edid-decode (hex):

00 ff ff ff ff ff ff 00 30 e4 65 06 00 00 00 00
00 1e 01 04 a5 1f 11 78 06 ad b5 a2 54 4c 9f 26
0c 50 54 00 00 00 01 01 01 01 01 01 01 01 01 01
01 01 01 01 01 01 2e 36 80 a0 70 38 1f 40 30 20
35 00 35 ae 10 00 00 1a 58 2b 80 a0 70 38 1f 40
30 20 35 00 35 ae 10 00 00 1a 00 00 00 fe 00 50
34 35 48 43 80 31 34 30 57 46 46 0a 00 00 00 00
00 02 41 31 9e 01 11 00 00 0a 01 0a 20 20 00 d2

00 ff ff ff ff ff ff 00 30 e4 65 06 00 00 00 00
00 1e 01 04 a5 1f 11 78 06 ad b5 a2 54 4c 9f 26
0c 50 54 00 00 00 01 01 01 01 01 01 01 01 01 01
01 01 01 01 01 01 2e 36 80 a0 70 38 1f 40 30 20
35 00 35 ae 10 00 00 1a 58 2b 80 a0 70 38 1f 40
30 20 35 00 35 ae 10 00 00 1a 00 00 00 fe 00 50
34 35 48 43 80 31 34 30 57 46 46 0a 00 00 00 00
00 02 41 31 9e 01 11 00 00 0a 01 0a 20 20 00 d2

----------------

Block 0, Base EDID:
  EDID Structure Version & Revision: 1.4
  Vendor & Product Identification:
    Manufacturer: LGD
    Model: 1637
    Made in: 2020
  Basic Display Parameters & Features:
    Digital display
    Bits per primary color channel: 8
    DisplayPort interface
    Maximum image size: 31 cm x 17 cm
    Gamma: 2.20
    Supported color formats: RGB 4:4:4
    Default (sRGB) color space is primary color space
    First detailed timing includes the native pixel format and preferred refresh rate
  Color Characteristics:
    Red  : 0.6347, 0.3300
    Green: 0.2998, 0.6220
    Blue : 0.1503, 0.0498
    White: 0.3134, 0.3291
  Established Timings I & II: none
  Standard Timings: none
  Detailed Timing Descriptors:
    DTD 1:  1920x1080   60.020425 Hz  16:9     66.683 kHz    138.700000 MHz (309 mm x 174 mm)
                 Hfront   48 Hsync  32 Hback   80 Hpol P
                 Vfront    3 Vsync   5 Vback   23 Vpol N
    DTD 2:  1920x1080   48.016340 Hz  16:9     53.346 kHz    110.960000 MHz (309 mm x 174 mm)
                 Hfront   48 Hsync  32 Hback   80 Hpol P
                 Vfront    3 Vsync   5 Vback   23 Vpol N
    Alphanumeric Data String: 'P45HC.140WFF'
    Manufacturer-Specified Display Descriptor (0x00): 00 00 00 02 41 31 9e 01 11 00 00 0a 01 0a 20 20 '....A1........  '
Checksum: 0xd2

----------------

Warnings:

Block 0, Base EDID:
  Alphanumeric Data String: Non-ASCII character 0x80 at position 5, can cause problems.
  Missing Display Product Name.

Failures:

Block 0, Base EDID:
  Basic Display Parameters & Features: sRGB is signaled, but the chromaticities do not match.
EDID:
  Extension Block 1 started with EDID header, ignoring Extension Blocks >= 1.

EDID conformity: FAIL
