edid-decode (hex):

00 ff ff ff ff ff ff 00 21 63 14 10 00 00 00 00
20 21 01 04 b5 36 1e 78 2a 6b e5 ad 54 45 ab 26
0e 50 54 04 43 00 81 bc 95 3c b3 3c d1 cf 01 01
01 01 01 01 01 01 2a 44 80 a0 70 38 27 40 30 20
35 00 1f 2e 21 00 00 1e 00 00 00 fd 00 4b b4 ca
ca 3c 01 0a 20 20 20 20 20 20 00 00 00 ff 00 30
30 30 30 30 30 30 30 30 30 30 30 31 00 00 00 fc
00 32 35 45 33 41 0a 20 20 20 20 20 20 20 01 ac

02 03 2a f3 41 bf 23 09 07 07 83 01 00 00 6d 1a
00 00 02 01 4b b4 00 00 00 00 00 00 e6 06 07 01
61 5d 01 e3 05 e3 01 e2 00 7f 28 83 80 a0 70 38
29 40 30 2c 35 00 1f 2e 21 00 00 1e 49 96 80 a0
70 38 29 40 30 2c 35 00 1f 2e 21 00 00 1e cb a0
80 78 70 38 29 40 30 2c 35 00 1f 2e 21 00 00 1e
00 00 00 00 00 00 00 00 00 00 00 00 00 00 00 00
00 00 00 00 00 00 00 00 00 00 00 00 00 00 00 00

00 ff ff ff ff ff ff 00 21 63 14 10 00 00 00 00
20 21 01 04 b5 36 1e 78 2a 6b e5 ad 54 45 ab 26
0e 50 54 04 43 00 81 bc 95 3c b3 3c d1 cf 01 01
01 01 01 01 01 01 2a 44 80 a0 70 38 27 40 30 20
35 00 1f 2e 21 00 00 1e 00 00 00 fd 00 4b b4 ca
ca 3c 01 0a 20 20 20 20 20 20 00 00 00 ff 00 30
30 30 30 30 30 30 30 30 30 30 30 31 00 00 00 fc
00 32 35 45 33 41 0a 20 20 20 20 20 20 20 01 ac

02 03 2a f3 41 bf 23 09 07 07 83 01 00 00 6d 1a
00 00 02 01 4b b4 00 00 00 00 00 00 e6 06 07 01
61 5d 01 e3 05 e3 01 e2 00 7f 28 83 80 a0 70 38
29 40 30 2c 35 00 1f 2e 21 00 00 1e 49 96 80 a0
70 38 29 40 30 2c 35 00 1f 2e 21 00 00 1e cb a0
80 78 70 38 29 40 30 2c 35 00 1f 2e 21 00 00 1e
00 00 00 00 00 00 00 00 00 00 00 00 00 00 00 00
00 00 00 00 00 00 00 00 00 00 00 00 00 00 00 00

----------------

Block 0, Base EDID:
  EDID Structure Version & Revision: 1.4
  Vendor & Product Identification:
    Manufacturer: HKC
    Model: 4116
    Made in: week 32 of 2023
  Basic Display Parameters & Features:
    Digital display
    Bits per primary color channel: 10
    DisplayPort interface
    Maximum image size: 54 cm x 30 cm
    Gamma: 2.20
    DPMS levels: Off
    Supported color formats: RGB 4:4:4, YCrCb 4:4:4
    First detailed timing includes the native pixel format and preferred refresh rate
  Color Characteristics:
    Red  : 0.6767, 0.3300
    Green: 0.2714, 0.6708
    Blue : 0.1513, 0.0566
    White: 0.3134, 0.3291
  Established Timings I & II:
    DMT 0x06:   640x480    75.000000 Hz   4:3     37.500 kHz     31.500000 MHz
    DMT 0x0b:   800x600    75.000000 Hz   4:3     46.875 kHz     49.500000 MHz
    DMT 0x12:  1024x768    75.028582 Hz   4:3     60.023 kHz     78.750000 MHz
    DMT 0x24:  1280x1024   75.024675 Hz   5:4     79.976 kHz    135.000000 MHz
  Standard Timings:
    GTF     :  1280x1024  120.000185 Hz   5:4    131.640 kHz    233.793000 MHz
    GTF     :  1440x900   119.999896 Hz  16:10   115.800 kHz    229.747000 MHz
    GTF     :  1680x1050  120.000000 Hz  16:10   135.000 kHz    313.200000 MHz
    GTF     :  1920x1080   75.000068 Hz  16:9     84.600 kHz    220.637000 MHz
  Detailed Timing Descriptors:
    DTD 1:  1920x1080   74.972503 Hz  16:9     83.894 kHz    174.500000 MHz (543 mm x 302 mm)
                 Hfront   48 Hsync  32 Hback   80 Hpol P
                 Vfront    3 Vsync   5 Vback   31 Vpol P
    Display Range Limits:
      Monitor ranges (Range Limits Only): 75-180 Hz V, 202-202 kHz H, max dotclock 600 MHz
    Display Product Serial Number: ...
    Display Product Name: '25E3A'
  Extension blocks: 1
Checksum: 0xac

----------------

Block 1, CTA-861 Extension Block:
  Revision: 3
  Underscans IT Video Formats by default
  Basic audio support
  Supports YCbCr 4:4:4
  Supports YCbCr 4:2:2
  Native DTDs: 3
  Video Data Block:
    VIC  63:  1920x1080  120.000000 Hz  16:9    135.000 kHz    297.000000 MHz (native)
  Audio Data Block:
    Linear PCM:
      Max channels: 2
      Supported sample rates (kHz): 48 44.1 32
      Supported sample sizes (bits): 24 20 16
  Speaker Allocation Data Block:
    FL/FR - Front Left/Right
  Vendor-Specific Data Block (AMD), OUI 00-00-1A:
    Version: 2
    Flags 1: 0x01
      FreeSync Supported
    Minimum Refresh Rate: 75 Hz
    Maximum Refresh Rate: 180 Hz
    Flags 5: 0x00
  HDR Static Metadata Data Block:
    Electro optical transfer functions:
      Traditional gamma - SDR luminance range
      Traditional gamma - HDR luminance range
      SMPTE ST2084
    Supported static metadata descriptors:
      Static metadata type 1
    Desired content max luminance: 97 (408.759 cd/m^2)
    Desired content max frame-average luminance: 93 (374.834 cd/m^2)
    Desired content min luminance: 1 (0.000 cd/m^2)
  Colorimetry Data Block:
    xvYCC601
    xvYCC709
    BT2020cYCC
    BT2020YCC
    BT2020RGB
    Gamut Boundary Description Metadata Profile P0
  Video Capability Data Block:
    YCbCr quantization: No Data
    RGB quantization: Selectable (via AVI Q)
    PT scan behavior: Supports both over- and underscan
    IT scan behavior: Supports both over- and underscan
    CE scan behavior: Supports both over- and underscan
  Detailed Timing Descriptors:
    DTD 2:  1920x1080  143.999177 Hz  16:9    161.423 kHz    335.760000 MHz (543 mm x 302 mm)
                 Hfront   48 Hsync  44 Hback   68 Hpol P
                 Vfront    3 Vsync   5 Vback   33 Vpol P
    DTD 3:  1920x1080  165.001201 Hz  16:9    184.966 kHz    384.730000 MHz (543 mm x 302 mm)
                 Hfront   48 Hsync  44 Hback   68 Hpol P
                 Vfront    3 Vsync   5 Vback   33 Vpol P
    DTD 4:  1920x1080  179.999475 Hz  16:9    201.779 kHz    411.630000 MHz (543 mm x 302 mm)
                 Hfront   48 Hsync  44 Hback   28 Hpol P
                 Vfront    3 Vsync   5 Vback   33 Vpol P
Checksum: 0x00  Unused space in Extension Block: 31 bytes

----------------

Warnings:

Block 0, Base EDID:
  Display Product Serial Number: ...
Block 1, CTA-861 Extension Block:
  Video Data Block: VIC 63 and the first DTD are not identical. Is this intended?
  Colorimetry Data Block: Set the sRGB colorimetry bit to avoid interop issues.
  Video Capability Data Block: Set Selectable YCbCr Quantization to avoid interop issues.
  Video Capability Data Block: S_PT is equal to S_IT and S_CE, so should be set to 0 instead.
EDID:
  Base EDID: Some timings are out of range of the Monitor Ranges:
    Horizontal Freq: 37.500 - 201.779 kHz (Monitor: 202.000 - 202.000 kHz)

Failures:

Block 1, CTA-861 Extension Block:
  Required 640x480p60 timings are missing in the established timings and the SVD list (VIC 1).
EDID:
  Extension Block 2 started with EDID header, ignoring Extension Blocks >= 2.

EDID conformity: FAIL
