edid-decode (hex):

00 ff ff ff ff ff ff 00 10 ac 02 a0 47 30 30 31
16 0c 01 03 0e 29 1f 96 eb 4c 40 a1 57 4c 97 26
1c 50 54 a5 4b 00 81 80 a9 40 71 4f 01 01 01 01
01 01 01 01 01 01 48 3f 40 30 62 b0 32 40 40 c0
13 00 6f 13 11 00 00 1e 00 00 00 ff 00 39 45 32
34 39 32 35 54 31 30 30 47 30 00 00 00 fc 00 44
45 4c 4c 20 32 30 30 30 46 50 0a 20 00 00 00 fd
00 38 4c 1f 50 10 00 0a 20 20 20 20 20 20 00 3b

00 ff ff ff ff ff ff 00 10 ac 02 a0 47 30 30 31
16 0c 01 03 0e 29 1f 96 eb 4c 40 a1 57 4c 97 26
1c 50 54 a5 4b 00 81 80 a9 40 71 4f 01 01 01 01
01 01 01 01 01 01 48 3f 40 30 62 b0 32 40 40 c0
13 00 6f 13 11 00 00 1e 00 00 00 ff 00 39 45 32
34 39 32 35 54 31 30 30 47 30 00 00 00 fc 00 44
45 4c 4c 20 32 30 30 30 46 50 0a 20 00 00 00 fd
00 38 4c 1f 50 10 00 0a 20 20 20 20 20 20 00 3b

----------------

Block 0, Base EDID:
  EDID Structure Version & Revision: 1.3
  Vendor & Product Identification:
    Manufacturer: DEL
    Model: 40962
    Serial Number: ...
    Made in: week 22 of 2002
  Basic Display Parameters & Features:
    Analog display
    Signal Level Standard: 0.700 : 0.300 : 1.000 V p-p
    Blank level equals black level
    Sync: Separate Composite SyncOnGreen
    Maximum image size: 41 cm x 31 cm
    Gamma: 2.50
    DPMS levels: Standby Suspend Off
    RGB color display
    First detailed timing is the preferred timing
    Supports GTF timings within operating range
  Color Characteristics:
    Red  : 0.6298, 0.3398
    Green: 0.2998, 0.5898
    Blue : 0.1494, 0.1093
    White: 0.3125, 0.3281
  Established Timings I & II:
    IBM     :   720x400    70.081663 Hz   9:5     31.467 kHz     28.320000 MHz
    DMT 0x04:   640x480    59.940476 Hz   4:3     31.469 kHz     25.175000 MHz
    DMT 0x06:   640x480    75.000000 Hz   4:3     37.500 kHz     31.500000 MHz
    DMT 0x09:   800x600    60.316541 Hz   4:3     37.879 kHz     40.000000 MHz
    DMT 0x0b:   800x600    75.000000 Hz   4:3     46.875 kHz     49.500000 MHz
    DMT 0x10:  1024x768    60.003840 Hz   4:3     48.363 kHz     65.000000 MHz
    DMT 0x12:  1024x768    75.028582 Hz   4:3     60.023 kHz     78.750000 MHz
    DMT 0x24:  1280x1024   75.024675 Hz   5:4     79.976 kHz    135.000000 MHz
  Standard Timings:
    DMT 0x23:  1280x1024   60.019740 Hz   5:4     63.981 kHz    108.000000 MHz
    DMT 0x33:  1600x1200   60.000000 Hz   4:3     75.000 kHz    162.000000 MHz
    DMT 0x15:  1152x864    75.000000 Hz   4:3     67.500 kHz    108.000000 MHz
  Detailed Timing Descriptors:
    DTD 1:  1600x1200   60.000000 Hz   4:3     75.000 kHz    162.000000 MHz (367 mm x 275 mm)
                 Hfront   64 Hsync 192 Hback  304 Hpol P
                 Vfront    1 Vsync   3 Vback   46 Vpol P
    Display Product Serial Number: ...
    Display Product Name: 'DELL 2000FP'
    Display Range Limits:
      Monitor ranges (GTF): 56-76 Hz V, 31-80 kHz H, max dotclock 160 MHz
Checksum: 0x3b

----------------

Warnings:

EDID:
  Base EDID: Some timings are out of range of the Monitor Ranges:
    Maximum Clock: 162.000 MHz (Monitor: 160.000 MHz)
    Could be due to a Monitor Range off-by-one rounding issue

Failures:

Block 0, Base EDID:
  Detailed Timing Descriptor #1: Mismatch of image size 367x275 mm vs display size 410x310 mm.
EDID:
  Extension Block 1 started with EDID header, ignoring Extension Blocks >= 1.

EDID conformity: FAIL
