edid-decode (hex):

00 ff ff ff ff ff ff 00 21 94 3b 2a 01 01 01 01
1e 13 01 03 a3 3d 00 78 ef ee 91 a3 54 4c 99 26
0f 50 54 00 00 00 d1 00 a9 c0 d1 c0 95 00 81 40
81 80 90 40 a9 40 28 3c 80 a0 70 b0 23 40 30 20
36 00 d8 87 00 00 00 1e 00 00 00 fd 00 28 55 0a
6e 15 ff 0a 20 20 20 20 20 20 00 00 00 fc 00 57
61 76 65 53 68 61 72 65 0a 20 20 20 00 00 00 ff
00 30 31 30 30 39 32 33 0a 20 20 20 20 20 01 8e

02 03 1a 74 47 4c 00 00 00 00 00 00 23 09 07 01
83 01 00 00 65 03 0c 00 10 00 28 3c 80 a0 70 b0
23 40 30 20 36 00 d8 87 00 00 00 1e 00 00 00 00
00 00 00 00 00 00 00 00 00 00 00 00 00 00 00 00
00 00 00 00 00 00 00 00 00 00 00 00 00 00 00 00
00 00 00 00 00 00 00 00 00 00 00 00 00 00 00 00
00 00 00 00 00 00 00 00 00 00 00 00 00 00 00 00
00 00 00 00 00 00 00 00 00 00 00 00 00 00 00 94

00 ff ff ff ff ff ff 00 21 94 3b 2a 01 01 01 01
1e 13 01 03 a3 3d 00 78 ef ee 91 a3 54 4c 99 26
0f 50 54 00 00 00 d1 00 a9 c0 d1 c0 95 00 81 40
81 80 90 40 a9 40 28 3c 80 a0 70 b0 23 40 30 20
36 00 d8 87 00 00 00 1e 00 00 00 fd 00 28 55 0a
6e 15 ff 0a 20 20 20 20 20 20 00 00 00 fc 00 57
61 76 65 53 68 61 72 65 0a 20 20 20 00 00 00 ff
00 30 31 30 30 39 32 33 0a 20 20 20 20 20 01 8e

02 03 1a 74 47 4c 00 00 00 00 00 00 23 09 07 01
83 01 00 00 65 03 0c 00 10 00 28 3c 80 a0 70 b0
23 40 30 20 36 00 d8 87 00 00 00 1e 00 00 00 00
00 00 00 00 00 00 00 00 00 00 00 00 00 00 00 00
00 00 00 00 00 00 00 00 00 00 00 00 00 00 00 00
00 00 00 00 00 00 00 00 00 00 00 00 00 00 00 00
00 00 00 00 00 00 00 00 00 00 00 00 00 00 00 00
00 00 00 00 00 00 00 00 00 00 00 00 00 00 00 94

----------------

Block 0, Base EDID:
  EDID Structure Version & Revision: 1.3
  Vendor & Product Identification:
    Manufacturer: HLT
    Model: 10811
    Serial Number: ...
    Made in: week 30 of 2009
  Basic Display Parameters & Features:
    Digital display
    DFP 1.x compatible TMDS
    Image size is variable
    Gamma: 2.20
    DPMS levels: Standby Suspend Off
    RGB color display
    Default (sRGB) color space is primary color space
    First detailed timing is the preferred timing
    Supports GTF timings within operating range
  Color Characteristics:
    Red  : 0.6396, 0.3300
    Green: 0.2998, 0.5996
    Blue : 0.1503, 0.0595
    White: 0.3125, 0.3291
  Established Timings I & II: none
  Standard Timings:
    DMT 0x45:  1920x1200   59.884600 Hz  16:10    74.556 kHz    193.250000 MHz
    DMT 0x53:  1600x900    60.000000 Hz  16:9     60.000 kHz    108.000000 MHz (RB)
    DMT 0x52:  1920x1080   60.000000 Hz  16:9     67.500 kHz    148.500000 MHz
    DMT 0x2f:  1440x900    59.887445 Hz  16:10    55.935 kHz    106.500000 MHz
    DMT 0x20:  1280x960    60.000000 Hz   4:3     60.000 kHz    108.000000 MHz
    DMT 0x23:  1280x1024   60.019740 Hz   5:4     63.981 kHz    108.000000 MHz
    DMT 0x2a:  1400x1050   59.978442 Hz   4:3     65.317 kHz    121.750000 MHz
    DMT 0x33:  1600x1200   60.000000 Hz   4:3     75.000 kHz    162.000000 MHz
  Detailed Timing Descriptors:
    DTD 1:  1920x1200   59.950171 Hz  16:10    74.038 kHz    154.000000 MHz (216 mm x 135 mm)
                 Hfront   48 Hsync  32 Hback   80 Hpol P
                 Vfront    3 Vsync   6 Vback   26 Vpol P
    Display Range Limits:
      Monitor ranges (Unknown (0xff)): 40-85 Hz V, 10-110 kHz H, max dotclock 210 MHz
    Display Product Name: 'WaveShare'
    Display Product Serial Number: ...
  Extension blocks: 1
Checksum: 0x8e

----------------

Block 1, CTA-861 Extension Block:
  Revision: 3
  Basic audio support
  Supports YCbCr 4:4:4
  Supports YCbCr 4:2:2
  Native detailed modes: 4
  Video Data Block:
    VIC  76:  1920x1080   60.000000 Hz  64:27    67.500 kHz    148.500000 MHz
  Audio Data Block:
    Linear PCM:
      Max channels: 2
      Supported sample rates (kHz): 48 44.1 32
      Supported sample sizes (bits): 16
  Speaker Allocation Data Block:
    FL/FR - Front Left/Right
  Vendor-Specific Data Block (HDMI), OUI 00-0C-03:
    Source physical address: 1.0.0.0
  Detailed Timing Descriptors:
    DTD 2:  1920x1200   59.950171 Hz  16:10    74.038 kHz    154.000000 MHz (216 mm x 135 mm)
                 Hfront   48 Hsync  32 Hback   80 Hpol P
                 Vfront    3 Vsync   6 Vback   26 Vpol P
Checksum: 0x94  Unused space in Extension Block: 83 bytes

----------------

Block 2, Unknown EDID Extension Block 0x00:
  00 ff ff ff ff ff ff 00 21 94 3b 2a 01 01 01 01 '........!.;*....'
  1e 13 01 03 a3 3d 00 78 ef ee 91 a3 54 4c 99 26 '.....=.x....TL.&'
  0f 50 54 00 00 00 d1 00 a9 c0 d1 c0 95 00 81 40 '.PT............@'
  81 80 90 40 a9 40 28 3c 80 a0 70 b0 23 40 30 20 '...@.@(<..p.#@0 '
  36 00 d8 87 00 00 00 1e 00 00 00 fd 00 28 55 0a '6............(U.'
  6e 15 ff 0a 20 20 20 20 20 20 00 00 00 fc 00 57 'n...      .....W'
  61 76 65 53 68 61 72 65 0a 20 20 20 00 00 00 ff 'aveShare.   ....'
  00 30 31 30 30 39 32 33 0a 20 20 20 20 20 01 8e '.0100923.     ..'
Checksum: 0x8e

----------------

Block 3, CTA-861 Extension Block:
  Revision: 3
  Basic audio support
  Supports YCbCr 4:4:4
  Supports YCbCr 4:2:2
  Native detailed modes: 4
  Video Data Block:
    VIC  76:  1920x1080   60.000000 Hz  64:27    67.500 kHz    148.500000 MHz
  Audio Data Block:
    Linear PCM:
      Max channels: 2
      Supported sample rates (kHz): 48 44.1 32
      Supported sample sizes (bits): 16
  Speaker Allocation Data Block:
    FL/FR - Front Left/Right
  Vendor-Specific Data Block (HDMI), OUI 00-0C-03:
    Source physical address: 1.0.0.0
  Detailed Timing Descriptors:
    DTD 3:  1920x1200   59.950171 Hz  16:10    74.038 kHz    154.000000 MHz (216 mm x 135 mm)
                 Hfront   48 Hsync  32 Hback   80 Hpol P
                 Vfront    3 Vsync   6 Vback   26 Vpol P
Checksum: 0x94  Unused space in Extension Block: 83 bytes

----------------

Warnings:

Block 0, Base EDID:
  Vendor & Product Identification: The serial number is one of the known dummy values, it should probably be set to 0.
  Detailed Timing Descriptor #1: DTD is similar but not identical to DMT 0x44.
Block 1, CTA-861 Extension Block:
  IT Video Formats are overscanned by default, but normally this should be underscanned.
  Video Data Block: VIC 76 and the first DTD are not identical. Is this intended?
  Detailed Timing Descriptor #2: DTD is similar but not identical to DMT 0x44.
  Display Product Serial Number is set, so the Serial Number in the Base EDID should be 0.
Block 3, CTA-861 Extension Block:
  IT Video Formats are overscanned by default, but normally this should be underscanned.
  Detailed Timing Descriptor #3: DTD is similar but not identical to DMT 0x44.
EDID:
  CTA-861: Multiple native progressive timings are defined.

Failures:

Block 0, Base EDID:
  Basic Display Parameters & Features: Digital Video Interface Standard set to reserved value 0x22.
  Display Range Limits: Unknown range class (0xff).
Block 1, CTA-861 Extension Block:
  There are more Native DTDs (4) than DTDs (3).
  Required 640x480p60 timings are missing in the established timings and the SVD list (VIC 1).
  Missing VCDB, needed for Set Selectable RGB Quantization to avoid interop issues.
Block 2, Base EDID:
  Unknown Extension Block.
Block 3, CTA-861 Extension Block:
  Video Data Block: Duplicate VIC 76.
  Speaker Allocation Data Block: Only one instance of this Data Block is allowed.
EDID:
  Base EDID: The DTD max image size is 216x135mm, but the display size is not specified anywhere.
  Base EDID: EDID specified 1 extension block(s), but found 3 extension block(s).
  Base EDID: EDID 1.3 requires a Block Map Extension in Block 1 if there are more than 2 blocks in the EDID.

EDID conformity: FAIL
