edid-decode (hex):

00 ff ff ff ff ff ff 00 06 b3 32 49 b5 69 0f 00
23 20 01 04 b5 77 22 78 3b f5 c0 ab 50 47 a5 26
10 50 54 bf cf 00 81 40 81 80 95 00 71 4f 81 c0
b3 00 d1 c0 01 01 1a 68 00 a0 f0 38 1f 40 30 20
3a 00 a8 4f 41 00 00 1a 00 00 00 fd 0c 30 a5 05
05 8c 01 0a 20 20 20 20 20 20 00 00 00 fc 00 58
47 34 39 57 43 52 0a 20 20 20 20 20 00 00 00 ff
00 52 36 4c 4d 54 46 30 30 36 30 39 31 0a 02 62

02 03 44 f1 5b 01 03 02 12 11 13 04 0f 8e 1e 1f
10 3f 40 75 76 60 05 07 14 16 20 21 22 5d 5e 5f
23 09 07 07 83 01 00 00 6d 1a 00 00 02 03 30 a5
00 05 6c 2d 6c 2d e3 05 c0 00 e6 06 05 01 6c 6c
23 e2 00 ea 56 5e 00 a0 a0 a0 29 50 30 20 35 00
a8 4f 41 00 00 1e e7 7c 70 a0 d0 a0 29 50 30 20
3a 00 a8 4f 41 00 00 1a 6f c2 00 a0 a0 a0 55 50
30 20 35 00 a8 4f 41 00 00 1e 00 00 00 00 00 5c

70 12 79 03 00 03 01 64 45 07 02 08 ff 13 3f 01
2f 80 1f 00 9f 05 28 00 02 00 09 00 57 79 01 08
ff 13 9f 00 2f 80 1f 00 9f 05 54 00 02 00 09 00
17 e5 00 08 ff 13 9f 00 2f 80 1f 00 9f 05 28 00
02 00 09 00 33 ca 01 08 ff 13 9f 00 2f 80 1f 00
9f 05 66 00 02 00 09 00 33 b7 00 88 ff 13 9f 00
2f 80 1f 00 9f 05 28 00 02 00 09 00 00 00 00 00
00 00 00 00 00 00 00 00 00 00 00 00 00 00 a6 90

00 ff ff ff ff ff ff 00 06 b3 32 49 b5 69 0f 00
23 20 01 04 b5 77 22 78 3b f5 c0 ab 50 47 a5 26
10 50 54 bf cf 00 81 40 81 80 95 00 71 4f 81 c0
b3 00 d1 c0 01 01 1a 68 00 a0 f0 38 1f 40 30 20
3a 00 a8 4f 41 00 00 1a 00 00 00 fd 0c 30 a5 05
05 8c 01 0a 20 20 20 20 20 20 00 00 00 fc 00 58
47 34 39 57 43 52 0a 20 20 20 20 20 00 00 00 ff
00 52 36 4c 4d 54 46 30 30 36 30 39 31 0a 02 62

02 03 44 f1 5b 01 03 02 12 11 13 04 0f 8e 1e 1f
10 3f 40 75 76 60 05 07 14 16 20 21 22 5d 5e 5f
23 09 07 07 83 01 00 00 6d 1a 00 00 02 03 30 a5
00 05 6c 2d 6c 2d e3 05 c0 00 e6 06 05 01 6c 6c
23 e2 00 ea 56 5e 00 a0 a0 a0 29 50 30 20 35 00
a8 4f 41 00 00 1e e7 7c 70 a0 d0 a0 29 50 30 20
3a 00 a8 4f 41 00 00 1a 6f c2 00 a0 a0 a0 55 50
30 20 35 00 a8 4f 41 00 00 1e 00 00 00 00 00 5c

70 12 79 03 00 03 01 64 45 07 02 08 ff 13 3f 01
2f 80 1f 00 9f 05 28 00 02 00 09 00 57 79 01 08
ff 13 9f 00 2f 80 1f 00 9f 05 54 00 02 00 09 00
17 e5 00 08 ff 13 9f 00 2f 80 1f 00 9f 05 28 00
02 00 09 00 33 ca 01 08 ff 13 9f 00 2f 80 1f 00
9f 05 66 00 02 00 09 00 33 b7 00 88 ff 13 9f 00
2f 80 1f 00 9f 05 28 00 02 00 09 00 00 00 00 00
00 00 00 00 00 00 00 00 00 00 00 00 00 00 a6 90

----------------

Block 0, Base EDID:
  EDID Structure Version & Revision: 1.4
  Vendor & Product Identification:
    Manufacturer: AUS
    Model: 18738
    Serial Number: ...
    Made in: week 35 of 2022
  Basic Display Parameters & Features:
    Digital display
    Bits per primary color channel: 10
    DisplayPort interface
    Maximum image size: 119 cm x 34 cm
    Gamma: 2.20
    DPMS levels: Off
    Supported color formats: RGB 4:4:4, YCrCb 4:4:4, YCrCb 4:2:2
    First detailed timing includes the native pixel format and preferred refresh rate
    Display supports continuous frequencies
  Color Characteristics:
    Red  : 0.6708, 0.3154
    Green: 0.2783, 0.6455
    Blue : 0.1513, 0.0625
    White: 0.3125, 0.3281
  Established Timings I & II:
    IBM     :   720x400    70.081663 Hz   9:5     31.467 kHz     28.320000 MHz
    DMT 0x04:   640x480    59.940476 Hz   4:3     31.469 kHz     25.175000 MHz
    Apple   :   640x480    66.666667 Hz   4:3     35.000 kHz     30.240000 MHz
    DMT 0x05:   640x480    72.808802 Hz   4:3     37.861 kHz     31.500000 MHz
    DMT 0x06:   640x480    75.000000 Hz   4:3     37.500 kHz     31.500000 MHz
    DMT 0x08:   800x600    56.250000 Hz   4:3     35.156 kHz     36.000000 MHz
    DMT 0x09:   800x600    60.316541 Hz   4:3     37.879 kHz     40.000000 MHz
    DMT 0x0a:   800x600    72.187572 Hz   4:3     48.077 kHz     50.000000 MHz
    DMT 0x0b:   800x600    75.000000 Hz   4:3     46.875 kHz     49.500000 MHz
    DMT 0x10:  1024x768    60.003840 Hz   4:3     48.363 kHz     65.000000 MHz
    DMT 0x11:  1024x768    70.069359 Hz   4:3     56.476 kHz     75.000000 MHz
    DMT 0x12:  1024x768    75.028582 Hz   4:3     60.023 kHz     78.750000 MHz
    DMT 0x24:  1280x1024   75.024675 Hz   5:4     79.976 kHz    135.000000 MHz
  Standard Timings:
    DMT 0x20:  1280x960    60.000000 Hz   4:3     60.000 kHz    108.000000 MHz
    DMT 0x23:  1280x1024   60.019740 Hz   5:4     63.981 kHz    108.000000 MHz
    DMT 0x2f:  1440x900    59.887445 Hz  16:10    55.935 kHz    106.500000 MHz
    DMT 0x15:  1152x864    75.000000 Hz   4:3     67.500 kHz    108.000000 MHz
    DMT 0x55:  1280x720    60.000000 Hz  16:9     45.000 kHz     74.250000 MHz
    DMT 0x3a:  1680x1050   59.954250 Hz  16:10    65.290 kHz    146.250000 MHz
    DMT 0x52:  1920x1080   60.000000 Hz  16:9     67.500 kHz    148.500000 MHz
  Detailed Timing Descriptors:
    DTD 1:  3840x1080   59.968497 Hz  32:9     66.625 kHz    266.500000 MHz (1192 mm x 335 mm)
                 Hfront   48 Hsync  32 Hback   80 Hpol P
                 Vfront    3 Vsync  10 Vback   18 Vpol N
    Display Range Limits:
      Monitor ranges (Range Limits Only): 48-165 Hz V, 260-260 kHz H, max dotclock 1400 MHz
    Display Product Name: 'XG49WCR'
    Display Product Serial Number: ...
  Extension blocks: 2
Checksum: 0x62

----------------

Block 1, CTA-861 Extension Block:
  Revision: 3
  Underscans IT Video Formats by default
  Basic audio support
  Supports YCbCr 4:4:4
  Supports YCbCr 4:2:2
  Native DTDs: 1
  Video Data Block:
    VIC   1:   640x480    59.940476 Hz   4:3     31.469 kHz     25.175000 MHz
    VIC   3:   720x480    59.940060 Hz  16:9     31.469 kHz     27.000000 MHz
    VIC   2:   720x480    59.940060 Hz   4:3     31.469 kHz     27.000000 MHz
    VIC  18:   720x576    50.000000 Hz  16:9     31.250 kHz     27.000000 MHz
    VIC  17:   720x576    50.000000 Hz   4:3     31.250 kHz     27.000000 MHz
    VIC  19:  1280x720    50.000000 Hz  16:9     37.500 kHz     74.250000 MHz
    VIC   4:  1280x720    60.000000 Hz  16:9     45.000 kHz     74.250000 MHz
    VIC  15:  1440x480    59.940060 Hz  16:9     31.469 kHz     54.000000 MHz
    VIC  14:  1440x480    59.940060 Hz   4:3     31.469 kHz     54.000000 MHz (native)
    VIC  30:  1440x576    50.000000 Hz  16:9     31.250 kHz     54.000000 MHz
    VIC  31:  1920x1080   50.000000 Hz  16:9     56.250 kHz    148.500000 MHz
    VIC  16:  1920x1080   60.000000 Hz  16:9     67.500 kHz    148.500000 MHz
    VIC  63:  1920x1080  120.000000 Hz  16:9    135.000 kHz    297.000000 MHz
    VIC  64:  1920x1080  100.000000 Hz  16:9    112.500 kHz    297.000000 MHz
    VIC 117:  3840x2160  100.000000 Hz  16:9    225.000 kHz   1188.000000 MHz
    VIC 118:  3840x2160  120.000000 Hz  16:9    270.000 kHz   1188.000000 MHz
    VIC  96:  3840x2160   50.000000 Hz  16:9    112.500 kHz    594.000000 MHz
    VIC   5:  1920x1080i  60.000000 Hz  16:9     33.750 kHz     74.250000 MHz
    VIC   7:  1440x480i   59.940060 Hz  16:9     15.734 kHz     27.000000 MHz
    VIC  20:  1920x1080i  50.000000 Hz  16:9     28.125 kHz     74.250000 MHz
    VIC  22:  1440x576i   50.000000 Hz  16:9     15.625 kHz     27.000000 MHz
    VIC  32:  1920x1080   24.000000 Hz  16:9     27.000 kHz     74.250000 MHz
    VIC  33:  1920x1080   25.000000 Hz  16:9     28.125 kHz     74.250000 MHz
    VIC  34:  1920x1080   30.000000 Hz  16:9     33.750 kHz     74.250000 MHz
    VIC  93:  3840x2160   24.000000 Hz  16:9     54.000 kHz    297.000000 MHz
    VIC  94:  3840x2160   25.000000 Hz  16:9     56.250 kHz    297.000000 MHz
    VIC  95:  3840x2160   30.000000 Hz  16:9     67.500 kHz    297.000000 MHz
  Audio Data Block:
    Linear PCM:
      Max channels: 2
      Supported sample rates (kHz): 48 44.1 32
      Supported sample sizes (bits): 24 20 16
  Speaker Allocation Data Block:
    FL/FR - Front Left/Right
  Vendor-Specific Data Block (AMD), OUI 00-00-1A:
    Version: 2
    Feature Caps: 0x03
    Minimum Refresh Rate: 48 Hz
    Maximum Refresh Rate: 165 Hz
    Flags 1.x: 0x00
    Flags 2.x: 0x05
      ST 2084 (PQ) EOTF Supported
      Linear EOTF (Windows scRGB, 0.0 - 125.0) Supported
      Gamma 2.2 EOTF Supported
      BT.2020 Gamut Supported
    Maximum luminance: 108 (518.736 cd/m^2)
    Minimum luminance: 45 (0.162 cd/m^2)
  Colorimetry Data Block:
    BT2020YCC
    BT2020RGB
  HDR Static Metadata Data Block:
    Electro optical transfer functions:
      Traditional gamma - SDR luminance range
      SMPTE ST2084
    Supported static metadata descriptors:
      Static metadata type 1
    Desired content max luminance: 108 (518.736 cd/m^2)
    Desired content max frame-average luminance: 108 (518.736 cd/m^2)
    Desired content min luminance: 35 (0.098 cd/m^2)
  Video Capability Data Block:
    YCbCr quantization: Selectable (via AVI YQ)
    RGB quantization: Selectable (via AVI Q)
    PT scan behavior: Always Underscanned
    IT scan behavior: Always Underscanned
    CE scan behavior: Always Underscanned
  Detailed Timing Descriptors:
    DTD 2:  2560x1440   59.950550 Hz  16:9     88.787 kHz    241.500000 MHz (1192 mm x 335 mm)
                 Hfront   48 Hsync  32 Hback   80 Hpol P
                 Vfront    3 Vsync   5 Vback   33 Vpol P
    DTD 3:  3440x1440   59.972616 Hz  43:18    88.819 kHz    319.750000 MHz (1192 mm x 335 mm)
                 Hfront   48 Hsync  32 Hback   80 Hpol P
                 Vfront    3 Vsync  10 Vback   28 Vpol N
    DTD 4:  2560x1440  119.997589 Hz  16:9    182.996 kHz    497.750000 MHz (1192 mm x 335 mm)
                 Hfront   48 Hsync  32 Hback   80 Hpol P
                 Vfront    3 Vsync   5 Vback   77 Vpol P
Checksum: 0x5c  Unused space in Extension Block: 5 bytes

----------------

Block 2, DisplayID Extension Block:
  Version: 1.2
  Extension Count: 0
  Display Product Type: Standalone display device
  Video Timing Modes Type 1 - Detailed Timings Data Block:
    DTD:  5120x1440  164.999305 Hz   0:0    244.364 kHz   1329.340000 MHz (aspect undefined, no 3D stereo)
               Hfront   48 Hsync  32 Hback  240 Hpol P
               Vfront    3 Vsync  10 Vback   28 Vpol N
    DTD:  5120x1440  119.970194 Hz   0:0    182.955 kHz    966.000000 MHz (aspect undefined, no 3D stereo)
               Hfront   48 Hsync  32 Hback   80 Hpol P
               Vfront    3 Vsync  10 Vback   72 Vpol N
    DTD:  5120x1440   75.000512 Hz   0:0    111.076 kHz    586.480000 MHz (aspect undefined, no 3D stereo)
               Hfront   48 Hsync  32 Hback   80 Hpol P
               Vfront    3 Vsync  10 Vback   28 Vpol N
    DTD:  5120x1440  143.978672 Hz   0:0    222.159 kHz   1173.000000 MHz (aspect undefined, no 3D stereo)
               Hfront   48 Hsync  32 Hback   80 Hpol P
               Vfront    3 Vsync  10 Vback   90 Vpol N
    DTD:  5120x1440   59.976879 Hz   0:0     88.826 kHz    469.000000 MHz (aspect undefined, no 3D stereo, preferred)
               Hfront   48 Hsync  32 Hback   80 Hpol P
               Vfront    3 Vsync  10 Vback   28 Vpol N
  Checksum: 0xa6
Checksum: 0x90

----------------

Warnings:

Block 0, Base EDID:
  Vendor & Product Identification: The serial number is one of the known dummy values, it should probably be set to 0.
Block 1, CTA-861 Extension Block:
  Video Data Block: VIC 1 and the first DTD are not identical. Is this intended?
  Colorimetry Data Block: Set the sRGB colorimetry bit to avoid interop issues.
  Video Capability Data Block: S_PT is equal to S_IT and S_CE, so should be set to 0 instead.
  Detailed Timing Descriptor #2: Image size is 1192x335 mm, but based on the picture AR it should be 595x335 mm.
  Detailed Timing Descriptor #3: Image size is 1192x335 mm, but based on the picture AR it should be 800x335 mm.
  Detailed Timing Descriptor #4: Image size is 1192x335 mm, but based on the picture AR it should be 595x335 mm.
  Display Product Serial Number is set, so the Serial Number in the Base EDID should be 0.
EDID:
  Base EDID: Some timings are out of range of the Monitor Ranges:
    Vertical Freq: 24.000 - 164.999 Hz (Monitor: 48.000 - 165.000 Hz)
    Horizontal Freq: 15.625 - 270.000 kHz (Monitor: 260.000 - 260.000 kHz)

Failures:

EDID:
  Extension Block 3 started with EDID header, ignoring Extension Blocks >= 3.
  CTA-861: Native progressive timings are a mix of several resolutions.
  DisplayID: Missing DisplayID Display Parameters Data Block.

EDID conformity: FAIL
