edid-decode (hex):

00 ff ff ff ff ff ff 00 5a 64 00 00 00 00 00 00
1e 1b 01 03 80 40 20 78 1a ee 91 a3 54 4c 99 26
0f 50 54 ad cf 00 d1 c0 b3 00 a9 40 a9 c0 95 00
90 40 71 40 81 40 84 21 56 a8 51 00 1f 30 46 8f
33 00 59 03 11 00 00 1e 66 21 50 b0 51 00 1b 30
40 70 36 00 a0 5a 00 00 00 1e c4 1b 00 a0 50 20
17 30 55 23 36 00 80 f0 10 00 00 18 00 00 00 fc
00 48 44 4d 49 0a 20 20 20 20 20 20 20 20 01 e0

02 03 1f f1 4b 03 04 05 90 12 13 14 1f 20 21 22
23 09 07 07 83 01 00 00 66 03 0c 00 10 00 80 01
1d 00 72 51 d0 1e 20 6e 28 55 00 a0 5a 00 00 00
1e 0e 1f 00 80 51 00 1e 30 40 80 37 00 80 e6 10
00 00 1e d4 17 00 60 51 58 18 20 30 80 3a 00 80
b4 10 00 00 1e 00 00 00 10 00 58 18 20 30 80 3a
00 80 b4 10 00 00 1e 8c 0a d0 8a 20 e0 2d 10 10
3e 96 00 c4 8e 21 00 00 18 00 00 00 00 00 00 bd

----------------

Block 0, Base EDID:
  EDID Structure Version & Revision: 1.3
  Vendor & Product Identification:
    Manufacturer: VSD
    Model: 0
    Made in: week 30 of 2017
  Basic Display Parameters & Features:
    Digital display
    Maximum image size: 64 cm x 32 cm
    Gamma: 2.20
    Undefined display color type
    First detailed timing is the preferred timing
  Color Characteristics:
    Red  : 0.6396, 0.3300
    Green: 0.2998, 0.5996
    Blue : 0.1503, 0.0595
    White: 0.3125, 0.3291
  Established Timings I & II:
    IBM     :   720x400    70.081663 Hz   9:5     31.467 kHz     28.320000 MHz
    DMT 0x04:   640x480    59.940476 Hz   4:3     31.469 kHz     25.175000 MHz
    DMT 0x05:   640x480    72.808802 Hz   4:3     37.861 kHz     31.500000 MHz
    DMT 0x06:   640x480    75.000000 Hz   4:3     37.500 kHz     31.500000 MHz
    DMT 0x09:   800x600    60.316541 Hz   4:3     37.879 kHz     40.000000 MHz
    DMT 0x0a:   800x600    72.187572 Hz   4:3     48.077 kHz     50.000000 MHz
    DMT 0x0b:   800x600    75.000000 Hz   4:3     46.875 kHz     49.500000 MHz
    DMT 0x10:  1024x768    60.003840 Hz   4:3     48.363 kHz     65.000000 MHz
    DMT 0x11:  1024x768    70.069359 Hz   4:3     56.476 kHz     75.000000 MHz
    DMT 0x12:  1024x768    75.028582 Hz   4:3     60.023 kHz     78.750000 MHz
    DMT 0x24:  1280x1024   75.024675 Hz   5:4     79.976 kHz    135.000000 MHz
  Standard Timings:
    DMT 0x52:  1920x1080   60.000000 Hz  16:9     67.500 kHz    148.500000 MHz
    DMT 0x3a:  1680x1050   59.954250 Hz  16:10    65.290 kHz    146.250000 MHz
    DMT 0x33:  1600x1200   60.000000 Hz   4:3     75.000 kHz    162.000000 MHz
    DMT 0x53:  1600x900    60.000000 Hz  16:9     60.000 kHz    108.000000 MHz (RB)
    DMT 0x2f:  1440x900    59.887445 Hz  16:10    55.935 kHz    106.500000 MHz
    DMT 0x2a:  1400x1050   59.978442 Hz   4:3     65.317 kHz    121.750000 MHz
    GTF     :  1152x864    60.000000 Hz   4:3     53.700 kHz     81.624000 MHz
    DMT 0x20:  1280x960    60.000000 Hz   4:3     60.000 kHz    108.000000 MHz
  Detailed Timing Descriptors:
    DTD 1:  1366x768    59.991190 Hz 683:384   47.933 kHz     85.800000 MHz (345 mm x 259 mm)
                 Hfront   70 Hsync 143 Hback  211 Hpol P
                 Vfront    3 Vsync   3 Vback   25 Vpol P
    DTD 2:  1360x768    60.015162 Hz  85:48    47.712 kHz     85.500000 MHz (160 mm x 90 mm)
                 Hfront   64 Hsync 112 Hback  256 Hpol P
                 Vfront    3 Vsync   6 Vback   18 Vpol P
    DTD 3:  1280x800    59.977049 Hz  16:10    49.361 kHz     71.080000 MHz (384 mm x 240 mm)
                 Hfront   85 Hsync  35 Hback   40 Hpol N
                 Vfront    3 Vsync   6 Vback   14 Vpol N
    Display Product Name: 'HDMI'
  Extension blocks: 1
Checksum: 0xe0

----------------

Block 1, CTA-861 Extension Block:
  Revision: 3
  Underscans IT Video Formats by default
  Basic audio support
  Supports YCbCr 4:4:4
  Supports YCbCr 4:2:2
  Native detailed modes: 1
  Video Data Block:
    VIC   3:   720x480    59.940060 Hz  16:9     31.469 kHz     27.000000 MHz
    VIC   4:  1280x720    60.000000 Hz  16:9     45.000 kHz     74.250000 MHz
    VIC   5:  1920x1080i  60.000000 Hz  16:9     33.750 kHz     74.250000 MHz
    VIC  16:  1920x1080   60.000000 Hz  16:9     67.500 kHz    148.500000 MHz (native)
    VIC  18:   720x576    50.000000 Hz  16:9     31.250 kHz     27.000000 MHz
    VIC  19:  1280x720    50.000000 Hz  16:9     37.500 kHz     74.250000 MHz
    VIC  20:  1920x1080i  50.000000 Hz  16:9     28.125 kHz     74.250000 MHz
    VIC  31:  1920x1080   50.000000 Hz  16:9     56.250 kHz    148.500000 MHz
    VIC  32:  1920x1080   24.000000 Hz  16:9     27.000 kHz     74.250000 MHz
    VIC  33:  1920x1080   25.000000 Hz  16:9     28.125 kHz     74.250000 MHz
    VIC  34:  1920x1080   30.000000 Hz  16:9     33.750 kHz     74.250000 MHz
  Audio Data Block:
    Linear PCM:
      Max channels: 2
      Supported sample rates (kHz): 48 44.1 32
      Supported sample sizes (bits): 24 20 16
  Speaker Allocation Data Block:
    FL/FR - Front Left/Right
  Vendor-Specific Data Block (HDMI), OUI 00-0C-03:
    Source physical address: 1.0.0.0
    Supports_AI
  Detailed Timing Descriptors:
    DTD 4:  1280x720    60.000000 Hz  16:9     45.000 kHz     74.250000 MHz (160 mm x 90 mm)
                 Hfront  110 Hsync  40 Hback  220 Hpol P
                 Vfront    5 Vsync   5 Vback   20 Vpol P
    DTD 5:  1280x768    59.870228 Hz   5:3     47.776 kHz     79.500000 MHz (384 mm x 230 mm)
                 Hfront   64 Hsync 128 Hback  192 Hpol P
                 Vfront    3 Vsync   7 Vback   20 Vpol P
    DTD 6:  1280x600    59.899761 Hz  32:15    37.377 kHz     61.000000 MHz (384 mm x 180 mm)
                 Hfront   48 Hsync 128 Hback  176 Hpol P
                 Vfront    3 Vsync  10 Vback   11 Vpol P
    Dummy Descriptor:
    DTD 7:   720x480    59.940060 Hz   3:2     31.469 kHz     27.000000 MHz (708 mm x 398 mm)
                 Hfront   16 Hsync  62 Hback   60 Hpol N
                 Vfront    9 Vsync   6 Vback   30 Vpol N
Checksum: 0xbd  Unused space in Extension Block: 6 bytes

----------------

Warnings:

Block 0, Base EDID:
  Detailed Timing Descriptor #1: Image size is 345x259 mm, but based on the picture AR it should be 345x193 mm.
  Detailed Timing Descriptor #2: Dubious image size (160x90 mm is smaller than 100x100 mm).
Block 1, CTA-861 Extension Block:
  Video Data Block: VIC 3 and the first DTD are not identical. Is this intended?
  Video Data Block: All VICs are in ascending order, and the first (preferred) VIC <= 4, is that intended?
  Detailed Timing Descriptor #4: Dubious image size (160x90 mm is smaller than 100x100 mm).
  Detailed Timing Descriptor #5: DTD is similar but not identical to DMT 0x17.
  Detailed Timing Descriptor #7: Image size is 708x398 mm, but based on the picture AR it should be 708x472 mm.

Failures:

Block 0, Base EDID:
  Basic Display Parameters & Features: The chromaticities match sRGB, but sRGB is not signaled.
  Detailed Timing Descriptor #1: Mismatch of image size 345x259 mm vs display size 640x320 mm.
  Detailed Timing Descriptor #2: Mismatch of image size 160x90 mm vs display size 640x320 mm.
  Detailed Timing Descriptor #3: Mismatch of image size 384x240 mm vs display size 640x320 mm.
  Missing Display Range Limits Descriptor.
Block 1, CTA-861 Extension Block:
  Detailed Timing Descriptor #4: Mismatch of image size 160x90 mm vs display size 640x320 mm.
  Detailed Timing Descriptor #5: Mismatch of image size 384x230 mm vs display size 640x320 mm.
  Detailed Timing Descriptor #6: Mismatch of image size 384x180 mm vs display size 640x320 mm.
  Dummy Descriptor: Dummy block filled with garbage.
  Detailed Timing Descriptor #7: Mismatch of image size 708x398 mm vs display size 640x320 mm.
  Detailed Timing Descriptor #7: Invalid detailed timing descriptor ordering.
  Missing VCDB, needed for Set Selectable RGB Quantization to avoid interop issues.
EDID:
  Base EDID: The DTD max image size is 708x398mm, which is larger than the display size 640.0x320.0mm.
  CTA-861: Native progressive timings are a mix of several resolutions.

EDID conformity: FAIL
