edid-decode (hex):

00 ff ff ff ff ff ff 00 22 0e 26 34 01 01 01 01
29 1e 01 03 80 36 1e 78 2a 90 55 a7 55 53 a0 28
13 50 54 a1 08 00 d1 c0 a9 c0 81 c0 b3 00 95 00
81 00 81 80 01 01 02 3a 80 18 71 38 2d 40 58 2c
45 00 1f 2e 21 00 00 1e 00 00 00 fd 00 2a 90 1e
f0 21 00 0a 20 20 20 20 20 20 00 00 00 fc 00 4f
4d 45 4e 20 62 79 20 48 50 20 32 35 00 00 00 ff
00 33 43 51 30 34 31 30 4d 56 39 0a 20 20 01 4e

02 03 26 f1 49 90 1f 04 13 03 02 12 11 01 23 09
07 07 65 03 0c 00 10 00 6d 1a 00 00 02 01 2a 90
ed 00 00 00 00 00 fe 5b 80 a0 70 38 35 40 30 20
35 00 fe 1f 11 00 00 1e a9 65 80 a0 70 38 3a 40
30 20 35 00 fe 1f 11 00 00 1e 86 6f 80 a0 70 38
40 40 30 20 35 00 fe 1f 11 00 00 1e fa 7e 80 88
70 38 12 40 18 20 35 00 ba 89 21 00 00 1c 00 00
00 00 00 00 00 00 00 00 00 00 00 00 00 00 00 c0

00 ff ff ff ff ff ff 00 22 0e 26 34 01 01 01 01
29 1e 01 03 80 36 1e 78 2a 90 55 a7 55 53 a0 28
13 50 54 a1 08 00 d1 c0 a9 c0 81 c0 b3 00 95 00
81 00 81 80 01 01 02 3a 80 18 71 38 2d 40 58 2c
45 00 1f 2e 21 00 00 1e 00 00 00 fd 00 2a 90 1e
f0 21 00 0a 20 20 20 20 20 20 00 00 00 fc 00 4f
4d 45 4e 20 62 79 20 48 50 20 32 35 00 00 00 ff
00 33 43 51 30 34 31 30 4d 56 39 0a 20 20 01 4e

02 03 26 f1 49 90 1f 04 13 03 02 12 11 01 23 09
07 07 65 03 0c 00 10 00 6d 1a 00 00 02 01 2a 90
ed 00 00 00 00 00 fe 5b 80 a0 70 38 35 40 30 20
35 00 fe 1f 11 00 00 1e a9 65 80 a0 70 38 3a 40
30 20 35 00 fe 1f 11 00 00 1e 86 6f 80 a0 70 38
40 40 30 20 35 00 fe 1f 11 00 00 1e fa 7e 80 88
70 38 12 40 18 20 35 00 ba 89 21 00 00 1c 00 00
00 00 00 00 00 00 00 00 00 00 00 00 00 00 00 c0

----------------

Block 0, Base EDID:
  EDID Structure Version & Revision: 1.3
  Vendor & Product Identification:
    Manufacturer: HPN
    Model: 13350
    Serial Number: ...
    Made in: week 41 of 2020
  Basic Display Parameters & Features:
    Digital display
    Maximum image size: 54 cm x 30 cm
    Gamma: 2.20
    DPMS levels: Off
    RGB color display
    First detailed timing is the preferred timing
  Color Characteristics:
    Red  : 0.6542, 0.3330
    Green: 0.3242, 0.6250
    Blue : 0.1572, 0.0751
    White: 0.3134, 0.3291
  Established Timings I & II:
    IBM     :   720x400    70.081663 Hz   9:5     31.467 kHz     28.320000 MHz
    DMT 0x04:   640x480    59.940476 Hz   4:3     31.469 kHz     25.175000 MHz
    DMT 0x09:   800x600    60.316541 Hz   4:3     37.879 kHz     40.000000 MHz
    DMT 0x10:  1024x768    60.003840 Hz   4:3     48.363 kHz     65.000000 MHz
  Standard Timings:
    DMT 0x52:  1920x1080   60.000000 Hz  16:9     67.500 kHz    148.500000 MHz
    DMT 0x53:  1600x900    60.000000 Hz  16:9     60.000 kHz    108.000000 MHz (RB)
    DMT 0x55:  1280x720    60.000000 Hz  16:9     45.000 kHz     74.250000 MHz
    DMT 0x3a:  1680x1050   59.954250 Hz  16:10    65.290 kHz    146.250000 MHz
    DMT 0x2f:  1440x900    59.887445 Hz  16:10    55.935 kHz    106.500000 MHz
    DMT 0x1c:  1280x800    59.810326 Hz  16:10    49.702 kHz     83.500000 MHz
    DMT 0x23:  1280x1024   60.019740 Hz   5:4     63.981 kHz    108.000000 MHz
  Detailed Timing Descriptors:
    DTD 1:  1920x1080   60.000000 Hz  16:9     67.500 kHz    148.500000 MHz (543 mm x 302 mm)
                 Hfront   88 Hsync  44 Hback  148 Hpol P
                 Vfront    4 Vsync   5 Vback   36 Vpol P
    Display Range Limits:
      Monitor ranges (GTF): 42-144 Hz V, 30-240 kHz H, max dotclock 330 MHz
    Display Product Name: 'OMEN by HP 25'
    Display Product Serial Number: ...
  Extension blocks: 1
Checksum: 0x4e

----------------

Block 1, CTA-861 Extension Block:
  Revision: 3
  Underscans IT Video Formats by default
  Basic audio support
  Supports YCbCr 4:4:4
  Supports YCbCr 4:2:2
  Native DTDs: 1
  Video Data Block:
    VIC  16:  1920x1080   60.000000 Hz  16:9     67.500 kHz    148.500000 MHz (native)
    VIC  31:  1920x1080   50.000000 Hz  16:9     56.250 kHz    148.500000 MHz
    VIC   4:  1280x720    60.000000 Hz  16:9     45.000 kHz     74.250000 MHz
    VIC  19:  1280x720    50.000000 Hz  16:9     37.500 kHz     74.250000 MHz
    VIC   3:   720x480    59.940060 Hz  16:9     31.469 kHz     27.000000 MHz
    VIC   2:   720x480    59.940060 Hz   4:3     31.469 kHz     27.000000 MHz
    VIC  18:   720x576    50.000000 Hz  16:9     31.250 kHz     27.000000 MHz
    VIC  17:   720x576    50.000000 Hz   4:3     31.250 kHz     27.000000 MHz
    VIC   1:   640x480    59.940476 Hz   4:3     31.469 kHz     25.175000 MHz
  Audio Data Block:
    Linear PCM:
      Max channels: 2
      Supported sample rates (kHz): 48 44.1 32
      Supported sample sizes (bits): 24 20 16
  Vendor-Specific Data Block (HDMI), OUI 00-0C-03:
    Source physical address: 1.0.0.0
  Vendor-Specific Data Block (AMD), OUI 00-00-1A:
    Version: 2
    Flags 1: 0x01
      FreeSync Supported
    Minimum Refresh Rate: 42 Hz
    Maximum Refresh Rate: 144 Hz
    MCCS VCP Code: 0xed
    Flags 5: 0x00
  Detailed Timing Descriptors:
    DTD 2:  1920x1080   99.930409 Hz  16:9    113.221 kHz    235.500000 MHz (510 mm x 287 mm)
                 Hfront   48 Hsync  32 Hback   80 Hpol P
                 Vfront    3 Vsync   5 Vback   45 Vpol P
    DTD 3:  1920x1080  109.947445 Hz  16:9    125.120 kHz    260.250000 MHz (510 mm x 287 mm)
                 Hfront   48 Hsync  32 Hback   80 Hpol P
                 Vfront    3 Vsync   5 Vback   50 Vpol P
    DTD 4:  1920x1080  119.982181 Hz  16:9    137.260 kHz    285.500000 MHz (510 mm x 287 mm)
                 Hfront   48 Hsync  32 Hback   80 Hpol P
                 Vfront    3 Vsync   5 Vback   56 Vpol P
    DTD 5:  1920x1080  143.991906 Hz  16:9    158.103 kHz    325.060000 MHz (698 mm x 393 mm)
                 Hfront   24 Hsync  32 Hback   80 Hpol N
                 Vfront    3 Vsync   5 Vback   10 Vpol P
Checksum: 0xc0  Unused space in Extension Block: 17 bytes

----------------

Warnings:

Block 0, Base EDID:
  Vendor & Product Identification: The serial number is one of the known dummy values, it should probably be set to 0.
Block 1, CTA-861 Extension Block:
  Display Product Serial Number is set, so the Serial Number in the Base EDID should be 0.
  Add a Colorimetry Data Block with the sRGB colorimetry bit set to avoid interop issues.

Failures:

Block 1, CTA-861 Extension Block:
  Detailed Timing Descriptor #2: Mismatch of image size 510x287 mm vs display size 540x300 mm.
  Detailed Timing Descriptor #3: Mismatch of image size 510x287 mm vs display size 540x300 mm.
  Detailed Timing Descriptor #4: Mismatch of image size 510x287 mm vs display size 540x300 mm.
  Detailed Timing Descriptor #5: Mismatch of image size 698x393 mm vs display size 540x300 mm.
  Missing VCDB, needed for Set Selectable RGB Quantization to avoid interop issues.
EDID:
  Extension Block 2 started with EDID header, ignoring Extension Blocks >= 2.
  Base EDID: The DTD max image size is 698x393mm, which is larger than the display size 540.0x300.0mm.

EDID conformity: FAIL
