edid-decode (hex):

00 ff ff ff ff ff ff 00 44 93 32 00 00 00 00 00
00 0f 01 03 80 21 15 78 0a 4d c0 93 5c 51 88 27
21 50 54 00 00 00 01 01 01 01 01 01 01 01 01 01
01 01 01 01 01 01 ea 1a 00 80 50 20 10 30 15 20
44 00 4b cf 10 00 00 18 00 00 00 0f 00 08 00 2a
00 01 00 04 00 32 4a 04 14 00 00 00 00 fe 00 51
55 41 4e 54 41 44 49 53 50 4c 41 59 00 00 00 fe
00 51 44 31 35 54 4c 30 32 35 0a 20 20 20 00 a0

00 ff ff ff ff ff ff 00 44 93 32 00 00 00 00 00
00 0f 01 03 80 21 15 78 0a 4d c0 93 5c 51 88 27
21 50 54 00 00 00 01 01 01 01 01 01 01 01 01 01
01 01 01 01 01 01 ea 1a 00 80 50 20 10 30 15 20
44 00 4b cf 10 00 00 18 00 00 00 0f 00 08 00 2a
00 01 00 04 00 32 4a 04 14 00 00 00 00 fe 00 51
55 41 4e 54 41 44 49 53 50 4c 41 59 00 00 00 fe
00 51 44 31 35 54 4c 30 32 35 0a 20 20 20 00 a0

----------------

Block 0, Base EDID:
  EDID Structure Version & Revision: 1.3
  Vendor & Product Identification:
    Manufacturer: QDS
    Model: 50
    Made in: 2005
  Basic Display Parameters & Features:
    Digital display
    Maximum image size: 33 cm x 21 cm
    Gamma: 2.20
    RGB color display
    First detailed timing is the preferred timing
  Color Characteristics:
    Red  : 0.5751, 0.3593
    Green: 0.3193, 0.5322
    Blue : 0.1552, 0.1289
    White: 0.3125, 0.3281
  Established Timings I & II: none
  Standard Timings: none
  Detailed Timing Descriptors:
    DTD 1:  1280x800    59.968945 Hz  16:10    48.935 kHz     68.900000 MHz (331 mm x 207 mm)
                 Hfront   21 Hsync  32 Hback   75 Hpol N
                 Vfront    4 Vsync   4 Vback    8 Vpol N
    Manufacturer-Specified Display Descriptor (0x0f): 00 0f 00 08 00 2a 00 01 00 04 00 32 4a 04 14 00 '.....*.....2J...'
    Alphanumeric Data String: 'QUANTADISPLAY'
    Alphanumeric Data String: 'QD15TL025'
Checksum: 0xa0

----------------

Failures:

Block 0, Base EDID:
  Missing Display Product Name.
  Missing Display Range Limits Descriptor.
EDID:
  Extension Block 1 started with EDID header, ignoring Extension Blocks >= 1.

EDID conformity: FAIL
