edid-decode (hex):

00 ff ff ff ff ff ff 00 1e 6d 46 75 eb e1 00 00
02 10 01 03 81 40 26 78 08 b1 da a1 56 48 98 24
13 48 4b a1 08 00 31 40 01 01 01 01 45 40 01 01
61 40 81 80 01 01 4e 1f 00 90 51 00 1b 30 40 88
13 00 a2 0b 32 00 00 18 1b 21 50 a0 51 00 1e 30
48 88 35 00 a2 0b 32 00 00 1c 00 00 00 fd 00 3b
3d 1f 30 09 00 0a 20 20 20 20 20 20 00 00 00 fc
00 52 5a 33 32 4c 5a 35 35 0a 20 20 20 20 00 8e

----------------

Block 0, Base EDID:
  EDID Structure Version & Revision: 1.3
  Vendor & Product Identification:
    Manufacturer: GSM
    Model: 30022
    Serial Number: ...
    Made in: week 2 of 2006
  Basic Display Parameters & Features:
    Digital display
    DFP 1.x compatible TMDS
    Maximum image size: 64 cm x 38 cm
    Gamma: 2.20
    RGB color display
  Color Characteristics:
    Red  : 0.6308, 0.3388
    Green: 0.2812, 0.5947
    Blue : 0.1435, 0.0751
    White: 0.2832, 0.2949
  Established Timings I & II:
    IBM     :   720x400    70.081663 Hz   9:5     31.467 kHz     28.320000 MHz
    DMT 0x04:   640x480    59.940476 Hz   4:3     31.469 kHz     25.175000 MHz
    DMT 0x09:   800x600    60.316541 Hz   4:3     37.879 kHz     40.000000 MHz
    DMT 0x10:  1024x768    60.003840 Hz   4:3     48.363 kHz     65.000000 MHz
  Standard Timings:
    DMT 0x04:   640x480    59.940476 Hz   4:3     31.469 kHz     25.175000 MHz
    DMT 0x09:   800x600    60.316541 Hz   4:3     37.879 kHz     40.000000 MHz
    DMT 0x10:  1024x768    60.003840 Hz   4:3     48.363 kHz     65.000000 MHz
    DMT 0x23:  1280x1024   60.019740 Hz   5:4     63.981 kHz    108.000000 MHz
  Detailed Timing Descriptors:
    DTD 1:  1280x768    60.002995 Hz   5:3     47.702 kHz     80.140000 MHz (930 mm x 523 mm)
                 Hfront   64 Hsync 136 Hback  200 Hpol N
                 Vfront    1 Vsync   3 Vback   23 Vpol N
    DTD 2:  1360x768    59.798991 Hz  85:48    47.720 kHz     84.750000 MHz (930 mm x 523 mm)
                 Hfront   72 Hsync 136 Hback  208 Hpol N
                 Vfront    3 Vsync   5 Vback   22 Vpol P
    Display Range Limits:
      Monitor ranges (GTF): 59-61 Hz V, 31-48 kHz H, max dotclock 90 MHz
    Display Product Name: 'RZ32LZ55'
Checksum: 0x8e

----------------

Warnings:

Block 0, Base EDID:
  Detailed Timing Descriptor #1: Image size is 930x523 mm, but based on the picture AR it should be 871x523 mm.
EDID:
  No Native Video Resolution was defined.
  Base EDID: Some timings are out of range of the Monitor Ranges:
    Vertical Freq: 59.799 - 70.082 Hz (Monitor: 59.000 - 61.000 Hz)
    Horizontal Freq: 31.466 - 63.981 kHz (Monitor: 31.000 - 48.000 kHz)
    Maximum Clock: 108.000 MHz (Monitor: 90.000 MHz)

Failures:

Block 0, Base EDID:
  Basic Display Parameters & Features: EDID 1.3 requires that the first detailed timing is the preferred timing.
  Detailed Timing Descriptor #1: Mismatch of image size 930x523 mm vs display size 640x380 mm.
  Detailed Timing Descriptor #2: Mismatch of image size 930x523 mm vs display size 640x380 mm.
EDID:
  Base EDID: The DTD max image size is 930x523mm, which is larger than the display size 640.0x380.0mm.

EDID conformity: FAIL
