edid-decode (hex):

00 ff ff ff ff ff ff 00 42 49 00 00 01 00 00 00
0a 12 01 03 0e 5d 34 78 ea de 58 a3 54 4c 99 26
0f 45 47 af cf 00 81 40 71 4f 01 01 01 01 81 80
8b c0 d1 c0 01 01 52 35 80 80 70 38 1f 40 20 20
13 00 c4 8e 21 00 00 1e 21 39 90 30 62 1a 27 40
68 b0 36 00 c4 8e 21 00 00 1c 00 00 00 fc 00 50
72 69 6d 61 0a 20 20 20 20 20 20 20 00 00 00 fd
00 37 4c 1e 55 12 00 0a 20 20 20 20 20 20 00 aa

00 ff ff ff ff ff ff 00 42 49 00 00 01 00 00 00
0a 12 01 03 0e 5d 34 78 ea de 58 a3 54 4c 99 26
0f 45 47 af cf 00 81 40 71 4f 01 01 01 01 81 80
8b c0 d1 c0 01 01 52 35 80 80 70 38 1f 40 20 20
13 00 c4 8e 21 00 00 1e 21 39 90 30 62 1a 27 40
68 b0 36 00 c4 8e 21 00 00 1c 00 00 00 fc 00 50
72 69 6d 61 0a 20 20 20 20 20 20 20 00 00 00 fd
00 37 4c 1e 55 12 00 0a 20 20 20 20 20 20 00 aa

----------------

Block 0, Base EDID:
  EDID Structure Version & Revision: 1.3
  Vendor & Product Identification:
    Manufacturer: PRI
    Model: 0
    Serial Number: ...
    Made in: week 10 of 2008
  Basic Display Parameters & Features:
    Analog display
    Signal Level Standard: 0.700 : 0.300 : 1.000 V p-p
    Blank level equals black level
    Sync: Separate Composite SyncOnGreen
    Maximum image size: 93 cm x 52 cm
    Gamma: 2.20
    DPMS levels: Standby Suspend Off
    RGB color display
    First detailed timing is the preferred timing
  Color Characteristics:
    Red  : 0.6396, 0.3291
    Green: 0.2998, 0.5996
    Blue : 0.1494, 0.0595
    White: 0.2714, 0.2773
  Established Timings I & II:
    IBM     :   720x400    70.081663 Hz   9:5     31.467 kHz     28.320000 MHz
    DMT 0x04:   640x480    59.940476 Hz   4:3     31.469 kHz     25.175000 MHz
    DMT 0x05:   640x480    72.808802 Hz   4:3     37.861 kHz     31.500000 MHz
    DMT 0x06:   640x480    75.000000 Hz   4:3     37.500 kHz     31.500000 MHz
    DMT 0x08:   800x600    56.250000 Hz   4:3     35.156 kHz     36.000000 MHz
    DMT 0x09:   800x600    60.316541 Hz   4:3     37.879 kHz     40.000000 MHz
    DMT 0x0a:   800x600    72.187572 Hz   4:3     48.077 kHz     50.000000 MHz
    DMT 0x0b:   800x600    75.000000 Hz   4:3     46.875 kHz     49.500000 MHz
    DMT 0x10:  1024x768    60.003840 Hz   4:3     48.363 kHz     65.000000 MHz
    DMT 0x11:  1024x768    70.069359 Hz   4:3     56.476 kHz     75.000000 MHz
    DMT 0x12:  1024x768    75.028582 Hz   4:3     60.023 kHz     78.750000 MHz
    DMT 0x24:  1280x1024   75.024675 Hz   5:4     79.976 kHz    135.000000 MHz
  Standard Timings:
    DMT 0x20:  1280x960    60.000000 Hz   4:3     60.000 kHz    108.000000 MHz
    DMT 0x15:  1152x864    75.000000 Hz   4:3     67.500 kHz    108.000000 MHz
    DMT 0x23:  1280x1024   60.019740 Hz   5:4     63.981 kHz    108.000000 MHz
    GTF     :  1360x765    60.000341 Hz  16:9     47.520 kHz     84.396000 MHz
    DMT 0x52:  1920x1080   60.000000 Hz  16:9     67.500 kHz    148.500000 MHz
  Detailed Timing Descriptors:
    DTD 1:  1920x1080   59.991351 Hz  16:9     66.650 kHz    136.500000 MHz (708 mm x 398 mm)
                 Hfront   32 Hsync  32 Hback   64 Hpol P
                 Vfront    1 Vsync   3 Vback   27 Vpol P
    DTD 2:  1680x1050   59.954250 Hz  16:10    65.290 kHz    146.250000 MHz (708 mm x 398 mm)
                 Hfront  104 Hsync 176 Hback  280 Hpol N
                 Vfront    3 Vsync   6 Vback   30 Vpol P
    Display Product Name: 'Prima'
    Display Range Limits:
      Monitor ranges (GTF): 55-76 Hz V, 30-85 kHz H, max dotclock 180 MHz
Checksum: 0xaa

----------------

Warnings:

Block 0, Base EDID:
  Vendor & Product Identification: The serial number is one of the known dummy values, it should probably be set to 0.
  Standard Timings: Standard Timing 1360x765 has a dubious odd vertical resolution.
  Detailed Timing Descriptor #2: Image size is 708x398 mm, but based on the picture AR it should be 636x398 mm.

Failures:

Block 0, Base EDID:
  Detailed Timing Descriptor #1: Mismatch of image size 708x398 mm vs display size 930x520 mm.
  Detailed Timing Descriptor #2: Mismatch of image size 708x398 mm vs display size 930x520 mm.
EDID:
  Extension Block 1 started with EDID header, ignoring Extension Blocks >= 1.

EDID conformity: FAIL
