edid-decode (hex):

00 ff ff ff ff ff ff 00 4c 83 48 4c 00 00 00 00
00 17 01 04 95 22 13 78 0a 36 25 93 56 55 93 29
1d 50 54 00 00 00 01 01 01 01 01 01 01 01 01 01
01 01 01 01 01 01 60 39 80 dc 70 38 40 40 30 20
25 00 58 c2 10 00 00 1a 41 26 80 dc 70 38 40 40
30 20 25 00 58 c2 10 00 00 1a 00 00 00 fe 00 4d
36 58 52 31 80 31 35 36 48 4c 0a 20 00 00 00 00
00 00 41 21 94 00 10 00 00 02 01 0a 20 20 00 12

----------------

Block 0, Base EDID:
  EDID Structure Version & Revision: 1.4
  Vendor & Product Identification:
    Manufacturer: SDC
    Model: 19528
    Made in: 2013
  Basic Display Parameters & Features:
    Digital display
    Bits per primary color channel: 6
    DisplayPort interface
    Maximum image size: 34 cm x 19 cm
    Gamma: 2.20
    Supported color formats: RGB 4:4:4, YCrCb 4:4:4
    First detailed timing includes the native pixel format and preferred refresh rate
  Color Characteristics:
    Red  : 0.5742, 0.3388
    Green: 0.3330, 0.5761
    Blue : 0.1601, 0.1152
    White: 0.3134, 0.3291
  Established Timings I & II: none
  Standard Timings: none
  Detailed Timing Descriptors:
    DTD 1:  1920x1080   59.996079 Hz  16:9     68.636 kHz    146.880000 MHz (344 mm x 194 mm)
                 Hfront   48 Hsync  32 Hback  140 Hpol P
                 Vfront    2 Vsync   5 Vback   57 Vpol N
    DTD 2:  1920x1080   40.001470 Hz  16:9     45.762 kHz     97.930000 MHz (344 mm x 194 mm)
                 Hfront   48 Hsync  32 Hback  140 Hpol P
                 Vfront    2 Vsync   5 Vback   57 Vpol N
    Alphanumeric Data String: 'M6XR1.156HL'
    Manufacturer-Specified Display Descriptor (0x00): 00 00 00 00 41 21 94 00 10 00 00 02 01 0a 20 20 '....A!........  '
Checksum: 0x12

----------------

Warnings:

Block 0, Base EDID:
  Alphanumeric Data String: Non-ASCII character 0x80 at position 5, can cause problems.
  Missing Display Product Name.

EDID conformity: PASS
