edid-decode (hex):

00 ff ff ff ff ff ff 00 4c 83 48 4c 00 00 00 00
00 18 01 04 95 22 13 78 0a b9 95 a2 55 4b 9c 26
0f 50 54 00 00 00 01 01 01 01 01 01 01 01 01 01
01 01 01 01 01 01 60 39 80 dc 70 38 40 40 30 20
25 00 58 c2 10 00 00 1a e7 2d 80 dc 70 38 40 40
30 20 25 00 58 c2 10 00 00 1a 00 00 00 fe 00 46
59 54 58 54 80 31 35 36 48 4c 0a 20 00 00 00 00
00 00 41 21 94 01 10 00 00 02 01 0a 20 20 00 33

----------------

Block 0, Base EDID:
  EDID Structure Version & Revision: 1.4
  Vendor & Product Identification:
    Manufacturer: SDC
    Model: 19528
    Made in: 2014
  Basic Display Parameters & Features:
    Digital display
    Bits per primary color channel: 6
    DisplayPort interface
    Maximum image size: 34 cm x 19 cm
    Gamma: 2.20
    Supported color formats: RGB 4:4:4, YCrCb 4:4:4
    First detailed timing includes the native pixel format and preferred refresh rate
  Color Characteristics:
    Red  : 0.6347, 0.3349
    Green: 0.2949, 0.6103
    Blue : 0.1503, 0.0595
    White: 0.3134, 0.3291
  Established Timings I & II: none
  Standard Timings: none
  Detailed Timing Descriptors:
    DTD 1:  1920x1080   59.996079 Hz  16:9     68.636 kHz    146.880000 MHz (344 mm x 194 mm)
                 Hfront   48 Hsync  32 Hback  140 Hpol P
                 Vfront    2 Vsync   5 Vback   57 Vpol N
    DTD 2:  1920x1080   47.999314 Hz  16:9     54.911 kHz    117.510000 MHz (344 mm x 194 mm)
                 Hfront   48 Hsync  32 Hback  140 Hpol P
                 Vfront    2 Vsync   5 Vback   57 Vpol N
    Alphanumeric Data String: 'FYTXT.156HL'
    Manufacturer-Specified Display Descriptor (0x00): 00 00 00 00 41 21 94 01 10 00 00 02 01 0a 20 20 '....A!........  '
Checksum: 0x33

----------------

Warnings:

Block 0, Base EDID:
  Alphanumeric Data String: Non-ASCII character 0x80 at position 5, can cause problems.
  Missing Display Product Name.

EDID conformity: PASS
