edid-decode (hex):

00 ff ff ff ff ff ff 00 4c 83 48 4c 00 00 00 00
32 18 01 04 a5 18 0d 78 0a 3a 75 a2 56 4d 9b 27
0e 50 54 00 00 00 01 01 01 01 01 01 01 01 01 01
01 01 01 01 01 01 52 35 80 80 70 38 1f 40 20 20
23 00 ef 86 00 00 00 1a a8 2a 80 80 70 38 1f 40
20 20 23 00 ef 86 00 00 00 1a 00 00 00 fe 00 36
46 52 38 46 81 31 30 38 48 4c 0a 20 00 00 00 00
00 02 41 15 28 01 00 00 00 0b 01 0a 20 20 00 4c

----------------

Block 0, Base EDID:
  EDID Structure Version & Revision: 1.4
  Vendor & Product Identification:
    Manufacturer: SDC
    Model: 19528
    Made in: week 50 of 2014
  Basic Display Parameters & Features:
    Digital display
    Bits per primary color channel: 8
    DisplayPort interface
    Maximum image size: 24 cm x 13 cm
    Gamma: 2.20
    Supported color formats: RGB 4:4:4, YCrCb 4:4:4
    First detailed timing includes the native pixel format and preferred refresh rate
  Color Characteristics:
    Red  : 0.6328, 0.3388
    Green: 0.3027, 0.6074
    Blue : 0.1533, 0.0576
    White: 0.3134, 0.3291
  Established Timings I & II: none
  Standard Timings: none
  Detailed Timing Descriptors:
    DTD 1:  1920x1080   59.991351 Hz  16:9     66.650 kHz    136.500000 MHz (239 mm x 134 mm)
                 Hfront   32 Hsync  32 Hback   64 Hpol P
                 Vfront    2 Vsync   3 Vback   26 Vpol N
    DTD 2:  1920x1080   47.993081 Hz  16:9     53.320 kHz    109.200000 MHz (239 mm x 134 mm)
                 Hfront   32 Hsync  32 Hback   64 Hpol P
                 Vfront    2 Vsync   3 Vback   26 Vpol N
    Alphanumeric Data String: '6FR8F.108HL'
    Manufacturer-Specified Display Descriptor (0x00): 00 00 00 02 41 15 28 01 00 00 00 0b 01 0a 20 20 '....A.(.......  '
Checksum: 0x4c

----------------

Warnings:

Block 0, Base EDID:
  Alphanumeric Data String: Non-ASCII character 0x81 at position 5, can cause problems.
  Missing Display Product Name.

EDID conformity: PASS
