edid-decode (hex):

00 ff ff ff ff ff ff 00 4c 83 48 4c 00 00 00 00
00 19 01 04 a5 26 15 78 0a 34 a5 a5 55 4e 9c 26
10 50 54 00 00 00 01 01 01 01 01 01 01 01 01 01
01 01 01 01 01 01 60 39 80 dc 70 38 40 40 30 20
25 00 7e d6 10 00 00 1a e7 2d 80 dc 70 38 40 40
30 20 25 00 7e d6 10 00 00 1a 00 00 00 fe 00 34
30 50 57 33 81 31 37 33 48 4c 0a 20 00 00 00 00
00 01 41 21 94 01 10 00 00 02 01 0a 20 20 00 76

----------------

Block 0, Base EDID:
  EDID Structure Version & Revision: 1.4
  Vendor & Product Identification:
    Manufacturer: SDC
    Model: 19528
    Made in: 2015
  Basic Display Parameters & Features:
    Digital display
    Bits per primary color channel: 8
    DisplayPort interface
    Maximum image size: 38 cm x 21 cm
    Gamma: 2.20
    Supported color formats: RGB 4:4:4, YCrCb 4:4:4
    First detailed timing includes the native pixel format and preferred refresh rate
  Color Characteristics:
    Red  : 0.6445, 0.3349
    Green: 0.3056, 0.6093
    Blue : 0.1503, 0.0644
    White: 0.3134, 0.3291
  Established Timings I & II: none
  Standard Timings: none
  Detailed Timing Descriptors:
    DTD 1:  1920x1080   59.996079 Hz  16:9     68.636 kHz    146.880000 MHz (382 mm x 214 mm)
                 Hfront   48 Hsync  32 Hback  140 Hpol P
                 Vfront    2 Vsync   5 Vback   57 Vpol N
    DTD 2:  1920x1080   47.999314 Hz  16:9     54.911 kHz    117.510000 MHz (382 mm x 214 mm)
                 Hfront   48 Hsync  32 Hback  140 Hpol P
                 Vfront    2 Vsync   5 Vback   57 Vpol N
    Alphanumeric Data String: '40PW3.173HL'
    Manufacturer-Specified Display Descriptor (0x00): 00 00 00 01 41 21 94 01 10 00 00 02 01 0a 20 20 '....A!........  '
Checksum: 0x76

----------------

Warnings:

Block 0, Base EDID:
  Alphanumeric Data String: Non-ASCII character 0x81 at position 5, can cause problems.
  Missing Display Product Name.

EDID conformity: PASS
