edid-decode (hex):

00 ff ff ff ff ff ff 00 1e 6d 27 77 e7 49 01 00
02 1e 01 04 b5 50 21 78 9f f6 75 af 4e 42 ab 26
0e 50 54 25 4b 00 71 40 81 80 81 c0 a9 c0 b3 00
d1 c0 81 00 d1 cf e7 7c 70 a0 d0 a0 29 50 30 20
3a 00 20 4f 31 00 00 1a 4e ab 70 b8 d1 a0 42 50
90 60 64 08 20 4f 31 00 00 1a 00 00 00 fd 00 78
90 e1 e1 50 01 0a 20 20 20 20 20 20 00 00 00 fc
00 33 34 47 4b 39 35 30 46 0a 20 20 20 20 02 cb

02 03 1a 71 23 09 06 07 49 10 04 03 01 1f 13 12
05 14 e3 05 c0 00 e3 06 05 01 4e d4 70 a0 d0 a0
46 50 30 20 3a 00 20 4f 31 00 00 1a 00 00 00 00
00 00 00 00 00 00 00 00 00 00 00 00 00 00 00 00
00 00 00 00 00 00 00 00 00 00 00 00 00 00 00 00
00 00 00 00 00 00 00 00 00 00 00 00 00 00 00 00
00 00 00 00 00 00 00 00 00 00 00 00 00 00 00 00
00 00 00 00 00 00 00 00 00 00 00 00 00 00 00 66

70 12 79 00 00 03 00 28 ea 05 01 86 6f 0d df 00
8f 80 1f 00 9f 05 54 00 02 00 09 00 66 38 01 86
6f 0d ef 00 2f 80 1f 00 9f 05 45 00 02 00 09 00
00 00 00 00 00 00 00 00 00 00 00 00 00 00 00 00
00 00 00 00 00 00 00 00 00 00 00 00 00 00 00 00
00 00 00 00 00 00 00 00 00 00 00 00 00 00 00 00
00 00 00 00 00 00 00 00 00 00 00 00 00 00 00 00
00 00 00 00 00 00 00 00 00 00 00 00 00 00 f6 90

00 ff ff ff ff ff ff 00 1e 6d 27 77 e7 49 01 00
02 1e 01 04 b5 50 21 78 9f f6 75 af 4e 42 ab 26
0e 50 54 25 4b 00 71 40 81 80 81 c0 a9 c0 b3 00
d1 c0 81 00 d1 cf e7 7c 70 a0 d0 a0 29 50 30 20
3a 00 20 4f 31 00 00 1a 4e ab 70 b8 d1 a0 42 50
90 60 64 08 20 4f 31 00 00 1a 00 00 00 fd 00 78
90 e1 e1 50 01 0a 20 20 20 20 20 20 00 00 00 fc
00 33 34 47 4b 39 35 30 46 0a 20 20 20 20 02 cb

02 03 1a 71 23 09 06 07 49 10 04 03 01 1f 13 12
05 14 e3 05 c0 00 e3 06 05 01 4e d4 70 a0 d0 a0
46 50 30 20 3a 00 20 4f 31 00 00 1a 00 00 00 00
00 00 00 00 00 00 00 00 00 00 00 00 00 00 00 00
00 00 00 00 00 00 00 00 00 00 00 00 00 00 00 00
00 00 00 00 00 00 00 00 00 00 00 00 00 00 00 00
00 00 00 00 00 00 00 00 00 00 00 00 00 00 00 00
00 00 00 00 00 00 00 00 00 00 00 00 00 00 00 66

70 12 79 00 00 03 00 28 ea 05 01 86 6f 0d df 00
8f 80 1f 00 9f 05 54 00 02 00 09 00 66 38 01 86
6f 0d ef 00 2f 80 1f 00 9f 05 45 00 02 00 09 00
00 00 00 00 00 00 00 00 00 00 00 00 00 00 00 00
00 00 00 00 00 00 00 00 00 00 00 00 00 00 00 00
00 00 00 00 00 00 00 00 00 00 00 00 00 00 00 00
00 00 00 00 00 00 00 00 00 00 00 00 00 00 00 00
00 00 00 00 00 00 00 00 00 00 00 00 00 00 f6 90

----------------

Block 0, Base EDID:
  EDID Structure Version & Revision: 1.4
  Vendor & Product Identification:
    Manufacturer: GSM
    Model: 30503
    Serial Number: ...
    Made in: week 2 of 2020
  Basic Display Parameters & Features:
    Digital display
    Bits per primary color channel: 10
    DisplayPort interface
    Maximum image size: 80 cm x 33 cm
    Gamma: 2.20
    DPMS levels: Standby
    Supported color formats: RGB 4:4:4, YCrCb 4:4:4, YCrCb 4:2:2
    Default (sRGB) color space is primary color space
    First detailed timing includes the native pixel format and preferred refresh rate
    Display supports continuous frequencies
  Color Characteristics:
    Red  : 0.6865, 0.3076
    Green: 0.2587, 0.6699
    Blue : 0.1494, 0.0576
    White: 0.3134, 0.3291
  Established Timings I & II:
    DMT 0x04:   640x480    59.940476 Hz   4:3     31.469 kHz     25.175000 MHz
    DMT 0x06:   640x480    75.000000 Hz   4:3     37.500 kHz     31.500000 MHz
    DMT 0x09:   800x600    60.316541 Hz   4:3     37.879 kHz     40.000000 MHz
    DMT 0x0b:   800x600    75.000000 Hz   4:3     46.875 kHz     49.500000 MHz
    DMT 0x10:  1024x768    60.003840 Hz   4:3     48.363 kHz     65.000000 MHz
    DMT 0x12:  1024x768    75.028582 Hz   4:3     60.023 kHz     78.750000 MHz
    DMT 0x24:  1280x1024   75.024675 Hz   5:4     79.976 kHz    135.000000 MHz
  Standard Timings:
    GTF     :  1152x864    60.000000 Hz   4:3     53.700 kHz     81.624000 MHz
    DMT 0x23:  1280x1024   60.019740 Hz   5:4     63.981 kHz    108.000000 MHz
    DMT 0x55:  1280x720    60.000000 Hz  16:9     45.000 kHz     74.250000 MHz
    DMT 0x53:  1600x900    60.000000 Hz  16:9     60.000 kHz    108.000000 MHz (RB)
    DMT 0x3a:  1680x1050   59.954250 Hz  16:10    65.290 kHz    146.250000 MHz
    DMT 0x52:  1920x1080   60.000000 Hz  16:9     67.500 kHz    148.500000 MHz
    DMT 0x1c:  1280x800    59.810326 Hz  16:10    49.702 kHz     83.500000 MHz
    GTF     :  1920x1080   75.000068 Hz  16:9     84.600 kHz    220.637000 MHz
  Detailed Timing Descriptors:
    DTD 1:  3440x1440   59.972616 Hz  43:18    88.819 kHz    319.750000 MHz (800 mm x 335 mm)
                 Hfront   48 Hsync  32 Hback   80 Hpol P
                 Vfront    3 Vsync  10 Vback   28 Vpol N
    DTD 2:  3440x1440   75.050314 Hz  43:18   113.026 kHz    438.540000 MHz (800 mm x 335 mm)
                 Hfront  144 Hsync  96 Hback  200 Hpol P
                 Vfront   38 Vsync   4 Vback   24 Vpol N
    Display Range Limits:
      Monitor ranges (Range Limits Only): 120-144 Hz V, 225-225 kHz H, max dotclock 800 MHz
    Display Product Name: '34GK950F'
  Extension blocks: 2
Checksum: 0xcb

----------------

Block 1, CTA-861 Extension Block:
  Revision: 3
  Basic audio support
  Supports YCbCr 4:4:4
  Supports YCbCr 4:2:2
  Native DTDs: 1
  Audio Data Block:
    Linear PCM:
      Max channels: 2
      Supported sample rates (kHz): 48 44.1
      Supported sample sizes (bits): 24 20 16
  Video Data Block:
    VIC  16:  1920x1080   60.000000 Hz  16:9     67.500 kHz    148.500000 MHz
    VIC   4:  1280x720    60.000000 Hz  16:9     45.000 kHz     74.250000 MHz
    VIC   3:   720x480    59.940060 Hz  16:9     31.469 kHz     27.000000 MHz
    VIC   1:   640x480    59.940476 Hz   4:3     31.469 kHz     25.175000 MHz
    VIC  31:  1920x1080   50.000000 Hz  16:9     56.250 kHz    148.500000 MHz
    VIC  19:  1280x720    50.000000 Hz  16:9     37.500 kHz     74.250000 MHz
    VIC  18:   720x576    50.000000 Hz  16:9     31.250 kHz     27.000000 MHz
    VIC   5:  1920x1080i  60.000000 Hz  16:9     33.750 kHz     74.250000 MHz
    VIC  20:  1920x1080i  50.000000 Hz  16:9     28.125 kHz     74.250000 MHz
  Colorimetry Data Block:
    BT2020YCC
    BT2020RGB
  HDR Static Metadata Data Block:
    Electro optical transfer functions:
      Traditional gamma - SDR luminance range
      SMPTE ST2084
    Supported static metadata descriptors:
      Static metadata type 1
  Detailed Timing Descriptors:
    DTD 3:  3440x1440   99.981604 Hz  43:18   150.972 kHz    543.500000 MHz (800 mm x 335 mm)
                 Hfront   48 Hsync  32 Hback   80 Hpol P
                 Vfront    3 Vsync  10 Vback   57 Vpol N
Checksum: 0x66  Unused space in Extension Block: 83 bytes

----------------

Block 2, DisplayID Extension Block:
  Version: 1.2
  Extension Count: 0
  Display Product Type: Extension Section
  Video Timing Modes Type 1 - Detailed Timings Data Block:
    DTD:  3440x1440  119.999642 Hz  64:27   182.999 kHz    670.510000 MHz (aspect 64:27, no 3D stereo, preferred)
               Hfront  144 Hsync  32 Hback   48 Hpol P
               Vfront    3 Vsync  10 Vback   72 Vpol N
    DTD:  3440x1440  143.922761 Hz  64:27   217.323 kHz    799.750000 MHz (aspect 64:27, no 3D stereo, preferred)
               Hfront   48 Hsync  32 Hback  160 Hpol P
               Vfront    3 Vsync  10 Vback   57 Vpol N
  Checksum: 0xf6
Checksum: 0x90

----------------

Warnings:

Block 1, CTA-861 Extension Block:
  IT Video Formats are overscanned by default, but normally this should be underscanned.
  Video Data Block: VIC 16 and the first DTD are not identical. Is this intended?
EDID:
  Base EDID: Some timings are out of range of the Monitor Ranges:
    Vertical Freq: 50.000 - 143.923 Hz (Monitor: 120.000 - 144.000 Hz)
    Horizontal Freq: 28.125 - 217.323 kHz (Monitor: 225.000 - 225.000 kHz)

Failures:

Block 0, Base EDID:
  Basic Display Parameters & Features: sRGB is signaled, but the chromaticities do not match.
Block 1, CTA-861 Extension Block:
  Missing VCDB, needed for Set Selectable RGB Quantization to avoid interop issues.
Block 2, DisplayID Extension Block:
  DisplayID Base Block has no product type.
EDID:
  Extension Block 3 started with EDID header, ignoring Extension Blocks >= 3.

EDID conformity: FAIL
