edid-decode (hex):

00 ff ff ff ff ff ff 00 06 af ac c5 00 00 00 00
21 21 01 04 b5 27 18 78 03 b5 19 b0 4e 3d ba 26
0c 51 57 00 00 00 01 01 01 01 01 01 01 01 01 01
01 01 01 01 01 01 00 ea 00 a0 f0 60 60 90 30 20
35 00 83 f2 10 00 00 18 00 00 00 0f 00 00 00 00
00 00 00 00 00 00 00 00 00 20 00 00 00 fd 0c 28
78 2d 2d 78 01 0a 20 20 20 20 20 20 00 00 00 fe
00 42 31 38 30 5a 41 4e 30 31 2e 30 20 0a 02 6f

02 03 0f 00 e3 05 80 00 e6 06 05 01 8e 8e 11 00
00 00 00 00 00 00 00 00 00 00 00 00 00 00 00 00
00 00 00 00 00 00 00 00 00 00 00 00 00 00 00 00
00 00 00 00 00 00 00 00 00 00 00 00 00 00 00 00
00 00 00 00 00 00 00 00 00 00 00 00 00 00 00 00
00 00 00 00 00 00 00 00 00 00 00 00 00 00 00 00
00 00 00 00 00 00 00 00 00 00 00 00 00 00 00 00
00 00 00 00 00 00 00 00 00 00 00 00 00 00 00 65

70 20 79 02 00 22 00 14 00 48 12 85 ff 0e 9f 00
2f 80 1f 00 5f 09 5f 00 02 00 04 00 2b 00 0c 27
00 32 77 00 00 27 00 28 3b 00 00 81 00 15 74 1a
00 00 03 03 28 78 00 60 8e 11 8e 11 78 00 00 00
00 8d 00 00 00 00 00 00 00 00 00 00 00 00 00 00
00 00 00 00 00 00 00 00 00 00 00 00 00 00 00 00
00 00 00 00 00 00 00 00 00 00 00 00 00 00 00 00
00 00 00 00 00 00 00 00 00 00 00 00 00 00 0b 90

00 ff ff ff ff ff ff 00 06 af ac c5 00 00 00 00
21 21 01 04 b5 27 18 78 03 b5 19 b0 4e 3d ba 26
0c 51 57 00 00 00 01 01 01 01 01 01 01 01 01 01
01 01 01 01 01 01 00 ea 00 a0 f0 60 60 90 30 20
35 00 83 f2 10 00 00 18 00 00 00 0f 00 00 00 00
00 00 00 00 00 00 00 00 00 20 00 00 00 fd 0c 28
78 2d 2d 78 01 0a 20 20 20 20 20 20 00 00 00 fe
00 42 31 38 30 5a 41 4e 30 31 2e 30 20 0a 02 6f

02 03 0f 00 e3 05 80 00 e6 06 05 01 8e 8e 11 00
00 00 00 00 00 00 00 00 00 00 00 00 00 00 00 00
00 00 00 00 00 00 00 00 00 00 00 00 00 00 00 00
00 00 00 00 00 00 00 00 00 00 00 00 00 00 00 00
00 00 00 00 00 00 00 00 00 00 00 00 00 00 00 00
00 00 00 00 00 00 00 00 00 00 00 00 00 00 00 00
00 00 00 00 00 00 00 00 00 00 00 00 00 00 00 00
00 00 00 00 00 00 00 00 00 00 00 00 00 00 00 65

70 20 79 02 00 22 00 14 00 48 12 85 ff 0e 9f 00
2f 80 1f 00 5f 09 5f 00 02 00 04 00 2b 00 0c 27
00 32 77 00 00 27 00 28 3b 00 00 81 00 15 74 1a
00 00 03 03 28 78 00 60 8e 11 8e 11 78 00 00 00
00 8d 00 00 00 00 00 00 00 00 00 00 00 00 00 00
00 00 00 00 00 00 00 00 00 00 00 00 00 00 00 00
00 00 00 00 00 00 00 00 00 00 00 00 00 00 00 00
00 00 00 00 00 00 00 00 00 00 00 00 00 00 0b 90

----------------

Block 0, Base EDID:
  EDID Structure Version & Revision: 1.4
  Vendor & Product Identification:
    Manufacturer: AUO
    Model: 50604
    Made in: week 33 of 2023
  Basic Display Parameters & Features:
    Digital display
    Bits per primary color channel: 10
    DisplayPort interface
    Maximum image size: 39 cm x 24 cm
    Gamma: 2.20
    Supported color formats: RGB 4:4:4
    First detailed timing includes the native pixel format and preferred refresh rate
    Display supports continuous frequencies
  Color Characteristics:
    Red  : 0.6894, 0.3076
    Green: 0.2392, 0.7275
    Blue : 0.1484, 0.0478
    White: 0.3183, 0.3408
  Established Timings I & II: none
  Standard Timings: none
  Detailed Timing Descriptors:
    DTD 1:  3840x2400   60.000000 Hz  16:10   149.760 kHz    599.040000 MHz (387 mm x 242 mm)
                 Hfront   48 Hsync  32 Hback   80 Hpol N
                 Vfront    3 Vsync   5 Vback   88 Vpol N
    Manufacturer-Specified Display Descriptor (0x0f): 00 0f 00 00 00 00 00 00 00 00 00 00 00 00 00 20 '............... '
    Display Range Limits:
      Monitor ranges (Range Limits Only): 40-120 Hz V, 300-300 kHz H, max dotclock 1200 MHz
    Alphanumeric Data String: 'B180ZAN01.0 '
  Extension blocks: 2
Checksum: 0x6f

----------------

Block 1, CTA-861 Extension Block:
  Revision: 3
  Native DTDs: 0
  Colorimetry Data Block:
    BT2020RGB
  HDR Static Metadata Data Block:
    Electro optical transfer functions:
      Traditional gamma - SDR luminance range
      SMPTE ST2084
    Supported static metadata descriptors:
      Static metadata type 1
    Desired content max luminance: 142 (1083.404 cd/m^2)
    Desired content max frame-average luminance: 142 (1083.404 cd/m^2)
    Desired content min luminance: 17 (0.048 cd/m^2)
Checksum: 0x65  Unused space in Extension Block: 112 bytes

----------------

Block 2, DisplayID Extension Block:
  Version: 2.0
  Extension Count: 0
  Display Product Primary Use Case: None of the listed primary use cases; generic display
  Video Timing Modes Type 7 - Detailed Timings Data Block:
    DTD:  3840x2400  120.000100 Hz  16:10   299.520 kHz   1198.081000 MHz (aspect 16:10, no 3D stereo, preferred)
               Hfront   48 Hsync  32 Hback   80 Hpol P
               Vfront    3 Vsync   5 Vback   88 Vpol N
  Adaptive Sync Data Block:
    Descriptor #1:
      Native Panel Range
      Fixed Average V-Total and Adaptive V-Total
      Supports Seamless Transition
      'Max Single Frame Duration Increase' field value without jitter impact
      'Max Single Frame Duration Decrease' field value without jitter impact
      Max Duration Increase: 0.00 ms
      Max Duration Decrease: 0.00 ms
      Min Refresh Rate: 50 Hz
      Max Refresh Rate: 120 Hz
    Descriptor #2:
      Native Panel Range
      Fixed Average V-Total and Adaptive V-Total
      Supports Seamless Transition
      'Max Single Frame Duration Increase' field value without jitter impact
      'Max Single Frame Duration Decrease' field value without jitter impact
      Max Duration Increase: 0.00 ms
      Max Duration Decrease: 0.00 ms
      Min Refresh Rate: 40 Hz
      Max Refresh Rate: 60 Hz
  CTA-861 DisplayID Data Block:
  Vendor-Specific Data Block (AMD), OUI 00-00-1A:
    Version: 3
    Feature Caps: 0x03
    Minimum Refresh Rate: 40 Hz
    Maximum Refresh Rate: 120 Hz
    Flags 1.x: 0x00
    Flags 2.x: 0x60
      ST 2084 (PQ) EOTF Supported
      Linear EOTF (Windows scRGB, 0.0 - 125.0) Supported
      BT.2020 Gamut Supported
    Maximum luminance: 142 (1083.404 cd/m^2)
    Minimum luminance: 17 (0.048 cd/m^2)
  Checksum: 0x0b
Checksum: 0x90

----------------

Warnings:

Block 0, Base EDID:
  Missing Display Product Name.
Block 1, CTA-861 Extension Block:
  IT Video Formats are overscanned by default, but normally this should be underscanned.
  Colorimetry Data Block: Set the sRGB colorimetry bit to avoid interop issues.
EDID:
  Base EDID: Some timings are out of range of the Monitor Ranges:
    Horizontal Freq: 149.760 - 299.520 kHz (Monitor: 300.000 - 300.000 kHz)

Failures:

Block 0, Base EDID:
  Alphanumeric Data String: One or more trailing spaces before newline.
Block 1, CTA-861 Extension Block:
  Required 640x480p60 timings are missing in the established timings and the SVD list (VIC 1).
  Missing VCDB, needed for Set Selectable RGB Quantization to avoid interop issues.
EDID:
  Extension Block 3 started with EDID header, ignoring Extension Blocks >= 3.
  DisplayID: Missing DisplayID Display Parameters Data Block.

EDID conformity: FAIL
