edid-decode (hex):

00 ff ff ff ff ff ff 00 09 e5 00 08 01 00 00 00
1e 20 01 03 80 35 1e 78 ee b1 0f a6 55 52 9c 27
0f 4f 53 00 00 00 01 01 01 01 01 01 01 01 01 01
01 01 01 01 01 01 02 3a 80 18 71 38 2d 40 58 2c
45 00 0f 28 21 00 00 1e 00 00 00 fc 00 41 33 34
30 32 57 42 41 0a 20 20 20 20 00 00 00 fd 00 39
3e 53 53 11 00 0a 20 20 20 20 20 20 00 00 00 fe
00 4d 56 32 33 38 46 48 4d 0a 20 20 20 20 00 d8

00 ff ff ff ff ff ff 00 09 e5 00 08 01 00 00 00
1e 20 01 03 80 35 1e 78 ee b1 0f a6 55 52 9c 27
0f 4f 53 00 00 00 01 01 01 01 01 01 01 01 01 01
01 01 01 01 01 01 02 3a 80 18 71 38 2d 40 58 2c
45 00 0f 28 21 00 00 1e 00 00 00 fc 00 41 33 34
30 32 57 42 41 0a 20 20 20 20 00 00 00 fd 00 39
3e 53 53 11 00 0a 20 20 20 20 20 20 00 00 00 fe
00 4d 56 32 33 38 46 48 4d 0a 20 20 20 20 00 d8

----------------

Block 0, Base EDID:
  EDID Structure Version & Revision: 1.3
  Vendor & Product Identification:
    Manufacturer: BOE
    Model: 2048
    Serial Number: ...
    Made in: week 30 of 2022
  Basic Display Parameters & Features:
    Digital display
    Maximum image size: 53 cm x 30 cm
    Gamma: 2.20
    DPMS levels: Standby Suspend Off
    RGB color display
    Default (sRGB) color space is primary color space
    First detailed timing is the preferred timing
  Color Characteristics:
    Red  : 0.6503, 0.3349
    Green: 0.3203, 0.6103
    Blue : 0.1523, 0.0585
    White: 0.3115, 0.3271
  Established Timings I & II: none
  Standard Timings: none
  Detailed Timing Descriptors:
    DTD 1:  1920x1080   60.000000 Hz  16:9     67.500 kHz    148.500000 MHz (527 mm x 296 mm)
                 Hfront   88 Hsync  44 Hback  148 Hpol P
                 Vfront    4 Vsync   5 Vback   36 Vpol P
    Display Product Name: 'A3402WBA'
    Display Range Limits:
      Monitor ranges (GTF): 57-62 Hz V, 83-83 kHz H, max dotclock 170 MHz
    Alphanumeric Data String: 'MV238FHM'
Checksum: 0xd8

----------------

Warnings:

Block 0, Base EDID:
  Vendor & Product Identification: The serial number is one of the known dummy values, it should probably be set to 0.
EDID:
  Base EDID: Some timings are out of range of the Monitor Ranges:
    Horizontal Freq: 67.500 - 67.500 kHz (Monitor: 83.000 - 83.000 kHz)

Failures:

Block 0, Base EDID:
  Basic Display Parameters & Features: sRGB is signaled, but the chromaticities do not match.
EDID:
  Extension Block 1 started with EDID header, ignoring Extension Blocks >= 1.

EDID conformity: FAIL
