edid-decode (hex):

00 ff ff ff ff ff ff 00 30 e4 38 07 00 00 00 00
00 20 01 04 a5 22 13 78 03 71 c5 98 5e 5b 8f 27
1b 50 54 00 00 00 01 01 01 01 01 01 01 01 01 01
01 01 01 01 01 01 8b 6f 80 a0 70 38 40 40 30 20
35 00 58 c2 10 00 00 1a 00 00 00 fd 00 30 78 89
89 1d 01 0a 20 20 20 20 20 20 00 00 00 fe 00 47
38 57 57 50 81 31 35 36 57 46 4a 0a 00 00 00 00
00 02 41 3f 99 00 00 00 00 0b 01 0a 20 20 01 88

70 13 79 00 00 03 01 14 c7 37 00 04 7f 07 9f 00
2f 00 1f 00 37 04 3f 00 02 00 04 00 00 00 00 00
00 00 00 00 00 00 00 00 00 00 00 00 00 00 00 00
00 00 00 00 00 00 00 00 00 00 00 00 00 00 00 00
00 00 00 00 00 00 00 00 00 00 00 00 00 00 00 00
00 00 00 00 00 00 00 00 00 00 00 00 00 00 00 00
00 00 00 00 00 00 00 00 00 00 00 00 00 00 00 00
00 00 00 00 00 00 00 00 00 00 00 00 00 00 67 90

00 ff ff ff ff ff ff 00 30 e4 38 07 00 00 00 00
00 20 01 04 a5 22 13 78 03 71 c5 98 5e 5b 8f 27
1b 50 54 00 00 00 01 01 01 01 01 01 01 01 01 01
01 01 01 01 01 01 8b 6f 80 a0 70 38 40 40 30 20
35 00 58 c2 10 00 00 1a 00 00 00 fd 00 30 78 89
89 1d 01 0a 20 20 20 20 20 20 00 00 00 fe 00 47
38 57 57 50 81 31 35 36 57 46 4a 0a 00 00 00 00
00 02 41 3f 99 00 00 00 00 0b 01 0a 20 20 01 88

70 13 79 00 00 03 01 14 c7 37 00 04 7f 07 9f 00
2f 00 1f 00 37 04 3f 00 02 00 04 00 00 00 00 00
00 00 00 00 00 00 00 00 00 00 00 00 00 00 00 00
00 00 00 00 00 00 00 00 00 00 00 00 00 00 00 00
00 00 00 00 00 00 00 00 00 00 00 00 00 00 00 00
00 00 00 00 00 00 00 00 00 00 00 00 00 00 00 00
00 00 00 00 00 00 00 00 00 00 00 00 00 00 00 00
00 00 00 00 00 00 00 00 00 00 00 00 00 00 67 90

----------------

Block 0, Base EDID:
  EDID Structure Version & Revision: 1.4
  Vendor & Product Identification:
    Manufacturer: LGD
    Model: 1848
    Made in: 2022
  Basic Display Parameters & Features:
    Digital display
    Bits per primary color channel: 8
    DisplayPort interface
    Maximum image size: 34 cm x 19 cm
    Gamma: 2.20
    Supported color formats: RGB 4:4:4
    First detailed timing includes the native pixel format and preferred refresh rate
    Display supports continuous frequencies
  Color Characteristics:
    Red  : 0.5947, 0.3701
    Green: 0.3554, 0.5595
    Blue : 0.1552, 0.1054
    White: 0.3134, 0.3291
  Established Timings I & II: none
  Standard Timings: none
  Detailed Timing Descriptors:
    DTD 1:  1920x1080  120.003194 Hz  16:9    137.284 kHz    285.550000 MHz (344 mm x 194 mm)
                 Hfront   48 Hsync  32 Hback   80 Hpol P
                 Vfront    3 Vsync   5 Vback   56 Vpol N
    Display Range Limits:
      Monitor ranges (Range Limits Only): 48-120 Hz V, 137-137 kHz H, max dotclock 290 MHz
    Alphanumeric Data String: 'G8WWP.156WFJ'
    Manufacturer-Specified Display Descriptor (0x00): 00 00 00 02 41 3f 99 00 00 00 00 0b 01 0a 20 20 '....A?........  '
  Extension blocks: 1
Checksum: 0x88

----------------

Block 1, DisplayID Extension Block:
  Version: 1.3
  Extension Count: 0
  Display Product Type: Extension Section
  Video Timing Modes Type 1 - Detailed Timings Data Block:
    DTD:  1920x1080   60.012103 Hz  16:9     68.654 kHz    142.800000 MHz (aspect 16:9, no 3D stereo)
               Hfront   48 Hsync  32 Hback   80 Hpol N
               Vfront    3 Vsync   5 Vback   56 Vpol N
  Checksum: 0x67
Checksum: 0x90

----------------

Block 2, Unknown EDID Extension Block 0x00:
  00 ff ff ff ff ff ff 00 30 e4 38 07 00 00 00 00 '........0.8.....'
  00 20 01 04 a5 22 13 78 03 71 c5 98 5e 5b 8f 27 '. ...".x.q..^[.''
  1b 50 54 00 00 00 01 01 01 01 01 01 01 01 01 01 '.PT.............'
  01 01 01 01 01 01 8b 6f 80 a0 70 38 40 40 30 20 '.......o..p8@@0 '
  35 00 58 c2 10 00 00 1a 00 00 00 fd 00 30 78 89 '5.X..........0x.'
  89 1d 01 0a 20 20 20 20 20 20 00 00 00 fe 00 47 '....      .....G'
  38 57 57 50 81 31 35 36 57 46 4a 0a 00 00 00 00 '8WWP.156WFJ.....'
  00 02 41 3f 99 00 00 00 00 0b 01 0a 20 20 01 88 '..A?........  ..'
Checksum: 0x88

----------------

Block 3, DisplayID Extension Block:
  Version: 1.3
  Extension Count: 0
  Video Timing Modes Type 1 - Detailed Timings Data Block:
    DTD:  1920x1080   60.012103 Hz  16:9     68.654 kHz    142.800000 MHz (aspect 16:9, no 3D stereo)
               Hfront   48 Hsync  32 Hback   80 Hpol N
               Vfront    3 Vsync   5 Vback   56 Vpol N
  Checksum: 0x67
Checksum: 0x90

----------------

Warnings:

Block 0, Base EDID:
  Alphanumeric Data String: Non-ASCII character 0x81 at position 5, can cause problems.
  Missing Display Product Name.
EDID:
  Base EDID: Some timings are out of range of the Monitor Ranges:
    Horizontal Freq: 68.653 - 137.283 kHz (Monitor: 137.000 - 137.000 kHz)

Failures:

Block 1, DisplayID Extension Block:
  DisplayID Base Block has no product type.
  Expected 0 DisplayID Extension Block, but got 1.
Block 2, Base EDID:
  Unknown Extension Block.
EDID:
  Base EDID: EDID specified 1 extension block(s), but found 3 extension block(s).
  DisplayID: DisplayID expects at least one preferred timing.

EDID conformity: FAIL
