edid-decode (hex):

00 ff ff ff ff ff ff 00 19 c9 00 00 00 00 00 00
00 15 01 03 08 00 00 78 0a e0 bd a3 54 48 97 26
0c 47 4a 21 08 00 95 00 81 80 90 40 b3 00 01 01
01 01 01 01 01 01 02 3a 80 18 71 38 2d 40 58 2c
45 00 10 09 31 00 00 1e 66 21 50 b0 51 00 1b 30
40 70 36 00 10 09 00 00 00 1e 00 00 00 fd 00 39
3f 1e 44 0f 00 0a 20 20 20 20 20 20 00 00 00 fc
00 46 55 4e 41 49 20 54 56 0a 20 20 20 20 00 33

00 ff ff ff ff ff ff 00 19 c9 00 00 00 00 00 00
00 15 01 03 08 00 00 78 0a e0 bd a3 54 48 97 26
0c 47 4a 21 08 00 95 00 81 80 90 40 b3 00 01 01
01 01 01 01 01 01 02 3a 80 18 71 38 2d 40 58 2c
45 00 10 09 31 00 00 1e 66 21 50 b0 51 00 1b 30
40 70 36 00 10 09 00 00 00 1e 00 00 00 fd 00 39
3f 1e 44 0f 00 0a 20 20 20 20 20 20 00 00 00 fc
00 46 55 4e 41 49 20 54 56 0a 20 20 20 20 00 33

----------------

Block 0, Base EDID:
  EDID Structure Version & Revision: 1.3
  Vendor & Product Identification:
    Manufacturer: FNI
    Model: 0
    Made in: 2011
  Basic Display Parameters & Features:
    Analog display
    Signal Level Standard: 0.700 : 0.300 : 1.000 V p-p
    Blank level equals black level
    Sync: Separate
    Image size is variable
    Gamma: 2.20
    RGB color display
    First detailed timing is the preferred timing
  Color Characteristics:
    Red  : 0.6396, 0.3300
    Green: 0.2812, 0.5898
    Blue : 0.1503, 0.0498
    White: 0.2802, 0.2900
  Established Timings I & II:
    DMT 0x04:   640x480    59.940476 Hz   4:3     31.469 kHz     25.175000 MHz
    DMT 0x09:   800x600    60.316541 Hz   4:3     37.879 kHz     40.000000 MHz
    DMT 0x10:  1024x768    60.003840 Hz   4:3     48.363 kHz     65.000000 MHz
  Standard Timings:
    DMT 0x2f:  1440x900    59.887445 Hz  16:10    55.935 kHz    106.500000 MHz
    DMT 0x23:  1280x1024   60.019740 Hz   5:4     63.981 kHz    108.000000 MHz
    DMT 0x2a:  1400x1050   59.978442 Hz   4:3     65.317 kHz    121.750000 MHz
    DMT 0x3a:  1680x1050   59.954250 Hz  16:10    65.290 kHz    146.250000 MHz
  Detailed Timing Descriptors:
    DTD 1:  1920x1080   60.000000 Hz  16:9     67.500 kHz    148.500000 MHz (784 mm x 265 mm)
                 Hfront   88 Hsync  44 Hback  148 Hpol P
                 Vfront    4 Vsync   5 Vback   36 Vpol P
    DTD 2:  1360x768    60.015162 Hz  85:48    47.712 kHz     85.500000 MHz (16 mm x 9 mm)
                 Hfront   64 Hsync 112 Hback  256 Hpol P
                 Vfront    3 Vsync   6 Vback   18 Vpol P
    Display Range Limits:
      Monitor ranges (GTF): 57-63 Hz V, 30-68 kHz H, max dotclock 150 MHz
    Display Product Name: 'FUNAI TV'
Checksum: 0x33

----------------

Block 1, Unknown EDID Extension Block 0x00:
  00 ff ff ff ff ff ff 00 19 c9 00 00 00 00 00 00 '................'
  00 15 01 03 08 00 00 78 0a e0 bd a3 54 48 97 26 '.......x....TH.&'
  0c 47 4a 21 08 00 95 00 81 80 90 40 b3 00 01 01 '.GJ!.......@....'
  01 01 01 01 01 01 02 3a 80 18 71 38 2d 40 58 2c '.......:..q8-@X,'
  45 00 10 09 31 00 00 1e 66 21 50 b0 51 00 1b 30 'E...1...f!P.Q..0'
  40 70 36 00 10 09 00 00 00 1e 00 00 00 fd 00 39 '@p6............9'
  3f 1e 44 0f 00 0a 20 20 20 20 20 20 00 00 00 fc '?.D...      ....'
  00 46 55 4e 41 49 20 54 56 0a 20 20 20 20 00 33 '.FUNAI TV.    .3'
Checksum: 0x33

----------------

Warnings:

Block 0, Base EDID:
  Detailed Timing Descriptor #1: Image size is 784x265 mm, but based on the picture AR it should be 784x441 mm.
  Detailed Timing Descriptor #2: Dubious image size (16x9 mm is smaller than 100x100 mm).

Failures:

Block 1, Base EDID:
  Unknown Extension Block.
EDID:
  Base EDID: The DTD max image size is 784x265mm, but the display size is not specified anywhere.
  Base EDID: EDID specified 0 extension block(s), but found 1 extension block(s).

EDID conformity: FAIL
