edid-decode (hex):

00 ff ff ff ff ff ff 00 05 e3 30 32 cd 01 00 00
2e 1f 01 03 80 46 27 78 2e 9b e5 ad 50 46 a5 26
10 50 54 bf ef 00 d1 c0 81 80 31 68 31 7c 45 68
45 7c 61 68 61 7c 02 3a 80 18 71 38 2d 40 58 2c
45 00 72 10 53 00 00 1e 6c 84 80 ba 7f 38 1e 40
30 40 35 00 72 10 53 00 00 1a 00 00 00 fc 00 41
47 33 32 33 46 57 47 33 52 33 0a 20 00 00 00 fd
00 30 a5 1e c8 22 00 0a 20 20 20 20 20 20 01 2e

02 03 36 f4 4b 10 1f 04 13 03 12 02 11 01 3f 4e
23 09 07 07 83 01 00 00 e3 05 e3 01 e6 06 07 01
53 53 00 67 03 0c 00 10 00 18 3c 67 d8 5d c4 01
44 80 21 e2 0e 61 6c 84 80 ba 7f 38 1e 40 30 40
35 00 72 10 53 00 00 1a fc 7e 80 88 70 38 12 40
18 20 35 00 72 10 53 00 00 1e 86 6f 80 a0 70 38
40 40 30 20 35 00 72 10 53 00 00 1e fe 5b 80 a0
70 38 35 40 30 20 35 00 72 10 53 00 00 1e 00 83

00 ff ff ff ff ff ff 00 05 e3 30 32 cd 01 00 00
2e 1f 01 03 80 46 27 78 2e 9b e5 ad 50 46 a5 26
10 50 54 bf ef 00 d1 c0 81 80 31 68 31 7c 45 68
45 7c 61 68 61 7c 02 3a 80 18 71 38 2d 40 58 2c
45 00 72 10 53 00 00 1e 6c 84 80 ba 7f 38 1e 40
30 40 35 00 72 10 53 00 00 1a 00 00 00 fc 00 41
47 33 32 33 46 57 47 33 52 33 0a 20 00 00 00 fd
00 30 a5 1e c8 22 00 0a 20 20 20 20 20 20 01 2e

02 03 36 f4 4b 10 1f 04 13 03 12 02 11 01 3f 4e
23 09 07 07 83 01 00 00 e3 05 e3 01 e6 06 07 01
53 53 00 67 03 0c 00 10 00 18 3c 67 d8 5d c4 01
44 80 21 e2 0e 61 6c 84 80 ba 7f 38 1e 40 30 40
35 00 72 10 53 00 00 1a fc 7e 80 88 70 38 12 40
18 20 35 00 72 10 53 00 00 1e 86 6f 80 a0 70 38
40 40 30 20 35 00 72 10 53 00 00 1e fe 5b 80 a0
70 38 35 40 30 20 35 00 72 10 53 00 00 1e 00 83

----------------

Block 0, Base EDID:
  EDID Structure Version & Revision: 1.3
  Vendor & Product Identification:
    Manufacturer: AOC
    Model: 12848
    Serial Number: ...
    Made in: week 46 of 2021
  Basic Display Parameters & Features:
    Digital display
    Maximum image size: 70 cm x 39 cm
    Gamma: 2.20
    DPMS levels: Off
    RGB color display
    Default (sRGB) color space is primary color space
    First detailed timing is the preferred timing
  Color Characteristics:
    Red  : 0.6777, 0.3134
    Green: 0.2753, 0.6474
    Blue : 0.1513, 0.0644
    White: 0.3134, 0.3291
  Established Timings I & II:
    IBM     :   720x400    70.081663 Hz   9:5     31.467 kHz     28.320000 MHz
    DMT 0x04:   640x480    59.940476 Hz   4:3     31.469 kHz     25.175000 MHz
    Apple   :   640x480    66.666667 Hz   4:3     35.000 kHz     30.240000 MHz
    DMT 0x05:   640x480    72.808802 Hz   4:3     37.861 kHz     31.500000 MHz
    DMT 0x06:   640x480    75.000000 Hz   4:3     37.500 kHz     31.500000 MHz
    DMT 0x08:   800x600    56.250000 Hz   4:3     35.156 kHz     36.000000 MHz
    DMT 0x09:   800x600    60.316541 Hz   4:3     37.879 kHz     40.000000 MHz
    DMT 0x0a:   800x600    72.187572 Hz   4:3     48.077 kHz     50.000000 MHz
    DMT 0x0b:   800x600    75.000000 Hz   4:3     46.875 kHz     49.500000 MHz
    Apple   :   832x624    74.551266 Hz   4:3     49.726 kHz     57.284000 MHz
    DMT 0x10:  1024x768    60.003840 Hz   4:3     48.363 kHz     65.000000 MHz
    DMT 0x11:  1024x768    70.069359 Hz   4:3     56.476 kHz     75.000000 MHz
    DMT 0x12:  1024x768    75.028582 Hz   4:3     60.023 kHz     78.750000 MHz
    DMT 0x24:  1280x1024   75.024675 Hz   5:4     79.976 kHz    135.000000 MHz
  Standard Timings:
    DMT 0x52:  1920x1080   60.000000 Hz  16:9     67.500 kHz    148.500000 MHz
    DMT 0x23:  1280x1024   60.019740 Hz   5:4     63.981 kHz    108.000000 MHz
    GTF     :   640x480    99.999537 Hz   4:3     50.900 kHz     43.163000 MHz
    GTF     :   640x480   119.999084 Hz   4:3     61.800 kHz     52.406000 MHz
    GTF     :   800x600    99.999707 Hz   4:3     63.600 kHz     68.179000 MHz
    GTF     :   800x600   119.999886 Hz   4:3     77.160 kHz     83.950000 MHz
    GTF     :  1024x768   100.000177 Hz   4:3     81.400 kHz    113.309000 MHz
    GTF     :  1024x768   119.999931 Hz   4:3     98.760 kHz    139.054000 MHz
  Detailed Timing Descriptors:
    DTD 1:  1920x1080   60.000000 Hz  16:9     67.500 kHz    148.500000 MHz (1394 mm x 784 mm)
                 Hfront   88 Hsync  44 Hback  148 Hpol P
                 Vfront    4 Vsync   5 Vback   36 Vpol P
    DTD 2:  1920x1080   51.363169 Hz  16:9     57.013 kHz    339.000000 MHz (1394 mm x 784 mm)
                 Hfront   48 Hsync  64 Hback 3914 Hpol P
                 Vfront    3 Vsync   5 Vback   22 Vpol N
    Display Product Name: 'AG323FWG3R3'
    Display Range Limits:
      Monitor ranges (GTF): 48-165 Hz V, 30-200 kHz H, max dotclock 340 MHz
  Extension blocks: 1
Checksum: 0x2e

----------------

Block 1, CTA-861 Extension Block:
  Revision: 3
  Underscans IT Video Formats by default
  Basic audio support
  Supports YCbCr 4:4:4
  Supports YCbCr 4:2:2
  Native DTDs: 4
  Video Data Block:
    VIC  16:  1920x1080   60.000000 Hz  16:9     67.500 kHz    148.500000 MHz
    VIC  31:  1920x1080   50.000000 Hz  16:9     56.250 kHz    148.500000 MHz
    VIC   4:  1280x720    60.000000 Hz  16:9     45.000 kHz     74.250000 MHz
    VIC  19:  1280x720    50.000000 Hz  16:9     37.500 kHz     74.250000 MHz
    VIC   3:   720x480    59.940060 Hz  16:9     31.469 kHz     27.000000 MHz
    VIC  18:   720x576    50.000000 Hz  16:9     31.250 kHz     27.000000 MHz
    VIC   2:   720x480    59.940060 Hz   4:3     31.469 kHz     27.000000 MHz
    VIC  17:   720x576    50.000000 Hz   4:3     31.250 kHz     27.000000 MHz
    VIC   1:   640x480    59.940476 Hz   4:3     31.469 kHz     25.175000 MHz
    VIC  63:  1920x1080  120.000000 Hz  16:9    135.000 kHz    297.000000 MHz
    VIC  78:  1920x1080  120.000000 Hz  64:27   135.000 kHz    297.000000 MHz
  Audio Data Block:
    Linear PCM:
      Max channels: 2
      Supported sample rates (kHz): 48 44.1 32
      Supported sample sizes (bits): 24 20 16
  Speaker Allocation Data Block:
    FL/FR - Front Left/Right
  Colorimetry Data Block:
    xvYCC601
    xvYCC709
    BT2020cYCC
    BT2020YCC
    BT2020RGB
    Gamut Boundary Description Metadata Profile P0
  HDR Static Metadata Data Block:
    Electro optical transfer functions:
      Traditional gamma - SDR luminance range
      Traditional gamma - HDR luminance range
      SMPTE ST2084
    Supported static metadata descriptors:
      Static metadata type 1
    Desired content max luminance: 83 (301.833 cd/m^2)
    Desired content max frame-average luminance: 83 (301.833 cd/m^2)
    Desired content min luminance: 0 (0.000 cd/m^2)
  Vendor-Specific Data Block (HDMI), OUI 00-0C-03:
    Source physical address: 1.0.0.0
    DC_30bit
    DC_Y444
    Maximum TMDS clock: 300 MHz
  Vendor-Specific Data Block (HDMI Forum), OUI C4-5D-D8:
    Version: 1
    Maximum TMDS Character Rate: 340 MHz
    SCDC Present
    Max Fixed Rate Link: 3 and 6 Gbps per lane on 3 lanes
    Supports 10-bits/component Deep Color 4:2:0 Pixel Encoding
  YCbCr 4:2:0 Video Data Block:
    VIC  97:  3840x2160   60.000000 Hz  16:9    135.000 kHz    594.000000 MHz
  Detailed Timing Descriptors:
    DTD 3:  1920x1080   51.363169 Hz  16:9     57.013 kHz    339.000000 MHz (1394 mm x 784 mm)
                 Hfront   48 Hsync  64 Hback 3914 Hpol P
                 Vfront    3 Vsync   5 Vback   22 Vpol N
    DTD 4:  1920x1080  144.000765 Hz  16:9    158.113 kHz    325.080000 MHz (1394 mm x 784 mm)
                 Hfront   24 Hsync  32 Hback   80 Hpol P
                 Vfront    3 Vsync   5 Vback   10 Vpol P
    DTD 5:  1920x1080  119.982181 Hz  16:9    137.260 kHz    285.500000 MHz (1394 mm x 784 mm)
                 Hfront   48 Hsync  32 Hback   80 Hpol P
                 Vfront    3 Vsync   5 Vback   56 Vpol P
    DTD 6:  1920x1080   99.930409 Hz  16:9    113.221 kHz    235.500000 MHz (1394 mm x 784 mm)
                 Hfront   48 Hsync  32 Hback   80 Hpol P
                 Vfront    3 Vsync   5 Vback   45 Vpol P
Checksum: 0x83  Unused space in Extension Block: 1 byte

----------------

Failures:

Block 0, Base EDID:
  Basic Display Parameters & Features: sRGB is signaled, but the chromaticities do not match.
  Detailed Timing Descriptor #1: Mismatch of image size 1394x784 mm vs display size 700x390 mm.
  Detailed Timing Descriptor #2: Mismatch of image size 1394x784 mm vs display size 700x390 mm.
Block 1, CTA-861 Extension Block:
  Vendor-Specific Data Block (HDMI Forum), OUI C4-5D-D8: Max TMDS rate is > 0 and <= 340 or > 600.
  Vendor-Specific Data Block (HDMI Forum), OUI C4-5D-D8: Max Fixed Rate Link is >= 2, but Max TMDS rate < 600.
  Detailed Timing Descriptor #3: Mismatch of image size 1394x784 mm vs display size 700x390 mm.
  Detailed Timing Descriptor #4: Mismatch of image size 1394x784 mm vs display size 700x390 mm.
  Detailed Timing Descriptor #5: Mismatch of image size 1394x784 mm vs display size 700x390 mm.
  Detailed Timing Descriptor #6: Mismatch of image size 1394x784 mm vs display size 700x390 mm.
  Missing VCDB, needed for Set Selectable RGB Quantization to avoid interop issues.
EDID:
  Extension Block 2 started with EDID header, ignoring Extension Blocks >= 2.
  Base EDID: The DTD max image size is 1394x784mm, which is larger than the display size 700.0x390.0mm.

EDID conformity: FAIL
