edid-decode (hex):

00 ff ff ff ff ff ff 00 59 4b 08 53 96 73 03 6c
12 1a 01 03 81 0f 08 78 ca 54 54 8f 54 59 97 26
cb 54 54 00 00 00 01 01 01 01 01 01 01 01 01 01
01 01 01 01 01 01 72 0b 20 80 30 e0 2d 10 28 30
d3 00 9a 54 00 00 00 18 00 00 00 fd 00 37 41 18
29 05 00 0a 20 20 20 20 20 20 00 00 00 fc 00 48
53 44 30 37 30 49 44 57 31 0a 0a 0a 00 00 00 10
00 00 00 00 00 00 00 00 00 00 00 00 00 00 00 8c

----------------

Block 0, Base EDID:
  EDID Structure Version & Revision: 1.3
  Vendor & Product Identification:
    Manufacturer: VJK
    Model: 21256
    Serial Number: ...
    Made in: week 18 of 2016
  Basic Display Parameters & Features:
    Digital display
    DFP 1.x compatible TMDS
    Maximum image size: 15 cm x 8 cm
    Gamma: 2.20
    DPMS levels: Standby Suspend
    RGB color display
    First detailed timing is the preferred timing
  Color Characteristics:
    Red  : 0.5595, 0.3291
    Green: 0.3486, 0.5898
    Blue : 0.1494, 0.7939
    White: 0.3291, 0.3281
  Established Timings I & II: none
  Standard Timings: none
  Detailed Timing Descriptors:
    DTD 1:   800x480    60.139573 Hz   5:3     31.573 kHz     29.300000 MHz (154 mm x 84 mm)
                 Hfront   40 Hsync  48 Hback   40 Hpol N
                 Vfront   13 Vsync   3 Vback   29 Vpol N
    Display Range Limits:
      Monitor ranges (GTF): 55-65 Hz V, 24-41 kHz H, max dotclock 50 MHz
    Display Product Name: 'HSD070IDW1'
    Dummy Descriptor:
Checksum: 0x8c

----------------

Warnings:

Block 0, Base EDID:
  Basic Display Parameters & Features: Dubious maximum image size (15x8 is smaller than 10x10 cm).
  Detailed Timing Descriptor #1: Dubious image size (154x84 mm is smaller than 100x100 mm).

Failures:

Block 0, Base EDID:
  Display Product Name: Non-space after newline.

EDID conformity: FAIL
