edid-decode (hex):

00 ff ff ff ff ff ff 00 36 87 70 02 00 00 00 00
32 21 01 03 80 3c 21 78 2a 64 35 a5 54 4f 9e 27
12 50 54 21 08 00 71 40 81 80 81 00 81 c0 95 00
95 c0 a9 c0 b3 00 02 3a 80 18 71 38 2d 40 58 2c
45 00 58 4a 21 00 00 1e ff 81 80 a0 70 38 1f 40
30 20 36 00 58 4a 21 00 00 1e 00 00 00 fd 00 30
90 1f ff 0d 00 0a 20 20 20 20 20 20 00 00 00 fc
00 54 47 32 37 48 32 0a 20 20 20 20 20 20 01 69

02 03 34 f1 43 90 3f 40 23 09 7f 07 83 01 00 00
67 03 0c 00 10 00 18 82 e3 05 60 00 e6 06 05 01
60 50 00 68 1a 00 00 01 01 30 a5 e6 67 d8 5d c4
01 82 88 01 02 3a 80 18 71 38 2d 40 58 2c 25 00
0f 28 21 00 00 1e 37 8b 80 18 71 38 2d 40 30 20
33 00 0f 28 21 00 00 1a 8a 6f 80 a0 70 38 40 40
30 20 3a 00 0f 28 21 00 00 1e 00 00 00 00 00 00
00 00 00 00 00 00 00 00 00 00 00 00 00 00 00 ea

00 ff ff ff ff ff ff 00 36 87 70 02 00 00 00 00
32 21 01 03 80 3c 21 78 2a 64 35 a5 54 4f 9e 27
12 50 54 21 08 00 71 40 81 80 81 00 81 c0 95 00
95 c0 a9 c0 b3 00 02 3a 80 18 71 38 2d 40 58 2c
45 00 58 4a 21 00 00 1e ff 81 80 a0 70 38 1f 40
30 20 36 00 58 4a 21 00 00 1e 00 00 00 fd 00 30
90 1f ff 0d 00 0a 20 20 20 20 20 20 00 00 00 fc
00 54 47 32 37 48 32 0a 20 20 20 20 20 20 01 69

02 03 34 f1 43 90 3f 40 23 09 7f 07 83 01 00 00
67 03 0c 00 10 00 18 82 e3 05 60 00 e6 06 05 01
60 50 00 68 1a 00 00 01 01 30 a5 e6 67 d8 5d c4
01 82 88 01 02 3a 80 18 71 38 2d 40 58 2c 25 00
0f 28 21 00 00 1e 37 8b 80 18 71 38 2d 40 30 20
33 00 0f 28 21 00 00 1a 8a 6f 80 a0 70 38 40 40
30 20 3a 00 0f 28 21 00 00 1e 00 00 00 00 00 00
00 00 00 00 00 00 00 00 00 00 00 00 00 00 00 ea

----------------

Block 0, Base EDID:
  EDID Structure Version & Revision: 1.3
  Vendor & Product Identification:
    Manufacturer: MTG
    Model: 624
    Made in: week 50 of 2023
  Basic Display Parameters & Features:
    Digital display
    Maximum image size: 60 cm x 33 cm
    Gamma: 2.20
    DPMS levels: Off
    RGB color display
    First detailed timing is the preferred timing
  Color Characteristics:
    Red  : 0.6455, 0.3300
    Green: 0.3095, 0.6171
    Blue : 0.1523, 0.0732
    White: 0.3134, 0.3291
  Established Timings I & II:
    DMT 0x04:   640x480    59.940476 Hz   4:3     31.469 kHz     25.175000 MHz
    DMT 0x09:   800x600    60.316541 Hz   4:3     37.879 kHz     40.000000 MHz
    DMT 0x10:  1024x768    60.003840 Hz   4:3     48.363 kHz     65.000000 MHz
  Standard Timings:
    GTF     :  1152x864    60.000000 Hz   4:3     53.700 kHz     81.624000 MHz
    DMT 0x23:  1280x1024   60.019740 Hz   5:4     63.981 kHz    108.000000 MHz
    DMT 0x1c:  1280x800    59.810326 Hz  16:10    49.702 kHz     83.500000 MHz
    DMT 0x55:  1280x720    60.000000 Hz  16:9     45.000 kHz     74.250000 MHz
    DMT 0x2f:  1440x900    59.887445 Hz  16:10    55.935 kHz    106.500000 MHz
    GTF     :  1440x810    60.000051 Hz  16:9     50.340 kHz     95.042000 MHz
    DMT 0x53:  1600x900    60.000000 Hz  16:9     60.000 kHz    108.000000 MHz (RB)
    DMT 0x3a:  1680x1050   59.954250 Hz  16:10    65.290 kHz    146.250000 MHz
  Detailed Timing Descriptors:
    DTD 1:  1920x1080   60.000000 Hz  16:9     67.500 kHz    148.500000 MHz (600 mm x 330 mm)
                 Hfront   88 Hsync  44 Hback  148 Hpol P
                 Vfront    4 Vsync   5 Vback   36 Vpol P
    DTD 2:  1920x1080  144.010074 Hz  16:9    159.995 kHz    332.790000 MHz (600 mm x 330 mm)
                 Hfront   48 Hsync  32 Hback   80 Hpol P
                 Vfront    3 Vsync   6 Vback   22 Vpol P
    Display Range Limits:
      Monitor ranges (GTF): 48-144 Hz V, 31-255 kHz H, max dotclock 130 MHz
    Display Product Name: 'TG27H2'
  Extension blocks: 1
Checksum: 0x69

----------------

Block 1, CTA-861 Extension Block:
  Revision: 3
  Underscans IT Video Formats by default
  Basic audio support
  Supports YCbCr 4:4:4
  Supports YCbCr 4:2:2
  Native DTDs: 1
  Video Data Block:
    VIC  16:  1920x1080   60.000000 Hz  16:9     67.500 kHz    148.500000 MHz (native)
    VIC  63:  1920x1080  120.000000 Hz  16:9    135.000 kHz    297.000000 MHz
    VIC  64:  1920x1080  100.000000 Hz  16:9    112.500 kHz    297.000000 MHz
  Audio Data Block:
    Linear PCM:
      Max channels: 2
      Supported sample rates (kHz): 192 176.4 96 88.2 48 44.1 32
      Supported sample sizes (bits): 24 20 16
  Speaker Allocation Data Block:
    FL/FR - Front Left/Right
  Vendor-Specific Data Block (HDMI), OUI 00-0C-03:
    Source physical address: 1.0.0.0
    DC_30bit
    DC_Y444
    Maximum TMDS clock: 650 MHz
  Colorimetry Data Block:
    BT2020cYCC
    BT2020YCC
  HDR Static Metadata Data Block:
    Electro optical transfer functions:
      Traditional gamma - SDR luminance range
      SMPTE ST2084
    Supported static metadata descriptors:
      Static metadata type 1
    Desired content max luminance: 96 (400.000 cd/m^2)
    Desired content max frame-average luminance: 80 (282.843 cd/m^2)
    Desired content min luminance: 0 (0.000 cd/m^2)
  Vendor-Specific Data Block (AMD), OUI 00-00-1A:
    Version: 1
    Flags 1: 0x01
      FreeSync Supported
    Minimum Refresh Rate: 48 Hz
    Maximum Refresh Rate: 165 Hz
    MCCS VCP Code: 0xe6
  Vendor-Specific Data Block (HDMI Forum), OUI C4-5D-D8:
    Version: 1
    Maximum TMDS Character Rate: 650 MHz
    SCDC Present
    Supports scrambling for <= 340 Mcsc
    Supports 10-bits/component Deep Color 4:2:0 Pixel Encoding
  Detailed Timing Descriptors:
    DTD 3:  1920x1080   60.000000 Hz  16:9     67.500 kHz    148.500000 MHz (527 mm x 296 mm)
                 Hfront   88 Hsync  44 Hback  148 Hpol P
                 Vfront    2 Vsync   5 Vback   38 Vpol P
    DTD 4:  1920x1080  143.995960 Hz  16:9    161.995 kHz    356.390000 MHz (527 mm x 296 mm)
                 Hfront   48 Hsync  32 Hback  200 Hpol P
                 Vfront    3 Vsync   3 Vback   39 Vpol N
    DTD 5:  1920x1080  119.998991 Hz  16:9    137.279 kHz    285.540000 MHz (527 mm x 296 mm)
                 Hfront   48 Hsync  32 Hback   80 Hpol P
                 Vfront    3 Vsync  10 Vback   51 Vpol P
Checksum: 0xea  Unused space in Extension Block: 21 bytes

----------------

Warnings:

Block 1, CTA-861 Extension Block:
  Colorimetry Data Block: Set the sRGB colorimetry bit to avoid interop issues.
  Detailed Timing Descriptor #3: DTD is similar but not identical to VIC 16.
EDID:
  Base EDID: Some timings are out of range of the Monitor Ranges:
    Maximum Clock: 356.390 MHz (Monitor: 130.000 MHz)

Failures:

Block 1, CTA-861 Extension Block:
  Vendor-Specific Data Block (HDMI), OUI 00-0C-03: HDMI VSDB Max TMDS rate is > 340.
  Vendor-Specific Data Block (HDMI Forum), OUI C4-5D-D8: HDMI Forum VSDB did not immediately follow the HDMI VSDB.
  Vendor-Specific Data Block (HDMI Forum), OUI C4-5D-D8: Max TMDS rate is > 0 and <= 340 or > 600.
  Detailed Timing Descriptor #3: Mismatch of image size 527x296 mm vs display size 600x330 mm.
  Detailed Timing Descriptor #4: Mismatch of image size 527x296 mm vs display size 600x330 mm.
  Detailed Timing Descriptor #5: Mismatch of image size 527x296 mm vs display size 600x330 mm.
  Missing VCDB, needed for Set Selectable RGB Quantization to avoid interop issues.
EDID:
  Extension Block 2 started with EDID header, ignoring Extension Blocks >= 2.

EDID conformity: FAIL
