edid-decode (hex):

00 ff ff ff ff ff ff 00 09 e5 d9 05 00 00 00 00
01 18 01 04 a5 1d 11 78 0a 88 2c a0 57 54 97 27
18 4b 51 00 00 00 01 01 01 01 01 01 01 01 01 01
01 01 01 01 01 01 13 5d 00 a0 a0 a0 14 50 30 20
55 00 26 a5 10 00 00 1a 13 5d 00 a0 a0 a0 14 50
30 20 55 00 26 a5 10 00 00 1a 00 00 00 fe 00 42
4f 45 20 48 46 0a 20 20 20 20 20 20 00 00 00 fe
00 54 56 31 33 33 51 48 4d 2d 4e 4c 30 0a 00 38

00 ff ff ff ff ff ff 00 09 e5 d9 05 00 00 00 00
01 18 01 04 a5 1d 11 78 0a 88 2c a0 57 54 97 27
18 4b 51 00 00 00 01 01 01 01 01 01 01 01 01 01
01 01 01 01 01 01 13 5d 00 a0 a0 a0 14 50 30 20
55 00 26 a5 10 00 00 1a 13 5d 00 a0 a0 a0 14 50
30 20 55 00 26 a5 10 00 00 1a 00 00 00 fe 00 42
4f 45 20 48 46 0a 20 20 20 20 20 20 00 00 00 fe
00 54 56 31 33 33 51 48 4d 2d 4e 4c 30 0a 00 38

----------------

Block 0, Base EDID:
  EDID Structure Version & Revision: 1.4
  Vendor & Product Identification:
    Manufacturer: BOE
    Model: 1497
    Made in: week 1 of 2014
  Basic Display Parameters & Features:
    Digital display
    Bits per primary color channel: 8
    DisplayPort interface
    Maximum image size: 29 cm x 17 cm
    Gamma: 2.20
    Supported color formats: RGB 4:4:4, YCrCb 4:4:4
    First detailed timing includes the native pixel format and preferred refresh rate
  Color Characteristics:
    Red  : 0.6269, 0.3398
    Green: 0.3300, 0.5898
    Blue : 0.1523, 0.0957
    White: 0.2958, 0.3164
  Established Timings I & II: none
  Standard Timings: none
  Detailed Timing Descriptors:
    DTD 1:  2560x1440   59.999496 Hz  16:9     87.599 kHz    238.270000 MHz (294 mm x 165 mm)
                 Hfront   48 Hsync  32 Hback   80 Hpol P
                 Vfront    5 Vsync   5 Vback   10 Vpol N
    DTD 2:  2560x1440   59.999496 Hz  16:9     87.599 kHz    238.270000 MHz (294 mm x 165 mm)
                 Hfront   48 Hsync  32 Hback   80 Hpol P
                 Vfront    5 Vsync   5 Vback   10 Vpol N
    Alphanumeric Data String: 'BOE HF'
    Alphanumeric Data String: 'TV133QHM-NL0'
Checksum: 0x38

----------------

Warnings:

Block 0, Base EDID:
  Missing Display Product Name.

Failures:

EDID:
  Extension Block 1 started with EDID header, ignoring Extension Blocks >= 1.

EDID conformity: FAIL
