edid-decode (hex):

00 ff ff ff ff ff ff 00 09 e5 31 0a 00 00 00 00
0f 1f 01 04 a5 22 16 78 07 37 55 96 5d 58 92 29
20 50 54 00 00 00 01 01 01 01 01 01 01 01 01 01
01 01 01 01 01 01 33 3f 80 dc 70 b0 3c 40 30 20
36 00 59 d7 10 00 00 1a 00 00 00 fd 00 28 3c 4c
4c 10 01 0a 20 20 20 20 20 20 00 00 00 fe 00 42
4f 45 20 43 51 0a 20 20 20 20 20 20 00 00 00 fe
00 4e 56 31 36 30 57 55 4d 2d 4e 34 33 0a 01 59

02 03 00 00 68 1a 00 00 01 01 28 3c 00 00 00 00
00 00 00 00 00 00 00 00 00 00 00 00 00 00 00 00
00 00 00 00 00 00 00 00 00 00 00 00 00 00 00 00
00 00 00 00 00 00 00 00 00 00 00 00 00 00 00 00
00 00 00 00 00 00 00 00 00 00 00 00 00 00 00 00
00 00 00 00 00 00 00 00 00 00 00 00 00 00 00 00
00 00 00 00 00 00 00 00 00 00 00 00 00 00 00 00
00 00 00 00 00 00 00 00 00 00 00 00 00 00 15 fe

00 ff ff ff ff ff ff 00 09 e5 31 0a 00 00 00 00
0f 1f 01 04 a5 22 16 78 07 37 55 96 5d 58 92 29
20 50 54 00 00 00 01 01 01 01 01 01 01 01 01 01
01 01 01 01 01 01 33 3f 80 dc 70 b0 3c 40 30 20
36 00 59 d7 10 00 00 1a 00 00 00 fd 00 28 3c 4c
4c 10 01 0a 20 20 20 20 20 20 00 00 00 fe 00 42
4f 45 20 43 51 0a 20 20 20 20 20 20 00 00 00 fe
00 4e 56 31 36 30 57 55 4d 2d 4e 34 33 0a 01 59

02 03 00 00 68 1a 00 00 01 01 28 3c 00 00 00 00
00 00 00 00 00 00 00 00 00 00 00 00 00 00 00 00
00 00 00 00 00 00 00 00 00 00 00 00 00 00 00 00
00 00 00 00 00 00 00 00 00 00 00 00 00 00 00 00
00 00 00 00 00 00 00 00 00 00 00 00 00 00 00 00
00 00 00 00 00 00 00 00 00 00 00 00 00 00 00 00
00 00 00 00 00 00 00 00 00 00 00 00 00 00 00 00
00 00 00 00 00 00 00 00 00 00 00 00 00 00 15 fe

----------------

Block 0, Base EDID:
  EDID Structure Version & Revision: 1.4
  Vendor & Product Identification:
    Manufacturer: BOE
    Model: 2609
    Made in: week 15 of 2021
  Basic Display Parameters & Features:
    Digital display
    Bits per primary color channel: 8
    DisplayPort interface
    Maximum image size: 34 cm x 22 cm
    Gamma: 2.20
    Supported color formats: RGB 4:4:4
    Default (sRGB) color space is primary color space
    First detailed timing includes the native pixel format and preferred refresh rate
    Display supports continuous frequencies
  Color Characteristics:
    Red  : 0.5859, 0.3662
    Green: 0.3447, 0.5732
    Blue : 0.1611, 0.1259
    White: 0.3134, 0.3291
  Established Timings I & II: none
  Standard Timings: none
  Detailed Timing Descriptors:
    DTD 1:  1920x1200   60.002225 Hz  16:10    75.603 kHz    161.790000 MHz (345 mm x 215 mm)
                 Hfront   48 Hsync  32 Hback  140 Hpol P
                 Vfront    3 Vsync   6 Vback   51 Vpol N
    Display Range Limits:
      Monitor ranges (Range Limits Only): 40-60 Hz V, 76-76 kHz H, max dotclock 160 MHz
    Alphanumeric Data String: 'BOE CQ'
    Alphanumeric Data String: 'NV160WUM-N43'
  Extension blocks: 1
Checksum: 0x59

----------------

Block 1, CTA-861 Extension Block:
  Revision: 3
  Native detailed modes: 0
Checksum: 0xfe

----------------

Block 2, Unknown EDID Extension Block 0x00:
  00 ff ff ff ff ff ff 00 09 e5 31 0a 00 00 00 00 '..........1.....'
  0f 1f 01 04 a5 22 16 78 07 37 55 96 5d 58 92 29 '.....".x.7U.]X.)'
  20 50 54 00 00 00 01 01 01 01 01 01 01 01 01 01 ' PT.............'
  01 01 01 01 01 01 33 3f 80 dc 70 b0 3c 40 30 20 '......3?..p.<@0 '
  36 00 59 d7 10 00 00 1a 00 00 00 fd 00 28 3c 4c '6.Y..........(<L'
  4c 10 01 0a 20 20 20 20 20 20 00 00 00 fe 00 42 'L...      .....B'
  4f 45 20 43 51 0a 20 20 20 20 20 20 00 00 00 fe 'OE CQ.      ....'
  00 4e 56 31 36 30 57 55 4d 2d 4e 34 33 0a 01 59 '.NV160WUM-N43..Y'
Checksum: 0x59

----------------

Block 3, CTA-861 Extension Block:
  Revision: 3
  Native detailed modes: 0
Checksum: 0xfe

----------------

Warnings:

Block 0, Base EDID:
  Missing Display Product Name.
Block 1, CTA-861 Extension Block:
  IT Video Formats are overscanned by default, but normally this should be underscanned.
Block 3, CTA-861 Extension Block:
  IT Video Formats are overscanned by default, but normally this should be underscanned.
EDID:
  Base EDID: Some timings are out of range of the Monitor Ranges:
    Maximum Clock: 161.790 MHz (Monitor: 160.000 MHz)
    Could be due to a Monitor Range off-by-one rounding issue

Failures:

Block 0, Base EDID:
  Basic Display Parameters & Features: sRGB is signaled, but the chromaticities do not match.
Block 1, CTA-861 Extension Block:
  Padding: Contains non-zero bytes.
  Required 640x480p60 timings are missing in the established timings and the SVD list (VIC 1).
  Missing VCDB, needed for Set Selectable RGB Quantization to avoid interop issues.
Block 2, Base EDID:
  Unknown Extension Block.
Block 3, CTA-861 Extension Block:
  Padding: Contains non-zero bytes.
EDID:
  Base EDID: EDID specified 1 extension block(s), but found 3 extension block(s).

EDID conformity: FAIL
