edid-decode (hex):

00 ff ff ff ff ff ff 00 09 e5 64 0c 00 00 00 00
14 21 01 04 b5 27 18 78 03 3e 15 ae 50 43 b0 25
0e 50 54 00 00 00 01 01 01 01 01 01 01 01 01 01
01 01 01 01 01 01 34 70 00 a0 a0 40 a0 60 30 20
36 00 84 f2 10 00 00 18 00 00 00 fd 0c 3c f0 a7
a7 73 01 0a 20 20 20 20 20 20 00 00 00 fc 00 4e
45 31 38 30 51 44 4d 2d 4e 5a 34 0a 00 00 00 fe
00 42 4f 45 20 43 51 0a 20 20 20 20 20 20 01 5b

70 20 79 02 00 21 00 1d 28 0f 74 09 00 0a 40 06
80 e1 2a 51 3d 64 b0 51 52 0e 02 35 54 d0 5f d0
5f b8 36 13 78 22 00 14 ff 87 11 85 ff 09 9f 00
2f 00 1f 00 3f 06 9f 00 02 00 05 00 2b 00 0c 27
00 3c ef 00 00 27 00 32 3b 00 00 81 00 15 74 1a
00 00 03 01 3c f0 00 00 00 00 00 00 f0 00 00 00
00 00 00 00 00 00 00 00 00 00 00 00 00 00 00 00
00 00 00 00 00 00 00 00 00 00 00 00 00 00 50 90

00 ff ff ff ff ff ff 00 09 e5 64 0c 00 00 00 00
14 21 01 04 b5 27 18 78 03 3e 15 ae 50 43 b0 25
0e 50 54 00 00 00 01 01 01 01 01 01 01 01 01 01
01 01 01 01 01 01 34 70 00 a0 a0 40 a0 60 30 20
36 00 84 f2 10 00 00 18 00 00 00 fd 0c 3c f0 a7
a7 73 01 0a 20 20 20 20 20 20 00 00 00 fc 00 4e
45 31 38 30 51 44 4d 2d 4e 5a 34 0a 00 00 00 fe
00 42 4f 45 20 43 51 0a 20 20 20 20 20 20 01 5b

70 20 79 02 00 21 00 1d 28 0f 74 09 00 0a 40 06
80 e1 2a 51 3d 64 b0 51 52 0e 02 35 54 d0 5f d0
5f b8 36 13 78 22 00 14 ff 87 11 85 ff 09 9f 00
2f 00 1f 00 3f 06 9f 00 02 00 05 00 2b 00 0c 27
00 3c ef 00 00 27 00 32 3b 00 00 81 00 15 74 1a
00 00 03 01 3c f0 00 00 00 00 00 00 f0 00 00 00
00 00 00 00 00 00 00 00 00 00 00 00 00 00 00 00
00 00 00 00 00 00 00 00 00 00 00 00 00 00 50 90

----------------

Block 0, Base EDID:
  EDID Structure Version & Revision: 1.4
  Vendor & Product Identification:
    Manufacturer: BOE
    Model: 3172
    Made in: week 20 of 2023
  Basic Display Parameters & Features:
    Digital display
    Bits per primary color channel: 10
    DisplayPort interface
    Maximum image size: 39 cm x 24 cm
    Gamma: 2.20
    Supported color formats: RGB 4:4:4
    First detailed timing includes the native pixel format and preferred refresh rate
    Display supports continuous frequencies
  Color Characteristics:
    Red  : 0.6796, 0.3154
    Green: 0.2646, 0.6894
    Blue : 0.1445, 0.0556
    White: 0.3134, 0.3291
  Established Timings I & II: none
  Standard Timings: none
  Detailed Timing Descriptors:
    DTD 1:  2560x1600   60.001671 Hz  16:10   105.603 kHz    287.240000 MHz (388 mm x 242 mm)
                 Hfront   48 Hsync  32 Hback   80 Hpol N
                 Vfront    3 Vsync   6 Vback  151 Vpol N
    Display Range Limits:
      Monitor ranges (Range Limits Only): 60-240 Hz V, 422-422 kHz H, max dotclock 1150 MHz
    Display Product Name: 'NE180QDM-NZ4'
    Alphanumeric Data String: 'BOE CQ'
  Extension blocks: 1
Checksum: 0x5b

----------------

Block 1, DisplayID Extension Block:
  Version: 2.0
  Extension Count: 0
  Display Product Primary Use Case: None of the listed primary use cases; generic display
  Display Parameters Data Block (0x21):
    Image size: 388.0 mm x 242.0 mm
    Display native pixel format: 2560x1600
    Scan Orientation: Left to Right, Top to Bottom
    Luminance Information: Minimum guaranteed value
    Color Information: CIE 1931
    Audio Speaker Information: not integrated
    Native Color Chromaticity:
      Primary #1:  (0.679932, 0.316895)
      Primary #2:  (0.264893, 0.688965)
      Primary #3:  (0.144775, 0.055908)
      White Point: (0.312988, 0.328857)
    Native Maximum Luminance (Full Coverage): 500.000000 cd/m^2
    Native Maximum Luminance (10% Rectangular Coverage): 500.000000 cd/m^2
    Native Minimum Luminance: 0.419922 cd/m^2
    Native Color Depth: 12 bpc
    Display Device Technology: Active Matrix LCD
    Native Gamma EOTF: 2.20
  Video Timing Modes Type 7 - Detailed Timings Data Block:
    DTD:  2560x1600  240.000000 Hz  16:10   422.400 kHz   1148.928000 MHz (aspect 16:10, no 3D stereo, preferred)
               Hfront   48 Hsync  32 Hback   80 Hpol N
               Vfront    3 Vsync   6 Vback  151 Vpol N
  Adaptive Sync Data Block:
    Descriptor #1:
      Native Panel Range
      Fixed Average V-Total and Adaptive V-Total
      Supports Seamless Transition
      'Max Single Frame Duration Increase' field value without jitter impact
      'Max Single Frame Duration Decrease' field value without jitter impact
      Max Duration Increase: 0.00 ms
      Max Duration Decrease: 0.00 ms
      Min Refresh Rate: 60 Hz
      Max Refresh Rate: 240 Hz
    Descriptor #2:
      Native Panel Range
      Fixed Average V-Total and Adaptive V-Total
      Supports Seamless Transition
      'Max Single Frame Duration Increase' field value without jitter impact
      'Max Single Frame Duration Decrease' field value without jitter impact
      Max Duration Increase: 0.00 ms
      Max Duration Decrease: 0.00 ms
      Min Refresh Rate: 50 Hz
      Max Refresh Rate: 60 Hz
  CTA-861 DisplayID Data Block:
  Vendor-Specific Data Block (AMD), OUI 00-00-1A:
    Version: 3
    Feature Caps: 0x01
    Minimum Refresh Rate: 60 Hz
    Maximum Refresh Rate: 240 Hz
    Flags 1.x: 0x00
    Flags 2.x: 0x00
  Checksum: 0x50
Checksum: 0x90

----------------

Block 2, Unknown EDID Extension Block 0x00:
  00 ff ff ff ff ff ff 00 09 e5 64 0c 00 00 00 00 '..........d.....'
  14 21 01 04 b5 27 18 78 03 3e 15 ae 50 43 b0 25 '.!...'.x.>..PC.%'
  0e 50 54 00 00 00 01 01 01 01 01 01 01 01 01 01 '.PT.............'
  01 01 01 01 01 01 34 70 00 a0 a0 40 a0 60 30 20 '......4p...@.`0 '
  36 00 84 f2 10 00 00 18 00 00 00 fd 0c 3c f0 a7 '6............<..'
  a7 73 01 0a 20 20 20 20 20 20 00 00 00 fc 00 4e '.s..      .....N'
  45 31 38 30 51 44 4d 2d 4e 5a 34 0a 00 00 00 fe 'E180QDM-NZ4.....'
  00 42 4f 45 20 43 51 0a 20 20 20 20 20 20 01 5b '.BOE CQ.      .['
Checksum: 0x5b

----------------

Block 3, DisplayID Extension Block:
  Version: 2.0
  Extension Count: 0
  Display Parameters Data Block (0x21):
    Image size: 388.0 mm x 242.0 mm
    Display native pixel format: 2560x1600
    Scan Orientation: Left to Right, Top to Bottom
    Luminance Information: Minimum guaranteed value
    Color Information: CIE 1931
    Audio Speaker Information: not integrated
    Native Color Chromaticity:
      Primary #1:  (0.679932, 0.316895)
      Primary #2:  (0.264893, 0.688965)
      Primary #3:  (0.144775, 0.055908)
      White Point: (0.312988, 0.328857)
    Native Maximum Luminance (Full Coverage): 500.000000 cd/m^2
    Native Maximum Luminance (10% Rectangular Coverage): 500.000000 cd/m^2
    Native Minimum Luminance: 0.419922 cd/m^2
    Native Color Depth: 12 bpc
    Display Device Technology: Active Matrix LCD
    Native Gamma EOTF: 2.20
  Video Timing Modes Type 7 - Detailed Timings Data Block:
    DTD:  2560x1600  240.000000 Hz  16:10   422.400 kHz   1148.928000 MHz (aspect 16:10, no 3D stereo, preferred)
               Hfront   48 Hsync  32 Hback   80 Hpol N
               Vfront    3 Vsync   6 Vback  151 Vpol N
  Adaptive Sync Data Block:
    Descriptor #1:
      Native Panel Range
      Fixed Average V-Total and Adaptive V-Total
      Supports Seamless Transition
      'Max Single Frame Duration Increase' field value without jitter impact
      'Max Single Frame Duration Decrease' field value without jitter impact
      Max Duration Increase: 0.00 ms
      Max Duration Decrease: 0.00 ms
      Min Refresh Rate: 60 Hz
      Max Refresh Rate: 240 Hz
    Descriptor #2:
      Native Panel Range
      Fixed Average V-Total and Adaptive V-Total
      Supports Seamless Transition
      'Max Single Frame Duration Increase' field value without jitter impact
      'Max Single Frame Duration Decrease' field value without jitter impact
      Max Duration Increase: 0.00 ms
      Max Duration Decrease: 0.00 ms
      Min Refresh Rate: 50 Hz
      Max Refresh Rate: 60 Hz
  CTA-861 DisplayID Data Block:
  Vendor-Specific Data Block (AMD), OUI 00-00-1A:
    Version: 3
    Feature Caps: 0x01
    Minimum Refresh Rate: 60 Hz
    Maximum Refresh Rate: 240 Hz
    Flags 1.x: 0x00
    Flags 2.x: 0x00
  Checksum: 0x50
Checksum: 0x90

----------------

Warnings:

EDID:
  Base EDID: Some timings are out of range of the Monitor Ranges:
    Horizontal Freq: 105.602 - 422.400 kHz (Monitor: 422.000 - 422.000 kHz)

Failures:

Block 1, DisplayID Extension Block:
  Expected 0 DisplayID Extension Block, but got 1.
Block 2, Base EDID:
  Unknown Extension Block.
Block 3, DisplayID Extension Block:
  Product Type should be 0 in extension block.
  Display Parameters Data Block (0x21): Duplicate Display Parameters Data Block.
EDID:
  Base EDID: EDID specified 1 extension block(s), but found 3 extension block(s).

EDID conformity: FAIL
