edid-decode (hex):

00 ff ff ff ff ff ff 00 28 9a 39 14 00 00 00 00
1c 1f 01 04 a5 1f 11 78 02 fc 11 95 57 5f 90 28
1a 50 54 00 00 00 01 01 01 01 01 01 01 01 01 01
01 01 01 01 01 01 8b 39 80 10 71 38 28 40 2e 1e
24 00 35 ae 10 00 00 18 00 00 00 00 00 00 00 00
00 00 00 00 00 00 00 00 00 00 00 00 00 fe 00 47
31 34 30 45 43 30 32 0a 20 20 20 20 00 00 00 fe
00 47 31 34 30 45 43 30 32 0a 20 20 20 20 00 0e

00 ff ff ff ff ff ff 00 28 9a 39 14 00 00 00 00
1c 1f 01 04 a5 1f 11 78 02 fc 11 95 57 5f 90 28
1a 50 54 00 00 00 01 01 01 01 01 01 01 01 01 01
01 01 01 01 01 01 8b 39 80 10 71 38 28 40 2e 1e
24 00 35 ae 10 00 00 18 00 00 00 00 00 00 00 00
00 00 00 00 00 00 00 00 00 00 00 00 00 fe 00 47
31 34 30 45 43 30 32 0a 20 20 20 20 00 00 00 fe
00 47 31 34 30 45 43 30 32 0a 20 20 20 20 00 0e

----------------

Block 0, Base EDID:
  EDID Structure Version & Revision: 1.4
  Vendor & Product Identification:
    Manufacturer: JDZ
    Model: 5177
    Made in: week 28 of 2021
  Basic Display Parameters & Features:
    Digital display
    Bits per primary color channel: 8
    DisplayPort interface
    Maximum image size: 31 cm x 17 cm
    Gamma: 2.20
    Supported color formats: RGB 4:4:4
    First detailed timing includes the native pixel format and preferred refresh rate
  Color Characteristics:
    Red  : 0.5849, 0.3427
    Green: 0.3740, 0.5625
    Blue : 0.1562, 0.1025
    White: 0.3125, 0.3291
  Established Timings I & II: none
  Standard Timings: none
  Detailed Timing Descriptors:
    DTD 1:  1920x1080   60.003096 Hz  16:9     67.203 kHz    147.310000 MHz (309 mm x 174 mm)
                 Hfront   46 Hsync  30 Hback  196 Hpol N
                 Vfront    2 Vsync   4 Vback   34 Vpol N
    Empty Descriptor
    Alphanumeric Data String: 'G140EC02'
    Alphanumeric Data String: 'G140EC02'
Checksum: 0x0e

----------------

Warnings:

Block 0, Base EDID:
  Missing Display Product Name.

Failures:

Block 0, Base EDID:
  Empty Descriptor: Use Dummy Descriptor instead of all zeroes.
EDID:
  Extension Block 1 started with EDID header, ignoring Extension Blocks >= 1.

EDID conformity: FAIL
