edid-decode (hex):

00 ff ff ff ff ff ff 00 26 cd 07 66 01 01 01 01
0c 16 01 03 80 3c 22 78 2a 3d c5 a4 56 4e 9e 28
0f 50 54 bf ef 80 71 4f 81 40 81 80 95 00 a9 40
b3 00 61 68 61 7c 02 3a 80 18 71 38 2d 40 58 2c
45 00 56 50 21 00 00 1e 00 00 00 ff 00 31 31 31
36 30 32 31 32 30 30 31 30 34 00 00 00 fd 00 37
79 1e 8c 21 00 0a 20 20 20 20 20 00 00 00 00 fc
00 50 4c 47 32 37 37 33 0a 20 20 20 20 20 01 19

02 01 04 00 98 4a 00 e0 51 00 3d 40 60 90 13 00
56 50 21 00 00 1e 53 5b 00 f0 51 00 49 40 68 f8
13 00 56 50 21 00 00 1e fe 5b 80 a0 70 38 35 40
30 20 35 00 56 50 21 00 00 1a a9 65 80 a0 70 38
3a 40 30 20 35 00 56 50 21 00 00 1a 86 6f 80 a0
70 38 40 40 30 20 35 00 56 50 21 00 00 1a 00 00
00 00 00 00 00 00 00 00 00 00 00 00 00 00 00 00
00 00 00 00 00 00 00 00 00 00 00 00 00 00 00 5c

00 ff ff ff ff ff ff 00 26 cd 07 66 01 01 01 01
0c 16 01 03 80 3c 22 78 2a 3d c5 a4 56 4e 9e 28
0f 50 54 bf ef 80 71 4f 81 40 81 80 95 00 a9 40
b3 00 61 68 61 7c 02 3a 80 18 71 38 2d 40 58 2c
45 00 56 50 21 00 00 1e 00 00 00 ff 00 31 31 31
36 30 32 31 32 30 30 31 30 34 00 00 00 fd 00 37
79 1e 8c 21 00 0a 20 20 20 20 20 00 00 00 00 fc
00 50 4c 47 32 37 37 33 0a 20 20 20 20 20 01 19

02 01 04 00 98 4a 00 e0 51 00 3d 40 60 90 13 00
56 50 21 00 00 1e 53 5b 00 f0 51 00 49 40 68 f8
13 00 56 50 21 00 00 1e fe 5b 80 a0 70 38 35 40
30 20 35 00 56 50 21 00 00 1a a9 65 80 a0 70 38
3a 40 30 20 35 00 56 50 21 00 00 1a 86 6f 80 a0
70 38 40 40 30 20 35 00 56 50 21 00 00 1a 00 00
00 00 00 00 00 00 00 00 00 00 00 00 00 00 00 00
00 00 00 00 00 00 00 00 00 00 00 00 00 00 00 5c

----------------

Block 0, Base EDID:
  EDID Structure Version & Revision: 1.3
  Vendor & Product Identification:
    Manufacturer: IVM
    Model: 26119
    Serial Number: ...
    Made in: week 12 of 2012
  Basic Display Parameters & Features:
    Digital display
    Maximum image size: 60 cm x 34 cm
    Gamma: 2.20
    DPMS levels: Off
    RGB color display
    First detailed timing is the preferred timing
  Color Characteristics:
    Red  : 0.6406, 0.3388
    Green: 0.3076, 0.6181
    Blue : 0.1591, 0.0585
    White: 0.3134, 0.3291
  Established Timings I & II:
    IBM     :   720x400    70.081663 Hz   9:5     31.467 kHz     28.320000 MHz
    DMT 0x04:   640x480    59.940476 Hz   4:3     31.469 kHz     25.175000 MHz
    Apple   :   640x480    66.666667 Hz   4:3     35.000 kHz     30.240000 MHz
    DMT 0x05:   640x480    72.808802 Hz   4:3     37.861 kHz     31.500000 MHz
    DMT 0x06:   640x480    75.000000 Hz   4:3     37.500 kHz     31.500000 MHz
    DMT 0x08:   800x600    56.250000 Hz   4:3     35.156 kHz     36.000000 MHz
    DMT 0x09:   800x600    60.316541 Hz   4:3     37.879 kHz     40.000000 MHz
    DMT 0x0a:   800x600    72.187572 Hz   4:3     48.077 kHz     50.000000 MHz
    DMT 0x0b:   800x600    75.000000 Hz   4:3     46.875 kHz     49.500000 MHz
    Apple   :   832x624    74.551266 Hz   4:3     49.726 kHz     57.284000 MHz
    DMT 0x10:  1024x768    60.003840 Hz   4:3     48.363 kHz     65.000000 MHz
    DMT 0x11:  1024x768    70.069359 Hz   4:3     56.476 kHz     75.000000 MHz
    DMT 0x12:  1024x768    75.028582 Hz   4:3     60.023 kHz     78.750000 MHz
    DMT 0x24:  1280x1024   75.024675 Hz   5:4     79.976 kHz    135.000000 MHz
    Apple   :  1152x870    75.061550 Hz 192:145   68.681 kHz    100.000000 MHz
  Standard Timings:
    DMT 0x15:  1152x864    75.000000 Hz   4:3     67.500 kHz    108.000000 MHz
    DMT 0x20:  1280x960    60.000000 Hz   4:3     60.000 kHz    108.000000 MHz
    DMT 0x23:  1280x1024   60.019740 Hz   5:4     63.981 kHz    108.000000 MHz
    DMT 0x2f:  1440x900    59.887445 Hz  16:10    55.935 kHz    106.500000 MHz
    DMT 0x33:  1600x1200   60.000000 Hz   4:3     75.000 kHz    162.000000 MHz
    DMT 0x3a:  1680x1050   59.954250 Hz  16:10    65.290 kHz    146.250000 MHz
    GTF     :  1024x768   100.000177 Hz   4:3     81.400 kHz    113.309000 MHz
    GTF     :  1024x768   119.999931 Hz   4:3     98.760 kHz    139.054000 MHz
  Detailed Timing Descriptors:
    DTD 1:  1920x1080   60.000000 Hz  16:9     67.500 kHz    148.500000 MHz (598 mm x 336 mm)
                 Hfront   88 Hsync  44 Hback  148 Hpol P
                 Vfront    4 Vsync   5 Vback   36 Vpol P
    Display Product Serial Number: ...
    Display Range Limits:
      Monitor ranges (GTF): 55-121 Hz V, 30-140 kHz H, max dotclock 330 MHz
    Display Product Name: 'PLG2773'
  Extension blocks: 1
Checksum: 0x19

----------------

Block 1, CTA-861 Extension Block:
  Revision: 1
  Detailed Timing Descriptors:
    DTD 2:  1280x1024  100.000000 Hz   5:4    108.500 kHz    190.960000 MHz (598 mm x 336 mm)
                 Hfront   96 Hsync 144 Hback  240 Hpol P
                 Vfront    1 Vsync   3 Vback   57 Vpol P
    DTD 3:  1280x1024  119.998645 Hz   5:4    131.639 kHz    233.790000 MHz (598 mm x 336 mm)
                 Hfront  104 Hsync 248 Hback  144 Hpol P
                 Vfront    1 Vsync   3 Vback   69 Vpol P
    DTD 4:  1920x1080   99.930409 Hz  16:9    113.221 kHz    235.500000 MHz (598 mm x 336 mm)
                 Hfront   48 Hsync  32 Hback   80 Hpol P
                 Vfront    3 Vsync   5 Vback   45 Vpol N
    DTD 5:  1920x1080  109.947445 Hz  16:9    125.120 kHz    260.250000 MHz (598 mm x 336 mm)
                 Hfront   48 Hsync  32 Hback   80 Hpol P
                 Vfront    3 Vsync   5 Vback   50 Vpol N
    DTD 6:  1920x1080  119.982181 Hz  16:9    137.260 kHz    285.500000 MHz (598 mm x 336 mm)
                 Hfront   48 Hsync  32 Hback   80 Hpol P
                 Vfront    3 Vsync   5 Vback   56 Vpol N
Checksum: 0x5c  Unused space in Extension Block: 33 bytes

----------------

Warnings:

Block 0, Base EDID:
  Vendor & Product Identification: The serial number is one of the known dummy values, it should probably be set to 0.
  Detailed Timing Descriptor #1: DTD is identical to VIC 16, which is not present in the CTA Ext Block.
Block 1, CTA-861 Extension Block:
  Detailed Timing Descriptor #2: Image size is 598x336 mm, but based on the picture AR it should be 420x336 mm.
  Detailed Timing Descriptor #3: Image size is 598x336 mm, but based on the picture AR it should be 420x336 mm.
  Display Product Serial Number is set, so the Serial Number in the Base EDID should be 0.
  Add a Colorimetry Data Block with the sRGB colorimetry bit set to avoid interop issues.

Failures:

Block 0, Base EDID:
  Display Range Limits: Bytes 12-17 must be 0x20.
Block 1, CTA-861 Extension Block:
  Missing VCDB, needed for Set Selectable RGB Quantization to avoid interop issues.
EDID:
  Extension Block 2 started with EDID header, ignoring Extension Blocks >= 2.

EDID conformity: FAIL
