edid-decode (hex):

00 ff ff ff ff ff ff 00 4c 83 46 4c 00 00 00 00
00 19 01 04 95 22 13 78 0a c5 a5 a3 57 4f 9c 26
14 50 54 00 00 00 01 01 01 01 01 01 01 01 01 01
01 01 01 01 01 01 d8 cc 00 a0 f0 70 19 80 30 20
26 00 58 c2 10 00 00 1a d8 cc 00 e0 f1 70 71 81
30 20 26 00 58 c2 10 00 00 1a 00 00 00 fe 00 32
30 33 38 57 83 31 35 36 46 4c 0a 20 00 00 00 00
00 02 41 21 9e 61 00 00 00 0b 01 0a 20 20 00 c0

00 ff ff ff ff ff ff 00 4c 83 46 4c 00 00 00 00
00 19 01 04 95 22 13 78 0a c5 a5 a3 57 4f 9c 26
14 50 54 00 00 00 01 01 01 01 01 01 01 01 01 01
01 01 01 01 01 01 d8 cc 00 a0 f0 70 19 80 30 20
26 00 58 c2 10 00 00 1a d8 cc 00 e0 f1 70 71 81
30 20 26 00 58 c2 10 00 00 1a 00 00 00 fe 00 32
30 33 38 57 83 31 35 36 46 4c 0a 20 00 00 00 00
00 02 41 21 9e 61 00 00 00 0b 01 0a 20 20 00 c0

----------------

Block 0, Base EDID:
  EDID Structure Version & Revision: 1.4
  Vendor & Product Identification:
    Manufacturer: SDC
    Model: 19526
    Made in: 2015
  Basic Display Parameters & Features:
    Digital display
    Bits per primary color channel: 6
    DisplayPort interface
    Maximum image size: 34 cm x 19 cm
    Gamma: 2.20
    Supported color formats: RGB 4:4:4, YCrCb 4:4:4
    First detailed timing includes the native pixel format and preferred refresh rate
  Color Characteristics:
    Red  : 0.6396, 0.3398
    Green: 0.3095, 0.6103
    Blue : 0.1503, 0.0800
    White: 0.3134, 0.3291
  Established Timings I & II: none
  Standard Timings: none
  Detailed Timing Descriptors:
    DTD 1:  3840x2160   60.000000 Hz  16:9    131.100 kHz    524.400000 MHz (344 mm x 194 mm)
                 Hfront   48 Hsync  32 Hback   80 Hpol P
                 Vfront    2 Vsync   6 Vback   17 Vpol N
    DTD 2:  3840x2160   47.998770 Hz  16:9    121.389 kHz    524.400000 MHz (344 mm x 194 mm)
                 Hfront   48 Hsync  32 Hback  400 Hpol P
                 Vfront    2 Vsync   6 Vback  361 Vpol N
    Alphanumeric Data String: '2038W.156FL'
    Manufacturer-Specified Display Descriptor (0x00): 00 00 00 02 41 21 9e 61 00 00 00 0b 01 0a 20 20 '....A!.a......  '
Checksum: 0xc0

----------------

Block 1, Unknown EDID Extension Block 0x00:
  00 ff ff ff ff ff ff 00 4c 83 46 4c 00 00 00 00 '........L.FL....'
  00 19 01 04 95 22 13 78 0a c5 a5 a3 57 4f 9c 26 '.....".x....WO.&'
  14 50 54 00 00 00 01 01 01 01 01 01 01 01 01 01 '.PT.............'
  01 01 01 01 01 01 d8 cc 00 a0 f0 70 19 80 30 20 '...........p..0 '
  26 00 58 c2 10 00 00 1a d8 cc 00 e0 f1 70 71 81 '&.X..........pq.'
  30 20 26 00 58 c2 10 00 00 1a 00 00 00 fe 00 32 '0 &.X..........2'
  30 33 38 57 83 31 35 36 46 4c 0a 20 00 00 00 00 '038W.156FL. ....'
  00 02 41 21 9e 61 00 00 00 0b 01 0a 20 20 00 c0 '..A!.a......  ..'
Checksum: 0xc0

----------------

Warnings:

Block 0, Base EDID:
  Alphanumeric Data String: Non-ASCII character 0x83 at position 5, can cause problems.
  Missing Display Product Name.

Failures:

Block 1, Base EDID:
  Unknown Extension Block.
EDID:
  Base EDID: EDID specified 0 extension block(s), but found 1 extension block(s).

EDID conformity: FAIL
