edid-decode (hex):

00 ff ff ff ff ff ff 00 06 af b2 5e 00 00 00 00
12 22 01 04 a5 22 16 78 03 2d e5 ae 51 44 ae 24
0d 50 54 00 00 00 01 01 01 01 01 01 01 01 01 01
01 01 01 01 01 01 03 3e 80 a0 70 b0 48 40 30 20
35 00 58 d7 10 00 00 1a 00 00 00 fd 00 1e 78 99
99 20 01 0a 20 20 20 20 20 20 00 00 00 fe 00 38
52 34 43 58 80 42 31 36 30 55 41 4e 00 00 00 00
00 02 41 0c b2 00 03 00 00 0a 41 0a 20 20 01 03

70 20 79 02 00 20 00 13 4f 55 41 b2 5e 00 00 00
00 12 18 07 42 31 36 30 55 41 4e 21 01 1d 77 0d
6a 08 80 07 b0 04 88 e1 ea 51 3d a4 b0 66 52 0f
02 35 54 d0 5f d0 5f 00 38 12 78 22 00 14 33 d8
04 85 7f 07 9f 00 2f 80 1f 00 af 04 47 00 02 00
04 00 2b 00 06 27 00 1e 77 00 00 2e 00 06 40 4e
d0 5f d0 5f 00 00 00 00 00 00 00 00 00 00 00 00
00 00 00 00 00 00 00 00 00 00 00 00 00 00 6e 90

00 ff ff ff ff ff ff 00 06 af b2 5e 00 00 00 00
12 22 01 04 a5 22 16 78 03 2d e5 ae 51 44 ae 24
0d 50 54 00 00 00 01 01 01 01 01 01 01 01 01 01
01 01 01 01 01 01 03 3e 80 a0 70 b0 48 40 30 20
35 00 58 d7 10 00 00 1a 00 00 00 fd 00 1e 78 99
99 20 01 0a 20 20 20 20 20 20 00 00 00 fe 00 38
52 34 43 58 80 42 31 36 30 55 41 4e 00 00 00 00
00 02 41 0c b2 00 03 00 00 0a 41 0a 20 20 01 03

70 20 79 02 00 20 00 13 4f 55 41 b2 5e 00 00 00
00 12 18 07 42 31 36 30 55 41 4e 21 01 1d 77 0d
6a 08 80 07 b0 04 88 e1 ea 51 3d a4 b0 66 52 0f
02 35 54 d0 5f d0 5f 00 38 12 78 22 00 14 33 d8
04 85 7f 07 9f 00 2f 80 1f 00 af 04 47 00 02 00
04 00 2b 00 06 27 00 1e 77 00 00 2e 00 06 40 4e
d0 5f d0 5f 00 00 00 00 00 00 00 00 00 00 00 00
00 00 00 00 00 00 00 00 00 00 00 00 00 00 6e 90

----------------

Block 0, Base EDID:
  EDID Structure Version & Revision: 1.4
  Vendor & Product Identification:
    Manufacturer: AUO
    Model: 24242
    Made in: week 18 of 2024
  Basic Display Parameters & Features:
    Digital display
    Bits per primary color channel: 8
    DisplayPort interface
    Maximum image size: 34 cm x 22 cm
    Gamma: 2.20
    Supported color formats: RGB 4:4:4
    First detailed timing includes the native pixel format and preferred refresh rate
    Display supports continuous frequencies
  Color Characteristics:
    Red  : 0.6796, 0.3183
    Green: 0.2685, 0.6806
    Blue : 0.1435, 0.0527
    White: 0.3134, 0.3291
  Established Timings I & II: none
  Standard Timings: none
  Detailed Timing Descriptors:
    DTD 1:  1920x1200   60.001663 Hz  16:10    76.322 kHz    158.750000 MHz (344 mm x 215 mm)
                 Hfront   48 Hsync  32 Hback   80 Hpol P
                 Vfront    3 Vsync   5 Vback   64 Vpol N
    Display Range Limits:
      Monitor ranges (Range Limits Only): 30-120 Hz V, 153-153 kHz H, max dotclock 320 MHz
    Alphanumeric Data String: '8R4CX.B160UAN'
    Manufacturer-Specified Display Descriptor (0x00): 00 00 00 02 41 0c b2 00 03 00 00 0a 41 0a 20 20 '....A.......A.  '
  Extension blocks: 1
Checksum: 0x03

----------------

Block 1, DisplayID Extension Block:
  Version: 2.0
  Extension Count: 0
  Display Product Primary Use Case: None of the listed primary use cases; generic display
  Product Identification Data Block (0x20), OUI 4F-55-41:
    Product Code: 24242
    Year of Manufacture: 2024, Week 18
    Product ID: B160UAN
  Display Parameters Data Block (0x21):
    Image size: 344.7 mm x 215.4 mm
    Display native pixel format: 1920x1200
    Scan Orientation: Left to Right, Top to Bottom
    Luminance Information: Guidance for the Source device
    Color Information: CIE 1931
    Audio Speaker Information: not integrated
    Native Color Chromaticity:
      Primary #1:  (0.679932, 0.319824)
      Primary #2:  (0.264893, 0.689941)
      Primary #3:  (0.149902, 0.059814)
      White Point: (0.312988, 0.328857)
    Native Maximum Luminance (Full Coverage): 500.000000 cd/m^2
    Native Maximum Luminance (10% Rectangular Coverage): 500.000000 cd/m^2
    Native Minimum Luminance: 0.500000 cd/m^2
    Native Color Depth: 8 bpc
    Display Device Technology: Active Matrix LCD
    Display Device Theme Preference: No Preference
    Native Gamma EOTF: 2.20
  Video Timing Modes Type 7 - Detailed Timings Data Block:
    DTD:  1920x1200  120.000302 Hz  16:10   152.640 kHz    317.492000 MHz (aspect 16:10, no 3D stereo, preferred)
               Hfront   48 Hsync  32 Hback   80 Hpol P
               Vfront    3 Vsync   5 Vback   64 Vpol N
  Adaptive Sync Data Block:
    Descriptor #1:
      Native Panel Range
      Fixed Average V-Total and Adaptive V-Total
      Supports Seamless Transition
      'Max Single Frame Duration Increase' field value without jitter impact
      'Max Single Frame Duration Decrease' field value without jitter impact
      Max Duration Increase: 0.00 ms
      Max Duration Decrease: 0.00 ms
      Min Refresh Rate: 30 Hz
      Max Refresh Rate: 120 Hz
  Brightness Luminance Range Data Block:
    Minimum SDR Luminance (Full Coverage): 25.000000 cd/m^2
    Maximum Suggested SDR Luminance (Full Coverage): 500.000000 cd/m^2
    Maximum Boost SDR Luminance: 500.000000 cd/m^2
  Checksum: 0x6e
Checksum: 0x90

----------------

Warnings:

Block 0, Base EDID:
  Alphanumeric Data String: Non-ASCII character 0x80 at position 5, can cause problems.
  Missing Display Product Name.
Block 1, DisplayID Extension Block:
  Product Identification Data Block (0x20), OUI 4F-55-41: Unknown OUI 4F-55-41 (possible PNP OUA).
EDID:
  Base EDID: Some timings are out of range of the Monitor Ranges:
    Horizontal Freq: 76.322 - 152.640 kHz (Monitor: 153.000 - 153.000 kHz)

Failures:

EDID:
  Extension Block 2 started with EDID header, ignoring Extension Blocks >= 2.

EDID conformity: FAIL
