edid-decode (hex):

00 ff ff ff ff ff ff 00 4c 2d 32 0d 43 4a 58 43
0d 20 01 03 80 3c 22 78 2a 52 95 a5 56 54 9d 25
0e 50 54 bb 8c 00 b3 00 81 c0 81 00 81 80 95 00
a9 c0 01 01 01 01 02 3a 80 18 71 38 2d 40 58 2c
45 00 56 50 21 00 00 1e 00 00 00 fd 00 30 48 1e
52 16 00 0a 20 20 20 20 20 20 00 00 00 fc 00 43
32 37 46 33 39 30 0a 20 20 20 20 20 00 00 00 ff
00 48 34 5a 54 33 30 35 31 32 33 0a 20 20 01 d9

02 03 24 f1 46 90 04 1f 13 12 03 23 09 07 07 83
01 00 00 67 03 0c 00 10 00 80 2b 68 1a 00 00 01
01 30 48 00 01 1d 00 bc 52 d0 1e 20 b8 28 55 40
56 50 21 00 00 1e 8c 0a d0 90 20 40 31 20 0c 40
55 00 56 50 21 00 00 18 8c 0a d0 8a 20 e0 2d 10
10 3e 96 00 56 50 21 00 00 18 21 52 80 a0 72 38
30 40 88 c8 35 00 56 50 21 00 00 1c 00 00 00 00
00 00 00 00 00 00 00 00 00 00 00 00 00 00 00 1a

00 ff ff ff ff ff ff 00 4c 2d 32 0d 43 4a 58 43
0d 20 01 03 80 3c 22 78 2a 52 95 a5 56 54 9d 25
0e 50 54 bb 8c 00 b3 00 81 c0 81 00 81 80 95 00
a9 c0 01 01 01 01 02 3a 80 18 71 38 2d 40 58 2c
45 00 56 50 21 00 00 1e 00 00 00 fd 00 30 48 1e
52 16 00 0a 20 20 20 20 20 20 00 00 00 fc 00 43
32 37 46 33 39 30 0a 20 20 20 20 20 00 00 00 ff
00 48 34 5a 54 33 30 35 31 32 33 0a 20 20 01 d9

02 03 24 f1 46 90 04 1f 13 12 03 23 09 07 07 83
01 00 00 67 03 0c 00 10 00 80 2b 68 1a 00 00 01
01 30 48 00 01 1d 00 bc 52 d0 1e 20 b8 28 55 40
56 50 21 00 00 1e 8c 0a d0 90 20 40 31 20 0c 40
55 00 56 50 21 00 00 18 8c 0a d0 8a 20 e0 2d 10
10 3e 96 00 56 50 21 00 00 18 21 52 80 a0 72 38
30 40 88 c8 35 00 56 50 21 00 00 1c 00 00 00 00
00 00 00 00 00 00 00 00 00 00 00 00 00 00 00 1a

00 ff ff ff ff ff ff 00 4c 2d 32 0d 43 4a 58 43
0d 20 01 03 80 3c 22 78 2a 52 95 a5 56 54 9d 25
0e 50 54 bb 8c 00 b3 00 81 c0 81 00 81 80 95 00
a9 c0 01 01 01 01 02 3a 80 18 71 38 2d 40 58 2c
45 00 56 50 21 00 00 1e 00 00 00 fd 00 30 48 1e
52 16 00 0a 20 20 20 20 20 20 00 00 00 fc 00 43
32 37 46 33 39 30 0a 20 20 20 20 20 00 00 00 ff
00 48 34 5a 54 33 30 35 31 32 33 0a 20 20 01 d9

02 03 24 f1 46 90 04 1f 13 12 03 23 09 07 07 83
01 00 00 67 03 0c 00 10 00 80 2b 68 1a 00 00 01
01 30 48 00 01 1d 00 bc 52 d0 1e 20 b8 28 55 40
56 50 21 00 00 1e 8c 0a d0 90 20 40 31 20 0c 40
55 00 56 50 21 00 00 18 8c 0a d0 8a 20 e0 2d 10
10 3e 96 00 56 50 21 00 00 18 21 52 80 a0 72 38
30 40 88 c8 35 00 56 50 21 00 00 1c 00 00 00 00
00 00 00 00 00 00 00 00 00 00 00 00 00 00 00 1a

00 ff ff ff ff ff ff 00 4c 2d 32 0d 43 4a 58 43
0d 20 01 03 80 3c 22 78 2a 52 95 a5 56 54 9d 25
0e 50 54 bb 8c 00 b3 00 81 c0 81 00 81 80 95 00
a9 c0 01 01 01 01 02 3a 80 18 71 38 2d 40 58 2c
45 00 56 50 21 00 00 1e 00 00 00 fd 00 30 48 1e
52 16 00 0a 20 20 20 20 20 20 00 00 00 fc 00 43
32 37 46 33 39 30 0a 20 20 20 20 20 00 00 00 ff
00 48 34 5a 54 33 30 35 31 32 33 0a 20 20 01 d9

02 03 24 f1 46 90 04 1f 13 12 03 23 09 07 07 83
01 00 00 67 03 0c 00 10 00 80 2b 68 1a 00 00 01
01 30 48 00 01 1d 00 bc 52 d0 1e 20 b8 28 55 40
56 50 21 00 00 1e 8c 0a d0 90 20 40 31 20 0c 40
55 00 56 50 21 00 00 18 8c 0a d0 8a 20 e0 2d 10
10 3e 96 00 56 50 21 00 00 18 21 52 80 a0 72 38
30 40 88 c8 35 00 56 50 21 00 00 1c 00 00 00 00
00 00 00 00 00 00 00 00 00 00 00 00 00 00 00 1a

00 ff ff ff ff ff ff 00 4c 2d 32 0d 43 4a 58 43
0d 20 01 03 80 3c 22 78 2a 52 95 a5 56 54 9d 25
0e 50 54 bb 8c 00 b3 00 81 c0 81 00 81 80 95 00
a9 c0 01 01 01 01 02 3a 80 18 71 38 2d 40 58 2c
45 00 56 50 21 00 00 1e 00 00 00 fd 00 30 48 1e
52 16 00 0a 20 20 20 20 20 20 00 00 00 fc 00 43
32 37 46 33 39 30 0a 20 20 20 20 20 00 00 00 ff
00 48 34 5a 54 33 30 35 31 32 33 0a 20 20 01 d9

02 03 24 f1 46 90 04 1f 13 12 03 23 09 07 07 83
01 00 00 67 03 0c 00 10 00 80 2b 68 1a 00 00 01
01 30 48 00 01 1d 00 bc 52 d0 1e 20 b8 28 55 40
56 50 21 00 00 1e 8c 0a d0 90 20 40 31 20 0c 40
55 00 56 50 21 00 00 18 8c 0a d0 8a 20 e0 2d 10
10 3e 96 00 56 50 21 00 00 18 21 52 80 a0 72 38
30 40 88 c8 35 00 56 50 21 00 00 1c 00 00 00 00
00 00 00 00 00 00 00 00 00 00 00 00 00 00 00 1a

00 ff ff ff ff ff ff 00 4c 2d 32 0d 43 4a 58 43
0d 20 01 03 80 3c 22 78 2a 52 95 a5 56 54 9d 25
0e 50 54 bb 8c 00 b3 00 81 c0 81 00 81 80 95 00
a9 c0 01 01 01 01 02 3a 80 18 71 38 2d 40 58 2c
45 00 56 50 21 00 00 1e 00 00 00 fd 00 30 48 1e
52 16 00 0a 20 20 20 20 20 20 00 00 00 fc 00 43
32 37 46 33 39 30 0a 20 20 20 20 20 00 00 00 ff
00 48 34 5a 54 33 30 35 31 32 33 0a 20 20 01 d9

02 03 24 f1 46 90 04 1f 13 12 03 23 09 07 07 83
01 00 00 67 03 0c 00 10 00 80 2b 68 1a 00 00 01
01 30 48 00 01 1d 00 bc 52 d0 1e 20 b8 28 55 40
56 50 21 00 00 1e 8c 0a d0 90 20 40 31 20 0c 40
55 00 56 50 21 00 00 18 8c 0a d0 8a 20 e0 2d 10
10 3e 96 00 56 50 21 00 00 18 21 52 80 a0 72 38
30 40 88 c8 35 00 56 50 21 00 00 1c 00 00 00 00
00 00 00 00 00 00 00 00 00 00 00 00 00 00 00 1a

----------------

Block 0, Base EDID:
  EDID Structure Version & Revision: 1.3
  Vendor & Product Identification:
    Manufacturer: SAM
    Model: 3378
    Serial Number: ...
    Made in: week 13 of 2022
  Basic Display Parameters & Features:
    Digital display
    Maximum image size: 60 cm x 34 cm
    Gamma: 2.20
    DPMS levels: Off
    RGB color display
    First detailed timing is the preferred timing
  Color Characteristics:
    Red  : 0.6455, 0.3369
    Green: 0.3281, 0.6152
    Blue : 0.1464, 0.0556
    White: 0.3134, 0.3291
  Established Timings I & II:
    IBM     :   720x400    70.081663 Hz   9:5     31.467 kHz     28.320000 MHz
    DMT 0x04:   640x480    59.940476 Hz   4:3     31.469 kHz     25.175000 MHz
    Apple   :   640x480    66.666667 Hz   4:3     35.000 kHz     30.240000 MHz
    DMT 0x05:   640x480    72.808802 Hz   4:3     37.861 kHz     31.500000 MHz
    DMT 0x08:   800x600    56.250000 Hz   4:3     35.156 kHz     36.000000 MHz
    DMT 0x09:   800x600    60.316541 Hz   4:3     37.879 kHz     40.000000 MHz
    DMT 0x0a:   800x600    72.187572 Hz   4:3     48.077 kHz     50.000000 MHz
    DMT 0x10:  1024x768    60.003840 Hz   4:3     48.363 kHz     65.000000 MHz
    DMT 0x11:  1024x768    70.069359 Hz   4:3     56.476 kHz     75.000000 MHz
  Standard Timings:
    DMT 0x3a:  1680x1050   59.954250 Hz  16:10    65.290 kHz    146.250000 MHz
    DMT 0x55:  1280x720    60.000000 Hz  16:9     45.000 kHz     74.250000 MHz
    DMT 0x1c:  1280x800    59.810326 Hz  16:10    49.702 kHz     83.500000 MHz
    DMT 0x23:  1280x1024   60.019740 Hz   5:4     63.981 kHz    108.000000 MHz
    DMT 0x2f:  1440x900    59.887445 Hz  16:10    55.935 kHz    106.500000 MHz
    DMT 0x53:  1600x900    60.000000 Hz  16:9     60.000 kHz    108.000000 MHz (RB)
  Detailed Timing Descriptors:
    DTD  1:  1920x1080   60.000000 Hz  16:9     67.500 kHz    148.500000 MHz (598 mm x 336 mm)
                  Hfront   88 Hsync  44 Hback  148 Hpol P
                  Vfront    4 Vsync   5 Vback   36 Vpol P
    Display Range Limits:
      Monitor ranges (GTF): 48-72 Hz V, 30-82 kHz H, max dotclock 220 MHz
    Display Product Name: 'C27F390'
    Display Product Serial Number: ...
  Extension blocks: 1
Checksum: 0xd9

----------------

Block 1, CTA-861 Extension Block:
  Revision: 3
  Underscans IT Video Formats by default
  Basic audio support
  Supports YCbCr 4:4:4
  Supports YCbCr 4:2:2
  Native detailed modes: 1
  Video Data Block:
    VIC  16:  1920x1080   60.000000 Hz  16:9     67.500 kHz    148.500000 MHz (native)
    VIC   4:  1280x720    60.000000 Hz  16:9     45.000 kHz     74.250000 MHz
    VIC  31:  1920x1080   50.000000 Hz  16:9     56.250 kHz    148.500000 MHz
    VIC  19:  1280x720    50.000000 Hz  16:9     37.500 kHz     74.250000 MHz
    VIC  18:   720x576    50.000000 Hz  16:9     31.250 kHz     27.000000 MHz
    VIC   3:   720x480    59.940060 Hz  16:9     31.469 kHz     27.000000 MHz
  Audio Data Block:
    Linear PCM:
      Max channels: 2
      Supported sample rates (kHz): 48 44.1 32
      Supported sample sizes (bits): 24 20 16
  Speaker Allocation Data Block:
    FL/FR - Front Left/Right
  Vendor-Specific Data Block (HDMI), OUI 00-0C-03:
    Source physical address: 1.0.0.0
    Supports_AI
    Maximum TMDS clock: 215 MHz
  Vendor-Specific Data Block (AMD), OUI 00-00-1A:
    Version: 1
    Feature Caps: 0x01
    Minimum Refresh Rate: 48 Hz
    Maximum Refresh Rate: 72 Hz
    Flags 1.x: 0x00
  Detailed Timing Descriptors:
    DTD  2:  1280x720    50.000000 Hz  16:9     37.500 kHz     74.250000 MHz (598 mm x 336 mm)
                  Hfront  440 Hsync  40 Hback  220 Hpol P
                  Vfront    5 Vsync   5 Vback   20 Vpol P
    DTD  3:   720x576    50.000000 Hz   5:4     31.250 kHz     27.000000 MHz (598 mm x 336 mm)
                  Hfront   12 Hsync  64 Hback   68 Hpol N
                  Vfront    5 Vsync   5 Vback   39 Vpol N
    DTD  4:   720x480    59.940060 Hz   3:2     31.469 kHz     27.000000 MHz (598 mm x 336 mm)
                  Hfront   16 Hsync  62 Hback   60 Hpol N
                  Vfront    9 Vsync   6 Vback   30 Vpol N
    DTD  5:  1920x1080   71.910434 Hz  16:9     81.115 kHz    210.250000 MHz (598 mm x 336 mm)
                  Hfront  136 Hsync 200 Hback  336 Hpol N
                  Vfront    3 Vsync   5 Vback   40 Vpol P
Checksum: 0x1a  Unused space in Extension Block: 19 bytes

----------------

Block 2, Unknown EDID Extension Block 0x00:
  00 ff ff ff ff ff ff 00 4c 2d 32 0d 43 4a 58 43 '........L-2.CJXC'
  0d 20 01 03 80 3c 22 78 2a 52 95 a5 56 54 9d 25 '. ...<"x*R..VT.%'
  0e 50 54 bb 8c 00 b3 00 81 c0 81 00 81 80 95 00 '.PT.............'
  a9 c0 01 01 01 01 02 3a 80 18 71 38 2d 40 58 2c '.......:..q8-@X,'
  45 00 56 50 21 00 00 1e 00 00 00 fd 00 30 48 1e 'E.VP!........0H.'
  52 16 00 0a 20 20 20 20 20 20 00 00 00 fc 00 43 'R...      .....C'
  32 37 46 33 39 30 0a 20 20 20 20 20 00 00 00 ff '27F390.     ....'
  00 48 34 5a 54 33 30 35 31 32 33 0a 20 20 01 d9 '.H4ZT305123.  ..'
Checksum: 0xd9

----------------

Block 3, CTA-861 Extension Block:
  Revision: 3
  Underscans IT Video Formats by default
  Basic audio support
  Supports YCbCr 4:4:4
  Supports YCbCr 4:2:2
  Native detailed modes: 1
  Video Data Block:
    VIC  16:  1920x1080   60.000000 Hz  16:9     67.500 kHz    148.500000 MHz (native)
    VIC   4:  1280x720    60.000000 Hz  16:9     45.000 kHz     74.250000 MHz
    VIC  31:  1920x1080   50.000000 Hz  16:9     56.250 kHz    148.500000 MHz
    VIC  19:  1280x720    50.000000 Hz  16:9     37.500 kHz     74.250000 MHz
    VIC  18:   720x576    50.000000 Hz  16:9     31.250 kHz     27.000000 MHz
    VIC   3:   720x480    59.940060 Hz  16:9     31.469 kHz     27.000000 MHz
  Audio Data Block:
    Linear PCM:
      Max channels: 2
      Supported sample rates (kHz): 48 44.1 32
      Supported sample sizes (bits): 24 20 16
  Speaker Allocation Data Block:
    FL/FR - Front Left/Right
  Vendor-Specific Data Block (HDMI), OUI 00-0C-03:
    Source physical address: 1.0.0.0
    Supports_AI
    Maximum TMDS clock: 215 MHz
  Vendor-Specific Data Block (AMD), OUI 00-00-1A:
    Version: 1
    Feature Caps: 0x01
    Minimum Refresh Rate: 48 Hz
    Maximum Refresh Rate: 72 Hz
    Flags 1.x: 0x00
  Detailed Timing Descriptors:
    DTD  6:  1280x720    50.000000 Hz  16:9     37.500 kHz     74.250000 MHz (598 mm x 336 mm)
                  Hfront  440 Hsync  40 Hback  220 Hpol P
                  Vfront    5 Vsync   5 Vback   20 Vpol P
    DTD  7:   720x576    50.000000 Hz   5:4     31.250 kHz     27.000000 MHz (598 mm x 336 mm)
                  Hfront   12 Hsync  64 Hback   68 Hpol N
                  Vfront    5 Vsync   5 Vback   39 Vpol N
    DTD  8:   720x480    59.940060 Hz   3:2     31.469 kHz     27.000000 MHz (598 mm x 336 mm)
                  Hfront   16 Hsync  62 Hback   60 Hpol N
                  Vfront    9 Vsync   6 Vback   30 Vpol N
    DTD  9:  1920x1080   71.910434 Hz  16:9     81.115 kHz    210.250000 MHz (598 mm x 336 mm)
                  Hfront  136 Hsync 200 Hback  336 Hpol N
                  Vfront    3 Vsync   5 Vback   40 Vpol P
Checksum: 0x1a  Unused space in Extension Block: 19 bytes

----------------

Block 4, Unknown EDID Extension Block 0x00:
  00 ff ff ff ff ff ff 00 4c 2d 32 0d 43 4a 58 43 '........L-2.CJXC'
  0d 20 01 03 80 3c 22 78 2a 52 95 a5 56 54 9d 25 '. ...<"x*R..VT.%'
  0e 50 54 bb 8c 00 b3 00 81 c0 81 00 81 80 95 00 '.PT.............'
  a9 c0 01 01 01 01 02 3a 80 18 71 38 2d 40 58 2c '.......:..q8-@X,'
  45 00 56 50 21 00 00 1e 00 00 00 fd 00 30 48 1e 'E.VP!........0H.'
  52 16 00 0a 20 20 20 20 20 20 00 00 00 fc 00 43 'R...      .....C'
  32 37 46 33 39 30 0a 20 20 20 20 20 00 00 00 ff '27F390.     ....'
  00 48 34 5a 54 33 30 35 31 32 33 0a 20 20 01 d9 '.H4ZT305123.  ..'
Checksum: 0xd9

----------------

Block 5, CTA-861 Extension Block:
  Revision: 3
  Underscans IT Video Formats by default
  Basic audio support
  Supports YCbCr 4:4:4
  Supports YCbCr 4:2:2
  Native detailed modes: 1
  Video Data Block:
    VIC  16:  1920x1080   60.000000 Hz  16:9     67.500 kHz    148.500000 MHz (native)
    VIC   4:  1280x720    60.000000 Hz  16:9     45.000 kHz     74.250000 MHz
    VIC  31:  1920x1080   50.000000 Hz  16:9     56.250 kHz    148.500000 MHz
    VIC  19:  1280x720    50.000000 Hz  16:9     37.500 kHz     74.250000 MHz
    VIC  18:   720x576    50.000000 Hz  16:9     31.250 kHz     27.000000 MHz
    VIC   3:   720x480    59.940060 Hz  16:9     31.469 kHz     27.000000 MHz
  Audio Data Block:
    Linear PCM:
      Max channels: 2
      Supported sample rates (kHz): 48 44.1 32
      Supported sample sizes (bits): 24 20 16
  Speaker Allocation Data Block:
    FL/FR - Front Left/Right
  Vendor-Specific Data Block (HDMI), OUI 00-0C-03:
    Source physical address: 1.0.0.0
    Supports_AI
    Maximum TMDS clock: 215 MHz
  Vendor-Specific Data Block (AMD), OUI 00-00-1A:
    Version: 1
    Feature Caps: 0x01
    Minimum Refresh Rate: 48 Hz
    Maximum Refresh Rate: 72 Hz
    Flags 1.x: 0x00
  Detailed Timing Descriptors:
    DTD 10:  1280x720    50.000000 Hz  16:9     37.500 kHz     74.250000 MHz (598 mm x 336 mm)
                  Hfront  440 Hsync  40 Hback  220 Hpol P
                  Vfront    5 Vsync   5 Vback   20 Vpol P
    DTD 11:   720x576    50.000000 Hz   5:4     31.250 kHz     27.000000 MHz (598 mm x 336 mm)
                  Hfront   12 Hsync  64 Hback   68 Hpol N
                  Vfront    5 Vsync   5 Vback   39 Vpol N
    DTD 12:   720x480    59.940060 Hz   3:2     31.469 kHz     27.000000 MHz (598 mm x 336 mm)
                  Hfront   16 Hsync  62 Hback   60 Hpol N
                  Vfront    9 Vsync   6 Vback   30 Vpol N
    DTD 13:  1920x1080   71.910434 Hz  16:9     81.115 kHz    210.250000 MHz (598 mm x 336 mm)
                  Hfront  136 Hsync 200 Hback  336 Hpol N
                  Vfront    3 Vsync   5 Vback   40 Vpol P
Checksum: 0x1a  Unused space in Extension Block: 19 bytes

----------------

Block 6, Unknown EDID Extension Block 0x00:
  00 ff ff ff ff ff ff 00 4c 2d 32 0d 43 4a 58 43 '........L-2.CJXC'
  0d 20 01 03 80 3c 22 78 2a 52 95 a5 56 54 9d 25 '. ...<"x*R..VT.%'
  0e 50 54 bb 8c 00 b3 00 81 c0 81 00 81 80 95 00 '.PT.............'
  a9 c0 01 01 01 01 02 3a 80 18 71 38 2d 40 58 2c '.......:..q8-@X,'
  45 00 56 50 21 00 00 1e 00 00 00 fd 00 30 48 1e 'E.VP!........0H.'
  52 16 00 0a 20 20 20 20 20 20 00 00 00 fc 00 43 'R...      .....C'
  32 37 46 33 39 30 0a 20 20 20 20 20 00 00 00 ff '27F390.     ....'
  00 48 34 5a 54 33 30 35 31 32 33 0a 20 20 01 d9 '.H4ZT305123.  ..'
Checksum: 0xd9

----------------

Block 7, CTA-861 Extension Block:
  Revision: 3
  Underscans IT Video Formats by default
  Basic audio support
  Supports YCbCr 4:4:4
  Supports YCbCr 4:2:2
  Native detailed modes: 1
  Video Data Block:
    VIC  16:  1920x1080   60.000000 Hz  16:9     67.500 kHz    148.500000 MHz (native)
    VIC   4:  1280x720    60.000000 Hz  16:9     45.000 kHz     74.250000 MHz
    VIC  31:  1920x1080   50.000000 Hz  16:9     56.250 kHz    148.500000 MHz
    VIC  19:  1280x720    50.000000 Hz  16:9     37.500 kHz     74.250000 MHz
    VIC  18:   720x576    50.000000 Hz  16:9     31.250 kHz     27.000000 MHz
    VIC   3:   720x480    59.940060 Hz  16:9     31.469 kHz     27.000000 MHz
  Audio Data Block:
    Linear PCM:
      Max channels: 2
      Supported sample rates (kHz): 48 44.1 32
      Supported sample sizes (bits): 24 20 16
  Speaker Allocation Data Block:
    FL/FR - Front Left/Right
  Vendor-Specific Data Block (HDMI), OUI 00-0C-03:
    Source physical address: 1.0.0.0
    Supports_AI
    Maximum TMDS clock: 215 MHz
  Vendor-Specific Data Block (AMD), OUI 00-00-1A:
    Version: 1
    Feature Caps: 0x01
    Minimum Refresh Rate: 48 Hz
    Maximum Refresh Rate: 72 Hz
    Flags 1.x: 0x00
  Detailed Timing Descriptors:
    DTD 14:  1280x720    50.000000 Hz  16:9     37.500 kHz     74.250000 MHz (598 mm x 336 mm)
                  Hfront  440 Hsync  40 Hback  220 Hpol P
                  Vfront    5 Vsync   5 Vback   20 Vpol P
    DTD 15:   720x576    50.000000 Hz   5:4     31.250 kHz     27.000000 MHz (598 mm x 336 mm)
                  Hfront   12 Hsync  64 Hback   68 Hpol N
                  Vfront    5 Vsync   5 Vback   39 Vpol N
    DTD 16:   720x480    59.940060 Hz   3:2     31.469 kHz     27.000000 MHz (598 mm x 336 mm)
                  Hfront   16 Hsync  62 Hback   60 Hpol N
                  Vfront    9 Vsync   6 Vback   30 Vpol N
    DTD 17:  1920x1080   71.910434 Hz  16:9     81.115 kHz    210.250000 MHz (598 mm x 336 mm)
                  Hfront  136 Hsync 200 Hback  336 Hpol N
                  Vfront    3 Vsync   5 Vback   40 Vpol P
Checksum: 0x1a  Unused space in Extension Block: 19 bytes

----------------

Block 8, Unknown EDID Extension Block 0x00:
  00 ff ff ff ff ff ff 00 4c 2d 32 0d 43 4a 58 43 '........L-2.CJXC'
  0d 20 01 03 80 3c 22 78 2a 52 95 a5 56 54 9d 25 '. ...<"x*R..VT.%'
  0e 50 54 bb 8c 00 b3 00 81 c0 81 00 81 80 95 00 '.PT.............'
  a9 c0 01 01 01 01 02 3a 80 18 71 38 2d 40 58 2c '.......:..q8-@X,'
  45 00 56 50 21 00 00 1e 00 00 00 fd 00 30 48 1e 'E.VP!........0H.'
  52 16 00 0a 20 20 20 20 20 20 00 00 00 fc 00 43 'R...      .....C'
  32 37 46 33 39 30 0a 20 20 20 20 20 00 00 00 ff '27F390.     ....'
  00 48 34 5a 54 33 30 35 31 32 33 0a 20 20 01 d9 '.H4ZT305123.  ..'
Checksum: 0xd9

----------------

Block 9, CTA-861 Extension Block:
  Revision: 3
  Underscans IT Video Formats by default
  Basic audio support
  Supports YCbCr 4:4:4
  Supports YCbCr 4:2:2
  Native detailed modes: 1
  Video Data Block:
    VIC  16:  1920x1080   60.000000 Hz  16:9     67.500 kHz    148.500000 MHz (native)
    VIC   4:  1280x720    60.000000 Hz  16:9     45.000 kHz     74.250000 MHz
    VIC  31:  1920x1080   50.000000 Hz  16:9     56.250 kHz    148.500000 MHz
    VIC  19:  1280x720    50.000000 Hz  16:9     37.500 kHz     74.250000 MHz
    VIC  18:   720x576    50.000000 Hz  16:9     31.250 kHz     27.000000 MHz
    VIC   3:   720x480    59.940060 Hz  16:9     31.469 kHz     27.000000 MHz
  Audio Data Block:
    Linear PCM:
      Max channels: 2
      Supported sample rates (kHz): 48 44.1 32
      Supported sample sizes (bits): 24 20 16
  Speaker Allocation Data Block:
    FL/FR - Front Left/Right
  Vendor-Specific Data Block (HDMI), OUI 00-0C-03:
    Source physical address: 1.0.0.0
    Supports_AI
    Maximum TMDS clock: 215 MHz
  Vendor-Specific Data Block (AMD), OUI 00-00-1A:
    Version: 1
    Feature Caps: 0x01
    Minimum Refresh Rate: 48 Hz
    Maximum Refresh Rate: 72 Hz
    Flags 1.x: 0x00
  Detailed Timing Descriptors:
    DTD 18:  1280x720    50.000000 Hz  16:9     37.500 kHz     74.250000 MHz (598 mm x 336 mm)
                  Hfront  440 Hsync  40 Hback  220 Hpol P
                  Vfront    5 Vsync   5 Vback   20 Vpol P
    DTD 19:   720x576    50.000000 Hz   5:4     31.250 kHz     27.000000 MHz (598 mm x 336 mm)
                  Hfront   12 Hsync  64 Hback   68 Hpol N
                  Vfront    5 Vsync   5 Vback   39 Vpol N
    DTD 20:   720x480    59.940060 Hz   3:2     31.469 kHz     27.000000 MHz (598 mm x 336 mm)
                  Hfront   16 Hsync  62 Hback   60 Hpol N
                  Vfront    9 Vsync   6 Vback   30 Vpol N
    DTD 21:  1920x1080   71.910434 Hz  16:9     81.115 kHz    210.250000 MHz (598 mm x 336 mm)
                  Hfront  136 Hsync 200 Hback  336 Hpol N
                  Vfront    3 Vsync   5 Vback   40 Vpol P
Checksum: 0x1a  Unused space in Extension Block: 19 bytes

----------------

Block 10, Unknown EDID Extension Block 0x00:
  00 ff ff ff ff ff ff 00 4c 2d 32 0d 43 4a 58 43 '........L-2.CJXC'
  0d 20 01 03 80 3c 22 78 2a 52 95 a5 56 54 9d 25 '. ...<"x*R..VT.%'
  0e 50 54 bb 8c 00 b3 00 81 c0 81 00 81 80 95 00 '.PT.............'
  a9 c0 01 01 01 01 02 3a 80 18 71 38 2d 40 58 2c '.......:..q8-@X,'
  45 00 56 50 21 00 00 1e 00 00 00 fd 00 30 48 1e 'E.VP!........0H.'
  52 16 00 0a 20 20 20 20 20 20 00 00 00 fc 00 43 'R...      .....C'
  32 37 46 33 39 30 0a 20 20 20 20 20 00 00 00 ff '27F390.     ....'
  00 48 34 5a 54 33 30 35 31 32 33 0a 20 20 01 d9 '.H4ZT305123.  ..'
Checksum: 0xd9

----------------

Block 11, CTA-861 Extension Block:
  Revision: 3
  Underscans IT Video Formats by default
  Basic audio support
  Supports YCbCr 4:4:4
  Supports YCbCr 4:2:2
  Native detailed modes: 1
  Video Data Block:
    VIC  16:  1920x1080   60.000000 Hz  16:9     67.500 kHz    148.500000 MHz (native)
    VIC   4:  1280x720    60.000000 Hz  16:9     45.000 kHz     74.250000 MHz
    VIC  31:  1920x1080   50.000000 Hz  16:9     56.250 kHz    148.500000 MHz
    VIC  19:  1280x720    50.000000 Hz  16:9     37.500 kHz     74.250000 MHz
    VIC  18:   720x576    50.000000 Hz  16:9     31.250 kHz     27.000000 MHz
    VIC   3:   720x480    59.940060 Hz  16:9     31.469 kHz     27.000000 MHz
  Audio Data Block:
    Linear PCM:
      Max channels: 2
      Supported sample rates (kHz): 48 44.1 32
      Supported sample sizes (bits): 24 20 16
  Speaker Allocation Data Block:
    FL/FR - Front Left/Right
  Vendor-Specific Data Block (HDMI), OUI 00-0C-03:
    Source physical address: 1.0.0.0
    Supports_AI
    Maximum TMDS clock: 215 MHz
  Vendor-Specific Data Block (AMD), OUI 00-00-1A:
    Version: 1
    Feature Caps: 0x01
    Minimum Refresh Rate: 48 Hz
    Maximum Refresh Rate: 72 Hz
    Flags 1.x: 0x00
  Detailed Timing Descriptors:
    DTD 22:  1280x720    50.000000 Hz  16:9     37.500 kHz     74.250000 MHz (598 mm x 336 mm)
                  Hfront  440 Hsync  40 Hback  220 Hpol P
                  Vfront    5 Vsync   5 Vback   20 Vpol P
    DTD 23:   720x576    50.000000 Hz   5:4     31.250 kHz     27.000000 MHz (598 mm x 336 mm)
                  Hfront   12 Hsync  64 Hback   68 Hpol N
                  Vfront    5 Vsync   5 Vback   39 Vpol N
    DTD 24:   720x480    59.940060 Hz   3:2     31.469 kHz     27.000000 MHz (598 mm x 336 mm)
                  Hfront   16 Hsync  62 Hback   60 Hpol N
                  Vfront    9 Vsync   6 Vback   30 Vpol N
    DTD 25:  1920x1080   71.910434 Hz  16:9     81.115 kHz    210.250000 MHz (598 mm x 336 mm)
                  Hfront  136 Hsync 200 Hback  336 Hpol N
                  Vfront    3 Vsync   5 Vback   40 Vpol P
Checksum: 0x1a  Unused space in Extension Block: 19 bytes

----------------

Warnings:

Block 1, CTA-861 Extension Block:
  Detailed Timing Descriptor #3: Image size is 598x336 mm, but based on the picture AR it should be 598x478 mm.
  Detailed Timing Descriptor #4: Image size is 598x336 mm, but based on the picture AR it should be 598x398 mm.
  Display Product Serial Number is set, so the Serial Number in the Base EDID should be 0.
  Add a Colorimetry Data Block with the sRGB colorimetry bit set to avoid interop issues.
Block 3, CTA-861 Extension Block:
  Detailed Timing Descriptor #7: Image size is 598x336 mm, but based on the picture AR it should be 598x478 mm.
  Detailed Timing Descriptor #8: Image size is 598x336 mm, but based on the picture AR it should be 598x398 mm.
Block 5, CTA-861 Extension Block:
  Detailed Timing Descriptor #11: Image size is 598x336 mm, but based on the picture AR it should be 598x478 mm.
  Detailed Timing Descriptor #12: Image size is 598x336 mm, but based on the picture AR it should be 598x398 mm.
Block 7, CTA-861 Extension Block:
  Detailed Timing Descriptor #15: Image size is 598x336 mm, but based on the picture AR it should be 598x478 mm.
  Detailed Timing Descriptor #16: Image size is 598x336 mm, but based on the picture AR it should be 598x398 mm.
Block 9, CTA-861 Extension Block:
  Detailed Timing Descriptor #19: Image size is 598x336 mm, but based on the picture AR it should be 598x478 mm.
  Detailed Timing Descriptor #20: Image size is 598x336 mm, but based on the picture AR it should be 598x398 mm.
Block 11, CTA-861 Extension Block:
  Detailed Timing Descriptor #23: Image size is 598x336 mm, but based on the picture AR it should be 598x478 mm.
  Detailed Timing Descriptor #24: Image size is 598x336 mm, but based on the picture AR it should be 598x398 mm.
EDID:
  Base EDID: Some timings are out of range of the Monitor Ranges:
    Vertical Freq: 50.000 - 72.809 Hz (Monitor: 48.000 - 72.000 Hz)
    Could be due to a Monitor Range off-by-one rounding issue
  CTA-861: Multiple native progressive timings are defined.

Failures:

Block 1, CTA-861 Extension Block:
  Missing VCDB, needed for Set Selectable RGB Quantization to avoid interop issues.
Block 2, Base EDID:
  Unknown Extension Block.
Block 3, CTA-861 Extension Block:
  Video Data Block: Duplicate VIC 16.
  Video Data Block: Duplicate VIC 4.
  Video Data Block: Duplicate VIC 31.
  Video Data Block: Duplicate VIC 19.
  Video Data Block: Duplicate VIC 18.
  Video Data Block: Duplicate VIC 3.
  Speaker Allocation Data Block: Only one instance of this Data Block is allowed.
Block 4, Base EDID:
  Unknown Extension Block.
Block 5, CTA-861 Extension Block:
  Speaker Allocation Data Block: Only one instance of this Data Block is allowed.
Block 6, Base EDID:
  Unknown Extension Block.
Block 7, CTA-861 Extension Block:
  Speaker Allocation Data Block: Only one instance of this Data Block is allowed.
Block 8, Base EDID:
  Unknown Extension Block.
Block 9, CTA-861 Extension Block:
  Speaker Allocation Data Block: Only one instance of this Data Block is allowed.
Block 10, Base EDID:
  Unknown Extension Block.
Block 11, CTA-861 Extension Block:
  Speaker Allocation Data Block: Only one instance of this Data Block is allowed.
EDID:
  Base EDID: EDID specified 1 extension block(s), but found 11 extension block(s).
  Base EDID: EDID 1.3 requires a Block Map Extension in Block 1 if there are more than 2 blocks in the EDID.

EDID conformity: FAIL
