edid-decode (hex):

00 ff ff ff ff ff ff 00 0a 6c 26 a8 26 08 23 20
21 21 01 03 80 1f 0c 78 ea 62 6e a1 54 57 94 21
14 4c 54 00 00 00 81 c0 01 01 01 01 01 01 01 01
01 01 01 01 01 01 04 27 80 0e 71 d0 28 20 30 20
63 00 35 73 10 00 00 1e 00 00 00 ff 00 4b 33 2d
32 30 32 33 30 38 32 36 0a 20 00 00 00 fc 00 4b
33 0a 20 20 20 20 20 20 20 20 20 20 00 00 00 fd
00 38 4c 1e 51 0d 00 0a 20 20 20 20 20 20 01 68

02 03 1a c1 41 84 23 09 7f 07 67 03 0c 00 10 00
38 2d 83 01 00 00 e3 05 03 01 01 1d 80 18 71 1c
16 20 58 2c 25 00 06 44 21 00 00 9e 00 00 00 00
00 00 00 00 00 00 00 00 00 00 00 00 00 00 00 00
00 00 00 00 00 00 00 00 00 00 00 00 00 00 00 00
00 00 00 00 00 00 00 00 00 00 00 00 00 00 00 00
00 00 00 00 00 00 00 00 00 00 00 00 00 00 00 00
00 00 00 00 00 00 00 00 00 00 00 00 00 00 00 23

00 ff ff ff ff ff ff 00 0a 6c 26 a8 26 08 23 20
21 21 01 03 80 1f 0c 78 ea 62 6e a1 54 57 94 21
14 4c 54 00 00 00 81 c0 01 01 01 01 01 01 01 01
01 01 01 01 01 01 04 27 80 0e 71 d0 28 20 30 20
63 00 35 73 10 00 00 1e 00 00 00 ff 00 4b 33 2d
32 30 32 33 30 38 32 36 0a 20 00 00 00 fc 00 4b
33 0a 20 20 20 20 20 20 20 20 20 20 00 00 00 fd
00 38 4c 1e 51 0d 00 0a 20 20 20 20 20 20 01 68

02 03 1a c1 41 84 23 09 7f 07 67 03 0c 00 10 00
38 2d 83 01 00 00 e3 05 03 01 01 1d 80 18 71 1c
16 20 58 2c 25 00 06 44 21 00 00 9e 00 00 00 00
00 00 00 00 00 00 00 00 00 00 00 00 00 00 00 00
00 00 00 00 00 00 00 00 00 00 00 00 00 00 00 00
00 00 00 00 00 00 00 00 00 00 00 00 00 00 00 00
00 00 00 00 00 00 00 00 00 00 00 00 00 00 00 00
00 00 00 00 00 00 00 00 00 00 00 00 00 00 00 23

----------------

Block 0, Base EDID:
  EDID Structure Version & Revision: 1.3
  Vendor & Product Identification:
    Manufacturer: BSL
    Model: 43046
    Serial Number: ...
    Made in: week 33 of 2023
  Basic Display Parameters & Features:
    Digital display
    Maximum image size: 31 cm x 12 cm
    Gamma: 2.20
    DPMS levels: Standby Suspend Off
    RGB color display
    First detailed timing is the preferred timing
  Color Characteristics:
    Red  : 0.6298, 0.3300
    Green: 0.3398, 0.5800
    Blue : 0.1298, 0.0800
    White: 0.2998, 0.3300
  Established Timings I & II: none
  Standard Timings:
    DMT 0x55:  1280x720    60.000000 Hz  16:9     45.000 kHz     74.250000 MHz
  Detailed Timing Descriptors:
    DTD 1:  1920x720    60.009613 Hz   8:3     45.607 kHz     99.880000 MHz (309 mm x 115 mm)
                 Hfront   48 Hsync  32 Hback  190 Hpol P
                 Vfront    6 Vsync   3 Vback   31 Vpol P
    Display Product Serial Number: ...
    Display Product Name: 'K3'
    Display Range Limits:
      Monitor ranges (GTF): 56-76 Hz V, 30-81 kHz H, max dotclock 130 MHz
  Extension blocks: 1
Checksum: 0x68

----------------

Block 1, CTA-861 Extension Block:
  Revision: 3
  Underscans IT Video Formats by default
  Basic audio support
  Native detailed modes: 1
  Video Data Block:
    VIC   4:  1280x720    60.000000 Hz  16:9     45.000 kHz     74.250000 MHz (native)
  Audio Data Block:
    Linear PCM:
      Max channels: 2
      Supported sample rates (kHz): 192 176.4 96 88.2 48 44.1 32
      Supported sample sizes (bits): 24 20 16
  Vendor-Specific Data Block (HDMI), OUI 00-0C-03:
    Source physical address: 1.0.0.0
    DC_36bit
    DC_30bit
    DC_Y444
    Maximum TMDS clock: 225 MHz
  Speaker Allocation Data Block:
    FL/FR - Front Left/Right
  Colorimetry Data Block:
    xvYCC601
    xvYCC709
    Gamut Boundary Description Metadata Profile P0
  Detailed Timing Descriptors:
    DTD 2:  1920x1080i  60.000000 Hz  16:9     33.750 kHz     74.250000 MHz (518 mm x 324 mm)
                 Hfront   88 Hsync  44 Hback  148 Hpol P
                 Vfront    2 Vsync   5 Vback   15 Vpol P Vfront +0.5 Odd Field
                 Vfront    2 Vsync   5 Vback   15 Vpol P Vback  +0.5 Even Field
Checksum: 0x23  Unused space in Extension Block: 83 bytes

----------------

Block 2, Unknown EDID Extension Block 0x00:
  00 ff ff ff ff ff ff 00 0a 6c 26 a8 26 08 23 20 '.........l&.&.# '
  21 21 01 03 80 1f 0c 78 ea 62 6e a1 54 57 94 21 '!!.....x.bn.TW.!'
  14 4c 54 00 00 00 81 c0 01 01 01 01 01 01 01 01 '.LT.............'
  01 01 01 01 01 01 04 27 80 0e 71 d0 28 20 30 20 '.......'..q.( 0 '
  63 00 35 73 10 00 00 1e 00 00 00 ff 00 4b 33 2d 'c.5s.........K3-'
  32 30 32 33 30 38 32 36 0a 20 00 00 00 fc 00 4b '20230826. .....K'
  33 0a 20 20 20 20 20 20 20 20 20 20 00 00 00 fd '3.          ....'
  00 38 4c 1e 51 0d 00 0a 20 20 20 20 20 20 01 68 '.8L.Q...      .h'
Checksum: 0x68

----------------

Block 3, CTA-861 Extension Block:
  Revision: 3
  Underscans IT Video Formats by default
  Basic audio support
  Native detailed modes: 1
  Video Data Block:
    VIC   4:  1280x720    60.000000 Hz  16:9     45.000 kHz     74.250000 MHz (native)
  Audio Data Block:
    Linear PCM:
      Max channels: 2
      Supported sample rates (kHz): 192 176.4 96 88.2 48 44.1 32
      Supported sample sizes (bits): 24 20 16
  Vendor-Specific Data Block (HDMI), OUI 00-0C-03:
    Source physical address: 1.0.0.0
    DC_36bit
    DC_30bit
    DC_Y444
    Maximum TMDS clock: 225 MHz
  Speaker Allocation Data Block:
    FL/FR - Front Left/Right
  Colorimetry Data Block:
    xvYCC601
    xvYCC709
    Gamut Boundary Description Metadata Profile P0
  Detailed Timing Descriptors:
    DTD 3:  1920x1080i  60.000000 Hz  16:9     33.750 kHz     74.250000 MHz (518 mm x 324 mm)
                 Hfront   88 Hsync  44 Hback  148 Hpol P
                 Vfront    2 Vsync   5 Vback   15 Vpol P Vfront +0.5 Odd Field
                 Vfront    2 Vsync   5 Vback   15 Vpol P Vback  +0.5 Even Field
Checksum: 0x23  Unused space in Extension Block: 83 bytes

----------------

Warnings:

Block 1, CTA-861 Extension Block:
  Video Data Block: VIC 4 and the first DTD are not identical. Is this intended?
  Colorimetry Data Block: Set the sRGB colorimetry bit to avoid interop issues.
  Detailed Timing Descriptor #2: DTD is identical to VIC 5, which is not present in the CTA Ext Block.
  Detailed Timing Descriptor #2: Image size is 518x324 mm, but based on the picture AR it should be 518x291 mm.
  Display Product Serial Number is set, so the Serial Number in the Base EDID should be 0.
Block 3, CTA-861 Extension Block:
  Colorimetry Data Block: Set the sRGB colorimetry bit to avoid interop issues.
  Detailed Timing Descriptor #3: DTD is identical to VIC 5, which is not present in the CTA Ext Block.
  Detailed Timing Descriptor #3: Image size is 518x324 mm, but based on the picture AR it should be 518x291 mm.

Failures:

Block 1, CTA-861 Extension Block:
  Detailed Timing Descriptor #2: Mismatch of image size 518x324 mm vs display size 310x120 mm.
  Required 640x480p60 timings are missing in the established timings and the SVD list (VIC 1).
  Missing VCDB, needed for Set Selectable RGB Quantization to avoid interop issues.
Block 2, Base EDID:
  Unknown Extension Block.
Block 3, CTA-861 Extension Block:
  Video Data Block: Duplicate VIC 4.
  Speaker Allocation Data Block: Only one instance of this Data Block is allowed.
  Colorimetry Data Block: Only one instance of this Data Block is allowed.
  Detailed Timing Descriptor #3: Mismatch of image size 518x324 mm vs display size 310x120 mm.
EDID:
  Base EDID: The DTD max image size is 518x324mm, which is larger than the display size 310.0x120.0mm.
  Base EDID: EDID specified 1 extension block(s), but found 3 extension block(s).
  Base EDID: EDID 1.3 requires a Block Map Extension in Block 1 if there are more than 2 blocks in the EDID.
  CTA-861: Native progressive timings are a mix of several resolutions.

EDID conformity: FAIL
