edid-decode (hex):

00 ff ff ff ff ff ff 00 09 e5 1a 0d 00 00 00 00
14 22 01 04 a5 22 13 78 03 30 45 96 5d 59 93 29
1f 50 54 00 00 00 01 01 01 01 01 01 01 01 01 01
01 01 01 01 01 01 3b 38 80 de 70 38 28 40 30 20
36 00 58 c2 10 00 00 1a fc 2c 80 de 70 38 28 40
30 20 36 00 58 c2 10 00 00 1a 00 00 00 fe 00 42
4f 45 20 43 51 0a 20 20 20 20 20 20 00 00 00 fe
00 4e 56 31 35 36 46 48 4d 2d 54 30 4b 0a 00 95

00 ff ff ff ff ff ff 00 09 e5 1a 0d 00 00 00 00
14 22 01 04 a5 22 13 78 03 30 45 96 5d 59 93 29
1f 50 54 00 00 00 01 01 01 01 01 01 01 01 01 01
01 01 01 01 01 01 3b 38 80 de 70 38 28 40 30 20
36 00 58 c2 10 00 00 1a fc 2c 80 de 70 38 28 40
30 20 36 00 58 c2 10 00 00 1a 00 00 00 fe 00 42
4f 45 20 43 51 0a 20 20 20 20 20 20 00 00 00 fe
00 4e 56 31 35 36 46 48 4d 2d 54 30 4b 0a 00 95

----------------

Block 0, Base EDID:
  EDID Structure Version & Revision: 1.4
  Vendor & Product Identification:
    Manufacturer: BOE
    Model: 3354
    Made in: week 20 of 2024
  Basic Display Parameters & Features:
    Digital display
    Bits per primary color channel: 8
    DisplayPort interface
    Maximum image size: 34 cm x 19 cm
    Gamma: 2.20
    Supported color formats: RGB 4:4:4
    First detailed timing includes the native pixel format and preferred refresh rate
    Display supports continuous frequencies
  Color Characteristics:
    Red  : 0.5859, 0.3662
    Green: 0.3476, 0.5742
    Blue : 0.1611, 0.1210
    White: 0.3134, 0.3291
  Established Timings I & II: none
  Standard Timings: none
  Detailed Timing Descriptors:
    DTD 1:  1920x1080   60.003168 Hz  16:9     67.204 kHz    143.950000 MHz (344 mm x 194 mm)
                 Hfront   48 Hsync  32 Hback  142 Hpol P
                 Vfront    3 Vsync   6 Vback   31 Vpol N
    DTD 2:  1920x1080   48.002534 Hz  16:9     53.763 kHz    115.160000 MHz (344 mm x 194 mm)
                 Hfront   48 Hsync  32 Hback  142 Hpol P
                 Vfront    3 Vsync   6 Vback   31 Vpol N
    Alphanumeric Data String: 'BOE CQ'
    Alphanumeric Data String: 'NV156FHM-T0K'
Checksum: 0x95

----------------

Warnings:

Block 0, Base EDID:
  Missing Display Product Name.

Failures:

Block 0, Base EDID:
  Missing Display Range Limits Descriptor.
EDID:
  Extension Block 1 started with EDID header, ignoring Extension Blocks >= 1.

EDID conformity: FAIL
