edid-decode (hex):

00 ff ff ff ff ff ff 00 36 69 a9 4b 00 00 00 00
23 21 01 04 b5 35 1d 78 3a f7 05 a3 56 4d 99 26
0d 50 54 bf cf 00 71 4f 81 c0 81 80 81 00 95 00
b3 00 d1 c0 01 01 02 3a 80 18 71 38 2d 40 58 2c
45 00 12 22 21 00 00 1e 00 00 00 fc 00 4d 53 49
20 4d 50 32 34 31 32 0a 20 20 00 00 00 fd 00 30
64 5d 5d 21 01 0a 20 20 20 20 20 20 00 00 00 ff
00 42 41 39 48 35 30 33 38 30 31 36 37 32 01 ed

02 03 1a 34 48 90 01 02 03 04 12 13 1f 83 01 00
00 68 1a 00 00 01 01 30 64 00 48 4d 80 a0 70 38
27 40 30 20 35 00 12 22 21 00 00 1a eb 5a 80 a0
70 38 27 40 30 20 35 00 12 22 21 00 00 1e 6e 0a
d0 b0 20 40 14 20 18 40 3a 00 12 22 21 00 00 1c
00 00 00 00 00 00 00 00 00 00 00 00 00 00 00 00
00 00 00 00 00 00 00 00 00 00 00 00 00 00 00 00
00 00 00 00 00 00 00 00 00 00 00 00 00 00 00 38

00 ff ff ff ff ff ff 00 36 69 a9 4b 00 00 00 00
23 21 01 04 b5 35 1d 78 3a f7 05 a3 56 4d 99 26
0d 50 54 bf cf 00 71 4f 81 c0 81 80 81 00 95 00
b3 00 d1 c0 01 01 02 3a 80 18 71 38 2d 40 58 2c
45 00 12 22 21 00 00 1e 00 00 00 fc 00 4d 53 49
20 4d 50 32 34 31 32 0a 20 20 00 00 00 fd 00 30
64 5d 5d 21 01 0a 20 20 20 20 20 20 00 00 00 ff
00 42 41 39 48 35 30 33 38 30 31 36 37 32 01 ed

02 03 1a 34 48 90 01 02 03 04 12 13 1f 83 01 00
00 68 1a 00 00 01 01 30 64 00 48 4d 80 a0 70 38
27 40 30 20 35 00 12 22 21 00 00 1a eb 5a 80 a0
70 38 27 40 30 20 35 00 12 22 21 00 00 1e 6e 0a
d0 b0 20 40 14 20 18 40 3a 00 12 22 21 00 00 1c
00 00 00 00 00 00 00 00 00 00 00 00 00 00 00 00
00 00 00 00 00 00 00 00 00 00 00 00 00 00 00 00
00 00 00 00 00 00 00 00 00 00 00 00 00 00 00 38

----------------

Block 0, Base EDID:
  EDID Structure Version & Revision: 1.4
  Vendor & Product Identification:
    Manufacturer: MSI
    Model: 19369
    Made in: week 35 of 2023
  Basic Display Parameters & Features:
    Digital display
    Bits per primary color channel: 10
    DisplayPort interface
    Maximum image size: 53 cm x 29 cm
    Gamma: 2.20
    DPMS levels: Off
    Supported color formats: RGB 4:4:4, YCrCb 4:4:4, YCrCb 4:2:2
    First detailed timing includes the native pixel format and preferred refresh rate
  Color Characteristics:
    Red  : 0.6396, 0.3388
    Green: 0.3017, 0.6005
    Blue : 0.1484, 0.0507
    White: 0.3134, 0.3291
  Established Timings I & II:
    IBM     :   720x400    70.081663 Hz   9:5     31.467 kHz     28.320000 MHz
    DMT 0x04:   640x480    59.940476 Hz   4:3     31.469 kHz     25.175000 MHz
    Apple   :   640x480    66.666667 Hz   4:3     35.000 kHz     30.240000 MHz
    DMT 0x05:   640x480    72.808802 Hz   4:3     37.861 kHz     31.500000 MHz
    DMT 0x06:   640x480    75.000000 Hz   4:3     37.500 kHz     31.500000 MHz
    DMT 0x08:   800x600    56.250000 Hz   4:3     35.156 kHz     36.000000 MHz
    DMT 0x09:   800x600    60.316541 Hz   4:3     37.879 kHz     40.000000 MHz
    DMT 0x0a:   800x600    72.187572 Hz   4:3     48.077 kHz     50.000000 MHz
    DMT 0x0b:   800x600    75.000000 Hz   4:3     46.875 kHz     49.500000 MHz
    DMT 0x10:  1024x768    60.003840 Hz   4:3     48.363 kHz     65.000000 MHz
    DMT 0x11:  1024x768    70.069359 Hz   4:3     56.476 kHz     75.000000 MHz
    DMT 0x12:  1024x768    75.028582 Hz   4:3     60.023 kHz     78.750000 MHz
    DMT 0x24:  1280x1024   75.024675 Hz   5:4     79.976 kHz    135.000000 MHz
  Standard Timings:
    DMT 0x15:  1152x864    75.000000 Hz   4:3     67.500 kHz    108.000000 MHz
    DMT 0x55:  1280x720    60.000000 Hz  16:9     45.000 kHz     74.250000 MHz
    DMT 0x23:  1280x1024   60.019740 Hz   5:4     63.981 kHz    108.000000 MHz
    DMT 0x1c:  1280x800    59.810326 Hz  16:10    49.702 kHz     83.500000 MHz
    DMT 0x2f:  1440x900    59.887445 Hz  16:10    55.935 kHz    106.500000 MHz
    DMT 0x3a:  1680x1050   59.954250 Hz  16:10    65.290 kHz    146.250000 MHz
    DMT 0x52:  1920x1080   60.000000 Hz  16:9     67.500 kHz    148.500000 MHz
  Detailed Timing Descriptors:
    DTD 1:  1920x1080   60.000000 Hz  16:9     67.500 kHz    148.500000 MHz (530 mm x 290 mm)
                 Hfront   88 Hsync  44 Hback  148 Hpol P
                 Vfront    4 Vsync   5 Vback   36 Vpol P
    Display Product Name: 'MSI MP2412'
    Display Range Limits:
      Monitor ranges (Range Limits Only): 48-100 Hz V, 93-93 kHz H, max dotclock 330 MHz
    Display Product Serial Number: ...
  Extension blocks: 1
Checksum: 0xed

----------------

Block 1, CTA-861 Extension Block:
  Revision: 3
  Supports YCbCr 4:4:4
  Supports YCbCr 4:2:2
  Native detailed modes: 4
  Video Data Block:
    VIC  16:  1920x1080   60.000000 Hz  16:9     67.500 kHz    148.500000 MHz (native)
    VIC   1:   640x480    59.940476 Hz   4:3     31.469 kHz     25.175000 MHz
    VIC   2:   720x480    59.940060 Hz   4:3     31.469 kHz     27.000000 MHz
    VIC   3:   720x480    59.940060 Hz  16:9     31.469 kHz     27.000000 MHz
    VIC   4:  1280x720    60.000000 Hz  16:9     45.000 kHz     74.250000 MHz
    VIC  18:   720x576    50.000000 Hz  16:9     31.250 kHz     27.000000 MHz
    VIC  19:  1280x720    50.000000 Hz  16:9     37.500 kHz     74.250000 MHz
    VIC  31:  1920x1080   50.000000 Hz  16:9     56.250 kHz    148.500000 MHz
  Speaker Allocation Data Block:
    FL/FR - Front Left/Right
  Vendor-Specific Data Block (AMD), OUI 00-00-1A:
    Version: 1
    Feature Caps: 0x01
    Minimum Refresh Rate: 48 Hz
    Maximum Refresh Rate: 100 Hz
    Flags 1.x: 0x00
  Detailed Timing Descriptors:
    DTD 2:  1920x1080   85.000344 Hz  16:9     95.115 kHz    197.840000 MHz (530 mm x 290 mm)
                 Hfront   48 Hsync  32 Hback   80 Hpol P
                 Vfront    3 Vsync   5 Vback   31 Vpol N
    DTD 3:  1920x1080   99.999141 Hz  16:9    111.899 kHz    232.750000 MHz (530 mm x 290 mm)
                 Hfront   48 Hsync  32 Hback   80 Hpol P
                 Vfront    3 Vsync   5 Vback   31 Vpol P
    DTD 4:   720x576    49.998502 Hz   5:4     29.799 kHz     26.700000 MHz (530 mm x 290 mm)
                 Hfront   24 Hsync  64 Hback   88 Hpol N
                 Vfront    3 Vsync  10 Vback    7 Vpol P
Checksum: 0x38  Unused space in Extension Block: 47 bytes

----------------

Block 2, Unknown EDID Extension Block 0x00:
  00 ff ff ff ff ff ff 00 36 69 a9 4b 00 00 00 00 '........6i.K....'
  23 21 01 04 b5 35 1d 78 3a f7 05 a3 56 4d 99 26 '#!...5.x:...VM.&'
  0d 50 54 bf cf 00 71 4f 81 c0 81 80 81 00 95 00 '.PT...qO........'
  b3 00 d1 c0 01 01 02 3a 80 18 71 38 2d 40 58 2c '.......:..q8-@X,'
  45 00 12 22 21 00 00 1e 00 00 00 fc 00 4d 53 49 'E.."!........MSI'
  20 4d 50 32 34 31 32 0a 20 20 00 00 00 fd 00 30 ' MP2412.  .....0'
  64 5d 5d 21 01 0a 20 20 20 20 20 20 00 00 00 ff 'd]]!..      ....'
  00 42 41 39 48 35 30 33 38 30 31 36 37 32 01 ed '.BA9H503801672..'
Checksum: 0xed

----------------

Block 3, CTA-861 Extension Block:
  Revision: 3
  Supports YCbCr 4:4:4
  Supports YCbCr 4:2:2
  Native detailed modes: 4
  Video Data Block:
    VIC  16:  1920x1080   60.000000 Hz  16:9     67.500 kHz    148.500000 MHz (native)
    VIC   1:   640x480    59.940476 Hz   4:3     31.469 kHz     25.175000 MHz
    VIC   2:   720x480    59.940060 Hz   4:3     31.469 kHz     27.000000 MHz
    VIC   3:   720x480    59.940060 Hz  16:9     31.469 kHz     27.000000 MHz
    VIC   4:  1280x720    60.000000 Hz  16:9     45.000 kHz     74.250000 MHz
    VIC  18:   720x576    50.000000 Hz  16:9     31.250 kHz     27.000000 MHz
    VIC  19:  1280x720    50.000000 Hz  16:9     37.500 kHz     74.250000 MHz
    VIC  31:  1920x1080   50.000000 Hz  16:9     56.250 kHz    148.500000 MHz
  Speaker Allocation Data Block:
    FL/FR - Front Left/Right
  Vendor-Specific Data Block (AMD), OUI 00-00-1A:
    Version: 1
    Feature Caps: 0x01
    Minimum Refresh Rate: 48 Hz
    Maximum Refresh Rate: 100 Hz
    Flags 1.x: 0x00
  Detailed Timing Descriptors:
    DTD 5:  1920x1080   85.000344 Hz  16:9     95.115 kHz    197.840000 MHz (530 mm x 290 mm)
                 Hfront   48 Hsync  32 Hback   80 Hpol P
                 Vfront    3 Vsync   5 Vback   31 Vpol N
    DTD 6:  1920x1080   99.999141 Hz  16:9    111.899 kHz    232.750000 MHz (530 mm x 290 mm)
                 Hfront   48 Hsync  32 Hback   80 Hpol P
                 Vfront    3 Vsync   5 Vback   31 Vpol P
    DTD 7:   720x576    49.998502 Hz   5:4     29.799 kHz     26.700000 MHz (530 mm x 290 mm)
                 Hfront   24 Hsync  64 Hback   88 Hpol N
                 Vfront    3 Vsync  10 Vback    7 Vpol P
Checksum: 0x38  Unused space in Extension Block: 47 bytes

----------------

Warnings:

Block 1, CTA-861 Extension Block:
  IT Video Formats are overscanned by default, but normally this should be underscanned.
  Detailed Timing Descriptor #4: Image size is 530x290 mm, but based on the picture AR it should be 530x424 mm.
  Add a Colorimetry Data Block with the sRGB colorimetry bit set to avoid interop issues.
Block 3, CTA-861 Extension Block:
  IT Video Formats are overscanned by default, but normally this should be underscanned.
  Detailed Timing Descriptor #7: Image size is 530x290 mm, but based on the picture AR it should be 530x424 mm.
EDID:
  Base EDID: Some timings are out of range of the Monitor Ranges:
    Horizontal Freq: 29.799 - 111.899 kHz (Monitor: 93.000 - 93.000 kHz)

Failures:

Block 1, CTA-861 Extension Block:
  Speaker Allocation Data Block: Audio information is present, but bit 6 of Byte 3 of the CTA-861 Extension header indicates no Basic Audio support.
  Missing VCDB, needed for Set Selectable RGB Quantization to avoid interop issues.
Block 2, Base EDID:
  Unknown Extension Block.
Block 3, CTA-861 Extension Block:
  Video Data Block: Duplicate VIC 16.
  Video Data Block: Duplicate VIC 1.
  Video Data Block: Duplicate VIC 2.
  Video Data Block: Duplicate VIC 3.
  Video Data Block: Duplicate VIC 4.
  Video Data Block: Duplicate VIC 18.
  Video Data Block: Duplicate VIC 19.
  Video Data Block: Duplicate VIC 31.
  Speaker Allocation Data Block: Only one instance of this Data Block is allowed.
  Speaker Allocation Data Block: Audio information is present, but bit 6 of Byte 3 of the CTA-861 Extension header indicates no Basic Audio support.
EDID:
  Base EDID: EDID specified 1 extension block(s), but found 3 extension block(s).
  CTA-861: Native progressive timings are a mix of several resolutions.

EDID conformity: FAIL
