edid-decode (hex):

00 ff ff ff ff ff ff 00 5a 63 35 1d 01 01 01 01
23 1e 01 03 80 46 27 78 2e 59 95 af 4f 42 af 26
0f 50 54 bf ef 80 e1 c0 d1 00 d1 c0 b3 00 a9 c0
95 00 81 00 81 c0 08 e8 00 30 f2 70 5a 80 b0 58
4a 00 ba 89 21 00 00 1a 00 00 00 ff 00 56 34 4d
32 30 33 35 30 30 31 30 35 0a 00 00 00 fd 00 28
3c 0f cc 3c 00 0a 20 20 20 20 20 20 00 00 00 fc
00 58 47 33 32 32 30 20 53 45 52 49 45 53 01 65

02 03 4f f1 55 61 60 5d 5e 5f 5a 10 05 04 03 02
07 06 0f 1f 14 13 12 16 01 1e 23 09 7f 07 83 01
00 00 6d 03 0c 00 10 00 38 3c 20 00 60 01 02 03
67 d8 5d c4 01 78 88 03 68 1a 00 00 01 01 28 3c
ed e3 05 e0 01 e2 0f 7f e6 06 07 01 6b 53 4f 08
e8 00 30 f2 70 5a 80 b0 58 4a 00 ba 89 21 00 00
1a 1a 68 00 a0 f0 38 1f 40 30 20 3a 00 ba 89 21
00 00 1a 00 00 00 00 00 00 00 00 00 00 00 00 5e

00 ff ff ff ff ff ff 00 5a 63 35 1d 01 01 01 01
23 1e 01 03 80 46 27 78 2e 59 95 af 4f 42 af 26
0f 50 54 bf ef 80 e1 c0 d1 00 d1 c0 b3 00 a9 c0
95 00 81 00 81 c0 08 e8 00 30 f2 70 5a 80 b0 58
4a 00 ba 89 21 00 00 1a 00 00 00 ff 00 56 34 4d
32 30 33 35 30 30 31 30 35 0a 00 00 00 fd 00 28
3c 0f cc 3c 00 0a 20 20 20 20 20 20 00 00 00 fc
00 58 47 33 32 32 30 20 53 45 52 49 45 53 01 65

02 03 4f f1 55 61 60 5d 5e 5f 5a 10 05 04 03 02
07 06 0f 1f 14 13 12 16 01 1e 23 09 7f 07 83 01
00 00 6d 03 0c 00 10 00 38 3c 20 00 60 01 02 03
67 d8 5d c4 01 78 88 03 68 1a 00 00 01 01 28 3c
ed e3 05 e0 01 e2 0f 7f e6 06 07 01 6b 53 4f 08
e8 00 30 f2 70 5a 80 b0 58 4a 00 ba 89 21 00 00
1a 1a 68 00 a0 f0 38 1f 40 30 20 3a 00 ba 89 21
00 00 1a 00 00 00 00 00 00 00 00 00 00 00 00 5e

----------------

Block 0, Base EDID:
  EDID Structure Version & Revision: 1.3
  Vendor & Product Identification:
    Manufacturer: VSC
    Model: 7477
    Serial Number: ...
    Made in: week 35 of 2020
  Basic Display Parameters & Features:
    Digital display
    Maximum image size: 70 cm x 39 cm
    Gamma: 2.20
    DPMS levels: Off
    RGB color display
    Default (sRGB) color space is primary color space
    First detailed timing is the preferred timing
  Color Characteristics:
    Red  : 0.6845, 0.3095
    Green: 0.2597, 0.6845
    Blue : 0.1503, 0.0595
    White: 0.3134, 0.3291
  Established Timings I & II:
    IBM     :   720x400    70.081663 Hz   9:5     31.467 kHz     28.320000 MHz
    DMT 0x04:   640x480    59.940476 Hz   4:3     31.469 kHz     25.175000 MHz
    Apple   :   640x480    66.666667 Hz   4:3     35.000 kHz     30.240000 MHz
    DMT 0x05:   640x480    72.808802 Hz   4:3     37.861 kHz     31.500000 MHz
    DMT 0x06:   640x480    75.000000 Hz   4:3     37.500 kHz     31.500000 MHz
    DMT 0x08:   800x600    56.250000 Hz   4:3     35.156 kHz     36.000000 MHz
    DMT 0x09:   800x600    60.316541 Hz   4:3     37.879 kHz     40.000000 MHz
    DMT 0x0a:   800x600    72.187572 Hz   4:3     48.077 kHz     50.000000 MHz
    DMT 0x0b:   800x600    75.000000 Hz   4:3     46.875 kHz     49.500000 MHz
    Apple   :   832x624    74.551266 Hz   4:3     49.726 kHz     57.284000 MHz
    DMT 0x10:  1024x768    60.003840 Hz   4:3     48.363 kHz     65.000000 MHz
    DMT 0x11:  1024x768    70.069359 Hz   4:3     56.476 kHz     75.000000 MHz
    DMT 0x12:  1024x768    75.028582 Hz   4:3     60.023 kHz     78.750000 MHz
    DMT 0x24:  1280x1024   75.024675 Hz   5:4     79.976 kHz    135.000000 MHz
    Apple   :  1152x870    75.061550 Hz 192:145   68.681 kHz    100.000000 MHz
  Standard Timings:
    DMT 0x54:  2048x1152   60.000000 Hz  16:9     72.000 kHz    162.000000 MHz (RB)
    DMT 0x45:  1920x1200   59.884600 Hz  16:10    74.556 kHz    193.250000 MHz
    DMT 0x52:  1920x1080   60.000000 Hz  16:9     67.500 kHz    148.500000 MHz
    DMT 0x3a:  1680x1050   59.954250 Hz  16:10    65.290 kHz    146.250000 MHz
    DMT 0x53:  1600x900    60.000000 Hz  16:9     60.000 kHz    108.000000 MHz (RB)
    DMT 0x2f:  1440x900    59.887445 Hz  16:10    55.935 kHz    106.500000 MHz
    DMT 0x1c:  1280x800    59.810326 Hz  16:10    49.702 kHz     83.500000 MHz
    DMT 0x55:  1280x720    60.000000 Hz  16:9     45.000 kHz     74.250000 MHz
  Detailed Timing Descriptors:
    DTD 1:  3840x2160   60.000000 Hz  16:9    135.000 kHz    594.000000 MHz (698 mm x 393 mm)
                 Hfront  176 Hsync  88 Hback  296 Hpol P
                 Vfront    4 Vsync  10 Vback   76 Vpol N
    Display Product Serial Number: ...
    Display Range Limits:
      Monitor ranges (GTF): 40-60 Hz V, 15-204 kHz H, max dotclock 600 MHz
    Display Product Name: 'XG3220 SERIES'
  Extension blocks: 1
Checksum: 0x65

----------------

Block 1, CTA-861 Extension Block:
  Revision: 3
  Underscans IT Video Formats by default
  Basic audio support
  Supports YCbCr 4:4:4
  Supports YCbCr 4:2:2
  Native DTDs: 1
  Video Data Block:
    VIC  97:  3840x2160   60.000000 Hz  16:9    135.000 kHz    594.000000 MHz
    VIC  96:  3840x2160   50.000000 Hz  16:9    112.500 kHz    594.000000 MHz
    VIC  93:  3840x2160   24.000000 Hz  16:9     54.000 kHz    297.000000 MHz
    VIC  94:  3840x2160   25.000000 Hz  16:9     56.250 kHz    297.000000 MHz
    VIC  95:  3840x2160   30.000000 Hz  16:9     67.500 kHz    297.000000 MHz
    VIC  90:  2560x1080   60.000000 Hz  64:27    66.000 kHz    198.000000 MHz
    VIC  16:  1920x1080   60.000000 Hz  16:9     67.500 kHz    148.500000 MHz
    VIC   5:  1920x1080i  60.000000 Hz  16:9     33.750 kHz     74.250000 MHz
    VIC   4:  1280x720    60.000000 Hz  16:9     45.000 kHz     74.250000 MHz
    VIC   3:   720x480    59.940060 Hz  16:9     31.469 kHz     27.000000 MHz
    VIC   2:   720x480    59.940060 Hz   4:3     31.469 kHz     27.000000 MHz
    VIC   7:  1440x480i   59.940060 Hz  16:9     15.734 kHz     27.000000 MHz
    VIC   6:  1440x480i   59.940060 Hz   4:3     15.734 kHz     27.000000 MHz
    VIC  15:  1440x480    59.940060 Hz  16:9     31.469 kHz     54.000000 MHz
    VIC  31:  1920x1080   50.000000 Hz  16:9     56.250 kHz    148.500000 MHz
    VIC  20:  1920x1080i  50.000000 Hz  16:9     28.125 kHz     74.250000 MHz
    VIC  19:  1280x720    50.000000 Hz  16:9     37.500 kHz     74.250000 MHz
    VIC  18:   720x576    50.000000 Hz  16:9     31.250 kHz     27.000000 MHz
    VIC  22:  1440x576i   50.000000 Hz  16:9     15.625 kHz     27.000000 MHz
    VIC   1:   640x480    59.940476 Hz   4:3     31.469 kHz     25.175000 MHz
    VIC  30:  1440x576    50.000000 Hz  16:9     31.250 kHz     54.000000 MHz
  Audio Data Block:
    Linear PCM:
      Max channels: 2
      Supported sample rates (kHz): 192 176.4 96 88.2 48 44.1 32
      Supported sample sizes (bits): 24 20 16
  Speaker Allocation Data Block:
    FL/FR - Front Left/Right
  Vendor-Specific Data Block (HDMI), OUI 00-0C-03:
    Source physical address: 1.0.0.0
    DC_36bit
    DC_30bit
    DC_Y444
    Maximum TMDS clock: 300 MHz
    Extended HDMI video details:
      HDMI VICs:
        HDMI VIC 1:  3840x2160   30.000000 Hz  16:9     67.500 kHz    297.000000 MHz
        HDMI VIC 2:  3840x2160   25.000000 Hz  16:9     56.250 kHz    297.000000 MHz
        HDMI VIC 3:  3840x2160   24.000000 Hz  16:9     54.000 kHz    297.000000 MHz
  Vendor-Specific Data Block (HDMI Forum), OUI C4-5D-D8:
    Version: 1
    Maximum TMDS Character Rate: 600 MHz
    SCDC Present
    Supports scrambling for <= 340 Mcsc
    Supports 12-bits/component Deep Color 4:2:0 Pixel Encoding
    Supports 10-bits/component Deep Color 4:2:0 Pixel Encoding
  Vendor-Specific Data Block (AMD), OUI 00-00-1A:
    Version: 1
    Feature Caps: 0x01
    Minimum Refresh Rate: 40 Hz
    Maximum Refresh Rate: 60 Hz
    Flags 1.x: 0xed (MCCS)
  Colorimetry Data Block:
    BT2020cYCC
    BT2020YCC
    BT2020RGB
    Gamut Boundary Description Metadata Profile P0
  YCbCr 4:2:0 Capability Map Data Block:
    VIC  97:  3840x2160   60.000000 Hz  16:9    135.000 kHz    594.000000 MHz
    VIC  96:  3840x2160   50.000000 Hz  16:9    112.500 kHz    594.000000 MHz
    VIC  93:  3840x2160   24.000000 Hz  16:9     54.000 kHz    297.000000 MHz
    VIC  94:  3840x2160   25.000000 Hz  16:9     56.250 kHz    297.000000 MHz
    VIC  95:  3840x2160   30.000000 Hz  16:9     67.500 kHz    297.000000 MHz
    VIC  90:  2560x1080   60.000000 Hz  64:27    66.000 kHz    198.000000 MHz
    VIC  16:  1920x1080   60.000000 Hz  16:9     67.500 kHz    148.500000 MHz
  HDR Static Metadata Data Block:
    Electro optical transfer functions:
      Traditional gamma - SDR luminance range
      Traditional gamma - HDR luminance range
      SMPTE ST2084
    Supported static metadata descriptors:
      Static metadata type 1
    Desired content max luminance: 107 (507.620 cd/m^2)
    Desired content max frame-average luminance: 83 (301.833 cd/m^2)
    Desired content min luminance: 79 (0.487 cd/m^2)
  Detailed Timing Descriptors:
    DTD 2:  3840x2160   60.000000 Hz  16:9    135.000 kHz    594.000000 MHz (698 mm x 393 mm)
                 Hfront  176 Hsync  88 Hback  296 Hpol P
                 Vfront    4 Vsync  10 Vback   76 Vpol N
    DTD 3:  3840x1080   59.968497 Hz  32:9     66.625 kHz    266.500000 MHz (698 mm x 393 mm)
                 Hfront   48 Hsync  32 Hback   80 Hpol P
                 Vfront    3 Vsync  10 Vback   18 Vpol N
Checksum: 0x5e  Unused space in Extension Block: 12 bytes

----------------

Warnings:

Block 0, Base EDID:
  Vendor & Product Identification: The serial number is one of the known dummy values, it should probably be set to 0.
  Detailed Timing Descriptor #1: DTD is similar but not identical to VIC 97.
Block 1, CTA-861 Extension Block:
  Video Data Block: VIC 97 and the first DTD are not identical. Is this intended?
  YCbCr 4:2:0 Capability Map Data Block: Some YCbCr 4:2:0 timings are invalid for HDMI 2.1 (which requires an RGB timings pixel rate >= 590 MHz).
  Detailed Timing Descriptor #2: DTD is similar but not identical to VIC 97.
  Detailed Timing Descriptor #3: Image size is 698x393 mm, but based on the picture AR it should be 698x196 mm.
  Display Product Serial Number is set, so the Serial Number in the Base EDID should be 0.
EDID:
  Base EDID: Some timings are out of range of the Monitor Ranges:
    Vertical Freq: 24.000 - 75.062 Hz (Monitor: 40.000 - 60.000 Hz)

Failures:

Block 0, Base EDID:
  Basic Display Parameters & Features: sRGB is signaled, but the chromaticities do not match.
Block 1, CTA-861 Extension Block:
  Vendor-Specific Data Block (HDMI Forum), OUI C4-5D-D8: HDMI VIC and related CTA VIC codes are present, but the UHD VIC bit is 0.
  Missing VCDB, needed for Set Selectable RGB Quantization to avoid interop issues.
EDID:
  Extension Block 2 started with EDID header, ignoring Extension Blocks >= 2.

EDID conformity: FAIL
