edid-decode (hex):

00 ff ff ff ff ff ff 00 1e 6d 4f 78 00 00 13 da
09 23 01 04 b5 4f 23 78 f9 bc 61 ad 51 3e b4 26
0d 50 54 f7 df 00 71 4f 81 40 81 80 81 c0 d1 c0
01 01 b3 00 95 00 c8 dd 70 40 d1 a0 46 50 30 20
3a 00 1d 4e 31 00 00 1a 00 00 00 fd 0c 30 f0 91
91 82 01 0a 20 20 20 20 20 20 00 00 00 fc 00 4c
47 20 55 4c 54 52 41 47 45 41 52 0a 00 00 00 ff
00 35 30 39 54 4f 44 58 30 35 30 38 32 0a 02 2b

02 03 28 f1 23 09 07 07 83 01 00 00 e3 05 e3 21
e6 06 07 01 68 68 27 e2 00 6a 6d 1a 00 00 02 01
30 f0 00 00 6a 0f 6a 0f 84 82 70 40 d1 a0 29 50
30 20 3a 00 1d 4e 31 00 00 1e 22 68 70 a0 d0 a0
29 50 30 20 3a 00 1d 4e 31 00 00 1a 00 00 00 00
00 00 00 00 00 00 00 00 00 00 00 00 00 00 00 00
00 00 00 00 00 00 00 00 00 00 00 00 00 00 00 00
00 00 00 00 00 00 00 00 00 00 00 00 00 00 00 be

70 12 79 03 00 01 00 0c dc 1e ac 0d 70 0d a0 05
90 78 fe bb 0f 00 0a a4 14 0e 00 00 01 23 00 00
00 03 01 50 30 f5 01 88 6f 0d 9f 00 2f 80 1f 00
9f 05 2c 00 04 80 09 00 e8 2b 01 00 6f 0d 9f 00
2f 80 1f 00 9f 05 28 00 04 00 09 00 60 08 01 08
6f 0d 3f 01 2f 80 1f 00 9f 05 3b 00 04 00 09 00
94 6f 00 00 7f 07 9f 00 07 80 1f 00 37 04 3f 00
17 80 07 00 00 00 00 00 00 00 00 00 00 00 e1 90

00 ff ff ff ff ff ff 00 1e 6d 4f 78 00 00 13 da
09 23 01 04 b5 4f 23 78 f9 bc 61 ad 51 3e b4 26
0d 50 54 f7 df 00 71 4f 81 40 81 80 81 c0 d1 c0
01 01 b3 00 95 00 c8 dd 70 40 d1 a0 46 50 30 20
3a 00 1d 4e 31 00 00 1a 00 00 00 fd 0c 30 f0 91
91 82 01 0a 20 20 20 20 20 20 00 00 00 fc 00 4c
47 20 55 4c 54 52 41 47 45 41 52 0a 00 00 00 ff
00 35 30 39 54 4f 44 58 30 35 30 38 32 0a 02 2b

02 03 28 f1 23 09 07 07 83 01 00 00 e3 05 e3 21
e6 06 07 01 68 68 27 e2 00 6a 6d 1a 00 00 02 01
30 f0 00 00 6a 0f 6a 0f 84 82 70 40 d1 a0 29 50
30 20 3a 00 1d 4e 31 00 00 1e 22 68 70 a0 d0 a0
29 50 30 20 3a 00 1d 4e 31 00 00 1a 00 00 00 00
00 00 00 00 00 00 00 00 00 00 00 00 00 00 00 00
00 00 00 00 00 00 00 00 00 00 00 00 00 00 00 00
00 00 00 00 00 00 00 00 00 00 00 00 00 00 00 be

70 12 79 03 00 01 00 0c dc 1e ac 0d 70 0d a0 05
90 78 fe bb 0f 00 0a a4 14 0e 00 00 01 23 00 00
00 03 01 50 30 f5 01 88 6f 0d 9f 00 2f 80 1f 00
9f 05 2c 00 04 80 09 00 e8 2b 01 00 6f 0d 9f 00
2f 80 1f 00 9f 05 28 00 04 00 09 00 60 08 01 08
6f 0d 3f 01 2f 80 1f 00 9f 05 3b 00 04 00 09 00
94 6f 00 00 7f 07 9f 00 07 80 1f 00 37 04 3f 00
17 80 07 00 00 00 00 00 00 00 00 00 00 00 e1 90

----------------

Block 0, Base EDID:
  EDID Structure Version & Revision: 1.4
  Vendor & Product Identification:
    Manufacturer: GSM
    Model: 30799
    Serial Number: ...
    Made in: week 9 of 2025
  Basic Display Parameters & Features:
    Digital display
    Bits per primary color channel: 10
    DisplayPort interface
    Maximum image size: 79 cm x 35 cm
    Gamma: 2.20
    DPMS levels: Standby Suspend Off
    Supported color formats: RGB 4:4:4, YCrCb 4:4:4, YCrCb 4:2:2
    First detailed timing does not include the native pixel format and preferred refresh rate
    Display supports continuous frequencies
  Color Characteristics:
    Red  : 0.6777, 0.3193
    Green: 0.2451, 0.7031
    Blue : 0.1494, 0.0527
    White: 0.3125, 0.3291
  Established Timings I & II:
    IBM     :   720x400    70.081663 Hz   9:5     31.467 kHz     28.320000 MHz
    IBM     :   720x400    87.849542 Hz   9:5     39.444 kHz     35.500000 MHz
    DMT 0x04:   640x480    59.940476 Hz   4:3     31.469 kHz     25.175000 MHz
    Apple   :   640x480    66.666667 Hz   4:3     35.000 kHz     30.240000 MHz
    DMT 0x06:   640x480    75.000000 Hz   4:3     37.500 kHz     31.500000 MHz
    DMT 0x08:   800x600    56.250000 Hz   4:3     35.156 kHz     36.000000 MHz
    DMT 0x09:   800x600    60.316541 Hz   4:3     37.879 kHz     40.000000 MHz
    DMT 0x0a:   800x600    72.187572 Hz   4:3     48.077 kHz     50.000000 MHz
    DMT 0x0b:   800x600    75.000000 Hz   4:3     46.875 kHz     49.500000 MHz
    DMT 0x0f:  1024x768i   86.957532 Hz   4:3     35.522 kHz     44.900000 MHz
    DMT 0x10:  1024x768    60.003840 Hz   4:3     48.363 kHz     65.000000 MHz
    DMT 0x11:  1024x768    70.069359 Hz   4:3     56.476 kHz     75.000000 MHz
    DMT 0x12:  1024x768    75.028582 Hz   4:3     60.023 kHz     78.750000 MHz
    DMT 0x24:  1280x1024   75.024675 Hz   5:4     79.976 kHz    135.000000 MHz
  Standard Timings:
    DMT 0x15:  1152x864    75.000000 Hz   4:3     67.500 kHz    108.000000 MHz
    DMT 0x20:  1280x960    60.000000 Hz   4:3     60.000 kHz    108.000000 MHz
    DMT 0x23:  1280x1024   60.019740 Hz   5:4     63.981 kHz    108.000000 MHz
    DMT 0x55:  1280x720    60.000000 Hz  16:9     45.000 kHz     74.250000 MHz
    DMT 0x52:  1920x1080   60.000000 Hz  16:9     67.500 kHz    148.500000 MHz
    DMT 0x3a:  1680x1050   59.954250 Hz  16:10    65.290 kHz    146.250000 MHz
    DMT 0x2f:  1440x900    59.887445 Hz  16:10    55.935 kHz    106.500000 MHz
  Detailed Timing Descriptors:
    DTD 1:  3440x1440  100.000000 Hz  43:18   151.000 kHz    567.760000 MHz (797 mm x 334 mm)
                 Hfront   48 Hsync  32 Hback  240 Hpol P
                 Vfront    3 Vsync  10 Vback   57 Vpol N
    Display Range Limits:
      Monitor ranges (Range Limits Only): 48-240 Hz V, 400-400 kHz H, max dotclock 1300 MHz
    Display Product Name: 'LG ULTRAGEAR'
    Display Product Serial Number: ...
  Extension blocks: 2
Checksum: 0x2b

----------------

Block 1, CTA-861 Extension Block:
  Revision: 3
  Underscans IT Video Formats by default
  Basic audio support
  Supports YCbCr 4:4:4
  Supports YCbCr 4:2:2
  Native DTDs: 1
  Audio Data Block:
    Linear PCM:
      Max channels: 2
      Supported sample rates (kHz): 48 44.1 32
      Supported sample sizes (bits): 24 20 16
  Speaker Allocation Data Block:
    FL/FR - Front Left/Right
  Colorimetry Data Block:
    xvYCC601
    xvYCC709
    BT2020cYCC
    BT2020YCC
    BT2020RGB
    Gamut Boundary Description Metadata Profile P0
    sRGB
  HDR Static Metadata Data Block:
    Electro optical transfer functions:
      Traditional gamma - SDR luminance range
      Traditional gamma - HDR luminance range
      SMPTE ST2084
    Supported static metadata descriptors:
      Static metadata type 1
    Desired content max luminance: 104 (475.683 cd/m^2)
    Desired content max frame-average luminance: 104 (475.683 cd/m^2)
    Desired content min luminance: 39 (0.111 cd/m^2)
  Video Capability Data Block:
    YCbCr quantization: No Data
    RGB quantization: Selectable (via AVI Q)
    PT scan behavior: Always Underscanned
    IT scan behavior: Always Underscanned
    CE scan behavior: Always Underscanned
  Vendor-Specific Data Block (AMD), OUI 00-00-1A:
    Version: 2
    Feature Caps: 0x01
    Minimum Refresh Rate: 48 Hz
    Maximum Refresh Rate: 240 Hz
    Flags 1.x: 0x00
    Flags 2.x: 0x00
  Detailed Timing Descriptors:
    DTD 2:  3440x1440   60.001149 Hz  43:18    88.862 kHz    334.120000 MHz (797 mm x 334 mm)
                 Hfront   48 Hsync  32 Hback  240 Hpol P
                 Vfront    3 Vsync  10 Vback   28 Vpol P
    DTD 3:  3440x1440   50.000000 Hz  43:18    74.050 kHz    266.580000 MHz (797 mm x 334 mm)
                 Hfront   48 Hsync  32 Hback   80 Hpol P
                 Vfront    3 Vsync  10 Vback   28 Vpol N
Checksum: 0xbe  Unused space in Extension Block: 51 bytes

----------------

Block 2, DisplayID Extension Block:
  Version: 1.2
  Extension Count: 0
  Display Product Type: Standalone display device
  Display Parameters Data Block (0x01):
    Image size: 790.0 mm x 350.0 mm
    Display native pixel format: 3440x1440
    Feature support flags:
      Power management (DPM)
      Audio support on video interface
    Gamma: 2.20
    Aspect ratio: 3.54
    Dynamic bpc native: 12
    Dynamic bpc overall: 12
  Display Interface Data Block:
    Interface Type: DisplayPort
    Number of Links: 4
    Interface Standard Version: 1.4
    Supported bpc for RGB encoding: 8, 10, 12
    Supported Content Protection: HDCP 2.3
    Spread Spectrum: None
  Video Timing Modes Type 1 - Detailed Timings Data Block:
    DTD:  3440x1440  240.001871 Hz   0:0    356.403 kHz   1283.050000 MHz (aspect undefined, no 3D stereo, preferred)
               Hfront   48 Hsync  32 Hback   80 Hpol P
               Vfront    5 Vsync  10 Vback   30 Vpol P
    DTD:  3440x1440  144.003676 Hz   1:1    213.269 kHz    767.770000 MHz (aspect 1:1, no 3D stereo)
               Hfront   48 Hsync  32 Hback   80 Hpol P
               Vfront    5 Vsync  10 Vback   26 Vpol N
    DTD:  3440x1440  120.001773 Hz   0:0    180.003 kHz    676.810000 MHz (aspect undefined, no 3D stereo)
               Hfront   48 Hsync  32 Hback  240 Hpol P
               Vfront    5 Vsync  10 Vback   45 Vpol N
    DTD:  1920x1080  120.045219 Hz   1:1    137.332 kHz    285.650000 MHz (aspect 1:1, no 3D stereo)
               Hfront    8 Hsync  32 Hback  120 Hpol P
               Vfront   24 Vsync   8 Vback   32 Vpol P
  Checksum: 0xe1
Checksum: 0x90

----------------

Warnings:

Block 1, CTA-861 Extension Block:
  Video Capability Data Block: Set Selectable YCbCr Quantization to avoid interop issues.
  Video Capability Data Block: S_PT is equal to S_IT and S_CE, so should be set to 0 instead.
  Display Product Serial Number is set, so the Serial Number in the Base EDID should be 0.
EDID:
  Base EDID: Some timings are out of range of the Monitor Ranges:
    Horizontal Freq: 31.466 - 356.402 kHz (Monitor: 400.000 - 400.000 kHz)

Failures:

EDID:
  Extension Block 3 started with EDID header, ignoring Extension Blocks >= 3.

EDID conformity: FAIL
