edid-decode (hex):

00 ff ff ff ff ff ff 00 22 f0 70 42 01 00 00 00
20 15 01 03 80 3c 22 78 ee ce 04 a3 57 51 9e 27
0c 50 54 a1 08 00 b3 00 81 c0 a9 c0 d1 c0 81 80
a9 40 95 00 01 01 9d 34 80 64 70 38 1f 40 1e 14
35 00 56 50 21 00 00 1e 00 00 00 fd 00 31 4b 36
57 12 00 0a 20 20 20 20 20 20 00 00 00 fc 00 48
50 20 41 6c 6c 2d 69 6e 2d 4f 6e 65 00 00 00 ff
00 31 0a 20 20 20 20 20 20 20 20 20 20 20 00 76

00 ff ff ff ff ff ff 00 22 f0 70 42 01 00 00 00
20 15 01 03 80 3c 22 78 ee ce 04 a3 57 51 9e 27
0c 50 54 a1 08 00 b3 00 81 c0 a9 c0 d1 c0 81 80
a9 40 95 00 01 01 9d 34 80 64 70 38 1f 40 1e 14
35 00 56 50 21 00 00 1e 00 00 00 fd 00 31 4b 36
57 12 00 0a 20 20 20 20 20 20 00 00 00 fc 00 48
50 20 41 6c 6c 2d 69 6e 2d 4f 6e 65 00 00 00 ff
00 31 0a 20 20 20 20 20 20 20 20 20 20 20 00 76

----------------

Block 0, Base EDID:
  EDID Structure Version & Revision: 1.3
  Vendor & Product Identification:
    Manufacturer: HWP
    Model: 17008
    Serial Number: ...
    Made in: week 32 of 2011
  Basic Display Parameters & Features:
    Digital display
    Maximum image size: 60 cm x 34 cm
    Gamma: 2.20
    DPMS levels: Standby Suspend Off
    RGB color display
    Default (sRGB) color space is primary color space
    First detailed timing is the preferred timing
  Color Characteristics:
    Red  : 0.6396, 0.3398
    Green: 0.3193, 0.6191
    Blue : 0.1523, 0.0468
    White: 0.3134, 0.3281
  Established Timings I & II:
    IBM     :   720x400    70.081663 Hz   9:5     31.467 kHz     28.320000 MHz
    DMT 0x04:   640x480    59.940476 Hz   4:3     31.469 kHz     25.175000 MHz
    DMT 0x09:   800x600    60.316541 Hz   4:3     37.879 kHz     40.000000 MHz
    DMT 0x10:  1024x768    60.003840 Hz   4:3     48.363 kHz     65.000000 MHz
  Standard Timings:
    DMT 0x3a:  1680x1050   59.954250 Hz  16:10    65.290 kHz    146.250000 MHz
    DMT 0x55:  1280x720    60.000000 Hz  16:9     45.000 kHz     74.250000 MHz
    DMT 0x53:  1600x900    60.000000 Hz  16:9     60.000 kHz    108.000000 MHz (RB)
    DMT 0x52:  1920x1080   60.000000 Hz  16:9     67.500 kHz    148.500000 MHz
    DMT 0x23:  1280x1024   60.019740 Hz   5:4     63.981 kHz    108.000000 MHz
    DMT 0x33:  1600x1200   60.000000 Hz   4:3     75.000 kHz    162.000000 MHz
    DMT 0x2f:  1440x900    59.887445 Hz  16:10    55.935 kHz    106.500000 MHz
  Detailed Timing Descriptors:
    DTD 1:  1920x1080   60.016398 Hz  16:9     66.678 kHz    134.690000 MHz (598 mm x 336 mm)
                 Hfront   30 Hsync  20 Hback   50 Hpol P
                 Vfront    3 Vsync   5 Vback   23 Vpol P
    Display Range Limits:
      Monitor ranges (GTF): 49-75 Hz V, 54-87 kHz H, max dotclock 180 MHz
    Display Product Name: 'HP All-in-One'
    Display Product Serial Number: ...
Checksum: 0x76

----------------

Warnings:

Block 0, Base EDID:
  Vendor & Product Identification: The serial number is one of the known dummy values, it should probably be set to 0.
  Display Product Serial Number: ...
EDID:
  Base EDID: Some timings are out of range of the Monitor Ranges:
    Horizontal Freq: 31.466 - 75.000 kHz (Monitor: 54.000 - 87.000 kHz)

Failures:

Block 0, Base EDID:
  Basic Display Parameters & Features: sRGB is signaled, but the chromaticities do not match.
EDID:
  Extension Block 1 started with EDID header, ignoring Extension Blocks >= 1.

EDID conformity: FAIL
