edid-decode (hex):

00 ff ff ff ff ff ff 00 22 64 69 24 01 01 01 01
19 12 01 03 0a 2f 1e 78 ee dc 55 a3 59 48 9e 24
11 50 54 bf ef 80 b3 0f a9 40 90 40 90 4f 81 80
81 40 71 4f a9 4f 21 39 90 30 62 1a 1c 40 68 b0
36 00 da 29 11 00 00 1c 00 00 00 fd 00 38 4c 18
5e 15 00 0a 20 20 20 20 20 20 00 00 00 ff 00 38
32 35 4d 4a 33 59 59 30 30 30 34 33 00 00 00 fc
00 48 61 6e 6e 73 2e 47 20 48 69 32 32 31 00 ef

00 ff ff ff ff ff ff 00 22 64 69 24 01 01 01 01
19 12 01 03 0a 2f 1e 78 ee dc 55 a3 59 48 9e 24
11 50 54 bf ef 80 b3 0f a9 40 90 40 90 4f 81 80
81 40 71 4f a9 4f 21 39 90 30 62 1a 1c 40 68 b0
36 00 da 29 11 00 00 1c 00 00 00 fd 00 38 4c 18
5e 15 00 0a 20 20 20 20 20 20 00 00 00 ff 00 38
32 35 4d 4a 33 59 59 30 30 30 34 33 00 00 00 fc
00 48 61 6e 6e 73 2e 47 20 48 69 32 32 31 00 ef

----------------

Block 0, Base EDID:
  EDID Structure Version & Revision: 1.3
  Vendor & Product Identification:
    Manufacturer: HSD
    Model: 9321
    Serial Number: ...
    Made in: week 25 of 2008
  Basic Display Parameters & Features:
    Analog display
    Signal Level Standard: 0.700 : 0.300 : 1.000 V p-p
    Blank level equals black level
    Sync: Separate SyncOnGreen
    Maximum image size: 47 cm x 30 cm
    Gamma: 2.20
    DPMS levels: Standby Suspend Off
    RGB color display
    Default (sRGB) color space is primary color space
    First detailed timing is the preferred timing
  Color Characteristics:
    Red  : 0.6396, 0.3486
    Green: 0.2841, 0.6171
    Blue : 0.1416, 0.0673
    White: 0.3134, 0.3291
  Established Timings I & II:
    IBM     :   720x400    70.081663 Hz   9:5     31.467 kHz     28.320000 MHz
    DMT 0x04:   640x480    59.940476 Hz   4:3     31.469 kHz     25.175000 MHz
    Apple   :   640x480    66.666667 Hz   4:3     35.000 kHz     30.240000 MHz
    DMT 0x05:   640x480    72.808802 Hz   4:3     37.861 kHz     31.500000 MHz
    DMT 0x06:   640x480    75.000000 Hz   4:3     37.500 kHz     31.500000 MHz
    DMT 0x08:   800x600    56.250000 Hz   4:3     35.156 kHz     36.000000 MHz
    DMT 0x09:   800x600    60.316541 Hz   4:3     37.879 kHz     40.000000 MHz
    DMT 0x0a:   800x600    72.187572 Hz   4:3     48.077 kHz     50.000000 MHz
    DMT 0x0b:   800x600    75.000000 Hz   4:3     46.875 kHz     49.500000 MHz
    Apple   :   832x624    74.551266 Hz   4:3     49.726 kHz     57.284000 MHz
    DMT 0x10:  1024x768    60.003840 Hz   4:3     48.363 kHz     65.000000 MHz
    DMT 0x11:  1024x768    70.069359 Hz   4:3     56.476 kHz     75.000000 MHz
    DMT 0x12:  1024x768    75.028582 Hz   4:3     60.023 kHz     78.750000 MHz
    DMT 0x24:  1280x1024   75.024675 Hz   5:4     79.976 kHz    135.000000 MHz
    Apple   :  1152x870    75.061550 Hz 192:145   68.681 kHz    100.000000 MHz
  Standard Timings:
    DMT 0x3b:  1680x1050   74.892027 Hz  16:10    82.306 kHz    187.000000 MHz
    DMT 0x33:  1600x1200   60.000000 Hz   4:3     75.000 kHz    162.000000 MHz
    DMT 0x2a:  1400x1050   59.978442 Hz   4:3     65.317 kHz    121.750000 MHz
    DMT 0x2b:  1400x1050   74.866680 Hz   4:3     82.278 kHz    156.000000 MHz
    DMT 0x23:  1280x1024   60.019740 Hz   5:4     63.981 kHz    108.000000 MHz
    DMT 0x20:  1280x960    60.000000 Hz   4:3     60.000 kHz    108.000000 MHz
    DMT 0x15:  1152x864    75.000000 Hz   4:3     67.500 kHz    108.000000 MHz
    DMT 0x36:  1600x1200   75.000000 Hz   4:3     93.750 kHz    202.500000 MHz
  Detailed Timing Descriptors:
    DTD 1:  1680x1050   60.566028 Hz  16:10    65.290 kHz    146.250000 MHz (474 mm x 297 mm)
                 Hfront  104 Hsync 176 Hback  280 Hpol N
                 Vfront    3 Vsync   6 Vback   19 Vpol P
    Display Range Limits:
      Monitor ranges (GTF): 56-76 Hz V, 24-94 kHz H, max dotclock 210 MHz
    Display Product Serial Number: ...
    Display Product Name: 'Hanns.G Hi221'
Checksum: 0xef

----------------

Warnings:

Block 0, Base EDID:
  Vendor & Product Identification: The serial number is one of the known dummy values, it should probably be set to 0.

Failures:

Block 0, Base EDID:
  Basic Display Parameters & Features: sRGB is signaled, but the chromaticities do not match.
EDID:
  Extension Block 1 started with EDID header, ignoring Extension Blocks >= 1.

EDID conformity: FAIL
