edid-decode (hex):

00 ff ff ff ff ff ff 00 32 63 2b 28 01 01 01 01
27 13 01 03 80 30 1b 78 ee ff f5 a5 56 49 9d 24
16 50 54 a1 08 00 81 40 81 80 95 00 01 01 b3 00
01 01 01 01 01 01 02 3a 80 18 71 38 2d 40 58 2c
45 00 df 0d 11 00 00 1e 00 00 00 fd 00 30 4c 18
5e 11 00 0a 20 20 20 20 20 20 00 00 00 fc 00 54
2d 50 4c 41 54 46 4f 52 4d 53 0a 20 00 00 00 ff
00 31 42 43 36 30 31 41 43 0a 20 20 20 20 00 ec

----------------

Block 0, Base EDID:
  EDID Structure Version & Revision: 1.3
  Vendor & Product Identification:
    Manufacturer: LSC
    Model: 10283
    Serial Number: ...
    Made in: week 39 of 2009
  Basic Display Parameters & Features:
    Digital display
    Maximum image size: 48 cm x 27 cm
    Gamma: 2.20
    DPMS levels: Standby Suspend Off
    RGB color display
    Default (sRGB) color space is primary color space
    First detailed timing is the preferred timing
  Color Characteristics:
    Red  : 0.6474, 0.3388
    Green: 0.2880, 0.6162
    Blue : 0.1435, 0.0888
    White: 0.3134, 0.3291
  Established Timings I & II:
    IBM     :   720x400    70.081663 Hz   9:5     31.467 kHz     28.320000 MHz
    DMT 0x04:   640x480    59.940476 Hz   4:3     31.469 kHz     25.175000 MHz
    DMT 0x09:   800x600    60.316541 Hz   4:3     37.879 kHz     40.000000 MHz
    DMT 0x10:  1024x768    60.003840 Hz   4:3     48.363 kHz     65.000000 MHz
  Standard Timings:
    DMT 0x20:  1280x960    60.000000 Hz   4:3     60.000 kHz    108.000000 MHz
    DMT 0x23:  1280x1024   60.019740 Hz   5:4     63.981 kHz    108.000000 MHz
    DMT 0x2f:  1440x900    59.887445 Hz  16:10    55.935 kHz    106.500000 MHz
    DMT 0x3a:  1680x1050   59.954250 Hz  16:10    65.290 kHz    146.250000 MHz
  Detailed Timing Descriptors:
    DTD 1:  1920x1080   60.000000 Hz  16:9     67.500 kHz    148.500000 MHz (479 mm x 269 mm)
                 Hfront   88 Hsync  44 Hback  148 Hpol P
                 Vfront    4 Vsync   5 Vback   36 Vpol P
    Display Range Limits:
      Monitor ranges (GTF): 48-76 Hz V, 24-94 kHz H, max dotclock 170 MHz
    Display Product Name: 'T-PLATFORMS'
    Display Product Serial Number: ...
Checksum: 0xec

----------------

Warnings:

Block 0, Base EDID:
  Vendor & Product Identification: The serial number is one of the known dummy values, it should probably be set to 0.

Failures:

Block 0, Base EDID:
  Basic Display Parameters & Features: sRGB is signaled, but the chromaticities do not match.

EDID conformity: FAIL
