edid-decode (hex):

00 ff ff ff ff ff ff 00 38 a3 01 69 01 01 01 01
11 1b 01 03 80 34 20 78 ea 4d a5 a8 55 4c 9f 26
10 50 54 bf ef 80 81 c0 81 40 81 80 8b c0 95 00
90 40 b3 00 a9 40 28 3c 80 a0 70 b0 23 40 30 20
36 00 06 44 21 00 00 1a 00 00 00 fd 00 31 55 1f
78 11 00 0a 20 20 20 20 20 20 00 00 00 fc 00 50
32 34 32 57 0a 20 20 20 20 20 20 20 00 00 00 ff
00 37 34 32 30 30 31 30 36 54 57 0a 20 20 01 71

02 03 17 81 46 90 04 03 1f 13 12 68 03 0c 00 10
00 30 2d 01 e2 00 4f 28 3c 80 a0 70 b0 23 40 30
20 36 00 06 44 21 00 00 1a 53 20 c0 a0 30 b0 25
40 30 20 5a 00 03 44 11 00 00 1a e4 3e b0 a0 40
80 37 70 30 20 3a 00 44 06 12 00 00 1a 72 1f b0
a0 40 c0 1c 30 30 20 37 00 44 03 11 00 00 1a 02
3a 80 18 71 38 2d 40 94 2c 45 00 06 23 21 00 00
1e 00 00 00 00 00 00 00 00 00 00 00 00 00 00 90

00 ff ff ff ff ff ff 00 38 a3 01 69 01 01 01 01
11 1b 01 03 80 34 20 78 ea 4d a5 a8 55 4c 9f 26
10 50 54 bf ef 80 81 c0 81 40 81 80 8b c0 95 00
90 40 b3 00 a9 40 28 3c 80 a0 70 b0 23 40 30 20
36 00 06 44 21 00 00 1a 00 00 00 fd 00 31 55 1f
78 11 00 0a 20 20 20 20 20 20 00 00 00 fc 00 50
32 34 32 57 0a 20 20 20 20 20 20 20 00 00 00 ff
00 37 34 32 30 30 31 30 36 54 57 0a 20 20 01 71

02 03 17 81 46 90 04 03 1f 13 12 68 03 0c 00 10
00 30 2d 01 e2 00 4f 28 3c 80 a0 70 b0 23 40 30
20 36 00 06 44 21 00 00 1a 53 20 c0 a0 30 b0 25
40 30 20 5a 00 03 44 11 00 00 1a e4 3e b0 a0 40
80 37 70 30 20 3a 00 44 06 12 00 00 1a 72 1f b0
a0 40 c0 1c 30 30 20 37 00 44 03 11 00 00 1a 02
3a 80 18 71 38 2d 40 94 2c 45 00 06 23 21 00 00
1e 00 00 00 00 00 00 00 00 00 00 00 00 00 00 90

----------------

Block 0, Base EDID:
  EDID Structure Version & Revision: 1.3
  Vendor & Product Identification:
    Manufacturer: NEC
    Model: 26881
    Serial Number: ...
    Made in: week 17 of 2017
  Basic Display Parameters & Features:
    Digital display
    Maximum image size: 52 cm x 32 cm
    Gamma: 2.20
    DPMS levels: Standby Suspend Off
    RGB color display
    First detailed timing is the preferred timing
  Color Characteristics:
    Red  : 0.6572, 0.3320
    Green: 0.2998, 0.6220
    Blue : 0.1503, 0.0644
    White: 0.3134, 0.3291
  Established Timings I & II:
    IBM     :   720x400    70.081663 Hz   9:5     31.467 kHz     28.320000 MHz
    DMT 0x04:   640x480    59.940476 Hz   4:3     31.469 kHz     25.175000 MHz
    Apple   :   640x480    66.666667 Hz   4:3     35.000 kHz     30.240000 MHz
    DMT 0x05:   640x480    72.808802 Hz   4:3     37.861 kHz     31.500000 MHz
    DMT 0x06:   640x480    75.000000 Hz   4:3     37.500 kHz     31.500000 MHz
    DMT 0x08:   800x600    56.250000 Hz   4:3     35.156 kHz     36.000000 MHz
    DMT 0x09:   800x600    60.316541 Hz   4:3     37.879 kHz     40.000000 MHz
    DMT 0x0a:   800x600    72.187572 Hz   4:3     48.077 kHz     50.000000 MHz
    DMT 0x0b:   800x600    75.000000 Hz   4:3     46.875 kHz     49.500000 MHz
    Apple   :   832x624    74.551266 Hz   4:3     49.726 kHz     57.284000 MHz
    DMT 0x10:  1024x768    60.003840 Hz   4:3     48.363 kHz     65.000000 MHz
    DMT 0x11:  1024x768    70.069359 Hz   4:3     56.476 kHz     75.000000 MHz
    DMT 0x12:  1024x768    75.028582 Hz   4:3     60.023 kHz     78.750000 MHz
    DMT 0x24:  1280x1024   75.024675 Hz   5:4     79.976 kHz    135.000000 MHz
    Apple   :  1152x870    75.061550 Hz 192:145   68.681 kHz    100.000000 MHz
  Standard Timings:
    DMT 0x55:  1280x720    60.000000 Hz  16:9     45.000 kHz     74.250000 MHz
    DMT 0x20:  1280x960    60.000000 Hz   4:3     60.000 kHz    108.000000 MHz
    DMT 0x23:  1280x1024   60.019740 Hz   5:4     63.981 kHz    108.000000 MHz
    GTF     :  1360x765    60.000341 Hz  16:9     47.520 kHz     84.396000 MHz
    DMT 0x2f:  1440x900    59.887445 Hz  16:10    55.935 kHz    106.500000 MHz
    DMT 0x2a:  1400x1050   59.978442 Hz   4:3     65.317 kHz    121.750000 MHz
    DMT 0x3a:  1680x1050   59.954250 Hz  16:10    65.290 kHz    146.250000 MHz
    DMT 0x33:  1600x1200   60.000000 Hz   4:3     75.000 kHz    162.000000 MHz
  Detailed Timing Descriptors:
    DTD 1:  1920x1200   59.950171 Hz  16:10    74.038 kHz    154.000000 MHz (518 mm x 324 mm)
                 Hfront   48 Hsync  32 Hback   80 Hpol P
                 Vfront    3 Vsync   6 Vback   26 Vpol N
    Display Range Limits:
      Monitor ranges (GTF): 49-85 Hz V, 31-120 kHz H, max dotclock 170 MHz
    Display Product Name: 'P242W'
    Display Product Serial Number: ...
  Extension blocks: 1
Checksum: 0x71

----------------

Block 1, CTA-861 Extension Block:
  Revision: 3
  Underscans IT Video Formats by default
  Native DTDs: 1
  Video Data Block:
    VIC  16:  1920x1080   60.000000 Hz  16:9     67.500 kHz    148.500000 MHz (native)
    VIC   4:  1280x720    60.000000 Hz  16:9     45.000 kHz     74.250000 MHz
    VIC   3:   720x480    59.940060 Hz  16:9     31.469 kHz     27.000000 MHz
    VIC  31:  1920x1080   50.000000 Hz  16:9     56.250 kHz    148.500000 MHz
    VIC  19:  1280x720    50.000000 Hz  16:9     37.500 kHz     74.250000 MHz
    VIC  18:   720x576    50.000000 Hz  16:9     31.250 kHz     27.000000 MHz
  Vendor-Specific Data Block (HDMI), OUI 00-0C-03:
    Source physical address: 1.0.0.0
    DC_36bit
    DC_30bit
    Maximum TMDS clock: 225 MHz
    Supported Content Types:
      Graphics
  Video Capability Data Block:
    YCbCr quantization: No Data
    RGB quantization: Selectable (via AVI Q)
    PT scan behavior: No Data
    IT scan behavior: Supports both over- and underscan
    CE scan behavior: Supports both over- and underscan
  Detailed Timing Descriptors:
    DTD 2:  1920x1200   59.950171 Hz  16:10    74.038 kHz    154.000000 MHz (518 mm x 324 mm)
                 Hfront   48 Hsync  32 Hback   80 Hpol P
                 Vfront    3 Vsync   6 Vback   26 Vpol N
    DTD 3:   960x1200   59.728317 Hz   4:5     73.884 kHz     82.750000 MHz (259 mm x 324 mm)
                 Hfront   48 Hsync  32 Hback   80 Hpol P
                 Vfront    5 Vsync  10 Vback   22 Vpol N
    DTD 4:  1200x1920   59.940432 Hz   5:8    118.382 kHz    161.000000 MHz (324 mm x 518 mm)
                 Hfront   48 Hsync  32 Hback   80 Hpol P
                 Vfront    3 Vsync  10 Vback   42 Vpol N
    DTD 5:  1200x960    59.910098 Hz   5:4     59.191 kHz     80.500000 MHz (324 mm x 259 mm)
                 Hfront   48 Hsync  32 Hback   80 Hpol P
                 Vfront    3 Vsync   7 Vback   18 Vpol N
    DTD 6:  1920x1080   60.000000 Hz  16:9     67.500 kHz    148.500000 MHz (518 mm x 291 mm)
                 Hfront  148 Hsync  44 Hback   88 Hpol P
                 Vfront    4 Vsync   5 Vback   36 Vpol P
Checksum: 0x90  Unused space in Extension Block: 14 bytes

----------------

Warnings:

Block 0, Base EDID:
  Vendor & Product Identification: The serial number is one of the known dummy values, it should probably be set to 0.
  Standard Timings: Standard Timing 1360x765 has a dubious odd vertical resolution.
Block 1, CTA-861 Extension Block:
  Video Data Block: VIC 16 and the first DTD are not identical. Is this intended?
  Detailed Timing Descriptor #6: DTD is similar but not identical to VIC 16.
  Display Product Serial Number is set, so the Serial Number in the Base EDID should be 0.
  Add a Colorimetry Data Block with the sRGB colorimetry bit set to avoid interop issues.

Failures:

Block 1, CTA-861 Extension Block:
  Detailed Timing Descriptor #4: Mismatch of image size 324x518 mm vs display size 520x320 mm.
  Detailed Timing Descriptor #5: Mismatch of image size 324x259 mm vs display size 520x320 mm.
EDID:
  Extension Block 2 started with EDID header, ignoring Extension Blocks >= 2.
  Base EDID: The DTD max image size is 518x518mm, which is larger than the display size 520.0x320.0mm.
  CTA-861: Native progressive timings are a mix of several resolutions.

EDID conformity: FAIL
