edid-decode (hex):

00 ff ff ff ff ff ff 00 06 af a5 b0 a5 b0 00 00
1a 20 01 04 b5 22 16 78 03 f2 25 91 57 58 95 2a
1f 50 54 00 00 00 01 01 01 01 01 01 01 01 01 01
01 01 01 01 01 01 7e 97 80 b8 70 b0 50 40 30 20
aa 00 58 d7 10 00 00 18 00 00 00 00 00 00 00 00
00 00 00 00 00 00 00 00 00 20 00 00 00 fd 00 30
90 b9 b9 27 01 0a 20 20 20 20 20 20 00 00 00 fe
00 42 31 36 30 55 41 4e 30 35 2e 41 20 0a 00 cf

00 ff ff ff ff ff ff 00 06 af a5 b0 a5 b0 00 00
1a 20 01 04 b5 22 16 78 03 f2 25 91 57 58 95 2a
1f 50 54 00 00 00 01 01 01 01 01 01 01 01 01 01
01 01 01 01 01 01 7e 97 80 b8 70 b0 50 40 30 20
aa 00 58 d7 10 00 00 18 00 00 00 00 00 00 00 00
00 00 00 00 00 00 00 00 00 20 00 00 00 fd 00 30
90 b9 b9 27 01 0a 20 20 20 20 20 20 00 00 00 fe
00 42 31 36 30 55 41 4e 30 35 2e 41 20 0a 00 cf

----------------

Block 0, Base EDID:
  EDID Structure Version & Revision: 1.4
  Vendor & Product Identification:
    Manufacturer: AUO
    Model: 45221
    Serial Number: ...
    Made in: week 26 of 2022
  Basic Display Parameters & Features:
    Digital display
    Bits per primary color channel: 10
    DisplayPort interface
    Maximum image size: 34 cm x 22 cm
    Gamma: 2.20
    Supported color formats: RGB 4:4:4
    First detailed timing includes the native pixel format and preferred refresh rate
    Display supports continuous frequencies
  Color Characteristics:
    Red  : 0.5693, 0.3427
    Green: 0.3437, 0.5839
    Blue : 0.1640, 0.1230
    White: 0.3134, 0.3291
  Established Timings I & II: none
  Standard Timings: none
  Detailed Timing Descriptors:
    DTD 1:  1920x1200  144.003981 Hz  16:10   184.325 kHz    387.820000 MHz (344 mm x 215 mm)
                 Hfront   48 Hsync  32 Hback  104 Hpol N
                 Vfront   10 Vsync  10 Vback   60 Vpol N
    Manufacturer-Specified Display Descriptor (0x00): 00 00 00 00 00 00 00 00 00 00 00 00 00 00 00 20 '............... '
    Display Range Limits:
      Monitor ranges (Range Limits Only): 48-144 Hz V, 185-185 kHz H, max dotclock 390 MHz
    Alphanumeric Data String: 'B160UAN05.A '
Checksum: 0xcf

----------------

Warnings:

Block 0, Base EDID:
  Missing Display Product Name.
EDID:
  Base EDID: Some timings are out of range of the Monitor Ranges:
    Horizontal Freq: 184.325 - 184.325 kHz (Monitor: 185.000 - 185.000 kHz)
    Could be due to a Monitor Range off-by-one rounding issue

Failures:

Block 0, Base EDID:
  Alphanumeric Data String: One or more trailing spaces before newline.
EDID:
  Extension Block 1 started with EDID header, ignoring Extension Blocks >= 1.

EDID conformity: FAIL
