edid-decode (hex):

00 ff ff ff ff ff ff 00 26 cf 33 05 00 00 00 00
02 16 01 04 80 1d 10 78 0a 08 00 97 5a 54 94 27
21 50 54 00 00 00 01 01 01 01 01 01 01 01 01 01
01 01 01 01 01 01 14 1e 56 c2 50 00 36 30 3a 24
37 00 25 a4 10 00 00 18 00 00 00 00 00 00 00 00
00 00 00 00 00 00 00 00 00 00 00 00 00 fe 00 49
6e 66 6f 56 69 73 69 6f 6e 0a 20 20 00 00 00 fe
00 4d 31 33 33 4e 57 4e 31 20 52 31 20 0a 00 0b

----------------

Block 0, Base EDID:
  EDID Structure Version & Revision: 1.4
  Vendor & Product Identification:
    Manufacturer: IVO
    Model: 1331
    Made in: week 2 of 2012
  Basic Display Parameters & Features:
    Digital display
    Color depth is undefined
    Digital interface is not defined
    Maximum image size: 29 cm x 16 cm
    Gamma: 2.20
    Supported color formats: RGB 4:4:4, YCrCb 4:4:4
    First detailed timing includes the native pixel format and preferred refresh rate
  Color Characteristics:
    Red  : 0.5898, 0.3515
    Green: 0.3300, 0.5781
    Blue : 0.1523, 0.1289
    White: 0.3125, 0.3281
  Established Timings I & II: none
  Standard Timings: none
  Detailed Timing Descriptors:
    DTD 1:  1366x768    60.047414 Hz 683:384   49.359 kHz     77.000000 MHz (293 mm x 164 mm)
                 Hfront   58 Hsync  36 Hback  100 Hpol N
                 Vfront    3 Vsync   7 Vback   44 Vpol N
    Empty Descriptor
    Alphanumeric Data String: 'InfoVision'
    Alphanumeric Data String: 'M133NWN1 R1 '
Checksum: 0x0b

----------------

Warnings:

Block 0, Base EDID:
  Missing Display Product Name.

Failures:

Block 0, Base EDID:
  Empty Descriptor: Use Dummy Descriptor instead of all zeroes.
  Alphanumeric Data String: One or more trailing spaces before newline.

EDID conformity: FAIL
