edid-decode (hex):

00 ff ff ff ff ff ff 00 22 0e 40 19 00 00 00 00
00 1a 01 04 80 35 1d 78 0a 01 35 a6 55 51 9f 28
0f 50 54 00 00 00 01 01 01 01 01 01 01 01 01 01
01 01 01 01 01 01 94 34 80 64 70 38 1f 40 10 0e
84 00 0f 28 21 00 00 1e 00 00 00 10 00 00 00 00
00 00 00 00 00 00 00 00 00 00 00 00 00 10 00 00
00 00 00 00 00 00 00 00 00 00 00 00 00 00 00 fc
00 48 50 20 38 30 30 20 47 33 20 41 69 4f 00 14

00 ff ff ff ff ff ff 00 22 0e 40 19 00 00 00 00
00 1a 01 04 80 35 1d 78 0a 01 35 a6 55 51 9f 28
0f 50 54 00 00 00 01 01 01 01 01 01 01 01 01 01
01 01 01 01 01 01 94 34 80 64 70 38 1f 40 10 0e
84 00 0f 28 21 00 00 1e 00 00 00 10 00 00 00 00
00 00 00 00 00 00 00 00 00 00 00 00 00 10 00 00
00 00 00 00 00 00 00 00 00 00 00 00 00 00 00 fc
00 48 50 20 38 30 30 20 47 33 20 41 69 4f 00 14

----------------

Block 0, Base EDID:
  EDID Structure Version & Revision: 1.4
  Vendor & Product Identification:
    Manufacturer: HPN
    Model: 6464
    Made in: 2016
  Basic Display Parameters & Features:
    Digital display
    Color depth is undefined
    Digital interface is not defined
    Maximum image size: 53 cm x 29 cm
    Gamma: 2.20
    Supported color formats: RGB 4:4:4, YCrCb 4:4:4
    First detailed timing includes the native pixel format and preferred refresh rate
  Color Characteristics:
    Red  : 0.6484, 0.3320
    Green: 0.3164, 0.6220
    Blue : 0.1562, 0.0615
    White: 0.3134, 0.3291
  Established Timings I & II: none
  Standard Timings: none
  Detailed Timing Descriptors:
    DTD 1:  1920x1080   59.976295 Hz  16:9     66.634 kHz    134.600000 MHz (527 mm x 296 mm)
                 Hfront   16 Hsync  14 Hback   70 Hpol P
                 Vfront    8 Vsync   4 Vback   19 Vpol P
    Dummy Descriptor:
    Dummy Descriptor:
    Display Product Name: 'HP 800 G3 AiO'
Checksum: 0x14

----------------

Failures:

EDID:
  Extension Block 1 started with EDID header, ignoring Extension Blocks >= 1.

EDID conformity: FAIL
