edid-decode (hex):

00 ff ff ff ff ff ff 00 09 e5 83 0a 00 00 00 00
19 1f 01 04 a5 1b 12 78 03 91 50 a7 51 4a 9d 26
0f 50 54 00 00 00 01 01 01 01 01 01 01 01 01 01
01 01 01 01 01 01 90 51 70 a0 80 a0 3c 50 30 20
36 00 12 b7 10 00 00 1a 90 51 70 a0 80 a0 b3 51
30 20 36 00 12 b7 10 00 00 1a 00 00 00 fe 00 42
4f 45 20 48 46 0a 20 20 20 20 20 20 00 00 00 fe
00 4e 56 31 33 30 57 54 4d 2d 4b 32 31 0a 00 55

00 ff ff ff ff ff ff 00 09 e5 83 0a 00 00 00 00
19 1f 01 04 a5 1b 12 78 03 91 50 a7 51 4a 9d 26
0f 50 54 00 00 00 01 01 01 01 01 01 01 01 01 01
01 01 01 01 01 01 90 51 70 a0 80 a0 3c 50 30 20
36 00 12 b7 10 00 00 1a 90 51 70 a0 80 a0 b3 51
30 20 36 00 12 b7 10 00 00 1a 00 00 00 fe 00 42
4f 45 20 48 46 0a 20 20 20 20 20 20 00 00 00 fe
00 4e 56 31 33 30 57 54 4d 2d 4b 32 31 0a 00 55

----------------

Block 0, Base EDID:
  EDID Structure Version & Revision: 1.4
  Vendor & Product Identification:
    Manufacturer: BOE
    Model: 2691
    Made in: week 25 of 2021
  Basic Display Parameters & Features:
    Digital display
    Bits per primary color channel: 8
    DisplayPort interface
    Maximum image size: 27 cm x 18 cm
    Gamma: 2.20
    Supported color formats: RGB 4:4:4
    First detailed timing includes the native pixel format and preferred refresh rate
    Display supports continuous frequencies
  Color Characteristics:
    Red  : 0.6542, 0.3173
    Green: 0.2890, 0.6142
    Blue : 0.1494, 0.0595
    White: 0.3125, 0.3281
  Established Timings I & II: none
  Standard Timings: none
  Detailed Timing Descriptors:
    DTD 1:  2160x1440   60.000000 Hz   3:2     90.000 kHz    208.800000 MHz (274 mm x 183 mm)
                 Hfront   48 Hsync  32 Hback   80 Hpol P
                 Vfront    3 Vsync   6 Vback   51 Vpol N
    DTD 2:  2160x1440   48.000000 Hz   3:2     90.000 kHz    208.800000 MHz (274 mm x 183 mm)
                 Hfront   48 Hsync  32 Hback   80 Hpol P
                 Vfront    3 Vsync   6 Vback  426 Vpol N
    Alphanumeric Data String: 'BOE HF'
    Alphanumeric Data String: 'NV130WTM-K21'
Checksum: 0x55

----------------

Warnings:

Block 0, Base EDID:
  Missing Display Product Name.

Failures:

Block 0, Base EDID:
  Missing Display Range Limits Descriptor.
EDID:
  Extension Block 1 started with EDID header, ignoring Extension Blocks >= 1.

EDID conformity: FAIL
