edid-decode (hex):

00 ff ff ff ff ff ff 00 31 03 00 29 00 00 00 00
1c 1e 01 03 80 44 1c 78 2a 64 f5 ad 50 49 a3 22
13 50 54 a1 0b 00 71 4f 81 c0 81 40 81 80 95 00
a9 c0 b3 00 d1 c0 7f 48 00 e0 a0 38 1f 40 30 20
35 00 a9 1f 21 00 00 1e 00 00 00 fd 00 30 4b 36
54 1e 00 0a 20 20 20 20 20 20 00 00 00 fc 00 46
49 4f 44 49 4f 20 41 46 31 31 46 0a 00 00 00 ff
00 0a 20 20 20 20 20 20 20 20 20 20 20 20 01 30

02 03 29 f1 4b 01 02 03 04 05 90 11 12 13 14 1f
23 09 7f 07 83 01 00 00 67 03 0c 00 10 00 b8 42
68 1a 00 00 01 01 30 4b 00 02 3a 80 18 71 38 2d
40 58 2c 45 00 a9 1f 21 00 00 1e 9e 5a 00 e0 a0
38 1f 40 30 20 35 00 a9 1f 21 00 00 1a 85 21 56
aa 51 00 1e 30 46 8f 33 00 a9 1f 21 00 00 1e 00
00 00 00 00 00 00 00 00 00 00 00 00 00 00 00 00
00 00 00 00 00 00 00 00 00 00 00 00 00 00 00 34

00 ff ff ff ff ff ff 00 31 03 00 29 00 00 00 00
1c 1e 01 03 80 44 1c 78 2a 64 f5 ad 50 49 a3 22
13 50 54 a1 0b 00 71 4f 81 c0 81 40 81 80 95 00
a9 c0 b3 00 d1 c0 7f 48 00 e0 a0 38 1f 40 30 20
35 00 a9 1f 21 00 00 1e 00 00 00 fd 00 30 4b 36
54 1e 00 0a 20 20 20 20 20 20 00 00 00 fc 00 46
49 4f 44 49 4f 20 41 46 31 31 46 0a 00 00 00 ff
00 0a 20 20 20 20 20 20 20 20 20 20 20 20 01 30

02 03 29 f1 4b 01 02 03 04 05 90 11 12 13 14 1f
23 09 7f 07 83 01 00 00 67 03 0c 00 10 00 b8 42
68 1a 00 00 01 01 30 4b 00 02 3a 80 18 71 38 2d
40 58 2c 45 00 a9 1f 21 00 00 1e 9e 5a 00 e0 a0
38 1f 40 30 20 35 00 a9 1f 21 00 00 1a 85 21 56
aa 51 00 1e 30 46 8f 33 00 a9 1f 21 00 00 1e 00
00 00 00 00 00 00 00 00 00 00 00 00 00 00 00 00
00 00 00 00 00 00 00 00 00 00 00 00 00 00 00 34

----------------

Block 0, Base EDID:
  EDID Structure Version & Revision: 1.3
  Vendor & Product Identification:
    Manufacturer: LHC
    Model: 10496
    Made in: week 28 of 2020
  Basic Display Parameters & Features:
    Digital display
    Maximum image size: 68 cm x 28 cm
    Gamma: 2.20
    DPMS levels: Off
    RGB color display
    First detailed timing is the preferred timing
  Color Characteristics:
    Red  : 0.6767, 0.3144
    Green: 0.2861, 0.6367
    Blue : 0.1357, 0.0771
    White: 0.3134, 0.3291
  Established Timings I & II:
    IBM     :   720x400    70.081663 Hz   9:5     31.467 kHz     28.320000 MHz
    DMT 0x04:   640x480    59.940476 Hz   4:3     31.469 kHz     25.175000 MHz
    DMT 0x09:   800x600    60.316541 Hz   4:3     37.879 kHz     40.000000 MHz
    DMT 0x10:  1024x768    60.003840 Hz   4:3     48.363 kHz     65.000000 MHz
    DMT 0x12:  1024x768    75.028582 Hz   4:3     60.023 kHz     78.750000 MHz
    DMT 0x24:  1280x1024   75.024675 Hz   5:4     79.976 kHz    135.000000 MHz
  Standard Timings:
    DMT 0x15:  1152x864    75.000000 Hz   4:3     67.500 kHz    108.000000 MHz
    DMT 0x55:  1280x720    60.000000 Hz  16:9     45.000 kHz     74.250000 MHz
    DMT 0x20:  1280x960    60.000000 Hz   4:3     60.000 kHz    108.000000 MHz
    DMT 0x23:  1280x1024   60.019740 Hz   5:4     63.981 kHz    108.000000 MHz
    DMT 0x2f:  1440x900    59.887445 Hz  16:10    55.935 kHz    106.500000 MHz
    DMT 0x53:  1600x900    60.000000 Hz  16:9     60.000 kHz    108.000000 MHz (RB)
    DMT 0x3a:  1680x1050   59.954250 Hz  16:10    65.290 kHz    146.250000 MHz
    DMT 0x52:  1920x1080   60.000000 Hz  16:9     67.500 kHz    148.500000 MHz
  Detailed Timing Descriptors:
    DTD 1:  2560x1080   60.002768 Hz  64:27    66.663 kHz    185.590000 MHz (681 mm x 287 mm)
                 Hfront   48 Hsync  32 Hback  144 Hpol P
                 Vfront    3 Vsync   5 Vback   23 Vpol P
    Display Range Limits:
      Monitor ranges (GTF): 48-75 Hz V, 54-84 kHz H, max dotclock 300 MHz
    Display Product Name: 'FIODIO AF11F'
    Display Product Serial Number: ...
  Extension blocks: 1
Checksum: 0x30

----------------

Block 1, CTA-861 Extension Block:
  Revision: 3
  Underscans IT Video Formats by default
  Basic audio support
  Supports YCbCr 4:4:4
  Supports YCbCr 4:2:2
  Native DTDs: 1
  Video Data Block:
    VIC   1:   640x480    59.940476 Hz   4:3     31.469 kHz     25.175000 MHz
    VIC   2:   720x480    59.940060 Hz   4:3     31.469 kHz     27.000000 MHz
    VIC   3:   720x480    59.940060 Hz  16:9     31.469 kHz     27.000000 MHz
    VIC   4:  1280x720    60.000000 Hz  16:9     45.000 kHz     74.250000 MHz
    VIC   5:  1920x1080i  60.000000 Hz  16:9     33.750 kHz     74.250000 MHz
    VIC  16:  1920x1080   60.000000 Hz  16:9     67.500 kHz    148.500000 MHz (native)
    VIC  17:   720x576    50.000000 Hz   4:3     31.250 kHz     27.000000 MHz
    VIC  18:   720x576    50.000000 Hz  16:9     31.250 kHz     27.000000 MHz
    VIC  19:  1280x720    50.000000 Hz  16:9     37.500 kHz     74.250000 MHz
    VIC  20:  1920x1080i  50.000000 Hz  16:9     28.125 kHz     74.250000 MHz
    VIC  31:  1920x1080   50.000000 Hz  16:9     56.250 kHz    148.500000 MHz
  Audio Data Block:
    Linear PCM:
      Max channels: 2
      Supported sample rates (kHz): 192 176.4 96 88.2 48 44.1 32
      Supported sample sizes (bits): 24 20 16
  Speaker Allocation Data Block:
    FL/FR - Front Left/Right
  Vendor-Specific Data Block (HDMI), OUI 00-0C-03:
    Source physical address: 1.0.0.0
    Supports_AI
    DC_36bit
    DC_30bit
    DC_Y444
    Maximum TMDS clock: 330 MHz
  Vendor-Specific Data Block (AMD), OUI 00-00-1A:
    Version: 1
    Feature Caps: 0x01
    Minimum Refresh Rate: 48 Hz
    Maximum Refresh Rate: 75 Hz
    Flags 1.x: 0x00
  Detailed Timing Descriptors:
    DTD 2:  1920x1080   60.000000 Hz  16:9     67.500 kHz    148.500000 MHz (681 mm x 287 mm)
                 Hfront   88 Hsync  44 Hback  148 Hpol P
                 Vfront    4 Vsync   5 Vback   36 Vpol P
    DTD 3:  2560x1080   75.001035 Hz  64:27    83.326 kHz    231.980000 MHz (681 mm x 287 mm)
                 Hfront   48 Hsync  32 Hback  144 Hpol P
                 Vfront    3 Vsync   5 Vback   23 Vpol N
    DTD 4:  1366x768    60.006322 Hz 683:384   47.885 kHz     85.810000 MHz (681 mm x 287 mm)
                 Hfront   70 Hsync 143 Hback  213 Hpol P
                 Vfront    3 Vsync   3 Vback   24 Vpol P
Checksum: 0x34  Unused space in Extension Block: 32 bytes

----------------

Warnings:

Block 1, CTA-861 Extension Block:
  Video Data Block: VIC 1 and the first DTD are not identical. Is this intended?
  Video Data Block: All VICs are in ascending order, and the first (preferred) VIC <= 4, is that intended?
  Detailed Timing Descriptor #2: Image size is 681x287 mm, but based on the picture AR it should be 510x287 mm.
  Detailed Timing Descriptor #4: Image size is 681x287 mm, but based on the picture AR it should be 510x287 mm.
  Add a Colorimetry Data Block with the sRGB colorimetry bit set to avoid interop issues.
EDID:
  Base EDID: Some timings are out of range of the Monitor Ranges:
    Horizontal Freq: 28.125 - 83.326 kHz (Monitor: 54.000 - 84.000 kHz)

Failures:

Block 0, Base EDID:
  Display Product Serial Number: ...
Block 1, CTA-861 Extension Block:
  Missing VCDB, needed for Set Selectable RGB Quantization to avoid interop issues.
EDID:
  Extension Block 2 started with EDID header, ignoring Extension Blocks >= 2.
  CTA-861: Native progressive timings are a mix of several resolutions.

EDID conformity: FAIL
