edid-decode (hex):

00 ff ff ff ff ff ff 00 22 f0 76 30 01 01 01 01
15 17 01 04 a5 33 1d 78 22 e2 95 a2 55 4f 9f 26
11 50 54 a1 08 00 d1 c0 81 c0 81 80 95 00 a9 c0
b3 00 01 01 01 01 02 3a 80 18 71 38 2d 40 58 2c
45 00 fd 1e 11 00 00 1e 00 00 00 fd 00 32 4c 18
5e 11 00 0a 20 20 20 20 20 20 00 00 00 fc 00 48
50 20 32 33 66 69 0a 20 20 20 20 20 00 00 00 ff
00 33 43 4d 33 32 31 30 35 4e 44 0a 20 20 00 2e

00 ff ff ff ff ff ff 00 22 f0 76 30 01 01 01 01
15 17 01 04 a5 33 1d 78 22 e2 95 a2 55 4f 9f 26
11 50 54 a1 08 00 d1 c0 81 c0 81 80 95 00 a9 c0
b3 00 01 01 01 01 02 3a 80 18 71 38 2d 40 58 2c
45 00 fd 1e 11 00 00 1e 00 00 00 fd 00 32 4c 18
5e 11 00 0a 20 20 20 20 20 20 00 00 00 fc 00 48
50 20 32 33 66 69 0a 20 20 20 20 20 00 00 00 ff
00 33 43 4d 33 32 31 30 35 4e 44 0a 20 20 00 2e

----------------

Block 0, Base EDID:
  EDID Structure Version & Revision: 1.4
  Vendor & Product Identification:
    Manufacturer: HWP
    Model: 12406
    Serial Number: ...
    Made in: week 21 of 2013
  Basic Display Parameters & Features:
    Digital display
    Bits per primary color channel: 8
    DisplayPort interface
    Maximum image size: 51 cm x 29 cm
    Gamma: 2.20
    DPMS levels: Off
    Supported color formats: RGB 4:4:4
    First detailed timing includes the native pixel format and preferred refresh rate
  Color Characteristics:
    Red  : 0.6357, 0.3339
    Green: 0.3085, 0.6230
    Blue : 0.1503, 0.0673
    White: 0.3134, 0.3291
  Established Timings I & II:
    IBM     :   720x400    70.081663 Hz   9:5     31.467 kHz     28.320000 MHz
    DMT 0x04:   640x480    59.940476 Hz   4:3     31.469 kHz     25.175000 MHz
    DMT 0x09:   800x600    60.316541 Hz   4:3     37.879 kHz     40.000000 MHz
    DMT 0x10:  1024x768    60.003840 Hz   4:3     48.363 kHz     65.000000 MHz
  Standard Timings:
    DMT 0x52:  1920x1080   60.000000 Hz  16:9     67.500 kHz    148.500000 MHz
    DMT 0x55:  1280x720    60.000000 Hz  16:9     45.000 kHz     74.250000 MHz
    DMT 0x23:  1280x1024   60.019740 Hz   5:4     63.981 kHz    108.000000 MHz
    DMT 0x2f:  1440x900    59.887445 Hz  16:10    55.935 kHz    106.500000 MHz
    DMT 0x53:  1600x900    60.000000 Hz  16:9     60.000 kHz    108.000000 MHz (RB)
    DMT 0x3a:  1680x1050   59.954250 Hz  16:10    65.290 kHz    146.250000 MHz
  Detailed Timing Descriptors:
    DTD 1:  1920x1080   60.000000 Hz  16:9     67.500 kHz    148.500000 MHz (509 mm x 286 mm)
                 Hfront   88 Hsync  44 Hback  148 Hpol P
                 Vfront    4 Vsync   5 Vback   36 Vpol P
    Display Range Limits:
      Monitor ranges (GTF): 50-76 Hz V, 24-94 kHz H, max dotclock 170 MHz
    Display Product Name: 'HP 23fi'
    Display Product Serial Number: ...
Checksum: 0x2e

----------------

Block 1, Unknown EDID Extension Block 0x00:
  00 ff ff ff ff ff ff 00 22 f0 76 30 01 01 01 01 '........".v0....'
  15 17 01 04 a5 33 1d 78 22 e2 95 a2 55 4f 9f 26 '.....3.x"...UO.&'
  11 50 54 a1 08 00 d1 c0 81 c0 81 80 95 00 a9 c0 '.PT.............'
  b3 00 01 01 01 01 02 3a 80 18 71 38 2d 40 58 2c '.......:..q8-@X,'
  45 00 fd 1e 11 00 00 1e 00 00 00 fd 00 32 4c 18 'E............2L.'
  5e 11 00 0a 20 20 20 20 20 20 00 00 00 fc 00 48 '^...      .....H'
  50 20 32 33 66 69 0a 20 20 20 20 20 00 00 00 ff 'P 23fi.     ....'
  00 33 43 4d 33 32 31 30 35 4e 44 0a 20 20 00 2e '.3CM32105ND.  ..'
Checksum: 0x2e

----------------

Warnings:

Block 0, Base EDID:
  Vendor & Product Identification: The serial number is one of the known dummy values, it should probably be set to 0.
  Display Range Limits: GTF support is deprecated in EDID 1.4.

Failures:

Block 0, Base EDID:
  Display Range Limits: GTF is supported, but the display does not support continuous frequencies.
Block 1, Base EDID:
  Unknown Extension Block.
EDID:
  Base EDID: EDID specified 0 extension block(s), but found 1 extension block(s).

EDID conformity: FAIL
