edid-decode (hex):

00 ff ff ff ff ff ff 00 22 f0 74 29 00 00 00 00
14 16 01 04 a5 30 1b 78 22 bb 53 a3 54 55 9e 27
0c 50 53 00 00 00 01 01 01 01 01 01 01 01 01 01
01 01 01 01 01 01 02 3a 80 18 71 38 2d 40 58 2c
45 00 dc 0c 11 00 00 1e d6 09 80 90 20 e0 1d 10
08 60 22 00 dc 0c 11 08 08 18 00 00 00 fc 00 48
50 20 4c 32 32 30 31 78 0a 20 20 20 00 00 00 ff
00 43 4e 4b 32 32 30 30 38 4a 4c 0a 20 20 00 d1

00 ff ff ff ff ff ff 00 22 f0 74 29 00 00 00 00
14 16 01 04 a5 30 1b 78 22 bb 53 a3 54 55 9e 27
0c 50 53 00 00 00 01 01 01 01 01 01 01 01 01 01
01 01 01 01 01 01 02 3a 80 18 71 38 2d 40 58 2c
45 00 dc 0c 11 00 00 1e d6 09 80 90 20 e0 1d 10
08 60 22 00 dc 0c 11 08 08 18 00 00 00 fc 00 48
50 20 4c 32 32 30 31 78 0a 20 20 20 00 00 00 ff
00 43 4e 4b 32 32 30 30 38 4a 4c 0a 20 20 00 d1

----------------

Block 0, Base EDID:
  EDID Structure Version & Revision: 1.4
  Vendor & Product Identification:
    Manufacturer: HWP
    Model: 10612
    Made in: week 20 of 2012
  Basic Display Parameters & Features:
    Digital display
    Bits per primary color channel: 8
    DisplayPort interface
    Maximum image size: 48 cm x 27 cm
    Gamma: 2.20
    DPMS levels: Off
    Supported color formats: RGB 4:4:4
    First detailed timing includes the native pixel format and preferred refresh rate
  Color Characteristics:
    Red  : 0.6386, 0.3310
    Green: 0.3339, 0.6201
    Blue : 0.1533, 0.0478
    White: 0.3125, 0.3271
  Established Timings I & II: none
  Standard Timings: none
  Detailed Timing Descriptors:
    DTD 1:  1920x1080   60.000000 Hz  16:9     67.500 kHz    148.500000 MHz (476 mm x 268 mm)
                 Hfront   88 Hsync  44 Hback  148 Hpol P
                 Vfront    4 Vsync   5 Vback   36 Vpol P
    DTD 2:   640x480    63.098913 Hz   4:3     32.117 kHz     25.180000 MHz (476 mm x 268 mm)
                 Hfront    8 Hsync  96 Hback   24 Hpol N Hborder 8
                 Vfront    2 Vsync   2 Vback    9 Vpol N Vborder 8
    Display Product Name: 'HP L2201x'
    Display Product Serial Number: ...
Checksum: 0xd1

----------------

Warnings:

Block 0, Base EDID:
  Detailed Timing Descriptor #2: Image size is 476x268 mm, but based on the picture AR it should be 357x268 mm.
  Detailed Timing Descriptor #2: The use of non-zero borders in a DTD is not recommended.

Failures:

EDID:
  Extension Block 1 started with EDID header, ignoring Extension Blocks >= 1.

EDID conformity: FAIL
