edid-decode (hex):

00 ff ff ff ff ff ff 00 4c 2d 0c 75 35 37 54 30
ff ff 01 04 b5 46 28 78 3b e9 05 a8 55 4a a7 27
0b 50 54 bf ef 80 71 4f 81 00 81 c0 81 80 95 00
a9 c0 b3 00 01 01 ee fc 00 5a a0 a0 29 50 0d 20
35 00 bb 89 21 00 00 1a 00 00 00 fd 0c 30 b4 0c
0c 47 01 0a 20 20 20 20 20 20 00 00 00 fc 00 4f
64 79 73 73 65 79 20 47 35 0a 20 20 00 00 00 ff
00 48 4e 41 58 41 30 30 32 31 32 0a 20 20 02 b6

02 03 2a f1 44 90 3f 1f 04 23 09 07 07 83 01 00
00 e3 05 c0 00 6d 1a 00 00 02 01 30 b4 00 00 00
00 00 00 e6 06 05 01 60 5a 00 56 5e 00 a0 a0 a0
29 50 30 20 35 00 bb 89 21 00 00 1a 6f c2 00 a0
a0 a0 55 50 30 20 35 00 bb 89 21 00 00 1a a4 9c
80 a0 70 38 59 40 30 20 35 00 bb 89 21 00 00 1a
02 3a 80 18 71 38 2d 40 58 2c 45 00 bb 89 21 00
00 1e 00 00 00 00 00 00 00 00 00 00 00 00 00 84

70 12 79 03 00 03 01 28 e0 13 01 84 ff 09 59 00
0c 80 1f 00 9f 05 28 00 02 00 04 00 ee 9c 00 04
7f 07 59 00 0c 80 1f 00 37 04 1e 00 02 00 09 00
00 00 00 00 00 00 00 00 00 00 00 00 00 00 00 00
00 00 00 00 00 00 00 00 00 00 00 00 00 00 00 00
00 00 00 00 00 00 00 00 00 00 00 00 00 00 00 00
00 00 00 00 00 00 00 00 00 00 00 00 00 00 00 00
00 00 00 00 00 00 00 00 00 00 00 00 00 00 74 90

00 ff ff ff ff ff ff 00 4c 2d 0c 75 35 37 54 30
ff ff 01 04 b5 46 28 78 3b e9 05 a8 55 4a a7 27
0b 50 54 bf ef 80 71 4f 81 00 81 c0 81 80 95 00
a9 c0 b3 00 01 01 ee fc 00 5a a0 a0 29 50 0d 20
35 00 bb 89 21 00 00 1a 00 00 00 fd 0c 30 b4 0c
0c 47 01 0a 20 20 20 20 20 20 00 00 00 fc 00 4f
64 79 73 73 65 79 20 47 35 0a 20 20 00 00 00 ff
00 48 4e 41 58 41 30 30 32 31 32 0a 20 20 02 b6

02 03 2a f1 44 90 3f 1f 04 23 09 07 07 83 01 00
00 e3 05 c0 00 6d 1a 00 00 02 01 30 b4 00 00 00
00 00 00 e6 06 05 01 60 5a 00 56 5e 00 a0 a0 a0
29 50 30 20 35 00 bb 89 21 00 00 1a 6f c2 00 a0
a0 a0 55 50 30 20 35 00 bb 89 21 00 00 1a a4 9c
80 a0 70 38 59 40 30 20 35 00 bb 89 21 00 00 1a
02 3a 80 18 71 38 2d 40 58 2c 45 00 bb 89 21 00
00 1e 00 00 00 00 00 00 00 00 00 00 00 00 00 84

70 12 79 03 00 03 01 28 e0 13 01 84 ff 09 59 00
0c 80 1f 00 9f 05 28 00 02 00 04 00 ee 9c 00 04
7f 07 59 00 0c 80 1f 00 37 04 1e 00 02 00 09 00
00 00 00 00 00 00 00 00 00 00 00 00 00 00 00 00
00 00 00 00 00 00 00 00 00 00 00 00 00 00 00 00
00 00 00 00 00 00 00 00 00 00 00 00 00 00 00 00
00 00 00 00 00 00 00 00 00 00 00 00 00 00 00 00
00 00 00 00 00 00 00 00 00 00 00 00 00 00 74 90

----------------

Block 0, Base EDID:
  EDID Structure Version & Revision: 1.4
  Vendor & Product Identification:
    Manufacturer: SAM
    Model: 29964
    Serial Number: ...
    Model year: 2245
  Basic Display Parameters & Features:
    Digital display
    Bits per primary color channel: 10
    DisplayPort interface
    Maximum image size: 70 cm x 40 cm
    Gamma: 2.20
    DPMS levels: Off
    Supported color formats: RGB 4:4:4, YCrCb 4:4:4, YCrCb 4:2:2
    First detailed timing includes the native pixel format and preferred refresh rate
    Display supports continuous frequencies
  Color Characteristics:
    Red  : 0.6591, 0.3339
    Green: 0.2910, 0.6533
    Blue : 0.1523, 0.0429
    White: 0.3134, 0.3291
  Established Timings I & II:
    IBM     :   720x400    70.081663 Hz   9:5     31.467 kHz     28.320000 MHz
    DMT 0x04:   640x480    59.940476 Hz   4:3     31.469 kHz     25.175000 MHz
    Apple   :   640x480    66.666667 Hz   4:3     35.000 kHz     30.240000 MHz
    DMT 0x05:   640x480    72.808802 Hz   4:3     37.861 kHz     31.500000 MHz
    DMT 0x06:   640x480    75.000000 Hz   4:3     37.500 kHz     31.500000 MHz
    DMT 0x08:   800x600    56.250000 Hz   4:3     35.156 kHz     36.000000 MHz
    DMT 0x09:   800x600    60.316541 Hz   4:3     37.879 kHz     40.000000 MHz
    DMT 0x0a:   800x600    72.187572 Hz   4:3     48.077 kHz     50.000000 MHz
    DMT 0x0b:   800x600    75.000000 Hz   4:3     46.875 kHz     49.500000 MHz
    Apple   :   832x624    74.551266 Hz   4:3     49.726 kHz     57.284000 MHz
    DMT 0x10:  1024x768    60.003840 Hz   4:3     48.363 kHz     65.000000 MHz
    DMT 0x11:  1024x768    70.069359 Hz   4:3     56.476 kHz     75.000000 MHz
    DMT 0x12:  1024x768    75.028582 Hz   4:3     60.023 kHz     78.750000 MHz
    DMT 0x24:  1280x1024   75.024675 Hz   5:4     79.976 kHz    135.000000 MHz
    Apple   :  1152x870    75.061550 Hz 192:145   68.681 kHz    100.000000 MHz
  Standard Timings:
    DMT 0x15:  1152x864    75.000000 Hz   4:3     67.500 kHz    108.000000 MHz
    DMT 0x1c:  1280x800    59.810326 Hz  16:10    49.702 kHz     83.500000 MHz
    DMT 0x55:  1280x720    60.000000 Hz  16:9     45.000 kHz     74.250000 MHz
    DMT 0x23:  1280x1024   60.019740 Hz   5:4     63.981 kHz    108.000000 MHz
    DMT 0x2f:  1440x900    59.887445 Hz  16:10    55.935 kHz    106.500000 MHz
    DMT 0x53:  1600x900    60.000000 Hz  16:9     60.000 kHz    108.000000 MHz (RB)
    DMT 0x3a:  1680x1050   59.954250 Hz  16:10    65.290 kHz    146.250000 MHz
  Detailed Timing Descriptors:
    DTD 1:  2560x1440  164.982865 Hz  16:9    244.340 kHz    647.500000 MHz (699 mm x 393 mm)
                 Hfront   13 Hsync  32 Hback   45 Hpol P
                 Vfront    3 Vsync   5 Vback   33 Vpol N
    Display Range Limits:
      Monitor ranges (Range Limits Only): 48-180 Hz V, 267-267 kHz H, max dotclock 710 MHz
    Display Product Name: 'Odyssey G5'
    Display Product Serial Number: ...
  Extension blocks: 2
Checksum: 0xb6

----------------

Block 1, CTA-861 Extension Block:
  Revision: 3
  Underscans IT Video Formats by default
  Basic audio support
  Supports YCbCr 4:4:4
  Supports YCbCr 4:2:2
  Native DTDs: 1
  Video Data Block:
    VIC  16:  1920x1080   60.000000 Hz  16:9     67.500 kHz    148.500000 MHz (native)
    VIC  63:  1920x1080  120.000000 Hz  16:9    135.000 kHz    297.000000 MHz
    VIC  31:  1920x1080   50.000000 Hz  16:9     56.250 kHz    148.500000 MHz
    VIC   4:  1280x720    60.000000 Hz  16:9     45.000 kHz     74.250000 MHz
  Audio Data Block:
    Linear PCM:
      Max channels: 2
      Supported sample rates (kHz): 48 44.1 32
      Supported sample sizes (bits): 24 20 16
  Speaker Allocation Data Block:
    FL/FR - Front Left/Right
  Colorimetry Data Block:
    BT2020YCC
    BT2020RGB
  Vendor-Specific Data Block (AMD), OUI 00-00-1A:
    Version: 2
    Feature Caps: 0x01
    Minimum Refresh Rate: 48 Hz
    Maximum Refresh Rate: 180 Hz
    Flags 1.x: 0x00
    Flags 2.x: 0x00
  HDR Static Metadata Data Block:
    Electro optical transfer functions:
      Traditional gamma - SDR luminance range
      SMPTE ST2084
    Supported static metadata descriptors:
      Static metadata type 1
    Desired content max luminance: 96 (400.000 cd/m^2)
    Desired content max frame-average luminance: 90 (351.250 cd/m^2)
    Desired content min luminance: 0 (0.000 cd/m^2)
  Detailed Timing Descriptors:
    DTD 2:  2560x1440   59.950550 Hz  16:9     88.787 kHz    241.500000 MHz (699 mm x 393 mm)
                 Hfront   48 Hsync  32 Hback   80 Hpol P
                 Vfront    3 Vsync   5 Vback   33 Vpol N
    DTD 3:  2560x1440  119.997589 Hz  16:9    182.996 kHz    497.750000 MHz (699 mm x 393 mm)
                 Hfront   48 Hsync  32 Hback   80 Hpol P
                 Vfront    3 Vsync   5 Vback   77 Vpol N
    DTD 4:  1920x1080  164.917418 Hz  16:9    192.788 kHz    401.000000 MHz (699 mm x 393 mm)
                 Hfront   48 Hsync  32 Hback   80 Hpol P
                 Vfront    3 Vsync   5 Vback   81 Vpol N
    DTD 5:  1920x1080   60.000000 Hz  16:9     67.500 kHz    148.500000 MHz (699 mm x 393 mm)
                 Hfront   88 Hsync  44 Hback  148 Hpol P
                 Vfront    4 Vsync   5 Vback   36 Vpol P
Checksum: 0x84  Unused space in Extension Block: 13 bytes

----------------

Block 2, DisplayID Extension Block:
  Version: 1.2
  Extension Count: 0
  Display Product Type: Standalone display device
  Video Timing Modes Type 1 - Detailed Timings Data Block:
    DTD:  2560x1440  179.952352 Hz  16:9    266.509 kHz    706.250000 MHz (aspect 16:9, no 3D stereo, preferred)
               Hfront   13 Hsync  32 Hback   45 Hpol P
               Vfront    3 Vsync   5 Vback   33 Vpol N
    DTD:  1920x1080  179.906050 Hz  16:9    199.876 kHz    401.750000 MHz (aspect 16:9, no 3D stereo)
               Hfront   13 Hsync  32 Hback   45 Hpol P
               Vfront    3 Vsync  10 Vback   18 Vpol N
  Checksum: 0x74
Checksum: 0x90

----------------

Warnings:

Block 1, CTA-861 Extension Block:
  Video Data Block: VIC 16 and the first DTD are not identical. Is this intended?
  Colorimetry Data Block: Set the sRGB colorimetry bit to avoid interop issues.
  Display Product Serial Number is set, so the Serial Number in the Base EDID should be 0.
EDID:
  Base EDID: Some timings are out of range of the Monitor Ranges:
    Horizontal Freq: 31.466 - 266.509 kHz (Monitor: 267.000 - 267.000 kHz)

Failures:

Block 0, Base EDID:
  Vendor & Product Identification: The year is more than one year in the future.
Block 1, CTA-861 Extension Block:
  Missing VCDB, needed for Set Selectable RGB Quantization to avoid interop issues.
EDID:
  Extension Block 3 started with EDID header, ignoring Extension Blocks >= 3.
  CTA-861: Native progressive timings are a mix of several resolutions.
  DisplayID: Missing DisplayID Display Parameters Data Block.

EDID conformity: FAIL
