edid-decode (hex):

00 ff ff ff ff ff ff 00 36 69 37 66 e1 d6 f4 03
32 12 01 03 81 2f 1a a4 e8 fb b4 a1 55 4b 97 24
10 48 4c 21 4e 00 81 c0 95 c0 a9 c0 b3 00 01 01
01 01 01 01 01 01 1a 36 80 a0 70 38 1f 40 30 20
35 00 dd 0c 11 00 00 1e 00 00 00 ff 00 30 30 30
30 30 31 0a 0a 0a 0a 0a 0a 0a 00 00 00 fd 00 32
4b 1e 55 14 00 0a 20 20 20 20 20 20 00 00 00 fc
00 57 69 6e 64 20 4e 65 74 31 20 32 32 0a 00 2d

00 ff ff ff ff ff ff 00 36 69 37 66 e1 d6 f4 03
32 12 01 03 81 2f 1a a4 e8 fb b4 a1 55 4b 97 24
10 48 4c 21 4e 00 81 c0 95 c0 a9 c0 b3 00 01 01
01 01 01 01 01 01 1a 36 80 a0 70 38 1f 40 30 20
35 00 dd 0c 11 00 00 1e 00 00 00 ff 00 30 30 30
30 30 31 0a 0a 0a 0a 0a 0a 0a 00 00 00 fd 00 32
4b 1e 55 14 00 0a 20 20 20 20 20 20 00 00 00 fc
00 57 69 6e 64 20 4e 65 74 31 20 32 32 0a 00 2d

----------------

Block 0, Base EDID:
  EDID Structure Version & Revision: 1.3
  Vendor & Product Identification:
    Manufacturer: MSI
    Model: 26167
    Serial Number: ...
    Made in: week 50 of 2008
  Basic Display Parameters & Features:
    Digital display
    DFP 1.x compatible TMDS
    Maximum image size: 47 cm x 26 cm
    Gamma: 2.64
    DPMS levels: Standby Suspend Off
    RGB color display
  Color Characteristics:
    Red  : 0.6318, 0.3349
    Green: 0.2949, 0.5927
    Blue : 0.1425, 0.0654
    White: 0.2822, 0.2968
  Established Timings I & II:
    DMT 0x04:   640x480    59.940476 Hz   4:3     31.469 kHz     25.175000 MHz
    DMT 0x09:   800x600    60.316541 Hz   4:3     37.879 kHz     40.000000 MHz
    DMT 0x0b:   800x600    75.000000 Hz   4:3     46.875 kHz     49.500000 MHz
    DMT 0x10:  1024x768    60.003840 Hz   4:3     48.363 kHz     65.000000 MHz
    DMT 0x11:  1024x768    70.069359 Hz   4:3     56.476 kHz     75.000000 MHz
    DMT 0x12:  1024x768    75.028582 Hz   4:3     60.023 kHz     78.750000 MHz
  Standard Timings:
    DMT 0x55:  1280x720    60.000000 Hz  16:9     45.000 kHz     74.250000 MHz
    GTF     :  1440x810    60.000051 Hz  16:9     50.340 kHz     95.042000 MHz
    DMT 0x53:  1600x900    60.000000 Hz  16:9     60.000 kHz    108.000000 MHz (RB)
    DMT 0x3a:  1680x1050   59.954250 Hz  16:10    65.290 kHz    146.250000 MHz
  Detailed Timing Descriptors:
    DTD 1:  1920x1080   59.933878 Hz  16:9     66.587 kHz    138.500000 MHz (477 mm x 268 mm)
                 Hfront   48 Hsync  32 Hback   80 Hpol P
                 Vfront    3 Vsync   5 Vback   23 Vpol P
    Display Product Serial Number: ...
    Display Range Limits:
      Monitor ranges (GTF): 50-75 Hz V, 30-85 kHz H, max dotclock 200 MHz
    Display Product Name: 'Wind Net1 22'
Checksum: 0x2d

----------------

Block 1, Unknown EDID Extension Block 0x00:
  00 ff ff ff ff ff ff 00 36 69 37 66 e1 d6 f4 03 '........6i7f....'
  32 12 01 03 81 2f 1a a4 e8 fb b4 a1 55 4b 97 24 '2..../......UK.$'
  10 48 4c 21 4e 00 81 c0 95 c0 a9 c0 b3 00 01 01 '.HL!N...........'
  01 01 01 01 01 01 1a 36 80 a0 70 38 1f 40 30 20 '.......6..p8.@0 '
  35 00 dd 0c 11 00 00 1e 00 00 00 ff 00 30 30 30 '5............000'
  30 30 31 0a 0a 0a 0a 0a 0a 0a 00 00 00 fd 00 32 '001............2'
  4b 1e 55 14 00 0a 20 20 20 20 20 20 00 00 00 fc 'K.U...      ....'
  00 57 69 6e 64 20 4e 65 74 31 20 32 32 0a 00 2d '.Wind Net1 22..-'
Checksum: 0x2d

----------------

Warnings:

Block 0, Base EDID:
  Display Product Serial Number: ...
EDID:
  No Native Video Resolution was defined.

Failures:

Block 0, Base EDID:
  Display Product Serial Number: ...
  Basic Display Parameters & Features: EDID 1.3 requires that the first detailed timing is the preferred timing.
Block 1, Base EDID:
  Unknown Extension Block.
EDID:
  Base EDID: EDID specified 0 extension block(s), but found 1 extension block(s).

EDID conformity: FAIL
