edid-decode (hex):

00 ff ff ff ff ff ff 00 06 af a0 7e 00 00 00 00
24 1f 01 04 b5 22 13 78 03 a5 95 a6 54 4a 9c 26
0f 50 54 00 00 00 01 01 01 01 01 01 01 01 01 01
01 01 01 01 01 01 34 9e 80 a0 70 38 64 40 10 10
3e 00 58 c1 10 00 00 18 00 00 00 0f 00 00 00 00
00 00 00 00 00 00 00 00 00 20 00 00 00 fd 00 3c
a5 c3 c3 29 01 0a 20 20 20 20 20 20 00 00 00 fe
00 42 31 35 36 48 41 4e 31 32 2e 48 20 0a 01 68

70 20 79 02 00 22 00 14 07 2e 06 84 7f 07 9f 00
0f 80 0f 00 37 04 63 00 02 00 0d 00 25 00 09 07
2e 06 07 2e 06 3c a5 80 81 00 10 72 1a 00 00 03
01 3c a5 00 00 53 50 53 50 a5 00 00 00 00 00 00
00 00 00 00 00 00 00 00 00 00 00 00 00 00 00 00
00 00 00 00 00 00 00 00 00 00 00 00 00 00 00 00
00 00 00 00 00 00 00 00 00 00 00 00 00 00 00 00
00 00 00 00 00 00 00 00 00 00 00 00 00 00 0e 90

----------------

Block 0, Base EDID:
  EDID Structure Version & Revision: 1.4
  Vendor & Product Identification:
    Manufacturer: AUO
    Model: 32416
    Made in: week 36 of 2021
  Basic Display Parameters & Features:
    Digital display
    Bits per primary color channel: 10
    DisplayPort interface
    Maximum image size: 34 cm x 19 cm
    Gamma: 2.20
    Supported color formats: RGB 4:4:4
    First detailed timing includes the native pixel format and preferred refresh rate
    Display supports continuous frequencies
  Color Characteristics:
    Red  : 0.6503, 0.3300
    Green: 0.2900, 0.6103
    Blue : 0.1503, 0.0595
    White: 0.3134, 0.3291
  Established Timings I & II: none
  Standard Timings: none
  Detailed Timing Descriptors:
    DTD 1:  1920x1080  165.009778 Hz  16:9    194.712 kHz    405.000000 MHz (344 mm x 193 mm)
                 Hfront   16 Hsync  16 Hback  128 Hpol N
                 Vfront    3 Vsync  14 Vback   83 Vpol N
    Manufacturer-Specified Display Descriptor (0x0f): 00 0f 00 00 00 00 00 00 00 00 00 00 00 00 00 20 '............... '
    Display Range Limits:
      Monitor ranges (Range Limits Only): 60-165 Hz V, 195-195 kHz H, max dotclock 410 MHz
    Alphanumeric Data String: 'B156HAN12.H '
  Extension blocks: 1
Checksum: 0x68

----------------

Block 1, DisplayID Extension Block:
  Version: 2.0
  Extension Count: 0
  Display Product Primary Use Case: None of the listed primary use cases; generic display
  Video Timing Modes Type 7 - Detailed Timings Data Block:
    DTD:  1920x1080  165.009778 Hz  16:9    194.712 kHz    405.000000 MHz (aspect 16:9, no 3D stereo, preferred)
               Hfront   16 Hsync  16 Hback  128 Hpol P
               Vfront    3 Vsync  14 Vback   83 Vpol N
  Dynamic Video Timing Range Limits Data Block:
    Minimum Pixel Clock: 405000 kHz
    Maximum Pixel Clock: 405000 kHz
    Minimum Vertical Refresh Rate: 60 Hz
    Maximum Vertical Refresh Rate: 165 Hz
    Seamless Dynamic Video Timing Support: Yes
  CTA-861 DisplayID Data Block:
  Vendor-Specific Data Block (AMD), OUI 00-00-1A:
    Version: 3
    Feature Caps: 0x01
    Minimum Refresh Rate: 60 Hz
    Maximum Refresh Rate: 165 Hz
    Flags 1.x: 0x00
    Flags 2.x: 0x00
    Maximum luminance: 83 (301.833 cd/m^2)
    Minimum luminance: 80 (0.297 cd/m^2)
    Unknown: 0x53 0x50
  Checksum: 0x0e
Checksum: 0x90

----------------

Warnings:

Block 0, Base EDID:
  Missing Display Product Name.

Failures:

Block 0, Base EDID:
  Alphanumeric Data String: One or more trailing spaces before newline.
Block 1, DisplayID Extension Block:
  Vendor-Specific Data Block (AMD), OUI 00-00-1A: Length is 16 instead of 19.
EDID:
  DisplayID: Missing DisplayID Display Parameters Data Block.

EDID conformity: FAIL
