edid-decode (hex):

00 ff ff ff ff ff ff 00 06 af ec 31 00 00 00 00
01 13 01 03 90 22 13 78 0a 6b 2a 9d 4c 42 84 1c
0d 48 4c 00 00 00 01 01 01 01 01 01 01 01 01 01
01 01 01 01 01 01 90 1a 56 3c 50 00 1a 30 30 20
36 00 58 c1 10 00 00 1a 90 1a 56 3c 50 00 1a 30
30 20 36 00 58 c1 10 00 00 1a 00 00 00 fe 00 58
37 37 36 57 80 42 31 35 36 58 57 33 00 00 00 00
00 00 00 00 00 00 00 00 00 01 01 0a 20 20 00 a9

----------------

Block 0, Base EDID:
  EDID Structure Version & Revision: 1.3
  Vendor & Product Identification:
    Manufacturer: AUO
    Model: 12780
    Made in: week 1 of 2009
  Basic Display Parameters & Features:
    Digital display
    Maximum image size: 34 cm x 19 cm
    Gamma: 2.20
    RGB color display
    First detailed timing is the preferred timing
  Color Characteristics:
    Red  : 0.6142, 0.2988
    Green: 0.2597, 0.5185
    Blue : 0.1093, 0.0527
    White: 0.2832, 0.2988
  Established Timings I & II: none
  Standard Timings: none
  Detailed Timing Descriptors:
    DTD 1:  1366x768    60.057726 Hz 683:384   47.686 kHz     68.000000 MHz (344 mm x 193 mm)
                 Hfront   48 Hsync  32 Hback  -20 Hpol P
                 Vfront    3 Vsync   6 Vback   17 Vpol N
    DTD 2:  1366x768    60.057726 Hz 683:384   47.686 kHz     68.000000 MHz (344 mm x 193 mm)
                 Hfront   48 Hsync  32 Hback  -20 Hpol P
                 Vfront    3 Vsync   6 Vback   17 Vpol N
    Alphanumeric Data String: 'X776W.B156XW3'
    Manufacturer-Specified Display Descriptor (0x00): 00 00 00 00 00 00 00 00 00 00 00 01 01 0a 20 20 '..............  '
Checksum: 0xa9

----------------

Warnings:

Block 0, Base EDID:
  Alphanumeric Data String: Non-ASCII character 0x80 at position 5, can cause problems.

Failures:

Block 0, Base EDID:
  Basic Display Parameters & Features: Digital Video Interface Standard set to reserved value 0x10.
  Detailed Timing Descriptor #1: 0 or negative horizontal back porch.
  Detailed Timing Descriptor #2: 0 or negative horizontal back porch.
  Missing Display Product Name.
  Missing Display Range Limits Descriptor.

EDID conformity: FAIL
