edid-decode (hex):

00 ff ff ff ff ff ff 00 22 0e 67 35 00 00 00 00
ff 1c 01 04 a0 1a 11 78 3a ee 95 a3 54 4c 99 26
0f 50 54 00 00 00 81 00 81 80 01 01 01 01 01 01
01 01 01 01 01 01 03 25 a0 a0 50 c0 1c 30 30 20
3a 00 03 ad 10 00 00 1c 66 21 56 aa 51 00 1e 30
46 8f 33 00 03 ad 10 00 00 1e 00 00 00 fc 00 53
6c 69 63 65 32 30 0a 20 20 20 20 20 00 00 00 fe
00 56 31 30 30 30 5f 53 48 41 52 50 0a 20 00 8d

----------------

Block 0, Base EDID:
  EDID Structure Version & Revision: 1.4
  Vendor & Product Identification:
    Manufacturer: HPN
    Model: 13671
    Model year: 2018
  Basic Display Parameters & Features:
    Digital display
    Bits per primary color channel: 8
    Digital interface is not defined
    Maximum image size: 26 cm x 17 cm
    Gamma: 2.20
    DPMS levels: Off
    Supported color formats: RGB 4:4:4, YCrCb 4:4:4, YCrCb 4:2:2
    First detailed timing includes the native pixel format and preferred refresh rate
  Color Characteristics:
    Red  : 0.6396, 0.3300
    Green: 0.2998, 0.5996
    Blue : 0.1503, 0.0595
    White: 0.3134, 0.3291
  Established Timings I & II: none
  Standard Timings:
    DMT 0x1c:  1280x800    59.810326 Hz  16:10    49.702 kHz     83.500000 MHz
    DMT 0x23:  1280x1024   60.019740 Hz   5:4     63.981 kHz    108.000000 MHz
  Detailed Timing Descriptors:
    DTD 1:  1440x960    59.938006 Hz   3:2     59.219 kHz     94.750000 MHz (259 mm x 173 mm)
                 Hfront   48 Hsync  32 Hback   80 Hpol N
                 Vfront    3 Vsync  10 Vback   15 Vpol P
    DTD 2:  1366x768    59.789541 Hz 683:384   47.712 kHz     85.500000 MHz (259 mm x 173 mm)
                 Hfront   70 Hsync 143 Hback  213 Hpol P
                 Vfront    3 Vsync   3 Vback   24 Vpol P
    Display Product Name: 'Slice20'
    Alphanumeric Data String: 'V1000_SHARP'
Checksum: 0x8d

----------------

Warnings:

Block 0, Base EDID:
  Detailed Timing Descriptor #2: Image size is 259x173 mm, but based on the picture AR it should be 259x145 mm.

EDID conformity: PASS
