edid-decode (hex):

00 ff ff ff ff ff ff 00 09 e5 c0 0c 00 00 00 00
04 22 01 04 a5 22 16 78 03 c0 95 95 5d 5a 95 2a
1f 50 54 00 00 00 01 01 01 01 01 01 01 01 01 01
01 01 01 01 01 01 f8 40 80 18 71 b0 3c 40 30 20
36 00 59 d7 10 00 00 1a fa 33 80 18 71 b0 3c 40
30 20 36 00 59 d7 10 00 00 1a 00 00 00 fe 00 58
33 46 59 38 80 4e 56 31 36 4b 34 32 00 00 00 00
00 02 41 01 9e 00 10 00 00 0a 01 0a 20 20 00 24

00 ff ff ff ff ff ff 00 09 e5 c0 0c 00 00 00 00
04 22 01 04 a5 22 16 78 03 c0 95 95 5d 5a 95 2a
1f 50 54 00 00 00 01 01 01 01 01 01 01 01 01 01
01 01 01 01 01 01 f8 40 80 18 71 b0 3c 40 30 20
36 00 59 d7 10 00 00 1a fa 33 80 18 71 b0 3c 40
30 20 36 00 59 d7 10 00 00 1a 00 00 00 fe 00 58
33 46 59 38 80 4e 56 31 36 4b 34 32 00 00 00 00
00 02 41 01 9e 00 10 00 00 0a 01 0a 20 20 00 24

----------------

Block 0, Base EDID:
  EDID Structure Version & Revision: 1.4
  Vendor & Product Identification:
    Manufacturer: BOE
    Model: 3264
    Made in: week 4 of 2024
  Basic Display Parameters & Features:
    Digital display
    Bits per primary color channel: 8
    DisplayPort interface
    Maximum image size: 34 cm x 22 cm
    Gamma: 2.20
    Supported color formats: RGB 4:4:4
    First detailed timing includes the native pixel format and preferred refresh rate
    Display supports continuous frequencies
  Color Characteristics:
    Red  : 0.5849, 0.3632
    Green: 0.3515, 0.5820
    Blue : 0.1660, 0.1220
    White: 0.3134, 0.3291
  Established Timings I & II: none
  Standard Timings: none
  Detailed Timing Descriptors:
    DTD 1:  1920x1200   60.000000 Hz  16:10    75.600 kHz    166.320000 MHz (345 mm x 215 mm)
                 Hfront   48 Hsync  32 Hback  200 Hpol P
                 Vfront    3 Vsync   6 Vback   51 Vpol N
    DTD 2:  1920x1200   48.001443 Hz  16:10    60.482 kHz    133.060000 MHz (345 mm x 215 mm)
                 Hfront   48 Hsync  32 Hback  200 Hpol P
                 Vfront    3 Vsync   6 Vback   51 Vpol N
    Alphanumeric Data String: 'X3FY8.NV16K42'
    Manufacturer-Specified Display Descriptor (0x00): 00 00 00 02 41 01 9e 00 10 00 00 0a 01 0a 20 20 '....A.........  '
Checksum: 0x24

----------------

Warnings:

Block 0, Base EDID:
  Alphanumeric Data String: Non-ASCII character 0x80 at position 5, can cause problems.
  Missing Display Product Name.

Failures:

Block 0, Base EDID:
  Missing Display Range Limits Descriptor.
EDID:
  Extension Block 1 started with EDID header, ignoring Extension Blocks >= 1.

EDID conformity: FAIL
