edid-decode (hex):

00 ff ff ff ff ff ff 00 4e 89 51 19 00 00 00 00
29 15 01 03 0e 29 17 78 8f 35 81 a6 56 48 9a 24
12 50 54 9f ef 00 31 ca 31 40 8b c0 81 80 01 01
01 01 01 01 01 01 66 21 50 b0 51 00 0d 30 40 70
26 00 c4 8e 21 00 00 9e 00 00 00 fd 00 38 4b 1e
5e 09 00 0a 20 20 20 20 20 20 00 00 00 fc 00 4d
4c 45 31 39 35 31 0a 20 20 20 20 20 00 00 00 ff
00 30 30 30 30 30 30 0a 20 20 20 20 20 20 00 6a

00 ff ff ff ff ff ff 00 4e 89 51 19 00 00 00 00
29 15 01 03 0e 29 17 78 8f 35 81 a6 56 48 9a 24
12 50 54 9f ef 00 31 ca 31 40 8b c0 81 80 01 01
01 01 01 01 01 01 66 21 50 b0 51 00 0d 30 40 70
26 00 c4 8e 21 00 00 9e 00 00 00 fd 00 38 4b 1e
5e 09 00 0a 20 20 20 20 20 20 00 00 00 fc 00 4d
4c 45 31 39 35 31 0a 20 20 20 20 20 00 00 00 ff
00 30 30 30 30 30 30 0a 20 20 20 20 20 20 00 6a

----------------

Block 0, Base EDID:
  EDID Structure Version & Revision: 1.3
  Vendor & Product Identification:
    Manufacturer: STI
    Model: 6481
    Made in: week 41 of 2011
  Basic Display Parameters & Features:
    Analog display
    Signal Level Standard: 0.700 : 0.300 : 1.000 V p-p
    Blank level equals black level
    Sync: Separate Composite SyncOnGreen
    Maximum image size: 41 cm x 23 cm
    Gamma: 2.20
    DPMS levels: Standby
    RGB color display
    Default (sRGB) color space is primary color space
    First detailed timing is the preferred timing
    Supports GTF timings within operating range
  Color Characteristics:
    Red  : 0.6484, 0.3388
    Green: 0.2822, 0.6025
    Blue : 0.1425, 0.0703
    White: 0.3125, 0.3291
  Established Timings I & II:
    IBM     :   720x400    70.081663 Hz   9:5     31.467 kHz     28.320000 MHz
    Apple   :   640x480    66.666667 Hz   4:3     35.000 kHz     30.240000 MHz
    DMT 0x05:   640x480    72.808802 Hz   4:3     37.861 kHz     31.500000 MHz
    DMT 0x06:   640x480    75.000000 Hz   4:3     37.500 kHz     31.500000 MHz
    DMT 0x08:   800x600    56.250000 Hz   4:3     35.156 kHz     36.000000 MHz
    DMT 0x09:   800x600    60.316541 Hz   4:3     37.879 kHz     40.000000 MHz
    DMT 0x0a:   800x600    72.187572 Hz   4:3     48.077 kHz     50.000000 MHz
    DMT 0x0b:   800x600    75.000000 Hz   4:3     46.875 kHz     49.500000 MHz
    Apple   :   832x624    74.551266 Hz   4:3     49.726 kHz     57.284000 MHz
    DMT 0x10:  1024x768    60.003840 Hz   4:3     48.363 kHz     65.000000 MHz
    DMT 0x11:  1024x768    70.069359 Hz   4:3     56.476 kHz     75.000000 MHz
    DMT 0x12:  1024x768    75.028582 Hz   4:3     60.023 kHz     78.750000 MHz
    DMT 0x24:  1280x1024   75.024675 Hz   5:4     79.976 kHz    135.000000 MHz
  Standard Timings:
    GTF     :   640x360    70.000000 Hz  16:9     26.250 kHz     20.580000 MHz
    DMT 0x04:   640x480    59.940476 Hz   4:3     31.469 kHz     25.175000 MHz
    GTF     :  1360x765    60.000341 Hz  16:9     47.520 kHz     84.396000 MHz
    DMT 0x23:  1280x1024   60.019740 Hz   5:4     63.981 kHz    108.000000 MHz
  Detailed Timing Descriptors:
    DTD 1:  1360x1536i  61.051892 Hz  85:96    47.712 kHz     85.500000 MHz (708 mm x 398 mm)
                 Hfront   64 Hsync 112 Hback  256 Hpol P
                 Vfront    2 Vsync   6 Vback    5 Vpol P Vfront +0.5 Odd Field
                 Vfront    2 Vsync   6 Vback    5 Vpol P Vback  +0.5 Even Field
    Display Range Limits:
      Monitor ranges (GTF): 56-75 Hz V, 30-94 kHz H, max dotclock 90 MHz
    Display Product Name: 'MLE1951'
    Display Product Serial Number: ...
Checksum: 0x6a

----------------

Warnings:

Block 0, Base EDID:
  Standard Timings: Standard Timing 1360x765 has a dubious odd vertical resolution.
  Detailed Timing Descriptor #1: Image size is 708x398 mm, but based on the picture AR it should be 352x398 mm.
  Display Product Serial Number: ...
EDID:
  Base EDID: Some timings are out of range of the Monitor Ranges:
    Horizontal Freq: 26.250 - 79.976 kHz (Monitor: 30.000 - 94.000 kHz)
    Maximum Clock: 135.000 MHz (Monitor: 90.000 MHz)

Failures:

Block 0, Base EDID:
  Basic Display Parameters & Features: sRGB is signaled, but the chromaticities do not match.
  Detailed Timing Descriptor #1: Mismatch of image size 708x398 mm vs display size 410x230 mm.
EDID:
  Extension Block 1 started with EDID header, ignoring Extension Blocks >= 1.
  Base EDID: The DTD max image size is 708x398mm, which is larger than the display size 410.0x230.0mm.

EDID conformity: FAIL
