edid-decode (hex):

00 ff ff ff ff ff ff 00 1e f9 8a 08 e0 03 00 00
2f 0f 01 03 80 2d 1c 78 ea ee 95 a3 54 4c 99 26
0f 50 54 bf ef 00 81 80 61 40 b3 00 01 01 01 01
01 01 01 01 01 01 2d 39 90 30 62 1a 27 40 68 b0
6e 01 c2 18 11 00 00 1e 00 00 00 fc 00 46 50 44
32 31 38 35 57 0a 20 20 20 20 00 00 00 fd 00 38
4c 1f 51 10 00 0a 20 20 20 20 20 20 00 00 00 ff
00 50 35 42 20 35 30 4e 20 30 30 39 39 32 00 20

00 ff ff ff ff ff ff 00 1e f9 8a 08 e0 03 00 00
2f 0f 01 03 80 2d 1c 78 ea ee 95 a3 54 4c 99 26
0f 50 54 bf ef 00 81 80 61 40 b3 00 01 01 01 01
01 01 01 01 01 01 2d 39 90 30 62 1a 27 40 68 b0
6e 01 c2 18 11 00 00 1e 00 00 00 fc 00 46 50 44
32 31 38 35 57 0a 20 20 20 20 00 00 00 fd 00 38
4c 1f 51 10 00 0a 20 20 20 20 20 20 00 00 00 ff
00 50 35 42 20 35 30 4e 20 30 30 39 39 32 00 20

----------------

Block 0, Base EDID:
  EDID Structure Version & Revision: 1.3
  Vendor & Product Identification:
    Manufacturer: GWY
    Model: 2186
    Serial Number: ...
    Made in: week 47 of 2005
  Basic Display Parameters & Features:
    Digital display
    Maximum image size: 45 cm x 28 cm
    Gamma: 2.20
    DPMS levels: Standby Suspend Off
    RGB color display
    First detailed timing is the preferred timing
  Color Characteristics:
    Red  : 0.6396, 0.3300
    Green: 0.2998, 0.5996
    Blue : 0.1503, 0.0595
    White: 0.3134, 0.3291
  Established Timings I & II:
    IBM     :   720x400    70.081663 Hz   9:5     31.467 kHz     28.320000 MHz
    DMT 0x04:   640x480    59.940476 Hz   4:3     31.469 kHz     25.175000 MHz
    Apple   :   640x480    66.666667 Hz   4:3     35.000 kHz     30.240000 MHz
    DMT 0x05:   640x480    72.808802 Hz   4:3     37.861 kHz     31.500000 MHz
    DMT 0x06:   640x480    75.000000 Hz   4:3     37.500 kHz     31.500000 MHz
    DMT 0x08:   800x600    56.250000 Hz   4:3     35.156 kHz     36.000000 MHz
    DMT 0x09:   800x600    60.316541 Hz   4:3     37.879 kHz     40.000000 MHz
    DMT 0x0a:   800x600    72.187572 Hz   4:3     48.077 kHz     50.000000 MHz
    DMT 0x0b:   800x600    75.000000 Hz   4:3     46.875 kHz     49.500000 MHz
    Apple   :   832x624    74.551266 Hz   4:3     49.726 kHz     57.284000 MHz
    DMT 0x10:  1024x768    60.003840 Hz   4:3     48.363 kHz     65.000000 MHz
    DMT 0x11:  1024x768    70.069359 Hz   4:3     56.476 kHz     75.000000 MHz
    DMT 0x12:  1024x768    75.028582 Hz   4:3     60.023 kHz     78.750000 MHz
    DMT 0x24:  1280x1024   75.024675 Hz   5:4     79.976 kHz    135.000000 MHz
  Standard Timings:
    DMT 0x23:  1280x1024   60.019740 Hz   5:4     63.981 kHz    108.000000 MHz
    DMT 0x10:  1024x768    60.003840 Hz   4:3     48.363 kHz     65.000000 MHz
    DMT 0x3a:  1680x1050   59.954250 Hz  16:10    65.290 kHz    146.250000 MHz
  Detailed Timing Descriptors:
    DTD 1:  1680x1050   60.003444 Hz  16:10    65.344 kHz    146.370000 MHz (450 mm x 280 mm)
                 Hfront  104 Hsync 176 Hback  280 Hpol P
                 Vfront    6 Vsync  30 Vback    3 Vpol P
    Display Product Name: 'FPD2185W'
    Display Range Limits:
      Monitor ranges (GTF): 56-76 Hz V, 31-81 kHz H, max dotclock 160 MHz
    Display Product Serial Number: ...
Checksum: 0x20

----------------

Failures:

EDID:
  Extension Block 1 started with EDID header, ignoring Extension Blocks >= 1.

EDID conformity: FAIL
