edid-decode (hex):

00 ff ff ff ff ff ff 00 06 af 5c 10 00 00 00 00
01 14 01 04 90 1a 0e 78 02 99 85 95 55 56 92 28
22 50 54 00 00 00 01 01 01 01 01 01 01 01 01 01
01 01 01 01 01 01 8a 1b 56 62 50 00 22 30 18 0e
24 00 00 90 10 00 00 1a 8a 1b 56 62 50 00 22 30
18 0e 24 00 00 90 10 00 00 1a 00 00 00 fe 00 34
43 46 31 34 80 42 31 31 36 58 57 31 00 00 00 00
00 00 41 02 94 01 01 00 00 01 01 0a 20 20 00 26

----------------

Block 0, Base EDID:
  EDID Structure Version & Revision: 1.4
  Vendor & Product Identification:
    Manufacturer: AUO
    Model: 4188
    Made in: week 1 of 2010
  Basic Display Parameters & Features:
    Digital display
    Bits per primary color channel: 6
    Digital interface is not defined
    Maximum image size: 26 cm x 14 cm
    Gamma: 2.20
    Supported color formats: RGB 4:4:4
    First detailed timing includes the native pixel format and preferred refresh rate
  Color Characteristics:
    Red  : 0.5839, 0.3330
    Green: 0.3378, 0.5712
    Blue : 0.1582, 0.1328
    White: 0.3134, 0.3291
  Established Timings I & II: none
  Standard Timings: none
  Detailed Timing Descriptors:
    DTD 1:  1366x768    60.044561 Hz 683:384   48.156 kHz     70.500000 MHz (256 mm x 144 mm)
                 Hfront   24 Hsync  14 Hback   60 Hpol P
                 Vfront    2 Vsync   4 Vback   28 Vpol N
    DTD 2:  1366x768    60.044561 Hz 683:384   48.156 kHz     70.500000 MHz (256 mm x 144 mm)
                 Hfront   24 Hsync  14 Hback   60 Hpol P
                 Vfront    2 Vsync   4 Vback   28 Vpol N
    Alphanumeric Data String: '4CF14.B116XW1'
    Manufacturer-Specified Display Descriptor (0x00): 00 00 00 00 41 02 94 01 01 00 00 01 01 0a 20 20 '....A.........  '
Checksum: 0x26

----------------

Warnings:

Block 0, Base EDID:
  Alphanumeric Data String: Non-ASCII character 0x80 at position 5, can cause problems.
  Missing Display Product Name.

EDID conformity: PASS
