edid-decode (hex):

00 ff ff ff ff ff ff 00 06 af 5c 10 00 00 00 00
00 1a 01 04 95 1a 0e 78 02 6b f5 91 55 54 91 27
22 50 54 00 00 00 01 01 01 01 01 01 01 01 01 01
01 01 01 01 01 01 89 1d 56 d0 50 00 20 30 28 20
36 00 00 90 10 00 00 1a c0 1c 56 1e 52 00 20 30
28 20 36 00 00 90 10 00 00 1a 00 00 00 fe 00 47
37 54 4b 43 80 42 31 31 36 58 54 42 00 00 00 00
00 00 41 22 96 01 11 00 00 09 01 0a 20 20 00 94

----------------

Block 0, Base EDID:
  EDID Structure Version & Revision: 1.4
  Vendor & Product Identification:
    Manufacturer: AUO
    Model: 4188
    Made in: 2016
  Basic Display Parameters & Features:
    Digital display
    Bits per primary color channel: 6
    DisplayPort interface
    Maximum image size: 26 cm x 14 cm
    Gamma: 2.20
    Supported color formats: RGB 4:4:4
    First detailed timing includes the native pixel format and preferred refresh rate
  Color Characteristics:
    Red  : 0.5673, 0.3339
    Green: 0.3300, 0.5693
    Blue : 0.1552, 0.1357
    White: 0.3134, 0.3291
  Established Timings I & II: none
  Standard Timings: none
  Detailed Timing Descriptors:
    DTD 1:  1366x768    60.046061 Hz 683:384   48.037 kHz     75.610000 MHz (256 mm x 144 mm)
                 Hfront   40 Hsync  32 Hback  136 Hpol P
                 Vfront    3 Vsync   6 Vback   23 Vpol N
    DTD 2:  1366x768    48.218029 Hz 683:384   38.574 kHz     73.600000 MHz (256 mm x 144 mm)
                 Hfront   40 Hsync  32 Hback  470 Hpol P
                 Vfront    3 Vsync   6 Vback   23 Vpol N
    Alphanumeric Data String: 'G7TKC.B116XTB'
    Manufacturer-Specified Display Descriptor (0x00): 00 00 00 00 41 22 96 01 11 00 00 09 01 0a 20 20 '....A"........  '
Checksum: 0x94

----------------

Warnings:

Block 0, Base EDID:
  Alphanumeric Data String: Non-ASCII character 0x80 at position 5, can cause problems.
  Missing Display Product Name.

EDID conformity: PASS
