edid-decode (hex):

00 ff ff ff ff ff ff 00 06 af 5c 10 00 00 00 00
00 15 01 04 90 1a 0e 78 02 99 85 95 55 56 92 28
22 50 54 00 00 00 01 01 01 01 01 01 01 01 01 01
01 01 01 01 01 01 70 1c 56 a4 50 00 19 30 28 20
36 00 00 90 10 00 00 18 44 16 56 a0 50 00 0a 30
28 20 36 00 00 90 10 00 00 18 00 00 00 fe 00 41
55 4f 0a 20 20 20 20 20 20 20 20 20 00 00 00 fe
00 42 31 31 36 58 54 4e 30 31 2e 30 20 0a 00 7e

----------------

Block 0, Base EDID:
  EDID Structure Version & Revision: 1.4
  Vendor & Product Identification:
    Manufacturer: AUO
    Model: 4188
    Made in: 2011
  Basic Display Parameters & Features:
    Digital display
    Bits per primary color channel: 6
    Digital interface is not defined
    Maximum image size: 26 cm x 14 cm
    Gamma: 2.20
    Supported color formats: RGB 4:4:4
    First detailed timing includes the native pixel format and preferred refresh rate
  Color Characteristics:
    Red  : 0.5839, 0.3330
    Green: 0.3378, 0.5712
    Blue : 0.1582, 0.1328
    White: 0.3134, 0.3291
  Established Timings I & II: none
  Standard Timings: none
  Detailed Timing Descriptors:
    DTD 1:  1366x768    60.002143 Hz 683:384   47.582 kHz     72.800000 MHz (256 mm x 144 mm)
                 Hfront   40 Hsync  32 Hback   92 Hpol N
                 Vfront    3 Vsync   6 Vback   16 Vpol N
    DTD 2:  1366x768    48.010997 Hz 683:384   37.353 kHz     57.000000 MHz (256 mm x 144 mm)
                 Hfront   40 Hsync  32 Hback   88 Hpol N
                 Vfront    3 Vsync   6 Vback    1 Vpol N
    Alphanumeric Data String: 'AUO'
    Alphanumeric Data String: 'B116XTN01.0 '
Checksum: 0x7e

----------------

Warnings:

Block 0, Base EDID:
  Missing Display Product Name.

Failures:

Block 0, Base EDID:
  Alphanumeric Data String: One or more trailing spaces before newline.

EDID conformity: FAIL
