edid-decode (hex):

00 ff ff ff ff ff ff 00 06 af 5c 10 00 00 00 00
0e 19 01 04 95 1a 0e 78 02 6b f5 91 55 54 91 27
22 50 54 00 00 00 01 01 01 01 01 01 01 01 01 01
01 01 01 01 01 01 a2 1c 56 a0 50 00 20 30 28 20
36 00 00 90 10 00 00 1a a2 1c 56 1e 52 00 20 30
28 20 36 00 00 90 10 00 00 1a 00 00 00 fe 00 35
4e 57 50 59 80 42 31 31 36 58 54 54 00 00 00 00
00 00 41 22 96 01 11 00 00 0a 01 0a 20 20 00 87

----------------

Block 0, Base EDID:
  EDID Structure Version & Revision: 1.4
  Vendor & Product Identification:
    Manufacturer: AUO
    Model: 4188
    Made in: week 14 of 2015
  Basic Display Parameters & Features:
    Digital display
    Bits per primary color channel: 6
    DisplayPort interface
    Maximum image size: 26 cm x 14 cm
    Gamma: 2.20
    Supported color formats: RGB 4:4:4
    First detailed timing includes the native pixel format and preferred refresh rate
  Color Characteristics:
    Red  : 0.5673, 0.3339
    Green: 0.3300, 0.5693
    Blue : 0.1552, 0.1357
    White: 0.3134, 0.3291
  Established Timings I & II: none
  Standard Timings: none
  Detailed Timing Descriptors:
    DTD 1:  1366x768    60.042595 Hz 683:384   48.034 kHz     73.300000 MHz (256 mm x 144 mm)
                 Hfront   40 Hsync  32 Hback   88 Hpol P
                 Vfront    3 Vsync   6 Vback   23 Vpol N
    DTD 2:  1366x768    48.021488 Hz 683:384   38.417 kHz     73.300000 MHz (256 mm x 144 mm)
                 Hfront   40 Hsync  32 Hback  470 Hpol P
                 Vfront    3 Vsync   6 Vback   23 Vpol N
    Alphanumeric Data String: '5NWPY.B116XTT'
    Manufacturer-Specified Display Descriptor (0x00): 00 00 00 00 41 22 96 01 11 00 00 0a 01 0a 20 20 '....A"........  '
Checksum: 0x87

----------------

Warnings:

Block 0, Base EDID:
  Alphanumeric Data String: Non-ASCII character 0x80 at position 5, can cause problems.
  Missing Display Product Name.

EDID conformity: PASS
