edid-decode (hex):

00 ff ff ff ff ff ff 00 36 69 e0 3c 00 00 00 00
1b 22 01 04 b5 3c 21 78 bf aa 15 a6 55 51 9d 27
0f 50 54 3f cf 00 b3 00 01 01 81 80 01 01 01 01
01 01 95 00 01 01 02 3a 80 18 71 38 2d 40 30 20
35 00 56 50 21 00 00 1a 00 00 00 fd 0c 30 fa 1f
1f 3c 01 0a 20 20 20 20 20 20 00 00 00 fc 00 4d
53 49 20 4d 41 47 20 32 37 43 36 58 00 00 00 ff
00 43 45 30 4d 30 34 34 37 30 31 34 38 31 01 0f

02 03 33 f1 4a 01 02 03 04 90 11 12 13 3f 1f 23
09 07 07 83 01 00 00 e3 05 e3 01 e6 06 07 01 55
55 00 6d 1a 00 00 02 01 30 fa 00 00 00 00 00 00
e2 00 ca 98 da 80 a0 70 38 29 40 30 20 35 00 56
50 21 00 00 1a 2f 9c 80 a0 70 38 55 40 30 20 35
00 56 50 21 00 00 1a 75 50 80 a0 70 38 55 40 30
20 35 00 56 50 21 00 00 1a b3 e3 80 a0 70 38 29
40 30 20 35 00 56 50 21 00 00 1a 00 00 00 00 8b

00 ff ff ff ff ff ff 00 36 69 e0 3c 00 00 00 00
1b 22 01 04 b5 3c 21 78 bf aa 15 a6 55 51 9d 27
0f 50 54 3f cf 00 b3 00 01 01 81 80 01 01 01 01
01 01 95 00 01 01 02 3a 80 18 71 38 2d 40 30 20
35 00 56 50 21 00 00 1a 00 00 00 fd 0c 30 fa 1f
1f 3c 01 0a 20 20 20 20 20 20 00 00 00 fc 00 4d
53 49 20 4d 41 47 20 32 37 43 36 58 00 00 00 ff
00 43 45 30 4d 30 34 34 37 30 31 34 38 31 01 0f

02 03 33 f1 4a 01 02 03 04 90 11 12 13 3f 1f 23
09 07 07 83 01 00 00 e3 05 e3 01 e6 06 07 01 55
55 00 6d 1a 00 00 02 01 30 fa 00 00 00 00 00 00
e2 00 ca 98 da 80 a0 70 38 29 40 30 20 35 00 56
50 21 00 00 1a 2f 9c 80 a0 70 38 55 40 30 20 35
00 56 50 21 00 00 1a 75 50 80 a0 70 38 55 40 30
20 35 00 56 50 21 00 00 1a b3 e3 80 a0 70 38 29
40 30 20 35 00 56 50 21 00 00 1a 00 00 00 00 8b

----------------

Block 0, Base EDID:
  EDID Structure Version & Revision: 1.4
  Vendor & Product Identification:
    Manufacturer: MSI
    Model: 15584
    Made in: week 27 of 2024
  Basic Display Parameters & Features:
    Digital display
    Bits per primary color channel: 10
    DisplayPort interface
    Maximum image size: 60 cm x 33 cm
    Gamma: 2.20
    DPMS levels: Standby Off
    Supported color formats: RGB 4:4:4, YCrCb 4:4:4, YCrCb 4:2:2
    Default (sRGB) color space is primary color space
    First detailed timing includes the native pixel format and preferred refresh rate
    Display supports continuous frequencies
  Color Characteristics:
    Red  : 0.6503, 0.3339
    Green: 0.3183, 0.6152
    Blue : 0.1523, 0.0595
    White: 0.3134, 0.3291
  Established Timings I & II:
    DMT 0x04:   640x480    59.940476 Hz   4:3     31.469 kHz     25.175000 MHz
    Apple   :   640x480    66.666667 Hz   4:3     35.000 kHz     30.240000 MHz
    DMT 0x05:   640x480    72.808802 Hz   4:3     37.861 kHz     31.500000 MHz
    DMT 0x06:   640x480    75.000000 Hz   4:3     37.500 kHz     31.500000 MHz
    DMT 0x08:   800x600    56.250000 Hz   4:3     35.156 kHz     36.000000 MHz
    DMT 0x09:   800x600    60.316541 Hz   4:3     37.879 kHz     40.000000 MHz
    DMT 0x0a:   800x600    72.187572 Hz   4:3     48.077 kHz     50.000000 MHz
    DMT 0x0b:   800x600    75.000000 Hz   4:3     46.875 kHz     49.500000 MHz
    DMT 0x10:  1024x768    60.003840 Hz   4:3     48.363 kHz     65.000000 MHz
    DMT 0x11:  1024x768    70.069359 Hz   4:3     56.476 kHz     75.000000 MHz
    DMT 0x12:  1024x768    75.028582 Hz   4:3     60.023 kHz     78.750000 MHz
    DMT 0x24:  1280x1024   75.024675 Hz   5:4     79.976 kHz    135.000000 MHz
  Standard Timings:
    DMT 0x3a:  1680x1050   59.954250 Hz  16:10    65.290 kHz    146.250000 MHz
    DMT 0x23:  1280x1024   60.019740 Hz   5:4     63.981 kHz    108.000000 MHz
    DMT 0x2f:  1440x900    59.887445 Hz  16:10    55.935 kHz    106.500000 MHz
  Detailed Timing Descriptors:
    DTD 1:  1920x1080   60.000000 Hz  16:9     67.500 kHz    148.500000 MHz (598 mm x 336 mm)
                 Hfront   48 Hsync  32 Hback  200 Hpol P
                 Vfront    3 Vsync   5 Vback   37 Vpol N
    Display Range Limits:
      Monitor ranges (Range Limits Only): 48-250 Hz V, 286-286 kHz H, max dotclock 600 MHz
    Display Product Name: 'MSI MAG 27C6X'
    Display Product Serial Number: ...
  Extension blocks: 1
Checksum: 0x0f

----------------

Block 1, CTA-861 Extension Block:
  Revision: 3
  Underscans IT Video Formats by default
  Basic audio support
  Supports YCbCr 4:4:4
  Supports YCbCr 4:2:2
  Native DTDs: 1
  Video Data Block:
    VIC   1:   640x480    59.940476 Hz   4:3     31.469 kHz     25.175000 MHz
    VIC   2:   720x480    59.940060 Hz   4:3     31.469 kHz     27.000000 MHz
    VIC   3:   720x480    59.940060 Hz  16:9     31.469 kHz     27.000000 MHz
    VIC   4:  1280x720    60.000000 Hz  16:9     45.000 kHz     74.250000 MHz
    VIC  16:  1920x1080   60.000000 Hz  16:9     67.500 kHz    148.500000 MHz (native)
    VIC  17:   720x576    50.000000 Hz   4:3     31.250 kHz     27.000000 MHz
    VIC  18:   720x576    50.000000 Hz  16:9     31.250 kHz     27.000000 MHz
    VIC  19:  1280x720    50.000000 Hz  16:9     37.500 kHz     74.250000 MHz
    VIC  63:  1920x1080  120.000000 Hz  16:9    135.000 kHz    297.000000 MHz
    VIC  31:  1920x1080   50.000000 Hz  16:9     56.250 kHz    148.500000 MHz
  Audio Data Block:
    Linear PCM:
      Max channels: 2
      Supported sample rates (kHz): 48 44.1 32
      Supported sample sizes (bits): 24 20 16
  Speaker Allocation Data Block:
    FL/FR - Front Left/Right
  Colorimetry Data Block:
    xvYCC601
    xvYCC709
    BT2020cYCC
    BT2020YCC
    BT2020RGB
    Gamut Boundary Description Metadata Profile P0
  HDR Static Metadata Data Block:
    Electro optical transfer functions:
      Traditional gamma - SDR luminance range
      Traditional gamma - HDR luminance range
      SMPTE ST2084
    Supported static metadata descriptors:
      Static metadata type 1
    Desired content max luminance: 85 (315.196 cd/m^2)
    Desired content max frame-average luminance: 85 (315.196 cd/m^2)
    Desired content min luminance: 0 (0.000 cd/m^2)
  Vendor-Specific Data Block (AMD), OUI 00-00-1A:
    Version: 2
    Flags 1: 0x01
      FreeSync Supported
    Minimum Refresh Rate: 48 Hz
    Maximum Refresh Rate: 250 Hz
    Flags 5: 0x00
  Video Capability Data Block:
    YCbCr quantization: Selectable (via AVI YQ)
    RGB quantization: Selectable (via AVI Q)
    PT scan behavior: No Data
    IT scan behavior: Always Underscanned
    CE scan behavior: Always Underscanned
  Detailed Timing Descriptors:
    DTD 2:  1920x1080  239.998628 Hz  16:9    269.038 kHz    559.600000 MHz (598 mm x 336 mm)
                 Hfront   48 Hsync  32 Hback   80 Hpol P
                 Vfront    3 Vsync   5 Vback   33 Vpol N
    DTD 3:  1920x1080  165.000825 Hz  16:9    192.226 kHz    399.830000 MHz (598 mm x 336 mm)
                 Hfront   48 Hsync  32 Hback   80 Hpol P
                 Vfront    3 Vsync   5 Vback   77 Vpol N
    DTD 4:  1920x1080   84.999175 Hz  16:9     99.024 kHz    205.970000 MHz (598 mm x 336 mm)
                 Hfront   48 Hsync  32 Hback   80 Hpol P
                 Vfront    3 Vsync   5 Vback   77 Vpol N
    DTD 5:  1920x1080  249.995711 Hz  16:9    280.245 kHz    582.910000 MHz (598 mm x 336 mm)
                 Hfront   48 Hsync  32 Hback   80 Hpol P
                 Vfront    3 Vsync   5 Vback   33 Vpol N
Checksum: 0x8b  Unused space in Extension Block: 4 bytes

----------------

Warnings:

Block 0, Base EDID:
  Detailed Timing Descriptor #1: DTD is similar but not identical to VIC 16.
Block 1, CTA-861 Extension Block:
  Video Data Block: VIC 1 and the first DTD are not identical. Is this intended?
EDID:
  Base EDID: Some timings are out of range of the Monitor Ranges:
    Horizontal Freq: 31.250 - 280.245 kHz (Monitor: 286.000 - 286.000 kHz)

Failures:

Block 0, Base EDID:
  Basic Display Parameters & Features: sRGB is signaled, but the chromaticities do not match.
EDID:
  Extension Block 2 started with EDID header, ignoring Extension Blocks >= 2.

EDID conformity: FAIL
