edid-decode (hex):

00 ff ff ff ff ff ff 00 14 8f 79 41 00 00 00 00
03 22 01 04 b5 1f 15 78 00 08 b5 af 51 3e ba 23
0a 50 54 00 00 00 01 01 01 01 01 01 01 01 01 01
01 01 01 01 01 01 00 00 00 10 00 00 00 00 00 00
00 00 00 00 00 00 00 00 00 00 00 fe 00 51 51 51
51 51 51 51 51 51 51 51 51 51 00 00 00 fc 00 45
44 4f 31 34 2e 35 35 0a 20 20 20 20 00 00 00 10
00 00 00 00 00 00 00 00 00 00 00 00 00 00 01 f1

70 20 79 02 00 20 00 0c 94 0b d5 02 45 00 00 00
00 01 18 00 21 00 1d 03 0c fd 07 30 0c 20 08 80
f1 ea 50 e7 13 ba 39 c2 0a 02 35 54 78 61 40 66
00 40 23 78 26 00 09 07 00 00 00 00 00 40 00 00
22 00 28 ff be 0d 80 2f 0c 17 01 d3 00 03 00 1f
08 7f 00 79 00 00 00 ff be 0d 00 2f 0c 17 01 d3
00 03 00 1f 08 1f 09 19 09 00 00 81 00 0b e3 05
80 00 e6 06 05 01 a0 7a 07 00 00 00 00 00 aa 90

00 ff ff ff ff ff ff 00 14 8f 79 41 00 00 00 00
03 22 01 04 b5 1f 15 78 00 08 b5 af 51 3e ba 23
0a 50 54 00 00 00 01 01 01 01 01 01 01 01 01 01
01 01 01 01 01 01 00 00 00 10 00 00 00 00 00 00
00 00 00 00 00 00 00 00 00 00 00 fe 00 51 51 51
51 51 51 51 51 51 51 51 51 51 00 00 00 fc 00 45
44 4f 31 34 2e 35 35 0a 20 20 20 20 00 00 00 10
00 00 00 00 00 00 00 00 00 00 00 00 00 00 01 f1

70 20 79 02 00 20 00 0c 94 0b d5 02 45 00 00 00
00 01 18 00 21 00 1d 03 0c fd 07 30 0c 20 08 80
f1 ea 50 e7 13 ba 39 c2 0a 02 35 54 78 61 40 66
00 40 23 78 26 00 09 07 00 00 00 00 00 40 00 00
22 00 28 ff be 0d 80 2f 0c 17 01 d3 00 03 00 1f
08 7f 00 79 00 00 00 ff be 0d 00 2f 0c 17 01 d3
00 03 00 1f 08 1f 09 19 09 00 00 81 00 0b e3 05
80 00 e6 06 05 01 a0 7a 07 00 00 00 00 00 aa 90

----------------

Block 0, Base EDID:
  EDID Structure Version & Revision: 1.4
  Vendor & Product Identification:
    Manufacturer: EDO
    Model: 16761
    Made in: week 3 of 2024
  Basic Display Parameters & Features:
    Digital display
    Bits per primary color channel: 10
    DisplayPort interface
    Maximum image size: 31 cm x 21 cm
    Gamma: 2.20
    Supported color formats: RGB 4:4:4
    First detailed timing does not include the native pixel format and preferred refresh rate
  Color Characteristics:
    Red  : 0.6835, 0.3164
    Green: 0.2441, 0.7265
    Blue : 0.1386, 0.0419
    White: 0.3134, 0.3291
  Established Timings I & II: none
  Standard Timings: none
  Detailed Timing Descriptors:
    Dummy Descriptor:
    Alphanumeric Data String: 'QQQQQQQQQQQQQ'
    Display Product Name: 'EDO14.55'
    Dummy Descriptor:
  Extension blocks: 1
Checksum: 0xf1

----------------

Block 1, DisplayID Extension Block:
  Version: 2.0
  Extension Count: 0
  Display Product Primary Use Case: None of the listed primary use cases; generic display
  Product Identification Data Block (0x20), OUI 94-0B-D5:
    Product Code: 17666
    Year of Manufacture: 2024, Week 1
  Display Parameters Data Block (0x21):
    Image size: 307.5 mm x 204.5 mm
    Display native pixel format: 3120x2080
    Scan Orientation: Left to Right, Top to Bottom
    Luminance Information: Minimum guaranteed value
    Color Information: CIE 1931
    Audio Speaker Information: not integrated
    Native Color Chromaticity:
      Primary #1:  (0.683838, 0.315918)
      Primary #2:  (0.243896, 0.726807)
      Primary #3:  (0.138916, 0.041992)
      White Point: (0.312988, 0.328857)
    Native Maximum Luminance (Full Coverage): 700.000000 cd/m^2
    Native Maximum Luminance (10% Rectangular Coverage): 1600.000000 cd/m^2
    Native Minimum Luminance: 2.000000 cd/m^2
    Native Color Depth: 10 bpc
    Display Device Technology: Organic LED
    Native Gamma EOTF: 2.20
  Display Interface Features Data Block:
    Supported bpc for RGB encoding: 6, 8, 10
    Supported color space and EOTF standard combination 1: BT.2020/SMPTE ST 2084
  Video Timing Modes Type 7 - Detailed Timings Data Block:
    DTD:  3120x2080  120.000000 Hz   1:1    264.960 kHz    900.864000 MHz (aspect 1:1, no 3D stereo, preferred)
               Hfront  212 Hsync   4 Hback   64 Hpol N
               Vfront  122 Vsync   1 Vback    5 Vpol N
    DTD:  3120x2080   60.000000 Hz   1:1    264.960 kHz    900.864000 MHz (aspect 1:1, no 3D stereo)
               Hfront  212 Hsync   4 Hback   64 Hpol N
               Vfront 2330 Vsync   1 Vback    5 Vpol N
  CTA-861 DisplayID Data Block:
  Colorimetry Data Block:
    BT2020RGB
  HDR Static Metadata Data Block:
    Electro optical transfer functions:
      Traditional gamma - SDR luminance range
      SMPTE ST2084
    Supported static metadata descriptors:
      Static metadata type 1
    Desired content max luminance: 160 (1600.000 cd/m^2)
    Desired content max frame-average luminance: 122 (702.501 cd/m^2)
    Desired content min luminance: 7 (0.012 cd/m^2)
  Checksum: 0xaa
Checksum: 0x90

----------------

Warnings:

Block 1, DisplayID Extension Block:
  Colorimetry Data Block: Set the sRGB colorimetry bit to avoid interop issues.

Failures:

Block 0, Base EDID:
  Standard Timings: Missing preferred timing.
EDID:
  Extension Block 2 started with EDID header, ignoring Extension Blocks >= 2.

EDID conformity: FAIL
