edid-decode (hex):

00 ff ff ff ff ff ff 00 4d 67 01 42 00 00 00 00
0f 22 01 04 b5 5d 35 78 3f f8 33 ac 52 43 ad 25
0c 48 49 a5 4f 00 71 4f 81 80 81 c0 81 00 95 00
b3 00 a9 c0 d1 c0 50 d0 00 a0 f0 70 3e 80 30 20
35 00 2c 64 42 00 00 1e 00 00 00 fc 00 4f 4c 45
44 20 47 34 32 50 35 0a 20 20 00 00 00 fd 00 28
78 0f de 6c 01 0a 20 20 20 20 20 20 00 00 00 ff
00 30 30 30 30 30 30 30 30 30 30 30 30 30 02 06

02 03 42 f2 50 83 04 05 10 1f 02 11 12 04 01 4d
4e 5e 5f 61 75 23 09 1f 07 83 01 00 00 6d 1a 00
00 02 01 28 78 00 00 00 00 00 00 e2 00 c0 e3 05
c3 01 e6 06 05 01 79 79 00 68 03 0c 00 20 00 38
ff 00 38 61 00 a0 a0 a0 55 50 30 20 35 00 2c 64
42 00 00 1a 70 c2 00 a0 a0 a0 55 50 30 20 35 00
2c 64 42 00 00 1a 00 00 00 00 00 00 00 00 00 00
00 00 00 00 00 00 00 00 00 00 00 00 00 00 00 ad

70 12 67 00 00 03 00 64 2f 5b 01 04 ff 0e 9f 00
2f 00 1f 00 6f 08 3d 00 02 00 04 00 63 04 01 04
ff 0e 9f 00 2f 00 1f 00 6f 08 3d 00 02 00 04 00
23 d6 00 04 ff 0e 9f 00 2f 00 1f 00 37 04 3d 00
02 00 04 00 c7 91 00 04 ff 09 9f 00 2f 00 1f 00
37 04 3d 00 02 00 04 00 9f a0 01 04 ff 0e 9f 00
2f 00 1f 00 6f 08 3d 00 02 00 04 00 81 00 00 00
00 00 00 00 00 00 00 00 00 00 00 00 00 00 81 0f

00 ff ff ff ff ff ff 00 4d 67 01 42 00 00 00 00
0f 22 01 04 b5 5d 35 78 3f f8 33 ac 52 43 ad 25
0c 48 49 a5 4f 00 71 4f 81 80 81 c0 81 00 95 00
b3 00 a9 c0 d1 c0 50 d0 00 a0 f0 70 3e 80 30 20
35 00 2c 64 42 00 00 1e 00 00 00 fc 00 4f 4c 45
44 20 47 34 32 50 35 0a 20 20 00 00 00 fd 00 28
78 0f de 6c 01 0a 20 20 20 20 20 20 00 00 00 ff
00 30 30 30 30 30 30 30 30 30 30 30 30 30 02 06

02 03 42 f2 50 83 04 05 10 1f 02 11 12 04 01 4d
4e 5e 5f 61 75 23 09 1f 07 83 01 00 00 6d 1a 00
00 02 01 28 78 00 00 00 00 00 00 e2 00 c0 e3 05
c3 01 e6 06 05 01 79 79 00 68 03 0c 00 20 00 38
ff 00 38 61 00 a0 a0 a0 55 50 30 20 35 00 2c 64
42 00 00 1a 70 c2 00 a0 a0 a0 55 50 30 20 35 00
2c 64 42 00 00 1a 00 00 00 00 00 00 00 00 00 00
00 00 00 00 00 00 00 00 00 00 00 00 00 00 00 ad

70 12 67 00 00 03 00 64 2f 5b 01 04 ff 0e 9f 00
2f 00 1f 00 6f 08 3d 00 02 00 04 00 63 04 01 04
ff 0e 9f 00 2f 00 1f 00 6f 08 3d 00 02 00 04 00
23 d6 00 04 ff 0e 9f 00 2f 00 1f 00 37 04 3d 00
02 00 04 00 c7 91 00 04 ff 09 9f 00 2f 00 1f 00
37 04 3d 00 02 00 04 00 9f a0 01 04 ff 0e 9f 00
2f 00 1f 00 6f 08 3d 00 02 00 04 00 81 00 00 00
00 00 00 00 00 00 00 00 00 00 00 00 00 00 81 0f

----------------

Block 0, Base EDID:
  EDID Structure Version & Revision: 1.4
  Vendor & Product Identification:
    Manufacturer: SKG
    Model: 16897
    Made in: week 15 of 2024
  Basic Display Parameters & Features:
    Digital display
    Bits per primary color channel: 10
    DisplayPort interface
    Maximum image size: 93 cm x 53 cm
    Gamma: 2.20
    DPMS levels: Off
    Supported color formats: RGB 4:4:4, YCrCb 4:4:4, YCrCb 4:2:2
    Default (sRGB) color space is primary color space
    First detailed timing includes the native pixel format and preferred refresh rate
    Display supports continuous frequencies
  Color Characteristics:
    Red  : 0.6748, 0.3232
    Green: 0.2636, 0.6757
    Blue : 0.1445, 0.0498
    White: 0.2812, 0.2880
  Established Timings I & II:
    IBM     :   720x400    70.081663 Hz   9:5     31.467 kHz     28.320000 MHz
    DMT 0x04:   640x480    59.940476 Hz   4:3     31.469 kHz     25.175000 MHz
    DMT 0x06:   640x480    75.000000 Hz   4:3     37.500 kHz     31.500000 MHz
    DMT 0x09:   800x600    60.316541 Hz   4:3     37.879 kHz     40.000000 MHz
    DMT 0x0b:   800x600    75.000000 Hz   4:3     46.875 kHz     49.500000 MHz
    DMT 0x10:  1024x768    60.003840 Hz   4:3     48.363 kHz     65.000000 MHz
    DMT 0x11:  1024x768    70.069359 Hz   4:3     56.476 kHz     75.000000 MHz
    DMT 0x12:  1024x768    75.028582 Hz   4:3     60.023 kHz     78.750000 MHz
    DMT 0x24:  1280x1024   75.024675 Hz   5:4     79.976 kHz    135.000000 MHz
  Standard Timings:
    DMT 0x15:  1152x864    75.000000 Hz   4:3     67.500 kHz    108.000000 MHz
    DMT 0x23:  1280x1024   60.019740 Hz   5:4     63.981 kHz    108.000000 MHz
    DMT 0x55:  1280x720    60.000000 Hz  16:9     45.000 kHz     74.250000 MHz
    DMT 0x1c:  1280x800    59.810326 Hz  16:10    49.702 kHz     83.500000 MHz
    DMT 0x2f:  1440x900    59.887445 Hz  16:10    55.935 kHz    106.500000 MHz
    DMT 0x3a:  1680x1050   59.954250 Hz  16:10    65.290 kHz    146.250000 MHz
    DMT 0x53:  1600x900    60.000000 Hz  16:9     60.000 kHz    108.000000 MHz (RB)
    DMT 0x52:  1920x1080   60.000000 Hz  16:9     67.500 kHz    148.500000 MHz
  Detailed Timing Descriptors:
    DTD 1:  3840x2160   60.000000 Hz  16:9    133.320 kHz    533.280000 MHz (1068 mm x 612 mm)
                 Hfront   48 Hsync  32 Hback   80 Hpol P
                 Vfront    3 Vsync   5 Vback   54 Vpol P
    Display Product Name: 'OLED G42P5'
    Display Range Limits:
      Monitor ranges (Range Limits Only): 40-120 Hz V, 15-222 kHz H, max dotclock 1080 MHz
    Display Product Serial Number: ...
  Extension blocks: 2
Checksum: 0x06

----------------

Block 1, CTA-861 Extension Block:
  Revision: 3
  Underscans IT Video Formats by default
  Basic audio support
  Supports YCbCr 4:4:4
  Supports YCbCr 4:2:2
  Native DTDs: 2
  Video Data Block:
    VIC   3:   720x480    59.940060 Hz  16:9     31.469 kHz     27.000000 MHz (native)
    VIC   4:  1280x720    60.000000 Hz  16:9     45.000 kHz     74.250000 MHz
    VIC   5:  1920x1080i  60.000000 Hz  16:9     33.750 kHz     74.250000 MHz
    VIC  16:  1920x1080   60.000000 Hz  16:9     67.500 kHz    148.500000 MHz
    VIC  31:  1920x1080   50.000000 Hz  16:9     56.250 kHz    148.500000 MHz
    VIC   2:   720x480    59.940060 Hz   4:3     31.469 kHz     27.000000 MHz
    VIC  17:   720x576    50.000000 Hz   4:3     31.250 kHz     27.000000 MHz
    VIC  18:   720x576    50.000000 Hz  16:9     31.250 kHz     27.000000 MHz
    VIC   4:  1280x720    60.000000 Hz  16:9     45.000 kHz     74.250000 MHz
    VIC   1:   640x480    59.940476 Hz   4:3     31.469 kHz     25.175000 MHz
    VIC  77:  1920x1080  100.000000 Hz  64:27   112.500 kHz    297.000000 MHz
    VIC  78:  1920x1080  120.000000 Hz  64:27   135.000 kHz    297.000000 MHz
    VIC  94:  3840x2160   25.000000 Hz  16:9     56.250 kHz    297.000000 MHz
    VIC  95:  3840x2160   30.000000 Hz  16:9     67.500 kHz    297.000000 MHz
    VIC  97:  3840x2160   60.000000 Hz  16:9    135.000 kHz    594.000000 MHz
    VIC 117:  3840x2160  100.000000 Hz  16:9    225.000 kHz   1188.000000 MHz
  Audio Data Block:
    Linear PCM:
      Max channels: 2
      Supported sample rates (kHz): 96 88.2 48 44.1 32
      Supported sample sizes (bits): 24 20 16
  Speaker Allocation Data Block:
    FL/FR - Front Left/Right
  Vendor-Specific Data Block (AMD), OUI 00-00-1A:
    Version: 2
    Flags 1: 0x01
      FreeSync Supported
    Minimum Refresh Rate: 40 Hz
    Maximum Refresh Rate: 120 Hz
    Flags 5: 0x00
  Video Capability Data Block:
    YCbCr quantization: Selectable (via AVI YQ)
    RGB quantization: Selectable (via AVI Q)
    PT scan behavior: No Data
    IT scan behavior: IT video formats not supported
    CE scan behavior: CE video formats not supported
  Colorimetry Data Block:
    xvYCC601
    xvYCC709
    BT2020YCC
    BT2020RGB
    Gamut Boundary Description Metadata Profile P0
  HDR Static Metadata Data Block:
    Electro optical transfer functions:
      Traditional gamma - SDR luminance range
      SMPTE ST2084
    Supported static metadata descriptors:
      Static metadata type 1
    Desired content max luminance: 121 (687.448 cd/m^2)
    Desired content max frame-average luminance: 121 (687.448 cd/m^2)
    Desired content min luminance: 0 (0.000 cd/m^2)
  Vendor-Specific Data Block (HDMI), OUI 00-0C-03:
    Source physical address: 2.0.0.0
    DC_36bit
    DC_30bit
    DC_Y444
    Maximum TMDS clock: 1275 MHz
  Detailed Timing Descriptors:
    DTD 2:  2560x1440   60.000000 Hz  16:9     91.500 kHz    248.880000 MHz (1068 mm x 612 mm)
                 Hfront   48 Hsync  32 Hback   80 Hpol P
                 Vfront    3 Vsync   5 Vback   77 Vpol N
    DTD 3:  2560x1440  120.000000 Hz  16:9    183.000 kHz    497.760000 MHz (1068 mm x 612 mm)
                 Hfront   48 Hsync  32 Hback   80 Hpol P
                 Vfront    3 Vsync   5 Vback   77 Vpol N
Checksum: 0xad  Unused space in Extension Block: 25 bytes

----------------

Block 2, DisplayID Extension Block:
  Version: 1.2
  Extension Count: 0
  Display Product Type: Extension Section
  Video Timing Modes Type 1 - Detailed Timings Data Block:
    DTD:  3840x2160  100.000000 Hz  16:9    222.200 kHz    888.800000 MHz (aspect 16:9, no 3D stereo)
               Hfront   48 Hsync  32 Hback   80 Hpol N
               Vfront    3 Vsync   5 Vback   54 Vpol N
    DTD:  3840x2160   75.000000 Hz  16:9    166.650 kHz    666.600000 MHz (aspect 16:9, no 3D stereo)
               Hfront   48 Hsync  32 Hback   80 Hpol N
               Vfront    3 Vsync   5 Vback   54 Vpol N
    DTD:  3840x1080  120.008757 Hz  16:9    137.050 kHz    548.200000 MHz (aspect 16:9, no 3D stereo)
               Hfront   48 Hsync  32 Hback   80 Hpol N
               Vfront    3 Vsync   5 Vback   54 Vpol N
    DTD:  2560x1080  120.145256 Hz  16:9    137.206 kHz    373.200000 MHz (aspect 16:9, no 3D stereo)
               Hfront   48 Hsync  32 Hback   80 Hpol N
               Vfront    3 Vsync   5 Vback   54 Vpol N
    DTD:  3840x2160  120.000000 Hz  16:9    266.640 kHz   1066.560000 MHz (aspect 16:9, no 3D stereo)
               Hfront   48 Hsync  32 Hback   80 Hpol N
               Vfront    3 Vsync   5 Vback   54 Vpol N
  Checksum: 0x81
Checksum: 0x0f  Unused space in Extension Block: 18 bytes

----------------

Warnings:

Block 0, Base EDID:
  Detailed Timing Descriptor #1: Image size is 1068x612 mm, but based on the picture AR it should be 1068x600 mm.
  Display Product Serial Number: ...
Block 1, CTA-861 Extension Block:
  Video Data Block: VIC 3 and the first DTD are not identical. Is this intended?
  Video Capability Data Block: IT scan behavior is expected to support underscanned.
  Video Capability Data Block: 'CE video formats not supported' makes no sense.
  Detailed Timing Descriptor #2: Image size is 1068x612 mm, but based on the picture AR it should be 1068x600 mm.
  Detailed Timing Descriptor #3: Image size is 1068x612 mm, but based on the picture AR it should be 1068x600 mm.
EDID:
  Base EDID: Some timings are out of range of the Monitor Ranges:
    Vertical Freq: 25.000 - 120.145 Hz (Monitor: 40.000 - 120.000 Hz)
    Horizontal Freq: 31.250 - 266.640 kHz (Monitor: 15.000 - 222.000 kHz)
    Maximum Clock: 1188.000 MHz (Monitor: 1080.000 MHz)

Failures:

Block 0, Base EDID:
  Basic Display Parameters & Features: sRGB is signaled, but the chromaticities do not match.
  Detailed Timing Descriptor #1: Mismatch of image size 1068x612 mm vs display size 930x530 mm.
Block 1, CTA-861 Extension Block:
  Video Data Block: Duplicate VIC 4.
  Vendor-Specific Data Block (HDMI), OUI 00-0C-03: HDMI VSDB Max TMDS rate is > 340.
  Vendor-Specific Data Block (HDMI), OUI 00-0C-03: The HDMI Specification requires EDID 1.3 instead of 1.4.
  Detailed Timing Descriptor #2: Mismatch of image size 1068x612 mm vs display size 930x530 mm.
  Detailed Timing Descriptor #3: Mismatch of image size 1068x612 mm vs display size 930x530 mm.
Block 2, DisplayID Extension Block:
  DisplayID Base Block has no product type.
  Padding: Contains non-zero bytes.
EDID:
  Extension Block 3 started with EDID header, ignoring Extension Blocks >= 3.
  Base EDID: The DTD max image size is 1068x612mm, which is larger than the display size 930.0x530.0mm.
  CTA-861: Native progressive timings are a mix of several resolutions.
  DisplayID: DisplayID expects at least one preferred timing.

EDID conformity: FAIL
