edid-decode (hex):

00 ff ff ff ff ff ff 00 1a b3 e3 07 73 7c 00 00
1b 14 01 03 68 2c 19 82 2a 95 35 a1 59 57 9f 27
0e 50 54 a5 4a 00 81 c0 01 01 01 01 01 01 01 01
01 01 01 01 01 01 2f 26 40 a0 60 84 1a 30 30 20
35 00 ba f9 10 00 00 1a 00 00 00 fd 00 3b 4b 1f
52 10 00 0a 20 20 20 20 20 20 00 00 00 fc 00 4c
32 30 54 2d 32 20 4c 45 44 0a 20 20 00 00 00 ff
00 59 56 33 4e 30 33 31 38 35 39 0a 20 20 00 21

00 ff ff ff ff ff ff 00 1a b3 e3 07 73 7c 00 00
1b 14 01 03 68 2c 19 82 2a 95 35 a1 59 57 9f 27
0e 50 54 a5 4a 00 81 c0 01 01 01 01 01 01 01 01
01 01 01 01 01 01 2f 26 40 a0 60 84 1a 30 30 20
35 00 ba f9 10 00 00 1a 00 00 00 fd 00 3b 4b 1f
52 10 00 0a 20 20 20 20 20 20 00 00 00 fc 00 4c
32 30 54 2d 32 20 4c 45 44 0a 20 20 00 00 00 ff
00 59 56 33 4e 30 33 31 38 35 39 0a 20 20 00 21

----------------

Block 0, Base EDID:
  EDID Structure Version & Revision: 1.3
  Vendor & Product Identification:
    Manufacturer: FUS
    Model: 2019
    Serial Number: ...
    Made in: week 27 of 2010
  Basic Display Parameters & Features:
    Analog display
    Signal Level Standard: 0.700 : 0.000 : 0.700 V p-p
    Blank level equals black level
    Sync: Separate
    Maximum image size: 44 cm x 25 cm
    Gamma: 2.30
    DPMS levels: Off
    RGB color display
    First detailed timing is the preferred timing
  Color Characteristics:
    Red  : 0.6308, 0.3486
    Green: 0.3408, 0.6220
    Blue : 0.1523, 0.0576
    White: 0.3134, 0.3291
  Established Timings I & II:
    IBM     :   720x400    70.081663 Hz   9:5     31.467 kHz     28.320000 MHz
    DMT 0x04:   640x480    59.940476 Hz   4:3     31.469 kHz     25.175000 MHz
    DMT 0x06:   640x480    75.000000 Hz   4:3     37.500 kHz     31.500000 MHz
    DMT 0x09:   800x600    60.316541 Hz   4:3     37.879 kHz     40.000000 MHz
    DMT 0x0b:   800x600    75.000000 Hz   4:3     46.875 kHz     49.500000 MHz
    DMT 0x10:  1024x768    60.003840 Hz   4:3     48.363 kHz     65.000000 MHz
    DMT 0x12:  1024x768    75.028582 Hz   4:3     60.023 kHz     78.750000 MHz
  Standard Timings:
    DMT 0x55:  1280x720    60.000000 Hz  16:9     45.000 kHz     74.250000 MHz
  Detailed Timing Descriptors:
    DTD 1:  1600x900    59.978156 Hz  16:9     55.540 kHz     97.750000 MHz (442 mm x 249 mm)
                 Hfront   48 Hsync  32 Hback   80 Hpol P
                 Vfront    3 Vsync   5 Vback   18 Vpol N
    Display Range Limits:
      Monitor ranges (GTF): 59-75 Hz V, 31-82 kHz H, max dotclock 160 MHz
    Display Product Name: 'L20T-2 LED'
    Display Product Serial Number: ...
Checksum: 0x21

----------------

Failures:

EDID:
  Extension Block 1 started with EDID header, ignoring Extension Blocks >= 1.

EDID conformity: FAIL
