edid-decode (hex):

00 ff ff ff ff ff ff 00 4d d9 50 21 01 01 01 01
32 0c 01 04 a5 1e 17 78 e2 b1 49 a1 58 4f 95 26
1d 48 4c a1 08 00 01 01 01 01 01 01 01 01 01 01
01 01 01 01 01 01 64 19 00 40 41 00 26 30 18 88
36 00 30 e4 10 00 00 18 00 00 00 fd 00 39 3f 1c
31 09 00 0a 20 20 20 20 20 20 00 00 00 fc 00 53
44 4d 2d 53 35 31 52 0a 20 20 20 20 00 00 00 ff
00 39 35 30 32 32 33 30 0a 20 20 20 20 20 00 e2

00 ff ff ff ff ff ff 00 4d d9 50 21 01 01 01 01
32 0c 01 04 a5 1e 17 78 e2 b1 49 a1 58 4f 95 26
1d 48 4c a1 08 00 01 01 01 01 01 01 01 01 01 01
01 01 01 01 01 01 64 19 00 40 41 00 26 30 18 88
36 00 30 e4 10 00 00 18 00 00 00 fd 00 39 3f 1c
31 09 00 0a 20 20 20 20 20 20 00 00 00 fc 00 53
44 4d 2d 53 35 31 52 0a 20 20 20 20 00 00 00 ff
00 39 35 30 32 32 33 30 0a 20 20 20 20 20 00 e2

----------------

Block 0, Base EDID:
  EDID Structure Version & Revision: 1.4
  Vendor & Product Identification:
    Manufacturer: SNY
    Model: 8528
    Serial Number: ...
    Made in: week 50 of 2002
  Basic Display Parameters & Features:
    Digital display
    Bits per primary color channel: 8
    DisplayPort interface
    Maximum image size: 30 cm x 23 cm
    Gamma: 2.20
    DPMS levels: Standby Suspend Off
    Supported color formats: RGB 4:4:4
    First detailed timing includes the native pixel format and preferred refresh rate
  Color Characteristics:
    Red  : 0.6308, 0.3466
    Green: 0.3085, 0.5830
    Blue : 0.1494, 0.1132
    White: 0.2832, 0.2978
  Established Timings I & II:
    IBM     :   720x400    70.081663 Hz   9:5     31.467 kHz     28.320000 MHz
    DMT 0x04:   640x480    59.940476 Hz   4:3     31.469 kHz     25.175000 MHz
    DMT 0x09:   800x600    60.316541 Hz   4:3     37.879 kHz     40.000000 MHz
    DMT 0x10:  1024x768    60.003840 Hz   4:3     48.363 kHz     65.000000 MHz
  Standard Timings: none
  Detailed Timing Descriptors:
    DTD 1:  1024x768    60.003840 Hz   4:3     48.363 kHz     65.000000 MHz (304 mm x 228 mm)
                 Hfront   24 Hsync 136 Hback  160 Hpol N
                 Vfront    3 Vsync   6 Vback   29 Vpol N
    Display Range Limits:
      Monitor ranges (GTF): 57-63 Hz V, 28-49 kHz H, max dotclock 90 MHz
    Display Product Name: 'SDM-S51R'
    Display Product Serial Number: ...
Checksum: 0xe2

----------------

Warnings:

Block 0, Base EDID:
  Vendor & Product Identification: The serial number is one of the known dummy values, it should probably be set to 0.
  Display Range Limits: GTF support is deprecated in EDID 1.4.
EDID:
  Base EDID: Some timings are out of range of the Monitor Ranges:
    Vertical Freq: 59.940 - 70.082 Hz (Monitor: 57.000 - 63.000 Hz)

Failures:

Block 0, Base EDID:
  Display Range Limits: GTF is supported, but the display does not support continuous frequencies.
EDID:
  Extension Block 1 started with EDID header, ignoring Extension Blocks >= 1.

EDID conformity: FAIL
