edid-decode (hex):

00 ff ff ff ff ff ff 00 04 81 04 00 01 00 00 00
01 11 01 03 80 0f 0a 00 0a 00 00 00 00 00 00 00
00 00 00 00 00 00 01 01 01 01 01 01 01 01 01 01
01 01 01 01 01 01 24 13 00 20 41 58 16 20 05 0d
23 00 ff ff 00 00 00 18 00 00 00 10 00 00 00 00
00 00 00 00 00 00 00 00 00 00 00 00 00 10 00 00
00 00 00 00 00 00 00 00 00 00 00 00 00 00 00 10
00 00 00 00 00 00 00 00 00 00 00 00 00 00 00 12

----------------

Block 0, Base EDID:
  EDID Structure Version & Revision: 1.3
  Vendor & Product Identification:
    Manufacturer: ADA
    Model: 4
    Serial Number: ...
    Made in: week 1 of 2007
  Basic Display Parameters & Features:
    Digital display
    Maximum image size: 15 cm x 10 cm
    Gamma: 1.00
    RGB color display
    First detailed timing is the preferred timing
  Color Characteristics:
    Red  : 0.0000, 0.0000
    Green: 0.0000, 0.0000
    Blue : 0.0000, 0.0000
    White: 0.0000, 0.0000
  Established Timings I & II: none
  Standard Timings: none
  Detailed Timing Descriptors:
    DTD 1:  1024x600    60.044310 Hz 128:75    37.348 kHz     49.000000 MHz (255 mm x 255 mm)
                 Hfront    5 Hsync  13 Hback  270 Hpol N
                 Vfront    2 Vsync   3 Vback   17 Vpol N
    Dummy Descriptor:
    Dummy Descriptor:
    Dummy Descriptor:
Checksum: 0x12

----------------

Warnings:

Block 0, Base EDID:
  Vendor & Product Identification: The serial number is one of the known dummy values, it should probably be set to 0.
  Detailed Timing Descriptor #1: Image size is 255x255 mm, but based on the picture AR it should be 255x149 mm.

Failures:

Block 0, Base EDID:
  Detailed Timing Descriptor #1: Mismatch of image size 255x255 mm vs display size 150x100 mm.
  Missing Display Product Name.
  Missing Display Range Limits Descriptor.
EDID:
  Base EDID: The DTD max image size is 255x255mm, which is larger than the display size 150.0x100.0mm.

EDID conformity: FAIL
