edid-decode (hex):

00 ff ff ff ff ff ff 00 04 81 04 00 01 00 00 00
01 11 01 03 80 0f 09 00 0a 00 00 00 00 00 00 00
00 00 00 00 00 00 45 c0 01 01 01 01 01 01 01 01
01 01 01 01 01 01 24 13 00 20 41 58 18 20 30 60
3a 00 9a 56 00 00 00 18 00 00 00 10 00 00 00 00
00 00 00 00 00 00 00 00 00 00 00 00 00 10 00 00
00 00 00 00 00 00 00 00 00 00 00 00 00 00 00 10
00 00 00 00 00 00 00 00 00 00 00 00 00 00 00 87

00 ff ff ff ff ff ff 00 04 81 04 00 01 00 00 00
01 11 01 03 80 0f 09 00 0a 00 00 00 00 00 00 00
00 00 00 00 00 00 45 c0 01 01 01 01 01 01 01 01
01 01 01 01 01 01 24 13 00 20 41 58 18 20 30 60
3a 00 9a 56 00 00 00 18 00 00 00 10 00 00 00 00
00 00 00 00 00 00 00 00 00 00 00 00 00 10 00 00
00 00 00 00 00 00 00 00 00 00 00 00 00 00 00 10
00 00 00 00 00 00 00 00 00 00 00 00 00 00 00 87

----------------

Block 0, Base EDID:
  EDID Structure Version & Revision: 1.3
  Vendor & Product Identification:
    Manufacturer: ADA
    Model: 4
    Serial Number: ...
    Made in: week 1 of 2007
  Basic Display Parameters & Features:
    Digital display
    Maximum image size: 15 cm x 9 cm
    Gamma: 1.00
    RGB color display
    First detailed timing is the preferred timing
  Color Characteristics:
    Red  : 0.0000, 0.0000
    Green: 0.0000, 0.0000
    Blue : 0.0000, 0.0000
    White: 0.0000, 0.0000
  Established Timings I & II: none
  Standard Timings:
    GTF     :   800x450    59.999308 Hz  16:9     27.960 kHz     27.736000 MHz
  Detailed Timing Descriptors:
    DTD 1:  1024x600    59.851861 Hz 128:75    37.348 kHz     49.000000 MHz (154 mm x 86 mm)
                 Hfront   48 Hsync  96 Hback  144 Hpol N
                 Vfront    3 Vsync  10 Vback   11 Vpol N
    Dummy Descriptor:
    Dummy Descriptor:
    Dummy Descriptor:
Checksum: 0x87

----------------

Warnings:

Block 0, Base EDID:
  Vendor & Product Identification: The serial number is one of the known dummy values, it should probably be set to 0.
  Basic Display Parameters & Features: Dubious maximum image size (15x9 is smaller than 10x10 cm).
  Detailed Timing Descriptor #1: Dubious image size (154x86 mm is smaller than 100x100 mm).

Failures:

Block 0, Base EDID:
  Missing Display Product Name.
  Missing Display Range Limits Descriptor.
EDID:
  Extension Block 1 started with EDID header, ignoring Extension Blocks >= 1.

EDID conformity: FAIL
