edid-decode (hex):

00 ff ff ff ff ff ff 00 26 cd 44 10 01 00 00 00
23 0e 01 03 78 40 27 78 ea f2 40 a4 54 45 9a 24
13 49 4b af ce 00 81 80 61 40 45 40 81 c0 01 01
01 01 01 01 01 01 a4 1f 00 80 51 00 1e 30 40 80
37 00 83 82 21 00 00 1c 00 00 00 fd 00 38 4b 1e
40 0b 00 0a 20 20 20 20 20 20 00 00 00 fc 00 50
4c 43 33 30 31 57 54 0a 20 20 20 20 00 00 00 fc
00 20 0a 20 20 20 20 20 20 20 20 20 20 20 00 8f

----------------

Block 0, Base EDID:
  EDID Structure Version & Revision: 1.3
  Vendor & Product Identification:
    Manufacturer: IVM
    Model: 4164
    Serial Number: ...
    Made in: week 35 of 2004
  Basic Display Parameters & Features:
    Analog display
    Signal Level Standard: 0.700 : 0.000 : 0.700 V p-p
    Blank-to-black setup/pedestal
    Sync: Separate
    Maximum image size: 64 cm x 39 cm
    Gamma: 2.20
    DPMS levels: Standby Suspend Off
    RGB color display
    First detailed timing is the preferred timing
  Color Characteristics:
    Red  : 0.6435, 0.3310
    Green: 0.2695, 0.6035
    Blue : 0.1416, 0.0742
    White: 0.2851, 0.2929
  Established Timings I & II:
    IBM     :   720x400    70.081663 Hz   9:5     31.467 kHz     28.320000 MHz
    DMT 0x04:   640x480    59.940476 Hz   4:3     31.469 kHz     25.175000 MHz
    DMT 0x05:   640x480    72.808802 Hz   4:3     37.861 kHz     31.500000 MHz
    DMT 0x06:   640x480    75.000000 Hz   4:3     37.500 kHz     31.500000 MHz
    DMT 0x08:   800x600    56.250000 Hz   4:3     35.156 kHz     36.000000 MHz
    DMT 0x09:   800x600    60.316541 Hz   4:3     37.879 kHz     40.000000 MHz
    DMT 0x0a:   800x600    72.187572 Hz   4:3     48.077 kHz     50.000000 MHz
    DMT 0x0b:   800x600    75.000000 Hz   4:3     46.875 kHz     49.500000 MHz
    DMT 0x10:  1024x768    60.003840 Hz   4:3     48.363 kHz     65.000000 MHz
    DMT 0x11:  1024x768    70.069359 Hz   4:3     56.476 kHz     75.000000 MHz
    DMT 0x12:  1024x768    75.028582 Hz   4:3     60.023 kHz     78.750000 MHz
  Standard Timings:
    DMT 0x23:  1280x1024   60.019740 Hz   5:4     63.981 kHz    108.000000 MHz
    DMT 0x10:  1024x768    60.003840 Hz   4:3     48.363 kHz     65.000000 MHz
    DMT 0x09:   800x600    60.316541 Hz   4:3     37.879 kHz     40.000000 MHz
    DMT 0x55:  1280x720    60.000000 Hz  16:9     45.000 kHz     74.250000 MHz
  Detailed Timing Descriptors:
    DTD 1:  1280x768    60.999855 Hz   5:3     48.678 kHz     81.000000 MHz (643 mm x 386 mm)
                 Hfront   64 Hsync 128 Hback  192 Hpol N
                 Vfront    3 Vsync   7 Vback   20 Vpol P
    Display Range Limits:
      Monitor ranges (GTF): 56-75 Hz V, 30-64 kHz H, max dotclock 110 MHz
    Display Product Name: 'PLC301WT'
    Display Product Name: ' '
Checksum: 0x8f

----------------

Warnings:

Block 0, Base EDID:
  Vendor & Product Identification: The serial number is one of the known dummy values, it should probably be set to 0.

Failures:

Block 0, Base EDID:
  Display Product Name: One or more trailing spaces before newline.

EDID conformity: FAIL
