edid-decode (hex):

00 ff ff ff ff ff ff 00 4c a3 55 31 00 00 00 00
00 0e 01 03 80 21 15 78 0a 87 f5 94 57 4f 8c 27
27 50 54 00 00 00 01 01 01 01 01 01 01 01 01 01
01 01 01 01 01 01 38 3f 80 08 71 b0 23 40 64 20
26 00 4b cf 10 00 00 19 00 00 00 0f 00 00 00 00
00 00 00 00 00 46 d2 02 64 00 00 00 00 fe 00 4a
34 33 36 32 02 31 35 34 55 31 0a 20 00 00 00 fe
00 e0 d8 c0 b8 90 68 40 00 02 01 0a 20 20 00 f0

----------------

Block 0, Base EDID:
  EDID Structure Version & Revision: 1.3
  Vendor & Product Identification:
    Manufacturer: SEC
    Model: 12629
    Made in: 2004
  Basic Display Parameters & Features:
    Digital display
    Maximum image size: 33 cm x 21 cm
    Gamma: 2.20
    RGB color display
    First detailed timing is the preferred timing
  Color Characteristics:
    Red  : 0.5800, 0.3398
    Green: 0.3095, 0.5498
    Blue : 0.1552, 0.1552
    White: 0.3134, 0.3291
  Established Timings I & II: none
  Standard Timings: none
  Detailed Timing Descriptors:
    DTD 1:  1920x1200   60.002076 Hz  16:10    74.103 kHz    161.840000 MHz (331 mm x 207 mm)
                 Hfront  100 Hsync  32 Hback  132 Hpol N
                 Vfront    2 Vsync   6 Vback   27 Vpol N
    Manufacturer-Specified Display Descriptor (0x0f): 00 0f 00 00 00 00 00 00 00 00 00 46 d2 02 64 00 '...........F..d.'
    Alphanumeric Data String: 'J4362.154U1'
    Alphanumeric Data String: '.....h@'
Checksum: 0xf0

----------------

Warnings:

Block 0, Base EDID:
  Alphanumeric Data String: Non-ASCII character 0x02 at position 5, can cause problems.
  Alphanumeric Data String: Non-ASCII character 0xe0 at position 0, can cause problems.
  Alphanumeric Data String: Non-ASCII character 0xd8 at position 1, can cause problems.
  Alphanumeric Data String: Non-ASCII character 0xc0 at position 2, can cause problems.
  Alphanumeric Data String: Non-ASCII character 0xb8 at position 3, can cause problems.
  Alphanumeric Data String: Non-ASCII character 0x90 at position 4, can cause problems.

Failures:

Block 0, Base EDID:
  Alphanumeric Data String: NUL byte at position 7.
  Missing Display Product Name.
  Missing Display Range Limits Descriptor.

EDID conformity: FAIL
