edid-decode (hex):

00 ff ff ff ff ff ff 00 4c a3 55 31 00 00 00 00
00 11 01 03 80 25 17 78 0a 87 f5 94 57 4f 8c 27
27 50 54 00 00 00 01 01 01 01 01 01 01 01 01 01
01 01 01 01 01 01 4f 40 80 34 71 b0 20 40 30 20
26 00 6f e6 10 00 00 19 00 00 00 0f 00 00 00 00
00 00 00 00 00 46 d2 02 64 00 00 00 00 fe 00 47
52 34 33 33 03 31 37 30 55 31 0a 20 00 00 00 fe
00 22 34 45 4f 7d ad d6 ff 02 01 0a 20 20 00 05

----------------

Block 0, Base EDID:
  EDID Structure Version & Revision: 1.3
  Vendor & Product Identification:
    Manufacturer: SEC
    Model: 12629
    Made in: 2007
  Basic Display Parameters & Features:
    Digital display
    Maximum image size: 37 cm x 23 cm
    Gamma: 2.20
    RGB color display
    First detailed timing is the preferred timing
  Color Characteristics:
    Red  : 0.5800, 0.3398
    Green: 0.3095, 0.5498
    Blue : 0.1552, 0.1552
    White: 0.3134, 0.3291
  Established Timings I & II: none
  Standard Timings: none
  Detailed Timing Descriptors:
    DTD 1:  1920x1200   59.976771 Hz  16:10    73.891 kHz    164.630000 MHz (367 mm x 230 mm)
                 Hfront   48 Hsync  32 Hback  228 Hpol N
                 Vfront    2 Vsync   6 Vback   24 Vpol N
    Manufacturer-Specified Display Descriptor (0x0f): 00 0f 00 00 00 00 00 00 00 00 00 46 d2 02 64 00 '...........F..d.'
    Alphanumeric Data String: 'GR433.170U1'
    Alphanumeric Data String: '"4EO}..'
Checksum: 0x05

----------------

Warnings:

Block 0, Base EDID:
  Alphanumeric Data String: Non-ASCII character 0x03 at position 5, can cause problems.
  Alphanumeric Data String: Non-ASCII character 0xad at position 5, can cause problems.
  Alphanumeric Data String: Non-ASCII character 0xd6 at position 6, can cause problems.

Failures:

Block 0, Base EDID:
  Alphanumeric Data String: 0xff byte at position 7.
  Missing Display Product Name.
  Missing Display Range Limits Descriptor.

EDID conformity: FAIL
