edid-decode (hex):

00 ff ff ff ff ff ff 00 4d d9 05 0d 01 00 00 00
ff 1b 01 03 80 a0 5a 78 0a 0d c9 a0 57 47 98 27
12 48 4c 20 00 00 81 c0 31 40 01 01 01 01 01 01
01 01 01 01 01 01 01 1d 00 72 51 d0 1e 20 6e 28
55 00 40 84 63 00 00 1e 00 00 00 fc 00 4d 50 2d
43 44 31 0a 20 20 20 20 20 20 00 00 00 fd 00 18
55 0e 46 10 00 0a 20 20 20 20 20 20 00 00 00 00
00 00 00 00 00 00 00 00 00 00 00 00 00 00 01 5c

02 03 1a 71 45 01 03 04 12 13 23 09 07 07 83 01
00 00 67 03 0c 00 10 00 80 1e 01 1d 00 72 51 d0
1e 20 6e 28 55 00 40 84 63 00 00 1e 01 1d 00 bc
52 d0 1e 20 b8 28 55 40 40 84 63 00 00 1e 8c 0a
d0 90 20 40 31 20 0c 40 55 00 40 84 63 00 00 1e
8c 0a d0 8a 20 e0 2d 10 10 3e 96 00 40 84 63 00
00 1e d6 09 80 a0 20 e0 2d 10 10 60 a2 00 40 84
63 08 08 1e 00 00 00 00 00 00 00 00 00 00 00 83

----------------

Block 0, Base EDID:
  EDID Structure Version & Revision: 1.3
  Vendor & Product Identification:
    Manufacturer: SNY
    Model: 3333
    Serial Number: ...
    Model year: 2017
  Basic Display Parameters & Features:
    Digital display
    Maximum image size: 160 cm x 90 cm
    Gamma: 2.20
    RGB color display
    First detailed timing is the preferred timing
  Color Characteristics:
    Red  : 0.6250, 0.3398
    Green: 0.2802, 0.5947
    Blue : 0.1552, 0.0703
    White: 0.2832, 0.2978
  Established Timings I & II:
    DMT 0x04:   640x480    59.940476 Hz   4:3     31.469 kHz     25.175000 MHz
  Standard Timings:
    DMT 0x55:  1280x720    60.000000 Hz  16:9     45.000 kHz     74.250000 MHz
    DMT 0x04:   640x480    59.940476 Hz   4:3     31.469 kHz     25.175000 MHz
  Detailed Timing Descriptors:
    DTD 1:  1280x720    60.000000 Hz  16:9     45.000 kHz     74.250000 MHz (1600 mm x 900 mm)
                 Hfront  110 Hsync  40 Hback  220 Hpol P
                 Vfront    5 Vsync   5 Vback   20 Vpol P
    Display Product Name: 'MP-CD1'
    Display Range Limits:
      Monitor ranges (GTF): 24-85 Hz V, 14-70 kHz H, max dotclock 160 MHz
    Empty Descriptor
  Extension blocks: 1
Checksum: 0x5c

----------------

Block 1, CTA-861 Extension Block:
  Revision: 3
  Basic audio support
  Supports YCbCr 4:4:4
  Supports YCbCr 4:2:2
  Native DTDs: 1
  Video Data Block:
    VIC   1:   640x480    59.940476 Hz   4:3     31.469 kHz     25.175000 MHz
    VIC   3:   720x480    59.940060 Hz  16:9     31.469 kHz     27.000000 MHz
    VIC   4:  1280x720    60.000000 Hz  16:9     45.000 kHz     74.250000 MHz
    VIC  18:   720x576    50.000000 Hz  16:9     31.250 kHz     27.000000 MHz
    VIC  19:  1280x720    50.000000 Hz  16:9     37.500 kHz     74.250000 MHz
  Audio Data Block:
    Linear PCM:
      Max channels: 2
      Supported sample rates (kHz): 48 44.1 32
      Supported sample sizes (bits): 24 20 16
  Speaker Allocation Data Block:
    FL/FR - Front Left/Right
  Vendor-Specific Data Block (HDMI), OUI 00-0C-03:
    Source physical address: 1.0.0.0
    Supports_AI
    Maximum TMDS clock: 150 MHz
  Detailed Timing Descriptors:
    DTD 2:  1280x720    60.000000 Hz  16:9     45.000 kHz     74.250000 MHz (1600 mm x 900 mm)
                 Hfront  110 Hsync  40 Hback  220 Hpol P
                 Vfront    5 Vsync   5 Vback   20 Vpol P
    DTD 3:  1280x720    50.000000 Hz  16:9     37.500 kHz     74.250000 MHz (1600 mm x 900 mm)
                 Hfront  440 Hsync  40 Hback  220 Hpol P
                 Vfront    5 Vsync   5 Vback   20 Vpol P
    DTD 4:   720x576    50.000000 Hz   5:4     31.250 kHz     27.000000 MHz (1600 mm x 900 mm)
                 Hfront   12 Hsync  64 Hback   68 Hpol P
                 Vfront    5 Vsync   5 Vback   39 Vpol P
    DTD 5:   720x480    59.940060 Hz   3:2     31.469 kHz     27.000000 MHz (1600 mm x 900 mm)
                 Hfront   16 Hsync  62 Hback   60 Hpol P
                 Vfront    9 Vsync   6 Vback   30 Vpol P
    DTD 6:   640x480    59.952381 Hz   4:3     31.475 kHz     25.180000 MHz (1600 mm x 900 mm)
                 Hfront   16 Hsync  96 Hback   32 Hpol P Hborder 8
                 Vfront   10 Vsync   2 Vback   17 Vpol P Vborder 8
Checksum: 0x83  Unused space in Extension Block: 11 bytes

----------------

Warnings:

Block 0, Base EDID:
  Vendor & Product Identification: The serial number is one of the known dummy values, it should probably be set to 0.
Block 1, CTA-861 Extension Block:
  IT Video Formats are overscanned by default, but normally this should be underscanned.
  Video Data Block: VIC 1 and the first DTD are not identical. Is this intended?
  Video Data Block: All VICs are in ascending order, and the first (preferred) VIC <= 4, is that intended?
  Detailed Timing Descriptor #4: DTD is similar but not identical to VIC 17.
  Detailed Timing Descriptor #4: Image size is 1600x900 mm, but based on the picture AR it should be 1125x900 mm.
  Detailed Timing Descriptor #5: DTD is similar but not identical to VIC 2.
  Detailed Timing Descriptor #5: Image size is 1600x900 mm, but based on the picture AR it should be 1350x900 mm.
  Detailed Timing Descriptor #6: Image size is 1600x900 mm, but based on the picture AR it should be 1200x900 mm.
  Detailed Timing Descriptor #6: The use of non-zero borders in a DTD is not recommended.
  Add a Colorimetry Data Block with the sRGB colorimetry bit set to avoid interop issues.

Failures:

Block 0, Base EDID:
  Vendor & Product Identification: EDID 1.3 does not support week 0xff.
  Empty Descriptor: Use Dummy Descriptor instead of all zeroes.
Block 1, CTA-861 Extension Block:
  Missing VCDB, needed for Set Selectable RGB Quantization to avoid interop issues.

EDID conformity: FAIL
