edid-decode (hex):

00 ff ff ff ff ff ff 00 09 e5 be 08 00 00 00 00
01 1d 01 04 a5 26 15 78 03 9e 05 94 5c 59 95 2b
23 50 54 00 00 00 01 01 01 01 01 01 01 01 01 01
01 01 01 01 01 01 77 6d 80 b4 70 38 20 40 30 20
36 00 7e d7 10 00 00 1a c9 2b 80 b4 70 38 20 40
30 20 36 00 7e d7 10 00 00 1a 00 00 00 fd 00 30
78 85 85 1c 01 0a 20 20 20 20 20 20 00 00 00 fe
00 4e 56 31 37 33 46 48 4d 2d 4e 58 31 0a 00 3b

----------------

Block 0, Base EDID:
  EDID Structure Version & Revision: 1.4
  Vendor & Product Identification:
    Manufacturer: BOE
    Model: 2238
    Made in: week 1 of 2019
  Basic Display Parameters & Features:
    Digital display
    Bits per primary color channel: 8
    DisplayPort interface
    Maximum image size: 38 cm x 21 cm
    Gamma: 2.20
    Supported color formats: RGB 4:4:4
    First detailed timing includes the native pixel format and preferred refresh rate
    Display supports continuous frequencies
  Color Characteristics:
    Red  : 0.5800, 0.3603
    Green: 0.3505, 0.5839
    Blue : 0.1679, 0.1367
    White: 0.3134, 0.3291
  Established Timings I & II: none
  Standard Timings: none
  Detailed Timing Descriptors:
    DTD 1:  1920x1080  120.002569 Hz  16:9    133.443 kHz    280.230000 MHz (382 mm x 215 mm)
                 Hfront   48 Hsync  32 Hback  100 Hpol P
                 Vfront    3 Vsync   6 Vback   23 Vpol N
    DTD 2:  1920x1080   48.000171 Hz  16:9     53.376 kHz    112.090000 MHz (382 mm x 215 mm)
                 Hfront   48 Hsync  32 Hback  100 Hpol P
                 Vfront    3 Vsync   6 Vback   23 Vpol N
    Display Range Limits:
      Monitor ranges (Range Limits Only): 48-120 Hz V, 133-133 kHz H, max dotclock 280 MHz
    Alphanumeric Data String: 'NV173FHM-NX1'
Checksum: 0x3b

----------------

Warnings:

Block 0, Base EDID:
  Missing Display Product Name.
EDID:
  Base EDID: Some timings are out of range of the Monitor Ranges:
    Horizontal Freq: 53.376 - 133.442 kHz (Monitor: 133.000 - 133.000 kHz)
    Maximum Clock: 280.230 MHz (Monitor: 280.000 MHz)

EDID conformity: PASS
