edid-decode (hex):

00 ff ff ff ff ff ff 00 30 e4 2c 07 00 00 00 00
00 1f 01 04 a5 1f 11 78 03 ad f5 98 5e 59 8b 26
1c 50 54 00 00 00 01 01 01 01 01 01 01 01 01 01
01 01 01 01 01 01 2e 36 80 a0 70 38 1f 40 30 20
35 00 35 ae 10 00 00 1a 00 00 00 00 00 00 00 00
00 00 00 00 00 00 00 00 00 00 00 00 00 fe 00 4c
47 20 44 69 73 70 6c 61 79 0a 20 20 00 00 00 fe
00 4c 50 31 34 30 57 46 48 2d 53 50 44 38 00 8b

00 ff ff ff ff ff ff 00 30 e4 2c 07 00 00 00 00
00 1f 01 04 a5 1f 11 78 03 ad f5 98 5e 59 8b 26
1c 50 54 00 00 00 01 01 01 01 01 01 01 01 01 01
01 01 01 01 01 01 2e 36 80 a0 70 38 1f 40 30 20
35 00 35 ae 10 00 00 1a 00 00 00 00 00 00 00 00
00 00 00 00 00 00 00 00 00 00 00 00 00 fe 00 4c
47 20 44 69 73 70 6c 61 79 0a 20 20 00 00 00 fe
00 4c 50 31 34 30 57 46 48 2d 53 50 44 38 00 8b

----------------

Block 0, Base EDID:
  EDID Structure Version & Revision: 1.4
  Vendor & Product Identification:
    Manufacturer: LGD
    Model: 1836
    Made in: 2021
  Basic Display Parameters & Features:
    Digital display
    Bits per primary color channel: 8
    DisplayPort interface
    Maximum image size: 31 cm x 17 cm
    Gamma: 2.20
    Supported color formats: RGB 4:4:4
    First detailed timing includes the native pixel format and preferred refresh rate
    Display supports continuous frequencies
  Color Characteristics:
    Red  : 0.5957, 0.3691
    Green: 0.3505, 0.5439
    Blue : 0.1513, 0.1123
    White: 0.3134, 0.3291
  Established Timings I & II: none
  Standard Timings: none
  Detailed Timing Descriptors:
    DTD 1:  1920x1080   60.020425 Hz  16:9     66.683 kHz    138.700000 MHz (309 mm x 174 mm)
                 Hfront   48 Hsync  32 Hback   80 Hpol P
                 Vfront    3 Vsync   5 Vback   23 Vpol N
    Empty Descriptor
    Alphanumeric Data String: 'LG Display'
    Alphanumeric Data String: 'LP140WFH-SPD8'
Checksum: 0x8b

----------------

Block 1, Unknown EDID Extension Block 0x00:
  00 ff ff ff ff ff ff 00 30 e4 2c 07 00 00 00 00 '........0.,.....'
  00 1f 01 04 a5 1f 11 78 03 ad f5 98 5e 59 8b 26 '.......x....^Y.&'
  1c 50 54 00 00 00 01 01 01 01 01 01 01 01 01 01 '.PT.............'
  01 01 01 01 01 01 2e 36 80 a0 70 38 1f 40 30 20 '.......6..p8.@0 '
  35 00 35 ae 10 00 00 1a 00 00 00 00 00 00 00 00 '5.5.............'
  00 00 00 00 00 00 00 00 00 00 00 00 00 fe 00 4c '...............L'
  47 20 44 69 73 70 6c 61 79 0a 20 20 00 00 00 fe 'G Display.  ....'
  00 4c 50 31 34 30 57 46 48 2d 53 50 44 38 00 8b '.LP140WFH-SPD8..'
Checksum: 0x8b

----------------

Warnings:

Block 0, Base EDID:
  Missing Display Product Name.

Failures:

Block 0, Base EDID:
  Empty Descriptor: Use Dummy Descriptor instead of all zeroes.
  Missing Display Range Limits Descriptor.
Block 1, Base EDID:
  Unknown Extension Block.
EDID:
  Base EDID: EDID specified 0 extension block(s), but found 1 extension block(s).

EDID conformity: FAIL
