edid-decode (hex):

00 ff ff ff ff ff ff 00 5d f2 30 24 21 1d 9a 00
10 16 01 03 00 35 1e 78 ea d6 a5 a2 59 4a 95 24
14 50 54 bf ce 00 81 81 71 40 81 80 81 8f 95 00
a9 40 d1 c0 01 01 28 3c 80 a0 70 b0 23 40 30 20
36 00 70 cf 10 00 00 1a 00 00 00 ff 00 59 54 32
30 31 32 30 33 30 36 31 35 0a 21 39 90 30 62 1a
27 40 68 b0 36 00 55 00 11 00 00 1c 00 00 00 fc
00 54 45 52 52 41 20 32 34 33 30 57 0a 20 00 c8

00 ff ff ff ff ff ff 00 5d f2 30 24 21 1d 9a 00
10 16 01 03 00 35 1e 78 ea d6 a5 a2 59 4a 95 24
14 50 54 bf ce 00 81 81 71 40 81 80 81 8f 95 00
a9 40 d1 c0 01 01 28 3c 80 a0 70 b0 23 40 30 20
36 00 70 cf 10 00 00 1a 00 00 00 ff 00 59 54 32
30 31 32 30 33 30 36 31 35 0a 21 39 90 30 62 1a
27 40 68 b0 36 00 55 00 11 00 00 1c 00 00 00 fc
00 54 45 52 52 41 20 32 34 33 30 57 0a 20 00 c8

----------------

Block 0, Base EDID:
  EDID Structure Version & Revision: 1.3
  Vendor & Product Identification:
    Manufacturer: WOR
    Model: 9264
    Serial Number: ...
    Made in: week 16 of 2012
  Basic Display Parameters & Features:
    Analog display
    Signal Level Standard: 0.700 : 0.300 : 1.000 V p-p
    Blank level equals black level
    Maximum image size: 53 cm x 30 cm
    Gamma: 2.20
    DPMS levels: Standby Suspend Off
    RGB color display
    First detailed timing is the preferred timing
  Color Characteristics:
    Red  : 0.6357, 0.3486
    Green: 0.2900, 0.5839
    Blue : 0.1425, 0.0800
    White: 0.3134, 0.3291
  Established Timings I & II:
    IBM     :   720x400    70.081663 Hz   9:5     31.467 kHz     28.320000 MHz
    DMT 0x04:   640x480    59.940476 Hz   4:3     31.469 kHz     25.175000 MHz
    Apple   :   640x480    66.666667 Hz   4:3     35.000 kHz     30.240000 MHz
    DMT 0x05:   640x480    72.808802 Hz   4:3     37.861 kHz     31.500000 MHz
    DMT 0x06:   640x480    75.000000 Hz   4:3     37.500 kHz     31.500000 MHz
    DMT 0x08:   800x600    56.250000 Hz   4:3     35.156 kHz     36.000000 MHz
    DMT 0x09:   800x600    60.316541 Hz   4:3     37.879 kHz     40.000000 MHz
    DMT 0x0a:   800x600    72.187572 Hz   4:3     48.077 kHz     50.000000 MHz
    DMT 0x0b:   800x600    75.000000 Hz   4:3     46.875 kHz     49.500000 MHz
    DMT 0x10:  1024x768    60.003840 Hz   4:3     48.363 kHz     65.000000 MHz
    DMT 0x11:  1024x768    70.069359 Hz   4:3     56.476 kHz     75.000000 MHz
    DMT 0x12:  1024x768    75.028582 Hz   4:3     60.023 kHz     78.750000 MHz
  Standard Timings:
    GTF     :  1280x1024   60.999806 Hz   5:4     64.721 kHz    110.802000 MHz
    GTF     :  1152x864    60.000000 Hz   4:3     53.700 kHz     81.624000 MHz
    DMT 0x23:  1280x1024   60.019740 Hz   5:4     63.981 kHz    108.000000 MHz
    DMT 0x24:  1280x1024   75.024675 Hz   5:4     79.976 kHz    135.000000 MHz
    DMT 0x2f:  1440x900    59.887445 Hz  16:10    55.935 kHz    106.500000 MHz
    DMT 0x33:  1600x1200   60.000000 Hz   4:3     75.000 kHz    162.000000 MHz
    DMT 0x52:  1920x1080   60.000000 Hz  16:9     67.500 kHz    148.500000 MHz
  Detailed Timing Descriptors:
    DTD 1:  1920x1200   59.950171 Hz  16:10    74.038 kHz    154.000000 MHz (368 mm x 207 mm)
                 Hfront   48 Hsync  32 Hback   80 Hpol P
                 Vfront    3 Vsync   6 Vback   26 Vpol N
    Display Product Serial Number: ...
    DTD 2:  1680x1050   59.954250 Hz  16:10    65.290 kHz    146.250000 MHz (341 mm x 256 mm)
                 Hfront  104 Hsync 176 Hback  280 Hpol N
                 Vfront    3 Vsync   6 Vback   30 Vpol P
    Display Product Name: 'TERRA 2430W'
Checksum: 0xc8

----------------

Warnings:

Block 0, Base EDID:
  Detailed Timing Descriptor #1: Image size is 368x207 mm, but based on the picture AR it should be 331x207 mm.
  Detailed Timing Descriptor #2: Image size is 341x256 mm, but based on the picture AR it should be 341x213 mm.

Failures:

Block 0, Base EDID:
  Detailed Timing Descriptor #1: Mismatch of image size 368x207 mm vs display size 530x300 mm.
  Detailed Timing Descriptor #2: Mismatch of image size 341x256 mm vs display size 530x300 mm.
  Detailed Timing Descriptor #2: Invalid detailed timing descriptor ordering.
  Missing Display Range Limits Descriptor.
EDID:
  Extension Block 1 started with EDID header, ignoring Extension Blocks >= 1.

EDID conformity: FAIL
