edid-decode (hex):

00 ff ff ff ff ff ff 00 04 72 66 00 72 83 80 92
1c 13 01 03 68 29 17 78 2a a9 80 a5 55 48 9b 26
12 50 54 bf ee 00 81 c0 81 00 01 01 01 01 01 01
01 01 01 01 01 01 66 21 56 a8 51 00 1e 30 45 8f
3a 00 58 c2 10 00 00 1c 00 00 00 fd 00 37 4b 1e
3c 09 00 0a 20 20 20 20 20 20 00 00 00 fc 00 41
63 65 72 20 45 31 38 31 48 0a 20 20 00 00 00 ff
00 45 30 35 30 38 30 30 31 34 32 30 33 0a 00 a8

00 ff ff ff ff ff ff 00 04 72 66 00 72 83 80 92
1c 13 01 03 68 29 17 78 2a a9 80 a5 55 48 9b 26
12 50 54 bf ee 00 81 c0 81 00 01 01 01 01 01 01
01 01 01 01 01 01 66 21 56 a8 51 00 1e 30 45 8f
3a 00 58 c2 10 00 00 1c 00 00 00 fd 00 37 4b 1e
3c 09 00 0a 20 20 20 20 20 20 00 00 00 fc 00 41
63 65 72 20 45 31 38 31 48 0a 20 20 00 00 00 ff
00 45 30 35 30 38 30 30 31 34 32 30 33 0a 00 a8

----------------

Block 0, Base EDID:
  EDID Structure Version & Revision: 1.3
  Vendor & Product Identification:
    Manufacturer: ACR
    Model: 102
    Serial Number: ...
    Made in: week 28 of 2009
  Basic Display Parameters & Features:
    Analog display
    Signal Level Standard: 0.700 : 0.000 : 0.700 V p-p
    Blank level equals black level
    Sync: Separate
    Maximum image size: 41 cm x 23 cm
    Gamma: 2.20
    DPMS levels: Off
    RGB color display
    First detailed timing is the preferred timing
  Color Characteristics:
    Red  : 0.6464, 0.3339
    Green: 0.2832, 0.6064
    Blue : 0.1503, 0.0703
    White: 0.3125, 0.3281
  Established Timings I & II:
    IBM     :   720x400    70.081663 Hz   9:5     31.467 kHz     28.320000 MHz
    DMT 0x04:   640x480    59.940476 Hz   4:3     31.469 kHz     25.175000 MHz
    Apple   :   640x480    66.666667 Hz   4:3     35.000 kHz     30.240000 MHz
    DMT 0x05:   640x480    72.808802 Hz   4:3     37.861 kHz     31.500000 MHz
    DMT 0x06:   640x480    75.000000 Hz   4:3     37.500 kHz     31.500000 MHz
    DMT 0x08:   800x600    56.250000 Hz   4:3     35.156 kHz     36.000000 MHz
    DMT 0x09:   800x600    60.316541 Hz   4:3     37.879 kHz     40.000000 MHz
    DMT 0x0a:   800x600    72.187572 Hz   4:3     48.077 kHz     50.000000 MHz
    DMT 0x0b:   800x600    75.000000 Hz   4:3     46.875 kHz     49.500000 MHz
    Apple   :   832x624    74.551266 Hz   4:3     49.726 kHz     57.284000 MHz
    DMT 0x10:  1024x768    60.003840 Hz   4:3     48.363 kHz     65.000000 MHz
    DMT 0x11:  1024x768    70.069359 Hz   4:3     56.476 kHz     75.000000 MHz
    DMT 0x12:  1024x768    75.028582 Hz   4:3     60.023 kHz     78.750000 MHz
  Standard Timings:
    DMT 0x55:  1280x720    60.000000 Hz  16:9     45.000 kHz     74.250000 MHz
    DMT 0x1c:  1280x800    59.810326 Hz  16:10    49.702 kHz     83.500000 MHz
  Detailed Timing Descriptors:
    DTD 1:  1366x768    59.856345 Hz 683:384   47.765 kHz     85.500000 MHz (344 mm x 194 mm)
                 Hfront   69 Hsync 143 Hback  212 Hpol N
                 Vfront    3 Vsync  10 Vback   17 Vpol P
    Display Range Limits:
      Monitor ranges (GTF): 55-75 Hz V, 30-60 kHz H, max dotclock 90 MHz
    Display Product Name: 'Acer E181H'
    Display Product Serial Number: ...
Checksum: 0xa8

----------------

Failures:

Block 0, Base EDID:
  Detailed Timing Descriptor #1: Mismatch of image size 344x194 mm vs display size 410x230 mm.
EDID:
  Extension Block 1 started with EDID header, ignoring Extension Blocks >= 1.

EDID conformity: FAIL
