edid-decode (hex):

00 ff ff ff ff ff ff 00 22 0e 5e 36 01 01 01 01
34 1d 01 03 80 30 1b 78 2a 5a 65 a7 56 52 9c 27
0f 50 54 21 08 00 d1 c0 a9 c0 81 c0 b3 00 95 00
81 00 81 80 00 00 02 3a 80 18 71 38 2d 40 58 2c
45 00 dc 0c 11 00 00 1e 00 00 00 fd 00 30 4b 1e
56 12 00 0a 20 20 20 20 20 20 00 00 00 fc 00 48
50 20 50 32 32 68 20 47 34 0a 20 20 00 00 00 ff
00 33 43 4d 39 35 32 30 36 57 33 20 20 20 01 d0

02 03 19 b1 49 90 1f 04 13 03 12 02 11 01 67 03
0c 00 10 00 00 1e e2 00 6b 02 3a 80 18 71 38 2d
40 58 2c 45 00 dc 0c 11 00 00 1e 02 3a 80 d0 72
38 2d 40 10 2c 45 80 dc 0c 11 00 00 1e 01 1d 00
72 51 d0 1e 20 6e 28 55 00 dc 0c 11 00 00 1e 01
1d 00 bc 52 d0 1e 20 b8 28 55 40 dc 0c 11 00 00
1e 00 00 80 a0 70 38 27 40 30 20 35 00 dc 0c 11
00 00 1a 00 00 00 00 00 00 00 00 00 00 00 00 05

00 ff ff ff ff ff ff 00 22 0e 5e 36 01 01 01 01
34 1d 01 03 80 30 1b 78 2a 5a 65 a7 56 52 9c 27
0f 50 54 21 08 00 d1 c0 a9 c0 81 c0 b3 00 95 00
81 00 81 80 00 00 02 3a 80 18 71 38 2d 40 58 2c
45 00 dc 0c 11 00 00 1e 00 00 00 fd 00 30 4b 1e
56 12 00 0a 20 20 20 20 20 20 00 00 00 fc 00 48
50 20 50 32 32 68 20 47 34 0a 20 20 00 00 00 ff
00 33 43 4d 39 35 32 30 36 57 33 20 20 20 01 d0

02 03 19 b1 49 90 1f 04 13 03 12 02 11 01 67 03
0c 00 10 00 00 1e e2 00 6b 02 3a 80 18 71 38 2d
40 58 2c 45 00 dc 0c 11 00 00 1e 02 3a 80 d0 72
38 2d 40 10 2c 45 80 dc 0c 11 00 00 1e 01 1d 00
72 51 d0 1e 20 6e 28 55 00 dc 0c 11 00 00 1e 01
1d 00 bc 52 d0 1e 20 b8 28 55 40 dc 0c 11 00 00
1e 00 00 80 a0 70 38 27 40 30 20 35 00 dc 0c 11
00 00 1a 00 00 00 00 00 00 00 00 00 00 00 00 05

----------------

Block 0, Base EDID:
  EDID Structure Version & Revision: 1.3
  Vendor & Product Identification:
    Manufacturer: HPN
    Model: 13918
    Serial Number: ...
    Made in: week 52 of 2019
  Basic Display Parameters & Features:
    Digital display
    Maximum image size: 48 cm x 27 cm
    Gamma: 2.20
    DPMS levels: Off
    RGB color display
    First detailed timing is the preferred timing
  Color Characteristics:
    Red  : 0.6533, 0.3369
    Green: 0.3222, 0.6113
    Blue : 0.1533, 0.0605
    White: 0.3134, 0.3291
  Established Timings I & II:
    DMT 0x04:   640x480    59.940476 Hz   4:3     31.469 kHz     25.175000 MHz
    DMT 0x09:   800x600    60.316541 Hz   4:3     37.879 kHz     40.000000 MHz
    DMT 0x10:  1024x768    60.003840 Hz   4:3     48.363 kHz     65.000000 MHz
  Standard Timings:
    DMT 0x52:  1920x1080   60.000000 Hz  16:9     67.500 kHz    148.500000 MHz
    DMT 0x53:  1600x900    60.000000 Hz  16:9     60.000 kHz    108.000000 MHz (RB)
    DMT 0x55:  1280x720    60.000000 Hz  16:9     45.000 kHz     74.250000 MHz
    DMT 0x3a:  1680x1050   59.954250 Hz  16:10    65.290 kHz    146.250000 MHz
    DMT 0x2f:  1440x900    59.887445 Hz  16:10    55.935 kHz    106.500000 MHz
    DMT 0x1c:  1280x800    59.810326 Hz  16:10    49.702 kHz     83.500000 MHz
    DMT 0x23:  1280x1024   60.019740 Hz   5:4     63.981 kHz    108.000000 MHz
  Detailed Timing Descriptors:
    DTD 1:  1920x1080   60.000000 Hz  16:9     67.500 kHz    148.500000 MHz (476 mm x 268 mm)
                 Hfront   88 Hsync  44 Hback  148 Hpol P
                 Vfront    4 Vsync   5 Vback   36 Vpol P
    Display Range Limits:
      Monitor ranges (GTF): 48-75 Hz V, 30-86 kHz H, max dotclock 180 MHz
    Display Product Name: 'HP P22h G4'
    Display Product Serial Number: ...
  Extension blocks: 1
Checksum: 0xd0

----------------

Block 1, CTA-861 Extension Block:
  Revision: 3
  Underscans IT Video Formats by default
  Supports YCbCr 4:4:4
  Supports YCbCr 4:2:2
  Native DTDs: 1
  Video Data Block:
    VIC  16:  1920x1080   60.000000 Hz  16:9     67.500 kHz    148.500000 MHz (native)
    VIC  31:  1920x1080   50.000000 Hz  16:9     56.250 kHz    148.500000 MHz
    VIC   4:  1280x720    60.000000 Hz  16:9     45.000 kHz     74.250000 MHz
    VIC  19:  1280x720    50.000000 Hz  16:9     37.500 kHz     74.250000 MHz
    VIC   3:   720x480    59.940060 Hz  16:9     31.469 kHz     27.000000 MHz
    VIC  18:   720x576    50.000000 Hz  16:9     31.250 kHz     27.000000 MHz
    VIC   2:   720x480    59.940060 Hz   4:3     31.469 kHz     27.000000 MHz
    VIC  17:   720x576    50.000000 Hz   4:3     31.250 kHz     27.000000 MHz
    VIC   1:   640x480    59.940476 Hz   4:3     31.469 kHz     25.175000 MHz
  Vendor-Specific Data Block (HDMI), OUI 00-0C-03:
    Source physical address: 1.0.0.0
    Maximum TMDS clock: 150 MHz
  Video Capability Data Block:
    YCbCr quantization: No Data
    RGB quantization: Selectable (via AVI Q)
    PT scan behavior: Always Underscanned
    IT scan behavior: Always Underscanned
    CE scan behavior: Supports both over- and underscan
  Detailed Timing Descriptors:
    DTD 2:  1920x1080   60.000000 Hz  16:9     67.500 kHz    148.500000 MHz (476 mm x 268 mm)
                 Hfront   88 Hsync  44 Hback  148 Hpol P
                 Vfront    4 Vsync   5 Vback   36 Vpol P
    DTD 3:  1920x1080   50.000000 Hz  16:9     56.250 kHz    148.500000 MHz (476 mm x 268 mm)
                 Hfront  528 Hsync  44 Hback  148 Hpol P
                 Vfront    4 Vsync   5 Vback   36 Vpol P
    DTD 4:  1280x720    60.000000 Hz  16:9     45.000 kHz     74.250000 MHz (476 mm x 268 mm)
                 Hfront  110 Hsync  40 Hback  220 Hpol P
                 Vfront    5 Vsync   5 Vback   20 Vpol P
    DTD 5:  1280x720    50.000000 Hz  16:9     37.500 kHz     74.250000 MHz (476 mm x 268 mm)
                 Hfront  440 Hsync  40 Hback  220 Hpol P
                 Vfront    5 Vsync   5 Vback   20 Vpol P
    Unknown Display Descriptor (0xa0): 80 a0 70 38 27 40 30 20 35 00 dc 0c 11 00 00 1a '..p8'@0 5.......'
Checksum: 0x05  Unused space in Extension Block: 12 bytes

----------------

Warnings:

Block 0, Base EDID:
  Vendor & Product Identification: The serial number is one of the known dummy values, it should probably be set to 0.
Block 1, CTA-861 Extension Block:
  Video Capability Data Block: Set Selectable YCbCr Quantization to avoid interop issues.
  Display Product Serial Number is set, so the Serial Number in the Base EDID should be 0.
  Add a Colorimetry Data Block with the sRGB colorimetry bit set to avoid interop issues.

Failures:

Block 0, Base EDID:
  Display Product Serial Number: ...
  Standard Timings: Use 0x0101 as the invalid Standard Timings code, not 0x0000.
Block 1, CTA-861 Extension Block:
  Display Descriptor #9: Monitor descriptor block has byte 2 nonzero (0x80).
  Display Descriptor #9: Monitor descriptor block has byte 4 nonzero (0x70).
  Display Descriptor #9: Unknown Type 0xa0.
EDID:
  Extension Block 2 started with EDID header, ignoring Extension Blocks >= 2.

EDID conformity: FAIL
