edid-decode (hex):

00 ff ff ff ff ff ff 00 30 e4 3c 03 00 00 00 00
00 16 01 04 90 1f 11 78 0a a9 25 96 58 57 8e 28
1f 50 54 00 00 00 01 01 01 01 01 01 01 01 01 01
01 01 01 01 01 01 fb 1d 56 ba 50 00 38 30 24 30
35 00 35 ae 10 00 00 19 d8 13 56 ba 50 00 32 30
24 30 35 00 35 ae 10 00 00 19 00 00 00 fe 00 4a
56 57 33 50 80 31 34 30 57 48 34 0a 00 00 00 00
00 00 41 31 94 01 00 00 00 01 01 0a 20 20 00 46

00 ff ff ff ff ff ff 00 30 e4 3c 03 00 00 00 00
00 16 01 04 90 1f 11 78 0a a9 25 96 58 57 8e 28
1f 50 54 00 00 00 01 01 01 01 01 01 01 01 01 01
01 01 01 01 01 01 fb 1d 56 ba 50 00 38 30 24 30
35 00 35 ae 10 00 00 19 d8 13 56 ba 50 00 32 30
24 30 35 00 35 ae 10 00 00 19 00 00 00 fe 00 4a
56 57 33 50 80 31 34 30 57 48 34 0a 00 00 00 00
00 00 41 31 94 01 00 00 00 01 01 0a 20 20 00 46

----------------

Block 0, Base EDID:
  EDID Structure Version & Revision: 1.4
  Vendor & Product Identification:
    Manufacturer: LGD
    Model: 828
    Made in: 2012
  Basic Display Parameters & Features:
    Digital display
    Bits per primary color channel: 6
    Digital interface is not defined
    Maximum image size: 31 cm x 17 cm
    Gamma: 2.20
    Supported color formats: RGB 4:4:4, YCrCb 4:4:4
    First detailed timing includes the native pixel format and preferred refresh rate
  Color Characteristics:
    Red  : 0.5878, 0.3457
    Green: 0.3417, 0.5556
    Blue : 0.1562, 0.1230
    White: 0.3134, 0.3291
  Established Timings I & II: none
  Standard Timings: none
  Detailed Timing Descriptors:
    DTD 1:  1366x768    60.014951 Hz 683:384   49.452 kHz     76.750000 MHz (309 mm x 174 mm)
                 Hfront   36 Hsync  48 Hback  102 Hpol N
                 Vfront    3 Vsync   5 Vback   48 Vpol N
    DTD 2:  1366x768    40.014620 Hz 683:384   32.732 kHz     50.800000 MHz (309 mm x 174 mm)
                 Hfront   36 Hsync  48 Hback  102 Hpol N
                 Vfront    3 Vsync   5 Vback   42 Vpol N
    Alphanumeric Data String: 'JVW3P.140WH4'
    Manufacturer-Specified Display Descriptor (0x00): 00 00 00 00 41 31 94 01 00 00 00 01 01 0a 20 20 '....A1........  '
Checksum: 0x46

----------------

Block 1, Unknown EDID Extension Block 0x00:
  00 ff ff ff ff ff ff 00 30 e4 3c 03 00 00 00 00 '........0.<.....'
  00 16 01 04 90 1f 11 78 0a a9 25 96 58 57 8e 28 '.......x..%.XW.('
  1f 50 54 00 00 00 01 01 01 01 01 01 01 01 01 01 '.PT.............'
  01 01 01 01 01 01 fb 1d 56 ba 50 00 38 30 24 30 '........V.P.80$0'
  35 00 35 ae 10 00 00 19 d8 13 56 ba 50 00 32 30 '5.5.......V.P.20'
  24 30 35 00 35 ae 10 00 00 19 00 00 00 fe 00 4a '$05.5..........J'
  56 57 33 50 80 31 34 30 57 48 34 0a 00 00 00 00 'VW3P.140WH4.....'
  00 00 41 31 94 01 00 00 00 01 01 0a 20 20 00 46 '..A1........  .F'
Checksum: 0x46

----------------

Warnings:

Block 0, Base EDID:
  Alphanumeric Data String: Non-ASCII character 0x80 at position 5, can cause problems.
  Missing Display Product Name.

Failures:

Block 1, Base EDID:
  Unknown Extension Block.
EDID:
  Base EDID: EDID specified 0 extension block(s), but found 1 extension block(s).

EDID conformity: FAIL
