edid-decode (hex):

00 ff ff ff ff ff ff 00 15 85 01 01 0f 00 00 00
09 16 01 03 80 3a 20 78 0a 01 c1 a0 57 47 98 27
12 4c 4c 21 08 00 31 40 45 40 61 40 81 80 01 01
01 01 01 01 01 01 98 21 50 b0 51 00 1b 30 40 70
36 00 40 84 63 00 00 1e 4c 1d 00 72 51 d0 1e 20
6e 28 55 00 40 84 63 00 00 1e 00 00 00 fc 00 45
4c 43 46 54 32 36 32 0a 20 20 20 20 00 00 00 fd
00 30 3e 0e 44 0f 00 0a 20 20 20 20 20 20 01 9b

02 03 27 70 52 01 02 03 04 05 06 07 10 11 12 13
14 15 16 1f 20 21 22 23 09 07 07 83 01 00 00 67
03 0c 00 20 00 b8 2d 01 1d 80 d0 72 1c 16 20 10
2c 25 80 40 84 63 00 00 9f 01 1d 80 18 71 1c 16
20 58 2c 25 00 40 84 63 00 00 99 01 1d 00 bc 52
d0 1e 20 b8 28 55 40 40 84 63 00 00 1e 02 3a 80
d0 72 38 2d 40 10 2c 45 80 40 84 63 00 00 1e 00
00 00 00 00 00 00 00 00 00 00 00 00 00 00 00 1e

00 ff ff ff ff ff ff 00 15 85 01 01 0f 00 00 00
09 16 01 03 80 3a 20 78 0a 01 c1 a0 57 47 98 27
12 4c 4c 21 08 00 31 40 45 40 61 40 81 80 01 01
01 01 01 01 01 01 98 21 50 b0 51 00 1b 30 40 70
36 00 40 84 63 00 00 1e 4c 1d 00 72 51 d0 1e 20
6e 28 55 00 40 84 63 00 00 1e 00 00 00 fc 00 45
4c 43 46 54 32 36 32 0a 20 20 20 20 00 00 00 fd
00 30 3e 0e 44 0f 00 0a 20 20 20 20 20 20 01 9b

02 03 27 70 52 01 02 03 04 05 06 07 10 11 12 13
14 15 16 1f 20 21 22 23 09 07 07 83 01 00 00 67
03 0c 00 20 00 b8 2d 01 1d 80 d0 72 1c 16 20 10
2c 25 80 40 84 63 00 00 9f 01 1d 80 18 71 1c 16
20 58 2c 25 00 40 84 63 00 00 99 01 1d 00 bc 52
d0 1e 20 b8 28 55 40 40 84 63 00 00 1e 02 3a 80
d0 72 38 2d 40 10 2c 45 80 40 84 63 00 00 1e 00
00 00 00 00 00 00 00 00 00 00 00 00 00 00 00 1e

----------------

Block 0, Base EDID:
  EDID Structure Version & Revision: 1.3
  Vendor & Product Identification:
    Manufacturer: ELE
    Model: 257
    Serial Number: ...
    Made in: week 9 of 2012
  Basic Display Parameters & Features:
    Digital display
    Maximum image size: 58 cm x 32 cm
    Gamma: 2.20
    RGB color display
    First detailed timing is the preferred timing
  Color Characteristics:
    Red  : 0.6250, 0.3398
    Green: 0.2773, 0.5947
    Blue : 0.1552, 0.0703
    White: 0.2968, 0.2978
  Established Timings I & II:
    DMT 0x04:   640x480    59.940476 Hz   4:3     31.469 kHz     25.175000 MHz
    DMT 0x09:   800x600    60.316541 Hz   4:3     37.879 kHz     40.000000 MHz
    DMT 0x10:  1024x768    60.003840 Hz   4:3     48.363 kHz     65.000000 MHz
  Standard Timings:
    DMT 0x04:   640x480    59.940476 Hz   4:3     31.469 kHz     25.175000 MHz
    DMT 0x09:   800x600    60.316541 Hz   4:3     37.879 kHz     40.000000 MHz
    DMT 0x10:  1024x768    60.003840 Hz   4:3     48.363 kHz     65.000000 MHz
    DMT 0x23:  1280x1024   60.019740 Hz   5:4     63.981 kHz    108.000000 MHz
  Detailed Timing Descriptors:
    DTD 1:  1360x768    60.366128 Hz  85:48    47.991 kHz     86.000000 MHz (1600 mm x 900 mm)
                 Hfront   64 Hsync 112 Hback  256 Hpol P
                 Vfront    3 Vsync   6 Vback   18 Vpol P
    DTD 2:  1280x720    60.606061 Hz  16:9     45.455 kHz     75.000000 MHz (1600 mm x 900 mm)
                 Hfront  110 Hsync  40 Hback  220 Hpol P
                 Vfront    5 Vsync   5 Vback   20 Vpol P
    Display Product Name: 'ELCFT262'
    Display Range Limits:
      Monitor ranges (GTF): 48-62 Hz V, 14-68 kHz H, max dotclock 150 MHz
  Extension blocks: 1
Checksum: 0x9b

----------------

Block 1, CTA-861 Extension Block:
  Revision: 3
  Basic audio support
  Supports YCbCr 4:4:4
  Supports YCbCr 4:2:2
  Native DTDs: 0
  Video Data Block:
    VIC   1:   640x480    59.940476 Hz   4:3     31.469 kHz     25.175000 MHz
    VIC   2:   720x480    59.940060 Hz   4:3     31.469 kHz     27.000000 MHz
    VIC   3:   720x480    59.940060 Hz  16:9     31.469 kHz     27.000000 MHz
    VIC   4:  1280x720    60.000000 Hz  16:9     45.000 kHz     74.250000 MHz
    VIC   5:  1920x1080i  60.000000 Hz  16:9     33.750 kHz     74.250000 MHz
    VIC   6:  1440x480i   59.940060 Hz   4:3     15.734 kHz     27.000000 MHz
    VIC   7:  1440x480i   59.940060 Hz  16:9     15.734 kHz     27.000000 MHz
    VIC  16:  1920x1080   60.000000 Hz  16:9     67.500 kHz    148.500000 MHz
    VIC  17:   720x576    50.000000 Hz   4:3     31.250 kHz     27.000000 MHz
    VIC  18:   720x576    50.000000 Hz  16:9     31.250 kHz     27.000000 MHz
    VIC  19:  1280x720    50.000000 Hz  16:9     37.500 kHz     74.250000 MHz
    VIC  20:  1920x1080i  50.000000 Hz  16:9     28.125 kHz     74.250000 MHz
    VIC  21:  1440x576i   50.000000 Hz   4:3     15.625 kHz     27.000000 MHz
    VIC  22:  1440x576i   50.000000 Hz  16:9     15.625 kHz     27.000000 MHz
    VIC  31:  1920x1080   50.000000 Hz  16:9     56.250 kHz    148.500000 MHz
    VIC  32:  1920x1080   24.000000 Hz  16:9     27.000 kHz     74.250000 MHz
    VIC  33:  1920x1080   25.000000 Hz  16:9     28.125 kHz     74.250000 MHz
    VIC  34:  1920x1080   30.000000 Hz  16:9     33.750 kHz     74.250000 MHz
  Audio Data Block:
    Linear PCM:
      Max channels: 2
      Supported sample rates (kHz): 48 44.1 32
      Supported sample sizes (bits): 24 20 16
  Speaker Allocation Data Block:
    FL/FR - Front Left/Right
  Vendor-Specific Data Block (HDMI), OUI 00-0C-03:
    Source physical address: 2.0.0.0
    Supports_AI
    DC_36bit
    DC_30bit
    DC_Y444
    Maximum TMDS clock: 225 MHz
  Detailed Timing Descriptors:
    DTD 3:  1920x1080i  50.000000 Hz  16:9     28.125 kHz     74.250000 MHz (1600 mm x 900 mm)
                 Hfront  528 Hsync  44 Hback  148 Hpol P
                 Vfront    2 Vsync   5 Vback   15 Vpol P Vfront +0.5 Odd Field
                 Vfront    2 Vsync   5 Vback   15 Vpol P Vback  +0.5 Even Field
    DTD 4:  1920x1080i  60.000000 Hz  16:9     33.750 kHz     74.250000 MHz (1600 mm x 900 mm)
                 Hfront   88 Hsync  44 Hback  148 Hpol N
                 Vfront    2 Vsync   5 Vback   15 Vpol N Vfront +0.5 Odd Field
                 Vfront    2 Vsync   5 Vback   15 Vpol N Vback  +0.5 Even Field
    DTD 5:  1280x720    50.000000 Hz  16:9     37.500 kHz     74.250000 MHz (1600 mm x 900 mm)
                 Hfront  440 Hsync  40 Hback  220 Hpol P
                 Vfront    5 Vsync   5 Vback   20 Vpol P
    DTD 6:  1920x1080   50.000000 Hz  16:9     56.250 kHz    148.500000 MHz (1600 mm x 900 mm)
                 Hfront  528 Hsync  44 Hback  148 Hpol P
                 Vfront    4 Vsync   5 Vback   36 Vpol P
Checksum: 0x1e  Unused space in Extension Block: 16 bytes

----------------

Warnings:

Block 1, CTA-861 Extension Block:
  IT Video Formats are overscanned by default, but normally this should be underscanned.
  Video Data Block: VIC 1 and the first DTD are not identical. Is this intended?
  Video Data Block: All VICs are in ascending order, and the first (preferred) VIC <= 4, is that intended?
  Detailed Timing Descriptor #4: DTD is similar but not identical to VIC 5.
  Add a Colorimetry Data Block with the sRGB colorimetry bit set to avoid interop issues.
EDID:
  Base EDID: Some timings are out of range of the Monitor Ranges:
    Vertical Freq: 24.000 - 60.606 Hz (Monitor: 48.000 - 62.000 Hz)

Failures:

Block 0, Base EDID:
  Detailed Timing Descriptor #1: Mismatch of image size 1600x900 mm vs display size 580x320 mm.
  Detailed Timing Descriptor #2: Mismatch of image size 1600x900 mm vs display size 580x320 mm.
Block 1, CTA-861 Extension Block:
  Detailed Timing Descriptor #3: Mismatch of image size 1600x900 mm vs display size 580x320 mm.
  Detailed Timing Descriptor #4: Mismatch of image size 1600x900 mm vs display size 580x320 mm.
  Detailed Timing Descriptor #5: Mismatch of image size 1600x900 mm vs display size 580x320 mm.
  Detailed Timing Descriptor #6: Mismatch of image size 1600x900 mm vs display size 580x320 mm.
  Missing VCDB, needed for Set Selectable RGB Quantization to avoid interop issues.
EDID:
  Extension Block 2 started with EDID header, ignoring Extension Blocks >= 2.
  Base EDID: The DTD max image size is 1600x900mm, which is larger than the display size 580.0x320.0mm.

EDID conformity: FAIL
