edid-decode (hex):

00 ff ff ff ff ff ff 00 0d af 14 12 00 00 00 00
00 00 01 05 80 1a 10 78 0a 80 a5 92 56 54 92 27
23 50 54 00 00 00 01 01 01 01 01 01 01 01 01 01
01 01 01 01 01 01 bc 1b 00 a0 50 20 17 30 30 20
36 00 05 a3 10 00 00 18 f3 16 00 a0 50 20 13 30
30 20 36 00 05 a3 10 00 00 00 00 00 00 fe 00 48
46 30 36 37 35 4e 31 32 31 49 33 0a 00 00 00 fe
00 29 3c 47 4d 70 8b a8 e1 01 01 0a 20 20 00 56

00 ff ff ff ff ff ff 00 0d af 14 12 00 00 00 00
00 00 01 05 80 1a 10 78 0a 80 a5 92 56 54 92 27
23 50 54 00 00 00 01 01 01 01 01 01 01 01 01 01
01 01 01 01 01 01 bc 1b 00 a0 50 20 17 30 30 20
36 00 05 a3 10 00 00 18 f3 16 00 a0 50 20 13 30
30 20 36 00 05 a3 10 00 00 00 00 00 00 fe 00 48
46 30 36 37 35 4e 31 32 31 49 33 0a 00 00 00 fe
00 29 3c 47 4d 70 8b a8 e1 01 01 0a 20 20 00 56

----------------

Block 0, Base EDID:
  EDID Structure Version & Revision: 1.5
  Vendor & Product Identification:
    Manufacturer: CMO
    Model: 4628
    Made in: 1990
  Basic Display Parameters & Features:
    Digital display
    Color depth is undefined
    Digital interface is not defined
    Maximum image size: 26 cm x 16 cm
    Gamma: 2.20
    Supported color formats: RGB 4:4:4, YCrCb 4:4:4
    First detailed timing includes the native pixel format and preferred refresh rate
  Color Characteristics:
    Red  : 0.5722, 0.3359
    Green: 0.3281, 0.5703
    Blue : 0.1542, 0.1386
    White: 0.3134, 0.3291
  Established Timings I & II: none
  Standard Timings: none
  Detailed Timing Descriptors:
    DTD 1:  1280x800    59.909545 Hz  16:10    49.306 kHz     71.000000 MHz (261 mm x 163 mm)
                 Hfront   48 Hsync  32 Hback   80 Hpol N
                 Vfront    3 Vsync   6 Vback   14 Vpol N
    DTD 2:  1280x800    49.815154 Hz  16:10    40.799 kHz     58.750000 MHz (261 mm x 163 mm)
                 Hfront   48 Hsync  32 Hback   80 Hpol N
                 Vfront    3 Vsync   6 Vback   10 Vpol N
    SPWG Module Revision: 0
    SPWG Descriptor #3:
      SPWG PC Maker P/N: 'HF067'
      SPWG LCD Supplier EEDID Revision: 53
      SPWG Manufacturer P/N: 'N121I3'
    SPWG Descriptor #4:
      SMBUS Values: 0x29 0x3c 0x47 0x4d 0x70 0x8b 0xa8 0xe1
      LVDS Channels: 1
      Panel Self Test Present
Checksum: 0x56

----------------

Warnings:

Block 0, Base EDID:
  EDID Structure Version & Revision: Unknown EDID minor version 5, assuming 1.4 conformance.
  Detailed Timing Descriptor #1: DTD is similar but not identical to DMT 0x1b.
  Missing Display Product Name.

Failures:

EDID:
  Extension Block 1 started with EDID header, ignoring Extension Blocks >= 1.

EDID conformity: FAIL
