edid-decode (hex):

00 ff ff ff ff ff ff 00 6a 92 01 00 00 00 00 00
04 1f 01 04 95 1a 0e 78 0a 7a 80 93 58 5d 92 26
1c 50 54 00 00 00 01 01 01 01 01 01 01 01 01 01
01 01 01 01 01 01 ce 1d 56 e2 50 00 1e 30 5a 0a
e6 00 00 90 10 00 00 18 00 00 00 fe 00 00 00 00
00 00 00 00 00 00 00 00 00 00 00 00 00 fe 00 5a
54 20 20 20 20 20 20 20 20 20 20 20 00 00 00 fe
00 5a 54 2d 41 30 20 20 20 20 20 20 20 0a 00 d7

----------------

Block 0, Base EDID:
  EDID Structure Version & Revision: 1.4
  Vendor & Product Identification:
    Manufacturer: ZTR
    Model: 1
    Made in: week 4 of 2021
  Basic Display Parameters & Features:
    Digital display
    Bits per primary color channel: 6
    DisplayPort interface
    Maximum image size: 26 cm x 14 cm
    Gamma: 2.20
    Supported color formats: RGB 4:4:4, YCrCb 4:4:4
    First detailed timing includes the native pixel format and preferred refresh rate
  Color Characteristics:
    Red  : 0.5751, 0.3466
    Green: 0.3652, 0.5722
    Blue : 0.1503, 0.1093
    White: 0.3125, 0.3281
  Established Timings I & II: none
  Standard Timings: none
  Detailed Timing Descriptors:
    DTD 1:  1366x768    60.059067 Hz 683:384   47.927 kHz     76.300000 MHz (256 mm x 144 mm)
                 Hfront   90 Hsync  10 Hback  126 Hpol N
                 Vfront   14 Vsync   6 Vback   10 Vpol N
    Alphanumeric Data String: ''
    Alphanumeric Data String: 'ZT           '
    Alphanumeric Data String: 'ZT-A0       '
Checksum: 0xd7

----------------

Warnings:

Block 0, Base EDID:
  Missing Display Product Name.

Failures:

Block 0, Base EDID:
  Alphanumeric Data String: NUL byte at position 0.
  Alphanumeric Data String: No newline, but one or more trailing spaces.
  Alphanumeric Data String: One or more trailing spaces before newline.

EDID conformity: FAIL
