edid-decode (hex):

00 ff ff ff ff ff ff 00 3b 07 8e 00 01 00 00 00
1a 0f 01 03 80 47 28 78 0a 33 30 a7 55 45 96 24
11 49 4b 20 00 00 01 01 01 01 01 01 01 01 01 01
01 01 01 01 01 01 01 1d 80 18 71 1c 16 20 58 2c
25 00 c4 8e 21 00 00 9e 8c 0a d0 8a 20 e0 2d 10
10 3e 96 00 c4 8e 21 00 00 18 f4 1a 50 80 51 00
19 30 38 88 35 00 c4 8e 21 00 00 18 1b 21 50 a0
51 00 1e 30 48 88 35 00 c4 8e 21 00 00 18 01 41

02 03 19 71 46 05 03 12 13 04 14 23 09 7f 07 83
01 00 00 65 03 0c 00 10 00 8c 0a d0 90 20 40 31
20 0c 40 55 00 c4 8e 21 00 00 18 01 1d 00 bc 52
d0 1e 20 b8 28 55 40 c4 8e 21 00 00 1e 01 1d 00
72 51 d0 1e 20 6e 28 55 00 c4 8e 21 00 00 1e 01
1d 80 d0 72 1c 16 20 10 2c 25 80 c4 8e 21 00 00
9e 00 00 00 fc 00 4d 52 49 44 54 4c 36 33 32 56
32 30 30 00 00 00 00 00 00 00 00 00 00 00 00 3f

00 ff ff ff ff ff ff 00 3b 07 8e 00 01 00 00 00
1a 0f 01 03 80 47 28 78 0a 33 30 a7 55 45 96 24
11 49 4b 20 00 00 01 01 01 01 01 01 01 01 01 01
01 01 01 01 01 01 01 1d 80 18 71 1c 16 20 58 2c
25 00 c4 8e 21 00 00 9e 8c 0a d0 8a 20 e0 2d 10
10 3e 96 00 c4 8e 21 00 00 18 f4 1a 50 80 51 00
19 30 38 88 35 00 c4 8e 21 00 00 18 1b 21 50 a0
51 00 1e 30 48 88 35 00 c4 8e 21 00 00 18 01 41

02 03 19 71 46 05 03 12 13 04 14 23 09 7f 07 83
01 00 00 65 03 0c 00 10 00 8c 0a d0 90 20 40 31
20 0c 40 55 00 c4 8e 21 00 00 18 01 1d 00 bc 52
d0 1e 20 b8 28 55 40 c4 8e 21 00 00 1e 01 1d 00
72 51 d0 1e 20 6e 28 55 00 c4 8e 21 00 00 1e 01
1d 80 d0 72 1c 16 20 10 2c 25 80 c4 8e 21 00 00
9e 00 00 00 fc 00 4d 52 49 44 54 4c 36 33 32 56
32 30 30 00 00 00 00 00 00 00 00 00 00 00 00 3f

----------------

Block 0, Base EDID:
  EDID Structure Version & Revision: 1.3
  Vendor & Product Identification:
    Manufacturer: NXG
    Model: 142
    Serial Number: ...
    Made in: week 26 of 2005
  Basic Display Parameters & Features:
    Digital display
    Maximum image size: 71 cm x 40 cm
    Gamma: 2.20
    RGB color display
    First detailed timing is the preferred timing
  Color Characteristics:
    Red  : 0.6523, 0.3349
    Green: 0.2695, 0.5888
    Blue : 0.1406, 0.0693
    White: 0.2851, 0.2929
  Established Timings I & II:
    DMT 0x04:   640x480    59.940476 Hz   4:3     31.469 kHz     25.175000 MHz
  Standard Timings: none
  Detailed Timing Descriptors:
    DTD 1:  1920x1080i  60.000000 Hz  16:9     33.750 kHz     74.250000 MHz (708 mm x 398 mm)
                 Hfront   88 Hsync  44 Hback  148 Hpol P
                 Vfront    2 Vsync   5 Vback   15 Vpol P Vfront +0.5 Odd Field
                 Vfront    2 Vsync   5 Vback   15 Vpol P Vback  +0.5 Even Field
    DTD 2:   720x480    59.940060 Hz   3:2     31.469 kHz     27.000000 MHz (708 mm x 398 mm)
                 Hfront   16 Hsync  62 Hback   60 Hpol N
                 Vfront    9 Vsync   6 Vback   30 Vpol N
    DTD 3:  1360x768    49.891829 Hz  85:48    39.564 kHz     69.000000 MHz (708 mm x 398 mm)
                 Hfront   56 Hsync 136 Hback  192 Hpol N
                 Vfront    3 Vsync   5 Vback   17 Vpol N
    DTD 4:  1360x768    59.798991 Hz  85:48    47.720 kHz     84.750000 MHz (708 mm x 398 mm)
                 Hfront   72 Hsync 136 Hback  208 Hpol N
                 Vfront    3 Vsync   5 Vback   22 Vpol N
  Extension blocks: 1
Checksum: 0x41

----------------

Block 1, CTA-861 Extension Block:
  Revision: 3
  Basic audio support
  Supports YCbCr 4:4:4
  Supports YCbCr 4:2:2
  Native DTDs: 1
  Video Data Block:
    VIC   5:  1920x1080i  60.000000 Hz  16:9     33.750 kHz     74.250000 MHz
    VIC   3:   720x480    59.940060 Hz  16:9     31.469 kHz     27.000000 MHz
    VIC  18:   720x576    50.000000 Hz  16:9     31.250 kHz     27.000000 MHz
    VIC  19:  1280x720    50.000000 Hz  16:9     37.500 kHz     74.250000 MHz
    VIC   4:  1280x720    60.000000 Hz  16:9     45.000 kHz     74.250000 MHz
    VIC  20:  1920x1080i  50.000000 Hz  16:9     28.125 kHz     74.250000 MHz
  Audio Data Block:
    Linear PCM:
      Max channels: 2
      Supported sample rates (kHz): 192 176.4 96 88.2 48 44.1 32
      Supported sample sizes (bits): 24 20 16
  Speaker Allocation Data Block:
    FL/FR - Front Left/Right
  Vendor-Specific Data Block (HDMI), OUI 00-0C-03:
    Source physical address: 1.0.0.0
  Detailed Timing Descriptors:
    DTD 5:   720x576    50.000000 Hz   5:4     31.250 kHz     27.000000 MHz (708 mm x 398 mm)
                 Hfront   12 Hsync  64 Hback   68 Hpol N
                 Vfront    5 Vsync   5 Vback   39 Vpol N
    DTD 6:  1280x720    50.000000 Hz  16:9     37.500 kHz     74.250000 MHz (708 mm x 398 mm)
                 Hfront  440 Hsync  40 Hback  220 Hpol P
                 Vfront    5 Vsync   5 Vback   20 Vpol P
    DTD 7:  1280x720    60.000000 Hz  16:9     45.000 kHz     74.250000 MHz (708 mm x 398 mm)
                 Hfront  110 Hsync  40 Hback  220 Hpol P
                 Vfront    5 Vsync   5 Vback   20 Vpol P
    DTD 8:  1920x1080i  50.000000 Hz  16:9     28.125 kHz     74.250000 MHz (708 mm x 398 mm)
                 Hfront  528 Hsync  44 Hback  148 Hpol P
                 Vfront    2 Vsync   5 Vback   15 Vpol P Vfront +0.5 Odd Field
                 Vfront    2 Vsync   5 Vback   15 Vpol P Vback  +0.5 Even Field
    Display Product Name: 'MRIDTL632V200'
Checksum: 0x3f  Unused space in Extension Block: 12 bytes

----------------

Warnings:

Block 0, Base EDID:
  Vendor & Product Identification: The serial number is one of the known dummy values, it should probably be set to 0.
  Detailed Timing Descriptor #2: Image size is 708x398 mm, but based on the picture AR it should be 597x398 mm.
Block 1, CTA-861 Extension Block:
  IT Video Formats are overscanned by default, but normally this should be underscanned.
  Detailed Timing Descriptor #5: Image size is 708x398 mm, but based on the picture AR it should be 497x398 mm.
  Add a Colorimetry Data Block with the sRGB colorimetry bit set to avoid interop issues.

Failures:

Block 0, Base EDID:
  Missing Display Product Name.
  Missing Display Range Limits Descriptor.
Block 1, CTA-861 Extension Block:
  Missing VCDB, needed for Set Selectable RGB Quantization to avoid interop issues.
EDID:
  Extension Block 2 started with EDID header, ignoring Extension Blocks >= 2.
  CTA-861: A native interlaced timing is present, but not a native progressive timing.

EDID conformity: FAIL
