edid-decode (hex):

00 ff ff ff ff ff ff 00 09 e5 67 0b 00 00 00 00
18 20 01 04 a5 26 15 78 03 c8 f5 a5 54 4b 9a 24
10 50 54 00 00 00 01 01 01 01 01 01 01 01 01 01
01 01 01 01 01 01 09 68 00 b4 a0 a0 b4 50 30 20
36 00 7e d7 10 00 00 1a 00 00 00 fd 0c 3c f0 86
86 6b 01 0a 20 20 20 20 20 20 00 00 00 00 00 00
00 00 00 00 00 00 00 00 00 00 00 00 00 00 00 02
00 0d 36 ff 0a 3c 96 37 1a 3d 96 00 00 00 01 61

70 20 79 02 00 22 00 14 5f 41 10 84 ff 09 b3 00
2f 00 1f 00 9f 05 b3 00 02 00 05 00 25 01 09 5f
41 10 5f 41 10 3c f0 80 81 00 13 72 1a 00 00 03
01 3c f0 00 00 53 51 53 51 f0 00 00 00 00 00 00
00 00 00 00 00 00 00 00 00 00 00 00 00 00 00 00
00 00 00 00 00 00 00 00 00 00 00 00 00 00 00 00
00 00 00 00 00 00 00 00 00 00 00 00 00 00 00 00
00 00 00 00 00 00 00 00 00 00 00 00 00 00 d1 90

00 ff ff ff ff ff ff 00 09 e5 67 0b 00 00 00 00
18 20 01 04 a5 26 15 78 03 c8 f5 a5 54 4b 9a 24
10 50 54 00 00 00 01 01 01 01 01 01 01 01 01 01
01 01 01 01 01 01 09 68 00 b4 a0 a0 b4 50 30 20
36 00 7e d7 10 00 00 1a 00 00 00 fd 0c 3c f0 86
86 6b 01 0a 20 20 20 20 20 20 00 00 00 00 00 00
00 00 00 00 00 00 00 00 00 00 00 00 00 00 00 02
00 0d 36 ff 0a 3c 96 37 1a 3d 96 00 00 00 01 61

70 20 79 02 00 22 00 14 5f 41 10 84 ff 09 b3 00
2f 00 1f 00 9f 05 b3 00 02 00 05 00 25 01 09 5f
41 10 5f 41 10 3c f0 80 81 00 13 72 1a 00 00 03
01 3c f0 00 00 53 51 53 51 f0 00 00 00 00 00 00
00 00 00 00 00 00 00 00 00 00 00 00 00 00 00 00
00 00 00 00 00 00 00 00 00 00 00 00 00 00 00 00
00 00 00 00 00 00 00 00 00 00 00 00 00 00 00 00
00 00 00 00 00 00 00 00 00 00 00 00 00 00 d1 90

----------------

Block 0, Base EDID:
  EDID Structure Version & Revision: 1.4
  Vendor & Product Identification:
    Manufacturer: BOE
    Model: 2919
    Made in: week 24 of 2022
  Basic Display Parameters & Features:
    Digital display
    Bits per primary color channel: 8
    DisplayPort interface
    Maximum image size: 38 cm x 21 cm
    Gamma: 2.20
    Supported color formats: RGB 4:4:4
    First detailed timing includes the native pixel format and preferred refresh rate
    Display supports continuous frequencies
  Color Characteristics:
    Red  : 0.6474, 0.3281
    Green: 0.2949, 0.6015
    Blue : 0.1435, 0.0654
    White: 0.3134, 0.3291
  Established Timings I & II: none
  Standard Timings: none
  Detailed Timing Descriptors:
    DTD 1:  2560x1440   60.000451 Hz  16:9     97.201 kHz    266.330000 MHz (382 mm x 215 mm)
                 Hfront   48 Hsync  32 Hback  100 Hpol P
                 Vfront    3 Vsync   6 Vback  171 Vpol N
    Display Range Limits:
      Monitor ranges (Range Limits Only): 60-240 Hz V, 389-389 kHz H, max dotclock 1070 MHz
    Empty Descriptor
    Manufacturer-Specified Display Descriptor (0x02): 00 02 00 0d 36 ff 0a 3c 96 37 1a 3d 96 00 00 00 '....6..<.7.=....'
  Extension blocks: 1
Checksum: 0x61

----------------

Block 1, DisplayID Extension Block:
  Version: 2.0
  Extension Count: 0
  Display Product Primary Use Case: None of the listed primary use cases; generic display
  Video Timing Modes Type 7 - Detailed Timings Data Block:
    DTD:  2560x1440  240.000000 Hz  16:9    388.800 kHz   1065.312000 MHz (aspect 16:9, no 3D stereo, preferred)
               Hfront   48 Hsync  32 Hback  100 Hpol N
               Vfront    3 Vsync   6 Vback  171 Vpol N
  Dynamic Video Timing Range Limits Data Block:
    Minimum Pixel Clock: 1065312 kHz
    Maximum Pixel Clock: 1065312 kHz
    Minimum Vertical Refresh Rate: 60 Hz
    Maximum Vertical Refresh Rate: 240 Hz
    Seamless Dynamic Video Timing Support: Yes
  CTA-861 DisplayID Data Block:
  Vendor-Specific Data Block (AMD), OUI 00-00-1A:
    Version: 3
    Feature Caps: 0x01
    Minimum Refresh Rate: 60 Hz
    Maximum Refresh Rate: 240 Hz
    Flags 1.x: 0x00
    Flags 2.x: 0x00
  Checksum: 0xd1
Checksum: 0x90

----------------

Warnings:

Block 0, Base EDID:
  Missing Display Product Name.
EDID:
  Base EDID: Some timings are out of range of the Monitor Ranges:
    Horizontal Freq: 97.200 - 388.800 kHz (Monitor: 389.000 - 389.000 kHz)

Failures:

Block 0, Base EDID:
  Empty Descriptor: Use Dummy Descriptor instead of all zeroes.
EDID:
  Extension Block 2 started with EDID header, ignoring Extension Blocks >= 2.
  DisplayID: Missing DisplayID Display Parameters Data Block.

EDID conformity: FAIL
