edid-decode (hex):

00 ff ff ff ff ff ff 00 06 b3 6c 32 72 d5 00 00
01 20 01 03 80 47 28 78 2a 10 f5 ac 50 46 ac 26
0b 50 54 bf cf 00 d1 c0 71 4f 81 c0 81 40 81 80
95 00 b3 00 01 01 40 e7 00 6a a0 a0 67 50 08 20
98 04 c4 8f 21 00 00 1a 56 5e 00 a0 a0 a0 29 50
30 20 35 00 c4 8f 21 00 00 1e 00 00 00 fd 00 30
90 1e de 3c 00 0a 20 20 20 20 20 20 00 00 00 fc
00 41 53 55 53 20 50 41 33 32 38 43 47 56 01 9a

02 03 57 71 53 01 02 03 11 12 13 0f 1d 1e 0e 90
1f 04 60 61 2f 3f 20 21 23 09 17 07 83 01 00 00
e2 00 d5 67 03 0c 00 10 00 38 3c 6d d8 5d c4 01
78 88 03 02 00 00 00 00 00 6d 1a 00 00 02 0b 30
90 e6 04 80 10 80 2f e3 05 c3 01 e4 0f 00 60 00
e6 06 05 01 80 67 27 f0 3c 00 d0 51 a0 35 50 60
88 3a 00 c4 8f 21 00 00 1c 6f c2 00 a0 a0 a0 55
50 30 20 35 00 c4 8f 21 00 00 1a 00 00 00 00 d5

00 ff ff ff ff ff ff 00 06 b3 6c 32 72 d5 00 00
01 20 01 03 80 47 28 78 2a 10 f5 ac 50 46 ac 26
0b 50 54 bf cf 00 d1 c0 71 4f 81 c0 81 40 81 80
95 00 b3 00 01 01 40 e7 00 6a a0 a0 67 50 08 20
98 04 c4 8f 21 00 00 1a 56 5e 00 a0 a0 a0 29 50
30 20 35 00 c4 8f 21 00 00 1e 00 00 00 fd 00 30
90 1e de 3c 00 0a 20 20 20 20 20 20 00 00 00 fc
00 41 53 55 53 20 50 41 33 32 38 43 47 56 01 9a

02 03 57 71 53 01 02 03 11 12 13 0f 1d 1e 0e 90
1f 04 60 61 2f 3f 20 21 23 09 17 07 83 01 00 00
e2 00 d5 67 03 0c 00 10 00 38 3c 6d d8 5d c4 01
78 88 03 02 00 00 00 00 00 6d 1a 00 00 02 0b 30
90 e6 04 80 10 80 2f e3 05 c3 01 e4 0f 00 60 00
e6 06 05 01 80 67 27 f0 3c 00 d0 51 a0 35 50 60
88 3a 00 c4 8f 21 00 00 1c 6f c2 00 a0 a0 a0 55
50 30 20 35 00 c4 8f 21 00 00 1a 00 00 00 00 d5

----------------

Block 0, Base EDID:
  EDID Structure Version & Revision: 1.3
  Vendor & Product Identification:
    Manufacturer: AUS
    Model: 12908
    Serial Number: ...
    Made in: week 1 of 2022
  Basic Display Parameters & Features:
    Digital display
    Maximum image size: 71 cm x 40 cm
    Gamma: 2.20
    DPMS levels: Off
    RGB color display
    First detailed timing is the preferred timing
  Color Characteristics:
    Red  : 0.6718, 0.3134
    Green: 0.2734, 0.6718
    Blue : 0.1513, 0.0458
    White: 0.3134, 0.3291
  Established Timings I & II:
    IBM     :   720x400    70.081663 Hz   9:5     31.467 kHz     28.320000 MHz
    DMT 0x04:   640x480    59.940476 Hz   4:3     31.469 kHz     25.175000 MHz
    Apple   :   640x480    66.666667 Hz   4:3     35.000 kHz     30.240000 MHz
    DMT 0x05:   640x480    72.808802 Hz   4:3     37.861 kHz     31.500000 MHz
    DMT 0x06:   640x480    75.000000 Hz   4:3     37.500 kHz     31.500000 MHz
    DMT 0x08:   800x600    56.250000 Hz   4:3     35.156 kHz     36.000000 MHz
    DMT 0x09:   800x600    60.316541 Hz   4:3     37.879 kHz     40.000000 MHz
    DMT 0x0a:   800x600    72.187572 Hz   4:3     48.077 kHz     50.000000 MHz
    DMT 0x0b:   800x600    75.000000 Hz   4:3     46.875 kHz     49.500000 MHz
    DMT 0x10:  1024x768    60.003840 Hz   4:3     48.363 kHz     65.000000 MHz
    DMT 0x11:  1024x768    70.069359 Hz   4:3     56.476 kHz     75.000000 MHz
    DMT 0x12:  1024x768    75.028582 Hz   4:3     60.023 kHz     78.750000 MHz
    DMT 0x24:  1280x1024   75.024675 Hz   5:4     79.976 kHz    135.000000 MHz
  Standard Timings:
    DMT 0x52:  1920x1080   60.000000 Hz  16:9     67.500 kHz    148.500000 MHz
    DMT 0x15:  1152x864    75.000000 Hz   4:3     67.500 kHz    108.000000 MHz
    DMT 0x55:  1280x720    60.000000 Hz  16:9     45.000 kHz     74.250000 MHz
    DMT 0x20:  1280x960    60.000000 Hz   4:3     60.000 kHz    108.000000 MHz
    DMT 0x23:  1280x1024   60.019740 Hz   5:4     63.981 kHz    108.000000 MHz
    DMT 0x2f:  1440x900    59.887445 Hz  16:10    55.935 kHz    106.500000 MHz
    DMT 0x3a:  1680x1050   59.954250 Hz  16:10    65.290 kHz    146.250000 MHz
  Detailed Timing Descriptors:
    DTD 1:  2560x1440  143.911545 Hz  16:9    222.056 kHz    592.000000 MHz (708 mm x 399 mm)
                 Hfront    8 Hsync  32 Hback   66 Hpol P
                 Vfront   25 Vsync   8 Vback   70 Vpol N
    DTD 2:  2560x1440   59.950550 Hz  16:9     88.787 kHz    241.500000 MHz (708 mm x 399 mm)
                 Hfront   48 Hsync  32 Hback   80 Hpol P
                 Vfront    3 Vsync   5 Vback   33 Vpol P
    Display Range Limits:
      Monitor ranges (GTF): 48-144 Hz V, 30-222 kHz H, max dotclock 600 MHz
    Display Product Name: 'ASUS PA328CGV'
  Extension blocks: 1
Checksum: 0x9a

----------------

Block 1, CTA-861 Extension Block:
  Revision: 3
  Basic audio support
  Supports YCbCr 4:4:4
  Supports YCbCr 4:2:2
  Native DTDs: 1
  Video Data Block:
    VIC   1:   640x480    59.940476 Hz   4:3     31.469 kHz     25.175000 MHz
    VIC   2:   720x480    59.940060 Hz   4:3     31.469 kHz     27.000000 MHz
    VIC   3:   720x480    59.940060 Hz  16:9     31.469 kHz     27.000000 MHz
    VIC  17:   720x576    50.000000 Hz   4:3     31.250 kHz     27.000000 MHz
    VIC  18:   720x576    50.000000 Hz  16:9     31.250 kHz     27.000000 MHz
    VIC  19:  1280x720    50.000000 Hz  16:9     37.500 kHz     74.250000 MHz
    VIC  15:  1440x480    59.940060 Hz  16:9     31.469 kHz     54.000000 MHz
    VIC  29:  1440x576    50.000000 Hz   4:3     31.250 kHz     54.000000 MHz
    VIC  30:  1440x576    50.000000 Hz  16:9     31.250 kHz     54.000000 MHz
    VIC  14:  1440x480    59.940060 Hz   4:3     31.469 kHz     54.000000 MHz
    VIC  16:  1920x1080   60.000000 Hz  16:9     67.500 kHz    148.500000 MHz (native)
    VIC  31:  1920x1080   50.000000 Hz  16:9     56.250 kHz    148.500000 MHz
    VIC   4:  1280x720    60.000000 Hz  16:9     45.000 kHz     74.250000 MHz
    VIC  96:  3840x2160   50.000000 Hz  16:9    112.500 kHz    594.000000 MHz
    VIC  97:  3840x2160   60.000000 Hz  16:9    135.000 kHz    594.000000 MHz
    VIC  47:  1280x720   120.000000 Hz  16:9     90.000 kHz    148.500000 MHz
    VIC  63:  1920x1080  120.000000 Hz  16:9    135.000 kHz    297.000000 MHz
    VIC  32:  1920x1080   24.000000 Hz  16:9     27.000 kHz     74.250000 MHz
    VIC  33:  1920x1080   25.000000 Hz  16:9     28.125 kHz     74.250000 MHz
  Audio Data Block:
    Linear PCM:
      Max channels: 2
      Supported sample rates (kHz): 96 48 44.1 32
      Supported sample sizes (bits): 24 20 16
  Speaker Allocation Data Block:
    FL/FR - Front Left/Right
  Video Capability Data Block:
    YCbCr quantization: Selectable (via AVI YQ)
    RGB quantization: Selectable (via AVI Q)
    PT scan behavior: Always Overscanned
    IT scan behavior: Always Overscanned
    CE scan behavior: Always Overscanned
  Vendor-Specific Data Block (HDMI), OUI 00-0C-03:
    Source physical address: 1.0.0.0
    DC_36bit
    DC_30bit
    DC_Y444
    Maximum TMDS clock: 300 MHz
  Vendor-Specific Data Block (HDMI Forum), OUI C4-5D-D8:
    Version: 1
    Maximum TMDS Character Rate: 600 MHz
    SCDC Present
    Supports scrambling for <= 340 Mcsc
    Supports 12-bits/component Deep Color 4:2:0 Pixel Encoding
    Supports 10-bits/component Deep Color 4:2:0 Pixel Encoding
    Supports Auto Low-Latency Mode
    VRRmin: 0 Hz
    VRRmax: 0 Hz
  Vendor-Specific Data Block (AMD), OUI 00-00-1A:
    Version: 2
    Feature Caps: 0x0b
      Local Dimming Supported
    Minimum Refresh Rate: 48 Hz
    Maximum Refresh Rate: 144 Hz
    Flags 1.x: 0xe6 (MCCS)
    Flags 2.x: 0x04
      ST 2084 (PQ) EOTF Supported
      Linear EOTF (Windows scRGB, 0.0 - 125.0) Supported
      Gamma 2.2 EOTF Supported
      BT.2020 Gamut Supported
    Maximum luminance: 128 (800.000 cd/m^2)
    Minimum luminance: 16 (0.031 cd/m^2)
    Maximum luminance (without local dimming): 128 (800.000 cd/m^2)
    Minimum luminance (without local dimming): 47 (0.272 cd/m^2)
  Colorimetry Data Block:
    xvYCC601
    xvYCC709
    BT2020YCC
    BT2020RGB
    Gamut Boundary Description Metadata Profile P0
  YCbCr 4:2:0 Capability Map Data Block:
    VIC  96:  3840x2160   50.000000 Hz  16:9    112.500 kHz    594.000000 MHz
    VIC  97:  3840x2160   60.000000 Hz  16:9    135.000 kHz    594.000000 MHz
  HDR Static Metadata Data Block:
    Electro optical transfer functions:
      Traditional gamma - SDR luminance range
      SMPTE ST2084
    Supported static metadata descriptors:
      Static metadata type 1
    Desired content max luminance: 128 (800.000 cd/m^2)
    Desired content max frame-average luminance: 103 (465.490 cd/m^2)
    Desired content min luminance: 39 (0.187 cd/m^2)
  Detailed Timing Descriptors:
    DTD 3:  1280x1440   59.912620 Hz   8:9     89.450 kHz    156.000000 MHz (708 mm x 399 mm)
                 Hfront   96 Hsync 136 Hback  232 Hpol N
                 Vfront    3 Vsync  10 Vback   40 Vpol P
    DTD 4:  2560x1440  119.997589 Hz  16:9    182.996 kHz    497.750000 MHz (708 mm x 399 mm)
                 Hfront   48 Hsync  32 Hback   80 Hpol P
                 Vfront    3 Vsync   5 Vback   77 Vpol N
Checksum: 0xd5  Unused space in Extension Block: 4 bytes

----------------

Warnings:

Block 1, CTA-861 Extension Block:
  IT Video Formats are overscanned by default, but normally this should be underscanned.
  Video Data Block: VIC 1 and the first DTD are not identical. Is this intended?
  Video Capability Data Block: IT scan behavior is expected to support underscanned.
  Video Capability Data Block: S_PT is equal to S_IT and S_CE, so should be set to 0 instead.
  Colorimetry Data Block: Set the sRGB colorimetry bit to avoid interop issues.
  Detailed Timing Descriptor #3: Image size is 708x399 mm, but based on the picture AR it should be 354x399 mm.
EDID:
  Base EDID: Some timings are out of range of the Monitor Ranges:
    Vertical Freq: 24.000 - 143.912 Hz (Monitor: 48.000 - 144.000 Hz)
    Horizontal Freq: 27.000 - 222.055 kHz (Monitor: 30.000 - 222.000 kHz)

Failures:

EDID:
  Extension Block 2 started with EDID header, ignoring Extension Blocks >= 2.
  CTA-861: Native progressive timings are a mix of several resolutions.

EDID conformity: FAIL
