edid-decode (hex):

00 ff ff ff ff ff ff 00 04 21 00 00 00 00 00 00
01 00 01 03 80 00 00 00 08 00 00 00 00 00 00 00
00 00 00 2c 00 00 1d 40 01 01 01 01 01 01 01 01
01 01 01 01 01 01 c4 09 80 a0 20 e0 2d 10 28 80
14 00 00 00 00 00 00 00 00 00 00 10 00 00 00 00
00 00 00 00 00 00 00 00 00 00 00 00 00 10 00 00
00 00 00 00 00 00 00 00 00 00 00 00 00 00 00 10
00 00 00 00 00 00 00 00 00 00 00 00 00 00 00 a7

----------------

Block 0, Base EDID:
  EDID Structure Version & Revision: 1.3
  Vendor & Product Identification:
    Manufacturer: AAA
    Model: 0
    Made in: week 1 of 1990
  Basic Display Parameters & Features:
    Digital display
    Image size is variable
    Gamma: 1.00
    RGB color display
  Color Characteristics:
    Red  : 0.0000, 0.0000
    Green: 0.0000, 0.0000
    Blue : 0.0000, 0.0000
    White: 0.0000, 0.0000
  Established Timings I & II:
    DMT 0x04:   640x480    59.940476 Hz   4:3     31.469 kHz     25.175000 MHz
    DMT 0x05:   640x480    72.808802 Hz   4:3     37.861 kHz     31.500000 MHz
    DMT 0x06:   640x480    75.000000 Hz   4:3     37.500 kHz     31.500000 MHz
  Standard Timings:
    GTF     :   480x360    60.000559 Hz   4:3     22.380 kHz     12.891000 MHz
  Detailed Timing Descriptors:
    DTD 1:   640x480    59.523810 Hz   4:3     31.250 kHz     25.000000 MHz (analog composite, sync-on-green)
                 Hfront   40 Hsync 128 Hback   -8 Hpol N
                 Vfront    1 Vsync   4 Vback   40 Vpol N
    Dummy Descriptor:
    Dummy Descriptor:
    Dummy Descriptor:
Checksum: 0xa7

----------------

Warnings:

EDID:
  No Native Video Resolution was defined.

Failures:

Block 0, Base EDID:
  Basic Display Parameters & Features: EDID 1.3 requires that the first detailed timing is the preferred timing.
  Standard Timings: 0 values in the video timing:
    Horizontal Active/Blanking 480/96
    Horizontal Frontporch/Sync Width 0/48
    Vertical Active/Blanking 360/13
    Vertical Frontporch/Sync Width 1/3
  Standard Timings: 0 or negative horizontal front porch.
  Detailed Timing Descriptor #1: 0 or negative horizontal back porch.
  Missing Display Product Name.
  Missing Display Range Limits Descriptor.

EDID conformity: FAIL
