edid-decode (hex):

00 ff ff ff ff ff ff 00 30 e4 e3 06 00 00 00 00
00 1f 01 04 a5 26 15 78 07 e5 35 a7 54 4a 9b 26
0e 50 54 00 00 00 01 01 01 01 01 01 01 01 01 01
01 01 01 01 01 01 b9 9c 80 a0 70 38 56 48 30 20
35 00 7e d7 10 00 00 1a 00 00 00 fd 00 3c a5 c1
c1 29 01 0a 20 20 20 20 20 20 00 00 00 fe 00 44
59 33 54 36 80 31 37 33 57 46 47 0a 00 00 00 00
00 02 41 1f 9e 00 11 00 00 0f 01 0a 20 20 01 c4

70 13 79 00 00 03 01 14 b8 9c 00 84 7f 07 9f 00
2f 80 1f 00 37 04 58 00 02 00 04 00 00 00 00 00
00 00 00 00 00 00 00 00 00 00 00 00 00 00 00 00
00 00 00 00 00 00 00 00 00 00 00 00 00 00 00 00
00 00 00 00 00 00 00 00 00 00 00 00 00 00 00 00
00 00 00 00 00 00 00 00 00 00 00 00 00 00 00 00
00 00 00 00 00 00 00 00 00 00 00 00 00 00 00 00
00 00 00 00 00 00 00 00 00 00 00 00 00 00 f8 90

00 ff ff ff ff ff ff 00 30 e4 e3 06 00 00 00 00
00 1f 01 04 a5 26 15 78 07 e5 35 a7 54 4a 9b 26
0e 50 54 00 00 00 01 01 01 01 01 01 01 01 01 01
01 01 01 01 01 01 b9 9c 80 a0 70 38 56 48 30 20
35 00 7e d7 10 00 00 1a 00 00 00 fd 00 3c a5 c1
c1 29 01 0a 20 20 20 20 20 20 00 00 00 fe 00 44
59 33 54 36 80 31 37 33 57 46 47 0a 00 00 00 00
00 02 41 1f 9e 00 11 00 00 0f 01 0a 20 20 01 c4

70 13 79 00 00 03 01 14 b8 9c 00 84 7f 07 9f 00
2f 80 1f 00 37 04 58 00 02 00 04 00 00 00 00 00
00 00 00 00 00 00 00 00 00 00 00 00 00 00 00 00
00 00 00 00 00 00 00 00 00 00 00 00 00 00 00 00
00 00 00 00 00 00 00 00 00 00 00 00 00 00 00 00
00 00 00 00 00 00 00 00 00 00 00 00 00 00 00 00
00 00 00 00 00 00 00 00 00 00 00 00 00 00 00 00
00 00 00 00 00 00 00 00 00 00 00 00 00 00 f8 90

----------------

Block 0, Base EDID:
  EDID Structure Version & Revision: 1.4
  Vendor & Product Identification:
    Manufacturer: LGD
    Model: 1763
    Made in: 2021
  Basic Display Parameters & Features:
    Digital display
    Bits per primary color channel: 8
    DisplayPort interface
    Maximum image size: 38 cm x 21 cm
    Gamma: 2.20
    Supported color formats: RGB 4:4:4
    Default (sRGB) color space is primary color space
    First detailed timing includes the native pixel format and preferred refresh rate
    Display supports continuous frequencies
  Color Characteristics:
    Red  : 0.6552, 0.3300
    Green: 0.2900, 0.6064
    Blue : 0.1484, 0.0576
    White: 0.3134, 0.3291
  Established Timings I & II: none
  Standard Timings: none
  Detailed Timing Descriptors:
    DTD 1:  1920x1080   60.015377 Hz  16:9    192.889 kHz    401.210000 MHz (382 mm x 215 mm)
                 Hfront   48 Hsync  32 Hback   80 Hpol P
                 Vfront    3 Vsync   5 Vback 2126 Vpol N
    Display Range Limits:
      Monitor ranges (Range Limits Only): 60-165 Hz V, 193-193 kHz H, max dotclock 410 MHz
    Alphanumeric Data String: 'DY3T6.173WFG'
    Manufacturer-Specified Display Descriptor (0x00): 00 00 00 02 41 1f 9e 00 11 00 00 0f 01 0a 20 20 '....A.........  '
  Extension blocks: 1
Checksum: 0xc4

----------------

Block 1, DisplayID Extension Block:
  Version: 1.3
  Extension Count: 0
  Display Product Type: Extension Section
  Video Timing Modes Type 1 - Detailed Timings Data Block:
    DTD:  1920x1080  165.003784 Hz  16:9    192.889 kHz    401.210000 MHz (aspect 16:9, no 3D stereo, preferred)
               Hfront   48 Hsync  32 Hback   80 Hpol P
               Vfront    3 Vsync   5 Vback   81 Vpol N
  Checksum: 0xf8
Checksum: 0x90

----------------

Warnings:

Block 0, Base EDID:
  Alphanumeric Data String: Non-ASCII character 0x80 at position 5, can cause problems.
  Missing Display Product Name.

Failures:

Block 0, Base EDID:
  Basic Display Parameters & Features: sRGB is signaled, but the chromaticities do not match.
Block 1, DisplayID Extension Block:
  DisplayID Base Block has no product type.
EDID:
  Extension Block 2 started with EDID header, ignoring Extension Blocks >= 2.

EDID conformity: FAIL
