edid-decode (hex):

00 ff ff ff ff ff ff 00 26 13 00 27 53 51 30 30
03 22 01 04 b5 3c 21 78 3b 1e c5 ae 4f 34 b1 26
0e 50 54 af cf 00 71 4f 81 80 a9 40 d1 c0 95 00
a9 c0 b3 00 31 4c 02 3a 80 18 71 38 2d 40 58 2c
45 00 55 50 21 00 00 1a 83 48 80 18 71 38 2d 40
58 2c 45 00 55 50 21 00 00 1a 00 00 00 fc 00 4d
53 32 37 48 51 2d 69 31 0a 20 20 20 00 00 00 fd
00 30 64 78 78 20 01 0a 20 20 20 20 20 20 01 3e

02 03 26 f1 48 10 1f 04 13 12 11 03 02 23 09 7f
07 83 01 00 00 e2 00 c0 e3 05 c0 00 e6 06 05 01
62 62 00 e2 00 c0 f4 22 a0 a0 50 84 20 30 58 2c
45 00 55 50 21 00 00 1e 01 1d 00 72 51 d0 1e 20
6e 28 55 00 55 50 21 00 00 1e 25 1c 50 a0 50 00
16 30 30 20 3a 00 55 50 21 00 00 1a 68 5b 80 a0
70 38 2d 40 58 2c 45 00 55 50 21 00 00 1e 00 00
00 00 00 00 00 00 00 00 00 00 00 00 00 00 00 9b

00 ff ff ff ff ff ff 00 26 13 00 27 53 51 30 30
03 22 01 04 b5 3c 21 78 3b 1e c5 ae 4f 34 b1 26
0e 50 54 af cf 00 71 4f 81 80 a9 40 d1 c0 95 00
a9 c0 b3 00 31 4c 02 3a 80 18 71 38 2d 40 58 2c
45 00 55 50 21 00 00 1a 83 48 80 18 71 38 2d 40
58 2c 45 00 55 50 21 00 00 1a 00 00 00 fc 00 4d
53 32 37 48 51 2d 69 31 0a 20 20 20 00 00 00 fd
00 30 64 78 78 20 01 0a 20 20 20 20 20 20 01 3e

02 03 26 f1 48 10 1f 04 13 12 11 03 02 23 09 7f
07 83 01 00 00 e2 00 c0 e3 05 c0 00 e6 06 05 01
62 62 00 e2 00 c0 f4 22 a0 a0 50 84 20 30 58 2c
45 00 55 50 21 00 00 1e 01 1d 00 72 51 d0 1e 20
6e 28 55 00 55 50 21 00 00 1e 25 1c 50 a0 50 00
16 30 30 20 3a 00 55 50 21 00 00 1a 68 5b 80 a0
70 38 2d 40 58 2c 45 00 55 50 21 00 00 1e 00 00
00 00 00 00 00 00 00 00 00 00 00 00 00 00 00 9b

----------------

Block 0, Base EDID:
  EDID Structure Version & Revision: 1.4
  Vendor & Product Identification:
    Manufacturer: IPS
    Model: 9984
    Serial Number: ...
    Made in: week 3 of 2024
  Basic Display Parameters & Features:
    Digital display
    Bits per primary color channel: 10
    DisplayPort interface
    Maximum image size: 60 cm x 33 cm
    Gamma: 2.20
    DPMS levels: Off
    Supported color formats: RGB 4:4:4, YCrCb 4:4:4, YCrCb 4:2:2
    First detailed timing includes the native pixel format and preferred refresh rate
    Display supports continuous frequencies
  Color Characteristics:
    Red  : 0.6796, 0.3095
    Green: 0.2060, 0.6933
    Blue : 0.1513, 0.0546
    White: 0.3134, 0.3291
  Established Timings I & II:
    IBM     :   720x400    70.081663 Hz   9:5     31.467 kHz     28.320000 MHz
    DMT 0x04:   640x480    59.940476 Hz   4:3     31.469 kHz     25.175000 MHz
    DMT 0x05:   640x480    72.808802 Hz   4:3     37.861 kHz     31.500000 MHz
    DMT 0x06:   640x480    75.000000 Hz   4:3     37.500 kHz     31.500000 MHz
    DMT 0x08:   800x600    56.250000 Hz   4:3     35.156 kHz     36.000000 MHz
    DMT 0x09:   800x600    60.316541 Hz   4:3     37.879 kHz     40.000000 MHz
    DMT 0x0a:   800x600    72.187572 Hz   4:3     48.077 kHz     50.000000 MHz
    DMT 0x0b:   800x600    75.000000 Hz   4:3     46.875 kHz     49.500000 MHz
    DMT 0x10:  1024x768    60.003840 Hz   4:3     48.363 kHz     65.000000 MHz
    DMT 0x11:  1024x768    70.069359 Hz   4:3     56.476 kHz     75.000000 MHz
    DMT 0x12:  1024x768    75.028582 Hz   4:3     60.023 kHz     78.750000 MHz
    DMT 0x24:  1280x1024   75.024675 Hz   5:4     79.976 kHz    135.000000 MHz
  Standard Timings:
    DMT 0x15:  1152x864    75.000000 Hz   4:3     67.500 kHz    108.000000 MHz
    DMT 0x23:  1280x1024   60.019740 Hz   5:4     63.981 kHz    108.000000 MHz
    DMT 0x33:  1600x1200   60.000000 Hz   4:3     75.000 kHz    162.000000 MHz
    DMT 0x52:  1920x1080   60.000000 Hz  16:9     67.500 kHz    148.500000 MHz
    DMT 0x2f:  1440x900    59.887445 Hz  16:10    55.935 kHz    106.500000 MHz
    DMT 0x53:  1600x900    60.000000 Hz  16:9     60.000 kHz    108.000000 MHz (RB)
    DMT 0x3a:  1680x1050   59.954250 Hz  16:10    65.290 kHz    146.250000 MHz
    DMT 0x05:   640x480    72.808802 Hz   4:3     37.861 kHz     31.500000 MHz
  Detailed Timing Descriptors:
    DTD 1:  1920x1080   60.000000 Hz  16:9     67.500 kHz    148.500000 MHz (597 mm x 336 mm)
                 Hfront   88 Hsync  44 Hback  148 Hpol P
                 Vfront    4 Vsync   5 Vback   36 Vpol N
    DTD 2:  1920x1080   75.002020 Hz  16:9     84.377 kHz    185.630000 MHz (597 mm x 336 mm)
                 Hfront   88 Hsync  44 Hback  148 Hpol P
                 Vfront    4 Vsync   5 Vback   36 Vpol N
    Display Product Name: 'MS27HQ-i1'
    Display Range Limits:
      Monitor ranges (Range Limits Only): 48-100 Hz V, 120-120 kHz H, max dotclock 320 MHz
  Extension blocks: 1
Checksum: 0x3e

----------------

Block 1, CTA-861 Extension Block:
  Revision: 3
  Underscans IT Video Formats by default
  Basic audio support
  Supports YCbCr 4:4:4
  Supports YCbCr 4:2:2
  Native DTDs: 1
  Video Data Block:
    VIC  16:  1920x1080   60.000000 Hz  16:9     67.500 kHz    148.500000 MHz
    VIC  31:  1920x1080   50.000000 Hz  16:9     56.250 kHz    148.500000 MHz
    VIC   4:  1280x720    60.000000 Hz  16:9     45.000 kHz     74.250000 MHz
    VIC  19:  1280x720    50.000000 Hz  16:9     37.500 kHz     74.250000 MHz
    VIC  18:   720x576    50.000000 Hz  16:9     31.250 kHz     27.000000 MHz
    VIC  17:   720x576    50.000000 Hz   4:3     31.250 kHz     27.000000 MHz
    VIC   3:   720x480    59.940060 Hz  16:9     31.469 kHz     27.000000 MHz
    VIC   2:   720x480    59.940060 Hz   4:3     31.469 kHz     27.000000 MHz
  Audio Data Block:
    Linear PCM:
      Max channels: 2
      Supported sample rates (kHz): 192 176.4 96 88.2 48 44.1 32
      Supported sample sizes (bits): 24 20 16
  Speaker Allocation Data Block:
    FL/FR - Front Left/Right
  Video Capability Data Block:
    YCbCr quantization: Selectable (via AVI YQ)
    RGB quantization: Selectable (via AVI Q)
    PT scan behavior: No Data
    IT scan behavior: IT video formats not supported
    CE scan behavior: CE video formats not supported
  Colorimetry Data Block:
    BT2020YCC
    BT2020RGB
  HDR Static Metadata Data Block:
    Electro optical transfer functions:
      Traditional gamma - SDR luminance range
      SMPTE ST2084
    Supported static metadata descriptors:
      Static metadata type 1
    Desired content max luminance: 98 (417.710 cd/m^2)
    Desired content max frame-average luminance: 98 (417.710 cd/m^2)
    Desired content min luminance: 0 (0.000 cd/m^2)
  Video Capability Data Block:
    YCbCr quantization: Selectable (via AVI YQ)
    RGB quantization: Selectable (via AVI Q)
    PT scan behavior: No Data
    IT scan behavior: IT video formats not supported
    CE scan behavior: CE video formats not supported
  Detailed Timing Descriptors:
    DTD 3:  1440x900    60.005365 Hz  16:10    55.925 kHz     89.480000 MHz (597 mm x 336 mm)
                 Hfront   88 Hsync  44 Hback   28 Hpol P
                 Vfront    4 Vsync   5 Vback   23 Vpol P
    DTD 4:  1280x720    60.000000 Hz  16:9     45.000 kHz     74.250000 MHz (597 mm x 336 mm)
                 Hfront  110 Hsync  40 Hback  220 Hpol P
                 Vfront    5 Vsync   5 Vback   20 Vpol P
    DTD 5:  1360x768    60.001666 Hz  85:48    47.401 kHz     72.050000 MHz (597 mm x 336 mm)
                 Hfront   48 Hsync  32 Hback   80 Hpol P
                 Vfront    3 Vsync  10 Vback    9 Vpol N
    DTD 6:  1920x1080  100.000000 Hz  16:9    112.500 kHz    234.000000 MHz (597 mm x 336 mm)
                 Hfront   88 Hsync  44 Hback   28 Hpol P
                 Vfront    4 Vsync   5 Vback   36 Vpol P
Checksum: 0x9b  Unused space in Extension Block: 17 bytes

----------------

Warnings:

Block 0, Base EDID:
  Detailed Timing Descriptor #1: DTD is similar but not identical to VIC 16.
Block 1, CTA-861 Extension Block:
  Video Data Block: VIC 16 and the first DTD are not identical. Is this intended?
  Video Capability Data Block: IT scan behavior is expected to support underscanned.
  Video Capability Data Block: 'CE video formats not supported' makes no sense.
  Colorimetry Data Block: Set the sRGB colorimetry bit to avoid interop issues.
  Video Capability Data Block: IT scan behavior is expected to support underscanned.
  Video Capability Data Block: 'CE video formats not supported' makes no sense.
  Detailed Timing Descriptor #3: Image size is 597x336 mm, but based on the picture AR it should be 537x336 mm.
EDID:
  Base EDID: Some timings are out of range of the Monitor Ranges:
    Horizontal Freq: 31.250 - 112.500 kHz (Monitor: 120.000 - 120.000 kHz)

Failures:

Block 1, CTA-861 Extension Block:
  Video Capability Data Block: Only one instance of this Data Block is allowed.
EDID:
  Extension Block 2 started with EDID header, ignoring Extension Blocks >= 2.

EDID conformity: FAIL
