edid-decode (hex):

00 ff ff ff ff ff ff 00 1e 6d 64 4b 9c fd 02 00
0c 11 01 03 6a 26 1e 78 ea 32 31 a3 57 4c 9d 25
11 50 54 a5 6b 80 31 4f 45 4f 61 4f 81 80 01 01
01 01 01 01 01 01 30 2a 00 98 51 00 2a 40 30 70
13 00 52 0e 11 00 00 1e 00 00 00 fd 00 38 4b 1e
53 0e 00 0a 20 20 20 20 20 20 00 00 00 fc 00 4c
31 39 35 34 0a 20 20 20 20 20 20 20 00 00 00 fc
00 20 0a 20 20 20 20 20 20 20 20 20 20 20 00 40

00 ff ff ff ff ff ff 00 1e 6d 64 4b 9c fd 02 00
0c 11 01 03 6a 26 1e 78 ea 32 31 a3 57 4c 9d 25
11 50 54 a5 6b 80 31 4f 45 4f 61 4f 81 80 01 01
01 01 01 01 01 01 30 2a 00 98 51 00 2a 40 30 70
13 00 52 0e 11 00 00 1e 00 00 00 fd 00 38 4b 1e
53 0e 00 0a 20 20 20 20 20 20 00 00 00 fc 00 4c
31 39 35 34 0a 20 20 20 20 20 20 20 00 00 00 fc
00 20 0a 20 20 20 20 20 20 20 20 20 20 20 00 40

----------------

Block 0, Base EDID:
  EDID Structure Version & Revision: 1.3
  Vendor & Product Identification:
    Manufacturer: GSM
    Model: 19300
    Serial Number: ...
    Made in: week 12 of 2007
  Basic Display Parameters & Features:
    Analog display
    Signal Level Standard: 0.700 : 0.000 : 0.700 V p-p
    Blank level equals black level
    Sync: Separate SyncOnGreen
    Maximum image size: 38 cm x 30 cm
    Gamma: 2.20
    DPMS levels: Standby Suspend Off
    RGB color display
    First detailed timing is the preferred timing
  Color Characteristics:
    Red  : 0.6367, 0.3427
    Green: 0.2968, 0.6152
    Blue : 0.1445, 0.0693
    White: 0.3125, 0.3291
  Established Timings I & II:
    IBM     :   720x400    70.081663 Hz   9:5     31.467 kHz     28.320000 MHz
    DMT 0x04:   640x480    59.940476 Hz   4:3     31.469 kHz     25.175000 MHz
    DMT 0x06:   640x480    75.000000 Hz   4:3     37.500 kHz     31.500000 MHz
    DMT 0x09:   800x600    60.316541 Hz   4:3     37.879 kHz     40.000000 MHz
    DMT 0x0b:   800x600    75.000000 Hz   4:3     46.875 kHz     49.500000 MHz
    Apple   :   832x624    74.551266 Hz   4:3     49.726 kHz     57.284000 MHz
    DMT 0x10:  1024x768    60.003840 Hz   4:3     48.363 kHz     65.000000 MHz
    DMT 0x12:  1024x768    75.028582 Hz   4:3     60.023 kHz     78.750000 MHz
    DMT 0x24:  1280x1024   75.024675 Hz   5:4     79.976 kHz    135.000000 MHz
    Apple   :  1152x870    75.061550 Hz 192:145   68.681 kHz    100.000000 MHz
  Standard Timings:
    DMT 0x06:   640x480    75.000000 Hz   4:3     37.500 kHz     31.500000 MHz
    DMT 0x0b:   800x600    75.000000 Hz   4:3     46.875 kHz     49.500000 MHz
    DMT 0x12:  1024x768    75.028582 Hz   4:3     60.023 kHz     78.750000 MHz
    DMT 0x23:  1280x1024   60.019740 Hz   5:4     63.981 kHz    108.000000 MHz
  Detailed Timing Descriptors:
    DTD 1:  1280x1024   60.019740 Hz   5:4     63.981 kHz    108.000000 MHz (338 mm x 270 mm)
                 Hfront   48 Hsync 112 Hback  248 Hpol P
                 Vfront    1 Vsync   3 Vback   38 Vpol P
    Display Range Limits:
      Monitor ranges (GTF): 56-75 Hz V, 30-83 kHz H, max dotclock 140 MHz
    Display Product Name: 'L1954'
    Display Product Name: ' '
Checksum: 0x40

----------------

Failures:

Block 0, Base EDID:
  Detailed Timing Descriptor #1: Mismatch of image size 338x270 mm vs display size 380x300 mm.
  Display Product Name: One or more trailing spaces before newline.
EDID:
  Extension Block 1 started with EDID header, ignoring Extension Blocks >= 1.

EDID conformity: FAIL
