edid-decode (hex):

00 ff ff ff ff ff ff 00 1e 41 4b 54 00 00 00 00
0a 1e 01 03 80 18 09 78 2a fa 58 a4 55 53 a2 24
0d 4b 4e 00 00 00 01 01 01 01 01 01 01 01 01 01
01 01 01 01 01 01 c4 24 80 90 70 d0 28 20 32 2c
a4 01 f3 5b 00 00 00 1f 00 00 00 fd 00 3c 64 1e
70 18 00 0a 20 20 20 20 20 20 00 00 00 fc 00 48
44 20 44 69 73 70 6c 61 79 0a 20 20 00 00 00 10
00 4c 54 4e 31 37 33 4b 54 30 31 30 30 30 01 90

02 03 2f f5 40 23 09 07 07 83 01 00 00 67 03 0c
00 10 00 38 50 68 1a 00 00 01 01 32 64 00 67 d8
5d c4 01 54 80 00 e3 05 c0 00 e4 06 05 01 60 a4
38 80 c8 70 38 3c 40 30 20 45 00 7e d6 10 00 00
1e 00 00 00 00 00 00 00 00 00 00 00 00 00 00 00
00 00 00 00 00 00 00 00 00 00 00 00 00 00 00 00
00 00 00 00 00 00 00 00 00 00 00 00 00 00 00 00
00 00 00 00 00 00 00 00 00 00 00 00 00 00 00 25

00 ff ff ff ff ff ff 00 1e 41 4b 54 00 00 00 00
0a 1e 01 03 80 18 09 78 2a fa 58 a4 55 53 a2 24
0d 4b 4e 00 00 00 01 01 01 01 01 01 01 01 01 01
01 01 01 01 01 01 c4 24 80 90 70 d0 28 20 32 2c
a4 01 f3 5b 00 00 00 1f 00 00 00 fd 00 3c 64 1e
70 18 00 0a 20 20 20 20 20 20 00 00 00 fc 00 48
44 20 44 69 73 70 6c 61 79 0a 20 20 00 00 00 10
00 4c 54 4e 31 37 33 4b 54 30 31 30 30 30 01 90

02 03 2f f5 40 23 09 07 07 83 01 00 00 67 03 0c
00 10 00 38 50 68 1a 00 00 01 01 32 64 00 67 d8
5d c4 01 54 80 00 e3 05 c0 00 e4 06 05 01 60 a4
38 80 c8 70 38 3c 40 30 20 45 00 7e d6 10 00 00
1e 00 00 00 00 00 00 00 00 00 00 00 00 00 00 00
00 00 00 00 00 00 00 00 00 00 00 00 00 00 00 00
00 00 00 00 00 00 00 00 00 00 00 00 00 00 00 00
00 00 00 00 00 00 00 00 00 00 00 00 00 00 00 25

----------------

Block 0, Base EDID:
  EDID Structure Version & Revision: 1.3
  Vendor & Product Identification:
    Manufacturer: GRA
    Model: 21579
    Made in: week 10 of 2020
  Basic Display Parameters & Features:
    Digital display
    Maximum image size: 24 cm x 9 cm
    Gamma: 2.20
    DPMS levels: Off
    RGB color display
    First detailed timing is the preferred timing
  Color Characteristics:
    Red  : 0.6435, 0.3349
    Green: 0.3261, 0.6347
    Blue : 0.1416, 0.0517
    White: 0.2949, 0.3046
  Established Timings I & II: none
  Standard Timings: none
  Detailed Timing Descriptors:
    DTD 1:  1920x720    60.001020 Hz   8:3     45.601 kHz     94.120000 MHz (243 mm x 91 mm)
                 Hfront   50 Hsync  44 Hback   50 Hpol P
                 Vfront   10 Vsync  20 Vback   10 Vpol P
    Display Range Limits:
      Monitor ranges (GTF): 60-100 Hz V, 30-112 kHz H, max dotclock 240 MHz
    Display Product Name: 'HD Display'
    Dummy Descriptor:
  Extension blocks: 1
Checksum: 0x90

----------------

Block 1, CTA-861 Extension Block:
  Revision: 3
  Underscans IT Video Formats by default
  Basic audio support
  Supports YCbCr 4:4:4
  Supports YCbCr 4:2:2
  Native DTDs: 5
  Video Data Block:
  Audio Data Block:
    Linear PCM:
      Max channels: 2
      Supported sample rates (kHz): 48 44.1 32
      Supported sample sizes (bits): 24 20 16
  Speaker Allocation Data Block:
    FL/FR - Front Left/Right
  Vendor-Specific Data Block (HDMI), OUI 00-0C-03:
    Source physical address: 1.0.0.0
    DC_36bit
    DC_30bit
    DC_Y444
    Maximum TMDS clock: 400 MHz
  Vendor-Specific Data Block (AMD), OUI 00-00-1A:
    Version: 1
    Feature Caps: 0x01
    Minimum Refresh Rate: 50 Hz
    Maximum Refresh Rate: 100 Hz
    Flags 1.x: 0x00
  Vendor-Specific Data Block (HDMI Forum), OUI C4-5D-D8:
    Version: 1
    Maximum TMDS Character Rate: 420 MHz
    SCDC Present
  Colorimetry Data Block:
    BT2020YCC
    BT2020RGB
  HDR Static Metadata Data Block:
    Electro optical transfer functions:
      Traditional gamma - SDR luminance range
      SMPTE ST2084
    Supported static metadata descriptors:
      Static metadata type 1
    Desired content max luminance: 96 (400.000 cd/m^2)
  Detailed Timing Descriptors:
    DTD 2:  1920x1080   59.996690 Hz  16:9     68.396 kHz    145.000000 MHz (382 mm x 214 mm)
                 Hfront   48 Hsync  32 Hback  120 Hpol P
                 Vfront    4 Vsync   5 Vback   51 Vpol P
Checksum: 0x25  Unused space in Extension Block: 62 bytes

----------------

Warnings:

Block 0, Base EDID:
  Basic Display Parameters & Features: Dubious maximum image size (24x9 is smaller than 10x10 cm).
  Detailed Timing Descriptor #1: Dubious image size (243x91 mm is smaller than 100x100 mm).
Block 1, CTA-861 Extension Block:
  Colorimetry Data Block: Set the sRGB colorimetry bit to avoid interop issues.

Failures:

Block 0, Base EDID:
  Dummy Descriptor: Dummy block filled with garbage.
Block 1, CTA-861 Extension Block:
  There are more Native DTDs (5) than DTDs (2).
  Video Data Block: This Data Block is empty.
  Vendor-Specific Data Block (HDMI), OUI 00-0C-03: HDMI VSDB Max TMDS rate is > 340.
  Vendor-Specific Data Block (HDMI Forum), OUI C4-5D-D8: HDMI Forum VSDB did not immediately follow the HDMI VSDB.
  Detailed Timing Descriptor #2: Mismatch of image size 382x214 mm vs display size 240x90 mm.
  Required 640x480p60 timings are missing in the established timings and the SVD list (VIC 1).
  Missing VCDB, needed for Set Selectable RGB Quantization to avoid interop issues.
EDID:
  Extension Block 2 started with EDID header, ignoring Extension Blocks >= 2.
  Base EDID: The DTD max image size is 382x214mm, which is larger than the display size 240.0x90.0mm.
  CTA-861: Native progressive timings are a mix of several resolutions.

EDID conformity: FAIL
