edid-decode (hex):

00 ff ff ff ff ff ff 00 4d 10 7d 15 00 00 00 00
2b 20 01 04 a5 1e 13 78 02 3a a0 97 5a 58 8b 27
19 50 54 00 00 00 01 01 01 01 01 01 01 01 01 01
01 01 01 01 01 01 28 3c 80 a0 70 b0 23 40 30 20
36 00 2e bc 10 00 00 18 20 30 80 a0 70 b0 23 40
30 20 36 00 2e bc 10 00 00 18 00 00 00 fe 00 58
44 37 4e 59 80 4c 51 31 34 30 4e 31 00 00 00 00
00 02 41 03 19 00 10 00 00 0a 01 0a 20 20 00 3e

00 ff ff ff ff ff ff 00 4d 10 7d 15 00 00 00 00
2b 20 01 04 a5 1e 13 78 02 3a a0 97 5a 58 8b 27
19 50 54 00 00 00 01 01 01 01 01 01 01 01 01 01
01 01 01 01 01 01 28 3c 80 a0 70 b0 23 40 30 20
36 00 2e bc 10 00 00 18 20 30 80 a0 70 b0 23 40
30 20 36 00 2e bc 10 00 00 18 00 00 00 fe 00 58
44 37 4e 59 80 4c 51 31 34 30 4e 31 00 00 00 00
00 02 41 03 19 00 10 00 00 0a 01 0a 20 20 00 3e

----------------

Block 0, Base EDID:
  EDID Structure Version & Revision: 1.4
  Vendor & Product Identification:
    Manufacturer: SHP
    Model: 5501
    Made in: week 43 of 2022
  Basic Display Parameters & Features:
    Digital display
    Bits per primary color channel: 8
    DisplayPort interface
    Maximum image size: 30 cm x 19 cm
    Gamma: 2.20
    Supported color formats: RGB 4:4:4
    First detailed timing includes the native pixel format and preferred refresh rate
  Color Characteristics:
    Red  : 0.5898, 0.3544
    Green: 0.3457, 0.5449
    Blue : 0.1542, 0.0996
    White: 0.3125, 0.3281
  Established Timings I & II: none
  Standard Timings: none
  Detailed Timing Descriptors:
    DTD 1:  1920x1200   59.950171 Hz  16:10    74.038 kHz    154.000000 MHz (302 mm x 188 mm)
                 Hfront   48 Hsync  32 Hback   80 Hpol N
                 Vfront    3 Vsync   6 Vback   26 Vpol N
    DTD 2:  1920x1200   47.960137 Hz  16:10    59.231 kHz    123.200000 MHz (302 mm x 188 mm)
                 Hfront   48 Hsync  32 Hback   80 Hpol N
                 Vfront    3 Vsync   6 Vback   26 Vpol N
    Alphanumeric Data String: 'XD7NY.LQ140N1'
    Manufacturer-Specified Display Descriptor (0x00): 00 00 00 02 41 03 19 00 10 00 00 0a 01 0a 20 20 '....A.........  '
Checksum: 0x3e

----------------

Block 1, Unknown EDID Extension Block 0x00:
  00 ff ff ff ff ff ff 00 4d 10 7d 15 00 00 00 00 '........M.}.....'
  2b 20 01 04 a5 1e 13 78 02 3a a0 97 5a 58 8b 27 '+ .....x.:..ZX.''
  19 50 54 00 00 00 01 01 01 01 01 01 01 01 01 01 '.PT.............'
  01 01 01 01 01 01 28 3c 80 a0 70 b0 23 40 30 20 '......(<..p.#@0 '
  36 00 2e bc 10 00 00 18 20 30 80 a0 70 b0 23 40 '6....... 0..p.#@'
  30 20 36 00 2e bc 10 00 00 18 00 00 00 fe 00 58 '0 6............X'
  44 37 4e 59 80 4c 51 31 34 30 4e 31 00 00 00 00 'D7NY.LQ140N1....'
  00 02 41 03 19 00 10 00 00 0a 01 0a 20 20 00 3e '..A.........  .>'
Checksum: 0x3e

----------------

Warnings:

Block 0, Base EDID:
  Detailed Timing Descriptor #1: DTD is similar but not identical to DMT 0x44.
  Alphanumeric Data String: Non-ASCII character 0x80 at position 5, can cause problems.
  Missing Display Product Name.

Failures:

Block 1, Base EDID:
  Unknown Extension Block.
EDID:
  Base EDID: EDID specified 0 extension block(s), but found 1 extension block(s).

EDID conformity: FAIL
