edid-decode (hex):

00 ff ff ff ff ff ff 00 5c 94 49 1c 01 01 01 01
33 16 01 04 a5 59 32 78 02 01 c1 a0 57 47 98 27
12 4c 4c a1 08 00 31 40 45 40 61 40 81 80 a9 40
01 01 01 01 01 01 02 3a 80 18 71 38 2d 40 58 2c
46 00 40 84 63 00 00 1e 00 00 00 ff 00 37 32 34
31 56 32 35 31 30 30 37 36 30 00 00 00 fd 00 39
4e 1e 50 0f 00 0a 20 20 20 20 20 20 00 00 00 fc
00 43 57 34 30 54 32 52 57 0a 20 20 20 20 00 ed

00 ff ff ff ff ff ff 00 5c 94 49 1c 01 01 01 01
33 16 01 04 a5 59 32 78 02 01 c1 a0 57 47 98 27
12 4c 4c a1 08 00 31 40 45 40 61 40 81 80 a9 40
01 01 01 01 01 01 02 3a 80 18 71 38 2d 40 58 2c
46 00 40 84 63 00 00 1e 00 00 00 ff 00 37 32 34
31 56 32 35 31 30 30 37 36 30 00 00 00 fd 00 39
4e 1e 50 0f 00 0a 20 20 20 20 20 20 00 00 00 fc
00 43 57 34 30 54 32 52 57 0a 20 20 20 20 00 ed

----------------

Block 0, Base EDID:
  EDID Structure Version & Revision: 1.4
  Vendor & Product Identification:
    Manufacturer: WDT
    Model: 7241
    Serial Number: ...
    Made in: week 51 of 2012
  Basic Display Parameters & Features:
    Digital display
    Bits per primary color channel: 8
    DisplayPort interface
    Maximum image size: 89 cm x 50 cm
    Gamma: 2.20
    Supported color formats: RGB 4:4:4
    First detailed timing includes the native pixel format and preferred refresh rate
  Color Characteristics:
    Red  : 0.6250, 0.3398
    Green: 0.2773, 0.5947
    Blue : 0.1552, 0.0703
    White: 0.2968, 0.2978
  Established Timings I & II:
    IBM     :   720x400    70.081663 Hz   9:5     31.467 kHz     28.320000 MHz
    DMT 0x04:   640x480    59.940476 Hz   4:3     31.469 kHz     25.175000 MHz
    DMT 0x09:   800x600    60.316541 Hz   4:3     37.879 kHz     40.000000 MHz
    DMT 0x10:  1024x768    60.003840 Hz   4:3     48.363 kHz     65.000000 MHz
  Standard Timings:
    DMT 0x04:   640x480    59.940476 Hz   4:3     31.469 kHz     25.175000 MHz
    DMT 0x09:   800x600    60.316541 Hz   4:3     37.879 kHz     40.000000 MHz
    DMT 0x10:  1024x768    60.003840 Hz   4:3     48.363 kHz     65.000000 MHz
    DMT 0x23:  1280x1024   60.019740 Hz   5:4     63.981 kHz    108.000000 MHz
    DMT 0x33:  1600x1200   60.000000 Hz   4:3     75.000 kHz    162.000000 MHz
  Detailed Timing Descriptors:
    DTD 1:  1920x1080   60.000000 Hz  16:9     67.500 kHz    148.500000 MHz (1600 mm x 900 mm)
                 Hfront   88 Hsync  44 Hback  148 Hpol P
                 Vfront    4 Vsync   6 Vback   35 Vpol P
    Display Product Serial Number: ...
    Display Range Limits:
      Monitor ranges (GTF): 57-78 Hz V, 30-80 kHz H, max dotclock 150 MHz
    Display Product Name: 'CW40T2RW'
Checksum: 0xed

----------------

Warnings:

Block 0, Base EDID:
  Vendor & Product Identification: The serial number is one of the known dummy values, it should probably be set to 0.
  Detailed Timing Descriptor #1: DTD is similar but not identical to VIC 16.
  Display Range Limits: GTF support is deprecated in EDID 1.4.
EDID:
  Base EDID: Some timings are out of range of the Monitor Ranges:
    Maximum Clock: 162.000 MHz (Monitor: 150.000 MHz)

Failures:

Block 0, Base EDID:
  Detailed Timing Descriptor #1: Mismatch of image size 1600x900 mm vs display size 890x500 mm.
  Display Range Limits: GTF is supported, but the display does not support continuous frequencies.
EDID:
  Extension Block 1 started with EDID header, ignoring Extension Blocks >= 1.
  Base EDID: The DTD max image size is 1600x900mm, which is larger than the display size 890.0x500.0mm.

EDID conformity: FAIL
