edid-decode (hex):

00 ff ff ff ff ff ff 00 4e 14 28 89 00 00 00 00
31 1e 01 04 b5 50 21 78 3b 90 55 af 4d 46 a8 26
11 50 54 bf ef 80 71 4f 81 c0 81 40 81 80 95 01
a9 c0 b3 00 d1 c0 4c 7d 70 a0 d0 a0 2d 50 30 20
35 00 33 5a 31 00 00 1a 00 00 00 ff 00 4e 4f 33
35 43 42 49 57 30 30 30 31 0a 00 00 00 fd 00 30
78 b2 b2 40 01 0a 20 20 20 20 20 20 00 00 00 fc
00 53 63 65 70 74 72 65 20 4f 33 35 0a 20 02 e8

02 03 32 f4 4c 01 02 03 04 05 90 11 12 13 14 1f
3f 23 08 07 07 83 01 00 00 6d 1a 00 00 02 11 30
78 00 00 00 00 00 00 e3 05 e3 01 e6 06 07 01 65
61 27 b2 41 b8 a0 60 a0 33 50 30 20 35 00 33 5a
31 00 00 1a 3a 6b 70 a0 d0 a0 55 50 30 20 35 00
33 5a 31 00 00 1a d4 d0 70 a0 d0 a0 2d 50 30 20
35 00 33 5a 31 00 00 1a ab 5e 00 a0 a0 a0 2d 50
30 20 35 00 33 5a 31 00 00 1e 00 00 00 00 00 7f

70 12 79 00 00 03 00 14 97 fa 00 04 6f 0d 9f 00
2f 00 1f 00 9f 05 2c 00 00 00 00 00 07 00 0a 08
81 00 08 04 00 04 02 10 00 03 01 28 42 91 00 04
ff 09 b3 00 2f 00 3f 00 37 04 32 00 02 80 04 00
d3 bc 00 00 ff 09 9f 00 2f 00 1e 00 9f 05 28 00
02 00 04 00 00 00 00 00 00 00 00 00 00 00 00 00
00 00 00 00 00 00 00 00 00 00 00 00 00 00 00 00
00 00 00 00 00 00 00 00 00 00 00 00 00 00 60 90

----------------

Block 0, Base EDID:
  EDID Structure Version & Revision: 1.4
  Vendor & Product Identification:
    Manufacturer: SPT
    Model: 35112
    Made in: week 49 of 2020
  Basic Display Parameters & Features:
    Digital display
    Bits per primary color channel: 10
    DisplayPort interface
    Maximum image size: 80 cm x 33 cm
    Gamma: 2.20
    DPMS levels: Off
    Supported color formats: RGB 4:4:4, YCrCb 4:4:4, YCrCb 4:2:2
    First detailed timing includes the native pixel format and preferred refresh rate
    Display supports continuous frequencies
  Color Characteristics:
    Red  : 0.6855, 0.3017
    Green: 0.2734, 0.6562
    Blue : 0.1494, 0.0673
    White: 0.3134, 0.3291
  Established Timings I & II:
    IBM     :   720x400    70.081663 Hz   9:5     31.467 kHz     28.320000 MHz
    DMT 0x04:   640x480    59.940476 Hz   4:3     31.469 kHz     25.175000 MHz
    Apple   :   640x480    66.666667 Hz   4:3     35.000 kHz     30.240000 MHz
    DMT 0x05:   640x480    72.808802 Hz   4:3     37.861 kHz     31.500000 MHz
    DMT 0x06:   640x480    75.000000 Hz   4:3     37.500 kHz     31.500000 MHz
    DMT 0x08:   800x600    56.250000 Hz   4:3     35.156 kHz     36.000000 MHz
    DMT 0x09:   800x600    60.316541 Hz   4:3     37.879 kHz     40.000000 MHz
    DMT 0x0a:   800x600    72.187572 Hz   4:3     48.077 kHz     50.000000 MHz
    DMT 0x0b:   800x600    75.000000 Hz   4:3     46.875 kHz     49.500000 MHz
    Apple   :   832x624    74.551266 Hz   4:3     49.726 kHz     57.284000 MHz
    DMT 0x10:  1024x768    60.003840 Hz   4:3     48.363 kHz     65.000000 MHz
    DMT 0x11:  1024x768    70.069359 Hz   4:3     56.476 kHz     75.000000 MHz
    DMT 0x12:  1024x768    75.028582 Hz   4:3     60.023 kHz     78.750000 MHz
    DMT 0x24:  1280x1024   75.024675 Hz   5:4     79.976 kHz    135.000000 MHz
    Apple   :  1152x870    75.061550 Hz 192:145   68.681 kHz    100.000000 MHz
  Standard Timings:
    DMT 0x15:  1152x864    75.000000 Hz   4:3     67.500 kHz    108.000000 MHz
    DMT 0x55:  1280x720    60.000000 Hz  16:9     45.000 kHz     74.250000 MHz
    DMT 0x20:  1280x960    60.000000 Hz   4:3     60.000 kHz    108.000000 MHz
    DMT 0x23:  1280x1024   60.019740 Hz   5:4     63.981 kHz    108.000000 MHz
    GTF     :  1440x900    61.000089 Hz  16:10    56.852 kHz    109.156000 MHz
    DMT 0x53:  1600x900    60.000000 Hz  16:9     60.000 kHz    108.000000 MHz (RB)
    DMT 0x3a:  1680x1050   59.954250 Hz  16:10    65.290 kHz    146.250000 MHz
    DMT 0x52:  1920x1080   60.000000 Hz  16:9     67.500 kHz    148.500000 MHz
  Detailed Timing Descriptors:
    DTD 1:  3440x1440   60.000000 Hz  43:18    89.100 kHz    320.760000 MHz (819 mm x 346 mm)
                 Hfront   48 Hsync  32 Hback   80 Hpol P
                 Vfront    3 Vsync   5 Vback   37 Vpol N
    Display Product Serial Number: ...
    Display Range Limits:
      Monitor ranges (Range Limits Only): 48-120 Hz V, 178-178 kHz H, max dotclock 640 MHz
    Display Product Name: 'Sceptre O35'
  Extension blocks: 2
Checksum: 0xe8

----------------

Block 1, CTA-861 Extension Block:
  Revision: 3
  Underscans IT Video Formats by default
  Basic audio support
  Supports YCbCr 4:4:4
  Supports YCbCr 4:2:2
  Native DTDs: 4
  Video Data Block:
    VIC   1:   640x480    59.940476 Hz   4:3     31.469 kHz     25.175000 MHz
    VIC   2:   720x480    59.940060 Hz   4:3     31.469 kHz     27.000000 MHz
    VIC   3:   720x480    59.940060 Hz  16:9     31.469 kHz     27.000000 MHz
    VIC   4:  1280x720    60.000000 Hz  16:9     45.000 kHz     74.250000 MHz
    VIC   5:  1920x1080i  60.000000 Hz  16:9     33.750 kHz     74.250000 MHz
    VIC  16:  1920x1080   60.000000 Hz  16:9     67.500 kHz    148.500000 MHz (native)
    VIC  17:   720x576    50.000000 Hz   4:3     31.250 kHz     27.000000 MHz
    VIC  18:   720x576    50.000000 Hz  16:9     31.250 kHz     27.000000 MHz
    VIC  19:  1280x720    50.000000 Hz  16:9     37.500 kHz     74.250000 MHz
    VIC  20:  1920x1080i  50.000000 Hz  16:9     28.125 kHz     74.250000 MHz
    VIC  31:  1920x1080   50.000000 Hz  16:9     56.250 kHz    148.500000 MHz
    VIC  63:  1920x1080  120.000000 Hz  16:9    135.000 kHz    297.000000 MHz
  Audio Data Block:
    Linear PCM:
      Max channels: 1
      Supported sample rates (kHz): 48 44.1 32
      Supported sample sizes (bits): 24 20 16
  Speaker Allocation Data Block:
    FL/FR - Front Left/Right
  Vendor-Specific Data Block (AMD), OUI 00-00-1A:
    Version: 2
    Feature Caps: 0x11
    Minimum Refresh Rate: 48 Hz
    Maximum Refresh Rate: 120 Hz
    Flags 1.x: 0x00
    Flags 2.x: 0x00
  Colorimetry Data Block:
    xvYCC601
    xvYCC709
    BT2020cYCC
    BT2020YCC
    BT2020RGB
    Gamut Boundary Description Metadata Profile P0
  HDR Static Metadata Data Block:
    Electro optical transfer functions:
      Traditional gamma - SDR luminance range
      Traditional gamma - HDR luminance range
      SMPTE ST2084
    Supported static metadata descriptors:
      Static metadata type 1
    Desired content max luminance: 101 (445.755 cd/m^2)
    Desired content max frame-average luminance: 97 (408.759 cd/m^2)
    Desired content min luminance: 39 (0.104 cd/m^2)
  Detailed Timing Descriptors:
    DTD 2:  1720x1440   59.998288 Hz  43:36    89.457 kHz    168.180000 MHz (819 mm x 346 mm)
                 Hfront   48 Hsync  32 Hback   80 Hpol P
                 Vfront    3 Vsync   5 Vback   43 Vpol N
    DTD 3:  3440x1440   50.000000 Hz  43:18    76.250 kHz    274.500000 MHz (819 mm x 346 mm)
                 Hfront   48 Hsync  32 Hback   80 Hpol P
                 Vfront    3 Vsync   5 Vback   77 Vpol N
    DTD 4:  3440x1440  100.000000 Hz  43:18   148.500 kHz    534.600000 MHz (819 mm x 346 mm)
                 Hfront   48 Hsync  32 Hback   80 Hpol P
                 Vfront    3 Vsync   5 Vback   37 Vpol N
    DTD 5:  2560x1440   59.999505 Hz  16:9     89.099 kHz    242.350000 MHz (819 mm x 346 mm)
                 Hfront   48 Hsync  32 Hback   80 Hpol P
                 Vfront    3 Vsync   5 Vback   37 Vpol P
Checksum: 0x7f  Unused space in Extension Block: 5 bytes

----------------

Block 2, DisplayID Extension Block:
  Version: 1.2
  Extension Count: 0
  Display Product Type: Extension Section
  Video Timing Modes Type 1 - Detailed Timings Data Block:
    DTD:  3440x1440  120.000000 Hz  16:9    178.200 kHz    641.520000 MHz (aspect 16:9, no 3D stereo)
               Hfront   48 Hsync  32 Hback   80 Hpol N
               Vfront    1 Vsync   1 Vback   43 Vpol N
  Supported Timing Modes Type 1 - VESA DMT Timings Data Block:
    DMT 0x04:   640x480    59.940476 Hz   4:3     31.469 kHz     25.175000 MHz
    DMT 0x09:   800x600    60.316541 Hz   4:3     37.879 kHz     40.000000 MHz
    DMT 0x10:  1024x768    60.003840 Hz   4:3     48.363 kHz     65.000000 MHz
    DMT 0x1c:  1280x800    59.810326 Hz  16:10    49.702 kHz     83.500000 MHz
    DMT 0x23:  1280x1024   60.019740 Hz   5:4     63.981 kHz    108.000000 MHz
    DMT 0x33:  1600x1200   60.000000 Hz   4:3     75.000 kHz    162.000000 MHz
    DMT 0x3a:  1680x1050   59.954250 Hz  16:10    65.290 kHz    146.250000 MHz
    DMT 0x45:  1920x1200   59.884600 Hz  16:10    74.556 kHz    193.250000 MHz
  Video Timing Modes Type 1 - Detailed Timings Data Block:
    DTD:  2560x1080  119.999096 Hz  16:9    135.719 kHz    371.870000 MHz (aspect 16:9, no 3D stereo)
               Hfront   48 Hsync  64 Hback   68 Hpol N
               Vfront    3 Vsync   5 Vback   43 Vpol P
    DTD:  2560x1440  120.000397 Hz   1:1    177.721 kHz    483.400000 MHz (aspect 1:1, no 3D stereo)
               Hfront   48 Hsync  31 Hback   81 Hpol N
               Vfront    3 Vsync   5 Vback   33 Vpol N
  Checksum: 0x60
Checksum: 0x90

----------------

Warnings:

Block 1, CTA-861 Extension Block:
  Video Data Block: VIC 1 and the first DTD are not identical. Is this intended?
  Video Data Block: All VICs are in ascending order, and the first (preferred) VIC <= 4, is that intended?
  Colorimetry Data Block: Set the sRGB colorimetry bit to avoid interop issues.
  Detailed Timing Descriptor #2: Image size is 819x346 mm, but based on the picture AR it should be 413x346 mm.
  Detailed Timing Descriptor #5: Image size is 819x346 mm, but based on the picture AR it should be 615x346 mm.
EDID:
  Base EDID: Some timings are out of range of the Monitor Ranges:
    Horizontal Freq: 28.125 - 178.200 kHz (Monitor: 178.000 - 178.000 kHz)
    Maximum Clock: 641.520 MHz (Monitor: 640.000 MHz)

Failures:

Block 0, Base EDID:
  Detailed Timing Descriptor #1: Mismatch of image size 819x346 mm vs display size 800x330 mm.
Block 1, CTA-861 Extension Block:
  Detailed Timing Descriptor #2: Mismatch of image size 819x346 mm vs display size 800x330 mm.
  Detailed Timing Descriptor #3: Mismatch of image size 819x346 mm vs display size 800x330 mm.
  Detailed Timing Descriptor #4: Mismatch of image size 819x346 mm vs display size 800x330 mm.
  Detailed Timing Descriptor #5: Mismatch of image size 819x346 mm vs display size 800x330 mm.
  Missing VCDB, needed for Set Selectable RGB Quantization to avoid interop issues.
Block 2, DisplayID Extension Block:
  DisplayID Base Block has no product type.
EDID:
  Base EDID: The DTD max image size is 819x346mm, which is larger than the display size 800.0x330.0mm.
  CTA-861: Native progressive timings are a mix of several resolutions.
  DisplayID: DisplayID expects at least one preferred timing.

EDID conformity: FAIL
