edid-decode (hex):

00 ff ff ff ff ff ff 00 09 e5 e9 09 00 00 00 00
27 20 01 04 a5 1f 11 78 06 c0 35 a4 54 4b 9d 25
0e 50 54 00 00 00 01 01 01 01 01 01 01 01 01 01
01 01 01 01 01 01 c0 39 80 18 71 38 28 40 30 20
36 00 36 ad 10 00 00 1a 34 2e 80 18 71 38 28 40
30 20 36 00 36 ad 10 00 00 1a 00 00 00 fe 00 48
35 48 47 52 80 4e 45 31 34 4e 34 36 00 00 00 00
00 02 41 21 a8 00 11 00 00 0a 01 0a 20 20 00 fa

00 ff ff ff ff ff ff 00 09 e5 e9 09 00 00 00 00
27 20 01 04 a5 1f 11 78 06 c0 35 a4 54 4b 9d 25
0e 50 54 00 00 00 01 01 01 01 01 01 01 01 01 01
01 01 01 01 01 01 c0 39 80 18 71 38 28 40 30 20
36 00 36 ad 10 00 00 1a 34 2e 80 18 71 38 28 40
30 20 36 00 36 ad 10 00 00 1a 00 00 00 fe 00 48
35 48 47 52 80 4e 45 31 34 4e 34 36 00 00 00 00
00 02 41 21 a8 00 11 00 00 0a 01 0a 20 20 00 fa

----------------

Block 0, Base EDID:
  EDID Structure Version & Revision: 1.4
  Vendor & Product Identification:
    Manufacturer: BOE
    Model: 2537
    Made in: week 39 of 2022
  Basic Display Parameters & Features:
    Digital display
    Bits per primary color channel: 8
    DisplayPort interface
    Maximum image size: 31 cm x 17 cm
    Gamma: 2.20
    Supported color formats: RGB 4:4:4
    Default (sRGB) color space is primary color space
    First detailed timing includes the native pixel format and preferred refresh rate
  Color Characteristics:
    Red  : 0.6435, 0.3281
    Green: 0.2929, 0.6132
    Blue : 0.1445, 0.0576
    White: 0.3134, 0.3291
  Established Timings I & II: none
  Standard Timings: none
  Detailed Timing Descriptors:
    DTD 1:  1920x1080   60.000000 Hz  16:9     67.200 kHz    147.840000 MHz (310 mm x 173 mm)
                 Hfront   48 Hsync  32 Hback  200 Hpol P
                 Vfront    3 Vsync   6 Vback   31 Vpol N
    DTD 2:  1920x1080   48.003247 Hz  16:9     53.764 kHz    118.280000 MHz (310 mm x 173 mm)
                 Hfront   48 Hsync  32 Hback  200 Hpol P
                 Vfront    3 Vsync   6 Vback   31 Vpol N
    Alphanumeric Data String: 'H5HGR.NE14N46'
    Manufacturer-Specified Display Descriptor (0x00): 00 00 00 02 41 21 a8 00 11 00 00 0a 01 0a 20 20 '....A!........  '
Checksum: 0xfa

----------------

Warnings:

Block 0, Base EDID:
  Alphanumeric Data String: Non-ASCII character 0x80 at position 5, can cause problems.
  Missing Display Product Name.

Failures:

Block 0, Base EDID:
  Basic Display Parameters & Features: sRGB is signaled, but the chromaticities do not match.
EDID:
  Extension Block 1 started with EDID header, ignoring Extension Blocks >= 1.

EDID conformity: FAIL
