edid-decode (hex):

00 ff ff ff ff ff ff 00 22 f0 1a 42 01 01 00 00
01 15 01 03 80 2c 18 78 0a 40 a0 a3 5a 52 a2 26
0e 50 54 00 00 00 01 01 01 01 01 01 01 01 01 01
01 01 01 01 01 01 30 2a 40 c8 60 84 64 30 18 50
13 00 bb f9 10 00 00 1e 00 00 00 ff 00 43 43 46
4c 43 4d 49 4d 32 30 30 46 47 00 00 00 fc 00 48
50 20 54 6f 75 63 68 53 6d 61 72 74 00 00 00 fe
00 4d 32 30 30 46 47 45 2d 4c 32 30 20 20 00 62

00 ff ff ff ff ff ff 00 22 f0 1a 42 01 01 00 00
01 15 01 03 80 2c 18 78 0a 40 a0 a3 5a 52 a2 26
0e 50 54 00 00 00 01 01 01 01 01 01 01 01 01 01
01 01 01 01 01 01 30 2a 40 c8 60 84 64 30 18 50
13 00 bb f9 10 00 00 1e 00 00 00 ff 00 43 43 46
4c 43 4d 49 4d 32 30 30 46 47 00 00 00 fc 00 48
50 20 54 6f 75 63 68 53 6d 61 72 74 00 00 00 fe
00 4d 32 30 30 46 47 45 2d 4c 32 30 20 20 00 62

----------------

Block 0, Base EDID:
  EDID Structure Version & Revision: 1.3
  Vendor & Product Identification:
    Manufacturer: HWP
    Model: 16922
    Serial Number: ...
    Made in: week 1 of 2011
  Basic Display Parameters & Features:
    Digital display
    Maximum image size: 44 cm x 24 cm
    Gamma: 2.20
    RGB color display
    First detailed timing is the preferred timing
  Color Characteristics:
    Red  : 0.6376, 0.3515
    Green: 0.3203, 0.6328
    Blue : 0.1503, 0.0566
    White: 0.3125, 0.3281
  Established Timings I & II: none
  Standard Timings: none
  Detailed Timing Descriptors:
    DTD 1:  1600x900    60.000000 Hz  16:9     60.000 kHz    108.000000 MHz (443 mm x 249 mm)
                 Hfront   24 Hsync  80 Hback   96 Hpol P
                 Vfront    1 Vsync   3 Vback   96 Vpol P
    Display Product Serial Number: ...
    Display Product Name: 'HP TouchSmart'
    Alphanumeric Data String: 'M200FGE-L20  '
Checksum: 0x62

----------------

Failures:

Block 0, Base EDID:
  Alphanumeric Data String: No newline, but one or more trailing spaces.
  Missing Display Range Limits Descriptor.
EDID:
  Extension Block 1 started with EDID header, ignoring Extension Blocks >= 1.

EDID conformity: FAIL
