edid-decode (hex):

00 ff ff ff ff ff ff 00 22 f0 1a 42 01 01 01 01
0f 17 01 03 80 32 1c 78 0a 0a 45 a5 56 51 9d 25
0e 50 54 00 00 00 01 01 01 01 01 01 01 01 01 01
01 01 01 01 01 01 fe 33 80 54 70 38 1b 40 20 1c
84 00 fd 1e 11 00 00 1e 00 00 00 ff 00 57 4c 45
44 53 44 43 4c 54 4d 32 33 30 00 00 00 fc 00 48
50 20 41 6c 6c 2d 69 6e 2d 4f 6e 65 00 00 00 fe
00 4c 54 4d 32 33 30 48 4c 30 38 0a 20 20 00 7c

----------------

Block 0, Base EDID:
  EDID Structure Version & Revision: 1.3
  Vendor & Product Identification:
    Manufacturer: HWP
    Model: 16922
    Serial Number: ...
    Made in: week 15 of 2013
  Basic Display Parameters & Features:
    Digital display
    Maximum image size: 50 cm x 28 cm
    Gamma: 2.20
    RGB color display
    First detailed timing is the preferred timing
  Color Characteristics:
    Red  : 0.6445, 0.3359
    Green: 0.3183, 0.6152
    Blue : 0.1455, 0.0546
    White: 0.3134, 0.3291
  Established Timings I & II: none
  Standard Timings: none
  Detailed Timing Descriptors:
    DTD 1:  1920x1080   59.997440 Hz  16:9     66.417 kHz    133.100000 MHz (509 mm x 286 mm)
                 Hfront   32 Hsync  28 Hback   24 Hpol P
                 Vfront    8 Vsync   4 Vback   15 Vpol P
    Display Product Serial Number: ...
    Display Product Name: 'HP All-in-One'
    Alphanumeric Data String: 'LTM230HL08'
Checksum: 0x7c

----------------

Warnings:

Block 0, Base EDID:
  Vendor & Product Identification: The serial number is one of the known dummy values, it should probably be set to 0.

Failures:

Block 0, Base EDID:
  Missing Display Range Limits Descriptor.

EDID conformity: FAIL
