edid-decode (hex):

00 ff ff ff ff ff ff 00 30 e4 b1 04 00 00 00 00
00 19 01 04 95 1f 11 78 ea db 85 93 5a 54 91 28
1c 50 54 00 00 00 01 01 01 01 01 01 01 01 01 01
01 01 01 01 01 01 d0 1d 56 f4 50 00 16 30 30 20
35 00 36 ae 10 00 00 19 d0 1d 56 86 52 00 16 30
30 20 35 00 36 ae 10 00 00 19 00 00 00 fe 00 35
54 30 50 39 80 31 34 30 57 48 55 0a 00 00 00 00
00 00 41 31 94 01 10 00 00 09 01 0a 20 20 00 be

----------------

Block 0, Base EDID:
  EDID Structure Version & Revision: 1.4
  Vendor & Product Identification:
    Manufacturer: LGD
    Model: 1201
    Made in: 2015
  Basic Display Parameters & Features:
    Digital display
    Bits per primary color channel: 6
    DisplayPort interface
    Maximum image size: 31 cm x 17 cm
    Gamma: 2.20
    DPMS levels: Standby Suspend Off
    Supported color formats: RGB 4:4:4, YCrCb 4:4:4
    First detailed timing includes the native pixel format and preferred refresh rate
  Color Characteristics:
    Red  : 0.5771, 0.3525
    Green: 0.3300, 0.5693
    Blue : 0.1582, 0.1093
    White: 0.3134, 0.3291
  Established Timings I & II: none
  Standard Timings: none
  Detailed Timing Descriptors:
    DTD 1:  1366x768    60.004717 Hz 683:384   47.404 kHz     76.320000 MHz (310 mm x 174 mm)
                 Hfront   48 Hsync  32 Hback  164 Hpol N
                 Vfront    3 Vsync   5 Vback   14 Vpol N
    DTD 2:  1366x768    48.015703 Hz 683:384   37.932 kHz     76.320000 MHz (310 mm x 174 mm)
                 Hfront   48 Hsync  32 Hback  566 Hpol N
                 Vfront    3 Vsync   5 Vback   14 Vpol N
    Alphanumeric Data String: '5T0P9.140WHU'
    Manufacturer-Specified Display Descriptor (0x00): 00 00 00 00 41 31 94 01 10 00 00 09 01 0a 20 20 '....A1........  '
Checksum: 0xbe

----------------

Warnings:

Block 0, Base EDID:
  Alphanumeric Data String: Non-ASCII character 0x80 at position 5, can cause problems.
  Missing Display Product Name.

EDID conformity: PASS
