edid-decode (hex):

00 ff ff ff ff ff ff 00 22 f0 15 42 01 00 00 00
30 14 01 03 80 30 1b 78 ee 16 00 a3 54 4f 9e 27
11 50 54 00 00 00 01 01 01 01 01 01 01 01 01 01
01 01 01 01 01 01 18 38 80 00 71 38 14 40 60 40
84 00 dd 0c 11 00 00 00 00 00 00 fc 00 48 50 20
54 6f 75 63 68 53 6d 61 72 74 00 00 00 fc 00 0a
20 20 20 20 20 20 20 20 20 20 20 20 00 00 00 fc
00 0a 20 20 20 20 20 20 20 20 20 20 20 20 00 88

00 ff ff ff ff ff ff 00 22 f0 15 42 01 00 00 00
30 14 01 03 80 30 1b 78 ee 16 00 a3 54 4f 9e 27
11 50 54 00 00 00 01 01 01 01 01 01 01 01 01 01
01 01 01 01 01 01 18 38 80 00 71 38 14 40 60 40
84 00 dd 0c 11 00 00 00 00 00 00 fc 00 48 50 20
54 6f 75 63 68 53 6d 61 72 74 00 00 00 fc 00 0a
20 20 20 20 20 20 20 20 20 20 20 20 00 00 00 fc
00 0a 20 20 20 20 20 20 20 20 20 20 20 20 00 88

----------------

Block 0, Base EDID:
  EDID Structure Version & Revision: 1.3
  Vendor & Product Identification:
    Manufacturer: HWP
    Model: 16917
    Serial Number: ...
    Made in: week 48 of 2010
  Basic Display Parameters & Features:
    Digital display
    Maximum image size: 48 cm x 27 cm
    Gamma: 2.20
    DPMS levels: Standby Suspend Off
    RGB color display
    Default (sRGB) color space is primary color space
    First detailed timing is the preferred timing
  Color Characteristics:
    Red  : 0.6367, 0.3291
    Green: 0.3095, 0.6191
    Blue : 0.1523, 0.0664
    White: 0.3125, 0.3281
  Established Timings I & II: none
  Standard Timings: none
  Detailed Timing Descriptors:
    DTD 1:  1920x1080   59.993316 Hz  16:9     65.993 kHz    143.600000 MHz (analog composite, sync-on-green, 477 mm x 268 mm)
                 Hfront   96 Hsync  64 Hback   96 Hpol N
                 Vfront    8 Vsync   4 Vback    8 Vpol N
    Display Product Name: 'HP TouchSmart'
    Display Product Name: ''
    Display Product Name: ''
Checksum: 0x88

----------------

Warnings:

Block 0, Base EDID:
  Vendor & Product Identification: The serial number is one of the known dummy values, it should probably be set to 0.

Failures:

Block 0, Base EDID:
  Basic Display Parameters & Features: sRGB is signaled, but the chromaticities do not match.
  Display Product Name: Empty string.
  Display Product Name: Empty string.
  Missing Display Range Limits Descriptor.
EDID:
  Extension Block 1 started with EDID header, ignoring Extension Blocks >= 1.

EDID conformity: FAIL
