edid-decode (hex):

00 ff ff ff ff ff ff 00 0d ae 50 14 00 00 00 00
00 1e 01 04 a5 1e 13 78 03 79 08 a5 54 4d 9b 25
10 52 58 00 00 00 01 01 01 01 01 01 01 01 01 01
01 01 01 01 01 01 42 3c 80 a0 70 b0 24 40 2e 1e
a6 00 2d bc 10 00 00 18 00 00 00 fd 00 28 3c 43
43 10 01 0a 20 20 20 20 20 20 00 00 00 fe 00 43
4d 4e 01 0a 20 20 20 20 20 20 20 20 00 00 00 fe
00 4e 31 34 30 4a 43 4e 2d 47 53 39 0a 20 00 6e

00 ff ff ff ff ff ff 00 0d ae 50 14 00 00 00 00
00 1e 01 04 a5 1e 13 78 03 79 08 a5 54 4d 9b 25
10 52 58 00 00 00 01 01 01 01 01 01 01 01 01 01
01 01 01 01 01 01 42 3c 80 a0 70 b0 24 40 2e 1e
a6 00 2d bc 10 00 00 18 00 00 00 fd 00 28 3c 43
43 10 01 0a 20 20 20 20 20 20 00 00 00 fe 00 43
4d 4e 01 0a 20 20 20 20 20 20 20 20 00 00 00 fe
00 4e 31 34 30 4a 43 4e 2d 47 53 39 0a 20 00 6e

----------------

Block 0, Base EDID:
  EDID Structure Version & Revision: 1.4
  Vendor & Product Identification:
    Manufacturer: CMN
    Model: 5200
    Made in: 2020
  Basic Display Parameters & Features:
    Digital display
    Bits per primary color channel: 8
    DisplayPort interface
    Maximum image size: 30 cm x 19 cm
    Gamma: 2.20
    Supported color formats: RGB 4:4:4
    First detailed timing includes the native pixel format and preferred refresh rate
    Display supports continuous frequencies
  Color Characteristics:
    Red  : 0.6455, 0.3310
    Green: 0.3027, 0.6064
    Blue : 0.1445, 0.0625
    White: 0.3222, 0.3437
  Established Timings I & II: none
  Standard Timings: none
  Detailed Timing Descriptors:
    DTD 1:  1920x1200   60.002801 Hz  16:10    74.163 kHz    154.260000 MHz (301 mm x 188 mm)
                 Hfront   46 Hsync  30 Hback   84 Hpol N
                 Vfront   10 Vsync   6 Vback   20 Vpol N
    Display Range Limits:
      Monitor ranges (Range Limits Only): 40-60 Hz V, 67-67 kHz H, max dotclock 160 MHz
    Alphanumeric Data String: 'CMN.'
    Alphanumeric Data String: 'N140JCN-GS9'
Checksum: 0x6e

----------------

Warnings:

Block 0, Base EDID:
  Alphanumeric Data String: Non-ASCII character 0x01 at position 3, can cause problems.
  Missing Display Product Name.
EDID:
  Base EDID: Some timings are out of range of the Monitor Ranges:
    Horizontal Freq: 74.163 - 74.163 kHz (Monitor: 67.000 - 67.000 kHz)

Failures:

EDID:
  Extension Block 1 started with EDID header, ignoring Extension Blocks >= 1.

EDID conformity: FAIL
