edid-decode (hex):

00 ff ff ff ff ff ff 00 0d 04 00 00 00 00 00 00
31 1f 01 03 80 45 1d 78 2c ee 95 a3 54 4c 99 26
0f 50 54 a7 cb 00 81 c0 81 80 95 00 01 01 b3 00
d1 c0 01 01 01 01 b8 47 00 a0 a0 38 2d 40 30 20
35 00 b3 23 21 00 00 1a 70 8f 00 a0 a0 38 2d 40
30 40 3a 00 55 50 21 00 00 1a 00 00 00 fd 00 30
c8 1e e9 3c 00 0a 20 20 20 20 20 20 00 00 00 fc
00 50 4d 47 33 30 43 39 30 30 57 46 47 0a 01 58

02 03 46 f1 4a 01 02 03 04 90 12 13 1f 04 5b 23
09 07 07 83 01 00 00 6a 03 0c 00 10 00 38 78 20
00 00 67 d8 5d c4 01 78 c0 00 6d 1a 00 00 02 01
30 c8 e6 00 00 00 00 00 e3 05 c0 00 e6 06 05 01
60 60 3a e2 00 d5 9e e8 00 78 a0 38 21 40 30 3c
36 00 56 50 21 00 00 1e 5b d1 00 78 a0 38 21 40
30 3c 36 00 6e e5 31 00 00 1e e8 bf 00 78 a0 38
21 40 3c 30 36 00 00 00 00 00 00 1e 00 00 00 e3

00 ff ff ff ff ff ff 00 0d 04 00 00 00 00 00 00
31 1f 01 03 80 45 1d 78 2c ee 95 a3 54 4c 99 26
0f 50 54 a7 cb 00 81 c0 81 80 95 00 01 01 b3 00
d1 c0 01 01 01 01 b8 47 00 a0 a0 38 2d 40 30 20
35 00 b3 23 21 00 00 1a 70 8f 00 a0 a0 38 2d 40
30 40 3a 00 55 50 21 00 00 1a 00 00 00 fd 00 30
c8 1e e9 3c 00 0a 20 20 20 20 20 20 00 00 00 fc
00 50 4d 47 33 30 43 39 30 30 57 46 47 0a 01 58

02 03 46 f1 4a 01 02 03 04 90 12 13 1f 04 5b 23
09 07 07 83 01 00 00 6a 03 0c 00 10 00 38 78 20
00 00 67 d8 5d c4 01 78 c0 00 6d 1a 00 00 02 01
30 c8 e6 00 00 00 00 00 e3 05 c0 00 e6 06 05 01
60 60 3a e2 00 d5 9e e8 00 78 a0 38 21 40 30 3c
36 00 56 50 21 00 00 1e 5b d1 00 78 a0 38 21 40
30 3c 36 00 6e e5 31 00 00 1e e8 bf 00 78 a0 38
21 40 3c 30 36 00 00 00 00 00 00 1e 00 00 00 e3

----------------

Block 0, Base EDID:
  EDID Structure Version & Revision: 1.3
  Vendor & Product Identification:
    Manufacturer: CHD
    Model: 0
    Made in: week 49 of 2021
  Basic Display Parameters & Features:
    Digital display
    Maximum image size: 69 cm x 29 cm
    Gamma: 2.20
    DPMS levels: Off
    RGB color display
    Default (sRGB) color space is primary color space
  Color Characteristics:
    Red  : 0.6396, 0.3300
    Green: 0.2998, 0.5996
    Blue : 0.1503, 0.0595
    White: 0.3134, 0.3291
  Established Timings I & II:
    IBM     :   720x400    70.081663 Hz   9:5     31.467 kHz     28.320000 MHz
    DMT 0x04:   640x480    59.940476 Hz   4:3     31.469 kHz     25.175000 MHz
    DMT 0x06:   640x480    75.000000 Hz   4:3     37.500 kHz     31.500000 MHz
    DMT 0x08:   800x600    56.250000 Hz   4:3     35.156 kHz     36.000000 MHz
    DMT 0x09:   800x600    60.316541 Hz   4:3     37.879 kHz     40.000000 MHz
    DMT 0x0a:   800x600    72.187572 Hz   4:3     48.077 kHz     50.000000 MHz
    DMT 0x0b:   800x600    75.000000 Hz   4:3     46.875 kHz     49.500000 MHz
    DMT 0x10:  1024x768    60.003840 Hz   4:3     48.363 kHz     65.000000 MHz
    DMT 0x12:  1024x768    75.028582 Hz   4:3     60.023 kHz     78.750000 MHz
    DMT 0x24:  1280x1024   75.024675 Hz   5:4     79.976 kHz    135.000000 MHz
  Standard Timings:
    DMT 0x55:  1280x720    60.000000 Hz  16:9     45.000 kHz     74.250000 MHz
    DMT 0x23:  1280x1024   60.019740 Hz   5:4     63.981 kHz    108.000000 MHz
    DMT 0x2f:  1440x900    59.887445 Hz  16:10    55.935 kHz    106.500000 MHz
    DMT 0x3a:  1680x1050   59.954250 Hz  16:10    65.290 kHz    146.250000 MHz
    DMT 0x52:  1920x1080   60.000000 Hz  16:9     67.500 kHz    148.500000 MHz
  Detailed Timing Descriptors:
    DTD 1:  2560x1080   60.000000 Hz  64:27    67.500 kHz    183.600000 MHz (691 mm x 291 mm)
                 Hfront   48 Hsync  32 Hback   80 Hpol P
                 Vfront    3 Vsync   5 Vback   37 Vpol N
    DTD 2:  2560x1080  120.000000 Hz  64:27   135.000 kHz    367.200000 MHz (597 mm x 336 mm)
                 Hfront   48 Hsync  64 Hback   48 Hpol P
                 Vfront    3 Vsync  10 Vback   32 Vpol N
    Display Range Limits:
      Monitor ranges (GTF): 48-200 Hz V, 30-233 kHz H, max dotclock 600 MHz
    Display Product Name: 'PMG30C900WFG'
  Extension blocks: 1
Checksum: 0x58

----------------

Block 1, CTA-861 Extension Block:
  Revision: 3
  Underscans IT Video Formats by default
  Basic audio support
  Supports YCbCr 4:4:4
  Supports YCbCr 4:2:2
  Native detailed modes: 1
  Video Data Block:
    VIC   1:   640x480    59.940476 Hz   4:3     31.469 kHz     25.175000 MHz
    VIC   2:   720x480    59.940060 Hz   4:3     31.469 kHz     27.000000 MHz
    VIC   3:   720x480    59.940060 Hz  16:9     31.469 kHz     27.000000 MHz
    VIC   4:  1280x720    60.000000 Hz  16:9     45.000 kHz     74.250000 MHz
    VIC  16:  1920x1080   60.000000 Hz  16:9     67.500 kHz    148.500000 MHz (native)
    VIC  18:   720x576    50.000000 Hz  16:9     31.250 kHz     27.000000 MHz
    VIC  19:  1280x720    50.000000 Hz  16:9     37.500 kHz     74.250000 MHz
    VIC  31:  1920x1080   50.000000 Hz  16:9     56.250 kHz    148.500000 MHz
    VIC   4:  1280x720    60.000000 Hz  16:9     45.000 kHz     74.250000 MHz
    VIC  91:  2560x1080  100.000000 Hz  64:27   125.000 kHz    371.250000 MHz
  Audio Data Block:
    Linear PCM:
      Max channels: 2
      Supported sample rates (kHz): 48 44.1 32
      Supported sample sizes (bits): 24 20 16
  Speaker Allocation Data Block:
    FL/FR - Front Left/Right
  Vendor-Specific Data Block (HDMI), OUI 00-0C-03:
    Source physical address: 1.0.0.0
    DC_36bit
    DC_30bit
    DC_Y444
    Maximum TMDS clock: 600 MHz
    Extended HDMI video details:
  Vendor-Specific Data Block (HDMI Forum), OUI C4-5D-D8:
    Version: 1
    Maximum TMDS Character Rate: 600 MHz
    SCDC Present
    SCDC Read Request Capable
  Vendor-Specific Data Block (AMD), OUI 00-00-1A:
    Version: 2
    Feature Caps: 0x01
    Minimum Refresh Rate: 48 Hz
    Maximum Refresh Rate: 200 Hz
    Flags 1.x: 0xe6 (MCCS)
    Flags 2.x: 0x00
  Colorimetry Data Block:
    BT2020YCC
    BT2020RGB
  HDR Static Metadata Data Block:
    Electro optical transfer functions:
      Traditional gamma - SDR luminance range
      SMPTE ST2084
    Supported static metadata descriptors:
      Static metadata type 1
    Desired content max luminance: 96 (400.000 cd/m^2)
    Desired content max frame-average luminance: 96 (400.000 cd/m^2)
    Desired content min luminance: 58 (0.207 cd/m^2)
  Video Capability Data Block:
    YCbCr quantization: Selectable (via AVI YQ)
    RGB quantization: Selectable (via AVI Q)
    PT scan behavior: Always Overscanned
    IT scan behavior: Always Overscanned
    CE scan behavior: Always Overscanned
  Detailed Timing Descriptors:
    DTD 3:  2560x1080  199.641952 Hz  64:27   222.201 kHz    595.500000 MHz (598 mm x 336 mm)
                 Hfront   48 Hsync  60 Hback   12 Hpol P
                 Vfront    3 Vsync   6 Vback   24 Vpol P
    DTD 4:  2560x1080  179.677757 Hz  64:27   199.981 kHz    535.950000 MHz (878 mm x 485 mm)
                 Hfront   48 Hsync  60 Hback   12 Hpol P
                 Vfront    3 Vsync   6 Vback   24 Vpol P
    DTD 5:  2560x1080  164.702096 Hz  64:27   183.313 kHz    491.280000 MHz
                 Hfront   60 Hsync  48 Hback   12 Hpol P
                 Vfront    3 Vsync   6 Vback   24 Vpol P
Checksum: 0xe3  Unused space in Extension Block: 3 bytes

----------------

Block 2, Unknown EDID Extension Block 0x00:
  00 ff ff ff ff ff ff 00 0d 04 00 00 00 00 00 00 '................'
  31 1f 01 03 80 45 1d 78 2c ee 95 a3 54 4c 99 26 '1....E.x,...TL.&'
  0f 50 54 a7 cb 00 81 c0 81 80 95 00 01 01 b3 00 '.PT.............'
  d1 c0 01 01 01 01 b8 47 00 a0 a0 38 2d 40 30 20 '.......G...8-@0 '
  35 00 b3 23 21 00 00 1a 70 8f 00 a0 a0 38 2d 40 '5..#!...p....8-@'
  30 40 3a 00 55 50 21 00 00 1a 00 00 00 fd 00 30 '0@:.UP!........0'
  c8 1e e9 3c 00 0a 20 20 20 20 20 20 00 00 00 fc '...<..      ....'
  00 50 4d 47 33 30 43 39 30 30 57 46 47 0a 01 58 '.PMG30C900WFG..X'
Checksum: 0x58

----------------

Block 3, CTA-861 Extension Block:
  Revision: 3
  Underscans IT Video Formats by default
  Basic audio support
  Supports YCbCr 4:4:4
  Supports YCbCr 4:2:2
  Native detailed modes: 1
  Video Data Block:
    VIC   1:   640x480    59.940476 Hz   4:3     31.469 kHz     25.175000 MHz
    VIC   2:   720x480    59.940060 Hz   4:3     31.469 kHz     27.000000 MHz
    VIC   3:   720x480    59.940060 Hz  16:9     31.469 kHz     27.000000 MHz
    VIC   4:  1280x720    60.000000 Hz  16:9     45.000 kHz     74.250000 MHz
    VIC  16:  1920x1080   60.000000 Hz  16:9     67.500 kHz    148.500000 MHz (native)
    VIC  18:   720x576    50.000000 Hz  16:9     31.250 kHz     27.000000 MHz
    VIC  19:  1280x720    50.000000 Hz  16:9     37.500 kHz     74.250000 MHz
    VIC  31:  1920x1080   50.000000 Hz  16:9     56.250 kHz    148.500000 MHz
    VIC   4:  1280x720    60.000000 Hz  16:9     45.000 kHz     74.250000 MHz
    VIC  91:  2560x1080  100.000000 Hz  64:27   125.000 kHz    371.250000 MHz
  Audio Data Block:
    Linear PCM:
      Max channels: 2
      Supported sample rates (kHz): 48 44.1 32
      Supported sample sizes (bits): 24 20 16
  Speaker Allocation Data Block:
    FL/FR - Front Left/Right
  Vendor-Specific Data Block (HDMI), OUI 00-0C-03:
    Source physical address: 1.0.0.0
    DC_36bit
    DC_30bit
    DC_Y444
    Maximum TMDS clock: 600 MHz
    Extended HDMI video details:
  Vendor-Specific Data Block (HDMI Forum), OUI C4-5D-D8:
    Version: 1
    Maximum TMDS Character Rate: 600 MHz
    SCDC Present
    SCDC Read Request Capable
  Vendor-Specific Data Block (AMD), OUI 00-00-1A:
    Version: 2
    Feature Caps: 0x01
    Minimum Refresh Rate: 48 Hz
    Maximum Refresh Rate: 200 Hz
    Flags 1.x: 0xe6 (MCCS)
    Flags 2.x: 0x00
  Colorimetry Data Block:
    BT2020YCC
    BT2020RGB
  HDR Static Metadata Data Block:
    Electro optical transfer functions:
      Traditional gamma - SDR luminance range
      SMPTE ST2084
    Supported static metadata descriptors:
      Static metadata type 1
    Desired content max luminance: 96 (400.000 cd/m^2)
    Desired content max frame-average luminance: 96 (400.000 cd/m^2)
    Desired content min luminance: 58 (0.207 cd/m^2)
  Video Capability Data Block:
    YCbCr quantization: Selectable (via AVI YQ)
    RGB quantization: Selectable (via AVI Q)
    PT scan behavior: Always Overscanned
    IT scan behavior: Always Overscanned
    CE scan behavior: Always Overscanned
  Detailed Timing Descriptors:
    DTD 6:  2560x1080  199.641952 Hz  64:27   222.201 kHz    595.500000 MHz (598 mm x 336 mm)
                 Hfront   48 Hsync  60 Hback   12 Hpol P
                 Vfront    3 Vsync   6 Vback   24 Vpol P
    DTD 7:  2560x1080  179.677757 Hz  64:27   199.981 kHz    535.950000 MHz (878 mm x 485 mm)
                 Hfront   48 Hsync  60 Hback   12 Hpol P
                 Vfront    3 Vsync   6 Vback   24 Vpol P
    DTD 8:  2560x1080  164.702096 Hz  64:27   183.313 kHz    491.280000 MHz
                 Hfront   60 Hsync  48 Hback   12 Hpol P
                 Vfront    3 Vsync   6 Vback   24 Vpol P
Checksum: 0xe3  Unused space in Extension Block: 3 bytes

----------------

Warnings:

Block 0, Base EDID:
  Detailed Timing Descriptor #2: Image size is 597x336 mm, but based on the picture AR it should be 597x251 mm.
Block 1, CTA-861 Extension Block:
  Video Data Block: VIC 1 and the first DTD are not identical. Is this intended?
  Video Capability Data Block: IT scan behavior is expected to support underscanned.
  Video Capability Data Block: S_PT is equal to S_IT and S_CE, so should be set to 0 instead.
  Detailed Timing Descriptor #3: Image size is 598x336 mm, but based on the picture AR it should be 598x252 mm.
  Detailed Timing Descriptor #4: Image size is 878x485 mm, but based on the picture AR it should be 878x370 mm.
Block 3, CTA-861 Extension Block:
  Video Capability Data Block: IT scan behavior is expected to support underscanned.
  Video Capability Data Block: S_PT is equal to S_IT and S_CE, so should be set to 0 instead.
  Detailed Timing Descriptor #6: Image size is 598x336 mm, but based on the picture AR it should be 598x252 mm.
  Detailed Timing Descriptor #7: Image size is 878x485 mm, but based on the picture AR it should be 878x370 mm.

Failures:

Block 0, Base EDID:
  Basic Display Parameters & Features: sRGB is signaled, but the chromaticities do not match.
  Basic Display Parameters & Features: EDID 1.3 requires that the first detailed timing is the preferred timing.
  Detailed Timing Descriptor #2: Mismatch of image size 597x336 mm vs display size 690x290 mm.
Block 1, CTA-861 Extension Block:
  Video Data Block: Duplicate VIC 4.
  Vendor-Specific Data Block (HDMI), OUI 00-0C-03: HDMI VSDB Max TMDS rate is > 340.
  Video Capability Data Block: IT video formats are always overscanned, but bit 7 of Byte 3 of the CTA-861 Extension header is set to underscanned.
  Detailed Timing Descriptor #3: Mismatch of image size 598x336 mm vs display size 690x290 mm.
  Detailed Timing Descriptor #4: Mismatch of image size 878x485 mm vs display size 690x290 mm.
  Detailed Timing Descriptor #5: Mismatch of image size vs display size: image size is not set, but display size is.
Block 2, Base EDID:
  Unknown Extension Block.
Block 3, CTA-861 Extension Block:
  Video Data Block: Duplicate VIC 1.
  Video Data Block: Duplicate VIC 2.
  Video Data Block: Duplicate VIC 3.
  Video Data Block: Duplicate VIC 16.
  Video Data Block: Duplicate VIC 18.
  Video Data Block: Duplicate VIC 19.
  Video Data Block: Duplicate VIC 31.
  Video Data Block: Duplicate VIC 91.
  Speaker Allocation Data Block: Only one instance of this Data Block is allowed.
  Vendor-Specific Data Block (HDMI), OUI 00-0C-03: HDMI VSDB Max TMDS rate is > 340.
  Vendor-Specific Data Block (HDMI Forum), OUI C4-5D-D8: Duplicate HDMI Forum VSDB/SCDB.
  Colorimetry Data Block: Only one instance of this Data Block is allowed.
  HDR Static Metadata Data Block: Only one instance of this Data Block is allowed.
  Video Capability Data Block: Only one instance of this Data Block is allowed.
  Video Capability Data Block: IT video formats are always overscanned, but bit 7 of Byte 3 of the CTA-861 Extension header is set to underscanned.
  Detailed Timing Descriptor #6: Mismatch of image size 598x336 mm vs display size 690x290 mm.
  Detailed Timing Descriptor #7: Mismatch of image size 878x485 mm vs display size 690x290 mm.
  Detailed Timing Descriptor #8: Mismatch of image size vs display size: image size is not set, but display size is.
EDID:
  Base EDID: The DTD max image size is 878x485mm, which is larger than the display size 690.0x290.0mm.
  Base EDID: EDID specified 1 extension block(s), but found 3 extension block(s).
  Base EDID: EDID 1.3 requires a Block Map Extension in Block 1 if there are more than 2 blocks in the EDID.
  CTA-861: Native progressive timings are a mix of several resolutions.

EDID conformity: FAIL
