edid-decode (hex):

00 ff ff ff ff ff ff 00 15 85 01 00 00 00 00 00
10 20 01 04 b5 46 27 78 3f 7c 85 a2 59 53 9c 24
0c 50 54 a5 4b 00 81 c0 81 00 81 40 81 80 95 00
a9 c0 b3 00 01 01 70 62 00 f0 a0 a0 3c 50 30 20
35 00 bc 86 21 00 00 1a 00 00 00 fd 00 30 4b 73
73 3c 01 0a 20 20 20 20 20 20 00 00 00 fc 00 45
4d 33 46 50 41 43 33 32 42 43 0a 20 00 00 00 ff
00 30 30 30 30 30 30 30 30 30 30 30 30 30 01 23

02 03 1b f1 45 01 02 03 04 90 23 09 1f 07 83 01
00 00 68 1a 00 00 01 01 30 4b 00 04 76 00 a0 a0
a0 29 50 30 20 35 00 bc 86 21 00 00 1a 02 3a 80
18 71 38 2d 40 58 2c 45 00 bc 86 21 00 00 7f ba
47 80 18 71 38 2d 40 30 20 35 00 bc 86 21 00 00
7f 00 00 00 00 00 00 00 00 00 00 00 00 00 00 00
00 00 00 00 00 00 00 00 00 00 00 00 00 00 00 00
00 00 00 00 00 00 00 00 00 00 00 00 00 00 00 bb

00 ff ff ff ff ff ff 00 15 85 01 00 00 00 00 00
10 20 01 04 b5 46 27 78 3f 7c 85 a2 59 53 9c 24
0c 50 54 a5 4b 00 81 c0 81 00 81 40 81 80 95 00
a9 c0 b3 00 01 01 70 62 00 f0 a0 a0 3c 50 30 20
35 00 bc 86 21 00 00 1a 00 00 00 fd 00 30 4b 73
73 3c 01 0a 20 20 20 20 20 20 00 00 00 fc 00 45
4d 33 46 50 41 43 33 32 42 43 0a 20 00 00 00 ff
00 30 30 30 30 30 30 30 30 30 30 30 30 30 01 23

02 03 1b f1 45 01 02 03 04 90 23 09 1f 07 83 01
00 00 68 1a 00 00 01 01 30 4b 00 04 76 00 a0 a0
a0 29 50 30 20 35 00 bc 86 21 00 00 1a 02 3a 80
18 71 38 2d 40 58 2c 45 00 bc 86 21 00 00 7f ba
47 80 18 71 38 2d 40 30 20 35 00 bc 86 21 00 00
7f 00 00 00 00 00 00 00 00 00 00 00 00 00 00 00
00 00 00 00 00 00 00 00 00 00 00 00 00 00 00 00
00 00 00 00 00 00 00 00 00 00 00 00 00 00 00 bb

----------------

Block 0, Base EDID:
  EDID Structure Version & Revision: 1.4
  Vendor & Product Identification:
    Manufacturer: ELE
    Model: 1
    Made in: week 16 of 2022
  Basic Display Parameters & Features:
    Digital display
    Bits per primary color channel: 10
    DisplayPort interface
    Maximum image size: 70 cm x 39 cm
    Gamma: 2.20
    DPMS levels: Off
    Supported color formats: RGB 4:4:4, YCrCb 4:4:4, YCrCb 4:2:2
    Default (sRGB) color space is primary color space
    First detailed timing includes the native pixel format and preferred refresh rate
    Display supports continuous frequencies
  Color Characteristics:
    Red  : 0.6337, 0.3505
    Green: 0.3271, 0.6093
    Blue : 0.1425, 0.0468
    White: 0.3134, 0.3291
  Established Timings I & II:
    IBM     :   720x400    70.081663 Hz   9:5     31.467 kHz     28.320000 MHz
    DMT 0x04:   640x480    59.940476 Hz   4:3     31.469 kHz     25.175000 MHz
    DMT 0x06:   640x480    75.000000 Hz   4:3     37.500 kHz     31.500000 MHz
    DMT 0x09:   800x600    60.316541 Hz   4:3     37.879 kHz     40.000000 MHz
    DMT 0x0b:   800x600    75.000000 Hz   4:3     46.875 kHz     49.500000 MHz
    DMT 0x10:  1024x768    60.003840 Hz   4:3     48.363 kHz     65.000000 MHz
    DMT 0x12:  1024x768    75.028582 Hz   4:3     60.023 kHz     78.750000 MHz
    DMT 0x24:  1280x1024   75.024675 Hz   5:4     79.976 kHz    135.000000 MHz
  Standard Timings:
    DMT 0x55:  1280x720    60.000000 Hz  16:9     45.000 kHz     74.250000 MHz
    DMT 0x1c:  1280x800    59.810326 Hz  16:10    49.702 kHz     83.500000 MHz
    DMT 0x20:  1280x960    60.000000 Hz   4:3     60.000 kHz    108.000000 MHz
    DMT 0x23:  1280x1024   60.019740 Hz   5:4     63.981 kHz    108.000000 MHz
    DMT 0x2f:  1440x900    59.887445 Hz  16:10    55.935 kHz    106.500000 MHz
    DMT 0x53:  1600x900    60.000000 Hz  16:9     60.000 kHz    108.000000 MHz (RB)
    DMT 0x3a:  1680x1050   59.954250 Hz  16:10    65.290 kHz    146.250000 MHz
  Detailed Timing Descriptors:
    DTD 1:  2560x1440   60.000000 Hz  16:9     90.000 kHz    252.000000 MHz (700 mm x 390 mm)
                 Hfront   48 Hsync  32 Hback  160 Hpol P
                 Vfront    3 Vsync   5 Vback   52 Vpol N
    Display Range Limits:
      Monitor ranges (Range Limits Only): 48-75 Hz V, 115-115 kHz H, max dotclock 600 MHz
    Display Product Name: 'EM3FPAC32BC'
    Display Product Serial Number: ...
  Extension blocks: 1
Checksum: 0x23

----------------

Block 1, CTA-861 Extension Block:
  Revision: 3
  Underscans IT Video Formats by default
  Basic audio support
  Supports YCbCr 4:4:4
  Supports YCbCr 4:2:2
  Native DTDs: 1
  Video Data Block:
    VIC   1:   640x480    59.940476 Hz   4:3     31.469 kHz     25.175000 MHz
    VIC   2:   720x480    59.940060 Hz   4:3     31.469 kHz     27.000000 MHz
    VIC   3:   720x480    59.940060 Hz  16:9     31.469 kHz     27.000000 MHz
    VIC   4:  1280x720    60.000000 Hz  16:9     45.000 kHz     74.250000 MHz
    VIC  16:  1920x1080   60.000000 Hz  16:9     67.500 kHz    148.500000 MHz (native)
  Audio Data Block:
    Linear PCM:
      Max channels: 2
      Supported sample rates (kHz): 96 88.2 48 44.1 32
      Supported sample sizes (bits): 24 20 16
  Speaker Allocation Data Block:
    FL/FR - Front Left/Right
  Vendor-Specific Data Block (AMD), OUI 00-00-1A:
    Version: 1
    Feature Caps: 0x01
    Minimum Refresh Rate: 48 Hz
    Maximum Refresh Rate: 75 Hz
    Flags 1.x: 0x00
  Detailed Timing Descriptors:
    DTD 2:  2560x1440   74.999007 Hz  16:9    111.074 kHz    302.120000 MHz (700 mm x 390 mm)
                 Hfront   48 Hsync  32 Hback   80 Hpol P
                 Vfront    3 Vsync   5 Vback   33 Vpol N
    DTD 3:  1920x1080   60.000000 Hz  16:9     67.500 kHz    148.500000 MHz (side by side interleaved, 700 mm x 390 mm)
                 Hfront   88 Hsync  44 Hback  148 Hpol P
                 Vfront    4 Vsync   5 Vback   36 Vpol P
    DTD 4:  1920x1080   74.189899 Hz  16:9     83.464 kHz    183.620000 MHz (side by side interleaved, 700 mm x 390 mm)
                 Hfront   48 Hsync  32 Hback  200 Hpol P
                 Vfront    3 Vsync   5 Vback   37 Vpol P
Checksum: 0xbb  Unused space in Extension Block: 46 bytes

----------------

Warnings:

Block 0, Base EDID:
  Display Product Serial Number: ...
Block 1, CTA-861 Extension Block:
  Video Data Block: VIC 1 and the first DTD are not identical. Is this intended?
  Video Data Block: All VICs are in ascending order, and the first (preferred) VIC <= 4, is that intended?
EDID:
  Base EDID: Some timings are out of range of the Monitor Ranges:
    Horizontal Freq: 31.466 - 111.073 kHz (Monitor: 115.000 - 115.000 kHz)

Failures:

Block 0, Base EDID:
  Basic Display Parameters & Features: sRGB is signaled, but the chromaticities do not match.
Block 1, CTA-861 Extension Block:
  Missing VCDB, needed for Set Selectable RGB Quantization to avoid interop issues.
EDID:
  Extension Block 2 started with EDID header, ignoring Extension Blocks >= 2.
  CTA-861: Native progressive timings are a mix of several resolutions.

EDID conformity: FAIL
