edid-decode (hex):

00 ff ff ff ff ff ff 00 4c 2d c3 72 00 00 00 00
17 20 01 03 80 79 44 78 2a cc 95 ad 4f 47 aa 24
0d 50 54 25 cf 00 71 4f 81 00 81 c0 81 80 95 00
a9 c0 b3 00 01 01 08 e8 00 30 f2 70 5a 80 b0 58
8a 00 ba a8 42 00 00 1e 00 00 00 fd 00 1e a5 1e
ff 9b 00 0a 20 20 20 20 20 20 00 00 00 fc 00 4f
64 79 73 73 65 79 20 41 72 6b 0a 20 00 00 00 ff
00 48 31 41 4b 35 30 30 30 30 30 0a 20 20 01 37

02 03 63 f0 e2 78 03 47 61 10 3f 04 03 5f 76 2f
0d 57 07 09 07 07 15 07 50 57 07 01 67 54 03 83
0f 00 00 e2 00 4f e3 05 c0 00 6b 03 0c 00 10 00
b8 3c 28 00 20 01 6d d8 5d c4 01 78 80 5b 02 30
a5 c1 34 05 6d 1a 00 00 02 0f 30 a5 00 04 91 05
75 0f e6 06 05 01 8b 73 02 e3 0f 41 00 e5 01 8b
84 90 79 6f c2 00 a0 a0 a0 55 50 30 20 35 00 ba
a8 42 00 00 1a 00 00 00 00 00 00 00 00 00 00 da

00 ff ff ff ff ff ff 00 4c 2d c3 72 00 00 00 00
17 20 01 03 80 79 44 78 2a cc 95 ad 4f 47 aa 24
0d 50 54 25 cf 00 71 4f 81 00 81 c0 81 80 95 00
a9 c0 b3 00 01 01 08 e8 00 30 f2 70 5a 80 b0 58
8a 00 ba a8 42 00 00 1e 00 00 00 fd 00 1e a5 1e
ff 9b 00 0a 20 20 20 20 20 20 00 00 00 fc 00 4f
64 79 73 73 65 79 20 41 72 6b 0a 20 00 00 00 ff
00 48 31 41 4b 35 30 30 30 30 30 0a 20 20 01 37

02 03 63 f0 e2 78 03 47 61 10 3f 04 03 5f 76 2f
0d 57 07 09 07 07 15 07 50 57 07 01 67 54 03 83
0f 00 00 e2 00 4f e3 05 c0 00 6b 03 0c 00 10 00
b8 3c 28 00 20 01 6d d8 5d c4 01 78 80 5b 02 30
a5 c1 34 05 6d 1a 00 00 02 0f 30 a5 00 04 91 05
75 0f e6 06 05 01 8b 73 02 e3 0f 41 00 e5 01 8b
84 90 79 6f c2 00 a0 a0 a0 55 50 30 20 35 00 ba
a8 42 00 00 1a 00 00 00 00 00 00 00 00 00 00 da

----------------

Block 0, Base EDID:
  EDID Structure Version & Revision: 1.3
  Vendor & Product Identification:
    Manufacturer: SAM
    Model: 29379
    Made in: week 23 of 2022
  Basic Display Parameters & Features:
    Digital display
    Maximum image size: 121 cm x 68 cm
    Gamma: 2.20
    DPMS levels: Off
    RGB color display
    First detailed timing is the preferred timing
  Color Characteristics:
    Red  : 0.6787, 0.3085
    Green: 0.2802, 0.6640
    Blue : 0.1425, 0.0517
    White: 0.3134, 0.3291
  Established Timings I & II:
    DMT 0x04:   640x480    59.940476 Hz   4:3     31.469 kHz     25.175000 MHz
    DMT 0x06:   640x480    75.000000 Hz   4:3     37.500 kHz     31.500000 MHz
    DMT 0x09:   800x600    60.316541 Hz   4:3     37.879 kHz     40.000000 MHz
    DMT 0x0a:   800x600    72.187572 Hz   4:3     48.077 kHz     50.000000 MHz
    DMT 0x0b:   800x600    75.000000 Hz   4:3     46.875 kHz     49.500000 MHz
    DMT 0x10:  1024x768    60.003840 Hz   4:3     48.363 kHz     65.000000 MHz
    DMT 0x11:  1024x768    70.069359 Hz   4:3     56.476 kHz     75.000000 MHz
    DMT 0x12:  1024x768    75.028582 Hz   4:3     60.023 kHz     78.750000 MHz
    DMT 0x24:  1280x1024   75.024675 Hz   5:4     79.976 kHz    135.000000 MHz
  Standard Timings:
    DMT 0x15:  1152x864    75.000000 Hz   4:3     67.500 kHz    108.000000 MHz
    DMT 0x1c:  1280x800    59.810326 Hz  16:10    49.702 kHz     83.500000 MHz
    DMT 0x55:  1280x720    60.000000 Hz  16:9     45.000 kHz     74.250000 MHz
    DMT 0x23:  1280x1024   60.019740 Hz   5:4     63.981 kHz    108.000000 MHz
    DMT 0x2f:  1440x900    59.887445 Hz  16:10    55.935 kHz    106.500000 MHz
    DMT 0x53:  1600x900    60.000000 Hz  16:9     60.000 kHz    108.000000 MHz (RB)
    DMT 0x3a:  1680x1050   59.954250 Hz  16:10    65.290 kHz    146.250000 MHz
  Detailed Timing Descriptors:
    DTD 1:  3840x2160   60.000000 Hz  16:9    135.000 kHz    594.000000 MHz (1210 mm x 680 mm)
                 Hfront  176 Hsync  88 Hback  296 Hpol P
                 Vfront    8 Vsync  10 Vback   72 Vpol P
    Display Range Limits:
      Monitor ranges (GTF): 30-165 Hz V, 30-255 kHz H, max dotclock 1550 MHz
    Display Product Name: 'Odyssey Ark'
    Display Product Serial Number: ...
  Extension blocks: 1
Checksum: 0x37

----------------

Block 1, CTA-861 Extension Block:
  Revision: 3
  Underscans IT Video Formats by default
  Basic audio support
  Supports YCbCr 4:4:4
  Supports YCbCr 4:2:2
  Native DTDs: 0
  HDMI Forum EDID Extension Override Data Block:
    EDID Extension Block Count: 3
  Video Data Block:
    VIC  97:  3840x2160   60.000000 Hz  16:9    135.000 kHz    594.000000 MHz
    VIC  16:  1920x1080   60.000000 Hz  16:9     67.500 kHz    148.500000 MHz
    VIC  63:  1920x1080  120.000000 Hz  16:9    135.000 kHz    297.000000 MHz
    VIC   4:  1280x720    60.000000 Hz  16:9     45.000 kHz     74.250000 MHz
    VIC   3:   720x480    59.940060 Hz  16:9     31.469 kHz     27.000000 MHz
    VIC  95:  3840x2160   30.000000 Hz  16:9     67.500 kHz    297.000000 MHz
    VIC 118:  3840x2160  120.000000 Hz  16:9    270.000 kHz   1188.000000 MHz
  Audio Data Block:
    Linear PCM:
      Max channels: 6
      Supported sample rates (kHz): 192 96 48 44.1 32
      Supported sample sizes (bits): 24 20 16
    Linear PCM:
      Max channels: 2
      Supported sample rates (kHz): 48 44.1 32
      Supported sample sizes (bits): 24 20 16
    AC-3:
      Max channels: 6
      Supported sample rates (kHz): 48 44.1 32
      Maximum bit rate: 640 kb/s
    Enhanced AC-3 (DD+):
      Max channels: 8
      Supported sample rates (kHz): 48 44.1 32
      Supports Joint Object Coding
    MAT (MLP):
      Max channels: 8
      Supported sample rates (kHz): 192 96 48
      Supports Dolby TrueHD, object audio PCM and channel-based PCM
      Hash calculation not required for object audio PCM or channel-based PCM
  Speaker Allocation Data Block:
    FL/FR - Front Left/Right
    LFE1 - Low Frequency Effects 1
    FC - Front Center
    LS/RS - Left/Right Surround
  Video Capability Data Block:
    YCbCr quantization: No Data
    RGB quantization: Selectable (via AVI Q)
    PT scan behavior: No Data
    IT scan behavior: Supports both over- and underscan
    CE scan behavior: Supports both over- and underscan
  Colorimetry Data Block:
    BT2020YCC
    BT2020RGB
  Vendor-Specific Data Block (HDMI), OUI 00-0C-03:
    Source physical address: 1.0.0.0
    Supports_AI
    DC_36bit
    DC_30bit
    DC_Y444
    Maximum TMDS clock: 300 MHz
    Supported Content Types:
      Game
    Extended HDMI video details:
      HDMI VICs:
        HDMI VIC 1:  3840x2160   30.000000 Hz  16:9     67.500 kHz    297.000000 MHz
  Vendor-Specific Data Block (HDMI Forum), OUI C4-5D-D8:
    Version: 1
    Maximum TMDS Character Rate: 600 MHz
    SCDC Present
    Max Fixed Rate Link: 3 and 6 Gbps per lane on 3 lanes, 6, 8 and 10 Gbps on 4 lanes
    Supports UHD VIC
    Supports 12-bits/component Deep Color 4:2:0 Pixel Encoding
    Supports 10-bits/component Deep Color 4:2:0 Pixel Encoding
    Supports Auto Low-Latency Mode
    VRRmin: 48 Hz
    VRRmax: 165 Hz
    Supports VESA DSC 1.2a compression
    Supports Compressed Video Transport for 4:2:0 Pixel Encoding
    Supports 10 bpc Compressed Video Transport
    DSC Max Slices: up to 8 slices and up to (340 MHz/Ksliceadjust) pixel clock per slice
    DSC Max Fixed Rate Link: 3 and 6 Gbps per lane on 3 lanes, 6 Gbps on 4 lanes
    Maximum number of bytes in a line of chunks: 6144
  Vendor-Specific Data Block (AMD), OUI 00-00-1A:
    Version: 2
    Flags 1: 0x0f
      FreeSync Supported
      FreeSync 2 HDR Supported
      Global Backlight Control Supported
      Local Dimming Supported
    Minimum Refresh Rate: 48 Hz
    Maximum Refresh Rate: 165 Hz
    Flags 5: 0x04
      Gamma 2.2 EOTF Supported
    Maximum luminance: 145 (1156.145 cd/m^2)
    Minimum luminance: 5 (0.004 cd/m^2)
    Maximum luminance (without local dimming): 117 (630.392 cd/m^2)
    Minimum luminance (without local dimming): 15 (0.022 cd/m^2)
  HDR Static Metadata Data Block:
    Electro optical transfer functions:
      Traditional gamma - SDR luminance range
      SMPTE ST2084
    Supported static metadata descriptors:
      Static metadata type 1
    Desired content max luminance: 139 (1015.241 cd/m^2)
    Desired content max frame-average luminance: 115 (603.666 cd/m^2)
    Desired content min luminance: 2 (0.001 cd/m^2)
  YCbCr 4:2:0 Capability Map Data Block:
    VIC  97:  3840x2160   60.000000 Hz  16:9    135.000 kHz    594.000000 MHz
    VIC 118:  3840x2160  120.000000 Hz  16:9    270.000 kHz   1188.000000 MHz
  Vendor-Specific Video Data Block (HDR10+), OUI 90-84-8B:
    Application Version: 1
    Full Frame Peak Luminance Index: 2
    Peak Luminance Index: 7
  Detailed Timing Descriptors:
    DTD 2:  2560x1440  119.997589 Hz  16:9    182.996 kHz    497.750000 MHz (1210 mm x 680 mm)
                 Hfront   48 Hsync  32 Hback   80 Hpol P
                 Vfront    3 Vsync   5 Vback   77 Vpol N
Checksum: 0xda  Unused space in Extension Block: 10 bytes

----------------

Warnings:

Block 0, Base EDID:
  Display Product Serial Number: ...
Block 1, CTA-861 Extension Block:
  Video Data Block: For improved preferred timing interoperability, set 'Native DTDs' to 1.
  Video Capability Data Block: Set Selectable YCbCr Quantization to avoid interop issues.
  Colorimetry Data Block: Set the sRGB colorimetry bit to avoid interop issues.

Failures:

EDID:
  Extension Block 2 started with EDID header, ignoring Extension Blocks >= 2.
  Base EDID: HDMI Forum EDID Extension Override Data Block specified 3 extension block(s), but found 1 extension block(s).

EDID conformity: FAIL
