edid-decode (hex):

00 ff ff ff ff ff ff 00 4c 2d d4 03 00 00 00 00
33 11 01 03 80 10 09 8c 0a e5 b1 a3 55 49 99 83
13 50 54 20 00 00 01 01 01 01 01 01 01 01 01 01
01 01 01 01 01 01 01 1d 00 72 51 d0 1e 20 6e 28
55 00 a0 5a 00 00 00 1e 01 1d 00 bc 52 d0 1e 20
b8 28 55 40 a0 5a 00 00 00 1e 00 00 00 fd 00 17
3c 1a 44 0f 00 0a 20 20 20 20 20 20 00 00 00 fc
00 53 41 4d 53 55 4e 47 0a 20 20 20 20 20 01 60

02 03 1f 71 4b 00 13 00 00 03 12 10 1f 20 21 22
23 09 07 07 83 01 00 00 66 03 0c 00 30 00 80 01
1d 80 18 71 1c 16 20 58 2c 25 00 a0 5a 00 00 00
9e 01 1d 80 d0 72 1c 16 20 10 2c 25 80 a0 5a 00
00 00 9e 8c 0a d0 8a 20 e0 2d 10 10 3e 96 00 a0
5a 00 00 00 18 8c 0a d0 90 20 40 31 20 0c 40 55
00 a0 5a 00 00 00 18 02 3a 80 18 71 38 2d 40 58
2c 45 00 a0 5a 00 00 00 1e 00 00 00 00 00 00 d6

00 ff ff ff ff ff ff 00 4c 2d d4 03 00 00 00 00
33 11 01 03 80 10 09 8c 0a e5 b1 a3 55 49 99 83
13 50 54 20 00 00 01 01 01 01 01 01 01 01 01 01
01 01 01 01 01 01 01 1d 00 72 51 d0 1e 20 6e 28
55 00 a0 5a 00 00 00 1e 01 1d 00 bc 52 d0 1e 20
b8 28 55 40 a0 5a 00 00 00 1e 00 00 00 fd 00 17
3c 1a 44 0f 00 0a 20 20 20 20 20 20 00 00 00 fc
00 53 41 4d 53 55 4e 47 0a 20 20 20 20 20 01 60

02 03 1f 71 4b 00 13 00 00 03 12 10 1f 20 21 22
23 09 07 07 83 01 00 00 66 03 0c 00 30 00 80 01
1d 80 18 71 1c 16 20 58 2c 25 00 a0 5a 00 00 00
9e 01 1d 80 d0 72 1c 16 20 10 2c 25 80 a0 5a 00
00 00 9e 8c 0a d0 8a 20 e0 2d 10 10 3e 96 00 a0
5a 00 00 00 18 8c 0a d0 90 20 40 31 20 0c 40 55
00 a0 5a 00 00 00 18 02 3a 80 18 71 38 2d 40 58
2c 45 00 a0 5a 00 00 00 1e 00 00 00 00 00 00 d6

----------------

Block 0, Base EDID:
  EDID Structure Version & Revision: 1.3
  Vendor & Product Identification:
    Manufacturer: SAM
    Model: 980
    Made in: week 51 of 2007
  Basic Display Parameters & Features:
    Digital display
    Maximum image size: 16 cm x 9 cm
    Gamma: 2.40
    RGB color display
    First detailed timing is the preferred timing
  Color Characteristics:
    Red  : 0.6396, 0.3339
    Green: 0.2861, 0.5986
    Blue : 0.5136, 0.0771
    White: 0.3125, 0.3291
  Established Timings I & II:
    DMT 0x04:   640x480    59.940476 Hz   4:3     31.469 kHz     25.175000 MHz
  Standard Timings: none
  Detailed Timing Descriptors:
    DTD 1:  1280x720    60.000000 Hz  16:9     45.000 kHz     74.250000 MHz (160 mm x 90 mm)
                 Hfront  110 Hsync  40 Hback  220 Hpol P
                 Vfront    5 Vsync   5 Vback   20 Vpol P
    DTD 2:  1280x720    50.000000 Hz  16:9     37.500 kHz     74.250000 MHz (160 mm x 90 mm)
                 Hfront  440 Hsync  40 Hback  220 Hpol P
                 Vfront    5 Vsync   5 Vback   20 Vpol P
    Display Range Limits:
      Monitor ranges (GTF): 23-60 Hz V, 26-68 kHz H, max dotclock 150 MHz
    Display Product Name: 'SAMSUNG'
  Extension blocks: 1
Checksum: 0x60

----------------

Block 1, CTA-861 Extension Block:
  Revision: 3
  Basic audio support
  Supports YCbCr 4:4:4
  Supports YCbCr 4:2:2
  Native DTDs: 1
  Video Data Block:
    VIC  19:  1280x720    50.000000 Hz  16:9     37.500 kHz     74.250000 MHz
    VIC   3:   720x480    59.940060 Hz  16:9     31.469 kHz     27.000000 MHz
    VIC  18:   720x576    50.000000 Hz  16:9     31.250 kHz     27.000000 MHz
    VIC  16:  1920x1080   60.000000 Hz  16:9     67.500 kHz    148.500000 MHz
    VIC  31:  1920x1080   50.000000 Hz  16:9     56.250 kHz    148.500000 MHz
    VIC  32:  1920x1080   24.000000 Hz  16:9     27.000 kHz     74.250000 MHz
    VIC  33:  1920x1080   25.000000 Hz  16:9     28.125 kHz     74.250000 MHz
    VIC  34:  1920x1080   30.000000 Hz  16:9     33.750 kHz     74.250000 MHz
  Audio Data Block:
    Linear PCM:
      Max channels: 2
      Supported sample rates (kHz): 48 44.1 32
      Supported sample sizes (bits): 24 20 16
  Speaker Allocation Data Block:
    FL/FR - Front Left/Right
  Vendor-Specific Data Block (HDMI), OUI 00-0C-03:
    Source physical address: 3.0.0.0
    Supports_AI
  Detailed Timing Descriptors:
    DTD 3:  1920x1080i  60.000000 Hz  16:9     33.750 kHz     74.250000 MHz (160 mm x 90 mm)
                 Hfront   88 Hsync  44 Hback  148 Hpol P
                 Vfront    2 Vsync   5 Vback   15 Vpol P Vfront +0.5 Odd Field
                 Vfront    2 Vsync   5 Vback   15 Vpol P Vback  +0.5 Even Field
    DTD 4:  1920x1080i  50.000000 Hz  16:9     28.125 kHz     74.250000 MHz (160 mm x 90 mm)
                 Hfront  528 Hsync  44 Hback  148 Hpol P
                 Vfront    2 Vsync   5 Vback   15 Vpol P Vfront +0.5 Odd Field
                 Vfront    2 Vsync   5 Vback   15 Vpol P Vback  +0.5 Even Field
    DTD 5:   720x480    59.940060 Hz   3:2     31.469 kHz     27.000000 MHz (160 mm x 90 mm)
                 Hfront   16 Hsync  62 Hback   60 Hpol N
                 Vfront    9 Vsync   6 Vback   30 Vpol N
    DTD 6:   720x576    50.000000 Hz   5:4     31.250 kHz     27.000000 MHz (160 mm x 90 mm)
                 Hfront   12 Hsync  64 Hback   68 Hpol N
                 Vfront    5 Vsync   5 Vback   39 Vpol N
    DTD 7:  1920x1080   60.000000 Hz  16:9     67.500 kHz    148.500000 MHz (160 mm x 90 mm)
                 Hfront   88 Hsync  44 Hback  148 Hpol P
                 Vfront    4 Vsync   5 Vback   36 Vpol P
Checksum: 0xd6  Unused space in Extension Block: 6 bytes

----------------

Warnings:

Block 0, Base EDID:
  Basic Display Parameters & Features: Dubious maximum image size (16x9 is smaller than 10x10 cm).
  Detailed Timing Descriptor #1: DTD is identical to VIC 4, which is not present in the CTA Ext Block.
  Detailed Timing Descriptor #1: Dubious image size (160x90 mm is smaller than 100x100 mm).
  Detailed Timing Descriptor #2: Dubious image size (160x90 mm is smaller than 100x100 mm).
Block 1, CTA-861 Extension Block:
  IT Video Formats are overscanned by default, but normally this should be underscanned.
  Video Data Block: VIC 19 and the first DTD are not identical. Is this intended?
  Detailed Timing Descriptor #3: DTD is identical to VIC 5, which is not present in the CTA Ext Block.
  Detailed Timing Descriptor #3: Dubious image size (160x90 mm is smaller than 100x100 mm).
  Detailed Timing Descriptor #4: DTD is identical to VIC 20, which is not present in the CTA Ext Block.
  Detailed Timing Descriptor #4: Dubious image size (160x90 mm is smaller than 100x100 mm).
  Detailed Timing Descriptor #5: Dubious image size (160x90 mm is smaller than 100x100 mm).
  Detailed Timing Descriptor #6: Dubious image size (160x90 mm is smaller than 100x100 mm).
  Detailed Timing Descriptor #7: Dubious image size (160x90 mm is smaller than 100x100 mm).
  Add a Colorimetry Data Block with the sRGB colorimetry bit set to avoid interop issues.

Failures:

Block 1, CTA-861 Extension Block:
  Missing VCDB, needed for Set Selectable RGB Quantization to avoid interop issues.
EDID:
  Extension Block 2 started with EDID header, ignoring Extension Blocks >= 2.

EDID conformity: FAIL
