edid-decode (hex):

00 ff ff ff ff ff ff 00 1e 6d 0d 77 86 40 01 00
09 1d 01 03 80 3c 22 78 ea 30 31 a6 55 53 9f 28
0e 50 54 a5 4b 80 31 7c 01 01 45 7c 61 7c 01 01
81 80 81 bc d1 fc 02 3a 80 18 71 38 2d 40 58 2c
45 00 13 2a 21 00 00 1e df 88 80 a0 70 38 5a 40
30 20 35 00 55 50 21 00 00 1e 00 00 00 fd 00 30
f0 1e ff 3c 00 0a 20 20 20 20 20 20 00 00 00 fc
00 32 37 47 4b 37 35 30 46 0a 20 20 20 20 01 cf

02 03 2d f1 23 09 07 07 49 01 02 03 04 11 12 13
1f 90 83 01 00 00 65 03 0c 00 10 00 67 d8 5d c4
01 7c c0 00 68 1a 00 00 01 01 30 f0 00 74 e1 80
78 70 38 64 40 08 37 98 0c 58 2f 21 00 00 1a e6
5f 00 a0 40 00 60 30 30 20 34 00 55 50 21 00 00
1e b4 91 00 a0 50 c0 78 30 30 20 34 00 55 50 21
00 00 18 00 00 00 ff 00 39 30 39 4e 54 55 57 32
45 30 35 34 0a 00 00 00 00 00 00 00 00 00 00 bf

00 ff ff ff ff ff ff 00 1e 6d 0d 77 86 40 01 00
09 1d 01 03 80 3c 22 78 ea 30 31 a6 55 53 9f 28
0e 50 54 a5 4b 80 31 7c 01 01 45 7c 61 7c 01 01
81 80 81 bc d1 fc 02 3a 80 18 71 38 2d 40 58 2c
45 00 13 2a 21 00 00 1e df 88 80 a0 70 38 5a 40
30 20 35 00 55 50 21 00 00 1e 00 00 00 fd 00 30
f0 1e ff 3c 00 0a 20 20 20 20 20 20 00 00 00 fc
00 32 37 47 4b 37 35 30 46 0a 20 20 20 20 01 cf

02 03 2d f1 23 09 07 07 49 01 02 03 04 11 12 13
1f 90 83 01 00 00 65 03 0c 00 10 00 67 d8 5d c4
01 7c c0 00 68 1a 00 00 01 01 30 f0 00 74 e1 80
78 70 38 64 40 08 37 98 0c 58 2f 21 00 00 1a e6
5f 00 a0 40 00 60 30 30 20 34 00 55 50 21 00 00
1e b4 91 00 a0 50 c0 78 30 30 20 34 00 55 50 21
00 00 18 00 00 00 ff 00 39 30 39 4e 54 55 57 32
45 30 35 34 0a 00 00 00 00 00 00 00 00 00 00 bf

----------------

Block 0, Base EDID:
  EDID Structure Version & Revision: 1.3
  Vendor & Product Identification:
    Manufacturer: GSM
    Model: 30477
    Serial Number: ...
    Made in: week 9 of 2019
  Basic Display Parameters & Features:
    Digital display
    Maximum image size: 60 cm x 34 cm
    Gamma: 2.20
    DPMS levels: Standby Suspend Off
    RGB color display
    First detailed timing is the preferred timing
  Color Characteristics:
    Red  : 0.6484, 0.3349
    Green: 0.3242, 0.6210
    Blue : 0.1562, 0.0576
    White: 0.3125, 0.3291
  Established Timings I & II:
    IBM     :   720x400    70.081663 Hz   9:5     31.467 kHz     28.320000 MHz
    DMT 0x04:   640x480    59.940476 Hz   4:3     31.469 kHz     25.175000 MHz
    DMT 0x06:   640x480    75.000000 Hz   4:3     37.500 kHz     31.500000 MHz
    DMT 0x09:   800x600    60.316541 Hz   4:3     37.879 kHz     40.000000 MHz
    DMT 0x0b:   800x600    75.000000 Hz   4:3     46.875 kHz     49.500000 MHz
    DMT 0x10:  1024x768    60.003840 Hz   4:3     48.363 kHz     65.000000 MHz
    DMT 0x12:  1024x768    75.028582 Hz   4:3     60.023 kHz     78.750000 MHz
    DMT 0x24:  1280x1024   75.024675 Hz   5:4     79.976 kHz    135.000000 MHz
    Apple   :  1152x870    75.061550 Hz 192:145   68.681 kHz    100.000000 MHz
  Standard Timings:
    GTF     :   640x480   119.999084 Hz   4:3     61.800 kHz     52.406000 MHz
    GTF     :   800x600   119.999886 Hz   4:3     77.160 kHz     83.950000 MHz
    GTF     :  1024x768   119.999931 Hz   4:3     98.760 kHz    139.054000 MHz
    DMT 0x23:  1280x1024   60.019740 Hz   5:4     63.981 kHz    108.000000 MHz
    GTF     :  1280x1024  120.000185 Hz   5:4    131.640 kHz    233.793000 MHz
    GTF     :  1920x1080  119.999987 Hz  16:9    138.840 kHz    368.759000 MHz
  Detailed Timing Descriptors:
    DTD 1:  1920x1080   60.000000 Hz  16:9     67.500 kHz    148.500000 MHz (531 mm x 298 mm)
                 Hfront   88 Hsync  44 Hback  148 Hpol P
                 Vfront    4 Vsync   5 Vback   36 Vpol P
    DTD 2:  1920x1080  143.980112 Hz  16:9    168.457 kHz    350.390000 MHz (597 mm x 336 mm)
                 Hfront   48 Hsync  32 Hback   80 Hpol P
                 Vfront    3 Vsync   5 Vback   82 Vpol P
    Display Range Limits:
      Monitor ranges (GTF): 48-240 Hz V, 30-255 kHz H, max dotclock 600 MHz
    Display Product Name: '27GK750F'
  Extension blocks: 1
Checksum: 0xcf

----------------

Block 1, CTA-861 Extension Block:
  Revision: 3
  Underscans IT Video Formats by default
  Basic audio support
  Supports YCbCr 4:4:4
  Supports YCbCr 4:2:2
  Native DTDs: 1
  Audio Data Block:
    Linear PCM:
      Max channels: 2
      Supported sample rates (kHz): 48 44.1 32
      Supported sample sizes (bits): 24 20 16
  Video Data Block:
    VIC   1:   640x480    59.940476 Hz   4:3     31.469 kHz     25.175000 MHz
    VIC   2:   720x480    59.940060 Hz   4:3     31.469 kHz     27.000000 MHz
    VIC   3:   720x480    59.940060 Hz  16:9     31.469 kHz     27.000000 MHz
    VIC   4:  1280x720    60.000000 Hz  16:9     45.000 kHz     74.250000 MHz
    VIC  17:   720x576    50.000000 Hz   4:3     31.250 kHz     27.000000 MHz
    VIC  18:   720x576    50.000000 Hz  16:9     31.250 kHz     27.000000 MHz
    VIC  19:  1280x720    50.000000 Hz  16:9     37.500 kHz     74.250000 MHz
    VIC  31:  1920x1080   50.000000 Hz  16:9     56.250 kHz    148.500000 MHz
    VIC  16:  1920x1080   60.000000 Hz  16:9     67.500 kHz    148.500000 MHz (native)
  Speaker Allocation Data Block:
    FL/FR - Front Left/Right
  Vendor-Specific Data Block (HDMI), OUI 00-0C-03:
    Source physical address: 1.0.0.0
  Vendor-Specific Data Block (HDMI Forum), OUI C4-5D-D8:
    Version: 1
    Maximum TMDS Character Rate: 620 MHz
    SCDC Present
    SCDC Read Request Capable
  Vendor-Specific Data Block (AMD), OUI 00-00-1A:
    Version: 1
    Flags 1: 0x01
      FreeSync Supported
    Minimum Refresh Rate: 48 Hz
    Maximum Refresh Rate: 240 Hz
  Detailed Timing Descriptors:
    DTD 3:  1920x1080  239.764041 Hz  16:9    282.922 kHz    577.160000 MHz (600 mm x 303 mm)
                 Hfront    8 Hsync  55 Hback   57 Hpol P
                 Vfront   57 Vsync   8 Vback   35 Vpol N
    DTD 4:  1024x768   239.986080 Hz   4:3    207.348 kHz    245.500000 MHz (597 mm x 336 mm)
                 Hfront   48 Hsync  32 Hback   80 Hpol P
                 Vfront    3 Vsync   4 Vback   89 Vpol P
    DTD 5:  1280x960   239.840535 Hz   4:3    259.028 kHz    373.000000 MHz (597 mm x 336 mm)
                 Hfront   48 Hsync  32 Hback   80 Hpol N
                 Vfront    3 Vsync   4 Vback  113 Vpol N
    Display Product Serial Number: ...
Checksum: 0xbf  Unused space in Extension Block: 10 bytes

----------------

Warnings:

Block 1, CTA-861 Extension Block:
  Video Data Block: VIC 1 and the first DTD are not identical. Is this intended?
  Detailed Timing Descriptor #3: Image size is 600x303 mm, but based on the picture AR it should be 538x303 mm.
  Detailed Timing Descriptor #4: Image size is 597x336 mm, but based on the picture AR it should be 448x336 mm.
  Detailed Timing Descriptor #5: Image size is 597x336 mm, but based on the picture AR it should be 448x336 mm.
  Display Product Serial Number is set, so the Serial Number in the Base EDID should be 0.
  Add a Colorimetry Data Block with the sRGB colorimetry bit set to avoid interop issues.

Failures:

Block 0, Base EDID:
  Detailed Timing Descriptor #1: Mismatch of image size 531x298 mm vs display size 600x340 mm.
Block 1, CTA-861 Extension Block:
  Vendor-Specific Data Block (HDMI Forum), OUI C4-5D-D8: Max TMDS rate is > 0 and <= 340 or > 600.
  Missing VCDB, needed for Set Selectable RGB Quantization to avoid interop issues.
EDID:
  Extension Block 2 started with EDID header, ignoring Extension Blocks >= 2.

EDID conformity: FAIL
