edid-decode (hex):

00 ff ff ff ff ff ff 00 4d 10 5b 15 00 00 00 00
17 1f 01 04 a5 26 15 78 07 de 50 a3 54 4c 99 26
0f 50 54 00 00 00 01 01 01 01 01 01 01 01 01 01
01 01 01 01 01 01 f7 37 80 a0 70 38 44 40 30 20
35 00 7e d7 10 00 00 18 00 00 00 fd 0e 30 2d 5a
5a 48 01 0a 20 20 20 20 20 20 00 00 00 10 00 00
00 00 00 00 00 00 00 00 00 00 00 00 00 00 00 fc
00 4c 51 31 37 33 4d 31 4a 57 30 34 0a 20 01 0f

70 13 79 00 00 03 01 14 d3 17 01 84 7f 07 9f 00
2f 00 1f 00 37 04 43 00 02 00 04 00 00 00 00 00
00 00 00 00 00 00 00 00 00 00 00 00 00 00 00 00
00 00 00 00 00 00 00 00 00 00 00 00 00 00 00 00
00 00 00 00 00 00 00 00 00 00 00 00 00 00 00 00
00 00 00 00 00 00 00 00 00 00 00 00 00 00 00 00
00 00 00 00 00 00 00 00 00 00 00 00 00 00 00 00
00 00 00 00 00 00 00 00 00 00 00 00 00 00 f6 90

00 ff ff ff ff ff ff 00 4d 10 5b 15 00 00 00 00
17 1f 01 04 a5 26 15 78 07 de 50 a3 54 4c 99 26
0f 50 54 00 00 00 01 01 01 01 01 01 01 01 01 01
01 01 01 01 01 01 f7 37 80 a0 70 38 44 40 30 20
35 00 7e d7 10 00 00 18 00 00 00 fd 0e 30 2d 5a
5a 48 01 0a 20 20 20 20 20 20 00 00 00 10 00 00
00 00 00 00 00 00 00 00 00 00 00 00 00 00 00 fc
00 4c 51 31 37 33 4d 31 4a 57 30 34 0a 20 01 0f

70 13 79 00 00 03 01 14 d3 17 01 84 7f 07 9f 00
2f 00 1f 00 37 04 43 00 02 00 04 00 00 00 00 00
00 00 00 00 00 00 00 00 00 00 00 00 00 00 00 00
00 00 00 00 00 00 00 00 00 00 00 00 00 00 00 00
00 00 00 00 00 00 00 00 00 00 00 00 00 00 00 00
00 00 00 00 00 00 00 00 00 00 00 00 00 00 00 00
00 00 00 00 00 00 00 00 00 00 00 00 00 00 00 00
00 00 00 00 00 00 00 00 00 00 00 00 00 00 f6 90

----------------

Block 0, Base EDID:
  EDID Structure Version & Revision: 1.4
  Vendor & Product Identification:
    Manufacturer: SHP
    Model: 5467
    Made in: week 23 of 2021
  Basic Display Parameters & Features:
    Digital display
    Bits per primary color channel: 8
    DisplayPort interface
    Maximum image size: 38 cm x 21 cm
    Gamma: 2.20
    Supported color formats: RGB 4:4:4
    Default (sRGB) color space is primary color space
    First detailed timing includes the native pixel format and preferred refresh rate
    Display supports continuous frequencies
  Color Characteristics:
    Red  : 0.6396, 0.3291
    Green: 0.2998, 0.5996
    Blue : 0.1494, 0.0595
    White: 0.3125, 0.3281
  Established Timings I & II: none
  Standard Timings: none
  Detailed Timing Descriptors:
    DTD 1:  1920x1080   59.999832 Hz  16:9     68.880 kHz    143.270000 MHz (382 mm x 215 mm)
                 Hfront   48 Hsync  32 Hback   80 Hpol N
                 Vfront    3 Vsync   5 Vback   60 Vpol N
    Display Range Limits:
      Monitor ranges (Range Limits Only): 48-300 Hz V, 345-345 kHz H, max dotclock 720 MHz
    Dummy Descriptor:
    Display Product Name: 'LQ173M1JW04'
  Extension blocks: 1
Checksum: 0x0f

----------------

Block 1, DisplayID Extension Block:
  Version: 1.3
  Extension Count: 0
  Display Product Type: Extension Section
  Video Timing Modes Type 1 - Detailed Timings Data Block:
    DTD:  1920x1080  300.003350 Hz  16:9    344.404 kHz    716.360000 MHz (aspect 16:9, no 3D stereo, preferred)
               Hfront   48 Hsync  32 Hback   80 Hpol N
               Vfront    3 Vsync   5 Vback   60 Vpol N
  Checksum: 0xf6
Checksum: 0x90

----------------

Warnings:

EDID:
  Base EDID: Some timings are out of range of the Monitor Ranges:
    Horizontal Freq: 68.879 - 344.403 kHz (Monitor: 345.000 - 345.000 kHz)

Failures:

Block 0, Base EDID:
  Basic Display Parameters & Features: sRGB is signaled, but the chromaticities do not match.
Block 1, DisplayID Extension Block:
  DisplayID Base Block has no product type.
EDID:
  Extension Block 2 started with EDID header, ignoring Extension Blocks >= 2.

EDID conformity: FAIL
