edid-decode (hex):

00 ff ff ff ff ff ff 00 26 13 80 15 10 10 10 10
22 1d 01 04 85 23 13 78 3a ef 65 a6 56 52 9d 28
0b 50 54 21 08 00 71 40 81 80 a9 c0 d1 c0 01 01
01 01 01 01 01 01 02 3a 80 18 71 38 2d 40 58 2c
45 00 dd 0c 11 00 00 1e 00 00 00 ff 00 30 30 30
30 30 30 30 30 30 30 30 30 0a 00 00 00 fc 00 4a
41 50 41 4e 4e 45 58 54 20 4d 4e 54 00 00 00 fd
00 38 4c 1e 53 11 01 0a 20 20 20 20 20 20 01 bd

02 03 30 f2 4f 04 05 10 13 14 1f 00 00 00 27 01
00 00 4b 4c 23 09 7f 07 83 01 00 00 65 03 0c 00
10 00 e3 05 e3 01 e6 06 07 01 62 62 30 e2 00 c0
02 3a 80 18 71 38 2d 40 58 2c 25 00 dd 0c 11 00
00 1e 01 1d 80 18 71 1c 16 20 58 2c 25 00 dd 0c
11 00 00 9e 00 00 00 00 00 00 00 00 00 00 00 00
00 00 00 00 00 00 00 00 00 00 00 00 00 00 00 00
00 00 00 00 00 00 00 00 00 00 00 00 00 00 00 f7

00 ff ff ff ff ff ff 00 26 13 80 15 10 10 10 10
22 1d 01 04 85 23 13 78 3a ef 65 a6 56 52 9d 28
0b 50 54 21 08 00 71 40 81 80 a9 c0 d1 c0 01 01
01 01 01 01 01 01 02 3a 80 18 71 38 2d 40 58 2c
45 00 dd 0c 11 00 00 1e 00 00 00 ff 00 30 30 30
30 30 30 30 30 30 30 30 30 0a 00 00 00 fc 00 4a
41 50 41 4e 4e 45 58 54 20 4d 4e 54 00 00 00 fd
00 38 4c 1e 53 11 01 0a 20 20 20 20 20 20 01 bd

02 03 30 f2 4f 04 05 10 13 14 1f 00 00 00 27 01
00 00 4b 4c 23 09 7f 07 83 01 00 00 65 03 0c 00
10 00 e3 05 e3 01 e6 06 07 01 62 62 30 e2 00 c0
02 3a 80 18 71 38 2d 40 58 2c 25 00 dd 0c 11 00
00 1e 01 1d 80 18 71 1c 16 20 58 2c 25 00 dd 0c
11 00 00 9e 00 00 00 00 00 00 00 00 00 00 00 00
00 00 00 00 00 00 00 00 00 00 00 00 00 00 00 00
00 00 00 00 00 00 00 00 00 00 00 00 00 00 00 f7

----------------

Block 0, Base EDID:
  EDID Structure Version & Revision: 1.4
  Vendor & Product Identification:
    Manufacturer: IPS
    Model: 5504
    Serial Number: ...
    Made in: week 34 of 2019
  Basic Display Parameters & Features:
    Digital display
    Color depth is undefined
    DisplayPort interface
    Maximum image size: 35 cm x 19 cm
    Gamma: 2.20
    DPMS levels: Off
    Supported color formats: RGB 4:4:4, YCrCb 4:4:4, YCrCb 4:2:2
    First detailed timing includes the native pixel format and preferred refresh rate
  Color Characteristics:
    Red  : 0.6513, 0.3378
    Green: 0.3232, 0.6162
    Blue : 0.1572, 0.0449
    White: 0.3134, 0.3291
  Established Timings I & II:
    DMT 0x04:   640x480    59.940476 Hz   4:3     31.469 kHz     25.175000 MHz
    DMT 0x09:   800x600    60.316541 Hz   4:3     37.879 kHz     40.000000 MHz
    DMT 0x10:  1024x768    60.003840 Hz   4:3     48.363 kHz     65.000000 MHz
  Standard Timings:
    GTF     :  1152x864    60.000000 Hz   4:3     53.700 kHz     81.624000 MHz
    DMT 0x23:  1280x1024   60.019740 Hz   5:4     63.981 kHz    108.000000 MHz
    DMT 0x53:  1600x900    60.000000 Hz  16:9     60.000 kHz    108.000000 MHz (RB)
    DMT 0x52:  1920x1080   60.000000 Hz  16:9     67.500 kHz    148.500000 MHz
  Detailed Timing Descriptors:
    DTD 1:  1920x1080   60.000000 Hz  16:9     67.500 kHz    148.500000 MHz (477 mm x 268 mm)
                 Hfront   88 Hsync  44 Hback  148 Hpol P
                 Vfront    4 Vsync   5 Vback   36 Vpol P
    Display Product Serial Number: ...
    Display Product Name: 'JAPANNEXT MNT'
    Display Range Limits:
      Monitor ranges (Range Limits Only): 56-76 Hz V, 30-83 kHz H, max dotclock 170 MHz
  Extension blocks: 1
Checksum: 0xbd

----------------

Block 1, CTA-861 Extension Block:
  Revision: 3
  Underscans IT Video Formats by default
  Basic audio support
  Supports YCbCr 4:4:4
  Supports YCbCr 4:2:2
  Native DTDs: 2
  Video Data Block:
    VIC   4:  1280x720    60.000000 Hz  16:9     45.000 kHz     74.250000 MHz
    VIC   5:  1920x1080i  60.000000 Hz  16:9     33.750 kHz     74.250000 MHz
    VIC  16:  1920x1080   60.000000 Hz  16:9     67.500 kHz    148.500000 MHz
    VIC  19:  1280x720    50.000000 Hz  16:9     37.500 kHz     74.250000 MHz
    VIC  20:  1920x1080i  50.000000 Hz  16:9     28.125 kHz     74.250000 MHz
    VIC  31:  1920x1080   50.000000 Hz  16:9     56.250 kHz    148.500000 MHz
    VIC  39:  1920x1080i  50.000000 Hz  16:9     31.250 kHz     72.000000 MHz
    VIC   1:   640x480    59.940476 Hz   4:3     31.469 kHz     25.175000 MHz
    VIC  75:  1920x1080   50.000000 Hz  64:27    56.250 kHz    148.500000 MHz
    VIC  76:  1920x1080   60.000000 Hz  64:27    67.500 kHz    148.500000 MHz
  Audio Data Block:
    Linear PCM:
      Max channels: 2
      Supported sample rates (kHz): 192 176.4 96 88.2 48 44.1 32
      Supported sample sizes (bits): 24 20 16
  Speaker Allocation Data Block:
    FL/FR - Front Left/Right
  Vendor-Specific Data Block (HDMI), OUI 00-0C-03:
    Source physical address: 1.0.0.0
  Colorimetry Data Block:
    xvYCC601
    xvYCC709
    BT2020cYCC
    BT2020YCC
    BT2020RGB
    Gamut Boundary Description Metadata Profile P0
  HDR Static Metadata Data Block:
    Electro optical transfer functions:
      Traditional gamma - SDR luminance range
      Traditional gamma - HDR luminance range
      SMPTE ST2084
    Supported static metadata descriptors:
      Static metadata type 1
    Desired content max luminance: 98 (417.710 cd/m^2)
    Desired content max frame-average luminance: 98 (417.710 cd/m^2)
    Desired content min luminance: 48 (0.148 cd/m^2)
  Video Capability Data Block:
    YCbCr quantization: Selectable (via AVI YQ)
    RGB quantization: Selectable (via AVI Q)
    PT scan behavior: No Data
    IT scan behavior: IT video formats not supported
    CE scan behavior: CE video formats not supported
  Detailed Timing Descriptors:
    DTD 2:  1920x1080   60.000000 Hz  16:9     67.500 kHz    148.500000 MHz (477 mm x 268 mm)
                 Hfront   88 Hsync  44 Hback  148 Hpol P
                 Vfront    2 Vsync   5 Vback   38 Vpol P
    DTD 3:  1920x1080i  60.000000 Hz  16:9     33.750 kHz     74.250000 MHz (477 mm x 268 mm)
                 Hfront   88 Hsync  44 Hback  148 Hpol P
                 Vfront    2 Vsync   5 Vback   15 Vpol P Vfront +0.5 Odd Field
                 Vfront    2 Vsync   5 Vback   15 Vpol P Vback  +0.5 Even Field
Checksum: 0xf7  Unused space in Extension Block: 43 bytes

----------------

Warnings:

Block 0, Base EDID:
  Display Product Serial Number: ...
Block 1, CTA-861 Extension Block:
  Video Data Block: VIC 4 and the first DTD are not identical. Is this intended?
  Colorimetry Data Block: Set the sRGB colorimetry bit to avoid interop issues.
  Video Capability Data Block: IT scan behavior is expected to support underscanned.
  Video Capability Data Block: 'CE video formats not supported' makes no sense.
  Detailed Timing Descriptor #2: DTD is similar but not identical to VIC 16.
  Display Product Serial Number is set, so the Serial Number in the Base EDID should be 0.
EDID:
  Base EDID: Some timings are out of range of the Monitor Ranges:
    Vertical Freq: 50.000 - 60.317 Hz (Monitor: 56.000 - 76.000 Hz)
    Horizontal Freq: 28.125 - 67.500 kHz (Monitor: 30.000 - 83.000 kHz)

Failures:

Block 0, Base EDID:
  Detailed Timing Descriptor #1: Mismatch of image size 477x268 mm vs display size 350x190 mm.
Block 1, CTA-861 Extension Block:
  Vendor-Specific Data Block (HDMI), OUI 00-0C-03: The HDMI Specification requires EDID 1.3 instead of 1.4.
  Detailed Timing Descriptor #2: Mismatch of image size 477x268 mm vs display size 350x190 mm.
  Detailed Timing Descriptor #3: Mismatch of image size 477x268 mm vs display size 350x190 mm.
EDID:
  Extension Block 2 started with EDID header, ignoring Extension Blocks >= 2.
  Base EDID: The DTD max image size is 477x268mm, which is larger than the display size 350.0x190.0mm.

EDID conformity: FAIL
