edid-decode (hex):

00 ff ff ff ff ff ff 00 36 69 c0 3d 00 00 00 00
01 1e 01 04 b5 47 28 78 3b 35 65 b0 4e 2e bc 26
0e 50 54 bf cf 00 d1 c0 71 4f 81 c0 81 40 81 80
95 00 b3 00 01 01 4d d0 00 a0 f0 70 3e 80 30 40
35 00 c4 8f 21 00 00 1a 02 3a 80 18 71 38 2d 40
58 2c 45 00 c4 8f 21 00 00 1e 00 00 00 fd 0c 30
90 4e 4e 86 01 0a 20 20 20 20 20 20 00 00 00 fc
00 4d 50 47 33 32 31 55 52 2d 51 44 0a 20 02 d5

02 03 3b 71 4c 04 13 90 3f 60 61 5f 76 03 12 01
47 23 09 17 07 83 01 00 00 e2 00 c0 65 03 0c 00
10 00 6d 1a 00 00 02 03 30 90 00 05 74 28 08 2e
e3 05 e0 01 e6 06 07 01 73 5a 17 56 5e 00 a0 a0
a0 29 50 30 20 35 00 c4 8f 21 00 00 1a 6f c2 00
a0 a0 a0 55 50 30 20 35 00 c4 8f 21 00 00 1a 00
00 00 00 00 00 00 00 00 00 00 00 00 00 00 00 00
00 00 00 00 00 00 00 00 00 00 00 00 00 00 00 89

70 12 79 00 00 03 01 3c 9a 08 02 04 ff 0e 9f 00
6f 80 1f 00 6f 08 99 00 91 00 04 00 a3 a0 01 04
ff 0e 9f 00 2f 80 3f 00 6f 08 3d 00 02 00 04 00
08 ec 00 00 ff 09 9f 00 2f 00 1f 00 9f 05 66 00
02 00 01 00 00 00 00 00 00 00 00 00 00 00 00 00
00 00 00 00 00 00 00 00 00 00 00 00 00 00 00 00
00 00 00 00 00 00 00 00 00 00 00 00 00 00 00 00
00 00 00 00 00 00 00 00 00 00 00 00 00 00 9c 90

00 ff ff ff ff ff ff 00 36 69 c0 3d 00 00 00 00
01 1e 01 04 b5 47 28 78 3b 35 65 b0 4e 2e bc 26
0e 50 54 bf cf 00 d1 c0 71 4f 81 c0 81 40 81 80
95 00 b3 00 01 01 4d d0 00 a0 f0 70 3e 80 30 40
35 00 c4 8f 21 00 00 1a 02 3a 80 18 71 38 2d 40
58 2c 45 00 c4 8f 21 00 00 1e 00 00 00 fd 0c 30
90 4e 4e 86 01 0a 20 20 20 20 20 20 00 00 00 fc
00 4d 50 47 33 32 31 55 52 2d 51 44 0a 20 02 d5

02 03 3b 71 4c 04 13 90 3f 60 61 5f 76 03 12 01
47 23 09 17 07 83 01 00 00 e2 00 c0 65 03 0c 00
10 00 6d 1a 00 00 02 03 30 90 00 05 74 28 08 2e
e3 05 e0 01 e6 06 07 01 73 5a 17 56 5e 00 a0 a0
a0 29 50 30 20 35 00 c4 8f 21 00 00 1a 6f c2 00
a0 a0 a0 55 50 30 20 35 00 c4 8f 21 00 00 1a 00
00 00 00 00 00 00 00 00 00 00 00 00 00 00 00 00
00 00 00 00 00 00 00 00 00 00 00 00 00 00 00 89

70 12 79 00 00 03 01 3c 9a 08 02 04 ff 0e 9f 00
6f 80 1f 00 6f 08 99 00 91 00 04 00 a3 a0 01 04
ff 0e 9f 00 2f 80 3f 00 6f 08 3d 00 02 00 04 00
08 ec 00 00 ff 09 9f 00 2f 00 1f 00 9f 05 66 00
02 00 01 00 00 00 00 00 00 00 00 00 00 00 00 00
00 00 00 00 00 00 00 00 00 00 00 00 00 00 00 00
00 00 00 00 00 00 00 00 00 00 00 00 00 00 00 00
00 00 00 00 00 00 00 00 00 00 00 00 00 00 9c 90

----------------

Block 0, Base EDID:
  EDID Structure Version & Revision: 1.4
  Vendor & Product Identification:
    Manufacturer: MSI
    Model: 15808
    Made in: week 1 of 2020
  Basic Display Parameters & Features:
    Digital display
    Bits per primary color channel: 10
    DisplayPort interface
    Maximum image size: 71 cm x 40 cm
    Gamma: 2.20
    DPMS levels: Off
    Supported color formats: RGB 4:4:4, YCrCb 4:4:4, YCrCb 4:2:2
    First detailed timing includes the native pixel format and preferred refresh rate
    Display supports continuous frequencies
  Color Characteristics:
    Red  : 0.6875, 0.3076
    Green: 0.1806, 0.7353
    Blue : 0.1494, 0.0566
    White: 0.3134, 0.3291
  Established Timings I & II:
    IBM     :   720x400    70.081663 Hz   9:5     31.467 kHz     28.320000 MHz
    DMT 0x04:   640x480    59.940476 Hz   4:3     31.469 kHz     25.175000 MHz
    Apple   :   640x480    66.666667 Hz   4:3     35.000 kHz     30.240000 MHz
    DMT 0x05:   640x480    72.808802 Hz   4:3     37.861 kHz     31.500000 MHz
    DMT 0x06:   640x480    75.000000 Hz   4:3     37.500 kHz     31.500000 MHz
    DMT 0x08:   800x600    56.250000 Hz   4:3     35.156 kHz     36.000000 MHz
    DMT 0x09:   800x600    60.316541 Hz   4:3     37.879 kHz     40.000000 MHz
    DMT 0x0a:   800x600    72.187572 Hz   4:3     48.077 kHz     50.000000 MHz
    DMT 0x0b:   800x600    75.000000 Hz   4:3     46.875 kHz     49.500000 MHz
    DMT 0x10:  1024x768    60.003840 Hz   4:3     48.363 kHz     65.000000 MHz
    DMT 0x11:  1024x768    70.069359 Hz   4:3     56.476 kHz     75.000000 MHz
    DMT 0x12:  1024x768    75.028582 Hz   4:3     60.023 kHz     78.750000 MHz
    DMT 0x24:  1280x1024   75.024675 Hz   5:4     79.976 kHz    135.000000 MHz
  Standard Timings:
    DMT 0x52:  1920x1080   60.000000 Hz  16:9     67.500 kHz    148.500000 MHz
    DMT 0x15:  1152x864    75.000000 Hz   4:3     67.500 kHz    108.000000 MHz
    DMT 0x55:  1280x720    60.000000 Hz  16:9     45.000 kHz     74.250000 MHz
    DMT 0x20:  1280x960    60.000000 Hz   4:3     60.000 kHz    108.000000 MHz
    DMT 0x23:  1280x1024   60.019740 Hz   5:4     63.981 kHz    108.000000 MHz
    DMT 0x2f:  1440x900    59.887445 Hz  16:10    55.935 kHz    106.500000 MHz
    DMT 0x3a:  1680x1050   59.954250 Hz  16:10    65.290 kHz    146.250000 MHz
  Detailed Timing Descriptors:
    DTD 1:  3840x2160   59.996625 Hz  16:9    133.312 kHz    533.250000 MHz (708 mm x 399 mm)
                 Hfront   48 Hsync  64 Hback   48 Hpol P
                 Vfront    3 Vsync   5 Vback   54 Vpol N
    DTD 2:  1920x1080   60.000000 Hz  16:9     67.500 kHz    148.500000 MHz (708 mm x 399 mm)
                 Hfront   88 Hsync  44 Hback  148 Hpol P
                 Vfront    4 Vsync   5 Vback   36 Vpol P
    Display Range Limits:
      Monitor ranges (Range Limits Only): 48-144 Hz V, 333-333 kHz H, max dotclock 1340 MHz
    Display Product Name: 'MPG321UR-QD'
  Extension blocks: 2
Checksum: 0xd5

----------------

Block 1, CTA-861 Extension Block:
  Revision: 3
  Basic audio support
  Supports YCbCr 4:4:4
  Supports YCbCr 4:2:2
  Native DTDs: 1
  Video Data Block:
    VIC   4:  1280x720    60.000000 Hz  16:9     45.000 kHz     74.250000 MHz
    VIC  19:  1280x720    50.000000 Hz  16:9     37.500 kHz     74.250000 MHz
    VIC  16:  1920x1080   60.000000 Hz  16:9     67.500 kHz    148.500000 MHz (native)
    VIC  63:  1920x1080  120.000000 Hz  16:9    135.000 kHz    297.000000 MHz
    VIC  96:  3840x2160   50.000000 Hz  16:9    112.500 kHz    594.000000 MHz
    VIC  97:  3840x2160   60.000000 Hz  16:9    135.000 kHz    594.000000 MHz
    VIC  95:  3840x2160   30.000000 Hz  16:9     67.500 kHz    297.000000 MHz
    VIC 118:  3840x2160  120.000000 Hz  16:9    270.000 kHz   1188.000000 MHz
    VIC   3:   720x480    59.940060 Hz  16:9     31.469 kHz     27.000000 MHz
    VIC  18:   720x576    50.000000 Hz  16:9     31.250 kHz     27.000000 MHz
    VIC   1:   640x480    59.940476 Hz   4:3     31.469 kHz     25.175000 MHz
    VIC  71:  1280x720   120.000000 Hz  64:27    90.000 kHz    148.500000 MHz
  Audio Data Block:
    Linear PCM:
      Max channels: 2
      Supported sample rates (kHz): 96 48 44.1 32
      Supported sample sizes (bits): 24 20 16
  Speaker Allocation Data Block:
    FL/FR - Front Left/Right
  Video Capability Data Block:
    YCbCr quantization: Selectable (via AVI YQ)
    RGB quantization: Selectable (via AVI Q)
    PT scan behavior: No Data
    IT scan behavior: IT video formats not supported
    CE scan behavior: CE video formats not supported
  Vendor-Specific Data Block (HDMI), OUI 00-0C-03:
    Source physical address: 1.0.0.0
  Vendor-Specific Data Block (AMD), OUI 00-00-1A:
    Version: 2
    Flags 1: 0x03
      FreeSync Supported
      FreeSync 2 HDR Supported
    Minimum Refresh Rate: 48 Hz
    Maximum Refresh Rate: 144 Hz
    Flags 5: 0x05
      sRGB EOTF Supported
      Gamma 2.2 EOTF Supported
    Maximum luminance: 116 (616.884 cd/m^2)
    Minimum luminance: 40 (0.152 cd/m^2)
  Colorimetry Data Block:
    BT2020cYCC
    BT2020YCC
    BT2020RGB
    Gamut Boundary Description Metadata Profile P0
  HDR Static Metadata Data Block:
    Electro optical transfer functions:
      Traditional gamma - SDR luminance range
      Traditional gamma - HDR luminance range
      SMPTE ST2084
    Supported static metadata descriptors:
      Static metadata type 1
    Desired content max luminance: 115 (603.666 cd/m^2)
    Desired content max frame-average luminance: 90 (351.250 cd/m^2)
    Desired content min luminance: 23 (0.049 cd/m^2)
  Detailed Timing Descriptors:
    DTD 3:  2560x1440   59.950550 Hz  16:9     88.787 kHz    241.500000 MHz (708 mm x 399 mm)
                 Hfront   48 Hsync  32 Hback   80 Hpol P
                 Vfront    3 Vsync   5 Vback   33 Vpol N
    DTD 4:  2560x1440  119.997589 Hz  16:9    182.996 kHz    497.750000 MHz (708 mm x 399 mm)
                 Hfront   48 Hsync  32 Hback   80 Hpol P
                 Vfront    3 Vsync   5 Vback   77 Vpol N
Checksum: 0x89  Unused space in Extension Block: 32 bytes

----------------

Block 2, DisplayID Extension Block:
  Version: 1.2
  Extension Count: 0
  Display Product Type: Extension Section
  Video Timing Modes Type 1 - Detailed Timings Data Block:
    DTD:  3840x2160  143.987684 Hz  16:9    333.188 kHz   1332.750000 MHz (aspect 16:9, no 3D stereo)
               Hfront  112 Hsync  32 Hback   16 Hpol P
               Vfront  146 Vsync   5 Vback    3 Vpol N
    DTD:  3840x2160  120.004500 Hz  16:9    266.650 kHz   1066.600000 MHz (aspect 16:9, no 3D stereo)
               Hfront   48 Hsync  64 Hback   48 Hpol P
               Vfront    3 Vsync   5 Vback   54 Vpol N
    DTD:  2560x1440  143.973257 Hz   1:1    222.151 kHz    604.250000 MHz (aspect 1:1, no 3D stereo)
               Hfront   48 Hsync  32 Hback   80 Hpol N
               Vfront    3 Vsync   2 Vback   98 Vpol N
  Checksum: 0x9c
Checksum: 0x90

----------------

Warnings:

Block 1, CTA-861 Extension Block:
  IT Video Formats are overscanned by default, but normally this should be underscanned.
  Video Data Block: VIC 4 and the first DTD are not identical. Is this intended?
  Video Capability Data Block: IT scan behavior is expected to support underscanned.
  Video Capability Data Block: 'CE video formats not supported' makes no sense.
  Colorimetry Data Block: Set the sRGB colorimetry bit to avoid interop issues.
EDID:
  Base EDID: Some timings are out of range of the Monitor Ranges:
    Vertical Freq: 30.000 - 143.988 Hz (Monitor: 48.000 - 144.000 Hz)
    Horizontal Freq: 31.250 - 333.187 kHz (Monitor: 333.000 - 333.000 kHz)

Failures:

Block 1, CTA-861 Extension Block:
  Vendor-Specific Data Block (HDMI), OUI 00-0C-03: The HDMI Specification requires EDID 1.3 instead of 1.4.
Block 2, DisplayID Extension Block:
  DisplayID Base Block has no product type.
EDID:
  Extension Block 3 started with EDID header, ignoring Extension Blocks >= 3.
  CTA-861: Native progressive timings are a mix of several resolutions.
  DisplayID: DisplayID expects at least one preferred timing.

EDID conformity: FAIL
