edid-decode (hex):

00 ff ff ff ff ff ff 00 4a 8b 40 38 00 11 40 38
00 1e 01 03 81 00 00 78 fc ee 91 a3 54 4c 99 26
0f 50 54 00 00 00 01 01 01 01 01 01 01 01 01 01
01 01 01 01 01 01 9e 6b 00 a0 f0 4c 30 40 30 20
35 00 58 63 10 00 00 1a 22 56 00 a0 f0 4c 30 40
30 20 35 00 58 63 10 00 00 1a 22 1d 80 a0 70 26
30 20 30 20 35 00 58 63 10 00 00 1a 00 00 00 fd
00 18 90 0f de 08 00 0a 20 20 20 20 20 20 01 d4

02 03 56 f2 5e 04 05 10 13 14 1f 20 21 22 27 48
49 4a 4b 4c 5d 5e 5f 60 61 62 63 64 65 66 67 68
69 6a 6b e2 00 d5 e3 05 c0 00 23 09 7f 07 83 01
00 00 e5 0f 00 00 0c 00 6e 03 0c 00 10 00 38 78
20 00 80 01 02 03 04 67 d8 5d c4 01 78 88 01 e6
06 05 01 69 69 4f a8 6b 00 a0 f0 4c 30 40 30 20
35 00 58 63 10 00 00 1a 22 1d 80 a0 70 26 30 20
30 20 35 00 58 63 10 00 00 1a 00 00 00 00 00 b5

00 ff ff ff ff ff ff 00 4a 8b 40 38 00 11 40 38
00 1e 01 03 81 00 00 78 fc ee 91 a3 54 4c 99 26
0f 50 54 00 00 00 01 01 01 01 01 01 01 01 01 01
01 01 01 01 01 01 9e 6b 00 a0 f0 4c 30 40 30 20
35 00 58 63 10 00 00 1a 22 56 00 a0 f0 4c 30 40
30 20 35 00 58 63 10 00 00 1a 22 1d 80 a0 70 26
30 20 30 20 35 00 58 63 10 00 00 1a 00 00 00 fd
00 18 90 0f de 08 00 0a 20 20 20 20 20 20 01 d4

02 03 56 f2 5e 04 05 10 13 14 1f 20 21 22 27 48
49 4a 4b 4c 5d 5e 5f 60 61 62 63 64 65 66 67 68
69 6a 6b e2 00 d5 e3 05 c0 00 23 09 7f 07 83 01
00 00 e5 0f 00 00 0c 00 6e 03 0c 00 10 00 38 78
20 00 80 01 02 03 04 67 d8 5d c4 01 78 88 01 e6
06 05 01 69 69 4f a8 6b 00 a0 f0 4c 30 40 30 20
35 00 58 63 10 00 00 1a 22 1d 80 a0 70 26 30 20
30 20 35 00 58 63 10 00 00 1a 00 00 00 00 00 b5

----------------

Block 0, Base EDID:
  EDID Structure Version & Revision: 1.3
  Vendor & Product Identification:
    Manufacturer: RTK
    Model: 14400
    Serial Number: ...
    Made in: 2020
  Basic Display Parameters & Features:
    Digital display
    DFP 1.x compatible TMDS
    Image size is variable
    Gamma: 2.20
    DPMS levels: Standby Suspend Off
    Undefined display color type
    Default (sRGB) color space is primary color space
  Color Characteristics:
    Red  : 0.6396, 0.3300
    Green: 0.2998, 0.5996
    Blue : 0.1503, 0.0595
    White: 0.3125, 0.3291
  Established Timings I & II: none
  Standard Timings: none
  Detailed Timing Descriptors:
    DTD 1:  3840x1100   59.995645 Hz 192:55    68.875 kHz    275.500000 MHz (344 mm x 99 mm)
                 Hfront   48 Hsync  32 Hback   80 Hpol P
                 Vfront    3 Vsync   5 Vback   40 Vpol N
    DTD 2:  3840x1100   48.018293 Hz 192:55    55.125 kHz    220.500000 MHz (344 mm x 99 mm)
                 Hfront   48 Hsync  32 Hback   80 Hpol P
                 Vfront    3 Vsync   5 Vback   40 Vpol N
    DTD 3:  1920x550    59.959480 Hz 192:55    35.856 kHz     74.580000 MHz (344 mm x 99 mm)
                 Hfront   48 Hsync  32 Hback   80 Hpol P
                 Vfront    3 Vsync   5 Vback   40 Vpol N
    Display Range Limits:
      Monitor ranges (GTF): 24-144 Hz V, 15-222 kHz H, max dotclock 80 MHz
  Extension blocks: 1
Checksum: 0xd4

----------------

Block 1, CTA-861 Extension Block:
  Revision: 3
  Underscans IT Video Formats by default
  Basic audio support
  Supports YCbCr 4:4:4
  Supports YCbCr 4:2:2
  Native DTDs: 2
  Video Data Block:
    VIC   4:  1280x720    60.000000 Hz  16:9     45.000 kHz     74.250000 MHz
    VIC   5:  1920x1080i  60.000000 Hz  16:9     33.750 kHz     74.250000 MHz
    VIC  16:  1920x1080   60.000000 Hz  16:9     67.500 kHz    148.500000 MHz
    VIC  19:  1280x720    50.000000 Hz  16:9     37.500 kHz     74.250000 MHz
    VIC  20:  1920x1080i  50.000000 Hz  16:9     28.125 kHz     74.250000 MHz
    VIC  31:  1920x1080   50.000000 Hz  16:9     56.250 kHz    148.500000 MHz
    VIC  32:  1920x1080   24.000000 Hz  16:9     27.000 kHz     74.250000 MHz
    VIC  33:  1920x1080   25.000000 Hz  16:9     28.125 kHz     74.250000 MHz
    VIC  34:  1920x1080   30.000000 Hz  16:9     33.750 kHz     74.250000 MHz
    VIC  39:  1920x1080i  50.000000 Hz  16:9     31.250 kHz     72.000000 MHz
    VIC  72:  1920x1080   24.000000 Hz  64:27    27.000 kHz     74.250000 MHz
    VIC  73:  1920x1080   25.000000 Hz  64:27    28.125 kHz     74.250000 MHz
    VIC  74:  1920x1080   30.000000 Hz  64:27    33.750 kHz     74.250000 MHz
    VIC  75:  1920x1080   50.000000 Hz  64:27    56.250 kHz    148.500000 MHz
    VIC  76:  1920x1080   60.000000 Hz  64:27    67.500 kHz    148.500000 MHz
    VIC  93:  3840x2160   24.000000 Hz  16:9     54.000 kHz    297.000000 MHz
    VIC  94:  3840x2160   25.000000 Hz  16:9     56.250 kHz    297.000000 MHz
    VIC  95:  3840x2160   30.000000 Hz  16:9     67.500 kHz    297.000000 MHz
    VIC  96:  3840x2160   50.000000 Hz  16:9    112.500 kHz    594.000000 MHz
    VIC  97:  3840x2160   60.000000 Hz  16:9    135.000 kHz    594.000000 MHz
    VIC  98:  4096x2160   24.000000 Hz 256:135   54.000 kHz    297.000000 MHz
    VIC  99:  4096x2160   25.000000 Hz 256:135   56.250 kHz    297.000000 MHz
    VIC 100:  4096x2160   30.000000 Hz 256:135   67.500 kHz    297.000000 MHz
    VIC 101:  4096x2160   50.000000 Hz 256:135  112.500 kHz    594.000000 MHz
    VIC 102:  4096x2160   60.000000 Hz 256:135  135.000 kHz    594.000000 MHz
    VIC 103:  3840x2160   24.000000 Hz  64:27    54.000 kHz    297.000000 MHz
    VIC 104:  3840x2160   25.000000 Hz  64:27    56.250 kHz    297.000000 MHz
    VIC 105:  3840x2160   30.000000 Hz  64:27    67.500 kHz    297.000000 MHz
    VIC 106:  3840x2160   50.000000 Hz  64:27   112.500 kHz    594.000000 MHz
    VIC 107:  3840x2160   60.000000 Hz  64:27   135.000 kHz    594.000000 MHz
  Video Capability Data Block:
    YCbCr quantization: Selectable (via AVI YQ)
    RGB quantization: Selectable (via AVI Q)
    PT scan behavior: Always Overscanned
    IT scan behavior: Always Overscanned
    CE scan behavior: Always Overscanned
  Colorimetry Data Block:
    BT2020YCC
    BT2020RGB
  Audio Data Block:
    Linear PCM:
      Max channels: 2
      Supported sample rates (kHz): 192 176.4 96 88.2 48 44.1 32
      Supported sample sizes (bits): 24 20 16
  Speaker Allocation Data Block:
    FL/FR - Front Left/Right
  YCbCr 4:2:0 Capability Map Data Block:
    VIC  96:  3840x2160   50.000000 Hz  16:9    112.500 kHz    594.000000 MHz
    VIC  97:  3840x2160   60.000000 Hz  16:9    135.000 kHz    594.000000 MHz
  Vendor-Specific Data Block (HDMI), OUI 00-0C-03:
    Source physical address: 1.0.0.0
    DC_36bit
    DC_30bit
    DC_Y444
    Maximum TMDS clock: 600 MHz
    Extended HDMI video details:
      HDMI VICs:
        HDMI VIC 1:  3840x2160   30.000000 Hz  16:9     67.500 kHz    297.000000 MHz
        HDMI VIC 2:  3840x2160   25.000000 Hz  16:9     56.250 kHz    297.000000 MHz
        HDMI VIC 3:  3840x2160   24.000000 Hz  16:9     54.000 kHz    297.000000 MHz
        HDMI VIC 4:  4096x2160   24.000000 Hz 256:135   54.000 kHz    297.000000 MHz
  Vendor-Specific Data Block (HDMI Forum), OUI C4-5D-D8:
    Version: 1
    Maximum TMDS Character Rate: 600 MHz
    SCDC Present
    Supports scrambling for <= 340 Mcsc
    Supports 10-bits/component Deep Color 4:2:0 Pixel Encoding
  HDR Static Metadata Data Block:
    Electro optical transfer functions:
      Traditional gamma - SDR luminance range
      SMPTE ST2084
    Supported static metadata descriptors:
      Static metadata type 1
    Desired content max luminance: 105 (486.099 cd/m^2)
    Desired content max frame-average luminance: 105 (486.099 cd/m^2)
    Desired content min luminance: 79 (0.467 cd/m^2)
  Detailed Timing Descriptors:
    DTD 4:  3840x1100   60.017422 Hz 192:55    68.900 kHz    275.600000 MHz (344 mm x 99 mm)
                 Hfront   48 Hsync  32 Hback   80 Hpol P
                 Vfront    3 Vsync   5 Vback   40 Vpol N
    DTD 5:  1920x550    59.959480 Hz 192:55    35.856 kHz     74.580000 MHz (344 mm x 99 mm)
                 Hfront   48 Hsync  32 Hback   80 Hpol P
                 Vfront    3 Vsync   5 Vback   40 Vpol N
Checksum: 0xb5  Unused space in Extension Block: 5 bytes

----------------

Warnings:

Block 0, Base EDID:
  Detailed Timing Descriptor #1: Dubious image size (344x99 mm is smaller than 100x100 mm).
  Detailed Timing Descriptor #2: Dubious image size (344x99 mm is smaller than 100x100 mm).
  Detailed Timing Descriptor #3: Dubious image size (344x99 mm is smaller than 100x100 mm).
Block 1, CTA-861 Extension Block:
  Video Data Block: VIC 4 and the first DTD are not identical. Is this intended?
  Video Data Block: All VICs are in ascending order, and the first (preferred) VIC <= 4, is that intended?
  Video Capability Data Block: IT scan behavior is expected to support underscanned.
  Video Capability Data Block: S_PT is equal to S_IT and S_CE, so should be set to 0 instead.
  Detailed Timing Descriptor #4: Dubious image size (344x99 mm is smaller than 100x100 mm).
  Detailed Timing Descriptor #5: Dubious image size (344x99 mm is smaller than 100x100 mm).
EDID:
  Base EDID: Some timings are out of range of the Monitor Ranges:
    Maximum Clock: 594.000 MHz (Monitor: 80.000 MHz)

Failures:

Block 0, Base EDID:
  Basic Display Parameters & Features: EDID 1.3 requires that the first detailed timing is the preferred timing.
  Missing Display Product Name.
Block 1, CTA-861 Extension Block:
  Video Capability Data Block: IT video formats are always overscanned, but bit 7 of Byte 3 of the CTA-861 Extension header is set to underscanned.
  Vendor-Specific Data Block (HDMI), OUI 00-0C-03: HDMI VSDB Max TMDS rate is > 340.
  Vendor-Specific Data Block (HDMI Forum), OUI C4-5D-D8: HDMI VIC and related CTA VIC codes are present, but the UHD VIC bit is 0.
  Required 640x480p60 timings are missing in the established timings and the SVD list (VIC 1).
EDID:
  Extension Block 2 started with EDID header, ignoring Extension Blocks >= 2.
  Base EDID: The DTD max image size is 344x99mm, but the display size is not specified anywhere.

EDID conformity: FAIL
