edid-decode (hex):

00 ff ff ff ff ff ff 00 04 72 0e 01 4d 1a 30 12
17 15 01 03 68 29 1a 78 2a 37 c5 a4 55 4c 9b 25
12 50 54 bf ee 80 71 4f 81 c0 81 00 01 01 01 01
01 01 01 01 01 01 9a 29 a0 d0 51 84 22 30 50 98
36 00 98 ff 10 00 00 1e 00 00 00 fd 00 37 4c 1e
51 0e 00 0a 20 20 20 20 20 20 00 00 00 fc 00 41
63 65 72 20 56 31 39 33 57 0a 20 20 00 00 00 ff
00 4c 4a 45 30 57 31 36 38 34 33 30 35 0a 00 e6

00 ff ff ff ff ff ff 00 04 72 0e 01 4d 1a 30 12
17 15 01 03 68 29 1a 78 2a 37 c5 a4 55 4c 9b 25
12 50 54 bf ee 80 71 4f 81 c0 81 00 01 01 01 01
01 01 01 01 01 01 9a 29 a0 d0 51 84 22 30 50 98
36 00 98 ff 10 00 00 1e 00 00 00 fd 00 37 4c 1e
51 0e 00 0a 20 20 20 20 20 20 00 00 00 fc 00 41
63 65 72 20 56 31 39 33 57 0a 20 20 00 00 00 ff
00 4c 4a 45 30 57 31 36 38 34 33 30 35 0a 00 e6

----------------

Block 0, Base EDID:
  EDID Structure Version & Revision: 1.3
  Vendor & Product Identification:
    Manufacturer: ACR
    Model: 270
    Serial Number: ...
    Made in: week 23 of 2011
  Basic Display Parameters & Features:
    Analog display
    Signal Level Standard: 0.700 : 0.000 : 0.700 V p-p
    Blank level equals black level
    Sync: Separate
    Maximum image size: 41 cm x 26 cm
    Gamma: 2.20
    DPMS levels: Off
    RGB color display
    First detailed timing is the preferred timing
  Color Characteristics:
    Red  : 0.6406, 0.3349
    Green: 0.2978, 0.6083
    Blue : 0.1474, 0.0703
    White: 0.3134, 0.3291
  Established Timings I & II:
    IBM     :   720x400    70.081663 Hz   9:5     31.467 kHz     28.320000 MHz
    DMT 0x04:   640x480    59.940476 Hz   4:3     31.469 kHz     25.175000 MHz
    Apple   :   640x480    66.666667 Hz   4:3     35.000 kHz     30.240000 MHz
    DMT 0x05:   640x480    72.808802 Hz   4:3     37.861 kHz     31.500000 MHz
    DMT 0x06:   640x480    75.000000 Hz   4:3     37.500 kHz     31.500000 MHz
    DMT 0x08:   800x600    56.250000 Hz   4:3     35.156 kHz     36.000000 MHz
    DMT 0x09:   800x600    60.316541 Hz   4:3     37.879 kHz     40.000000 MHz
    DMT 0x0a:   800x600    72.187572 Hz   4:3     48.077 kHz     50.000000 MHz
    DMT 0x0b:   800x600    75.000000 Hz   4:3     46.875 kHz     49.500000 MHz
    Apple   :   832x624    74.551266 Hz   4:3     49.726 kHz     57.284000 MHz
    DMT 0x10:  1024x768    60.003840 Hz   4:3     48.363 kHz     65.000000 MHz
    DMT 0x11:  1024x768    70.069359 Hz   4:3     56.476 kHz     75.000000 MHz
    DMT 0x12:  1024x768    75.028582 Hz   4:3     60.023 kHz     78.750000 MHz
    Apple   :  1152x870    75.061550 Hz 192:145   68.681 kHz    100.000000 MHz
  Standard Timings:
    DMT 0x15:  1152x864    75.000000 Hz   4:3     67.500 kHz    108.000000 MHz
    DMT 0x55:  1280x720    60.000000 Hz  16:9     45.000 kHz     74.250000 MHz
    DMT 0x1c:  1280x800    59.810326 Hz  16:10    49.702 kHz     83.500000 MHz
  Detailed Timing Descriptors:
    DTD 1:  1440x900    59.887445 Hz  16:10    55.935 kHz    106.500000 MHz (408 mm x 255 mm)
                 Hfront   80 Hsync 152 Hback  232 Hpol P
                 Vfront    3 Vsync   6 Vback   25 Vpol P
    Display Range Limits:
      Monitor ranges (GTF): 55-76 Hz V, 30-81 kHz H, max dotclock 140 MHz
    Display Product Name: 'Acer V193W'
    Display Product Serial Number: ...
Checksum: 0xe6

----------------

Warnings:

Block 0, Base EDID:
  Detailed Timing Descriptor #1: DTD is similar but not identical to DMT 0x2f.

Failures:

EDID:
  Extension Block 1 started with EDID header, ignoring Extension Blocks >= 1.

EDID conformity: FAIL
