edid-decode (hex):

00 ff ff ff ff ff ff 00 06 af 96 15 00 00 00 00
00 1b 01 04 a5 26 15 78 02 9d 75 a4 57 56 9c 27
0c 50 54 00 00 00 01 01 01 01 01 01 01 01 01 01
01 01 01 01 01 01 94 61 00 a0 a0 a0 5a 50 30 20
35 00 7e d6 10 00 00 1a 94 61 00 a0 a0 a0 d6 51
30 20 35 00 7e d6 10 00 00 1a 00 00 00 fe 00 32
4a 56 4d 36 80 42 31 37 33 51 54 4e 00 00 00 00
00 02 41 00 28 00 01 00 00 0b 01 0a 20 20 00 60

----------------

Block 0, Base EDID:
  EDID Structure Version & Revision: 1.4
  Vendor & Product Identification:
    Manufacturer: AUO
    Model: 5526
    Made in: 2017
  Basic Display Parameters & Features:
    Digital display
    Bits per primary color channel: 8
    DisplayPort interface
    Maximum image size: 38 cm x 21 cm
    Gamma: 2.20
    Supported color formats: RGB 4:4:4
    First detailed timing includes the native pixel format and preferred refresh rate
  Color Characteristics:
    Red  : 0.6425, 0.3408
    Green: 0.3388, 0.6103
    Blue : 0.1533, 0.0498
    White: 0.3134, 0.3291
  Established Timings I & II: none
  Standard Timings: none
  Detailed Timing Descriptors:
    DTD 1:  2560x1440   60.024990 Hz  16:9     91.838 kHz    249.800000 MHz (382 mm x 214 mm)
                 Hfront   48 Hsync  32 Hback   80 Hpol P
                 Vfront    3 Vsync   5 Vback   82 Vpol N
    DTD 2:  2560x1440   48.082846 Hz  16:9     91.838 kHz    249.800000 MHz (382 mm x 214 mm)
                 Hfront   48 Hsync  32 Hback   80 Hpol P
                 Vfront    3 Vsync   5 Vback  462 Vpol N
    Alphanumeric Data String: '2JVM6.B173QTN'
    Manufacturer-Specified Display Descriptor (0x00): 00 00 00 02 41 00 28 00 01 00 00 0b 01 0a 20 20 '....A.(.......  '
Checksum: 0x60

----------------

Warnings:

Block 0, Base EDID:
  Alphanumeric Data String: Non-ASCII character 0x80 at position 5, can cause problems.
  Missing Display Product Name.

EDID conformity: PASS
