edid-decode (hex):

00 ff ff ff ff ff ff 00 1e 6d f0 75 01 01 01 01
0a 12 01 03 80 46 27 78 ea d9 b0 a3 57 49 9c 25
11 49 4b a1 0c 00 31 40 45 40 61 40 81 80 01 01
01 01 d1 c0 01 01 1b 21 50 a0 51 00 1e 30 48 88
35 00 bc 86 21 00 00 1c 1a 36 80 a0 70 38 1f 40
30 20 35 00 e8 26 32 00 00 1a 00 00 00 fd 00 32
4b 1c 43 0f 00 00 00 00 00 00 00 00 00 00 00 fc
00 4c 47 20 54 56 0a 20 20 20 20 20 20 20 01 c4

02 03 23 f1 4e 01 06 15 02 03 11 12 13 04 14 85
20 1f 10 23 15 07 50 83 01 00 00 67 03 0c 00 20
00 b8 2d 01 1d 00 80 51 d0 1c 20 40 80 35 00 bc
88 21 00 00 1e 8c 0a d0 8a 20 e0 2d 10 10 3e 96
00 13 8e 21 00 00 18 02 3a 80 18 71 38 2d 40 58
2c 45 00 06 44 21 00 00 1e 01 1d 80 18 71 1c 16
20 58 2c 25 00 c4 8e 21 00 00 9e 4e 1f 00 80 51
00 1e 30 40 80 37 00 bc 88 21 00 00 18 00 00 fb

00 ff ff ff ff ff ff 00 1e 6d f0 75 01 01 01 01
0a 12 01 03 80 46 27 78 ea d9 b0 a3 57 49 9c 25
11 49 4b a1 0c 00 31 40 45 40 61 40 81 80 01 01
01 01 d1 c0 01 01 1b 21 50 a0 51 00 1e 30 48 88
35 00 bc 86 21 00 00 1c 1a 36 80 a0 70 38 1f 40
30 20 35 00 e8 26 32 00 00 1a 00 00 00 fd 00 32
4b 1c 43 0f 00 00 00 00 00 00 00 00 00 00 00 fc
00 4c 47 20 54 56 0a 20 20 20 20 20 20 20 01 c4

02 03 23 f1 4e 01 06 15 02 03 11 12 13 04 14 85
20 1f 10 23 15 07 50 83 01 00 00 67 03 0c 00 20
00 b8 2d 01 1d 00 80 51 d0 1c 20 40 80 35 00 bc
88 21 00 00 1e 8c 0a d0 8a 20 e0 2d 10 10 3e 96
00 13 8e 21 00 00 18 02 3a 80 18 71 38 2d 40 58
2c 45 00 06 44 21 00 00 1e 01 1d 80 18 71 1c 16
20 58 2c 25 00 c4 8e 21 00 00 9e 4e 1f 00 80 51
00 1e 30 40 80 37 00 bc 88 21 00 00 18 00 00 fb

----------------

Block 0, Base EDID:
  EDID Structure Version & Revision: 1.3
  Vendor & Product Identification:
    Manufacturer: GSM
    Model: 30192
    Serial Number: ...
    Made in: week 10 of 2008
  Basic Display Parameters & Features:
    Digital display
    Maximum image size: 70 cm x 39 cm
    Gamma: 2.20
    DPMS levels: Standby Suspend Off
    RGB color display
    First detailed timing is the preferred timing
  Color Characteristics:
    Red  : 0.6396, 0.3408
    Green: 0.2871, 0.6103
    Blue : 0.1464, 0.0693
    White: 0.2851, 0.2929
  Established Timings I & II:
    IBM     :   720x400    70.081663 Hz   9:5     31.467 kHz     28.320000 MHz
    DMT 0x04:   640x480    59.940476 Hz   4:3     31.469 kHz     25.175000 MHz
    DMT 0x09:   800x600    60.316541 Hz   4:3     37.879 kHz     40.000000 MHz
    DMT 0x10:  1024x768    60.003840 Hz   4:3     48.363 kHz     65.000000 MHz
    DMT 0x11:  1024x768    70.069359 Hz   4:3     56.476 kHz     75.000000 MHz
  Standard Timings:
    DMT 0x04:   640x480    59.940476 Hz   4:3     31.469 kHz     25.175000 MHz
    DMT 0x09:   800x600    60.316541 Hz   4:3     37.879 kHz     40.000000 MHz
    DMT 0x10:  1024x768    60.003840 Hz   4:3     48.363 kHz     65.000000 MHz
    DMT 0x23:  1280x1024   60.019740 Hz   5:4     63.981 kHz    108.000000 MHz
    DMT 0x52:  1920x1080   60.000000 Hz  16:9     67.500 kHz    148.500000 MHz
  Detailed Timing Descriptors:
    DTD 1:  1360x768    59.798991 Hz  85:48    47.720 kHz     84.750000 MHz (700 mm x 390 mm)
                 Hfront   72 Hsync 136 Hback  208 Hpol N
                 Vfront    3 Vsync   5 Vback   22 Vpol P
    DTD 2:  1920x1080   59.933878 Hz  16:9     66.587 kHz    138.500000 MHz (1000 mm x 550 mm)
                 Hfront   48 Hsync  32 Hback   80 Hpol P
                 Vfront    3 Vsync   5 Vback   23 Vpol N
    Display Range Limits:
      Monitor ranges (GTF): 50-75 Hz V, 28-67 kHz H, max dotclock 150 MHz
    Display Product Name: 'LG TV'
  Extension blocks: 1
Checksum: 0xc4

----------------

Block 1, CTA-861 Extension Block:
  Revision: 3
  Underscans IT Video Formats by default
  Basic audio support
  Supports YCbCr 4:4:4
  Supports YCbCr 4:2:2
  Native DTDs: 1
  Video Data Block:
    VIC   1:   640x480    59.940476 Hz   4:3     31.469 kHz     25.175000 MHz
    VIC   6:  1440x480i   59.940060 Hz   4:3     15.734 kHz     27.000000 MHz
    VIC  21:  1440x576i   50.000000 Hz   4:3     15.625 kHz     27.000000 MHz
    VIC   2:   720x480    59.940060 Hz   4:3     31.469 kHz     27.000000 MHz
    VIC   3:   720x480    59.940060 Hz  16:9     31.469 kHz     27.000000 MHz
    VIC  17:   720x576    50.000000 Hz   4:3     31.250 kHz     27.000000 MHz
    VIC  18:   720x576    50.000000 Hz  16:9     31.250 kHz     27.000000 MHz
    VIC  19:  1280x720    50.000000 Hz  16:9     37.500 kHz     74.250000 MHz
    VIC   4:  1280x720    60.000000 Hz  16:9     45.000 kHz     74.250000 MHz
    VIC  20:  1920x1080i  50.000000 Hz  16:9     28.125 kHz     74.250000 MHz
    VIC   5:  1920x1080i  60.000000 Hz  16:9     33.750 kHz     74.250000 MHz (native)
    VIC  32:  1920x1080   24.000000 Hz  16:9     27.000 kHz     74.250000 MHz
    VIC  31:  1920x1080   50.000000 Hz  16:9     56.250 kHz    148.500000 MHz
    VIC  16:  1920x1080   60.000000 Hz  16:9     67.500 kHz    148.500000 MHz
  Audio Data Block:
    AC-3:
      Max channels: 6
      Supported sample rates (kHz): 48 44.1 32
      Maximum bit rate: 640 kb/s
  Speaker Allocation Data Block:
    FL/FR - Front Left/Right
  Vendor-Specific Data Block (HDMI), OUI 00-0C-03:
    Source physical address: 2.0.0.0
    Supports_AI
    DC_36bit
    DC_30bit
    DC_Y444
    Maximum TMDS clock: 225 MHz
  Detailed Timing Descriptors:
    DTD 3:  1280x720    59.654270 Hz  16:9     44.621 kHz     74.250000 MHz (700 mm x 392 mm)
                 Hfront   64 Hsync 128 Hback  192 Hpol P
                 Vfront    3 Vsync   5 Vback   20 Vpol P
    DTD 4:   720x480    59.940060 Hz   3:2     31.469 kHz     27.000000 MHz (531 mm x 398 mm)
                 Hfront   16 Hsync  62 Hback   60 Hpol N
                 Vfront    9 Vsync   6 Vback   30 Vpol N
    DTD 5:  1920x1080   60.000000 Hz  16:9     67.500 kHz    148.500000 MHz (518 mm x 324 mm)
                 Hfront   88 Hsync  44 Hback  148 Hpol P
                 Vfront    4 Vsync   5 Vback   36 Vpol P
    DTD 6:  1920x1080i  60.000000 Hz  16:9     33.750 kHz     74.250000 MHz (708 mm x 398 mm)
                 Hfront   88 Hsync  44 Hback  148 Hpol P
                 Vfront    2 Vsync   5 Vback   15 Vpol P Vfront +0.5 Odd Field
                 Vfront    2 Vsync   5 Vback   15 Vpol P Vback  +0.5 Even Field
    DTD 7:  1280x768    60.352203 Hz   5:3     48.161 kHz     80.140000 MHz (700 mm x 392 mm)
                 Hfront   64 Hsync 128 Hback  192 Hpol N
                 Vfront    3 Vsync   7 Vback   20 Vpol N
Checksum: 0xfb  Unused space in Extension Block: 2 bytes

----------------

Warnings:

Block 0, Base EDID:
  Vendor & Product Identification: The serial number is one of the known dummy values, it should probably be set to 0.
  Detailed Timing Descriptor #2: Image size is 1000x550 mm, but based on the picture AR it should be 977x550 mm.
Block 1, CTA-861 Extension Block:
  Video Data Block: VIC 1 and the first DTD are not identical. Is this intended?
  Detailed Timing Descriptor #4: Image size is 531x398 mm, but based on the picture AR it should be 531x354 mm.
  Detailed Timing Descriptor #5: Image size is 518x324 mm, but based on the picture AR it should be 518x291 mm.
  Detailed Timing Descriptor #7: Image size is 700x392 mm, but based on the picture AR it should be 653x392 mm.
  Add a Colorimetry Data Block with the sRGB colorimetry bit set to avoid interop issues.
EDID:
  Base EDID: Some timings are out of range of the Monitor Ranges:
    Vertical Freq: 24.000 - 70.082 Hz (Monitor: 50.000 - 75.000 Hz)
    Horizontal Freq: 15.625 - 67.500 kHz (Monitor: 28.000 - 67.000 kHz)

Failures:

Block 0, Base EDID:
  Detailed Timing Descriptor #2: Mismatch of image size 1000x550 mm vs display size 700x390 mm.
  Display Range Limits: Byte 11 is 0x00 instead of 0x0a.
  Display Range Limits: Bytes 12-17 must be 0x20.
Block 1, CTA-861 Extension Block:
  Detailed Timing Descriptor #5: Mismatch of image size 518x324 mm vs display size 700x390 mm.
  Missing VCDB, needed for Set Selectable RGB Quantization to avoid interop issues.
EDID:
  Extension Block 2 started with EDID header, ignoring Extension Blocks >= 2.
  Base EDID: The DTD max image size is 1000x550mm, which is larger than the display size 700.0x390.0mm.

EDID conformity: FAIL
