edid-decode (hex):

00 ff ff ff ff ff ff 00 08 59 00 40 01 00 00 00
23 16 01 03 80 56 31 78 0c ee 91 a3 54 4c 99 26
0f 50 54 a3 08 00 81 c0 81 00 81 0f 81 40 81 80
95 00 b3 00 01 01 02 3a 80 18 71 38 2d 40 58 2c
45 00 7a f4 31 00 00 1e 0e 1f 00 80 51 00 1e 30
40 80 37 00 4f 63 21 00 00 1c 00 00 00 fc 00 4e
53 2d 33 39 45 34 38 30 41 31 33 0a 00 00 00 fd
00 32 55 1f 45 0f 00 0a 20 20 20 20 20 20 01 35

02 03 1e 72 47 22 20 06 02 04 05 10 26 09 07 07
17 7f 18 83 01 00 00 66 03 0c 00 30 00 f8 8c 0a
d0 8a 20 e0 2d 10 10 3e 96 00 13 8e 21 00 00 18
01 1d 00 72 51 d0 1e 20 6e 28 55 00 c4 8e 21 00
00 1e f3 39 80 18 71 38 2d 40 58 2c 45 00 c4 8e
21 00 00 1e 00 00 00 00 00 00 00 00 00 00 00 00
00 00 00 00 00 00 00 00 00 00 00 00 00 00 00 00
00 00 00 00 00 00 00 00 00 00 00 00 00 00 00 2b

00 ff ff ff ff ff ff 00 08 59 00 40 01 00 00 00
23 16 01 03 80 56 31 78 0c ee 91 a3 54 4c 99 26
0f 50 54 a3 08 00 81 c0 81 00 81 0f 81 40 81 80
95 00 b3 00 01 01 02 3a 80 18 71 38 2d 40 58 2c
45 00 7a f4 31 00 00 1e 0e 1f 00 80 51 00 1e 30
40 80 37 00 4f 63 21 00 00 1c 00 00 00 fc 00 4e
53 2d 33 39 45 34 38 30 41 31 33 0a 00 00 00 fd
00 32 55 1f 45 0f 00 0a 20 20 20 20 20 20 01 35

02 03 1e 72 47 22 20 06 02 04 05 10 26 09 07 07
17 7f 18 83 01 00 00 66 03 0c 00 30 00 f8 8c 0a
d0 8a 20 e0 2d 10 10 3e 96 00 13 8e 21 00 00 18
01 1d 00 72 51 d0 1e 20 6e 28 55 00 c4 8e 21 00
00 1e f3 39 80 18 71 38 2d 40 58 2c 45 00 c4 8e
21 00 00 1e 00 00 00 00 00 00 00 00 00 00 00 00
00 00 00 00 00 00 00 00 00 00 00 00 00 00 00 00
00 00 00 00 00 00 00 00 00 00 00 00 00 00 00 2b

----------------

Block 0, Base EDID:
  EDID Structure Version & Revision: 1.3
  Vendor & Product Identification:
    Manufacturer: BBY
    Model: 16384
    Serial Number: ...
    Made in: week 35 of 2012
  Basic Display Parameters & Features:
    Digital display
    Maximum image size: 86 cm x 49 cm
    Gamma: 2.20
    RGB color display
    Default (sRGB) color space is primary color space
  Color Characteristics:
    Red  : 0.6396, 0.3300
    Green: 0.2998, 0.5996
    Blue : 0.1503, 0.0595
    White: 0.3125, 0.3291
  Established Timings I & II:
    IBM     :   720x400    70.081663 Hz   9:5     31.467 kHz     28.320000 MHz
    DMT 0x04:   640x480    59.940476 Hz   4:3     31.469 kHz     25.175000 MHz
    DMT 0x08:   800x600    56.250000 Hz   4:3     35.156 kHz     36.000000 MHz
    DMT 0x09:   800x600    60.316541 Hz   4:3     37.879 kHz     40.000000 MHz
    DMT 0x10:  1024x768    60.003840 Hz   4:3     48.363 kHz     65.000000 MHz
  Standard Timings:
    DMT 0x55:  1280x720    60.000000 Hz  16:9     45.000 kHz     74.250000 MHz
    DMT 0x1c:  1280x800    59.810326 Hz  16:10    49.702 kHz     83.500000 MHz
    DMT 0x1d:  1280x800    74.934142 Hz  16:10    62.795 kHz    106.500000 MHz
    DMT 0x20:  1280x960    60.000000 Hz   4:3     60.000 kHz    108.000000 MHz
    DMT 0x23:  1280x1024   60.019740 Hz   5:4     63.981 kHz    108.000000 MHz
    DMT 0x2f:  1440x900    59.887445 Hz  16:10    55.935 kHz    106.500000 MHz
    DMT 0x3a:  1680x1050   59.954250 Hz  16:10    65.290 kHz    146.250000 MHz
  Detailed Timing Descriptors:
    DTD 1:  1920x1080   60.000000 Hz  16:9     67.500 kHz    148.500000 MHz (890 mm x 500 mm)
                 Hfront   88 Hsync  44 Hback  148 Hpol P
                 Vfront    4 Vsync   5 Vback   36 Vpol P
    DTD 2:  1280x768    59.870228 Hz   5:3     47.776 kHz     79.500000 MHz (591 mm x 355 mm)
                 Hfront   64 Hsync 128 Hback  192 Hpol N
                 Vfront    3 Vsync   7 Vback   20 Vpol P
    Display Product Name: 'NS-39E480A13'
    Display Range Limits:
      Monitor ranges (GTF): 50-85 Hz V, 31-69 kHz H, max dotclock 150 MHz
  Extension blocks: 1
Checksum: 0x35

----------------

Block 1, CTA-861 Extension Block:
  Revision: 3
  Basic audio support
  Supports YCbCr 4:4:4
  Supports YCbCr 4:2:2
  Native DTDs: 2
  Video Data Block:
    VIC  34:  1920x1080   30.000000 Hz  16:9     33.750 kHz     74.250000 MHz
    VIC  32:  1920x1080   24.000000 Hz  16:9     27.000 kHz     74.250000 MHz
    VIC   6:  1440x480i   59.940060 Hz   4:3     15.734 kHz     27.000000 MHz
    VIC   2:   720x480    59.940060 Hz   4:3     31.469 kHz     27.000000 MHz
    VIC   4:  1280x720    60.000000 Hz  16:9     45.000 kHz     74.250000 MHz
    VIC   5:  1920x1080i  60.000000 Hz  16:9     33.750 kHz     74.250000 MHz
    VIC  16:  1920x1080   60.000000 Hz  16:9     67.500 kHz    148.500000 MHz
  Audio Data Block:
    Linear PCM:
      Max channels: 2
      Supported sample rates (kHz): 48 44.1 32
      Supported sample sizes (bits): 24 20 16
    AC-3:
      Max channels: 8
      Supported sample rates (kHz): 192 176.4 96 88.2 48 44.1 32
      Maximum bit rate: 192 kb/s
  Speaker Allocation Data Block:
    FL/FR - Front Left/Right
  Vendor-Specific Data Block (HDMI), OUI 00-0C-03:
    Source physical address: 3.0.0.0
    Supports_AI
    DC_48bit
    DC_36bit
    DC_30bit
    DC_Y444
  Detailed Timing Descriptors:
    DTD 3:   720x480    59.940060 Hz   3:2     31.469 kHz     27.000000 MHz (531 mm x 398 mm)
                 Hfront   16 Hsync  62 Hback   60 Hpol N
                 Vfront    9 Vsync   6 Vback   30 Vpol N
    DTD 4:  1280x720    60.000000 Hz  16:9     45.000 kHz     74.250000 MHz (708 mm x 398 mm)
                 Hfront  110 Hsync  40 Hback  220 Hpol P
                 Vfront    5 Vsync   5 Vback   20 Vpol P
    DTD 5:  1920x1080   59.939394 Hz  16:9     67.432 kHz    148.350000 MHz (708 mm x 398 mm)
                 Hfront   88 Hsync  44 Hback  148 Hpol P
                 Vfront    4 Vsync   5 Vback   36 Vpol P
Checksum: 0x2b  Unused space in Extension Block: 43 bytes

----------------

Warnings:

Block 0, Base EDID:
  Vendor & Product Identification: The serial number is one of the known dummy values, it should probably be set to 0.
Block 1, CTA-861 Extension Block:
  IT Video Formats are overscanned by default, but normally this should be underscanned.
  Video Data Block: VIC 34 and the first DTD are not identical. Is this intended?
  Detailed Timing Descriptor #3: Image size is 531x398 mm, but based on the picture AR it should be 531x354 mm.
EDID:
  Base EDID: Some timings are out of range of the Monitor Ranges:
    Vertical Freq: 24.000 - 74.934 Hz (Monitor: 50.000 - 85.000 Hz)
    Horizontal Freq: 15.734 - 67.500 kHz (Monitor: 31.000 - 69.000 kHz)

Failures:

Block 0, Base EDID:
  Basic Display Parameters & Features: EDID 1.3 requires that the first detailed timing is the preferred timing.
  Detailed Timing Descriptor #1: Mismatch of image size 890x500 mm vs display size 860x490 mm.
  Detailed Timing Descriptor #2: Mismatch of image size 591x355 mm vs display size 860x490 mm.
Block 1, CTA-861 Extension Block:
  Detailed Timing Descriptor #3: Mismatch of image size 531x398 mm vs display size 860x490 mm.
  Detailed Timing Descriptor #4: Mismatch of image size 708x398 mm vs display size 860x490 mm.
  Detailed Timing Descriptor #5: Mismatch of image size 708x398 mm vs display size 860x490 mm.
  Missing VCDB, needed for Set Selectable RGB Quantization to avoid interop issues.
EDID:
  Extension Block 2 started with EDID header, ignoring Extension Blocks >= 2.
  Base EDID: The DTD max image size is 890x500mm, which is larger than the display size 860.0x490.0mm.
  CTA-861: Native progressive timings are a mix of several resolutions.

EDID conformity: FAIL
