edid-decode (hex):

00 ff ff ff ff ff ff 00 4e 83 01 05 f6 0c 00 00
14 0d 01 03 08 1e 17 78 28 2b 05 a0 5b 4b 96 25
18 50 54 bf ee 00 61 40 01 01 01 01 01 01 01 01
01 01 01 01 01 01 64 19 00 40 41 00 26 30 18 88
36 00 30 e4 10 00 00 1e 00 00 00 fd 00 32 4b 1e
3c 09 01 20 20 20 20 20 20 20 00 00 00 fc 00 45
31 35 54 73 0a 20 20 20 20 20 20 20 00 00 00 ff
00 4d 53 35 33 35 33 34 41 30 33 33 31 38 00 7d

----------------

Block 0, Base EDID:
  EDID Structure Version & Revision: 1.3
  Vendor & Product Identification:
    Manufacturer: STC
    Model: 1281
    Serial Number: ...
    Made in: week 20 of 2003
  Basic Display Parameters & Features:
    Analog display
    Signal Level Standard: 0.700 : 0.300 : 1.000 V p-p
    Blank level equals black level
    Sync: Separate
    Maximum image size: 30 cm x 23 cm
    Gamma: 2.20
    DPMS levels: Off
    RGB color display
  Color Characteristics:
    Red  : 0.6250, 0.3574
    Green: 0.2949, 0.5888
    Blue : 0.1445, 0.0937
    White: 0.3134, 0.3291
  Established Timings I & II:
    IBM     :   720x400    70.081663 Hz   9:5     31.467 kHz     28.320000 MHz
    DMT 0x04:   640x480    59.940476 Hz   4:3     31.469 kHz     25.175000 MHz
    Apple   :   640x480    66.666667 Hz   4:3     35.000 kHz     30.240000 MHz
    DMT 0x05:   640x480    72.808802 Hz   4:3     37.861 kHz     31.500000 MHz
    DMT 0x06:   640x480    75.000000 Hz   4:3     37.500 kHz     31.500000 MHz
    DMT 0x08:   800x600    56.250000 Hz   4:3     35.156 kHz     36.000000 MHz
    DMT 0x09:   800x600    60.316541 Hz   4:3     37.879 kHz     40.000000 MHz
    DMT 0x0a:   800x600    72.187572 Hz   4:3     48.077 kHz     50.000000 MHz
    DMT 0x0b:   800x600    75.000000 Hz   4:3     46.875 kHz     49.500000 MHz
    Apple   :   832x624    74.551266 Hz   4:3     49.726 kHz     57.284000 MHz
    DMT 0x10:  1024x768    60.003840 Hz   4:3     48.363 kHz     65.000000 MHz
    DMT 0x11:  1024x768    70.069359 Hz   4:3     56.476 kHz     75.000000 MHz
    DMT 0x12:  1024x768    75.028582 Hz   4:3     60.023 kHz     78.750000 MHz
  Standard Timings:
    DMT 0x10:  1024x768    60.003840 Hz   4:3     48.363 kHz     65.000000 MHz
  Detailed Timing Descriptors:
    DTD 1:  1024x768    60.003840 Hz   4:3     48.363 kHz     65.000000 MHz (304 mm x 228 mm)
                 Hfront   24 Hsync 136 Hback  160 Hpol P
                 Vfront    3 Vsync   6 Vback   29 Vpol P
    Display Range Limits:
      Monitor ranges (Range Limits Only): 50-75 Hz V, 30-60 kHz H, max dotclock 90 MHz
    Display Product Name: 'E15Ts'
    Display Product Serial Number: ...
Checksum: 0x7d

----------------

Warnings:

Block 0, Base EDID:
  Detailed Timing Descriptor #1: DTD is similar but not identical to DMT 0x10.

Failures:

Block 0, Base EDID:
  Basic Display Parameters & Features: EDID 1.3 requires that the first detailed timing is the preferred timing.
  Display Range Limits: 'Range Limits Only' is not allowed for EDID < 1.4.
  Display Range Limits: Byte 11 is 0x20 instead of 0x0a.

EDID conformity: FAIL
