edid-decode (hex):

00 ff ff ff ff ff ff 00 0e 4d 20 1b ff ff ff ff
24 21 01 03 80 3b 22 78 2a 14 bb ad 52 41 af 25
0d 4a 4c b3 eb 80 71 4f 81 40 81 80 81 c0 81 00
95 00 b3 00 d1 c0 56 5e 00 a0 a0 a0 29 50 30 20
35 00 4e 4e 21 00 00 1e 00 00 00 fd 00 28 f0 1e
ff 69 00 0a 20 20 20 20 20 20 00 00 00 fc 00 32
37 51 48 44 32 34 30 0a 20 20 20 20 00 00 00 ff
00 41 32 54 34 43 33 33 36 34 30 50 55 0a 01 ca

02 03 63 f1 e2 78 02 52 01 03 12 13 04 2f 20 21
22 1f 10 40 3f 5d 5e 5f 60 61 23 09 07 07 83 01
00 00 6d 03 0c 00 20 00 38 44 20 00 60 03 02 01
6d d8 5d c4 01 78 80 3b 1d 28 f0 c3 34 0c e4 0f
00 00 02 e3 0e 75 76 e3 05 c3 81 e2 00 d5 e6 06
0d 01 6e 60 00 6d 1a 00 00 02 01 28 f0 e6 04 00
00 00 00 6f c2 00 a0 a0 a0 55 50 30 20 35 00 4e
4e 21 00 00 1e 00 00 00 00 00 00 00 00 00 00 65

70 12 79 03 00 03 01 64 55 5e 00 84 ff 09 9f 00
2f 80 1f 00 9f 05 28 00 02 80 04 00 cf 85 01 04
ff 09 8b 00 2f 80 1f 00 9f 05 63 00 17 80 13 00
c3 98 01 04 ff 09 9f 00 2f 80 1f 00 9f 05 a2 00
02 80 07 00 38 4e 00 04 ff 09 9f 00 2f 80 1f 00
9f 05 21 00 02 80 04 00 25 f9 00 04 7f 07 17 01
57 80 2b 00 37 04 7f 00 03 80 04 00 00 00 00 00
00 00 00 00 00 00 00 00 00 00 00 00 00 00 b0 90

00 ff ff ff ff ff ff 00 0e 4d 20 1b ff ff ff ff
24 21 01 03 80 3b 22 78 2a 14 bb ad 52 41 af 25
0d 4a 4c b3 eb 80 71 4f 81 40 81 80 81 c0 81 00
95 00 b3 00 d1 c0 56 5e 00 a0 a0 a0 29 50 30 20
35 00 4e 4e 21 00 00 1e 00 00 00 fd 00 28 f0 1e
ff 69 00 0a 20 20 20 20 20 20 00 00 00 fc 00 32
37 51 48 44 32 34 30 0a 20 20 20 20 00 00 00 ff
00 41 32 54 34 43 33 33 36 34 30 50 55 0a 01 ca

02 03 63 f1 e2 78 02 52 01 03 12 13 04 2f 20 21
22 1f 10 40 3f 5d 5e 5f 60 61 23 09 07 07 83 01
00 00 6d 03 0c 00 20 00 38 44 20 00 60 03 02 01
6d d8 5d c4 01 78 80 3b 1d 28 f0 c3 34 0c e4 0f
00 00 02 e3 0e 75 76 e3 05 c3 81 e2 00 d5 e6 06
0d 01 6e 60 00 6d 1a 00 00 02 01 28 f0 e6 04 00
00 00 00 6f c2 00 a0 a0 a0 55 50 30 20 35 00 4e
4e 21 00 00 1e 00 00 00 00 00 00 00 00 00 00 65

70 12 79 03 00 03 01 64 55 5e 00 84 ff 09 9f 00
2f 80 1f 00 9f 05 28 00 02 80 04 00 cf 85 01 04
ff 09 8b 00 2f 80 1f 00 9f 05 63 00 17 80 13 00
c3 98 01 04 ff 09 9f 00 2f 80 1f 00 9f 05 a2 00
02 80 07 00 38 4e 00 04 ff 09 9f 00 2f 80 1f 00
9f 05 21 00 02 80 04 00 25 f9 00 04 7f 07 17 01
57 80 2b 00 37 04 7f 00 03 80 04 00 00 00 00 00
00 00 00 00 00 00 00 00 00 00 00 00 00 00 b0 90

----------------

Block 0, Base EDID:
  EDID Structure Version & Revision: 1.3
  Vendor & Product Identification:
    Manufacturer: CRM
    Model: 6944
    Serial Number: ...
    Made in: week 36 of 2023
  Basic Display Parameters & Features:
    Digital display
    Maximum image size: 59 cm x 34 cm
    Gamma: 2.20
    DPMS levels: Off
    RGB color display
    First detailed timing is the preferred timing
  Color Characteristics:
    Red  : 0.6757, 0.3212
    Green: 0.2548, 0.6835
    Blue : 0.1464, 0.0537
    White: 0.2910, 0.2998
  Established Timings I & II:
    IBM     :   720x400    70.081663 Hz   9:5     31.467 kHz     28.320000 MHz
    DMT 0x04:   640x480    59.940476 Hz   4:3     31.469 kHz     25.175000 MHz
    Apple   :   640x480    66.666667 Hz   4:3     35.000 kHz     30.240000 MHz
    DMT 0x08:   800x600    56.250000 Hz   4:3     35.156 kHz     36.000000 MHz
    DMT 0x09:   800x600    60.316541 Hz   4:3     37.879 kHz     40.000000 MHz
    DMT 0x0a:   800x600    72.187572 Hz   4:3     48.077 kHz     50.000000 MHz
    DMT 0x0b:   800x600    75.000000 Hz   4:3     46.875 kHz     49.500000 MHz
    Apple   :   832x624    74.551266 Hz   4:3     49.726 kHz     57.284000 MHz
    DMT 0x10:  1024x768    60.003840 Hz   4:3     48.363 kHz     65.000000 MHz
    DMT 0x12:  1024x768    75.028582 Hz   4:3     60.023 kHz     78.750000 MHz
    DMT 0x24:  1280x1024   75.024675 Hz   5:4     79.976 kHz    135.000000 MHz
    Apple   :  1152x870    75.061550 Hz 192:145   68.681 kHz    100.000000 MHz
  Standard Timings:
    DMT 0x15:  1152x864    75.000000 Hz   4:3     67.500 kHz    108.000000 MHz
    DMT 0x20:  1280x960    60.000000 Hz   4:3     60.000 kHz    108.000000 MHz
    DMT 0x23:  1280x1024   60.019740 Hz   5:4     63.981 kHz    108.000000 MHz
    DMT 0x55:  1280x720    60.000000 Hz  16:9     45.000 kHz     74.250000 MHz
    DMT 0x1c:  1280x800    59.810326 Hz  16:10    49.702 kHz     83.500000 MHz
    DMT 0x2f:  1440x900    59.887445 Hz  16:10    55.935 kHz    106.500000 MHz
    DMT 0x3a:  1680x1050   59.954250 Hz  16:10    65.290 kHz    146.250000 MHz
    DMT 0x52:  1920x1080   60.000000 Hz  16:9     67.500 kHz    148.500000 MHz
  Detailed Timing Descriptors:
    DTD 1:  2560x1440   59.950550 Hz  16:9     88.787 kHz    241.500000 MHz (590 mm x 334 mm)
                 Hfront   48 Hsync  32 Hback   80 Hpol P
                 Vfront    3 Vsync   5 Vback   33 Vpol P
    Display Range Limits:
      Monitor ranges (GTF): 40-240 Hz V, 30-255 kHz H, max dotclock 1050 MHz
    Display Product Name: '27QHD240'
    Display Product Serial Number: ...
  Extension blocks: 1
Checksum: 0xca

----------------

Block 1, CTA-861 Extension Block:
  Revision: 3
  Underscans IT Video Formats by default
  Basic audio support
  Supports YCbCr 4:4:4
  Supports YCbCr 4:2:2
  Native detailed modes: 1
  HDMI Forum EDID Extension Override Data Block:
    EDID Extension Block Count: 2
  Video Data Block:
    VIC   1:   640x480    59.940476 Hz   4:3     31.469 kHz     25.175000 MHz
    VIC   3:   720x480    59.940060 Hz  16:9     31.469 kHz     27.000000 MHz
    VIC  18:   720x576    50.000000 Hz  16:9     31.250 kHz     27.000000 MHz
    VIC  19:  1280x720    50.000000 Hz  16:9     37.500 kHz     74.250000 MHz
    VIC   4:  1280x720    60.000000 Hz  16:9     45.000 kHz     74.250000 MHz
    VIC  47:  1280x720   120.000000 Hz  16:9     90.000 kHz    148.500000 MHz
    VIC  32:  1920x1080   24.000000 Hz  16:9     27.000 kHz     74.250000 MHz
    VIC  33:  1920x1080   25.000000 Hz  16:9     28.125 kHz     74.250000 MHz
    VIC  34:  1920x1080   30.000000 Hz  16:9     33.750 kHz     74.250000 MHz
    VIC  31:  1920x1080   50.000000 Hz  16:9     56.250 kHz    148.500000 MHz
    VIC  16:  1920x1080   60.000000 Hz  16:9     67.500 kHz    148.500000 MHz
    VIC  64:  1920x1080  100.000000 Hz  16:9    112.500 kHz    297.000000 MHz
    VIC  63:  1920x1080  120.000000 Hz  16:9    135.000 kHz    297.000000 MHz
    VIC  93:  3840x2160   24.000000 Hz  16:9     54.000 kHz    297.000000 MHz
    VIC  94:  3840x2160   25.000000 Hz  16:9     56.250 kHz    297.000000 MHz
    VIC  95:  3840x2160   30.000000 Hz  16:9     67.500 kHz    297.000000 MHz
    VIC  96:  3840x2160   50.000000 Hz  16:9    112.500 kHz    594.000000 MHz
    VIC  97:  3840x2160   60.000000 Hz  16:9    135.000 kHz    594.000000 MHz
  Audio Data Block:
    Linear PCM:
      Max channels: 2
      Supported sample rates (kHz): 48 44.1 32
      Supported sample sizes (bits): 24 20 16
  Speaker Allocation Data Block:
    FL/FR - Front Left/Right
  Vendor-Specific Data Block (HDMI), OUI 00-0C-03:
    Source physical address: 2.0.0.0
    DC_36bit
    DC_30bit
    DC_Y444
    Maximum TMDS clock: 340 MHz
    Extended HDMI video details:
      HDMI VICs:
        HDMI VIC 3:  3840x2160   24.000000 Hz  16:9     54.000 kHz    297.000000 MHz
        HDMI VIC 2:  3840x2160   25.000000 Hz  16:9     56.250 kHz    297.000000 MHz
        HDMI VIC 1:  3840x2160   30.000000 Hz  16:9     67.500 kHz    297.000000 MHz
  Vendor-Specific Data Block (HDMI Forum), OUI C4-5D-D8:
    Version: 1
    Maximum TMDS Character Rate: 600 MHz
    SCDC Present
    Max Fixed Rate Link: 3 and 6 Gbps per lane on 3 lanes, 6 Gbps on 4 lanes
    Supports UHD VIC
    Supports 12-bits/component Deep Color 4:2:0 Pixel Encoding
    Supports 10-bits/component Deep Color 4:2:0 Pixel Encoding
    Supports media rates below VRRmin (CinemaVRR, deprecated)
    Supports negative Mvrr values
    Supports Fast Vactive
    Supports a FAPA in blanking after first active video line
    VRRmin: 40 Hz
    VRRmax: 240 Hz
    Supports VESA DSC 1.2a compression
    Supports Compressed Video Transport for 4:2:0 Pixel Encoding
    Supports 12 bpc Compressed Video Transport
    Supports 10 bpc Compressed Video Transport
    DSC Max Slices: up to 8 slices and up to (340 MHz/Ksliceadjust) pixel clock per slice
    DSC Max Fixed Rate Link: 3 and 6 Gbps per lane on 3 lanes, 6 Gbps on 4 lanes
    Maximum number of bytes in a line of chunks: 13312
  YCbCr 4:2:0 Capability Map Data Block:
    VIC  97:  3840x2160   60.000000 Hz  16:9    135.000 kHz    594.000000 MHz
  YCbCr 4:2:0 Video Data Block:
    VIC 117:  3840x2160  100.000000 Hz  16:9    225.000 kHz   1188.000000 MHz
    VIC 118:  3840x2160  120.000000 Hz  16:9    270.000 kHz   1188.000000 MHz
  Colorimetry Data Block:
    xvYCC601
    xvYCC709
    BT2020YCC
    BT2020RGB
    Gamut Boundary Description Metadata Profile P0
    ST2113RGB
  Video Capability Data Block:
    YCbCr quantization: Selectable (via AVI YQ)
    RGB quantization: Selectable (via AVI Q)
    PT scan behavior: Always Overscanned
    IT scan behavior: Always Overscanned
    CE scan behavior: Always Overscanned
  HDR Static Metadata Data Block:
    Electro optical transfer functions:
      Traditional gamma - SDR luminance range
      SMPTE ST2084
      Hybrid Log-Gamma
    Supported static metadata descriptors:
      Static metadata type 1
    Desired content max luminance: 110 (541.702 cd/m^2)
    Desired content max frame-average luminance: 96 (400.000 cd/m^2)
    Desired content min luminance: 0 (0.000 cd/m^2)
  Vendor-Specific Data Block (AMD), OUI 00-00-1A:
    Version: 2
    Feature Caps: 0x01
    Minimum Refresh Rate: 40 Hz
    Maximum Refresh Rate: 240 Hz
    Flags 1.x: 0xe6 (MCCS)
    Flags 2.x: 0x04
    Maximum luminance: 0 (50.000 cd/m^2)
    Minimum luminance: 0 (0.000 cd/m^2)
    Maximum luminance (without local dimming): 0 (50.000 cd/m^2)
    Minimum luminance (without local dimming): 0 (0.000 cd/m^2)
  Detailed Timing Descriptors:
    DTD 2:  2560x1440  119.997589 Hz  16:9    182.996 kHz    497.750000 MHz (590 mm x 334 mm)
                 Hfront   48 Hsync  32 Hback   80 Hpol P
                 Vfront    3 Vsync   5 Vback   77 Vpol P
Checksum: 0x65  Unused space in Extension Block: 10 bytes

----------------

Block 2, DisplayID Extension Block:
  Version: 1.2
  Extension Count: 0
  Display Product Type: Standalone display device
  Video Timing Modes Type 1 - Detailed Timings Data Block:
    DTD:  2560x1440   59.950550 Hz  16:9     88.787 kHz    241.500000 MHz (aspect 16:9, no 3D stereo, preferred)
               Hfront   48 Hsync  32 Hback   80 Hpol P
               Vfront    3 Vsync   5 Vback   33 Vpol P
    DTD:  2560x1440  240.000000 Hz  16:9    369.600 kHz    997.920000 MHz (aspect 16:9, no 3D stereo)
               Hfront   48 Hsync  32 Hback   60 Hpol P
               Vfront   24 Vsync  20 Vback   56 Vpol P
    DTD:  2560x1440  240.000367 Hz  16:9    384.721 kHz   1046.440000 MHz (aspect 16:9, no 3D stereo)
               Hfront   48 Hsync  32 Hback   80 Hpol P
               Vfront    3 Vsync   8 Vback  152 Vpol P
    DTD:  2560x1440   49.946624 Hz  16:9     73.621 kHz    200.250000 MHz (aspect 16:9, no 3D stereo)
               Hfront   48 Hsync  32 Hback   80 Hpol P
               Vfront    3 Vsync   5 Vback   26 Vpol P
    DTD:  1920x1080  239.998495 Hz  16:9    289.918 kHz    637.820000 MHz (aspect 16:9, no 3D stereo)
               Hfront   88 Hsync  44 Hback  148 Hpol P
               Vfront    4 Vsync   5 Vback  119 Vpol P
  Checksum: 0xb0
Checksum: 0x90

----------------

Block 3, Unknown EDID Extension Block 0x00:
  00 ff ff ff ff ff ff 00 0e 4d 20 1b ff ff ff ff '.........M .....'
  24 21 01 03 80 3b 22 78 2a 14 bb ad 52 41 af 25 '$!...;"x*...RA.%'
  0d 4a 4c b3 eb 80 71 4f 81 40 81 80 81 c0 81 00 '.JL...qO.@......'
  95 00 b3 00 d1 c0 56 5e 00 a0 a0 a0 29 50 30 20 '......V^....)P0 '
  35 00 4e 4e 21 00 00 1e 00 00 00 fd 00 28 f0 1e '5.NN!........(..'
  ff 69 00 0a 20 20 20 20 20 20 00 00 00 fc 00 32 '.i..      .....2'
  37 51 48 44 32 34 30 0a 20 20 20 20 00 00 00 ff '7QHD240.    ....'
  00 41 32 54 34 43 33 33 36 34 30 50 55 0a 01 ca '.A2T4C33640PU...'
Checksum: 0xca

----------------

Block 4, CTA-861 Extension Block:
  Revision: 3
  Underscans IT Video Formats by default
  Basic audio support
  Supports YCbCr 4:4:4
  Supports YCbCr 4:2:2
  Native detailed modes: 1
  HDMI Forum EDID Extension Override Data Block:
    EDID Extension Block Count: 2
  Video Data Block:
    VIC   1:   640x480    59.940476 Hz   4:3     31.469 kHz     25.175000 MHz
    VIC   3:   720x480    59.940060 Hz  16:9     31.469 kHz     27.000000 MHz
    VIC  18:   720x576    50.000000 Hz  16:9     31.250 kHz     27.000000 MHz
    VIC  19:  1280x720    50.000000 Hz  16:9     37.500 kHz     74.250000 MHz
    VIC   4:  1280x720    60.000000 Hz  16:9     45.000 kHz     74.250000 MHz
    VIC  47:  1280x720   120.000000 Hz  16:9     90.000 kHz    148.500000 MHz
    VIC  32:  1920x1080   24.000000 Hz  16:9     27.000 kHz     74.250000 MHz
    VIC  33:  1920x1080   25.000000 Hz  16:9     28.125 kHz     74.250000 MHz
    VIC  34:  1920x1080   30.000000 Hz  16:9     33.750 kHz     74.250000 MHz
    VIC  31:  1920x1080   50.000000 Hz  16:9     56.250 kHz    148.500000 MHz
    VIC  16:  1920x1080   60.000000 Hz  16:9     67.500 kHz    148.500000 MHz
    VIC  64:  1920x1080  100.000000 Hz  16:9    112.500 kHz    297.000000 MHz
    VIC  63:  1920x1080  120.000000 Hz  16:9    135.000 kHz    297.000000 MHz
    VIC  93:  3840x2160   24.000000 Hz  16:9     54.000 kHz    297.000000 MHz
    VIC  94:  3840x2160   25.000000 Hz  16:9     56.250 kHz    297.000000 MHz
    VIC  95:  3840x2160   30.000000 Hz  16:9     67.500 kHz    297.000000 MHz
    VIC  96:  3840x2160   50.000000 Hz  16:9    112.500 kHz    594.000000 MHz
    VIC  97:  3840x2160   60.000000 Hz  16:9    135.000 kHz    594.000000 MHz
  Audio Data Block:
    Linear PCM:
      Max channels: 2
      Supported sample rates (kHz): 48 44.1 32
      Supported sample sizes (bits): 24 20 16
  Speaker Allocation Data Block:
    FL/FR - Front Left/Right
  Vendor-Specific Data Block (HDMI), OUI 00-0C-03:
    Source physical address: 2.0.0.0
    DC_36bit
    DC_30bit
    DC_Y444
    Maximum TMDS clock: 340 MHz
    Extended HDMI video details:
      HDMI VICs:
        HDMI VIC 3:  3840x2160   24.000000 Hz  16:9     54.000 kHz    297.000000 MHz
        HDMI VIC 2:  3840x2160   25.000000 Hz  16:9     56.250 kHz    297.000000 MHz
        HDMI VIC 1:  3840x2160   30.000000 Hz  16:9     67.500 kHz    297.000000 MHz
  Vendor-Specific Data Block (HDMI Forum), OUI C4-5D-D8:
    Version: 1
    Maximum TMDS Character Rate: 600 MHz
    SCDC Present
    Max Fixed Rate Link: 3 and 6 Gbps per lane on 3 lanes, 6 Gbps on 4 lanes
    Supports UHD VIC
    Supports 12-bits/component Deep Color 4:2:0 Pixel Encoding
    Supports 10-bits/component Deep Color 4:2:0 Pixel Encoding
    Supports media rates below VRRmin (CinemaVRR, deprecated)
    Supports negative Mvrr values
    Supports Fast Vactive
    Supports a FAPA in blanking after first active video line
    VRRmin: 40 Hz
    VRRmax: 240 Hz
    Supports VESA DSC 1.2a compression
    Supports Compressed Video Transport for 4:2:0 Pixel Encoding
    Supports 12 bpc Compressed Video Transport
    Supports 10 bpc Compressed Video Transport
    DSC Max Slices: up to 8 slices and up to (340 MHz/Ksliceadjust) pixel clock per slice
    DSC Max Fixed Rate Link: 3 and 6 Gbps per lane on 3 lanes, 6 Gbps on 4 lanes
    Maximum number of bytes in a line of chunks: 13312
  YCbCr 4:2:0 Capability Map Data Block:
    VIC  97:  3840x2160   60.000000 Hz  16:9    135.000 kHz    594.000000 MHz
  YCbCr 4:2:0 Video Data Block:
    VIC 117:  3840x2160  100.000000 Hz  16:9    225.000 kHz   1188.000000 MHz
    VIC 118:  3840x2160  120.000000 Hz  16:9    270.000 kHz   1188.000000 MHz
  Colorimetry Data Block:
    xvYCC601
    xvYCC709
    BT2020YCC
    BT2020RGB
    Gamut Boundary Description Metadata Profile P0
    ST2113RGB
  Video Capability Data Block:
    YCbCr quantization: Selectable (via AVI YQ)
    RGB quantization: Selectable (via AVI Q)
    PT scan behavior: Always Overscanned
    IT scan behavior: Always Overscanned
    CE scan behavior: Always Overscanned
  HDR Static Metadata Data Block:
    Electro optical transfer functions:
      Traditional gamma - SDR luminance range
      SMPTE ST2084
      Hybrid Log-Gamma
    Supported static metadata descriptors:
      Static metadata type 1
    Desired content max luminance: 110 (541.702 cd/m^2)
    Desired content max frame-average luminance: 96 (400.000 cd/m^2)
    Desired content min luminance: 0 (0.000 cd/m^2)
  Vendor-Specific Data Block (AMD), OUI 00-00-1A:
    Version: 2
    Feature Caps: 0x01
    Minimum Refresh Rate: 40 Hz
    Maximum Refresh Rate: 240 Hz
    Flags 1.x: 0xe6 (MCCS)
    Flags 2.x: 0x04
    Maximum luminance: 0 (50.000 cd/m^2)
    Minimum luminance: 0 (0.000 cd/m^2)
    Maximum luminance (without local dimming): 0 (50.000 cd/m^2)
    Minimum luminance (without local dimming): 0 (0.000 cd/m^2)
  Detailed Timing Descriptors:
    DTD 3:  2560x1440  119.997589 Hz  16:9    182.996 kHz    497.750000 MHz (590 mm x 334 mm)
                 Hfront   48 Hsync  32 Hback   80 Hpol P
                 Vfront    3 Vsync   5 Vback   77 Vpol P
Checksum: 0x65  Unused space in Extension Block: 10 bytes

----------------

Block 5, DisplayID Extension Block:
  Version: 1.2
  Extension Count: 0
  Video Timing Modes Type 1 - Detailed Timings Data Block:
    DTD:  2560x1440   59.950550 Hz  16:9     88.787 kHz    241.500000 MHz (aspect 16:9, no 3D stereo, preferred)
               Hfront   48 Hsync  32 Hback   80 Hpol P
               Vfront    3 Vsync   5 Vback   33 Vpol P
    DTD:  2560x1440  240.000000 Hz  16:9    369.600 kHz    997.920000 MHz (aspect 16:9, no 3D stereo)
               Hfront   48 Hsync  32 Hback   60 Hpol P
               Vfront   24 Vsync  20 Vback   56 Vpol P
    DTD:  2560x1440  240.000367 Hz  16:9    384.721 kHz   1046.440000 MHz (aspect 16:9, no 3D stereo)
               Hfront   48 Hsync  32 Hback   80 Hpol P
               Vfront    3 Vsync   8 Vback  152 Vpol P
    DTD:  2560x1440   49.946624 Hz  16:9     73.621 kHz    200.250000 MHz (aspect 16:9, no 3D stereo)
               Hfront   48 Hsync  32 Hback   80 Hpol P
               Vfront    3 Vsync   5 Vback   26 Vpol P
    DTD:  1920x1080  239.998495 Hz  16:9    289.918 kHz    637.820000 MHz (aspect 16:9, no 3D stereo)
               Hfront   88 Hsync  44 Hback  148 Hpol P
               Vfront    4 Vsync   5 Vback  119 Vpol P
  Checksum: 0xb0
Checksum: 0x90

----------------

Warnings:

Block 1, CTA-861 Extension Block:
  Video Data Block: VIC 1 and the first DTD are not identical. Is this intended?
  Vendor-Specific Data Block (HDMI Forum), OUI C4-5D-D8: CinemaVRR is deprecated and must be cleared.
  Colorimetry Data Block: Set the sRGB colorimetry bit to avoid interop issues.
  Video Capability Data Block: IT scan behavior is expected to support underscanned.
  Video Capability Data Block: S_PT is equal to S_IT and S_CE, so should be set to 0 instead.
  Display Product Serial Number is set, so the Serial Number in the Base EDID should be 0.
Block 4, CTA-861 Extension Block:
  Vendor-Specific Data Block (HDMI Forum), OUI C4-5D-D8: CinemaVRR is deprecated and must be cleared.
  Colorimetry Data Block: Set the sRGB colorimetry bit to avoid interop issues.
  Video Capability Data Block: IT scan behavior is expected to support underscanned.
  Video Capability Data Block: S_PT is equal to S_IT and S_CE, so should be set to 0 instead.
EDID:
  Base EDID: Some timings are out of range of the Monitor Ranges:
    Vertical Freq: 24.000 - 240.000 Hz (Monitor: 40.000 - 240.000 Hz)
    Horizontal Freq: 27.000 - 384.720 kHz (Monitor: 30.000 - 510.000 kHz)

Failures:

Block 1, CTA-861 Extension Block:
  Video Capability Data Block: IT video formats are always overscanned, but bit 7 of Byte 3 of the CTA-861 Extension header is set to underscanned.
Block 2, DisplayID Extension Block:
  Expected 0 DisplayID Extension Block, but got 1.
Block 3, Base EDID:
  Unknown Extension Block.
Block 4, CTA-861 Extension Block:
  HDMI Forum EDID Extension Override Data Block: Only one instance of this Data Block is allowed.
  HDMI Forum EDID Extension Override Data Block: Data Block can only be present in Block 1.
  HDMI Forum EDID Extension Override Data Block: Data Block starts at a wrong offset.
  Video Data Block: Duplicate VIC 1.
  Video Data Block: Duplicate VIC 3.
  Video Data Block: Duplicate VIC 18.
  Video Data Block: Duplicate VIC 19.
  Video Data Block: Duplicate VIC 4.
  Video Data Block: Duplicate VIC 47.
  Video Data Block: Duplicate VIC 32.
  Video Data Block: Duplicate VIC 33.
  Video Data Block: Duplicate VIC 34.
  Video Data Block: Duplicate VIC 31.
  Video Data Block: Duplicate VIC 16.
  Video Data Block: Duplicate VIC 64.
  Video Data Block: Duplicate VIC 63.
  Video Data Block: Duplicate VIC 93.
  Video Data Block: Duplicate VIC 94.
  Video Data Block: Duplicate VIC 95.
  Video Data Block: Duplicate VIC 96.
  Video Data Block: Duplicate VIC 97.
  Speaker Allocation Data Block: Only one instance of this Data Block is allowed.
  Vendor-Specific Data Block (HDMI Forum), OUI C4-5D-D8: Duplicate HDMI Forum VSDB/SCDB.
  YCbCr 4:2:0 Capability Map Data Block: Only one instance of this Data Block is allowed.
  YCbCr 4:2:0 Video Data Block: Duplicate YCbCr 4:2:0 VIC 117.
  YCbCr 4:2:0 Video Data Block: Duplicate YCbCr 4:2:0 VIC 118.
  Colorimetry Data Block: Only one instance of this Data Block is allowed.
  Video Capability Data Block: Only one instance of this Data Block is allowed.
  Video Capability Data Block: IT video formats are always overscanned, but bit 7 of Byte 3 of the CTA-861 Extension header is set to underscanned.
  HDR Static Metadata Data Block: Only one instance of this Data Block is allowed.
Block 5, DisplayID Extension Block:
  Product Type should be 0 in extension block.
EDID:
  Base EDID: HDMI Forum EDID Extension Override Data Block specified 2 extension block(s), but found 5 extension block(s).
  DisplayID: Missing DisplayID Display Parameters Data Block.

EDID conformity: FAIL
