edid-decode (hex):

00 ff ff ff ff ff ff 00 30 e4 14 02 00 00 00 00
00 14 01 04 90 22 13 78 02 1b e5 9e 59 50 98 26
0e 50 54 00 00 00 01 01 01 01 01 01 01 01 01 01
01 01 01 01 01 01 b5 25 40 a0 60 84 0e 30 30 20
25 00 58 c2 10 00 00 19 fa 19 40 d8 60 84 0e 30
30 20 25 00 58 c2 10 00 00 19 00 00 00 fe 00 38
30 32 56 57 80 31 35 36 57 44 31 0a 00 00 00 00
00 00 41 31 99 00 00 00 00 02 01 0a 20 20 00 95

----------------

Block 0, Base EDID:
  EDID Structure Version & Revision: 1.4
  Vendor & Product Identification:
    Manufacturer: LGD
    Model: 532
    Made in: 2010
  Basic Display Parameters & Features:
    Digital display
    Bits per primary color channel: 6
    Digital interface is not defined
    Maximum image size: 34 cm x 19 cm
    Gamma: 2.20
    Supported color formats: RGB 4:4:4
    First detailed timing includes the native pixel format and preferred refresh rate
  Color Characteristics:
    Red  : 0.6171, 0.3486
    Green: 0.3144, 0.5966
    Blue : 0.1513, 0.0566
    White: 0.3134, 0.3291
  Established Timings I & II: none
  Standard Timings: none
  Detailed Timing Descriptors:
    DTD 1:  1600x900    60.007211 Hz  16:9     54.847 kHz     96.530000 MHz (344 mm x 194 mm)
                 Hfront   48 Hsync  32 Hback   80 Hpol N
                 Vfront    2 Vsync   5 Vback    7 Vpol N
    DTD 2:  1600x900    40.064489 Hz  16:9     36.619 kHz     66.500000 MHz (344 mm x 194 mm)
                 Hfront   48 Hsync  32 Hback  136 Hpol N
                 Vfront    2 Vsync   5 Vback    7 Vpol N
    Alphanumeric Data String: '802VW.156WD1'
    Manufacturer-Specified Display Descriptor (0x00): 00 00 00 00 41 31 99 00 00 00 00 02 01 0a 20 20 '....A1........  '
Checksum: 0x95

----------------

Warnings:

Block 0, Base EDID:
  Alphanumeric Data String: Non-ASCII character 0x80 at position 5, can cause problems.
  Missing Display Product Name.

EDID conformity: PASS
