edid-decode (hex):

00 ff ff ff ff ff ff 00 49 54 00 12 72 00 0d 00
14 1c 01 03 80 20 12 78 0a f7 ae a3 53 49 9b 26
0e 47 4a af cf 00 81 00 81 80 95 00 81 c0 b3 00
a9 40 d1 00 a9 c0 02 3a 80 18 71 38 2d 40 58 2c
45 00 c0 1c 32 00 00 1e 66 21 56 aa 51 00 1e 30
46 8f 33 00 ab 80 21 00 00 1e 00 00 00 fd 00 31
4c 1e 52 12 00 0a 20 20 20 20 20 20 00 00 00 fc
00 52 4a 54 20 48 44 4d 49 0a 20 20 20 20 01 8a

02 03 22 f0 50 39 07 50 83 01 1f 01 01 1d 12 72
51 d0 1e 20 6e 23 01 00 00 68 03 0c 00 10 00 b8
2d 20 01 1d 00 72 51 d0 1e 20 6e 28 55 00 00 d0
52 00 00 1e 01 1d 00 bc 52 d0 1e 20 b8 28 55 40
00 d0 52 00 00 1e d5 09 80 a0 20 e0 2d 10 08 60
22 00 80 e0 21 08 08 18 02 3a 80 18 71 38 2d 40
58 2c 45 00 80 38 74 00 00 1e 00 00 00 00 00 00
00 00 00 00 00 00 00 00 00 00 00 00 00 00 00 d2

00 ff ff ff ff ff ff 00 49 54 00 12 72 00 0d 00
14 1c 01 03 80 20 12 78 0a f7 ae a3 53 49 9b 26
0e 47 4a af cf 00 81 00 81 80 95 00 81 c0 b3 00
a9 40 d1 00 a9 c0 02 3a 80 18 71 38 2d 40 58 2c
45 00 c0 1c 32 00 00 1e 66 21 56 aa 51 00 1e 30
46 8f 33 00 ab 80 21 00 00 1e 00 00 00 fd 00 31
4c 1e 52 12 00 0a 20 20 20 20 20 20 00 00 00 fc
00 52 4a 54 20 48 44 4d 49 0a 20 20 20 20 01 8a

02 03 22 f0 50 39 07 50 83 01 1f 01 01 1d 12 72
51 d0 1e 20 6e 23 01 00 00 68 03 0c 00 10 00 b8
2d 20 01 1d 00 72 51 d0 1e 20 6e 28 55 00 00 d0
52 00 00 1e 01 1d 00 bc 52 d0 1e 20 b8 28 55 40
00 d0 52 00 00 1e d5 09 80 a0 20 e0 2d 10 08 60
22 00 80 e0 21 08 08 18 02 3a 80 18 71 38 2d 40
58 2c 45 00 80 38 74 00 00 1e 00 00 00 00 00 00
00 00 00 00 00 00 00 00 00 00 00 00 00 00 00 d2

----------------

Block 0, Base EDID:
  EDID Structure Version & Revision: 1.3
  Vendor & Product Identification:
    Manufacturer: RJT
    Model: 4608
    Serial Number: ...
    Made in: week 20 of 2018
  Basic Display Parameters & Features:
    Digital display
    Maximum image size: 32 cm x 18 cm
    Gamma: 2.20
    RGB color display
    First detailed timing is the preferred timing
  Color Characteristics:
    Red  : 0.6396, 0.3271
    Green: 0.2861, 0.6083
    Blue : 0.1503, 0.0566
    White: 0.2802, 0.2910
  Established Timings I & II:
    IBM     :   720x400    70.081663 Hz   9:5     31.467 kHz     28.320000 MHz
    DMT 0x04:   640x480    59.940476 Hz   4:3     31.469 kHz     25.175000 MHz
    DMT 0x05:   640x480    72.808802 Hz   4:3     37.861 kHz     31.500000 MHz
    DMT 0x06:   640x480    75.000000 Hz   4:3     37.500 kHz     31.500000 MHz
    DMT 0x08:   800x600    56.250000 Hz   4:3     35.156 kHz     36.000000 MHz
    DMT 0x09:   800x600    60.316541 Hz   4:3     37.879 kHz     40.000000 MHz
    DMT 0x0a:   800x600    72.187572 Hz   4:3     48.077 kHz     50.000000 MHz
    DMT 0x0b:   800x600    75.000000 Hz   4:3     46.875 kHz     49.500000 MHz
    DMT 0x10:  1024x768    60.003840 Hz   4:3     48.363 kHz     65.000000 MHz
    DMT 0x11:  1024x768    70.069359 Hz   4:3     56.476 kHz     75.000000 MHz
    DMT 0x12:  1024x768    75.028582 Hz   4:3     60.023 kHz     78.750000 MHz
    DMT 0x24:  1280x1024   75.024675 Hz   5:4     79.976 kHz    135.000000 MHz
  Standard Timings:
    DMT 0x1c:  1280x800    59.810326 Hz  16:10    49.702 kHz     83.500000 MHz
    DMT 0x23:  1280x1024   60.019740 Hz   5:4     63.981 kHz    108.000000 MHz
    DMT 0x2f:  1440x900    59.887445 Hz  16:10    55.935 kHz    106.500000 MHz
    DMT 0x55:  1280x720    60.000000 Hz  16:9     45.000 kHz     74.250000 MHz
    DMT 0x3a:  1680x1050   59.954250 Hz  16:10    65.290 kHz    146.250000 MHz
    DMT 0x33:  1600x1200   60.000000 Hz   4:3     75.000 kHz    162.000000 MHz
    DMT 0x45:  1920x1200   59.884600 Hz  16:10    74.556 kHz    193.250000 MHz
    DMT 0x53:  1600x900    60.000000 Hz  16:9     60.000 kHz    108.000000 MHz (RB)
  Detailed Timing Descriptors:
    DTD  1:  1920x1080   60.000000 Hz  16:9     67.500 kHz    148.500000 MHz (960 mm x 540 mm)
                  Hfront   88 Hsync  44 Hback  148 Hpol P
                  Vfront    4 Vsync   5 Vback   36 Vpol P
    DTD  2:  1366x768    59.789541 Hz 683:384   47.712 kHz     85.500000 MHz (683 mm x 384 mm)
                  Hfront   70 Hsync 143 Hback  213 Hpol P
                  Vfront    3 Vsync   3 Vback   24 Vpol P
    Display Range Limits:
      Monitor ranges (GTF): 49-76 Hz V, 30-82 kHz H, max dotclock 180 MHz
    Display Product Name: 'RJT HDMI'
  Extension blocks: 1
Checksum: 0x8a

----------------

Block 1, CTA-861 Extension Block:
  Revision: 3
  Underscans IT Video Formats by default
  Basic audio support
  Supports YCbCr 4:4:4
  Supports YCbCr 4:2:2
  Native detailed modes: 0
  Video Data Block:
    VIC  57:   720x480   239.760240 Hz  16:9    125.874 kHz    108.000000 MHz
    VIC   7:  1440x480i   59.940060 Hz  16:9     15.734 kHz     27.000000 MHz
    VIC  80:  1680x720    25.000000 Hz  64:27    18.750 kHz     59.400000 MHz
    VIC   3:   720x480    59.940060 Hz  16:9     31.469 kHz     27.000000 MHz (native)
    VIC   1:   640x480    59.940476 Hz   4:3     31.469 kHz     25.175000 MHz
    VIC  31:  1920x1080   50.000000 Hz  16:9     56.250 kHz    148.500000 MHz
    VIC   1:   640x480    59.940476 Hz   4:3     31.469 kHz     25.175000 MHz
    VIC   1:   640x480    59.940476 Hz   4:3     31.469 kHz     25.175000 MHz
    VIC  29:  1440x576    50.000000 Hz   4:3     31.250 kHz     54.000000 MHz
    VIC  18:   720x576    50.000000 Hz  16:9     31.250 kHz     27.000000 MHz
    VIC 114:  3840x2160   48.000000 Hz  16:9    108.000 kHz    594.000000 MHz
    VIC  81:  1680x720    30.000000 Hz  64:27    22.500 kHz     59.400000 MHz
    VIC 208:  7680x4320  100.000000 Hz  64:27   450.000 kHz   4752.000000 MHz
    VIC  30:  1440x576    50.000000 Hz  16:9     31.250 kHz     54.000000 MHz
    VIC  32:  1920x1080   24.000000 Hz  16:9     27.000 kHz     74.250000 MHz
    VIC 110:  1680x720    48.000000 Hz  64:27    36.000 kHz     99.000000 MHz
  Audio Data Block:
    Reserved (0x00)
  Vendor-Specific Data Block (HDMI), OUI 00-0C-03:
    Source physical address: 1.0.0.0
    Supports_AI
    DC_36bit
    DC_30bit
    DC_Y444
    Maximum TMDS clock: 225 MHz
    Extended HDMI video details:
      3D VIC indices with specific capabilities:
        VIC  57:   720x480   239.760240 Hz  16:9    125.874 kHz    108.000000 MHz (frame packing)
        VIC   1:   640x480    59.940476 Hz   4:3     31.469 kHz     25.175000 MHz (line alternative)
        VIC  31:  1920x1080   50.000000 Hz  16:9     56.250 kHz    148.500000 MHz (field alternative)
        VIC  30:  1440x576    50.000000 Hz  16:9     31.250 kHz     54.000000 MHz (frame packing)
        VIC   7:  1440x480i   59.940060 Hz  16:9     15.734 kHz     27.000000 MHz (unknown (0x0e))
        VIC   1:   640x480    59.940476 Hz   4:3     31.469 kHz     25.175000 MHz (unknown (0x0e))
        VIC  31:  1920x1080   50.000000 Hz  16:9     56.250 kHz    148.500000 MHz (L + depth + gfx + gfx-depth)
        VIC  57:   720x480   239.760240 Hz  16:9    125.874 kHz    108.000000 MHz (frame packing)
        VIC  57:   720x480   239.760240 Hz  16:9    125.874 kHz    108.000000 MHz (frame packing)
        VIC  30:  1440x576    50.000000 Hz  16:9     31.250 kHz     54.000000 MHz (frame packing)
        VIC  31:  1920x1080   50.000000 Hz  16:9     56.250 kHz    148.500000 MHz (line alternative)
        VIC  57:   720x480   239.760240 Hz  16:9    125.874 kHz    108.000000 MHz (frame packing)
        VIC  57:   720x480   239.760240 Hz  16:9    125.874 kHz    108.000000 MHz (frame packing)
        VIC   7:  1440x480i   59.940060 Hz  16:9     15.734 kHz     27.000000 MHz (unknown (0x0e))
        VIC   7:  1440x480i   59.940060 Hz  16:9     15.734 kHz     27.000000 MHz (unknown (0x0d))
        VIC  81:  1680x720    30.000000 Hz  64:27    22.500 kHz     59.400000 MHz (unknown (0x0c))
        VIC  30:  1440x576    50.000000 Hz  16:9     31.250 kHz     54.000000 MHz (frame packing)
        VIC   7:  1440x480i   59.940060 Hz  16:9     15.734 kHz     27.000000 MHz (unknown (0x0e))
        VIC  81:  1680x720    30.000000 Hz  64:27    22.500 kHz     59.400000 MHz (side-by-side, not in use)
        VIC  31:  1920x1080   50.000000 Hz  16:9     56.250 kHz    148.500000 MHz (L + depth + gfx + gfx-depth)
        VIC   1:   640x480    59.940476 Hz   4:3     31.469 kHz     25.175000 MHz (frame packing)
        VIC  57:   720x480   239.760240 Hz  16:9    125.874 kHz    108.000000 MHz (frame packing)
  Detailed Timing Descriptors:
    DTD  3:  1280x720    60.000000 Hz  16:9     45.000 kHz     74.250000 MHz (1280 mm x 720 mm)
                  Hfront  110 Hsync  40 Hback  220 Hpol P
                  Vfront    5 Vsync   5 Vback   20 Vpol P
    DTD  4:  1280x720    50.000000 Hz  16:9     37.500 kHz     74.250000 MHz (1280 mm x 720 mm)
                  Hfront  440 Hsync  40 Hback  220 Hpol P
                  Vfront    5 Vsync   5 Vback   20 Vpol P
    DTD  5:   640x480    59.928571 Hz   4:3     31.462 kHz     25.170000 MHz (640 mm x 480 mm)
                  Hfront    8 Hsync  96 Hback   40 Hpol N Hborder 8
                  Vfront    2 Vsync   2 Vback   25 Vpol N Vborder 8
    DTD  6:  1920x1080   60.000000 Hz  16:9     67.500 kHz    148.500000 MHz (1920 mm x 1080 mm)
                  Hfront   88 Hsync  44 Hback  148 Hpol P
                  Vfront    4 Vsync   5 Vback   36 Vpol P
Checksum: 0xd2  Unused space in Extension Block: 21 bytes

----------------

Block 2, Unknown EDID Extension Block 0x00:
  00 ff ff ff ff ff ff 00 49 54 00 12 72 00 0d 00 '........IT..r...'
  14 1c 01 03 80 20 12 78 0a f7 ae a3 53 49 9b 26 '..... .x....SI.&'
  0e 47 4a af cf 00 81 00 81 80 95 00 81 c0 b3 00 '.GJ.............'
  a9 40 d1 00 a9 c0 02 3a 80 18 71 38 2d 40 58 2c '.@.....:..q8-@X,'
  45 00 c0 1c 32 00 00 1e 66 21 56 aa 51 00 1e 30 'E...2...f!V.Q..0'
  46 8f 33 00 ab 80 21 00 00 1e 00 00 00 fd 00 31 'F.3...!........1'
  4c 1e 52 12 00 0a 20 20 20 20 20 20 00 00 00 fc 'L.R...      ....'
  00 52 4a 54 20 48 44 4d 49 0a 20 20 20 20 01 8a '.RJT HDMI.    ..'
Checksum: 0x8a

----------------

Block 3, CTA-861 Extension Block:
  Revision: 3
  Underscans IT Video Formats by default
  Basic audio support
  Supports YCbCr 4:4:4
  Supports YCbCr 4:2:2
  Native detailed modes: 0
  Video Data Block:
    VIC  57:   720x480   239.760240 Hz  16:9    125.874 kHz    108.000000 MHz
    VIC   7:  1440x480i   59.940060 Hz  16:9     15.734 kHz     27.000000 MHz
    VIC  80:  1680x720    25.000000 Hz  64:27    18.750 kHz     59.400000 MHz
    VIC   3:   720x480    59.940060 Hz  16:9     31.469 kHz     27.000000 MHz (native)
    VIC   1:   640x480    59.940476 Hz   4:3     31.469 kHz     25.175000 MHz
    VIC  31:  1920x1080   50.000000 Hz  16:9     56.250 kHz    148.500000 MHz
    VIC   1:   640x480    59.940476 Hz   4:3     31.469 kHz     25.175000 MHz
    VIC   1:   640x480    59.940476 Hz   4:3     31.469 kHz     25.175000 MHz
    VIC  29:  1440x576    50.000000 Hz   4:3     31.250 kHz     54.000000 MHz
    VIC  18:   720x576    50.000000 Hz  16:9     31.250 kHz     27.000000 MHz
    VIC 114:  3840x2160   48.000000 Hz  16:9    108.000 kHz    594.000000 MHz
    VIC  81:  1680x720    30.000000 Hz  64:27    22.500 kHz     59.400000 MHz
    VIC 208:  7680x4320  100.000000 Hz  64:27   450.000 kHz   4752.000000 MHz
    VIC  30:  1440x576    50.000000 Hz  16:9     31.250 kHz     54.000000 MHz
    VIC  32:  1920x1080   24.000000 Hz  16:9     27.000 kHz     74.250000 MHz
    VIC 110:  1680x720    48.000000 Hz  64:27    36.000 kHz     99.000000 MHz
  Audio Data Block:
    Reserved (0x00)
  Vendor-Specific Data Block (HDMI), OUI 00-0C-03:
    Source physical address: 1.0.0.0
    Supports_AI
    DC_36bit
    DC_30bit
    DC_Y444
    Maximum TMDS clock: 225 MHz
    Extended HDMI video details:
      3D VIC indices with specific capabilities:
        VIC  57:   720x480   239.760240 Hz  16:9    125.874 kHz    108.000000 MHz (frame packing)
        VIC   1:   640x480    59.940476 Hz   4:3     31.469 kHz     25.175000 MHz (line alternative)
        VIC  31:  1920x1080   50.000000 Hz  16:9     56.250 kHz    148.500000 MHz (field alternative)
        VIC  30:  1440x576    50.000000 Hz  16:9     31.250 kHz     54.000000 MHz (frame packing)
        VIC   7:  1440x480i   59.940060 Hz  16:9     15.734 kHz     27.000000 MHz (unknown (0x0e))
        VIC   1:   640x480    59.940476 Hz   4:3     31.469 kHz     25.175000 MHz (unknown (0x0e))
        VIC  31:  1920x1080   50.000000 Hz  16:9     56.250 kHz    148.500000 MHz (L + depth + gfx + gfx-depth)
        VIC  57:   720x480   239.760240 Hz  16:9    125.874 kHz    108.000000 MHz (frame packing)
        VIC  57:   720x480   239.760240 Hz  16:9    125.874 kHz    108.000000 MHz (frame packing)
        VIC  30:  1440x576    50.000000 Hz  16:9     31.250 kHz     54.000000 MHz (frame packing)
        VIC  31:  1920x1080   50.000000 Hz  16:9     56.250 kHz    148.500000 MHz (line alternative)
        VIC  57:   720x480   239.760240 Hz  16:9    125.874 kHz    108.000000 MHz (frame packing)
        VIC  57:   720x480   239.760240 Hz  16:9    125.874 kHz    108.000000 MHz (frame packing)
        VIC   7:  1440x480i   59.940060 Hz  16:9     15.734 kHz     27.000000 MHz (unknown (0x0e))
        VIC   7:  1440x480i   59.940060 Hz  16:9     15.734 kHz     27.000000 MHz (unknown (0x0d))
        VIC  81:  1680x720    30.000000 Hz  64:27    22.500 kHz     59.400000 MHz (unknown (0x0c))
        VIC  30:  1440x576    50.000000 Hz  16:9     31.250 kHz     54.000000 MHz (frame packing)
        VIC   7:  1440x480i   59.940060 Hz  16:9     15.734 kHz     27.000000 MHz (unknown (0x0e))
        VIC  81:  1680x720    30.000000 Hz  64:27    22.500 kHz     59.400000 MHz (side-by-side, not in use)
        VIC  31:  1920x1080   50.000000 Hz  16:9     56.250 kHz    148.500000 MHz (L + depth + gfx + gfx-depth)
        VIC   1:   640x480    59.940476 Hz   4:3     31.469 kHz     25.175000 MHz (frame packing)
        VIC  57:   720x480   239.760240 Hz  16:9    125.874 kHz    108.000000 MHz (frame packing)
  Detailed Timing Descriptors:
    DTD  7:  1280x720    60.000000 Hz  16:9     45.000 kHz     74.250000 MHz (1280 mm x 720 mm)
                  Hfront  110 Hsync  40 Hback  220 Hpol P
                  Vfront    5 Vsync   5 Vback   20 Vpol P
    DTD  8:  1280x720    50.000000 Hz  16:9     37.500 kHz     74.250000 MHz (1280 mm x 720 mm)
                  Hfront  440 Hsync  40 Hback  220 Hpol P
                  Vfront    5 Vsync   5 Vback   20 Vpol P
    DTD  9:   640x480    59.928571 Hz   4:3     31.462 kHz     25.170000 MHz (640 mm x 480 mm)
                  Hfront    8 Hsync  96 Hback   40 Hpol N Hborder 8
                  Vfront    2 Vsync   2 Vback   25 Vpol N Vborder 8
    DTD 10:  1920x1080   60.000000 Hz  16:9     67.500 kHz    148.500000 MHz (1920 mm x 1080 mm)
                  Hfront   88 Hsync  44 Hback  148 Hpol P
                  Vfront    4 Vsync   5 Vback   36 Vpol P
Checksum: 0xd2  Unused space in Extension Block: 21 bytes

----------------

Warnings:

Block 0, Base EDID:
  Detailed Timing Descriptor #1: DTD is identical to VIC 16, which is not present in the CTA Ext Block.
Block 1, CTA-861 Extension Block:
  Video Data Block: VIC 57 and the first DTD are not identical. Is this intended?
  Detailed Timing Descriptor #3: DTD is identical to VIC 4, which is not present in the CTA Ext Block.
  Detailed Timing Descriptor #4: DTD is identical to VIC 19, which is not present in the CTA Ext Block.
  Detailed Timing Descriptor #5: The use of non-zero borders in a DTD is not recommended.
  Detailed Timing Descriptor #6: DTD is identical to VIC 16, which is not present in the CTA Ext Block.
  Add a Colorimetry Data Block with the sRGB colorimetry bit set to avoid interop issues.
Block 3, CTA-861 Extension Block:
  Detailed Timing Descriptor #7: DTD is identical to VIC 4, which is not present in the CTA Ext Block.
  Detailed Timing Descriptor #8: DTD is identical to VIC 19, which is not present in the CTA Ext Block.
  Detailed Timing Descriptor #9: The use of non-zero borders in a DTD is not recommended.
  Detailed Timing Descriptor #10: DTD is identical to VIC 16, which is not present in the CTA Ext Block.
EDID:
  Base EDID: Some timings are out of range of the Monitor Ranges:
    Vertical Freq: 24.000 - 239.760 Hz (Monitor: 49.000 - 76.000 Hz)
    Horizontal Freq: 15.734 - 450.000 kHz (Monitor: 30.000 - 82.000 kHz)
    Maximum Clock: 4752.000 MHz (Monitor: 180.000 MHz)
  CTA-861: Multiple native progressive timings are defined.
  CTA-861: Native progressive resolution of 720x480 is smaller than the max preferred progressive resolution 1920x1080.

Failures:

Block 0, Base EDID:
  Detailed Timing Descriptor #1: Mismatch of image size 960x540 mm vs display size 320x180 mm.
  Detailed Timing Descriptor #2: Mismatch of image size 683x384 mm vs display size 320x180 mm.
Block 1, CTA-861 Extension Block:
  Video Data Block: Duplicate VIC 1.
  Audio Data Block: Audio Format Code 0x00 is reserved.
  Vendor-Specific Data Block (HDMI), OUI 00-0C-03: Unknown 3D_Structure_X value 0x0e.
  Vendor-Specific Data Block (HDMI), OUI 00-0C-03: Unknown 3D_Structure_X value 0x0e.
  Vendor-Specific Data Block (HDMI), OUI 00-0C-03: Unknown 3D_Structure_X value 0x0e.
  Vendor-Specific Data Block (HDMI), OUI 00-0C-03: Unknown 3D_Structure_X value 0x0d.
  Vendor-Specific Data Block (HDMI), OUI 00-0C-03: Unknown 3D_Structure_X value 0x0c.
  Vendor-Specific Data Block (HDMI), OUI 00-0C-03: Unknown 3D_Structure_X value 0x0e.
  Vendor-Specific Data Block (HDMI), OUI 00-0C-03: not-in-use 3D_Detail_X value 0x02.
  Detailed Timing Descriptor #3: Mismatch of image size 1280x720 mm vs display size 320x180 mm.
  Detailed Timing Descriptor #4: Mismatch of image size 1280x720 mm vs display size 320x180 mm.
  Detailed Timing Descriptor #5: Mismatch of image size 640x480 mm vs display size 320x180 mm.
  Detailed Timing Descriptor #6: Mismatch of image size 1920x1080 mm vs display size 320x180 mm.
  Missing VCDB, needed for Set Selectable RGB Quantization to avoid interop issues.
Block 2, Base EDID:
  Unknown Extension Block.
Block 3, CTA-861 Extension Block:
  Video Data Block: Duplicate VIC 57.
  Video Data Block: Duplicate VIC 7.
  Video Data Block: Duplicate VIC 80.
  Video Data Block: Duplicate VIC 3.
  Video Data Block: Duplicate VIC 31.
  Video Data Block: Duplicate VIC 29.
  Video Data Block: Duplicate VIC 18.
  Video Data Block: Duplicate VIC 114.
  Video Data Block: Duplicate VIC 81.
  Video Data Block: Duplicate VIC 208.
  Video Data Block: Duplicate VIC 30.
  Video Data Block: Duplicate VIC 32.
  Video Data Block: Duplicate VIC 110.
  Audio Data Block: Audio Format Code 0x00 is reserved.
  Vendor-Specific Data Block (HDMI), OUI 00-0C-03: Unknown 3D_Structure_X value 0x0e.
  Vendor-Specific Data Block (HDMI), OUI 00-0C-03: Unknown 3D_Structure_X value 0x0e.
  Vendor-Specific Data Block (HDMI), OUI 00-0C-03: Unknown 3D_Structure_X value 0x0e.
  Vendor-Specific Data Block (HDMI), OUI 00-0C-03: Unknown 3D_Structure_X value 0x0d.
  Vendor-Specific Data Block (HDMI), OUI 00-0C-03: Unknown 3D_Structure_X value 0x0c.
  Vendor-Specific Data Block (HDMI), OUI 00-0C-03: Unknown 3D_Structure_X value 0x0e.
  Vendor-Specific Data Block (HDMI), OUI 00-0C-03: not-in-use 3D_Detail_X value 0x02.
  Detailed Timing Descriptor #7: Mismatch of image size 1280x720 mm vs display size 320x180 mm.
  Detailed Timing Descriptor #8: Mismatch of image size 1280x720 mm vs display size 320x180 mm.
  Detailed Timing Descriptor #9: Mismatch of image size 640x480 mm vs display size 320x180 mm.
  Detailed Timing Descriptor #10: Mismatch of image size 1920x1080 mm vs display size 320x180 mm.
EDID:
  Base EDID: The DTD max image size is 1920x1080mm, which is larger than the display size 320.0x180.0mm.
  Base EDID: EDID specified 1 extension block(s), but found 3 extension block(s).
  Base EDID: EDID 1.3 requires a Block Map Extension in Block 1 if there are more than 2 blocks in the EDID.
  CTA-861: The maximum HDMI TMDS clock is 225000 kHz, but one or more video timings go up to 4752000 kHz.

EDID conformity: FAIL
