edid-decode (hex):

00 ff ff ff ff ff ff 00 49 54 00 12 72 00 0d 00
14 1e 01 03 80 c0 6c 78 0a f7 ae a3 53 49 9b 26
0e 47 4a af cf 00 81 00 81 80 95 00 81 c0 b3 00
a9 40 d1 00 a9 c0 02 3a 80 18 71 38 2d 40 58 2c
45 00 c0 1c 32 00 00 1e 66 21 56 aa 51 00 1e 30
46 8f 33 00 ab 80 21 00 00 1e 00 00 00 fd 00 31
4c 1e 52 12 00 0a 20 20 20 20 20 20 00 00 00 fc
00 52 4a 54 20 48 44 4d 49 0a 20 20 20 20 01 8e

02 03 32 f0 53 01 02 03 84 05 06 07 10 11 12 13
14 15 16 1f 20 21 22 27 2c 09 07 07 15 07 50 3d
07 10 55 07 01 83 01 00 00 68 03 0c 00 10 00 b8
2d 20 0e 1f 00 80 51 00 1e 30 40 80 37 00 80 80
21 00 00 1e 01 1d 00 bc 52 d0 1e 20 b8 28 55 40
80 68 21 00 00 1e 01 1d 80 18 71 1c 16 20 58 2c
45 00 c0 1c 32 08 08 9e 02 3a 80 18 71 38 2d 40
58 2c 45 00 c0 1c 32 00 00 1e 00 00 00 00 00 17

----------------

Block 0, Base EDID:
  EDID Structure Version & Revision: 1.3
  Vendor & Product Identification:
    Manufacturer: RJT
    Model: 4608
    Serial Number: ...
    Made in: week 20 of 2020
  Basic Display Parameters & Features:
    Digital display
    Maximum image size: 192 cm x 108 cm
    Gamma: 2.20
    RGB color display
    First detailed timing is the preferred timing
  Color Characteristics:
    Red  : 0.6396, 0.3271
    Green: 0.2861, 0.6083
    Blue : 0.1503, 0.0566
    White: 0.2802, 0.2910
  Established Timings I & II:
    IBM     :   720x400    70.081663 Hz   9:5     31.467 kHz     28.320000 MHz
    DMT 0x04:   640x480    59.940476 Hz   4:3     31.469 kHz     25.175000 MHz
    DMT 0x05:   640x480    72.808802 Hz   4:3     37.861 kHz     31.500000 MHz
    DMT 0x06:   640x480    75.000000 Hz   4:3     37.500 kHz     31.500000 MHz
    DMT 0x08:   800x600    56.250000 Hz   4:3     35.156 kHz     36.000000 MHz
    DMT 0x09:   800x600    60.316541 Hz   4:3     37.879 kHz     40.000000 MHz
    DMT 0x0a:   800x600    72.187572 Hz   4:3     48.077 kHz     50.000000 MHz
    DMT 0x0b:   800x600    75.000000 Hz   4:3     46.875 kHz     49.500000 MHz
    DMT 0x10:  1024x768    60.003840 Hz   4:3     48.363 kHz     65.000000 MHz
    DMT 0x11:  1024x768    70.069359 Hz   4:3     56.476 kHz     75.000000 MHz
    DMT 0x12:  1024x768    75.028582 Hz   4:3     60.023 kHz     78.750000 MHz
    DMT 0x24:  1280x1024   75.024675 Hz   5:4     79.976 kHz    135.000000 MHz
  Standard Timings:
    DMT 0x1c:  1280x800    59.810326 Hz  16:10    49.702 kHz     83.500000 MHz
    DMT 0x23:  1280x1024   60.019740 Hz   5:4     63.981 kHz    108.000000 MHz
    DMT 0x2f:  1440x900    59.887445 Hz  16:10    55.935 kHz    106.500000 MHz
    DMT 0x55:  1280x720    60.000000 Hz  16:9     45.000 kHz     74.250000 MHz
    DMT 0x3a:  1680x1050   59.954250 Hz  16:10    65.290 kHz    146.250000 MHz
    DMT 0x33:  1600x1200   60.000000 Hz   4:3     75.000 kHz    162.000000 MHz
    DMT 0x45:  1920x1200   59.884600 Hz  16:10    74.556 kHz    193.250000 MHz
    DMT 0x53:  1600x900    60.000000 Hz  16:9     60.000 kHz    108.000000 MHz (RB)
  Detailed Timing Descriptors:
    DTD 1:  1920x1080   60.000000 Hz  16:9     67.500 kHz    148.500000 MHz (960 mm x 540 mm)
                 Hfront   88 Hsync  44 Hback  148 Hpol P
                 Vfront    4 Vsync   5 Vback   36 Vpol P
    DTD 2:  1366x768    59.789541 Hz 683:384   47.712 kHz     85.500000 MHz (683 mm x 384 mm)
                 Hfront   70 Hsync 143 Hback  213 Hpol P
                 Vfront    3 Vsync   3 Vback   24 Vpol P
    Display Range Limits:
      Monitor ranges (GTF): 49-76 Hz V, 30-82 kHz H, max dotclock 180 MHz
    Display Product Name: 'RJT HDMI'
  Extension blocks: 1
Checksum: 0x8e

----------------

Block 1, CTA-861 Extension Block:
  Revision: 3
  Underscans IT Video Formats by default
  Basic audio support
  Supports YCbCr 4:4:4
  Supports YCbCr 4:2:2
  Native DTDs: 0
  Video Data Block:
    VIC   1:   640x480    59.940476 Hz   4:3     31.469 kHz     25.175000 MHz
    VIC   2:   720x480    59.940060 Hz   4:3     31.469 kHz     27.000000 MHz
    VIC   3:   720x480    59.940060 Hz  16:9     31.469 kHz     27.000000 MHz
    VIC   4:  1280x720    60.000000 Hz  16:9     45.000 kHz     74.250000 MHz (native)
    VIC   5:  1920x1080i  60.000000 Hz  16:9     33.750 kHz     74.250000 MHz
    VIC   6:  1440x480i   59.940060 Hz   4:3     15.734 kHz     27.000000 MHz
    VIC   7:  1440x480i   59.940060 Hz  16:9     15.734 kHz     27.000000 MHz
    VIC  16:  1920x1080   60.000000 Hz  16:9     67.500 kHz    148.500000 MHz
    VIC  17:   720x576    50.000000 Hz   4:3     31.250 kHz     27.000000 MHz
    VIC  18:   720x576    50.000000 Hz  16:9     31.250 kHz     27.000000 MHz
    VIC  19:  1280x720    50.000000 Hz  16:9     37.500 kHz     74.250000 MHz
    VIC  20:  1920x1080i  50.000000 Hz  16:9     28.125 kHz     74.250000 MHz
    VIC  21:  1440x576i   50.000000 Hz   4:3     15.625 kHz     27.000000 MHz
    VIC  22:  1440x576i   50.000000 Hz  16:9     15.625 kHz     27.000000 MHz
    VIC  31:  1920x1080   50.000000 Hz  16:9     56.250 kHz    148.500000 MHz
    VIC  32:  1920x1080   24.000000 Hz  16:9     27.000 kHz     74.250000 MHz
    VIC  33:  1920x1080   25.000000 Hz  16:9     28.125 kHz     74.250000 MHz
    VIC  34:  1920x1080   30.000000 Hz  16:9     33.750 kHz     74.250000 MHz
    VIC  39:  1920x1080i  50.000000 Hz  16:9     31.250 kHz     72.000000 MHz
  Audio Data Block:
    Linear PCM:
      Max channels: 2
      Supported sample rates (kHz): 48 44.1 32
      Supported sample sizes (bits): 24 20 16
    AC-3:
      Max channels: 6
      Supported sample rates (kHz): 48 44.1 32
      Maximum bit rate: 640 kb/s
    DTS:
      Max channels: 6
      Supported sample rates (kHz): 48 44.1 32
      Maximum bit rate: 128 kb/s
    Enhanced AC-3 (DD+):
      Max channels: 6
      Supported sample rates (kHz): 48 44.1 32
      Supports Joint Object Coding
  Speaker Allocation Data Block:
    FL/FR - Front Left/Right
  Vendor-Specific Data Block (HDMI), OUI 00-0C-03:
    Source physical address: 1.0.0.0
    Supports_AI
    DC_36bit
    DC_30bit
    DC_Y444
    Maximum TMDS clock: 225 MHz
    Extended HDMI video details:
      Base EDID image size indicates aspect ratio
      3D VIC indices with specific capabilities:
        VIC   1:   640x480    59.940476 Hz   4:3     31.469 kHz     25.175000 MHz (frame packing)
        VIC  17:   720x576    50.000000 Hz   4:3     31.250 kHz     27.000000 MHz (frame packing)
        VIC   6:  1440x480i   59.940060 Hz   4:3     15.734 kHz     27.000000 MHz (field alternative)
        VIC   1:   640x480    59.940476 Hz   4:3     31.469 kHz     25.175000 MHz (frame packing)
        VIC   2:   720x480    59.940060 Hz   4:3     31.469 kHz     27.000000 MHz (unknown (0x0e))
        VIC   5:  1920x1080i  60.000000 Hz  16:9     33.750 kHz     74.250000 MHz (frame packing)
        VIC  17:   720x576    50.000000 Hz   4:3     31.250 kHz     27.000000 MHz (frame packing)
        VIC   4:  1280x720    60.000000 Hz  16:9     45.000 kHz     74.250000 MHz (unknown (0x07))
        VIC   1:   640x480    59.940476 Hz   4:3     31.469 kHz     25.175000 MHz (frame packing)
        VIC  17:   720x576    50.000000 Hz   4:3     31.250 kHz     27.000000 MHz (frame packing)
        VIC  17:   720x576    50.000000 Hz   4:3     31.250 kHz     27.000000 MHz (frame packing)
        VIC   3:   720x480    59.940060 Hz  16:9     31.469 kHz     27.000000 MHz (field alternative)
        VIC   1:   640x480    59.940476 Hz   4:3     31.469 kHz     25.175000 MHz (frame packing)
        VIC   1:   640x480    59.940476 Hz   4:3     31.469 kHz     25.175000 MHz (frame packing)
        VIC   2:   720x480    59.940060 Hz   4:3     31.469 kHz     27.000000 MHz (unknown (0x0e))
        VIC   2:   720x480    59.940060 Hz   4:3     31.469 kHz     27.000000 MHz (unknown (0x0d))
        VIC  20:  1920x1080i  50.000000 Hz  16:9     28.125 kHz     74.250000 MHz (unknown (0x0c))
        VIC  22:  1440x576i   50.000000 Hz  16:9     15.625 kHz     27.000000 MHz (frame packing)
        VIC   2:   720x480    59.940060 Hz   4:3     31.469 kHz     27.000000 MHz (unknown (0x0e))
        VIC  20:  1920x1080i  50.000000 Hz  16:9     28.125 kHz     74.250000 MHz (side-by-side, not in use)
        VIC   6:  1440x480i   59.940060 Hz   4:3     15.734 kHz     27.000000 MHz (L + depth + gfx + gfx-depth)
        VIC   5:  1920x1080i  60.000000 Hz  16:9     33.750 kHz     74.250000 MHz (frame packing)
        VIC  17:   720x576    50.000000 Hz   4:3     31.250 kHz     27.000000 MHz (frame packing)
        VIC   7:  1440x480i   59.940060 Hz  16:9     15.734 kHz     27.000000 MHz (side-by-side, not in use)
  Detailed Timing Descriptors:
    DTD 3:  1280x768    59.870228 Hz   5:3     47.776 kHz     79.500000 MHz (640 mm x 384 mm)
                 Hfront   64 Hsync 128 Hback  192 Hpol P
                 Vfront    3 Vsync   7 Vback   20 Vpol P
    DTD 4:  1280x720    50.000000 Hz  16:9     37.500 kHz     74.250000 MHz (640 mm x 360 mm)
                 Hfront  440 Hsync  40 Hback  220 Hpol P
                 Vfront    5 Vsync   5 Vback   20 Vpol P
    DTD 5:  1920x1080i  61.756633 Hz  16:9     33.750 kHz     74.250000 MHz (960 mm x 540 mm)
                 Hfront   88 Hsync  44 Hback  132 Hpol P Hborder 8
                 Vfront    4 Vsync   5 Vback   -3 Vpol P Vborder 8 Vfront +0.5 Odd Field
                 Vfront    4 Vsync   5 Vback   -3 Vpol P Vborder 8 Vback  +0.5 Even Field
    DTD 6:  1920x1080   60.000000 Hz  16:9     67.500 kHz    148.500000 MHz (960 mm x 540 mm)
                 Hfront   88 Hsync  44 Hback  148 Hpol P
                 Vfront    4 Vsync   5 Vback   36 Vpol P
Checksum: 0x17  Unused space in Extension Block: 5 bytes

----------------

Warnings:

Block 1, CTA-861 Extension Block:
  Video Data Block: VIC 1 and the first DTD are not identical. Is this intended?
  Video Data Block: All VICs are in ascending order, and the first (preferred) VIC <= 4, is that intended?
  Vendor-Specific Data Block (HDMI), OUI 00-0C-03: 'Indicates Aspect Ratio' is used for a small display (<= 255 cm), it is better to fill in the actual size
  Detailed Timing Descriptor #3: DTD is similar but not identical to DMT 0x17.
  Detailed Timing Descriptor #5: The use of non-zero borders in a DTD is not recommended.
  Add a Colorimetry Data Block with the sRGB colorimetry bit set to avoid interop issues.
EDID:
  Base EDID: Some timings are out of range of the Monitor Ranges:
    Vertical Freq: 24.000 - 75.029 Hz (Monitor: 49.000 - 76.000 Hz)
    Horizontal Freq: 15.625 - 79.976 kHz (Monitor: 30.000 - 82.000 kHz)
    Maximum Clock: 193.250 MHz (Monitor: 180.000 MHz)
  CTA-861: Native progressive resolution of 1280x720 is smaller than the max preferred progressive resolution 1920x1080.

Failures:

Block 0, Base EDID:
  Detailed Timing Descriptor #1: Mismatch of image size 960x540 mm vs display size 1920x1080 mm.
  Detailed Timing Descriptor #2: Mismatch of image size 683x384 mm vs display size 1920x1080 mm.
Block 1, CTA-861 Extension Block:
  Vendor-Specific Data Block (HDMI), OUI 00-0C-03: Unknown 3D_Structure_X value 0x0e.
  Vendor-Specific Data Block (HDMI), OUI 00-0C-03: Unknown 3D_Structure_X value 0x07.
  Vendor-Specific Data Block (HDMI), OUI 00-0C-03: Unknown 3D_Structure_X value 0x0e.
  Vendor-Specific Data Block (HDMI), OUI 00-0C-03: Unknown 3D_Structure_X value 0x0d.
  Vendor-Specific Data Block (HDMI), OUI 00-0C-03: Unknown 3D_Structure_X value 0x0c.
  Vendor-Specific Data Block (HDMI), OUI 00-0C-03: Unknown 3D_Structure_X value 0x0e.
  Vendor-Specific Data Block (HDMI), OUI 00-0C-03: not-in-use 3D_Detail_X value 0x02.
  Vendor-Specific Data Block (HDMI), OUI 00-0C-03: not-in-use 3D_Detail_X value 0x02.
  Detailed Timing Descriptor #3: Mismatch of image size 640x384 mm vs display size 1920x1080 mm.
  Detailed Timing Descriptor #4: Mismatch of image size 640x360 mm vs display size 1920x1080 mm.
  Detailed Timing Descriptor #5: 0 or negative vertical back porch.
  Detailed Timing Descriptor #5: Mismatch of image size 960x540 mm vs display size 1920x1080 mm.
  Detailed Timing Descriptor #6: Mismatch of image size 960x540 mm vs display size 1920x1080 mm.
  Missing VCDB, needed for Set Selectable RGB Quantization to avoid interop issues.

EDID conformity: FAIL
