edid-decode (hex):

00 ff ff ff ff ff ff 00 09 e5 62 0d 00 00 00 00
2d 22 01 04 b5 1e 13 78 07 b0 b5 a8 53 4d 9c 25
0e 50 54 00 00 00 01 01 01 01 01 01 01 01 01 01
01 01 01 01 01 01 4d db 00 a0 a0 40 78 60 30 20
66 00 2e bc 10 00 00 1a b9 57 00 a0 a0 40 78 60
30 20 66 00 2e bc 10 00 00 1a 00 00 00 fe 00 46
57 34 30 43 80 4e 45 31 34 4e 34 33 00 00 00 00
00 03 41 2d 9e 00 01 00 00 0b 41 0a 20 20 01 2e

70 20 79 02 00 20 00 13 9a 0e 00 62 0d 00 00 00
00 2d 18 07 4e 45 31 34 4e 34 33 21 01 1d c8 0b
5d 07 00 0a 40 06 88 87 ba 53 d0 e4 9b 56 d2 0e
02 35 54 b0 5c b0 5c 66 32 13 78 22 00 14 ff 90
08 85 ff 09 9f 00 2f 00 1f 00 3f 06 77 00 05 00
05 00 25 00 09 ff 90 08 ff 90 08 30 78 80 81 00
13 72 1a 00 00 03 51 30 78 00 00 53 42 53 42 78
00 00 00 00 00 00 00 00 00 00 00 00 00 00 a6 90

00 ff ff ff ff ff ff 00 09 e5 62 0d 00 00 00 00
2d 22 01 04 b5 1e 13 78 07 b0 b5 a8 53 4d 9c 25
0e 50 54 00 00 00 01 01 01 01 01 01 01 01 01 01
01 01 01 01 01 01 4d db 00 a0 a0 40 78 60 30 20
66 00 2e bc 10 00 00 1a b9 57 00 a0 a0 40 78 60
30 20 66 00 2e bc 10 00 00 1a 00 00 00 fe 00 46
57 34 30 43 80 4e 45 31 34 4e 34 33 00 00 00 00
00 03 41 2d 9e 00 01 00 00 0b 41 0a 20 20 01 2e

70 20 79 02 00 20 00 13 9a 0e 00 62 0d 00 00 00
00 2d 18 07 4e 45 31 34 4e 34 33 21 01 1d c8 0b
5d 07 00 0a 40 06 88 87 ba 53 d0 e4 9b 56 d2 0e
02 35 54 b0 5c b0 5c 66 32 13 78 22 00 14 ff 90
08 85 ff 09 9f 00 2f 00 1f 00 3f 06 77 00 05 00
05 00 25 00 09 ff 90 08 ff 90 08 30 78 80 81 00
13 72 1a 00 00 03 51 30 78 00 00 53 42 53 42 78
00 00 00 00 00 00 00 00 00 00 00 00 00 00 a6 90

----------------

Block 0, Base EDID:
  EDID Structure Version & Revision: 1.4
  Vendor & Product Identification:
    Manufacturer: BOE
    Model: 3426
    Made in: week 45 of 2024
  Basic Display Parameters & Features:
    Digital display
    Bits per primary color channel: 10
    DisplayPort interface
    Maximum image size: 30 cm x 19 cm
    Gamma: 2.20
    Supported color formats: RGB 4:4:4
    Default (sRGB) color space is primary color space
    First detailed timing includes the native pixel format and preferred refresh rate
    Display supports continuous frequencies
  Color Characteristics:
    Red  : 0.6582, 0.3271
    Green: 0.3007, 0.6093
    Blue : 0.1464, 0.0576
    White: 0.3134, 0.3291
  Established Timings I & II: none
  Standard Timings: none
  Detailed Timing Descriptors:
    DTD 1:  2560x1600  120.000427 Hz  16:10   206.401 kHz    561.410000 MHz (302 mm x 188 mm)
                 Hfront   48 Hsync  32 Hback   80 Hpol P
                 Vfront    6 Vsync   6 Vback  108 Vpol N
    DTD 2:  2560x1600   48.001453 Hz  16:10    82.562 kHz    224.570000 MHz (302 mm x 188 mm)
                 Hfront   48 Hsync  32 Hback   80 Hpol P
                 Vfront    6 Vsync   6 Vback  108 Vpol N
    Alphanumeric Data String: 'FW40C.NE14N43'
    Manufacturer-Specified Display Descriptor (0x00): 00 00 00 03 41 2d 9e 00 01 00 00 0b 41 0a 20 20 '....A-......A.  '
  Extension blocks: 1
Checksum: 0x2e

----------------

Block 1, DisplayID Extension Block:
  Version: 2.0
  Extension Count: 0
  Display Product Primary Use Case: None of the listed primary use cases; generic display
  Product Identification Data Block (0x20), OUI 9A-0E-00:
    Product Code: 3426
    Year of Manufacture: 2024, Week 45
    Product ID: NE14N43
  Display Parameters Data Block (0x21):
    Image size: 301.6 mm x 188.5 mm
    Display native pixel format: 2560x1600
    Scan Orientation: Left to Right, Top to Bottom
    Luminance Information: Guidance for the Source device
    Color Information: CIE 1931
    Audio Speaker Information: not integrated
    Native Color Chromaticity:
      Primary #1:  (0.657959, 0.326904)
      Primary #2:  (0.300781, 0.608887)
      Primary #3:  (0.145996, 0.057861)
      White Point: (0.312988, 0.328857)
    Native Maximum Luminance (Full Coverage): 300.000000 cd/m^2
    Native Maximum Luminance (10% Rectangular Coverage): 300.000000 cd/m^2
    Native Minimum Luminance: 0.199951 cd/m^2
    Native Color Depth: 10 bpc
    Display Device Technology: Active Matrix LCD
    Display Device Theme Preference: No Preference
    Native Gamma EOTF: 2.20
  Video Timing Modes Type 7 - Detailed Timings Data Block:
    DTD:  2560x1600  120.000000 Hz  16:10   206.400 kHz    561.408000 MHz (aspect 16:10, no 3D stereo, preferred)
               Hfront   48 Hsync  32 Hback   80 Hpol N
               Vfront    6 Vsync   6 Vback  108 Vpol N
  Dynamic Video Timing Range Limits Data Block:
    Minimum Pixel Clock: 561408 kHz
    Maximum Pixel Clock: 561408 kHz
    Minimum Vertical Refresh Rate: 48 Hz
    Maximum Vertical Refresh Rate: 120 Hz
    Seamless Dynamic Video Timing Support: Yes
  CTA-861 DisplayID Data Block:
  Vendor-Specific Data Block (AMD), OUI 00-00-1A:
    Version: 3
    Feature Caps: 0x51
      FreeSync Panel Replay Supported
    Minimum Refresh Rate: 48 Hz
    Maximum Refresh Rate: 120 Hz
    Flags 1.x: 0x00
    Flags 2.x: 0x00
  Checksum: 0xa6
Checksum: 0x90

----------------

Warnings:

Block 0, Base EDID:
  Alphanumeric Data String: Non-ASCII character 0x80 at position 5, can cause problems.
  Missing Display Product Name.

Failures:

Block 0, Base EDID:
  Basic Display Parameters & Features: sRGB is signaled, but the chromaticities do not match.
  Missing Display Range Limits Descriptor.
EDID:
  Extension Block 2 started with EDID header, ignoring Extension Blocks >= 2.

EDID conformity: FAIL
