edid-decode (hex):

00 ff ff ff ff ff ff 00 36 64 50 21 01 01 01 01
1d 20 01 03 a0 30 1a 78 e2 2d 36 a7 54 38 ae 26
0d 4f 54 27 cf 00 81 c0 b3 00 95 00 81 80 a9 c0
81 00 71 40 81 4f 02 3a 80 18 71 38 2d 40 58 2c
45 00 df 04 11 00 00 1a 66 21 56 aa 51 00 1e 30
46 8f 33 00 df 04 11 00 00 1e 2a 44 80 a0 70 38
27 40 30 2c 45 00 df 04 11 00 00 06 00 00 00 fc
00 5a 4e 4f 44 46 4f 32 31 42 4c 30 31 0a 01 0b

02 03 1b 41 23 09 07 07 83 01 00 00 67 03 0c 00
20 00 00 21 43 10 04 03 e2 00 0f 8c 0a d0 8a 20
e0 2d 10 10 3e 96 00 a0 5a 00 00 00 00 00 00 00
00 00 00 00 00 00 00 00 00 00 00 00 00 00 00 00
00 00 00 00 00 00 00 00 00 00 00 00 00 00 00 00
00 00 00 00 00 00 00 00 00 00 00 00 00 00 00 00
00 00 00 00 00 00 00 00 00 00 00 00 00 00 00 00
00 00 00 00 00 00 00 00 00 00 00 00 00 00 00 d4

00 ff ff ff ff ff ff 00 36 64 50 21 01 01 01 01
1d 20 01 03 a0 30 1a 78 e2 2d 36 a7 54 38 ae 26
0d 4f 54 27 cf 00 81 c0 b3 00 95 00 81 80 a9 c0
81 00 71 40 81 4f 02 3a 80 18 71 38 2d 40 58 2c
45 00 df 04 11 00 00 1a 66 21 56 aa 51 00 1e 30
46 8f 33 00 df 04 11 00 00 1e 2a 44 80 a0 70 38
27 40 30 2c 45 00 df 04 11 00 00 06 00 00 00 fc
00 5a 4e 4f 44 46 4f 32 31 42 4c 30 31 0a 01 0b

02 03 1b 41 23 09 07 07 83 01 00 00 67 03 0c 00
20 00 00 21 43 10 04 03 e2 00 0f 8c 0a d0 8a 20
e0 2d 10 10 3e 96 00 a0 5a 00 00 00 00 00 00 00
00 00 00 00 00 00 00 00 00 00 00 00 00 00 00 00
00 00 00 00 00 00 00 00 00 00 00 00 00 00 00 00
00 00 00 00 00 00 00 00 00 00 00 00 00 00 00 00
00 00 00 00 00 00 00 00 00 00 00 00 00 00 00 00
00 00 00 00 00 00 00 00 00 00 00 00 00 00 00 d4

----------------

Block 0, Base EDID:
  EDID Structure Version & Revision: 1.3
  Vendor & Product Identification:
    Manufacturer: MSD
    Model: 8528
    Serial Number: ...
    Made in: week 29 of 2022
  Basic Display Parameters & Features:
    Digital display
    Maximum image size: 48 cm x 26 cm
    Gamma: 2.20
    DPMS levels: Standby Suspend Off
    Monochrome or grayscale display
    First detailed timing is the preferred timing
  Color Characteristics:
    Red  : 0.6523, 0.3300
    Green: 0.2216, 0.6806
    Blue : 0.1484, 0.0537
    White: 0.3095, 0.3300
  Established Timings I & II:
    DMT 0x04:   640x480    59.940476 Hz   4:3     31.469 kHz     25.175000 MHz
    DMT 0x06:   640x480    75.000000 Hz   4:3     37.500 kHz     31.500000 MHz
    DMT 0x08:   800x600    56.250000 Hz   4:3     35.156 kHz     36.000000 MHz
    DMT 0x09:   800x600    60.316541 Hz   4:3     37.879 kHz     40.000000 MHz
    DMT 0x0a:   800x600    72.187572 Hz   4:3     48.077 kHz     50.000000 MHz
    DMT 0x0b:   800x600    75.000000 Hz   4:3     46.875 kHz     49.500000 MHz
    DMT 0x10:  1024x768    60.003840 Hz   4:3     48.363 kHz     65.000000 MHz
    DMT 0x11:  1024x768    70.069359 Hz   4:3     56.476 kHz     75.000000 MHz
    DMT 0x12:  1024x768    75.028582 Hz   4:3     60.023 kHz     78.750000 MHz
    DMT 0x24:  1280x1024   75.024675 Hz   5:4     79.976 kHz    135.000000 MHz
  Standard Timings:
    DMT 0x55:  1280x720    60.000000 Hz  16:9     45.000 kHz     74.250000 MHz
    DMT 0x3a:  1680x1050   59.954250 Hz  16:10    65.290 kHz    146.250000 MHz
    DMT 0x2f:  1440x900    59.887445 Hz  16:10    55.935 kHz    106.500000 MHz
    DMT 0x23:  1280x1024   60.019740 Hz   5:4     63.981 kHz    108.000000 MHz
    DMT 0x53:  1600x900    60.000000 Hz  16:9     60.000 kHz    108.000000 MHz (RB)
    DMT 0x1c:  1280x800    59.810326 Hz  16:10    49.702 kHz     83.500000 MHz
    GTF     :  1152x864    60.000000 Hz   4:3     53.700 kHz     81.624000 MHz
    GTF     :  1280x960    74.999884 Hz   4:3     75.150 kHz    129.859000 MHz
  Detailed Timing Descriptors:
    DTD 1:  1920x1080   60.000000 Hz  16:9     67.500 kHz    148.500000 MHz (479 mm x 260 mm)
                 Hfront   88 Hsync  44 Hback  148 Hpol P
                 Vfront    4 Vsync   5 Vback   36 Vpol N
    DTD 2:  1366x768    59.789541 Hz 683:384   47.712 kHz     85.500000 MHz (479 mm x 260 mm)
                 Hfront   70 Hsync 143 Hback  213 Hpol P
                 Vfront    3 Vsync   3 Vback   24 Vpol P
    DTD 3:  1920x1080   74.972503 Hz  16:9     83.894 kHz    174.500000 MHz (analog composite, serrate, 479 mm x 260 mm)
                 Hfront   48 Hsync  44 Hback   68 Hpol N
                 Vfront    4 Vsync   5 Vback   30 Vpol N
    Display Product Name: 'ZNODFO21BL01'
  Extension blocks: 1
Checksum: 0x0b

----------------

Block 1, CTA-861 Extension Block:
  Revision: 3
  Basic audio support
  Native DTDs: 1
  Audio Data Block:
    Linear PCM:
      Max channels: 2
      Supported sample rates (kHz): 48 44.1 32
      Supported sample sizes (bits): 24 20 16
  Speaker Allocation Data Block:
    FL/FR - Front Left/Right
  Vendor-Specific Data Block (HDMI), OUI 00-0C-03:
    Source physical address: 2.0.0.0
    Maximum TMDS clock: 165 MHz
  Video Data Block:
    VIC  16:  1920x1080   60.000000 Hz  16:9     67.500 kHz    148.500000 MHz
    VIC   4:  1280x720    60.000000 Hz  16:9     45.000 kHz     74.250000 MHz
    VIC   3:   720x480    59.940060 Hz  16:9     31.469 kHz     27.000000 MHz
  Video Capability Data Block:
    YCbCr quantization: No Data
    RGB quantization: No Data
    PT scan behavior: No Data
    IT scan behavior: Supports both over- and underscan
    CE scan behavior: Supports both over- and underscan
  Detailed Timing Descriptors:
    DTD 4:   720x480    59.940060 Hz   3:2     31.469 kHz     27.000000 MHz (analog composite, sync-on-green, 160 mm x 90 mm)
                 Hfront   16 Hsync  62 Hback   60 Hpol N
                 Vfront    9 Vsync   6 Vback   30 Vpol N
Checksum: 0xd4  Unused space in Extension Block: 82 bytes

----------------

Warnings:

Block 0, Base EDID:
  Vendor & Product Identification: The serial number is one of the known dummy values, it should probably be set to 0.
  Detailed Timing Descriptor #1: DTD is similar but not identical to VIC 16.
Block 1, CTA-861 Extension Block:
  IT Video Formats are overscanned by default, but normally this should be underscanned.
  Video Data Block: VIC 16 and the first DTD are not identical. Is this intended?
  Detailed Timing Descriptor #4: Dubious image size (160x90 mm is smaller than 100x100 mm).
  Add a Colorimetry Data Block with the sRGB colorimetry bit set to avoid interop issues.

Failures:

Block 0, Base EDID:
  Basic Display Parameters & Features: Digital Video Interface Standard set to reserved value 0x20.
  Missing Display Range Limits Descriptor.
Block 1, CTA-861 Extension Block:
  Video Capability Data Block: Set Selectable RGB Quantization to avoid interop issues.
  Detailed Timing Descriptor #4: Mismatch of image size 160x90 mm vs display size 480x260 mm.
EDID:
  Extension Block 2 started with EDID header, ignoring Extension Blocks >= 2.
  CTA-861: The maximum HDMI TMDS clock is 165000 kHz, but one or more video timings go up to 174500 kHz.

EDID conformity: FAIL
