edid-decode (hex):

00 ff ff ff ff ff ff 00 1e 6d 90 75 24 25 00 00
0c 10 01 03 80 5c 34 96 0a f3 30 a7 54 42 aa 26
0f 48 4c 00 00 00 01 01 01 01 01 01 01 01 01 01
01 01 01 01 01 01 8c 0a d0 8a 20 e0 2d 10 10 3e
96 00 c4 8e 21 00 00 18 00 00 00 fc 00 33 32 4c
45 32 52 2d 5a 4a 0a 20 20 20 00 00 00 fd 00 2d
41 19 32 08 00 0a 20 20 20 20 20 20 00 00 00 00
00 00 00 00 00 00 00 00 00 00 00 00 00 00 01 a4

02 03 1c 72 23 09 07 02 49 07 16 81 03 05 14 13
12 04 83 01 00 00 65 03 0c 00 10 00 01 1d 80 18
71 1c 16 20 58 2c 25 00 c4 8e 21 00 00 9e 01 1d
80 d0 72 1c 16 20 10 2c 25 80 c4 8e 21 00 00 9e
01 1d 00 bc 52 d0 1e 20 b8 28 55 40 c4 8e 21 00
00 1e 8c 0a d0 90 20 40 31 20 0c 40 55 00 c4 8e
21 00 00 18 01 1d 00 72 51 d0 1e 20 6e 28 55 00
c4 8e 21 00 00 1e 00 00 00 00 00 00 00 00 00 2f

----------------

Block 0, Base EDID:
  EDID Structure Version & Revision: 1.3
  Vendor & Product Identification:
    Manufacturer: GSM
    Model: 30096
    Serial Number: ...
    Made in: week 12 of 2006
  Basic Display Parameters & Features:
    Digital display
    Maximum image size: 92 cm x 52 cm
    Gamma: 2.50
    RGB color display
    First detailed timing is the preferred timing
  Color Characteristics:
    Red  : 0.6552, 0.3310
    Green: 0.2578, 0.6669
    Blue : 0.1484, 0.0615
    White: 0.2812, 0.2968
  Established Timings I & II: none
  Standard Timings: none
  Detailed Timing Descriptors:
    DTD 1:   720x480    59.940060 Hz   3:2     31.469 kHz     27.000000 MHz (708 mm x 398 mm)
                 Hfront   16 Hsync  62 Hback   60 Hpol N
                 Vfront    9 Vsync   6 Vback   30 Vpol N
    Display Product Name: '32LE2R-ZJ'
    Display Range Limits:
      Monitor ranges (GTF): 45-65 Hz V, 25-50 kHz H, max dotclock 80 MHz
    Empty Descriptor
  Extension blocks: 1
Checksum: 0xa4

----------------

Block 1, CTA-861 Extension Block:
  Revision: 3
  Basic audio support
  Supports YCbCr 4:4:4
  Supports YCbCr 4:2:2
  Native detailed modes: 2
  Audio Data Block:
    Linear PCM:
      Max channels: 2
      Supported sample rates (kHz): 48 44.1 32
      Supported sample sizes (bits): 20
  Video Data Block:
    VIC   7:  1440x480i   59.940060 Hz  16:9     15.734 kHz     27.000000 MHz
    VIC  22:  1440x576i   50.000000 Hz  16:9     15.625 kHz     27.000000 MHz
    VIC   1:   640x480    59.940476 Hz   4:3     31.469 kHz     25.175000 MHz (native)
    VIC   3:   720x480    59.940060 Hz  16:9     31.469 kHz     27.000000 MHz
    VIC   5:  1920x1080i  60.000000 Hz  16:9     33.750 kHz     74.250000 MHz
    VIC  20:  1920x1080i  50.000000 Hz  16:9     28.125 kHz     74.250000 MHz
    VIC  19:  1280x720    50.000000 Hz  16:9     37.500 kHz     74.250000 MHz
    VIC  18:   720x576    50.000000 Hz  16:9     31.250 kHz     27.000000 MHz
    VIC   4:  1280x720    60.000000 Hz  16:9     45.000 kHz     74.250000 MHz
  Speaker Allocation Data Block:
    FL/FR - Front Left/Right
  Vendor-Specific Data Block (HDMI), OUI 00-0C-03:
    Source physical address: 1.0.0.0
  Detailed Timing Descriptors:
    DTD 2:  1920x1080i  60.000000 Hz  16:9     33.750 kHz     74.250000 MHz (708 mm x 398 mm)
                 Hfront   88 Hsync  44 Hback  148 Hpol P
                 Vfront    2 Vsync   5 Vback   15 Vpol P Vfront +0.5 Odd Field
                 Vfront    2 Vsync   5 Vback   15 Vpol P Vback  +0.5 Even Field
    DTD 3:  1920x1080i  50.000000 Hz  16:9     28.125 kHz     74.250000 MHz (708 mm x 398 mm)
                 Hfront  528 Hsync  44 Hback  148 Hpol P
                 Vfront    2 Vsync   5 Vback   15 Vpol P Vfront +0.5 Odd Field
                 Vfront    2 Vsync   5 Vback   15 Vpol P Vback  +0.5 Even Field
    DTD 4:  1280x720    50.000000 Hz  16:9     37.500 kHz     74.250000 MHz (708 mm x 398 mm)
                 Hfront  440 Hsync  40 Hback  220 Hpol P
                 Vfront    5 Vsync   5 Vback   20 Vpol P
    DTD 5:   720x576    50.000000 Hz   5:4     31.250 kHz     27.000000 MHz (708 mm x 398 mm)
                 Hfront   12 Hsync  64 Hback   68 Hpol N
                 Vfront    5 Vsync   5 Vback   39 Vpol N
    DTD 6:  1280x720    60.000000 Hz  16:9     45.000 kHz     74.250000 MHz (708 mm x 398 mm)
                 Hfront  110 Hsync  40 Hback  220 Hpol P
                 Vfront    5 Vsync   5 Vback   20 Vpol P
Checksum: 0x2f  Unused space in Extension Block: 9 bytes

----------------

Warnings:

Block 0, Base EDID:
  Detailed Timing Descriptor #1: Image size is 708x398 mm, but based on the picture AR it should be 708x472 mm.
Block 1, CTA-861 Extension Block:
  IT Video Formats are overscanned by default, but normally this should be underscanned.
  Video Data Block: VIC 7 and the first DTD are not identical. Is this intended?
  Detailed Timing Descriptor #5: Image size is 708x398 mm, but based on the picture AR it should be 708x566 mm.
  Add a Colorimetry Data Block with the sRGB colorimetry bit set to avoid interop issues.
EDID:
  Base EDID: Some timings are out of range of the Monitor Ranges:
    Horizontal Freq: 15.625 - 45.000 kHz (Monitor: 25.000 - 50.000 kHz)

Failures:

Block 0, Base EDID:
  Detailed Timing Descriptor #1: Mismatch of image size 708x398 mm vs display size 920x520 mm.
  Empty Descriptor: Use Dummy Descriptor instead of all zeroes.
Block 1, CTA-861 Extension Block:
  Detailed Timing Descriptor #2: Mismatch of image size 708x398 mm vs display size 920x520 mm.
  Detailed Timing Descriptor #3: Mismatch of image size 708x398 mm vs display size 920x520 mm.
  Detailed Timing Descriptor #4: Mismatch of image size 708x398 mm vs display size 920x520 mm.
  Detailed Timing Descriptor #5: Mismatch of image size 708x398 mm vs display size 920x520 mm.
  Detailed Timing Descriptor #6: Mismatch of image size 708x398 mm vs display size 920x520 mm.
  Missing VCDB, needed for Set Selectable RGB Quantization to avoid interop issues.
EDID:
  CTA-861: Native progressive timings are a mix of several resolutions.

EDID conformity: FAIL
