edid-decode (hex):

00 ff ff ff ff ff ff 00 26 cd 60 17 0b 0a 00 00
0b 0d 01 02 68 20 18 78 2a 4f 29 a0 57 49 9b 26
10 48 4c a4 42 00 31 59 45 59 61 59 81 80 01 01
01 01 01 01 01 01 ea 24 00 60 41 00 28 30 30 60
13 00 36 e6 10 00 00 1e f9 15 20 f8 30 58 1f 20
20 40 13 00 36 e6 10 00 00 1e 00 00 00 fc 00 4c
53 37 30 34 55 0a 20 20 20 20 20 20 00 00 00 fd
00 32 a0 1e 46 0b 00 0a 20 20 20 20 20 20 00 41

00 ff ff ff ff ff ff 00 26 cd 60 17 0b 0a 00 00
0b 0d 01 02 68 20 18 78 2a 4f 29 a0 57 49 9b 26
10 48 4c a4 42 00 31 59 45 59 61 59 81 80 01 01
01 01 01 01 01 01 ea 24 00 60 41 00 28 30 30 60
13 00 36 e6 10 00 00 1e f9 15 20 f8 30 58 1f 20
20 40 13 00 36 e6 10 00 00 1e 00 00 00 fc 00 4c
53 37 30 34 55 0a 20 20 20 20 20 20 00 00 00 fd
00 32 a0 1e 46 0b 00 0a 20 20 20 20 20 20 00 41

----------------

Block 0, Base EDID:
  EDID Structure Version & Revision: 1.2
  Vendor & Product Identification:
    Manufacturer: IVM
    Model: 5984
    Serial Number: ...
    Made in: week 11 of 2003
  Basic Display Parameters & Features:
    Analog display
    Signal Level Standard: 0.700 : 0.000 : 0.700 V p-p
    Blank level equals black level
    Sync: Separate
    Maximum image size: 32 cm x 24 cm
    Gamma: 2.20
    DPMS levels: Off
    RGB color display
    First detailed timing is the preferred timing
  Color Characteristics:
    Red  : 0.6259, 0.3398
    Green: 0.2880, 0.6083
    Blue : 0.1484, 0.0644
    White: 0.2832, 0.2978
  Established Timings I & II:
    IBM     :   720x400    70.081663 Hz   9:5     31.467 kHz     28.320000 MHz
    DMT 0x04:   640x480    59.940476 Hz   4:3     31.469 kHz     25.175000 MHz
    DMT 0x06:   640x480    75.000000 Hz   4:3     37.500 kHz     31.500000 MHz
    DMT 0x0b:   800x600    75.000000 Hz   4:3     46.875 kHz     49.500000 MHz
    DMT 0x12:  1024x768    75.028582 Hz   4:3     60.023 kHz     78.750000 MHz
  Standard Timings:
    DMT 0x07:   640x480    85.008312 Hz   4:3     43.269 kHz     36.000000 MHz
    DMT 0x0c:   800x600    85.061274 Hz   4:3     53.674 kHz     56.250000 MHz
    DMT 0x13:  1024x768    84.996690 Hz   4:3     68.677 kHz     94.500000 MHz
    DMT 0x23:  1280x1024   60.019740 Hz   5:4     63.981 kHz    108.000000 MHz
  Detailed Timing Descriptors:
    DTD 1:  1024x768    84.996690 Hz   4:3     68.677 kHz     94.500000 MHz (310 mm x 230 mm)
                 Hfront   48 Hsync  96 Hback  208 Hpol P
                 Vfront    1 Vsync   3 Vback   36 Vpol P
    DTD 2:   800x600    85.061274 Hz   4:3     53.674 kHz     56.250000 MHz (310 mm x 230 mm)
                 Hfront   32 Hsync  64 Hback  152 Hpol P
                 Vfront    1 Vsync   3 Vback   27 Vpol P
    Display Product Name: 'LS704U'
    Display Range Limits:
      Monitor ranges (GTF): 50-160 Hz V, 30-70 kHz H, max dotclock 110 MHz
Checksum: 0x41

----------------

Warnings:

Block 0, Base EDID:
  EDID Structure Version & Revision: EDID 1.2 is deprecated, do not use.

Failures:

Block 0, Base EDID:
  Detailed Timing Descriptor #1: Mismatch of image size 310x230 mm vs display size 320x240 mm.
  Detailed Timing Descriptor #2: Mismatch of image size 310x230 mm vs display size 320x240 mm.
EDID:
  Extension Block 1 started with EDID header, ignoring Extension Blocks >= 1.

EDID conformity: FAIL
