edid-decode (hex):

00 ff ff ff ff ff ff 00 0e 98 06 10 00 00 00 00
00 0e 01 03 18 21 19 a0 e8 a1 16 9f 59 4b 94 25
17 4c 52 ad ce 00 31 4f 45 4f 61 4f 01 01 01 01
01 01 01 01 01 01 c3 1e 00 20 41 00 20 30 10 60
13 00 30 e4 10 00 00 1e 00 00 00 fc 00 43 54 58
20 53 35 30 30 00 0a 20 20 20 00 00 00 fd 00 3c
4b 1e 3c 08 00 0a 20 20 20 20 20 20 00 00 00 fe
00 20 0a 20 20 20 20 20 20 20 20 20 20 20 00 c1

----------------

Block 0, Base EDID:
  EDID Structure Version & Revision: 1.3
  Vendor & Product Identification:
    Manufacturer: CTX
    Model: 4102
    Made in: 2004
  Basic Display Parameters & Features:
    Analog display
    Signal Level Standard: 0.700 : 0.300 : 1.000 V p-p
    Blank-to-black setup/pedestal
    Sync: Separate
    Maximum image size: 33 cm x 25 cm
    Gamma: 2.60
    DPMS levels: Standby Suspend Off
    RGB color display
  Color Characteristics:
    Red  : 0.6230, 0.3496
    Green: 0.2929, 0.5791
    Blue : 0.1445, 0.0908
    White: 0.2978, 0.3222
  Established Timings I & II:
    IBM     :   720x400    70.081663 Hz   9:5     31.467 kHz     28.320000 MHz
    DMT 0x04:   640x480    59.940476 Hz   4:3     31.469 kHz     25.175000 MHz
    DMT 0x05:   640x480    72.808802 Hz   4:3     37.861 kHz     31.500000 MHz
    DMT 0x06:   640x480    75.000000 Hz   4:3     37.500 kHz     31.500000 MHz
    DMT 0x09:   800x600    60.316541 Hz   4:3     37.879 kHz     40.000000 MHz
    DMT 0x0a:   800x600    72.187572 Hz   4:3     48.077 kHz     50.000000 MHz
    DMT 0x0b:   800x600    75.000000 Hz   4:3     46.875 kHz     49.500000 MHz
    DMT 0x10:  1024x768    60.003840 Hz   4:3     48.363 kHz     65.000000 MHz
    DMT 0x11:  1024x768    70.069359 Hz   4:3     56.476 kHz     75.000000 MHz
    DMT 0x12:  1024x768    75.028582 Hz   4:3     60.023 kHz     78.750000 MHz
  Standard Timings:
    DMT 0x06:   640x480    75.000000 Hz   4:3     37.500 kHz     31.500000 MHz
    DMT 0x0b:   800x600    75.000000 Hz   4:3     46.875 kHz     49.500000 MHz
    DMT 0x12:  1024x768    75.028582 Hz   4:3     60.023 kHz     78.750000 MHz
  Detailed Timing Descriptors:
    DTD 1:  1024x768    75.028582 Hz   4:3     60.023 kHz     78.750000 MHz (304 mm x 228 mm)
                 Hfront   16 Hsync  96 Hback  176 Hpol P
                 Vfront    1 Vsync   3 Vback   28 Vpol P
    Display Product Name: 'CTX S500'
    Display Range Limits:
      Monitor ranges (GTF): 60-75 Hz V, 30-60 kHz H, max dotclock 80 MHz
    Alphanumeric Data String: ' '
Checksum: 0xc1

----------------

Failures:

Block 0, Base EDID:
  Basic Display Parameters & Features: EDID 1.3 requires that the first detailed timing is the preferred timing.
  Detailed Timing Descriptor #1: Mismatch of image size 304x228 mm vs display size 330x250 mm.
  Display Product Name: NUL byte at position 8.
  Alphanumeric Data String: One or more trailing spaces before newline.

EDID conformity: FAIL
