edid-decode (hex):

00 ff ff ff ff ff ff 00 06 6d 60 10 00 00 00 00
14 1f 01 04 b5 17 0f 78 3a ef 65 a6 56 52 9d 28
0b 50 54 a5 4b 00 d1 c0 81 c0 01 01 01 01 01 01
01 01 01 01 01 01 78 1e 56 02 51 00 22 30 30 08
62 00 d9 87 00 00 00 1e 02 3a 80 18 71 38 2d 40
58 2c 45 00 d9 87 00 00 00 00 00 00 00 fc 00 41
53 4d 2d 31 30 36 46 43 0a 20 20 20 00 00 00 fd
00 38 4c 1e 53 11 01 0a 20 20 20 20 20 20 00 5c

00 ff ff ff ff ff ff 00 06 6d 60 10 00 00 00 00
14 1f 01 04 b5 17 0f 78 3a ef 65 a6 56 52 9d 28
0b 50 54 a5 4b 00 d1 c0 81 c0 01 01 01 01 01 01
01 01 01 01 01 01 78 1e 56 02 51 00 22 30 30 08
62 00 d9 87 00 00 00 1e 02 3a 80 18 71 38 2d 40
58 2c 45 00 d9 87 00 00 00 00 00 00 00 fc 00 41
53 4d 2d 31 30 36 46 43 0a 20 20 20 00 00 00 fd
00 38 4c 1e 53 11 01 0a 20 20 20 20 20 20 00 5c

----------------

Block 0, Base EDID:
  EDID Structure Version & Revision: 1.4
  Vendor & Product Identification:
    Manufacturer: ASM
    Model: 4192
    Made in: week 20 of 2021
  Basic Display Parameters & Features:
    Digital display
    Bits per primary color channel: 10
    DisplayPort interface
    Maximum image size: 23 cm x 15 cm
    Gamma: 2.20
    DPMS levels: Off
    Supported color formats: RGB 4:4:4, YCrCb 4:4:4, YCrCb 4:2:2
    First detailed timing includes the native pixel format and preferred refresh rate
  Color Characteristics:
    Red  : 0.6513, 0.3378
    Green: 0.3232, 0.6162
    Blue : 0.1572, 0.0449
    White: 0.3134, 0.3291
  Established Timings I & II:
    IBM     :   720x400    70.081663 Hz   9:5     31.467 kHz     28.320000 MHz
    DMT 0x04:   640x480    59.940476 Hz   4:3     31.469 kHz     25.175000 MHz
    DMT 0x06:   640x480    75.000000 Hz   4:3     37.500 kHz     31.500000 MHz
    DMT 0x09:   800x600    60.316541 Hz   4:3     37.879 kHz     40.000000 MHz
    DMT 0x0b:   800x600    75.000000 Hz   4:3     46.875 kHz     49.500000 MHz
    DMT 0x10:  1024x768    60.003840 Hz   4:3     48.363 kHz     65.000000 MHz
    DMT 0x12:  1024x768    75.028582 Hz   4:3     60.023 kHz     78.750000 MHz
    DMT 0x24:  1280x1024   75.024675 Hz   5:4     79.976 kHz    135.000000 MHz
  Standard Timings:
    DMT 0x52:  1920x1080   60.000000 Hz  16:9     67.500 kHz    148.500000 MHz
    DMT 0x55:  1280x720    60.000000 Hz  16:9     45.000 kHz     74.250000 MHz
  Detailed Timing Descriptors:
    DTD 1:  1366x768    59.887228 Hz 683:384   48.030 kHz     78.000000 MHz (217 mm x 135 mm)
                 Hfront   48 Hsync   8 Hback  202 Hpol P
                 Vfront    6 Vsync   2 Vback   26 Vpol P
    DTD 2:  1920x1080   60.000000 Hz  16:9     67.500 kHz    148.500000 MHz (analog composite, sync-on-green, 217 mm x 135 mm)
                 Hfront   88 Hsync  44 Hback  148 Hpol N
                 Vfront    4 Vsync   5 Vback   36 Vpol N
    Display Product Name: 'ASM-106FC'
    Display Range Limits:
      Monitor ranges (Range Limits Only): 56-76 Hz V, 30-83 kHz H, max dotclock 170 MHz
Checksum: 0x5c

----------------

Warnings:

Block 0, Base EDID:
  Detailed Timing Descriptor #1: Image size is 217x135 mm, but based on the picture AR it should be 217x122 mm.
  Detailed Timing Descriptor #2: DTD is similar but not identical to VIC 16.
  Detailed Timing Descriptor #2: Image size is 217x135 mm, but based on the picture AR it should be 217x122 mm.

Failures:

Block 0, Base EDID:
  Detailed Timing Descriptor #1: Mismatch of image size 217x135 mm vs display size 230x150 mm.
  Detailed Timing Descriptor #2: Mismatch of image size 217x135 mm vs display size 230x150 mm.
EDID:
  Extension Block 1 started with EDID header, ignoring Extension Blocks >= 1.

EDID conformity: FAIL
