edid-decode (hex):

00 ff ff ff ff ff ff 00 04 72 ab 00 37 7d 00 95
32 13 01 03 68 30 1b 78 2e c5 85 a4 59 49 9a 24
12 50 54 bf ef 80 81 c0 81 40 71 4f 81 80 01 01
01 01 81 00 01 01 02 3a 80 18 71 38 2d 40 58 2c
45 00 dc 0c 11 00 00 1e 00 00 00 fd 00 38 4c 1e
52 10 00 0a 20 20 20 20 20 20 00 00 00 ff 00 4c
46 4a 30 38 30 31 35 34 32 30 30 0a 00 00 00 fc
00 41 63 65 72 20 58 32 32 33 48 51 0a 20 00 f7

00 ff ff ff ff ff ff 00 04 72 ab 00 37 7d 00 95
32 13 01 03 68 30 1b 78 2e c5 85 a4 59 49 9a 24
12 50 54 bf ef 80 81 c0 81 40 71 4f 81 80 01 01
01 01 81 00 01 01 02 3a 80 18 71 38 2d 40 58 2c
45 00 dc 0c 11 00 00 1e 00 00 00 fd 00 38 4c 1e
52 10 00 0a 20 20 20 20 20 20 00 00 00 ff 00 4c
46 4a 30 38 30 31 35 34 32 30 30 0a 00 00 00 fc
00 41 63 65 72 20 58 32 32 33 48 51 0a 20 00 f7

----------------

Block 0, Base EDID:
  EDID Structure Version & Revision: 1.3
  Vendor & Product Identification:
    Manufacturer: ACR
    Model: 171
    Serial Number: ...
    Made in: week 50 of 2009
  Basic Display Parameters & Features:
    Analog display
    Signal Level Standard: 0.700 : 0.000 : 0.700 V p-p
    Blank level equals black level
    Sync: Separate
    Maximum image size: 48 cm x 27 cm
    Gamma: 2.20
    DPMS levels: Off
    RGB color display
    Default (sRGB) color space is primary color space
    First detailed timing is the preferred timing
  Color Characteristics:
    Red  : 0.6435, 0.3476
    Green: 0.2861, 0.6025
    Blue : 0.1425, 0.0703
    White: 0.3134, 0.3291
  Established Timings I & II:
    IBM     :   720x400    70.081663 Hz   9:5     31.467 kHz     28.320000 MHz
    DMT 0x04:   640x480    59.940476 Hz   4:3     31.469 kHz     25.175000 MHz
    Apple   :   640x480    66.666667 Hz   4:3     35.000 kHz     30.240000 MHz
    DMT 0x05:   640x480    72.808802 Hz   4:3     37.861 kHz     31.500000 MHz
    DMT 0x06:   640x480    75.000000 Hz   4:3     37.500 kHz     31.500000 MHz
    DMT 0x08:   800x600    56.250000 Hz   4:3     35.156 kHz     36.000000 MHz
    DMT 0x09:   800x600    60.316541 Hz   4:3     37.879 kHz     40.000000 MHz
    DMT 0x0a:   800x600    72.187572 Hz   4:3     48.077 kHz     50.000000 MHz
    DMT 0x0b:   800x600    75.000000 Hz   4:3     46.875 kHz     49.500000 MHz
    Apple   :   832x624    74.551266 Hz   4:3     49.726 kHz     57.284000 MHz
    DMT 0x10:  1024x768    60.003840 Hz   4:3     48.363 kHz     65.000000 MHz
    DMT 0x11:  1024x768    70.069359 Hz   4:3     56.476 kHz     75.000000 MHz
    DMT 0x12:  1024x768    75.028582 Hz   4:3     60.023 kHz     78.750000 MHz
    DMT 0x24:  1280x1024   75.024675 Hz   5:4     79.976 kHz    135.000000 MHz
    Apple   :  1152x870    75.061550 Hz 192:145   68.681 kHz    100.000000 MHz
  Standard Timings:
    DMT 0x55:  1280x720    60.000000 Hz  16:9     45.000 kHz     74.250000 MHz
    DMT 0x20:  1280x960    60.000000 Hz   4:3     60.000 kHz    108.000000 MHz
    DMT 0x15:  1152x864    75.000000 Hz   4:3     67.500 kHz    108.000000 MHz
    DMT 0x23:  1280x1024   60.019740 Hz   5:4     63.981 kHz    108.000000 MHz
    DMT 0x1c:  1280x800    59.810326 Hz  16:10    49.702 kHz     83.500000 MHz
  Detailed Timing Descriptors:
    DTD 1:  1920x1080   60.000000 Hz  16:9     67.500 kHz    148.500000 MHz (476 mm x 268 mm)
                 Hfront   88 Hsync  44 Hback  148 Hpol P
                 Vfront    4 Vsync   5 Vback   36 Vpol P
    Display Range Limits:
      Monitor ranges (GTF): 56-76 Hz V, 30-82 kHz H, max dotclock 160 MHz
    Display Product Serial Number: ...
    Display Product Name: 'Acer X223HQ'
Checksum: 0xf7

----------------

Failures:

Block 0, Base EDID:
  Basic Display Parameters & Features: sRGB is signaled, but the chromaticities do not match.
EDID:
  Extension Block 1 started with EDID header, ignoring Extension Blocks >= 1.

EDID conformity: FAIL
