edid-decode (hex):

00 ff ff ff ff ff ff 00 10 ac fe 93 59 36 c7 17
1c 1b 01 03 80 30 1b 78 0a 82 60 a7 56 53 9c 27
10 50 54 00 00 00 01 01 01 01 01 01 01 01 01 01
01 01 01 01 01 01 40 38 80 00 71 38 14 40 30 21
42 00 dc 0c 11 00 00 1e 00 00 00 fc 00 49 6e 73
70 69 72 6f 6e 20 33 32 38 30 00 00 00 10 00 00
0a 20 20 20 20 20 20 20 20 20 20 20 00 00 00 10
00 00 0a 20 20 20 20 20 20 20 21 20 20 20 00 3c

00 ff ff ff ff ff ff 00 10 ac fe 93 59 36 c7 17
1c 1b 01 03 80 30 1b 78 0a 82 60 a7 56 53 9c 27
10 50 54 00 00 00 01 01 01 01 01 01 01 01 01 01
01 01 01 01 01 01 40 38 80 00 71 38 14 40 30 21
42 00 dc 0c 11 00 00 1e 00 00 00 fc 00 49 6e 73
70 69 72 6f 6e 20 33 32 38 30 00 00 00 10 00 00
0a 20 20 20 20 20 20 20 20 20 20 20 00 00 00 10
00 00 0a 20 20 20 20 20 20 20 21 20 20 20 00 3c

----------------

Block 0, Base EDID:
  EDID Structure Version & Revision: 1.3
  Vendor & Product Identification:
    Manufacturer: DEL
    Model: 37886
    Serial Number: ...
    Made in: week 28 of 2017
  Basic Display Parameters & Features:
    Digital display
    Maximum image size: 48 cm x 27 cm
    Gamma: 2.20
    RGB color display
    First detailed timing is the preferred timing
  Color Characteristics:
    Red  : 0.6542, 0.3359
    Green: 0.3242, 0.6113
    Blue : 0.1533, 0.0644
    White: 0.3125, 0.3281
  Established Timings I & II: none
  Standard Timings: none
  Detailed Timing Descriptors:
    DTD 1:  1920x1080   60.160428 Hz  16:9     66.176 kHz    144.000000 MHz (476 mm x 268 mm)
                 Hfront   48 Hsync  33 Hback  175 Hpol P
                 Vfront    4 Vsync   2 Vback   14 Vpol P
    Display Product Name: 'Inspiron 3280'
    Dummy Descriptor:
    Dummy Descriptor:
Checksum: 0x3c

----------------

Failures:

Block 0, Base EDID:
  Dummy Descriptor: Dummy block filled with garbage.
  Dummy Descriptor: Dummy block filled with garbage.
  Missing Display Range Limits Descriptor.
EDID:
  Extension Block 1 started with EDID header, ignoring Extension Blocks >= 1.

EDID conformity: FAIL
