edid-decode (hex):

00 ff ff ff ff ff ff 00 4d d9 01 9c 01 01 01 01
01 13 01 03 80 a0 5a 78 0a 0d c9 a0 57 47 98 27
12 48 4c 21 08 00 81 80 01 01 01 01 01 01 01 01
01 01 01 01 01 01 01 1d 00 72 51 d0 1e 20 6e 28
55 00 40 84 63 00 00 1e 01 1d 80 18 71 1c 16 20
58 2c 25 00 40 84 63 00 00 9e 00 00 00 fd 00 3a
3e 0f 46 0f 00 0a 20 20 20 20 20 20 00 00 00 fc
00 53 4f 4e 59 20 54 56 0a 20 20 20 20 20 01 17

02 03 3a 74 4f 10 04 05 03 02 07 06 20 01 0e 0f
0a 0b 23 24 38 09 7f 07 0f 7f 07 15 07 50 3e 1f
c0 4d 02 00 57 06 00 67 54 00 5f 54 01 83 5f 00
00 68 03 0c 00 22 00 80 21 00 8c 0a d0 8a 20 e0
2d 10 10 3e 96 00 40 84 63 00 00 18 8c 0a d0 8a
20 e0 2d 10 10 3e 96 00 b0 84 43 00 00 18 00 00
00 00 00 00 00 00 00 00 00 00 00 00 00 00 00 00
00 00 00 00 00 00 00 00 00 00 00 00 00 00 00 2d

----------------

Block 0, Base EDID:
  EDID Structure Version & Revision: 1.3
  Vendor & Product Identification:
    Manufacturer: SNY
    Model: 39937
    Serial Number: ...
    Made in: week 1 of 2009
  Basic Display Parameters & Features:
    Digital display
    Maximum image size: 160 cm x 90 cm
    Gamma: 2.20
    RGB color display
    First detailed timing is the preferred timing
  Color Characteristics:
    Red  : 0.6250, 0.3398
    Green: 0.2802, 0.5947
    Blue : 0.1552, 0.0703
    White: 0.2832, 0.2978
  Established Timings I & II:
    DMT 0x04:   640x480    59.940476 Hz   4:3     31.469 kHz     25.175000 MHz
    DMT 0x09:   800x600    60.316541 Hz   4:3     37.879 kHz     40.000000 MHz
    DMT 0x10:  1024x768    60.003840 Hz   4:3     48.363 kHz     65.000000 MHz
  Standard Timings:
    DMT 0x23:  1280x1024   60.019740 Hz   5:4     63.981 kHz    108.000000 MHz
  Detailed Timing Descriptors:
    DTD 1:  1280x720    60.000000 Hz  16:9     45.000 kHz     74.250000 MHz (1600 mm x 900 mm)
                 Hfront  110 Hsync  40 Hback  220 Hpol P
                 Vfront    5 Vsync   5 Vback   20 Vpol P
    DTD 2:  1920x1080i  60.000000 Hz  16:9     33.750 kHz     74.250000 MHz (1600 mm x 900 mm)
                 Hfront   88 Hsync  44 Hback  148 Hpol P
                 Vfront    2 Vsync   5 Vback   15 Vpol P Vfront +0.5 Odd Field
                 Vfront    2 Vsync   5 Vback   15 Vpol P Vback  +0.5 Even Field
    Display Range Limits:
      Monitor ranges (GTF): 58-62 Hz V, 15-70 kHz H, max dotclock 150 MHz
    Display Product Name: 'SONY TV'
  Extension blocks: 1
Checksum: 0x17

----------------

Block 1, CTA-861 Extension Block:
  Revision: 3
  Basic audio support
  Supports YCbCr 4:4:4
  Supports YCbCr 4:2:2
  Native detailed modes: 4
  Video Data Block:
    VIC  16:  1920x1080   60.000000 Hz  16:9     67.500 kHz    148.500000 MHz
    VIC   4:  1280x720    60.000000 Hz  16:9     45.000 kHz     74.250000 MHz
    VIC   5:  1920x1080i  60.000000 Hz  16:9     33.750 kHz     74.250000 MHz
    VIC   3:   720x480    59.940060 Hz  16:9     31.469 kHz     27.000000 MHz
    VIC   2:   720x480    59.940060 Hz   4:3     31.469 kHz     27.000000 MHz
    VIC   7:  1440x480i   59.940060 Hz  16:9     15.734 kHz     27.000000 MHz
    VIC   6:  1440x480i   59.940060 Hz   4:3     15.734 kHz     27.000000 MHz
    VIC  32:  1920x1080   24.000000 Hz  16:9     27.000 kHz     74.250000 MHz
    VIC   1:   640x480    59.940476 Hz   4:3     31.469 kHz     25.175000 MHz
    VIC  14:  1440x480    59.940060 Hz   4:3     31.469 kHz     54.000000 MHz
    VIC  15:  1440x480    59.940060 Hz  16:9     31.469 kHz     54.000000 MHz
    VIC  10:  2880x480i   59.940060 Hz   4:3     15.734 kHz     54.000000 MHz
    VIC  11:  2880x480i   59.940060 Hz  16:9     15.734 kHz     54.000000 MHz
    VIC  35:  2880x480    59.940060 Hz   4:3     31.469 kHz    108.000000 MHz
    VIC  36:  2880x480    59.940060 Hz  16:9     31.469 kHz    108.000000 MHz
  Audio Data Block:
    Linear PCM:
      Max channels: 2
      Supported sample rates (kHz): 192 176.4 96 88.2 48 44.1 32
      Supported sample sizes (bits): 24 20 16
    Linear PCM:
      Max channels: 8
      Supported sample rates (kHz): 192 176.4 96 88.2 48 44.1 32
      Supported sample sizes (bits): 24 20 16
    AC-3:
      Max channels: 6
      Supported sample rates (kHz): 48 44.1 32
      Maximum bit rate: 640 kb/s
    DTS:
      Max channels: 7
      Supported sample rates (kHz): 96 88.2 48 44.1 32
      Maximum bit rate: 1536 kb/s
    One Bit Audio:
      Max channels: 6
      Supported sample rates (kHz): 44.1
      Audio Format Code dependent value: 0x00
    Enhanced AC-3 (DD+):
      Max channels: 8
      Supported sample rates (kHz): 48 44.1
    MAT (MLP):
      Max channels: 8
      Supported sample rates (kHz): 192 96 48
      Supports only Dolby TrueHD
    DTS-HD:
      Max channels: 8
      Supported sample rates (kHz): 192 96 48
      Audio Format Code dependent value: 0x01
  Speaker Allocation Data Block:
    FL/FR - Front Left/Right
    LFE1 - Low Frequency Effects 1
    FC - Front Center
    LS/RS - Left/Right Surround
    BC - Back Center
    BL/BR - Back Left/Right
  Vendor-Specific Data Block (HDMI), OUI 00-0C-03:
    Source physical address: 2.2.0.0
    Supports_AI
    Maximum TMDS clock: 165 MHz
  Detailed Timing Descriptors:
    DTD 3:   720x480    59.940060 Hz   3:2     31.469 kHz     27.000000 MHz (1600 mm x 900 mm)
                 Hfront   16 Hsync  62 Hback   60 Hpol N
                 Vfront    9 Vsync   6 Vback   30 Vpol N
    DTD 4:   720x480    59.940060 Hz   3:2     31.469 kHz     27.000000 MHz (1200 mm x 900 mm)
                 Hfront   16 Hsync  62 Hback   60 Hpol N
                 Vfront    9 Vsync   6 Vback   30 Vpol N
Checksum: 0x2d  Unused space in Extension Block: 33 bytes

----------------

Warnings:

Block 0, Base EDID:
  Vendor & Product Identification: The serial number is one of the known dummy values, it should probably be set to 0.
Block 1, CTA-861 Extension Block:
  IT Video Formats are overscanned by default, but normally this should be underscanned.
  Video Data Block: VIC 16 and the first DTD are not identical. Is this intended?
  Detailed Timing Descriptor #3: Image size is 1600x900 mm, but based on the picture AR it should be 1600x1066 mm.
  Detailed Timing Descriptor #4: Image size is 1200x900 mm, but based on the picture AR it should be 1200x800 mm.
  Add a Colorimetry Data Block with the sRGB colorimetry bit set to avoid interop issues.
EDID:
  Base EDID: Some timings are out of range of the Monitor Ranges:
    Vertical Freq: 24.000 - 60.317 Hz (Monitor: 58.000 - 62.000 Hz)

Failures:

Block 1, CTA-861 Extension Block:
  Missing VCDB, needed for Set Selectable RGB Quantization to avoid interop issues.
EDID:
  CTA-861: Native progressive timings are a mix of several resolutions.

EDID conformity: FAIL
