edid-decode (hex):

00 ff ff ff ff ff ff 00 07 21 13 01 01 09 24 20
19 22 01 04 b5 09 0f 78 0e ee 95 a3 54 4c 99 26
0f 4f 4f 00 00 00 01 01 01 01 01 01 01 01 01 01
01 01 01 01 01 01 7b 7e 38 18 41 80 40 70 50 2c
02 0c 9a 57 00 00 00 1e e5 97 38 18 41 80 40 70
50 2c 02 0c 9a 57 00 00 00 1e 69 39 38 b4 40 80
18 70 5a 12 e2 00 9a 57 00 00 00 1e 00 00 00 fc
00 41 59 41 4f 4c 45 44 5f 46 48 44 0a 20 01 f4

02 03 0f 05 e3 05 80 00 e6 06 05 01 8a 60 07 dc
5e 38 18 41 80 40 70 50 2c 02 0c 9a 57 00 00 00
1e 00 00 00 00 00 00 00 00 00 00 00 00 00 00 00
00 00 00 00 00 00 00 00 00 00 00 00 00 00 00 00
00 00 00 00 00 00 00 00 00 00 00 00 00 00 00 00
00 00 00 00 00 00 00 00 00 00 00 00 00 00 00 00
00 00 00 00 00 00 00 00 00 00 00 00 00 00 00 00
00 00 00 00 00 00 00 00 00 00 00 00 00 00 00 08

00 ff ff ff ff ff ff 00 07 21 13 01 01 09 24 20
19 22 01 04 b5 09 0f 78 0e ee 95 a3 54 4c 99 26
0f 4f 4f 00 00 00 01 01 01 01 01 01 01 01 01 01
01 01 01 01 01 01 7b 7e 38 18 41 80 40 70 50 2c
02 0c 9a 57 00 00 00 1e e5 97 38 18 41 80 40 70
50 2c 02 0c 9a 57 00 00 00 1e 69 39 38 b4 40 80
18 70 5a 12 e2 00 9a 57 00 00 00 1e 00 00 00 fc
00 41 59 41 4f 4c 45 44 5f 46 48 44 0a 20 01 f4

02 03 0f 05 e3 05 80 00 e6 06 05 01 8a 60 07 dc
5e 38 18 41 80 40 70 50 2c 02 0c 9a 57 00 00 00
1e 00 00 00 00 00 00 00 00 00 00 00 00 00 00 00
00 00 00 00 00 00 00 00 00 00 00 00 00 00 00 00
00 00 00 00 00 00 00 00 00 00 00 00 00 00 00 00
00 00 00 00 00 00 00 00 00 00 00 00 00 00 00 00
00 00 00 00 00 00 00 00 00 00 00 00 00 00 00 00
00 00 00 00 00 00 00 00 00 00 00 00 00 00 00 08

----------------

Block 0, Base EDID:
  EDID Structure Version & Revision: 1.4
  Vendor & Product Identification:
    Manufacturer: AYA
    Model: 275
    Serial Number: ...
    Made in: week 25 of 2024
  Basic Display Parameters & Features:
    Digital display
    Bits per primary color channel: 10
    DisplayPort interface
    Maximum image size: 9 cm x 15 cm
    Gamma: 2.20
    Supported color formats: RGB 4:4:4, YCrCb 4:4:4
    Default (sRGB) color space is primary color space
    First detailed timing includes the native pixel format and preferred refresh rate
  Color Characteristics:
    Red  : 0.6396, 0.3300
    Green: 0.2998, 0.5996
    Blue : 0.1503, 0.0595
    White: 0.3095, 0.3095
  Established Timings I & II: none
  Standard Timings: none
  Detailed Timing Descriptors:
    DTD 1:  1080x1920  120.000445 Hz   9:16   238.081 kHz    323.790000 MHz (154 mm x 87 mm)
                 Hfront   80 Hsync  44 Hback  156 Hpol P
                 Vfront   48 Vsync   2 Vback   14 Vpol P
    DTD 2:  1080x1920  144.112458 Hz   9:16   285.919 kHz    388.850000 MHz (154 mm x 87 mm)
                 Hfront   80 Hsync  44 Hback  156 Hpol P
                 Vfront   48 Vsync   2 Vback   14 Vpol P
    DTD 3:  1080x1920   60.001470 Hz   9:16   116.643 kHz    146.970000 MHz (154 mm x 87 mm)
                 Hfront   90 Hsync  18 Hback   72 Hpol P
                 Vfront   14 Vsync   2 Vback    8 Vpol P
    Display Product Name: 'AYAOLED_FHD'
  Extension blocks: 1
Checksum: 0xf4

----------------

Block 1, CTA-861 Extension Block:
  Revision: 3
  Native DTDs: 5
  Colorimetry Data Block:
    BT2020RGB
  HDR Static Metadata Data Block:
    Electro optical transfer functions:
      Traditional gamma - SDR luminance range
      SMPTE ST2084
    Supported static metadata descriptors:
      Static metadata type 1
    Desired content max luminance: 138 (993.486 cd/m^2)
    Desired content max frame-average luminance: 96 (400.000 cd/m^2)
    Desired content min luminance: 7 (0.007 cd/m^2)
  Detailed Timing Descriptors:
    DTD 4:  1080x1920   89.999407 Hz   9:16   178.559 kHz    242.840000 MHz (154 mm x 87 mm)
                 Hfront   80 Hsync  44 Hback  156 Hpol P
                 Vfront   48 Vsync   2 Vback   14 Vpol P
Checksum: 0x08  Unused space in Extension Block: 94 bytes

----------------

Warnings:

Block 0, Base EDID:
  Basic Display Parameters & Features: Dubious maximum image size (9x15 is smaller than 10x10 cm).
  Detailed Timing Descriptor #1: Dubious image size (154x87 mm is smaller than 100x100 mm).
  Detailed Timing Descriptor #2: Dubious image size (154x87 mm is smaller than 100x100 mm).
  Detailed Timing Descriptor #3: Dubious image size (154x87 mm is smaller than 100x100 mm).
Block 1, CTA-861 Extension Block:
  IT Video Formats are overscanned by default, but normally this should be underscanned.
  Detailed Timing Descriptor #4: Dubious image size (154x87 mm is smaller than 100x100 mm).

Failures:

Block 0, Base EDID:
  Basic Display Parameters & Features: sRGB is signaled, but the chromaticities do not match.
  Detailed Timing Descriptor #1: Mismatch of image size 154x87 mm vs display size 90x150 mm.
  Detailed Timing Descriptor #2: Mismatch of image size 154x87 mm vs display size 90x150 mm.
  Detailed Timing Descriptor #3: Mismatch of image size 154x87 mm vs display size 90x150 mm.
Block 1, CTA-861 Extension Block:
  There are more Native DTDs (5) than DTDs (4).
  Detailed Timing Descriptor #4: Mismatch of image size 154x87 mm vs display size 90x150 mm.
  Required 640x480p60 timings are missing in the established timings and the SVD list (VIC 1).
  Missing VCDB, needed for Set Selectable RGB Quantization to avoid interop issues.
EDID:
  Extension Block 2 started with EDID header, ignoring Extension Blocks >= 2.
  Base EDID: The DTD max image size is 154x87mm, which is larger than the display size 90.0x150.0mm.

EDID conformity: FAIL
