edid-decode (hex):

00 ff ff ff ff ff ff 00 4c a3 46 43 00 00 00 00
00 11 01 03 80 21 15 78 0a 87 f5 94 57 4f 8c 27
27 50 54 00 00 00 01 01 01 01 01 01 01 01 01 01
01 01 01 01 01 01 23 3f 80 20 71 b0 14 40 30 20
26 00 4b cf 10 00 00 19 00 00 00 0f 00 00 00 00
00 00 00 00 00 46 d2 02 64 00 00 00 00 fe 00 53
41 4d 53 55 4e 47 0a 20 20 20 20 20 00 00 00 fe
00 4c 54 4e 31 35 34 55 32 2d 4c 30 37 0a 00 83

00 ff ff ff ff ff ff 00 4c a3 46 43 00 00 00 00
00 11 01 03 80 21 15 78 0a 87 f5 94 57 4f 8c 27
27 50 54 00 00 00 01 01 01 01 01 01 01 01 01 01
01 01 01 01 01 01 23 3f 80 20 71 b0 14 40 30 20
26 00 4b cf 10 00 00 19 00 00 00 0f 00 00 00 00
00 00 00 00 00 46 d2 02 64 00 00 00 00 fe 00 53
41 4d 53 55 4e 47 0a 20 20 20 20 20 00 00 00 fe
00 4c 54 4e 31 35 34 55 32 2d 4c 30 37 0a 00 83

----------------

Block 0, Base EDID:
  EDID Structure Version & Revision: 1.3
  Vendor & Product Identification:
    Manufacturer: SEC
    Model: 17222
    Made in: 2007
  Basic Display Parameters & Features:
    Digital display
    Maximum image size: 33 cm x 21 cm
    Gamma: 2.20
    RGB color display
    First detailed timing is the preferred timing
  Color Characteristics:
    Red  : 0.5800, 0.3398
    Green: 0.3095, 0.5498
    Blue : 0.1552, 0.1552
    White: 0.3134, 0.3291
  Established Timings I & II: none
  Standard Timings: none
  Detailed Timing Descriptors:
    DTD 1:  1920x1200   60.001633 Hz  16:10    73.202 kHz    161.630000 MHz (331 mm x 207 mm)
                 Hfront   48 Hsync  32 Hback  208 Hpol N
                 Vfront    2 Vsync   6 Vback   12 Vpol N
    Manufacturer-Specified Display Descriptor (0x0f): 00 0f 00 00 00 00 00 00 00 00 00 46 d2 02 64 00 '...........F..d.'
    Alphanumeric Data String: 'SAMSUNG'
    Alphanumeric Data String: 'LTN154U2-L07'
Checksum: 0x83

----------------

Failures:

Block 0, Base EDID:
  Missing Display Product Name.
  Missing Display Range Limits Descriptor.
EDID:
  Extension Block 1 started with EDID header, ignoring Extension Blocks >= 1.

EDID conformity: FAIL
