edid-decode (hex):

00 ff ff ff ff ff ff 00 3a c4 00 0b 00 00 00 00
2d 0c 01 03 80 20 14 00 ea a8 e0 99 57 4b 92 25
1c 50 54 00 00 00 01 01 01 01 01 01 01 01 01 01
01 01 01 01 01 01 6c 39 90 42 62 1a 26 40 00 40
08 00 42 c9 10 00 00 18 00 00 00 fc 00 4e 76 69
64 69 61 20 44 65 66 61 75 6c 00 00 00 fc 00 74
20 46 6c 61 74 20 50 61 6e 65 6c 00 00 00 00 fd
00 00 3c 1d 42 0f 00 00 20 20 20 20 20 00 00 ce

----------------

Block 0, Base EDID:
  EDID Structure Version & Revision: 1.3
  Vendor & Product Identification:
    Manufacturer: NVD
    Model: 2816
    Made in: week 45 of 2002
  Basic Display Parameters & Features:
    Digital display
    Maximum image size: 32 cm x 20 cm
    Gamma: 1.00
    DPMS levels: Standby Suspend Off
    RGB color display
    First detailed timing is the preferred timing
  Color Characteristics:
    Red  : 0.5996, 0.3417
    Green: 0.2949, 0.5703
    Blue : 0.1474, 0.1113
    White: 0.3125, 0.3281
  Established Timings I & II: none
  Standard Timings: none
  Detailed Timing Descriptors:
    DTD 1:  1680x1050   59.836268 Hz  16:10    65.102 kHz    147.000000 MHz (322 mm x 201 mm)
                 Hfront    0 Hsync  64 Hback  514 Hpol N
                 Vfront    0 Vsync   8 Vback   30 Vpol N
                   6c 39 90 42 62 1a 26 40 00 40 08 00 42 c9 10 00 00 18 'l9.Bb.&@.@..B.....'
    Display Product Name: 'Nvidia Defaul'
    Display Product Name: 't Flat Panel'
    Display Range Limits:
      Monitor ranges (GTF): 0-60 Hz V, 29-66 kHz H, max dotclock 150 MHz
Checksum: 0xce

----------------

Failures:

Block 0, Base EDID:
  Detailed Timing Descriptor #1: 0 values in the video timing:
    Horizontal Active/Blanking 1680/578
    Horizontal Frontporch/Sync Width 0/64
    Vertical Active/Blanking 1050/38
    Vertical Frontporch/Sync Width 0/8
  Detailed Timing Descriptor #1: 0 or negative horizontal front porch.
  Display Product Name: NUL byte at position 12.
  Display Range Limits: Byte 11 is 0x00 instead of 0x0a.
  Display Range Limits: Bytes 12-17 must be 0x20.

EDID conformity: FAIL
