edid-decode (hex):

00 ff ff ff ff ff ff 00 25 cc 62 22 9c 08 00 00
15 11 01 04 a5 2f 1d 78 e2 de 95 a3 54 4c 99 26
0f 50 54 bf ef 80 90 4f 71 4f 01 01 01 01 95 00
95 0f b3 00 01 01 08 39 90 30 62 1a 27 40 68 b0
36 00 d9 28 11 00 00 19 00 00 00 fd 00 38 4c 1f
53 10 00 0a 20 20 20 20 20 20 00 00 00 ff 00 37
32 31 30 32 32 30 34 0a 20 20 20 20 00 00 00 fc
00 4c 45 32 32 36 32 0a 20 20 20 20 20 20 00 28

00 ff ff ff ff ff ff 00 25 cc 62 22 9c 08 00 00
15 11 01 04 a5 2f 1d 78 e2 de 95 a3 54 4c 99 26
0f 50 54 bf ef 80 90 4f 71 4f 01 01 01 01 95 00
95 0f b3 00 01 01 08 39 90 30 62 1a 27 40 68 b0
36 00 d9 28 11 00 00 19 00 00 00 fd 00 38 4c 1f
53 10 00 0a 20 20 20 20 20 20 00 00 00 ff 00 37
32 31 30 32 32 30 34 0a 20 20 20 20 00 00 00 fc
00 4c 45 32 32 36 32 0a 20 20 20 20 20 20 00 28

----------------

Block 0, Base EDID:
  EDID Structure Version & Revision: 1.4
  Vendor & Product Identification:
    Manufacturer: INL
    Model: 8802
    Serial Number: ...
    Made in: week 21 of 2007
  Basic Display Parameters & Features:
    Digital display
    Bits per primary color channel: 8
    DisplayPort interface
    Maximum image size: 47 cm x 29 cm
    Gamma: 2.20
    DPMS levels: Standby Suspend Off
    Supported color formats: RGB 4:4:4
    First detailed timing includes the native pixel format and preferred refresh rate
  Color Characteristics:
    Red  : 0.6396, 0.3291
    Green: 0.2998, 0.5996
    Blue : 0.1503, 0.0595
    White: 0.3134, 0.3291
  Established Timings I & II:
    IBM     :   720x400    70.081663 Hz   9:5     31.467 kHz     28.320000 MHz
    DMT 0x04:   640x480    59.940476 Hz   4:3     31.469 kHz     25.175000 MHz
    Apple   :   640x480    66.666667 Hz   4:3     35.000 kHz     30.240000 MHz
    DMT 0x05:   640x480    72.808802 Hz   4:3     37.861 kHz     31.500000 MHz
    DMT 0x06:   640x480    75.000000 Hz   4:3     37.500 kHz     31.500000 MHz
    DMT 0x08:   800x600    56.250000 Hz   4:3     35.156 kHz     36.000000 MHz
    DMT 0x09:   800x600    60.316541 Hz   4:3     37.879 kHz     40.000000 MHz
    DMT 0x0a:   800x600    72.187572 Hz   4:3     48.077 kHz     50.000000 MHz
    DMT 0x0b:   800x600    75.000000 Hz   4:3     46.875 kHz     49.500000 MHz
    Apple   :   832x624    74.551266 Hz   4:3     49.726 kHz     57.284000 MHz
    DMT 0x10:  1024x768    60.003840 Hz   4:3     48.363 kHz     65.000000 MHz
    DMT 0x11:  1024x768    70.069359 Hz   4:3     56.476 kHz     75.000000 MHz
    DMT 0x12:  1024x768    75.028582 Hz   4:3     60.023 kHz     78.750000 MHz
    DMT 0x24:  1280x1024   75.024675 Hz   5:4     79.976 kHz    135.000000 MHz
    Apple   :  1152x870    75.061550 Hz 192:145   68.681 kHz    100.000000 MHz
  Standard Timings:
    DMT 0x2b:  1400x1050   74.866680 Hz   4:3     82.278 kHz    156.000000 MHz
    DMT 0x15:  1152x864    75.000000 Hz   4:3     67.500 kHz    108.000000 MHz
    DMT 0x2f:  1440x900    59.887445 Hz  16:10    55.935 kHz    106.500000 MHz
    DMT 0x30:  1440x900    74.984427 Hz  16:10    70.635 kHz    136.750000 MHz
    DMT 0x3a:  1680x1050   59.954250 Hz  16:10    65.290 kHz    146.250000 MHz
  Detailed Timing Descriptors:
    DTD 1:  1680x1050   59.851764 Hz  16:10    65.179 kHz    146.000000 MHz (473 mm x 296 mm)
                 Hfront  104 Hsync 176 Hback  280 Hpol N
                 Vfront    3 Vsync   6 Vback   30 Vpol N
    Display Range Limits:
      Monitor ranges (GTF): 56-76 Hz V, 31-83 kHz H, max dotclock 160 MHz
    Display Product Serial Number: ...
    Display Product Name: 'LE2262'
Checksum: 0x28

----------------

Block 1, Unknown EDID Extension Block 0x00:
  00 ff ff ff ff ff ff 00 25 cc 62 22 9c 08 00 00 '........%.b"....'
  15 11 01 04 a5 2f 1d 78 e2 de 95 a3 54 4c 99 26 '...../.x....TL.&'
  0f 50 54 bf ef 80 90 4f 71 4f 01 01 01 01 95 00 '.PT....OqO......'
  95 0f b3 00 01 01 08 39 90 30 62 1a 27 40 68 b0 '.......9.0b.'@h.'
  36 00 d9 28 11 00 00 19 00 00 00 fd 00 38 4c 1f '6..(.........8L.'
  53 10 00 0a 20 20 20 20 20 20 00 00 00 ff 00 37 'S...      .....7'
  32 31 30 32 32 30 34 0a 20 20 20 20 00 00 00 fc '2102204.    ....'
  00 4c 45 32 32 36 32 0a 20 20 20 20 20 20 00 28 '.LE2262.      .('
Checksum: 0x28

----------------

Warnings:

Block 0, Base EDID:
  Display Range Limits: GTF support is deprecated in EDID 1.4.

Failures:

Block 0, Base EDID:
  Display Range Limits: GTF is supported, but the display does not support continuous frequencies.
Block 1, Base EDID:
  Unknown Extension Block.
EDID:
  Base EDID: EDID specified 0 extension block(s), but found 1 extension block(s).

EDID conformity: FAIL
