edid-decode (hex):

00 ff ff ff ff ff ff 00 0d ae 41 13 00 00 00 00
11 16 01 03 80 1d 10 78 0a 98 55 95 59 56 93 28
20 50 54 00 00 00 01 01 01 01 01 01 01 01 01 01
01 01 01 01 01 01 79 1d 56 c2 50 00 26 30 1f 41
4c 00 25 a5 10 00 00 18 00 00 00 fe 00 4e 31 33
33 42 47 45 2d 4c 42 31 0a 20 00 00 00 fe 00 43
4d 4e 20 20 20 20 20 20 20 20 20 20 00 00 00 fe
00 4e 31 33 33 42 47 45 2d 4c 42 31 0a 20 00 41

----------------

Block 0, Base EDID:
  EDID Structure Version & Revision: 1.3
  Vendor & Product Identification:
    Manufacturer: CMN
    Model: 4929
    Made in: week 17 of 2012
  Basic Display Parameters & Features:
    Digital display
    Maximum image size: 29 cm x 16 cm
    Gamma: 2.20
    RGB color display
    First detailed timing is the preferred timing
  Color Characteristics:
    Red  : 0.5839, 0.3486
    Green: 0.3378, 0.5742
    Blue : 0.1572, 0.1259
    White: 0.3134, 0.3291
  Established Timings I & II: none
  Standard Timings: none
  Detailed Timing Descriptors:
    DTD 1:  1366x768    60.006681 Hz 683:384   48.365 kHz     75.450000 MHz (293 mm x 165 mm)
                 Hfront   31 Hsync  65 Hback   98 Hpol N
                 Vfront    4 Vsync  12 Vback   22 Vpol N
    Alphanumeric Data String: 'N133BGE-LB1'
    Alphanumeric Data String: 'CMN          '
    Alphanumeric Data String: 'N133BGE-LB1'
Checksum: 0x41

----------------

Failures:

Block 0, Base EDID:
  Alphanumeric Data String: No newline, but one or more trailing spaces.
  Missing Display Product Name.
  Missing Display Range Limits Descriptor.

EDID conformity: FAIL
