edid-decode (hex):

00 ff ff ff ff ff ff 00 0d af 56 15 00 00 00 00
28 11 01 03 80 21 15 78 0a 07 f5 9a 57 4e 87 26
1e 50 54 00 00 00 01 01 01 01 01 01 01 01 01 01
01 01 01 01 01 01 bc 1b 00 a0 50 20 17 30 30 20
36 00 4b cf 10 00 00 18 00 00 00 fe 00 4e 31 35
34 49 33 2d 4c 30 34 0a 20 20 00 00 00 fe 00 43
4d 4f 0a 20 20 20 20 20 20 20 20 20 00 00 00 fe
00 4e 31 35 34 49 33 2d 4c 30 34 0a 20 20 00 a1

00 ff ff ff ff ff ff 00 0d af 56 15 00 00 00 00
28 11 01 03 80 21 15 78 0a 07 f5 9a 57 4e 87 26
1e 50 54 00 00 00 01 01 01 01 01 01 01 01 01 01
01 01 01 01 01 01 bc 1b 00 a0 50 20 17 30 30 20
36 00 4b cf 10 00 00 18 00 00 00 fe 00 4e 31 35
34 49 33 2d 4c 30 34 0a 20 20 00 00 00 fe 00 43
4d 4f 0a 20 20 20 20 20 20 20 20 20 00 00 00 fe
00 4e 31 35 34 49 33 2d 4c 30 34 0a 20 20 00 a1

----------------

Block 0, Base EDID:
  EDID Structure Version & Revision: 1.3
  Vendor & Product Identification:
    Manufacturer: CMO
    Model: 5462
    Made in: week 40 of 2007
  Basic Display Parameters & Features:
    Digital display
    Maximum image size: 33 cm x 21 cm
    Gamma: 2.20
    RGB color display
    First detailed timing is the preferred timing
  Color Characteristics:
    Red  : 0.6015, 0.3398
    Green: 0.3056, 0.5302
    Blue : 0.1513, 0.1201
    White: 0.3134, 0.3291
  Established Timings I & II: none
  Standard Timings: none
  Detailed Timing Descriptors:
    DTD 1:  1280x800    59.909545 Hz  16:10    49.306 kHz     71.000000 MHz (331 mm x 207 mm)
                 Hfront   48 Hsync  32 Hback   80 Hpol N
                 Vfront    3 Vsync   6 Vback   14 Vpol N
    Alphanumeric Data String: 'N154I3-L04'
    Alphanumeric Data String: 'CMO'
    Alphanumeric Data String: 'N154I3-L04'
Checksum: 0xa1

----------------

Warnings:

Block 0, Base EDID:
  Detailed Timing Descriptor #1: DTD is similar but not identical to DMT 0x1b.

Failures:

Block 0, Base EDID:
  Missing Display Product Name.
  Missing Display Range Limits Descriptor.
EDID:
  Extension Block 1 started with EDID header, ignoring Extension Blocks >= 1.

EDID conformity: FAIL
