edid-decode (hex):

00 ff ff ff ff ff ff 00 06 af 6d 20 00 00 00 00
00 18 01 04 95 1c 10 78 02 08 75 95 59 58 96 28
1c 50 54 00 00 00 01 01 01 01 01 01 01 01 01 01
01 01 01 01 01 01 14 37 80 b8 70 38 24 40 10 10
3e 00 14 9b 10 00 00 1a 10 2c 80 b8 70 38 24 40
10 10 3e 00 14 9b 10 00 00 1a 00 00 00 fe 00 46
44 4d 34 32 80 42 31 32 35 48 41 4e 00 00 00 00
00 00 41 01 9e 00 11 00 00 0a 01 0a 20 20 00 ec

----------------

Block 0, Base EDID:
  EDID Structure Version & Revision: 1.4
  Vendor & Product Identification:
    Manufacturer: AUO
    Model: 8301
    Made in: 2014
  Basic Display Parameters & Features:
    Digital display
    Bits per primary color channel: 6
    DisplayPort interface
    Maximum image size: 28 cm x 16 cm
    Gamma: 2.20
    Supported color formats: RGB 4:4:4
    First detailed timing includes the native pixel format and preferred refresh rate
  Color Characteristics:
    Red  : 0.5820, 0.3476
    Green: 0.3457, 0.5859
    Blue : 0.1572, 0.1123
    White: 0.3134, 0.3291
  Established Timings I & II: none
  Standard Timings: none
  Detailed Timing Descriptors:
    DTD 1:  1920x1080   60.049471 Hz  16:9     67.015 kHz    141.000000 MHz (276 mm x 155 mm)
                 Hfront   16 Hsync  16 Hback  152 Hpol P
                 Vfront    3 Vsync  14 Vback   19 Vpol N
    DTD 2:  1920x1080   48.039576 Hz  16:9     53.612 kHz    112.800000 MHz (276 mm x 155 mm)
                 Hfront   16 Hsync  16 Hback  152 Hpol P
                 Vfront    3 Vsync  14 Vback   19 Vpol N
    Alphanumeric Data String: 'FDM42.B125HAN'
    Manufacturer-Specified Display Descriptor (0x00): 00 00 00 00 41 01 9e 00 11 00 00 0a 01 0a 20 20 '....A.........  '
Checksum: 0xec

----------------

Warnings:

Block 0, Base EDID:
  Alphanumeric Data String: Non-ASCII character 0x80 at position 5, can cause problems.
  Missing Display Product Name.

EDID conformity: PASS
