edid-decode (hex):

00 ff ff ff ff ff ff 00 09 e5 bb 09 00 00 00 00
2a 1e 01 04 95 22 13 78 03 bb 85 a5 55 4f 9f 27
0f 50 54 00 00 00 01 01 01 01 01 01 01 01 01 01
01 01 01 01 01 01 70 3a 80 0b 71 38 3c 40 30 20
36 00 58 c2 10 00 00 1a f5 26 80 0b 71 38 3c 40
30 20 36 00 58 c2 10 00 00 1a 00 00 00 00 00 00
00 00 00 00 00 00 00 00 00 00 00 00 00 00 00 02
00 0d 36 ff 0a 3c 96 14 13 2d 96 00 00 00 00 ed

00 ff ff ff ff ff ff 00 09 e5 bb 09 00 00 00 00
2a 1e 01 04 95 22 13 78 03 bb 85 a5 55 4f 9f 27
0f 50 54 00 00 00 01 01 01 01 01 01 01 01 01 01
01 01 01 01 01 01 70 3a 80 0b 71 38 3c 40 30 20
36 00 58 c2 10 00 00 1a f5 26 80 0b 71 38 3c 40
30 20 36 00 58 c2 10 00 00 1a 00 00 00 00 00 00
00 00 00 00 00 00 00 00 00 00 00 00 00 00 00 02
00 0d 36 ff 0a 3c 96 14 13 2d 96 00 00 00 00 ed

----------------

Block 0, Base EDID:
  EDID Structure Version & Revision: 1.4
  Vendor & Product Identification:
    Manufacturer: BOE
    Model: 2491
    Made in: week 42 of 2020
  Basic Display Parameters & Features:
    Digital display
    Bits per primary color channel: 6
    DisplayPort interface
    Maximum image size: 34 cm x 19 cm
    Gamma: 2.20
    Supported color formats: RGB 4:4:4
    First detailed timing includes the native pixel format and preferred refresh rate
    Display supports continuous frequencies
  Color Characteristics:
    Red  : 0.6464, 0.3349
    Green: 0.3105, 0.6240
    Blue : 0.1542, 0.0585
    White: 0.3134, 0.3291
  Established Timings I & II: none
  Standard Timings: none
  Detailed Timing Descriptors:
    DTD 1:  1920x1080   60.003690 Hz  16:9     68.404 kHz    149.600000 MHz (344 mm x 194 mm)
                 Hfront   48 Hsync  32 Hback  187 Hpol P
                 Vfront    3 Vsync   6 Vback   51 Vpol N
    DTD 2:  1920x1080   40.001123 Hz  16:9     45.601 kHz     99.730000 MHz (344 mm x 194 mm)
                 Hfront   48 Hsync  32 Hback  187 Hpol P
                 Vfront    3 Vsync   6 Vback   51 Vpol N
    Empty Descriptor
    Manufacturer-Specified Display Descriptor (0x02): 00 02 00 0d 36 ff 0a 3c 96 14 13 2d 96 00 00 00 '....6..<...-....'
Checksum: 0xed

----------------

Warnings:

Block 0, Base EDID:
  Missing Display Product Name.

Failures:

Block 0, Base EDID:
  Empty Descriptor: Use Dummy Descriptor instead of all zeroes.
  Missing Display Range Limits Descriptor.
EDID:
  Extension Block 1 started with EDID header, ignoring Extension Blocks >= 1.

EDID conformity: FAIL
