edid-decode (hex):

00 ff ff ff ff ff ff 00 06 af 9e 10 00 00 00 00
01 13 01 03 90 26 15 78 0a c4 95 9e 57 53 92 26
0f 50 54 00 00 00 01 01 01 01 01 01 01 01 01 01
01 01 01 01 01 01 68 29 40 48 61 84 0c 30 30 20
36 00 7e d6 10 00 00 1a 68 29 40 48 61 84 0c 30
30 20 36 00 7e d6 10 00 00 1a 00 00 00 fe 00 34
50 47 39 4e 80 42 31 37 33 52 57 31 00 00 00 00
00 00 00 00 00 00 00 00 00 02 01 0a 20 20 00 d2

----------------

Block 0, Base EDID:
  EDID Structure Version & Revision: 1.3
  Vendor & Product Identification:
    Manufacturer: AUO
    Model: 4254
    Made in: week 1 of 2009
  Basic Display Parameters & Features:
    Digital display
    Maximum image size: 38 cm x 21 cm
    Gamma: 2.20
    RGB color display
    First detailed timing is the preferred timing
  Color Characteristics:
    Red  : 0.6201, 0.3398
    Green: 0.3251, 0.5703
    Blue : 0.1503, 0.0595
    White: 0.3134, 0.3291
  Established Timings I & II: none
  Standard Timings: none
  Detailed Timing Descriptors:
    DTD 1:  1600x900    60.284269 Hz  16:9     54.979 kHz    106.000000 MHz (382 mm x 214 mm)
                 Hfront   48 Hsync  32 Hback  248 Hpol P
                 Vfront    3 Vsync   6 Vback    3 Vpol N
    DTD 2:  1600x900    60.284269 Hz  16:9     54.979 kHz    106.000000 MHz (382 mm x 214 mm)
                 Hfront   48 Hsync  32 Hback  248 Hpol P
                 Vfront    3 Vsync   6 Vback    3 Vpol N
    Alphanumeric Data String: '4PG9N.B173RW1'
    Manufacturer-Specified Display Descriptor (0x00): 00 00 00 00 00 00 00 00 00 00 00 02 01 0a 20 20 '..............  '
Checksum: 0xd2

----------------

Warnings:

Block 0, Base EDID:
  Alphanumeric Data String: Non-ASCII character 0x80 at position 5, can cause problems.

Failures:

Block 0, Base EDID:
  Basic Display Parameters & Features: Digital Video Interface Standard set to reserved value 0x10.
  Missing Display Product Name.
  Missing Display Range Limits Descriptor.

EDID conformity: FAIL
