edid-decode (hex):

00 ff ff ff ff ff ff 00 41 0c 3b d0 56 34 12 00
16 11 01 03 80 28 16 78 0a e5 b5 a3 55 49 99 27
13 50 54 bf ce 00 81 c0 8b c0 81 40 00 01 00 01
00 01 00 01 00 01 01 1d 80 d0 72 1c 16 20 10 2c
25 80 90 e1 10 00 00 9a 0e 1f 00 80 51 00 1e 30
40 80 37 00 90 e1 10 00 00 1c 00 00 00 fc 00 50
48 4c 20 31 39 50 46 4c 34 33 32 32 00 00 00 fd
00 32 3c 0f 46 0f 00 0a 20 20 20 20 20 20 01 b7

02 03 23 f0 50 81 82 83 84 85 86 87 90 91 92 93
94 95 96 9f 80 23 09 07 07 83 01 00 00 65 03 0c
00 10 00 02 3a 80 d0 72 38 2d 40 10 2c 25 80 90
e1 10 00 00 1e 02 3a 80 18 71 38 2d 40 58 2c 25
00 90 e1 10 00 00 1e 01 1d 00 bc 52 d0 1e 20 b8
28 55 40 90 e1 10 00 00 1e 01 1d 00 72 51 d0 1e
20 6e 28 55 00 90 e1 10 00 00 1e 00 00 00 00 00
00 00 00 00 00 00 00 00 00 00 00 00 00 00 00 7a

00 ff ff ff ff ff ff 00 41 0c 3b d0 56 34 12 00
16 11 01 03 80 28 16 78 0a e5 b5 a3 55 49 99 27
13 50 54 bf ce 00 81 c0 8b c0 81 40 00 01 00 01
00 01 00 01 00 01 01 1d 80 d0 72 1c 16 20 10 2c
25 80 90 e1 10 00 00 9a 0e 1f 00 80 51 00 1e 30
40 80 37 00 90 e1 10 00 00 1c 00 00 00 fc 00 50
48 4c 20 31 39 50 46 4c 34 33 32 32 00 00 00 fd
00 32 3c 0f 46 0f 00 0a 20 20 20 20 20 20 01 b7

02 03 23 f0 50 81 82 83 84 85 86 87 90 91 92 93
94 95 96 9f 80 23 09 07 07 83 01 00 00 65 03 0c
00 10 00 02 3a 80 d0 72 38 2d 40 10 2c 25 80 90
e1 10 00 00 1e 02 3a 80 18 71 38 2d 40 58 2c 25
00 90 e1 10 00 00 1e 01 1d 00 bc 52 d0 1e 20 b8
28 55 40 90 e1 10 00 00 1e 01 1d 00 72 51 d0 1e
20 6e 28 55 00 90 e1 10 00 00 1e 00 00 00 00 00
00 00 00 00 00 00 00 00 00 00 00 00 00 00 00 7a

----------------

Block 0, Base EDID:
  EDID Structure Version & Revision: 1.3
  Vendor & Product Identification:
    Manufacturer: PHL
    Model: 53307
    Serial Number: ...
    Made in: week 22 of 2007
  Basic Display Parameters & Features:
    Digital display
    Maximum image size: 40 cm x 22 cm
    Gamma: 2.20
    RGB color display
    First detailed timing is the preferred timing
  Color Characteristics:
    Red  : 0.6396, 0.3339
    Green: 0.2861, 0.5986
    Blue : 0.1542, 0.0771
    White: 0.3134, 0.3291
  Established Timings I & II:
    IBM     :   720x400    70.081663 Hz   9:5     31.467 kHz     28.320000 MHz
    DMT 0x04:   640x480    59.940476 Hz   4:3     31.469 kHz     25.175000 MHz
    Apple   :   640x480    66.666667 Hz   4:3     35.000 kHz     30.240000 MHz
    DMT 0x05:   640x480    72.808802 Hz   4:3     37.861 kHz     31.500000 MHz
    DMT 0x06:   640x480    75.000000 Hz   4:3     37.500 kHz     31.500000 MHz
    DMT 0x08:   800x600    56.250000 Hz   4:3     35.156 kHz     36.000000 MHz
    DMT 0x09:   800x600    60.316541 Hz   4:3     37.879 kHz     40.000000 MHz
    DMT 0x0a:   800x600    72.187572 Hz   4:3     48.077 kHz     50.000000 MHz
    DMT 0x0b:   800x600    75.000000 Hz   4:3     46.875 kHz     49.500000 MHz
    DMT 0x10:  1024x768    60.003840 Hz   4:3     48.363 kHz     65.000000 MHz
    DMT 0x11:  1024x768    70.069359 Hz   4:3     56.476 kHz     75.000000 MHz
    DMT 0x12:  1024x768    75.028582 Hz   4:3     60.023 kHz     78.750000 MHz
  Standard Timings:
    DMT 0x55:  1280x720    60.000000 Hz  16:9     45.000 kHz     74.250000 MHz
    GTF     :  1360x765    60.000341 Hz  16:9     47.520 kHz     84.396000 MHz
    DMT 0x20:  1280x960    60.000000 Hz   4:3     60.000 kHz    108.000000 MHz
  Detailed Timing Descriptors:
    DTD 1:  1920x1080i  50.000000 Hz  16:9     28.125 kHz     74.250000 MHz (400 mm x 225 mm)
                 Hfront  528 Hsync  44 Hback  148 Hpol P
                 Vfront    2 Vsync   5 Vback   15 Vpol N Vfront +0.5 Odd Field
                 Vfront    2 Vsync   5 Vback   15 Vpol N Vback  +0.5 Even Field
    DTD 2:  1280x768    59.870228 Hz   5:3     47.776 kHz     79.500000 MHz (400 mm x 225 mm)
                 Hfront   64 Hsync 128 Hback  192 Hpol N
                 Vfront    3 Vsync   7 Vback   20 Vpol P
    Display Product Name: 'PHL 19PFL4322'
    Display Range Limits:
      Monitor ranges (GTF): 50-60 Hz V, 15-70 kHz H, max dotclock 150 MHz
  Extension blocks: 1
Checksum: 0xb7

----------------

Block 1, CTA-861 Extension Block:
  Revision: 3
  Underscans IT Video Formats by default
  Basic audio support
  Supports YCbCr 4:4:4
  Supports YCbCr 4:2:2
  Native DTDs: 0
  Video Data Block:
    VIC   1:   640x480    59.940476 Hz   4:3     31.469 kHz     25.175000 MHz (native)
    VIC   2:   720x480    59.940060 Hz   4:3     31.469 kHz     27.000000 MHz (native)
    VIC   3:   720x480    59.940060 Hz  16:9     31.469 kHz     27.000000 MHz (native)
    VIC   4:  1280x720    60.000000 Hz  16:9     45.000 kHz     74.250000 MHz (native)
    VIC   5:  1920x1080i  60.000000 Hz  16:9     33.750 kHz     74.250000 MHz (native)
    VIC   6:  1440x480i   59.940060 Hz   4:3     15.734 kHz     27.000000 MHz (native)
    VIC   7:  1440x480i   59.940060 Hz  16:9     15.734 kHz     27.000000 MHz (native)
    VIC  16:  1920x1080   60.000000 Hz  16:9     67.500 kHz    148.500000 MHz (native)
    VIC  17:   720x576    50.000000 Hz   4:3     31.250 kHz     27.000000 MHz (native)
    VIC  18:   720x576    50.000000 Hz  16:9     31.250 kHz     27.000000 MHz (native)
    VIC  19:  1280x720    50.000000 Hz  16:9     37.500 kHz     74.250000 MHz (native)
    VIC  20:  1920x1080i  50.000000 Hz  16:9     28.125 kHz     74.250000 MHz (native)
    VIC  21:  1440x576i   50.000000 Hz   4:3     15.625 kHz     27.000000 MHz (native)
    VIC  22:  1440x576i   50.000000 Hz  16:9     15.625 kHz     27.000000 MHz (native)
    VIC  31:  1920x1080   50.000000 Hz  16:9     56.250 kHz    148.500000 MHz (native)
  Audio Data Block:
    Linear PCM:
      Max channels: 2
      Supported sample rates (kHz): 48 44.1 32
      Supported sample sizes (bits): 24 20 16
  Speaker Allocation Data Block:
    FL/FR - Front Left/Right
  Vendor-Specific Data Block (HDMI), OUI 00-0C-03:
    Source physical address: 1.0.0.0
  Detailed Timing Descriptors:
    DTD 3:  1920x1080   50.000000 Hz  16:9     56.250 kHz    148.500000 MHz (400 mm x 225 mm)
                 Hfront  528 Hsync  44 Hback  148 Hpol P
                 Vfront    2 Vsync   5 Vback   38 Vpol P
    DTD 4:  1920x1080   60.000000 Hz  16:9     67.500 kHz    148.500000 MHz (400 mm x 225 mm)
                 Hfront   88 Hsync  44 Hback  148 Hpol P
                 Vfront    2 Vsync   5 Vback   38 Vpol P
    DTD 5:  1280x720    50.000000 Hz  16:9     37.500 kHz     74.250000 MHz (400 mm x 225 mm)
                 Hfront  440 Hsync  40 Hback  220 Hpol P
                 Vfront    5 Vsync   5 Vback   20 Vpol P
    DTD 6:  1280x720    60.000000 Hz  16:9     45.000 kHz     74.250000 MHz (400 mm x 225 mm)
                 Hfront  110 Hsync  40 Hback  220 Hpol P
                 Vfront    5 Vsync   5 Vback   20 Vpol P
Checksum: 0x7a  Unused space in Extension Block: 20 bytes

----------------

Warnings:

Block 0, Base EDID:
  Standard Timings: Standard Timing 1360x765 has a dubious odd vertical resolution.
  Detailed Timing Descriptor #1: DTD is similar but not identical to VIC 20.
  Detailed Timing Descriptor #2: Image size is 400x225 mm, but based on the picture AR it should be 375x225 mm.
Block 1, CTA-861 Extension Block:
  Video Data Block: VIC 1 and the first DTD are not identical. Is this intended?
  Video Data Block: All VICs are in ascending order, and the first (preferred) VIC <= 4, is that intended?
  Detailed Timing Descriptor #3: DTD is similar but not identical to VIC 31.
  Detailed Timing Descriptor #4: DTD is similar but not identical to VIC 16.
  Add a Colorimetry Data Block with the sRGB colorimetry bit set to avoid interop issues.
EDID:
  Base EDID: Some timings are out of range of the Monitor Ranges:
    Vertical Freq: 50.000 - 75.029 Hz (Monitor: 50.000 - 60.000 Hz)

Failures:

Block 0, Base EDID:
  Standard Timings: Use 0x0101 as the invalid Standard Timings code, not 0x0001.
  Standard Timings: Use 0x0101 as the invalid Standard Timings code, not 0x0001.
  Standard Timings: Use 0x0101 as the invalid Standard Timings code, not 0x0001.
  Standard Timings: Use 0x0101 as the invalid Standard Timings code, not 0x0001.
  Standard Timings: Use 0x0101 as the invalid Standard Timings code, not 0x0001.
Block 1, CTA-861 Extension Block:
  Missing VCDB, needed for Set Selectable RGB Quantization to avoid interop issues.
EDID:
  Extension Block 2 started with EDID header, ignoring Extension Blocks >= 2.
  CTA-861: Native progressive timings are a mix of several resolutions.
  CTA-861: Native interlaced timings are a mix of several resolutions.

EDID conformity: FAIL
