edid-decode (hex):

00 ff ff ff ff ff ff 00 31 03 00 35 00 00 00 00
35 1e 01 03 80 50 22 78 3f ee d5 a3 54 4c 99 23
0f 50 54 a5 4b 00 81 c0 81 80 95 00 a9 c0 b3 00
d1 c0 01 01 01 01 7a 3e 70 a0 d0 a0 29 50 30 20
35 00 1b 4e 31 00 00 1a 21 68 70 a0 d0 a0 29 50
30 20 35 00 1b 4e 31 00 00 1a 00 00 00 fd 00 30
65 a0 a0 3c 01 0a 20 20 20 20 20 20 00 00 00 fc
00 55 57 51 48 44 2d 31 30 30 2d 56 32 0a 01 2f

02 03 3c f1 4f 01 02 03 04 04 04 90 10 13 13 5b
1f 5a 5b 3f 23 09 07 07 83 01 00 00 6a 03 0c 00
13 00 00 78 20 00 00 67 00 00 00 01 78 c0 00 68
1a 00 00 01 01 00 65 00 e3 05 00 00 20 68 70 a0
d0 a0 29 50 58 40 45 00 1b 4e 31 00 00 1e a3 48
b8 68 61 a0 32 50 30 40 35 00 1b 4e 31 00 00 1e
00 00 00 00 00 00 00 00 00 00 00 00 00 00 00 00
00 00 00 00 00 00 00 00 00 00 00 00 00 00 00 e5

00 ff ff ff ff ff ff 00 31 03 00 35 00 00 00 00
35 1e 01 03 80 50 22 78 3f ee d5 a3 54 4c 99 23
0f 50 54 a5 4b 00 81 c0 81 80 95 00 a9 c0 b3 00
d1 c0 01 01 01 01 7a 3e 70 a0 d0 a0 29 50 30 20
35 00 1b 4e 31 00 00 1a 21 68 70 a0 d0 a0 29 50
30 20 35 00 1b 4e 31 00 00 1a 00 00 00 fd 00 30
65 a0 a0 3c 01 0a 20 20 20 20 20 20 00 00 00 fc
00 55 57 51 48 44 2d 31 30 30 2d 56 32 0a 01 2f

02 03 3c f1 4f 01 02 03 04 04 04 90 10 13 13 5b
1f 5a 5b 3f 23 09 07 07 83 01 00 00 6a 03 0c 00
13 00 00 78 20 00 00 67 00 00 00 01 78 c0 00 68
1a 00 00 01 01 00 65 00 e3 05 00 00 20 68 70 a0
d0 a0 29 50 58 40 45 00 1b 4e 31 00 00 1e a3 48
b8 68 61 a0 32 50 30 40 35 00 1b 4e 31 00 00 1e
00 00 00 00 00 00 00 00 00 00 00 00 00 00 00 00
00 00 00 00 00 00 00 00 00 00 00 00 00 00 00 e5

----------------

Block 0, Base EDID:
  EDID Structure Version & Revision: 1.3
  Vendor & Product Identification:
    Manufacturer: LHC
    Model: 13568
    Made in: week 53 of 2020
  Basic Display Parameters & Features:
    Digital display
    Maximum image size: 80 cm x 34 cm
    Gamma: 2.20
    DPMS levels: Off
    Undefined display color type
    Default (sRGB) color space is primary color space
    First detailed timing is the preferred timing
    Supports GTF timings within operating range
  Color Characteristics:
    Red  : 0.6396, 0.3300
    Green: 0.2998, 0.5996
    Blue : 0.1396, 0.0595
    White: 0.3134, 0.3291
  Established Timings I & II:
    IBM     :   720x400    70.081663 Hz   9:5     31.467 kHz     28.320000 MHz
    DMT 0x04:   640x480    59.940476 Hz   4:3     31.469 kHz     25.175000 MHz
    DMT 0x06:   640x480    75.000000 Hz   4:3     37.500 kHz     31.500000 MHz
    DMT 0x09:   800x600    60.316541 Hz   4:3     37.879 kHz     40.000000 MHz
    DMT 0x0b:   800x600    75.000000 Hz   4:3     46.875 kHz     49.500000 MHz
    DMT 0x10:  1024x768    60.003840 Hz   4:3     48.363 kHz     65.000000 MHz
    DMT 0x12:  1024x768    75.028582 Hz   4:3     60.023 kHz     78.750000 MHz
    DMT 0x24:  1280x1024   75.024675 Hz   5:4     79.976 kHz    135.000000 MHz
  Standard Timings:
    DMT 0x55:  1280x720    60.000000 Hz  16:9     45.000 kHz     74.250000 MHz
    DMT 0x23:  1280x1024   60.019740 Hz   5:4     63.981 kHz    108.000000 MHz
    DMT 0x2f:  1440x900    59.887445 Hz  16:10    55.935 kHz    106.500000 MHz
    DMT 0x53:  1600x900    60.000000 Hz  16:9     60.000 kHz    108.000000 MHz (RB)
    DMT 0x3a:  1680x1050   59.954250 Hz  16:10    65.290 kHz    146.250000 MHz
    DMT 0x52:  1920x1080   60.000000 Hz  16:9     67.500 kHz    148.500000 MHz
  Detailed Timing Descriptors:
    DTD 1:  3440x1440   29.998500 Hz  43:18    44.428 kHz    159.940000 MHz (795 mm x 334 mm)
                 Hfront   48 Hsync  32 Hback   80 Hpol P
                 Vfront    3 Vsync   5 Vback   33 Vpol N
    DTD 2:  3440x1440   49.998124 Hz  43:18    74.047 kHz    266.570000 MHz (795 mm x 334 mm)
                 Hfront   48 Hsync  32 Hback   80 Hpol P
                 Vfront    3 Vsync   5 Vback   33 Vpol N
    Display Range Limits:
      Monitor ranges (Range Limits Only): 48-101 Hz V, 160-160 kHz H, max dotclock 600 MHz
    Display Product Name: 'UWQHD-100-V2'
  Extension blocks: 1
Checksum: 0x2f

----------------

Block 1, CTA-861 Extension Block:
  Revision: 3
  Underscans IT Video Formats by default
  Basic audio support
  Supports YCbCr 4:4:4
  Supports YCbCr 4:2:2
  Native DTDs: 1
  Video Data Block:
    VIC   1:   640x480    59.940476 Hz   4:3     31.469 kHz     25.175000 MHz
    VIC   2:   720x480    59.940060 Hz   4:3     31.469 kHz     27.000000 MHz
    VIC   3:   720x480    59.940060 Hz  16:9     31.469 kHz     27.000000 MHz
    VIC   4:  1280x720    60.000000 Hz  16:9     45.000 kHz     74.250000 MHz
    VIC   4:  1280x720    60.000000 Hz  16:9     45.000 kHz     74.250000 MHz
    VIC   4:  1280x720    60.000000 Hz  16:9     45.000 kHz     74.250000 MHz
    VIC  16:  1920x1080   60.000000 Hz  16:9     67.500 kHz    148.500000 MHz (native)
    VIC  16:  1920x1080   60.000000 Hz  16:9     67.500 kHz    148.500000 MHz
    VIC  19:  1280x720    50.000000 Hz  16:9     37.500 kHz     74.250000 MHz
    VIC  19:  1280x720    50.000000 Hz  16:9     37.500 kHz     74.250000 MHz
    VIC  91:  2560x1080  100.000000 Hz  64:27   125.000 kHz    371.250000 MHz
    VIC  31:  1920x1080   50.000000 Hz  16:9     56.250 kHz    148.500000 MHz
    VIC  90:  2560x1080   60.000000 Hz  64:27    66.000 kHz    198.000000 MHz
    VIC  91:  2560x1080  100.000000 Hz  64:27   125.000 kHz    371.250000 MHz
    VIC  63:  1920x1080  120.000000 Hz  16:9    135.000 kHz    297.000000 MHz
  Audio Data Block:
    Linear PCM:
      Max channels: 2
      Supported sample rates (kHz): 48 44.1 32
      Supported sample sizes (bits): 24 20 16
  Speaker Allocation Data Block:
    FL/FR - Front Left/Right
  Vendor-Specific Data Block (HDMI), OUI 00-0C-03:
    Source physical address: 1.3.0.0
    Maximum TMDS clock: 600 MHz
    Extended HDMI video details:
  Vendor-Specific Data Block, OUI 00-00-00:
    01 78 c0 00                                     '.x..'
  Vendor-Specific Data Block (AMD), OUI 00-00-1A:
    Version: 1
    Flags 1: 0x01
      FreeSync Supported
    Minimum Refresh Rate: 0 Hz
    Maximum Refresh Rate: 101 Hz
  Colorimetry Data Block:
  Detailed Timing Descriptors:
    DTD 3:  3440x1440   49.996249 Hz  43:18    74.044 kHz    266.560000 MHz (795 mm x 334 mm)
                 Hfront   88 Hsync  64 Hback    8 Hpol P
                 Vfront    4 Vsync   5 Vback   32 Vpol P
    DTD 4:  1720x1440   59.999355 Hz  43:36    89.399 kHz    185.950000 MHz (795 mm x 334 mm)
                 Hfront   48 Hsync  64 Hback  248 Hpol P
                 Vfront    3 Vsync   5 Vback   42 Vpol P
Checksum: 0xe5  Unused space in Extension Block: 31 bytes

----------------

Warnings:

Block 1, CTA-861 Extension Block:
  Video Data Block: VIC 1 and the first DTD are not identical. Is this intended?
  Vendor-Specific Data Block, OUI 00-00-00: All zeroes OUI.
  Detailed Timing Descriptor #4: Image size is 795x334 mm, but based on the picture AR it should be 398x334 mm.
EDID:
  Base EDID: Some timings are out of range of the Monitor Ranges:
    Vertical Freq: 29.998 - 120.000 Hz (Monitor: 48.000 - 101.000 Hz)
    Horizontal Freq: 31.466 - 135.000 kHz (Monitor: 160.000 - 160.000 kHz)

Failures:

Block 0, Base EDID:
  Basic Display Parameters & Features: sRGB is signaled, but the chromaticities do not match.
  Display Range Limits: 'Range Limits Only' is not allowed for EDID < 1.4.
Block 1, CTA-861 Extension Block:
  Video Data Block: Duplicate VIC 4.
  Video Data Block: Duplicate VIC 16.
  Video Data Block: Duplicate VIC 19.
  Video Data Block: Duplicate VIC 91.
  Vendor-Specific Data Block (HDMI), OUI 00-0C-03: HDMI VSDB Max TMDS rate is > 340.
  Missing VCDB, needed for Set Selectable RGB Quantization to avoid interop issues.
EDID:
  Extension Block 2 started with EDID header, ignoring Extension Blocks >= 2.
  CTA-861: Native progressive timings are a mix of several resolutions.

EDID conformity: FAIL
