edid-decode (hex):

00 ff ff ff ff ff ff 00 30 e4 50 04 00 00 00 00
00 18 01 04 95 1c 10 78 0a 9f 15 94 58 55 90 29
1c 50 54 00 00 00 01 01 01 01 01 01 01 01 01 01
01 01 01 01 01 01 52 1c 56 a0 50 00 18 30 20 20
24 00 15 9c 10 00 00 1a a8 16 56 a0 50 00 18 30
20 20 24 00 15 9c 10 00 00 1a 00 00 00 fe 00 54
36 54 37 4b 80 31 32 35 57 48 32 0a 00 00 00 00
00 00 41 31 94 00 00 00 00 09 01 0a 20 20 00 4f

----------------

Block 0, Base EDID:
  EDID Structure Version & Revision: 1.4
  Vendor & Product Identification:
    Manufacturer: LGD
    Model: 1104
    Made in: 2014
  Basic Display Parameters & Features:
    Digital display
    Bits per primary color channel: 6
    DisplayPort interface
    Maximum image size: 28 cm x 16 cm
    Gamma: 2.20
    Supported color formats: RGB 4:4:4, YCrCb 4:4:4
    First detailed timing includes the native pixel format and preferred refresh rate
  Color Characteristics:
    Red  : 0.5800, 0.3447
    Green: 0.3349, 0.5654
    Blue : 0.1601, 0.1103
    White: 0.3134, 0.3291
  Established Timings I & II: none
  Standard Timings: none
  Detailed Timing Descriptors:
    DTD 1:  1366x768    59.987159 Hz 683:384   47.510 kHz     72.500000 MHz (277 mm x 156 mm)
                 Hfront   32 Hsync  32 Hback   96 Hpol P
                 Vfront    2 Vsync   4 Vback   18 Vpol N
    DTD 2:  1366x768    47.989727 Hz 683:384   38.008 kHz     58.000000 MHz (277 mm x 156 mm)
                 Hfront   32 Hsync  32 Hback   96 Hpol P
                 Vfront    2 Vsync   4 Vback   18 Vpol N
    Alphanumeric Data String: 'T6T7K.125WH2'
    Manufacturer-Specified Display Descriptor (0x00): 00 00 00 00 41 31 94 00 00 00 00 09 01 0a 20 20 '....A1........  '
Checksum: 0x4f

----------------

Warnings:

Block 0, Base EDID:
  Alphanumeric Data String: Non-ASCII character 0x80 at position 5, can cause problems.
  Missing Display Product Name.

EDID conformity: PASS
