edid-decode (hex):

00 ff ff ff ff ff ff 00 1a b3 21 08 00 00 00 00
26 17 01 03 80 3c 22 78 2a 4b b5 a7 56 4b a3 25
0a 50 54 a5 4b 00 81 00 81 8f 95 00 b3 00 d1 00
01 01 01 01 01 01 56 5e 00 a0 a0 a0 29 50 30 20
35 00 54 4f 21 00 00 1a 00 00 00 ff 00 59 56 36
46 30 30 39 38 34 38 0a 20 20 00 00 00 fc 00 50
32 37 54 2d 37 20 4c 45 44 0a 20 20 00 00 00 fd
00 32 4c 1e 64 21 00 0a 20 20 20 20 20 20 01 3b

02 03 04 00 28 3c 80 a0 70 b0 23 40 30 20 36 00
55 50 21 00 00 1a 02 3a 80 18 71 38 2d 40 58 2c
96 00 55 50 21 00 00 18 01 1d 00 72 51 d0 1e 20
6e 28 55 00 55 50 21 00 00 1e 02 3a 80 d0 72 38
2d 40 10 2c 96 80 55 50 21 00 00 18 00 00 00 00
00 00 00 00 00 00 00 00 00 00 00 00 00 00 00 00
00 00 00 00 00 00 00 00 00 00 00 00 00 00 00 00
00 00 00 00 00 00 00 00 00 00 00 00 00 00 00 17

00 ff ff ff ff ff ff 00 1a b3 21 08 00 00 00 00
26 17 01 03 80 3c 22 78 2a 4b b5 a7 56 4b a3 25
0a 50 54 a5 4b 00 81 00 81 8f 95 00 b3 00 d1 00
01 01 01 01 01 01 56 5e 00 a0 a0 a0 29 50 30 20
35 00 54 4f 21 00 00 1a 00 00 00 ff 00 59 56 36
46 30 30 39 38 34 38 0a 20 20 00 00 00 fc 00 50
32 37 54 2d 37 20 4c 45 44 0a 20 20 00 00 00 fd
00 32 4c 1e 64 21 00 0a 20 20 20 20 20 20 01 3b

02 03 04 00 28 3c 80 a0 70 b0 23 40 30 20 36 00
55 50 21 00 00 1a 02 3a 80 18 71 38 2d 40 58 2c
96 00 55 50 21 00 00 18 01 1d 00 72 51 d0 1e 20
6e 28 55 00 55 50 21 00 00 1e 02 3a 80 d0 72 38
2d 40 10 2c 96 80 55 50 21 00 00 18 00 00 00 00
00 00 00 00 00 00 00 00 00 00 00 00 00 00 00 00
00 00 00 00 00 00 00 00 00 00 00 00 00 00 00 00
00 00 00 00 00 00 00 00 00 00 00 00 00 00 00 17

----------------

Block 0, Base EDID:
  EDID Structure Version & Revision: 1.3
  Vendor & Product Identification:
    Manufacturer: FUS
    Model: 2081
    Made in: week 38 of 2013
  Basic Display Parameters & Features:
    Digital display
    Maximum image size: 60 cm x 34 cm
    Gamma: 2.20
    DPMS levels: Off
    RGB color display
    First detailed timing is the preferred timing
  Color Characteristics:
    Red  : 0.6533, 0.3359
    Green: 0.2949, 0.6396
    Blue : 0.1464, 0.0419
    White: 0.3134, 0.3291
  Established Timings I & II:
    IBM     :   720x400    70.081663 Hz   9:5     31.467 kHz     28.320000 MHz
    DMT 0x04:   640x480    59.940476 Hz   4:3     31.469 kHz     25.175000 MHz
    DMT 0x06:   640x480    75.000000 Hz   4:3     37.500 kHz     31.500000 MHz
    DMT 0x09:   800x600    60.316541 Hz   4:3     37.879 kHz     40.000000 MHz
    DMT 0x0b:   800x600    75.000000 Hz   4:3     46.875 kHz     49.500000 MHz
    DMT 0x10:  1024x768    60.003840 Hz   4:3     48.363 kHz     65.000000 MHz
    DMT 0x12:  1024x768    75.028582 Hz   4:3     60.023 kHz     78.750000 MHz
    DMT 0x24:  1280x1024   75.024675 Hz   5:4     79.976 kHz    135.000000 MHz
  Standard Timings:
    DMT 0x1c:  1280x800    59.810326 Hz  16:10    49.702 kHz     83.500000 MHz
    DMT 0x24:  1280x1024   75.024675 Hz   5:4     79.976 kHz    135.000000 MHz
    DMT 0x2f:  1440x900    59.887445 Hz  16:10    55.935 kHz    106.500000 MHz
    DMT 0x3a:  1680x1050   59.954250 Hz  16:10    65.290 kHz    146.250000 MHz
    DMT 0x45:  1920x1200   59.884600 Hz  16:10    74.556 kHz    193.250000 MHz
  Detailed Timing Descriptors:
    DTD 1:  2560x1440   59.950550 Hz  16:9     88.787 kHz    241.500000 MHz (596 mm x 335 mm)
                 Hfront   48 Hsync  32 Hback   80 Hpol P
                 Vfront    3 Vsync   5 Vback   33 Vpol N
    Display Product Serial Number: ...
    Display Product Name: 'P27T-7 LED'
    Display Range Limits:
      Monitor ranges (GTF): 50-76 Hz V, 30-100 kHz H, max dotclock 330 MHz
  Extension blocks: 1
Checksum: 0x3b

----------------

Block 1, CTA-861 Extension Block:
  Revision: 3
  Native DTDs: 0
  Detailed Timing Descriptors:
    DTD 2:  1920x1200   59.950171 Hz  16:10    74.038 kHz    154.000000 MHz (597 mm x 336 mm)
                 Hfront   48 Hsync  32 Hback   80 Hpol P
                 Vfront    3 Vsync   6 Vback   26 Vpol N
    DTD 3:  1920x1080   60.000000 Hz  16:9     67.500 kHz    148.500000 MHz (597 mm x 336 mm)
                 Hfront   88 Hsync  44 Hback  148 Hpol N
                 Vfront    9 Vsync   6 Vback   30 Vpol N
    DTD 4:  1280x720    60.000000 Hz  16:9     45.000 kHz     74.250000 MHz (597 mm x 336 mm)
                 Hfront  110 Hsync  40 Hback  220 Hpol P
                 Vfront    5 Vsync   5 Vback   20 Vpol P
    DTD 5:  1920x1080   50.000000 Hz  16:9     56.250 kHz    148.500000 MHz (597 mm x 336 mm)
                 Hfront  528 Hsync  44 Hback  148 Hpol N
                 Vfront    9 Vsync   6 Vback   30 Vpol N
Checksum: 0x17  Unused space in Extension Block: 51 bytes

----------------

Warnings:

Block 1, CTA-861 Extension Block:
  IT Video Formats are overscanned by default, but normally this should be underscanned.
  Detailed Timing Descriptor #2: Image size is 597x336 mm, but based on the picture AR it should be 537x336 mm.
  Detailed Timing Descriptor #3: DTD is similar but not identical to VIC 16.
  Detailed Timing Descriptor #4: DTD is identical to VIC 4, which is not present in the CTA Ext Block.
  Detailed Timing Descriptor #5: DTD is similar but not identical to VIC 31.
  Add a Colorimetry Data Block with the sRGB colorimetry bit set to avoid interop issues.

Failures:

Block 1, CTA-861 Extension Block:
  Missing VCDB, needed for Set Selectable RGB Quantization to avoid interop issues.
EDID:
  Extension Block 2 started with EDID header, ignoring Extension Blocks >= 2.

EDID conformity: FAIL
