edid-decode (hex):

00 ff ff ff ff ff ff 00 4e 14 99 19 31 0a 00 00
26 10 01 03 80 26 1e 78 2f ec 59 a5 58 4a 9a 26
21 52 56 bf ef 80 71 4f 81 40 81 80 95 00 81 c0
8b c0 01 01 01 01 9a 29 a0 d0 51 84 22 30 50 98
36 00 9e 04 11 00 00 1c 0e 1f 00 80 51 00 1e 30
40 80 37 00 72 dc 10 00 00 1c 00 00 00 fc 00 53
63 65 70 74 72 65 20 20 0a 20 20 20 00 00 00 fc
00 58 39 57 47 2d 4e 61 67 61 56 0a 20 20 00 39

00 ff ff ff ff ff ff 00 4e 14 99 19 31 0a 00 00
26 10 01 03 80 26 1e 78 2f ec 59 a5 58 4a 9a 26
21 52 56 bf ef 80 71 4f 81 40 81 80 95 00 81 c0
8b c0 01 01 01 01 9a 29 a0 d0 51 84 22 30 50 98
36 00 9e 04 11 00 00 1c 0e 1f 00 80 51 00 1e 30
40 80 37 00 72 dc 10 00 00 1c 00 00 00 fc 00 53
63 65 70 74 72 65 20 20 0a 20 20 20 00 00 00 fc
00 58 39 57 47 2d 4e 61 67 61 56 0a 20 20 00 39

----------------

Block 0, Base EDID:
  EDID Structure Version & Revision: 1.3
  Vendor & Product Identification:
    Manufacturer: SPT
    Model: 6553
    Serial Number: ...
    Made in: week 38 of 2006
  Basic Display Parameters & Features:
    Digital display
    Maximum image size: 38 cm x 30 cm
    Gamma: 2.20
    DPMS levels: Off
    RGB color display
    Default (sRGB) color space is primary color space
    First detailed timing is the preferred timing
    Supports GTF timings within operating range
  Color Characteristics:
    Red  : 0.6474, 0.3457
    Green: 0.2919, 0.6015
    Blue : 0.1494, 0.1298
    White: 0.3222, 0.3369
  Established Timings I & II:
    IBM     :   720x400    70.081663 Hz   9:5     31.467 kHz     28.320000 MHz
    DMT 0x04:   640x480    59.940476 Hz   4:3     31.469 kHz     25.175000 MHz
    Apple   :   640x480    66.666667 Hz   4:3     35.000 kHz     30.240000 MHz
    DMT 0x05:   640x480    72.808802 Hz   4:3     37.861 kHz     31.500000 MHz
    DMT 0x06:   640x480    75.000000 Hz   4:3     37.500 kHz     31.500000 MHz
    DMT 0x08:   800x600    56.250000 Hz   4:3     35.156 kHz     36.000000 MHz
    DMT 0x09:   800x600    60.316541 Hz   4:3     37.879 kHz     40.000000 MHz
    DMT 0x0a:   800x600    72.187572 Hz   4:3     48.077 kHz     50.000000 MHz
    DMT 0x0b:   800x600    75.000000 Hz   4:3     46.875 kHz     49.500000 MHz
    Apple   :   832x624    74.551266 Hz   4:3     49.726 kHz     57.284000 MHz
    DMT 0x10:  1024x768    60.003840 Hz   4:3     48.363 kHz     65.000000 MHz
    DMT 0x11:  1024x768    70.069359 Hz   4:3     56.476 kHz     75.000000 MHz
    DMT 0x12:  1024x768    75.028582 Hz   4:3     60.023 kHz     78.750000 MHz
    DMT 0x24:  1280x1024   75.024675 Hz   5:4     79.976 kHz    135.000000 MHz
    Apple   :  1152x870    75.061550 Hz 192:145   68.681 kHz    100.000000 MHz
  Standard Timings:
    DMT 0x15:  1152x864    75.000000 Hz   4:3     67.500 kHz    108.000000 MHz
    DMT 0x20:  1280x960    60.000000 Hz   4:3     60.000 kHz    108.000000 MHz
    DMT 0x23:  1280x1024   60.019740 Hz   5:4     63.981 kHz    108.000000 MHz
    DMT 0x2f:  1440x900    59.887445 Hz  16:10    55.935 kHz    106.500000 MHz
    DMT 0x55:  1280x720    60.000000 Hz  16:9     45.000 kHz     74.250000 MHz
    GTF     :  1360x765    60.000341 Hz  16:9     47.520 kHz     84.396000 MHz
  Detailed Timing Descriptors:
    DTD 1:  1440x900    59.887445 Hz  16:10    55.935 kHz    106.500000 MHz (414 mm x 260 mm)
                 Hfront   80 Hsync 152 Hback  232 Hpol N
                 Vfront    3 Vsync   6 Vback   25 Vpol P
    DTD 2:  1280x768    59.870228 Hz   5:3     47.776 kHz     79.500000 MHz (370 mm x 220 mm)
                 Hfront   64 Hsync 128 Hback  192 Hpol N
                 Vfront    3 Vsync   7 Vback   20 Vpol P
    Display Product Name: 'Sceptre  '
    Display Product Name: 'X9WG-NagaV'
Checksum: 0x39

----------------

Warnings:

Block 0, Base EDID:
  Standard Timings: Standard Timing 1360x765 has a dubious odd vertical resolution.

Failures:

Block 0, Base EDID:
  Basic Display Parameters & Features: sRGB is signaled, but the chromaticities do not match.
  Detailed Timing Descriptor #1: Mismatch of image size 414x260 mm vs display size 380x300 mm.
  Detailed Timing Descriptor #2: Mismatch of image size 370x220 mm vs display size 380x300 mm.
  Display Product Name: One or more trailing spaces before newline.
  Missing Display Range Limits Descriptor.
EDID:
  Extension Block 1 started with EDID header, ignoring Extension Blocks >= 1.
  Base EDID: The DTD max image size is 414x260mm, which is larger than the display size 380.0x300.0mm.

EDID conformity: FAIL
