edid-decode (hex):

00 ff ff ff ff ff ff 00 4c 83 63 41 00 00 00 00
08 1f 01 04 b5 1d 12 78 02 0c f1 ae 52 3c b9 23
0c 50 54 00 00 00 01 01 01 01 01 01 01 01 01 01
01 01 01 01 01 01 53 ce 80 30 d2 70 20 80 30 20
88 00 20 b4 10 00 00 1b 53 ce 80 30 d2 70 20 80
30 20 88 00 20 b4 10 00 00 1b 00 00 00 fe 00 38
56 58 56 54 81 31 33 34 58 4b 30 34 00 00 00 00
00 03 04 03 00 01 00 00 00 0b 01 0a 20 20 01 10

02 03 0f 00 e3 05 80 00 e6 06 05 01 74 60 07 00
00 00 00 00 00 00 00 00 00 00 00 00 00 00 00 00
00 00 00 00 00 00 00 00 00 00 00 00 00 00 00 00
00 00 00 00 00 00 00 00 00 00 00 00 00 00 00 00
00 00 00 00 00 00 00 00 00 00 00 00 00 00 00 00
00 00 00 00 00 00 00 00 00 00 00 00 00 00 00 00
00 00 00 00 00 00 00 00 00 00 00 00 00 00 00 00
00 00 00 00 00 00 00 00 00 00 00 00 00 00 00 b7

----------------

Block 0, Base EDID:
  EDID Structure Version & Revision: 1.4
  Vendor & Product Identification:
    Manufacturer: SDC
    Model: 16739
    Made in: week 8 of 2021
  Basic Display Parameters & Features:
    Digital display
    Bits per primary color channel: 10
    DisplayPort interface
    Maximum image size: 29 cm x 18 cm
    Gamma: 2.20
    Supported color formats: RGB 4:4:4
    First detailed timing includes the native pixel format and preferred refresh rate
  Color Characteristics:
    Red  : 0.6796, 0.3203
    Green: 0.2373, 0.7226
    Blue : 0.1396, 0.0498
    White: 0.3125, 0.3291
  Established Timings I & II: none
  Standard Timings: none
  Detailed Timing Descriptors:
    DTD 1:  3456x2160   60.000645 Hz  16:10   131.521 kHz    528.190000 MHz (288 mm x 180 mm)
                 Hfront   48 Hsync  32 Hback  480 Hpol P
                 Vfront    8 Vsync   8 Vback   16 Vpol N
    DTD 2:  3456x2160   60.000645 Hz  16:10   131.521 kHz    528.190000 MHz (288 mm x 180 mm)
                 Hfront   48 Hsync  32 Hback  480 Hpol P
                 Vfront    8 Vsync   8 Vback   16 Vpol N
    Alphanumeric Data String: '8VXVT.134XK04'
    Manufacturer-Specified Display Descriptor (0x00): 00 00 00 03 04 03 00 01 00 00 00 0b 01 0a 20 20 '..............  '
  Extension blocks: 1
Checksum: 0x10

----------------

Block 1, CTA-861 Extension Block:
  Revision: 3
  Native DTDs: 0
  Colorimetry Data Block:
    BT2020RGB
  HDR Static Metadata Data Block:
    Electro optical transfer functions:
      Traditional gamma - SDR luminance range
      SMPTE ST2084
    Supported static metadata descriptors:
      Static metadata type 1
    Desired content max luminance: 116 (616.884 cd/m^2)
    Desired content max frame-average luminance: 96 (400.000 cd/m^2)
    Desired content min luminance: 7 (0.005 cd/m^2)
Checksum: 0xb7  Unused space in Extension Block: 112 bytes

----------------

Warnings:

Block 0, Base EDID:
  Alphanumeric Data String: Non-ASCII character 0x81 at position 5, can cause problems.
  Missing Display Product Name.
Block 1, CTA-861 Extension Block:
  IT Video Formats are overscanned by default, but normally this should be underscanned.
  Colorimetry Data Block: Set the sRGB colorimetry bit to avoid interop issues.

Failures:

Block 1, CTA-861 Extension Block:
  Required 640x480p60 timings are missing in the established timings and the SVD list (VIC 1).
  Missing VCDB, needed for Set Selectable RGB Quantization to avoid interop issues.

EDID conformity: FAIL
