edid-decode (hex):

00 ff ff ff ff ff ff 00 38 a3 b1 66 01 01 01 01
06 10 01 04 a5 29 1f 78 e2 a6 a5 a3 57 4a 9d 25
12 50 54 bf ef 80 31 59 45 59 61 59 71 4f 81 59
81 99 a9 40 01 01 48 3f 40 30 62 b0 32 40 40 c0
13 00 98 32 11 00 00 1e 00 00 00 fd 00 32 55 1f
5c 11 00 0a 20 20 20 20 20 20 00 00 00 fc 00 4c
43 44 32 30 39 30 55 58 69 0a 20 20 00 00 00 ff
00 36 32 31 30 30 32 32 31 59 42 0a 20 20 00 2b

00 ff ff ff ff ff ff 00 38 a3 b1 66 01 01 01 01
06 10 01 04 a5 29 1f 78 e2 a6 a5 a3 57 4a 9d 25
12 50 54 bf ef 80 31 59 45 59 61 59 71 4f 81 59
81 99 a9 40 01 01 48 3f 40 30 62 b0 32 40 40 c0
13 00 98 32 11 00 00 1e 00 00 00 fd 00 32 55 1f
5c 11 00 0a 20 20 20 20 20 20 00 00 00 fc 00 4c
43 44 32 30 39 30 55 58 69 0a 20 20 00 00 00 ff
00 36 32 31 30 30 32 32 31 59 42 0a 20 20 00 2b

----------------

Block 0, Base EDID:
  EDID Structure Version & Revision: 1.4
  Vendor & Product Identification:
    Manufacturer: NEC
    Model: 26289
    Serial Number: ...
    Made in: week 6 of 2006
  Basic Display Parameters & Features:
    Digital display
    Bits per primary color channel: 8
    DisplayPort interface
    Maximum image size: 41 cm x 31 cm
    Gamma: 2.20
    DPMS levels: Standby Suspend Off
    Supported color formats: RGB 4:4:4
    First detailed timing includes the native pixel format and preferred refresh rate
  Color Characteristics:
    Red  : 0.6386, 0.3417
    Green: 0.2900, 0.6152
    Blue : 0.1464, 0.0722
    White: 0.3134, 0.3291
  Established Timings I & II:
    IBM     :   720x400    70.081663 Hz   9:5     31.467 kHz     28.320000 MHz
    DMT 0x04:   640x480    59.940476 Hz   4:3     31.469 kHz     25.175000 MHz
    Apple   :   640x480    66.666667 Hz   4:3     35.000 kHz     30.240000 MHz
    DMT 0x05:   640x480    72.808802 Hz   4:3     37.861 kHz     31.500000 MHz
    DMT 0x06:   640x480    75.000000 Hz   4:3     37.500 kHz     31.500000 MHz
    DMT 0x08:   800x600    56.250000 Hz   4:3     35.156 kHz     36.000000 MHz
    DMT 0x09:   800x600    60.316541 Hz   4:3     37.879 kHz     40.000000 MHz
    DMT 0x0a:   800x600    72.187572 Hz   4:3     48.077 kHz     50.000000 MHz
    DMT 0x0b:   800x600    75.000000 Hz   4:3     46.875 kHz     49.500000 MHz
    Apple   :   832x624    74.551266 Hz   4:3     49.726 kHz     57.284000 MHz
    DMT 0x10:  1024x768    60.003840 Hz   4:3     48.363 kHz     65.000000 MHz
    DMT 0x11:  1024x768    70.069359 Hz   4:3     56.476 kHz     75.000000 MHz
    DMT 0x12:  1024x768    75.028582 Hz   4:3     60.023 kHz     78.750000 MHz
    DMT 0x24:  1280x1024   75.024675 Hz   5:4     79.976 kHz    135.000000 MHz
    Apple   :  1152x870    75.061550 Hz 192:145   68.681 kHz    100.000000 MHz
  Standard Timings:
    DMT 0x07:   640x480    85.008312 Hz   4:3     43.269 kHz     36.000000 MHz
    DMT 0x0c:   800x600    85.061274 Hz   4:3     53.674 kHz     56.250000 MHz
    DMT 0x13:  1024x768    84.996690 Hz   4:3     68.677 kHz     94.500000 MHz
    DMT 0x15:  1152x864    75.000000 Hz   4:3     67.500 kHz    108.000000 MHz
    DMT 0x21:  1280x960    85.002473 Hz   4:3     85.938 kHz    148.500000 MHz
    DMT 0x25:  1280x1024   85.024098 Hz   5:4     91.146 kHz    157.500000 MHz
    DMT 0x33:  1600x1200   60.000000 Hz   4:3     75.000 kHz    162.000000 MHz
  Detailed Timing Descriptors:
    DTD 1:  1600x1200   60.000000 Hz   4:3     75.000 kHz    162.000000 MHz (408 mm x 306 mm)
                 Hfront   64 Hsync 192 Hback  304 Hpol P
                 Vfront    1 Vsync   3 Vback   46 Vpol P
    Display Range Limits:
      Monitor ranges (GTF): 50-85 Hz V, 31-92 kHz H, max dotclock 170 MHz
    Display Product Name: 'LCD2090UXi'
    Display Product Serial Number: ...
Checksum: 0x2b

----------------

Warnings:

Block 0, Base EDID:
  Vendor & Product Identification: The serial number is one of the known dummy values, it should probably be set to 0.
  Display Range Limits: GTF support is deprecated in EDID 1.4.

Failures:

Block 0, Base EDID:
  Display Range Limits: GTF is supported, but the display does not support continuous frequencies.
EDID:
  Extension Block 1 started with EDID header, ignoring Extension Blocks >= 1.

EDID conformity: FAIL
