edid-decode (hex):

00 ff ff ff ff ff ff 00 4e 16 0c 33 01 00 00 00
20 17 01 03 08 5d 35 78 ea aa aa a0 54 46 98 24
0e 48 4c bf ef 80 81 40 81 c0 8b c0 95 00 b3 00
a9 40 01 01 01 01 02 3a 80 18 71 38 2d 40 58 2c
45 00 a2 0b 32 00 00 1e 00 00 00 fd 00 38 55 1f
4b 11 00 0a 20 20 20 20 20 20 00 00 00 fc 00 53
32 2d 54 45 4b 20 54 56 0a 20 20 20 00 00 00 ff
00 53 4e 2d 30 30 30 30 30 30 30 30 31 0a 00 c2

00 ff ff ff ff ff ff 00 4e 16 0c 33 01 00 00 00
20 17 01 03 08 5d 35 78 ea aa aa a0 54 46 98 24
0e 48 4c bf ef 80 81 40 81 c0 8b c0 95 00 b3 00
a9 40 01 01 01 01 02 3a 80 18 71 38 2d 40 58 2c
45 00 a2 0b 32 00 00 1e 00 00 00 fd 00 38 55 1f
4b 11 00 0a 20 20 20 20 20 20 00 00 00 fc 00 53
32 2d 54 45 4b 20 54 56 0a 20 20 20 00 00 00 ff
00 53 4e 2d 30 30 30 30 30 30 30 30 31 0a 00 c2

----------------

Block 0, Base EDID:
  EDID Structure Version & Revision: 1.3
  Vendor & Product Identification:
    Manufacturer: SPV
    Model: 13068
    Serial Number: ...
    Made in: week 32 of 2013
  Basic Display Parameters & Features:
    Analog display
    Signal Level Standard: 0.700 : 0.300 : 1.000 V p-p
    Blank level equals black level
    Sync: Separate
    Maximum image size: 93 cm x 53 cm
    Gamma: 2.20
    DPMS levels: Standby Suspend Off
    RGB color display
    First detailed timing is the preferred timing
  Color Characteristics:
    Red  : 0.6269, 0.3300
    Green: 0.2753, 0.5957
    Blue : 0.1425, 0.0566
    White: 0.2832, 0.2988
  Established Timings I & II:
    IBM     :   720x400    70.081663 Hz   9:5     31.467 kHz     28.320000 MHz
    DMT 0x04:   640x480    59.940476 Hz   4:3     31.469 kHz     25.175000 MHz
    Apple   :   640x480    66.666667 Hz   4:3     35.000 kHz     30.240000 MHz
    DMT 0x05:   640x480    72.808802 Hz   4:3     37.861 kHz     31.500000 MHz
    DMT 0x06:   640x480    75.000000 Hz   4:3     37.500 kHz     31.500000 MHz
    DMT 0x08:   800x600    56.250000 Hz   4:3     35.156 kHz     36.000000 MHz
    DMT 0x09:   800x600    60.316541 Hz   4:3     37.879 kHz     40.000000 MHz
    DMT 0x0a:   800x600    72.187572 Hz   4:3     48.077 kHz     50.000000 MHz
    DMT 0x0b:   800x600    75.000000 Hz   4:3     46.875 kHz     49.500000 MHz
    Apple   :   832x624    74.551266 Hz   4:3     49.726 kHz     57.284000 MHz
    DMT 0x10:  1024x768    60.003840 Hz   4:3     48.363 kHz     65.000000 MHz
    DMT 0x11:  1024x768    70.069359 Hz   4:3     56.476 kHz     75.000000 MHz
    DMT 0x12:  1024x768    75.028582 Hz   4:3     60.023 kHz     78.750000 MHz
    DMT 0x24:  1280x1024   75.024675 Hz   5:4     79.976 kHz    135.000000 MHz
    Apple   :  1152x870    75.061550 Hz 192:145   68.681 kHz    100.000000 MHz
  Standard Timings:
    DMT 0x20:  1280x960    60.000000 Hz   4:3     60.000 kHz    108.000000 MHz
    DMT 0x55:  1280x720    60.000000 Hz  16:9     45.000 kHz     74.250000 MHz
    GTF     :  1360x765    60.000341 Hz  16:9     47.520 kHz     84.396000 MHz
    DMT 0x2f:  1440x900    59.887445 Hz  16:10    55.935 kHz    106.500000 MHz
    DMT 0x3a:  1680x1050   59.954250 Hz  16:10    65.290 kHz    146.250000 MHz
    DMT 0x33:  1600x1200   60.000000 Hz   4:3     75.000 kHz    162.000000 MHz
  Detailed Timing Descriptors:
    DTD 1:  1920x1080   60.000000 Hz  16:9     67.500 kHz    148.500000 MHz (930 mm x 523 mm)
                 Hfront   88 Hsync  44 Hback  148 Hpol P
                 Vfront    4 Vsync   5 Vback   36 Vpol P
    Display Range Limits:
      Monitor ranges (GTF): 56-85 Hz V, 31-75 kHz H, max dotclock 170 MHz
    Display Product Name: 'S2-TEK TV'
    Display Product Serial Number: ...
Checksum: 0xc2

----------------

Warnings:

Block 0, Base EDID:
  Vendor & Product Identification: The serial number is one of the known dummy values, it should probably be set to 0.
  Standard Timings: Standard Timing 1360x765 has a dubious odd vertical resolution.
  Display Product Serial Number: ...
EDID:
  Base EDID: Some timings are out of range of the Monitor Ranges:
    Horizontal Freq: 31.466 - 79.976 kHz (Monitor: 31.000 - 75.000 kHz)

Failures:

EDID:
  Extension Block 1 started with EDID header, ignoring Extension Blocks >= 1.

EDID conformity: FAIL
