edid-decode (hex):

00 ff ff ff ff ff ff 00 22 03 98 19 0e 48 21 03
2a 0e 01 01 68 24 1b a0 e8 00 bd a0 57 49 9b 26
10 44 4a a5 4f 00 45 59 31 59 a9 40 81 80 61 59
81 59 a9 4f 01 01 00 00 00 fd 00 32 a0 1e 62 14
00 0a 20 20 20 20 20 20 01 01 01 01 01 01 01 01
01 01 01 01 01 01 01 01 01 01 01 01 01 01 01 01
01 01 01 01 01 01 01 01 01 01 01 01 01 01 01 01
01 01 01 01 01 01 01 01 01 01 01 01 01 01 00 fa

00 ff ff ff ff ff ff 00 22 03 98 19 0e 48 21 03
2a 0e 01 01 68 24 1b a0 e8 00 bd a0 57 49 9b 26
10 44 4a a5 4f 00 45 59 31 59 a9 40 81 80 61 59
81 59 a9 4f 01 01 00 00 00 fd 00 32 a0 1e 62 14
00 0a 20 20 20 20 20 20 01 01 01 01 01 01 01 01
01 01 01 01 01 01 01 01 01 01 01 01 01 01 01 01
01 01 01 01 01 01 01 01 01 01 01 01 01 01 01 01
01 01 01 01 01 01 01 01 01 01 01 01 01 01 00 fa

----------------

Block 0, Base EDID:
  EDID Structure Version & Revision: 1.1
  Vendor & Product Identification:
    Manufacturer: HPC
    Model: 6552
    Serial Number: ...
    Made in: week 42 of 2004
  Basic Display Parameters & Features:
    Analog display
    Signal Level Standard: 0.700 : 0.000 : 0.700 V p-p
    Blank level equals black level
    Sync: Separate
    Maximum image size: 36 cm x 27 cm
    Gamma: 2.60
    DPMS levels: Standby Suspend Off
    RGB color display
  Color Characteristics:
    Red  : 0.6250, 0.3398
    Green: 0.2851, 0.6054
    Blue : 0.1503, 0.0654
    White: 0.2685, 0.2900
  Established Timings I & II:
    IBM     :   720x400    70.081663 Hz   9:5     31.467 kHz     28.320000 MHz
    DMT 0x04:   640x480    59.940476 Hz   4:3     31.469 kHz     25.175000 MHz
    DMT 0x06:   640x480    75.000000 Hz   4:3     37.500 kHz     31.500000 MHz
    DMT 0x09:   800x600    60.316541 Hz   4:3     37.879 kHz     40.000000 MHz
    DMT 0x0b:   800x600    75.000000 Hz   4:3     46.875 kHz     49.500000 MHz
    DMT 0x10:  1024x768    60.003840 Hz   4:3     48.363 kHz     65.000000 MHz
    DMT 0x11:  1024x768    70.069359 Hz   4:3     56.476 kHz     75.000000 MHz
    DMT 0x12:  1024x768    75.028582 Hz   4:3     60.023 kHz     78.750000 MHz
    DMT 0x24:  1280x1024   75.024675 Hz   5:4     79.976 kHz    135.000000 MHz
  Standard Timings:
    DMT 0x0c:   800x600    85.061274 Hz   4:3     53.674 kHz     56.250000 MHz
    DMT 0x07:   640x480    85.008312 Hz   4:3     43.269 kHz     36.000000 MHz
    DMT 0x33:  1600x1200   60.000000 Hz   4:3     75.000 kHz    162.000000 MHz
    DMT 0x23:  1280x1024   60.019740 Hz   5:4     63.981 kHz    108.000000 MHz
    DMT 0x13:  1024x768    84.996690 Hz   4:3     68.677 kHz     94.500000 MHz
    DMT 0x21:  1280x960    85.002473 Hz   4:3     85.938 kHz    148.500000 MHz
    DMT 0x36:  1600x1200   75.000000 Hz   4:3     93.750 kHz    202.500000 MHz
  Detailed Timing Descriptors:
    Display Range Limits:
      Monitor ranges (GTF): 50-160 Hz V, 30-98 kHz H, max dotclock 200 MHz
    Detailed mode: 01 01 01 01 01 01 01 01 01 01 01 01 01 01 01 01 01 01 '..................'
    Detailed mode: 01 01 01 01 01 01 01 01 01 01 01 01 01 01 01 01 01 01 '..................'
    Detailed mode: 01 01 01 01 01 01 01 01 01 01 01 01 01 01 01 01 01 01 '..................'
Checksum: 0xfa

----------------

Warnings:

Block 0, Base EDID:
  EDID Structure Version & Revision: EDID 1.1 is deprecated, do not use.
EDID:
  Base EDID: Some timings are out of range of the Monitor Ranges:
    Maximum Clock: 202.500 MHz (Monitor: 200.000 MHz)
    Could be due to a Monitor Range off-by-one rounding issue

Failures:

Block 0, Base EDID:
  Detailed Timing Descriptor #1: Pixelclock < 10 MHz, assuming invalid data 0x01 0x01.
  Detailed Timing Descriptor #1: Invalid detailed timing descriptor ordering.
  Detailed Timing Descriptor #2: Pixelclock < 10 MHz, assuming invalid data 0x01 0x01.
  Detailed Timing Descriptor #2: Invalid detailed timing descriptor ordering.
  Detailed Timing Descriptor #3: Pixelclock < 10 MHz, assuming invalid data 0x01 0x01.
  Detailed Timing Descriptor #3: Invalid detailed timing descriptor ordering.
EDID:
  Extension Block 1 started with EDID header, ignoring Extension Blocks >= 1.

EDID conformity: FAIL
