edid-decode (hex):

00 ff ff ff ff ff ff 00 04 94 83 24 27 03 18 20
0d 1c 01 03 a2 5d 34 78 ce cf b5 a3 55 49 99 25
10 50 54 a5 4b 00 81 80 95 00 b3 00 01 01 01 01
01 01 01 01 01 01 02 3a 80 18 71 38 2d 40 58 2c
45 00 a2 0a 32 00 00 1e 00 00 00 fe 00 41 44 56
41 4e 54 45 43 48 0a 20 20 20 00 00 00 fd 00 32
4b 1e 5e 15 4f 52 5f 48 44 4d 49 0a 00 00 00 fc
00 41 44 56 41 4e 54 45 43 48 0a 20 20 20 01 74

02 03 1e f2 4b 05 12 07 13 16 14 1f 10 04 83 81
23 09 07 07 83 01 00 00 65 03 0c 00 10 00 8c 0a
a0 14 51 f0 16 00 26 7c 43 00 f0 be 00 00 00 98
8c 0a d0 14 21 e0 2d 10 10 3a 96 00 f0 be 00 00
00 18 01 1d 00 72 51 d0 1e 20 6e 28 55 00 f0 be
00 00 00 1e 01 1d 80 18 71 1c 16 20 58 2c 25 00
f0 be 00 00 00 9e 02 3a 80 18 71 38 2d 40 58 2c
45 00 be be 00 00 00 1e 00 00 00 00 00 00 00 41

----------------

Block 0, Base EDID:
  EDID Structure Version & Revision: 1.3
  Vendor & Product Identification:
    Manufacturer: ADT
    Model: 9347
    Serial Number: ...
    Made in: week 13 of 2018
  Basic Display Parameters & Features:
    Digital display
    Maximum image size: 93 cm x 52 cm
    Gamma: 2.20
    DPMS levels: Standby Suspend
    RGB color display
    Default (sRGB) color space is primary color space
    First detailed timing is the preferred timing
  Color Characteristics:
    Red  : 0.6396, 0.3320
    Green: 0.2880, 0.6005
    Blue : 0.1464, 0.0654
    White: 0.3134, 0.3291
  Established Timings I & II:
    IBM     :   720x400    70.081663 Hz   9:5     31.467 kHz     28.320000 MHz
    DMT 0x04:   640x480    59.940476 Hz   4:3     31.469 kHz     25.175000 MHz
    DMT 0x06:   640x480    75.000000 Hz   4:3     37.500 kHz     31.500000 MHz
    DMT 0x09:   800x600    60.316541 Hz   4:3     37.879 kHz     40.000000 MHz
    DMT 0x0b:   800x600    75.000000 Hz   4:3     46.875 kHz     49.500000 MHz
    DMT 0x10:  1024x768    60.003840 Hz   4:3     48.363 kHz     65.000000 MHz
    DMT 0x12:  1024x768    75.028582 Hz   4:3     60.023 kHz     78.750000 MHz
    DMT 0x24:  1280x1024   75.024675 Hz   5:4     79.976 kHz    135.000000 MHz
  Standard Timings:
    DMT 0x23:  1280x1024   60.019740 Hz   5:4     63.981 kHz    108.000000 MHz
    DMT 0x2f:  1440x900    59.887445 Hz  16:10    55.935 kHz    106.500000 MHz
    DMT 0x3a:  1680x1050   59.954250 Hz  16:10    65.290 kHz    146.250000 MHz
  Detailed Timing Descriptors:
    DTD 1:  1920x1080   60.000000 Hz  16:9     67.500 kHz    148.500000 MHz (930 mm x 522 mm)
                 Hfront   88 Hsync  44 Hback  148 Hpol P
                 Vfront    4 Vsync   5 Vback   36 Vpol P
    Alphanumeric Data String: 'ADVANTECH'
    Display Range Limits:
      Monitor ranges (Unknown (0x4f)): 50-75 Hz V, 30-94 kHz H, max dotclock 210 MHz
    Display Product Name: 'ADVANTECH'
  Extension blocks: 1
Checksum: 0x74

----------------

Block 1, CTA-861 Extension Block:
  Revision: 3
  Underscans IT Video Formats by default
  Basic audio support
  Supports YCbCr 4:4:4
  Supports YCbCr 4:2:2
  Native detailed modes: 2
  Video Data Block:
    VIC   5:  1920x1080i  60.000000 Hz  16:9     33.750 kHz     74.250000 MHz
    VIC  18:   720x576    50.000000 Hz  16:9     31.250 kHz     27.000000 MHz
    VIC   7:  1440x480i   59.940060 Hz  16:9     15.734 kHz     27.000000 MHz
    VIC  19:  1280x720    50.000000 Hz  16:9     37.500 kHz     74.250000 MHz
    VIC  22:  1440x576i   50.000000 Hz  16:9     15.625 kHz     27.000000 MHz
    VIC  20:  1920x1080i  50.000000 Hz  16:9     28.125 kHz     74.250000 MHz
    VIC  31:  1920x1080   50.000000 Hz  16:9     56.250 kHz    148.500000 MHz
    VIC  16:  1920x1080   60.000000 Hz  16:9     67.500 kHz    148.500000 MHz
    VIC   4:  1280x720    60.000000 Hz  16:9     45.000 kHz     74.250000 MHz
    VIC   3:   720x480    59.940060 Hz  16:9     31.469 kHz     27.000000 MHz (native)
    VIC   1:   640x480    59.940476 Hz   4:3     31.469 kHz     25.175000 MHz (native)
  Audio Data Block:
    Linear PCM:
      Max channels: 2
      Supported sample rates (kHz): 48 44.1 32
      Supported sample sizes (bits): 24 20 16
  Speaker Allocation Data Block:
    FL/FR - Front Left/Right
  Vendor-Specific Data Block (HDMI), OUI 00-0C-03:
    Source physical address: 1.0.0.0
  Detailed Timing Descriptors:
    DTD 2:  1440x480i   59.940060 Hz   3:1     15.734 kHz     27.000000 MHz (240 mm x 190 mm)
                 Hfront   38 Hsync 124 Hback  114 Hpol N
                 Vfront    4 Vsync   3 Vback   15 Vpol N Vfront +0.5 Odd Field
                 Vfront    4 Vsync   3 Vback   15 Vpol N Vback  +0.5 Even Field
    DTD 3:   720x480    51.635112 Hz   3:2     27.108 kHz     27.000000 MHz (240 mm x 190 mm)
                 Hfront   16 Hsync  58 Hback  202 Hpol N
                 Vfront    9 Vsync   6 Vback   30 Vpol N
    DTD 4:  1280x720    60.000000 Hz  16:9     45.000 kHz     74.250000 MHz (240 mm x 190 mm)
                 Hfront  110 Hsync  40 Hback  220 Hpol P
                 Vfront    5 Vsync   5 Vback   20 Vpol P
    DTD 5:  1920x1080i  60.000000 Hz  16:9     33.750 kHz     74.250000 MHz (240 mm x 190 mm)
                 Hfront   88 Hsync  44 Hback  148 Hpol P
                 Vfront    2 Vsync   5 Vback   15 Vpol P Vfront +0.5 Odd Field
                 Vfront    2 Vsync   5 Vback   15 Vpol P Vback  +0.5 Even Field
    DTD 6:  1920x1080   60.000000 Hz  16:9     67.500 kHz    148.500000 MHz (190 mm x 190 mm)
                 Hfront   88 Hsync  44 Hback  148 Hpol P
                 Vfront    4 Vsync   5 Vback   36 Vpol P
Checksum: 0x41  Unused space in Extension Block: 7 bytes

----------------

Warnings:

Block 1, CTA-861 Extension Block:
  Video Data Block: VIC 5 and the first DTD are not identical. Is this intended?
  Detailed Timing Descriptor #2: Image size is 240x190 mm, but based on the picture AR it should be 240x80 mm.
  Detailed Timing Descriptor #3: Image size is 240x190 mm, but based on the picture AR it should be 240x160 mm.
  Detailed Timing Descriptor #4: Image size is 240x190 mm, but based on the picture AR it should be 240x135 mm.
  Detailed Timing Descriptor #5: Image size is 240x190 mm, but based on the picture AR it should be 240x135 mm.
  Detailed Timing Descriptor #6: Image size is 190x190 mm, but based on the picture AR it should be 190x106 mm.
EDID:
  Base EDID: Some timings are out of range of the Monitor Ranges:
    Horizontal Freq: 15.625 - 79.976 kHz (Monitor: 30.000 - 94.000 kHz)
  CTA-861: Native interlaced resolution of 1440x480 is smaller than the max preferred interlaced resolution 1920x1080.

Failures:

Block 0, Base EDID:
  Basic Display Parameters & Features: Digital Video Interface Standard set to reserved value 0x22.
  Basic Display Parameters & Features: sRGB is signaled, but the chromaticities do not match.
  Display Range Limits: Unknown range class (0x4f).
  Display Range Limits: Byte 11 is 0x52 instead of 0x0a.
  Display Range Limits: Bytes 12-17 must be 0x20.
Block 1, CTA-861 Extension Block:
  Detailed Timing Descriptor #2: Mismatch of image size 240x190 mm vs display size 930x520 mm.
  Detailed Timing Descriptor #3: Mismatch of image size 240x190 mm vs display size 930x520 mm.
  Detailed Timing Descriptor #4: Mismatch of image size 240x190 mm vs display size 930x520 mm.
  Detailed Timing Descriptor #5: Mismatch of image size 240x190 mm vs display size 930x520 mm.
  Detailed Timing Descriptor #6: Mismatch of image size 190x190 mm vs display size 930x520 mm.
  Missing VCDB, needed for Set Selectable RGB Quantization to avoid interop issues.
EDID:
  CTA-861: Native progressive timings are a mix of several resolutions.

EDID conformity: FAIL
