edid-decode (hex):

00 ff ff ff ff ff ff 00 5a 63 3c 03 01 00 00 00
2b 1f 01 04 b5 3f 24 78 2b b4 a5 ad 4f 44 9e 25
0f 50 54 bf ef 80 d1 c0 b3 00 81 c0 a9 c0 95 00
81 80 01 01 01 01 4d d0 00 a0 f0 70 3e 80 30 20
35 00 78 68 21 00 00 1e 00 00 00 ff 00 57 4c 39
32 31 34 33 30 30 30 31 38 0a 00 00 00 fd 00 30
96 ff ff 8c 01 0a 20 20 20 20 20 20 00 00 00 fc
00 56 58 32 38 38 32 2d 34 4b 50 0a 20 20 02 35

02 03 3e f2 58 01 02 03 04 10 13 1f 20 21 22 3f
4c 5a 5b 5c 5d 5e 5f 60 61 69 6b 75 76 23 09 7f
07 83 01 00 00 e3 05 e3 01 e6 06 07 01 60 60 27
6d 1a 00 00 02 01 30 96 00 00 00 00 00 00 02 3a
80 18 71 38 2d 40 58 2c 25 00 78 68 21 00 00 1e
10 bd 00 a0 a0 a0 29 50 30 20 35 00 78 68 21 00
00 1e 68 74 80 18 71 38 2d 40 58 2c 25 00 78 68
21 00 00 1e 00 00 00 00 00 00 00 00 00 00 00 93

70 12 6a 00 00 03 00 50 97 d0 00 04 ff 0e 9f 00
2f 00 1f 00 6f 08 3d 00 02 00 04 00 93 5b 01 04
ff 0e 9f 00 2f 00 1f 00 6f 08 3d 00 02 00 04 00
d3 9d 01 04 ff 0e 9f 00 2f 00 1f 00 6f 08 2c 00
02 00 04 00 52 f4 01 04 ff 0e 9f 00 2f 00 1f 00
6f 08 3d 00 02 00 04 00 03 01 14 23 07 02 04 ff
0e 9f 00 2f 00 1f 00 6f 08 36 00 02 00 04 00 5f
00 00 00 00 00 00 00 00 00 00 00 00 00 00 00 90

00 ff ff ff ff ff ff 00 5a 63 3c 03 01 00 00 00
2b 1f 01 04 b5 3f 24 78 2b b4 a5 ad 4f 44 9e 25
0f 50 54 bf ef 80 d1 c0 b3 00 81 c0 a9 c0 95 00
81 80 01 01 01 01 4d d0 00 a0 f0 70 3e 80 30 20
35 00 78 68 21 00 00 1e 00 00 00 ff 00 57 4c 39
32 31 34 33 30 30 30 31 38 0a 00 00 00 fd 00 30
96 ff ff 8c 01 0a 20 20 20 20 20 20 00 00 00 fc
00 56 58 32 38 38 32 2d 34 4b 50 0a 20 20 02 35

02 03 3e f2 58 01 02 03 04 10 13 1f 20 21 22 3f
4c 5a 5b 5c 5d 5e 5f 60 61 69 6b 75 76 23 09 7f
07 83 01 00 00 e3 05 e3 01 e6 06 07 01 60 60 27
6d 1a 00 00 02 01 30 96 00 00 00 00 00 00 02 3a
80 18 71 38 2d 40 58 2c 25 00 78 68 21 00 00 1e
10 bd 00 a0 a0 a0 29 50 30 20 35 00 78 68 21 00
00 1e 68 74 80 18 71 38 2d 40 58 2c 25 00 78 68
21 00 00 1e 00 00 00 00 00 00 00 00 00 00 00 93

70 12 6a 00 00 03 00 50 97 d0 00 04 ff 0e 9f 00
2f 00 1f 00 6f 08 3d 00 02 00 04 00 93 5b 01 04
ff 0e 9f 00 2f 00 1f 00 6f 08 3d 00 02 00 04 00
d3 9d 01 04 ff 0e 9f 00 2f 00 1f 00 6f 08 2c 00
02 00 04 00 52 f4 01 04 ff 0e 9f 00 2f 00 1f 00
6f 08 3d 00 02 00 04 00 03 01 14 23 07 02 04 ff
0e 9f 00 2f 00 1f 00 6f 08 36 00 02 00 04 00 5f
00 00 00 00 00 00 00 00 00 00 00 00 00 00 00 90

----------------

Block 0, Base EDID:
  EDID Structure Version & Revision: 1.4
  Vendor & Product Identification:
    Manufacturer: VSC
    Model: 828
    Serial Number: ...
    Made in: week 43 of 2021
  Basic Display Parameters & Features:
    Digital display
    Bits per primary color channel: 10
    DisplayPort interface
    Maximum image size: 63 cm x 36 cm
    Gamma: 2.20
    DPMS levels: Off
    Supported color formats: RGB 4:4:4, YCrCb 4:4:4
    First detailed timing includes the native pixel format and preferred refresh rate
    Display supports continuous frequencies
  Color Characteristics:
    Red  : 0.6777, 0.3115
    Green: 0.2666, 0.6171
    Blue : 0.1464, 0.0605
    White: 0.3134, 0.3291
  Established Timings I & II:
    IBM     :   720x400    70.081663 Hz   9:5     31.467 kHz     28.320000 MHz
    DMT 0x04:   640x480    59.940476 Hz   4:3     31.469 kHz     25.175000 MHz
    Apple   :   640x480    66.666667 Hz   4:3     35.000 kHz     30.240000 MHz
    DMT 0x05:   640x480    72.808802 Hz   4:3     37.861 kHz     31.500000 MHz
    DMT 0x06:   640x480    75.000000 Hz   4:3     37.500 kHz     31.500000 MHz
    DMT 0x08:   800x600    56.250000 Hz   4:3     35.156 kHz     36.000000 MHz
    DMT 0x09:   800x600    60.316541 Hz   4:3     37.879 kHz     40.000000 MHz
    DMT 0x0a:   800x600    72.187572 Hz   4:3     48.077 kHz     50.000000 MHz
    DMT 0x0b:   800x600    75.000000 Hz   4:3     46.875 kHz     49.500000 MHz
    Apple   :   832x624    74.551266 Hz   4:3     49.726 kHz     57.284000 MHz
    DMT 0x10:  1024x768    60.003840 Hz   4:3     48.363 kHz     65.000000 MHz
    DMT 0x11:  1024x768    70.069359 Hz   4:3     56.476 kHz     75.000000 MHz
    DMT 0x12:  1024x768    75.028582 Hz   4:3     60.023 kHz     78.750000 MHz
    DMT 0x24:  1280x1024   75.024675 Hz   5:4     79.976 kHz    135.000000 MHz
    Apple   :  1152x870    75.061550 Hz 192:145   68.681 kHz    100.000000 MHz
  Standard Timings:
    DMT 0x52:  1920x1080   60.000000 Hz  16:9     67.500 kHz    148.500000 MHz
    DMT 0x3a:  1680x1050   59.954250 Hz  16:10    65.290 kHz    146.250000 MHz
    DMT 0x55:  1280x720    60.000000 Hz  16:9     45.000 kHz     74.250000 MHz
    DMT 0x53:  1600x900    60.000000 Hz  16:9     60.000 kHz    108.000000 MHz (RB)
    DMT 0x2f:  1440x900    59.887445 Hz  16:10    55.935 kHz    106.500000 MHz
    DMT 0x23:  1280x1024   60.019740 Hz   5:4     63.981 kHz    108.000000 MHz
  Detailed Timing Descriptors:
    DTD 1:  3840x2160   59.996625 Hz  16:9    133.312 kHz    533.250000 MHz (632 mm x 360 mm)
                 Hfront   48 Hsync  32 Hback   80 Hpol P
                 Vfront    3 Vsync   5 Vback   54 Vpol P
    Display Product Serial Number: ...
    Display Range Limits:
      Monitor ranges (Range Limits Only): 48-150 Hz V, 255-255 kHz H, max dotclock 1400 MHz
    Display Product Name: 'VX2882-4KP'
  Extension blocks: 2
Checksum: 0x35

----------------

Block 1, CTA-861 Extension Block:
  Revision: 3
  Underscans IT Video Formats by default
  Basic audio support
  Supports YCbCr 4:4:4
  Supports YCbCr 4:2:2
  Native DTDs: 2
  Video Data Block:
    VIC   1:   640x480    59.940476 Hz   4:3     31.469 kHz     25.175000 MHz
    VIC   2:   720x480    59.940060 Hz   4:3     31.469 kHz     27.000000 MHz
    VIC   3:   720x480    59.940060 Hz  16:9     31.469 kHz     27.000000 MHz
    VIC   4:  1280x720    60.000000 Hz  16:9     45.000 kHz     74.250000 MHz
    VIC  16:  1920x1080   60.000000 Hz  16:9     67.500 kHz    148.500000 MHz
    VIC  19:  1280x720    50.000000 Hz  16:9     37.500 kHz     74.250000 MHz
    VIC  31:  1920x1080   50.000000 Hz  16:9     56.250 kHz    148.500000 MHz
    VIC  32:  1920x1080   24.000000 Hz  16:9     27.000 kHz     74.250000 MHz
    VIC  33:  1920x1080   25.000000 Hz  16:9     28.125 kHz     74.250000 MHz
    VIC  34:  1920x1080   30.000000 Hz  16:9     33.750 kHz     74.250000 MHz
    VIC  63:  1920x1080  120.000000 Hz  16:9    135.000 kHz    297.000000 MHz
    VIC  76:  1920x1080   60.000000 Hz  64:27    67.500 kHz    148.500000 MHz
    VIC  90:  2560x1080   60.000000 Hz  64:27    66.000 kHz    198.000000 MHz
    VIC  91:  2560x1080  100.000000 Hz  64:27   125.000 kHz    371.250000 MHz
    VIC  92:  2560x1080  120.000000 Hz  64:27   150.000 kHz    495.000000 MHz
    VIC  93:  3840x2160   24.000000 Hz  16:9     54.000 kHz    297.000000 MHz
    VIC  94:  3840x2160   25.000000 Hz  16:9     56.250 kHz    297.000000 MHz
    VIC  95:  3840x2160   30.000000 Hz  16:9     67.500 kHz    297.000000 MHz
    VIC  96:  3840x2160   50.000000 Hz  16:9    112.500 kHz    594.000000 MHz
    VIC  97:  3840x2160   60.000000 Hz  16:9    135.000 kHz    594.000000 MHz
    VIC 105:  3840x2160   30.000000 Hz  64:27    67.500 kHz    297.000000 MHz
    VIC 107:  3840x2160   60.000000 Hz  64:27   135.000 kHz    594.000000 MHz
    VIC 117:  3840x2160  100.000000 Hz  16:9    225.000 kHz   1188.000000 MHz
    VIC 118:  3840x2160  120.000000 Hz  16:9    270.000 kHz   1188.000000 MHz
  Audio Data Block:
    Linear PCM:
      Max channels: 2
      Supported sample rates (kHz): 192 176.4 96 88.2 48 44.1 32
      Supported sample sizes (bits): 24 20 16
  Speaker Allocation Data Block:
    FL/FR - Front Left/Right
  Colorimetry Data Block:
    xvYCC601
    xvYCC709
    BT2020cYCC
    BT2020YCC
    BT2020RGB
    Gamut Boundary Description Metadata Profile P0
  HDR Static Metadata Data Block:
    Electro optical transfer functions:
      Traditional gamma - SDR luminance range
      Traditional gamma - HDR luminance range
      SMPTE ST2084
    Supported static metadata descriptors:
      Static metadata type 1
    Desired content max luminance: 96 (400.000 cd/m^2)
    Desired content max frame-average luminance: 96 (400.000 cd/m^2)
    Desired content min luminance: 39 (0.094 cd/m^2)
  Vendor-Specific Data Block (AMD), OUI 00-00-1A:
    Version: 2
    Flags 1: 0x01
      FreeSync Supported
    Minimum Refresh Rate: 48 Hz
    Maximum Refresh Rate: 150 Hz
    Flags 5: 0x00
  Detailed Timing Descriptors:
    DTD 2:  1920x1080   60.000000 Hz  16:9     67.500 kHz    148.500000 MHz (632 mm x 360 mm)
                 Hfront   88 Hsync  44 Hback  148 Hpol P
                 Vfront    2 Vsync   5 Vback   38 Vpol P
    DTD 3:  2560x1440  120.149343 Hz  16:9    177.941 kHz    484.000000 MHz (632 mm x 360 mm)
                 Hfront   48 Hsync  32 Hback   80 Hpol P
                 Vfront    3 Vsync   5 Vback   33 Vpol P
    DTD 4:  1920x1080  120.404040 Hz  16:9    135.455 kHz    298.000000 MHz (632 mm x 360 mm)
                 Hfront   88 Hsync  44 Hback  148 Hpol P
                 Vfront    2 Vsync   5 Vback   38 Vpol P
Checksum: 0x93  Unused space in Extension Block: 11 bytes

----------------

Block 2, DisplayID Extension Block:
  Version: 1.2
  Extension Count: 0
  Display Product Type: Extension Section
  Video Timing Modes Type 1 - Detailed Timings Data Block:
    DTD:  3840x2160   60.081008 Hz  16:9    133.500 kHz    534.000000 MHz (aspect 16:9, no 3D stereo)
               Hfront   48 Hsync  32 Hback   80 Hpol N
               Vfront    3 Vsync   5 Vback   54 Vpol N
    DTD:  3840x2160  100.112511 Hz  16:9    222.450 kHz    889.800000 MHz (aspect 16:9, no 3D stereo)
               Hfront   48 Hsync  32 Hback   80 Hpol N
               Vfront    3 Vsync   5 Vback   54 Vpol N
    DTD:  3840x2160  120.113379 Hz  16:9    264.850 kHz   1059.400000 MHz (aspect 16:9, no 3D stereo)
               Hfront   48 Hsync  32 Hback   80 Hpol N
               Vfront    3 Vsync   5 Vback   37 Vpol N
    DTD:  3840x2160  144.107786 Hz  16:9    320.207 kHz   1280.830000 MHz (aspect 16:9, no 3D stereo)
               Hfront   48 Hsync  32 Hback   80 Hpol N
               Vfront    3 Vsync   5 Vback   54 Vpol N
  Video Timing Modes Type 1 - Detailed Timings Data Block:
    DTD:  3840x2160  150.000000 Hz  16:9    332.250 kHz   1329.000000 MHz (aspect 16:9, no 3D stereo)
               Hfront   48 Hsync  32 Hback   80 Hpol N
               Vfront    3 Vsync   5 Vback   47 Vpol N
  Checksum: 0x5f
Checksum: 0x90  Unused space in Extension Block: 15 bytes

----------------

Warnings:

Block 0, Base EDID:
  Vendor & Product Identification: The serial number is one of the known dummy values, it should probably be set to 0.
Block 1, CTA-861 Extension Block:
  Video Data Block: VIC 1 and the first DTD are not identical. Is this intended?
  Video Data Block: All VICs are in ascending order, and the first (preferred) VIC <= 4, is that intended?
  Colorimetry Data Block: Set the sRGB colorimetry bit to avoid interop issues.
  Detailed Timing Descriptor #2: DTD is similar but not identical to VIC 16.
  Display Product Serial Number is set, so the Serial Number in the Base EDID should be 0.
EDID:
  Base EDID: Some timings are out of range of the Monitor Ranges:
    Vertical Freq: 24.000 - 150.000 Hz (Monitor: 48.000 - 150.000 Hz)
    Horizontal Freq: 27.000 - 332.250 kHz (Monitor: 255.000 - 255.000 kHz)

Failures:

Block 1, CTA-861 Extension Block:
  Missing VCDB, needed for Set Selectable RGB Quantization to avoid interop issues.
Block 2, DisplayID Extension Block:
  DisplayID Base Block has no product type.
EDID:
  Extension Block 3 started with EDID header, ignoring Extension Blocks >= 3.
  CTA-861: Native progressive timings are a mix of several resolutions.
  DisplayID: DisplayID expects at least one preferred timing.

EDID conformity: FAIL
