edid-decode (hex):

00 ff ff ff ff ff ff 00 41 0c 58 d0 01 01 01 01
15 13 01 03 80 2f 1d 78 2a 78 f5 a6 55 48 9b 26
12 50 54 bd cf 00 81 40 81 80 95 00 b3 00 01 01
01 01 01 01 01 01 21 39 90 30 62 1a 27 40 68 b0
36 00 34 cd 31 00 00 1c 7c 2e 90 a0 60 1a 1e 40
30 20 36 00 34 cd 31 00 00 1a 00 00 00 fd 00 38
4c 1e 50 11 00 0a 20 20 20 20 20 20 00 00 00 fc
00 32 32 50 46 4c 33 34 30 33 44 45 55 0a 01 52

02 03 29 f1 4f 13 04 14 05 06 07 02 03 11 12 15
16 10 1f 01 23 09 07 07 83 01 00 00 6c 03 0c 00
10 00 00 00 c0 01 01 01 01 01 1d 00 bc 52 d0 1e
20 b8 28 55 40 34 cd 31 00 00 1e 01 1d 80 18 71
1c 16 20 58 2c 25 00 34 cd 31 00 00 9e 01 1d 00
72 51 d0 1e 20 6e 28 55 00 34 cd 31 00 00 1e 01
1d 80 d0 72 1c 16 20 10 2c 25 80 34 cd 31 00 00
9e 00 00 00 00 00 00 00 00 00 00 00 00 00 00 c7

00 ff ff ff ff ff ff 00 41 0c 58 d0 01 01 01 01
15 13 01 03 80 2f 1d 78 2a 78 f5 a6 55 48 9b 26
12 50 54 bd cf 00 81 40 81 80 95 00 b3 00 01 01
01 01 01 01 01 01 21 39 90 30 62 1a 27 40 68 b0
36 00 34 cd 31 00 00 1c 7c 2e 90 a0 60 1a 1e 40
30 20 36 00 34 cd 31 00 00 1a 00 00 00 fd 00 38
4c 1e 50 11 00 0a 20 20 20 20 20 20 00 00 00 fc
00 32 32 50 46 4c 33 34 30 33 44 45 55 0a 01 52

02 03 29 f1 4f 13 04 14 05 06 07 02 03 11 12 15
16 10 1f 01 23 09 07 07 83 01 00 00 6c 03 0c 00
10 00 00 00 c0 01 01 01 01 01 1d 00 bc 52 d0 1e
20 b8 28 55 40 34 cd 31 00 00 1e 01 1d 80 18 71
1c 16 20 58 2c 25 00 34 cd 31 00 00 9e 01 1d 00
72 51 d0 1e 20 6e 28 55 00 34 cd 31 00 00 1e 01
1d 80 d0 72 1c 16 20 10 2c 25 80 34 cd 31 00 00
9e 00 00 00 00 00 00 00 00 00 00 00 00 00 00 c7

----------------

Block 0, Base EDID:
  EDID Structure Version & Revision: 1.3
  Vendor & Product Identification:
    Manufacturer: PHL
    Model: 53336
    Serial Number: ...
    Made in: week 21 of 2009
  Basic Display Parameters & Features:
    Digital display
    Maximum image size: 47 cm x 29 cm
    Gamma: 2.20
    DPMS levels: Off
    RGB color display
    First detailed timing is the preferred timing
  Color Characteristics:
    Red  : 0.6494, 0.3349
    Green: 0.2832, 0.6054
    Blue : 0.1513, 0.0732
    White: 0.3134, 0.3291
  Established Timings I & II:
    IBM     :   720x400    70.081663 Hz   9:5     31.467 kHz     28.320000 MHz
    DMT 0x04:   640x480    59.940476 Hz   4:3     31.469 kHz     25.175000 MHz
    Apple   :   640x480    66.666667 Hz   4:3     35.000 kHz     30.240000 MHz
    DMT 0x05:   640x480    72.808802 Hz   4:3     37.861 kHz     31.500000 MHz
    DMT 0x06:   640x480    75.000000 Hz   4:3     37.500 kHz     31.500000 MHz
    DMT 0x09:   800x600    60.316541 Hz   4:3     37.879 kHz     40.000000 MHz
    DMT 0x0a:   800x600    72.187572 Hz   4:3     48.077 kHz     50.000000 MHz
    DMT 0x0b:   800x600    75.000000 Hz   4:3     46.875 kHz     49.500000 MHz
    DMT 0x10:  1024x768    60.003840 Hz   4:3     48.363 kHz     65.000000 MHz
    DMT 0x11:  1024x768    70.069359 Hz   4:3     56.476 kHz     75.000000 MHz
    DMT 0x12:  1024x768    75.028582 Hz   4:3     60.023 kHz     78.750000 MHz
    DMT 0x24:  1280x1024   75.024675 Hz   5:4     79.976 kHz    135.000000 MHz
  Standard Timings:
    DMT 0x20:  1280x960    60.000000 Hz   4:3     60.000 kHz    108.000000 MHz
    DMT 0x23:  1280x1024   60.019740 Hz   5:4     63.981 kHz    108.000000 MHz
    DMT 0x2f:  1440x900    59.887445 Hz  16:10    55.935 kHz    106.500000 MHz
    DMT 0x3a:  1680x1050   59.954250 Hz  16:10    65.290 kHz    146.250000 MHz
  Detailed Timing Descriptors:
    DTD 1:  1680x1050   59.954250 Hz  16:10    65.290 kHz    146.250000 MHz (820 mm x 461 mm)
                 Hfront  104 Hsync 176 Hback  280 Hpol N
                 Vfront    3 Vsync   6 Vback   30 Vpol P
    DTD 2:  1680x1050   59.883253 Hz  16:10    64.674 kHz    119.000000 MHz (820 mm x 461 mm)
                 Hfront   48 Hsync  32 Hback   80 Hpol P
                 Vfront    3 Vsync   6 Vback   21 Vpol N
    Display Range Limits:
      Monitor ranges (GTF): 56-76 Hz V, 30-80 kHz H, max dotclock 170 MHz
    Display Product Name: '22PFL3403DEU'
  Extension blocks: 1
Checksum: 0x52

----------------

Block 1, CTA-861 Extension Block:
  Revision: 3
  Underscans IT Video Formats by default
  Basic audio support
  Supports YCbCr 4:4:4
  Supports YCbCr 4:2:2
  Native DTDs: 1
  Video Data Block:
    VIC  19:  1280x720    50.000000 Hz  16:9     37.500 kHz     74.250000 MHz
    VIC   4:  1280x720    60.000000 Hz  16:9     45.000 kHz     74.250000 MHz
    VIC  20:  1920x1080i  50.000000 Hz  16:9     28.125 kHz     74.250000 MHz
    VIC   5:  1920x1080i  60.000000 Hz  16:9     33.750 kHz     74.250000 MHz
    VIC   6:  1440x480i   59.940060 Hz   4:3     15.734 kHz     27.000000 MHz
    VIC   7:  1440x480i   59.940060 Hz  16:9     15.734 kHz     27.000000 MHz
    VIC   2:   720x480    59.940060 Hz   4:3     31.469 kHz     27.000000 MHz
    VIC   3:   720x480    59.940060 Hz  16:9     31.469 kHz     27.000000 MHz
    VIC  17:   720x576    50.000000 Hz   4:3     31.250 kHz     27.000000 MHz
    VIC  18:   720x576    50.000000 Hz  16:9     31.250 kHz     27.000000 MHz
    VIC  21:  1440x576i   50.000000 Hz   4:3     15.625 kHz     27.000000 MHz
    VIC  22:  1440x576i   50.000000 Hz  16:9     15.625 kHz     27.000000 MHz
    VIC  16:  1920x1080   60.000000 Hz  16:9     67.500 kHz    148.500000 MHz
    VIC  31:  1920x1080   50.000000 Hz  16:9     56.250 kHz    148.500000 MHz
    VIC   1:   640x480    59.940476 Hz   4:3     31.469 kHz     25.175000 MHz
  Audio Data Block:
    Linear PCM:
      Max channels: 2
      Supported sample rates (kHz): 48 44.1 32
      Supported sample sizes (bits): 24 20 16
  Speaker Allocation Data Block:
    FL/FR - Front Left/Right
  Vendor-Specific Data Block (HDMI), OUI 00-0C-03:
    Source physical address: 1.0.0.0
    Maximum TMDS clock: 0 MHz
    Video latency: 0 ms
    Audio latency: 0 ms
    Interlaced video latency: 0 ms
    Interlaced audio latency: 0 ms
  Detailed Timing Descriptors:
    DTD 3:  1280x720    50.000000 Hz  16:9     37.500 kHz     74.250000 MHz (820 mm x 461 mm)
                 Hfront  440 Hsync  40 Hback  220 Hpol P
                 Vfront    5 Vsync   5 Vback   20 Vpol P
    DTD 4:  1920x1080i  60.000000 Hz  16:9     33.750 kHz     74.250000 MHz (820 mm x 461 mm)
                 Hfront   88 Hsync  44 Hback  148 Hpol P
                 Vfront    2 Vsync   5 Vback   15 Vpol P Vfront +0.5 Odd Field
                 Vfront    2 Vsync   5 Vback   15 Vpol P Vback  +0.5 Even Field
    DTD 5:  1280x720    60.000000 Hz  16:9     45.000 kHz     74.250000 MHz (820 mm x 461 mm)
                 Hfront  110 Hsync  40 Hback  220 Hpol P
                 Vfront    5 Vsync   5 Vback   20 Vpol P
    DTD 6:  1920x1080i  50.000000 Hz  16:9     28.125 kHz     74.250000 MHz (820 mm x 461 mm)
                 Hfront  528 Hsync  44 Hback  148 Hpol P
                 Vfront    2 Vsync   5 Vback   15 Vpol P Vfront +0.5 Odd Field
                 Vfront    2 Vsync   5 Vback   15 Vpol P Vback  +0.5 Even Field
Checksum: 0xc7  Unused space in Extension Block: 14 bytes

----------------

Warnings:

Block 0, Base EDID:
  Vendor & Product Identification: The serial number is one of the known dummy values, it should probably be set to 0.
  Detailed Timing Descriptor #1: Image size is 820x461 mm, but based on the picture AR it should be 737x461 mm.
  Detailed Timing Descriptor #2: Image size is 820x461 mm, but based on the picture AR it should be 737x461 mm.
Block 1, CTA-861 Extension Block:
  Video Data Block: VIC 19 and the first DTD are not identical. Is this intended?
  Vendor-Specific Data Block (HDMI), OUI 00-0C-03: Progressive and Interlaced latency values are identical, no need for both.
  Add a Colorimetry Data Block with the sRGB colorimetry bit set to avoid interop issues.
EDID:
  Base EDID: Some timings are out of range of the Monitor Ranges:
    Vertical Freq: 50.000 - 75.029 Hz (Monitor: 56.000 - 76.000 Hz)
    Horizontal Freq: 15.625 - 79.976 kHz (Monitor: 30.000 - 80.000 kHz)

Failures:

Block 0, Base EDID:
  Detailed Timing Descriptor #1: Mismatch of image size 820x461 mm vs display size 470x290 mm.
  Detailed Timing Descriptor #2: Mismatch of image size 820x461 mm vs display size 470x290 mm.
Block 1, CTA-861 Extension Block:
  Detailed Timing Descriptor #3: Mismatch of image size 820x461 mm vs display size 470x290 mm.
  Detailed Timing Descriptor #4: Mismatch of image size 820x461 mm vs display size 470x290 mm.
  Detailed Timing Descriptor #5: Mismatch of image size 820x461 mm vs display size 470x290 mm.
  Detailed Timing Descriptor #6: Mismatch of image size 820x461 mm vs display size 470x290 mm.
  Missing VCDB, needed for Set Selectable RGB Quantization to avoid interop issues.
EDID:
  Extension Block 2 started with EDID header, ignoring Extension Blocks >= 2.
  Base EDID: The DTD max image size is 820x461mm, which is larger than the display size 470.0x290.0mm.

EDID conformity: FAIL
