edid-decode (hex):

00 ff ff ff ff ff ff 00 09 e5 09 0d 00 00 00 00
1c 22 01 04 b5 1e 13 78 03 0b 9f af 51 3f b8 23
0b 4f 53 00 00 00 01 01 01 01 01 01 01 01 01 01
01 01 01 01 01 01 00 00 00 00 00 00 00 00 00 00
00 00 00 00 00 00 00 00 00 00 00 fd 0c 1e 78 e6
e6 46 01 0a 20 20 20 20 20 20 00 00 00 fe 00 42
4f 45 20 43 51 0a 20 20 20 20 20 20 00 00 00 fc
00 4e 42 31 34 30 42 39 4d 2d 41 36 33 0a 02 43

02 03 0f 00 e3 05 80 00 e6 06 05 01 73 6a 02 00
00 00 00 00 00 00 00 00 00 00 00 00 00 00 00 00
00 00 00 00 00 00 00 00 00 00 00 00 00 00 00 00
00 00 00 00 00 00 00 00 00 00 00 00 00 00 00 00
00 00 00 00 00 00 00 00 00 00 00 00 00 00 00 00
00 00 00 00 00 00 00 00 00 00 00 00 00 00 00 00
00 00 00 00 00 00 00 00 00 00 00 00 00 00 00 00
00 00 00 00 00 00 00 00 00 00 00 00 00 00 00 b3

70 20 79 02 00 22 00 28 ff af 0a 85 3f 0b 9f 00
2f 00 1f 00 07 07 77 00 69 00 07 00 ff af 0a 05
3f 0b 9f 00 2f 00 1f 00 07 07 f7 07 69 00 07 00
25 01 09 ff af 0a ff af 0a 1e 78 80 2b 60 0c 05
85 1e 77 00 21 00 00 00 00 00 00 00 00 00 00 00
00 00 00 00 00 00 00 00 00 00 00 00 00 00 00 00
00 00 00 00 00 00 00 00 00 00 00 00 00 00 00 00
00 00 00 00 00 00 00 00 00 00 00 00 00 00 b6 90

00 ff ff ff ff ff ff 00 09 e5 09 0d 00 00 00 00
1c 22 01 04 b5 1e 13 78 03 0b 9f af 51 3f b8 23
0b 4f 53 00 00 00 01 01 01 01 01 01 01 01 01 01
01 01 01 01 01 01 00 00 00 00 00 00 00 00 00 00
00 00 00 00 00 00 00 00 00 00 00 fd 0c 1e 78 e6
e6 46 01 0a 20 20 20 20 20 20 00 00 00 fe 00 42
4f 45 20 43 51 0a 20 20 20 20 20 20 00 00 00 fc
00 4e 42 31 34 30 42 39 4d 2d 41 36 33 0a 02 43

02 03 0f 00 e3 05 80 00 e6 06 05 01 73 6a 02 00
00 00 00 00 00 00 00 00 00 00 00 00 00 00 00 00
00 00 00 00 00 00 00 00 00 00 00 00 00 00 00 00
00 00 00 00 00 00 00 00 00 00 00 00 00 00 00 00
00 00 00 00 00 00 00 00 00 00 00 00 00 00 00 00
00 00 00 00 00 00 00 00 00 00 00 00 00 00 00 00
00 00 00 00 00 00 00 00 00 00 00 00 00 00 00 00
00 00 00 00 00 00 00 00 00 00 00 00 00 00 00 b3

70 20 79 02 00 22 00 28 ff af 0a 85 3f 0b 9f 00
2f 00 1f 00 07 07 77 00 69 00 07 00 ff af 0a 05
3f 0b 9f 00 2f 00 1f 00 07 07 f7 07 69 00 07 00
25 01 09 ff af 0a ff af 0a 1e 78 80 2b 60 0c 05
85 1e 77 00 21 00 00 00 00 00 00 00 00 00 00 00
00 00 00 00 00 00 00 00 00 00 00 00 00 00 00 00
00 00 00 00 00 00 00 00 00 00 00 00 00 00 00 00
00 00 00 00 00 00 00 00 00 00 00 00 00 00 b6 90

----------------

Block 0, Base EDID:
  EDID Structure Version & Revision: 1.4
  Vendor & Product Identification:
    Manufacturer: BOE
    Model: 3337
    Made in: week 28 of 2024
  Basic Display Parameters & Features:
    Digital display
    Bits per primary color channel: 10
    DisplayPort interface
    Maximum image size: 30 cm x 19 cm
    Gamma: 2.20
    Supported color formats: RGB 4:4:4
    First detailed timing includes the native pixel format and preferred refresh rate
    Display supports continuous frequencies
  Color Characteristics:
    Red  : 0.6835, 0.3164
    Green: 0.2480, 0.7216
    Blue : 0.1386, 0.0439
    White: 0.3115, 0.3271
  Established Timings I & II: none
  Standard Timings: none
  Detailed Timing Descriptors:
    Empty Descriptor
    Display Range Limits:
      Monitor ranges (Range Limits Only): 30-120 Hz V, 485-485 kHz H, max dotclock 700 MHz
    Alphanumeric Data String: 'BOE CQ'
    Display Product Name: 'NB140B9M-A63'
  Extension blocks: 2
Checksum: 0x43

----------------

Block 1, CTA-861 Extension Block:
  Revision: 3
  Native DTDs: 0
  Colorimetry Data Block:
    BT2020RGB
  HDR Static Metadata Data Block:
    Electro optical transfer functions:
      Traditional gamma - SDR luminance range
      SMPTE ST2084
    Supported static metadata descriptors:
      Static metadata type 1
    Desired content max luminance: 115 (603.666 cd/m^2)
    Desired content max frame-average luminance: 106 (496.743 cd/m^2)
    Desired content min luminance: 2 (0.000 cd/m^2)
Checksum: 0xb3  Unused space in Extension Block: 112 bytes

----------------

Block 2, DisplayID Extension Block:
  Version: 2.0
  Extension Count: 0
  Display Product Primary Use Case: None of the listed primary use cases; generic display
  Video Timing Modes Type 7 - Detailed Timings Data Block:
    DTD:  2880x1800  120.000000 Hz  16:10   230.400 kHz    700.416000 MHz (aspect 16:10, no 3D stereo, preferred)
               Hfront   48 Hsync  32 Hback   80 Hpol N
               Vfront  106 Vsync   8 Vback    6 Vpol N
    DTD:  2880x1800   60.000000 Hz  16:10   230.400 kHz    700.416000 MHz (aspect 16:10, no 3D stereo)
               Hfront   48 Hsync  32 Hback   80 Hpol N
               Vfront  106 Vsync   8 Vback 1926 Vpol N
  Dynamic Video Timing Range Limits Data Block:
    Minimum Pixel Clock: 700416 kHz
    Maximum Pixel Clock: 700416 kHz
    Minimum Vertical Refresh Rate: 30 Hz
    Maximum Vertical Refresh Rate: 120 Hz
    Seamless Dynamic Video Timing Support: Yes
  Adaptive Sync Data Block:
    Descriptor #1:
      Native Panel Range
      Fixed Average V-Total and Adaptive V-Total
      Supports Seamless Transition
      Max Duration Increase: 33.25 ms
      Max Duration Decrease: 8.25 ms
      Min Refresh Rate: 30 Hz
      Max Refresh Rate: 120 Hz
  Checksum: 0xb6
Checksum: 0x90

----------------

Warnings:

Block 1, CTA-861 Extension Block:
  IT Video Formats are overscanned by default, but normally this should be underscanned.
  Colorimetry Data Block: Set the sRGB colorimetry bit to avoid interop issues.
EDID:
  No Native Video Resolution was defined.
    Hint: set 'Native DTDs' to a non-0 value, or add a Native Video Resolution Data Block.
  Base EDID: Some timings are out of range of the Monitor Ranges:
    Horizontal Freq: 230.400 - 230.400 kHz (Monitor: 485.000 - 485.000 kHz)
    Maximum Clock: 700.416 MHz (Monitor: 700.000 MHz)

Failures:

Block 0, Base EDID:
  Standard Timings: Missing preferred timing.
  Empty Descriptor: Use Dummy Descriptor instead of all zeroes.
Block 1, CTA-861 Extension Block:
  Required 640x480p60 timings are missing in the established timings and the SVD list (VIC 1).
  Missing VCDB, needed for Set Selectable RGB Quantization to avoid interop issues.
EDID:
  Extension Block 3 started with EDID header, ignoring Extension Blocks >= 3.
  DisplayID: Missing DisplayID Display Parameters Data Block.

EDID conformity: FAIL
