edid-decode (hex):

00 ff ff ff ff ff ff 00 06 af ac ca 00 00 00 00
14 21 01 04 a5 22 16 78 03 73 51 9b 59 56 90 26
22 52 55 00 00 00 01 01 01 01 01 01 01 01 01 01
01 01 01 01 01 01 fa 3c 80 b8 70 b0 24 40 10 10
3e 00 58 d7 10 00 00 18 00 00 00 0f 00 00 00 00
00 00 00 00 00 00 00 00 00 20 00 00 00 fd 00 28
3c 4b 4b 10 01 0a 20 20 20 20 20 20 00 00 00 fe
00 42 31 36 30 55 41 4b 30 31 2e 34 20 0a 00 5f

00 ff ff ff ff ff ff 00 06 af ac ca 00 00 00 00
14 21 01 04 a5 22 16 78 03 73 51 9b 59 56 90 26
22 52 55 00 00 00 01 01 01 01 01 01 01 01 01 01
01 01 01 01 01 01 fa 3c 80 b8 70 b0 24 40 10 10
3e 00 58 d7 10 00 00 18 00 00 00 0f 00 00 00 00
00 00 00 00 00 00 00 00 00 20 00 00 00 fd 00 28
3c 4b 4b 10 01 0a 20 20 20 20 20 20 00 00 00 fe
00 42 31 36 30 55 41 4b 30 31 2e 34 20 0a 00 5f

----------------

Block 0, Base EDID:
  EDID Structure Version & Revision: 1.4
  Vendor & Product Identification:
    Manufacturer: AUO
    Model: 51884
    Made in: week 20 of 2023
  Basic Display Parameters & Features:
    Digital display
    Bits per primary color channel: 8
    DisplayPort interface
    Maximum image size: 34 cm x 22 cm
    Gamma: 2.20
    Supported color formats: RGB 4:4:4
    First detailed timing includes the native pixel format and preferred refresh rate
    Display supports continuous frequencies
  Color Characteristics:
    Red  : 0.6064, 0.3505
    Green: 0.3359, 0.5654
    Blue : 0.1494, 0.1337
    White: 0.3203, 0.3330
  Established Timings I & II: none
  Standard Timings: none
  Detailed Timing Descriptors:
    DTD 1:  1920x1200   60.025902 Hz  16:10    74.192 kHz    156.100000 MHz (344 mm x 215 mm)
                 Hfront   16 Hsync  16 Hback  152 Hpol N
                 Vfront    3 Vsync  14 Vback   19 Vpol N
    Manufacturer-Specified Display Descriptor (0x0f): 00 0f 00 00 00 00 00 00 00 00 00 00 00 00 00 20 '............... '
    Display Range Limits:
      Monitor ranges (Range Limits Only): 40-60 Hz V, 75-75 kHz H, max dotclock 160 MHz
    Alphanumeric Data String: 'B160UAK01.4 '
Checksum: 0x5f

----------------

Block 1, Unknown EDID Extension Block 0x00:
  00 ff ff ff ff ff ff 00 06 af ac ca 00 00 00 00 '................'
  14 21 01 04 a5 22 16 78 03 73 51 9b 59 56 90 26 '.!...".x.sQ.YV.&'
  22 52 55 00 00 00 01 01 01 01 01 01 01 01 01 01 '"RU.............'
  01 01 01 01 01 01 fa 3c 80 b8 70 b0 24 40 10 10 '.......<..p.$@..'
  3e 00 58 d7 10 00 00 18 00 00 00 0f 00 00 00 00 '>.X.............'
  00 00 00 00 00 00 00 00 00 20 00 00 00 fd 00 28 '......... .....('
  3c 4b 4b 10 01 0a 20 20 20 20 20 20 00 00 00 fe '<KK...      ....'
  00 42 31 36 30 55 41 4b 30 31 2e 34 20 0a 00 5f '.B160UAK01.4 .._'
Checksum: 0x5f

----------------

Warnings:

Block 0, Base EDID:
  Missing Display Product Name.
EDID:
  Base EDID: Some timings are out of range of the Monitor Ranges:
    Horizontal Freq: 74.192 - 74.192 kHz (Monitor: 75.000 - 75.000 kHz)
    Could be due to a Monitor Range off-by-one rounding issue

Failures:

Block 0, Base EDID:
  Alphanumeric Data String: One or more trailing spaces before newline.
Block 1, Base EDID:
  Unknown Extension Block.
EDID:
  Base EDID: EDID specified 0 extension block(s), but found 1 extension block(s).

EDID conformity: FAIL
