edid-decode (hex):

00 ff ff ff ff ff ff 00 06 af ec 44 00 00 00 00
29 17 01 04 95 22 13 78 02 bb f5 94 55 54 90 27
23 50 54 00 00 00 01 01 01 01 01 01 01 01 01 01
01 01 01 01 01 01 9e 1b 56 7c 50 00 16 30 08 0a
31 00 58 c1 10 00 00 18 00 00 00 0f 00 00 00 00
00 00 00 00 00 00 00 00 00 20 00 00 00 fe 00 41
55 4f 0a 20 20 20 20 20 20 20 20 20 00 00 00 fe
00 42 31 35 36 58 54 4e 30 34 2e 34 20 0a 00 76

----------------

Block 0, Base EDID:
  EDID Structure Version & Revision: 1.4
  Vendor & Product Identification:
    Manufacturer: AUO
    Model: 17644
    Made in: week 41 of 2013
  Basic Display Parameters & Features:
    Digital display
    Bits per primary color channel: 6
    DisplayPort interface
    Maximum image size: 34 cm x 19 cm
    Gamma: 2.20
    Supported color formats: RGB 4:4:4
    First detailed timing includes the native pixel format and preferred refresh rate
  Color Characteristics:
    Red  : 0.5800, 0.3349
    Green: 0.3300, 0.5654
    Blue : 0.1552, 0.1396
    White: 0.3134, 0.3291
  Established Timings I & II: none
  Standard Timings: none
  Detailed Timing Descriptors:
    DTD 1:  1366x768    60.062866 Hz 683:384   47.450 kHz     70.700000 MHz (344 mm x 193 mm)
                 Hfront    8 Hsync  10 Hback  106 Hpol N
                 Vfront    3 Vsync   1 Vback   18 Vpol N
    Manufacturer-Specified Display Descriptor (0x0f): 00 0f 00 00 00 00 00 00 00 00 00 00 00 00 00 20 '............... '
    Alphanumeric Data String: 'AUO'
    Alphanumeric Data String: 'B156XTN04.4 '
Checksum: 0x76

----------------

Warnings:

Block 0, Base EDID:
  Missing Display Product Name.

Failures:

Block 0, Base EDID:
  Alphanumeric Data String: One or more trailing spaces before newline.

EDID conformity: FAIL
