edid-decode (hex):

00 ff ff ff ff ff ff 00 30 ae e9 40 00 00 00 00
00 16 01 04 95 1c 10 78 e2 86 75 97 52 4b 89 24
2a 50 54 00 00 00 01 01 01 01 01 01 01 01 01 01
01 01 01 01 01 01 c4 1d 56 e0 50 00 1e 30 26 16
36 00 15 9c 10 00 00 18 c4 1d 56 6e 52 00 1e 30
26 16 36 00 15 9c 10 00 00 18 00 00 00 0f 00 8c
09 30 8c 09 30 16 09 00 06 af 6c 10 00 00 00 fe
00 42 31 32 35 58 54 4e 30 31 2e 30 20 0a 00 db

00 ff ff ff ff ff ff 00 30 ae e9 40 00 00 00 00
00 16 01 04 95 1c 10 78 e2 86 75 97 52 4b 89 24
2a 50 54 00 00 00 01 01 01 01 01 01 01 01 01 01
01 01 01 01 01 01 c4 1d 56 e0 50 00 1e 30 26 16
36 00 15 9c 10 00 00 18 c4 1d 56 6e 52 00 1e 30
26 16 36 00 15 9c 10 00 00 18 00 00 00 0f 00 8c
09 30 8c 09 30 16 09 00 06 af 6c 10 00 00 00 fe
00 42 31 32 35 58 54 4e 30 31 2e 30 20 0a 00 db

----------------

Block 0, Base EDID:
  EDID Structure Version & Revision: 1.4
  Vendor & Product Identification:
    Manufacturer: LEN
    Model: 16617
    Made in: 2012
  Basic Display Parameters & Features:
    Digital display
    Bits per primary color channel: 6
    DisplayPort interface
    Maximum image size: 28 cm x 16 cm
    Gamma: 2.20
    DPMS levels: Standby Suspend Off
    Supported color formats: RGB 4:4:4
    First detailed timing includes the native pixel format and preferred refresh rate
  Color Characteristics:
    Red  : 0.5917, 0.3203
    Green: 0.2939, 0.5371
    Blue : 0.1416, 0.1669
    White: 0.3134, 0.3291
  Established Timings I & II: none
  Standard Timings: none
  Detailed Timing Descriptors:
    DTD 1:  1366x768    60.055800 Hz 683:384   47.925 kHz     76.200000 MHz (277 mm x 156 mm)
                 Hfront   38 Hsync  22 Hback  164 Hpol N
                 Vfront    3 Vsync   6 Vback   21 Vpol N
    DTD 2:  1366x768    48.032556 Hz 683:384   38.330 kHz     76.200000 MHz (277 mm x 156 mm)
                 Hfront   38 Hsync  22 Hback  562 Hpol N
                 Vfront    3 Vsync   6 Vback   21 Vpol N
    Manufacturer-Specified Display Descriptor (0x0f): 00 0f 00 8c 09 30 8c 09 30 16 09 00 06 af 6c 10 '.....0..0.....l.'
    Alphanumeric Data String: 'B125XTN01.0 '
Checksum: 0xdb

----------------

Warnings:

Block 0, Base EDID:
  Missing Display Product Name.

Failures:

Block 0, Base EDID:
  Alphanumeric Data String: One or more trailing spaces before newline.
EDID:
  Extension Block 1 started with EDID header, ignoring Extension Blocks >= 1.

EDID conformity: FAIL
