edid-decode (hex):

00 ff ff ff ff ff ff 00 4d 10 82 14 00 00 00 00
10 1b 01 04 a5 1a 11 78 0e de 50 a3 54 4c 99 26
0f 50 54 00 00 00 01 01 01 01 01 01 01 01 01 01
01 01 01 01 01 01 e7 8b 40 a0 b0 80 2c 70 30 20
3a 00 03 ad 10 00 00 18 e7 8b 40 a0 b0 80 17 72
30 20 3a 00 03 ad 10 00 00 18 00 00 00 fe 00 48
57 38 59 4e 80 4c 51 31 32 33 5a 31 00 00 00 00
00 02 41 03 28 01 12 00 00 0b 01 0a 20 20 00 1c

----------------

Block 0, Base EDID:
  EDID Structure Version & Revision: 1.4
  Vendor & Product Identification:
    Manufacturer: SHP
    Model: 5250
    Made in: week 16 of 2017
  Basic Display Parameters & Features:
    Digital display
    Bits per primary color channel: 8
    DisplayPort interface
    Maximum image size: 26 cm x 17 cm
    Gamma: 2.20
    Supported color formats: RGB 4:4:4, YCrCb 4:4:4
    Default (sRGB) color space is primary color space
    First detailed timing includes the native pixel format and preferred refresh rate
  Color Characteristics:
    Red  : 0.6396, 0.3291
    Green: 0.2998, 0.5996
    Blue : 0.1494, 0.0595
    White: 0.3125, 0.3281
  Established Timings I & II: none
  Standard Timings: none
  Detailed Timing Descriptors:
    DTD 1:  2880x1920   59.985998 Hz   3:2    117.812 kHz    358.150000 MHz (259 mm x 173 mm)
                 Hfront   48 Hsync  32 Hback   80 Hpol N
                 Vfront    3 Vsync  10 Vback   31 Vpol N
    DTD 2:  2880x1920   47.988798 Hz   3:2    117.812 kHz    358.150000 MHz (259 mm x 173 mm)
                 Hfront   48 Hsync  32 Hback   80 Hpol N
                 Vfront    3 Vsync  10 Vback  522 Vpol N
    Alphanumeric Data String: 'HW8YN.LQ123Z1'
    Manufacturer-Specified Display Descriptor (0x00): 00 00 00 02 41 03 28 01 12 00 00 0b 01 0a 20 20 '....A.(.......  '
Checksum: 0x1c

----------------

Warnings:

Block 0, Base EDID:
  Alphanumeric Data String: Non-ASCII character 0x80 at position 5, can cause problems.
  Missing Display Product Name.

Failures:

Block 0, Base EDID:
  Basic Display Parameters & Features: sRGB is signaled, but the chromaticities do not match.

EDID conformity: FAIL
