edid-decode (hex):

00 ff ff ff ff ff ff 00 06 af a6 a3 00 00 00 00
08 20 01 04 b5 22 16 78 03 34 c5 ad 51 46 b1 24
0d 50 54 00 00 00 01 01 01 01 01 01 01 01 01 01
01 01 01 01 01 01 1e 6f 00 a0 a0 40 8f 60 30 20
aa 00 58 d7 10 00 00 18 00 00 00 0f 00 00 00 00
00 00 00 00 00 00 00 00 00 20 00 00 00 00 00 00
00 00 00 00 00 00 00 00 00 00 00 00 00 00 00 03
00 0f 1e ff 23 3c 2c 37 2c ff 2c 01 01 20 02 b8

02 03 0f 00 e3 05 80 00 e6 06 05 01 92 92 10 00
00 00 00 00 00 00 00 00 00 00 00 00 00 00 00 00
00 00 00 00 00 00 00 00 00 00 00 00 00 00 00 00
00 00 00 00 00 00 00 00 00 00 00 00 00 00 00 00
00 00 00 00 00 00 00 00 00 00 00 00 00 00 00 00
00 00 00 00 00 00 00 00 00 00 00 00 00 00 00 00
00 00 00 00 00 00 00 00 00 00 00 00 00 00 00 00
00 00 00 00 00 00 00 00 00 00 00 00 00 00 00 5e

70 20 79 02 00 22 00 14 af 5c 11 84 ff 09 9f 00
2f 80 1f 00 3f 06 8e 00 09 00 09 00 25 01 09 af
5c 11 af 5c 11 3c f0 80 81 00 1b e3 05 80 00 e6
06 07 01 92 92 10 72 1a 00 00 03 01 3c f0 00 24
92 10 92 10 f0 00 00 00 00 00 00 00 00 00 00 00
00 00 00 00 00 00 00 00 00 00 00 00 00 00 00 00
00 00 00 00 00 00 00 00 00 00 00 00 00 00 00 00
00 00 00 00 00 00 00 00 00 00 00 00 00 00 e2 90

00 ff ff ff ff ff ff 00 06 af a6 a3 00 00 00 00
08 20 01 04 b5 22 16 78 03 34 c5 ad 51 46 b1 24
0d 50 54 00 00 00 01 01 01 01 01 01 01 01 01 01
01 01 01 01 01 01 1e 6f 00 a0 a0 40 8f 60 30 20
aa 00 58 d7 10 00 00 18 00 00 00 0f 00 00 00 00
00 00 00 00 00 00 00 00 00 20 00 00 00 00 00 00
00 00 00 00 00 00 00 00 00 00 00 00 00 00 00 03
00 0f 1e ff 23 3c 2c 37 2c ff 2c 01 01 20 02 b8

02 03 0f 00 e3 05 80 00 e6 06 05 01 92 92 10 00
00 00 00 00 00 00 00 00 00 00 00 00 00 00 00 00
00 00 00 00 00 00 00 00 00 00 00 00 00 00 00 00
00 00 00 00 00 00 00 00 00 00 00 00 00 00 00 00
00 00 00 00 00 00 00 00 00 00 00 00 00 00 00 00
00 00 00 00 00 00 00 00 00 00 00 00 00 00 00 00
00 00 00 00 00 00 00 00 00 00 00 00 00 00 00 00
00 00 00 00 00 00 00 00 00 00 00 00 00 00 00 5e

70 20 79 02 00 22 00 14 af 5c 11 84 ff 09 9f 00
2f 80 1f 00 3f 06 8e 00 09 00 09 00 25 01 09 af
5c 11 af 5c 11 3c f0 80 81 00 1b e3 05 80 00 e6
06 07 01 92 92 10 72 1a 00 00 03 01 3c f0 00 24
92 10 92 10 f0 00 00 00 00 00 00 00 00 00 00 00
00 00 00 00 00 00 00 00 00 00 00 00 00 00 00 00
00 00 00 00 00 00 00 00 00 00 00 00 00 00 00 00
00 00 00 00 00 00 00 00 00 00 00 00 00 00 e2 90

----------------

Block 0, Base EDID:
  EDID Structure Version & Revision: 1.4
  Vendor & Product Identification:
    Manufacturer: AUO
    Model: 41894
    Made in: week 8 of 2022
  Basic Display Parameters & Features:
    Digital display
    Bits per primary color channel: 10
    DisplayPort interface
    Maximum image size: 34 cm x 22 cm
    Gamma: 2.20
    Supported color formats: RGB 4:4:4
    First detailed timing includes the native pixel format and preferred refresh rate
    Display supports continuous frequencies
  Color Characteristics:
    Red  : 0.6757, 0.3193
    Green: 0.2744, 0.6914
    Blue : 0.1435, 0.0507
    White: 0.3134, 0.3291
  Established Timings I & II: none
  Standard Timings: none
  Detailed Timing Descriptors:
    DTD 1:  2560x1600   60.000506 Hz  16:10   104.581 kHz    284.460000 MHz (344 mm x 215 mm)
                 Hfront   48 Hsync  32 Hback   80 Hpol N
                 Vfront   10 Vsync  10 Vback  123 Vpol N
    Manufacturer-Specified Display Descriptor (0x0f): 00 0f 00 00 00 00 00 00 00 00 00 00 00 00 00 20 '............... '
    Empty Descriptor
    Manufacturer-Specified Display Descriptor (0x03): 00 03 00 0f 1e ff 23 3c 2c 37 2c ff 2c 01 01 20 '......#<,7,.,.. '
  Extension blocks: 2
Checksum: 0xb8

----------------

Block 1, CTA-861 Extension Block:
  Revision: 3
  Native DTDs: 0
  Colorimetry Data Block:
    BT2020RGB
  HDR Static Metadata Data Block:
    Electro optical transfer functions:
      Traditional gamma - SDR luminance range
      SMPTE ST2084
    Supported static metadata descriptors:
      Static metadata type 1
    Desired content max luminance: 146 (1181.461 cd/m^2)
    Desired content max frame-average luminance: 146 (1181.461 cd/m^2)
    Desired content min luminance: 16 (0.047 cd/m^2)
Checksum: 0x5e  Unused space in Extension Block: 112 bytes

----------------

Block 2, DisplayID Extension Block:
  Version: 2.0
  Extension Count: 0
  Display Product Primary Use Case: None of the listed primary use cases; generic display
  Video Timing Modes Type 7 - Detailed Timings Data Block:
    DTD:  2560x1600  240.002025 Hz  16:9    418.324 kHz   1137.840000 MHz (aspect 16:9, no 3D stereo, preferred)
               Hfront   48 Hsync  32 Hback   80 Hpol P
               Vfront   10 Vsync  10 Vback  123 Vpol N
  Dynamic Video Timing Range Limits Data Block:
    Minimum Pixel Clock: 1137840 kHz
    Maximum Pixel Clock: 1137840 kHz
    Minimum Vertical Refresh Rate: 60 Hz
    Maximum Vertical Refresh Rate: 240 Hz
    Seamless Dynamic Video Timing Support: Yes
  CTA-861 DisplayID Data Block:
  Colorimetry Data Block:
    BT2020RGB
  HDR Static Metadata Data Block:
    Electro optical transfer functions:
      Traditional gamma - SDR luminance range
      Traditional gamma - HDR luminance range
      SMPTE ST2084
    Supported static metadata descriptors:
      Static metadata type 1
    Desired content max luminance: 146 (1181.461 cd/m^2)
    Desired content max frame-average luminance: 146 (1181.461 cd/m^2)
    Desired content min luminance: 16 (0.047 cd/m^2)
  Vendor-Specific Data Block (AMD), OUI 00-00-1A:
    Version: 3
    Flags 1: 0x01
      FreeSync Supported
    Minimum Refresh Rate: 60 Hz
    Maximum Refresh Rate: 240 Hz
    Flags 5: 0x24
  Checksum: 0xe2
Checksum: 0x90

----------------

Warnings:

Block 0, Base EDID:
  Missing Display Product Name.
Block 1, CTA-861 Extension Block:
  IT Video Formats are overscanned by default, but normally this should be underscanned.
  Colorimetry Data Block: Set the sRGB colorimetry bit to avoid interop issues.
Block 2, DisplayID Extension Block:
  Colorimetry Data Block: Set the sRGB colorimetry bit to avoid interop issues.

Failures:

Block 0, Base EDID:
  Empty Descriptor: Use Dummy Descriptor instead of all zeroes.
  Missing Display Range Limits Descriptor.
Block 1, CTA-861 Extension Block:
  Required 640x480p60 timings are missing in the established timings and the SVD list (VIC 1).
  Missing VCDB, needed for Set Selectable RGB Quantization to avoid interop issues.
Block 2, DisplayID Extension Block:
  Vendor-Specific Data Block (AMD), OUI 00-00-1A: Length is 27 instead of 30.
EDID:
  Extension Block 3 started with EDID header, ignoring Extension Blocks >= 3.
  DisplayID: Missing DisplayID Display Parameters Data Block.

EDID conformity: FAIL
