edid-decode (hex):

00 ff ff ff ff ff ff 00 59 3a 11 10 01 01 01 01
00 19 01 03 80 6e 3e 78 2a fe 3d a4 54 4f 9f 25
0c 47 4a 20 00 00 d1 c0 d1 fc 01 01 01 01 01 01
01 01 01 01 01 01 04 74 00 30 f2 70 5a 80 b0 58
8a 00 ad 11 32 00 00 1e 02 3a 80 18 71 38 2d 40
58 2c 45 00 ad 11 32 00 00 1e 00 00 00 fc 00 44
35 30 75 2d 44 31 0a 20 20 20 20 20 00 00 00 fd
00 19 4c 0f 8c 1e 00 0a 20 20 20 20 20 20 01 65

02 03 38 71 4a 02 03 05 90 04 20 3f 5d 5f 64 32
57 06 00 00 00 00 00 00 00 00 00 00 09 07 07 15
07 50 83 01 00 00 6d 03 0c 00 50 00 38 3c 20 00
60 01 03 04 e3 0e 61 66 02 3a 80 18 71 38 2d 40
58 2c 45 00 ad 11 32 00 00 1e 01 1d 00 72 51 d0
1e 20 6e 28 55 00 ad 11 32 00 00 1e 00 00 00 00
00 00 00 00 00 00 00 00 00 00 00 00 00 00 00 00
00 00 00 00 00 00 00 00 00 00 00 00 00 00 00 2c

----------------

Block 0, Base EDID:
  EDID Structure Version & Revision: 1.3
  Vendor & Product Identification:
    Manufacturer: VIZ
    Model: 4113
    Serial Number: ...
    Made in: 2015
  Basic Display Parameters & Features:
    Digital display
    Maximum image size: 110 cm x 62 cm
    Gamma: 2.20
    DPMS levels: Off
    RGB color display
    First detailed timing is the preferred timing
  Color Characteristics:
    Red  : 0.6435, 0.3310
    Green: 0.3115, 0.6230
    Blue : 0.1445, 0.0498
    White: 0.2802, 0.2900
  Established Timings I & II:
    DMT 0x04:   640x480    59.940476 Hz   4:3     31.469 kHz     25.175000 MHz
  Standard Timings:
    DMT 0x52:  1920x1080   60.000000 Hz  16:9     67.500 kHz    148.500000 MHz
    GTF     :  1920x1080  119.999987 Hz  16:9    138.840 kHz    368.759000 MHz
  Detailed Timing Descriptors:
    DTD 1:  3840x2160   30.000000 Hz  16:9     67.500 kHz    297.000000 MHz (941 mm x 529 mm)
                 Hfront  176 Hsync  88 Hback  296 Hpol P
                 Vfront    8 Vsync  10 Vback   72 Vpol P
    DTD 2:  1920x1080   60.000000 Hz  16:9     67.500 kHz    148.500000 MHz (941 mm x 529 mm)
                 Hfront   88 Hsync  44 Hback  148 Hpol P
                 Vfront    4 Vsync   5 Vback   36 Vpol P
    Display Product Name: 'D50u-D1'
    Display Range Limits:
      Monitor ranges (GTF): 25-76 Hz V, 15-140 kHz H, max dotclock 300 MHz
  Extension blocks: 1
Checksum: 0x65

----------------

Block 1, CTA-861 Extension Block:
  Revision: 3
  Basic audio support
  Supports YCbCr 4:4:4
  Supports YCbCr 4:2:2
  Native DTDs: 1
  Video Data Block:
    VIC   2:   720x480    59.940060 Hz   4:3     31.469 kHz     27.000000 MHz
    VIC   3:   720x480    59.940060 Hz  16:9     31.469 kHz     27.000000 MHz
    VIC   5:  1920x1080i  60.000000 Hz  16:9     33.750 kHz     74.250000 MHz
    VIC  16:  1920x1080   60.000000 Hz  16:9     67.500 kHz    148.500000 MHz (native)
    VIC   4:  1280x720    60.000000 Hz  16:9     45.000 kHz     74.250000 MHz
    VIC  32:  1920x1080   24.000000 Hz  16:9     27.000 kHz     74.250000 MHz
    VIC  63:  1920x1080  120.000000 Hz  16:9    135.000 kHz    297.000000 MHz
    VIC  93:  3840x2160   24.000000 Hz  16:9     54.000 kHz    297.000000 MHz
    VIC  95:  3840x2160   30.000000 Hz  16:9     67.500 kHz    297.000000 MHz
    VIC 100:  4096x2160   30.000000 Hz 256:135   67.500 kHz    297.000000 MHz
  Audio Data Block:
    Enhanced AC-3 (DD+):
      Max channels: 8
      Supported sample rates (kHz): 48 44.1
    Reserved (0x00)
    Reserved (0x00)
    Reserved (0x00)
    Linear PCM:
      Max channels: 2
      Supported sample rates (kHz): 48 44.1 32
      Supported sample sizes (bits): 24 20 16
    AC-3:
      Max channels: 6
      Supported sample rates (kHz): 48 44.1 32
      Maximum bit rate: 640 kb/s
  Speaker Allocation Data Block:
    FL/FR - Front Left/Right
  Vendor-Specific Data Block (HDMI), OUI 00-0C-03:
    Source physical address: 5.0.0.0
    DC_36bit
    DC_30bit
    DC_Y444
    Maximum TMDS clock: 300 MHz
    Extended HDMI video details:
      HDMI VICs:
        HDMI VIC 1:  3840x2160   30.000000 Hz  16:9     67.500 kHz    297.000000 MHz
        HDMI VIC 3:  3840x2160   24.000000 Hz  16:9     54.000 kHz    297.000000 MHz
        HDMI VIC 4:  4096x2160   24.000000 Hz 256:135   54.000 kHz    297.000000 MHz
  YCbCr 4:2:0 Video Data Block:
    VIC  97:  3840x2160   60.000000 Hz  16:9    135.000 kHz    594.000000 MHz
    VIC 102:  4096x2160   60.000000 Hz 256:135  135.000 kHz    594.000000 MHz
  Detailed Timing Descriptors:
    DTD 3:  1920x1080   60.000000 Hz  16:9     67.500 kHz    148.500000 MHz (941 mm x 529 mm)
                 Hfront   88 Hsync  44 Hback  148 Hpol P
                 Vfront    4 Vsync   5 Vback   36 Vpol P
    DTD 4:  1280x720    60.000000 Hz  16:9     45.000 kHz     74.250000 MHz (941 mm x 529 mm)
                 Hfront  110 Hsync  40 Hback  220 Hpol P
                 Vfront    5 Vsync   5 Vback   20 Vpol P
Checksum: 0x2c  Unused space in Extension Block: 35 bytes

----------------

Warnings:

Block 0, Base EDID:
  Vendor & Product Identification: The serial number is one of the known dummy values, it should probably be set to 0.
Block 1, CTA-861 Extension Block:
  IT Video Formats are overscanned by default, but normally this should be underscanned.
  Video Data Block: VIC 2 and the first DTD are not identical. Is this intended?
  Add a Colorimetry Data Block with the sRGB colorimetry bit set to avoid interop issues.
EDID:
  Base EDID: Some timings are out of range of the Monitor Ranges:
    Vertical Freq: 24.000 - 120.000 Hz (Monitor: 25.000 - 76.000 Hz)
    Maximum Clock: 368.759 MHz (Monitor: 300.000 MHz)

Failures:

Block 0, Base EDID:
  Detailed Timing Descriptor #1: Mismatch of image size 941x529 mm vs display size 1100x620 mm.
  Detailed Timing Descriptor #2: Mismatch of image size 941x529 mm vs display size 1100x620 mm.
Block 1, CTA-861 Extension Block:
  Audio Data Block: Audio Format Code 0x00 is reserved.
  Audio Data Block: Audio Format Code 0x00 is reserved.
  Audio Data Block: Audio Format Code 0x00 is reserved.
  Vendor-Specific Data Block (HDMI), OUI 00-0C-03: HDMI VIC Codes must have their CTA-861 VIC equivalents in the VSB.
  Detailed Timing Descriptor #3: Mismatch of image size 941x529 mm vs display size 1100x620 mm.
  Detailed Timing Descriptor #4: Mismatch of image size 941x529 mm vs display size 1100x620 mm.
  Missing VCDB, needed for Set Selectable RGB Quantization to avoid interop issues.
EDID:
  CTA-861: The maximum HDMI TMDS clock is 300000 kHz, but one or more video timings go up to 368759 kHz.
  CTA-861: Native progressive timings are a mix of several resolutions.

EDID conformity: FAIL
