edid-decode (hex):

00 ff ff ff ff ff ff 00 36 69 d3 3c 00 00 00 00
2f 20 01 04 b5 3c 22 78 3b 0f c5 a8 54 43 ae 27
0d 50 54 bf cf 00 d1 c0 71 4f 81 c0 81 40 81 80
95 00 b3 00 d1 fc 56 5e 00 a0 a0 a0 29 50 30 20
35 00 55 50 21 00 00 1a 6f c2 00 a0 a0 a0 55 50
30 20 35 00 55 50 21 00 00 1a 00 00 00 fd 00 30
aa fa fa 46 01 0a 20 20 20 20 20 20 00 00 00 fc
00 4d 53 49 20 47 32 37 32 51 50 46 0a 20 02 4b

02 03 31 71 48 04 13 90 4c 3f 03 12 01 23 09 17
07 83 01 00 00 e2 00 c0 6d 1a 00 00 02 01 30 aa
00 00 00 00 00 00 e3 05 c0 01 e6 06 07 01 53 53
1c ba 89 00 a0 a0 a0 55 50 30 20 35 00 55 50 21
00 00 1a 00 00 00 00 00 00 00 00 00 00 00 00 00
00 00 00 00 00 00 00 00 00 00 00 00 00 00 00 00
00 00 00 00 00 00 00 00 00 00 00 00 00 00 00 00
00 00 00 00 00 00 00 00 00 00 00 00 00 00 00 69

70 12 79 03 00 01 00 0c a8 1b 96 0f 00 0a a0 05
10 78 ff ff 03 01 28 25 01 01 04 ff 09 63 00 14
80 1f 00 9f 05 3b 00 0a 00 07 00 45 04 01 04 ff
09 69 00 07 80 1f 00 9f 05 1d 00 02 00 04 00 00
00 00 00 00 00 00 00 00 00 00 00 00 00 00 00 00
00 00 00 00 00 00 00 00 00 00 00 00 00 00 00 00
00 00 00 00 00 00 00 00 00 00 00 00 00 00 00 00
00 00 00 00 00 00 00 00 00 00 00 00 00 00 37 90

00 ff ff ff ff ff ff 00 36 69 d3 3c 00 00 00 00
2f 20 01 04 b5 3c 22 78 3b 0f c5 a8 54 43 ae 27
0d 50 54 bf cf 00 d1 c0 71 4f 81 c0 81 40 81 80
95 00 b3 00 d1 fc 56 5e 00 a0 a0 a0 29 50 30 20
35 00 55 50 21 00 00 1a 6f c2 00 a0 a0 a0 55 50
30 20 35 00 55 50 21 00 00 1a 00 00 00 fd 00 30
aa fa fa 46 01 0a 20 20 20 20 20 20 00 00 00 fc
00 4d 53 49 20 47 32 37 32 51 50 46 0a 20 02 4b

02 03 31 71 48 04 13 90 4c 3f 03 12 01 23 09 17
07 83 01 00 00 e2 00 c0 6d 1a 00 00 02 01 30 aa
00 00 00 00 00 00 e3 05 c0 01 e6 06 07 01 53 53
1c ba 89 00 a0 a0 a0 55 50 30 20 35 00 55 50 21
00 00 1a 00 00 00 00 00 00 00 00 00 00 00 00 00
00 00 00 00 00 00 00 00 00 00 00 00 00 00 00 00
00 00 00 00 00 00 00 00 00 00 00 00 00 00 00 00
00 00 00 00 00 00 00 00 00 00 00 00 00 00 00 69

70 12 79 03 00 01 00 0c a8 1b 96 0f 00 0a a0 05
10 78 ff ff 03 01 28 25 01 01 04 ff 09 63 00 14
80 1f 00 9f 05 3b 00 0a 00 07 00 45 04 01 04 ff
09 69 00 07 80 1f 00 9f 05 1d 00 02 00 04 00 00
00 00 00 00 00 00 00 00 00 00 00 00 00 00 00 00
00 00 00 00 00 00 00 00 00 00 00 00 00 00 00 00
00 00 00 00 00 00 00 00 00 00 00 00 00 00 00 00
00 00 00 00 00 00 00 00 00 00 00 00 00 00 37 90

----------------

Block 0, Base EDID:
  EDID Structure Version & Revision: 1.4
  Vendor & Product Identification:
    Manufacturer: MSI
    Model: 15571
    Made in: week 47 of 2022
  Basic Display Parameters & Features:
    Digital display
    Bits per primary color channel: 10
    DisplayPort interface
    Maximum image size: 60 cm x 34 cm
    Gamma: 2.20
    DPMS levels: Off
    Supported color formats: RGB 4:4:4, YCrCb 4:4:4, YCrCb 4:2:2
    First detailed timing includes the native pixel format and preferred refresh rate
    Display supports continuous frequencies
  Color Characteristics:
    Red  : 0.6562, 0.3281
    Green: 0.2646, 0.6826
    Blue : 0.1552, 0.0507
    White: 0.3134, 0.3291
  Established Timings I & II:
    IBM     :   720x400    70.081663 Hz   9:5     31.467 kHz     28.320000 MHz
    DMT 0x04:   640x480    59.940476 Hz   4:3     31.469 kHz     25.175000 MHz
    Apple   :   640x480    66.666667 Hz   4:3     35.000 kHz     30.240000 MHz
    DMT 0x05:   640x480    72.808802 Hz   4:3     37.861 kHz     31.500000 MHz
    DMT 0x06:   640x480    75.000000 Hz   4:3     37.500 kHz     31.500000 MHz
    DMT 0x08:   800x600    56.250000 Hz   4:3     35.156 kHz     36.000000 MHz
    DMT 0x09:   800x600    60.316541 Hz   4:3     37.879 kHz     40.000000 MHz
    DMT 0x0a:   800x600    72.187572 Hz   4:3     48.077 kHz     50.000000 MHz
    DMT 0x0b:   800x600    75.000000 Hz   4:3     46.875 kHz     49.500000 MHz
    DMT 0x10:  1024x768    60.003840 Hz   4:3     48.363 kHz     65.000000 MHz
    DMT 0x11:  1024x768    70.069359 Hz   4:3     56.476 kHz     75.000000 MHz
    DMT 0x12:  1024x768    75.028582 Hz   4:3     60.023 kHz     78.750000 MHz
    DMT 0x24:  1280x1024   75.024675 Hz   5:4     79.976 kHz    135.000000 MHz
  Standard Timings:
    DMT 0x52:  1920x1080   60.000000 Hz  16:9     67.500 kHz    148.500000 MHz
    DMT 0x15:  1152x864    75.000000 Hz   4:3     67.500 kHz    108.000000 MHz
    DMT 0x55:  1280x720    60.000000 Hz  16:9     45.000 kHz     74.250000 MHz
    DMT 0x20:  1280x960    60.000000 Hz   4:3     60.000 kHz    108.000000 MHz
    DMT 0x23:  1280x1024   60.019740 Hz   5:4     63.981 kHz    108.000000 MHz
    DMT 0x2f:  1440x900    59.887445 Hz  16:10    55.935 kHz    106.500000 MHz
    DMT 0x3a:  1680x1050   59.954250 Hz  16:10    65.290 kHz    146.250000 MHz
    GTF     :  1920x1080  119.999987 Hz  16:9    138.840 kHz    368.759000 MHz
  Detailed Timing Descriptors:
    DTD 1:  2560x1440   59.950550 Hz  16:9     88.787 kHz    241.500000 MHz (597 mm x 336 mm)
                 Hfront   48 Hsync  32 Hback   80 Hpol P
                 Vfront    3 Vsync   5 Vback   33 Vpol N
    DTD 2:  2560x1440  119.997589 Hz  16:9    182.996 kHz    497.750000 MHz (597 mm x 336 mm)
                 Hfront   48 Hsync  32 Hback   80 Hpol P
                 Vfront    3 Vsync   5 Vback   77 Vpol N
    Display Range Limits:
      Monitor ranges (Range Limits Only): 48-170 Hz V, 250-250 kHz H, max dotclock 700 MHz
    Display Product Name: 'MSI G272QPF'
  Extension blocks: 2
Checksum: 0x4b

----------------

Block 1, CTA-861 Extension Block:
  Revision: 3
  Basic audio support
  Supports YCbCr 4:4:4
  Supports YCbCr 4:2:2
  Native DTDs: 1
  Video Data Block:
    VIC   4:  1280x720    60.000000 Hz  16:9     45.000 kHz     74.250000 MHz
    VIC  19:  1280x720    50.000000 Hz  16:9     37.500 kHz     74.250000 MHz
    VIC  16:  1920x1080   60.000000 Hz  16:9     67.500 kHz    148.500000 MHz (native)
    VIC  76:  1920x1080   60.000000 Hz  64:27    67.500 kHz    148.500000 MHz
    VIC  63:  1920x1080  120.000000 Hz  16:9    135.000 kHz    297.000000 MHz
    VIC   3:   720x480    59.940060 Hz  16:9     31.469 kHz     27.000000 MHz
    VIC  18:   720x576    50.000000 Hz  16:9     31.250 kHz     27.000000 MHz
    VIC   1:   640x480    59.940476 Hz   4:3     31.469 kHz     25.175000 MHz
  Audio Data Block:
    Linear PCM:
      Max channels: 2
      Supported sample rates (kHz): 96 48 44.1 32
      Supported sample sizes (bits): 24 20 16
  Speaker Allocation Data Block:
    FL/FR - Front Left/Right
  Video Capability Data Block:
    YCbCr quantization: Selectable (via AVI YQ)
    RGB quantization: Selectable (via AVI Q)
    PT scan behavior: No Data
    IT scan behavior: IT video formats not supported
    CE scan behavior: CE video formats not supported
  Vendor-Specific Data Block (AMD), OUI 00-00-1A:
    Version: 2
    Feature Caps: 0x01
    Minimum Refresh Rate: 48 Hz
    Maximum Refresh Rate: 170 Hz
    Flags 1.x: 0x00
    Flags 2.x: 0x00
  Colorimetry Data Block:
    BT2020YCC
    BT2020RGB
    Gamut Boundary Description Metadata Profile P0
  HDR Static Metadata Data Block:
    Electro optical transfer functions:
      Traditional gamma - SDR luminance range
      Traditional gamma - HDR luminance range
      SMPTE ST2084
    Supported static metadata descriptors:
      Static metadata type 1
    Desired content max luminance: 83 (301.833 cd/m^2)
    Desired content max frame-average luminance: 83 (301.833 cd/m^2)
    Desired content min luminance: 28 (0.036 cd/m^2)
  Detailed Timing Descriptors:
    DTD 3:  2560x1440   85.000000 Hz  16:9    129.625 kHz    352.580000 MHz (597 mm x 336 mm)
                 Hfront   48 Hsync  32 Hback   80 Hpol P
                 Vfront    3 Vsync   5 Vback   77 Vpol N
Checksum: 0x69  Unused space in Extension Block: 60 bytes

----------------

Block 2, DisplayID Extension Block:
  Version: 1.2
  Extension Count: 0
  Display Product Type: Standalone display device
  Display Parameters Data Block (0x01):
    Image size: 708.0 mm x 399.0 mm
    Display native pixel format: 2560x1440
    Feature support flags:
      Power management (DPM)
    Gamma: 2.20
    Aspect ratio: 3.55
    Dynamic bpc native: 16
    Dynamic bpc overall: 16
  Video Timing Modes Type 1 - Detailed Timings Data Block:
    DTD:  2560x1440  164.987469 Hz  16:9    247.481 kHz    658.300000 MHz (aspect 16:9, no 3D stereo)
               Hfront   21 Hsync  32 Hback   47 Hpol P
               Vfront   11 Vsync   8 Vback   41 Vpol N
    DTD:  2560x1440  170.016994 Hz  16:9    249.925 kHz    666.300000 MHz (aspect 16:9, no 3D stereo)
               Hfront    8 Hsync  32 Hback   66 Hpol P
               Vfront    3 Vsync   5 Vback   22 Vpol N
  Checksum: 0x37
Checksum: 0x90

----------------

Warnings:

Block 1, CTA-861 Extension Block:
  IT Video Formats are overscanned by default, but normally this should be underscanned.
  Video Data Block: VIC 4 and the first DTD are not identical. Is this intended?
  Video Capability Data Block: IT scan behavior is expected to support underscanned.
  Video Capability Data Block: 'CE video formats not supported' makes no sense.
  Colorimetry Data Block: Set the sRGB colorimetry bit to avoid interop issues.
EDID:
  Base EDID: Some timings are out of range of the Monitor Ranges:
    Horizontal Freq: 31.250 - 249.924 kHz (Monitor: 250.000 - 250.000 kHz)

Failures:

Block 0, Base EDID:
  Detailed Timing Descriptor #1: Mismatch of image size 597x336 mm vs display size 708x399 mm.
  Detailed Timing Descriptor #2: Mismatch of image size 597x336 mm vs display size 708x399 mm.
Block 1, CTA-861 Extension Block:
  Detailed Timing Descriptor #3: Mismatch of image size 597x336 mm vs display size 708x399 mm.
EDID:
  Extension Block 3 started with EDID header, ignoring Extension Blocks >= 3.
  CTA-861: Native progressive timings are a mix of several resolutions.
  DisplayID: DisplayID expects at least one preferred timing.
  DisplayID: Image size mismatch: DisplayID: 708.0x399.0mm Base EDID: 600.0x340.0mm.

EDID conformity: FAIL
