edid-decode (hex):

00 ff ff ff ff ff ff 00 4c 23 00 27 00 00 00 00
01 21 01 04 b5 3c 21 78 3b d5 f5 b1 4c 3d ae 25
11 50 54 bf 2f 80 d1 c0 b3 00 95 00 81 80 71 4f
81 c0 81 40 a9 40 56 5e 00 a0 a0 a0 29 50 30 20
35 00 55 50 21 00 00 1a 00 00 00 fd 00 30 a5 ff
ff 46 01 0a 20 20 20 20 20 20 00 00 00 fc 00 44
50 31 0a 20 20 20 20 20 20 20 20 20 00 00 00 ff
00 30 30 30 30 30 30 30 30 30 30 30 30 30 02 56

02 03 2a f1 49 01 02 02 03 04 05 10 00 00 23 09
07 07 83 01 00 00 68 1a 00 00 01 17 30 a5 00 e3
05 e3 01 e6 06 07 01 65 65 1b f5 bd 00 a0 a0 a0
32 50 20 40 35 00 b9 88 21 00 00 1a 05 76 00 a0
a0 a0 29 50 30 20 35 00 b8 88 21 00 00 1a 02 3a
80 18 71 38 2d 40 30 20 35 00 b9 88 21 00 00 1a
98 e2 00 a0 a0 a0 29 50 30 20 35 00 b9 88 21 00
00 1a 00 00 00 00 00 00 00 00 00 00 00 00 00 ec

70 12 79 00 00 03 00 14 a2 03 01 04 ff 09 9f 00
2f 00 1f 00 9f 05 28 00 02 80 04 00 07 00 0a 08
81 00 08 04 00 04 02 10 00 00 00 00 00 00 00 00
00 00 00 00 00 00 00 00 00 00 00 00 00 00 00 00
00 00 00 00 00 00 00 00 00 00 00 00 00 00 00 00
00 00 00 00 00 00 00 00 00 00 00 00 00 00 00 00
00 00 00 00 00 00 00 00 00 00 00 00 00 00 00 00
00 00 00 00 00 00 00 00 00 00 00 00 00 00 b1 90

00 ff ff ff ff ff ff 00 4c 23 00 27 00 00 00 00
01 21 01 04 b5 3c 21 78 3b d5 f5 b1 4c 3d ae 25
11 50 54 bf 2f 80 d1 c0 b3 00 95 00 81 80 71 4f
81 c0 81 40 a9 40 56 5e 00 a0 a0 a0 29 50 30 20
35 00 55 50 21 00 00 1a 00 00 00 fd 00 30 a5 ff
ff 46 01 0a 20 20 20 20 20 20 00 00 00 fc 00 44
50 31 0a 20 20 20 20 20 20 20 20 20 00 00 00 ff
00 30 30 30 30 30 30 30 30 30 30 30 30 30 02 56

02 03 2a f1 49 01 02 02 03 04 05 10 00 00 23 09
07 07 83 01 00 00 68 1a 00 00 01 17 30 a5 00 e3
05 e3 01 e6 06 07 01 65 65 1b f5 bd 00 a0 a0 a0
32 50 20 40 35 00 b9 88 21 00 00 1a 05 76 00 a0
a0 a0 29 50 30 20 35 00 b8 88 21 00 00 1a 02 3a
80 18 71 38 2d 40 30 20 35 00 b9 88 21 00 00 1a
98 e2 00 a0 a0 a0 29 50 30 20 35 00 b9 88 21 00
00 1a 00 00 00 00 00 00 00 00 00 00 00 00 00 ec

70 12 79 00 00 03 00 14 a2 03 01 04 ff 09 9f 00
2f 00 1f 00 9f 05 28 00 02 80 04 00 07 00 0a 08
81 00 08 04 00 04 02 10 00 00 00 00 00 00 00 00
00 00 00 00 00 00 00 00 00 00 00 00 00 00 00 00
00 00 00 00 00 00 00 00 00 00 00 00 00 00 00 00
00 00 00 00 00 00 00 00 00 00 00 00 00 00 00 00
00 00 00 00 00 00 00 00 00 00 00 00 00 00 00 00
00 00 00 00 00 00 00 00 00 00 00 00 00 00 b1 90

----------------

Block 0, Base EDID:
  EDID Structure Version & Revision: 1.4
  Vendor & Product Identification:
    Manufacturer: SAC
    Model: 9984
    Made in: week 1 of 2023
  Basic Display Parameters & Features:
    Digital display
    Bits per primary color channel: 10
    DisplayPort interface
    Maximum image size: 60 cm x 33 cm
    Gamma: 2.20
    DPMS levels: Off
    Supported color formats: RGB 4:4:4, YCrCb 4:4:4, YCrCb 4:2:2
    First detailed timing includes the native pixel format and preferred refresh rate
    Display supports continuous frequencies
  Color Characteristics:
    Red  : 0.6943, 0.2978
    Green: 0.2392, 0.6806
    Blue : 0.1474, 0.0693
    White: 0.3134, 0.3291
  Established Timings I & II:
    IBM     :   720x400    70.081663 Hz   9:5     31.467 kHz     28.320000 MHz
    DMT 0x04:   640x480    59.940476 Hz   4:3     31.469 kHz     25.175000 MHz
    Apple   :   640x480    66.666667 Hz   4:3     35.000 kHz     30.240000 MHz
    DMT 0x05:   640x480    72.808802 Hz   4:3     37.861 kHz     31.500000 MHz
    DMT 0x06:   640x480    75.000000 Hz   4:3     37.500 kHz     31.500000 MHz
    DMT 0x08:   800x600    56.250000 Hz   4:3     35.156 kHz     36.000000 MHz
    DMT 0x09:   800x600    60.316541 Hz   4:3     37.879 kHz     40.000000 MHz
    Apple   :   832x624    74.551266 Hz   4:3     49.726 kHz     57.284000 MHz
    DMT 0x10:  1024x768    60.003840 Hz   4:3     48.363 kHz     65.000000 MHz
    DMT 0x11:  1024x768    70.069359 Hz   4:3     56.476 kHz     75.000000 MHz
    DMT 0x12:  1024x768    75.028582 Hz   4:3     60.023 kHz     78.750000 MHz
    DMT 0x24:  1280x1024   75.024675 Hz   5:4     79.976 kHz    135.000000 MHz
    Apple   :  1152x870    75.061550 Hz 192:145   68.681 kHz    100.000000 MHz
  Standard Timings:
    DMT 0x52:  1920x1080   60.000000 Hz  16:9     67.500 kHz    148.500000 MHz
    DMT 0x3a:  1680x1050   59.954250 Hz  16:10    65.290 kHz    146.250000 MHz
    DMT 0x2f:  1440x900    59.887445 Hz  16:10    55.935 kHz    106.500000 MHz
    DMT 0x23:  1280x1024   60.019740 Hz   5:4     63.981 kHz    108.000000 MHz
    DMT 0x15:  1152x864    75.000000 Hz   4:3     67.500 kHz    108.000000 MHz
    DMT 0x55:  1280x720    60.000000 Hz  16:9     45.000 kHz     74.250000 MHz
    DMT 0x20:  1280x960    60.000000 Hz   4:3     60.000 kHz    108.000000 MHz
    DMT 0x33:  1600x1200   60.000000 Hz   4:3     75.000 kHz    162.000000 MHz
  Detailed Timing Descriptors:
    DTD 1:  2560x1440   59.950550 Hz  16:9     88.787 kHz    241.500000 MHz (597 mm x 336 mm)
                 Hfront   48 Hsync  32 Hback   80 Hpol P
                 Vfront    3 Vsync   5 Vback   33 Vpol N
    Display Range Limits:
      Monitor ranges (Range Limits Only): 48-165 Hz V, 255-255 kHz H, max dotclock 700 MHz
    Display Product Name: 'DP1'
    Display Product Serial Number: ...
  Extension blocks: 2
Checksum: 0x56

----------------

Block 1, CTA-861 Extension Block:
  Revision: 3
  Underscans IT Video Formats by default
  Basic audio support
  Supports YCbCr 4:4:4
  Supports YCbCr 4:2:2
  Native DTDs: 1
  Video Data Block:
    VIC   1:   640x480    59.940476 Hz   4:3     31.469 kHz     25.175000 MHz
    VIC   2:   720x480    59.940060 Hz   4:3     31.469 kHz     27.000000 MHz
    VIC   2:   720x480    59.940060 Hz   4:3     31.469 kHz     27.000000 MHz
    VIC   3:   720x480    59.940060 Hz  16:9     31.469 kHz     27.000000 MHz
    VIC   4:  1280x720    60.000000 Hz  16:9     45.000 kHz     74.250000 MHz
    VIC   5:  1920x1080i  60.000000 Hz  16:9     33.750 kHz     74.250000 MHz
    VIC  16:  1920x1080   60.000000 Hz  16:9     67.500 kHz    148.500000 MHz
  Audio Data Block:
    Linear PCM:
      Max channels: 2
      Supported sample rates (kHz): 48 44.1 32
      Supported sample sizes (bits): 24 20 16
  Speaker Allocation Data Block:
    FL/FR - Front Left/Right
  Vendor-Specific Data Block (AMD), OUI 00-00-1A:
    Version: 1
    Flags 1: 0x17
      FreeSync Supported
    Minimum Refresh Rate: 48 Hz
    Maximum Refresh Rate: 165 Hz
  Colorimetry Data Block:
    xvYCC601
    xvYCC709
    BT2020cYCC
    BT2020YCC
    BT2020RGB
    Gamut Boundary Description Metadata Profile P0
  HDR Static Metadata Data Block:
    Electro optical transfer functions:
      Traditional gamma - SDR luminance range
      Traditional gamma - HDR luminance range
      SMPTE ST2084
    Supported static metadata descriptors:
      Static metadata type 1
    Desired content max luminance: 101 (445.755 cd/m^2)
    Desired content max frame-average luminance: 101 (445.755 cd/m^2)
    Desired content min luminance: 27 (0.050 cd/m^2)
  Detailed Timing Descriptors:
    DTD 2:  2560x1440  119.988650 Hz  16:9    178.783 kHz    486.290000 MHz (697 mm x 392 mm)
                 Hfront   32 Hsync  64 Hback   64 Hpol P
                 Vfront    3 Vsync   5 Vback   42 Vpol N
    DTD 3:  2560x1440   75.001489 Hz  16:9    111.077 kHz    302.130000 MHz (696 mm x 392 mm)
                 Hfront   48 Hsync  32 Hback   80 Hpol P
                 Vfront    3 Vsync   5 Vback   33 Vpol N
    DTD 4:  1920x1080   60.000000 Hz  16:9     67.500 kHz    148.500000 MHz (697 mm x 392 mm)
                 Hfront   48 Hsync  32 Hback  200 Hpol P
                 Vfront    3 Vsync   5 Vback   37 Vpol N
    DTD 5:  2560x1440  144.000477 Hz  16:9    213.265 kHz    580.080000 MHz (697 mm x 392 mm)
                 Hfront   48 Hsync  32 Hback   80 Hpol P
                 Vfront    3 Vsync   5 Vback   33 Vpol N
Checksum: 0xec  Unused space in Extension Block: 13 bytes

----------------

Block 2, DisplayID Extension Block:
  Version: 1.2
  Extension Count: 0
  Display Product Type: Extension Section
  Video Timing Modes Type 1 - Detailed Timings Data Block:
    DTD:  2560x1440  164.999305 Hz  16:9    244.364 kHz    664.670000 MHz (aspect 16:9, no 3D stereo)
               Hfront   48 Hsync  32 Hback   80 Hpol N
               Vfront    3 Vsync   5 Vback   33 Vpol P
  Supported Timing Modes Type 1 - VESA DMT Timings Data Block:
    DMT 0x04:   640x480    59.940476 Hz   4:3     31.469 kHz     25.175000 MHz
    DMT 0x09:   800x600    60.316541 Hz   4:3     37.879 kHz     40.000000 MHz
    DMT 0x10:  1024x768    60.003840 Hz   4:3     48.363 kHz     65.000000 MHz
    DMT 0x1c:  1280x800    59.810326 Hz  16:10    49.702 kHz     83.500000 MHz
    DMT 0x23:  1280x1024   60.019740 Hz   5:4     63.981 kHz    108.000000 MHz
    DMT 0x33:  1600x1200   60.000000 Hz   4:3     75.000 kHz    162.000000 MHz
    DMT 0x3a:  1680x1050   59.954250 Hz  16:10    65.290 kHz    146.250000 MHz
    DMT 0x45:  1920x1200   59.884600 Hz  16:10    74.556 kHz    193.250000 MHz
  Checksum: 0xb1
Checksum: 0x90

----------------

Warnings:

Block 0, Base EDID:
  Display Product Serial Number: ...
Block 1, CTA-861 Extension Block:
  Video Data Block: VIC 1 and the first DTD are not identical. Is this intended?
  Video Data Block: All VICs are in ascending order, and the first (preferred) VIC <= 4, is that intended?
  Colorimetry Data Block: Set the sRGB colorimetry bit to avoid interop issues.
  Detailed Timing Descriptor #4: DTD is similar but not identical to VIC 16.
EDID:
  Base EDID: Some timings are out of range of the Monitor Ranges:
    Horizontal Freq: 31.466 - 244.363 kHz (Monitor: 255.000 - 255.000 kHz)

Failures:

Block 1, CTA-861 Extension Block:
  Video Data Block: Duplicate VIC 2.
  Detailed Timing Descriptor #2: Mismatch of image size 697x392 mm vs display size 600x330 mm.
  Detailed Timing Descriptor #3: Mismatch of image size 696x392 mm vs display size 600x330 mm.
  Detailed Timing Descriptor #4: Mismatch of image size 697x392 mm vs display size 600x330 mm.
  Detailed Timing Descriptor #5: Mismatch of image size 697x392 mm vs display size 600x330 mm.
  Missing VCDB, needed for Set Selectable RGB Quantization to avoid interop issues.
Block 2, DisplayID Extension Block:
  DisplayID Base Block has no product type.
EDID:
  Extension Block 3 started with EDID header, ignoring Extension Blocks >= 3.
  Base EDID: The DTD max image size is 697x392mm, which is larger than the display size 600.0x330.0mm.
  DisplayID: DisplayID expects at least one preferred timing.

EDID conformity: FAIL
