edid-decode (hex):

00 ff ff ff ff ff ff 00 1e 6d 87 9e f8 36 05 00
05 21 01 04 b5 78 22 78 f9 52 f1 b0 4f 42 ab 25
0f 50 54 21 09 00 d1 c0 61 40 45 40 01 01 01 01
01 01 01 01 01 01 74 d6 00 a0 f0 38 40 40 30 20
3a 00 ae 51 41 00 00 1a 00 00 00 fd 00 30 90 e1
e1 76 01 0a 20 20 20 20 20 20 00 00 00 fc 00 4c
47 20 55 4c 54 52 41 57 49 44 45 0a 00 00 00 ff
00 33 30 35 4e 54 4c 45 41 31 37 35 32 0a 02 c0

02 03 28 70 23 09 07 07 83 01 00 00 e3 05 c0 00
e6 06 05 01 60 60 28 e2 00 6a 6d 1a 00 00 02 0b
30 90 00 04 65 26 5e 29 f4 b0 00 a0 f0 38 35 40
30 20 3a 00 ae 51 41 00 00 1a 00 00 00 00 00 00
00 00 00 00 00 00 00 00 00 00 00 00 00 00 00 00
00 00 00 00 00 00 00 00 00 00 00 00 00 00 00 00
00 00 00 00 00 00 00 00 00 00 00 00 00 00 00 00
00 00 00 00 00 00 00 00 00 00 00 00 00 00 00 a8

70 12 79 03 00 01 00 0c cd 2e 2a 0d 00 14 a0 05
90 78 ff 99 03 00 50 33 ca 01 88 ff 13 9f 00 2f
80 1f 00 9f 05 66 00 02 00 09 00 6c 37 01 08 ff
13 9f 00 2f 80 1f 00 9f 05 45 00 02 00 09 00 ca
06 01 88 ff 13 9f 00 2f 80 1f 00 9f 05 3a 00 02
00 09 00 30 dd 00 08 ff 13 9f 00 2f 80 1f 00 9f
05 31 00 02 00 09 00 00 00 00 00 00 00 00 00 00
00 00 00 00 00 00 00 00 00 00 00 00 00 00 19 90

00 ff ff ff ff ff ff 00 1e 6d 87 9e f8 36 05 00
05 21 01 04 b5 78 22 78 f9 52 f1 b0 4f 42 ab 25
0f 50 54 21 09 00 d1 c0 61 40 45 40 01 01 01 01
01 01 01 01 01 01 74 d6 00 a0 f0 38 40 40 30 20
3a 00 ae 51 41 00 00 1a 00 00 00 fd 00 30 90 e1
e1 76 01 0a 20 20 20 20 20 20 00 00 00 fc 00 4c
47 20 55 4c 54 52 41 57 49 44 45 0a 00 00 00 ff
00 33 30 35 4e 54 4c 45 41 31 37 35 32 0a 02 c0

02 03 28 70 23 09 07 07 83 01 00 00 e3 05 c0 00
e6 06 05 01 60 60 28 e2 00 6a 6d 1a 00 00 02 0b
30 90 00 04 65 26 5e 29 f4 b0 00 a0 f0 38 35 40
30 20 3a 00 ae 51 41 00 00 1a 00 00 00 00 00 00
00 00 00 00 00 00 00 00 00 00 00 00 00 00 00 00
00 00 00 00 00 00 00 00 00 00 00 00 00 00 00 00
00 00 00 00 00 00 00 00 00 00 00 00 00 00 00 00
00 00 00 00 00 00 00 00 00 00 00 00 00 00 00 a8

70 12 79 03 00 01 00 0c cd 2e 2a 0d 00 14 a0 05
90 78 ff 99 03 00 50 33 ca 01 88 ff 13 9f 00 2f
80 1f 00 9f 05 66 00 02 00 09 00 6c 37 01 08 ff
13 9f 00 2f 80 1f 00 9f 05 45 00 02 00 09 00 ca
06 01 88 ff 13 9f 00 2f 80 1f 00 9f 05 3a 00 02
00 09 00 30 dd 00 08 ff 13 9f 00 2f 80 1f 00 9f
05 31 00 02 00 09 00 00 00 00 00 00 00 00 00 00
00 00 00 00 00 00 00 00 00 00 00 00 00 00 19 90

----------------

Block 0, Base EDID:
  EDID Structure Version & Revision: 1.4
  Vendor & Product Identification:
    Manufacturer: GSM
    Model: 40583
    Serial Number: ...
    Made in: week 5 of 2023
  Basic Display Parameters & Features:
    Digital display
    Bits per primary color channel: 10
    DisplayPort interface
    Maximum image size: 120 cm x 34 cm
    Gamma: 2.20
    DPMS levels: Standby Suspend Off
    Supported color formats: RGB 4:4:4, YCrCb 4:4:4, YCrCb 4:2:2
    First detailed timing does not include the native pixel format and preferred refresh rate
    Display supports continuous frequencies
  Color Characteristics:
    Red  : 0.6884, 0.3095
    Green: 0.2578, 0.6699
    Blue : 0.1474, 0.0615
    White: 0.3125, 0.3291
  Established Timings I & II:
    DMT 0x04:   640x480    59.940476 Hz   4:3     31.469 kHz     25.175000 MHz
    DMT 0x09:   800x600    60.316541 Hz   4:3     37.879 kHz     40.000000 MHz
    DMT 0x10:  1024x768    60.003840 Hz   4:3     48.363 kHz     65.000000 MHz
    DMT 0x24:  1280x1024   75.024675 Hz   5:4     79.976 kHz    135.000000 MHz
  Standard Timings:
    DMT 0x52:  1920x1080   60.000000 Hz  16:9     67.500 kHz    148.500000 MHz
    DMT 0x10:  1024x768    60.003840 Hz   4:3     48.363 kHz     65.000000 MHz
    DMT 0x09:   800x600    60.316541 Hz   4:3     37.879 kHz     40.000000 MHz
  Detailed Timing Descriptors:
    DTD 1:  3840x1080  119.973776 Hz  32:9    137.250 kHz    549.000000 MHz (1198 mm x 337 mm)
                 Hfront   48 Hsync  32 Hback   80 Hpol P
                 Vfront    3 Vsync  10 Vback   51 Vpol N
    Display Range Limits:
      Monitor ranges (Range Limits Only): 48-144 Hz V, 225-225 kHz H, max dotclock 1180 MHz
    Display Product Name: 'LG ULTRAWIDE'
    Display Product Serial Number: ...
  Extension blocks: 2
Checksum: 0xc0

----------------

Block 1, CTA-861 Extension Block:
  Revision: 3
  Basic audio support
  Supports YCbCr 4:4:4
  Supports YCbCr 4:2:2
  Native DTDs: 0
  Audio Data Block:
    Linear PCM:
      Max channels: 2
      Supported sample rates (kHz): 48 44.1 32
      Supported sample sizes (bits): 24 20 16
  Speaker Allocation Data Block:
    FL/FR - Front Left/Right
  Colorimetry Data Block:
    BT2020YCC
    BT2020RGB
  HDR Static Metadata Data Block:
    Electro optical transfer functions:
      Traditional gamma - SDR luminance range
      SMPTE ST2084
    Supported static metadata descriptors:
      Static metadata type 1
    Desired content max luminance: 96 (400.000 cd/m^2)
    Desired content max frame-average luminance: 96 (400.000 cd/m^2)
    Desired content min luminance: 40 (0.098 cd/m^2)
  Video Capability Data Block:
    YCbCr quantization: No Data
    RGB quantization: Selectable (via AVI Q)
    PT scan behavior: Always Underscanned
    IT scan behavior: Always Underscanned
    CE scan behavior: Always Underscanned
  Vendor-Specific Data Block (AMD), OUI 00-00-1A:
    Version: 2
    Feature Caps: 0x0b
      Local Dimming Supported
    Minimum Refresh Rate: 48 Hz
    Maximum Refresh Rate: 144 Hz
    Flags 1.x: 0x00
    Flags 2.x: 0x04
      ST 2084 (PQ) EOTF Supported
      Linear EOTF (Windows scRGB, 0.0 - 125.0) Supported
      Gamma 2.2 EOTF Supported
      BT.2020 Gamut Supported
    Maximum luminance: 101 (445.755 cd/m^2)
    Minimum luminance: 38 (0.099 cd/m^2)
    Maximum luminance (without local dimming): 94 (383.041 cd/m^2)
    Minimum luminance (without local dimming): 41 (0.099 cd/m^2)
  Detailed Timing Descriptors:
    DTD 2:  3840x1080   99.955869 Hz  32:9    113.250 kHz    453.000000 MHz (1198 mm x 337 mm)
                 Hfront   48 Hsync  32 Hback   80 Hpol P
                 Vfront    3 Vsync  10 Vback   40 Vpol N
Checksum: 0xa8  Unused space in Extension Block: 69 bytes

----------------

Block 2, DisplayID Extension Block:
  Version: 1.2
  Extension Count: 0
  Display Product Type: Standalone display device
  Display Parameters Data Block (0x01):
    Image size: 1198.1 mm x 337.0 mm
    Display native pixel format: 5120x1440
    Feature support flags:
      Power management (DPM)
      Audio support on video interface
    Gamma: 2.20
    Aspect ratio: 3.55
    Dynamic bpc native: 10
    Dynamic bpc overall: 10
  Video Timing Modes Type 1 - Detailed Timings Data Block:
    DTD:  5120x1440  143.978672 Hz   0:0    222.159 kHz   1173.000000 MHz (aspect undefined, no 3D stereo, preferred)
               Hfront   48 Hsync  32 Hback   80 Hpol P
               Vfront    3 Vsync  10 Vback   90 Vpol N
    DTD:  5120x1440   99.996237 Hz   0:0    150.994 kHz    797.250000 MHz (aspect undefined, no 3D stereo)
               Hfront   48 Hsync  32 Hback   80 Hpol P
               Vfront    3 Vsync  10 Vback   57 Vpol N
    DTD:  5120x1440   84.999848 Hz   0:0    127.415 kHz    672.750000 MHz (aspect undefined, no 3D stereo, preferred)
               Hfront   48 Hsync  32 Hback   80 Hpol P
               Vfront    3 Vsync  10 Vback   46 Vpol N
    DTD:  5120x1440   71.976052 Hz   0:0    107.244 kHz    566.250000 MHz (aspect undefined, no 3D stereo)
               Hfront   48 Hsync  32 Hback   80 Hpol P
               Vfront    3 Vsync  10 Vback   37 Vpol N
  Checksum: 0x19
Checksum: 0x90

----------------

Warnings:

Block 1, CTA-861 Extension Block:
  IT Video Formats are overscanned by default, but normally this should be underscanned.
  Colorimetry Data Block: Set the sRGB colorimetry bit to avoid interop issues.
  Video Capability Data Block: Set Selectable YCbCr Quantization to avoid interop issues.
  Video Capability Data Block: S_PT is equal to S_IT and S_CE, so should be set to 0 instead.
  Display Product Serial Number is set, so the Serial Number in the Base EDID should be 0.
EDID:
  Base EDID: Some timings are out of range of the Monitor Ranges:
    Horizontal Freq: 31.468 - 222.159 kHz (Monitor: 225.000 - 225.000 kHz)

Failures:

Block 1, CTA-861 Extension Block:
  Video Capability Data Block: IT video formats are always underscanned, but bit 7 of Byte 3 of the CTA-861 Extension header is set to overscanned.
EDID:
  Extension Block 3 started with EDID header, ignoring Extension Blocks >= 3.

EDID conformity: FAIL
