edid-decode (hex):

00 ff ff ff ff ff ff 00 30 ae 52 90 00 00 00 00
1f 1e 01 04 a5 22 13 78 03 da e5 95 5d 59 94 29
24 50 54 00 00 00 01 01 01 01 01 01 01 01 01 01
01 01 01 01 01 01 96 3b 80 36 71 38 3c 40 30 20
36 00 58 c2 10 00 00 1a 00 00 00 00 00 00 00 00
00 00 00 00 00 00 00 00 00 00 00 00 00 fe 00 4c
45 4e 4f 56 4f 0a 20 20 20 20 20 20 00 00 00 fe
00 4c 45 4e 31 35 36 46 48 44 20 20 20 20 00 34

00 ff ff ff ff ff ff 00 30 ae 52 90 00 00 00 00
1f 1e 01 04 a5 22 13 78 03 da e5 95 5d 59 94 29
24 50 54 00 00 00 01 01 01 01 01 01 01 01 01 01
01 01 01 01 01 01 96 3b 80 36 71 38 3c 40 30 20
36 00 58 c2 10 00 00 1a 00 00 00 00 00 00 00 00
00 00 00 00 00 00 00 00 00 00 00 00 00 fe 00 4c
45 4e 4f 56 4f 0a 20 20 20 20 20 20 00 00 00 fe
00 4c 45 4e 31 35 36 46 48 44 20 20 20 20 00 34

----------------

Block 0, Base EDID:
  EDID Structure Version & Revision: 1.4
  Vendor & Product Identification:
    Manufacturer: LEN
    Model: 36946
    Made in: week 31 of 2020
  Basic Display Parameters & Features:
    Digital display
    Bits per primary color channel: 8
    DisplayPort interface
    Maximum image size: 34 cm x 19 cm
    Gamma: 2.20
    Supported color formats: RGB 4:4:4
    First detailed timing includes the native pixel format and preferred refresh rate
    Display supports continuous frequencies
  Color Characteristics:
    Red  : 0.5849, 0.3642
    Green: 0.3496, 0.5800
    Blue : 0.1630, 0.1425
    White: 0.3134, 0.3291
  Established Timings I & II: none
  Standard Timings: none
  Detailed Timing Descriptors:
    DTD 1:  1920x1080   60.003147 Hz  16:9     68.404 kHz    152.540000 MHz (344 mm x 194 mm)
                 Hfront   48 Hsync  32 Hback  230 Hpol P
                 Vfront    3 Vsync   6 Vback   51 Vpol N
    Empty Descriptor
    Alphanumeric Data String: 'LENOVO'
    Alphanumeric Data String: 'LEN156FHD    '
Checksum: 0x34

----------------

Warnings:

Block 0, Base EDID:
  Missing Display Product Name.

Failures:

Block 0, Base EDID:
  Empty Descriptor: Use Dummy Descriptor instead of all zeroes.
  Alphanumeric Data String: No newline, but one or more trailing spaces.
  Missing Display Range Limits Descriptor.
EDID:
  Extension Block 1 started with EDID header, ignoring Extension Blocks >= 1.

EDID conformity: FAIL
