edid-decode (hex):

00 ff ff ff ff ff ff 00 30 ae 52 90 00 00 00 00
30 1f 01 04 a5 22 13 78 03 28 65 97 59 54 8e 27
1e 50 54 00 00 00 01 01 01 01 01 01 01 01 01 01
01 01 01 01 01 01 36 36 80 a0 70 38 20 40 44 2d
35 00 58 c1 10 00 00 18 00 00 00 fd 00 28 3c 43
43 0e 01 0a 20 20 20 20 20 20 00 00 00 fe 00 4c
45 4e 4f 56 4f 0a 20 20 20 20 20 20 00 00 00 fe
00 4c 45 4e 31 35 36 46 48 44 20 20 20 20 00 a4

00 ff ff ff ff ff ff 00 30 ae 52 90 00 00 00 00
30 1f 01 04 a5 22 13 78 03 28 65 97 59 54 8e 27
1e 50 54 00 00 00 01 01 01 01 01 01 01 01 01 01
01 01 01 01 01 01 36 36 80 a0 70 38 20 40 44 2d
35 00 58 c1 10 00 00 18 00 00 00 fd 00 28 3c 43
43 0e 01 0a 20 20 20 20 20 20 00 00 00 fe 00 4c
45 4e 4f 56 4f 0a 20 20 20 20 20 20 00 00 00 fe
00 4c 45 4e 31 35 36 46 48 44 20 20 20 20 00 a4

----------------

Block 0, Base EDID:
  EDID Structure Version & Revision: 1.4
  Vendor & Product Identification:
    Manufacturer: LEN
    Model: 36946
    Made in: week 48 of 2021
  Basic Display Parameters & Features:
    Digital display
    Bits per primary color channel: 8
    DisplayPort interface
    Maximum image size: 34 cm x 19 cm
    Gamma: 2.20
    Supported color formats: RGB 4:4:4
    First detailed timing includes the native pixel format and preferred refresh rate
    Display supports continuous frequencies
  Color Characteristics:
    Red  : 0.5898, 0.3496
    Green: 0.3300, 0.5546
    Blue : 0.1533, 0.1191
    White: 0.3134, 0.3291
  Established Timings I & II: none
  Standard Timings: none
  Detailed Timing Descriptors:
    DTD 1:  1920x1080   60.001038 Hz  16:9     66.721 kHz    138.780000 MHz (344 mm x 193 mm)
                 Hfront   68 Hsync  45 Hback   47 Hpol N
                 Vfront    3 Vsync   5 Vback   24 Vpol N
    Display Range Limits:
      Monitor ranges (Range Limits Only): 40-60 Hz V, 67-67 kHz H, max dotclock 140 MHz
    Alphanumeric Data String: 'LENOVO'
    Alphanumeric Data String: 'LEN156FHD    '
Checksum: 0xa4

----------------

Warnings:

Block 0, Base EDID:
  Missing Display Product Name.

Failures:

Block 0, Base EDID:
  Alphanumeric Data String: No newline, but one or more trailing spaces.
EDID:
  Extension Block 1 started with EDID header, ignoring Extension Blocks >= 1.

EDID conformity: FAIL
