edid-decode (hex):

00 ff ff ff ff ff ff 00 26 13 01 00 0a 1a 00 00
18 1d 01 03 80 34 1f 78 ea d6 a5 a2 59 4a 95 24
14 50 54 2b 08 00 81 00 81 40 90 40 a9 c0 81 80
81 c0 95 00 b3 00 02 3a 80 18 71 38 2d 40 58 2c
45 00 08 36 21 00 00 1e 80 48 80 18 71 38 2d 40
30 28 55 00 b4 f5 10 00 00 1c 66 21 56 aa 51 00
1e 30 46 8f 33 00 aa ef 10 00 00 1e 00 00 00 fc
00 00 0a 20 20 20 20 20 20 20 20 20 20 20 01 4d

02 03 1f f1 4c 01 02 03 04 05 07 90 12 13 14 16
1f 23 09 07 07 83 01 00 00 65 03 0c 00 10 00 02
3a 80 18 71 38 2d 40 58 2c 45 00 fe 1f 11 00 00
1e 01 1d 80 18 71 1c 16 20 58 2c 25 00 fe 1f 11
00 00 9e 01 1d 00 72 51 d0 1e 20 6e 28 55 00 fe
1f 11 00 00 1e 8c 0a d0 8a 20 e0 2d 10 10 3e 96
00 fe 1f 11 00 00 18 01 1d 00 bc 52 d0 1e 20 b8
28 55 40 e8 12 11 00 00 1e 00 00 00 00 00 00 07

00 ff ff ff ff ff ff 00 26 13 01 00 0a 1a 00 00
18 1d 01 03 80 34 1f 78 ea d6 a5 a2 59 4a 95 24
14 50 54 2b 08 00 81 00 81 40 90 40 a9 c0 81 80
81 c0 95 00 b3 00 02 3a 80 18 71 38 2d 40 58 2c
45 00 08 36 21 00 00 1e 80 48 80 18 71 38 2d 40
30 28 55 00 b4 f5 10 00 00 1c 66 21 56 aa 51 00
1e 30 46 8f 33 00 aa ef 10 00 00 1e 00 00 00 fc
00 00 0a 20 20 20 20 20 20 20 20 20 20 20 01 4d

02 03 1f f1 4c 01 02 03 04 05 07 90 12 13 14 16
1f 23 09 07 07 83 01 00 00 65 03 0c 00 10 00 02
3a 80 18 71 38 2d 40 58 2c 45 00 fe 1f 11 00 00
1e 01 1d 80 18 71 1c 16 20 58 2c 25 00 fe 1f 11
00 00 9e 01 1d 00 72 51 d0 1e 20 6e 28 55 00 fe
1f 11 00 00 1e 8c 0a d0 8a 20 e0 2d 10 10 3e 96
00 fe 1f 11 00 00 18 01 1d 00 bc 52 d0 1e 20 b8
28 55 40 e8 12 11 00 00 1e 00 00 00 00 00 00 07

----------------

Block 0, Base EDID:
  EDID Structure Version & Revision: 1.3
  Vendor & Product Identification:
    Manufacturer: IPS
    Model: 1
    Serial Number: ...
    Made in: week 24 of 2019
  Basic Display Parameters & Features:
    Digital display
    Maximum image size: 52 cm x 31 cm
    Gamma: 2.20
    DPMS levels: Standby Suspend Off
    RGB color display
    First detailed timing is the preferred timing
  Color Characteristics:
    Red  : 0.6357, 0.3486
    Green: 0.2900, 0.5839
    Blue : 0.1425, 0.0800
    White: 0.3134, 0.3291
  Established Timings I & II:
    DMT 0x04:   640x480    59.940476 Hz   4:3     31.469 kHz     25.175000 MHz
    DMT 0x05:   640x480    72.808802 Hz   4:3     37.861 kHz     31.500000 MHz
    DMT 0x08:   800x600    56.250000 Hz   4:3     35.156 kHz     36.000000 MHz
    DMT 0x09:   800x600    60.316541 Hz   4:3     37.879 kHz     40.000000 MHz
    DMT 0x10:  1024x768    60.003840 Hz   4:3     48.363 kHz     65.000000 MHz
  Standard Timings:
    DMT 0x1c:  1280x800    59.810326 Hz  16:10    49.702 kHz     83.500000 MHz
    DMT 0x20:  1280x960    60.000000 Hz   4:3     60.000 kHz    108.000000 MHz
    DMT 0x2a:  1400x1050   59.978442 Hz   4:3     65.317 kHz    121.750000 MHz
    DMT 0x53:  1600x900    60.000000 Hz  16:9     60.000 kHz    108.000000 MHz (RB)
    DMT 0x23:  1280x1024   60.019740 Hz   5:4     63.981 kHz    108.000000 MHz
    DMT 0x55:  1280x720    60.000000 Hz  16:9     45.000 kHz     74.250000 MHz
    DMT 0x2f:  1440x900    59.887445 Hz  16:10    55.935 kHz    106.500000 MHz
    DMT 0x3a:  1680x1050   59.954250 Hz  16:10    65.290 kHz    146.250000 MHz
  Detailed Timing Descriptors:
    DTD 1:  1920x1080   60.000000 Hz  16:9     67.500 kHz    148.500000 MHz (520 mm x 310 mm)
                 Hfront   88 Hsync  44 Hback  148 Hpol P
                 Vfront    4 Vsync   5 Vback   36 Vpol P
    DTD 2:  1920x1080   74.989899 Hz  16:9     84.364 kHz    185.600000 MHz (436 mm x 245 mm)
                 Hfront   48 Hsync  40 Hback  192 Hpol N
                 Vfront    5 Vsync   5 Vback   35 Vpol P
    DTD 3:  1366x768    59.789541 Hz 683:384   47.712 kHz     85.500000 MHz (426 mm x 239 mm)
                 Hfront   70 Hsync 143 Hback  213 Hpol P
                 Vfront    3 Vsync   3 Vback   24 Vpol P
    Display Product Name: ''
  Extension blocks: 1
Checksum: 0x4d

----------------

Block 1, CTA-861 Extension Block:
  Revision: 3
  Underscans IT Video Formats by default
  Basic audio support
  Supports YCbCr 4:4:4
  Supports YCbCr 4:2:2
  Native DTDs: 1
  Video Data Block:
    VIC   1:   640x480    59.940476 Hz   4:3     31.469 kHz     25.175000 MHz
    VIC   2:   720x480    59.940060 Hz   4:3     31.469 kHz     27.000000 MHz
    VIC   3:   720x480    59.940060 Hz  16:9     31.469 kHz     27.000000 MHz
    VIC   4:  1280x720    60.000000 Hz  16:9     45.000 kHz     74.250000 MHz
    VIC   5:  1920x1080i  60.000000 Hz  16:9     33.750 kHz     74.250000 MHz
    VIC   7:  1440x480i   59.940060 Hz  16:9     15.734 kHz     27.000000 MHz
    VIC  16:  1920x1080   60.000000 Hz  16:9     67.500 kHz    148.500000 MHz (native)
    VIC  18:   720x576    50.000000 Hz  16:9     31.250 kHz     27.000000 MHz
    VIC  19:  1280x720    50.000000 Hz  16:9     37.500 kHz     74.250000 MHz
    VIC  20:  1920x1080i  50.000000 Hz  16:9     28.125 kHz     74.250000 MHz
    VIC  22:  1440x576i   50.000000 Hz  16:9     15.625 kHz     27.000000 MHz
    VIC  31:  1920x1080   50.000000 Hz  16:9     56.250 kHz    148.500000 MHz
  Audio Data Block:
    Linear PCM:
      Max channels: 2
      Supported sample rates (kHz): 48 44.1 32
      Supported sample sizes (bits): 24 20 16
  Speaker Allocation Data Block:
    FL/FR - Front Left/Right
  Vendor-Specific Data Block (HDMI), OUI 00-0C-03:
    Source physical address: 1.0.0.0
  Detailed Timing Descriptors:
    DTD 4:  1920x1080   60.000000 Hz  16:9     67.500 kHz    148.500000 MHz (510 mm x 287 mm)
                 Hfront   88 Hsync  44 Hback  148 Hpol P
                 Vfront    4 Vsync   5 Vback   36 Vpol P
    DTD 5:  1920x1080i  60.000000 Hz  16:9     33.750 kHz     74.250000 MHz (510 mm x 287 mm)
                 Hfront   88 Hsync  44 Hback  148 Hpol P
                 Vfront    2 Vsync   5 Vback   15 Vpol P Vfront +0.5 Odd Field
                 Vfront    2 Vsync   5 Vback   15 Vpol P Vback  +0.5 Even Field
    DTD 6:  1280x720    60.000000 Hz  16:9     45.000 kHz     74.250000 MHz (510 mm x 287 mm)
                 Hfront  110 Hsync  40 Hback  220 Hpol P
                 Vfront    5 Vsync   5 Vback   20 Vpol P
    DTD 7:   720x480    59.940060 Hz   3:2     31.469 kHz     27.000000 MHz (510 mm x 287 mm)
                 Hfront   16 Hsync  62 Hback   60 Hpol N
                 Vfront    9 Vsync   6 Vback   30 Vpol N
    DTD 8:  1280x720    50.000000 Hz  16:9     37.500 kHz     74.250000 MHz (488 mm x 274 mm)
                 Hfront  440 Hsync  40 Hback  220 Hpol P
                 Vfront    5 Vsync   5 Vback   20 Vpol P
Checksum: 0x07  Unused space in Extension Block: 6 bytes

----------------

Warnings:

Block 0, Base EDID:
  Vendor & Product Identification: The serial number is one of the known dummy values, it should probably be set to 0.
  Detailed Timing Descriptor #1: Image size is 520x310 mm, but based on the picture AR it should be 520x292 mm.
Block 1, CTA-861 Extension Block:
  Video Data Block: VIC 1 and the first DTD are not identical. Is this intended?
  Video Data Block: All VICs are in ascending order, and the first (preferred) VIC <= 4, is that intended?
  Detailed Timing Descriptor #7: Image size is 510x287 mm, but based on the picture AR it should be 430x287 mm.
  Add a Colorimetry Data Block with the sRGB colorimetry bit set to avoid interop issues.

Failures:

Block 0, Base EDID:
  Detailed Timing Descriptor #2: Mismatch of image size 436x245 mm vs display size 520x310 mm.
  Detailed Timing Descriptor #3: Mismatch of image size 426x239 mm vs display size 520x310 mm.
  Display Product Name: NUL byte at position 0.
  Missing Display Range Limits Descriptor.
Block 1, CTA-861 Extension Block:
  Detailed Timing Descriptor #4: Mismatch of image size 510x287 mm vs display size 520x310 mm.
  Detailed Timing Descriptor #5: Mismatch of image size 510x287 mm vs display size 520x310 mm.
  Detailed Timing Descriptor #6: Mismatch of image size 510x287 mm vs display size 520x310 mm.
  Detailed Timing Descriptor #7: Mismatch of image size 510x287 mm vs display size 520x310 mm.
  Detailed Timing Descriptor #8: Mismatch of image size 488x274 mm vs display size 520x310 mm.
  Missing VCDB, needed for Set Selectable RGB Quantization to avoid interop issues.
EDID:
  Extension Block 2 started with EDID header, ignoring Extension Blocks >= 2.

EDID conformity: FAIL
