edid-decode (hex):

00 ff ff ff ff ff ff 00 26 13 01 00 00 00 00 00
17 21 01 03 80 00 00 78 3a 90 55 a7 55 53 a0 28
13 50 54 a5 4f 00 71 4f 81 80 81 c0 81 00 95 00
b3 00 a9 c0 d1 c0 02 3a 80 18 71 38 2d 40 58 2c
45 00 55 50 21 00 00 1e 82 48 80 18 71 38 2d 40
58 2c 45 00 55 50 21 00 00 1e 00 00 00 fd 00 30
c8 1e ff 3c 01 0a 20 20 20 20 20 20 00 00 00 fc
00 48 44 4d 49 0a 20 20 20 20 20 20 20 20 01 f4

02 03 38 f1 44 01 02 04 10 23 09 07 07 83 01 00
00 67 03 0c 00 20 00 38 44 67 d8 5d c4 01 78 80
00 68 1a 00 00 01 01 30 c8 ed e3 05 e3 01 e6 06
07 01 60 50 00 e2 00 4b 71 7f 80 78 70 38 1f 40
30 20 45 00 20 2f 21 00 00 1e 36 95 80 a0 70 38
21 40 30 40 35 00 56 50 21 00 00 1e 84 6c 80 a0
70 38 21 40 30 40 35 00 55 50 21 00 00 1e 00 00
00 00 00 00 00 00 00 00 00 00 00 00 00 00 00 16

00 ff ff ff ff ff ff 00 26 13 01 00 00 00 00 00
17 21 01 03 80 00 00 78 3a 90 55 a7 55 53 a0 28
13 50 54 a5 4f 00 71 4f 81 80 81 c0 81 00 95 00
b3 00 a9 c0 d1 c0 02 3a 80 18 71 38 2d 40 58 2c
45 00 55 50 21 00 00 1e 82 48 80 18 71 38 2d 40
58 2c 45 00 55 50 21 00 00 1e 00 00 00 fd 00 30
c8 1e ff 3c 01 0a 20 20 20 20 20 20 00 00 00 fc
00 48 44 4d 49 0a 20 20 20 20 20 20 20 20 01 f4

02 03 38 f1 44 01 02 04 10 23 09 07 07 83 01 00
00 67 03 0c 00 20 00 38 44 67 d8 5d c4 01 78 80
00 68 1a 00 00 01 01 30 c8 ed e3 05 e3 01 e6 06
07 01 60 50 00 e2 00 4b 71 7f 80 78 70 38 1f 40
30 20 45 00 20 2f 21 00 00 1e 36 95 80 a0 70 38
21 40 30 40 35 00 56 50 21 00 00 1e 84 6c 80 a0
70 38 21 40 30 40 35 00 55 50 21 00 00 1e 00 00
00 00 00 00 00 00 00 00 00 00 00 00 00 00 00 16

----------------

Block 0, Base EDID:
  EDID Structure Version & Revision: 1.3
  Vendor & Product Identification:
    Manufacturer: IPS
    Model: 1
    Made in: week 23 of 2023
  Basic Display Parameters & Features:
    Digital display
    Image size is variable
    Gamma: 2.20
    DPMS levels: Off
    Undefined display color type
    First detailed timing is the preferred timing
  Color Characteristics:
    Red  : 0.6542, 0.3330
    Green: 0.3242, 0.6250
    Blue : 0.1572, 0.0751
    White: 0.3134, 0.3291
  Established Timings I & II:
    IBM     :   720x400    70.081663 Hz   9:5     31.467 kHz     28.320000 MHz
    DMT 0x04:   640x480    59.940476 Hz   4:3     31.469 kHz     25.175000 MHz
    DMT 0x06:   640x480    75.000000 Hz   4:3     37.500 kHz     31.500000 MHz
    DMT 0x09:   800x600    60.316541 Hz   4:3     37.879 kHz     40.000000 MHz
    DMT 0x0b:   800x600    75.000000 Hz   4:3     46.875 kHz     49.500000 MHz
    DMT 0x10:  1024x768    60.003840 Hz   4:3     48.363 kHz     65.000000 MHz
    DMT 0x11:  1024x768    70.069359 Hz   4:3     56.476 kHz     75.000000 MHz
    DMT 0x12:  1024x768    75.028582 Hz   4:3     60.023 kHz     78.750000 MHz
    DMT 0x24:  1280x1024   75.024675 Hz   5:4     79.976 kHz    135.000000 MHz
  Standard Timings:
    DMT 0x15:  1152x864    75.000000 Hz   4:3     67.500 kHz    108.000000 MHz
    DMT 0x23:  1280x1024   60.019740 Hz   5:4     63.981 kHz    108.000000 MHz
    DMT 0x55:  1280x720    60.000000 Hz  16:9     45.000 kHz     74.250000 MHz
    DMT 0x1c:  1280x800    59.810326 Hz  16:10    49.702 kHz     83.500000 MHz
    DMT 0x2f:  1440x900    59.887445 Hz  16:10    55.935 kHz    106.500000 MHz
    DMT 0x3a:  1680x1050   59.954250 Hz  16:10    65.290 kHz    146.250000 MHz
    DMT 0x53:  1600x900    60.000000 Hz  16:9     60.000 kHz    108.000000 MHz (RB)
    DMT 0x52:  1920x1080   60.000000 Hz  16:9     67.500 kHz    148.500000 MHz
  Detailed Timing Descriptors:
    DTD 1:  1920x1080   60.000000 Hz  16:9     67.500 kHz    148.500000 MHz (597 mm x 336 mm)
                 Hfront   88 Hsync  44 Hback  148 Hpol P
                 Vfront    4 Vsync   5 Vback   36 Vpol P
    DTD 2:  1920x1080   74.997980 Hz  16:9     84.373 kHz    185.620000 MHz (597 mm x 336 mm)
                 Hfront   88 Hsync  44 Hback  148 Hpol P
                 Vfront    4 Vsync   5 Vback   36 Vpol P
    Display Range Limits:
      Monitor ranges (Range Limits Only): 48-200 Hz V, 30-255 kHz H, max dotclock 600 MHz
    Display Product Name: 'HDMI'
  Extension blocks: 1
Checksum: 0xf4

----------------

Block 1, CTA-861 Extension Block:
  Revision: 3
  Underscans IT Video Formats by default
  Basic audio support
  Supports YCbCr 4:4:4
  Supports YCbCr 4:2:2
  Native DTDs: 1
  Video Data Block:
    VIC   1:   640x480    59.940476 Hz   4:3     31.469 kHz     25.175000 MHz
    VIC   2:   720x480    59.940060 Hz   4:3     31.469 kHz     27.000000 MHz
    VIC   4:  1280x720    60.000000 Hz  16:9     45.000 kHz     74.250000 MHz
    VIC  16:  1920x1080   60.000000 Hz  16:9     67.500 kHz    148.500000 MHz
  Audio Data Block:
    Linear PCM:
      Max channels: 2
      Supported sample rates (kHz): 48 44.1 32
      Supported sample sizes (bits): 24 20 16
  Speaker Allocation Data Block:
    FL/FR - Front Left/Right
  Vendor-Specific Data Block (HDMI), OUI 00-0C-03:
    Source physical address: 2.0.0.0
    DC_36bit
    DC_30bit
    DC_Y444
    Maximum TMDS clock: 340 MHz
  Vendor-Specific Data Block (HDMI Forum), OUI C4-5D-D8:
    Version: 1
    Maximum TMDS Character Rate: 600 MHz
    SCDC Present
  Vendor-Specific Data Block (AMD), OUI 00-00-1A:
    Version: 1
    Feature Caps: 0x01
    Minimum Refresh Rate: 48 Hz
    Maximum Refresh Rate: 200 Hz
    Flags 1.x: 0xed (MCCS)
  Colorimetry Data Block:
    xvYCC601
    xvYCC709
    BT2020cYCC
    BT2020YCC
    BT2020RGB
    Gamut Boundary Description Metadata Profile P0
  HDR Static Metadata Data Block:
    Electro optical transfer functions:
      Traditional gamma - SDR luminance range
      Traditional gamma - HDR luminance range
      SMPTE ST2084
    Supported static metadata descriptors:
      Static metadata type 1
    Desired content max luminance: 96 (400.000 cd/m^2)
    Desired content max frame-average luminance: 80 (282.843 cd/m^2)
    Desired content min luminance: 0 (0.000 cd/m^2)
  Video Capability Data Block:
    YCbCr quantization: No Data
    RGB quantization: Selectable (via AVI Q)
    PT scan behavior: No Data
    IT scan behavior: Always Underscanned
    CE scan behavior: Supports both over- and underscan
  Detailed Timing Descriptors:
    DTD 3:  1920x1080  143.948218 Hz  16:9    159.926 kHz    326.250000 MHz (544 mm x 303 mm)
                 Hfront   48 Hsync  32 Hback   40 Hpol P
                 Vfront    4 Vsync   5 Vback   22 Vpol P
    DTD 4:  1920x1080  164.999309 Hz  16:9    183.644 kHz    381.980000 MHz (598 mm x 336 mm)
                 Hfront   48 Hsync  64 Hback   48 Hpol P
                 Vfront    3 Vsync   5 Vback   25 Vpol P
    DTD 5:  1920x1080  119.997927 Hz  16:9    133.558 kHz    277.800000 MHz (597 mm x 336 mm)
                 Hfront   48 Hsync  64 Hback   48 Hpol P
                 Vfront    3 Vsync   5 Vback   25 Vpol P
Checksum: 0x16  Unused space in Extension Block: 17 bytes

----------------

Warnings:

Block 1, CTA-861 Extension Block:
  Video Data Block: VIC 1 and the first DTD are not identical. Is this intended?
  Video Data Block: All VICs are in ascending order, and the first (preferred) VIC <= 4, is that intended?
  Colorimetry Data Block: Set the sRGB colorimetry bit to avoid interop issues.
  Video Capability Data Block: Set Selectable YCbCr Quantization to avoid interop issues.

Failures:

Block 0, Base EDID:
  Display Range Limits: 'Range Limits Only' is not allowed for EDID < 1.4.
EDID:
  Extension Block 2 started with EDID header, ignoring Extension Blocks >= 2.
  Base EDID: The DTD max image size is 598x336mm, but the display size is not specified anywhere.

EDID conformity: FAIL
