edid-decode (hex):

00 ff ff ff ff ff ff 00 44 0c 57 00 00 00 00 00
00 0f 01 03 80 21 15 78 0a bc a5 94 57 4f 8c 27
27 50 54 00 00 00 01 01 01 01 01 01 01 01 01 01
01 01 01 01 01 01 a8 2f 90 e0 60 1a 10 40 20 40
13 00 4b cf 10 00 00 19 00 00 00 0f 00 00 00 00
00 00 00 00 00 18 c0 04 10 00 00 00 00 fe 00 46
46 30 35 38 00 00 00 00 00 00 00 0a 00 00 00 fe
00 2a 36 43 4a 6b 8e ae ff 02 01 0a 20 20 00 1a

00 ff ff ff ff ff ff 00 44 0c 57 00 00 00 00 00
00 0f 01 03 80 21 15 78 0a bc a5 94 57 4f 8c 27
27 50 54 00 00 00 01 01 01 01 01 01 01 01 01 01
01 01 01 01 01 01 a8 2f 90 e0 60 1a 10 40 20 40
13 00 4b cf 10 00 00 19 00 00 00 0f 00 00 00 00
00 00 00 00 00 18 c0 04 10 00 00 00 00 fe 00 46
46 30 35 38 00 00 00 00 00 00 00 0a 00 00 00 fe
00 2a 36 43 4a 6b 8e ae ff 02 01 0a 20 20 00 1a

----------------

Block 0, Base EDID:
  EDID Structure Version & Revision: 1.3
  Vendor & Product Identification:
    Manufacturer: Q@L
    Model: 87
    Made in: 2005
  Basic Display Parameters & Features:
    Digital display
    Maximum image size: 33 cm x 21 cm
    Gamma: 2.20
    RGB color display
    First detailed timing is the preferred timing
  Color Characteristics:
    Red  : 0.5800, 0.3427
    Green: 0.3115, 0.5468
    Blue : 0.1542, 0.1542
    White: 0.3134, 0.3291
  Established Timings I & II: none
  Standard Timings: none
  Detailed Timing Descriptors:
    DTD 1:  1680x1050   60.108471 Hz  16:10    64.076 kHz    122.000000 MHz (331 mm x 207 mm)
                 Hfront   32 Hsync  64 Hback  128 Hpol N
                 Vfront    1 Vsync   3 Vback   12 Vpol N
    Manufacturer-Specified Display Descriptor (0x0f): 00 0f 00 00 00 00 00 00 00 00 00 18 c0 04 10 00 '................'
    Alphanumeric Data String: 'FF058'
    Alphanumeric Data String: '*6CJk..'
Checksum: 0x1a

----------------

Warnings:

Block 0, Base EDID:
  Alphanumeric Data String: Non-ASCII character 0x8e at position 5, can cause problems.
  Alphanumeric Data String: Non-ASCII character 0xae at position 6, can cause problems.

Failures:

Block 0, Base EDID:
  Vendor & Product Identification: Manufacturer name field contains garbage.
  Alphanumeric Data String: NUL byte at position 5.
  Alphanumeric Data String: 0xff byte at position 7.
  Missing Display Product Name.
  Missing Display Range Limits Descriptor.
EDID:
  Extension Block 1 started with EDID header, ignoring Extension Blocks >= 1.

EDID conformity: FAIL
