edid-decode (hex):

00 ff ff ff ff ff ff 00 4c 23 33 27 01 00 00 00
01 1f 01 04 b5 3c 21 78 3b d5 f5 b1 4c 3d ae 25
11 50 54 bf ef 80 d1 c0 b3 00 95 00 81 80 71 4f
81 c0 81 40 a9 40 56 5e 00 a0 a0 a0 29 50 30 20
35 00 55 4f 21 00 00 1a 00 00 00 fd 00 30 b4 f2
f2 50 01 0a 20 20 20 20 20 20 00 00 00 fc 00 44
50 31 0a 20 20 20 20 20 20 20 20 20 00 00 00 ff
00 30 30 30 30 30 30 30 30 30 30 30 30 30 02 66

02 03 36 f1 50 1f 01 02 03 04 05 10 11 12 13 14
21 22 06 07 08 23 09 07 07 83 01 00 00 e3 05 c2
00 6d 1a 00 00 02 17 30 b4 00 04 62 20 5f 23 e6
06 07 01 62 5f 21 f9 bd 00 a0 a0 a0 32 50 20 40
35 00 55 4f 21 00 00 1a 5b 9d 00 a0 a0 a0 29 50
30 20 35 00 55 4f 21 00 00 1a 86 6f 80 a0 70 38
40 40 30 20 35 00 55 4f 21 00 00 1a 00 00 00 00
00 00 00 00 00 00 00 00 00 00 00 00 00 00 00 f8

70 12 79 00 00 03 00 14 a5 03 01 84 ff 09 9f 00
2f 00 1f 00 9f 05 28 00 02 80 04 00 07 00 0a 08
81 00 08 04 00 04 02 10 00 03 00 14 0f 17 01 84
ff 09 77 00 2f 00 1f 00 9f 05 28 00 02 80 04 00
03 00 14 97 e2 00 84 ff 09 9f 00 2f 00 1f 00 9f
05 28 00 02 80 04 00 00 00 00 00 00 00 00 00 00
00 00 00 00 00 00 00 00 00 00 00 00 00 00 00 00
00 00 00 00 00 00 00 00 00 00 00 00 00 00 f2 90

00 ff ff ff ff ff ff 00 4c 23 33 27 01 00 00 00
01 1f 01 04 b5 3c 21 78 3b d5 f5 b1 4c 3d ae 25
11 50 54 bf ef 80 d1 c0 b3 00 95 00 81 80 71 4f
81 c0 81 40 a9 40 56 5e 00 a0 a0 a0 29 50 30 20
35 00 55 4f 21 00 00 1a 00 00 00 fd 00 30 b4 f2
f2 50 01 0a 20 20 20 20 20 20 00 00 00 fc 00 44
50 31 0a 20 20 20 20 20 20 20 20 20 00 00 00 ff
00 30 30 30 30 30 30 30 30 30 30 30 30 30 02 66

02 03 36 f1 50 1f 01 02 03 04 05 10 11 12 13 14
21 22 06 07 08 23 09 07 07 83 01 00 00 e3 05 c2
00 6d 1a 00 00 02 17 30 b4 00 04 62 20 5f 23 e6
06 07 01 62 5f 21 f9 bd 00 a0 a0 a0 32 50 20 40
35 00 55 4f 21 00 00 1a 5b 9d 00 a0 a0 a0 29 50
30 20 35 00 55 4f 21 00 00 1a 86 6f 80 a0 70 38
40 40 30 20 35 00 55 4f 21 00 00 1a 00 00 00 00
00 00 00 00 00 00 00 00 00 00 00 00 00 00 00 f8

70 12 79 00 00 03 00 14 a5 03 01 84 ff 09 9f 00
2f 00 1f 00 9f 05 28 00 02 80 04 00 07 00 0a 08
81 00 08 04 00 04 02 10 00 03 00 14 0f 17 01 84
ff 09 77 00 2f 00 1f 00 9f 05 28 00 02 80 04 00
03 00 14 97 e2 00 84 ff 09 9f 00 2f 00 1f 00 9f
05 28 00 02 80 04 00 00 00 00 00 00 00 00 00 00
00 00 00 00 00 00 00 00 00 00 00 00 00 00 00 00
00 00 00 00 00 00 00 00 00 00 00 00 00 00 f2 90

----------------

Block 0, Base EDID:
  EDID Structure Version & Revision: 1.4
  Vendor & Product Identification:
    Manufacturer: SAC
    Model: 10035
    Serial Number: ...
    Made in: week 1 of 2021
  Basic Display Parameters & Features:
    Digital display
    Bits per primary color channel: 10
    DisplayPort interface
    Maximum image size: 60 cm x 33 cm
    Gamma: 2.20
    DPMS levels: Off
    Supported color formats: RGB 4:4:4, YCrCb 4:4:4, YCrCb 4:2:2
    First detailed timing includes the native pixel format and preferred refresh rate
    Display supports continuous frequencies
  Color Characteristics:
    Red  : 0.6943, 0.2978
    Green: 0.2392, 0.6806
    Blue : 0.1474, 0.0693
    White: 0.3134, 0.3291
  Established Timings I & II:
    IBM     :   720x400    70.081663 Hz   9:5     31.467 kHz     28.320000 MHz
    DMT 0x04:   640x480    59.940476 Hz   4:3     31.469 kHz     25.175000 MHz
    Apple   :   640x480    66.666667 Hz   4:3     35.000 kHz     30.240000 MHz
    DMT 0x05:   640x480    72.808802 Hz   4:3     37.861 kHz     31.500000 MHz
    DMT 0x06:   640x480    75.000000 Hz   4:3     37.500 kHz     31.500000 MHz
    DMT 0x08:   800x600    56.250000 Hz   4:3     35.156 kHz     36.000000 MHz
    DMT 0x09:   800x600    60.316541 Hz   4:3     37.879 kHz     40.000000 MHz
    DMT 0x0a:   800x600    72.187572 Hz   4:3     48.077 kHz     50.000000 MHz
    DMT 0x0b:   800x600    75.000000 Hz   4:3     46.875 kHz     49.500000 MHz
    Apple   :   832x624    74.551266 Hz   4:3     49.726 kHz     57.284000 MHz
    DMT 0x10:  1024x768    60.003840 Hz   4:3     48.363 kHz     65.000000 MHz
    DMT 0x11:  1024x768    70.069359 Hz   4:3     56.476 kHz     75.000000 MHz
    DMT 0x12:  1024x768    75.028582 Hz   4:3     60.023 kHz     78.750000 MHz
    DMT 0x24:  1280x1024   75.024675 Hz   5:4     79.976 kHz    135.000000 MHz
    Apple   :  1152x870    75.061550 Hz 192:145   68.681 kHz    100.000000 MHz
  Standard Timings:
    DMT 0x52:  1920x1080   60.000000 Hz  16:9     67.500 kHz    148.500000 MHz
    DMT 0x3a:  1680x1050   59.954250 Hz  16:10    65.290 kHz    146.250000 MHz
    DMT 0x2f:  1440x900    59.887445 Hz  16:10    55.935 kHz    106.500000 MHz
    DMT 0x23:  1280x1024   60.019740 Hz   5:4     63.981 kHz    108.000000 MHz
    DMT 0x15:  1152x864    75.000000 Hz   4:3     67.500 kHz    108.000000 MHz
    DMT 0x55:  1280x720    60.000000 Hz  16:9     45.000 kHz     74.250000 MHz
    DMT 0x20:  1280x960    60.000000 Hz   4:3     60.000 kHz    108.000000 MHz
    DMT 0x33:  1600x1200   60.000000 Hz   4:3     75.000 kHz    162.000000 MHz
  Detailed Timing Descriptors:
    DTD 1:  2560x1440   59.950550 Hz  16:9     88.787 kHz    241.500000 MHz (597 mm x 335 mm)
                 Hfront   48 Hsync  32 Hback   80 Hpol P
                 Vfront    3 Vsync   5 Vback   33 Vpol N
    Display Range Limits:
      Monitor ranges (Range Limits Only): 48-180 Hz V, 242-242 kHz H, max dotclock 800 MHz
    Display Product Name: 'DP1'
    Display Product Serial Number: ...
  Extension blocks: 2
Checksum: 0x66

----------------

Block 1, CTA-861 Extension Block:
  Revision: 3
  Underscans IT Video Formats by default
  Basic audio support
  Supports YCbCr 4:4:4
  Supports YCbCr 4:2:2
  Native detailed modes: 1
  Video Data Block:
    VIC  31:  1920x1080   50.000000 Hz  16:9     56.250 kHz    148.500000 MHz
    VIC   1:   640x480    59.940476 Hz   4:3     31.469 kHz     25.175000 MHz
    VIC   2:   720x480    59.940060 Hz   4:3     31.469 kHz     27.000000 MHz
    VIC   3:   720x480    59.940060 Hz  16:9     31.469 kHz     27.000000 MHz
    VIC   4:  1280x720    60.000000 Hz  16:9     45.000 kHz     74.250000 MHz
    VIC   5:  1920x1080i  60.000000 Hz  16:9     33.750 kHz     74.250000 MHz
    VIC  16:  1920x1080   60.000000 Hz  16:9     67.500 kHz    148.500000 MHz
    VIC  17:   720x576    50.000000 Hz   4:3     31.250 kHz     27.000000 MHz
    VIC  18:   720x576    50.000000 Hz  16:9     31.250 kHz     27.000000 MHz
    VIC  19:  1280x720    50.000000 Hz  16:9     37.500 kHz     74.250000 MHz
    VIC  20:  1920x1080i  50.000000 Hz  16:9     28.125 kHz     74.250000 MHz
    VIC  33:  1920x1080   25.000000 Hz  16:9     28.125 kHz     74.250000 MHz
    VIC  34:  1920x1080   30.000000 Hz  16:9     33.750 kHz     74.250000 MHz
    VIC   6:  1440x480i   59.940060 Hz   4:3     15.734 kHz     27.000000 MHz
    VIC   7:  1440x480i   59.940060 Hz  16:9     15.734 kHz     27.000000 MHz
    VIC   8:  1440x240    60.054449 Hz   4:3     15.734 kHz     27.000000 MHz
  Audio Data Block:
    Linear PCM:
      Max channels: 2
      Supported sample rates (kHz): 48 44.1 32
      Supported sample sizes (bits): 24 20 16
  Speaker Allocation Data Block:
    FL/FR - Front Left/Right
  Colorimetry Data Block:
    xvYCC709
    BT2020YCC
    BT2020RGB
  Vendor-Specific Data Block (AMD), OUI 00-00-1A:
    Version: 2
    Feature Caps: 0x17
    Minimum Refresh Rate: 48 Hz
    Maximum Refresh Rate: 180 Hz
    Flags 1.x: 0x00
    Flags 2.x: 0x04
    Maximum luminance: 98 (417.710 cd/m^2)
    Minimum luminance: 32 (0.066 cd/m^2)
    Maximum luminance (without local dimming): 95 (391.429 cd/m^2)
    Minimum luminance (without local dimming): 35 (0.074 cd/m^2)
  HDR Static Metadata Data Block:
    Electro optical transfer functions:
      Traditional gamma - SDR luminance range
      Traditional gamma - HDR luminance range
      SMPTE ST2084
    Supported static metadata descriptors:
      Static metadata type 1
    Desired content max luminance: 98 (417.710 cd/m^2)
    Desired content max frame-average luminance: 95 (391.429 cd/m^2)
    Desired content min luminance: 33 (0.070 cd/m^2)
  Detailed Timing Descriptors:
    DTD 2:  2560x1440  119.998520 Hz  16:9    178.798 kHz    486.330000 MHz (597 mm x 335 mm)
                 Hfront   32 Hsync  64 Hback   64 Hpol P
                 Vfront    3 Vsync   5 Vback   42 Vpol N
    DTD 3:  2560x1440   99.999504 Hz  16:9    148.099 kHz    402.830000 MHz (597 mm x 335 mm)
                 Hfront   48 Hsync  32 Hback   80 Hpol P
                 Vfront    3 Vsync   5 Vback   33 Vpol N
    DTD 4:  1920x1080  119.982181 Hz  16:9    137.260 kHz    285.500000 MHz (597 mm x 335 mm)
                 Hfront   48 Hsync  32 Hback   80 Hpol P
                 Vfront    3 Vsync   5 Vback   56 Vpol N
Checksum: 0xf8  Unused space in Extension Block: 19 bytes

----------------

Block 2, DisplayID Extension Block:
  Version: 1.2
  Extension Count: 0
  Display Product Type: Extension Section
  Video Timing Modes Type 1 - Detailed Timings Data Block:
    DTD:  2560x1440  165.006752 Hz  16:9    244.375 kHz    664.700000 MHz (aspect 16:9, no 3D stereo, preferred)
               Hfront   48 Hsync  32 Hback   80 Hpol N
               Vfront    3 Vsync   5 Vback   33 Vpol P
  Supported Timing Modes Type 1 - VESA DMT Timings Data Block:
    DMT 0x04:   640x480    59.940476 Hz   4:3     31.469 kHz     25.175000 MHz
    DMT 0x09:   800x600    60.316541 Hz   4:3     37.879 kHz     40.000000 MHz
    DMT 0x10:  1024x768    60.003840 Hz   4:3     48.363 kHz     65.000000 MHz
    DMT 0x1c:  1280x800    59.810326 Hz  16:10    49.702 kHz     83.500000 MHz
    DMT 0x23:  1280x1024   60.019740 Hz   5:4     63.981 kHz    108.000000 MHz
    DMT 0x33:  1600x1200   60.000000 Hz   4:3     75.000 kHz    162.000000 MHz
    DMT 0x3a:  1680x1050   59.954250 Hz  16:10    65.290 kHz    146.250000 MHz
    DMT 0x45:  1920x1200   59.884600 Hz  16:10    74.556 kHz    193.250000 MHz
  Video Timing Modes Type 1 - Detailed Timings Data Block:
    DTD:  2560x1440  179.991333 Hz  16:9    266.567 kHz    714.400000 MHz (aspect 16:9, no 3D stereo, preferred)
               Hfront   48 Hsync  32 Hback   40 Hpol N
               Vfront    3 Vsync   5 Vback   33 Vpol P
  Video Timing Modes Type 1 - Detailed Timings Data Block:
    DTD:  2560x1440  144.000477 Hz  16:9    213.265 kHz    580.080000 MHz (aspect 16:9, no 3D stereo, preferred)
               Hfront   48 Hsync  32 Hback   80 Hpol N
               Vfront    3 Vsync   5 Vback   33 Vpol P
  Checksum: 0xf2
Checksum: 0x90

----------------

Block 3, Unknown EDID Extension Block 0x00:
  00 ff ff ff ff ff ff 00 4c 23 33 27 01 00 00 00 '........L#3'....'
  01 1f 01 04 b5 3c 21 78 3b d5 f5 b1 4c 3d ae 25 '.....<!x;...L=.%'
  11 50 54 bf ef 80 d1 c0 b3 00 95 00 81 80 71 4f '.PT...........qO'
  81 c0 81 40 a9 40 56 5e 00 a0 a0 a0 29 50 30 20 '...@.@V^....)P0 '
  35 00 55 4f 21 00 00 1a 00 00 00 fd 00 30 b4 f2 '5.UO!........0..'
  f2 50 01 0a 20 20 20 20 20 20 00 00 00 fc 00 44 '.P..      .....D'
  50 31 0a 20 20 20 20 20 20 20 20 20 00 00 00 ff 'P1.         ....'
  00 30 30 30 30 30 30 30 30 30 30 30 30 30 02 66 '.0000000000000.f'
Checksum: 0x66

----------------

Block 4, CTA-861 Extension Block:
  Revision: 3
  Underscans IT Video Formats by default
  Basic audio support
  Supports YCbCr 4:4:4
  Supports YCbCr 4:2:2
  Native detailed modes: 1
  Video Data Block:
    VIC  31:  1920x1080   50.000000 Hz  16:9     56.250 kHz    148.500000 MHz
    VIC   1:   640x480    59.940476 Hz   4:3     31.469 kHz     25.175000 MHz
    VIC   2:   720x480    59.940060 Hz   4:3     31.469 kHz     27.000000 MHz
    VIC   3:   720x480    59.940060 Hz  16:9     31.469 kHz     27.000000 MHz
    VIC   4:  1280x720    60.000000 Hz  16:9     45.000 kHz     74.250000 MHz
    VIC   5:  1920x1080i  60.000000 Hz  16:9     33.750 kHz     74.250000 MHz
    VIC  16:  1920x1080   60.000000 Hz  16:9     67.500 kHz    148.500000 MHz
    VIC  17:   720x576    50.000000 Hz   4:3     31.250 kHz     27.000000 MHz
    VIC  18:   720x576    50.000000 Hz  16:9     31.250 kHz     27.000000 MHz
    VIC  19:  1280x720    50.000000 Hz  16:9     37.500 kHz     74.250000 MHz
    VIC  20:  1920x1080i  50.000000 Hz  16:9     28.125 kHz     74.250000 MHz
    VIC  33:  1920x1080   25.000000 Hz  16:9     28.125 kHz     74.250000 MHz
    VIC  34:  1920x1080   30.000000 Hz  16:9     33.750 kHz     74.250000 MHz
    VIC   6:  1440x480i   59.940060 Hz   4:3     15.734 kHz     27.000000 MHz
    VIC   7:  1440x480i   59.940060 Hz  16:9     15.734 kHz     27.000000 MHz
    VIC   8:  1440x240    60.054449 Hz   4:3     15.734 kHz     27.000000 MHz
  Audio Data Block:
    Linear PCM:
      Max channels: 2
      Supported sample rates (kHz): 48 44.1 32
      Supported sample sizes (bits): 24 20 16
  Speaker Allocation Data Block:
    FL/FR - Front Left/Right
  Colorimetry Data Block:
    xvYCC709
    BT2020YCC
    BT2020RGB
  Vendor-Specific Data Block (AMD), OUI 00-00-1A:
    Version: 2
    Feature Caps: 0x17
    Minimum Refresh Rate: 48 Hz
    Maximum Refresh Rate: 180 Hz
    Flags 1.x: 0x00
    Flags 2.x: 0x04
    Maximum luminance: 98 (417.710 cd/m^2)
    Minimum luminance: 32 (0.066 cd/m^2)
    Maximum luminance (without local dimming): 95 (391.429 cd/m^2)
    Minimum luminance (without local dimming): 35 (0.074 cd/m^2)
  HDR Static Metadata Data Block:
    Electro optical transfer functions:
      Traditional gamma - SDR luminance range
      Traditional gamma - HDR luminance range
      SMPTE ST2084
    Supported static metadata descriptors:
      Static metadata type 1
    Desired content max luminance: 98 (417.710 cd/m^2)
    Desired content max frame-average luminance: 95 (391.429 cd/m^2)
    Desired content min luminance: 33 (0.070 cd/m^2)
  Detailed Timing Descriptors:
    DTD 5:  2560x1440  119.998520 Hz  16:9    178.798 kHz    486.330000 MHz (597 mm x 335 mm)
                 Hfront   32 Hsync  64 Hback   64 Hpol P
                 Vfront    3 Vsync   5 Vback   42 Vpol N
    DTD 6:  2560x1440   99.999504 Hz  16:9    148.099 kHz    402.830000 MHz (597 mm x 335 mm)
                 Hfront   48 Hsync  32 Hback   80 Hpol P
                 Vfront    3 Vsync   5 Vback   33 Vpol N
    DTD 7:  1920x1080  119.982181 Hz  16:9    137.260 kHz    285.500000 MHz (597 mm x 335 mm)
                 Hfront   48 Hsync  32 Hback   80 Hpol P
                 Vfront    3 Vsync   5 Vback   56 Vpol N
Checksum: 0xf8  Unused space in Extension Block: 19 bytes

----------------

Block 5, DisplayID Extension Block:
  Version: 1.2
  Extension Count: 0
  Video Timing Modes Type 1 - Detailed Timings Data Block:
    DTD:  2560x1440  165.006752 Hz  16:9    244.375 kHz    664.700000 MHz (aspect 16:9, no 3D stereo, preferred)
               Hfront   48 Hsync  32 Hback   80 Hpol N
               Vfront    3 Vsync   5 Vback   33 Vpol P
  Supported Timing Modes Type 1 - VESA DMT Timings Data Block:
    DMT 0x04:   640x480    59.940476 Hz   4:3     31.469 kHz     25.175000 MHz
    DMT 0x09:   800x600    60.316541 Hz   4:3     37.879 kHz     40.000000 MHz
    DMT 0x10:  1024x768    60.003840 Hz   4:3     48.363 kHz     65.000000 MHz
    DMT 0x1c:  1280x800    59.810326 Hz  16:10    49.702 kHz     83.500000 MHz
    DMT 0x23:  1280x1024   60.019740 Hz   5:4     63.981 kHz    108.000000 MHz
    DMT 0x33:  1600x1200   60.000000 Hz   4:3     75.000 kHz    162.000000 MHz
    DMT 0x3a:  1680x1050   59.954250 Hz  16:10    65.290 kHz    146.250000 MHz
    DMT 0x45:  1920x1200   59.884600 Hz  16:10    74.556 kHz    193.250000 MHz
  Video Timing Modes Type 1 - Detailed Timings Data Block:
    DTD:  2560x1440  179.991333 Hz  16:9    266.567 kHz    714.400000 MHz (aspect 16:9, no 3D stereo, preferred)
               Hfront   48 Hsync  32 Hback   40 Hpol N
               Vfront    3 Vsync   5 Vback   33 Vpol P
  Video Timing Modes Type 1 - Detailed Timings Data Block:
    DTD:  2560x1440  144.000477 Hz  16:9    213.265 kHz    580.080000 MHz (aspect 16:9, no 3D stereo, preferred)
               Hfront   48 Hsync  32 Hback   80 Hpol N
               Vfront    3 Vsync   5 Vback   33 Vpol P
  Checksum: 0xf2
Checksum: 0x90

----------------

Warnings:

Block 0, Base EDID:
  Vendor & Product Identification: The serial number is one of the known dummy values, it should probably be set to 0.
  Display Product Serial Number: ...
Block 1, CTA-861 Extension Block:
  Video Data Block: VIC 31 and the first DTD are not identical. Is this intended?
  Colorimetry Data Block: Set the sRGB colorimetry bit to avoid interop issues.
  Display Product Serial Number is set, so the Serial Number in the Base EDID should be 0.
Block 4, CTA-861 Extension Block:
  Colorimetry Data Block: Set the sRGB colorimetry bit to avoid interop issues.
EDID:
  Base EDID: Some timings are out of range of the Monitor Ranges:
    Vertical Freq: 25.000 - 179.991 Hz (Monitor: 48.000 - 180.000 Hz)
    Horizontal Freq: 15.734 - 266.567 kHz (Monitor: 242.000 - 242.000 kHz)

Failures:

Block 1, CTA-861 Extension Block:
  Missing VCDB, needed for Set Selectable RGB Quantization to avoid interop issues.
Block 2, DisplayID Extension Block:
  DisplayID Base Block has no product type.
  Expected 0 DisplayID Extension Block, but got 1.
Block 3, Base EDID:
  Unknown Extension Block.
Block 4, CTA-861 Extension Block:
  Video Data Block: Duplicate VIC 31.
  Video Data Block: Duplicate VIC 1.
  Video Data Block: Duplicate VIC 2.
  Video Data Block: Duplicate VIC 3.
  Video Data Block: Duplicate VIC 4.
  Video Data Block: Duplicate VIC 5.
  Video Data Block: Duplicate VIC 16.
  Video Data Block: Duplicate VIC 17.
  Video Data Block: Duplicate VIC 18.
  Video Data Block: Duplicate VIC 19.
  Video Data Block: Duplicate VIC 20.
  Video Data Block: Duplicate VIC 33.
  Video Data Block: Duplicate VIC 34.
  Video Data Block: Duplicate VIC 6.
  Video Data Block: Duplicate VIC 7.
  Video Data Block: Duplicate VIC 8.
  Speaker Allocation Data Block: Only one instance of this Data Block is allowed.
  Colorimetry Data Block: Only one instance of this Data Block is allowed.
  HDR Static Metadata Data Block: Only one instance of this Data Block is allowed.
EDID:
  Base EDID: EDID specified 2 extension block(s), but found 5 extension block(s).

EDID conformity: FAIL
