edid-decode (hex):

00 ff ff ff ff ff ff 00 36 64 00 19 00 00 00 00
18 21 01 03 80 29 1a 78 ea d6 a5 a2 59 4a 95 24
14 50 54 21 08 00 81 00 01 01 01 01 a9 c0 81 00
81 00 95 00 01 01 21 39 90 30 62 1a 27 40 18 b0
36 40 9a 00 11 00 00 18 83 2d 40 bc 61 84 32 30
60 98 36 00 9a 00 11 00 00 1c 00 00 00 fd 00 30
4b 1e ff 1e 00 0a 20 20 20 20 20 20 00 00 00 fc
00 54 45 2d 31 39 31 30 53 0a 20 20 20 20 01 42

02 03 1a b1 46 01 02 03 04 0e 0f 65 03 0c 00 10
00 68 1a 00 00 01 01 30 4b ed 66 21 50 aa 51 00
1e 30 46 8f 33 00 9a 00 11 00 00 1e 66 21 50 aa
51 00 1e 30 46 8f 33 00 9a 00 11 00 00 1e 00 00
00 00 00 00 00 00 00 00 00 00 00 00 00 00 00 00
00 00 00 00 00 00 00 00 00 00 00 00 00 00 00 00
00 00 00 00 00 00 00 00 00 00 00 00 00 00 00 00
00 00 00 00 00 00 00 00 00 00 00 00 00 00 00 71

00 ff ff ff ff ff ff 00 36 64 00 19 00 00 00 00
18 21 01 03 80 29 1a 78 ea d6 a5 a2 59 4a 95 24
14 50 54 21 08 00 81 00 01 01 01 01 a9 c0 81 00
81 00 95 00 01 01 21 39 90 30 62 1a 27 40 18 b0
36 40 9a 00 11 00 00 18 83 2d 40 bc 61 84 32 30
60 98 36 00 9a 00 11 00 00 1c 00 00 00 fd 00 30
4b 1e ff 1e 00 0a 20 20 20 20 20 20 00 00 00 fc
00 54 45 2d 31 39 31 30 53 0a 20 20 20 20 01 42

02 03 1a b1 46 01 02 03 04 0e 0f 65 03 0c 00 10
00 68 1a 00 00 01 01 30 4b ed 66 21 50 aa 51 00
1e 30 46 8f 33 00 9a 00 11 00 00 1e 66 21 50 aa
51 00 1e 30 46 8f 33 00 9a 00 11 00 00 1e 00 00
00 00 00 00 00 00 00 00 00 00 00 00 00 00 00 00
00 00 00 00 00 00 00 00 00 00 00 00 00 00 00 00
00 00 00 00 00 00 00 00 00 00 00 00 00 00 00 00
00 00 00 00 00 00 00 00 00 00 00 00 00 00 00 71

----------------

Block 0, Base EDID:
  EDID Structure Version & Revision: 1.3
  Vendor & Product Identification:
    Manufacturer: MSD
    Model: 6400
    Made in: week 24 of 2023
  Basic Display Parameters & Features:
    Digital display
    Maximum image size: 41 cm x 26 cm
    Gamma: 2.20
    DPMS levels: Standby Suspend Off
    RGB color display
    First detailed timing is the preferred timing
  Color Characteristics:
    Red  : 0.6357, 0.3486
    Green: 0.2900, 0.5839
    Blue : 0.1425, 0.0800
    White: 0.3134, 0.3291
  Established Timings I & II:
    DMT 0x04:   640x480    59.940476 Hz   4:3     31.469 kHz     25.175000 MHz
    DMT 0x09:   800x600    60.316541 Hz   4:3     37.879 kHz     40.000000 MHz
    DMT 0x10:  1024x768    60.003840 Hz   4:3     48.363 kHz     65.000000 MHz
  Standard Timings:
    DMT 0x1c:  1280x800    59.810326 Hz  16:10    49.702 kHz     83.500000 MHz
    DMT 0x53:  1600x900    60.000000 Hz  16:9     60.000 kHz    108.000000 MHz (RB)
    DMT 0x1c:  1280x800    59.810326 Hz  16:10    49.702 kHz     83.500000 MHz
    DMT 0x1c:  1280x800    59.810326 Hz  16:10    49.702 kHz     83.500000 MHz
    DMT 0x2f:  1440x900    59.887445 Hz  16:10    55.935 kHz    106.500000 MHz
  Detailed Timing Descriptors:
    DTD 1:  1680x1050   59.954250 Hz  16:10    65.290 kHz    146.250000 MHz (410 mm x 256 mm)
                 Hfront  280 Hsync 176 Hback  104 Hpol N
                 Vfront    3 Vsync   6 Vback   30 Vpol N
    DTD 2:  1600x900    60.001030 Hz  16:9     57.001 kHz    116.510000 MHz (410 mm x 256 mm)
                 Hfront   96 Hsync 152 Hback  196 Hpol N
                 Vfront    3 Vsync   6 Vback   41 Vpol P
    Display Range Limits:
      Monitor ranges (GTF): 48-75 Hz V, 30-255 kHz H, max dotclock 300 MHz
    Display Product Name: 'TE-1910S'
  Extension blocks: 1
Checksum: 0x42

----------------

Block 1, CTA-861 Extension Block:
  Revision: 3
  Underscans IT Video Formats by default
  Supports YCbCr 4:4:4
  Supports YCbCr 4:2:2
  Native DTDs: 1
  Video Data Block:
    VIC   1:   640x480    59.940476 Hz   4:3     31.469 kHz     25.175000 MHz
    VIC   2:   720x480    59.940060 Hz   4:3     31.469 kHz     27.000000 MHz
    VIC   3:   720x480    59.940060 Hz  16:9     31.469 kHz     27.000000 MHz
    VIC   4:  1280x720    60.000000 Hz  16:9     45.000 kHz     74.250000 MHz
    VIC  14:  1440x480    59.940060 Hz   4:3     31.469 kHz     54.000000 MHz
    VIC  15:  1440x480    59.940060 Hz  16:9     31.469 kHz     54.000000 MHz
  Vendor-Specific Data Block (HDMI), OUI 00-0C-03:
    Source physical address: 1.0.0.0
  Vendor-Specific Data Block (AMD), OUI 00-00-1A:
    Version: 1
    Feature Caps: 0x01
    Minimum Refresh Rate: 48 Hz
    Maximum Refresh Rate: 75 Hz
    Flags 1.x: 0xed (MCCS)
  Detailed Timing Descriptors:
    DTD 3:  1360x768    59.990402 Hz  85:48    47.872 kHz     85.500000 MHz (410 mm x 256 mm)
                 Hfront   70 Hsync 143 Hback  213 Hpol P
                 Vfront    3 Vsync   3 Vback   24 Vpol P
    DTD 4:  1360x768    59.990402 Hz  85:48    47.872 kHz     85.500000 MHz (410 mm x 256 mm)
                 Hfront   70 Hsync 143 Hback  213 Hpol P
                 Vfront    3 Vsync   3 Vback   24 Vpol P
Checksum: 0x71  Unused space in Extension Block: 65 bytes

----------------

Warnings:

Block 0, Base EDID:
  Detailed Timing Descriptor #1: DTD is similar but not identical to DMT 0x3a.
  Detailed Timing Descriptor #2: Image size is 410x256 mm, but based on the picture AR it should be 410x230 mm.
Block 1, CTA-861 Extension Block:
  Video Data Block: VIC 1 and the first DTD are not identical. Is this intended?
  Video Data Block: All VICs are in ascending order, and the first (preferred) VIC <= 4, is that intended?
  Detailed Timing Descriptor #3: Image size is 410x256 mm, but based on the picture AR it should be 410x231 mm.
  Detailed Timing Descriptor #4: Image size is 410x256 mm, but based on the picture AR it should be 410x231 mm.
  Add a Colorimetry Data Block with the sRGB colorimetry bit set to avoid interop issues.

Failures:

Block 1, CTA-861 Extension Block:
  Missing VCDB, needed for Set Selectable RGB Quantization to avoid interop issues.
EDID:
  Extension Block 2 started with EDID header, ignoring Extension Blocks >= 2.

EDID conformity: FAIL
