edid-decode (hex):

00 ff ff ff ff ff ff 00 10 ac 92 d0 42 31 45 30
1e 1b 01 04 a5 26 1e 78 3a c9 75 a6 57 51 9d 27
0e 50 54 a5 4b 00 71 4f 81 80 01 01 01 01 01 01
01 01 01 01 01 01 30 2a 00 98 51 00 2a 40 30 70
13 00 77 2c 11 00 00 1e 00 00 00 ff 00 37 59 4b
46 38 37 37 51 30 45 31 42 0a 00 00 00 fc 00 44
45 4c 4c 20 50 31 39 31 37 53 0a 20 00 00 00 fd
00 38 4c 1e 51 0e 01 0a 20 20 20 20 20 20 00 88

00 ff ff ff ff ff ff 00 10 ac 92 d0 42 31 45 30
1e 1b 01 04 a5 26 1e 78 3a c9 75 a6 57 51 9d 27
0e 50 54 a5 4b 00 71 4f 81 80 01 01 01 01 01 01
01 01 01 01 01 01 30 2a 00 98 51 00 2a 40 30 70
13 00 77 2c 11 00 00 1e 00 00 00 ff 00 37 59 4b
46 38 37 37 51 30 45 31 42 0a 00 00 00 fc 00 44
45 4c 4c 20 50 31 39 31 37 53 0a 20 00 00 00 fd
00 38 4c 1e 51 0e 01 0a 20 20 20 20 20 20 00 88

----------------

Block 0, Base EDID:
  EDID Structure Version & Revision: 1.4
  Vendor & Product Identification:
    Manufacturer: DEL
    Model: 53394
    Serial Number: ...
    Made in: week 30 of 2017
  Basic Display Parameters & Features:
    Digital display
    Bits per primary color channel: 8
    DisplayPort interface
    Maximum image size: 38 cm x 30 cm
    Gamma: 2.20
    DPMS levels: Off
    Supported color formats: RGB 4:4:4, YCrCb 4:4:4, YCrCb 4:2:2
    First detailed timing includes the native pixel format and preferred refresh rate
  Color Characteristics:
    Red  : 0.6513, 0.3398
    Green: 0.3183, 0.6142
    Blue : 0.1533, 0.0576
    White: 0.3134, 0.3291
  Established Timings I & II:
    IBM     :   720x400    70.081663 Hz   9:5     31.467 kHz     28.320000 MHz
    DMT 0x04:   640x480    59.940476 Hz   4:3     31.469 kHz     25.175000 MHz
    DMT 0x06:   640x480    75.000000 Hz   4:3     37.500 kHz     31.500000 MHz
    DMT 0x09:   800x600    60.316541 Hz   4:3     37.879 kHz     40.000000 MHz
    DMT 0x0b:   800x600    75.000000 Hz   4:3     46.875 kHz     49.500000 MHz
    DMT 0x10:  1024x768    60.003840 Hz   4:3     48.363 kHz     65.000000 MHz
    DMT 0x12:  1024x768    75.028582 Hz   4:3     60.023 kHz     78.750000 MHz
    DMT 0x24:  1280x1024   75.024675 Hz   5:4     79.976 kHz    135.000000 MHz
  Standard Timings:
    DMT 0x15:  1152x864    75.000000 Hz   4:3     67.500 kHz    108.000000 MHz
    DMT 0x23:  1280x1024   60.019740 Hz   5:4     63.981 kHz    108.000000 MHz
  Detailed Timing Descriptors:
    DTD 1:  1280x1024   60.019740 Hz   5:4     63.981 kHz    108.000000 MHz (375 mm x 300 mm)
                 Hfront   48 Hsync 112 Hback  248 Hpol P
                 Vfront    1 Vsync   3 Vback   38 Vpol P
    Display Product Serial Number: ...
    Display Product Name: 'DELL P1917S'
    Display Range Limits:
      Monitor ranges (Range Limits Only): 56-76 Hz V, 30-81 kHz H, max dotclock 140 MHz
Checksum: 0x88

----------------

Failures:

EDID:
  Extension Block 1 started with EDID header, ignoring Extension Blocks >= 1.

EDID conformity: FAIL
