edid-decode (hex):

00 ff ff ff ff ff ff 00 34 a2 04 83 01 00 00 00
2a 1a 01 04 a5 46 27 78 33 87 e5 a4 56 50 9e 26
0d 50 54 af cf 00 81 80 61 7c 81 bc 95 00 95 3c
b3 00 b3 3c d1 fc 37 8b 80 18 71 38 2d 40 58 2c
45 00 ba 89 21 00 00 1e 02 3a 80 18 71 38 2d 40
58 2c 45 00 ba 89 21 00 00 1e 00 00 00 fd 00 5a
90 a2 a2 24 01 0a 20 20 20 20 20 20 00 00 00 fc
00 4d 44 32 31 34 32 36 0a 20 20 20 20 20 01 c8

02 03 19 c1 23 09 07 07 83 01 00 00 03 00 00 00
03 00 00 00 00 00 00 00 00 2a 82 80 50 70 38 4d
40 08 20 f8 0c ba 89 21 00 00 1a 00 00 00 00 00
00 00 00 00 00 00 00 00 00 00 00 00 00 00 00 00
00 00 00 00 00 00 00 00 00 00 00 00 00 00 00 00
00 00 00 00 00 00 00 00 00 00 00 00 00 00 00 00
00 00 00 00 00 00 00 00 00 00 00 00 00 00 00 00
00 00 00 00 00 00 00 00 00 00 00 00 00 00 00 02

00 ff ff ff ff ff ff 00 34 a2 04 83 01 00 00 00
2a 1a 01 04 a5 46 27 78 33 87 e5 a4 56 50 9e 26
0d 50 54 af cf 00 81 80 61 7c 81 bc 95 00 95 3c
b3 00 b3 3c d1 fc 37 8b 80 18 71 38 2d 40 58 2c
45 00 ba 89 21 00 00 1e 02 3a 80 18 71 38 2d 40
58 2c 45 00 ba 89 21 00 00 1e 00 00 00 fd 00 5a
90 a2 a2 24 01 0a 20 20 20 20 20 20 00 00 00 fc
00 4d 44 32 31 34 32 36 0a 20 20 20 20 20 01 c8

02 03 19 c1 23 09 07 07 83 01 00 00 03 00 00 00
03 00 00 00 00 00 00 00 00 2a 82 80 50 70 38 4d
40 08 20 f8 0c ba 89 21 00 00 1a 00 00 00 00 00
00 00 00 00 00 00 00 00 00 00 00 00 00 00 00 00
00 00 00 00 00 00 00 00 00 00 00 00 00 00 00 00
00 00 00 00 00 00 00 00 00 00 00 00 00 00 00 00
00 00 00 00 00 00 00 00 00 00 00 00 00 00 00 00
00 00 00 00 00 00 00 00 00 00 00 00 00 00 00 02

----------------

Block 0, Base EDID:
  EDID Structure Version & Revision: 1.4
  Vendor & Product Identification:
    Manufacturer: MEB
    Model: 33540
    Serial Number: ...
    Made in: week 42 of 2016
  Basic Display Parameters & Features:
    Digital display
    Bits per primary color channel: 8
    DisplayPort interface
    Maximum image size: 70 cm x 39 cm
    Gamma: 2.20
    DPMS levels: Off
    Supported color formats: RGB 4:4:4, YCrCb 4:2:2
    First detailed timing includes the native pixel format and preferred refresh rate
    Display supports continuous frequencies
  Color Characteristics:
    Red  : 0.6425, 0.3359
    Green: 0.3134, 0.6201
    Blue : 0.1513, 0.0527
    White: 0.3134, 0.3291
  Established Timings I & II:
    IBM     :   720x400    70.081663 Hz   9:5     31.467 kHz     28.320000 MHz
    DMT 0x04:   640x480    59.940476 Hz   4:3     31.469 kHz     25.175000 MHz
    DMT 0x05:   640x480    72.808802 Hz   4:3     37.861 kHz     31.500000 MHz
    DMT 0x06:   640x480    75.000000 Hz   4:3     37.500 kHz     31.500000 MHz
    DMT 0x08:   800x600    56.250000 Hz   4:3     35.156 kHz     36.000000 MHz
    DMT 0x09:   800x600    60.316541 Hz   4:3     37.879 kHz     40.000000 MHz
    DMT 0x0a:   800x600    72.187572 Hz   4:3     48.077 kHz     50.000000 MHz
    DMT 0x0b:   800x600    75.000000 Hz   4:3     46.875 kHz     49.500000 MHz
    DMT 0x10:  1024x768    60.003840 Hz   4:3     48.363 kHz     65.000000 MHz
    DMT 0x11:  1024x768    70.069359 Hz   4:3     56.476 kHz     75.000000 MHz
    DMT 0x12:  1024x768    75.028582 Hz   4:3     60.023 kHz     78.750000 MHz
    DMT 0x24:  1280x1024   75.024675 Hz   5:4     79.976 kHz    135.000000 MHz
  Standard Timings:
    DMT 0x23:  1280x1024   60.019740 Hz   5:4     63.981 kHz    108.000000 MHz
    GTF     :  1024x768   119.999931 Hz   4:3     98.760 kHz    139.054000 MHz
    GTF     :  1280x1024  120.000185 Hz   5:4    131.640 kHz    233.793000 MHz
    DMT 0x2f:  1440x900    59.887445 Hz  16:10    55.935 kHz    106.500000 MHz
    GTF     :  1440x900   119.999896 Hz  16:10   115.800 kHz    229.747000 MHz
    DMT 0x3a:  1680x1050   59.954250 Hz  16:10    65.290 kHz    146.250000 MHz
    GTF     :  1680x1050  120.000000 Hz  16:10   135.000 kHz    313.200000 MHz
    GTF     :  1920x1080  119.999987 Hz  16:9    138.840 kHz    368.759000 MHz
  Detailed Timing Descriptors:
    DTD 1:  1920x1080  143.995960 Hz  16:9    161.995 kHz    356.390000 MHz (698 mm x 393 mm)
                 Hfront   88 Hsync  44 Hback  148 Hpol P
                 Vfront    4 Vsync   5 Vback   36 Vpol P
    DTD 2:  1920x1080   60.000000 Hz  16:9     67.500 kHz    148.500000 MHz (698 mm x 393 mm)
                 Hfront   88 Hsync  44 Hback  148 Hpol P
                 Vfront    4 Vsync   5 Vback   36 Vpol P
    Display Range Limits:
      Monitor ranges (Range Limits Only): 90-144 Hz V, 162-162 kHz H, max dotclock 360 MHz
    Display Product Name: 'MD21426'
  Extension blocks: 1
Checksum: 0xc8

----------------

Block 1, CTA-861 Extension Block:
  Revision: 3
  Underscans IT Video Formats by default
  Basic audio support
  Native detailed modes: 1
  Audio Data Block:
    Linear PCM:
      Max channels: 2
      Supported sample rates (kHz): 48 44.1 32
      Supported sample sizes (bits): 24 20 16
  Speaker Allocation Data Block:
    FL/FR - Front Left/Right
  Unknown CTA-861 Data Block (tag 0x00, length 3):
    00 00 00                                        '...'
  Unknown CTA-861 Data Block (tag 0x00, length 3):
    00 00 00                                        '...'
  Unknown CTA-861 Data Block (tag 0x00, length 0):
  Unknown CTA-861 Data Block (tag 0x00, length 0):
  Unknown CTA-861 Data Block (tag 0x00, length 0):
  Unknown CTA-861 Data Block (tag 0x00, length 0):
  Unknown CTA-861 Data Block (tag 0x00, length 0):
  Detailed Timing Descriptors:
    DTD 3:  1920x1080  144.001729 Hz  16:9    166.610 kHz    333.220000 MHz (698 mm x 393 mm)
                 Hfront    8 Hsync  32 Hback   40 Hpol P
                 Vfront   63 Vsync   8 Vback    6 Vpol N
Checksum: 0x02  Unused space in Extension Block: 84 bytes

----------------

Block 2, Unknown EDID Extension Block 0x00:
  00 ff ff ff ff ff ff 00 34 a2 04 83 01 00 00 00 '........4.......'
  2a 1a 01 04 a5 46 27 78 33 87 e5 a4 56 50 9e 26 '*....F'x3...VP.&'
  0d 50 54 af cf 00 81 80 61 7c 81 bc 95 00 95 3c '.PT.....a|.....<'
  b3 00 b3 3c d1 fc 37 8b 80 18 71 38 2d 40 58 2c '...<..7...q8-@X,'
  45 00 ba 89 21 00 00 1e 02 3a 80 18 71 38 2d 40 'E...!....:..q8-@'
  58 2c 45 00 ba 89 21 00 00 1e 00 00 00 fd 00 5a 'X,E...!........Z'
  90 a2 a2 24 01 0a 20 20 20 20 20 20 00 00 00 fc '...$..      ....'
  00 4d 44 32 31 34 32 36 0a 20 20 20 20 20 01 c8 '.MD21426.     ..'
Checksum: 0xc8

----------------

Block 3, CTA-861 Extension Block:
  Revision: 3
  Underscans IT Video Formats by default
  Basic audio support
  Native detailed modes: 1
  Audio Data Block:
    Linear PCM:
      Max channels: 2
      Supported sample rates (kHz): 48 44.1 32
      Supported sample sizes (bits): 24 20 16
  Speaker Allocation Data Block:
    FL/FR - Front Left/Right
  Unknown CTA-861 Data Block (tag 0x00, length 3):
    00 00 00                                        '...'
  Unknown CTA-861 Data Block (tag 0x00, length 3):
    00 00 00                                        '...'
  Unknown CTA-861 Data Block (tag 0x00, length 0):
  Unknown CTA-861 Data Block (tag 0x00, length 0):
  Unknown CTA-861 Data Block (tag 0x00, length 0):
  Unknown CTA-861 Data Block (tag 0x00, length 0):
  Unknown CTA-861 Data Block (tag 0x00, length 0):
  Detailed Timing Descriptors:
    DTD 4:  1920x1080  144.001729 Hz  16:9    166.610 kHz    333.220000 MHz (698 mm x 393 mm)
                 Hfront    8 Hsync  32 Hback   40 Hpol P
                 Vfront   63 Vsync   8 Vback    6 Vpol N
Checksum: 0x02  Unused space in Extension Block: 84 bytes

----------------

Warnings:

Block 0, Base EDID:
  Vendor & Product Identification: The serial number is one of the known dummy values, it should probably be set to 0.
  Detailed Timing Descriptor #2: DTD is identical to VIC 16, which is not present in the CTA Ext Block.
Block 1, CTA-861 Extension Block:
  Unknown CTA-861 Data Block (tag 0x00, length 3).
  Unknown CTA-861 Data Block (tag 0x00, length 3).
  Unknown CTA-861 Data Block (tag 0x00, length 0).
  Unknown CTA-861 Data Block (tag 0x00, length 0).
  Unknown CTA-861 Data Block (tag 0x00, length 0).
  Unknown CTA-861 Data Block (tag 0x00, length 0).
  Unknown CTA-861 Data Block (tag 0x00, length 0).
  Add a Colorimetry Data Block with the sRGB colorimetry bit set to avoid interop issues.
Block 3, CTA-861 Extension Block:
  Unknown CTA-861 Data Block (tag 0x00, length 3).
  Unknown CTA-861 Data Block (tag 0x00, length 3).
  Unknown CTA-861 Data Block (tag 0x00, length 0).
  Unknown CTA-861 Data Block (tag 0x00, length 0).
  Unknown CTA-861 Data Block (tag 0x00, length 0).
  Unknown CTA-861 Data Block (tag 0x00, length 0).
  Unknown CTA-861 Data Block (tag 0x00, length 0).
EDID:
  Base EDID: Some timings are out of range of the Monitor Ranges:
    Vertical Freq: 56.250 - 144.002 Hz (Monitor: 90.000 - 144.000 Hz)
    Horizontal Freq: 31.466 - 166.610 kHz (Monitor: 162.000 - 162.000 kHz)
    Maximum Clock: 368.759 MHz (Monitor: 360.000 MHz)

Failures:

Block 1, CTA-861 Extension Block:
  Missing VCDB, needed for Set Selectable RGB Quantization to avoid interop issues.
Block 2, Base EDID:
  Unknown Extension Block.
Block 3, CTA-861 Extension Block:
  Speaker Allocation Data Block: Only one instance of this Data Block is allowed.
EDID:
  Base EDID: EDID specified 1 extension block(s), but found 3 extension block(s).

EDID conformity: FAIL
