edid-decode (hex):

00 ff ff ff ff ff ff 00 04 72 65 03 f2 0d 30 40
03 18 01 04 a5 2b 18 78 e2 69 d5 a2 56 4f a0 28
0f 50 54 bf ee 80 71 4f 81 c0 a9 c0 81 00 01 01
01 01 01 01 01 01 30 2a 40 c8 60 84 64 30 18 50
13 00 b0 ef 10 00 00 1e 00 00 00 fd 00 38 4b 1f
53 0c 00 0a 20 20 20 20 20 20 00 00 00 fc 00 41
63 65 72 20 53 32 30 30 48 51 4c 0a 00 00 00 ff
00 4c 5a 36 52 4e 30 30 32 34 33 33 30 0a 00 01

00 ff ff ff ff ff ff 00 04 72 65 03 f2 0d 30 40
03 18 01 04 a5 2b 18 78 e2 69 d5 a2 56 4f a0 28
0f 50 54 bf ee 80 71 4f 81 c0 a9 c0 81 00 01 01
01 01 01 01 01 01 30 2a 40 c8 60 84 64 30 18 50
13 00 b0 ef 10 00 00 1e 00 00 00 fd 00 38 4b 1f
53 0c 00 0a 20 20 20 20 20 20 00 00 00 fc 00 41
63 65 72 20 53 32 30 30 48 51 4c 0a 00 00 00 ff
00 4c 5a 36 52 4e 30 30 32 34 33 33 30 0a 00 01

----------------

Block 0, Base EDID:
  EDID Structure Version & Revision: 1.4
  Vendor & Product Identification:
    Manufacturer: ACR
    Model: 869
    Serial Number: ...
    Made in: week 3 of 2014
  Basic Display Parameters & Features:
    Digital display
    Bits per primary color channel: 8
    DisplayPort interface
    Maximum image size: 43 cm x 24 cm
    Gamma: 2.20
    DPMS levels: Standby Suspend Off
    Supported color formats: RGB 4:4:4
    First detailed timing includes the native pixel format and preferred refresh rate
  Color Characteristics:
    Red  : 0.6337, 0.3378
    Green: 0.3105, 0.6259
    Blue : 0.1591, 0.0595
    White: 0.3134, 0.3291
  Established Timings I & II:
    IBM     :   720x400    70.081663 Hz   9:5     31.467 kHz     28.320000 MHz
    DMT 0x04:   640x480    59.940476 Hz   4:3     31.469 kHz     25.175000 MHz
    Apple   :   640x480    66.666667 Hz   4:3     35.000 kHz     30.240000 MHz
    DMT 0x05:   640x480    72.808802 Hz   4:3     37.861 kHz     31.500000 MHz
    DMT 0x06:   640x480    75.000000 Hz   4:3     37.500 kHz     31.500000 MHz
    DMT 0x08:   800x600    56.250000 Hz   4:3     35.156 kHz     36.000000 MHz
    DMT 0x09:   800x600    60.316541 Hz   4:3     37.879 kHz     40.000000 MHz
    DMT 0x0a:   800x600    72.187572 Hz   4:3     48.077 kHz     50.000000 MHz
    DMT 0x0b:   800x600    75.000000 Hz   4:3     46.875 kHz     49.500000 MHz
    Apple   :   832x624    74.551266 Hz   4:3     49.726 kHz     57.284000 MHz
    DMT 0x10:  1024x768    60.003840 Hz   4:3     48.363 kHz     65.000000 MHz
    DMT 0x11:  1024x768    70.069359 Hz   4:3     56.476 kHz     75.000000 MHz
    DMT 0x12:  1024x768    75.028582 Hz   4:3     60.023 kHz     78.750000 MHz
    Apple   :  1152x870    75.061550 Hz 192:145   68.681 kHz    100.000000 MHz
  Standard Timings:
    DMT 0x15:  1152x864    75.000000 Hz   4:3     67.500 kHz    108.000000 MHz
    DMT 0x55:  1280x720    60.000000 Hz  16:9     45.000 kHz     74.250000 MHz
    DMT 0x53:  1600x900    60.000000 Hz  16:9     60.000 kHz    108.000000 MHz (RB)
    DMT 0x1c:  1280x800    59.810326 Hz  16:10    49.702 kHz     83.500000 MHz
  Detailed Timing Descriptors:
    DTD 1:  1600x900    60.000000 Hz  16:9     60.000 kHz    108.000000 MHz (432 mm x 239 mm)
                 Hfront   24 Hsync  80 Hback   96 Hpol P
                 Vfront    1 Vsync   3 Vback   96 Vpol P
    Display Range Limits:
      Monitor ranges (GTF): 56-75 Hz V, 31-83 kHz H, max dotclock 120 MHz
    Display Product Name: 'Acer S200HQL'
    Display Product Serial Number: ...
Checksum: 0x01

----------------

Warnings:

Block 0, Base EDID:
  Display Range Limits: GTF support is deprecated in EDID 1.4.

Failures:

Block 0, Base EDID:
  Display Range Limits: GTF is supported, but the display does not support continuous frequencies.
EDID:
  Extension Block 1 started with EDID header, ignoring Extension Blocks >= 1.

EDID conformity: FAIL
