edid-decode (hex):

00 ff ff ff ff ff ff 00 15 85 00 00 01 01 01 01
1a 18 01 03 80 46 27 78 0a d7 a5 a2 59 4a 96 24
14 50 54 ad ce 00 01 01 01 01 01 01 01 01 01 01
01 01 01 01 01 01 66 21 50 b0 51 00 1b 30 40 70
36 00 f8 c2 21 00 00 1e 0e 1f 00 80 51 00 1e 30
40 80 37 00 f8 c2 21 00 00 1c 00 00 00 fc 00 45
4c 45 46 54 33 32 36 0a 20 20 20 20 00 00 00 fd
00 32 4c 1e 41 0b 00 0a 20 20 20 20 20 20 01 88

02 03 2d f1 50 90 05 04 02 03 06 07 11 12 13 14
15 16 1f 01 20 26 09 07 07 15 07 24 83 01 00 00
6c 03 0c 00 30 00 00 2d c0 01 01 01 01 02 3a 80
18 71 38 2d 40 58 2c 45 00 70 ea 31 00 00 1e 01
1d 80 18 71 1c 16 20 58 2c 25 00 f4 19 11 00 00
9e 8c 0a d0 8a 20 e0 2d 10 10 3a 96 00 58 c2 21
00 00 18 8c 0a d0 8a 20 e0 2d 10 10 3e 96 00 20
c2 31 00 00 18 00 00 00 00 00 00 00 00 00 00 ba

00 ff ff ff ff ff ff 00 15 85 00 00 01 01 01 01
1a 18 01 03 80 46 27 78 0a d7 a5 a2 59 4a 96 24
14 50 54 ad ce 00 01 01 01 01 01 01 01 01 01 01
01 01 01 01 01 01 66 21 50 b0 51 00 1b 30 40 70
36 00 f8 c2 21 00 00 1e 0e 1f 00 80 51 00 1e 30
40 80 37 00 f8 c2 21 00 00 1c 00 00 00 fc 00 45
4c 45 46 54 33 32 36 0a 20 20 20 20 00 00 00 fd
00 32 4c 1e 41 0b 00 0a 20 20 20 20 20 20 01 88

02 03 2d f1 50 90 05 04 02 03 06 07 11 12 13 14
15 16 1f 01 20 26 09 07 07 15 07 24 83 01 00 00
6c 03 0c 00 30 00 00 2d c0 01 01 01 01 02 3a 80
18 71 38 2d 40 58 2c 45 00 70 ea 31 00 00 1e 01
1d 80 18 71 1c 16 20 58 2c 25 00 f4 19 11 00 00
9e 8c 0a d0 8a 20 e0 2d 10 10 3a 96 00 58 c2 21
00 00 18 8c 0a d0 8a 20 e0 2d 10 10 3e 96 00 20
c2 31 00 00 18 00 00 00 00 00 00 00 00 00 00 ba

----------------

Block 0, Base EDID:
  EDID Structure Version & Revision: 1.3
  Vendor & Product Identification:
    Manufacturer: ELE
    Model: 0
    Serial Number: ...
    Made in: week 26 of 2014
  Basic Display Parameters & Features:
    Digital display
    Maximum image size: 70 cm x 39 cm
    Gamma: 2.20
    RGB color display
    First detailed timing is the preferred timing
  Color Characteristics:
    Red  : 0.6357, 0.3486
    Green: 0.2900, 0.5888
    Blue : 0.1425, 0.0800
    White: 0.3134, 0.3291
  Established Timings I & II:
    IBM     :   720x400    70.081663 Hz   9:5     31.467 kHz     28.320000 MHz
    DMT 0x04:   640x480    59.940476 Hz   4:3     31.469 kHz     25.175000 MHz
    DMT 0x05:   640x480    72.808802 Hz   4:3     37.861 kHz     31.500000 MHz
    DMT 0x06:   640x480    75.000000 Hz   4:3     37.500 kHz     31.500000 MHz
    DMT 0x09:   800x600    60.316541 Hz   4:3     37.879 kHz     40.000000 MHz
    DMT 0x0a:   800x600    72.187572 Hz   4:3     48.077 kHz     50.000000 MHz
    DMT 0x0b:   800x600    75.000000 Hz   4:3     46.875 kHz     49.500000 MHz
    DMT 0x10:  1024x768    60.003840 Hz   4:3     48.363 kHz     65.000000 MHz
    DMT 0x11:  1024x768    70.069359 Hz   4:3     56.476 kHz     75.000000 MHz
    DMT 0x12:  1024x768    75.028582 Hz   4:3     60.023 kHz     78.750000 MHz
  Standard Timings: none
  Detailed Timing Descriptors:
    DTD  1:  1360x768    60.015162 Hz  85:48    47.712 kHz     85.500000 MHz (760 mm x 450 mm)
                  Hfront   64 Hsync 112 Hback  256 Hpol P
                  Vfront    3 Vsync   6 Vback   18 Vpol P
    DTD  2:  1280x768    59.870228 Hz   5:3     47.776 kHz     79.500000 MHz (760 mm x 450 mm)
                  Hfront   64 Hsync 128 Hback  192 Hpol N
                  Vfront    3 Vsync   7 Vback   20 Vpol P
    Display Product Name: 'ELEFT326'
    Display Range Limits:
      Monitor ranges (GTF): 50-76 Hz V, 30-65 kHz H, max dotclock 110 MHz
  Extension blocks: 1
Checksum: 0x88

----------------

Block 1, CTA-861 Extension Block:
  Revision: 3
  Underscans IT Video Formats by default
  Basic audio support
  Supports YCbCr 4:4:4
  Supports YCbCr 4:2:2
  Native detailed modes: 1
  Video Data Block:
    VIC  16:  1920x1080   60.000000 Hz  16:9     67.500 kHz    148.500000 MHz (native)
    VIC   5:  1920x1080i  60.000000 Hz  16:9     33.750 kHz     74.250000 MHz
    VIC   4:  1280x720    60.000000 Hz  16:9     45.000 kHz     74.250000 MHz
    VIC   2:   720x480    59.940060 Hz   4:3     31.469 kHz     27.000000 MHz
    VIC   3:   720x480    59.940060 Hz  16:9     31.469 kHz     27.000000 MHz
    VIC   6:  1440x480i   59.940060 Hz   4:3     15.734 kHz     27.000000 MHz
    VIC   7:  1440x480i   59.940060 Hz  16:9     15.734 kHz     27.000000 MHz
    VIC  17:   720x576    50.000000 Hz   4:3     31.250 kHz     27.000000 MHz
    VIC  18:   720x576    50.000000 Hz  16:9     31.250 kHz     27.000000 MHz
    VIC  19:  1280x720    50.000000 Hz  16:9     37.500 kHz     74.250000 MHz
    VIC  20:  1920x1080i  50.000000 Hz  16:9     28.125 kHz     74.250000 MHz
    VIC  21:  1440x576i   50.000000 Hz   4:3     15.625 kHz     27.000000 MHz
    VIC  22:  1440x576i   50.000000 Hz  16:9     15.625 kHz     27.000000 MHz
    VIC  31:  1920x1080   50.000000 Hz  16:9     56.250 kHz    148.500000 MHz
    VIC   1:   640x480    59.940476 Hz   4:3     31.469 kHz     25.175000 MHz
    VIC  32:  1920x1080   24.000000 Hz  16:9     27.000 kHz     74.250000 MHz
  Audio Data Block:
    Linear PCM:
      Max channels: 2
      Supported sample rates (kHz): 48 44.1 32
      Supported sample sizes (bits): 24 20 16
    AC-3:
      Max channels: 6
      Supported sample rates (kHz): 48 44.1 32
      Maximum bit rate: 288 kb/s
  Speaker Allocation Data Block:
    FL/FR - Front Left/Right
  Vendor-Specific Data Block (HDMI), OUI 00-0C-03:
    Source physical address: 3.0.0.0
    Maximum TMDS clock: 225 MHz
    Video latency: 0 ms
    Audio latency: 0 ms
    Interlaced video latency: 0 ms
    Interlaced audio latency: 0 ms
  Detailed Timing Descriptors:
    DTD  3:  1920x1080   60.000000 Hz  16:9     67.500 kHz    148.500000 MHz (880 mm x 490 mm)
                  Hfront   88 Hsync  44 Hback  148 Hpol P
                  Vfront    4 Vsync   5 Vback   36 Vpol P
    DTD  4:  1920x1080i  60.000000 Hz  16:9     33.750 kHz     74.250000 MHz (500 mm x 281 mm)
                  Hfront   88 Hsync  44 Hback  148 Hpol P
                  Vfront    2 Vsync   5 Vback   15 Vpol P Vfront +0.5 Odd Field
                  Vfront    2 Vsync   5 Vback   15 Vpol P Vback  +0.5 Even Field
    DTD  5:   720x480    59.940060 Hz   3:2     31.469 kHz     27.000000 MHz (600 mm x 450 mm)
                  Hfront   16 Hsync  58 Hback   64 Hpol N
                  Vfront    9 Vsync   6 Vback   30 Vpol N
    DTD  6:   720x480    59.940060 Hz   3:2     31.469 kHz     27.000000 MHz (800 mm x 450 mm)
                  Hfront   16 Hsync  62 Hback   60 Hpol N
                  Vfront    9 Vsync   6 Vback   30 Vpol N
Checksum: 0xba  Unused space in Extension Block: 10 bytes

----------------

Block 2, Unknown EDID Extension Block 0x00:
  00 ff ff ff ff ff ff 00 15 85 00 00 01 01 01 01 '................'
  1a 18 01 03 80 46 27 78 0a d7 a5 a2 59 4a 96 24 '.....F'x....YJ.$'
  14 50 54 ad ce 00 01 01 01 01 01 01 01 01 01 01 '.PT.............'
  01 01 01 01 01 01 66 21 50 b0 51 00 1b 30 40 70 '......f!P.Q..0@p'
  36 00 f8 c2 21 00 00 1e 0e 1f 00 80 51 00 1e 30 '6...!.......Q..0'
  40 80 37 00 f8 c2 21 00 00 1c 00 00 00 fc 00 45 '@.7...!........E'
  4c 45 46 54 33 32 36 0a 20 20 20 20 00 00 00 fd 'LEFT326.    ....'
  00 32 4c 1e 41 0b 00 0a 20 20 20 20 20 20 01 88 '.2L.A...      ..'
Checksum: 0x88

----------------

Block 3, CTA-861 Extension Block:
  Revision: 3
  Underscans IT Video Formats by default
  Basic audio support
  Supports YCbCr 4:4:4
  Supports YCbCr 4:2:2
  Native detailed modes: 1
  Video Data Block:
    VIC  16:  1920x1080   60.000000 Hz  16:9     67.500 kHz    148.500000 MHz (native)
    VIC   5:  1920x1080i  60.000000 Hz  16:9     33.750 kHz     74.250000 MHz
    VIC   4:  1280x720    60.000000 Hz  16:9     45.000 kHz     74.250000 MHz
    VIC   2:   720x480    59.940060 Hz   4:3     31.469 kHz     27.000000 MHz
    VIC   3:   720x480    59.940060 Hz  16:9     31.469 kHz     27.000000 MHz
    VIC   6:  1440x480i   59.940060 Hz   4:3     15.734 kHz     27.000000 MHz
    VIC   7:  1440x480i   59.940060 Hz  16:9     15.734 kHz     27.000000 MHz
    VIC  17:   720x576    50.000000 Hz   4:3     31.250 kHz     27.000000 MHz
    VIC  18:   720x576    50.000000 Hz  16:9     31.250 kHz     27.000000 MHz
    VIC  19:  1280x720    50.000000 Hz  16:9     37.500 kHz     74.250000 MHz
    VIC  20:  1920x1080i  50.000000 Hz  16:9     28.125 kHz     74.250000 MHz
    VIC  21:  1440x576i   50.000000 Hz   4:3     15.625 kHz     27.000000 MHz
    VIC  22:  1440x576i   50.000000 Hz  16:9     15.625 kHz     27.000000 MHz
    VIC  31:  1920x1080   50.000000 Hz  16:9     56.250 kHz    148.500000 MHz
    VIC   1:   640x480    59.940476 Hz   4:3     31.469 kHz     25.175000 MHz
    VIC  32:  1920x1080   24.000000 Hz  16:9     27.000 kHz     74.250000 MHz
  Audio Data Block:
    Linear PCM:
      Max channels: 2
      Supported sample rates (kHz): 48 44.1 32
      Supported sample sizes (bits): 24 20 16
    AC-3:
      Max channels: 6
      Supported sample rates (kHz): 48 44.1 32
      Maximum bit rate: 288 kb/s
  Speaker Allocation Data Block:
    FL/FR - Front Left/Right
  Vendor-Specific Data Block (HDMI), OUI 00-0C-03:
    Source physical address: 3.0.0.0
    Maximum TMDS clock: 225 MHz
    Video latency: 0 ms
    Audio latency: 0 ms
    Interlaced video latency: 0 ms
    Interlaced audio latency: 0 ms
  Detailed Timing Descriptors:
    DTD  7:  1920x1080   60.000000 Hz  16:9     67.500 kHz    148.500000 MHz (880 mm x 490 mm)
                  Hfront   88 Hsync  44 Hback  148 Hpol P
                  Vfront    4 Vsync   5 Vback   36 Vpol P
    DTD  8:  1920x1080i  60.000000 Hz  16:9     33.750 kHz     74.250000 MHz (500 mm x 281 mm)
                  Hfront   88 Hsync  44 Hback  148 Hpol P
                  Vfront    2 Vsync   5 Vback   15 Vpol P Vfront +0.5 Odd Field
                  Vfront    2 Vsync   5 Vback   15 Vpol P Vback  +0.5 Even Field
    DTD  9:   720x480    59.940060 Hz   3:2     31.469 kHz     27.000000 MHz (600 mm x 450 mm)
                  Hfront   16 Hsync  58 Hback   64 Hpol N
                  Vfront    9 Vsync   6 Vback   30 Vpol N
    DTD 10:   720x480    59.940060 Hz   3:2     31.469 kHz     27.000000 MHz (800 mm x 450 mm)
                  Hfront   16 Hsync  62 Hback   60 Hpol N
                  Vfront    9 Vsync   6 Vback   30 Vpol N
Checksum: 0xba  Unused space in Extension Block: 10 bytes

----------------

Warnings:

Block 0, Base EDID:
  Vendor & Product Identification: The serial number is one of the known dummy values, it should probably be set to 0.
  Detailed Timing Descriptor #1: Image size is 760x450 mm, but based on the picture AR it should be 760x429 mm.
Block 1, CTA-861 Extension Block:
  Video Data Block: VIC 16 and the first DTD are not identical. Is this intended?
  Vendor-Specific Data Block (HDMI), OUI 00-0C-03: Progressive and Interlaced latency values are identical, no need for both.
  Detailed Timing Descriptor #5: DTD is similar but not identical to VIC 2.
  Detailed Timing Descriptor #5: Image size is 600x450 mm, but based on the picture AR it should be 600x400 mm.
  Detailed Timing Descriptor #6: Image size is 800x450 mm, but based on the picture AR it should be 800x533 mm.
  Add a Colorimetry Data Block with the sRGB colorimetry bit set to avoid interop issues.
Block 3, CTA-861 Extension Block:
  Vendor-Specific Data Block (HDMI), OUI 00-0C-03: Progressive and Interlaced latency values are identical, no need for both.
  Detailed Timing Descriptor #9: DTD is similar but not identical to VIC 2.
  Detailed Timing Descriptor #9: Image size is 600x450 mm, but based on the picture AR it should be 600x400 mm.
  Detailed Timing Descriptor #10: Image size is 800x450 mm, but based on the picture AR it should be 800x533 mm.
EDID:
  Base EDID: Some timings are out of range of the Monitor Ranges:
    Vertical Freq: 24.000 - 75.029 Hz (Monitor: 50.000 - 76.000 Hz)
    Horizontal Freq: 15.625 - 67.500 kHz (Monitor: 30.000 - 65.000 kHz)
    Maximum Clock: 148.500 MHz (Monitor: 110.000 MHz)

Failures:

Block 0, Base EDID:
  Detailed Timing Descriptor #1: Mismatch of image size 760x450 mm vs display size 700x390 mm.
  Detailed Timing Descriptor #2: Mismatch of image size 760x450 mm vs display size 700x390 mm.
Block 1, CTA-861 Extension Block:
  Detailed Timing Descriptor #3: Mismatch of image size 880x490 mm vs display size 700x390 mm.
  Detailed Timing Descriptor #4: Mismatch of image size 500x281 mm vs display size 700x390 mm.
  Detailed Timing Descriptor #5: Mismatch of image size 600x450 mm vs display size 700x390 mm.
  Detailed Timing Descriptor #6: Mismatch of image size 800x450 mm vs display size 700x390 mm.
  Missing VCDB, needed for Set Selectable RGB Quantization to avoid interop issues.
Block 2, Base EDID:
  Unknown Extension Block.
Block 3, CTA-861 Extension Block:
  Video Data Block: Duplicate VIC 16.
  Video Data Block: Duplicate VIC 5.
  Video Data Block: Duplicate VIC 4.
  Video Data Block: Duplicate VIC 2.
  Video Data Block: Duplicate VIC 3.
  Video Data Block: Duplicate VIC 6.
  Video Data Block: Duplicate VIC 7.
  Video Data Block: Duplicate VIC 17.
  Video Data Block: Duplicate VIC 18.
  Video Data Block: Duplicate VIC 19.
  Video Data Block: Duplicate VIC 20.
  Video Data Block: Duplicate VIC 21.
  Video Data Block: Duplicate VIC 22.
  Video Data Block: Duplicate VIC 31.
  Video Data Block: Duplicate VIC 1.
  Video Data Block: Duplicate VIC 32.
  Speaker Allocation Data Block: Only one instance of this Data Block is allowed.
  Detailed Timing Descriptor #7: Mismatch of image size 880x490 mm vs display size 700x390 mm.
  Detailed Timing Descriptor #8: Mismatch of image size 500x281 mm vs display size 700x390 mm.
  Detailed Timing Descriptor #9: Mismatch of image size 600x450 mm vs display size 700x390 mm.
  Detailed Timing Descriptor #10: Mismatch of image size 800x450 mm vs display size 700x390 mm.
EDID:
  Base EDID: The DTD max image size is 880x490mm, which is larger than the display size 700.0x390.0mm.
  Base EDID: EDID specified 1 extension block(s), but found 3 extension block(s).
  Base EDID: EDID 1.3 requires a Block Map Extension in Block 1 if there are more than 2 blocks in the EDID.
  CTA-861: Native progressive timings are a mix of several resolutions.

EDID conformity: FAIL
