edid-decode (hex):

00 ff ff ff ff ff ff 00 06 af 9d 42 00 00 00 00
11 1c 01 04 a5 26 16 78 03 96 75 a3 56 52 9c 27
0c 50 54 00 00 00 01 01 01 01 01 01 01 01 01 01
01 01 01 01 01 01 40 38 80 b4 70 38 3e 40 10 10
3e 00 7e d7 10 00 00 18 40 38 80 b4 70 38 7a 42
10 10 3e 00 7e d7 10 00 00 18 00 00 00 fe 00 41
55 4f 0a 20 20 20 20 20 20 20 20 20 00 00 00 fe
00 42 31 37 33 48 41 4e 30 34 2e 32 20 0a 00 c6

----------------

Block 0, Base EDID:
  EDID Structure Version & Revision: 1.4
  Vendor & Product Identification:
    Manufacturer: AUO
    Model: 17053
    Made in: week 17 of 2018
  Basic Display Parameters & Features:
    Digital display
    Bits per primary color channel: 8
    DisplayPort interface
    Maximum image size: 38 cm x 22 cm
    Gamma: 2.20
    Supported color formats: RGB 4:4:4
    First detailed timing includes the native pixel format and preferred refresh rate
    Display supports continuous frequencies
  Color Characteristics:
    Red  : 0.6386, 0.3369
    Green: 0.3212, 0.6113
    Blue : 0.1533, 0.0498
    White: 0.3134, 0.3291
  Established Timings I & II: none
  Standard Timings: none
  Detailed Timing Descriptors:
    DTD 1:  1920x1080   60.045034 Hz  16:9     68.571 kHz    144.000000 MHz (382 mm x 215 mm)
                 Hfront   16 Hsync  16 Hback  148 Hpol N
                 Vfront    3 Vsync  14 Vback   45 Vpol N
    DTD 2:  1920x1080   40.006668 Hz  16:9     68.571 kHz    144.000000 MHz (382 mm x 215 mm)
                 Hfront   16 Hsync  16 Hback  148 Hpol N
                 Vfront    3 Vsync  14 Vback  617 Vpol N
    Alphanumeric Data String: 'AUO'
    Alphanumeric Data String: 'B173HAN04.2 '
Checksum: 0xc6

----------------

Warnings:

Block 0, Base EDID:
  Missing Display Product Name.

Failures:

Block 0, Base EDID:
  Alphanumeric Data String: One or more trailing spaces before newline.
  Missing Display Range Limits Descriptor.

EDID conformity: FAIL
