edid-decode (hex):

00 ff ff ff ff ff ff 00 22 0e 49 40 00 00 00 00
1d 1f 01 04 a5 3c 22 78 22 fe c5 a6 53 4a 98 25
0f 50 54 00 00 00 01 01 01 01 01 01 01 01 01 01
01 01 01 01 01 01 56 5e 00 a0 a0 a0 29 50 30 20
35 00 55 50 21 00 00 1e 00 00 00 ff 00 43 5a 43
32 33 39 38 47 56 44 20 0d 0a 00 00 00 fc 00 48
50 20 38 37 30 20 47 39 20 41 69 4f 00 00 00 03
00 28 39 fe 2b 3c 7a 43 39 88 7a 00 00 00 00 d9

00 ff ff ff ff ff ff 00 22 0e 49 40 00 00 00 00
1d 1f 01 04 a5 3c 22 78 22 fe c5 a6 53 4a 98 25
0f 50 54 00 00 00 01 01 01 01 01 01 01 01 01 01
01 01 01 01 01 01 56 5e 00 a0 a0 a0 29 50 30 20
35 00 55 50 21 00 00 1e 00 00 00 ff 00 43 5a 43
32 33 39 38 47 56 44 20 0d 0a 00 00 00 fc 00 48
50 20 38 37 30 20 47 39 20 41 69 4f 00 00 00 03
00 28 39 fe 2b 3c 7a 43 39 88 7a 00 00 00 00 d9

----------------

Block 0, Base EDID:
  EDID Structure Version & Revision: 1.4
  Vendor & Product Identification:
    Manufacturer: HPN
    Model: 16457
    Made in: week 29 of 2021
  Basic Display Parameters & Features:
    Digital display
    Bits per primary color channel: 8
    DisplayPort interface
    Maximum image size: 60 cm x 34 cm
    Gamma: 2.20
    DPMS levels: Off
    Supported color formats: RGB 4:4:4
    First detailed timing includes the native pixel format and preferred refresh rate
  Color Characteristics:
    Red  : 0.6513, 0.3271
    Green: 0.2919, 0.5957
    Blue : 0.1474, 0.0585
    White: 0.3134, 0.3291
  Established Timings I & II: none
  Standard Timings: none
  Detailed Timing Descriptors:
    DTD 1:  2560x1440   59.950550 Hz  16:9     88.787 kHz    241.500000 MHz (597 mm x 336 mm)
                 Hfront   48 Hsync  32 Hback   80 Hpol P
                 Vfront    3 Vsync   5 Vback   33 Vpol P
    Display Product Serial Number: ...
    Display Product Name: 'HP 870 G9 AiO'
    Manufacturer-Specified Display Descriptor (0x03): 00 03 00 28 39 fe 2b 3c 7a 43 39 88 7a 00 00 00 '...(9.+<zC9.z...'
Checksum: 0xd9

----------------

Warnings:

Block 0, Base EDID:
  Display Product Serial Number: ...

Failures:

EDID:
  Extension Block 1 started with EDID header, ignoring Extension Blocks >= 1.

EDID conformity: FAIL
