edid-decode (hex):

00 ff ff ff ff ff ff 00 0d ae a9 15 00 00 00 00
0a 15 01 04 90 22 13 78 02 00 25 9e 57 52 99 29
15 50 54 00 00 00 01 01 01 01 01 01 01 01 01 01
01 01 01 01 01 01 12 1b 56 6b 50 00 10 30 0f 1f
26 00 58 c2 10 00 00 1a e1 13 56 dc 50 00 22 30
41 2c 47 00 58 c2 10 00 00 1a 00 00 00 fe 00 35
33 44 43 33 80 31 35 36 42 47 45 0a 00 00 00 00
00 00 41 31 96 00 00 00 00 01 01 0a 20 20 00 f5

----------------

Block 0, Base EDID:
  EDID Structure Version & Revision: 1.4
  Vendor & Product Identification:
    Manufacturer: CMN
    Model: 5545
    Made in: week 10 of 2011
  Basic Display Parameters & Features:
    Digital display
    Bits per primary color channel: 6
    Digital interface is not defined
    Maximum image size: 34 cm x 19 cm
    Gamma: 2.20
    Supported color formats: RGB 4:4:4
    First detailed timing includes the native pixel format and preferred refresh rate
  Color Characteristics:
    Red  : 0.6171, 0.3398
    Green: 0.3203, 0.5976
    Blue : 0.1601, 0.0839
    White: 0.3134, 0.3291
  Established Timings I & II: none
  Standard Timings: none
  Detailed Timing Descriptors:
    DTD 1:  1366x768    60.008729 Hz 683:384   47.047 kHz     69.300000 MHz (344 mm x 194 mm)
                 Hfront   15 Hsync  31 Hback   61 Hpol P
                 Vfront    2 Vsync   6 Vback    8 Vpol N
    DTD 2:  1366x768    40.008742 Hz 683:384   32.087 kHz     50.890000 MHz (344 mm x 194 mm)
                 Hfront   65 Hsync  44 Hback  111 Hpol P
                 Vfront    4 Vsync   7 Vback   23 Vpol N
    Alphanumeric Data String: '53DC3.156BGE'
    Manufacturer-Specified Display Descriptor (0x00): 00 00 00 00 41 31 96 00 00 00 00 01 01 0a 20 20 '....A1........  '
Checksum: 0xf5

----------------

Warnings:

Block 0, Base EDID:
  Alphanumeric Data String: Non-ASCII character 0x80 at position 5, can cause problems.
  Missing Display Product Name.

EDID conformity: PASS
