edid-decode (hex):

00 ff ff ff ff ff ff 00 4c 2d cb 75 57 39 55 30
ff ff 01 04 b5 3c 22 78 3b 89 d1 b2 4c 3c b8 24
0e 50 54 21 08 00 81 c0 81 00 81 80 95 00 a9 c0
b3 00 01 01 01 01 14 d9 00 40 a1 a0 a8 50 80 20
3a 00 56 50 21 00 00 1a 00 00 00 fd 0e 30 69 ff
ff a7 01 0a 20 20 20 20 20 20 00 00 00 fc 00 4f
64 79 73 73 65 79 20 47 36 30 53 44 00 00 00 ff
00 48 4e 41 58 43 30 30 39 37 31 0a 20 20 02 69

02 03 37 f1 44 90 3f 04 03 23 09 07 07 83 01 00
00 e3 05 c0 00 74 1a 00 00 03 07 30 f0 00 a0 60
01 4b 02 68 01 00 00 00 00 00 e6 06 05 01 60 4b
00 e5 01 8b 84 90 39 8a 6c 00 40 a1 a0 a8 50 80
20 3a 00 56 50 21 00 00 1a 00 00 00 00 00 00 00
00 00 00 00 00 00 00 00 00 00 00 00 00 00 00 00
00 00 00 00 00 00 00 00 00 00 00 00 00 00 00 00
00 00 00 00 00 00 00 00 00 00 00 00 00 00 00 5f

70 12 79 03 00 03 01 64 13 d9 00 84 ff 09 3f 01
7f 80 1f 00 9f 05 a7 00 02 00 09 00 3c 8b 02 04
ff 09 3f 01 7f 80 1f 00 9f 05 a7 00 02 00 09 00
4e 6e 01 04 7f 07 ef 00 57 80 1f 00 37 04 7d 00
02 00 09 00 14 b2 01 04 ff 09 3f 01 7f 80 1f 00
9f 05 a7 00 02 00 09 00 23 f4 00 04 7f 07 ef 00
57 80 1f 00 37 04 7d 00 02 00 09 00 00 00 00 00
00 00 00 00 00 00 00 00 00 00 00 00 00 00 96 90

00 ff ff ff ff ff ff 00 4c 2d cb 75 57 39 55 30
ff ff 01 04 b5 3c 22 78 3b 89 d1 b2 4c 3c b8 24
0e 50 54 21 08 00 81 c0 81 00 81 80 95 00 a9 c0
b3 00 01 01 01 01 14 d9 00 40 a1 a0 a8 50 80 20
3a 00 56 50 21 00 00 1a 00 00 00 fd 0e 30 69 ff
ff a7 01 0a 20 20 20 20 20 20 00 00 00 fc 00 4f
64 79 73 73 65 79 20 47 36 30 53 44 00 00 00 ff
00 48 4e 41 58 43 30 30 39 37 31 0a 20 20 02 69

02 03 37 f1 44 90 3f 04 03 23 09 07 07 83 01 00
00 e3 05 c0 00 74 1a 00 00 03 07 30 f0 00 a0 60
01 4b 02 68 01 00 00 00 00 00 e6 06 05 01 60 4b
00 e5 01 8b 84 90 39 8a 6c 00 40 a1 a0 a8 50 80
20 3a 00 56 50 21 00 00 1a 00 00 00 00 00 00 00
00 00 00 00 00 00 00 00 00 00 00 00 00 00 00 00
00 00 00 00 00 00 00 00 00 00 00 00 00 00 00 00
00 00 00 00 00 00 00 00 00 00 00 00 00 00 00 5f

70 12 79 03 00 03 01 64 13 d9 00 84 ff 09 3f 01
7f 80 1f 00 9f 05 a7 00 02 00 09 00 3c 8b 02 04
ff 09 3f 01 7f 80 1f 00 9f 05 a7 00 02 00 09 00
4e 6e 01 04 7f 07 ef 00 57 80 1f 00 37 04 7d 00
02 00 09 00 14 b2 01 04 ff 09 3f 01 7f 80 1f 00
9f 05 a7 00 02 00 09 00 23 f4 00 04 7f 07 ef 00
57 80 1f 00 37 04 7d 00 02 00 09 00 00 00 00 00
00 00 00 00 00 00 00 00 00 00 00 00 00 00 96 90

----------------

Block 0, Base EDID:
  EDID Structure Version & Revision: 1.4
  Vendor & Product Identification:
    Manufacturer: SAM
    Model: 30155
    Serial Number: ...
    Model year: 2245
  Basic Display Parameters & Features:
    Digital display
    Bits per primary color channel: 10
    DisplayPort interface
    Maximum image size: 60 cm x 34 cm
    Gamma: 2.20
    DPMS levels: Off
    Supported color formats: RGB 4:4:4, YCrCb 4:4:4, YCrCb 4:2:2
    First detailed timing includes the native pixel format and preferred refresh rate
    Display supports continuous frequencies
  Color Characteristics:
    Red  : 0.6972, 0.2968
    Green: 0.2363, 0.7197
    Blue : 0.1435, 0.0556
    White: 0.3125, 0.3291
  Established Timings I & II:
    DMT 0x04:   640x480    59.940476 Hz   4:3     31.469 kHz     25.175000 MHz
    DMT 0x09:   800x600    60.316541 Hz   4:3     37.879 kHz     40.000000 MHz
    DMT 0x10:  1024x768    60.003840 Hz   4:3     48.363 kHz     65.000000 MHz
  Standard Timings:
    DMT 0x55:  1280x720    60.000000 Hz  16:9     45.000 kHz     74.250000 MHz
    DMT 0x1c:  1280x800    59.810326 Hz  16:10    49.702 kHz     83.500000 MHz
    DMT 0x23:  1280x1024   60.019740 Hz   5:4     63.981 kHz    108.000000 MHz
    DMT 0x2f:  1440x900    59.887445 Hz  16:10    55.935 kHz    106.500000 MHz
    DMT 0x53:  1600x900    60.000000 Hz  16:9     60.000 kHz    108.000000 MHz (RB)
    DMT 0x3a:  1680x1050   59.954250 Hz  16:10    65.290 kHz    146.250000 MHz
  Detailed Timing Descriptors:
    DTD 1:  2560x1440  119.998964 Hz  16:9    192.958 kHz    555.720000 MHz (598 mm x 336 mm)
                 Hfront  128 Hsync  32 Hback  160 Hpol P
                 Vfront    3 Vsync  10 Vback  155 Vpol N
    Display Range Limits:
      Monitor ranges (Range Limits Only): 48-360 Hz V, 510-510 kHz H, max dotclock 1670 MHz
    Display Product Name: 'Odyssey G60SD'
    Display Product Serial Number: ...
  Extension blocks: 2
Checksum: 0x69

----------------

Block 1, CTA-861 Extension Block:
  Revision: 3
  Underscans IT Video Formats by default
  Basic audio support
  Supports YCbCr 4:4:4
  Supports YCbCr 4:2:2
  Native DTDs: 1
  Video Data Block:
    VIC  16:  1920x1080   60.000000 Hz  16:9     67.500 kHz    148.500000 MHz (native)
    VIC  63:  1920x1080  120.000000 Hz  16:9    135.000 kHz    297.000000 MHz
    VIC   4:  1280x720    60.000000 Hz  16:9     45.000 kHz     74.250000 MHz
    VIC   3:   720x480    59.940060 Hz  16:9     31.469 kHz     27.000000 MHz
  Audio Data Block:
    Linear PCM:
      Max channels: 2
      Supported sample rates (kHz): 48 44.1 32
      Supported sample sizes (bits): 24 20 16
  Speaker Allocation Data Block:
    FL/FR - Front Left/Right
  Colorimetry Data Block:
    BT2020YCC
    BT2020RGB
  Vendor-Specific Data Block (AMD), OUI 00-00-1A:
    Version: 3
    Flags 1: 0x07
      FreeSync Supported
      FreeSync 2 HDR Supported
    Minimum Refresh Rate: 48 Hz
    Maximum Refresh Rate: 360 Hz
    Flags 5: 0xa0
      Display is OLED
      ST 2084 (PQ) EOTF Supported
    Maximum luminance: 96 (400.000 cd/m^2)
    Minimum luminance: 1 (0.000 cd/m^2)
    Maximum luminance (without local dimming): 75 (253.810 cd/m^2)
    Minimum luminance (without local dimming): 2 (0.000 cd/m^2)
  HDR Static Metadata Data Block:
    Electro optical transfer functions:
      Traditional gamma - SDR luminance range
      SMPTE ST2084
    Supported static metadata descriptors:
      Static metadata type 1
    Desired content max luminance: 96 (400.000 cd/m^2)
    Desired content max frame-average luminance: 75 (253.810 cd/m^2)
    Desired content min luminance: 0 (0.000 cd/m^2)
  Vendor-Specific Video Data Block (HDR10+), OUI 90-84-8B:
    Application Version: 1
    Full Frame Peak Luminance Index: 2
    Peak Luminance Index: 3
  Detailed Timing Descriptors:
    DTD 2:  2560x1440   59.999482 Hz  16:9     96.479 kHz    277.860000 MHz (598 mm x 336 mm)
                 Hfront  128 Hsync  32 Hback  160 Hpol P
                 Vfront    3 Vsync  10 Vback  155 Vpol N
Checksum: 0x5f  Unused space in Extension Block: 54 bytes

----------------

Block 2, DisplayID Extension Block:
  Version: 1.2
  Extension Count: 0
  Display Product Type: Standalone display device
  Video Timing Modes Type 1 - Detailed Timings Data Block:
    DTD:  2560x1440  119.998964 Hz  16:9    192.958 kHz    555.720000 MHz (aspect 16:9, no 3D stereo, preferred)
               Hfront  128 Hsync  32 Hback  160 Hpol P
               Vfront    3 Vsync  10 Vback  155 Vpol N
    DTD:  2560x1440  359.999050 Hz  16:9    578.878 kHz   1667.170000 MHz (aspect 16:9, no 3D stereo)
               Hfront  128 Hsync  32 Hback  160 Hpol P
               Vfront    3 Vsync  10 Vback  155 Vpol N
    DTD:  1920x1080  359.986334 Hz  16:9    434.144 kHz    937.750000 MHz (aspect 16:9, no 3D stereo)
               Hfront   88 Hsync  32 Hback  120 Hpol P
               Vfront    3 Vsync  10 Vback  113 Vpol N
    DTD:  2560x1440  239.956900 Hz  16:9    385.851 kHz   1111.250000 MHz (aspect 16:9, no 3D stereo)
               Hfront  128 Hsync  32 Hback  160 Hpol P
               Vfront    3 Vsync  10 Vback  155 Vpol N
    DTD:  1920x1080  239.926909 Hz  16:9    289.352 kHz    625.000000 MHz (aspect 16:9, no 3D stereo)
               Hfront   88 Hsync  32 Hback  120 Hpol P
               Vfront    3 Vsync  10 Vback  113 Vpol N
  Checksum: 0x96
Checksum: 0x90

----------------

Warnings:

Block 1, CTA-861 Extension Block:
  Video Data Block: VIC 16 and the first DTD are not identical. Is this intended?
  Colorimetry Data Block: Set the sRGB colorimetry bit to avoid interop issues.
  Display Product Serial Number is set, so the Serial Number in the Base EDID should be 0.
EDID:
  Base EDID: Some timings are out of range of the Monitor Ranges:
    Horizontal Freq: 31.468 - 578.878 kHz (Monitor: 510.000 - 510.000 kHz)

Failures:

Block 0, Base EDID:
  Vendor & Product Identification: The year is more than one year in the future.
Block 1, CTA-861 Extension Block:
  Missing VCDB, needed for Set Selectable RGB Quantization to avoid interop issues.
EDID:
  Extension Block 3 started with EDID header, ignoring Extension Blocks >= 3.
  CTA-861: Native progressive timings are a mix of several resolutions.
  DisplayID: Missing DisplayID Display Parameters Data Block.

EDID conformity: FAIL
