edid-decode (hex):

00 ff ff ff ff ff ff 00 4c a3 45 42 00 00 00 00
00 15 01 03 80 1d 10 78 0a 4f 35 8f 57 55 90 29
1e 50 54 00 00 00 01 01 01 01 01 01 01 01 01 01
01 01 01 01 01 01 bc 1b 56 80 50 00 19 30 30 20
55 00 25 a5 10 00 00 19 00 00 00 0f 00 00 00 00
00 00 00 00 00 23 5c 02 67 00 00 00 00 fe 00 53
41 4d 53 55 4e 47 0a 20 20 20 20 20 00 00 00 fe
00 31 33 33 41 54 32 37 2d 54 30 31 0a 20 00 c4

00 ff ff ff ff ff ff 00 4c a3 45 42 00 00 00 00
00 15 01 03 80 1d 10 78 0a 4f 35 8f 57 55 90 29
1e 50 54 00 00 00 01 01 01 01 01 01 01 01 01 01
01 01 01 01 01 01 bc 1b 56 80 50 00 19 30 30 20
55 00 25 a5 10 00 00 19 00 00 00 0f 00 00 00 00
00 00 00 00 00 23 5c 02 67 00 00 00 00 fe 00 53
41 4d 53 55 4e 47 0a 20 20 20 20 20 00 00 00 fe
00 31 33 33 41 54 32 37 2d 54 30 31 0a 20 00 c4

----------------

Block 0, Base EDID:
  EDID Structure Version & Revision: 1.3
  Vendor & Product Identification:
    Manufacturer: SEC
    Model: 16965
    Made in: 2011
  Basic Display Parameters & Features:
    Digital display
    Maximum image size: 29 cm x 16 cm
    Gamma: 2.20
    RGB color display
    First detailed timing is the preferred timing
  Color Characteristics:
    Red  : 0.5595, 0.3398
    Green: 0.3349, 0.5654
    Blue : 0.1601, 0.1201
    White: 0.3134, 0.3291
  Established Timings I & II: none
  Standard Timings: none
  Detailed Timing Descriptors:
    DTD 1:  1366x768    59.928660 Hz 683:384   47.523 kHz     71.000000 MHz (293 mm x 165 mm)
                 Hfront   48 Hsync  32 Hback   48 Hpol N
                 Vfront    5 Vsync   5 Vback   15 Vpol N
    Manufacturer-Specified Display Descriptor (0x0f): 00 0f 00 00 00 00 00 00 00 00 00 23 5c 02 67 00 '...........#\.g.'
    Alphanumeric Data String: 'SAMSUNG'
    Alphanumeric Data String: '133AT27-T01'
Checksum: 0xc4

----------------

Failures:

Block 0, Base EDID:
  Missing Display Product Name.
  Missing Display Range Limits Descriptor.
EDID:
  Extension Block 1 started with EDID header, ignoring Extension Blocks >= 1.

EDID conformity: FAIL
