edid-decode (hex):

00 ff ff ff ff ff ff 00 4c 2e 9a 30 3e 59 3f 1e
12 16 01 03 80 2f 1c 78 22 35 81 a6 56 48 9a 24
12 50 54 af cf 00 81 00 81 40 81 80 95 00 a9 40
b3 00 81 c0 01 01 02 3a 80 18 71 38 2d 40 58 2c
45 00 dd 0c 11 00 00 1e 79 2e 40 10 62 84 20 30
70 98 13 00 bb f9 10 00 00 1c 00 00 00 fd 00 38
4b 1e 5f 11 00 0a 20 20 20 20 20 20 00 00 00 fc
00 43 61 73 70 65 72 0a 20 20 20 20 20 20 01 aa

02 03 1a f1 45 90 04 01 03 02 23 09 07 07 83 01
00 00 67 03 0c 00 10 00 18 2d 02 3a 80 18 71 38
2d 40 58 2c 45 00 e0 0e 11 00 00 1e 01 1d 00 72
51 d0 1e 20 6e 28 55 00 a0 5a 00 00 00 1e 8c 0a
d0 8a 20 e0 2d 10 10 3e 96 00 a0 5a 00 00 00 18
00 00 00 00 00 00 00 00 00 00 00 00 00 00 00 00
00 00 00 00 00 00 00 00 00 00 00 00 00 00 00 00
00 00 00 00 00 00 00 00 00 00 00 00 00 00 00 a3

00 ff ff ff ff ff ff 00 4c 2e 9a 30 3e 59 3f 1e
12 16 01 03 80 2f 1c 78 22 35 81 a6 56 48 9a 24
12 50 54 af cf 00 81 00 81 40 81 80 95 00 a9 40
b3 00 81 c0 01 01 02 3a 80 18 71 38 2d 40 58 2c
45 00 dd 0c 11 00 00 1e 79 2e 40 10 62 84 20 30
70 98 13 00 bb f9 10 00 00 1c 00 00 00 fd 00 38
4b 1e 5f 11 00 0a 20 20 20 20 20 20 00 00 00 fc
00 43 61 73 70 65 72 0a 20 20 20 20 20 20 01 aa

02 03 1a f1 45 90 04 01 03 02 23 09 07 07 83 01
00 00 67 03 0c 00 10 00 18 2d 02 3a 80 18 71 38
2d 40 58 2c 45 00 e0 0e 11 00 00 1e 01 1d 00 72
51 d0 1e 20 6e 28 55 00 a0 5a 00 00 00 1e 8c 0a
d0 8a 20 e0 2d 10 10 3e 96 00 a0 5a 00 00 00 18
00 00 00 00 00 00 00 00 00 00 00 00 00 00 00 00
00 00 00 00 00 00 00 00 00 00 00 00 00 00 00 00
00 00 00 00 00 00 00 00 00 00 00 00 00 00 00 a3

----------------

Block 0, Base EDID:
  EDID Structure Version & Revision: 1.3
  Vendor & Product Identification:
    Manufacturer: SAN
    Model: 12442
    Serial Number: ...
    Made in: week 18 of 2012
  Basic Display Parameters & Features:
    Digital display
    Maximum image size: 47 cm x 28 cm
    Gamma: 2.20
    DPMS levels: Off
    Monochrome or grayscale display
    First detailed timing is the preferred timing
  Color Characteristics:
    Red  : 0.6484, 0.3388
    Green: 0.2822, 0.6025
    Blue : 0.1425, 0.0703
    White: 0.3125, 0.3291
  Established Timings I & II:
    IBM     :   720x400    70.081663 Hz   9:5     31.467 kHz     28.320000 MHz
    DMT 0x04:   640x480    59.940476 Hz   4:3     31.469 kHz     25.175000 MHz
    DMT 0x05:   640x480    72.808802 Hz   4:3     37.861 kHz     31.500000 MHz
    DMT 0x06:   640x480    75.000000 Hz   4:3     37.500 kHz     31.500000 MHz
    DMT 0x08:   800x600    56.250000 Hz   4:3     35.156 kHz     36.000000 MHz
    DMT 0x09:   800x600    60.316541 Hz   4:3     37.879 kHz     40.000000 MHz
    DMT 0x0a:   800x600    72.187572 Hz   4:3     48.077 kHz     50.000000 MHz
    DMT 0x0b:   800x600    75.000000 Hz   4:3     46.875 kHz     49.500000 MHz
    DMT 0x10:  1024x768    60.003840 Hz   4:3     48.363 kHz     65.000000 MHz
    DMT 0x11:  1024x768    70.069359 Hz   4:3     56.476 kHz     75.000000 MHz
    DMT 0x12:  1024x768    75.028582 Hz   4:3     60.023 kHz     78.750000 MHz
    DMT 0x24:  1280x1024   75.024675 Hz   5:4     79.976 kHz    135.000000 MHz
  Standard Timings:
    DMT 0x1c:  1280x800    59.810326 Hz  16:10    49.702 kHz     83.500000 MHz
    DMT 0x20:  1280x960    60.000000 Hz   4:3     60.000 kHz    108.000000 MHz
    DMT 0x23:  1280x1024   60.019740 Hz   5:4     63.981 kHz    108.000000 MHz
    DMT 0x2f:  1440x900    59.887445 Hz  16:10    55.935 kHz    106.500000 MHz
    DMT 0x33:  1600x1200   60.000000 Hz   4:3     75.000 kHz    162.000000 MHz
    DMT 0x3a:  1680x1050   59.954250 Hz  16:10    65.290 kHz    146.250000 MHz
    DMT 0x55:  1280x720    60.000000 Hz  16:9     45.000 kHz     74.250000 MHz
  Detailed Timing Descriptors:
    DTD 1:  1920x1080   60.000000 Hz  16:9     67.500 kHz    148.500000 MHz (477 mm x 268 mm)
                 Hfront   88 Hsync  44 Hback  148 Hpol P
                 Vfront    4 Vsync   5 Vback   36 Vpol P
    DTD 2:  1600x900    59.986003 Hz  16:9     55.907 kHz    118.970000 MHz (443 mm x 249 mm)
                 Hfront  112 Hsync 152 Hback  264 Hpol N
                 Vfront    1 Vsync   3 Vback   28 Vpol P
    Display Range Limits:
      Monitor ranges (GTF): 56-75 Hz V, 30-95 kHz H, max dotclock 170 MHz
    Display Product Name: 'Casper'
  Extension blocks: 1
Checksum: 0xaa

----------------

Block 1, CTA-861 Extension Block:
  Revision: 3
  Underscans IT Video Formats by default
  Basic audio support
  Supports YCbCr 4:4:4
  Supports YCbCr 4:2:2
  Native DTDs: 1
  Video Data Block:
    VIC  16:  1920x1080   60.000000 Hz  16:9     67.500 kHz    148.500000 MHz (native)
    VIC   4:  1280x720    60.000000 Hz  16:9     45.000 kHz     74.250000 MHz
    VIC   1:   640x480    59.940476 Hz   4:3     31.469 kHz     25.175000 MHz
    VIC   3:   720x480    59.940060 Hz  16:9     31.469 kHz     27.000000 MHz
    VIC   2:   720x480    59.940060 Hz   4:3     31.469 kHz     27.000000 MHz
  Audio Data Block:
    Linear PCM:
      Max channels: 2
      Supported sample rates (kHz): 48 44.1 32
      Supported sample sizes (bits): 24 20 16
  Speaker Allocation Data Block:
    FL/FR - Front Left/Right
  Vendor-Specific Data Block (HDMI), OUI 00-0C-03:
    Source physical address: 1.0.0.0
    DC_30bit
    DC_Y444
    Maximum TMDS clock: 225 MHz
  Detailed Timing Descriptors:
    DTD 3:  1920x1080   60.000000 Hz  16:9     67.500 kHz    148.500000 MHz (480 mm x 270 mm)
                 Hfront   88 Hsync  44 Hback  148 Hpol P
                 Vfront    4 Vsync   5 Vback   36 Vpol P
    DTD 4:  1280x720    60.000000 Hz  16:9     45.000 kHz     74.250000 MHz (160 mm x 90 mm)
                 Hfront  110 Hsync  40 Hback  220 Hpol P
                 Vfront    5 Vsync   5 Vback   20 Vpol P
    DTD 5:   720x480    59.940060 Hz   3:2     31.469 kHz     27.000000 MHz (160 mm x 90 mm)
                 Hfront   16 Hsync  62 Hback   60 Hpol N
                 Vfront    9 Vsync   6 Vback   30 Vpol N
Checksum: 0xa3  Unused space in Extension Block: 47 bytes

----------------

Warnings:

Block 1, CTA-861 Extension Block:
  Detailed Timing Descriptor #4: Dubious image size (160x90 mm is smaller than 100x100 mm).
  Detailed Timing Descriptor #5: Dubious image size (160x90 mm is smaller than 100x100 mm).
  Add a Colorimetry Data Block with the sRGB colorimetry bit set to avoid interop issues.

Failures:

Block 0, Base EDID:
  Detailed Timing Descriptor #2: Mismatch of image size 443x249 mm vs display size 470x280 mm.
Block 1, CTA-861 Extension Block:
  Detailed Timing Descriptor #3: Mismatch of image size 480x270 mm vs display size 470x280 mm.
  Detailed Timing Descriptor #4: Mismatch of image size 160x90 mm vs display size 470x280 mm.
  Detailed Timing Descriptor #5: Mismatch of image size 160x90 mm vs display size 470x280 mm.
  Missing VCDB, needed for Set Selectable RGB Quantization to avoid interop issues.
EDID:
  Extension Block 2 started with EDID header, ignoring Extension Blocks >= 2.
  Base EDID: The DTD max image size is 480x270mm, which is larger than the display size 470.0x280.0mm.

EDID conformity: FAIL
