edid-decode (hex):

00 ff ff ff ff ff ff 00 4c 2e 9a 30 3e 59 3f 1e
2f 14 01 03 80 2f 1c 78 22 35 81 a6 56 48 9a 24
12 50 54 23 08 00 81 00 81 40 81 80 95 00 a9 40
b3 00 01 01 01 01 02 3a 80 18 71 38 2d 40 58 2c
45 00 dd 0c 11 00 00 1e 79 2e 40 10 62 84 20 30
70 98 13 00 bb f9 10 00 00 1c 00 00 00 fd 00 38
4b 1e 5f 12 00 0a 20 20 20 20 20 20 00 00 00 fc
00 4c 45 44 20 4d 4f 4e 49 54 4f 52 0a 20 01 01

02 03 1c 71 47 02 11 13 84 1f 10 03 23 09 7f 07
83 01 00 00 67 03 0c 00 10 00 00 28 66 21 50 b0
51 00 1b 30 40 70 36 00 0f 48 42 00 00 1e 66 21
56 aa 51 00 1e 30 46 8f 33 00 0f 48 42 00 00 1e
8c 0a d0 8a 20 e0 2d 10 10 3e 96 00 10 09 00 00
00 18 00 00 00 00 00 00 00 00 00 00 00 00 00 00
00 00 00 00 00 00 00 00 00 00 00 00 00 00 00 00
00 00 00 00 00 00 00 00 00 00 00 00 00 00 00 80

00 ff ff ff ff ff ff 00 4c 2e 9a 30 3e 59 3f 1e
2f 14 01 03 80 2f 1c 78 22 35 81 a6 56 48 9a 24
12 50 54 23 08 00 81 00 81 40 81 80 95 00 a9 40
b3 00 01 01 01 01 02 3a 80 18 71 38 2d 40 58 2c
45 00 dd 0c 11 00 00 1e 79 2e 40 10 62 84 20 30
70 98 13 00 bb f9 10 00 00 1c 00 00 00 fd 00 38
4b 1e 5f 12 00 0a 20 20 20 20 20 20 00 00 00 fc
00 4c 45 44 20 4d 4f 4e 49 54 4f 52 0a 20 01 01

02 03 1c 71 47 02 11 13 84 1f 10 03 23 09 7f 07
83 01 00 00 67 03 0c 00 10 00 00 28 66 21 50 b0
51 00 1b 30 40 70 36 00 0f 48 42 00 00 1e 66 21
56 aa 51 00 1e 30 46 8f 33 00 0f 48 42 00 00 1e
8c 0a d0 8a 20 e0 2d 10 10 3e 96 00 10 09 00 00
00 18 00 00 00 00 00 00 00 00 00 00 00 00 00 00
00 00 00 00 00 00 00 00 00 00 00 00 00 00 00 00
00 00 00 00 00 00 00 00 00 00 00 00 00 00 00 80

----------------

Block 0, Base EDID:
  EDID Structure Version & Revision: 1.3
  Vendor & Product Identification:
    Manufacturer: SAN
    Model: 12442
    Serial Number: ...
    Made in: week 47 of 2010
  Basic Display Parameters & Features:
    Digital display
    Maximum image size: 47 cm x 28 cm
    Gamma: 2.20
    DPMS levels: Off
    Monochrome or grayscale display
    First detailed timing is the preferred timing
  Color Characteristics:
    Red  : 0.6484, 0.3388
    Green: 0.2822, 0.6025
    Blue : 0.1425, 0.0703
    White: 0.3125, 0.3291
  Established Timings I & II:
    DMT 0x04:   640x480    59.940476 Hz   4:3     31.469 kHz     25.175000 MHz
    DMT 0x08:   800x600    56.250000 Hz   4:3     35.156 kHz     36.000000 MHz
    DMT 0x09:   800x600    60.316541 Hz   4:3     37.879 kHz     40.000000 MHz
    DMT 0x10:  1024x768    60.003840 Hz   4:3     48.363 kHz     65.000000 MHz
  Standard Timings:
    DMT 0x1c:  1280x800    59.810326 Hz  16:10    49.702 kHz     83.500000 MHz
    DMT 0x20:  1280x960    60.000000 Hz   4:3     60.000 kHz    108.000000 MHz
    DMT 0x23:  1280x1024   60.019740 Hz   5:4     63.981 kHz    108.000000 MHz
    DMT 0x2f:  1440x900    59.887445 Hz  16:10    55.935 kHz    106.500000 MHz
    DMT 0x33:  1600x1200   60.000000 Hz   4:3     75.000 kHz    162.000000 MHz
    DMT 0x3a:  1680x1050   59.954250 Hz  16:10    65.290 kHz    146.250000 MHz
  Detailed Timing Descriptors:
    DTD 1:  1920x1080   60.000000 Hz  16:9     67.500 kHz    148.500000 MHz (477 mm x 268 mm)
                 Hfront   88 Hsync  44 Hback  148 Hpol P
                 Vfront    4 Vsync   5 Vback   36 Vpol P
    DTD 2:  1600x900    59.986003 Hz  16:9     55.907 kHz    118.970000 MHz (443 mm x 249 mm)
                 Hfront  112 Hsync 152 Hback  264 Hpol N
                 Vfront    1 Vsync   3 Vback   28 Vpol P
    Display Range Limits:
      Monitor ranges (GTF): 56-75 Hz V, 30-95 kHz H, max dotclock 180 MHz
    Display Product Name: 'LED MONITOR'
  Extension blocks: 1
Checksum: 0x01

----------------

Block 1, CTA-861 Extension Block:
  Revision: 3
  Basic audio support
  Supports YCbCr 4:4:4
  Supports YCbCr 4:2:2
  Native DTDs: 1
  Video Data Block:
    VIC   2:   720x480    59.940060 Hz   4:3     31.469 kHz     27.000000 MHz
    VIC  17:   720x576    50.000000 Hz   4:3     31.250 kHz     27.000000 MHz
    VIC  19:  1280x720    50.000000 Hz  16:9     37.500 kHz     74.250000 MHz
    VIC   4:  1280x720    60.000000 Hz  16:9     45.000 kHz     74.250000 MHz (native)
    VIC  31:  1920x1080   50.000000 Hz  16:9     56.250 kHz    148.500000 MHz
    VIC  16:  1920x1080   60.000000 Hz  16:9     67.500 kHz    148.500000 MHz
    VIC   3:   720x480    59.940060 Hz  16:9     31.469 kHz     27.000000 MHz
  Audio Data Block:
    Linear PCM:
      Max channels: 2
      Supported sample rates (kHz): 192 176.4 96 88.2 48 44.1 32
      Supported sample sizes (bits): 24 20 16
  Speaker Allocation Data Block:
    FL/FR - Front Left/Right
  Vendor-Specific Data Block (HDMI), OUI 00-0C-03:
    Source physical address: 1.0.0.0
    Maximum TMDS clock: 200 MHz
  Detailed Timing Descriptors:
    DTD 3:  1360x768    60.015162 Hz  85:48    47.712 kHz     85.500000 MHz (1039 mm x 584 mm)
                 Hfront   64 Hsync 112 Hback  256 Hpol P
                 Vfront    3 Vsync   6 Vback   18 Vpol P
    DTD 4:  1366x768    59.789541 Hz 683:384   47.712 kHz     85.500000 MHz (1039 mm x 584 mm)
                 Hfront   70 Hsync 143 Hback  213 Hpol P
                 Vfront    3 Vsync   3 Vback   24 Vpol P
    DTD 5:   720x480    59.940060 Hz   3:2     31.469 kHz     27.000000 MHz (16 mm x 9 mm)
                 Hfront   16 Hsync  62 Hback   60 Hpol N
                 Vfront    9 Vsync   6 Vback   30 Vpol N
Checksum: 0x80  Unused space in Extension Block: 45 bytes

----------------

Warnings:

Block 1, CTA-861 Extension Block:
  IT Video Formats are overscanned by default, but normally this should be underscanned.
  Video Data Block: VIC 2 and the first DTD are not identical. Is this intended?
  Detailed Timing Descriptor #5: Dubious image size (16x9 mm is smaller than 100x100 mm).
  Add a Colorimetry Data Block with the sRGB colorimetry bit set to avoid interop issues.
EDID:
  Base EDID: Some timings are out of range of the Monitor Ranges:
    Vertical Freq: 50.000 - 60.317 Hz (Monitor: 56.000 - 75.000 Hz)

Failures:

Block 0, Base EDID:
  Detailed Timing Descriptor #2: Mismatch of image size 443x249 mm vs display size 470x280 mm.
Block 1, CTA-861 Extension Block:
  Detailed Timing Descriptor #3: Mismatch of image size 1039x584 mm vs display size 470x280 mm.
  Detailed Timing Descriptor #4: Mismatch of image size 1039x584 mm vs display size 470x280 mm.
  Detailed Timing Descriptor #5: Mismatch of image size 16x9 mm vs display size 470x280 mm.
  Missing VCDB, needed for Set Selectable RGB Quantization to avoid interop issues.
EDID:
  Extension Block 2 started with EDID header, ignoring Extension Blocks >= 2.
  Base EDID: The DTD max image size is 1039x584mm, which is larger than the display size 470.0x280.0mm.
  CTA-861: Native progressive timings are a mix of several resolutions.

EDID conformity: FAIL
