edid-decode (hex):

00 ff ff ff ff ff ff 00 09 e5 95 0a 00 00 00 00
1e 1f 01 04 95 1f 11 78 02 3a d5 95 5c 55 8e 27
1d 50 54 00 00 00 01 01 01 01 01 01 01 01 01 01
01 01 01 01 01 01 2a 36 80 a0 70 38 1f 40 30 20
35 00 35 ae 10 00 00 1a 52 2b 80 a0 70 38 1f 40
30 20 35 00 35 ae 10 00 00 1a 00 00 00 fe 00 56
46 30 54 39 80 4e 45 31 34 30 46 48 00 00 00 00
00 00 41 21 99 00 11 00 00 0a 01 0a 20 20 00 e0

----------------

Block 0, Base EDID:
  EDID Structure Version & Revision: 1.4
  Vendor & Product Identification:
    Manufacturer: BOE
    Model: 2709
    Made in: week 30 of 2021
  Basic Display Parameters & Features:
    Digital display
    Bits per primary color channel: 6
    DisplayPort interface
    Maximum image size: 31 cm x 17 cm
    Gamma: 2.20
    Supported color formats: RGB 4:4:4
    First detailed timing includes the native pixel format and preferred refresh rate
  Color Characteristics:
    Red  : 0.5820, 0.3623
    Green: 0.3339, 0.5566
    Blue : 0.1552, 0.1142
    White: 0.3134, 0.3291
  Established Timings I & II: none
  Standard Timings: none
  Detailed Timing Descriptors:
    DTD 1:  1920x1080   60.003116 Hz  16:9     66.663 kHz    138.660000 MHz (309 mm x 174 mm)
                 Hfront   48 Hsync  32 Hback   80 Hpol P
                 Vfront    3 Vsync   5 Vback   23 Vpol N
    DTD 2:  1920x1080   47.990376 Hz  16:9     53.317 kHz    110.900000 MHz (309 mm x 174 mm)
                 Hfront   48 Hsync  32 Hback   80 Hpol P
                 Vfront    3 Vsync   5 Vback   23 Vpol N
    Alphanumeric Data String: 'VF0T9.NE140FH'
    Manufacturer-Specified Display Descriptor (0x00): 00 00 00 00 41 21 99 00 11 00 00 0a 01 0a 20 20 '....A!........  '
Checksum: 0xe0

----------------

Warnings:

Block 0, Base EDID:
  Alphanumeric Data String: Non-ASCII character 0x80 at position 5, can cause problems.
  Missing Display Product Name.

EDID conformity: PASS
