edid-decode (hex):

00 ff ff ff ff ff ff 00 5c 2d 80 23 00 00 00 00
03 20 01 03 80 35 1d 78 ca 4e c0 a6 55 50 9c 26
11 50 54 af cf 00 81 c0 81 40 81 80 90 40 a9 c0
95 00 b3 00 01 01 02 3a 80 18 71 38 2d 40 58 2c
45 00 12 22 21 00 00 1e 00 00 00 fd 00 30 4b 1e
55 12 00 0a 20 20 20 20 20 20 00 00 00 ff 00 30
30 30 30 30 30 30 30 30 30 30 30 30 00 00 00 fc
00 51 4d 32 34 44 46 49 0a 20 20 20 20 20 01 f1

02 03 2c f1 4a 90 00 04 03 02 00 00 13 12 11 23
09 7f 07 83 01 00 00 67 03 0c 00 10 00 38 2d 68
1a 00 00 01 01 30 4b ed e3 0f 01 00 31 44 80 a0
70 38 27 40 30 20 35 00 55 50 21 00 00 1e 01 1d
00 72 51 d0 1e 20 6e 28 55 00 55 50 21 00 00 1e
8c 0a d0 8a 20 e0 2d 10 10 3e 96 00 55 50 21 00
00 18 00 00 00 00 00 00 00 00 00 00 00 00 00 00
00 00 00 00 00 00 00 00 00 00 00 00 00 00 00 0b

00 ff ff ff ff ff ff 00 5c 2d 80 23 00 00 00 00
03 20 01 03 80 35 1d 78 ca 4e c0 a6 55 50 9c 26
11 50 54 af cf 00 81 c0 81 40 81 80 90 40 a9 c0
95 00 b3 00 01 01 02 3a 80 18 71 38 2d 40 58 2c
45 00 12 22 21 00 00 1e 00 00 00 fd 00 30 4b 1e
55 12 00 0a 20 20 20 20 20 20 00 00 00 ff 00 30
30 30 30 30 30 30 30 30 30 30 30 30 00 00 00 fc
00 51 4d 32 34 44 46 49 0a 20 20 20 20 20 01 f1

02 03 2c f1 4a 90 00 04 03 02 00 00 13 12 11 23
09 7f 07 83 01 00 00 67 03 0c 00 10 00 38 2d 68
1a 00 00 01 01 30 4b ed e3 0f 01 00 31 44 80 a0
70 38 27 40 30 20 35 00 55 50 21 00 00 1e 01 1d
00 72 51 d0 1e 20 6e 28 55 00 55 50 21 00 00 1e
8c 0a d0 8a 20 e0 2d 10 10 3e 96 00 55 50 21 00
00 18 00 00 00 00 00 00 00 00 00 00 00 00 00 00
00 00 00 00 00 00 00 00 00 00 00 00 00 00 00 0b

----------------

Block 0, Base EDID:
  EDID Structure Version & Revision: 1.3
  Vendor & Product Identification:
    Manufacturer: WAM
    Model: 9088
    Made in: week 3 of 2022
  Basic Display Parameters & Features:
    Digital display
    Maximum image size: 53 cm x 29 cm
    Gamma: 2.20
    DPMS levels: Standby Suspend
    RGB color display
    First detailed timing is the preferred timing
  Color Characteristics:
    Red  : 0.6494, 0.3320
    Green: 0.3154, 0.6113
    Blue : 0.1513, 0.0664
    White: 0.3125, 0.3281
  Established Timings I & II:
    IBM     :   720x400    70.081663 Hz   9:5     31.467 kHz     28.320000 MHz
    DMT 0x04:   640x480    59.940476 Hz   4:3     31.469 kHz     25.175000 MHz
    DMT 0x05:   640x480    72.808802 Hz   4:3     37.861 kHz     31.500000 MHz
    DMT 0x06:   640x480    75.000000 Hz   4:3     37.500 kHz     31.500000 MHz
    DMT 0x08:   800x600    56.250000 Hz   4:3     35.156 kHz     36.000000 MHz
    DMT 0x09:   800x600    60.316541 Hz   4:3     37.879 kHz     40.000000 MHz
    DMT 0x0a:   800x600    72.187572 Hz   4:3     48.077 kHz     50.000000 MHz
    DMT 0x0b:   800x600    75.000000 Hz   4:3     46.875 kHz     49.500000 MHz
    DMT 0x10:  1024x768    60.003840 Hz   4:3     48.363 kHz     65.000000 MHz
    DMT 0x11:  1024x768    70.069359 Hz   4:3     56.476 kHz     75.000000 MHz
    DMT 0x12:  1024x768    75.028582 Hz   4:3     60.023 kHz     78.750000 MHz
    DMT 0x24:  1280x1024   75.024675 Hz   5:4     79.976 kHz    135.000000 MHz
  Standard Timings:
    DMT 0x55:  1280x720    60.000000 Hz  16:9     45.000 kHz     74.250000 MHz
    DMT 0x20:  1280x960    60.000000 Hz   4:3     60.000 kHz    108.000000 MHz
    DMT 0x23:  1280x1024   60.019740 Hz   5:4     63.981 kHz    108.000000 MHz
    DMT 0x2a:  1400x1050   59.978442 Hz   4:3     65.317 kHz    121.750000 MHz
    DMT 0x53:  1600x900    60.000000 Hz  16:9     60.000 kHz    108.000000 MHz (RB)
    DMT 0x2f:  1440x900    59.887445 Hz  16:10    55.935 kHz    106.500000 MHz
    DMT 0x3a:  1680x1050   59.954250 Hz  16:10    65.290 kHz    146.250000 MHz
  Detailed Timing Descriptors:
    DTD 1:  1920x1080   60.000000 Hz  16:9     67.500 kHz    148.500000 MHz (530 mm x 290 mm)
                 Hfront   88 Hsync  44 Hback  148 Hpol P
                 Vfront    4 Vsync   5 Vback   36 Vpol P
    Display Range Limits:
      Monitor ranges (GTF): 48-75 Hz V, 30-85 kHz H, max dotclock 180 MHz
    Display Product Serial Number: ...
    Display Product Name: 'QM24DFI'
  Extension blocks: 1
Checksum: 0xf1

----------------

Block 1, CTA-861 Extension Block:
  Revision: 3
  Underscans IT Video Formats by default
  Basic audio support
  Supports YCbCr 4:4:4
  Supports YCbCr 4:2:2
  Native DTDs: 1
  Video Data Block:
    VIC  16:  1920x1080   60.000000 Hz  16:9     67.500 kHz    148.500000 MHz (native)
    VIC   4:  1280x720    60.000000 Hz  16:9     45.000 kHz     74.250000 MHz
    VIC   3:   720x480    59.940060 Hz  16:9     31.469 kHz     27.000000 MHz
    VIC   2:   720x480    59.940060 Hz   4:3     31.469 kHz     27.000000 MHz
    VIC  19:  1280x720    50.000000 Hz  16:9     37.500 kHz     74.250000 MHz
    VIC  18:   720x576    50.000000 Hz  16:9     31.250 kHz     27.000000 MHz
    VIC  17:   720x576    50.000000 Hz   4:3     31.250 kHz     27.000000 MHz
  Audio Data Block:
    Linear PCM:
      Max channels: 2
      Supported sample rates (kHz): 192 176.4 96 88.2 48 44.1 32
      Supported sample sizes (bits): 24 20 16
  Speaker Allocation Data Block:
    FL/FR - Front Left/Right
  Vendor-Specific Data Block (HDMI), OUI 00-0C-03:
    Source physical address: 1.0.0.0
    DC_36bit
    DC_30bit
    DC_Y444
    Maximum TMDS clock: 225 MHz
  Vendor-Specific Data Block (AMD), OUI 00-00-1A:
    Version: 1
    Flags 1: 0x01
      FreeSync Supported
    Minimum Refresh Rate: 48 Hz
    Maximum Refresh Rate: 75 Hz
    MCCS VCP Code: 0xed
  YCbCr 4:2:0 Capability Map Data Block:
    VIC  16:  1920x1080   60.000000 Hz  16:9     67.500 kHz    148.500000 MHz
  Detailed Timing Descriptors:
    DTD 2:  1920x1080   75.002578 Hz  16:9     83.928 kHz    174.570000 MHz (597 mm x 336 mm)
                 Hfront   48 Hsync  32 Hback   80 Hpol P
                 Vfront    3 Vsync   5 Vback   31 Vpol P
    DTD 3:  1280x720    60.000000 Hz  16:9     45.000 kHz     74.250000 MHz (597 mm x 336 mm)
                 Hfront  110 Hsync  40 Hback  220 Hpol P
                 Vfront    5 Vsync   5 Vback   20 Vpol P
    DTD 4:   720x480    59.940060 Hz   3:2     31.469 kHz     27.000000 MHz (597 mm x 336 mm)
                 Hfront   16 Hsync  62 Hback   60 Hpol N
                 Vfront    9 Vsync   6 Vback   30 Vpol N
Checksum: 0x0b  Unused space in Extension Block: 29 bytes

----------------

Warnings:

Block 0, Base EDID:
  Display Product Serial Number: ...
Block 1, CTA-861 Extension Block:
  YCbCr 4:2:0 Capability Map Data Block: Some YCbCr 4:2:0 timings are invalid for HDMI 2.1 (which requires an RGB timings pixel rate >= 590 MHz).
  Detailed Timing Descriptor #4: Image size is 597x336 mm, but based on the picture AR it should be 504x336 mm.
  Add a Colorimetry Data Block with the sRGB colorimetry bit set to avoid interop issues.

Failures:

Block 1, CTA-861 Extension Block:
  Detailed Timing Descriptor #2: Mismatch of image size 597x336 mm vs display size 530x290 mm.
  Detailed Timing Descriptor #3: Mismatch of image size 597x336 mm vs display size 530x290 mm.
  Detailed Timing Descriptor #4: Mismatch of image size 597x336 mm vs display size 530x290 mm.
  Missing VCDB, needed for Set Selectable RGB Quantization to avoid interop issues.
EDID:
  Extension Block 2 started with EDID header, ignoring Extension Blocks >= 2.
  Base EDID: The DTD max image size is 597x336mm, which is larger than the display size 530.0x290.0mm.

EDID conformity: FAIL
