edid-decode (hex):

00 ff ff ff ff ff ff 00 67 13 88 88 00 00 00 01
22 20 01 03 80 05 15 78 0a 0d c9 a0 57 47 98 27
12 48 4c 00 00 00 01 c1 01 01 01 c1 01 01 01 01
01 01 01 01 01 01 00 23 e0 18 11 80 2d 70 58 2c
45 00 36 da 00 00 00 1a 00 23 e0 18 11 80 2d 70
58 2c 45 00 36 da 00 00 00 1a 00 00 00 fa 00 0a
20 20 20 20 02 00 20 20 20 20 20 0a 00 00 00 fc
00 59 58 20 44 69 73 70 6c 61 79 20 20 20 00 65

00 ff ff ff ff ff ff 00 67 13 88 88 00 00 00 01
22 20 01 03 80 05 15 78 0a 0d c9 a0 57 47 98 27
12 48 4c 00 00 00 01 c1 01 01 01 c1 01 01 01 01
01 01 01 01 01 01 00 23 e0 18 11 80 2d 70 58 2c
45 00 36 da 00 00 00 1a 00 23 e0 18 11 80 2d 70
58 2c 45 00 36 da 00 00 00 1a 00 00 00 fa 00 0a
20 20 20 20 02 00 20 20 20 20 20 0a 00 00 00 fc
00 59 58 20 44 69 73 70 6c 61 79 20 20 20 00 65

----------------

Block 0, Base EDID:
  EDID Structure Version & Revision: 1.3
  Vendor & Product Identification:
    Manufacturer: YXS
    Model: 34952
    Serial Number: ...
    Made in: week 34 of 2022
  Basic Display Parameters & Features:
    Digital display
    Maximum image size: 5 cm x 21 cm
    Gamma: 2.20
    RGB color display
    First detailed timing is the preferred timing
  Color Characteristics:
    Red  : 0.6250, 0.3398
    Green: 0.2802, 0.5947
    Blue : 0.1552, 0.0703
    White: 0.2832, 0.2978
  Established Timings I & II: none
  Standard Timings:
  Detailed Timing Descriptors:
    DTD 1:   480x1920   59.997322 Hz   1:4    117.895 kHz     89.600000 MHz (54 mm x 218 mm)
                 Hfront   88 Hsync  44 Hback  148 Hpol P
                 Vfront    4 Vsync   5 Vback   36 Vpol N
    DTD 2:   480x1920   59.997322 Hz   1:4    117.895 kHz     89.600000 MHz (54 mm x 218 mm)
                 Hfront   88 Hsync  44 Hback  148 Hpol P
                 Vfront    4 Vsync   5 Vback   36 Vpol N
    Standard Timing Identifications:
      GTF     :   328x205    92.001317 Hz  16:10    19.964 kHz      7.826000 MHz
      GTF     :   504x315    92.000228 Hz  16:10    30.636 kHz     19.362000 MHz
      GTF     :   504x315    61.997961 Hz  16:10    20.273 kHz     12.164000 MHz
      GTF     :   504x315    92.000228 Hz  16:10    30.636 kHz     19.362000 MHz
      GTF     :   504x315    92.000228 Hz  16:10    30.636 kHz     19.362000 MHz
    Display Product Name: 'YX Display   '
Checksum: 0x65

----------------

Block 1, Unknown EDID Extension Block 0x00:
  00 ff ff ff ff ff ff 00 67 13 88 88 00 00 00 01 '........g.......'
  22 20 01 03 80 05 15 78 0a 0d c9 a0 57 47 98 27 '" .....x....WG.''
  12 48 4c 00 00 00 01 c1 01 01 01 c1 01 01 01 01 '.HL.............'
  01 01 01 01 01 01 00 23 e0 18 11 80 2d 70 58 2c '.......#....-pX,'
  45 00 36 da 00 00 00 1a 00 23 e0 18 11 80 2d 70 'E.6......#....-p'
  58 2c 45 00 36 da 00 00 00 1a 00 00 00 fa 00 0a 'X,E.6...........'
  20 20 20 20 02 00 20 20 20 20 20 0a 00 00 00 fc '    ..     .....'
  00 59 58 20 44 69 73 70 6c 61 79 20 20 20 00 65 '.YX Display   .e'
Checksum: 0x65

----------------

Warnings:

Block 0, Base EDID:
  Basic Display Parameters & Features: Dubious maximum image size (5x21 is smaller than 10x10 cm).
  Detailed Timing Descriptor #1: Dubious image size (54x218 mm is smaller than 100x100 mm).
  Detailed Timing Descriptor #2: Dubious image size (54x218 mm is smaller than 100x100 mm).
  Standard Timing Identifications: Standard Timing 328x205 has a dubious odd vertical resolution.
  Standard Timing Identifications: Standard Timing 504x315 has a dubious odd vertical resolution.
  Standard Timing Identifications: Standard Timing 504x315 has a dubious odd vertical resolution.
  Standard Timing Identifications: Standard Timing 504x315 has a dubious odd vertical resolution.
  Standard Timing Identifications: Standard Timing 504x315 has a dubious odd vertical resolution.

Failures:

Block 0, Base EDID:
  Standard Timings: Use 0x0101 as the invalid Standard Timings code, not 0x01c1.
  Standard Timings: Use 0x0101 as the invalid Standard Timings code, not 0x01c1.
  Standard Timing Identifications: 0 values in the video timing:
    Horizontal Active/Blanking 328/64
    Horizontal Frontporch/Sync Width 0/32
    Vertical Active/Blanking 205/12
    Vertical Frontporch/Sync Width 1/3
  Standard Timing Identifications: 0 or negative horizontal front porch.
  Standard Timing Identifications: 0 values in the video timing:
    Horizontal Active/Blanking 504/96
    Horizontal Frontporch/Sync Width 0/48
    Vertical Active/Blanking 315/12
    Vertical Frontporch/Sync Width 1/3
  Standard Timing Identifications: 0 or negative horizontal front porch.
  Standard Timing Identifications: Use 0x0101 as the invalid Standard Timings code, not 0x0020.
  Display Product Name: No newline, but one or more trailing spaces.
  Missing Display Range Limits Descriptor.
Block 1, Base EDID:
  Unknown Extension Block.
EDID:
  Base EDID: EDID specified 0 extension block(s), but found 1 extension block(s).

EDID conformity: FAIL
