edid-decode (hex):

00 ff ff ff ff ff ff 00 06 af 9f aa 00 00 00 00
01 20 01 04 a5 22 13 78 03 9b 00 a8 54 48 9c 25
0f 4f 56 00 00 00 01 01 01 01 01 01 01 01 01 01
01 01 01 01 01 01 cc d8 80 a0 70 38 20 4d 30 20
a5 00 58 c1 10 00 00 1a 00 00 00 fd 0e 3c 69 91
91 50 01 0a 20 20 20 20 20 20 00 00 00 fe 00 30
56 50 44 34 80 42 31 35 36 48 41 4e 00 00 00 00
00 02 41 0f 9e 00 01 00 00 0f 01 0a 20 20 01 5e

70 13 79 00 00 03 01 14 bc 47 01 84 7f 07 9f 00
2f 00 1f 00 37 04 27 00 09 00 04 00 00 00 00 00
00 00 00 00 00 00 00 00 00 00 00 00 00 00 00 00
00 00 00 00 00 00 00 00 00 00 00 00 00 00 00 00
00 00 00 00 00 00 00 00 00 00 00 00 00 00 00 00
00 00 00 00 00 00 00 00 00 00 00 00 00 00 00 00
00 00 00 00 00 00 00 00 00 00 00 00 00 00 00 00
00 00 00 00 00 00 00 00 00 00 00 00 00 00 f2 90

00 ff ff ff ff ff ff 00 06 af 9f aa 00 00 00 00
01 20 01 04 a5 22 13 78 03 9b 00 a8 54 48 9c 25
0f 4f 56 00 00 00 01 01 01 01 01 01 01 01 01 01
01 01 01 01 01 01 cc d8 80 a0 70 38 20 4d 30 20
a5 00 58 c1 10 00 00 1a 00 00 00 fd 0e 3c 69 91
91 50 01 0a 20 20 20 20 20 20 00 00 00 fe 00 30
56 50 44 34 80 42 31 35 36 48 41 4e 00 00 00 00
00 02 41 0f 9e 00 01 00 00 0f 01 0a 20 20 01 5e

70 13 79 00 00 03 01 14 bc 47 01 84 7f 07 9f 00
2f 00 1f 00 37 04 27 00 09 00 04 00 00 00 00 00
00 00 00 00 00 00 00 00 00 00 00 00 00 00 00 00
00 00 00 00 00 00 00 00 00 00 00 00 00 00 00 00
00 00 00 00 00 00 00 00 00 00 00 00 00 00 00 00
00 00 00 00 00 00 00 00 00 00 00 00 00 00 00 00
00 00 00 00 00 00 00 00 00 00 00 00 00 00 00 00
00 00 00 00 00 00 00 00 00 00 00 00 00 00 f2 90

----------------

Block 0, Base EDID:
  EDID Structure Version & Revision: 1.4
  Vendor & Product Identification:
    Manufacturer: AUO
    Model: 43679
    Made in: week 1 of 2022
  Basic Display Parameters & Features:
    Digital display
    Bits per primary color channel: 8
    DisplayPort interface
    Maximum image size: 34 cm x 19 cm
    Gamma: 2.20
    Supported color formats: RGB 4:4:4
    First detailed timing includes the native pixel format and preferred refresh rate
    Display supports continuous frequencies
  Color Characteristics:
    Red  : 0.6582, 0.3291
    Green: 0.2832, 0.6123
    Blue : 0.1445, 0.0585
    White: 0.3085, 0.3359
  Established Timings I & II: none
  Standard Timings: none
  Detailed Timing Descriptors:
    DTD 1:  1920x1080   60.096154 Hz  16:9    266.827 kHz    555.000000 MHz (344 mm x 193 mm)
                 Hfront   48 Hsync  32 Hback   80 Hpol P
                 Vfront   10 Vsync   5 Vback 3345 Vpol N
    Display Range Limits:
      Monitor ranges (Range Limits Only): 60-360 Hz V, 400-400 kHz H, max dotclock 800 MHz
    Alphanumeric Data String: '0VPD4.B156HAN'
    Manufacturer-Specified Display Descriptor (0x00): 00 00 00 02 41 0f 9e 00 01 00 00 0f 01 0a 20 20 '....A.........  '
  Extension blocks: 1
Checksum: 0x5e

----------------

Block 1, DisplayID Extension Block:
  Version: 1.3
  Extension Count: 0
  Display Product Type: Extension Section
  Video Timing Modes Type 1 - Detailed Timings Data Block:
    DTD:  1920x1080  360.151957 Hz  16:9    403.370 kHz    839.010000 MHz (aspect 16:9, no 3D stereo, preferred)
               Hfront   48 Hsync  32 Hback   80 Hpol N
               Vfront   10 Vsync   5 Vback   25 Vpol N
  Checksum: 0xf2
Checksum: 0x90

----------------

Warnings:

Block 0, Base EDID:
  Alphanumeric Data String: Non-ASCII character 0x80 at position 5, can cause problems.
  Missing Display Product Name.
EDID:
  Base EDID: Some timings are out of range of the Monitor Ranges:
    Horizontal Freq: 266.826 - 403.370 kHz (Monitor: 400.000 - 400.000 kHz)
    Maximum Clock: 839.010 MHz (Monitor: 800.000 MHz)

Failures:

Block 1, DisplayID Extension Block:
  DisplayID Base Block has no product type.
EDID:
  Extension Block 2 started with EDID header, ignoring Extension Blocks >= 2.

EDID conformity: FAIL
