edid-decode (hex):

00 ff ff ff ff ff ff 00 36 09 01 10 00 88 88 88
1c 1c 01 03 80 00 00 78 0a 0d c9 a0 57 47 98 27
12 48 4c 00 00 00 d1 c0 01 01 01 01 01 01 01 01
01 01 01 01 01 01 40 1f 00 c8 50 20 32 30 58 2d
45 00 00 20 53 00 00 1e 00 00 00 10 00 80 10 70
20 20 84 00 80 38 74 00 00 18 00 00 00 fc 00 4d
50 49 31 30 37 0a 20 20 20 20 20 20 00 00 00 10
00 14 78 01 ff 1d 00 0a 20 20 20 20 20 20 00 95

00 ff ff ff ff ff ff 00 36 09 01 10 00 88 88 88
1c 1c 01 03 80 00 00 78 0a 0d c9 a0 57 47 98 27
12 48 4c 00 00 00 d1 c0 01 01 01 01 01 01 01 01
01 01 01 01 01 01 40 1f 00 c8 50 20 32 30 58 2d
45 00 00 20 53 00 00 1e 00 00 00 10 00 80 10 70
20 20 84 00 80 38 74 00 00 18 00 00 00 fc 00 4d
50 49 31 30 37 0a 20 20 20 20 20 20 00 00 00 10
00 14 78 01 ff 1d 00 0a 20 20 20 20 20 20 00 95

----------------

Block 0, Base EDID:
  EDID Structure Version & Revision: 1.3
  Vendor & Product Identification:
    Manufacturer: MPI
    Model: 4097
    Serial Number: ...
    Made in: week 28 of 2018
  Basic Display Parameters & Features:
    Digital display
    Image size is variable
    Gamma: 2.20
    RGB color display
    First detailed timing is the preferred timing
  Color Characteristics:
    Red  : 0.6250, 0.3398
    Green: 0.2802, 0.5947
    Blue : 0.1552, 0.0703
    White: 0.2832, 0.2978
  Established Timings I & II: none
  Standard Timings:
    DMT 0x52:  1920x1080   60.000000 Hz  16:9     67.500 kHz    148.500000 MHz
  Detailed Timing Descriptors:
    DTD 1:  1280x800    63.593005 Hz  16:10    54.054 kHz     80.000000 MHz (1280 mm x 800 mm)
                 Hfront   88 Hsync  45 Hback   67 Hpol P
                 Vfront    4 Vsync   5 Vback   41 Vpol P
    Dummy Descriptor:
    Display Product Name: 'MPI107'
    Dummy Descriptor:
Checksum: 0x95

----------------

Failures:

Block 0, Base EDID:
  Dummy Descriptor: Dummy block filled with garbage.
  Dummy Descriptor: Dummy block filled with garbage.
  Missing Display Range Limits Descriptor.
EDID:
  Extension Block 1 started with EDID header, ignoring Extension Blocks >= 1.
  Base EDID: The DTD max image size is 1280x800mm, but the display size is not specified anywhere.

EDID conformity: FAIL
