edid-decode (hex):

00 ff ff ff ff ff ff 00 4d 10 3e 14 00 00 00 00
28 19 01 04 a5 23 13 78 0e 2a 8b a9 53 34 b8 25
0c 4e 53 00 00 00 01 01 01 01 01 01 01 01 01 01
01 01 01 01 01 01 4d d0 00 a0 f0 70 3e 80 30 20
35 00 5a c2 10 00 00 18 00 00 00 00 00 00 00 00
00 00 00 00 00 00 00 00 00 00 00 00 00 fe 00 37
50 48 50 54 82 4c 51 31 35 36 44 31 00 00 00 00
00 02 41 03 28 00 12 00 00 0b 01 0a 20 20 00 16

00 ff ff ff ff ff ff 00 4d 10 3e 14 00 00 00 00
28 19 01 04 a5 23 13 78 0e 2a 8b a9 53 34 b8 25
0c 4e 53 00 00 00 01 01 01 01 01 01 01 01 01 01
01 01 01 01 01 01 4d d0 00 a0 f0 70 3e 80 30 20
35 00 5a c2 10 00 00 18 00 00 00 00 00 00 00 00
00 00 00 00 00 00 00 00 00 00 00 00 00 fe 00 37
50 48 50 54 82 4c 51 31 35 36 44 31 00 00 00 00
00 02 41 03 28 00 12 00 00 0b 01 0a 20 20 00 16

----------------

Block 0, Base EDID:
  EDID Structure Version & Revision: 1.4
  Vendor & Product Identification:
    Manufacturer: SHP
    Model: 5182
    Made in: week 40 of 2015
  Basic Display Parameters & Features:
    Digital display
    Bits per primary color channel: 8
    DisplayPort interface
    Maximum image size: 35 cm x 19 cm
    Gamma: 2.20
    Supported color formats: RGB 4:4:4, YCrCb 4:4:4
    Default (sRGB) color space is primary color space
    First detailed timing includes the native pixel format and preferred refresh rate
  Color Characteristics:
    Red  : 0.6601, 0.3261
    Green: 0.2050, 0.7207
    Blue : 0.1464, 0.0468
    White: 0.3066, 0.3271
  Established Timings I & II: none
  Standard Timings: none
  Detailed Timing Descriptors:
    DTD 1:  3840x2160   59.996625 Hz  16:9    133.312 kHz    533.250000 MHz (346 mm x 194 mm)
                 Hfront   48 Hsync  32 Hback   80 Hpol N
                 Vfront    3 Vsync   5 Vback   54 Vpol N
    Empty Descriptor
    Alphanumeric Data String: '7PHPT.LQ156D1'
    Manufacturer-Specified Display Descriptor (0x00): 00 00 00 02 41 03 28 00 12 00 00 0b 01 0a 20 20 '....A.(.......  '
Checksum: 0x16

----------------

Block 1, Unknown EDID Extension Block 0x00:
  00 ff ff ff ff ff ff 00 4d 10 3e 14 00 00 00 00 '........M.>.....'
  28 19 01 04 a5 23 13 78 0e 2a 8b a9 53 34 b8 25 '(....#.x.*..S4.%'
  0c 4e 53 00 00 00 01 01 01 01 01 01 01 01 01 01 '.NS.............'
  01 01 01 01 01 01 4d d0 00 a0 f0 70 3e 80 30 20 '......M....p>.0 '
  35 00 5a c2 10 00 00 18 00 00 00 00 00 00 00 00 '5.Z.............'
  00 00 00 00 00 00 00 00 00 00 00 00 00 fe 00 37 '...............7'
  50 48 50 54 82 4c 51 31 35 36 44 31 00 00 00 00 'PHPT.LQ156D1....'
  00 02 41 03 28 00 12 00 00 0b 01 0a 20 20 00 16 '..A.(.......  ..'
Checksum: 0x16

----------------

Warnings:

Block 0, Base EDID:
  Alphanumeric Data String: Non-ASCII character 0x82 at position 5, can cause problems.
  Missing Display Product Name.

Failures:

Block 0, Base EDID:
  Basic Display Parameters & Features: sRGB is signaled, but the chromaticities do not match.
  Empty Descriptor: Use Dummy Descriptor instead of all zeroes.
Block 1, Base EDID:
  Unknown Extension Block.
EDID:
  Base EDID: EDID specified 0 extension block(s), but found 1 extension block(s).

EDID conformity: FAIL
