edid-decode (hex):

00 ff ff ff ff ff ff 00 10 ac 8a 70 46 4b 30 42
24 0a 01 04 a5 24 1b ae e2 a5 c2 9d 59 4a 9c 27
12 48 4f a4 43 00 31 59 45 59 61 59 81 99 a9 40
01 01 01 01 01 01 86 3d 00 c0 51 00 30 40 40 a0
13 00 63 09 11 00 00 18 00 00 00 ff 00 34 35 31
32 52 30 39 38 42 30 4b 46 0a 00 00 00 fc 00 44
45 4c 4c 20 4d 39 39 30 20 0a 20 20 00 00 00 fd
00 32 a0 1e 60 ff 00 0a 20 20 20 20 20 20 00 7e

----------------

Block 0, Base EDID:
  EDID Structure Version & Revision: 1.4
  Vendor & Product Identification:
    Manufacturer: DEL
    Model: 28810
    Serial Number: ...
    Made in: week 36 of 2000
  Basic Display Parameters & Features:
    Digital display
    Bits per primary color channel: 8
    DisplayPort interface
    Maximum image size: 36 cm x 27 cm
    Gamma: 2.74
    DPMS levels: Standby Suspend Off
    Supported color formats: RGB 4:4:4
    First detailed timing includes the native pixel format and preferred refresh rate
  Color Characteristics:
    Red  : 0.6152, 0.3496
    Green: 0.2900, 0.6103
    Blue : 0.1552, 0.0703
    White: 0.2812, 0.3105
  Established Timings I & II:
    IBM     :   720x400    70.081663 Hz   9:5     31.467 kHz     28.320000 MHz
    DMT 0x04:   640x480    59.940476 Hz   4:3     31.469 kHz     25.175000 MHz
    DMT 0x06:   640x480    75.000000 Hz   4:3     37.500 kHz     31.500000 MHz
    DMT 0x0b:   800x600    75.000000 Hz   4:3     46.875 kHz     49.500000 MHz
    DMT 0x12:  1024x768    75.028582 Hz   4:3     60.023 kHz     78.750000 MHz
    DMT 0x24:  1280x1024   75.024675 Hz   5:4     79.976 kHz    135.000000 MHz
  Standard Timings:
    DMT 0x07:   640x480    85.008312 Hz   4:3     43.269 kHz     36.000000 MHz
    DMT 0x0c:   800x600    85.061274 Hz   4:3     53.674 kHz     56.250000 MHz
    DMT 0x13:  1024x768    84.996690 Hz   4:3     68.677 kHz     94.500000 MHz
    DMT 0x25:  1280x1024   85.024098 Hz   5:4     91.146 kHz    157.500000 MHz
    DMT 0x33:  1600x1200   60.000000 Hz   4:3     75.000 kHz    162.000000 MHz
  Detailed Timing Descriptors:
    DTD 1:  1280x1024   85.024098 Hz   5:4     91.146 kHz    157.500000 MHz (355 mm x 265 mm)
                 Hfront   64 Hsync 160 Hback  224 Hpol N
                 Vfront    1 Vsync   3 Vback   44 Vpol N
    Display Product Serial Number: ...
    Display Product Name: 'DELL M990 '
    Display Range Limits:
      Monitor ranges (GTF): 50-160 Hz V, 30-96 kHz H, max dotclock 2550 MHz
Checksum: 0x7e

----------------

Warnings:

Block 0, Base EDID:
  Detailed Timing Descriptor #1: DTD is similar but not identical to DMT 0x25.
  Detailed Timing Descriptor #1: Image size is 355x265 mm, but based on the picture AR it should be 331x265 mm.
  Display Range Limits: GTF support is deprecated in EDID 1.4.

Failures:

Block 0, Base EDID:
  Display Product Name: One or more trailing spaces before newline.
  Display Range Limits: GTF is supported, but the display does not support continuous frequencies.

EDID conformity: FAIL
