edid-decode (hex):

00 ff ff ff ff ff ff 00 15 8f 00 19 ce 1e 00 00
05 14 01 03 a1 28 19 78 ee 80 c5 a6 57 49 9b 23
12 50 54 bf eb 00 61 45 61 4c 71 4f 81 40 81 80
8b c0 01 01 01 01 68 29 a0 d0 51 84 22 30 50 98
36 00 98 ff 10 00 00 1c 7c 2e 90 a0 60 1a 1e 40
30 20 36 00 d9 28 11 00 00 1a fc 21 00 90 51 00
20 30 48 80 37 00 d9 28 11 00 00 1c 00 00 00 fd
00 38 4b 1e 53 0e 00 0a 20 20 20 20 20 20 00 7a

00 ff ff ff ff ff ff 00 15 8f 00 19 ce 1e 00 00
05 14 01 03 a1 28 19 78 ee 80 c5 a6 57 49 9b 23
12 50 54 bf eb 00 61 45 61 4c 71 4f 81 40 81 80
8b c0 01 01 01 01 68 29 a0 d0 51 84 22 30 50 98
36 00 98 ff 10 00 00 1c 7c 2e 90 a0 60 1a 1e 40
30 20 36 00 d9 28 11 00 00 1a fc 21 00 90 51 00
20 30 48 80 37 00 d9 28 11 00 00 1c 00 00 00 fd
00 38 4b 1e 53 0e 00 0a 20 20 20 20 20 20 00 7a

----------------

Block 0, Base EDID:
  EDID Structure Version & Revision: 1.3
  Vendor & Product Identification:
    Manufacturer: ELO
    Model: 6400
    Serial Number: ...
    Made in: week 5 of 2010
  Basic Display Parameters & Features:
    Digital display
    DFP 1.x compatible TMDS
    Maximum image size: 40 cm x 25 cm
    Gamma: 2.20
    DPMS levels: Standby Suspend Off
    RGB color display
    Default (sRGB) color space is primary color space
    First detailed timing is the preferred timing
  Color Characteristics:
    Red  : 0.6503, 0.3398
    Green: 0.2851, 0.6054
    Blue : 0.1396, 0.0703
    White: 0.3134, 0.3291
  Established Timings I & II:
    IBM     :   720x400    70.081663 Hz   9:5     31.467 kHz     28.320000 MHz
    DMT 0x04:   640x480    59.940476 Hz   4:3     31.469 kHz     25.175000 MHz
    Apple   :   640x480    66.666667 Hz   4:3     35.000 kHz     30.240000 MHz
    DMT 0x05:   640x480    72.808802 Hz   4:3     37.861 kHz     31.500000 MHz
    DMT 0x06:   640x480    75.000000 Hz   4:3     37.500 kHz     31.500000 MHz
    DMT 0x08:   800x600    56.250000 Hz   4:3     35.156 kHz     36.000000 MHz
    DMT 0x09:   800x600    60.316541 Hz   4:3     37.879 kHz     40.000000 MHz
    DMT 0x0a:   800x600    72.187572 Hz   4:3     48.077 kHz     50.000000 MHz
    DMT 0x0b:   800x600    75.000000 Hz   4:3     46.875 kHz     49.500000 MHz
    Apple   :   832x624    74.551266 Hz   4:3     49.726 kHz     57.284000 MHz
    DMT 0x10:  1024x768    60.003840 Hz   4:3     48.363 kHz     65.000000 MHz
    DMT 0x12:  1024x768    75.028582 Hz   4:3     60.023 kHz     78.750000 MHz
    DMT 0x24:  1280x1024   75.024675 Hz   5:4     79.976 kHz    135.000000 MHz
  Standard Timings:
    GTF     :  1024x768    64.999739 Hz   4:3     51.870 kHz     69.713000 MHz
    GTF     :  1024x768    72.000073 Hz   4:3     57.672 kHz     78.434000 MHz
    DMT 0x15:  1152x864    75.000000 Hz   4:3     67.500 kHz    108.000000 MHz
    DMT 0x20:  1280x960    60.000000 Hz   4:3     60.000 kHz    108.000000 MHz
    DMT 0x23:  1280x1024   60.019740 Hz   5:4     63.981 kHz    108.000000 MHz
    GTF     :  1360x765    60.000341 Hz  16:9     47.520 kHz     84.396000 MHz
  Detailed Timing Descriptors:
    DTD 1:  1440x900    59.606284 Hz  16:10    55.672 kHz    106.000000 MHz (408 mm x 255 mm)
                 Hfront   80 Hsync 152 Hback  232 Hpol N
                 Vfront    3 Vsync   6 Vback   25 Vpol P
    DTD 2:  1680x1050   59.883253 Hz  16:10    64.674 kHz    119.000000 MHz (473 mm x 296 mm)
                 Hfront   48 Hsync  32 Hback   80 Hpol P
                 Vfront    3 Vsync   6 Vback   21 Vpol N
    DTD 3:  1280x768    64.732143 Hz   5:3     51.786 kHz     87.000000 MHz (473 mm x 296 mm)
                 Hfront   72 Hsync 128 Hback  200 Hpol N
                 Vfront    3 Vsync   7 Vback   22 Vpol P
    Display Range Limits:
      Monitor ranges (GTF): 56-75 Hz V, 30-83 kHz H, max dotclock 140 MHz
Checksum: 0x7a

----------------

Warnings:

Block 0, Base EDID:
  Standard Timings: Standard Timing 1360x765 has a dubious odd vertical resolution.
  Detailed Timing Descriptor #3: Image size is 473x296 mm, but based on the picture AR it should be 473x283 mm.

Failures:

Block 0, Base EDID:
  Basic Display Parameters & Features: Digital Video Interface Standard set to reserved value 0x20.
  Basic Display Parameters & Features: sRGB is signaled, but the chromaticities do not match.
  Detailed Timing Descriptor #2: Mismatch of image size 473x296 mm vs display size 400x250 mm.
  Detailed Timing Descriptor #3: Mismatch of image size 473x296 mm vs display size 400x250 mm.
  Missing Display Product Name.
EDID:
  Extension Block 1 started with EDID header, ignoring Extension Blocks >= 1.
  Base EDID: The DTD max image size is 473x296mm, which is larger than the display size 400.0x250.0mm.

EDID conformity: FAIL
