edid-decode (hex):

00 ff ff ff ff ff ff 00 06 af 3d 31 00 00 00 00
06 1e 01 04 95 1f 11 78 02 f9 95 92 57 59 90 29
22 50 54 00 00 00 01 01 01 01 01 01 01 01 01 01
01 01 01 01 01 01 60 3b 80 04 71 38 52 40 10 10
3e 00 35 ae 10 00 00 1a 80 2f 80 04 71 38 52 40
10 10 3e 00 35 ae 10 00 00 1a 00 00 00 fe 00 33
33 47 54 46 80 42 31 34 30 48 41 42 00 00 00 00
00 01 41 22 94 00 11 00 00 0a 01 0a 20 20 00 b9

----------------

Block 0, Base EDID:
  EDID Structure Version & Revision: 1.4
  Vendor & Product Identification:
    Manufacturer: AUO
    Model: 12605
    Made in: week 6 of 2020
  Basic Display Parameters & Features:
    Digital display
    Bits per primary color channel: 6
    DisplayPort interface
    Maximum image size: 31 cm x 17 cm
    Gamma: 2.20
    Supported color formats: RGB 4:4:4
    First detailed timing includes the native pixel format and preferred refresh rate
  Color Characteristics:
    Red  : 0.5732, 0.3427
    Green: 0.3496, 0.5634
    Blue : 0.1621, 0.1337
    White: 0.3134, 0.3291
  Established Timings I & II: none
  Standard Timings: none
  Detailed Timing Descriptors:
    DTD 1:  1920x1080   60.004106 Hz  16:9     69.725 kHz    152.000000 MHz (309 mm x 174 mm)
                 Hfront   16 Hsync  16 Hback  228 Hpol P
                 Vfront    3 Vsync  14 Vback   65 Vpol N
    DTD 2:  1920x1080   48.003284 Hz  16:9     55.780 kHz    121.600000 MHz (309 mm x 174 mm)
                 Hfront   16 Hsync  16 Hback  228 Hpol P
                 Vfront    3 Vsync  14 Vback   65 Vpol N
    Alphanumeric Data String: '33GTF.B140HAB'
    Manufacturer-Specified Display Descriptor (0x00): 00 00 00 01 41 22 94 00 11 00 00 0a 01 0a 20 20 '....A"........  '
Checksum: 0xb9

----------------

Warnings:

Block 0, Base EDID:
  Alphanumeric Data String: Non-ASCII character 0x80 at position 5, can cause problems.
  Missing Display Product Name.

EDID conformity: PASS
