edid-decode (hex):

00 ff ff ff ff ff ff 00 06 af a5 30 00 00 00 00
16 20 01 04 b5 22 16 78 03 b0 45 a7 54 49 9c 21
0f 50 54 00 00 00 01 01 01 01 01 01 01 01 01 01
01 01 01 01 01 01 3e d8 00 a0 a0 40 60 60 30 20
aa 00 58 d7 10 00 00 1a 80 56 00 a0 a0 40 60 60
30 20 aa 00 58 d7 10 00 00 1a 00 00 00 fe 00 50
33 46 50 4a 80 42 31 36 30 51 41 4e 00 00 00 00
00 03 41 2e 9e 00 11 00 00 0b 41 0a 20 20 01 bc

70 20 79 02 00 25 01 09 6b 72 08 6b 72 08 30 78
80 81 00 10 72 1a 00 00 03 01 30 78 00 00 53 49
53 49 78 00 00 00 00 00 00 00 00 00 00 00 00 00
00 00 00 00 00 00 00 00 00 00 00 00 00 00 00 00
00 00 00 00 00 00 00 00 00 00 00 00 00 00 00 00
00 00 00 00 00 00 00 00 00 00 00 00 00 00 00 00
00 00 00 00 00 00 00 00 00 00 00 00 00 00 00 00
00 00 00 00 00 00 00 00 00 00 00 00 00 00 cb 90

00 ff ff ff ff ff ff 00 06 af a5 30 00 00 00 00
16 20 01 04 b5 22 16 78 03 b0 45 a7 54 49 9c 21
0f 50 54 00 00 00 01 01 01 01 01 01 01 01 01 01
01 01 01 01 01 01 3e d8 00 a0 a0 40 60 60 30 20
aa 00 58 d7 10 00 00 1a 80 56 00 a0 a0 40 60 60
30 20 aa 00 58 d7 10 00 00 1a 00 00 00 fe 00 50
33 46 50 4a 80 42 31 36 30 51 41 4e 00 00 00 00
00 03 41 2e 9e 00 11 00 00 0b 41 0a 20 20 01 bc

70 20 79 02 00 25 01 09 6b 72 08 6b 72 08 30 78
80 81 00 10 72 1a 00 00 03 01 30 78 00 00 53 49
53 49 78 00 00 00 00 00 00 00 00 00 00 00 00 00
00 00 00 00 00 00 00 00 00 00 00 00 00 00 00 00
00 00 00 00 00 00 00 00 00 00 00 00 00 00 00 00
00 00 00 00 00 00 00 00 00 00 00 00 00 00 00 00
00 00 00 00 00 00 00 00 00 00 00 00 00 00 00 00
00 00 00 00 00 00 00 00 00 00 00 00 00 00 cb 90

----------------

Block 0, Base EDID:
  EDID Structure Version & Revision: 1.4
  Vendor & Product Identification:
    Manufacturer: AUO
    Model: 12453
    Made in: week 22 of 2022
  Basic Display Parameters & Features:
    Digital display
    Bits per primary color channel: 10
    DisplayPort interface
    Maximum image size: 34 cm x 22 cm
    Gamma: 2.20
    Supported color formats: RGB 4:4:4
    First detailed timing includes the native pixel format and preferred refresh rate
    Display supports continuous frequencies
  Color Characteristics:
    Red  : 0.6542, 0.3310
    Green: 0.2851, 0.6093
    Blue : 0.1298, 0.0585
    White: 0.3134, 0.3291
  Established Timings I & II: none
  Standard Timings: none
  Detailed Timing Descriptors:
    DTD 1:  2560x1600  120.001214 Hz  16:10   203.522 kHz    553.580000 MHz (344 mm x 215 mm)
                 Hfront   48 Hsync  32 Hback   80 Hpol P
                 Vfront   10 Vsync  10 Vback   76 Vpol N
    DTD 2:  2560x1600   48.002220 Hz  16:10    81.412 kHz    221.440000 MHz (344 mm x 215 mm)
                 Hfront   48 Hsync  32 Hback   80 Hpol P
                 Vfront   10 Vsync  10 Vback   76 Vpol N
    Alphanumeric Data String: 'P3FPJ.B160QAN'
    Manufacturer-Specified Display Descriptor (0x00): 00 00 00 03 41 2e 9e 00 11 00 00 0b 41 0a 20 20 '....A.......A.  '
  Extension blocks: 1
Checksum: 0xbc

----------------

Block 1, DisplayID Extension Block:
  Version: 2.0
  Extension Count: 0
  Display Product Primary Use Case: None of the listed primary use cases; generic display
  Dynamic Video Timing Range Limits Data Block:
    Minimum Pixel Clock: 553580 kHz
    Maximum Pixel Clock: 553580 kHz
    Minimum Vertical Refresh Rate: 48 Hz
    Maximum Vertical Refresh Rate: 120 Hz
    Seamless Dynamic Video Timing Support: Yes
  CTA-861 DisplayID Data Block:
  Vendor-Specific Data Block (AMD), OUI 00-00-1A:
    Version: 3
    Feature Caps: 0x01
    Minimum Refresh Rate: 48 Hz
    Maximum Refresh Rate: 120 Hz
    Flags 1.x: 0x00
    Flags 2.x: 0x00
  Checksum: 0xcb
Checksum: 0x90

----------------

Warnings:

Block 0, Base EDID:
  Alphanumeric Data String: Non-ASCII character 0x80 at position 5, can cause problems.
  Missing Display Product Name.

Failures:

Block 0, Base EDID:
  Missing Display Range Limits Descriptor.
Block 1, DisplayID Extension Block:
  Vendor-Specific Data Block (AMD), OUI 00-00-1A: Length is 16 instead of 19.
EDID:
  Extension Block 2 started with EDID header, ignoring Extension Blocks >= 2.
  DisplayID: Missing DisplayID Display Parameters Data Block.
  DisplayID: Missing DisplayID Type VII Detailed Timing Data Block.
  DisplayID: DisplayID expects at least one preferred timing.

EDID conformity: FAIL
