edid-decode (hex):

00 ff ff ff ff ff ff 00 30 e4 66 02 00 00 00 00
00 13 01 03 80 22 13 78 0a 94 65 9b 9b 55 96 26
0f 50 54 00 00 00 01 01 01 01 01 01 01 01 01 01
01 01 01 01 01 01 12 1b 56 78 50 00 0e 30 20 20
24 00 58 c2 10 00 00 19 12 1b 56 78 50 00 0e 30
20 20 24 00 58 c2 10 00 00 19 00 00 00 fe 00 31
4b 30 52 32 80 31 35 36 57 48 32 0a 00 00 00 00
00 ff ff ff ff ff ff ff ff 01 01 0a 20 20 00 70

----------------

Block 0, Base EDID:
  EDID Structure Version & Revision: 1.3
  Vendor & Product Identification:
    Manufacturer: LGD
    Model: 614
    Made in: 2009
  Basic Display Parameters & Features:
    Digital display
    Maximum image size: 34 cm x 19 cm
    Gamma: 2.20
    RGB color display
    First detailed timing is the preferred timing
  Color Characteristics:
    Red  : 0.6074, 0.6064
    Green: 0.3330, 0.5859
    Blue : 0.1494, 0.0605
    White: 0.3134, 0.3291
  Established Timings I & II: none
  Standard Timings: none
  Detailed Timing Descriptors:
    DTD 1:  1366x768    59.635885 Hz 683:384   46.635 kHz     69.300000 MHz (344 mm x 194 mm)
                 Hfront   32 Hsync  32 Hback   56 Hpol N
                 Vfront    2 Vsync   4 Vback    8 Vpol N
    DTD 2:  1366x768    59.635885 Hz 683:384   46.635 kHz     69.300000 MHz (344 mm x 194 mm)
                 Hfront   32 Hsync  32 Hback   56 Hpol N
                 Vfront    2 Vsync   4 Vback    8 Vpol N
    Alphanumeric Data String: '1K0R2.156WH2'
    Manufacturer-Specified Display Descriptor (0x00): 00 00 00 ff ff ff ff ff ff ff ff 01 01 0a 20 20 '..............  '
Checksum: 0x70

----------------

Warnings:

Block 0, Base EDID:
  Alphanumeric Data String: Non-ASCII character 0x80 at position 5, can cause problems.

Failures:

Block 0, Base EDID:
  Missing Display Product Name.
  Missing Display Range Limits Descriptor.

EDID conformity: FAIL
