edid-decode (hex):

00 ff ff ff ff ff ff 00 10 ac 9d 42 4c 31 34 32
22 20 01 03 80 5e 1b 78 ea 8b 55 a4 55 4e 9e 27
0e 50 54 a5 4b 00 01 01 d1 c0 b3 00 01 01 81 80
81 00 71 4f 01 01 1a 68 00 a0 f0 38 1f 40 30 20
3a 00 ad 09 31 00 00 1a 00 00 00 ff 00 48 57 59
33 59 4e 33 0a 20 20 20 20 20 00 00 00 fc 00 44
45 4c 4c 20 55 34 33 32 33 51 45 0a 00 00 00 fd
00 1d 4c 1e 53 1e 00 0a 20 20 20 20 20 20 01 2d

02 03 24 f1 4c 10 1f 20 05 14 04 13 12 11 03 02
01 23 09 1f 07 83 01 00 00 67 03 0c 00 20 00 38
3c e2 00 6b bf 16 00 a0 80 38 13 40 30 20 3a 00
ad 09 31 00 00 1a 02 3a 80 18 71 38 2d 40 58 2c
45 00 ad 09 31 00 00 1e 01 1d 00 72 51 d0 1e 20
6e 28 55 00 ad 09 31 00 00 1e 00 00 00 00 00 00
00 00 00 00 00 00 00 00 00 00 00 00 00 00 00 00
00 00 00 00 00 00 00 00 00 00 00 00 00 00 00 23

00 ff ff ff ff ff ff 00 10 ac 9d 42 4c 31 34 32
22 20 01 03 80 5e 1b 78 ea 8b 55 a4 55 4e 9e 27
0e 50 54 a5 4b 00 01 01 d1 c0 b3 00 01 01 81 80
81 00 71 4f 01 01 1a 68 00 a0 f0 38 1f 40 30 20
3a 00 ad 09 31 00 00 1a 00 00 00 ff 00 48 57 59
33 59 4e 33 0a 20 20 20 20 20 00 00 00 fc 00 44
45 4c 4c 20 55 34 33 32 33 51 45 0a 00 00 00 fd
00 1d 4c 1e 53 1e 00 0a 20 20 20 20 20 20 01 2d

02 03 24 f1 4c 10 1f 20 05 14 04 13 12 11 03 02
01 23 09 1f 07 83 01 00 00 67 03 0c 00 20 00 38
3c e2 00 6b bf 16 00 a0 80 38 13 40 30 20 3a 00
ad 09 31 00 00 1a 02 3a 80 18 71 38 2d 40 58 2c
45 00 ad 09 31 00 00 1e 01 1d 00 72 51 d0 1e 20
6e 28 55 00 ad 09 31 00 00 1e 00 00 00 00 00 00
00 00 00 00 00 00 00 00 00 00 00 00 00 00 00 00
00 00 00 00 00 00 00 00 00 00 00 00 00 00 00 23

----------------

Block 0, Base EDID:
  EDID Structure Version & Revision: 1.3
  Vendor & Product Identification:
    Manufacturer: DEL
    Model: 17053
    Serial Number: ...
    Made in: week 34 of 2022
  Basic Display Parameters & Features:
    Digital display
    Maximum image size: 94 cm x 27 cm
    Gamma: 2.20
    DPMS levels: Standby Suspend Off
    RGB color display
    First detailed timing is the preferred timing
  Color Characteristics:
    Red  : 0.6425, 0.3320
    Green: 0.3066, 0.6201
    Blue : 0.1533, 0.0556
    White: 0.3134, 0.3291
  Established Timings I & II:
    IBM     :   720x400    70.081663 Hz   9:5     31.467 kHz     28.320000 MHz
    DMT 0x04:   640x480    59.940476 Hz   4:3     31.469 kHz     25.175000 MHz
    DMT 0x06:   640x480    75.000000 Hz   4:3     37.500 kHz     31.500000 MHz
    DMT 0x09:   800x600    60.316541 Hz   4:3     37.879 kHz     40.000000 MHz
    DMT 0x0b:   800x600    75.000000 Hz   4:3     46.875 kHz     49.500000 MHz
    DMT 0x10:  1024x768    60.003840 Hz   4:3     48.363 kHz     65.000000 MHz
    DMT 0x12:  1024x768    75.028582 Hz   4:3     60.023 kHz     78.750000 MHz
    DMT 0x24:  1280x1024   75.024675 Hz   5:4     79.976 kHz    135.000000 MHz
  Standard Timings:
    DMT 0x52:  1920x1080   60.000000 Hz  16:9     67.500 kHz    148.500000 MHz
    DMT 0x3a:  1680x1050   59.954250 Hz  16:10    65.290 kHz    146.250000 MHz
    DMT 0x23:  1280x1024   60.019740 Hz   5:4     63.981 kHz    108.000000 MHz
    DMT 0x1c:  1280x800    59.810326 Hz  16:10    49.702 kHz     83.500000 MHz
    DMT 0x15:  1152x864    75.000000 Hz   4:3     67.500 kHz    108.000000 MHz
  Detailed Timing Descriptors:
    DTD 1:  3840x1080   59.968497 Hz  32:9     66.625 kHz    266.500000 MHz (941 mm x 265 mm)
                 Hfront   48 Hsync  32 Hback   80 Hpol P
                 Vfront    3 Vsync  10 Vback   18 Vpol N
    Display Product Serial Number: ...
    Display Product Name: 'DELL U4323QE'
    Display Range Limits:
      Monitor ranges (GTF): 29-76 Hz V, 30-83 kHz H, max dotclock 300 MHz
  Extension blocks: 1
Checksum: 0x2d

----------------

Block 1, CTA-861 Extension Block:
  Revision: 3
  Underscans IT Video Formats by default
  Basic audio support
  Supports YCbCr 4:4:4
  Supports YCbCr 4:2:2
  Native DTDs: 1
  Video Data Block:
    VIC  16:  1920x1080   60.000000 Hz  16:9     67.500 kHz    148.500000 MHz
    VIC  31:  1920x1080   50.000000 Hz  16:9     56.250 kHz    148.500000 MHz
    VIC  32:  1920x1080   24.000000 Hz  16:9     27.000 kHz     74.250000 MHz
    VIC   5:  1920x1080i  60.000000 Hz  16:9     33.750 kHz     74.250000 MHz
    VIC  20:  1920x1080i  50.000000 Hz  16:9     28.125 kHz     74.250000 MHz
    VIC   4:  1280x720    60.000000 Hz  16:9     45.000 kHz     74.250000 MHz
    VIC  19:  1280x720    50.000000 Hz  16:9     37.500 kHz     74.250000 MHz
    VIC  18:   720x576    50.000000 Hz  16:9     31.250 kHz     27.000000 MHz
    VIC  17:   720x576    50.000000 Hz   4:3     31.250 kHz     27.000000 MHz
    VIC   3:   720x480    59.940060 Hz  16:9     31.469 kHz     27.000000 MHz
    VIC   2:   720x480    59.940060 Hz   4:3     31.469 kHz     27.000000 MHz
    VIC   1:   640x480    59.940476 Hz   4:3     31.469 kHz     25.175000 MHz
  Audio Data Block:
    Linear PCM:
      Max channels: 2
      Supported sample rates (kHz): 96 88.2 48 44.1 32
      Supported sample sizes (bits): 24 20 16
  Speaker Allocation Data Block:
    FL/FR - Front Left/Right
  Vendor-Specific Data Block (HDMI), OUI 00-0C-03:
    Source physical address: 2.0.0.0
    DC_36bit
    DC_30bit
    DC_Y444
    Maximum TMDS clock: 300 MHz
  Video Capability Data Block:
    YCbCr quantization: No Data
    RGB quantization: Selectable (via AVI Q)
    PT scan behavior: Always Underscanned
    IT scan behavior: Always Underscanned
    CE scan behavior: Supports both over- and underscan
  Detailed Timing Descriptors:
    DTD 2:  2048x1080   23.996617 Hz 256:135   26.372 kHz     58.230000 MHz (941 mm x 265 mm)
                 Hfront   48 Hsync  32 Hback   80 Hpol P
                 Vfront    3 Vsync  10 Vback    6 Vpol N
    DTD 3:  1920x1080   60.000000 Hz  16:9     67.500 kHz    148.500000 MHz (941 mm x 265 mm)
                 Hfront   88 Hsync  44 Hback  148 Hpol P
                 Vfront    4 Vsync   5 Vback   36 Vpol P
    DTD 4:  1280x720    60.000000 Hz  16:9     45.000 kHz     74.250000 MHz (941 mm x 265 mm)
                 Hfront  110 Hsync  40 Hback  220 Hpol P
                 Vfront    5 Vsync   5 Vback   20 Vpol P
Checksum: 0x23  Unused space in Extension Block: 37 bytes

----------------

Warnings:

Block 1, CTA-861 Extension Block:
  Video Data Block: VIC 16 and the first DTD are not identical. Is this intended?
  Video Capability Data Block: Set Selectable YCbCr Quantization to avoid interop issues.
  Detailed Timing Descriptor #2: Image size is 941x265 mm, but based on the picture AR it should be 502x265 mm.
  Detailed Timing Descriptor #3: Image size is 941x265 mm, but based on the picture AR it should be 471x265 mm.
  Detailed Timing Descriptor #4: Image size is 941x265 mm, but based on the picture AR it should be 471x265 mm.
  Display Product Serial Number is set, so the Serial Number in the Base EDID should be 0.
  Add a Colorimetry Data Block with the sRGB colorimetry bit set to avoid interop issues.
EDID:
  Base EDID: Some timings are out of range of the Monitor Ranges:
    Vertical Freq: 23.997 - 75.029 Hz (Monitor: 29.000 - 76.000 Hz)
    Horizontal Freq: 26.372 - 79.976 kHz (Monitor: 30.000 - 83.000 kHz)

Failures:

EDID:
  Extension Block 2 started with EDID header, ignoring Extension Blocks >= 2.

EDID conformity: FAIL
