edid-decode (hex):

00 ff ff ff ff ff ff 00 14 89 09 12 00 00 00 00
32 18 01 03 b0 30 1b 78 2a c4 f6 a3 57 4a 9c 23
11 4f 54 bf ef 80 71 4f 81 80 81 40 95 00 a9 40
83 00 d1 c0 00 00 02 3a 80 18 71 38 2d 40 58 2c
45 00 09 25 21 00 00 1e 00 00 00 fd 00 3c 55 1e
51 0f 00 0a 20 20 20 20 20 20 00 00 00 fc 00 56
47 41 20 54 4f 20 48 44 4d 49 0a 20 00 00 00 fa
00 71 40 81 0f 8b c0 8b c0 90 40 a9 c0 0a 00 9d

00 ff ff ff ff ff ff 00 14 89 09 12 00 00 00 00
32 18 01 03 b0 30 1b 78 2a c4 f6 a3 57 4a 9c 23
11 4f 54 bf ef 80 71 4f 81 80 81 40 95 00 a9 40
83 00 d1 c0 00 00 02 3a 80 18 71 38 2d 40 58 2c
45 00 09 25 21 00 00 1e 00 00 00 fd 00 3c 55 1e
51 0f 00 0a 20 20 20 20 20 20 00 00 00 fc 00 56
47 41 20 54 4f 20 48 44 4d 49 0a 20 00 00 00 fa
00 71 40 81 0f 8b c0 8b c0 90 40 a9 c0 0a 00 9d

----------------

Block 0, Base EDID:
  EDID Structure Version & Revision: 1.3
  Vendor & Product Identification:
    Manufacturer: EDI
    Model: 4617
    Made in: week 50 of 2014
  Basic Display Parameters & Features:
    Digital display
    Maximum image size: 48 cm x 27 cm
    Gamma: 2.20
    DPMS levels: Off
    RGB color display
    First detailed timing is the preferred timing
  Color Characteristics:
    Red  : 0.6396, 0.3398
    Green: 0.2900, 0.6093
    Blue : 0.1396, 0.0693
    White: 0.3095, 0.3300
  Established Timings I & II:
    IBM     :   720x400    70.081663 Hz   9:5     31.467 kHz     28.320000 MHz
    DMT 0x04:   640x480    59.940476 Hz   4:3     31.469 kHz     25.175000 MHz
    Apple   :   640x480    66.666667 Hz   4:3     35.000 kHz     30.240000 MHz
    DMT 0x05:   640x480    72.808802 Hz   4:3     37.861 kHz     31.500000 MHz
    DMT 0x06:   640x480    75.000000 Hz   4:3     37.500 kHz     31.500000 MHz
    DMT 0x08:   800x600    56.250000 Hz   4:3     35.156 kHz     36.000000 MHz
    DMT 0x09:   800x600    60.316541 Hz   4:3     37.879 kHz     40.000000 MHz
    DMT 0x0a:   800x600    72.187572 Hz   4:3     48.077 kHz     50.000000 MHz
    DMT 0x0b:   800x600    75.000000 Hz   4:3     46.875 kHz     49.500000 MHz
    Apple   :   832x624    74.551266 Hz   4:3     49.726 kHz     57.284000 MHz
    DMT 0x10:  1024x768    60.003840 Hz   4:3     48.363 kHz     65.000000 MHz
    DMT 0x11:  1024x768    70.069359 Hz   4:3     56.476 kHz     75.000000 MHz
    DMT 0x12:  1024x768    75.028582 Hz   4:3     60.023 kHz     78.750000 MHz
    DMT 0x24:  1280x1024   75.024675 Hz   5:4     79.976 kHz    135.000000 MHz
    Apple   :  1152x870    75.061550 Hz 192:145   68.681 kHz    100.000000 MHz
  Standard Timings:
    DMT 0x15:  1152x864    75.000000 Hz   4:3     67.500 kHz    108.000000 MHz
    DMT 0x23:  1280x1024   60.019740 Hz   5:4     63.981 kHz    108.000000 MHz
    DMT 0x20:  1280x960    60.000000 Hz   4:3     60.000 kHz    108.000000 MHz
    DMT 0x2f:  1440x900    59.887445 Hz  16:10    55.935 kHz    106.500000 MHz
    DMT 0x33:  1600x1200   60.000000 Hz   4:3     75.000 kHz    162.000000 MHz
    GTF     :  1296x810    59.999944 Hz  16:10    50.340 kHz     86.182000 MHz
    DMT 0x52:  1920x1080   60.000000 Hz  16:9     67.500 kHz    148.500000 MHz
  Detailed Timing Descriptors:
    DTD 1:  1920x1080   60.000000 Hz  16:9     67.500 kHz    148.500000 MHz (521 mm x 293 mm)
                 Hfront   88 Hsync  44 Hback  148 Hpol P
                 Vfront    4 Vsync   5 Vback   36 Vpol P
    Display Range Limits:
      Monitor ranges (GTF): 60-85 Hz V, 30-81 kHz H, max dotclock 150 MHz
    Display Product Name: 'VGA TO HDMI'
    Standard Timing Identifications:
      GTF     :  1152x864    60.000000 Hz   4:3     53.700 kHz     81.624000 MHz
      DMT 0x1d:  1280x800    74.934142 Hz  16:10    62.795 kHz    106.500000 MHz
      GTF     :  1360x765    60.000341 Hz  16:9     47.520 kHz     84.396000 MHz
      GTF     :  1360x765    60.000341 Hz  16:9     47.520 kHz     84.396000 MHz
      DMT 0x2a:  1400x1050   59.978442 Hz   4:3     65.317 kHz    121.750000 MHz
      DMT 0x53:  1600x900    60.000000 Hz  16:9     60.000 kHz    108.000000 MHz (RB)
Checksum: 0x9d

----------------

Warnings:

Block 0, Base EDID:
  Standard Timing Identifications: Standard Timing 1360x765 has a dubious odd vertical resolution.
  Standard Timing Identifications: Standard Timing 1360x765 has a dubious odd vertical resolution.
EDID:
  Base EDID: Some timings are out of range of the Monitor Ranges:
    Vertical Freq: 56.250 - 75.062 Hz (Monitor: 60.000 - 85.000 Hz)
    Maximum Clock: 162.000 MHz (Monitor: 150.000 MHz)

Failures:

Block 0, Base EDID:
  Basic Display Parameters & Features: Digital Video Interface Standard set to reserved value 0x30.
  Standard Timings: Use 0x0101 as the invalid Standard Timings code, not 0x0000.
  Detailed Timing Descriptor #1: Mismatch of image size 521x293 mm vs display size 480x270 mm.
EDID:
  Extension Block 1 started with EDID header, ignoring Extension Blocks >= 1.
  Base EDID: The DTD max image size is 521x293mm, which is larger than the display size 480.0x270.0mm.

EDID conformity: FAIL
