edid-decode (hex):

00 ff ff ff ff ff ff 00 12 8d 00 27 01 00 00 00
0f 23 01 04 08 3c 21 78 aa 2d 36 a7 54 38 ae 26
0d 4f 54 b5 cb 80 71 40 81 c0 81 00 81 40 81 80
95 00 a9 c0 b3 00 02 3a 80 18 71 38 2d 40 58 2c
45 00 55 50 21 00 00 1a 2a 44 80 a0 70 38 27 40
30 2c 45 00 55 50 21 00 00 1c 00 00 00 ff 00 31
4d 34 36 37 38 32 30 33 30 31 39 39 00 00 00 fc
00 44 4d 32 37 30 56 0a 20 20 20 20 20 20 00 ca

00 ff ff ff ff ff ff 00 12 8d 00 27 01 00 00 00
0f 23 01 04 08 3c 21 78 aa 2d 36 a7 54 38 ae 26
0d 4f 54 b5 cb 80 71 40 81 c0 81 00 81 40 81 80
95 00 a9 c0 b3 00 02 3a 80 18 71 38 2d 40 58 2c
45 00 55 50 21 00 00 1a 2a 44 80 a0 70 38 27 40
30 2c 45 00 55 50 21 00 00 1c 00 00 00 ff 00 31
4d 34 36 37 38 32 30 33 30 31 39 39 00 00 00 fc
00 44 4d 32 37 30 56 0a 20 20 20 20 20 20 00 ca

----------------

Block 0, Base EDID:
  EDID Structure Version & Revision: 1.4
  Vendor & Product Identification:
    Manufacturer: DTM
    Model: 9984
    Serial Number: ...
    Made in: week 15 of 2025
  Basic Display Parameters & Features:
    Analog display
    Signal Level Standard: 0.700 : 0.300 : 1.000 V p-p
    Blank level equals black level
    Sync: Separate
    Maximum image size: 60 cm x 33 cm
    Gamma: 2.20
    DPMS levels: Standby Off
    RGB color display
    First detailed timing includes the native pixel format and preferred refresh rate
  Color Characteristics:
    Red  : 0.6523, 0.3300
    Green: 0.2216, 0.6806
    Blue : 0.1484, 0.0537
    White: 0.3095, 0.3300
  Established Timings I & II:
    IBM     :   720x400    70.081663 Hz   9:5     31.467 kHz     28.320000 MHz
    DMT 0x04:   640x480    59.940476 Hz   4:3     31.469 kHz     25.175000 MHz
    Apple   :   640x480    66.666667 Hz   4:3     35.000 kHz     30.240000 MHz
    DMT 0x06:   640x480    75.000000 Hz   4:3     37.500 kHz     31.500000 MHz
    DMT 0x09:   800x600    60.316541 Hz   4:3     37.879 kHz     40.000000 MHz
    DMT 0x0a:   800x600    72.187572 Hz   4:3     48.077 kHz     50.000000 MHz
    DMT 0x0b:   800x600    75.000000 Hz   4:3     46.875 kHz     49.500000 MHz
    DMT 0x10:  1024x768    60.003840 Hz   4:3     48.363 kHz     65.000000 MHz
    DMT 0x12:  1024x768    75.028582 Hz   4:3     60.023 kHz     78.750000 MHz
    DMT 0x24:  1280x1024   75.024675 Hz   5:4     79.976 kHz    135.000000 MHz
    Apple   :  1152x870    75.061550 Hz 192:145   68.681 kHz    100.000000 MHz
  Standard Timings:
    GTF     :  1152x864    60.000000 Hz   4:3     53.700 kHz     81.624000 MHz
    DMT 0x55:  1280x720    60.000000 Hz  16:9     45.000 kHz     74.250000 MHz
    DMT 0x1c:  1280x800    59.810326 Hz  16:10    49.702 kHz     83.500000 MHz
    DMT 0x20:  1280x960    60.000000 Hz   4:3     60.000 kHz    108.000000 MHz
    DMT 0x23:  1280x1024   60.019740 Hz   5:4     63.981 kHz    108.000000 MHz
    DMT 0x2f:  1440x900    59.887445 Hz  16:10    55.935 kHz    106.500000 MHz
    DMT 0x53:  1600x900    60.000000 Hz  16:9     60.000 kHz    108.000000 MHz (RB)
    DMT 0x3a:  1680x1050   59.954250 Hz  16:10    65.290 kHz    146.250000 MHz
  Detailed Timing Descriptors:
    DTD 1:  1920x1080   60.000000 Hz  16:9     67.500 kHz    148.500000 MHz (597 mm x 336 mm)
                 Hfront   88 Hsync  44 Hback  148 Hpol P
                 Vfront    4 Vsync   5 Vback   36 Vpol N
    DTD 2:  1920x1080   74.972503 Hz  16:9     83.894 kHz    174.500000 MHz (597 mm x 336 mm)
                 Hfront   48 Hsync  44 Hback   68 Hpol N
                 Vfront    4 Vsync   5 Vback   30 Vpol P
    Display Product Serial Number: ...
    Display Product Name: 'DM270V'
Checksum: 0xca

----------------

Warnings:

Block 0, Base EDID:
  Vendor & Product Identification: The serial number is one of the known dummy values, it should probably be set to 0.
  Detailed Timing Descriptor #1: DTD is similar but not identical to VIC 16.

Failures:

EDID:
  Extension Block 1 started with EDID header, ignoring Extension Blocks >= 1.

EDID conformity: FAIL
