edid-decode (hex):

00 ff ff ff ff ff ff 00 4e 14 b4 0c 01 01 01 01
0f 17 01 03 80 46 27 78 0a 92 03 a2 56 48 99 25
14 4a 4d a1 08 00 95 00 61 40 b3 00 01 01 01 01
01 01 01 01 01 01 66 21 50 b0 51 00 1b 30 40 70
36 00 ba 88 21 00 00 1e a9 1a 00 a0 50 00 16 30
30 20 37 00 ba 88 21 00 00 1a 00 00 00 fc 00 58
33 32 32 42 56 2d 48 44 52 0a 20 20 00 00 00 fd
00 3b 3d 0f 44 0f 00 0a 20 20 20 20 20 20 01 6c

----------------

Block 0, Base EDID:
  EDID Structure Version & Revision: 1.3
  Vendor & Product Identification:
    Manufacturer: SPT
    Model: 3252
    Serial Number: ...
    Made in: week 15 of 2013
  Basic Display Parameters & Features:
    Digital display
    Maximum image size: 70 cm x 39 cm
    Gamma: 2.20
    RGB color display
    First detailed timing is the preferred timing
  Color Characteristics:
    Red  : 0.6347, 0.3369
    Green: 0.2812, 0.5996
    Blue : 0.1445, 0.0781
    White: 0.2890, 0.3037
  Established Timings I & II:
    IBM     :   720x400    70.081663 Hz   9:5     31.467 kHz     28.320000 MHz
    DMT 0x04:   640x480    59.940476 Hz   4:3     31.469 kHz     25.175000 MHz
    DMT 0x09:   800x600    60.316541 Hz   4:3     37.879 kHz     40.000000 MHz
    DMT 0x10:  1024x768    60.003840 Hz   4:3     48.363 kHz     65.000000 MHz
  Standard Timings:
    DMT 0x2f:  1440x900    59.887445 Hz  16:10    55.935 kHz    106.500000 MHz
    DMT 0x10:  1024x768    60.003840 Hz   4:3     48.363 kHz     65.000000 MHz
    DMT 0x3a:  1680x1050   59.954250 Hz  16:10    65.290 kHz    146.250000 MHz
  Detailed Timing Descriptors:
    DTD 1:  1360x768    60.015162 Hz  85:48    47.712 kHz     85.500000 MHz (698 mm x 392 mm)
                 Hfront   64 Hsync 112 Hback  256 Hpol P
                 Vfront    3 Vsync   6 Vback   18 Vpol P
    DTD 2:  1280x768    59.994726 Hz   5:3     47.396 kHz     68.250000 MHz (698 mm x 392 mm)
                 Hfront   48 Hsync  32 Hback   80 Hpol P
                 Vfront    3 Vsync   7 Vback   12 Vpol N
    Display Product Name: 'X322BV-HDR'
    Display Range Limits:
      Monitor ranges (GTF): 59-61 Hz V, 15-68 kHz H, max dotclock 150 MHz
  Extension blocks: 1
Checksum: 0x6c

----------------

Warnings:

Block 0, Base EDID:
  Vendor & Product Identification: The serial number is one of the known dummy values, it should probably be set to 0.
  Detailed Timing Descriptor #2: Image size is 698x392 mm, but based on the picture AR it should be 698x418 mm.
EDID:
  Base EDID: Some timings are out of range of the Monitor Ranges:
    Vertical Freq: 59.887 - 70.082 Hz (Monitor: 59.000 - 61.000 Hz)

Failures:

EDID:
  Base EDID: EDID specified 1 extension block(s), but found 0 extension block(s).

EDID conformity: FAIL
