edid-decode (hex):

00 ff ff ff ff ff ff 00 36 74 50 18 01 00 00 00
16 13 01 03 68 22 13 78 ea 42 2f a3 54 45 99 26
0f 4a 4c ad cf 00 31 4a 45 4a 61 4c 01 01 01 01
01 01 01 01 01 01 1b 21 50 a0 51 00 1e 30 48 88
35 00 b9 88 21 00 00 1c a9 1a 00 a0 50 00 16 30
30 20 37 00 b9 88 21 00 00 1a 00 00 00 fc 00 31
38 35 57 48 4f 0a 20 20 20 20 20 20 00 00 00 fc
00 0a 20 20 20 20 20 20 20 20 20 20 20 20 00 57

00 ff ff ff ff ff ff 00 36 74 50 18 01 00 00 00
16 13 01 03 68 22 13 78 ea 42 2f a3 54 45 99 26
0f 4a 4c ad cf 00 31 4a 45 4a 61 4c 01 01 01 01
01 01 01 01 01 01 1b 21 50 a0 51 00 1e 30 48 88
35 00 b9 88 21 00 00 1c a9 1a 00 a0 50 00 16 30
30 20 37 00 b9 88 21 00 00 1a 00 00 00 fc 00 31
38 35 57 48 4f 0a 20 20 20 20 20 20 00 00 00 fc
00 0a 20 20 20 20 20 20 20 20 20 20 20 20 00 57

----------------

Block 0, Base EDID:
  EDID Structure Version & Revision: 1.3
  Vendor & Product Identification:
    Manufacturer: MST
    Model: 6224
    Serial Number: ...
    Made in: week 22 of 2009
  Basic Display Parameters & Features:
    Analog display
    Signal Level Standard: 0.700 : 0.000 : 0.700 V p-p
    Blank level equals black level
    Sync: Separate
    Maximum image size: 34 cm x 19 cm
    Gamma: 2.20
    DPMS levels: Standby Suspend Off
    RGB color display
    First detailed timing is the preferred timing
  Color Characteristics:
    Red  : 0.6376, 0.3281
    Green: 0.2695, 0.5996
    Blue : 0.1484, 0.0605
    White: 0.2919, 0.2998
  Established Timings I & II:
    IBM     :   720x400    70.081663 Hz   9:5     31.467 kHz     28.320000 MHz
    DMT 0x04:   640x480    59.940476 Hz   4:3     31.469 kHz     25.175000 MHz
    DMT 0x05:   640x480    72.808802 Hz   4:3     37.861 kHz     31.500000 MHz
    DMT 0x06:   640x480    75.000000 Hz   4:3     37.500 kHz     31.500000 MHz
    DMT 0x09:   800x600    60.316541 Hz   4:3     37.879 kHz     40.000000 MHz
    DMT 0x0a:   800x600    72.187572 Hz   4:3     48.077 kHz     50.000000 MHz
    DMT 0x0b:   800x600    75.000000 Hz   4:3     46.875 kHz     49.500000 MHz
    DMT 0x10:  1024x768    60.003840 Hz   4:3     48.363 kHz     65.000000 MHz
    DMT 0x11:  1024x768    70.069359 Hz   4:3     56.476 kHz     75.000000 MHz
    DMT 0x12:  1024x768    75.028582 Hz   4:3     60.023 kHz     78.750000 MHz
    DMT 0x24:  1280x1024   75.024675 Hz   5:4     79.976 kHz    135.000000 MHz
  Standard Timings:
    GTF     :   640x480    70.000000 Hz   4:3     35.000 kHz     28.560000 MHz
    GTF     :   800x600    70.000000 Hz   4:3     43.750 kHz     45.500000 MHz
    GTF     :  1024x768    72.000073 Hz   4:3     57.672 kHz     78.434000 MHz
  Detailed Timing Descriptors:
    DTD 1:  1360x768    59.798991 Hz  85:48    47.720 kHz     84.750000 MHz (697 mm x 392 mm)
                 Hfront   72 Hsync 136 Hback  208 Hpol N
                 Vfront    3 Vsync   5 Vback   22 Vpol P
    DTD 2:  1280x768    59.994726 Hz   5:3     47.396 kHz     68.250000 MHz (697 mm x 392 mm)
                 Hfront   48 Hsync  32 Hback   80 Hpol P
                 Vfront    3 Vsync   7 Vback   12 Vpol N
    Display Product Name: '185WHO'
    Display Product Name: ''
Checksum: 0x57

----------------

Warnings:

Block 0, Base EDID:
  Vendor & Product Identification: The serial number is one of the known dummy values, it should probably be set to 0.
  Detailed Timing Descriptor #2: Image size is 697x392 mm, but based on the picture AR it should be 653x392 mm.

Failures:

Block 0, Base EDID:
  Detailed Timing Descriptor #1: Mismatch of image size 697x392 mm vs display size 340x190 mm.
  Detailed Timing Descriptor #2: Mismatch of image size 697x392 mm vs display size 340x190 mm.
  Display Product Name: Empty string.
  Missing Display Range Limits Descriptor.
EDID:
  Extension Block 1 started with EDID header, ignoring Extension Blocks >= 1.
  Base EDID: The DTD max image size is 697x392mm, which is larger than the display size 340.0x190.0mm.

EDID conformity: FAIL
