edid-decode (hex):

00 ff ff ff ff ff ff 00 30 e4 c6 06 00 00 00 00
00 1f 01 04 a5 1d 11 78 06 b2 f5 a5 53 4e 9b 27
0c 50 54 00 00 00 01 01 01 01 01 01 01 01 01 01
01 01 01 01 01 01 2e 36 80 a0 70 38 1f 40 30 20
35 00 26 a5 10 00 00 1a 5c 2b 80 a0 70 38 1f 40
30 20 35 00 26 a5 10 00 00 1a 00 00 00 fe 00 43
37 4a 44 36 80 31 33 33 57 46 37 0a 00 00 00 00
00 01 41 31 9e 00 11 00 00 0a 01 0a 20 20 00 6d

00 ff ff ff ff ff ff 00 30 e4 c6 06 00 00 00 00
00 1f 01 04 a5 1d 11 78 06 b2 f5 a5 53 4e 9b 27
0c 50 54 00 00 00 01 01 01 01 01 01 01 01 01 01
01 01 01 01 01 01 2e 36 80 a0 70 38 1f 40 30 20
35 00 26 a5 10 00 00 1a 5c 2b 80 a0 70 38 1f 40
30 20 35 00 26 a5 10 00 00 1a 00 00 00 fe 00 43
37 4a 44 36 80 31 33 33 57 46 37 0a 00 00 00 00
00 01 41 31 9e 00 11 00 00 0a 01 0a 20 20 00 6d

----------------

Block 0, Base EDID:
  EDID Structure Version & Revision: 1.4
  Vendor & Product Identification:
    Manufacturer: LGD
    Model: 1734
    Made in: 2021
  Basic Display Parameters & Features:
    Digital display
    Bits per primary color channel: 8
    DisplayPort interface
    Maximum image size: 29 cm x 17 cm
    Gamma: 2.20
    Supported color formats: RGB 4:4:4
    Default (sRGB) color space is primary color space
    First detailed timing includes the native pixel format and preferred refresh rate
  Color Characteristics:
    Red  : 0.6464, 0.3271
    Green: 0.3046, 0.6074
    Blue : 0.1552, 0.0498
    White: 0.3134, 0.3291
  Established Timings I & II: none
  Standard Timings: none
  Detailed Timing Descriptors:
    DTD 1:  1920x1080   60.020425 Hz  16:9     66.683 kHz    138.700000 MHz (294 mm x 165 mm)
                 Hfront   48 Hsync  32 Hback   80 Hpol P
                 Vfront    3 Vsync   5 Vback   23 Vpol N
    DTD 2:  1920x1080   48.033650 Hz  16:9     53.365 kHz    111.000000 MHz (294 mm x 165 mm)
                 Hfront   48 Hsync  32 Hback   80 Hpol P
                 Vfront    3 Vsync   5 Vback   23 Vpol N
    Alphanumeric Data String: 'C7JD6.133WF7'
    Manufacturer-Specified Display Descriptor (0x00): 00 00 00 01 41 31 9e 00 11 00 00 0a 01 0a 20 20 '....A1........  '
Checksum: 0x6d

----------------

Warnings:

Block 0, Base EDID:
  Alphanumeric Data String: Non-ASCII character 0x80 at position 5, can cause problems.
  Missing Display Product Name.

Failures:

Block 0, Base EDID:
  Basic Display Parameters & Features: sRGB is signaled, but the chromaticities do not match.
EDID:
  Extension Block 1 started with EDID header, ignoring Extension Blocks >= 1.

EDID conformity: FAIL
