edid-decode (hex):

00 ff ff ff ff ff ff 00 4c 2d 7c 0c 51 4b 5a 5a
17 1a 01 03 80 2f 1d 78 2a d9 85 a4 55 4d 9a 26
10 50 54 bf ef 80 71 4f 81 c0 81 00 81 80 95 00
a9 c0 01 01 01 01 21 39 90 30 62 1a 27 40 68 b0
36 00 d9 23 11 00 00 1c 00 00 00 fd 00 38 4b 1e
51 11 00 0a 20 20 20 20 20 20 00 00 00 fc 00 53
32 32 45 34 35 30 0a 20 20 20 20 20 00 00 00 ff
00 48 34 4c 48 36 30 30 36 32 39 0a 20 20 01 3d

02 01 04 00 01 1d 00 72 51 d0 1e 20 6e 28 55 00
d9 23 11 00 00 1e 01 1d 00 bc 52 d0 1e 20 b8 28
55 40 d9 23 11 00 00 1e 8c 0a d0 90 20 40 31 20
0c 40 55 00 d9 23 11 00 00 18 8c 0a d0 8a 20 e0
2d 10 10 3e 96 00 d9 23 11 00 00 18 00 00 00 00
00 00 00 00 00 00 00 00 00 00 00 00 00 00 00 00
00 00 00 00 00 00 00 00 00 00 00 00 00 00 00 00
00 00 00 00 00 00 00 00 00 00 00 00 00 00 00 77

00 ff ff ff ff ff ff 00 4c 2d 7c 0c 51 4b 5a 5a
17 1a 01 03 80 2f 1d 78 2a d9 85 a4 55 4d 9a 26
10 50 54 bf ef 80 71 4f 81 c0 81 00 81 80 95 00
a9 c0 01 01 01 01 21 39 90 30 62 1a 27 40 68 b0
36 00 d9 23 11 00 00 1c 00 00 00 fd 00 38 4b 1e
51 11 00 0a 20 20 20 20 20 20 00 00 00 fc 00 53
32 32 45 34 35 30 0a 20 20 20 20 20 00 00 00 ff
00 48 34 4c 48 36 30 30 36 32 39 0a 20 20 01 3d

02 01 04 00 01 1d 00 72 51 d0 1e 20 6e 28 55 00
d9 23 11 00 00 1e 01 1d 00 bc 52 d0 1e 20 b8 28
55 40 d9 23 11 00 00 1e 8c 0a d0 90 20 40 31 20
0c 40 55 00 d9 23 11 00 00 18 8c 0a d0 8a 20 e0
2d 10 10 3e 96 00 d9 23 11 00 00 18 00 00 00 00
00 00 00 00 00 00 00 00 00 00 00 00 00 00 00 00
00 00 00 00 00 00 00 00 00 00 00 00 00 00 00 00
00 00 00 00 00 00 00 00 00 00 00 00 00 00 00 77

----------------

Block 0, Base EDID:
  EDID Structure Version & Revision: 1.3
  Vendor & Product Identification:
    Manufacturer: SAM
    Model: 3196
    Serial Number: ...
    Made in: week 23 of 2016
  Basic Display Parameters & Features:
    Digital display
    Maximum image size: 47 cm x 29 cm
    Gamma: 2.20
    DPMS levels: Off
    RGB color display
    First detailed timing is the preferred timing
  Color Characteristics:
    Red  : 0.6435, 0.3330
    Green: 0.3027, 0.6025
    Blue : 0.1503, 0.0625
    White: 0.3134, 0.3291
  Established Timings I & II:
    IBM     :   720x400    70.081663 Hz   9:5     31.467 kHz     28.320000 MHz
    DMT 0x04:   640x480    59.940476 Hz   4:3     31.469 kHz     25.175000 MHz
    Apple   :   640x480    66.666667 Hz   4:3     35.000 kHz     30.240000 MHz
    DMT 0x05:   640x480    72.808802 Hz   4:3     37.861 kHz     31.500000 MHz
    DMT 0x06:   640x480    75.000000 Hz   4:3     37.500 kHz     31.500000 MHz
    DMT 0x08:   800x600    56.250000 Hz   4:3     35.156 kHz     36.000000 MHz
    DMT 0x09:   800x600    60.316541 Hz   4:3     37.879 kHz     40.000000 MHz
    DMT 0x0a:   800x600    72.187572 Hz   4:3     48.077 kHz     50.000000 MHz
    DMT 0x0b:   800x600    75.000000 Hz   4:3     46.875 kHz     49.500000 MHz
    Apple   :   832x624    74.551266 Hz   4:3     49.726 kHz     57.284000 MHz
    DMT 0x10:  1024x768    60.003840 Hz   4:3     48.363 kHz     65.000000 MHz
    DMT 0x11:  1024x768    70.069359 Hz   4:3     56.476 kHz     75.000000 MHz
    DMT 0x12:  1024x768    75.028582 Hz   4:3     60.023 kHz     78.750000 MHz
    DMT 0x24:  1280x1024   75.024675 Hz   5:4     79.976 kHz    135.000000 MHz
    Apple   :  1152x870    75.061550 Hz 192:145   68.681 kHz    100.000000 MHz
  Standard Timings:
    DMT 0x15:  1152x864    75.000000 Hz   4:3     67.500 kHz    108.000000 MHz
    DMT 0x55:  1280x720    60.000000 Hz  16:9     45.000 kHz     74.250000 MHz
    DMT 0x1c:  1280x800    59.810326 Hz  16:10    49.702 kHz     83.500000 MHz
    DMT 0x23:  1280x1024   60.019740 Hz   5:4     63.981 kHz    108.000000 MHz
    DMT 0x2f:  1440x900    59.887445 Hz  16:10    55.935 kHz    106.500000 MHz
    DMT 0x53:  1600x900    60.000000 Hz  16:9     60.000 kHz    108.000000 MHz (RB)
  Detailed Timing Descriptors:
    DTD 1:  1680x1050   59.954250 Hz  16:10    65.290 kHz    146.250000 MHz (473 mm x 291 mm)
                 Hfront  104 Hsync 176 Hback  280 Hpol N
                 Vfront    3 Vsync   6 Vback   30 Vpol P
    Display Range Limits:
      Monitor ranges (GTF): 56-75 Hz V, 30-81 kHz H, max dotclock 170 MHz
    Display Product Name: 'S22E450'
    Display Product Serial Number: ...
  Extension blocks: 1
Checksum: 0x3d

----------------

Block 1, CTA-861 Extension Block:
  Revision: 1
  Detailed Timing Descriptors:
    DTD 2:  1280x720    60.000000 Hz  16:9     45.000 kHz     74.250000 MHz (473 mm x 291 mm)
                 Hfront  110 Hsync  40 Hback  220 Hpol P
                 Vfront    5 Vsync   5 Vback   20 Vpol P
    DTD 3:  1280x720    50.000000 Hz  16:9     37.500 kHz     74.250000 MHz (473 mm x 291 mm)
                 Hfront  440 Hsync  40 Hback  220 Hpol P
                 Vfront    5 Vsync   5 Vback   20 Vpol P
    DTD 4:   720x576    50.000000 Hz   5:4     31.250 kHz     27.000000 MHz (473 mm x 291 mm)
                 Hfront   12 Hsync  64 Hback   68 Hpol N
                 Vfront    5 Vsync   5 Vback   39 Vpol N
    DTD 5:   720x480    59.940060 Hz   3:2     31.469 kHz     27.000000 MHz (473 mm x 291 mm)
                 Hfront   16 Hsync  62 Hback   60 Hpol N
                 Vfront    9 Vsync   6 Vback   30 Vpol N
Checksum: 0x77  Unused space in Extension Block: 51 bytes

----------------

Block 2, Unknown EDID Extension Block 0x00:
  00 ff ff ff ff ff ff 00 4c 2d 7c 0c 51 4b 5a 5a '........L-|.QKZZ'
  17 1a 01 03 80 2f 1d 78 2a d9 85 a4 55 4d 9a 26 '...../.x*...UM.&'
  10 50 54 bf ef 80 71 4f 81 c0 81 00 81 80 95 00 '.PT...qO........'
  a9 c0 01 01 01 01 21 39 90 30 62 1a 27 40 68 b0 '......!9.0b.'@h.'
  36 00 d9 23 11 00 00 1c 00 00 00 fd 00 38 4b 1e '6..#.........8K.'
  51 11 00 0a 20 20 20 20 20 20 00 00 00 fc 00 53 'Q...      .....S'
  32 32 45 34 35 30 0a 20 20 20 20 20 00 00 00 ff '22E450.     ....'
  00 48 34 4c 48 36 30 30 36 32 39 0a 20 20 01 3d '.H4LH600629.  .='
Checksum: 0x3d

----------------

Block 3, CTA-861 Extension Block:
  Revision: 1
  Detailed Timing Descriptors:
    DTD 6:  1280x720    60.000000 Hz  16:9     45.000 kHz     74.250000 MHz (473 mm x 291 mm)
                 Hfront  110 Hsync  40 Hback  220 Hpol P
                 Vfront    5 Vsync   5 Vback   20 Vpol P
    DTD 7:  1280x720    50.000000 Hz  16:9     37.500 kHz     74.250000 MHz (473 mm x 291 mm)
                 Hfront  440 Hsync  40 Hback  220 Hpol P
                 Vfront    5 Vsync   5 Vback   20 Vpol P
    DTD 8:   720x576    50.000000 Hz   5:4     31.250 kHz     27.000000 MHz (473 mm x 291 mm)
                 Hfront   12 Hsync  64 Hback   68 Hpol N
                 Vfront    5 Vsync   5 Vback   39 Vpol N
    DTD 9:   720x480    59.940060 Hz   3:2     31.469 kHz     27.000000 MHz (473 mm x 291 mm)
                 Hfront   16 Hsync  62 Hback   60 Hpol N
                 Vfront    9 Vsync   6 Vback   30 Vpol N
Checksum: 0x77  Unused space in Extension Block: 51 bytes

----------------

Warnings:

Block 1, CTA-861 Extension Block:
  Detailed Timing Descriptor #2: DTD is identical to VIC 4, which is not present in the CTA Ext Block.
  Detailed Timing Descriptor #2: Image size is 473x291 mm, but based on the picture AR it should be 473x266 mm.
  Detailed Timing Descriptor #3: DTD is identical to VIC 19, which is not present in the CTA Ext Block.
  Detailed Timing Descriptor #3: Image size is 473x291 mm, but based on the picture AR it should be 473x266 mm.
  Detailed Timing Descriptor #4: Image size is 473x291 mm, but based on the picture AR it should be 473x378 mm.
  Detailed Timing Descriptor #5: Image size is 473x291 mm, but based on the picture AR it should be 473x315 mm.
  Display Product Serial Number is set, so the Serial Number in the Base EDID should be 0.
  Add a Colorimetry Data Block with the sRGB colorimetry bit set to avoid interop issues.
Block 3, CTA-861 Extension Block:
  Detailed Timing Descriptor #6: DTD is identical to VIC 4, which is not present in the CTA Ext Block.
  Detailed Timing Descriptor #6: Image size is 473x291 mm, but based on the picture AR it should be 473x266 mm.
  Detailed Timing Descriptor #7: DTD is identical to VIC 19, which is not present in the CTA Ext Block.
  Detailed Timing Descriptor #7: Image size is 473x291 mm, but based on the picture AR it should be 473x266 mm.
  Detailed Timing Descriptor #8: Image size is 473x291 mm, but based on the picture AR it should be 473x378 mm.
  Detailed Timing Descriptor #9: Image size is 473x291 mm, but based on the picture AR it should be 473x315 mm.
EDID:
  Base EDID: Some timings are out of range of the Monitor Ranges:
    Vertical Freq: 50.000 - 75.062 Hz (Monitor: 56.000 - 75.000 Hz)

Failures:

Block 1, CTA-861 Extension Block:
  Missing VCDB, needed for Set Selectable RGB Quantization to avoid interop issues.
Block 2, Base EDID:
  Unknown Extension Block.
EDID:
  Base EDID: EDID specified 1 extension block(s), but found 3 extension block(s).
  Base EDID: EDID 1.3 requires a Block Map Extension in Block 1 if there are more than 2 blocks in the EDID.

EDID conformity: FAIL
