edid-decode (hex):

00 ff ff ff ff ff ff 00 4d d9 01 e7 01 01 01 01
1c 13 01 03 80 35 1d 78 0a 0d c9 a0 57 47 98 27
12 48 4c 20 08 00 01 01 01 01 01 01 01 01 01 01
01 01 01 01 01 01 02 3a 80 18 71 38 2d 40 46 28
55 00 13 2b 21 00 00 18 01 1d 80 18 71 1c 16 20
58 2c 25 00 13 2b 21 00 00 9e 00 00 00 fc 00 48
44 4d 49 20 54 56 0a 20 20 20 20 20 00 00 00 fd
00 32 3f 0f 6f 11 00 0a 20 20 20 20 20 20 01 1f

02 03 21 72 4d 90 1f 04 13 05 14 03 12 02 11 01
06 15 23 09 07 07 83 01 00 00 66 03 0c 00 10 00
80 01 1d 00 72 51 d0 1e 20 6e 28 55 00 13 2b 21
00 00 1e 8c 0a d0 90 20 40 31 20 0c 40 55 00 13
2b 21 00 00 18 8c 0a d0 8a 20 e0 2d 10 10 3e 96
00 13 2b 21 00 00 18 02 3a 80 d0 72 38 2d 40 10
2c 45 80 13 2b 21 00 00 1e 01 1d 00 bc 52 d0 1e
20 b8 28 55 40 13 2b 21 00 00 1e 00 00 00 00 4a

00 ff ff ff ff ff ff 00 4d d9 01 e7 01 01 01 01
1c 13 01 03 80 35 1d 78 0a 0d c9 a0 57 47 98 27
12 48 4c 20 08 00 01 01 01 01 01 01 01 01 01 01
01 01 01 01 01 01 02 3a 80 18 71 38 2d 40 46 28
55 00 13 2b 21 00 00 18 01 1d 80 18 71 1c 16 20
58 2c 25 00 13 2b 21 00 00 9e 00 00 00 fc 00 48
44 4d 49 20 54 56 0a 20 20 20 20 20 00 00 00 fd
00 32 3f 0f 6f 11 00 0a 20 20 20 20 20 20 01 1f

02 03 21 72 4d 90 1f 04 13 05 14 03 12 02 11 01
06 15 23 09 07 07 83 01 00 00 66 03 0c 00 10 00
80 01 1d 00 72 51 d0 1e 20 6e 28 55 00 13 2b 21
00 00 1e 8c 0a d0 90 20 40 31 20 0c 40 55 00 13
2b 21 00 00 18 8c 0a d0 8a 20 e0 2d 10 10 3e 96
00 13 2b 21 00 00 18 02 3a 80 d0 72 38 2d 40 10
2c 45 80 13 2b 21 00 00 1e 01 1d 00 bc 52 d0 1e
20 b8 28 55 40 13 2b 21 00 00 1e 00 00 00 00 4a

----------------

Block 0, Base EDID:
  EDID Structure Version & Revision: 1.3
  Vendor & Product Identification:
    Manufacturer: SNY
    Model: 59137
    Serial Number: ...
    Made in: week 28 of 2009
  Basic Display Parameters & Features:
    Digital display
    Maximum image size: 53 cm x 29 cm
    Gamma: 2.20
    RGB color display
    First detailed timing is the preferred timing
  Color Characteristics:
    Red  : 0.6250, 0.3398
    Green: 0.2802, 0.5947
    Blue : 0.1552, 0.0703
    White: 0.2832, 0.2978
  Established Timings I & II:
    DMT 0x04:   640x480    59.940476 Hz   4:3     31.469 kHz     25.175000 MHz
    DMT 0x10:  1024x768    60.003840 Hz   4:3     48.363 kHz     65.000000 MHz
  Standard Timings: none
  Detailed Timing Descriptors:
    DTD 1:  1920x1080   60.000000 Hz  16:9     67.500 kHz    148.500000 MHz (531 mm x 299 mm)
                 Hfront   70 Hsync  40 Hback  170 Hpol N
                 Vfront    5 Vsync   5 Vback   35 Vpol N
    DTD 2:  1920x1080i  60.000000 Hz  16:9     33.750 kHz     74.250000 MHz (531 mm x 299 mm)
                 Hfront   88 Hsync  44 Hback  148 Hpol P
                 Vfront    2 Vsync   5 Vback   15 Vpol P Vfront +0.5 Odd Field
                 Vfront    2 Vsync   5 Vback   15 Vpol P Vback  +0.5 Even Field
    Display Product Name: 'HDMI TV'
    Display Range Limits:
      Monitor ranges (GTF): 50-63 Hz V, 15-111 kHz H, max dotclock 170 MHz
  Extension blocks: 1
Checksum: 0x1f

----------------

Block 1, CTA-861 Extension Block:
  Revision: 3
  Basic audio support
  Supports YCbCr 4:4:4
  Supports YCbCr 4:2:2
  Native DTDs: 2
  Video Data Block:
    VIC  16:  1920x1080   60.000000 Hz  16:9     67.500 kHz    148.500000 MHz (native)
    VIC  31:  1920x1080   50.000000 Hz  16:9     56.250 kHz    148.500000 MHz
    VIC   4:  1280x720    60.000000 Hz  16:9     45.000 kHz     74.250000 MHz
    VIC  19:  1280x720    50.000000 Hz  16:9     37.500 kHz     74.250000 MHz
    VIC   5:  1920x1080i  60.000000 Hz  16:9     33.750 kHz     74.250000 MHz
    VIC  20:  1920x1080i  50.000000 Hz  16:9     28.125 kHz     74.250000 MHz
    VIC   3:   720x480    59.940060 Hz  16:9     31.469 kHz     27.000000 MHz
    VIC  18:   720x576    50.000000 Hz  16:9     31.250 kHz     27.000000 MHz
    VIC   2:   720x480    59.940060 Hz   4:3     31.469 kHz     27.000000 MHz
    VIC  17:   720x576    50.000000 Hz   4:3     31.250 kHz     27.000000 MHz
    VIC   1:   640x480    59.940476 Hz   4:3     31.469 kHz     25.175000 MHz
    VIC   6:  1440x480i   59.940060 Hz   4:3     15.734 kHz     27.000000 MHz
    VIC  21:  1440x576i   50.000000 Hz   4:3     15.625 kHz     27.000000 MHz
  Audio Data Block:
    Linear PCM:
      Max channels: 2
      Supported sample rates (kHz): 48 44.1 32
      Supported sample sizes (bits): 24 20 16
  Speaker Allocation Data Block:
    FL/FR - Front Left/Right
  Vendor-Specific Data Block (HDMI), OUI 00-0C-03:
    Source physical address: 1.0.0.0
    Supports_AI
  Detailed Timing Descriptors:
    DTD 3:  1280x720    60.000000 Hz  16:9     45.000 kHz     74.250000 MHz (531 mm x 299 mm)
                 Hfront  110 Hsync  40 Hback  220 Hpol P
                 Vfront    5 Vsync   5 Vback   20 Vpol P
    DTD 4:   720x576    50.000000 Hz   5:4     31.250 kHz     27.000000 MHz (531 mm x 299 mm)
                 Hfront   12 Hsync  64 Hback   68 Hpol N
                 Vfront    5 Vsync   5 Vback   39 Vpol N
    DTD 5:   720x480    59.940060 Hz   3:2     31.469 kHz     27.000000 MHz (531 mm x 299 mm)
                 Hfront   16 Hsync  62 Hback   60 Hpol N
                 Vfront    9 Vsync   6 Vback   30 Vpol N
    DTD 6:  1920x1080   50.000000 Hz  16:9     56.250 kHz    148.500000 MHz (531 mm x 299 mm)
                 Hfront  528 Hsync  44 Hback  148 Hpol P
                 Vfront    4 Vsync   5 Vback   36 Vpol P
    DTD 7:  1280x720    50.000000 Hz  16:9     37.500 kHz     74.250000 MHz (531 mm x 299 mm)
                 Hfront  440 Hsync  40 Hback  220 Hpol P
                 Vfront    5 Vsync   5 Vback   20 Vpol P
Checksum: 0x4a  Unused space in Extension Block: 4 bytes

----------------

Warnings:

Block 0, Base EDID:
  Vendor & Product Identification: The serial number is one of the known dummy values, it should probably be set to 0.
  Detailed Timing Descriptor #1: DTD is similar but not identical to VIC 16.
Block 1, CTA-861 Extension Block:
  IT Video Formats are overscanned by default, but normally this should be underscanned.
  Video Data Block: VIC 16 and the first DTD are not identical. Is this intended?
  Detailed Timing Descriptor #4: Image size is 531x299 mm, but based on the picture AR it should be 373x299 mm.
  Detailed Timing Descriptor #5: Image size is 531x299 mm, but based on the picture AR it should be 448x299 mm.
  Add a Colorimetry Data Block with the sRGB colorimetry bit set to avoid interop issues.

Failures:

Block 1, CTA-861 Extension Block:
  Missing VCDB, needed for Set Selectable RGB Quantization to avoid interop issues.
EDID:
  Extension Block 2 started with EDID header, ignoring Extension Blocks >= 2.

EDID conformity: FAIL
