edid-decode (hex):

00 ff ff ff ff ff ff 00 30 ae a3 66 01 01 01 01
14 1f 01 03 80 3c 21 78 3a 92 55 a7 55 53 93 28
13 50 54 af ed 00 71 4f 81 c0 81 80 81 8a b3 00
d1 c0 a9 c0 01 01 02 3a 80 18 71 38 2d 40 58 2c
45 00 55 50 21 00 00 1e 00 00 00 ff 00 55 47 57
30 36 47 48 35 0a 20 20 20 20 00 00 00 fd 00 30
a5 1e a8 3c 01 0a 20 20 20 20 20 20 00 00 00 fc
00 4c 45 4e 20 47 32 37 63 2d 31 30 0a 20 01 b2

02 03 35 f1 49 03 04 90 1f 02 11 12 13 3f 23 09
07 07 83 01 00 00 68 03 0c 00 20 00 38 78 00 67
d8 5d c4 01 78 80 00 6d 1a 00 00 02 01 30 a5 ed
00 00 00 00 00 7b 7f 80 78 70 38 1f 40 30 20 45
00 55 50 21 00 00 1a 12 9e 80 04 71 38 2d 40 58
2c 45 00 55 50 21 00 00 1e 66 21 56 aa 51 00 1e
30 46 8f 33 00 55 50 21 00 00 1e 7f 48 80 18 71
38 2d 40 30 28 55 00 55 50 21 00 00 1e 00 00 38

00 ff ff ff ff ff ff 00 30 ae a3 66 01 01 01 01
14 1f 01 03 80 3c 21 78 3a 92 55 a7 55 53 93 28
13 50 54 af ed 00 71 4f 81 c0 81 80 81 8a b3 00
d1 c0 a9 c0 01 01 02 3a 80 18 71 38 2d 40 58 2c
45 00 55 50 21 00 00 1e 00 00 00 ff 00 55 47 57
30 36 47 48 35 0a 20 20 20 20 00 00 00 fd 00 30
a5 1e a8 3c 01 0a 20 20 20 20 20 20 00 00 00 fc
00 4c 45 4e 20 47 32 37 63 2d 31 30 0a 20 01 b2

02 03 35 f1 49 03 04 90 1f 02 11 12 13 3f 23 09
07 07 83 01 00 00 68 03 0c 00 20 00 38 78 00 67
d8 5d c4 01 78 80 00 6d 1a 00 00 02 01 30 a5 ed
00 00 00 00 00 7b 7f 80 78 70 38 1f 40 30 20 45
00 55 50 21 00 00 1a 12 9e 80 04 71 38 2d 40 58
2c 45 00 55 50 21 00 00 1e 66 21 56 aa 51 00 1e
30 46 8f 33 00 55 50 21 00 00 1e 7f 48 80 18 71
38 2d 40 30 28 55 00 55 50 21 00 00 1e 00 00 38

----------------

Block 0, Base EDID:
  EDID Structure Version & Revision: 1.3
  Vendor & Product Identification:
    Manufacturer: LEN
    Model: 26275
    Serial Number: ...
    Made in: week 20 of 2021
  Basic Display Parameters & Features:
    Digital display
    Maximum image size: 60 cm x 33 cm
    Gamma: 2.20
    DPMS levels: Off
    Undefined display color type
    First detailed timing is the preferred timing
  Color Characteristics:
    Red  : 0.6542, 0.3330
    Green: 0.3242, 0.5761
    Blue : 0.1572, 0.0751
    White: 0.3134, 0.3291
  Established Timings I & II:
    IBM     :   720x400    70.081663 Hz   9:5     31.467 kHz     28.320000 MHz
    DMT 0x04:   640x480    59.940476 Hz   4:3     31.469 kHz     25.175000 MHz
    DMT 0x05:   640x480    72.808802 Hz   4:3     37.861 kHz     31.500000 MHz
    DMT 0x06:   640x480    75.000000 Hz   4:3     37.500 kHz     31.500000 MHz
    DMT 0x08:   800x600    56.250000 Hz   4:3     35.156 kHz     36.000000 MHz
    DMT 0x09:   800x600    60.316541 Hz   4:3     37.879 kHz     40.000000 MHz
    DMT 0x0a:   800x600    72.187572 Hz   4:3     48.077 kHz     50.000000 MHz
    DMT 0x0b:   800x600    75.000000 Hz   4:3     46.875 kHz     49.500000 MHz
    Apple   :   832x624    74.551266 Hz   4:3     49.726 kHz     57.284000 MHz
    DMT 0x10:  1024x768    60.003840 Hz   4:3     48.363 kHz     65.000000 MHz
    DMT 0x11:  1024x768    70.069359 Hz   4:3     56.476 kHz     75.000000 MHz
    DMT 0x24:  1280x1024   75.024675 Hz   5:4     79.976 kHz    135.000000 MHz
  Standard Timings:
    DMT 0x15:  1152x864    75.000000 Hz   4:3     67.500 kHz    108.000000 MHz
    DMT 0x55:  1280x720    60.000000 Hz  16:9     45.000 kHz     74.250000 MHz
    DMT 0x23:  1280x1024   60.019740 Hz   5:4     63.981 kHz    108.000000 MHz
    GTF     :  1280x1024   69.999805 Hz   5:4     74.620 kHz    128.943000 MHz
    DMT 0x3a:  1680x1050   59.954250 Hz  16:10    65.290 kHz    146.250000 MHz
    DMT 0x52:  1920x1080   60.000000 Hz  16:9     67.500 kHz    148.500000 MHz
    DMT 0x53:  1600x900    60.000000 Hz  16:9     60.000 kHz    108.000000 MHz (RB)
  Detailed Timing Descriptors:
    DTD 1:  1920x1080   60.000000 Hz  16:9     67.500 kHz    148.500000 MHz (597 mm x 336 mm)
                 Hfront   88 Hsync  44 Hback  148 Hpol P
                 Vfront    4 Vsync   5 Vback   36 Vpol P
    Display Product Serial Number: ...
    Display Range Limits:
      Monitor ranges (Range Limits Only): 48-165 Hz V, 30-168 kHz H, max dotclock 600 MHz
    Display Product Name: 'LEN G27c-10'
  Extension blocks: 1
Checksum: 0xb2

----------------

Block 1, CTA-861 Extension Block:
  Revision: 3
  Underscans IT Video Formats by default
  Basic audio support
  Supports YCbCr 4:4:4
  Supports YCbCr 4:2:2
  Native DTDs: 1
  Video Data Block:
    VIC   3:   720x480    59.940060 Hz  16:9     31.469 kHz     27.000000 MHz
    VIC   4:  1280x720    60.000000 Hz  16:9     45.000 kHz     74.250000 MHz
    VIC  16:  1920x1080   60.000000 Hz  16:9     67.500 kHz    148.500000 MHz (native)
    VIC  31:  1920x1080   50.000000 Hz  16:9     56.250 kHz    148.500000 MHz
    VIC   2:   720x480    59.940060 Hz   4:3     31.469 kHz     27.000000 MHz
    VIC  17:   720x576    50.000000 Hz   4:3     31.250 kHz     27.000000 MHz
    VIC  18:   720x576    50.000000 Hz  16:9     31.250 kHz     27.000000 MHz
    VIC  19:  1280x720    50.000000 Hz  16:9     37.500 kHz     74.250000 MHz
    VIC  63:  1920x1080  120.000000 Hz  16:9    135.000 kHz    297.000000 MHz
  Audio Data Block:
    Linear PCM:
      Max channels: 2
      Supported sample rates (kHz): 48 44.1 32
      Supported sample sizes (bits): 24 20 16
  Speaker Allocation Data Block:
    FL/FR - Front Left/Right
  Vendor-Specific Data Block (HDMI), OUI 00-0C-03:
    Source physical address: 2.0.0.0
    DC_36bit
    DC_30bit
    DC_Y444
    Maximum TMDS clock: 600 MHz
  Vendor-Specific Data Block (HDMI Forum), OUI C4-5D-D8:
    Version: 1
    Maximum TMDS Character Rate: 600 MHz
    SCDC Present
  Vendor-Specific Data Block (AMD), OUI 00-00-1A:
    Version: 2
    Feature Caps: 0x01
    Minimum Refresh Rate: 48 Hz
    Maximum Refresh Rate: 165 Hz
    Flags 1.x: 0xed (MCCS)
    Flags 2.x: 0x00
  Detailed Timing Descriptors:
    DTD 2:  1920x1080  143.992340 Hz  16:9    159.975 kHz    326.350000 MHz (597 mm x 336 mm)
                 Hfront   48 Hsync  32 Hback   40 Hpol P
                 Vfront    4 Vsync   5 Vback   22 Vpol N
    DTD 3:  1920x1080  164.998981 Hz  16:9    185.624 kHz    404.660000 MHz (597 mm x 336 mm)
                 Hfront   88 Hsync  44 Hback  128 Hpol P
                 Vfront    4 Vsync   5 Vback   36 Vpol P
    DTD 4:  1366x768    59.789541 Hz 683:384   47.712 kHz     85.500000 MHz (597 mm x 336 mm)
                 Hfront   70 Hsync 143 Hback  213 Hpol P
                 Vfront    3 Vsync   3 Vback   24 Vpol P
    DTD 5:  1920x1080   74.985859 Hz  16:9     84.359 kHz    185.590000 MHz (597 mm x 336 mm)
                 Hfront   48 Hsync  40 Hback  192 Hpol P
                 Vfront    5 Vsync   5 Vback   35 Vpol P
Checksum: 0x38  Unused space in Extension Block: 2 bytes

----------------

Warnings:

Block 0, Base EDID:
  Vendor & Product Identification: The serial number is one of the known dummy values, it should probably be set to 0.
Block 1, CTA-861 Extension Block:
  Video Data Block: VIC 3 and the first DTD are not identical. Is this intended?
  Display Product Serial Number is set, so the Serial Number in the Base EDID should be 0.
  Add a Colorimetry Data Block with the sRGB colorimetry bit set to avoid interop issues.
EDID:
  Base EDID: Some timings are out of range of the Monitor Ranges:
    Horizontal Freq: 31.250 - 185.623 kHz (Monitor: 30.000 - 168.000 kHz)

Failures:

Block 0, Base EDID:
  Display Range Limits: 'Range Limits Only' is not allowed for EDID < 1.4.
Block 1, CTA-861 Extension Block:
  Vendor-Specific Data Block (HDMI), OUI 00-0C-03: HDMI VSDB Max TMDS rate is > 340.
  Missing VCDB, needed for Set Selectable RGB Quantization to avoid interop issues.
EDID:
  Extension Block 2 started with EDID header, ignoring Extension Blocks >= 2.

EDID conformity: FAIL
