edid-decode (hex):

00 ff ff ff ff ff ff 00 52 d3 01 00 00 00 00 00
1c 13 01 03 08 1f 17 96 8a bb b9 a3 52 46 98 24
0f 48 4c af ce 00 01 01 01 01 01 01 01 01 01 01
01 01 01 01 01 01 c3 1e 00 20 41 00 2a 30 10 60
13 00 00 00 00 00 00 00 00 00 00 fd 00 37 4c 1e
3d 08 00 0a 20 20 20 20 20 20 00 00 00 fc 00 53
44 31 35 0a 0a 0a 0a 0a 0a 0a 0a 0a 00 00 00 ff
00 56 30 2e 30 30 31 0a 0a 0a 0a 0a 0a 0a 00 0b

00 ff ff ff ff ff ff 00 52 d3 01 00 00 00 00 00
1c 13 01 03 08 1f 17 96 8a bb b9 a3 52 46 98 24
0f 48 4c af ce 00 01 01 01 01 01 01 01 01 01 01
01 01 01 01 01 01 c3 1e 00 20 41 00 2a 30 10 60
13 00 00 00 00 00 00 00 00 00 00 fd 00 37 4c 1e
3d 08 00 0a 20 20 20 20 20 20 00 00 00 fc 00 53
44 31 35 0a 0a 0a 0a 0a 0a 0a 0a 0a 00 00 00 ff
00 56 30 2e 30 30 31 0a 0a 0a 0a 0a 0a 0a 00 0b

----------------

Block 0, Base EDID:
  EDID Structure Version & Revision: 1.3
  Vendor & Product Identification:
    Manufacturer: TVS
    Model: 1
    Made in: week 28 of 2009
  Basic Display Parameters & Features:
    Analog display
    Signal Level Standard: 0.700 : 0.300 : 1.000 V p-p
    Blank level equals black level
    Sync: Separate
    Maximum image size: 31 cm x 23 cm
    Gamma: 2.50
    DPMS levels: Standby
    RGB color display
    First detailed timing is the preferred timing
  Color Characteristics:
    Red  : 0.6386, 0.3232
    Green: 0.2753, 0.5966
    Blue : 0.1425, 0.0615
    White: 0.2832, 0.2978
  Established Timings I & II:
    IBM     :   720x400    70.081663 Hz   9:5     31.467 kHz     28.320000 MHz
    DMT 0x04:   640x480    59.940476 Hz   4:3     31.469 kHz     25.175000 MHz
    DMT 0x05:   640x480    72.808802 Hz   4:3     37.861 kHz     31.500000 MHz
    DMT 0x06:   640x480    75.000000 Hz   4:3     37.500 kHz     31.500000 MHz
    DMT 0x08:   800x600    56.250000 Hz   4:3     35.156 kHz     36.000000 MHz
    DMT 0x09:   800x600    60.316541 Hz   4:3     37.879 kHz     40.000000 MHz
    DMT 0x0a:   800x600    72.187572 Hz   4:3     48.077 kHz     50.000000 MHz
    DMT 0x0b:   800x600    75.000000 Hz   4:3     46.875 kHz     49.500000 MHz
    DMT 0x10:  1024x768    60.003840 Hz   4:3     48.363 kHz     65.000000 MHz
    DMT 0x11:  1024x768    70.069359 Hz   4:3     56.476 kHz     75.000000 MHz
    DMT 0x12:  1024x768    75.028582 Hz   4:3     60.023 kHz     78.750000 MHz
  Standard Timings: none
  Detailed Timing Descriptors:
    DTD 1:  1024x768    74.102304 Hz   4:3     60.023 kHz     78.750000 MHz (analog composite, sync-on-green)
                 Hfront   16 Hsync  96 Hback  176 Hpol N
                 Vfront    1 Vsync   3 Vback   38 Vpol N
    Display Range Limits:
      Monitor ranges (GTF): 55-76 Hz V, 30-61 kHz H, max dotclock 80 MHz
    Display Product Name: 'SD15'
    Display Product Serial Number: ...
Checksum: 0x0b

----------------

Failures:

Block 0, Base EDID:
  Display Product Serial Number: ...
  Detailed Timing Descriptor #1: Mismatch of image size vs display size: image size is not set, but display size is.
  Display Product Name: Non-space after newline.
EDID:
  Extension Block 1 started with EDID header, ignoring Extension Blocks >= 1.

EDID conformity: FAIL
