edid-decode (hex):

00 ff ff ff ff ff ff 00 2a 59 00 17 00 00 00 00
14 1d 01 03 80 28 10 78 2a 31 86 a8 52 46 97 23
1b 4c 58 bf ef 00 a9 c0 95 00 81 80 81 40 81 c0
01 01 01 01 01 01 2f 26 40 a0 60 84 1a 30 30 20
35 00 59 03 11 00 00 1e 15 3b 40 20 62 84 2a 30
68 a8 35 00 99 e6 10 00 00 1e 00 00 00 fd 00 30
4c 1e 55 11 00 0a 20 20 20 20 20 20 00 00 00 fc
00 48 44 4d 49 0a 20 20 20 20 20 20 20 20 01 73

02 03 25 f1 47 04 13 03 12 02 11 01 23 09 17 07
83 01 00 00 67 03 0c 00 10 00 38 2d 68 1a 00 00
01 01 30 4b de 66 21 56 aa 51 00 1e 30 46 8f 33
00 b2 ec 10 00 00 1e 01 1d 00 72 51 d0 1e 20 6e
28 55 00 09 25 21 00 00 1e 8c 0a d0 8a 20 e0 2d
10 10 3e 96 00 09 25 21 00 00 18 8c 0a d0 90 20
40 31 20 0c 40 55 00 09 25 21 00 00 18 00 00 00
00 00 00 00 00 00 00 00 00 00 00 00 00 00 00 60

00 ff ff ff ff ff ff 00 2a 59 00 17 00 00 00 00
14 1d 01 03 80 28 10 78 2a 31 86 a8 52 46 97 23
1b 4c 58 bf ef 00 a9 c0 95 00 81 80 81 40 81 c0
01 01 01 01 01 01 2f 26 40 a0 60 84 1a 30 30 20
35 00 59 03 11 00 00 1e 15 3b 40 20 62 84 2a 30
68 a8 35 00 99 e6 10 00 00 1e 00 00 00 fd 00 30
4c 1e 55 11 00 0a 20 20 20 20 20 20 00 00 00 fc
00 48 44 4d 49 0a 20 20 20 20 20 20 20 20 01 73

02 03 25 f1 47 04 13 03 12 02 11 01 23 09 17 07
83 01 00 00 67 03 0c 00 10 00 38 2d 68 1a 00 00
01 01 30 4b de 66 21 56 aa 51 00 1e 30 46 8f 33
00 b2 ec 10 00 00 1e 01 1d 00 72 51 d0 1e 20 6e
28 55 00 09 25 21 00 00 1e 8c 0a d0 8a 20 e0 2d
10 10 3e 96 00 09 25 21 00 00 18 8c 0a d0 90 20
40 31 20 0c 40 55 00 09 25 21 00 00 18 00 00 00
00 00 00 00 00 00 00 00 00 00 00 00 00 00 00 60

----------------

Block 0, Base EDID:
  EDID Structure Version & Revision: 1.3
  Vendor & Product Identification:
    Manufacturer: JRY
    Model: 5888
    Made in: week 20 of 2019
  Basic Display Parameters & Features:
    Digital display
    Maximum image size: 40 cm x 16 cm
    Gamma: 2.20
    DPMS levels: Off
    RGB color display
    First detailed timing is the preferred timing
  Color Characteristics:
    Red  : 0.6562, 0.3232
    Green: 0.2734, 0.5908
    Blue : 0.1386, 0.1054
    White: 0.2978, 0.3457
  Established Timings I & II:
    IBM     :   720x400    70.081663 Hz   9:5     31.467 kHz     28.320000 MHz
    DMT 0x04:   640x480    59.940476 Hz   4:3     31.469 kHz     25.175000 MHz
    Apple   :   640x480    66.666667 Hz   4:3     35.000 kHz     30.240000 MHz
    DMT 0x05:   640x480    72.808802 Hz   4:3     37.861 kHz     31.500000 MHz
    DMT 0x06:   640x480    75.000000 Hz   4:3     37.500 kHz     31.500000 MHz
    DMT 0x08:   800x600    56.250000 Hz   4:3     35.156 kHz     36.000000 MHz
    DMT 0x09:   800x600    60.316541 Hz   4:3     37.879 kHz     40.000000 MHz
    DMT 0x0a:   800x600    72.187572 Hz   4:3     48.077 kHz     50.000000 MHz
    DMT 0x0b:   800x600    75.000000 Hz   4:3     46.875 kHz     49.500000 MHz
    Apple   :   832x624    74.551266 Hz   4:3     49.726 kHz     57.284000 MHz
    DMT 0x10:  1024x768    60.003840 Hz   4:3     48.363 kHz     65.000000 MHz
    DMT 0x11:  1024x768    70.069359 Hz   4:3     56.476 kHz     75.000000 MHz
    DMT 0x12:  1024x768    75.028582 Hz   4:3     60.023 kHz     78.750000 MHz
    DMT 0x24:  1280x1024   75.024675 Hz   5:4     79.976 kHz    135.000000 MHz
  Standard Timings:
    DMT 0x53:  1600x900    60.000000 Hz  16:9     60.000 kHz    108.000000 MHz (RB)
    DMT 0x2f:  1440x900    59.887445 Hz  16:10    55.935 kHz    106.500000 MHz
    DMT 0x23:  1280x1024   60.019740 Hz   5:4     63.981 kHz    108.000000 MHz
    DMT 0x20:  1280x960    60.000000 Hz   4:3     60.000 kHz    108.000000 MHz
    DMT 0x55:  1280x720    60.000000 Hz  16:9     45.000 kHz     74.250000 MHz
  Detailed Timing Descriptors:
    DTD 1:  1600x900    59.978156 Hz  16:9     55.540 kHz     97.750000 MHz (345 mm x 259 mm)
                 Hfront   48 Hsync  32 Hback   80 Hpol P
                 Vfront    3 Vsync   5 Vback   18 Vpol P
    DTD 2:  1600x900    74.889288 Hz  16:9     70.546 kHz    151.250000 MHz (409 mm x 230 mm)
                 Hfront  104 Hsync 168 Hback  272 Hpol P
                 Vfront    3 Vsync   5 Vback   34 Vpol P
    Display Range Limits:
      Monitor ranges (GTF): 48-76 Hz V, 30-85 kHz H, max dotclock 170 MHz
    Display Product Name: 'HDMI'
  Extension blocks: 1
Checksum: 0x73

----------------

Block 1, CTA-861 Extension Block:
  Revision: 3
  Underscans IT Video Formats by default
  Basic audio support
  Supports YCbCr 4:4:4
  Supports YCbCr 4:2:2
  Native DTDs: 1
  Video Data Block:
    VIC   4:  1280x720    60.000000 Hz  16:9     45.000 kHz     74.250000 MHz
    VIC  19:  1280x720    50.000000 Hz  16:9     37.500 kHz     74.250000 MHz
    VIC   3:   720x480    59.940060 Hz  16:9     31.469 kHz     27.000000 MHz
    VIC  18:   720x576    50.000000 Hz  16:9     31.250 kHz     27.000000 MHz
    VIC   2:   720x480    59.940060 Hz   4:3     31.469 kHz     27.000000 MHz
    VIC  17:   720x576    50.000000 Hz   4:3     31.250 kHz     27.000000 MHz
    VIC   1:   640x480    59.940476 Hz   4:3     31.469 kHz     25.175000 MHz
  Audio Data Block:
    Linear PCM:
      Max channels: 2
      Supported sample rates (kHz): 96 48 44.1 32
      Supported sample sizes (bits): 24 20 16
  Speaker Allocation Data Block:
    FL/FR - Front Left/Right
  Vendor-Specific Data Block (HDMI), OUI 00-0C-03:
    Source physical address: 1.0.0.0
    DC_36bit
    DC_30bit
    DC_Y444
    Maximum TMDS clock: 225 MHz
  Vendor-Specific Data Block (AMD), OUI 00-00-1A:
    Version: 1
    Feature Caps: 0x01
    Minimum Refresh Rate: 48 Hz
    Maximum Refresh Rate: 75 Hz
    Flags 1.x: 0xde (MCCS)
  Detailed Timing Descriptors:
    DTD 3:  1366x768    59.789541 Hz 683:384   47.712 kHz     85.500000 MHz (434 mm x 236 mm)
                 Hfront   70 Hsync 143 Hback  213 Hpol P
                 Vfront    3 Vsync   3 Vback   24 Vpol P
    DTD 4:  1280x720    60.000000 Hz  16:9     45.000 kHz     74.250000 MHz (521 mm x 293 mm)
                 Hfront  110 Hsync  40 Hback  220 Hpol P
                 Vfront    5 Vsync   5 Vback   20 Vpol P
    DTD 5:   720x480    59.940060 Hz   3:2     31.469 kHz     27.000000 MHz (521 mm x 293 mm)
                 Hfront   16 Hsync  62 Hback   60 Hpol N
                 Vfront    9 Vsync   6 Vback   30 Vpol N
    DTD 6:   720x576    50.000000 Hz   5:4     31.250 kHz     27.000000 MHz (521 mm x 293 mm)
                 Hfront   12 Hsync  64 Hback   68 Hpol N
                 Vfront    5 Vsync   5 Vback   39 Vpol N
Checksum: 0x60  Unused space in Extension Block: 18 bytes

----------------

Warnings:

Block 0, Base EDID:
  Detailed Timing Descriptor #1: Image size is 345x259 mm, but based on the picture AR it should be 345x194 mm.
Block 1, CTA-861 Extension Block:
  Video Data Block: VIC 4 and the first DTD are not identical. Is this intended?
  Detailed Timing Descriptor #5: Image size is 521x293 mm, but based on the picture AR it should be 439x293 mm.
  Detailed Timing Descriptor #6: Image size is 521x293 mm, but based on the picture AR it should be 366x293 mm.
  Add a Colorimetry Data Block with the sRGB colorimetry bit set to avoid interop issues.

Failures:

Block 0, Base EDID:
  Detailed Timing Descriptor #1: Mismatch of image size 345x259 mm vs display size 400x160 mm.
  Detailed Timing Descriptor #2: Mismatch of image size 409x230 mm vs display size 400x160 mm.
Block 1, CTA-861 Extension Block:
  Detailed Timing Descriptor #3: Mismatch of image size 434x236 mm vs display size 400x160 mm.
  Detailed Timing Descriptor #4: Mismatch of image size 521x293 mm vs display size 400x160 mm.
  Detailed Timing Descriptor #5: Mismatch of image size 521x293 mm vs display size 400x160 mm.
  Detailed Timing Descriptor #6: Mismatch of image size 521x293 mm vs display size 400x160 mm.
  Missing VCDB, needed for Set Selectable RGB Quantization to avoid interop issues.
EDID:
  Extension Block 2 started with EDID header, ignoring Extension Blocks >= 2.
  Base EDID: The DTD max image size is 521x293mm, which is larger than the display size 400.0x160.0mm.

EDID conformity: FAIL
