edid-decode (hex):

00 ff ff ff ff ff ff 00 21 63 41 27 01 00 00 00
0c 21 01 04 b5 3c 21 78 3b f4 65 ad 4e 41 a9 27
10 50 54 a5 4b 00 81 80 81 bc 95 00 95 3c b3 00
b3 3c d1 cf d1 c0 6a 5e 00 a0 a0 a0 29 50 30 20
35 00 55 50 21 00 00 1a 00 00 00 fd 0c 30 f0 1e
ff 6e 01 0a 20 20 20 20 20 20 00 00 00 fc 00 49
47 32 37 51 4b 0a 20 20 20 20 20 20 00 00 00 ff
00 30 30 30 30 30 30 30 30 30 30 30 30 31 02 d0

02 03 30 f1 23 09 07 07 83 01 00 00 47 90 01 03
04 12 3f 61 e2 00 7f e3 05 e3 01 e6 06 07 01 62
5f 00 6d 1a 00 00 02 01 30 f0 00 00 00 21 73 21
42 df 00 78 a0 a0 29 50 30 40 35 00 55 50 21 00
00 1e 6f c2 00 a0 a0 a0 55 50 30 20 35 00 55 50
21 00 00 1a fb 31 00 a0 50 a0 29 50 30 20 35 00
55 50 21 00 00 1a 00 00 00 00 00 00 00 00 00 00
00 00 00 00 00 00 00 00 00 00 00 00 00 00 00 ba

00 ff ff ff ff ff ff 00 21 63 41 27 01 00 00 00
0c 21 01 04 b5 3c 21 78 3b f4 65 ad 4e 41 a9 27
10 50 54 a5 4b 00 81 80 81 bc 95 00 95 3c b3 00
b3 3c d1 cf d1 c0 6a 5e 00 a0 a0 a0 29 50 30 20
35 00 55 50 21 00 00 1a 00 00 00 fd 0c 30 f0 1e
ff 6e 01 0a 20 20 20 20 20 20 00 00 00 fc 00 49
47 32 37 51 4b 0a 20 20 20 20 20 20 00 00 00 ff
00 30 30 30 30 30 30 30 30 30 30 30 30 31 02 d0

00 ff ff ff ff ff ff 00 21 63 41 27 01 00 00 00
0c 21 01 04 b5 3c 21 78 3b f4 65 ad 4e 41 a9 27
10 50 54 a5 4b 00 81 80 81 bc 95 00 95 3c b3 00
b3 3c d1 cf d1 c0 6a 5e 00 a0 a0 a0 29 50 30 20
35 00 55 50 21 00 00 1a 00 00 00 fd 0c 30 f0 1e
ff 6e 01 0a 20 20 20 20 20 20 00 00 00 fc 00 49
47 32 37 51 4b 0a 20 20 20 20 20 20 00 00 00 ff
00 30 30 30 30 30 30 30 30 30 30 30 30 31 02 d0

02 03 30 f1 23 09 07 07 83 01 00 00 47 90 01 03
04 12 3f 61 e2 00 7f e3 05 e3 01 e6 06 07 01 62
5f 00 6d 1a 00 00 02 01 30 f0 00 00 00 21 73 21
42 df 00 78 a0 a0 29 50 30 40 35 00 55 50 21 00
00 1e 6f c2 00 a0 a0 a0 55 50 30 20 35 00 55 50
21 00 00 1a fb 31 00 a0 50 a0 29 50 30 20 35 00
55 50 21 00 00 1a 00 00 00 00 00 00 00 00 00 00
00 00 00 00 00 00 00 00 00 00 00 00 00 00 00 ba

00 ff ff ff ff ff ff 00 21 63 41 27 01 00 00 00
0c 21 01 04 b5 3c 21 78 3b f4 65 ad 4e 41 a9 27
10 50 54 a5 4b 00 81 80 81 bc 95 00 95 3c b3 00
b3 3c d1 cf d1 c0 6a 5e 00 a0 a0 a0 29 50 30 20
35 00 55 50 21 00 00 1a 00 00 00 fd 0c 30 f0 1e
ff 6e 01 0a 20 20 20 20 20 20 00 00 00 fc 00 49
47 32 37 51 4b 0a 20 20 20 20 20 20 00 00 00 ff
00 30 30 30 30 30 30 30 30 30 30 30 30 31 02 d0

----------------

Block 0, Base EDID:
  EDID Structure Version & Revision: 1.4
  Vendor & Product Identification:
    Manufacturer: HKC
    Model: 10049
    Serial Number: ...
    Made in: week 12 of 2023
  Basic Display Parameters & Features:
    Digital display
    Bits per primary color channel: 10
    DisplayPort interface
    Maximum image size: 60 cm x 33 cm
    Gamma: 2.20
    DPMS levels: Off
    Supported color formats: RGB 4:4:4, YCrCb 4:4:4, YCrCb 4:2:2
    First detailed timing includes the native pixel format and preferred refresh rate
    Display supports continuous frequencies
  Color Characteristics:
    Red  : 0.6787, 0.3076
    Green: 0.2548, 0.6601
    Blue : 0.1533, 0.0644
    White: 0.3134, 0.3291
  Established Timings I & II:
    IBM     :   720x400    70.081663 Hz   9:5     31.467 kHz     28.320000 MHz
    DMT 0x04:   640x480    59.940476 Hz   4:3     31.469 kHz     25.175000 MHz
    DMT 0x06:   640x480    75.000000 Hz   4:3     37.500 kHz     31.500000 MHz
    DMT 0x09:   800x600    60.316541 Hz   4:3     37.879 kHz     40.000000 MHz
    DMT 0x0b:   800x600    75.000000 Hz   4:3     46.875 kHz     49.500000 MHz
    DMT 0x10:  1024x768    60.003840 Hz   4:3     48.363 kHz     65.000000 MHz
    DMT 0x12:  1024x768    75.028582 Hz   4:3     60.023 kHz     78.750000 MHz
    DMT 0x24:  1280x1024   75.024675 Hz   5:4     79.976 kHz    135.000000 MHz
  Standard Timings:
    DMT 0x23:  1280x1024   60.019740 Hz   5:4     63.981 kHz    108.000000 MHz
    GTF     :  1280x1024  120.000185 Hz   5:4    131.640 kHz    233.793000 MHz
    DMT 0x2f:  1440x900    59.887445 Hz  16:10    55.935 kHz    106.500000 MHz
    GTF     :  1440x900   119.999896 Hz  16:10   115.800 kHz    229.747000 MHz
    DMT 0x3a:  1680x1050   59.954250 Hz  16:10    65.290 kHz    146.250000 MHz
    GTF     :  1680x1050  120.000000 Hz  16:10   135.000 kHz    313.200000 MHz
    GTF     :  1920x1080   75.000068 Hz  16:9     84.600 kHz    220.637000 MHz
    DMT 0x52:  1920x1080   60.000000 Hz  16:9     67.500 kHz    148.500000 MHz
  Detailed Timing Descriptors:
    DTD 1:  2560x1440   60.000199 Hz  16:9     88.860 kHz    241.700000 MHz (597 mm x 336 mm)
                 Hfront   48 Hsync  32 Hback   80 Hpol P
                 Vfront    3 Vsync   5 Vback   33 Vpol N
    Display Range Limits:
      Monitor ranges (Range Limits Only): 48-240 Hz V, 285-510 kHz H, max dotclock 1100 MHz
    Display Product Name: 'IG27QK'
    Display Product Serial Number: ...
  Extension blocks: 2
Checksum: 0xd0

----------------

Block 1, CTA-861 Extension Block:
  Revision: 3
  Underscans IT Video Formats by default
  Basic audio support
  Supports YCbCr 4:4:4
  Supports YCbCr 4:2:2
  Native detailed modes: 1
  Audio Data Block:
    Linear PCM:
      Max channels: 2
      Supported sample rates (kHz): 48 44.1 32
      Supported sample sizes (bits): 24 20 16
  Speaker Allocation Data Block:
    FL/FR - Front Left/Right
  Video Data Block:
    VIC  16:  1920x1080   60.000000 Hz  16:9     67.500 kHz    148.500000 MHz (native)
    VIC   1:   640x480    59.940476 Hz   4:3     31.469 kHz     25.175000 MHz
    VIC   3:   720x480    59.940060 Hz  16:9     31.469 kHz     27.000000 MHz
    VIC   4:  1280x720    60.000000 Hz  16:9     45.000 kHz     74.250000 MHz
    VIC  18:   720x576    50.000000 Hz  16:9     31.250 kHz     27.000000 MHz
    VIC  63:  1920x1080  120.000000 Hz  16:9    135.000 kHz    297.000000 MHz
    VIC  97:  3840x2160   60.000000 Hz  16:9    135.000 kHz    594.000000 MHz
  Video Capability Data Block:
    YCbCr quantization: No Data
    RGB quantization: Selectable (via AVI Q)
    PT scan behavior: Supports both over- and underscan
    IT scan behavior: Supports both over- and underscan
    CE scan behavior: Supports both over- and underscan
  Colorimetry Data Block:
    xvYCC601
    xvYCC709
    BT2020cYCC
    BT2020YCC
    BT2020RGB
    Gamut Boundary Description Metadata Profile P0
  HDR Static Metadata Data Block:
    Electro optical transfer functions:
      Traditional gamma - SDR luminance range
      Traditional gamma - HDR luminance range
      SMPTE ST2084
    Supported static metadata descriptors:
      Static metadata type 1
    Desired content max luminance: 98 (417.710 cd/m^2)
    Desired content max frame-average luminance: 95 (391.429 cd/m^2)
    Desired content min luminance: 0 (0.000 cd/m^2)
  Vendor-Specific Data Block (AMD), OUI 00-00-1A:
    Version: 2
    Feature Caps: 0x01
    Minimum Refresh Rate: 48 Hz
    Maximum Refresh Rate: 240 Hz
    Flags 1.x: 0x00
    Flags 2.x: 0x00
  Detailed Timing Descriptors:
    DTD 2:  2560x1440  143.998105 Hz  16:9    213.261 kHz    571.540000 MHz (597 mm x 336 mm)
                 Hfront   48 Hsync  64 Hback    8 Hpol P
                 Vfront    3 Vsync   5 Vback   33 Vpol P
    DTD 3:  2560x1440  119.997589 Hz  16:9    182.996 kHz    497.750000 MHz (597 mm x 336 mm)
                 Hfront   48 Hsync  32 Hback   80 Hpol P
                 Vfront    3 Vsync   5 Vback   77 Vpol N
    DTD 4:  1280x1440   59.996061 Hz   8:9     88.854 kHz    127.950000 MHz (597 mm x 336 mm)
                 Hfront   48 Hsync  32 Hback   80 Hpol P
                 Vfront    3 Vsync   5 Vback   33 Vpol N
Checksum: 0xba  Unused space in Extension Block: 25 bytes

----------------

Block 2, Unknown EDID Extension Block 0x00:
  00 ff ff ff ff ff ff 00 21 63 41 27 01 00 00 00 '........!cA'....'
  0c 21 01 04 b5 3c 21 78 3b f4 65 ad 4e 41 a9 27 '.!...<!x;.e.NA.''
  10 50 54 a5 4b 00 81 80 81 bc 95 00 95 3c b3 00 '.PT.K........<..'
  b3 3c d1 cf d1 c0 6a 5e 00 a0 a0 a0 29 50 30 20 '.<....j^....)P0 '
  35 00 55 50 21 00 00 1a 00 00 00 fd 0c 30 f0 1e '5.UP!........0..'
  ff 6e 01 0a 20 20 20 20 20 20 00 00 00 fc 00 49 '.n..      .....I'
  47 32 37 51 4b 0a 20 20 20 20 20 20 00 00 00 ff 'G27QK.      ....'
  00 30 30 30 30 30 30 30 30 30 30 30 30 31 02 d0 '.0000000000001..'
Checksum: 0xd0

----------------

Block 3, Unknown EDID Extension Block 0x00:
  00 ff ff ff ff ff ff 00 21 63 41 27 01 00 00 00 '........!cA'....'
  0c 21 01 04 b5 3c 21 78 3b f4 65 ad 4e 41 a9 27 '.!...<!x;.e.NA.''
  10 50 54 a5 4b 00 81 80 81 bc 95 00 95 3c b3 00 '.PT.K........<..'
  b3 3c d1 cf d1 c0 6a 5e 00 a0 a0 a0 29 50 30 20 '.<....j^....)P0 '
  35 00 55 50 21 00 00 1a 00 00 00 fd 0c 30 f0 1e '5.UP!........0..'
  ff 6e 01 0a 20 20 20 20 20 20 00 00 00 fc 00 49 '.n..      .....I'
  47 32 37 51 4b 0a 20 20 20 20 20 20 00 00 00 ff 'G27QK.      ....'
  00 30 30 30 30 30 30 30 30 30 30 30 30 31 02 d0 '.0000000000001..'
Checksum: 0xd0

----------------

Block 4, CTA-861 Extension Block:
  Revision: 3
  Underscans IT Video Formats by default
  Basic audio support
  Supports YCbCr 4:4:4
  Supports YCbCr 4:2:2
  Native detailed modes: 1
  Audio Data Block:
    Linear PCM:
      Max channels: 2
      Supported sample rates (kHz): 48 44.1 32
      Supported sample sizes (bits): 24 20 16
  Speaker Allocation Data Block:
    FL/FR - Front Left/Right
  Video Data Block:
    VIC  16:  1920x1080   60.000000 Hz  16:9     67.500 kHz    148.500000 MHz (native)
    VIC   1:   640x480    59.940476 Hz   4:3     31.469 kHz     25.175000 MHz
    VIC   3:   720x480    59.940060 Hz  16:9     31.469 kHz     27.000000 MHz
    VIC   4:  1280x720    60.000000 Hz  16:9     45.000 kHz     74.250000 MHz
    VIC  18:   720x576    50.000000 Hz  16:9     31.250 kHz     27.000000 MHz
    VIC  63:  1920x1080  120.000000 Hz  16:9    135.000 kHz    297.000000 MHz
    VIC  97:  3840x2160   60.000000 Hz  16:9    135.000 kHz    594.000000 MHz
  Video Capability Data Block:
    YCbCr quantization: No Data
    RGB quantization: Selectable (via AVI Q)
    PT scan behavior: Supports both over- and underscan
    IT scan behavior: Supports both over- and underscan
    CE scan behavior: Supports both over- and underscan
  Colorimetry Data Block:
    xvYCC601
    xvYCC709
    BT2020cYCC
    BT2020YCC
    BT2020RGB
    Gamut Boundary Description Metadata Profile P0
  HDR Static Metadata Data Block:
    Electro optical transfer functions:
      Traditional gamma - SDR luminance range
      Traditional gamma - HDR luminance range
      SMPTE ST2084
    Supported static metadata descriptors:
      Static metadata type 1
    Desired content max luminance: 98 (417.710 cd/m^2)
    Desired content max frame-average luminance: 95 (391.429 cd/m^2)
    Desired content min luminance: 0 (0.000 cd/m^2)
  Vendor-Specific Data Block (AMD), OUI 00-00-1A:
    Version: 2
    Feature Caps: 0x01
    Minimum Refresh Rate: 48 Hz
    Maximum Refresh Rate: 240 Hz
    Flags 1.x: 0x00
    Flags 2.x: 0x00
  Detailed Timing Descriptors:
    DTD 5:  2560x1440  143.998105 Hz  16:9    213.261 kHz    571.540000 MHz (597 mm x 336 mm)
                 Hfront   48 Hsync  64 Hback    8 Hpol P
                 Vfront    3 Vsync   5 Vback   33 Vpol P
    DTD 6:  2560x1440  119.997589 Hz  16:9    182.996 kHz    497.750000 MHz (597 mm x 336 mm)
                 Hfront   48 Hsync  32 Hback   80 Hpol P
                 Vfront    3 Vsync   5 Vback   77 Vpol N
    DTD 7:  1280x1440   59.996061 Hz   8:9     88.854 kHz    127.950000 MHz (597 mm x 336 mm)
                 Hfront   48 Hsync  32 Hback   80 Hpol P
                 Vfront    3 Vsync   5 Vback   33 Vpol N
Checksum: 0xba  Unused space in Extension Block: 25 bytes

----------------

Block 5, Unknown EDID Extension Block 0x00:
  00 ff ff ff ff ff ff 00 21 63 41 27 01 00 00 00 '........!cA'....'
  0c 21 01 04 b5 3c 21 78 3b f4 65 ad 4e 41 a9 27 '.!...<!x;.e.NA.''
  10 50 54 a5 4b 00 81 80 81 bc 95 00 95 3c b3 00 '.PT.K........<..'
  b3 3c d1 cf d1 c0 6a 5e 00 a0 a0 a0 29 50 30 20 '.<....j^....)P0 '
  35 00 55 50 21 00 00 1a 00 00 00 fd 0c 30 f0 1e '5.UP!........0..'
  ff 6e 01 0a 20 20 20 20 20 20 00 00 00 fc 00 49 '.n..      .....I'
  47 32 37 51 4b 0a 20 20 20 20 20 20 00 00 00 ff 'G27QK.      ....'
  00 30 30 30 30 30 30 30 30 30 30 30 30 31 02 d0 '.0000000000001..'
Checksum: 0xd0

----------------

Warnings:

Block 0, Base EDID:
  Vendor & Product Identification: The serial number is one of the known dummy values, it should probably be set to 0.
  Display Product Serial Number: ...
Block 1, CTA-861 Extension Block:
  Video Data Block: VIC 16 and the first DTD are not identical. Is this intended?
  Video Capability Data Block: Set Selectable YCbCr Quantization to avoid interop issues.
  Video Capability Data Block: S_PT is equal to S_IT and S_CE, so should be set to 0 instead.
  Colorimetry Data Block: Set the sRGB colorimetry bit to avoid interop issues.
  Detailed Timing Descriptor #4: Image size is 597x336 mm, but based on the picture AR it should be 597x671 mm.
  Display Product Serial Number is set, so the Serial Number in the Base EDID should be 0.
Block 4, CTA-861 Extension Block:
  Video Capability Data Block: Set Selectable YCbCr Quantization to avoid interop issues.
  Video Capability Data Block: S_PT is equal to S_IT and S_CE, so should be set to 0 instead.
  Colorimetry Data Block: Set the sRGB colorimetry bit to avoid interop issues.
  Detailed Timing Descriptor #7: Image size is 597x336 mm, but based on the picture AR it should be 597x671 mm.
EDID:
  Base EDID: Some timings are out of range of the Monitor Ranges:
    Horizontal Freq: 31.250 - 213.261 kHz (Monitor: 285.000 - 510.000 kHz)

Failures:

Block 2, Base EDID:
  Unknown Extension Block.
Block 3, Base EDID:
  Unknown Extension Block.
Block 4, CTA-861 Extension Block:
  Speaker Allocation Data Block: Only one instance of this Data Block is allowed.
  Video Data Block: Duplicate VIC 16.
  Video Data Block: Duplicate VIC 1.
  Video Data Block: Duplicate VIC 3.
  Video Data Block: Duplicate VIC 4.
  Video Data Block: Duplicate VIC 18.
  Video Data Block: Duplicate VIC 63.
  Video Data Block: Duplicate VIC 97.
  Video Capability Data Block: Only one instance of this Data Block is allowed.
  Colorimetry Data Block: Only one instance of this Data Block is allowed.
  HDR Static Metadata Data Block: Only one instance of this Data Block is allowed.
Block 5, Base EDID:
  Unknown Extension Block.
EDID:
  Base EDID: EDID specified 2 extension block(s), but found 5 extension block(s).
  CTA-861: Native progressive timings are a mix of several resolutions.

EDID conformity: FAIL
