edid-decode (hex):

00 ff ff ff ff ff ff 00 09 e5 78 0b 00 00 00 00
18 20 01 04 b5 26 18 78 03 3e 15 ae 50 43 b0 25
0e 50 54 00 00 00 01 01 01 01 01 01 01 01 01 01
01 01 01 01 01 01 34 70 00 a0 a0 40 a0 60 30 20
36 00 84 f2 10 00 00 1a 00 00 00 fd 0c 3c a5 23
23 4f 01 0a 20 20 20 20 20 20 00 00 00 fe 00 42
4f 45 20 43 51 0a 20 20 20 20 20 20 00 00 00 fe
00 4e 45 31 38 30 51 44 4d 2d 4e 59 31 0a 01 bd

70 20 79 02 00 22 00 14 7f 0d 0c 85 ff 09 9f 00
2f 00 1f 00 3f 06 9f 00 02 00 05 00 25 00 09 7f
0d 0c 7f 0d 0c 3c a5 80 81 00 13 72 1a 00 00 03
01 3c a5 00 00 53 51 53 51 a5 00 00 00 00 2b 00
06 27 00 3c a4 00 00 00 00 00 00 00 00 00 00 00
00 00 00 00 00 00 00 00 00 00 00 00 00 00 00 00
00 00 00 00 00 00 00 00 00 00 00 00 00 00 00 00
00 00 00 00 00 00 00 00 00 00 00 00 00 00 49 90

00 ff ff ff ff ff ff 00 09 e5 78 0b 00 00 00 00
18 20 01 04 b5 26 18 78 03 3e 15 ae 50 43 b0 25
0e 50 54 00 00 00 01 01 01 01 01 01 01 01 01 01
01 01 01 01 01 01 34 70 00 a0 a0 40 a0 60 30 20
36 00 84 f2 10 00 00 1a 00 00 00 fd 0c 3c a5 23
23 4f 01 0a 20 20 20 20 20 20 00 00 00 fe 00 42
4f 45 20 43 51 0a 20 20 20 20 20 20 00 00 00 fe
00 4e 45 31 38 30 51 44 4d 2d 4e 59 31 0a 01 bd

70 20 79 02 00 22 00 14 7f 0d 0c 85 ff 09 9f 00
2f 00 1f 00 3f 06 9f 00 02 00 05 00 25 00 09 7f
0d 0c 7f 0d 0c 3c a5 80 81 00 13 72 1a 00 00 03
01 3c a5 00 00 53 51 53 51 a5 00 00 00 00 2b 00
06 27 00 3c a4 00 00 00 00 00 00 00 00 00 00 00
00 00 00 00 00 00 00 00 00 00 00 00 00 00 00 00
00 00 00 00 00 00 00 00 00 00 00 00 00 00 00 00
00 00 00 00 00 00 00 00 00 00 00 00 00 00 49 90

----------------

Block 0, Base EDID:
  EDID Structure Version & Revision: 1.4
  Vendor & Product Identification:
    Manufacturer: BOE
    Model: 2936
    Made in: week 24 of 2022
  Basic Display Parameters & Features:
    Digital display
    Bits per primary color channel: 10
    DisplayPort interface
    Maximum image size: 38 cm x 24 cm
    Gamma: 2.20
    Supported color formats: RGB 4:4:4
    First detailed timing includes the native pixel format and preferred refresh rate
    Display supports continuous frequencies
  Color Characteristics:
    Red  : 0.6796, 0.3154
    Green: 0.2646, 0.6894
    Blue : 0.1445, 0.0556
    White: 0.3134, 0.3291
  Established Timings I & II: none
  Standard Timings: none
  Detailed Timing Descriptors:
    DTD 1:  2560x1600   60.001671 Hz  16:10   105.603 kHz    287.240000 MHz (388 mm x 242 mm)
                 Hfront   48 Hsync  32 Hback   80 Hpol P
                 Vfront    3 Vsync   6 Vback  151 Vpol N
    Display Range Limits:
      Monitor ranges (Range Limits Only): 60-165 Hz V, 290-290 kHz H, max dotclock 790 MHz
    Alphanumeric Data String: 'BOE CQ'
    Alphanumeric Data String: 'NE180QDM-NY1'
  Extension blocks: 1
Checksum: 0xbd

----------------

Block 1, DisplayID Extension Block:
  Version: 2.0
  Extension Count: 0
  Display Product Primary Use Case: None of the listed primary use cases; generic display
  Video Timing Modes Type 7 - Detailed Timings Data Block:
    DTD:  2560x1600  165.000000 Hz  16:10   290.400 kHz    789.888000 MHz (aspect 16:10, no 3D stereo, preferred)
               Hfront   48 Hsync  32 Hback   80 Hpol N
               Vfront    3 Vsync   6 Vback  151 Vpol N
  Dynamic Video Timing Range Limits Data Block:
    Minimum Pixel Clock: 789888 kHz
    Maximum Pixel Clock: 789888 kHz
    Minimum Vertical Refresh Rate: 60 Hz
    Maximum Vertical Refresh Rate: 165 Hz
    Seamless Dynamic Video Timing Support: Yes
  CTA-861 DisplayID Data Block:
  Vendor-Specific Data Block (AMD), OUI 00-00-1A:
    Version: 3
    Feature Caps: 0x01
    Minimum Refresh Rate: 60 Hz
    Maximum Refresh Rate: 165 Hz
    Flags 1.x: 0x00
    Flags 2.x: 0x00
  Adaptive Sync Data Block:
    Descriptor #1:
      Native Panel Range
      Fixed Average V-Total and Adaptive V-Total
      Supports Seamless Transition
      'Max Single Frame Duration Increase' field value without jitter impact
      'Max Single Frame Duration Decrease' field value without jitter impact
      Max Duration Increase: 0.00 ms
      Max Duration Decrease: 0.00 ms
      Min Refresh Rate: 60 Hz
      Max Refresh Rate: 165 Hz
  Checksum: 0x49
Checksum: 0x90

----------------

Warnings:

Block 0, Base EDID:
  Missing Display Product Name.
EDID:
  Base EDID: Some timings are out of range of the Monitor Ranges:
    Horizontal Freq: 105.602 - 290.400 kHz (Monitor: 290.000 - 290.000 kHz)

Failures:

EDID:
  Extension Block 2 started with EDID header, ignoring Extension Blocks >= 2.
  DisplayID: Missing DisplayID Display Parameters Data Block.

EDID conformity: FAIL
