edid-decode (hex):

00 ff ff ff ff ff ff 00 24 4d 98 19 01 01 01 01
16 0a 01 01 6e 28 1e 96 e8 0c c9 a0 57 47 9b 27
12 48 4c ef cf 00 31 59 45 59 61 59 71 59 81 99
a9 4f a9 59 01 01 90 14 c0 2c 31 11 1c 20 0c 6c
1a 00 84 23 11 00 00 1a 00 00 00 fc 00 49 42 4d
20 50 32 36 30 20 20 20 20 20 00 00 00 fd 00 32
a0 1e 79 1e 00 0a 20 20 20 20 20 20 00 00 00 ff
00 35 35 2d 38 39 37 31 36 0a 20 20 20 20 00 26

----------------

Block 0, Base EDID:
  EDID Structure Version & Revision: 1.1
  Vendor & Product Identification:
    Manufacturer: IBM
    Model: 6552
    Serial Number: ...
    Made in: week 22 of 2000
  Basic Display Parameters & Features:
    Analog display
    Signal Level Standard: 0.700 : 0.000 : 0.700 V p-p
    Blank level equals black level
    Sync: Separate Composite SyncOnGreen
    Maximum image size: 40 cm x 30 cm
    Gamma: 2.50
    DPMS levels: Standby Suspend Off
    RGB color display
  Color Characteristics:
    Red  : 0.6250, 0.3398
    Green: 0.2802, 0.6054
    Blue : 0.1552, 0.0703
    White: 0.2832, 0.2978
  Established Timings I & II:
    IBM     :   720x400    70.081663 Hz   9:5     31.467 kHz     28.320000 MHz
    IBM     :   720x400    87.849542 Hz   9:5     39.444 kHz     35.500000 MHz
    DMT 0x04:   640x480    59.940476 Hz   4:3     31.469 kHz     25.175000 MHz
    DMT 0x05:   640x480    72.808802 Hz   4:3     37.861 kHz     31.500000 MHz
    DMT 0x06:   640x480    75.000000 Hz   4:3     37.500 kHz     31.500000 MHz
    DMT 0x08:   800x600    56.250000 Hz   4:3     35.156 kHz     36.000000 MHz
    DMT 0x09:   800x600    60.316541 Hz   4:3     37.879 kHz     40.000000 MHz
    DMT 0x0a:   800x600    72.187572 Hz   4:3     48.077 kHz     50.000000 MHz
    DMT 0x0b:   800x600    75.000000 Hz   4:3     46.875 kHz     49.500000 MHz
    DMT 0x10:  1024x768    60.003840 Hz   4:3     48.363 kHz     65.000000 MHz
    DMT 0x11:  1024x768    70.069359 Hz   4:3     56.476 kHz     75.000000 MHz
    DMT 0x12:  1024x768    75.028582 Hz   4:3     60.023 kHz     78.750000 MHz
    DMT 0x24:  1280x1024   75.024675 Hz   5:4     79.976 kHz    135.000000 MHz
  Standard Timings:
    DMT 0x07:   640x480    85.008312 Hz   4:3     43.269 kHz     36.000000 MHz
    DMT 0x0c:   800x600    85.061274 Hz   4:3     53.674 kHz     56.250000 MHz
    DMT 0x13:  1024x768    84.996690 Hz   4:3     68.677 kHz     94.500000 MHz
    Unknown :  1152x864    85.000 Hz   4:3
    DMT 0x25:  1280x1024   85.024098 Hz   5:4     91.146 kHz    157.500000 MHz
    DMT 0x36:  1600x1200   75.000000 Hz   4:3     93.750 kHz    202.500000 MHz
    DMT 0x37:  1600x1200   85.000000 Hz   4:3    106.250 kHz    229.500000 MHz
  Detailed Timing Descriptors:
    DTD 1:   960x529    75.004987 Hz 960:529   41.778 kHz     52.640000 MHz (388 mm x 291 mm)
                 Hfront   12 Hsync 108 Hback  180 Hpol P
                 Vfront    1 Vsync  10 Vback   17 Vpol N
    Display Product Name: 'IBM P260     '
    Display Range Limits:
      Monitor ranges (GTF): 50-160 Hz V, 30-121 kHz H, max dotclock 300 MHz
    Display Product Serial Number: ...
Checksum: 0x26

----------------

Warnings:

Block 0, Base EDID:
  EDID Structure Version & Revision: EDID 1.1 is deprecated, do not use.
  Vendor & Product Identification: The serial number is one of the known dummy values, it should probably be set to 0.
  Detailed Timing Descriptor #1: Image size is 388x291 mm, but based on the picture AR it should be 388x213 mm.

Failures:

Block 0, Base EDID:
  Display Product Name: No newline, but one or more trailing spaces.

EDID conformity: FAIL
