edid-decode (hex):

00 ff ff ff ff ff ff 00 42 86 19 22 a0 00 00 00
11 13 01 03 80 32 1d 78 ea d4 25 a4 55 49 9b 27
13 50 54 a5 4b 00 81 c0 81 80 a9 40 01 01 01 01
01 01 01 01 01 01 02 3a 80 18 71 38 2d 40 58 2c
96 00 f1 24 11 00 00 1e 00 00 00 ff 00 42 47 32
32 36 32 30 35 30 30 31 36 30 00 00 00 fd 00 38
4c 1f 52 10 00 0a 20 20 20 20 20 20 00 00 00 fc
00 50 54 46 42 47 46 2d 32 32 52 57 0a 20 01 53

02 03 21 f1 23 09 7f 07 4e 02 03 06 07 15 16 11
12 13 04 05 14 90 1f 83 01 00 00 65 03 0c 00 10
00 8c 0a d0 8a 20 e0 2d 10 10 3e 96 00 26 35 21
00 00 18 8c 0a d0 90 20 40 31 20 0c 40 55 00 26
35 21 00 00 18 01 1d 80 18 71 1c 16 20 58 2c 25
00 26 35 21 00 00 9e 01 1d 00 bc 52 d0 1e 20 b8
28 55 40 26 35 21 00 00 1e 01 1d 80 d0 72 1c 16
20 10 2c 25 80 26 35 21 00 00 9e 00 00 00 00 6f

00 ff ff ff ff ff ff 00 42 86 19 22 a0 00 00 00
11 13 01 03 80 32 1d 78 ea d4 25 a4 55 49 9b 27
13 50 54 a5 4b 00 81 c0 81 80 a9 40 01 01 01 01
01 01 01 01 01 01 02 3a 80 18 71 38 2d 40 58 2c
96 00 f1 24 11 00 00 1e 00 00 00 ff 00 42 47 32
32 36 32 30 35 30 30 31 36 30 00 00 00 fd 00 38
4c 1f 52 10 00 0a 20 20 20 20 20 20 00 00 00 fc
00 50 54 46 42 47 46 2d 32 32 52 57 0a 20 01 53

02 03 21 f1 23 09 7f 07 4e 02 03 06 07 15 16 11
12 13 04 05 14 90 1f 83 01 00 00 65 03 0c 00 10
00 8c 0a d0 8a 20 e0 2d 10 10 3e 96 00 26 35 21
00 00 18 8c 0a d0 90 20 40 31 20 0c 40 55 00 26
35 21 00 00 18 01 1d 80 18 71 1c 16 20 58 2c 25
00 26 35 21 00 00 9e 01 1d 00 bc 52 d0 1e 20 b8
28 55 40 26 35 21 00 00 1e 01 1d 80 d0 72 1c 16
20 10 2c 25 80 26 35 21 00 00 9e 00 00 00 00 6f

----------------

Block 0, Base EDID:
  EDID Structure Version & Revision: 1.3
  Vendor & Product Identification:
    Manufacturer: PTF
    Model: 8729
    Serial Number: ...
    Made in: week 17 of 2009
  Basic Display Parameters & Features:
    Digital display
    Maximum image size: 50 cm x 29 cm
    Gamma: 2.20
    DPMS levels: Standby Suspend Off
    RGB color display
    First detailed timing is the preferred timing
  Color Characteristics:
    Red  : 0.6435, 0.3330
    Green: 0.2861, 0.6054
    Blue : 0.1523, 0.0761
    White: 0.3134, 0.3291
  Established Timings I & II:
    IBM     :   720x400    70.081663 Hz   9:5     31.467 kHz     28.320000 MHz
    DMT 0x04:   640x480    59.940476 Hz   4:3     31.469 kHz     25.175000 MHz
    DMT 0x06:   640x480    75.000000 Hz   4:3     37.500 kHz     31.500000 MHz
    DMT 0x09:   800x600    60.316541 Hz   4:3     37.879 kHz     40.000000 MHz
    DMT 0x0b:   800x600    75.000000 Hz   4:3     46.875 kHz     49.500000 MHz
    DMT 0x10:  1024x768    60.003840 Hz   4:3     48.363 kHz     65.000000 MHz
    DMT 0x12:  1024x768    75.028582 Hz   4:3     60.023 kHz     78.750000 MHz
    DMT 0x24:  1280x1024   75.024675 Hz   5:4     79.976 kHz    135.000000 MHz
  Standard Timings:
    DMT 0x55:  1280x720    60.000000 Hz  16:9     45.000 kHz     74.250000 MHz
    DMT 0x23:  1280x1024   60.019740 Hz   5:4     63.981 kHz    108.000000 MHz
    DMT 0x33:  1600x1200   60.000000 Hz   4:3     75.000 kHz    162.000000 MHz
  Detailed Timing Descriptors:
    DTD 1:  1920x1080   60.000000 Hz  16:9     67.500 kHz    148.500000 MHz (497 mm x 292 mm)
                 Hfront   88 Hsync  44 Hback  148 Hpol P
                 Vfront    9 Vsync   6 Vback   30 Vpol P
    Display Product Serial Number: ...
    Display Range Limits:
      Monitor ranges (GTF): 56-76 Hz V, 31-82 kHz H, max dotclock 160 MHz
    Display Product Name: 'PTFBGF-22RW'
  Extension blocks: 1
Checksum: 0x53

----------------

Block 1, CTA-861 Extension Block:
  Revision: 3
  Underscans IT Video Formats by default
  Basic audio support
  Supports YCbCr 4:4:4
  Supports YCbCr 4:2:2
  Native DTDs: 1
  Audio Data Block:
    Linear PCM:
      Max channels: 2
      Supported sample rates (kHz): 192 176.4 96 88.2 48 44.1 32
      Supported sample sizes (bits): 24 20 16
  Video Data Block:
    VIC   2:   720x480    59.940060 Hz   4:3     31.469 kHz     27.000000 MHz
    VIC   3:   720x480    59.940060 Hz  16:9     31.469 kHz     27.000000 MHz
    VIC   6:  1440x480i   59.940060 Hz   4:3     15.734 kHz     27.000000 MHz
    VIC   7:  1440x480i   59.940060 Hz  16:9     15.734 kHz     27.000000 MHz
    VIC  21:  1440x576i   50.000000 Hz   4:3     15.625 kHz     27.000000 MHz
    VIC  22:  1440x576i   50.000000 Hz  16:9     15.625 kHz     27.000000 MHz
    VIC  17:   720x576    50.000000 Hz   4:3     31.250 kHz     27.000000 MHz
    VIC  18:   720x576    50.000000 Hz  16:9     31.250 kHz     27.000000 MHz
    VIC  19:  1280x720    50.000000 Hz  16:9     37.500 kHz     74.250000 MHz
    VIC   4:  1280x720    60.000000 Hz  16:9     45.000 kHz     74.250000 MHz
    VIC   5:  1920x1080i  60.000000 Hz  16:9     33.750 kHz     74.250000 MHz
    VIC  20:  1920x1080i  50.000000 Hz  16:9     28.125 kHz     74.250000 MHz
    VIC  16:  1920x1080   60.000000 Hz  16:9     67.500 kHz    148.500000 MHz (native)
    VIC  31:  1920x1080   50.000000 Hz  16:9     56.250 kHz    148.500000 MHz
  Speaker Allocation Data Block:
    FL/FR - Front Left/Right
  Vendor-Specific Data Block (HDMI), OUI 00-0C-03:
    Source physical address: 1.0.0.0
  Detailed Timing Descriptors:
    DTD 2:   720x480    59.940060 Hz   3:2     31.469 kHz     27.000000 MHz (550 mm x 309 mm)
                 Hfront   16 Hsync  62 Hback   60 Hpol N
                 Vfront    9 Vsync   6 Vback   30 Vpol N
    DTD 3:   720x576    50.000000 Hz   5:4     31.250 kHz     27.000000 MHz (550 mm x 309 mm)
                 Hfront   12 Hsync  64 Hback   68 Hpol N
                 Vfront    5 Vsync   5 Vback   39 Vpol N
    DTD 4:  1920x1080i  60.000000 Hz  16:9     33.750 kHz     74.250000 MHz (550 mm x 309 mm)
                 Hfront   88 Hsync  44 Hback  148 Hpol P
                 Vfront    2 Vsync   5 Vback   15 Vpol P Vfront +0.5 Odd Field
                 Vfront    2 Vsync   5 Vback   15 Vpol P Vback  +0.5 Even Field
    DTD 5:  1280x720    50.000000 Hz  16:9     37.500 kHz     74.250000 MHz (550 mm x 309 mm)
                 Hfront  440 Hsync  40 Hback  220 Hpol P
                 Vfront    5 Vsync   5 Vback   20 Vpol P
    DTD 6:  1920x1080i  50.000000 Hz  16:9     28.125 kHz     74.250000 MHz (550 mm x 309 mm)
                 Hfront  528 Hsync  44 Hback  148 Hpol P
                 Vfront    2 Vsync   5 Vback   15 Vpol P Vfront +0.5 Odd Field
                 Vfront    2 Vsync   5 Vback   15 Vpol P Vback  +0.5 Even Field
Checksum: 0x6f  Unused space in Extension Block: 4 bytes

----------------

Warnings:

Block 0, Base EDID:
  Detailed Timing Descriptor #1: DTD is similar but not identical to VIC 16.
  Detailed Timing Descriptor #1: Image size is 497x292 mm, but based on the picture AR it should be 497x279 mm.
Block 1, CTA-861 Extension Block:
  Video Data Block: VIC 2 and the first DTD are not identical. Is this intended?
  Detailed Timing Descriptor #2: Image size is 550x309 mm, but based on the picture AR it should be 463x309 mm.
  Detailed Timing Descriptor #3: Image size is 550x309 mm, but based on the picture AR it should be 386x309 mm.
  Display Product Serial Number is set, so the Serial Number in the Base EDID should be 0.
  Add a Colorimetry Data Block with the sRGB colorimetry bit set to avoid interop issues.
EDID:
  Base EDID: Some timings are out of range of the Monitor Ranges:
    Vertical Freq: 50.000 - 75.029 Hz (Monitor: 56.000 - 76.000 Hz)
    Horizontal Freq: 15.625 - 79.976 kHz (Monitor: 31.000 - 82.000 kHz)
    Maximum Clock: 162.000 MHz (Monitor: 160.000 MHz)

Failures:

Block 1, CTA-861 Extension Block:
  Detailed Timing Descriptor #2: Mismatch of image size 550x309 mm vs display size 500x290 mm.
  Detailed Timing Descriptor #3: Mismatch of image size 550x309 mm vs display size 500x290 mm.
  Detailed Timing Descriptor #4: Mismatch of image size 550x309 mm vs display size 500x290 mm.
  Detailed Timing Descriptor #5: Mismatch of image size 550x309 mm vs display size 500x290 mm.
  Detailed Timing Descriptor #6: Mismatch of image size 550x309 mm vs display size 500x290 mm.
  Missing VCDB, needed for Set Selectable RGB Quantization to avoid interop issues.
EDID:
  Extension Block 2 started with EDID header, ignoring Extension Blocks >= 2.
  Base EDID: The DTD max image size is 550x309mm, which is larger than the display size 500.0x290.0mm.

EDID conformity: FAIL
