edid-decode (hex):

00 ff ff ff ff ff ff 00 20 e3 00 22 66 66 66 00
02 22 01 03 80 30 1a 78 2a 2d 36 a7 54 38 ae 26
0d 4f 54 25 6f 80 d1 c0 b3 00 95 00 81 80 a9 c0
71 40 8b c0 81 40 02 3a 80 18 71 38 2d 40 58 2c
45 00 e0 04 11 00 00 1a 4f 44 80 a0 70 38 29 40
30 20 33 00 e0 04 11 00 00 1a 00 00 00 fd 00 32
4b 1e 55 15 00 0a 20 20 20 20 20 20 00 00 00 fc
00 47 32 32 30 41 0a 20 20 20 20 20 20 20 01 06

02 03 19 f1 46 01 02 04 10 1f 13 23 09 07 07 83
01 00 00 65 03 0c 00 10 00 02 3a 80 18 71 38 2d
40 58 2c 45 00 e0 04 11 00 00 1a 66 21 56 aa 51
00 1e 30 46 8f 33 00 e0 04 11 00 00 1a 01 1d 00
72 51 d0 1e 20 6e 28 55 00 e0 04 11 00 00 1e 00
00 00 00 00 00 00 00 00 00 00 00 00 00 00 00 00
00 00 00 00 00 00 00 00 00 00 00 00 00 00 00 00
00 00 00 00 00 00 00 00 00 00 00 00 00 00 00 34

00 ff ff ff ff ff ff 00 20 e3 00 22 66 66 66 00
02 22 01 03 80 30 1a 78 2a 2d 36 a7 54 38 ae 26
0d 4f 54 25 6f 80 d1 c0 b3 00 95 00 81 80 a9 c0
71 40 8b c0 81 40 02 3a 80 18 71 38 2d 40 58 2c
45 00 e0 04 11 00 00 1a 4f 44 80 a0 70 38 29 40
30 20 33 00 e0 04 11 00 00 1a 00 00 00 fd 00 32
4b 1e 55 15 00 0a 20 20 20 20 20 20 00 00 00 fc
00 47 32 32 30 41 0a 20 20 20 20 20 20 20 01 06

02 03 19 f1 46 01 02 04 10 1f 13 23 09 07 07 83
01 00 00 65 03 0c 00 10 00 02 3a 80 18 71 38 2d
40 58 2c 45 00 e0 04 11 00 00 1a 66 21 56 aa 51
00 1e 30 46 8f 33 00 e0 04 11 00 00 1a 01 1d 00
72 51 d0 1e 20 6e 28 55 00 e0 04 11 00 00 1e 00
00 00 00 00 00 00 00 00 00 00 00 00 00 00 00 00
00 00 00 00 00 00 00 00 00 00 00 00 00 00 00 00
00 00 00 00 00 00 00 00 00 00 00 00 00 00 00 34

----------------

Block 0, Base EDID:
  EDID Structure Version & Revision: 1.3
  Vendor & Product Identification:
    Manufacturer: HGC
    Model: 8704
    Serial Number: ...
    Made in: week 2 of 2024
  Basic Display Parameters & Features:
    Digital display
    Maximum image size: 48 cm x 26 cm
    Gamma: 2.20
    DPMS levels: Off
    RGB color display
    First detailed timing is the preferred timing
  Color Characteristics:
    Red  : 0.6523, 0.3300
    Green: 0.2216, 0.6806
    Blue : 0.1484, 0.0537
    White: 0.3095, 0.3300
  Established Timings I & II:
    DMT 0x04:   640x480    59.940476 Hz   4:3     31.469 kHz     25.175000 MHz
    DMT 0x06:   640x480    75.000000 Hz   4:3     37.500 kHz     31.500000 MHz
    DMT 0x09:   800x600    60.316541 Hz   4:3     37.879 kHz     40.000000 MHz
    DMT 0x0b:   800x600    75.000000 Hz   4:3     46.875 kHz     49.500000 MHz
    Apple   :   832x624    74.551266 Hz   4:3     49.726 kHz     57.284000 MHz
    DMT 0x10:  1024x768    60.003840 Hz   4:3     48.363 kHz     65.000000 MHz
    DMT 0x11:  1024x768    70.069359 Hz   4:3     56.476 kHz     75.000000 MHz
    DMT 0x12:  1024x768    75.028582 Hz   4:3     60.023 kHz     78.750000 MHz
    DMT 0x24:  1280x1024   75.024675 Hz   5:4     79.976 kHz    135.000000 MHz
    Apple   :  1152x870    75.061550 Hz 192:145   68.681 kHz    100.000000 MHz
  Standard Timings:
    DMT 0x52:  1920x1080   60.000000 Hz  16:9     67.500 kHz    148.500000 MHz
    DMT 0x3a:  1680x1050   59.954250 Hz  16:10    65.290 kHz    146.250000 MHz
    DMT 0x2f:  1440x900    59.887445 Hz  16:10    55.935 kHz    106.500000 MHz
    DMT 0x23:  1280x1024   60.019740 Hz   5:4     63.981 kHz    108.000000 MHz
    DMT 0x53:  1600x900    60.000000 Hz  16:9     60.000 kHz    108.000000 MHz (RB)
    GTF     :  1152x864    60.000000 Hz   4:3     53.700 kHz     81.624000 MHz
    GTF     :  1360x765    60.000341 Hz  16:9     47.520 kHz     84.396000 MHz
    DMT 0x20:  1280x960    60.000000 Hz   4:3     60.000 kHz    108.000000 MHz
  Detailed Timing Descriptors:
    DTD 1:  1920x1080   60.000000 Hz  16:9     67.500 kHz    148.500000 MHz (480 mm x 260 mm)
                 Hfront   88 Hsync  44 Hback  148 Hpol P
                 Vfront    4 Vsync   5 Vback   36 Vpol N
    DTD 2:  1920x1080   74.997427 Hz  16:9     84.072 kHz    174.870000 MHz (480 mm x 260 mm)
                 Hfront   48 Hsync  32 Hback   80 Hpol P
                 Vfront    3 Vsync   3 Vback   35 Vpol N
    Display Range Limits:
      Monitor ranges (GTF): 50-75 Hz V, 30-85 kHz H, max dotclock 210 MHz
    Display Product Name: 'G220A'
  Extension blocks: 1
Checksum: 0x06

----------------

Block 1, CTA-861 Extension Block:
  Revision: 3
  Underscans IT Video Formats by default
  Basic audio support
  Supports YCbCr 4:4:4
  Supports YCbCr 4:2:2
  Native DTDs: 1
  Video Data Block:
    VIC   1:   640x480    59.940476 Hz   4:3     31.469 kHz     25.175000 MHz
    VIC   2:   720x480    59.940060 Hz   4:3     31.469 kHz     27.000000 MHz
    VIC   4:  1280x720    60.000000 Hz  16:9     45.000 kHz     74.250000 MHz
    VIC  16:  1920x1080   60.000000 Hz  16:9     67.500 kHz    148.500000 MHz
    VIC  31:  1920x1080   50.000000 Hz  16:9     56.250 kHz    148.500000 MHz
    VIC  19:  1280x720    50.000000 Hz  16:9     37.500 kHz     74.250000 MHz
  Audio Data Block:
    Linear PCM:
      Max channels: 2
      Supported sample rates (kHz): 48 44.1 32
      Supported sample sizes (bits): 24 20 16
  Speaker Allocation Data Block:
    FL/FR - Front Left/Right
  Vendor-Specific Data Block (HDMI), OUI 00-0C-03:
    Source physical address: 1.0.0.0
  Detailed Timing Descriptors:
    DTD 3:  1920x1080   60.000000 Hz  16:9     67.500 kHz    148.500000 MHz (480 mm x 260 mm)
                 Hfront   88 Hsync  44 Hback  148 Hpol P
                 Vfront    4 Vsync   5 Vback   36 Vpol N
    DTD 4:  1366x768    59.789541 Hz 683:384   47.712 kHz     85.500000 MHz (480 mm x 260 mm)
                 Hfront   70 Hsync 143 Hback  213 Hpol P
                 Vfront    3 Vsync   3 Vback   24 Vpol N
    DTD 5:  1280x720    60.000000 Hz  16:9     45.000 kHz     74.250000 MHz (480 mm x 260 mm)
                 Hfront  110 Hsync  40 Hback  220 Hpol P
                 Vfront    5 Vsync   5 Vback   20 Vpol P
Checksum: 0x34  Unused space in Extension Block: 48 bytes

----------------

Warnings:

Block 0, Base EDID:
  Standard Timings: Standard Timing 1360x765 has a dubious odd vertical resolution.
  Detailed Timing Descriptor #1: DTD is similar but not identical to VIC 16.
Block 1, CTA-861 Extension Block:
  Video Data Block: VIC 1 and the first DTD are not identical. Is this intended?
  Detailed Timing Descriptor #3: DTD is similar but not identical to VIC 16.
  Detailed Timing Descriptor #4: DTD is similar but not identical to DMT 0x51.
  Add a Colorimetry Data Block with the sRGB colorimetry bit set to avoid interop issues.

Failures:

Block 1, CTA-861 Extension Block:
  Missing VCDB, needed for Set Selectable RGB Quantization to avoid interop issues.
EDID:
  Extension Block 2 started with EDID header, ignoring Extension Blocks >= 2.

EDID conformity: FAIL
