edid-decode (hex):

00 ff ff ff ff ff ff 00 06 b3 4b 27 01 01 01 01
26 21 01 04 b5 3c 22 78 3b 65 d0 ae 4f 43 a4 23
10 50 54 bf cf 00 81 40 81 80 95 00 71 4f 81 c0
b3 00 d1 c0 01 01 4d d0 00 a0 f0 70 3e 80 30 20
35 00 54 4f 21 00 00 1a 00 00 00 fd 0c 30 a0 61
61 96 01 0a 20 20 20 20 20 20 00 00 00 fc 00 50
47 32 37 55 51 52 0a 20 20 20 20 20 00 00 00 ff
00 52 39 4c 4d 51 53 31 37 32 37 35 34 0a 02 c4

02 03 38 f1 4f 60 61 04 13 1f 10 0f 0e 1e 1d 3f
5d 5e 5f 76 23 09 07 07 83 01 00 00 e3 05 c0 00
e6 06 05 01 7a 7a 14 e2 00 6a 6d 1a 00 00 02 0b
30 a0 00 04 7a 14 7a 14 b8 bc 00 50 a0 a0 55 50
08 20 68 00 54 4f 21 00 00 1a 56 5e 00 a0 a0 a0
29 50 30 20 35 00 54 4f 21 00 00 1a 00 00 00 00
00 00 00 00 00 00 00 00 00 00 00 00 00 00 00 00
00 00 00 00 00 00 00 00 00 00 00 00 00 00 00 9e

70 12 79 03 00 03 01 64 22 e5 00 04 ff 09 4f 00
07 80 1f 00 9f 05 66 00 02 80 09 00 47 f8 01 04
ff 0e 4f 00 07 00 1f 00 6f 08 7e 00 70 00 07 00
91 14 02 04 ff 0e 4f 00 07 80 1f 00 6f 08 a0 00
92 00 07 00 3f 22 02 04 ff 0e 9f 00 2f 80 1f 00
6f 08 18 00 0b 00 04 00 ce ac 01 04 ff 0e 9f 00
6f 80 1f 00 6f 08 7e 00 76 00 04 00 00 00 00 00
00 00 00 00 00 00 00 00 00 00 00 00 00 00 b7 90

00 ff ff ff ff ff ff 00 06 b3 4b 27 01 01 01 01
26 21 01 04 b5 3c 22 78 3b 65 d0 ae 4f 43 a4 23
10 50 54 bf cf 00 81 40 81 80 95 00 71 4f 81 c0
b3 00 d1 c0 01 01 4d d0 00 a0 f0 70 3e 80 30 20
35 00 54 4f 21 00 00 1a 00 00 00 fd 0c 30 a0 61
61 96 01 0a 20 20 20 20 20 20 00 00 00 fc 00 50
47 32 37 55 51 52 0a 20 20 20 20 20 00 00 00 ff
00 52 39 4c 4d 51 53 31 37 32 37 35 34 0a 02 c4

02 03 38 f1 4f 60 61 04 13 1f 10 0f 0e 1e 1d 3f
5d 5e 5f 76 23 09 07 07 83 01 00 00 e3 05 c0 00
e6 06 05 01 7a 7a 14 e2 00 6a 6d 1a 00 00 02 0b
30 a0 00 04 7a 14 7a 14 b8 bc 00 50 a0 a0 55 50
08 20 68 00 54 4f 21 00 00 1a 56 5e 00 a0 a0 a0
29 50 30 20 35 00 54 4f 21 00 00 1a 00 00 00 00
00 00 00 00 00 00 00 00 00 00 00 00 00 00 00 00
00 00 00 00 00 00 00 00 00 00 00 00 00 00 00 9e

70 12 79 03 00 03 01 64 22 e5 00 04 ff 09 4f 00
07 80 1f 00 9f 05 66 00 02 80 09 00 47 f8 01 04
ff 0e 4f 00 07 00 1f 00 6f 08 7e 00 70 00 07 00
91 14 02 04 ff 0e 4f 00 07 80 1f 00 6f 08 a0 00
92 00 07 00 3f 22 02 04 ff 0e 9f 00 2f 80 1f 00
6f 08 18 00 0b 00 04 00 ce ac 01 04 ff 0e 9f 00
6f 80 1f 00 6f 08 7e 00 76 00 04 00 00 00 00 00
00 00 00 00 00 00 00 00 00 00 00 00 00 00 b7 90

----------------

Block 0, Base EDID:
  EDID Structure Version & Revision: 1.4
  Vendor & Product Identification:
    Manufacturer: AUS
    Model: 10059
    Serial Number: ...
    Made in: week 38 of 2023
  Basic Display Parameters & Features:
    Digital display
    Bits per primary color channel: 10
    DisplayPort interface
    Maximum image size: 60 cm x 34 cm
    Gamma: 2.20
    DPMS levels: Off
    Supported color formats: RGB 4:4:4, YCrCb 4:4:4, YCrCb 4:2:2
    First detailed timing includes the native pixel format and preferred refresh rate
    Display supports continuous frequencies
  Color Characteristics:
    Red  : 0.6806, 0.3105
    Green: 0.2626, 0.6416
    Blue : 0.1396, 0.0634
    White: 0.3125, 0.3281
  Established Timings I & II:
    IBM     :   720x400    70.081663 Hz   9:5     31.467 kHz     28.320000 MHz
    DMT 0x04:   640x480    59.940476 Hz   4:3     31.469 kHz     25.175000 MHz
    Apple   :   640x480    66.666667 Hz   4:3     35.000 kHz     30.240000 MHz
    DMT 0x05:   640x480    72.808802 Hz   4:3     37.861 kHz     31.500000 MHz
    DMT 0x06:   640x480    75.000000 Hz   4:3     37.500 kHz     31.500000 MHz
    DMT 0x08:   800x600    56.250000 Hz   4:3     35.156 kHz     36.000000 MHz
    DMT 0x09:   800x600    60.316541 Hz   4:3     37.879 kHz     40.000000 MHz
    DMT 0x0a:   800x600    72.187572 Hz   4:3     48.077 kHz     50.000000 MHz
    DMT 0x0b:   800x600    75.000000 Hz   4:3     46.875 kHz     49.500000 MHz
    DMT 0x10:  1024x768    60.003840 Hz   4:3     48.363 kHz     65.000000 MHz
    DMT 0x11:  1024x768    70.069359 Hz   4:3     56.476 kHz     75.000000 MHz
    DMT 0x12:  1024x768    75.028582 Hz   4:3     60.023 kHz     78.750000 MHz
    DMT 0x24:  1280x1024   75.024675 Hz   5:4     79.976 kHz    135.000000 MHz
  Standard Timings:
    DMT 0x20:  1280x960    60.000000 Hz   4:3     60.000 kHz    108.000000 MHz
    DMT 0x23:  1280x1024   60.019740 Hz   5:4     63.981 kHz    108.000000 MHz
    DMT 0x2f:  1440x900    59.887445 Hz  16:10    55.935 kHz    106.500000 MHz
    DMT 0x15:  1152x864    75.000000 Hz   4:3     67.500 kHz    108.000000 MHz
    DMT 0x55:  1280x720    60.000000 Hz  16:9     45.000 kHz     74.250000 MHz
    DMT 0x3a:  1680x1050   59.954250 Hz  16:10    65.290 kHz    146.250000 MHz
    DMT 0x52:  1920x1080   60.000000 Hz  16:9     67.500 kHz    148.500000 MHz
  Detailed Timing Descriptors:
    DTD 1:  3840x2160   59.996625 Hz  16:9    133.312 kHz    533.250000 MHz (596 mm x 335 mm)
                 Hfront   48 Hsync  32 Hback   80 Hpol P
                 Vfront    3 Vsync   5 Vback   54 Vpol N
    Display Range Limits:
      Monitor ranges (Range Limits Only): 48-160 Hz V, 352-352 kHz H, max dotclock 1500 MHz
    Display Product Name: 'PG27UQR'
    Display Product Serial Number: ...
  Extension blocks: 2
Checksum: 0xc4

----------------

Block 1, CTA-861 Extension Block:
  Revision: 3
  Underscans IT Video Formats by default
  Basic audio support
  Supports YCbCr 4:4:4
  Supports YCbCr 4:2:2
  Native DTDs: 1
  Video Data Block:
    VIC  96:  3840x2160   50.000000 Hz  16:9    112.500 kHz    594.000000 MHz
    VIC  97:  3840x2160   60.000000 Hz  16:9    135.000 kHz    594.000000 MHz
    VIC   4:  1280x720    60.000000 Hz  16:9     45.000 kHz     74.250000 MHz
    VIC  19:  1280x720    50.000000 Hz  16:9     37.500 kHz     74.250000 MHz
    VIC  31:  1920x1080   50.000000 Hz  16:9     56.250 kHz    148.500000 MHz
    VIC  16:  1920x1080   60.000000 Hz  16:9     67.500 kHz    148.500000 MHz
    VIC  15:  1440x480    59.940060 Hz  16:9     31.469 kHz     54.000000 MHz
    VIC  14:  1440x480    59.940060 Hz   4:3     31.469 kHz     54.000000 MHz
    VIC  30:  1440x576    50.000000 Hz  16:9     31.250 kHz     54.000000 MHz
    VIC  29:  1440x576    50.000000 Hz   4:3     31.250 kHz     54.000000 MHz
    VIC  63:  1920x1080  120.000000 Hz  16:9    135.000 kHz    297.000000 MHz
    VIC  93:  3840x2160   24.000000 Hz  16:9     54.000 kHz    297.000000 MHz
    VIC  94:  3840x2160   25.000000 Hz  16:9     56.250 kHz    297.000000 MHz
    VIC  95:  3840x2160   30.000000 Hz  16:9     67.500 kHz    297.000000 MHz
    VIC 118:  3840x2160  120.000000 Hz  16:9    270.000 kHz   1188.000000 MHz
  Audio Data Block:
    Linear PCM:
      Max channels: 2
      Supported sample rates (kHz): 48 44.1 32
      Supported sample sizes (bits): 24 20 16
  Speaker Allocation Data Block:
    FL/FR - Front Left/Right
  Colorimetry Data Block:
    BT2020YCC
    BT2020RGB
  HDR Static Metadata Data Block:
    Electro optical transfer functions:
      Traditional gamma - SDR luminance range
      SMPTE ST2084
    Supported static metadata descriptors:
      Static metadata type 1
    Desired content max luminance: 122 (702.501 cd/m^2)
    Desired content max frame-average luminance: 122 (702.501 cd/m^2)
    Desired content min luminance: 20 (0.043 cd/m^2)
  Video Capability Data Block:
    YCbCr quantization: No Data
    RGB quantization: Selectable (via AVI Q)
    PT scan behavior: Always Underscanned
    IT scan behavior: Always Underscanned
    CE scan behavior: Always Underscanned
  Vendor-Specific Data Block (AMD), OUI 00-00-1A:
    Version: 2
    Feature Caps: 0x0b
      Local Dimming Supported
    Minimum Refresh Rate: 48 Hz
    Maximum Refresh Rate: 160 Hz
    Flags 1.x: 0x00
    Flags 2.x: 0x04
      ST 2084 (PQ) EOTF Supported
      Linear EOTF (Windows scRGB, 0.0 - 125.0) Supported
      Gamma 2.2 EOTF Supported
      BT.2020 Gamut Supported
    Maximum luminance: 122 (702.501 cd/m^2)
    Minimum luminance: 20 (0.043 cd/m^2)
    Maximum luminance (without local dimming): 122 (702.501 cd/m^2)
    Minimum luminance (without local dimming): 20 (0.043 cd/m^2)
  Detailed Timing Descriptors:
    DTD 2:  2560x1440  120.000000 Hz  16:9    183.000 kHz    483.120000 MHz (596 mm x 335 mm)
                 Hfront    8 Hsync  32 Hback   40 Hpol P
                 Vfront    6 Vsync   8 Vback   71 Vpol N
    DTD 3:  2560x1440   59.950550 Hz  16:9     88.787 kHz    241.500000 MHz (596 mm x 335 mm)
                 Hfront   48 Hsync  32 Hback   80 Hpol P
                 Vfront    3 Vsync   5 Vback   33 Vpol N
Checksum: 0x9e  Unused space in Extension Block: 35 bytes

----------------

Block 2, DisplayID Extension Block:
  Version: 1.2
  Extension Count: 0
  Display Product Type: Standalone display device
  Video Timing Modes Type 1 - Detailed Timings Data Block:
    DTD:  2560x1440  144.000766 Hz  16:9    222.193 kHz    586.590000 MHz (aspect 16:9, no 3D stereo)
               Hfront    8 Hsync  32 Hback   40 Hpol P
               Vfront    3 Vsync  10 Vback   90 Vpol P
    DTD:  3840x2160  143.999358 Hz  16:9    329.327 kHz   1290.960000 MHz (aspect 16:9, no 3D stereo)
               Hfront    8 Hsync  32 Hback   40 Hpol N
               Vfront  113 Vsync   8 Vback    6 Vpol N
    DTD:  3840x2160  149.849643 Hz  16:9    347.801 kHz   1363.380000 MHz (aspect 16:9, no 3D stereo)
               Hfront    8 Hsync  32 Hback   40 Hpol P
               Vfront  147 Vsync   8 Vback    6 Vpol N
    DTD:  3840x2160  160.000000 Hz  16:9    349.600 kHz   1398.400000 MHz (aspect 16:9, no 3D stereo)
               Hfront   48 Hsync  32 Hback   80 Hpol P
               Vfront   12 Vsync   5 Vback    8 Vpol N
    DTD:  3840x2160  119.998907 Hz  16:9    274.438 kHz   1097.750000 MHz (aspect 16:9, no 3D stereo)
               Hfront  112 Hsync  32 Hback   16 Hpol P
               Vfront  119 Vsync   5 Vback    3 Vpol N
  Checksum: 0xb7
Checksum: 0x90

----------------

Warnings:

Block 0, Base EDID:
  Vendor & Product Identification: The serial number is one of the known dummy values, it should probably be set to 0.
Block 1, CTA-861 Extension Block:
  Video Data Block: VIC 96 and the first DTD are not identical. Is this intended?
  Colorimetry Data Block: Set the sRGB colorimetry bit to avoid interop issues.
  Video Capability Data Block: Set Selectable YCbCr Quantization to avoid interop issues.
  Video Capability Data Block: S_PT is equal to S_IT and S_CE, so should be set to 0 instead.
  Display Product Serial Number is set, so the Serial Number in the Base EDID should be 0.
EDID:
  Base EDID: Some timings are out of range of the Monitor Ranges:
    Vertical Freq: 24.000 - 160.000 Hz (Monitor: 48.000 - 160.000 Hz)
    Horizontal Freq: 31.250 - 349.600 kHz (Monitor: 352.000 - 352.000 kHz)

Failures:

EDID:
  Extension Block 3 started with EDID header, ignoring Extension Blocks >= 3.
  DisplayID: Missing DisplayID Display Parameters Data Block.
  DisplayID: DisplayID expects at least one preferred timing.

EDID conformity: FAIL
