edid-decode (hex):

00 ff ff ff ff ff ff 00 09 e5 e9 0c 00 00 00 00
0a 22 01 04 a5 22 16 78 07 14 a5 a7 53 4d 9d 26
0e 50 54 00 00 00 01 01 01 01 01 01 01 01 01 01
01 01 01 01 01 01 60 3f 80 a0 70 b0 64 40 30 20
66 00 59 d7 10 00 00 1a 00 00 00 fd 00 30 a5 d7
d7 2d 01 0a 20 20 20 20 20 20 00 00 00 fe 00 3d
4c 33 30 31 31 20 20 20 20 20 20 ff 00 00 00 fc
00 4e 45 31 36 30 57 55 4d 2d 4e 58 41 0a 01 bd

70 20 79 02 00 21 00 1d 77 0d 6a 08 80 07 b0 04
88 6e 3a 53 d4 e4 9c 66 92 0e 02 35 54 b0 5c b0
5c 00 42 12 78 22 00 14 cf ce 06 85 7f 07 9f 00
2f 00 1f 00 af 04 63 00 05 00 05 00 2b 00 0c 27
00 30 a4 00 00 27 00 30 3b 00 00 2e 00 06 00 42
b0 5c b0 5c 81 00 1e 72 1a 00 00 03 71 30 a5 00
00 53 ff 53 ff a5 00 00 00 00 e3 05 04 00 e6 06
01 01 53 53 ff 00 00 00 00 00 00 00 00 00 2b 90

00 ff ff ff ff ff ff 00 09 e5 e9 0c 00 00 00 00
0a 22 01 04 a5 22 16 78 07 14 a5 a7 53 4d 9d 26
0e 50 54 00 00 00 01 01 01 01 01 01 01 01 01 01
01 01 01 01 01 01 60 3f 80 a0 70 b0 64 40 30 20
66 00 59 d7 10 00 00 1a 00 00 00 fd 00 30 a5 d7
d7 2d 01 0a 20 20 20 20 20 20 00 00 00 fe 00 3d
4c 33 30 31 31 20 20 20 20 20 20 ff 00 00 00 fc
00 4e 45 31 36 30 57 55 4d 2d 4e 58 41 0a 01 bd

70 20 79 02 00 21 00 1d 77 0d 6a 08 80 07 b0 04
88 6e 3a 53 d4 e4 9c 66 92 0e 02 35 54 b0 5c b0
5c 00 42 12 78 22 00 14 cf ce 06 85 7f 07 9f 00
2f 00 1f 00 af 04 63 00 05 00 05 00 2b 00 0c 27
00 30 a4 00 00 27 00 30 3b 00 00 2e 00 06 00 42
b0 5c b0 5c 81 00 1e 72 1a 00 00 03 71 30 a5 00
00 53 ff 53 ff a5 00 00 00 00 e3 05 04 00 e6 06
01 01 53 53 ff 00 00 00 00 00 00 00 00 00 2b 90

----------------

Block 0, Base EDID:
  EDID Structure Version & Revision: 1.4
  Vendor & Product Identification:
    Manufacturer: BOE
    Model: 3305
    Made in: week 10 of 2024
  Basic Display Parameters & Features:
    Digital display
    Bits per primary color channel: 8
    DisplayPort interface
    Maximum image size: 34 cm x 22 cm
    Gamma: 2.20
    Supported color formats: RGB 4:4:4
    Default (sRGB) color space is primary color space
    First detailed timing includes the native pixel format and preferred refresh rate
    Display supports continuous frequencies
  Color Characteristics:
    Red  : 0.6523, 0.3251
    Green: 0.3017, 0.6132
    Blue : 0.1503, 0.0566
    White: 0.3134, 0.3291
  Established Timings I & II: none
  Standard Timings: none
  Detailed Timing Descriptors:
    DTD 1:  1920x1200   60.000000 Hz  16:10    78.000 kHz    162.240000 MHz (345 mm x 215 mm)
                 Hfront   48 Hsync  32 Hback   80 Hpol P
                 Vfront    6 Vsync   6 Vback   88 Vpol N
    Display Range Limits:
      Monitor ranges (Range Limits Only): 48-165 Hz V, 215-215 kHz H, max dotclock 450 MHz
    Alphanumeric Data String: '=L3011      '
    Display Product Name: 'NE160WUM-NXA'
  Extension blocks: 1
Checksum: 0xbd

----------------

Block 1, DisplayID Extension Block:
  Version: 2.0
  Extension Count: 0
  Display Product Primary Use Case: None of the listed primary use cases; generic display
  Display Parameters Data Block (0x21):
    Image size: 344.7 mm x 215.4 mm
    Display native pixel format: 1920x1200
    Scan Orientation: Left to Right, Top to Bottom
    Luminance Information: Guidance for the Source device
    Color Information: CIE 1931
    Audio Speaker Information: not integrated
    Native Color Chromaticity:
      Primary #1:  (0.651855, 0.324951)
      Primary #2:  (0.301758, 0.612793)
      Primary #3:  (0.149902, 0.056885)
      White Point: (0.312988, 0.328857)
    Native Maximum Luminance (Full Coverage): 300.000000 cd/m^2
    Native Maximum Luminance (10% Rectangular Coverage): 300.000000 cd/m^2
    Native Minimum Luminance: 3.000000 cd/m^2
    Native Color Depth: 8 bpc
    Display Device Technology: Active Matrix LCD
    Native Gamma EOTF: 2.20
  Video Timing Modes Type 7 - Detailed Timings Data Block:
    DTD:  1920x1200  165.000000 Hz  16:10   214.500 kHz    446.160000 MHz (aspect 16:10, no 3D stereo, preferred)
               Hfront   48 Hsync  32 Hback   80 Hpol N
               Vfront    6 Vsync   6 Vback   88 Vpol N
  Adaptive Sync Data Block:
    Descriptor #1:
      Native Panel Range
      Fixed Average V-Total and Adaptive V-Total
      Supports Seamless Transition
      'Max Single Frame Duration Increase' field value without jitter impact
      'Max Single Frame Duration Decrease' field value without jitter impact
      Max Duration Increase: 0.00 ms
      Max Duration Decrease: 0.00 ms
      Min Refresh Rate: 48 Hz
      Max Refresh Rate: 165 Hz
    Descriptor #2:
      Native Panel Range
      Fixed Average V-Total and Adaptive V-Total
      Supports Seamless Transition
      'Max Single Frame Duration Increase' field value without jitter impact
      'Max Single Frame Duration Decrease' field value without jitter impact
      Max Duration Increase: 0.00 ms
      Max Duration Decrease: 0.00 ms
      Min Refresh Rate: 48 Hz
      Max Refresh Rate: 60 Hz
  Brightness Luminance Range Data Block:
    Minimum SDR Luminance (Full Coverage): 3.000000 cd/m^2
    Maximum Suggested SDR Luminance (Full Coverage): 300.000000 cd/m^2
    Maximum Boost SDR Luminance: 300.000000 cd/m^2
  CTA-861 DisplayID Data Block:
  Vendor-Specific Data Block (AMD), OUI 00-00-1A:
    Version: 3
    Feature Caps: 0x71
      FreeSync Panel Replay Supported
    Minimum Refresh Rate: 48 Hz
    Maximum Refresh Rate: 165 Hz
    Flags 1.x: 0x00
    Flags 2.x: 0x00
  Colorimetry Data Block:
    sYCC601
  HDR Static Metadata Data Block:
    Electro optical transfer functions:
      Traditional gamma - SDR luminance range
    Supported static metadata descriptors:
      Static metadata type 1
    Desired content max luminance: 83 (301.833 cd/m^2)
    Desired content max frame-average luminance: 83 (301.833 cd/m^2)
    Desired content min luminance: 255 (3.018 cd/m^2)
  Checksum: 0x2b
Checksum: 0x90

----------------

Warnings:

EDID:
  Base EDID: Some timings are out of range of the Monitor Ranges:
    Horizontal Freq: 78.000 - 214.500 kHz (Monitor: 215.000 - 215.000 kHz)

Failures:

Block 0, Base EDID:
  Basic Display Parameters & Features: sRGB is signaled, but the chromaticities do not match.
  Alphanumeric Data String: 0xff byte at position 12.
EDID:
  Extension Block 2 started with EDID header, ignoring Extension Blocks >= 2.

EDID conformity: FAIL
