edid-decode (hex):

00 ff ff ff ff ff ff 00 06 af 3e 10 00 00 00 00
01 13 01 03 90 1f 11 78 0a c8 95 9e 57 54 92 26
0f 50 54 00 00 00 01 01 01 01 01 01 01 01 01 01
01 01 01 01 01 01 68 29 40 4a 61 84 0c 30 40 2a
33 00 35 ae 10 00 00 1a 68 29 40 4a 61 84 0c 30
40 2a 33 00 35 ae 10 00 00 1a 00 00 00 fe 00 46
31 33 33 4a 81 42 31 34 30 52 57 31 00 00 00 00
00 00 00 00 00 00 00 00 00 02 01 0a 20 20 00 18

----------------

Block 0, Base EDID:
  EDID Structure Version & Revision: 1.3
  Vendor & Product Identification:
    Manufacturer: AUO
    Model: 4158
    Made in: week 1 of 2009
  Basic Display Parameters & Features:
    Digital display
    Maximum image size: 31 cm x 17 cm
    Gamma: 2.20
    RGB color display
    First detailed timing is the preferred timing
  Color Characteristics:
    Red  : 0.6201, 0.3398
    Green: 0.3300, 0.5703
    Blue : 0.1503, 0.0595
    White: 0.3134, 0.3291
  Established Timings I & II: none
  Standard Timings: none
  Detailed Timing Descriptors:
    DTD 1:  1600x900    60.221798 Hz  16:9     54.922 kHz    106.000000 MHz (309 mm x 174 mm)
                 Hfront   64 Hsync  42 Hback  224 Hpol P
                 Vfront    3 Vsync   3 Vback    6 Vpol N
    DTD 2:  1600x900    60.221798 Hz  16:9     54.922 kHz    106.000000 MHz (309 mm x 174 mm)
                 Hfront   64 Hsync  42 Hback  224 Hpol P
                 Vfront    3 Vsync   3 Vback    6 Vpol N
    Alphanumeric Data String: 'F133J.B140RW1'
    Manufacturer-Specified Display Descriptor (0x00): 00 00 00 00 00 00 00 00 00 00 00 02 01 0a 20 20 '..............  '
Checksum: 0x18

----------------

Warnings:

Block 0, Base EDID:
  Alphanumeric Data String: Non-ASCII character 0x81 at position 5, can cause problems.

Failures:

Block 0, Base EDID:
  Basic Display Parameters & Features: Digital Video Interface Standard set to reserved value 0x10.
  Missing Display Product Name.
  Missing Display Range Limits Descriptor.

EDID conformity: FAIL
