edid-decode (hex):

00 ff ff ff ff ff ff 00 06 af 3e 10 82 0a 00 00
34 18 01 04 90 1f 11 78 02 c4 e5 98 58 53 94 26
1f 50 54 00 00 00 01 01 01 01 01 01 01 01 01 01
01 01 01 01 01 01 88 2c 40 a0 61 84 2a 30 40 2a
33 00 35 ae 10 00 00 1a b0 1d 40 a0 61 84 2a 30
40 2a 33 00 35 ae 10 00 00 1a 00 00 00 fe 00 57
33 56 31 30 80 42 31 34 30 52 54 46 00 00 00 00
00 00 41 21 a8 01 10 00 00 02 01 0a 20 20 00 76

00 ff ff ff ff ff ff 00 06 af 3e 10 82 0a 00 00
34 18 01 04 90 1f 11 78 02 c4 e5 98 58 53 94 26
1f 50 54 00 00 00 01 01 01 01 01 01 01 01 01 01
01 01 01 01 01 01 88 2c 40 a0 61 84 2a 30 40 2a
33 00 35 ae 10 00 00 1a b0 1d 40 a0 61 84 2a 30
40 2a 33 00 35 ae 10 00 00 1a 00 00 00 fe 00 57
33 56 31 30 80 42 31 34 30 52 54 46 00 00 00 00
00 00 41 21 a8 01 10 00 00 02 01 0a 20 20 00 76

----------------

Block 0, Base EDID:
  EDID Structure Version & Revision: 1.4
  Vendor & Product Identification:
    Manufacturer: AUO
    Model: 4158
    Serial Number: ...
    Made in: week 52 of 2014
  Basic Display Parameters & Features:
    Digital display
    Bits per primary color channel: 6
    Digital interface is not defined
    Maximum image size: 31 cm x 17 cm
    Gamma: 2.20
    Supported color formats: RGB 4:4:4
    First detailed timing includes the native pixel format and preferred refresh rate
  Color Characteristics:
    Red  : 0.5966, 0.3437
    Green: 0.3251, 0.5781
    Blue : 0.1513, 0.1230
    White: 0.3134, 0.3291
  Established Timings I & II: none
  Standard Timings: none
  Detailed Timing Descriptors:
    DTD 1:  1600x900    60.029320 Hz  16:9     56.548 kHz    114.000000 MHz (309 mm x 174 mm)
                 Hfront   64 Hsync  42 Hback  310 Hpol P
                 Vfront    3 Vsync   3 Vback   36 Vpol N
    DTD 2:  1600x900    40.019546 Hz  16:9     37.698 kHz     76.000000 MHz (309 mm x 174 mm)
                 Hfront   64 Hsync  42 Hback  310 Hpol P
                 Vfront    3 Vsync   3 Vback   36 Vpol N
    Alphanumeric Data String: 'W3V10.B140RTF'
    Manufacturer-Specified Display Descriptor (0x00): 00 00 00 00 41 21 a8 01 10 00 00 02 01 0a 20 20 '....A!........  '
Checksum: 0x76

----------------

Warnings:

Block 0, Base EDID:
  Alphanumeric Data String: Non-ASCII character 0x80 at position 5, can cause problems.
  Missing Display Product Name.

Failures:

EDID:
  Extension Block 1 started with EDID header, ignoring Extension Blocks >= 1.

EDID conformity: FAIL
