edid-decode (hex):

00 ff ff ff ff ff ff 00 4c 2d 7f 77 35 52 57 30
ff ff 01 03 80 3c 22 78 2a 89 d1 b2 4c 3c b8 24
0e 50 54 21 08 00 81 00 81 c0 81 80 a9 c0 b3 00
95 00 01 01 01 01 14 d9 00 40 a1 a0 a8 50 80 20
3a 00 56 50 21 00 00 1a 00 00 00 fd 00 30 ff 1e
ff 70 00 0a 20 20 20 20 20 20 00 00 00 fc 00 4f
64 79 73 73 65 79 20 47 36 31 53 44 00 00 00 ff
00 48 4e 42 58 41 30 30 32 38 36 0a 20 20 01 94

02 03 53 f0 e2 78 02 44 10 3f 04 03 23 09 07 07
83 01 00 00 e2 00 4f e3 05 c0 00 67 03 0c 00 20
00 b8 44 6d d8 5d c4 01 78 80 58 00 30 f0 c3 54
0b 74 1a 00 00 03 07 30 f0 00 a0 60 01 4b 02 f0
00 00 00 00 00 00 e6 06 05 01 60 4b 00 e5 01 8b
84 90 39 6f c2 00 a0 a0 a0 55 50 30 20 35 00 56
50 21 00 00 1a 00 00 00 00 00 00 00 00 00 00 00
00 00 00 00 00 00 00 00 00 00 00 00 00 00 00 33

00 ff ff ff ff ff ff 00 4c 2d 7f 77 35 52 57 30
ff ff 01 03 80 3c 22 78 2a 89 d1 b2 4c 3c b8 24
0e 50 54 21 08 00 81 00 81 c0 81 80 a9 c0 b3 00
95 00 01 01 01 01 14 d9 00 40 a1 a0 a8 50 80 20
3a 00 56 50 21 00 00 1a 00 00 00 fd 00 30 ff 1e
ff 70 00 0a 20 20 20 20 20 20 00 00 00 fc 00 4f
64 79 73 73 65 79 20 47 36 31 53 44 00 00 00 ff
00 48 4e 42 58 41 30 30 32 38 36 0a 20 20 01 94

02 03 53 f0 e2 78 02 44 10 3f 04 03 23 09 07 07
83 01 00 00 e2 00 4f e3 05 c0 00 67 03 0c 00 20
00 b8 44 6d d8 5d c4 01 78 80 58 00 30 f0 c3 54
0b 74 1a 00 00 03 07 30 f0 00 a0 60 01 4b 02 f0
00 00 00 00 00 00 e6 06 05 01 60 4b 00 e5 01 8b
84 90 39 6f c2 00 a0 a0 a0 55 50 30 20 35 00 56
50 21 00 00 1a 00 00 00 00 00 00 00 00 00 00 00
00 00 00 00 00 00 00 00 00 00 00 00 00 00 00 33

----------------

Block 0, Base EDID:
  EDID Structure Version & Revision: 1.3
  Vendor & Product Identification:
    Manufacturer: SAM
    Model: 30591
    Serial Number: ...
    Model year: 2245
  Basic Display Parameters & Features:
    Digital display
    Maximum image size: 60 cm x 34 cm
    Gamma: 2.20
    DPMS levels: Off
    RGB color display
    First detailed timing is the preferred timing
  Color Characteristics:
    Red  : 0.6972, 0.2968
    Green: 0.2363, 0.7197
    Blue : 0.1435, 0.0556
    White: 0.3125, 0.3291
  Established Timings I & II:
    DMT 0x04:   640x480    59.940476 Hz   4:3     31.469 kHz     25.175000 MHz
    DMT 0x09:   800x600    60.316541 Hz   4:3     37.879 kHz     40.000000 MHz
    DMT 0x10:  1024x768    60.003840 Hz   4:3     48.363 kHz     65.000000 MHz
  Standard Timings:
    DMT 0x1c:  1280x800    59.810326 Hz  16:10    49.702 kHz     83.500000 MHz
    DMT 0x55:  1280x720    60.000000 Hz  16:9     45.000 kHz     74.250000 MHz
    DMT 0x23:  1280x1024   60.019740 Hz   5:4     63.981 kHz    108.000000 MHz
    DMT 0x53:  1600x900    60.000000 Hz  16:9     60.000 kHz    108.000000 MHz (RB)
    DMT 0x3a:  1680x1050   59.954250 Hz  16:10    65.290 kHz    146.250000 MHz
    DMT 0x2f:  1440x900    59.887445 Hz  16:10    55.935 kHz    106.500000 MHz
  Detailed Timing Descriptors:
    DTD 1:  2560x1440  119.998964 Hz  16:9    192.958 kHz    555.720000 MHz (598 mm x 336 mm)
                 Hfront  128 Hsync  32 Hback  160 Hpol P
                 Vfront    3 Vsync  10 Vback  155 Vpol N
    Display Range Limits:
      Monitor ranges (GTF): 48-255 Hz V, 30-255 kHz H, max dotclock 1120 MHz
    Display Product Name: 'Odyssey G61SD'
    Display Product Serial Number: ...
  Extension blocks: 1
Checksum: 0x94

----------------

Block 1, CTA-861 Extension Block:
  Revision: 3
  Underscans IT Video Formats by default
  Basic audio support
  Supports YCbCr 4:4:4
  Supports YCbCr 4:2:2
  Native DTDs: 0
  HDMI Forum EDID Extension Override Data Block:
    EDID Extension Block Count: 2
  Video Data Block:
    VIC  16:  1920x1080   60.000000 Hz  16:9     67.500 kHz    148.500000 MHz
    VIC  63:  1920x1080  120.000000 Hz  16:9    135.000 kHz    297.000000 MHz
    VIC   4:  1280x720    60.000000 Hz  16:9     45.000 kHz     74.250000 MHz
    VIC   3:   720x480    59.940060 Hz  16:9     31.469 kHz     27.000000 MHz
  Audio Data Block:
    Linear PCM:
      Max channels: 2
      Supported sample rates (kHz): 48 44.1 32
      Supported sample sizes (bits): 24 20 16
  Speaker Allocation Data Block:
    FL/FR - Front Left/Right
  Video Capability Data Block:
    YCbCr quantization: No Data
    RGB quantization: Selectable (via AVI Q)
    PT scan behavior: No Data
    IT scan behavior: Supports both over- and underscan
    CE scan behavior: Supports both over- and underscan
  Colorimetry Data Block:
    BT2020YCC
    BT2020RGB
  Vendor-Specific Data Block (HDMI), OUI 00-0C-03:
    Source physical address: 2.0.0.0
    Supports_AI
    DC_36bit
    DC_30bit
    DC_Y444
    Maximum TMDS clock: 340 MHz
  Vendor-Specific Data Block (HDMI Forum), OUI C4-5D-D8:
    Version: 1
    Maximum TMDS Character Rate: 600 MHz
    SCDC Present
    Max Fixed Rate Link: 3 and 6 Gbps per lane on 3 lanes, 6, 8 and 10 Gbps on 4 lanes
    Supports UHD VIC
    VRRmin: 48 Hz
    VRRmax: 240 Hz
    Supports VESA DSC 1.2a compression
    Supports Compressed Video Transport for 4:2:0 Pixel Encoding
    Supports 12 bpc Compressed Video Transport
    Supports 10 bpc Compressed Video Transport
    DSC Max Slices: up to 8 slices and up to (340 MHz/Ksliceadjust) pixel clock per slice
    DSC Max Fixed Rate Link: 3 and 6 Gbps per lane on 3 lanes, 6, 8 and 10 Gbps on 4 lanes
    Maximum number of bytes in a line of chunks: 12288
  Vendor-Specific Data Block (AMD), OUI 00-00-1A:
    Version: 3
    Feature Caps: 0x07
      Global Backlight Control Supported
    Minimum Refresh Rate: 48 Hz
    Maximum Refresh Rate: 240 Hz
    Flags 1.x: 0x00
    Flags 2.x: 0xa0
      ST 2084 (PQ) EOTF Supported
      Linear EOTF (Windows scRGB, 0.0 - 125.0) Supported
      BT.2020 Gamut Supported
    Maximum luminance: 96 (400.000 cd/m^2)
    Minimum luminance: 1 (0.000 cd/m^2)
    Maximum luminance (minimum backlight): 75 (253.810 cd/m^2)
    Minimum luminance (minimum backlight): 2 (0.000 cd/m^2)
  HDR Static Metadata Data Block:
    Electro optical transfer functions:
      Traditional gamma - SDR luminance range
      SMPTE ST2084
    Supported static metadata descriptors:
      Static metadata type 1
    Desired content max luminance: 96 (400.000 cd/m^2)
    Desired content max frame-average luminance: 75 (253.810 cd/m^2)
    Desired content min luminance: 0 (0.000 cd/m^2)
  Vendor-Specific Video Data Block (HDR10+), OUI 90-84-8B:
    Application Version: 1
    Full Frame Peak Luminance Index: 2
    Peak Luminance Index: 3
  Detailed Timing Descriptors:
    DTD 2:  2560x1440  119.997589 Hz  16:9    182.996 kHz    497.750000 MHz (598 mm x 336 mm)
                 Hfront   48 Hsync  32 Hback   80 Hpol P
                 Vfront    3 Vsync   5 Vback   77 Vpol N
Checksum: 0x33  Unused space in Extension Block: 26 bytes

----------------

Warnings:

Block 1, CTA-861 Extension Block:
  Video Data Block: VIC 16 and the first DTD are not identical. Is this intended?
  Video Capability Data Block: Set Selectable YCbCr Quantization to avoid interop issues.
  Colorimetry Data Block: Set the sRGB colorimetry bit to avoid interop issues.
  Display Product Serial Number is set, so the Serial Number in the Base EDID should be 0.

Failures:

Block 0, Base EDID:
  Vendor & Product Identification: EDID 1.3 does not support week 0xff.
  Vendor & Product Identification: The year is more than one year in the future.
Block 1, CTA-861 Extension Block:
  Vendor-Specific Data Block (HDMI Forum), OUI C4-5D-D8: UHD VIC bit is 1, but no related VIC codes are present.
EDID:
  Extension Block 2 started with EDID header, ignoring Extension Blocks >= 2.
  Base EDID: HDMI Forum EDID Extension Override Data Block specified 2 extension block(s), but found 1 extension block(s).

EDID conformity: FAIL
