edid-decode (hex):

00 ff ff ff ff ff ff 00 06 af 9f f0 00 00 00 00
1f 1f 01 04 a5 22 16 78 03 47 a5 a8 55 48 9e 25
0e 50 54 00 00 00 01 01 01 01 01 01 01 01 01 01
01 01 01 01 01 01 0c 6c 00 a0 a0 40 5e 60 30 20
aa 00 58 d7 10 00 00 18 70 56 00 a0 a0 40 5e 60
30 20 aa 00 58 d7 10 00 00 18 00 00 00 fd 00 30
3c 66 66 1c 01 0a 20 20 20 20 20 20 00 00 00 fe
00 42 31 36 30 51 41 4e 30 32 2e 57 20 0a 00 31

----------------

Block 0, Base EDID:
  EDID Structure Version & Revision: 1.4
  Vendor & Product Identification:
    Manufacturer: AUO
    Model: 61599
    Made in: week 31 of 2021
  Basic Display Parameters & Features:
    Digital display
    Bits per primary color channel: 8
    DisplayPort interface
    Maximum image size: 34 cm x 22 cm
    Gamma: 2.20
    Supported color formats: RGB 4:4:4
    First detailed timing includes the native pixel format and preferred refresh rate
    Display supports continuous frequencies
  Color Characteristics:
    Red  : 0.6572, 0.3320
    Green: 0.2822, 0.6201
    Blue : 0.1464, 0.0566
    White: 0.3134, 0.3291
  Established Timings I & II: none
  Standard Timings: none
  Detailed Timing Descriptors:
    DTD 1:  2560x1600   60.030210 Hz  16:10   101.691 kHz    276.600000 MHz (344 mm x 215 mm)
                 Hfront   48 Hsync  32 Hback   80 Hpol N
                 Vfront   10 Vsync  10 Vback   74 Vpol N
    DTD 2:  2560x1600   48.024168 Hz  16:10    81.353 kHz    221.280000 MHz (344 mm x 215 mm)
                 Hfront   48 Hsync  32 Hback   80 Hpol N
                 Vfront   10 Vsync  10 Vback   74 Vpol N
    Display Range Limits:
      Monitor ranges (Range Limits Only): 48-60 Hz V, 102-102 kHz H, max dotclock 280 MHz
    Alphanumeric Data String: 'B160QAN02.W '
Checksum: 0x31

----------------

Warnings:

Block 0, Base EDID:
  Missing Display Product Name.
EDID:
  Base EDID: Some timings are out of range of the Monitor Ranges:
    Horizontal Freq: 81.352 - 101.691 kHz (Monitor: 102.000 - 102.000 kHz)

Failures:

Block 0, Base EDID:
  Alphanumeric Data String: One or more trailing spaces before newline.

EDID conformity: FAIL
