edid-decode (hex):

00 ff ff ff ff ff ff 00 33 23 01 00 01 00 00 00
34 1d 01 03 80 34 1e 78 2e 9d e1 a6 54 54 9f 26
0d 50 54 a5 6f 80 45 7c 61 7c 81 80 81 bc 95 00
95 3c b3 00 01 01 02 3a 80 18 71 38 2d 40 58 2c
45 00 13 2a 21 00 00 1e 04 74 80 18 71 38 2d 40
30 20 45 00 13 2a 21 00 00 1e 00 00 00 ff 00 30
30 0a 20 20 20 20 20 20 20 20 20 20 00 00 00 fc
00 4a 44 32 34 46 47 31 4d 53 31 34 34 0a 01 13

02 03 23 f1 50 90 05 04 03 02 01 11 12 13 14 06
07 15 16 1f 20 23 09 07 07 65 03 0c 00 10 00 83
01 00 00 04 74 80 18 71 38 2d 40 58 2c 45 00 13
2a 21 00 00 1e 01 1d 80 18 71 1c 16 20 58 2c 25
00 13 2a 21 00 00 9f 01 1d 00 72 51 d0 1e 20 6e
28 55 00 13 2a 21 00 00 1f 8c 0a d0 8a 20 e0 2d
10 10 3e 96 00 13 2a 21 00 00 19 00 00 00 00 00
00 00 00 00 00 00 00 00 00 00 00 00 00 00 00 8c

00 ff ff ff ff ff ff 00 33 23 01 00 01 00 00 00
34 1d 01 03 80 34 1e 78 2e 9d e1 a6 54 54 9f 26
0d 50 54 a5 6f 80 45 7c 61 7c 81 80 81 bc 95 00
95 3c b3 00 01 01 02 3a 80 18 71 38 2d 40 58 2c
45 00 13 2a 21 00 00 1e 04 74 80 18 71 38 2d 40
30 20 45 00 13 2a 21 00 00 1e 00 00 00 ff 00 30
30 0a 20 20 20 20 20 20 20 20 20 20 00 00 00 fc
00 4a 44 32 34 46 47 31 4d 53 31 34 34 0a 01 13

02 03 23 f1 50 90 05 04 03 02 01 11 12 13 14 06
07 15 16 1f 20 23 09 07 07 65 03 0c 00 10 00 83
01 00 00 04 74 80 18 71 38 2d 40 58 2c 45 00 13
2a 21 00 00 1e 01 1d 80 18 71 1c 16 20 58 2c 25
00 13 2a 21 00 00 9f 01 1d 00 72 51 d0 1e 20 6e
28 55 00 13 2a 21 00 00 1f 8c 0a d0 8a 20 e0 2d
10 10 3e 96 00 13 2a 21 00 00 19 00 00 00 00 00
00 00 00 00 00 00 00 00 00 00 00 00 00 00 00 8c

----------------

Block 0, Base EDID:
  EDID Structure Version & Revision: 1.3
  Vendor & Product Identification:
    Manufacturer: LYC
    Model: 1
    Serial Number: ...
    Made in: week 52 of 2019
  Basic Display Parameters & Features:
    Digital display
    Maximum image size: 52 cm x 30 cm
    Gamma: 2.20
    DPMS levels: Off
    RGB color display
    Default (sRGB) color space is primary color space
    First detailed timing is the preferred timing
  Color Characteristics:
    Red  : 0.6503, 0.3291
    Green: 0.3310, 0.6220
    Blue : 0.1513, 0.0527
    White: 0.3125, 0.3291
  Established Timings I & II:
    IBM     :   720x400    70.081663 Hz   9:5     31.467 kHz     28.320000 MHz
    DMT 0x04:   640x480    59.940476 Hz   4:3     31.469 kHz     25.175000 MHz
    DMT 0x06:   640x480    75.000000 Hz   4:3     37.500 kHz     31.500000 MHz
    DMT 0x09:   800x600    60.316541 Hz   4:3     37.879 kHz     40.000000 MHz
    DMT 0x0b:   800x600    75.000000 Hz   4:3     46.875 kHz     49.500000 MHz
    Apple   :   832x624    74.551266 Hz   4:3     49.726 kHz     57.284000 MHz
    DMT 0x10:  1024x768    60.003840 Hz   4:3     48.363 kHz     65.000000 MHz
    DMT 0x11:  1024x768    70.069359 Hz   4:3     56.476 kHz     75.000000 MHz
    DMT 0x12:  1024x768    75.028582 Hz   4:3     60.023 kHz     78.750000 MHz
    DMT 0x24:  1280x1024   75.024675 Hz   5:4     79.976 kHz    135.000000 MHz
    Apple   :  1152x870    75.061550 Hz 192:145   68.681 kHz    100.000000 MHz
  Standard Timings:
    GTF     :   800x600   119.999886 Hz   4:3     77.160 kHz     83.950000 MHz
    GTF     :  1024x768   119.999931 Hz   4:3     98.760 kHz    139.054000 MHz
    DMT 0x23:  1280x1024   60.019740 Hz   5:4     63.981 kHz    108.000000 MHz
    GTF     :  1280x1024  120.000185 Hz   5:4    131.640 kHz    233.793000 MHz
    DMT 0x2f:  1440x900    59.887445 Hz  16:10    55.935 kHz    106.500000 MHz
    GTF     :  1440x900   119.999896 Hz  16:10   115.800 kHz    229.747000 MHz
    DMT 0x3a:  1680x1050   59.954250 Hz  16:10    65.290 kHz    146.250000 MHz
  Detailed Timing Descriptors:
    DTD 1:  1920x1080   60.000000 Hz  16:9     67.500 kHz    148.500000 MHz (531 mm x 298 mm)
                 Hfront   88 Hsync  44 Hback  148 Hpol P
                 Vfront    4 Vsync   5 Vback   36 Vpol P
    DTD 2:  1920x1080  120.000000 Hz  16:9    135.000 kHz    297.000000 MHz (531 mm x 298 mm)
                 Hfront   48 Hsync  32 Hback  200 Hpol P
                 Vfront    4 Vsync   5 Vback   36 Vpol P
    Display Product Serial Number: ...
    Display Product Name: 'JD24FG1MS144'
  Extension blocks: 1
Checksum: 0x13

----------------

Block 1, CTA-861 Extension Block:
  Revision: 3
  Underscans IT Video Formats by default
  Basic audio support
  Supports YCbCr 4:4:4
  Supports YCbCr 4:2:2
  Native DTDs: 1
  Video Data Block:
    VIC  16:  1920x1080   60.000000 Hz  16:9     67.500 kHz    148.500000 MHz (native)
    VIC   5:  1920x1080i  60.000000 Hz  16:9     33.750 kHz     74.250000 MHz
    VIC   4:  1280x720    60.000000 Hz  16:9     45.000 kHz     74.250000 MHz
    VIC   3:   720x480    59.940060 Hz  16:9     31.469 kHz     27.000000 MHz
    VIC   2:   720x480    59.940060 Hz   4:3     31.469 kHz     27.000000 MHz
    VIC   1:   640x480    59.940476 Hz   4:3     31.469 kHz     25.175000 MHz
    VIC  17:   720x576    50.000000 Hz   4:3     31.250 kHz     27.000000 MHz
    VIC  18:   720x576    50.000000 Hz  16:9     31.250 kHz     27.000000 MHz
    VIC  19:  1280x720    50.000000 Hz  16:9     37.500 kHz     74.250000 MHz
    VIC  20:  1920x1080i  50.000000 Hz  16:9     28.125 kHz     74.250000 MHz
    VIC   6:  1440x480i   59.940060 Hz   4:3     15.734 kHz     27.000000 MHz
    VIC   7:  1440x480i   59.940060 Hz  16:9     15.734 kHz     27.000000 MHz
    VIC  21:  1440x576i   50.000000 Hz   4:3     15.625 kHz     27.000000 MHz
    VIC  22:  1440x576i   50.000000 Hz  16:9     15.625 kHz     27.000000 MHz
    VIC  31:  1920x1080   50.000000 Hz  16:9     56.250 kHz    148.500000 MHz
    VIC  32:  1920x1080   24.000000 Hz  16:9     27.000 kHz     74.250000 MHz
  Audio Data Block:
    Linear PCM:
      Max channels: 2
      Supported sample rates (kHz): 48 44.1 32
      Supported sample sizes (bits): 24 20 16
  Vendor-Specific Data Block (HDMI), OUI 00-0C-03:
    Source physical address: 1.0.0.0
  Speaker Allocation Data Block:
    FL/FR - Front Left/Right
  Detailed Timing Descriptors:
    DTD 3:  1920x1080  120.000000 Hz  16:9    135.000 kHz    297.000000 MHz (531 mm x 298 mm)
                 Hfront   88 Hsync  44 Hback  148 Hpol P
                 Vfront    4 Vsync   5 Vback   36 Vpol P
    DTD 4:  1920x1080i  60.000000 Hz  16:9     33.750 kHz     74.250000 MHz (531 mm x 298 mm)
                 Hfront   88 Hsync  44 Hback  148 Hpol P
                 Vfront    2 Vsync   5 Vback   15 Vpol P Vfront +0.5 Odd Field
                 Vfront    2 Vsync   5 Vback   15 Vpol P Vback  +0.5 Even Field
    DTD 5:  1280x720    60.000000 Hz  16:9     45.000 kHz     74.250000 MHz (531 mm x 298 mm)
                 Hfront  110 Hsync  40 Hback  220 Hpol P
                 Vfront    5 Vsync   5 Vback   20 Vpol P
    DTD 6:   720x480    59.940060 Hz   3:2     31.469 kHz     27.000000 MHz (531 mm x 298 mm)
                 Hfront   16 Hsync  62 Hback   60 Hpol N
                 Vfront    9 Vsync   6 Vback   30 Vpol N
Checksum: 0x8c  Unused space in Extension Block: 20 bytes

----------------

Warnings:

Block 0, Base EDID:
  Vendor & Product Identification: The serial number is one of the known dummy values, it should probably be set to 0.
  Detailed Timing Descriptor #2: DTD is similar but not identical to VIC 63.
  Display Product Serial Number: ...
Block 1, CTA-861 Extension Block:
  Detailed Timing Descriptor #3: DTD is identical to VIC 63, which is not present in the CTA Ext Block.
  Detailed Timing Descriptor #6: Image size is 531x298 mm, but based on the picture AR it should be 447x298 mm.
  Display Product Serial Number is set, so the Serial Number in the Base EDID should be 0.

Failures:

Block 0, Base EDID:
  Basic Display Parameters & Features: sRGB is signaled, but the chromaticities do not match.
  Detailed Timing Descriptor #1: Mismatch of image size 531x298 mm vs display size 520x300 mm.
  Detailed Timing Descriptor #2: Mismatch of image size 531x298 mm vs display size 520x300 mm.
  Missing Display Range Limits Descriptor.
Block 1, CTA-861 Extension Block:
  Detailed Timing Descriptor #3: Mismatch of image size 531x298 mm vs display size 520x300 mm.
  Detailed Timing Descriptor #4: Mismatch of image size 531x298 mm vs display size 520x300 mm.
  Detailed Timing Descriptor #5: Mismatch of image size 531x298 mm vs display size 520x300 mm.
  Detailed Timing Descriptor #6: Mismatch of image size 531x298 mm vs display size 520x300 mm.
  Missing VCDB, needed for Set Selectable RGB Quantization to avoid interop issues.
EDID:
  Extension Block 2 started with EDID header, ignoring Extension Blocks >= 2.
  Base EDID: The DTD max image size is 531x298mm, which is larger than the display size 520.0x300.0mm.

EDID conformity: FAIL
