edid-decode (hex):

00 ff ff ff ff ff ff 00 15 21 9e a1 0a 1a 00 00
19 1e 01 03 80 34 1d 78 ea d6 a5 a2 59 4a 95 24
14 50 54 af cf 00 81 00 81 40 81 80 81 c0 71 40
01 01 45 40 01 01 66 21 56 aa 51 00 1e 30 46 8f
33 00 9a e6 10 00 00 1e 66 21 50 b0 51 00 1b 30
40 70 36 00 9a e6 10 00 00 1c 0e 1f 00 80 51 00
1e 30 10 80 17 00 9a dc 10 00 00 1e 00 00 00 fc
00 45 31 41 41 32 34 4e 2d 47 0a 20 20 20 01 e3

02 03 25 c2 4d 01 03 04 04 04 90 10 13 13 13 9f
20 22 26 09 07 07 09 07 07 83 01 00 00 67 03 0c
00 10 00 80 2d 01 1d 00 72 51 d0 1e 20 6e 28 55
00 c4 8e 21 00 00 18 01 1d 00 72 51 d0 1e 20 6e
28 55 00 c4 8e 21 00 00 19 01 1d 00 bc 52 d0 1e
20 b8 28 55 40 c4 8e 21 00 00 1f 01 1d 00 72 51
d0 1e 20 6e 28 55 00 c4 8e 21 00 00 1f 00 00 00
00 00 00 00 00 00 00 00 00 00 00 00 00 00 00 7a

----------------

Block 0, Base EDID:
  EDID Structure Version & Revision: 1.3
  Vendor & Product Identification:
    Manufacturer: EIA
    Model: 41374
    Serial Number: ...
    Made in: week 25 of 2020
  Basic Display Parameters & Features:
    Digital display
    Maximum image size: 52 cm x 29 cm
    Gamma: 2.20
    DPMS levels: Standby Suspend Off
    RGB color display
    First detailed timing is the preferred timing
  Color Characteristics:
    Red  : 0.6357, 0.3486
    Green: 0.2900, 0.5839
    Blue : 0.1425, 0.0800
    White: 0.3134, 0.3291
  Established Timings I & II:
    IBM     :   720x400    70.081663 Hz   9:5     31.467 kHz     28.320000 MHz
    DMT 0x04:   640x480    59.940476 Hz   4:3     31.469 kHz     25.175000 MHz
    DMT 0x05:   640x480    72.808802 Hz   4:3     37.861 kHz     31.500000 MHz
    DMT 0x06:   640x480    75.000000 Hz   4:3     37.500 kHz     31.500000 MHz
    DMT 0x08:   800x600    56.250000 Hz   4:3     35.156 kHz     36.000000 MHz
    DMT 0x09:   800x600    60.316541 Hz   4:3     37.879 kHz     40.000000 MHz
    DMT 0x0a:   800x600    72.187572 Hz   4:3     48.077 kHz     50.000000 MHz
    DMT 0x0b:   800x600    75.000000 Hz   4:3     46.875 kHz     49.500000 MHz
    DMT 0x10:  1024x768    60.003840 Hz   4:3     48.363 kHz     65.000000 MHz
    DMT 0x11:  1024x768    70.069359 Hz   4:3     56.476 kHz     75.000000 MHz
    DMT 0x12:  1024x768    75.028582 Hz   4:3     60.023 kHz     78.750000 MHz
    DMT 0x24:  1280x1024   75.024675 Hz   5:4     79.976 kHz    135.000000 MHz
  Standard Timings:
    DMT 0x1c:  1280x800    59.810326 Hz  16:10    49.702 kHz     83.500000 MHz
    DMT 0x20:  1280x960    60.000000 Hz   4:3     60.000 kHz    108.000000 MHz
    DMT 0x23:  1280x1024   60.019740 Hz   5:4     63.981 kHz    108.000000 MHz
    DMT 0x55:  1280x720    60.000000 Hz  16:9     45.000 kHz     74.250000 MHz
    GTF     :  1152x864    60.000000 Hz   4:3     53.700 kHz     81.624000 MHz
    DMT 0x09:   800x600    60.316541 Hz   4:3     37.879 kHz     40.000000 MHz
  Detailed Timing Descriptors:
    DTD 1:  1366x768    59.789541 Hz 683:384   47.712 kHz     85.500000 MHz (410 mm x 230 mm)
                 Hfront   70 Hsync 143 Hback  213 Hpol P
                 Vfront    3 Vsync   3 Vback   24 Vpol P
    DTD 2:  1360x768    60.015162 Hz  85:48    47.712 kHz     85.500000 MHz (410 mm x 230 mm)
                 Hfront   64 Hsync 112 Hback  256 Hpol N
                 Vfront    3 Vsync   6 Vback   18 Vpol P
    DTD 3:  1280x768    59.870228 Hz   5:3     47.776 kHz     79.500000 MHz (410 mm x 220 mm)
                 Hfront   16 Hsync 128 Hback  240 Hpol P
                 Vfront    1 Vsync   7 Vback   22 Vpol P
    Display Product Name: 'E1AA24N-G'
  Extension blocks: 1
Checksum: 0xe3

----------------

Block 1, CTA-861 Extension Block:
  Revision: 3
  Underscans IT Video Formats by default
  Basic audio support
  Native detailed modes: 2
  Video Data Block:
    VIC   1:   640x480    59.940476 Hz   4:3     31.469 kHz     25.175000 MHz
    VIC   3:   720x480    59.940060 Hz  16:9     31.469 kHz     27.000000 MHz
    VIC   4:  1280x720    60.000000 Hz  16:9     45.000 kHz     74.250000 MHz
    VIC   4:  1280x720    60.000000 Hz  16:9     45.000 kHz     74.250000 MHz
    VIC   4:  1280x720    60.000000 Hz  16:9     45.000 kHz     74.250000 MHz
    VIC  16:  1920x1080   60.000000 Hz  16:9     67.500 kHz    148.500000 MHz (native)
    VIC  16:  1920x1080   60.000000 Hz  16:9     67.500 kHz    148.500000 MHz
    VIC  19:  1280x720    50.000000 Hz  16:9     37.500 kHz     74.250000 MHz
    VIC  19:  1280x720    50.000000 Hz  16:9     37.500 kHz     74.250000 MHz
    VIC  19:  1280x720    50.000000 Hz  16:9     37.500 kHz     74.250000 MHz
    VIC  31:  1920x1080   50.000000 Hz  16:9     56.250 kHz    148.500000 MHz (native)
    VIC  32:  1920x1080   24.000000 Hz  16:9     27.000 kHz     74.250000 MHz
    VIC  34:  1920x1080   30.000000 Hz  16:9     33.750 kHz     74.250000 MHz
  Audio Data Block:
    Linear PCM:
      Max channels: 2
      Supported sample rates (kHz): 48 44.1 32
      Supported sample sizes (bits): 24 20 16
    Linear PCM:
      Max channels: 2
      Supported sample rates (kHz): 48 44.1 32
      Supported sample sizes (bits): 24 20 16
  Speaker Allocation Data Block:
    FL/FR - Front Left/Right
  Vendor-Specific Data Block (HDMI), OUI 00-0C-03:
    Source physical address: 1.0.0.0
    Supports_AI
    Maximum TMDS clock: 225 MHz
  Detailed Timing Descriptors:
    DTD 4:  1280x720    60.000000 Hz  16:9     45.000 kHz     74.250000 MHz (708 mm x 398 mm)
                 Hfront  110 Hsync  40 Hback  220 Hpol N
                 Vfront    5 Vsync   5 Vback   20 Vpol N
    DTD 5:  1280x720    60.000000 Hz  16:9     45.000 kHz     74.250000 MHz (708 mm x 398 mm)
                 Hfront  110 Hsync  40 Hback  220 Hpol N
                 Vfront    5 Vsync   5 Vback   20 Vpol N
    DTD 6:  1280x720    50.000000 Hz  16:9     37.500 kHz     74.250000 MHz (708 mm x 398 mm)
                 Hfront  440 Hsync  40 Hback  220 Hpol P
                 Vfront    5 Vsync   5 Vback   20 Vpol P
    DTD 7:  1280x720    60.000000 Hz  16:9     45.000 kHz     74.250000 MHz (708 mm x 398 mm)
                 Hfront  110 Hsync  40 Hback  220 Hpol P
                 Vfront    5 Vsync   5 Vback   20 Vpol P
Checksum: 0x7a  Unused space in Extension Block: 18 bytes

----------------

Warnings:

Block 0, Base EDID:
  Vendor & Product Identification: The serial number is one of the known dummy values, it should probably be set to 0.
  Detailed Timing Descriptor #2: DTD is similar but not identical to DMT 0x27.
  Detailed Timing Descriptor #3: DTD is similar but not identical to DMT 0x17.
  Detailed Timing Descriptor #3: Image size is 410x220 mm, but based on the picture AR it should be 410x246 mm.
Block 1, CTA-861 Extension Block:
  Video Data Block: VIC 1 and the first DTD are not identical. Is this intended?
  Video Data Block: All VICs are in ascending order, and the first (preferred) VIC <= 4, is that intended?
  Detailed Timing Descriptor #4: DTD is similar but not identical to VIC 4.
  Detailed Timing Descriptor #5: DTD is similar but not identical to VIC 4.
  Add a Colorimetry Data Block with the sRGB colorimetry bit set to avoid interop issues.

Failures:

Block 0, Base EDID:
  Detailed Timing Descriptor #1: Mismatch of image size 410x230 mm vs display size 520x290 mm.
  Detailed Timing Descriptor #2: Mismatch of image size 410x230 mm vs display size 520x290 mm.
  Detailed Timing Descriptor #3: Mismatch of image size 410x220 mm vs display size 520x290 mm.
  Missing Display Range Limits Descriptor.
Block 1, CTA-861 Extension Block:
  Video Data Block: Duplicate VIC 4.
  Video Data Block: Duplicate VIC 16.
  Video Data Block: Duplicate VIC 19.
  Detailed Timing Descriptor #4: Mismatch of image size 708x398 mm vs display size 520x290 mm.
  Detailed Timing Descriptor #5: Mismatch of image size 708x398 mm vs display size 520x290 mm.
  Detailed Timing Descriptor #6: Mismatch of image size 708x398 mm vs display size 520x290 mm.
  Detailed Timing Descriptor #7: Mismatch of image size 708x398 mm vs display size 520x290 mm.
  Missing VCDB, needed for Set Selectable RGB Quantization to avoid interop issues.
EDID:
  Base EDID: The DTD max image size is 708x398mm, which is larger than the display size 520.0x290.0mm.
  CTA-861: Native progressive timings are a mix of several resolutions.

EDID conformity: FAIL
