edid-decode (hex):

00 ff ff ff ff ff ff 00 4c 2d 48 54 01 00 00 00
15 13 01 03 80 00 00 78 0a ee 91 a3 54 4c 99 26
0f 50 54 20 00 00 01 01 01 01 01 01 01 01 01 01
01 01 01 01 01 01 02 3a 80 18 71 38 2d 40 58 2c
45 00 10 09 00 00 00 1e 8c 0a d0 8a 20 e0 2d 10
10 3e 96 00 04 03 00 00 00 18 00 00 00 fc 00 53
41 4d 53 55 4e 47 0a 20 20 20 20 20 00 00 00 fd
00 3b 3d 0f 2e 08 00 0a 20 20 20 20 20 20 01 fb

02 03 31 71 4d 82 05 04 01 10 11 14 13 1f 06 15
03 12 29 09 07 07 15 07 50 3d 07 c0 83 01 00 00
6c 03 0c 00 11 00 80 1e 00 00 00 00 00 e3 05 03
01 01 1d 00 72 51 d0 1e 20 6e 28 55 00 10 09 00
00 00 1e d6 09 80 a0 20 e0 2d 10 10 60 a2 00 04
03 00 00 00 18 8c 0a d0 8a 20 e0 2d 10 10 3e 96
00 10 09 00 00 00 18 00 00 00 00 00 00 00 00 00
00 00 00 00 00 00 00 00 00 00 00 00 00 00 00 df

00 ff ff ff ff ff ff 00 4c 2d 48 54 01 00 00 00
15 13 01 03 80 00 00 78 0a ee 91 a3 54 4c 99 26
0f 50 54 20 00 00 01 01 01 01 01 01 01 01 01 01
01 01 01 01 01 01 02 3a 80 18 71 38 2d 40 58 2c
45 00 10 09 00 00 00 1e 8c 0a d0 8a 20 e0 2d 10
10 3e 96 00 04 03 00 00 00 18 00 00 00 fc 00 53
41 4d 53 55 4e 47 0a 20 20 20 20 20 00 00 00 fd
00 3b 3d 0f 2e 08 00 0a 20 20 20 20 20 20 01 fb

02 03 31 71 4d 82 05 04 01 10 11 14 13 1f 06 15
03 12 29 09 07 07 15 07 50 3d 07 c0 83 01 00 00
6c 03 0c 00 11 00 80 1e 00 00 00 00 00 e3 05 03
01 01 1d 00 72 51 d0 1e 20 6e 28 55 00 10 09 00
00 00 1e d6 09 80 a0 20 e0 2d 10 10 60 a2 00 04
03 00 00 00 18 8c 0a d0 8a 20 e0 2d 10 10 3e 96
00 10 09 00 00 00 18 00 00 00 00 00 00 00 00 00
00 00 00 00 00 00 00 00 00 00 00 00 00 00 00 df

----------------

Block 0, Base EDID:
  EDID Structure Version & Revision: 1.3
  Vendor & Product Identification:
    Manufacturer: SAM
    Model: 21576
    Serial Number: ...
    Made in: week 21 of 2009
  Basic Display Parameters & Features:
    Digital display
    Image size is variable
    Gamma: 2.20
    RGB color display
    First detailed timing is the preferred timing
  Color Characteristics:
    Red  : 0.6396, 0.3300
    Green: 0.2998, 0.5996
    Blue : 0.1503, 0.0595
    White: 0.3125, 0.3291
  Established Timings I & II:
    DMT 0x04:   640x480    59.940476 Hz   4:3     31.469 kHz     25.175000 MHz
  Standard Timings: none
  Detailed Timing Descriptors:
    DTD 1:  1920x1080   60.000000 Hz  16:9     67.500 kHz    148.500000 MHz (16 mm x 9 mm)
                 Hfront   88 Hsync  44 Hback  148 Hpol P
                 Vfront    4 Vsync   5 Vback   36 Vpol P
    DTD 2:   720x480    59.940060 Hz   3:2     31.469 kHz     27.000000 MHz (4 mm x 3 mm)
                 Hfront   16 Hsync  62 Hback   60 Hpol N
                 Vfront    9 Vsync   6 Vback   30 Vpol N
    Display Product Name: 'SAMSUNG'
    Display Range Limits:
      Monitor ranges (GTF): 59-61 Hz V, 15-46 kHz H, max dotclock 80 MHz
  Extension blocks: 1
Checksum: 0xfb

----------------

Block 1, CTA-861 Extension Block:
  Revision: 3
  Basic audio support
  Supports YCbCr 4:4:4
  Supports YCbCr 4:2:2
  Native DTDs: 1
  Video Data Block:
    VIC   2:   720x480    59.940060 Hz   4:3     31.469 kHz     27.000000 MHz (native)
    VIC   5:  1920x1080i  60.000000 Hz  16:9     33.750 kHz     74.250000 MHz
    VIC   4:  1280x720    60.000000 Hz  16:9     45.000 kHz     74.250000 MHz
    VIC   1:   640x480    59.940476 Hz   4:3     31.469 kHz     25.175000 MHz
    VIC  16:  1920x1080   60.000000 Hz  16:9     67.500 kHz    148.500000 MHz
    VIC  17:   720x576    50.000000 Hz   4:3     31.250 kHz     27.000000 MHz
    VIC  20:  1920x1080i  50.000000 Hz  16:9     28.125 kHz     74.250000 MHz
    VIC  19:  1280x720    50.000000 Hz  16:9     37.500 kHz     74.250000 MHz
    VIC  31:  1920x1080   50.000000 Hz  16:9     56.250 kHz    148.500000 MHz
    VIC   6:  1440x480i   59.940060 Hz   4:3     15.734 kHz     27.000000 MHz
    VIC  21:  1440x576i   50.000000 Hz   4:3     15.625 kHz     27.000000 MHz
    VIC   3:   720x480    59.940060 Hz  16:9     31.469 kHz     27.000000 MHz
    VIC  18:   720x576    50.000000 Hz  16:9     31.250 kHz     27.000000 MHz
  Audio Data Block:
    Linear PCM:
      Max channels: 2
      Supported sample rates (kHz): 48 44.1 32
      Supported sample sizes (bits): 24 20 16
    AC-3:
      Max channels: 6
      Supported sample rates (kHz): 48 44.1 32
      Maximum bit rate: 640 kb/s
    DTS:
      Max channels: 6
      Supported sample rates (kHz): 48 44.1 32
      Maximum bit rate: 1536 kb/s
  Speaker Allocation Data Block:
    FL/FR - Front Left/Right
  Vendor-Specific Data Block (HDMI), OUI 00-0C-03:
    Source physical address: 1.1.0.0
    Supports_AI
    Maximum TMDS clock: 150 MHz
  Colorimetry Data Block:
    xvYCC601
    xvYCC709
    Gamut Boundary Description Metadata Profile P0
  Detailed Timing Descriptors:
    DTD 3:  1280x720    60.000000 Hz  16:9     45.000 kHz     74.250000 MHz (16 mm x 9 mm)
                 Hfront  110 Hsync  40 Hback  220 Hpol P
                 Vfront    5 Vsync   5 Vback   20 Vpol P
    DTD 4:   640x480    59.952381 Hz   4:3     31.475 kHz     25.180000 MHz (4 mm x 3 mm)
                 Hfront   16 Hsync  96 Hback   48 Hpol N
                 Vfront   10 Vsync   2 Vback   33 Vpol N
    DTD 5:   720x480    59.940060 Hz   3:2     31.469 kHz     27.000000 MHz (16 mm x 9 mm)
                 Hfront   16 Hsync  62 Hback   60 Hpol N
                 Vfront    9 Vsync   6 Vback   30 Vpol N
Checksum: 0xdf  Unused space in Extension Block: 24 bytes

----------------

Warnings:

Block 0, Base EDID:
  Vendor & Product Identification: The serial number is one of the known dummy values, it should probably be set to 0.
  Detailed Timing Descriptor #1: Dubious image size (16x9 mm is smaller than 100x100 mm).
  Detailed Timing Descriptor #2: Dubious image size (4x3 mm is smaller than 100x100 mm).
Block 1, CTA-861 Extension Block:
  IT Video Formats are overscanned by default, but normally this should be underscanned.
  Video Data Block: VIC 2 and the first DTD are not identical. Is this intended?
  Detailed Timing Descriptor #3: Dubious image size (16x9 mm is smaller than 100x100 mm).
  Detailed Timing Descriptor #4: Dubious image size (4x3 mm is smaller than 100x100 mm).
  Detailed Timing Descriptor #5: Dubious image size (16x9 mm is smaller than 100x100 mm).
EDID:
  Base EDID: Some timings are out of range of the Monitor Ranges:
    Vertical Freq: 50.000 - 60.000 Hz (Monitor: 59.000 - 61.000 Hz)
    Horizontal Freq: 15.625 - 67.500 kHz (Monitor: 15.000 - 46.000 kHz)
    Maximum Clock: 148.500 MHz (Monitor: 80.000 MHz)

Failures:

Block 0, Base EDID:
  Basic Display Parameters & Features: The chromaticities match sRGB, but sRGB is not signaled.
Block 1, CTA-861 Extension Block:
  Missing VCDB, needed for Set Selectable RGB Quantization to avoid interop issues.
EDID:
  Extension Block 2 started with EDID header, ignoring Extension Blocks >= 2.
  Base EDID: The DTD max image size is 16x9mm, but the display size is not specified anywhere.
  CTA-861: Native progressive timings are a mix of several resolutions.

EDID conformity: FAIL
