edid-decode (hex):

00 ff ff ff ff ff ff 00 30 ae 00 20 01 01 01 01
01 16 01 03 80 29 17 78 ee fc 99 a2 57 53 a1 27
0c 4f 54 00 00 00 01 01 01 01 01 01 01 01 01 01
01 01 01 01 01 01 66 21 56 aa 51 00 1e 30 46 8f
33 00 9a e6 10 00 00 1e 00 00 00 fc 00 4c 65 6e
6f 76 6f 20 41 49 4f 20 50 43 00 00 00 fd 00 3b
3d 1e 30 09 00 0a 20 20 20 20 20 20 00 00 00 ff
00 30 30 30 30 30 31 0a 20 20 20 20 20 20 00 e4

----------------

Block 0, Base EDID:
  EDID Structure Version & Revision: 1.3
  Vendor & Product Identification:
    Manufacturer: LEN
    Model: 8192
    Serial Number: ...
    Made in: week 1 of 2012
  Basic Display Parameters & Features:
    Digital display
    Maximum image size: 41 cm x 23 cm
    Gamma: 2.20
    DPMS levels: Standby Suspend Off
    RGB color display
    Default (sRGB) color space is primary color space
    First detailed timing is the preferred timing
  Color Characteristics:
    Red  : 0.6357, 0.3427
    Green: 0.3271, 0.6289
    Blue : 0.1542, 0.0478
    White: 0.3105, 0.3291
  Established Timings I & II: none
  Standard Timings: none
  Detailed Timing Descriptors:
    DTD 1:  1366x768    59.789541 Hz 683:384   47.712 kHz     85.500000 MHz (410 mm x 230 mm)
                 Hfront   70 Hsync 143 Hback  213 Hpol P
                 Vfront    3 Vsync   3 Vback   24 Vpol P
    Display Product Name: 'Lenovo AIO PC'
    Display Range Limits:
      Monitor ranges (GTF): 59-61 Hz V, 30-48 kHz H, max dotclock 90 MHz
    Display Product Serial Number: ...
Checksum: 0xe4

----------------

Warnings:

Block 0, Base EDID:
  Vendor & Product Identification: The serial number is one of the known dummy values, it should probably be set to 0.
  Display Product Serial Number: ...

Failures:

Block 0, Base EDID:
  Basic Display Parameters & Features: sRGB is signaled, but the chromaticities do not match.

EDID conformity: FAIL
