edid-decode (hex):

00 ff ff ff ff ff ff 00 30 ae 00 20 01 00 00 00
01 17 01 04 a5 33 1d 78 e2 37 81 a5 56 51 9d 25
0e 50 54 00 00 00 d1 c0 81 c0 01 01 01 01 01 01
01 01 01 01 01 01 02 3a 80 18 71 38 2d 40 58 2c
45 00 fe 22 11 00 00 1e 01 1d 00 72 51 d0 1e 20
6e 28 55 00 fe 22 11 00 00 1e 00 00 00 fc 20 4c
65 6e 6f 76 6f 20 41 49 4f 20 50 43 00 00 00 fd
00 32 4b 36 53 12 00 0a 20 20 20 20 20 20 00 00

----------------

Block 0, Base EDID:
  EDID Structure Version & Revision: 1.4
  Vendor & Product Identification:
    Manufacturer: LEN
    Model: 8192
    Serial Number: ...
    Made in: week 1 of 2013
  Basic Display Parameters & Features:
    Digital display
    Bits per primary color channel: 8
    DisplayPort interface
    Maximum image size: 51 cm x 29 cm
    Gamma: 2.20
    DPMS levels: Standby Suspend Off
    Supported color formats: RGB 4:4:4
    First detailed timing includes the native pixel format and preferred refresh rate
  Color Characteristics:
    Red  : 0.6445, 0.3388
    Green: 0.3173, 0.6162
    Blue : 0.1464, 0.0546
    White: 0.3125, 0.3291
  Established Timings I & II: none
  Standard Timings:
    DMT 0x52:  1920x1080   60.000000 Hz  16:9     67.500 kHz    148.500000 MHz
    DMT 0x55:  1280x720    60.000000 Hz  16:9     45.000 kHz     74.250000 MHz
  Detailed Timing Descriptors:
    DTD 1:  1920x1080   60.000000 Hz  16:9     67.500 kHz    148.500000 MHz (510 mm x 290 mm)
                 Hfront   88 Hsync  44 Hback  148 Hpol P
                 Vfront    4 Vsync   5 Vback   36 Vpol P
    DTD 2:  1280x720    60.000000 Hz  16:9     45.000 kHz     74.250000 MHz (510 mm x 290 mm)
                 Hfront  110 Hsync  40 Hback  220 Hpol P
                 Vfront    5 Vsync   5 Vback   20 Vpol P
    Display Product Name: 'Lenovo AIO PC'
    Display Range Limits:
      Monitor ranges (GTF): 50-75 Hz V, 54-83 kHz H, max dotclock 180 MHz
Checksum: 0x00

----------------

Warnings:

Block 0, Base EDID:
  Vendor & Product Identification: The serial number is one of the known dummy values, it should probably be set to 0.
  Display Range Limits: GTF support is deprecated in EDID 1.4.
EDID:
  Base EDID: Some timings are out of range of the Monitor Ranges:
    Horizontal Freq: 45.000 - 67.500 kHz (Monitor: 54.000 - 83.000 kHz)

Failures:

Block 0, Base EDID:
  Display Descriptor #3: Monitor descriptor block has byte 4 nonzero (0x20).
  Display Range Limits: GTF is supported, but the display does not support continuous frequencies.

EDID conformity: FAIL
