edid-decode (hex):

00 ff ff ff ff ff ff 00 06 af a4 bc 00 00 00 00
01 20 01 04 a5 1e 13 78 03 f3 f5 a7 54 48 9c 24
0e 50 54 00 00 00 01 01 01 01 01 01 01 01 01 01
01 01 01 01 01 01 46 3c 80 a0 70 b0 24 40 2c 20
35 00 2d bc 10 00 00 1a 38 30 80 a0 70 b0 24 40
2c 20 35 00 2d bc 10 00 00 1a 00 00 00 fe 00 4a
34 33 46 38 80 42 31 34 30 55 41 4e 00 00 00 00
00 02 41 01 9e 01 11 00 00 0a 41 0a 20 20 00 82

00 ff ff ff ff ff ff 00 06 af a4 bc 00 00 00 00
01 20 01 04 a5 1e 13 78 03 f3 f5 a7 54 48 9c 24
0e 50 54 00 00 00 01 01 01 01 01 01 01 01 01 01
01 01 01 01 01 01 46 3c 80 a0 70 b0 24 40 2c 20
35 00 2d bc 10 00 00 1a 38 30 80 a0 70 b0 24 40
2c 20 35 00 2d bc 10 00 00 1a 00 00 00 fe 00 4a
34 33 46 38 80 42 31 34 30 55 41 4e 00 00 00 00
00 02 41 01 9e 01 11 00 00 0a 41 0a 20 20 00 82

----------------

Block 0, Base EDID:
  EDID Structure Version & Revision: 1.4
  Vendor & Product Identification:
    Manufacturer: AUO
    Model: 48292
    Made in: week 1 of 2022
  Basic Display Parameters & Features:
    Digital display
    Bits per primary color channel: 8
    DisplayPort interface
    Maximum image size: 30 cm x 19 cm
    Gamma: 2.20
    Supported color formats: RGB 4:4:4
    First detailed timing includes the native pixel format and preferred refresh rate
    Display supports continuous frequencies
  Color Characteristics:
    Red  : 0.6552, 0.3310
    Green: 0.2812, 0.6123
    Blue : 0.1435, 0.0576
    White: 0.3134, 0.3291
  Established Timings I & II: none
  Standard Timings: none
  Detailed Timing Descriptors:
    DTD 1:  1920x1200   60.018359 Hz  16:10    74.183 kHz    154.300000 MHz (301 mm x 188 mm)
                 Hfront   44 Hsync  32 Hback   84 Hpol P
                 Vfront    3 Vsync   5 Vback   28 Vpol N
    DTD 2:  1920x1200   48.014688 Hz  16:10    59.346 kHz    123.440000 MHz (301 mm x 188 mm)
                 Hfront   44 Hsync  32 Hback   84 Hpol P
                 Vfront    3 Vsync   5 Vback   28 Vpol N
    Alphanumeric Data String: 'J43F8.B140UAN'
    Manufacturer-Specified Display Descriptor (0x00): 00 00 00 02 41 01 9e 01 11 00 00 0a 41 0a 20 20 '....A.......A.  '
Checksum: 0x82

----------------

Block 1, Unknown EDID Extension Block 0x00:
  00 ff ff ff ff ff ff 00 06 af a4 bc 00 00 00 00 '................'
  01 20 01 04 a5 1e 13 78 03 f3 f5 a7 54 48 9c 24 '. .....x....TH.$'
  0e 50 54 00 00 00 01 01 01 01 01 01 01 01 01 01 '.PT.............'
  01 01 01 01 01 01 46 3c 80 a0 70 b0 24 40 2c 20 '......F<..p.$@, '
  35 00 2d bc 10 00 00 1a 38 30 80 a0 70 b0 24 40 '5.-.....80..p.$@'
  2c 20 35 00 2d bc 10 00 00 1a 00 00 00 fe 00 4a ', 5.-..........J'
  34 33 46 38 80 42 31 34 30 55 41 4e 00 00 00 00 '43F8.B140UAN....'
  00 02 41 01 9e 01 11 00 00 0a 41 0a 20 20 00 82 '..A.......A.  ..'
Checksum: 0x82

----------------

Warnings:

Block 0, Base EDID:
  Alphanumeric Data String: Non-ASCII character 0x80 at position 5, can cause problems.
  Missing Display Product Name.

Failures:

Block 0, Base EDID:
  Missing Display Range Limits Descriptor.
Block 1, Base EDID:
  Unknown Extension Block.
EDID:
  Base EDID: EDID specified 0 extension block(s), but found 1 extension block(s).

EDID conformity: FAIL
