edid-decode (hex):

00 ff ff ff ff ff ff 00 04 72 28 05 e4 7f 60 74
2e 1b 01 04 a5 52 23 78 3e 04 31 a7 56 4e 9e 26
11 50 54 bf ef 80 71 4f 81 40 81 80 81 c0 81 00
95 00 b3 00 d1 c0 cd 46 00 a0 a0 38 1f 40 30 20
3a 00 34 5a 31 00 00 1a 00 00 00 fd 00 38 4c 1f
53 1e 00 0a 20 20 20 20 20 20 00 00 00 fc 00 43
42 33 35 31 43 0a 20 20 20 20 20 20 00 00 00 ff
00 54 36 44 41 41 30 30 31 38 35 30 31 0a 01 c2

02 03 18 f1 4b 01 02 03 04 05 90 11 12 13 14 1f
23 09 07 07 83 01 00 00 d8 59 00 60 a3 38 28 40
a0 10 3a 10 34 5a 31 00 00 1a 00 00 00 00 00 00
00 00 00 00 00 00 00 00 00 00 00 00 00 00 00 00
00 00 00 00 00 00 00 00 00 00 00 00 00 00 00 00
00 00 00 00 00 00 00 00 00 00 00 00 00 00 00 00
00 00 00 00 00 00 00 00 00 00 00 00 00 00 00 00
00 00 00 00 00 00 00 00 00 00 00 00 00 00 00 3a

00 ff ff ff ff ff ff 00 04 72 28 05 e4 7f 60 74
2e 1b 01 04 a5 52 23 78 3e 04 31 a7 56 4e 9e 26
11 50 54 bf ef 80 71 4f 81 40 81 80 81 c0 81 00
95 00 b3 00 d1 c0 cd 46 00 a0 a0 38 1f 40 30 20
3a 00 34 5a 31 00 00 1a 00 00 00 fd 00 38 4c 1f
53 1e 00 0a 20 20 20 20 20 20 00 00 00 fc 00 43
42 33 35 31 43 0a 20 20 20 20 20 20 00 00 00 ff
00 54 36 44 41 41 30 30 31 38 35 30 31 0a 01 c2

02 03 18 f1 4b 01 02 03 04 05 90 11 12 13 14 1f
23 09 07 07 83 01 00 00 d8 59 00 60 a3 38 28 40
a0 10 3a 10 34 5a 31 00 00 1a 00 00 00 00 00 00
00 00 00 00 00 00 00 00 00 00 00 00 00 00 00 00
00 00 00 00 00 00 00 00 00 00 00 00 00 00 00 00
00 00 00 00 00 00 00 00 00 00 00 00 00 00 00 00
00 00 00 00 00 00 00 00 00 00 00 00 00 00 00 00
00 00 00 00 00 00 00 00 00 00 00 00 00 00 00 3a

----------------

Block 0, Base EDID:
  EDID Structure Version & Revision: 1.4
  Vendor & Product Identification:
    Manufacturer: ACR
    Model: 1320
    Serial Number: ...
    Made in: week 46 of 2017
  Basic Display Parameters & Features:
    Digital display
    Bits per primary color channel: 8
    DisplayPort interface
    Maximum image size: 82 cm x 35 cm
    Gamma: 2.20
    DPMS levels: Off
    Supported color formats: RGB 4:4:4, YCrCb 4:4:4, YCrCb 4:2:2
    Default (sRGB) color space is primary color space
    First detailed timing includes the native pixel format and preferred refresh rate
  Color Characteristics:
    Red  : 0.6523, 0.3359
    Green: 0.3056, 0.6171
    Blue : 0.1484, 0.0693
    White: 0.3125, 0.3291
  Established Timings I & II:
    IBM     :   720x400    70.081663 Hz   9:5     31.467 kHz     28.320000 MHz
    DMT 0x04:   640x480    59.940476 Hz   4:3     31.469 kHz     25.175000 MHz
    Apple   :   640x480    66.666667 Hz   4:3     35.000 kHz     30.240000 MHz
    DMT 0x05:   640x480    72.808802 Hz   4:3     37.861 kHz     31.500000 MHz
    DMT 0x06:   640x480    75.000000 Hz   4:3     37.500 kHz     31.500000 MHz
    DMT 0x08:   800x600    56.250000 Hz   4:3     35.156 kHz     36.000000 MHz
    DMT 0x09:   800x600    60.316541 Hz   4:3     37.879 kHz     40.000000 MHz
    DMT 0x0a:   800x600    72.187572 Hz   4:3     48.077 kHz     50.000000 MHz
    DMT 0x0b:   800x600    75.000000 Hz   4:3     46.875 kHz     49.500000 MHz
    Apple   :   832x624    74.551266 Hz   4:3     49.726 kHz     57.284000 MHz
    DMT 0x10:  1024x768    60.003840 Hz   4:3     48.363 kHz     65.000000 MHz
    DMT 0x11:  1024x768    70.069359 Hz   4:3     56.476 kHz     75.000000 MHz
    DMT 0x12:  1024x768    75.028582 Hz   4:3     60.023 kHz     78.750000 MHz
    DMT 0x24:  1280x1024   75.024675 Hz   5:4     79.976 kHz    135.000000 MHz
    Apple   :  1152x870    75.061550 Hz 192:145   68.681 kHz    100.000000 MHz
  Standard Timings:
    DMT 0x15:  1152x864    75.000000 Hz   4:3     67.500 kHz    108.000000 MHz
    DMT 0x20:  1280x960    60.000000 Hz   4:3     60.000 kHz    108.000000 MHz
    DMT 0x23:  1280x1024   60.019740 Hz   5:4     63.981 kHz    108.000000 MHz
    DMT 0x55:  1280x720    60.000000 Hz  16:9     45.000 kHz     74.250000 MHz
    DMT 0x1c:  1280x800    59.810326 Hz  16:10    49.702 kHz     83.500000 MHz
    DMT 0x2f:  1440x900    59.887445 Hz  16:10    55.935 kHz    106.500000 MHz
    DMT 0x3a:  1680x1050   59.954250 Hz  16:10    65.290 kHz    146.250000 MHz
    DMT 0x52:  1920x1080   60.000000 Hz  16:9     67.500 kHz    148.500000 MHz
  Detailed Timing Descriptors:
    DTD 1:  2560x1080   59.978424 Hz  64:27    66.636 kHz    181.250000 MHz (820 mm x 346 mm)
                 Hfront   48 Hsync  32 Hback   80 Hpol P
                 Vfront    3 Vsync  10 Vback   18 Vpol N
    Display Range Limits:
      Monitor ranges (GTF): 56-76 Hz V, 31-83 kHz H, max dotclock 300 MHz
    Display Product Name: 'CB351C'
    Display Product Serial Number: ...
  Extension blocks: 1
Checksum: 0xc2

----------------

Block 1, CTA-861 Extension Block:
  Revision: 3
  Underscans IT Video Formats by default
  Basic audio support
  Supports YCbCr 4:4:4
  Supports YCbCr 4:2:2
  Native detailed modes: 1
  Video Data Block:
    VIC   1:   640x480    59.940476 Hz   4:3     31.469 kHz     25.175000 MHz
    VIC   2:   720x480    59.940060 Hz   4:3     31.469 kHz     27.000000 MHz
    VIC   3:   720x480    59.940060 Hz  16:9     31.469 kHz     27.000000 MHz
    VIC   4:  1280x720    60.000000 Hz  16:9     45.000 kHz     74.250000 MHz
    VIC   5:  1920x1080i  60.000000 Hz  16:9     33.750 kHz     74.250000 MHz
    VIC  16:  1920x1080   60.000000 Hz  16:9     67.500 kHz    148.500000 MHz (native)
    VIC  17:   720x576    50.000000 Hz   4:3     31.250 kHz     27.000000 MHz
    VIC  18:   720x576    50.000000 Hz  16:9     31.250 kHz     27.000000 MHz
    VIC  19:  1280x720    50.000000 Hz  16:9     37.500 kHz     74.250000 MHz
    VIC  20:  1920x1080i  50.000000 Hz  16:9     28.125 kHz     74.250000 MHz
    VIC  31:  1920x1080   50.000000 Hz  16:9     56.250 kHz    148.500000 MHz
  Audio Data Block:
    Linear PCM:
      Max channels: 2
      Supported sample rates (kHz): 48 44.1 32
      Supported sample sizes (bits): 24 20 16
  Speaker Allocation Data Block:
    FL/FR - Front Left/Right
  Detailed Timing Descriptors:
    DTD 2:  2560x1080   59.975801 Hz  64:27    67.173 kHz    230.000000 MHz (820 mm x 346 mm)
                 Hfront  160 Hsync 272 Hback  432 Hpol P
                 Vfront    3 Vsync  10 Vback   27 Vpol N
Checksum: 0x3a  Unused space in Extension Block: 85 bytes

----------------

Block 2, Unknown EDID Extension Block 0x00:
  00 ff ff ff ff ff ff 00 04 72 28 05 e4 7f 60 74 '.........r(...`t'
  2e 1b 01 04 a5 52 23 78 3e 04 31 a7 56 4e 9e 26 '.....R#x>.1.VN.&'
  11 50 54 bf ef 80 71 4f 81 40 81 80 81 c0 81 00 '.PT...qO.@......'
  95 00 b3 00 d1 c0 cd 46 00 a0 a0 38 1f 40 30 20 '.......F...8.@0 '
  3a 00 34 5a 31 00 00 1a 00 00 00 fd 00 38 4c 1f ':.4Z1........8L.'
  53 1e 00 0a 20 20 20 20 20 20 00 00 00 fc 00 43 'S...      .....C'
  42 33 35 31 43 0a 20 20 20 20 20 20 00 00 00 ff 'B351C.      ....'
  00 54 36 44 41 41 30 30 31 38 35 30 31 0a 01 c2 '.T6DAA0018501...'
Checksum: 0xc2

----------------

Block 3, CTA-861 Extension Block:
  Revision: 3
  Underscans IT Video Formats by default
  Basic audio support
  Supports YCbCr 4:4:4
  Supports YCbCr 4:2:2
  Native detailed modes: 1
  Video Data Block:
    VIC   1:   640x480    59.940476 Hz   4:3     31.469 kHz     25.175000 MHz
    VIC   2:   720x480    59.940060 Hz   4:3     31.469 kHz     27.000000 MHz
    VIC   3:   720x480    59.940060 Hz  16:9     31.469 kHz     27.000000 MHz
    VIC   4:  1280x720    60.000000 Hz  16:9     45.000 kHz     74.250000 MHz
    VIC   5:  1920x1080i  60.000000 Hz  16:9     33.750 kHz     74.250000 MHz
    VIC  16:  1920x1080   60.000000 Hz  16:9     67.500 kHz    148.500000 MHz (native)
    VIC  17:   720x576    50.000000 Hz   4:3     31.250 kHz     27.000000 MHz
    VIC  18:   720x576    50.000000 Hz  16:9     31.250 kHz     27.000000 MHz
    VIC  19:  1280x720    50.000000 Hz  16:9     37.500 kHz     74.250000 MHz
    VIC  20:  1920x1080i  50.000000 Hz  16:9     28.125 kHz     74.250000 MHz
    VIC  31:  1920x1080   50.000000 Hz  16:9     56.250 kHz    148.500000 MHz
  Audio Data Block:
    Linear PCM:
      Max channels: 2
      Supported sample rates (kHz): 48 44.1 32
      Supported sample sizes (bits): 24 20 16
  Speaker Allocation Data Block:
    FL/FR - Front Left/Right
  Detailed Timing Descriptors:
    DTD 3:  2560x1080   59.975801 Hz  64:27    67.173 kHz    230.000000 MHz (820 mm x 346 mm)
                 Hfront  160 Hsync 272 Hback  432 Hpol P
                 Vfront    3 Vsync  10 Vback   27 Vpol N
Checksum: 0x3a  Unused space in Extension Block: 85 bytes

----------------

Warnings:

Block 0, Base EDID:
  Display Range Limits: GTF support is deprecated in EDID 1.4.
Block 1, CTA-861 Extension Block:
  Video Data Block: VIC 1 and the first DTD are not identical. Is this intended?
  Video Data Block: All VICs are in ascending order, and the first (preferred) VIC <= 4, is that intended?
  Display Product Serial Number is set, so the Serial Number in the Base EDID should be 0.
Block 3, CTA-861 Extension Block:
  Video Data Block: All VICs are in ascending order, and the first (preferred) VIC <= 4, is that intended?
EDID:
  Base EDID: Some timings are out of range of the Monitor Ranges:
    Vertical Freq: 50.000 - 75.062 Hz (Monitor: 56.000 - 76.000 Hz)
    Horizontal Freq: 28.125 - 79.976 kHz (Monitor: 31.000 - 83.000 kHz)

Failures:

Block 0, Base EDID:
  Basic Display Parameters & Features: sRGB is signaled, but the chromaticities do not match.
  Display Range Limits: GTF is supported, but the display does not support continuous frequencies.
Block 1, CTA-861 Extension Block:
  Missing VCDB, needed for Set Selectable RGB Quantization to avoid interop issues.
Block 2, Base EDID:
  Unknown Extension Block.
Block 3, CTA-861 Extension Block:
  Video Data Block: Duplicate VIC 1.
  Video Data Block: Duplicate VIC 2.
  Video Data Block: Duplicate VIC 3.
  Video Data Block: Duplicate VIC 4.
  Video Data Block: Duplicate VIC 5.
  Video Data Block: Duplicate VIC 16.
  Video Data Block: Duplicate VIC 17.
  Video Data Block: Duplicate VIC 18.
  Video Data Block: Duplicate VIC 19.
  Video Data Block: Duplicate VIC 20.
  Video Data Block: Duplicate VIC 31.
  Speaker Allocation Data Block: Only one instance of this Data Block is allowed.
EDID:
  Base EDID: EDID specified 1 extension block(s), but found 3 extension block(s).
  CTA-861: Native progressive timings are a mix of several resolutions.

EDID conformity: FAIL
