edid-decode (hex):

00 ff ff ff ff ff ff 00 61 a9 46 34 00 00 00 00
0d 1f 01 04 b5 50 21 78 3b 64 f5 ad 50 49 a3 22
13 50 54 ad cf 00 71 4f 81 c0 81 40 81 80 95 00
a9 c0 b3 00 d1 c0 22 68 70 a0 d0 a0 29 50 30 20
35 00 1d 4e 31 00 00 1a 20 fd 70 a0 d0 a0 3c 50
30 20 35 00 1d 4e 31 00 00 1e 00 00 00 fd 00 30
90 a0 a0 3c 01 0a 20 20 20 20 20 20 00 00 00 fc
00 4d 69 20 4d 6f 6e 69 74 6f 72 0a 20 20 02 ac

02 03 26 f4 4c 01 02 03 04 05 90 11 12 13 14 1f
3f 23 09 07 07 83 01 00 00 6d 1a 00 00 02 01 30
90 00 00 00 00 00 00 ac 00 a0 a0 38 2d 40 30 20
35 00 1d 4e 31 00 00 1e f0 d2 70 a0 d0 a0 3c 50
30 20 35 00 1d 4e 31 00 00 1e a3 48 b8 68 61 a0
32 50 30 40 35 00 1d 4e 31 00 00 1e f5 7c 70 a0
d0 a0 29 50 30 20 35 00 1d 4e 31 00 00 1e 00 00
00 00 00 00 00 00 00 00 00 00 00 00 00 00 00 d3

00 ff ff ff ff ff ff 00 61 a9 46 34 00 00 00 00
0d 1f 01 04 b5 50 21 78 3b 64 f5 ad 50 49 a3 22
13 50 54 ad cf 00 71 4f 81 c0 81 40 81 80 95 00
a9 c0 b3 00 d1 c0 22 68 70 a0 d0 a0 29 50 30 20
35 00 1d 4e 31 00 00 1a 20 fd 70 a0 d0 a0 3c 50
30 20 35 00 1d 4e 31 00 00 1e 00 00 00 fd 00 30
90 a0 a0 3c 01 0a 20 20 20 20 20 20 00 00 00 fc
00 4d 69 20 4d 6f 6e 69 74 6f 72 0a 20 20 02 ac

00 ff ff ff ff ff ff 00 61 a9 46 34 00 00 00 00
0d 1f 01 04 b5 50 21 78 3b 64 f5 ad 50 49 a3 22
13 50 54 ad cf 00 71 4f 81 c0 81 40 81 80 95 00
a9 c0 b3 00 d1 c0 22 68 70 a0 d0 a0 29 50 30 20
35 00 1d 4e 31 00 00 1a 20 fd 70 a0 d0 a0 3c 50
30 20 35 00 1d 4e 31 00 00 1e 00 00 00 fd 00 30
90 a0 a0 3c 01 0a 20 20 20 20 20 20 00 00 00 fc
00 4d 69 20 4d 6f 6e 69 74 6f 72 0a 20 20 02 ac

02 03 26 f4 4c 01 02 03 04 05 90 11 12 13 14 1f
3f 23 09 07 07 83 01 00 00 6d 1a 00 00 02 01 30
90 00 00 00 00 00 00 ac 00 a0 a0 38 2d 40 30 20
35 00 1d 4e 31 00 00 1e f0 d2 70 a0 d0 a0 3c 50
30 20 35 00 1d 4e 31 00 00 1e a3 48 b8 68 61 a0
32 50 30 40 35 00 1d 4e 31 00 00 1e f5 7c 70 a0
d0 a0 29 50 30 20 35 00 1d 4e 31 00 00 1e 00 00
00 00 00 00 00 00 00 00 00 00 00 00 00 00 00 d3

00 ff ff ff ff ff ff 00 61 a9 46 34 00 00 00 00
0d 1f 01 04 b5 50 21 78 3b 64 f5 ad 50 49 a3 22
13 50 54 ad cf 00 71 4f 81 c0 81 40 81 80 95 00
a9 c0 b3 00 d1 c0 22 68 70 a0 d0 a0 29 50 30 20
35 00 1d 4e 31 00 00 1a 20 fd 70 a0 d0 a0 3c 50
30 20 35 00 1d 4e 31 00 00 1e 00 00 00 fd 00 30
90 a0 a0 3c 01 0a 20 20 20 20 20 20 00 00 00 fc
00 4d 69 20 4d 6f 6e 69 74 6f 72 0a 20 20 02 ac

----------------

Block 0, Base EDID:
  EDID Structure Version & Revision: 1.4
  Vendor & Product Identification:
    Manufacturer: XMI
    Model: 13382
    Made in: week 13 of 2021
  Basic Display Parameters & Features:
    Digital display
    Bits per primary color channel: 10
    DisplayPort interface
    Maximum image size: 80 cm x 33 cm
    Gamma: 2.20
    DPMS levels: Off
    Supported color formats: RGB 4:4:4, YCrCb 4:4:4, YCrCb 4:2:2
    First detailed timing includes the native pixel format and preferred refresh rate
    Display supports continuous frequencies
  Color Characteristics:
    Red  : 0.6767, 0.3144
    Green: 0.2861, 0.6367
    Blue : 0.1357, 0.0771
    White: 0.3134, 0.3291
  Established Timings I & II:
    IBM     :   720x400    70.081663 Hz   9:5     31.467 kHz     28.320000 MHz
    DMT 0x04:   640x480    59.940476 Hz   4:3     31.469 kHz     25.175000 MHz
    DMT 0x05:   640x480    72.808802 Hz   4:3     37.861 kHz     31.500000 MHz
    DMT 0x06:   640x480    75.000000 Hz   4:3     37.500 kHz     31.500000 MHz
    DMT 0x09:   800x600    60.316541 Hz   4:3     37.879 kHz     40.000000 MHz
    DMT 0x0a:   800x600    72.187572 Hz   4:3     48.077 kHz     50.000000 MHz
    DMT 0x0b:   800x600    75.000000 Hz   4:3     46.875 kHz     49.500000 MHz
    DMT 0x10:  1024x768    60.003840 Hz   4:3     48.363 kHz     65.000000 MHz
    DMT 0x11:  1024x768    70.069359 Hz   4:3     56.476 kHz     75.000000 MHz
    DMT 0x12:  1024x768    75.028582 Hz   4:3     60.023 kHz     78.750000 MHz
    DMT 0x24:  1280x1024   75.024675 Hz   5:4     79.976 kHz    135.000000 MHz
  Standard Timings:
    DMT 0x15:  1152x864    75.000000 Hz   4:3     67.500 kHz    108.000000 MHz
    DMT 0x55:  1280x720    60.000000 Hz  16:9     45.000 kHz     74.250000 MHz
    DMT 0x20:  1280x960    60.000000 Hz   4:3     60.000 kHz    108.000000 MHz
    DMT 0x23:  1280x1024   60.019740 Hz   5:4     63.981 kHz    108.000000 MHz
    DMT 0x2f:  1440x900    59.887445 Hz  16:10    55.935 kHz    106.500000 MHz
    DMT 0x53:  1600x900    60.000000 Hz  16:9     60.000 kHz    108.000000 MHz (RB)
    DMT 0x3a:  1680x1050   59.954250 Hz  16:10    65.290 kHz    146.250000 MHz
    DMT 0x52:  1920x1080   60.000000 Hz  16:9     67.500 kHz    148.500000 MHz
  Detailed Timing Descriptors:
    DTD 1:  3440x1440   50.000000 Hz  43:18    74.050 kHz    266.580000 MHz (797 mm x 334 mm)
                 Hfront   48 Hsync  32 Hback   80 Hpol P
                 Vfront    3 Vsync   5 Vback   33 Vpol N
    DTD 2:  3440x1440  120.000000 Hz  43:18   180.000 kHz    648.000000 MHz (797 mm x 334 mm)
                 Hfront   48 Hsync  32 Hback   80 Hpol P
                 Vfront    3 Vsync   5 Vback   52 Vpol P
    Display Range Limits:
      Monitor ranges (Range Limits Only): 48-144 Hz V, 160-160 kHz H, max dotclock 600 MHz
    Display Product Name: 'Mi Monitor'
  Extension blocks: 2
Checksum: 0xac

----------------

Block 1, CTA-861 Extension Block:
  Revision: 3
  Underscans IT Video Formats by default
  Basic audio support
  Supports YCbCr 4:4:4
  Supports YCbCr 4:2:2
  Native DTDs: 4
  Video Data Block:
    VIC   1:   640x480    59.940476 Hz   4:3     31.469 kHz     25.175000 MHz
    VIC   2:   720x480    59.940060 Hz   4:3     31.469 kHz     27.000000 MHz
    VIC   3:   720x480    59.940060 Hz  16:9     31.469 kHz     27.000000 MHz
    VIC   4:  1280x720    60.000000 Hz  16:9     45.000 kHz     74.250000 MHz
    VIC   5:  1920x1080i  60.000000 Hz  16:9     33.750 kHz     74.250000 MHz
    VIC  16:  1920x1080   60.000000 Hz  16:9     67.500 kHz    148.500000 MHz (native)
    VIC  17:   720x576    50.000000 Hz   4:3     31.250 kHz     27.000000 MHz
    VIC  18:   720x576    50.000000 Hz  16:9     31.250 kHz     27.000000 MHz
    VIC  19:  1280x720    50.000000 Hz  16:9     37.500 kHz     74.250000 MHz
    VIC  20:  1920x1080i  50.000000 Hz  16:9     28.125 kHz     74.250000 MHz
    VIC  31:  1920x1080   50.000000 Hz  16:9     56.250 kHz    148.500000 MHz
    VIC  63:  1920x1080  120.000000 Hz  16:9    135.000 kHz    297.000000 MHz
  Audio Data Block:
    Linear PCM:
      Max channels: 2
      Supported sample rates (kHz): 48 44.1 32
      Supported sample sizes (bits): 24 20 16
  Speaker Allocation Data Block:
    FL/FR - Front Left/Right
  Vendor-Specific Data Block (AMD), OUI 00-00-1A:
    Version: 2
    Flags 1: 0x01
      FreeSync Supported
    Minimum Refresh Rate: 48 Hz
    Maximum Refresh Rate: 144 Hz
    Flags 5: 0x00
  Detailed Timing Descriptors:
    DTD 3:  2560x1080  143.895425 Hz  64:27   161.882 kHz    440.320000 MHz (797 mm x 334 mm)
                 Hfront   48 Hsync  32 Hback   80 Hpol P
                 Vfront    3 Vsync   5 Vback   37 Vpol P
    DTD 4:  3440x1440  100.000000 Hz  43:18   150.000 kHz    540.000000 MHz (797 mm x 334 mm)
                 Hfront   48 Hsync  32 Hback   80 Hpol P
                 Vfront    3 Vsync   5 Vback   52 Vpol P
    DTD 5:  1720x1440   59.999355 Hz  43:36    89.399 kHz    185.950000 MHz (797 mm x 334 mm)
                 Hfront   48 Hsync  64 Hback  248 Hpol P
                 Vfront    3 Vsync   5 Vback   42 Vpol P
    DTD 6:  3440x1440   59.998875 Hz  43:18    88.858 kHz    319.890000 MHz (797 mm x 334 mm)
                 Hfront   48 Hsync  32 Hback   80 Hpol P
                 Vfront    3 Vsync   5 Vback   33 Vpol P
Checksum: 0xd3  Unused space in Extension Block: 17 bytes

----------------

Warnings:

Block 1, CTA-861 Extension Block:
  Video Data Block: VIC 1 and the first DTD are not identical. Is this intended?
  Video Data Block: All VICs are in ascending order, and the first (preferred) VIC <= 4, is that intended?
  Detailed Timing Descriptor #5: Image size is 797x334 mm, but based on the picture AR it should be 398x334 mm.
  Add a Colorimetry Data Block with the sRGB colorimetry bit set to avoid interop issues.
EDID:
  Base EDID: Some timings are out of range of the Monitor Ranges:
    Horizontal Freq: 28.125 - 180.000 kHz (Monitor: 160.000 - 160.000 kHz)
    Maximum Clock: 648.000 MHz (Monitor: 600.000 MHz)

Failures:

Block 1, CTA-861 Extension Block:
  Offset is 38, but should be 39.
  Missing VCDB, needed for Set Selectable RGB Quantization to avoid interop issues.
EDID:
  Extension Block 2 started with EDID header, ignoring Extension Blocks >= 2.
  Base EDID: EDID specified 2 extension block(s), but found 1 extension block(s).
  CTA-861: Native progressive timings are a mix of several resolutions.

EDID conformity: FAIL
