edid-decode (hex):

00 ff ff ff ff ff ff 00 0d 12 11 75 70 03 00 00
05 18 01 04 a5 2b 1d 78 e2 84 96 ac 51 30 b4 25
10 50 53 00 00 00 01 00 01 00 01 00 01 00 01 00
01 00 01 00 01 00 68 42 80 18 71 38 2d 40 30 20
35 00 07 44 21 00 00 1a 00 00 00 f7 00 0a 00 00
00 00 00 00 00 00 00 00 00 00 00 00 00 fd 00 32
50 1e 53 11 00 0a 20 20 20 20 20 20 00 00 00 fc
00 43 48 37 35 31 31 42 0a 20 20 20 20 20 00 3a

00 ff ff ff ff ff ff 00 0d 12 11 75 70 03 00 00
05 18 01 04 a5 2b 1d 78 e2 84 96 ac 51 30 b4 25
10 50 53 00 00 00 01 00 01 00 01 00 01 00 01 00
01 00 01 00 01 00 68 42 80 18 71 38 2d 40 30 20
35 00 07 44 21 00 00 1a 00 00 00 f7 00 0a 00 00
00 00 00 00 00 00 00 00 00 00 00 00 00 fd 00 32
50 1e 53 11 00 0a 20 20 20 20 20 20 00 00 00 fc
00 43 48 37 35 31 31 42 0a 20 20 20 20 20 00 3a

----------------

Block 0, Base EDID:
  EDID Structure Version & Revision: 1.4
  Vendor & Product Identification:
    Manufacturer: CHR
    Model: 29969
    Serial Number: ...
    Made in: week 5 of 2014
  Basic Display Parameters & Features:
    Digital display
    Bits per primary color channel: 8
    DisplayPort interface
    Maximum image size: 43 cm x 29 cm
    Gamma: 2.20
    DPMS levels: Standby Suspend Off
    Supported color formats: RGB 4:4:4
    First detailed timing includes the native pixel format and preferred refresh rate
  Color Characteristics:
    Red  : 0.6738, 0.3164
    Green: 0.1884, 0.7031
    Blue : 0.1464, 0.0634
    White: 0.3134, 0.3261
  Established Timings I & II: none
  Standard Timings:
  Detailed Timing Descriptors:
    DTD 1:  1920x1080   68.686869 Hz  16:9     77.273 kHz    170.000000 MHz (519 mm x 324 mm)
                 Hfront   48 Hsync  32 Hback  200 Hpol P
                 Vfront    3 Vsync   5 Vback   37 Vpol N
    Established timings III:
    Display Range Limits:
      Monitor ranges (GTF): 50-80 Hz V, 30-83 kHz H, max dotclock 170 MHz
    Display Product Name: 'CH7511B'
Checksum: 0x3a

----------------

Block 1, Unknown EDID Extension Block 0x00:
  00 ff ff ff ff ff ff 00 0d 12 11 75 70 03 00 00 '...........up...'
  05 18 01 04 a5 2b 1d 78 e2 84 96 ac 51 30 b4 25 '.....+.x....Q0.%'
  10 50 53 00 00 00 01 00 01 00 01 00 01 00 01 00 '.PS.............'
  01 00 01 00 01 00 68 42 80 18 71 38 2d 40 30 20 '......hB..q8-@0 '
  35 00 07 44 21 00 00 1a 00 00 00 f7 00 0a 00 00 '5..D!...........'
  00 00 00 00 00 00 00 00 00 00 00 00 00 fd 00 32 '...............2'
  50 1e 53 11 00 0a 20 20 20 20 20 20 00 00 00 fc 'P.S...      ....'
  00 43 48 37 35 31 31 42 0a 20 20 20 20 20 00 3a '.CH7511B.     .:'
Checksum: 0x3a

----------------

Warnings:

Block 0, Base EDID:
  Detailed Timing Descriptor #1: Image size is 519x324 mm, but based on the picture AR it should be 519x291 mm.
  Display Range Limits: GTF support is deprecated in EDID 1.4.

Failures:

Block 0, Base EDID:
  Standard Timings: Use 0x0101 as the invalid Standard Timings code, not 0x0100.
  Standard Timings: Use 0x0101 as the invalid Standard Timings code, not 0x0100.
  Standard Timings: Use 0x0101 as the invalid Standard Timings code, not 0x0100.
  Standard Timings: Use 0x0101 as the invalid Standard Timings code, not 0x0100.
  Standard Timings: Use 0x0101 as the invalid Standard Timings code, not 0x0100.
  Standard Timings: Use 0x0101 as the invalid Standard Timings code, not 0x0100.
  Standard Timings: Use 0x0101 as the invalid Standard Timings code, not 0x0100.
  Standard Timings: Use 0x0101 as the invalid Standard Timings code, not 0x0100.
  Detailed Timing Descriptor #1: Mismatch of image size 519x324 mm vs display size 430x290 mm.
  Display Range Limits: GTF is supported, but the display does not support continuous frequencies.
Block 1, Base EDID:
  Unknown Extension Block.
EDID:
  Base EDID: The DTD max image size is 519x324mm, which is larger than the display size 430.0x290.0mm.
  Base EDID: EDID specified 0 extension block(s), but found 1 extension block(s).

EDID conformity: FAIL
