edid-decode (hex):

00 ff ff ff ff ff ff 00 0d 12 11 75 70 03 00 00
0e 1c 01 04 95 2b 1d 78 e2 80 42 ac 51 30 b4 25
10 50 53 00 00 00 01 01 01 01 01 01 01 01 01 01
01 01 01 01 01 01 f1 0e 20 e0 30 58 18 20 20 50
34 00 07 44 21 00 00 1c 00 00 00 00 00 00 00 00
00 00 00 00 00 00 00 00 00 00 00 00 00 fd 00 38
4c 1e 53 11 00 0a 20 20 20 20 20 20 00 00 00 fc
00 38 30 30 78 36 30 30 0a 20 20 20 20 20 00 f9

00 ff ff ff ff ff ff 00 0d 12 11 75 70 03 00 00
0e 1c 01 04 95 2b 1d 78 e2 80 42 ac 51 30 b4 25
10 50 53 00 00 00 01 01 01 01 01 01 01 01 01 01
01 01 01 01 01 01 f1 0e 20 e0 30 58 18 20 20 50
34 00 07 44 21 00 00 1c 00 00 00 00 00 00 00 00
00 00 00 00 00 00 00 00 00 00 00 00 00 fd 00 38
4c 1e 53 11 00 0a 20 20 20 20 20 20 00 00 00 fc
00 38 30 30 78 36 30 30 0a 20 20 20 20 20 00 f9

----------------

Block 0, Base EDID:
  EDID Structure Version & Revision: 1.4
  Vendor & Product Identification:
    Manufacturer: CHR
    Model: 29969
    Serial Number: ...
    Made in: week 14 of 2018
  Basic Display Parameters & Features:
    Digital display
    Bits per primary color channel: 6
    DisplayPort interface
    Maximum image size: 43 cm x 29 cm
    Gamma: 2.20
    DPMS levels: Standby Suspend Off
    Supported color formats: RGB 4:4:4
    First detailed timing includes the native pixel format and preferred refresh rate
  Color Characteristics:
    Red  : 0.6738, 0.3164
    Green: 0.1875, 0.7031
    Blue : 0.1455, 0.0625
    White: 0.3125, 0.3261
  Established Timings I & II: none
  Standard Timings: none
  Detailed Timing Descriptors:
    DTD 1:   800x600    59.861403 Hz   4:3     37.354 kHz     38.250000 MHz (519 mm x 324 mm)
                 Hfront   32 Hsync  80 Hback  112 Hpol N
                 Vfront    3 Vsync   4 Vback   17 Vpol P
    Empty Descriptor
    Display Range Limits:
      Monitor ranges (GTF): 56-76 Hz V, 30-83 kHz H, max dotclock 170 MHz
    Display Product Name: '800x600'
Checksum: 0xf9

----------------

Block 1, Unknown EDID Extension Block 0x00:
  00 ff ff ff ff ff ff 00 0d 12 11 75 70 03 00 00 '...........up...'
  0e 1c 01 04 95 2b 1d 78 e2 80 42 ac 51 30 b4 25 '.....+.x..B.Q0.%'
  10 50 53 00 00 00 01 01 01 01 01 01 01 01 01 01 '.PS.............'
  01 01 01 01 01 01 f1 0e 20 e0 30 58 18 20 20 50 '........ .0X.  P'
  34 00 07 44 21 00 00 1c 00 00 00 00 00 00 00 00 '4..D!...........'
  00 00 00 00 00 00 00 00 00 00 00 00 00 fd 00 38 '...............8'
  4c 1e 53 11 00 0a 20 20 20 20 20 20 00 00 00 fc 'L.S...      ....'
  00 38 30 30 78 36 30 30 0a 20 20 20 20 20 00 f9 '.800x600.     ..'
Checksum: 0xf9

----------------

Warnings:

Block 0, Base EDID:
  Detailed Timing Descriptor #1: Image size is 519x324 mm, but based on the picture AR it should be 519x389 mm.
  Display Range Limits: GTF support is deprecated in EDID 1.4.

Failures:

Block 0, Base EDID:
  Detailed Timing Descriptor #1: Mismatch of image size 519x324 mm vs display size 430x290 mm.
  Empty Descriptor: Use Dummy Descriptor instead of all zeroes.
  Display Range Limits: GTF is supported, but the display does not support continuous frequencies.
Block 1, Base EDID:
  Unknown Extension Block.
EDID:
  Base EDID: The DTD max image size is 519x324mm, which is larger than the display size 430.0x290.0mm.
  Base EDID: EDID specified 0 extension block(s), but found 1 extension block(s).

EDID conformity: FAIL
