edid-decode (hex):

00 ff ff ff ff ff ff 00 0d 12 11 75 01 04 00 00
05 17 01 04 a5 2b 1d 78 02 80 42 ac 51 30 b4 25
10 50 53 00 00 00 01 01 01 01 01 01 01 01 01 01
01 01 01 01 01 01 28 36 80 a0 70 38 1f 40 50 20
35 00 07 44 21 00 00 1a 22 2d 80 a0 70 38 1f 40
50 20 35 00 07 44 21 00 00 0a 00 00 00 fe 00 0a
20 20 20 20 20 20 20 20 20 20 20 20 00 00 00 fe
00 31 39 32 30 78 31 30 38 30 20 20 20 20 00 f5

00 ff ff ff ff ff ff 00 0d 12 11 75 01 04 00 00
05 17 01 04 a5 2b 1d 78 02 80 42 ac 51 30 b4 25
10 50 53 00 00 00 01 01 01 01 01 01 01 01 01 01
01 01 01 01 01 01 28 36 80 a0 70 38 1f 40 50 20
35 00 07 44 21 00 00 1a 22 2d 80 a0 70 38 1f 40
50 20 35 00 07 44 21 00 00 0a 00 00 00 fe 00 0a
20 20 20 20 20 20 20 20 20 20 20 20 00 00 00 fe
00 31 39 32 30 78 31 30 38 30 20 20 20 20 00 f5

----------------

Block 0, Base EDID:
  EDID Structure Version & Revision: 1.4
  Vendor & Product Identification:
    Manufacturer: CHR
    Model: 29969
    Serial Number: ...
    Made in: week 5 of 2013
  Basic Display Parameters & Features:
    Digital display
    Bits per primary color channel: 8
    DisplayPort interface
    Maximum image size: 43 cm x 29 cm
    Gamma: 2.20
    Supported color formats: RGB 4:4:4
    First detailed timing includes the native pixel format and preferred refresh rate
  Color Characteristics:
    Red  : 0.6738, 0.3164
    Green: 0.1875, 0.7031
    Blue : 0.1455, 0.0625
    White: 0.3125, 0.3261
  Established Timings I & II: none
  Standard Timings: none
  Detailed Timing Descriptors:
    DTD 1:  1920x1080   59.994461 Hz  16:9     66.654 kHz    138.640000 MHz (519 mm x 324 mm)
                 Hfront   80 Hsync  32 Hback   48 Hpol P
                 Vfront    3 Vsync   5 Vback   23 Vpol N
    DTD 2:  1920x1080   49.998269 Hz  16:9     55.548 kHz    115.540000 MHz (bipolar analog composite, 519 mm x 324 mm)
                 Hfront   80 Hsync  32 Hback   48 Hpol N
                 Vfront    3 Vsync   5 Vback   23 Vpol N
    Alphanumeric Data String: ''
    Alphanumeric Data String: '1920x1080    '
Checksum: 0xf5

----------------

Warnings:

Block 0, Base EDID:
  Detailed Timing Descriptor #1: Image size is 519x324 mm, but based on the picture AR it should be 519x291 mm.
  Detailed Timing Descriptor #2: Image size is 519x324 mm, but based on the picture AR it should be 519x291 mm.
  Missing Display Product Name.

Failures:

Block 0, Base EDID:
  Detailed Timing Descriptor #1: Mismatch of image size 519x324 mm vs display size 430x290 mm.
  Detailed Timing Descriptor #2: Mismatch of image size 519x324 mm vs display size 430x290 mm.
  Alphanumeric Data String: Empty string.
  Alphanumeric Data String: No newline, but one or more trailing spaces.
EDID:
  Extension Block 1 started with EDID header, ignoring Extension Blocks >= 1.
  Base EDID: The DTD max image size is 519x324mm, which is larger than the display size 430.0x290.0mm.

EDID conformity: FAIL
