edid-decode (hex):

00 ff ff ff ff ff ff 00 0d 12 11 75 70 03 00 00
23 20 01 04 a5 20 19 78 e2 e5 45 a5 56 52 9b 28
0a 50 54 00 00 00 01 40 01 00 01 00 01 00 01 00
01 00 01 00 01 00 64 19 00 40 41 00 26 30 18 88
36 00 30 e4 10 00 00 18 00 00 00 f7 00 0a 00 00
00 00 00 00 00 00 00 00 00 00 00 00 00 fd 00 32
50 1e 53 08 00 0a 20 20 20 20 20 20 00 00 00 fc
00 47 31 35 30 58 4e 45 0a 20 20 20 20 20 00 a7

00 ff ff ff ff ff ff 00 0d 12 11 75 70 03 00 00
23 20 01 04 a5 20 19 78 e2 e5 45 a5 56 52 9b 28
0a 50 54 00 00 00 01 40 01 00 01 00 01 00 01 00
01 00 01 00 01 00 64 19 00 40 41 00 26 30 18 88
36 00 30 e4 10 00 00 18 00 00 00 f7 00 0a 00 00
00 00 00 00 00 00 00 00 00 00 00 00 00 fd 00 32
50 1e 53 08 00 0a 20 20 20 20 20 20 00 00 00 fc
00 47 31 35 30 58 4e 45 0a 20 20 20 20 20 00 a7

----------------

Block 0, Base EDID:
  EDID Structure Version & Revision: 1.4
  Vendor & Product Identification:
    Manufacturer: CHR
    Model: 29969
    Serial Number: ...
    Made in: week 35 of 2022
  Basic Display Parameters & Features:
    Digital display
    Bits per primary color channel: 8
    DisplayPort interface
    Maximum image size: 32 cm x 25 cm
    Gamma: 2.20
    DPMS levels: Standby Suspend Off
    Supported color formats: RGB 4:4:4
    First detailed timing includes the native pixel format and preferred refresh rate
  Color Characteristics:
    Red  : 0.6474, 0.3378
    Green: 0.3212, 0.6064
    Blue : 0.1572, 0.0390
    White: 0.3134, 0.3291
  Established Timings I & II: none
  Standard Timings:
  Detailed Timing Descriptors:
    DTD 1:  1024x768    60.003840 Hz   4:3     48.363 kHz     65.000000 MHz (304 mm x 228 mm)
                 Hfront   24 Hsync 136 Hback  160 Hpol N
                 Vfront    3 Vsync   6 Vback   29 Vpol N
    Established timings III:
    Display Range Limits:
      Monitor ranges (GTF): 50-80 Hz V, 30-83 kHz H, max dotclock 80 MHz
    Display Product Name: 'G150XNE'
Checksum: 0xa7

----------------

Block 1, Unknown EDID Extension Block 0x00:
  00 ff ff ff ff ff ff 00 0d 12 11 75 70 03 00 00 '...........up...'
  23 20 01 04 a5 20 19 78 e2 e5 45 a5 56 52 9b 28 '# ... .x..E.VR.('
  0a 50 54 00 00 00 01 40 01 00 01 00 01 00 01 00 '.PT....@........'
  01 00 01 00 01 00 64 19 00 40 41 00 26 30 18 88 '......d..@A.&0..'
  36 00 30 e4 10 00 00 18 00 00 00 f7 00 0a 00 00 '6.0.............'
  00 00 00 00 00 00 00 00 00 00 00 00 00 fd 00 32 '...............2'
  50 1e 53 08 00 0a 20 20 20 20 20 20 00 00 00 fc 'P.S...      ....'
  00 47 31 35 30 58 4e 45 0a 20 20 20 20 20 00 a7 '.G150XNE.     ..'
Checksum: 0xa7

----------------

Warnings:

Block 0, Base EDID:
  Display Range Limits: GTF support is deprecated in EDID 1.4.

Failures:

Block 0, Base EDID:
  Standard Timings: Use 0x0101 as the invalid Standard Timings code, not 0x0140.
  Standard Timings: Use 0x0101 as the invalid Standard Timings code, not 0x0100.
  Standard Timings: Use 0x0101 as the invalid Standard Timings code, not 0x0100.
  Standard Timings: Use 0x0101 as the invalid Standard Timings code, not 0x0100.
  Standard Timings: Use 0x0101 as the invalid Standard Timings code, not 0x0100.
  Standard Timings: Use 0x0101 as the invalid Standard Timings code, not 0x0100.
  Standard Timings: Use 0x0101 as the invalid Standard Timings code, not 0x0100.
  Standard Timings: Use 0x0101 as the invalid Standard Timings code, not 0x0100.
  Detailed Timing Descriptor #1: Mismatch of image size 304x228 mm vs display size 320x250 mm.
  Display Range Limits: GTF is supported, but the display does not support continuous frequencies.
Block 1, Base EDID:
  Unknown Extension Block.
EDID:
  Base EDID: EDID specified 0 extension block(s), but found 1 extension block(s).

EDID conformity: FAIL
