edid-decode (hex):

00 ff ff ff ff ff ff 00 0d 12 11 75 70 03 00 00
05 18 01 04 a5 35 1d 78 e2 84 96 ac 51 30 b4 25
10 50 53 00 00 00 01 00 01 00 01 00 01 00 01 00
01 00 01 00 01 00 51 36 80 8c 70 38 2d 40 30 20
35 00 0f 28 21 00 00 1a 00 00 00 f7 00 0a 00 00
00 00 00 00 00 00 00 00 00 00 00 00 00 fd 00 32
50 1e 53 07 00 0a 20 20 20 20 20 20 00 00 00 fc
00 43 48 37 35 31 32 42 0a 20 20 20 20 20 00 fd

00 ff ff ff ff ff ff 00 0d 12 11 75 70 03 00 00
05 18 01 04 a5 35 1d 78 e2 84 96 ac 51 30 b4 25
10 50 53 00 00 00 01 00 01 00 01 00 01 00 01 00
01 00 01 00 01 00 51 36 80 8c 70 38 2d 40 30 20
35 00 0f 28 21 00 00 1a 00 00 00 f7 00 0a 00 00
00 00 00 00 00 00 00 00 00 00 00 00 00 fd 00 32
50 1e 53 07 00 0a 20 20 20 20 20 20 00 00 00 fc
00 43 48 37 35 31 32 42 0a 20 20 20 20 20 00 fd

----------------

Block 0, Base EDID:
  EDID Structure Version & Revision: 1.4
  Vendor & Product Identification:
    Manufacturer: CHR
    Model: 29969
    Serial Number: ...
    Made in: week 5 of 2014
  Basic Display Parameters & Features:
    Digital display
    Bits per primary color channel: 8
    DisplayPort interface
    Maximum image size: 53 cm x 29 cm
    Gamma: 2.20
    DPMS levels: Standby Suspend Off
    Supported color formats: RGB 4:4:4
    First detailed timing includes the native pixel format and preferred refresh rate
  Color Characteristics:
    Red  : 0.6738, 0.3164
    Green: 0.1884, 0.7031
    Blue : 0.1464, 0.0634
    White: 0.3134, 0.3261
  Established Timings I & II: none
  Standard Timings:
  Detailed Timing Descriptors:
    DTD 1:  1920x1080   60.000000 Hz  16:9     67.500 kHz    139.050000 MHz (527 mm x 296 mm)
                 Hfront   48 Hsync  32 Hback   60 Hpol P
                 Vfront    3 Vsync   5 Vback   37 Vpol N
    Established timings III:
    Display Range Limits:
      Monitor ranges (GTF): 50-80 Hz V, 30-83 kHz H, max dotclock 70 MHz
    Display Product Name: 'CH7512B'
Checksum: 0xfd

----------------

Block 1, Unknown EDID Extension Block 0x00:
  00 ff ff ff ff ff ff 00 0d 12 11 75 70 03 00 00 '...........up...'
  05 18 01 04 a5 35 1d 78 e2 84 96 ac 51 30 b4 25 '.....5.x....Q0.%'
  10 50 53 00 00 00 01 00 01 00 01 00 01 00 01 00 '.PS.............'
  01 00 01 00 01 00 51 36 80 8c 70 38 2d 40 30 20 '......Q6..p8-@0 '
  35 00 0f 28 21 00 00 1a 00 00 00 f7 00 0a 00 00 '5..(!...........'
  00 00 00 00 00 00 00 00 00 00 00 00 00 fd 00 32 '...............2'
  50 1e 53 07 00 0a 20 20 20 20 20 20 00 00 00 fc 'P.S...      ....'
  00 43 48 37 35 31 32 42 0a 20 20 20 20 20 00 fd '.CH7512B.     ..'
Checksum: 0xfd

----------------

Warnings:

Block 0, Base EDID:
  Display Range Limits: GTF support is deprecated in EDID 1.4.
EDID:
  Base EDID: Some timings are out of range of the Monitor Ranges:
    Maximum Clock: 139.050 MHz (Monitor: 70.000 MHz)

Failures:

Block 0, Base EDID:
  Standard Timings: Use 0x0101 as the invalid Standard Timings code, not 0x0100.
  Standard Timings: Use 0x0101 as the invalid Standard Timings code, not 0x0100.
  Standard Timings: Use 0x0101 as the invalid Standard Timings code, not 0x0100.
  Standard Timings: Use 0x0101 as the invalid Standard Timings code, not 0x0100.
  Standard Timings: Use 0x0101 as the invalid Standard Timings code, not 0x0100.
  Standard Timings: Use 0x0101 as the invalid Standard Timings code, not 0x0100.
  Standard Timings: Use 0x0101 as the invalid Standard Timings code, not 0x0100.
  Standard Timings: Use 0x0101 as the invalid Standard Timings code, not 0x0100.
  Display Range Limits: GTF is supported, but the display does not support continuous frequencies.
Block 1, Base EDID:
  Unknown Extension Block.
EDID:
  Base EDID: EDID specified 0 extension block(s), but found 1 extension block(s).

EDID conformity: FAIL
