edid-decode (hex):

00 ff ff ff ff ff ff 00 0d 12 11 75 70 03 00 00
05 18 01 04 a5 2b 1d 78 e2 80 42 ac 51 30 b4 25
10 50 53 00 00 00 01 01 01 01 01 01 01 01 01 01
01 01 01 01 01 01 c8 19 00 68 41 00 16 30 30 20
34 00 d3 9e 00 00 00 1e 00 00 00 00 00 00 00 00
00 00 00 00 00 00 00 00 00 00 00 00 00 fd 00 38
4c 1e 53 11 00 0a 20 20 20 20 20 20 00 00 00 fc
00 43 48 37 35 31 31 42 0a 20 20 20 20 20 00 09

00 ff ff ff ff ff ff 00 0d 12 11 75 70 03 00 00
05 18 01 04 a5 2b 1d 78 e2 80 42 ac 51 30 b4 25
10 50 53 00 00 00 01 01 01 01 01 01 01 01 01 01
01 01 01 01 01 01 c8 19 00 68 41 00 16 30 30 20
34 00 d3 9e 00 00 00 1e 00 00 00 00 00 00 00 00
00 00 00 00 00 00 00 00 00 00 00 00 00 fd 00 38
4c 1e 53 11 00 0a 20 20 20 20 20 20 00 00 00 fc
00 43 48 37 35 31 31 42 0a 20 20 20 20 20 00 09

----------------

Block 0, Base EDID:
  EDID Structure Version & Revision: 1.4
  Vendor & Product Identification:
    Manufacturer: CHR
    Model: 29969
    Serial Number: ...
    Made in: week 5 of 2014
  Basic Display Parameters & Features:
    Digital display
    Bits per primary color channel: 8
    DisplayPort interface
    Maximum image size: 43 cm x 29 cm
    Gamma: 2.20
    DPMS levels: Standby Suspend Off
    Supported color formats: RGB 4:4:4
    First detailed timing includes the native pixel format and preferred refresh rate
  Color Characteristics:
    Red  : 0.6738, 0.3164
    Green: 0.1875, 0.7031
    Blue : 0.1455, 0.0625
    White: 0.3125, 0.3261
  Established Timings I & II: none
  Standard Timings: none
  Detailed Timing Descriptors:
    DTD 1:  1024x768    60.364381 Hz   4:3     47.688 kHz     66.000000 MHz (211 mm x 158 mm)
                 Hfront   48 Hsync  32 Hback  280 Hpol P
                 Vfront    3 Vsync   4 Vback   15 Vpol P
    Empty Descriptor
    Display Range Limits:
      Monitor ranges (GTF): 56-76 Hz V, 30-83 kHz H, max dotclock 170 MHz
    Display Product Name: 'CH7511B'
Checksum: 0x09

----------------

Block 1, Unknown EDID Extension Block 0x00:
  00 ff ff ff ff ff ff 00 0d 12 11 75 70 03 00 00 '...........up...'
  05 18 01 04 a5 2b 1d 78 e2 80 42 ac 51 30 b4 25 '.....+.x..B.Q0.%'
  10 50 53 00 00 00 01 01 01 01 01 01 01 01 01 01 '.PS.............'
  01 01 01 01 01 01 c8 19 00 68 41 00 16 30 30 20 '.........hA..00 '
  34 00 d3 9e 00 00 00 1e 00 00 00 00 00 00 00 00 '4...............'
  00 00 00 00 00 00 00 00 00 00 00 00 00 fd 00 38 '...............8'
  4c 1e 53 11 00 0a 20 20 20 20 20 20 00 00 00 fc 'L.S...      ....'
  00 43 48 37 35 31 31 42 0a 20 20 20 20 20 00 09 '.CH7511B.     ..'
Checksum: 0x09

----------------

Warnings:

Block 0, Base EDID:
  Display Range Limits: GTF support is deprecated in EDID 1.4.

Failures:

Block 0, Base EDID:
  Detailed Timing Descriptor #1: Mismatch of image size 211x158 mm vs display size 430x290 mm.
  Empty Descriptor: Use Dummy Descriptor instead of all zeroes.
  Display Range Limits: GTF is supported, but the display does not support continuous frequencies.
Block 1, Base EDID:
  Unknown Extension Block.
EDID:
  Base EDID: EDID specified 0 extension block(s), but found 1 extension block(s).

EDID conformity: FAIL
