edid-decode (hex):

00 ff ff ff ff ff ff 00 0d 12 11 75 70 03 00 00
15 15 01 04 a5 00 00 78 e2 80 42 ac 51 30 b4 25
10 50 53 00 00 00 01 01 01 01 01 01 01 01 01 01
01 01 01 01 01 01 e0 15 00 a0 40 00 16 30 30 20
34 00 06 4d 21 00 00 1a 00 00 00 00 00 00 00 00
00 00 00 00 00 00 00 00 00 00 00 00 00 fd 00 38
4c 1e 53 11 00 0a 20 20 20 20 20 20 00 00 00 fc
00 43 48 37 35 31 31 42 0a 20 20 20 20 20 00 fa

00 ff ff ff ff ff ff 00 0d 12 11 75 70 03 00 00
15 15 01 04 a5 00 00 78 e2 80 42 ac 51 30 b4 25
10 50 53 00 00 00 01 01 01 01 01 01 01 01 01 01
01 01 01 01 01 01 e0 15 00 a0 40 00 16 30 30 20
34 00 06 4d 21 00 00 1a 00 00 00 00 00 00 00 00
00 00 00 00 00 00 00 00 00 00 00 00 00 fd 00 38
4c 1e 53 11 00 0a 20 20 20 20 20 20 00 00 00 fc
00 43 48 37 35 31 31 42 0a 20 20 20 20 20 00 fa

----------------

Block 0, Base EDID:
  EDID Structure Version & Revision: 1.4
  Vendor & Product Identification:
    Manufacturer: CHR
    Model: 29969
    Serial Number: ...
    Made in: week 21 of 2011
  Basic Display Parameters & Features:
    Digital display
    Bits per primary color channel: 8
    DisplayPort interface
    Image size is variable
    Gamma: 2.20
    DPMS levels: Standby Suspend Off
    Supported color formats: RGB 4:4:4
    First detailed timing includes the native pixel format and preferred refresh rate
  Color Characteristics:
    Red  : 0.6738, 0.3164
    Green: 0.1875, 0.7031
    Blue : 0.1455, 0.0625
    White: 0.3125, 0.3261
  Established Timings I & II: none
  Standard Timings: none
  Detailed Timing Descriptors:
    DTD 1:  1024x768    59.869997 Hz   4:3     47.297 kHz     56.000000 MHz (518 mm x 333 mm)
                 Hfront   48 Hsync  32 Hback   80 Hpol P
                 Vfront    3 Vsync   4 Vback   15 Vpol N
    Empty Descriptor
    Display Range Limits:
      Monitor ranges (GTF): 56-76 Hz V, 30-83 kHz H, max dotclock 170 MHz
    Display Product Name: 'CH7511B'
Checksum: 0xfa

----------------

Block 1, Unknown EDID Extension Block 0x00:
  00 ff ff ff ff ff ff 00 0d 12 11 75 70 03 00 00 '...........up...'
  15 15 01 04 a5 00 00 78 e2 80 42 ac 51 30 b4 25 '.......x..B.Q0.%'
  10 50 53 00 00 00 01 01 01 01 01 01 01 01 01 01 '.PS.............'
  01 01 01 01 01 01 e0 15 00 a0 40 00 16 30 30 20 '..........@..00 '
  34 00 06 4d 21 00 00 1a 00 00 00 00 00 00 00 00 '4..M!...........'
  00 00 00 00 00 00 00 00 00 00 00 00 00 fd 00 38 '...............8'
  4c 1e 53 11 00 0a 20 20 20 20 20 20 00 00 00 fc 'L.S...      ....'
  00 43 48 37 35 31 31 42 0a 20 20 20 20 20 00 fa '.CH7511B.     ..'
Checksum: 0xfa

----------------

Warnings:

Block 0, Base EDID:
  Detailed Timing Descriptor #1: Image size is 518x333 mm, but based on the picture AR it should be 518x388 mm.
  Display Range Limits: GTF support is deprecated in EDID 1.4.

Failures:

Block 0, Base EDID:
  Empty Descriptor: Use Dummy Descriptor instead of all zeroes.
  Display Range Limits: GTF is supported, but the display does not support continuous frequencies.
Block 1, Base EDID:
  Unknown Extension Block.
EDID:
  Base EDID: The DTD max image size is 518x333mm, but the display size is not specified anywhere.
  Base EDID: EDID specified 0 extension block(s), but found 1 extension block(s).

EDID conformity: FAIL
