edid-decode (hex):

00 ff ff ff ff ff ff 00 4d 10 f4 14 00 00 00 00
0e 1e 01 04 a5 22 13 78 07 de 50 a3 54 4c 99 26
0f 50 54 00 00 00 01 01 01 01 01 01 01 01 01 01
01 01 01 01 01 01 50 d0 80 50 70 38 1f 40 18 28
35 00 58 c2 10 00 00 18 14 34 80 50 70 38 1f 40
18 28 35 00 58 c2 10 00 00 18 00 00 00 fd 0c 3c
f0 0b 0b 36 01 0a 20 20 20 20 20 20 00 00 00 fc
00 4c 51 31 35 36 4d 31 4a 57 31 36 0a 20 00 6f

----------------

Block 0, Base EDID:
  EDID Structure Version & Revision: 1.4
  Vendor & Product Identification:
    Manufacturer: SHP
    Model: 5364
    Made in: week 14 of 2020
  Basic Display Parameters & Features:
    Digital display
    Bits per primary color channel: 8
    DisplayPort interface
    Maximum image size: 34 cm x 19 cm
    Gamma: 2.20
    Supported color formats: RGB 4:4:4
    Default (sRGB) color space is primary color space
    First detailed timing includes the native pixel format and preferred refresh rate
    Display supports continuous frequencies
  Color Characteristics:
    Red  : 0.6396, 0.3291
    Green: 0.2998, 0.5996
    Blue : 0.1494, 0.0595
    White: 0.3125, 0.3281
  Established Timings I & II: none
  Standard Timings: none
  Detailed Timing Descriptors:
    DTD 1:  1920x1080  240.000000 Hz  16:9    266.640 kHz    533.280000 MHz (344 mm x 194 mm)
                 Hfront   24 Hsync  40 Hback   16 Hpol N
                 Vfront    3 Vsync   5 Vback   23 Vpol N
    DTD 2:  1920x1080   60.000000 Hz  16:9     66.660 kHz    133.320000 MHz (344 mm x 194 mm)
                 Hfront   24 Hsync  40 Hback   16 Hpol N
                 Vfront    3 Vsync   5 Vback   23 Vpol N
    Display Range Limits:
      Monitor ranges (Range Limits Only): 60-240 Hz V, 266-266 kHz H, max dotclock 540 MHz
    Display Product Name: 'LQ156M1JW16'
Checksum: 0x6f

----------------

Warnings:

EDID:
  Base EDID: Some timings are out of range of the Monitor Ranges:
    Horizontal Freq: 66.660 - 266.640 kHz (Monitor: 266.000 - 266.000 kHz)

Failures:

Block 0, Base EDID:
  Basic Display Parameters & Features: sRGB is signaled, but the chromaticities do not match.

EDID conformity: FAIL
