edid-decode (hex):

00 ff ff ff ff ff ff 00 06 af 8a 70 00 00 00 00
00 1d 01 04 b5 1f 11 78 03 60 85 a4 54 4c 9d 27
11 50 54 00 00 00 01 01 01 01 01 01 01 01 01 01
01 01 01 01 01 01 66 d0 00 a0 f0 70 3e 80 30 20
35 00 35 ad 10 00 00 18 ef 8a 00 a0 f0 70 3e 80
30 20 35 00 35 ad 10 00 00 18 00 00 00 00 00 00
00 00 00 00 00 00 00 00 00 00 00 00 00 00 00 03
00 0c 20 ff 16 3c 13 2d 0e 42 13 01 01 20 01 94

02 03 0f 00 e3 05 80 00 e6 06 05 01 6f 6f 22 00
00 00 00 00 00 00 00 00 00 00 00 00 00 00 00 00
00 00 00 00 00 00 00 00 00 00 00 00 00 00 00 00
00 00 00 00 00 00 00 00 00 00 00 00 00 00 00 00
00 00 00 00 00 00 00 00 00 00 00 00 00 00 00 00
00 00 00 00 00 00 00 00 00 00 00 00 00 00 00 00
00 00 00 00 00 00 00 00 00 00 00 00 00 00 00 00
00 00 00 00 00 00 00 00 00 00 00 00 00 00 00 92

00 ff ff ff ff ff ff 00 06 af 8a 70 00 00 00 00
00 1d 01 04 b5 1f 11 78 03 60 85 a4 54 4c 9d 27
11 50 54 00 00 00 01 01 01 01 01 01 01 01 01 01
01 01 01 01 01 01 66 d0 00 a0 f0 70 3e 80 30 20
35 00 35 ad 10 00 00 18 ef 8a 00 a0 f0 70 3e 80
30 20 35 00 35 ad 10 00 00 18 00 00 00 00 00 00
00 00 00 00 00 00 00 00 00 00 00 00 00 00 00 03
00 0c 20 ff 16 3c 13 2d 0e 42 13 01 01 20 01 94

02 03 0f 00 e3 05 80 00 e6 06 05 01 6f 6f 22 00
00 00 00 00 00 00 00 00 00 00 00 00 00 00 00 00
00 00 00 00 00 00 00 00 00 00 00 00 00 00 00 00
00 00 00 00 00 00 00 00 00 00 00 00 00 00 00 00
00 00 00 00 00 00 00 00 00 00 00 00 00 00 00 00
00 00 00 00 00 00 00 00 00 00 00 00 00 00 00 00
00 00 00 00 00 00 00 00 00 00 00 00 00 00 00 00
00 00 00 00 00 00 00 00 00 00 00 00 00 00 00 92

----------------

Block 0, Base EDID:
  EDID Structure Version & Revision: 1.4
  Vendor & Product Identification:
    Manufacturer: AUO
    Model: 28810
    Made in: 2019
  Basic Display Parameters & Features:
    Digital display
    Bits per primary color channel: 10
    DisplayPort interface
    Maximum image size: 31 cm x 17 cm
    Gamma: 2.20
    Supported color formats: RGB 4:4:4
    First detailed timing includes the native pixel format and preferred refresh rate
    Display supports continuous frequencies
  Color Characteristics:
    Red  : 0.6416, 0.3300
    Green: 0.2968, 0.6132
    Blue : 0.1542, 0.0664
    White: 0.3134, 0.3291
  Established Timings I & II: none
  Standard Timings: none
  Detailed Timing Descriptors:
    DTD 1:  3840x2160   60.024752 Hz  16:9    133.375 kHz    533.500000 MHz (309 mm x 173 mm)
                 Hfront   48 Hsync  32 Hback   80 Hpol N
                 Vfront    3 Vsync   5 Vback   54 Vpol N
    DTD 2:  3840x2160   40.016877 Hz  16:9     88.918 kHz    355.670000 MHz (309 mm x 173 mm)
                 Hfront   48 Hsync  32 Hback   80 Hpol N
                 Vfront    3 Vsync   5 Vback   54 Vpol N
    Empty Descriptor
    Manufacturer-Specified Display Descriptor (0x03): 00 03 00 0c 20 ff 16 3c 13 2d 0e 42 13 01 01 20 '.... ..<.-.B... '
  Extension blocks: 1
Checksum: 0x94

----------------

Block 1, CTA-861 Extension Block:
  Revision: 3
  Native detailed modes: 0
  Colorimetry Data Block:
    BT2020RGB
  HDR Static Metadata Data Block:
    Electro optical transfer functions:
      Traditional gamma - SDR luminance range
      SMPTE ST2084
    Supported static metadata descriptors:
      Static metadata type 1
    Desired content max luminance: 111 (553.564 cd/m^2)
    Desired content max frame-average luminance: 111 (553.564 cd/m^2)
    Desired content min luminance: 34 (0.098 cd/m^2)
Checksum: 0x92  Unused space in Extension Block: 112 bytes

----------------

Block 2, Unknown EDID Extension Block 0x00:
  00 ff ff ff ff ff ff 00 06 af 8a 70 00 00 00 00 '...........p....'
  00 1d 01 04 b5 1f 11 78 03 60 85 a4 54 4c 9d 27 '.......x.`..TL.''
  11 50 54 00 00 00 01 01 01 01 01 01 01 01 01 01 '.PT.............'
  01 01 01 01 01 01 66 d0 00 a0 f0 70 3e 80 30 20 '......f....p>.0 '
  35 00 35 ad 10 00 00 18 ef 8a 00 a0 f0 70 3e 80 '5.5..........p>.'
  30 20 35 00 35 ad 10 00 00 18 00 00 00 00 00 00 '0 5.5...........'
  00 00 00 00 00 00 00 00 00 00 00 00 00 00 00 03 '................'
  00 0c 20 ff 16 3c 13 2d 0e 42 13 01 01 20 01 94 '.. ..<.-.B... ..'
Checksum: 0x94

----------------

Block 3, CTA-861 Extension Block:
  Revision: 3
  Native detailed modes: 0
  Colorimetry Data Block:
    BT2020RGB
  HDR Static Metadata Data Block:
    Electro optical transfer functions:
      Traditional gamma - SDR luminance range
      SMPTE ST2084
    Supported static metadata descriptors:
      Static metadata type 1
    Desired content max luminance: 111 (553.564 cd/m^2)
    Desired content max frame-average luminance: 111 (553.564 cd/m^2)
    Desired content min luminance: 34 (0.098 cd/m^2)
Checksum: 0x92  Unused space in Extension Block: 112 bytes

----------------

Warnings:

Block 0, Base EDID:
  Missing Display Product Name.
Block 1, CTA-861 Extension Block:
  IT Video Formats are overscanned by default, but normally this should be underscanned.
  Colorimetry Data Block: Set the sRGB colorimetry bit to avoid interop issues.
Block 3, CTA-861 Extension Block:
  IT Video Formats are overscanned by default, but normally this should be underscanned.
  Colorimetry Data Block: Set the sRGB colorimetry bit to avoid interop issues.

Failures:

Block 0, Base EDID:
  Empty Descriptor: Use Dummy Descriptor instead of all zeroes.
  Missing Display Range Limits Descriptor.
Block 1, CTA-861 Extension Block:
  Required 640x480p60 timings are missing in the established timings and the SVD list (VIC 1).
  Missing VCDB, needed for Set Selectable RGB Quantization to avoid interop issues.
Block 2, Base EDID:
  Unknown Extension Block.
Block 3, CTA-861 Extension Block:
  Colorimetry Data Block: Only one instance of this Data Block is allowed.
  HDR Static Metadata Data Block: Only one instance of this Data Block is allowed.
EDID:
  Base EDID: EDID specified 1 extension block(s), but found 3 extension block(s).

EDID conformity: FAIL
