edid-decode (hex):

00 ff ff ff ff ff ff 00 30 e4 01 6e 00 00 00 00
00 12 01 03 80 22 13 78 0a 00 00 00 00 00 00 00
00 50 54 00 00 00 01 01 01 01 01 01 01 01 01 01
01 01 01 01 01 01 3e 1c 56 a0 50 00 16 30 30 20
35 00 58 c2 10 00 00 19 3e 1c 56 a0 50 00 16 30
30 20 35 00 58 c2 10 00 00 19 00 00 00 fe 00 4a
35 35 33 48 80 31 35 36 57 48 31 0a 00 00 00 00
00 ff ff ff ff ff ff ff ff 01 01 0a 20 20 00 bf

----------------

Block 0, Base EDID:
  EDID Structure Version & Revision: 1.3
  Vendor & Product Identification:
    Manufacturer: LGD
    Model: 28161
    Made in: 2008
  Basic Display Parameters & Features:
    Digital display
    Maximum image size: 34 cm x 19 cm
    Gamma: 2.20
    RGB color display
    First detailed timing is the preferred timing
  Color Characteristics:
    Red  : 0.0000, 0.0000
    Green: 0.0000, 0.0000
    Blue : 0.0000, 0.0000
    White: 0.3125, 0.3281
  Established Timings I & II: none
  Standard Timings: none
  Detailed Timing Descriptors:
    DTD 1:  1366x768    59.973124 Hz 683:384   47.379 kHz     72.300000 MHz (344 mm x 194 mm)
                 Hfront   48 Hsync  32 Hback   80 Hpol N
                 Vfront    3 Vsync   5 Vback   14 Vpol N
    DTD 2:  1366x768    59.973124 Hz 683:384   47.379 kHz     72.300000 MHz (344 mm x 194 mm)
                 Hfront   48 Hsync  32 Hback   80 Hpol N
                 Vfront    3 Vsync   5 Vback   14 Vpol N
    Alphanumeric Data String: 'J553H.156WH1'
    Manufacturer-Specified Display Descriptor (0x00): 00 00 00 ff ff ff ff ff ff ff ff 01 01 0a 20 20 '..............  '
Checksum: 0xbf

----------------

Warnings:

Block 0, Base EDID:
  Alphanumeric Data String: Non-ASCII character 0x80 at position 5, can cause problems.

Failures:

Block 0, Base EDID:
  Missing Display Product Name.
  Missing Display Range Limits Descriptor.

EDID conformity: FAIL
