edid-decode (hex):

00 ff ff ff ff ff ff 00 51 b8 30 14 48 31 56 4e
1c 20 01 04 b5 1e 14 78 07 ee 95 a3 54 4c 99 26
0f 50 54 00 00 00 01 01 01 01 01 01 01 01 01 01
01 01 01 01 01 01 44 a3 d8 b4 90 90 28 60 30 20
86 04 2c c8 10 00 00 18 00 00 00 fd 00 30 5a a0
a0 2b 01 0a 20 20 20 20 20 20 00 00 00 ff 00 0a
20 20 20 20 20 20 20 20 20 20 20 20 00 00 00 10
00 0a 20 20 20 20 20 20 20 20 20 20 20 20 01 bb

70 13 79 00 00 03 01 28 43 a3 00 04 d7 09 b3 00
2f 00 1f 00 8f 06 83 03 17 00 05 00 43 a3 00 04
d7 09 b3 00 2f 00 1f 00 8f 06 08 06 17 00 05 00
00 00 00 00 00 00 00 00 00 00 00 00 00 00 00 00
00 00 00 00 00 00 00 00 00 00 00 00 00 00 00 00
00 00 00 00 00 00 00 00 00 00 00 00 00 00 00 00
00 00 00 00 00 00 00 00 00 00 00 00 00 00 00 00
00 00 00 00 00 00 00 00 00 00 00 00 00 00 bc 90

00 ff ff ff ff ff ff 00 51 b8 30 14 48 31 56 4e
1c 20 01 04 b5 1e 14 78 07 ee 95 a3 54 4c 99 26
0f 50 54 00 00 00 01 01 01 01 01 01 01 01 01 01
01 01 01 01 01 01 44 a3 d8 b4 90 90 28 60 30 20
86 04 2c c8 10 00 00 18 00 00 00 fd 00 30 5a a0
a0 2b 01 0a 20 20 20 20 20 20 00 00 00 ff 00 0a
20 20 20 20 20 20 20 20 20 20 20 20 00 00 00 10
00 0a 20 20 20 20 20 20 20 20 20 20 20 20 01 bb

70 13 79 00 00 03 01 28 43 a3 00 04 d7 09 b3 00
2f 00 1f 00 8f 06 83 03 17 00 05 00 43 a3 00 04
d7 09 b3 00 2f 00 1f 00 8f 06 08 06 17 00 05 00
00 00 00 00 00 00 00 00 00 00 00 00 00 00 00 00
00 00 00 00 00 00 00 00 00 00 00 00 00 00 00 00
00 00 00 00 00 00 00 00 00 00 00 00 00 00 00 00
00 00 00 00 00 00 00 00 00 00 00 00 00 00 00 00
00 00 00 00 00 00 00 00 00 00 00 00 00 00 bc 90

----------------

Block 0, Base EDID:
  EDID Structure Version & Revision: 1.4
  Vendor & Product Identification:
    Manufacturer: TMX
    Model: 5168
    Serial Number: ...
    Made in: week 28 of 2022
  Basic Display Parameters & Features:
    Digital display
    Bits per primary color channel: 10
    DisplayPort interface
    Maximum image size: 30 cm x 20 cm
    Gamma: 2.20
    Supported color formats: RGB 4:4:4
    Default (sRGB) color space is primary color space
    First detailed timing includes the native pixel format and preferred refresh rate
    Display supports continuous frequencies
  Color Characteristics:
    Red  : 0.6396, 0.3300
    Green: 0.2998, 0.5996
    Blue : 0.1503, 0.0595
    White: 0.3134, 0.3291
  Established Timings I & II: none
  Standard Timings: none
  Detailed Timing Descriptors:
    DTD 1:  2520x1680   90.000000 Hz   3:2    154.800 kHz    417.960000 MHz (300 mm x 200 mm)
                 Hfront   48 Hsync  32 Hback  100 Hpol N
                 Vfront   24 Vsync   6 Vback   10 Vpol N
    Display Range Limits:
      Monitor ranges (Range Limits Only): 48-90 Hz V, 160-160 kHz H, max dotclock 430 MHz
    Display Product Serial Number: ...
    Dummy Descriptor:
  Extension blocks: 1
Checksum: 0xbb

----------------

Block 1, DisplayID Extension Block:
  Version: 1.3
  Extension Count: 0
  Display Product Type: Extension Section
  Video Timing Modes Type 1 - Detailed Timings Data Block:
    DTD:  2520x1680   60.000000 Hz  16:9    154.800 kHz    417.960000 MHz (aspect 16:9, no 3D stereo)
               Hfront   48 Hsync  32 Hback  100 Hpol N
               Vfront   24 Vsync   6 Vback  870 Vpol N
    DTD:  2520x1680   48.000000 Hz  16:9    154.800 kHz    417.960000 MHz (aspect 16:9, no 3D stereo)
               Hfront   48 Hsync  32 Hback  100 Hpol N
               Vfront   24 Vsync   6 Vback 1515 Vpol N
  Checksum: 0xbc
Checksum: 0x90

----------------

Block 2, Unknown EDID Extension Block 0x00:
  00 ff ff ff ff ff ff 00 51 b8 30 14 48 31 56 4e '........Q.0.H1VN'
  1c 20 01 04 b5 1e 14 78 07 ee 95 a3 54 4c 99 26 '. .....x....TL.&'
  0f 50 54 00 00 00 01 01 01 01 01 01 01 01 01 01 '.PT.............'
  01 01 01 01 01 01 44 a3 d8 b4 90 90 28 60 30 20 '......D.....(`0 '
  86 04 2c c8 10 00 00 18 00 00 00 fd 00 30 5a a0 '..,..........0Z.'
  a0 2b 01 0a 20 20 20 20 20 20 00 00 00 ff 00 0a '.+..      ......'
  20 20 20 20 20 20 20 20 20 20 20 20 00 00 00 10 '            ....'
  00 0a 20 20 20 20 20 20 20 20 20 20 20 20 01 bb '..            ..'
Checksum: 0xbb

----------------

Block 3, DisplayID Extension Block:
  Version: 1.3
  Extension Count: 0
  Video Timing Modes Type 1 - Detailed Timings Data Block:
    DTD:  2520x1680   60.000000 Hz  16:9    154.800 kHz    417.960000 MHz (aspect 16:9, no 3D stereo)
               Hfront   48 Hsync  32 Hback  100 Hpol N
               Vfront   24 Vsync   6 Vback  870 Vpol N
    DTD:  2520x1680   48.000000 Hz  16:9    154.800 kHz    417.960000 MHz (aspect 16:9, no 3D stereo)
               Hfront   48 Hsync  32 Hback  100 Hpol N
               Vfront   24 Vsync   6 Vback 1515 Vpol N
  Checksum: 0xbc
Checksum: 0x90

----------------

Warnings:

Block 0, Base EDID:
  Missing Display Product Name.
EDID:
  Base EDID: Some timings are out of range of the Monitor Ranges:
    Horizontal Freq: 154.800 - 154.800 kHz (Monitor: 160.000 - 160.000 kHz)

Failures:

Block 0, Base EDID:
  Display Product Serial Number: ...
  Basic Display Parameters & Features: sRGB is signaled, but the chromaticities do not match.
  Dummy Descriptor: Dummy block filled with garbage.
Block 1, DisplayID Extension Block:
  DisplayID Base Block has no product type.
  Expected 0 DisplayID Extension Block, but got 1.
Block 2, Base EDID:
  Unknown Extension Block.
EDID:
  Base EDID: EDID specified 1 extension block(s), but found 3 extension block(s).
  DisplayID: DisplayID expects at least one preferred timing.

EDID conformity: FAIL
