edid-decode (hex):

00 ff ff ff ff ff ff 00 21 63 00 00 01 00 00 00
16 1d 01 03 80 2c 17 78 ca 02 70 a0 57 48 9a 25
0f 47 4c af cf 00 95 00 a9 c0 81 c0 81 80 01 01
01 01 01 01 01 01 30 2a 40 c8 60 84 64 30 18 50
13 00 b8 e6 10 00 00 1e 00 00 00 fc 00 32 30 53
31 0a 20 20 20 20 20 20 20 20 00 00 00 fd 00 32
4b 1e 55 0f 00 0a 20 20 20 20 20 20 00 00 00 ff
00 43 46 41 30 30 34 35 32 38 31 33 39 32 01 ce

02 03 31 f1 47 01 02 03 04 11 12 13 38 09 07 07
35 34 2c 20 30 78 33 38 2c 44 2c 20 30 78 33 36
2c 20 30 78 00 83 01 00 00 67 03 0c 00 10 00 38
2d 01 1d 00 72 51 d0 1e 20 6e 28 55 00 b8 e6 10
00 00 1e 00 00 00 00 00 00 00 00 00 00 00 00 00
00 00 00 00 00 00 00 00 00 00 00 00 00 00 00 00
00 00 00 00 00 00 00 00 00 00 00 00 00 00 00 00
00 00 00 00 00 00 00 00 00 00 00 00 00 00 00 65

00 ff ff ff ff ff ff 00 21 63 00 00 01 00 00 00
16 1d 01 03 80 2c 17 78 ca 02 70 a0 57 48 9a 25
0f 47 4c af cf 00 95 00 a9 c0 81 c0 81 80 01 01
01 01 01 01 01 01 30 2a 40 c8 60 84 64 30 18 50
13 00 b8 e6 10 00 00 1e 00 00 00 fc 00 32 30 53
31 0a 20 20 20 20 20 20 20 20 00 00 00 fd 00 32
4b 1e 55 0f 00 0a 20 20 20 20 20 20 00 00 00 ff
00 43 46 41 30 30 34 35 32 38 31 33 39 32 01 ce

02 03 31 f1 47 01 02 03 04 11 12 13 38 09 07 07
35 34 2c 20 30 78 33 38 2c 44 2c 20 30 78 33 36
2c 20 30 78 00 83 01 00 00 67 03 0c 00 10 00 38
2d 01 1d 00 72 51 d0 1e 20 6e 28 55 00 b8 e6 10
00 00 1e 00 00 00 00 00 00 00 00 00 00 00 00 00
00 00 00 00 00 00 00 00 00 00 00 00 00 00 00 00
00 00 00 00 00 00 00 00 00 00 00 00 00 00 00 00
00 00 00 00 00 00 00 00 00 00 00 00 00 00 00 65

----------------

Block 0, Base EDID:
  EDID Structure Version & Revision: 1.3
  Vendor & Product Identification:
    Manufacturer: HKC
    Model: 0
    Serial Number: ...
    Made in: week 22 of 2019
  Basic Display Parameters & Features:
    Digital display
    Maximum image size: 44 cm x 23 cm
    Gamma: 2.20
    DPMS levels: Standby Suspend
    RGB color display
    First detailed timing is the preferred timing
  Color Characteristics:
    Red  : 0.6250, 0.3398
    Green: 0.2812, 0.6035
    Blue : 0.1455, 0.0615
    White: 0.2773, 0.2968
  Established Timings I & II:
    IBM     :   720x400    70.081663 Hz   9:5     31.467 kHz     28.320000 MHz
    DMT 0x04:   640x480    59.940476 Hz   4:3     31.469 kHz     25.175000 MHz
    DMT 0x05:   640x480    72.808802 Hz   4:3     37.861 kHz     31.500000 MHz
    DMT 0x06:   640x480    75.000000 Hz   4:3     37.500 kHz     31.500000 MHz
    DMT 0x08:   800x600    56.250000 Hz   4:3     35.156 kHz     36.000000 MHz
    DMT 0x09:   800x600    60.316541 Hz   4:3     37.879 kHz     40.000000 MHz
    DMT 0x0a:   800x600    72.187572 Hz   4:3     48.077 kHz     50.000000 MHz
    DMT 0x0b:   800x600    75.000000 Hz   4:3     46.875 kHz     49.500000 MHz
    DMT 0x10:  1024x768    60.003840 Hz   4:3     48.363 kHz     65.000000 MHz
    DMT 0x11:  1024x768    70.069359 Hz   4:3     56.476 kHz     75.000000 MHz
    DMT 0x12:  1024x768    75.028582 Hz   4:3     60.023 kHz     78.750000 MHz
    DMT 0x24:  1280x1024   75.024675 Hz   5:4     79.976 kHz    135.000000 MHz
  Standard Timings:
    DMT 0x2f:  1440x900    59.887445 Hz  16:10    55.935 kHz    106.500000 MHz
    DMT 0x53:  1600x900    60.000000 Hz  16:9     60.000 kHz    108.000000 MHz (RB)
    DMT 0x55:  1280x720    60.000000 Hz  16:9     45.000 kHz     74.250000 MHz
    DMT 0x23:  1280x1024   60.019740 Hz   5:4     63.981 kHz    108.000000 MHz
  Detailed Timing Descriptors:
    DTD 1:  1600x900    60.000000 Hz  16:9     60.000 kHz    108.000000 MHz (440 mm x 230 mm)
                 Hfront   24 Hsync  80 Hback   96 Hpol P
                 Vfront    1 Vsync   3 Vback   96 Vpol P
    Display Product Name: '20S1'
    Display Range Limits:
      Monitor ranges (GTF): 50-75 Hz V, 30-85 kHz H, max dotclock 150 MHz
    Display Product Serial Number: ...
  Extension blocks: 1
Checksum: 0xce

----------------

Block 1, CTA-861 Extension Block:
  Revision: 3
  Underscans IT Video Formats by default
  Basic audio support
  Supports YCbCr 4:4:4
  Supports YCbCr 4:2:2
  Native detailed modes: 1
  Video Data Block:
    VIC   1:   640x480    59.940476 Hz   4:3     31.469 kHz     25.175000 MHz
    VIC   2:   720x480    59.940060 Hz   4:3     31.469 kHz     27.000000 MHz
    VIC   3:   720x480    59.940060 Hz  16:9     31.469 kHz     27.000000 MHz
    VIC   4:  1280x720    60.000000 Hz  16:9     45.000 kHz     74.250000 MHz
    VIC  17:   720x576    50.000000 Hz   4:3     31.250 kHz     27.000000 MHz
    VIC  18:   720x576    50.000000 Hz  16:9     31.250 kHz     27.000000 MHz
    VIC  19:  1280x720    50.000000 Hz  16:9     37.500 kHz     74.250000 MHz
  Audio Data Block:
    Linear PCM:
      Max channels: 2
      Supported sample rates (kHz): 48 44.1 32
      Supported sample sizes (bits): 24 20 16
    AAC LC:
      Max channels: 6
      Supported sample rates (kHz): 176.4 96 48
      Maximum bit rate: 352 kb/s
    MPEG 1 Layer 3 (MP3):
      Max channels: 1
      Supported sample rates (kHz): 176.4 96
      Maximum bit rate: 960 kb/s
    AAC LC:
      Max channels: 4
      Supported sample rates (kHz): 176.4 96 88.2
      Maximum bit rate: 352 kb/s
    ATRAC:
      Max channels: 5
      Supported sample rates (kHz): 176.4 88.2 48
      Maximum bit rate: 256 kb/s
    AAC LC:
      Max channels: 1
      Supported sample rates (kHz): 192 176.4 96 88.2
      Maximum bit rate: 408 kb/s
    AAC LC:
      Max channels: 7
      Supported sample rates (kHz): 176.4 88.2 48
      Maximum bit rate: 256 kb/s
    AAC LC:
      Max channels: 1
      Supported sample rates (kHz): 192 176.4 96 88.2
      Maximum bit rate: 0 kb/s
  Speaker Allocation Data Block:
    FL/FR - Front Left/Right
  Vendor-Specific Data Block (HDMI), OUI 00-0C-03:
    Source physical address: 1.0.0.0
    DC_36bit
    DC_30bit
    DC_Y444
    Maximum TMDS clock: 225 MHz
  Detailed Timing Descriptors:
    DTD 2:  1280x720    60.000000 Hz  16:9     45.000 kHz     74.250000 MHz (440 mm x 230 mm)
                 Hfront  110 Hsync  40 Hback  220 Hpol P
                 Vfront    5 Vsync   5 Vback   20 Vpol P
Checksum: 0x65  Unused space in Extension Block: 60 bytes

----------------

Block 2, Unknown EDID Extension Block 0x00:
  00 ff ff ff ff ff ff 00 21 63 00 00 01 00 00 00 '........!c......'
  16 1d 01 03 80 2c 17 78 ca 02 70 a0 57 48 9a 25 '.....,.x..p.WH.%'
  0f 47 4c af cf 00 95 00 a9 c0 81 c0 81 80 01 01 '.GL.............'
  01 01 01 01 01 01 30 2a 40 c8 60 84 64 30 18 50 '......0*@.`.d0.P'
  13 00 b8 e6 10 00 00 1e 00 00 00 fc 00 32 30 53 '.............20S'
  31 0a 20 20 20 20 20 20 20 20 00 00 00 fd 00 32 '1.        .....2'
  4b 1e 55 0f 00 0a 20 20 20 20 20 20 00 00 00 ff 'K.U...      ....'
  00 43 46 41 30 30 34 35 32 38 31 33 39 32 01 ce '.CFA0045281392..'
Checksum: 0xce

----------------

Block 3, CTA-861 Extension Block:
  Revision: 3
  Underscans IT Video Formats by default
  Basic audio support
  Supports YCbCr 4:4:4
  Supports YCbCr 4:2:2
  Native detailed modes: 1
  Video Data Block:
    VIC   1:   640x480    59.940476 Hz   4:3     31.469 kHz     25.175000 MHz
    VIC   2:   720x480    59.940060 Hz   4:3     31.469 kHz     27.000000 MHz
    VIC   3:   720x480    59.940060 Hz  16:9     31.469 kHz     27.000000 MHz
    VIC   4:  1280x720    60.000000 Hz  16:9     45.000 kHz     74.250000 MHz
    VIC  17:   720x576    50.000000 Hz   4:3     31.250 kHz     27.000000 MHz
    VIC  18:   720x576    50.000000 Hz  16:9     31.250 kHz     27.000000 MHz
    VIC  19:  1280x720    50.000000 Hz  16:9     37.500 kHz     74.250000 MHz
  Audio Data Block:
    Linear PCM:
      Max channels: 2
      Supported sample rates (kHz): 48 44.1 32
      Supported sample sizes (bits): 24 20 16
    AAC LC:
      Max channels: 6
      Supported sample rates (kHz): 176.4 96 48
      Maximum bit rate: 352 kb/s
    MPEG 1 Layer 3 (MP3):
      Max channels: 1
      Supported sample rates (kHz): 176.4 96
      Maximum bit rate: 960 kb/s
    AAC LC:
      Max channels: 4
      Supported sample rates (kHz): 176.4 96 88.2
      Maximum bit rate: 352 kb/s
    ATRAC:
      Max channels: 5
      Supported sample rates (kHz): 176.4 88.2 48
      Maximum bit rate: 256 kb/s
    AAC LC:
      Max channels: 1
      Supported sample rates (kHz): 192 176.4 96 88.2
      Maximum bit rate: 408 kb/s
    AAC LC:
      Max channels: 7
      Supported sample rates (kHz): 176.4 88.2 48
      Maximum bit rate: 256 kb/s
    AAC LC:
      Max channels: 1
      Supported sample rates (kHz): 192 176.4 96 88.2
      Maximum bit rate: 0 kb/s
  Speaker Allocation Data Block:
    FL/FR - Front Left/Right
  Vendor-Specific Data Block (HDMI), OUI 00-0C-03:
    Source physical address: 1.0.0.0
    DC_36bit
    DC_30bit
    DC_Y444
    Maximum TMDS clock: 225 MHz
  Detailed Timing Descriptors:
    DTD 3:  1280x720    60.000000 Hz  16:9     45.000 kHz     74.250000 MHz (440 mm x 230 mm)
                 Hfront  110 Hsync  40 Hback  220 Hpol P
                 Vfront    5 Vsync   5 Vback   20 Vpol P
Checksum: 0x65  Unused space in Extension Block: 60 bytes

----------------

Warnings:

Block 0, Base EDID:
  Vendor & Product Identification: The serial number is one of the known dummy values, it should probably be set to 0.
  Detailed Timing Descriptor #1: Image size is 440x230 mm, but based on the picture AR it should be 440x247 mm.
Block 1, CTA-861 Extension Block:
  Video Data Block: VIC 1 and the first DTD are not identical. Is this intended?
  Video Data Block: All VICs are in ascending order, and the first (preferred) VIC <= 4, is that intended?
  Detailed Timing Descriptor #2: Image size is 440x230 mm, but based on the picture AR it should be 440x247 mm.
  Display Product Serial Number is set, so the Serial Number in the Base EDID should be 0.
  Add a Colorimetry Data Block with the sRGB colorimetry bit set to avoid interop issues.
Block 3, CTA-861 Extension Block:
  Video Data Block: All VICs are in ascending order, and the first (preferred) VIC <= 4, is that intended?
  Detailed Timing Descriptor #3: Image size is 440x230 mm, but based on the picture AR it should be 440x247 mm.

Failures:

Block 1, CTA-861 Extension Block:
  Missing VCDB, needed for Set Selectable RGB Quantization to avoid interop issues.
Block 2, Base EDID:
  Unknown Extension Block.
Block 3, CTA-861 Extension Block:
  Video Data Block: Duplicate VIC 1.
  Video Data Block: Duplicate VIC 2.
  Video Data Block: Duplicate VIC 3.
  Video Data Block: Duplicate VIC 4.
  Video Data Block: Duplicate VIC 17.
  Video Data Block: Duplicate VIC 18.
  Video Data Block: Duplicate VIC 19.
  Speaker Allocation Data Block: Only one instance of this Data Block is allowed.
EDID:
  Base EDID: EDID specified 1 extension block(s), but found 3 extension block(s).
  Base EDID: EDID 1.3 requires a Block Map Extension in Block 1 if there are more than 2 blocks in the EDID.

EDID conformity: FAIL
