edid-decode (hex):

00 ff ff ff ff ff ff 00 36 7f 25 00 01 01 01 01
30 16 01 04 a5 1d 10 78 02 0f 15 9a 56 4b 8b 26
20 50 54 00 00 00 d1 c0 01 01 01 01 01 01 01 01
01 01 01 01 01 01 9c 3f 80 31 72 38 0f 40 20 20
33 00 23 a4 10 00 00 18 07 27 80 69 71 38 0f 40
20 20 33 00 23 a4 10 00 00 18 00 00 00 fc 00 53
6f 6e 79 20 4c 43 44 0a 20 20 20 20 00 00 00 fd
00 27 3d 2b 42 11 00 0a 20 20 20 20 20 20 00 fb

00 ff ff ff ff ff ff 00 36 7f 25 00 01 01 01 01
30 16 01 04 a5 1d 10 78 02 0f 15 9a 56 4b 8b 26
20 50 54 00 00 00 d1 c0 01 01 01 01 01 01 01 01
01 01 01 01 01 01 9c 3f 80 31 72 38 0f 40 20 20
33 00 23 a4 10 00 00 18 07 27 80 69 71 38 0f 40
20 20 33 00 23 a4 10 00 00 18 00 00 00 fc 00 53
6f 6e 79 20 4c 43 44 0a 20 20 20 20 00 00 00 fd
00 27 3d 2b 42 11 00 0a 20 20 20 20 20 20 00 fb

----------------

Block 0, Base EDID:
  EDID Structure Version & Revision: 1.4
  Vendor & Product Identification:
    Manufacturer: MS_
    Model: 37
    Serial Number: ...
    Made in: week 48 of 2012
  Basic Display Parameters & Features:
    Digital display
    Bits per primary color channel: 8
    DisplayPort interface
    Maximum image size: 29 cm x 16 cm
    Gamma: 2.20
    Supported color formats: RGB 4:4:4
    First detailed timing includes the native pixel format and preferred refresh rate
  Color Characteristics:
    Red  : 0.6015, 0.3359
    Green: 0.2958, 0.5458
    Blue : 0.1484, 0.1259
    White: 0.3134, 0.3291
  Established Timings I & II: none
  Standard Timings:
    DMT 0x52:  1920x1080   60.000000 Hz  16:9     67.500 kHz    148.500000 MHz
  Detailed Timing Descriptors:
    DTD 1:  1920x1080   59.940479 Hz  16:9     65.635 kHz    162.840000 MHz (291 mm x 164 mm)
                 Hfront   32 Hsync  32 Hback  497 Hpol N
                 Vfront    3 Vsync   3 Vback    9 Vpol N
    DTD 2:  1920x1080   40.000881 Hz  16:9     43.801 kHz     99.910000 MHz (291 mm x 164 mm)
                 Hfront   32 Hsync  32 Hback  297 Hpol N
                 Vfront    3 Vsync   3 Vback    9 Vpol N
    Display Product Name: 'Sony LCD'
    Display Range Limits:
      Monitor ranges (GTF): 39-61 Hz V, 43-66 kHz H, max dotclock 170 MHz
Checksum: 0xfb

----------------

Warnings:

Block 0, Base EDID:
  Vendor & Product Identification: The serial number is one of the known dummy values, it should probably be set to 0.
  Display Range Limits: GTF support is deprecated in EDID 1.4.
EDID:
  Base EDID: Some timings are out of range of the Monitor Ranges:
    Horizontal Freq: 43.800 - 67.500 kHz (Monitor: 43.000 - 66.000 kHz)

Failures:

Block 0, Base EDID:
  Vendor & Product Identification: Manufacturer name field contains garbage.
  Display Range Limits: GTF is supported, but the display does not support continuous frequencies.
EDID:
  Extension Block 1 started with EDID header, ignoring Extension Blocks >= 1.

EDID conformity: FAIL
