edid-decode (hex):

00 ff ff ff ff ff ff 00 30 e4 93 07 00 00 00 00
00 21 01 04 a5 25 17 78 01 16 e5 ae 52 42 b1 24
0e 50 54 00 00 00 01 01 01 01 01 01 01 01 01 01
01 01 01 01 01 01 47 6d 00 a0 a0 40 72 60 30 20
36 00 6e e5 10 00 00 1a 00 00 00 fd 00 1f 90 f7
f7 44 01 0a 20 20 20 20 20 20 00 00 00 fe 00 4c
47 20 44 49 53 50 4c 41 59 0a 20 20 00 00 00 fe
00 4c 50 31 37 30 57 51 32 2d 53 50 44 31 02 ee

02 03 0f 00 e3 05 80 00 e6 06 01 01 60 60 42 00
00 00 00 00 00 00 00 00 00 00 00 00 00 00 00 00
00 00 00 00 00 00 00 00 00 00 00 00 00 00 00 00
00 00 00 00 00 00 00 00 00 00 00 00 00 00 00 00
00 00 00 00 00 00 00 00 00 00 00 00 00 00 00 00
00 00 00 00 00 00 00 00 00 00 00 00 00 00 00 00
00 00 00 00 00 00 00 00 00 00 00 00 00 00 00 00
00 00 00 00 00 00 00 00 00 00 00 00 00 00 00 94

70 20 79 02 00 22 00 14 75 3e 0a 85 ff 09 9f 00
2f 80 1f 00 3f 06 71 00 02 00 05 00 00 00 00 00
00 00 00 00 00 00 00 00 00 00 00 00 00 00 00 00
25 01 09 75 3e 0a 75 3e 0a 1f 90 80 26 00 09 02
00 00 00 00 00 10 00 00 00 00 00 00 00 00 00 00
00 00 00 00 00 00 00 00 00 00 00 00 00 00 00 00
00 00 00 00 00 00 00 00 00 00 00 00 00 00 00 00
00 00 00 00 00 00 00 00 00 00 00 00 00 00 a2 90

00 ff ff ff ff ff ff 00 30 e4 93 07 00 00 00 00
00 21 01 04 a5 25 17 78 01 16 e5 ae 52 42 b1 24
0e 50 54 00 00 00 01 01 01 01 01 01 01 01 01 01
01 01 01 01 01 01 47 6d 00 a0 a0 40 72 60 30 20
36 00 6e e5 10 00 00 1a 00 00 00 fd 00 1f 90 f7
f7 44 01 0a 20 20 20 20 20 20 00 00 00 fe 00 4c
47 20 44 49 53 50 4c 41 59 0a 20 20 00 00 00 fe
00 4c 50 31 37 30 57 51 32 2d 53 50 44 31 02 ee

02 03 0f 00 e3 05 80 00 e6 06 01 01 60 60 42 00
00 00 00 00 00 00 00 00 00 00 00 00 00 00 00 00
00 00 00 00 00 00 00 00 00 00 00 00 00 00 00 00
00 00 00 00 00 00 00 00 00 00 00 00 00 00 00 00
00 00 00 00 00 00 00 00 00 00 00 00 00 00 00 00
00 00 00 00 00 00 00 00 00 00 00 00 00 00 00 00
00 00 00 00 00 00 00 00 00 00 00 00 00 00 00 00
00 00 00 00 00 00 00 00 00 00 00 00 00 00 00 94

70 20 79 02 00 22 00 14 75 3e 0a 85 ff 09 9f 00
2f 80 1f 00 3f 06 71 00 02 00 05 00 00 00 00 00
00 00 00 00 00 00 00 00 00 00 00 00 00 00 00 00
25 01 09 75 3e 0a 75 3e 0a 1f 90 80 26 00 09 02
00 00 00 00 00 10 00 00 00 00 00 00 00 00 00 00
00 00 00 00 00 00 00 00 00 00 00 00 00 00 00 00
00 00 00 00 00 00 00 00 00 00 00 00 00 00 00 00
00 00 00 00 00 00 00 00 00 00 00 00 00 00 a2 90

----------------

Block 0, Base EDID:
  EDID Structure Version & Revision: 1.4
  Vendor & Product Identification:
    Manufacturer: LGD
    Model: 1939
    Made in: 2023
  Basic Display Parameters & Features:
    Digital display
    Bits per primary color channel: 8
    DisplayPort interface
    Maximum image size: 37 cm x 23 cm
    Gamma: 2.20
    Supported color formats: RGB 4:4:4
    First detailed timing does not include the native pixel format and preferred refresh rate
    Display supports continuous frequencies
  Color Characteristics:
    Red  : 0.6796, 0.3212
    Green: 0.2587, 0.6933
    Blue : 0.1435, 0.0566
    White: 0.3134, 0.3291
  Established Timings I & II: none
  Standard Timings: none
  Detailed Timing Descriptors:
    DTD 1:  2560x1600   60.005405 Hz  16:10   102.849 kHz    279.750000 MHz (366 mm x 229 mm)
                 Hfront   48 Hsync  32 Hback   80 Hpol P
                 Vfront    3 Vsync   6 Vback  105 Vpol N
    Display Range Limits:
      Monitor ranges (Range Limits Only): 31-144 Hz V, 247-247 kHz H, max dotclock 680 MHz
    Alphanumeric Data String: 'LG DISPLAY'
    Alphanumeric Data String: 'LP170WQ2-SPD1'
  Extension blocks: 2
Checksum: 0xee

----------------

Block 1, CTA-861 Extension Block:
  Revision: 3
  Native DTDs: 0
  Colorimetry Data Block:
    BT2020RGB
  HDR Static Metadata Data Block:
    Electro optical transfer functions:
      Traditional gamma - SDR luminance range
    Supported static metadata descriptors:
      Static metadata type 1
    Desired content max luminance: 96 (400.000 cd/m^2)
    Desired content max frame-average luminance: 96 (400.000 cd/m^2)
    Desired content min luminance: 66 (0.268 cd/m^2)
Checksum: 0x94  Unused space in Extension Block: 112 bytes

----------------

Block 2, DisplayID Extension Block:
  Version: 2.0
  Extension Count: 0
  Display Product Primary Use Case: None of the listed primary use cases; generic display
  Video Timing Modes Type 7 - Detailed Timings Data Block:
    DTD:  2560x1600  144.002248 Hz  16:10   246.820 kHz    671.350000 MHz (aspect 16:10, no 3D stereo, preferred)
               Hfront   48 Hsync  32 Hback   80 Hpol P
               Vfront    3 Vsync   6 Vback  105 Vpol N
  Filler:
    00 00 00 00 00 00 00 00 00 00 00 00 00 00 00 00 '................'
    00 00 00 00 25 01 09 75 3e 0a 75 3e 0a 1f 90 80 '....%..u>.u>....'
    26 00 09 02 00 00 00 00 00 10 00 00 00 00 00 00 '&...............'
    00 00 00 00 00 00 00 00 00 00 00 00 00 00 00 00 '................'
    00 00 00 00 00 00 00 00 00 00 00 00 00 00 00 00 '................'
    00 00 00 00 00 00 00 00 00 00 00 00 00 00 00 00 '................'
    00 00                                           '..'
  Checksum: 0xa2
Checksum: 0x90

----------------

Warnings:

Block 0, Base EDID:
  Missing Display Product Name.
Block 1, CTA-861 Extension Block:
  IT Video Formats are overscanned by default, but normally this should be underscanned.
  Colorimetry Data Block: Set the sRGB colorimetry bit to avoid interop issues.
EDID:
  No Native Video Resolution was defined.
    Hint: set 'Native DTDs' to a non-0 value, or add a Native Video Resolution Data Block.
  Base EDID: Some timings are out of range of the Monitor Ranges:
    Horizontal Freq: 102.849 - 246.819 kHz (Monitor: 247.000 - 247.000 kHz)

Failures:

Block 1, CTA-861 Extension Block:
  Required 640x480p60 timings are missing in the established timings and the SVD list (VIC 1).
  Missing VCDB, needed for Set Selectable RGB Quantization to avoid interop issues.
Block 2, DisplayID Extension Block:
  Non-0 filler bytes in the DisplayID block.
EDID:
  Extension Block 3 started with EDID header, ignoring Extension Blocks >= 3.
  DisplayID: Missing DisplayID Display Parameters Data Block.

EDID conformity: FAIL
