edid-decode (hex):

00 ff ff ff ff ff ff 00 10 ac 16 40 36 31 31 47
30 11 01 03 80 40 28 78 28 85 85 a8 53 34 aa 25
12 50 54 00 00 00 01 01 01 01 01 01 01 01 01 01
01 01 01 01 01 01 bc 1b 00 a0 50 20 17 30 30 20
36 00 86 96 21 00 00 1a b0 68 00 a0 a0 40 2e 60
30 20 36 00 86 96 21 00 00 1e 00 00 00 fc 00 44
45 4c 4c 33 30 30 37 57 46 50 48 43 00 00 00 ff
00 59 57 32 35 38 37 42 54 47 31 31 36 0a 00 05

00 ff ff ff ff ff ff 00 10 ac 16 40 36 31 31 47
30 11 01 03 80 40 28 78 28 85 85 a8 53 34 aa 25
12 50 54 00 00 00 01 01 01 01 01 01 01 01 01 01
01 01 01 01 01 01 bc 1b 00 a0 50 20 17 30 30 20
36 00 86 96 21 00 00 1a b0 68 00 a0 a0 40 2e 60
30 20 36 00 86 96 21 00 00 1e 00 00 00 fc 00 44
45 4c 4c 33 30 30 37 57 46 50 48 43 00 00 00 ff
00 59 57 32 35 38 37 42 54 47 31 31 36 0a 00 05

----------------

Block 0, Base EDID:
  EDID Structure Version & Revision: 1.3
  Vendor & Product Identification:
    Manufacturer: DEL
    Model: 16406
    Serial Number: ...
    Made in: week 48 of 2007
  Basic Display Parameters & Features:
    Digital display
    Maximum image size: 64 cm x 40 cm
    Gamma: 2.20
    DPMS levels: Off
    RGB color display
  Color Characteristics:
    Red  : 0.6582, 0.3242
    Green: 0.2041, 0.6650
    Blue : 0.1464, 0.0703
    White: 0.3134, 0.3291
  Established Timings I & II: none
  Standard Timings: none
  Detailed Timing Descriptors:
    DTD 1:  1280x800    59.909545 Hz  16:10    49.306 kHz     71.000000 MHz (646 mm x 406 mm)
                 Hfront   48 Hsync  32 Hback   80 Hpol P
                 Vfront    3 Vsync   6 Vback   14 Vpol N
    DTD 2:  2560x1600   59.859910 Hz  16:10    98.529 kHz    268.000000 MHz (646 mm x 406 mm)
                 Hfront   48 Hsync  32 Hback   80 Hpol P
                 Vfront    3 Vsync   6 Vback   37 Vpol P
    Display Product Name: 'DELL3007WFPHC'
    Display Product Serial Number: ...
Checksum: 0x05

----------------

Warnings:

EDID:
  No Native Video Resolution was defined.

Failures:

Block 0, Base EDID:
  Basic Display Parameters & Features: EDID 1.3 requires that the first detailed timing is the preferred timing.
  Missing Display Range Limits Descriptor.
EDID:
  Extension Block 1 started with EDID header, ignoring Extension Blocks >= 1.

EDID conformity: FAIL
