edid-decode (hex):

00 ff ff ff ff ff ff 00 60 a3 ff ff 00 00 00 00
0c 23 01 04 b5 3c 22 78 bb 50 e5 ac 51 47 a2 24
12 50 54 a5 48 00 01 01 a9 c0 71 4f 01 01 01 01
01 01 01 01 01 01 ac 35 80 a0 70 38 15 40 30 20
35 00 56 50 21 00 00 1e 00 00 00 ff 00 0a 20 20
20 20 20 20 20 20 20 20 20 20 00 00 00 fc 00 45
53 2d 32 37 46 32 0a 20 20 20 20 20 00 00 00 fd
00 3c 78 24 87 1e 00 0a 20 20 20 20 20 20 01 f2

02 03 23 35 49 01 00 00 00 90 04 02 03 3f 68 1a
00 00 01 01 3c 78 00 e3 05 e0 01 e4 06 07 01 60
e2 00 cf 18 43 80 a0 70 38 15 40 30 20 35 00 56
50 21 00 00 1e 59 6b 80 a0 70 38 15 40 30 20 35
00 56 50 21 00 00 1e 75 59 80 a0 70 38 15 40 30
20 35 00 56 50 21 00 00 1e 00 00 00 00 00 00 00
00 00 00 00 00 00 00 00 00 00 00 00 00 00 00 00
00 00 00 00 00 00 00 00 00 00 00 00 00 00 00 fb

00 ff ff ff ff ff ff 00 60 a3 ff ff 00 00 00 00
0c 23 01 04 b5 3c 22 78 bb 50 e5 ac 51 47 a2 24
12 50 54 a5 48 00 01 01 a9 c0 71 4f 01 01 01 01
01 01 01 01 01 01 ac 35 80 a0 70 38 15 40 30 20
35 00 56 50 21 00 00 1e 00 00 00 ff 00 0a 20 20
20 20 20 20 20 20 20 20 20 20 00 00 00 fc 00 45
53 2d 32 37 46 32 0a 20 20 20 20 20 00 00 00 fd
00 3c 78 24 87 1e 00 0a 20 20 20 20 20 20 01 f2

02 03 23 35 49 01 00 00 00 90 04 02 03 3f 68 1a
00 00 01 01 3c 78 00 e3 05 e0 01 e4 06 07 01 60
e2 00 cf 18 43 80 a0 70 38 15 40 30 20 35 00 56
50 21 00 00 1e 59 6b 80 a0 70 38 15 40 30 20 35
00 56 50 21 00 00 1e 75 59 80 a0 70 38 15 40 30
20 35 00 56 50 21 00 00 1e 00 00 00 00 00 00 00
00 00 00 00 00 00 00 00 00 00 00 00 00 00 00 00
00 00 00 00 00 00 00 00 00 00 00 00 00 00 00 fb

----------------

Block 0, Base EDID:
  EDID Structure Version & Revision: 1.4
  Vendor & Product Identification:
    Manufacturer: XEC
    Model: 65535
    Made in: week 12 of 2025
  Basic Display Parameters & Features:
    Digital display
    Bits per primary color channel: 10
    DisplayPort interface
    Maximum image size: 60 cm x 34 cm
    Gamma: 2.20
    DPMS levels: Standby Off
    Supported color formats: RGB 4:4:4, YCrCb 4:4:4, YCrCb 4:2:2
    First detailed timing includes the native pixel format and preferred refresh rate
    Display supports continuous frequencies
  Color Characteristics:
    Red  : 0.6728, 0.3173
    Green: 0.2773, 0.6328
    Blue : 0.1435, 0.0722
    White: 0.3134, 0.3291
  Established Timings I & II:
    IBM     :   720x400    70.081663 Hz   9:5     31.467 kHz     28.320000 MHz
    DMT 0x04:   640x480    59.940476 Hz   4:3     31.469 kHz     25.175000 MHz
    DMT 0x06:   640x480    75.000000 Hz   4:3     37.500 kHz     31.500000 MHz
    DMT 0x09:   800x600    60.316541 Hz   4:3     37.879 kHz     40.000000 MHz
    DMT 0x0b:   800x600    75.000000 Hz   4:3     46.875 kHz     49.500000 MHz
    DMT 0x10:  1024x768    60.003840 Hz   4:3     48.363 kHz     65.000000 MHz
  Standard Timings:
    DMT 0x53:  1600x900    60.000000 Hz  16:9     60.000 kHz    108.000000 MHz (RB)
    DMT 0x15:  1152x864    75.000000 Hz   4:3     67.500 kHz    108.000000 MHz
  Detailed Timing Descriptors:
    DTD 1:  1920x1080   59.997904 Hz  16:9     66.058 kHz    137.400000 MHz (598 mm x 336 mm)
                 Hfront   48 Hsync  32 Hback   80 Hpol P
                 Vfront    3 Vsync   5 Vback   13 Vpol P
    Display Product Serial Number: ...
    Display Product Name: 'ES-27F2'
    Display Range Limits:
      Monitor ranges (GTF): 60-120 Hz V, 36-135 kHz H, max dotclock 300 MHz
  Extension blocks: 1
Checksum: 0xf2

----------------

Block 1, CTA-861 Extension Block:
  Revision: 3
  Supports YCbCr 4:4:4
  Supports YCbCr 4:2:2
  Native DTDs: 5
  Video Data Block:
    VIC   1:   640x480    59.940476 Hz   4:3     31.469 kHz     25.175000 MHz
    VIC  16:  1920x1080   60.000000 Hz  16:9     67.500 kHz    148.500000 MHz (native)
    VIC   4:  1280x720    60.000000 Hz  16:9     45.000 kHz     74.250000 MHz
    VIC   2:   720x480    59.940060 Hz   4:3     31.469 kHz     27.000000 MHz
    VIC   3:   720x480    59.940060 Hz  16:9     31.469 kHz     27.000000 MHz
    VIC  63:  1920x1080  120.000000 Hz  16:9    135.000 kHz    297.000000 MHz
  Vendor-Specific Data Block (AMD), OUI 00-00-1A:
    Version: 1
    Flags 1: 0x01
      FreeSync Supported
    Minimum Refresh Rate: 60 Hz
    Maximum Refresh Rate: 120 Hz
  Colorimetry Data Block:
    BT2020cYCC
    BT2020YCC
    BT2020RGB
    Gamut Boundary Description Metadata Profile P0
  HDR Static Metadata Data Block:
    Electro optical transfer functions:
      Traditional gamma - SDR luminance range
      Traditional gamma - HDR luminance range
      SMPTE ST2084
    Supported static metadata descriptors:
      Static metadata type 1
    Desired content max luminance: 96 (400.000 cd/m^2)
  Video Capability Data Block:
    YCbCr quantization: Selectable (via AVI YQ)
    RGB quantization: Selectable (via AVI Q)
    PT scan behavior: No Data
    IT scan behavior: Supports both over- and underscan
    CE scan behavior: Supports both over- and underscan
  Detailed Timing Descriptors:
    DTD 2:  1920x1080   75.001747 Hz  16:9     82.577 kHz    171.760000 MHz (598 mm x 336 mm)
                 Hfront   48 Hsync  32 Hback   80 Hpol P
                 Vfront    3 Vsync   5 Vback   13 Vpol P
    DTD 3:  1920x1080  120.000175 Hz  16:9    132.120 kHz    274.810000 MHz (598 mm x 336 mm)
                 Hfront   48 Hsync  32 Hback   80 Hpol P
                 Vfront    3 Vsync   5 Vback   13 Vpol P
    DTD 4:  1920x1080  100.000873 Hz  16:9    110.101 kHz    229.010000 MHz (598 mm x 336 mm)
                 Hfront   48 Hsync  32 Hback   80 Hpol P
                 Vfront    3 Vsync   5 Vback   13 Vpol P
Checksum: 0xfb  Unused space in Extension Block: 38 bytes

----------------

Warnings:

Block 0, Base EDID:
  Display Range Limits: GTF support is deprecated in EDID 1.4.
Block 1, CTA-861 Extension Block:
  IT Video Formats are overscanned by default, but normally this should be underscanned.
  Video Data Block: VIC 1 and the first DTD are not identical. Is this intended?
  Colorimetry Data Block: Set the sRGB colorimetry bit to avoid interop issues.
EDID:
  Base EDID: Some timings are out of range of the Monitor Ranges:
    Horizontal Freq: 31.466 - 135.000 kHz (Monitor: 36.000 - 135.000 kHz)

Failures:

Block 0, Base EDID:
  Display Product Serial Number: ...
Block 1, CTA-861 Extension Block:
  There are more Native DTDs (5) than DTDs (4).
EDID:
  Extension Block 2 started with EDID header, ignoring Extension Blocks >= 2.

EDID conformity: FAIL
