edid-decode (hex):

00 ff ff ff ff ff ff 00 60 a3 ff ff 00 00 00 00
23 20 01 04 a5 3c 22 78 3b b6 e0 a3 56 50 a0 27
0e 50 54 bf ef 00 81 80 81 bc 95 00 95 3c b3 00
b3 3c d1 c0 01 01 02 3a 80 18 71 38 2d 40 58 2c
45 00 55 50 21 00 00 1e 00 00 00 ff 00 30 30 30
30 30 30 30 30 30 30 30 30 31 00 00 00 fd 00 30
f0 ff ff 3c 01 0a 20 20 20 20 20 20 00 00 00 fc
00 45 53 2d 32 37 47 32 00 20 20 20 20 20 01 bb

02 03 22 f1 4c 01 03 10 3f 04 13 1f 12 02 11 90
45 23 09 07 07 83 01 00 00 68 1a 00 00 01 01 30
f0 00 7e 97 80 a0 70 38 32 40 30 20 35 00 56 89
21 00 00 1e 36 84 80 a0 70 38 32 40 18 20 35 00
20 2f 21 00 00 1e 96 e0 80 c8 70 38 32 40 30 40
35 00 ba 89 21 00 00 1a 88 74 80 18 71 38 32 40
30 20 35 00 56 53 21 00 00 1a 66 21 56 aa 51 00
1e 30 46 8f 33 00 ba 89 21 00 00 1e 00 00 00 13

00 ff ff ff ff ff ff 00 60 a3 ff ff 00 00 00 00
23 20 01 04 a5 3c 22 78 3b b6 e0 a3 56 50 a0 27
0e 50 54 bf ef 00 81 80 81 bc 95 00 95 3c b3 00
b3 3c d1 c0 01 01 02 3a 80 18 71 38 2d 40 58 2c
45 00 55 50 21 00 00 1e 00 00 00 ff 00 30 30 30
30 30 30 30 30 30 30 30 30 31 00 00 00 fd 00 30
f0 ff ff 3c 01 0a 20 20 20 20 20 20 00 00 00 fc
00 45 53 2d 32 37 47 32 00 20 20 20 20 20 01 bb

02 03 22 f1 4c 01 03 10 3f 04 13 1f 12 02 11 90
45 23 09 07 07 83 01 00 00 68 1a 00 00 01 01 30
f0 00 7e 97 80 a0 70 38 32 40 30 20 35 00 56 89
21 00 00 1e 36 84 80 a0 70 38 32 40 18 20 35 00
20 2f 21 00 00 1e 96 e0 80 c8 70 38 32 40 30 40
35 00 ba 89 21 00 00 1a 88 74 80 18 71 38 32 40
30 20 35 00 56 53 21 00 00 1a 66 21 56 aa 51 00
1e 30 46 8f 33 00 ba 89 21 00 00 1e 00 00 00 13

----------------

Block 0, Base EDID:
  EDID Structure Version & Revision: 1.4
  Vendor & Product Identification:
    Manufacturer: XEC
    Model: 65535
    Made in: week 35 of 2022
  Basic Display Parameters & Features:
    Digital display
    Bits per primary color channel: 8
    DisplayPort interface
    Maximum image size: 60 cm x 34 cm
    Gamma: 2.20
    DPMS levels: Off
    Supported color formats: RGB 4:4:4, YCrCb 4:4:4, YCrCb 4:2:2
    First detailed timing includes the native pixel format and preferred refresh rate
    Display supports continuous frequencies
  Color Characteristics:
    Red  : 0.6386, 0.3388
    Green: 0.3134, 0.6269
    Blue : 0.1552, 0.0566
    White: 0.3125, 0.3281
  Established Timings I & II:
    IBM     :   720x400    70.081663 Hz   9:5     31.467 kHz     28.320000 MHz
    DMT 0x04:   640x480    59.940476 Hz   4:3     31.469 kHz     25.175000 MHz
    Apple   :   640x480    66.666667 Hz   4:3     35.000 kHz     30.240000 MHz
    DMT 0x05:   640x480    72.808802 Hz   4:3     37.861 kHz     31.500000 MHz
    DMT 0x06:   640x480    75.000000 Hz   4:3     37.500 kHz     31.500000 MHz
    DMT 0x08:   800x600    56.250000 Hz   4:3     35.156 kHz     36.000000 MHz
    DMT 0x09:   800x600    60.316541 Hz   4:3     37.879 kHz     40.000000 MHz
    DMT 0x0a:   800x600    72.187572 Hz   4:3     48.077 kHz     50.000000 MHz
    DMT 0x0b:   800x600    75.000000 Hz   4:3     46.875 kHz     49.500000 MHz
    Apple   :   832x624    74.551266 Hz   4:3     49.726 kHz     57.284000 MHz
    DMT 0x10:  1024x768    60.003840 Hz   4:3     48.363 kHz     65.000000 MHz
    DMT 0x11:  1024x768    70.069359 Hz   4:3     56.476 kHz     75.000000 MHz
    DMT 0x12:  1024x768    75.028582 Hz   4:3     60.023 kHz     78.750000 MHz
    DMT 0x24:  1280x1024   75.024675 Hz   5:4     79.976 kHz    135.000000 MHz
  Standard Timings:
    DMT 0x23:  1280x1024   60.019740 Hz   5:4     63.981 kHz    108.000000 MHz
    GTF     :  1280x1024  120.000185 Hz   5:4    131.640 kHz    233.793000 MHz
    DMT 0x2f:  1440x900    59.887445 Hz  16:10    55.935 kHz    106.500000 MHz
    GTF     :  1440x900   119.999896 Hz  16:10   115.800 kHz    229.747000 MHz
    DMT 0x3a:  1680x1050   59.954250 Hz  16:10    65.290 kHz    146.250000 MHz
    GTF     :  1680x1050  120.000000 Hz  16:10   135.000 kHz    313.200000 MHz
    DMT 0x52:  1920x1080   60.000000 Hz  16:9     67.500 kHz    148.500000 MHz
  Detailed Timing Descriptors:
    DTD  1:  1920x1080   60.000000 Hz  16:9     67.500 kHz    148.500000 MHz (597 mm x 336 mm)
                  Hfront   88 Hsync  44 Hback  148 Hpol P
                  Vfront    4 Vsync   5 Vback   36 Vpol P
    Display Product Serial Number: ...
    Display Range Limits:
      Monitor ranges (Range Limits Only): 48-240 Hz V, 255-255 kHz H, max dotclock 600 MHz
    Display Product Name: 'ES-27G2'
  Extension blocks: 1
Checksum: 0xbb

----------------

Block 1, CTA-861 Extension Block:
  Revision: 3
  Underscans IT Video Formats by default
  Basic audio support
  Supports YCbCr 4:4:4
  Supports YCbCr 4:2:2
  Native detailed modes: 1
  Video Data Block:
    VIC   1:   640x480    59.940476 Hz   4:3     31.469 kHz     25.175000 MHz
    VIC   3:   720x480    59.940060 Hz  16:9     31.469 kHz     27.000000 MHz
    VIC  16:  1920x1080   60.000000 Hz  16:9     67.500 kHz    148.500000 MHz
    VIC  63:  1920x1080  120.000000 Hz  16:9    135.000 kHz    297.000000 MHz
    VIC   4:  1280x720    60.000000 Hz  16:9     45.000 kHz     74.250000 MHz
    VIC  19:  1280x720    50.000000 Hz  16:9     37.500 kHz     74.250000 MHz
    VIC  31:  1920x1080   50.000000 Hz  16:9     56.250 kHz    148.500000 MHz
    VIC  18:   720x576    50.000000 Hz  16:9     31.250 kHz     27.000000 MHz
    VIC   2:   720x480    59.940060 Hz   4:3     31.469 kHz     27.000000 MHz
    VIC  17:   720x576    50.000000 Hz   4:3     31.250 kHz     27.000000 MHz
    VIC  16:  1920x1080   60.000000 Hz  16:9     67.500 kHz    148.500000 MHz (native)
    VIC  69:  1280x720    60.000000 Hz  64:27    45.000 kHz     74.250000 MHz
  Audio Data Block:
    Linear PCM:
      Max channels: 2
      Supported sample rates (kHz): 48 44.1 32
      Supported sample sizes (bits): 24 20 16
  Speaker Allocation Data Block:
    FL/FR - Front Left/Right
  Vendor-Specific Data Block (AMD), OUI 00-00-1A:
    Version: 1
    Feature Caps: 0x01
    Minimum Refresh Rate: 48 Hz
    Maximum Refresh Rate: 240 Hz
    Flags 1.x: 0x00
  Detailed Timing Descriptors:
    DTD  2:  1920x1080  165.001702 Hz  16:9    186.452 kHz    387.820000 MHz (598 mm x 393 mm)
                  Hfront   48 Hsync  32 Hback   80 Hpol P
                  Vfront    3 Vsync   5 Vback   42 Vpol P
    DTD  3:  1920x1080  144.001021 Hz  16:9    162.721 kHz    338.460000 MHz (544 mm x 303 mm)
                  Hfront   24 Hsync  32 Hback  104 Hpol P
                  Vfront    3 Vsync   5 Vback   42 Vpol P
    DTD  4:  1920x1080  239.998330 Hz  16:9    271.198 kHz    574.940000 MHz (698 mm x 393 mm)
                  Hfront   48 Hsync  64 Hback   88 Hpol P
                  Vfront    3 Vsync   5 Vback   42 Vpol N
    DTD  5:  1920x1080  120.000000 Hz  16:9    135.600 kHz    298.320000 MHz (598 mm x 339 mm)
                  Hfront   48 Hsync  32 Hback  200 Hpol P
                  Vfront    3 Vsync   5 Vback   42 Vpol N
    DTD  6:  1366x768    59.789541 Hz 683:384   47.712 kHz     85.500000 MHz (698 mm x 393 mm)
                  Hfront   70 Hsync 143 Hback  213 Hpol P
                  Vfront    3 Vsync   3 Vback   24 Vpol P
Checksum: 0x13  Unused space in Extension Block: 3 bytes

----------------

Block 2, Unknown EDID Extension Block 0x00:
  00 ff ff ff ff ff ff 00 60 a3 ff ff 00 00 00 00 '........`.......'
  23 20 01 04 a5 3c 22 78 3b b6 e0 a3 56 50 a0 27 '# ...<"x;...VP.''
  0e 50 54 bf ef 00 81 80 81 bc 95 00 95 3c b3 00 '.PT..........<..'
  b3 3c d1 c0 01 01 02 3a 80 18 71 38 2d 40 58 2c '.<.....:..q8-@X,'
  45 00 55 50 21 00 00 1e 00 00 00 ff 00 30 30 30 'E.UP!........000'
  30 30 30 30 30 30 30 30 30 31 00 00 00 fd 00 30 '0000000001.....0'
  f0 ff ff 3c 01 0a 20 20 20 20 20 20 00 00 00 fc '...<..      ....'
  00 45 53 2d 32 37 47 32 00 20 20 20 20 20 01 bb '.ES-27G2.     ..'
Checksum: 0xbb

----------------

Block 3, CTA-861 Extension Block:
  Revision: 3
  Underscans IT Video Formats by default
  Basic audio support
  Supports YCbCr 4:4:4
  Supports YCbCr 4:2:2
  Native detailed modes: 1
  Video Data Block:
    VIC   1:   640x480    59.940476 Hz   4:3     31.469 kHz     25.175000 MHz
    VIC   3:   720x480    59.940060 Hz  16:9     31.469 kHz     27.000000 MHz
    VIC  16:  1920x1080   60.000000 Hz  16:9     67.500 kHz    148.500000 MHz
    VIC  63:  1920x1080  120.000000 Hz  16:9    135.000 kHz    297.000000 MHz
    VIC   4:  1280x720    60.000000 Hz  16:9     45.000 kHz     74.250000 MHz
    VIC  19:  1280x720    50.000000 Hz  16:9     37.500 kHz     74.250000 MHz
    VIC  31:  1920x1080   50.000000 Hz  16:9     56.250 kHz    148.500000 MHz
    VIC  18:   720x576    50.000000 Hz  16:9     31.250 kHz     27.000000 MHz
    VIC   2:   720x480    59.940060 Hz   4:3     31.469 kHz     27.000000 MHz
    VIC  17:   720x576    50.000000 Hz   4:3     31.250 kHz     27.000000 MHz
    VIC  16:  1920x1080   60.000000 Hz  16:9     67.500 kHz    148.500000 MHz (native)
    VIC  69:  1280x720    60.000000 Hz  64:27    45.000 kHz     74.250000 MHz
  Audio Data Block:
    Linear PCM:
      Max channels: 2
      Supported sample rates (kHz): 48 44.1 32
      Supported sample sizes (bits): 24 20 16
  Speaker Allocation Data Block:
    FL/FR - Front Left/Right
  Vendor-Specific Data Block (AMD), OUI 00-00-1A:
    Version: 1
    Feature Caps: 0x01
    Minimum Refresh Rate: 48 Hz
    Maximum Refresh Rate: 240 Hz
    Flags 1.x: 0x00
  Detailed Timing Descriptors:
    DTD  7:  1920x1080  165.001702 Hz  16:9    186.452 kHz    387.820000 MHz (598 mm x 393 mm)
                  Hfront   48 Hsync  32 Hback   80 Hpol P
                  Vfront    3 Vsync   5 Vback   42 Vpol P
    DTD  8:  1920x1080  144.001021 Hz  16:9    162.721 kHz    338.460000 MHz (544 mm x 303 mm)
                  Hfront   24 Hsync  32 Hback  104 Hpol P
                  Vfront    3 Vsync   5 Vback   42 Vpol P
    DTD  9:  1920x1080  239.998330 Hz  16:9    271.198 kHz    574.940000 MHz (698 mm x 393 mm)
                  Hfront   48 Hsync  64 Hback   88 Hpol P
                  Vfront    3 Vsync   5 Vback   42 Vpol N
    DTD 10:  1920x1080  120.000000 Hz  16:9    135.600 kHz    298.320000 MHz (598 mm x 339 mm)
                  Hfront   48 Hsync  32 Hback  200 Hpol P
                  Vfront    3 Vsync   5 Vback   42 Vpol N
    DTD 11:  1366x768    59.789541 Hz 683:384   47.712 kHz     85.500000 MHz (698 mm x 393 mm)
                  Hfront   70 Hsync 143 Hback  213 Hpol P
                  Vfront    3 Vsync   3 Vback   24 Vpol P
Checksum: 0x13  Unused space in Extension Block: 3 bytes

----------------

Warnings:

Block 0, Base EDID:
  Display Product Serial Number: ...
Block 1, CTA-861 Extension Block:
  Video Data Block: VIC 1 and the first DTD are not identical. Is this intended?
  Detailed Timing Descriptor #2: Image size is 598x393 mm, but based on the picture AR it should be 598x336 mm.
  Add a Colorimetry Data Block with the sRGB colorimetry bit set to avoid interop issues.
Block 3, CTA-861 Extension Block:
  Detailed Timing Descriptor #7: Image size is 598x393 mm, but based on the picture AR it should be 598x336 mm.
EDID:
  Base EDID: Some timings are out of range of the Monitor Ranges:
    Horizontal Freq: 31.250 - 271.198 kHz (Monitor: 255.000 - 255.000 kHz)
  CTA-861: Multiple native progressive timings are defined.

Failures:

Block 0, Base EDID:
  Display Product Name: NUL byte at position 7.
Block 1, CTA-861 Extension Block:
  Video Data Block: Duplicate VIC 16.
  Detailed Timing Descriptor #2: Mismatch of image size 598x393 mm vs display size 600x340 mm.
  Detailed Timing Descriptor #3: Mismatch of image size 544x303 mm vs display size 600x340 mm.
  Detailed Timing Descriptor #4: Mismatch of image size 698x393 mm vs display size 600x340 mm.
  Detailed Timing Descriptor #6: Mismatch of image size 698x393 mm vs display size 600x340 mm.
  Missing VCDB, needed for Set Selectable RGB Quantization to avoid interop issues.
Block 2, Base EDID:
  Unknown Extension Block.
Block 3, CTA-861 Extension Block:
  Video Data Block: Duplicate VIC 1.
  Video Data Block: Duplicate VIC 3.
  Video Data Block: Duplicate VIC 63.
  Video Data Block: Duplicate VIC 4.
  Video Data Block: Duplicate VIC 19.
  Video Data Block: Duplicate VIC 31.
  Video Data Block: Duplicate VIC 18.
  Video Data Block: Duplicate VIC 2.
  Video Data Block: Duplicate VIC 17.
  Video Data Block: Duplicate VIC 69.
  Speaker Allocation Data Block: Only one instance of this Data Block is allowed.
  Detailed Timing Descriptor #7: Mismatch of image size 598x393 mm vs display size 600x340 mm.
  Detailed Timing Descriptor #8: Mismatch of image size 544x303 mm vs display size 600x340 mm.
  Detailed Timing Descriptor #9: Mismatch of image size 698x393 mm vs display size 600x340 mm.
  Detailed Timing Descriptor #11: Mismatch of image size 698x393 mm vs display size 600x340 mm.
EDID:
  Base EDID: The DTD max image size is 698x393mm, which is larger than the display size 600.0x340.0mm.
  Base EDID: EDID specified 1 extension block(s), but found 3 extension block(s).

EDID conformity: FAIL
