edid-decode (hex):

00 ff ff ff ff ff ff 00 09 e5 f5 06 00 00 00 00
01 1a 01 04 95 22 13 78 0a 00 10 a7 57 51 a1 27
10 50 54 00 00 00 01 01 01 01 01 01 01 01 01 01
01 01 01 01 01 01 9c 3b 80 36 71 38 3c 40 30 20
36 00 58 c2 10 00 00 1a fd 2d 80 0e 71 38 28 40
30 20 36 00 58 c2 10 00 00 1a 00 00 00 fe 00 4d
48 36 4b 39 80 4e 56 31 35 41 32 32 00 00 00 00
00 00 41 22 9e 00 10 00 00 0a 01 0a 20 20 00 d5

00 ff ff ff ff ff ff 00 09 e5 f5 06 00 00 00 00
01 1a 01 04 95 22 13 78 0a 00 10 a7 57 51 a1 27
10 50 54 00 00 00 01 01 01 01 01 01 01 01 01 01
01 01 01 01 01 01 9c 3b 80 36 71 38 3c 40 30 20
36 00 58 c2 10 00 00 1a fd 2d 80 0e 71 38 28 40
30 20 36 00 58 c2 10 00 00 1a 00 00 00 fe 00 4d
48 36 4b 39 80 4e 56 31 35 41 32 32 00 00 00 00
00 00 41 22 9e 00 10 00 00 0a 01 0a 20 20 00 d5

----------------

Block 0, Base EDID:
  EDID Structure Version & Revision: 1.4
  Vendor & Product Identification:
    Manufacturer: BOE
    Model: 1781
    Made in: week 1 of 2016
  Basic Display Parameters & Features:
    Digital display
    Bits per primary color channel: 6
    DisplayPort interface
    Maximum image size: 34 cm x 19 cm
    Gamma: 2.20
    Supported color formats: RGB 4:4:4, YCrCb 4:4:4
    First detailed timing includes the native pixel format and preferred refresh rate
  Color Characteristics:
    Red  : 0.6523, 0.3398
    Green: 0.3164, 0.6289
    Blue : 0.1523, 0.0634
    White: 0.3125, 0.3281
  Established Timings I & II: none
  Standard Timings: none
  Detailed Timing Descriptors:
    DTD 1:  1920x1080   60.026748 Hz  16:9     68.430 kHz    152.600000 MHz (344 mm x 194 mm)
                 Hfront   48 Hsync  32 Hback  230 Hpol P
                 Vfront    3 Vsync   6 Vback   51 Vpol N
    DTD 2:  1920x1080   47.998206 Hz  16:9     53.758 kHz    117.730000 MHz (344 mm x 194 mm)
                 Hfront   48 Hsync  32 Hback  190 Hpol P
                 Vfront    3 Vsync   6 Vback   31 Vpol N
    Alphanumeric Data String: 'MH6K9.NV15A22'
    Manufacturer-Specified Display Descriptor (0x00): 00 00 00 00 41 22 9e 00 10 00 00 0a 01 0a 20 20 '....A"........  '
Checksum: 0xd5

----------------

Warnings:

Block 0, Base EDID:
  Alphanumeric Data String: Non-ASCII character 0x80 at position 5, can cause problems.
  Missing Display Product Name.

Failures:

EDID:
  Extension Block 1 started with EDID header, ignoring Extension Blocks >= 1.

EDID conformity: FAIL
