edid-decode (hex):

00 ff ff ff ff ff ff 00 26 cd 16 76 39 00 00 00
03 1f 01 03 80 46 27 78 2e 76 75 a7 54 50 9b 26
12 50 54 bf ef 00 d1 c0 81 80 31 68 31 7c 45 68
45 7c 61 68 61 7c 56 5e 00 a0 a0 a0 29 50 30 20
35 00 b9 88 21 00 00 1e a0 73 00 6a a0 a0 29 50
08 20 35 00 b9 88 21 00 00 1a 00 00 00 fc 00 50
4c 33 32 36 36 51 0a 20 20 20 20 20 00 00 00 fd
00 30 4b 1e a0 22 00 0a 20 20 20 20 20 20 01 a6

02 03 48 f1 4b 10 1f 05 14 04 13 03 12 02 11 01
23 09 07 07 83 01 00 00 e2 00 d5 67 03 0c 00 11
00 38 44 67 d8 5d c4 01 78 80 03 6d 1a 00 00 02
01 30 4b e6 00 00 00 00 00 e3 05 c3 01 e3 0f 00
18 e6 06 07 01 66 66 2c 02 3a 80 18 71 38 2d 40
58 2c 45 00 b9 88 21 00 00 1e f0 3c 00 d0 51 a0
35 50 60 88 3a 00 b9 88 21 00 00 1c 00 00 00 00
00 00 00 00 00 00 00 00 00 00 00 00 00 00 00 49

00 ff ff ff ff ff ff 00 26 cd 16 76 39 00 00 00
03 1f 01 03 80 46 27 78 2e 76 75 a7 54 50 9b 26
12 50 54 bf ef 00 d1 c0 81 80 31 68 31 7c 45 68
45 7c 61 68 61 7c 56 5e 00 a0 a0 a0 29 50 30 20
35 00 b9 88 21 00 00 1e a0 73 00 6a a0 a0 29 50
08 20 35 00 b9 88 21 00 00 1a 00 00 00 fc 00 50
4c 33 32 36 36 51 0a 20 20 20 20 20 00 00 00 fd
00 30 4b 1e a0 22 00 0a 20 20 20 20 20 20 01 a6

02 03 48 f1 4b 10 1f 05 14 04 13 03 12 02 11 01
23 09 07 07 83 01 00 00 e2 00 d5 67 03 0c 00 11
00 38 44 67 d8 5d c4 01 78 80 03 6d 1a 00 00 02
01 30 4b e6 00 00 00 00 00 e3 05 c3 01 e3 0f 00
18 e6 06 07 01 66 66 2c 02 3a 80 18 71 38 2d 40
58 2c 45 00 b9 88 21 00 00 1e f0 3c 00 d0 51 a0
35 50 60 88 3a 00 b9 88 21 00 00 1c 00 00 00 00
00 00 00 00 00 00 00 00 00 00 00 00 00 00 00 49

----------------

Block 0, Base EDID:
  EDID Structure Version & Revision: 1.3
  Vendor & Product Identification:
    Manufacturer: IVM
    Model: 30230
    Serial Number: ...
    Made in: week 3 of 2021
  Basic Display Parameters & Features:
    Digital display
    Maximum image size: 70 cm x 39 cm
    Gamma: 2.20
    DPMS levels: Off
    RGB color display
    Default (sRGB) color space is primary color space
    First detailed timing is the preferred timing
  Color Characteristics:
    Red  : 0.6533, 0.3310
    Green: 0.3134, 0.6074
    Blue : 0.1494, 0.0732
    White: 0.3134, 0.3291
  Established Timings I & II:
    IBM     :   720x400    70.081663 Hz   9:5     31.467 kHz     28.320000 MHz
    DMT 0x04:   640x480    59.940476 Hz   4:3     31.469 kHz     25.175000 MHz
    Apple   :   640x480    66.666667 Hz   4:3     35.000 kHz     30.240000 MHz
    DMT 0x05:   640x480    72.808802 Hz   4:3     37.861 kHz     31.500000 MHz
    DMT 0x06:   640x480    75.000000 Hz   4:3     37.500 kHz     31.500000 MHz
    DMT 0x08:   800x600    56.250000 Hz   4:3     35.156 kHz     36.000000 MHz
    DMT 0x09:   800x600    60.316541 Hz   4:3     37.879 kHz     40.000000 MHz
    DMT 0x0a:   800x600    72.187572 Hz   4:3     48.077 kHz     50.000000 MHz
    DMT 0x0b:   800x600    75.000000 Hz   4:3     46.875 kHz     49.500000 MHz
    Apple   :   832x624    74.551266 Hz   4:3     49.726 kHz     57.284000 MHz
    DMT 0x10:  1024x768    60.003840 Hz   4:3     48.363 kHz     65.000000 MHz
    DMT 0x11:  1024x768    70.069359 Hz   4:3     56.476 kHz     75.000000 MHz
    DMT 0x12:  1024x768    75.028582 Hz   4:3     60.023 kHz     78.750000 MHz
    DMT 0x24:  1280x1024   75.024675 Hz   5:4     79.976 kHz    135.000000 MHz
  Standard Timings:
    DMT 0x52:  1920x1080   60.000000 Hz  16:9     67.500 kHz    148.500000 MHz
    DMT 0x23:  1280x1024   60.019740 Hz   5:4     63.981 kHz    108.000000 MHz
    GTF     :   640x480    99.999537 Hz   4:3     50.900 kHz     43.163000 MHz
    GTF     :   640x480   119.999084 Hz   4:3     61.800 kHz     52.406000 MHz
    GTF     :   800x600    99.999707 Hz   4:3     63.600 kHz     68.179000 MHz
    GTF     :   800x600   119.999886 Hz   4:3     77.160 kHz     83.950000 MHz
    GTF     :  1024x768   100.000177 Hz   4:3     81.400 kHz    113.309000 MHz
    GTF     :  1024x768   119.999931 Hz   4:3     98.760 kHz    139.054000 MHz
  Detailed Timing Descriptors:
    DTD 1:  2560x1440   59.950550 Hz  16:9     88.787 kHz    241.500000 MHz (697 mm x 392 mm)
                 Hfront   48 Hsync  32 Hback   80 Hpol P
                 Vfront    3 Vsync   5 Vback   33 Vpol P
    DTD 2:  2560x1440   74.968101 Hz  16:9    111.028 kHz    296.000000 MHz (697 mm x 392 mm)
                 Hfront    8 Hsync  32 Hback   66 Hpol P
                 Vfront    3 Vsync   5 Vback   33 Vpol N
    Display Product Name: 'PL3266Q'
    Display Range Limits:
      Monitor ranges (GTF): 48-75 Hz V, 30-160 kHz H, max dotclock 340 MHz
  Extension blocks: 1
Checksum: 0xa6

----------------

Block 1, CTA-861 Extension Block:
  Revision: 3
  Underscans IT Video Formats by default
  Basic audio support
  Supports YCbCr 4:4:4
  Supports YCbCr 4:2:2
  Native detailed modes: 1
  Video Data Block:
    VIC  16:  1920x1080   60.000000 Hz  16:9     67.500 kHz    148.500000 MHz
    VIC  31:  1920x1080   50.000000 Hz  16:9     56.250 kHz    148.500000 MHz
    VIC   5:  1920x1080i  60.000000 Hz  16:9     33.750 kHz     74.250000 MHz
    VIC  20:  1920x1080i  50.000000 Hz  16:9     28.125 kHz     74.250000 MHz
    VIC   4:  1280x720    60.000000 Hz  16:9     45.000 kHz     74.250000 MHz
    VIC  19:  1280x720    50.000000 Hz  16:9     37.500 kHz     74.250000 MHz
    VIC   3:   720x480    59.940060 Hz  16:9     31.469 kHz     27.000000 MHz
    VIC  18:   720x576    50.000000 Hz  16:9     31.250 kHz     27.000000 MHz
    VIC   2:   720x480    59.940060 Hz   4:3     31.469 kHz     27.000000 MHz
    VIC  17:   720x576    50.000000 Hz   4:3     31.250 kHz     27.000000 MHz
    VIC   1:   640x480    59.940476 Hz   4:3     31.469 kHz     25.175000 MHz
  Audio Data Block:
    Linear PCM:
      Max channels: 2
      Supported sample rates (kHz): 48 44.1 32
      Supported sample sizes (bits): 24 20 16
  Speaker Allocation Data Block:
    FL/FR - Front Left/Right
  Video Capability Data Block:
    YCbCr quantization: Selectable (via AVI YQ)
    RGB quantization: Selectable (via AVI Q)
    PT scan behavior: Always Overscanned
    IT scan behavior: Always Overscanned
    CE scan behavior: Always Overscanned
  Vendor-Specific Data Block (HDMI), OUI 00-0C-03:
    Source physical address: 1.1.0.0
    DC_36bit
    DC_30bit
    DC_Y444
    Maximum TMDS clock: 340 MHz
  Vendor-Specific Data Block (HDMI Forum), OUI C4-5D-D8:
    Version: 1
    Maximum TMDS Character Rate: 600 MHz
    SCDC Present
    Supports 12-bits/component Deep Color 4:2:0 Pixel Encoding
    Supports 10-bits/component Deep Color 4:2:0 Pixel Encoding
  Vendor-Specific Data Block (AMD), OUI 00-00-1A:
    Version: 2
    Feature Caps: 0x01
    Minimum Refresh Rate: 48 Hz
    Maximum Refresh Rate: 75 Hz
    Flags 1.x: 0xe6 (MCCS)
    Flags 2.x: 0x00
  Colorimetry Data Block:
    xvYCC601
    xvYCC709
    BT2020YCC
    BT2020RGB
    Gamut Boundary Description Metadata Profile P0
  YCbCr 4:2:0 Capability Map Data Block:
    VIC  16:  1920x1080   60.000000 Hz  16:9     67.500 kHz    148.500000 MHz
    VIC  31:  1920x1080   50.000000 Hz  16:9     56.250 kHz    148.500000 MHz
  HDR Static Metadata Data Block:
    Electro optical transfer functions:
      Traditional gamma - SDR luminance range
      Traditional gamma - HDR luminance range
      SMPTE ST2084
    Supported static metadata descriptors:
      Static metadata type 1
    Desired content max luminance: 102 (455.515 cd/m^2)
    Desired content max frame-average luminance: 102 (455.515 cd/m^2)
    Desired content min luminance: 44 (0.136 cd/m^2)
  Detailed Timing Descriptors:
    DTD 3:  1920x1080   60.000000 Hz  16:9     67.500 kHz    148.500000 MHz (697 mm x 392 mm)
                 Hfront   88 Hsync  44 Hback  148 Hpol P
                 Vfront    4 Vsync   5 Vback   36 Vpol P
    DTD 4:  1280x1440   59.912620 Hz   8:9     89.450 kHz    156.000000 MHz (697 mm x 392 mm)
                 Hfront   96 Hsync 136 Hback  232 Hpol N
                 Vfront    3 Vsync  10 Vback   40 Vpol P
Checksum: 0x49  Unused space in Extension Block: 19 bytes

----------------

Block 2, Unknown EDID Extension Block 0x00:
  00 ff ff ff ff ff ff 00 26 cd 16 76 39 00 00 00 '........&..v9...'
  03 1f 01 03 80 46 27 78 2e 76 75 a7 54 50 9b 26 '.....F'x.vu.TP.&'
  12 50 54 bf ef 00 d1 c0 81 80 31 68 31 7c 45 68 '.PT.......1h1|Eh'
  45 7c 61 68 61 7c 56 5e 00 a0 a0 a0 29 50 30 20 'E|aha|V^....)P0 '
  35 00 b9 88 21 00 00 1e a0 73 00 6a a0 a0 29 50 '5...!....s.j..)P'
  08 20 35 00 b9 88 21 00 00 1a 00 00 00 fc 00 50 '. 5...!........P'
  4c 33 32 36 36 51 0a 20 20 20 20 20 00 00 00 fd 'L3266Q.     ....'
  00 30 4b 1e a0 22 00 0a 20 20 20 20 20 20 01 a6 '.0K.."..      ..'
Checksum: 0xa6

----------------

Block 3, CTA-861 Extension Block:
  Revision: 3
  Underscans IT Video Formats by default
  Basic audio support
  Supports YCbCr 4:4:4
  Supports YCbCr 4:2:2
  Native detailed modes: 1
  Video Data Block:
    VIC  16:  1920x1080   60.000000 Hz  16:9     67.500 kHz    148.500000 MHz
    VIC  31:  1920x1080   50.000000 Hz  16:9     56.250 kHz    148.500000 MHz
    VIC   5:  1920x1080i  60.000000 Hz  16:9     33.750 kHz     74.250000 MHz
    VIC  20:  1920x1080i  50.000000 Hz  16:9     28.125 kHz     74.250000 MHz
    VIC   4:  1280x720    60.000000 Hz  16:9     45.000 kHz     74.250000 MHz
    VIC  19:  1280x720    50.000000 Hz  16:9     37.500 kHz     74.250000 MHz
    VIC   3:   720x480    59.940060 Hz  16:9     31.469 kHz     27.000000 MHz
    VIC  18:   720x576    50.000000 Hz  16:9     31.250 kHz     27.000000 MHz
    VIC   2:   720x480    59.940060 Hz   4:3     31.469 kHz     27.000000 MHz
    VIC  17:   720x576    50.000000 Hz   4:3     31.250 kHz     27.000000 MHz
    VIC   1:   640x480    59.940476 Hz   4:3     31.469 kHz     25.175000 MHz
  Audio Data Block:
    Linear PCM:
      Max channels: 2
      Supported sample rates (kHz): 48 44.1 32
      Supported sample sizes (bits): 24 20 16
  Speaker Allocation Data Block:
    FL/FR - Front Left/Right
  Video Capability Data Block:
    YCbCr quantization: Selectable (via AVI YQ)
    RGB quantization: Selectable (via AVI Q)
    PT scan behavior: Always Overscanned
    IT scan behavior: Always Overscanned
    CE scan behavior: Always Overscanned
  Vendor-Specific Data Block (HDMI), OUI 00-0C-03:
    Source physical address: 1.1.0.0
    DC_36bit
    DC_30bit
    DC_Y444
    Maximum TMDS clock: 340 MHz
  Vendor-Specific Data Block (HDMI Forum), OUI C4-5D-D8:
    Version: 1
    Maximum TMDS Character Rate: 600 MHz
    SCDC Present
    Supports 12-bits/component Deep Color 4:2:0 Pixel Encoding
    Supports 10-bits/component Deep Color 4:2:0 Pixel Encoding
  Vendor-Specific Data Block (AMD), OUI 00-00-1A:
    Version: 2
    Feature Caps: 0x01
    Minimum Refresh Rate: 48 Hz
    Maximum Refresh Rate: 75 Hz
    Flags 1.x: 0xe6 (MCCS)
    Flags 2.x: 0x00
  Colorimetry Data Block:
    xvYCC601
    xvYCC709
    BT2020YCC
    BT2020RGB
    Gamut Boundary Description Metadata Profile P0
  YCbCr 4:2:0 Capability Map Data Block:
    VIC  16:  1920x1080   60.000000 Hz  16:9     67.500 kHz    148.500000 MHz
    VIC  31:  1920x1080   50.000000 Hz  16:9     56.250 kHz    148.500000 MHz
  HDR Static Metadata Data Block:
    Electro optical transfer functions:
      Traditional gamma - SDR luminance range
      Traditional gamma - HDR luminance range
      SMPTE ST2084
    Supported static metadata descriptors:
      Static metadata type 1
    Desired content max luminance: 102 (455.515 cd/m^2)
    Desired content max frame-average luminance: 102 (455.515 cd/m^2)
    Desired content min luminance: 44 (0.136 cd/m^2)
  Detailed Timing Descriptors:
    DTD 5:  1920x1080   60.000000 Hz  16:9     67.500 kHz    148.500000 MHz (697 mm x 392 mm)
                 Hfront   88 Hsync  44 Hback  148 Hpol P
                 Vfront    4 Vsync   5 Vback   36 Vpol P
    DTD 6:  1280x1440   59.912620 Hz   8:9     89.450 kHz    156.000000 MHz (697 mm x 392 mm)
                 Hfront   96 Hsync 136 Hback  232 Hpol N
                 Vfront    3 Vsync  10 Vback   40 Vpol P
Checksum: 0x49  Unused space in Extension Block: 19 bytes

----------------

Warnings:

Block 1, CTA-861 Extension Block:
  Video Data Block: VIC 16 and the first DTD are not identical. Is this intended?
  Video Capability Data Block: IT scan behavior is expected to support underscanned.
  Video Capability Data Block: S_PT is equal to S_IT and S_CE, so should be set to 0 instead.
  YCbCr 4:2:0 Capability Map Data Block: Some YCbCr 4:2:0 timings are invalid for HDMI 2.1 (which requires an RGB timings pixel rate >= 590 MHz).
  Detailed Timing Descriptor #4: Image size is 697x392 mm, but based on the picture AR it should be 697x784 mm.
Block 3, CTA-861 Extension Block:
  Video Capability Data Block: IT scan behavior is expected to support underscanned.
  Video Capability Data Block: S_PT is equal to S_IT and S_CE, so should be set to 0 instead.
  Detailed Timing Descriptor #6: Image size is 697x392 mm, but based on the picture AR it should be 697x784 mm.
EDID:
  Base EDID: Some timings are out of range of the Monitor Ranges:
    Vertical Freq: 50.000 - 120.000 Hz (Monitor: 48.000 - 75.000 Hz)
    Horizontal Freq: 28.125 - 111.027 kHz (Monitor: 30.000 - 160.000 kHz)

Failures:

Block 0, Base EDID:
  Basic Display Parameters & Features: sRGB is signaled, but the chromaticities do not match.
Block 1, CTA-861 Extension Block:
  Video Capability Data Block: IT video formats are always overscanned, but bit 7 of Byte 3 of the CTA-861 Extension header is set to underscanned.
Block 2, Base EDID:
  Unknown Extension Block.
Block 3, CTA-861 Extension Block:
  Video Data Block: Duplicate VIC 16.
  Video Data Block: Duplicate VIC 31.
  Video Data Block: Duplicate VIC 5.
  Video Data Block: Duplicate VIC 20.
  Video Data Block: Duplicate VIC 4.
  Video Data Block: Duplicate VIC 19.
  Video Data Block: Duplicate VIC 3.
  Video Data Block: Duplicate VIC 18.
  Video Data Block: Duplicate VIC 2.
  Video Data Block: Duplicate VIC 17.
  Video Data Block: Duplicate VIC 1.
  Speaker Allocation Data Block: Only one instance of this Data Block is allowed.
  Video Capability Data Block: Only one instance of this Data Block is allowed.
  Video Capability Data Block: IT video formats are always overscanned, but bit 7 of Byte 3 of the CTA-861 Extension header is set to underscanned.
  Vendor-Specific Data Block (HDMI Forum), OUI C4-5D-D8: Duplicate HDMI Forum VSDB/SCDB.
  Colorimetry Data Block: Only one instance of this Data Block is allowed.
  YCbCr 4:2:0 Capability Map Data Block: Only one instance of this Data Block is allowed.
  HDR Static Metadata Data Block: Only one instance of this Data Block is allowed.
EDID:
  Base EDID: EDID specified 1 extension block(s), but found 3 extension block(s).
  Base EDID: EDID 1.3 requires a Block Map Extension in Block 1 if there are more than 2 blocks in the EDID.

EDID conformity: FAIL
