edid-decode (hex):

00 ff ff ff ff ff ff 00 4c 83 07 42 00 00 00 00
00 22 01 04 b5 1e 13 78 03 cf d1 ae 51 3e b6 23
0b 50 54 00 00 00 01 01 01 01 01 01 01 01 01 01
01 01 01 01 01 01 00 00 00 00 00 00 00 00 00 00
00 00 00 00 00 00 00 00 00 00 00 fd 00 1e 78 e6
e6 47 01 0a 20 20 20 20 20 20 00 00 00 fe 00 53
44 43 20 20 20 20 20 20 20 20 20 20 00 00 00 fc
00 41 54 4e 41 34 30 48 51 30 32 2d 30 20 02 6a

02 03 23 00 e3 05 80 00 e6 06 05 01 8a 6a 01 73
1a 00 00 03 5b 1e 78 00 a0 8a 01 6a 02 78 00 00
00 00 8d 00 00 00 00 00 00 00 00 00 00 00 00 00
00 00 00 00 00 00 00 00 00 00 00 00 00 00 00 00
00 00 00 00 00 00 00 00 00 00 00 00 00 00 00 00
00 00 00 00 00 00 00 00 00 00 00 00 00 00 00 00
00 00 00 00 00 00 00 00 00 00 00 00 00 00 00 00
00 00 00 00 00 00 00 00 00 00 00 00 00 00 00 6c

70 20 79 02 00 20 00 0c ba 41 59 07 42 00 00 00
00 00 18 00 22 00 28 00 d4 0a 05 3f 0b c7 00 07
00 1f 00 07 07 77 00 4f 00 0f 00 00 d4 0a 85 3f
0b c7 00 07 00 1f 00 07 07 f7 07 cf 07 0f 00 2b
00 0c 27 00 1e 77 00 00 27 00 1e 3b 00 00 2e 00
06 18 10 d0 5f d0 63 00 00 00 00 00 00 00 00 00
00 00 00 00 00 00 00 00 00 00 00 00 00 00 00 00
00 00 00 00 00 00 00 00 00 00 00 00 00 00 81 90

00 ff ff ff ff ff ff 00 4c 83 07 42 00 00 00 00
00 22 01 04 b5 1e 13 78 03 cf d1 ae 51 3e b6 23
0b 50 54 00 00 00 01 01 01 01 01 01 01 01 01 01
01 01 01 01 01 01 00 00 00 00 00 00 00 00 00 00
00 00 00 00 00 00 00 00 00 00 00 fd 00 1e 78 e6
e6 47 01 0a 20 20 20 20 20 20 00 00 00 fe 00 53
44 43 20 20 20 20 20 20 20 20 20 20 00 00 00 fc
00 41 54 4e 41 34 30 48 51 30 32 2d 30 20 02 6a

02 03 23 00 e3 05 80 00 e6 06 05 01 8a 6a 01 73
1a 00 00 03 5b 1e 78 00 a0 8a 01 6a 02 78 00 00
00 00 8d 00 00 00 00 00 00 00 00 00 00 00 00 00
00 00 00 00 00 00 00 00 00 00 00 00 00 00 00 00
00 00 00 00 00 00 00 00 00 00 00 00 00 00 00 00
00 00 00 00 00 00 00 00 00 00 00 00 00 00 00 00
00 00 00 00 00 00 00 00 00 00 00 00 00 00 00 00
00 00 00 00 00 00 00 00 00 00 00 00 00 00 00 6c

70 20 79 02 00 20 00 0c ba 41 59 07 42 00 00 00
00 00 18 00 22 00 28 00 d4 0a 05 3f 0b c7 00 07
00 1f 00 07 07 77 00 4f 00 0f 00 00 d4 0a 85 3f
0b c7 00 07 00 1f 00 07 07 f7 07 cf 07 0f 00 2b
00 0c 27 00 1e 77 00 00 27 00 1e 3b 00 00 2e 00
06 18 10 d0 5f d0 63 00 00 00 00 00 00 00 00 00
00 00 00 00 00 00 00 00 00 00 00 00 00 00 00 00
00 00 00 00 00 00 00 00 00 00 00 00 00 00 81 90

----------------

Block 0, Base EDID:
  EDID Structure Version & Revision: 1.4
  Vendor & Product Identification:
    Manufacturer: SDC
    Model: 16903
    Made in: 2024
  Basic Display Parameters & Features:
    Digital display
    Bits per primary color channel: 10
    DisplayPort interface
    Maximum image size: 30 cm x 19 cm
    Gamma: 2.20
    Supported color formats: RGB 4:4:4
    First detailed timing includes the native pixel format and preferred refresh rate
    Display supports continuous frequencies
  Color Characteristics:
    Red  : 0.6826, 0.3164
    Green: 0.2451, 0.7138
    Blue : 0.1396, 0.0439
    White: 0.3125, 0.3291
  Established Timings I & II: none
  Standard Timings: none
  Detailed Timing Descriptors:
    Empty Descriptor
    Display Range Limits:
      Monitor ranges (Range Limits Only): 30-120 Hz V, 230-230 kHz H, max dotclock 710 MHz
    Alphanumeric Data String: 'SDC          '
    Display Product Name: 'ATNA40HQ02-0 '
  Extension blocks: 2
Checksum: 0x6a

----------------

Block 1, CTA-861 Extension Block:
  Revision: 3
  Native DTDs: 0
  Colorimetry Data Block:
    BT2020RGB
  HDR Static Metadata Data Block:
    Electro optical transfer functions:
      Traditional gamma - SDR luminance range
      SMPTE ST2084
    Supported static metadata descriptors:
      Static metadata type 1
    Desired content max luminance: 138 (993.486 cd/m^2)
    Desired content max frame-average luminance: 106 (496.743 cd/m^2)
    Desired content min luminance: 1 (0.000 cd/m^2)
  Vendor-Specific Data Block (AMD), OUI 00-00-1A:
    Version: 3
    Flags 1: 0x5b
      FreeSync Supported
      FreeSync 2 HDR Supported
      Local Dimming Supported
      Panel Replay/PSR Switch Supported
      Panel Replay Supported
    Minimum Refresh Rate: 30 Hz
    Maximum Refresh Rate: 120 Hz
    Flags 5: 0xa0
      Display is OLED
      ST 2084 (PQ) EOTF Supported
    Maximum luminance: 138 (993.486 cd/m^2)
    Minimum luminance: 1 (0.000 cd/m^2)
    Maximum luminance (without local dimming): 106 (496.743 cd/m^2)
    Minimum luminance (without local dimming): 2 (0.000 cd/m^2)
    Additional Sink Information Address: 0x410
Checksum: 0x6c  Unused space in Extension Block: 92 bytes

----------------

Block 2, DisplayID Extension Block:
  Version: 2.0
  Extension Count: 0
  Display Product Primary Use Case: None of the listed primary use cases; generic display
  Product Identification Data Block (0x20), OUI BA-41-59:
    Product Code: 16903
    Year of Manufacture: 2024
  Video Timing Modes Type 7 - Detailed Timings Data Block:
    DTD:  2880x1800  120.000169 Hz  16:10   230.400 kHz    709.633000 MHz (aspect 16:10, no 3D stereo)
               Hfront    8 Hsync  32 Hback  160 Hpol N
               Vfront   80 Vsync  16 Vback   24 Vpol N
    DTD:  2880x1800   60.000085 Hz  16:10   230.400 kHz    709.633000 MHz (aspect 16:10, no 3D stereo, preferred)
               Hfront    8 Hsync  32 Hback  160 Hpol N
               Vfront 2000 Vsync  16 Vback   24 Vpol N
  Adaptive Sync Data Block:
    Descriptor #1:
      Native Panel Range
      Fixed Average V-Total and Adaptive V-Total
      Supports Seamless Transition
      'Max Single Frame Duration Increase' field value without jitter impact
      'Max Single Frame Duration Decrease' field value without jitter impact
      Max Duration Increase: 0.00 ms
      Max Duration Decrease: 0.00 ms
      Min Refresh Rate: 30 Hz
      Max Refresh Rate: 120 Hz
    Descriptor #2:
      Native Panel Range
      Fixed Average V-Total and Adaptive V-Total
      Supports Seamless Transition
      'Max Single Frame Duration Increase' field value without jitter impact
      'Max Single Frame Duration Decrease' field value without jitter impact
      Max Duration Increase: 0.00 ms
      Max Duration Decrease: 0.00 ms
      Min Refresh Rate: 30 Hz
      Max Refresh Rate: 60 Hz
  Brightness Luminance Range Data Block:
    Minimum SDR Luminance (Full Coverage): 0.000500 cd/m^2
    Maximum Suggested SDR Luminance (Full Coverage): 500.000000 cd/m^2
    Maximum Boost SDR Luminance: 1000.000000 cd/m^2
  Checksum: 0x81
Checksum: 0x90

----------------

Warnings:

Block 1, CTA-861 Extension Block:
  IT Video Formats are overscanned by default, but normally this should be underscanned.
  Colorimetry Data Block: Set the sRGB colorimetry bit to avoid interop issues.
EDID:
  No Native Video Resolution was defined.
    Hint: set 'Native DTDs' to a non-0 value, or add a Native Video Resolution Data Block.

Failures:

Block 0, Base EDID:
  Standard Timings: Missing preferred timing.
  Empty Descriptor: Use Dummy Descriptor instead of all zeroes.
  Alphanumeric Data String: No newline, but one or more trailing spaces.
  Display Product Name: No newline, but one or more trailing spaces.
Block 1, CTA-861 Extension Block:
  Required 640x480p60 timings are missing in the established timings and the SVD list (VIC 1).
  Missing VCDB, needed for Set Selectable RGB Quantization to avoid interop issues.
EDID:
  Extension Block 3 started with EDID header, ignoring Extension Blocks >= 3.
  DisplayID: Missing DisplayID Display Parameters Data Block.

EDID conformity: FAIL
