edid-decode (hex):

00 ff ff ff ff ff ff 00 38 a3 5d 67 01 01 01 01
17 14 01 03 80 37 22 78 ea a8 45 ae 4f 33 b2 26
0d 50 54 bf ef 80 81 c0 81 80 90 40 8b c0 95 00
a9 40 b3 00 d1 00 28 3c 80 a0 70 b0 23 40 30 20
36 00 26 58 21 00 00 1a 00 00 00 fd 00 32 55 1f
5c 11 00 0a 20 20 20 20 20 20 00 00 00 fc 00 4c
43 44 32 36 39 30 57 55 58 69 32 0a 00 00 00 ff
00 30 36 32 30 30 34 35 36 55 42 0a 20 20 00 e6

00 ff ff ff ff ff ff 00 38 a3 5d 67 01 01 01 01
17 14 01 03 80 37 22 78 ea a8 45 ae 4f 33 b2 26
0d 50 54 bf ef 80 81 c0 81 80 90 40 8b c0 95 00
a9 40 b3 00 d1 00 28 3c 80 a0 70 b0 23 40 30 20
36 00 26 58 21 00 00 1a 00 00 00 fd 00 32 55 1f
5c 11 00 0a 20 20 20 20 20 20 00 00 00 fc 00 4c
43 44 32 36 39 30 57 55 58 69 32 0a 00 00 00 ff
00 30 36 32 30 30 34 35 36 55 42 0a 20 20 00 e6

----------------

Block 0, Base EDID:
  EDID Structure Version & Revision: 1.3
  Vendor & Product Identification:
    Manufacturer: NEC
    Model: 26461
    Serial Number: ...
    Made in: week 23 of 2010
  Basic Display Parameters & Features:
    Digital display
    Maximum image size: 55 cm x 34 cm
    Gamma: 2.20
    DPMS levels: Standby Suspend Off
    RGB color display
    First detailed timing is the preferred timing
  Color Characteristics:
    Red  : 0.6816, 0.3105
    Green: 0.2011, 0.6953
    Blue : 0.1494, 0.0507
    White: 0.3134, 0.3291
  Established Timings I & II:
    IBM     :   720x400    70.081663 Hz   9:5     31.467 kHz     28.320000 MHz
    DMT 0x04:   640x480    59.940476 Hz   4:3     31.469 kHz     25.175000 MHz
    Apple   :   640x480    66.666667 Hz   4:3     35.000 kHz     30.240000 MHz
    DMT 0x05:   640x480    72.808802 Hz   4:3     37.861 kHz     31.500000 MHz
    DMT 0x06:   640x480    75.000000 Hz   4:3     37.500 kHz     31.500000 MHz
    DMT 0x08:   800x600    56.250000 Hz   4:3     35.156 kHz     36.000000 MHz
    DMT 0x09:   800x600    60.316541 Hz   4:3     37.879 kHz     40.000000 MHz
    DMT 0x0a:   800x600    72.187572 Hz   4:3     48.077 kHz     50.000000 MHz
    DMT 0x0b:   800x600    75.000000 Hz   4:3     46.875 kHz     49.500000 MHz
    Apple   :   832x624    74.551266 Hz   4:3     49.726 kHz     57.284000 MHz
    DMT 0x10:  1024x768    60.003840 Hz   4:3     48.363 kHz     65.000000 MHz
    DMT 0x11:  1024x768    70.069359 Hz   4:3     56.476 kHz     75.000000 MHz
    DMT 0x12:  1024x768    75.028582 Hz   4:3     60.023 kHz     78.750000 MHz
    DMT 0x24:  1280x1024   75.024675 Hz   5:4     79.976 kHz    135.000000 MHz
    Apple   :  1152x870    75.061550 Hz 192:145   68.681 kHz    100.000000 MHz
  Standard Timings:
    DMT 0x55:  1280x720    60.000000 Hz  16:9     45.000 kHz     74.250000 MHz
    DMT 0x23:  1280x1024   60.019740 Hz   5:4     63.981 kHz    108.000000 MHz
    DMT 0x2a:  1400x1050   59.978442 Hz   4:3     65.317 kHz    121.750000 MHz
    GTF     :  1360x765    60.000341 Hz  16:9     47.520 kHz     84.396000 MHz
    DMT 0x2f:  1440x900    59.887445 Hz  16:10    55.935 kHz    106.500000 MHz
    DMT 0x33:  1600x1200   60.000000 Hz   4:3     75.000 kHz    162.000000 MHz
    DMT 0x3a:  1680x1050   59.954250 Hz  16:10    65.290 kHz    146.250000 MHz
    DMT 0x45:  1920x1200   59.884600 Hz  16:10    74.556 kHz    193.250000 MHz
  Detailed Timing Descriptors:
    DTD 1:  1920x1200   59.950171 Hz  16:10    74.038 kHz    154.000000 MHz (550 mm x 344 mm)
                 Hfront   48 Hsync  32 Hback   80 Hpol P
                 Vfront    3 Vsync   6 Vback   26 Vpol N
    Display Range Limits:
      Monitor ranges (GTF): 50-85 Hz V, 31-92 kHz H, max dotclock 170 MHz
    Display Product Name: 'LCD2690WUXi2'
    Display Product Serial Number: ...
Checksum: 0xe6

----------------

Warnings:

Block 0, Base EDID:
  Vendor & Product Identification: The serial number is one of the known dummy values, it should probably be set to 0.
  Standard Timings: Standard Timing 1360x765 has a dubious odd vertical resolution.
EDID:
  Base EDID: Some timings are out of range of the Monitor Ranges:
    Maximum Clock: 193.250 MHz (Monitor: 170.000 MHz)

Failures:

EDID:
  Extension Block 1 started with EDID header, ignoring Extension Blocks >= 1.

EDID conformity: FAIL
