edid-decode (hex):

00 ff ff ff ff ff ff 00 06 af ec 11 00 00 00 00
01 12 01 03 90 22 13 78 0a e6 b5 a3 57 4f 94 26
1e 50 54 00 00 00 01 01 01 01 01 01 01 01 01 01
01 01 01 01 01 01 20 1c 56 78 50 00 26 30 30 20
34 00 58 c1 10 00 00 1a 20 1c 56 78 50 00 26 30
30 20 34 00 58 c1 10 00 00 1a 00 00 00 fe 00 4d
30 39 34 47 80 42 31 35 36 58 57 31 00 00 00 00
00 00 00 00 00 00 00 00 00 01 01 0a 20 20 00 df

----------------

Block 0, Base EDID:
  EDID Structure Version & Revision: 1.3
  Vendor & Product Identification:
    Manufacturer: AUO
    Model: 4588
    Made in: week 1 of 2008
  Basic Display Parameters & Features:
    Digital display
    Maximum image size: 34 cm x 19 cm
    Gamma: 2.20
    RGB color display
    First detailed timing is the preferred timing
  Color Characteristics:
    Red  : 0.6396, 0.3417
    Green: 0.3095, 0.5800
    Blue : 0.1503, 0.1201
    White: 0.3134, 0.3291
  Established Timings I & II: none
  Standard Timings: none
  Detailed Timing Descriptors:
    DTD 1:  1366x768    60.114418 Hz 683:384   48.452 kHz     72.000000 MHz (344 mm x 193 mm)
                 Hfront   48 Hsync  32 Hback   40 Hpol P
                 Vfront    3 Vsync   4 Vback   31 Vpol N
    DTD 2:  1366x768    60.114418 Hz 683:384   48.452 kHz     72.000000 MHz (344 mm x 193 mm)
                 Hfront   48 Hsync  32 Hback   40 Hpol P
                 Vfront    3 Vsync   4 Vback   31 Vpol N
    Alphanumeric Data String: 'M094G.B156XW1'
    Manufacturer-Specified Display Descriptor (0x00): 00 00 00 00 00 00 00 00 00 00 00 01 01 0a 20 20 '..............  '
Checksum: 0xdf

----------------

Warnings:

Block 0, Base EDID:
  Alphanumeric Data String: Non-ASCII character 0x80 at position 5, can cause problems.

Failures:

Block 0, Base EDID:
  Basic Display Parameters & Features: Digital Video Interface Standard set to reserved value 0x10.
  Missing Display Product Name.
  Missing Display Range Limits Descriptor.

EDID conformity: FAIL
