edid-decode (hex):

00 ff ff ff ff ff ff 00 10 ac 12 30 37 41 46 42
20 0e 01 04 a5 20 18 78 e6 12 69 a5 52 49 99 24
0e 48 4c a0 42 00 31 59 45 59 61 59 01 01 01 01
01 01 01 01 01 01 ea 24 00 60 41 00 28 30 30 60
13 00 38 ea 10 00 00 1e 00 00 00 ff 00 55 31 35
35 34 34 38 32 42 46 41 37 0a 00 00 00 fc 00 44
45 4c 4c 20 45 37 37 33 73 0a 20 20 00 00 00 fd
00 32 a0 1e 46 0b 00 0a 20 20 20 20 20 20 00 05

00 ff ff ff ff ff ff 00 10 ac 12 30 37 41 46 42
20 0e 01 04 a5 20 18 78 e6 12 69 a5 52 49 99 24
0e 48 4c a0 42 00 31 59 45 59 61 59 01 01 01 01
01 01 01 01 01 01 ea 24 00 60 41 00 28 30 30 60
13 00 38 ea 10 00 00 1e 00 00 00 ff 00 55 31 35
35 34 34 38 32 42 46 41 37 0a 00 00 00 fc 00 44
45 4c 4c 20 45 37 37 33 73 0a 20 20 00 00 00 fd
00 32 a0 1e 46 0b 00 0a 20 20 20 20 20 20 00 05

----------------

Block 0, Base EDID:
  EDID Structure Version & Revision: 1.4
  Vendor & Product Identification:
    Manufacturer: DEL
    Model: 12306
    Serial Number: ...
    Made in: week 32 of 2004
  Basic Display Parameters & Features:
    Digital display
    Bits per primary color channel: 8
    DisplayPort interface
    Maximum image size: 32 cm x 24 cm
    Gamma: 2.20
    DPMS levels: Standby Suspend Off
    Supported color formats: RGB 4:4:4
    Default (sRGB) color space is primary color space
    First detailed timing includes the native pixel format and preferred refresh rate
  Color Characteristics:
    Red  : 0.6445, 0.3212
    Green: 0.2851, 0.5996
    Blue : 0.1416, 0.0566
    White: 0.2832, 0.2978
  Established Timings I & II:
    IBM     :   720x400    70.081663 Hz   9:5     31.467 kHz     28.320000 MHz
    DMT 0x04:   640x480    59.940476 Hz   4:3     31.469 kHz     25.175000 MHz
    DMT 0x0b:   800x600    75.000000 Hz   4:3     46.875 kHz     49.500000 MHz
    DMT 0x12:  1024x768    75.028582 Hz   4:3     60.023 kHz     78.750000 MHz
  Standard Timings:
    DMT 0x07:   640x480    85.008312 Hz   4:3     43.269 kHz     36.000000 MHz
    DMT 0x0c:   800x600    85.061274 Hz   4:3     53.674 kHz     56.250000 MHz
    DMT 0x13:  1024x768    84.996690 Hz   4:3     68.677 kHz     94.500000 MHz
  Detailed Timing Descriptors:
    DTD 1:  1024x768    84.996690 Hz   4:3     68.677 kHz     94.500000 MHz (312 mm x 234 mm)
                 Hfront   48 Hsync  96 Hback  208 Hpol P
                 Vfront    1 Vsync   3 Vback   36 Vpol P
    Display Product Serial Number: ...
    Display Product Name: 'DELL E773s'
    Display Range Limits:
      Monitor ranges (GTF): 50-160 Hz V, 30-70 kHz H, max dotclock 110 MHz
Checksum: 0x05

----------------

Warnings:

Block 0, Base EDID:
  Display Range Limits: GTF support is deprecated in EDID 1.4.

Failures:

Block 0, Base EDID:
  Basic Display Parameters & Features: sRGB is signaled, but the chromaticities do not match.
  Display Range Limits: GTF is supported, but the display does not support continuous frequencies.
EDID:
  Extension Block 1 started with EDID header, ignoring Extension Blocks >= 1.

EDID conformity: FAIL
