edid-decode (hex):

00 ff ff ff ff ff ff 00 30 64 00 50 01 01 01 01
22 10 01 02 80 21 15 78 0a 4f d5 9c 57 4b 8c 27
1f 50 54 00 00 00 01 01 01 01 01 01 01 01 01 01
01 01 01 01 01 01 47 3b 80 08 71 b0 23 40 64 20
26 00 4c d0 10 00 00 18 00 00 00 0f 00 08 28 10
38 01 11 02 11 1e 20 08 12 00 00 00 00 fe 00 54
4d 44 49 53 50 4c 41 59 0a 20 20 20 00 00 00 fe
00 4c 54 44 31 35 34 45 5a 30 43 0a 20 20 00 52

00 ff ff ff ff ff ff 00 30 64 00 50 01 01 01 01
22 10 01 02 80 21 15 78 0a 4f d5 9c 57 4b 8c 27
1f 50 54 00 00 00 01 01 01 01 01 01 01 01 01 01
01 01 01 01 01 01 47 3b 80 08 71 b0 23 40 64 20
26 00 4c d0 10 00 00 18 00 00 00 0f 00 08 28 10
38 01 11 02 11 1e 20 08 12 00 00 00 00 fe 00 54
4d 44 49 53 50 4c 41 59 0a 20 20 20 00 00 00 fe
00 4c 54 44 31 35 34 45 5a 30 43 0a 20 20 00 52

----------------

Block 0, Base EDID:
  EDID Structure Version & Revision: 1.2
  Vendor & Product Identification:
    Manufacturer: LCD
    Model: 20480
    Serial Number: ...
    Made in: week 34 of 2006
  Basic Display Parameters & Features:
    Digital display
    Maximum image size: 33 cm x 21 cm
    Gamma: 2.20
    RGB color display
    First detailed timing is the preferred timing
  Color Characteristics:
    Red  : 0.6103, 0.3398
    Green: 0.2958, 0.5498
    Blue : 0.1552, 0.1220
    White: 0.3134, 0.3291
  Established Timings I & II: none
  Standard Timings: none
  Detailed Timing Descriptors:
    DTD 1:  1920x1200   56.261215 Hz  16:10    69.483 kHz    151.750000 MHz (332 mm x 208 mm)
                 Hfront  100 Hsync  32 Hback  132 Hpol N
                 Vfront    2 Vsync   6 Vback   27 Vpol N
    Manufacturer-Specified Display Descriptor (0x0f): 00 0f 00 08 28 10 38 01 11 02 11 1e 20 08 12 00 '....(.8..... ...'
    Alphanumeric Data String: 'TMDISPLAY'
    Alphanumeric Data String: 'LTD154EZ0C'
Checksum: 0x52

----------------

Warnings:

Block 0, Base EDID:
  EDID Structure Version & Revision: EDID 1.2 is deprecated, do not use.
  Vendor & Product Identification: The serial number is one of the known dummy values, it should probably be set to 0.

Failures:

EDID:
  Extension Block 1 started with EDID header, ignoring Extension Blocks >= 1.

EDID conformity: FAIL
