edid-decode (hex):

00 ff ff ff ff ff ff 00 59 3a 28 10 01 01 01 01
06 1c 01 03 80 46 27 78 0a e7 4d a3 55 50 9c 27
0f 47 4a 25 0e 00 01 01 01 01 01 01 01 01 01 01
01 01 01 01 01 01 66 21 56 b0 51 00 1b 30 80 82
26 00 b9 88 21 00 00 1e 00 00 00 ff 00 4c 41 55
41 56 4d 4b 55 30 30 30 30 30 00 00 00 fc 00 44
33 32 68 2d 46 30 0a 20 20 20 20 20 00 00 00 fd
00 38 4c 1f 50 0f 00 0a 20 20 20 20 20 20 01 36

02 03 27 71 49 01 02 03 84 05 06 07 10 20 2c 09
07 07 15 07 50 57 06 00 3d 07 bc 83 01 00 00 67
03 0c 00 20 00 38 2d 02 3a 80 18 71 38 2d 40 58
2c 45 00 b9 88 21 00 00 1e 01 1d 00 72 51 d0 1e
20 6e 28 55 00 b9 88 21 00 00 1e 01 1d 80 18 71
38 2d 40 58 2c 25 00 b9 88 21 00 00 9e 00 00 00
00 00 00 00 00 00 00 00 00 00 00 00 00 00 00 00
00 00 00 00 00 00 00 00 00 00 00 00 00 00 00 c1

00 ff ff ff ff ff ff 00 59 3a 28 10 01 01 01 01
06 1c 01 03 80 46 27 78 0a e7 4d a3 55 50 9c 27
0f 47 4a 25 0e 00 01 01 01 01 01 01 01 01 01 01
01 01 01 01 01 01 66 21 56 b0 51 00 1b 30 80 82
26 00 b9 88 21 00 00 1e 00 00 00 ff 00 4c 41 55
41 56 4d 4b 55 30 30 30 30 30 00 00 00 fc 00 44
33 32 68 2d 46 30 0a 20 20 20 20 20 00 00 00 fd
00 38 4c 1f 50 0f 00 0a 20 20 20 20 20 20 01 36

02 03 27 71 49 01 02 03 84 05 06 07 10 20 2c 09
07 07 15 07 50 57 06 00 3d 07 bc 83 01 00 00 67
03 0c 00 20 00 38 2d 02 3a 80 18 71 38 2d 40 58
2c 45 00 b9 88 21 00 00 1e 01 1d 00 72 51 d0 1e
20 6e 28 55 00 b9 88 21 00 00 1e 01 1d 80 18 71
38 2d 40 58 2c 25 00 b9 88 21 00 00 9e 00 00 00
00 00 00 00 00 00 00 00 00 00 00 00 00 00 00 00
00 00 00 00 00 00 00 00 00 00 00 00 00 00 00 c1

----------------

Block 0, Base EDID:
  EDID Structure Version & Revision: 1.3
  Vendor & Product Identification:
    Manufacturer: VIZ
    Model: 4136
    Serial Number: ...
    Made in: week 6 of 2018
  Basic Display Parameters & Features:
    Digital display
    Maximum image size: 70 cm x 39 cm
    Gamma: 2.20
    RGB color display
    First detailed timing is the preferred timing
  Color Characteristics:
    Red  : 0.6396, 0.3339
    Green: 0.3134, 0.6123
    Blue : 0.1533, 0.0585
    White: 0.2802, 0.2900
  Established Timings I & II:
    DMT 0x04:   640x480    59.940476 Hz   4:3     31.469 kHz     25.175000 MHz
    DMT 0x06:   640x480    75.000000 Hz   4:3     37.500 kHz     31.500000 MHz
    DMT 0x09:   800x600    60.316541 Hz   4:3     37.879 kHz     40.000000 MHz
    DMT 0x10:  1024x768    60.003840 Hz   4:3     48.363 kHz     65.000000 MHz
    DMT 0x11:  1024x768    70.069359 Hz   4:3     56.476 kHz     75.000000 MHz
    DMT 0x12:  1024x768    75.028582 Hz   4:3     60.023 kHz     78.750000 MHz
  Standard Timings: none
  Detailed Timing Descriptors:
    DTD 1:  1366x768    59.814889 Hz 683:384   47.553 kHz     85.500000 MHz (697 mm x 392 mm)
                 Hfront  128 Hsync 130 Hback  174 Hpol P
                 Vfront    2 Vsync   6 Vback   19 Vpol P
    Display Product Serial Number: ...
    Display Product Name: 'D32h-F0'
    Display Range Limits:
      Monitor ranges (GTF): 56-76 Hz V, 31-80 kHz H, max dotclock 150 MHz
  Extension blocks: 1
Checksum: 0x36

----------------

Block 1, CTA-861 Extension Block:
  Revision: 3
  Basic audio support
  Supports YCbCr 4:4:4
  Supports YCbCr 4:2:2
  Native detailed modes: 1
  Video Data Block:
    VIC   1:   640x480    59.940476 Hz   4:3     31.469 kHz     25.175000 MHz
    VIC   2:   720x480    59.940060 Hz   4:3     31.469 kHz     27.000000 MHz
    VIC   3:   720x480    59.940060 Hz  16:9     31.469 kHz     27.000000 MHz
    VIC   4:  1280x720    60.000000 Hz  16:9     45.000 kHz     74.250000 MHz (native)
    VIC   5:  1920x1080i  60.000000 Hz  16:9     33.750 kHz     74.250000 MHz
    VIC   6:  1440x480i   59.940060 Hz   4:3     15.734 kHz     27.000000 MHz
    VIC   7:  1440x480i   59.940060 Hz  16:9     15.734 kHz     27.000000 MHz
    VIC  16:  1920x1080   60.000000 Hz  16:9     67.500 kHz    148.500000 MHz
    VIC  32:  1920x1080   24.000000 Hz  16:9     27.000 kHz     74.250000 MHz
  Audio Data Block:
    Linear PCM:
      Max channels: 2
      Supported sample rates (kHz): 48 44.1 32
      Supported sample sizes (bits): 24 20 16
    AC-3:
      Max channels: 6
      Supported sample rates (kHz): 48 44.1 32
      Maximum bit rate: 640 kb/s
    Enhanced AC-3 (DD+):
      Max channels: 8
      Supported sample rates (kHz): 48 44.1
    DTS:
      Max channels: 6
      Supported sample rates (kHz): 48 44.1 32
      Maximum bit rate: 1504 kb/s
  Speaker Allocation Data Block:
    FL/FR - Front Left/Right
  Vendor-Specific Data Block (HDMI), OUI 00-0C-03:
    Source physical address: 2.0.0.0
    DC_36bit
    DC_30bit
    DC_Y444
    Maximum TMDS clock: 225 MHz
  Detailed Timing Descriptors:
    DTD 2:  1920x1080   60.000000 Hz  16:9     67.500 kHz    148.500000 MHz (697 mm x 392 mm)
                 Hfront   88 Hsync  44 Hback  148 Hpol P
                 Vfront    4 Vsync   5 Vback   36 Vpol P
    DTD 3:  1280x720    60.000000 Hz  16:9     45.000 kHz     74.250000 MHz (697 mm x 392 mm)
                 Hfront  110 Hsync  40 Hback  220 Hpol P
                 Vfront    5 Vsync   5 Vback   20 Vpol P
    DTD 4:  1920x2160i  29.986673 Hz   8:9     33.750 kHz     74.250000 MHz (697 mm x 392 mm)
                 Hfront   88 Hsync  44 Hback  148 Hpol P
                 Vfront    2 Vsync   5 Vback   38 Vpol P Vfront +0.5 Odd Field
                 Vfront    2 Vsync   5 Vback   38 Vpol P Vback  +0.5 Even Field
Checksum: 0xc1  Unused space in Extension Block: 34 bytes

----------------

Block 2, Unknown EDID Extension Block 0x00:
  00 ff ff ff ff ff ff 00 59 3a 28 10 01 01 01 01 '........Y:(.....'
  06 1c 01 03 80 46 27 78 0a e7 4d a3 55 50 9c 27 '.....F'x..M.UP.''
  0f 47 4a 25 0e 00 01 01 01 01 01 01 01 01 01 01 '.GJ%............'
  01 01 01 01 01 01 66 21 56 b0 51 00 1b 30 80 82 '......f!V.Q..0..'
  26 00 b9 88 21 00 00 1e 00 00 00 ff 00 4c 41 55 '&...!........LAU'
  41 56 4d 4b 55 30 30 30 30 30 00 00 00 fc 00 44 'AVMKU00000.....D'
  33 32 68 2d 46 30 0a 20 20 20 20 20 00 00 00 fd '32h-F0.     ....'
  00 38 4c 1f 50 0f 00 0a 20 20 20 20 20 20 01 36 '.8L.P...      .6'
Checksum: 0x36

----------------

Block 3, CTA-861 Extension Block:
  Revision: 3
  Basic audio support
  Supports YCbCr 4:4:4
  Supports YCbCr 4:2:2
  Native detailed modes: 1
  Video Data Block:
    VIC   1:   640x480    59.940476 Hz   4:3     31.469 kHz     25.175000 MHz
    VIC   2:   720x480    59.940060 Hz   4:3     31.469 kHz     27.000000 MHz
    VIC   3:   720x480    59.940060 Hz  16:9     31.469 kHz     27.000000 MHz
    VIC   4:  1280x720    60.000000 Hz  16:9     45.000 kHz     74.250000 MHz (native)
    VIC   5:  1920x1080i  60.000000 Hz  16:9     33.750 kHz     74.250000 MHz
    VIC   6:  1440x480i   59.940060 Hz   4:3     15.734 kHz     27.000000 MHz
    VIC   7:  1440x480i   59.940060 Hz  16:9     15.734 kHz     27.000000 MHz
    VIC  16:  1920x1080   60.000000 Hz  16:9     67.500 kHz    148.500000 MHz
    VIC  32:  1920x1080   24.000000 Hz  16:9     27.000 kHz     74.250000 MHz
  Audio Data Block:
    Linear PCM:
      Max channels: 2
      Supported sample rates (kHz): 48 44.1 32
      Supported sample sizes (bits): 24 20 16
    AC-3:
      Max channels: 6
      Supported sample rates (kHz): 48 44.1 32
      Maximum bit rate: 640 kb/s
    Enhanced AC-3 (DD+):
      Max channels: 8
      Supported sample rates (kHz): 48 44.1
    DTS:
      Max channels: 6
      Supported sample rates (kHz): 48 44.1 32
      Maximum bit rate: 1504 kb/s
  Speaker Allocation Data Block:
    FL/FR - Front Left/Right
  Vendor-Specific Data Block (HDMI), OUI 00-0C-03:
    Source physical address: 2.0.0.0
    DC_36bit
    DC_30bit
    DC_Y444
    Maximum TMDS clock: 225 MHz
  Detailed Timing Descriptors:
    DTD 5:  1920x1080   60.000000 Hz  16:9     67.500 kHz    148.500000 MHz (697 mm x 392 mm)
                 Hfront   88 Hsync  44 Hback  148 Hpol P
                 Vfront    4 Vsync   5 Vback   36 Vpol P
    DTD 6:  1280x720    60.000000 Hz  16:9     45.000 kHz     74.250000 MHz (697 mm x 392 mm)
                 Hfront  110 Hsync  40 Hback  220 Hpol P
                 Vfront    5 Vsync   5 Vback   20 Vpol P
    DTD 7:  1920x2160i  29.986673 Hz   8:9     33.750 kHz     74.250000 MHz (697 mm x 392 mm)
                 Hfront   88 Hsync  44 Hback  148 Hpol P
                 Vfront    2 Vsync   5 Vback   38 Vpol P Vfront +0.5 Odd Field
                 Vfront    2 Vsync   5 Vback   38 Vpol P Vback  +0.5 Even Field
Checksum: 0xc1  Unused space in Extension Block: 34 bytes

----------------

Warnings:

Block 0, Base EDID:
  Vendor & Product Identification: The serial number is one of the known dummy values, it should probably be set to 0.
Block 1, CTA-861 Extension Block:
  IT Video Formats are overscanned by default, but normally this should be underscanned.
  Video Data Block: VIC 1 and the first DTD are not identical. Is this intended?
  Video Data Block: All VICs are in ascending order, and the first (preferred) VIC <= 4, is that intended?
  Detailed Timing Descriptor #4: Image size is 697x392 mm, but based on the picture AR it should be 697x784 mm.
  Display Product Serial Number is set, so the Serial Number in the Base EDID should be 0.
  Add a Colorimetry Data Block with the sRGB colorimetry bit set to avoid interop issues.
Block 3, CTA-861 Extension Block:
  IT Video Formats are overscanned by default, but normally this should be underscanned.
  Video Data Block: All VICs are in ascending order, and the first (preferred) VIC <= 4, is that intended?
  Detailed Timing Descriptor #7: Image size is 697x392 mm, but based on the picture AR it should be 697x784 mm.
EDID:
  Base EDID: Some timings are out of range of the Monitor Ranges:
    Vertical Freq: 24.000 - 75.029 Hz (Monitor: 56.000 - 76.000 Hz)
    Horizontal Freq: 15.734 - 67.500 kHz (Monitor: 31.000 - 80.000 kHz)

Failures:

Block 1, CTA-861 Extension Block:
  Missing VCDB, needed for Set Selectable RGB Quantization to avoid interop issues.
Block 2, Base EDID:
  Unknown Extension Block.
Block 3, CTA-861 Extension Block:
  Video Data Block: Duplicate VIC 1.
  Video Data Block: Duplicate VIC 2.
  Video Data Block: Duplicate VIC 3.
  Video Data Block: Duplicate VIC 4.
  Video Data Block: Duplicate VIC 5.
  Video Data Block: Duplicate VIC 6.
  Video Data Block: Duplicate VIC 7.
  Video Data Block: Duplicate VIC 16.
  Video Data Block: Duplicate VIC 32.
  Speaker Allocation Data Block: Only one instance of this Data Block is allowed.
EDID:
  Base EDID: EDID specified 1 extension block(s), but found 3 extension block(s).
  Base EDID: EDID 1.3 requires a Block Map Extension in Block 1 if there are more than 2 blocks in the EDID.
  CTA-861: Native progressive timings are a mix of several resolutions.

EDID conformity: FAIL
