edid-decode (hex):

00 ff ff ff ff ff ff 00 26 cf 66 8c 00 00 00 00
00 1d 01 04 a5 1f 11 78 0a de 50 a3 54 4c 99 26
0f 50 54 00 00 00 01 01 01 01 01 01 01 01 01 01
01 01 01 01 01 01 38 36 80 a0 70 38 20 40 18 30
3c 00 35 ae 10 00 00 19 00 00 00 fe 00 4d 31 34
30 4e 56 46 41 20 52 32 20 0a 00 00 00 03 00 03
26 a2 04 2c 5c 14 07 08 af 00 00 00 00 00 00 03
00 19 51 ff 64 a0 f4 14 09 39 f4 01 01 00 00 d8

00 ff ff ff ff ff ff 00 26 cf 66 8c 00 00 00 00
00 1d 01 04 a5 1f 11 78 0a de 50 a3 54 4c 99 26
0f 50 54 00 00 00 01 01 01 01 01 01 01 01 01 01
01 01 01 01 01 01 38 36 80 a0 70 38 20 40 18 30
3c 00 35 ae 10 00 00 19 00 00 00 fe 00 4d 31 34
30 4e 56 46 41 20 52 32 20 0a 00 00 00 03 00 03
26 a2 04 2c 5c 14 07 08 af 00 00 00 00 00 00 03
00 19 51 ff 64 a0 f4 14 09 39 f4 01 01 00 00 d8

----------------

Block 0, Base EDID:
  EDID Structure Version & Revision: 1.4
  Vendor & Product Identification:
    Manufacturer: IVO
    Model: 35942
    Made in: 2019
  Basic Display Parameters & Features:
    Digital display
    Bits per primary color channel: 8
    DisplayPort interface
    Maximum image size: 31 cm x 17 cm
    Gamma: 2.20
    Supported color formats: RGB 4:4:4, YCrCb 4:4:4
    First detailed timing includes the native pixel format and preferred refresh rate
  Color Characteristics:
    Red  : 0.6396, 0.3291
    Green: 0.2998, 0.5996
    Blue : 0.1494, 0.0595
    White: 0.3125, 0.3281
  Established Timings I & II: none
  Standard Timings: none
  Detailed Timing Descriptors:
    DTD 1:  1920x1080   60.009685 Hz  16:9     66.731 kHz    138.800000 MHz (309 mm x 174 mm)
                 Hfront   24 Hsync  48 Hback   88 Hpol N
                 Vfront    3 Vsync  12 Vback   17 Vpol N
    Alphanumeric Data String: 'M140NVFA R2 '
    Manufacturer-Specified Display Descriptor (0x03): 00 03 00 03 26 a2 04 2c 5c 14 07 08 af 00 00 00 '....&..,\.......'
    Manufacturer-Specified Display Descriptor (0x03): 00 03 00 19 51 ff 64 a0 f4 14 09 39 f4 01 01 00 '....Q.d....9....'
Checksum: 0xd8

----------------

Warnings:

Block 0, Base EDID:
  Missing Display Product Name.

Failures:

Block 0, Base EDID:
  Alphanumeric Data String: One or more trailing spaces before newline.
EDID:
  Extension Block 1 started with EDID header, ignoring Extension Blocks >= 1.

EDID conformity: FAIL
