edid-decode (hex):

00 ff ff ff ff ff ff 00 12 e5 0c 70 01 01 01 01
00 0b 01 03 68 22 1b 64 ea ee a6 9e 54 4c 99 26
19 4f 54 bf ef 00 71 4f 81 40 01 01 01 01 01 01
01 01 01 01 01 01 bc 34 00 98 51 00 2a 40 10 90
13 00 54 0e 11 00 00 1e 00 00 00 fd 00 38 4c 1e
50 0e 0a 20 20 20 20 20 20 20 00 00 00 ff 00 30
30 30 30 30 30 30 30 0a 20 20 20 20 00 00 00 fc
00 31 37 22 20 54 46 54 2d 4c 43 44 0a 00 00 f0

----------------

Block 0, Base EDID:
  EDID Structure Version & Revision: 1.3
  Vendor & Product Identification:
    Manufacturer: DWE
    Model: 28684
    Serial Number: ...
    Made in: 2001
  Basic Display Parameters & Features:
    Analog display
    Signal Level Standard: 0.700 : 0.000 : 0.700 V p-p
    Blank level equals black level
    Sync: Separate
    Maximum image size: 34 cm x 27 cm
    Gamma: 2.00
    DPMS levels: Standby Suspend Off
    RGB color display
    First detailed timing is the preferred timing
  Color Characteristics:
    Red  : 0.6201, 0.3300
    Green: 0.2998, 0.5996
    Blue : 0.1503, 0.0996
    White: 0.3095, 0.3300
  Established Timings I & II:
    IBM     :   720x400    70.081663 Hz   9:5     31.467 kHz     28.320000 MHz
    DMT 0x04:   640x480    59.940476 Hz   4:3     31.469 kHz     25.175000 MHz
    Apple   :   640x480    66.666667 Hz   4:3     35.000 kHz     30.240000 MHz
    DMT 0x05:   640x480    72.808802 Hz   4:3     37.861 kHz     31.500000 MHz
    DMT 0x06:   640x480    75.000000 Hz   4:3     37.500 kHz     31.500000 MHz
    DMT 0x08:   800x600    56.250000 Hz   4:3     35.156 kHz     36.000000 MHz
    DMT 0x09:   800x600    60.316541 Hz   4:3     37.879 kHz     40.000000 MHz
    DMT 0x0a:   800x600    72.187572 Hz   4:3     48.077 kHz     50.000000 MHz
    DMT 0x0b:   800x600    75.000000 Hz   4:3     46.875 kHz     49.500000 MHz
    Apple   :   832x624    74.551266 Hz   4:3     49.726 kHz     57.284000 MHz
    DMT 0x10:  1024x768    60.003840 Hz   4:3     48.363 kHz     65.000000 MHz
    DMT 0x11:  1024x768    70.069359 Hz   4:3     56.476 kHz     75.000000 MHz
    DMT 0x12:  1024x768    75.028582 Hz   4:3     60.023 kHz     78.750000 MHz
    DMT 0x24:  1280x1024   75.024675 Hz   5:4     79.976 kHz    135.000000 MHz
  Standard Timings:
    DMT 0x15:  1152x864    75.000000 Hz   4:3     67.500 kHz    108.000000 MHz
    DMT 0x20:  1280x960    60.000000 Hz   4:3     60.000 kHz    108.000000 MHz
  Detailed Timing Descriptors:
    DTD 1:  1280x1024   75.024675 Hz   5:4     79.976 kHz    135.000000 MHz (340 mm x 270 mm)
                 Hfront   16 Hsync 144 Hback  248 Hpol P
                 Vfront    1 Vsync   3 Vback   38 Vpol P
    Display Range Limits:
      Monitor ranges (Unknown (0x0a)): 56-76 Hz V, 30-80 kHz H, max dotclock 140 MHz
    Display Product Serial Number: ...
    Display Product Name: '17" TFT-LCD'
Checksum: 0xf0

----------------

Warnings:

Block 0, Base EDID:
  Vendor & Product Identification: The serial number is one of the known dummy values, it should probably be set to 0.
  Display Product Serial Number: ...

Failures:

Block 0, Base EDID:
  Display Range Limits: Unknown range class (0x0a).
  Display Range Limits: Byte 11 is 0x20 instead of 0x0a.
  Display Product Name: Non-space after newline.

EDID conformity: FAIL
