edid-decode (hex):

00 ff ff ff ff ff ff 00 09 e5 13 08 00 00 00 00
01 1c 01 04 95 1a 0e 78 0a 81 c0 96 59 5a 9a 29
1f 50 54 00 00 00 01 01 01 01 01 01 01 01 01 01
01 01 01 01 01 01 6b 1b 56 64 50 00 1e 30 26 18
44 00 00 90 10 00 00 1a ef 15 56 64 50 00 1e 30
26 18 44 00 00 90 10 00 00 00 00 00 00 fe 00 42
4f 45 20 48 46 0a 20 20 20 20 20 20 00 00 00 fe
00 4e 56 31 31 36 57 48 4d 2d 54 30 31 0a 00 86

00 ff ff ff ff ff ff 00 09 e5 13 08 00 00 00 00
01 1c 01 04 95 1a 0e 78 0a 81 c0 96 59 5a 9a 29
1f 50 54 00 00 00 01 01 01 01 01 01 01 01 01 01
01 01 01 01 01 01 6b 1b 56 64 50 00 1e 30 26 18
44 00 00 90 10 00 00 1a ef 15 56 64 50 00 1e 30
26 18 44 00 00 90 10 00 00 00 00 00 00 fe 00 42
4f 45 20 48 46 0a 20 20 20 20 20 20 00 00 00 fe
00 4e 56 31 31 36 57 48 4d 2d 54 30 31 0a 00 86

----------------

Block 0, Base EDID:
  EDID Structure Version & Revision: 1.4
  Vendor & Product Identification:
    Manufacturer: BOE
    Model: 2067
    Made in: week 1 of 2018
  Basic Display Parameters & Features:
    Digital display
    Bits per primary color channel: 6
    DisplayPort interface
    Maximum image size: 26 cm x 14 cm
    Gamma: 2.20
    Supported color formats: RGB 4:4:4, YCrCb 4:4:4
    First detailed timing includes the native pixel format and preferred refresh rate
  Color Characteristics:
    Red  : 0.5878, 0.3476
    Green: 0.3515, 0.6025
    Blue : 0.1630, 0.1210
    White: 0.3125, 0.3281
  Established Timings I & II: none
  Standard Timings: none
  Detailed Timing Descriptors:
    DTD 1:  1366x768    59.998222 Hz 683:384   47.879 kHz     70.190000 MHz (256 mm x 144 mm)
                 Hfront   38 Hsync  24 Hback   38 Hpol P
                 Vfront    4 Vsync   4 Vback   22 Vpol N
    DTD 2:  1366x768    47.996868 Hz 683:384   38.302 kHz     56.150000 MHz (analog composite, sync-on-green, 256 mm x 144 mm)
                 Hfront   38 Hsync  24 Hback   38 Hpol N
                 Vfront    4 Vsync   4 Vback   22 Vpol N
    Alphanumeric Data String: 'BOE HF'
    Alphanumeric Data String: 'NV116WHM-T01'
Checksum: 0x86

----------------

Warnings:

Block 0, Base EDID:
  Missing Display Product Name.

Failures:

EDID:
  Extension Block 1 started with EDID header, ignoring Extension Blocks >= 1.

EDID conformity: FAIL
