edid-decode (hex):

00 ff ff ff ff ff ff 00 4c 2d e9 71 39 55 4b 35
20 21 01 03 80 3c 22 78 2a bd b5 a7 53 4b a2 24
0c 50 54 a1 08 00 d1 c0 a9 c0 81 c0 b3 00 95 00
81 00 81 80 01 01 56 5e 00 a0 a0 a0 29 50 30 20
35 00 56 50 21 00 00 1a 00 00 00 fd 00 30 4b 1e
70 1f 00 0a 20 20 20 20 20 20 00 00 00 fc 00 4c
53 32 37 42 36 31 78 0a 20 20 20 20 00 00 00 ff
00 48 34 54 57 38 30 30 33 31 37 0a 20 20 01 ce

02 03 27 f1 49 90 1f 04 13 12 11 03 02 01 23 09
07 07 83 01 00 00 67 03 0c 00 10 00 00 3d 68 1a
00 00 01 01 30 4b 00 d9 76 00 a0 a0 a0 34 50 30
20 35 00 56 50 21 00 00 1a 02 3a 80 18 71 38 2d
40 58 2c 45 00 56 50 21 00 00 1e 2a 44 80 a0 70
38 27 40 30 20 35 00 56 50 21 00 00 1a 01 1d 00
72 51 d0 1e 20 6e 28 55 00 56 50 21 00 00 1e 00
00 00 00 00 00 00 00 00 00 00 00 00 00 00 00 b8

00 ff ff ff ff ff ff 00 4c 2d e9 71 39 55 4b 35
20 21 01 03 80 3c 22 78 2a bd b5 a7 53 4b a2 24
0c 50 54 a1 08 00 d1 c0 a9 c0 81 c0 b3 00 95 00
81 00 81 80 01 01 56 5e 00 a0 a0 a0 29 50 30 20
35 00 56 50 21 00 00 1a 00 00 00 fd 00 30 4b 1e
70 1f 00 0a 20 20 20 20 20 20 00 00 00 fc 00 4c
53 32 37 42 36 31 78 0a 20 20 20 20 00 00 00 ff
00 48 34 54 57 38 30 30 33 31 37 0a 20 20 01 ce

02 03 27 f1 49 90 1f 04 13 12 11 03 02 01 23 09
07 07 83 01 00 00 67 03 0c 00 10 00 00 3d 68 1a
00 00 01 01 30 4b 00 d9 76 00 a0 a0 a0 34 50 30
20 35 00 56 50 21 00 00 1a 02 3a 80 18 71 38 2d
40 58 2c 45 00 56 50 21 00 00 1e 2a 44 80 a0 70
38 27 40 30 20 35 00 56 50 21 00 00 1a 01 1d 00
72 51 d0 1e 20 6e 28 55 00 56 50 21 00 00 1e 00
00 00 00 00 00 00 00 00 00 00 00 00 00 00 00 b8

----------------

Block 0, Base EDID:
  EDID Structure Version & Revision: 1.3
  Vendor & Product Identification:
    Manufacturer: SAM
    Model: 29161
    Serial Number: ...
    Made in: week 32 of 2023
  Basic Display Parameters & Features:
    Digital display
    Maximum image size: 60 cm x 34 cm
    Gamma: 2.20
    DPMS levels: Off
    RGB color display
    First detailed timing is the preferred timing
  Color Characteristics:
    Red  : 0.6542, 0.3271
    Green: 0.2958, 0.6337
    Blue : 0.1425, 0.0498
    White: 0.3134, 0.3291
  Established Timings I & II:
    IBM     :   720x400    70.081663 Hz   9:5     31.467 kHz     28.320000 MHz
    DMT 0x04:   640x480    59.940476 Hz   4:3     31.469 kHz     25.175000 MHz
    DMT 0x09:   800x600    60.316541 Hz   4:3     37.879 kHz     40.000000 MHz
    DMT 0x10:  1024x768    60.003840 Hz   4:3     48.363 kHz     65.000000 MHz
  Standard Timings:
    DMT 0x52:  1920x1080   60.000000 Hz  16:9     67.500 kHz    148.500000 MHz
    DMT 0x53:  1600x900    60.000000 Hz  16:9     60.000 kHz    108.000000 MHz (RB)
    DMT 0x55:  1280x720    60.000000 Hz  16:9     45.000 kHz     74.250000 MHz
    DMT 0x3a:  1680x1050   59.954250 Hz  16:10    65.290 kHz    146.250000 MHz
    DMT 0x2f:  1440x900    59.887445 Hz  16:10    55.935 kHz    106.500000 MHz
    DMT 0x1c:  1280x800    59.810326 Hz  16:10    49.702 kHz     83.500000 MHz
    DMT 0x23:  1280x1024   60.019740 Hz   5:4     63.981 kHz    108.000000 MHz
  Detailed Timing Descriptors:
    DTD 1:  2560x1440   59.950550 Hz  16:9     88.787 kHz    241.500000 MHz (598 mm x 336 mm)
                 Hfront   48 Hsync  32 Hback   80 Hpol P
                 Vfront    3 Vsync   5 Vback   33 Vpol N
    Display Range Limits:
      Monitor ranges (GTF): 48-75 Hz V, 30-112 kHz H, max dotclock 310 MHz
    Display Product Name: 'LS27B61x'
    Display Product Serial Number: ...
  Extension blocks: 1
Checksum: 0xce

----------------

Block 1, CTA-861 Extension Block:
  Revision: 3
  Underscans IT Video Formats by default
  Basic audio support
  Supports YCbCr 4:4:4
  Supports YCbCr 4:2:2
  Native DTDs: 1
  Video Data Block:
    VIC  16:  1920x1080   60.000000 Hz  16:9     67.500 kHz    148.500000 MHz (native)
    VIC  31:  1920x1080   50.000000 Hz  16:9     56.250 kHz    148.500000 MHz
    VIC   4:  1280x720    60.000000 Hz  16:9     45.000 kHz     74.250000 MHz
    VIC  19:  1280x720    50.000000 Hz  16:9     37.500 kHz     74.250000 MHz
    VIC  18:   720x576    50.000000 Hz  16:9     31.250 kHz     27.000000 MHz
    VIC  17:   720x576    50.000000 Hz   4:3     31.250 kHz     27.000000 MHz
    VIC   3:   720x480    59.940060 Hz  16:9     31.469 kHz     27.000000 MHz
    VIC   2:   720x480    59.940060 Hz   4:3     31.469 kHz     27.000000 MHz
    VIC   1:   640x480    59.940476 Hz   4:3     31.469 kHz     25.175000 MHz
  Audio Data Block:
    Linear PCM:
      Max channels: 2
      Supported sample rates (kHz): 48 44.1 32
      Supported sample sizes (bits): 24 20 16
  Speaker Allocation Data Block:
    FL/FR - Front Left/Right
  Vendor-Specific Data Block (HDMI), OUI 00-0C-03:
    Source physical address: 1.0.0.0
    Maximum TMDS clock: 305 MHz
  Vendor-Specific Data Block (AMD), OUI 00-00-1A:
    Version: 1
    Flags 1: 0x01
      FreeSync Supported
    Minimum Refresh Rate: 48 Hz
    Maximum Refresh Rate: 75 Hz
  Detailed Timing Descriptors:
    DTD 2:  2560x1440   74.970923 Hz  16:9    111.857 kHz    304.250000 MHz (598 mm x 336 mm)
                 Hfront   48 Hsync  32 Hback   80 Hpol P
                 Vfront    3 Vsync   5 Vback   44 Vpol N
    DTD 3:  1920x1080   60.000000 Hz  16:9     67.500 kHz    148.500000 MHz (598 mm x 336 mm)
                 Hfront   88 Hsync  44 Hback  148 Hpol P
                 Vfront    4 Vsync   5 Vback   36 Vpol P
    DTD 4:  1920x1080   74.972503 Hz  16:9     83.894 kHz    174.500000 MHz (598 mm x 336 mm)
                 Hfront   48 Hsync  32 Hback   80 Hpol P
                 Vfront    3 Vsync   5 Vback   31 Vpol N
    DTD 5:  1280x720    60.000000 Hz  16:9     45.000 kHz     74.250000 MHz (598 mm x 336 mm)
                 Hfront  110 Hsync  40 Hback  220 Hpol P
                 Vfront    5 Vsync   5 Vback   20 Vpol P
Checksum: 0xb8  Unused space in Extension Block: 16 bytes

----------------

Warnings:

Block 1, CTA-861 Extension Block:
  Video Data Block: VIC 16 and the first DTD are not identical. Is this intended?
  Display Product Serial Number is set, so the Serial Number in the Base EDID should be 0.
  Add a Colorimetry Data Block with the sRGB colorimetry bit set to avoid interop issues.

Failures:

Block 1, CTA-861 Extension Block:
  Missing VCDB, needed for Set Selectable RGB Quantization to avoid interop issues.
EDID:
  Extension Block 2 started with EDID header, ignoring Extension Blocks >= 2.
  CTA-861: Native progressive timings are a mix of several resolutions.

EDID conformity: FAIL
