edid-decode (hex):

00 ff ff ff ff ff ff 00 51 b8 01 00 00 00 00 00
12 20 01 04 b5 1d 12 78 07 0f 91 ae 52 43 b0 26
0f 50 54 00 00 00 01 01 01 01 01 01 01 01 01 01
01 01 01 01 01 01 07 6f 00 af a0 40 84 60 30 20
36 00 20 b4 10 00 00 18 00 00 00 fd 0c 3a a5 1f
1f 4f 01 0a 20 20 20 20 20 20 00 00 00 10 00 20
20 20 20 20 20 20 20 20 20 20 20 20 00 00 00 fc
00 54 4c 31 33 34 41 44 58 50 30 31 2d 30 01 6b

70 20 79 02 00 22 00 14 28 ed 0b 85 ff 09 ae 00
2f 00 1f 00 3f 06 83 00 02 00 05 00 2b 00 06 27
00 3c a4 00 00 81 00 13 72 1a 00 00 03 01 3a a5
00 00 00 00 00 00 a5 00 00 00 00 00 00 00 00 00
00 00 00 00 00 00 00 00 00 00 00 00 00 00 00 00
00 00 00 00 00 00 00 00 00 00 00 00 00 00 00 00
00 00 00 00 00 00 00 00 00 00 00 00 00 00 00 00
00 00 00 00 00 00 00 00 00 00 00 00 00 00 d7 90

00 ff ff ff ff ff ff 00 51 b8 01 00 00 00 00 00
12 20 01 04 b5 1d 12 78 07 0f 91 ae 52 43 b0 26
0f 50 54 00 00 00 01 01 01 01 01 01 01 01 01 01
01 01 01 01 01 01 07 6f 00 af a0 40 84 60 30 20
36 00 20 b4 10 00 00 18 00 00 00 fd 0c 3a a5 1f
1f 4f 01 0a 20 20 20 20 20 20 00 00 00 10 00 20
20 20 20 20 20 20 20 20 20 20 20 20 00 00 00 fc
00 54 4c 31 33 34 41 44 58 50 30 31 2d 30 01 6b

70 20 79 02 00 22 00 14 28 ed 0b 85 ff 09 ae 00
2f 00 1f 00 3f 06 83 00 02 00 05 00 2b 00 06 27
00 3c a4 00 00 81 00 13 72 1a 00 00 03 01 3a a5
00 00 00 00 00 00 a5 00 00 00 00 00 00 00 00 00
00 00 00 00 00 00 00 00 00 00 00 00 00 00 00 00
00 00 00 00 00 00 00 00 00 00 00 00 00 00 00 00
00 00 00 00 00 00 00 00 00 00 00 00 00 00 00 00
00 00 00 00 00 00 00 00 00 00 00 00 00 00 d7 90

----------------

Block 0, Base EDID:
  EDID Structure Version & Revision: 1.4
  Vendor & Product Identification:
    Manufacturer: TMX
    Model: 1
    Made in: week 18 of 2022
  Basic Display Parameters & Features:
    Digital display
    Bits per primary color channel: 10
    DisplayPort interface
    Maximum image size: 29 cm x 18 cm
    Gamma: 2.20
    Supported color formats: RGB 4:4:4
    Default (sRGB) color space is primary color space
    First detailed timing includes the native pixel format and preferred refresh rate
    Display supports continuous frequencies
  Color Characteristics:
    Red  : 0.6796, 0.3203
    Green: 0.2646, 0.6904
    Blue : 0.1503, 0.0595
    White: 0.3125, 0.3291
  Established Timings I & II: none
  Standard Timings: none
  Detailed Timing Descriptors:
    DTD 1:  2560x1600   60.001858 Hz  16:10   103.923 kHz    284.230000 MHz (288 mm x 180 mm)
                 Hfront   48 Hsync  32 Hback   95 Hpol N
                 Vfront    3 Vsync   6 Vback  123 Vpol N
    Display Range Limits:
      Monitor ranges (Range Limits Only): 58-165 Hz V, 286-286 kHz H, max dotclock 790 MHz
    Dummy Descriptor:
    Display Product Name: 'TL134ADXP01-0'
  Extension blocks: 1
Checksum: 0x6b

----------------

Block 1, DisplayID Extension Block:
  Version: 2.0
  Extension Count: 0
  Display Product Primary Use Case: None of the listed primary use cases; generic display
  Video Timing Modes Type 7 - Detailed Timings Data Block:
    DTD:  2560x1600  165.000148 Hz  16:10   285.780 kHz    781.609000 MHz (aspect 16:10, no 3D stereo, preferred)
               Hfront   48 Hsync  32 Hback   95 Hpol N
               Vfront    3 Vsync   6 Vback  123 Vpol N
  Adaptive Sync Data Block:
    Descriptor #1:
      Native Panel Range
      Fixed Average V-Total and Adaptive V-Total
      Supports Seamless Transition
      'Max Single Frame Duration Increase' field value without jitter impact
      'Max Single Frame Duration Decrease' field value without jitter impact
      Max Duration Increase: 0.00 ms
      Max Duration Decrease: 0.00 ms
      Min Refresh Rate: 60 Hz
      Max Refresh Rate: 165 Hz
  CTA-861 DisplayID Data Block:
  Vendor-Specific Data Block (AMD), OUI 00-00-1A:
    Version: 3
    Feature Caps: 0x01
    Minimum Refresh Rate: 58 Hz
    Maximum Refresh Rate: 165 Hz
    Flags 1.x: 0x00
    Flags 2.x: 0x00
  Checksum: 0xd7
Checksum: 0x90

----------------

Warnings:

EDID:
  Base EDID: Some timings are out of range of the Monitor Ranges:
    Horizontal Freq: 103.923 - 285.780 kHz (Monitor: 286.000 - 286.000 kHz)

Failures:

Block 0, Base EDID:
  Basic Display Parameters & Features: sRGB is signaled, but the chromaticities do not match.
  Dummy Descriptor: Dummy block filled with garbage.
EDID:
  Extension Block 2 started with EDID header, ignoring Extension Blocks >= 2.
  DisplayID: Missing DisplayID Display Parameters Data Block.

EDID conformity: FAIL
