edid-decode (hex):

00 ff ff ff ff ff ff 00 30 e4 15 07 00 00 00 00
00 1f 01 04 a5 1d 12 78 07 bb e5 a5 53 4c 9e 27
0b 50 54 00 00 00 01 01 01 01 01 01 01 01 01 01
01 01 01 01 01 01 ec 68 00 a0 a0 40 2e 60 30 20
36 00 1e b3 10 00 00 1a f3 45 00 a0 a0 40 2e 60
30 20 36 00 1e b3 10 00 00 1a 00 00 00 00 00 00
00 00 00 00 00 00 00 00 00 00 00 00 00 00 00 02
00 0c 26 ff 14 3c c8 11 0b 26 c8 00 00 00 01 f7

70 20 79 00 00 25 01 09 8c bb 02 37 19 04 28 3c
80 81 00 13 72 1a 00 00 03 01 28 3c 00 00 60 50
60 50 3c 00 00 00 00 00 00 00 00 00 00 00 00 00
00 00 00 00 00 00 00 00 00 00 00 00 00 00 00 00
00 00 00 00 00 00 00 00 00 00 00 00 00 00 00 00
00 00 00 00 00 00 00 00 00 00 00 00 00 00 00 00
00 00 00 00 00 00 00 00 00 00 00 00 00 00 00 00
00 00 00 00 00 00 00 00 00 00 00 00 00 00 93 90

00 ff ff ff ff ff ff 00 30 e4 15 07 00 00 00 00
00 1f 01 04 a5 1d 12 78 07 bb e5 a5 53 4c 9e 27
0b 50 54 00 00 00 01 01 01 01 01 01 01 01 01 01
01 01 01 01 01 01 ec 68 00 a0 a0 40 2e 60 30 20
36 00 1e b3 10 00 00 1a f3 45 00 a0 a0 40 2e 60
30 20 36 00 1e b3 10 00 00 1a 00 00 00 00 00 00
00 00 00 00 00 00 00 00 00 00 00 00 00 00 00 02
00 0c 26 ff 14 3c c8 11 0b 26 c8 00 00 00 01 f7

70 20 79 00 00 25 01 09 8c bb 02 37 19 04 28 3c
80 81 00 13 72 1a 00 00 03 01 28 3c 00 00 60 50
60 50 3c 00 00 00 00 00 00 00 00 00 00 00 00 00
00 00 00 00 00 00 00 00 00 00 00 00 00 00 00 00
00 00 00 00 00 00 00 00 00 00 00 00 00 00 00 00
00 00 00 00 00 00 00 00 00 00 00 00 00 00 00 00
00 00 00 00 00 00 00 00 00 00 00 00 00 00 00 00
00 00 00 00 00 00 00 00 00 00 00 00 00 00 93 90

----------------

Block 0, Base EDID:
  EDID Structure Version & Revision: 1.4
  Vendor & Product Identification:
    Manufacturer: LGD
    Model: 1813
    Made in: 2021
  Basic Display Parameters & Features:
    Digital display
    Bits per primary color channel: 8
    DisplayPort interface
    Maximum image size: 29 cm x 18 cm
    Gamma: 2.20
    Supported color formats: RGB 4:4:4
    Default (sRGB) color space is primary color space
    First detailed timing includes the native pixel format and preferred refresh rate
    Display supports continuous frequencies
  Color Characteristics:
    Red  : 0.6464, 0.3271
    Green: 0.2988, 0.6201
    Blue : 0.1552, 0.0449
    White: 0.3134, 0.3291
  Established Timings I & II: none
  Standard Timings: none
  Detailed Timing Descriptors:
    DTD 1:  2560x1600   59.993925 Hz  16:10    98.750 kHz    268.600000 MHz (286 mm x 179 mm)
                 Hfront   48 Hsync  32 Hback   80 Hpol P
                 Vfront    3 Vsync   6 Vback   37 Vpol N
    DTD 2:  2560x1600   39.996694 Hz  16:10    65.835 kHz    179.070000 MHz (286 mm x 179 mm)
                 Hfront   48 Hsync  32 Hback   80 Hpol P
                 Vfront    3 Vsync   6 Vback   37 Vpol N
    Empty Descriptor
    Manufacturer-Specified Display Descriptor (0x02): 00 02 00 0c 26 ff 14 3c c8 11 0b 26 c8 00 00 00 '....&..<...&....'
  Extension blocks: 1
Checksum: 0xf7

----------------

Block 1, DisplayID Extension Block:
  Version: 2.0
  Extension Count: 0
  Display Product Primary Use Case: Same primary use case as the base section
  Dynamic Video Timing Range Limits Data Block:
    Minimum Pixel Clock: 179085 kHz
    Maximum Pixel Clock: 268600 kHz
    Minimum Vertical Refresh Rate: 40 Hz
    Maximum Vertical Refresh Rate: 60 Hz
    Seamless Dynamic Video Timing Support: Yes
  CTA-861 DisplayID Data Block:
  Vendor-Specific Data Block (AMD), OUI 00-00-1A:
    Version: 3
    Flags 1: 0x01
      FreeSync Supported
    Minimum Refresh Rate: 40 Hz
    Maximum Refresh Rate: 60 Hz
    Flags 5: 0x00
  Checksum: 0x93
Checksum: 0x90

----------------

Warnings:

Block 0, Base EDID:
  Missing Display Product Name.

Failures:

Block 0, Base EDID:
  Basic Display Parameters & Features: sRGB is signaled, but the chromaticities do not match.
  Empty Descriptor: Use Dummy Descriptor instead of all zeroes.
  Missing Display Range Limits Descriptor.
Block 1, DisplayID Extension Block:
  DisplayID Base Block has no product type.
EDID:
  Extension Block 2 started with EDID header, ignoring Extension Blocks >= 2.
  DisplayID: DisplayID expects at least one preferred timing.

EDID conformity: FAIL
