edid-decode (hex):

00 ff ff ff ff ff ff 00 41 0c 8e 09 6b 01 00 00
15 21 01 04 b5 6d 1f 78 3f 8a 75 a9 4f 4a a8 27
0b 50 54 bf ef 00 d1 c0 b3 00 95 00 81 80 81 40
81 c0 01 01 01 01 0e 69 00 b4 f0 38 23 40 30 20
3a 00 41 32 41 00 00 1a 00 00 00 ff 00 41 55 30
32 33 32 31 30 30 30 33 36 33 00 00 00 fc 00 50
48 4c 20 34 35 42 31 55 36 39 30 30 00 00 00 fd
00 1e 4b 72 72 3c 01 0a 20 20 20 20 20 20 02 1c

02 03 2c f1 4b 01 03 05 14 04 13 1f 12 02 11 90
23 09 07 07 83 01 00 00 e3 05 c3 01 e6 06 05 01
66 66 25 68 1a 00 00 01 01 30 4b 00 51 83 00 b4
f0 38 23 40 30 20 3a 00 41 32 41 00 00 1a 02 76
00 a0 a0 a0 29 50 30 20 98 04 41 32 41 00 00 1a
56 5e 00 a0 a0 a0 29 50 30 20 35 00 41 32 41 00
00 1e 00 00 00 00 00 00 00 00 00 00 00 00 00 00
00 00 00 00 00 00 00 00 00 00 00 00 00 00 00 e5

70 12 79 03 00 03 01 50 17 e5 00 88 ff 13 9f 00
2f 80 1f 00 9f 05 28 00 02 00 09 00 be d6 00 08
ff 13 9f 00 2f 80 1f 00 9f 05 28 00 02 00 09 00
33 b7 00 08 ff 13 9f 00 2f 80 1f 00 9f 05 28 00
02 00 09 00 55 5a 00 08 ff 13 9f 00 2f 80 1f 00
9f 05 14 00 02 00 09 00 00 00 00 00 00 00 00 00
00 00 00 00 00 00 00 00 00 00 00 00 00 00 00 00
00 00 00 00 00 00 00 00 00 00 00 00 00 00 11 90

00 ff ff ff ff ff ff 00 41 0c 8e 09 6b 01 00 00
15 21 01 04 b5 6d 1f 78 3f 8a 75 a9 4f 4a a8 27
0b 50 54 bf ef 00 d1 c0 b3 00 95 00 81 80 81 40
81 c0 01 01 01 01 0e 69 00 b4 f0 38 23 40 30 20
3a 00 41 32 41 00 00 1a 00 00 00 ff 00 41 55 30
32 33 32 31 30 30 30 33 36 33 00 00 00 fc 00 50
48 4c 20 34 35 42 31 55 36 39 30 30 00 00 00 fd
00 1e 4b 72 72 3c 01 0a 20 20 20 20 20 20 02 1c

02 03 2c f1 4b 01 03 05 14 04 13 1f 12 02 11 90
23 09 07 07 83 01 00 00 e3 05 c3 01 e6 06 05 01
66 66 25 68 1a 00 00 01 01 30 4b 00 51 83 00 b4
f0 38 23 40 30 20 3a 00 41 32 41 00 00 1a 02 76
00 a0 a0 a0 29 50 30 20 98 04 41 32 41 00 00 1a
56 5e 00 a0 a0 a0 29 50 30 20 35 00 41 32 41 00
00 1e 00 00 00 00 00 00 00 00 00 00 00 00 00 00
00 00 00 00 00 00 00 00 00 00 00 00 00 00 00 e5

70 12 79 03 00 03 01 50 17 e5 00 88 ff 13 9f 00
2f 80 1f 00 9f 05 28 00 02 00 09 00 be d6 00 08
ff 13 9f 00 2f 80 1f 00 9f 05 28 00 02 00 09 00
33 b7 00 08 ff 13 9f 00 2f 80 1f 00 9f 05 28 00
02 00 09 00 55 5a 00 08 ff 13 9f 00 2f 80 1f 00
9f 05 14 00 02 00 09 00 00 00 00 00 00 00 00 00
00 00 00 00 00 00 00 00 00 00 00 00 00 00 00 00
00 00 00 00 00 00 00 00 00 00 00 00 00 00 11 90

----------------

Block 0, Base EDID:
  EDID Structure Version & Revision: 1.4
  Vendor & Product Identification:
    Manufacturer: PHL
    Model: 2446
    Serial Number: ...
    Made in: week 21 of 2023
  Basic Display Parameters & Features:
    Digital display
    Bits per primary color channel: 10
    DisplayPort interface
    Maximum image size: 109 cm x 31 cm
    Gamma: 2.20
    DPMS levels: Off
    Supported color formats: RGB 4:4:4, YCrCb 4:4:4, YCrCb 4:2:2
    Default (sRGB) color space is primary color space
    First detailed timing includes the native pixel format and preferred refresh rate
    Display supports continuous frequencies
  Color Characteristics:
    Red  : 0.6621, 0.3085
    Green: 0.2910, 0.6582
    Blue : 0.1533, 0.0458
    White: 0.3134, 0.3291
  Established Timings I & II:
    IBM     :   720x400    70.081663 Hz   9:5     31.467 kHz     28.320000 MHz
    DMT 0x04:   640x480    59.940476 Hz   4:3     31.469 kHz     25.175000 MHz
    Apple   :   640x480    66.666667 Hz   4:3     35.000 kHz     30.240000 MHz
    DMT 0x05:   640x480    72.808802 Hz   4:3     37.861 kHz     31.500000 MHz
    DMT 0x06:   640x480    75.000000 Hz   4:3     37.500 kHz     31.500000 MHz
    DMT 0x08:   800x600    56.250000 Hz   4:3     35.156 kHz     36.000000 MHz
    DMT 0x09:   800x600    60.316541 Hz   4:3     37.879 kHz     40.000000 MHz
    DMT 0x0a:   800x600    72.187572 Hz   4:3     48.077 kHz     50.000000 MHz
    DMT 0x0b:   800x600    75.000000 Hz   4:3     46.875 kHz     49.500000 MHz
    Apple   :   832x624    74.551266 Hz   4:3     49.726 kHz     57.284000 MHz
    DMT 0x10:  1024x768    60.003840 Hz   4:3     48.363 kHz     65.000000 MHz
    DMT 0x11:  1024x768    70.069359 Hz   4:3     56.476 kHz     75.000000 MHz
    DMT 0x12:  1024x768    75.028582 Hz   4:3     60.023 kHz     78.750000 MHz
    DMT 0x24:  1280x1024   75.024675 Hz   5:4     79.976 kHz    135.000000 MHz
  Standard Timings:
    DMT 0x52:  1920x1080   60.000000 Hz  16:9     67.500 kHz    148.500000 MHz
    DMT 0x3a:  1680x1050   59.954250 Hz  16:10    65.290 kHz    146.250000 MHz
    DMT 0x2f:  1440x900    59.887445 Hz  16:10    55.935 kHz    106.500000 MHz
    DMT 0x23:  1280x1024   60.019740 Hz   5:4     63.981 kHz    108.000000 MHz
    DMT 0x20:  1280x960    60.000000 Hz   4:3     60.000 kHz    108.000000 MHz
    DMT 0x55:  1280x720    60.000000 Hz  16:9     45.000 kHz     74.250000 MHz
  Detailed Timing Descriptors:
    DTD 1:  3840x1080   60.000446 Hz  32:9     66.900 kHz    268.940000 MHz (1089 mm x 306 mm)
                 Hfront   48 Hsync  32 Hback  100 Hpol P
                 Vfront    3 Vsync  10 Vback   22 Vpol N
    Display Product Serial Number: ...
    Display Product Name: 'PHL 45B1U6900'
    Display Range Limits:
      Monitor ranges (Range Limits Only): 30-75 Hz V, 114-114 kHz H, max dotclock 600 MHz
  Extension blocks: 2
Checksum: 0x1c

----------------

Block 1, CTA-861 Extension Block:
  Revision: 3
  Underscans IT Video Formats by default
  Basic audio support
  Supports YCbCr 4:4:4
  Supports YCbCr 4:2:2
  Native DTDs: 1
  Video Data Block:
    VIC   1:   640x480    59.940476 Hz   4:3     31.469 kHz     25.175000 MHz
    VIC   3:   720x480    59.940060 Hz  16:9     31.469 kHz     27.000000 MHz
    VIC   5:  1920x1080i  60.000000 Hz  16:9     33.750 kHz     74.250000 MHz
    VIC  20:  1920x1080i  50.000000 Hz  16:9     28.125 kHz     74.250000 MHz
    VIC   4:  1280x720    60.000000 Hz  16:9     45.000 kHz     74.250000 MHz
    VIC  19:  1280x720    50.000000 Hz  16:9     37.500 kHz     74.250000 MHz
    VIC  31:  1920x1080   50.000000 Hz  16:9     56.250 kHz    148.500000 MHz
    VIC  18:   720x576    50.000000 Hz  16:9     31.250 kHz     27.000000 MHz
    VIC   2:   720x480    59.940060 Hz   4:3     31.469 kHz     27.000000 MHz
    VIC  17:   720x576    50.000000 Hz   4:3     31.250 kHz     27.000000 MHz
    VIC  16:  1920x1080   60.000000 Hz  16:9     67.500 kHz    148.500000 MHz (native)
  Audio Data Block:
    Linear PCM:
      Max channels: 2
      Supported sample rates (kHz): 48 44.1 32
      Supported sample sizes (bits): 24 20 16
  Speaker Allocation Data Block:
    FL/FR - Front Left/Right
  Colorimetry Data Block:
    xvYCC601
    xvYCC709
    BT2020YCC
    BT2020RGB
    Gamut Boundary Description Metadata Profile P0
  HDR Static Metadata Data Block:
    Electro optical transfer functions:
      Traditional gamma - SDR luminance range
      SMPTE ST2084
    Supported static metadata descriptors:
      Static metadata type 1
    Desired content max luminance: 102 (455.515 cd/m^2)
    Desired content max frame-average luminance: 102 (455.515 cd/m^2)
    Desired content min luminance: 37 (0.096 cd/m^2)
  Vendor-Specific Data Block (AMD), OUI 00-00-1A:
    Version: 1
    Flags 1: 0x01
      FreeSync Supported
    Minimum Refresh Rate: 48 Hz
    Maximum Refresh Rate: 75 Hz
  Detailed Timing Descriptors:
    DTD 2:  3840x1080   74.999442 Hz  32:9     83.624 kHz    336.170000 MHz (1089 mm x 306 mm)
                 Hfront   48 Hsync  32 Hback  100 Hpol P
                 Vfront    3 Vsync  10 Vback   22 Vpol N
    DTD 3:  2560x1440   74.994042 Hz  16:9    111.066 kHz    302.100000 MHz (1089 mm x 306 mm)
                 Hfront   48 Hsync  32 Hback   80 Hpol P
                 Vfront   25 Vsync   8 Vback    8 Vpol N
    DTD 4:  2560x1440   59.950550 Hz  16:9     88.787 kHz    241.500000 MHz (1089 mm x 306 mm)
                 Hfront   48 Hsync  32 Hback   80 Hpol P
                 Vfront    3 Vsync   5 Vback   33 Vpol P
Checksum: 0xe5  Unused space in Extension Block: 29 bytes

----------------

Block 2, DisplayID Extension Block:
  Version: 1.2
  Extension Count: 0
  Display Product Type: Standalone display device
  Video Timing Modes Type 1 - Detailed Timings Data Block:
    DTD:  5120x1440   75.000512 Hz   0:0    111.076 kHz    586.480000 MHz (aspect undefined, no 3D stereo, preferred)
               Hfront   48 Hsync  32 Hback   80 Hpol P
               Vfront    3 Vsync  10 Vback   28 Vpol N
    DTD:  5120x1440   70.303388 Hz   0:0    104.119 kHz    549.750000 MHz (aspect undefined, no 3D stereo)
               Hfront   48 Hsync  32 Hback   80 Hpol P
               Vfront    3 Vsync  10 Vback   28 Vpol N
    DTD:  5120x1440   59.976879 Hz   0:0     88.826 kHz    469.000000 MHz (aspect undefined, no 3D stereo)
               Hfront   48 Hsync  32 Hback   80 Hpol P
               Vfront    3 Vsync  10 Vback   28 Vpol N
    DTD:  5120x1440   29.978948 Hz   0:0     43.799 kHz    231.260000 MHz (aspect undefined, no 3D stereo)
               Hfront   48 Hsync  32 Hback   80 Hpol P
               Vfront    3 Vsync  10 Vback    8 Vpol N
  Checksum: 0x11
Checksum: 0x90

----------------

Warnings:

Block 1, CTA-861 Extension Block:
  Video Data Block: VIC 1 and the first DTD are not identical. Is this intended?
  Detailed Timing Descriptor #3: Image size is 1089x306 mm, but based on the picture AR it should be 544x306 mm.
  Detailed Timing Descriptor #4: Image size is 1089x306 mm, but based on the picture AR it should be 544x306 mm.
  Display Product Serial Number is set, so the Serial Number in the Base EDID should be 0.
EDID:
  Base EDID: Some timings are out of range of the Monitor Ranges:
    Horizontal Freq: 28.125 - 111.075 kHz (Monitor: 114.000 - 114.000 kHz)

Failures:

Block 0, Base EDID:
  Basic Display Parameters & Features: sRGB is signaled, but the chromaticities do not match.
Block 1, CTA-861 Extension Block:
  Missing VCDB, needed for Set Selectable RGB Quantization to avoid interop issues.
EDID:
  Extension Block 3 started with EDID header, ignoring Extension Blocks >= 3.
  CTA-861: Native progressive timings are a mix of several resolutions.
  DisplayID: Missing DisplayID Display Parameters Data Block.

EDID conformity: FAIL
