edid-decode (hex):

00 ff ff ff ff ff ff 00 1a b3 48 04 96 64 04 00
06 0e 01 03 80 1e 17 75 2a 80 f8 a3 55 47 99 24
0d 4d 50 a5 4e 00 61 40 61 4f 45 40 45 4f 31 40
31 4f 01 01 01 01 64 19 00 40 41 00 26 30 18 88
36 00 30 e4 10 00 00 18 00 00 00 ff 00 59 45 47
43 32 38 37 38 39 34 0a 20 20 00 00 00 fd 00 37
4b 1e 3f 08 00 0a 20 20 20 20 20 20 00 00 00 fc
00 50 31 35 2d 31 0a 20 20 20 20 20 20 20 00 4e

00 ff ff ff ff ff ff 00 1a b3 48 04 96 64 04 00
06 0e 01 03 80 1e 17 75 2a 80 f8 a3 55 47 99 24
0d 4d 50 a5 4e 00 61 40 61 4f 45 40 45 4f 31 40
31 4f 01 01 01 01 64 19 00 40 41 00 26 30 18 88
36 00 30 e4 10 00 00 18 00 00 00 ff 00 59 45 47
43 32 38 37 38 39 34 0a 20 20 00 00 00 fd 00 37
4b 1e 3f 08 00 0a 20 20 20 20 20 20 00 00 00 fc
00 50 31 35 2d 31 0a 20 20 20 20 20 20 20 00 4e

----------------

Block 0, Base EDID:
  EDID Structure Version & Revision: 1.3
  Vendor & Product Identification:
    Manufacturer: FUS
    Model: 1096
    Serial Number: ...
    Made in: week 6 of 2004
  Basic Display Parameters & Features:
    Digital display
    Maximum image size: 30 cm x 23 cm
    Gamma: 2.17
    DPMS levels: Off
    RGB color display
    First detailed timing is the preferred timing
  Color Characteristics:
    Red  : 0.6386, 0.3320
    Green: 0.2773, 0.5976
    Blue : 0.1435, 0.0537
    White: 0.3027, 0.3125
  Established Timings I & II:
    IBM     :   720x400    70.081663 Hz   9:5     31.467 kHz     28.320000 MHz
    DMT 0x04:   640x480    59.940476 Hz   4:3     31.469 kHz     25.175000 MHz
    DMT 0x06:   640x480    75.000000 Hz   4:3     37.500 kHz     31.500000 MHz
    DMT 0x09:   800x600    60.316541 Hz   4:3     37.879 kHz     40.000000 MHz
    DMT 0x0b:   800x600    75.000000 Hz   4:3     46.875 kHz     49.500000 MHz
    DMT 0x10:  1024x768    60.003840 Hz   4:3     48.363 kHz     65.000000 MHz
    DMT 0x11:  1024x768    70.069359 Hz   4:3     56.476 kHz     75.000000 MHz
    DMT 0x12:  1024x768    75.028582 Hz   4:3     60.023 kHz     78.750000 MHz
  Standard Timings:
    DMT 0x10:  1024x768    60.003840 Hz   4:3     48.363 kHz     65.000000 MHz
    DMT 0x12:  1024x768    75.028582 Hz   4:3     60.023 kHz     78.750000 MHz
    DMT 0x09:   800x600    60.316541 Hz   4:3     37.879 kHz     40.000000 MHz
    DMT 0x0b:   800x600    75.000000 Hz   4:3     46.875 kHz     49.500000 MHz
    DMT 0x04:   640x480    59.940476 Hz   4:3     31.469 kHz     25.175000 MHz
    DMT 0x06:   640x480    75.000000 Hz   4:3     37.500 kHz     31.500000 MHz
  Detailed Timing Descriptors:
    DTD 1:  1024x768    60.003840 Hz   4:3     48.363 kHz     65.000000 MHz (304 mm x 228 mm)
                 Hfront   24 Hsync 136 Hback  160 Hpol N
                 Vfront    3 Vsync   6 Vback   29 Vpol N
    Display Product Serial Number: ...
    Display Range Limits:
      Monitor ranges (GTF): 55-75 Hz V, 30-63 kHz H, max dotclock 80 MHz
    Display Product Name: 'P15-1'
Checksum: 0x4e

----------------

Failures:

EDID:
  Extension Block 1 started with EDID header, ignoring Extension Blocks >= 1.

EDID conformity: FAIL
