edid-decode (hex):

00 ff ff ff ff ff ff 00 34 38 75 07 f6 1c 06 00
29 0e 01 03 08 26 1e 96 28 67 55 a5 5b 47 9c 25
1e 4f 54 af cf 00 01 01 01 01 61 4c 81 80 01 01
01 01 01 01 01 01 d6 09 80 a0 20 5e 63 10 30 60
02 00 78 2d 11 00 00 1e 00 00 00 ff 00 34 34 31
41 41 30 31 34 30 30 36 33 30 00 00 00 fc 00 31
30 31 39 30 35 0a 20 20 20 20 20 20 00 00 00 fd
00 38 4b 1f 50 0e 00 0a 20 20 20 20 20 20 00 49

----------------

Block 0, Base EDID:
  EDID Structure Version & Revision: 1.3
  Vendor & Product Identification:
    Manufacturer: MAX
    Model: 1909
    Serial Number: ...
    Made in: week 41 of 2004
  Basic Display Parameters & Features:
    Analog display
    Signal Level Standard: 0.700 : 0.300 : 1.000 V p-p
    Blank level equals black level
    Sync: Separate
    Maximum image size: 38 cm x 30 cm
    Gamma: 2.50
    DPMS levels: Off
    RGB color display
  Color Characteristics:
    Red  : 0.6455, 0.3574
    Green: 0.2783, 0.6123
    Blue : 0.1455, 0.1181
    White: 0.3095, 0.3291
  Established Timings I & II:
    IBM     :   720x400    70.081663 Hz   9:5     31.467 kHz     28.320000 MHz
    DMT 0x04:   640x480    59.940476 Hz   4:3     31.469 kHz     25.175000 MHz
    DMT 0x05:   640x480    72.808802 Hz   4:3     37.861 kHz     31.500000 MHz
    DMT 0x06:   640x480    75.000000 Hz   4:3     37.500 kHz     31.500000 MHz
    DMT 0x08:   800x600    56.250000 Hz   4:3     35.156 kHz     36.000000 MHz
    DMT 0x09:   800x600    60.316541 Hz   4:3     37.879 kHz     40.000000 MHz
    DMT 0x0a:   800x600    72.187572 Hz   4:3     48.077 kHz     50.000000 MHz
    DMT 0x0b:   800x600    75.000000 Hz   4:3     46.875 kHz     49.500000 MHz
    DMT 0x10:  1024x768    60.003840 Hz   4:3     48.363 kHz     65.000000 MHz
    DMT 0x11:  1024x768    70.069359 Hz   4:3     56.476 kHz     75.000000 MHz
    DMT 0x12:  1024x768    75.028582 Hz   4:3     60.023 kHz     78.750000 MHz
    DMT 0x24:  1280x1024   75.024675 Hz   5:4     79.976 kHz    135.000000 MHz
  Standard Timings:
    GTF     :  1024x768    72.000073 Hz   4:3     57.672 kHz     78.434000 MHz
    DMT 0x23:  1280x1024   60.019740 Hz   5:4     63.981 kHz    108.000000 MHz
  Detailed Timing Descriptors:
    DTD 1:   640x350    70.100223 Hz  64:35    31.475 kHz     25.180000 MHz (376 mm x 301 mm)
                 Hfront   48 Hsync  96 Hback   16 Hpol P
                 Vfront    0 Vsync   2 Vback   97 Vpol P
                   d6 09 80 a0 20 5e 63 10 30 60 02 00 78 2d 11 00 00 1e '.... ^c.0`..x-....'
    Display Product Serial Number: ...
    Display Product Name: '101905'
    Display Range Limits:
      Monitor ranges (GTF): 56-75 Hz V, 31-80 kHz H, max dotclock 140 MHz
Checksum: 0x49

----------------

Warnings:

Block 0, Base EDID:
  Detailed Timing Descriptor #1: Image size is 376x301 mm, but based on the picture AR it should be 376x205 mm.

Failures:

Block 0, Base EDID:
  Basic Display Parameters & Features: EDID 1.3 requires that the first detailed timing is the preferred timing.
  Detailed Timing Descriptor #1: 0 values in the video timing:
    Horizontal Active/Blanking 640/160
    Horizontal Frontporch/Sync Width 48/96
    Vertical Active/Blanking 350/99
    Vertical Frontporch/Sync Width 0/2

EDID conformity: FAIL
