edid-decode (hex):

00 ff ff ff ff ff ff 00 4c 83 52 48 00 00 00 00
00 17 01 03 95 22 13 78 ea ce 85 9e 5b 4c 94 26
17 50 54 00 00 00 01 01 01 01 01 01 01 01 01 01
01 01 01 01 01 01 50 cd 00 a0 f0 70 1e 80 30 20
25 00 58 c2 10 00 00 18 00 00 00 0f 00 00 00 00
00 00 00 00 00 37 82 05 46 00 00 00 00 fe 00 53
41 4d 53 55 4e 47 0a 20 4c 83 46 4c 00 00 00 fe
00 4c 54 4e 31 35 36 46 4c 30 32 4c 30 31 00 e4

00 ff ff ff ff ff ff 00 4c 83 52 48 00 00 00 00
00 17 01 03 95 22 13 78 ea ce 85 9e 5b 4c 94 26
17 50 54 00 00 00 01 01 01 01 01 01 01 01 01 01
01 01 01 01 01 01 50 cd 00 a0 f0 70 1e 80 30 20
25 00 58 c2 10 00 00 18 00 00 00 0f 00 00 00 00
00 00 00 00 00 37 82 05 46 00 00 00 00 fe 00 53
41 4d 53 55 4e 47 0a 20 4c 83 46 4c 00 00 00 fe
00 4c 54 4e 31 35 36 46 4c 30 32 4c 30 31 00 e4

----------------

Block 0, Base EDID:
  EDID Structure Version & Revision: 1.3
  Vendor & Product Identification:
    Manufacturer: SDC
    Model: 18514
    Made in: 2013
  Basic Display Parameters & Features:
    Digital display
    DFP 1.x compatible TMDS
    Maximum image size: 34 cm x 19 cm
    Gamma: 2.20
    DPMS levels: Standby Suspend Off
    RGB color display
    First detailed timing is the preferred timing
  Color Characteristics:
    Red  : 0.6201, 0.3554
    Green: 0.2998, 0.5800
    Blue : 0.1503, 0.0898
    White: 0.3134, 0.3291
  Established Timings I & II: none
  Standard Timings: none
  Detailed Timing Descriptors:
    DTD 1:  3840x2160   60.000000 Hz  16:9    131.400 kHz    525.600000 MHz (344 mm x 194 mm)
                 Hfront   48 Hsync  32 Hback   80 Hpol N
                 Vfront    2 Vsync   5 Vback   23 Vpol N
    Manufacturer-Specified Display Descriptor (0x0f): 00 0f 00 00 00 00 00 00 00 00 00 37 82 05 46 00 '...........7..F.'
    Alphanumeric Data String: 'SAMSUNG'
    Alphanumeric Data String: 'LTN156FL02L01'
Checksum: 0xe4

----------------

Failures:

Block 0, Base EDID:
  Basic Display Parameters & Features: Digital Video Interface Standard set to reserved value 0x14.
  Alphanumeric Data String: Non-space after newline.
  Missing Display Product Name.
  Missing Display Range Limits Descriptor.
EDID:
  Extension Block 1 started with EDID header, ignoring Extension Blocks >= 1.

EDID conformity: FAIL
