edid-decode (hex):

00 ff ff ff ff ff ff 00 06 af 6f 10 00 00 00 00
00 1a 01 04 a5 19 11 78 02 4a 75 a4 56 52 9c 27
0a 50 54 00 00 00 01 01 01 01 01 01 01 01 01 01
01 01 01 01 01 01 70 94 40 10 b1 80 50 70 28 20
aa 00 fe a9 00 00 00 18 00 00 00 0f 00 00 00 00
00 00 00 00 00 00 00 00 00 20 00 00 00 fe 00 41
55 4f 0a 20 20 20 20 20 20 20 20 20 00 00 00 fe
00 42 31 32 30 59 41 4e 30 31 2e 30 20 0a 00 08

----------------

Block 0, Base EDID:
  EDID Structure Version & Revision: 1.4
  Vendor & Product Identification:
    Manufacturer: AUO
    Model: 4207
    Made in: 2016
  Basic Display Parameters & Features:
    Digital display
    Bits per primary color channel: 8
    DisplayPort interface
    Maximum image size: 25 cm x 17 cm
    Gamma: 2.20
    Supported color formats: RGB 4:4:4
    First detailed timing includes the native pixel format and preferred refresh rate
  Color Characteristics:
    Red  : 0.6416, 0.3359
    Green: 0.3222, 0.6113
    Blue : 0.1533, 0.0419
    White: 0.3134, 0.3291
  Established Timings I & II: none
  Standard Timings: none
  Detailed Timing Descriptors:
    DTD 1:  2880x1920   60.279188 Hz   3:2    120.558 kHz    380.000000 MHz (254 mm x 169 mm)
                 Hfront   40 Hsync  32 Hback  200 Hpol N
                 Vfront   10 Vsync  10 Vback   60 Vpol N
    Manufacturer-Specified Display Descriptor (0x0f): 00 0f 00 00 00 00 00 00 00 00 00 00 00 00 00 20 '............... '
    Alphanumeric Data String: 'AUO'
    Alphanumeric Data String: 'B120YAN01.0 '
Checksum: 0x08

----------------

Warnings:

Block 0, Base EDID:
  Missing Display Product Name.

Failures:

Block 0, Base EDID:
  Alphanumeric Data String: One or more trailing spaces before newline.

EDID conformity: FAIL
