edid-decode (hex):

00 ff ff ff ff ff ff 00 38 72 74 03 00 00 00 01
28 08 01 04 a0 1e 17 78 26 57 f1 a4 56 4e 94 24
19 50 54 00 08 00 61 40 01 01 01 01 01 01 01 01
01 01 01 01 01 01 64 19 00 40 41 00 26 30 18 88
36 00 30 e4 10 00 00 18 00 00 00 fd 00 1e 78 1f
3f 08 00 0a 20 20 20 20 20 20 00 00 00 fc 00 4e
43 52 20 37 34 30 33 20 31 35 22 0a 00 00 00 ff
00 41 30 30 30 30 30 30 30 30 30 30 30 31 00 57

----------------

Block 0, Base EDID:
  EDID Structure Version & Revision: 1.4
  Vendor & Product Identification:
    Manufacturer: NCR
    Model: 884
    Serial Number: ...
    Made in: week 40 of 1998
  Basic Display Parameters & Features:
    Digital display
    Bits per primary color channel: 8
    Digital interface is not defined
    Maximum image size: 30 cm x 23 cm
    Gamma: 2.20
    DPMS levels: Off
    Supported color formats: RGB 4:4:4
    Default (sRGB) color space is primary color space
    First detailed timing includes the native pixel format and preferred refresh rate
  Color Characteristics:
    Red  : 0.6416, 0.3369
    Green: 0.3056, 0.5810
    Blue : 0.1435, 0.1005
    White: 0.3125, 0.3291
  Established Timings I & II:
    DMT 0x10:  1024x768    60.003840 Hz   4:3     48.363 kHz     65.000000 MHz
  Standard Timings:
    DMT 0x10:  1024x768    60.003840 Hz   4:3     48.363 kHz     65.000000 MHz
  Detailed Timing Descriptors:
    DTD 1:  1024x768    60.003840 Hz   4:3     48.363 kHz     65.000000 MHz (304 mm x 228 mm)
                 Hfront   24 Hsync 136 Hback  160 Hpol N
                 Vfront    3 Vsync   6 Vback   29 Vpol N
    Display Range Limits:
      Monitor ranges (GTF): 30-120 Hz V, 31-63 kHz H, max dotclock 80 MHz
    Display Product Name: 'NCR 7403 15"'
    Display Product Serial Number: ...
Checksum: 0x57

----------------

Warnings:

Block 0, Base EDID:
  Display Range Limits: GTF support is deprecated in EDID 1.4.

Failures:

Block 0, Base EDID:
  Basic Display Parameters & Features: sRGB is signaled, but the chromaticities do not match.
  Display Range Limits: GTF is supported, but the display does not support continuous frequencies.

EDID conformity: FAIL
