edid-decode (hex):

00 ff ff ff ff ff ff 00 09 e5 7f 09 00 00 00 00
27 1e 01 04 95 1a 0e 78 02 40 10 9a 5f 59 96 28
1f 50 54 00 00 00 01 01 01 01 01 01 01 01 01 01
01 01 01 01 01 01 8a 1c 56 a0 50 00 1e 30 30 20
35 00 00 90 10 00 00 1a d5 16 56 a0 50 00 1e 30
30 20 35 00 00 90 10 00 00 1a 00 00 00 fe 00 44
4d 31 4e 57 80 4e 56 31 31 54 31 31 00 00 00 00
00 00 41 21 96 00 10 00 00 09 01 0a 20 20 00 a8

----------------

Block 0, Base EDID:
  EDID Structure Version & Revision: 1.4
  Vendor & Product Identification:
    Manufacturer: BOE
    Model: 2431
    Made in: week 39 of 2020
  Basic Display Parameters & Features:
    Digital display
    Bits per primary color channel: 6
    DisplayPort interface
    Maximum image size: 26 cm x 14 cm
    Gamma: 2.20
    Supported color formats: RGB 4:4:4
    First detailed timing includes the native pixel format and preferred refresh rate
  Color Characteristics:
    Red  : 0.6025, 0.3710
    Green: 0.3476, 0.5859
    Blue : 0.1562, 0.1220
    White: 0.3125, 0.3281
  Established Timings I & II: none
  Standard Timings: none
  Detailed Timing Descriptors:
    DTD 1:  1366x768    59.995993 Hz 683:384   47.877 kHz     73.060000 MHz (256 mm x 144 mm)
                 Hfront   48 Hsync  32 Hback   80 Hpol P
                 Vfront    3 Vsync   5 Vback   22 Vpol N
    DTD 2:  1366x768    47.998436 Hz 683:384   38.303 kHz     58.450000 MHz (256 mm x 144 mm)
                 Hfront   48 Hsync  32 Hback   80 Hpol P
                 Vfront    3 Vsync   5 Vback   22 Vpol N
    Alphanumeric Data String: 'DM1NW.NV11T11'
    Manufacturer-Specified Display Descriptor (0x00): 00 00 00 00 41 21 96 00 10 00 00 09 01 0a 20 20 '....A!........  '
Checksum: 0xa8

----------------

Warnings:

Block 0, Base EDID:
  Alphanumeric Data String: Non-ASCII character 0x80 at position 5, can cause problems.
  Missing Display Product Name.

EDID conformity: PASS
