edid-decode (hex):

00 ff ff ff ff ff ff 00 4e 14 98 0c 29 bb 02 00
0d 1f 01 04 b5 46 27 78 29 ee 91 a3 54 4c 99 26
0f 50 54 21 0a 00 81 80 b3 00 a9 c0 01 01 81 40
01 01 01 01 01 01 02 3a 80 18 71 38 2d 40 58 2c
35 00 bc 86 21 00 00 1e 00 00 00 ff 00 0a 20 20
20 20 20 20 20 20 20 20 20 20 00 00 00 fd 00 30
f0 ff ff 3c 01 0a 20 20 20 20 20 20 00 00 00 fc
00 53 63 65 70 74 72 65 20 4b 33 32 0a 20 01 45

02 03 16 f1 49 90 1f 04 13 03 12 01 40 3f 23 09
07 01 83 01 00 00 29 b6 80 a0 70 38 29 40 3c 30
35 00 00 00 00 00 00 1e 28 83 80 a0 70 38 29 40
30 20 35 00 00 00 00 00 00 1e 28 aa 80 18 71 38
78 40 58 2c 35 00 00 00 00 00 00 1e 98 da 80 a0
70 38 29 40 3c 30 35 00 00 00 00 00 00 1e 2c 39
a0 20 53 84 bd 30 68 b0 36 00 ba 89 21 00 00 1e
00 00 00 00 00 00 00 00 00 00 00 00 00 00 00 8d

00 ff ff ff ff ff ff 00 4e 14 98 0c 29 bb 02 00
0d 1f 01 04 b5 46 27 78 29 ee 91 a3 54 4c 99 26
0f 50 54 21 0a 00 81 80 b3 00 a9 c0 01 01 81 40
01 01 01 01 01 01 02 3a 80 18 71 38 2d 40 58 2c
35 00 bc 86 21 00 00 1e 00 00 00 ff 00 0a 20 20
20 20 20 20 20 20 20 20 20 20 00 00 00 fd 00 30
f0 ff ff 3c 01 0a 20 20 20 20 20 20 00 00 00 fc
00 53 63 65 70 74 72 65 20 4b 33 32 0a 20 01 45

02 03 16 f1 49 90 1f 04 13 03 12 01 40 3f 23 09
07 01 83 01 00 00 29 b6 80 a0 70 38 29 40 3c 30
35 00 00 00 00 00 00 1e 28 83 80 a0 70 38 29 40
30 20 35 00 00 00 00 00 00 1e 28 aa 80 18 71 38
78 40 58 2c 35 00 00 00 00 00 00 1e 98 da 80 a0
70 38 29 40 3c 30 35 00 00 00 00 00 00 1e 2c 39
a0 20 53 84 bd 30 68 b0 36 00 ba 89 21 00 00 1e
00 00 00 00 00 00 00 00 00 00 00 00 00 00 00 8d

----------------

Block 0, Base EDID:
  EDID Structure Version & Revision: 1.4
  Vendor & Product Identification:
    Manufacturer: SPT
    Model: 3224
    Serial Number: ...
    Made in: week 13 of 2021
  Basic Display Parameters & Features:
    Digital display
    Bits per primary color channel: 10
    DisplayPort interface
    Maximum image size: 70 cm x 39 cm
    Gamma: 2.20
    DPMS levels: Off
    Supported color formats: RGB 4:4:4, YCrCb 4:4:4
    First detailed timing does not include the native pixel format and preferred refresh rate
    Display supports continuous frequencies
  Color Characteristics:
    Red  : 0.6396, 0.3300
    Green: 0.2998, 0.5996
    Blue : 0.1503, 0.0595
    White: 0.3125, 0.3291
  Established Timings I & II:
    DMT 0x04:   640x480    59.940476 Hz   4:3     31.469 kHz     25.175000 MHz
    DMT 0x09:   800x600    60.316541 Hz   4:3     37.879 kHz     40.000000 MHz
    DMT 0x10:  1024x768    60.003840 Hz   4:3     48.363 kHz     65.000000 MHz
    DMT 0x12:  1024x768    75.028582 Hz   4:3     60.023 kHz     78.750000 MHz
  Standard Timings:
    DMT 0x23:  1280x1024   60.019740 Hz   5:4     63.981 kHz    108.000000 MHz
    DMT 0x3a:  1680x1050   59.954250 Hz  16:10    65.290 kHz    146.250000 MHz
    DMT 0x53:  1600x900    60.000000 Hz  16:9     60.000 kHz    108.000000 MHz (RB)
    DMT 0x20:  1280x960    60.000000 Hz   4:3     60.000 kHz    108.000000 MHz
  Detailed Timing Descriptors:
    DTD  1:  1920x1080   60.000000 Hz  16:9     67.500 kHz    148.500000 MHz (700 mm x 390 mm)
                  Hfront   88 Hsync  44 Hback  148 Hpol P
                  Vfront    3 Vsync   5 Vback   37 Vpol P
    Display Product Serial Number: ...
    Display Range Limits:
      Monitor ranges (Range Limits Only): 48-240 Hz V, 255-255 kHz H, max dotclock 600 MHz
    Display Product Name: 'Sceptre K32'
  Extension blocks: 1
Checksum: 0x45

----------------

Block 1, CTA-861 Extension Block:
  Revision: 3
  Underscans IT Video Formats by default
  Basic audio support
  Supports YCbCr 4:4:4
  Supports YCbCr 4:2:2
  Native detailed modes: 1
  Video Data Block:
    VIC  16:  1920x1080   60.000000 Hz  16:9     67.500 kHz    148.500000 MHz (native)
    VIC  31:  1920x1080   50.000000 Hz  16:9     56.250 kHz    148.500000 MHz
    VIC   4:  1280x720    60.000000 Hz  16:9     45.000 kHz     74.250000 MHz
    VIC  19:  1280x720    50.000000 Hz  16:9     37.500 kHz     74.250000 MHz
    VIC   3:   720x480    59.940060 Hz  16:9     31.469 kHz     27.000000 MHz
    VIC  18:   720x576    50.000000 Hz  16:9     31.250 kHz     27.000000 MHz
    VIC   1:   640x480    59.940476 Hz   4:3     31.469 kHz     25.175000 MHz
    VIC  64:  1920x1080  100.000000 Hz  16:9    112.500 kHz    297.000000 MHz
    VIC  63:  1920x1080  120.000000 Hz  16:9    135.000 kHz    297.000000 MHz
  Audio Data Block:
    Linear PCM:
      Max channels: 2
      Supported sample rates (kHz): 48 44.1 32
      Supported sample sizes (bits): 16
  Speaker Allocation Data Block:
    FL/FR - Front Left/Right
  Detailed Timing Descriptors:
    DTD  2:  1920x1080  199.997427 Hz  16:9    224.197 kHz    466.330000 MHz
                  Hfront   60 Hsync  48 Hback   52 Hpol P
                  Vfront    3 Vsync   5 Vback   33 Vpol P
    DTD  3:  1920x1080  143.999177 Hz  16:9    161.423 kHz    335.760000 MHz
                  Hfront   48 Hsync  32 Hback   80 Hpol P
                  Vfront    3 Vsync   5 Vback   33 Vpol P
    DTD  4:  1920x1080  165.000000 Hz  16:9    198.000 kHz    435.600000 MHz
                  Hfront   88 Hsync  44 Hback  148 Hpol P
                  Vfront    3 Vsync   5 Vback  112 Vpol P
    DTD  5:  1920x1080  239.998628 Hz  16:9    269.038 kHz    559.600000 MHz
                  Hfront   60 Hsync  48 Hback   52 Hpol P
                  Vfront    3 Vsync   5 Vback   33 Vpol P
    DTD  6:  1440x900    59.999344 Hz  16:10    65.339 kHz    146.360000 MHz (698 mm x 393 mm)
                  Hfront  104 Hsync 176 Hback  520 Hpol P
                  Vfront    3 Vsync   6 Vback  180 Vpol P
Checksum: 0x8d  Unused space in Extension Block: 15 bytes

----------------

Block 2, Unknown EDID Extension Block 0x00:
  00 ff ff ff ff ff ff 00 4e 14 98 0c 29 bb 02 00 '........N...)...'
  0d 1f 01 04 b5 46 27 78 29 ee 91 a3 54 4c 99 26 '.....F'x)...TL.&'
  0f 50 54 21 0a 00 81 80 b3 00 a9 c0 01 01 81 40 '.PT!...........@'
  01 01 01 01 01 01 02 3a 80 18 71 38 2d 40 58 2c '.......:..q8-@X,'
  35 00 bc 86 21 00 00 1e 00 00 00 ff 00 0a 20 20 '5...!.........  '
  20 20 20 20 20 20 20 20 20 20 00 00 00 fd 00 30 '          .....0'
  f0 ff ff 3c 01 0a 20 20 20 20 20 20 00 00 00 fc '...<..      ....'
  00 53 63 65 70 74 72 65 20 4b 33 32 0a 20 01 45 '.Sceptre K32. .E'
Checksum: 0x45

----------------

Block 3, CTA-861 Extension Block:
  Revision: 3
  Underscans IT Video Formats by default
  Basic audio support
  Supports YCbCr 4:4:4
  Supports YCbCr 4:2:2
  Native detailed modes: 1
  Video Data Block:
    VIC  16:  1920x1080   60.000000 Hz  16:9     67.500 kHz    148.500000 MHz (native)
    VIC  31:  1920x1080   50.000000 Hz  16:9     56.250 kHz    148.500000 MHz
    VIC   4:  1280x720    60.000000 Hz  16:9     45.000 kHz     74.250000 MHz
    VIC  19:  1280x720    50.000000 Hz  16:9     37.500 kHz     74.250000 MHz
    VIC   3:   720x480    59.940060 Hz  16:9     31.469 kHz     27.000000 MHz
    VIC  18:   720x576    50.000000 Hz  16:9     31.250 kHz     27.000000 MHz
    VIC   1:   640x480    59.940476 Hz   4:3     31.469 kHz     25.175000 MHz
    VIC  64:  1920x1080  100.000000 Hz  16:9    112.500 kHz    297.000000 MHz
    VIC  63:  1920x1080  120.000000 Hz  16:9    135.000 kHz    297.000000 MHz
  Audio Data Block:
    Linear PCM:
      Max channels: 2
      Supported sample rates (kHz): 48 44.1 32
      Supported sample sizes (bits): 16
  Speaker Allocation Data Block:
    FL/FR - Front Left/Right
  Detailed Timing Descriptors:
    DTD  7:  1920x1080  199.997427 Hz  16:9    224.197 kHz    466.330000 MHz
                  Hfront   60 Hsync  48 Hback   52 Hpol P
                  Vfront    3 Vsync   5 Vback   33 Vpol P
    DTD  8:  1920x1080  143.999177 Hz  16:9    161.423 kHz    335.760000 MHz
                  Hfront   48 Hsync  32 Hback   80 Hpol P
                  Vfront    3 Vsync   5 Vback   33 Vpol P
    DTD  9:  1920x1080  165.000000 Hz  16:9    198.000 kHz    435.600000 MHz
                  Hfront   88 Hsync  44 Hback  148 Hpol P
                  Vfront    3 Vsync   5 Vback  112 Vpol P
    DTD 10:  1920x1080  239.998628 Hz  16:9    269.038 kHz    559.600000 MHz
                  Hfront   60 Hsync  48 Hback   52 Hpol P
                  Vfront    3 Vsync   5 Vback   33 Vpol P
    DTD 11:  1440x900    59.999344 Hz  16:10    65.339 kHz    146.360000 MHz (698 mm x 393 mm)
                  Hfront  104 Hsync 176 Hback  520 Hpol P
                  Vfront    3 Vsync   6 Vback  180 Vpol P
Checksum: 0x8d  Unused space in Extension Block: 15 bytes

----------------

Warnings:

Block 0, Base EDID:
  Detailed Timing Descriptor #1: DTD is similar but not identical to VIC 16.
Block 1, CTA-861 Extension Block:
  Video Data Block: VIC 16 and the first DTD are not identical. Is this intended?
  Detailed Timing Descriptor #6: Image size is 698x393 mm, but based on the picture AR it should be 698x436 mm.
  Display Product Serial Number is set, so the Serial Number in the Base EDID should be 0.
Block 3, CTA-861 Extension Block:
  Detailed Timing Descriptor #11: Image size is 698x393 mm, but based on the picture AR it should be 698x436 mm.
EDID:
  Base EDID: Some timings are out of range of the Monitor Ranges:
    Horizontal Freq: 31.250 - 269.038 kHz (Monitor: 255.000 - 255.000 kHz)
  CTA-861: Multiple native progressive timings are defined.

Failures:

Block 0, Base EDID:
  Display Product Serial Number: ...
  Basic Display Parameters & Features: The chromaticities match sRGB, but sRGB is not signaled.
Block 1, CTA-861 Extension Block:
  Detailed Timing Descriptor #2: Mismatch of image size vs display size: image size is not set, but display size is.
  Detailed Timing Descriptor #3: Mismatch of image size vs display size: image size is not set, but display size is.
  Detailed Timing Descriptor #4: Mismatch of image size vs display size: image size is not set, but display size is.
  Detailed Timing Descriptor #5: Mismatch of image size vs display size: image size is not set, but display size is.
  Missing VCDB, needed for Set Selectable RGB Quantization to avoid interop issues.
Block 2, Base EDID:
  Unknown Extension Block.
Block 3, CTA-861 Extension Block:
  Video Data Block: Duplicate VIC 16.
  Video Data Block: Duplicate VIC 31.
  Video Data Block: Duplicate VIC 4.
  Video Data Block: Duplicate VIC 19.
  Video Data Block: Duplicate VIC 3.
  Video Data Block: Duplicate VIC 18.
  Video Data Block: Duplicate VIC 1.
  Video Data Block: Duplicate VIC 64.
  Video Data Block: Duplicate VIC 63.
  Speaker Allocation Data Block: Only one instance of this Data Block is allowed.
  Detailed Timing Descriptor #7: Mismatch of image size vs display size: image size is not set, but display size is.
  Detailed Timing Descriptor #8: Mismatch of image size vs display size: image size is not set, but display size is.
  Detailed Timing Descriptor #9: Mismatch of image size vs display size: image size is not set, but display size is.
  Detailed Timing Descriptor #10: Mismatch of image size vs display size: image size is not set, but display size is.
EDID:
  Base EDID: EDID specified 1 extension block(s), but found 3 extension block(s).

EDID conformity: FAIL
