edid-decode (hex):

00 ff ff ff ff ff ff 00 36 69 c0 3b 00 00 00 00
13 22 01 04 b5 36 1f 78 3b 2c f1 a7 56 4e 9f 24
0e 50 54 3f cf 00 81 80 95 00 b3 00 01 01 01 01
01 01 01 01 01 01 02 3a 80 18 71 38 2d 40 58 2c
45 00 1f 2e 21 00 00 1e 00 00 00 fd 00 30 b4 c8
c8 32 01 0a 20 20 20 20 20 20 00 00 00 fc 00 4d
53 49 20 47 32 35 35 46 0a 20 20 20 00 00 00 ff
00 42 43 30 4d 30 34 34 35 30 30 30 33 38 01 28

02 03 23 f4 49 01 02 03 04 90 11 12 13 9f 23 09
07 07 83 01 00 00 68 1a 00 00 01 01 30 b4 00 e3
05 03 01 fb 81 80 a0 70 38 1f 40 20 40 45 00 1f
2e 21 00 00 1e f2 94 80 a0 70 38 1f 40 20 40 45
00 1f 2e 21 00 00 1e 56 a2 80 a0 70 38 1e 40 30
20 35 00 1f 2e 21 00 00 1e 52 6c 80 a0 70 38 1f
40 20 40 45 00 1f 2e 21 00 00 1e 00 00 00 00 00
00 00 00 00 00 00 00 00 00 00 00 00 00 00 00 23

00 ff ff ff ff ff ff 00 36 69 c0 3b 00 00 00 00
13 22 01 04 b5 36 1f 78 3b 2c f1 a7 56 4e 9f 24
0e 50 54 3f cf 00 81 80 95 00 b3 00 01 01 01 01
01 01 01 01 01 01 02 3a 80 18 71 38 2d 40 58 2c
45 00 1f 2e 21 00 00 1e 00 00 00 fd 00 30 b4 c8
c8 32 01 0a 20 20 20 20 20 20 00 00 00 fc 00 4d
53 49 20 47 32 35 35 46 0a 20 20 20 00 00 00 ff
00 42 43 30 4d 30 34 34 35 30 30 30 33 38 01 28

02 03 23 f4 49 01 02 03 04 90 11 12 13 9f 23 09
07 07 83 01 00 00 68 1a 00 00 01 01 30 b4 00 e3
05 03 01 fb 81 80 a0 70 38 1f 40 20 40 45 00 1f
2e 21 00 00 1e f2 94 80 a0 70 38 1f 40 20 40 45
00 1f 2e 21 00 00 1e 56 a2 80 a0 70 38 1e 40 30
20 35 00 1f 2e 21 00 00 1e 52 6c 80 a0 70 38 1f
40 20 40 45 00 1f 2e 21 00 00 1e 00 00 00 00 00
00 00 00 00 00 00 00 00 00 00 00 00 00 00 00 23

----------------

Block 0, Base EDID:
  EDID Structure Version & Revision: 1.4
  Vendor & Product Identification:
    Manufacturer: MSI
    Model: 15296
    Made in: week 19 of 2024
  Basic Display Parameters & Features:
    Digital display
    Bits per primary color channel: 10
    DisplayPort interface
    Maximum image size: 54 cm x 31 cm
    Gamma: 2.20
    DPMS levels: Off
    Supported color formats: RGB 4:4:4, YCrCb 4:4:4, YCrCb 4:2:2
    First detailed timing includes the native pixel format and preferred refresh rate
    Display supports continuous frequencies
  Color Characteristics:
    Red  : 0.6523, 0.3378
    Green: 0.3076, 0.6210
    Blue : 0.1435, 0.0576
    White: 0.3125, 0.3291
  Established Timings I & II:
    DMT 0x04:   640x480    59.940476 Hz   4:3     31.469 kHz     25.175000 MHz
    Apple   :   640x480    66.666667 Hz   4:3     35.000 kHz     30.240000 MHz
    DMT 0x05:   640x480    72.808802 Hz   4:3     37.861 kHz     31.500000 MHz
    DMT 0x06:   640x480    75.000000 Hz   4:3     37.500 kHz     31.500000 MHz
    DMT 0x08:   800x600    56.250000 Hz   4:3     35.156 kHz     36.000000 MHz
    DMT 0x09:   800x600    60.316541 Hz   4:3     37.879 kHz     40.000000 MHz
    DMT 0x0a:   800x600    72.187572 Hz   4:3     48.077 kHz     50.000000 MHz
    DMT 0x0b:   800x600    75.000000 Hz   4:3     46.875 kHz     49.500000 MHz
    DMT 0x10:  1024x768    60.003840 Hz   4:3     48.363 kHz     65.000000 MHz
    DMT 0x11:  1024x768    70.069359 Hz   4:3     56.476 kHz     75.000000 MHz
    DMT 0x12:  1024x768    75.028582 Hz   4:3     60.023 kHz     78.750000 MHz
    DMT 0x24:  1280x1024   75.024675 Hz   5:4     79.976 kHz    135.000000 MHz
  Standard Timings:
    DMT 0x23:  1280x1024   60.019740 Hz   5:4     63.981 kHz    108.000000 MHz
    DMT 0x2f:  1440x900    59.887445 Hz  16:10    55.935 kHz    106.500000 MHz
    DMT 0x3a:  1680x1050   59.954250 Hz  16:10    65.290 kHz    146.250000 MHz
  Detailed Timing Descriptors:
    DTD 1:  1920x1080   60.000000 Hz  16:9     67.500 kHz    148.500000 MHz (543 mm x 302 mm)
                 Hfront   88 Hsync  44 Hback  148 Hpol P
                 Vfront    4 Vsync   5 Vback   36 Vpol P
    Display Range Limits:
      Monitor ranges (Range Limits Only): 48-180 Hz V, 200-200 kHz H, max dotclock 500 MHz
    Display Product Name: 'MSI G255F'
    Display Product Serial Number: ...
  Extension blocks: 1
Checksum: 0x28

----------------

Block 1, CTA-861 Extension Block:
  Revision: 3
  Underscans IT Video Formats by default
  Basic audio support
  Supports YCbCr 4:4:4
  Supports YCbCr 4:2:2
  Native DTDs: 4
  Video Data Block:
    VIC   1:   640x480    59.940476 Hz   4:3     31.469 kHz     25.175000 MHz
    VIC   2:   720x480    59.940060 Hz   4:3     31.469 kHz     27.000000 MHz
    VIC   3:   720x480    59.940060 Hz  16:9     31.469 kHz     27.000000 MHz
    VIC   4:  1280x720    60.000000 Hz  16:9     45.000 kHz     74.250000 MHz
    VIC  16:  1920x1080   60.000000 Hz  16:9     67.500 kHz    148.500000 MHz (native)
    VIC  17:   720x576    50.000000 Hz   4:3     31.250 kHz     27.000000 MHz
    VIC  18:   720x576    50.000000 Hz  16:9     31.250 kHz     27.000000 MHz
    VIC  19:  1280x720    50.000000 Hz  16:9     37.500 kHz     74.250000 MHz
    VIC  31:  1920x1080   50.000000 Hz  16:9     56.250 kHz    148.500000 MHz (native)
  Audio Data Block:
    Linear PCM:
      Max channels: 2
      Supported sample rates (kHz): 48 44.1 32
      Supported sample sizes (bits): 24 20 16
  Speaker Allocation Data Block:
    FL/FR - Front Left/Right
  Vendor-Specific Data Block (AMD), OUI 00-00-1A:
    Version: 1
    Flags 1: 0x01
      FreeSync Supported
    Minimum Refresh Rate: 48 Hz
    Maximum Refresh Rate: 180 Hz
  Colorimetry Data Block:
    xvYCC601
    xvYCC709
    Gamut Boundary Description Metadata Profile P0
  Detailed Timing Descriptors:
    DTD 2:  1920x1080  143.992765 Hz  16:9    159.976 kHz    332.750000 MHz (543 mm x 302 mm)
                 Hfront   32 Hsync  64 Hback   64 Hpol P
                 Vfront    4 Vsync   5 Vback   22 Vpol P
    DTD 3:  1920x1080  165.002077 Hz  16:9    183.317 kHz    381.300000 MHz (543 mm x 302 mm)
                 Hfront   32 Hsync  64 Hback   64 Hpol P
                 Vfront    4 Vsync   5 Vback   22 Vpol P
    DTD 4:  1920x1080  179.998267 Hz  16:9    199.798 kHz    415.580000 MHz (543 mm x 302 mm)
                 Hfront   48 Hsync  32 Hback   80 Hpol P
                 Vfront    3 Vsync   5 Vback   22 Vpol P
    DTD 5:  1920x1080  119.997577 Hz  16:9    133.317 kHz    277.300000 MHz (543 mm x 302 mm)
                 Hfront   32 Hsync  64 Hback   64 Hpol P
                 Vfront    4 Vsync   5 Vback   22 Vpol P
Checksum: 0x23  Unused space in Extension Block: 20 bytes

----------------

Warnings:

Block 1, CTA-861 Extension Block:
  Video Data Block: VIC 1 and the first DTD are not identical. Is this intended?
  Video Data Block: All VICs are in ascending order, and the first (preferred) VIC <= 4, is that intended?
  Colorimetry Data Block: Set the sRGB colorimetry bit to avoid interop issues.
EDID:
  Base EDID: Some timings are out of range of the Monitor Ranges:
    Horizontal Freq: 31.250 - 199.798 kHz (Monitor: 200.000 - 200.000 kHz)

Failures:

Block 1, CTA-861 Extension Block:
  Missing VCDB, needed for Set Selectable RGB Quantization to avoid interop issues.
EDID:
  Extension Block 2 started with EDID header, ignoring Extension Blocks >= 2.

EDID conformity: FAIL
