edid-decode (hex):

00 ff ff ff ff ff ff 00 30 e4 00 00 00 00 00 00
00 14 01 04 90 22 13 78 0a ed 95 9d 5d 57 9a 26
1c 50 54 00 00 00 01 01 01 01 01 01 01 01 01 01
01 01 01 01 01 01 58 1b 56 7e 50 00 0e 30 24 30
35 00 58 c2 10 00 00 19 3e 12 56 7e 50 00 0e 30
24 30 35 00 58 c2 10 00 00 19 00 00 00 fe 00 33
33 46 33 4d 80 31 35 36 57 48 38 0a 00 00 00 00
00 00 41 31 94 00 00 00 00 01 01 0a 20 20 00 97

00 ff ff ff ff ff ff 00 30 e4 00 00 00 00 00 00
00 14 01 04 90 22 13 78 0a ed 95 9d 5d 57 9a 26
1c 50 54 00 00 00 01 01 01 01 01 01 01 01 01 01
01 01 01 01 01 01 58 1b 56 7e 50 00 0e 30 24 30
35 00 58 c2 10 00 00 19 3e 12 56 7e 50 00 0e 30
24 30 35 00 58 c2 10 00 00 19 00 00 00 fe 00 33
33 46 33 4d 80 31 35 36 57 48 38 0a 00 00 00 00
00 00 41 31 94 00 00 00 00 01 01 0a 20 20 00 97

----------------

Block 0, Base EDID:
  EDID Structure Version & Revision: 1.4
  Vendor & Product Identification:
    Manufacturer: LGD
    Model: 0
    Made in: 2010
  Basic Display Parameters & Features:
    Digital display
    Bits per primary color channel: 6
    Digital interface is not defined
    Maximum image size: 34 cm x 19 cm
    Gamma: 2.20
    Supported color formats: RGB 4:4:4, YCrCb 4:4:4
    First detailed timing includes the native pixel format and preferred refresh rate
  Color Characteristics:
    Red  : 0.6162, 0.3652
    Green: 0.3427, 0.6025
    Blue : 0.1503, 0.1103
    White: 0.3134, 0.3291
  Established Timings I & II: none
  Standard Timings: none
  Detailed Timing Descriptors:
    DTD 1:  1366x768    59.996023 Hz 683:384   46.917 kHz     70.000000 MHz (344 mm x 194 mm)
                 Hfront   36 Hsync  48 Hback   42 Hpol N
                 Vfront    3 Vsync   5 Vback    6 Vpol N
    DTD 2:  1366x768    40.025918 Hz 683:384   31.300 kHz     46.700000 MHz (344 mm x 194 mm)
                 Hfront   36 Hsync  48 Hback   42 Hpol N
                 Vfront    3 Vsync   5 Vback    6 Vpol N
    Alphanumeric Data String: '33F3M.156WH8'
    Manufacturer-Specified Display Descriptor (0x00): 00 00 00 00 41 31 94 00 00 00 00 01 01 0a 20 20 '....A1........  '
Checksum: 0x97

----------------

Warnings:

Block 0, Base EDID:
  Alphanumeric Data String: Non-ASCII character 0x80 at position 5, can cause problems.
  Missing Display Product Name.

Failures:

EDID:
  Extension Block 1 started with EDID header, ignoring Extension Blocks >= 1.

EDID conformity: FAIL
