edid-decode (hex):

00 ff ff ff ff ff ff 00 30 e4 00 00 00 00 00 00
00 13 01 04 95 22 13 78 02 15 d5 9e 59 50 98 26
0e 50 54 00 00 00 01 01 01 01 01 01 01 01 01 01
01 01 01 01 01 01 ca 35 80 92 70 38 1f 40 30 20
35 00 58 c2 10 00 00 18 22 24 80 a0 70 38 1f 40
30 20 35 00 58 c2 10 00 00 18 00 00 00 fe 00 44
48 30 39 31 80 31 35 36 57 46 31 0a 00 00 00 00
00 00 41 31 1e 00 00 00 00 09 01 0a 20 20 00 d6

----------------

Block 0, Base EDID:
  EDID Structure Version & Revision: 1.4
  Vendor & Product Identification:
    Manufacturer: LGD
    Model: 0
    Made in: 2009
  Basic Display Parameters & Features:
    Digital display
    Bits per primary color channel: 6
    DisplayPort interface
    Maximum image size: 34 cm x 19 cm
    Gamma: 2.20
    Supported color formats: RGB 4:4:4
    First detailed timing includes the native pixel format and preferred refresh rate
  Color Characteristics:
    Red  : 0.6171, 0.3486
    Green: 0.3134, 0.5947
    Blue : 0.1513, 0.0556
    White: 0.3134, 0.3291
  Established Timings I & II: none
  Standard Timings: none
  Detailed Timing Descriptors:
    DTD 1:  1920x1080   59.991478 Hz  16:9     66.651 kHz    137.700000 MHz (344 mm x 194 mm)
                 Hfront   48 Hsync  32 Hback   66 Hpol N
                 Vfront    3 Vsync   5 Vback   23 Vpol N
    DTD 2:  1920x1080   40.028041 Hz  16:9     44.471 kHz     92.500000 MHz (344 mm x 194 mm)
                 Hfront   48 Hsync  32 Hback   80 Hpol N
                 Vfront    3 Vsync   5 Vback   23 Vpol N
    Alphanumeric Data String: 'DH091.156WF1'
    Manufacturer-Specified Display Descriptor (0x00): 00 00 00 00 41 31 1e 00 00 00 00 09 01 0a 20 20 '....A1........  '
Checksum: 0xd6

----------------

Warnings:

Block 0, Base EDID:
  Alphanumeric Data String: Non-ASCII character 0x80 at position 5, can cause problems.
  Missing Display Product Name.

EDID conformity: PASS
