edid-decode (hex):

00 ff ff ff ff ff ff 00 30 e4 00 00 00 00 00 00
00 14 01 04 90 1f 11 78 0a c6 05 96 58 55 8d 28
1f 50 54 00 00 00 01 01 01 01 01 01 01 01 01 01
01 01 01 01 01 01 1b 1c 56 91 50 00 19 30 24 30
35 00 35 ae 10 00 00 19 de 12 56 91 50 00 19 30
24 30 35 00 35 ae 10 00 00 19 00 00 00 fe 00 47
57 35 59 33 80 31 34 30 57 48 36 0a 00 00 00 00
00 00 41 31 94 00 00 00 00 01 01 0a 20 20 00 0d

----------------

Block 0, Base EDID:
  EDID Structure Version & Revision: 1.4
  Vendor & Product Identification:
    Manufacturer: LGD
    Model: 0
    Made in: 2010
  Basic Display Parameters & Features:
    Digital display
    Bits per primary color channel: 6
    Digital interface is not defined
    Maximum image size: 31 cm x 17 cm
    Gamma: 2.20
    Supported color formats: RGB 4:4:4, YCrCb 4:4:4
    First detailed timing includes the native pixel format and preferred refresh rate
  Color Characteristics:
    Red  : 0.5888, 0.3437
    Green: 0.3330, 0.5527
    Blue : 0.1562, 0.1210
    White: 0.3134, 0.3291
  Established Timings I & II: none
  Standard Timings: none
  Detailed Timing Descriptors:
    DTD 1:  1366x768    60.047253 Hz 683:384   47.617 kHz     71.950000 MHz (309 mm x 174 mm)
                 Hfront   36 Hsync  48 Hback   61 Hpol N
                 Vfront    3 Vsync   5 Vback   17 Vpol N
    DTD 2:  1366x768    40.309692 Hz 683:384   31.966 kHz     48.300000 MHz (309 mm x 174 mm)
                 Hfront   36 Hsync  48 Hback   61 Hpol N
                 Vfront    3 Vsync   5 Vback   17 Vpol N
    Alphanumeric Data String: 'GW5Y3.140WH6'
    Manufacturer-Specified Display Descriptor (0x00): 00 00 00 00 41 31 94 00 00 00 00 01 01 0a 20 20 '....A1........  '
Checksum: 0x0d

----------------

Warnings:

Block 0, Base EDID:
  Alphanumeric Data String: Non-ASCII character 0x80 at position 5, can cause problems.
  Missing Display Product Name.

EDID conformity: PASS
