edid-decode (hex):

00 ff ff ff ff ff ff 00 30 e4 00 00 00 00 00 00
00 18 01 04 a5 3c 22 78 e2 00 05 00 00 00 00 00
00 50 54 00 00 00 01 01 01 01 01 01 01 01 01 01
01 01 01 01 01 01 51 d0 00 a0 f0 70 3e 80 30 20
35 00 58 c2 10 00 00 1a a4 a6 00 a0 f0 70 3e 80
30 20 36 00 58 c2 10 00 00 1a 00 00 00 fe 00 30
30 30 30 30 00 31 35 36 55 44 31 0a 00 00 00 00
00 02 41 31 9e 11 10 00 00 0b 01 0a 20 20 00 5e

----------------

Block 0, Base EDID:
  EDID Structure Version & Revision: 1.4
  Vendor & Product Identification:
    Manufacturer: LGD
    Model: 0
    Made in: 2014
  Basic Display Parameters & Features:
    Digital display
    Bits per primary color channel: 8
    DisplayPort interface
    Maximum image size: 60 cm x 34 cm
    Gamma: 2.20
    DPMS levels: Standby Suspend Off
    Supported color formats: RGB 4:4:4
    First detailed timing includes the native pixel format and preferred refresh rate
  Color Characteristics:
    Red  : 0.0000, 0.0000
    Green: 0.0000, 0.0000
    Blue : 0.0000, 0.0000
    White: 0.3134, 0.3291
  Established Timings I & II: none
  Standard Timings: none
  Detailed Timing Descriptors:
    DTD 1:  3840x2160   60.001125 Hz  16:9    133.322 kHz    533.290000 MHz (344 mm x 194 mm)
                 Hfront   48 Hsync  32 Hback   80 Hpol P
                 Vfront    3 Vsync   5 Vback   54 Vpol N
    DTD 2:  3840x2160   47.997300 Hz  16:9    106.650 kHz    426.600000 MHz (344 mm x 194 mm)
                 Hfront   48 Hsync  32 Hback   80 Hpol P
                 Vfront    3 Vsync   6 Vback   53 Vpol N
    Alphanumeric Data String: '00000'
    Manufacturer-Specified Display Descriptor (0x00): 00 00 00 02 41 31 9e 11 10 00 00 0b 01 0a 20 20 '....A1........  '
Checksum: 0x5e

----------------

Warnings:

Block 0, Base EDID:
  Missing Display Product Name.

Failures:

Block 0, Base EDID:
  Detailed Timing Descriptor #1: Mismatch of image size 344x194 mm vs display size 600x340 mm.
  Detailed Timing Descriptor #2: Mismatch of image size 344x194 mm vs display size 600x340 mm.
  Alphanumeric Data String: NUL byte at position 5.

EDID conformity: FAIL
