edid-decode (hex):

00 ff ff ff ff ff ff 00 05 e3 b8 19 01 01 01 01
00 13 01 03 80 29 1c 78 0a 9e 2b a3 55 4a 9a 25
10 47 4a a1 08 00 01 01 01 01 01 01 01 01 01 01
01 01 01 01 01 01 66 21 50 b0 51 00 1b 30 40 70
36 00 9a 18 11 00 00 1e 00 00 00 ff 00 20 20 20
20 20 20 20 20 20 20 20 20 20 00 00 00 fd 00 38
47 1e 31 09 00 0a 20 20 20 20 20 20 00 00 00 fc
00 4c 31 39 57 42 38 31 0a 20 20 20 20 20 01 41

02 03 20 71 4d 01 02 03 11 12 13 84 05 14 06 07
15 16 23 09 07 07 83 01 00 00 65 03 0c 00 10 00
01 1d 00 72 51 d0 1e 20 6e 28 55 00 9a 18 11 00
00 1e 00 00 00 00 00 00 00 00 00 00 00 00 00 00
00 00 00 00 00 00 00 00 00 00 00 00 00 00 00 00
00 00 00 00 00 00 00 00 00 00 00 00 00 00 00 00
00 00 00 00 00 00 00 00 00 00 00 00 00 00 00 00
00 00 00 00 00 00 00 00 00 00 00 00 00 00 00 0f

00 ff ff ff ff ff ff 00 05 e3 b8 19 01 01 01 01
00 13 01 03 80 29 1c 78 0a 9e 2b a3 55 4a 9a 25
10 47 4a a1 08 00 01 01 01 01 01 01 01 01 01 01
01 01 01 01 01 01 66 21 50 b0 51 00 1b 30 40 70
36 00 9a 18 11 00 00 1e 00 00 00 ff 00 20 20 20
20 20 20 20 20 20 20 20 20 20 00 00 00 fd 00 38
47 1e 31 09 00 0a 20 20 20 20 20 20 00 00 00 fc
00 4c 31 39 57 42 38 31 0a 20 20 20 20 20 01 41

02 03 20 71 4d 01 02 03 11 12 13 84 05 14 06 07
15 16 23 09 07 07 83 01 00 00 65 03 0c 00 10 00
01 1d 00 72 51 d0 1e 20 6e 28 55 00 9a 18 11 00
00 1e 00 00 00 00 00 00 00 00 00 00 00 00 00 00
00 00 00 00 00 00 00 00 00 00 00 00 00 00 00 00
00 00 00 00 00 00 00 00 00 00 00 00 00 00 00 00
00 00 00 00 00 00 00 00 00 00 00 00 00 00 00 00
00 00 00 00 00 00 00 00 00 00 00 00 00 00 00 0f

----------------

Block 0, Base EDID:
  EDID Structure Version & Revision: 1.3
  Vendor & Product Identification:
    Manufacturer: AOC
    Model: 6584
    Serial Number: ...
    Made in: 2009
  Basic Display Parameters & Features:
    Digital display
    Maximum image size: 41 cm x 28 cm
    Gamma: 2.20
    RGB color display
    First detailed timing is the preferred timing
  Color Characteristics:
    Red  : 0.6386, 0.3330
    Green: 0.2919, 0.6035
    Blue : 0.1445, 0.0644
    White: 0.2792, 0.2919
  Established Timings I & II:
    IBM     :   720x400    70.081663 Hz   9:5     31.467 kHz     28.320000 MHz
    DMT 0x04:   640x480    59.940476 Hz   4:3     31.469 kHz     25.175000 MHz
    DMT 0x09:   800x600    60.316541 Hz   4:3     37.879 kHz     40.000000 MHz
    DMT 0x10:  1024x768    60.003840 Hz   4:3     48.363 kHz     65.000000 MHz
  Standard Timings: none
  Detailed Timing Descriptors:
    DTD 1:  1360x768    60.015162 Hz  85:48    47.712 kHz     85.500000 MHz (410 mm x 280 mm)
                 Hfront   64 Hsync 112 Hback  256 Hpol P
                 Vfront    3 Vsync   6 Vback   18 Vpol P
    Display Product Serial Number: ...
    Display Range Limits:
      Monitor ranges (GTF): 56-71 Hz V, 30-49 kHz H, max dotclock 90 MHz
    Display Product Name: 'L19WB81'
  Extension blocks: 1
Checksum: 0x41

----------------

Block 1, CTA-861 Extension Block:
  Revision: 3
  Basic audio support
  Supports YCbCr 4:4:4
  Supports YCbCr 4:2:2
  Native DTDs: 1
  Video Data Block:
    VIC   1:   640x480    59.940476 Hz   4:3     31.469 kHz     25.175000 MHz
    VIC   2:   720x480    59.940060 Hz   4:3     31.469 kHz     27.000000 MHz
    VIC   3:   720x480    59.940060 Hz  16:9     31.469 kHz     27.000000 MHz
    VIC  17:   720x576    50.000000 Hz   4:3     31.250 kHz     27.000000 MHz
    VIC  18:   720x576    50.000000 Hz  16:9     31.250 kHz     27.000000 MHz
    VIC  19:  1280x720    50.000000 Hz  16:9     37.500 kHz     74.250000 MHz
    VIC   4:  1280x720    60.000000 Hz  16:9     45.000 kHz     74.250000 MHz (native)
    VIC   5:  1920x1080i  60.000000 Hz  16:9     33.750 kHz     74.250000 MHz
    VIC  20:  1920x1080i  50.000000 Hz  16:9     28.125 kHz     74.250000 MHz
    VIC   6:  1440x480i   59.940060 Hz   4:3     15.734 kHz     27.000000 MHz
    VIC   7:  1440x480i   59.940060 Hz  16:9     15.734 kHz     27.000000 MHz
    VIC  21:  1440x576i   50.000000 Hz   4:3     15.625 kHz     27.000000 MHz
    VIC  22:  1440x576i   50.000000 Hz  16:9     15.625 kHz     27.000000 MHz
  Audio Data Block:
    Linear PCM:
      Max channels: 2
      Supported sample rates (kHz): 48 44.1 32
      Supported sample sizes (bits): 24 20 16
  Speaker Allocation Data Block:
    FL/FR - Front Left/Right
  Vendor-Specific Data Block (HDMI), OUI 00-0C-03:
    Source physical address: 1.0.0.0
  Detailed Timing Descriptors:
    DTD 2:  1280x720    60.000000 Hz  16:9     45.000 kHz     74.250000 MHz (410 mm x 280 mm)
                 Hfront  110 Hsync  40 Hback  220 Hpol P
                 Vfront    5 Vsync   5 Vback   20 Vpol P
Checksum: 0x0f  Unused space in Extension Block: 77 bytes

----------------

Warnings:

Block 0, Base EDID:
  Vendor & Product Identification: The serial number is one of the known dummy values, it should probably be set to 0.
  Detailed Timing Descriptor #1: Image size is 410x280 mm, but based on the picture AR it should be 410x231 mm.
  Display Product Serial Number: ...
Block 1, CTA-861 Extension Block:
  IT Video Formats are overscanned by default, but normally this should be underscanned.
  Video Data Block: VIC 1 and the first DTD are not identical. Is this intended?
  Detailed Timing Descriptor #2: Image size is 410x280 mm, but based on the picture AR it should be 410x230 mm.
  Display Product Serial Number is set, so the Serial Number in the Base EDID should be 0.
  Add a Colorimetry Data Block with the sRGB colorimetry bit set to avoid interop issues.
EDID:
  Base EDID: Some timings are out of range of the Monitor Ranges:
    Vertical Freq: 50.000 - 70.082 Hz (Monitor: 56.000 - 71.000 Hz)
    Horizontal Freq: 15.625 - 48.363 kHz (Monitor: 30.000 - 49.000 kHz)

Failures:

Block 0, Base EDID:
  Display Product Serial Number: ...
Block 1, CTA-861 Extension Block:
  Missing VCDB, needed for Set Selectable RGB Quantization to avoid interop issues.
EDID:
  Extension Block 2 started with EDID header, ignoring Extension Blocks >= 2.
  CTA-861: Native progressive timings are a mix of several resolutions.

EDID conformity: FAIL
