edid-decode (hex):

00 ff ff ff ff ff ff 00 06 b3 ba 27 01 01 01 01
05 21 01 04 b5 3c 22 78 3b 0b 10 b0 4c 45 a8 26
0a 50 54 bf cf 00 71 4f 81 c0 81 40 81 80 d1 c0
d1 fc 95 00 b3 00 4d d0 00 a0 f0 70 3e 80 30 20
35 00 54 4f 21 00 00 1a 00 00 00 fd 0c 30 90 4a
4a 81 01 0a 20 20 20 20 20 20 00 00 00 fc 00 52
4f 47 20 58 47 32 37 55 51 52 0a 20 00 00 00 ff
00 52 31 4c 4d 51 53 31 30 30 38 39 31 20 02 7f

02 03 3a f2 51 01 02 03 11 12 13 04 0e 0f 1d 1e
1f 10 40 3f 60 61 e2 00 d5 23 09 07 07 83 01 00
00 e3 05 c0 00 e6 06 05 01 70 70 07 6d 1a 00 00
02 0b 30 90 00 04 6f 2c 6f 2c 56 5e 00 a0 a0 a0
29 50 30 20 35 00 54 4f 21 00 00 1a 86 bc 00 50
a0 a0 55 50 08 20 78 00 54 4f 21 00 00 1e 00 00
00 00 00 00 00 00 00 00 00 00 00 00 00 00 00 00
00 00 00 00 00 00 00 00 00 00 00 00 00 00 00 8a

00 ff ff ff ff ff ff 00 06 b3 ba 27 01 01 01 01
05 21 01 04 b5 3c 22 78 3b 0b 10 b0 4c 45 a8 26
0a 50 54 bf cf 00 71 4f 81 c0 81 40 81 80 d1 c0
d1 fc 95 00 b3 00 4d d0 00 a0 f0 70 3e 80 30 20
35 00 54 4f 21 00 00 1a 00 00 00 fd 0c 30 90 4a
4a 81 01 0a 20 20 20 20 20 20 00 00 00 fc 00 52
4f 47 20 58 47 32 37 55 51 52 0a 20 00 00 00 ff
00 52 31 4c 4d 51 53 31 30 30 38 39 31 20 02 7f

00 ff ff ff ff ff ff 00 06 b3 ba 27 01 01 01 01
05 21 01 04 b5 3c 22 78 3b 0b 10 b0 4c 45 a8 26
0a 50 54 bf cf 00 71 4f 81 c0 81 40 81 80 d1 c0
d1 fc 95 00 b3 00 4d d0 00 a0 f0 70 3e 80 30 20
35 00 54 4f 21 00 00 1a 00 00 00 fd 0c 30 90 4a
4a 81 01 0a 20 20 20 20 20 20 00 00 00 fc 00 52
4f 47 20 58 47 32 37 55 51 52 0a 20 00 00 00 ff
00 52 31 4c 4d 51 53 31 30 30 38 39 31 20 02 7f

02 03 3a f2 51 01 02 03 11 12 13 04 0e 0f 1d 1e
1f 10 40 3f 60 61 e2 00 d5 23 09 07 07 83 01 00
00 e3 05 c0 00 e6 06 05 01 70 70 07 6d 1a 00 00
02 0b 30 90 00 04 6f 2c 6f 2c 56 5e 00 a0 a0 a0
29 50 30 20 35 00 54 4f 21 00 00 1a 86 bc 00 50
a0 a0 55 50 08 20 78 00 54 4f 21 00 00 1e 00 00
00 00 00 00 00 00 00 00 00 00 00 00 00 00 00 00
00 00 00 00 00 00 00 00 00 00 00 00 00 00 00 8a

00 ff ff ff ff ff ff 00 06 b3 ba 27 01 01 01 01
05 21 01 04 b5 3c 22 78 3b 0b 10 b0 4c 45 a8 26
0a 50 54 bf cf 00 71 4f 81 c0 81 40 81 80 d1 c0
d1 fc 95 00 b3 00 4d d0 00 a0 f0 70 3e 80 30 20
35 00 54 4f 21 00 00 1a 00 00 00 fd 0c 30 90 4a
4a 81 01 0a 20 20 20 20 20 20 00 00 00 fc 00 52
4f 47 20 58 47 32 37 55 51 52 0a 20 00 00 00 ff
00 52 31 4c 4d 51 53 31 30 30 38 39 31 20 02 7f

----------------

Block 0, Base EDID:
  EDID Structure Version & Revision: 1.4
  Vendor & Product Identification:
    Manufacturer: AUS
    Model: 10170
    Serial Number: ...
    Made in: week 5 of 2023
  Basic Display Parameters & Features:
    Digital display
    Bits per primary color channel: 10
    DisplayPort interface
    Maximum image size: 60 cm x 34 cm
    Gamma: 2.20
    DPMS levels: Off
    Supported color formats: RGB 4:4:4, YCrCb 4:4:4, YCrCb 4:2:2
    First detailed timing includes the native pixel format and preferred refresh rate
    Display supports continuous frequencies
  Color Characteristics:
    Red  : 0.6875, 0.2968
    Green: 0.2714, 0.6591
    Blue : 0.1484, 0.0400
    White: 0.3125, 0.3281
  Established Timings I & II:
    IBM     :   720x400    70.081663 Hz   9:5     31.467 kHz     28.320000 MHz
    DMT 0x04:   640x480    59.940476 Hz   4:3     31.469 kHz     25.175000 MHz
    Apple   :   640x480    66.666667 Hz   4:3     35.000 kHz     30.240000 MHz
    DMT 0x05:   640x480    72.808802 Hz   4:3     37.861 kHz     31.500000 MHz
    DMT 0x06:   640x480    75.000000 Hz   4:3     37.500 kHz     31.500000 MHz
    DMT 0x08:   800x600    56.250000 Hz   4:3     35.156 kHz     36.000000 MHz
    DMT 0x09:   800x600    60.316541 Hz   4:3     37.879 kHz     40.000000 MHz
    DMT 0x0a:   800x600    72.187572 Hz   4:3     48.077 kHz     50.000000 MHz
    DMT 0x0b:   800x600    75.000000 Hz   4:3     46.875 kHz     49.500000 MHz
    DMT 0x10:  1024x768    60.003840 Hz   4:3     48.363 kHz     65.000000 MHz
    DMT 0x11:  1024x768    70.069359 Hz   4:3     56.476 kHz     75.000000 MHz
    DMT 0x12:  1024x768    75.028582 Hz   4:3     60.023 kHz     78.750000 MHz
    DMT 0x24:  1280x1024   75.024675 Hz   5:4     79.976 kHz    135.000000 MHz
  Standard Timings:
    DMT 0x15:  1152x864    75.000000 Hz   4:3     67.500 kHz    108.000000 MHz
    DMT 0x55:  1280x720    60.000000 Hz  16:9     45.000 kHz     74.250000 MHz
    DMT 0x20:  1280x960    60.000000 Hz   4:3     60.000 kHz    108.000000 MHz
    DMT 0x23:  1280x1024   60.019740 Hz   5:4     63.981 kHz    108.000000 MHz
    DMT 0x52:  1920x1080   60.000000 Hz  16:9     67.500 kHz    148.500000 MHz
    GTF     :  1920x1080  119.999987 Hz  16:9    138.840 kHz    368.759000 MHz
    DMT 0x2f:  1440x900    59.887445 Hz  16:10    55.935 kHz    106.500000 MHz
    DMT 0x3a:  1680x1050   59.954250 Hz  16:10    65.290 kHz    146.250000 MHz
  Detailed Timing Descriptors:
    DTD 1:  3840x2160   59.996625 Hz  16:9    133.312 kHz    533.250000 MHz (596 mm x 335 mm)
                 Hfront   48 Hsync  32 Hback   80 Hpol P
                 Vfront    3 Vsync   5 Vback   54 Vpol N
    Display Range Limits:
      Monitor ranges (Range Limits Only): 48-144 Hz V, 329-329 kHz H, max dotclock 1290 MHz
    Display Product Name: 'ROG XG27UQR'
    Display Product Serial Number: ...
  Extension blocks: 2
Checksum: 0x7f

----------------

Block 1, CTA-861 Extension Block:
  Revision: 3
  Underscans IT Video Formats by default
  Basic audio support
  Supports YCbCr 4:4:4
  Supports YCbCr 4:2:2
  Native DTDs: 2
  Video Data Block:
    VIC   1:   640x480    59.940476 Hz   4:3     31.469 kHz     25.175000 MHz
    VIC   2:   720x480    59.940060 Hz   4:3     31.469 kHz     27.000000 MHz
    VIC   3:   720x480    59.940060 Hz  16:9     31.469 kHz     27.000000 MHz
    VIC  17:   720x576    50.000000 Hz   4:3     31.250 kHz     27.000000 MHz
    VIC  18:   720x576    50.000000 Hz  16:9     31.250 kHz     27.000000 MHz
    VIC  19:  1280x720    50.000000 Hz  16:9     37.500 kHz     74.250000 MHz
    VIC   4:  1280x720    60.000000 Hz  16:9     45.000 kHz     74.250000 MHz
    VIC  14:  1440x480    59.940060 Hz   4:3     31.469 kHz     54.000000 MHz
    VIC  15:  1440x480    59.940060 Hz  16:9     31.469 kHz     54.000000 MHz
    VIC  29:  1440x576    50.000000 Hz   4:3     31.250 kHz     54.000000 MHz
    VIC  30:  1440x576    50.000000 Hz  16:9     31.250 kHz     54.000000 MHz
    VIC  31:  1920x1080   50.000000 Hz  16:9     56.250 kHz    148.500000 MHz
    VIC  16:  1920x1080   60.000000 Hz  16:9     67.500 kHz    148.500000 MHz
    VIC  64:  1920x1080  100.000000 Hz  16:9    112.500 kHz    297.000000 MHz
    VIC  63:  1920x1080  120.000000 Hz  16:9    135.000 kHz    297.000000 MHz
    VIC  96:  3840x2160   50.000000 Hz  16:9    112.500 kHz    594.000000 MHz
    VIC  97:  3840x2160   60.000000 Hz  16:9    135.000 kHz    594.000000 MHz
  Video Capability Data Block:
    YCbCr quantization: Selectable (via AVI YQ)
    RGB quantization: Selectable (via AVI Q)
    PT scan behavior: Always Overscanned
    IT scan behavior: Always Overscanned
    CE scan behavior: Always Overscanned
  Audio Data Block:
    Linear PCM:
      Max channels: 2
      Supported sample rates (kHz): 48 44.1 32
      Supported sample sizes (bits): 24 20 16
  Speaker Allocation Data Block:
    FL/FR - Front Left/Right
  Colorimetry Data Block:
    BT2020YCC
    BT2020RGB
  HDR Static Metadata Data Block:
    Electro optical transfer functions:
      Traditional gamma - SDR luminance range
      SMPTE ST2084
    Supported static metadata descriptors:
      Static metadata type 1
    Desired content max luminance: 112 (565.685 cd/m^2)
    Desired content max frame-average luminance: 112 (565.685 cd/m^2)
    Desired content min luminance: 7 (0.004 cd/m^2)
  Vendor-Specific Data Block (AMD), OUI 00-00-1A:
    Version: 2
    Feature Caps: 0x0b
      Local Dimming Supported
    Minimum Refresh Rate: 48 Hz
    Maximum Refresh Rate: 144 Hz
    Flags 1.x: 0x00
    Flags 2.x: 0x04
      ST 2084 (PQ) EOTF Supported
      Linear EOTF (Windows scRGB, 0.0 - 125.0) Supported
      Gamma 2.2 EOTF Supported
      BT.2020 Gamut Supported
    Maximum luminance: 111 (553.564 cd/m^2)
    Minimum luminance: 44 (0.165 cd/m^2)
    Maximum luminance (without local dimming): 111 (553.564 cd/m^2)
    Minimum luminance (without local dimming): 44 (0.165 cd/m^2)
  Detailed Timing Descriptors:
    DTD 2:  2560x1440   59.950550 Hz  16:9     88.787 kHz    241.500000 MHz (596 mm x 335 mm)
                 Hfront   48 Hsync  32 Hback   80 Hpol P
                 Vfront    3 Vsync   5 Vback   33 Vpol N
    DTD 3:  2560x1440  119.875807 Hz  16:9    182.811 kHz    482.620000 MHz (596 mm x 335 mm)
                 Hfront    8 Hsync  32 Hback   40 Hpol P
                 Vfront    7 Vsync   8 Vback   70 Vpol P
Checksum: 0x8a  Unused space in Extension Block: 33 bytes

----------------

Warnings:

Block 0, Base EDID:
  Vendor & Product Identification: The serial number is one of the known dummy values, it should probably be set to 0.
Block 1, CTA-861 Extension Block:
  Video Data Block: VIC 1 and the first DTD are not identical. Is this intended?
  Video Capability Data Block: IT scan behavior is expected to support underscanned.
  Video Capability Data Block: S_PT is equal to S_IT and S_CE, so should be set to 0 instead.
  Colorimetry Data Block: Set the sRGB colorimetry bit to avoid interop issues.
  Display Product Serial Number is set, so the Serial Number in the Base EDID should be 0.
EDID:
  Base EDID: Some timings are out of range of the Monitor Ranges:
    Horizontal Freq: 31.250 - 182.810 kHz (Monitor: 329.000 - 329.000 kHz)

Failures:

Block 0, Base EDID:
  Display Product Serial Number: ...
Block 1, CTA-861 Extension Block:
  Video Capability Data Block: IT video formats are always overscanned, but bit 7 of Byte 3 of the CTA-861 Extension header is set to underscanned.
EDID:
  Extension Block 2 started with EDID header, ignoring Extension Blocks >= 2.
  Base EDID: EDID specified 2 extension block(s), but found 1 extension block(s).
  CTA-861: Native progressive timings are a mix of several resolutions.

EDID conformity: FAIL
