edid-decode (hex):

00 ff ff ff ff ff ff 00 4e 14 a4 0a 01 00 00 00
24 1e 01 04 a5 3c 21 78 3b 8e 05 ad 4f 33 b0 26
0d 50 54 a5 cb 00 81 c0 81 00 81 40 81 80 95 00
a9 c0 b3 00 01 01 02 3a 80 18 71 38 2d 40 58 2c
45 00 55 50 21 00 00 1e 00 00 00 ff 00 0a 20 20
20 20 20 20 20 20 20 20 20 20 00 00 00 fd 00 32
f2 ff ff 3c 01 0a 20 20 20 20 20 20 00 00 00 fc
00 53 63 65 70 74 72 65 20 4b 32 37 0a 20 01 f2

02 03 1c f3 41 90 23 09 07 07 83 01 00 00 6d 1a
00 00 02 01 30 f2 00 00 00 00 00 00 04 74 80 18
71 38 2d 40 58 2c 35 00 55 50 21 00 00 1e fe 7e
80 88 70 38 12 40 18 20 35 00 55 50 21 00 00 1e
7c dd 80 c8 70 38 21 40 30 40 35 00 55 50 21 00
00 1e 82 91 80 88 70 38 12 40 18 20 35 00 55 50
21 00 00 7f 66 21 56 aa 51 00 1e 30 46 8f 33 00
55 50 21 00 00 7f 00 00 00 00 00 00 00 00 00 b2

00 ff ff ff ff ff ff 00 4e 14 a4 0a 01 00 00 00
24 1e 01 04 a5 3c 21 78 3b 8e 05 ad 4f 33 b0 26
0d 50 54 a5 cb 00 81 c0 81 00 81 40 81 80 95 00
a9 c0 b3 00 01 01 02 3a 80 18 71 38 2d 40 58 2c
45 00 55 50 21 00 00 1e 00 00 00 ff 00 0a 20 20
20 20 20 20 20 20 20 20 20 20 00 00 00 fd 00 32
f2 ff ff 3c 01 0a 20 20 20 20 20 20 00 00 00 fc
00 53 63 65 70 74 72 65 20 4b 32 37 0a 20 01 f2

02 03 1c f3 41 90 23 09 07 07 83 01 00 00 6d 1a
00 00 02 01 30 f2 00 00 00 00 00 00 04 74 80 18
71 38 2d 40 58 2c 35 00 55 50 21 00 00 1e fe 7e
80 88 70 38 12 40 18 20 35 00 55 50 21 00 00 1e
7c dd 80 c8 70 38 21 40 30 40 35 00 55 50 21 00
00 1e 82 91 80 88 70 38 12 40 18 20 35 00 55 50
21 00 00 7f 66 21 56 aa 51 00 1e 30 46 8f 33 00
55 50 21 00 00 7f 00 00 00 00 00 00 00 00 00 b2

----------------

Block 0, Base EDID:
  EDID Structure Version & Revision: 1.4
  Vendor & Product Identification:
    Manufacturer: SPT
    Model: 2724
    Serial Number: ...
    Made in: week 36 of 2020
  Basic Display Parameters & Features:
    Digital display
    Bits per primary color channel: 8
    DisplayPort interface
    Maximum image size: 60 cm x 33 cm
    Gamma: 2.20
    DPMS levels: Off
    Supported color formats: RGB 4:4:4, YCrCb 4:4:4, YCrCb 4:2:2
    First detailed timing includes the native pixel format and preferred refresh rate
    Display supports continuous frequencies
  Color Characteristics:
    Red  : 0.6777, 0.3085
    Green: 0.2021, 0.6894
    Blue : 0.1484, 0.0507
    White: 0.3134, 0.3291
  Established Timings I & II:
    IBM     :   720x400    70.081663 Hz   9:5     31.467 kHz     28.320000 MHz
    DMT 0x04:   640x480    59.940476 Hz   4:3     31.469 kHz     25.175000 MHz
    DMT 0x06:   640x480    75.000000 Hz   4:3     37.500 kHz     31.500000 MHz
    DMT 0x09:   800x600    60.316541 Hz   4:3     37.879 kHz     40.000000 MHz
    DMT 0x0a:   800x600    72.187572 Hz   4:3     48.077 kHz     50.000000 MHz
    DMT 0x0b:   800x600    75.000000 Hz   4:3     46.875 kHz     49.500000 MHz
    DMT 0x10:  1024x768    60.003840 Hz   4:3     48.363 kHz     65.000000 MHz
    DMT 0x12:  1024x768    75.028582 Hz   4:3     60.023 kHz     78.750000 MHz
    DMT 0x24:  1280x1024   75.024675 Hz   5:4     79.976 kHz    135.000000 MHz
  Standard Timings:
    DMT 0x55:  1280x720    60.000000 Hz  16:9     45.000 kHz     74.250000 MHz
    DMT 0x1c:  1280x800    59.810326 Hz  16:10    49.702 kHz     83.500000 MHz
    DMT 0x20:  1280x960    60.000000 Hz   4:3     60.000 kHz    108.000000 MHz
    DMT 0x23:  1280x1024   60.019740 Hz   5:4     63.981 kHz    108.000000 MHz
    DMT 0x2f:  1440x900    59.887445 Hz  16:10    55.935 kHz    106.500000 MHz
    DMT 0x53:  1600x900    60.000000 Hz  16:9     60.000 kHz    108.000000 MHz (RB)
    DMT 0x3a:  1680x1050   59.954250 Hz  16:10    65.290 kHz    146.250000 MHz
  Detailed Timing Descriptors:
    DTD 1:  1920x1080   60.000000 Hz  16:9     67.500 kHz    148.500000 MHz (597 mm x 336 mm)
                 Hfront   88 Hsync  44 Hback  148 Hpol P
                 Vfront    4 Vsync   5 Vback   36 Vpol P
    Display Product Serial Number: ...
    Display Range Limits:
      Monitor ranges (Range Limits Only): 50-242 Hz V, 255-255 kHz H, max dotclock 600 MHz
    Display Product Name: 'Sceptre K27'
  Extension blocks: 1
Checksum: 0xf2

----------------

Block 1, CTA-861 Extension Block:
  Revision: 3
  Underscans IT Video Formats by default
  Basic audio support
  Supports YCbCr 4:4:4
  Supports YCbCr 4:2:2
  Native DTDs: 3
  Video Data Block:
    VIC  16:  1920x1080   60.000000 Hz  16:9     67.500 kHz    148.500000 MHz (native)
  Audio Data Block:
    Linear PCM:
      Max channels: 2
      Supported sample rates (kHz): 48 44.1 32
      Supported sample sizes (bits): 24 20 16
  Speaker Allocation Data Block:
    FL/FR - Front Left/Right
  Vendor-Specific Data Block (AMD), OUI 00-00-1A:
    Version: 2
    Flags 1: 0x01
      FreeSync Supported
    Minimum Refresh Rate: 48 Hz
    Maximum Refresh Rate: 242 Hz
    Flags 5: 0x00
  Detailed Timing Descriptors:
    DTD 2:  1920x1080  120.000000 Hz  16:9    135.000 kHz    297.000000 MHz (597 mm x 336 mm)
                 Hfront   88 Hsync  44 Hback  148 Hpol P
                 Vfront    3 Vsync   5 Vback   37 Vpol P
    DTD 3:  1920x1080  144.009625 Hz  16:9    158.123 kHz    325.100000 MHz (597 mm x 336 mm)
                 Hfront   24 Hsync  32 Hback   80 Hpol P
                 Vfront    3 Vsync   5 Vback   10 Vpol P
    DTD 4:  1920x1080  240.299039 Hz  16:9    267.453 kHz    567.000000 MHz (597 mm x 336 mm)
                 Hfront   48 Hsync  64 Hback   88 Hpol P
                 Vfront    3 Vsync   5 Vback   25 Vpol P
    DTD 5:  1920x1080  165.006414 Hz  16:9    181.177 kHz    372.500000 MHz (side by side interleaved, 597 mm x 336 mm)
                 Hfront   24 Hsync  32 Hback   80 Hpol P
                 Vfront    3 Vsync   5 Vback   10 Vpol P
    DTD 6:  1366x768    59.789541 Hz 683:384   47.712 kHz     85.500000 MHz (side by side interleaved, 597 mm x 336 mm)
                 Hfront   70 Hsync 143 Hback  213 Hpol P
                 Vfront    3 Vsync   3 Vback   24 Vpol P
Checksum: 0xb2  Unused space in Extension Block: 9 bytes

----------------

Warnings:

Block 0, Base EDID:
  Vendor & Product Identification: The serial number is one of the known dummy values, it should probably be set to 0.
Block 1, CTA-861 Extension Block:
  Detailed Timing Descriptor #2: DTD is similar but not identical to VIC 63.
  Display Product Serial Number is set, so the Serial Number in the Base EDID should be 0.
  Add a Colorimetry Data Block with the sRGB colorimetry bit set to avoid interop issues.
EDID:
  Base EDID: Some timings are out of range of the Monitor Ranges:
    Horizontal Freq: 31.466 - 267.452 kHz (Monitor: 255.000 - 255.000 kHz)

Failures:

Block 0, Base EDID:
  Display Product Serial Number: ...
Block 1, CTA-861 Extension Block:
  Missing VCDB, needed for Set Selectable RGB Quantization to avoid interop issues.
EDID:
  Extension Block 2 started with EDID header, ignoring Extension Blocks >= 2.

EDID conformity: FAIL
