edid-decode (hex):

00 ff ff ff ff ff ff 00 4c a3 42 54 00 00 00 00
00 12 01 03 90 25 17 78 0a 87 f5 94 57 4f 8c 27
27 50 54 00 00 00 01 01 01 01 01 01 01 01 01 01
01 01 01 01 01 01 2e 2b a0 e8 51 84 38 30 50 98
36 00 6f e6 10 00 00 1a 2e 2b a0 e8 51 84 38 30
50 98 36 00 6f e6 10 00 00 1a 00 00 00 fe 00 50
57 32 39 33 80 31 37 30 42 54 0a 20 00 00 00 00
00 00 00 00 00 00 00 00 00 02 01 0a 20 20 00 fb

----------------

Block 0, Base EDID:
  EDID Structure Version & Revision: 1.3
  Vendor & Product Identification:
    Manufacturer: SEC
    Model: 21570
    Made in: 2008
  Basic Display Parameters & Features:
    Digital display
    Maximum image size: 37 cm x 23 cm
    Gamma: 2.20
    RGB color display
    First detailed timing is the preferred timing
  Color Characteristics:
    Red  : 0.5800, 0.3398
    Green: 0.3095, 0.5498
    Blue : 0.1552, 0.1552
    White: 0.3134, 0.3291
  Established Timings I & II: none
  Standard Timings: none
  Detailed Timing Descriptors:
    DTD 1:  1440x900    59.972829 Hz  16:10    57.334 kHz    110.540000 MHz (367 mm x 230 mm)
                 Hfront   80 Hsync 152 Hback  256 Hpol P
                 Vfront    3 Vsync   6 Vback   47 Vpol N
    DTD 2:  1440x900    59.972829 Hz  16:10    57.334 kHz    110.540000 MHz (367 mm x 230 mm)
                 Hfront   80 Hsync 152 Hback  256 Hpol P
                 Vfront    3 Vsync   6 Vback   47 Vpol N
    Alphanumeric Data String: 'PW293.170BT'
    Manufacturer-Specified Display Descriptor (0x00): 00 00 00 00 00 00 00 00 00 00 00 02 01 0a 20 20 '..............  '
Checksum: 0xfb

----------------

Warnings:

Block 0, Base EDID:
  Alphanumeric Data String: Non-ASCII character 0x80 at position 5, can cause problems.

Failures:

Block 0, Base EDID:
  Basic Display Parameters & Features: Digital Video Interface Standard set to reserved value 0x10.
  Missing Display Product Name.
  Missing Display Range Limits Descriptor.

EDID conformity: FAIL
