edid-decode (hex):

00 ff ff ff ff ff ff 00 4c a3 42 54 00 00 00 00
00 14 01 04 90 25 17 78 0a b8 98 96 59 56 8d 28
21 50 56 00 00 00 01 01 01 01 01 01 01 01 01 01
01 01 01 01 01 01 f2 29 a0 b0 51 84 38 30 50 98
36 00 6f e6 10 00 00 1a f2 29 a0 b0 51 84 38 30
50 98 36 00 6f e6 10 00 00 1a 00 00 00 fe 00 46
31 39 39 52 82 31 37 30 42 54 0a 20 00 00 00 00
00 00 41 01 12 00 00 00 00 06 01 0a 20 20 00 b7

----------------

Block 0, Base EDID:
  EDID Structure Version & Revision: 1.4
  Vendor & Product Identification:
    Manufacturer: SEC
    Model: 21570
    Made in: 2010
  Basic Display Parameters & Features:
    Digital display
    Bits per primary color channel: 6
    Digital interface is not defined
    Maximum image size: 37 cm x 23 cm
    Gamma: 2.20
    Supported color formats: RGB 4:4:4, YCrCb 4:4:4
    First detailed timing includes the native pixel format and preferred refresh rate
  Color Characteristics:
    Red  : 0.5878, 0.3505
    Green: 0.3378, 0.5507
    Blue : 0.1582, 0.1298
    White: 0.3144, 0.3359
  Established Timings I & II: none
  Standard Timings: none
  Detailed Timing Descriptors:
    DTD 1:  1440x900    60.001162 Hz  16:10    57.361 kHz    107.380000 MHz (367 mm x 230 mm)
                 Hfront   80 Hsync 152 Hback  200 Hpol P
                 Vfront    3 Vsync   6 Vback   47 Vpol N
    DTD 2:  1440x900    60.001162 Hz  16:10    57.361 kHz    107.380000 MHz (367 mm x 230 mm)
                 Hfront   80 Hsync 152 Hback  200 Hpol P
                 Vfront    3 Vsync   6 Vback   47 Vpol N
    Alphanumeric Data String: 'F199R.170BT'
    Manufacturer-Specified Display Descriptor (0x00): 00 00 00 00 41 01 12 00 00 00 00 06 01 0a 20 20 '....A.........  '
Checksum: 0xb7

----------------

Warnings:

Block 0, Base EDID:
  Alphanumeric Data String: Non-ASCII character 0x82 at position 5, can cause problems.
  Missing Display Product Name.

EDID conformity: PASS
