edid-decode (hex):

00 ff ff ff ff ff ff 00 22 0e 0e 39 01 01 01 01
24 21 01 04 a5 3c 22 78 3a d7 35 ab 53 4f 9e 25
0f 50 54 a5 4b 00 d1 00 d1 c0 b3 00 a9 c0 95 00
81 80 81 00 81 c0 56 5e 00 a0 a0 a0 29 50 30 20
35 00 55 50 21 00 00 1a 00 00 00 fd 00 32 4b 1e
73 1e 01 0a 20 20 20 20 20 20 00 00 00 fc 00 48
50 20 45 32 37 71 20 47 35 0a 20 20 00 00 00 ff
00 43 4e 43 33 33 36 30 47 5a 4a 0a 20 20 01 03

02 03 11 b1 49 10 1f 04 13 12 03 11 02 01 e2 00
ea a0 73 00 6a a0 a0 29 50 08 20 35 00 55 50 21
00 00 1a 28 3c 80 a0 70 b0 23 40 30 20 36 00 55
50 21 00 00 1a 2a 44 80 a0 70 38 27 40 30 20 35
00 55 50 21 00 00 1a 02 3a 80 18 71 38 2d 40 58
2c 45 00 55 50 21 00 00 1e 48 3f 40 30 62 b0 32
40 40 c0 13 00 55 50 21 00 00 1e 00 00 00 00 00
00 00 00 00 00 00 00 00 00 00 00 00 00 00 00 ca

00 ff ff ff ff ff ff 00 22 0e 0e 39 01 01 01 01
24 21 01 04 a5 3c 22 78 3a d7 35 ab 53 4f 9e 25
0f 50 54 a5 4b 00 d1 00 d1 c0 b3 00 a9 c0 95 00
81 80 81 00 81 c0 56 5e 00 a0 a0 a0 29 50 30 20
35 00 55 50 21 00 00 1a 00 00 00 fd 00 32 4b 1e
73 1e 01 0a 20 20 20 20 20 20 00 00 00 fc 00 48
50 20 45 32 37 71 20 47 35 0a 20 20 00 00 00 ff
00 43 4e 43 33 33 36 30 47 5a 4a 0a 20 20 01 03

02 03 11 b1 49 10 1f 04 13 12 03 11 02 01 e2 00
ea a0 73 00 6a a0 a0 29 50 08 20 35 00 55 50 21
00 00 1a 28 3c 80 a0 70 b0 23 40 30 20 36 00 55
50 21 00 00 1a 2a 44 80 a0 70 38 27 40 30 20 35
00 55 50 21 00 00 1a 02 3a 80 18 71 38 2d 40 58
2c 45 00 55 50 21 00 00 1e 48 3f 40 30 62 b0 32
40 40 c0 13 00 55 50 21 00 00 1e 00 00 00 00 00
00 00 00 00 00 00 00 00 00 00 00 00 00 00 00 ca

----------------

Block 0, Base EDID:
  EDID Structure Version & Revision: 1.4
  Vendor & Product Identification:
    Manufacturer: HPN
    Model: 14606
    Serial Number: ...
    Made in: week 36 of 2023
  Basic Display Parameters & Features:
    Digital display
    Bits per primary color channel: 8
    DisplayPort interface
    Maximum image size: 60 cm x 34 cm
    Gamma: 2.20
    DPMS levels: Off
    Supported color formats: RGB 4:4:4, YCrCb 4:4:4, YCrCb 4:2:2
    First detailed timing includes the native pixel format and preferred refresh rate
  Color Characteristics:
    Red  : 0.6708, 0.3251
    Green: 0.3095, 0.6201
    Blue : 0.1445, 0.0615
    White: 0.3134, 0.3291
  Established Timings I & II:
    IBM     :   720x400    70.081663 Hz   9:5     31.467 kHz     28.320000 MHz
    DMT 0x04:   640x480    59.940476 Hz   4:3     31.469 kHz     25.175000 MHz
    DMT 0x06:   640x480    75.000000 Hz   4:3     37.500 kHz     31.500000 MHz
    DMT 0x09:   800x600    60.316541 Hz   4:3     37.879 kHz     40.000000 MHz
    DMT 0x0b:   800x600    75.000000 Hz   4:3     46.875 kHz     49.500000 MHz
    DMT 0x10:  1024x768    60.003840 Hz   4:3     48.363 kHz     65.000000 MHz
    DMT 0x12:  1024x768    75.028582 Hz   4:3     60.023 kHz     78.750000 MHz
    DMT 0x24:  1280x1024   75.024675 Hz   5:4     79.976 kHz    135.000000 MHz
  Standard Timings:
    DMT 0x45:  1920x1200   59.884600 Hz  16:10    74.556 kHz    193.250000 MHz
    DMT 0x52:  1920x1080   60.000000 Hz  16:9     67.500 kHz    148.500000 MHz
    DMT 0x3a:  1680x1050   59.954250 Hz  16:10    65.290 kHz    146.250000 MHz
    DMT 0x53:  1600x900    60.000000 Hz  16:9     60.000 kHz    108.000000 MHz (RB)
    DMT 0x2f:  1440x900    59.887445 Hz  16:10    55.935 kHz    106.500000 MHz
    DMT 0x23:  1280x1024   60.019740 Hz   5:4     63.981 kHz    108.000000 MHz
    DMT 0x1c:  1280x800    59.810326 Hz  16:10    49.702 kHz     83.500000 MHz
    DMT 0x55:  1280x720    60.000000 Hz  16:9     45.000 kHz     74.250000 MHz
  Detailed Timing Descriptors:
    DTD  1:  2560x1440   59.950550 Hz  16:9     88.787 kHz    241.500000 MHz (597 mm x 336 mm)
                  Hfront   48 Hsync  32 Hback   80 Hpol P
                  Vfront    3 Vsync   5 Vback   33 Vpol N
    Display Range Limits:
      Monitor ranges (Range Limits Only): 50-75 Hz V, 30-115 kHz H, max dotclock 300 MHz
    Display Product Name: 'HP E27q G5'
    Display Product Serial Number: ...
  Extension blocks: 1
Checksum: 0x03

----------------

Block 1, CTA-861 Extension Block:
  Revision: 3
  Underscans IT Video Formats by default
  Supports YCbCr 4:4:4
  Supports YCbCr 4:2:2
  Native detailed modes: 1
  Video Data Block:
    VIC  16:  1920x1080   60.000000 Hz  16:9     67.500 kHz    148.500000 MHz
    VIC  31:  1920x1080   50.000000 Hz  16:9     56.250 kHz    148.500000 MHz
    VIC   4:  1280x720    60.000000 Hz  16:9     45.000 kHz     74.250000 MHz
    VIC  19:  1280x720    50.000000 Hz  16:9     37.500 kHz     74.250000 MHz
    VIC  18:   720x576    50.000000 Hz  16:9     31.250 kHz     27.000000 MHz
    VIC   3:   720x480    59.940060 Hz  16:9     31.469 kHz     27.000000 MHz
    VIC  17:   720x576    50.000000 Hz   4:3     31.250 kHz     27.000000 MHz
    VIC   2:   720x480    59.940060 Hz   4:3     31.469 kHz     27.000000 MHz
    VIC   1:   640x480    59.940476 Hz   4:3     31.469 kHz     25.175000 MHz
  Video Capability Data Block:
    YCbCr quantization: Selectable (via AVI YQ)
    RGB quantization: Selectable (via AVI Q)
    PT scan behavior: Always Underscanned
    IT scan behavior: Always Underscanned
    CE scan behavior: Always Underscanned
  Detailed Timing Descriptors:
    DTD  2:  2560x1440   74.968101 Hz  16:9    111.028 kHz    296.000000 MHz (597 mm x 336 mm)
                  Hfront    8 Hsync  32 Hback   66 Hpol P
                  Vfront    3 Vsync   5 Vback   33 Vpol N
    DTD  3:  1920x1200   59.950171 Hz  16:10    74.038 kHz    154.000000 MHz (597 mm x 336 mm)
                  Hfront   48 Hsync  32 Hback   80 Hpol P
                  Vfront    3 Vsync   6 Vback   26 Vpol N
    DTD  4:  1920x1080   74.972503 Hz  16:9     83.894 kHz    174.500000 MHz (597 mm x 336 mm)
                  Hfront   48 Hsync  32 Hback   80 Hpol P
                  Vfront    3 Vsync   5 Vback   31 Vpol N
    DTD  5:  1920x1080   60.000000 Hz  16:9     67.500 kHz    148.500000 MHz (597 mm x 336 mm)
                  Hfront   88 Hsync  44 Hback  148 Hpol P
                  Vfront    4 Vsync   5 Vback   36 Vpol P
    DTD  6:  1600x1200   60.000000 Hz   4:3     75.000 kHz    162.000000 MHz (597 mm x 336 mm)
                  Hfront   64 Hsync 192 Hback  304 Hpol P
                  Vfront    1 Vsync   3 Vback   46 Vpol P
Checksum: 0xca  Unused space in Extension Block: 20 bytes

----------------

Block 2, Unknown EDID Extension Block 0x00:
  00 ff ff ff ff ff ff 00 22 0e 0e 39 01 01 01 01 '........"..9....'
  24 21 01 04 a5 3c 22 78 3a d7 35 ab 53 4f 9e 25 '$!...<"x:.5.SO.%'
  0f 50 54 a5 4b 00 d1 00 d1 c0 b3 00 a9 c0 95 00 '.PT.K...........'
  81 80 81 00 81 c0 56 5e 00 a0 a0 a0 29 50 30 20 '......V^....)P0 '
  35 00 55 50 21 00 00 1a 00 00 00 fd 00 32 4b 1e '5.UP!........2K.'
  73 1e 01 0a 20 20 20 20 20 20 00 00 00 fc 00 48 's...      .....H'
  50 20 45 32 37 71 20 47 35 0a 20 20 00 00 00 ff 'P E27q G5.  ....'
  00 43 4e 43 33 33 36 30 47 5a 4a 0a 20 20 01 03 '.CNC3360GZJ.  ..'
Checksum: 0x03

----------------

Block 3, CTA-861 Extension Block:
  Revision: 3
  Underscans IT Video Formats by default
  Supports YCbCr 4:4:4
  Supports YCbCr 4:2:2
  Native detailed modes: 1
  Video Data Block:
    VIC  16:  1920x1080   60.000000 Hz  16:9     67.500 kHz    148.500000 MHz
    VIC  31:  1920x1080   50.000000 Hz  16:9     56.250 kHz    148.500000 MHz
    VIC   4:  1280x720    60.000000 Hz  16:9     45.000 kHz     74.250000 MHz
    VIC  19:  1280x720    50.000000 Hz  16:9     37.500 kHz     74.250000 MHz
    VIC  18:   720x576    50.000000 Hz  16:9     31.250 kHz     27.000000 MHz
    VIC   3:   720x480    59.940060 Hz  16:9     31.469 kHz     27.000000 MHz
    VIC  17:   720x576    50.000000 Hz   4:3     31.250 kHz     27.000000 MHz
    VIC   2:   720x480    59.940060 Hz   4:3     31.469 kHz     27.000000 MHz
    VIC   1:   640x480    59.940476 Hz   4:3     31.469 kHz     25.175000 MHz
  Video Capability Data Block:
    YCbCr quantization: Selectable (via AVI YQ)
    RGB quantization: Selectable (via AVI Q)
    PT scan behavior: Always Underscanned
    IT scan behavior: Always Underscanned
    CE scan behavior: Always Underscanned
  Detailed Timing Descriptors:
    DTD  7:  2560x1440   74.968101 Hz  16:9    111.028 kHz    296.000000 MHz (597 mm x 336 mm)
                  Hfront    8 Hsync  32 Hback   66 Hpol P
                  Vfront    3 Vsync   5 Vback   33 Vpol N
    DTD  8:  1920x1200   59.950171 Hz  16:10    74.038 kHz    154.000000 MHz (597 mm x 336 mm)
                  Hfront   48 Hsync  32 Hback   80 Hpol P
                  Vfront    3 Vsync   6 Vback   26 Vpol N
    DTD  9:  1920x1080   74.972503 Hz  16:9     83.894 kHz    174.500000 MHz (597 mm x 336 mm)
                  Hfront   48 Hsync  32 Hback   80 Hpol P
                  Vfront    3 Vsync   5 Vback   31 Vpol N
    DTD 10:  1920x1080   60.000000 Hz  16:9     67.500 kHz    148.500000 MHz (597 mm x 336 mm)
                  Hfront   88 Hsync  44 Hback  148 Hpol P
                  Vfront    4 Vsync   5 Vback   36 Vpol P
    DTD 11:  1600x1200   60.000000 Hz   4:3     75.000 kHz    162.000000 MHz (597 mm x 336 mm)
                  Hfront   64 Hsync 192 Hback  304 Hpol P
                  Vfront    1 Vsync   3 Vback   46 Vpol P
Checksum: 0xca  Unused space in Extension Block: 20 bytes

----------------

Warnings:

Block 0, Base EDID:
  Vendor & Product Identification: The serial number is one of the known dummy values, it should probably be set to 0.
Block 1, CTA-861 Extension Block:
  Video Data Block: VIC 16 and the first DTD are not identical. Is this intended?
  Video Capability Data Block: S_PT is equal to S_IT and S_CE, so should be set to 0 instead.
  Detailed Timing Descriptor #3: Image size is 597x336 mm, but based on the picture AR it should be 597x373 mm.
  Detailed Timing Descriptor #6: Image size is 597x336 mm, but based on the picture AR it should be 597x447 mm.
  Display Product Serial Number is set, so the Serial Number in the Base EDID should be 0.
  Add a Colorimetry Data Block with the sRGB colorimetry bit set to avoid interop issues.
Block 3, CTA-861 Extension Block:
  Video Capability Data Block: S_PT is equal to S_IT and S_CE, so should be set to 0 instead.
  Detailed Timing Descriptor #8: Image size is 597x336 mm, but based on the picture AR it should be 597x373 mm.
  Detailed Timing Descriptor #11: Image size is 597x336 mm, but based on the picture AR it should be 597x447 mm.

Failures:

Block 2, Base EDID:
  Unknown Extension Block.
Block 3, CTA-861 Extension Block:
  Video Data Block: Duplicate VIC 16.
  Video Data Block: Duplicate VIC 31.
  Video Data Block: Duplicate VIC 4.
  Video Data Block: Duplicate VIC 19.
  Video Data Block: Duplicate VIC 18.
  Video Data Block: Duplicate VIC 3.
  Video Data Block: Duplicate VIC 17.
  Video Data Block: Duplicate VIC 2.
  Video Data Block: Duplicate VIC 1.
  Video Capability Data Block: Only one instance of this Data Block is allowed.
EDID:
  Base EDID: EDID specified 1 extension block(s), but found 3 extension block(s).

EDID conformity: FAIL
