edid-decode (hex):

00 ff ff ff ff ff ff 00 1e f9 b0 06 06 21 00 00
03 12 01 03 80 25 15 78 2a 5e 95 a7 53 4c 98 24
14 50 54 a1 08 00 71 00 71 40 81 40 81 80 01 01
01 01 01 01 01 01 1a 1d 00 80 51 d0 1c 20 40 80
35 00 75 d1 10 00 00 1c 00 00 00 fd 00 3b 47 1f
40 0b 00 0a 20 20 20 20 20 20 00 00 00 fc 00 46
50 44 31 37 37 35 57 0a 20 20 20 20 00 00 00 ff
00 4d 47 4d 38 31 37 30 50 30 38 34 35 34 00 9d

00 ff ff ff ff ff ff 00 1e f9 b0 06 06 21 00 00
03 12 01 03 80 25 15 78 2a 5e 95 a7 53 4c 98 24
14 50 54 a1 08 00 71 00 71 40 81 40 81 80 01 01
01 01 01 01 01 01 1a 1d 00 80 51 d0 1c 20 40 80
35 00 75 d1 10 00 00 1c 00 00 00 fd 00 3b 47 1f
40 0b 00 0a 20 20 20 20 20 20 00 00 00 fc 00 46
50 44 31 37 37 35 57 0a 20 20 20 20 00 00 00 ff
00 4d 47 4d 38 31 37 30 50 30 38 34 35 34 00 9d

----------------

Block 0, Base EDID:
  EDID Structure Version & Revision: 1.3
  Vendor & Product Identification:
    Manufacturer: GWY
    Model: 1712
    Serial Number: ...
    Made in: week 3 of 2008
  Basic Display Parameters & Features:
    Digital display
    Maximum image size: 37 cm x 21 cm
    Gamma: 2.20
    DPMS levels: Off
    RGB color display
    First detailed timing is the preferred timing
  Color Characteristics:
    Red  : 0.6533, 0.3251
    Green: 0.2998, 0.5957
    Blue : 0.1425, 0.0791
    White: 0.3134, 0.3291
  Established Timings I & II:
    IBM     :   720x400    70.081663 Hz   9:5     31.467 kHz     28.320000 MHz
    DMT 0x04:   640x480    59.940476 Hz   4:3     31.469 kHz     25.175000 MHz
    DMT 0x09:   800x600    60.316541 Hz   4:3     37.879 kHz     40.000000 MHz
    DMT 0x10:  1024x768    60.003840 Hz   4:3     48.363 kHz     65.000000 MHz
  Standard Timings:
    GTF     :  1152x720    59.999964 Hz  16:10    44.760 kHz     67.319000 MHz
    GTF     :  1152x864    60.000000 Hz   4:3     53.700 kHz     81.624000 MHz
    DMT 0x20:  1280x960    60.000000 Hz   4:3     60.000 kHz    108.000000 MHz
    DMT 0x23:  1280x1024   60.019740 Hz   5:4     63.981 kHz    108.000000 MHz
  Detailed Timing Descriptors:
    DTD 1:  1280x720    59.855126 Hz  16:9     44.772 kHz     74.500000 MHz (373 mm x 209 mm)
                 Hfront   64 Hsync 128 Hback  192 Hpol N
                 Vfront    3 Vsync   5 Vback   20 Vpol P
    Display Range Limits:
      Monitor ranges (GTF): 59-71 Hz V, 31-64 kHz H, max dotclock 110 MHz
    Display Product Name: 'FPD1775W'
    Display Product Serial Number: ...
Checksum: 0x9d

----------------

Failures:

EDID:
  Extension Block 1 started with EDID header, ignoring Extension Blocks >= 1.

EDID conformity: FAIL
