edid-decode (hex):

00 ff ff ff ff ff ff 00 43 47 50 19 01 01 01 01
25 1f 01 03 80 2c 17 78 2a c9 05 a3 57 4b 9c 25
12 50 54 af ee 00 45 4a 95 00 81 80 01 01 01 01
81 4f 71 40 81 40 30 2a 40 c8 60 84 64 30 18 50
13 00 b8 e6 10 00 00 1e 66 21 50 b0 51 00 1b 30
40 70 36 00 b8 e6 10 00 00 1e 00 00 00 fd 00 38
4b 1f 53 0e 00 0a 20 20 20 20 20 20 00 00 00 fc
00 48 44 4d 49 0a 20 20 20 20 20 20 20 20 00 e8

00 ff ff ff ff ff ff 00 43 47 50 19 01 01 01 01
25 1f 01 03 80 2c 17 78 2a c9 05 a3 57 4b 9c 25
12 50 54 af ee 00 45 4a 95 00 81 80 01 01 01 01
81 4f 71 40 81 40 30 2a 40 c8 60 84 64 30 18 50
13 00 b8 e6 10 00 00 1e 66 21 50 b0 51 00 1b 30
40 70 36 00 b8 e6 10 00 00 1e 00 00 00 fd 00 38
4b 1f 53 0e 00 0a 20 20 20 20 20 20 00 00 00 fc
00 48 44 4d 49 0a 20 20 20 20 20 20 20 20 00 e8

----------------

Block 0, Base EDID:
  EDID Structure Version & Revision: 1.3
  Vendor & Product Identification:
    Manufacturer: PZG
    Model: 6480
    Serial Number: ...
    Made in: week 37 of 2021
  Basic Display Parameters & Features:
    Digital display
    Maximum image size: 44 cm x 23 cm
    Gamma: 2.20
    DPMS levels: Off
    RGB color display
    First detailed timing is the preferred timing
  Color Characteristics:
    Red  : 0.6396, 0.3398
    Green: 0.2949, 0.6103
    Blue : 0.1445, 0.0703
    White: 0.3134, 0.3291
  Established Timings I & II:
    IBM     :   720x400    70.081663 Hz   9:5     31.467 kHz     28.320000 MHz
    DMT 0x04:   640x480    59.940476 Hz   4:3     31.469 kHz     25.175000 MHz
    DMT 0x05:   640x480    72.808802 Hz   4:3     37.861 kHz     31.500000 MHz
    DMT 0x06:   640x480    75.000000 Hz   4:3     37.500 kHz     31.500000 MHz
    DMT 0x08:   800x600    56.250000 Hz   4:3     35.156 kHz     36.000000 MHz
    DMT 0x09:   800x600    60.316541 Hz   4:3     37.879 kHz     40.000000 MHz
    DMT 0x0a:   800x600    72.187572 Hz   4:3     48.077 kHz     50.000000 MHz
    DMT 0x0b:   800x600    75.000000 Hz   4:3     46.875 kHz     49.500000 MHz
    Apple   :   832x624    74.551266 Hz   4:3     49.726 kHz     57.284000 MHz
    DMT 0x10:  1024x768    60.003840 Hz   4:3     48.363 kHz     65.000000 MHz
    DMT 0x11:  1024x768    70.069359 Hz   4:3     56.476 kHz     75.000000 MHz
    DMT 0x12:  1024x768    75.028582 Hz   4:3     60.023 kHz     78.750000 MHz
  Standard Timings:
    GTF     :   800x600    70.000000 Hz   4:3     43.750 kHz     45.500000 MHz
    DMT 0x2f:  1440x900    59.887445 Hz  16:10    55.935 kHz    106.500000 MHz
    DMT 0x23:  1280x1024   60.019740 Hz   5:4     63.981 kHz    108.000000 MHz
    GTF     :  1280x960    74.999884 Hz   4:3     75.150 kHz    129.859000 MHz
    GTF     :  1152x864    60.000000 Hz   4:3     53.700 kHz     81.624000 MHz
    DMT 0x20:  1280x960    60.000000 Hz   4:3     60.000 kHz    108.000000 MHz
  Detailed Timing Descriptors:
    DTD 1:  1600x900    60.000000 Hz  16:9     60.000 kHz    108.000000 MHz (440 mm x 230 mm)
                 Hfront   24 Hsync  80 Hback   96 Hpol P
                 Vfront    1 Vsync   3 Vback   96 Vpol P
    DTD 2:  1360x768    60.015162 Hz  85:48    47.712 kHz     85.500000 MHz (440 mm x 230 mm)
                 Hfront   64 Hsync 112 Hback  256 Hpol P
                 Vfront    3 Vsync   6 Vback   18 Vpol P
    Display Range Limits:
      Monitor ranges (GTF): 56-75 Hz V, 31-83 kHz H, max dotclock 140 MHz
    Display Product Name: 'HDMI'
Checksum: 0xe8

----------------

Block 1, Unknown EDID Extension Block 0x00:
  00 ff ff ff ff ff ff 00 43 47 50 19 01 01 01 01 '........CGP.....'
  25 1f 01 03 80 2c 17 78 2a c9 05 a3 57 4b 9c 25 '%....,.x*...WK.%'
  12 50 54 af ee 00 45 4a 95 00 81 80 01 01 01 01 '.PT...EJ........'
  81 4f 71 40 81 40 30 2a 40 c8 60 84 64 30 18 50 '.Oq@.@0*@.`.d0.P'
  13 00 b8 e6 10 00 00 1e 66 21 50 b0 51 00 1b 30 '........f!P.Q..0'
  40 70 36 00 b8 e6 10 00 00 1e 00 00 00 fd 00 38 '@p6............8'
  4b 1f 53 0e 00 0a 20 20 20 20 20 20 00 00 00 fc 'K.S...      ....'
  00 48 44 4d 49 0a 20 20 20 20 20 20 20 20 00 e8 '.HDMI.        ..'
Checksum: 0xe8

----------------

Warnings:

Block 0, Base EDID:
  Vendor & Product Identification: The serial number is one of the known dummy values, it should probably be set to 0.
  Detailed Timing Descriptor #1: Image size is 440x230 mm, but based on the picture AR it should be 440x247 mm.
  Detailed Timing Descriptor #2: Image size is 440x230 mm, but based on the picture AR it should be 440x248 mm.

Failures:

Block 1, Base EDID:
  Unknown Extension Block.
EDID:
  Base EDID: EDID specified 0 extension block(s), but found 1 extension block(s).

EDID conformity: FAIL
