edid-decode (hex):

00 ff ff ff ff ff ff 00 06 af 3e 30 00 00 00 00
08 19 01 04 90 1f 11 78 02 1c f5 97 58 50 8e 27
27 50 54 00 00 00 01 01 01 01 01 01 01 01 01 01
01 01 01 01 01 01 00 2d 40 90 61 84 3c 30 40 2a
33 00 35 ae 10 00 00 1a 00 1e 40 90 61 84 3c 30
40 2a 33 00 35 ae 10 00 00 1a 00 00 00 fe 00 36
54 48 30 39 80 42 31 34 30 52 54 30 00 00 00 00
00 00 41 22 99 00 11 00 00 02 01 0a 20 20 00 02

----------------

Block 0, Base EDID:
  EDID Structure Version & Revision: 1.4
  Vendor & Product Identification:
    Manufacturer: AUO
    Model: 12350
    Made in: week 8 of 2015
  Basic Display Parameters & Features:
    Digital display
    Bits per primary color channel: 6
    Digital interface is not defined
    Maximum image size: 31 cm x 17 cm
    Gamma: 2.20
    Supported color formats: RGB 4:4:4
    First detailed timing includes the native pixel format and preferred refresh rate
  Color Characteristics:
    Red  : 0.5898, 0.3447
    Green: 0.3154, 0.5546
    Blue : 0.1552, 0.1552
    White: 0.3134, 0.3291
  Established Timings I & II: none
  Standard Timings: none
  Detailed Timing Descriptors:
    DTD 1:  1600x900    60.000000 Hz  16:9     57.600 kHz    115.200000 MHz (309 mm x 174 mm)
                 Hfront   64 Hsync  42 Hback  294 Hpol P
                 Vfront    3 Vsync   3 Vback   54 Vpol N
    DTD 2:  1600x900    40.000000 Hz  16:9     38.400 kHz     76.800000 MHz (309 mm x 174 mm)
                 Hfront   64 Hsync  42 Hback  294 Hpol P
                 Vfront    3 Vsync   3 Vback   54 Vpol N
    Alphanumeric Data String: '6TH09.B140RT0'
    Manufacturer-Specified Display Descriptor (0x00): 00 00 00 00 41 22 99 00 11 00 00 02 01 0a 20 20 '....A"........  '
Checksum: 0x02

----------------

Warnings:

Block 0, Base EDID:
  Alphanumeric Data String: Non-ASCII character 0x80 at position 5, can cause problems.
  Missing Display Product Name.

EDID conformity: PASS
