edid-decode (hex):

00 ff ff ff ff ff ff 00 4e 14 0d 08 00 00 00 00
31 1f 01 03 08 2c 17 78 2a 31 86 a8 52 46 97 23
1b 4c 58 bf ef 00 a9 c0 95 00 81 80 81 40 81 c0
71 40 71 4f 01 01 2f 26 40 a0 60 84 1a 30 30 20
35 00 b3 ed 10 00 00 1e 66 21 56 aa 51 00 1e 30
46 8f 33 00 9a 18 11 00 00 1a 15 3b 40 20 62 84
2a 30 68 a8 35 00 9a 18 11 00 00 1e 00 00 00 fc
00 53 63 65 70 74 72 65 20 4a 32 30 0a 20 00 1d

00 ff ff ff ff ff ff 00 4e 14 0d 08 00 00 00 00
31 1f 01 03 08 2c 17 78 2a 31 86 a8 52 46 97 23
1b 4c 58 bf ef 00 a9 c0 95 00 81 80 81 40 81 c0
71 40 71 4f 01 01 2f 26 40 a0 60 84 1a 30 30 20
35 00 b3 ed 10 00 00 1e 66 21 56 aa 51 00 1e 30
46 8f 33 00 9a 18 11 00 00 1a 15 3b 40 20 62 84
2a 30 68 a8 35 00 9a 18 11 00 00 1e 00 00 00 fc
00 53 63 65 70 74 72 65 20 4a 32 30 0a 20 00 1d

----------------

Block 0, Base EDID:
  EDID Structure Version & Revision: 1.3
  Vendor & Product Identification:
    Manufacturer: SPT
    Model: 2061
    Made in: week 49 of 2021
  Basic Display Parameters & Features:
    Analog display
    Signal Level Standard: 0.700 : 0.300 : 1.000 V p-p
    Blank level equals black level
    Sync: Separate
    Maximum image size: 44 cm x 23 cm
    Gamma: 2.20
    DPMS levels: Off
    RGB color display
    First detailed timing is the preferred timing
  Color Characteristics:
    Red  : 0.6562, 0.3232
    Green: 0.2734, 0.5908
    Blue : 0.1386, 0.1054
    White: 0.2978, 0.3457
  Established Timings I & II:
    IBM     :   720x400    70.081663 Hz   9:5     31.467 kHz     28.320000 MHz
    DMT 0x04:   640x480    59.940476 Hz   4:3     31.469 kHz     25.175000 MHz
    Apple   :   640x480    66.666667 Hz   4:3     35.000 kHz     30.240000 MHz
    DMT 0x05:   640x480    72.808802 Hz   4:3     37.861 kHz     31.500000 MHz
    DMT 0x06:   640x480    75.000000 Hz   4:3     37.500 kHz     31.500000 MHz
    DMT 0x08:   800x600    56.250000 Hz   4:3     35.156 kHz     36.000000 MHz
    DMT 0x09:   800x600    60.316541 Hz   4:3     37.879 kHz     40.000000 MHz
    DMT 0x0a:   800x600    72.187572 Hz   4:3     48.077 kHz     50.000000 MHz
    DMT 0x0b:   800x600    75.000000 Hz   4:3     46.875 kHz     49.500000 MHz
    Apple   :   832x624    74.551266 Hz   4:3     49.726 kHz     57.284000 MHz
    DMT 0x10:  1024x768    60.003840 Hz   4:3     48.363 kHz     65.000000 MHz
    DMT 0x11:  1024x768    70.069359 Hz   4:3     56.476 kHz     75.000000 MHz
    DMT 0x12:  1024x768    75.028582 Hz   4:3     60.023 kHz     78.750000 MHz
    DMT 0x24:  1280x1024   75.024675 Hz   5:4     79.976 kHz    135.000000 MHz
  Standard Timings:
    DMT 0x53:  1600x900    60.000000 Hz  16:9     60.000 kHz    108.000000 MHz (RB)
    DMT 0x2f:  1440x900    59.887445 Hz  16:10    55.935 kHz    106.500000 MHz
    DMT 0x23:  1280x1024   60.019740 Hz   5:4     63.981 kHz    108.000000 MHz
    DMT 0x20:  1280x960    60.000000 Hz   4:3     60.000 kHz    108.000000 MHz
    DMT 0x55:  1280x720    60.000000 Hz  16:9     45.000 kHz     74.250000 MHz
    GTF     :  1152x864    60.000000 Hz   4:3     53.700 kHz     81.624000 MHz
    DMT 0x15:  1152x864    75.000000 Hz   4:3     67.500 kHz    108.000000 MHz
  Detailed Timing Descriptors:
    DTD 1:  1600x900    59.978156 Hz  16:9     55.540 kHz     97.750000 MHz (435 mm x 237 mm)
                 Hfront   48 Hsync  32 Hback   80 Hpol P
                 Vfront    3 Vsync   5 Vback   18 Vpol P
    DTD 2:  1366x768    59.789541 Hz 683:384   47.712 kHz     85.500000 MHz (410 mm x 280 mm)
                 Hfront   70 Hsync 143 Hback  213 Hpol P
                 Vfront    3 Vsync   3 Vback   24 Vpol N
    DTD 3:  1600x900    74.889288 Hz  16:9     70.546 kHz    151.250000 MHz (410 mm x 280 mm)
                 Hfront  104 Hsync 168 Hback  272 Hpol P
                 Vfront    3 Vsync   5 Vback   34 Vpol P
    Display Product Name: 'Sceptre J20'
Checksum: 0x1d

----------------

Warnings:

Block 0, Base EDID:
  Detailed Timing Descriptor #2: DTD is similar but not identical to DMT 0x51.
  Detailed Timing Descriptor #2: Image size is 410x280 mm, but based on the picture AR it should be 410x230 mm.
  Detailed Timing Descriptor #3: Image size is 410x280 mm, but based on the picture AR it should be 410x230 mm.

Failures:

Block 0, Base EDID:
  Detailed Timing Descriptor #2: Mismatch of image size 410x280 mm vs display size 440x230 mm.
  Detailed Timing Descriptor #3: Mismatch of image size 410x280 mm vs display size 440x230 mm.
  Missing Display Range Limits Descriptor.
EDID:
  Extension Block 1 started with EDID header, ignoring Extension Blocks >= 1.
  Base EDID: The DTD max image size is 435x280mm, which is larger than the display size 440.0x230.0mm.

EDID conformity: FAIL
