edid-decode (hex):

00 ff ff ff ff ff ff 00 51 f3 8f 50 00 00 0d 00
0e 10 01 03 80 22 13 78 ca e2 b5 9e 59 52 99 26
1e 50 54 00 00 00 01 01 01 01 01 01 01 01 01 01
01 01 01 01 01 01 9e 37 80 b4 70 38 32 40 1e 14
aa 00 58 c1 10 00 00 18 00 00 00 fd 00 3b 3d 43
45 0f 00 0a 20 20 20 20 20 20 00 00 00 fc 00 49
6e 74 65 72 6e 61 6c 20 4c 43 44 0a 00 00 00 fe
00 54 4f 53 48 49 42 41 0a 20 20 20 20 20 00 4e

00 ff ff ff ff ff ff 00 51 f3 8f 50 00 00 0d 00
0e 10 01 03 80 22 13 78 ca e2 b5 9e 59 52 99 26
1e 50 54 00 00 00 01 01 01 01 01 01 01 01 01 01
01 01 01 01 01 01 9e 37 80 b4 70 38 32 40 1e 14
aa 00 58 c1 10 00 00 18 00 00 00 fd 00 3b 3d 43
45 0f 00 0a 20 20 20 20 20 20 00 00 00 fc 00 49
6e 74 65 72 6e 61 6c 20 4c 43 44 0a 00 00 00 fe
00 54 4f 53 48 49 42 41 0a 20 20 20 20 20 00 4e

----------------

Block 0, Base EDID:
  EDID Structure Version & Revision: 1.3
  Vendor & Product Identification:
    Manufacturer: TOS
    Model: 20623
    Serial Number: ...
    Made in: week 14 of 2006
  Basic Display Parameters & Features:
    Digital display
    Maximum image size: 34 cm x 19 cm
    Gamma: 2.20
    DPMS levels: Standby Suspend
    RGB color display
    First detailed timing is the preferred timing
  Color Characteristics:
    Red  : 0.6201, 0.3496
    Green: 0.3203, 0.5996
    Blue : 0.1503, 0.1201
    White: 0.3134, 0.3291
  Established Timings I & II: none
  Standard Timings: none
  Detailed Timing Descriptors:
    DTD 1:  1920x1080   60.000000 Hz  16:9     67.800 kHz    142.380000 MHz (344 mm x 193 mm)
                 Hfront   30 Hsync  20 Hback  130 Hpol N
                 Vfront   10 Vsync  10 Vback   30 Vpol N
    Display Range Limits:
      Monitor ranges (GTF): 59-61 Hz V, 67-69 kHz H, max dotclock 150 MHz
    Display Product Name: 'Internal LCD'
    Alphanumeric Data String: 'TOSHIBA'
Checksum: 0x4e

----------------

Failures:

EDID:
  Extension Block 1 started with EDID header, ignoring Extension Blocks >= 1.

EDID conformity: FAIL
