edid-decode (hex):

00 ff ff ff ff ff ff 00 59 3a 67 00 01 01 01 01
00 16 01 03 08 29 17 78 2a 5d a5 a3 59 53 a0 27
0f 50 54 a5 46 00 01 01 01 01 01 01 01 01 01 01
01 01 01 01 01 01 66 21 50 b0 51 00 1b 30 40 70
36 00 9a e6 10 00 00 1e 64 19 00 40 41 00 26 30
18 88 36 00 9a e6 10 00 00 18 00 00 00 fc 00 45
31 39 31 56 41 0a 20 20 20 20 20 20 00 00 00 fd
00 3a 4c 1e 3d 09 00 0a 20 20 20 20 20 20 00 c7

00 ff ff ff ff ff ff 00 59 3a 67 00 01 01 01 01
00 16 01 03 08 29 17 78 2a 5d a5 a3 59 53 a0 27
0f 50 54 a5 46 00 01 01 01 01 01 01 01 01 01 01
01 01 01 01 01 01 66 21 50 b0 51 00 1b 30 40 70
36 00 9a e6 10 00 00 1e 64 19 00 40 41 00 26 30
18 88 36 00 9a e6 10 00 00 18 00 00 00 fc 00 45
31 39 31 56 41 0a 20 20 20 20 20 20 00 00 00 fd
00 3a 4c 1e 3d 09 00 0a 20 20 20 20 20 20 00 c7

----------------

Block 0, Base EDID:
  EDID Structure Version & Revision: 1.3
  Vendor & Product Identification:
    Manufacturer: VIZ
    Model: 103
    Serial Number: ...
    Made in: 2012
  Basic Display Parameters & Features:
    Analog display
    Signal Level Standard: 0.700 : 0.300 : 1.000 V p-p
    Blank level equals black level
    Sync: Separate
    Maximum image size: 41 cm x 23 cm
    Gamma: 2.20
    DPMS levels: Off
    RGB color display
    First detailed timing is the preferred timing
  Color Characteristics:
    Red  : 0.6376, 0.3486
    Green: 0.3271, 0.6259
    Blue : 0.1542, 0.0605
    White: 0.3134, 0.3291
  Established Timings I & II:
    IBM     :   720x400    70.081663 Hz   9:5     31.467 kHz     28.320000 MHz
    DMT 0x04:   640x480    59.940476 Hz   4:3     31.469 kHz     25.175000 MHz
    DMT 0x06:   640x480    75.000000 Hz   4:3     37.500 kHz     31.500000 MHz
    DMT 0x09:   800x600    60.316541 Hz   4:3     37.879 kHz     40.000000 MHz
    DMT 0x0b:   800x600    75.000000 Hz   4:3     46.875 kHz     49.500000 MHz
    DMT 0x11:  1024x768    70.069359 Hz   4:3     56.476 kHz     75.000000 MHz
    DMT 0x12:  1024x768    75.028582 Hz   4:3     60.023 kHz     78.750000 MHz
  Standard Timings: none
  Detailed Timing Descriptors:
    DTD 1:  1360x768    60.015162 Hz  85:48    47.712 kHz     85.500000 MHz (410 mm x 230 mm)
                 Hfront   64 Hsync 112 Hback  256 Hpol P
                 Vfront    3 Vsync   6 Vback   18 Vpol P
    DTD 2:  1024x768    60.003840 Hz   4:3     48.363 kHz     65.000000 MHz (410 mm x 230 mm)
                 Hfront   24 Hsync 136 Hback  160 Hpol N
                 Vfront    3 Vsync   6 Vback   29 Vpol N
    Display Product Name: 'E191VA'
    Display Range Limits:
      Monitor ranges (GTF): 58-76 Hz V, 30-61 kHz H, max dotclock 90 MHz
Checksum: 0xc7

----------------

Warnings:

Block 0, Base EDID:
  Vendor & Product Identification: The serial number is one of the known dummy values, it should probably be set to 0.
  Detailed Timing Descriptor #2: Image size is 410x230 mm, but based on the picture AR it should be 306x230 mm.

Failures:

EDID:
  Extension Block 1 started with EDID header, ignoring Extension Blocks >= 1.

EDID conformity: FAIL
