edid-decode (hex):

00 ff ff ff ff ff ff 00 09 e5 68 0d 00 00 00 00
28 22 01 04 b5 21 15 78 07 51 85 a7 54 4b 9d 24
0f 50 54 00 00 00 01 01 01 01 01 01 01 01 01 01
01 01 01 01 01 01 4f 6f 00 a0 a0 40 92 60 30 20
66 00 49 ce 10 00 00 1a 00 00 00 fd 0c 1e b4 3b
3b 55 01 0a 20 20 20 20 20 20 00 00 00 fe 00 42
4f 45 20 4e 4a 0a 20 20 20 20 20 20 00 00 00 fc
00 4e 45 31 35 33 51 44 4d 2d 4e 59 33 0a 01 40

70 20 79 02 00 22 00 14 41 0b 0d 85 ff 09 9f 00
2f 00 1f 00 3f 06 91 00 05 00 05 00 2b 00 0c 27
00 1e 3b 00 00 27 00 48 b3 00 00 25 00 09 41 0b
0d 41 0b 0d 1e b4 80 81 00 15 74 1a 00 00 03 51
1e b4 00 00 5a 51 5a 51 b4 00 00 00 00 00 00 00
00 00 00 00 00 00 00 00 00 00 00 00 00 00 00 00
00 00 00 00 00 00 00 00 00 00 00 00 00 00 00 00
00 00 00 00 00 00 00 00 00 00 00 00 00 00 1d 90

00 ff ff ff ff ff ff 00 09 e5 68 0d 00 00 00 00
28 22 01 04 b5 21 15 78 07 51 85 a7 54 4b 9d 24
0f 50 54 00 00 00 01 01 01 01 01 01 01 01 01 01
01 01 01 01 01 01 4f 6f 00 a0 a0 40 92 60 30 20
66 00 49 ce 10 00 00 1a 00 00 00 fd 0c 1e b4 3b
3b 55 01 0a 20 20 20 20 20 20 00 00 00 fe 00 42
4f 45 20 4e 4a 0a 20 20 20 20 20 20 00 00 00 fc
00 4e 45 31 35 33 51 44 4d 2d 4e 59 33 0a 01 40

70 20 79 02 00 22 00 14 41 0b 0d 85 ff 09 9f 00
2f 00 1f 00 3f 06 91 00 05 00 05 00 2b 00 0c 27
00 1e 3b 00 00 27 00 48 b3 00 00 25 00 09 41 0b
0d 41 0b 0d 1e b4 80 81 00 15 74 1a 00 00 03 51
1e b4 00 00 5a 51 5a 51 b4 00 00 00 00 00 00 00
00 00 00 00 00 00 00 00 00 00 00 00 00 00 00 00
00 00 00 00 00 00 00 00 00 00 00 00 00 00 00 00
00 00 00 00 00 00 00 00 00 00 00 00 00 00 1d 90

----------------

Block 0, Base EDID:
  EDID Structure Version & Revision: 1.4
  Vendor & Product Identification:
    Manufacturer: BOE
    Model: 3432
    Made in: week 40 of 2024
  Basic Display Parameters & Features:
    Digital display
    Bits per primary color channel: 10
    DisplayPort interface
    Maximum image size: 33 cm x 21 cm
    Gamma: 2.20
    Supported color formats: RGB 4:4:4
    Default (sRGB) color space is primary color space
    First detailed timing includes the native pixel format and preferred refresh rate
    Display supports continuous frequencies
  Color Characteristics:
    Red  : 0.6533, 0.3291
    Green: 0.2929, 0.6142
    Blue : 0.1425, 0.0585
    White: 0.3134, 0.3291
  Established Timings I & II: none
  Standard Timings: none
  Detailed Timing Descriptors:
    DTD 1:  2560x1600   60.000590 Hz  16:10   104.761 kHz    284.950000 MHz (329 mm x 206 mm)
                 Hfront   48 Hsync  32 Hback   80 Hpol P
                 Vfront    6 Vsync   6 Vback  134 Vpol N
    Display Range Limits:
      Monitor ranges (Range Limits Only): 30-180 Hz V, 314-314 kHz H, max dotclock 850 MHz
    Alphanumeric Data String: 'BOE NJ'
    Display Product Name: 'NE153QDM-NY3'
  Extension blocks: 1
Checksum: 0x40

----------------

Block 1, DisplayID Extension Block:
  Version: 2.0
  Extension Count: 0
  Display Product Primary Use Case: None of the listed primary use cases; generic display
  Video Timing Modes Type 7 - Detailed Timings Data Block:
    DTD:  2560x1600  180.001769 Hz  16:10   314.283 kHz    854.850000 MHz (aspect 16:10, no 3D stereo, preferred)
               Hfront   48 Hsync  32 Hback   80 Hpol N
               Vfront    6 Vsync   6 Vback  134 Vpol N
  Adaptive Sync Data Block:
    Descriptor #1:
      Native Panel Range
      Fixed Average V-Total and Adaptive V-Total
      Supports Seamless Transition
      'Max Single Frame Duration Increase' field value without jitter impact
      'Max Single Frame Duration Decrease' field value without jitter impact
      Max Duration Increase: 0.00 ms
      Max Duration Decrease: 0.00 ms
      Min Refresh Rate: 30 Hz
      Max Refresh Rate: 60 Hz
    Descriptor #2:
      Native Panel Range
      Fixed Average V-Total and Adaptive V-Total
      Supports Seamless Transition
      'Max Single Frame Duration Increase' field value without jitter impact
      'Max Single Frame Duration Decrease' field value without jitter impact
      Max Duration Increase: 0.00 ms
      Max Duration Decrease: 0.00 ms
      Min Refresh Rate: 72 Hz
      Max Refresh Rate: 180 Hz
  Dynamic Video Timing Range Limits Data Block:
    Minimum Pixel Clock: 854850 kHz
    Maximum Pixel Clock: 854850 kHz
    Minimum Vertical Refresh Rate: 30 Hz
    Maximum Vertical Refresh Rate: 180 Hz
    Seamless Dynamic Video Timing Support: Yes
  CTA-861 DisplayID Data Block:
  Vendor-Specific Data Block (AMD), OUI 00-00-1A:
    Version: 3
    Flags 1: 0x51
      FreeSync Supported
      Panel Replay/PSR Switch Supported
      Panel Replay Supported
    Minimum Refresh Rate: 30 Hz
    Maximum Refresh Rate: 180 Hz
    Flags 5: 0x00
  Checksum: 0x1d
Checksum: 0x90

----------------

Warnings:

EDID:
  Base EDID: Some timings are out of range of the Monitor Ranges:
    Horizontal Freq: 104.761 - 314.283 kHz (Monitor: 314.000 - 314.000 kHz)
    Maximum Clock: 854.850 MHz (Monitor: 850.000 MHz)

Failures:

Block 0, Base EDID:
  Basic Display Parameters & Features: sRGB is signaled, but the chromaticities do not match.
EDID:
  Extension Block 2 started with EDID header, ignoring Extension Blocks >= 2.
  DisplayID: Missing DisplayID Display Parameters Data Block.

EDID conformity: FAIL
