edid-decode (hex):

00 ff ff ff ff ff ff 00 06 af d4 14 00 00 00 00
23 18 01 04 a0 16 0e 78 02 0a 95 99 58 53 95 27
21 50 54 00 00 00 01 01 01 01 01 01 01 01 01 01
01 01 01 01 01 01 4e 1b 00 93 50 20 10 30 5e 20
44 00 d8 87 00 00 00 18 00 00 00 0f 00 00 00 00
00 00 00 00 00 00 00 00 00 20 00 00 00 fe 00 41
55 4f 0a 20 20 20 20 20 20 20 20 20 00 00 00 fe
00 42 31 30 31 45 41 4e 30 31 2e 34 20 0a 00 c3

00 ff ff ff ff ff ff 00 06 af d4 14 00 00 00 00
23 18 01 04 a0 16 0e 78 02 0a 95 99 58 53 95 27
21 50 54 00 00 00 01 01 01 01 01 01 01 01 01 01
01 01 01 01 01 01 4e 1b 00 93 50 20 10 30 5e 20
44 00 d8 87 00 00 00 18 00 00 00 0f 00 00 00 00
00 00 00 00 00 00 00 00 00 20 00 00 00 fe 00 41
55 4f 0a 20 20 20 20 20 20 20 20 20 00 00 00 fe
00 42 31 30 31 45 41 4e 30 31 2e 34 20 0a 00 c3

----------------

Block 0, Base EDID:
  EDID Structure Version & Revision: 1.4
  Vendor & Product Identification:
    Manufacturer: AUO
    Model: 5332
    Made in: week 35 of 2014
  Basic Display Parameters & Features:
    Digital display
    Bits per primary color channel: 8
    Digital interface is not defined
    Maximum image size: 22 cm x 14 cm
    Gamma: 2.20
    Supported color formats: RGB 4:4:4
    First detailed timing includes the native pixel format and preferred refresh rate
  Color Characteristics:
    Red  : 0.5976, 0.3437
    Green: 0.3261, 0.5839
    Blue : 0.1542, 0.1298
    White: 0.3134, 0.3291
  Established Timings I & II: none
  Standard Timings: none
  Detailed Timing Descriptors:
    DTD 1:  1280x800    60.029267 Hz  16:10    48.984 kHz     69.900000 MHz (216 mm x 135 mm)
                 Hfront   94 Hsync  32 Hback   21 Hpol N
                 Vfront    4 Vsync   4 Vback    8 Vpol N
    Manufacturer-Specified Display Descriptor (0x0f): 00 0f 00 00 00 00 00 00 00 00 00 00 00 00 00 20 '............... '
    Alphanumeric Data String: 'AUO'
    Alphanumeric Data String: 'B101EAN01.4 '
Checksum: 0xc3

----------------

Warnings:

Block 0, Base EDID:
  Missing Display Product Name.

Failures:

Block 0, Base EDID:
  Alphanumeric Data String: One or more trailing spaces before newline.
EDID:
  Extension Block 1 started with EDID header, ignoring Extension Blocks >= 1.

EDID conformity: FAIL
