edid-decode (hex):

00 ff ff ff ff ff ff 00 52 62 08 01 01 01 01 01
ff 18 01 03 80 46 27 78 0a 03 30 a8 53 44 98 23
18 4c 59 ad cf 00 81 c0 81 80 61 4c 01 01 01 01
01 01 01 01 01 01 66 21 50 b0 51 00 1b 30 40 70
36 00 bc 86 21 00 00 1e 02 3a 80 18 71 38 2d 40
58 2c 45 00 bc 86 21 00 00 1e 00 00 00 fc 00 54
4f 53 48 49 42 41 2d 54 56 0a 20 20 00 00 00 fd
00 18 4b 0f 51 0f 00 0a 20 20 20 20 20 20 01 dd

02 03 2b 70 52 1f 10 20 21 22 13 04 14 05 12 11
03 02 16 15 07 06 01 26 09 07 07 15 07 50 6c 03
0c 00 20 00 00 1e c0 15 15 1f 1f 02 3a 80 d0 72
38 2d 40 10 2c 45 80 bc 86 21 00 00 1e 01 1d 80
d0 72 1c 16 20 10 2c 25 80 bc 86 21 00 00 9e 01
1d 00 bc 52 d0 1e 20 b8 28 55 40 bc 86 21 00 00
1e 02 3a 80 18 71 38 2d 40 58 2c 45 00 bc 86 21
00 00 1e 00 00 00 00 00 00 00 00 00 00 00 00 c4

----------------

Block 0, Base EDID:
  EDID Structure Version & Revision: 1.3
  Vendor & Product Identification:
    Manufacturer: TSB
    Model: 264
    Serial Number: ...
    Model year: 2014
  Basic Display Parameters & Features:
    Digital display
    Maximum image size: 70 cm x 39 cm
    Gamma: 2.20
    RGB color display
    First detailed timing is the preferred timing
  Color Characteristics:
    Red  : 0.6562, 0.3242
    Green: 0.2656, 0.5966
    Blue : 0.1367, 0.0966
    White: 0.2968, 0.3476
  Established Timings I & II:
    IBM     :   720x400    70.081663 Hz   9:5     31.467 kHz     28.320000 MHz
    DMT 0x04:   640x480    59.940476 Hz   4:3     31.469 kHz     25.175000 MHz
    DMT 0x05:   640x480    72.808802 Hz   4:3     37.861 kHz     31.500000 MHz
    DMT 0x06:   640x480    75.000000 Hz   4:3     37.500 kHz     31.500000 MHz
    DMT 0x09:   800x600    60.316541 Hz   4:3     37.879 kHz     40.000000 MHz
    DMT 0x0a:   800x600    72.187572 Hz   4:3     48.077 kHz     50.000000 MHz
    DMT 0x0b:   800x600    75.000000 Hz   4:3     46.875 kHz     49.500000 MHz
    DMT 0x10:  1024x768    60.003840 Hz   4:3     48.363 kHz     65.000000 MHz
    DMT 0x11:  1024x768    70.069359 Hz   4:3     56.476 kHz     75.000000 MHz
    DMT 0x12:  1024x768    75.028582 Hz   4:3     60.023 kHz     78.750000 MHz
    DMT 0x24:  1280x1024   75.024675 Hz   5:4     79.976 kHz    135.000000 MHz
  Standard Timings:
    DMT 0x55:  1280x720    60.000000 Hz  16:9     45.000 kHz     74.250000 MHz
    DMT 0x23:  1280x1024   60.019740 Hz   5:4     63.981 kHz    108.000000 MHz
    GTF     :  1024x768    72.000073 Hz   4:3     57.672 kHz     78.434000 MHz
  Detailed Timing Descriptors:
    DTD 1:  1360x768    60.015162 Hz  85:48    47.712 kHz     85.500000 MHz (700 mm x 390 mm)
                 Hfront   64 Hsync 112 Hback  256 Hpol P
                 Vfront    3 Vsync   6 Vback   18 Vpol P
    DTD 2:  1920x1080   60.000000 Hz  16:9     67.500 kHz    148.500000 MHz (700 mm x 390 mm)
                 Hfront   88 Hsync  44 Hback  148 Hpol P
                 Vfront    4 Vsync   5 Vback   36 Vpol P
    Display Product Name: 'TOSHIBA-TV'
    Display Range Limits:
      Monitor ranges (GTF): 24-75 Hz V, 15-81 kHz H, max dotclock 150 MHz
  Extension blocks: 1
Checksum: 0xdd

----------------

Block 1, CTA-861 Extension Block:
  Revision: 3
  Basic audio support
  Supports YCbCr 4:4:4
  Supports YCbCr 4:2:2
  Native DTDs: 0
  Video Data Block:
    VIC  31:  1920x1080   50.000000 Hz  16:9     56.250 kHz    148.500000 MHz
    VIC  16:  1920x1080   60.000000 Hz  16:9     67.500 kHz    148.500000 MHz
    VIC  32:  1920x1080   24.000000 Hz  16:9     27.000 kHz     74.250000 MHz
    VIC  33:  1920x1080   25.000000 Hz  16:9     28.125 kHz     74.250000 MHz
    VIC  34:  1920x1080   30.000000 Hz  16:9     33.750 kHz     74.250000 MHz
    VIC  19:  1280x720    50.000000 Hz  16:9     37.500 kHz     74.250000 MHz
    VIC   4:  1280x720    60.000000 Hz  16:9     45.000 kHz     74.250000 MHz
    VIC  20:  1920x1080i  50.000000 Hz  16:9     28.125 kHz     74.250000 MHz
    VIC   5:  1920x1080i  60.000000 Hz  16:9     33.750 kHz     74.250000 MHz
    VIC  18:   720x576    50.000000 Hz  16:9     31.250 kHz     27.000000 MHz
    VIC  17:   720x576    50.000000 Hz   4:3     31.250 kHz     27.000000 MHz
    VIC   3:   720x480    59.940060 Hz  16:9     31.469 kHz     27.000000 MHz
    VIC   2:   720x480    59.940060 Hz   4:3     31.469 kHz     27.000000 MHz
    VIC  22:  1440x576i   50.000000 Hz  16:9     15.625 kHz     27.000000 MHz
    VIC  21:  1440x576i   50.000000 Hz   4:3     15.625 kHz     27.000000 MHz
    VIC   7:  1440x480i   59.940060 Hz  16:9     15.734 kHz     27.000000 MHz
    VIC   6:  1440x480i   59.940060 Hz   4:3     15.734 kHz     27.000000 MHz
    VIC   1:   640x480    59.940476 Hz   4:3     31.469 kHz     25.175000 MHz
  Audio Data Block:
    Linear PCM:
      Max channels: 2
      Supported sample rates (kHz): 48 44.1 32
      Supported sample sizes (bits): 24 20 16
    AC-3:
      Max channels: 6
      Supported sample rates (kHz): 48 44.1 32
      Maximum bit rate: 640 kb/s
  Vendor-Specific Data Block (HDMI), OUI 00-0C-03:
    Source physical address: 2.0.0.0
    Maximum TMDS clock: 150 MHz
    Video latency: 40 ms
    Audio latency: 40 ms
    Interlaced video latency: 60 ms
    Interlaced audio latency: 60 ms
  Detailed Timing Descriptors:
    DTD 3:  1920x1080   50.000000 Hz  16:9     56.250 kHz    148.500000 MHz (700 mm x 390 mm)
                 Hfront  528 Hsync  44 Hback  148 Hpol P
                 Vfront    4 Vsync   5 Vback   36 Vpol P
    DTD 4:  1920x1080i  50.000000 Hz  16:9     28.125 kHz     74.250000 MHz (700 mm x 390 mm)
                 Hfront  528 Hsync  44 Hback  148 Hpol P
                 Vfront    2 Vsync   5 Vback   15 Vpol P Vfront +0.5 Odd Field
                 Vfront    2 Vsync   5 Vback   15 Vpol P Vback  +0.5 Even Field
    DTD 5:  1280x720    50.000000 Hz  16:9     37.500 kHz     74.250000 MHz (700 mm x 390 mm)
                 Hfront  440 Hsync  40 Hback  220 Hpol P
                 Vfront    5 Vsync   5 Vback   20 Vpol P
    DTD 6:  1920x1080   60.000000 Hz  16:9     67.500 kHz    148.500000 MHz (700 mm x 390 mm)
                 Hfront   88 Hsync  44 Hback  148 Hpol P
                 Vfront    4 Vsync   5 Vback   36 Vpol P
Checksum: 0xc4  Unused space in Extension Block: 12 bytes

----------------

Warnings:

Block 0, Base EDID:
  Vendor & Product Identification: The serial number is one of the known dummy values, it should probably be set to 0.
Block 1, CTA-861 Extension Block:
  IT Video Formats are overscanned by default, but normally this should be underscanned.
  Video Data Block: VIC 31 and the first DTD are not identical. Is this intended?
  Add a Colorimetry Data Block with the sRGB colorimetry bit set to avoid interop issues.

Failures:

Block 0, Base EDID:
  Vendor & Product Identification: EDID 1.3 does not support week 0xff.
Block 1, CTA-861 Extension Block:
  Missing VCDB, needed for Set Selectable RGB Quantization to avoid interop issues.

EDID conformity: FAIL
