edid-decode (hex):

00 ff ff ff ff ff ff 00 34 a4 a7 11 00 00 00 00
24 0b 01 03 80 1e 17 8c e0 4e e0 a1 57 4c 99 23
19 52 57 bf ee 00 61 4c 81 c0 01 01 01 01 01 01
01 01 01 01 01 01 64 19 00 40 41 00 26 30 18 88
36 00 33 e6 10 00 00 18 00 00 00 fd 00 38 4c 1f
3d 08 00 0a 20 20 20 20 20 20 00 00 00 fc 00 4d
44 39 36 31 35 41 46 20 20 20 20 20 00 00 00 ff
00 30 0a 20 20 20 20 20 20 20 20 20 20 20 00 4f

00 ff ff ff ff ff ff 00 34 a4 a7 11 00 00 00 00
24 0b 01 03 80 1e 17 8c e0 4e e0 a1 57 4c 99 23
19 52 57 bf ee 00 61 4c 81 c0 01 01 01 01 01 01
01 01 01 01 01 01 64 19 00 40 41 00 26 30 18 88
36 00 33 e6 10 00 00 18 00 00 00 fd 00 38 4c 1f
3d 08 00 0a 20 20 20 20 20 20 00 00 00 fc 00 4d
44 39 36 31 35 41 46 20 20 20 20 20 00 00 00 ff
00 30 0a 20 20 20 20 20 20 20 20 20 20 20 00 4f

----------------

Block 0, Base EDID:
  EDID Structure Version & Revision: 1.3
  Vendor & Product Identification:
    Manufacturer: MED
    Model: 4519
    Made in: week 36 of 2001
  Basic Display Parameters & Features:
    Digital display
    Maximum image size: 30 cm x 23 cm
    Gamma: 2.40
    DPMS levels: Standby Suspend Off
    Monochrome or grayscale display
  Color Characteristics:
    Red  : 0.6298, 0.3398
    Green: 0.2998, 0.5996
    Blue : 0.1396, 0.0996
    White: 0.3203, 0.3398
  Established Timings I & II:
    IBM     :   720x400    70.081663 Hz   9:5     31.467 kHz     28.320000 MHz
    DMT 0x04:   640x480    59.940476 Hz   4:3     31.469 kHz     25.175000 MHz
    Apple   :   640x480    66.666667 Hz   4:3     35.000 kHz     30.240000 MHz
    DMT 0x05:   640x480    72.808802 Hz   4:3     37.861 kHz     31.500000 MHz
    DMT 0x06:   640x480    75.000000 Hz   4:3     37.500 kHz     31.500000 MHz
    DMT 0x08:   800x600    56.250000 Hz   4:3     35.156 kHz     36.000000 MHz
    DMT 0x09:   800x600    60.316541 Hz   4:3     37.879 kHz     40.000000 MHz
    DMT 0x0a:   800x600    72.187572 Hz   4:3     48.077 kHz     50.000000 MHz
    DMT 0x0b:   800x600    75.000000 Hz   4:3     46.875 kHz     49.500000 MHz
    Apple   :   832x624    74.551266 Hz   4:3     49.726 kHz     57.284000 MHz
    DMT 0x10:  1024x768    60.003840 Hz   4:3     48.363 kHz     65.000000 MHz
    DMT 0x11:  1024x768    70.069359 Hz   4:3     56.476 kHz     75.000000 MHz
    DMT 0x12:  1024x768    75.028582 Hz   4:3     60.023 kHz     78.750000 MHz
  Standard Timings:
    GTF     :  1024x768    72.000073 Hz   4:3     57.672 kHz     78.434000 MHz
    DMT 0x55:  1280x720    60.000000 Hz  16:9     45.000 kHz     74.250000 MHz
  Detailed Timing Descriptors:
    DTD 1:  1024x768    60.003840 Hz   4:3     48.363 kHz     65.000000 MHz (307 mm x 230 mm)
                 Hfront   24 Hsync 136 Hback  160 Hpol N
                 Vfront    3 Vsync   6 Vback   29 Vpol N
    Display Range Limits:
      Monitor ranges (GTF): 56-76 Hz V, 31-61 kHz H, max dotclock 80 MHz
    Display Product Name: 'MD9615AF     '
    Display Product Serial Number: ...
Checksum: 0x4f

----------------

Warnings:

Block 0, Base EDID:
  Display Product Serial Number: ...
EDID:
  No Native Video Resolution was defined.

Failures:

Block 0, Base EDID:
  Basic Display Parameters & Features: EDID 1.3 requires that the first detailed timing is the preferred timing.
  Display Product Name: No newline, but one or more trailing spaces.
EDID:
  Extension Block 1 started with EDID header, ignoring Extension Blocks >= 1.

EDID conformity: FAIL
