edid-decode (hex):

00 ff ff ff ff ff ff 00 05 e3 03 27 b5 69 0f 00
2c 22 01 03 80 3c 22 78 2e bf 15 b0 4e 36 be 26
0b 50 54 b3 0c 00 d1 c0 81 80 31 40 45 40 61 40
01 01 01 01 01 01 50 d0 00 a0 f0 70 3e 80 30 58
8a 00 55 50 21 00 00 1a 00 00 00 ff 00 31 33 32
32 31 33 31 32 33 31 32 33 33 00 00 00 fc 00 4b
32 37 55 33 44 0a 20 20 20 20 20 20 00 00 00 fd
00 30 46 1e d2 71 00 0a 20 20 20 20 20 20 01 29

02 03 4b f1 e2 78 02 4d 01 03 05 14 04 13 1f 12
02 11 10 60 61 23 09 07 07 83 01 00 00 67 03 0c
00 10 00 38 44 6d d8 5d c4 01 78 80 63 02 30 00
00 00 00 68 1a 00 00 01 01 30 46 e6 e3 05 e3 01
e3 0f 00 18 e6 06 07 01 76 76 00 6a 5e 00 a0 a0
a0 29 50 30 20 35 00 55 50 21 00 00 1e 00 00 00
00 00 00 00 00 00 00 00 00 00 00 00 00 00 00 00
00 00 00 00 00 00 00 00 00 00 00 00 00 00 00 f9

70 12 79 03 00 03 01 28 1a 77 01 84 ff 13 3f 01
5f 80 3f 00 3f 0b 3d 00 02 00 09 00 9f b5 01 04
ff 13 3f 01 5f 80 3f 00 3f 0b 3d 00 02 00 09 00
00 00 00 00 00 00 00 00 00 00 00 00 00 00 00 00
00 00 00 00 00 00 00 00 00 00 00 00 00 00 00 00
00 00 00 00 00 00 00 00 00 00 00 00 00 00 00 00
00 00 00 00 00 00 00 00 00 00 00 00 00 00 00 00
00 00 00 00 00 00 00 00 00 00 00 00 00 00 d3 90

00 ff ff ff ff ff ff 00 05 e3 03 27 b5 69 0f 00
2c 22 01 03 80 3c 22 78 2e bf 15 b0 4e 36 be 26
0b 50 54 b3 0c 00 d1 c0 81 80 31 40 45 40 61 40
01 01 01 01 01 01 50 d0 00 a0 f0 70 3e 80 30 58
8a 00 55 50 21 00 00 1a 00 00 00 ff 00 31 33 32
32 31 33 31 32 33 31 32 33 33 00 00 00 fc 00 4b
32 37 55 33 44 0a 20 20 20 20 20 20 00 00 00 fd
00 30 46 1e d2 71 00 0a 20 20 20 20 20 20 01 29

02 03 4b f1 e2 78 02 4d 01 03 05 14 04 13 1f 12
02 11 10 60 61 23 09 07 07 83 01 00 00 67 03 0c
00 10 00 38 44 6d d8 5d c4 01 78 80 63 02 30 00
00 00 00 68 1a 00 00 01 01 30 46 e6 e3 05 e3 01
e3 0f 00 18 e6 06 07 01 76 76 00 6a 5e 00 a0 a0
a0 29 50 30 20 35 00 55 50 21 00 00 1e 00 00 00
00 00 00 00 00 00 00 00 00 00 00 00 00 00 00 00
00 00 00 00 00 00 00 00 00 00 00 00 00 00 00 f9

70 12 79 03 00 03 01 28 1a 77 01 84 ff 13 3f 01
5f 80 3f 00 3f 0b 3d 00 02 00 09 00 9f b5 01 04
ff 13 3f 01 5f 80 3f 00 3f 0b 3d 00 02 00 09 00
00 00 00 00 00 00 00 00 00 00 00 00 00 00 00 00
00 00 00 00 00 00 00 00 00 00 00 00 00 00 00 00
00 00 00 00 00 00 00 00 00 00 00 00 00 00 00 00
00 00 00 00 00 00 00 00 00 00 00 00 00 00 00 00
00 00 00 00 00 00 00 00 00 00 00 00 00 00 d3 90

----------------

Block 0, Base EDID:
  EDID Structure Version & Revision: 1.3
  Vendor & Product Identification:
    Manufacturer: AOC
    Model: 9987
    Serial Number: ...
    Made in: week 44 of 2024
  Basic Display Parameters & Features:
    Digital display
    Maximum image size: 60 cm x 34 cm
    Gamma: 2.20
    DPMS levels: Off
    RGB color display
    Default (sRGB) color space is primary color space
    First detailed timing is the preferred timing
  Color Characteristics:
    Red  : 0.6894, 0.3076
    Green: 0.2138, 0.7451
    Blue : 0.1484, 0.0439
    White: 0.3134, 0.3291
  Established Timings I & II:
    IBM     :   720x400    70.081663 Hz   9:5     31.467 kHz     28.320000 MHz
    DMT 0x04:   640x480    59.940476 Hz   4:3     31.469 kHz     25.175000 MHz
    Apple   :   640x480    66.666667 Hz   4:3     35.000 kHz     30.240000 MHz
    DMT 0x08:   800x600    56.250000 Hz   4:3     35.156 kHz     36.000000 MHz
    DMT 0x09:   800x600    60.316541 Hz   4:3     37.879 kHz     40.000000 MHz
    DMT 0x10:  1024x768    60.003840 Hz   4:3     48.363 kHz     65.000000 MHz
    DMT 0x11:  1024x768    70.069359 Hz   4:3     56.476 kHz     75.000000 MHz
  Standard Timings:
    DMT 0x52:  1920x1080   60.000000 Hz  16:9     67.500 kHz    148.500000 MHz
    DMT 0x23:  1280x1024   60.019740 Hz   5:4     63.981 kHz    108.000000 MHz
    DMT 0x04:   640x480    59.940476 Hz   4:3     31.469 kHz     25.175000 MHz
    DMT 0x09:   800x600    60.316541 Hz   4:3     37.879 kHz     40.000000 MHz
    DMT 0x10:  1024x768    60.003840 Hz   4:3     48.363 kHz     65.000000 MHz
  Detailed Timing Descriptors:
    DTD 1:  3840x2160   60.000000 Hz  16:9    133.320 kHz    533.280000 MHz (597 mm x 336 mm)
                 Hfront   48 Hsync  88 Hback   24 Hpol P
                 Vfront    8 Vsync  10 Vback   44 Vpol N
    Display Product Serial Number: ...
    Display Product Name: 'K27U3D'
    Display Range Limits:
      Monitor ranges (GTF): 48-70 Hz V, 30-210 kHz H, max dotclock 1130 MHz
  Extension blocks: 1
Checksum: 0x29

----------------

Block 1, CTA-861 Extension Block:
  Revision: 3
  Underscans IT Video Formats by default
  Basic audio support
  Supports YCbCr 4:4:4
  Supports YCbCr 4:2:2
  Native DTDs: 1
  HDMI Forum EDID Extension Override Data Block:
    EDID Extension Block Count: 2
  Video Data Block:
    VIC   1:   640x480    59.940476 Hz   4:3     31.469 kHz     25.175000 MHz
    VIC   3:   720x480    59.940060 Hz  16:9     31.469 kHz     27.000000 MHz
    VIC   5:  1920x1080i  60.000000 Hz  16:9     33.750 kHz     74.250000 MHz
    VIC  20:  1920x1080i  50.000000 Hz  16:9     28.125 kHz     74.250000 MHz
    VIC   4:  1280x720    60.000000 Hz  16:9     45.000 kHz     74.250000 MHz
    VIC  19:  1280x720    50.000000 Hz  16:9     37.500 kHz     74.250000 MHz
    VIC  31:  1920x1080   50.000000 Hz  16:9     56.250 kHz    148.500000 MHz
    VIC  18:   720x576    50.000000 Hz  16:9     31.250 kHz     27.000000 MHz
    VIC   2:   720x480    59.940060 Hz   4:3     31.469 kHz     27.000000 MHz
    VIC  17:   720x576    50.000000 Hz   4:3     31.250 kHz     27.000000 MHz
    VIC  16:  1920x1080   60.000000 Hz  16:9     67.500 kHz    148.500000 MHz
    VIC  96:  3840x2160   50.000000 Hz  16:9    112.500 kHz    594.000000 MHz
    VIC  97:  3840x2160   60.000000 Hz  16:9    135.000 kHz    594.000000 MHz
  Audio Data Block:
    Linear PCM:
      Max channels: 2
      Supported sample rates (kHz): 48 44.1 32
      Supported sample sizes (bits): 24 20 16
  Speaker Allocation Data Block:
    FL/FR - Front Left/Right
  Vendor-Specific Data Block (HDMI), OUI 00-0C-03:
    Source physical address: 1.0.0.0
    DC_36bit
    DC_30bit
    DC_Y444
    Maximum TMDS clock: 340 MHz
  Vendor-Specific Data Block (HDMI Forum), OUI C4-5D-D8:
    Version: 1
    Maximum TMDS Character Rate: 600 MHz
    SCDC Present
    Max Fixed Rate Link: 3 and 6 Gbps per lane on 3 lanes, 6, 8, 10 and 12 Gbps on 4 lanes
    Supports 12-bits/component Deep Color 4:2:0 Pixel Encoding
    Supports 10-bits/component Deep Color 4:2:0 Pixel Encoding
    Supports Auto Low-Latency Mode
    VRRmin: 48 Hz
    VRRmax: 0 Hz
  Vendor-Specific Data Block (AMD), OUI 00-00-1A:
    Version: 1
    Feature Caps: 0x01
    Minimum Refresh Rate: 48 Hz
    Maximum Refresh Rate: 70 Hz
    Flags 1.x: 0xe6 (MCCS)
  Colorimetry Data Block:
    xvYCC601
    xvYCC709
    BT2020cYCC
    BT2020YCC
    BT2020RGB
    Gamut Boundary Description Metadata Profile P0
  YCbCr 4:2:0 Capability Map Data Block:
    VIC  96:  3840x2160   50.000000 Hz  16:9    112.500 kHz    594.000000 MHz
    VIC  97:  3840x2160   60.000000 Hz  16:9    135.000 kHz    594.000000 MHz
  HDR Static Metadata Data Block:
    Electro optical transfer functions:
      Traditional gamma - SDR luminance range
      Traditional gamma - HDR luminance range
      SMPTE ST2084
    Supported static metadata descriptors:
      Static metadata type 1
    Desired content max luminance: 118 (644.196 cd/m^2)
    Desired content max frame-average luminance: 118 (644.196 cd/m^2)
    Desired content min luminance: 0 (0.000 cd/m^2)
  Detailed Timing Descriptors:
    DTD 2:  2560x1440   60.000199 Hz  16:9     88.860 kHz    241.700000 MHz (597 mm x 336 mm)
                 Hfront   48 Hsync  32 Hback   80 Hpol P
                 Vfront    3 Vsync   5 Vback   33 Vpol P
Checksum: 0xf9  Unused space in Extension Block: 34 bytes

----------------

Block 2, DisplayID Extension Block:
  Version: 1.2
  Extension Count: 0
  Display Product Type: Standalone display device
  Video Timing Modes Type 1 - Detailed Timings Data Block:
    DTD:  5120x2880   60.000075 Hz  16:9    176.520 kHz    960.270000 MHz (aspect 16:9, no 3D stereo, preferred)
               Hfront   96 Hsync  64 Hback  160 Hpol P
               Vfront    3 Vsync  10 Vback   49 Vpol N
    DTD:  5120x2880   70.000400 Hz  16:9    205.941 kHz   1120.320000 MHz (aspect 16:9, no 3D stereo)
               Hfront   96 Hsync  64 Hback  160 Hpol P
               Vfront    3 Vsync  10 Vback   49 Vpol N
  Checksum: 0xd3
Checksum: 0x90

----------------

Warnings:

Block 0, Base EDID:
  Vendor & Product Identification: The serial number is one of the known dummy values, it should probably be set to 0.
Block 1, CTA-861 Extension Block:
  Video Data Block: VIC 1 and the first DTD are not identical. Is this intended?
  Display Product Serial Number is set, so the Serial Number in the Base EDID should be 0.
EDID:
  Base EDID: Some timings are out of range of the Monitor Ranges:
    Horizontal Freq: 28.125 - 205.941 kHz (Monitor: 30.000 - 210.000 kHz)

Failures:

Block 0, Base EDID:
  Basic Display Parameters & Features: sRGB is signaled, but the chromaticities do not match.
Block 1, CTA-861 Extension Block:
  Missing VCDB, needed for Set Selectable RGB Quantization to avoid interop issues.
EDID:
  Extension Block 3 started with EDID header, ignoring Extension Blocks >= 3.
  DisplayID: Missing DisplayID Display Parameters Data Block.

EDID conformity: FAIL
