edid-decode (hex):

00 ff ff ff ff ff ff 00 09 e5 68 0c 00 00 00 00
11 21 01 04 a5 22 16 78 03 fd 25 94 5d 58 94 2a
21 50 54 00 00 00 01 01 01 01 01 01 01 01 01 01
01 01 01 01 01 01 af 41 80 54 71 b0 28 40 30 20
36 00 59 d7 10 00 00 1a ca 2b 80 54 71 b0 28 40
30 20 36 00 59 d7 10 00 00 1a 00 00 00 00 00 00
00 00 00 00 00 00 00 00 00 00 00 00 00 00 00 02
00 0d 36 ff 0a 3c 96 10 15 33 96 00 00 00 01 a9

70 20 79 02 00 25 01 09 cf 90 02 cf 90 02 28 3c
80 81 00 10 6f 1a 00 00 03 01 28 3c 00 00 53 51
53 51 3c 00 00 00 00 00 00 00 00 00 00 00 00 00
00 00 00 00 00 00 00 00 00 00 00 00 00 00 00 00
00 00 00 00 00 00 00 00 00 00 00 00 00 00 00 00
00 00 00 00 00 00 00 00 00 00 00 00 00 00 00 00
00 00 00 00 00 00 00 00 00 00 00 00 00 00 00 00
00 00 00 00 00 00 00 00 00 00 00 00 00 00 8a 90

00 ff ff ff ff ff ff 00 09 e5 68 0c 00 00 00 00
11 21 01 04 a5 22 16 78 03 fd 25 94 5d 58 94 2a
21 50 54 00 00 00 01 01 01 01 01 01 01 01 01 01
01 01 01 01 01 01 af 41 80 54 71 b0 28 40 30 20
36 00 59 d7 10 00 00 1a ca 2b 80 54 71 b0 28 40
30 20 36 00 59 d7 10 00 00 1a 00 00 00 00 00 00
00 00 00 00 00 00 00 00 00 00 00 00 00 00 00 02
00 0d 36 ff 0a 3c 96 10 15 33 96 00 00 00 01 a9

70 20 79 02 00 25 01 09 cf 90 02 cf 90 02 28 3c
80 81 00 10 6f 1a 00 00 03 01 28 3c 00 00 53 51
53 51 3c 00 00 00 00 00 00 00 00 00 00 00 00 00
00 00 00 00 00 00 00 00 00 00 00 00 00 00 00 00
00 00 00 00 00 00 00 00 00 00 00 00 00 00 00 00
00 00 00 00 00 00 00 00 00 00 00 00 00 00 00 00
00 00 00 00 00 00 00 00 00 00 00 00 00 00 00 00
00 00 00 00 00 00 00 00 00 00 00 00 00 00 8a 90

----------------

Block 0, Base EDID:
  EDID Structure Version & Revision: 1.4
  Vendor & Product Identification:
    Manufacturer: BOE
    Model: 3176
    Made in: week 17 of 2023
  Basic Display Parameters & Features:
    Digital display
    Bits per primary color channel: 8
    DisplayPort interface
    Maximum image size: 34 cm x 22 cm
    Gamma: 2.20
    Supported color formats: RGB 4:4:4
    First detailed timing includes the native pixel format and preferred refresh rate
    Display supports continuous frequencies
  Color Characteristics:
    Red  : 0.5810, 0.3662
    Green: 0.3466, 0.5791
    Blue : 0.1640, 0.1308
    White: 0.3134, 0.3291
  Established Timings I & II: none
  Standard Timings: none
  Detailed Timing Descriptors:
    DTD 1:  1920x1200   60.002141 Hz  16:10    74.403 kHz    168.150000 MHz (345 mm x 215 mm)
                 Hfront   48 Hsync  32 Hback  260 Hpol P
                 Vfront    3 Vsync   6 Vback   31 Vpol N
    DTD 2:  1920x1200   40.001427 Hz  16:10    49.602 kHz    112.100000 MHz (345 mm x 215 mm)
                 Hfront   48 Hsync  32 Hback  260 Hpol P
                 Vfront    3 Vsync   6 Vback   31 Vpol N
    Empty Descriptor
    Manufacturer-Specified Display Descriptor (0x02): 00 02 00 0d 36 ff 0a 3c 96 10 15 33 96 00 00 00 '....6..<...3....'
  Extension blocks: 1
Checksum: 0xa9

----------------

Block 1, DisplayID Extension Block:
  Version: 2.0
  Extension Count: 0
  Display Product Primary Use Case: None of the listed primary use cases; generic display
  Dynamic Video Timing Range Limits Data Block:
    Minimum Pixel Clock: 168144 kHz
    Maximum Pixel Clock: 168144 kHz
    Minimum Vertical Refresh Rate: 40 Hz
    Maximum Vertical Refresh Rate: 60 Hz
    Seamless Dynamic Video Timing Support: Yes
  CTA-861 DisplayID Data Block:
  Vendor-Specific Data Block (AMD), OUI 00-00-1A:
    Version: 3
    Feature Caps: 0x01
    Minimum Refresh Rate: 40 Hz
    Maximum Refresh Rate: 60 Hz
    Flags 1.x: 0x00
    Flags 2.x: 0x00
  Checksum: 0x8a
Checksum: 0x90

----------------

Block 2, Unknown EDID Extension Block 0x00:
  00 ff ff ff ff ff ff 00 09 e5 68 0c 00 00 00 00 '..........h.....'
  11 21 01 04 a5 22 16 78 03 fd 25 94 5d 58 94 2a '.!...".x..%.]X.*'
  21 50 54 00 00 00 01 01 01 01 01 01 01 01 01 01 '!PT.............'
  01 01 01 01 01 01 af 41 80 54 71 b0 28 40 30 20 '.......A.Tq.(@0 '
  36 00 59 d7 10 00 00 1a ca 2b 80 54 71 b0 28 40 '6.Y......+.Tq.(@'
  30 20 36 00 59 d7 10 00 00 1a 00 00 00 00 00 00 '0 6.Y...........'
  00 00 00 00 00 00 00 00 00 00 00 00 00 00 00 02 '................'
  00 0d 36 ff 0a 3c 96 10 15 33 96 00 00 00 01 a9 '..6..<...3......'
Checksum: 0xa9

----------------

Block 3, DisplayID Extension Block:
  Version: 2.0
  Extension Count: 0
  Dynamic Video Timing Range Limits Data Block:
    Minimum Pixel Clock: 168144 kHz
    Maximum Pixel Clock: 168144 kHz
    Minimum Vertical Refresh Rate: 40 Hz
    Maximum Vertical Refresh Rate: 60 Hz
    Seamless Dynamic Video Timing Support: Yes
  CTA-861 DisplayID Data Block:
  Vendor-Specific Data Block (AMD), OUI 00-00-1A:
    Version: 3
    Feature Caps: 0x01
    Minimum Refresh Rate: 40 Hz
    Maximum Refresh Rate: 60 Hz
    Flags 1.x: 0x00
    Flags 2.x: 0x00
  Checksum: 0x8a
Checksum: 0x90

----------------

Warnings:

Block 0, Base EDID:
  Missing Display Product Name.

Failures:

Block 0, Base EDID:
  Empty Descriptor: Use Dummy Descriptor instead of all zeroes.
  Missing Display Range Limits Descriptor.
Block 1, DisplayID Extension Block:
  Expected 0 DisplayID Extension Block, but got 1.
Block 2, Base EDID:
  Unknown Extension Block.
Block 3, DisplayID Extension Block:
  Product Type should be 0 in extension block.
EDID:
  Base EDID: EDID specified 1 extension block(s), but found 3 extension block(s).
  DisplayID: Missing DisplayID Display Parameters Data Block.
  DisplayID: Missing DisplayID Type VII Detailed Timing Data Block.
  DisplayID: DisplayID expects at least one preferred timing.

EDID conformity: FAIL
