edid-decode (hex):

00 ff ff ff ff ff ff 00 10 ac f3 d0 56 46 34 30
29 1d 01 03 80 46 28 78 ea 2d e5 ad 50 45 a8 26
11 50 54 a5 4b 00 81 00 b3 00 d1 00 71 4f a9 40
81 80 d1 c0 01 01 56 5e 00 a0 a0 a0 29 50 30 20
35 00 b9 88 21 00 00 1a 00 00 00 ff 00 34 30 57
4e 34 57 32 0a 20 20 20 20 20 00 00 00 fc 00 44
45 4c 4c 20 53 33 32 32 30 44 47 46 00 00 00 fd
00 30 90 1e e6 3c 00 0a 20 20 20 20 20 20 01 77

02 03 36 f1 50 90 05 04 03 02 07 16 01 06 11 12
15 13 14 1f 5a 23 09 07 07 83 01 00 00 67 03 0c
00 20 00 38 3c 67 d8 5d c4 01 78 88 01 68 1a 00
00 01 01 30 90 e6 40 e7 00 6a a0 a0 67 50 08 20
98 04 b9 88 21 00 00 1a 02 3a 80 18 71 38 2d 40
58 2c 45 00 b9 88 21 00 00 1e 01 1d 00 72 51 d0
1e 20 6e 28 55 00 b9 88 21 00 00 1e 8c 0a d0 8a
20 e0 2d 10 10 3e 96 00 b9 88 21 00 00 18 00 b6

00 ff ff ff ff ff ff 00 10 ac f3 d0 56 46 34 30
29 1d 01 03 80 46 28 78 ea 2d e5 ad 50 45 a8 26
11 50 54 a5 4b 00 81 00 b3 00 d1 00 71 4f a9 40
81 80 d1 c0 01 01 56 5e 00 a0 a0 a0 29 50 30 20
35 00 b9 88 21 00 00 1a 00 00 00 ff 00 34 30 57
4e 34 57 32 0a 20 20 20 20 20 00 00 00 fc 00 44
45 4c 4c 20 53 33 32 32 30 44 47 46 00 00 00 fd
00 30 90 1e e6 3c 00 0a 20 20 20 20 20 20 01 77

02 03 36 f1 50 90 05 04 03 02 07 16 01 06 11 12
15 13 14 1f 5a 23 09 07 07 83 01 00 00 67 03 0c
00 20 00 38 3c 67 d8 5d c4 01 78 88 01 68 1a 00
00 01 01 30 90 e6 40 e7 00 6a a0 a0 67 50 08 20
98 04 b9 88 21 00 00 1a 02 3a 80 18 71 38 2d 40
58 2c 45 00 b9 88 21 00 00 1e 01 1d 00 72 51 d0
1e 20 6e 28 55 00 b9 88 21 00 00 1e 8c 0a d0 8a
20 e0 2d 10 10 3e 96 00 b9 88 21 00 00 18 00 b6

----------------

Block 0, Base EDID:
  EDID Structure Version & Revision: 1.3
  Vendor & Product Identification:
    Manufacturer: DEL
    Model: 53491
    Serial Number: ...
    Made in: week 41 of 2019
  Basic Display Parameters & Features:
    Digital display
    Maximum image size: 70 cm x 40 cm
    Gamma: 2.20
    DPMS levels: Standby Suspend Off
    RGB color display
    First detailed timing is the preferred timing
  Color Characteristics:
    Red  : 0.6757, 0.3144
    Green: 0.2724, 0.6572
    Blue : 0.1513, 0.0683
    White: 0.3134, 0.3291
  Established Timings I & II:
    IBM     :   720x400    70.081663 Hz   9:5     31.467 kHz     28.320000 MHz
    DMT 0x04:   640x480    59.940476 Hz   4:3     31.469 kHz     25.175000 MHz
    DMT 0x06:   640x480    75.000000 Hz   4:3     37.500 kHz     31.500000 MHz
    DMT 0x09:   800x600    60.316541 Hz   4:3     37.879 kHz     40.000000 MHz
    DMT 0x0b:   800x600    75.000000 Hz   4:3     46.875 kHz     49.500000 MHz
    DMT 0x10:  1024x768    60.003840 Hz   4:3     48.363 kHz     65.000000 MHz
    DMT 0x12:  1024x768    75.028582 Hz   4:3     60.023 kHz     78.750000 MHz
    DMT 0x24:  1280x1024   75.024675 Hz   5:4     79.976 kHz    135.000000 MHz
  Standard Timings:
    DMT 0x1c:  1280x800    59.810326 Hz  16:10    49.702 kHz     83.500000 MHz
    DMT 0x3a:  1680x1050   59.954250 Hz  16:10    65.290 kHz    146.250000 MHz
    DMT 0x45:  1920x1200   59.884600 Hz  16:10    74.556 kHz    193.250000 MHz
    DMT 0x15:  1152x864    75.000000 Hz   4:3     67.500 kHz    108.000000 MHz
    DMT 0x33:  1600x1200   60.000000 Hz   4:3     75.000 kHz    162.000000 MHz
    DMT 0x23:  1280x1024   60.019740 Hz   5:4     63.981 kHz    108.000000 MHz
    DMT 0x52:  1920x1080   60.000000 Hz  16:9     67.500 kHz    148.500000 MHz
  Detailed Timing Descriptors:
    DTD 1:  2560x1440   59.950550 Hz  16:9     88.787 kHz    241.500000 MHz (697 mm x 392 mm)
                 Hfront   48 Hsync  32 Hback   80 Hpol P
                 Vfront    3 Vsync   5 Vback   33 Vpol N
    Display Product Serial Number: ...
    Display Product Name: 'DELL S3220DGF'
    Display Range Limits:
      Monitor ranges (GTF): 48-144 Hz V, 30-230 kHz H, max dotclock 600 MHz
  Extension blocks: 1
Checksum: 0x77

----------------

Block 1, CTA-861 Extension Block:
  Revision: 3
  Underscans IT Video Formats by default
  Basic audio support
  Supports YCbCr 4:4:4
  Supports YCbCr 4:2:2
  Native DTDs: 1
  Video Data Block:
    VIC  16:  1920x1080   60.000000 Hz  16:9     67.500 kHz    148.500000 MHz (native)
    VIC   5:  1920x1080i  60.000000 Hz  16:9     33.750 kHz     74.250000 MHz
    VIC   4:  1280x720    60.000000 Hz  16:9     45.000 kHz     74.250000 MHz
    VIC   3:   720x480    59.940060 Hz  16:9     31.469 kHz     27.000000 MHz
    VIC   2:   720x480    59.940060 Hz   4:3     31.469 kHz     27.000000 MHz
    VIC   7:  1440x480i   59.940060 Hz  16:9     15.734 kHz     27.000000 MHz
    VIC  22:  1440x576i   50.000000 Hz  16:9     15.625 kHz     27.000000 MHz
    VIC   1:   640x480    59.940476 Hz   4:3     31.469 kHz     25.175000 MHz
    VIC   6:  1440x480i   59.940060 Hz   4:3     15.734 kHz     27.000000 MHz
    VIC  17:   720x576    50.000000 Hz   4:3     31.250 kHz     27.000000 MHz
    VIC  18:   720x576    50.000000 Hz  16:9     31.250 kHz     27.000000 MHz
    VIC  21:  1440x576i   50.000000 Hz   4:3     15.625 kHz     27.000000 MHz
    VIC  19:  1280x720    50.000000 Hz  16:9     37.500 kHz     74.250000 MHz
    VIC  20:  1920x1080i  50.000000 Hz  16:9     28.125 kHz     74.250000 MHz
    VIC  31:  1920x1080   50.000000 Hz  16:9     56.250 kHz    148.500000 MHz
    VIC  90:  2560x1080   60.000000 Hz  64:27    66.000 kHz    198.000000 MHz
  Audio Data Block:
    Linear PCM:
      Max channels: 2
      Supported sample rates (kHz): 48 44.1 32
      Supported sample sizes (bits): 24 20 16
  Speaker Allocation Data Block:
    FL/FR - Front Left/Right
  Vendor-Specific Data Block (HDMI), OUI 00-0C-03:
    Source physical address: 2.0.0.0
    DC_36bit
    DC_30bit
    DC_Y444
    Maximum TMDS clock: 300 MHz
  Vendor-Specific Data Block (HDMI Forum), OUI C4-5D-D8:
    Version: 1
    Maximum TMDS Character Rate: 600 MHz
    SCDC Present
    Supports scrambling for <= 340 Mcsc
    Supports 10-bits/component Deep Color 4:2:0 Pixel Encoding
  Vendor-Specific Data Block (AMD), OUI 00-00-1A:
    Version: 1
    Feature Caps: 0x01
    Minimum Refresh Rate: 48 Hz
    Maximum Refresh Rate: 144 Hz
    Flags 1.x: 0xe6 (MCCS)
  Detailed Timing Descriptors:
    DTD 2:  2560x1440  143.911545 Hz  16:9    222.056 kHz    592.000000 MHz (697 mm x 392 mm)
                 Hfront    8 Hsync  32 Hback   66 Hpol P
                 Vfront   25 Vsync   8 Vback   70 Vpol N
    DTD 3:  1920x1080   60.000000 Hz  16:9     67.500 kHz    148.500000 MHz (697 mm x 392 mm)
                 Hfront   88 Hsync  44 Hback  148 Hpol P
                 Vfront    4 Vsync   5 Vback   36 Vpol P
    DTD 4:  1280x720    60.000000 Hz  16:9     45.000 kHz     74.250000 MHz (697 mm x 392 mm)
                 Hfront  110 Hsync  40 Hback  220 Hpol P
                 Vfront    5 Vsync   5 Vback   20 Vpol P
    DTD 5:   720x480    59.940060 Hz   3:2     31.469 kHz     27.000000 MHz (697 mm x 392 mm)
                 Hfront   16 Hsync  62 Hback   60 Hpol N
                 Vfront    9 Vsync   6 Vback   30 Vpol N
Checksum: 0xb6  Unused space in Extension Block: 1 byte

----------------

Warnings:

Block 1, CTA-861 Extension Block:
  Video Data Block: VIC 16 and the first DTD are not identical. Is this intended?
  Detailed Timing Descriptor #5: Image size is 697x392 mm, but based on the picture AR it should be 588x392 mm.
  Display Product Serial Number is set, so the Serial Number in the Base EDID should be 0.
  Add a Colorimetry Data Block with the sRGB colorimetry bit set to avoid interop issues.
EDID:
  Base EDID: Some timings are out of range of the Monitor Ranges:
    Horizontal Freq: 15.625 - 222.055 kHz (Monitor: 30.000 - 230.000 kHz)

Failures:

Block 1, CTA-861 Extension Block:
  Missing VCDB, needed for Set Selectable RGB Quantization to avoid interop issues.
EDID:
  Extension Block 2 started with EDID header, ignoring Extension Blocks >= 2.
  CTA-861: Native progressive timings are a mix of several resolutions.

EDID conformity: FAIL
