edid-decode (hex):

00 ff ff ff ff ff ff 00 11 ee 54 00 01 01 01 01
00 1b 01 03 80 a0 5a 78 0a ee 91 a3 54 4c 99 26
0f 50 54 a1 08 00 31 40 45 40 61 40 71 40 81 80
01 01 01 01 01 01 02 3a 80 18 71 38 2d 40 58 2c
45 00 a0 5a 00 00 00 1e 02 3a 80 d0 72 38 2d 40
10 2c 45 80 c4 8e 21 00 00 1e 00 00 00 fc 00 44
45 4e 4f 4e 2d 41 56 52 0a 20 20 20 00 00 00 fd
00 3a 3e 1e 53 10 00 0a 20 20 20 20 20 20 01 b7

02 03 5e f1 54 10 9f 04 13 05 14 03 02 12 20 21
22 15 01 0e 23 0f 24 1e 26 35 0f 7f 07 3d 1e c0
15 07 50 5f 7e 03 57 06 03 67 7e 03 5f 7e 01 83
5f 00 00 7f 03 0c 00 14 00 80 2d 20 c0 15 01 41
0e 3c 08 10 18 10 06 10 16 10 28 10 66 68 00 76
78 00 86 e3 05 00 00 e6 11 46 d0 00 70 00 01 1d
80 18 71 1c 16 20 58 2c 25 00 c4 8e 21 00 00 9e
00 00 00 00 00 00 00 00 00 00 00 00 00 00 00 aa

00 ff ff ff ff ff ff 00 11 ee 54 00 01 01 01 01
00 1b 01 03 80 a0 5a 78 0a ee 91 a3 54 4c 99 26
0f 50 54 a1 08 00 31 40 45 40 61 40 71 40 81 80
01 01 01 01 01 01 02 3a 80 18 71 38 2d 40 58 2c
45 00 a0 5a 00 00 00 1e 02 3a 80 d0 72 38 2d 40
10 2c 45 80 c4 8e 21 00 00 1e 00 00 00 fc 00 44
45 4e 4f 4e 2d 41 56 52 0a 20 20 20 00 00 00 fd
00 3a 3e 1e 53 10 00 0a 20 20 20 20 20 20 01 b7

02 03 5e f1 54 10 9f 04 13 05 14 03 02 12 20 21
22 15 01 0e 23 0f 24 1e 26 35 0f 7f 07 3d 1e c0
15 07 50 5f 7e 03 57 06 03 67 7e 03 5f 7e 01 83
5f 00 00 7f 03 0c 00 14 00 80 2d 20 c0 15 01 41
0e 3c 08 10 18 10 06 10 16 10 28 10 66 68 00 76
78 00 86 e3 05 00 00 e6 11 46 d0 00 70 00 01 1d
80 18 71 1c 16 20 58 2c 25 00 c4 8e 21 00 00 9e
00 00 00 00 00 00 00 00 00 00 00 00 00 00 00 aa

----------------

Block 0, Base EDID:
  EDID Structure Version & Revision: 1.3
  Vendor & Product Identification:
    Manufacturer: DON
    Model: 84
    Serial Number: ...
    Made in: 2017
  Basic Display Parameters & Features:
    Digital display
    Maximum image size: 160 cm x 90 cm
    Gamma: 2.20
    RGB color display
    First detailed timing is the preferred timing
  Color Characteristics:
    Red  : 0.6396, 0.3300
    Green: 0.2998, 0.5996
    Blue : 0.1503, 0.0595
    White: 0.3125, 0.3291
  Established Timings I & II:
    IBM     :   720x400    70.081663 Hz   9:5     31.467 kHz     28.320000 MHz
    DMT 0x04:   640x480    59.940476 Hz   4:3     31.469 kHz     25.175000 MHz
    DMT 0x09:   800x600    60.316541 Hz   4:3     37.879 kHz     40.000000 MHz
    DMT 0x10:  1024x768    60.003840 Hz   4:3     48.363 kHz     65.000000 MHz
  Standard Timings:
    DMT 0x04:   640x480    59.940476 Hz   4:3     31.469 kHz     25.175000 MHz
    DMT 0x09:   800x600    60.316541 Hz   4:3     37.879 kHz     40.000000 MHz
    DMT 0x10:  1024x768    60.003840 Hz   4:3     48.363 kHz     65.000000 MHz
    GTF     :  1152x864    60.000000 Hz   4:3     53.700 kHz     81.624000 MHz
    DMT 0x23:  1280x1024   60.019740 Hz   5:4     63.981 kHz    108.000000 MHz
  Detailed Timing Descriptors:
    DTD 1:  1920x1080   60.000000 Hz  16:9     67.500 kHz    148.500000 MHz (160 mm x 90 mm)
                 Hfront   88 Hsync  44 Hback  148 Hpol P
                 Vfront    4 Vsync   5 Vback   36 Vpol P
    DTD 2:  1920x1080   50.000000 Hz  16:9     56.250 kHz    148.500000 MHz (708 mm x 398 mm)
                 Hfront  528 Hsync  44 Hback  148 Hpol P
                 Vfront    4 Vsync   5 Vback   36 Vpol P
    Display Product Name: 'DENON-AVR'
    Display Range Limits:
      Monitor ranges (GTF): 58-62 Hz V, 30-83 kHz H, max dotclock 160 MHz
  Extension blocks: 1
Checksum: 0xb7

----------------

Block 1, CTA-861 Extension Block:
  Revision: 3
  Underscans IT Video Formats by default
  Basic audio support
  Supports YCbCr 4:4:4
  Supports YCbCr 4:2:2
  Native detailed modes: 1
  Video Data Block:
    VIC  16:  1920x1080   60.000000 Hz  16:9     67.500 kHz    148.500000 MHz
    VIC  31:  1920x1080   50.000000 Hz  16:9     56.250 kHz    148.500000 MHz (native)
    VIC   4:  1280x720    60.000000 Hz  16:9     45.000 kHz     74.250000 MHz
    VIC  19:  1280x720    50.000000 Hz  16:9     37.500 kHz     74.250000 MHz
    VIC   5:  1920x1080i  60.000000 Hz  16:9     33.750 kHz     74.250000 MHz
    VIC  20:  1920x1080i  50.000000 Hz  16:9     28.125 kHz     74.250000 MHz
    VIC   3:   720x480    59.940060 Hz  16:9     31.469 kHz     27.000000 MHz
    VIC   2:   720x480    59.940060 Hz   4:3     31.469 kHz     27.000000 MHz
    VIC  18:   720x576    50.000000 Hz  16:9     31.250 kHz     27.000000 MHz
    VIC  32:  1920x1080   24.000000 Hz  16:9     27.000 kHz     74.250000 MHz
    VIC  33:  1920x1080   25.000000 Hz  16:9     28.125 kHz     74.250000 MHz
    VIC  34:  1920x1080   30.000000 Hz  16:9     33.750 kHz     74.250000 MHz
    VIC  21:  1440x576i   50.000000 Hz   4:3     15.625 kHz     27.000000 MHz
    VIC   1:   640x480    59.940476 Hz   4:3     31.469 kHz     25.175000 MHz
    VIC  14:  1440x480    59.940060 Hz   4:3     31.469 kHz     54.000000 MHz
    VIC  35:  2880x480    59.940060 Hz   4:3     31.469 kHz    108.000000 MHz
    VIC  15:  1440x480    59.940060 Hz  16:9     31.469 kHz     54.000000 MHz
    VIC  36:  2880x480    59.940060 Hz  16:9     31.469 kHz    108.000000 MHz
    VIC  30:  1440x576    50.000000 Hz  16:9     31.250 kHz     54.000000 MHz
    VIC  38:  2880x576    50.000000 Hz  16:9     31.250 kHz    108.000000 MHz
  Audio Data Block:
    Linear PCM:
      Max channels: 8
      Supported sample rates (kHz): 192 176.4 96 88.2 48 44.1 32
      Supported sample sizes (bits): 24 20 16
    DTS:
      Max channels: 6
      Supported sample rates (kHz): 96 88.2 48 44.1
      Maximum bit rate: 1536 kb/s
    AC-3:
      Max channels: 6
      Supported sample rates (kHz): 48 44.1 32
      Maximum bit rate: 640 kb/s
    DTS-HD:
      Max channels: 8
      Supported sample rates (kHz): 192 176.4 96 88.2 48 44.1
      Supports DTS:X
      Audio Format Code dependent value: 0x03
    Enhanced AC-3 (DD+):
      Max channels: 8
      Supported sample rates (kHz): 48 44.1
      Supports Joint Object Coding
      Supports Joint Object Coding with ACMOD28
    MAT (MLP):
      Max channels: 8
      Supported sample rates (kHz): 192 176.4 96 88.2 48 44.1
      Supports Dolby TrueHD, object audio PCM and channel-based PCM
      Hash calculation not required for object audio PCM or channel-based PCM
    DTS-HD:
      Max channels: 8
      Supported sample rates (kHz): 192 176.4 96 88.2 48 44.1
      Audio Format Code dependent value: 0x01
  Speaker Allocation Data Block:
    FL/FR - Front Left/Right
    LFE1 - Low Frequency Effects 1
    FC - Front Center
    LS/RS - Left/Right Surround
    BC - Back Center
    BL/BR - Back Left/Right
  Vendor-Specific Data Block (HDMI), OUI 00-0C-03:
    Source physical address: 1.4.0.0
    Supports_AI
    Maximum TMDS clock: 225 MHz
    Extended HDMI video details:
      3D present
      3D-capable-VIC mask present
      3D: Side-by-side (half, horizontal)
      3D: Top-and-bottom
      3D: Frame-packing
      3D VIC indices that support these capabilities:
        VIC   4:  1280x720    60.000000 Hz  16:9     45.000 kHz     74.250000 MHz
        VIC  19:  1280x720    50.000000 Hz  16:9     37.500 kHz     74.250000 MHz
        VIC   5:  1920x1080i  60.000000 Hz  16:9     33.750 kHz     74.250000 MHz
        VIC  20:  1920x1080i  50.000000 Hz  16:9     28.125 kHz     74.250000 MHz
        VIC  32:  1920x1080   24.000000 Hz  16:9     27.000 kHz     74.250000 MHz
        VIC  33:  1920x1080   25.000000 Hz  16:9     28.125 kHz     74.250000 MHz
        VIC  34:  1920x1080   30.000000 Hz  16:9     33.750 kHz     74.250000 MHz
      3D VIC indices with specific capabilities:
        VIC  16:  1920x1080   60.000000 Hz  16:9     67.500 kHz    148.500000 MHz (side-by-side, horizontal)
        VIC  31:  1920x1080   50.000000 Hz  16:9     56.250 kHz    148.500000 MHz (side-by-side, horizontal)
        VIC  16:  1920x1080   60.000000 Hz  16:9     67.500 kHz    148.500000 MHz (top-and-bottom)
        VIC  31:  1920x1080   50.000000 Hz  16:9     56.250 kHz    148.500000 MHz (frame packing)
        VIC  31:  1920x1080   50.000000 Hz  16:9     56.250 kHz    148.500000 MHz (top-and-bottom)
        VIC  31:  1920x1080   50.000000 Hz  16:9     56.250 kHz    148.500000 MHz (frame packing)
        VIC   4:  1280x720    60.000000 Hz  16:9     45.000 kHz     74.250000 MHz (side-by-side, horizontal)
        VIC   3:   720x480    59.940060 Hz  16:9     31.469 kHz     27.000000 MHz (top-and-bottom)
        VIC   3:   720x480    59.940060 Hz  16:9     31.469 kHz     27.000000 MHz (side-by-side, any subsampling)
        VIC   2:   720x480    59.940060 Hz   4:3     31.469 kHz     27.000000 MHz (top-and-bottom)
        VIC   2:   720x480    59.940060 Hz   4:3     31.469 kHz     27.000000 MHz (side-by-side, any subsampling)
        VIC  18:   720x576    50.000000 Hz  16:9     31.250 kHz     27.000000 MHz (top-and-bottom)
  Colorimetry Data Block:
  Vendor-Specific Audio Data Block (Dolby), OUI 00-D0-46:
    Version: 1 (7 bytes)
    Height speaker zone present
    Surround speaker zone present
    Center speaker zone present
  Detailed Timing Descriptors:
    DTD 3:  1920x1080i  60.000000 Hz  16:9     33.750 kHz     74.250000 MHz (708 mm x 398 mm)
                 Hfront   88 Hsync  44 Hback  148 Hpol P
                 Vfront    2 Vsync   5 Vback   15 Vpol P Vfront +0.5 Odd Field
                 Vfront    2 Vsync   5 Vback   15 Vpol P Vback  +0.5 Even Field
Checksum: 0xaa  Unused space in Extension Block: 15 bytes

----------------

Block 2, Unknown EDID Extension Block 0x00:
  00 ff ff ff ff ff ff 00 11 ee 54 00 01 01 01 01 '..........T.....'
  00 1b 01 03 80 a0 5a 78 0a ee 91 a3 54 4c 99 26 '......Zx....TL.&'
  0f 50 54 a1 08 00 31 40 45 40 61 40 71 40 81 80 '.PT...1@E@a@q@..'
  01 01 01 01 01 01 02 3a 80 18 71 38 2d 40 58 2c '.......:..q8-@X,'
  45 00 a0 5a 00 00 00 1e 02 3a 80 d0 72 38 2d 40 'E..Z.....:..r8-@'
  10 2c 45 80 c4 8e 21 00 00 1e 00 00 00 fc 00 44 '.,E...!........D'
  45 4e 4f 4e 2d 41 56 52 0a 20 20 20 00 00 00 fd 'ENON-AVR.   ....'
  00 3a 3e 1e 53 10 00 0a 20 20 20 20 20 20 01 b7 '.:>.S...      ..'
Checksum: 0xb7

----------------

Block 3, CTA-861 Extension Block:
  Revision: 3
  Underscans IT Video Formats by default
  Basic audio support
  Supports YCbCr 4:4:4
  Supports YCbCr 4:2:2
  Native detailed modes: 1
  Video Data Block:
    VIC  16:  1920x1080   60.000000 Hz  16:9     67.500 kHz    148.500000 MHz
    VIC  31:  1920x1080   50.000000 Hz  16:9     56.250 kHz    148.500000 MHz (native)
    VIC   4:  1280x720    60.000000 Hz  16:9     45.000 kHz     74.250000 MHz
    VIC  19:  1280x720    50.000000 Hz  16:9     37.500 kHz     74.250000 MHz
    VIC   5:  1920x1080i  60.000000 Hz  16:9     33.750 kHz     74.250000 MHz
    VIC  20:  1920x1080i  50.000000 Hz  16:9     28.125 kHz     74.250000 MHz
    VIC   3:   720x480    59.940060 Hz  16:9     31.469 kHz     27.000000 MHz
    VIC   2:   720x480    59.940060 Hz   4:3     31.469 kHz     27.000000 MHz
    VIC  18:   720x576    50.000000 Hz  16:9     31.250 kHz     27.000000 MHz
    VIC  32:  1920x1080   24.000000 Hz  16:9     27.000 kHz     74.250000 MHz
    VIC  33:  1920x1080   25.000000 Hz  16:9     28.125 kHz     74.250000 MHz
    VIC  34:  1920x1080   30.000000 Hz  16:9     33.750 kHz     74.250000 MHz
    VIC  21:  1440x576i   50.000000 Hz   4:3     15.625 kHz     27.000000 MHz
    VIC   1:   640x480    59.940476 Hz   4:3     31.469 kHz     25.175000 MHz
    VIC  14:  1440x480    59.940060 Hz   4:3     31.469 kHz     54.000000 MHz
    VIC  35:  2880x480    59.940060 Hz   4:3     31.469 kHz    108.000000 MHz
    VIC  15:  1440x480    59.940060 Hz  16:9     31.469 kHz     54.000000 MHz
    VIC  36:  2880x480    59.940060 Hz  16:9     31.469 kHz    108.000000 MHz
    VIC  30:  1440x576    50.000000 Hz  16:9     31.250 kHz     54.000000 MHz
    VIC  38:  2880x576    50.000000 Hz  16:9     31.250 kHz    108.000000 MHz
  Audio Data Block:
    Linear PCM:
      Max channels: 8
      Supported sample rates (kHz): 192 176.4 96 88.2 48 44.1 32
      Supported sample sizes (bits): 24 20 16
    DTS:
      Max channels: 6
      Supported sample rates (kHz): 96 88.2 48 44.1
      Maximum bit rate: 1536 kb/s
    AC-3:
      Max channels: 6
      Supported sample rates (kHz): 48 44.1 32
      Maximum bit rate: 640 kb/s
    DTS-HD:
      Max channels: 8
      Supported sample rates (kHz): 192 176.4 96 88.2 48 44.1
      Supports DTS:X
      Audio Format Code dependent value: 0x03
    Enhanced AC-3 (DD+):
      Max channels: 8
      Supported sample rates (kHz): 48 44.1
      Supports Joint Object Coding
      Supports Joint Object Coding with ACMOD28
    MAT (MLP):
      Max channels: 8
      Supported sample rates (kHz): 192 176.4 96 88.2 48 44.1
      Supports Dolby TrueHD, object audio PCM and channel-based PCM
      Hash calculation not required for object audio PCM or channel-based PCM
    DTS-HD:
      Max channels: 8
      Supported sample rates (kHz): 192 176.4 96 88.2 48 44.1
      Audio Format Code dependent value: 0x01
  Speaker Allocation Data Block:
    FL/FR - Front Left/Right
    LFE1 - Low Frequency Effects 1
    FC - Front Center
    LS/RS - Left/Right Surround
    BC - Back Center
    BL/BR - Back Left/Right
  Vendor-Specific Data Block (HDMI), OUI 00-0C-03:
    Source physical address: 1.4.0.0
    Supports_AI
    Maximum TMDS clock: 225 MHz
    Extended HDMI video details:
      3D present
      3D-capable-VIC mask present
      3D: Side-by-side (half, horizontal)
      3D: Top-and-bottom
      3D: Frame-packing
      3D VIC indices that support these capabilities:
        VIC   4:  1280x720    60.000000 Hz  16:9     45.000 kHz     74.250000 MHz
        VIC  19:  1280x720    50.000000 Hz  16:9     37.500 kHz     74.250000 MHz
        VIC   5:  1920x1080i  60.000000 Hz  16:9     33.750 kHz     74.250000 MHz
        VIC  20:  1920x1080i  50.000000 Hz  16:9     28.125 kHz     74.250000 MHz
        VIC  32:  1920x1080   24.000000 Hz  16:9     27.000 kHz     74.250000 MHz
        VIC  33:  1920x1080   25.000000 Hz  16:9     28.125 kHz     74.250000 MHz
        VIC  34:  1920x1080   30.000000 Hz  16:9     33.750 kHz     74.250000 MHz
      3D VIC indices with specific capabilities:
        VIC  16:  1920x1080   60.000000 Hz  16:9     67.500 kHz    148.500000 MHz (side-by-side, horizontal)
        VIC  31:  1920x1080   50.000000 Hz  16:9     56.250 kHz    148.500000 MHz (side-by-side, horizontal)
        VIC  16:  1920x1080   60.000000 Hz  16:9     67.500 kHz    148.500000 MHz (top-and-bottom)
        VIC  31:  1920x1080   50.000000 Hz  16:9     56.250 kHz    148.500000 MHz (frame packing)
        VIC  31:  1920x1080   50.000000 Hz  16:9     56.250 kHz    148.500000 MHz (top-and-bottom)
        VIC  31:  1920x1080   50.000000 Hz  16:9     56.250 kHz    148.500000 MHz (frame packing)
        VIC   4:  1280x720    60.000000 Hz  16:9     45.000 kHz     74.250000 MHz (side-by-side, horizontal)
        VIC   3:   720x480    59.940060 Hz  16:9     31.469 kHz     27.000000 MHz (top-and-bottom)
        VIC   3:   720x480    59.940060 Hz  16:9     31.469 kHz     27.000000 MHz (side-by-side, any subsampling)
        VIC   2:   720x480    59.940060 Hz   4:3     31.469 kHz     27.000000 MHz (top-and-bottom)
        VIC   2:   720x480    59.940060 Hz   4:3     31.469 kHz     27.000000 MHz (side-by-side, any subsampling)
        VIC  18:   720x576    50.000000 Hz  16:9     31.250 kHz     27.000000 MHz (top-and-bottom)
  Colorimetry Data Block:
  Vendor-Specific Audio Data Block (Dolby), OUI 00-D0-46:
    Version: 1 (7 bytes)
    Height speaker zone present
    Surround speaker zone present
    Center speaker zone present
  Detailed Timing Descriptors:
    DTD 4:  1920x1080i  60.000000 Hz  16:9     33.750 kHz     74.250000 MHz (708 mm x 398 mm)
                 Hfront   88 Hsync  44 Hback  148 Hpol P
                 Vfront    2 Vsync   5 Vback   15 Vpol P Vfront +0.5 Odd Field
                 Vfront    2 Vsync   5 Vback   15 Vpol P Vback  +0.5 Even Field
Checksum: 0xaa  Unused space in Extension Block: 15 bytes

----------------

Warnings:

Block 0, Base EDID:
  Vendor & Product Identification: The serial number is one of the known dummy values, it should probably be set to 0.
  Detailed Timing Descriptor #1: Dubious image size (160x90 mm is smaller than 100x100 mm).
EDID:
  Base EDID: Some timings are out of range of the Monitor Ranges:
    Vertical Freq: 24.000 - 70.082 Hz (Monitor: 58.000 - 62.000 Hz)
    Horizontal Freq: 15.625 - 67.500 kHz (Monitor: 30.000 - 83.000 kHz)
  CTA-861: Multiple native progressive timings are defined.

Failures:

Block 0, Base EDID:
  Basic Display Parameters & Features: The chromaticities match sRGB, but sRGB is not signaled.
  Detailed Timing Descriptor #1: Mismatch of image size 160x90 mm vs display size 1600x900 mm.
  Detailed Timing Descriptor #2: Mismatch of image size 708x398 mm vs display size 1600x900 mm.
Block 1, CTA-861 Extension Block:
  Detailed Timing Descriptor #3: Mismatch of image size 708x398 mm vs display size 1600x900 mm.
  Missing VCDB, needed for Set Selectable RGB Quantization to avoid interop issues.
Block 2, Base EDID:
  Unknown Extension Block.
Block 3, CTA-861 Extension Block:
  Video Data Block: Duplicate VIC 16.
  Video Data Block: Duplicate VIC 31.
  Video Data Block: Duplicate VIC 4.
  Video Data Block: Duplicate VIC 19.
  Video Data Block: Duplicate VIC 5.
  Video Data Block: Duplicate VIC 20.
  Video Data Block: Duplicate VIC 3.
  Video Data Block: Duplicate VIC 2.
  Video Data Block: Duplicate VIC 18.
  Video Data Block: Duplicate VIC 32.
  Video Data Block: Duplicate VIC 33.
  Video Data Block: Duplicate VIC 34.
  Video Data Block: Duplicate VIC 21.
  Video Data Block: Duplicate VIC 1.
  Video Data Block: Duplicate VIC 14.
  Video Data Block: Duplicate VIC 35.
  Video Data Block: Duplicate VIC 15.
  Video Data Block: Duplicate VIC 36.
  Video Data Block: Duplicate VIC 30.
  Video Data Block: Duplicate VIC 38.
  Speaker Allocation Data Block: Only one instance of this Data Block is allowed.
  Colorimetry Data Block: Only one instance of this Data Block is allowed.
  Detailed Timing Descriptor #4: Mismatch of image size 708x398 mm vs display size 1600x900 mm.
EDID:
  Base EDID: EDID specified 1 extension block(s), but found 3 extension block(s).
  Base EDID: EDID 1.3 requires a Block Map Extension in Block 1 if there are more than 2 blocks in the EDID.

EDID conformity: FAIL
