edid-decode (hex):

00 ff ff ff ff ff ff 00 0e 14 24 04 00 00 00 00
1d 0f 01 02 80 1d 15 78 0a 54 34 95 55 50 8c 28
25 4f 54 00 00 00 01 01 01 01 01 01 01 01 01 01
01 01 01 01 01 01 64 19 00 40 41 00 26 30 18 88
36 00 1e d6 10 00 00 18 00 00 00 0f 00 00 00 00
00 00 00 00 00 26 a0 02 13 00 00 00 00 fe 00 44
38 39 37 32 30 31 34 31 58 44 36 0a 00 00 00 fe
00 f3 df cf c5 a0 73 53 00 01 01 0a 20 20 00 07

----------------

Block 0, Base EDID:
  EDID Structure Version & Revision: 1.2
  Vendor & Product Identification:
    Manufacturer: CPT
    Model: 1060
    Made in: week 29 of 2005
  Basic Display Parameters & Features:
    Digital display
    Maximum image size: 29 cm x 21 cm
    Gamma: 2.20
    RGB color display
    First detailed timing is the preferred timing
  Color Characteristics:
    Red  : 0.5830, 0.3330
    Green: 0.3134, 0.5468
    Blue : 0.1562, 0.1474
    White: 0.3095, 0.3281
  Established Timings I & II: none
  Standard Timings: none
  Detailed Timing Descriptors:
    DTD 1:  1024x768    60.003840 Hz   4:3     48.363 kHz     65.000000 MHz (286 mm x 214 mm)
                 Hfront   24 Hsync 136 Hback  160 Hpol N
                 Vfront    3 Vsync   6 Vback   29 Vpol N
    Manufacturer-Specified Display Descriptor (0x0f): 00 0f 00 00 00 00 00 00 00 00 00 26 a0 02 13 00 '...........&....'
    Alphanumeric Data String: 'D89720141XD6'
    Alphanumeric Data String: '.....sS'
Checksum: 0x07

----------------

Warnings:

Block 0, Base EDID:
  EDID Structure Version & Revision: EDID 1.2 is deprecated, do not use.
  Alphanumeric Data String: Non-ASCII character 0xf3 at position 0, can cause problems.
  Alphanumeric Data String: Non-ASCII character 0xdf at position 1, can cause problems.
  Alphanumeric Data String: Non-ASCII character 0xcf at position 2, can cause problems.
  Alphanumeric Data String: Non-ASCII character 0xc5 at position 3, can cause problems.
  Alphanumeric Data String: Non-ASCII character 0xa0 at position 4, can cause problems.

Failures:

Block 0, Base EDID:
  Alphanumeric Data String: NUL byte at position 7.

EDID conformity: FAIL
