edid-decode (hex):

00 ff ff ff ff ff ff 00 20 29 03 05 01 00 00 00
05 11 01 04 a5 24 1d 78 e2 4c 26 9e 5d 58 90 25
1f 53 5a 21 08 40 31 40 45 40 61 40 01 01 01 01
01 01 01 01 01 01 70 17 00 20 01 00 20 30 10 60
13 00 f4 77 11 00 00 1e 00 00 00 fd 00 3c 3c 1f
3c 06 00 0a 20 20 20 20 20 20 00 00 00 fc 00 53
47 37 20 0a 20 20 20 20 20 20 20 20 00 00 00 fc
00 0a 20 20 20 20 20 20 20 20 20 20 20 20 00 d7

----------------

Block 0, Base EDID:
  EDID Structure Version & Revision: 1.4
  Vendor & Product Identification:
    Manufacturer: HAI
    Model: 1283
    Serial Number: ...
    Made in: week 5 of 2007
  Basic Display Parameters & Features:
    Digital display
    Bits per primary color channel: 8
    DisplayPort interface
    Maximum image size: 36 cm x 29 cm
    Gamma: 2.20
    DPMS levels: Standby Suspend Off
    Supported color formats: RGB 4:4:4
    First detailed timing includes the native pixel format and preferred refresh rate
  Color Characteristics:
    Red  : 0.6181, 0.3632
    Green: 0.3466, 0.5625
    Blue : 0.1445, 0.1230
    White: 0.3251, 0.3535
  Established Timings I & II:
    DMT 0x04:   640x480    59.940476 Hz   4:3     31.469 kHz     25.175000 MHz
    DMT 0x09:   800x600    60.316541 Hz   4:3     37.879 kHz     40.000000 MHz
    DMT 0x10:  1024x768    60.003840 Hz   4:3     48.363 kHz     65.000000 MHz
  Standard Timings:
    DMT 0x04:   640x480    59.940476 Hz   4:3     31.469 kHz     25.175000 MHz
    DMT 0x09:   800x600    60.316541 Hz   4:3     37.879 kHz     40.000000 MHz
    DMT 0x10:  1024x768    60.003840 Hz   4:3     48.363 kHz     65.000000 MHz
  Detailed Timing Descriptors:
    DTD 1:     0x768   260.416667 Hz   0:1    208.333 kHz     60.000000 MHz (500 mm x 375 mm)
                 Hfront   16 Hsync  96 Hback  176 Hpol P
                 Vfront    1 Vsync   3 Vback   28 Vpol P
                   70 17 00 20 01 00 20 30 10 60 13 00 f4 77 11 00 00 1e 'p.. .. 0.`...w....'
    Display Range Limits:
      Monitor ranges (GTF): 60-60 Hz V, 31-60 kHz H, max dotclock 60 MHz
    Display Product Name: 'SG7 '
    Display Product Name: ''
Checksum: 0xd7

----------------

Warnings:

Block 0, Base EDID:
  Vendor & Product Identification: The serial number is one of the known dummy values, it should probably be set to 0.
  Display Range Limits: GTF support is deprecated in EDID 1.4.
EDID:
  No Native Video Resolution was defined.
  Base EDID: Some timings are out of range of the Monitor Ranges:
    Vertical Freq: 59.940 - 260.417 Hz (Monitor: 60.000 - 60.000 Hz)
    Horizontal Freq: 31.468 - 208.333 kHz (Monitor: 31.000 - 60.000 kHz)
    Maximum Clock: 65.000 MHz (Monitor: 60.000 MHz)

Failures:

Block 0, Base EDID:
  Detailed Timing Descriptor #1: 0 values in the video timing:
    Horizontal Active/Blanking 0/288
    Horizontal Frontporch/Sync Width 16/96
    Vertical Active/Blanking 768/32
    Vertical Frontporch/Sync Width 1/3
  Detailed Timing Descriptor #1: Mismatch of image size 500x375 mm vs display size 360x290 mm.
  Display Range Limits: GTF is supported, but the display does not support continuous frequencies.
  Display Product Name: One or more trailing spaces before newline.
  Display Product Name: Empty string.
EDID:
  Base EDID: The DTD max image size is 500x375mm, which is larger than the display size 360.0x290.0mm.

EDID conformity: FAIL
