edid-decode (hex):

00 ff ff ff ff ff ff 00 30 e4 98 06 00 00 00 00
00 1e 01 04 a5 1d 12 78 07 a8 05 a6 54 4b 9b 25
0e 50 54 00 00 00 01 01 01 01 01 01 01 01 01 01
01 01 01 01 01 01 ec 68 00 a0 a0 40 2e 60 30 20
36 00 1e b3 10 00 00 1a 00 00 00 fd 00 30 3c 63
63 1b 01 0a 20 20 20 20 20 20 00 00 00 fe 00 4c
47 20 44 69 73 70 6c 61 79 0a 20 20 00 00 00 fe
00 4c 50 31 33 33 57 51 31 2d 53 50 46 31 00 50

00 ff ff ff ff ff ff 00 30 e4 98 06 00 00 00 00
00 1e 01 04 a5 1d 12 78 07 a8 05 a6 54 4b 9b 25
0e 50 54 00 00 00 01 01 01 01 01 01 01 01 01 01
01 01 01 01 01 01 ec 68 00 a0 a0 40 2e 60 30 20
36 00 1e b3 10 00 00 1a 00 00 00 fd 00 30 3c 63
63 1b 01 0a 20 20 20 20 20 20 00 00 00 fe 00 4c
47 20 44 69 73 70 6c 61 79 0a 20 20 00 00 00 fe
00 4c 50 31 33 33 57 51 31 2d 53 50 46 31 00 50

----------------

Block 0, Base EDID:
  EDID Structure Version & Revision: 1.4
  Vendor & Product Identification:
    Manufacturer: LGD
    Model: 1688
    Made in: 2020
  Basic Display Parameters & Features:
    Digital display
    Bits per primary color channel: 8
    DisplayPort interface
    Maximum image size: 29 cm x 18 cm
    Gamma: 2.20
    Supported color formats: RGB 4:4:4
    Default (sRGB) color space is primary color space
    First detailed timing includes the native pixel format and preferred refresh rate
    Display supports continuous frequencies
  Color Characteristics:
    Red  : 0.6503, 0.3300
    Green: 0.2949, 0.6054
    Blue : 0.1445, 0.0546
    White: 0.3134, 0.3291
  Established Timings I & II: none
  Standard Timings: none
  Detailed Timing Descriptors:
    DTD 1:  2560x1600   59.993925 Hz  16:10    98.750 kHz    268.600000 MHz (286 mm x 179 mm)
                 Hfront   48 Hsync  32 Hback   80 Hpol P
                 Vfront    3 Vsync   6 Vback   37 Vpol N
    Display Range Limits:
      Monitor ranges (Range Limits Only): 48-60 Hz V, 99-99 kHz H, max dotclock 270 MHz
    Alphanumeric Data String: 'LG Display'
    Alphanumeric Data String: 'LP133WQ1-SPF1'
Checksum: 0x50

----------------

Warnings:

Block 0, Base EDID:
  Missing Display Product Name.

Failures:

Block 0, Base EDID:
  Basic Display Parameters & Features: sRGB is signaled, but the chromaticities do not match.
EDID:
  Extension Block 1 started with EDID header, ignoring Extension Blocks >= 1.

EDID conformity: FAIL
