edid-decode (hex):

00 ff ff ff ff ff ff 00 4c 2d 8f 07 57 43 32 42
2d 15 01 03 80 30 1b 78 2a 92 c1 a2 59 55 9e 27
0e 50 54 bf ef 80 71 4f 81 00 81 40 81 80 95 00
b3 00 a9 40 95 0f 02 3a 80 18 71 38 2d 40 58 2c
45 00 dd 0c 11 00 00 1e 00 00 00 fd 00 38 4b 1e
51 11 00 0a 20 20 20 20 20 20 00 00 00 fc 00 53
41 33 30 30 2f 53 41 33 35 30 0a 20 00 00 00 ff
00 48 39 58 42 42 30 38 39 31 38 0a 20 20 01 28

02 01 04 00 02 3a 80 d0 72 38 2d 40 10 2c 45 80
dd 0c 11 00 00 1e 01 1d 00 72 51 d0 1e 20 6e 28
55 00 dd 0c 11 00 00 1e 01 1d 00 bc 52 d0 1e 20
b8 28 55 40 15 1e 11 00 00 1e 8c 0a d0 90 20 40
31 20 0c 40 55 00 dd 1e 11 00 00 18 8c 0a d0 8a
20 e0 2d 10 10 3e 96 00 dd 1e 11 00 00 18 00 00
00 00 00 00 00 00 00 00 00 00 00 00 00 00 00 00
00 00 00 00 00 00 00 00 00 00 00 00 00 00 00 99

00 ff ff ff ff ff ff 00 4c 2d 8f 07 57 43 32 42
2d 15 01 03 80 30 1b 78 2a 92 c1 a2 59 55 9e 27
0e 50 54 bf ef 80 71 4f 81 00 81 40 81 80 95 00
b3 00 a9 40 95 0f 02 3a 80 18 71 38 2d 40 58 2c
45 00 dd 0c 11 00 00 1e 00 00 00 fd 00 38 4b 1e
51 11 00 0a 20 20 20 20 20 20 00 00 00 fc 00 53
41 33 30 30 2f 53 41 33 35 30 0a 20 00 00 00 ff
00 48 39 58 42 42 30 38 39 31 38 0a 20 20 01 28

02 01 04 00 02 3a 80 d0 72 38 2d 40 10 2c 45 80
dd 0c 11 00 00 1e 01 1d 00 72 51 d0 1e 20 6e 28
55 00 dd 0c 11 00 00 1e 01 1d 00 bc 52 d0 1e 20
b8 28 55 40 15 1e 11 00 00 1e 8c 0a d0 90 20 40
31 20 0c 40 55 00 dd 1e 11 00 00 18 8c 0a d0 8a
20 e0 2d 10 10 3e 96 00 dd 1e 11 00 00 18 00 00
00 00 00 00 00 00 00 00 00 00 00 00 00 00 00 00
00 00 00 00 00 00 00 00 00 00 00 00 00 00 00 99

----------------

Block 0, Base EDID:
  EDID Structure Version & Revision: 1.3
  Vendor & Product Identification:
    Manufacturer: SAM
    Model: 1935
    Serial Number: ...
    Made in: week 45 of 2011
  Basic Display Parameters & Features:
    Digital display
    Maximum image size: 48 cm x 27 cm
    Gamma: 2.20
    DPMS levels: Off
    RGB color display
    First detailed timing is the preferred timing
  Color Characteristics:
    Red  : 0.6347, 0.3486
    Green: 0.3320, 0.6191
    Blue : 0.1552, 0.0546
    White: 0.3125, 0.3291
  Established Timings I & II:
    IBM     :   720x400    70.081663 Hz   9:5     31.467 kHz     28.320000 MHz
    DMT 0x04:   640x480    59.940476 Hz   4:3     31.469 kHz     25.175000 MHz
    Apple   :   640x480    66.666667 Hz   4:3     35.000 kHz     30.240000 MHz
    DMT 0x05:   640x480    72.808802 Hz   4:3     37.861 kHz     31.500000 MHz
    DMT 0x06:   640x480    75.000000 Hz   4:3     37.500 kHz     31.500000 MHz
    DMT 0x08:   800x600    56.250000 Hz   4:3     35.156 kHz     36.000000 MHz
    DMT 0x09:   800x600    60.316541 Hz   4:3     37.879 kHz     40.000000 MHz
    DMT 0x0a:   800x600    72.187572 Hz   4:3     48.077 kHz     50.000000 MHz
    DMT 0x0b:   800x600    75.000000 Hz   4:3     46.875 kHz     49.500000 MHz
    Apple   :   832x624    74.551266 Hz   4:3     49.726 kHz     57.284000 MHz
    DMT 0x10:  1024x768    60.003840 Hz   4:3     48.363 kHz     65.000000 MHz
    DMT 0x11:  1024x768    70.069359 Hz   4:3     56.476 kHz     75.000000 MHz
    DMT 0x12:  1024x768    75.028582 Hz   4:3     60.023 kHz     78.750000 MHz
    DMT 0x24:  1280x1024   75.024675 Hz   5:4     79.976 kHz    135.000000 MHz
    Apple   :  1152x870    75.061550 Hz 192:145   68.681 kHz    100.000000 MHz
  Standard Timings:
    DMT 0x15:  1152x864    75.000000 Hz   4:3     67.500 kHz    108.000000 MHz
    DMT 0x1c:  1280x800    59.810326 Hz  16:10    49.702 kHz     83.500000 MHz
    DMT 0x20:  1280x960    60.000000 Hz   4:3     60.000 kHz    108.000000 MHz
    DMT 0x23:  1280x1024   60.019740 Hz   5:4     63.981 kHz    108.000000 MHz
    DMT 0x2f:  1440x900    59.887445 Hz  16:10    55.935 kHz    106.500000 MHz
    DMT 0x3a:  1680x1050   59.954250 Hz  16:10    65.290 kHz    146.250000 MHz
    DMT 0x33:  1600x1200   60.000000 Hz   4:3     75.000 kHz    162.000000 MHz
    DMT 0x30:  1440x900    74.984427 Hz  16:10    70.635 kHz    136.750000 MHz
  Detailed Timing Descriptors:
    DTD  1:  1920x1080   60.000000 Hz  16:9     67.500 kHz    148.500000 MHz (477 mm x 268 mm)
                  Hfront   88 Hsync  44 Hback  148 Hpol P
                  Vfront    4 Vsync   5 Vback   36 Vpol P
    Display Range Limits:
      Monitor ranges (GTF): 56-75 Hz V, 30-81 kHz H, max dotclock 170 MHz
    Display Product Name: 'SA300/SA350'
    Display Product Serial Number: ...
  Extension blocks: 1
Checksum: 0x28

----------------

Block 1, CTA-861 Extension Block:
  Revision: 1
  Detailed Timing Descriptors:
    DTD  2:  1920x1080   50.000000 Hz  16:9     56.250 kHz    148.500000 MHz (477 mm x 268 mm)
                  Hfront  528 Hsync  44 Hback  148 Hpol P
                  Vfront    4 Vsync   5 Vback   36 Vpol P
    DTD  3:  1280x720    60.000000 Hz  16:9     45.000 kHz     74.250000 MHz (477 mm x 268 mm)
                  Hfront  110 Hsync  40 Hback  220 Hpol P
                  Vfront    5 Vsync   5 Vback   20 Vpol P
    DTD  4:  1280x720    50.000000 Hz  16:9     37.500 kHz     74.250000 MHz (277 mm x 286 mm)
                  Hfront  440 Hsync  40 Hback  220 Hpol P
                  Vfront    5 Vsync   5 Vback   20 Vpol P
    DTD  5:   720x576    50.000000 Hz   5:4     31.250 kHz     27.000000 MHz (477 mm x 286 mm)
                  Hfront   12 Hsync  64 Hback   68 Hpol N
                  Vfront    5 Vsync   5 Vback   39 Vpol N
    DTD  6:   720x480    59.940060 Hz   3:2     31.469 kHz     27.000000 MHz (477 mm x 286 mm)
                  Hfront   16 Hsync  62 Hback   60 Hpol N
                  Vfront    9 Vsync   6 Vback   30 Vpol N
Checksum: 0x99  Unused space in Extension Block: 33 bytes

----------------

Block 2, Unknown EDID Extension Block 0x00:
  00 ff ff ff ff ff ff 00 4c 2d 8f 07 57 43 32 42 '........L-..WC2B'
  2d 15 01 03 80 30 1b 78 2a 92 c1 a2 59 55 9e 27 '-....0.x*...YU.''
  0e 50 54 bf ef 80 71 4f 81 00 81 40 81 80 95 00 '.PT...qO...@....'
  b3 00 a9 40 95 0f 02 3a 80 18 71 38 2d 40 58 2c '...@...:..q8-@X,'
  45 00 dd 0c 11 00 00 1e 00 00 00 fd 00 38 4b 1e 'E............8K.'
  51 11 00 0a 20 20 20 20 20 20 00 00 00 fc 00 53 'Q...      .....S'
  41 33 30 30 2f 53 41 33 35 30 0a 20 00 00 00 ff 'A300/SA350. ....'
  00 48 39 58 42 42 30 38 39 31 38 0a 20 20 01 28 '.H9XBB08918.  .('
Checksum: 0x28

----------------

Block 3, CTA-861 Extension Block:
  Revision: 1
  Detailed Timing Descriptors:
    DTD  7:  1920x1080   50.000000 Hz  16:9     56.250 kHz    148.500000 MHz (477 mm x 268 mm)
                  Hfront  528 Hsync  44 Hback  148 Hpol P
                  Vfront    4 Vsync   5 Vback   36 Vpol P
    DTD  8:  1280x720    60.000000 Hz  16:9     45.000 kHz     74.250000 MHz (477 mm x 268 mm)
                  Hfront  110 Hsync  40 Hback  220 Hpol P
                  Vfront    5 Vsync   5 Vback   20 Vpol P
    DTD  9:  1280x720    50.000000 Hz  16:9     37.500 kHz     74.250000 MHz (277 mm x 286 mm)
                  Hfront  440 Hsync  40 Hback  220 Hpol P
                  Vfront    5 Vsync   5 Vback   20 Vpol P
    DTD 10:   720x576    50.000000 Hz   5:4     31.250 kHz     27.000000 MHz (477 mm x 286 mm)
                  Hfront   12 Hsync  64 Hback   68 Hpol N
                  Vfront    5 Vsync   5 Vback   39 Vpol N
    DTD 11:   720x480    59.940060 Hz   3:2     31.469 kHz     27.000000 MHz (477 mm x 286 mm)
                  Hfront   16 Hsync  62 Hback   60 Hpol N
                  Vfront    9 Vsync   6 Vback   30 Vpol N
Checksum: 0x99  Unused space in Extension Block: 33 bytes

----------------

Warnings:

Block 0, Base EDID:
  Detailed Timing Descriptor #1: DTD is identical to VIC 16, which is not present in the CTA Ext Block.
Block 1, CTA-861 Extension Block:
  Detailed Timing Descriptor #2: DTD is identical to VIC 31, which is not present in the CTA Ext Block.
  Detailed Timing Descriptor #3: DTD is identical to VIC 4, which is not present in the CTA Ext Block.
  Detailed Timing Descriptor #4: DTD is identical to VIC 19, which is not present in the CTA Ext Block.
  Detailed Timing Descriptor #4: Image size is 277x286 mm, but based on the picture AR it should be 277x155 mm.
  Detailed Timing Descriptor #5: Image size is 477x286 mm, but based on the picture AR it should be 477x381 mm.
  Detailed Timing Descriptor #6: Image size is 477x286 mm, but based on the picture AR it should be 477x318 mm.
  Display Product Serial Number is set, so the Serial Number in the Base EDID should be 0.
  Add a Colorimetry Data Block with the sRGB colorimetry bit set to avoid interop issues.
Block 3, CTA-861 Extension Block:
  Detailed Timing Descriptor #7: DTD is identical to VIC 31, which is not present in the CTA Ext Block.
  Detailed Timing Descriptor #8: DTD is identical to VIC 4, which is not present in the CTA Ext Block.
  Detailed Timing Descriptor #9: DTD is identical to VIC 19, which is not present in the CTA Ext Block.
  Detailed Timing Descriptor #9: Image size is 277x286 mm, but based on the picture AR it should be 277x155 mm.
  Detailed Timing Descriptor #10: Image size is 477x286 mm, but based on the picture AR it should be 477x381 mm.
  Detailed Timing Descriptor #11: Image size is 477x286 mm, but based on the picture AR it should be 477x318 mm.
EDID:
  Base EDID: Some timings are out of range of the Monitor Ranges:
    Vertical Freq: 50.000 - 75.062 Hz (Monitor: 56.000 - 75.000 Hz)

Failures:

Block 1, CTA-861 Extension Block:
  Detailed Timing Descriptor #4: Mismatch of image size 277x286 mm vs display size 480x270 mm.
  Detailed Timing Descriptor #5: Mismatch of image size 477x286 mm vs display size 480x270 mm.
  Detailed Timing Descriptor #6: Mismatch of image size 477x286 mm vs display size 480x270 mm.
  Missing VCDB, needed for Set Selectable RGB Quantization to avoid interop issues.
Block 2, Base EDID:
  Unknown Extension Block.
Block 3, CTA-861 Extension Block:
  Detailed Timing Descriptor #9: Mismatch of image size 277x286 mm vs display size 480x270 mm.
  Detailed Timing Descriptor #10: Mismatch of image size 477x286 mm vs display size 480x270 mm.
  Detailed Timing Descriptor #11: Mismatch of image size 477x286 mm vs display size 480x270 mm.
EDID:
  Base EDID: The DTD max image size is 477x286mm, which is larger than the display size 480.0x270.0mm.
  Base EDID: EDID specified 1 extension block(s), but found 3 extension block(s).
  Base EDID: EDID 1.3 requires a Block Map Extension in Block 1 if there are more than 2 blocks in the EDID.

EDID conformity: FAIL
