edid-decode (hex):

00 ff ff ff ff ff ff 00 10 ac e9 41 55 39 34 34
21 1e 01 04 b5 46 27 78 3a a4 15 a9 53 4c a8 26
0b 50 54 a5 4b 00 e1 c0 d1 00 d1 c0 b3 00 a9 40
81 80 81 00 71 4f 56 5e 00 a0 a0 a0 29 50 30 20
35 00 ba 89 21 00 00 1a 00 00 00 ff 00 35 35 44
31 30 32 33 0a 20 20 20 20 20 00 00 00 fc 00 44
45 4c 4c 20 50 33 32 32 31 44 0a 20 00 00 00 fd
00 38 4c 1e 5a 1e 01 0a 20 20 20 20 20 20 01 f0

00 ff ff ff ff ff ff 00 10 ac e9 41 55 39 34 34
21 1e 01 04 b5 46 27 78 3a a4 15 a9 53 4c a8 26
0b 50 54 a5 4b 00 e1 c0 d1 00 d1 c0 b3 00 a9 40
81 80 81 00 71 4f 56 5e 00 a0 a0 a0 29 50 30 20
35 00 ba 89 21 00 00 1a 00 00 00 ff 00 35 35 44
31 30 32 33 0a 20 20 20 20 20 00 00 00 fc 00 44
45 4c 4c 20 50 33 32 32 31 44 0a 20 00 00 00 fd
00 38 4c 1e 5a 1e 01 0a 20 20 20 20 20 20 01 f0

----------------

Block 0, Base EDID:
  EDID Structure Version & Revision: 1.4
  Vendor & Product Identification:
    Manufacturer: DEL
    Model: 16873
    Serial Number: ...
    Made in: week 33 of 2020
  Basic Display Parameters & Features:
    Digital display
    Bits per primary color channel: 10
    DisplayPort interface
    Maximum image size: 70 cm x 39 cm
    Gamma: 2.20
    DPMS levels: Off
    Supported color formats: RGB 4:4:4, YCrCb 4:4:4, YCrCb 4:2:2
    First detailed timing includes the native pixel format and preferred refresh rate
  Color Characteristics:
    Red  : 0.6621, 0.3261
    Green: 0.2978, 0.6562
    Blue : 0.1484, 0.0439
    White: 0.3134, 0.3291
  Established Timings I & II:
    IBM     :   720x400    70.081663 Hz   9:5     31.467 kHz     28.320000 MHz
    DMT 0x04:   640x480    59.940476 Hz   4:3     31.469 kHz     25.175000 MHz
    DMT 0x06:   640x480    75.000000 Hz   4:3     37.500 kHz     31.500000 MHz
    DMT 0x09:   800x600    60.316541 Hz   4:3     37.879 kHz     40.000000 MHz
    DMT 0x0b:   800x600    75.000000 Hz   4:3     46.875 kHz     49.500000 MHz
    DMT 0x10:  1024x768    60.003840 Hz   4:3     48.363 kHz     65.000000 MHz
    DMT 0x12:  1024x768    75.028582 Hz   4:3     60.023 kHz     78.750000 MHz
    DMT 0x24:  1280x1024   75.024675 Hz   5:4     79.976 kHz    135.000000 MHz
  Standard Timings:
    DMT 0x54:  2048x1152   60.000000 Hz  16:9     72.000 kHz    162.000000 MHz (RB)
    DMT 0x45:  1920x1200   59.884600 Hz  16:10    74.556 kHz    193.250000 MHz
    DMT 0x52:  1920x1080   60.000000 Hz  16:9     67.500 kHz    148.500000 MHz
    DMT 0x3a:  1680x1050   59.954250 Hz  16:10    65.290 kHz    146.250000 MHz
    DMT 0x33:  1600x1200   60.000000 Hz   4:3     75.000 kHz    162.000000 MHz
    DMT 0x23:  1280x1024   60.019740 Hz   5:4     63.981 kHz    108.000000 MHz
    DMT 0x1c:  1280x800    59.810326 Hz  16:10    49.702 kHz     83.500000 MHz
    DMT 0x15:  1152x864    75.000000 Hz   4:3     67.500 kHz    108.000000 MHz
  Detailed Timing Descriptors:
    DTD 1:  2560x1440   59.950550 Hz  16:9     88.787 kHz    241.500000 MHz (698 mm x 393 mm)
                 Hfront   48 Hsync  32 Hback   80 Hpol P
                 Vfront    3 Vsync   5 Vback   33 Vpol N
    Display Product Serial Number: ...
    Display Product Name: 'DELL P3221D'
    Display Range Limits:
      Monitor ranges (Range Limits Only): 56-76 Hz V, 30-90 kHz H, max dotclock 300 MHz
  Extension blocks: 1
Checksum: 0xf0

----------------

Failures:

EDID:
  Extension Block 1 started with EDID header, ignoring Extension Blocks >= 1.
  Base EDID: EDID specified 1 extension block(s), but found 0 extension block(s).

EDID conformity: FAIL
