edid-decode (hex):

00 ff ff ff ff ff ff 00 05 e3 83 21 01 00 00 00
0b 1a 01 03 68 30 1a 78 ea 00 10 a0 57 49 9b 26
10 48 4c ad cf 00 31 4a 45 4a 61 4c 81 c0 81 80
81 8a 81 8c a9 c0 02 3a 80 18 71 38 2d 40 58 2c
45 00 09 25 21 00 00 1e 7c 2e 90 a0 60 1a 1e 40
30 20 36 00 09 25 21 00 00 18 00 00 00 fc 00 50
32 41 35 38 33 45 0a 20 20 20 20 20 00 00 00 ff
00 35 38 33 45 43 4c 36 33 30 31 38 34 39 00 a2

00 ff ff ff ff ff ff 00 05 e3 83 21 01 00 00 00
0b 1a 01 03 68 30 1a 78 ea 00 10 a0 57 49 9b 26
10 48 4c ad cf 00 31 4a 45 4a 61 4c 81 c0 81 80
81 8a 81 8c a9 c0 02 3a 80 18 71 38 2d 40 58 2c
45 00 09 25 21 00 00 1e 7c 2e 90 a0 60 1a 1e 40
30 20 36 00 09 25 21 00 00 18 00 00 00 fc 00 50
32 41 35 38 33 45 0a 20 20 20 20 20 00 00 00 ff
00 35 38 33 45 43 4c 36 33 30 31 38 34 39 00 a2

----------------

Block 0, Base EDID:
  EDID Structure Version & Revision: 1.3
  Vendor & Product Identification:
    Manufacturer: AOC
    Model: 8579
    Serial Number: ...
    Made in: week 11 of 2016
  Basic Display Parameters & Features:
    Analog display
    Signal Level Standard: 0.700 : 0.000 : 0.700 V p-p
    Blank level equals black level
    Sync: Separate
    Maximum image size: 48 cm x 26 cm
    Gamma: 2.20
    DPMS levels: Standby Suspend Off
    RGB color display
    First detailed timing is the preferred timing
  Color Characteristics:
    Red  : 0.6250, 0.3398
    Green: 0.2851, 0.6054
    Blue : 0.1484, 0.0634
    White: 0.2812, 0.2968
  Established Timings I & II:
    IBM     :   720x400    70.081663 Hz   9:5     31.467 kHz     28.320000 MHz
    DMT 0x04:   640x480    59.940476 Hz   4:3     31.469 kHz     25.175000 MHz
    DMT 0x05:   640x480    72.808802 Hz   4:3     37.861 kHz     31.500000 MHz
    DMT 0x06:   640x480    75.000000 Hz   4:3     37.500 kHz     31.500000 MHz
    DMT 0x09:   800x600    60.316541 Hz   4:3     37.879 kHz     40.000000 MHz
    DMT 0x0a:   800x600    72.187572 Hz   4:3     48.077 kHz     50.000000 MHz
    DMT 0x0b:   800x600    75.000000 Hz   4:3     46.875 kHz     49.500000 MHz
    DMT 0x10:  1024x768    60.003840 Hz   4:3     48.363 kHz     65.000000 MHz
    DMT 0x11:  1024x768    70.069359 Hz   4:3     56.476 kHz     75.000000 MHz
    DMT 0x12:  1024x768    75.028582 Hz   4:3     60.023 kHz     78.750000 MHz
    DMT 0x24:  1280x1024   75.024675 Hz   5:4     79.976 kHz    135.000000 MHz
  Standard Timings:
    GTF     :   640x480    70.000000 Hz   4:3     35.000 kHz     28.560000 MHz
    GTF     :   800x600    70.000000 Hz   4:3     43.750 kHz     45.500000 MHz
    GTF     :  1024x768    72.000073 Hz   4:3     57.672 kHz     78.434000 MHz
    DMT 0x55:  1280x720    60.000000 Hz  16:9     45.000 kHz     74.250000 MHz
    DMT 0x23:  1280x1024   60.019740 Hz   5:4     63.981 kHz    108.000000 MHz
    GTF     :  1280x1024   69.999805 Hz   5:4     74.620 kHz    128.943000 MHz
    GTF     :  1280x1024   72.000069 Hz   5:4     76.824 kHz    132.752000 MHz
    DMT 0x53:  1600x900    60.000000 Hz  16:9     60.000 kHz    108.000000 MHz (RB)
  Detailed Timing Descriptors:
    DTD 1:  1920x1080   60.000000 Hz  16:9     67.500 kHz    148.500000 MHz (521 mm x 293 mm)
                 Hfront   88 Hsync  44 Hback  148 Hpol P
                 Vfront    4 Vsync   5 Vback   36 Vpol P
    DTD 2:  1680x1050   59.883253 Hz  16:10    64.674 kHz    119.000000 MHz (521 mm x 293 mm)
                 Hfront   48 Hsync  32 Hback   80 Hpol N
                 Vfront    3 Vsync   6 Vback   21 Vpol N
    Display Product Name: 'P2A583E'
    Display Product Serial Number: ...
Checksum: 0xa2

----------------

Warnings:

Block 0, Base EDID:
  Vendor & Product Identification: The serial number is one of the known dummy values, it should probably be set to 0.
  Detailed Timing Descriptor #2: DTD is similar but not identical to DMT 0x39.
  Detailed Timing Descriptor #2: Image size is 521x293 mm, but based on the picture AR it should be 468x293 mm.

Failures:

Block 0, Base EDID:
  Detailed Timing Descriptor #1: Mismatch of image size 521x293 mm vs display size 480x260 mm.
  Detailed Timing Descriptor #2: Mismatch of image size 521x293 mm vs display size 480x260 mm.
  Missing Display Range Limits Descriptor.
EDID:
  Extension Block 1 started with EDID header, ignoring Extension Blocks >= 1.
  Base EDID: The DTD max image size is 521x293mm, which is larger than the display size 480.0x260.0mm.

EDID conformity: FAIL
