edid-decode (hex):

00 ff ff ff ff ff ff 00 30 ae fa 66 00 00 00 00
1b 20 01 04 b5 3c 22 78 3f ad b5 a3 55 4e 9e 26
0e 50 54 a1 48 00 95 00 81 80 a9 c0 b3 00 d1 c0
31 40 01 01 01 01 fd 5e 00 a0 a0 a0 32 50 30 20
35 00 56 e2 20 00 00 1a 00 00 00 fc 00 44 32 37
71 2d 33 30 0a 20 20 20 20 20 00 00 00 fd 00 30
4c 73 73 1f 00 0a 20 20 20 20 20 20 00 00 00 ff
00 55 52 48 4b 38 54 31 38 0a 20 20 20 20 01 f6

02 03 2c 71 4b 90 1f 05 14 04 13 03 12 01 02 11
23 09 07 07 83 01 00 00 e3 05 c0 00 e6 06 05 01
5b 5b 29 68 1a 00 00 01 01 30 4b 00 7c 2e 90 a0
60 1a 1e 40 30 20 36 00 55 50 21 00 00 1e 66 21
56 aa 51 00 1e 30 46 8f 33 00 55 50 21 00 00 1e
f9 76 00 a0 a0 a0 35 50 30 20 35 00 56 50 21 00
00 7f 02 3a 80 18 71 38 2d 40 58 2c 45 00 56 50
21 00 00 7f 00 00 00 00 00 00 00 00 00 00 00 0f

00 ff ff ff ff ff ff 00 30 ae fa 66 00 00 00 00
1b 20 01 04 b5 3c 22 78 3f ad b5 a3 55 4e 9e 26
0e 50 54 a1 48 00 95 00 81 80 a9 c0 b3 00 d1 c0
31 40 01 01 01 01 fd 5e 00 a0 a0 a0 32 50 30 20
35 00 56 e2 20 00 00 1a 00 00 00 fc 00 44 32 37
71 2d 33 30 0a 20 20 20 20 20 00 00 00 fd 00 30
4c 73 73 1f 00 0a 20 20 20 20 20 20 00 00 00 ff
00 55 52 48 4b 38 54 31 38 0a 20 20 20 20 01 f6

02 03 2c 71 4b 90 1f 05 14 04 13 03 12 01 02 11
23 09 07 07 83 01 00 00 e3 05 c0 00 e6 06 05 01
5b 5b 29 68 1a 00 00 01 01 30 4b 00 7c 2e 90 a0
60 1a 1e 40 30 20 36 00 55 50 21 00 00 1e 66 21
56 aa 51 00 1e 30 46 8f 33 00 55 50 21 00 00 1e
f9 76 00 a0 a0 a0 35 50 30 20 35 00 56 50 21 00
00 7f 02 3a 80 18 71 38 2d 40 58 2c 45 00 56 50
21 00 00 7f 00 00 00 00 00 00 00 00 00 00 00 0f

----------------

Block 0, Base EDID:
  EDID Structure Version & Revision: 1.4
  Vendor & Product Identification:
    Manufacturer: LEN
    Model: 26362
    Made in: week 27 of 2022
  Basic Display Parameters & Features:
    Digital display
    Bits per primary color channel: 10
    DisplayPort interface
    Maximum image size: 60 cm x 34 cm
    Gamma: 2.20
    DPMS levels: Off
    Supported color formats: RGB 4:4:4, YCrCb 4:4:4, YCrCb 4:2:2
    Default (sRGB) color space is primary color space
    First detailed timing includes the native pixel format and preferred refresh rate
    Display supports continuous frequencies
  Color Characteristics:
    Red  : 0.6386, 0.3339
    Green: 0.3076, 0.6181
    Blue : 0.1503, 0.0576
    White: 0.3134, 0.3291
  Established Timings I & II:
    IBM     :   720x400    70.081663 Hz   9:5     31.467 kHz     28.320000 MHz
    DMT 0x04:   640x480    59.940476 Hz   4:3     31.469 kHz     25.175000 MHz
    DMT 0x09:   800x600    60.316541 Hz   4:3     37.879 kHz     40.000000 MHz
    DMT 0x0b:   800x600    75.000000 Hz   4:3     46.875 kHz     49.500000 MHz
    DMT 0x10:  1024x768    60.003840 Hz   4:3     48.363 kHz     65.000000 MHz
  Standard Timings:
    DMT 0x2f:  1440x900    59.887445 Hz  16:10    55.935 kHz    106.500000 MHz
    DMT 0x23:  1280x1024   60.019740 Hz   5:4     63.981 kHz    108.000000 MHz
    DMT 0x53:  1600x900    60.000000 Hz  16:9     60.000 kHz    108.000000 MHz (RB)
    DMT 0x3a:  1680x1050   59.954250 Hz  16:10    65.290 kHz    146.250000 MHz
    DMT 0x52:  1920x1080   60.000000 Hz  16:9     67.500 kHz    148.500000 MHz
    DMT 0x04:   640x480    59.940476 Hz   4:3     31.469 kHz     25.175000 MHz
  Detailed Timing Descriptors:
    DTD 1:  2560x1440   60.000493 Hz  16:9     89.401 kHz    243.170000 MHz (598 mm x 226 mm)
                 Hfront   48 Hsync  32 Hback   80 Hpol P
                 Vfront    3 Vsync   5 Vback   42 Vpol N
    Display Product Name: 'D27q-30'
    Display Range Limits:
      Monitor ranges (GTF): 48-76 Hz V, 115-115 kHz H, max dotclock 310 MHz
    Display Product Serial Number: ...
  Extension blocks: 1
Checksum: 0xf6

----------------

Block 1, CTA-861 Extension Block:
  Revision: 3
  Basic audio support
  Supports YCbCr 4:4:4
  Supports YCbCr 4:2:2
  Native DTDs: 1
  Video Data Block:
    VIC  16:  1920x1080   60.000000 Hz  16:9     67.500 kHz    148.500000 MHz (native)
    VIC  31:  1920x1080   50.000000 Hz  16:9     56.250 kHz    148.500000 MHz
    VIC   5:  1920x1080i  60.000000 Hz  16:9     33.750 kHz     74.250000 MHz
    VIC  20:  1920x1080i  50.000000 Hz  16:9     28.125 kHz     74.250000 MHz
    VIC   4:  1280x720    60.000000 Hz  16:9     45.000 kHz     74.250000 MHz
    VIC  19:  1280x720    50.000000 Hz  16:9     37.500 kHz     74.250000 MHz
    VIC   3:   720x480    59.940060 Hz  16:9     31.469 kHz     27.000000 MHz
    VIC  18:   720x576    50.000000 Hz  16:9     31.250 kHz     27.000000 MHz
    VIC   1:   640x480    59.940476 Hz   4:3     31.469 kHz     25.175000 MHz
    VIC   2:   720x480    59.940060 Hz   4:3     31.469 kHz     27.000000 MHz
    VIC  17:   720x576    50.000000 Hz   4:3     31.250 kHz     27.000000 MHz
  Audio Data Block:
    Linear PCM:
      Max channels: 2
      Supported sample rates (kHz): 48 44.1 32
      Supported sample sizes (bits): 24 20 16
  Speaker Allocation Data Block:
    FL/FR - Front Left/Right
  Colorimetry Data Block:
    BT2020YCC
    BT2020RGB
  HDR Static Metadata Data Block:
    Electro optical transfer functions:
      Traditional gamma - SDR luminance range
      SMPTE ST2084
    Supported static metadata descriptors:
      Static metadata type 1
    Desired content max luminance: 91 (358.942 cd/m^2)
    Desired content max frame-average luminance: 91 (358.942 cd/m^2)
    Desired content min luminance: 41 (0.093 cd/m^2)
  Vendor-Specific Data Block (AMD), OUI 00-00-1A:
    Version: 1
    Feature Caps: 0x01
    Minimum Refresh Rate: 48 Hz
    Maximum Refresh Rate: 75 Hz
    Flags 1.x: 0x00
  Detailed Timing Descriptors:
    DTD 2:  1680x1050   59.883253 Hz  16:10    64.674 kHz    119.000000 MHz (597 mm x 336 mm)
                 Hfront   48 Hsync  32 Hback   80 Hpol P
                 Vfront    3 Vsync   6 Vback   21 Vpol P
    DTD 3:  1366x768    59.789541 Hz 683:384   47.712 kHz     85.500000 MHz (597 mm x 336 mm)
                 Hfront   70 Hsync 143 Hback  213 Hpol P
                 Vfront    3 Vsync   3 Vback   24 Vpol P
    DTD 4:  2560x1440   74.999508 Hz  16:9    111.974 kHz    304.570000 MHz (side by side interleaved, 598 mm x 336 mm)
                 Hfront   48 Hsync  32 Hback   80 Hpol P
                 Vfront    3 Vsync   5 Vback   45 Vpol P
    DTD 5:  1920x1080   60.000000 Hz  16:9     67.500 kHz    148.500000 MHz (side by side interleaved, 598 mm x 336 mm)
                 Hfront   88 Hsync  44 Hback  148 Hpol P
                 Vfront    4 Vsync   5 Vback   36 Vpol P
Checksum: 0x0f  Unused space in Extension Block: 11 bytes

----------------

Warnings:

Block 0, Base EDID:
  Detailed Timing Descriptor #1: Image size is 598x226 mm, but based on the picture AR it should be 401x226 mm.
  Display Range Limits: GTF support is deprecated in EDID 1.4.
Block 1, CTA-861 Extension Block:
  IT Video Formats are overscanned by default, but normally this should be underscanned.
  Video Data Block: VIC 16 and the first DTD are not identical. Is this intended?
  Detailed Timing Descriptor #2: DTD is similar but not identical to DMT 0x39.
  Detailed Timing Descriptor #2: Image size is 597x336 mm, but based on the picture AR it should be 537x336 mm.
EDID:
  Base EDID: Some timings are out of range of the Monitor Ranges:
    Horizontal Freq: 28.125 - 111.974 kHz (Monitor: 115.000 - 115.000 kHz)

Failures:

Block 0, Base EDID:
  Basic Display Parameters & Features: sRGB is signaled, but the chromaticities do not match.
Block 1, CTA-861 Extension Block:
  Missing VCDB, needed for Set Selectable RGB Quantization to avoid interop issues.
EDID:
  Extension Block 2 started with EDID header, ignoring Extension Blocks >= 2.
  CTA-861: Native progressive timings are a mix of several resolutions.

EDID conformity: FAIL
