edid-decode (hex):

00 ff ff ff ff ff ff 00 0d af 58 15 00 00 00 00
20 12 01 03 90 22 13 78 0a 87 f5 94 57 4f 8c 27
27 50 54 00 00 00 01 01 01 01 01 01 01 01 01 01
01 01 01 01 01 01 1d 1b 56 66 50 00 14 30 10 22
26 00 58 c1 10 00 00 1a 1d 1b 56 66 50 00 14 30
10 22 26 00 58 c1 10 00 00 1a 00 00 00 fe 00 4b
36 34 37 48 80 4e 31 35 36 42 33 0a 00 00 00 00
00 00 00 00 00 00 00 00 00 01 01 0a 20 20 00 6f

----------------

Block 0, Base EDID:
  EDID Structure Version & Revision: 1.3
  Vendor & Product Identification:
    Manufacturer: CMO
    Model: 5464
    Made in: week 32 of 2008
  Basic Display Parameters & Features:
    Digital display
    Maximum image size: 34 cm x 19 cm
    Gamma: 2.20
    RGB color display
    First detailed timing is the preferred timing
  Color Characteristics:
    Red  : 0.5800, 0.3398
    Green: 0.3095, 0.5498
    Blue : 0.1552, 0.1552
    White: 0.3134, 0.3291
  Established Timings I & II: none
  Standard Timings: none
  Detailed Timing Descriptors:
    DTD 1:  1366x768    60.002559 Hz 683:384   47.282 kHz     69.410000 MHz (344 mm x 193 mm)
                 Hfront   16 Hsync  34 Hback   52 Hpol P
                 Vfront    2 Vsync   6 Vback   12 Vpol N
    DTD 2:  1366x768    60.002559 Hz 683:384   47.282 kHz     69.410000 MHz (344 mm x 193 mm)
                 Hfront   16 Hsync  34 Hback   52 Hpol P
                 Vfront    2 Vsync   6 Vback   12 Vpol N
    Alphanumeric Data String: 'K647H.N156B3'
    Manufacturer-Specified Display Descriptor (0x00): 00 00 00 00 00 00 00 00 00 00 00 01 01 0a 20 20 '..............  '
Checksum: 0x6f

----------------

Warnings:

Block 0, Base EDID:
  Alphanumeric Data String: Non-ASCII character 0x80 at position 5, can cause problems.

Failures:

Block 0, Base EDID:
  Basic Display Parameters & Features: Digital Video Interface Standard set to reserved value 0x10.
  Missing Display Product Name.
  Missing Display Range Limits Descriptor.

EDID conformity: FAIL
