edid-decode (hex):

00 ff ff ff ff ff ff 00 21 94 33 34 01 00 00 00
14 1e 01 03 80 00 00 78 0a 0d c9 a0 57 47 98 27
12 48 4c 00 00 00 01 01 01 01 01 01 01 01 01 01
01 01 01 01 01 01 b8 35 38 78 40 80 10 70 20 20
84 00 80 38 74 00 00 18 b8 35 38 68 40 80 10 70
20 20 84 00 80 38 74 00 00 18 00 00 00 fc 00 57
61 76 65 53 68 73 61 72 65 0a 20 20 00 00 00 fd
00 14 78 01 ff 1d 00 0a 20 20 20 20 20 20 01 be

02 03 1a 71 47 c6 46 46 46 46 46 46 23 09 07 01
83 01 00 00 65 03 0c 00 10 00 b8 35 38 68 40 80
10 70 20 20 84 00 80 38 74 00 00 18 b8 35 38 68
40 80 10 70 20 20 84 00 80 38 74 00 00 18 b8 35
38 68 40 80 10 70 20 20 84 00 80 38 74 00 00 18
b8 35 38 68 40 80 10 70 20 20 84 00 80 38 74 00
00 18 00 00 00 00 00 00 00 00 00 00 00 00 00 00
00 00 00 00 00 00 00 00 00 00 00 00 00 00 00 2f

00 ff ff ff ff ff ff 00 21 94 33 34 01 00 00 00
14 1e 01 03 80 00 00 78 0a 0d c9 a0 57 47 98 27
12 48 4c 00 00 00 01 01 01 01 01 01 01 01 01 01
01 01 01 01 01 01 b8 35 38 78 40 80 10 70 20 20
84 00 80 38 74 00 00 18 b8 35 38 68 40 80 10 70
20 20 84 00 80 38 74 00 00 18 00 00 00 fc 00 57
61 76 65 53 68 73 61 72 65 0a 20 20 00 00 00 fd
00 14 78 01 ff 1d 00 0a 20 20 20 20 20 20 01 be

02 03 1a 71 47 c6 46 46 46 46 46 46 23 09 07 01
83 01 00 00 65 03 0c 00 10 00 b8 35 38 68 40 80
10 70 20 20 84 00 80 38 74 00 00 18 b8 35 38 68
40 80 10 70 20 20 84 00 80 38 74 00 00 18 b8 35
38 68 40 80 10 70 20 20 84 00 80 38 74 00 00 18
b8 35 38 68 40 80 10 70 20 20 84 00 80 38 74 00
00 18 00 00 00 00 00 00 00 00 00 00 00 00 00 00
00 00 00 00 00 00 00 00 00 00 00 00 00 00 00 2f

----------------

Block 0, Base EDID:
  EDID Structure Version & Revision: 1.3
  Vendor & Product Identification:
    Manufacturer: HLT
    Model: 13363
    Serial Number: ...
    Made in: week 20 of 2020
  Basic Display Parameters & Features:
    Digital display
    Image size is variable
    Gamma: 2.20
    RGB color display
    First detailed timing is the preferred timing
  Color Characteristics:
    Red  : 0.6250, 0.3398
    Green: 0.2802, 0.5947
    Blue : 0.1552, 0.0703
    White: 0.2832, 0.2978
  Established Timings I & II: none
  Standard Timings: none
  Detailed Timing Descriptors:
    DTD 1:  1080x1920   59.194215 Hz   9:16   114.600 kHz    137.520000 MHz (1920 mm x 1080 mm)
                 Hfront   32 Hsync  32 Hback   56 Hpol N
                 Vfront    8 Vsync   4 Vback    4 Vpol N
    DTD 2:  1080x1920   59.994137 Hz   9:16   116.149 kHz    137.520000 MHz (1920 mm x 1080 mm)
                 Hfront   32 Hsync  32 Hback   40 Hpol N
                 Vfront    8 Vsync   4 Vback    4 Vpol N
    Display Product Name: 'WaveShsare'
    Display Range Limits:
      Monitor ranges (GTF): 20-120 Hz V, 1-255 kHz H, max dotclock 290 MHz
  Extension blocks: 1
Checksum: 0xbe

----------------

Block 1, CTA-861 Extension Block:
  Revision: 3
  Basic audio support
  Supports YCbCr 4:4:4
  Supports YCbCr 4:2:2
  Native DTDs: 1
  Video Data Block:
    VIC 198:  7680x4320   50.000000 Hz  16:9    220.000 kHz   2376.000000 MHz
    VIC  70:  1280x720   100.000000 Hz  64:27    75.000 kHz    148.500000 MHz
    VIC  70:  1280x720   100.000000 Hz  64:27    75.000 kHz    148.500000 MHz
    VIC  70:  1280x720   100.000000 Hz  64:27    75.000 kHz    148.500000 MHz
    VIC  70:  1280x720   100.000000 Hz  64:27    75.000 kHz    148.500000 MHz
    VIC  70:  1280x720   100.000000 Hz  64:27    75.000 kHz    148.500000 MHz
    VIC  70:  1280x720   100.000000 Hz  64:27    75.000 kHz    148.500000 MHz
  Audio Data Block:
    Linear PCM:
      Max channels: 2
      Supported sample rates (kHz): 48 44.1 32
      Supported sample sizes (bits): 16
  Speaker Allocation Data Block:
    FL/FR - Front Left/Right
  Vendor-Specific Data Block (HDMI), OUI 00-0C-03:
    Source physical address: 1.0.0.0
  Detailed Timing Descriptors:
    DTD 3:  1080x1920   59.994137 Hz   9:16   116.149 kHz    137.520000 MHz (1920 mm x 1080 mm)
                 Hfront   32 Hsync  32 Hback   40 Hpol N
                 Vfront    8 Vsync   4 Vback    4 Vpol N
    DTD 4:  1080x1920   59.994137 Hz   9:16   116.149 kHz    137.520000 MHz (1920 mm x 1080 mm)
                 Hfront   32 Hsync  32 Hback   40 Hpol N
                 Vfront    8 Vsync   4 Vback    4 Vpol N
    DTD 5:  1080x1920   59.994137 Hz   9:16   116.149 kHz    137.520000 MHz (1920 mm x 1080 mm)
                 Hfront   32 Hsync  32 Hback   40 Hpol N
                 Vfront    8 Vsync   4 Vback    4 Vpol N
    DTD 6:  1080x1920   59.994137 Hz   9:16   116.149 kHz    137.520000 MHz (1920 mm x 1080 mm)
                 Hfront   32 Hsync  32 Hback   40 Hpol N
                 Vfront    8 Vsync   4 Vback    4 Vpol N
Checksum: 0x2f  Unused space in Extension Block: 29 bytes

----------------

Warnings:

Block 0, Base EDID:
  Vendor & Product Identification: The serial number is one of the known dummy values, it should probably be set to 0.
  Detailed Timing Descriptor #1: Image size is 1920x1080 mm, but based on the picture AR it should be 607x1080 mm.
  Detailed Timing Descriptor #2: Image size is 1920x1080 mm, but based on the picture AR it should be 607x1080 mm.
Block 1, CTA-861 Extension Block:
  IT Video Formats are overscanned by default, but normally this should be underscanned.
  Video Data Block: The first VIC 198 has width or height >= 4096, adding a VFPDB and NVRDB is strongly recommended.
  Detailed Timing Descriptor #3: Image size is 1920x1080 mm, but based on the picture AR it should be 607x1080 mm.
  Detailed Timing Descriptor #4: Image size is 1920x1080 mm, but based on the picture AR it should be 607x1080 mm.
  Detailed Timing Descriptor #5: Image size is 1920x1080 mm, but based on the picture AR it should be 607x1080 mm.
  Detailed Timing Descriptor #6: Image size is 1920x1080 mm, but based on the picture AR it should be 607x1080 mm.
  Add a Colorimetry Data Block with the sRGB colorimetry bit set to avoid interop issues.
EDID:
  Base EDID: Some timings are out of range of the Monitor Ranges:
    Maximum Clock: 2376.000 MHz (Monitor: 290.000 MHz)
  CTA-861: Native progressive resolution of 1080x1920 is smaller than the max preferred progressive resolution 7680x4320.

Failures:

Block 1, CTA-861 Extension Block:
  Video Data Block: Duplicate VIC 70.
  Required 640x480p60 timings are missing in the established timings and the SVD list (VIC 1).
  Missing VCDB, needed for Set Selectable RGB Quantization to avoid interop issues.
EDID:
  Extension Block 2 started with EDID header, ignoring Extension Blocks >= 2.
  Base EDID: The DTD max image size is 1920x1080mm, but the display size is not specified anywhere.

EDID conformity: FAIL
