edid-decode (hex):

00 ff ff ff ff ff ff 00 0e 14 29 14 00 00 00 00
25 12 01 03 80 21 15 78 0a d7 fd 97 5c 54 91 28
26 50 54 00 00 00 01 01 01 01 01 01 01 01 01 01
01 01 01 01 01 01 19 1e 00 2c 51 20 0d 30 18 20
36 00 4b cf 10 00 00 1a 19 1e 00 2c 51 20 0d 30
18 20 36 00 4b cf 10 00 00 1a 00 00 00 fe 00 52
4d 35 32 32 80 31 35 34 57 42 39 20 00 00 00 00
00 0c 12 17 1e 3d 67 a0 ff 01 01 0a 20 20 00 dc

----------------

Block 0, Base EDID:
  EDID Structure Version & Revision: 1.3
  Vendor & Product Identification:
    Manufacturer: CPT
    Model: 5161
    Made in: week 37 of 2008
  Basic Display Parameters & Features:
    Digital display
    Maximum image size: 33 cm x 21 cm
    Gamma: 2.20
    RGB color display
    First detailed timing is the preferred timing
  Color Characteristics:
    Red  : 0.5927, 0.3603
    Green: 0.3291, 0.5693
    Blue : 0.1591, 0.1513
    White: 0.3154, 0.3291
  Established Timings I & II: none
  Standard Timings: none
  Detailed Timing Descriptors:
    DTD 1:  1280x800    59.982562 Hz  16:10    48.766 kHz     77.050000 MHz (331 mm x 207 mm)
                 Hfront   24 Hsync  32 Hback  244 Hpol P
                 Vfront    3 Vsync   6 Vback    4 Vpol N
    DTD 2:  1280x800    59.982562 Hz  16:10    48.766 kHz     77.050000 MHz (331 mm x 207 mm)
                 Hfront   24 Hsync  32 Hback  244 Hpol P
                 Vfront    3 Vsync   6 Vback    4 Vpol N
    Alphanumeric Data String: 'RM522.154WB9 '
    Manufacturer-Specified Display Descriptor (0x00): 00 00 00 0c 12 17 1e 3d 67 a0 ff 01 01 0a 20 20 '.......=g.....  '
Checksum: 0xdc

----------------

Warnings:

Block 0, Base EDID:
  Alphanumeric Data String: Non-ASCII character 0x80 at position 5, can cause problems.

Failures:

Block 0, Base EDID:
  Alphanumeric Data String: No newline, but one or more trailing spaces.
  Missing Display Product Name.
  Missing Display Range Limits Descriptor.

EDID conformity: FAIL
