edid-decode (hex):

00 ff ff ff ff ff ff 00 21 63 3d 02 00 00 00 00
00 21 01 04 a5 22 13 78 e3 e0 a0 95 5c 59 93 28
1e 50 54 00 00 00 01 01 01 01 01 01 01 01 01 01
01 01 01 01 01 01 5b 36 80 a0 70 38 23 40 30 20
36 00 58 c2 10 00 00 19 00 00 00 fd 00 37 3c 43
43 0d 01 0a 20 20 20 20 20 20 00 00 00 fe 00 48
4b 43 20 4d 59 20 20 20 20 0a 20 20 00 00 00 fe
00 4d 42 31 35 36 43 53 30 31 2d 38 20 20 00 15

00 ff ff ff ff ff ff 00 21 63 3d 02 00 00 00 00
00 21 01 04 a5 22 13 78 e3 e0 a0 95 5c 59 93 28
1e 50 54 00 00 00 01 01 01 01 01 01 01 01 01 01
01 01 01 01 01 01 5b 36 80 a0 70 38 23 40 30 20
36 00 58 c2 10 00 00 19 00 00 00 fd 00 37 3c 43
43 0d 01 0a 20 20 20 20 20 20 00 00 00 fe 00 48
4b 43 20 4d 59 20 20 20 20 0a 20 20 00 00 00 fe
00 4d 42 31 35 36 43 53 30 31 2d 38 20 20 00 15

----------------

Block 0, Base EDID:
  EDID Structure Version & Revision: 1.4
  Vendor & Product Identification:
    Manufacturer: HKC
    Model: 573
    Made in: 2023
  Basic Display Parameters & Features:
    Digital display
    Bits per primary color channel: 8
    DisplayPort interface
    Maximum image size: 34 cm x 19 cm
    Gamma: 2.20
    DPMS levels: Standby Suspend Off
    Supported color formats: RGB 4:4:4
    First detailed timing includes the native pixel format and preferred refresh rate
    Display supports continuous frequencies
  Color Characteristics:
    Red  : 0.5849, 0.3613
    Green: 0.3476, 0.5742
    Blue : 0.1582, 0.1191
    White: 0.3125, 0.3281
  Established Timings I & II: none
  Standard Timings: none
  Detailed Timing Descriptors:
    DTD 1:  1920x1080   59.999138 Hz  16:9     66.899 kHz    139.150000 MHz (344 mm x 194 mm)
                 Hfront   48 Hsync  32 Hback   80 Hpol N
                 Vfront    3 Vsync   6 Vback   26 Vpol N
    Display Range Limits:
      Monitor ranges (Range Limits Only): 55-60 Hz V, 67-67 kHz H, max dotclock 130 MHz
    Alphanumeric Data String: 'HKC MY    '
    Alphanumeric Data String: 'MB156CS01-8  '
Checksum: 0x15

----------------

Warnings:

Block 0, Base EDID:
  Missing Display Product Name.
EDID:
  Base EDID: Some timings are out of range of the Monitor Ranges:
    Maximum Clock: 139.150 MHz (Monitor: 130.000 MHz)
    Could be due to a Monitor Range off-by-one rounding issue

Failures:

Block 0, Base EDID:
  Alphanumeric Data String: One or more trailing spaces before newline.
  Alphanumeric Data String: No newline, but one or more trailing spaces.
EDID:
  Extension Block 1 started with EDID header, ignoring Extension Blocks >= 1.

EDID conformity: FAIL
