edid-decode (hex):

00 ff ff ff ff ff ff 00 4c 2d 8b 09 00 00 00 00
08 16 01 03 80 10 09 78 0a ee 91 a3 54 4c 99 26
0f 50 54 20 00 00 01 01 01 01 01 01 01 01 01 01
01 01 01 01 01 01 01 1d 00 72 51 d0 1e 20 6e 28
55 00 a0 5a 00 00 00 1e 01 1d 80 18 71 1c 16 20
58 2c 25 00 a0 5a 00 00 00 9e 00 00 00 fd 00 18
3c 0f 44 17 00 0a 20 20 20 20 20 20 00 00 00 fc
00 53 41 4d 53 55 4e 47 0a 20 20 20 20 20 01 62

02 03 1f 71 47 84 05 03 10 20 22 07 23 09 07 07
83 01 00 00 e2 00 03 67 03 0c 00 20 00 b8 2d 8c
0a d0 8a 20 e0 2d 10 10 3e 96 00 a0 5a 00 00 00
18 02 3a 80 18 71 38 2d 40 58 2c 45 00 a0 5a 00
00 00 1e 00 00 00 00 00 00 00 00 00 00 00 00 00
00 00 00 00 00 00 00 00 00 00 00 00 00 00 00 00
00 00 00 00 00 00 00 00 00 00 00 00 00 00 00 00
00 00 00 00 00 00 00 00 00 00 00 00 00 00 00 33

00 ff ff ff ff ff ff 00 4c 2d 8b 09 00 00 00 00
08 16 01 03 80 10 09 78 0a ee 91 a3 54 4c 99 26
0f 50 54 20 00 00 01 01 01 01 01 01 01 01 01 01
01 01 01 01 01 01 01 1d 00 72 51 d0 1e 20 6e 28
55 00 a0 5a 00 00 00 1e 01 1d 80 18 71 1c 16 20
58 2c 25 00 a0 5a 00 00 00 9e 00 00 00 fd 00 18
3c 0f 44 17 00 0a 20 20 20 20 20 20 00 00 00 fc
00 53 41 4d 53 55 4e 47 0a 20 20 20 20 20 01 62

02 03 1f 71 47 84 05 03 10 20 22 07 23 09 07 07
83 01 00 00 e2 00 03 67 03 0c 00 20 00 b8 2d 8c
0a d0 8a 20 e0 2d 10 10 3e 96 00 a0 5a 00 00 00
18 02 3a 80 18 71 38 2d 40 58 2c 45 00 a0 5a 00
00 00 1e 00 00 00 00 00 00 00 00 00 00 00 00 00
00 00 00 00 00 00 00 00 00 00 00 00 00 00 00 00
00 00 00 00 00 00 00 00 00 00 00 00 00 00 00 00
00 00 00 00 00 00 00 00 00 00 00 00 00 00 00 33

----------------

Block 0, Base EDID:
  EDID Structure Version & Revision: 1.3
  Vendor & Product Identification:
    Manufacturer: SAM
    Model: 2443
    Made in: week 8 of 2012
  Basic Display Parameters & Features:
    Digital display
    Maximum image size: 16 cm x 9 cm
    Gamma: 2.20
    RGB color display
    First detailed timing is the preferred timing
  Color Characteristics:
    Red  : 0.6396, 0.3300
    Green: 0.2998, 0.5996
    Blue : 0.1503, 0.0595
    White: 0.3125, 0.3291
  Established Timings I & II:
    DMT 0x04:   640x480    59.940476 Hz   4:3     31.469 kHz     25.175000 MHz
  Standard Timings: none
  Detailed Timing Descriptors:
    DTD 1:  1280x720    60.000000 Hz  16:9     45.000 kHz     74.250000 MHz (160 mm x 90 mm)
                 Hfront  110 Hsync  40 Hback  220 Hpol P
                 Vfront    5 Vsync   5 Vback   20 Vpol P
    DTD 2:  1920x1080i  60.000000 Hz  16:9     33.750 kHz     74.250000 MHz (160 mm x 90 mm)
                 Hfront   88 Hsync  44 Hback  148 Hpol P
                 Vfront    2 Vsync   5 Vback   15 Vpol P Vfront +0.5 Odd Field
                 Vfront    2 Vsync   5 Vback   15 Vpol P Vback  +0.5 Even Field
    Display Range Limits:
      Monitor ranges (GTF): 24-60 Hz V, 15-68 kHz H, max dotclock 230 MHz
    Display Product Name: 'SAMSUNG'
  Extension blocks: 1
Checksum: 0x62

----------------

Block 1, CTA-861 Extension Block:
  Revision: 3
  Basic audio support
  Supports YCbCr 4:4:4
  Supports YCbCr 4:2:2
  Native DTDs: 1
  Video Data Block:
    VIC   4:  1280x720    60.000000 Hz  16:9     45.000 kHz     74.250000 MHz (native)
    VIC   5:  1920x1080i  60.000000 Hz  16:9     33.750 kHz     74.250000 MHz
    VIC   3:   720x480    59.940060 Hz  16:9     31.469 kHz     27.000000 MHz
    VIC  16:  1920x1080   60.000000 Hz  16:9     67.500 kHz    148.500000 MHz
    VIC  32:  1920x1080   24.000000 Hz  16:9     27.000 kHz     74.250000 MHz
    VIC  34:  1920x1080   30.000000 Hz  16:9     33.750 kHz     74.250000 MHz
    VIC   7:  1440x480i   59.940060 Hz  16:9     15.734 kHz     27.000000 MHz
  Audio Data Block:
    Linear PCM:
      Max channels: 2
      Supported sample rates (kHz): 48 44.1 32
      Supported sample sizes (bits): 24 20 16
  Speaker Allocation Data Block:
    FL/FR - Front Left/Right
  Video Capability Data Block:
    YCbCr quantization: No Data
    RGB quantization: No Data
    PT scan behavior: No Data
    IT scan behavior: IT video formats not supported
    CE scan behavior: Supports both over- and underscan
  Vendor-Specific Data Block (HDMI), OUI 00-0C-03:
    Source physical address: 2.0.0.0
    Supports_AI
    DC_36bit
    DC_30bit
    DC_Y444
    Maximum TMDS clock: 225 MHz
  Detailed Timing Descriptors:
    DTD 3:   720x480    59.940060 Hz   3:2     31.469 kHz     27.000000 MHz (160 mm x 90 mm)
                 Hfront   16 Hsync  62 Hback   60 Hpol N
                 Vfront    9 Vsync   6 Vback   30 Vpol N
    DTD 4:  1920x1080   60.000000 Hz  16:9     67.500 kHz    148.500000 MHz (160 mm x 90 mm)
                 Hfront   88 Hsync  44 Hback  148 Hpol P
                 Vfront    4 Vsync   5 Vback   36 Vpol P
Checksum: 0x33  Unused space in Extension Block: 60 bytes

----------------

Warnings:

Block 0, Base EDID:
  Basic Display Parameters & Features: Dubious maximum image size (16x9 is smaller than 10x10 cm).
  Detailed Timing Descriptor #1: Dubious image size (160x90 mm is smaller than 100x100 mm).
  Detailed Timing Descriptor #2: Dubious image size (160x90 mm is smaller than 100x100 mm).
Block 1, CTA-861 Extension Block:
  IT Video Formats are overscanned by default, but normally this should be underscanned.
  Video Capability Data Block: Set Selectable YCbCr Quantization to avoid interop issues.
  Video Capability Data Block: IT scan behavior is expected to support underscanned.
  Detailed Timing Descriptor #3: Dubious image size (160x90 mm is smaller than 100x100 mm).
  Detailed Timing Descriptor #4: Dubious image size (160x90 mm is smaller than 100x100 mm).

Failures:

Block 0, Base EDID:
  Basic Display Parameters & Features: The chromaticities match sRGB, but sRGB is not signaled.
Block 1, CTA-861 Extension Block:
  Video Capability Data Block: Set Selectable RGB Quantization to avoid interop issues.
EDID:
  Extension Block 2 started with EDID header, ignoring Extension Blocks >= 2.

EDID conformity: FAIL
