edid-decode (hex):

00 ff ff ff ff ff ff 00 09 e5 f4 0c 00 00 00 00
0d 22 01 04 a5 1e 13 78 03 a8 65 96 5d 58 95 29
1d 50 54 00 00 00 01 01 01 01 01 01 01 01 01 01
01 01 01 01 01 01 61 40 80 04 71 b0 3c 40 30 20
36 00 2e bc 10 00 00 1a 81 33 80 04 71 b0 3c 40
30 20 36 00 2e bc 10 00 00 1a 00 00 00 fe 00 56
34 4b 44 54 81 4e 56 31 34 41 31 36 00 00 00 00
00 01 41 21 9e 00 00 00 00 0a 01 0a 20 20 00 ee

00 ff ff ff ff ff ff 00 09 e5 f4 0c 00 00 00 00
0d 22 01 04 a5 1e 13 78 03 a8 65 96 5d 58 95 29
1d 50 54 00 00 00 01 01 01 01 01 01 01 01 01 01
01 01 01 01 01 01 61 40 80 04 71 b0 3c 40 30 20
36 00 2e bc 10 00 00 1a 81 33 80 04 71 b0 3c 40
30 20 36 00 2e bc 10 00 00 1a 00 00 00 fe 00 56
34 4b 44 54 81 4e 56 31 34 41 31 36 00 00 00 00
00 01 41 21 9e 00 00 00 00 0a 01 0a 20 20 00 ee

----------------

Block 0, Base EDID:
  EDID Structure Version & Revision: 1.4
  Vendor & Product Identification:
    Manufacturer: BOE
    Model: 3316
    Made in: week 13 of 2024
  Basic Display Parameters & Features:
    Digital display
    Bits per primary color channel: 8
    DisplayPort interface
    Maximum image size: 30 cm x 19 cm
    Gamma: 2.20
    Supported color formats: RGB 4:4:4
    First detailed timing includes the native pixel format and preferred refresh rate
    Display supports continuous frequencies
  Color Characteristics:
    Red  : 0.5878, 0.3652
    Green: 0.3457, 0.5820
    Blue : 0.1611, 0.1152
    White: 0.3134, 0.3291
  Established Timings I & II: none
  Standard Timings: none
  Detailed Timing Descriptors:
    DTD 1:  1920x1200   60.000728 Hz  16:10    75.601 kHz    164.810000 MHz (302 mm x 188 mm)
                 Hfront   48 Hsync  32 Hback  180 Hpol P
                 Vfront    3 Vsync   6 Vback   51 Vpol N
    DTD 2:  1920x1200   48.001311 Hz  16:10    60.482 kHz    131.850000 MHz (302 mm x 188 mm)
                 Hfront   48 Hsync  32 Hback  180 Hpol P
                 Vfront    3 Vsync   6 Vback   51 Vpol N
    Alphanumeric Data String: 'V4KDT.NV14A16'
    Manufacturer-Specified Display Descriptor (0x00): 00 00 00 01 41 21 9e 00 00 00 00 0a 01 0a 20 20 '....A!........  '
Checksum: 0xee

----------------

Warnings:

Block 0, Base EDID:
  Alphanumeric Data String: Non-ASCII character 0x81 at position 5, can cause problems.
  Missing Display Product Name.

Failures:

Block 0, Base EDID:
  Missing Display Range Limits Descriptor.
EDID:
  Extension Block 1 started with EDID header, ignoring Extension Blocks >= 1.

EDID conformity: FAIL
