edid-decode (hex):

00 ff ff ff ff ff ff 00 30 ae 51 90 00 00 00 00
23 1d 01 04 a5 22 13 78 03 0b 95 93 5c 59 93 2a
20 50 54 00 00 00 01 01 01 01 01 01 01 01 01 01
01 01 01 01 01 01 04 3a 80 36 71 38 1e 40 30 20
36 00 58 c2 10 00 00 1a 00 00 00 fd 00 28 3c 43
43 0f 01 0a 00 00 00 00 00 00 00 00 00 fe 00 4c
45 4e 4f 56 4f 0a 20 20 20 20 20 20 00 00 00 fe
00 4c 45 4e 31 35 36 46 48 44 20 20 20 20 00 08

00 ff ff ff ff ff ff 00 30 ae 51 90 00 00 00 00
23 1d 01 04 a5 22 13 78 03 0b 95 93 5c 59 93 2a
20 50 54 00 00 00 01 01 01 01 01 01 01 01 01 01
01 01 01 01 01 01 04 3a 80 36 71 38 1e 40 30 20
36 00 58 c2 10 00 00 1a 00 00 00 fd 00 28 3c 43
43 0f 01 0a 00 00 00 00 00 00 00 00 00 fe 00 4c
45 4e 4f 56 4f 0a 20 20 20 20 20 20 00 00 00 fe
00 4c 45 4e 31 35 36 46 48 44 20 20 20 20 00 08

----------------

Block 0, Base EDID:
  EDID Structure Version & Revision: 1.4
  Vendor & Product Identification:
    Manufacturer: LEN
    Model: 36945
    Made in: week 35 of 2019
  Basic Display Parameters & Features:
    Digital display
    Bits per primary color channel: 8
    DisplayPort interface
    Maximum image size: 34 cm x 19 cm
    Gamma: 2.20
    Supported color formats: RGB 4:4:4
    First detailed timing includes the native pixel format and preferred refresh rate
    Display supports continuous frequencies
  Color Characteristics:
    Red  : 0.5742, 0.3593
    Green: 0.3496, 0.5771
    Blue : 0.1660, 0.1259
    White: 0.3134, 0.3291
  Established Timings I & II: none
  Standard Timings: none
  Detailed Timing Descriptors:
    DTD 1:  1920x1080   60.000808 Hz  16:9     66.601 kHz    148.520000 MHz (344 mm x 194 mm)
                 Hfront   48 Hsync  32 Hback  230 Hpol P
                 Vfront    3 Vsync   6 Vback   21 Vpol N
    Display Range Limits:
      Monitor ranges (Range Limits Only): 40-60 Hz V, 67-67 kHz H, max dotclock 150 MHz
    Alphanumeric Data String: 'LENOVO'
    Alphanumeric Data String: 'LEN156FHD    '
Checksum: 0x08

----------------

Warnings:

Block 0, Base EDID:
  Missing Display Product Name.

Failures:

Block 0, Base EDID:
  Display Range Limits: Bytes 12-17 must be 0x20.
  Alphanumeric Data String: No newline, but one or more trailing spaces.
EDID:
  Extension Block 1 started with EDID header, ignoring Extension Blocks >= 1.

EDID conformity: FAIL
