edid-decode (hex):

00 ff ff ff ff ff ff 00 1c a6 07 11 01 00 00 00
06 17 01 03 80 0c 09 78 0a 1e ac 98 59 56 85 28
29 52 57 2d cf 00 01 01 01 01 01 01 01 01 01 01
01 01 01 01 01 01 8c 0a d0 8a 20 e0 2d 10 10 3e
96 00 81 60 00 00 00 18 01 1d 80 18 71 1c 16 20
58 2c 25 00 81 49 00 00 00 9e 00 00 00 fc 00 48
44 4d 49 2d 44 41 0a 20 20 20 20 20 00 00 00 fd
00 17 3d 0d 2e 11 00 0a 20 20 20 20 20 20 01 e1

02 03 23 71 4e 01 02 03 04 05 06 90 11 12 13 14
15 1f 20 23 09 07 07 83 01 00 00 67 03 0c 00 10
00 00 2d 8c 0a d0 8a 20 e0 2d 10 10 3e 96 00 04
03 00 00 00 18 8c 0a d0 8a 20 e0 2d 10 10 3e 96
00 10 09 00 00 00 18 01 1d 00 72 51 d0 1e 20 6e
28 55 00 10 09 00 00 00 1e 01 1d 80 18 71 1c 16
20 58 2c 25 00 10 09 00 00 00 9e 8c 0a a0 14 51
f0 16 00 26 7c 43 00 04 03 00 00 00 98 00 00 e4

00 ff ff ff ff ff ff 00 1c a6 07 11 01 00 00 00
06 17 01 03 80 0c 09 78 0a 1e ac 98 59 56 85 28
29 52 57 2d cf 00 01 01 01 01 01 01 01 01 01 01
01 01 01 01 01 01 8c 0a d0 8a 20 e0 2d 10 10 3e
96 00 81 60 00 00 00 18 01 1d 80 18 71 1c 16 20
58 2c 25 00 81 49 00 00 00 9e 00 00 00 fc 00 48
44 4d 49 2d 44 41 0a 20 20 20 20 20 00 00 00 fd
00 17 3d 0d 2e 11 00 0a 20 20 20 20 20 20 01 e1

02 03 23 71 4e 01 02 03 04 05 06 90 11 12 13 14
15 1f 20 23 09 07 07 83 01 00 00 67 03 0c 00 10
00 00 2d 8c 0a d0 8a 20 e0 2d 10 10 3e 96 00 04
03 00 00 00 18 8c 0a d0 8a 20 e0 2d 10 10 3e 96
00 10 09 00 00 00 18 01 1d 00 72 51 d0 1e 20 6e
28 55 00 10 09 00 00 00 1e 01 1d 80 18 71 1c 16
20 58 2c 25 00 10 09 00 00 00 9e 8c 0a a0 14 51
f0 16 00 26 7c 43 00 04 03 00 00 00 98 00 00 e4

----------------

Block 0, Base EDID:
  EDID Structure Version & Revision: 1.3
  Vendor & Product Identification:
    Manufacturer: GEF
    Model: 4359
    Serial Number: ...
    Made in: week 6 of 2013
  Basic Display Parameters & Features:
    Digital display
    Maximum image size: 12 cm x 9 cm
    Gamma: 2.20
    RGB color display
    First detailed timing is the preferred timing
  Color Characteristics:
    Red  : 0.5937, 0.3486
    Green: 0.3388, 0.5214
    Blue : 0.1582, 0.1621
    White: 0.3232, 0.3398
  Established Timings I & II:
    DMT 0x04:   640x480    59.940476 Hz   4:3     31.469 kHz     25.175000 MHz
    DMT 0x05:   640x480    72.808802 Hz   4:3     37.861 kHz     31.500000 MHz
    DMT 0x06:   640x480    75.000000 Hz   4:3     37.500 kHz     31.500000 MHz
    DMT 0x09:   800x600    60.316541 Hz   4:3     37.879 kHz     40.000000 MHz
    DMT 0x0a:   800x600    72.187572 Hz   4:3     48.077 kHz     50.000000 MHz
    DMT 0x0b:   800x600    75.000000 Hz   4:3     46.875 kHz     49.500000 MHz
    DMT 0x10:  1024x768    60.003840 Hz   4:3     48.363 kHz     65.000000 MHz
    DMT 0x11:  1024x768    70.069359 Hz   4:3     56.476 kHz     75.000000 MHz
    DMT 0x12:  1024x768    75.028582 Hz   4:3     60.023 kHz     78.750000 MHz
    DMT 0x24:  1280x1024   75.024675 Hz   5:4     79.976 kHz    135.000000 MHz
  Standard Timings: none
  Detailed Timing Descriptors:
    DTD 1:   720x480    59.940060 Hz   3:2     31.469 kHz     27.000000 MHz (129 mm x 96 mm)
                 Hfront   16 Hsync  62 Hback   60 Hpol N
                 Vfront    9 Vsync   6 Vback   30 Vpol N
    DTD 2:  1920x1080i  60.000000 Hz  16:9     33.750 kHz     74.250000 MHz (129 mm x 73 mm)
                 Hfront   88 Hsync  44 Hback  148 Hpol P
                 Vfront    2 Vsync   5 Vback   15 Vpol P Vfront +0.5 Odd Field
                 Vfront    2 Vsync   5 Vback   15 Vpol P Vback  +0.5 Even Field
    Display Product Name: 'HDMI-DA'
    Display Range Limits:
      Monitor ranges (GTF): 23-61 Hz V, 13-46 kHz H, max dotclock 170 MHz
  Extension blocks: 1
Checksum: 0xe1

----------------

Block 1, CTA-861 Extension Block:
  Revision: 3
  Basic audio support
  Supports YCbCr 4:4:4
  Supports YCbCr 4:2:2
  Native DTDs: 1
  Video Data Block:
    VIC   1:   640x480    59.940476 Hz   4:3     31.469 kHz     25.175000 MHz
    VIC   2:   720x480    59.940060 Hz   4:3     31.469 kHz     27.000000 MHz
    VIC   3:   720x480    59.940060 Hz  16:9     31.469 kHz     27.000000 MHz
    VIC   4:  1280x720    60.000000 Hz  16:9     45.000 kHz     74.250000 MHz
    VIC   5:  1920x1080i  60.000000 Hz  16:9     33.750 kHz     74.250000 MHz
    VIC   6:  1440x480i   59.940060 Hz   4:3     15.734 kHz     27.000000 MHz
    VIC  16:  1920x1080   60.000000 Hz  16:9     67.500 kHz    148.500000 MHz (native)
    VIC  17:   720x576    50.000000 Hz   4:3     31.250 kHz     27.000000 MHz
    VIC  18:   720x576    50.000000 Hz  16:9     31.250 kHz     27.000000 MHz
    VIC  19:  1280x720    50.000000 Hz  16:9     37.500 kHz     74.250000 MHz
    VIC  20:  1920x1080i  50.000000 Hz  16:9     28.125 kHz     74.250000 MHz
    VIC  21:  1440x576i   50.000000 Hz   4:3     15.625 kHz     27.000000 MHz
    VIC  31:  1920x1080   50.000000 Hz  16:9     56.250 kHz    148.500000 MHz
    VIC  32:  1920x1080   24.000000 Hz  16:9     27.000 kHz     74.250000 MHz
  Audio Data Block:
    Linear PCM:
      Max channels: 2
      Supported sample rates (kHz): 48 44.1 32
      Supported sample sizes (bits): 24 20 16
  Speaker Allocation Data Block:
    FL/FR - Front Left/Right
  Vendor-Specific Data Block (HDMI), OUI 00-0C-03:
    Source physical address: 1.0.0.0
    Maximum TMDS clock: 225 MHz
  Detailed Timing Descriptors:
    DTD 3:   720x480    59.940060 Hz   3:2     31.469 kHz     27.000000 MHz (4 mm x 3 mm)
                 Hfront   16 Hsync  62 Hback   60 Hpol N
                 Vfront    9 Vsync   6 Vback   30 Vpol N
    DTD 4:   720x480    59.940060 Hz   3:2     31.469 kHz     27.000000 MHz (16 mm x 9 mm)
                 Hfront   16 Hsync  62 Hback   60 Hpol N
                 Vfront    9 Vsync   6 Vback   30 Vpol N
    DTD 5:  1280x720    60.000000 Hz  16:9     45.000 kHz     74.250000 MHz (16 mm x 9 mm)
                 Hfront  110 Hsync  40 Hback  220 Hpol P
                 Vfront    5 Vsync   5 Vback   20 Vpol P
    DTD 6:  1920x1080i  60.000000 Hz  16:9     33.750 kHz     74.250000 MHz (16 mm x 9 mm)
                 Hfront   88 Hsync  44 Hback  148 Hpol P
                 Vfront    2 Vsync   5 Vback   15 Vpol P Vfront +0.5 Odd Field
                 Vfront    2 Vsync   5 Vback   15 Vpol P Vback  +0.5 Even Field
    DTD 7:  1440x480i   59.940060 Hz   3:1     15.734 kHz     27.000000 MHz (4 mm x 3 mm)
                 Hfront   38 Hsync 124 Hback  114 Hpol N
                 Vfront    4 Vsync   3 Vback   15 Vpol N Vfront +0.5 Odd Field
                 Vfront    4 Vsync   3 Vback   15 Vpol N Vback  +0.5 Even Field
Checksum: 0xe4  Unused space in Extension Block: 2 bytes

----------------

Warnings:

Block 0, Base EDID:
  Vendor & Product Identification: The serial number is one of the known dummy values, it should probably be set to 0.
  Basic Display Parameters & Features: Dubious maximum image size (12x9 is smaller than 10x10 cm).
  Detailed Timing Descriptor #1: Dubious image size (129x96 mm is smaller than 100x100 mm).
  Detailed Timing Descriptor #2: Dubious image size (129x73 mm is smaller than 100x100 mm).
Block 1, CTA-861 Extension Block:
  IT Video Formats are overscanned by default, but normally this should be underscanned.
  Video Data Block: VIC 1 and the first DTD are not identical. Is this intended?
  Video Data Block: All VICs are in ascending order, and the first (preferred) VIC <= 4, is that intended?
  Detailed Timing Descriptor #3: Dubious image size (4x3 mm is smaller than 100x100 mm).
  Detailed Timing Descriptor #4: Dubious image size (16x9 mm is smaller than 100x100 mm).
  Detailed Timing Descriptor #5: Dubious image size (16x9 mm is smaller than 100x100 mm).
  Detailed Timing Descriptor #6: Dubious image size (16x9 mm is smaller than 100x100 mm).
  Detailed Timing Descriptor #7: Dubious image size (4x3 mm is smaller than 100x100 mm).
  Add a Colorimetry Data Block with the sRGB colorimetry bit set to avoid interop issues.
EDID:
  Base EDID: Some timings are out of range of the Monitor Ranges:
    Vertical Freq: 24.000 - 75.029 Hz (Monitor: 23.000 - 61.000 Hz)
    Horizontal Freq: 15.625 - 79.976 kHz (Monitor: 13.000 - 46.000 kHz)

Failures:

Block 1, CTA-861 Extension Block:
  Detailed Timing Descriptor #3: Mismatch of image size 4x3 mm vs display size 120x90 mm.
  Detailed Timing Descriptor #4: Mismatch of image size 16x9 mm vs display size 120x90 mm.
  Detailed Timing Descriptor #5: Mismatch of image size 16x9 mm vs display size 120x90 mm.
  Detailed Timing Descriptor #6: Mismatch of image size 16x9 mm vs display size 120x90 mm.
  Detailed Timing Descriptor #7: Mismatch of image size 4x3 mm vs display size 120x90 mm.
  Missing VCDB, needed for Set Selectable RGB Quantization to avoid interop issues.
EDID:
  Extension Block 2 started with EDID header, ignoring Extension Blocks >= 2.
  CTA-861: Native progressive timings are a mix of several resolutions.

EDID conformity: FAIL
