edid-decode (hex):

00 ff ff ff ff ff ff 00 06 09 18 76 6b 00 00 00
33 0a 01 03 6c 22 1b 78 ea 6e 66 a1 54 4c 99 26
19 4f 54 bd ef 80 71 4f 81 80 81 8c 81 90 01 01
01 01 01 01 01 01 30 2a 00 98 51 00 2a 40 30 70
13 00 52 0e 11 00 00 1e d5 09 80 a0 20 5e 63 10
10 60 52 08 52 0e 11 08 06 1a 00 00 00 fd 00 38
4b 1f 51 0d 0a 20 20 20 20 20 20 20 00 00 00 fc
00 41 63 65 72 20 46 50 37 35 31 0a 20 20 00 d3

----------------

Block 0, Base EDID:
  EDID Structure Version & Revision: 1.3
  Vendor & Product Identification:
    Manufacturer: API
    Model: 30232
    Serial Number: ...
    Made in: week 51 of 2000
  Basic Display Parameters & Features:
    Analog display
    Signal Level Standard: 0.700 : 0.000 : 0.700 V p-p
    Blank level equals black level
    Sync: Separate Composite
    Maximum image size: 34 cm x 27 cm
    Gamma: 2.20
    DPMS levels: Standby Suspend Off
    RGB color display
    First detailed timing is the preferred timing
  Color Characteristics:
    Red  : 0.6298, 0.3300
    Green: 0.2998, 0.5996
    Blue : 0.1494, 0.0996
    White: 0.3095, 0.3300
  Established Timings I & II:
    IBM     :   720x400    70.081663 Hz   9:5     31.467 kHz     28.320000 MHz
    DMT 0x04:   640x480    59.940476 Hz   4:3     31.469 kHz     25.175000 MHz
    Apple   :   640x480    66.666667 Hz   4:3     35.000 kHz     30.240000 MHz
    DMT 0x05:   640x480    72.808802 Hz   4:3     37.861 kHz     31.500000 MHz
    DMT 0x06:   640x480    75.000000 Hz   4:3     37.500 kHz     31.500000 MHz
    DMT 0x09:   800x600    60.316541 Hz   4:3     37.879 kHz     40.000000 MHz
    DMT 0x0a:   800x600    72.187572 Hz   4:3     48.077 kHz     50.000000 MHz
    DMT 0x0b:   800x600    75.000000 Hz   4:3     46.875 kHz     49.500000 MHz
    Apple   :   832x624    74.551266 Hz   4:3     49.726 kHz     57.284000 MHz
    DMT 0x10:  1024x768    60.003840 Hz   4:3     48.363 kHz     65.000000 MHz
    DMT 0x11:  1024x768    70.069359 Hz   4:3     56.476 kHz     75.000000 MHz
    DMT 0x12:  1024x768    75.028582 Hz   4:3     60.023 kHz     78.750000 MHz
    DMT 0x24:  1280x1024   75.024675 Hz   5:4     79.976 kHz    135.000000 MHz
    Apple   :  1152x870    75.061550 Hz 192:145   68.681 kHz    100.000000 MHz
  Standard Timings:
    DMT 0x15:  1152x864    75.000000 Hz   4:3     67.500 kHz    108.000000 MHz
    DMT 0x23:  1280x1024   60.019740 Hz   5:4     63.981 kHz    108.000000 MHz
    GTF     :  1280x1024   72.000069 Hz   5:4     76.824 kHz    132.752000 MHz
    GTF     :  1280x1024   75.999957 Hz   5:4     81.320 kHz    141.822000 MHz
  Detailed Timing Descriptors:
    DTD 1:  1280x1024   60.019740 Hz   5:4     63.981 kHz    108.000000 MHz (338 mm x 270 mm)
                 Hfront   48 Hsync 112 Hback  248 Hpol P
                 Vfront    1 Vsync   3 Vback   38 Vpol P
    DTD 2:   640x350    70.072383 Hz  64:35    31.462 kHz     25.170000 MHz (338 mm x 270 mm)
                 Hfront   16 Hsync  96 Hback   32 Hpol P Hborder 8
                 Vfront   37 Vsync   2 Vback   48 Vpol N Vborder 6
    Display Range Limits:
      Monitor ranges (Unknown (0x0a)): 56-75 Hz V, 31-81 kHz H, max dotclock 130 MHz
    Display Product Name: 'Acer FP751'
Checksum: 0xd3

----------------

Warnings:

Block 0, Base EDID:
  Detailed Timing Descriptor #2: Image size is 338x270 mm, but based on the picture AR it should be 338x184 mm.
  Detailed Timing Descriptor #2: The use of non-zero borders in a DTD is not recommended.
EDID:
  Base EDID: Some timings are out of range of the Monitor Ranges:
    Vertical Freq: 59.940 - 76.000 Hz (Monitor: 56.000 - 75.000 Hz)
    Maximum Clock: 141.822 MHz (Monitor: 130.000 MHz)

Failures:

Block 0, Base EDID:
  Display Range Limits: Unknown range class (0x0a).
  Display Range Limits: Byte 11 is 0x20 instead of 0x0a.

EDID conformity: FAIL
