edid-decode (hex):

00 ff ff ff ff ff ff 00 06 10 1e 92 67 00 fe 02
02 0f 01 03 80 31 1f 78 2e cf b5 a3 55 49 99 25
10 50 54 00 00 00 d1 00 01 01 01 01 01 01 01 01
01 01 01 01 01 01 25 3c 80 a0 70 b0 23 40 30 20
36 00 ef 36 11 00 00 1a 00 00 00 fc 00 43 69 6e
65 6d 61 20 48 44 20 44 69 73 00 00 00 fc 00 70
6c 61 79 0a 00 00 00 00 00 00 00 00 00 00 00 00
00 00 00 00 00 00 00 00 00 00 00 00 00 00 01 6c

40 01 02 00 00 00 00 76 00 01 a5 00 ff ff 03 1a
1a a8 01 00 00 00 00 00 40 00 00 00 00 00 00 00
00 00 00 00 00 00 00 00 00 00 00 00 00 00 00 00
00 00 00 00 00 00 00 00 00 00 00 00 00 00 00 00
00 00 00 00 00 00 00 00 00 00 00 00 00 00 00 00
00 00 00 00 00 00 00 00 00 00 00 00 00 00 00 00
00 00 00 00 00 00 00 00 00 00 00 00 00 00 00 00
00 00 00 00 00 00 00 00 00 00 00 00 00 00 00 83

00 ff ff ff ff ff ff 00 06 10 1e 92 67 00 fe 02
02 0f 01 03 80 31 1f 78 2e cf b5 a3 55 49 99 25
10 50 54 00 00 00 d1 00 01 01 01 01 01 01 01 01
01 01 01 01 01 01 25 3c 80 a0 70 b0 23 40 30 20
36 00 ef 36 11 00 00 1a 00 00 00 fc 00 43 69 6e
65 6d 61 20 48 44 20 44 69 73 00 00 00 fc 00 70
6c 61 79 0a 00 00 00 00 00 00 00 00 00 00 00 00
00 00 00 00 00 00 00 00 00 00 00 00 00 00 01 6c

40 01 02 00 00 00 00 76 00 01 a5 00 ff ff 03 1a
1a a8 01 00 00 00 00 00 40 00 00 00 00 00 00 00
00 00 00 00 00 00 00 00 00 00 00 00 00 00 00 00
00 00 00 00 00 00 00 00 00 00 00 00 00 00 00 00
00 00 00 00 00 00 00 00 00 00 00 00 00 00 00 00
00 00 00 00 00 00 00 00 00 00 00 00 00 00 00 00
00 00 00 00 00 00 00 00 00 00 00 00 00 00 00 00
00 00 00 00 00 00 00 00 00 00 00 00 00 00 00 83

----------------

Block 0, Base EDID:
  EDID Structure Version & Revision: 1.3
  Vendor & Product Identification:
    Manufacturer: APP
    Model: 37406
    Serial Number: ...
    Made in: week 2 of 2005
  Basic Display Parameters & Features:
    Digital display
    Maximum image size: 49 cm x 31 cm
    Gamma: 2.20
    DPMS levels: Off
    RGB color display
    Default (sRGB) color space is primary color space
    First detailed timing is the preferred timing
  Color Characteristics:
    Red  : 0.6396, 0.3320
    Green: 0.2880, 0.6005
    Blue : 0.1464, 0.0654
    White: 0.3134, 0.3291
  Established Timings I & II: none
  Standard Timings:
    DMT 0x45:  1920x1200   59.884600 Hz  16:10    74.556 kHz    193.250000 MHz
  Detailed Timing Descriptors:
    DTD 1:  1920x1200   59.938493 Hz  16:10    74.024 kHz    153.970000 MHz (495 mm x 310 mm)
                 Hfront   48 Hsync  32 Hback   80 Hpol P
                 Vfront    3 Vsync   6 Vback   26 Vpol N
    Display Product Name: 'Cinema HD Dis'
    Display Product Name: 'play'
    Empty Descriptor
  Extension blocks: 1
Checksum: 0x6c

----------------

Block 1, Display Information Extension Block:
  Version: 1
  Digital Interface:
    Supported Digital Interface: DVI Single Link
    Data Enable Signal Usage Not Available
    Edge of Shift Clock: Use both edges of shift clock
    HDCP is not supported
    Digital Receivers support Double Clocking of Input Data
    Packetized Digital Video is supported
    Data Formats: Unknown (0x00)
    Minimum Pixel Clock Frequency Per Link: 1 MHz
    Maximum Pixel Clock Frequency Per Link: 165 MHz
    Crossover Frequency: None - Single Link
  Display Device:
    Sub-Pixel Layout: Quad Pixel - G at bottom left & top right
    Sub-Pixel Configuration: Unknown (0x1a)
    Sub-Pixel Shape: Unknown (0x1a)
    Horizontal Dot/Pixel Pitch: 1.68 mm
    Vertical Dot/Pixel Pitch: 0.01 mm
    Display Device does not have a Fixed Pixel Format
    View Direction: Not specified
    Display Device uses non-transparent background
    Physical Implementation: Not specified
    Monitor/display does not support DDC/CI
  Display Capabities & Feature Support Set:
    Legacy Modes: Not all VGA/DOS Legacy Timing Modes are supported
    Stereo Video: No direct stereo
    Scaler On Board: No
    Image Centering: No
    Conditional Update: No
    Interlaced Video: No
    Frame Lock: No
    Frame Rate Conversion: Not supported
    Vertical Frequency: Not available
    Horizontal Frequency: 0.64 kHz
    Display/Scan Orientation Definition Type: Not defined
    Screen Orientation: Landscape
    Zero Pixel Location: Upper Left
    Scan Direction: Not defined
    Standalone Projector: No
    Default Color/Luminance Decoding: Not defined
    Preferred Color/Luminance Decoder: Uses Default Decoding
    Color/Luminance Decoding Capabilities: None
    Dithering: No
    Supported Color Bit-Depth of Sub-Channel 0 (Blue): No Information
    Supported Color Bit-Depth of Sub-Channel 1 (Green): No Information
    Supported Color Bit-Depth of Sub-Channel 2 (Red): No Information
    Supported Color Bit-Depth of Sub-Channel 0 (Cb/Pb): No Information
    Supported Color Bit-Depth of Sub-Channel 1 (Y): No Information
    Supported Color Bit-Depth of Sub-Channel 2 (Cr/Pr): No Information
    Aspect Ratio Conversion Modes: None
  Display Transfer Characteristics - Gamma:
    No Display Transfer Characteristics
Checksum: 0x83

----------------

Failures:

Block 0, Base EDID:
  Basic Display Parameters & Features: sRGB is signaled, but the chromaticities do not match.
  Display Product Name: Non-space after newline.
  Empty Descriptor: Use Dummy Descriptor instead of all zeroes.
  Missing Display Range Limits Descriptor.
Block 1, Display Information Extension Block:
  Digital Interface: Bit 6 of byte 0x07 should be 0.
  Digital Interface: Unknown Data Format 0x00.
  Display Device: Unknown Sub-Pixel Configuration 0x1a.
  Display Device: Unknown Sub-Pixel Shape 0x1a.
EDID:
  Extension Block 2 started with EDID header, ignoring Extension Blocks >= 2.

EDID conformity: FAIL
