edid-decode (hex):

00 ff ff ff ff ff ff 00 06 3f 00 00 00 00 00 00
02 18 01 03 08 29 17 78 ea 95 a5 a5 55 51 9f 27
0f 50 54 3f ce 00 01 01 01 01 01 01 01 01 01 01
01 01 01 01 01 01 20 1c 56 86 50 00 20 30 0e 4c
13 00 9a e6 10 00 00 1e 66 21 50 b0 51 00 1b 30
00 70 86 40 9a e6 10 00 00 1e 1a 1d 00 80 51 d0
1c 20 40 80 35 00 9a e6 10 00 00 1e 00 00 00 fc
00 4d 31 38 35 58 54 4e 30 31 2e 32 20 20 00 6b

00 ff ff ff ff ff ff 00 06 3f 00 00 00 00 00 00
02 18 01 03 08 29 17 78 ea 95 a5 a5 55 51 9f 27
0f 50 54 3f ce 00 01 01 01 01 01 01 01 01 01 01
01 01 01 01 01 01 20 1c 56 86 50 00 20 30 0e 4c
13 00 9a e6 10 00 00 1e 66 21 50 b0 51 00 1b 30
00 70 86 40 9a e6 10 00 00 1e 1a 1d 00 80 51 d0
1c 20 40 80 35 00 9a e6 10 00 00 1e 00 00 00 fc
00 4d 31 38 35 58 54 4e 30 31 2e 32 20 20 00 6b

----------------

Block 0, Base EDID:
  EDID Structure Version & Revision: 1.3
  Vendor & Product Identification:
    Manufacturer: AQ_
    Model: 0
    Made in: week 2 of 2014
  Basic Display Parameters & Features:
    Analog display
    Signal Level Standard: 0.700 : 0.300 : 1.000 V p-p
    Blank level equals black level
    Sync: Separate
    Maximum image size: 41 cm x 23 cm
    Gamma: 2.20
    DPMS levels: Standby Suspend Off
    RGB color display
    First detailed timing is the preferred timing
  Color Characteristics:
    Red  : 0.6464, 0.3330
    Green: 0.3173, 0.6220
    Blue : 0.1542, 0.0605
    White: 0.3134, 0.3291
  Established Timings I & II:
    DMT 0x04:   640x480    59.940476 Hz   4:3     31.469 kHz     25.175000 MHz
    Apple   :   640x480    66.666667 Hz   4:3     35.000 kHz     30.240000 MHz
    DMT 0x05:   640x480    72.808802 Hz   4:3     37.861 kHz     31.500000 MHz
    DMT 0x06:   640x480    75.000000 Hz   4:3     37.500 kHz     31.500000 MHz
    DMT 0x08:   800x600    56.250000 Hz   4:3     35.156 kHz     36.000000 MHz
    DMT 0x09:   800x600    60.316541 Hz   4:3     37.879 kHz     40.000000 MHz
    DMT 0x0a:   800x600    72.187572 Hz   4:3     48.077 kHz     50.000000 MHz
    DMT 0x0b:   800x600    75.000000 Hz   4:3     46.875 kHz     49.500000 MHz
    DMT 0x10:  1024x768    60.003840 Hz   4:3     48.363 kHz     65.000000 MHz
    DMT 0x11:  1024x768    70.069359 Hz   4:3     56.476 kHz     75.000000 MHz
    DMT 0x12:  1024x768    75.028582 Hz   4:3     60.023 kHz     78.750000 MHz
  Standard Timings: none
  Detailed Timing Descriptors:
    DTD 1:  1366x768    60.000000 Hz 683:384   48.000 kHz     72.000000 MHz (410 mm x 230 mm)
                 Hfront   14 Hsync  76 Hback   44 Hpol P
                 Vfront    1 Vsync   3 Vback   28 Vpol P
    DTD 2:  1360x768    60.015162 Hz  85:48    47.712 kHz     85.500000 MHz (410 mm x 230 mm)
                 Hfront  256 Hsync 112 Hback   64 Hpol P
                 Vfront    8 Vsync   6 Vback   13 Vpol P
    DTD 3:  1280x720    59.855126 Hz  16:9     44.772 kHz     74.500000 MHz (410 mm x 230 mm)
                 Hfront   64 Hsync 128 Hback  192 Hpol P
                 Vfront    3 Vsync   5 Vback   20 Vpol P
    Display Product Name: 'M185XTN01.2  '
Checksum: 0x6b

----------------

Block 1, Unknown EDID Extension Block 0x00:
  00 ff ff ff ff ff ff 00 06 3f 00 00 00 00 00 00 '.........?......'
  02 18 01 03 08 29 17 78 ea 95 a5 a5 55 51 9f 27 '.....).x....UQ.''
  0f 50 54 3f ce 00 01 01 01 01 01 01 01 01 01 01 '.PT?............'
  01 01 01 01 01 01 20 1c 56 86 50 00 20 30 0e 4c '...... .V.P. 0.L'
  13 00 9a e6 10 00 00 1e 66 21 50 b0 51 00 1b 30 '........f!P.Q..0'
  00 70 86 40 9a e6 10 00 00 1e 1a 1d 00 80 51 d0 '.p.@..........Q.'
  1c 20 40 80 35 00 9a e6 10 00 00 1e 00 00 00 fc '. @.5...........'
  00 4d 31 38 35 58 54 4e 30 31 2e 32 20 20 00 6b '.M185XTN01.2  .k'
Checksum: 0x6b

----------------

Warnings:

Block 0, Base EDID:
  Detailed Timing Descriptor #1: DTD is similar but not identical to DMT 0x56.
  Detailed Timing Descriptor #2: DTD is similar but not identical to DMT 0x27.

Failures:

Block 0, Base EDID:
  Vendor & Product Identification: Manufacturer name field contains garbage.
  Display Product Name: No newline, but one or more trailing spaces.
  Missing Display Range Limits Descriptor.
Block 1, Base EDID:
  Unknown Extension Block.
EDID:
  Base EDID: EDID specified 0 extension block(s), but found 1 extension block(s).

EDID conformity: FAIL
