edid-decode (hex):

00 ff ff ff ff ff ff 00 09 d1 1f 77 45 54 00 00
14 13 01 03 0e 21 13 78 ea 66 c5 9b 57 50 8f 28
27 50 54 ad e0 00 81 c0 01 01 01 01 01 01 01 01
01 01 01 01 01 01 1a 1d 00 80 51 d0 1c 20 40 80
35 00 4c bb 10 00 00 1c 00 00 00 ff 00 45 35 39
31 33 39 32 39 53 4c 30 0a 0a 00 00 00 fd 00 3b
4b 1f 40 0e 00 0a 20 20 20 20 20 20 00 00 00 fc
00 42 65 6e 51 20 54 35 32 57 0a 0a 0a 0a 00 14

00 ff ff ff ff ff ff 00 09 d1 1f 77 45 54 00 00
14 13 01 03 0e 21 13 78 ea 66 c5 9b 57 50 8f 28
27 50 54 ad e0 00 81 c0 01 01 01 01 01 01 01 01
01 01 01 01 01 01 1a 1d 00 80 51 d0 1c 20 40 80
35 00 4c bb 10 00 00 1c 00 00 00 ff 00 45 35 39
31 33 39 32 39 53 4c 30 0a 0a 00 00 00 fd 00 3b
4b 1f 40 0e 00 0a 20 20 20 20 20 20 00 00 00 fc
00 42 65 6e 51 20 54 35 32 57 0a 0a 0a 0a 00 14

----------------

Block 0, Base EDID:
  EDID Structure Version & Revision: 1.3
  Vendor & Product Identification:
    Manufacturer: BNQ
    Model: 30495
    Serial Number: ...
    Made in: week 20 of 2009
  Basic Display Parameters & Features:
    Analog display
    Signal Level Standard: 0.700 : 0.300 : 1.000 V p-p
    Blank level equals black level
    Sync: Separate Composite SyncOnGreen
    Maximum image size: 33 cm x 19 cm
    Gamma: 2.20
    DPMS levels: Standby Suspend Off
    RGB color display
    First detailed timing is the preferred timing
  Color Characteristics:
    Red  : 0.6064, 0.3417
    Green: 0.3134, 0.5605
    Blue : 0.1591, 0.1523
    White: 0.3134, 0.3291
  Established Timings I & II:
    IBM     :   720x400    70.081663 Hz   9:5     31.467 kHz     28.320000 MHz
    DMT 0x04:   640x480    59.940476 Hz   4:3     31.469 kHz     25.175000 MHz
    DMT 0x05:   640x480    72.808802 Hz   4:3     37.861 kHz     31.500000 MHz
    DMT 0x06:   640x480    75.000000 Hz   4:3     37.500 kHz     31.500000 MHz
    DMT 0x09:   800x600    60.316541 Hz   4:3     37.879 kHz     40.000000 MHz
    DMT 0x0a:   800x600    72.187572 Hz   4:3     48.077 kHz     50.000000 MHz
    DMT 0x0b:   800x600    75.000000 Hz   4:3     46.875 kHz     49.500000 MHz
    Apple   :   832x624    74.551266 Hz   4:3     49.726 kHz     57.284000 MHz
  Standard Timings:
    DMT 0x55:  1280x720    60.000000 Hz  16:9     45.000 kHz     74.250000 MHz
  Detailed Timing Descriptors:
    DTD 1:  1280x720    59.855126 Hz  16:9     44.772 kHz     74.500000 MHz (332 mm x 187 mm)
                 Hfront   64 Hsync 128 Hback  192 Hpol N
                 Vfront    3 Vsync   5 Vback   20 Vpol P
    Display Product Serial Number: ...
    Display Range Limits:
      Monitor ranges (GTF): 59-75 Hz V, 31-64 kHz H, max dotclock 140 MHz
    Display Product Name: 'BenQ T52W'
Checksum: 0x14

----------------

Warnings:

Block 0, Base EDID:
  Vendor & Product Identification: The serial number is one of the known dummy values, it should probably be set to 0.

Failures:

Block 0, Base EDID:
  Display Product Serial Number: ...
  Display Product Name: Non-space after newline.
EDID:
  Extension Block 1 started with EDID header, ignoring Extension Blocks >= 1.

EDID conformity: FAIL
