edid-decode (hex):

00 ff ff ff ff ff ff 00 30 e4 3c 05 00 00 00 00
00 1a 01 04 95 1f 11 78 02 91 15 94 5c 55 92 29
1d 50 54 00 00 00 01 01 01 01 01 01 01 01 01 01
01 01 01 01 01 01 2e 36 80 a0 70 38 1f 40 30 20
35 00 35 ae 10 00 00 19 5c 2b 80 a0 70 38 1f 40
30 20 35 00 35 ae 10 00 00 19 00 00 00 fe 00 4b
54 34 33 46 80 31 34 30 57 46 37 0a 00 00 00 00
00 00 41 30 96 01 10 00 00 0a 01 0a 20 20 00 d7

----------------

Block 0, Base EDID:
  EDID Structure Version & Revision: 1.4
  Vendor & Product Identification:
    Manufacturer: LGD
    Model: 1340
    Made in: 2016
  Basic Display Parameters & Features:
    Digital display
    Bits per primary color channel: 6
    DisplayPort interface
    Maximum image size: 31 cm x 17 cm
    Gamma: 2.20
    Supported color formats: RGB 4:4:4
    First detailed timing includes the native pixel format and preferred refresh rate
  Color Characteristics:
    Red  : 0.5800, 0.3603
    Green: 0.3320, 0.5712
    Blue : 0.1601, 0.1142
    White: 0.3134, 0.3291
  Established Timings I & II: none
  Standard Timings: none
  Detailed Timing Descriptors:
    DTD 1:  1920x1080   60.020425 Hz  16:9     66.683 kHz    138.700000 MHz (309 mm x 174 mm)
                 Hfront   48 Hsync  32 Hback   80 Hpol N
                 Vfront    3 Vsync   5 Vback   23 Vpol N
    DTD 2:  1920x1080   48.033650 Hz  16:9     53.365 kHz    111.000000 MHz (309 mm x 174 mm)
                 Hfront   48 Hsync  32 Hback   80 Hpol N
                 Vfront    3 Vsync   5 Vback   23 Vpol N
    Alphanumeric Data String: 'KT43F.140WF7'
    Manufacturer-Specified Display Descriptor (0x00): 00 00 00 00 41 30 96 01 10 00 00 0a 01 0a 20 20 '....A0........  '
Checksum: 0xd7

----------------

Warnings:

Block 0, Base EDID:
  Alphanumeric Data String: Non-ASCII character 0x80 at position 5, can cause problems.
  Missing Display Product Name.

EDID conformity: PASS
