edid-decode (hex):

00 ff ff ff ff ff ff 00 05 e3 16 17 0a ee 00 00
18 11 01 03 68 22 1b 78 e8 0e 80 a7 53 4c 98 24
14 50 54 bf e0 00 81 c0 01 01 01 01 01 01 01 01
01 01 01 01 01 01 1a 1d 00 80 51 d0 1c 20 40 80
35 00 54 0e 11 00 00 1c 00 00 00 ff 00 44 33 32
37 36 4a 41 30 36 30 39 33 38 00 00 00 fd 00 32
4b 1f 3a 08 00 0a 20 20 20 20 20 20 00 00 00 fc
00 37 31 36 53 77 0a 20 20 20 20 20 20 20 00 2c

00 ff ff ff ff ff ff 00 05 e3 16 17 0a ee 00 00
18 11 01 03 68 22 1b 78 e8 0e 80 a7 53 4c 98 24
14 50 54 bf e0 00 81 c0 01 01 01 01 01 01 01 01
01 01 01 01 01 01 1a 1d 00 80 51 d0 1c 20 40 80
35 00 54 0e 11 00 00 1c 00 00 00 ff 00 44 33 32
37 36 4a 41 30 36 30 39 33 38 00 00 00 fd 00 32
4b 1f 3a 08 00 0a 20 20 20 20 20 20 00 00 00 fc
00 37 31 36 53 77 0a 20 20 20 20 20 20 20 00 2c

----------------

Block 0, Base EDID:
  EDID Structure Version & Revision: 1.3
  Vendor & Product Identification:
    Manufacturer: AOC
    Model: 5910
    Serial Number: ...
    Made in: week 24 of 2007
  Basic Display Parameters & Features:
    Analog display
    Signal Level Standard: 0.700 : 0.000 : 0.700 V p-p
    Blank level equals black level
    Sync: Separate
    Maximum image size: 34 cm x 27 cm
    Gamma: 2.20
    DPMS levels: Standby Suspend Off
    RGB color display
  Color Characteristics:
    Red  : 0.6523, 0.3242
    Green: 0.2998, 0.5957
    Blue : 0.1425, 0.0781
    White: 0.3125, 0.3281
  Established Timings I & II:
    IBM     :   720x400    70.081663 Hz   9:5     31.467 kHz     28.320000 MHz
    DMT 0x04:   640x480    59.940476 Hz   4:3     31.469 kHz     25.175000 MHz
    Apple   :   640x480    66.666667 Hz   4:3     35.000 kHz     30.240000 MHz
    DMT 0x05:   640x480    72.808802 Hz   4:3     37.861 kHz     31.500000 MHz
    DMT 0x06:   640x480    75.000000 Hz   4:3     37.500 kHz     31.500000 MHz
    DMT 0x08:   800x600    56.250000 Hz   4:3     35.156 kHz     36.000000 MHz
    DMT 0x09:   800x600    60.316541 Hz   4:3     37.879 kHz     40.000000 MHz
    DMT 0x0a:   800x600    72.187572 Hz   4:3     48.077 kHz     50.000000 MHz
    DMT 0x0b:   800x600    75.000000 Hz   4:3     46.875 kHz     49.500000 MHz
    Apple   :   832x624    74.551266 Hz   4:3     49.726 kHz     57.284000 MHz
  Standard Timings:
    DMT 0x55:  1280x720    60.000000 Hz  16:9     45.000 kHz     74.250000 MHz
  Detailed Timing Descriptors:
    DTD 1:  1280x720    59.855126 Hz  16:9     44.772 kHz     74.500000 MHz (340 mm x 270 mm)
                 Hfront   64 Hsync 128 Hback  192 Hpol N
                 Vfront    3 Vsync   5 Vback   20 Vpol P
    Display Product Serial Number: ...
    Display Range Limits:
      Monitor ranges (GTF): 50-75 Hz V, 31-58 kHz H, max dotclock 80 MHz
    Display Product Name: '716Sw'
Checksum: 0x2c

----------------

Block 1, Unknown EDID Extension Block 0x00:
  00 ff ff ff ff ff ff 00 05 e3 16 17 0a ee 00 00 '................'
  18 11 01 03 68 22 1b 78 e8 0e 80 a7 53 4c 98 24 '....h".x....SL.$'
  14 50 54 bf e0 00 81 c0 01 01 01 01 01 01 01 01 '.PT.............'
  01 01 01 01 01 01 1a 1d 00 80 51 d0 1c 20 40 80 '..........Q.. @.'
  35 00 54 0e 11 00 00 1c 00 00 00 ff 00 44 33 32 '5.T..........D32'
  37 36 4a 41 30 36 30 39 33 38 00 00 00 fd 00 32 '76JA060938.....2'
  4b 1f 3a 08 00 0a 20 20 20 20 20 20 00 00 00 fc 'K.:...      ....'
  00 37 31 36 53 77 0a 20 20 20 20 20 20 20 00 2c '.716Sw.       .,'
Checksum: 0x2c

----------------

Warnings:

Block 0, Base EDID:
  Detailed Timing Descriptor #1: Image size is 340x270 mm, but based on the picture AR it should be 340x191 mm.

Failures:

Block 0, Base EDID:
  Basic Display Parameters & Features: EDID 1.3 requires that the first detailed timing is the preferred timing.
Block 1, Base EDID:
  Unknown Extension Block.
EDID:
  Base EDID: EDID specified 0 extension block(s), but found 1 extension block(s).

EDID conformity: FAIL
