edid-decode (hex):

00 ff ff ff ff ff ff 00 09 d1 52 7f 45 54 00 00
14 1d 01 03 80 36 1e 78 2e 4c 00 a7 55 52 a0 28
13 50 54 a5 6b 80 d1 c0 81 c0 81 00 81 80 a9 c0
b3 00 81 bc 01 01 5a 87 80 a0 70 38 4d 40 30 20
35 00 20 2f 21 00 00 1a 23 e8 80 78 70 38 87 40
1c 20 98 0c 20 2f 21 00 00 1a 00 00 00 fd 00 30
f0 1e ff 3c 00 0a 20 20 20 20 20 20 00 00 00 fc
00 48 69 67 68 20 52 61 74 65 32 34 30 0a 01 91

02 03 34 f1 50 90 05 3f 2f 4d 5b 5c 5a 61 69 64
66 15 16 1f 20 23 09 07 07 83 01 00 00 65 03 0c
00 10 00 67 d8 5d c4 01 78 c0 00 68 1a 00 00 01
01 30 f0 e6 40 e7 00 6a a0 a0 67 50 08 20 98 04
20 2f 21 00 00 1a 6f c2 00 a0 a0 a0 55 50 30 20
35 00 20 2f 21 00 00 1e 0f d2 54 a0 90 84 62 60
30 20 3a 00 20 2f 21 00 00 1c b6 e4 e0 a0 b0 a0
55 50 30 40 3a 00 20 2f 21 00 00 1a 00 00 00 1f

00 ff ff ff ff ff ff 00 09 d1 52 7f 45 54 00 00
14 1d 01 03 80 36 1e 78 2e 4c 00 a7 55 52 a0 28
13 50 54 a5 6b 80 d1 c0 81 c0 81 00 81 80 a9 c0
b3 00 81 bc 01 01 5a 87 80 a0 70 38 4d 40 30 20
35 00 20 2f 21 00 00 1a 23 e8 80 78 70 38 87 40
1c 20 98 0c 20 2f 21 00 00 1a 00 00 00 fd 00 30
f0 1e ff 3c 00 0a 20 20 20 20 20 20 00 00 00 fc
00 48 69 67 68 20 52 61 74 65 32 34 30 0a 01 91

02 03 34 f1 50 90 05 3f 2f 4d 5b 5c 5a 61 69 64
66 15 16 1f 20 23 09 07 07 83 01 00 00 65 03 0c
00 10 00 67 d8 5d c4 01 78 c0 00 68 1a 00 00 01
01 30 f0 e6 40 e7 00 6a a0 a0 67 50 08 20 98 04
20 2f 21 00 00 1a 6f c2 00 a0 a0 a0 55 50 30 20
35 00 20 2f 21 00 00 1e 0f d2 54 a0 90 84 62 60
30 20 3a 00 20 2f 21 00 00 1c b6 e4 e0 a0 b0 a0
55 50 30 40 3a 00 20 2f 21 00 00 1a 00 00 00 1f

----------------

Block 0, Base EDID:
  EDID Structure Version & Revision: 1.3
  Vendor & Product Identification:
    Manufacturer: BNQ
    Model: 32594
    Serial Number: ...
    Made in: week 20 of 2019
  Basic Display Parameters & Features:
    Digital display
    Maximum image size: 54 cm x 30 cm
    Gamma: 2.20
    DPMS levels: Off
    RGB color display
    Default (sRGB) color space is primary color space
    First detailed timing is the preferred timing
  Color Characteristics:
    Red  : 0.6533, 0.3320
    Green: 0.3232, 0.6250
    Blue : 0.1562, 0.0742
    White: 0.3125, 0.3281
  Established Timings I & II:
    IBM     :   720x400    70.081663 Hz   9:5     31.467 kHz     28.320000 MHz
    DMT 0x04:   640x480    59.940476 Hz   4:3     31.469 kHz     25.175000 MHz
    DMT 0x06:   640x480    75.000000 Hz   4:3     37.500 kHz     31.500000 MHz
    DMT 0x09:   800x600    60.316541 Hz   4:3     37.879 kHz     40.000000 MHz
    DMT 0x0b:   800x600    75.000000 Hz   4:3     46.875 kHz     49.500000 MHz
    Apple   :   832x624    74.551266 Hz   4:3     49.726 kHz     57.284000 MHz
    DMT 0x10:  1024x768    60.003840 Hz   4:3     48.363 kHz     65.000000 MHz
    DMT 0x12:  1024x768    75.028582 Hz   4:3     60.023 kHz     78.750000 MHz
    DMT 0x24:  1280x1024   75.024675 Hz   5:4     79.976 kHz    135.000000 MHz
    Apple   :  1152x870    75.061550 Hz 192:145   68.681 kHz    100.000000 MHz
  Standard Timings:
    DMT 0x52:  1920x1080   60.000000 Hz  16:9     67.500 kHz    148.500000 MHz
    DMT 0x55:  1280x720    60.000000 Hz  16:9     45.000 kHz     74.250000 MHz
    DMT 0x1c:  1280x800    59.810326 Hz  16:10    49.702 kHz     83.500000 MHz
    DMT 0x23:  1280x1024   60.019740 Hz   5:4     63.981 kHz    108.000000 MHz
    DMT 0x53:  1600x900    60.000000 Hz  16:9     60.000 kHz    108.000000 MHz (RB)
    DMT 0x3a:  1680x1050   59.954250 Hz  16:10    65.290 kHz    146.250000 MHz
    GTF     :  1280x1024  120.000185 Hz   5:4    131.640 kHz    233.793000 MHz
  Detailed Timing Descriptors:
    DTD 1:  1920x1080  143.981451 Hz  16:9    166.587 kHz    346.500000 MHz (544 mm x 303 mm)
                 Hfront   48 Hsync  32 Hback   80 Hpol P
                 Vfront    3 Vsync   5 Vback   69 Vpol N
    DTD 2:  1920x1080  239.760349 Hz  16:9    291.309 kHz    594.270000 MHz (544 mm x 303 mm)
                 Hfront   28 Hsync  32 Hback   60 Hpol P
                 Vfront   57 Vsync   8 Vback   70 Vpol N
    Display Range Limits:
      Monitor ranges (GTF): 48-240 Hz V, 30-255 kHz H, max dotclock 600 MHz
    Display Product Name: 'High Rate240'
  Extension blocks: 1
Checksum: 0x91

----------------

Block 1, CTA-861 Extension Block:
  Revision: 3
  Underscans IT Video Formats by default
  Basic audio support
  Supports YCbCr 4:4:4
  Supports YCbCr 4:2:2
  Native DTDs: 1
  Video Data Block:
    VIC  16:  1920x1080   60.000000 Hz  16:9     67.500 kHz    148.500000 MHz (native)
    VIC   5:  1920x1080i  60.000000 Hz  16:9     33.750 kHz     74.250000 MHz
    VIC  63:  1920x1080  120.000000 Hz  16:9    135.000 kHz    297.000000 MHz
    VIC  47:  1280x720   120.000000 Hz  16:9     90.000 kHz    148.500000 MHz
    VIC  77:  1920x1080  100.000000 Hz  64:27   112.500 kHz    297.000000 MHz
    VIC  91:  2560x1080  100.000000 Hz  64:27   125.000 kHz    371.250000 MHz
    VIC  92:  2560x1080  120.000000 Hz  64:27   150.000 kHz    495.000000 MHz
    VIC  90:  2560x1080   60.000000 Hz  64:27    66.000 kHz    198.000000 MHz
    VIC  97:  3840x2160   60.000000 Hz  16:9    135.000 kHz    594.000000 MHz
    VIC 105:  3840x2160   30.000000 Hz  64:27    67.500 kHz    297.000000 MHz
    VIC 100:  4096x2160   30.000000 Hz 256:135   67.500 kHz    297.000000 MHz
    VIC 102:  4096x2160   60.000000 Hz 256:135  135.000 kHz    594.000000 MHz
    VIC  21:  1440x576i   50.000000 Hz   4:3     15.625 kHz     27.000000 MHz
    VIC  22:  1440x576i   50.000000 Hz  16:9     15.625 kHz     27.000000 MHz
    VIC  31:  1920x1080   50.000000 Hz  16:9     56.250 kHz    148.500000 MHz
    VIC  32:  1920x1080   24.000000 Hz  16:9     27.000 kHz     74.250000 MHz
  Audio Data Block:
    Linear PCM:
      Max channels: 2
      Supported sample rates (kHz): 48 44.1 32
      Supported sample sizes (bits): 24 20 16
  Speaker Allocation Data Block:
    FL/FR - Front Left/Right
  Vendor-Specific Data Block (HDMI), OUI 00-0C-03:
    Source physical address: 1.0.0.0
  Vendor-Specific Data Block (HDMI Forum), OUI C4-5D-D8:
    Version: 1
    Maximum TMDS Character Rate: 600 MHz
    SCDC Present
    SCDC Read Request Capable
  Vendor-Specific Data Block (AMD), OUI 00-00-1A:
    Version: 1
    Feature Caps: 0x01
    Minimum Refresh Rate: 48 Hz
    Maximum Refresh Rate: 240 Hz
    Flags 1.x: 0xe6 (MCCS)
  Detailed Timing Descriptors:
    DTD 3:  2560x1440  143.911545 Hz  16:9    222.056 kHz    592.000000 MHz (544 mm x 303 mm)
                 Hfront    8 Hsync  32 Hback   66 Hpol P
                 Vfront   25 Vsync   8 Vback   70 Vpol N
    DTD 4:  2560x1440  119.997589 Hz  16:9    182.996 kHz    497.750000 MHz (544 mm x 303 mm)
                 Hfront   48 Hsync  32 Hback   80 Hpol P
                 Vfront    3 Vsync   5 Vback   77 Vpol P
    DTD 5:  2388x1668  119.506161 Hz 199:139  211.048 kHz    537.750000 MHz (544 mm x 303 mm)
                 Hfront   48 Hsync  32 Hback   80 Hpol N
                 Vfront    3 Vsync  10 Vback   85 Vpol P
    DTD 6:  3040x1440  119.979508 Hz  19:9    182.969 kHz    585.500000 MHz (544 mm x 303 mm)
                 Hfront   48 Hsync  64 Hback   48 Hpol P
                 Vfront    3 Vsync  10 Vback   72 Vpol N
Checksum: 0x1f  Unused space in Extension Block: 3 bytes

----------------

Warnings:

Block 0, Base EDID:
  Vendor & Product Identification: The serial number is one of the known dummy values, it should probably be set to 0.
Block 1, CTA-861 Extension Block:
  Video Data Block: VIC 16 and the first DTD are not identical. Is this intended?
  Detailed Timing Descriptor #5: Image size is 544x303 mm, but based on the picture AR it should be 433x303 mm.
  Detailed Timing Descriptor #6: Image size is 544x303 mm, but based on the picture AR it should be 544x257 mm.
EDID:
  Base EDID: Some timings are out of range of the Monitor Ranges:
    Vertical Freq: 24.000 - 239.760 Hz (Monitor: 48.000 - 240.000 Hz)
    Horizontal Freq: 15.625 - 291.308 kHz (Monitor: 30.000 - 510.000 kHz)

Failures:

Block 0, Base EDID:
  Basic Display Parameters & Features: sRGB is signaled, but the chromaticities do not match.
Block 1, CTA-861 Extension Block:
  Missing VCDB, needed for Set Selectable RGB Quantization to avoid interop issues.
EDID:
  Extension Block 2 started with EDID header, ignoring Extension Blocks >= 2.

EDID conformity: FAIL
