edid-decode (hex):

00 ff ff ff ff ff ff 00 4e 14 78 09 00 00 00 00
2e 14 01 03 08 35 1e 78 0a 60 85 a6 56 4a 9c 25
12 50 54 ad ce 00 95 00 b3 00 01 01 01 01 01 01
01 01 01 01 01 01 02 3a 80 18 71 38 2d 40 58 2c
45 00 70 ea 31 00 00 1e 00 00 00 ff 00 31 35 33
39 0a 0a 0a 0a 0a 0a 0a 0a 0a 00 00 00 fd 00 3b
4d 1e 50 0f 00 0a 20 20 20 20 20 20 00 00 00 fc
00 58 32 34 30 2d 43 4e 43 0a 0a 0a 0a 0a 00 1f

00 ff ff ff ff ff ff 00 4e 14 78 09 00 00 00 00
2e 14 01 03 08 35 1e 78 0a 60 85 a6 56 4a 9c 25
12 50 54 ad ce 00 95 00 b3 00 01 01 01 01 01 01
01 01 01 01 01 01 02 3a 80 18 71 38 2d 40 58 2c
45 00 70 ea 31 00 00 1e 00 00 00 ff 00 31 35 33
39 0a 0a 0a 0a 0a 0a 0a 0a 0a 00 00 00 fd 00 3b
4d 1e 50 0f 00 0a 20 20 20 20 20 20 00 00 00 fc
00 58 32 34 30 2d 43 4e 43 0a 0a 0a 0a 0a 00 1f

----------------

Block 0, Base EDID:
  EDID Structure Version & Revision: 1.3
  Vendor & Product Identification:
    Manufacturer: SPT
    Model: 2424
    Made in: week 46 of 2010
  Basic Display Parameters & Features:
    Analog display
    Signal Level Standard: 0.700 : 0.300 : 1.000 V p-p
    Blank level equals black level
    Sync: Separate
    Maximum image size: 53 cm x 30 cm
    Gamma: 2.20
    RGB color display
    First detailed timing is the preferred timing
  Color Characteristics:
    Red  : 0.6494, 0.3378
    Green: 0.2890, 0.6093
    Blue : 0.1464, 0.0703
    White: 0.3134, 0.3291
  Established Timings I & II:
    IBM     :   720x400    70.081663 Hz   9:5     31.467 kHz     28.320000 MHz
    DMT 0x04:   640x480    59.940476 Hz   4:3     31.469 kHz     25.175000 MHz
    DMT 0x05:   640x480    72.808802 Hz   4:3     37.861 kHz     31.500000 MHz
    DMT 0x06:   640x480    75.000000 Hz   4:3     37.500 kHz     31.500000 MHz
    DMT 0x09:   800x600    60.316541 Hz   4:3     37.879 kHz     40.000000 MHz
    DMT 0x0a:   800x600    72.187572 Hz   4:3     48.077 kHz     50.000000 MHz
    DMT 0x0b:   800x600    75.000000 Hz   4:3     46.875 kHz     49.500000 MHz
    DMT 0x10:  1024x768    60.003840 Hz   4:3     48.363 kHz     65.000000 MHz
    DMT 0x11:  1024x768    70.069359 Hz   4:3     56.476 kHz     75.000000 MHz
    DMT 0x12:  1024x768    75.028582 Hz   4:3     60.023 kHz     78.750000 MHz
  Standard Timings:
    DMT 0x2f:  1440x900    59.887445 Hz  16:10    55.935 kHz    106.500000 MHz
    DMT 0x3a:  1680x1050   59.954250 Hz  16:10    65.290 kHz    146.250000 MHz
  Detailed Timing Descriptors:
    DTD 1:  1920x1080   60.000000 Hz  16:9     67.500 kHz    148.500000 MHz (880 mm x 490 mm)
                 Hfront   88 Hsync  44 Hback  148 Hpol P
                 Vfront    4 Vsync   5 Vback   36 Vpol P
    Display Product Serial Number: ...
    Display Range Limits:
      Monitor ranges (GTF): 59-77 Hz V, 30-80 kHz H, max dotclock 150 MHz
    Display Product Name: 'X240-CNC'
Checksum: 0x1f

----------------

Failures:

Block 0, Base EDID:
  Display Product Serial Number: ...
  Detailed Timing Descriptor #1: Mismatch of image size 880x490 mm vs display size 530x300 mm.
  Display Product Name: Non-space after newline.
EDID:
  Extension Block 1 started with EDID header, ignoring Extension Blocks >= 1.
  Base EDID: The DTD max image size is 880x490mm, which is larger than the display size 530.0x300.0mm.

EDID conformity: FAIL
