edid-decode (hex):

00 ff ff ff ff ff ff 00 06 af a7 f1 00 00 00 00
21 20 01 04 b5 22 16 78 03 0e 05 ae 51 43 ae 24
0e 50 54 00 00 00 01 01 01 01 01 01 01 01 01 01
01 01 01 01 01 01 f4 a6 80 a0 c0 d0 78 70 6c 30
aa 00 58 d7 10 00 00 18 00 00 00 fd 0c 30 a5 5f
5f 76 01 0a 20 20 20 20 20 20 00 00 00 fe 00 41
55 4f 0a 20 20 20 20 20 20 20 20 20 00 00 00 fe
00 42 31 36 30 51 41 4e 30 34 2e 53 20 0a 01 a2

70 12 79 00 00 03 01 28 f4 a6 00 85 7f 0c 9f 00
6b 00 2f 00 cf 07 77 00 09 00 09 00 1d cb 01 05
7f 0c 9f 00 6b 00 2f 00 cf 07 77 00 09 00 09 00
00 00 00 00 00 00 00 00 00 00 00 00 00 00 00 00
00 00 00 00 00 00 00 00 00 00 00 00 00 00 00 00
00 00 00 00 00 00 00 00 00 00 00 00 00 00 00 00
00 00 00 00 00 00 00 00 00 00 00 00 00 00 00 00
00 00 00 00 00 00 00 00 00 00 00 00 00 00 f6 90

00 ff ff ff ff ff ff 00 06 af a7 f1 00 00 00 00
21 20 01 04 b5 22 16 78 03 0e 05 ae 51 43 ae 24
0e 50 54 00 00 00 01 01 01 01 01 01 01 01 01 01
01 01 01 01 01 01 f4 a6 80 a0 c0 d0 78 70 6c 30
aa 00 58 d7 10 00 00 18 00 00 00 fd 0c 30 a5 5f
5f 76 01 0a 20 20 20 20 20 20 00 00 00 fe 00 41
55 4f 0a 20 20 20 20 20 20 20 20 20 00 00 00 fe
00 42 31 36 30 51 41 4e 30 34 2e 53 20 0a 01 a2

70 12 79 00 00 03 01 28 f4 a6 00 85 7f 0c 9f 00
6b 00 2f 00 cf 07 77 00 09 00 09 00 1d cb 01 05
7f 0c 9f 00 6b 00 2f 00 cf 07 77 00 09 00 09 00
00 00 00 00 00 00 00 00 00 00 00 00 00 00 00 00
00 00 00 00 00 00 00 00 00 00 00 00 00 00 00 00
00 00 00 00 00 00 00 00 00 00 00 00 00 00 00 00
00 00 00 00 00 00 00 00 00 00 00 00 00 00 00 00
00 00 00 00 00 00 00 00 00 00 00 00 00 00 f6 90

----------------

Block 0, Base EDID:
  EDID Structure Version & Revision: 1.4
  Vendor & Product Identification:
    Manufacturer: AUO
    Model: 61863
    Made in: week 33 of 2022
  Basic Display Parameters & Features:
    Digital display
    Bits per primary color channel: 10
    DisplayPort interface
    Maximum image size: 34 cm x 22 cm
    Gamma: 2.20
    Supported color formats: RGB 4:4:4
    First detailed timing includes the native pixel format and preferred refresh rate
    Display supports continuous frequencies
  Color Characteristics:
    Red  : 0.6796, 0.3164
    Green: 0.2646, 0.6816
    Blue : 0.1406, 0.0546
    White: 0.3134, 0.3291
  Established Timings I & II: none
  Standard Timings: none
  Detailed Timing Descriptors:
    DTD 1:  3200x2000   60.001123 Hz  16:10   127.202 kHz    427.400000 MHz (344 mm x 215 mm)
                 Hfront  108 Hsync  48 Hback    4 Hpol N
                 Vfront   10 Vsync  10 Vback  100 Vpol N
    Display Range Limits:
      Monitor ranges (Range Limits Only): 48-165 Hz V, 350-350 kHz H, max dotclock 1180 MHz
    Alphanumeric Data String: 'AUO'
    Alphanumeric Data String: 'B160QAN04.S '
  Extension blocks: 1
Checksum: 0xa2

----------------

Block 1, DisplayID Extension Block:
  Version: 1.2
  Extension Count: 0
  Display Product Type: Extension Section
  Video Timing Modes Type 1 - Detailed Timings Data Block:
    DTD:  3200x2000   60.002527 Hz  16:10   127.205 kHz    427.410000 MHz (aspect 16:10, no 3D stereo, preferred)
               Hfront  108 Hsync  48 Hback    4 Hpol N
               Vfront   10 Vsync  10 Vback  100 Vpol N
    DTD:  3200x2000  165.001685 Hz  16:10   349.804 kHz   1175.340000 MHz (aspect 16:10, no 3D stereo)
               Hfront  108 Hsync  48 Hback    4 Hpol N
               Vfront   10 Vsync  10 Vback  100 Vpol N
  Checksum: 0xf6
Checksum: 0x90

----------------

Block 2, Unknown EDID Extension Block 0x00:
  00 ff ff ff ff ff ff 00 06 af a7 f1 00 00 00 00 '................'
  21 20 01 04 b5 22 16 78 03 0e 05 ae 51 43 ae 24 '! ...".x....QC.$'
  0e 50 54 00 00 00 01 01 01 01 01 01 01 01 01 01 '.PT.............'
  01 01 01 01 01 01 f4 a6 80 a0 c0 d0 78 70 6c 30 '............xpl0'
  aa 00 58 d7 10 00 00 18 00 00 00 fd 0c 30 a5 5f '..X..........0._'
  5f 76 01 0a 20 20 20 20 20 20 00 00 00 fe 00 41 '_v..      .....A'
  55 4f 0a 20 20 20 20 20 20 20 20 20 00 00 00 fe 'UO.         ....'
  00 42 31 36 30 51 41 4e 30 34 2e 53 20 0a 01 a2 '.B160QAN04.S ...'
Checksum: 0xa2

----------------

Block 3, DisplayID Extension Block:
  Version: 1.2
  Extension Count: 0
  Video Timing Modes Type 1 - Detailed Timings Data Block:
    DTD:  3200x2000   60.002527 Hz  16:10   127.205 kHz    427.410000 MHz (aspect 16:10, no 3D stereo, preferred)
               Hfront  108 Hsync  48 Hback    4 Hpol N
               Vfront   10 Vsync  10 Vback  100 Vpol N
    DTD:  3200x2000  165.001685 Hz  16:10   349.804 kHz   1175.340000 MHz (aspect 16:10, no 3D stereo)
               Hfront  108 Hsync  48 Hback    4 Hpol N
               Vfront   10 Vsync  10 Vback  100 Vpol N
  Checksum: 0xf6
Checksum: 0x90

----------------

Warnings:

Block 0, Base EDID:
  Missing Display Product Name.
EDID:
  Base EDID: Some timings are out of range of the Monitor Ranges:
    Horizontal Freq: 127.202 - 349.803 kHz (Monitor: 350.000 - 350.000 kHz)

Failures:

Block 0, Base EDID:
  Alphanumeric Data String: One or more trailing spaces before newline.
Block 1, DisplayID Extension Block:
  DisplayID Base Block has no product type.
  Expected 0 DisplayID Extension Block, but got 1.
Block 2, Base EDID:
  Unknown Extension Block.
EDID:
  Base EDID: EDID specified 1 extension block(s), but found 3 extension block(s).

EDID conformity: FAIL
