edid-decode (hex):

00 ff ff ff ff ff ff 00 09 e5 79 0d 00 00 00 00
2a 22 01 04 a5 22 16 78 03 3d 35 ae 50 43 b1 25
0e 50 54 00 00 00 01 01 01 01 01 01 01 01 01 01
01 01 01 01 01 01 34 70 00 a0 a0 40 a0 60 30 20
36 00 59 d7 10 00 00 1a 00 00 00 00 00 00 00 00
00 00 00 00 00 00 00 00 00 00 00 00 00 fe 00 42
4f 45 20 43 51 0a 20 20 20 20 20 20 00 00 00 fc
00 4e 45 31 36 30 51 44 4d 2d 4e 5a 36 0a 01 2a

70 20 79 02 00 22 00 14 7f 0d 0c 85 ff 09 9f 00
2f 00 1f 00 3f 06 9f 00 02 00 05 00 25 01 09 7f
0d 0c 7f 0d 0c 3c a5 80 2b 00 0c 27 00 3c a4 00
00 27 00 30 3b 00 00 81 00 15 74 1a 00 00 03 01
3c a5 00 00 6a 42 6a 42 a5 00 00 00 00 00 00 21
01 1d 77 0d 6a 08 00 0a 40 06 88 e1 aa 50 3d 24
b1 51 d2 0e 02 35 54 d0 5f d0 5f 54 35 12 78 2e
00 06 40 4e d0 5f d0 5f 00 00 00 00 00 00 55 90

00 ff ff ff ff ff ff 00 09 e5 79 0d 00 00 00 00
2a 22 01 04 a5 22 16 78 03 3d 35 ae 50 43 b1 25
0e 50 54 00 00 00 01 01 01 01 01 01 01 01 01 01
01 01 01 01 01 01 34 70 00 a0 a0 40 a0 60 30 20
36 00 59 d7 10 00 00 1a 00 00 00 00 00 00 00 00
00 00 00 00 00 00 00 00 00 00 00 00 00 fe 00 42
4f 45 20 43 51 0a 20 20 20 20 20 20 00 00 00 fc
00 4e 45 31 36 30 51 44 4d 2d 4e 5a 36 0a 01 2a

70 20 79 02 00 22 00 14 7f 0d 0c 85 ff 09 9f 00
2f 00 1f 00 3f 06 9f 00 02 00 05 00 25 01 09 7f
0d 0c 7f 0d 0c 3c a5 80 2b 00 0c 27 00 3c a4 00
00 27 00 30 3b 00 00 81 00 15 74 1a 00 00 03 01
3c a5 00 00 6a 42 6a 42 a5 00 00 00 00 00 00 21
01 1d 77 0d 6a 08 00 0a 40 06 88 e1 aa 50 3d 24
b1 51 d2 0e 02 35 54 d0 5f d0 5f 54 35 12 78 2e
00 06 40 4e d0 5f d0 5f 00 00 00 00 00 00 55 90

----------------

Block 0, Base EDID:
  EDID Structure Version & Revision: 1.4
  Vendor & Product Identification:
    Manufacturer: BOE
    Model: 3449
    Made in: week 42 of 2024
  Basic Display Parameters & Features:
    Digital display
    Bits per primary color channel: 8
    DisplayPort interface
    Maximum image size: 34 cm x 22 cm
    Gamma: 2.20
    Supported color formats: RGB 4:4:4
    First detailed timing includes the native pixel format and preferred refresh rate
    Display supports continuous frequencies
  Color Characteristics:
    Red  : 0.6796, 0.3154
    Green: 0.2646, 0.6923
    Blue : 0.1445, 0.0576
    White: 0.3134, 0.3291
  Established Timings I & II: none
  Standard Timings: none
  Detailed Timing Descriptors:
    DTD 1:  2560x1600   60.001671 Hz  16:10   105.603 kHz    287.240000 MHz (345 mm x 215 mm)
                 Hfront   48 Hsync  32 Hback   80 Hpol P
                 Vfront    3 Vsync   6 Vback  151 Vpol N
    Empty Descriptor
    Alphanumeric Data String: 'BOE CQ'
    Display Product Name: 'NE160QDM-NZ6'
  Extension blocks: 1
Checksum: 0x2a

----------------

Block 1, DisplayID Extension Block:
  Version: 2.0
  Extension Count: 0
  Display Product Primary Use Case: None of the listed primary use cases; generic display
  Video Timing Modes Type 7 - Detailed Timings Data Block:
    DTD:  2560x1600  165.000000 Hz  16:10   290.400 kHz    789.888000 MHz (aspect 16:10, no 3D stereo, preferred)
               Hfront   48 Hsync  32 Hback   80 Hpol N
               Vfront    3 Vsync   6 Vback  151 Vpol N
  Dynamic Video Timing Range Limits Data Block:
    Minimum Pixel Clock: 789888 kHz
    Maximum Pixel Clock: 789888 kHz
    Minimum Vertical Refresh Rate: 60 Hz
    Maximum Vertical Refresh Rate: 165 Hz
    Seamless Dynamic Video Timing Support: Yes
  Adaptive Sync Data Block:
    Descriptor #1:
      Native Panel Range
      Fixed Average V-Total and Adaptive V-Total
      Supports Seamless Transition
      'Max Single Frame Duration Increase' field value without jitter impact
      'Max Single Frame Duration Decrease' field value without jitter impact
      Max Duration Increase: 0.00 ms
      Max Duration Decrease: 0.00 ms
      Min Refresh Rate: 60 Hz
      Max Refresh Rate: 165 Hz
    Descriptor #2:
      Native Panel Range
      Fixed Average V-Total and Adaptive V-Total
      Supports Seamless Transition
      'Max Single Frame Duration Increase' field value without jitter impact
      'Max Single Frame Duration Decrease' field value without jitter impact
      Max Duration Increase: 0.00 ms
      Max Duration Decrease: 0.00 ms
      Min Refresh Rate: 48 Hz
      Max Refresh Rate: 60 Hz
  CTA-861 DisplayID Data Block:
  Vendor-Specific Data Block (AMD), OUI 00-00-1A:
    Version: 3
    Feature Caps: 0x01
    Minimum Refresh Rate: 60 Hz
    Maximum Refresh Rate: 165 Hz
    Flags 1.x: 0x00
    Flags 2.x: 0x00
  Display Parameters Data Block (0x21):
    Image size: 344.7 mm x 215.4 mm
    Display native pixel format: 2560x1600
    Scan Orientation: Left to Right, Top to Bottom
    Luminance Information: Guidance for the Source device
    Color Information: CIE 1931
    Audio Speaker Information: not integrated
    Native Color Chromaticity:
      Primary #1:  (0.679932, 0.314941)
      Primary #2:  (0.264893, 0.691895)
      Primary #3:  (0.144775, 0.057861)
      White Point: (0.312988, 0.328857)
    Native Maximum Luminance (Full Coverage): 500.000000 cd/m^2
    Native Maximum Luminance (10% Rectangular Coverage): 500.000000 cd/m^2
    Native Minimum Luminance: 0.333008 cd/m^2
    Native Color Depth: 8 bpc
    Display Device Technology: Active Matrix LCD
    Display Device Theme Preference: No Preference
    Native Gamma EOTF: 2.20
  Brightness Luminance Range Data Block:
    Minimum SDR Luminance (Full Coverage): 25.000000 cd/m^2
    Maximum Suggested SDR Luminance (Full Coverage): 500.000000 cd/m^2
    Maximum Boost SDR Luminance: 500.000000 cd/m^2
  Checksum: 0x55
Checksum: 0x90

----------------

Failures:

Block 0, Base EDID:
  Empty Descriptor: Use Dummy Descriptor instead of all zeroes.
  Missing Display Range Limits Descriptor.
EDID:
  Extension Block 2 started with EDID header, ignoring Extension Blocks >= 2.

EDID conformity: FAIL
