edid-decode (hex):

00 ff ff ff ff ff ff 00 09 e5 c4 0b 00 00 00 00
28 20 01 04 b5 22 16 78 03 56 0e ae 51 43 b6 25
0d 51 57 00 00 00 01 01 01 01 01 01 01 01 01 01
01 01 01 01 01 01 34 70 00 a0 a0 40 a0 60 30 20
36 00 59 d7 10 00 00 1a 00 00 00 fd 0c 3c f0 a7
a7 73 01 0a 20 20 20 20 20 20 00 00 00 fe 00 42
4f 45 20 43 51 0a 20 20 20 20 20 20 00 00 00 fc
00 4e 45 31 36 30 51 44 4d 2d 4e 4d 34 0a 02 27

02 03 0f 00 e3 05 80 80 e6 06 05 01 95 73 10 00
00 00 00 00 00 00 00 00 00 00 00 00 00 00 00 00
00 00 00 00 00 00 00 00 00 00 00 00 00 00 00 00
00 00 00 00 00 00 00 00 00 00 00 00 00 00 00 00
00 00 00 00 00 00 00 00 00 00 00 00 00 00 00 00
00 00 00 00 00 00 00 00 00 00 00 00 00 00 00 00
00 00 00 00 00 00 00 00 00 00 00 00 00 00 00 00
00 00 00 00 00 00 00 00 00 00 00 00 00 00 00 fa

70 20 79 02 00 22 00 14 ff 87 11 85 ff 09 9f 00
2f 00 1f 00 3f 06 9f 00 02 00 05 00 2b 00 06 27
00 3c ef 00 00 81 00 15 74 1a 00 00 03 0b 3c f0
00 60 95 10 73 10 f0 00 00 00 00 8d 00 00 00 00
00 00 00 00 00 00 00 00 00 00 00 00 00 00 00 00
00 00 00 00 00 00 00 00 00 00 00 00 00 00 00 00
00 00 00 00 00 00 00 00 00 00 00 00 00 00 00 00
00 00 00 00 00 00 00 00 00 00 00 00 00 00 4d 90

00 ff ff ff ff ff ff 00 09 e5 c4 0b 00 00 00 00
28 20 01 04 b5 22 16 78 03 56 0e ae 51 43 b6 25
0d 51 57 00 00 00 01 01 01 01 01 01 01 01 01 01
01 01 01 01 01 01 34 70 00 a0 a0 40 a0 60 30 20
36 00 59 d7 10 00 00 1a 00 00 00 fd 0c 3c f0 a7
a7 73 01 0a 20 20 20 20 20 20 00 00 00 fe 00 42
4f 45 20 43 51 0a 20 20 20 20 20 20 00 00 00 fc
00 4e 45 31 36 30 51 44 4d 2d 4e 4d 34 0a 02 27

02 03 0f 00 e3 05 80 80 e6 06 05 01 95 73 10 00
00 00 00 00 00 00 00 00 00 00 00 00 00 00 00 00
00 00 00 00 00 00 00 00 00 00 00 00 00 00 00 00
00 00 00 00 00 00 00 00 00 00 00 00 00 00 00 00
00 00 00 00 00 00 00 00 00 00 00 00 00 00 00 00
00 00 00 00 00 00 00 00 00 00 00 00 00 00 00 00
00 00 00 00 00 00 00 00 00 00 00 00 00 00 00 00
00 00 00 00 00 00 00 00 00 00 00 00 00 00 00 fa

70 20 79 02 00 22 00 14 ff 87 11 85 ff 09 9f 00
2f 00 1f 00 3f 06 9f 00 02 00 05 00 2b 00 06 27
00 3c ef 00 00 81 00 15 74 1a 00 00 03 0b 3c f0
00 60 95 10 73 10 f0 00 00 00 00 8d 00 00 00 00
00 00 00 00 00 00 00 00 00 00 00 00 00 00 00 00
00 00 00 00 00 00 00 00 00 00 00 00 00 00 00 00
00 00 00 00 00 00 00 00 00 00 00 00 00 00 00 00
00 00 00 00 00 00 00 00 00 00 00 00 00 00 4d 90

----------------

Block 0, Base EDID:
  EDID Structure Version & Revision: 1.4
  Vendor & Product Identification:
    Manufacturer: BOE
    Model: 3012
    Made in: week 40 of 2022
  Basic Display Parameters & Features:
    Digital display
    Bits per primary color channel: 10
    DisplayPort interface
    Maximum image size: 34 cm x 22 cm
    Gamma: 2.20
    Supported color formats: RGB 4:4:4
    First detailed timing includes the native pixel format and preferred refresh rate
    Display supports continuous frequencies
  Color Characteristics:
    Red  : 0.6806, 0.3173
    Green: 0.2626, 0.7128
    Blue : 0.1445, 0.0507
    White: 0.3193, 0.3417
  Established Timings I & II: none
  Standard Timings: none
  Detailed Timing Descriptors:
    DTD 1:  2560x1600   60.001671 Hz  16:10   105.603 kHz    287.240000 MHz (345 mm x 215 mm)
                 Hfront   48 Hsync  32 Hback   80 Hpol P
                 Vfront    3 Vsync   6 Vback  151 Vpol N
    Display Range Limits:
      Monitor ranges (Range Limits Only): 60-240 Hz V, 422-422 kHz H, max dotclock 1150 MHz
    Alphanumeric Data String: 'BOE CQ'
    Display Product Name: 'NE160QDM-NM4'
  Extension blocks: 2
Checksum: 0x27

----------------

Block 1, CTA-861 Extension Block:
  Revision: 3
  Native detailed modes: 0
  Colorimetry Data Block:
    BT2020RGB
    ST2113RGB
  HDR Static Metadata Data Block:
    Electro optical transfer functions:
      Traditional gamma - SDR luminance range
      SMPTE ST2084
    Supported static metadata descriptors:
      Static metadata type 1
    Desired content max luminance: 149 (1260.785 cd/m^2)
    Desired content max frame-average luminance: 115 (603.666 cd/m^2)
    Desired content min luminance: 16 (0.050 cd/m^2)
Checksum: 0xfa  Unused space in Extension Block: 112 bytes

----------------

Block 2, DisplayID Extension Block:
  Version: 2.0
  Extension Count: 0
  Display Product Primary Use Case: None of the listed primary use cases; generic display
  Video Timing Modes Type 7 - Detailed Timings Data Block:
    DTD:  2560x1600  240.000000 Hz  16:10   422.400 kHz   1148.928000 MHz (aspect 16:10, no 3D stereo, preferred)
               Hfront   48 Hsync  32 Hback   80 Hpol N
               Vfront    3 Vsync   6 Vback  151 Vpol N
  Adaptive Sync Data Block:
    Descriptor #1:
      Native Panel Range
      Fixed Average V-Total and Adaptive V-Total
      Supports Seamless Transition
      'Max Single Frame Duration Increase' field value without jitter impact
      'Max Single Frame Duration Decrease' field value without jitter impact
      Max Duration Increase: 0.00 ms
      Max Duration Decrease: 0.00 ms
      Min Refresh Rate: 60 Hz
      Max Refresh Rate: 240 Hz
  CTA-861 DisplayID Data Block:
  Vendor-Specific Data Block (AMD), OUI 00-00-1A:
    Version: 3
    Feature Caps: 0x0b
      Local Dimming Supported
    Minimum Refresh Rate: 60 Hz
    Maximum Refresh Rate: 240 Hz
    Flags 1.x: 0x00
    Flags 2.x: 0x60
      ST 2084 (PQ) EOTF Supported
      Linear EOTF (Windows scRGB, 0.0 - 125.0) Supported
      BT.2020 Gamut Supported
    Maximum luminance: 149 (1260.785 cd/m^2)
    Minimum luminance: 16 (0.050 cd/m^2)
    Maximum luminance (without local dimming): 115 (603.666 cd/m^2)
    Minimum luminance (without local dimming): 16 (0.024 cd/m^2)
  Checksum: 0x4d
Checksum: 0x90

----------------

Block 3, Unknown EDID Extension Block 0x00:
  00 ff ff ff ff ff ff 00 09 e5 c4 0b 00 00 00 00 '................'
  28 20 01 04 b5 22 16 78 03 56 0e ae 51 43 b6 25 '( ...".x.V..QC.%'
  0d 51 57 00 00 00 01 01 01 01 01 01 01 01 01 01 '.QW.............'
  01 01 01 01 01 01 34 70 00 a0 a0 40 a0 60 30 20 '......4p...@.`0 '
  36 00 59 d7 10 00 00 1a 00 00 00 fd 0c 3c f0 a7 '6.Y..........<..'
  a7 73 01 0a 20 20 20 20 20 20 00 00 00 fe 00 42 '.s..      .....B'
  4f 45 20 43 51 0a 20 20 20 20 20 20 00 00 00 fc 'OE CQ.      ....'
  00 4e 45 31 36 30 51 44 4d 2d 4e 4d 34 0a 02 27 '.NE160QDM-NM4..''
Checksum: 0x27

----------------

Block 4, CTA-861 Extension Block:
  Revision: 3
  Native detailed modes: 0
  Colorimetry Data Block:
    BT2020RGB
    ST2113RGB
  HDR Static Metadata Data Block:
    Electro optical transfer functions:
      Traditional gamma - SDR luminance range
      SMPTE ST2084
    Supported static metadata descriptors:
      Static metadata type 1
    Desired content max luminance: 149 (1260.785 cd/m^2)
    Desired content max frame-average luminance: 115 (603.666 cd/m^2)
    Desired content min luminance: 16 (0.050 cd/m^2)
Checksum: 0xfa  Unused space in Extension Block: 112 bytes

----------------

Block 5, DisplayID Extension Block:
  Version: 2.0
  Extension Count: 0
  Video Timing Modes Type 7 - Detailed Timings Data Block:
    DTD:  2560x1600  240.000000 Hz  16:10   422.400 kHz   1148.928000 MHz (aspect 16:10, no 3D stereo, preferred)
               Hfront   48 Hsync  32 Hback   80 Hpol N
               Vfront    3 Vsync   6 Vback  151 Vpol N
  Adaptive Sync Data Block:
    Descriptor #1:
      Native Panel Range
      Fixed Average V-Total and Adaptive V-Total
      Supports Seamless Transition
      'Max Single Frame Duration Increase' field value without jitter impact
      'Max Single Frame Duration Decrease' field value without jitter impact
      Max Duration Increase: 0.00 ms
      Max Duration Decrease: 0.00 ms
      Min Refresh Rate: 60 Hz
      Max Refresh Rate: 240 Hz
  CTA-861 DisplayID Data Block:
  Vendor-Specific Data Block (AMD), OUI 00-00-1A:
    Version: 3
    Feature Caps: 0x0b
      Local Dimming Supported
    Minimum Refresh Rate: 60 Hz
    Maximum Refresh Rate: 240 Hz
    Flags 1.x: 0x00
    Flags 2.x: 0x60
      ST 2084 (PQ) EOTF Supported
      Linear EOTF (Windows scRGB, 0.0 - 125.0) Supported
      BT.2020 Gamut Supported
    Maximum luminance: 149 (1260.785 cd/m^2)
    Minimum luminance: 16 (0.050 cd/m^2)
    Maximum luminance (without local dimming): 115 (603.666 cd/m^2)
    Minimum luminance (without local dimming): 16 (0.024 cd/m^2)
  Checksum: 0x4d
Checksum: 0x90

----------------

Warnings:

Block 1, CTA-861 Extension Block:
  IT Video Formats are overscanned by default, but normally this should be underscanned.
  Colorimetry Data Block: Set the sRGB colorimetry bit to avoid interop issues.
Block 4, CTA-861 Extension Block:
  IT Video Formats are overscanned by default, but normally this should be underscanned.
  Colorimetry Data Block: Set the sRGB colorimetry bit to avoid interop issues.
EDID:
  Base EDID: Some timings are out of range of the Monitor Ranges:
    Horizontal Freq: 105.602 - 422.400 kHz (Monitor: 422.000 - 422.000 kHz)

Failures:

Block 1, CTA-861 Extension Block:
  Required 640x480p60 timings are missing in the established timings and the SVD list (VIC 1).
  Missing VCDB, needed for Set Selectable RGB Quantization to avoid interop issues.
Block 2, DisplayID Extension Block:
  Expected 0 DisplayID Extension Block, but got 1.
Block 3, Base EDID:
  Unknown Extension Block.
Block 4, CTA-861 Extension Block:
  Colorimetry Data Block: Only one instance of this Data Block is allowed.
  HDR Static Metadata Data Block: Only one instance of this Data Block is allowed.
Block 5, DisplayID Extension Block:
  Product Type should be 0 in extension block.
EDID:
  Base EDID: EDID specified 2 extension block(s), but found 5 extension block(s).
  DisplayID: Missing DisplayID Display Parameters Data Block.

EDID conformity: FAIL
