edid-decode (hex):

00 ff ff ff ff ff ff 00 25 17 85 1a ff e0 f5 05
1e 0f 01 03 68 00 00 7a aa bb b9 a3 52 46 98 24
0f 48 4c ad cf 00 01 01 01 01 01 01 01 01 01 01
01 01 01 01 01 01 30 2a 00 98 51 00 2a 40 30 70
23 00 20 20 00 00 00 00 00 00 00 fd 00 3a 4b 1e
50 0e 00 0a 20 20 20 20 20 20 00 00 00 fc 00 4e
54 31 37 30 0a 0a 0a 0a 0a 0a 0a 0a 00 00 00 ff
00 39 39 39 39 39 39 39 39 39 39 0a 0a 0a 00 a6

----------------

Block 0, Base EDID:
  EDID Structure Version & Revision: 1.3
  Vendor & Product Identification:
    Manufacturer: IHW
    Model: 6789
    Serial Number: ...
    Made in: week 30 of 2005
  Basic Display Parameters & Features:
    Analog display
    Signal Level Standard: 0.700 : 0.000 : 0.700 V p-p
    Blank level equals black level
    Sync: Separate
    Image size is variable
    Gamma: 2.22
    DPMS levels: Standby Off
    RGB color display
    First detailed timing is the preferred timing
  Color Characteristics:
    Red  : 0.6386, 0.3232
    Green: 0.2753, 0.5966
    Blue : 0.1425, 0.0615
    White: 0.2832, 0.2978
  Established Timings I & II:
    IBM     :   720x400    70.081663 Hz   9:5     31.467 kHz     28.320000 MHz
    DMT 0x04:   640x480    59.940476 Hz   4:3     31.469 kHz     25.175000 MHz
    DMT 0x05:   640x480    72.808802 Hz   4:3     37.861 kHz     31.500000 MHz
    DMT 0x06:   640x480    75.000000 Hz   4:3     37.500 kHz     31.500000 MHz
    DMT 0x09:   800x600    60.316541 Hz   4:3     37.879 kHz     40.000000 MHz
    DMT 0x0a:   800x600    72.187572 Hz   4:3     48.077 kHz     50.000000 MHz
    DMT 0x0b:   800x600    75.000000 Hz   4:3     46.875 kHz     49.500000 MHz
    DMT 0x10:  1024x768    60.003840 Hz   4:3     48.363 kHz     65.000000 MHz
    DMT 0x11:  1024x768    70.069359 Hz   4:3     56.476 kHz     75.000000 MHz
    DMT 0x12:  1024x768    75.028582 Hz   4:3     60.023 kHz     78.750000 MHz
    DMT 0x24:  1280x1024   75.024675 Hz   5:4     79.976 kHz    135.000000 MHz
  Standard Timings: none
  Detailed Timing Descriptors:
    DTD 1:  1280x1024   60.019740 Hz   5:4     63.981 kHz    108.000000 MHz (analog composite, sync-on-green, 32 mm x 32 mm)
                 Hfront   48 Hsync 112 Hback  248 Hpol N
                 Vfront    2 Vsync   3 Vback   37 Vpol N
    Display Range Limits:
      Monitor ranges (GTF): 58-75 Hz V, 30-80 kHz H, max dotclock 140 MHz
    Display Product Name: 'NT170'
    Display Product Serial Number: ...
Checksum: 0xa6

----------------

Warnings:

Block 0, Base EDID:
  Detailed Timing Descriptor #1: DTD is similar but not identical to DMT 0x23.
  Detailed Timing Descriptor #1: Dubious image size (32x32 mm is smaller than 100x100 mm).

Failures:

Block 0, Base EDID:
  Display Product Serial Number: ...
  Display Product Name: Non-space after newline.
EDID:
  Base EDID: The DTD max image size is 32x32mm, but the display size is not specified anywhere.

EDID conformity: FAIL
