edid-decode (hex):

00 ff ff ff ff ff ff 00 4e 8e 1c 00 35 31 42 4c
12 10 01 03 68 1b 14 78 2e ee 91 a3 54 4c 99 26
0f 50 54 bf e8 00 31 59 45 59 61 40 01 01 01 01
01 01 01 01 01 01 f9 15 20 f8 30 58 1f 20 20 40
13 00 0b c8 10 00 00 1e 00 00 00 fd 00 32 78 1e
37 07 00 0a 20 20 20 20 20 20 00 00 00 fc 00 53
41 4d 54 52 4f 4e 0a 20 20 20 20 20 00 00 00 ff
00 48 58 42 4c 35 30 31 38 37 32 0a 20 20 00 63

00 ff ff ff ff ff ff 00 4e 8e 1c 00 35 31 42 4c
12 10 01 03 68 1b 14 78 2e ee 91 a3 54 4c 99 26
0f 50 54 bf e8 00 31 59 45 59 61 40 01 01 01 01
01 01 01 01 01 01 f9 15 20 f8 30 58 1f 20 20 40
13 00 0b c8 10 00 00 1e 00 00 00 fd 00 32 78 1e
37 07 00 0a 20 20 20 20 20 20 00 00 00 fc 00 53
41 4d 54 52 4f 4e 0a 20 20 20 20 20 00 00 00 ff
00 48 58 42 4c 35 30 31 38 37 32 0a 20 20 00 63

----------------

Block 0, Base EDID:
  EDID Structure Version & Revision: 1.3
  Vendor & Product Identification:
    Manufacturer: STN
    Model: 28
    Serial Number: ...
    Made in: week 18 of 2006
  Basic Display Parameters & Features:
    Analog display
    Signal Level Standard: 0.700 : 0.000 : 0.700 V p-p
    Blank level equals black level
    Sync: Separate
    Maximum image size: 27 cm x 20 cm
    Gamma: 2.20
    DPMS levels: Off
    RGB color display
    Default (sRGB) color space is primary color space
    First detailed timing is the preferred timing
  Color Characteristics:
    Red  : 0.6396, 0.3300
    Green: 0.2998, 0.5996
    Blue : 0.1503, 0.0595
    White: 0.3125, 0.3291
  Established Timings I & II:
    IBM     :   720x400    70.081663 Hz   9:5     31.467 kHz     28.320000 MHz
    DMT 0x04:   640x480    59.940476 Hz   4:3     31.469 kHz     25.175000 MHz
    Apple   :   640x480    66.666667 Hz   4:3     35.000 kHz     30.240000 MHz
    DMT 0x05:   640x480    72.808802 Hz   4:3     37.861 kHz     31.500000 MHz
    DMT 0x06:   640x480    75.000000 Hz   4:3     37.500 kHz     31.500000 MHz
    DMT 0x08:   800x600    56.250000 Hz   4:3     35.156 kHz     36.000000 MHz
    DMT 0x09:   800x600    60.316541 Hz   4:3     37.879 kHz     40.000000 MHz
    DMT 0x0a:   800x600    72.187572 Hz   4:3     48.077 kHz     50.000000 MHz
    DMT 0x0b:   800x600    75.000000 Hz   4:3     46.875 kHz     49.500000 MHz
    Apple   :   832x624    74.551266 Hz   4:3     49.726 kHz     57.284000 MHz
    DMT 0x10:  1024x768    60.003840 Hz   4:3     48.363 kHz     65.000000 MHz
  Standard Timings:
    DMT 0x07:   640x480    85.008312 Hz   4:3     43.269 kHz     36.000000 MHz
    DMT 0x0c:   800x600    85.061274 Hz   4:3     53.674 kHz     56.250000 MHz
    DMT 0x10:  1024x768    60.003840 Hz   4:3     48.363 kHz     65.000000 MHz
  Detailed Timing Descriptors:
    DTD 1:   800x600    85.061274 Hz   4:3     53.674 kHz     56.250000 MHz (267 mm x 200 mm)
                 Hfront   32 Hsync  64 Hback  152 Hpol P
                 Vfront    1 Vsync   3 Vback   27 Vpol P
    Display Range Limits:
      Monitor ranges (GTF): 50-120 Hz V, 30-55 kHz H, max dotclock 70 MHz
    Display Product Name: 'SAMTRON'
    Display Product Serial Number: ...
Checksum: 0x63

----------------

Failures:

EDID:
  Extension Block 1 started with EDID header, ignoring Extension Blocks >= 1.

EDID conformity: FAIL
