edid-decode (hex):

00 ff ff ff ff ff ff 00 02 96 01 00 01 01 01 01
28 16 01 03 80 59 32 78 0a 0d c9 a0 57 47 98 27
12 48 4c 21 08 00 31 40 45 40 61 40 81 00 01 01
81 80 d1 c0 01 01 02 3a 80 18 71 38 2d 40 58 2c
45 00 75 f2 31 00 00 1e 66 21 56 b0 51 00 1b 30
40 70 36 00 75 f2 31 00 00 9e 00 00 00 fc 00 54
56 0a 20 20 20 20 20 20 20 20 20 20 00 00 00 fd
00 31 4c 0f 50 0e 00 0a 20 20 20 20 20 20 01 fa

02 03 27 71 4d 01 03 04 05 07 90 12 13 14 16 1f
20 22 23 09 7f 07 83 01 00 00 6c 03 0c 00 10 00
b8 2d c0 0c 0c 0c 0c 02 3a 80 18 71 38 2d 40 58
2c 45 00 c4 8e 21 00 00 1e 01 1d 00 72 51 d0 1e
20 6e 28 55 00 c4 8e 21 00 00 1e 01 1d 80 18 71
1c 16 20 58 2c 25 00 c4 8e 21 00 00 9e 01 1d 80
d0 72 1c 16 20 10 2c 25 80 c4 8e 21 00 00 9e 00
00 00 00 00 00 00 00 00 00 00 00 00 00 00 00 26

00 ff ff ff ff ff ff 00 02 96 01 00 01 01 01 01
28 16 01 03 80 59 32 78 0a 0d c9 a0 57 47 98 27
12 48 4c 21 08 00 31 40 45 40 61 40 81 00 01 01
81 80 d1 c0 01 01 02 3a 80 18 71 38 2d 40 58 2c
45 00 75 f2 31 00 00 1e 66 21 56 b0 51 00 1b 30
40 70 36 00 75 f2 31 00 00 9e 00 00 00 fc 00 54
56 0a 20 20 20 20 20 20 20 20 20 20 00 00 00 fd
00 31 4c 0f 50 0e 00 0a 20 20 20 20 20 20 01 fa

02 03 27 71 4d 01 03 04 05 07 90 12 13 14 16 1f
20 22 23 09 7f 07 83 01 00 00 6c 03 0c 00 10 00
b8 2d c0 0c 0c 0c 0c 02 3a 80 18 71 38 2d 40 58
2c 45 00 c4 8e 21 00 00 1e 01 1d 00 72 51 d0 1e
20 6e 28 55 00 c4 8e 21 00 00 1e 01 1d 80 18 71
1c 16 20 58 2c 25 00 c4 8e 21 00 00 9e 01 1d 80
d0 72 1c 16 20 10 2c 25 80 c4 8e 21 00 00 9e 00
00 00 00 00 00 00 00 00 00 00 00 00 00 00 00 26

----------------

Block 0, Base EDID:
  EDID Structure Version & Revision: 1.3
  Vendor & Product Identification:
    Manufacturer: @TV
    Model: 1
    Serial Number: ...
    Made in: week 40 of 2012
  Basic Display Parameters & Features:
    Digital display
    Maximum image size: 89 cm x 50 cm
    Gamma: 2.20
    RGB color display
    First detailed timing is the preferred timing
  Color Characteristics:
    Red  : 0.6250, 0.3398
    Green: 0.2802, 0.5947
    Blue : 0.1552, 0.0703
    White: 0.2832, 0.2978
  Established Timings I & II:
    DMT 0x04:   640x480    59.940476 Hz   4:3     31.469 kHz     25.175000 MHz
    DMT 0x09:   800x600    60.316541 Hz   4:3     37.879 kHz     40.000000 MHz
    DMT 0x10:  1024x768    60.003840 Hz   4:3     48.363 kHz     65.000000 MHz
  Standard Timings:
    DMT 0x04:   640x480    59.940476 Hz   4:3     31.469 kHz     25.175000 MHz
    DMT 0x09:   800x600    60.316541 Hz   4:3     37.879 kHz     40.000000 MHz
    DMT 0x10:  1024x768    60.003840 Hz   4:3     48.363 kHz     65.000000 MHz
    DMT 0x1c:  1280x800    59.810326 Hz  16:10    49.702 kHz     83.500000 MHz
    DMT 0x23:  1280x1024   60.019740 Hz   5:4     63.981 kHz    108.000000 MHz
    DMT 0x52:  1920x1080   60.000000 Hz  16:9     67.500 kHz    148.500000 MHz
  Detailed Timing Descriptors:
    DTD 1:  1920x1080   60.000000 Hz  16:9     67.500 kHz    148.500000 MHz (885 mm x 498 mm)
                 Hfront   88 Hsync  44 Hback  148 Hpol P
                 Vfront    4 Vsync   5 Vback   36 Vpol P
    DTD 2:  1366x1536i  59.777293 Hz 683:768   47.553 kHz     85.500000 MHz (885 mm x 498 mm)
                 Hfront   64 Hsync 112 Hback  256 Hpol P
                 Vfront    3 Vsync   6 Vback   18 Vpol P Vfront +0.5 Odd Field
                 Vfront    3 Vsync   6 Vback   18 Vpol P Vback  +0.5 Even Field
    Display Product Name: 'TV'
    Display Range Limits:
      Monitor ranges (GTF): 49-76 Hz V, 15-80 kHz H, max dotclock 140 MHz
  Extension blocks: 1
Checksum: 0xfa

----------------

Block 1, CTA-861 Extension Block:
  Revision: 3
  Basic audio support
  Supports YCbCr 4:4:4
  Supports YCbCr 4:2:2
  Native DTDs: 1
  Video Data Block:
    VIC   1:   640x480    59.940476 Hz   4:3     31.469 kHz     25.175000 MHz
    VIC   3:   720x480    59.940060 Hz  16:9     31.469 kHz     27.000000 MHz
    VIC   4:  1280x720    60.000000 Hz  16:9     45.000 kHz     74.250000 MHz
    VIC   5:  1920x1080i  60.000000 Hz  16:9     33.750 kHz     74.250000 MHz
    VIC   7:  1440x480i   59.940060 Hz  16:9     15.734 kHz     27.000000 MHz
    VIC  16:  1920x1080   60.000000 Hz  16:9     67.500 kHz    148.500000 MHz (native)
    VIC  18:   720x576    50.000000 Hz  16:9     31.250 kHz     27.000000 MHz
    VIC  19:  1280x720    50.000000 Hz  16:9     37.500 kHz     74.250000 MHz
    VIC  20:  1920x1080i  50.000000 Hz  16:9     28.125 kHz     74.250000 MHz
    VIC  22:  1440x576i   50.000000 Hz  16:9     15.625 kHz     27.000000 MHz
    VIC  31:  1920x1080   50.000000 Hz  16:9     56.250 kHz    148.500000 MHz
    VIC  32:  1920x1080   24.000000 Hz  16:9     27.000 kHz     74.250000 MHz
    VIC  34:  1920x1080   30.000000 Hz  16:9     33.750 kHz     74.250000 MHz
  Audio Data Block:
    Linear PCM:
      Max channels: 2
      Supported sample rates (kHz): 192 176.4 96 88.2 48 44.1 32
      Supported sample sizes (bits): 24 20 16
  Speaker Allocation Data Block:
    FL/FR - Front Left/Right
  Vendor-Specific Data Block (HDMI), OUI 00-0C-03:
    Source physical address: 1.0.0.0
    Supports_AI
    DC_36bit
    DC_30bit
    DC_Y444
    Maximum TMDS clock: 225 MHz
    Video latency: 22 ms
    Audio latency: 22 ms
    Interlaced video latency: 22 ms
    Interlaced audio latency: 22 ms
  Detailed Timing Descriptors:
    DTD 3:  1920x1080   60.000000 Hz  16:9     67.500 kHz    148.500000 MHz (708 mm x 398 mm)
                 Hfront   88 Hsync  44 Hback  148 Hpol P
                 Vfront    4 Vsync   5 Vback   36 Vpol P
    DTD 4:  1280x720    60.000000 Hz  16:9     45.000 kHz     74.250000 MHz (708 mm x 398 mm)
                 Hfront  110 Hsync  40 Hback  220 Hpol P
                 Vfront    5 Vsync   5 Vback   20 Vpol P
    DTD 5:  1920x1080i  60.000000 Hz  16:9     33.750 kHz     74.250000 MHz (708 mm x 398 mm)
                 Hfront   88 Hsync  44 Hback  148 Hpol P
                 Vfront    2 Vsync   5 Vback   15 Vpol P Vfront +0.5 Odd Field
                 Vfront    2 Vsync   5 Vback   15 Vpol P Vback  +0.5 Even Field
    DTD 6:  1920x1080i  50.000000 Hz  16:9     28.125 kHz     74.250000 MHz (708 mm x 398 mm)
                 Hfront  528 Hsync  44 Hback  148 Hpol P
                 Vfront    2 Vsync   5 Vback   15 Vpol P Vfront +0.5 Odd Field
                 Vfront    2 Vsync   5 Vback   15 Vpol P Vback  +0.5 Even Field
Checksum: 0x26  Unused space in Extension Block: 16 bytes

----------------

Warnings:

Block 0, Base EDID:
  Vendor & Product Identification: The serial number is one of the known dummy values, it should probably be set to 0.
  Detailed Timing Descriptor #2: Image size is 885x498 mm, but based on the picture AR it should be 442x498 mm.
Block 1, CTA-861 Extension Block:
  IT Video Formats are overscanned by default, but normally this should be underscanned.
  Video Data Block: VIC 1 and the first DTD are not identical. Is this intended?
  Video Data Block: All VICs are in ascending order, and the first (preferred) VIC <= 4, is that intended?
  Vendor-Specific Data Block (HDMI), OUI 00-0C-03: Progressive and Interlaced latency values are identical, no need for both.
  Add a Colorimetry Data Block with the sRGB colorimetry bit set to avoid interop issues.
EDID:
  Base EDID: Some timings are out of range of the Monitor Ranges:
    Vertical Freq: 24.000 - 60.317 Hz (Monitor: 49.000 - 76.000 Hz)
    Maximum Clock: 148.500 MHz (Monitor: 140.000 MHz)

Failures:

Block 0, Base EDID:
  Vendor & Product Identification: Manufacturer name field contains garbage.
Block 1, CTA-861 Extension Block:
  Detailed Timing Descriptor #3: Mismatch of image size 708x398 mm vs display size 890x500 mm.
  Detailed Timing Descriptor #4: Mismatch of image size 708x398 mm vs display size 890x500 mm.
  Detailed Timing Descriptor #5: Mismatch of image size 708x398 mm vs display size 890x500 mm.
  Detailed Timing Descriptor #6: Mismatch of image size 708x398 mm vs display size 890x500 mm.
  Missing VCDB, needed for Set Selectable RGB Quantization to avoid interop issues.
EDID:
  Extension Block 2 started with EDID header, ignoring Extension Blocks >= 2.

EDID conformity: FAIL
