edid-decode (hex):

00 ff ff ff ff ff ff 00 09 e5 45 0b 02 00 00 00
10 20 01 04 b5 22 16 78 03 41 05 96 5e 5a 94 29
1f 50 54 00 00 00 01 01 01 01 01 01 01 01 01 01
01 01 01 01 01 01 cd 9f 80 d8 70 b0 82 40 30 20
36 00 59 d7 10 00 00 1a 00 00 00 00 00 00 00 00
00 00 00 00 00 00 00 00 00 00 00 00 00 fd 00 30
90 c0 c0 29 01 0a 20 20 20 20 20 20 00 00 00 fe
00 4e 56 31 36 30 57 55 4d 2d 4e 58 33 0a 00 0c

00 ff ff ff ff ff ff 00 09 e5 45 0b 02 00 00 00
10 20 01 04 b5 22 16 78 03 41 05 96 5e 5a 94 29
1f 50 54 00 00 00 01 01 01 01 01 01 01 01 01 01
01 01 01 01 01 01 cd 9f 80 d8 70 b0 82 40 30 20
36 00 59 d7 10 00 00 1a 00 00 00 00 00 00 00 00
00 00 00 00 00 00 00 00 00 00 00 00 00 fd 00 30
90 c0 c0 29 01 0a 20 20 20 20 20 20 00 00 00 fe
00 4e 56 31 36 30 57 55 4d 2d 4e 58 33 0a 00 0c

----------------

Block 0, Base EDID:
  EDID Structure Version & Revision: 1.4
  Vendor & Product Identification:
    Manufacturer: BOE
    Model: 2885
    Serial Number: ...
    Made in: week 16 of 2022
  Basic Display Parameters & Features:
    Digital display
    Bits per primary color channel: 10
    DisplayPort interface
    Maximum image size: 34 cm x 22 cm
    Gamma: 2.20
    Supported color formats: RGB 4:4:4
    First detailed timing includes the native pixel format and preferred refresh rate
    Display supports continuous frequencies
  Color Characteristics:
    Red  : 0.5869, 0.3671
    Green: 0.3515, 0.5791
    Blue : 0.1601, 0.1210
    White: 0.3134, 0.3291
  Established Timings I & II: none
  Standard Timings: none
  Detailed Timing Descriptors:
    DTD 1:  1920x1200  144.001155 Hz  16:10   191.522 kHz    409.090000 MHz (345 mm x 215 mm)
                 Hfront   48 Hsync  32 Hback  136 Hpol P
                 Vfront    3 Vsync   6 Vback  121 Vpol N
    Empty Descriptor
    Display Range Limits:
      Monitor ranges (Range Limits Only): 48-144 Hz V, 192-192 kHz H, max dotclock 410 MHz
    Alphanumeric Data String: 'NV160WUM-NX3'
Checksum: 0x0c

----------------

Warnings:

Block 0, Base EDID:
  Missing Display Product Name.

Failures:

Block 0, Base EDID:
  Empty Descriptor: Use Dummy Descriptor instead of all zeroes.
EDID:
  Extension Block 1 started with EDID header, ignoring Extension Blocks >= 1.

EDID conformity: FAIL
