edid-decode (hex):

00 ff ff ff ff ff ff 00 4c 2d ae 74 57 44 53 30
32 21 01 04 b5 77 22 78 3b 12 45 ac 52 48 a7 27
10 50 54 25 cf 00 71 4f 81 00 81 c0 81 80 a9 c0
b3 00 95 00 d1 c0 1a 68 00 a0 f0 38 1f 40 30 20
3a 00 a9 50 41 00 00 1a 00 00 00 fd 0c 60 f0 66
66 c2 01 0a 20 20 20 20 20 20 00 00 00 fc 00 4f
64 79 73 73 65 79 20 47 39 35 43 0a 00 00 00 ff
00 48 4e 54 57 43 30 30 30 35 30 0a 20 20 02 11

02 03 2f f0 43 10 04 03 23 09 07 07 83 01 00 00
e3 05 c0 00 6d 1a 00 00 02 0f 60 f0 00 04 8b 19
73 21 e6 06 05 01 8b 73 02 e5 01 8b 84 90 79 1a
68 00 a0 f0 38 1f 40 30 20 3a 00 a9 50 41 00 00
1a 56 5e 00 a0 a0 a0 29 50 30 20 35 00 a9 50 41
00 00 1a 2d d6 80 78 70 38 29 40 1c 20 3a 00 a9
50 41 00 00 1a 00 00 00 00 00 00 00 00 00 00 00
00 00 00 00 00 00 00 00 00 00 00 00 00 00 00 c5

70 12 79 03 00 03 01 50 9c f5 02 88 ff 13 3f 01
7f 80 1f 00 9f 05 2e 00 02 00 09 00 33 b7 00 08
ff 13 9f 00 2f 80 1f 00 9f 05 28 00 02 00 09 00
7c 91 01 08 ff 09 3f 01 7f 80 1f 00 9f 05 2e 00
02 00 09 00 0d af 01 08 ff 0e 17 01 6b 80 1f 00
37 04 23 00 02 00 09 00 00 00 00 00 00 00 00 00
00 00 00 00 00 00 00 00 00 00 00 00 00 00 00 00
00 00 00 00 00 00 00 00 00 00 00 00 00 00 b8 90

00 ff ff ff ff ff ff 00 4c 2d ae 74 57 44 53 30
32 21 01 04 b5 77 22 78 3b 12 45 ac 52 48 a7 27
10 50 54 25 cf 00 71 4f 81 00 81 c0 81 80 a9 c0
b3 00 95 00 d1 c0 1a 68 00 a0 f0 38 1f 40 30 20
3a 00 a9 50 41 00 00 1a 00 00 00 fd 0c 60 f0 66
66 c2 01 0a 20 20 20 20 20 20 00 00 00 fc 00 4f
64 79 73 73 65 79 20 47 39 35 43 0a 00 00 00 ff
00 48 4e 54 57 43 30 30 30 35 30 0a 20 20 02 11

02 03 2f f0 43 10 04 03 23 09 07 07 83 01 00 00
e3 05 c0 00 6d 1a 00 00 02 0f 60 f0 00 04 8b 19
73 21 e6 06 05 01 8b 73 02 e5 01 8b 84 90 79 1a
68 00 a0 f0 38 1f 40 30 20 3a 00 a9 50 41 00 00
1a 56 5e 00 a0 a0 a0 29 50 30 20 35 00 a9 50 41
00 00 1a 2d d6 80 78 70 38 29 40 1c 20 3a 00 a9
50 41 00 00 1a 00 00 00 00 00 00 00 00 00 00 00
00 00 00 00 00 00 00 00 00 00 00 00 00 00 00 c5

70 12 79 03 00 03 01 50 9c f5 02 88 ff 13 3f 01
7f 80 1f 00 9f 05 2e 00 02 00 09 00 33 b7 00 08
ff 13 9f 00 2f 80 1f 00 9f 05 28 00 02 00 09 00
7c 91 01 08 ff 09 3f 01 7f 80 1f 00 9f 05 2e 00
02 00 09 00 0d af 01 08 ff 0e 17 01 6b 80 1f 00
37 04 23 00 02 00 09 00 00 00 00 00 00 00 00 00
00 00 00 00 00 00 00 00 00 00 00 00 00 00 00 00
00 00 00 00 00 00 00 00 00 00 00 00 00 00 b8 90

----------------

Block 0, Base EDID:
  EDID Structure Version & Revision: 1.4
  Vendor & Product Identification:
    Manufacturer: SAM
    Model: 29870
    Serial Number: ...
    Made in: week 50 of 2023
  Basic Display Parameters & Features:
    Digital display
    Bits per primary color channel: 10
    DisplayPort interface
    Maximum image size: 119 cm x 34 cm
    Gamma: 2.20
    DPMS levels: Off
    Supported color formats: RGB 4:4:4, YCrCb 4:4:4, YCrCb 4:2:2
    First detailed timing includes the native pixel format and preferred refresh rate
    Display supports continuous frequencies
  Color Characteristics:
    Red  : 0.6718, 0.3212
    Green: 0.2812, 0.6542
    Blue : 0.1533, 0.0625
    White: 0.3134, 0.3291
  Established Timings I & II:
    DMT 0x04:   640x480    59.940476 Hz   4:3     31.469 kHz     25.175000 MHz
    DMT 0x06:   640x480    75.000000 Hz   4:3     37.500 kHz     31.500000 MHz
    DMT 0x09:   800x600    60.316541 Hz   4:3     37.879 kHz     40.000000 MHz
    DMT 0x0a:   800x600    72.187572 Hz   4:3     48.077 kHz     50.000000 MHz
    DMT 0x0b:   800x600    75.000000 Hz   4:3     46.875 kHz     49.500000 MHz
    DMT 0x10:  1024x768    60.003840 Hz   4:3     48.363 kHz     65.000000 MHz
    DMT 0x11:  1024x768    70.069359 Hz   4:3     56.476 kHz     75.000000 MHz
    DMT 0x12:  1024x768    75.028582 Hz   4:3     60.023 kHz     78.750000 MHz
    DMT 0x24:  1280x1024   75.024675 Hz   5:4     79.976 kHz    135.000000 MHz
  Standard Timings:
    DMT 0x15:  1152x864    75.000000 Hz   4:3     67.500 kHz    108.000000 MHz
    DMT 0x1c:  1280x800    59.810326 Hz  16:10    49.702 kHz     83.500000 MHz
    DMT 0x55:  1280x720    60.000000 Hz  16:9     45.000 kHz     74.250000 MHz
    DMT 0x23:  1280x1024   60.019740 Hz   5:4     63.981 kHz    108.000000 MHz
    DMT 0x53:  1600x900    60.000000 Hz  16:9     60.000 kHz    108.000000 MHz (RB)
    DMT 0x3a:  1680x1050   59.954250 Hz  16:10    65.290 kHz    146.250000 MHz
    DMT 0x2f:  1440x900    59.887445 Hz  16:10    55.935 kHz    106.500000 MHz
    DMT 0x52:  1920x1080   60.000000 Hz  16:9     67.500 kHz    148.500000 MHz
  Detailed Timing Descriptors:
    DTD 1:  3840x1080   59.968497 Hz  32:9     66.625 kHz    266.500000 MHz (1193 mm x 336 mm)
                 Hfront   48 Hsync  32 Hback   80 Hpol P
                 Vfront    3 Vsync  10 Vback   18 Vpol N
    Display Range Limits:
      Monitor ranges (Range Limits Only): 96-240 Hz V, 357-357 kHz H, max dotclock 1940 MHz
    Display Product Name: 'Odyssey G95C'
    Display Product Serial Number: ...
  Extension blocks: 2
Checksum: 0x11

----------------

Block 1, CTA-861 Extension Block:
  Revision: 3
  Underscans IT Video Formats by default
  Basic audio support
  Supports YCbCr 4:4:4
  Supports YCbCr 4:2:2
  Native detailed modes: 0
  Video Data Block:
    VIC  16:  1920x1080   60.000000 Hz  16:9     67.500 kHz    148.500000 MHz
    VIC   4:  1280x720    60.000000 Hz  16:9     45.000 kHz     74.250000 MHz
    VIC   3:   720x480    59.940060 Hz  16:9     31.469 kHz     27.000000 MHz
  Audio Data Block:
    Linear PCM:
      Max channels: 2
      Supported sample rates (kHz): 48 44.1 32
      Supported sample sizes (bits): 24 20 16
  Speaker Allocation Data Block:
    FL/FR - Front Left/Right
  Colorimetry Data Block:
    BT2020YCC
    BT2020RGB
  Vendor-Specific Data Block (AMD), OUI 00-00-1A:
    Version: 2
    Feature Caps: 0x0f
      Global Backlight Control Supported
      Local Dimming Supported
    Minimum Refresh Rate: 96 Hz
    Maximum Refresh Rate: 240 Hz
    Flags 1.x: 0x00
    Flags 2.x: 0x04
      ST 2084 (PQ) EOTF Supported
      Linear EOTF (Windows scRGB, 0.0 - 125.0) Supported
      Gamma 2.2 EOTF Supported
      BT.2020 Gamut Supported
    Maximum luminance: 139 (1015.241 cd/m^2)
    Minimum luminance: 25 (0.098 cd/m^2)
    Maximum luminance (without local dimming): 115 (603.666 cd/m^2)
    Minimum luminance (without local dimming): 33 (0.101 cd/m^2)
  HDR Static Metadata Data Block:
    Electro optical transfer functions:
      Traditional gamma - SDR luminance range
      SMPTE ST2084
    Supported static metadata descriptors:
      Static metadata type 1
    Desired content max luminance: 139 (1015.241 cd/m^2)
    Desired content max frame-average luminance: 115 (603.666 cd/m^2)
    Desired content min luminance: 2 (0.001 cd/m^2)
  Vendor-Specific Video Data Block (HDR10+), OUI 90-84-8B:
    Application Version: 1
    Full Frame Peak Luminance Index: 2
    Peak Luminance Index: 7
  Detailed Timing Descriptors:
    DTD 2:  3840x1080   59.968497 Hz  32:9     66.625 kHz    266.500000 MHz (1193 mm x 336 mm)
                 Hfront   48 Hsync  32 Hback   80 Hpol P
                 Vfront    3 Vsync  10 Vback   18 Vpol N
    DTD 3:  2560x1440   59.950550 Hz  16:9     88.787 kHz    241.500000 MHz (1193 mm x 336 mm)
                 Hfront   48 Hsync  32 Hback   80 Hpol P
                 Vfront    3 Vsync   5 Vback   33 Vpol N
    DTD 4:  1920x1080  239.758794 Hz  16:9    268.770 kHz    548.290000 MHz (1193 mm x 336 mm)
                 Hfront   28 Hsync  32 Hback   60 Hpol P
                 Vfront    3 Vsync  10 Vback   28 Vpol N
Checksum: 0xc5  Unused space in Extension Block: 26 bytes

----------------

Block 2, DisplayID Extension Block:
  Version: 1.2
  Extension Count: 0
  Display Product Type: Standalone display device
  Video Timing Modes Type 1 - Detailed Timings Data Block:
    DTD:  5120x1440  239.760523 Hz   0:0    356.524 kHz   1939.490000 MHz (aspect undefined, no 3D stereo, preferred)
               Hfront  128 Hsync  32 Hback  160 Hpol P
               Vfront    3 Vsync  10 Vback   34 Vpol N
    DTD:  5120x1440   59.976879 Hz   0:0     88.826 kHz    469.000000 MHz (aspect undefined, no 3D stereo)
               Hfront   48 Hsync  32 Hback   80 Hpol P
               Vfront    3 Vsync  10 Vback   28 Vpol N
    DTD:  2560x1440  239.998973 Hz   0:0    356.878 kHz   1027.810000 MHz (aspect undefined, no 3D stereo)
               Hfront  128 Hsync  32 Hback  160 Hpol P
               Vfront    3 Vsync  10 Vback   34 Vpol N
    DTD:  3840x1080  239.999826 Hz   0:0    267.840 kHz   1103.500000 MHz (aspect undefined, no 3D stereo)
               Hfront  108 Hsync  32 Hback  140 Hpol P
               Vfront    3 Vsync  10 Vback   23 Vpol N
  Checksum: 0xb8
Checksum: 0x90

----------------

Block 3, Unknown EDID Extension Block 0x00:
  00 ff ff ff ff ff ff 00 4c 2d ae 74 57 44 53 30 '........L-.tWDS0'
  32 21 01 04 b5 77 22 78 3b 12 45 ac 52 48 a7 27 '2!...w"x;.E.RH.''
  10 50 54 25 cf 00 71 4f 81 00 81 c0 81 80 a9 c0 '.PT%..qO........'
  b3 00 95 00 d1 c0 1a 68 00 a0 f0 38 1f 40 30 20 '.......h...8.@0 '
  3a 00 a9 50 41 00 00 1a 00 00 00 fd 0c 60 f0 66 ':..PA........`.f'
  66 c2 01 0a 20 20 20 20 20 20 00 00 00 fc 00 4f 'f...      .....O'
  64 79 73 73 65 79 20 47 39 35 43 0a 00 00 00 ff 'dyssey G95C.....'
  00 48 4e 54 57 43 30 30 30 35 30 0a 20 20 02 11 '.HNTWC00050.  ..'
Checksum: 0x11

----------------

Block 4, CTA-861 Extension Block:
  Revision: 3
  Underscans IT Video Formats by default
  Basic audio support
  Supports YCbCr 4:4:4
  Supports YCbCr 4:2:2
  Native detailed modes: 0
  Video Data Block:
    VIC  16:  1920x1080   60.000000 Hz  16:9     67.500 kHz    148.500000 MHz
    VIC   4:  1280x720    60.000000 Hz  16:9     45.000 kHz     74.250000 MHz
    VIC   3:   720x480    59.940060 Hz  16:9     31.469 kHz     27.000000 MHz
  Audio Data Block:
    Linear PCM:
      Max channels: 2
      Supported sample rates (kHz): 48 44.1 32
      Supported sample sizes (bits): 24 20 16
  Speaker Allocation Data Block:
    FL/FR - Front Left/Right
  Colorimetry Data Block:
    BT2020YCC
    BT2020RGB
  Vendor-Specific Data Block (AMD), OUI 00-00-1A:
    Version: 2
    Feature Caps: 0x0f
      Global Backlight Control Supported
      Local Dimming Supported
    Minimum Refresh Rate: 96 Hz
    Maximum Refresh Rate: 240 Hz
    Flags 1.x: 0x00
    Flags 2.x: 0x04
      ST 2084 (PQ) EOTF Supported
      Linear EOTF (Windows scRGB, 0.0 - 125.0) Supported
      Gamma 2.2 EOTF Supported
      BT.2020 Gamut Supported
    Maximum luminance: 139 (1015.241 cd/m^2)
    Minimum luminance: 25 (0.098 cd/m^2)
    Maximum luminance (without local dimming): 115 (603.666 cd/m^2)
    Minimum luminance (without local dimming): 33 (0.101 cd/m^2)
  HDR Static Metadata Data Block:
    Electro optical transfer functions:
      Traditional gamma - SDR luminance range
      SMPTE ST2084
    Supported static metadata descriptors:
      Static metadata type 1
    Desired content max luminance: 139 (1015.241 cd/m^2)
    Desired content max frame-average luminance: 115 (603.666 cd/m^2)
    Desired content min luminance: 2 (0.001 cd/m^2)
  Vendor-Specific Video Data Block (HDR10+), OUI 90-84-8B:
    Application Version: 1
    Full Frame Peak Luminance Index: 2
    Peak Luminance Index: 7
  Detailed Timing Descriptors:
    DTD 5:  3840x1080   59.968497 Hz  32:9     66.625 kHz    266.500000 MHz (1193 mm x 336 mm)
                 Hfront   48 Hsync  32 Hback   80 Hpol P
                 Vfront    3 Vsync  10 Vback   18 Vpol N
    DTD 6:  2560x1440   59.950550 Hz  16:9     88.787 kHz    241.500000 MHz (1193 mm x 336 mm)
                 Hfront   48 Hsync  32 Hback   80 Hpol P
                 Vfront    3 Vsync   5 Vback   33 Vpol N
    DTD 7:  1920x1080  239.758794 Hz  16:9    268.770 kHz    548.290000 MHz (1193 mm x 336 mm)
                 Hfront   28 Hsync  32 Hback   60 Hpol P
                 Vfront    3 Vsync  10 Vback   28 Vpol N
Checksum: 0xc5  Unused space in Extension Block: 26 bytes

----------------

Block 5, DisplayID Extension Block:
  Version: 1.2
  Extension Count: 0
  Video Timing Modes Type 1 - Detailed Timings Data Block:
    DTD:  5120x1440  239.760523 Hz   0:0    356.524 kHz   1939.490000 MHz (aspect undefined, no 3D stereo, preferred)
               Hfront  128 Hsync  32 Hback  160 Hpol P
               Vfront    3 Vsync  10 Vback   34 Vpol N
    DTD:  5120x1440   59.976879 Hz   0:0     88.826 kHz    469.000000 MHz (aspect undefined, no 3D stereo)
               Hfront   48 Hsync  32 Hback   80 Hpol P
               Vfront    3 Vsync  10 Vback   28 Vpol N
    DTD:  2560x1440  239.998973 Hz   0:0    356.878 kHz   1027.810000 MHz (aspect undefined, no 3D stereo)
               Hfront  128 Hsync  32 Hback  160 Hpol P
               Vfront    3 Vsync  10 Vback   34 Vpol N
    DTD:  3840x1080  239.999826 Hz   0:0    267.840 kHz   1103.500000 MHz (aspect undefined, no 3D stereo)
               Hfront  108 Hsync  32 Hback  140 Hpol P
               Vfront    3 Vsync  10 Vback   23 Vpol N
  Checksum: 0xb8
Checksum: 0x90

----------------

Warnings:

Block 1, CTA-861 Extension Block:
  Video Data Block: VIC 16 and the first DTD are not identical. Is this intended?
  Colorimetry Data Block: Set the sRGB colorimetry bit to avoid interop issues.
  Detailed Timing Descriptor #3: Image size is 1193x336 mm, but based on the picture AR it should be 1193x671 mm.
  Detailed Timing Descriptor #4: Image size is 1193x336 mm, but based on the picture AR it should be 1193x671 mm.
  Display Product Serial Number is set, so the Serial Number in the Base EDID should be 0.
Block 4, CTA-861 Extension Block:
  Colorimetry Data Block: Set the sRGB colorimetry bit to avoid interop issues.
  Detailed Timing Descriptor #6: Image size is 1193x336 mm, but based on the picture AR it should be 1193x671 mm.
  Detailed Timing Descriptor #7: Image size is 1193x336 mm, but based on the picture AR it should be 1193x671 mm.
EDID:
  Base EDID: Some timings are out of range of the Monitor Ranges:
    Vertical Freq: 59.810 - 240.000 Hz (Monitor: 96.000 - 240.000 Hz)
    Horizontal Freq: 31.468 - 356.878 kHz (Monitor: 357.000 - 357.000 kHz)

Failures:

Block 1, CTA-861 Extension Block:
  Missing VCDB, needed for Set Selectable RGB Quantization to avoid interop issues.
Block 2, DisplayID Extension Block:
  Expected 0 DisplayID Extension Block, but got 1.
Block 3, Base EDID:
  Unknown Extension Block.
Block 4, CTA-861 Extension Block:
  Video Data Block: Duplicate VIC 16.
  Video Data Block: Duplicate VIC 4.
  Video Data Block: Duplicate VIC 3.
  Speaker Allocation Data Block: Only one instance of this Data Block is allowed.
  Colorimetry Data Block: Only one instance of this Data Block is allowed.
  HDR Static Metadata Data Block: Only one instance of this Data Block is allowed.
Block 5, DisplayID Extension Block:
  Product Type should be 0 in extension block.
EDID:
  Base EDID: EDID specified 2 extension block(s), but found 5 extension block(s).
  DisplayID: Missing DisplayID Display Parameters Data Block.

EDID conformity: FAIL
