edid-decode (hex):

00 ff ff ff ff ff ff 00 4c 23 53 24 12 00 00 00
01 23 01 03 80 35 1d 78 2a ee 91 a3 54 4c 99 26
0f 50 54 21 08 00 01 01 81 c0 81 80 95 00 a9 c0
b3 00 d1 cf 01 01 02 3a 80 18 71 38 2d 40 30 20
35 00 12 22 21 00 00 1e 00 00 00 fc 00 4f 46 32
34 0a 20 20 20 20 20 20 20 20 00 00 00 ff 00 0a
20 20 20 20 20 20 20 20 20 20 20 20 00 00 00 fd
00 30 78 1e b4 22 00 0a 20 20 20 20 20 20 01 ae

02 03 2c b2 47 90 01 02 03 04 1f 3f 67 03 0c 00
10 00 18 44 68 1a 00 00 01 01 30 78 e6 67 d8 5d
c4 01 44 80 01 e2 00 d5 e3 05 c0 00 0e 5c 80 a0
70 38 35 40 30 20 25 00 58 4a 21 00 00 1e 14 1d
56 a0 50 00 2d 30 30 20 35 00 58 4a 21 00 00 1e
8e 44 80 a0 70 38 2d 40 30 20 35 00 58 4a 21 00
00 18 b0 6d 80 a0 70 38 2d 40 30 20 35 00 12 22
21 00 00 1e 00 00 00 00 00 00 00 00 00 00 00 7d

00 ff ff ff ff ff ff 00 4c 23 53 24 12 00 00 00
01 23 01 03 80 35 1d 78 2a ee 91 a3 54 4c 99 26
0f 50 54 21 08 00 01 01 81 c0 81 80 95 00 a9 c0
b3 00 d1 cf 01 01 02 3a 80 18 71 38 2d 40 30 20
35 00 12 22 21 00 00 1e 00 00 00 fc 00 4f 46 32
34 0a 20 20 20 20 20 20 20 20 00 00 00 ff 00 0a
20 20 20 20 20 20 20 20 20 20 20 20 00 00 00 fd
00 30 78 1e b4 22 00 0a 20 20 20 20 20 20 01 ae

02 03 2c b2 47 90 01 02 03 04 1f 3f 67 03 0c 00
10 00 18 44 68 1a 00 00 01 01 30 78 e6 67 d8 5d
c4 01 44 80 01 e2 00 d5 e3 05 c0 00 0e 5c 80 a0
70 38 35 40 30 20 25 00 58 4a 21 00 00 1e 14 1d
56 a0 50 00 2d 30 30 20 35 00 58 4a 21 00 00 1e
8e 44 80 a0 70 38 2d 40 30 20 35 00 58 4a 21 00
00 18 b0 6d 80 a0 70 38 2d 40 30 20 35 00 12 22
21 00 00 1e 00 00 00 00 00 00 00 00 00 00 00 7d

----------------

Block 0, Base EDID:
  EDID Structure Version & Revision: 1.3
  Vendor & Product Identification:
    Manufacturer: SAC
    Model: 9299
    Serial Number: ...
    Made in: week 1 of 2025
  Basic Display Parameters & Features:
    Digital display
    Maximum image size: 53 cm x 29 cm
    Gamma: 2.20
    DPMS levels: Off
    RGB color display
    First detailed timing is the preferred timing
  Color Characteristics:
    Red  : 0.6396, 0.3300
    Green: 0.2998, 0.5996
    Blue : 0.1503, 0.0595
    White: 0.3125, 0.3291
  Established Timings I & II:
    DMT 0x04:   640x480    59.940476 Hz   4:3     31.469 kHz     25.175000 MHz
    DMT 0x09:   800x600    60.316541 Hz   4:3     37.879 kHz     40.000000 MHz
    DMT 0x10:  1024x768    60.003840 Hz   4:3     48.363 kHz     65.000000 MHz
  Standard Timings:
    DMT 0x55:  1280x720    60.000000 Hz  16:9     45.000 kHz     74.250000 MHz
    DMT 0x23:  1280x1024   60.019740 Hz   5:4     63.981 kHz    108.000000 MHz
    DMT 0x2f:  1440x900    59.887445 Hz  16:10    55.935 kHz    106.500000 MHz
    DMT 0x53:  1600x900    60.000000 Hz  16:9     60.000 kHz    108.000000 MHz (RB)
    DMT 0x3a:  1680x1050   59.954250 Hz  16:10    65.290 kHz    146.250000 MHz
    GTF     :  1920x1080   75.000068 Hz  16:9     84.600 kHz    220.637000 MHz
  Detailed Timing Descriptors:
    DTD 1:  1920x1080   60.000000 Hz  16:9     67.500 kHz    148.500000 MHz (530 mm x 290 mm)
                 Hfront   48 Hsync  32 Hback  200 Hpol P
                 Vfront    3 Vsync   5 Vback   37 Vpol P
    Display Product Name: 'OF24'
    Display Product Serial Number: ...
    Display Range Limits:
      Monitor ranges (GTF): 48-120 Hz V, 30-180 kHz H, max dotclock 340 MHz
  Extension blocks: 1
Checksum: 0xae

----------------

Block 1, CTA-861 Extension Block:
  Revision: 3
  Underscans IT Video Formats by default
  Supports YCbCr 4:4:4
  Supports YCbCr 4:2:2
  Native DTDs: 2
  Video Data Block:
    VIC  16:  1920x1080   60.000000 Hz  16:9     67.500 kHz    148.500000 MHz (native)
    VIC   1:   640x480    59.940476 Hz   4:3     31.469 kHz     25.175000 MHz
    VIC   2:   720x480    59.940060 Hz   4:3     31.469 kHz     27.000000 MHz
    VIC   3:   720x480    59.940060 Hz  16:9     31.469 kHz     27.000000 MHz
    VIC   4:  1280x720    60.000000 Hz  16:9     45.000 kHz     74.250000 MHz
    VIC  31:  1920x1080   50.000000 Hz  16:9     56.250 kHz    148.500000 MHz
    VIC  63:  1920x1080  120.000000 Hz  16:9    135.000 kHz    297.000000 MHz
  Vendor-Specific Data Block (HDMI), OUI 00-0C-03:
    Source physical address: 1.0.0.0
    DC_30bit
    DC_Y444
    Maximum TMDS clock: 340 MHz
  Vendor-Specific Data Block (AMD), OUI 00-00-1A:
    Version: 1
    Feature Caps: 0x01
    Minimum Refresh Rate: 48 Hz
    Maximum Refresh Rate: 120 Hz
    Flags 1.x: 0xe6 (MCCS)
  Vendor-Specific Data Block (HDMI Forum), OUI C4-5D-D8:
    Version: 1
    Maximum TMDS Character Rate: 340 MHz
    SCDC Present
    Supports 10-bits/component Deep Color 4:2:0 Pixel Encoding
  Video Capability Data Block:
    YCbCr quantization: Selectable (via AVI YQ)
    RGB quantization: Selectable (via AVI Q)
    PT scan behavior: Always Overscanned
    IT scan behavior: Always Overscanned
    CE scan behavior: Always Overscanned
  Colorimetry Data Block:
    BT2020YCC
    BT2020RGB
  Detailed Timing Descriptors:
    DTD 2:  1920x1080   99.998303 Hz  16:9    113.298 kHz    235.660000 MHz (600 mm x 330 mm)
                 Hfront   48 Hsync  32 Hback   80 Hpol P
                 Vfront    2 Vsync   5 Vback   46 Vpol P
    DTD 3:  1366x768    60.001386 Hz 683:384   48.781 kHz     74.440000 MHz (600 mm x 330 mm)
                 Hfront   48 Hsync  32 Hback   80 Hpol P
                 Vfront    3 Vsync   5 Vback   37 Vpol P
    DTD 4:  1920x1080   75.000000 Hz  16:9     84.375 kHz    175.500000 MHz (600 mm x 330 mm)
                 Hfront   48 Hsync  32 Hback   80 Hpol N
                 Vfront    3 Vsync   5 Vback   37 Vpol N
    DTD 5:  1920x1080  120.000000 Hz  16:9    135.000 kHz    280.800000 MHz (530 mm x 290 mm)
                 Hfront   48 Hsync  32 Hback   80 Hpol P
                 Vfront    3 Vsync   5 Vback   37 Vpol P
Checksum: 0x7d  Unused space in Extension Block: 11 bytes

----------------

Warnings:

Block 0, Base EDID:
  Detailed Timing Descriptor #1: DTD is similar but not identical to VIC 16.
Block 1, CTA-861 Extension Block:
  Video Data Block: VIC 16 and the first DTD are not identical. Is this intended?
  Video Capability Data Block: IT scan behavior is expected to support underscanned.
  Video Capability Data Block: S_PT is equal to S_IT and S_CE, so should be set to 0 instead.
  Display Product Serial Number is set, so the Serial Number in the Base EDID should be 0.

Failures:

Block 0, Base EDID:
  Display Product Serial Number: ...
  Basic Display Parameters & Features: The chromaticities match sRGB, but sRGB is not signaled.
Block 1, CTA-861 Extension Block:
  Vendor-Specific Data Block (HDMI Forum), OUI C4-5D-D8: HDMI Forum VSDB did not immediately follow the HDMI VSDB.
  Vendor-Specific Data Block (HDMI Forum), OUI C4-5D-D8: Max TMDS rate is > 0 and <= 340 or > 600.
  Video Capability Data Block: IT video formats are always overscanned, but bit 7 of Byte 3 of the CTA-861 Extension header is set to underscanned.
  Detailed Timing Descriptor #2: Mismatch of image size 600x330 mm vs display size 530x290 mm.
  Detailed Timing Descriptor #3: Mismatch of image size 600x330 mm vs display size 530x290 mm.
  Detailed Timing Descriptor #4: Mismatch of image size 600x330 mm vs display size 530x290 mm.
EDID:
  Extension Block 2 started with EDID header, ignoring Extension Blocks >= 2.
  Base EDID: The DTD max image size is 600x330mm, which is larger than the display size 530.0x290.0mm.

EDID conformity: FAIL
