edid-decode (hex):

00 ff ff ff ff ff ff 00 2c ee 20 03 00 00 00 00
24 1e 01 03 80 46 27 78 2e 17 b0 a8 54 4f a3 22
11 50 54 bf ef 00 81 40 81 c0 81 80 95 00 b3 00
d1 c0 01 01 01 01 56 5e 00 a0 a0 a0 29 50 30 20
25 00 55 50 21 00 00 1e 00 00 00 ff 00 30 30 30
30 31 0a 20 20 20 20 20 20 20 00 00 00 fd 00 30
4c 1e 63 1f 00 0a 20 20 20 20 20 20 00 00 00 fc
00 4b 41 4d 4e 33 32 51 46 37 54 42 0a 20 01 9c

02 03 32 f1 4c 04 05 03 13 14 12 01 02 11 90 1f
16 23 09 07 07 83 01 00 00 67 03 0c 00 10 00 38
78 68 1a 00 00 01 01 30 4b ed 67 d8 5d c4 01 78
c0 00 8e 44 80 a0 70 38 2d 40 58 2c 45 00 bc 86
21 00 00 1e 7f 21 56 aa 51 00 1e 30 46 8f 33 00
bc 86 21 00 00 9e a0 74 00 82 a0 a0 28 50 20 30
35 00 bc 86 21 00 00 18 02 3a 80 18 71 38 2d 40
58 2c 45 00 bc 22 21 00 00 ff 00 00 00 00 00 5d

00 ff ff ff ff ff ff 00 2c ee 20 03 00 00 00 00
24 1e 01 03 80 46 27 78 2e 17 b0 a8 54 4f a3 22
11 50 54 bf ef 00 81 40 81 c0 81 80 95 00 b3 00
d1 c0 01 01 01 01 56 5e 00 a0 a0 a0 29 50 30 20
25 00 55 50 21 00 00 1e 00 00 00 ff 00 30 30 30
30 31 0a 20 20 20 20 20 20 20 00 00 00 fd 00 30
4c 1e 63 1f 00 0a 20 20 20 20 20 20 00 00 00 fc
00 4b 41 4d 4e 33 32 51 46 37 54 42 0a 20 01 9c

02 03 32 f1 4c 04 05 03 13 14 12 01 02 11 90 1f
16 23 09 07 07 83 01 00 00 67 03 0c 00 10 00 38
78 68 1a 00 00 01 01 30 4b ed 67 d8 5d c4 01 78
c0 00 8e 44 80 a0 70 38 2d 40 58 2c 45 00 bc 86
21 00 00 1e 7f 21 56 aa 51 00 1e 30 46 8f 33 00
bc 86 21 00 00 9e a0 74 00 82 a0 a0 28 50 20 30
35 00 bc 86 21 00 00 18 02 3a 80 18 71 38 2d 40
58 2c 45 00 bc 22 21 00 00 ff 00 00 00 00 00 5d

----------------

Block 0, Base EDID:
  EDID Structure Version & Revision: 1.3
  Vendor & Product Identification:
    Manufacturer: KGN
    Model: 800
    Made in: week 36 of 2020
  Basic Display Parameters & Features:
    Digital display
    Maximum image size: 70 cm x 39 cm
    Gamma: 2.20
    DPMS levels: Off
    RGB color display
    Default (sRGB) color space is primary color space
    First detailed timing is the preferred timing
  Color Characteristics:
    Red  : 0.6562, 0.3291
    Green: 0.3095, 0.6396
    Blue : 0.1347, 0.0693
    White: 0.3125, 0.3281
  Established Timings I & II:
    IBM     :   720x400    70.081663 Hz   9:5     31.467 kHz     28.320000 MHz
    DMT 0x04:   640x480    59.940476 Hz   4:3     31.469 kHz     25.175000 MHz
    Apple   :   640x480    66.666667 Hz   4:3     35.000 kHz     30.240000 MHz
    DMT 0x05:   640x480    72.808802 Hz   4:3     37.861 kHz     31.500000 MHz
    DMT 0x06:   640x480    75.000000 Hz   4:3     37.500 kHz     31.500000 MHz
    DMT 0x08:   800x600    56.250000 Hz   4:3     35.156 kHz     36.000000 MHz
    DMT 0x09:   800x600    60.316541 Hz   4:3     37.879 kHz     40.000000 MHz
    DMT 0x0a:   800x600    72.187572 Hz   4:3     48.077 kHz     50.000000 MHz
    DMT 0x0b:   800x600    75.000000 Hz   4:3     46.875 kHz     49.500000 MHz
    Apple   :   832x624    74.551266 Hz   4:3     49.726 kHz     57.284000 MHz
    DMT 0x10:  1024x768    60.003840 Hz   4:3     48.363 kHz     65.000000 MHz
    DMT 0x11:  1024x768    70.069359 Hz   4:3     56.476 kHz     75.000000 MHz
    DMT 0x12:  1024x768    75.028582 Hz   4:3     60.023 kHz     78.750000 MHz
    DMT 0x24:  1280x1024   75.024675 Hz   5:4     79.976 kHz    135.000000 MHz
  Standard Timings:
    DMT 0x20:  1280x960    60.000000 Hz   4:3     60.000 kHz    108.000000 MHz
    DMT 0x55:  1280x720    60.000000 Hz  16:9     45.000 kHz     74.250000 MHz
    DMT 0x23:  1280x1024   60.019740 Hz   5:4     63.981 kHz    108.000000 MHz
    DMT 0x2f:  1440x900    59.887445 Hz  16:10    55.935 kHz    106.500000 MHz
    DMT 0x3a:  1680x1050   59.954250 Hz  16:10    65.290 kHz    146.250000 MHz
    DMT 0x52:  1920x1080   60.000000 Hz  16:9     67.500 kHz    148.500000 MHz
  Detailed Timing Descriptors:
    DTD 1:  2560x1440   59.950550 Hz  16:9     88.787 kHz    241.500000 MHz (597 mm x 336 mm)
                 Hfront   48 Hsync  32 Hback   80 Hpol P
                 Vfront    2 Vsync   5 Vback   34 Vpol P
    Display Product Serial Number: ...
    Display Range Limits:
      Monitor ranges (GTF): 48-76 Hz V, 30-99 kHz H, max dotclock 310 MHz
    Display Product Name: 'KAMN32QF7TB'
  Extension blocks: 1
Checksum: 0x9c

----------------

Block 1, CTA-861 Extension Block:
  Revision: 3
  Underscans IT Video Formats by default
  Basic audio support
  Supports YCbCr 4:4:4
  Supports YCbCr 4:2:2
  Native detailed modes: 1
  Video Data Block:
    VIC   4:  1280x720    60.000000 Hz  16:9     45.000 kHz     74.250000 MHz
    VIC   5:  1920x1080i  60.000000 Hz  16:9     33.750 kHz     74.250000 MHz
    VIC   3:   720x480    59.940060 Hz  16:9     31.469 kHz     27.000000 MHz
    VIC  19:  1280x720    50.000000 Hz  16:9     37.500 kHz     74.250000 MHz
    VIC  20:  1920x1080i  50.000000 Hz  16:9     28.125 kHz     74.250000 MHz
    VIC  18:   720x576    50.000000 Hz  16:9     31.250 kHz     27.000000 MHz
    VIC   1:   640x480    59.940476 Hz   4:3     31.469 kHz     25.175000 MHz
    VIC   2:   720x480    59.940060 Hz   4:3     31.469 kHz     27.000000 MHz
    VIC  17:   720x576    50.000000 Hz   4:3     31.250 kHz     27.000000 MHz
    VIC  16:  1920x1080   60.000000 Hz  16:9     67.500 kHz    148.500000 MHz (native)
    VIC  31:  1920x1080   50.000000 Hz  16:9     56.250 kHz    148.500000 MHz
    VIC  22:  1440x576i   50.000000 Hz  16:9     15.625 kHz     27.000000 MHz
  Audio Data Block:
    Linear PCM:
      Max channels: 2
      Supported sample rates (kHz): 48 44.1 32
      Supported sample sizes (bits): 24 20 16
  Speaker Allocation Data Block:
    FL/FR - Front Left/Right
  Vendor-Specific Data Block (HDMI), OUI 00-0C-03:
    Source physical address: 1.0.0.0
    DC_36bit
    DC_30bit
    DC_Y444
    Maximum TMDS clock: 600 MHz
  Vendor-Specific Data Block (AMD), OUI 00-00-1A:
    Version: 1
    Feature Caps: 0x01
    Minimum Refresh Rate: 48 Hz
    Maximum Refresh Rate: 75 Hz
    Flags 1.x: 0xed (MCCS)
  Vendor-Specific Data Block (HDMI Forum), OUI C4-5D-D8:
    Version: 1
    Maximum TMDS Character Rate: 600 MHz
    SCDC Present
    SCDC Read Request Capable
  Detailed Timing Descriptors:
    DTD 2:  1920x1080   75.000000 Hz  16:9     84.375 kHz    175.500000 MHz (700 mm x 390 mm)
                 Hfront   88 Hsync  44 Hback   28 Hpol P
                 Vfront    4 Vsync   5 Vback   36 Vpol P
    DTD 3:  1366x1536i  59.926816 Hz 683:768   47.852 kHz     85.750000 MHz (700 mm x 390 mm)
                 Hfront   70 Hsync 143 Hback  213 Hpol P
                 Vfront    3 Vsync   3 Vback   24 Vpol P Vfront +0.5 Odd Field
                 Vfront    3 Vsync   3 Vback   24 Vpol P Vback  +0.5 Even Field
    DTD 4:  2560x1440   74.992465 Hz  16:9    110.989 kHz    298.560000 MHz (700 mm x 390 mm)
                 Hfront   32 Hsync  48 Hback   50 Hpol N
                 Vfront    3 Vsync   5 Vback   32 Vpol N
    DTD 5:  1920x2160i  59.973345 Hz   8:9     67.500 kHz    148.500000 MHz (side by side interleaved, 700 mm x 290 mm)
                 Hfront   88 Hsync  44 Hback  148 Hpol P
                 Vfront    4 Vsync   5 Vback   36 Vpol P Vfront +0.5 Odd Field
                 Vfront    4 Vsync   5 Vback   36 Vpol P Vback  +0.5 Even Field
Checksum: 0x5d  Unused space in Extension Block: 5 bytes

----------------

Block 2, Unknown EDID Extension Block 0x00:
  00 ff ff ff ff ff ff 00 2c ee 20 03 00 00 00 00 '........,. .....'
  24 1e 01 03 80 46 27 78 2e 17 b0 a8 54 4f a3 22 '$....F'x....TO."'
  11 50 54 bf ef 00 81 40 81 c0 81 80 95 00 b3 00 '.PT....@........'
  d1 c0 01 01 01 01 56 5e 00 a0 a0 a0 29 50 30 20 '......V^....)P0 '
  25 00 55 50 21 00 00 1e 00 00 00 ff 00 30 30 30 '%.UP!........000'
  30 31 0a 20 20 20 20 20 20 20 00 00 00 fd 00 30 '01.       .....0'
  4c 1e 63 1f 00 0a 20 20 20 20 20 20 00 00 00 fc 'L.c...      ....'
  00 4b 41 4d 4e 33 32 51 46 37 54 42 0a 20 01 9c '.KAMN32QF7TB. ..'
Checksum: 0x9c

----------------

Block 3, CTA-861 Extension Block:
  Revision: 3
  Underscans IT Video Formats by default
  Basic audio support
  Supports YCbCr 4:4:4
  Supports YCbCr 4:2:2
  Native detailed modes: 1
  Video Data Block:
    VIC   4:  1280x720    60.000000 Hz  16:9     45.000 kHz     74.250000 MHz
    VIC   5:  1920x1080i  60.000000 Hz  16:9     33.750 kHz     74.250000 MHz
    VIC   3:   720x480    59.940060 Hz  16:9     31.469 kHz     27.000000 MHz
    VIC  19:  1280x720    50.000000 Hz  16:9     37.500 kHz     74.250000 MHz
    VIC  20:  1920x1080i  50.000000 Hz  16:9     28.125 kHz     74.250000 MHz
    VIC  18:   720x576    50.000000 Hz  16:9     31.250 kHz     27.000000 MHz
    VIC   1:   640x480    59.940476 Hz   4:3     31.469 kHz     25.175000 MHz
    VIC   2:   720x480    59.940060 Hz   4:3     31.469 kHz     27.000000 MHz
    VIC  17:   720x576    50.000000 Hz   4:3     31.250 kHz     27.000000 MHz
    VIC  16:  1920x1080   60.000000 Hz  16:9     67.500 kHz    148.500000 MHz (native)
    VIC  31:  1920x1080   50.000000 Hz  16:9     56.250 kHz    148.500000 MHz
    VIC  22:  1440x576i   50.000000 Hz  16:9     15.625 kHz     27.000000 MHz
  Audio Data Block:
    Linear PCM:
      Max channels: 2
      Supported sample rates (kHz): 48 44.1 32
      Supported sample sizes (bits): 24 20 16
  Speaker Allocation Data Block:
    FL/FR - Front Left/Right
  Vendor-Specific Data Block (HDMI), OUI 00-0C-03:
    Source physical address: 1.0.0.0
    DC_36bit
    DC_30bit
    DC_Y444
    Maximum TMDS clock: 600 MHz
  Vendor-Specific Data Block (AMD), OUI 00-00-1A:
    Version: 1
    Feature Caps: 0x01
    Minimum Refresh Rate: 48 Hz
    Maximum Refresh Rate: 75 Hz
    Flags 1.x: 0xed (MCCS)
  Vendor-Specific Data Block (HDMI Forum), OUI C4-5D-D8:
    Version: 1
    Maximum TMDS Character Rate: 600 MHz
    SCDC Present
    SCDC Read Request Capable
  Detailed Timing Descriptors:
    DTD 6:  1920x1080   75.000000 Hz  16:9     84.375 kHz    175.500000 MHz (700 mm x 390 mm)
                 Hfront   88 Hsync  44 Hback   28 Hpol P
                 Vfront    4 Vsync   5 Vback   36 Vpol P
    DTD 7:  1366x1536i  59.926816 Hz 683:768   47.852 kHz     85.750000 MHz (700 mm x 390 mm)
                 Hfront   70 Hsync 143 Hback  213 Hpol P
                 Vfront    3 Vsync   3 Vback   24 Vpol P Vfront +0.5 Odd Field
                 Vfront    3 Vsync   3 Vback   24 Vpol P Vback  +0.5 Even Field
    DTD 8:  2560x1440   74.992465 Hz  16:9    110.989 kHz    298.560000 MHz (700 mm x 390 mm)
                 Hfront   32 Hsync  48 Hback   50 Hpol N
                 Vfront    3 Vsync   5 Vback   32 Vpol N
    DTD 9:  1920x2160i  59.973345 Hz   8:9     67.500 kHz    148.500000 MHz (side by side interleaved, 700 mm x 290 mm)
                 Hfront   88 Hsync  44 Hback  148 Hpol P
                 Vfront    4 Vsync   5 Vback   36 Vpol P Vfront +0.5 Odd Field
                 Vfront    4 Vsync   5 Vback   36 Vpol P Vback  +0.5 Even Field
Checksum: 0x5d  Unused space in Extension Block: 5 bytes

----------------

Warnings:

Block 0, Base EDID:
  Display Product Serial Number: ...
Block 1, CTA-861 Extension Block:
  Video Data Block: VIC 4 and the first DTD are not identical. Is this intended?
  Detailed Timing Descriptor #3: Image size is 700x390 mm, but based on the picture AR it should be 700x787 mm.
  Detailed Timing Descriptor #5: Image size is 700x290 mm, but based on the picture AR it should be 700x787 mm.
Block 3, CTA-861 Extension Block:
  Detailed Timing Descriptor #7: Image size is 700x390 mm, but based on the picture AR it should be 700x787 mm.
  Detailed Timing Descriptor #9: Image size is 700x290 mm, but based on the picture AR it should be 700x787 mm.
EDID:
  Base EDID: Some timings are out of range of the Monitor Ranges:
    Horizontal Freq: 15.625 - 110.988 kHz (Monitor: 30.000 - 99.000 kHz)

Failures:

Block 0, Base EDID:
  Basic Display Parameters & Features: sRGB is signaled, but the chromaticities do not match.
  Detailed Timing Descriptor #1: Mismatch of image size 597x336 mm vs display size 700x390 mm.
Block 1, CTA-861 Extension Block:
  Vendor-Specific Data Block (HDMI), OUI 00-0C-03: HDMI VSDB Max TMDS rate is > 340.
  Vendor-Specific Data Block (HDMI Forum), OUI C4-5D-D8: HDMI Forum VSDB did not immediately follow the HDMI VSDB.
  Missing VCDB, needed for Set Selectable RGB Quantization to avoid interop issues.
Block 2, Base EDID:
  Unknown Extension Block.
Block 3, CTA-861 Extension Block:
  Video Data Block: Duplicate VIC 4.
  Video Data Block: Duplicate VIC 5.
  Video Data Block: Duplicate VIC 3.
  Video Data Block: Duplicate VIC 19.
  Video Data Block: Duplicate VIC 20.
  Video Data Block: Duplicate VIC 18.
  Video Data Block: Duplicate VIC 1.
  Video Data Block: Duplicate VIC 2.
  Video Data Block: Duplicate VIC 17.
  Video Data Block: Duplicate VIC 16.
  Video Data Block: Duplicate VIC 31.
  Video Data Block: Duplicate VIC 22.
  Speaker Allocation Data Block: Only one instance of this Data Block is allowed.
  Vendor-Specific Data Block (HDMI), OUI 00-0C-03: HDMI VSDB Max TMDS rate is > 340.
  Vendor-Specific Data Block (HDMI Forum), OUI C4-5D-D8: HDMI Forum VSDB did not immediately follow the HDMI VSDB.
  Vendor-Specific Data Block (HDMI Forum), OUI C4-5D-D8: Duplicate HDMI Forum VSDB/SCDB.
EDID:
  Base EDID: EDID specified 1 extension block(s), but found 3 extension block(s).
  Base EDID: EDID 1.3 requires a Block Map Extension in Block 1 if there are more than 2 blocks in the EDID.
  CTA-861: Native progressive timings are a mix of several resolutions.

EDID conformity: FAIL
