edid-decode (hex):

00 ff ff ff ff ff ff 00 09 e5 77 09 00 00 00 00
0f 1f 01 04 a5 26 15 78 03 7c e5 a4 55 4c 9f 26
0f 50 54 00 00 00 01 01 01 01 01 01 01 01 01 01
01 01 01 01 01 01 09 ec 00 a0 a0 a0 67 50 30 20
35 00 00 b0 31 00 00 18 00 00 00 fd 00 28 a5 f4
f4 43 01 0a 20 20 20 20 20 20 00 00 00 fe 00 42
4f 45 20 43 51 0a 20 20 20 20 20 20 00 00 00 fe
00 4e 45 31 37 33 51 48 4d 2d 4e 59 32 0a 01 9d

70 13 79 00 00 03 01 14 e5 04 01 84 ff 09 ae 00
2f 00 1f 00 9f 05 27 00 02 00 05 00 00 00 00 00
00 00 00 00 00 00 00 00 00 00 00 00 00 00 00 00
00 00 00 00 00 00 00 00 00 00 00 00 00 00 00 00
00 00 00 00 00 00 00 00 00 00 00 00 00 00 00 00
00 00 00 00 00 00 00 00 00 00 00 00 00 00 00 00
00 00 00 00 00 00 00 00 00 00 00 00 00 00 00 00
00 00 00 00 00 00 00 00 00 00 00 00 00 00 18 90

----------------

Block 0, Base EDID:
  EDID Structure Version & Revision: 1.4
  Vendor & Product Identification:
    Manufacturer: BOE
    Model: 2423
    Made in: week 15 of 2021
  Basic Display Parameters & Features:
    Digital display
    Bits per primary color channel: 8
    DisplayPort interface
    Maximum image size: 38 cm x 21 cm
    Gamma: 2.20
    Supported color formats: RGB 4:4:4
    First detailed timing includes the native pixel format and preferred refresh rate
    Display supports continuous frequencies
  Color Characteristics:
    Red  : 0.6416, 0.3349
    Green: 0.2998, 0.6210
    Blue : 0.1513, 0.0605
    White: 0.3134, 0.3291
  Established Timings I & II: none
  Standard Timings: none
  Detailed Timing Descriptors:
    DTD 1:  2560x1440  143.973257 Hz  16:9    222.151 kHz    604.250000 MHz (768 mm x 432 mm)
                 Hfront   48 Hsync  32 Hback   80 Hpol N
                 Vfront    3 Vsync   5 Vback   95 Vpol N
    Display Range Limits:
      Monitor ranges (Range Limits Only): 40-165 Hz V, 244-244 kHz H, max dotclock 670 MHz
    Alphanumeric Data String: 'BOE CQ'
    Alphanumeric Data String: 'NE173QHM-NY2'
  Extension blocks: 1
Checksum: 0x9d

----------------

Block 1, DisplayID Extension Block:
  Version: 1.3
  Extension Count: 0
  Display Product Type: Extension Section
  Video Timing Modes Type 1 - Detailed Timings Data Block:
    DTD:  2560x1440  165.003212 Hz  16:9    244.205 kHz    667.900000 MHz (aspect 16:9, no 3D stereo, preferred)
               Hfront   48 Hsync  32 Hback   95 Hpol N
               Vfront    3 Vsync   6 Vback   31 Vpol N
  Checksum: 0x18
Checksum: 0x90

----------------

Warnings:

Block 0, Base EDID:
  Missing Display Product Name.
EDID:
  Base EDID: Some timings are out of range of the Monitor Ranges:
    Horizontal Freq: 222.150 - 244.204 kHz (Monitor: 244.000 - 244.000 kHz)

Failures:

Block 0, Base EDID:
  Detailed Timing Descriptor #1: Mismatch of image size 768x432 mm vs display size 380x210 mm.
Block 1, DisplayID Extension Block:
  DisplayID Base Block has no product type.
EDID:
  Base EDID: The DTD max image size is 768x432mm, which is larger than the display size 380.0x210.0mm.

EDID conformity: FAIL
