edid-decode (hex):

00 ff ff ff ff ff ff 00 06 af 9c 01 00 00 00 00
0a 1f 01 04 a5 1d 12 78 03 b7 d5 91 56 5a 94 29
1c 50 54 00 00 00 01 01 01 01 01 01 01 01 01 01
01 01 01 01 01 01 fa 3c 80 b8 70 b0 24 40 10 10
3e 00 1e b2 10 00 00 18 00 00 00 fd 00 28 3c 4b
4b 10 01 0a 20 20 20 20 20 20 00 00 00 fe 00 41
55 4f 0a 20 20 20 20 20 20 20 20 20 00 00 00 fe
00 42 31 33 33 55 41 4e 30 31 2e 35 20 0a 00 0d

00 ff ff ff ff ff ff 00 06 af 9c 01 00 00 00 00
0a 1f 01 04 a5 1d 12 78 03 b7 d5 91 56 5a 94 29
1c 50 54 00 00 00 01 01 01 01 01 01 01 01 01 01
01 01 01 01 01 01 fa 3c 80 b8 70 b0 24 40 10 10
3e 00 1e b2 10 00 00 18 00 00 00 fd 00 28 3c 4b
4b 10 01 0a 20 20 20 20 20 20 00 00 00 fe 00 41
55 4f 0a 20 20 20 20 20 20 20 20 20 00 00 00 fe
00 42 31 33 33 55 41 4e 30 31 2e 35 20 0a 00 0d

----------------

Block 0, Base EDID:
  EDID Structure Version & Revision: 1.4
  Vendor & Product Identification:
    Manufacturer: AUO
    Model: 412
    Made in: week 10 of 2021
  Basic Display Parameters & Features:
    Digital display
    Bits per primary color channel: 8
    DisplayPort interface
    Maximum image size: 29 cm x 18 cm
    Gamma: 2.20
    Supported color formats: RGB 4:4:4
    First detailed timing includes the native pixel format and preferred refresh rate
    Display supports continuous frequencies
  Color Characteristics:
    Red  : 0.5683, 0.3388
    Green: 0.3525, 0.5810
    Blue : 0.1630, 0.1103
    White: 0.3134, 0.3291
  Established Timings I & II: none
  Standard Timings: none
  Detailed Timing Descriptors:
    DTD 1:  1920x1200   60.025902 Hz  16:10    74.192 kHz    156.100000 MHz (286 mm x 178 mm)
                 Hfront   16 Hsync  16 Hback  152 Hpol N
                 Vfront    3 Vsync  14 Vback   19 Vpol N
    Display Range Limits:
      Monitor ranges (Range Limits Only): 40-60 Hz V, 75-75 kHz H, max dotclock 160 MHz
    Alphanumeric Data String: 'AUO'
    Alphanumeric Data String: 'B133UAN01.5 '
Checksum: 0x0d

----------------

Warnings:

Block 0, Base EDID:
  Missing Display Product Name.
EDID:
  Base EDID: Some timings are out of range of the Monitor Ranges:
    Horizontal Freq: 74.192 - 74.192 kHz (Monitor: 75.000 - 75.000 kHz)
    Could be due to a Monitor Range off-by-one rounding issue

Failures:

Block 0, Base EDID:
  Alphanumeric Data String: One or more trailing spaces before newline.
EDID:
  Extension Block 1 started with EDID header, ignoring Extension Blocks >= 1.

EDID conformity: FAIL
