edid-decode (hex):

00 ff ff ff ff ff ff 00 26 cd 01 09 01 01 01 01
03 23 01 04 b5 6d 1f 78 3b 2d 65 ad 4f 4a a6 24
0d 50 54 bf ef 80 71 4f 81 40 81 80 81 c0 95 00
b3 00 d1 c0 01 01 1a 68 00 a0 f0 38 1f 40 30 20
3a 00 3f 32 41 00 00 1a 00 00 00 ff 00 31 32 32
32 37 35 30 33 31 30 30 33 34 00 00 00 fd 00 37
a6 f7 f7 82 01 0a 20 20 20 20 20 20 00 00 00 fc
00 50 4c 34 35 39 34 44 51 0a 20 20 20 20 02 97

02 03 34 f1 48 01 03 04 10 11 13 1f 3f 23 09 07
07 83 01 00 00 6d 1a 00 00 02 03 30 a5 00 04 64
2d 64 2d e2 00 ea e3 05 e0 00 e6 06 07 01 64 64
01 e2 0f 80 1c d2 00 b4 f0 38 23 40 30 20 3a 00
3f 32 41 00 00 1a 6f c2 00 a0 a0 a0 55 50 30 20
35 00 3f 32 41 00 00 1a 00 00 00 00 00 00 00 00
00 00 00 00 00 00 00 00 00 00 00 00 00 00 00 00
00 00 00 00 00 00 00 00 00 00 00 00 00 00 00 63

70 12 79 06 00 03 01 64 be fb 01 88 ff 13 9f 00
2f 80 3f 00 9f 05 33 00 05 00 07 00 8b 6e 01 08
ff 13 9f 00 2f 80 1f 00 9f 05 28 00 02 00 09 00
a2 03 01 08 ff 13 9f 00 2f 80 1f 00 9f 05 28 00
02 00 09 00 17 e5 00 08 ff 13 9f 00 2f 80 1f 00
9f 05 28 00 02 00 09 00 33 b7 00 08 ff 13 9f 00
2f 80 1f 00 9f 05 28 00 02 00 09 00 00 00 00 00
00 00 00 00 00 00 00 00 00 00 00 00 00 00 45 90

00 ff ff ff ff ff ff 00 26 cd 01 09 01 01 01 01
03 23 01 04 b5 6d 1f 78 3b 2d 65 ad 4f 4a a6 24
0d 50 54 bf ef 80 71 4f 81 40 81 80 81 c0 95 00
b3 00 d1 c0 01 01 1a 68 00 a0 f0 38 1f 40 30 20
3a 00 3f 32 41 00 00 1a 00 00 00 ff 00 31 32 32
32 37 35 30 33 31 30 30 33 34 00 00 00 fd 00 37
a6 f7 f7 82 01 0a 20 20 20 20 20 20 00 00 00 fc
00 50 4c 34 35 39 34 44 51 0a 20 20 20 20 02 97

02 03 34 f1 48 01 03 04 10 11 13 1f 3f 23 09 07
07 83 01 00 00 6d 1a 00 00 02 03 30 a5 00 04 64
2d 64 2d e2 00 ea e3 05 e0 00 e6 06 07 01 64 64
01 e2 0f 80 1c d2 00 b4 f0 38 23 40 30 20 3a 00
3f 32 41 00 00 1a 6f c2 00 a0 a0 a0 55 50 30 20
35 00 3f 32 41 00 00 1a 00 00 00 00 00 00 00 00
00 00 00 00 00 00 00 00 00 00 00 00 00 00 00 00
00 00 00 00 00 00 00 00 00 00 00 00 00 00 00 63

70 12 79 06 00 03 01 64 be fb 01 88 ff 13 9f 00
2f 80 3f 00 9f 05 33 00 05 00 07 00 8b 6e 01 08
ff 13 9f 00 2f 80 1f 00 9f 05 28 00 02 00 09 00
a2 03 01 08 ff 13 9f 00 2f 80 1f 00 9f 05 28 00
02 00 09 00 17 e5 00 08 ff 13 9f 00 2f 80 1f 00
9f 05 28 00 02 00 09 00 33 b7 00 08 ff 13 9f 00
2f 80 1f 00 9f 05 28 00 02 00 09 00 00 00 00 00
00 00 00 00 00 00 00 00 00 00 00 00 00 00 45 90

----------------

Block 0, Base EDID:
  EDID Structure Version & Revision: 1.4
  Vendor & Product Identification:
    Manufacturer: IVM
    Model: 2305
    Serial Number: ...
    Made in: week 3 of 2025
  Basic Display Parameters & Features:
    Digital display
    Bits per primary color channel: 10
    DisplayPort interface
    Maximum image size: 109 cm x 31 cm
    Gamma: 2.20
    DPMS levels: Off
    Supported color formats: RGB 4:4:4, YCrCb 4:4:4, YCrCb 4:2:2
    First detailed timing includes the native pixel format and preferred refresh rate
    Display supports continuous frequencies
  Color Characteristics:
    Red  : 0.6757, 0.3105
    Green: 0.2919, 0.6494
    Blue : 0.1416, 0.0527
    White: 0.3134, 0.3291
  Established Timings I & II:
    IBM     :   720x400    70.081663 Hz   9:5     31.467 kHz     28.320000 MHz
    DMT 0x04:   640x480    59.940476 Hz   4:3     31.469 kHz     25.175000 MHz
    Apple   :   640x480    66.666667 Hz   4:3     35.000 kHz     30.240000 MHz
    DMT 0x05:   640x480    72.808802 Hz   4:3     37.861 kHz     31.500000 MHz
    DMT 0x06:   640x480    75.000000 Hz   4:3     37.500 kHz     31.500000 MHz
    DMT 0x08:   800x600    56.250000 Hz   4:3     35.156 kHz     36.000000 MHz
    DMT 0x09:   800x600    60.316541 Hz   4:3     37.879 kHz     40.000000 MHz
    DMT 0x0a:   800x600    72.187572 Hz   4:3     48.077 kHz     50.000000 MHz
    DMT 0x0b:   800x600    75.000000 Hz   4:3     46.875 kHz     49.500000 MHz
    Apple   :   832x624    74.551266 Hz   4:3     49.726 kHz     57.284000 MHz
    DMT 0x10:  1024x768    60.003840 Hz   4:3     48.363 kHz     65.000000 MHz
    DMT 0x11:  1024x768    70.069359 Hz   4:3     56.476 kHz     75.000000 MHz
    DMT 0x12:  1024x768    75.028582 Hz   4:3     60.023 kHz     78.750000 MHz
    DMT 0x24:  1280x1024   75.024675 Hz   5:4     79.976 kHz    135.000000 MHz
    Apple   :  1152x870    75.061550 Hz 192:145   68.681 kHz    100.000000 MHz
  Standard Timings:
    DMT 0x15:  1152x864    75.000000 Hz   4:3     67.500 kHz    108.000000 MHz
    DMT 0x20:  1280x960    60.000000 Hz   4:3     60.000 kHz    108.000000 MHz
    DMT 0x23:  1280x1024   60.019740 Hz   5:4     63.981 kHz    108.000000 MHz
    DMT 0x55:  1280x720    60.000000 Hz  16:9     45.000 kHz     74.250000 MHz
    DMT 0x2f:  1440x900    59.887445 Hz  16:10    55.935 kHz    106.500000 MHz
    DMT 0x3a:  1680x1050   59.954250 Hz  16:10    65.290 kHz    146.250000 MHz
    DMT 0x52:  1920x1080   60.000000 Hz  16:9     67.500 kHz    148.500000 MHz
  Detailed Timing Descriptors:
    DTD 1:  3840x1080   59.968497 Hz  32:9     66.625 kHz    266.500000 MHz (1087 mm x 306 mm)
                 Hfront   48 Hsync  32 Hback   80 Hpol P
                 Vfront    3 Vsync  10 Vback   18 Vpol N
    Display Product Serial Number: ...
    Display Range Limits:
      Monitor ranges (Range Limits Only): 55-166 Hz V, 247-247 kHz H, max dotclock 1300 MHz
    Display Product Name: 'PL4594DQ'
  Extension blocks: 2
Checksum: 0x97

----------------

Block 1, CTA-861 Extension Block:
  Revision: 3
  Underscans IT Video Formats by default
  Basic audio support
  Supports YCbCr 4:4:4
  Supports YCbCr 4:2:2
  Native DTDs: 1
  Video Data Block:
    VIC   1:   640x480    59.940476 Hz   4:3     31.469 kHz     25.175000 MHz
    VIC   3:   720x480    59.940060 Hz  16:9     31.469 kHz     27.000000 MHz
    VIC   4:  1280x720    60.000000 Hz  16:9     45.000 kHz     74.250000 MHz
    VIC  16:  1920x1080   60.000000 Hz  16:9     67.500 kHz    148.500000 MHz
    VIC  17:   720x576    50.000000 Hz   4:3     31.250 kHz     27.000000 MHz
    VIC  19:  1280x720    50.000000 Hz  16:9     37.500 kHz     74.250000 MHz
    VIC  31:  1920x1080   50.000000 Hz  16:9     56.250 kHz    148.500000 MHz
    VIC  63:  1920x1080  120.000000 Hz  16:9    135.000 kHz    297.000000 MHz
  Audio Data Block:
    Linear PCM:
      Max channels: 2
      Supported sample rates (kHz): 48 44.1 32
      Supported sample sizes (bits): 24 20 16
  Speaker Allocation Data Block:
    FL/FR - Front Left/Right
  Vendor-Specific Data Block (AMD), OUI 00-00-1A:
    Version: 2
    Flags 1: 0x03
      FreeSync Supported
      FreeSync 2 HDR Supported
    Minimum Refresh Rate: 48 Hz
    Maximum Refresh Rate: 165 Hz
    Flags 5: 0x04
      Gamma 2.2 EOTF Supported
    Maximum luminance: 100 (436.203 cd/m^2)
    Minimum luminance: 45 (0.136 cd/m^2)
  Video Capability Data Block:
    YCbCr quantization: Selectable (via AVI YQ)
    RGB quantization: Selectable (via AVI Q)
    PT scan behavior: Always Underscanned
    IT scan behavior: Always Underscanned
    CE scan behavior: Always Underscanned
  Colorimetry Data Block:
    BT2020cYCC
    BT2020YCC
    BT2020RGB
  HDR Static Metadata Data Block:
    Electro optical transfer functions:
      Traditional gamma - SDR luminance range
      Traditional gamma - HDR luminance range
      SMPTE ST2084
    Supported static metadata descriptors:
      Static metadata type 1
    Desired content max luminance: 100 (436.203 cd/m^2)
    Desired content max frame-average luminance: 100 (436.203 cd/m^2)
    Desired content min luminance: 1 (0.000 cd/m^2)
  YCbCr 4:2:0 Capability Map Data Block:
    VIC  63:  1920x1080  120.000000 Hz  16:9    135.000 kHz    297.000000 MHz
  Detailed Timing Descriptors:
    DTD 2:  3840x1080  120.000892 Hz  32:9    133.801 kHz    537.880000 MHz (1087 mm x 306 mm)
                 Hfront   48 Hsync  32 Hback  100 Hpol P
                 Vfront    3 Vsync  10 Vback   22 Vpol N
    DTD 3:  2560x1440  119.997589 Hz  16:9    182.996 kHz    497.750000 MHz (1087 mm x 306 mm)
                 Hfront   48 Hsync  32 Hback   80 Hpol P
                 Vfront    3 Vsync   5 Vback   77 Vpol N
Checksum: 0x63  Unused space in Extension Block: 39 bytes

----------------

Block 2, DisplayID Extension Block:
  Version: 1.2
  Extension Count: 0
  Display Product Type: DIRECT DRIVE monitor
  Video Timing Modes Type 1 - Detailed Timings Data Block:
    DTD:  5120x1440  164.999949 Hz   0:0    246.180 kHz   1299.830000 MHz (aspect undefined, no 3D stereo, preferred)
               Hfront   48 Hsync  64 Hback   48 Hpol P
               Vfront    6 Vsync   8 Vback   38 Vpol N
    DTD:  5120x1440  119.999795 Hz   0:0    177.720 kHz    938.360000 MHz (aspect undefined, no 3D stereo)
               Hfront   48 Hsync  32 Hback   80 Hpol P
               Vfront    3 Vsync  10 Vback   28 Vpol N
    DTD:  5120x1440   84.999642 Hz   0:0    125.884 kHz    664.670000 MHz (aspect undefined, no 3D stereo)
               Hfront   48 Hsync  32 Hback   80 Hpol P
               Vfront    3 Vsync  10 Vback   28 Vpol N
    DTD:  5120x1440   75.000512 Hz   0:0    111.076 kHz    586.480000 MHz (aspect undefined, no 3D stereo)
               Hfront   48 Hsync  32 Hback   80 Hpol P
               Vfront    3 Vsync  10 Vback   28 Vpol N
    DTD:  5120x1440   59.976879 Hz   0:0     88.826 kHz    469.000000 MHz (aspect undefined, no 3D stereo)
               Hfront   48 Hsync  32 Hback   80 Hpol P
               Vfront    3 Vsync  10 Vback   28 Vpol N
  Checksum: 0x45
Checksum: 0x90

----------------

Warnings:

Block 0, Base EDID:
  Vendor & Product Identification: The serial number is one of the known dummy values, it should probably be set to 0.
Block 1, CTA-861 Extension Block:
  Video Data Block: VIC 1 and the first DTD are not identical. Is this intended?
  Video Data Block: All VICs are in ascending order, and the first (preferred) VIC <= 4, is that intended?
  Video Capability Data Block: S_PT is equal to S_IT and S_CE, so should be set to 0 instead.
  Colorimetry Data Block: Set the sRGB colorimetry bit to avoid interop issues.
  YCbCr 4:2:0 Capability Map Data Block: Some YCbCr 4:2:0 timings are invalid for HDMI 2.1 (which requires an RGB timings pixel rate >= 590 MHz).
  Detailed Timing Descriptor #3: Image size is 1087x306 mm, but based on the picture AR it should be 544x306 mm.
  Display Product Serial Number is set, so the Serial Number in the Base EDID should be 0.
EDID:
  Base EDID: Some timings are out of range of the Monitor Ranges:
    Vertical Freq: 50.000 - 165.000 Hz (Monitor: 55.000 - 166.000 Hz)
    Horizontal Freq: 31.250 - 246.179 kHz (Monitor: 247.000 - 247.000 kHz)

Failures:

EDID:
  Extension Block 3 started with EDID header, ignoring Extension Blocks >= 3.
  DisplayID: Missing DisplayID Display Parameters Data Block.

EDID conformity: FAIL
