edid-decode (hex):

00 ff ff ff ff ff ff 00 38 a3 7e 66 01 01 01 01
1c 11 01 04 0e 1e 17 78 ee b4 a5 a1 58 4e 97 26
16 50 54 bf ee 00 01 01 01 01 01 01 01 01 01 01
01 01 01 01 01 01 c3 1e 00 20 41 00 20 30 10 60
13 00 30 e4 10 00 00 1e 00 00 00 fd 00 38 4b 1f
3c 08 00 0a 20 20 20 20 20 20 00 00 00 fc 00 4c
43 44 31 35 37 30 4e 58 0a 20 20 20 00 00 00 ff
00 37 37 43 30 38 33 36 32 54 42 0a 20 20 00 51

00 ff ff ff ff ff ff 00 38 a3 7e 66 01 01 01 01
1c 11 01 04 0e 1e 17 78 ee b4 a5 a1 58 4e 97 26
16 50 54 bf ee 00 01 01 01 01 01 01 01 01 01 01
01 01 01 01 01 01 c3 1e 00 20 41 00 20 30 10 60
13 00 30 e4 10 00 00 1e 00 00 00 fd 00 38 4b 1f
3c 08 00 0a 20 20 20 20 20 20 00 00 00 fc 00 4c
43 44 31 35 37 30 4e 58 0a 20 20 20 00 00 00 ff
00 37 37 43 30 38 33 36 32 54 42 0a 20 20 00 51

----------------

Block 0, Base EDID:
  EDID Structure Version & Revision: 1.4
  Vendor & Product Identification:
    Manufacturer: NEC
    Model: 26238
    Serial Number: ...
    Made in: week 28 of 2007
  Basic Display Parameters & Features:
    Analog display
    Signal Level Standard: 0.700 : 0.300 : 1.000 V p-p
    Blank level equals black level
    Sync: Separate Composite SyncOnGreen
    Maximum image size: 30 cm x 23 cm
    Gamma: 2.20
    DPMS levels: Standby Suspend Off
    RGB color display
    Default (sRGB) color space is primary color space
    First detailed timing includes the native pixel format and preferred refresh rate
  Color Characteristics:
    Red  : 0.6308, 0.3466
    Green: 0.3056, 0.5898
    Blue : 0.1503, 0.0878
    White: 0.3134, 0.3291
  Established Timings I & II:
    IBM     :   720x400    70.081663 Hz   9:5     31.467 kHz     28.320000 MHz
    DMT 0x04:   640x480    59.940476 Hz   4:3     31.469 kHz     25.175000 MHz
    Apple   :   640x480    66.666667 Hz   4:3     35.000 kHz     30.240000 MHz
    DMT 0x05:   640x480    72.808802 Hz   4:3     37.861 kHz     31.500000 MHz
    DMT 0x06:   640x480    75.000000 Hz   4:3     37.500 kHz     31.500000 MHz
    DMT 0x08:   800x600    56.250000 Hz   4:3     35.156 kHz     36.000000 MHz
    DMT 0x09:   800x600    60.316541 Hz   4:3     37.879 kHz     40.000000 MHz
    DMT 0x0a:   800x600    72.187572 Hz   4:3     48.077 kHz     50.000000 MHz
    DMT 0x0b:   800x600    75.000000 Hz   4:3     46.875 kHz     49.500000 MHz
    Apple   :   832x624    74.551266 Hz   4:3     49.726 kHz     57.284000 MHz
    DMT 0x10:  1024x768    60.003840 Hz   4:3     48.363 kHz     65.000000 MHz
    DMT 0x11:  1024x768    70.069359 Hz   4:3     56.476 kHz     75.000000 MHz
    DMT 0x12:  1024x768    75.028582 Hz   4:3     60.023 kHz     78.750000 MHz
  Standard Timings: none
  Detailed Timing Descriptors:
    DTD 1:  1024x768    75.028582 Hz   4:3     60.023 kHz     78.750000 MHz (304 mm x 228 mm)
                 Hfront   16 Hsync  96 Hback  176 Hpol P
                 Vfront    1 Vsync   3 Vback   28 Vpol P
    Display Range Limits:
      Monitor ranges (GTF): 56-75 Hz V, 31-60 kHz H, max dotclock 80 MHz
    Display Product Name: 'LCD1570NX'
    Display Product Serial Number: ...
Checksum: 0x51

----------------

Warnings:

Block 0, Base EDID:
  Vendor & Product Identification: The serial number is one of the known dummy values, it should probably be set to 0.
  Display Range Limits: GTF support is deprecated in EDID 1.4.

Failures:

Block 0, Base EDID:
  Basic Display Parameters & Features: sRGB is signaled, but the chromaticities do not match.
  Display Range Limits: GTF is supported, but the display does not support continuous frequencies.
EDID:
  Extension Block 1 started with EDID header, ignoring Extension Blocks >= 1.

EDID conformity: FAIL
