edid-decode (hex):

00 ff ff ff ff ff ff 00 4d 10 40 14 00 00 00 00
12 19 01 04 a5 1a 0e 78 06 de 50 a3 54 4c 99 26
0f 50 54 00 00 00 01 01 01 01 01 01 01 01 01 01
01 01 01 01 01 01 ad 36 80 62 70 38 4c 40 09 09
05 0c 00 90 10 00 00 18 bd 2b 80 62 70 38 4c 40
09 09 05 0c 00 90 10 00 00 18 00 00 00 10 00 00
00 00 00 00 00 00 00 00 00 00 00 00 00 00 00 fc
00 4c 51 31 31 36 4d 31 4a 57 30 32 0a 20 00 4e

00 ff ff ff ff ff ff 00 4d 10 40 14 00 00 00 00
12 19 01 04 a5 1a 0e 78 06 de 50 a3 54 4c 99 26
0f 50 54 00 00 00 01 01 01 01 01 01 01 01 01 01
01 01 01 01 01 01 ad 36 80 62 70 38 4c 40 09 09
05 0c 00 90 10 00 00 18 bd 2b 80 62 70 38 4c 40
09 09 05 0c 00 90 10 00 00 18 00 00 00 10 00 00
00 00 00 00 00 00 00 00 00 00 00 00 00 00 00 fc
00 4c 51 31 31 36 4d 31 4a 57 30 32 0a 20 00 4e

----------------

Block 0, Base EDID:
  EDID Structure Version & Revision: 1.4
  Vendor & Product Identification:
    Manufacturer: SHP
    Model: 5184
    Made in: week 18 of 2015
  Basic Display Parameters & Features:
    Digital display
    Bits per primary color channel: 8
    DisplayPort interface
    Maximum image size: 26 cm x 14 cm
    Gamma: 2.20
    Supported color formats: RGB 4:4:4
    Default (sRGB) color space is primary color space
    First detailed timing includes the native pixel format and preferred refresh rate
  Color Characteristics:
    Red  : 0.6396, 0.3291
    Green: 0.2998, 0.5996
    Blue : 0.1494, 0.0595
    White: 0.3125, 0.3281
  Established Timings I & II: none
  Standard Timings: none
  Detailed Timing Descriptors:
    DTD 1:  1920x1080   60.000652 Hz  16:9     69.361 kHz    139.970000 MHz (256 mm x 144 mm)
                 Hfront    9 Hsync   9 Hback   80 Hpol N
                 Vfront   48 Vsync   5 Vback   23 Vpol N
    DTD 2:  1920x1080   47.997949 Hz  16:9     55.486 kHz    111.970000 MHz (256 mm x 144 mm)
                 Hfront    9 Hsync   9 Hback   80 Hpol N
                 Vfront   48 Vsync   5 Vback   23 Vpol N
    Dummy Descriptor:
    Display Product Name: 'LQ116M1JW02'
Checksum: 0x4e

----------------

Failures:

Block 0, Base EDID:
  Basic Display Parameters & Features: sRGB is signaled, but the chromaticities do not match.
EDID:
  Extension Block 1 started with EDID header, ignoring Extension Blocks >= 1.

EDID conformity: FAIL
