edid-decode (hex):

00 ff ff ff ff ff ff 00 0e 77 13 15 00 00 00 00
00 21 01 04 a5 22 13 78 03 ed f5 a3 55 4c 9c 26
0d 50 54 00 00 00 01 01 01 01 01 01 01 01 01 01
01 01 01 01 01 01 6e 39 80 a0 70 38 62 40 30 20
35 00 58 c1 10 00 00 18 00 00 00 fd 00 30 b4 d4
d4 2d 01 0a 20 20 20 20 20 20 00 00 00 fe 00 43
53 4f 54 20 54 33 0a 20 20 20 20 20 00 00 00 fe
00 4d 4e 46 36 30 31 42 41 33 2d 31 0a 20 01 a0

70 20 79 02 00 22 00 14 d9 ba 06 84 7f 07 9f 00
2f 00 1f 00 37 04 61 00 02 00 04 00 2b 00 0c 27
00 30 3b 00 00 27 00 3c b3 00 00 81 00 13 72 1a
00 00 03 01 30 b4 00 04 00 00 00 00 b4 00 00 00
00 00 00 00 00 00 00 00 00 00 00 00 00 00 00 00
00 00 00 00 00 00 00 00 00 00 00 00 00 00 00 00
00 00 00 00 00 00 00 00 00 00 00 00 00 00 00 00
00 00 00 00 00 00 00 00 00 00 00 00 00 00 5e 90

00 ff ff ff ff ff ff 00 0e 77 13 15 00 00 00 00
00 21 01 04 a5 22 13 78 03 ed f5 a3 55 4c 9c 26
0d 50 54 00 00 00 01 01 01 01 01 01 01 01 01 01
01 01 01 01 01 01 6e 39 80 a0 70 38 62 40 30 20
35 00 58 c1 10 00 00 18 00 00 00 fd 00 30 b4 d4
d4 2d 01 0a 20 20 20 20 20 20 00 00 00 fe 00 43
53 4f 54 20 54 33 0a 20 20 20 20 20 00 00 00 fe
00 4d 4e 46 36 30 31 42 41 33 2d 31 0a 20 01 a0

70 20 79 02 00 22 00 14 d9 ba 06 84 7f 07 9f 00
2f 00 1f 00 37 04 61 00 02 00 04 00 2b 00 0c 27
00 30 3b 00 00 27 00 3c b3 00 00 81 00 13 72 1a
00 00 03 01 30 b4 00 04 00 00 00 00 b4 00 00 00
00 00 00 00 00 00 00 00 00 00 00 00 00 00 00 00
00 00 00 00 00 00 00 00 00 00 00 00 00 00 00 00
00 00 00 00 00 00 00 00 00 00 00 00 00 00 00 00
00 00 00 00 00 00 00 00 00 00 00 00 00 00 5e 90

----------------

Block 0, Base EDID:
  EDID Structure Version & Revision: 1.4
  Vendor & Product Identification:
    Manufacturer: CSW
    Model: 5395
    Made in: 2023
  Basic Display Parameters & Features:
    Digital display
    Bits per primary color channel: 8
    DisplayPort interface
    Maximum image size: 34 cm x 19 cm
    Gamma: 2.20
    Supported color formats: RGB 4:4:4
    First detailed timing includes the native pixel format and preferred refresh rate
    Display supports continuous frequencies
  Color Characteristics:
    Red  : 0.6396, 0.3339
    Green: 0.2998, 0.6103
    Blue : 0.1513, 0.0537
    White: 0.3134, 0.3291
  Established Timings I & II: none
  Standard Timings: none
  Detailed Timing Descriptors:
    DTD 1:  1920x1080   60.002285 Hz  16:9     70.683 kHz    147.020000 MHz (344 mm x 193 mm)
                 Hfront   48 Hsync  32 Hback   80 Hpol N
                 Vfront    3 Vsync   5 Vback   90 Vpol N
    Display Range Limits:
      Monitor ranges (Range Limits Only): 48-180 Hz V, 212-212 kHz H, max dotclock 450 MHz
    Alphanumeric Data String: 'CSOT T3'
    Alphanumeric Data String: 'MNF601BA3-1'
  Extension blocks: 1
Checksum: 0xa0

----------------

Block 1, DisplayID Extension Block:
  Version: 2.0
  Extension Count: 0
  Display Product Primary Use Case: None of the listed primary use cases; generic display
  Video Timing Modes Type 7 - Detailed Timings Data Block:
    DTD:  1920x1080  180.002775 Hz  16:9    212.043 kHz    441.050000 MHz (aspect 16:9, no 3D stereo, preferred)
               Hfront   48 Hsync  32 Hback   80 Hpol N
               Vfront    3 Vsync   5 Vback   90 Vpol N
  Adaptive Sync Data Block:
    Descriptor #1:
      Native Panel Range
      Fixed Average V-Total and Adaptive V-Total
      Supports Seamless Transition
      'Max Single Frame Duration Increase' field value without jitter impact
      'Max Single Frame Duration Decrease' field value without jitter impact
      Max Duration Increase: 0.00 ms
      Max Duration Decrease: 0.00 ms
      Min Refresh Rate: 48 Hz
      Max Refresh Rate: 60 Hz
    Descriptor #2:
      Native Panel Range
      Fixed Average V-Total and Adaptive V-Total
      Supports Seamless Transition
      'Max Single Frame Duration Increase' field value without jitter impact
      'Max Single Frame Duration Decrease' field value without jitter impact
      Max Duration Increase: 0.00 ms
      Max Duration Decrease: 0.00 ms
      Min Refresh Rate: 60 Hz
      Max Refresh Rate: 180 Hz
  CTA-861 DisplayID Data Block:
  Vendor-Specific Data Block (AMD), OUI 00-00-1A:
    Version: 3
    Flags 1: 0x01
      FreeSync Supported
    Minimum Refresh Rate: 48 Hz
    Maximum Refresh Rate: 180 Hz
    Flags 5: 0x04
  Checksum: 0x5e
Checksum: 0x90

----------------

Warnings:

Block 0, Base EDID:
  Missing Display Product Name.
EDID:
  Base EDID: Some timings are out of range of the Monitor Ranges:
    Horizontal Freq: 70.682 - 212.043 kHz (Monitor: 212.000 - 212.000 kHz)

Failures:

EDID:
  Extension Block 2 started with EDID header, ignoring Extension Blocks >= 2.
  DisplayID: Missing DisplayID Display Parameters Data Block.

EDID conformity: FAIL
