edid-decode (hex):

00 ff ff ff ff ff ff 00 0e 96 02 92 00 00 00 00
0f 17 01 03 80 50 2d 78 0a ee 91 a3 54 4c 99 26
0f 50 54 2d 4f 00 71 59 81 59 95 19 a9 59 b3 19
d1 19 d1 4f 81 00 02 3a 80 18 71 38 2d 40 58 30
45 00 80 68 21 00 00 1e 00 00 00 fd 00 18 55 0f
46 0f 00 0a 20 20 20 20 20 20 00 00 00 fc 00 43
75 6c 74 72 61 76 69 65 77 20 54 56 00 00 00 00
00 00 00 00 00 00 00 00 00 00 00 00 00 00 01 67

02 03 22 f0 4c 10 1f 20 05 14 04 13 12 03 16 07
01 23 09 7f 07 83 01 00 00 68 03 0c 00 10 00 00
2d 00 66 21 50 b0 51 00 1b 30 40 70 36 00 98 ff
10 00 00 1a 7f 21 56 aa 51 00 1e 30 46 8f 33 00
98 ff 10 00 00 1e 00 00 00 00 00 00 00 00 00 00
00 00 00 00 00 00 00 00 00 00 00 00 00 00 00 00
00 00 00 00 00 00 00 00 00 00 00 00 00 00 00 00
00 00 00 00 00 00 00 00 00 00 00 00 00 00 00 2b

00 ff ff ff ff ff ff 00 0e 96 02 92 00 00 00 00
0f 17 01 03 80 50 2d 78 0a ee 91 a3 54 4c 99 26
0f 50 54 2d 4f 00 71 59 81 59 95 19 a9 59 b3 19
d1 19 d1 4f 81 00 02 3a 80 18 71 38 2d 40 58 30
45 00 80 68 21 00 00 1e 00 00 00 fd 00 18 55 0f
46 0f 00 0a 20 20 20 20 20 20 00 00 00 fc 00 43
75 6c 74 72 61 76 69 65 77 20 54 56 00 00 00 00
00 00 00 00 00 00 00 00 00 00 00 00 00 00 01 67

02 03 22 f0 4c 10 1f 20 05 14 04 13 12 03 16 07
01 23 09 7f 07 83 01 00 00 68 03 0c 00 10 00 00
2d 00 66 21 50 b0 51 00 1b 30 40 70 36 00 98 ff
10 00 00 1a 7f 21 56 aa 51 00 1e 30 46 8f 33 00
98 ff 10 00 00 1e 00 00 00 00 00 00 00 00 00 00
00 00 00 00 00 00 00 00 00 00 00 00 00 00 00 00
00 00 00 00 00 00 00 00 00 00 00 00 00 00 00 00
00 00 00 00 00 00 00 00 00 00 00 00 00 00 00 2b

----------------

Block 0, Base EDID:
  EDID Structure Version & Revision: 1.3
  Vendor & Product Identification:
    Manufacturer: CTV
    Model: 37378
    Made in: week 15 of 2013
  Basic Display Parameters & Features:
    Digital display
    Maximum image size: 80 cm x 45 cm
    Gamma: 2.20
    RGB color display
    First detailed timing is the preferred timing
  Color Characteristics:
    Red  : 0.6396, 0.3300
    Green: 0.2998, 0.5996
    Blue : 0.1503, 0.0595
    White: 0.3125, 0.3291
  Established Timings I & II:
    DMT 0x04:   640x480    59.940476 Hz   4:3     31.469 kHz     25.175000 MHz
    DMT 0x05:   640x480    72.808802 Hz   4:3     37.861 kHz     31.500000 MHz
    DMT 0x06:   640x480    75.000000 Hz   4:3     37.500 kHz     31.500000 MHz
    DMT 0x09:   800x600    60.316541 Hz   4:3     37.879 kHz     40.000000 MHz
    DMT 0x0b:   800x600    75.000000 Hz   4:3     46.875 kHz     49.500000 MHz
    DMT 0x10:  1024x768    60.003840 Hz   4:3     48.363 kHz     65.000000 MHz
    DMT 0x11:  1024x768    70.069359 Hz   4:3     56.476 kHz     75.000000 MHz
    DMT 0x12:  1024x768    75.028582 Hz   4:3     60.023 kHz     78.750000 MHz
    DMT 0x24:  1280x1024   75.024675 Hz   5:4     79.976 kHz    135.000000 MHz
  Standard Timings:
    GTF     :  1152x864    84.999687 Hz   4:3     77.095 kHz    119.651000 MHz
    DMT 0x21:  1280x960    85.002473 Hz   4:3     85.938 kHz    148.500000 MHz
    DMT 0x31:  1440x900    84.842118 Hz  16:10    80.430 kHz    157.000000 MHz
    DMT 0x37:  1600x1200   85.000000 Hz   4:3    106.250 kHz    229.500000 MHz
    DMT 0x3c:  1680x1050   84.940512 Hz  16:10    93.859 kHz    214.750000 MHz
    DMT 0x47:  1920x1200   84.931608 Hz  16:10   107.184 kHz    281.250000 MHz
    DMT 0x4a:  1920x1440   75.000000 Hz   4:3    112.500 kHz    297.000000 MHz
    DMT 0x1c:  1280x800    59.810326 Hz  16:10    49.702 kHz     83.500000 MHz
  Detailed Timing Descriptors:
    DTD 1:  1920x1080   60.000000 Hz  16:9     67.500 kHz    148.500000 MHz (640 mm x 360 mm)
                 Hfront   88 Hsync  48 Hback  144 Hpol P
                 Vfront    4 Vsync   5 Vback   36 Vpol P
    Display Range Limits:
      Monitor ranges (GTF): 24-85 Hz V, 15-70 kHz H, max dotclock 150 MHz
    Display Product Name: 'Cultraview TV'
    Empty Descriptor
  Extension blocks: 1
Checksum: 0x67

----------------

Block 1, CTA-861 Extension Block:
  Revision: 3
  Underscans IT Video Formats by default
  Basic audio support
  Supports YCbCr 4:4:4
  Supports YCbCr 4:2:2
  Native detailed modes: 0
  Video Data Block:
    VIC  16:  1920x1080   60.000000 Hz  16:9     67.500 kHz    148.500000 MHz
    VIC  31:  1920x1080   50.000000 Hz  16:9     56.250 kHz    148.500000 MHz
    VIC  32:  1920x1080   24.000000 Hz  16:9     27.000 kHz     74.250000 MHz
    VIC   5:  1920x1080i  60.000000 Hz  16:9     33.750 kHz     74.250000 MHz
    VIC  20:  1920x1080i  50.000000 Hz  16:9     28.125 kHz     74.250000 MHz
    VIC   4:  1280x720    60.000000 Hz  16:9     45.000 kHz     74.250000 MHz
    VIC  19:  1280x720    50.000000 Hz  16:9     37.500 kHz     74.250000 MHz
    VIC  18:   720x576    50.000000 Hz  16:9     31.250 kHz     27.000000 MHz
    VIC   3:   720x480    59.940060 Hz  16:9     31.469 kHz     27.000000 MHz
    VIC  22:  1440x576i   50.000000 Hz  16:9     15.625 kHz     27.000000 MHz
    VIC   7:  1440x480i   59.940060 Hz  16:9     15.734 kHz     27.000000 MHz
    VIC   1:   640x480    59.940476 Hz   4:3     31.469 kHz     25.175000 MHz
  Audio Data Block:
    Linear PCM:
      Max channels: 2
      Supported sample rates (kHz): 192 176.4 96 88.2 48 44.1 32
      Supported sample sizes (bits): 24 20 16
  Speaker Allocation Data Block:
    FL/FR - Front Left/Right
  Vendor-Specific Data Block (HDMI), OUI 00-0C-03:
    Source physical address: 1.0.0.0
    Maximum TMDS clock: 225 MHz
  Detailed Timing Descriptors:
    DTD 2:  1360x768    60.015162 Hz  85:48    47.712 kHz     85.500000 MHz (408 mm x 255 mm)
                 Hfront   64 Hsync 112 Hback  256 Hpol P
                 Vfront    3 Vsync   6 Vback   18 Vpol N
    DTD 3:  1366x768    59.964364 Hz 683:384   47.852 kHz     85.750000 MHz (408 mm x 255 mm)
                 Hfront   70 Hsync 143 Hback  213 Hpol P
                 Vfront    3 Vsync   3 Vback   24 Vpol P
Checksum: 0x2b  Unused space in Extension Block: 57 bytes

----------------

Block 2, Unknown EDID Extension Block 0x00:
  00 ff ff ff ff ff ff 00 0e 96 02 92 00 00 00 00 '................'
  0f 17 01 03 80 50 2d 78 0a ee 91 a3 54 4c 99 26 '.....P-x....TL.&'
  0f 50 54 2d 4f 00 71 59 81 59 95 19 a9 59 b3 19 '.PT-O.qY.Y...Y..'
  d1 19 d1 4f 81 00 02 3a 80 18 71 38 2d 40 58 30 '...O...:..q8-@X0'
  45 00 80 68 21 00 00 1e 00 00 00 fd 00 18 55 0f 'E..h!.........U.'
  46 0f 00 0a 20 20 20 20 20 20 00 00 00 fc 00 43 'F...      .....C'
  75 6c 74 72 61 76 69 65 77 20 54 56 00 00 00 00 'ultraview TV....'
  00 00 00 00 00 00 00 00 00 00 00 00 00 00 01 67 '...............g'
Checksum: 0x67

----------------

Block 3, CTA-861 Extension Block:
  Revision: 3
  Underscans IT Video Formats by default
  Basic audio support
  Supports YCbCr 4:4:4
  Supports YCbCr 4:2:2
  Native detailed modes: 0
  Video Data Block:
    VIC  16:  1920x1080   60.000000 Hz  16:9     67.500 kHz    148.500000 MHz
    VIC  31:  1920x1080   50.000000 Hz  16:9     56.250 kHz    148.500000 MHz
    VIC  32:  1920x1080   24.000000 Hz  16:9     27.000 kHz     74.250000 MHz
    VIC   5:  1920x1080i  60.000000 Hz  16:9     33.750 kHz     74.250000 MHz
    VIC  20:  1920x1080i  50.000000 Hz  16:9     28.125 kHz     74.250000 MHz
    VIC   4:  1280x720    60.000000 Hz  16:9     45.000 kHz     74.250000 MHz
    VIC  19:  1280x720    50.000000 Hz  16:9     37.500 kHz     74.250000 MHz
    VIC  18:   720x576    50.000000 Hz  16:9     31.250 kHz     27.000000 MHz
    VIC   3:   720x480    59.940060 Hz  16:9     31.469 kHz     27.000000 MHz
    VIC  22:  1440x576i   50.000000 Hz  16:9     15.625 kHz     27.000000 MHz
    VIC   7:  1440x480i   59.940060 Hz  16:9     15.734 kHz     27.000000 MHz
    VIC   1:   640x480    59.940476 Hz   4:3     31.469 kHz     25.175000 MHz
  Audio Data Block:
    Linear PCM:
      Max channels: 2
      Supported sample rates (kHz): 192 176.4 96 88.2 48 44.1 32
      Supported sample sizes (bits): 24 20 16
  Speaker Allocation Data Block:
    FL/FR - Front Left/Right
  Vendor-Specific Data Block (HDMI), OUI 00-0C-03:
    Source physical address: 1.0.0.0
    Maximum TMDS clock: 225 MHz
  Detailed Timing Descriptors:
    DTD 4:  1360x768    60.015162 Hz  85:48    47.712 kHz     85.500000 MHz (408 mm x 255 mm)
                 Hfront   64 Hsync 112 Hback  256 Hpol P
                 Vfront    3 Vsync   6 Vback   18 Vpol N
    DTD 5:  1366x768    59.964364 Hz 683:384   47.852 kHz     85.750000 MHz (408 mm x 255 mm)
                 Hfront   70 Hsync 143 Hback  213 Hpol P
                 Vfront    3 Vsync   3 Vback   24 Vpol P
Checksum: 0x2b  Unused space in Extension Block: 57 bytes

----------------

Warnings:

Block 0, Base EDID:
  Detailed Timing Descriptor #1: DTD is similar but not identical to VIC 16.
Block 1, CTA-861 Extension Block:
  Video Data Block: VIC 16 and the first DTD are not identical. Is this intended?
  Detailed Timing Descriptor #2: DTD is similar but not identical to DMT 0x27.
  Detailed Timing Descriptor #2: Image size is 408x255 mm, but based on the picture AR it should be 408x230 mm.
  Detailed Timing Descriptor #3: Image size is 408x255 mm, but based on the picture AR it should be 408x229 mm.
Block 3, CTA-861 Extension Block:
  Detailed Timing Descriptor #4: DTD is similar but not identical to DMT 0x27.
  Detailed Timing Descriptor #4: Image size is 408x255 mm, but based on the picture AR it should be 408x230 mm.
  Detailed Timing Descriptor #5: Image size is 408x255 mm, but based on the picture AR it should be 408x229 mm.
EDID:
  Base EDID: Some timings are out of range of the Monitor Ranges:
    Horizontal Freq: 15.625 - 112.500 kHz (Monitor: 15.000 - 70.000 kHz)
    Maximum Clock: 297.000 MHz (Monitor: 150.000 MHz)

Failures:

Block 0, Base EDID:
  Basic Display Parameters & Features: The chromaticities match sRGB, but sRGB is not signaled.
  Detailed Timing Descriptor #1: Mismatch of image size 640x360 mm vs display size 800x450 mm.
  Empty Descriptor: Use Dummy Descriptor instead of all zeroes.
Block 1, CTA-861 Extension Block:
  Detailed Timing Descriptor #2: Mismatch of image size 408x255 mm vs display size 800x450 mm.
  Detailed Timing Descriptor #3: Mismatch of image size 408x255 mm vs display size 800x450 mm.
  Missing VCDB, needed for Set Selectable RGB Quantization to avoid interop issues.
Block 2, Base EDID:
  Unknown Extension Block.
Block 3, CTA-861 Extension Block:
  Video Data Block: Duplicate VIC 16.
  Video Data Block: Duplicate VIC 31.
  Video Data Block: Duplicate VIC 32.
  Video Data Block: Duplicate VIC 5.
  Video Data Block: Duplicate VIC 20.
  Video Data Block: Duplicate VIC 4.
  Video Data Block: Duplicate VIC 19.
  Video Data Block: Duplicate VIC 18.
  Video Data Block: Duplicate VIC 3.
  Video Data Block: Duplicate VIC 22.
  Video Data Block: Duplicate VIC 7.
  Video Data Block: Duplicate VIC 1.
  Speaker Allocation Data Block: Only one instance of this Data Block is allowed.
  Detailed Timing Descriptor #4: Mismatch of image size 408x255 mm vs display size 800x450 mm.
  Detailed Timing Descriptor #5: Mismatch of image size 408x255 mm vs display size 800x450 mm.
EDID:
  Base EDID: EDID specified 1 extension block(s), but found 3 extension block(s).
  Base EDID: EDID 1.3 requires a Block Map Extension in Block 1 if there are more than 2 blocks in the EDID.
  CTA-861: The maximum HDMI TMDS clock is 225000 kHz, but one or more video timings go up to 297000 kHz.

EDID conformity: FAIL
