edid-decode (hex):

00 ff ff ff ff ff ff 00 09 e5 b9 09 00 00 00 00
2c 1e 01 04 a5 22 13 78 03 7e a5 a6 54 4b 9c 25
10 50 54 00 00 00 01 01 01 01 01 01 01 01 01 01
01 01 01 01 01 01 2f 3f 80 a0 70 38 d8 40 6c 30
aa 00 58 c2 10 00 00 1a 00 00 00 fd 0e 3c 69 d4
d4 61 01 0a 20 20 20 20 20 20 00 00 00 fe 00 42
4f 45 20 43 51 0a 20 20 20 20 20 20 00 00 00 fe
00 4e 45 31 35 36 46 48 4d 2d 4e 5a 33 0a 01 fc

70 13 79 00 00 03 01 14 15 7b 01 84 7f 07 9f 00
6b 00 2f 00 37 04 d7 00 09 00 09 00 00 00 00 00
00 00 00 00 00 00 00 00 00 00 00 00 00 00 00 00
00 00 00 00 00 00 00 00 00 00 00 00 00 00 00 00
00 00 00 00 00 00 00 00 00 00 00 00 00 00 00 00
00 00 00 00 00 00 00 00 00 00 00 00 00 00 00 00
00 00 00 00 00 00 00 00 00 00 00 00 00 00 00 00
00 00 00 00 00 00 00 00 00 00 00 00 00 00 64 90

----------------

Block 0, Base EDID:
  EDID Structure Version & Revision: 1.4
  Vendor & Product Identification:
    Manufacturer: BOE
    Model: 2489
    Made in: week 44 of 2020
  Basic Display Parameters & Features:
    Digital display
    Bits per primary color channel: 8
    DisplayPort interface
    Maximum image size: 34 cm x 19 cm
    Gamma: 2.20
    Supported color formats: RGB 4:4:4
    First detailed timing includes the native pixel format and preferred refresh rate
    Display supports continuous frequencies
  Color Characteristics:
    Red  : 0.6494, 0.3310
    Green: 0.2958, 0.6113
    Blue : 0.1464, 0.0644
    White: 0.3134, 0.3291
  Established Timings I & II: none
  Standard Timings: none
  Detailed Timing Descriptors:
    DTD 1:  1920x1080   60.003413 Hz  16:9     77.764 kHz    161.750000 MHz (344 mm x 194 mm)
                 Hfront  108 Hsync  48 Hback    4 Hpol P
                 Vfront   10 Vsync  10 Vback  196 Vpol N
    Display Range Limits:
      Monitor ranges (Range Limits Only): 60-360 Hz V, 467-467 kHz H, max dotclock 970 MHz
    Alphanumeric Data String: 'BOE CQ'
    Alphanumeric Data String: 'NE156FHM-NZ3'
  Extension blocks: 1
Checksum: 0xfc

----------------

Block 1, DisplayID Extension Block:
  Version: 1.3
  Extension Count: 0
  Display Product Type: Extension Section
  Video Timing Modes Type 1 - Detailed Timings Data Block:
    DTD:  1920x1080  360.005639 Hz  16:9    466.567 kHz    970.460000 MHz (aspect 16:9, no 3D stereo, preferred)
               Hfront  108 Hsync  48 Hback    4 Hpol N
               Vfront   10 Vsync  10 Vback  196 Vpol N
  Checksum: 0x64
Checksum: 0x90

----------------

Warnings:

Block 0, Base EDID:
  Missing Display Product Name.
EDID:
  Base EDID: Some timings are out of range of the Monitor Ranges:
    Horizontal Freq: 77.764 - 466.567 kHz (Monitor: 467.000 - 467.000 kHz)
    Maximum Clock: 970.460 MHz (Monitor: 970.000 MHz)

Failures:

Block 1, DisplayID Extension Block:
  DisplayID Base Block has no product type.

EDID conformity: FAIL
