edid-decode (hex):

00 ff ff ff ff ff ff 00 06 af a7 84 00 00 00 00
1a 20 01 04 a5 22 16 78 03 c2 d5 ad 51 42 b1 25
0d 50 54 00 00 00 01 01 01 01 01 01 01 01 01 01
01 01 01 01 01 01 c4 72 00 a0 a0 40 c8 60 30 20
aa 00 58 d7 10 00 00 18 00 00 00 0f 00 00 00 00
00 00 00 00 00 00 00 00 00 20 00 00 00 fd 0c 3c
f0 b2 b2 76 01 0a 20 20 20 20 20 20 00 00 00 fe
00 42 31 36 30 51 41 4e 30 32 2e 33 20 0a 01 44

70 12 79 00 00 03 01 14 06 cb 01 84 ff 09 9f 00
2f 00 1f 00 3f 06 c7 00 09 00 09 00 00 00 00 00
00 00 00 00 00 00 00 00 00 00 00 00 00 00 00 00
00 00 00 00 00 00 00 00 00 00 00 00 00 00 00 00
00 00 00 00 00 00 00 00 00 00 00 00 00 00 00 00
00 00 00 00 00 00 00 00 00 00 00 00 00 00 00 00
00 00 00 00 00 00 00 00 00 00 00 00 00 00 00 00
00 00 00 00 00 00 00 00 00 00 00 00 00 00 f4 90

00 ff ff ff ff ff ff 00 06 af a7 84 00 00 00 00
1a 20 01 04 a5 22 16 78 03 c2 d5 ad 51 42 b1 25
0d 50 54 00 00 00 01 01 01 01 01 01 01 01 01 01
01 01 01 01 01 01 c4 72 00 a0 a0 40 c8 60 30 20
aa 00 58 d7 10 00 00 18 00 00 00 0f 00 00 00 00
00 00 00 00 00 00 00 00 00 20 00 00 00 fd 0c 3c
f0 b2 b2 76 01 0a 20 20 20 20 20 20 00 00 00 fe
00 42 31 36 30 51 41 4e 30 32 2e 33 20 0a 01 44

70 12 79 00 00 03 01 14 06 cb 01 84 ff 09 9f 00
2f 00 1f 00 3f 06 c7 00 09 00 09 00 00 00 00 00
00 00 00 00 00 00 00 00 00 00 00 00 00 00 00 00
00 00 00 00 00 00 00 00 00 00 00 00 00 00 00 00
00 00 00 00 00 00 00 00 00 00 00 00 00 00 00 00
00 00 00 00 00 00 00 00 00 00 00 00 00 00 00 00
00 00 00 00 00 00 00 00 00 00 00 00 00 00 00 00
00 00 00 00 00 00 00 00 00 00 00 00 00 00 f4 90

----------------

Block 0, Base EDID:
  EDID Structure Version & Revision: 1.4
  Vendor & Product Identification:
    Manufacturer: AUO
    Model: 33959
    Made in: week 26 of 2022
  Basic Display Parameters & Features:
    Digital display
    Bits per primary color channel: 8
    DisplayPort interface
    Maximum image size: 34 cm x 22 cm
    Gamma: 2.20
    Supported color formats: RGB 4:4:4
    First detailed timing includes the native pixel format and preferred refresh rate
    Display supports continuous frequencies
  Color Characteristics:
    Red  : 0.6787, 0.3164
    Green: 0.2578, 0.6933
    Blue : 0.1474, 0.0517
    White: 0.3134, 0.3291
  Established Timings I & II: none
  Standard Timings: none
  Detailed Timing Descriptors:
    DTD 1:  2560x1600   60.008170 Hz  16:10   108.015 kHz    293.800000 MHz (344 mm x 215 mm)
                 Hfront   48 Hsync  32 Hback   80 Hpol N
                 Vfront   10 Vsync  10 Vback  180 Vpol N
    Manufacturer-Specified Display Descriptor (0x0f): 00 0f 00 00 00 00 00 00 00 00 00 00 00 00 00 20 '............... '
    Display Range Limits:
      Monitor ranges (Range Limits Only): 60-240 Hz V, 433-433 kHz H, max dotclock 1180 MHz
    Alphanumeric Data String: 'B160QAN02.3 '
  Extension blocks: 1
Checksum: 0x44

----------------

Block 1, DisplayID Extension Block:
  Version: 1.2
  Extension Count: 0
  Display Product Type: Extension Section
  Video Timing Modes Type 1 - Detailed Timings Data Block:
    DTD:  2560x1600  240.014297 Hz  16:9    432.026 kHz   1175.110000 MHz (aspect 16:9, no 3D stereo, preferred)
               Hfront   48 Hsync  32 Hback   80 Hpol N
               Vfront   10 Vsync  10 Vback  180 Vpol N
  Checksum: 0xf4
Checksum: 0x90

----------------

Warnings:

Block 0, Base EDID:
  Missing Display Product Name.
EDID:
  Base EDID: Some timings are out of range of the Monitor Ranges:
    Horizontal Freq: 108.014 - 432.025 kHz (Monitor: 433.000 - 433.000 kHz)

Failures:

Block 0, Base EDID:
  Alphanumeric Data String: One or more trailing spaces before newline.
Block 1, DisplayID Extension Block:
  DisplayID Base Block has no product type.
EDID:
  Extension Block 2 started with EDID header, ignoring Extension Blocks >= 2.

EDID conformity: FAIL
