edid-decode (hex):

00 ff ff ff ff ff ff 00 0d 0f 30 00 01 00 00 00
0b 20 01 03 80 8b 4e 78 0a 50 1f a3 59 49 97 24
bb 4f 53 21 08 00 81 80 81 c0 81 00 d1 c0 95 00
b3 00 01 01 01 01 04 74 00 30 f2 70 5a 80 b0 58
8a 00 72 10 53 00 00 1e 02 3a 80 18 71 38 2d 40
58 2c 45 00 72 10 53 00 00 1e 00 00 00 fc 00 53
6d 61 72 74 20 54 56 0a 20 20 20 20 00 00 00 fd
00 32 4b 1e 50 1e 00 0a 20 20 20 20 20 20 01 e3

02 03 4b f0 52 10 05 04 03 01 12 13 14 16 07 1f
20 21 22 02 06 22 01 29 09 07 07 15 07 50 57 06
00 83 01 00 00 6e 03 0c 00 30 00 b8 3c 20 00 80
01 02 03 04 e2 00 7f e3 05 c3 01 e3 06 05 01 eb
01 46 d0 00 46 4f 42 9e 34 2e bd 01 1d 80 18 71
1c 16 20 58 2c 25 00 72 10 53 00 00 9e 16 22 56
9e 51 00 31 30 3e 90 a5 00 72 10 53 00 00 1e 00
00 00 00 00 00 00 00 00 00 00 00 00 00 00 00 0b

00 ff ff ff ff ff ff 00 0d 0f 30 00 01 00 00 00
0b 20 01 03 80 8b 4e 78 0a 50 1f a3 59 49 97 24
bb 4f 53 21 08 00 81 80 81 c0 81 00 d1 c0 95 00
b3 00 01 01 01 01 04 74 00 30 f2 70 5a 80 b0 58
8a 00 72 10 53 00 00 1e 02 3a 80 18 71 38 2d 40
58 2c 45 00 72 10 53 00 00 1e 00 00 00 fc 00 53
6d 61 72 74 20 54 56 0a 20 20 20 20 00 00 00 fd
00 32 4b 1e 50 1e 00 0a 20 20 20 20 20 20 01 e3

02 03 4b f0 52 10 05 04 03 01 12 13 14 16 07 1f
20 21 22 02 06 22 01 29 09 07 07 15 07 50 57 06
00 83 01 00 00 6e 03 0c 00 30 00 b8 3c 20 00 80
01 02 03 04 e2 00 7f e3 05 c3 01 e3 06 05 01 eb
01 46 d0 00 46 4f 42 9e 34 2e bd 01 1d 80 18 71
1c 16 20 58 2c 25 00 72 10 53 00 00 9e 16 22 56
9e 51 00 31 30 3e 90 a5 00 72 10 53 00 00 1e 00
00 00 00 00 00 00 00 00 00 00 00 00 00 00 00 0b

----------------

Block 0, Base EDID:
  EDID Structure Version & Revision: 1.3
  Vendor & Product Identification:
    Manufacturer: CHO
    Model: 48
    Serial Number: ...
    Made in: week 11 of 2022
  Basic Display Parameters & Features:
    Digital display
    Maximum image size: 139 cm x 78 cm
    Gamma: 2.20
    RGB color display
    First detailed timing is the preferred timing
  Color Characteristics:
    Red  : 0.6376, 0.3486
    Green: 0.2851, 0.5898
    Blue : 0.1406, 0.7314
    White: 0.3115, 0.3271
  Established Timings I & II:
    DMT 0x04:   640x480    59.940476 Hz   4:3     31.469 kHz     25.175000 MHz
    DMT 0x09:   800x600    60.316541 Hz   4:3     37.879 kHz     40.000000 MHz
    DMT 0x10:  1024x768    60.003840 Hz   4:3     48.363 kHz     65.000000 MHz
  Standard Timings:
    DMT 0x23:  1280x1024   60.019740 Hz   5:4     63.981 kHz    108.000000 MHz
    DMT 0x55:  1280x720    60.000000 Hz  16:9     45.000 kHz     74.250000 MHz
    DMT 0x1c:  1280x800    59.810326 Hz  16:10    49.702 kHz     83.500000 MHz
    DMT 0x52:  1920x1080   60.000000 Hz  16:9     67.500 kHz    148.500000 MHz
    DMT 0x2f:  1440x900    59.887445 Hz  16:10    55.935 kHz    106.500000 MHz
    DMT 0x3a:  1680x1050   59.954250 Hz  16:10    65.290 kHz    146.250000 MHz
  Detailed Timing Descriptors:
    DTD 1:  3840x2160   30.000000 Hz  16:9     67.500 kHz    297.000000 MHz (1394 mm x 784 mm)
                 Hfront  176 Hsync  88 Hback  296 Hpol P
                 Vfront    8 Vsync  10 Vback   72 Vpol P
    DTD 2:  1920x1080   60.000000 Hz  16:9     67.500 kHz    148.500000 MHz (1394 mm x 784 mm)
                 Hfront   88 Hsync  44 Hback  148 Hpol P
                 Vfront    4 Vsync   5 Vback   36 Vpol P
    Display Product Name: 'Smart TV'
    Display Range Limits:
      Monitor ranges (GTF): 50-75 Hz V, 30-80 kHz H, max dotclock 300 MHz
  Extension blocks: 1
Checksum: 0xe3

----------------

Block 1, CTA-861 Extension Block:
  Revision: 3
  Underscans IT Video Formats by default
  Basic audio support
  Supports YCbCr 4:4:4
  Supports YCbCr 4:2:2
  Native DTDs: 0
  Video Data Block:
    VIC  16:  1920x1080   60.000000 Hz  16:9     67.500 kHz    148.500000 MHz
    VIC   5:  1920x1080i  60.000000 Hz  16:9     33.750 kHz     74.250000 MHz
    VIC   4:  1280x720    60.000000 Hz  16:9     45.000 kHz     74.250000 MHz
    VIC   3:   720x480    59.940060 Hz  16:9     31.469 kHz     27.000000 MHz
    VIC   1:   640x480    59.940476 Hz   4:3     31.469 kHz     25.175000 MHz
    VIC  18:   720x576    50.000000 Hz  16:9     31.250 kHz     27.000000 MHz
    VIC  19:  1280x720    50.000000 Hz  16:9     37.500 kHz     74.250000 MHz
    VIC  20:  1920x1080i  50.000000 Hz  16:9     28.125 kHz     74.250000 MHz
    VIC  22:  1440x576i   50.000000 Hz  16:9     15.625 kHz     27.000000 MHz
    VIC   7:  1440x480i   59.940060 Hz  16:9     15.734 kHz     27.000000 MHz
    VIC  31:  1920x1080   50.000000 Hz  16:9     56.250 kHz    148.500000 MHz
    VIC  32:  1920x1080   24.000000 Hz  16:9     27.000 kHz     74.250000 MHz
    VIC  33:  1920x1080   25.000000 Hz  16:9     28.125 kHz     74.250000 MHz
    VIC  34:  1920x1080   30.000000 Hz  16:9     33.750 kHz     74.250000 MHz
    VIC   2:   720x480    59.940060 Hz   4:3     31.469 kHz     27.000000 MHz
    VIC   6:  1440x480i   59.940060 Hz   4:3     15.734 kHz     27.000000 MHz
    VIC  34:  1920x1080   30.000000 Hz  16:9     33.750 kHz     74.250000 MHz
    VIC   1:   640x480    59.940476 Hz   4:3     31.469 kHz     25.175000 MHz
  Audio Data Block:
    Linear PCM:
      Max channels: 2
      Supported sample rates (kHz): 48 44.1 32
      Supported sample sizes (bits): 24 20 16
    AC-3:
      Max channels: 6
      Supported sample rates (kHz): 48 44.1 32
      Maximum bit rate: 640 kb/s
    Enhanced AC-3 (DD+):
      Max channels: 8
      Supported sample rates (kHz): 48 44.1
  Speaker Allocation Data Block:
    FL/FR - Front Left/Right
  Vendor-Specific Data Block (HDMI), OUI 00-0C-03:
    Source physical address: 3.0.0.0
    Supports_AI
    DC_36bit
    DC_30bit
    DC_Y444
    Maximum TMDS clock: 300 MHz
    Extended HDMI video details:
      HDMI VICs:
        HDMI VIC 1:  3840x2160   30.000000 Hz  16:9     67.500 kHz    297.000000 MHz
        HDMI VIC 2:  3840x2160   25.000000 Hz  16:9     56.250 kHz    297.000000 MHz
        HDMI VIC 3:  3840x2160   24.000000 Hz  16:9     54.000 kHz    297.000000 MHz
        HDMI VIC 4:  4096x2160   24.000000 Hz 256:135   54.000 kHz    297.000000 MHz
  Video Capability Data Block:
    YCbCr quantization: No Data
    RGB quantization: Selectable (via AVI Q)
    PT scan behavior: Supports both over- and underscan
    IT scan behavior: Supports both over- and underscan
    CE scan behavior: Supports both over- and underscan
  Colorimetry Data Block:
    xvYCC601
    xvYCC709
    BT2020YCC
    BT2020RGB
    Gamut Boundary Description Metadata Profile P0
  HDR Static Metadata Data Block:
    Electro optical transfer functions:
      Traditional gamma - SDR luminance range
      SMPTE ST2084
    Supported static metadata descriptors:
      Static metadata type 1
  Vendor-Specific Video Data Block (Dolby), OUI 00-D0-46:
    Version: 2 (12 bytes)
    Supports Backlight Control
    Supports global dimming
    DM Version: 3.x
    Backlt Min Luma: 100 cd/m^2
    Interface: Standard + Low-Latency
    Supports 10b 12b 444: Not supported
    Target Min PQ v2: 180 (0.04494425 cd/m^2)
    Target Max PQ v2: 2575 (320 cd/m^2)
    Unique Rx, Ry: 0.64453125, 0.33984375
    Unique Gx, Gy: 0.30859375, 0.60156250
    Unique Bx, By: 0.14843750, 0.05078125
  Detailed Timing Descriptors:
    DTD 3:  1920x1080i  60.000000 Hz  16:9     33.750 kHz     74.250000 MHz (1394 mm x 784 mm)
                 Hfront   88 Hsync  44 Hback  148 Hpol P
                 Vfront    2 Vsync   5 Vback   15 Vpol P Vfront +0.5 Odd Field
                 Vfront    2 Vsync   5 Vback   15 Vpol P Vback  +0.5 Even Field
    DTD 4:  1366x768    60.003026 Hz 683:384   49.022 kHz     87.260000 MHz (1394 mm x 784 mm)
                 Hfront   62 Hsync 144 Hback  208 Hpol P
                 Vfront   10 Vsync   5 Vback   34 Vpol P
Checksum: 0x0b  Unused space in Extension Block: 16 bytes

----------------

Warnings:

Block 0, Base EDID:
  Vendor & Product Identification: The serial number is one of the known dummy values, it should probably be set to 0.
  Detailed Timing Descriptor #1: DTD is identical to VIC 95, which is not present in the CTA Ext Block.
Block 1, CTA-861 Extension Block:
  Video Data Block: VIC 16 and the first DTD are not identical. Is this intended?
  Video Capability Data Block: Set Selectable YCbCr Quantization to avoid interop issues.
  Video Capability Data Block: S_PT is equal to S_IT and S_CE, so should be set to 0 instead.
  Colorimetry Data Block: Set the sRGB colorimetry bit to avoid interop issues.
EDID:
  Base EDID: Some timings are out of range of the Monitor Ranges:
    Vertical Freq: 24.000 - 60.317 Hz (Monitor: 50.000 - 75.000 Hz)
    Horizontal Freq: 15.625 - 67.500 kHz (Monitor: 30.000 - 80.000 kHz)

Failures:

Block 1, CTA-861 Extension Block:
  Video Data Block: Duplicate VIC 34.
  Video Data Block: Duplicate VIC 1.
  Vendor-Specific Data Block (HDMI), OUI 00-0C-03: HDMI VIC Codes must have their CTA-861 VIC equivalents in the VSB.
EDID:
  Extension Block 2 started with EDID header, ignoring Extension Blocks >= 2.

EDID conformity: FAIL
