edid-decode (hex):

00 ff ff ff ff ff ff 00 22 70 19 00 79 01 00 00
34 13 01 03 80 36 1e 78 2a 82 15 a4 56 4f 9d 24
12 50 54 21 08 00 81 80 95 00 b3 00 01 01 01 01
01 01 01 01 01 01 02 3a 80 18 71 38 2d 40 58 2c
45 00 1f 31 21 00 00 1e 00 00 00 ff 00 39 35 32
46 58 32 34 59 30 30 33 37 37 00 00 00 fc 00 48
53 47 31 30 37 34 0a 20 20 20 20 20 00 00 00 fd
00 3b 3d 1f 46 0f 00 0a 20 20 20 20 20 20 01 06

02 03 1c 71 46 01 02 03 04 05 90 26 09 07 07 11
07 50 83 01 00 00 65 03 0c 00 20 00 02 3a 80 18
71 38 2d 40 58 2c 45 00 1f 31 21 00 00 1e 01 1d
80 18 71 1c 16 20 58 2c 25 00 1f 31 21 00 00 9e
8c 0a d0 8a 20 e0 2d 10 10 3e 96 00 1f 31 21 00
00 18 01 1d 00 72 51 d0 1e 20 6e 28 55 00 1f 31
21 00 00 1e 00 00 00 00 00 00 00 00 00 00 00 00
00 00 00 00 00 00 00 00 00 00 00 00 00 00 00 56

00 ff ff ff ff ff ff 00 22 70 19 00 79 01 00 00
34 13 01 03 80 36 1e 78 2a 82 15 a4 56 4f 9d 24
12 50 54 21 08 00 81 80 95 00 b3 00 01 01 01 01
01 01 01 01 01 01 02 3a 80 18 71 38 2d 40 58 2c
45 00 1f 31 21 00 00 1e 00 00 00 ff 00 39 35 32
46 58 32 34 59 30 30 33 37 37 00 00 00 fc 00 48
53 47 31 30 37 34 0a 20 20 20 20 20 00 00 00 fd
00 3b 3d 1f 46 0f 00 0a 20 20 20 20 20 20 01 06

02 03 1c 71 46 01 02 03 04 05 90 26 09 07 07 11
07 50 83 01 00 00 65 03 0c 00 20 00 02 3a 80 18
71 38 2d 40 58 2c 45 00 1f 31 21 00 00 1e 01 1d
80 18 71 1c 16 20 58 2c 25 00 1f 31 21 00 00 9e
8c 0a d0 8a 20 e0 2d 10 10 3e 96 00 1f 31 21 00
00 18 01 1d 00 72 51 d0 1e 20 6e 28 55 00 1f 31
21 00 00 1e 00 00 00 00 00 00 00 00 00 00 00 00
00 00 00 00 00 00 00 00 00 00 00 00 00 00 00 56

----------------

Block 0, Base EDID:
  EDID Structure Version & Revision: 1.3
  Vendor & Product Identification:
    Manufacturer: HSP
    Model: 25
    Serial Number: ...
    Made in: week 52 of 2009
  Basic Display Parameters & Features:
    Digital display
    Maximum image size: 54 cm x 30 cm
    Gamma: 2.20
    DPMS levels: Off
    RGB color display
    First detailed timing is the preferred timing
  Color Characteristics:
    Red  : 0.6425, 0.3359
    Green: 0.3085, 0.6152
    Blue : 0.1406, 0.0712
    White: 0.3134, 0.3291
  Established Timings I & II:
    DMT 0x04:   640x480    59.940476 Hz   4:3     31.469 kHz     25.175000 MHz
    DMT 0x09:   800x600    60.316541 Hz   4:3     37.879 kHz     40.000000 MHz
    DMT 0x10:  1024x768    60.003840 Hz   4:3     48.363 kHz     65.000000 MHz
  Standard Timings:
    DMT 0x23:  1280x1024   60.019740 Hz   5:4     63.981 kHz    108.000000 MHz
    DMT 0x2f:  1440x900    59.887445 Hz  16:10    55.935 kHz    106.500000 MHz
    DMT 0x3a:  1680x1050   59.954250 Hz  16:10    65.290 kHz    146.250000 MHz
  Detailed Timing Descriptors:
    DTD 1:  1920x1080   60.000000 Hz  16:9     67.500 kHz    148.500000 MHz (543 mm x 305 mm)
                 Hfront   88 Hsync  44 Hback  148 Hpol P
                 Vfront    4 Vsync   5 Vback   36 Vpol P
    Display Product Serial Number: ...
    Display Product Name: 'HSG1074'
    Display Range Limits:
      Monitor ranges (GTF): 59-61 Hz V, 31-70 kHz H, max dotclock 150 MHz
  Extension blocks: 1
Checksum: 0x06

----------------

Block 1, CTA-861 Extension Block:
  Revision: 3
  Basic audio support
  Supports YCbCr 4:4:4
  Supports YCbCr 4:2:2
  Native DTDs: 1
  Video Data Block:
    VIC   1:   640x480    59.940476 Hz   4:3     31.469 kHz     25.175000 MHz
    VIC   2:   720x480    59.940060 Hz   4:3     31.469 kHz     27.000000 MHz
    VIC   3:   720x480    59.940060 Hz  16:9     31.469 kHz     27.000000 MHz
    VIC   4:  1280x720    60.000000 Hz  16:9     45.000 kHz     74.250000 MHz
    VIC   5:  1920x1080i  60.000000 Hz  16:9     33.750 kHz     74.250000 MHz
    VIC  16:  1920x1080   60.000000 Hz  16:9     67.500 kHz    148.500000 MHz (native)
  Audio Data Block:
    Linear PCM:
      Max channels: 2
      Supported sample rates (kHz): 48 44.1 32
      Supported sample sizes (bits): 24 20 16
    AC-3:
      Max channels: 2
      Supported sample rates (kHz): 48 44.1 32
      Maximum bit rate: 640 kb/s
  Speaker Allocation Data Block:
    FL/FR - Front Left/Right
  Vendor-Specific Data Block (HDMI), OUI 00-0C-03:
    Source physical address: 2.0.0.0
  Detailed Timing Descriptors:
    DTD 2:  1920x1080   60.000000 Hz  16:9     67.500 kHz    148.500000 MHz (543 mm x 305 mm)
                 Hfront   88 Hsync  44 Hback  148 Hpol P
                 Vfront    4 Vsync   5 Vback   36 Vpol P
    DTD 3:  1920x1080i  60.000000 Hz  16:9     33.750 kHz     74.250000 MHz (543 mm x 305 mm)
                 Hfront   88 Hsync  44 Hback  148 Hpol P
                 Vfront    2 Vsync   5 Vback   15 Vpol P Vfront +0.5 Odd Field
                 Vfront    2 Vsync   5 Vback   15 Vpol P Vback  +0.5 Even Field
    DTD 4:   720x480    59.940060 Hz   3:2     31.469 kHz     27.000000 MHz (543 mm x 305 mm)
                 Hfront   16 Hsync  62 Hback   60 Hpol N
                 Vfront    9 Vsync   6 Vback   30 Vpol N
    DTD 5:  1280x720    60.000000 Hz  16:9     45.000 kHz     74.250000 MHz (543 mm x 305 mm)
                 Hfront  110 Hsync  40 Hback  220 Hpol P
                 Vfront    5 Vsync   5 Vback   20 Vpol P
Checksum: 0x56  Unused space in Extension Block: 27 bytes

----------------

Warnings:

Block 1, CTA-861 Extension Block:
  IT Video Formats are overscanned by default, but normally this should be underscanned.
  Video Data Block: VIC 1 and the first DTD are not identical. Is this intended?
  Video Data Block: All VICs are in ascending order, and the first (preferred) VIC <= 4, is that intended?
  Detailed Timing Descriptor #4: Image size is 543x305 mm, but based on the picture AR it should be 457x305 mm.
  Display Product Serial Number is set, so the Serial Number in the Base EDID should be 0.
  Add a Colorimetry Data Block with the sRGB colorimetry bit set to avoid interop issues.

Failures:

Block 1, CTA-861 Extension Block:
  Missing VCDB, needed for Set Selectable RGB Quantization to avoid interop issues.
EDID:
  Extension Block 2 started with EDID header, ignoring Extension Blocks >= 2.

EDID conformity: FAIL
