edid-decode (hex):

00 ff ff ff ff ff ff 00 36 69 a7 3c 01 01 01 01
1a 1f 01 03 80 3b 21 78 ee 55 b5 ac 50 47 ac 25
0a 50 54 3f cf 00 81 80 95 00 b3 00 d1 c0 01 01
01 01 01 01 01 01 53 35 80 9c 70 38 10 40 58 2c
45 00 55 50 21 00 00 1a 00 00 00 fd 00 30 a5 1e
a7 3c 00 0a 20 20 20 20 20 20 00 00 00 fc 00 4d
53 49 20 4d 41 47 32 37 34 52 32 0a 00 00 00 ff
00 43 41 37 41 33 36 31 36 30 31 31 31 39 01 96

02 03 44 f1 4b 01 02 03 04 90 11 12 13 1f 3f 40
23 09 17 07 83 01 00 00 6a 03 0c 00 10 00 38 3c
20 00 00 67 d8 5d c4 01 78 80 03 6d 1a 00 00 02
01 30 a5 ec 00 00 00 00 00 e3 05 e3 01 e6 06 07
01 57 57 44 7d 97 80 a0 70 38 32 40 30 20 75 08
55 50 21 00 00 1a 13 84 80 a0 70 38 32 40 30 20
75 08 55 50 21 00 00 1a b2 4d 80 a0 70 38 32 40
30 20 75 08 55 50 21 00 00 1a 00 00 00 00 00 6a

00 ff ff ff ff ff ff 00 36 69 a7 3c 01 01 01 01
1a 1f 01 03 80 3b 21 78 ee 55 b5 ac 50 47 ac 25
0a 50 54 3f cf 00 81 80 95 00 b3 00 d1 c0 01 01
01 01 01 01 01 01 53 35 80 9c 70 38 10 40 58 2c
45 00 55 50 21 00 00 1a 00 00 00 fd 00 30 a5 1e
a7 3c 00 0a 20 20 20 20 20 20 00 00 00 fc 00 4d
53 49 20 4d 41 47 32 37 34 52 32 0a 00 00 00 ff
00 43 41 37 41 33 36 31 36 30 31 31 31 39 01 96

02 03 44 f1 4b 01 02 03 04 90 11 12 13 1f 3f 40
23 09 17 07 83 01 00 00 6a 03 0c 00 10 00 38 3c
20 00 00 67 d8 5d c4 01 78 80 03 6d 1a 00 00 02
01 30 a5 ec 00 00 00 00 00 e3 05 e3 01 e6 06 07
01 57 57 44 7d 97 80 a0 70 38 32 40 30 20 75 08
55 50 21 00 00 1a 13 84 80 a0 70 38 32 40 30 20
75 08 55 50 21 00 00 1a b2 4d 80 a0 70 38 32 40
30 20 75 08 55 50 21 00 00 1a 00 00 00 00 00 6a

----------------

Block 0, Base EDID:
  EDID Structure Version & Revision: 1.3
  Vendor & Product Identification:
    Manufacturer: MSI
    Model: 15527
    Serial Number: ...
    Made in: week 26 of 2021
  Basic Display Parameters & Features:
    Digital display
    Maximum image size: 59 cm x 33 cm
    Gamma: 2.20
    DPMS levels: Standby Suspend Off
    RGB color display
    Default (sRGB) color space is primary color space
    First detailed timing is the preferred timing
  Color Characteristics:
    Red  : 0.6728, 0.3134
    Green: 0.2783, 0.6728
    Blue : 0.1464, 0.0419
    White: 0.3134, 0.3291
  Established Timings I & II:
    DMT 0x04:   640x480    59.940476 Hz   4:3     31.469 kHz     25.175000 MHz
    Apple   :   640x480    66.666667 Hz   4:3     35.000 kHz     30.240000 MHz
    DMT 0x05:   640x480    72.808802 Hz   4:3     37.861 kHz     31.500000 MHz
    DMT 0x06:   640x480    75.000000 Hz   4:3     37.500 kHz     31.500000 MHz
    DMT 0x08:   800x600    56.250000 Hz   4:3     35.156 kHz     36.000000 MHz
    DMT 0x09:   800x600    60.316541 Hz   4:3     37.879 kHz     40.000000 MHz
    DMT 0x0a:   800x600    72.187572 Hz   4:3     48.077 kHz     50.000000 MHz
    DMT 0x0b:   800x600    75.000000 Hz   4:3     46.875 kHz     49.500000 MHz
    DMT 0x10:  1024x768    60.003840 Hz   4:3     48.363 kHz     65.000000 MHz
    DMT 0x11:  1024x768    70.069359 Hz   4:3     56.476 kHz     75.000000 MHz
    DMT 0x12:  1024x768    75.028582 Hz   4:3     60.023 kHz     78.750000 MHz
    DMT 0x24:  1280x1024   75.024675 Hz   5:4     79.976 kHz    135.000000 MHz
  Standard Timings:
    DMT 0x23:  1280x1024   60.019740 Hz   5:4     63.981 kHz    108.000000 MHz
    DMT 0x2f:  1440x900    59.887445 Hz  16:10    55.935 kHz    106.500000 MHz
    DMT 0x3a:  1680x1050   59.954250 Hz  16:10    65.290 kHz    146.250000 MHz
    DMT 0x52:  1920x1080   60.000000 Hz  16:9     67.500 kHz    148.500000 MHz
  Detailed Timing Descriptors:
    DTD 1:  1920x1080   59.996589 Hz  16:9     65.756 kHz    136.510000 MHz (597 mm x 336 mm)
                 Hfront   88 Hsync  44 Hback   24 Hpol P
                 Vfront    4 Vsync   5 Vback    7 Vpol N
    Display Range Limits:
      Monitor ranges (GTF): 48-165 Hz V, 30-167 kHz H, max dotclock 600 MHz
    Display Product Name: 'MSI MAG274R2'
    Display Product Serial Number: ...
  Extension blocks: 1
Checksum: 0x96

----------------

Block 1, CTA-861 Extension Block:
  Revision: 3
  Underscans IT Video Formats by default
  Basic audio support
  Supports YCbCr 4:4:4
  Supports YCbCr 4:2:2
  Native DTDs: 1
  Video Data Block:
    VIC   1:   640x480    59.940476 Hz   4:3     31.469 kHz     25.175000 MHz
    VIC   2:   720x480    59.940060 Hz   4:3     31.469 kHz     27.000000 MHz
    VIC   3:   720x480    59.940060 Hz  16:9     31.469 kHz     27.000000 MHz
    VIC   4:  1280x720    60.000000 Hz  16:9     45.000 kHz     74.250000 MHz
    VIC  16:  1920x1080   60.000000 Hz  16:9     67.500 kHz    148.500000 MHz (native)
    VIC  17:   720x576    50.000000 Hz   4:3     31.250 kHz     27.000000 MHz
    VIC  18:   720x576    50.000000 Hz  16:9     31.250 kHz     27.000000 MHz
    VIC  19:  1280x720    50.000000 Hz  16:9     37.500 kHz     74.250000 MHz
    VIC  31:  1920x1080   50.000000 Hz  16:9     56.250 kHz    148.500000 MHz
    VIC  63:  1920x1080  120.000000 Hz  16:9    135.000 kHz    297.000000 MHz
    VIC  64:  1920x1080  100.000000 Hz  16:9    112.500 kHz    297.000000 MHz
  Audio Data Block:
    Linear PCM:
      Max channels: 2
      Supported sample rates (kHz): 96 48 44.1 32
      Supported sample sizes (bits): 24 20 16
  Speaker Allocation Data Block:
    FL/FR - Front Left/Right
  Vendor-Specific Data Block (HDMI), OUI 00-0C-03:
    Source physical address: 1.0.0.0
    DC_36bit
    DC_30bit
    DC_Y444
    Maximum TMDS clock: 300 MHz
    Extended HDMI video details:
  Vendor-Specific Data Block (HDMI Forum), OUI C4-5D-D8:
    Version: 1
    Maximum TMDS Character Rate: 600 MHz
    SCDC Present
    Supports 12-bits/component Deep Color 4:2:0 Pixel Encoding
    Supports 10-bits/component Deep Color 4:2:0 Pixel Encoding
  Vendor-Specific Data Block (AMD), OUI 00-00-1A:
    Version: 2
    Feature Caps: 0x01
    Minimum Refresh Rate: 48 Hz
    Maximum Refresh Rate: 165 Hz
    Flags 1.x: 0xec (MCCS)
    Flags 2.x: 0x00
  Colorimetry Data Block:
    xvYCC601
    xvYCC709
    BT2020cYCC
    BT2020YCC
    BT2020RGB
    Gamut Boundary Description Metadata Profile P0
  HDR Static Metadata Data Block:
    Electro optical transfer functions:
      Traditional gamma - SDR luminance range
      Traditional gamma - HDR luminance range
      SMPTE ST2084
    Supported static metadata descriptors:
      Static metadata type 1
    Desired content max luminance: 87 (329.151 cd/m^2)
    Desired content max frame-average luminance: 87 (329.151 cd/m^2)
    Desired content min luminance: 68 (0.234 cd/m^2)
  Detailed Timing Descriptors:
    DTD 2:  1920x1080  164.997447 Hz  16:9    186.447 kHz    387.810000 MHz (597 mm x 336 mm)
                 Hfront   48 Hsync  32 Hback   80 Hpol P
                 Vfront   39 Vsync   5 Vback    6 Vpol N
    DTD 3:  1920x1080  143.852110 Hz  16:9    162.553 kHz    338.110000 MHz (597 mm x 336 mm)
                 Hfront   48 Hsync  32 Hback   80 Hpol P
                 Vfront   39 Vsync   5 Vback    6 Vpol N
    DTD 4:  1920x1080   84.623894 Hz  16:9     95.625 kHz    198.900000 MHz (597 mm x 336 mm)
                 Hfront   48 Hsync  32 Hback   80 Hpol P
                 Vfront   39 Vsync   5 Vback    6 Vpol N
Checksum: 0x6a  Unused space in Extension Block: 5 bytes

----------------

Warnings:

Block 0, Base EDID:
  Vendor & Product Identification: The serial number is one of the known dummy values, it should probably be set to 0.
Block 1, CTA-861 Extension Block:
  Video Data Block: VIC 1 and the first DTD are not identical. Is this intended?
  Video Data Block: All VICs are in ascending order, and the first (preferred) VIC <= 4, is that intended?
  Display Product Serial Number is set, so the Serial Number in the Base EDID should be 0.
EDID:
  Base EDID: Some timings are out of range of the Monitor Ranges:
    Horizontal Freq: 31.250 - 186.447 kHz (Monitor: 30.000 - 167.000 kHz)

Failures:

Block 0, Base EDID:
  Basic Display Parameters & Features: sRGB is signaled, but the chromaticities do not match.
Block 1, CTA-861 Extension Block:
  Missing VCDB, needed for Set Selectable RGB Quantization to avoid interop issues.
EDID:
  Extension Block 2 started with EDID header, ignoring Extension Blocks >= 2.

EDID conformity: FAIL
