edid-decode (hex):

00 ff ff ff ff ff ff 00 22 45 30 00 01 00 00 00
0a 1d 01 03 80 73 41 78 0a cf 74 a3 57 4c b0 23
09 48 4c 21 08 00 81 80 45 40 61 40 95 00 01 01
01 01 01 01 01 01 02 3a 80 18 71 38 2d 40 58 2c
45 00 c4 8e 21 00 00 1e 66 21 50 b0 51 00 1b 30
40 70 36 00 c4 8e 21 00 00 1e 00 00 00 fc 00 48
61 69 65 72 20 54 56 0a 20 20 20 20 00 00 00 fd
00 32 4b 1e 50 17 00 0a 20 20 20 20 20 20 01 c6

02 03 3e f2 4d 01 03 04 05 07 90 12 13 14 16 9f
20 22 29 09 07 07 11 17 50 57 7f 00 83 01 00 00
e2 00 ff 72 03 0c 00 10 00 b8 44 20 c0 84 01 02
03 04 01 41 00 00 e3 05 ff 01 e3 06 0f 01 8c 0a
d0 8a 20 e0 2d 10 10 3e 96 00 c4 8e 21 00 00 18
8c 0a d0 90 20 40 31 20 0c 40 55 00 c4 8e 21 00
00 18 01 1d 00 bc 52 d0 1e 20 b8 28 55 40 c4 8e
21 00 00 1e 00 00 00 00 00 00 00 00 00 00 00 ea

00 ff ff ff ff ff ff 00 22 45 30 00 01 00 00 00
0a 1d 01 03 80 73 41 78 0a cf 74 a3 57 4c b0 23
09 48 4c 21 08 00 81 80 45 40 61 40 95 00 01 01
01 01 01 01 01 01 02 3a 80 18 71 38 2d 40 58 2c
45 00 c4 8e 21 00 00 1e 66 21 50 b0 51 00 1b 30
40 70 36 00 c4 8e 21 00 00 1e 00 00 00 fc 00 48
61 69 65 72 20 54 56 0a 20 20 20 20 00 00 00 fd
00 32 4b 1e 50 17 00 0a 20 20 20 20 20 20 01 c6

02 03 3e f2 4d 01 03 04 05 07 90 12 13 14 16 9f
20 22 29 09 07 07 11 17 50 57 7f 00 83 01 00 00
e2 00 ff 72 03 0c 00 10 00 b8 44 20 c0 84 01 02
03 04 01 41 00 00 e3 05 ff 01 e3 06 0f 01 8c 0a
d0 8a 20 e0 2d 10 10 3e 96 00 c4 8e 21 00 00 18
8c 0a d0 90 20 40 31 20 0c 40 55 00 c4 8e 21 00
00 18 01 1d 00 bc 52 d0 1e 20 b8 28 55 40 c4 8e
21 00 00 1e 00 00 00 00 00 00 00 00 00 00 00 ea

----------------

Block 0, Base EDID:
  EDID Structure Version & Revision: 1.3
  Vendor & Product Identification:
    Manufacturer: HRE
    Model: 48
    Serial Number: ...
    Made in: week 10 of 2019
  Basic Display Parameters & Features:
    Digital display
    Maximum image size: 115 cm x 65 cm
    Gamma: 2.20
    RGB color display
    First detailed timing is the preferred timing
  Color Characteristics:
    Red  : 0.6396, 0.3398
    Green: 0.2998, 0.6904
    Blue : 0.1376, 0.0380
    White: 0.2822, 0.2968
  Established Timings I & II:
    DMT 0x04:   640x480    59.940476 Hz   4:3     31.469 kHz     25.175000 MHz
    DMT 0x09:   800x600    60.316541 Hz   4:3     37.879 kHz     40.000000 MHz
    DMT 0x10:  1024x768    60.003840 Hz   4:3     48.363 kHz     65.000000 MHz
  Standard Timings:
    DMT 0x23:  1280x1024   60.019740 Hz   5:4     63.981 kHz    108.000000 MHz
    DMT 0x09:   800x600    60.316541 Hz   4:3     37.879 kHz     40.000000 MHz
    DMT 0x10:  1024x768    60.003840 Hz   4:3     48.363 kHz     65.000000 MHz
    DMT 0x2f:  1440x900    59.887445 Hz  16:10    55.935 kHz    106.500000 MHz
  Detailed Timing Descriptors:
    DTD 1:  1920x1080   60.000000 Hz  16:9     67.500 kHz    148.500000 MHz (708 mm x 398 mm)
                 Hfront   88 Hsync  44 Hback  148 Hpol P
                 Vfront    4 Vsync   5 Vback   36 Vpol P
    DTD 2:  1360x768    60.015162 Hz  85:48    47.712 kHz     85.500000 MHz (708 mm x 398 mm)
                 Hfront   64 Hsync 112 Hback  256 Hpol P
                 Vfront    3 Vsync   6 Vback   18 Vpol P
    Display Product Name: 'Haier TV'
    Display Range Limits:
      Monitor ranges (GTF): 50-75 Hz V, 30-80 kHz H, max dotclock 230 MHz
  Extension blocks: 1
Checksum: 0xc6

----------------

Block 1, CTA-861 Extension Block:
  Revision: 3
  Underscans IT Video Formats by default
  Basic audio support
  Supports YCbCr 4:4:4
  Supports YCbCr 4:2:2
  Native DTDs: 2
  Video Data Block:
    VIC   1:   640x480    59.940476 Hz   4:3     31.469 kHz     25.175000 MHz
    VIC   3:   720x480    59.940060 Hz  16:9     31.469 kHz     27.000000 MHz
    VIC   4:  1280x720    60.000000 Hz  16:9     45.000 kHz     74.250000 MHz
    VIC   5:  1920x1080i  60.000000 Hz  16:9     33.750 kHz     74.250000 MHz
    VIC   7:  1440x480i   59.940060 Hz  16:9     15.734 kHz     27.000000 MHz
    VIC  16:  1920x1080   60.000000 Hz  16:9     67.500 kHz    148.500000 MHz (native)
    VIC  18:   720x576    50.000000 Hz  16:9     31.250 kHz     27.000000 MHz
    VIC  19:  1280x720    50.000000 Hz  16:9     37.500 kHz     74.250000 MHz
    VIC  20:  1920x1080i  50.000000 Hz  16:9     28.125 kHz     74.250000 MHz
    VIC  22:  1440x576i   50.000000 Hz  16:9     15.625 kHz     27.000000 MHz
    VIC  31:  1920x1080   50.000000 Hz  16:9     56.250 kHz    148.500000 MHz (native)
    VIC  32:  1920x1080   24.000000 Hz  16:9     27.000 kHz     74.250000 MHz
    VIC  34:  1920x1080   30.000000 Hz  16:9     33.750 kHz     74.250000 MHz
  Audio Data Block:
    Linear PCM:
      Max channels: 2
      Supported sample rates (kHz): 48 44.1 32
      Supported sample sizes (bits): 24 20 16
    AC-3:
      Max channels: 2
      Supported sample rates (kHz): 96 48 44.1 32
      Maximum bit rate: 640 kb/s
    Enhanced AC-3 (DD+):
      Max channels: 8
      Supported sample rates (kHz): 192 176.4 96 88.2 48 44.1 32
  Speaker Allocation Data Block:
    FL/FR - Front Left/Right
  Video Capability Data Block:
    YCbCr quantization: Selectable (via AVI YQ)
    RGB quantization: Selectable (via AVI Q)
    PT scan behavior: Supports both over- and underscan
    IT scan behavior: Supports both over- and underscan
    CE scan behavior: Supports both over- and underscan
  Vendor-Specific Data Block (HDMI), OUI 00-0C-03:
    Source physical address: 1.0.0.0
    Supports_AI
    DC_36bit
    DC_30bit
    DC_Y444
    Maximum TMDS clock: 340 MHz
    Extended HDMI video details:
      3D present
      3D-capable-VIC mask present
      HDMI VICs:
        HDMI VIC 1:  3840x2160   30.000000 Hz  16:9     67.500 kHz    297.000000 MHz
        HDMI VIC 2:  3840x2160   25.000000 Hz  16:9     56.250 kHz    297.000000 MHz
        HDMI VIC 3:  3840x2160   24.000000 Hz  16:9     54.000 kHz    297.000000 MHz
        HDMI VIC 4:  4096x2160   24.000000 Hz 256:135   54.000 kHz    297.000000 MHz
      3D: Side-by-side (half, horizontal)
      3D: Top-and-bottom
      3D: Frame-packing
      3D VIC indices that support these capabilities:
  Colorimetry Data Block:
    xvYCC601
    xvYCC709
    sYCC601
    opYCC601
    opRGB
    BT2020cYCC
    BT2020YCC
    BT2020RGB
    Gamut Boundary Description Metadata Profile P0
  HDR Static Metadata Data Block:
    Electro optical transfer functions:
      Traditional gamma - SDR luminance range
      Traditional gamma - HDR luminance range
      SMPTE ST2084
      Hybrid Log-Gamma
    Supported static metadata descriptors:
      Static metadata type 1
  Detailed Timing Descriptors:
    DTD 3:   720x480    59.940060 Hz   3:2     31.469 kHz     27.000000 MHz (708 mm x 398 mm)
                 Hfront   16 Hsync  62 Hback   60 Hpol N
                 Vfront    9 Vsync   6 Vback   30 Vpol N
    DTD 4:   720x576    50.000000 Hz   5:4     31.250 kHz     27.000000 MHz (708 mm x 398 mm)
                 Hfront   12 Hsync  64 Hback   68 Hpol N
                 Vfront    5 Vsync   5 Vback   39 Vpol N
    DTD 5:  1280x720    50.000000 Hz  16:9     37.500 kHz     74.250000 MHz (708 mm x 398 mm)
                 Hfront  440 Hsync  40 Hback  220 Hpol P
                 Vfront    5 Vsync   5 Vback   20 Vpol P
Checksum: 0xea  Unused space in Extension Block: 11 bytes

----------------

Warnings:

Block 0, Base EDID:
  Vendor & Product Identification: The serial number is one of the known dummy values, it should probably be set to 0.
Block 1, CTA-861 Extension Block:
  Video Data Block: VIC 1 and the first DTD are not identical. Is this intended?
  Video Data Block: All VICs are in ascending order, and the first (preferred) VIC <= 4, is that intended?
  Video Capability Data Block: S_PT is equal to S_IT and S_CE, so should be set to 0 instead.
  Colorimetry Data Block: Set the sRGB colorimetry bit to avoid interop issues.
  Detailed Timing Descriptor #3: Image size is 708x398 mm, but based on the picture AR it should be 597x398 mm.
  Detailed Timing Descriptor #4: Image size is 708x398 mm, but based on the picture AR it should be 497x398 mm.
EDID:
  Base EDID: Some timings are out of range of the Monitor Ranges:
    Vertical Freq: 24.000 - 60.317 Hz (Monitor: 50.000 - 75.000 Hz)
    Horizontal Freq: 15.625 - 67.500 kHz (Monitor: 30.000 - 80.000 kHz)
    Maximum Clock: 297.000 MHz (Monitor: 230.000 MHz)

Failures:

Block 0, Base EDID:
  Detailed Timing Descriptor #1: Mismatch of image size 708x398 mm vs display size 1150x650 mm.
  Detailed Timing Descriptor #2: Mismatch of image size 708x398 mm vs display size 1150x650 mm.
Block 1, CTA-861 Extension Block:
  Vendor-Specific Data Block (HDMI), OUI 00-0C-03: HDMI VIC Codes must have their CTA-861 VIC equivalents in the VSB.
  Detailed Timing Descriptor #3: Mismatch of image size 708x398 mm vs display size 1150x650 mm.
  Detailed Timing Descriptor #4: Mismatch of image size 708x398 mm vs display size 1150x650 mm.
  Detailed Timing Descriptor #5: Mismatch of image size 708x398 mm vs display size 1150x650 mm.
EDID:
  Extension Block 2 started with EDID header, ignoring Extension Blocks >= 2.
  CTA-861: Native progressive timings are a mix of several resolutions.

EDID conformity: FAIL
