edid-decode (hex):

00 ff ff ff ff ff ff 00 59 3a 41 00 01 01 01 01
27 12 01 03 08 3a 20 78 2a 98 6c a3 55 44 98 26
0e 47 49 a5 4a 00 45 59 01 01 01 01 01 01 01 01
01 01 01 01 01 01 66 21 50 b0 51 00 1b 30 40 70
36 00 48 80 42 00 00 1e 00 00 00 fd 00 32 55 1f
46 0b 00 0a 20 20 20 20 20 20 00 00 00 ff 00 4b
4d 42 42 41 49 33 38 34 36 31 34 37 00 00 00 fc
00 56 57 32 36 4c 20 48 44 54 56 32 30 46 00 56

00 ff ff ff ff ff ff 00 59 3a 41 00 01 01 01 01
27 12 01 03 08 3a 20 78 2a 98 6c a3 55 44 98 26
0e 47 49 a5 4a 00 45 59 01 01 01 01 01 01 01 01
01 01 01 01 01 01 66 21 50 b0 51 00 1b 30 40 70
36 00 48 80 42 00 00 1e 00 00 00 fd 00 32 55 1f
46 0b 00 0a 20 20 20 20 20 20 00 00 00 ff 00 4b
4d 42 42 41 49 33 38 34 36 31 34 37 00 00 00 fc
00 56 57 32 36 4c 20 48 44 54 56 32 30 46 00 56

----------------

Block 0, Base EDID:
  EDID Structure Version & Revision: 1.3
  Vendor & Product Identification:
    Manufacturer: VIZ
    Model: 65
    Serial Number: ...
    Made in: week 39 of 2008
  Basic Display Parameters & Features:
    Analog display
    Signal Level Standard: 0.700 : 0.300 : 1.000 V p-p
    Blank level equals black level
    Sync: Separate
    Maximum image size: 58 cm x 32 cm
    Gamma: 2.20
    DPMS levels: Off
    RGB color display
    First detailed timing is the preferred timing
  Color Characteristics:
    Red  : 0.6386, 0.3330
    Green: 0.2675, 0.5937
    Blue : 0.1494, 0.0566
    White: 0.2802, 0.2851
  Established Timings I & II:
    IBM     :   720x400    70.081663 Hz   9:5     31.467 kHz     28.320000 MHz
    DMT 0x04:   640x480    59.940476 Hz   4:3     31.469 kHz     25.175000 MHz
    DMT 0x06:   640x480    75.000000 Hz   4:3     37.500 kHz     31.500000 MHz
    DMT 0x09:   800x600    60.316541 Hz   4:3     37.879 kHz     40.000000 MHz
    DMT 0x0b:   800x600    75.000000 Hz   4:3     46.875 kHz     49.500000 MHz
    DMT 0x10:  1024x768    60.003840 Hz   4:3     48.363 kHz     65.000000 MHz
    DMT 0x12:  1024x768    75.028582 Hz   4:3     60.023 kHz     78.750000 MHz
  Standard Timings:
    DMT 0x0c:   800x600    85.061274 Hz   4:3     53.674 kHz     56.250000 MHz
  Detailed Timing Descriptors:
    DTD 1:  1360x768    60.015162 Hz  85:48    47.712 kHz     85.500000 MHz (1096 mm x 640 mm)
                 Hfront   64 Hsync 112 Hback  256 Hpol P
                 Vfront    3 Vsync   6 Vback   18 Vpol P
    Display Range Limits:
      Monitor ranges (GTF): 50-85 Hz V, 31-70 kHz H, max dotclock 110 MHz
    Display Product Serial Number: ...
    Display Product Name: 'VW26L HDTV20F'
Checksum: 0x56

----------------

Warnings:

Block 0, Base EDID:
  Vendor & Product Identification: The serial number is one of the known dummy values, it should probably be set to 0.
  Detailed Timing Descriptor #1: Image size is 1096x640 mm, but based on the picture AR it should be 1096x618 mm.

Failures:

Block 0, Base EDID:
  Detailed Timing Descriptor #1: Mismatch of image size 1096x640 mm vs display size 580x320 mm.
EDID:
  Extension Block 1 started with EDID header, ignoring Extension Blocks >= 1.
  Base EDID: The DTD max image size is 1096x640mm, which is larger than the display size 580.0x320.0mm.

EDID conformity: FAIL
