edid-decode (hex):

00 ff ff ff ff ff ff 00 1e 6d ed 57 01 01 01 01
01 14 01 04 68 33 1c 78 ea c6 65 a0 59 58 9d 27
0e 50 54 a1 08 00 b3 00 81 80 81 40 71 40 01 01
01 01 01 01 01 01 02 3a 80 18 71 38 2d 40 58 2c
45 00 fd 1e 11 00 00 1e 00 00 00 fd 00 38 3d 1e
45 0f 00 0a 20 20 20 20 20 20 00 00 00 fc 00 4d
32 33 38 30 41 0a 20 20 20 20 20 20 00 00 00 ff
00 0a 20 20 20 20 20 20 20 20 20 20 20 20 00 e2

00 ff ff ff ff ff ff 00 1e 6d ed 57 01 01 01 01
01 14 01 04 68 33 1c 78 ea c6 65 a0 59 58 9d 27
0e 50 54 a1 08 00 b3 00 81 80 81 40 71 40 01 01
01 01 01 01 01 01 02 3a 80 18 71 38 2d 40 58 2c
45 00 fd 1e 11 00 00 1e 00 00 00 fd 00 38 3d 1e
45 0f 00 0a 20 20 20 20 20 20 00 00 00 fc 00 4d
32 33 38 30 41 0a 20 20 20 20 20 20 00 00 00 ff
00 0a 20 20 20 20 20 20 20 20 20 20 20 20 00 e2

----------------

Block 0, Base EDID:
  EDID Structure Version & Revision: 1.4
  Vendor & Product Identification:
    Manufacturer: GSM
    Model: 22509
    Serial Number: ...
    Made in: week 1 of 2010
  Basic Display Parameters & Features:
    Analog display
    Signal Level Standard: 0.700 : 0.000 : 0.700 V p-p
    Blank level equals black level
    Sync: Separate
    Maximum image size: 51 cm x 28 cm
    Gamma: 2.20
    DPMS levels: Standby Suspend Off
    RGB color display
    First detailed timing includes the native pixel format and preferred refresh rate
  Color Characteristics:
    Red  : 0.6279, 0.3476
    Green: 0.3447, 0.6152
    Blue : 0.1533, 0.0566
    White: 0.3134, 0.3291
  Established Timings I & II:
    IBM     :   720x400    70.081663 Hz   9:5     31.467 kHz     28.320000 MHz
    DMT 0x04:   640x480    59.940476 Hz   4:3     31.469 kHz     25.175000 MHz
    DMT 0x09:   800x600    60.316541 Hz   4:3     37.879 kHz     40.000000 MHz
    DMT 0x10:  1024x768    60.003840 Hz   4:3     48.363 kHz     65.000000 MHz
  Standard Timings:
    DMT 0x3a:  1680x1050   59.954250 Hz  16:10    65.290 kHz    146.250000 MHz
    DMT 0x23:  1280x1024   60.019740 Hz   5:4     63.981 kHz    108.000000 MHz
    DMT 0x20:  1280x960    60.000000 Hz   4:3     60.000 kHz    108.000000 MHz
    GTF     :  1152x864    60.000000 Hz   4:3     53.700 kHz     81.624000 MHz
  Detailed Timing Descriptors:
    DTD 1:  1920x1080   60.000000 Hz  16:9     67.500 kHz    148.500000 MHz (509 mm x 286 mm)
                 Hfront   88 Hsync  44 Hback  148 Hpol P
                 Vfront    4 Vsync   5 Vback   36 Vpol P
    Display Range Limits:
      Monitor ranges (GTF): 56-61 Hz V, 30-69 kHz H, max dotclock 150 MHz
    Display Product Name: 'M2380A'
    Display Product Serial Number: ...
Checksum: 0xe2

----------------

Block 1, Unknown EDID Extension Block 0x00:
  00 ff ff ff ff ff ff 00 1e 6d ed 57 01 01 01 01 '.........m.W....'
  01 14 01 04 68 33 1c 78 ea c6 65 a0 59 58 9d 27 '....h3.x..e.YX.''
  0e 50 54 a1 08 00 b3 00 81 80 81 40 71 40 01 01 '.PT........@q@..'
  01 01 01 01 01 01 02 3a 80 18 71 38 2d 40 58 2c '.......:..q8-@X,'
  45 00 fd 1e 11 00 00 1e 00 00 00 fd 00 38 3d 1e 'E............8=.'
  45 0f 00 0a 20 20 20 20 20 20 00 00 00 fc 00 4d 'E...      .....M'
  32 33 38 30 41 0a 20 20 20 20 20 20 00 00 00 ff '2380A.      ....'
  00 0a 20 20 20 20 20 20 20 20 20 20 20 20 00 e2 '..            ..'
Checksum: 0xe2

----------------

Warnings:

Block 0, Base EDID:
  Vendor & Product Identification: The serial number is one of the known dummy values, it should probably be set to 0.
  Display Range Limits: GTF support is deprecated in EDID 1.4.
EDID:
  Base EDID: Some timings are out of range of the Monitor Ranges:
    Vertical Freq: 59.940 - 70.082 Hz (Monitor: 56.000 - 61.000 Hz)

Failures:

Block 0, Base EDID:
  Display Product Serial Number: ...
  Display Range Limits: GTF is supported, but the display does not support continuous frequencies.
Block 1, Base EDID:
  Unknown Extension Block.
EDID:
  Base EDID: EDID specified 0 extension block(s), but found 1 extension block(s).

EDID conformity: FAIL
