edid-decode (hex):

00 ff ff ff ff ff ff 00 21 63 00 20 01 00 00 00
1e 16 01 03 80 2e 1b 78 ca 00 10 a0 57 49 9b 26
10 48 4c ad cf 00 61 4c 81 80 81 8a 81 8c 01 01
01 01 01 01 01 01 30 2a 40 c8 60 84 64 30 18 50
13 00 cf 10 11 00 00 1e 00 00 00 fc 00 43 41 53
50 45 52 0a 20 20 20 20 20 20 00 00 00 fd 00 38
4c 1f 51 0f 00 0a 20 20 20 20 20 20 00 00 00 ff
00 30 30 30 30 30 31 0a 20 20 20 20 20 20 00 84

00 ff ff ff ff ff ff 00 21 63 00 20 01 00 00 00
1e 16 01 03 80 2e 1b 78 ca 00 10 a0 57 49 9b 26
10 48 4c ad cf 00 61 4c 81 80 81 8a 81 8c 01 01
01 01 01 01 01 01 30 2a 40 c8 60 84 64 30 18 50
13 00 cf 10 11 00 00 1e 00 00 00 fc 00 43 41 53
50 45 52 0a 20 20 20 20 20 20 00 00 00 fd 00 38
4c 1f 51 0f 00 0a 20 20 20 20 20 20 00 00 00 ff
00 30 30 30 30 30 31 0a 20 20 20 20 20 20 00 84

----------------

Block 0, Base EDID:
  EDID Structure Version & Revision: 1.3
  Vendor & Product Identification:
    Manufacturer: HKC
    Model: 8192
    Serial Number: ...
    Made in: week 30 of 2012
  Basic Display Parameters & Features:
    Digital display
    Maximum image size: 46 cm x 27 cm
    Gamma: 2.20
    DPMS levels: Standby Suspend
    RGB color display
    First detailed timing is the preferred timing
  Color Characteristics:
    Red  : 0.6250, 0.3398
    Green: 0.2851, 0.6054
    Blue : 0.1484, 0.0634
    White: 0.2812, 0.2968
  Established Timings I & II:
    IBM     :   720x400    70.081663 Hz   9:5     31.467 kHz     28.320000 MHz
    DMT 0x04:   640x480    59.940476 Hz   4:3     31.469 kHz     25.175000 MHz
    DMT 0x05:   640x480    72.808802 Hz   4:3     37.861 kHz     31.500000 MHz
    DMT 0x06:   640x480    75.000000 Hz   4:3     37.500 kHz     31.500000 MHz
    DMT 0x09:   800x600    60.316541 Hz   4:3     37.879 kHz     40.000000 MHz
    DMT 0x0a:   800x600    72.187572 Hz   4:3     48.077 kHz     50.000000 MHz
    DMT 0x0b:   800x600    75.000000 Hz   4:3     46.875 kHz     49.500000 MHz
    DMT 0x10:  1024x768    60.003840 Hz   4:3     48.363 kHz     65.000000 MHz
    DMT 0x11:  1024x768    70.069359 Hz   4:3     56.476 kHz     75.000000 MHz
    DMT 0x12:  1024x768    75.028582 Hz   4:3     60.023 kHz     78.750000 MHz
    DMT 0x24:  1280x1024   75.024675 Hz   5:4     79.976 kHz    135.000000 MHz
  Standard Timings:
    DMT 0x11:  1024x768    70.069359 Hz   4:3     56.476 kHz     75.000000 MHz
    DMT 0x23:  1280x1024   60.019740 Hz   5:4     63.981 kHz    108.000000 MHz
    GTF     :  1280x1024   69.999805 Hz   5:4     74.620 kHz    128.943000 MHz
    GTF     :  1280x1024   72.000069 Hz   5:4     76.824 kHz    132.752000 MHz
  Detailed Timing Descriptors:
    DTD 1:  1600x900    60.000000 Hz  16:9     60.000 kHz    108.000000 MHz (463 mm x 272 mm)
                 Hfront   24 Hsync  80 Hback   96 Hpol P
                 Vfront    1 Vsync   3 Vback   96 Vpol P
    Display Product Name: 'CASPER'
    Display Range Limits:
      Monitor ranges (GTF): 56-76 Hz V, 31-81 kHz H, max dotclock 150 MHz
    Display Product Serial Number: ...
Checksum: 0x84

----------------

Block 1, Unknown EDID Extension Block 0x00:
  00 ff ff ff ff ff ff 00 21 63 00 20 01 00 00 00 '........!c. ....'
  1e 16 01 03 80 2e 1b 78 ca 00 10 a0 57 49 9b 26 '.......x....WI.&'
  10 48 4c ad cf 00 61 4c 81 80 81 8a 81 8c 01 01 '.HL...aL........'
  01 01 01 01 01 01 30 2a 40 c8 60 84 64 30 18 50 '......0*@.`.d0.P'
  13 00 cf 10 11 00 00 1e 00 00 00 fc 00 43 41 53 '.............CAS'
  50 45 52 0a 20 20 20 20 20 20 00 00 00 fd 00 38 'PER.      .....8'
  4c 1f 51 0f 00 0a 20 20 20 20 20 20 00 00 00 ff 'L.Q...      ....'
  00 30 30 30 30 30 31 0a 20 20 20 20 20 20 00 84 '.000001.      ..'
Checksum: 0x84

----------------

Warnings:

Block 0, Base EDID:
  Vendor & Product Identification: The serial number is one of the known dummy values, it should probably be set to 0.
  Detailed Timing Descriptor #1: Image size is 463x272 mm, but based on the picture AR it should be 463x260 mm.
  Display Product Serial Number: ...

Failures:

Block 1, Base EDID:
  Unknown Extension Block.
EDID:
  Base EDID: EDID specified 0 extension block(s), but found 1 extension block(s).

EDID conformity: FAIL
