edid-decode (hex):

00 ff ff ff ff ff ff 00 1e 6d a9 3b 1c 23 01 00
0e 10 01 03 78 1c 15 b0 ea 60 59 a4 54 46 9b 24
10 48 4c bf e8 00 31 59 45 59 61 4a 01 01 01 01
01 01 01 01 01 01 64 19 00 40 41 00 26 30 18 88
36 00 0e c8 10 00 00 18 f9 15 20 f8 30 58 1f 20
20 40 13 00 0e c8 10 00 00 1e 00 00 00 fd 00 32
78 1e 38 08 00 0a 20 20 20 20 20 20 00 00 00 fc
00 54 35 33 30 53 0a 20 20 20 20 20 20 20 00 94

00 ff ff ff ff ff ff 00 1e 6d a9 3b 1c 23 01 00
0e 10 01 03 78 1c 15 b0 ea 60 59 a4 54 46 9b 24
10 48 4c bf e8 00 31 59 45 59 61 4a 01 01 01 01
01 01 01 01 01 01 64 19 00 40 41 00 26 30 18 88
36 00 0e c8 10 00 00 18 f9 15 20 f8 30 58 1f 20
20 40 13 00 0e c8 10 00 00 1e 00 00 00 fd 00 32
78 1e 38 08 00 0a 20 20 20 20 20 20 00 00 00 fc
00 54 35 33 30 53 0a 20 20 20 20 20 20 20 00 94

----------------

Block 0, Base EDID:
  EDID Structure Version & Revision: 1.3
  Vendor & Product Identification:
    Manufacturer: GSM
    Model: 15273
    Serial Number: ...
    Made in: week 14 of 2006
  Basic Display Parameters & Features:
    Analog display
    Signal Level Standard: 0.700 : 0.000 : 0.700 V p-p
    Blank-to-black setup/pedestal
    Sync: Separate
    Maximum image size: 28 cm x 21 cm
    Gamma: 2.76
    DPMS levels: Standby Suspend Off
    RGB color display
    First detailed timing is the preferred timing
  Color Characteristics:
    Red  : 0.6416, 0.3300
    Green: 0.2734, 0.6054
    Blue : 0.1416, 0.0634
    White: 0.2832, 0.2978
  Established Timings I & II:
    IBM     :   720x400    70.081663 Hz   9:5     31.467 kHz     28.320000 MHz
    DMT 0x04:   640x480    59.940476 Hz   4:3     31.469 kHz     25.175000 MHz
    Apple   :   640x480    66.666667 Hz   4:3     35.000 kHz     30.240000 MHz
    DMT 0x05:   640x480    72.808802 Hz   4:3     37.861 kHz     31.500000 MHz
    DMT 0x06:   640x480    75.000000 Hz   4:3     37.500 kHz     31.500000 MHz
    DMT 0x08:   800x600    56.250000 Hz   4:3     35.156 kHz     36.000000 MHz
    DMT 0x09:   800x600    60.316541 Hz   4:3     37.879 kHz     40.000000 MHz
    DMT 0x0a:   800x600    72.187572 Hz   4:3     48.077 kHz     50.000000 MHz
    DMT 0x0b:   800x600    75.000000 Hz   4:3     46.875 kHz     49.500000 MHz
    Apple   :   832x624    74.551266 Hz   4:3     49.726 kHz     57.284000 MHz
    DMT 0x10:  1024x768    60.003840 Hz   4:3     48.363 kHz     65.000000 MHz
  Standard Timings:
    DMT 0x07:   640x480    85.008312 Hz   4:3     43.269 kHz     36.000000 MHz
    DMT 0x0c:   800x600    85.061274 Hz   4:3     53.674 kHz     56.250000 MHz
    DMT 0x11:  1024x768    70.069359 Hz   4:3     56.476 kHz     75.000000 MHz
  Detailed Timing Descriptors:
    DTD 1:  1024x768    60.003840 Hz   4:3     48.363 kHz     65.000000 MHz (270 mm x 200 mm)
                 Hfront   24 Hsync 136 Hback  160 Hpol N
                 Vfront    3 Vsync   6 Vback   29 Vpol N
    DTD 2:   800x600    85.061274 Hz   4:3     53.674 kHz     56.250000 MHz (270 mm x 200 mm)
                 Hfront   32 Hsync  64 Hback  152 Hpol P
                 Vfront    1 Vsync   3 Vback   27 Vpol P
    Display Range Limits:
      Monitor ranges (GTF): 50-120 Hz V, 30-56 kHz H, max dotclock 80 MHz
    Display Product Name: 'T530S'
Checksum: 0x94

----------------

Failures:

Block 0, Base EDID:
  Detailed Timing Descriptor #1: Mismatch of image size 270x200 mm vs display size 280x210 mm.
  Detailed Timing Descriptor #2: Mismatch of image size 270x200 mm vs display size 280x210 mm.
EDID:
  Extension Block 1 started with EDID header, ignoring Extension Blocks >= 1.

EDID conformity: FAIL
