edid-decode (hex):

00 ff ff ff ff ff ff 00 06 af 99 bf 00 00 00 00
07 1f 01 04 a5 22 16 78 03 1d b5 a8 54 48 9c 24
0e 50 54 00 00 00 01 01 01 01 01 01 01 01 01 01
01 01 01 01 01 01 4a d8 00 a0 a0 40 60 60 30 20
aa 00 58 d7 10 00 00 18 2a 6c 00 a0 a0 40 60 60
30 20 aa 00 58 d7 10 00 00 18 00 00 00 fd 00 30
78 cc cc 37 01 0a 20 20 20 20 20 20 00 00 00 fe
00 42 31 36 30 51 41 4e 30 32 2e 50 20 0a 00 04

----------------

Block 0, Base EDID:
  EDID Structure Version & Revision: 1.4
  Vendor & Product Identification:
    Manufacturer: AUO
    Model: 49049
    Made in: week 7 of 2021
  Basic Display Parameters & Features:
    Digital display
    Bits per primary color channel: 8
    DisplayPort interface
    Maximum image size: 34 cm x 22 cm
    Gamma: 2.20
    Supported color formats: RGB 4:4:4
    First detailed timing includes the native pixel format and preferred refresh rate
    Display supports continuous frequencies
  Color Characteristics:
    Red  : 0.6562, 0.3291
    Green: 0.2841, 0.6103
    Blue : 0.1425, 0.0576
    White: 0.3134, 0.3291
  Established Timings I & II: none
  Standard Timings: none
  Detailed Timing Descriptors:
    DTD 1:  2560x1600  120.027227 Hz  16:10   203.566 kHz    553.700000 MHz (344 mm x 215 mm)
                 Hfront   48 Hsync  32 Hback   80 Hpol N
                 Vfront   10 Vsync  10 Vback   76 Vpol N
    DTD 2:  2560x1600   60.024452 Hz  16:10   101.801 kHz    276.900000 MHz (344 mm x 215 mm)
                 Hfront   48 Hsync  32 Hback   80 Hpol N
                 Vfront   10 Vsync  10 Vback   76 Vpol N
    Display Range Limits:
      Monitor ranges (Range Limits Only): 48-120 Hz V, 204-204 kHz H, max dotclock 550 MHz
    Alphanumeric Data String: 'B160QAN02.P '
Checksum: 0x04

----------------

Warnings:

Block 0, Base EDID:
  Missing Display Product Name.
EDID:
  Base EDID: Some timings are out of range of the Monitor Ranges:
    Horizontal Freq: 101.801 - 203.566 kHz (Monitor: 204.000 - 204.000 kHz)
    Maximum Clock: 553.700 MHz (Monitor: 550.000 MHz)

Failures:

Block 0, Base EDID:
  Alphanumeric Data String: One or more trailing spaces before newline.

EDID conformity: FAIL
