edid-decode (hex):

00 ff ff ff ff ff ff 00 1e 6d 12 76 01 01 01 01
03 13 01 03 80 46 27 78 ea d9 b0 a3 57 49 9c 25
11 49 4b a1 08 00 31 40 45 40 61 40 d1 c0 01 01
01 01 01 01 01 01 4c 1f 00 90 51 00 1b 30 40 88
17 00 e8 26 32 00 00 1a 1b 21 50 a0 51 00 1e 30
48 88 35 00 bc 86 21 00 00 1c 00 00 00 fd 00 39
4b 1f 54 12 00 0a 20 20 20 20 20 20 00 00 00 fc
00 33 32 50 47 36 30 30 30 0a 20 20 20 20 01 43

00 ff ff ff ff ff ff 00 1e 6d 12 76 01 01 01 01
03 13 01 03 80 46 27 78 ea d9 b0 a3 57 49 9c 25
11 49 4b a1 08 00 31 40 45 40 61 40 d1 c0 01 01
01 01 01 01 01 01 4c 1f 00 90 51 00 1b 30 40 88
17 00 e8 26 32 00 00 1a 1b 21 50 a0 51 00 1e 30
48 88 35 00 bc 86 21 00 00 1c 00 00 00 fd 00 39
4b 1f 54 12 00 0a 20 20 20 20 20 20 00 00 00 fc
00 33 32 50 47 36 30 30 30 0a 20 20 20 20 01 43

----------------

Block 0, Base EDID:
  EDID Structure Version & Revision: 1.3
  Vendor & Product Identification:
    Manufacturer: GSM
    Model: 30226
    Serial Number: ...
    Made in: week 3 of 2009
  Basic Display Parameters & Features:
    Digital display
    Maximum image size: 70 cm x 39 cm
    Gamma: 2.20
    DPMS levels: Standby Suspend Off
    RGB color display
    First detailed timing is the preferred timing
  Color Characteristics:
    Red  : 0.6396, 0.3408
    Green: 0.2871, 0.6103
    Blue : 0.1464, 0.0693
    White: 0.2851, 0.2929
  Established Timings I & II:
    IBM     :   720x400    70.081663 Hz   9:5     31.467 kHz     28.320000 MHz
    DMT 0x04:   640x480    59.940476 Hz   4:3     31.469 kHz     25.175000 MHz
    DMT 0x09:   800x600    60.316541 Hz   4:3     37.879 kHz     40.000000 MHz
    DMT 0x10:  1024x768    60.003840 Hz   4:3     48.363 kHz     65.000000 MHz
  Standard Timings:
    DMT 0x04:   640x480    59.940476 Hz   4:3     31.469 kHz     25.175000 MHz
    DMT 0x09:   800x600    60.316541 Hz   4:3     37.879 kHz     40.000000 MHz
    DMT 0x10:  1024x768    60.003840 Hz   4:3     48.363 kHz     65.000000 MHz
    DMT 0x52:  1920x1080   60.000000 Hz  16:9     67.500 kHz    148.500000 MHz
  Detailed Timing Descriptors:
    DTD 1:  1280x768    59.988020 Hz   5:3     47.690 kHz     80.120000 MHz (1000 mm x 550 mm)
                 Hfront   64 Hsync 136 Hback  200 Hpol P
                 Vfront    1 Vsync   7 Vback   19 Vpol N
    DTD 2:  1360x768    59.798991 Hz  85:48    47.720 kHz     84.750000 MHz (700 mm x 390 mm)
                 Hfront   72 Hsync 136 Hback  208 Hpol N
                 Vfront    3 Vsync   5 Vback   22 Vpol P
    Display Range Limits:
      Monitor ranges (GTF): 57-75 Hz V, 31-84 kHz H, max dotclock 180 MHz
    Display Product Name: '32PG6000'
  Extension blocks: 1
Checksum: 0x43

----------------

Warnings:

Block 0, Base EDID:
  Vendor & Product Identification: The serial number is one of the known dummy values, it should probably be set to 0.
  Detailed Timing Descriptor #1: Image size is 1000x550 mm, but based on the picture AR it should be 916x550 mm.

Failures:

Block 0, Base EDID:
  Detailed Timing Descriptor #1: Mismatch of image size 1000x550 mm vs display size 700x390 mm.
EDID:
  Extension Block 1 started with EDID header, ignoring Extension Blocks >= 1.
  Base EDID: The DTD max image size is 1000x550mm, which is larger than the display size 700.0x390.0mm.
  Base EDID: EDID specified 1 extension block(s), but found 0 extension block(s).

EDID conformity: FAIL
