edid-decode (hex):

00 ff ff ff ff ff ff 00 4d 10 56 15 00 00 00 00
31 1f 01 04 a5 22 13 78 0f de 50 a3 54 4c 99 26
0f 50 54 00 00 00 01 01 01 01 01 01 01 01 01 01
01 01 01 01 01 01 99 36 80 a0 70 38 28 40 30 20
35 00 58 c2 10 00 00 18 00 00 00 fd 00 3c a5 c1
c1 28 01 0a 20 20 20 20 20 20 00 00 00 fe 00 36
43 39 44 58 80 4c 51 31 35 36 4d 31 00 00 00 00
00 02 41 0d 1e 00 02 00 00 0b 41 0a 20 20 01 f2

70 13 79 00 00 03 01 14 b8 9c 00 84 7f 07 9f 00
2f 00 1f 00 37 04 58 00 02 00 04 00 00 00 00 00
00 00 00 00 00 00 00 00 00 00 00 00 00 00 00 00
00 00 00 00 00 00 00 00 00 00 00 00 00 00 00 00
00 00 00 00 00 00 00 00 00 00 00 00 00 00 00 00
00 00 00 00 00 00 00 00 00 00 00 00 00 00 00 00
00 00 00 00 00 00 00 00 00 00 00 00 00 00 00 00
00 00 00 00 00 00 00 00 00 00 00 00 00 00 78 90

00 ff ff ff ff ff ff 00 4d 10 56 15 00 00 00 00
31 1f 01 04 a5 22 13 78 0f de 50 a3 54 4c 99 26
0f 50 54 00 00 00 01 01 01 01 01 01 01 01 01 01
01 01 01 01 01 01 99 36 80 a0 70 38 28 40 30 20
35 00 58 c2 10 00 00 18 00 00 00 fd 00 3c a5 c1
c1 28 01 0a 20 20 20 20 20 20 00 00 00 fe 00 36
43 39 44 58 80 4c 51 31 35 36 4d 31 00 00 00 00
00 02 41 0d 1e 00 02 00 00 0b 41 0a 20 20 01 f2

70 13 79 00 00 03 01 14 b8 9c 00 84 7f 07 9f 00
2f 00 1f 00 37 04 58 00 02 00 04 00 00 00 00 00
00 00 00 00 00 00 00 00 00 00 00 00 00 00 00 00
00 00 00 00 00 00 00 00 00 00 00 00 00 00 00 00
00 00 00 00 00 00 00 00 00 00 00 00 00 00 00 00
00 00 00 00 00 00 00 00 00 00 00 00 00 00 00 00
00 00 00 00 00 00 00 00 00 00 00 00 00 00 00 00
00 00 00 00 00 00 00 00 00 00 00 00 00 00 78 90

----------------

Block 0, Base EDID:
  EDID Structure Version & Revision: 1.4
  Vendor & Product Identification:
    Manufacturer: SHP
    Model: 5462
    Made in: week 49 of 2021
  Basic Display Parameters & Features:
    Digital display
    Bits per primary color channel: 8
    DisplayPort interface
    Maximum image size: 34 cm x 19 cm
    Gamma: 2.20
    Supported color formats: RGB 4:4:4, YCrCb 4:4:4
    Default (sRGB) color space is primary color space
    First detailed timing includes the native pixel format and preferred refresh rate
    Display supports continuous frequencies
  Color Characteristics:
    Red  : 0.6396, 0.3291
    Green: 0.2998, 0.5996
    Blue : 0.1494, 0.0595
    White: 0.3125, 0.3281
  Established Timings I & II: none
  Standard Timings: none
  Detailed Timing Descriptors:
    DTD 1:  1920x1080   59.997424 Hz  16:9     67.197 kHz    139.770000 MHz (344 mm x 194 mm)
                 Hfront   48 Hsync  32 Hback   80 Hpol N
                 Vfront    3 Vsync   5 Vback   32 Vpol N
    Display Range Limits:
      Monitor ranges (Range Limits Only): 60-165 Hz V, 193-193 kHz H, max dotclock 400 MHz
    Alphanumeric Data String: '6C9DX.LQ156M1'
    Manufacturer-Specified Display Descriptor (0x00): 00 00 00 02 41 0d 1e 00 02 00 00 0b 41 0a 20 20 '....A.......A.  '
  Extension blocks: 1
Checksum: 0xf2

----------------

Block 1, DisplayID Extension Block:
  Version: 1.3
  Extension Count: 0
  Display Product Type: Extension Section
  Video Timing Modes Type 1 - Detailed Timings Data Block:
    DTD:  1920x1080  165.003784 Hz  16:9    192.889 kHz    401.210000 MHz (aspect 16:9, no 3D stereo, preferred)
               Hfront   48 Hsync  32 Hback   80 Hpol N
               Vfront    3 Vsync   5 Vback   81 Vpol N
  Checksum: 0x78
Checksum: 0x90

----------------

Block 2, Unknown EDID Extension Block 0x00:
  00 ff ff ff ff ff ff 00 4d 10 56 15 00 00 00 00 '........M.V.....'
  31 1f 01 04 a5 22 13 78 0f de 50 a3 54 4c 99 26 '1....".x..P.TL.&'
  0f 50 54 00 00 00 01 01 01 01 01 01 01 01 01 01 '.PT.............'
  01 01 01 01 01 01 99 36 80 a0 70 38 28 40 30 20 '.......6..p8(@0 '
  35 00 58 c2 10 00 00 18 00 00 00 fd 00 3c a5 c1 '5.X..........<..'
  c1 28 01 0a 20 20 20 20 20 20 00 00 00 fe 00 36 '.(..      .....6'
  43 39 44 58 80 4c 51 31 35 36 4d 31 00 00 00 00 'C9DX.LQ156M1....'
  00 02 41 0d 1e 00 02 00 00 0b 41 0a 20 20 01 f2 '..A.......A.  ..'
Checksum: 0xf2

----------------

Block 3, DisplayID Extension Block:
  Version: 1.3
  Extension Count: 0
  Video Timing Modes Type 1 - Detailed Timings Data Block:
    DTD:  1920x1080  165.003784 Hz  16:9    192.889 kHz    401.210000 MHz (aspect 16:9, no 3D stereo, preferred)
               Hfront   48 Hsync  32 Hback   80 Hpol N
               Vfront    3 Vsync   5 Vback   81 Vpol N
  Checksum: 0x78
Checksum: 0x90

----------------

Warnings:

Block 0, Base EDID:
  Alphanumeric Data String: Non-ASCII character 0x80 at position 5, can cause problems.
  Missing Display Product Name.
EDID:
  Base EDID: Some timings are out of range of the Monitor Ranges:
    Horizontal Freq: 67.197 - 192.889 kHz (Monitor: 193.000 - 193.000 kHz)
    Maximum Clock: 401.210 MHz (Monitor: 400.000 MHz)

Failures:

Block 0, Base EDID:
  Basic Display Parameters & Features: sRGB is signaled, but the chromaticities do not match.
Block 1, DisplayID Extension Block:
  DisplayID Base Block has no product type.
  Expected 0 DisplayID Extension Block, but got 1.
Block 2, Base EDID:
  Unknown Extension Block.
EDID:
  Base EDID: EDID specified 1 extension block(s), but found 3 extension block(s).

EDID conformity: FAIL
