edid-decode (hex):

00 ff ff ff ff ff ff 00 30 ae 40 40 00 00 00 00
32 0f 01 03 80 1e 17 78 ea 77 f1 a0 5a 4b 96 24
18 50 54 21 08 00 01 01 01 01 01 01 01 01 01 01
01 01 01 01 01 01 64 19 00 40 41 00 26 30 18 88
36 00 30 e4 10 00 00 18 28 15 00 40 41 00 26 30
18 88 36 00 30 e4 10 00 00 18 00 00 00 0f 00 61
43 32 61 43 28 14 01 00 0d af 12 15 00 00 00 fe
00 4e 31 35 30 58 33 2d 4c 30 41 0a 20 20 00 1a

00 ff ff ff ff ff ff 00 30 ae 40 40 00 00 00 00
32 0f 01 03 80 1e 17 78 ea 77 f1 a0 5a 4b 96 24
18 50 54 21 08 00 01 01 01 01 01 01 01 01 01 01
01 01 01 01 01 01 64 19 00 40 41 00 26 30 18 88
36 00 30 e4 10 00 00 18 28 15 00 40 41 00 26 30
18 88 36 00 30 e4 10 00 00 18 00 00 00 0f 00 61
43 32 61 43 28 14 01 00 0d af 12 15 00 00 00 fe
00 4e 31 35 30 58 33 2d 4c 30 41 0a 20 20 00 1a

----------------

Block 0, Base EDID:
  EDID Structure Version & Revision: 1.3
  Vendor & Product Identification:
    Manufacturer: LEN
    Model: 16448
    Made in: week 50 of 2005
  Basic Display Parameters & Features:
    Digital display
    Maximum image size: 30 cm x 23 cm
    Gamma: 2.20
    DPMS levels: Standby Suspend Off
    RGB color display
    First detailed timing is the preferred timing
  Color Characteristics:
    Red  : 0.6259, 0.3544
    Green: 0.2939, 0.5888
    Blue : 0.1435, 0.0966
    White: 0.3125, 0.3291
  Established Timings I & II:
    DMT 0x04:   640x480    59.940476 Hz   4:3     31.469 kHz     25.175000 MHz
    DMT 0x09:   800x600    60.316541 Hz   4:3     37.879 kHz     40.000000 MHz
    DMT 0x10:  1024x768    60.003840 Hz   4:3     48.363 kHz     65.000000 MHz
  Standard Timings: none
  Detailed Timing Descriptors:
    DTD 1:  1024x768    60.003840 Hz   4:3     48.363 kHz     65.000000 MHz (304 mm x 228 mm)
                 Hfront   24 Hsync 136 Hback  160 Hpol N
                 Vfront    3 Vsync   6 Vback   29 Vpol N
    DTD 2:  1024x768    49.997046 Hz   4:3     40.298 kHz     54.160000 MHz (304 mm x 228 mm)
                 Hfront   24 Hsync 136 Hback  160 Hpol N
                 Vfront    3 Vsync   6 Vback   29 Vpol N
    Manufacturer-Specified Display Descriptor (0x0f): 00 0f 00 61 43 32 61 43 28 14 01 00 0d af 12 15 '...aC2aC(.......'
    Alphanumeric Data String: 'N150X3-L0A'
Checksum: 0x1a

----------------

Failures:

Block 0, Base EDID:
  Missing Display Product Name.
  Missing Display Range Limits Descriptor.
EDID:
  Extension Block 1 started with EDID header, ignoring Extension Blocks >= 1.

EDID conformity: FAIL
