edid-decode (hex):

00 ff ff ff ff ff ff 00 28 9a ed 60 00 00 00 00
08 21 01 04 a5 22 13 78 03 90 15 96 5e 59 92 29
21 50 54 00 00 00 01 01 01 01 01 01 01 01 01 01
01 01 01 01 01 01 9c 3b 80 36 71 38 3c 40 30 20
36 00 59 c3 10 00 00 1a 00 00 00 00 00 00 00 00
00 00 00 00 58 c2 10 00 00 1a 00 00 00 fe 00 47
31 35 36 45 42 30 36 0a 20 20 20 20 00 00 00 fc
00 4c 43 4d 31 35 36 42 45 30 31 32 33 42 00 d5

00 ff ff ff ff ff ff 00 28 9a ed 60 00 00 00 00
08 21 01 04 a5 22 13 78 03 90 15 96 5e 59 92 29
21 50 54 00 00 00 01 01 01 01 01 01 01 01 01 01
01 01 01 01 01 01 9c 3b 80 36 71 38 3c 40 30 20
36 00 59 c3 10 00 00 1a 00 00 00 00 00 00 00 00
00 00 00 00 58 c2 10 00 00 1a 00 00 00 fe 00 47
31 35 36 45 42 30 36 0a 20 20 20 20 00 00 00 fc
00 4c 43 4d 31 35 36 42 45 30 31 32 33 42 00 d5

----------------

Block 0, Base EDID:
  EDID Structure Version & Revision: 1.4
  Vendor & Product Identification:
    Manufacturer: JDZ
    Model: 24813
    Made in: week 8 of 2023
  Basic Display Parameters & Features:
    Digital display
    Bits per primary color channel: 8
    DisplayPort interface
    Maximum image size: 34 cm x 19 cm
    Gamma: 2.20
    Supported color formats: RGB 4:4:4
    First detailed timing includes the native pixel format and preferred refresh rate
    Display supports continuous frequencies
  Color Characteristics:
    Red  : 0.5878, 0.3681
    Green: 0.3476, 0.5703
    Blue : 0.1601, 0.1298
    White: 0.3134, 0.3291
  Established Timings I & II: none
  Standard Timings: none
  Detailed Timing Descriptors:
    DTD 1:  1920x1080   60.026748 Hz  16:9     68.430 kHz    152.600000 MHz (345 mm x 195 mm)
                 Hfront   48 Hsync  32 Hback  230 Hpol P
                 Vfront    3 Vsync   6 Vback   51 Vpol N
    Manufacturer-Specified Display Descriptor (0x00): 00 00 00 00 00 00 00 00 00 00 58 c2 10 00 00 1a '..........X.....'
    Alphanumeric Data String: 'G156EB06'
    Display Product Name: 'LCM156BE0123B'
Checksum: 0xd5

----------------

Failures:

Block 0, Base EDID:
  Missing Display Range Limits Descriptor.
EDID:
  Extension Block 1 started with EDID header, ignoring Extension Blocks >= 1.

EDID conformity: FAIL
