edid-decode (hex):

00 ff ff ff ff ff ff 00 0e 14 d4 17 00 00 00 00
2a 14 01 03 80 1d 10 78 0a c3 0d 94 57 4f 8c 27
20 50 54 00 00 00 01 01 01 01 01 01 01 01 01 01
01 01 01 01 01 01 78 1d 56 c2 50 00 26 30 3b 27
59 00 25 a5 10 00 00 1a a5 13 56 c2 50 00 26 30
3b 27 59 00 25 a5 10 00 00 1a 00 00 00 fe 00 57
4d 58 57 37 80 31 33 33 57 41 31 20 00 00 00 00
00 00 00 00 00 00 00 00 00 01 01 0a 20 20 00 fc

00 ff ff ff ff ff ff 00 0e 14 d4 17 00 00 00 00
2a 14 01 03 80 1d 10 78 0a c3 0d 94 57 4f 8c 27
20 50 54 00 00 00 01 01 01 01 01 01 01 01 01 01
01 01 01 01 01 01 78 1d 56 c2 50 00 26 30 3b 27
59 00 25 a5 10 00 00 1a a5 13 56 c2 50 00 26 30
3b 27 59 00 25 a5 10 00 00 1a 00 00 00 fe 00 57
4d 58 57 37 80 31 33 33 57 41 31 20 00 00 00 00
00 00 00 00 00 00 00 00 00 01 01 0a 20 20 00 fc

----------------

Block 0, Base EDID:
  EDID Structure Version & Revision: 1.3
  Vendor & Product Identification:
    Manufacturer: CPT
    Model: 6100
    Made in: week 42 of 2010
  Basic Display Parameters & Features:
    Digital display
    Maximum image size: 29 cm x 16 cm
    Gamma: 2.20
    RGB color display
    First detailed timing is the preferred timing
  Color Characteristics:
    Red  : 0.5810, 0.3398
    Green: 0.3085, 0.5498
    Blue : 0.1523, 0.1250
    White: 0.3154, 0.3291
  Established Timings I & II: none
  Standard Timings: none
  Detailed Timing Descriptors:
    DTD 1:  1366x768    59.998727 Hz 683:384   48.359 kHz     75.440000 MHz (293 mm x 165 mm)
                 Hfront   59 Hsync  39 Hback   96 Hpol P
                 Vfront    5 Vsync   9 Vback   24 Vpol N
    DTD 2:  1366x768    39.996501 Hz 683:384   32.237 kHz     50.290000 MHz (293 mm x 165 mm)
                 Hfront   59 Hsync  39 Hback   96 Hpol P
                 Vfront    5 Vsync   9 Vback   24 Vpol N
    Alphanumeric Data String: 'WMXW7.133WA1 '
    Manufacturer-Specified Display Descriptor (0x00): 00 00 00 00 00 00 00 00 00 00 00 01 01 0a 20 20 '..............  '
Checksum: 0xfc

----------------

Block 1, Unknown EDID Extension Block 0x00:
  00 ff ff ff ff ff ff 00 0e 14 d4 17 00 00 00 00 '................'
  2a 14 01 03 80 1d 10 78 0a c3 0d 94 57 4f 8c 27 '*......x....WO.''
  20 50 54 00 00 00 01 01 01 01 01 01 01 01 01 01 ' PT.............'
  01 01 01 01 01 01 78 1d 56 c2 50 00 26 30 3b 27 '......x.V.P.&0;''
  59 00 25 a5 10 00 00 1a a5 13 56 c2 50 00 26 30 'Y.%.......V.P.&0'
  3b 27 59 00 25 a5 10 00 00 1a 00 00 00 fe 00 57 ';'Y.%..........W'
  4d 58 57 37 80 31 33 33 57 41 31 20 00 00 00 00 'MXW7.133WA1 ....'
  00 00 00 00 00 00 00 00 00 01 01 0a 20 20 00 fc '............  ..'
Checksum: 0xfc

----------------

Warnings:

Block 0, Base EDID:
  Alphanumeric Data String: Non-ASCII character 0x80 at position 5, can cause problems.

Failures:

Block 0, Base EDID:
  Alphanumeric Data String: No newline, but one or more trailing spaces.
  Missing Display Product Name.
  Missing Display Range Limits Descriptor.
Block 1, Base EDID:
  Unknown Extension Block.
EDID:
  Base EDID: EDID specified 0 extension block(s), but found 1 extension block(s).

EDID conformity: FAIL
