edid-decode (hex):

00 ff ff ff ff ff ff 00 41 0c 05 e0 48 c7 0a 00
25 0a 01 01 68 1f 17 bb e8 d5 e8 9e 58 4a 9c 27
0f 48 4c ad ee 00 31 59 45 59 61 59 81 80 31 68
45 67 81 40 71 4f d6 09 80 a0 20 5e 63 10 10 60
52 08 32 e6 10 00 00 1a 00 00 00 ff 00 20 43 58
20 20 37 30 36 33 37 36 0a 20 00 00 00 fc 00 50
48 49 4c 49 50 53 20 31 30 37 53 0a 00 00 00 fd
00 32 a0 1e 47 0b 00 0a 20 20 20 20 20 20 00 12

00 ff ff ff ff ff ff 00 41 0c 05 e0 48 c7 0a 00
25 0a 01 01 68 1f 17 bb e8 d5 e8 9e 58 4a 9c 27
0f 48 4c ad ee 00 31 59 45 59 61 59 81 80 31 68
45 67 81 40 71 4f d6 09 80 a0 20 5e 63 10 10 60
52 08 32 e6 10 00 00 1a 00 00 00 ff 00 20 43 58
20 20 37 30 36 33 37 36 0a 20 00 00 00 fc 00 50
48 49 4c 49 50 53 20 31 30 37 53 0a 00 00 00 fd
00 32 a0 1e 47 0b 00 0a 20 20 20 20 20 20 00 12

----------------

Block 0, Base EDID:
  EDID Structure Version & Revision: 1.1
  Vendor & Product Identification:
    Manufacturer: PHL
    Model: 57349
    Serial Number: ...
    Made in: week 37 of 2000
  Basic Display Parameters & Features:
    Analog display
    Signal Level Standard: 0.700 : 0.000 : 0.700 V p-p
    Blank level equals black level
    Sync: Separate
    Maximum image size: 31 cm x 23 cm
    Gamma: 2.87
    DPMS levels: Standby Suspend Off
    RGB color display
  Color Characteristics:
    Red  : 0.6201, 0.3447
    Green: 0.2900, 0.6103
    Blue : 0.1552, 0.0605
    White: 0.2832, 0.2968
  Established Timings I & II:
    IBM     :   720x400    70.081663 Hz   9:5     31.467 kHz     28.320000 MHz
    DMT 0x04:   640x480    59.940476 Hz   4:3     31.469 kHz     25.175000 MHz
    DMT 0x05:   640x480    72.808802 Hz   4:3     37.861 kHz     31.500000 MHz
    DMT 0x06:   640x480    75.000000 Hz   4:3     37.500 kHz     31.500000 MHz
    DMT 0x09:   800x600    60.316541 Hz   4:3     37.879 kHz     40.000000 MHz
    DMT 0x0a:   800x600    72.187572 Hz   4:3     48.077 kHz     50.000000 MHz
    DMT 0x0b:   800x600    75.000000 Hz   4:3     46.875 kHz     49.500000 MHz
    Apple   :   832x624    74.551266 Hz   4:3     49.726 kHz     57.284000 MHz
    DMT 0x10:  1024x768    60.003840 Hz   4:3     48.363 kHz     65.000000 MHz
    DMT 0x11:  1024x768    70.069359 Hz   4:3     56.476 kHz     75.000000 MHz
    DMT 0x12:  1024x768    75.028582 Hz   4:3     60.023 kHz     78.750000 MHz
  Standard Timings:
    DMT 0x07:   640x480    85.008312 Hz   4:3     43.269 kHz     36.000000 MHz
    DMT 0x0c:   800x600    85.061274 Hz   4:3     53.674 kHz     56.250000 MHz
    DMT 0x13:  1024x768    84.996690 Hz   4:3     68.677 kHz     94.500000 MHz
    DMT 0x23:  1280x1024   60.019740 Hz   5:4     63.981 kHz    108.000000 MHz
    Unknown :   640x480   100.000 Hz   4:3
    Unknown :   800x600    99.000 Hz   4:3
    DMT 0x20:  1280x960    60.000000 Hz   4:3     60.000 kHz    108.000000 MHz
    DMT 0x15:  1152x864    75.000000 Hz   4:3     67.500 kHz    108.000000 MHz
  Detailed Timing Descriptors:
    DTD 1:   640x350    70.100223 Hz  64:35    31.475 kHz     25.180000 MHz (306 mm x 230 mm)
                 Hfront   16 Hsync  96 Hback   48 Hpol P
                 Vfront   37 Vsync   2 Vback   60 Vpol N
    Display Product Serial Number: ...
    Display Product Name: 'PHILIPS 107S'
    Display Range Limits:
      Monitor ranges (GTF): 50-160 Hz V, 30-71 kHz H, max dotclock 110 MHz
Checksum: 0x12

----------------

Warnings:

Block 0, Base EDID:
  EDID Structure Version & Revision: EDID 1.1 is deprecated, do not use.
  Detailed Timing Descriptor #1: Image size is 306x230 mm, but based on the picture AR it should be 306x167 mm.

Failures:

EDID:
  Extension Block 1 started with EDID header, ignoring Extension Blocks >= 1.

EDID conformity: FAIL
