edid-decode (hex):

00 ff ff ff ff ff ff 00 06 af ec 27 00 00 00 00
00 15 01 04 90 22 13 78 02 d7 75 93 55 55 8d 29
24 50 54 00 00 00 01 01 01 01 01 01 01 01 01 01
01 01 01 01 01 01 0c 1c 56 a0 50 00 10 30 30 20
36 00 58 c1 10 00 00 18 00 00 00 0f 00 00 00 00
00 00 00 00 00 00 00 00 00 20 00 00 00 fe 00 41
55 4f 0a 20 20 20 20 20 20 20 20 20 00 00 00 fe
00 42 31 35 36 58 57 30 32 20 56 37 20 0a 00 59

----------------

Block 0, Base EDID:
  EDID Structure Version & Revision: 1.4
  Vendor & Product Identification:
    Manufacturer: AUO
    Model: 10220
    Made in: 2011
  Basic Display Parameters & Features:
    Digital display
    Bits per primary color channel: 6
    Digital interface is not defined
    Maximum image size: 34 cm x 19 cm
    Gamma: 2.20
    Supported color formats: RGB 4:4:4
    First detailed timing includes the native pixel format and preferred refresh rate
  Color Characteristics:
    Red  : 0.5771, 0.3330
    Green: 0.3330, 0.5537
    Blue : 0.1611, 0.1435
    White: 0.3134, 0.3291
  Established Timings I & II: none
  Standard Timings: none
  Detailed Timing Descriptors:
    DTD 1:  1366x768    60.014176 Hz 683:384   47.051 kHz     71.800000 MHz (344 mm x 193 mm)
                 Hfront   48 Hsync  32 Hback   80 Hpol N
                 Vfront    3 Vsync   6 Vback    7 Vpol N
    Manufacturer-Specified Display Descriptor (0x0f): 00 0f 00 00 00 00 00 00 00 00 00 00 00 00 00 20 '............... '
    Alphanumeric Data String: 'AUO'
    Alphanumeric Data String: 'B156XW02 V7 '
Checksum: 0x59

----------------

Warnings:

Block 0, Base EDID:
  Missing Display Product Name.

Failures:

Block 0, Base EDID:
  Alphanumeric Data String: One or more trailing spaces before newline.

EDID conformity: FAIL
