edid-decode (hex):

00 ff ff ff ff ff ff 00 09 e5 93 0a 00 00 00 00
1d 1f 01 04 a5 1d 12 78 03 ca f5 a4 54 4b 9b 25
0e 50 54 00 00 00 01 01 01 01 01 01 01 01 01 01
01 01 01 01 01 01 62 6b 00 c8 a0 40 3c 60 30 20
36 00 1e b3 10 00 00 00 00 00 00 fd 00 28 3c 64
64 1b 01 0a 20 20 20 20 20 20 00 00 00 fe 00 42
4f 45 20 43 51 0a 20 20 20 20 20 20 00 00 00 fe
00 4e 45 31 33 33 51 44 4d 2d 4e 36 31 0a 00 98

00 ff ff ff ff ff ff 00 09 e5 93 0a 00 00 00 00
1d 1f 01 04 a5 1d 12 78 03 ca f5 a4 54 4b 9b 25
0e 50 54 00 00 00 01 01 01 01 01 01 01 01 01 01
01 01 01 01 01 01 62 6b 00 c8 a0 40 3c 60 30 20
36 00 1e b3 10 00 00 00 00 00 00 fd 00 28 3c 64
64 1b 01 0a 20 20 20 20 20 20 00 00 00 fe 00 42
4f 45 20 43 51 0a 20 20 20 20 20 20 00 00 00 fe
00 4e 45 31 33 33 51 44 4d 2d 4e 36 31 0a 00 98

----------------

Block 0, Base EDID:
  EDID Structure Version & Revision: 1.4
  Vendor & Product Identification:
    Manufacturer: BOE
    Model: 2707
    Made in: week 29 of 2021
  Basic Display Parameters & Features:
    Digital display
    Bits per primary color channel: 8
    DisplayPort interface
    Maximum image size: 29 cm x 18 cm
    Gamma: 2.20
    Supported color formats: RGB 4:4:4
    First detailed timing includes the native pixel format and preferred refresh rate
    Display supports continuous frequencies
  Color Characteristics:
    Red  : 0.6435, 0.3281
    Green: 0.2949, 0.6074
    Blue : 0.1474, 0.0576
    White: 0.3134, 0.3291
  Established Timings I & II: none
  Standard Timings: none
  Detailed Timing Descriptors:
    DTD 1:  2560x1600   60.000873 Hz  16:10    99.601 kHz    274.900000 MHz (analog composite, sync-on-green, 286 mm x 179 mm)
                 Hfront   48 Hsync  32 Hback  120 Hpol N
                 Vfront    3 Vsync   6 Vback   51 Vpol N
    Display Range Limits:
      Monitor ranges (Range Limits Only): 40-60 Hz V, 100-100 kHz H, max dotclock 270 MHz
    Alphanumeric Data String: 'BOE CQ'
    Alphanumeric Data String: 'NE133QDM-N61'
Checksum: 0x98

----------------

Warnings:

Block 0, Base EDID:
  Missing Display Product Name.
EDID:
  Base EDID: Some timings are out of range of the Monitor Ranges:
    Maximum Clock: 274.900 MHz (Monitor: 270.000 MHz)
    Could be due to a Monitor Range off-by-one rounding issue

Failures:

EDID:
  Extension Block 1 started with EDID header, ignoring Extension Blocks >= 1.

EDID conformity: FAIL
