edid-decode (hex):

00 ff ff ff ff ff ff 00 4c a3 41 54 00 00 00 00
00 12 01 03 90 23 14 78 0a 87 f5 94 57 4f 8c 27
27 50 54 00 00 00 01 01 01 01 01 01 01 01 01 01
01 01 01 01 01 01 83 1b 56 78 50 00 16 30 30 20
25 00 61 c6 10 00 00 1a 83 1b 56 78 50 00 16 30
30 20 25 00 61 c6 10 00 00 1a 00 00 00 fe 00 4e
30 38 31 44 80 31 36 30 41 54 0a 20 00 00 00 00
00 00 00 00 00 00 00 00 00 01 01 0a 20 20 00 04

----------------

Block 0, Base EDID:
  EDID Structure Version & Revision: 1.3
  Vendor & Product Identification:
    Manufacturer: SEC
    Model: 21569
    Made in: 2008
  Basic Display Parameters & Features:
    Digital display
    Maximum image size: 35 cm x 20 cm
    Gamma: 2.20
    RGB color display
    First detailed timing is the preferred timing
  Color Characteristics:
    Red  : 0.5800, 0.3398
    Green: 0.3095, 0.5498
    Blue : 0.1552, 0.1552
    White: 0.3134, 0.3291
  Established Timings I & II: none
  Standard Timings: none
  Detailed Timing Descriptors:
    DTD 1:  1366x768    59.994548 Hz 683:384   47.396 kHz     70.430000 MHz (353 mm x 198 mm)
                 Hfront   48 Hsync  32 Hback   40 Hpol P
                 Vfront    2 Vsync   5 Vback   15 Vpol N
    DTD 2:  1366x768    59.994548 Hz 683:384   47.396 kHz     70.430000 MHz (353 mm x 198 mm)
                 Hfront   48 Hsync  32 Hback   40 Hpol P
                 Vfront    2 Vsync   5 Vback   15 Vpol N
    Alphanumeric Data String: 'N081D.160AT'
    Manufacturer-Specified Display Descriptor (0x00): 00 00 00 00 00 00 00 00 00 00 00 01 01 0a 20 20 '..............  '
Checksum: 0x04

----------------

Warnings:

Block 0, Base EDID:
  Alphanumeric Data String: Non-ASCII character 0x80 at position 5, can cause problems.

Failures:

Block 0, Base EDID:
  Basic Display Parameters & Features: Digital Video Interface Standard set to reserved value 0x10.
  Missing Display Product Name.
  Missing Display Range Limits Descriptor.

EDID conformity: FAIL
