edid-decode (hex):

00 ff ff ff ff ff ff 00 4c a3 41 54 00 00 00 00
00 14 01 04 95 1e 13 78 0a 9f 06 89 5a 57 98 2a
20 50 55 00 00 00 01 01 01 01 01 01 01 01 01 01
01 01 01 01 01 01 a1 1b 00 ac 50 20 0c 30 0c 40
33 00 2f be 10 00 00 1a 6c 12 00 ac 50 20 0c 30
0c 40 33 00 2f be 10 00 00 1a 00 00 00 fe 00 57
46 36 36 43 81 31 34 31 41 54 0a 20 00 00 00 00
00 00 41 01 19 00 00 00 00 09 01 0a 20 20 00 c6

----------------

Block 0, Base EDID:
  EDID Structure Version & Revision: 1.4
  Vendor & Product Identification:
    Manufacturer: SEC
    Model: 21569
    Made in: 2010
  Basic Display Parameters & Features:
    Digital display
    Bits per primary color channel: 6
    DisplayPort interface
    Maximum image size: 30 cm x 19 cm
    Gamma: 2.20
    Supported color formats: RGB 4:4:4, YCrCb 4:4:4
    First detailed timing includes the native pixel format and preferred refresh rate
  Color Characteristics:
    Red  : 0.5371, 0.3525
    Green: 0.3427, 0.5966
    Blue : 0.1640, 0.1250
    White: 0.3134, 0.3339
  Established Timings I & II: none
  Standard Timings: none
  Detailed Timing Descriptors:
    DTD 1:  1280x800    59.990297 Hz  16:10    48.712 kHz     70.730000 MHz (303 mm x 190 mm)
                 Hfront   12 Hsync  64 Hback   96 Hpol P
                 Vfront    3 Vsync   3 Vback    6 Vpol N
    DTD 2:  1280x800    39.999186 Hz  16:10    32.479 kHz     47.160000 MHz (303 mm x 190 mm)
                 Hfront   12 Hsync  64 Hback   96 Hpol P
                 Vfront    3 Vsync   3 Vback    6 Vpol N
    Alphanumeric Data String: 'WF66C.141AT'
    Manufacturer-Specified Display Descriptor (0x00): 00 00 00 00 41 01 19 00 00 00 00 09 01 0a 20 20 '....A.........  '
Checksum: 0xc6

----------------

Warnings:

Block 0, Base EDID:
  Alphanumeric Data String: Non-ASCII character 0x81 at position 5, can cause problems.
  Missing Display Product Name.

EDID conformity: PASS
