edid-decode (hex):

00 ff ff ff ff ff ff 00 4c a3 41 54 00 00 00 00
00 11 01 03 80 1d 12 78 0a 87 f5 94 57 4f 8c 27
27 50 54 00 00 00 01 01 01 01 01 01 01 01 01 01
01 01 01 01 01 01 2b 1c 00 a8 50 20 1e 30 30 20
36 00 05 a3 10 00 00 19 00 00 00 0f 00 00 00 00
00 00 00 00 00 32 d2 02 32 00 00 00 00 fe 00 44
57 39 31 39 80 31 33 33 41 54 0a 20 00 00 00 00
00 ff ff ff ff ff ff ff ff 01 01 0a 20 20 00 57

----------------

Block 0, Base EDID:
  EDID Structure Version & Revision: 1.3
  Vendor & Product Identification:
    Manufacturer: SEC
    Model: 21569
    Made in: 2007
  Basic Display Parameters & Features:
    Digital display
    Maximum image size: 29 cm x 18 cm
    Gamma: 2.20
    RGB color display
    First detailed timing is the preferred timing
  Color Characteristics:
    Red  : 0.5800, 0.3398
    Green: 0.3095, 0.5498
    Blue : 0.1552, 0.1552
    White: 0.3134, 0.3291
  Established Timings I & II: none
  Standard Timings: none
  Detailed Timing Descriptors:
    DTD 1:  1280x800    59.999667 Hz  16:10    49.800 kHz     72.110000 MHz (261 mm x 163 mm)
                 Hfront   48 Hsync  32 Hback   88 Hpol N
                 Vfront    3 Vsync   6 Vback   21 Vpol N
    Manufacturer-Specified Display Descriptor (0x0f): 00 0f 00 00 00 00 00 00 00 00 00 32 d2 02 32 00 '...........2..2.'
    Alphanumeric Data String: 'DW919.133AT'
    Manufacturer-Specified Display Descriptor (0x00): 00 00 00 ff ff ff ff ff ff ff ff 01 01 0a 20 20 '..............  '
Checksum: 0x57

----------------

Warnings:

Block 0, Base EDID:
  Alphanumeric Data String: Non-ASCII character 0x80 at position 5, can cause problems.

Failures:

Block 0, Base EDID:
  Detailed Timing Descriptor #1: Mismatch of image size 261x163 mm vs display size 290x180 mm.
  Missing Display Product Name.
  Missing Display Range Limits Descriptor.

EDID conformity: FAIL
