edid-decode (hex):

00 ff ff ff ff ff ff 00 4c a3 41 54 00 00 00 00
00 12 01 03 90 1a 10 78 0a 8b f5 94 57 54 8c 23
1e 50 54 00 00 00 01 01 01 01 01 01 01 01 01 01
01 01 01 01 01 01 7a 1b 00 78 50 20 1e 30 30 20
36 00 1e b3 10 00 00 1a 7a 1b 00 78 50 20 1e 30
30 20 36 00 1e b3 10 00 00 1a 00 00 00 fe 00 44
30 36 33 43 80 31 32 31 41 54 0a 20 00 00 00 00
00 00 00 00 00 00 00 00 00 01 01 0a 20 20 00 1b

----------------

Block 0, Base EDID:
  EDID Structure Version & Revision: 1.3
  Vendor & Product Identification:
    Manufacturer: SEC
    Model: 21569
    Made in: 2008
  Basic Display Parameters & Features:
    Digital display
    Maximum image size: 26 cm x 16 cm
    Gamma: 2.20
    RGB color display
    First detailed timing is the preferred timing
  Color Characteristics:
    Red  : 0.5800, 0.3398
    Green: 0.3300, 0.5498
    Blue : 0.1396, 0.1201
    White: 0.3134, 0.3291
  Established Timings I & II: none
  Standard Timings: none
  Detailed Timing Descriptors:
    DTD 1:  1280x800    60.533563 Hz  16:10    50.243 kHz     70.340000 MHz (286 mm x 179 mm)
                 Hfront   48 Hsync  32 Hback   40 Hpol P
                 Vfront    3 Vsync   6 Vback   21 Vpol N
    DTD 2:  1280x800    60.533563 Hz  16:10    50.243 kHz     70.340000 MHz (286 mm x 179 mm)
                 Hfront   48 Hsync  32 Hback   40 Hpol P
                 Vfront    3 Vsync   6 Vback   21 Vpol N
    Alphanumeric Data String: 'D063C.121AT'
    Manufacturer-Specified Display Descriptor (0x00): 00 00 00 00 00 00 00 00 00 00 00 01 01 0a 20 20 '..............  '
Checksum: 0x1b

----------------

Warnings:

Block 0, Base EDID:
  Alphanumeric Data String: Non-ASCII character 0x80 at position 5, can cause problems.

Failures:

Block 0, Base EDID:
  Basic Display Parameters & Features: Digital Video Interface Standard set to reserved value 0x10.
  Detailed Timing Descriptor #1: Mismatch of image size 286x179 mm vs display size 260x160 mm.
  Detailed Timing Descriptor #2: Mismatch of image size 286x179 mm vs display size 260x160 mm.
  Missing Display Product Name.
  Missing Display Range Limits Descriptor.
EDID:
  Base EDID: The DTD max image size is 286x179mm, which is larger than the display size 260.0x160.0mm.

EDID conformity: FAIL
