edid-decode (hex):

00 ff ff ff ff ff ff 00 4c a3 41 54 00 00 00 00
00 15 01 04 90 22 13 78 0a c8 95 9e 57 54 92 26
0f 50 54 00 00 00 01 01 01 01 01 01 01 01 01 01
01 01 01 01 01 01 f5 1d 56 fc 50 00 16 30 30 20
25 00 58 c2 10 00 00 1a 08 13 56 b0 50 00 16 30
30 20 25 00 58 c2 10 00 00 1a 00 00 00 fe 00 59
52 31 57 34 80 31 35 36 41 54 0a 20 00 00 00 00
00 00 41 21 96 00 00 00 00 01 01 0a 20 20 00 59

----------------

Block 0, Base EDID:
  EDID Structure Version & Revision: 1.4
  Vendor & Product Identification:
    Manufacturer: SEC
    Model: 21569
    Made in: 2011
  Basic Display Parameters & Features:
    Digital display
    Bits per primary color channel: 6
    Digital interface is not defined
    Maximum image size: 34 cm x 19 cm
    Gamma: 2.20
    Supported color formats: RGB 4:4:4, YCrCb 4:4:4
    First detailed timing includes the native pixel format and preferred refresh rate
  Color Characteristics:
    Red  : 0.6201, 0.3398
    Green: 0.3300, 0.5703
    Blue : 0.1503, 0.0595
    White: 0.3134, 0.3291
  Established Timings I & II: none
  Standard Timings: none
  Detailed Timing Descriptors:
    DTD 1:  1366x768    59.997497 Hz 683:384   47.398 kHz     76.690000 MHz (344 mm x 194 mm)
                 Hfront   48 Hsync  32 Hback  172 Hpol P
                 Vfront    2 Vsync   5 Vback   15 Vpol N
    DTD 2:  1366x768    39.994090 Hz 683:384   31.595 kHz     48.720000 MHz (344 mm x 194 mm)
                 Hfront   48 Hsync  32 Hback   96 Hpol P
                 Vfront    2 Vsync   5 Vback   15 Vpol N
    Alphanumeric Data String: 'YR1W4.156AT'
    Manufacturer-Specified Display Descriptor (0x00): 00 00 00 00 41 21 96 00 00 00 00 01 01 0a 20 20 '....A!........  '
Checksum: 0x59

----------------

Warnings:

Block 0, Base EDID:
  Alphanumeric Data String: Non-ASCII character 0x80 at position 5, can cause problems.
  Missing Display Product Name.

EDID conformity: PASS
