edid-decode (hex):

00 ff ff ff ff ff ff 00 4c a3 41 54 00 00 00 00
00 13 01 03 90 1b 10 78 0a 36 25 93 56 55 93 29
1d 50 54 00 00 00 01 01 01 01 01 01 01 01 01 01
01 01 01 01 01 01 c4 1b 56 80 50 00 19 30 30 20
25 00 00 90 10 00 00 1a c4 1b 56 80 50 00 19 30
30 20 25 00 00 90 10 00 00 1a 00 00 00 fe 00 44
57 56 4d 44 80 31 31 36 41 54 0a 20 00 00 00 00
00 0c 10 17 1b 36 69 a9 ff 01 01 0a 20 20 00 d6

----------------

Block 0, Base EDID:
  EDID Structure Version & Revision: 1.3
  Vendor & Product Identification:
    Manufacturer: SEC
    Model: 21569
    Made in: 2009
  Basic Display Parameters & Features:
    Digital display
    Maximum image size: 27 cm x 16 cm
    Gamma: 2.20
    RGB color display
    First detailed timing is the preferred timing
  Color Characteristics:
    Red  : 0.5742, 0.3388
    Green: 0.3330, 0.5761
    Blue : 0.1601, 0.1152
    White: 0.3134, 0.3291
  Established Timings I & II: none
  Standard Timings: none
  Detailed Timing Descriptors:
    DTD 1:  1366x768    59.996185 Hz 683:384   47.577 kHz     71.080000 MHz (256 mm x 144 mm)
                 Hfront   48 Hsync  32 Hback   48 Hpol P
                 Vfront    2 Vsync   5 Vback   18 Vpol N
    DTD 2:  1366x768    59.996185 Hz 683:384   47.577 kHz     71.080000 MHz (256 mm x 144 mm)
                 Hfront   48 Hsync  32 Hback   48 Hpol P
                 Vfront    2 Vsync   5 Vback   18 Vpol N
    Alphanumeric Data String: 'DWVMD.116AT'
    Manufacturer-Specified Display Descriptor (0x00): 00 00 00 0c 10 17 1b 36 69 a9 ff 01 01 0a 20 20 '.......6i.....  '
Checksum: 0xd6

----------------

Warnings:

Block 0, Base EDID:
  Alphanumeric Data String: Non-ASCII character 0x80 at position 5, can cause problems.

Failures:

Block 0, Base EDID:
  Basic Display Parameters & Features: Digital Video Interface Standard set to reserved value 0x10.
  Detailed Timing Descriptor #1: Mismatch of image size 256x144 mm vs display size 270x160 mm.
  Detailed Timing Descriptor #2: Mismatch of image size 256x144 mm vs display size 270x160 mm.
  Missing Display Product Name.
  Missing Display Range Limits Descriptor.

EDID conformity: FAIL
