edid-decode (hex):

00 ff ff ff ff ff ff 00 4c a3 41 54 00 00 00 00
00 16 01 04 90 1e 11 78 0a 8b c5 94 57 54 8c 27
17 50 54 00 00 00 01 01 01 01 01 01 01 01 01 01
01 01 01 01 01 01 96 1e 56 1e 51 00 16 30 30 20
55 00 35 ae 10 00 00 1a 87 13 56 d8 50 00 16 30
30 20 55 00 35 ae 10 00 00 1a 00 00 00 fe 00 58
35 33 4d 58 82 31 34 30 41 54 0a 20 00 00 00 00
00 00 41 01 bf 00 00 00 00 01 01 0a 20 20 00 12

00 ff ff ff ff ff ff 00 4c a3 41 54 00 00 00 00
00 16 01 04 90 1e 11 78 0a 8b c5 94 57 54 8c 27
17 50 54 00 00 00 01 01 01 01 01 01 01 01 01 01
01 01 01 01 01 01 96 1e 56 1e 51 00 16 30 30 20
55 00 35 ae 10 00 00 1a 87 13 56 d8 50 00 16 30
30 20 55 00 35 ae 10 00 00 1a 00 00 00 fe 00 58
35 33 4d 58 82 31 34 30 41 54 0a 20 00 00 00 00
00 00 41 01 bf 00 00 00 00 01 01 0a 20 20 00 12

----------------

Block 0, Base EDID:
  EDID Structure Version & Revision: 1.4
  Vendor & Product Identification:
    Manufacturer: SEC
    Model: 21569
    Made in: 2012
  Basic Display Parameters & Features:
    Digital display
    Bits per primary color channel: 6
    Digital interface is not defined
    Maximum image size: 30 cm x 17 cm
    Gamma: 2.20
    Supported color formats: RGB 4:4:4, YCrCb 4:4:4
    First detailed timing includes the native pixel format and preferred refresh rate
  Color Characteristics:
    Red  : 0.5800, 0.3398
    Green: 0.3300, 0.5498
    Blue : 0.1552, 0.0898
    White: 0.3134, 0.3291
  Established Timings I & II: none
  Standard Timings: none
  Detailed Timing Descriptors:
    DTD 1:  1366x768    59.996322 Hz 683:384   47.397 kHz     78.300000 MHz (309 mm x 174 mm)
                 Hfront   48 Hsync  32 Hback  206 Hpol P
                 Vfront    5 Vsync   5 Vback   12 Vpol N
    DTD 2:  1366x768    39.999040 Hz 683:384   31.599 kHz     49.990000 MHz (309 mm x 174 mm)
                 Hfront   48 Hsync  32 Hback  136 Hpol P
                 Vfront    5 Vsync   5 Vback   12 Vpol N
    Alphanumeric Data String: 'X53MX.140AT'
    Manufacturer-Specified Display Descriptor (0x00): 00 00 00 00 41 01 bf 00 00 00 00 01 01 0a 20 20 '....A.........  '
Checksum: 0x12

----------------

Block 1, Unknown EDID Extension Block 0x00:
  00 ff ff ff ff ff ff 00 4c a3 41 54 00 00 00 00 '........L.AT....'
  00 16 01 04 90 1e 11 78 0a 8b c5 94 57 54 8c 27 '.......x....WT.''
  17 50 54 00 00 00 01 01 01 01 01 01 01 01 01 01 '.PT.............'
  01 01 01 01 01 01 96 1e 56 1e 51 00 16 30 30 20 '........V.Q..00 '
  55 00 35 ae 10 00 00 1a 87 13 56 d8 50 00 16 30 'U.5.......V.P..0'
  30 20 55 00 35 ae 10 00 00 1a 00 00 00 fe 00 58 '0 U.5..........X'
  35 33 4d 58 82 31 34 30 41 54 0a 20 00 00 00 00 '53MX.140AT. ....'
  00 00 41 01 bf 00 00 00 00 01 01 0a 20 20 00 12 '..A.........  ..'
Checksum: 0x12

----------------

Warnings:

Block 0, Base EDID:
  Alphanumeric Data String: Non-ASCII character 0x82 at position 5, can cause problems.
  Missing Display Product Name.

Failures:

Block 1, Base EDID:
  Unknown Extension Block.
EDID:
  Base EDID: EDID specified 0 extension block(s), but found 1 extension block(s).

EDID conformity: FAIL
