edid-decode (hex):

00 ff ff ff ff ff ff 00 4c a3 41 54 00 00 00 00
00 12 01 03 90 1e 13 78 0a 66 f5 9c 54 58 59 27
0c 50 54 00 00 00 01 01 01 01 01 01 01 01 01 01
01 01 01 01 01 01 d6 1d 00 18 51 20 10 30 0c 40
33 00 2f be 10 00 00 1a e4 13 00 18 51 20 10 30
0c 40 33 00 2f be 10 00 00 1a 00 00 00 fe 00 4b
57 35 37 37 80 31 34 31 41 54 0a 20 00 00 00 00
00 22 2f 44 62 88 b3 e1 ff 01 01 0a 20 20 00 28

----------------

Block 0, Base EDID:
  EDID Structure Version & Revision: 1.3
  Vendor & Product Identification:
    Manufacturer: SEC
    Model: 21569
    Made in: 2008
  Basic Display Parameters & Features:
    Digital display
    Maximum image size: 30 cm x 19 cm
    Gamma: 2.20
    RGB color display
    First detailed timing is the preferred timing
  Color Characteristics:
    Red  : 0.6103, 0.3300
    Green: 0.3447, 0.3496
    Blue : 0.1552, 0.0498
    White: 0.3134, 0.3291
  Established Timings I & II: none
  Standard Timings: none
  Detailed Timing Descriptors:
    DTD 1:  1280x800    60.001885 Hz  16:10    48.962 kHz     76.380000 MHz (303 mm x 190 mm)
                 Hfront   12 Hsync  64 Hback  204 Hpol P
                 Vfront    3 Vsync   3 Vback   10 Vpol N
    DTD 2:  1280x800    40.001257 Hz  16:10    32.641 kHz     50.920000 MHz (303 mm x 190 mm)
                 Hfront   12 Hsync  64 Hback  204 Hpol P
                 Vfront    3 Vsync   3 Vback   10 Vpol N
    Alphanumeric Data String: 'KW577.141AT'
    Manufacturer-Specified Display Descriptor (0x00): 00 00 00 22 2f 44 62 88 b3 e1 ff 01 01 0a 20 20 '..."/Db.......  '
Checksum: 0x28

----------------

Warnings:

Block 0, Base EDID:
  Alphanumeric Data String: Non-ASCII character 0x80 at position 5, can cause problems.

Failures:

Block 0, Base EDID:
  Basic Display Parameters & Features: Digital Video Interface Standard set to reserved value 0x10.
  Missing Display Product Name.
  Missing Display Range Limits Descriptor.

EDID conformity: FAIL
