edid-decode (hex):

00 ff ff ff ff ff ff 00 4c a3 41 54 00 00 00 00
00 12 01 03 90 1d 12 78 0a 87 f5 94 57 4f 8c 27
27 50 54 00 00 00 01 01 01 01 01 01 01 01 01 01
01 01 01 01 01 01 d1 19 00 50 50 20 0c 30 28 18
36 00 1e b3 10 00 00 1a d1 19 00 50 50 20 0c 30
28 18 36 00 1e b3 10 00 00 1a 00 00 00 fe 00 4e
38 33 35 43 80 31 33 33 41 54 0a 20 00 00 00 fe
00 00 00 00 00 00 00 00 00 01 01 0a 20 20 00 ea

00 ff ff ff ff ff ff 00 4c a3 41 54 00 00 00 00
00 12 01 03 90 1d 12 78 0a 87 f5 94 57 4f 8c 27
27 50 54 00 00 00 01 01 01 01 01 01 01 01 01 01
01 01 01 01 01 01 d1 19 00 50 50 20 0c 30 28 18
36 00 1e b3 10 00 00 1a d1 19 00 50 50 20 0c 30
28 18 36 00 1e b3 10 00 00 1a 00 00 00 fe 00 4e
38 33 35 43 80 31 33 33 41 54 0a 20 00 00 00 fe
00 00 00 00 00 00 00 00 00 01 01 0a 20 20 00 ea

----------------

Block 0, Base EDID:
  EDID Structure Version & Revision: 1.3
  Vendor & Product Identification:
    Manufacturer: SEC
    Model: 21569
    Made in: 2008
  Basic Display Parameters & Features:
    Digital display
    Maximum image size: 29 cm x 18 cm
    Gamma: 2.20
    RGB color display
    First detailed timing is the preferred timing
  Color Characteristics:
    Red  : 0.5800, 0.3398
    Green: 0.3095, 0.5498
    Blue : 0.1552, 0.1552
    White: 0.3134, 0.3291
  Established Timings I & II: none
  Standard Timings: none
  Detailed Timing Descriptors:
    DTD 1:  1280x800    59.846784 Hz  16:10    48.596 kHz     66.090000 MHz (286 mm x 179 mm)
                 Hfront   40 Hsync  24 Hback   16 Hpol P
                 Vfront    3 Vsync   6 Vback    3 Vpol N
    DTD 2:  1280x800    59.846784 Hz  16:10    48.596 kHz     66.090000 MHz (286 mm x 179 mm)
                 Hfront   40 Hsync  24 Hback   16 Hpol P
                 Vfront    3 Vsync   6 Vback    3 Vpol N
    SPWG Module Revision: 26
    SPWG Descriptor #3:
      SPWG PC Maker P/N: 'N835C'
      SPWG LCD Supplier EEDID Revision: 128
      SPWG Manufacturer P/N: '133AT'
    SPWG Descriptor #4:
      SMBUS Values: 0x00 0x00 0x00 0x00 0x00 0x00 0x00 0x00
      LVDS Channels: 1
      Panel Self Test Present
Checksum: 0xea

----------------

Failures:

Block 0, Base EDID:
  Basic Display Parameters & Features: Digital Video Interface Standard set to reserved value 0x10.
  Missing Display Product Name.
  Missing Display Range Limits Descriptor.
EDID:
  Extension Block 1 started with EDID header, ignoring Extension Blocks >= 1.

EDID conformity: FAIL
