edid-decode (hex):

00 ff ff ff ff ff ff 00 4c a3 41 54 00 00 00 00
00 14 01 04 90 1d 10 78 0a 4b c5 9c 57 54 8c 27
17 50 54 00 00 00 01 01 01 01 01 01 01 01 01 01
01 01 01 01 01 01 eb 1d 56 fa 50 00 16 30 30 20
55 00 25 a5 10 00 00 1a dc 12 56 a2 50 00 16 30
30 20 55 00 25 a5 10 00 00 1a 00 00 00 fe 00 58
58 54 4e 4e 80 31 33 33 41 54 0a 20 00 00 00 00
00 00 41 01 94 00 00 00 00 01 01 0a 20 20 00 23

----------------

Block 0, Base EDID:
  EDID Structure Version & Revision: 1.4
  Vendor & Product Identification:
    Manufacturer: SEC
    Model: 21569
    Made in: 2010
  Basic Display Parameters & Features:
    Digital display
    Bits per primary color channel: 6
    Digital interface is not defined
    Maximum image size: 29 cm x 16 cm
    Gamma: 2.20
    Supported color formats: RGB 4:4:4, YCrCb 4:4:4
    First detailed timing includes the native pixel format and preferred refresh rate
  Color Characteristics:
    Red  : 0.6103, 0.3398
    Green: 0.3300, 0.5498
    Blue : 0.1552, 0.0898
    White: 0.3134, 0.3291
  Established Timings I & II: none
  Standard Timings: none
  Detailed Timing Descriptors:
    DTD 1:  1366x768    59.993420 Hz 683:384   47.395 kHz     76.590000 MHz (293 mm x 165 mm)
                 Hfront   48 Hsync  32 Hback  170 Hpol P
                 Vfront    5 Vsync   5 Vback   12 Vpol N
    DTD 2:  1366x768    39.996024 Hz 683:384   31.597 kHz     48.280000 MHz (293 mm x 165 mm)
                 Hfront   48 Hsync  32 Hback   82 Hpol P
                 Vfront    5 Vsync   5 Vback   12 Vpol N
    Alphanumeric Data String: 'XXTNN.133AT'
    Manufacturer-Specified Display Descriptor (0x00): 00 00 00 00 41 01 94 00 00 00 00 01 01 0a 20 20 '....A.........  '
Checksum: 0x23

----------------

Warnings:

Block 0, Base EDID:
  Alphanumeric Data String: Non-ASCII character 0x80 at position 5, can cause problems.
  Missing Display Product Name.

EDID conformity: PASS
