edid-decode (hex):

00 ff ff ff ff ff ff 00 4c a3 41 54 00 00 00 00
00 14 01 03 90 16 0d 78 0a 85 95 99 57 4f 8f 26
21 50 54 00 00 00 01 01 01 01 01 01 01 01 01 01
01 01 01 01 01 01 bc 1b 56 84 50 00 16 30 30 20
55 00 df 7d 00 00 00 1a bc 1b 56 84 50 00 16 30
30 20 55 00 df 7d 00 00 00 1a 00 00 00 fe 00 47
4d 38 34 58 80 31 30 31 41 54 0a 20 00 00 00 00
00 0c 10 17 1b 36 69 a9 ff 01 01 0a 20 20 00 86

00 ff ff ff ff ff ff 00 4c a3 41 54 00 00 00 00
00 14 01 03 90 16 0d 78 0a 85 95 99 57 4f 8f 26
21 50 54 00 00 00 01 01 01 01 01 01 01 01 01 01
01 01 01 01 01 01 bc 1b 56 84 50 00 16 30 30 20
55 00 df 7d 00 00 00 1a bc 1b 56 84 50 00 16 30
30 20 55 00 df 7d 00 00 00 1a 00 00 00 fe 00 47
4d 38 34 58 80 31 30 31 41 54 0a 20 00 00 00 00
00 0c 10 17 1b 36 69 a9 ff 01 01 0a 20 20 00 86

----------------

Block 0, Base EDID:
  EDID Structure Version & Revision: 1.3
  Vendor & Product Identification:
    Manufacturer: SEC
    Model: 21569
    Made in: 2010
  Basic Display Parameters & Features:
    Digital display
    Maximum image size: 22 cm x 13 cm
    Gamma: 2.20
    RGB color display
    First detailed timing is the preferred timing
  Color Characteristics:
    Red  : 0.5996, 0.3398
    Green: 0.3095, 0.5595
    Blue : 0.1503, 0.1298
    White: 0.3134, 0.3291
  Established Timings I & II: none
  Standard Timings: none
  Detailed Timing Descriptors:
    DTD 1:  1366x768    59.995606 Hz 683:384   47.397 kHz     71.000000 MHz (223 mm x 125 mm)
                 Hfront   48 Hsync  32 Hback   52 Hpol P
                 Vfront    5 Vsync   5 Vback   12 Vpol N
    DTD 2:  1366x768    59.995606 Hz 683:384   47.397 kHz     71.000000 MHz (223 mm x 125 mm)
                 Hfront   48 Hsync  32 Hback   52 Hpol P
                 Vfront    5 Vsync   5 Vback   12 Vpol N
    Alphanumeric Data String: 'GM84X.101AT'
    Manufacturer-Specified Display Descriptor (0x00): 00 00 00 0c 10 17 1b 36 69 a9 ff 01 01 0a 20 20 '.......6i.....  '
Checksum: 0x86

----------------

Warnings:

Block 0, Base EDID:
  Alphanumeric Data String: Non-ASCII character 0x80 at position 5, can cause problems.

Failures:

Block 0, Base EDID:
  Basic Display Parameters & Features: Digital Video Interface Standard set to reserved value 0x10.
  Missing Display Product Name.
  Missing Display Range Limits Descriptor.
EDID:
  Extension Block 1 started with EDID header, ignoring Extension Blocks >= 1.

EDID conformity: FAIL
