edid-decode (hex):

00 ff ff ff ff ff ff 00 09 e5 9e 06 00 00 00 00
01 1a 01 04 95 26 15 78 02 50 f0 9f 5a 58 9c 27
19 50 54 00 00 00 01 01 01 01 01 01 01 01 01 01
01 01 01 01 01 01 f0 28 40 f2 60 84 30 30 30 20
36 00 7e d7 10 00 00 1a bc 20 40 f2 60 84 30 30
30 20 36 00 7e d7 10 00 00 1a 00 00 00 fe 00 38
56 50 52 30 80 4e 54 31 37 33 57 44 00 00 00 00
00 00 41 11 96 00 00 00 00 0a 01 0a 20 20 00 0c

----------------

Block 0, Base EDID:
  EDID Structure Version & Revision: 1.4
  Vendor & Product Identification:
    Manufacturer: BOE
    Model: 1694
    Made in: week 1 of 2016
  Basic Display Parameters & Features:
    Digital display
    Bits per primary color channel: 6
    DisplayPort interface
    Maximum image size: 38 cm x 21 cm
    Gamma: 2.20
    Supported color formats: RGB 4:4:4
    First detailed timing includes the native pixel format and preferred refresh rate
  Color Characteristics:
    Red  : 0.6220, 0.3525
    Green: 0.3437, 0.6093
    Blue : 0.1552, 0.1005
    White: 0.3125, 0.3281
  Established Timings I & II: none
  Standard Timings: none
  Detailed Timing Descriptors:
    DTD 1:  1600x900    60.015485 Hz  16:9     56.895 kHz    104.800000 MHz (382 mm x 215 mm)
                 Hfront   48 Hsync  32 Hback  162 Hpol P
                 Vfront    3 Vsync   6 Vback   39 Vpol N
    DTD 2:  1600x900    47.989481 Hz  16:9     45.494 kHz     83.800000 MHz (382 mm x 215 mm)
                 Hfront   48 Hsync  32 Hback  162 Hpol P
                 Vfront    3 Vsync   6 Vback   39 Vpol N
    Alphanumeric Data String: '8VPR0.NT173WD'
    Manufacturer-Specified Display Descriptor (0x00): 00 00 00 00 41 11 96 00 00 00 00 0a 01 0a 20 20 '....A.........  '
Checksum: 0x0c

----------------

Warnings:

Block 0, Base EDID:
  Alphanumeric Data String: Non-ASCII character 0x80 at position 5, can cause problems.
  Missing Display Product Name.

EDID conformity: PASS
