edid-decode (hex):

00 ff ff ff ff ff ff 00 30 ae 01 12 01 00 00 00
19 1a 01 03 81 30 1b 78 ea 64 b5 ab 52 38 ab 25
13 50 54 00 00 00 01 01 01 01 01 01 01 01 01 01
01 01 01 01 01 01 19 38 80 00 71 38 14 40 60 40
84 00 dc 0c 11 00 00 1c 00 00 00 10 00 00 00 00
00 00 00 00 00 00 00 00 00 00 00 00 00 10 00 48
50 20 41 4c 00 0a 20 20 20 20 20 20 00 00 00 ff
00 4c 4d 32 31 35 57 46 33 2d 53 4c 53 31 00 44

00 ff ff ff ff ff ff 00 30 ae 01 12 01 00 00 00
19 1a 01 03 81 30 1b 78 ea 64 b5 ab 52 38 ab 25
13 50 54 00 00 00 01 01 01 01 01 01 01 01 01 01
01 01 01 01 01 01 19 38 80 00 71 38 14 40 60 40
84 00 dc 0c 11 00 00 1c 00 00 00 10 00 00 00 00
00 00 00 00 00 00 00 00 00 00 00 00 00 10 00 48
50 20 41 4c 00 0a 20 20 20 20 20 20 00 00 00 ff
00 4c 4d 32 31 35 57 46 33 2d 53 4c 53 31 00 44

----------------

Block 0, Base EDID:
  EDID Structure Version & Revision: 1.3
  Vendor & Product Identification:
    Manufacturer: LEN
    Model: 4609
    Serial Number: ...
    Made in: week 25 of 2016
  Basic Display Parameters & Features:
    Digital display
    DFP 1.x compatible TMDS
    Maximum image size: 48 cm x 27 cm
    Gamma: 2.20
    DPMS levels: Standby Suspend Off
    RGB color display
    First detailed timing is the preferred timing
  Color Characteristics:
    Red  : 0.6689, 0.3222
    Green: 0.2197, 0.6679
    Blue : 0.1464, 0.0771
    White: 0.3134, 0.3291
  Established Timings I & II: none
  Standard Timings: none
  Detailed Timing Descriptors:
    DTD 1:  1920x1080   59.997493 Hz  16:9     65.997 kHz    143.610000 MHz (476 mm x 268 mm)
                 Hfront   96 Hsync  64 Hback   96 Hpol N
                 Vfront    8 Vsync   4 Vback    8 Vpol P
    Dummy Descriptor:
    Dummy Descriptor:
    Display Product Serial Number: ...
Checksum: 0x44

----------------

Block 1, Unknown EDID Extension Block 0x00:
  00 ff ff ff ff ff ff 00 30 ae 01 12 01 00 00 00 '........0.......'
  19 1a 01 03 81 30 1b 78 ea 64 b5 ab 52 38 ab 25 '.....0.x.d..R8.%'
  13 50 54 00 00 00 01 01 01 01 01 01 01 01 01 01 '.PT.............'
  01 01 01 01 01 01 19 38 80 00 71 38 14 40 60 40 '.......8..q8.@`@'
  84 00 dc 0c 11 00 00 1c 00 00 00 10 00 00 00 00 '................'
  00 00 00 00 00 00 00 00 00 00 00 00 00 10 00 48 '...............H'
  50 20 41 4c 00 0a 20 20 20 20 20 20 00 00 00 ff 'P AL..      ....'
  00 4c 4d 32 31 35 57 46 33 2d 53 4c 53 31 00 44 '.LM215WF3-SLS1.D'
Checksum: 0x44

----------------

Warnings:

Block 0, Base EDID:
  Vendor & Product Identification: The serial number is one of the known dummy values, it should probably be set to 0.

Failures:

Block 0, Base EDID:
  Dummy Descriptor: Dummy block filled with garbage.
  Missing Display Product Name.
  Missing Display Range Limits Descriptor.
Block 1, Base EDID:
  Unknown Extension Block.
EDID:
  Base EDID: EDID specified 0 extension block(s), but found 1 extension block(s).

EDID conformity: FAIL
