edid-decode (hex):

00 ff ff ff ff ff ff 00 09 d1 02 79 45 54 00 00
0b 12 01 03 80 22 1b 78 2e 3d 85 a6 56 4a 9a 24
12 50 54 a5 6b 80 71 00 81 00 81 40 01 01 01 01
01 01 01 01 01 01 30 2a 00 98 51 00 2a 40 30 70
13 00 52 0e 11 00 00 1e 00 00 00 ff 00 4b 33 38
31 32 38 35 30 53 4c 30 0a 20 00 00 00 fd 00 37
4c 1f 53 0e 00 0a 20 20 20 20 20 20 00 00 00 fc
00 42 65 6e 51 20 45 37 30 30 0a 0a 0a 0a 00 de

00 ff ff ff ff ff ff 00 09 d1 02 79 45 54 00 00
0b 12 01 03 80 22 1b 78 2e 3d 85 a6 56 4a 9a 24
12 50 54 a5 6b 80 71 00 81 00 81 40 01 01 01 01
01 01 01 01 01 01 30 2a 00 98 51 00 2a 40 30 70
13 00 52 0e 11 00 00 1e 00 00 00 ff 00 4b 33 38
31 32 38 35 30 53 4c 30 0a 20 00 00 00 fd 00 37
4c 1f 53 0e 00 0a 20 20 20 20 20 20 00 00 00 fc
00 42 65 6e 51 20 45 37 30 30 0a 0a 0a 0a 00 de

----------------

Block 0, Base EDID:
  EDID Structure Version & Revision: 1.3
  Vendor & Product Identification:
    Manufacturer: BNQ
    Model: 30978
    Serial Number: ...
    Made in: week 11 of 2008
  Basic Display Parameters & Features:
    Digital display
    Maximum image size: 34 cm x 27 cm
    Gamma: 2.20
    DPMS levels: Off
    RGB color display
    Default (sRGB) color space is primary color space
    First detailed timing is the preferred timing
  Color Characteristics:
    Red  : 0.6484, 0.3388
    Green: 0.2919, 0.6025
    Blue : 0.1425, 0.0703
    White: 0.3134, 0.3291
  Established Timings I & II:
    IBM     :   720x400    70.081663 Hz   9:5     31.467 kHz     28.320000 MHz
    DMT 0x04:   640x480    59.940476 Hz   4:3     31.469 kHz     25.175000 MHz
    DMT 0x06:   640x480    75.000000 Hz   4:3     37.500 kHz     31.500000 MHz
    DMT 0x09:   800x600    60.316541 Hz   4:3     37.879 kHz     40.000000 MHz
    DMT 0x0b:   800x600    75.000000 Hz   4:3     46.875 kHz     49.500000 MHz
    Apple   :   832x624    74.551266 Hz   4:3     49.726 kHz     57.284000 MHz
    DMT 0x10:  1024x768    60.003840 Hz   4:3     48.363 kHz     65.000000 MHz
    DMT 0x12:  1024x768    75.028582 Hz   4:3     60.023 kHz     78.750000 MHz
    DMT 0x24:  1280x1024   75.024675 Hz   5:4     79.976 kHz    135.000000 MHz
    Apple   :  1152x870    75.061550 Hz 192:145   68.681 kHz    100.000000 MHz
  Standard Timings:
    GTF     :  1152x720    59.999964 Hz  16:10    44.760 kHz     67.319000 MHz
    DMT 0x1c:  1280x800    59.810326 Hz  16:10    49.702 kHz     83.500000 MHz
    DMT 0x20:  1280x960    60.000000 Hz   4:3     60.000 kHz    108.000000 MHz
  Detailed Timing Descriptors:
    DTD 1:  1280x1024   60.019740 Hz   5:4     63.981 kHz    108.000000 MHz (338 mm x 270 mm)
                 Hfront   48 Hsync 112 Hback  248 Hpol P
                 Vfront    1 Vsync   3 Vback   38 Vpol P
    Display Product Serial Number: ...
    Display Range Limits:
      Monitor ranges (GTF): 55-76 Hz V, 31-83 kHz H, max dotclock 140 MHz
    Display Product Name: 'BenQ E700'
Checksum: 0xde

----------------

Block 1, Unknown EDID Extension Block 0x00:
  00 ff ff ff ff ff ff 00 09 d1 02 79 45 54 00 00 '...........yET..'
  0b 12 01 03 80 22 1b 78 2e 3d 85 a6 56 4a 9a 24 '.....".x.=..VJ.$'
  12 50 54 a5 6b 80 71 00 81 00 81 40 01 01 01 01 '.PT.k.q....@....'
  01 01 01 01 01 01 30 2a 00 98 51 00 2a 40 30 70 '......0*..Q.*@0p'
  13 00 52 0e 11 00 00 1e 00 00 00 ff 00 4b 33 38 '..R..........K38'
  31 32 38 35 30 53 4c 30 0a 20 00 00 00 fd 00 37 '12850SL0. .....7'
  4c 1f 53 0e 00 0a 20 20 20 20 20 20 00 00 00 fc 'L.S...      ....'
  00 42 65 6e 51 20 45 37 30 30 0a 0a 0a 0a 00 de '.BenQ E700......'
Checksum: 0xde

----------------

Warnings:

Block 0, Base EDID:
  Vendor & Product Identification: The serial number is one of the known dummy values, it should probably be set to 0.

Failures:

Block 0, Base EDID:
  Basic Display Parameters & Features: sRGB is signaled, but the chromaticities do not match.
  Display Product Name: Non-space after newline.
Block 1, Base EDID:
  Unknown Extension Block.
EDID:
  Base EDID: EDID specified 0 extension block(s), but found 1 extension block(s).

EDID conformity: FAIL
