edid-decode (hex):

00 ff ff ff ff ff ff 00 09 e5 de 0d 00 00 00 00
16 23 01 04 a5 22 13 78 03 3d 05 98 5b 57 8a 28
18 50 54 00 00 00 01 01 01 01 01 01 01 01 01 01
01 01 01 01 01 01 70 3a 80 0b 71 38 3c 40 30 20
36 00 58 c2 10 00 00 1a c0 2e 80 0b 71 38 3c 40
30 20 36 00 58 c2 10 00 00 1a 00 00 00 00 00 00
00 00 00 00 00 00 00 00 00 00 00 00 00 00 00 02
00 0b 40 ff 0a 3c 7d 16 14 29 7d 00 00 00 00 25

00 ff ff ff ff ff ff 00 09 e5 de 0d 00 00 00 00
16 23 01 04 a5 22 13 78 03 3d 05 98 5b 57 8a 28
18 50 54 00 00 00 01 01 01 01 01 01 01 01 01 01
01 01 01 01 01 01 70 3a 80 0b 71 38 3c 40 30 20
36 00 58 c2 10 00 00 1a c0 2e 80 0b 71 38 3c 40
30 20 36 00 58 c2 10 00 00 1a 00 00 00 00 00 00
00 00 00 00 00 00 00 00 00 00 00 00 00 00 00 02
00 0b 40 ff 0a 3c 7d 16 14 29 7d 00 00 00 00 25

----------------

Block 0, Base EDID:
  EDID Structure Version & Revision: 1.4
  Vendor & Product Identification:
    Manufacturer: BOE
    Model: 3550
    Made in: week 22 of 2025
  Basic Display Parameters & Features:
    Digital display
    Bits per primary color channel: 8
    DisplayPort interface
    Maximum image size: 34 cm x 19 cm
    Gamma: 2.20
    Supported color formats: RGB 4:4:4
    First detailed timing includes the native pixel format and preferred refresh rate
    Display supports continuous frequencies
  Color Characteristics:
    Red  : 0.5937, 0.3583
    Green: 0.3427, 0.5400
    Blue : 0.1562, 0.0937
    White: 0.3134, 0.3291
  Established Timings I & II: none
  Standard Timings: none
  Detailed Timing Descriptors:
    DTD 1:  1920x1080   60.003690 Hz  16:9     68.404 kHz    149.600000 MHz (344 mm x 194 mm)
                 Hfront   48 Hsync  32 Hback  187 Hpol P
                 Vfront    3 Vsync   6 Vback   51 Vpol N
    DTD 2:  1920x1080   48.002952 Hz  16:9     54.723 kHz    119.680000 MHz (344 mm x 194 mm)
                 Hfront   48 Hsync  32 Hback  187 Hpol P
                 Vfront    3 Vsync   6 Vback   51 Vpol N
    Empty Descriptor
    Manufacturer-Specified Display Descriptor (0x02): 00 02 00 0b 40 ff 0a 3c 7d 16 14 29 7d 00 00 00 '....@..<}..)}...'
Checksum: 0x25

----------------

Warnings:

Block 0, Base EDID:
  Missing Display Product Name.

Failures:

Block 0, Base EDID:
  Empty Descriptor: Use Dummy Descriptor instead of all zeroes.
  Missing Display Range Limits Descriptor.
EDID:
  Extension Block 1 started with EDID header, ignoring Extension Blocks >= 1.

EDID conformity: FAIL
