edid-decode (hex):

00 ff ff ff ff ff ff 00 38 73 00 00 00 00 00 00
0d 1a 01 03 a3 79 44 96 1e ee 91 a3 54 4c 99 26
0f 50 54 20 00 00 01 01 01 01 01 01 01 01 01 01
01 01 01 01 01 01 02 3a 80 18 71 38 2d 40 58 2c
45 00 be ab 42 00 00 1e 01 1d 00 72 51 d0 1e 20
6e 28 55 00 be ab 42 00 00 1e 00 00 00 fc 00 4e
43 53 20 48 44 4d 49 20 20 20 20 20 00 00 00 fd
00 18 78 0c 9a 22 00 0a 20 20 20 20 20 20 01 b7

02 03 19 c1 46 90 04 05 22 13 14 23 09 04 07 83
01 00 00 65 03 0c 00 10 00 01 1d 80 18 71 1c 16
20 58 2c 25 00 be ab 42 00 00 9e 01 1d 80 18 71
38 2d 40 58 2c 45 00 be ab 42 00 00 1e 01 1d 00
bc 52 d0 1e 20 b8 28 55 40 be ab 42 00 00 1e 01
1d 80 d0 72 1c 16 20 10 2c 25 80 be ab 42 00 00
9e 00 00 00 00 00 00 00 00 00 00 00 00 00 00 00
00 00 00 00 00 00 00 00 00 00 00 00 00 00 00 1d

00 ff ff ff ff ff ff 00 38 73 00 00 00 00 00 00
0d 1a 01 03 a3 79 44 96 1e ee 91 a3 54 4c 99 26
0f 50 54 20 00 00 01 01 01 01 01 01 01 01 01 01
01 01 01 01 01 01 02 3a 80 18 71 38 2d 40 58 2c
45 00 be ab 42 00 00 1e 01 1d 00 72 51 d0 1e 20
6e 28 55 00 be ab 42 00 00 1e 00 00 00 fc 00 4e
43 53 20 48 44 4d 49 20 20 20 20 20 00 00 00 fd
00 18 78 0c 9a 22 00 0a 20 20 20 20 20 20 01 b7

02 03 19 c1 46 90 04 05 22 13 14 23 09 04 07 83
01 00 00 65 03 0c 00 10 00 01 1d 80 18 71 1c 16
20 58 2c 25 00 be ab 42 00 00 9e 01 1d 80 18 71
38 2d 40 58 2c 45 00 be ab 42 00 00 1e 01 1d 00
bc 52 d0 1e 20 b8 28 55 40 be ab 42 00 00 1e 01
1d 80 d0 72 1c 16 20 10 2c 25 80 be ab 42 00 00
9e 00 00 00 00 00 00 00 00 00 00 00 00 00 00 00
00 00 00 00 00 00 00 00 00 00 00 00 00 00 00 1d

----------------

Block 0, Base EDID:
  EDID Structure Version & Revision: 1.3
  Vendor & Product Identification:
    Manufacturer: NCS
    Model: 0
    Made in: week 13 of 2016
  Basic Display Parameters & Features:
    Digital display
    DFP 1.x compatible TMDS
    Maximum image size: 121 cm x 68 cm
    Gamma: 2.50
    Undefined display color type
    Default (sRGB) color space is primary color space
    First detailed timing is the preferred timing
  Color Characteristics:
    Red  : 0.6396, 0.3300
    Green: 0.2998, 0.5996
    Blue : 0.1503, 0.0595
    White: 0.3125, 0.3291
  Established Timings I & II:
    DMT 0x04:   640x480    59.940476 Hz   4:3     31.469 kHz     25.175000 MHz
  Standard Timings: none
  Detailed Timing Descriptors:
    DTD 1:  1920x1080   60.000000 Hz  16:9     67.500 kHz    148.500000 MHz (1214 mm x 683 mm)
                 Hfront   88 Hsync  44 Hback  148 Hpol P
                 Vfront    4 Vsync   5 Vback   36 Vpol P
    DTD 2:  1280x720    60.000000 Hz  16:9     45.000 kHz     74.250000 MHz (1214 mm x 683 mm)
                 Hfront  110 Hsync  40 Hback  220 Hpol P
                 Vfront    5 Vsync   5 Vback   20 Vpol P
    Display Product Name: 'NCS HDMI     '
    Display Range Limits:
      Monitor ranges (GTF): 24-120 Hz V, 12-154 kHz H, max dotclock 340 MHz
  Extension blocks: 1
Checksum: 0xb7

----------------

Block 1, CTA-861 Extension Block:
  Revision: 3
  Underscans IT Video Formats by default
  Basic audio support
  Native DTDs: 1
  Video Data Block:
    VIC  16:  1920x1080   60.000000 Hz  16:9     67.500 kHz    148.500000 MHz (native)
    VIC   4:  1280x720    60.000000 Hz  16:9     45.000 kHz     74.250000 MHz
    VIC   5:  1920x1080i  60.000000 Hz  16:9     33.750 kHz     74.250000 MHz
    VIC  34:  1920x1080   30.000000 Hz  16:9     33.750 kHz     74.250000 MHz
    VIC  19:  1280x720    50.000000 Hz  16:9     37.500 kHz     74.250000 MHz
    VIC  20:  1920x1080i  50.000000 Hz  16:9     28.125 kHz     74.250000 MHz
  Audio Data Block:
    Linear PCM:
      Max channels: 2
      Supported sample rates (kHz): 48
      Supported sample sizes (bits): 24 20 16
  Speaker Allocation Data Block:
    FL/FR - Front Left/Right
  Vendor-Specific Data Block (HDMI), OUI 00-0C-03:
    Source physical address: 1.0.0.0
  Detailed Timing Descriptors:
    DTD 3:  1920x1080i  60.000000 Hz  16:9     33.750 kHz     74.250000 MHz (1214 mm x 683 mm)
                 Hfront   88 Hsync  44 Hback  148 Hpol P
                 Vfront    2 Vsync   5 Vback   15 Vpol P Vfront +0.5 Odd Field
                 Vfront    2 Vsync   5 Vback   15 Vpol P Vback  +0.5 Even Field
    DTD 4:  1920x1080   30.000000 Hz  16:9     33.750 kHz     74.250000 MHz (1214 mm x 683 mm)
                 Hfront   88 Hsync  44 Hback  148 Hpol P
                 Vfront    4 Vsync   5 Vback   36 Vpol P
    DTD 5:  1280x720    50.000000 Hz  16:9     37.500 kHz     74.250000 MHz (1214 mm x 683 mm)
                 Hfront  440 Hsync  40 Hback  220 Hpol P
                 Vfront    5 Vsync   5 Vback   20 Vpol P
    DTD 6:  1920x1080i  50.000000 Hz  16:9     28.125 kHz     74.250000 MHz (1214 mm x 683 mm)
                 Hfront  528 Hsync  44 Hback  148 Hpol P
                 Vfront    2 Vsync   5 Vback   15 Vpol P Vfront +0.5 Odd Field
                 Vfront    2 Vsync   5 Vback   15 Vpol P Vback  +0.5 Even Field
Checksum: 0x1d  Unused space in Extension Block: 30 bytes

----------------

Warnings:

Block 0, Base EDID:
  Basic Display Parameters & Features: sRGB is signaled, but the gamma != 2.2.

Failures:

Block 0, Base EDID:
  Basic Display Parameters & Features: Digital Video Interface Standard set to reserved value 0x22.
  Display Product Name: No newline, but one or more trailing spaces.
Block 1, CTA-861 Extension Block:
  Missing VCDB, needed for Set Selectable RGB Quantization to avoid interop issues.
EDID:
  Extension Block 2 started with EDID header, ignoring Extension Blocks >= 2.

EDID conformity: FAIL
