edid-decode (hex):

00 ff ff ff ff ff ff 00 25 e3 08 90 00 00 00 00
33 1f 01 03 80 6b 1e 78 2a c2 01 b0 4e 48 a9 27
0d 50 54 bf ef 80 71 4f 81 c0 81 40 81 80 95 00
a9 c0 b3 00 d1 c0 93 69 00 c8 f0 38 23 40 30 20
35 00 2f 2d 41 00 00 1a 00 00 00 fd 00 30 78 36
a0 3c 00 0a 20 20 20 20 20 20 00 00 00 fc 00 57
52 34 34 2d 50 4c 55 53 0a 20 20 20 00 00 00 ff
00 30 30 30 30 30 30 30 30 30 30 30 30 30 01 44

02 03 44 f1 4e 01 02 03 04 05 90 11 12 13 14 1f
3f 61 60 23 09 7f 07 83 01 00 00 67 03 0c 00 10
00 38 3c 67 d8 5d c4 01 78 80 03 6d 1a 00 00 02
11 30 78 ed 00 00 00 00 00 e3 05 e3 01 e6 06 07
01 75 68 1e 56 5e 00 a0 a0 a0 29 50 30 20 35 00
2f 2d 41 00 00 1e 6f c2 00 a0 a0 a0 55 50 20 40
45 00 2f 2d 41 00 00 1a e0 d3 00 a0 f0 38 32 40
30 40 3a 00 2f 2d 41 00 00 1a 00 00 00 00 00 4d

00 ff ff ff ff ff ff 00 25 e3 08 90 00 00 00 00
33 1f 01 03 80 6b 1e 78 2a c2 01 b0 4e 48 a9 27
0d 50 54 bf ef 80 71 4f 81 c0 81 40 81 80 95 00
a9 c0 b3 00 d1 c0 93 69 00 c8 f0 38 23 40 30 20
35 00 2f 2d 41 00 00 1a 00 00 00 fd 00 30 78 36
a0 3c 00 0a 20 20 20 20 20 20 00 00 00 fc 00 57
52 34 34 2d 50 4c 55 53 0a 20 20 20 00 00 00 ff
00 30 30 30 30 30 30 30 30 30 30 30 30 30 01 44

02 03 44 f1 4e 01 02 03 04 05 90 11 12 13 14 1f
3f 61 60 23 09 7f 07 83 01 00 00 67 03 0c 00 10
00 38 3c 67 d8 5d c4 01 78 80 03 6d 1a 00 00 02
11 30 78 ed 00 00 00 00 00 e3 05 e3 01 e6 06 07
01 75 68 1e 56 5e 00 a0 a0 a0 29 50 30 20 35 00
2f 2d 41 00 00 1e 6f c2 00 a0 a0 a0 55 50 20 40
45 00 2f 2d 41 00 00 1a e0 d3 00 a0 f0 38 32 40
30 40 3a 00 2f 2d 41 00 00 1a 00 00 00 00 00 4d

----------------

Block 0, Base EDID:
  EDID Structure Version & Revision: 1.3
  Vendor & Product Identification:
    Manufacturer: IOC
    Model: 36872
    Made in: week 51 of 2021
  Basic Display Parameters & Features:
    Digital display
    Maximum image size: 107 cm x 30 cm
    Gamma: 2.20
    DPMS levels: Off
    RGB color display
    First detailed timing is the preferred timing
  Color Characteristics:
    Red  : 0.6904, 0.3046
    Green: 0.2812, 0.6621
    Blue : 0.1523, 0.0507
    White: 0.3125, 0.3291
  Established Timings I & II:
    IBM     :   720x400    70.081663 Hz   9:5     31.467 kHz     28.320000 MHz
    DMT 0x04:   640x480    59.940476 Hz   4:3     31.469 kHz     25.175000 MHz
    Apple   :   640x480    66.666667 Hz   4:3     35.000 kHz     30.240000 MHz
    DMT 0x05:   640x480    72.808802 Hz   4:3     37.861 kHz     31.500000 MHz
    DMT 0x06:   640x480    75.000000 Hz   4:3     37.500 kHz     31.500000 MHz
    DMT 0x08:   800x600    56.250000 Hz   4:3     35.156 kHz     36.000000 MHz
    DMT 0x09:   800x600    60.316541 Hz   4:3     37.879 kHz     40.000000 MHz
    DMT 0x0a:   800x600    72.187572 Hz   4:3     48.077 kHz     50.000000 MHz
    DMT 0x0b:   800x600    75.000000 Hz   4:3     46.875 kHz     49.500000 MHz
    Apple   :   832x624    74.551266 Hz   4:3     49.726 kHz     57.284000 MHz
    DMT 0x10:  1024x768    60.003840 Hz   4:3     48.363 kHz     65.000000 MHz
    DMT 0x11:  1024x768    70.069359 Hz   4:3     56.476 kHz     75.000000 MHz
    DMT 0x12:  1024x768    75.028582 Hz   4:3     60.023 kHz     78.750000 MHz
    DMT 0x24:  1280x1024   75.024675 Hz   5:4     79.976 kHz    135.000000 MHz
    Apple   :  1152x870    75.061550 Hz 192:145   68.681 kHz    100.000000 MHz
  Standard Timings:
    DMT 0x15:  1152x864    75.000000 Hz   4:3     67.500 kHz    108.000000 MHz
    DMT 0x55:  1280x720    60.000000 Hz  16:9     45.000 kHz     74.250000 MHz
    DMT 0x20:  1280x960    60.000000 Hz   4:3     60.000 kHz    108.000000 MHz
    DMT 0x23:  1280x1024   60.019740 Hz   5:4     63.981 kHz    108.000000 MHz
    DMT 0x2f:  1440x900    59.887445 Hz  16:10    55.935 kHz    106.500000 MHz
    DMT 0x53:  1600x900    60.000000 Hz  16:9     60.000 kHz    108.000000 MHz (RB)
    DMT 0x3a:  1680x1050   59.954250 Hz  16:10    65.290 kHz    146.250000 MHz
    DMT 0x52:  1920x1080   60.000000 Hz  16:9     67.500 kHz    148.500000 MHz
  Detailed Timing Descriptors:
    DTD 1:  3840x1080   59.998668 Hz  32:9     66.899 kHz    270.270000 MHz (1071 mm x 301 mm)
                 Hfront   48 Hsync  32 Hback  120 Hpol P
                 Vfront    3 Vsync   5 Vback   27 Vpol N
    Display Range Limits:
      Monitor ranges (GTF): 48-120 Hz V, 54-160 kHz H, max dotclock 600 MHz
    Display Product Name: 'WR44-PLUS'
    Display Product Serial Number: ...
  Extension blocks: 1
Checksum: 0x44

----------------

Block 1, CTA-861 Extension Block:
  Revision: 3
  Underscans IT Video Formats by default
  Basic audio support
  Supports YCbCr 4:4:4
  Supports YCbCr 4:2:2
  Native DTDs: 1
  Video Data Block:
    VIC   1:   640x480    59.940476 Hz   4:3     31.469 kHz     25.175000 MHz
    VIC   2:   720x480    59.940060 Hz   4:3     31.469 kHz     27.000000 MHz
    VIC   3:   720x480    59.940060 Hz  16:9     31.469 kHz     27.000000 MHz
    VIC   4:  1280x720    60.000000 Hz  16:9     45.000 kHz     74.250000 MHz
    VIC   5:  1920x1080i  60.000000 Hz  16:9     33.750 kHz     74.250000 MHz
    VIC  16:  1920x1080   60.000000 Hz  16:9     67.500 kHz    148.500000 MHz (native)
    VIC  17:   720x576    50.000000 Hz   4:3     31.250 kHz     27.000000 MHz
    VIC  18:   720x576    50.000000 Hz  16:9     31.250 kHz     27.000000 MHz
    VIC  19:  1280x720    50.000000 Hz  16:9     37.500 kHz     74.250000 MHz
    VIC  20:  1920x1080i  50.000000 Hz  16:9     28.125 kHz     74.250000 MHz
    VIC  31:  1920x1080   50.000000 Hz  16:9     56.250 kHz    148.500000 MHz
    VIC  63:  1920x1080  120.000000 Hz  16:9    135.000 kHz    297.000000 MHz
    VIC  97:  3840x2160   60.000000 Hz  16:9    135.000 kHz    594.000000 MHz
    VIC  96:  3840x2160   50.000000 Hz  16:9    112.500 kHz    594.000000 MHz
  Audio Data Block:
    Linear PCM:
      Max channels: 2
      Supported sample rates (kHz): 192 176.4 96 88.2 48 44.1 32
      Supported sample sizes (bits): 24 20 16
  Speaker Allocation Data Block:
    FL/FR - Front Left/Right
  Vendor-Specific Data Block (HDMI), OUI 00-0C-03:
    Source physical address: 1.0.0.0
    DC_36bit
    DC_30bit
    DC_Y444
    Maximum TMDS clock: 300 MHz
  Vendor-Specific Data Block (HDMI Forum), OUI C4-5D-D8:
    Version: 1
    Maximum TMDS Character Rate: 600 MHz
    SCDC Present
    Supports 12-bits/component Deep Color 4:2:0 Pixel Encoding
    Supports 10-bits/component Deep Color 4:2:0 Pixel Encoding
  Vendor-Specific Data Block (AMD), OUI 00-00-1A:
    Version: 2
    Flags 1: 0x11
      FreeSync Supported
    Minimum Refresh Rate: 48 Hz
    Maximum Refresh Rate: 120 Hz
    MCCS VCP Code: 0xed
    Flags 5: 0x00
  Colorimetry Data Block:
    xvYCC601
    xvYCC709
    BT2020cYCC
    BT2020YCC
    BT2020RGB
    Gamut Boundary Description Metadata Profile P0
  HDR Static Metadata Data Block:
    Electro optical transfer functions:
      Traditional gamma - SDR luminance range
      Traditional gamma - HDR luminance range
      SMPTE ST2084
    Supported static metadata descriptors:
      Static metadata type 1
    Desired content max luminance: 117 (630.392 cd/m^2)
    Desired content max frame-average luminance: 104 (475.683 cd/m^2)
    Desired content min luminance: 30 (0.087 cd/m^2)
  Detailed Timing Descriptors:
    DTD 2:  2560x1440   59.950550 Hz  16:9     88.787 kHz    241.500000 MHz (1071 mm x 301 mm)
                 Hfront   48 Hsync  32 Hback   80 Hpol P
                 Vfront    3 Vsync   5 Vback   33 Vpol P
    DTD 3:  2560x1440  119.997589 Hz  16:9    182.996 kHz    497.750000 MHz (1071 mm x 301 mm)
                 Hfront   32 Hsync  64 Hback   64 Hpol P
                 Vfront    4 Vsync   5 Vback   76 Vpol N
    DTD 4:  3840x1080  120.000000 Hz  32:9    135.600 kHz    542.400000 MHz (1071 mm x 301 mm)
                 Hfront   48 Hsync  64 Hback   48 Hpol P
                 Vfront    3 Vsync  10 Vback   37 Vpol N
Checksum: 0x4d  Unused space in Extension Block: 5 bytes

----------------

Warnings:

Block 0, Base EDID:
  Display Product Serial Number: ...
Block 1, CTA-861 Extension Block:
  Video Data Block: VIC 1 and the first DTD are not identical. Is this intended?
  Colorimetry Data Block: Set the sRGB colorimetry bit to avoid interop issues.
  Detailed Timing Descriptor #2: Image size is 1071x301 mm, but based on the picture AR it should be 535x301 mm.
  Detailed Timing Descriptor #3: Image size is 1071x301 mm, but based on the picture AR it should be 535x301 mm.
EDID:
  Base EDID: Some timings are out of range of the Monitor Ranges:
    Horizontal Freq: 28.125 - 182.996 kHz (Monitor: 54.000 - 160.000 kHz)

Failures:

Block 1, CTA-861 Extension Block:
  Missing VCDB, needed for Set Selectable RGB Quantization to avoid interop issues.
EDID:
  Extension Block 2 started with EDID header, ignoring Extension Blocks >= 2.
  CTA-861: Native progressive timings are a mix of several resolutions.

EDID conformity: FAIL
