edid-decode (hex):

00 ff ff ff ff ff ff 00 0e 8c 10 27 01 00 00 00
04 17 01 04 a5 a0 64 78 22 1f f5 ae 4f 35 b5 25
0d 50 54 23 08 00 a9 40 81 80 81 c0 d1 00 01 01
01 01 01 01 01 01 56 5e 00 a0 a0 a0 29 50 28 20
35 00 76 70 21 00 00 1a 02 3a 80 18 71 38 2d 40
58 2c 45 00 76 70 21 00 00 1e 00 00 00 fd 00 38
4c 1f 5a 19 00 0a 20 20 20 20 20 20 00 00 00 fc
00 44 69 73 70 6c 61 79 20 50 6f 72 74 0a 01 cf

02 03 1e f1 4b 90 1f 14 13 12 11 05 04 03 02 01
23 09 07 07 83 01 00 00 65 03 0c 00 10 00 02 3a
80 18 71 38 2d 40 58 2c 45 00 a2 0b 32 00 00 1e
02 3a 80 d0 72 38 2d 40 10 2c 45 80 a2 0b 32 00
00 1e 01 1d 00 72 51 d0 1e 20 6e 28 55 00 a2 0b
32 00 00 1e 01 1d 00 bc 52 d0 1e 20 b8 28 55 40
a2 0b 32 00 00 1e 8c 0a d0 90 20 40 31 20 0c 40
55 00 a2 0b 32 00 00 18 00 00 00 00 00 00 00 44

00 ff ff ff ff ff ff 00 0e 8c 10 27 01 00 00 00
04 17 01 04 a5 a0 64 78 22 1f f5 ae 4f 35 b5 25
0d 50 54 23 08 00 a9 40 81 80 81 c0 d1 00 01 01
01 01 01 01 01 01 56 5e 00 a0 a0 a0 29 50 28 20
35 00 76 70 21 00 00 1a 02 3a 80 18 71 38 2d 40
58 2c 45 00 76 70 21 00 00 1e 00 00 00 fd 00 38
4c 1f 5a 19 00 0a 20 20 20 20 20 20 00 00 00 fc
00 44 69 73 70 6c 61 79 20 50 6f 72 74 0a 01 cf

02 03 1e f1 4b 90 1f 14 13 12 11 05 04 03 02 01
23 09 07 07 83 01 00 00 65 03 0c 00 10 00 02 3a
80 18 71 38 2d 40 58 2c 45 00 a2 0b 32 00 00 1e
02 3a 80 d0 72 38 2d 40 10 2c 45 80 a2 0b 32 00
00 1e 01 1d 00 72 51 d0 1e 20 6e 28 55 00 a2 0b
32 00 00 1e 01 1d 00 bc 52 d0 1e 20 b8 28 55 40
a2 0b 32 00 00 1e 8c 0a d0 90 20 40 31 20 0c 40
55 00 a2 0b 32 00 00 18 00 00 00 00 00 00 00 44

----------------

Block 0, Base EDID:
  EDID Structure Version & Revision: 1.4
  Vendor & Product Identification:
    Manufacturer: CTL
    Model: 10000
    Serial Number: ...
    Made in: week 4 of 2013
  Basic Display Parameters & Features:
    Digital display
    Bits per primary color channel: 8
    DisplayPort interface
    Maximum image size: 160 cm x 100 cm
    Gamma: 2.20
    DPMS levels: Off
    Supported color formats: RGB 4:4:4
    First detailed timing includes the native pixel format and preferred refresh rate
  Color Characteristics:
    Red  : 0.6796, 0.3095
    Green: 0.2099, 0.7099
    Blue : 0.1474, 0.0537
    White: 0.3134, 0.3291
  Established Timings I & II:
    DMT 0x04:   640x480    59.940476 Hz   4:3     31.469 kHz     25.175000 MHz
    DMT 0x08:   800x600    56.250000 Hz   4:3     35.156 kHz     36.000000 MHz
    DMT 0x09:   800x600    60.316541 Hz   4:3     37.879 kHz     40.000000 MHz
    DMT 0x10:  1024x768    60.003840 Hz   4:3     48.363 kHz     65.000000 MHz
  Standard Timings:
    DMT 0x33:  1600x1200   60.000000 Hz   4:3     75.000 kHz    162.000000 MHz
    DMT 0x23:  1280x1024   60.019740 Hz   5:4     63.981 kHz    108.000000 MHz
    DMT 0x55:  1280x720    60.000000 Hz  16:9     45.000 kHz     74.250000 MHz
    DMT 0x45:  1920x1200   59.884600 Hz  16:10    74.556 kHz    193.250000 MHz
  Detailed Timing Descriptors:
    DTD 1:  2560x1440   59.950550 Hz  16:9     88.787 kHz    241.500000 MHz (630 mm x 368 mm)
                 Hfront   40 Hsync  32 Hback   88 Hpol P
                 Vfront    3 Vsync   5 Vback   33 Vpol N
    DTD 2:  1920x1080   60.000000 Hz  16:9     67.500 kHz    148.500000 MHz (630 mm x 368 mm)
                 Hfront   88 Hsync  44 Hback  148 Hpol P
                 Vfront    4 Vsync   5 Vback   36 Vpol P
    Display Range Limits:
      Monitor ranges (GTF): 56-76 Hz V, 31-90 kHz H, max dotclock 250 MHz
    Display Product Name: 'Display Port'
  Extension blocks: 1
Checksum: 0xcf

----------------

Block 1, CTA-861 Extension Block:
  Revision: 3
  Underscans IT Video Formats by default
  Basic audio support
  Supports YCbCr 4:4:4
  Supports YCbCr 4:2:2
  Native DTDs: 1
  Video Data Block:
    VIC  16:  1920x1080   60.000000 Hz  16:9     67.500 kHz    148.500000 MHz (native)
    VIC  31:  1920x1080   50.000000 Hz  16:9     56.250 kHz    148.500000 MHz
    VIC  20:  1920x1080i  50.000000 Hz  16:9     28.125 kHz     74.250000 MHz
    VIC  19:  1280x720    50.000000 Hz  16:9     37.500 kHz     74.250000 MHz
    VIC  18:   720x576    50.000000 Hz  16:9     31.250 kHz     27.000000 MHz
    VIC  17:   720x576    50.000000 Hz   4:3     31.250 kHz     27.000000 MHz
    VIC   5:  1920x1080i  60.000000 Hz  16:9     33.750 kHz     74.250000 MHz
    VIC   4:  1280x720    60.000000 Hz  16:9     45.000 kHz     74.250000 MHz
    VIC   3:   720x480    59.940060 Hz  16:9     31.469 kHz     27.000000 MHz
    VIC   2:   720x480    59.940060 Hz   4:3     31.469 kHz     27.000000 MHz
    VIC   1:   640x480    59.940476 Hz   4:3     31.469 kHz     25.175000 MHz
  Audio Data Block:
    Linear PCM:
      Max channels: 2
      Supported sample rates (kHz): 48 44.1 32
      Supported sample sizes (bits): 24 20 16
  Speaker Allocation Data Block:
    FL/FR - Front Left/Right
  Vendor-Specific Data Block (HDMI), OUI 00-0C-03:
    Source physical address: 1.0.0.0
  Detailed Timing Descriptors:
    DTD 3:  1920x1080   60.000000 Hz  16:9     67.500 kHz    148.500000 MHz (930 mm x 523 mm)
                 Hfront   88 Hsync  44 Hback  148 Hpol P
                 Vfront    4 Vsync   5 Vback   36 Vpol P
    DTD 4:  1920x1080   50.000000 Hz  16:9     56.250 kHz    148.500000 MHz (930 mm x 523 mm)
                 Hfront  528 Hsync  44 Hback  148 Hpol P
                 Vfront    4 Vsync   5 Vback   36 Vpol P
    DTD 5:  1280x720    60.000000 Hz  16:9     45.000 kHz     74.250000 MHz (930 mm x 523 mm)
                 Hfront  110 Hsync  40 Hback  220 Hpol P
                 Vfront    5 Vsync   5 Vback   20 Vpol P
    DTD 6:  1280x720    50.000000 Hz  16:9     37.500 kHz     74.250000 MHz (930 mm x 523 mm)
                 Hfront  440 Hsync  40 Hback  220 Hpol P
                 Vfront    5 Vsync   5 Vback   20 Vpol P
    DTD 7:   720x576    50.000000 Hz   5:4     31.250 kHz     27.000000 MHz (930 mm x 523 mm)
                 Hfront   12 Hsync  64 Hback   68 Hpol N
                 Vfront    5 Vsync   5 Vback   39 Vpol N
Checksum: 0x44  Unused space in Extension Block: 7 bytes

----------------

Warnings:

Block 0, Base EDID:
  Vendor & Product Identification: The serial number is one of the known dummy values, it should probably be set to 0.
  Detailed Timing Descriptor #1: Image size is 630x368 mm, but based on the picture AR it should be 630x354 mm.
  Detailed Timing Descriptor #2: Image size is 630x368 mm, but based on the picture AR it should be 630x354 mm.
  Display Range Limits: GTF support is deprecated in EDID 1.4.
Block 1, CTA-861 Extension Block:
  Video Data Block: VIC 16 and the first DTD are not identical. Is this intended?
  Detailed Timing Descriptor #7: Image size is 930x523 mm, but based on the picture AR it should be 653x523 mm.
  Add a Colorimetry Data Block with the sRGB colorimetry bit set to avoid interop issues.
EDID:
  Base EDID: Some timings are out of range of the Monitor Ranges:
    Vertical Freq: 50.000 - 60.317 Hz (Monitor: 56.000 - 76.000 Hz)
    Horizontal Freq: 28.125 - 88.786 kHz (Monitor: 31.000 - 90.000 kHz)

Failures:

Block 0, Base EDID:
  Detailed Timing Descriptor #1: Mismatch of image size 630x368 mm vs display size 1600x1000 mm.
  Detailed Timing Descriptor #2: Mismatch of image size 630x368 mm vs display size 1600x1000 mm.
  Display Range Limits: GTF is supported, but the display does not support continuous frequencies.
Block 1, CTA-861 Extension Block:
  Vendor-Specific Data Block (HDMI), OUI 00-0C-03: The HDMI Specification requires EDID 1.3 instead of 1.4.
  Detailed Timing Descriptor #3: Mismatch of image size 930x523 mm vs display size 1600x1000 mm.
  Detailed Timing Descriptor #4: Mismatch of image size 930x523 mm vs display size 1600x1000 mm.
  Detailed Timing Descriptor #5: Mismatch of image size 930x523 mm vs display size 1600x1000 mm.
  Detailed Timing Descriptor #6: Mismatch of image size 930x523 mm vs display size 1600x1000 mm.
  Detailed Timing Descriptor #7: Mismatch of image size 930x523 mm vs display size 1600x1000 mm.
  Missing VCDB, needed for Set Selectable RGB Quantization to avoid interop issues.
EDID:
  Extension Block 2 started with EDID header, ignoring Extension Blocks >= 2.
  CTA-861: Native progressive timings are a mix of several resolutions.

EDID conformity: FAIL
