edid-decode (hex):

00 ff ff ff ff ff ff 00 09 d1 83 7f 00 00 00 00
2f 1f 01 04 a5 36 1e 78 3f 50 e5 a8 55 52 9f 26
14 50 54 a5 6b 80 d1 c0 81 c0 81 00 81 80 a9 c0
b3 00 81 bc 01 01 02 3a 80 18 71 38 2d 40 58 2c
45 00 20 2f 21 00 00 1e 00 00 00 ff 00 45 42 35
42 4d 30 31 37 30 30 53 4c 30 00 00 00 fd 00 30
f0 ff ff 3c 01 0a 20 20 20 20 20 20 00 00 00 fc
00 5a 4f 57 49 45 20 58 4c 20 4c 43 44 0a 01 27

02 03 30 f1 52 90 05 04 03 02 01 11 12 13 3f 06
15 16 1f 20 21 22 40 e2 00 cf 23 09 07 07 83 01
00 00 6d 1a 00 00 02 01 30 f0 00 00 00 00 00 00
fe 5b 80 a0 70 38 35 40 30 20 35 00 20 2f 21 00
00 1a 5a 87 80 a0 70 38 4d 40 30 20 35 00 20 2f
21 00 00 1a 0c df 80 a0 70 38 40 40 30 40 35 00
20 2f 21 00 00 1a 9c c7 00 08 52 00 a0 40 74 90
37 00 20 2f 21 00 00 1c 00 00 00 00 00 00 00 b8

00 ff ff ff ff ff ff 00 09 d1 83 7f 00 00 00 00
2f 1f 01 04 a5 36 1e 78 3f 50 e5 a8 55 52 9f 26
14 50 54 a5 6b 80 d1 c0 81 c0 81 00 81 80 a9 c0
b3 00 81 bc 01 01 02 3a 80 18 71 38 2d 40 58 2c
45 00 20 2f 21 00 00 1e 00 00 00 ff 00 45 42 35
42 4d 30 31 37 30 30 53 4c 30 00 00 00 fd 00 30
f0 ff ff 3c 01 0a 20 20 20 20 20 20 00 00 00 fc
00 5a 4f 57 49 45 20 58 4c 20 4c 43 44 0a 01 27

02 03 30 f1 52 90 05 04 03 02 01 11 12 13 3f 06
15 16 1f 20 21 22 40 e2 00 cf 23 09 07 07 83 01
00 00 6d 1a 00 00 02 01 30 f0 00 00 00 00 00 00
fe 5b 80 a0 70 38 35 40 30 20 35 00 20 2f 21 00
00 1a 5a 87 80 a0 70 38 4d 40 30 20 35 00 20 2f
21 00 00 1a 0c df 80 a0 70 38 40 40 30 40 35 00
20 2f 21 00 00 1a 9c c7 00 08 52 00 a0 40 74 90
37 00 20 2f 21 00 00 1c 00 00 00 00 00 00 00 b8

----------------

Block 0, Base EDID:
  EDID Structure Version & Revision: 1.4
  Vendor & Product Identification:
    Manufacturer: BNQ
    Model: 32643
    Made in: week 47 of 2021
  Basic Display Parameters & Features:
    Digital display
    Bits per primary color channel: 8
    DisplayPort interface
    Maximum image size: 54 cm x 30 cm
    Gamma: 2.20
    DPMS levels: Off
    Supported color formats: RGB 4:4:4, YCrCb 4:4:4, YCrCb 4:2:2
    Default (sRGB) color space is primary color space
    First detailed timing includes the native pixel format and preferred refresh rate
    Display supports continuous frequencies
  Color Characteristics:
    Red  : 0.6572, 0.3330
    Green: 0.3203, 0.6210
    Blue : 0.1513, 0.0800
    White: 0.3134, 0.3291
  Established Timings I & II:
    IBM     :   720x400    70.081663 Hz   9:5     31.467 kHz     28.320000 MHz
    DMT 0x04:   640x480    59.940476 Hz   4:3     31.469 kHz     25.175000 MHz
    DMT 0x06:   640x480    75.000000 Hz   4:3     37.500 kHz     31.500000 MHz
    DMT 0x09:   800x600    60.316541 Hz   4:3     37.879 kHz     40.000000 MHz
    DMT 0x0b:   800x600    75.000000 Hz   4:3     46.875 kHz     49.500000 MHz
    Apple   :   832x624    74.551266 Hz   4:3     49.726 kHz     57.284000 MHz
    DMT 0x10:  1024x768    60.003840 Hz   4:3     48.363 kHz     65.000000 MHz
    DMT 0x12:  1024x768    75.028582 Hz   4:3     60.023 kHz     78.750000 MHz
    DMT 0x24:  1280x1024   75.024675 Hz   5:4     79.976 kHz    135.000000 MHz
    Apple   :  1152x870    75.061550 Hz 192:145   68.681 kHz    100.000000 MHz
  Standard Timings:
    DMT 0x52:  1920x1080   60.000000 Hz  16:9     67.500 kHz    148.500000 MHz
    DMT 0x55:  1280x720    60.000000 Hz  16:9     45.000 kHz     74.250000 MHz
    DMT 0x1c:  1280x800    59.810326 Hz  16:10    49.702 kHz     83.500000 MHz
    DMT 0x23:  1280x1024   60.019740 Hz   5:4     63.981 kHz    108.000000 MHz
    DMT 0x53:  1600x900    60.000000 Hz  16:9     60.000 kHz    108.000000 MHz (RB)
    DMT 0x3a:  1680x1050   59.954250 Hz  16:10    65.290 kHz    146.250000 MHz
    GTF     :  1280x1024  120.000185 Hz   5:4    131.640 kHz    233.793000 MHz
  Detailed Timing Descriptors:
    DTD 1:  1920x1080   60.000000 Hz  16:9     67.500 kHz    148.500000 MHz (544 mm x 303 mm)
                 Hfront   88 Hsync  44 Hback  148 Hpol P
                 Vfront    4 Vsync   5 Vback   36 Vpol P
    Display Product Serial Number: ...
    Display Range Limits:
      Monitor ranges (Range Limits Only): 48-240 Hz V, 255-255 kHz H, max dotclock 600 MHz
    Display Product Name: 'ZOWIE XL LCD'
  Extension blocks: 1
Checksum: 0x27

----------------

Block 1, CTA-861 Extension Block:
  Revision: 3
  Underscans IT Video Formats by default
  Basic audio support
  Supports YCbCr 4:4:4
  Supports YCbCr 4:2:2
  Native detailed modes: 1
  Video Data Block:
    VIC  16:  1920x1080   60.000000 Hz  16:9     67.500 kHz    148.500000 MHz (native)
    VIC   5:  1920x1080i  60.000000 Hz  16:9     33.750 kHz     74.250000 MHz
    VIC   4:  1280x720    60.000000 Hz  16:9     45.000 kHz     74.250000 MHz
    VIC   3:   720x480    59.940060 Hz  16:9     31.469 kHz     27.000000 MHz
    VIC   2:   720x480    59.940060 Hz   4:3     31.469 kHz     27.000000 MHz
    VIC   1:   640x480    59.940476 Hz   4:3     31.469 kHz     25.175000 MHz
    VIC  17:   720x576    50.000000 Hz   4:3     31.250 kHz     27.000000 MHz
    VIC  18:   720x576    50.000000 Hz  16:9     31.250 kHz     27.000000 MHz
    VIC  19:  1280x720    50.000000 Hz  16:9     37.500 kHz     74.250000 MHz
    VIC  63:  1920x1080  120.000000 Hz  16:9    135.000 kHz    297.000000 MHz
    VIC   6:  1440x480i   59.940060 Hz   4:3     15.734 kHz     27.000000 MHz
    VIC  21:  1440x576i   50.000000 Hz   4:3     15.625 kHz     27.000000 MHz
    VIC  22:  1440x576i   50.000000 Hz  16:9     15.625 kHz     27.000000 MHz
    VIC  31:  1920x1080   50.000000 Hz  16:9     56.250 kHz    148.500000 MHz
    VIC  32:  1920x1080   24.000000 Hz  16:9     27.000 kHz     74.250000 MHz
    VIC  33:  1920x1080   25.000000 Hz  16:9     28.125 kHz     74.250000 MHz
    VIC  34:  1920x1080   30.000000 Hz  16:9     33.750 kHz     74.250000 MHz
    VIC  64:  1920x1080  100.000000 Hz  16:9    112.500 kHz    297.000000 MHz
  Video Capability Data Block:
    YCbCr quantization: Selectable (via AVI YQ)
    RGB quantization: Selectable (via AVI Q)
    PT scan behavior: No Data
    IT scan behavior: Supports both over- and underscan
    CE scan behavior: Supports both over- and underscan
  Audio Data Block:
    Linear PCM:
      Max channels: 2
      Supported sample rates (kHz): 48 44.1 32
      Supported sample sizes (bits): 24 20 16
  Speaker Allocation Data Block:
    FL/FR - Front Left/Right
  Vendor-Specific Data Block (AMD), OUI 00-00-1A:
    Version: 2
    Feature Caps: 0x01
    Minimum Refresh Rate: 48 Hz
    Maximum Refresh Rate: 240 Hz
    Flags 1.x: 0x00
    Flags 2.x: 0x00
    Maximum luminance: 0 (50.000 cd/m^2)
    Minimum luminance: 0 (0.000 cd/m^2)
    Unknown: 0x00 0x00
  Detailed Timing Descriptors:
    DTD 2:  1920x1080   99.930409 Hz  16:9    113.221 kHz    235.500000 MHz (544 mm x 303 mm)
                 Hfront   48 Hsync  32 Hback   80 Hpol P
                 Vfront    3 Vsync   5 Vback   45 Vpol N
    DTD 3:  1920x1080  143.981451 Hz  16:9    166.587 kHz    346.500000 MHz (544 mm x 303 mm)
                 Hfront   48 Hsync  32 Hback   80 Hpol P
                 Vfront    3 Vsync   5 Vback   69 Vpol N
    DTD 4:  1920x1080  239.964363 Hz  16:9    274.519 kHz    571.000000 MHz (544 mm x 303 mm)
                 Hfront   48 Hsync  64 Hback   48 Hpol P
                 Vfront    3 Vsync   5 Vback   56 Vpol N
    DTD 5:  1280x1024  239.771021 Hz   5:4    283.889 kHz    511.000000 MHz (544 mm x 303 mm)
                 Hfront  116 Hsync 144 Hback  260 Hpol N
                 Vfront    3 Vsync   7 Vback  150 Vpol P
Checksum: 0xb8  Unused space in Extension Block: 7 bytes

----------------

Block 2, Unknown EDID Extension Block 0x00:
  00 ff ff ff ff ff ff 00 09 d1 83 7f 00 00 00 00 '................'
  2f 1f 01 04 a5 36 1e 78 3f 50 e5 a8 55 52 9f 26 '/....6.x?P..UR.&'
  14 50 54 a5 6b 80 d1 c0 81 c0 81 00 81 80 a9 c0 '.PT.k...........'
  b3 00 81 bc 01 01 02 3a 80 18 71 38 2d 40 58 2c '.......:..q8-@X,'
  45 00 20 2f 21 00 00 1e 00 00 00 ff 00 45 42 35 'E. /!........EB5'
  42 4d 30 31 37 30 30 53 4c 30 00 00 00 fd 00 30 'BM01700SL0.....0'
  f0 ff ff 3c 01 0a 20 20 20 20 20 20 00 00 00 fc '...<..      ....'
  00 5a 4f 57 49 45 20 58 4c 20 4c 43 44 0a 01 27 '.ZOWIE XL LCD..''
Checksum: 0x27

----------------

Block 3, CTA-861 Extension Block:
  Revision: 3
  Underscans IT Video Formats by default
  Basic audio support
  Supports YCbCr 4:4:4
  Supports YCbCr 4:2:2
  Native detailed modes: 1
  Video Data Block:
    VIC  16:  1920x1080   60.000000 Hz  16:9     67.500 kHz    148.500000 MHz (native)
    VIC   5:  1920x1080i  60.000000 Hz  16:9     33.750 kHz     74.250000 MHz
    VIC   4:  1280x720    60.000000 Hz  16:9     45.000 kHz     74.250000 MHz
    VIC   3:   720x480    59.940060 Hz  16:9     31.469 kHz     27.000000 MHz
    VIC   2:   720x480    59.940060 Hz   4:3     31.469 kHz     27.000000 MHz
    VIC   1:   640x480    59.940476 Hz   4:3     31.469 kHz     25.175000 MHz
    VIC  17:   720x576    50.000000 Hz   4:3     31.250 kHz     27.000000 MHz
    VIC  18:   720x576    50.000000 Hz  16:9     31.250 kHz     27.000000 MHz
    VIC  19:  1280x720    50.000000 Hz  16:9     37.500 kHz     74.250000 MHz
    VIC  63:  1920x1080  120.000000 Hz  16:9    135.000 kHz    297.000000 MHz
    VIC   6:  1440x480i   59.940060 Hz   4:3     15.734 kHz     27.000000 MHz
    VIC  21:  1440x576i   50.000000 Hz   4:3     15.625 kHz     27.000000 MHz
    VIC  22:  1440x576i   50.000000 Hz  16:9     15.625 kHz     27.000000 MHz
    VIC  31:  1920x1080   50.000000 Hz  16:9     56.250 kHz    148.500000 MHz
    VIC  32:  1920x1080   24.000000 Hz  16:9     27.000 kHz     74.250000 MHz
    VIC  33:  1920x1080   25.000000 Hz  16:9     28.125 kHz     74.250000 MHz
    VIC  34:  1920x1080   30.000000 Hz  16:9     33.750 kHz     74.250000 MHz
    VIC  64:  1920x1080  100.000000 Hz  16:9    112.500 kHz    297.000000 MHz
  Video Capability Data Block:
    YCbCr quantization: Selectable (via AVI YQ)
    RGB quantization: Selectable (via AVI Q)
    PT scan behavior: No Data
    IT scan behavior: Supports both over- and underscan
    CE scan behavior: Supports both over- and underscan
  Audio Data Block:
    Linear PCM:
      Max channels: 2
      Supported sample rates (kHz): 48 44.1 32
      Supported sample sizes (bits): 24 20 16
  Speaker Allocation Data Block:
    FL/FR - Front Left/Right
  Vendor-Specific Data Block (AMD), OUI 00-00-1A:
    Version: 2
    Feature Caps: 0x01
    Minimum Refresh Rate: 48 Hz
    Maximum Refresh Rate: 240 Hz
    Flags 1.x: 0x00
    Flags 2.x: 0x00
    Maximum luminance: 0 (50.000 cd/m^2)
    Minimum luminance: 0 (0.000 cd/m^2)
    Unknown: 0x00 0x00
  Detailed Timing Descriptors:
    DTD 6:  1920x1080   99.930409 Hz  16:9    113.221 kHz    235.500000 MHz (544 mm x 303 mm)
                 Hfront   48 Hsync  32 Hback   80 Hpol P
                 Vfront    3 Vsync   5 Vback   45 Vpol N
    DTD 7:  1920x1080  143.981451 Hz  16:9    166.587 kHz    346.500000 MHz (544 mm x 303 mm)
                 Hfront   48 Hsync  32 Hback   80 Hpol P
                 Vfront    3 Vsync   5 Vback   69 Vpol N
    DTD 8:  1920x1080  239.964363 Hz  16:9    274.519 kHz    571.000000 MHz (544 mm x 303 mm)
                 Hfront   48 Hsync  64 Hback   48 Hpol P
                 Vfront    3 Vsync   5 Vback   56 Vpol N
    DTD 9:  1280x1024  239.771021 Hz   5:4    283.889 kHz    511.000000 MHz (544 mm x 303 mm)
                 Hfront  116 Hsync 144 Hback  260 Hpol N
                 Vfront    3 Vsync   7 Vback  150 Vpol P
Checksum: 0xb8  Unused space in Extension Block: 7 bytes

----------------

Warnings:

Block 1, CTA-861 Extension Block:
  Detailed Timing Descriptor #5: Image size is 544x303 mm, but based on the picture AR it should be 544x435 mm.
Block 3, CTA-861 Extension Block:
  Detailed Timing Descriptor #9: Image size is 544x303 mm, but based on the picture AR it should be 544x435 mm.
EDID:
  Base EDID: Some timings are out of range of the Monitor Ranges:
    Vertical Freq: 24.000 - 239.964 Hz (Monitor: 48.000 - 240.000 Hz)
    Horizontal Freq: 15.625 - 283.888 kHz (Monitor: 255.000 - 255.000 kHz)
  CTA-861: Multiple native progressive timings are defined.

Failures:

Block 0, Base EDID:
  Basic Display Parameters & Features: sRGB is signaled, but the chromaticities do not match.
Block 2, Base EDID:
  Unknown Extension Block.
Block 3, CTA-861 Extension Block:
  Video Data Block: Duplicate VIC 16.
  Video Data Block: Duplicate VIC 5.
  Video Data Block: Duplicate VIC 4.
  Video Data Block: Duplicate VIC 3.
  Video Data Block: Duplicate VIC 2.
  Video Data Block: Duplicate VIC 1.
  Video Data Block: Duplicate VIC 17.
  Video Data Block: Duplicate VIC 18.
  Video Data Block: Duplicate VIC 19.
  Video Data Block: Duplicate VIC 63.
  Video Data Block: Duplicate VIC 6.
  Video Data Block: Duplicate VIC 21.
  Video Data Block: Duplicate VIC 22.
  Video Data Block: Duplicate VIC 31.
  Video Data Block: Duplicate VIC 32.
  Video Data Block: Duplicate VIC 33.
  Video Data Block: Duplicate VIC 34.
  Video Data Block: Duplicate VIC 64.
  Video Capability Data Block: Only one instance of this Data Block is allowed.
  Speaker Allocation Data Block: Only one instance of this Data Block is allowed.
EDID:
  Base EDID: EDID specified 1 extension block(s), but found 3 extension block(s).

EDID conformity: FAIL
