edid-decode (hex):

00 ff ff ff ff ff ff 00 30 e4 b1 06 a1 27 21 00
00 1f 01 04 a5 1b 12 78 03 ef 70 a7 51 4c a8 26
0e 4f 53 00 00 00 01 01 01 01 01 01 01 01 01 01
01 01 01 01 01 01 de 8a 40 78 b0 80 37 70 30 20
55 00 12 b7 10 00 00 1a 00 00 00 fd 00 1e 78 f0
f0 48 01 0a 20 20 20 20 20 20 00 00 00 fe 00 4c
47 44 5f 4d 50 31 2e 31 5f 0a 20 20 00 00 00 fe
00 4c 50 31 32 39 57 54 32 31 32 31 36 36 01 7d

70 13 2e 00 00 03 01 14 7f 15 01 88 3f 0b 4f 00
07 80 1f 00 7f 07 1f 08 41 00 07 00 03 01 14 7f
15 01 08 3f 0b 4f 00 07 80 1f 00 7f 07 4f 00 41
00 07 00 45 00 00 00 00 00 00 00 00 00 00 00 00
00 00 00 00 00 00 00 00 00 00 00 00 00 00 00 00
00 00 00 00 00 00 00 00 00 00 00 00 00 00 00 00
00 00 00 00 00 00 00 00 00 00 00 00 00 00 00 00
00 00 00 00 00 00 00 00 00 00 00 00 00 00 00 90

00 ff ff ff ff ff ff 00 30 e4 b1 06 a1 27 21 00
00 1f 01 04 a5 1b 12 78 03 ef 70 a7 51 4c a8 26
0e 4f 53 00 00 00 01 01 01 01 01 01 01 01 01 01
01 01 01 01 01 01 de 8a 40 78 b0 80 37 70 30 20
55 00 12 b7 10 00 00 1a 00 00 00 fd 00 1e 78 f0
f0 48 01 0a 20 20 20 20 20 20 00 00 00 fe 00 4c
47 44 5f 4d 50 31 2e 31 5f 0a 20 20 00 00 00 fe
00 4c 50 31 32 39 57 54 32 31 32 31 36 36 01 7d

70 13 2e 00 00 03 01 14 7f 15 01 88 3f 0b 4f 00
07 80 1f 00 7f 07 1f 08 41 00 07 00 03 01 14 7f
15 01 08 3f 0b 4f 00 07 80 1f 00 7f 07 4f 00 41
00 07 00 45 00 00 00 00 00 00 00 00 00 00 00 00
00 00 00 00 00 00 00 00 00 00 00 00 00 00 00 00
00 00 00 00 00 00 00 00 00 00 00 00 00 00 00 00
00 00 00 00 00 00 00 00 00 00 00 00 00 00 00 00
00 00 00 00 00 00 00 00 00 00 00 00 00 00 00 90

----------------

Block 0, Base EDID:
  EDID Structure Version & Revision: 1.4
  Vendor & Product Identification:
    Manufacturer: LGD
    Model: 1713
    Serial Number: ...
    Made in: 2021
  Basic Display Parameters & Features:
    Digital display
    Bits per primary color channel: 8
    DisplayPort interface
    Maximum image size: 27 cm x 18 cm
    Gamma: 2.20
    Supported color formats: RGB 4:4:4
    First detailed timing includes the native pixel format and preferred refresh rate
    Display supports continuous frequencies
  Color Characteristics:
    Red  : 0.6552, 0.3183
    Green: 0.2998, 0.6591
    Blue : 0.1494, 0.0576
    White: 0.3085, 0.3242
  Established Timings I & II: none
  Standard Timings: none
  Detailed Timing Descriptors:
    DTD 1:  2880x1920   60.000000 Hz   3:2    118.500 kHz    355.500000 MHz (274 mm x 183 mm)
                 Hfront   48 Hsync  32 Hback   40 Hpol P
                 Vfront    5 Vsync   5 Vback   45 Vpol N
    Display Range Limits:
      Monitor ranges (Range Limits Only): 30-120 Hz V, 240-240 kHz H, max dotclock 720 MHz
    Alphanumeric Data String: 'LGD_MP1.1_'
    Alphanumeric Data String: 'LP129WT212166'
  Extension blocks: 1
Checksum: 0x7d

----------------

Block 1, DisplayID Extension Block:
  Version: 1.3
  Extension Count: 0
  Display Product Type: Extension Section
  Video Timing Modes Type 1 - Detailed Timings Data Block:
    DTD:  2880x1920   60.000000 Hz   0:0    240.000 kHz    710.400000 MHz (aspect undefined, no 3D stereo, preferred)
               Hfront    8 Hsync  32 Hback   40 Hpol P
               Vfront   66 Vsync   8 Vback 2006 Vpol N
  Video Timing Modes Type 1 - Detailed Timings Data Block:
    DTD:  2880x1920  120.000000 Hz   0:0    240.000 kHz    710.400000 MHz (aspect undefined, no 3D stereo)
               Hfront    8 Hsync  32 Hback   40 Hpol P
               Vfront   66 Vsync   8 Vback    6 Vpol N
  Checksum: 0x45
Checksum: 0x90  Unused space in Extension Block: 75 bytes

----------------

Warnings:

Block 0, Base EDID:
  Missing Display Product Name.
EDID:
  Base EDID: Some timings are out of range of the Monitor Ranges:
    Horizontal Freq: 118.500 - 240.000 kHz (Monitor: 240.000 - 240.000 kHz)

Failures:

Block 1, DisplayID Extension Block:
  DisplayID Base Block has no product type.
EDID:
  Extension Block 2 started with EDID header, ignoring Extension Blocks >= 2.

EDID conformity: FAIL
