edid-decode (hex):

00 ff ff ff ff ff ff 00 1e 6d 24 4c 79 15 00 00
02 1a 01 03 6c 29 17 78 ea d0 25 a2 58 55 9c 28
0f 50 54 a7 6a 00 31 4f 45 4f 61 4f 81 c0 01 01
01 01 01 01 01 01 66 21 56 aa 51 00 1e 30 46 8f
33 00 9a e6 10 00 00 1e 00 00 00 fd 00 38 4b 1e
3d 09 00 0a 20 20 20 20 20 20 00 00 00 fc 00 31
39 4d 33 35 0a 20 20 20 20 20 20 20 00 00 00 ff
00 53 65 72 69 61 6c 4e 75 6d 62 65 72 0a 00 15

00 ff ff ff ff ff ff 00 1e 6d 24 4c 79 15 00 00
02 1a 01 03 6c 29 17 78 ea d0 25 a2 58 55 9c 28
0f 50 54 a7 6a 00 31 4f 45 4f 61 4f 81 c0 01 01
01 01 01 01 01 01 66 21 56 aa 51 00 1e 30 46 8f
33 00 9a e6 10 00 00 1e 00 00 00 fd 00 38 4b 1e
3d 09 00 0a 20 20 20 20 20 20 00 00 00 fc 00 31
39 4d 33 35 0a 20 20 20 20 20 20 20 00 00 00 ff
00 53 65 72 69 61 6c 4e 75 6d 62 65 72 0a 00 15

----------------

Block 0, Base EDID:
  EDID Structure Version & Revision: 1.3
  Vendor & Product Identification:
    Manufacturer: GSM
    Model: 19492
    Serial Number: ...
    Made in: week 2 of 2016
  Basic Display Parameters & Features:
    Analog display
    Signal Level Standard: 0.700 : 0.000 : 0.700 V p-p
    Blank level equals black level
    Sync: Separate Composite
    Maximum image size: 41 cm x 23 cm
    Gamma: 2.20
    DPMS levels: Standby Suspend Off
    RGB color display
    First detailed timing is the preferred timing
  Color Characteristics:
    Red  : 0.6357, 0.3447
    Green: 0.3320, 0.6093
    Blue : 0.1562, 0.0605
    White: 0.3134, 0.3291
  Established Timings I & II:
    IBM     :   720x400    70.081663 Hz   9:5     31.467 kHz     28.320000 MHz
    DMT 0x04:   640x480    59.940476 Hz   4:3     31.469 kHz     25.175000 MHz
    DMT 0x06:   640x480    75.000000 Hz   4:3     37.500 kHz     31.500000 MHz
    DMT 0x08:   800x600    56.250000 Hz   4:3     35.156 kHz     36.000000 MHz
    DMT 0x09:   800x600    60.316541 Hz   4:3     37.879 kHz     40.000000 MHz
    DMT 0x0b:   800x600    75.000000 Hz   4:3     46.875 kHz     49.500000 MHz
    Apple   :   832x624    74.551266 Hz   4:3     49.726 kHz     57.284000 MHz
    DMT 0x10:  1024x768    60.003840 Hz   4:3     48.363 kHz     65.000000 MHz
    DMT 0x12:  1024x768    75.028582 Hz   4:3     60.023 kHz     78.750000 MHz
  Standard Timings:
    DMT 0x06:   640x480    75.000000 Hz   4:3     37.500 kHz     31.500000 MHz
    DMT 0x0b:   800x600    75.000000 Hz   4:3     46.875 kHz     49.500000 MHz
    DMT 0x12:  1024x768    75.028582 Hz   4:3     60.023 kHz     78.750000 MHz
    DMT 0x55:  1280x720    60.000000 Hz  16:9     45.000 kHz     74.250000 MHz
  Detailed Timing Descriptors:
    DTD 1:  1366x768    59.789541 Hz 683:384   47.712 kHz     85.500000 MHz (410 mm x 230 mm)
                 Hfront   70 Hsync 143 Hback  213 Hpol P
                 Vfront    3 Vsync   3 Vback   24 Vpol P
    Display Range Limits:
      Monitor ranges (GTF): 56-75 Hz V, 30-61 kHz H, max dotclock 90 MHz
    Display Product Name: '19M35'
    Display Product Serial Number: ...
Checksum: 0x15

----------------

Block 1, Unknown EDID Extension Block 0x00:
  00 ff ff ff ff ff ff 00 1e 6d 24 4c 79 15 00 00 '.........m$Ly...'
  02 1a 01 03 6c 29 17 78 ea d0 25 a2 58 55 9c 28 '....l).x..%.XU.('
  0f 50 54 a7 6a 00 31 4f 45 4f 61 4f 81 c0 01 01 '.PT.j.1OEOaO....'
  01 01 01 01 01 01 66 21 56 aa 51 00 1e 30 46 8f '......f!V.Q..0F.'
  33 00 9a e6 10 00 00 1e 00 00 00 fd 00 38 4b 1e '3............8K.'
  3d 09 00 0a 20 20 20 20 20 20 00 00 00 fc 00 31 '=...      .....1'
  39 4d 33 35 0a 20 20 20 20 20 20 20 00 00 00 ff '9M35.       ....'
  00 53 65 72 69 61 6c 4e 75 6d 62 65 72 0a 00 15 '.SerialNumber...'
Checksum: 0x15

----------------

Warnings:

Block 0, Base EDID:
  Display Product Serial Number: ...

Failures:

Block 1, Base EDID:
  Unknown Extension Block.
EDID:
  Base EDID: EDID specified 0 extension block(s), but found 1 extension block(s).

EDID conformity: FAIL
