edid-decode (hex):

00 ff ff ff ff ff ff 00 36 69 b1 50 00 00 00 00
0a 22 01 04 b5 3c 21 78 2b bb 05 ad 56 55 99 26
0d 50 54 bf cf 00 71 4f 81 c0 81 80 81 00 95 00
b3 00 d1 c0 01 01 02 3a 80 18 71 38 2d 40 58 2c
45 00 58 4a 21 00 00 1e 00 00 00 fc 00 4d 53 49
20 4d 44 32 37 32 58 50 0a 20 00 00 00 fd 00 30
64 5d 5d 21 01 0a 20 20 20 20 20 20 00 00 00 ff
00 50 42 31 48 37 31 34 33 30 30 30 36 32 01 6c

02 03 2c 74 48 90 01 02 03 04 12 13 1f 23 09 07
07 83 01 00 00 68 1a 00 00 01 01 30 64 00 e6 06
07 01 65 60 07 e2 00 7f e3 05 e3 01 48 4d 80 a0
70 38 27 40 30 20 35 00 58 4a 21 00 00 1a eb 5a
80 a0 70 38 27 40 30 20 35 00 58 4a 21 00 00 1e
00 00 00 00 00 00 00 00 00 00 00 00 00 00 00 00
00 00 00 00 00 00 00 00 00 00 00 00 00 00 00 00
00 00 00 00 00 00 00 00 00 00 00 00 00 00 00 72

00 ff ff ff ff ff ff 00 36 69 b1 50 00 00 00 00
0a 22 01 04 b5 3c 21 78 2b bb 05 ad 56 55 99 26
0d 50 54 bf cf 00 71 4f 81 c0 81 80 81 00 95 00
b3 00 d1 c0 01 01 02 3a 80 18 71 38 2d 40 58 2c
45 00 58 4a 21 00 00 1e 00 00 00 fc 00 4d 53 49
20 4d 44 32 37 32 58 50 0a 20 00 00 00 fd 00 30
64 5d 5d 21 01 0a 20 20 20 20 20 20 00 00 00 ff
00 50 42 31 48 37 31 34 33 30 30 30 36 32 01 6c

02 03 2c 74 48 90 01 02 03 04 12 13 1f 23 09 07
07 83 01 00 00 68 1a 00 00 01 01 30 64 00 e6 06
07 01 65 60 07 e2 00 7f e3 05 e3 01 48 4d 80 a0
70 38 27 40 30 20 35 00 58 4a 21 00 00 1a eb 5a
80 a0 70 38 27 40 30 20 35 00 58 4a 21 00 00 1e
00 00 00 00 00 00 00 00 00 00 00 00 00 00 00 00
00 00 00 00 00 00 00 00 00 00 00 00 00 00 00 00
00 00 00 00 00 00 00 00 00 00 00 00 00 00 00 72

----------------

Block 0, Base EDID:
  EDID Structure Version & Revision: 1.4
  Vendor & Product Identification:
    Manufacturer: MSI
    Model: 20657
    Made in: week 10 of 2024
  Basic Display Parameters & Features:
    Digital display
    Bits per primary color channel: 10
    DisplayPort interface
    Maximum image size: 60 cm x 33 cm
    Gamma: 2.20
    DPMS levels: Off
    Supported color formats: RGB 4:4:4, YCrCb 4:4:4
    First detailed timing includes the native pixel format and preferred refresh rate
    Display supports continuous frequencies
  Color Characteristics:
    Red  : 0.6777, 0.3388
    Green: 0.3339, 0.6005
    Blue : 0.1484, 0.0507
    White: 0.3134, 0.3291
  Established Timings I & II:
    IBM     :   720x400    70.081663 Hz   9:5     31.467 kHz     28.320000 MHz
    DMT 0x04:   640x480    59.940476 Hz   4:3     31.469 kHz     25.175000 MHz
    Apple   :   640x480    66.666667 Hz   4:3     35.000 kHz     30.240000 MHz
    DMT 0x05:   640x480    72.808802 Hz   4:3     37.861 kHz     31.500000 MHz
    DMT 0x06:   640x480    75.000000 Hz   4:3     37.500 kHz     31.500000 MHz
    DMT 0x08:   800x600    56.250000 Hz   4:3     35.156 kHz     36.000000 MHz
    DMT 0x09:   800x600    60.316541 Hz   4:3     37.879 kHz     40.000000 MHz
    DMT 0x0a:   800x600    72.187572 Hz   4:3     48.077 kHz     50.000000 MHz
    DMT 0x0b:   800x600    75.000000 Hz   4:3     46.875 kHz     49.500000 MHz
    DMT 0x10:  1024x768    60.003840 Hz   4:3     48.363 kHz     65.000000 MHz
    DMT 0x11:  1024x768    70.069359 Hz   4:3     56.476 kHz     75.000000 MHz
    DMT 0x12:  1024x768    75.028582 Hz   4:3     60.023 kHz     78.750000 MHz
    DMT 0x24:  1280x1024   75.024675 Hz   5:4     79.976 kHz    135.000000 MHz
  Standard Timings:
    DMT 0x15:  1152x864    75.000000 Hz   4:3     67.500 kHz    108.000000 MHz
    DMT 0x55:  1280x720    60.000000 Hz  16:9     45.000 kHz     74.250000 MHz
    DMT 0x23:  1280x1024   60.019740 Hz   5:4     63.981 kHz    108.000000 MHz
    DMT 0x1c:  1280x800    59.810326 Hz  16:10    49.702 kHz     83.500000 MHz
    DMT 0x2f:  1440x900    59.887445 Hz  16:10    55.935 kHz    106.500000 MHz
    DMT 0x3a:  1680x1050   59.954250 Hz  16:10    65.290 kHz    146.250000 MHz
    DMT 0x52:  1920x1080   60.000000 Hz  16:9     67.500 kHz    148.500000 MHz
  Detailed Timing Descriptors:
    DTD 1:  1920x1080   60.000000 Hz  16:9     67.500 kHz    148.500000 MHz (600 mm x 330 mm)
                 Hfront   88 Hsync  44 Hback  148 Hpol P
                 Vfront    4 Vsync   5 Vback   36 Vpol P
    Display Product Name: 'MSI MD272XP'
    Display Range Limits:
      Monitor ranges (Range Limits Only): 48-100 Hz V, 93-93 kHz H, max dotclock 330 MHz
    Display Product Serial Number: ...
  Extension blocks: 1
Checksum: 0x6c

----------------

Block 1, CTA-861 Extension Block:
  Revision: 3
  Basic audio support
  Supports YCbCr 4:4:4
  Supports YCbCr 4:2:2
  Native DTDs: 4
  Video Data Block:
    VIC  16:  1920x1080   60.000000 Hz  16:9     67.500 kHz    148.500000 MHz (native)
    VIC   1:   640x480    59.940476 Hz   4:3     31.469 kHz     25.175000 MHz
    VIC   2:   720x480    59.940060 Hz   4:3     31.469 kHz     27.000000 MHz
    VIC   3:   720x480    59.940060 Hz  16:9     31.469 kHz     27.000000 MHz
    VIC   4:  1280x720    60.000000 Hz  16:9     45.000 kHz     74.250000 MHz
    VIC  18:   720x576    50.000000 Hz  16:9     31.250 kHz     27.000000 MHz
    VIC  19:  1280x720    50.000000 Hz  16:9     37.500 kHz     74.250000 MHz
    VIC  31:  1920x1080   50.000000 Hz  16:9     56.250 kHz    148.500000 MHz
  Audio Data Block:
    Linear PCM:
      Max channels: 2
      Supported sample rates (kHz): 48 44.1 32
      Supported sample sizes (bits): 24 20 16
  Speaker Allocation Data Block:
    FL/FR - Front Left/Right
  Vendor-Specific Data Block (AMD), OUI 00-00-1A:
    Version: 1
    Feature Caps: 0x01
    Minimum Refresh Rate: 48 Hz
    Maximum Refresh Rate: 100 Hz
    Flags 1.x: 0x00
  HDR Static Metadata Data Block:
    Electro optical transfer functions:
      Traditional gamma - SDR luminance range
      Traditional gamma - HDR luminance range
      SMPTE ST2084
    Supported static metadata descriptors:
      Static metadata type 1
    Desired content max luminance: 101 (445.755 cd/m^2)
    Desired content max frame-average luminance: 96 (400.000 cd/m^2)
    Desired content min luminance: 7 (0.003 cd/m^2)
  Video Capability Data Block:
    YCbCr quantization: No Data
    RGB quantization: Selectable (via AVI Q)
    PT scan behavior: Supports both over- and underscan
    IT scan behavior: Supports both over- and underscan
    CE scan behavior: Supports both over- and underscan
  Colorimetry Data Block:
    xvYCC601
    xvYCC709
    BT2020cYCC
    BT2020YCC
    BT2020RGB
    Gamut Boundary Description Metadata Profile P0
  Detailed Timing Descriptors:
    DTD 2:  1920x1080   85.000344 Hz  16:9     95.115 kHz    197.840000 MHz (600 mm x 330 mm)
                 Hfront   48 Hsync  32 Hback   80 Hpol P
                 Vfront    3 Vsync   5 Vback   31 Vpol N
    DTD 3:  1920x1080   99.999141 Hz  16:9    111.899 kHz    232.750000 MHz (600 mm x 330 mm)
                 Hfront   48 Hsync  32 Hback   80 Hpol P
                 Vfront    3 Vsync   5 Vback   31 Vpol P
Checksum: 0x72  Unused space in Extension Block: 47 bytes

----------------

Warnings:

Block 1, CTA-861 Extension Block:
  IT Video Formats are overscanned by default, but normally this should be underscanned.
  Video Capability Data Block: Set Selectable YCbCr Quantization to avoid interop issues.
  Video Capability Data Block: S_PT is equal to S_IT and S_CE, so should be set to 0 instead.
  Colorimetry Data Block: Set the sRGB colorimetry bit to avoid interop issues.
EDID:
  Base EDID: Some timings are out of range of the Monitor Ranges:
    Horizontal Freq: 31.250 - 111.899 kHz (Monitor: 93.000 - 93.000 kHz)

Failures:

Block 1, CTA-861 Extension Block:
  There are more Native DTDs (4) than DTDs (3).
EDID:
  Extension Block 2 started with EDID header, ignoring Extension Blocks >= 2.

EDID conformity: FAIL
