edid-decode (hex):

00 ff ff ff ff ff ff 00 26 cf 3b 05 00 00 00 00
00 1c 01 04 95 1d 11 78 0a da 10 97 58 51 97 27
1e 50 54 00 00 00 01 01 01 01 01 01 01 01 01 01
01 01 01 01 01 01 d8 1d 56 84 50 00 52 30 28 20
3c 00 26 a5 10 00 00 19 66 17 56 c2 50 00 20 30
28 20 3c 00 26 a5 10 00 00 19 00 00 00 fe 00 43
50 57 31 38 80 31 33 33 4e 57 52 39 00 00 00 00
00 00 41 31 16 00 10 00 00 09 01 0a 20 20 00 67

00 ff ff ff ff ff ff 00 10 ac 48 41 57 35 34 39
0d 1e 01 04 a5 35 1e 78 3e ee 95 a3 54 4c 99 26
0f 50 54 a5 4b 00 71 4f 81 80 a9 c0 d1 c0 01 01
01 01 01 01 01 01 02 3a 80 18 71 38 2d 40 58 2c
45 00 0f 28 21 00 00 1e 00 00 00 ff 00 32 32 50
4e 54 31 33 0a 20 20 20 20 20 00 00 00 fc 00 44
45 4c 4c 20 55 32 34 31 39 48 0a 20 00 00 00 fd
00 38 4c 1e 53 11 01 0a 20 20 20 20 20 20 01 d0

02 03 1c f1 4f 90 05 04 03 02 07 16 01 06 11 12
15 13 14 1f 23 09 7f 07 83 01 00 00 02 3a 80 18
71 38 2d 40 58 2c 45 00 0f 28 21 00 00 1e 01 1d
80 18 71 1c 16 20 58 2c 25 00 0f 28 21 00 00 9e
01 1d 00 72 51 d0 1e 20 6e 28 55 00 0f 28 21 00
00 1e 8c 0a d0 8a 20 e0 2d 10 10 3e 96 00 0f 28
21 00 00 18 00 00 00 00 00 00 00 00 00 00 00 00
00 00 00 00 00 00 00 00 00 00 00 00 00 00 00 17

00 ff ff ff ff ff ff 00 10 ac 48 41 57 39 34 39
0d 1e 01 04 a5 35 1e 78 3e ee 95 a3 54 4c 99 26
0f 50 54 a5 4b 00 71 4f 81 80 a9 c0 d1 c0 01 01
01 01 01 01 01 01 02 3a 80 18 71 38 2d 40 58 2c
45 00 0f 28 21 00 00 1e 00 00 00 ff 00 36 32 50
4e 54 31 33 0a 20 20 20 20 20 00 00 00 fc 00 44
45 4c 4c 20 55 32 34 31 39 48 0a 20 00 00 00 fd
00 38 4c 1e 53 11 01 0a 20 20 20 20 20 20 01 c8

02 03 1c f1 4f 90 05 04 03 02 07 16 01 06 11 12
15 13 14 1f 23 09 7f 07 83 01 00 00 02 3a 80 18
71 38 2d 40 58 2c 45 00 0f 28 21 00 00 1e 01 1d
80 18 71 1c 16 20 58 2c 25 00 0f 28 21 00 00 9e
01 1d 00 72 51 d0 1e 20 6e 28 55 00 0f 28 21 00
00 1e 8c 0a d0 8a 20 e0 2d 10 10 3e 96 00 0f 28
21 00 00 18 00 00 00 00 00 00 00 00 00 00 00 00
00 00 00 00 00 00 00 00 00 00 00 00 00 00 00 17

00 ff ff ff ff ff ff 00 26 cf 3b 05 00 00 00 00
00 1c 01 04 95 1d 11 78 0a da 10 97 58 51 97 27
1e 50 54 00 00 00 01 01 01 01 01 01 01 01 01 01
01 01 01 01 01 01 d8 1d 56 84 50 00 52 30 28 20
3c 00 26 a5 10 00 00 19 66 17 56 c2 50 00 20 30
28 20 3c 00 26 a5 10 00 00 19 00 00 00 fe 00 43
50 57 31 38 80 31 33 33 4e 57 52 39 00 00 00 00
00 00 41 31 16 00 10 00 00 09 01 0a 20 20 00 67

00 ff ff ff ff ff ff 00 10 ac 48 41 57 35 34 39
0d 1e 01 04 a5 35 1e 78 3e ee 95 a3 54 4c 99 26
0f 50 54 a5 4b 00 71 4f 81 80 a9 c0 d1 c0 01 01
01 01 01 01 01 01 02 3a 80 18 71 38 2d 40 58 2c
45 00 0f 28 21 00 00 1e 00 00 00 ff 00 32 32 50
4e 54 31 33 0a 20 20 20 20 20 00 00 00 fc 00 44
45 4c 4c 20 55 32 34 31 39 48 0a 20 00 00 00 fd
00 38 4c 1e 53 11 01 0a 20 20 20 20 20 20 01 d0

02 03 1c f1 4f 90 05 04 03 02 07 16 01 06 11 12
15 13 14 1f 23 09 7f 07 83 01 00 00 02 3a 80 18
71 38 2d 40 58 2c 45 00 0f 28 21 00 00 1e 01 1d
80 18 71 1c 16 20 58 2c 25 00 0f 28 21 00 00 9e
01 1d 00 72 51 d0 1e 20 6e 28 55 00 0f 28 21 00
00 1e 8c 0a d0 8a 20 e0 2d 10 10 3e 96 00 0f 28
21 00 00 18 00 00 00 00 00 00 00 00 00 00 00 00
00 00 00 00 00 00 00 00 00 00 00 00 00 00 00 17

00 ff ff ff ff ff ff 00 10 ac 48 41 57 39 34 39
0d 1e 01 04 a5 35 1e 78 3e ee 95 a3 54 4c 99 26
0f 50 54 a5 4b 00 71 4f 81 80 a9 c0 d1 c0 01 01
01 01 01 01 01 01 02 3a 80 18 71 38 2d 40 58 2c
45 00 0f 28 21 00 00 1e 00 00 00 ff 00 36 32 50
4e 54 31 33 0a 20 20 20 20 20 00 00 00 fc 00 44
45 4c 4c 20 55 32 34 31 39 48 0a 20 00 00 00 fd
00 38 4c 1e 53 11 01 0a 20 20 20 20 20 20 01 c8

02 03 1c f1 4f 90 05 04 03 02 07 16 01 06 11 12
15 13 14 1f 23 09 7f 07 83 01 00 00 02 3a 80 18
71 38 2d 40 58 2c 45 00 0f 28 21 00 00 1e 01 1d
80 18 71 1c 16 20 58 2c 25 00 0f 28 21 00 00 9e
01 1d 00 72 51 d0 1e 20 6e 28 55 00 0f 28 21 00
00 1e 8c 0a d0 8a 20 e0 2d 10 10 3e 96 00 0f 28
21 00 00 18 00 00 00 00 00 00 00 00 00 00 00 00
00 00 00 00 00 00 00 00 00 00 00 00 00 00 00 17

----------------

Block 0, Base EDID:
  EDID Structure Version & Revision: 1.4
  Vendor & Product Identification:
    Manufacturer: IVO
    Model: 1339
    Made in: 2018
  Basic Display Parameters & Features:
    Digital display
    Bits per primary color channel: 6
    DisplayPort interface
    Maximum image size: 29 cm x 17 cm
    Gamma: 2.20
    Supported color formats: RGB 4:4:4, YCrCb 4:4:4
    First detailed timing includes the native pixel format and preferred refresh rate
  Color Characteristics:
    Red  : 0.5927, 0.3447
    Green: 0.3183, 0.5917
    Blue : 0.1523, 0.1181
    White: 0.3125, 0.3281
  Established Timings I & II: none
  Standard Timings: none
  Detailed Timing Descriptors:
    DTD 1:  1366x768    60.001571 Hz 683:384   51.001 kHz     76.400000 MHz (294 mm x 165 mm)
                 Hfront   40 Hsync  32 Hback   60 Hpol N
                 Vfront    3 Vsync  12 Vback   67 Vpol N
    DTD 2:  1366x768    47.996795 Hz 683:384   38.397 kHz     59.900000 MHz (294 mm x 165 mm)
                 Hfront   40 Hsync  32 Hback  122 Hpol N
                 Vfront    3 Vsync  12 Vback   17 Vpol N
    Alphanumeric Data String: 'CPW18.133NWR9'
    Manufacturer-Specified Display Descriptor (0x00): 00 00 00 00 41 31 16 00 10 00 00 09 01 0a 20 20 '....A1........  '
Checksum: 0x67

----------------

Warnings:

Block 0, Base EDID:
  Alphanumeric Data String: Non-ASCII character 0x80 at position 5, can cause problems.
  Missing Display Product Name.

Failures:

EDID:
  Extension Block 1 started with EDID header, ignoring Extension Blocks >= 1.

EDID conformity: FAIL
