edid-decode (hex):

00 ff ff ff ff ff ff 00 10 ac 9c a1 49 52 36 31
35 20 01 04 a5 3b 21 78 3b e4 a5 a6 54 4c 9e 26
0d 50 54 a5 4b 00 71 4f 81 80 a9 c0 d1 c0 01 01
01 01 01 01 01 01 56 5e 00 a0 a0 a0 29 50 30 20
35 00 55 50 21 00 00 1a 00 00 00 ff 00 47 59 4c
32 52 34 33 0a 20 20 20 20 20 00 00 00 fc 00 44
45 4c 4c 20 53 32 37 32 31 44 53 0a 00 00 00 fd
00 30 4b 73 73 3c 01 0a 20 20 20 20 20 20 01 b1

02 03 26 f1 50 10 1f 20 05 14 04 13 12 11 03 02
16 15 07 06 01 23 09 07 07 83 01 00 00 68 1a 00
00 01 01 30 4b 00 bf 16 00 a0 80 38 13 40 30 20
3a 00 55 50 21 00 00 1a 7e 39 00 a0 80 38 1f 40
30 20 3a 00 55 50 21 00 00 1a 02 3a 80 18 71 38
2d 40 58 2c 45 00 55 50 21 00 00 1e d9 76 00 a0
a0 a0 34 50 30 20 35 00 55 50 21 00 00 1a 00 00
00 00 00 00 00 00 00 00 00 00 00 00 00 00 00 86

00 ff ff ff ff ff ff 00 10 ac 9c a1 49 52 36 31
35 20 01 04 a5 3b 21 78 3b e4 a5 a6 54 4c 9e 26
0d 50 54 a5 4b 00 71 4f 81 80 a9 c0 d1 c0 01 01
01 01 01 01 01 01 56 5e 00 a0 a0 a0 29 50 30 20
35 00 55 50 21 00 00 1a 00 00 00 ff 00 47 59 4c
32 52 34 33 0a 20 20 20 20 20 00 00 00 fc 00 44
45 4c 4c 20 53 32 37 32 31 44 53 0a 00 00 00 fd
00 30 4b 73 73 3c 01 0a 20 20 20 20 20 20 01 b1

02 03 26 f1 50 10 1f 20 05 14 04 13 12 11 03 02
16 15 07 06 01 23 09 07 07 83 01 00 00 68 1a 00
00 01 01 30 4b 00 bf 16 00 a0 80 38 13 40 30 20
3a 00 55 50 21 00 00 1a 7e 39 00 a0 80 38 1f 40
30 20 3a 00 55 50 21 00 00 1a 02 3a 80 18 71 38
2d 40 58 2c 45 00 55 50 21 00 00 1e d9 76 00 a0
a0 a0 34 50 30 20 35 00 55 50 21 00 00 1a 00 00
00 00 00 00 00 00 00 00 00 00 00 00 00 00 00 86

----------------

Block 0, Base EDID:
  EDID Structure Version & Revision: 1.4
  Vendor & Product Identification:
    Manufacturer: DEL
    Model: 41372
    Serial Number: ...
    Made in: week 53 of 2022
  Basic Display Parameters & Features:
    Digital display
    Bits per primary color channel: 8
    DisplayPort interface
    Maximum image size: 59 cm x 33 cm
    Gamma: 2.20
    DPMS levels: Off
    Supported color formats: RGB 4:4:4, YCrCb 4:4:4, YCrCb 4:2:2
    First detailed timing includes the native pixel format and preferred refresh rate
    Display supports continuous frequencies
  Color Characteristics:
    Red  : 0.6513, 0.3300
    Green: 0.2978, 0.6171
    Blue : 0.1503, 0.0527
    White: 0.3134, 0.3291
  Established Timings I & II:
    IBM     :   720x400    70.081663 Hz   9:5     31.467 kHz     28.320000 MHz
    DMT 0x04:   640x480    59.940476 Hz   4:3     31.469 kHz     25.175000 MHz
    DMT 0x06:   640x480    75.000000 Hz   4:3     37.500 kHz     31.500000 MHz
    DMT 0x09:   800x600    60.316541 Hz   4:3     37.879 kHz     40.000000 MHz
    DMT 0x0b:   800x600    75.000000 Hz   4:3     46.875 kHz     49.500000 MHz
    DMT 0x10:  1024x768    60.003840 Hz   4:3     48.363 kHz     65.000000 MHz
    DMT 0x12:  1024x768    75.028582 Hz   4:3     60.023 kHz     78.750000 MHz
    DMT 0x24:  1280x1024   75.024675 Hz   5:4     79.976 kHz    135.000000 MHz
  Standard Timings:
    DMT 0x15:  1152x864    75.000000 Hz   4:3     67.500 kHz    108.000000 MHz
    DMT 0x23:  1280x1024   60.019740 Hz   5:4     63.981 kHz    108.000000 MHz
    DMT 0x53:  1600x900    60.000000 Hz  16:9     60.000 kHz    108.000000 MHz (RB)
    DMT 0x52:  1920x1080   60.000000 Hz  16:9     67.500 kHz    148.500000 MHz
  Detailed Timing Descriptors:
    DTD 1:  2560x1440   59.950550 Hz  16:9     88.787 kHz    241.500000 MHz (597 mm x 336 mm)
                 Hfront   48 Hsync  32 Hback   80 Hpol P
                 Vfront    3 Vsync   5 Vback   33 Vpol N
    Display Product Serial Number: ...
    Display Product Name: 'DELL S2721DS'
    Display Range Limits:
      Monitor ranges (Range Limits Only): 48-75 Hz V, 115-115 kHz H, max dotclock 600 MHz
  Extension blocks: 1
Checksum: 0xb1

----------------

Block 1, CTA-861 Extension Block:
  Revision: 3
  Underscans IT Video Formats by default
  Basic audio support
  Supports YCbCr 4:4:4
  Supports YCbCr 4:2:2
  Native detailed modes: 1
  Video Data Block:
    VIC  16:  1920x1080   60.000000 Hz  16:9     67.500 kHz    148.500000 MHz
    VIC  31:  1920x1080   50.000000 Hz  16:9     56.250 kHz    148.500000 MHz
    VIC  32:  1920x1080   24.000000 Hz  16:9     27.000 kHz     74.250000 MHz
    VIC   5:  1920x1080i  60.000000 Hz  16:9     33.750 kHz     74.250000 MHz
    VIC  20:  1920x1080i  50.000000 Hz  16:9     28.125 kHz     74.250000 MHz
    VIC   4:  1280x720    60.000000 Hz  16:9     45.000 kHz     74.250000 MHz
    VIC  19:  1280x720    50.000000 Hz  16:9     37.500 kHz     74.250000 MHz
    VIC  18:   720x576    50.000000 Hz  16:9     31.250 kHz     27.000000 MHz
    VIC  17:   720x576    50.000000 Hz   4:3     31.250 kHz     27.000000 MHz
    VIC   3:   720x480    59.940060 Hz  16:9     31.469 kHz     27.000000 MHz
    VIC   2:   720x480    59.940060 Hz   4:3     31.469 kHz     27.000000 MHz
    VIC  22:  1440x576i   50.000000 Hz  16:9     15.625 kHz     27.000000 MHz
    VIC  21:  1440x576i   50.000000 Hz   4:3     15.625 kHz     27.000000 MHz
    VIC   7:  1440x480i   59.940060 Hz  16:9     15.734 kHz     27.000000 MHz
    VIC   6:  1440x480i   59.940060 Hz   4:3     15.734 kHz     27.000000 MHz
    VIC   1:   640x480    59.940476 Hz   4:3     31.469 kHz     25.175000 MHz
  Audio Data Block:
    Linear PCM:
      Max channels: 2
      Supported sample rates (kHz): 48 44.1 32
      Supported sample sizes (bits): 24 20 16
  Speaker Allocation Data Block:
    FL/FR - Front Left/Right
  Vendor-Specific Data Block (AMD), OUI 00-00-1A:
    Version: 1
    Feature Caps: 0x01
    Minimum Refresh Rate: 48 Hz
    Maximum Refresh Rate: 75 Hz
    Flags 1.x: 0x00
  Detailed Timing Descriptors:
    DTD 2:  2048x1080   23.996617 Hz 256:135   26.372 kHz     58.230000 MHz (597 mm x 336 mm)
                 Hfront   48 Hsync  32 Hback   80 Hpol P
                 Vfront    3 Vsync  10 Vback    6 Vpol N
    DTD 3:  2048x1080   59.997848 Hz 256:135   66.658 kHz    147.180000 MHz (597 mm x 336 mm)
                 Hfront   48 Hsync  32 Hback   80 Hpol P
                 Vfront    3 Vsync  10 Vback   18 Vpol N
    DTD 4:  1920x1080   60.000000 Hz  16:9     67.500 kHz    148.500000 MHz (597 mm x 336 mm)
                 Hfront   88 Hsync  44 Hback  148 Hpol P
                 Vfront    4 Vsync   5 Vback   36 Vpol P
    DTD 5:  2560x1440   74.970923 Hz  16:9    111.857 kHz    304.250000 MHz (597 mm x 336 mm)
                 Hfront   48 Hsync  32 Hback   80 Hpol P
                 Vfront    3 Vsync   5 Vback   44 Vpol N
Checksum: 0x86  Unused space in Extension Block: 17 bytes

----------------

Block 2, Unknown EDID Extension Block 0x00:
  00 ff ff ff ff ff ff 00 10 ac 9c a1 49 52 36 31 '............IR61'
  35 20 01 04 a5 3b 21 78 3b e4 a5 a6 54 4c 9e 26 '5 ...;!x;...TL.&'
  0d 50 54 a5 4b 00 71 4f 81 80 a9 c0 d1 c0 01 01 '.PT.K.qO........'
  01 01 01 01 01 01 56 5e 00 a0 a0 a0 29 50 30 20 '......V^....)P0 '
  35 00 55 50 21 00 00 1a 00 00 00 ff 00 47 59 4c '5.UP!........GYL'
  32 52 34 33 0a 20 20 20 20 20 00 00 00 fc 00 44 '2R43.     .....D'
  45 4c 4c 20 53 32 37 32 31 44 53 0a 00 00 00 fd 'ELL S2721DS.....'
  00 30 4b 73 73 3c 01 0a 20 20 20 20 20 20 01 b1 '.0Kss<..      ..'
Checksum: 0xb1

----------------

Block 3, CTA-861 Extension Block:
  Revision: 3
  Underscans IT Video Formats by default
  Basic audio support
  Supports YCbCr 4:4:4
  Supports YCbCr 4:2:2
  Native detailed modes: 1
  Video Data Block:
    VIC  16:  1920x1080   60.000000 Hz  16:9     67.500 kHz    148.500000 MHz
    VIC  31:  1920x1080   50.000000 Hz  16:9     56.250 kHz    148.500000 MHz
    VIC  32:  1920x1080   24.000000 Hz  16:9     27.000 kHz     74.250000 MHz
    VIC   5:  1920x1080i  60.000000 Hz  16:9     33.750 kHz     74.250000 MHz
    VIC  20:  1920x1080i  50.000000 Hz  16:9     28.125 kHz     74.250000 MHz
    VIC   4:  1280x720    60.000000 Hz  16:9     45.000 kHz     74.250000 MHz
    VIC  19:  1280x720    50.000000 Hz  16:9     37.500 kHz     74.250000 MHz
    VIC  18:   720x576    50.000000 Hz  16:9     31.250 kHz     27.000000 MHz
    VIC  17:   720x576    50.000000 Hz   4:3     31.250 kHz     27.000000 MHz
    VIC   3:   720x480    59.940060 Hz  16:9     31.469 kHz     27.000000 MHz
    VIC   2:   720x480    59.940060 Hz   4:3     31.469 kHz     27.000000 MHz
    VIC  22:  1440x576i   50.000000 Hz  16:9     15.625 kHz     27.000000 MHz
    VIC  21:  1440x576i   50.000000 Hz   4:3     15.625 kHz     27.000000 MHz
    VIC   7:  1440x480i   59.940060 Hz  16:9     15.734 kHz     27.000000 MHz
    VIC   6:  1440x480i   59.940060 Hz   4:3     15.734 kHz     27.000000 MHz
    VIC   1:   640x480    59.940476 Hz   4:3     31.469 kHz     25.175000 MHz
  Audio Data Block:
    Linear PCM:
      Max channels: 2
      Supported sample rates (kHz): 48 44.1 32
      Supported sample sizes (bits): 24 20 16
  Speaker Allocation Data Block:
    FL/FR - Front Left/Right
  Vendor-Specific Data Block (AMD), OUI 00-00-1A:
    Version: 1
    Feature Caps: 0x01
    Minimum Refresh Rate: 48 Hz
    Maximum Refresh Rate: 75 Hz
    Flags 1.x: 0x00
  Detailed Timing Descriptors:
    DTD 6:  2048x1080   23.996617 Hz 256:135   26.372 kHz     58.230000 MHz (597 mm x 336 mm)
                 Hfront   48 Hsync  32 Hback   80 Hpol P
                 Vfront    3 Vsync  10 Vback    6 Vpol N
    DTD 7:  2048x1080   59.997848 Hz 256:135   66.658 kHz    147.180000 MHz (597 mm x 336 mm)
                 Hfront   48 Hsync  32 Hback   80 Hpol P
                 Vfront    3 Vsync  10 Vback   18 Vpol N
    DTD 8:  1920x1080   60.000000 Hz  16:9     67.500 kHz    148.500000 MHz (597 mm x 336 mm)
                 Hfront   88 Hsync  44 Hback  148 Hpol P
                 Vfront    4 Vsync   5 Vback   36 Vpol P
    DTD 9:  2560x1440   74.970923 Hz  16:9    111.857 kHz    304.250000 MHz (597 mm x 336 mm)
                 Hfront   48 Hsync  32 Hback   80 Hpol P
                 Vfront    3 Vsync   5 Vback   44 Vpol N
Checksum: 0x86  Unused space in Extension Block: 17 bytes

----------------

Warnings:

Block 1, CTA-861 Extension Block:
  Video Data Block: VIC 16 and the first DTD are not identical. Is this intended?
  Detailed Timing Descriptor #2: Image size is 597x336 mm, but based on the picture AR it should be 597x314 mm.
  Detailed Timing Descriptor #3: Image size is 597x336 mm, but based on the picture AR it should be 597x314 mm.
  Display Product Serial Number is set, so the Serial Number in the Base EDID should be 0.
  Add a Colorimetry Data Block with the sRGB colorimetry bit set to avoid interop issues.
Block 3, CTA-861 Extension Block:
  Detailed Timing Descriptor #6: Image size is 597x336 mm, but based on the picture AR it should be 597x314 mm.
  Detailed Timing Descriptor #7: Image size is 597x336 mm, but based on the picture AR it should be 597x314 mm.
EDID:
  Base EDID: Some timings are out of range of the Monitor Ranges:
    Vertical Freq: 23.997 - 75.029 Hz (Monitor: 48.000 - 75.000 Hz)
    Horizontal Freq: 15.625 - 111.856 kHz (Monitor: 115.000 - 115.000 kHz)

Failures:

Block 1, CTA-861 Extension Block:
  Missing VCDB, needed for Set Selectable RGB Quantization to avoid interop issues.
Block 2, Base EDID:
  Unknown Extension Block.
Block 3, CTA-861 Extension Block:
  Video Data Block: Duplicate VIC 16.
  Video Data Block: Duplicate VIC 31.
  Video Data Block: Duplicate VIC 32.
  Video Data Block: Duplicate VIC 5.
  Video Data Block: Duplicate VIC 20.
  Video Data Block: Duplicate VIC 4.
  Video Data Block: Duplicate VIC 19.
  Video Data Block: Duplicate VIC 18.
  Video Data Block: Duplicate VIC 17.
  Video Data Block: Duplicate VIC 3.
  Video Data Block: Duplicate VIC 2.
  Video Data Block: Duplicate VIC 22.
  Video Data Block: Duplicate VIC 21.
  Video Data Block: Duplicate VIC 7.
  Video Data Block: Duplicate VIC 6.
  Video Data Block: Duplicate VIC 1.
  Speaker Allocation Data Block: Only one instance of this Data Block is allowed.
EDID:
  Base EDID: EDID specified 1 extension block(s), but found 3 extension block(s).

EDID conformity: FAIL
