edid-decode (hex):

00 ff ff ff ff ff ff 00 32 0c a8 0a 00 00 00 00
00 12 01 03 90 21 15 78 0a 46 55 96 58 56 8f 27
1f 50 54 00 00 00 01 01 01 01 01 01 01 01 01 01
01 01 01 01 01 01 94 25 a0 24 51 84 1a 30 30 20
36 00 4b cf 10 00 00 1b 19 19 a0 26 51 84 1a 30
30 20 36 00 4b cf 10 00 00 1b 00 00 00 fe 00 54
4e 31 36 32 80 31 35 34 57 50 32 0a 00 00 00 00
00 3c 58 74 90 ac c8 e4 ff 02 01 0a 20 20 00 95

----------------

Block 0, Base EDID:
  EDID Structure Version & Revision: 1.3
  Vendor & Product Identification:
    Manufacturer: LPL
    Model: 2728
    Made in: 2008
  Basic Display Parameters & Features:
    Digital display
    Maximum image size: 33 cm x 21 cm
    Gamma: 2.20
    RGB color display
    First detailed timing is the preferred timing
  Color Characteristics:
    Red  : 0.5869, 0.3437
    Green: 0.3369, 0.5605
    Blue : 0.1533, 0.1220
    White: 0.3134, 0.3291
  Established Timings I & II: none
  Standard Timings: none
  Detailed Timing Descriptors:
    DTD 1:  1440x900    59.981345 Hz  16:10    55.543 kHz     96.200000 MHz (331 mm x 207 mm)
                 Hfront   48 Hsync  32 Hback  212 Hpol P
                 Vfront    3 Vsync   6 Vback   17 Vpol N
    DTD 2:  1440x900    40.014100 Hz  16:10    37.053 kHz     64.250000 MHz (331 mm x 207 mm)
                 Hfront   48 Hsync  32 Hback  214 Hpol P
                 Vfront    3 Vsync   6 Vback   17 Vpol N
    Alphanumeric Data String: 'TN162.154WP2'
    Manufacturer-Specified Display Descriptor (0x00): 00 00 00 3c 58 74 90 ac c8 e4 ff 02 01 0a 20 20 '...<Xt........  '
Checksum: 0x95

----------------

Warnings:

Block 0, Base EDID:
  Alphanumeric Data String: Non-ASCII character 0x80 at position 5, can cause problems.

Failures:

Block 0, Base EDID:
  Basic Display Parameters & Features: Digital Video Interface Standard set to reserved value 0x10.
  Missing Display Product Name.
  Missing Display Range Limits Descriptor.

EDID conformity: FAIL
