edid-decode (hex):

00 ff ff ff ff ff ff 00 1e 6d 00 26 01 01 01 01
01 13 01 03 80 3a 21 78 2a 1f 9c a3 54 42 97 26
0f 47 49 a5 6e 00 81 c0 01 01 01 01 01 01 01 01
01 01 01 01 01 01 66 21 50 b0 51 00 1b 30 40 70
36 00 b8 88 21 00 00 1e 40 1f 56 1a 51 00 2a 30
2c 40 13 04 58 c2 10 00 00 1e 00 00 00 fd 00 38
4e 1e 50 11 00 0a 20 20 20 20 20 20 00 00 00 fc
00 32 36 4c 47 33 30 30 30 0a 20 20 20 20 01 2c

02 03 21 f1 4e 81 02 03 15 12 13 04 14 05 20 21
22 1f 10 23 15 07 50 83 01 00 00 65 03 0c 00 20
00 01 1d 00 bc 52 d0 1e 20 b8 28 55 40 34 cd 31
00 00 1e 01 1d 80 18 71 1c 16 20 58 2c 25 00 34
cd 31 00 00 9e 01 1d 00 72 51 d0 1e 20 6e 28 55
00 34 cd 31 00 00 1e 01 1d 80 d0 72 1c 16 20 10
2c 25 80 34 cd 31 00 00 9e 8c 0a d0 90 20 40 31
20 0c 40 55 00 34 cd 31 00 00 18 00 00 00 00 f5

00 ff ff ff ff ff ff 00 1e 6d 00 26 01 01 01 01
01 13 01 03 80 3a 21 78 2a 1f 9c a3 54 42 97 26
0f 47 49 a5 6e 00 81 c0 01 01 01 01 01 01 01 01
01 01 01 01 01 01 66 21 50 b0 51 00 1b 30 40 70
36 00 b8 88 21 00 00 1e 40 1f 56 1a 51 00 2a 30
2c 40 13 04 58 c2 10 00 00 1e 00 00 00 fd 00 38
4e 1e 50 11 00 0a 20 20 20 20 20 20 00 00 00 fc
00 32 36 4c 47 33 30 30 30 0a 20 20 20 20 01 2c

02 03 21 f1 4e 81 02 03 15 12 13 04 14 05 20 21
22 1f 10 23 15 07 50 83 01 00 00 65 03 0c 00 20
00 01 1d 00 bc 52 d0 1e 20 b8 28 55 40 34 cd 31
00 00 1e 01 1d 80 18 71 1c 16 20 58 2c 25 00 34
cd 31 00 00 9e 01 1d 00 72 51 d0 1e 20 6e 28 55
00 34 cd 31 00 00 1e 01 1d 80 d0 72 1c 16 20 10
2c 25 80 34 cd 31 00 00 9e 8c 0a d0 90 20 40 31
20 0c 40 55 00 34 cd 31 00 00 18 00 00 00 00 f5

----------------

Block 0, Base EDID:
  EDID Structure Version & Revision: 1.3
  Vendor & Product Identification:
    Manufacturer: GSM
    Model: 9728
    Serial Number: ...
    Made in: week 1 of 2009
  Basic Display Parameters & Features:
    Digital display
    Maximum image size: 58 cm x 33 cm
    Gamma: 2.20
    DPMS levels: Off
    RGB color display
    First detailed timing is the preferred timing
  Color Characteristics:
    Red  : 0.6367, 0.3291
    Green: 0.2607, 0.5927
    Blue : 0.1503, 0.0595
    White: 0.2802, 0.2851
  Established Timings I & II:
    IBM     :   720x400    70.081663 Hz   9:5     31.467 kHz     28.320000 MHz
    DMT 0x04:   640x480    59.940476 Hz   4:3     31.469 kHz     25.175000 MHz
    DMT 0x06:   640x480    75.000000 Hz   4:3     37.500 kHz     31.500000 MHz
    DMT 0x09:   800x600    60.316541 Hz   4:3     37.879 kHz     40.000000 MHz
    DMT 0x0b:   800x600    75.000000 Hz   4:3     46.875 kHz     49.500000 MHz
    Apple   :   832x624    74.551266 Hz   4:3     49.726 kHz     57.284000 MHz
    DMT 0x10:  1024x768    60.003840 Hz   4:3     48.363 kHz     65.000000 MHz
    DMT 0x11:  1024x768    70.069359 Hz   4:3     56.476 kHz     75.000000 MHz
    DMT 0x12:  1024x768    75.028582 Hz   4:3     60.023 kHz     78.750000 MHz
  Standard Timings:
    DMT 0x55:  1280x720    60.000000 Hz  16:9     45.000 kHz     74.250000 MHz
  Detailed Timing Descriptors:
    DTD  1:  1360x768    60.015162 Hz  85:48    47.712 kHz     85.500000 MHz (696 mm x 392 mm)
                  Hfront   64 Hsync 112 Hback  256 Hpol P
                  Vfront    3 Vsync   6 Vback   18 Vpol P
    DTD  2:  1366x768    59.930481 Hz 683:384   48.544 kHz     80.000000 MHz (344 mm x 194 mm)
                  Hfront   44 Hsync  64 Hback  174 Hpol P
                  Vfront   17 Vsync   3 Vback   22 Vpol P
    Display Range Limits:
      Monitor ranges (GTF): 56-78 Hz V, 30-80 kHz H, max dotclock 170 MHz
    Display Product Name: '26LG3000'
  Extension blocks: 1
Checksum: 0x2c

----------------

Block 1, CTA-861 Extension Block:
  Revision: 3
  Underscans IT Video Formats by default
  Basic audio support
  Supports YCbCr 4:4:4
  Supports YCbCr 4:2:2
  Native detailed modes: 1
  Video Data Block:
    VIC   1:   640x480    59.940476 Hz   4:3     31.469 kHz     25.175000 MHz (native)
    VIC   2:   720x480    59.940060 Hz   4:3     31.469 kHz     27.000000 MHz
    VIC   3:   720x480    59.940060 Hz  16:9     31.469 kHz     27.000000 MHz
    VIC  21:  1440x576i   50.000000 Hz   4:3     15.625 kHz     27.000000 MHz
    VIC  18:   720x576    50.000000 Hz  16:9     31.250 kHz     27.000000 MHz
    VIC  19:  1280x720    50.000000 Hz  16:9     37.500 kHz     74.250000 MHz
    VIC   4:  1280x720    60.000000 Hz  16:9     45.000 kHz     74.250000 MHz
    VIC  20:  1920x1080i  50.000000 Hz  16:9     28.125 kHz     74.250000 MHz
    VIC   5:  1920x1080i  60.000000 Hz  16:9     33.750 kHz     74.250000 MHz
    VIC  32:  1920x1080   24.000000 Hz  16:9     27.000 kHz     74.250000 MHz
    VIC  33:  1920x1080   25.000000 Hz  16:9     28.125 kHz     74.250000 MHz
    VIC  34:  1920x1080   30.000000 Hz  16:9     33.750 kHz     74.250000 MHz
    VIC  31:  1920x1080   50.000000 Hz  16:9     56.250 kHz    148.500000 MHz
    VIC  16:  1920x1080   60.000000 Hz  16:9     67.500 kHz    148.500000 MHz
  Audio Data Block:
    AC-3:
      Max channels: 6
      Supported sample rates (kHz): 48 44.1 32
      Maximum bit rate: 640 kb/s
  Speaker Allocation Data Block:
    FL/FR - Front Left/Right
  Vendor-Specific Data Block (HDMI), OUI 00-0C-03:
    Source physical address: 2.0.0.0
  Detailed Timing Descriptors:
    DTD  3:  1280x720    50.000000 Hz  16:9     37.500 kHz     74.250000 MHz (820 mm x 461 mm)
                  Hfront  440 Hsync  40 Hback  220 Hpol P
                  Vfront    5 Vsync   5 Vback   20 Vpol P
    DTD  4:  1920x1080i  60.000000 Hz  16:9     33.750 kHz     74.250000 MHz (820 mm x 461 mm)
                  Hfront   88 Hsync  44 Hback  148 Hpol P
                  Vfront    2 Vsync   5 Vback   15 Vpol P Vfront +0.5 Odd Field
                  Vfront    2 Vsync   5 Vback   15 Vpol P Vback  +0.5 Even Field
    DTD  5:  1280x720    60.000000 Hz  16:9     45.000 kHz     74.250000 MHz (820 mm x 461 mm)
                  Hfront  110 Hsync  40 Hback  220 Hpol P
                  Vfront    5 Vsync   5 Vback   20 Vpol P
    DTD  6:  1920x1080i  50.000000 Hz  16:9     28.125 kHz     74.250000 MHz (820 mm x 461 mm)
                  Hfront  528 Hsync  44 Hback  148 Hpol P
                  Vfront    2 Vsync   5 Vback   15 Vpol P Vfront +0.5 Odd Field
                  Vfront    2 Vsync   5 Vback   15 Vpol P Vback  +0.5 Even Field
    DTD  7:   720x576    50.000000 Hz   5:4     31.250 kHz     27.000000 MHz (820 mm x 461 mm)
                  Hfront   12 Hsync  64 Hback   68 Hpol N
                  Vfront    5 Vsync   5 Vback   39 Vpol N
Checksum: 0xf5  Unused space in Extension Block: 4 bytes

----------------

Block 2, Unknown EDID Extension Block 0x00:
  00 ff ff ff ff ff ff 00 1e 6d 00 26 01 01 01 01 '.........m.&....'
  01 13 01 03 80 3a 21 78 2a 1f 9c a3 54 42 97 26 '.....:!x*...TB.&'
  0f 47 49 a5 6e 00 81 c0 01 01 01 01 01 01 01 01 '.GI.n...........'
  01 01 01 01 01 01 66 21 50 b0 51 00 1b 30 40 70 '......f!P.Q..0@p'
  36 00 b8 88 21 00 00 1e 40 1f 56 1a 51 00 2a 30 '6...!...@.V.Q.*0'
  2c 40 13 04 58 c2 10 00 00 1e 00 00 00 fd 00 38 ',@..X..........8'
  4e 1e 50 11 00 0a 20 20 20 20 20 20 00 00 00 fc 'N.P...      ....'
  00 32 36 4c 47 33 30 30 30 0a 20 20 20 20 01 2c '.26LG3000.    .,'
Checksum: 0x2c

----------------

Block 3, CTA-861 Extension Block:
  Revision: 3
  Underscans IT Video Formats by default
  Basic audio support
  Supports YCbCr 4:4:4
  Supports YCbCr 4:2:2
  Native detailed modes: 1
  Video Data Block:
    VIC   1:   640x480    59.940476 Hz   4:3     31.469 kHz     25.175000 MHz (native)
    VIC   2:   720x480    59.940060 Hz   4:3     31.469 kHz     27.000000 MHz
    VIC   3:   720x480    59.940060 Hz  16:9     31.469 kHz     27.000000 MHz
    VIC  21:  1440x576i   50.000000 Hz   4:3     15.625 kHz     27.000000 MHz
    VIC  18:   720x576    50.000000 Hz  16:9     31.250 kHz     27.000000 MHz
    VIC  19:  1280x720    50.000000 Hz  16:9     37.500 kHz     74.250000 MHz
    VIC   4:  1280x720    60.000000 Hz  16:9     45.000 kHz     74.250000 MHz
    VIC  20:  1920x1080i  50.000000 Hz  16:9     28.125 kHz     74.250000 MHz
    VIC   5:  1920x1080i  60.000000 Hz  16:9     33.750 kHz     74.250000 MHz
    VIC  32:  1920x1080   24.000000 Hz  16:9     27.000 kHz     74.250000 MHz
    VIC  33:  1920x1080   25.000000 Hz  16:9     28.125 kHz     74.250000 MHz
    VIC  34:  1920x1080   30.000000 Hz  16:9     33.750 kHz     74.250000 MHz
    VIC  31:  1920x1080   50.000000 Hz  16:9     56.250 kHz    148.500000 MHz
    VIC  16:  1920x1080   60.000000 Hz  16:9     67.500 kHz    148.500000 MHz
  Audio Data Block:
    AC-3:
      Max channels: 6
      Supported sample rates (kHz): 48 44.1 32
      Maximum bit rate: 640 kb/s
  Speaker Allocation Data Block:
    FL/FR - Front Left/Right
  Vendor-Specific Data Block (HDMI), OUI 00-0C-03:
    Source physical address: 2.0.0.0
  Detailed Timing Descriptors:
    DTD  8:  1280x720    50.000000 Hz  16:9     37.500 kHz     74.250000 MHz (820 mm x 461 mm)
                  Hfront  440 Hsync  40 Hback  220 Hpol P
                  Vfront    5 Vsync   5 Vback   20 Vpol P
    DTD  9:  1920x1080i  60.000000 Hz  16:9     33.750 kHz     74.250000 MHz (820 mm x 461 mm)
                  Hfront   88 Hsync  44 Hback  148 Hpol P
                  Vfront    2 Vsync   5 Vback   15 Vpol P Vfront +0.5 Odd Field
                  Vfront    2 Vsync   5 Vback   15 Vpol P Vback  +0.5 Even Field
    DTD 10:  1280x720    60.000000 Hz  16:9     45.000 kHz     74.250000 MHz (820 mm x 461 mm)
                  Hfront  110 Hsync  40 Hback  220 Hpol P
                  Vfront    5 Vsync   5 Vback   20 Vpol P
    DTD 11:  1920x1080i  50.000000 Hz  16:9     28.125 kHz     74.250000 MHz (820 mm x 461 mm)
                  Hfront  528 Hsync  44 Hback  148 Hpol P
                  Vfront    2 Vsync   5 Vback   15 Vpol P Vfront +0.5 Odd Field
                  Vfront    2 Vsync   5 Vback   15 Vpol P Vback  +0.5 Even Field
    DTD 12:   720x576    50.000000 Hz   5:4     31.250 kHz     27.000000 MHz (820 mm x 461 mm)
                  Hfront   12 Hsync  64 Hback   68 Hpol N
                  Vfront    5 Vsync   5 Vback   39 Vpol N
Checksum: 0xf5  Unused space in Extension Block: 4 bytes

----------------

Warnings:

Block 0, Base EDID:
  Vendor & Product Identification: The serial number is one of the known dummy values, it should probably be set to 0.
Block 1, CTA-861 Extension Block:
  Video Data Block: VIC 1 and the first DTD are not identical. Is this intended?
  Detailed Timing Descriptor #7: Image size is 820x461 mm, but based on the picture AR it should be 820x656 mm.
  Add a Colorimetry Data Block with the sRGB colorimetry bit set to avoid interop issues.
Block 3, CTA-861 Extension Block:
  Detailed Timing Descriptor #12: Image size is 820x461 mm, but based on the picture AR it should be 820x656 mm.
EDID:
  Base EDID: Some timings are out of range of the Monitor Ranges:
    Vertical Freq: 24.000 - 75.029 Hz (Monitor: 56.000 - 78.000 Hz)
    Horizontal Freq: 15.625 - 67.500 kHz (Monitor: 30.000 - 80.000 kHz)

Failures:

Block 0, Base EDID:
  Detailed Timing Descriptor #1: Mismatch of image size 696x392 mm vs display size 580x330 mm.
  Detailed Timing Descriptor #2: Mismatch of image size 344x194 mm vs display size 580x330 mm.
Block 1, CTA-861 Extension Block:
  Detailed Timing Descriptor #3: Mismatch of image size 820x461 mm vs display size 580x330 mm.
  Detailed Timing Descriptor #4: Mismatch of image size 820x461 mm vs display size 580x330 mm.
  Detailed Timing Descriptor #5: Mismatch of image size 820x461 mm vs display size 580x330 mm.
  Detailed Timing Descriptor #6: Mismatch of image size 820x461 mm vs display size 580x330 mm.
  Detailed Timing Descriptor #7: Mismatch of image size 820x461 mm vs display size 580x330 mm.
  Missing VCDB, needed for Set Selectable RGB Quantization to avoid interop issues.
Block 2, Base EDID:
  Unknown Extension Block.
Block 3, CTA-861 Extension Block:
  Video Data Block: Duplicate VIC 1.
  Video Data Block: Duplicate VIC 2.
  Video Data Block: Duplicate VIC 3.
  Video Data Block: Duplicate VIC 21.
  Video Data Block: Duplicate VIC 18.
  Video Data Block: Duplicate VIC 19.
  Video Data Block: Duplicate VIC 4.
  Video Data Block: Duplicate VIC 20.
  Video Data Block: Duplicate VIC 5.
  Video Data Block: Duplicate VIC 32.
  Video Data Block: Duplicate VIC 33.
  Video Data Block: Duplicate VIC 34.
  Video Data Block: Duplicate VIC 31.
  Video Data Block: Duplicate VIC 16.
  Speaker Allocation Data Block: Only one instance of this Data Block is allowed.
  Detailed Timing Descriptor #8: Mismatch of image size 820x461 mm vs display size 580x330 mm.
  Detailed Timing Descriptor #9: Mismatch of image size 820x461 mm vs display size 580x330 mm.
  Detailed Timing Descriptor #10: Mismatch of image size 820x461 mm vs display size 580x330 mm.
  Detailed Timing Descriptor #11: Mismatch of image size 820x461 mm vs display size 580x330 mm.
  Detailed Timing Descriptor #12: Mismatch of image size 820x461 mm vs display size 580x330 mm.
EDID:
  Base EDID: The DTD max image size is 820x461mm, which is larger than the display size 580.0x330.0mm.
  Base EDID: EDID specified 1 extension block(s), but found 3 extension block(s).
  Base EDID: EDID 1.3 requires a Block Map Extension in Block 1 if there are more than 2 blocks in the EDID.
  CTA-861: Native progressive timings are a mix of several resolutions.

EDID conformity: FAIL
