edid-decode (hex):

00 ff ff ff ff ff ff 00 30 e4 2c 03 00 00 00 00
00 16 01 04 90 22 13 78 0a af 55 9c 5b 52 96 26
0e 50 54 00 00 00 01 01 01 01 01 01 01 01 01 01
01 01 01 01 01 01 4c 36 80 a0 70 38 1f 40 20 40
36 00 58 c2 10 00 00 18 32 32 80 b0 72 38 96 40
a0 f0 e8 00 58 c2 10 00 00 18 00 00 00 fe 00 4e
46 47 38 44 80 31 35 36 57 46 43 0a 00 00 00 00
00 00 41 31 9e 00 00 00 00 02 01 0a 20 20 00 8f

00 ff ff ff ff ff ff 00 30 e4 2c 03 00 00 00 00
00 16 01 04 90 22 13 78 0a af 55 9c 5b 52 96 26
0e 50 54 00 00 00 01 01 01 01 01 01 01 01 01 01
01 01 01 01 01 01 4c 36 80 a0 70 38 1f 40 20 40
36 00 58 c2 10 00 00 18 32 32 80 b0 72 38 96 40
a0 f0 e8 00 58 c2 10 00 00 18 00 00 00 fe 00 4e
46 47 38 44 80 31 35 36 57 46 43 0a 00 00 00 00
00 00 41 31 9e 00 00 00 00 02 01 0a 20 20 00 8f

----------------

Block 0, Base EDID:
  EDID Structure Version & Revision: 1.4
  Vendor & Product Identification:
    Manufacturer: LGD
    Model: 812
    Made in: 2012
  Basic Display Parameters & Features:
    Digital display
    Bits per primary color channel: 6
    Digital interface is not defined
    Maximum image size: 34 cm x 19 cm
    Gamma: 2.20
    Supported color formats: RGB 4:4:4, YCrCb 4:4:4
    First detailed timing includes the native pixel format and preferred refresh rate
  Color Characteristics:
    Red  : 0.6113, 0.3574
    Green: 0.3232, 0.5888
    Blue : 0.1494, 0.0556
    White: 0.3134, 0.3291
  Established Timings I & II: none
  Standard Timings: none
  Detailed Timing Descriptors:
    DTD 1:  1920x1080   60.150246 Hz  16:9     66.827 kHz    139.000000 MHz (344 mm x 194 mm)
                 Hfront   32 Hsync  64 Hback   64 Hpol N
                 Vfront    3 Vsync   6 Vback   22 Vpol N
    DTD 2:  1920x1080   40.058108 Hz  16:9     49.271 kHz    128.500000 MHz (344 mm x 194 mm)
                 Hfront  160 Hsync 240 Hback  288 Hpol N
                 Vfront   14 Vsync   8 Vback  128 Vpol N
    Alphanumeric Data String: 'NFG8D.156WFC'
    Manufacturer-Specified Display Descriptor (0x00): 00 00 00 00 41 31 9e 00 00 00 00 02 01 0a 20 20 '....A1........  '
Checksum: 0x8f

----------------

Warnings:

Block 0, Base EDID:
  Alphanumeric Data String: Non-ASCII character 0x80 at position 5, can cause problems.
  Missing Display Product Name.

Failures:

EDID:
  Extension Block 1 started with EDID header, ignoring Extension Blocks >= 1.

EDID conformity: FAIL
