edid-decode (hex):

00 ff ff ff ff ff ff 00 4c 83 4f 89 00 00 00 00
00 19 01 04 95 22 13 78 0a b9 95 a2 55 4b 9c 26
0f 50 54 00 00 00 01 01 01 01 01 01 01 01 01 01
01 01 01 01 01 01 29 36 80 a0 70 38 1f 40 30 20
25 00 58 c2 10 00 00 1a 54 2b 80 a0 70 38 1f 40
30 20 25 00 58 c2 10 00 00 1a 00 00 00 fe 00 43
31 4a 37 4d 80 31 35 36 48 4c 0a 20 00 00 00 00
00 00 41 21 9e 00 10 00 00 0a 01 0a 20 20 00 c3

----------------

Block 0, Base EDID:
  EDID Structure Version & Revision: 1.4
  Vendor & Product Identification:
    Manufacturer: SDC
    Model: 35151
    Made in: 2015
  Basic Display Parameters & Features:
    Digital display
    Bits per primary color channel: 6
    DisplayPort interface
    Maximum image size: 34 cm x 19 cm
    Gamma: 2.20
    Supported color formats: RGB 4:4:4, YCrCb 4:4:4
    First detailed timing includes the native pixel format and preferred refresh rate
  Color Characteristics:
    Red  : 0.6347, 0.3349
    Green: 0.2949, 0.6103
    Blue : 0.1503, 0.0595
    White: 0.3134, 0.3291
  Established Timings I & II: none
  Standard Timings: none
  Detailed Timing Descriptors:
    DTD 1:  1920x1080   59.998788 Hz  16:9     66.659 kHz    138.650000 MHz (344 mm x 194 mm)
                 Hfront   48 Hsync  32 Hback   80 Hpol P
                 Vfront    2 Vsync   5 Vback   24 Vpol N
    DTD 2:  1920x1080   47.999031 Hz  16:9     53.327 kHz    110.920000 MHz (344 mm x 194 mm)
                 Hfront   48 Hsync  32 Hback   80 Hpol P
                 Vfront    2 Vsync   5 Vback   24 Vpol N
    Alphanumeric Data String: 'C1J7M.156HL'
    Manufacturer-Specified Display Descriptor (0x00): 00 00 00 00 41 21 9e 00 10 00 00 0a 01 0a 20 20 '....A!........  '
Checksum: 0xc3

----------------

Warnings:

Block 0, Base EDID:
  Alphanumeric Data String: Non-ASCII character 0x80 at position 5, can cause problems.
  Missing Display Product Name.

EDID conformity: PASS
