edid-decode (hex):

00 ff ff ff ff ff ff 00 59 34 4c 02 01 00 00 00
34 0f 01 03 00 1f 17 ff ea 0f 6e a0 57 48 9a 26
10 47 4f a5 4e 00 61 40 00 00 00 00 00 00 00 00
00 00 00 00 00 00 6e 19 00 40 41 00 26 30 18 88
36 00 30 e4 10 00 00 1e 00 00 00 fc 00 35 38 38
0a 20 20 20 20 20 20 20 20 20 00 00 00 00 00 00
65 6e 65 73 69 73 0a 20 20 20 20 20 00 00 00 f9
00 00 00 00 00 00 00 00 00 00 00 00 00 00 00 a3

00 ff ff ff ff ff ff 00 59 34 4c 02 01 00 00 00
34 0f 01 03 00 1f 17 ff ea 0f 6e a0 57 48 9a 26
10 47 4f a5 4e 00 61 40 00 00 00 00 00 00 00 00
00 00 00 00 00 00 6e 19 00 40 41 00 26 30 18 88
36 00 30 e4 10 00 00 1e 00 00 00 fc 00 35 38 38
0a 20 20 20 20 20 20 20 20 20 00 00 00 00 00 00
65 6e 65 73 69 73 0a 20 20 20 20 20 00 00 00 f9
00 00 00 00 00 00 00 00 00 00 00 00 00 00 00 a3

----------------

Block 0, Base EDID:
  EDID Structure Version & Revision: 1.3
  Vendor & Product Identification:
    Manufacturer: VIT
    Model: 588
    Serial Number: ...
    Made in: week 52 of 2005
  Basic Display Parameters & Features:
    Analog display
    Signal Level Standard: 0.700 : 0.300 : 1.000 V p-p
    Blank level equals black level
    Maximum image size: 31 cm x 23 cm
    Gamma is defined in an extension block
    DPMS levels: Standby Suspend Off
    RGB color display
    First detailed timing is the preferred timing
  Color Characteristics:
    Red  : 0.6250, 0.3398
    Green: 0.2841, 0.6044
    Blue : 0.1494, 0.0644
    White: 0.2802, 0.3105
  Established Timings I & II:
    IBM     :   720x400    70.081663 Hz   9:5     31.467 kHz     28.320000 MHz
    DMT 0x04:   640x480    59.940476 Hz   4:3     31.469 kHz     25.175000 MHz
    DMT 0x06:   640x480    75.000000 Hz   4:3     37.500 kHz     31.500000 MHz
    DMT 0x09:   800x600    60.316541 Hz   4:3     37.879 kHz     40.000000 MHz
    DMT 0x0b:   800x600    75.000000 Hz   4:3     46.875 kHz     49.500000 MHz
    DMT 0x10:  1024x768    60.003840 Hz   4:3     48.363 kHz     65.000000 MHz
    DMT 0x11:  1024x768    70.069359 Hz   4:3     56.476 kHz     75.000000 MHz
    DMT 0x12:  1024x768    75.028582 Hz   4:3     60.023 kHz     78.750000 MHz
  Standard Timings:
    DMT 0x10:  1024x768    60.003840 Hz   4:3     48.363 kHz     65.000000 MHz
  Detailed Timing Descriptors:
    DTD 1:  1024x768    60.096154 Hz   4:3     48.438 kHz     65.100000 MHz (304 mm x 228 mm)
                 Hfront   24 Hsync 136 Hback  160 Hpol P
                 Vfront    3 Vsync   6 Vback   29 Vpol P
    Display Product Name: '588'
    Manufacturer-Specified Display Descriptor (0x00): 00 00 00 00 65 6e 65 73 69 73 0a 20 20 20 20 20 '....enesis.     '
    Display Color Management Data:
      Version : 0
      Red a3  : 0.00
      Red a2  : 0.00
      Green a3: 0.00
      Green a2: 0.00
      Blue a3 : 0.00
      Blue a2 : 0.00
Checksum: 0xa3

----------------

Warnings:

Block 0, Base EDID:
  Vendor & Product Identification: The serial number is one of the known dummy values, it should probably be set to 0.

Failures:

Block 0, Base EDID:
  Standard Timings: Use 0x0101 as the invalid Standard Timings code, not 0x0000.
  Standard Timings: Use 0x0101 as the invalid Standard Timings code, not 0x0000.
  Standard Timings: Use 0x0101 as the invalid Standard Timings code, not 0x0000.
  Standard Timings: Use 0x0101 as the invalid Standard Timings code, not 0x0000.
  Standard Timings: Use 0x0101 as the invalid Standard Timings code, not 0x0000.
  Standard Timings: Use 0x0101 as the invalid Standard Timings code, not 0x0000.
  Standard Timings: Use 0x0101 as the invalid Standard Timings code, not 0x0000.
  Missing Display Range Limits Descriptor.
EDID:
  Extension Block 1 started with EDID header, ignoring Extension Blocks >= 1.

EDID conformity: FAIL
