edid-decode (hex):

00 ff ff ff ff ff ff 00 21 63 22 19 01 00 00 00
09 11 01 04 68 29 1a 78 ea 85 e5 a2 59 4a 95 23
14 50 54 a3 08 00 31 40 45 40 61 40 81 80 95 00
01 01 01 01 01 01 9a 29 a0 d0 51 84 22 30 50 98
36 00 99 33 11 00 00 1c 00 00 00 ff 00 0a 20 20
20 20 20 20 20 20 20 20 20 20 00 00 00 fd 00 37
3c 1e 46 10 00 0a 20 20 20 20 20 20 00 00 00 fc
00 0a 20 20 20 20 20 20 20 20 20 20 20 20 00 ef

00 ff ff ff ff ff ff 00 21 63 22 19 01 00 00 00
09 11 01 04 68 29 1a 78 ea 85 e5 a2 59 4a 95 23
14 50 54 a3 08 00 31 40 45 40 61 40 81 80 95 00
01 01 01 01 01 01 9a 29 a0 d0 51 84 22 30 50 98
36 00 99 33 11 00 00 1c 00 00 00 ff 00 0a 20 20
20 20 20 20 20 20 20 20 20 20 00 00 00 fd 00 37
3c 1e 46 10 00 0a 20 20 20 20 20 20 00 00 00 fc
00 0a 20 20 20 20 20 20 20 20 20 20 20 20 00 ef

----------------

Block 0, Base EDID:
  EDID Structure Version & Revision: 1.4
  Vendor & Product Identification:
    Manufacturer: HKC
    Model: 6434
    Serial Number: ...
    Made in: week 9 of 2007
  Basic Display Parameters & Features:
    Analog display
    Signal Level Standard: 0.700 : 0.000 : 0.700 V p-p
    Blank level equals black level
    Sync: Separate
    Maximum image size: 41 cm x 26 cm
    Gamma: 2.20
    DPMS levels: Standby Suspend Off
    RGB color display
    First detailed timing includes the native pixel format and preferred refresh rate
  Color Characteristics:
    Red  : 0.6347, 0.3476
    Green: 0.2900, 0.5830
    Blue : 0.1396, 0.0800
    White: 0.3134, 0.3291
  Established Timings I & II:
    IBM     :   720x400    70.081663 Hz   9:5     31.467 kHz     28.320000 MHz
    DMT 0x04:   640x480    59.940476 Hz   4:3     31.469 kHz     25.175000 MHz
    DMT 0x08:   800x600    56.250000 Hz   4:3     35.156 kHz     36.000000 MHz
    DMT 0x09:   800x600    60.316541 Hz   4:3     37.879 kHz     40.000000 MHz
    DMT 0x10:  1024x768    60.003840 Hz   4:3     48.363 kHz     65.000000 MHz
  Standard Timings:
    DMT 0x04:   640x480    59.940476 Hz   4:3     31.469 kHz     25.175000 MHz
    DMT 0x09:   800x600    60.316541 Hz   4:3     37.879 kHz     40.000000 MHz
    DMT 0x10:  1024x768    60.003840 Hz   4:3     48.363 kHz     65.000000 MHz
    DMT 0x23:  1280x1024   60.019740 Hz   5:4     63.981 kHz    108.000000 MHz
    DMT 0x2f:  1440x900    59.887445 Hz  16:10    55.935 kHz    106.500000 MHz
  Detailed Timing Descriptors:
    DTD 1:  1440x900    59.887445 Hz  16:10    55.935 kHz    106.500000 MHz (409 mm x 307 mm)
                 Hfront   80 Hsync 152 Hback  232 Hpol N
                 Vfront    3 Vsync   6 Vback   25 Vpol P
    Display Product Serial Number: ...
    Display Range Limits:
      Monitor ranges (GTF): 55-60 Hz V, 30-70 kHz H, max dotclock 160 MHz
    Display Product Name: ''
Checksum: 0xef

----------------

Warnings:

Block 0, Base EDID:
  Vendor & Product Identification: The serial number is one of the known dummy values, it should probably be set to 0.
  Detailed Timing Descriptor #1: Image size is 409x307 mm, but based on the picture AR it should be 409x255 mm.
  Display Range Limits: GTF support is deprecated in EDID 1.4.
EDID:
  Base EDID: Some timings are out of range of the Monitor Ranges:
    Vertical Freq: 56.250 - 70.082 Hz (Monitor: 55.000 - 60.000 Hz)

Failures:

Block 0, Base EDID:
  Display Product Serial Number: ...
  Detailed Timing Descriptor #1: Mismatch of image size 409x307 mm vs display size 410x260 mm.
  Display Range Limits: GTF is supported, but the display does not support continuous frequencies.
  Display Product Name: Empty string.
EDID:
  Extension Block 1 started with EDID header, ignoring Extension Blocks >= 1.
  Base EDID: The DTD max image size is 409x307mm, which is larger than the display size 410.0x260.0mm.

EDID conformity: FAIL
