edid-decode (hex):

00 ff ff ff ff ff ff 00 0e 77 17 15 00 00 00 00
00 22 01 04 a5 21 15 78 03 7e 91 96 5c 5a 93 28
1e 51 56 00 00 00 01 01 01 01 01 01 01 01 01 01
01 01 01 01 01 01 1a 3f 80 04 71 b0 23 40 30 20
36 00 49 cd 10 00 00 18 00 00 00 fd 00 28 3c 4a
4a 10 01 0a 20 20 20 20 20 20 00 00 00 fe 00 43
4f 53 54 20 54 39 0a 20 20 20 20 20 00 00 00 fc
00 4d 4e 46 33 30 37 51 53 33 2d 31 0a 20 01 93

70 20 79 02 00 81 00 14 74 1a 00 00 03 01 28 3c
00 00 00 00 00 00 3c 00 00 00 00 80 00 00 00 00
00 00 00 00 00 00 00 00 00 00 00 00 00 00 00 00
00 00 00 00 00 00 00 00 00 00 00 00 00 00 00 00
00 00 00 00 00 00 00 00 00 00 00 00 00 00 00 00
00 00 00 00 00 00 00 00 00 00 00 00 00 00 00 00
00 00 00 00 00 00 00 00 00 00 00 00 00 00 00 00
00 00 00 00 00 00 00 00 00 00 00 00 00 00 1e 90

00 ff ff ff ff ff ff 00 0e 77 17 15 00 00 00 00
00 22 01 04 a5 21 15 78 03 7e 91 96 5c 5a 93 28
1e 51 56 00 00 00 01 01 01 01 01 01 01 01 01 01
01 01 01 01 01 01 1a 3f 80 04 71 b0 23 40 30 20
36 00 49 cd 10 00 00 18 00 00 00 fd 00 28 3c 4a
4a 10 01 0a 20 20 20 20 20 20 00 00 00 fe 00 43
4f 53 54 20 54 39 0a 20 20 20 20 20 00 00 00 fc
00 4d 4e 46 33 30 37 51 53 33 2d 31 0a 20 01 93

70 20 79 02 00 81 00 14 74 1a 00 00 03 01 28 3c
00 00 00 00 00 00 3c 00 00 00 00 80 00 00 00 00
00 00 00 00 00 00 00 00 00 00 00 00 00 00 00 00
00 00 00 00 00 00 00 00 00 00 00 00 00 00 00 00
00 00 00 00 00 00 00 00 00 00 00 00 00 00 00 00
00 00 00 00 00 00 00 00 00 00 00 00 00 00 00 00
00 00 00 00 00 00 00 00 00 00 00 00 00 00 00 00
00 00 00 00 00 00 00 00 00 00 00 00 00 00 1e 90

----------------

Block 0, Base EDID:
  EDID Structure Version & Revision: 1.4
  Vendor & Product Identification:
    Manufacturer: CSW
    Model: 5399
    Made in: 2024
  Basic Display Parameters & Features:
    Digital display
    Bits per primary color channel: 8
    DisplayPort interface
    Maximum image size: 33 cm x 21 cm
    Gamma: 2.20
    Supported color formats: RGB 4:4:4
    First detailed timing includes the native pixel format and preferred refresh rate
    Display supports continuous frequencies
  Color Characteristics:
    Red  : 0.5869, 0.3623
    Green: 0.3544, 0.5761
    Blue : 0.1582, 0.1181
    White: 0.3164, 0.3369
  Established Timings I & II: none
  Standard Timings: none
  Detailed Timing Descriptors:
    DTD 1:  1920x1200   60.000743 Hz  16:10    74.101 kHz    161.540000 MHz (329 mm x 205 mm)
                 Hfront   48 Hsync  32 Hback  180 Hpol N
                 Vfront    3 Vsync   6 Vback   26 Vpol N
    Display Range Limits:
      Monitor ranges (Range Limits Only): 40-60 Hz V, 74-74 kHz H, max dotclock 160 MHz
    Alphanumeric Data String: 'COST T9'
    Display Product Name: 'MNF307QS3-1'
  Extension blocks: 1
Checksum: 0x93

----------------

Block 1, DisplayID Extension Block:
  Version: 2.0
  Extension Count: 0
  Display Product Primary Use Case: None of the listed primary use cases; generic display
  CTA-861 DisplayID Data Block:
  Vendor-Specific Data Block (AMD), OUI 00-00-1A:
    Version: 3
    Flags 1: 0x01
      FreeSync Supported
    Minimum Refresh Rate: 40 Hz
    Maximum Refresh Rate: 60 Hz
    Flags 5: 0x00
    Additional Sink Information Address: 0x403
  Checksum: 0x1e
Checksum: 0x90

----------------

Warnings:

EDID:
  Base EDID: Some timings are out of range of the Monitor Ranges:
    Maximum Clock: 161.540 MHz (Monitor: 160.000 MHz)
    Could be due to a Monitor Range off-by-one rounding issue

Failures:

Block 1, DisplayID Extension Block:
  Vendor-Specific Data Block (AMD), OUI 00-00-1A: Length is 20 instead of 21.
EDID:
  Extension Block 2 started with EDID header, ignoring Extension Blocks >= 2.
  DisplayID: Missing DisplayID Display Parameters Data Block.
  DisplayID: Missing DisplayID Type VII Detailed Timing Data Block.
  DisplayID: DisplayID expects at least one preferred timing.

EDID conformity: FAIL
