edid-decode (hex):

00 ff ff ff ff ff ff 00 1e 6d 00 00 00 00 00 00
34 0d 01 01 88 5c 34 96 08 fb 7d a3 56 4c b0 23
09 44 5d bf ee 80 31 59 4b d9 4c d9 45 59 61 59
71 59 81 40 81 80 30 2a 00 98 51 00 2a 40 30 70
13 00 98 08 32 00 00 1e 00 00 00 fd 00 30 7d 1e
78 0f 00 0a 20 20 20 20 20 20 00 00 00 fc 00 4c
47 20 54 56 20 20 20 20 20 20 20 20 d5 09 80 a0
20 e0 2d 10 10 60 a2 00 98 08 32 10 10 18 01 4a

02 01 04 00 01 1d 00 72 51 d0 1e 20 6e 28 55 00
c4 8e 21 00 00 1e 8c 0a d0 8a 20 e0 2d 10 10 3e
96 00 c4 8e 21 00 00 18 01 1d 80 18 71 1c 16 20
58 2c 25 00 c4 8e 21 00 00 9e 00 00 00 00 00 00
00 00 00 00 00 00 00 00 00 00 00 00 00 00 00 00
00 00 00 00 00 00 00 00 00 00 00 00 00 00 00 00
00 00 00 00 00 00 00 00 00 00 00 00 00 00 00 00
00 00 00 00 00 00 00 00 00 00 00 00 00 00 00 bf

00 ff ff ff ff ff ff 00 1e 6d 00 00 00 00 00 00
34 0d 01 01 88 5c 34 96 08 fb 7d a3 56 4c b0 23
09 44 5d bf ee 80 31 59 4b d9 4c d9 45 59 61 59
71 59 81 40 81 80 30 2a 00 98 51 00 2a 40 30 70
13 00 98 08 32 00 00 1e 00 00 00 fd 00 30 7d 1e
78 0f 00 0a 20 20 20 20 20 20 00 00 00 fc 00 4c
47 20 54 56 20 20 20 20 20 20 20 20 d5 09 80 a0
20 e0 2d 10 10 60 a2 00 98 08 32 10 10 18 01 4a

02 01 04 00 01 1d 00 72 51 d0 1e 20 6e 28 55 00
c4 8e 21 00 00 1e 8c 0a d0 8a 20 e0 2d 10 10 3e
96 00 c4 8e 21 00 00 18 01 1d 80 18 71 1c 16 20
58 2c 25 00 c4 8e 21 00 00 9e 00 00 00 00 00 00
00 00 00 00 00 00 00 00 00 00 00 00 00 00 00 00
00 00 00 00 00 00 00 00 00 00 00 00 00 00 00 00
00 00 00 00 00 00 00 00 00 00 00 00 00 00 00 00
00 00 00 00 00 00 00 00 00 00 00 00 00 00 00 bf

----------------

Block 0, Base EDID:
  EDID Structure Version & Revision: 1.1
  Vendor & Product Identification:
    Manufacturer: GSM
    Model: 0
    Made in: week 52 of 2003
  Basic Display Parameters & Features:
    Digital display
    Maximum image size: 92 cm x 52 cm
    Gamma: 2.50
    RGB color display
  Color Characteristics:
    Red  : 0.6396, 0.3388
    Green: 0.2988, 0.6904
    Blue : 0.1376, 0.0380
    White: 0.2685, 0.3642
  Established Timings I & II:
    IBM     :   720x400    70.081663 Hz   9:5     31.467 kHz     28.320000 MHz
    DMT 0x04:   640x480    59.940476 Hz   4:3     31.469 kHz     25.175000 MHz
    Apple   :   640x480    66.666667 Hz   4:3     35.000 kHz     30.240000 MHz
    DMT 0x05:   640x480    72.808802 Hz   4:3     37.861 kHz     31.500000 MHz
    DMT 0x06:   640x480    75.000000 Hz   4:3     37.500 kHz     31.500000 MHz
    DMT 0x08:   800x600    56.250000 Hz   4:3     35.156 kHz     36.000000 MHz
    DMT 0x09:   800x600    60.316541 Hz   4:3     37.879 kHz     40.000000 MHz
    DMT 0x0a:   800x600    72.187572 Hz   4:3     48.077 kHz     50.000000 MHz
    DMT 0x0b:   800x600    75.000000 Hz   4:3     46.875 kHz     49.500000 MHz
    Apple   :   832x624    74.551266 Hz   4:3     49.726 kHz     57.284000 MHz
    DMT 0x10:  1024x768    60.003840 Hz   4:3     48.363 kHz     65.000000 MHz
    DMT 0x11:  1024x768    70.069359 Hz   4:3     56.476 kHz     75.000000 MHz
    DMT 0x12:  1024x768    75.028582 Hz   4:3     60.023 kHz     78.750000 MHz
    Apple   :  1152x870    75.061550 Hz 192:145   68.681 kHz    100.000000 MHz
  Standard Timings:
    DMT 0x07:   640x480    85.008312 Hz   4:3     43.269 kHz     36.000000 MHz
    Unknown :   848x477    85.000 Hz  16:9
    Unknown :   856x481    85.000 Hz  16:9
    DMT 0x0c:   800x600    85.061274 Hz   4:3     53.674 kHz     56.250000 MHz
    DMT 0x13:  1024x768    84.996690 Hz   4:3     68.677 kHz     94.500000 MHz
    Unknown :  1152x864    85.000 Hz   4:3
    DMT 0x20:  1280x960    60.000000 Hz   4:3     60.000 kHz    108.000000 MHz
    DMT 0x23:  1280x1024   60.019740 Hz   5:4     63.981 kHz    108.000000 MHz
  Detailed Timing Descriptors:
    DTD 1:  1280x1024   60.019740 Hz   5:4     63.981 kHz    108.000000 MHz (920 mm x 520 mm)
                 Hfront   48 Hsync 112 Hback  248 Hpol P
                 Vfront    1 Vsync   3 Vback   38 Vpol P
    Display Range Limits:
      Monitor ranges (GTF): 48-125 Hz V, 30-120 kHz H, max dotclock 150 MHz
    Display Product Name: 'LG TV        '
    DTD 2:   640x480    59.928571 Hz   4:3     31.462 kHz     25.170000 MHz (920 mm x 520 mm)
                 Hfront   16 Hsync  96 Hback   16 Hpol N Hborder 16
                 Vfront   10 Vsync   2 Vback    1 Vpol N Vborder 16
  Extension blocks: 1
Checksum: 0x4a

----------------

Block 1, CTA-861 Extension Block:
  Revision: 1
  Detailed Timing Descriptors:
    DTD 3:  1280x720    60.000000 Hz  16:9     45.000 kHz     74.250000 MHz (708 mm x 398 mm)
                 Hfront  110 Hsync  40 Hback  220 Hpol P
                 Vfront    5 Vsync   5 Vback   20 Vpol P
    DTD 4:   720x480    59.940060 Hz   3:2     31.469 kHz     27.000000 MHz (708 mm x 398 mm)
                 Hfront   16 Hsync  62 Hback   60 Hpol N
                 Vfront    9 Vsync   6 Vback   30 Vpol N
    DTD 5:  1920x1080i  60.000000 Hz  16:9     33.750 kHz     74.250000 MHz (708 mm x 398 mm)
                 Hfront   88 Hsync  44 Hback  148 Hpol P
                 Vfront    2 Vsync   5 Vback   15 Vpol P Vfront +0.5 Odd Field
                 Vfront    2 Vsync   5 Vback   15 Vpol P Vback  +0.5 Even Field
Checksum: 0xbf  Unused space in Extension Block: 69 bytes

----------------

Block 2, Unknown EDID Extension Block 0x00:
  00 ff ff ff ff ff ff 00 1e 6d 00 00 00 00 00 00 '.........m......'
  34 0d 01 01 88 5c 34 96 08 fb 7d a3 56 4c b0 23 '4....\4...}.VL.#'
  09 44 5d bf ee 80 31 59 4b d9 4c d9 45 59 61 59 '.D]...1YK.L.EYaY'
  71 59 81 40 81 80 30 2a 00 98 51 00 2a 40 30 70 'qY.@..0*..Q.*@0p'
  13 00 98 08 32 00 00 1e 00 00 00 fd 00 30 7d 1e '....2........0}.'
  78 0f 00 0a 20 20 20 20 20 20 00 00 00 fc 00 4c 'x...      .....L'
  47 20 54 56 20 20 20 20 20 20 20 20 d5 09 80 a0 'G TV        ....'
  20 e0 2d 10 10 60 a2 00 98 08 32 10 10 18 01 4a ' .-..`....2....J'
Checksum: 0x4a

----------------

Block 3, CTA-861 Extension Block:
  Revision: 1
  Detailed Timing Descriptors:
    DTD 6:  1280x720    60.000000 Hz  16:9     45.000 kHz     74.250000 MHz (708 mm x 398 mm)
                 Hfront  110 Hsync  40 Hback  220 Hpol P
                 Vfront    5 Vsync   5 Vback   20 Vpol P
    DTD 7:   720x480    59.940060 Hz   3:2     31.469 kHz     27.000000 MHz (708 mm x 398 mm)
                 Hfront   16 Hsync  62 Hback   60 Hpol N
                 Vfront    9 Vsync   6 Vback   30 Vpol N
    DTD 8:  1920x1080i  60.000000 Hz  16:9     33.750 kHz     74.250000 MHz (708 mm x 398 mm)
                 Hfront   88 Hsync  44 Hback  148 Hpol P
                 Vfront    2 Vsync   5 Vback   15 Vpol P Vfront +0.5 Odd Field
                 Vfront    2 Vsync   5 Vback   15 Vpol P Vback  +0.5 Even Field
Checksum: 0xbf  Unused space in Extension Block: 69 bytes

----------------

Warnings:

Block 0, Base EDID:
  EDID Structure Version & Revision: EDID 1.1 is deprecated, do not use.
  Standard Timings: Standard Timing 848x477 has a dubious odd vertical resolution.
  Standard Timings: Standard Timing 856x481 has a dubious odd vertical resolution.
  Detailed Timing Descriptor #1: Image size is 920x520 mm, but based on the picture AR it should be 920x736 mm.
  Detailed Timing Descriptor #2: Image size is 920x520 mm, but based on the picture AR it should be 920x690 mm.
  Detailed Timing Descriptor #2: The use of non-zero borders in a DTD is not recommended.
Block 1, CTA-861 Extension Block:
  Detailed Timing Descriptor #3: DTD is identical to VIC 4, which is not present in the CTA Ext Block.
  Detailed Timing Descriptor #4: Image size is 708x398 mm, but based on the picture AR it should be 708x472 mm.
  Detailed Timing Descriptor #5: DTD is identical to VIC 5, which is not present in the CTA Ext Block.
  Add a Colorimetry Data Block with the sRGB colorimetry bit set to avoid interop issues.
Block 3, CTA-861 Extension Block:
  Detailed Timing Descriptor #6: DTD is identical to VIC 4, which is not present in the CTA Ext Block.
  Detailed Timing Descriptor #7: Image size is 708x398 mm, but based on the picture AR it should be 708x472 mm.
  Detailed Timing Descriptor #8: DTD is identical to VIC 5, which is not present in the CTA Ext Block.
EDID:
  No Native Video Resolution was defined.
    Hint: set 'Native detailed modes' to a non-0 value, or add a Native Video Resolution Data Block.

Failures:

Block 0, Base EDID:
  Basic Display Parameters & Features: Digital Video Interface Standard set to reserved value 0x08.
  Display Product Name: No newline, but one or more trailing spaces.
  Detailed Timing Descriptor #2: Invalid detailed timing descriptor ordering.
Block 1, CTA-861 Extension Block:
  Detailed Timing Descriptor #3: Mismatch of image size 708x398 mm vs display size 920x520 mm.
  Detailed Timing Descriptor #4: Mismatch of image size 708x398 mm vs display size 920x520 mm.
  Detailed Timing Descriptor #5: Mismatch of image size 708x398 mm vs display size 920x520 mm.
  Missing VCDB, needed for Set Selectable RGB Quantization to avoid interop issues.
Block 2, Base EDID:
  Unknown Extension Block.
Block 3, CTA-861 Extension Block:
  Detailed Timing Descriptor #6: Mismatch of image size 708x398 mm vs display size 920x520 mm.
  Detailed Timing Descriptor #7: Mismatch of image size 708x398 mm vs display size 920x520 mm.
  Detailed Timing Descriptor #8: Mismatch of image size 708x398 mm vs display size 920x520 mm.
EDID:
  Base EDID: EDID specified 1 extension block(s), but found 3 extension block(s).

EDID conformity: FAIL
