edid-decode (hex):

00 ff ff ff ff ff ff 00 09 e5 69 0b 00 00 00 00
18 20 01 04 a5 26 15 78 03 0f 95 ae 52 43 b0 26
0f 50 54 00 00 00 01 01 01 01 01 01 01 01 01 01
01 01 01 01 01 01 e2 67 00 b0 a0 a0 b4 50 30 20
36 00 7d d6 10 00 00 1a 00 00 00 fd 0c 3c f0 86
86 6a 01 0a 20 20 20 20 20 20 00 00 00 fe 00 42
4f 45 20 43 51 0a 20 20 20 20 20 20 00 00 00 fe
00 4e 45 31 37 33 51 48 4d 2d 4e 5a 32 0a 01 60

70 20 79 02 00 22 00 14 4c 3b 10 84 ff 09 af 00
2f 00 1f 00 9f 05 b3 00 02 00 05 00 2b 00 06 27
00 3c ef 00 00 81 00 13 72 1a 00 00 03 01 3c f0
00 00 00 00 00 00 f0 00 00 00 00 00 00 00 00 00
00 00 00 00 00 00 00 00 00 00 00 00 00 00 00 00
00 00 00 00 00 00 00 00 00 00 00 00 00 00 00 00
00 00 00 00 00 00 00 00 00 00 00 00 00 00 00 00
00 00 00 00 00 00 00 00 00 00 00 00 00 00 ee 90

00 ff ff ff ff ff ff 00 09 e5 69 0b 00 00 00 00
18 20 01 04 a5 26 15 78 03 0f 95 ae 52 43 b0 26
0f 50 54 00 00 00 01 01 01 01 01 01 01 01 01 01
01 01 01 01 01 01 e2 67 00 b0 a0 a0 b4 50 30 20
36 00 7d d6 10 00 00 1a 00 00 00 fd 0c 3c f0 86
86 6a 01 0a 20 20 20 20 20 20 00 00 00 fe 00 42
4f 45 20 43 51 0a 20 20 20 20 20 20 00 00 00 fe
00 4e 45 31 37 33 51 48 4d 2d 4e 5a 32 0a 01 60

70 20 79 02 00 22 00 14 4c 3b 10 84 ff 09 af 00
2f 00 1f 00 9f 05 b3 00 02 00 05 00 2b 00 06 27
00 3c ef 00 00 81 00 13 72 1a 00 00 03 01 3c f0
00 00 00 00 00 00 f0 00 00 00 00 00 00 00 00 00
00 00 00 00 00 00 00 00 00 00 00 00 00 00 00 00
00 00 00 00 00 00 00 00 00 00 00 00 00 00 00 00
00 00 00 00 00 00 00 00 00 00 00 00 00 00 00 00
00 00 00 00 00 00 00 00 00 00 00 00 00 00 ee 90

----------------

Block 0, Base EDID:
  EDID Structure Version & Revision: 1.4
  Vendor & Product Identification:
    Manufacturer: BOE
    Model: 2921
    Made in: week 24 of 2022
  Basic Display Parameters & Features:
    Digital display
    Bits per primary color channel: 8
    DisplayPort interface
    Maximum image size: 38 cm x 21 cm
    Gamma: 2.20
    Supported color formats: RGB 4:4:4
    First detailed timing includes the native pixel format and preferred refresh rate
    Display supports continuous frequencies
  Color Characteristics:
    Red  : 0.6796, 0.3203
    Green: 0.2646, 0.6904
    Blue : 0.1503, 0.0595
    White: 0.3134, 0.3291
  Established Timings I & II: none
  Standard Timings: none
  Detailed Timing Descriptors:
    DTD 1:  2560x1440   60.000180 Hz  16:9     97.200 kHz    265.940000 MHz (381 mm x 214 mm)
                 Hfront   48 Hsync  32 Hback   96 Hpol P
                 Vfront    3 Vsync   6 Vback  171 Vpol N
    Display Range Limits:
      Monitor ranges (Range Limits Only): 60-240 Hz V, 389-389 kHz H, max dotclock 1060 MHz
    Alphanumeric Data String: 'BOE CQ'
    Alphanumeric Data String: 'NE173QHM-NZ2'
  Extension blocks: 1
Checksum: 0x60

----------------

Block 1, DisplayID Extension Block:
  Version: 2.0
  Extension Count: 0
  Display Product Primary Use Case: None of the listed primary use cases; generic display
  Video Timing Modes Type 7 - Detailed Timings Data Block:
    DTD:  2560x1440  240.000045 Hz  16:9    388.800 kHz   1063.757000 MHz (aspect 16:9, no 3D stereo, preferred)
               Hfront   48 Hsync  32 Hback   96 Hpol N
               Vfront    3 Vsync   6 Vback  171 Vpol N
  Adaptive Sync Data Block:
    Descriptor #1:
      Native Panel Range
      Fixed Average V-Total and Adaptive V-Total
      Supports Seamless Transition
      'Max Single Frame Duration Increase' field value without jitter impact
      'Max Single Frame Duration Decrease' field value without jitter impact
      Max Duration Increase: 0.00 ms
      Max Duration Decrease: 0.00 ms
      Min Refresh Rate: 60 Hz
      Max Refresh Rate: 240 Hz
  CTA-861 DisplayID Data Block:
  Vendor-Specific Data Block (AMD), OUI 00-00-1A:
    Version: 3
    Feature Caps: 0x01
    Minimum Refresh Rate: 60 Hz
    Maximum Refresh Rate: 240 Hz
    Flags 1.x: 0x00
    Flags 2.x: 0x00
    Maximum luminance: 0 (50.000 cd/m^2)
    Minimum luminance: 0 (0.000 cd/m^2)
    Unknown: 0x00 0x00
  Checksum: 0xee
Checksum: 0x90

----------------

Block 2, Unknown EDID Extension Block 0x00:
  00 ff ff ff ff ff ff 00 09 e5 69 0b 00 00 00 00 '..........i.....'
  18 20 01 04 a5 26 15 78 03 0f 95 ae 52 43 b0 26 '. ...&.x....RC.&'
  0f 50 54 00 00 00 01 01 01 01 01 01 01 01 01 01 '.PT.............'
  01 01 01 01 01 01 e2 67 00 b0 a0 a0 b4 50 30 20 '.......g.....P0 '
  36 00 7d d6 10 00 00 1a 00 00 00 fd 0c 3c f0 86 '6.}..........<..'
  86 6a 01 0a 20 20 20 20 20 20 00 00 00 fe 00 42 '.j..      .....B'
  4f 45 20 43 51 0a 20 20 20 20 20 20 00 00 00 fe 'OE CQ.      ....'
  00 4e 45 31 37 33 51 48 4d 2d 4e 5a 32 0a 01 60 '.NE173QHM-NZ2..`'
Checksum: 0x60

----------------

Block 3, DisplayID Extension Block:
  Version: 2.0
  Extension Count: 0
  Video Timing Modes Type 7 - Detailed Timings Data Block:
    DTD:  2560x1440  240.000045 Hz  16:9    388.800 kHz   1063.757000 MHz (aspect 16:9, no 3D stereo, preferred)
               Hfront   48 Hsync  32 Hback   96 Hpol N
               Vfront    3 Vsync   6 Vback  171 Vpol N
  Adaptive Sync Data Block:
    Descriptor #1:
      Native Panel Range
      Fixed Average V-Total and Adaptive V-Total
      Supports Seamless Transition
      'Max Single Frame Duration Increase' field value without jitter impact
      'Max Single Frame Duration Decrease' field value without jitter impact
      Max Duration Increase: 0.00 ms
      Max Duration Decrease: 0.00 ms
      Min Refresh Rate: 60 Hz
      Max Refresh Rate: 240 Hz
  CTA-861 DisplayID Data Block:
  Vendor-Specific Data Block (AMD), OUI 00-00-1A:
    Version: 3
    Feature Caps: 0x01
    Minimum Refresh Rate: 60 Hz
    Maximum Refresh Rate: 240 Hz
    Flags 1.x: 0x00
    Flags 2.x: 0x00
    Maximum luminance: 0 (50.000 cd/m^2)
    Minimum luminance: 0 (0.000 cd/m^2)
    Unknown: 0x00 0x00
  Checksum: 0xee
Checksum: 0x90

----------------

Warnings:

Block 0, Base EDID:
  Missing Display Product Name.
EDID:
  Base EDID: Some timings are out of range of the Monitor Ranges:
    Horizontal Freq: 97.200 - 388.800 kHz (Monitor: 389.000 - 389.000 kHz)
    Maximum Clock: 1063.757 MHz (Monitor: 1060.000 MHz)

Failures:

Block 1, DisplayID Extension Block:
  Expected 0 DisplayID Extension Block, but got 1.
Block 2, Base EDID:
  Unknown Extension Block.
Block 3, DisplayID Extension Block:
  Product Type should be 0 in extension block.
EDID:
  Base EDID: EDID specified 1 extension block(s), but found 3 extension block(s).
  DisplayID: Missing DisplayID Display Parameters Data Block.

EDID conformity: FAIL
