edid-decode (hex):

00 ff ff ff ff ff ff 00 4c 2d 0b 09 01 00 00 00
2a 15 01 03 80 66 39 78 0a ee 91 a3 54 4c 99 26
0f 50 54 b9 8c 00 71 4f 81 c0 81 00 81 80 95 00
a9 c0 b3 00 01 01 02 3a 80 18 71 38 2d 40 58 2c
45 00 a0 5a 00 00 00 1e 66 21 56 aa 51 00 1e 30
46 8f 33 00 a0 5a 00 00 00 1e 00 00 00 fc 00 53
41 4d 53 55 4e 47 0a 20 20 20 20 20 00 00 00 fd
00 18 4b 0f 51 17 00 0a 20 20 20 20 20 20 01 6e

02 03 1b f1 46 90 1f 04 13 03 12 23 09 07 07 83
01 00 00 67 03 0c 00 20 00 80 2b 02 3a 80 18 71
38 2d 40 58 2c 45 00 10 09 00 00 00 1e 02 3a 80
d0 72 38 2d 40 10 2c 45 80 10 09 00 00 00 1e 01
1d 00 72 51 d0 1e 20 6e 28 55 00 10 09 00 00 00
1e 01 1d 00 bc 52 d0 1e 20 b8 28 55 40 10 09 00
00 00 1e 8c 0a d0 8a 20 e0 2d 10 10 3e 96 00 10
09 00 00 00 18 00 00 00 00 00 00 00 00 00 00 d1

----------------

Block 0, Base EDID:
  EDID Structure Version & Revision: 1.3
  Vendor & Product Identification:
    Manufacturer: SAM
    Model: 2315
    Serial Number: ...
    Made in: week 42 of 2011
  Basic Display Parameters & Features:
    Digital display
    Maximum image size: 102 cm x 57 cm
    Gamma: 2.20
    RGB color display
    First detailed timing is the preferred timing
  Color Characteristics:
    Red  : 0.6396, 0.3300
    Green: 0.2998, 0.5996
    Blue : 0.1503, 0.0595
    White: 0.3125, 0.3291
  Established Timings I & II:
    IBM     :   720x400    70.081663 Hz   9:5     31.467 kHz     28.320000 MHz
    DMT 0x04:   640x480    59.940476 Hz   4:3     31.469 kHz     25.175000 MHz
    Apple   :   640x480    66.666667 Hz   4:3     35.000 kHz     30.240000 MHz
    DMT 0x05:   640x480    72.808802 Hz   4:3     37.861 kHz     31.500000 MHz
    DMT 0x09:   800x600    60.316541 Hz   4:3     37.879 kHz     40.000000 MHz
    DMT 0x0a:   800x600    72.187572 Hz   4:3     48.077 kHz     50.000000 MHz
    DMT 0x10:  1024x768    60.003840 Hz   4:3     48.363 kHz     65.000000 MHz
    DMT 0x11:  1024x768    70.069359 Hz   4:3     56.476 kHz     75.000000 MHz
  Standard Timings:
    DMT 0x15:  1152x864    75.000000 Hz   4:3     67.500 kHz    108.000000 MHz
    DMT 0x55:  1280x720    60.000000 Hz  16:9     45.000 kHz     74.250000 MHz
    DMT 0x1c:  1280x800    59.810326 Hz  16:10    49.702 kHz     83.500000 MHz
    DMT 0x23:  1280x1024   60.019740 Hz   5:4     63.981 kHz    108.000000 MHz
    DMT 0x2f:  1440x900    59.887445 Hz  16:10    55.935 kHz    106.500000 MHz
    DMT 0x53:  1600x900    60.000000 Hz  16:9     60.000 kHz    108.000000 MHz (RB)
    DMT 0x3a:  1680x1050   59.954250 Hz  16:10    65.290 kHz    146.250000 MHz
  Detailed Timing Descriptors:
    DTD 1:  1920x1080   60.000000 Hz  16:9     67.500 kHz    148.500000 MHz (160 mm x 90 mm)
                 Hfront   88 Hsync  44 Hback  148 Hpol P
                 Vfront    4 Vsync   5 Vback   36 Vpol P
    DTD 2:  1366x768    59.789541 Hz 683:384   47.712 kHz     85.500000 MHz (160 mm x 90 mm)
                 Hfront   70 Hsync 143 Hback  213 Hpol P
                 Vfront    3 Vsync   3 Vback   24 Vpol P
    Display Product Name: 'SAMSUNG'
    Display Range Limits:
      Monitor ranges (GTF): 24-75 Hz V, 15-81 kHz H, max dotclock 230 MHz
  Extension blocks: 1
Checksum: 0x6e

----------------

Block 1, CTA-861 Extension Block:
  Revision: 3
  Underscans IT Video Formats by default
  Basic audio support
  Supports YCbCr 4:4:4
  Supports YCbCr 4:2:2
  Native DTDs: 1
  Video Data Block:
    VIC  16:  1920x1080   60.000000 Hz  16:9     67.500 kHz    148.500000 MHz (native)
    VIC  31:  1920x1080   50.000000 Hz  16:9     56.250 kHz    148.500000 MHz
    VIC   4:  1280x720    60.000000 Hz  16:9     45.000 kHz     74.250000 MHz
    VIC  19:  1280x720    50.000000 Hz  16:9     37.500 kHz     74.250000 MHz
    VIC   3:   720x480    59.940060 Hz  16:9     31.469 kHz     27.000000 MHz
    VIC  18:   720x576    50.000000 Hz  16:9     31.250 kHz     27.000000 MHz
  Audio Data Block:
    Linear PCM:
      Max channels: 2
      Supported sample rates (kHz): 48 44.1 32
      Supported sample sizes (bits): 24 20 16
  Speaker Allocation Data Block:
    FL/FR - Front Left/Right
  Vendor-Specific Data Block (HDMI), OUI 00-0C-03:
    Source physical address: 2.0.0.0
    Supports_AI
    Maximum TMDS clock: 215 MHz
  Detailed Timing Descriptors:
    DTD 3:  1920x1080   60.000000 Hz  16:9     67.500 kHz    148.500000 MHz (16 mm x 9 mm)
                 Hfront   88 Hsync  44 Hback  148 Hpol P
                 Vfront    4 Vsync   5 Vback   36 Vpol P
    DTD 4:  1920x1080   50.000000 Hz  16:9     56.250 kHz    148.500000 MHz (16 mm x 9 mm)
                 Hfront  528 Hsync  44 Hback  148 Hpol P
                 Vfront    4 Vsync   5 Vback   36 Vpol P
    DTD 5:  1280x720    60.000000 Hz  16:9     45.000 kHz     74.250000 MHz (16 mm x 9 mm)
                 Hfront  110 Hsync  40 Hback  220 Hpol P
                 Vfront    5 Vsync   5 Vback   20 Vpol P
    DTD 6:  1280x720    50.000000 Hz  16:9     37.500 kHz     74.250000 MHz (16 mm x 9 mm)
                 Hfront  440 Hsync  40 Hback  220 Hpol P
                 Vfront    5 Vsync   5 Vback   20 Vpol P
    DTD 7:   720x480    59.940060 Hz   3:2     31.469 kHz     27.000000 MHz (16 mm x 9 mm)
                 Hfront   16 Hsync  62 Hback   60 Hpol N
                 Vfront    9 Vsync   6 Vback   30 Vpol N
Checksum: 0xd1  Unused space in Extension Block: 10 bytes

----------------

Warnings:

Block 0, Base EDID:
  Vendor & Product Identification: The serial number is one of the known dummy values, it should probably be set to 0.
  Detailed Timing Descriptor #1: Dubious image size (160x90 mm is smaller than 100x100 mm).
  Detailed Timing Descriptor #2: Dubious image size (160x90 mm is smaller than 100x100 mm).
Block 1, CTA-861 Extension Block:
  Detailed Timing Descriptor #3: Dubious image size (16x9 mm is smaller than 100x100 mm).
  Detailed Timing Descriptor #4: Dubious image size (16x9 mm is smaller than 100x100 mm).
  Detailed Timing Descriptor #5: Dubious image size (16x9 mm is smaller than 100x100 mm).
  Detailed Timing Descriptor #6: Dubious image size (16x9 mm is smaller than 100x100 mm).
  Detailed Timing Descriptor #7: Dubious image size (16x9 mm is smaller than 100x100 mm).

Failures:

Block 0, Base EDID:
  Basic Display Parameters & Features: The chromaticities match sRGB, but sRGB is not signaled.
  Detailed Timing Descriptor #1: Mismatch of image size 160x90 mm vs display size 1020x570 mm.
  Detailed Timing Descriptor #2: Mismatch of image size 160x90 mm vs display size 1020x570 mm.
Block 1, CTA-861 Extension Block:
  Detailed Timing Descriptor #3: Mismatch of image size 16x9 mm vs display size 1020x570 mm.
  Detailed Timing Descriptor #4: Mismatch of image size 16x9 mm vs display size 1020x570 mm.
  Detailed Timing Descriptor #5: Mismatch of image size 16x9 mm vs display size 1020x570 mm.
  Detailed Timing Descriptor #6: Mismatch of image size 16x9 mm vs display size 1020x570 mm.
  Detailed Timing Descriptor #7: Mismatch of image size 16x9 mm vs display size 1020x570 mm.
  Missing VCDB, needed for Set Selectable RGB Quantization to avoid interop issues.

EDID conformity: FAIL
