edid-decode (hex):

00 ff ff ff ff ff ff 00 22 0e 6b 40 01 00 00 00
01 22 01 04 a5 30 1a 78 ea 23 95 a8 54 4f 9d 26
12 50 54 00 00 00 01 01 01 01 01 01 01 01 01 01
01 01 01 01 01 01 02 3a 80 18 71 38 2d 40 58 2c
45 00 de 04 11 00 00 1c ac 26 80 18 71 38 2d 40
58 2c 45 00 de 04 11 00 00 1c 00 00 00 fc 00 48
50 20 41 6c 6c 2d 69 6e 2d 4f 6e 65 00 00 00 fd
00 38 4c 1e 53 10 00 0a 20 20 20 20 20 20 00 1f

00 ff ff ff ff ff ff 00 22 0e 6b 40 01 00 00 00
01 22 01 04 a5 30 1a 78 ea 23 95 a8 54 4f 9d 26
12 50 54 00 00 00 01 01 01 01 01 01 01 01 01 01
01 01 01 01 01 01 02 3a 80 18 71 38 2d 40 58 2c
45 00 de 04 11 00 00 1c ac 26 80 18 71 38 2d 40
58 2c 45 00 de 04 11 00 00 1c 00 00 00 fc 00 48
50 20 41 6c 6c 2d 69 6e 2d 4f 6e 65 00 00 00 fd
00 38 4c 1e 53 10 00 0a 20 20 20 20 20 20 00 1f

----------------

Block 0, Base EDID:
  EDID Structure Version & Revision: 1.4
  Vendor & Product Identification:
    Manufacturer: HPN
    Model: 16491
    Serial Number: ...
    Made in: week 1 of 2024
  Basic Display Parameters & Features:
    Digital display
    Bits per primary color channel: 8
    DisplayPort interface
    Maximum image size: 48 cm x 26 cm
    Gamma: 2.20
    DPMS levels: Standby Suspend Off
    Supported color formats: RGB 4:4:4, YCrCb 4:4:4
    First detailed timing includes the native pixel format and preferred refresh rate
  Color Characteristics:
    Red  : 0.6562, 0.3300
    Green: 0.3085, 0.6162
    Blue : 0.1503, 0.0712
    White: 0.3134, 0.3291
  Established Timings I & II: none
  Standard Timings: none
  Detailed Timing Descriptors:
    DTD 1:  1920x1080   60.000000 Hz  16:9     67.500 kHz    148.500000 MHz (478 mm x 260 mm)
                 Hfront   88 Hsync  44 Hback  148 Hpol N
                 Vfront    4 Vsync   5 Vback   36 Vpol P
    DTD 2:  1920x1080   40.000000 Hz  16:9     45.000 kHz     99.000000 MHz (478 mm x 260 mm)
                 Hfront   88 Hsync  44 Hback  148 Hpol N
                 Vfront    4 Vsync   5 Vback   36 Vpol P
    Display Product Name: 'HP All-in-One'
    Display Range Limits:
      Monitor ranges (GTF): 56-76 Hz V, 30-83 kHz H, max dotclock 160 MHz
Checksum: 0x1f

----------------

Warnings:

Block 0, Base EDID:
  Vendor & Product Identification: The serial number is one of the known dummy values, it should probably be set to 0.
  Detailed Timing Descriptor #1: DTD is similar but not identical to VIC 16.
  Display Range Limits: GTF support is deprecated in EDID 1.4.
EDID:
  Base EDID: Some timings are out of range of the Monitor Ranges:
    Vertical Freq: 40.000 - 60.000 Hz (Monitor: 56.000 - 76.000 Hz)

Failures:

Block 0, Base EDID:
  Display Range Limits: GTF is supported, but the display does not support continuous frequencies.
EDID:
  Extension Block 1 started with EDID header, ignoring Extension Blocks >= 1.

EDID conformity: FAIL
