edid-decode (hex):

00 ff ff ff ff ff ff 00 66 ae 90 06 74 17 31 84
08 1d 01 03 80 5f 36 78 0a 23 ad a4 54 4d 99 26
0f 47 4a a5 8f 00 d1 fc 01 01 01 01 01 01 01 01
01 01 01 01 01 01 02 3a 80 18 71 38 2d 40 58 2c
45 00 ba 88 21 00 00 1e 00 00 00 10 71 38 2d 40
58 2c 45 00 ba 88 21 00 00 1e 00 00 00 fc 00 34
4b 36 30 20 53 2b 20 48 44 52 0a 20 00 00 00 00
00 00 00 00 00 00 00 00 00 00 00 00 00 00 01 8d

02 03 1d e0 42 00 00 23 09 07 07 83 01 00 00 6d
03 0c 00 10 00 b8 3c 20 00 60 01 02 03 00 00 00
00 00 00 00 00 00 00 00 00 00 00 00 00 00 00 00
00 00 00 00 00 00 00 00 00 00 00 00 00 00 00 00
00 00 00 00 00 00 00 00 00 00 00 00 00 00 00 00
00 00 00 00 00 00 00 00 00 00 00 00 00 00 00 00
00 00 00 00 00 00 00 00 00 00 00 00 00 00 00 00
00 00 00 00 00 00 00 00 00 00 00 00 00 00 00 f8

00 ff ff ff ff ff ff 00 66 ae 90 06 74 17 31 84
08 1d 01 03 80 5f 36 78 0a 23 ad a4 54 4d 99 26
0f 47 4a a5 8f 00 d1 fc 01 01 01 01 01 01 01 01
01 01 01 01 01 01 02 3a 80 18 71 38 2d 40 58 2c
45 00 ba 88 21 00 00 1e 00 00 00 10 71 38 2d 40
58 2c 45 00 ba 88 21 00 00 1e 00 00 00 fc 00 34
4b 36 30 20 53 2b 20 48 44 52 0a 20 00 00 00 00
00 00 00 00 00 00 00 00 00 00 00 00 00 00 01 8d

02 03 1d e0 42 00 00 23 09 07 07 83 01 00 00 6d
03 0c 00 10 00 b8 3c 20 00 60 01 02 03 00 00 00
00 00 00 00 00 00 00 00 00 00 00 00 00 00 00 00
00 00 00 00 00 00 00 00 00 00 00 00 00 00 00 00
00 00 00 00 00 00 00 00 00 00 00 00 00 00 00 00
00 00 00 00 00 00 00 00 00 00 00 00 00 00 00 00
00 00 00 00 00 00 00 00 00 00 00 00 00 00 00 00
00 00 00 00 00 00 00 00 00 00 00 00 00 00 00 f8

----------------

Block 0, Base EDID:
  EDID Structure Version & Revision: 1.3
  Vendor & Product Identification:
    Manufacturer: YUN
    Model: 1680
    Serial Number: ...
    Made in: week 8 of 2019
  Basic Display Parameters & Features:
    Digital display
    Maximum image size: 95 cm x 54 cm
    Gamma: 2.20
    RGB color display
    First detailed timing is the preferred timing
  Color Characteristics:
    Red  : 0.6406, 0.3300
    Green: 0.3007, 0.6005
    Blue : 0.1503, 0.0605
    White: 0.2802, 0.2900
  Established Timings I & II:
    IBM     :   720x400    70.081663 Hz   9:5     31.467 kHz     28.320000 MHz
    DMT 0x04:   640x480    59.940476 Hz   4:3     31.469 kHz     25.175000 MHz
    DMT 0x06:   640x480    75.000000 Hz   4:3     37.500 kHz     31.500000 MHz
    DMT 0x09:   800x600    60.316541 Hz   4:3     37.879 kHz     40.000000 MHz
    DMT 0x0a:   800x600    72.187572 Hz   4:3     48.077 kHz     50.000000 MHz
    DMT 0x10:  1024x768    60.003840 Hz   4:3     48.363 kHz     65.000000 MHz
    DMT 0x11:  1024x768    70.069359 Hz   4:3     56.476 kHz     75.000000 MHz
    DMT 0x12:  1024x768    75.028582 Hz   4:3     60.023 kHz     78.750000 MHz
    DMT 0x24:  1280x1024   75.024675 Hz   5:4     79.976 kHz    135.000000 MHz
  Standard Timings:
    GTF     :  1920x1080  119.999987 Hz  16:9    138.840 kHz    368.759000 MHz
  Detailed Timing Descriptors:
    DTD 1:  1920x1080   60.000000 Hz  16:9     67.500 kHz    148.500000 MHz (698 mm x 392 mm)
                 Hfront   88 Hsync  44 Hback  148 Hpol P
                 Vfront    4 Vsync   5 Vback   36 Vpol P
    Dummy Descriptor:
    Display Product Name: '4K60 S+ HDR'
    Empty Descriptor
  Extension blocks: 1
Checksum: 0x8d

----------------

Block 1, CTA-861 Extension Block:
  Revision: 3
  Underscans IT Video Formats by default
  Basic audio support
  Supports YCbCr 4:4:4
  Native DTDs: 0
  Video Data Block:
  Audio Data Block:
    Linear PCM:
      Max channels: 2
      Supported sample rates (kHz): 48 44.1 32
      Supported sample sizes (bits): 24 20 16
  Speaker Allocation Data Block:
    FL/FR - Front Left/Right
  Vendor-Specific Data Block (HDMI), OUI 00-0C-03:
    Source physical address: 1.0.0.0
    Supports_AI
    DC_36bit
    DC_30bit
    DC_Y444
    Maximum TMDS clock: 300 MHz
    Extended HDMI video details:
      HDMI VICs:
        HDMI VIC 1:  3840x2160   30.000000 Hz  16:9     67.500 kHz    297.000000 MHz
        HDMI VIC 2:  3840x2160   25.000000 Hz  16:9     56.250 kHz    297.000000 MHz
        HDMI VIC 3:  3840x2160   24.000000 Hz  16:9     54.000 kHz    297.000000 MHz
Checksum: 0xf8  Unused space in Extension Block: 98 bytes

----------------

Warnings:

Block 0, Base EDID:
  Detailed Timing Descriptor #1: DTD is identical to VIC 16, which is not present in the CTA Ext Block.
Block 1, CTA-861 Extension Block:
  Add a Colorimetry Data Block with the sRGB colorimetry bit set to avoid interop issues.

Failures:

Block 0, Base EDID:
  Detailed Timing Descriptor #1: Mismatch of image size 698x392 mm vs display size 950x540 mm.
  Display Descriptor #2: Monitor descriptor block has byte 4 nonzero (0x71).
  Dummy Descriptor: Dummy block filled with garbage.
  Empty Descriptor: Use Dummy Descriptor instead of all zeroes.
  Missing Display Range Limits Descriptor.
Block 1, CTA-861 Extension Block:
  Vendor-Specific Data Block (HDMI), OUI 00-0C-03: HDMI VIC Codes must have their CTA-861 VIC equivalents in the VSB.
  Missing VCDB, needed for Set Selectable RGB Quantization to avoid interop issues.
EDID:
  Extension Block 2 started with EDID header, ignoring Extension Blocks >= 2.
  CTA-861: The maximum HDMI TMDS clock is 300000 kHz, but one or more video timings go up to 368759 kHz.

EDID conformity: FAIL
