edid-decode (hex):

00 ff ff ff ff ff ff 00 04 72 9b 00 9e b4 80 84
30 12 01 03 68 35 1d 78 ea 60 85 a6 56 4a 9c 25
12 50 54 af cf 00 81 80 71 4f 95 00 95 0f a9 40
b3 00 b3 0f d1 c0 94 43 80 90 72 38 28 40 80 c8
35 00 13 2a 21 00 00 1c 00 00 00 fc 00 58 32 34
33 48 0a 20 20 20 20 20 20 20 00 00 00 fd 00 38
4c 1f 53 14 00 0a 20 20 20 20 20 20 00 00 00 ff
00 4c 46 48 30 43 30 30 31 34 30 30 30 0a 00 a9

00 ff ff ff ff ff ff 00 04 72 9b 00 9e b4 80 84
30 12 01 03 68 35 1d 78 ea 60 85 a6 56 4a 9c 25
12 50 54 af cf 00 81 80 71 4f 95 00 95 0f a9 40
b3 00 b3 0f d1 c0 94 43 80 90 72 38 28 40 80 c8
35 00 13 2a 21 00 00 1c 00 00 00 fc 00 58 32 34
33 48 0a 20 20 20 20 20 20 20 00 00 00 fd 00 38
4c 1f 53 14 00 0a 20 20 20 20 20 20 00 00 00 ff
00 4c 46 48 30 43 30 30 31 34 30 30 30 0a 00 a9

----------------

Block 0, Base EDID:
  EDID Structure Version & Revision: 1.3
  Vendor & Product Identification:
    Manufacturer: ACR
    Model: 155
    Serial Number: ...
    Made in: week 48 of 2008
  Basic Display Parameters & Features:
    Analog display
    Signal Level Standard: 0.700 : 0.000 : 0.700 V p-p
    Blank level equals black level
    Sync: Separate
    Maximum image size: 53 cm x 29 cm
    Gamma: 2.20
    DPMS levels: Standby Suspend Off
    RGB color display
    First detailed timing is the preferred timing
  Color Characteristics:
    Red  : 0.6494, 0.3378
    Green: 0.2890, 0.6093
    Blue : 0.1464, 0.0703
    White: 0.3134, 0.3291
  Established Timings I & II:
    IBM     :   720x400    70.081663 Hz   9:5     31.467 kHz     28.320000 MHz
    DMT 0x04:   640x480    59.940476 Hz   4:3     31.469 kHz     25.175000 MHz
    DMT 0x05:   640x480    72.808802 Hz   4:3     37.861 kHz     31.500000 MHz
    DMT 0x06:   640x480    75.000000 Hz   4:3     37.500 kHz     31.500000 MHz
    DMT 0x08:   800x600    56.250000 Hz   4:3     35.156 kHz     36.000000 MHz
    DMT 0x09:   800x600    60.316541 Hz   4:3     37.879 kHz     40.000000 MHz
    DMT 0x0a:   800x600    72.187572 Hz   4:3     48.077 kHz     50.000000 MHz
    DMT 0x0b:   800x600    75.000000 Hz   4:3     46.875 kHz     49.500000 MHz
    DMT 0x10:  1024x768    60.003840 Hz   4:3     48.363 kHz     65.000000 MHz
    DMT 0x11:  1024x768    70.069359 Hz   4:3     56.476 kHz     75.000000 MHz
    DMT 0x12:  1024x768    75.028582 Hz   4:3     60.023 kHz     78.750000 MHz
    DMT 0x24:  1280x1024   75.024675 Hz   5:4     79.976 kHz    135.000000 MHz
  Standard Timings:
    DMT 0x23:  1280x1024   60.019740 Hz   5:4     63.981 kHz    108.000000 MHz
    DMT 0x15:  1152x864    75.000000 Hz   4:3     67.500 kHz    108.000000 MHz
    DMT 0x2f:  1440x900    59.887445 Hz  16:10    55.935 kHz    106.500000 MHz
    DMT 0x30:  1440x900    74.984427 Hz  16:10    70.635 kHz    136.750000 MHz
    DMT 0x33:  1600x1200   60.000000 Hz   4:3     75.000 kHz    162.000000 MHz
    DMT 0x3a:  1680x1050   59.954250 Hz  16:10    65.290 kHz    146.250000 MHz
    DMT 0x3b:  1680x1050   74.892027 Hz  16:10    82.306 kHz    187.000000 MHz
    DMT 0x52:  1920x1080   60.000000 Hz  16:9     67.500 kHz    148.500000 MHz
  Detailed Timing Descriptors:
    DTD 1:  1920x1080   59.962844 Hz  16:9     67.158 kHz    173.000000 MHz (531 mm x 298 mm)
                 Hfront  128 Hsync 200 Hback  328 Hpol N
                 Vfront    3 Vsync   5 Vback   32 Vpol P
    Display Product Name: 'X243H'
    Display Range Limits:
      Monitor ranges (GTF): 56-76 Hz V, 31-83 kHz H, max dotclock 200 MHz
    Display Product Serial Number: ...
Checksum: 0xa9

----------------

Failures:

EDID:
  Extension Block 1 started with EDID header, ignoring Extension Blocks >= 1.

EDID conformity: FAIL
