edid-decode (hex):

00 ff ff ff ff ff ff 00 36 04 a6 ae 00 00 00 00
1c 21 01 04 b5 3c 22 78 f9 f4 65 ad 4e 41 a9 27
10 50 54 a5 4b 00 81 80 81 bc 95 00 95 3c b3 00
b3 3c d1 cf 01 01 14 64 00 f0 a0 a0 55 50 30 20
35 00 55 50 21 00 00 1a 00 00 00 fd 0c 30 f0 ff
ff 6e 01 0a 20 20 20 20 20 20 00 00 00 fc 00 34
34 37 31 30 0a 20 20 20 20 20 20 20 00 00 00 ff
00 30 30 30 30 30 30 30 30 30 30 30 30 31 02 57

02 03 30 f1 23 09 07 07 83 01 00 00 47 90 04 03
81 12 3f 61 e2 00 7f e3 05 c0 00 e6 06 07 01 62
5f 00 6d 1a 00 00 02 01 30 f0 00 04 73 21 73 21
02 3a 80 18 71 38 2d 40 58 2c 45 00 55 50 21 00
00 1e 6f c2 00 a0 a0 a0 55 50 30 20 35 00 55 50
21 00 00 1a 38 8b 80 18 71 38 2d 40 30 20 35 00
55 50 21 00 00 1a 52 32 00 a0 50 a0 33 50 30 20
35 00 55 50 21 00 00 1a 00 00 00 00 00 00 00 f3

70 12 79 03 00 03 01 50 f3 7b 01 04 ff 09 9f 00
2f 80 1f 00 9f 05 31 00 02 00 04 00 f7 e3 00 04
ff 09 9f 00 2f 00 3f 00 9f 05 31 00 02 00 04 00
59 0b 01 04 ff 09 9f 00 2f 00 1f 00 9f 05 54 00
02 00 04 00 85 9f 00 04 7f 07 17 01 2f 00 1f 00
37 04 2c 00 02 00 04 00 00 00 00 00 00 00 00 00
00 00 00 00 00 00 00 00 00 00 00 00 00 00 00 00
00 00 00 00 00 00 00 00 00 00 00 00 00 00 b0 90

00 ff ff ff ff ff ff 00 36 04 a6 ae 00 00 00 00
1c 21 01 04 b5 3c 22 78 f9 f4 65 ad 4e 41 a9 27
10 50 54 a5 4b 00 81 80 81 bc 95 00 95 3c b3 00
b3 3c d1 cf 01 01 14 64 00 f0 a0 a0 55 50 30 20
35 00 55 50 21 00 00 1a 00 00 00 fd 0c 30 f0 ff
ff 6e 01 0a 20 20 20 20 20 20 00 00 00 fc 00 34
34 37 31 30 0a 20 20 20 20 20 20 20 00 00 00 ff
00 30 30 30 30 30 30 30 30 30 30 30 30 31 02 57

02 03 30 f1 23 09 07 07 83 01 00 00 47 90 04 03
81 12 3f 61 e2 00 7f e3 05 c0 00 e6 06 07 01 62
5f 00 6d 1a 00 00 02 01 30 f0 00 04 73 21 73 21
02 3a 80 18 71 38 2d 40 58 2c 45 00 55 50 21 00
00 1e 6f c2 00 a0 a0 a0 55 50 30 20 35 00 55 50
21 00 00 1a 38 8b 80 18 71 38 2d 40 30 20 35 00
55 50 21 00 00 1a 52 32 00 a0 50 a0 33 50 30 20
35 00 55 50 21 00 00 1a 00 00 00 00 00 00 00 f3

70 12 79 03 00 03 01 50 f3 7b 01 04 ff 09 9f 00
2f 80 1f 00 9f 05 31 00 02 00 04 00 f7 e3 00 04
ff 09 9f 00 2f 00 3f 00 9f 05 31 00 02 00 04 00
59 0b 01 04 ff 09 9f 00 2f 00 1f 00 9f 05 54 00
02 00 04 00 85 9f 00 04 7f 07 17 01 2f 00 1f 00
37 04 2c 00 02 00 04 00 00 00 00 00 00 00 00 00
00 00 00 00 00 00 00 00 00 00 00 00 00 00 00 00
00 00 00 00 00 00 00 00 00 00 00 00 00 00 b0 90

----------------

Block 0, Base EDID:
  EDID Structure Version & Revision: 1.4
  Vendor & Product Identification:
    Manufacturer: MPD
    Model: 44710
    Made in: week 28 of 2023
  Basic Display Parameters & Features:
    Digital display
    Bits per primary color channel: 10
    DisplayPort interface
    Maximum image size: 60 cm x 34 cm
    Gamma: 2.20
    DPMS levels: Standby Suspend Off
    Supported color formats: RGB 4:4:4, YCrCb 4:4:4, YCrCb 4:2:2
    First detailed timing does not include the native pixel format and preferred refresh rate
    Display supports continuous frequencies
  Color Characteristics:
    Red  : 0.6787, 0.3076
    Green: 0.2548, 0.6601
    Blue : 0.1533, 0.0644
    White: 0.3134, 0.3291
  Established Timings I & II:
    IBM     :   720x400    70.081663 Hz   9:5     31.467 kHz     28.320000 MHz
    DMT 0x04:   640x480    59.940476 Hz   4:3     31.469 kHz     25.175000 MHz
    DMT 0x06:   640x480    75.000000 Hz   4:3     37.500 kHz     31.500000 MHz
    DMT 0x09:   800x600    60.316541 Hz   4:3     37.879 kHz     40.000000 MHz
    DMT 0x0b:   800x600    75.000000 Hz   4:3     46.875 kHz     49.500000 MHz
    DMT 0x10:  1024x768    60.003840 Hz   4:3     48.363 kHz     65.000000 MHz
    DMT 0x12:  1024x768    75.028582 Hz   4:3     60.023 kHz     78.750000 MHz
    DMT 0x24:  1280x1024   75.024675 Hz   5:4     79.976 kHz    135.000000 MHz
  Standard Timings:
    DMT 0x23:  1280x1024   60.019740 Hz   5:4     63.981 kHz    108.000000 MHz
    GTF     :  1280x1024  120.000185 Hz   5:4    131.640 kHz    233.793000 MHz
    DMT 0x2f:  1440x900    59.887445 Hz  16:10    55.935 kHz    106.500000 MHz
    GTF     :  1440x900   119.999896 Hz  16:10   115.800 kHz    229.747000 MHz
    DMT 0x3a:  1680x1050   59.954250 Hz  16:10    65.290 kHz    146.250000 MHz
    GTF     :  1680x1050  120.000000 Hz  16:10   135.000 kHz    313.200000 MHz
    GTF     :  1920x1080   75.000068 Hz  16:9     84.600 kHz    220.637000 MHz
  Detailed Timing Descriptors:
    DTD 1:  2560x1440   60.000000 Hz  16:9     91.500 kHz    256.200000 MHz (597 mm x 336 mm)
                 Hfront   48 Hsync  32 Hback  160 Hpol P
                 Vfront    3 Vsync   5 Vback   77 Vpol N
    Display Range Limits:
      Monitor ranges (Range Limits Only): 48-240 Hz V, 510-510 kHz H, max dotclock 1100 MHz
    Display Product Name: '44710'
    Display Product Serial Number: ...
  Extension blocks: 2
Checksum: 0x57

----------------

Block 1, CTA-861 Extension Block:
  Revision: 3
  Underscans IT Video Formats by default
  Basic audio support
  Supports YCbCr 4:4:4
  Supports YCbCr 4:2:2
  Native detailed modes: 1
  Audio Data Block:
    Linear PCM:
      Max channels: 2
      Supported sample rates (kHz): 48 44.1 32
      Supported sample sizes (bits): 24 20 16
  Speaker Allocation Data Block:
    FL/FR - Front Left/Right
  Video Data Block:
    VIC  16:  1920x1080   60.000000 Hz  16:9     67.500 kHz    148.500000 MHz (native)
    VIC   4:  1280x720    60.000000 Hz  16:9     45.000 kHz     74.250000 MHz
    VIC   3:   720x480    59.940060 Hz  16:9     31.469 kHz     27.000000 MHz
    VIC   1:   640x480    59.940476 Hz   4:3     31.469 kHz     25.175000 MHz (native)
    VIC  18:   720x576    50.000000 Hz  16:9     31.250 kHz     27.000000 MHz
    VIC  63:  1920x1080  120.000000 Hz  16:9    135.000 kHz    297.000000 MHz
    VIC  97:  3840x2160   60.000000 Hz  16:9    135.000 kHz    594.000000 MHz
  Video Capability Data Block:
    YCbCr quantization: No Data
    RGB quantization: Selectable (via AVI Q)
    PT scan behavior: Supports both over- and underscan
    IT scan behavior: Supports both over- and underscan
    CE scan behavior: Supports both over- and underscan
  Colorimetry Data Block:
    BT2020YCC
    BT2020RGB
  HDR Static Metadata Data Block:
    Electro optical transfer functions:
      Traditional gamma - SDR luminance range
      Traditional gamma - HDR luminance range
      SMPTE ST2084
    Supported static metadata descriptors:
      Static metadata type 1
    Desired content max luminance: 98 (417.710 cd/m^2)
    Desired content max frame-average luminance: 95 (391.429 cd/m^2)
    Desired content min luminance: 0 (0.000 cd/m^2)
  Vendor-Specific Data Block (AMD), OUI 00-00-1A:
    Version: 2
    Feature Caps: 0x01
    Minimum Refresh Rate: 48 Hz
    Maximum Refresh Rate: 240 Hz
    Flags 1.x: 0x00
    Flags 2.x: 0x04
    Maximum luminance: 115 (603.666 cd/m^2)
    Minimum luminance: 33 (0.101 cd/m^2)
    Maximum luminance (without local dimming): 115 (603.666 cd/m^2)
    Minimum luminance (without local dimming): 33 (0.101 cd/m^2)
  Detailed Timing Descriptors:
    DTD 2:  1920x1080   60.000000 Hz  16:9     67.500 kHz    148.500000 MHz (597 mm x 336 mm)
                 Hfront   88 Hsync  44 Hback  148 Hpol P
                 Vfront    4 Vsync   5 Vback   36 Vpol P
    DTD 3:  2560x1440  119.997589 Hz  16:9    182.996 kHz    497.750000 MHz (597 mm x 336 mm)
                 Hfront   48 Hsync  32 Hback   80 Hpol P
                 Vfront    3 Vsync   5 Vback   77 Vpol N
    DTD 4:  1920x1080  144.000000 Hz  16:9    162.000 kHz    356.400000 MHz (597 mm x 336 mm)
                 Hfront   48 Hsync  32 Hback  200 Hpol P
                 Vfront    3 Vsync   5 Vback   37 Vpol N
    DTD 5:  1280x1440   59.998882 Hz   8:9     89.458 kHz    128.820000 MHz (597 mm x 336 mm)
                 Hfront   48 Hsync  32 Hback   80 Hpol P
                 Vfront    3 Vsync   5 Vback   43 Vpol N
Checksum: 0xf3  Unused space in Extension Block: 7 bytes

----------------

Block 2, DisplayID Extension Block:
  Version: 1.2
  Extension Count: 0
  Display Product Type: Standalone display device
  Video Timing Modes Type 1 - Detailed Timings Data Block:
    DTD:  2560x1440  240.001974 Hz  16:9    357.603 kHz    972.680000 MHz (aspect 16:9, no 3D stereo)
               Hfront   48 Hsync  32 Hback   80 Hpol P
               Vfront    3 Vsync   5 Vback   42 Vpol N
    DTD:  2560x1440  143.999210 Hz  16:9    214.559 kHz    583.600000 MHz (aspect 16:9, no 3D stereo)
               Hfront   48 Hsync  64 Hback   48 Hpol N
               Vfront    3 Vsync   5 Vback   42 Vpol N
    DTD:  2560x1440  165.000000 Hz  16:9    251.625 kHz    684.420000 MHz (aspect 16:9, no 3D stereo)
               Hfront   48 Hsync  32 Hback   80 Hpol N
               Vfront    3 Vsync   5 Vback   77 Vpol N
    DTD:  1920x1080  165.002020 Hz  16:9    185.627 kHz    408.380000 MHz (aspect 16:9, no 3D stereo)
               Hfront   48 Hsync  32 Hback  200 Hpol N
               Vfront    3 Vsync   5 Vback   37 Vpol N
  Checksum: 0xb0
Checksum: 0x90

----------------

Block 3, Unknown EDID Extension Block 0x00:
  00 ff ff ff ff ff ff 00 36 04 a6 ae 00 00 00 00 '........6.......'
  1c 21 01 04 b5 3c 22 78 f9 f4 65 ad 4e 41 a9 27 '.!...<"x..e.NA.''
  10 50 54 a5 4b 00 81 80 81 bc 95 00 95 3c b3 00 '.PT.K........<..'
  b3 3c d1 cf 01 01 14 64 00 f0 a0 a0 55 50 30 20 '.<.....d....UP0 '
  35 00 55 50 21 00 00 1a 00 00 00 fd 0c 30 f0 ff '5.UP!........0..'
  ff 6e 01 0a 20 20 20 20 20 20 00 00 00 fc 00 34 '.n..      .....4'
  34 37 31 30 0a 20 20 20 20 20 20 20 00 00 00 ff '4710.       ....'
  00 30 30 30 30 30 30 30 30 30 30 30 30 31 02 57 '.0000000000001.W'
Checksum: 0x57

----------------

Block 4, CTA-861 Extension Block:
  Revision: 3
  Underscans IT Video Formats by default
  Basic audio support
  Supports YCbCr 4:4:4
  Supports YCbCr 4:2:2
  Native detailed modes: 1
  Audio Data Block:
    Linear PCM:
      Max channels: 2
      Supported sample rates (kHz): 48 44.1 32
      Supported sample sizes (bits): 24 20 16
  Speaker Allocation Data Block:
    FL/FR - Front Left/Right
  Video Data Block:
    VIC  16:  1920x1080   60.000000 Hz  16:9     67.500 kHz    148.500000 MHz (native)
    VIC   4:  1280x720    60.000000 Hz  16:9     45.000 kHz     74.250000 MHz
    VIC   3:   720x480    59.940060 Hz  16:9     31.469 kHz     27.000000 MHz
    VIC   1:   640x480    59.940476 Hz   4:3     31.469 kHz     25.175000 MHz (native)
    VIC  18:   720x576    50.000000 Hz  16:9     31.250 kHz     27.000000 MHz
    VIC  63:  1920x1080  120.000000 Hz  16:9    135.000 kHz    297.000000 MHz
    VIC  97:  3840x2160   60.000000 Hz  16:9    135.000 kHz    594.000000 MHz
  Video Capability Data Block:
    YCbCr quantization: No Data
    RGB quantization: Selectable (via AVI Q)
    PT scan behavior: Supports both over- and underscan
    IT scan behavior: Supports both over- and underscan
    CE scan behavior: Supports both over- and underscan
  Colorimetry Data Block:
    BT2020YCC
    BT2020RGB
  HDR Static Metadata Data Block:
    Electro optical transfer functions:
      Traditional gamma - SDR luminance range
      Traditional gamma - HDR luminance range
      SMPTE ST2084
    Supported static metadata descriptors:
      Static metadata type 1
    Desired content max luminance: 98 (417.710 cd/m^2)
    Desired content max frame-average luminance: 95 (391.429 cd/m^2)
    Desired content min luminance: 0 (0.000 cd/m^2)
  Vendor-Specific Data Block (AMD), OUI 00-00-1A:
    Version: 2
    Feature Caps: 0x01
    Minimum Refresh Rate: 48 Hz
    Maximum Refresh Rate: 240 Hz
    Flags 1.x: 0x00
    Flags 2.x: 0x04
    Maximum luminance: 115 (603.666 cd/m^2)
    Minimum luminance: 33 (0.101 cd/m^2)
    Maximum luminance (without local dimming): 115 (603.666 cd/m^2)
    Minimum luminance (without local dimming): 33 (0.101 cd/m^2)
  Detailed Timing Descriptors:
    DTD 6:  1920x1080   60.000000 Hz  16:9     67.500 kHz    148.500000 MHz (597 mm x 336 mm)
                 Hfront   88 Hsync  44 Hback  148 Hpol P
                 Vfront    4 Vsync   5 Vback   36 Vpol P
    DTD 7:  2560x1440  119.997589 Hz  16:9    182.996 kHz    497.750000 MHz (597 mm x 336 mm)
                 Hfront   48 Hsync  32 Hback   80 Hpol P
                 Vfront    3 Vsync   5 Vback   77 Vpol N
    DTD 8:  1920x1080  144.000000 Hz  16:9    162.000 kHz    356.400000 MHz (597 mm x 336 mm)
                 Hfront   48 Hsync  32 Hback  200 Hpol P
                 Vfront    3 Vsync   5 Vback   37 Vpol N
    DTD 9:  1280x1440   59.998882 Hz   8:9     89.458 kHz    128.820000 MHz (597 mm x 336 mm)
                 Hfront   48 Hsync  32 Hback   80 Hpol P
                 Vfront    3 Vsync   5 Vback   43 Vpol N
Checksum: 0xf3  Unused space in Extension Block: 7 bytes

----------------

Block 5, DisplayID Extension Block:
  Version: 1.2
  Extension Count: 0
  Video Timing Modes Type 1 - Detailed Timings Data Block:
    DTD:  2560x1440  240.001974 Hz  16:9    357.603 kHz    972.680000 MHz (aspect 16:9, no 3D stereo)
               Hfront   48 Hsync  32 Hback   80 Hpol P
               Vfront    3 Vsync   5 Vback   42 Vpol N
    DTD:  2560x1440  143.999210 Hz  16:9    214.559 kHz    583.600000 MHz (aspect 16:9, no 3D stereo)
               Hfront   48 Hsync  64 Hback   48 Hpol N
               Vfront    3 Vsync   5 Vback   42 Vpol N
    DTD:  2560x1440  165.000000 Hz  16:9    251.625 kHz    684.420000 MHz (aspect 16:9, no 3D stereo)
               Hfront   48 Hsync  32 Hback   80 Hpol N
               Vfront    3 Vsync   5 Vback   77 Vpol N
    DTD:  1920x1080  165.002020 Hz  16:9    185.627 kHz    408.380000 MHz (aspect 16:9, no 3D stereo)
               Hfront   48 Hsync  32 Hback  200 Hpol N
               Vfront    3 Vsync   5 Vback   37 Vpol N
  Checksum: 0xb0
Checksum: 0x90

----------------

Warnings:

Block 0, Base EDID:
  Display Product Serial Number: ...
Block 1, CTA-861 Extension Block:
  Video Data Block: VIC 16 and the first DTD are not identical. Is this intended?
  Video Capability Data Block: Set Selectable YCbCr Quantization to avoid interop issues.
  Video Capability Data Block: S_PT is equal to S_IT and S_CE, so should be set to 0 instead.
  Colorimetry Data Block: Set the sRGB colorimetry bit to avoid interop issues.
  Detailed Timing Descriptor #5: Image size is 597x336 mm, but based on the picture AR it should be 597x671 mm.
Block 4, CTA-861 Extension Block:
  Video Capability Data Block: Set Selectable YCbCr Quantization to avoid interop issues.
  Video Capability Data Block: S_PT is equal to S_IT and S_CE, so should be set to 0 instead.
  Colorimetry Data Block: Set the sRGB colorimetry bit to avoid interop issues.
  Detailed Timing Descriptor #9: Image size is 597x336 mm, but based on the picture AR it should be 597x671 mm.
EDID:
  Base EDID: Some timings are out of range of the Monitor Ranges:
    Horizontal Freq: 31.250 - 357.602 kHz (Monitor: 510.000 - 510.000 kHz)

Failures:

Block 2, DisplayID Extension Block:
  Expected 0 DisplayID Extension Block, but got 1.
Block 3, Base EDID:
  Unknown Extension Block.
Block 4, CTA-861 Extension Block:
  Speaker Allocation Data Block: Only one instance of this Data Block is allowed.
  Video Data Block: Duplicate VIC 16.
  Video Data Block: Duplicate VIC 4.
  Video Data Block: Duplicate VIC 3.
  Video Data Block: Duplicate VIC 1.
  Video Data Block: Duplicate VIC 18.
  Video Data Block: Duplicate VIC 63.
  Video Data Block: Duplicate VIC 97.
  Video Capability Data Block: Only one instance of this Data Block is allowed.
  Colorimetry Data Block: Only one instance of this Data Block is allowed.
  HDR Static Metadata Data Block: Only one instance of this Data Block is allowed.
Block 5, DisplayID Extension Block:
  Product Type should be 0 in extension block.
EDID:
  Base EDID: EDID specified 2 extension block(s), but found 5 extension block(s).
  CTA-861: Native progressive timings are a mix of several resolutions.
  DisplayID: Missing DisplayID Display Parameters Data Block.
  DisplayID: DisplayID expects at least one preferred timing.

EDID conformity: FAIL
