edid-decode (hex):

00 ff ff ff ff ff ff 00 09 e5 86 36 0f 00 00 00
01 1e 01 04 a5 3c 21 ff 2f 00 00 a0 57 49 9b 26
10 48 4f 00 00 00 01 01 01 01 01 01 01 01 01 01
01 01 01 01 01 01 02 3a 80 18 71 38 2d 40 58 2d
36 00 12 22 21 00 00 1e 00 00 00 fc 00 00 0a 20
20 20 20 20 20 20 20 20 20 20 00 00 00 fd 00 3c
3c ac ac 0f 00 0a 20 20 20 20 20 20 00 00 00 00
00 00 00 00 00 00 00 00 00 00 00 00 00 00 00 1d

00 ff ff ff ff ff ff 00 09 e5 86 36 0f 00 00 00
01 1e 01 04 a5 3c 21 ff 2f 00 00 a0 57 49 9b 26
10 48 4f 00 00 00 01 01 01 01 01 01 01 01 01 01
01 01 01 01 01 01 02 3a 80 18 71 38 2d 40 58 2d
36 00 12 22 21 00 00 1e 00 00 00 fc 00 00 0a 20
20 20 20 20 20 20 20 20 20 20 00 00 00 fd 00 3c
3c ac ac 0f 00 0a 20 20 20 20 20 20 00 00 00 00
00 00 00 00 00 00 00 00 00 00 00 00 00 00 00 1d

----------------

Block 0, Base EDID:
  EDID Structure Version & Revision: 1.4
  Vendor & Product Identification:
    Manufacturer: BOE
    Model: 13958
    Serial Number: ...
    Made in: week 1 of 2020
  Basic Display Parameters & Features:
    Digital display
    Bits per primary color channel: 8
    DisplayPort interface
    Maximum image size: 60 cm x 33 cm
    Gamma is defined in an extension block
    DPMS levels: Off
    Supported color formats: RGB 4:4:4, YCrCb 4:4:4
    Default (sRGB) color space is primary color space
    First detailed timing includes the native pixel format and preferred refresh rate
    Display supports continuous frequencies
  Color Characteristics:
    Red  : 0.6250, 0.3398
    Green: 0.2851, 0.6054
    Blue : 0.1484, 0.0625
    White: 0.2812, 0.3085
  Established Timings I & II: none
  Standard Timings: none
  Detailed Timing Descriptors:
    DTD 1:  1920x1080   60.000000 Hz  16:9     67.500 kHz    148.500000 MHz (530 mm x 290 mm)
                 Hfront   88 Hsync  45 Hback  147 Hpol P
                 Vfront    3 Vsync   6 Vback   36 Vpol P
    Display Product Name: ''
    Display Range Limits:
      Monitor ranges (GTF): 60-60 Hz V, 172-172 kHz H, max dotclock 150 MHz
    Empty Descriptor
Checksum: 0x1d

----------------

Warnings:

Block 0, Base EDID:
  Basic Display Parameters & Features: sRGB is signaled, but the gamma != 2.2.
  Detailed Timing Descriptor #1: DTD is similar but not identical to VIC 16.
  Display Range Limits: GTF support is deprecated in EDID 1.4.
EDID:
  Base EDID: Some timings are out of range of the Monitor Ranges:
    Horizontal Freq: 67.500 - 67.500 kHz (Monitor: 172.000 - 172.000 kHz)

Failures:

Block 0, Base EDID:
  Basic Display Parameters & Features: sRGB is signaled, but the chromaticities do not match.
  Detailed Timing Descriptor #1: Mismatch of image size 530x290 mm vs display size 600x330 mm.
  Display Product Name: NUL byte at position 0.
  Empty Descriptor: Use Dummy Descriptor instead of all zeroes.
EDID:
  Extension Block 1 started with EDID header, ignoring Extension Blocks >= 1.

EDID conformity: FAIL
