edid-decode (hex):

00 ff ff ff ff ff ff 00 0d af 62 14 00 00 00 00
12 14 01 04 95 1e 13 78 02 87 f5 94 57 4f 8c 27
27 50 54 00 00 00 01 01 01 01 01 01 01 01 01 01
01 01 01 01 01 01 e4 1a 00 72 50 20 17 30 30 20
36 00 2f bd 10 00 00 1a ed 11 00 72 50 20 17 30
30 20 36 00 2f bd 10 00 00 1a 00 00 00 fe 00 4a
58 43 4e 38 80 4e 31 34 31 49 36 0a 00 00 00 00
00 00 41 31 16 00 00 00 00 09 01 0a 20 20 00 6d

----------------

Block 0, Base EDID:
  EDID Structure Version & Revision: 1.4
  Vendor & Product Identification:
    Manufacturer: CMO
    Model: 5218
    Made in: week 18 of 2010
  Basic Display Parameters & Features:
    Digital display
    Bits per primary color channel: 6
    DisplayPort interface
    Maximum image size: 30 cm x 19 cm
    Gamma: 2.20
    Supported color formats: RGB 4:4:4
    First detailed timing includes the native pixel format and preferred refresh rate
  Color Characteristics:
    Red  : 0.5800, 0.3398
    Green: 0.3095, 0.5498
    Blue : 0.1552, 0.1552
    White: 0.3134, 0.3291
  Established Timings I & II: none
  Standard Timings: none
  Detailed Timing Descriptors:
    DTD 1:  1280x800    60.003731 Hz  16:10    49.383 kHz     68.840000 MHz (303 mm x 189 mm)
                 Hfront   48 Hsync  32 Hback   34 Hpol P
                 Vfront    3 Vsync   6 Vback   14 Vpol N
    DTD 2:  1280x800    39.999582 Hz  16:10    32.920 kHz     45.890000 MHz (303 mm x 189 mm)
                 Hfront   48 Hsync  32 Hback   34 Hpol P
                 Vfront    3 Vsync   6 Vback   14 Vpol N
    Alphanumeric Data String: 'JXCN8.N141I6'
    Manufacturer-Specified Display Descriptor (0x00): 00 00 00 00 41 31 16 00 00 00 00 09 01 0a 20 20 '....A1........  '
Checksum: 0x6d

----------------

Warnings:

Block 0, Base EDID:
  Alphanumeric Data String: Non-ASCII character 0x80 at position 5, can cause problems.
  Missing Display Product Name.

EDID conformity: PASS
