edid-decode (hex):

00 ff ff ff ff ff ff 00 4c 23 53 27 00 00 00 00
27 22 01 03 80 3c 21 78 2a a7 95 ad 4f 44 a9 25
0e 50 54 25 4b 00 d1 cf 81 c0 81 80 95 00 a9 c0
b3 00 d1 c0 d1 00 6a 5e 00 a0 a0 a0 29 50 30 20
35 00 55 50 21 00 00 1a 00 00 00 fd 00 30 4b 1e
91 28 00 0a 20 20 20 20 20 20 00 00 00 fc 00 32
37 50 35 30 31 51 0a 20 20 20 20 20 02 3a 80 18
71 38 2d 40 30 20 45 00 55 50 21 00 00 1e 01 a7

02 03 3e f1 4d 90 05 04 03 02 01 1f 13 12 11 dc
dc dc 23 09 07 07 83 01 00 00 67 03 0c 00 10 00
38 50 67 d8 5d c4 01 50 c0 01 e6 06 05 01 62 62
00 e3 05 c3 01 68 1a 00 00 01 01 30 4b e6 6a 5e
00 a0 a0 a0 29 50 30 20 35 00 55 50 21 00 00 1a
04 76 00 a0 a0 a0 29 50 30 20 35 00 55 50 21 00
00 1a ad 4e 00 a0 a0 a0 29 50 30 2a 35 00 55 50
21 00 00 1a 00 00 00 00 00 00 00 00 00 00 00 f1

00 ff ff ff ff ff ff 00 4c 23 53 27 00 00 00 00
27 22 01 03 80 3c 21 78 2a a7 95 ad 4f 44 a9 25
0e 50 54 25 4b 00 d1 cf 81 c0 81 80 95 00 a9 c0
b3 00 d1 c0 d1 00 6a 5e 00 a0 a0 a0 29 50 30 20
35 00 55 50 21 00 00 1a 00 00 00 fd 00 30 4b 1e
91 28 00 0a 20 20 20 20 20 20 00 00 00 fc 00 32
37 50 35 30 31 51 0a 20 20 20 20 20 02 3a 80 18
71 38 2d 40 30 20 45 00 55 50 21 00 00 1e 01 a7

02 03 3e f1 4d 90 05 04 03 02 01 1f 13 12 11 dc
dc dc 23 09 07 07 83 01 00 00 67 03 0c 00 10 00
38 50 67 d8 5d c4 01 50 c0 01 e6 06 05 01 62 62
00 e3 05 c3 01 68 1a 00 00 01 01 30 4b e6 6a 5e
00 a0 a0 a0 29 50 30 20 35 00 55 50 21 00 00 1a
04 76 00 a0 a0 a0 29 50 30 20 35 00 55 50 21 00
00 1a ad 4e 00 a0 a0 a0 29 50 30 2a 35 00 55 50
21 00 00 1a 00 00 00 00 00 00 00 00 00 00 00 f1

----------------

Block 0, Base EDID:
  EDID Structure Version & Revision: 1.3
  Vendor & Product Identification:
    Manufacturer: SAC
    Model: 10067
    Made in: week 39 of 2024
  Basic Display Parameters & Features:
    Digital display
    Maximum image size: 60 cm x 33 cm
    Gamma: 2.20
    DPMS levels: Off
    RGB color display
    First detailed timing is the preferred timing
  Color Characteristics:
    Red  : 0.6777, 0.3105
    Green: 0.2666, 0.6630
    Blue : 0.1464, 0.0556
    White: 0.3134, 0.3291
  Established Timings I & II:
    DMT 0x04:   640x480    59.940476 Hz   4:3     31.469 kHz     25.175000 MHz
    DMT 0x06:   640x480    75.000000 Hz   4:3     37.500 kHz     31.500000 MHz
    DMT 0x09:   800x600    60.316541 Hz   4:3     37.879 kHz     40.000000 MHz
    DMT 0x0b:   800x600    75.000000 Hz   4:3     46.875 kHz     49.500000 MHz
    DMT 0x10:  1024x768    60.003840 Hz   4:3     48.363 kHz     65.000000 MHz
    DMT 0x12:  1024x768    75.028582 Hz   4:3     60.023 kHz     78.750000 MHz
    DMT 0x24:  1280x1024   75.024675 Hz   5:4     79.976 kHz    135.000000 MHz
  Standard Timings:
    GTF     :  1920x1080   75.000068 Hz  16:9     84.600 kHz    220.637000 MHz
    DMT 0x55:  1280x720    60.000000 Hz  16:9     45.000 kHz     74.250000 MHz
    DMT 0x23:  1280x1024   60.019740 Hz   5:4     63.981 kHz    108.000000 MHz
    DMT 0x2f:  1440x900    59.887445 Hz  16:10    55.935 kHz    106.500000 MHz
    DMT 0x53:  1600x900    60.000000 Hz  16:9     60.000 kHz    108.000000 MHz (RB)
    DMT 0x3a:  1680x1050   59.954250 Hz  16:10    65.290 kHz    146.250000 MHz
    DMT 0x52:  1920x1080   60.000000 Hz  16:9     67.500 kHz    148.500000 MHz
    DMT 0x45:  1920x1200   59.884600 Hz  16:10    74.556 kHz    193.250000 MHz
  Detailed Timing Descriptors:
    DTD 1:  2560x1440   60.000199 Hz  16:9     88.860 kHz    241.700000 MHz (597 mm x 336 mm)
                 Hfront   48 Hsync  32 Hback   80 Hpol P
                 Vfront    3 Vsync   5 Vback   33 Vpol N
    Display Range Limits:
      Monitor ranges (GTF): 48-75 Hz V, 30-145 kHz H, max dotclock 400 MHz
    Display Product Name: '27P501Q'
    DTD 2:  1920x1080   60.000000 Hz  16:9     67.500 kHz    148.500000 MHz (597 mm x 336 mm)
                 Hfront   48 Hsync  32 Hback  200 Hpol P
                 Vfront    4 Vsync   5 Vback   36 Vpol P
  Extension blocks: 1
Checksum: 0xa7

----------------

Block 1, CTA-861 Extension Block:
  Revision: 3
  Underscans IT Video Formats by default
  Basic audio support
  Supports YCbCr 4:4:4
  Supports YCbCr 4:2:2
  Native DTDs: 1
  Video Data Block:
    VIC  16:  1920x1080   60.000000 Hz  16:9     67.500 kHz    148.500000 MHz (native)
    VIC   5:  1920x1080i  60.000000 Hz  16:9     33.750 kHz     74.250000 MHz
    VIC   4:  1280x720    60.000000 Hz  16:9     45.000 kHz     74.250000 MHz
    VIC   3:   720x480    59.940060 Hz  16:9     31.469 kHz     27.000000 MHz
    VIC   2:   720x480    59.940060 Hz   4:3     31.469 kHz     27.000000 MHz
    VIC   1:   640x480    59.940476 Hz   4:3     31.469 kHz     25.175000 MHz
    VIC  31:  1920x1080   50.000000 Hz  16:9     56.250 kHz    148.500000 MHz
    VIC  19:  1280x720    50.000000 Hz  16:9     37.500 kHz     74.250000 MHz
    VIC  18:   720x576    50.000000 Hz  16:9     31.250 kHz     27.000000 MHz
    VIC  17:   720x576    50.000000 Hz   4:3     31.250 kHz     27.000000 MHz
    Unknown (VIC 220)
    Unknown (VIC 220)
    Unknown (VIC 220)
  Audio Data Block:
    Linear PCM:
      Max channels: 2
      Supported sample rates (kHz): 48 44.1 32
      Supported sample sizes (bits): 24 20 16
  Speaker Allocation Data Block:
    FL/FR - Front Left/Right
  Vendor-Specific Data Block (HDMI), OUI 00-0C-03:
    Source physical address: 1.0.0.0
    DC_36bit
    DC_30bit
    DC_Y444
    Maximum TMDS clock: 400 MHz
  Vendor-Specific Data Block (HDMI Forum), OUI C4-5D-D8:
    Version: 1
    Maximum TMDS Character Rate: 400 MHz
    SCDC Present
    SCDC Read Request Capable
    Supports 10-bits/component Deep Color 4:2:0 Pixel Encoding
  HDR Static Metadata Data Block:
    Electro optical transfer functions:
      Traditional gamma - SDR luminance range
      SMPTE ST2084
    Supported static metadata descriptors:
      Static metadata type 1
    Desired content max luminance: 98 (417.710 cd/m^2)
    Desired content max frame-average luminance: 98 (417.710 cd/m^2)
    Desired content min luminance: 0 (0.000 cd/m^2)
  Colorimetry Data Block:
    xvYCC601
    xvYCC709
    BT2020YCC
    BT2020RGB
    Gamut Boundary Description Metadata Profile P0
  Vendor-Specific Data Block (AMD), OUI 00-00-1A:
    Version: 1
    Flags 1: 0x01
      FreeSync Supported
    Minimum Refresh Rate: 48 Hz
    Maximum Refresh Rate: 75 Hz
    MCCS VCP Code: 0xe6
  Detailed Timing Descriptors:
    DTD 3:  2560x1440   60.000199 Hz  16:9     88.860 kHz    241.700000 MHz (597 mm x 336 mm)
                 Hfront   48 Hsync  32 Hback   80 Hpol P
                 Vfront    3 Vsync   5 Vback   33 Vpol N
    DTD 4:  2560x1440   74.999007 Hz  16:9    111.074 kHz    302.120000 MHz (597 mm x 336 mm)
                 Hfront   48 Hsync  32 Hback   80 Hpol P
                 Vfront    3 Vsync   5 Vback   33 Vpol N
    DTD 5:  2560x1440   49.998511 Hz  16:9     74.048 kHz    201.410000 MHz (597 mm x 336 mm)
                 Hfront   48 Hsync  42 Hback   70 Hpol P
                 Vfront    3 Vsync   5 Vback   33 Vpol N
Checksum: 0xf1  Unused space in Extension Block: 11 bytes

----------------

Warnings:

Block 0, Base EDID:
  Detailed Timing Descriptor #2: DTD is similar but not identical to VIC 16.
Block 1, CTA-861 Extension Block:
  Video Data Block: VIC 16 and the first DTD are not identical. Is this intended?
  Colorimetry Data Block: Set the sRGB colorimetry bit to avoid interop issues.

Failures:

Block 0, Base EDID:
  Detailed Timing Descriptor #2: Invalid detailed timing descriptor ordering.
Block 1, CTA-861 Extension Block:
  Video Data Block: Unknown VIC 220.
  Video Data Block: Unknown VIC 220.
  Video Data Block: Duplicate VIC 220.
  Video Data Block: Unknown VIC 220.
  Vendor-Specific Data Block (HDMI), OUI 00-0C-03: HDMI VSDB Max TMDS rate is > 340.
  Missing VCDB, needed for Set Selectable RGB Quantization to avoid interop issues.
EDID:
  Extension Block 2 started with EDID header, ignoring Extension Blocks >= 2.
  CTA-861: Native progressive timings are a mix of several resolutions.

EDID conformity: FAIL
