edid-decode (hex):

00 ff ff ff ff ff ff 00 4c ab 00 00 01 00 00 00
23 17 01 03 81 6e 3e 78 8a a5 8e a6 54 4a 9c 26
12 45 46 ad ce 00 81 40 01 01 01 01 01 01 01 01
01 01 01 01 01 01 04 74 00 30 f2 70 5a 80 b0 58
8a 00 ba 89 21 00 00 1e 9a 29 a0 d0 51 84 22 30
50 98 36 00 b9 88 21 00 00 1c 00 00 00 fd 00 32
4b 18 3c 0b 00 0a 20 20 20 20 20 20 00 00 00 fc
00 53 45 35 30 55 59 30 34 0a 20 20 20 20 01 5a

02 03 2a 71 4f 06 07 02 03 15 96 11 12 13 04 14
05 1f 90 20 23 09 07 07 83 01 00 00 6d 03 0c 00
20 00 08 3c 20 40 68 01 02 03 8c 0a d0 90 20 40
31 20 0c 40 55 00 b9 88 21 00 00 18 01 1d 80 18
71 1c 16 20 58 2c 25 00 b9 88 21 00 00 9e 01 1d
80 d0 72 1c 16 20 10 2c 25 80 b9 88 21 00 00 9e
01 1d 00 bc 52 d0 1e 20 b8 28 55 40 b9 88 21 00
00 1e 00 00 00 00 00 00 00 00 00 00 00 00 00 a0

----------------

Block 0, Base EDID:
  EDID Structure Version & Revision: 1.3
  Vendor & Product Identification:
    Manufacturer: SEK
    Model: 0
    Serial Number: ...
    Made in: week 35 of 2013
  Basic Display Parameters & Features:
    Digital display
    DFP 1.x compatible TMDS
    Maximum image size: 110 cm x 62 cm
    Gamma: 2.20
    DPMS levels: Standby
    RGB color display
    First detailed timing is the preferred timing
  Color Characteristics:
    Red  : 0.6503, 0.3300
    Green: 0.2900, 0.6103
    Blue : 0.1503, 0.0703
    White: 0.2724, 0.2753
  Established Timings I & II:
    IBM     :   720x400    70.081663 Hz   9:5     31.467 kHz     28.320000 MHz
    DMT 0x04:   640x480    59.940476 Hz   4:3     31.469 kHz     25.175000 MHz
    DMT 0x05:   640x480    72.808802 Hz   4:3     37.861 kHz     31.500000 MHz
    DMT 0x06:   640x480    75.000000 Hz   4:3     37.500 kHz     31.500000 MHz
    DMT 0x09:   800x600    60.316541 Hz   4:3     37.879 kHz     40.000000 MHz
    DMT 0x0a:   800x600    72.187572 Hz   4:3     48.077 kHz     50.000000 MHz
    DMT 0x0b:   800x600    75.000000 Hz   4:3     46.875 kHz     49.500000 MHz
    DMT 0x10:  1024x768    60.003840 Hz   4:3     48.363 kHz     65.000000 MHz
    DMT 0x11:  1024x768    70.069359 Hz   4:3     56.476 kHz     75.000000 MHz
    DMT 0x12:  1024x768    75.028582 Hz   4:3     60.023 kHz     78.750000 MHz
  Standard Timings:
    DMT 0x20:  1280x960    60.000000 Hz   4:3     60.000 kHz    108.000000 MHz
  Detailed Timing Descriptors:
    DTD 1:  3840x2160   30.000000 Hz  16:9     67.500 kHz    297.000000 MHz (698 mm x 393 mm)
                 Hfront  176 Hsync  88 Hback  296 Hpol P
                 Vfront    8 Vsync  10 Vback   72 Vpol P
    DTD 2:  1440x900    59.887445 Hz  16:10    55.935 kHz    106.500000 MHz (697 mm x 392 mm)
                 Hfront   80 Hsync 152 Hback  232 Hpol N
                 Vfront    3 Vsync   6 Vback   25 Vpol P
    Display Range Limits:
      Monitor ranges (GTF): 50-75 Hz V, 24-60 kHz H, max dotclock 110 MHz
    Display Product Name: 'SE50UY04'
  Extension blocks: 1
Checksum: 0x5a

----------------

Block 1, CTA-861 Extension Block:
  Revision: 3
  Basic audio support
  Supports YCbCr 4:4:4
  Supports YCbCr 4:2:2
  Native detailed modes: 1
  Video Data Block:
    VIC   6:  1440x480i   59.940060 Hz   4:3     15.734 kHz     27.000000 MHz
    VIC   7:  1440x480i   59.940060 Hz  16:9     15.734 kHz     27.000000 MHz
    VIC   2:   720x480    59.940060 Hz   4:3     31.469 kHz     27.000000 MHz
    VIC   3:   720x480    59.940060 Hz  16:9     31.469 kHz     27.000000 MHz
    VIC  21:  1440x576i   50.000000 Hz   4:3     15.625 kHz     27.000000 MHz
    VIC  22:  1440x576i   50.000000 Hz  16:9     15.625 kHz     27.000000 MHz (native)
    VIC  17:   720x576    50.000000 Hz   4:3     31.250 kHz     27.000000 MHz
    VIC  18:   720x576    50.000000 Hz  16:9     31.250 kHz     27.000000 MHz
    VIC  19:  1280x720    50.000000 Hz  16:9     37.500 kHz     74.250000 MHz
    VIC   4:  1280x720    60.000000 Hz  16:9     45.000 kHz     74.250000 MHz
    VIC  20:  1920x1080i  50.000000 Hz  16:9     28.125 kHz     74.250000 MHz
    VIC   5:  1920x1080i  60.000000 Hz  16:9     33.750 kHz     74.250000 MHz
    VIC  31:  1920x1080   50.000000 Hz  16:9     56.250 kHz    148.500000 MHz
    VIC  16:  1920x1080   60.000000 Hz  16:9     67.500 kHz    148.500000 MHz (native)
    VIC  32:  1920x1080   24.000000 Hz  16:9     27.000 kHz     74.250000 MHz
  Audio Data Block:
    Linear PCM:
      Max channels: 2
      Supported sample rates (kHz): 48 44.1 32
      Supported sample sizes (bits): 24 20 16
  Speaker Allocation Data Block:
    FL/FR - Front Left/Right
  Vendor-Specific Data Block (HDMI), OUI 00-0C-03:
    Source physical address: 2.0.0.0
    DC_Y444
    Maximum TMDS clock: 300 MHz
    Extended HDMI video details:
      3D-capable-VIC mask present
      HDMI VICs:
        HDMI VIC 1:  3840x2160   30.000000 Hz  16:9     67.500 kHz    297.000000 MHz
        HDMI VIC 2:  3840x2160   25.000000 Hz  16:9     56.250 kHz    297.000000 MHz
        HDMI VIC 3:  3840x2160   24.000000 Hz  16:9     54.000 kHz    297.000000 MHz
      3D: Side-by-side (half, quincunx)
      3D: Side-by-side (full)
      3D: Field-alternative
      3D VIC indices that support these capabilities:
        VIC  21:  1440x576i   50.000000 Hz   4:3     15.625 kHz     27.000000 MHz
        VIC  18:   720x576    50.000000 Hz  16:9     31.250 kHz     27.000000 MHz
        VIC  31:  1920x1080   50.000000 Hz  16:9     56.250 kHz    148.500000 MHz
        VIC  32:  1920x1080   24.000000 Hz  16:9     27.000 kHz     74.250000 MHz
        SVD Index 16 is out of range
      3D VIC indices with specific capabilities:
        VIC   2:   720x480    59.940060 Hz   4:3     31.469 kHz     27.000000 MHz (frame packing)
        VIC  21:  1440x576i   50.000000 Hz   4:3     15.625 kHz     27.000000 MHz (frame packing)
        VIC   3:   720x480    59.940060 Hz  16:9     31.469 kHz     27.000000 MHz (field alternative)
        VIC   2:   720x480    59.940060 Hz   4:3     31.469 kHz     27.000000 MHz (frame packing)
  Detailed Timing Descriptors:
    DTD 3:   720x576    50.000000 Hz   5:4     31.250 kHz     27.000000 MHz (697 mm x 392 mm)
                 Hfront   12 Hsync  64 Hback   68 Hpol N
                 Vfront    5 Vsync   5 Vback   39 Vpol N
    DTD 4:  1920x1080i  60.000000 Hz  16:9     33.750 kHz     74.250000 MHz (697 mm x 392 mm)
                 Hfront   88 Hsync  44 Hback  148 Hpol P
                 Vfront    2 Vsync   5 Vback   15 Vpol P Vfront +0.5 Odd Field
                 Vfront    2 Vsync   5 Vback   15 Vpol P Vback  +0.5 Even Field
    DTD 5:  1920x1080i  50.000000 Hz  16:9     28.125 kHz     74.250000 MHz (697 mm x 392 mm)
                 Hfront  528 Hsync  44 Hback  148 Hpol P
                 Vfront    2 Vsync   5 Vback   15 Vpol P Vfront +0.5 Odd Field
                 Vfront    2 Vsync   5 Vback   15 Vpol P Vback  +0.5 Even Field
    DTD 6:  1280x720    50.000000 Hz  16:9     37.500 kHz     74.250000 MHz (697 mm x 392 mm)
                 Hfront  440 Hsync  40 Hback  220 Hpol P
                 Vfront    5 Vsync   5 Vback   20 Vpol P
Checksum: 0xa0  Unused space in Extension Block: 13 bytes

----------------

Warnings:

Block 0, Base EDID:
  Vendor & Product Identification: The serial number is one of the known dummy values, it should probably be set to 0.
  Detailed Timing Descriptor #1: DTD is identical to VIC 95, which is not present in the CTA Ext Block.
  Detailed Timing Descriptor #2: Image size is 697x392 mm, but based on the picture AR it should be 697x435 mm.
Block 1, CTA-861 Extension Block:
  IT Video Formats are overscanned by default, but normally this should be underscanned.
  Video Data Block: VIC 6 and the first DTD are not identical. Is this intended?
  Detailed Timing Descriptor #3: Image size is 697x392 mm, but based on the picture AR it should be 697x557 mm.
  Add a Colorimetry Data Block with the sRGB colorimetry bit set to avoid interop issues.
EDID:
  Base EDID: Some timings are out of range of the Monitor Ranges:
    Vertical Freq: 24.000 - 75.029 Hz (Monitor: 50.000 - 75.000 Hz)
    Horizontal Freq: 15.625 - 67.500 kHz (Monitor: 24.000 - 60.000 kHz)
    Maximum Clock: 297.000 MHz (Monitor: 110.000 MHz)

Failures:

Block 0, Base EDID:
  Detailed Timing Descriptor #1: Mismatch of image size 698x393 mm vs display size 1100x620 mm.
  Detailed Timing Descriptor #2: Mismatch of image size 697x392 mm vs display size 1100x620 mm.
Block 1, CTA-861 Extension Block:
  Vendor-Specific Data Block (HDMI), OUI 00-0C-03: HDMI VIC Codes must have their CTA-861 VIC equivalents in the VSB.
  Vendor-Specific Data Block (HDMI), OUI 00-0C-03: HDMI 3D VIC indices max index 16 > 15 (#SVDs).
  Detailed Timing Descriptor #3: Mismatch of image size 697x392 mm vs display size 1100x620 mm.
  Detailed Timing Descriptor #4: Mismatch of image size 697x392 mm vs display size 1100x620 mm.
  Detailed Timing Descriptor #5: Mismatch of image size 697x392 mm vs display size 1100x620 mm.
  Detailed Timing Descriptor #6: Mismatch of image size 697x392 mm vs display size 1100x620 mm.
  Missing VCDB, needed for Set Selectable RGB Quantization to avoid interop issues.
EDID:
  CTA-861: Native progressive timings are a mix of several resolutions.

EDID conformity: FAIL
