edid-decode (hex):

00 ff ff ff ff ff ff 00 4c ab 00 00 00 00 00 00
23 18 01 03 80 56 34 00 8a ee 95 a3 54 4c 99 26
0f 50 54 a5 4e 00 01 01 01 01 01 01 01 01 01 01
01 01 01 01 01 01 04 74 00 30 f2 70 5a 80 b0 58
8a 00 44 17 74 00 00 1e 00 00 00 fd 00 18 55 0f
50 10 00 0a 20 20 20 20 20 20 00 00 00 fc 00 53
45 33 39 55 41 30 31 55 4b 0a 20 20 00 00 00 00
00 00 00 00 00 00 00 00 00 00 00 00 00 00 01 19

02 03 31 71 52 90 05 04 02 03 06 07 11 12 13 14
15 16 1f 01 20 21 22 26 09 07 07 15 07 24 83 01
00 00 6e 03 0c 00 10 00 38 44 20 00 80 01 02 03
00 02 3a 80 18 71 38 2d 40 58 2c 45 00 70 ea 31
00 00 1e 01 1d 80 18 71 1c 16 20 58 2c 25 00 f4
19 11 00 00 9e 8c 0a d0 8a 20 e0 2d 10 10 3a 96
00 58 c2 21 00 00 18 8c 0a d0 8a 20 e0 2d 10 10
3e 96 00 20 c2 31 00 00 18 00 00 00 00 00 00 de

00 ff ff ff ff ff ff 00 4c ab 00 00 00 00 00 00
23 18 01 03 80 56 34 00 8a ee 95 a3 54 4c 99 26
0f 50 54 a5 4e 00 01 01 01 01 01 01 01 01 01 01
01 01 01 01 01 01 04 74 00 30 f2 70 5a 80 b0 58
8a 00 44 17 74 00 00 1e 00 00 00 fd 00 18 55 0f
50 10 00 0a 20 20 20 20 20 20 00 00 00 fc 00 53
45 33 39 55 41 30 31 55 4b 0a 20 20 00 00 00 00
00 00 00 00 00 00 00 00 00 00 00 00 00 00 01 19

02 03 31 71 52 90 05 04 02 03 06 07 11 12 13 14
15 16 1f 01 20 21 22 26 09 07 07 15 07 24 83 01
00 00 6e 03 0c 00 10 00 38 44 20 00 80 01 02 03
00 02 3a 80 18 71 38 2d 40 58 2c 45 00 70 ea 31
00 00 1e 01 1d 80 18 71 1c 16 20 58 2c 25 00 f4
19 11 00 00 9e 8c 0a d0 8a 20 e0 2d 10 10 3a 96
00 58 c2 21 00 00 18 8c 0a d0 8a 20 e0 2d 10 10
3e 96 00 20 c2 31 00 00 18 00 00 00 00 00 00 de

----------------

Block 0, Base EDID:
  EDID Structure Version & Revision: 1.3
  Vendor & Product Identification:
    Manufacturer: SEK
    Model: 0
    Made in: week 35 of 2014
  Basic Display Parameters & Features:
    Digital display
    Maximum image size: 86 cm x 52 cm
    Gamma: 1.00
    DPMS levels: Standby
    RGB color display
    First detailed timing is the preferred timing
  Color Characteristics:
    Red  : 0.6396, 0.3300
    Green: 0.2998, 0.5996
    Blue : 0.1503, 0.0595
    White: 0.3134, 0.3291
  Established Timings I & II:
    IBM     :   720x400    70.081663 Hz   9:5     31.467 kHz     28.320000 MHz
    DMT 0x04:   640x480    59.940476 Hz   4:3     31.469 kHz     25.175000 MHz
    DMT 0x06:   640x480    75.000000 Hz   4:3     37.500 kHz     31.500000 MHz
    DMT 0x09:   800x600    60.316541 Hz   4:3     37.879 kHz     40.000000 MHz
    DMT 0x0b:   800x600    75.000000 Hz   4:3     46.875 kHz     49.500000 MHz
    DMT 0x10:  1024x768    60.003840 Hz   4:3     48.363 kHz     65.000000 MHz
    DMT 0x11:  1024x768    70.069359 Hz   4:3     56.476 kHz     75.000000 MHz
    DMT 0x12:  1024x768    75.028582 Hz   4:3     60.023 kHz     78.750000 MHz
  Standard Timings: none
  Detailed Timing Descriptors:
    DTD 1:  3840x2160   30.000000 Hz  16:9     67.500 kHz    297.000000 MHz (1860 mm x 1047 mm)
                 Hfront  176 Hsync  88 Hback  296 Hpol P
                 Vfront    8 Vsync  10 Vback   72 Vpol P
    Display Range Limits:
      Monitor ranges (GTF): 24-85 Hz V, 15-80 kHz H, max dotclock 160 MHz
    Display Product Name: 'SE39UA01UK'
    Empty Descriptor
  Extension blocks: 1
Checksum: 0x19

----------------

Block 1, CTA-861 Extension Block:
  Revision: 3
  Basic audio support
  Supports YCbCr 4:4:4
  Supports YCbCr 4:2:2
  Native DTDs: 1
  Video Data Block:
    VIC  16:  1920x1080   60.000000 Hz  16:9     67.500 kHz    148.500000 MHz (native)
    VIC   5:  1920x1080i  60.000000 Hz  16:9     33.750 kHz     74.250000 MHz
    VIC   4:  1280x720    60.000000 Hz  16:9     45.000 kHz     74.250000 MHz
    VIC   2:   720x480    59.940060 Hz   4:3     31.469 kHz     27.000000 MHz
    VIC   3:   720x480    59.940060 Hz  16:9     31.469 kHz     27.000000 MHz
    VIC   6:  1440x480i   59.940060 Hz   4:3     15.734 kHz     27.000000 MHz
    VIC   7:  1440x480i   59.940060 Hz  16:9     15.734 kHz     27.000000 MHz
    VIC  17:   720x576    50.000000 Hz   4:3     31.250 kHz     27.000000 MHz
    VIC  18:   720x576    50.000000 Hz  16:9     31.250 kHz     27.000000 MHz
    VIC  19:  1280x720    50.000000 Hz  16:9     37.500 kHz     74.250000 MHz
    VIC  20:  1920x1080i  50.000000 Hz  16:9     28.125 kHz     74.250000 MHz
    VIC  21:  1440x576i   50.000000 Hz   4:3     15.625 kHz     27.000000 MHz
    VIC  22:  1440x576i   50.000000 Hz  16:9     15.625 kHz     27.000000 MHz
    VIC  31:  1920x1080   50.000000 Hz  16:9     56.250 kHz    148.500000 MHz
    VIC   1:   640x480    59.940476 Hz   4:3     31.469 kHz     25.175000 MHz
    VIC  32:  1920x1080   24.000000 Hz  16:9     27.000 kHz     74.250000 MHz
    VIC  33:  1920x1080   25.000000 Hz  16:9     28.125 kHz     74.250000 MHz
    VIC  34:  1920x1080   30.000000 Hz  16:9     33.750 kHz     74.250000 MHz
  Audio Data Block:
    Linear PCM:
      Max channels: 2
      Supported sample rates (kHz): 48 44.1 32
      Supported sample sizes (bits): 24 20 16
    AC-3:
      Max channels: 6
      Supported sample rates (kHz): 48 44.1 32
      Maximum bit rate: 288 kb/s
  Speaker Allocation Data Block:
    FL/FR - Front Left/Right
  Vendor-Specific Data Block (HDMI), OUI 00-0C-03:
    Source physical address: 1.0.0.0
    DC_36bit
    DC_30bit
    DC_Y444
    Maximum TMDS clock: 340 MHz
    Extended HDMI video details:
      HDMI VICs:
        HDMI VIC 1:  3840x2160   30.000000 Hz  16:9     67.500 kHz    297.000000 MHz
        HDMI VIC 2:  3840x2160   25.000000 Hz  16:9     56.250 kHz    297.000000 MHz
        HDMI VIC 3:  3840x2160   24.000000 Hz  16:9     54.000 kHz    297.000000 MHz
         Unknown (HDMI VIC 0)
  Detailed Timing Descriptors:
    DTD 2:  1920x1080   60.000000 Hz  16:9     67.500 kHz    148.500000 MHz (880 mm x 490 mm)
                 Hfront   88 Hsync  44 Hback  148 Hpol P
                 Vfront    4 Vsync   5 Vback   36 Vpol P
    DTD 3:  1920x1080i  60.000000 Hz  16:9     33.750 kHz     74.250000 MHz (500 mm x 281 mm)
                 Hfront   88 Hsync  44 Hback  148 Hpol P
                 Vfront    2 Vsync   5 Vback   15 Vpol P Vfront +0.5 Odd Field
                 Vfront    2 Vsync   5 Vback   15 Vpol P Vback  +0.5 Even Field
    DTD 4:   720x480    59.940060 Hz   3:2     31.469 kHz     27.000000 MHz (600 mm x 450 mm)
                 Hfront   16 Hsync  58 Hback   64 Hpol N
                 Vfront    9 Vsync   6 Vback   30 Vpol N
    DTD 5:   720x480    59.940060 Hz   3:2     31.469 kHz     27.000000 MHz (800 mm x 450 mm)
                 Hfront   16 Hsync  62 Hback   60 Hpol N
                 Vfront    9 Vsync   6 Vback   30 Vpol N
Checksum: 0xde  Unused space in Extension Block: 6 bytes

----------------

Warnings:

Block 0, Base EDID:
  Detailed Timing Descriptor #1: DTD is identical to VIC 95, which is not present in the CTA Ext Block.
Block 1, CTA-861 Extension Block:
  IT Video Formats are overscanned by default, but normally this should be underscanned.
  Video Data Block: VIC 16 and the first DTD are not identical. Is this intended?
  Detailed Timing Descriptor #4: DTD is similar but not identical to VIC 2.
  Detailed Timing Descriptor #4: Image size is 600x450 mm, but based on the picture AR it should be 600x400 mm.
  Detailed Timing Descriptor #5: Image size is 800x450 mm, but based on the picture AR it should be 675x450 mm.
  Add a Colorimetry Data Block with the sRGB colorimetry bit set to avoid interop issues.
EDID:
  Base EDID: Some timings are out of range of the Monitor Ranges:
    Maximum Clock: 297.000 MHz (Monitor: 160.000 MHz)

Failures:

Block 0, Base EDID:
  Detailed Timing Descriptor #1: Mismatch of image size 1860x1047 mm vs display size 860x520 mm.
  Empty Descriptor: Use Dummy Descriptor instead of all zeroes.
Block 1, CTA-861 Extension Block:
  Vendor-Specific Data Block (HDMI), OUI 00-0C-03: Unknown HDMI VIC 0.
  Vendor-Specific Data Block (HDMI), OUI 00-0C-03: HDMI VIC Codes must have their CTA-861 VIC equivalents in the VSB.
  Detailed Timing Descriptor #2: Mismatch of image size 880x490 mm vs display size 860x520 mm.
  Detailed Timing Descriptor #3: Mismatch of image size 500x281 mm vs display size 860x520 mm.
  Detailed Timing Descriptor #4: Mismatch of image size 600x450 mm vs display size 860x520 mm.
  Detailed Timing Descriptor #5: Mismatch of image size 800x450 mm vs display size 860x520 mm.
  Missing VCDB, needed for Set Selectable RGB Quantization to avoid interop issues.
EDID:
  Extension Block 2 started with EDID header, ignoring Extension Blocks >= 2.
  Base EDID: The DTD max image size is 1860x1047mm, which is larger than the display size 860.0x520.0mm.
  CTA-861: Native progressive timings are a mix of several resolutions.

EDID conformity: FAIL
