edid-decode (hex):

00 ff ff ff ff ff ff 00 10 ac 49 a2 53 30 42 30
19 22 01 03 80 46 28 78 ea 03 21 af 4e 3e b5 25
0d 50 54 a5 4b 00 71 4f 81 80 a9 c0 d1 c0 01 01
01 01 01 01 01 01 08 e8 00 30 f2 70 5a 80 b0 58
8a 00 bb 8b 21 00 00 1e 00 00 00 ff 00 36 47 34
34 59 5a 33 0a 20 20 20 20 20 00 00 00 fc 00 41
57 33 32 32 35 51 46 0a 20 20 20 20 00 00 00 fd
08 30 f0 1b ff f3 00 0a 20 20 20 20 20 20 03 d7

f0 02 70 00 00 00 00 00 00 00 00 00 00 00 00 00
00 00 00 00 00 00 00 00 00 00 00 00 00 00 00 00
00 00 00 00 00 00 00 00 00 00 00 00 00 00 00 00
00 00 00 00 00 00 00 00 00 00 00 00 00 00 00 00
00 00 00 00 00 00 00 00 00 00 00 00 00 00 00 00
00 00 00 00 00 00 00 00 00 00 00 00 00 00 00 00
00 00 00 00 00 00 00 00 00 00 00 00 00 00 00 00
00 00 00 00 00 00 00 00 00 00 00 00 00 00 00 9e

02 03 3b b1 54 76 61 60 5f 5e 5d 3f 22 21 20 1f
14 13 12 10 05 04 03 02 01 6d 03 0c 00 10 00 38
44 20 00 60 01 02 03 6d d8 5d c4 01 78 80 63 02
30 f0 c3 64 23 e2 00 ea e2 0f 07 00 00 00 00 00
00 00 00 00 00 00 00 00 00 00 00 00 00 00 00 00
00 00 00 00 00 00 00 00 00 00 00 00 00 00 00 00
00 00 00 00 00 00 00 00 00 00 00 00 00 00 00 00
00 00 00 00 00 00 00 00 00 00 00 00 00 00 00 d1

70 12 79 03 00 03 01 64 5f e4 00 04 7f 07 b3 00
3f 80 3f 00 37 04 4f 00 02 00 04 00 6e c2 00 04
ff 09 9f 00 2f 80 1f 00 9f 05 54 00 02 00 04 00
ca 9c 01 04 ff 09 9f 00 2f 80 1f 00 9f 05 b2 00
02 00 04 00 6b b4 03 04 ff 0e 7f 01 2f 80 1f 00
6f 08 ea 00 02 00 04 00 55 5e 00 04 ff 09 9f 00
2f 80 1f 00 9f 05 28 00 02 00 04 00 00 00 00 00
00 00 00 00 00 00 00 00 00 00 00 00 00 00 33 90

00 ff ff ff ff ff ff 00 10 ac 49 a2 53 30 42 30
19 22 01 03 80 46 28 78 ea 03 21 af 4e 3e b5 25
0d 50 54 a5 4b 00 71 4f 81 80 a9 c0 d1 c0 01 01
01 01 01 01 01 01 08 e8 00 30 f2 70 5a 80 b0 58
8a 00 bb 8b 21 00 00 1e 00 00 00 ff 00 36 47 34
34 59 5a 33 0a 20 20 20 20 20 00 00 00 fc 00 41
57 33 32 32 35 51 46 0a 20 20 20 20 00 00 00 fd
08 30 f0 1b ff f3 00 0a 20 20 20 20 20 20 03 d7

f0 02 70 00 00 00 00 00 00 00 00 00 00 00 00 00
00 00 00 00 00 00 00 00 00 00 00 00 00 00 00 00
00 00 00 00 00 00 00 00 00 00 00 00 00 00 00 00
00 00 00 00 00 00 00 00 00 00 00 00 00 00 00 00
00 00 00 00 00 00 00 00 00 00 00 00 00 00 00 00
00 00 00 00 00 00 00 00 00 00 00 00 00 00 00 00
00 00 00 00 00 00 00 00 00 00 00 00 00 00 00 00
00 00 00 00 00 00 00 00 00 00 00 00 00 00 00 9e

02 03 3b b1 54 76 61 60 5f 5e 5d 3f 22 21 20 1f
14 13 12 10 05 04 03 02 01 6d 03 0c 00 10 00 38
44 20 00 60 01 02 03 6d d8 5d c4 01 78 80 63 02
30 f0 c3 64 23 e2 00 ea e2 0f 07 00 00 00 00 00
00 00 00 00 00 00 00 00 00 00 00 00 00 00 00 00
00 00 00 00 00 00 00 00 00 00 00 00 00 00 00 00
00 00 00 00 00 00 00 00 00 00 00 00 00 00 00 00
00 00 00 00 00 00 00 00 00 00 00 00 00 00 00 d1

70 12 79 03 00 03 01 64 5f e4 00 04 7f 07 b3 00
3f 80 3f 00 37 04 4f 00 02 00 04 00 6e c2 00 04
ff 09 9f 00 2f 80 1f 00 9f 05 54 00 02 00 04 00
ca 9c 01 04 ff 09 9f 00 2f 80 1f 00 9f 05 b2 00
02 00 04 00 6b b4 03 04 ff 0e 7f 01 2f 80 1f 00
6f 08 ea 00 02 00 04 00 55 5e 00 04 ff 09 9f 00
2f 80 1f 00 9f 05 28 00 02 00 04 00 00 00 00 00
00 00 00 00 00 00 00 00 00 00 00 00 00 00 33 90

----------------

Block 0, Base EDID:
  EDID Structure Version & Revision: 1.3
  Vendor & Product Identification:
    Manufacturer: DEL
    Model: 41545
    Serial Number: ...
    Made in: week 25 of 2024
  Basic Display Parameters & Features:
    Digital display
    Maximum image size: 70 cm x 40 cm
    Gamma: 2.20
    DPMS levels: Standby Suspend Off
    RGB color display
    First detailed timing is the preferred timing
  Color Characteristics:
    Red  : 0.6835, 0.3046
    Green: 0.2421, 0.7099
    Blue : 0.1445, 0.0527
    White: 0.3125, 0.3291
  Established Timings I & II:
    IBM     :   720x400    70.081663 Hz   9:5     31.467 kHz     28.320000 MHz
    DMT 0x04:   640x480    59.940476 Hz   4:3     31.469 kHz     25.175000 MHz
    DMT 0x06:   640x480    75.000000 Hz   4:3     37.500 kHz     31.500000 MHz
    DMT 0x09:   800x600    60.316541 Hz   4:3     37.879 kHz     40.000000 MHz
    DMT 0x0b:   800x600    75.000000 Hz   4:3     46.875 kHz     49.500000 MHz
    DMT 0x10:  1024x768    60.003840 Hz   4:3     48.363 kHz     65.000000 MHz
    DMT 0x12:  1024x768    75.028582 Hz   4:3     60.023 kHz     78.750000 MHz
    DMT 0x24:  1280x1024   75.024675 Hz   5:4     79.976 kHz    135.000000 MHz
  Standard Timings:
    DMT 0x15:  1152x864    75.000000 Hz   4:3     67.500 kHz    108.000000 MHz
    DMT 0x23:  1280x1024   60.019740 Hz   5:4     63.981 kHz    108.000000 MHz
    DMT 0x53:  1600x900    60.000000 Hz  16:9     60.000 kHz    108.000000 MHz (RB)
    DMT 0x52:  1920x1080   60.000000 Hz  16:9     67.500 kHz    148.500000 MHz
  Detailed Timing Descriptors:
    DTD 1:  3840x2160   60.000000 Hz  16:9    135.000 kHz    594.000000 MHz (699 mm x 395 mm)
                 Hfront  176 Hsync  88 Hback  296 Hpol P
                 Vfront    8 Vsync  10 Vback   72 Vpol P
    Display Product Serial Number: ...
    Display Product Name: 'AW3225QF'
    Display Range Limits:
      Monitor ranges (GTF): 48-240 Hz V, 27-255 kHz H, max dotclock 2430 MHz
  Extension blocks: 3
Checksum: 0xd7

----------------

Block 1, Block Map Extension Block:
  Block   2: CTA-861 Extension Block
  Block   3: DisplayID Extension Block
Checksum: 0x9e

----------------

Block 2, CTA-861 Extension Block:
  Revision: 3
  Underscans IT Video Formats by default
  Supports YCbCr 4:4:4
  Supports YCbCr 4:2:2
  Native DTDs: 1
  Video Data Block:
    VIC 118:  3840x2160  120.000000 Hz  16:9    270.000 kHz   1188.000000 MHz
    VIC  97:  3840x2160   60.000000 Hz  16:9    135.000 kHz    594.000000 MHz
    VIC  96:  3840x2160   50.000000 Hz  16:9    112.500 kHz    594.000000 MHz
    VIC  95:  3840x2160   30.000000 Hz  16:9     67.500 kHz    297.000000 MHz
    VIC  94:  3840x2160   25.000000 Hz  16:9     56.250 kHz    297.000000 MHz
    VIC  93:  3840x2160   24.000000 Hz  16:9     54.000 kHz    297.000000 MHz
    VIC  63:  1920x1080  120.000000 Hz  16:9    135.000 kHz    297.000000 MHz
    VIC  34:  1920x1080   30.000000 Hz  16:9     33.750 kHz     74.250000 MHz
    VIC  33:  1920x1080   25.000000 Hz  16:9     28.125 kHz     74.250000 MHz
    VIC  32:  1920x1080   24.000000 Hz  16:9     27.000 kHz     74.250000 MHz
    VIC  31:  1920x1080   50.000000 Hz  16:9     56.250 kHz    148.500000 MHz
    VIC  20:  1920x1080i  50.000000 Hz  16:9     28.125 kHz     74.250000 MHz
    VIC  19:  1280x720    50.000000 Hz  16:9     37.500 kHz     74.250000 MHz
    VIC  18:   720x576    50.000000 Hz  16:9     31.250 kHz     27.000000 MHz
    VIC  16:  1920x1080   60.000000 Hz  16:9     67.500 kHz    148.500000 MHz
    VIC   5:  1920x1080i  60.000000 Hz  16:9     33.750 kHz     74.250000 MHz
    VIC   4:  1280x720    60.000000 Hz  16:9     45.000 kHz     74.250000 MHz
    VIC   3:   720x480    59.940060 Hz  16:9     31.469 kHz     27.000000 MHz
    VIC   2:   720x480    59.940060 Hz   4:3     31.469 kHz     27.000000 MHz
    VIC   1:   640x480    59.940476 Hz   4:3     31.469 kHz     25.175000 MHz
  Vendor-Specific Data Block (HDMI), OUI 00-0C-03:
    Source physical address: 1.0.0.0
    DC_36bit
    DC_30bit
    DC_Y444
    Maximum TMDS clock: 340 MHz
    Extended HDMI video details:
      HDMI VICs:
        HDMI VIC 1:  3840x2160   30.000000 Hz  16:9     67.500 kHz    297.000000 MHz
        HDMI VIC 2:  3840x2160   25.000000 Hz  16:9     56.250 kHz    297.000000 MHz
        HDMI VIC 3:  3840x2160   24.000000 Hz  16:9     54.000 kHz    297.000000 MHz
  Vendor-Specific Data Block (HDMI Forum), OUI C4-5D-D8:
    Version: 1
    Maximum TMDS Character Rate: 600 MHz
    SCDC Present
    Max Fixed Rate Link: 3 and 6 Gbps per lane on 3 lanes, 6, 8, 10 and 12 Gbps on 4 lanes
    Supports 12-bits/component Deep Color 4:2:0 Pixel Encoding
    Supports 10-bits/component Deep Color 4:2:0 Pixel Encoding
    Supports Auto Low-Latency Mode
    VRRmin: 48 Hz
    VRRmax: 240 Hz
    Supports VESA DSC 1.2a compression
    Supports Compressed Video Transport for 4:2:0 Pixel Encoding
    Supports 12 bpc Compressed Video Transport
    Supports 10 bpc Compressed Video Transport
    DSC Max Slices: up to 8 slices and up to (340 MHz/Ksliceadjust) pixel clock per slice
    DSC Max Fixed Rate Link: 3 and 6 Gbps per lane on 3 lanes, 6, 8, 10 and 12 Gbps on 4 lanes
    Maximum number of bytes in a line of chunks: 36864
  Video Capability Data Block:
    YCbCr quantization: Selectable (via AVI YQ)
    RGB quantization: Selectable (via AVI Q)
    PT scan behavior: Always Underscanned
    IT scan behavior: Always Underscanned
    CE scan behavior: Always Underscanned
  YCbCr 4:2:0 Capability Map Data Block:
    VIC 118:  3840x2160  120.000000 Hz  16:9    270.000 kHz   1188.000000 MHz
    VIC  97:  3840x2160   60.000000 Hz  16:9    135.000 kHz    594.000000 MHz
    VIC  96:  3840x2160   50.000000 Hz  16:9    112.500 kHz    594.000000 MHz
Checksum: 0xd1  Unused space in Extension Block: 68 bytes

----------------

Block 3, DisplayID Extension Block:
  Version: 1.2
  Extension Count: 0
  Display Product Type: Standalone display device
  Video Timing Modes Type 1 - Detailed Timings Data Block:
    DTD:  1920x1080  240.000000 Hz  16:9    278.400 kHz    584.640000 MHz (aspect 16:9, no 3D stereo)
               Hfront   64 Hsync  64 Hback   52 Hpol P
               Vfront    3 Vsync   5 Vback   72 Vpol N
    DTD:  2560x1440  119.997589 Hz  16:9    182.996 kHz    497.750000 MHz (aspect 16:9, no 3D stereo)
               Hfront   48 Hsync  32 Hback   80 Hpol P
               Vfront    3 Vsync   5 Vback   77 Vpol N
    DTD:  2560x1440  239.969753 Hz  16:9    388.511 kHz   1056.750000 MHz (aspect 16:9, no 3D stereo)
               Hfront   48 Hsync  32 Hback   80 Hpol P
               Vfront    3 Vsync   5 Vback  171 Vpol N
    DTD:  3840x2160  240.000474 Hz  16:9    574.801 kHz   2427.960000 MHz (aspect 16:9, no 3D stereo)
               Hfront   48 Hsync  32 Hback  304 Hpol P
               Vfront    3 Vsync   5 Vback  227 Vpol N
    DTD:  2560x1440   59.950550 Hz  16:9     88.787 kHz    241.500000 MHz (aspect 16:9, no 3D stereo)
               Hfront   48 Hsync  32 Hback   80 Hpol P
               Vfront    3 Vsync   5 Vback   33 Vpol N
  Checksum: 0x33
Checksum: 0x90

----------------

Warnings:

Block 2, CTA-861 Extension Block:
  Video Data Block: VIC 118 and the first DTD are not identical. Is this intended?
  Video Capability Data Block: S_PT is equal to S_IT and S_CE, so should be set to 0 instead.
  Display Product Serial Number is set, so the Serial Number in the Base EDID should be 0.
  Add a Colorimetry Data Block with the sRGB colorimetry bit set to avoid interop issues.
EDID:
  Base EDID: Some timings are out of range of the Monitor Ranges:
    Vertical Freq: 24.000 - 240.000 Hz (Monitor: 48.000 - 240.000 Hz)
    Horizontal Freq: 27.000 - 574.801 kHz (Monitor: 27.000 - 510.000 kHz)

Failures:

Block 0, Base EDID:
  Display Descriptor #4: Monitor descriptor block has byte 4 nonzero (0x08).
Block 2, CTA-861 Extension Block:
  Vendor-Specific Data Block (HDMI Forum), OUI C4-5D-D8: HDMI VIC and related CTA VIC codes are present, but the UHD VIC bit is 0.
EDID:
  Extension Block 4 started with EDID header, ignoring Extension Blocks >= 4.
  DisplayID: Missing DisplayID Display Parameters Data Block.
  DisplayID: DisplayID expects at least one preferred timing.

EDID conformity: FAIL
