edid-decode (hex):

00 ff ff ff ff ff ff 00 06 af a7 c8 00 00 00 00
21 20 01 04 a5 27 18 78 03 d6 45 ad 51 44 b0 26
0c 50 54 00 00 00 01 01 01 01 01 01 01 01 01 01
01 01 01 01 01 01 c1 72 00 a0 a0 40 c8 60 30 20
35 00 83 f2 10 00 00 18 00 00 00 0f 00 00 00 00
00 00 00 00 00 00 00 00 00 20 00 00 00 fd 0c 3c
f0 b2 b2 76 01 0a 20 20 20 20 20 20 00 00 00 fe
00 42 31 38 30 51 41 4e 30 31 2e 30 20 0a 01 a1

70 20 79 02 00 22 00 14 04 ee 11 84 ff 09 9f 00
2f 80 1f 00 3f 06 c7 00 02 00 04 00 25 01 09 04
ee 11 04 ee 11 3c f0 80 81 00 10 72 1a 00 00 03
01 3c f0 00 00 73 20 73 20 f0 00 00 00 00 00 00
00 00 00 00 00 00 00 00 00 00 00 00 00 00 00 00
00 00 00 00 00 00 00 00 00 00 00 00 00 00 00 00
00 00 00 00 00 00 00 00 00 00 00 00 00 00 00 00
00 00 00 00 00 00 00 00 00 00 00 00 00 00 dd 90

00 ff ff ff ff ff ff 00 06 af a7 c8 00 00 00 00
21 20 01 04 a5 27 18 78 03 d6 45 ad 51 44 b0 26
0c 50 54 00 00 00 01 01 01 01 01 01 01 01 01 01
01 01 01 01 01 01 c1 72 00 a0 a0 40 c8 60 30 20
35 00 83 f2 10 00 00 18 00 00 00 0f 00 00 00 00
00 00 00 00 00 00 00 00 00 20 00 00 00 fd 0c 3c
f0 b2 b2 76 01 0a 20 20 20 20 20 20 00 00 00 fe
00 42 31 38 30 51 41 4e 30 31 2e 30 20 0a 01 a1

70 20 79 02 00 22 00 14 04 ee 11 84 ff 09 9f 00
2f 80 1f 00 3f 06 c7 00 02 00 04 00 25 01 09 04
ee 11 04 ee 11 3c f0 80 81 00 10 72 1a 00 00 03
01 3c f0 00 00 73 20 73 20 f0 00 00 00 00 00 00
00 00 00 00 00 00 00 00 00 00 00 00 00 00 00 00
00 00 00 00 00 00 00 00 00 00 00 00 00 00 00 00
00 00 00 00 00 00 00 00 00 00 00 00 00 00 00 00
00 00 00 00 00 00 00 00 00 00 00 00 00 00 dd 90

----------------

Block 0, Base EDID:
  EDID Structure Version & Revision: 1.4
  Vendor & Product Identification:
    Manufacturer: AUO
    Model: 51367
    Made in: week 33 of 2022
  Basic Display Parameters & Features:
    Digital display
    Bits per primary color channel: 8
    DisplayPort interface
    Maximum image size: 39 cm x 24 cm
    Gamma: 2.20
    Supported color formats: RGB 4:4:4
    First detailed timing includes the native pixel format and preferred refresh rate
    Display supports continuous frequencies
  Color Characteristics:
    Red  : 0.6787, 0.3173
    Green: 0.2666, 0.6894
    Blue : 0.1494, 0.0468
    White: 0.3134, 0.3291
  Established Timings I & II: none
  Standard Timings: none
  Detailed Timing Descriptors:
    DTD 1:  2560x1600   60.002042 Hz  16:10   108.004 kHz    293.770000 MHz (387 mm x 242 mm)
                 Hfront   48 Hsync  32 Hback   80 Hpol N
                 Vfront    3 Vsync   5 Vback  192 Vpol N
    Manufacturer-Specified Display Descriptor (0x0f): 00 0f 00 00 00 00 00 00 00 00 00 00 00 00 00 20 '............... '
    Display Range Limits:
      Monitor ranges (Range Limits Only): 60-240 Hz V, 433-433 kHz H, max dotclock 1180 MHz
    Alphanumeric Data String: 'B180QAN01.0 '
  Extension blocks: 1
Checksum: 0xa1

----------------

Block 1, DisplayID Extension Block:
  Version: 2.0
  Extension Count: 0
  Display Product Primary Use Case: None of the listed primary use cases; generic display
  Video Timing Modes Type 7 - Detailed Timings Data Block:
    DTD:  2560x1600  240.001021 Hz  16:9    432.002 kHz   1175.045000 MHz (aspect 16:9, no 3D stereo, preferred)
               Hfront   48 Hsync  32 Hback   80 Hpol P
               Vfront    3 Vsync   5 Vback  192 Vpol N
  Dynamic Video Timing Range Limits Data Block:
    Minimum Pixel Clock: 1175045 kHz
    Maximum Pixel Clock: 1175045 kHz
    Minimum Vertical Refresh Rate: 60 Hz
    Maximum Vertical Refresh Rate: 240 Hz
    Seamless Dynamic Video Timing Support: Yes
  CTA-861 DisplayID Data Block:
  Vendor-Specific Data Block (AMD), OUI 00-00-1A:
    Version: 3
    Flags 1: 0x01
      FreeSync Supported
    Minimum Refresh Rate: 60 Hz
    Maximum Refresh Rate: 240 Hz
    Flags 5: 0x00
  Checksum: 0xdd
Checksum: 0x90

----------------

Warnings:

Block 0, Base EDID:
  Missing Display Product Name.
EDID:
  Base EDID: Some timings are out of range of the Monitor Ranges:
    Horizontal Freq: 108.003 - 432.001 kHz (Monitor: 433.000 - 433.000 kHz)

Failures:

Block 0, Base EDID:
  Alphanumeric Data String: One or more trailing spaces before newline.
Block 1, DisplayID Extension Block:
  Vendor-Specific Data Block (AMD), OUI 00-00-1A: Length is 16 instead of 19.
EDID:
  Extension Block 2 started with EDID header, ignoring Extension Blocks >= 2.
  DisplayID: Missing DisplayID Display Parameters Data Block.

EDID conformity: FAIL
