edid-decode (hex):

00 ff ff ff ff ff ff 00 22 f0 79 21 01 00 00 00
01 1a 01 03 80 50 22 78 e6 a1 95 a9 54 4d 9c 26
0f 50 54 00 08 00 81 c0 81 00 81 80 8b c0 95 00
a9 c0 a9 40 b3 00 e7 7c 70 a0 d0 a0 29 50 30 20
3a 00 2a 63 31 00 00 1a a9 4c 70 00 d4 a0 1c 50
a0 60 3a 10 2a 63 31 00 00 1a 00 00 00 fc 00 48
50 20 41 6c 6c 2d 69 6e 2d 4f 6e 65 00 00 00 fd
00 30 3e 0f 32 3c 01 0a 20 20 20 20 20 20 01 4c

02 03 2f f1 4f 10 05 04 03 02 07 16 01 14 1f 12
13 20 21 22 23 09 07 07 83 01 00 00 6a 03 0c 00
10 00 38 3c 20 00 00 67 d8 5d c4 01 78 88 00 02
3a 80 18 71 38 2d 40 58 2c 25 00 55 50 21 00 00
1e 01 1d 80 18 71 1c 16 20 58 2c 25 00 55 50 21
00 00 9e 01 1d 00 72 51 d0 1e 20 6e 28 55 00 55
50 21 00 00 1e 8c 0a d0 8a 20 e0 2d 10 10 3e 96
00 55 50 21 00 00 18 00 00 00 00 00 00 00 00 af

00 ff ff ff ff ff ff 00 22 f0 79 21 01 00 00 00
01 1a 01 03 80 50 22 78 e6 a1 95 a9 54 4d 9c 26
0f 50 54 00 08 00 81 c0 81 00 81 80 8b c0 95 00
a9 c0 a9 40 b3 00 e7 7c 70 a0 d0 a0 29 50 30 20
3a 00 2a 63 31 00 00 1a a9 4c 70 00 d4 a0 1c 50
a0 60 3a 10 2a 63 31 00 00 1a 00 00 00 fc 00 48
50 20 41 6c 6c 2d 69 6e 2d 4f 6e 65 00 00 00 fd
00 30 3e 0f 32 3c 01 0a 20 20 20 20 20 20 01 4c

02 03 2f f1 4f 10 05 04 03 02 07 16 01 14 1f 12
13 20 21 22 23 09 07 07 83 01 00 00 6a 03 0c 00
10 00 38 3c 20 00 00 67 d8 5d c4 01 78 88 00 02
3a 80 18 71 38 2d 40 58 2c 25 00 55 50 21 00 00
1e 01 1d 80 18 71 1c 16 20 58 2c 25 00 55 50 21
00 00 9e 01 1d 00 72 51 d0 1e 20 6e 28 55 00 55
50 21 00 00 1e 8c 0a d0 8a 20 e0 2d 10 10 3e 96
00 55 50 21 00 00 18 00 00 00 00 00 00 00 00 af

----------------

Block 0, Base EDID:
  EDID Structure Version & Revision: 1.3
  Vendor & Product Identification:
    Manufacturer: HWP
    Model: 8569
    Serial Number: ...
    Made in: week 1 of 2016
  Basic Display Parameters & Features:
    Digital display
    Maximum image size: 80 cm x 34 cm
    Gamma: 2.20
    DPMS levels: Standby Suspend Off
    Monochrome or grayscale display
    Default (sRGB) color space is primary color space
    First detailed timing is the preferred timing
  Color Characteristics:
    Red  : 0.6621, 0.3300
    Green: 0.3007, 0.6103
    Blue : 0.1503, 0.0595
    White: 0.3134, 0.3291
  Established Timings I & II:
    DMT 0x10:  1024x768    60.003840 Hz   4:3     48.363 kHz     65.000000 MHz
  Standard Timings:
    DMT 0x55:  1280x720    60.000000 Hz  16:9     45.000 kHz     74.250000 MHz
    DMT 0x1c:  1280x800    59.810326 Hz  16:10    49.702 kHz     83.500000 MHz
    DMT 0x23:  1280x1024   60.019740 Hz   5:4     63.981 kHz    108.000000 MHz
    GTF     :  1360x765    60.000341 Hz  16:9     47.520 kHz     84.396000 MHz
    DMT 0x2f:  1440x900    59.887445 Hz  16:10    55.935 kHz    106.500000 MHz
    DMT 0x53:  1600x900    60.000000 Hz  16:9     60.000 kHz    108.000000 MHz (RB)
    DMT 0x33:  1600x1200   60.000000 Hz   4:3     75.000 kHz    162.000000 MHz
    DMT 0x3a:  1680x1050   59.954250 Hz  16:10    65.290 kHz    146.250000 MHz
  Detailed Timing Descriptors:
    DTD  1:  3440x1440   59.972616 Hz  43:18    88.819 kHz    319.750000 MHz (810 mm x 355 mm)
                  Hfront   48 Hsync  32 Hback   80 Hpol P
                  Vfront    3 Vsync  10 Vback   28 Vpol N
    DTD  2:  3440x1440   29.947421 Hz  43:18    43.963 kHz    196.250000 MHz (810 mm x 355 mm)
                  Hfront  160 Hsync 352 Hback  512 Hpol P
                  Vfront    3 Vsync  10 Vback   15 Vpol N
    Display Product Name: 'HP All-in-One'
    Display Range Limits:
      Monitor ranges (Range Limits Only): 48-62 Hz V, 15-50 kHz H, max dotclock 600 MHz
  Extension blocks: 1
Checksum: 0x4c

----------------

Block 1, CTA-861 Extension Block:
  Revision: 3
  Underscans IT Video Formats by default
  Basic audio support
  Supports YCbCr 4:4:4
  Supports YCbCr 4:2:2
  Native detailed modes: 1
  Video Data Block:
    VIC  16:  1920x1080   60.000000 Hz  16:9     67.500 kHz    148.500000 MHz
    VIC   5:  1920x1080i  60.000000 Hz  16:9     33.750 kHz     74.250000 MHz
    VIC   4:  1280x720    60.000000 Hz  16:9     45.000 kHz     74.250000 MHz
    VIC   3:   720x480    59.940060 Hz  16:9     31.469 kHz     27.000000 MHz
    VIC   2:   720x480    59.940060 Hz   4:3     31.469 kHz     27.000000 MHz
    VIC   7:  1440x480i   59.940060 Hz  16:9     15.734 kHz     27.000000 MHz
    VIC  22:  1440x576i   50.000000 Hz  16:9     15.625 kHz     27.000000 MHz
    VIC   1:   640x480    59.940476 Hz   4:3     31.469 kHz     25.175000 MHz
    VIC  20:  1920x1080i  50.000000 Hz  16:9     28.125 kHz     74.250000 MHz
    VIC  31:  1920x1080   50.000000 Hz  16:9     56.250 kHz    148.500000 MHz
    VIC  18:   720x576    50.000000 Hz  16:9     31.250 kHz     27.000000 MHz
    VIC  19:  1280x720    50.000000 Hz  16:9     37.500 kHz     74.250000 MHz
    VIC  32:  1920x1080   24.000000 Hz  16:9     27.000 kHz     74.250000 MHz
    VIC  33:  1920x1080   25.000000 Hz  16:9     28.125 kHz     74.250000 MHz
    VIC  34:  1920x1080   30.000000 Hz  16:9     33.750 kHz     74.250000 MHz
  Audio Data Block:
    Linear PCM:
      Max channels: 2
      Supported sample rates (kHz): 48 44.1 32
      Supported sample sizes (bits): 24 20 16
  Speaker Allocation Data Block:
    FL/FR - Front Left/Right
  Vendor-Specific Data Block (HDMI), OUI 00-0C-03:
    Source physical address: 1.0.0.0
    DC_36bit
    DC_30bit
    DC_Y444
    Maximum TMDS clock: 300 MHz
    Extended HDMI video details:
  Vendor-Specific Data Block (HDMI Forum), OUI C4-5D-D8:
    Version: 1
    Maximum TMDS Character Rate: 600 MHz
    SCDC Present
    Supports scrambling for <= 340 Mcsc
  Detailed Timing Descriptors:
    DTD  3:  1920x1080   60.000000 Hz  16:9     67.500 kHz    148.500000 MHz (597 mm x 336 mm)
                  Hfront   88 Hsync  44 Hback  148 Hpol P
                  Vfront    2 Vsync   5 Vback   38 Vpol P
    DTD  4:  1920x1080i  60.000000 Hz  16:9     33.750 kHz     74.250000 MHz (597 mm x 336 mm)
                  Hfront   88 Hsync  44 Hback  148 Hpol P
                  Vfront    2 Vsync   5 Vback   15 Vpol P Vfront +0.5 Odd Field
                  Vfront    2 Vsync   5 Vback   15 Vpol P Vback  +0.5 Even Field
    DTD  5:  1280x720    60.000000 Hz  16:9     45.000 kHz     74.250000 MHz (597 mm x 336 mm)
                  Hfront  110 Hsync  40 Hback  220 Hpol P
                  Vfront    5 Vsync   5 Vback   20 Vpol P
    DTD  6:   720x480    59.940060 Hz   3:2     31.469 kHz     27.000000 MHz (597 mm x 336 mm)
                  Hfront   16 Hsync  62 Hback   60 Hpol N
                  Vfront    9 Vsync   6 Vback   30 Vpol N
Checksum: 0xaf  Unused space in Extension Block: 8 bytes

----------------

Block 2, Unknown EDID Extension Block 0x00:
  00 ff ff ff ff ff ff 00 22 f0 79 21 01 00 00 00 '........".y!....'
  01 1a 01 03 80 50 22 78 e6 a1 95 a9 54 4d 9c 26 '.....P"x....TM.&'
  0f 50 54 00 08 00 81 c0 81 00 81 80 8b c0 95 00 '.PT.............'
  a9 c0 a9 40 b3 00 e7 7c 70 a0 d0 a0 29 50 30 20 '...@...|p...)P0 '
  3a 00 2a 63 31 00 00 1a a9 4c 70 00 d4 a0 1c 50 ':.*c1....Lp....P'
  a0 60 3a 10 2a 63 31 00 00 1a 00 00 00 fc 00 48 '.`:.*c1........H'
  50 20 41 6c 6c 2d 69 6e 2d 4f 6e 65 00 00 00 fd 'P All-in-One....'
  00 30 3e 0f 32 3c 01 0a 20 20 20 20 20 20 01 4c '.0>.2<..      .L'
Checksum: 0x4c

----------------

Block 3, CTA-861 Extension Block:
  Revision: 3
  Underscans IT Video Formats by default
  Basic audio support
  Supports YCbCr 4:4:4
  Supports YCbCr 4:2:2
  Native detailed modes: 1
  Video Data Block:
    VIC  16:  1920x1080   60.000000 Hz  16:9     67.500 kHz    148.500000 MHz
    VIC   5:  1920x1080i  60.000000 Hz  16:9     33.750 kHz     74.250000 MHz
    VIC   4:  1280x720    60.000000 Hz  16:9     45.000 kHz     74.250000 MHz
    VIC   3:   720x480    59.940060 Hz  16:9     31.469 kHz     27.000000 MHz
    VIC   2:   720x480    59.940060 Hz   4:3     31.469 kHz     27.000000 MHz
    VIC   7:  1440x480i   59.940060 Hz  16:9     15.734 kHz     27.000000 MHz
    VIC  22:  1440x576i   50.000000 Hz  16:9     15.625 kHz     27.000000 MHz
    VIC   1:   640x480    59.940476 Hz   4:3     31.469 kHz     25.175000 MHz
    VIC  20:  1920x1080i  50.000000 Hz  16:9     28.125 kHz     74.250000 MHz
    VIC  31:  1920x1080   50.000000 Hz  16:9     56.250 kHz    148.500000 MHz
    VIC  18:   720x576    50.000000 Hz  16:9     31.250 kHz     27.000000 MHz
    VIC  19:  1280x720    50.000000 Hz  16:9     37.500 kHz     74.250000 MHz
    VIC  32:  1920x1080   24.000000 Hz  16:9     27.000 kHz     74.250000 MHz
    VIC  33:  1920x1080   25.000000 Hz  16:9     28.125 kHz     74.250000 MHz
    VIC  34:  1920x1080   30.000000 Hz  16:9     33.750 kHz     74.250000 MHz
  Audio Data Block:
    Linear PCM:
      Max channels: 2
      Supported sample rates (kHz): 48 44.1 32
      Supported sample sizes (bits): 24 20 16
  Speaker Allocation Data Block:
    FL/FR - Front Left/Right
  Vendor-Specific Data Block (HDMI), OUI 00-0C-03:
    Source physical address: 1.0.0.0
    DC_36bit
    DC_30bit
    DC_Y444
    Maximum TMDS clock: 300 MHz
    Extended HDMI video details:
  Vendor-Specific Data Block (HDMI Forum), OUI C4-5D-D8:
    Version: 1
    Maximum TMDS Character Rate: 600 MHz
    SCDC Present
    Supports scrambling for <= 340 Mcsc
  Detailed Timing Descriptors:
    DTD  7:  1920x1080   60.000000 Hz  16:9     67.500 kHz    148.500000 MHz (597 mm x 336 mm)
                  Hfront   88 Hsync  44 Hback  148 Hpol P
                  Vfront    2 Vsync   5 Vback   38 Vpol P
    DTD  8:  1920x1080i  60.000000 Hz  16:9     33.750 kHz     74.250000 MHz (597 mm x 336 mm)
                  Hfront   88 Hsync  44 Hback  148 Hpol P
                  Vfront    2 Vsync   5 Vback   15 Vpol P Vfront +0.5 Odd Field
                  Vfront    2 Vsync   5 Vback   15 Vpol P Vback  +0.5 Even Field
    DTD  9:  1280x720    60.000000 Hz  16:9     45.000 kHz     74.250000 MHz (597 mm x 336 mm)
                  Hfront  110 Hsync  40 Hback  220 Hpol P
                  Vfront    5 Vsync   5 Vback   20 Vpol P
    DTD 10:   720x480    59.940060 Hz   3:2     31.469 kHz     27.000000 MHz (597 mm x 336 mm)
                  Hfront   16 Hsync  62 Hback   60 Hpol N
                  Vfront    9 Vsync   6 Vback   30 Vpol N
Checksum: 0xaf  Unused space in Extension Block: 8 bytes

----------------

Warnings:

Block 0, Base EDID:
  Vendor & Product Identification: The serial number is one of the known dummy values, it should probably be set to 0.
  Standard Timings: Standard Timing 1360x765 has a dubious odd vertical resolution.
  Detailed Timing Descriptor #1: Image size is 810x355 mm, but based on the picture AR it should be 810x339 mm.
  Detailed Timing Descriptor #2: Image size is 810x355 mm, but based on the picture AR it should be 810x339 mm.
Block 1, CTA-861 Extension Block:
  Video Data Block: VIC 16 and the first DTD are not identical. Is this intended?
  Detailed Timing Descriptor #3: DTD is similar but not identical to VIC 16.
  Detailed Timing Descriptor #6: Image size is 597x336 mm, but based on the picture AR it should be 597x398 mm.
Block 3, CTA-861 Extension Block:
  Detailed Timing Descriptor #7: DTD is similar but not identical to VIC 16.
  Detailed Timing Descriptor #10: Image size is 597x336 mm, but based on the picture AR it should be 597x398 mm.
EDID:
  Base EDID: Some timings are out of range of the Monitor Ranges:
    Vertical Freq: 24.000 - 60.020 Hz (Monitor: 48.000 - 62.000 Hz)
    Horizontal Freq: 15.625 - 88.819 kHz (Monitor: 15.000 - 50.000 kHz)

Failures:

Block 0, Base EDID:
  Basic Display Parameters & Features: sRGB is signaled, but the chromaticities do not match.
  Detailed Timing Descriptor #1: Mismatch of image size 810x355 mm vs display size 800x340 mm.
  Detailed Timing Descriptor #2: Mismatch of image size 810x355 mm vs display size 800x340 mm.
  Display Range Limits: 'Range Limits Only' is not allowed for EDID < 1.4.
Block 1, CTA-861 Extension Block:
  Missing VCDB, needed for Set Selectable RGB Quantization to avoid interop issues.
Block 2, Base EDID:
  Unknown Extension Block.
Block 3, CTA-861 Extension Block:
  Video Data Block: Duplicate VIC 16.
  Video Data Block: Duplicate VIC 5.
  Video Data Block: Duplicate VIC 4.
  Video Data Block: Duplicate VIC 3.
  Video Data Block: Duplicate VIC 2.
  Video Data Block: Duplicate VIC 7.
  Video Data Block: Duplicate VIC 22.
  Video Data Block: Duplicate VIC 1.
  Video Data Block: Duplicate VIC 20.
  Video Data Block: Duplicate VIC 31.
  Video Data Block: Duplicate VIC 18.
  Video Data Block: Duplicate VIC 19.
  Video Data Block: Duplicate VIC 32.
  Video Data Block: Duplicate VIC 33.
  Video Data Block: Duplicate VIC 34.
  Speaker Allocation Data Block: Only one instance of this Data Block is allowed.
  Vendor-Specific Data Block (HDMI Forum), OUI C4-5D-D8: Duplicate HDMI Forum VSDB/SCDB.
EDID:
  Base EDID: The DTD max image size is 810x355mm, which is larger than the display size 800.0x340.0mm.
  Base EDID: EDID specified 1 extension block(s), but found 3 extension block(s).
  Base EDID: EDID 1.3 requires a Block Map Extension in Block 1 if there are more than 2 blocks in the EDID.

EDID conformity: FAIL
