edid-decode (hex):

00 ff ff ff ff ff ff 00 22 f0 79 21 01 00 00 00
01 1a 01 04 a5 3c 22 78 02 93 25 a9 54 4d 9e 25
0c 50 54 00 00 00 01 01 01 01 01 01 01 01 01 01
01 01 01 01 01 01 14 60 00 d0 a0 a0 29 50 30 08
36 00 55 50 21 00 00 1a 00 00 00 fd 00 31 3e 0f
32 1e 01 0a 20 20 20 20 20 20 00 00 00 fc 00 48
50 20 41 6c 6c 2d 69 6e 2d 4f 6e 65 00 00 00 ff
00 4c 54 4d 32 37 30 44 4c 31 31 0a 20 20 00 75

00 ff ff ff ff ff ff 00 22 f0 79 21 01 00 00 00
01 1a 01 04 a5 3c 22 78 02 93 25 a9 54 4d 9e 25
0c 50 54 00 00 00 01 01 01 01 01 01 01 01 01 01
01 01 01 01 01 01 14 60 00 d0 a0 a0 29 50 30 08
36 00 55 50 21 00 00 1a 00 00 00 fd 00 31 3e 0f
32 1e 01 0a 20 20 20 20 20 20 00 00 00 fc 00 48
50 20 41 6c 6c 2d 69 6e 2d 4f 6e 65 00 00 00 ff
00 4c 54 4d 32 37 30 44 4c 31 31 0a 20 20 00 75

----------------

Block 0, Base EDID:
  EDID Structure Version & Revision: 1.4
  Vendor & Product Identification:
    Manufacturer: HWP
    Model: 8569
    Serial Number: ...
    Made in: week 1 of 2016
  Basic Display Parameters & Features:
    Digital display
    Bits per primary color channel: 8
    DisplayPort interface
    Maximum image size: 60 cm x 34 cm
    Gamma: 2.20
    Supported color formats: RGB 4:4:4
    First detailed timing includes the native pixel format and preferred refresh rate
  Color Characteristics:
    Red  : 0.6621, 0.3291
    Green: 0.3007, 0.6201
    Blue : 0.1445, 0.0488
    White: 0.3134, 0.3291
  Established Timings I & II: none
  Standard Timings: none
  Detailed Timing Descriptors:
    DTD 1:  2560x1440   59.998907 Hz  16:9     88.858 kHz    245.960000 MHz (597 mm x 336 mm)
                 Hfront   48 Hsync   8 Hback  152 Hpol P
                 Vfront    3 Vsync   6 Vback   32 Vpol N
    Display Range Limits:
      Monitor ranges (Range Limits Only): 49-62 Hz V, 15-50 kHz H, max dotclock 300 MHz
    Display Product Name: 'HP All-in-One'
    Display Product Serial Number: ...
Checksum: 0x75

----------------

Warnings:

Block 0, Base EDID:
  Vendor & Product Identification: The serial number is one of the known dummy values, it should probably be set to 0.
EDID:
  Base EDID: Some timings are out of range of the Monitor Ranges:
    Horizontal Freq: 88.858 - 88.858 kHz (Monitor: 15.000 - 50.000 kHz)

Failures:

EDID:
  Extension Block 1 started with EDID header, ignoring Extension Blocks >= 1.

EDID conformity: FAIL
