edid-decode (hex):

00 ff ff ff ff ff ff 00 30 ae c3 67 00 00 00 00
1f 22 01 03 80 3c 21 78 2e 5e f5 b0 4c 39 a8 24
0e 50 54 a5 6f 00 71 4f 81 80 95 00 81 8f b3 00
a9 c0 d1 c0 d1 c0 4d d0 00 a0 f0 70 3e 80 30 20
35 00 55 50 21 00 00 1a 00 00 00 fd 00 30 4b 36
a0 3c 00 0a 20 20 20 20 20 20 00 00 00 fc 00 4e
32 37 70 0a 20 20 20 20 20 20 20 20 00 00 00 ff
00 55 4d 41 32 30 39 32 34 20 20 20 20 20 01 33

02 03 40 f1 4c 01 03 04 05 10 11 13 14 1f 5f 61
60 23 09 3f 07 83 01 00 00 e2 00 ca 6b 03 0c 00
20 00 38 3c 20 00 20 01 67 d8 5d c4 01 78 80 03
e3 05 e3 01 e4 0f 00 0c 00 e6 06 07 01 62 5f 22
4d d0 00 a0 f0 70 3e 80 30 20 35 00 55 4f 21 00
00 1a 56 5e 00 a0 a0 a0 29 50 30 20 35 00 55 4f
21 00 00 1a 00 00 00 00 00 00 00 00 00 00 00 00
00 00 00 00 00 00 00 00 00 00 00 00 00 00 00 4b

00 ff ff ff ff ff ff 00 30 ae c3 67 00 00 00 00
1f 22 01 03 80 3c 21 78 2e 5e f5 b0 4c 39 a8 24
0e 50 54 a5 6f 00 71 4f 81 80 95 00 81 8f b3 00
a9 c0 d1 c0 d1 c0 4d d0 00 a0 f0 70 3e 80 30 20
35 00 55 50 21 00 00 1a 00 00 00 fd 00 30 4b 36
a0 3c 00 0a 20 20 20 20 20 20 00 00 00 fc 00 4e
32 37 70 0a 20 20 20 20 20 20 20 20 00 00 00 ff
00 55 4d 41 32 30 39 32 34 20 20 20 20 20 01 33

02 03 40 f1 4c 01 03 04 05 10 11 13 14 1f 5f 61
60 23 09 3f 07 83 01 00 00 e2 00 ca 6b 03 0c 00
20 00 38 3c 20 00 20 01 67 d8 5d c4 01 78 80 03
e3 05 e3 01 e4 0f 00 0c 00 e6 06 07 01 62 5f 22
4d d0 00 a0 f0 70 3e 80 30 20 35 00 55 4f 21 00
00 1a 56 5e 00 a0 a0 a0 29 50 30 20 35 00 55 4f
21 00 00 1a 00 00 00 00 00 00 00 00 00 00 00 00
00 00 00 00 00 00 00 00 00 00 00 00 00 00 00 4b

----------------

Block 0, Base EDID:
  EDID Structure Version & Revision: 1.3
  Vendor & Product Identification:
    Manufacturer: LEN
    Model: 26563
    Made in: week 31 of 2024
  Basic Display Parameters & Features:
    Digital display
    Maximum image size: 60 cm x 33 cm
    Gamma: 2.20
    DPMS levels: Off
    RGB color display
    Default (sRGB) color space is primary color space
    First detailed timing is the preferred timing
  Color Characteristics:
    Red  : 0.6884, 0.2978
    Green: 0.2255, 0.6582
    Blue : 0.1435, 0.0576
    White: 0.3134, 0.3291
  Established Timings I & II:
    IBM     :   720x400    70.081663 Hz   9:5     31.467 kHz     28.320000 MHz
    DMT 0x04:   640x480    59.940476 Hz   4:3     31.469 kHz     25.175000 MHz
    DMT 0x06:   640x480    75.000000 Hz   4:3     37.500 kHz     31.500000 MHz
    DMT 0x09:   800x600    60.316541 Hz   4:3     37.879 kHz     40.000000 MHz
    DMT 0x0b:   800x600    75.000000 Hz   4:3     46.875 kHz     49.500000 MHz
    Apple   :   832x624    74.551266 Hz   4:3     49.726 kHz     57.284000 MHz
    DMT 0x10:  1024x768    60.003840 Hz   4:3     48.363 kHz     65.000000 MHz
    DMT 0x11:  1024x768    70.069359 Hz   4:3     56.476 kHz     75.000000 MHz
    DMT 0x12:  1024x768    75.028582 Hz   4:3     60.023 kHz     78.750000 MHz
    DMT 0x24:  1280x1024   75.024675 Hz   5:4     79.976 kHz    135.000000 MHz
  Standard Timings:
    DMT 0x15:  1152x864    75.000000 Hz   4:3     67.500 kHz    108.000000 MHz
    DMT 0x23:  1280x1024   60.019740 Hz   5:4     63.981 kHz    108.000000 MHz
    DMT 0x2f:  1440x900    59.887445 Hz  16:10    55.935 kHz    106.500000 MHz
    DMT 0x24:  1280x1024   75.024675 Hz   5:4     79.976 kHz    135.000000 MHz
    DMT 0x3a:  1680x1050   59.954250 Hz  16:10    65.290 kHz    146.250000 MHz
    DMT 0x53:  1600x900    60.000000 Hz  16:9     60.000 kHz    108.000000 MHz (RB)
    DMT 0x52:  1920x1080   60.000000 Hz  16:9     67.500 kHz    148.500000 MHz
    DMT 0x52:  1920x1080   60.000000 Hz  16:9     67.500 kHz    148.500000 MHz
  Detailed Timing Descriptors:
    DTD 1:  3840x2160   59.996625 Hz  16:9    133.312 kHz    533.250000 MHz (597 mm x 336 mm)
                 Hfront   48 Hsync  32 Hback   80 Hpol P
                 Vfront    3 Vsync   5 Vback   54 Vpol N
    Display Range Limits:
      Monitor ranges (GTF): 48-75 Hz V, 54-160 kHz H, max dotclock 600 MHz
    Display Product Name: 'N27p'
    Display Product Serial Number: ...
  Extension blocks: 1
Checksum: 0x33

----------------

Block 1, CTA-861 Extension Block:
  Revision: 3
  Underscans IT Video Formats by default
  Basic audio support
  Supports YCbCr 4:4:4
  Supports YCbCr 4:2:2
  Native DTDs: 1
  Video Data Block:
    VIC   1:   640x480    59.940476 Hz   4:3     31.469 kHz     25.175000 MHz
    VIC   3:   720x480    59.940060 Hz  16:9     31.469 kHz     27.000000 MHz
    VIC   4:  1280x720    60.000000 Hz  16:9     45.000 kHz     74.250000 MHz
    VIC   5:  1920x1080i  60.000000 Hz  16:9     33.750 kHz     74.250000 MHz
    VIC  16:  1920x1080   60.000000 Hz  16:9     67.500 kHz    148.500000 MHz
    VIC  17:   720x576    50.000000 Hz   4:3     31.250 kHz     27.000000 MHz
    VIC  19:  1280x720    50.000000 Hz  16:9     37.500 kHz     74.250000 MHz
    VIC  20:  1920x1080i  50.000000 Hz  16:9     28.125 kHz     74.250000 MHz
    VIC  31:  1920x1080   50.000000 Hz  16:9     56.250 kHz    148.500000 MHz
    VIC  95:  3840x2160   30.000000 Hz  16:9     67.500 kHz    297.000000 MHz
    VIC  97:  3840x2160   60.000000 Hz  16:9    135.000 kHz    594.000000 MHz
    VIC  96:  3840x2160   50.000000 Hz  16:9    112.500 kHz    594.000000 MHz
  Audio Data Block:
    Linear PCM:
      Max channels: 2
      Supported sample rates (kHz): 176.4 96 88.2 48 44.1 32
      Supported sample sizes (bits): 24 20 16
  Speaker Allocation Data Block:
    FL/FR - Front Left/Right
  Video Capability Data Block:
    YCbCr quantization: Selectable (via AVI YQ)
    RGB quantization: Selectable (via AVI Q)
    PT scan behavior: No Data
    IT scan behavior: Always Underscanned
    CE scan behavior: Always Underscanned
  Vendor-Specific Data Block (HDMI), OUI 00-0C-03:
    Source physical address: 2.0.0.0
    DC_36bit
    DC_30bit
    DC_Y444
    Maximum TMDS clock: 300 MHz
    Extended HDMI video details:
      HDMI VICs:
        HDMI VIC 1:  3840x2160   30.000000 Hz  16:9     67.500 kHz    297.000000 MHz
  Vendor-Specific Data Block (HDMI Forum), OUI C4-5D-D8:
    Version: 1
    Maximum TMDS Character Rate: 600 MHz
    SCDC Present
    Supports 12-bits/component Deep Color 4:2:0 Pixel Encoding
    Supports 10-bits/component Deep Color 4:2:0 Pixel Encoding
  Colorimetry Data Block:
    xvYCC601
    xvYCC709
    BT2020cYCC
    BT2020YCC
    BT2020RGB
    Gamut Boundary Description Metadata Profile P0
  YCbCr 4:2:0 Capability Map Data Block:
    VIC  97:  3840x2160   60.000000 Hz  16:9    135.000 kHz    594.000000 MHz
    VIC  96:  3840x2160   50.000000 Hz  16:9    112.500 kHz    594.000000 MHz
  HDR Static Metadata Data Block:
    Electro optical transfer functions:
      Traditional gamma - SDR luminance range
      Traditional gamma - HDR luminance range
      SMPTE ST2084
    Supported static metadata descriptors:
      Static metadata type 1
    Desired content max luminance: 98 (417.710 cd/m^2)
    Desired content max frame-average luminance: 95 (391.429 cd/m^2)
    Desired content min luminance: 34 (0.074 cd/m^2)
  Detailed Timing Descriptors:
    DTD 2:  3840x2160   59.996625 Hz  16:9    133.312 kHz    533.250000 MHz (597 mm x 335 mm)
                 Hfront   48 Hsync  32 Hback   80 Hpol P
                 Vfront    3 Vsync   5 Vback   54 Vpol N
    DTD 3:  2560x1440   59.950550 Hz  16:9     88.787 kHz    241.500000 MHz (597 mm x 335 mm)
                 Hfront   48 Hsync  32 Hback   80 Hpol P
                 Vfront    3 Vsync   5 Vback   33 Vpol N
Checksum: 0x4b  Unused space in Extension Block: 27 bytes

----------------

Warnings:

Block 1, CTA-861 Extension Block:
  Video Data Block: VIC 1 and the first DTD are not identical. Is this intended?
EDID:
  Base EDID: Some timings are out of range of the Monitor Ranges:
    Vertical Freq: 30.000 - 75.029 Hz (Monitor: 48.000 - 75.000 Hz)
    Horizontal Freq: 28.125 - 135.000 kHz (Monitor: 54.000 - 160.000 kHz)

Failures:

Block 0, Base EDID:
  Display Product Serial Number: ...
  Basic Display Parameters & Features: sRGB is signaled, but the chromaticities do not match.
Block 1, CTA-861 Extension Block:
  Vendor-Specific Data Block (HDMI Forum), OUI C4-5D-D8: HDMI VIC and related CTA VIC codes are present, but the UHD VIC bit is 0.
EDID:
  Extension Block 2 started with EDID header, ignoring Extension Blocks >= 2.

EDID conformity: FAIL
