edid-decode (hex):

00 ff ff ff ff ff ff 00 6a 92 15 00 00 00 00 00
1c 22 01 04 a5 22 13 78 03 2c c5 94 5c 59 95 29
1e 50 54 00 00 00 01 01 01 01 01 01 01 01 01 01
01 01 01 01 01 01 c7 3a 80 18 71 38 3c 40 30 20
36 00 58 c1 10 00 00 1a 00 00 00 fd 00 28 3c 43
43 0e 00 0a 20 20 20 20 20 20 00 00 00 fe 00 43
53 4f 54 20 54 39 0a 20 20 20 20 20 00 00 00 fc
00 31 35 36 58 58 35 34 31 39 54 30 32 0a 00 e4

00 ff ff ff ff ff ff 00 6a 92 15 00 00 00 00 00
1c 22 01 04 a5 22 13 78 03 2c c5 94 5c 59 95 29
1e 50 54 00 00 00 01 01 01 01 01 01 01 01 01 01
01 01 01 01 01 01 c7 3a 80 18 71 38 3c 40 30 20
36 00 58 c1 10 00 00 1a 00 00 00 fd 00 28 3c 43
43 0e 00 0a 20 20 20 20 20 20 00 00 00 fe 00 43
53 4f 54 20 54 39 0a 20 20 20 20 20 00 00 00 fc
00 31 35 36 58 58 35 34 31 39 54 30 32 0a 00 e4

----------------

Block 0, Base EDID:
  EDID Structure Version & Revision: 1.4
  Vendor & Product Identification:
    Manufacturer: ZTR
    Model: 21
    Made in: week 28 of 2024
  Basic Display Parameters & Features:
    Digital display
    Bits per primary color channel: 8
    DisplayPort interface
    Maximum image size: 34 cm x 19 cm
    Gamma: 2.20
    Supported color formats: RGB 4:4:4
    First detailed timing includes the native pixel format and preferred refresh rate
    Display supports continuous frequencies
  Color Characteristics:
    Red  : 0.5781, 0.3613
    Green: 0.3505, 0.5820
    Blue : 0.1630, 0.1171
    White: 0.3134, 0.3291
  Established Timings I & II: none
  Standard Timings: none
  Detailed Timing Descriptors:
    DTD 1:  1920x1080   59.996013 Hz  16:9     68.395 kHz    150.470000 MHz (344 mm x 193 mm)
                 Hfront   48 Hsync  32 Hback  200 Hpol P
                 Vfront    3 Vsync   6 Vback   51 Vpol N
    Display Range Limits:
      Monitor ranges (GTF): 40-60 Hz V, 67-67 kHz H, max dotclock 140 MHz
    Alphanumeric Data String: 'CSOT T9'
    Display Product Name: '156XX5419T02'
Checksum: 0xe4

----------------

Warnings:

Block 0, Base EDID:
  Display Range Limits: GTF support is deprecated in EDID 1.4.
EDID:
  Base EDID: Some timings are out of range of the Monitor Ranges:
    Horizontal Freq: 68.395 - 68.395 kHz (Monitor: 67.000 - 67.000 kHz)
    Maximum Clock: 150.470 MHz (Monitor: 140.000 MHz)

Failures:

EDID:
  Extension Block 1 started with EDID header, ignoring Extension Blocks >= 1.

EDID conformity: FAIL
