edid-decode (hex):

00 ff ff ff ff ff ff 00 11 8d 00 00 85 89 14 eb
2a 09 01 04 00 00 00 ff 02 00 00 00 00 00 00 00
00 00 00 21 c8 00 41 40 81 c0 81 80 95 00 a9 40
b3 00 d1 c0 d1 00 94 2a 00 b0 51 00 27 40 50 88
37 00 00 00 00 00 00 1c 00 00 00 fc 00 4e 6f 20
4d 6f 6e 69 74 6f 72 0a 20 20 00 00 00 ff 00 55
53 42 5f 34 33 30 31 2d 30 30 30 30 00 00 00 00
00 00 00 00 00 00 00 00 00 00 00 00 00 00 01 89

10 01 02 03 01 4d 21 56 a2 51 00 1e 30 48 88 3a
00 00 00 00 00 00 1c 73 0a d0 b0 20 e0 14 10 18
40 3a 00 00 00 00 00 00 1c 1f 10 10 67 14 10 1b
24 10 e1 c0 00 00 00 00 00 00 00 00 00 00 00 00
00 00 00 00 00 00 00 00 00 00 00 00 00 00 00 00
00 00 00 00 00 00 00 00 00 00 00 00 00 00 00 00
00 00 00 00 00 00 00 00 00 00 00 00 00 00 00 00
00 00 00 00 00 00 00 00 00 00 00 00 00 00 00 35

00 ff ff ff ff ff ff 00 11 8d 00 00 85 89 14 eb
2a 09 01 04 00 00 00 ff 02 00 00 00 00 00 00 00
00 00 00 21 c8 00 41 40 81 c0 81 80 95 00 a9 40
b3 00 d1 c0 d1 00 94 2a 00 b0 51 00 27 40 50 88
37 00 00 00 00 00 00 1c 00 00 00 fc 00 4e 6f 20
4d 6f 6e 69 74 6f 72 0a 20 20 00 00 00 ff 00 55
53 42 5f 34 33 30 31 2d 30 30 30 30 00 00 00 00
00 00 00 00 00 00 00 00 00 00 00 00 00 00 01 89

10 01 02 03 01 4d 21 56 a2 51 00 1e 30 48 88 3a
00 00 00 00 00 00 1c 73 0a d0 b0 20 e0 14 10 18
40 3a 00 00 00 00 00 00 1c 1f 10 10 67 14 10 1b
24 10 e1 c0 00 00 00 00 00 00 00 00 00 00 00 00
00 00 00 00 00 00 00 00 00 00 00 00 00 00 00 00
00 00 00 00 00 00 00 00 00 00 00 00 00 00 00 00
00 00 00 00 00 00 00 00 00 00 00 00 00 00 00 00
00 00 00 00 00 00 00 00 00 00 00 00 00 00 00 35

----------------

Block 0, Base EDID:
  EDID Structure Version & Revision: 1.4
  Vendor & Product Identification:
    Manufacturer: DLM
    Model: 0
    Serial Number: ...
    Made in: week 42 of 1999
  Basic Display Parameters & Features:
    Analog display
    Signal Level Standard: 0.700 : 0.300 : 1.000 V p-p
    Blank level equals black level
    Image size is variable
    Gamma is defined in an extension block
    Monochrome or grayscale display
    First detailed timing includes the native pixel format and preferred refresh rate
  Color Characteristics:
    Red  : 0.0000, 0.0000
    Green: 0.0000, 0.0000
    Blue : 0.0000, 0.0000
    White: 0.0000, 0.0000
  Established Timings I & II:
    DMT 0x04:   640x480    59.940476 Hz   4:3     31.469 kHz     25.175000 MHz
    DMT 0x09:   800x600    60.316541 Hz   4:3     37.879 kHz     40.000000 MHz
    DMT 0x0a:   800x600    72.187572 Hz   4:3     48.077 kHz     50.000000 MHz
    DMT 0x0b:   800x600    75.000000 Hz   4:3     46.875 kHz     49.500000 MHz
    DMT 0x10:  1024x768    60.003840 Hz   4:3     48.363 kHz     65.000000 MHz
  Standard Timings:
    GTF     :   768x576    59.999451 Hz   4:3     35.820 kHz     34.960000 MHz
    DMT 0x55:  1280x720    60.000000 Hz  16:9     45.000 kHz     74.250000 MHz
    DMT 0x23:  1280x1024   60.019740 Hz   5:4     63.981 kHz    108.000000 MHz
    DMT 0x2f:  1440x900    59.887445 Hz  16:10    55.935 kHz    106.500000 MHz
    DMT 0x33:  1600x1200   60.000000 Hz   4:3     75.000 kHz    162.000000 MHz
    DMT 0x3a:  1680x1050   59.954250 Hz  16:10    65.290 kHz    146.250000 MHz
    DMT 0x52:  1920x1080   60.000000 Hz  16:9     67.500 kHz    148.500000 MHz
    DMT 0x45:  1920x1200   59.884600 Hz  16:10    74.556 kHz    193.250000 MHz
  Detailed Timing Descriptors:
    DTD 1:  1280x1024   59.894849 Hz   5:4     63.668 kHz    109.000000 MHz
                 Hfront   80 Hsync 136 Hback  216 Hpol N
                 Vfront    3 Vsync   7 Vback   29 Vpol P
    Display Product Name: 'No Monitor'
    Display Product Serial Number: ...
    Empty Descriptor
  Extension blocks: 1
Checksum: 0x89

----------------

Block 1, Video Timing Extension Block:
  Version: 1
  Detailed Timing Descriptors:
    DTD:  1366x768    59.882048 Hz 683:384   47.786 kHz     85.250000 MHz
               Hfront   72 Hsync 136 Hback  210 Hpol N
               Vfront    3 Vsync  10 Vback   17 Vpol P
    DTD:   720x480    59.709821 Hz   3:2     29.855 kHz     26.750000 MHz
               Hfront   24 Hsync  64 Hback   88 Hpol N
               Vfront    3 Vsync  10 Vback    7 Vpol P
  Coordinated Video Timings:
    CVT:   768x576    49.811242 Hz   4:3     29.688 kHz     28.500000 MHz (preferred vertical rate)
    CVT:  1280x720    49.826718 Hz  16:9     37.071 kHz     60.500000 MHz (preferred vertical rate)
    CVT:  1920x1080   49.929146 Hz  16:9     55.621 kHz    141.500000 MHz (preferred vertical rate)
  Standard Timings:
    DMT 0x54:  2048x1152   60.000000 Hz  16:9     72.000 kHz    162.000000 MHz (RB)
Checksum: 0x35  Unused space in Extension Block: 75 bytes

----------------

Failures:

Block 0, Base EDID:
  Empty Descriptor: Use Dummy Descriptor instead of all zeroes.
EDID:
  Extension Block 2 started with EDID header, ignoring Extension Blocks >= 2.

EDID conformity: FAIL
