edid-decode (hex):

00 ff ff ff ff ff ff 00 04 72 30 05 99 a1 40 73
22 1b 01 04 a5 3c 22 78 3b ee d1 a5 55 48 9b 26
12 50 54 23 08 00 81 40 81 80 81 c0 81 00 95 00
b3 00 d1 c0 01 01 08 82 80 50 70 38 4d 40 08 20
f8 0c 53 50 21 00 00 1c 24 6b 80 50 70 38 40 40
08 20 28 0c 53 50 21 00 00 1c 00 00 00 fd 00 30
90 b4 b4 22 01 0a 20 20 20 20 20 20 00 00 00 fc
00 41 63 65 72 20 58 5a 32 37 31 0a 20 20 01 d6

02 03 20 f1 4b 01 03 04 12 13 05 14 3f 1f 90 07
23 09 07 07 83 01 00 00 67 03 0c 00 10 00 00 42
02 3a 80 18 71 38 2d 40 58 2c 45 00 53 50 21 00
00 1e 01 1d 00 72 51 d0 1e 20 6e 28 55 00 53 50
21 00 00 1e 8c 0a d0 8a 20 e0 2d 10 10 3e 96 00
53 50 21 00 00 18 8c 0a d0 90 20 40 31 20 0c 40
55 00 53 50 21 00 00 18 24 6b 80 50 70 38 40 40
08 20 28 0c 53 50 21 00 00 1c 00 00 00 00 00 b9

00 ff ff ff ff ff ff 00 04 72 30 05 99 a1 40 73
22 1b 01 04 a5 3c 22 78 3b ee d1 a5 55 48 9b 26
12 50 54 23 08 00 81 40 81 80 81 c0 81 00 95 00
b3 00 d1 c0 01 01 08 82 80 50 70 38 4d 40 08 20
f8 0c 53 50 21 00 00 1c 24 6b 80 50 70 38 40 40
08 20 28 0c 53 50 21 00 00 1c 00 00 00 fd 00 30
90 b4 b4 22 01 0a 20 20 20 20 20 20 00 00 00 fc
00 41 63 65 72 20 58 5a 32 37 31 0a 20 20 01 d6

02 03 20 f1 4b 01 03 04 12 13 05 14 3f 1f 90 07
23 09 07 07 83 01 00 00 67 03 0c 00 10 00 00 42
02 3a 80 18 71 38 2d 40 58 2c 45 00 53 50 21 00
00 1e 01 1d 00 72 51 d0 1e 20 6e 28 55 00 53 50
21 00 00 1e 8c 0a d0 8a 20 e0 2d 10 10 3e 96 00
53 50 21 00 00 18 8c 0a d0 90 20 40 31 20 0c 40
55 00 53 50 21 00 00 18 24 6b 80 50 70 38 40 40
08 20 28 0c 53 50 21 00 00 1c 00 00 00 00 00 b9

----------------

Block 0, Base EDID:
  EDID Structure Version & Revision: 1.4
  Vendor & Product Identification:
    Manufacturer: ACR
    Model: 1328
    Serial Number: ...
    Made in: week 34 of 2017
  Basic Display Parameters & Features:
    Digital display
    Bits per primary color channel: 8
    DisplayPort interface
    Maximum image size: 60 cm x 34 cm
    Gamma: 2.20
    DPMS levels: Off
    Supported color formats: RGB 4:4:4, YCrCb 4:4:4, YCrCb 4:2:2
    First detailed timing includes the native pixel format and preferred refresh rate
    Display supports continuous frequencies
  Color Characteristics:
    Red  : 0.6474, 0.3339
    Green: 0.2841, 0.6074
    Blue : 0.1513, 0.0712
    White: 0.3125, 0.3291
  Established Timings I & II:
    DMT 0x04:   640x480    59.940476 Hz   4:3     31.469 kHz     25.175000 MHz
    DMT 0x08:   800x600    56.250000 Hz   4:3     35.156 kHz     36.000000 MHz
    DMT 0x09:   800x600    60.316541 Hz   4:3     37.879 kHz     40.000000 MHz
    DMT 0x10:  1024x768    60.003840 Hz   4:3     48.363 kHz     65.000000 MHz
  Standard Timings:
    DMT 0x20:  1280x960    60.000000 Hz   4:3     60.000 kHz    108.000000 MHz
    DMT 0x23:  1280x1024   60.019740 Hz   5:4     63.981 kHz    108.000000 MHz
    DMT 0x55:  1280x720    60.000000 Hz  16:9     45.000 kHz     74.250000 MHz
    DMT 0x1c:  1280x800    59.810326 Hz  16:10    49.702 kHz     83.500000 MHz
    DMT 0x2f:  1440x900    59.887445 Hz  16:10    55.935 kHz    106.500000 MHz
    DMT 0x3a:  1680x1050   59.954250 Hz  16:10    65.290 kHz    146.250000 MHz
    DMT 0x52:  1920x1080   60.000000 Hz  16:9     67.500 kHz    148.500000 MHz
  Detailed Timing Descriptors:
    DTD 1:  1920x1080  143.854797 Hz  16:9    166.440 kHz    332.880000 MHz (595 mm x 336 mm)
                 Hfront    8 Hsync  32 Hback   40 Hpol N
                 Vfront   63 Vsync   8 Vback    6 Vpol P
    DTD 2:  1920x1080  119.877622 Hz  16:9    137.140 kHz    274.280000 MHz (595 mm x 336 mm)
                 Hfront    8 Hsync  32 Hback   40 Hpol N
                 Vfront   50 Vsync   8 Vback    6 Vpol P
    Display Range Limits:
      Monitor ranges (Range Limits Only): 48-144 Hz V, 180-180 kHz H, max dotclock 340 MHz
    Display Product Name: 'Acer XZ271'
  Extension blocks: 1
Checksum: 0xd6

----------------

Block 1, CTA-861 Extension Block:
  Revision: 3
  Underscans IT Video Formats by default
  Basic audio support
  Supports YCbCr 4:4:4
  Supports YCbCr 4:2:2
  Native DTDs: 1
  Video Data Block:
    VIC   1:   640x480    59.940476 Hz   4:3     31.469 kHz     25.175000 MHz
    VIC   3:   720x480    59.940060 Hz  16:9     31.469 kHz     27.000000 MHz
    VIC   4:  1280x720    60.000000 Hz  16:9     45.000 kHz     74.250000 MHz
    VIC  18:   720x576    50.000000 Hz  16:9     31.250 kHz     27.000000 MHz
    VIC  19:  1280x720    50.000000 Hz  16:9     37.500 kHz     74.250000 MHz
    VIC   5:  1920x1080i  60.000000 Hz  16:9     33.750 kHz     74.250000 MHz
    VIC  20:  1920x1080i  50.000000 Hz  16:9     28.125 kHz     74.250000 MHz
    VIC  63:  1920x1080  120.000000 Hz  16:9    135.000 kHz    297.000000 MHz
    VIC  31:  1920x1080   50.000000 Hz  16:9     56.250 kHz    148.500000 MHz
    VIC  16:  1920x1080   60.000000 Hz  16:9     67.500 kHz    148.500000 MHz (native)
    VIC   7:  1440x480i   59.940060 Hz  16:9     15.734 kHz     27.000000 MHz
  Audio Data Block:
    Linear PCM:
      Max channels: 2
      Supported sample rates (kHz): 48 44.1 32
      Supported sample sizes (bits): 24 20 16
  Speaker Allocation Data Block:
    FL/FR - Front Left/Right
  Vendor-Specific Data Block (HDMI), OUI 00-0C-03:
    Source physical address: 1.0.0.0
    Maximum TMDS clock: 330 MHz
  Detailed Timing Descriptors:
    DTD 3:  1920x1080   60.000000 Hz  16:9     67.500 kHz    148.500000 MHz (595 mm x 336 mm)
                 Hfront   88 Hsync  44 Hback  148 Hpol P
                 Vfront    4 Vsync   5 Vback   36 Vpol P
    DTD 4:  1280x720    60.000000 Hz  16:9     45.000 kHz     74.250000 MHz (595 mm x 336 mm)
                 Hfront  110 Hsync  40 Hback  220 Hpol P
                 Vfront    5 Vsync   5 Vback   20 Vpol P
    DTD 5:   720x480    59.940060 Hz   3:2     31.469 kHz     27.000000 MHz (595 mm x 336 mm)
                 Hfront   16 Hsync  62 Hback   60 Hpol N
                 Vfront    9 Vsync   6 Vback   30 Vpol N
    DTD 6:   720x576    50.000000 Hz   5:4     31.250 kHz     27.000000 MHz (595 mm x 336 mm)
                 Hfront   12 Hsync  64 Hback   68 Hpol N
                 Vfront    5 Vsync   5 Vback   39 Vpol N
    DTD 7:  1920x1080  119.877622 Hz  16:9    137.140 kHz    274.280000 MHz (595 mm x 336 mm)
                 Hfront    8 Hsync  32 Hback   40 Hpol N
                 Vfront   50 Vsync   8 Vback    6 Vpol P
Checksum: 0xb9  Unused space in Extension Block: 5 bytes

----------------

Warnings:

Block 1, CTA-861 Extension Block:
  Video Data Block: VIC 1 and the first DTD are not identical. Is this intended?
  Detailed Timing Descriptor #5: Image size is 595x336 mm, but based on the picture AR it should be 504x336 mm.
  Detailed Timing Descriptor #6: Image size is 595x336 mm, but based on the picture AR it should be 420x336 mm.
  Add a Colorimetry Data Block with the sRGB colorimetry bit set to avoid interop issues.
EDID:
  Base EDID: Some timings are out of range of the Monitor Ranges:
    Horizontal Freq: 15.734 - 166.440 kHz (Monitor: 180.000 - 180.000 kHz)

Failures:

Block 1, CTA-861 Extension Block:
  Vendor-Specific Data Block (HDMI), OUI 00-0C-03: The HDMI Specification requires EDID 1.3 instead of 1.4.
  Missing VCDB, needed for Set Selectable RGB Quantization to avoid interop issues.
EDID:
  Extension Block 2 started with EDID header, ignoring Extension Blocks >= 2.
  CTA-861: The maximum HDMI TMDS clock is 330000 kHz, but one or more video timings go up to 332880 kHz.

EDID conformity: FAIL
