edid-decode (hex):

00 ff ff ff ff ff ff 00 38 a3 7a 2c 01 01 01 01
28 1e 01 03 80 50 21 78 ea 97 d5 aa 52 4d a0 26
11 50 54 bf ef 80 81 00 81 40 81 80 81 c0 95 00
a9 40 b3 00 d1 c0 e7 7c 70 a0 d0 a0 29 50 30 20
3a 00 1d 4e 31 00 00 1a 00 00 00 fd 00 1e 4c 1f
5f 20 30 30 35 4e 41 0a 20 20 00 00 00 fc 00 45
58 33 34 31 52 0a 20 20 20 20 20 20 00 00 00 ff
00 30 58 37 30 36 39 37 34 4e 42 0a 20 20 01 41

02 03 28 f1 48 10 04 03 1f 13 01 12 5a 23 09 07
07 83 01 00 00 67 03 0c 00 10 00 38 40 67 d8 5d
c4 01 46 88 00 e2 0f 00 56 5e 00 a0 a0 a0 29 50
2f 20 35 00 1d 4e 31 00 00 1a 9f 3d 70 a0 d0 a0
15 50 50 20 8a 00 1d 4e 31 00 00 1e 9d 67 70 a0
d0 a0 22 50 50 20 5a 04 1d 4e 31 00 00 1e 6a 3e
b8 50 60 a0 29 50 08 20 b8 04 1d 4e 31 00 00 1a
00 00 00 00 00 00 00 00 00 00 00 00 00 00 00 0b

00 ff ff ff ff ff ff 00 38 a3 7a 2c 01 01 01 01
28 1e 01 03 80 50 21 78 ea 97 d5 aa 52 4d a0 26
11 50 54 bf ef 80 81 00 81 40 81 80 81 c0 95 00
a9 40 b3 00 d1 c0 e7 7c 70 a0 d0 a0 29 50 30 20
3a 00 1d 4e 31 00 00 1a 00 00 00 fd 00 1e 4c 1f
5f 20 30 30 35 4e 41 0a 20 20 00 00 00 fc 00 45
58 33 34 31 52 0a 20 20 20 20 20 20 00 00 00 ff
00 30 58 37 30 36 39 37 34 4e 42 0a 20 20 01 41

02 03 28 f1 48 10 04 03 1f 13 01 12 5a 23 09 07
07 83 01 00 00 67 03 0c 00 10 00 38 40 67 d8 5d
c4 01 46 88 00 e2 0f 00 56 5e 00 a0 a0 a0 29 50
2f 20 35 00 1d 4e 31 00 00 1a 9f 3d 70 a0 d0 a0
15 50 50 20 8a 00 1d 4e 31 00 00 1e 9d 67 70 a0
d0 a0 22 50 50 20 5a 04 1d 4e 31 00 00 1e 6a 3e
b8 50 60 a0 29 50 08 20 b8 04 1d 4e 31 00 00 1a
00 00 00 00 00 00 00 00 00 00 00 00 00 00 00 0b

----------------

Block 0, Base EDID:
  EDID Structure Version & Revision: 1.3
  Vendor & Product Identification:
    Manufacturer: NEC
    Model: 11386
    Serial Number: ...
    Made in: week 40 of 2020
  Basic Display Parameters & Features:
    Digital display
    Maximum image size: 80 cm x 33 cm
    Gamma: 2.20
    DPMS levels: Standby Suspend Off
    RGB color display
    First detailed timing is the preferred timing
  Color Characteristics:
    Red  : 0.6660, 0.3212
    Green: 0.3017, 0.6279
    Blue : 0.1513, 0.0673
    White: 0.3134, 0.3291
  Established Timings I & II:
    IBM     :   720x400    70.081663 Hz   9:5     31.467 kHz     28.320000 MHz
    DMT 0x04:   640x480    59.940476 Hz   4:3     31.469 kHz     25.175000 MHz
    Apple   :   640x480    66.666667 Hz   4:3     35.000 kHz     30.240000 MHz
    DMT 0x05:   640x480    72.808802 Hz   4:3     37.861 kHz     31.500000 MHz
    DMT 0x06:   640x480    75.000000 Hz   4:3     37.500 kHz     31.500000 MHz
    DMT 0x08:   800x600    56.250000 Hz   4:3     35.156 kHz     36.000000 MHz
    DMT 0x09:   800x600    60.316541 Hz   4:3     37.879 kHz     40.000000 MHz
    DMT 0x0a:   800x600    72.187572 Hz   4:3     48.077 kHz     50.000000 MHz
    DMT 0x0b:   800x600    75.000000 Hz   4:3     46.875 kHz     49.500000 MHz
    Apple   :   832x624    74.551266 Hz   4:3     49.726 kHz     57.284000 MHz
    DMT 0x10:  1024x768    60.003840 Hz   4:3     48.363 kHz     65.000000 MHz
    DMT 0x11:  1024x768    70.069359 Hz   4:3     56.476 kHz     75.000000 MHz
    DMT 0x12:  1024x768    75.028582 Hz   4:3     60.023 kHz     78.750000 MHz
    DMT 0x24:  1280x1024   75.024675 Hz   5:4     79.976 kHz    135.000000 MHz
    Apple   :  1152x870    75.061550 Hz 192:145   68.681 kHz    100.000000 MHz
  Standard Timings:
    DMT 0x1c:  1280x800    59.810326 Hz  16:10    49.702 kHz     83.500000 MHz
    DMT 0x20:  1280x960    60.000000 Hz   4:3     60.000 kHz    108.000000 MHz
    DMT 0x23:  1280x1024   60.019740 Hz   5:4     63.981 kHz    108.000000 MHz
    DMT 0x55:  1280x720    60.000000 Hz  16:9     45.000 kHz     74.250000 MHz
    DMT 0x2f:  1440x900    59.887445 Hz  16:10    55.935 kHz    106.500000 MHz
    DMT 0x33:  1600x1200   60.000000 Hz   4:3     75.000 kHz    162.000000 MHz
    DMT 0x3a:  1680x1050   59.954250 Hz  16:10    65.290 kHz    146.250000 MHz
    DMT 0x52:  1920x1080   60.000000 Hz  16:9     67.500 kHz    148.500000 MHz
  Detailed Timing Descriptors:
    DTD 1:  3440x1440   59.972616 Hz  43:18    88.819 kHz    319.750000 MHz (797 mm x 334 mm)
                 Hfront   48 Hsync  32 Hback   80 Hpol P
                 Vfront    3 Vsync  10 Vback   28 Vpol N
    Display Range Limits:
      Monitor ranges (Unknown (0x30)): 30-76 Hz V, 31-95 kHz H, max dotclock 320 MHz
    Display Product Name: 'EX341R'
    Display Product Serial Number: ...
  Extension blocks: 1
Checksum: 0x41

----------------

Block 1, CTA-861 Extension Block:
  Revision: 3
  Underscans IT Video Formats by default
  Basic audio support
  Supports YCbCr 4:4:4
  Supports YCbCr 4:2:2
  Native detailed modes: 1
  Video Data Block:
    VIC  16:  1920x1080   60.000000 Hz  16:9     67.500 kHz    148.500000 MHz
    VIC   4:  1280x720    60.000000 Hz  16:9     45.000 kHz     74.250000 MHz
    VIC   3:   720x480    59.940060 Hz  16:9     31.469 kHz     27.000000 MHz
    VIC  31:  1920x1080   50.000000 Hz  16:9     56.250 kHz    148.500000 MHz
    VIC  19:  1280x720    50.000000 Hz  16:9     37.500 kHz     74.250000 MHz
    VIC   1:   640x480    59.940476 Hz   4:3     31.469 kHz     25.175000 MHz
    VIC  18:   720x576    50.000000 Hz  16:9     31.250 kHz     27.000000 MHz
    VIC  90:  2560x1080   60.000000 Hz  64:27    66.000 kHz    198.000000 MHz
  Audio Data Block:
    Linear PCM:
      Max channels: 2
      Supported sample rates (kHz): 48 44.1 32
      Supported sample sizes (bits): 24 20 16
  Speaker Allocation Data Block:
    FL/FR - Front Left/Right
  Vendor-Specific Data Block (HDMI), OUI 00-0C-03:
    Source physical address: 1.0.0.0
    DC_36bit
    DC_30bit
    DC_Y444
    Maximum TMDS clock: 320 MHz
  Vendor-Specific Data Block (HDMI Forum), OUI C4-5D-D8:
    Version: 1
    Maximum TMDS Character Rate: 350 MHz
    SCDC Present
    Supports scrambling for <= 340 Mcsc
  YCbCr 4:2:0 Capability Map Data Block:
    Empty Capability Map
  Detailed Timing Descriptors:
    DTD 2:  2560x1440   59.950550 Hz  16:9     88.787 kHz    241.500000 MHz (797 mm x 334 mm)
                 Hfront   47 Hsync  32 Hback   81 Hpol P
                 Vfront    3 Vsync   5 Vback   33 Vpol N
    DTD 3:  3440x1440   29.992775 Hz  43:18    43.819 kHz    157.750000 MHz (797 mm x 334 mm)
                 Hfront   80 Hsync  32 Hback   48 Hpol P
                 Vfront    8 Vsync  10 Vback    3 Vpol P
    DTD 4:  3440x1440   49.986808 Hz  43:18    73.681 kHz    265.250000 MHz (797 mm x 334 mm)
                 Hfront   80 Hsync  32 Hback   48 Hpol P
                 Vfront   21 Vsync  10 Vback    3 Vpol P
    DTD 5:  1720x1440   59.936980 Hz  43:36    88.767 kHz    159.780000 MHz (797 mm x 334 mm)
                 Hfront    8 Hsync  32 Hback   40 Hpol P
                 Vfront   27 Vsync   8 Vback    6 Vpol N
Checksum: 0x0b  Unused space in Extension Block: 15 bytes

----------------

Block 2, Unknown EDID Extension Block 0x00:
  00 ff ff ff ff ff ff 00 38 a3 7a 2c 01 01 01 01 '........8.z,....'
  28 1e 01 03 80 50 21 78 ea 97 d5 aa 52 4d a0 26 '(....P!x....RM.&'
  11 50 54 bf ef 80 81 00 81 40 81 80 81 c0 95 00 '.PT......@......'
  a9 40 b3 00 d1 c0 e7 7c 70 a0 d0 a0 29 50 30 20 '.@.....|p...)P0 '
  3a 00 1d 4e 31 00 00 1a 00 00 00 fd 00 1e 4c 1f ':..N1.........L.'
  5f 20 30 30 35 4e 41 0a 20 20 00 00 00 fc 00 45 '_ 005NA.  .....E'
  58 33 34 31 52 0a 20 20 20 20 20 20 00 00 00 ff 'X341R.      ....'
  00 30 58 37 30 36 39 37 34 4e 42 0a 20 20 01 41 '.0X706974NB.  .A'
Checksum: 0x41

----------------

Block 3, CTA-861 Extension Block:
  Revision: 3
  Underscans IT Video Formats by default
  Basic audio support
  Supports YCbCr 4:4:4
  Supports YCbCr 4:2:2
  Native detailed modes: 1
  Video Data Block:
    VIC  16:  1920x1080   60.000000 Hz  16:9     67.500 kHz    148.500000 MHz
    VIC   4:  1280x720    60.000000 Hz  16:9     45.000 kHz     74.250000 MHz
    VIC   3:   720x480    59.940060 Hz  16:9     31.469 kHz     27.000000 MHz
    VIC  31:  1920x1080   50.000000 Hz  16:9     56.250 kHz    148.500000 MHz
    VIC  19:  1280x720    50.000000 Hz  16:9     37.500 kHz     74.250000 MHz
    VIC   1:   640x480    59.940476 Hz   4:3     31.469 kHz     25.175000 MHz
    VIC  18:   720x576    50.000000 Hz  16:9     31.250 kHz     27.000000 MHz
    VIC  90:  2560x1080   60.000000 Hz  64:27    66.000 kHz    198.000000 MHz
  Audio Data Block:
    Linear PCM:
      Max channels: 2
      Supported sample rates (kHz): 48 44.1 32
      Supported sample sizes (bits): 24 20 16
  Speaker Allocation Data Block:
    FL/FR - Front Left/Right
  Vendor-Specific Data Block (HDMI), OUI 00-0C-03:
    Source physical address: 1.0.0.0
    DC_36bit
    DC_30bit
    DC_Y444
    Maximum TMDS clock: 320 MHz
  Vendor-Specific Data Block (HDMI Forum), OUI C4-5D-D8:
    Version: 1
    Maximum TMDS Character Rate: 350 MHz
    SCDC Present
    Supports scrambling for <= 340 Mcsc
  YCbCr 4:2:0 Capability Map Data Block:
    Empty Capability Map
  Detailed Timing Descriptors:
    DTD 6:  2560x1440   59.950550 Hz  16:9     88.787 kHz    241.500000 MHz (797 mm x 334 mm)
                 Hfront   47 Hsync  32 Hback   81 Hpol P
                 Vfront    3 Vsync   5 Vback   33 Vpol N
    DTD 7:  3440x1440   29.992775 Hz  43:18    43.819 kHz    157.750000 MHz (797 mm x 334 mm)
                 Hfront   80 Hsync  32 Hback   48 Hpol P
                 Vfront    8 Vsync  10 Vback    3 Vpol P
    DTD 8:  3440x1440   49.986808 Hz  43:18    73.681 kHz    265.250000 MHz (797 mm x 334 mm)
                 Hfront   80 Hsync  32 Hback   48 Hpol P
                 Vfront   21 Vsync  10 Vback    3 Vpol P
    DTD 9:  1720x1440   59.936980 Hz  43:36    88.767 kHz    159.780000 MHz (797 mm x 334 mm)
                 Hfront    8 Hsync  32 Hback   40 Hpol P
                 Vfront   27 Vsync   8 Vback    6 Vpol N
Checksum: 0x0b  Unused space in Extension Block: 15 bytes

----------------

Warnings:

Block 0, Base EDID:
  Vendor & Product Identification: The serial number is one of the known dummy values, it should probably be set to 0.
Block 1, CTA-861 Extension Block:
  Video Data Block: VIC 16 and the first DTD are not identical. Is this intended?
  Detailed Timing Descriptor #2: Image size is 797x334 mm, but based on the picture AR it should be 797x448 mm.
  Detailed Timing Descriptor #5: Image size is 797x334 mm, but based on the picture AR it should be 797x667 mm.
  Display Product Serial Number is set, so the Serial Number in the Base EDID should be 0.
  Add a Colorimetry Data Block with the sRGB colorimetry bit set to avoid interop issues.
Block 3, CTA-861 Extension Block:
  Detailed Timing Descriptor #6: Image size is 797x334 mm, but based on the picture AR it should be 797x448 mm.
  Detailed Timing Descriptor #9: Image size is 797x334 mm, but based on the picture AR it should be 797x667 mm.

Failures:

Block 0, Base EDID:
  Display Range Limits: Unknown range class (0x30).
  Display Range Limits: Byte 11 is 0x30 instead of 0x0a.
  Display Range Limits: Bytes 12-17 must be 0x20.
Block 1, CTA-861 Extension Block:
  YCbCr 4:2:0 Capability Map Data Block: Empty Capability Map.
  Missing VCDB, needed for Set Selectable RGB Quantization to avoid interop issues.
Block 2, Base EDID:
  Unknown Extension Block.
Block 3, CTA-861 Extension Block:
  Video Data Block: Duplicate VIC 16.
  Video Data Block: Duplicate VIC 4.
  Video Data Block: Duplicate VIC 3.
  Video Data Block: Duplicate VIC 31.
  Video Data Block: Duplicate VIC 19.
  Video Data Block: Duplicate VIC 1.
  Video Data Block: Duplicate VIC 18.
  Video Data Block: Duplicate VIC 90.
  Speaker Allocation Data Block: Only one instance of this Data Block is allowed.
  Vendor-Specific Data Block (HDMI Forum), OUI C4-5D-D8: Duplicate HDMI Forum VSDB/SCDB.
  YCbCr 4:2:0 Capability Map Data Block: Only one instance of this Data Block is allowed.
  YCbCr 4:2:0 Capability Map Data Block: Empty Capability Map.
EDID:
  Base EDID: EDID specified 1 extension block(s), but found 3 extension block(s).
  Base EDID: EDID 1.3 requires a Block Map Extension in Block 1 if there are more than 2 blocks in the EDID.

EDID conformity: FAIL
