edid-decode (hex):

00 ff ff ff ff ff ff 00 20 40 01 00 01 01 01 01
2a 16 01 03 80 59 32 78 0a 0d c9 a0 57 47 98 27
12 48 4c 21 08 00 31 40 45 40 61 40 81 00 8b c0
01 01 d1 c0 01 01 66 21 50 b0 51 00 1b 30 40 70
36 00 75 f2 31 00 00 1e 00 00 00 fe 00 48 42 54
56 2d 32 39 44 30 37 48 44 0a 00 00 00 fc 00 48
42 54 56 2d 32 39 44 30 37 48 44 0a 00 00 00 fd
00 31 4c 0f 50 0e 00 0a 20 20 20 20 20 20 01 b1

02 03 2e 74 53 02 04 2e 11 13 28 20 22 10 21 1f
06 15 03 07 12 16 05 14 23 09 0f 00 83 01 00 00
6d 03 0c 00 10 00 b9 2d c0 00 00 00 00 00 01 1d
00 bc 52 d0 1e 20 b8 28 55 40 75 f2 31 00 00 1e
01 1d 80 d0 72 1c 16 20 10 2c 25 80 75 f2 31 00
00 9f 8c 0a d0 8a 20 e0 2d 10 10 3e 96 00 75 f2
31 00 00 19 8c 0a d0 90 20 40 31 20 0c 40 55 00
75 f2 31 00 00 18 00 00 00 00 00 00 00 00 00 34

00 ff ff ff ff ff ff 00 20 40 01 00 01 01 01 01
2a 16 01 03 80 59 32 78 0a 0d c9 a0 57 47 98 27
12 48 4c 21 08 00 31 40 45 40 61 40 81 00 8b c0
01 01 d1 c0 01 01 66 21 50 b0 51 00 1b 30 40 70
36 00 75 f2 31 00 00 1e 00 00 00 fe 00 48 42 54
56 2d 32 39 44 30 37 48 44 0a 00 00 00 fc 00 48
42 54 56 2d 32 39 44 30 37 48 44 0a 00 00 00 fd
00 31 4c 0f 50 0e 00 0a 20 20 20 20 20 20 01 b1

02 03 2e 74 53 02 04 2e 11 13 28 20 22 10 21 1f
06 15 03 07 12 16 05 14 23 09 0f 00 83 01 00 00
6d 03 0c 00 10 00 b9 2d c0 00 00 00 00 00 01 1d
00 bc 52 d0 1e 20 b8 28 55 40 75 f2 31 00 00 1e
01 1d 80 d0 72 1c 16 20 10 2c 25 80 75 f2 31 00
00 9f 8c 0a d0 8a 20 e0 2d 10 10 3e 96 00 75 f2
31 00 00 19 8c 0a d0 90 20 40 31 20 0c 40 55 00
75 f2 31 00 00 18 00 00 00 00 00 00 00 00 00 34

----------------

Block 0, Base EDID:
  EDID Structure Version & Revision: 1.3
  Vendor & Product Identification:
    Manufacturer: HB@
    Model: 1
    Serial Number: ...
    Made in: week 42 of 2012
  Basic Display Parameters & Features:
    Digital display
    Maximum image size: 89 cm x 50 cm
    Gamma: 2.20
    RGB color display
    First detailed timing is the preferred timing
  Color Characteristics:
    Red  : 0.6250, 0.3398
    Green: 0.2802, 0.5947
    Blue : 0.1552, 0.0703
    White: 0.2832, 0.2978
  Established Timings I & II:
    DMT 0x04:   640x480    59.940476 Hz   4:3     31.469 kHz     25.175000 MHz
    DMT 0x09:   800x600    60.316541 Hz   4:3     37.879 kHz     40.000000 MHz
    DMT 0x10:  1024x768    60.003840 Hz   4:3     48.363 kHz     65.000000 MHz
  Standard Timings:
    DMT 0x04:   640x480    59.940476 Hz   4:3     31.469 kHz     25.175000 MHz
    DMT 0x09:   800x600    60.316541 Hz   4:3     37.879 kHz     40.000000 MHz
    DMT 0x10:  1024x768    60.003840 Hz   4:3     48.363 kHz     65.000000 MHz
    DMT 0x1c:  1280x800    59.810326 Hz  16:10    49.702 kHz     83.500000 MHz
    GTF     :  1360x765    60.000341 Hz  16:9     47.520 kHz     84.396000 MHz
    DMT 0x52:  1920x1080   60.000000 Hz  16:9     67.500 kHz    148.500000 MHz
  Detailed Timing Descriptors:
    DTD 1:  1360x768    60.015162 Hz  85:48    47.712 kHz     85.500000 MHz (885 mm x 498 mm)
                 Hfront   64 Hsync 112 Hback  256 Hpol P
                 Vfront    3 Vsync   6 Vback   18 Vpol P
    Alphanumeric Data String: 'HBTV-29D07HD'
    Display Product Name: 'HBTV-29D07HD'
    Display Range Limits:
      Monitor ranges (GTF): 49-76 Hz V, 15-80 kHz H, max dotclock 140 MHz
  Extension blocks: 1
Checksum: 0xb1

----------------

Block 1, CTA-861 Extension Block:
  Revision: 3
  Basic audio support
  Supports YCbCr 4:4:4
  Supports YCbCr 4:2:2
  Native DTDs: 4
  Video Data Block:
    VIC   2:   720x480    59.940060 Hz   4:3     31.469 kHz     27.000000 MHz
    VIC   4:  1280x720    60.000000 Hz  16:9     45.000 kHz     74.250000 MHz
    VIC  46:  1920x1080i 120.000000 Hz  16:9     67.500 kHz    148.500000 MHz
    VIC  17:   720x576    50.000000 Hz   4:3     31.250 kHz     27.000000 MHz
    VIC  19:  1280x720    50.000000 Hz  16:9     37.500 kHz     74.250000 MHz
    VIC  40:  1920x1080i 100.000000 Hz  16:9     56.250 kHz    148.500000 MHz
    VIC  32:  1920x1080   24.000000 Hz  16:9     27.000 kHz     74.250000 MHz
    VIC  34:  1920x1080   30.000000 Hz  16:9     33.750 kHz     74.250000 MHz
    VIC  16:  1920x1080   60.000000 Hz  16:9     67.500 kHz    148.500000 MHz
    VIC  33:  1920x1080   25.000000 Hz  16:9     28.125 kHz     74.250000 MHz
    VIC  31:  1920x1080   50.000000 Hz  16:9     56.250 kHz    148.500000 MHz
    VIC   6:  1440x480i   59.940060 Hz   4:3     15.734 kHz     27.000000 MHz
    VIC  21:  1440x576i   50.000000 Hz   4:3     15.625 kHz     27.000000 MHz
    VIC   3:   720x480    59.940060 Hz  16:9     31.469 kHz     27.000000 MHz
    VIC   7:  1440x480i   59.940060 Hz  16:9     15.734 kHz     27.000000 MHz
    VIC  18:   720x576    50.000000 Hz  16:9     31.250 kHz     27.000000 MHz
    VIC  22:  1440x576i   50.000000 Hz  16:9     15.625 kHz     27.000000 MHz
    VIC   5:  1920x1080i  60.000000 Hz  16:9     33.750 kHz     74.250000 MHz
    VIC  20:  1920x1080i  50.000000 Hz  16:9     28.125 kHz     74.250000 MHz
  Audio Data Block:
    Linear PCM:
      Max channels: 2
      Supported sample rates (kHz): 88.2 48 44.1 32
      Supported sample sizes (bits):
  Speaker Allocation Data Block:
    FL/FR - Front Left/Right
  Vendor-Specific Data Block (HDMI), OUI 00-0C-03:
    Source physical address: 1.0.0.0
    Supports_AI
    DC_36bit
    DC_30bit
    DC_Y444
    DVI_Dual
    Maximum TMDS clock: 225 MHz
    Video latency: Unknown
    Audio latency: Unknown
    Interlaced video latency: Unknown
    Interlaced audio latency: Unknown
  Detailed Timing Descriptors:
    DTD 2:  1280x720    50.000000 Hz  16:9     37.500 kHz     74.250000 MHz (885 mm x 498 mm)
                 Hfront  440 Hsync  40 Hback  220 Hpol P
                 Vfront    5 Vsync   5 Vback   20 Vpol P
    DTD 3:  1920x1080i  50.000000 Hz  16:9     28.125 kHz     74.250000 MHz (885 mm x 498 mm)
                 Hfront  528 Hsync  44 Hback  148 Hpol P
                 Vfront    2 Vsync   5 Vback   15 Vpol P Vfront +0.5 Odd Field
                 Vfront    2 Vsync   5 Vback   15 Vpol P Vback  +0.5 Even Field
    DTD 4:   720x480    59.940060 Hz   3:2     31.469 kHz     27.000000 MHz (885 mm x 498 mm)
                 Hfront   16 Hsync  62 Hback   60 Hpol N
                 Vfront    9 Vsync   6 Vback   30 Vpol N
    DTD 5:   720x576    50.000000 Hz   5:4     31.250 kHz     27.000000 MHz (885 mm x 498 mm)
                 Hfront   12 Hsync  64 Hback   68 Hpol N
                 Vfront    5 Vsync   5 Vback   39 Vpol N
Checksum: 0x34  Unused space in Extension Block: 9 bytes

----------------

Warnings:

Block 0, Base EDID:
  Vendor & Product Identification: The serial number is one of the known dummy values, it should probably be set to 0.
  Standard Timings: Standard Timing 1360x765 has a dubious odd vertical resolution.
Block 1, CTA-861 Extension Block:
  IT Video Formats are overscanned by default, but normally this should be underscanned.
  Video Data Block: VIC 2 and the first DTD are not identical. Is this intended?
  Vendor-Specific Data Block (HDMI), OUI 00-0C-03: Progressive and Interlaced latency values are identical, no need for both.
  Detailed Timing Descriptor #4: Image size is 885x498 mm, but based on the picture AR it should be 747x498 mm.
  Detailed Timing Descriptor #5: Image size is 885x498 mm, but based on the picture AR it should be 622x498 mm.
  Add a Colorimetry Data Block with the sRGB colorimetry bit set to avoid interop issues.
EDID:
  Base EDID: Some timings are out of range of the Monitor Ranges:
    Vertical Freq: 24.000 - 120.000 Hz (Monitor: 49.000 - 76.000 Hz)
    Maximum Clock: 148.500 MHz (Monitor: 140.000 MHz)

Failures:

Block 0, Base EDID:
  Vendor & Product Identification: Manufacturer name field contains garbage.
Block 1, CTA-861 Extension Block:
  Missing VCDB, needed for Set Selectable RGB Quantization to avoid interop issues.
EDID:
  Extension Block 2 started with EDID header, ignoring Extension Blocks >= 2.
  CTA-861: Native progressive timings are a mix of several resolutions.

EDID conformity: FAIL
