edid-decode (hex):

00 ff ff ff ff ff ff 00 1a aa 11 48 05 03 b0 16
31 1a 01 03 08 2c 19 78 ea 94 f0 a1 59 57 9f 26
0e 50 54 ad ce 00 81 00 95 00 01 01 01 01 01 01
01 01 01 01 01 01 30 2a 40 c8 60 84 64 30 18 50
13 00 ba f9 10 00 00 1e 00 00 00 fd 00 37 4c 1e
48 0e 00 0a 20 20 20 20 20 20 00 00 00 fc 00 56
4c 2d 32 30 30 53 53 57 4c 0a 20 20 00 00 00 fe
00 0a 20 20 20 20 20 20 20 20 20 20 20 20 00 c8

00 ff ff ff ff ff ff 00 1a aa 11 48 05 03 b0 16
31 1a 01 03 08 2c 19 78 ea 94 f0 a1 59 57 9f 26
0e 50 54 ad ce 00 81 00 95 00 01 01 01 01 01 01
01 01 01 01 01 01 30 2a 40 c8 60 84 64 30 18 50
13 00 ba f9 10 00 00 1e 00 00 00 fd 00 37 4c 1e
48 0e 00 0a 20 20 20 20 20 20 00 00 00 fc 00 56
4c 2d 32 30 30 53 53 57 4c 0a 20 20 00 00 00 fe
00 0a 20 20 20 20 20 20 20 20 20 20 20 20 00 c8

----------------

Block 0, Base EDID:
  EDID Structure Version & Revision: 1.3
  Vendor & Product Identification:
    Manufacturer: FUJ
    Model: 18449
    Serial Number: ...
    Made in: week 49 of 2016
  Basic Display Parameters & Features:
    Analog display
    Signal Level Standard: 0.700 : 0.300 : 1.000 V p-p
    Blank level equals black level
    Sync: Separate
    Maximum image size: 44 cm x 25 cm
    Gamma: 2.20
    DPMS levels: Standby Suspend Off
    RGB color display
    First detailed timing is the preferred timing
  Color Characteristics:
    Red  : 0.6308, 0.3486
    Green: 0.3408, 0.6210
    Blue : 0.1513, 0.0576
    White: 0.3125, 0.3281
  Established Timings I & II:
    IBM     :   720x400    70.081663 Hz   9:5     31.467 kHz     28.320000 MHz
    DMT 0x04:   640x480    59.940476 Hz   4:3     31.469 kHz     25.175000 MHz
    DMT 0x05:   640x480    72.808802 Hz   4:3     37.861 kHz     31.500000 MHz
    DMT 0x06:   640x480    75.000000 Hz   4:3     37.500 kHz     31.500000 MHz
    DMT 0x09:   800x600    60.316541 Hz   4:3     37.879 kHz     40.000000 MHz
    DMT 0x0a:   800x600    72.187572 Hz   4:3     48.077 kHz     50.000000 MHz
    DMT 0x0b:   800x600    75.000000 Hz   4:3     46.875 kHz     49.500000 MHz
    DMT 0x10:  1024x768    60.003840 Hz   4:3     48.363 kHz     65.000000 MHz
    DMT 0x11:  1024x768    70.069359 Hz   4:3     56.476 kHz     75.000000 MHz
    DMT 0x12:  1024x768    75.028582 Hz   4:3     60.023 kHz     78.750000 MHz
  Standard Timings:
    DMT 0x1c:  1280x800    59.810326 Hz  16:10    49.702 kHz     83.500000 MHz
    DMT 0x2f:  1440x900    59.887445 Hz  16:10    55.935 kHz    106.500000 MHz
  Detailed Timing Descriptors:
    DTD 1:  1600x900    60.000000 Hz  16:9     60.000 kHz    108.000000 MHz (442 mm x 249 mm)
                 Hfront   24 Hsync  80 Hback   96 Hpol P
                 Vfront    1 Vsync   3 Vback   96 Vpol P
    Display Range Limits:
      Monitor ranges (GTF): 55-76 Hz V, 30-72 kHz H, max dotclock 140 MHz
    Display Product Name: 'VL-200SSWL'
    Alphanumeric Data String: ''
Checksum: 0xc8

----------------

Failures:

Block 0, Base EDID:
  Alphanumeric Data String: Empty string.
EDID:
  Extension Block 1 started with EDID header, ignoring Extension Blocks >= 1.

EDID conformity: FAIL
