edid-decode (hex):

00 ff ff ff ff ff ff 00 06 af 2c 11 00 00 00 00
01 12 01 03 80 1d 10 78 0a ba 65 9b 59 54 9e 26
1a 4d 52 00 00 00 01 01 01 01 01 01 01 01 01 01
01 01 01 01 01 01 20 1c 56 80 50 00 23 30 30 20
36 00 25 a4 10 00 00 18 00 00 00 0f 00 00 00 00
00 00 00 00 00 00 00 00 00 20 00 00 00 fe 00 41
55 4f 0a 20 20 20 20 20 20 20 20 20 00 00 00 fe
00 42 31 33 33 58 57 30 31 20 56 31 20 0a 00 ba

00 ff ff ff ff ff ff 00 06 af 2c 11 00 00 00 00
01 12 01 03 80 1d 10 78 0a ba 65 9b 59 54 9e 26
1a 4d 52 00 00 00 01 01 01 01 01 01 01 01 01 01
01 01 01 01 01 01 20 1c 56 80 50 00 23 30 30 20
36 00 25 a4 10 00 00 18 00 00 00 0f 00 00 00 00
00 00 00 00 00 00 00 00 00 20 00 00 00 fe 00 41
55 4f 0a 20 20 20 20 20 20 20 20 20 00 00 00 fe
00 42 31 33 33 58 57 30 31 20 56 31 20 0a 00 ba

----------------

Block 0, Base EDID:
  EDID Structure Version & Revision: 1.3
  Vendor & Product Identification:
    Manufacturer: AUO
    Model: 4396
    Made in: week 1 of 2008
  Basic Display Parameters & Features:
    Digital display
    Maximum image size: 29 cm x 16 cm
    Gamma: 2.20
    RGB color display
    First detailed timing is the preferred timing
  Color Characteristics:
    Red  : 0.6074, 0.3505
    Green: 0.3300, 0.6191
    Blue : 0.1494, 0.1035
    White: 0.3017, 0.3212
  Established Timings I & II: none
  Standard Timings: none
  Detailed Timing Descriptors:
    DTD 1:  1366x768    60.015904 Hz 683:384   48.193 kHz     72.000000 MHz (293 mm x 164 mm)
                 Hfront   48 Hsync  32 Hback   48 Hpol N
                 Vfront    3 Vsync   6 Vback   26 Vpol N
    Manufacturer-Specified Display Descriptor (0x0f): 00 0f 00 00 00 00 00 00 00 00 00 00 00 00 00 20 '............... '
    Alphanumeric Data String: 'AUO'
    Alphanumeric Data String: 'B133XW01 V1 '
Checksum: 0xba

----------------

Failures:

Block 0, Base EDID:
  Alphanumeric Data String: One or more trailing spaces before newline.
  Missing Display Product Name.
  Missing Display Range Limits Descriptor.
EDID:
  Extension Block 1 started with EDID header, ignoring Extension Blocks >= 1.

EDID conformity: FAIL
