edid-decode (hex):

00 ff ff ff ff ff ff 00 43 0f 18 34 00 00 00 00
2d 20 01 04 b5 51 23 78 3b 64 f5 ad 50 49 aa 22
13 50 54 a5 cf 00 71 4f 81 c0 81 40 81 80 95 00
a9 c0 b3 00 d1 c0 f5 7c 70 a0 d0 a0 29 50 30 20
35 00 2a 5c 31 00 00 1a 20 fd 70 a0 d0 a0 3c 50
30 20 35 00 2a 5c 31 00 00 1e 00 00 00 fd 00 30
91 a0 a0 50 01 0a 20 20 20 20 20 20 00 00 00 fc
00 50 69 78 69 6f 20 50 58 43 33 34 38 43 02 4f

02 03 2c f4 51 01 02 03 04 05 90 11 12 13 14 1f
3f 5d 5e 5f 60 61 23 09 07 07 83 01 00 00 6d 1a
00 00 02 01 30 91 00 00 68 00 00 00 f0 d2 70 a0
d0 a0 3c 50 30 20 35 00 2a 5c 31 00 00 1e 4d d0
00 a0 f0 70 3e 80 30 20 35 00 2a 5c 31 00 00 1e
f2 49 00 a0 a0 38 50 40 20 30 35 00 2a 5c 31 00
00 1e 00 00 00 00 00 00 00 00 00 00 00 00 00 00
00 00 00 00 00 00 00 00 00 00 00 00 00 00 00 fd

70 12 79 00 00 03 00 50 e6 2b 01 04 6f 0d 9f 00
2f 00 1f 00 9f 05 28 00 02 00 04 00 17 42 00 04
b7 06 9f 00 2f 00 1f 00 9f 05 3b 00 02 00 04 00
55 c2 00 04 ff 09 9f 00 2f 00 1f 00 9f 05 54 00
04 00 02 00 50 e9 00 04 ff 09 9f 00 2f 00 1f 00
9f 05 54 00 04 00 02 00 07 00 0a 08 91 08 08 a4
10 06 12 90 84 00 00 00 00 00 00 00 00 00 00 00
00 00 00 00 00 00 00 00 00 00 00 00 00 00 0d 90

00 ff ff ff ff ff ff 00 43 0f 18 34 00 00 00 00
2d 20 01 04 b5 51 23 78 3b 64 f5 ad 50 49 aa 22
13 50 54 a5 cf 00 71 4f 81 c0 81 40 81 80 95 00
a9 c0 b3 00 d1 c0 f5 7c 70 a0 d0 a0 29 50 30 20
35 00 2a 5c 31 00 00 1a 20 fd 70 a0 d0 a0 3c 50
30 20 35 00 2a 5c 31 00 00 1e 00 00 00 fd 00 30
91 a0 a0 50 01 0a 20 20 20 20 20 20 00 00 00 fc
00 50 69 78 69 6f 20 50 58 43 33 34 38 43 02 4f

02 03 2c f4 51 01 02 03 04 05 90 11 12 13 14 1f
3f 5d 5e 5f 60 61 23 09 07 07 83 01 00 00 6d 1a
00 00 02 01 30 91 00 00 68 00 00 00 f0 d2 70 a0
d0 a0 3c 50 30 20 35 00 2a 5c 31 00 00 1e 4d d0
00 a0 f0 70 3e 80 30 20 35 00 2a 5c 31 00 00 1e
f2 49 00 a0 a0 38 50 40 20 30 35 00 2a 5c 31 00
00 1e 00 00 00 00 00 00 00 00 00 00 00 00 00 00
00 00 00 00 00 00 00 00 00 00 00 00 00 00 00 fd

70 12 79 00 00 03 00 50 e6 2b 01 04 6f 0d 9f 00
2f 00 1f 00 9f 05 28 00 02 00 04 00 17 42 00 04
b7 06 9f 00 2f 00 1f 00 9f 05 3b 00 02 00 04 00
55 c2 00 04 ff 09 9f 00 2f 00 1f 00 9f 05 54 00
04 00 02 00 50 e9 00 04 ff 09 9f 00 2f 00 1f 00
9f 05 54 00 04 00 02 00 07 00 0a 08 91 08 08 a4
10 06 12 90 84 00 00 00 00 00 00 00 00 00 00 00
00 00 00 00 00 00 00 00 00 00 00 00 00 00 0d 90

----------------

Block 0, Base EDID:
  EDID Structure Version & Revision: 1.4
  Vendor & Product Identification:
    Manufacturer: PXO
    Model: 13336
    Made in: week 45 of 2022
  Basic Display Parameters & Features:
    Digital display
    Bits per primary color channel: 10
    DisplayPort interface
    Maximum image size: 81 cm x 35 cm
    Gamma: 2.20
    DPMS levels: Off
    Supported color formats: RGB 4:4:4, YCrCb 4:4:4, YCrCb 4:2:2
    First detailed timing includes the native pixel format and preferred refresh rate
    Display supports continuous frequencies
  Color Characteristics:
    Red  : 0.6767, 0.3144
    Green: 0.2861, 0.6640
    Blue : 0.1357, 0.0771
    White: 0.3134, 0.3291
  Established Timings I & II:
    IBM     :   720x400    70.081663 Hz   9:5     31.467 kHz     28.320000 MHz
    DMT 0x04:   640x480    59.940476 Hz   4:3     31.469 kHz     25.175000 MHz
    DMT 0x06:   640x480    75.000000 Hz   4:3     37.500 kHz     31.500000 MHz
    DMT 0x09:   800x600    60.316541 Hz   4:3     37.879 kHz     40.000000 MHz
    DMT 0x0a:   800x600    72.187572 Hz   4:3     48.077 kHz     50.000000 MHz
    DMT 0x0b:   800x600    75.000000 Hz   4:3     46.875 kHz     49.500000 MHz
    DMT 0x10:  1024x768    60.003840 Hz   4:3     48.363 kHz     65.000000 MHz
    DMT 0x11:  1024x768    70.069359 Hz   4:3     56.476 kHz     75.000000 MHz
    DMT 0x12:  1024x768    75.028582 Hz   4:3     60.023 kHz     78.750000 MHz
    DMT 0x24:  1280x1024   75.024675 Hz   5:4     79.976 kHz    135.000000 MHz
  Standard Timings:
    DMT 0x15:  1152x864    75.000000 Hz   4:3     67.500 kHz    108.000000 MHz
    DMT 0x55:  1280x720    60.000000 Hz  16:9     45.000 kHz     74.250000 MHz
    DMT 0x20:  1280x960    60.000000 Hz   4:3     60.000 kHz    108.000000 MHz
    DMT 0x23:  1280x1024   60.019740 Hz   5:4     63.981 kHz    108.000000 MHz
    DMT 0x2f:  1440x900    59.887445 Hz  16:10    55.935 kHz    106.500000 MHz
    DMT 0x53:  1600x900    60.000000 Hz  16:9     60.000 kHz    108.000000 MHz (RB)
    DMT 0x3a:  1680x1050   59.954250 Hz  16:10    65.290 kHz    146.250000 MHz
    DMT 0x52:  1920x1080   60.000000 Hz  16:9     67.500 kHz    148.500000 MHz
  Detailed Timing Descriptors:
    DTD 1:  3440x1440   59.998875 Hz  43:18    88.858 kHz    319.890000 MHz (810 mm x 348 mm)
                 Hfront   48 Hsync  32 Hback   80 Hpol P
                 Vfront    3 Vsync   5 Vback   33 Vpol N
    DTD 2:  3440x1440  120.000000 Hz  43:18   180.000 kHz    648.000000 MHz (810 mm x 348 mm)
                 Hfront   48 Hsync  32 Hback   80 Hpol P
                 Vfront    3 Vsync   5 Vback   52 Vpol P
    Display Range Limits:
      Monitor ranges (Range Limits Only): 48-145 Hz V, 160-160 kHz H, max dotclock 800 MHz
    Display Product Name: 'Pixio PXC348C'
  Extension blocks: 2
Checksum: 0x4f

----------------

Block 1, CTA-861 Extension Block:
  Revision: 3
  Underscans IT Video Formats by default
  Basic audio support
  Supports YCbCr 4:4:4
  Supports YCbCr 4:2:2
  Native DTDs: 4
  Video Data Block:
    VIC   1:   640x480    59.940476 Hz   4:3     31.469 kHz     25.175000 MHz
    VIC   2:   720x480    59.940060 Hz   4:3     31.469 kHz     27.000000 MHz
    VIC   3:   720x480    59.940060 Hz  16:9     31.469 kHz     27.000000 MHz
    VIC   4:  1280x720    60.000000 Hz  16:9     45.000 kHz     74.250000 MHz
    VIC   5:  1920x1080i  60.000000 Hz  16:9     33.750 kHz     74.250000 MHz
    VIC  16:  1920x1080   60.000000 Hz  16:9     67.500 kHz    148.500000 MHz (native)
    VIC  17:   720x576    50.000000 Hz   4:3     31.250 kHz     27.000000 MHz
    VIC  18:   720x576    50.000000 Hz  16:9     31.250 kHz     27.000000 MHz
    VIC  19:  1280x720    50.000000 Hz  16:9     37.500 kHz     74.250000 MHz
    VIC  20:  1920x1080i  50.000000 Hz  16:9     28.125 kHz     74.250000 MHz
    VIC  31:  1920x1080   50.000000 Hz  16:9     56.250 kHz    148.500000 MHz
    VIC  63:  1920x1080  120.000000 Hz  16:9    135.000 kHz    297.000000 MHz
    VIC  93:  3840x2160   24.000000 Hz  16:9     54.000 kHz    297.000000 MHz
    VIC  94:  3840x2160   25.000000 Hz  16:9     56.250 kHz    297.000000 MHz
    VIC  95:  3840x2160   30.000000 Hz  16:9     67.500 kHz    297.000000 MHz
    VIC  96:  3840x2160   50.000000 Hz  16:9    112.500 kHz    594.000000 MHz
    VIC  97:  3840x2160   60.000000 Hz  16:9    135.000 kHz    594.000000 MHz
  Audio Data Block:
    Linear PCM:
      Max channels: 2
      Supported sample rates (kHz): 48 44.1 32
      Supported sample sizes (bits): 24 20 16
  Speaker Allocation Data Block:
    FL/FR - Front Left/Right
  Vendor-Specific Data Block (AMD), OUI 00-00-1A:
    Version: 2
    Flags 1: 0x01
      FreeSync Supported
    Minimum Refresh Rate: 48 Hz
    Maximum Refresh Rate: 145 Hz
    Flags 5: 0x00
  Detailed Timing Descriptors:
    DTD 3:  3440x1440  100.000000 Hz  43:18   150.000 kHz    540.000000 MHz (810 mm x 348 mm)
                 Hfront   48 Hsync  32 Hback   80 Hpol P
                 Vfront    3 Vsync   5 Vback   52 Vpol P
    DTD 4:  3840x2160   59.996625 Hz  16:9    133.312 kHz    533.250000 MHz (810 mm x 348 mm)
                 Hfront   48 Hsync  32 Hback   80 Hpol P
                 Vfront    3 Vsync   5 Vback   54 Vpol P
    DTD 5:  2560x1080   59.996197 Hz  64:27    69.596 kHz    189.300000 MHz (810 mm x 348 mm)
                 Hfront   32 Hsync  48 Hback   80 Hpol P
                 Vfront    3 Vsync   5 Vback   72 Vpol P
Checksum: 0xfd  Unused space in Extension Block: 29 bytes

----------------

Block 2, DisplayID Extension Block:
  Version: 1.2
  Extension Count: 0
  Display Product Type: Extension Section
  Video Timing Modes Type 1 - Detailed Timings Data Block:
    DTD:  3440x1440  143.999925 Hz  16:9    213.264 kHz    767.750000 MHz (aspect 16:9, no 3D stereo)
               Hfront   48 Hsync  32 Hback   80 Hpol N
               Vfront    3 Vsync   5 Vback   33 Vpol N
    DTD:  1720x1440   60.000000 Hz  16:9     90.000 kHz    169.200000 MHz (aspect 16:9, no 3D stereo)
               Hfront   48 Hsync  32 Hback   80 Hpol N
               Vfront    3 Vsync   5 Vback   52 Vpol N
    DTD:  2560x1440  119.937319 Hz  16:9    182.904 kHz    497.500000 MHz (aspect 16:9, no 3D stereo)
               Hfront   48 Hsync  32 Hback   80 Hpol N
               Vfront    5 Vsync   3 Vback   77 Vpol N
    DTD:  2560x1440  143.994696 Hz  16:9    219.592 kHz    597.290000 MHz (aspect 16:9, no 3D stereo)
               Hfront   48 Hsync  32 Hback   80 Hpol N
               Vfront    5 Vsync   3 Vback   77 Vpol N
  Supported Timing Modes Type 1 - VESA DMT Timings Data Block:
    DMT 0x04:   640x480    59.940476 Hz   4:3     31.469 kHz     25.175000 MHz
    DMT 0x09:   800x600    60.316541 Hz   4:3     37.879 kHz     40.000000 MHz
    DMT 0x0d:   800x600   119.971829 Hz   4:3     76.302 kHz     73.250000 MHz (RB)
    DMT 0x10:  1024x768    60.003840 Hz   4:3     48.363 kHz     65.000000 MHz
    DMT 0x14:  1024x768   119.988531 Hz   4:3     97.551 kHz    115.500000 MHz (RB)
    DMT 0x1c:  1280x800    59.810326 Hz  16:10    49.702 kHz     83.500000 MHz
    DMT 0x23:  1280x1024   60.019740 Hz   5:4     63.981 kHz    108.000000 MHz
    DMT 0x26:  1280x1024  119.958231 Hz   5:4    130.035 kHz    187.250000 MHz (RB)
    DMT 0x28:  1360x768   119.966660 Hz  85:48    97.533 kHz    148.250000 MHz (RB)
    DMT 0x2d:  1400x1050  119.904077 Hz   4:3    133.333 kHz    208.000000 MHz (RB)
    DMT 0x32:  1440x900   119.851784 Hz  16:10   114.219 kHz    182.750000 MHz (RB)
    DMT 0x33:  1600x1200   60.000000 Hz   4:3     75.000 kHz    162.000000 MHz
    DMT 0x3a:  1680x1050   59.954250 Hz  16:10    65.290 kHz    146.250000 MHz
    DMT 0x3d:  1680x1050  119.985533 Hz  16:10   133.424 kHz    245.500000 MHz (RB)
    DMT 0x45:  1920x1200   59.884600 Hz  16:10    74.556 kHz    193.250000 MHz
    DMT 0x48:  1920x1200  119.908612 Hz  16:10   152.404 kHz    317.000000 MHz (RB)
    DMT 0x4b:  1920x1440  119.955864 Hz   4:3    182.933 kHz    380.500000 MHz (RB)
    DMT 0x50:  2560x1600  119.962758 Hz  16:10   203.217 kHz    552.750000 MHz (RB)
  Checksum: 0x0d
Checksum: 0x90

----------------

Warnings:

Block 1, CTA-861 Extension Block:
  Video Data Block: VIC 1 and the first DTD are not identical. Is this intended?
  Video Data Block: All VICs are in ascending order, and the first (preferred) VIC <= 4, is that intended?
  Detailed Timing Descriptor #4: Image size is 810x348 mm, but based on the picture AR it should be 618x348 mm.
  Add a Colorimetry Data Block with the sRGB colorimetry bit set to avoid interop issues.
EDID:
  Base EDID: Some timings are out of range of the Monitor Ranges:
    Vertical Freq: 24.000 - 144.000 Hz (Monitor: 48.000 - 145.000 Hz)
    Horizontal Freq: 28.125 - 219.591 kHz (Monitor: 160.000 - 160.000 kHz)

Failures:

Block 1, CTA-861 Extension Block:
  Missing VCDB, needed for Set Selectable RGB Quantization to avoid interop issues.
Block 2, DisplayID Extension Block:
  DisplayID Base Block has no product type.
EDID:
  Extension Block 3 started with EDID header, ignoring Extension Blocks >= 3.
  CTA-861: Native progressive timings are a mix of several resolutions.
  DisplayID: DisplayID expects at least one preferred timing.

EDID conformity: FAIL
