edid-decode (hex):

00 ff ff ff ff ff ff 00 36 69 a2 3d 01 01 01 01
0f 1f 01 03 80 46 27 78 ee f8 c5 a5 56 50 9e 26
11 50 54 bf ef 80 71 4f 81 c0 81 00 81 40 81 80
95 00 b3 00 a9 40 4d d0 00 a0 f0 70 3e 80 30 20
35 00 bc 86 21 00 00 1e 00 00 00 fd 00 1e 4b 1f
87 3c 00 0a 20 20 20 20 20 20 00 00 00 fc 00 4d
41 47 33 32 31 43 55 52 56 0a 20 20 00 00 00 ff
00 44 41 32 41 30 31 31 34 30 30 32 34 31 01 42

02 03 46 f1 53 01 02 03 04 05 10 11 12 13 14 1f
20 21 22 5d 5e 5f 61 60 23 09 17 07 83 01 00 00
6d 03 0c 00 10 00 38 3c 20 00 60 03 02 01 67 d8
5d c4 01 78 80 03 e4 0f 00 00 06 e3 05 e3 01 e6
06 07 01 5c 5c 00 04 74 00 30 f2 70 5a 80 b0 58
8a 00 bc 86 21 00 00 1e 56 5e 00 a0 a0 a0 29 50
30 20 35 00 bc 86 21 00 00 1e 1b 21 50 a0 51 00
1e 30 48 88 35 00 bc 86 21 00 00 1e 00 00 00 2f

00 ff ff ff ff ff ff 00 36 69 a2 3d 01 01 01 01
0f 1f 01 03 80 46 27 78 ee f8 c5 a5 56 50 9e 26
11 50 54 bf ef 80 71 4f 81 c0 81 00 81 40 81 80
95 00 b3 00 a9 40 4d d0 00 a0 f0 70 3e 80 30 20
35 00 bc 86 21 00 00 1e 00 00 00 fd 00 1e 4b 1f
87 3c 00 0a 20 20 20 20 20 20 00 00 00 fc 00 4d
41 47 33 32 31 43 55 52 56 0a 20 20 00 00 00 ff
00 44 41 32 41 30 31 31 34 30 30 32 34 31 01 42

02 03 46 f1 53 01 02 03 04 05 10 11 12 13 14 1f
20 21 22 5d 5e 5f 61 60 23 09 17 07 83 01 00 00
6d 03 0c 00 10 00 38 3c 20 00 60 03 02 01 67 d8
5d c4 01 78 80 03 e4 0f 00 00 06 e3 05 e3 01 e6
06 07 01 5c 5c 00 04 74 00 30 f2 70 5a 80 b0 58
8a 00 bc 86 21 00 00 1e 56 5e 00 a0 a0 a0 29 50
30 20 35 00 bc 86 21 00 00 1e 1b 21 50 a0 51 00
1e 30 48 88 35 00 bc 86 21 00 00 1e 00 00 00 2f

----------------

Block 0, Base EDID:
  EDID Structure Version & Revision: 1.3
  Vendor & Product Identification:
    Manufacturer: MSI
    Model: 15778
    Serial Number: ...
    Made in: week 15 of 2021
  Basic Display Parameters & Features:
    Digital display
    Maximum image size: 70 cm x 39 cm
    Gamma: 2.20
    DPMS levels: Standby Suspend Off
    RGB color display
    Default (sRGB) color space is primary color space
    First detailed timing is the preferred timing
  Color Characteristics:
    Red  : 0.6474, 0.3388
    Green: 0.3144, 0.6171
    Blue : 0.1513, 0.0664
    White: 0.3134, 0.3291
  Established Timings I & II:
    IBM     :   720x400    70.081663 Hz   9:5     31.467 kHz     28.320000 MHz
    DMT 0x04:   640x480    59.940476 Hz   4:3     31.469 kHz     25.175000 MHz
    Apple   :   640x480    66.666667 Hz   4:3     35.000 kHz     30.240000 MHz
    DMT 0x05:   640x480    72.808802 Hz   4:3     37.861 kHz     31.500000 MHz
    DMT 0x06:   640x480    75.000000 Hz   4:3     37.500 kHz     31.500000 MHz
    DMT 0x08:   800x600    56.250000 Hz   4:3     35.156 kHz     36.000000 MHz
    DMT 0x09:   800x600    60.316541 Hz   4:3     37.879 kHz     40.000000 MHz
    DMT 0x0a:   800x600    72.187572 Hz   4:3     48.077 kHz     50.000000 MHz
    DMT 0x0b:   800x600    75.000000 Hz   4:3     46.875 kHz     49.500000 MHz
    Apple   :   832x624    74.551266 Hz   4:3     49.726 kHz     57.284000 MHz
    DMT 0x10:  1024x768    60.003840 Hz   4:3     48.363 kHz     65.000000 MHz
    DMT 0x11:  1024x768    70.069359 Hz   4:3     56.476 kHz     75.000000 MHz
    DMT 0x12:  1024x768    75.028582 Hz   4:3     60.023 kHz     78.750000 MHz
    DMT 0x24:  1280x1024   75.024675 Hz   5:4     79.976 kHz    135.000000 MHz
    Apple   :  1152x870    75.061550 Hz 192:145   68.681 kHz    100.000000 MHz
  Standard Timings:
    DMT 0x15:  1152x864    75.000000 Hz   4:3     67.500 kHz    108.000000 MHz
    DMT 0x55:  1280x720    60.000000 Hz  16:9     45.000 kHz     74.250000 MHz
    DMT 0x1c:  1280x800    59.810326 Hz  16:10    49.702 kHz     83.500000 MHz
    DMT 0x20:  1280x960    60.000000 Hz   4:3     60.000 kHz    108.000000 MHz
    DMT 0x23:  1280x1024   60.019740 Hz   5:4     63.981 kHz    108.000000 MHz
    DMT 0x2f:  1440x900    59.887445 Hz  16:10    55.935 kHz    106.500000 MHz
    DMT 0x3a:  1680x1050   59.954250 Hz  16:10    65.290 kHz    146.250000 MHz
    DMT 0x33:  1600x1200   60.000000 Hz   4:3     75.000 kHz    162.000000 MHz
  Detailed Timing Descriptors:
    DTD 1:  3840x2160   59.996625 Hz  16:9    133.312 kHz    533.250000 MHz (700 mm x 390 mm)
                 Hfront   48 Hsync  32 Hback   80 Hpol P
                 Vfront    3 Vsync   5 Vback   54 Vpol P
    Display Range Limits:
      Monitor ranges (GTF): 30-75 Hz V, 31-135 kHz H, max dotclock 600 MHz
    Display Product Name: 'MAG321CURV'
    Display Product Serial Number: ...
  Extension blocks: 1
Checksum: 0x42

----------------

Block 1, CTA-861 Extension Block:
  Revision: 3
  Underscans IT Video Formats by default
  Basic audio support
  Supports YCbCr 4:4:4
  Supports YCbCr 4:2:2
  Native DTDs: 1
  Video Data Block:
    VIC   1:   640x480    59.940476 Hz   4:3     31.469 kHz     25.175000 MHz
    VIC   2:   720x480    59.940060 Hz   4:3     31.469 kHz     27.000000 MHz
    VIC   3:   720x480    59.940060 Hz  16:9     31.469 kHz     27.000000 MHz
    VIC   4:  1280x720    60.000000 Hz  16:9     45.000 kHz     74.250000 MHz
    VIC   5:  1920x1080i  60.000000 Hz  16:9     33.750 kHz     74.250000 MHz
    VIC  16:  1920x1080   60.000000 Hz  16:9     67.500 kHz    148.500000 MHz
    VIC  17:   720x576    50.000000 Hz   4:3     31.250 kHz     27.000000 MHz
    VIC  18:   720x576    50.000000 Hz  16:9     31.250 kHz     27.000000 MHz
    VIC  19:  1280x720    50.000000 Hz  16:9     37.500 kHz     74.250000 MHz
    VIC  20:  1920x1080i  50.000000 Hz  16:9     28.125 kHz     74.250000 MHz
    VIC  31:  1920x1080   50.000000 Hz  16:9     56.250 kHz    148.500000 MHz
    VIC  32:  1920x1080   24.000000 Hz  16:9     27.000 kHz     74.250000 MHz
    VIC  33:  1920x1080   25.000000 Hz  16:9     28.125 kHz     74.250000 MHz
    VIC  34:  1920x1080   30.000000 Hz  16:9     33.750 kHz     74.250000 MHz
    VIC  93:  3840x2160   24.000000 Hz  16:9     54.000 kHz    297.000000 MHz
    VIC  94:  3840x2160   25.000000 Hz  16:9     56.250 kHz    297.000000 MHz
    VIC  95:  3840x2160   30.000000 Hz  16:9     67.500 kHz    297.000000 MHz
    VIC  97:  3840x2160   60.000000 Hz  16:9    135.000 kHz    594.000000 MHz
    VIC  96:  3840x2160   50.000000 Hz  16:9    112.500 kHz    594.000000 MHz
  Audio Data Block:
    Linear PCM:
      Max channels: 2
      Supported sample rates (kHz): 96 48 44.1 32
      Supported sample sizes (bits): 24 20 16
  Speaker Allocation Data Block:
    FL/FR - Front Left/Right
  Vendor-Specific Data Block (HDMI), OUI 00-0C-03:
    Source physical address: 1.0.0.0
    DC_36bit
    DC_30bit
    DC_Y444
    Maximum TMDS clock: 300 MHz
    Extended HDMI video details:
      HDMI VICs:
        HDMI VIC 3:  3840x2160   24.000000 Hz  16:9     54.000 kHz    297.000000 MHz
        HDMI VIC 2:  3840x2160   25.000000 Hz  16:9     56.250 kHz    297.000000 MHz
        HDMI VIC 1:  3840x2160   30.000000 Hz  16:9     67.500 kHz    297.000000 MHz
  Vendor-Specific Data Block (HDMI Forum), OUI C4-5D-D8:
    Version: 1
    Maximum TMDS Character Rate: 600 MHz
    SCDC Present
    Supports 12-bits/component Deep Color 4:2:0 Pixel Encoding
    Supports 10-bits/component Deep Color 4:2:0 Pixel Encoding
  YCbCr 4:2:0 Capability Map Data Block:
    VIC  97:  3840x2160   60.000000 Hz  16:9    135.000 kHz    594.000000 MHz
    VIC  96:  3840x2160   50.000000 Hz  16:9    112.500 kHz    594.000000 MHz
  Colorimetry Data Block:
    xvYCC601
    xvYCC709
    BT2020cYCC
    BT2020YCC
    BT2020RGB
    Gamut Boundary Description Metadata Profile P0
  HDR Static Metadata Data Block:
    Electro optical transfer functions:
      Traditional gamma - SDR luminance range
      Traditional gamma - HDR luminance range
      SMPTE ST2084
    Supported static metadata descriptors:
      Static metadata type 1
    Desired content max luminance: 92 (366.802 cd/m^2)
    Desired content max frame-average luminance: 92 (366.802 cd/m^2)
    Desired content min luminance: 0 (0.000 cd/m^2)
  Detailed Timing Descriptors:
    DTD 2:  3840x2160   30.000000 Hz  16:9     67.500 kHz    297.000000 MHz (700 mm x 390 mm)
                 Hfront  176 Hsync  88 Hback  296 Hpol P
                 Vfront    8 Vsync  10 Vback   72 Vpol P
    DTD 3:  2560x1440   59.950550 Hz  16:9     88.787 kHz    241.500000 MHz (700 mm x 390 mm)
                 Hfront   48 Hsync  32 Hback   80 Hpol P
                 Vfront    3 Vsync   5 Vback   33 Vpol P
    DTD 4:  1360x768    59.798991 Hz  85:48    47.720 kHz     84.750000 MHz (700 mm x 390 mm)
                 Hfront   72 Hsync 136 Hback  208 Hpol P
                 Vfront    3 Vsync   5 Vback   22 Vpol P
Checksum: 0x2f  Unused space in Extension Block: 3 bytes

----------------

Warnings:

Block 0, Base EDID:
  Vendor & Product Identification: The serial number is one of the known dummy values, it should probably be set to 0.
Block 1, CTA-861 Extension Block:
  Video Data Block: VIC 1 and the first DTD are not identical. Is this intended?
  Display Product Serial Number is set, so the Serial Number in the Base EDID should be 0.
EDID:
  Base EDID: Some timings are out of range of the Monitor Ranges:
    Vertical Freq: 24.000 - 75.062 Hz (Monitor: 30.000 - 75.000 Hz)
    Horizontal Freq: 27.000 - 135.000 kHz (Monitor: 31.000 - 135.000 kHz)

Failures:

Block 0, Base EDID:
  Basic Display Parameters & Features: sRGB is signaled, but the chromaticities do not match.
Block 1, CTA-861 Extension Block:
  Vendor-Specific Data Block (HDMI Forum), OUI C4-5D-D8: HDMI VIC and related CTA VIC codes are present, but the UHD VIC bit is 0.
  Missing VCDB, needed for Set Selectable RGB Quantization to avoid interop issues.
EDID:
  Extension Block 2 started with EDID header, ignoring Extension Blocks >= 2.

EDID conformity: FAIL
