edid-decode (hex):

00 ff ff ff ff ff ff 00 1c a3 13 00 88 88 00 00
00 19 01 03 80 1a 0f 78 ee 62 c0 a6 56 54 9b 25
0c 50 54 21 08 00 71 40 81 00 81 80 81 c0 01 c1
95 00 b3 00 d1 c0 e8 35 80 a0 70 38 1f 40 30 20
25 00 00 90 10 00 00 1a 00 00 00 ff 00 38 38 38
38 0a 20 20 20 20 20 20 20 20 00 00 00 fc 00 4f
6e 6c 61 70 31 31 30 31 50 0a 20 20 00 00 00 fd
00 38 4c 1e 53 17 00 0a 20 20 20 20 20 20 01 5b

02 03 1a 71 47 10 03 14 05 13 84 12 23 09 07 07
83 01 00 00 65 03 0c 00 10 00 8c 0a d0 90 20 40
31 20 0c 40 55 00 36 d4 31 00 00 18 01 1d 80 18
71 1c 16 20 58 2c 25 00 36 d4 31 00 00 9e 01 1d
80 d0 72 1c 16 20 10 2c 25 80 36 d4 31 00 00 9e
01 1d 00 bc 52 d0 1e 20 b8 28 55 40 36 d4 31 00
00 1e f3 39 80 18 71 38 2d 40 58 2c 45 00 c4 8e
21 00 00 1e 00 00 00 00 00 00 00 00 00 00 00 54

00 ff ff ff ff ff ff 00 1c a3 13 00 88 88 00 00
00 19 01 03 80 1a 0f 78 ee 62 c0 a6 56 54 9b 25
0c 50 54 21 08 00 71 40 81 00 81 80 81 c0 01 c1
95 00 b3 00 d1 c0 e8 35 80 a0 70 38 1f 40 30 20
25 00 00 90 10 00 00 1a 00 00 00 ff 00 38 38 38
38 0a 20 20 20 20 20 20 20 20 00 00 00 fc 00 4f
6e 6c 61 70 31 31 30 31 50 0a 20 20 00 00 00 fd
00 38 4c 1e 53 17 00 0a 20 20 20 20 20 20 01 5b

02 03 1a 71 47 10 03 14 05 13 84 12 23 09 07 07
83 01 00 00 65 03 0c 00 10 00 8c 0a d0 90 20 40
31 20 0c 40 55 00 36 d4 31 00 00 18 01 1d 80 18
71 1c 16 20 58 2c 25 00 36 d4 31 00 00 9e 01 1d
80 d0 72 1c 16 20 10 2c 25 80 36 d4 31 00 00 9e
01 1d 00 bc 52 d0 1e 20 b8 28 55 40 36 d4 31 00
00 1e f3 39 80 18 71 38 2d 40 58 2c 45 00 c4 8e
21 00 00 1e 00 00 00 00 00 00 00 00 00 00 00 54

----------------

Block 0, Base EDID:
  EDID Structure Version & Revision: 1.3
  Vendor & Product Identification:
    Manufacturer: GEC
    Model: 19
    Serial Number: ...
    Made in: 2015
  Basic Display Parameters & Features:
    Digital display
    Maximum image size: 26 cm x 15 cm
    Gamma: 2.20
    DPMS levels: Standby Suspend Off
    RGB color display
    Default (sRGB) color space is primary color space
    First detailed timing is the preferred timing
  Color Characteristics:
    Red  : 0.6494, 0.3378
    Green: 0.3281, 0.6074
    Blue : 0.1474, 0.0468
    White: 0.3125, 0.3281
  Established Timings I & II:
    DMT 0x04:   640x480    59.940476 Hz   4:3     31.469 kHz     25.175000 MHz
    DMT 0x09:   800x600    60.316541 Hz   4:3     37.879 kHz     40.000000 MHz
    DMT 0x10:  1024x768    60.003840 Hz   4:3     48.363 kHz     65.000000 MHz
  Standard Timings:
    GTF     :  1152x864    60.000000 Hz   4:3     53.700 kHz     81.624000 MHz
    DMT 0x1c:  1280x800    59.810326 Hz  16:10    49.702 kHz     83.500000 MHz
    DMT 0x23:  1280x1024   60.019740 Hz   5:4     63.981 kHz    108.000000 MHz
    DMT 0x55:  1280x720    60.000000 Hz  16:9     45.000 kHz     74.250000 MHz
    DMT 0x2f:  1440x900    59.887445 Hz  16:10    55.935 kHz    106.500000 MHz
    DMT 0x3a:  1680x1050   59.954250 Hz  16:10    65.290 kHz    146.250000 MHz
    DMT 0x52:  1920x1080   60.000000 Hz  16:9     67.500 kHz    148.500000 MHz
  Detailed Timing Descriptors:
    DTD 1:  1920x1080   59.717510 Hz  16:9     66.346 kHz    138.000000 MHz (256 mm x 144 mm)
                 Hfront   48 Hsync  32 Hback   80 Hpol P
                 Vfront    2 Vsync   5 Vback   24 Vpol N
    Display Product Serial Number: ...
    Display Product Name: 'Onlap1101P'
    Display Range Limits:
      Monitor ranges (GTF): 56-76 Hz V, 30-83 kHz H, max dotclock 230 MHz
  Extension blocks: 1
Checksum: 0x5b

----------------

Block 1, CTA-861 Extension Block:
  Revision: 3
  Basic audio support
  Supports YCbCr 4:4:4
  Supports YCbCr 4:2:2
  Native DTDs: 1
  Video Data Block:
    VIC  16:  1920x1080   60.000000 Hz  16:9     67.500 kHz    148.500000 MHz
    VIC   3:   720x480    59.940060 Hz  16:9     31.469 kHz     27.000000 MHz
    VIC  20:  1920x1080i  50.000000 Hz  16:9     28.125 kHz     74.250000 MHz
    VIC   5:  1920x1080i  60.000000 Hz  16:9     33.750 kHz     74.250000 MHz
    VIC  19:  1280x720    50.000000 Hz  16:9     37.500 kHz     74.250000 MHz
    VIC   4:  1280x720    60.000000 Hz  16:9     45.000 kHz     74.250000 MHz (native)
    VIC  18:   720x576    50.000000 Hz  16:9     31.250 kHz     27.000000 MHz
  Audio Data Block:
    Linear PCM:
      Max channels: 2
      Supported sample rates (kHz): 48 44.1 32
      Supported sample sizes (bits): 24 20 16
  Speaker Allocation Data Block:
    FL/FR - Front Left/Right
  Vendor-Specific Data Block (HDMI), OUI 00-0C-03:
    Source physical address: 1.0.0.0
  Detailed Timing Descriptors:
    DTD 2:   720x576    50.000000 Hz   5:4     31.250 kHz     27.000000 MHz (822 mm x 468 mm)
                 Hfront   12 Hsync  64 Hback   68 Hpol N
                 Vfront    5 Vsync   5 Vback   39 Vpol N
    DTD 3:  1920x1080i  60.000000 Hz  16:9     33.750 kHz     74.250000 MHz (822 mm x 468 mm)
                 Hfront   88 Hsync  44 Hback  148 Hpol P
                 Vfront    2 Vsync   5 Vback   15 Vpol P Vfront +0.5 Odd Field
                 Vfront    2 Vsync   5 Vback   15 Vpol P Vback  +0.5 Even Field
    DTD 4:  1920x1080i  50.000000 Hz  16:9     28.125 kHz     74.250000 MHz (822 mm x 468 mm)
                 Hfront  528 Hsync  44 Hback  148 Hpol P
                 Vfront    2 Vsync   5 Vback   15 Vpol P Vfront +0.5 Odd Field
                 Vfront    2 Vsync   5 Vback   15 Vpol P Vback  +0.5 Even Field
    DTD 5:  1280x720    50.000000 Hz  16:9     37.500 kHz     74.250000 MHz (822 mm x 468 mm)
                 Hfront  440 Hsync  40 Hback  220 Hpol P
                 Vfront    5 Vsync   5 Vback   20 Vpol P
    DTD 6:  1920x1080   59.939394 Hz  16:9     67.432 kHz    148.350000 MHz (708 mm x 398 mm)
                 Hfront   88 Hsync  44 Hback  148 Hpol P
                 Vfront    4 Vsync   5 Vback   36 Vpol P
Checksum: 0x54  Unused space in Extension Block: 11 bytes

----------------

Warnings:

Block 1, CTA-861 Extension Block:
  IT Video Formats are overscanned by default, but normally this should be underscanned.
  Video Data Block: VIC 16 and the first DTD are not identical. Is this intended?
  Detailed Timing Descriptor #2: Image size is 822x468 mm, but based on the picture AR it should be 585x468 mm.
  Display Product Serial Number is set, so the Serial Number in the Base EDID should be 0.
EDID:
  Base EDID: Some timings are out of range of the Monitor Ranges:
    Vertical Freq: 50.000 - 60.317 Hz (Monitor: 56.000 - 76.000 Hz)
    Horizontal Freq: 28.125 - 67.500 kHz (Monitor: 30.000 - 83.000 kHz)

Failures:

Block 0, Base EDID:
  Basic Display Parameters & Features: sRGB is signaled, but the chromaticities do not match.
  Standard Timings: Use 0x0101 as the invalid Standard Timings code, not 0x01c1.
Block 1, CTA-861 Extension Block:
  Detailed Timing Descriptor #2: Mismatch of image size 822x468 mm vs display size 260x150 mm.
  Detailed Timing Descriptor #3: Mismatch of image size 822x468 mm vs display size 260x150 mm.
  Detailed Timing Descriptor #4: Mismatch of image size 822x468 mm vs display size 260x150 mm.
  Detailed Timing Descriptor #5: Mismatch of image size 822x468 mm vs display size 260x150 mm.
  Detailed Timing Descriptor #6: Mismatch of image size 708x398 mm vs display size 260x150 mm.
  Missing VCDB, needed for Set Selectable RGB Quantization to avoid interop issues.
EDID:
  Extension Block 2 started with EDID header, ignoring Extension Blocks >= 2.
  Base EDID: The DTD max image size is 822x468mm, which is larger than the display size 260.0x150.0mm.
  CTA-861: Native progressive timings are a mix of several resolutions.

EDID conformity: FAIL
