edid-decode (hex):

00 ff ff ff ff ff ff 00 36 09 02 70 01 00 00 00
01 11 01 03 80 12 0d 00 0a 00 00 00 00 00 00 00
00 00 00 00 00 00 45 c0 61 c0 71 c0 81 c0 8b c0
95 c0 a9 c0 d1 c0 24 13 00 20 41 58 16 20 05 0d
23 00 ff ff 00 00 00 1c 00 00 00 fc 00 57 49 4d
41 58 49 54 0a 20 20 20 20 20 00 00 00 10 00 00
00 00 00 00 00 00 00 00 00 00 00 00 00 00 00 10
00 00 00 00 00 00 00 00 00 00 00 00 00 00 01 04

02 03 14 41 41 00 23 09 07 07 83 01 00 00 65 03
0c 00 10 00 00 00 00 10 00 10 0a 20 20 20 20 20
20 20 20 20 20 20 00 00 00 10 00 10 0a 20 20 20
20 20 20 20 20 20 20 20 00 00 00 10 00 01 01 20
20 20 20 20 20 20 20 20 20 20 00 00 00 10 00 10
0a 20 20 20 20 20 20 20 20 20 20 20 00 00 00 10
00 10 0a 20 20 20 20 20 20 20 20 20 20 20 00 00
00 00 00 00 00 00 00 00 00 00 00 00 00 00 00 89

00 ff ff ff ff ff ff 00 36 09 02 70 01 00 00 00
01 11 01 03 80 12 0d 00 0a 00 00 00 00 00 00 00
00 00 00 00 00 00 45 c0 61 c0 71 c0 81 c0 8b c0
95 c0 a9 c0 d1 c0 24 13 00 20 41 58 16 20 05 0d
23 00 ff ff 00 00 00 1c 00 00 00 fc 00 57 49 4d
41 58 49 54 0a 20 20 20 20 20 00 00 00 10 00 00
00 00 00 00 00 00 00 00 00 00 00 00 00 00 00 10
00 00 00 00 00 00 00 00 00 00 00 00 00 00 01 04

02 03 14 41 41 00 23 09 07 07 83 01 00 00 65 03
0c 00 10 00 00 00 00 10 00 10 0a 20 20 20 20 20
20 20 20 20 20 20 00 00 00 10 00 10 0a 20 20 20
20 20 20 20 20 20 20 20 00 00 00 10 00 01 01 20
20 20 20 20 20 20 20 20 20 20 00 00 00 10 00 10
0a 20 20 20 20 20 20 20 20 20 20 20 00 00 00 10
00 10 0a 20 20 20 20 20 20 20 20 20 20 20 00 00
00 00 00 00 00 00 00 00 00 00 00 00 00 00 00 89

----------------

Block 0, Base EDID:
  EDID Structure Version & Revision: 1.3
  Vendor & Product Identification:
    Manufacturer: MPI
    Model: 28674
    Serial Number: ...
    Made in: week 1 of 2007
  Basic Display Parameters & Features:
    Digital display
    Maximum image size: 18 cm x 13 cm
    Gamma: 1.00
    RGB color display
    First detailed timing is the preferred timing
  Color Characteristics:
    Red  : 0.0000, 0.0000
    Green: 0.0000, 0.0000
    Blue : 0.0000, 0.0000
    White: 0.0000, 0.0000
  Established Timings I & II: none
  Standard Timings:
    GTF     :   800x450    59.999308 Hz  16:9     27.960 kHz     27.736000 MHz
    GTF     :  1024x576    60.000204 Hz  16:9     35.820 kHz     46.996000 MHz
    GTF     :  1152x648    60.000120 Hz  16:9     40.260 kHz     59.907000 MHz
    DMT 0x55:  1280x720    60.000000 Hz  16:9     45.000 kHz     74.250000 MHz
    GTF     :  1360x765    60.000341 Hz  16:9     47.520 kHz     84.396000 MHz
    GTF     :  1440x810    60.000051 Hz  16:9     50.340 kHz     95.042000 MHz
    DMT 0x53:  1600x900    60.000000 Hz  16:9     60.000 kHz    108.000000 MHz (RB)
    DMT 0x52:  1920x1080   60.000000 Hz  16:9     67.500 kHz    148.500000 MHz
  Detailed Timing Descriptors:
    DTD 1:  1024x600    60.044310 Hz 128:75    37.348 kHz     49.000000 MHz (255 mm x 255 mm)
                 Hfront    5 Hsync  13 Hback  270 Hpol N
                 Vfront    2 Vsync   3 Vback   17 Vpol P
    Display Product Name: 'WIMAXIT'
    Dummy Descriptor:
    Dummy Descriptor:
  Extension blocks: 1
Checksum: 0x04

----------------

Block 1, CTA-861 Extension Block:
  Revision: 3
  Basic audio support
  Native DTDs: 1
  Video Data Block:
  Audio Data Block:
    Linear PCM:
      Max channels: 2
      Supported sample rates (kHz): 48 44.1 32
      Supported sample sizes (bits): 24 20 16
  Speaker Allocation Data Block:
    FL/FR - Front Left/Right
  Vendor-Specific Data Block (HDMI), OUI 00-0C-03:
    Source physical address: 1.0.0.0
  Detailed Timing Descriptors:
    Dummy Descriptor:
    Dummy Descriptor:
    Dummy Descriptor:
    Dummy Descriptor:
    Dummy Descriptor:
Checksum: 0x89  Unused space in Extension Block: 17 bytes

----------------

Warnings:

Block 0, Base EDID:
  Vendor & Product Identification: The serial number is one of the known dummy values, it should probably be set to 0.
  Standard Timings: Standard Timing 1360x765 has a dubious odd vertical resolution.
  Detailed Timing Descriptor #1: Image size is 255x255 mm, but based on the picture AR it should be 255x149 mm.
Block 1, CTA-861 Extension Block:
  IT Video Formats are overscanned by default, but normally this should be underscanned.
  Add a Colorimetry Data Block with the sRGB colorimetry bit set to avoid interop issues.

Failures:

Block 0, Base EDID:
  Detailed Timing Descriptor #1: Mismatch of image size 255x255 mm vs display size 180x130 mm.
  Missing Display Range Limits Descriptor.
Block 1, CTA-861 Extension Block:
  Dummy Descriptor: Dummy block filled with garbage.
  Dummy Descriptor: Dummy block filled with garbage.
  Dummy Descriptor: Dummy block filled with garbage.
  Dummy Descriptor: Dummy block filled with garbage.
  Dummy Descriptor: Dummy block filled with garbage.
  Required 640x480p60 timings are missing in the established timings and the SVD list (VIC 1).
  Missing VCDB, needed for Set Selectable RGB Quantization to avoid interop issues.
EDID:
  Extension Block 2 started with EDID header, ignoring Extension Blocks >= 2.
  Base EDID: The DTD max image size is 255x255mm, which is larger than the display size 180.0x130.0mm.

EDID conformity: FAIL
