edid-decode (hex):

00 ff ff ff ff ff ff 00 5e 74 00 14 00 00 00 00
2b 1f 01 04 a5 1f 11 78 02 33 66 9b 53 55 88 25
29 4f 54 00 00 00 01 01 01 01 01 01 01 01 01 01
01 01 01 01 01 01 8a 39 80 10 71 38 28 40 2e 1e
24 00 36 aa 10 00 00 1a 00 00 00 00 00 00 00 00
00 00 00 00 00 00 00 00 00 00 00 00 00 fe 00 57
49 53 54 52 4f 4e 20 54 5a 0a 20 20 00 00 00 fe
00 31 34 30 46 49 0a 20 20 20 20 20 20 20 00 e7

00 ff ff ff ff ff ff 00 5e 74 00 14 00 00 00 00
2b 1f 01 04 a5 1f 11 78 02 33 66 9b 53 55 88 25
29 4f 54 00 00 00 01 01 01 01 01 01 01 01 01 01
01 01 01 01 01 01 8a 39 80 10 71 38 28 40 2e 1e
24 00 36 aa 10 00 00 1a 00 00 00 00 00 00 00 00
00 00 00 00 00 00 00 00 00 00 00 00 00 fe 00 57
49 53 54 52 4f 4e 20 54 5a 0a 20 20 00 00 00 fe
00 31 34 30 46 49 0a 20 20 20 20 20 20 20 00 e7

----------------

Block 0, Base EDID:
  EDID Structure Version & Revision: 1.4
  Vendor & Product Identification:
    Manufacturer: WST
    Model: 5120
    Made in: week 43 of 2021
  Basic Display Parameters & Features:
    Digital display
    Bits per primary color channel: 8
    DisplayPort interface
    Maximum image size: 31 cm x 17 cm
    Gamma: 2.20
    Supported color formats: RGB 4:4:4
    First detailed timing includes the native pixel format and preferred refresh rate
  Color Characteristics:
    Red  : 0.6054, 0.3271
    Green: 0.3320, 0.5341
    Blue : 0.1455, 0.1621
    White: 0.3095, 0.3300
  Established Timings I & II: none
  Standard Timings: none
  Detailed Timing Descriptors:
    DTD 1:  1920x1080   59.999022 Hz  16:9     67.199 kHz    147.300000 MHz (310 mm x 170 mm)
                 Hfront   46 Hsync  30 Hback  196 Hpol P
                 Vfront    2 Vsync   4 Vback   34 Vpol N
    Empty Descriptor
    Alphanumeric Data String: 'WISTRON TZ'
    Alphanumeric Data String: '140FI'
Checksum: 0xe7

----------------

Warnings:

Block 0, Base EDID:
  Missing Display Product Name.

Failures:

Block 0, Base EDID:
  Empty Descriptor: Use Dummy Descriptor instead of all zeroes.
EDID:
  Extension Block 1 started with EDID header, ignoring Extension Blocks >= 1.

EDID conformity: FAIL
