edid-decode (hex):

00 ff ff ff ff ff ff 00 26 85 ac 80 30 36 37 31
03 19 01 04 a5 3c 22 78 0a 3d 25 a3 59 51 a0 25
0f 50 54 21 08 00 81 c0 81 80 a9 40 d1 c0 b3 00
90 40 95 00 a9 c0 64 19 00 40 41 00 26 30 18 88
36 00 00 c0 10 00 00 18 66 21 56 aa 51 00 1e 30
46 8f 33 00 55 c0 10 00 00 1e 00 00 00 fc 00 44
50 32 48 44 4d 49 20 31 37 36 30 20 30 2a 00 08
52 c0 28 30 60 70 13 00 40 f0 10 00 00 1e 00 ac

00 ff ff ff ff ff ff 00 26 85 ac 80 30 36 37 31
03 19 01 04 a5 3c 22 78 0a 3d 25 a3 59 51 a0 25
0f 50 54 21 08 00 81 c0 81 80 a9 40 d1 c0 b3 00
90 40 95 00 a9 c0 64 19 00 40 41 00 26 30 18 88
36 00 00 c0 10 00 00 18 66 21 56 aa 51 00 1e 30
46 8f 33 00 55 c0 10 00 00 1e 00 00 00 fc 00 44
50 32 48 44 4d 49 20 31 37 36 30 20 30 2a 00 08
52 c0 28 30 60 70 13 00 40 f0 10 00 00 1e 00 ac

----------------

Block 0, Base EDID:
  EDID Structure Version & Revision: 1.4
  Vendor & Product Identification:
    Manufacturer: ITE
    Model: 32940
    Serial Number: ...
    Made in: week 3 of 2015
  Basic Display Parameters & Features:
    Digital display
    Bits per primary color channel: 8
    DisplayPort interface
    Maximum image size: 60 cm x 34 cm
    Gamma: 2.20
    Supported color formats: RGB 4:4:4, YCrCb 4:4:4
    First detailed timing includes the native pixel format and preferred refresh rate
  Color Characteristics:
    Red  : 0.6367, 0.3505
    Green: 0.3193, 0.6259
    Blue : 0.1445, 0.0605
    White: 0.3134, 0.3291
  Established Timings I & II:
    DMT 0x04:   640x480    59.940476 Hz   4:3     31.469 kHz     25.175000 MHz
    DMT 0x09:   800x600    60.316541 Hz   4:3     37.879 kHz     40.000000 MHz
    DMT 0x10:  1024x768    60.003840 Hz   4:3     48.363 kHz     65.000000 MHz
  Standard Timings:
    DMT 0x55:  1280x720    60.000000 Hz  16:9     45.000 kHz     74.250000 MHz
    DMT 0x23:  1280x1024   60.019740 Hz   5:4     63.981 kHz    108.000000 MHz
    DMT 0x33:  1600x1200   60.000000 Hz   4:3     75.000 kHz    162.000000 MHz
    DMT 0x52:  1920x1080   60.000000 Hz  16:9     67.500 kHz    148.500000 MHz
    DMT 0x3a:  1680x1050   59.954250 Hz  16:10    65.290 kHz    146.250000 MHz
    DMT 0x2a:  1400x1050   59.978442 Hz   4:3     65.317 kHz    121.750000 MHz
    DMT 0x2f:  1440x900    59.887445 Hz  16:10    55.935 kHz    106.500000 MHz
    DMT 0x53:  1600x900    60.000000 Hz  16:9     60.000 kHz    108.000000 MHz (RB)
  Detailed Timing Descriptors:
    DTD 1:  1024x768    60.003840 Hz   4:3     48.363 kHz     65.000000 MHz (256 mm x 192 mm)
                 Hfront   24 Hsync 136 Hback  160 Hpol N
                 Vfront    3 Vsync   6 Vback   29 Vpol N
    DTD 2:  1366x768    59.789541 Hz 683:384   47.712 kHz     85.500000 MHz (341 mm x 192 mm)
                 Hfront   70 Hsync 143 Hback  213 Hpol P
                 Vfront    3 Vsync   3 Vback   24 Vpol P
    Display Product Name: 'DP2HDMI 1760 '
    DTD 3:  1280x960    60.000000 Hz   4:3     60.000 kHz    108.000000 MHz (320 mm x 240 mm)
                 Hfront   96 Hsync 112 Hback  312 Hpol P
                 Vfront    1 Vsync   3 Vback   36 Vpol P
Checksum: 0xac

----------------

Failures:

Block 0, Base EDID:
  Detailed Timing Descriptor #1: Mismatch of image size 256x192 mm vs display size 600x340 mm.
  Detailed Timing Descriptor #2: Mismatch of image size 341x192 mm vs display size 600x340 mm.
  Display Product Name: No newline, but one or more trailing spaces.
  Detailed Timing Descriptor #3: Mismatch of image size 320x240 mm vs display size 600x340 mm.
  Detailed Timing Descriptor #3: Invalid detailed timing descriptor ordering.
EDID:
  Extension Block 1 started with EDID header, ignoring Extension Blocks >= 1.

EDID conformity: FAIL
