edid-decode (hex):

00 ff ff ff ff ff ff 00 06 af 9e dd 00 00 00 00
00 1f 01 04 a5 1e 13 78 03 44 c5 a8 55 47 a1 24
0e 50 54 00 00 00 01 01 01 01 01 01 01 01 01 01
01 01 01 01 01 01 00 69 00 a0 a0 40 2e 60 30 20
35 00 2d bc 10 00 00 18 00 54 00 a0 a0 40 2e 60
30 20 35 00 2d bc 10 00 00 18 00 00 00 fd 00 30
3c 63 63 1b 01 0a 20 20 20 20 20 20 00 00 00 fe
00 42 31 34 30 51 41 4e 30 33 2e 32 20 0a 00 d1

00 ff ff ff ff ff ff 00 06 af 9e dd 00 00 00 00
00 1f 01 04 a5 1e 13 78 03 44 c5 a8 55 47 a1 24
0e 50 54 00 00 00 01 01 01 01 01 01 01 01 01 01
01 01 01 01 01 01 00 69 00 a0 a0 40 2e 60 30 20
35 00 2d bc 10 00 00 18 00 54 00 a0 a0 40 2e 60
30 20 35 00 2d bc 10 00 00 18 00 00 00 fd 00 30
3c 63 63 1b 01 0a 20 20 20 20 20 20 00 00 00 fe
00 42 31 34 30 51 41 4e 30 33 2e 32 20 0a 00 d1

----------------

Block 0, Base EDID:
  EDID Structure Version & Revision: 1.4
  Vendor & Product Identification:
    Manufacturer: AUO
    Model: 56734
    Made in: 2021
  Basic Display Parameters & Features:
    Digital display
    Bits per primary color channel: 8
    DisplayPort interface
    Maximum image size: 30 cm x 19 cm
    Gamma: 2.20
    Supported color formats: RGB 4:4:4
    First detailed timing includes the native pixel format and preferred refresh rate
    Display supports continuous frequencies
  Color Characteristics:
    Red  : 0.6572, 0.3320
    Green: 0.2783, 0.6289
    Blue : 0.1435, 0.0546
    White: 0.3134, 0.3291
  Established Timings I & II: none
  Standard Timings: none
  Detailed Timing Descriptors:
    DTD 1:  2560x1600   60.038596 Hz  16:10    98.824 kHz    268.800000 MHz (301 mm x 188 mm)
                 Hfront   48 Hsync  32 Hback   80 Hpol N
                 Vfront    3 Vsync   5 Vback   38 Vpol N
    DTD 2:  2560x1600   48.030877 Hz  16:10    79.059 kHz    215.040000 MHz (301 mm x 188 mm)
                 Hfront   48 Hsync  32 Hback   80 Hpol N
                 Vfront    3 Vsync   5 Vback   38 Vpol N
    Display Range Limits:
      Monitor ranges (Range Limits Only): 48-60 Hz V, 99-99 kHz H, max dotclock 270 MHz
    Alphanumeric Data String: 'B140QAN03.2 '
Checksum: 0xd1

----------------

Block 1, Unknown EDID Extension Block 0x00:
  00 ff ff ff ff ff ff 00 06 af 9e dd 00 00 00 00 '................'
  00 1f 01 04 a5 1e 13 78 03 44 c5 a8 55 47 a1 24 '.......x.D..UG.$'
  0e 50 54 00 00 00 01 01 01 01 01 01 01 01 01 01 '.PT.............'
  01 01 01 01 01 01 00 69 00 a0 a0 40 2e 60 30 20 '.......i...@.`0 '
  35 00 2d bc 10 00 00 18 00 54 00 a0 a0 40 2e 60 '5.-......T...@.`'
  30 20 35 00 2d bc 10 00 00 18 00 00 00 fd 00 30 '0 5.-..........0'
  3c 63 63 1b 01 0a 20 20 20 20 20 20 00 00 00 fe '<cc...      ....'
  00 42 31 34 30 51 41 4e 30 33 2e 32 20 0a 00 d1 '.B140QAN03.2 ...'
Checksum: 0xd1

----------------

Warnings:

Block 0, Base EDID:
  Missing Display Product Name.
EDID:
  Base EDID: Some timings are out of range of the Monitor Ranges:
    Horizontal Freq: 79.058 - 98.823 kHz (Monitor: 99.000 - 99.000 kHz)

Failures:

Block 0, Base EDID:
  Alphanumeric Data String: One or more trailing spaces before newline.
Block 1, Base EDID:
  Unknown Extension Block.
EDID:
  Base EDID: EDID specified 0 extension block(s), but found 1 extension block(s).

EDID conformity: FAIL
