edid-decode (hex):

00 ff ff ff ff ff ff 00 09 e5 87 05 00 00 00 00
01 13 01 03 90 16 0d 78 0a 22 c0 95 56 4e 8e 26
24 50 54 00 00 00 01 01 01 01 01 01 01 01 01 01
01 01 01 01 01 01 8a 16 00 da 41 58 2a 20 30 20
3a 00 df 7d 00 00 00 1a 8a 16 00 da 41 58 2a 20
30 20 3a 00 df 7d 00 00 00 1a 00 00 00 fe 00 48
30 31 38 54 80 48 54 31 30 31 30 31 00 00 00 00
00 00 00 00 00 00 00 00 00 01 01 0a 20 20 00 50

----------------

Block 0, Base EDID:
  EDID Structure Version & Revision: 1.3
  Vendor & Product Identification:
    Manufacturer: BOE
    Model: 1415
    Made in: week 1 of 2009
  Basic Display Parameters & Features:
    Digital display
    Maximum image size: 22 cm x 13 cm
    Gamma: 2.20
    RGB color display
    First detailed timing is the preferred timing
  Color Characteristics:
    Red  : 0.5820, 0.3378
    Green: 0.3046, 0.5566
    Blue : 0.1513, 0.1406
    White: 0.3125, 0.3281
  Established Timings I & II: none
  Standard Timings: none
  Detailed Timing Descriptors:
    DTD 1:  1024x600    59.996922 Hz 128:75    38.518 kHz     57.700000 MHz (223 mm x 125 mm)
                 Hfront   48 Hsync  32 Hback  394 Hpol P
                 Vfront    3 Vsync  10 Vback   29 Vpol N
    DTD 2:  1024x600    59.996922 Hz 128:75    38.518 kHz     57.700000 MHz (223 mm x 125 mm)
                 Hfront   48 Hsync  32 Hback  394 Hpol P
                 Vfront    3 Vsync  10 Vback   29 Vpol N
    Alphanumeric Data String: 'H018T.HT10101'
    Manufacturer-Specified Display Descriptor (0x00): 00 00 00 00 00 00 00 00 00 00 00 01 01 0a 20 20 '..............  '
Checksum: 0x50

----------------

Warnings:

Block 0, Base EDID:
  Alphanumeric Data String: Non-ASCII character 0x80 at position 5, can cause problems.

Failures:

Block 0, Base EDID:
  Basic Display Parameters & Features: Digital Video Interface Standard set to reserved value 0x10.
  Missing Display Product Name.
  Missing Display Range Limits Descriptor.

EDID conformity: FAIL
