edid-decode (hex):

00 ff ff ff ff ff ff 00 61 78 80 23 01 00 00 00
1a 1f 01 03 08 34 1f 78 ea 2d 36 a7 54 38 ae 26
0d 4f 54 01 4b 00 d1 c0 01 c1 01 81 01 c1 01 c1
01 c1 01 01 01 01 02 3a 80 18 71 38 2d 40 58 2c
45 00 08 36 21 00 00 1a 2a 44 80 a0 70 38 27 40
30 2c 45 00 4a 29 21 00 00 1e 00 00 00 fc 00 56
47 41 0a 20 20 20 20 20 20 20 20 20 00 00 00 10
00 32 33 38 30 57 0a 20 20 20 20 20 20 20 00 cc

00 ff ff ff ff ff ff 00 61 78 80 23 01 00 00 00
1a 1f 01 03 08 34 1f 78 ea 2d 36 a7 54 38 ae 26
0d 4f 54 01 4b 00 d1 c0 01 c1 01 81 01 c1 01 c1
01 c1 01 01 01 01 02 3a 80 18 71 38 2d 40 58 2c
45 00 08 36 21 00 00 1a 2a 44 80 a0 70 38 27 40
30 2c 45 00 4a 29 21 00 00 1e 00 00 00 fc 00 56
47 41 0a 20 20 20 20 20 20 20 20 20 00 00 00 10
00 32 33 38 30 57 0a 20 20 20 20 20 20 20 00 cc

----------------

Block 0, Base EDID:
  EDID Structure Version & Revision: 1.3
  Vendor & Product Identification:
    Manufacturer: XKX
    Model: 9088
    Serial Number: ...
    Made in: week 26 of 2021
  Basic Display Parameters & Features:
    Analog display
    Signal Level Standard: 0.700 : 0.300 : 1.000 V p-p
    Blank level equals black level
    Sync: Separate
    Maximum image size: 52 cm x 31 cm
    Gamma: 2.20
    DPMS levels: Standby Suspend Off
    RGB color display
    First detailed timing is the preferred timing
  Color Characteristics:
    Red  : 0.6523, 0.3300
    Green: 0.2216, 0.6806
    Blue : 0.1484, 0.0537
    White: 0.3095, 0.3300
  Established Timings I & II:
    DMT 0x09:   800x600    60.316541 Hz   4:3     37.879 kHz     40.000000 MHz
    DMT 0x0b:   800x600    75.000000 Hz   4:3     46.875 kHz     49.500000 MHz
    DMT 0x10:  1024x768    60.003840 Hz   4:3     48.363 kHz     65.000000 MHz
    DMT 0x12:  1024x768    75.028582 Hz   4:3     60.023 kHz     78.750000 MHz
    DMT 0x24:  1280x1024   75.024675 Hz   5:4     79.976 kHz    135.000000 MHz
  Standard Timings:
    DMT 0x52:  1920x1080   60.000000 Hz  16:9     67.500 kHz    148.500000 MHz
  Detailed Timing Descriptors:
    DTD 1:  1920x1080   60.000000 Hz  16:9     67.500 kHz    148.500000 MHz (520 mm x 310 mm)
                 Hfront   88 Hsync  44 Hback  148 Hpol P
                 Vfront    4 Vsync   5 Vback   36 Vpol N
    DTD 2:  1920x1080   74.972503 Hz  16:9     83.894 kHz    174.500000 MHz (586 mm x 297 mm)
                 Hfront   48 Hsync  44 Hback   68 Hpol P
                 Vfront    4 Vsync   5 Vback   30 Vpol P
    Display Product Name: 'VGA'
    Dummy Descriptor:
Checksum: 0xcc

----------------

Warnings:

Block 0, Base EDID:
  Vendor & Product Identification: The serial number is one of the known dummy values, it should probably be set to 0.
  Detailed Timing Descriptor #1: DTD is similar but not identical to VIC 16.
  Detailed Timing Descriptor #1: Image size is 520x310 mm, but based on the picture AR it should be 520x292 mm.
  Detailed Timing Descriptor #2: Image size is 586x297 mm, but based on the picture AR it should be 528x297 mm.

Failures:

Block 0, Base EDID:
  Standard Timings: Use 0x0101 as the invalid Standard Timings code, not 0x01c1.
  Standard Timings: Use 0x0101 as the invalid Standard Timings code, not 0x0181.
  Standard Timings: Use 0x0101 as the invalid Standard Timings code, not 0x01c1.
  Standard Timings: Use 0x0101 as the invalid Standard Timings code, not 0x01c1.
  Standard Timings: Use 0x0101 as the invalid Standard Timings code, not 0x01c1.
  Detailed Timing Descriptor #2: Mismatch of image size 586x297 mm vs display size 520x310 mm.
  Dummy Descriptor: Dummy block filled with garbage.
  Missing Display Range Limits Descriptor.
EDID:
  Extension Block 1 started with EDID header, ignoring Extension Blocks >= 1.
  Base EDID: The DTD max image size is 586x310mm, which is larger than the display size 520.0x310.0mm.

EDID conformity: FAIL
