edid-decode (hex):

00 ff ff ff ff ff ff 00 04 72 af 08 da 28 10 11
0b 1f 01 04 b5 50 23 78 3b 52 f5 b0 4f 42 ab 25
0f 50 54 bf ef 80 71 4f 81 40 81 80 81 c0 81 00
95 00 b3 00 d1 c0 f5 7c 70 a0 d0 a0 29 50 30 20
3a 00 20 4f 31 00 00 1a 58 d4 70 a0 d0 a0 46 50
30 20 88 0c 20 4f 31 00 00 1a 00 00 00 fd 0c 37
b4 10 10 60 01 0a 20 20 20 20 20 20 00 00 00 fc
00 58 33 34 20 47 53 0a 20 20 20 20 20 20 02 48

02 03 3b f1 52 01 02 03 04 10 11 12 13 1f 20 21
22 59 5a 5d 5e 5f 61 23 09 07 07 83 01 00 00 e3
05 c3 01 e6 06 05 01 6e 60 00 e2 00 d5 6d 1a 00
00 02 01 30 b4 00 04 00 00 00 00 58 d4 70 a0 d0
a0 46 50 30 20 88 0c 20 4f 31 00 00 1a 2d b3 70
a0 d0 a0 3b 50 30 20 d8 08 20 4f 31 00 00 1a 5c
9d 70 a0 d0 a0 34 50 30 20 68 08 20 4f 31 00 00
1a 00 00 00 00 00 00 00 00 00 00 00 00 00 00 fe

70 12 79 00 00 03 01 14 34 31 01 86 6f 0d 4f 00
07 80 1f 00 9f 05 66 00 58 00 07 00 03 01 14 7e
73 01 86 6f 0d 4f 00 07 80 1f 00 9f 05 3c 00 02
00 09 00 00 00 00 00 00 00 00 00 00 00 00 00 00
00 00 00 00 00 00 00 00 00 00 00 00 00 00 00 00
00 00 00 00 00 00 00 00 00 00 00 00 00 00 00 00
00 00 00 00 00 00 00 00 00 00 00 00 00 00 00 00
00 00 00 00 00 00 00 00 00 00 00 00 00 00 ab 90

00 ff ff ff ff ff ff 00 04 72 af 08 da 28 10 11
0b 1f 01 04 b5 50 23 78 3b 52 f5 b0 4f 42 ab 25
0f 50 54 bf ef 80 71 4f 81 40 81 80 81 c0 81 00
95 00 b3 00 d1 c0 f5 7c 70 a0 d0 a0 29 50 30 20
3a 00 20 4f 31 00 00 1a 58 d4 70 a0 d0 a0 46 50
30 20 88 0c 20 4f 31 00 00 1a 00 00 00 fd 0c 37
b4 10 10 60 01 0a 20 20 20 20 20 20 00 00 00 fc
00 58 33 34 20 47 53 0a 20 20 20 20 20 20 02 48

02 03 3b f1 52 01 02 03 04 10 11 12 13 1f 20 21
22 59 5a 5d 5e 5f 61 23 09 07 07 83 01 00 00 e3
05 c3 01 e6 06 05 01 6e 60 00 e2 00 d5 6d 1a 00
00 02 01 30 b4 00 04 00 00 00 00 58 d4 70 a0 d0
a0 46 50 30 20 88 0c 20 4f 31 00 00 1a 2d b3 70
a0 d0 a0 3b 50 30 20 d8 08 20 4f 31 00 00 1a 5c
9d 70 a0 d0 a0 34 50 30 20 68 08 20 4f 31 00 00
1a 00 00 00 00 00 00 00 00 00 00 00 00 00 00 fe

70 12 79 00 00 03 01 14 34 31 01 86 6f 0d 4f 00
07 80 1f 00 9f 05 66 00 58 00 07 00 03 01 14 7e
73 01 86 6f 0d 4f 00 07 80 1f 00 9f 05 3c 00 02
00 09 00 00 00 00 00 00 00 00 00 00 00 00 00 00
00 00 00 00 00 00 00 00 00 00 00 00 00 00 00 00
00 00 00 00 00 00 00 00 00 00 00 00 00 00 00 00
00 00 00 00 00 00 00 00 00 00 00 00 00 00 00 00
00 00 00 00 00 00 00 00 00 00 00 00 00 00 ab 90

----------------

Block 0, Base EDID:
  EDID Structure Version & Revision: 1.4
  Vendor & Product Identification:
    Manufacturer: ACR
    Model: 2223
    Serial Number: ...
    Made in: week 11 of 2021
  Basic Display Parameters & Features:
    Digital display
    Bits per primary color channel: 10
    DisplayPort interface
    Maximum image size: 80 cm x 35 cm
    Gamma: 2.20
    DPMS levels: Off
    Supported color formats: RGB 4:4:4, YCrCb 4:4:4, YCrCb 4:2:2
    First detailed timing includes the native pixel format and preferred refresh rate
    Display supports continuous frequencies
  Color Characteristics:
    Red  : 0.6884, 0.3095
    Green: 0.2578, 0.6699
    Blue : 0.1474, 0.0615
    White: 0.3134, 0.3291
  Established Timings I & II:
    IBM     :   720x400    70.081663 Hz   9:5     31.467 kHz     28.320000 MHz
    DMT 0x04:   640x480    59.940476 Hz   4:3     31.469 kHz     25.175000 MHz
    Apple   :   640x480    66.666667 Hz   4:3     35.000 kHz     30.240000 MHz
    DMT 0x05:   640x480    72.808802 Hz   4:3     37.861 kHz     31.500000 MHz
    DMT 0x06:   640x480    75.000000 Hz   4:3     37.500 kHz     31.500000 MHz
    DMT 0x08:   800x600    56.250000 Hz   4:3     35.156 kHz     36.000000 MHz
    DMT 0x09:   800x600    60.316541 Hz   4:3     37.879 kHz     40.000000 MHz
    DMT 0x0a:   800x600    72.187572 Hz   4:3     48.077 kHz     50.000000 MHz
    DMT 0x0b:   800x600    75.000000 Hz   4:3     46.875 kHz     49.500000 MHz
    Apple   :   832x624    74.551266 Hz   4:3     49.726 kHz     57.284000 MHz
    DMT 0x10:  1024x768    60.003840 Hz   4:3     48.363 kHz     65.000000 MHz
    DMT 0x11:  1024x768    70.069359 Hz   4:3     56.476 kHz     75.000000 MHz
    DMT 0x12:  1024x768    75.028582 Hz   4:3     60.023 kHz     78.750000 MHz
    DMT 0x24:  1280x1024   75.024675 Hz   5:4     79.976 kHz    135.000000 MHz
    Apple   :  1152x870    75.061550 Hz 192:145   68.681 kHz    100.000000 MHz
  Standard Timings:
    DMT 0x15:  1152x864    75.000000 Hz   4:3     67.500 kHz    108.000000 MHz
    DMT 0x20:  1280x960    60.000000 Hz   4:3     60.000 kHz    108.000000 MHz
    DMT 0x23:  1280x1024   60.019740 Hz   5:4     63.981 kHz    108.000000 MHz
    DMT 0x55:  1280x720    60.000000 Hz  16:9     45.000 kHz     74.250000 MHz
    DMT 0x1c:  1280x800    59.810326 Hz  16:10    49.702 kHz     83.500000 MHz
    DMT 0x2f:  1440x900    59.887445 Hz  16:10    55.935 kHz    106.500000 MHz
    DMT 0x3a:  1680x1050   59.954250 Hz  16:10    65.290 kHz    146.250000 MHz
    DMT 0x52:  1920x1080   60.000000 Hz  16:9     67.500 kHz    148.500000 MHz
  Detailed Timing Descriptors:
    DTD 1:  3440x1440   59.998875 Hz  43:18    88.858 kHz    319.890000 MHz (800 mm x 335 mm)
                 Hfront   48 Hsync  32 Hback   80 Hpol P
                 Vfront    3 Vsync  10 Vback   28 Vpol N
    DTD 2:  3440x1440  100.000000 Hz  43:18   151.000 kHz    543.600000 MHz (800 mm x 335 mm)
                 Hfront   48 Hsync  32 Hback   80 Hpol P
                 Vfront   56 Vsync   8 Vback    6 Vpol N
    Display Range Limits:
      Monitor ranges (Range Limits Only): 55-180 Hz V, 271-271 kHz H, max dotclock 960 MHz
    Display Product Name: 'X34 GS'
  Extension blocks: 2
Checksum: 0x48

----------------

Block 1, CTA-861 Extension Block:
  Revision: 3
  Underscans IT Video Formats by default
  Basic audio support
  Supports YCbCr 4:4:4
  Supports YCbCr 4:2:2
  Native detailed modes: 1
  Video Data Block:
    VIC   1:   640x480    59.940476 Hz   4:3     31.469 kHz     25.175000 MHz
    VIC   2:   720x480    59.940060 Hz   4:3     31.469 kHz     27.000000 MHz
    VIC   3:   720x480    59.940060 Hz  16:9     31.469 kHz     27.000000 MHz
    VIC   4:  1280x720    60.000000 Hz  16:9     45.000 kHz     74.250000 MHz
    VIC  16:  1920x1080   60.000000 Hz  16:9     67.500 kHz    148.500000 MHz
    VIC  17:   720x576    50.000000 Hz   4:3     31.250 kHz     27.000000 MHz
    VIC  18:   720x576    50.000000 Hz  16:9     31.250 kHz     27.000000 MHz
    VIC  19:  1280x720    50.000000 Hz  16:9     37.500 kHz     74.250000 MHz
    VIC  31:  1920x1080   50.000000 Hz  16:9     56.250 kHz    148.500000 MHz
    VIC  32:  1920x1080   24.000000 Hz  16:9     27.000 kHz     74.250000 MHz
    VIC  33:  1920x1080   25.000000 Hz  16:9     28.125 kHz     74.250000 MHz
    VIC  34:  1920x1080   30.000000 Hz  16:9     33.750 kHz     74.250000 MHz
    VIC  89:  2560x1080   50.000000 Hz  64:27    56.250 kHz    185.625000 MHz
    VIC  90:  2560x1080   60.000000 Hz  64:27    66.000 kHz    198.000000 MHz
    VIC  93:  3840x2160   24.000000 Hz  16:9     54.000 kHz    297.000000 MHz
    VIC  94:  3840x2160   25.000000 Hz  16:9     56.250 kHz    297.000000 MHz
    VIC  95:  3840x2160   30.000000 Hz  16:9     67.500 kHz    297.000000 MHz
    VIC  97:  3840x2160   60.000000 Hz  16:9    135.000 kHz    594.000000 MHz
  Audio Data Block:
    Linear PCM:
      Max channels: 2
      Supported sample rates (kHz): 48 44.1 32
      Supported sample sizes (bits): 24 20 16
  Speaker Allocation Data Block:
    FL/FR - Front Left/Right
  Colorimetry Data Block:
    xvYCC601
    xvYCC709
    BT2020YCC
    BT2020RGB
    Gamut Boundary Description Metadata Profile P0
  HDR Static Metadata Data Block:
    Electro optical transfer functions:
      Traditional gamma - SDR luminance range
      SMPTE ST2084
    Supported static metadata descriptors:
      Static metadata type 1
    Desired content max luminance: 110 (541.702 cd/m^2)
    Desired content max frame-average luminance: 96 (400.000 cd/m^2)
    Desired content min luminance: 0 (0.000 cd/m^2)
  Video Capability Data Block:
    YCbCr quantization: Selectable (via AVI YQ)
    RGB quantization: Selectable (via AVI Q)
    PT scan behavior: Always Overscanned
    IT scan behavior: Always Overscanned
    CE scan behavior: Always Overscanned
  Vendor-Specific Data Block (AMD), OUI 00-00-1A:
    Version: 2
    Feature Caps: 0x01
    Minimum Refresh Rate: 48 Hz
    Maximum Refresh Rate: 180 Hz
    Flags 1.x: 0x00
    Flags 2.x: 0x04
    Maximum luminance: 0 (50.000 cd/m^2)
    Minimum luminance: 0 (0.000 cd/m^2)
    Maximum luminance (without local dimming): 0 (50.000 cd/m^2)
    Minimum luminance (without local dimming): 0 (0.000 cd/m^2)
  Detailed Timing Descriptors:
    DTD 3:  3440x1440  100.000000 Hz  43:18   151.000 kHz    543.600000 MHz (800 mm x 335 mm)
                 Hfront   48 Hsync  32 Hback   80 Hpol P
                 Vfront   56 Vsync   8 Vback    6 Vpol N
    DTD 4:  3440x1440   84.999259 Hz  43:18   127.414 kHz    458.690000 MHz (800 mm x 335 mm)
                 Hfront   48 Hsync  32 Hback   80 Hpol P
                 Vfront   45 Vsync   8 Vback    6 Vpol N
    DTD 5:  3440x1440   75.000000 Hz  43:18   111.900 kHz    402.840000 MHz (800 mm x 335 mm)
                 Hfront   48 Hsync  32 Hback   80 Hpol P
                 Vfront   38 Vsync   8 Vback    6 Vpol N
Checksum: 0xfe  Unused space in Extension Block: 14 bytes

----------------

Block 2, DisplayID Extension Block:
  Version: 1.2
  Extension Count: 0
  Display Product Type: Extension Section
  Video Timing Modes Type 1 - Detailed Timings Data Block:
    DTD:  3440x1440  143.855314 Hz  64:27   221.969 kHz    781.330000 MHz (aspect 64:27, no 3D stereo, preferred)
               Hfront    8 Hsync  32 Hback   40 Hpol P
               Vfront   89 Vsync   8 Vback    6 Vpol N
  Video Timing Modes Type 1 - Detailed Timings Data Block:
    DTD:  3440x1440  179.999319 Hz  64:27   270.179 kHz    951.030000 MHz (aspect 64:27, no 3D stereo, preferred)
               Hfront    8 Hsync  32 Hback   40 Hpol P
               Vfront    3 Vsync  10 Vback   48 Vpol N
  Checksum: 0xab
Checksum: 0x90

----------------

Block 3, Unknown EDID Extension Block 0x00:
  00 ff ff ff ff ff ff 00 04 72 af 08 da 28 10 11 '.........r...(..'
  0b 1f 01 04 b5 50 23 78 3b 52 f5 b0 4f 42 ab 25 '.....P#x;R..OB.%'
  0f 50 54 bf ef 80 71 4f 81 40 81 80 81 c0 81 00 '.PT...qO.@......'
  95 00 b3 00 d1 c0 f5 7c 70 a0 d0 a0 29 50 30 20 '.......|p...)P0 '
  3a 00 20 4f 31 00 00 1a 58 d4 70 a0 d0 a0 46 50 ':. O1...X.p...FP'
  30 20 88 0c 20 4f 31 00 00 1a 00 00 00 fd 0c 37 '0 .. O1........7'
  b4 10 10 60 01 0a 20 20 20 20 20 20 00 00 00 fc '...`..      ....'
  00 58 33 34 20 47 53 0a 20 20 20 20 20 20 02 48 '.X34 GS.      .H'
Checksum: 0x48

----------------

Block 4, CTA-861 Extension Block:
  Revision: 3
  Underscans IT Video Formats by default
  Basic audio support
  Supports YCbCr 4:4:4
  Supports YCbCr 4:2:2
  Native detailed modes: 1
  Video Data Block:
    VIC   1:   640x480    59.940476 Hz   4:3     31.469 kHz     25.175000 MHz
    VIC   2:   720x480    59.940060 Hz   4:3     31.469 kHz     27.000000 MHz
    VIC   3:   720x480    59.940060 Hz  16:9     31.469 kHz     27.000000 MHz
    VIC   4:  1280x720    60.000000 Hz  16:9     45.000 kHz     74.250000 MHz
    VIC  16:  1920x1080   60.000000 Hz  16:9     67.500 kHz    148.500000 MHz
    VIC  17:   720x576    50.000000 Hz   4:3     31.250 kHz     27.000000 MHz
    VIC  18:   720x576    50.000000 Hz  16:9     31.250 kHz     27.000000 MHz
    VIC  19:  1280x720    50.000000 Hz  16:9     37.500 kHz     74.250000 MHz
    VIC  31:  1920x1080   50.000000 Hz  16:9     56.250 kHz    148.500000 MHz
    VIC  32:  1920x1080   24.000000 Hz  16:9     27.000 kHz     74.250000 MHz
    VIC  33:  1920x1080   25.000000 Hz  16:9     28.125 kHz     74.250000 MHz
    VIC  34:  1920x1080   30.000000 Hz  16:9     33.750 kHz     74.250000 MHz
    VIC  89:  2560x1080   50.000000 Hz  64:27    56.250 kHz    185.625000 MHz
    VIC  90:  2560x1080   60.000000 Hz  64:27    66.000 kHz    198.000000 MHz
    VIC  93:  3840x2160   24.000000 Hz  16:9     54.000 kHz    297.000000 MHz
    VIC  94:  3840x2160   25.000000 Hz  16:9     56.250 kHz    297.000000 MHz
    VIC  95:  3840x2160   30.000000 Hz  16:9     67.500 kHz    297.000000 MHz
    VIC  97:  3840x2160   60.000000 Hz  16:9    135.000 kHz    594.000000 MHz
  Audio Data Block:
    Linear PCM:
      Max channels: 2
      Supported sample rates (kHz): 48 44.1 32
      Supported sample sizes (bits): 24 20 16
  Speaker Allocation Data Block:
    FL/FR - Front Left/Right
  Colorimetry Data Block:
    xvYCC601
    xvYCC709
    BT2020YCC
    BT2020RGB
    Gamut Boundary Description Metadata Profile P0
  HDR Static Metadata Data Block:
    Electro optical transfer functions:
      Traditional gamma - SDR luminance range
      SMPTE ST2084
    Supported static metadata descriptors:
      Static metadata type 1
    Desired content max luminance: 110 (541.702 cd/m^2)
    Desired content max frame-average luminance: 96 (400.000 cd/m^2)
    Desired content min luminance: 0 (0.000 cd/m^2)
  Video Capability Data Block:
    YCbCr quantization: Selectable (via AVI YQ)
    RGB quantization: Selectable (via AVI Q)
    PT scan behavior: Always Overscanned
    IT scan behavior: Always Overscanned
    CE scan behavior: Always Overscanned
  Vendor-Specific Data Block (AMD), OUI 00-00-1A:
    Version: 2
    Feature Caps: 0x01
    Minimum Refresh Rate: 48 Hz
    Maximum Refresh Rate: 180 Hz
    Flags 1.x: 0x00
    Flags 2.x: 0x04
    Maximum luminance: 0 (50.000 cd/m^2)
    Minimum luminance: 0 (0.000 cd/m^2)
    Maximum luminance (without local dimming): 0 (50.000 cd/m^2)
    Minimum luminance (without local dimming): 0 (0.000 cd/m^2)
  Detailed Timing Descriptors:
    DTD 6:  3440x1440  100.000000 Hz  43:18   151.000 kHz    543.600000 MHz (800 mm x 335 mm)
                 Hfront   48 Hsync  32 Hback   80 Hpol P
                 Vfront   56 Vsync   8 Vback    6 Vpol N
    DTD 7:  3440x1440   84.999259 Hz  43:18   127.414 kHz    458.690000 MHz (800 mm x 335 mm)
                 Hfront   48 Hsync  32 Hback   80 Hpol P
                 Vfront   45 Vsync   8 Vback    6 Vpol N
    DTD 8:  3440x1440   75.000000 Hz  43:18   111.900 kHz    402.840000 MHz (800 mm x 335 mm)
                 Hfront   48 Hsync  32 Hback   80 Hpol P
                 Vfront   38 Vsync   8 Vback    6 Vpol N
Checksum: 0xfe  Unused space in Extension Block: 14 bytes

----------------

Block 5, DisplayID Extension Block:
  Version: 1.2
  Extension Count: 0
  Video Timing Modes Type 1 - Detailed Timings Data Block:
    DTD:  3440x1440  143.855314 Hz  64:27   221.969 kHz    781.330000 MHz (aspect 64:27, no 3D stereo, preferred)
               Hfront    8 Hsync  32 Hback   40 Hpol P
               Vfront   89 Vsync   8 Vback    6 Vpol N
  Video Timing Modes Type 1 - Detailed Timings Data Block:
    DTD:  3440x1440  179.999319 Hz  64:27   270.179 kHz    951.030000 MHz (aspect 64:27, no 3D stereo, preferred)
               Hfront    8 Hsync  32 Hback   40 Hpol P
               Vfront    3 Vsync  10 Vback   48 Vpol N
  Checksum: 0xab
Checksum: 0x90

----------------

Warnings:

Block 1, CTA-861 Extension Block:
  Video Data Block: VIC 1 and the first DTD are not identical. Is this intended?
  Video Data Block: All VICs are in ascending order, and the first (preferred) VIC <= 4, is that intended?
  Colorimetry Data Block: Set the sRGB colorimetry bit to avoid interop issues.
  Video Capability Data Block: IT scan behavior is expected to support underscanned.
  Video Capability Data Block: S_PT is equal to S_IT and S_CE, so should be set to 0 instead.
Block 4, CTA-861 Extension Block:
  Video Data Block: All VICs are in ascending order, and the first (preferred) VIC <= 4, is that intended?
  Colorimetry Data Block: Set the sRGB colorimetry bit to avoid interop issues.
  Video Capability Data Block: IT scan behavior is expected to support underscanned.
  Video Capability Data Block: S_PT is equal to S_IT and S_CE, so should be set to 0 instead.
EDID:
  Base EDID: Some timings are out of range of the Monitor Ranges:
    Vertical Freq: 24.000 - 179.999 Hz (Monitor: 55.000 - 180.000 Hz)
    Horizontal Freq: 27.000 - 270.178 kHz (Monitor: 271.000 - 271.000 kHz)

Failures:

Block 1, CTA-861 Extension Block:
  Video Capability Data Block: IT video formats are always overscanned, but bit 7 of Byte 3 of the CTA-861 Extension header is set to underscanned.
Block 2, DisplayID Extension Block:
  DisplayID Base Block has no product type.
  Expected 0 DisplayID Extension Block, but got 1.
Block 3, Base EDID:
  Unknown Extension Block.
Block 4, CTA-861 Extension Block:
  Video Data Block: Duplicate VIC 1.
  Video Data Block: Duplicate VIC 2.
  Video Data Block: Duplicate VIC 3.
  Video Data Block: Duplicate VIC 4.
  Video Data Block: Duplicate VIC 16.
  Video Data Block: Duplicate VIC 17.
  Video Data Block: Duplicate VIC 18.
  Video Data Block: Duplicate VIC 19.
  Video Data Block: Duplicate VIC 31.
  Video Data Block: Duplicate VIC 32.
  Video Data Block: Duplicate VIC 33.
  Video Data Block: Duplicate VIC 34.
  Video Data Block: Duplicate VIC 89.
  Video Data Block: Duplicate VIC 90.
  Video Data Block: Duplicate VIC 93.
  Video Data Block: Duplicate VIC 94.
  Video Data Block: Duplicate VIC 95.
  Video Data Block: Duplicate VIC 97.
  Speaker Allocation Data Block: Only one instance of this Data Block is allowed.
  Colorimetry Data Block: Only one instance of this Data Block is allowed.
  HDR Static Metadata Data Block: Only one instance of this Data Block is allowed.
  Video Capability Data Block: Only one instance of this Data Block is allowed.
  Video Capability Data Block: IT video formats are always overscanned, but bit 7 of Byte 3 of the CTA-861 Extension header is set to underscanned.
EDID:
  Base EDID: EDID specified 2 extension block(s), but found 5 extension block(s).

EDID conformity: FAIL
