edid-decode (hex):

00 ff ff ff ff ff ff 00 30 ae a2 66 00 00 00 00
34 1f 01 04 a5 46 27 78 3f 31 25 a6 55 4e 9c 26
0e 50 54 af ef 00 b3 00 a9 c0 d1 fc d1 c0 71 4f
81 80 81 c0 81 8a 56 5e 00 a0 a0 a0 29 50 30 20
35 00 ba 88 21 00 00 1a 00 00 00 ff 00 55 4d 57
30 43 48 47 34 0a 20 20 20 20 00 00 00 fd 00 30
90 df df 3c 01 0a 20 20 20 20 20 20 00 00 00 fc
00 4c 45 4e 20 47 33 32 71 63 2d 31 30 0a 01 6a

02 03 22 f5 47 01 03 13 04 12 90 1f 23 09 07 07
83 01 00 00 6d 1a 00 00 02 01 30 90 00 00 00 00
00 00 86 bc 00 50 a0 a0 55 50 08 20 78 00 56 50
21 00 00 1a 40 e7 00 6a a0 a0 67 50 08 20 98 04
56 50 21 00 00 1a 66 21 56 aa 51 00 1e 30 46 8f
33 00 c4 fe 10 00 00 1e e6 9c 00 64 a0 a0 46 50
30 20 88 0c 56 50 21 00 00 1a 00 00 00 00 00 00
00 00 00 00 00 00 00 00 00 00 00 00 00 00 00 f5

00 ff ff ff ff ff ff 00 30 ae a2 66 00 00 00 00
34 1f 01 04 a5 46 27 78 3f 31 25 a6 55 4e 9c 26
0e 50 54 af ef 00 b3 00 a9 c0 d1 fc d1 c0 71 4f
81 80 81 c0 81 8a 56 5e 00 a0 a0 a0 29 50 30 20
35 00 ba 88 21 00 00 1a 00 00 00 ff 00 55 4d 57
30 43 48 47 34 0a 20 20 20 20 00 00 00 fd 00 30
90 df df 3c 01 0a 20 20 20 20 20 20 00 00 00 fc
00 4c 45 4e 20 47 33 32 71 63 2d 31 30 0a 01 6a

02 03 22 f5 47 01 03 13 04 12 90 1f 23 09 07 07
83 01 00 00 6d 1a 00 00 02 01 30 90 00 00 00 00
00 00 86 bc 00 50 a0 a0 55 50 08 20 78 00 56 50
21 00 00 1a 40 e7 00 6a a0 a0 67 50 08 20 98 04
56 50 21 00 00 1a 66 21 56 aa 51 00 1e 30 46 8f
33 00 c4 fe 10 00 00 1e e6 9c 00 64 a0 a0 46 50
30 20 88 0c 56 50 21 00 00 1a 00 00 00 00 00 00
00 00 00 00 00 00 00 00 00 00 00 00 00 00 00 f5

----------------

Block 0, Base EDID:
  EDID Structure Version & Revision: 1.4
  Vendor & Product Identification:
    Manufacturer: LEN
    Model: 26274
    Made in: week 52 of 2021
  Basic Display Parameters & Features:
    Digital display
    Bits per primary color channel: 8
    DisplayPort interface
    Maximum image size: 70 cm x 39 cm
    Gamma: 2.20
    DPMS levels: Off
    Supported color formats: RGB 4:4:4, YCrCb 4:4:4, YCrCb 4:2:2
    Default (sRGB) color space is primary color space
    First detailed timing includes the native pixel format and preferred refresh rate
    Display supports continuous frequencies
  Color Characteristics:
    Red  : 0.6484, 0.3349
    Green: 0.3046, 0.6103
    Blue : 0.1484, 0.0566
    White: 0.3134, 0.3291
  Established Timings I & II:
    IBM     :   720x400    70.081663 Hz   9:5     31.467 kHz     28.320000 MHz
    DMT 0x04:   640x480    59.940476 Hz   4:3     31.469 kHz     25.175000 MHz
    DMT 0x05:   640x480    72.808802 Hz   4:3     37.861 kHz     31.500000 MHz
    DMT 0x06:   640x480    75.000000 Hz   4:3     37.500 kHz     31.500000 MHz
    DMT 0x08:   800x600    56.250000 Hz   4:3     35.156 kHz     36.000000 MHz
    DMT 0x09:   800x600    60.316541 Hz   4:3     37.879 kHz     40.000000 MHz
    DMT 0x0a:   800x600    72.187572 Hz   4:3     48.077 kHz     50.000000 MHz
    DMT 0x0b:   800x600    75.000000 Hz   4:3     46.875 kHz     49.500000 MHz
    Apple   :   832x624    74.551266 Hz   4:3     49.726 kHz     57.284000 MHz
    DMT 0x10:  1024x768    60.003840 Hz   4:3     48.363 kHz     65.000000 MHz
    DMT 0x11:  1024x768    70.069359 Hz   4:3     56.476 kHz     75.000000 MHz
    DMT 0x12:  1024x768    75.028582 Hz   4:3     60.023 kHz     78.750000 MHz
    DMT 0x24:  1280x1024   75.024675 Hz   5:4     79.976 kHz    135.000000 MHz
  Standard Timings:
    DMT 0x3a:  1680x1050   59.954250 Hz  16:10    65.290 kHz    146.250000 MHz
    DMT 0x53:  1600x900    60.000000 Hz  16:9     60.000 kHz    108.000000 MHz (RB)
    GTF     :  1920x1080  119.999987 Hz  16:9    138.840 kHz    368.759000 MHz
    DMT 0x52:  1920x1080   60.000000 Hz  16:9     67.500 kHz    148.500000 MHz
    DMT 0x15:  1152x864    75.000000 Hz   4:3     67.500 kHz    108.000000 MHz
    DMT 0x23:  1280x1024   60.019740 Hz   5:4     63.981 kHz    108.000000 MHz
    DMT 0x55:  1280x720    60.000000 Hz  16:9     45.000 kHz     74.250000 MHz
    GTF     :  1280x1024   69.999805 Hz   5:4     74.620 kHz    128.943000 MHz
  Detailed Timing Descriptors:
    DTD 1:  2560x1440   59.950550 Hz  16:9     88.787 kHz    241.500000 MHz (698 mm x 392 mm)
                 Hfront   48 Hsync  32 Hback   80 Hpol P
                 Vfront    3 Vsync   5 Vback   33 Vpol N
    Display Product Serial Number: ...
    Display Range Limits:
      Monitor ranges (Range Limits Only): 48-144 Hz V, 223-223 kHz H, max dotclock 600 MHz
    Display Product Name: 'LEN G32qc-10'
  Extension blocks: 1
Checksum: 0x6a

----------------

Block 1, CTA-861 Extension Block:
  Revision: 3
  Underscans IT Video Formats by default
  Basic audio support
  Supports YCbCr 4:4:4
  Supports YCbCr 4:2:2
  Native DTDs: 5
  Video Data Block:
    VIC   1:   640x480    59.940476 Hz   4:3     31.469 kHz     25.175000 MHz
    VIC   3:   720x480    59.940060 Hz  16:9     31.469 kHz     27.000000 MHz
    VIC  19:  1280x720    50.000000 Hz  16:9     37.500 kHz     74.250000 MHz
    VIC   4:  1280x720    60.000000 Hz  16:9     45.000 kHz     74.250000 MHz
    VIC  18:   720x576    50.000000 Hz  16:9     31.250 kHz     27.000000 MHz
    VIC  16:  1920x1080   60.000000 Hz  16:9     67.500 kHz    148.500000 MHz (native)
    VIC  31:  1920x1080   50.000000 Hz  16:9     56.250 kHz    148.500000 MHz
  Audio Data Block:
    Linear PCM:
      Max channels: 2
      Supported sample rates (kHz): 48 44.1 32
      Supported sample sizes (bits): 24 20 16
  Speaker Allocation Data Block:
    FL/FR - Front Left/Right
  Vendor-Specific Data Block (AMD), OUI 00-00-1A:
    Version: 2
    Feature Caps: 0x01
    Minimum Refresh Rate: 48 Hz
    Maximum Refresh Rate: 144 Hz
    Flags 1.x: 0x00
    Flags 2.x: 0x00
  Detailed Timing Descriptors:
    DTD 2:  2560x1440  119.875807 Hz  16:9    182.811 kHz    482.620000 MHz (598 mm x 336 mm)
                 Hfront    8 Hsync  32 Hback   40 Hpol P
                 Vfront    7 Vsync   8 Vback   70 Vpol N
    DTD 3:  2560x1440  143.911545 Hz  16:9    222.056 kHz    592.000000 MHz (598 mm x 336 mm)
                 Hfront    8 Hsync  32 Hback   66 Hpol P
                 Vfront   25 Vsync   8 Vback   70 Vpol N
    DTD 4:  1366x768    59.789541 Hz 683:384   47.712 kHz     85.500000 MHz (452 mm x 254 mm)
                 Hfront   70 Hsync 143 Hback  213 Hpol P
                 Vfront    3 Vsync   3 Vback   24 Vpol P
    DTD 5:  2560x1440  100.000000 Hz  16:9    151.000 kHz    401.660000 MHz (598 mm x 336 mm)
                 Hfront   48 Hsync  32 Hback   20 Hpol P
                 Vfront   56 Vsync   8 Vback    6 Vpol N
Checksum: 0xf5  Unused space in Extension Block: 21 bytes

----------------

Warnings:

Block 1, CTA-861 Extension Block:
  Video Data Block: VIC 1 and the first DTD are not identical. Is this intended?
EDID:
  Base EDID: Some timings are out of range of the Monitor Ranges:
    Horizontal Freq: 31.250 - 222.055 kHz (Monitor: 223.000 - 223.000 kHz)

Failures:

Block 0, Base EDID:
  Basic Display Parameters & Features: sRGB is signaled, but the chromaticities do not match.
Block 1, CTA-861 Extension Block:
  Detailed Timing Descriptor #2: Mismatch of image size 598x336 mm vs display size 700x390 mm.
  Detailed Timing Descriptor #3: Mismatch of image size 598x336 mm vs display size 700x390 mm.
  Detailed Timing Descriptor #4: Mismatch of image size 452x254 mm vs display size 700x390 mm.
  Detailed Timing Descriptor #5: Mismatch of image size 598x336 mm vs display size 700x390 mm.
  Missing VCDB, needed for Set Selectable RGB Quantization to avoid interop issues.
EDID:
  Extension Block 2 started with EDID header, ignoring Extension Blocks >= 2.
  CTA-861: Native progressive timings are a mix of several resolutions.

EDID conformity: FAIL
