edid-decode (hex):

00 ff ff ff ff ff ff 00 4c 2d 96 0f 00 00 00 00
29 1c 01 04 b5 46 27 78 3a ce 51 a6 57 4c 9f 26
12 50 54 bf ef 80 71 4f 81 00 81 c0 81 80 a9 c0
b3 00 95 00 01 01 4d 6c 80 a0 70 70 3e 80 30 20
3a 00 b9 88 21 00 00 1c 00 00 00 fd 00 38 4b 1e
86 1c 00 0a 20 20 20 20 20 20 00 00 00 fc 00 55
33 32 52 35 39 78 0a 20 20 20 20 20 00 00 00 ff
00 48 31 41 4b 35 30 30 30 30 30 0a 20 20 01 ee

02 03 0e f0 41 10 23 09 07 07 83 01 00 00 02 3a
80 18 71 38 2d 40 58 2c 45 00 b9 88 21 00 00 1e
00 00 00 00 00 00 00 00 00 00 00 00 00 00 00 00
00 00 00 00 00 00 00 00 00 00 00 00 00 00 00 00
00 00 00 00 00 00 00 00 00 00 00 00 00 00 00 00
00 00 00 00 00 00 00 00 00 00 00 00 00 00 00 00
00 00 00 00 00 00 00 00 00 00 00 00 00 00 00 00
00 00 00 00 00 00 00 00 00 00 00 00 00 00 00 bb

00 ff ff ff ff ff ff 00 4c 2d 96 0f 00 00 00 00
29 1c 01 04 b5 46 27 78 3a ce 51 a6 57 4c 9f 26
12 50 54 bf ef 80 71 4f 81 00 81 c0 81 80 a9 c0
b3 00 95 00 01 01 4d 6c 80 a0 70 70 3e 80 30 20
3a 00 b9 88 21 00 00 1c 00 00 00 fd 00 38 4b 1e
86 1c 00 0a 20 20 20 20 20 20 00 00 00 fc 00 55
33 32 52 35 39 78 0a 20 20 20 20 20 00 00 00 ff
00 48 31 41 4b 35 30 30 30 30 30 0a 20 20 01 ee

02 03 0e f0 41 10 23 09 07 07 83 01 00 00 02 3a
80 18 71 38 2d 40 58 2c 45 00 b9 88 21 00 00 1e
00 00 00 00 00 00 00 00 00 00 00 00 00 00 00 00
00 00 00 00 00 00 00 00 00 00 00 00 00 00 00 00
00 00 00 00 00 00 00 00 00 00 00 00 00 00 00 00
00 00 00 00 00 00 00 00 00 00 00 00 00 00 00 00
00 00 00 00 00 00 00 00 00 00 00 00 00 00 00 00
00 00 00 00 00 00 00 00 00 00 00 00 00 00 00 bb

----------------

Block 0, Base EDID:
  EDID Structure Version & Revision: 1.4
  Vendor & Product Identification:
    Manufacturer: SAM
    Model: 3990
    Made in: week 41 of 2018
  Basic Display Parameters & Features:
    Digital display
    Bits per primary color channel: 10
    DisplayPort interface
    Maximum image size: 70 cm x 39 cm
    Gamma: 2.20
    DPMS levels: Off
    Supported color formats: RGB 4:4:4, YCrCb 4:4:4, YCrCb 4:2:2
    First detailed timing includes the native pixel format and preferred refresh rate
  Color Characteristics:
    Red  : 0.6513, 0.3398
    Green: 0.2998, 0.6230
    Blue : 0.1494, 0.0712
    White: 0.3125, 0.3291
  Established Timings I & II:
    IBM     :   720x400    70.081663 Hz   9:5     31.467 kHz     28.320000 MHz
    DMT 0x04:   640x480    59.940476 Hz   4:3     31.469 kHz     25.175000 MHz
    Apple   :   640x480    66.666667 Hz   4:3     35.000 kHz     30.240000 MHz
    DMT 0x05:   640x480    72.808802 Hz   4:3     37.861 kHz     31.500000 MHz
    DMT 0x06:   640x480    75.000000 Hz   4:3     37.500 kHz     31.500000 MHz
    DMT 0x08:   800x600    56.250000 Hz   4:3     35.156 kHz     36.000000 MHz
    DMT 0x09:   800x600    60.316541 Hz   4:3     37.879 kHz     40.000000 MHz
    DMT 0x0a:   800x600    72.187572 Hz   4:3     48.077 kHz     50.000000 MHz
    DMT 0x0b:   800x600    75.000000 Hz   4:3     46.875 kHz     49.500000 MHz
    Apple   :   832x624    74.551266 Hz   4:3     49.726 kHz     57.284000 MHz
    DMT 0x10:  1024x768    60.003840 Hz   4:3     48.363 kHz     65.000000 MHz
    DMT 0x11:  1024x768    70.069359 Hz   4:3     56.476 kHz     75.000000 MHz
    DMT 0x12:  1024x768    75.028582 Hz   4:3     60.023 kHz     78.750000 MHz
    DMT 0x24:  1280x1024   75.024675 Hz   5:4     79.976 kHz    135.000000 MHz
    Apple   :  1152x870    75.061550 Hz 192:145   68.681 kHz    100.000000 MHz
  Standard Timings:
    DMT 0x15:  1152x864    75.000000 Hz   4:3     67.500 kHz    108.000000 MHz
    DMT 0x1c:  1280x800    59.810326 Hz  16:10    49.702 kHz     83.500000 MHz
    DMT 0x55:  1280x720    60.000000 Hz  16:9     45.000 kHz     74.250000 MHz
    DMT 0x23:  1280x1024   60.019740 Hz   5:4     63.981 kHz    108.000000 MHz
    DMT 0x53:  1600x900    60.000000 Hz  16:9     60.000 kHz    108.000000 MHz (RB)
    DMT 0x3a:  1680x1050   59.954250 Hz  16:10    65.290 kHz    146.250000 MHz
    DMT 0x2f:  1440x900    59.887445 Hz  16:10    55.935 kHz    106.500000 MHz
  Detailed Timing Descriptors:
    DTD 1:  1920x2160   59.987970 Hz   8:9    133.293 kHz    277.250000 MHz (697 mm x 392 mm)
                 Hfront   48 Hsync  32 Hback   80 Hpol N
                 Vfront    3 Vsync  10 Vback   49 Vpol P
    Display Range Limits:
      Monitor ranges (GTF): 56-75 Hz V, 30-134 kHz H, max dotclock 280 MHz
    Display Product Name: 'U32R59x'
    Display Product Serial Number: ...
  Extension blocks: 1
Checksum: 0xee

----------------

Block 1, CTA-861 Extension Block:
  Revision: 3
  Underscans IT Video Formats by default
  Basic audio support
  Supports YCbCr 4:4:4
  Supports YCbCr 4:2:2
  Native DTDs: 0
  Video Data Block:
    VIC  16:  1920x1080   60.000000 Hz  16:9     67.500 kHz    148.500000 MHz
  Audio Data Block:
    Linear PCM:
      Max channels: 2
      Supported sample rates (kHz): 48 44.1 32
      Supported sample sizes (bits): 24 20 16
  Speaker Allocation Data Block:
    FL/FR - Front Left/Right
  Detailed Timing Descriptors:
    DTD 2:  1920x1080   60.000000 Hz  16:9     67.500 kHz    148.500000 MHz (697 mm x 392 mm)
                 Hfront   88 Hsync  44 Hback  148 Hpol P
                 Vfront    4 Vsync   5 Vback   36 Vpol P
Checksum: 0xbb  Unused space in Extension Block: 95 bytes

----------------

Warnings:

Block 0, Base EDID:
  Detailed Timing Descriptor #1: Image size is 697x392 mm, but based on the picture AR it should be 348x392 mm.
  Display Range Limits: GTF support is deprecated in EDID 1.4.
  Display Product Serial Number: ...
Block 1, CTA-861 Extension Block:
  Video Data Block: VIC 16 and the first DTD are not identical. Is this intended?
  Add a Colorimetry Data Block with the sRGB colorimetry bit set to avoid interop issues.

Failures:

Block 0, Base EDID:
  Display Range Limits: GTF is supported, but the display does not support continuous frequencies.
Block 1, CTA-861 Extension Block:
  Missing VCDB, needed for Set Selectable RGB Quantization to avoid interop issues.
EDID:
  Extension Block 2 started with EDID header, ignoring Extension Blocks >= 2.

EDID conformity: FAIL
