edid-decode (hex):

00 ff ff ff ff ff ff 00 30 e4 b3 06 00 00 00 00
00 1f 01 04 a5 22 15 78 06 a2 05 a6 54 49 a2 25
0e 50 54 00 00 00 01 01 01 01 01 01 01 01 01 01
01 01 01 01 01 01 28 3c 80 a0 70 b0 23 40 30 20
36 00 50 d2 10 00 00 1a 20 30 80 a0 70 b0 23 40
30 20 36 00 50 d2 10 00 00 1a 00 00 00 fe 00 34
44 57 56 4a 81 31 35 36 57 55 31 0a 00 00 00 00
00 02 41 31 b2 00 11 00 00 0a 01 0a 20 20 00 ad

----------------

Block 0, Base EDID:
  EDID Structure Version & Revision: 1.4
  Vendor & Product Identification:
    Manufacturer: LGD
    Model: 1715
    Made in: 2021
  Basic Display Parameters & Features:
    Digital display
    Bits per primary color channel: 8
    DisplayPort interface
    Maximum image size: 34 cm x 21 cm
    Gamma: 2.20
    Supported color formats: RGB 4:4:4
    Default (sRGB) color space is primary color space
    First detailed timing includes the native pixel format and preferred refresh rate
  Color Characteristics:
    Red  : 0.6503, 0.3300
    Green: 0.2851, 0.6347
    Blue : 0.1445, 0.0546
    White: 0.3134, 0.3291
  Established Timings I & II: none
  Standard Timings: none
  Detailed Timing Descriptors:
    DTD 1:  1920x1200   59.950171 Hz  16:10    74.038 kHz    154.000000 MHz (336 mm x 210 mm)
                 Hfront   48 Hsync  32 Hback   80 Hpol P
                 Vfront    3 Vsync   6 Vback   26 Vpol N
    DTD 2:  1920x1200   47.960137 Hz  16:10    59.231 kHz    123.200000 MHz (336 mm x 210 mm)
                 Hfront   48 Hsync  32 Hback   80 Hpol P
                 Vfront    3 Vsync   6 Vback   26 Vpol N
    Alphanumeric Data String: '4DWVJ.156WU1'
    Manufacturer-Specified Display Descriptor (0x00): 00 00 00 02 41 31 b2 00 11 00 00 0a 01 0a 20 20 '....A1........  '
Checksum: 0xad

----------------

Warnings:

Block 0, Base EDID:
  Alphanumeric Data String: Non-ASCII character 0x81 at position 5, can cause problems.
  Missing Display Product Name.

Failures:

Block 0, Base EDID:
  Basic Display Parameters & Features: sRGB is signaled, but the chromaticities do not match.

EDID conformity: FAIL
