edid-decode (hex):

00 ff ff ff ff ff ff 00 12 e5 10 18 50 2d 31 01
15 12 01 03 81 22 13 78 2a b3 70 a2 55 48 98 27
15 50 54 bf ee 00 59 40 61 4c 81 c0 01 01 01 01
01 01 01 01 01 01 66 21 56 aa 51 00 1e 30 46 8f
33 00 29 17 00 00 00 1e 00 00 00 ff 00 30 0a 0a
0a 0a 0a 0a 0a 0a 0a 0a 0a 0a 00 00 00 fd 00 37
4b 1e 3c 08 00 0a 20 20 20 20 20 20 00 00 00 fc
00 48 44 4d 49 0a 0a 0a 0a 0a 0a 0a 0a 0a 01 46

00 ff ff ff ff ff ff 00 12 e5 00 21 50 2d 31 01
1c 13 01 03 81 2f 1a 78 2e 35 85 a6 56 48 9a 24
12 50 54 af ef 00 71 4f 81 80 81 8a 95 00 95 0f
b3 00 d1 c0 81 00 02 3a 80 18 71 38 2d 40 58 2c
45 00 dc 0c 11 00 00 1e 00 00 00 ff 00 30 0a 0a
0a 0a 0a 0a 0a 0a 0a 0a 0a 0a 00 00 00 fd 00 38
4b 1e 53 15 00 0a 20 20 20 20 20 20 00 00 00 fc
00 48 44 4d 49 0a 0a 0a 0a 0a 0a 0a 0a 0a 01 08

00 ff ff ff ff ff ff 00 12 e5 10 18 50 2d 31 01
15 12 01 03 81 22 13 78 2a b3 70 a2 55 48 98 27
15 50 54 bf ee 00 59 40 61 4c 81 c0 01 01 01 01
01 01 01 01 01 01 66 21 56 aa 51 00 1e 30 46 8f
33 00 29 17 00 00 00 1e 00 00 00 ff 00 30 0a 0a
0a 0a 0a 0a 0a 0a 0a 0a 0a 0a 00 00 00 fd 00 37
4b 1e 3c 08 00 0a 20 20 20 20 20 20 00 00 00 fc
00 48 44 4d 49 0a 0a 0a 0a 0a 0a 0a 0a 0a 01 46

00 ff ff ff ff ff ff 00 12 e5 00 21 50 2d 31 01
1c 13 01 03 81 2f 1a 78 2e 35 85 a6 56 48 9a 24
12 50 54 af ef 00 71 4f 81 80 81 8a 95 00 95 0f
b3 00 d1 c0 81 00 02 3a 80 18 71 38 2d 40 58 2c
45 00 dc 0c 11 00 00 1e 00 00 00 ff 00 30 0a 0a
0a 0a 0a 0a 0a 0a 0a 0a 0a 0a 00 00 00 fd 00 38
4b 1e 53 15 00 0a 20 20 20 20 20 20 00 00 00 fc
00 48 44 4d 49 0a 0a 0a 0a 0a 0a 0a 0a 0a 01 08

----------------

Block 0, Base EDID:
  EDID Structure Version & Revision: 1.3
  Vendor & Product Identification:
    Manufacturer: DWE
    Model: 6160
    Serial Number: ...
    Made in: week 21 of 2008
  Basic Display Parameters & Features:
    Digital display
    DFP 1.x compatible TMDS
    Maximum image size: 34 cm x 19 cm
    Gamma: 2.20
    DPMS levels: Off
    RGB color display
    First detailed timing is the preferred timing
  Color Characteristics:
    Red  : 0.6347, 0.3349
    Green: 0.2812, 0.5966
    Blue : 0.1533, 0.0849
    White: 0.3125, 0.3281
  Established Timings I & II:
    IBM     :   720x400    70.081663 Hz   9:5     31.467 kHz     28.320000 MHz
    DMT 0x04:   640x480    59.940476 Hz   4:3     31.469 kHz     25.175000 MHz
    Apple   :   640x480    66.666667 Hz   4:3     35.000 kHz     30.240000 MHz
    DMT 0x05:   640x480    72.808802 Hz   4:3     37.861 kHz     31.500000 MHz
    DMT 0x06:   640x480    75.000000 Hz   4:3     37.500 kHz     31.500000 MHz
    DMT 0x08:   800x600    56.250000 Hz   4:3     35.156 kHz     36.000000 MHz
    DMT 0x09:   800x600    60.316541 Hz   4:3     37.879 kHz     40.000000 MHz
    DMT 0x0a:   800x600    72.187572 Hz   4:3     48.077 kHz     50.000000 MHz
    DMT 0x0b:   800x600    75.000000 Hz   4:3     46.875 kHz     49.500000 MHz
    Apple   :   832x624    74.551266 Hz   4:3     49.726 kHz     57.284000 MHz
    DMT 0x10:  1024x768    60.003840 Hz   4:3     48.363 kHz     65.000000 MHz
    DMT 0x11:  1024x768    70.069359 Hz   4:3     56.476 kHz     75.000000 MHz
    DMT 0x12:  1024x768    75.028582 Hz   4:3     60.023 kHz     78.750000 MHz
  Standard Timings:
    GTF     :   960x720    59.999484 Hz   4:3     44.760 kHz     55.860000 MHz
    GTF     :  1024x768    72.000073 Hz   4:3     57.672 kHz     78.434000 MHz
    DMT 0x55:  1280x720    60.000000 Hz  16:9     45.000 kHz     74.250000 MHz
  Detailed Timing Descriptors:
    DTD 1:  1366x768    59.789541 Hz 683:384   47.712 kHz     85.500000 MHz (41 mm x 23 mm)
                 Hfront   70 Hsync 143 Hback  213 Hpol P
                 Vfront    3 Vsync   3 Vback   24 Vpol P
    Display Product Serial Number: ...
    Display Range Limits:
      Monitor ranges (GTF): 55-75 Hz V, 30-60 kHz H, max dotclock 80 MHz
    Display Product Name: 'HDMI'
  Extension blocks: 1
Checksum: 0x46

----------------

Warnings:

Block 0, Base EDID:
  Vendor & Product Identification: The serial number is one of the known dummy values, it should probably be set to 0.
  Detailed Timing Descriptor #1: Dubious image size (41x23 mm is smaller than 100x100 mm).
  Display Product Serial Number: ...
EDID:
  Base EDID: Some timings are out of range of the Monitor Ranges:
    Maximum Clock: 85.500 MHz (Monitor: 80.000 MHz)
    Could be due to a Monitor Range off-by-one rounding issue

Failures:

Block 0, Base EDID:
  Display Product Serial Number: ...
  Detailed Timing Descriptor #1: Mismatch of image size 41x23 mm vs display size 340x190 mm.
  Display Product Name: Non-space after newline.
EDID:
  Extension Block 1 started with EDID header, ignoring Extension Blocks >= 1.
  Base EDID: EDID specified 1 extension block(s), but found 0 extension block(s).

EDID conformity: FAIL
