edid-decode (hex):

00 ff ff ff ff ff ff 00 0e 6f 3b 16 00 00 00 00
17 21 01 04 a5 23 16 78 07 ee 95 a3 54 4c 99 26
0f 50 54 00 00 00 01 01 01 01 01 01 01 01 01 01
01 01 01 01 01 01 ea 3d 80 c8 70 b0 2e 40 30 20
36 00 59 d7 10 00 00 1a ea 3d 80 ca 70 b0 64 41
30 20 36 00 59 d7 10 00 00 1a 00 00 00 fd 00 28
3c 4b 4b 10 01 0a 20 20 20 20 20 20 00 00 00 fc
00 4d 4e 47 30 30 37 51 53 34 2d 33 0a 20 00 ba

00 ff ff ff ff ff ff 00 0e 6f 3b 16 00 00 00 00
17 21 01 04 a5 23 16 78 07 ee 95 a3 54 4c 99 26
0f 50 54 00 00 00 01 01 01 01 01 01 01 01 01 01
01 01 01 01 01 01 ea 3d 80 c8 70 b0 2e 40 30 20
36 00 59 d7 10 00 00 1a ea 3d 80 ca 70 b0 64 41
30 20 36 00 59 d7 10 00 00 1a 00 00 00 fd 00 28
3c 4b 4b 10 01 0a 20 20 20 20 20 20 00 00 00 fc
00 4d 4e 47 30 30 37 51 53 34 2d 33 0a 20 00 ba

----------------

Block 0, Base EDID:
  EDID Structure Version & Revision: 1.4
  Vendor & Product Identification:
    Manufacturer: CSO
    Model: 5691
    Made in: week 23 of 2023
  Basic Display Parameters & Features:
    Digital display
    Bits per primary color channel: 8
    DisplayPort interface
    Maximum image size: 35 cm x 22 cm
    Gamma: 2.20
    Supported color formats: RGB 4:4:4
    Default (sRGB) color space is primary color space
    First detailed timing includes the native pixel format and preferred refresh rate
    Display supports continuous frequencies
  Color Characteristics:
    Red  : 0.6396, 0.3300
    Green: 0.2998, 0.5996
    Blue : 0.1503, 0.0595
    White: 0.3134, 0.3291
  Established Timings I & II: none
  Standard Timings: none
  Detailed Timing Descriptors:
    DTD 1:  1920x1200   60.003331 Hz  16:10    74.764 kHz    158.500000 MHz (345 mm x 215 mm)
                 Hfront   48 Hsync  32 Hback  120 Hpol P
                 Vfront    3 Vsync   6 Vback   37 Vpol N
    DTD 2:  1920x1200   48.003654 Hz  16:10    74.694 kHz    158.500000 MHz (345 mm x 215 mm)
                 Hfront   48 Hsync  32 Hback  122 Hpol P
                 Vfront    3 Vsync   6 Vback  347 Vpol N
    Display Range Limits:
      Monitor ranges (Range Limits Only): 40-60 Hz V, 75-75 kHz H, max dotclock 160 MHz
    Display Product Name: 'MNG007QS4-3'
Checksum: 0xba

----------------

Block 1, Unknown EDID Extension Block 0x00:
  00 ff ff ff ff ff ff 00 0e 6f 3b 16 00 00 00 00 '.........o;.....'
  17 21 01 04 a5 23 16 78 07 ee 95 a3 54 4c 99 26 '.!...#.x....TL.&'
  0f 50 54 00 00 00 01 01 01 01 01 01 01 01 01 01 '.PT.............'
  01 01 01 01 01 01 ea 3d 80 c8 70 b0 2e 40 30 20 '.......=..p..@0 '
  36 00 59 d7 10 00 00 1a ea 3d 80 ca 70 b0 64 41 '6.Y......=..p.dA'
  30 20 36 00 59 d7 10 00 00 1a 00 00 00 fd 00 28 '0 6.Y..........('
  3c 4b 4b 10 01 0a 20 20 20 20 20 20 00 00 00 fc '<KK...      ....'
  00 4d 4e 47 30 30 37 51 53 34 2d 33 0a 20 00 ba '.MNG007QS4-3. ..'
Checksum: 0xba

----------------

Failures:

Block 0, Base EDID:
  Basic Display Parameters & Features: sRGB is signaled, but the chromaticities do not match.
Block 1, Base EDID:
  Unknown Extension Block.
EDID:
  Base EDID: EDID specified 0 extension block(s), but found 1 extension block(s).

EDID conformity: FAIL
