edid-decode (hex):

00 ff ff ff ff ff ff 00 0d af 71 15 00 00 00 00
28 12 01 03 90 22 13 78 0a 87 f5 94 57 4f 8c 27
27 50 54 00 00 00 01 01 01 01 01 01 01 01 01 01
01 01 01 01 01 01 79 1a 56 4d 50 00 0f 30 0c 1a
25 00 58 c1 10 00 00 1a 79 1a 56 4d 50 00 0f 30
0c 1a 25 00 58 c1 10 00 00 1a 00 00 00 fe 00 48
32 30 32 4a 80 4e 31 35 36 42 36 0a 00 00 00 00
00 00 00 00 00 00 00 00 00 01 01 0a 20 20 00 f9

00 ff ff ff ff ff ff 00 0d af 71 15 00 00 00 00
28 12 01 03 90 22 13 78 0a 87 f5 94 57 4f 8c 27
27 50 54 00 00 00 01 01 01 01 01 01 01 01 01 01
01 01 01 01 01 01 79 1a 56 4d 50 00 0f 30 0c 1a
25 00 58 c1 10 00 00 1a 79 1a 56 4d 50 00 0f 30
0c 1a 25 00 58 c1 10 00 00 1a 00 00 00 fe 00 48
32 30 32 4a 80 4e 31 35 36 42 36 0a 00 00 00 00
00 00 00 00 00 00 00 00 00 01 01 0a 20 20 00 f9

----------------

Block 0, Base EDID:
  EDID Structure Version & Revision: 1.3
  Vendor & Product Identification:
    Manufacturer: CMO
    Model: 5489
    Made in: week 40 of 2008
  Basic Display Parameters & Features:
    Digital display
    Maximum image size: 34 cm x 19 cm
    Gamma: 2.20
    RGB color display
    First detailed timing is the preferred timing
  Color Characteristics:
    Red  : 0.5800, 0.3398
    Green: 0.3095, 0.5498
    Blue : 0.1552, 0.1552
    White: 0.3134, 0.3291
  Established Timings I & II: none
  Standard Timings: none
  Detailed Timing Descriptors:
    DTD 1:  1366x768    59.980405 Hz 683:384   46.965 kHz     67.770000 MHz (344 mm x 193 mm)
                 Hfront   12 Hsync  26 Hback   39 Hpol P
                 Vfront    2 Vsync   5 Vback    8 Vpol N
    DTD 2:  1366x768    59.980405 Hz 683:384   46.965 kHz     67.770000 MHz (344 mm x 193 mm)
                 Hfront   12 Hsync  26 Hback   39 Hpol P
                 Vfront    2 Vsync   5 Vback    8 Vpol N
    Alphanumeric Data String: 'H202J.N156B6'
    Manufacturer-Specified Display Descriptor (0x00): 00 00 00 00 00 00 00 00 00 00 00 01 01 0a 20 20 '..............  '
Checksum: 0xf9

----------------

Block 1, Unknown EDID Extension Block 0x00:
  00 ff ff ff ff ff ff 00 0d af 71 15 00 00 00 00 '..........q.....'
  28 12 01 03 90 22 13 78 0a 87 f5 94 57 4f 8c 27 '(....".x....WO.''
  27 50 54 00 00 00 01 01 01 01 01 01 01 01 01 01 ''PT.............'
  01 01 01 01 01 01 79 1a 56 4d 50 00 0f 30 0c 1a '......y.VMP..0..'
  25 00 58 c1 10 00 00 1a 79 1a 56 4d 50 00 0f 30 '%.X.....y.VMP..0'
  0c 1a 25 00 58 c1 10 00 00 1a 00 00 00 fe 00 48 '..%.X..........H'
  32 30 32 4a 80 4e 31 35 36 42 36 0a 00 00 00 00 '202J.N156B6.....'
  00 00 00 00 00 00 00 00 00 01 01 0a 20 20 00 f9 '............  ..'
Checksum: 0xf9

----------------

Warnings:

Block 0, Base EDID:
  Alphanumeric Data String: Non-ASCII character 0x80 at position 5, can cause problems.

Failures:

Block 0, Base EDID:
  Basic Display Parameters & Features: Digital Video Interface Standard set to reserved value 0x10.
  Missing Display Product Name.
  Missing Display Range Limits Descriptor.
Block 1, Base EDID:
  Unknown Extension Block.
EDID:
  Base EDID: EDID specified 0 extension block(s), but found 1 extension block(s).

EDID conformity: FAIL
