edid-decode (hex):

00 ff ff ff ff ff ff 00 22 f0 46 28 00 00 00 00
0f 14 01 04 a5 29 1a 78 26 37 c5 a4 55 4c 9b 25
12 50 54 a1 08 00 81 40 81 80 01 01 01 01 01 01
01 01 01 01 01 01 9a 29 a0 d0 51 84 22 30 50 98
36 00 98 ff 10 00 00 1c 00 00 00 fd 00 32 4c 18
53 0e 01 0a 20 20 20 20 20 20 00 00 00 fc 00 4c
41 31 39 30 35 0a 20 20 20 20 20 20 00 00 00 ff
00 43 4e 43 30 31 35 31 37 53 4d 0a 20 20 00 d3

00 ff ff ff ff ff ff 00 22 f0 46 28 00 00 00 00
0f 14 01 04 a5 29 1a 78 26 37 c5 a4 55 4c 9b 25
12 50 54 a1 08 00 81 40 81 80 01 01 01 01 01 01
01 01 01 01 01 01 9a 29 a0 d0 51 84 22 30 50 98
36 00 98 ff 10 00 00 1c 00 00 00 fd 00 32 4c 18
53 0e 01 0a 20 20 20 20 20 20 00 00 00 fc 00 4c
41 31 39 30 35 0a 20 20 20 20 20 20 00 00 00 ff
00 43 4e 43 30 31 35 31 37 53 4d 0a 20 20 00 d3

----------------

Block 0, Base EDID:
  EDID Structure Version & Revision: 1.4
  Vendor & Product Identification:
    Manufacturer: HWP
    Model: 10310
    Made in: week 15 of 2010
  Basic Display Parameters & Features:
    Digital display
    Bits per primary color channel: 8
    DisplayPort interface
    Maximum image size: 41 cm x 26 cm
    Gamma: 2.20
    DPMS levels: Off
    Supported color formats: RGB 4:4:4
    Default (sRGB) color space is primary color space
    First detailed timing includes the native pixel format and preferred refresh rate
  Color Characteristics:
    Red  : 0.6406, 0.3349
    Green: 0.2978, 0.6083
    Blue : 0.1474, 0.0703
    White: 0.3134, 0.3291
  Established Timings I & II:
    IBM     :   720x400    70.081663 Hz   9:5     31.467 kHz     28.320000 MHz
    DMT 0x04:   640x480    59.940476 Hz   4:3     31.469 kHz     25.175000 MHz
    DMT 0x09:   800x600    60.316541 Hz   4:3     37.879 kHz     40.000000 MHz
    DMT 0x10:  1024x768    60.003840 Hz   4:3     48.363 kHz     65.000000 MHz
  Standard Timings:
    DMT 0x20:  1280x960    60.000000 Hz   4:3     60.000 kHz    108.000000 MHz
    DMT 0x23:  1280x1024   60.019740 Hz   5:4     63.981 kHz    108.000000 MHz
  Detailed Timing Descriptors:
    DTD 1:  1440x900    59.887445 Hz  16:10    55.935 kHz    106.500000 MHz (408 mm x 255 mm)
                 Hfront   80 Hsync 152 Hback  232 Hpol N
                 Vfront    3 Vsync   6 Vback   25 Vpol P
    Display Range Limits:
      Monitor ranges (Range Limits Only): 50-76 Hz V, 24-83 kHz H, max dotclock 140 MHz
    Display Product Name: 'LA1905'
    Display Product Serial Number: ...
Checksum: 0xd3

----------------

Failures:

Block 0, Base EDID:
  Basic Display Parameters & Features: sRGB is signaled, but the chromaticities do not match.
EDID:
  Extension Block 1 started with EDID header, ignoring Extension Blocks >= 1.

EDID conformity: FAIL
