edid-decode (hex):

00 ff ff ff ff ff ff 00 1a b3 fd 07 f1 a7 00 00
2f 15 01 04 a5 33 1d 78 3a fe 25 a8 53 37 ae 24
11 50 54 a5 4b 00 a9 40 b3 00 95 00 81 00 81 80
01 01 01 01 01 01 02 3a 80 18 71 38 2d 40 58 2c
96 00 fd 1e 11 00 00 18 00 00 00 fd 00 31 4c 0f
52 11 00 0a 20 20 20 20 20 20 00 00 00 fc 00 42
32 33 54 2d 36 20 4c 45 44 0a 20 20 00 00 00 ff
00 59 56 34 45 30 34 32 39 39 33 0a 20 20 01 e4

02 03 18 74 4b 90 9f 85 94 04 13 03 12 01 02 11
23 09 07 07 83 01 00 00 02 3a 80 d0 72 38 2d 40
10 2c 96 80 fd 1d 11 00 00 18 28 3c 80 a0 70 b0
23 40 30 20 36 00 fd 1e 11 00 00 1a 01 1d 00 bc
52 d0 1e 20 b8 28 55 40 fd 1e 11 00 00 1e 01 1d
00 72 51 d0 1e 20 6e 28 55 00 fd 1e 11 00 00 1e
8c 0a d0 90 20 40 31 20 0c 40 55 00 fd 1e 11 00
00 18 00 00 00 00 00 00 00 00 00 00 00 00 00 2a

00 ff ff ff ff ff ff 00 1a b3 fd 07 f1 a7 00 00
2f 15 01 04 a5 33 1d 78 3a fe 25 a8 53 37 ae 24
11 50 54 a5 4b 00 a9 40 b3 00 95 00 81 00 81 80
01 01 01 01 01 01 02 3a 80 18 71 38 2d 40 58 2c
96 00 fd 1e 11 00 00 18 00 00 00 fd 00 31 4c 0f
52 11 00 0a 20 20 20 20 20 20 00 00 00 fc 00 42
32 33 54 2d 36 20 4c 45 44 0a 20 20 00 00 00 ff
00 59 56 34 45 30 34 32 39 39 33 0a 20 20 01 e4

02 03 18 74 4b 90 9f 85 94 04 13 03 12 01 02 11
23 09 07 07 83 01 00 00 02 3a 80 d0 72 38 2d 40
10 2c 96 80 fd 1d 11 00 00 18 28 3c 80 a0 70 b0
23 40 30 20 36 00 fd 1e 11 00 00 1a 01 1d 00 bc
52 d0 1e 20 b8 28 55 40 fd 1e 11 00 00 1e 01 1d
00 72 51 d0 1e 20 6e 28 55 00 fd 1e 11 00 00 1e
8c 0a d0 90 20 40 31 20 0c 40 55 00 fd 1e 11 00
00 18 00 00 00 00 00 00 00 00 00 00 00 00 00 2a

----------------

Block 0, Base EDID:
  EDID Structure Version & Revision: 1.4
  Vendor & Product Identification:
    Manufacturer: FUS
    Model: 2045
    Serial Number: ...
    Made in: week 47 of 2011
  Basic Display Parameters & Features:
    Digital display
    Bits per primary color channel: 8
    DisplayPort interface
    Maximum image size: 51 cm x 29 cm
    Gamma: 2.20
    DPMS levels: Off
    Supported color formats: RGB 4:4:4, YCrCb 4:4:4, YCrCb 4:2:2
    First detailed timing includes the native pixel format and preferred refresh rate
  Color Characteristics:
    Red  : 0.6591, 0.3271
    Green: 0.2177, 0.6816
    Blue : 0.1406, 0.0683
    White: 0.3134, 0.3291
  Established Timings I & II:
    IBM     :   720x400    70.081663 Hz   9:5     31.467 kHz     28.320000 MHz
    DMT 0x04:   640x480    59.940476 Hz   4:3     31.469 kHz     25.175000 MHz
    DMT 0x06:   640x480    75.000000 Hz   4:3     37.500 kHz     31.500000 MHz
    DMT 0x09:   800x600    60.316541 Hz   4:3     37.879 kHz     40.000000 MHz
    DMT 0x0b:   800x600    75.000000 Hz   4:3     46.875 kHz     49.500000 MHz
    DMT 0x10:  1024x768    60.003840 Hz   4:3     48.363 kHz     65.000000 MHz
    DMT 0x12:  1024x768    75.028582 Hz   4:3     60.023 kHz     78.750000 MHz
    DMT 0x24:  1280x1024   75.024675 Hz   5:4     79.976 kHz    135.000000 MHz
  Standard Timings:
    DMT 0x33:  1600x1200   60.000000 Hz   4:3     75.000 kHz    162.000000 MHz
    DMT 0x3a:  1680x1050   59.954250 Hz  16:10    65.290 kHz    146.250000 MHz
    DMT 0x2f:  1440x900    59.887445 Hz  16:10    55.935 kHz    106.500000 MHz
    DMT 0x1c:  1280x800    59.810326 Hz  16:10    49.702 kHz     83.500000 MHz
    DMT 0x23:  1280x1024   60.019740 Hz   5:4     63.981 kHz    108.000000 MHz
  Detailed Timing Descriptors:
    DTD  1:  1920x1080   60.000000 Hz  16:9     67.500 kHz    148.500000 MHz (509 mm x 286 mm)
                  Hfront   88 Hsync  44 Hback  148 Hpol N
                  Vfront    9 Vsync   6 Vback   30 Vpol N
    Display Range Limits:
      Monitor ranges (GTF): 49-76 Hz V, 15-82 kHz H, max dotclock 170 MHz
    Display Product Name: 'B23T-6 LED'
    Display Product Serial Number: ...
  Extension blocks: 1
Checksum: 0xe4

----------------

Block 1, CTA-861 Extension Block:
  Revision: 3
  Basic audio support
  Supports YCbCr 4:4:4
  Supports YCbCr 4:2:2
  Native detailed modes: 4
  Video Data Block:
    VIC  16:  1920x1080   60.000000 Hz  16:9     67.500 kHz    148.500000 MHz (native)
    VIC  31:  1920x1080   50.000000 Hz  16:9     56.250 kHz    148.500000 MHz (native)
    VIC   5:  1920x1080i  60.000000 Hz  16:9     33.750 kHz     74.250000 MHz (native)
    VIC  20:  1920x1080i  50.000000 Hz  16:9     28.125 kHz     74.250000 MHz (native)
    VIC   4:  1280x720    60.000000 Hz  16:9     45.000 kHz     74.250000 MHz
    VIC  19:  1280x720    50.000000 Hz  16:9     37.500 kHz     74.250000 MHz
    VIC   3:   720x480    59.940060 Hz  16:9     31.469 kHz     27.000000 MHz
    VIC  18:   720x576    50.000000 Hz  16:9     31.250 kHz     27.000000 MHz
    VIC   1:   640x480    59.940476 Hz   4:3     31.469 kHz     25.175000 MHz
    VIC   2:   720x480    59.940060 Hz   4:3     31.469 kHz     27.000000 MHz
    VIC  17:   720x576    50.000000 Hz   4:3     31.250 kHz     27.000000 MHz
  Audio Data Block:
    Linear PCM:
      Max channels: 2
      Supported sample rates (kHz): 48 44.1 32
      Supported sample sizes (bits): 24 20 16
  Speaker Allocation Data Block:
    FL/FR - Front Left/Right
  Detailed Timing Descriptors:
    DTD  2:  1920x1080   50.000000 Hz  16:9     56.250 kHz    148.500000 MHz (509 mm x 285 mm)
                  Hfront  528 Hsync  44 Hback  148 Hpol N
                  Vfront    9 Vsync   6 Vback   30 Vpol N
    DTD  3:  1920x1200   59.950171 Hz  16:10    74.038 kHz    154.000000 MHz (509 mm x 286 mm)
                  Hfront   48 Hsync  32 Hback   80 Hpol P
                  Vfront    3 Vsync   6 Vback   26 Vpol N
    DTD  4:  1280x720    50.000000 Hz  16:9     37.500 kHz     74.250000 MHz (509 mm x 286 mm)
                  Hfront  440 Hsync  40 Hback  220 Hpol P
                  Vfront    5 Vsync   5 Vback   20 Vpol P
    DTD  5:  1280x720    60.000000 Hz  16:9     45.000 kHz     74.250000 MHz (509 mm x 286 mm)
                  Hfront  110 Hsync  40 Hback  220 Hpol P
                  Vfront    5 Vsync   5 Vback   20 Vpol P
    DTD  6:   720x576    50.000000 Hz   5:4     31.250 kHz     27.000000 MHz (509 mm x 286 mm)
                  Hfront   12 Hsync  64 Hback   68 Hpol N
                  Vfront    5 Vsync   5 Vback   39 Vpol N
Checksum: 0x2a  Unused space in Extension Block: 13 bytes

----------------

Block 2, Unknown EDID Extension Block 0x00:
  00 ff ff ff ff ff ff 00 1a b3 fd 07 f1 a7 00 00 '................'
  2f 15 01 04 a5 33 1d 78 3a fe 25 a8 53 37 ae 24 '/....3.x:.%.S7.$'
  11 50 54 a5 4b 00 a9 40 b3 00 95 00 81 00 81 80 '.PT.K..@........'
  01 01 01 01 01 01 02 3a 80 18 71 38 2d 40 58 2c '.......:..q8-@X,'
  96 00 fd 1e 11 00 00 18 00 00 00 fd 00 31 4c 0f '.............1L.'
  52 11 00 0a 20 20 20 20 20 20 00 00 00 fc 00 42 'R...      .....B'
  32 33 54 2d 36 20 4c 45 44 0a 20 20 00 00 00 ff '23T-6 LED.  ....'
  00 59 56 34 45 30 34 32 39 39 33 0a 20 20 01 e4 '.YV4E042993.  ..'
Checksum: 0xe4

----------------

Block 3, CTA-861 Extension Block:
  Revision: 3
  Basic audio support
  Supports YCbCr 4:4:4
  Supports YCbCr 4:2:2
  Native detailed modes: 4
  Video Data Block:
    VIC  16:  1920x1080   60.000000 Hz  16:9     67.500 kHz    148.500000 MHz (native)
    VIC  31:  1920x1080   50.000000 Hz  16:9     56.250 kHz    148.500000 MHz (native)
    VIC   5:  1920x1080i  60.000000 Hz  16:9     33.750 kHz     74.250000 MHz (native)
    VIC  20:  1920x1080i  50.000000 Hz  16:9     28.125 kHz     74.250000 MHz (native)
    VIC   4:  1280x720    60.000000 Hz  16:9     45.000 kHz     74.250000 MHz
    VIC  19:  1280x720    50.000000 Hz  16:9     37.500 kHz     74.250000 MHz
    VIC   3:   720x480    59.940060 Hz  16:9     31.469 kHz     27.000000 MHz
    VIC  18:   720x576    50.000000 Hz  16:9     31.250 kHz     27.000000 MHz
    VIC   1:   640x480    59.940476 Hz   4:3     31.469 kHz     25.175000 MHz
    VIC   2:   720x480    59.940060 Hz   4:3     31.469 kHz     27.000000 MHz
    VIC  17:   720x576    50.000000 Hz   4:3     31.250 kHz     27.000000 MHz
  Audio Data Block:
    Linear PCM:
      Max channels: 2
      Supported sample rates (kHz): 48 44.1 32
      Supported sample sizes (bits): 24 20 16
  Speaker Allocation Data Block:
    FL/FR - Front Left/Right
  Detailed Timing Descriptors:
    DTD  7:  1920x1080   50.000000 Hz  16:9     56.250 kHz    148.500000 MHz (509 mm x 285 mm)
                  Hfront  528 Hsync  44 Hback  148 Hpol N
                  Vfront    9 Vsync   6 Vback   30 Vpol N
    DTD  8:  1920x1200   59.950171 Hz  16:10    74.038 kHz    154.000000 MHz (509 mm x 286 mm)
                  Hfront   48 Hsync  32 Hback   80 Hpol P
                  Vfront    3 Vsync   6 Vback   26 Vpol N
    DTD  9:  1280x720    50.000000 Hz  16:9     37.500 kHz     74.250000 MHz (509 mm x 286 mm)
                  Hfront  440 Hsync  40 Hback  220 Hpol P
                  Vfront    5 Vsync   5 Vback   20 Vpol P
    DTD 10:  1280x720    60.000000 Hz  16:9     45.000 kHz     74.250000 MHz (509 mm x 286 mm)
                  Hfront  110 Hsync  40 Hback  220 Hpol P
                  Vfront    5 Vsync   5 Vback   20 Vpol P
    DTD 11:   720x576    50.000000 Hz   5:4     31.250 kHz     27.000000 MHz (509 mm x 286 mm)
                  Hfront   12 Hsync  64 Hback   68 Hpol N
                  Vfront    5 Vsync   5 Vback   39 Vpol N
Checksum: 0x2a  Unused space in Extension Block: 13 bytes

----------------

Warnings:

Block 0, Base EDID:
  Detailed Timing Descriptor #1: DTD is similar but not identical to VIC 16.
  Display Range Limits: GTF support is deprecated in EDID 1.4.
Block 1, CTA-861 Extension Block:
  IT Video Formats are overscanned by default, but normally this should be underscanned.
  Video Data Block: VIC 16 and the first DTD are not identical. Is this intended?
  Detailed Timing Descriptor #2: DTD is similar but not identical to VIC 31.
  Detailed Timing Descriptor #3: Image size is 509x286 mm, but based on the picture AR it should be 509x318 mm.
  Detailed Timing Descriptor #6: Image size is 509x286 mm, but based on the picture AR it should be 509x407 mm.
  Display Product Serial Number is set, so the Serial Number in the Base EDID should be 0.
  Add a Colorimetry Data Block with the sRGB colorimetry bit set to avoid interop issues.
Block 3, CTA-861 Extension Block:
  IT Video Formats are overscanned by default, but normally this should be underscanned.
  Detailed Timing Descriptor #7: DTD is similar but not identical to VIC 31.
  Detailed Timing Descriptor #8: Image size is 509x286 mm, but based on the picture AR it should be 509x318 mm.
  Detailed Timing Descriptor #11: Image size is 509x286 mm, but based on the picture AR it should be 509x407 mm.
EDID:
  CTA-861: Multiple native interlaced timings are defined.

Failures:

Block 0, Base EDID:
  Display Range Limits: GTF is supported, but the display does not support continuous frequencies.
Block 1, CTA-861 Extension Block:
  Missing VCDB, needed for Set Selectable RGB Quantization to avoid interop issues.
Block 2, Base EDID:
  Unknown Extension Block.
Block 3, CTA-861 Extension Block:
  Video Data Block: Duplicate VIC 16.
  Video Data Block: Duplicate VIC 31.
  Video Data Block: Duplicate VIC 5.
  Video Data Block: Duplicate VIC 20.
  Video Data Block: Duplicate VIC 4.
  Video Data Block: Duplicate VIC 19.
  Video Data Block: Duplicate VIC 3.
  Video Data Block: Duplicate VIC 18.
  Video Data Block: Duplicate VIC 1.
  Video Data Block: Duplicate VIC 2.
  Video Data Block: Duplicate VIC 17.
  Speaker Allocation Data Block: Only one instance of this Data Block is allowed.
EDID:
  Base EDID: EDID specified 1 extension block(s), but found 3 extension block(s).
  CTA-861: Native progressive timings are a mix of several resolutions.

EDID conformity: FAIL
