edid-decode (hex):

00 ff ff ff ff ff ff 00 30 ae 97 8a 00 00 00 00
00 1e 01 04 a5 22 16 78 03 05 d4 a5 54 4b 99 22
10 50 56 00 00 00 01 01 01 01 01 01 01 01 01 01
01 01 01 01 01 01 ef 68 00 a0 a0 40 2e 60 30 20
36 00 58 d7 10 00 00 18 00 00 00 fd 00 28 3c 63
63 1b 01 0a 20 20 20 20 20 20 00 00 00 fe 00 43
53 4f 54 20 54 33 0a 20 20 20 20 20 00 00 00 fe
00 4d 4e 47 30 30 37 44 41 31 2d 34 0a 20 00 5f

00 ff ff ff ff ff ff 00 30 ae 97 8a 00 00 00 00
00 1e 01 04 a5 22 16 78 03 05 d4 a5 54 4b 99 22
10 50 56 00 00 00 01 01 01 01 01 01 01 01 01 01
01 01 01 01 01 01 ef 68 00 a0 a0 40 2e 60 30 20
36 00 58 d7 10 00 00 18 00 00 00 fd 00 28 3c 63
63 1b 01 0a 20 20 20 20 20 20 00 00 00 fe 00 43
53 4f 54 20 54 33 0a 20 20 20 20 20 00 00 00 fe
00 4d 4e 47 30 30 37 44 41 31 2d 34 0a 20 00 5f

----------------

Block 0, Base EDID:
  EDID Structure Version & Revision: 1.4
  Vendor & Product Identification:
    Manufacturer: LEN
    Model: 35479
    Made in: 2020
  Basic Display Parameters & Features:
    Digital display
    Bits per primary color channel: 8
    DisplayPort interface
    Maximum image size: 34 cm x 22 cm
    Gamma: 2.20
    Supported color formats: RGB 4:4:4
    First detailed timing includes the native pixel format and preferred refresh rate
    Display supports continuous frequencies
  Color Characteristics:
    Red  : 0.6445, 0.3281
    Green: 0.2939, 0.5986
    Blue : 0.1357, 0.0634
    White: 0.3134, 0.3359
  Established Timings I & II: none
  Standard Timings: none
  Detailed Timing Descriptors:
    DTD 1:  2560x1600   60.000625 Hz  16:10    98.761 kHz    268.630000 MHz (344 mm x 215 mm)
                 Hfront   48 Hsync  32 Hback   80 Hpol N
                 Vfront    3 Vsync   6 Vback   37 Vpol N
    Display Range Limits:
      Monitor ranges (Range Limits Only): 40-60 Hz V, 99-99 kHz H, max dotclock 270 MHz
    Alphanumeric Data String: 'CSOT T3'
    Alphanumeric Data String: 'MNG007DA1-4'
Checksum: 0x5f

----------------

Warnings:

Block 0, Base EDID:
  Missing Display Product Name.

Failures:

EDID:
  Extension Block 1 started with EDID header, ignoring Extension Blocks >= 1.

EDID conformity: FAIL
