edid-decode (hex):

00 ff ff ff ff ff ff 00 15 c3 95 23 01 01 01 01
18 18 01 03 68 33 1d 78 ea 01 f5 a2 57 52 9f 27
0a 50 54 21 08 00 81 80 81 40 b3 00 81 c0 01 01
01 01 01 01 01 01 02 3a 80 18 71 38 2d 40 58 2c
45 00 fe 1f 11 00 00 1e 00 00 00 ff 00 35 35 37
35 31 30 36 34 0a 20 20 20 20 00 00 00 fd 00 37
3d 1f 44 0f 00 0a 20 20 20 20 20 20 00 00 00 fc
00 45 56 32 33 31 36 57 0a 20 20 20 20 20 00 4e

00 ff ff ff ff ff ff 00 15 c3 95 23 01 01 01 01
18 18 01 03 68 33 1d 78 ea 01 f5 a2 57 52 9f 27
0a 50 54 21 08 00 81 80 81 40 b3 00 81 c0 01 01
01 01 01 01 01 01 02 3a 80 18 71 38 2d 40 58 2c
45 00 fe 1f 11 00 00 1e 00 00 00 ff 00 35 35 37
35 31 30 36 34 0a 20 20 20 20 00 00 00 fd 00 37
3d 1f 44 0f 00 0a 20 20 20 20 20 20 00 00 00 fc
00 45 56 32 33 31 36 57 0a 20 20 20 20 20 00 4e

----------------

Block 0, Base EDID:
  EDID Structure Version & Revision: 1.3
  Vendor & Product Identification:
    Manufacturer: ENC
    Model: 9109
    Serial Number: ...
    Made in: week 24 of 2014
  Basic Display Parameters & Features:
    Analog display
    Signal Level Standard: 0.700 : 0.000 : 0.700 V p-p
    Blank level equals black level
    Sync: Separate
    Maximum image size: 51 cm x 29 cm
    Gamma: 2.20
    DPMS levels: Standby Suspend Off
    RGB color display
    First detailed timing is the preferred timing
  Color Characteristics:
    Red  : 0.6328, 0.3398
    Green: 0.3203, 0.6220
    Blue : 0.1552, 0.0419
    White: 0.3134, 0.3291
  Established Timings I & II:
    DMT 0x04:   640x480    59.940476 Hz   4:3     31.469 kHz     25.175000 MHz
    DMT 0x09:   800x600    60.316541 Hz   4:3     37.879 kHz     40.000000 MHz
    DMT 0x10:  1024x768    60.003840 Hz   4:3     48.363 kHz     65.000000 MHz
  Standard Timings:
    DMT 0x23:  1280x1024   60.019740 Hz   5:4     63.981 kHz    108.000000 MHz
    DMT 0x20:  1280x960    60.000000 Hz   4:3     60.000 kHz    108.000000 MHz
    DMT 0x3a:  1680x1050   59.954250 Hz  16:10    65.290 kHz    146.250000 MHz
    DMT 0x55:  1280x720    60.000000 Hz  16:9     45.000 kHz     74.250000 MHz
  Detailed Timing Descriptors:
    DTD 1:  1920x1080   60.000000 Hz  16:9     67.500 kHz    148.500000 MHz (510 mm x 287 mm)
                 Hfront   88 Hsync  44 Hback  148 Hpol P
                 Vfront    4 Vsync   5 Vback   36 Vpol P
    Display Product Serial Number: ...
    Display Range Limits:
      Monitor ranges (GTF): 55-61 Hz V, 31-68 kHz H, max dotclock 150 MHz
    Display Product Name: 'EV2316W'
Checksum: 0x4e

----------------

Warnings:

Block 0, Base EDID:
  Vendor & Product Identification: The serial number is one of the known dummy values, it should probably be set to 0.

Failures:

EDID:
  Extension Block 1 started with EDID header, ignoring Extension Blocks >= 1.

EDID conformity: FAIL
