edid-decode (hex):

00 ff ff ff ff ff ff 00 30 e4 4c 03 00 00 00 00
00 16 01 04 90 1d 10 78 02 03 65 95 58 57 8e 28
1e 50 54 00 00 00 01 01 01 01 01 01 01 01 01 01
01 01 01 01 01 01 1c 1b 56 71 50 00 0e 30 28 22
53 00 25 a5 10 00 00 1a 1c 1b 56 98 51 00 d2 30
28 22 53 00 25 a5 10 00 00 1a 00 00 00 fe 00 4e
50 46 4e 36 80 31 33 33 57 48 32 0a 00 00 00 00
00 00 41 21 94 00 10 00 00 01 01 0a 20 20 00 4d

----------------

Block 0, Base EDID:
  EDID Structure Version & Revision: 1.4
  Vendor & Product Identification:
    Manufacturer: LGD
    Model: 844
    Made in: 2012
  Basic Display Parameters & Features:
    Digital display
    Bits per primary color channel: 6
    Digital interface is not defined
    Maximum image size: 29 cm x 16 cm
    Gamma: 2.20
    Supported color formats: RGB 4:4:4
    First detailed timing includes the native pixel format and preferred refresh rate
  Color Characteristics:
    Red  : 0.5820, 0.3437
    Green: 0.3398, 0.5576
    Blue : 0.1572, 0.1191
    White: 0.3134, 0.3291
  Established Timings I & II: none
  Standard Timings: none
  Detailed Timing Descriptors:
    DTD 1:  1366x768    60.004600 Hz 683:384   46.924 kHz     69.400000 MHz (293 mm x 165 mm)
                 Hfront   40 Hsync  34 Hback   39 Hpol P
                 Vfront    5 Vsync   3 Vback    6 Vpol N
    DTD 2:  1366x768    40.000646 Hz 683:384   39.121 kHz     69.400000 MHz (293 mm x 165 mm)
                 Hfront   40 Hsync  34 Hback  334 Hpol P
                 Vfront    5 Vsync   3 Vback  202 Vpol N
    Alphanumeric Data String: 'NPFN6.133WH2'
    Manufacturer-Specified Display Descriptor (0x00): 00 00 00 00 41 21 94 00 10 00 00 01 01 0a 20 20 '....A!........  '
Checksum: 0x4d

----------------

Warnings:

Block 0, Base EDID:
  Alphanumeric Data String: Non-ASCII character 0x80 at position 5, can cause problems.
  Missing Display Product Name.

EDID conformity: PASS
