edid-decode (hex):

00 ff ff ff ff ff ff 00 24 4d 16 25 01 01 01 01
34 0d 01 03 8e 24 1d 78 ea 09 20 a2 57 4b 97 24
18 50 54 a5 6a 80 01 01 01 01 01 01 81 80 01 01
01 01 01 01 01 01 30 2a 00 98 51 00 2a 40 30 70
13 00 67 1f 11 00 00 1e 00 00 00 fc 00 49 42 4d
20 54 38 36 30 0a 00 00 00 00 00 00 00 fe 00 39
34 39 34 0a 00 00 00 00 00 00 00 00 00 00 00 ff
00 36 36 2d 59 34 36 32 34 0a 20 20 20 20 00 2c

00 ff ff ff ff ff ff 00 24 4d 16 25 01 01 01 01
34 0d 01 03 8e 24 1d 78 ea 09 20 a2 57 4b 97 24
18 50 54 a5 6a 80 01 01 01 01 01 01 81 80 01 01
01 01 01 01 01 01 30 2a 00 98 51 00 2a 40 30 70
13 00 67 1f 11 00 00 1e 00 00 00 fc 00 49 42 4d
20 54 38 36 30 0a 00 00 00 00 00 00 00 fe 00 39
34 39 34 0a 00 00 00 00 00 00 00 00 00 00 00 ff
00 36 36 2d 59 34 36 32 34 0a 20 20 20 20 00 2c

----------------

Block 0, Base EDID:
  EDID Structure Version & Revision: 1.3
  Vendor & Product Identification:
    Manufacturer: IBM
    Model: 9494
    Serial Number: ...
    Made in: week 52 of 2003
  Basic Display Parameters & Features:
    Digital display
    Maximum image size: 36 cm x 29 cm
    Gamma: 2.20
    DPMS levels: Standby Suspend Off
    RGB color display
    First detailed timing is the preferred timing
  Color Characteristics:
    Red  : 0.6328, 0.3398
    Green: 0.2949, 0.5908
    Blue : 0.1406, 0.0957
    White: 0.3125, 0.3281
  Established Timings I & II:
    IBM     :   720x400    70.081663 Hz   9:5     31.467 kHz     28.320000 MHz
    DMT 0x04:   640x480    59.940476 Hz   4:3     31.469 kHz     25.175000 MHz
    DMT 0x06:   640x480    75.000000 Hz   4:3     37.500 kHz     31.500000 MHz
    DMT 0x09:   800x600    60.316541 Hz   4:3     37.879 kHz     40.000000 MHz
    DMT 0x0b:   800x600    75.000000 Hz   4:3     46.875 kHz     49.500000 MHz
    Apple   :   832x624    74.551266 Hz   4:3     49.726 kHz     57.284000 MHz
    DMT 0x10:  1024x768    60.003840 Hz   4:3     48.363 kHz     65.000000 MHz
    DMT 0x12:  1024x768    75.028582 Hz   4:3     60.023 kHz     78.750000 MHz
    Apple   :  1152x870    75.061550 Hz 192:145   68.681 kHz    100.000000 MHz
  Standard Timings:
    DMT 0x23:  1280x1024   60.019740 Hz   5:4     63.981 kHz    108.000000 MHz
  Detailed Timing Descriptors:
    DTD 1:  1280x1024   60.019740 Hz   5:4     63.981 kHz    108.000000 MHz (359 mm x 287 mm)
                 Hfront   48 Hsync 112 Hback  248 Hpol P
                 Vfront    1 Vsync   3 Vback   38 Vpol P
    Display Product Name: 'IBM T860'
    Alphanumeric Data String: '9494'
    Display Product Serial Number: ...
Checksum: 0x2c

----------------

Warnings:

Block 0, Base EDID:
  Vendor & Product Identification: The serial number is one of the known dummy values, it should probably be set to 0.

Failures:

Block 0, Base EDID:
  Basic Display Parameters & Features: Digital Video Interface Standard set to reserved value 0x0e.
  Display Product Name: Non-space after newline.
  Alphanumeric Data String: Non-space after newline.
  Missing Display Range Limits Descriptor.
EDID:
  Extension Block 1 started with EDID header, ignoring Extension Blocks >= 1.

EDID conformity: FAIL
