edid-decode (hex):

00 ff ff ff ff ff ff 00 53 04 00 00 45 54 00 00
00 3a 01 03 80 00 00 78 2e 60 81 a6 56 4a 9c 25
12 50 54 a5 6b 80 71 40 81 c0 81 40 81 80 d1 c0
95 cf 01 01 01 01 68 29 a0 d0 51 84 22 30 50 98
36 00 98 ff 10 00 00 1a 6b 35 a0 f0 51 84 2a 30
60 98 36 00 00 00 00 00 00 1a 00 00 00 fd 00 32
4c 18 53 11 00 0a 20 20 20 20 20 20 00 00 00 fc
00 45 58 50 4f 53 45 2d 31 39 0a 20 20 20 01 96

02 03 22 f2 4a 9f 90 14 13 12 1e 01 04 05 03 23
09 07 07 83 01 00 00 67 03 0c 00 10 00 00 1e e2
00 4f 8c 0a d0 8a 20 e0 2d 10 10 3e 96 00 58 c2
10 00 00 18 01 1d 80 18 71 1c 16 20 58 2c 25 00
58 c2 10 00 00 9e 02 3a 80 18 71 38 2d 40 58 2c
45 00 58 c2 10 00 00 1e 01 1d 80 d0 72 1c 16 20
10 2c 25 80 58 c2 10 00 00 9e 02 3a 80 d0 72 38
2d 40 10 2c 45 80 58 c2 10 00 00 1e 00 00 00 78

00 ff ff ff ff ff ff 00 53 04 00 00 45 54 00 00
00 3a 01 03 80 00 00 78 2e 60 81 a6 56 4a 9c 25
12 50 54 a5 6b 80 71 40 81 c0 81 40 81 80 d1 c0
95 cf 01 01 01 01 68 29 a0 d0 51 84 22 30 50 98
36 00 98 ff 10 00 00 1a 6b 35 a0 f0 51 84 2a 30
60 98 36 00 00 00 00 00 00 1a 00 00 00 fd 00 32
4c 18 53 11 00 0a 20 20 20 20 20 20 00 00 00 fc
00 45 58 50 4f 53 45 2d 31 39 0a 20 20 20 01 96

02 03 22 f2 4a 9f 90 14 13 12 1e 01 04 05 03 23
09 07 07 83 01 00 00 67 03 0c 00 10 00 00 1e e2
00 4f 8c 0a d0 8a 20 e0 2d 10 10 3e 96 00 58 c2
10 00 00 18 01 1d 80 18 71 1c 16 20 58 2c 25 00
58 c2 10 00 00 9e 02 3a 80 18 71 38 2d 40 58 2c
45 00 58 c2 10 00 00 1e 01 1d 80 d0 72 1c 16 20
10 2c 25 80 58 c2 10 00 00 9e 02 3a 80 d0 72 38
2d 40 10 2c 45 80 58 c2 10 00 00 1e 00 00 00 78

----------------

Block 0, Base EDID:
  EDID Structure Version & Revision: 1.3
  Vendor & Product Identification:
    Manufacturer: TXD
    Model: 0
    Serial Number: ...
    Made in: 2048
  Basic Display Parameters & Features:
    Digital display
    Image size is variable
    Gamma: 2.20
    DPMS levels: Off
    RGB color display
    Default (sRGB) color space is primary color space
    First detailed timing is the preferred timing
  Color Characteristics:
    Red  : 0.6494, 0.3378
    Green: 0.2890, 0.6093
    Blue : 0.1464, 0.0703
    White: 0.3125, 0.3291
  Established Timings I & II:
    IBM     :   720x400    70.081663 Hz   9:5     31.467 kHz     28.320000 MHz
    DMT 0x04:   640x480    59.940476 Hz   4:3     31.469 kHz     25.175000 MHz
    DMT 0x06:   640x480    75.000000 Hz   4:3     37.500 kHz     31.500000 MHz
    DMT 0x09:   800x600    60.316541 Hz   4:3     37.879 kHz     40.000000 MHz
    DMT 0x0b:   800x600    75.000000 Hz   4:3     46.875 kHz     49.500000 MHz
    Apple   :   832x624    74.551266 Hz   4:3     49.726 kHz     57.284000 MHz
    DMT 0x10:  1024x768    60.003840 Hz   4:3     48.363 kHz     65.000000 MHz
    DMT 0x12:  1024x768    75.028582 Hz   4:3     60.023 kHz     78.750000 MHz
    DMT 0x24:  1280x1024   75.024675 Hz   5:4     79.976 kHz    135.000000 MHz
    Apple   :  1152x870    75.061550 Hz 192:145   68.681 kHz    100.000000 MHz
  Standard Timings:
    GTF     :  1152x864    60.000000 Hz   4:3     53.700 kHz     81.624000 MHz
    DMT 0x55:  1280x720    60.000000 Hz  16:9     45.000 kHz     74.250000 MHz
    DMT 0x20:  1280x960    60.000000 Hz   4:3     60.000 kHz    108.000000 MHz
    DMT 0x23:  1280x1024   60.019740 Hz   5:4     63.981 kHz    108.000000 MHz
    DMT 0x52:  1920x1080   60.000000 Hz  16:9     67.500 kHz    148.500000 MHz
    GTF     :  1440x810    75.000000 Hz  16:9     63.450 kHz    121.824000 MHz
  Detailed Timing Descriptors:
    DTD 1:  1440x900    59.606284 Hz  16:10    55.672 kHz    106.000000 MHz (408 mm x 255 mm)
                 Hfront   80 Hsync 152 Hback  232 Hpol P
                 Vfront    3 Vsync   6 Vback   25 Vpol N
    DTD 2:  1440x900    74.984427 Hz  16:10    70.635 kHz    136.750000 MHz
                 Hfront   96 Hsync 152 Hback  248 Hpol P
                 Vfront    3 Vsync   6 Vback   33 Vpol N
    Display Range Limits:
      Monitor ranges (GTF): 50-76 Hz V, 24-83 kHz H, max dotclock 170 MHz
    Display Product Name: 'EXPOSE-19'
  Extension blocks: 1
Checksum: 0x96

----------------

Block 1, CTA-861 Extension Block:
  Revision: 3
  Underscans IT Video Formats by default
  Basic audio support
  Supports YCbCr 4:4:4
  Supports YCbCr 4:2:2
  Native DTDs: 2
  Video Data Block:
    VIC  31:  1920x1080   50.000000 Hz  16:9     56.250 kHz    148.500000 MHz (native)
    VIC  16:  1920x1080   60.000000 Hz  16:9     67.500 kHz    148.500000 MHz (native)
    VIC  20:  1920x1080i  50.000000 Hz  16:9     28.125 kHz     74.250000 MHz
    VIC  19:  1280x720    50.000000 Hz  16:9     37.500 kHz     74.250000 MHz
    VIC  18:   720x576    50.000000 Hz  16:9     31.250 kHz     27.000000 MHz
    VIC  30:  1440x576    50.000000 Hz  16:9     31.250 kHz     54.000000 MHz
    VIC   1:   640x480    59.940476 Hz   4:3     31.469 kHz     25.175000 MHz
    VIC   4:  1280x720    60.000000 Hz  16:9     45.000 kHz     74.250000 MHz
    VIC   5:  1920x1080i  60.000000 Hz  16:9     33.750 kHz     74.250000 MHz
    VIC   3:   720x480    59.940060 Hz  16:9     31.469 kHz     27.000000 MHz
  Audio Data Block:
    Linear PCM:
      Max channels: 2
      Supported sample rates (kHz): 48 44.1 32
      Supported sample sizes (bits): 24 20 16
  Speaker Allocation Data Block:
    FL/FR - Front Left/Right
  Vendor-Specific Data Block (HDMI), OUI 00-0C-03:
    Source physical address: 1.0.0.0
    Maximum TMDS clock: 150 MHz
  Video Capability Data Block:
    YCbCr quantization: No Data
    RGB quantization: Selectable (via AVI Q)
    PT scan behavior: No Data
    IT scan behavior: Supports both over- and underscan
    CE scan behavior: Supports both over- and underscan
  Detailed Timing Descriptors:
    DTD 3:   720x480    59.940060 Hz   3:2     31.469 kHz     27.000000 MHz (344 mm x 194 mm)
                 Hfront   16 Hsync  62 Hback   60 Hpol N
                 Vfront    9 Vsync   6 Vback   30 Vpol N
    DTD 4:  1920x1080i  60.000000 Hz  16:9     33.750 kHz     74.250000 MHz (344 mm x 194 mm)
                 Hfront   88 Hsync  44 Hback  148 Hpol P
                 Vfront    2 Vsync   5 Vback   15 Vpol P Vfront +0.5 Odd Field
                 Vfront    2 Vsync   5 Vback   15 Vpol P Vback  +0.5 Even Field
    DTD 5:  1920x1080   60.000000 Hz  16:9     67.500 kHz    148.500000 MHz (344 mm x 194 mm)
                 Hfront   88 Hsync  44 Hback  148 Hpol P
                 Vfront    4 Vsync   5 Vback   36 Vpol P
    DTD 6:  1920x1080i  50.000000 Hz  16:9     28.125 kHz     74.250000 MHz (344 mm x 194 mm)
                 Hfront  528 Hsync  44 Hback  148 Hpol P
                 Vfront    2 Vsync   5 Vback   15 Vpol P Vfront +0.5 Odd Field
                 Vfront    2 Vsync   5 Vback   15 Vpol P Vback  +0.5 Even Field
    DTD 7:  1920x1080   50.000000 Hz  16:9     56.250 kHz    148.500000 MHz (344 mm x 194 mm)
                 Hfront  528 Hsync  44 Hback  148 Hpol P
                 Vfront    4 Vsync   5 Vback   36 Vpol P
Checksum: 0x78  Unused space in Extension Block: 3 bytes

----------------

Warnings:

Block 0, Base EDID:
  Vendor & Product Identification: The serial number is one of the known dummy values, it should probably be set to 0.
  Detailed Timing Descriptor #2: DTD is similar but not identical to DMT 0x30.
Block 1, CTA-861 Extension Block:
  Video Data Block: VIC 31 and the first DTD are not identical. Is this intended?
  Video Capability Data Block: Set Selectable YCbCr Quantization to avoid interop issues.
  Detailed Timing Descriptor #3: Image size is 344x194 mm, but based on the picture AR it should be 291x194 mm.

Failures:

Block 0, Base EDID:
  Vendor & Product Identification: The year is more than one year in the future.
  Basic Display Parameters & Features: sRGB is signaled, but the chromaticities do not match.
EDID:
  Extension Block 2 started with EDID header, ignoring Extension Blocks >= 2.
  Base EDID: The DTD max image size is 408x255mm, but the display size is not specified anywhere.
  CTA-861: Native progressive timings are a mix of several resolutions.

EDID conformity: FAIL
