edid-decode (hex):

00 ff ff ff ff ff ff 00 53 04 00 00 45 54 00 00
00 3a 01 03 80 00 00 78 2e 60 81 a6 56 4a 9c 25
12 50 54 a5 60 00 01 01 01 01 01 01 01 01 01 01
01 01 01 01 01 01 24 13 00 20 41 58 18 20 28 68
3a 00 99 e6 10 00 00 1a 00 00 00 ff 00 30 30 30
30 30 30 30 30 53 4c 30 0a 20 00 00 00 fd 00 32
4c 18 53 0f 00 0a 20 20 20 20 20 20 00 00 00 fc
00 44 69 73 70 6c 61 79 0a 20 20 20 20 20 01 b0

02 03 1d f1 4a 90 04 03 02 1f 13 12 11 05 14 23
09 7f 07 83 01 00 00 65 03 0c 00 10 00 02 3a 80
18 71 38 2d 40 58 2c 45 00 dd 0c 11 00 00 1e 01
1d 00 72 51 d0 1e 20 6e 28 55 00 dd 0c 11 00 00
1e 8c 0a d0 8a 20 e0 2d 10 10 3e 96 00 dd 0c 11
00 00 18 01 1d 80 18 71 1c 16 20 58 2c 25 00 dd
0c 11 00 00 9e 00 00 00 00 00 00 00 00 00 00 00
00 00 00 00 00 00 00 00 00 00 00 00 00 00 00 48

00 ff ff ff ff ff ff 00 53 04 00 00 45 54 00 00
00 3a 01 03 80 00 00 78 2e 60 81 a6 56 4a 9c 25
12 50 54 a5 60 00 01 01 01 01 01 01 01 01 01 01
01 01 01 01 01 01 24 13 00 20 41 58 18 20 28 68
3a 00 99 e6 10 00 00 1a 00 00 00 ff 00 30 30 30
30 30 30 30 30 53 4c 30 0a 20 00 00 00 fd 00 32
4c 18 53 0f 00 0a 20 20 20 20 20 20 00 00 00 fc
00 44 69 73 70 6c 61 79 0a 20 20 20 20 20 01 b0

02 03 1d f1 4a 90 04 03 02 1f 13 12 11 05 14 23
09 7f 07 83 01 00 00 65 03 0c 00 10 00 02 3a 80
18 71 38 2d 40 58 2c 45 00 dd 0c 11 00 00 1e 01
1d 00 72 51 d0 1e 20 6e 28 55 00 dd 0c 11 00 00
1e 8c 0a d0 8a 20 e0 2d 10 10 3e 96 00 dd 0c 11
00 00 18 01 1d 80 18 71 1c 16 20 58 2c 25 00 dd
0c 11 00 00 9e 00 00 00 00 00 00 00 00 00 00 00
00 00 00 00 00 00 00 00 00 00 00 00 00 00 00 48

----------------

Block 0, Base EDID:
  EDID Structure Version & Revision: 1.3
  Vendor & Product Identification:
    Manufacturer: TXD
    Model: 0
    Serial Number: ...
    Made in: 2048
  Basic Display Parameters & Features:
    Digital display
    Image size is variable
    Gamma: 2.20
    DPMS levels: Off
    RGB color display
    Default (sRGB) color space is primary color space
    First detailed timing is the preferred timing
  Color Characteristics:
    Red  : 0.6494, 0.3378
    Green: 0.2890, 0.6093
    Blue : 0.1464, 0.0703
    White: 0.3125, 0.3291
  Established Timings I & II:
    IBM     :   720x400    70.081663 Hz   9:5     31.467 kHz     28.320000 MHz
    DMT 0x04:   640x480    59.940476 Hz   4:3     31.469 kHz     25.175000 MHz
    DMT 0x06:   640x480    75.000000 Hz   4:3     37.500 kHz     31.500000 MHz
    DMT 0x09:   800x600    60.316541 Hz   4:3     37.879 kHz     40.000000 MHz
    DMT 0x0b:   800x600    75.000000 Hz   4:3     46.875 kHz     49.500000 MHz
    Apple   :   832x624    74.551266 Hz   4:3     49.726 kHz     57.284000 MHz
  Standard Timings: none
  Detailed Timing Descriptors:
    DTD 1:  1024x600    59.851861 Hz 128:75    37.348 kHz     49.000000 MHz (409 mm x 230 mm)
                 Hfront   40 Hsync 104 Hback  144 Hpol P
                 Vfront    3 Vsync  10 Vback   11 Vpol N
    Display Product Serial Number: ...
    Display Range Limits:
      Monitor ranges (GTF): 50-76 Hz V, 24-83 kHz H, max dotclock 150 MHz
    Display Product Name: 'Display'
  Extension blocks: 1
Checksum: 0xb0

----------------

Block 1, CTA-861 Extension Block:
  Revision: 3
  Underscans IT Video Formats by default
  Basic audio support
  Supports YCbCr 4:4:4
  Supports YCbCr 4:2:2
  Native DTDs: 1
  Video Data Block:
    VIC  16:  1920x1080   60.000000 Hz  16:9     67.500 kHz    148.500000 MHz (native)
    VIC   4:  1280x720    60.000000 Hz  16:9     45.000 kHz     74.250000 MHz
    VIC   3:   720x480    59.940060 Hz  16:9     31.469 kHz     27.000000 MHz
    VIC   2:   720x480    59.940060 Hz   4:3     31.469 kHz     27.000000 MHz
    VIC  31:  1920x1080   50.000000 Hz  16:9     56.250 kHz    148.500000 MHz
    VIC  19:  1280x720    50.000000 Hz  16:9     37.500 kHz     74.250000 MHz
    VIC  18:   720x576    50.000000 Hz  16:9     31.250 kHz     27.000000 MHz
    VIC  17:   720x576    50.000000 Hz   4:3     31.250 kHz     27.000000 MHz
    VIC   5:  1920x1080i  60.000000 Hz  16:9     33.750 kHz     74.250000 MHz
    VIC  20:  1920x1080i  50.000000 Hz  16:9     28.125 kHz     74.250000 MHz
  Audio Data Block:
    Linear PCM:
      Max channels: 2
      Supported sample rates (kHz): 192 176.4 96 88.2 48 44.1 32
      Supported sample sizes (bits): 24 20 16
  Speaker Allocation Data Block:
    FL/FR - Front Left/Right
  Vendor-Specific Data Block (HDMI), OUI 00-0C-03:
    Source physical address: 1.0.0.0
  Detailed Timing Descriptors:
    DTD 2:  1920x1080   60.000000 Hz  16:9     67.500 kHz    148.500000 MHz (477 mm x 268 mm)
                 Hfront   88 Hsync  44 Hback  148 Hpol P
                 Vfront    4 Vsync   5 Vback   36 Vpol P
    DTD 3:  1280x720    60.000000 Hz  16:9     45.000 kHz     74.250000 MHz (477 mm x 268 mm)
                 Hfront  110 Hsync  40 Hback  220 Hpol P
                 Vfront    5 Vsync   5 Vback   20 Vpol P
    DTD 4:   720x480    59.940060 Hz   3:2     31.469 kHz     27.000000 MHz (477 mm x 268 mm)
                 Hfront   16 Hsync  62 Hback   60 Hpol N
                 Vfront    9 Vsync   6 Vback   30 Vpol N
    DTD 5:  1920x1080i  60.000000 Hz  16:9     33.750 kHz     74.250000 MHz (477 mm x 268 mm)
                 Hfront   88 Hsync  44 Hback  148 Hpol P
                 Vfront    2 Vsync   5 Vback   15 Vpol P Vfront +0.5 Odd Field
                 Vfront    2 Vsync   5 Vback   15 Vpol P Vback  +0.5 Even Field
Checksum: 0x48  Unused space in Extension Block: 26 bytes

----------------

Warnings:

Block 0, Base EDID:
  Vendor & Product Identification: The serial number is one of the known dummy values, it should probably be set to 0.
Block 1, CTA-861 Extension Block:
  Video Data Block: VIC 16 and the first DTD are not identical. Is this intended?
  Detailed Timing Descriptor #4: Image size is 477x268 mm, but based on the picture AR it should be 402x268 mm.
  Display Product Serial Number is set, so the Serial Number in the Base EDID should be 0.

Failures:

Block 0, Base EDID:
  Vendor & Product Identification: The year is more than one year in the future.
  Basic Display Parameters & Features: sRGB is signaled, but the chromaticities do not match.
Block 1, CTA-861 Extension Block:
  Missing VCDB, needed for Set Selectable RGB Quantization to avoid interop issues.
EDID:
  Extension Block 2 started with EDID header, ignoring Extension Blocks >= 2.
  Base EDID: The DTD max image size is 477x268mm, but the display size is not specified anywhere.
  CTA-861: Native progressive timings are a mix of several resolutions.

EDID conformity: FAIL
