edid-decode (hex):

00 ff ff ff ff ff ff 00 53 04 00 00 01 00 00 00
00 3a 01 03 80 00 00 78 2e b1 a5 a1 58 4f 95 26
16 50 54 af c6 00 81 c0 81 00 01 01 01 01 01 01
01 01 01 01 01 01 66 21 56 aa 51 00 1b 30 40 8f
33 00 99 e6 10 00 00 1a 00 00 00 ff 00 30 30 30
30 30 30 30 31 30 30 30 30 0a 00 00 00 fd 00 38
4b 1e 3e 08 00 0a 20 20 20 20 20 20 00 00 00 fc
00 44 69 73 70 6c 61 79 0a 20 20 20 20 20 00 b2

00 ff ff ff ff ff ff 00 53 04 00 00 01 00 00 00
00 3a 01 03 80 00 00 78 2e b1 a5 a1 58 4f 95 26
16 50 54 af c6 00 81 c0 81 00 01 01 01 01 01 01
01 01 01 01 01 01 66 21 56 aa 51 00 1b 30 40 8f
33 00 99 e6 10 00 00 1a 00 00 00 ff 00 30 30 30
30 30 30 30 31 30 30 30 30 0a 00 00 00 fd 00 38
4b 1e 3e 08 00 0a 20 20 20 20 20 20 00 00 00 fc
00 44 69 73 70 6c 61 79 0a 20 20 20 20 20 00 b2

----------------

Block 0, Base EDID:
  EDID Structure Version & Revision: 1.3
  Vendor & Product Identification:
    Manufacturer: TXD
    Model: 0
    Serial Number: ...
    Made in: 2048
  Basic Display Parameters & Features:
    Digital display
    Image size is variable
    Gamma: 2.20
    DPMS levels: Off
    RGB color display
    Default (sRGB) color space is primary color space
    First detailed timing is the preferred timing
  Color Characteristics:
    Red  : 0.6308, 0.3466
    Green: 0.3085, 0.5830
    Blue : 0.1503, 0.0878
    White: 0.3134, 0.3291
  Established Timings I & II:
    IBM     :   720x400    70.081663 Hz   9:5     31.467 kHz     28.320000 MHz
    DMT 0x04:   640x480    59.940476 Hz   4:3     31.469 kHz     25.175000 MHz
    DMT 0x05:   640x480    72.808802 Hz   4:3     37.861 kHz     31.500000 MHz
    DMT 0x06:   640x480    75.000000 Hz   4:3     37.500 kHz     31.500000 MHz
    DMT 0x08:   800x600    56.250000 Hz   4:3     35.156 kHz     36.000000 MHz
    DMT 0x09:   800x600    60.316541 Hz   4:3     37.879 kHz     40.000000 MHz
    DMT 0x0a:   800x600    72.187572 Hz   4:3     48.077 kHz     50.000000 MHz
    DMT 0x0b:   800x600    75.000000 Hz   4:3     46.875 kHz     49.500000 MHz
    DMT 0x11:  1024x768    70.069359 Hz   4:3     56.476 kHz     75.000000 MHz
    DMT 0x12:  1024x768    75.028582 Hz   4:3     60.023 kHz     78.750000 MHz
  Standard Timings:
    DMT 0x55:  1280x720    60.000000 Hz  16:9     45.000 kHz     74.250000 MHz
    DMT 0x1c:  1280x800    59.810326 Hz  16:10    49.702 kHz     83.500000 MHz
  Detailed Timing Descriptors:
    DTD 1:  1366x768    60.015162 Hz 683:384   47.712 kHz     85.500000 MHz (409 mm x 230 mm)
                 Hfront   64 Hsync 143 Hback  219 Hpol P
                 Vfront    3 Vsync   3 Vback   21 Vpol N
    Display Product Serial Number: ...
    Display Range Limits:
      Monitor ranges (GTF): 56-75 Hz V, 30-62 kHz H, max dotclock 80 MHz
    Display Product Name: 'Display'
Checksum: 0xb2

----------------

Block 1, Unknown EDID Extension Block 0x00:
  00 ff ff ff ff ff ff 00 53 04 00 00 01 00 00 00 '........S.......'
  00 3a 01 03 80 00 00 78 2e b1 a5 a1 58 4f 95 26 '.:.....x....XO.&'
  16 50 54 af c6 00 81 c0 81 00 01 01 01 01 01 01 '.PT.............'
  01 01 01 01 01 01 66 21 56 aa 51 00 1b 30 40 8f '......f!V.Q..0@.'
  33 00 99 e6 10 00 00 1a 00 00 00 ff 00 30 30 30 '3............000'
  30 30 30 30 31 30 30 30 30 0a 00 00 00 fd 00 38 '000010000......8'
  4b 1e 3e 08 00 0a 20 20 20 20 20 20 00 00 00 fc 'K.>...      ....'
  00 44 69 73 70 6c 61 79 0a 20 20 20 20 20 00 b2 '.Display.     ..'
Checksum: 0xb2

----------------

Warnings:

Block 0, Base EDID:
  Vendor & Product Identification: The serial number is one of the known dummy values, it should probably be set to 0.
  Display Product Serial Number: ...
EDID:
  Base EDID: Some timings are out of range of the Monitor Ranges:
    Maximum Clock: 85.500 MHz (Monitor: 80.000 MHz)
    Could be due to a Monitor Range off-by-one rounding issue

Failures:

Block 0, Base EDID:
  Vendor & Product Identification: The year is more than one year in the future.
  Basic Display Parameters & Features: sRGB is signaled, but the chromaticities do not match.
Block 1, Base EDID:
  Unknown Extension Block.
EDID:
  Base EDID: The DTD max image size is 409x230mm, but the display size is not specified anywhere.
  Base EDID: EDID specified 0 extension block(s), but found 1 extension block(s).

EDID conformity: FAIL
