edid-decode (hex):

00 ff ff ff ff ff ff 00 53 04 00 00 01 00 00 00
00 3a 01 03 88 00 00 00 8e 00 00 00 00 00 00 00
00 00 00 a1 09 00 81 40 95 40 81 c0 00 00 00 00
00 00 00 00 00 00 9a 29 a0 d0 51 84 22 30 50 98
36 00 20 56 00 00 00 1c 00 00 00 fc 00 48 44 4d
49 0a 20 20 20 20 20 20 20 20 00 00 00 10 00 00
00 00 00 00 00 00 00 00 00 00 00 00 00 00 00 10
00 00 00 00 00 00 00 00 00 00 00 00 00 00 00 87

00 ff ff ff ff ff ff 00 53 04 00 00 01 00 00 00
00 3a 01 03 88 00 00 00 8e 00 00 00 00 00 00 00
00 00 00 a1 09 00 81 40 95 40 81 c0 00 00 00 00
00 00 00 00 00 00 9a 29 a0 d0 51 84 22 30 50 98
36 00 20 56 00 00 00 1c 00 00 00 fc 00 48 44 4d
49 0a 20 20 20 20 20 20 20 20 00 00 00 10 00 00
00 00 00 00 00 00 00 00 00 00 00 00 00 00 00 10
00 00 00 00 00 00 00 00 00 00 00 00 00 00 00 87

----------------

Block 0, Base EDID:
  EDID Structure Version & Revision: 1.3
  Vendor & Product Identification:
    Manufacturer: TXD
    Model: 0
    Serial Number: ...
    Made in: 2048
  Basic Display Parameters & Features:
    Digital display
    Image size is variable
    Gamma: 1.00
    DPMS levels: Standby
    RGB color display
    Default (sRGB) color space is primary color space
    First detailed timing is the preferred timing
  Color Characteristics:
    Red  : 0.0000, 0.0000
    Green: 0.0000, 0.0000
    Blue : 0.0000, 0.0000
    White: 0.0000, 0.0000
  Established Timings I & II:
    IBM     :   720x400    70.081663 Hz   9:5     31.467 kHz     28.320000 MHz
    DMT 0x04:   640x480    59.940476 Hz   4:3     31.469 kHz     25.175000 MHz
    DMT 0x09:   800x600    60.316541 Hz   4:3     37.879 kHz     40.000000 MHz
    DMT 0x10:  1024x768    60.003840 Hz   4:3     48.363 kHz     65.000000 MHz
    DMT 0x24:  1280x1024   75.024675 Hz   5:4     79.976 kHz    135.000000 MHz
  Standard Timings:
    DMT 0x20:  1280x960    60.000000 Hz   4:3     60.000 kHz    108.000000 MHz
    GTF     :  1440x1080   60.000055 Hz   4:3     67.080 kHz    129.867000 MHz
    DMT 0x55:  1280x720    60.000000 Hz  16:9     45.000 kHz     74.250000 MHz
  Detailed Timing Descriptors:
    DTD 1:  1440x900    59.887445 Hz  16:10    55.935 kHz    106.500000 MHz (32 mm x 86 mm)
                 Hfront   80 Hsync 152 Hback  232 Hpol N
                 Vfront    3 Vsync   6 Vback   25 Vpol P
    Display Product Name: 'HDMI'
    Dummy Descriptor:
    Dummy Descriptor:
Checksum: 0x87

----------------

Warnings:

Block 0, Base EDID:
  Vendor & Product Identification: The serial number is one of the known dummy values, it should probably be set to 0.
  Basic Display Parameters & Features: sRGB is signaled, but the gamma != 2.2.
  Detailed Timing Descriptor #1: Dubious image size (32x86 mm is smaller than 100x100 mm).

Failures:

Block 0, Base EDID:
  Vendor & Product Identification: The year is more than one year in the future.
  Basic Display Parameters & Features: Digital Video Interface Standard set to reserved value 0x08.
  Basic Display Parameters & Features: sRGB is signaled, but the chromaticities do not match.
  Standard Timings: Use 0x0101 as the invalid Standard Timings code, not 0x0000.
  Standard Timings: Use 0x0101 as the invalid Standard Timings code, not 0x0000.
  Standard Timings: Use 0x0101 as the invalid Standard Timings code, not 0x0000.
  Standard Timings: Use 0x0101 as the invalid Standard Timings code, not 0x0000.
  Standard Timings: Use 0x0101 as the invalid Standard Timings code, not 0x0000.
  Missing Display Range Limits Descriptor.
EDID:
  Extension Block 1 started with EDID header, ignoring Extension Blocks >= 1.
  Base EDID: The DTD max image size is 32x86mm, but the display size is not specified anywhere.

EDID conformity: FAIL
