edid-decode (hex):

00 ff ff ff ff ff ff 00 1d ac 00 14 00 00 00 00
01 15 01 04 a5 00 00 78 22 b3 25 ac 51 30 b4 26
10 50 54 a5 4b 00 81 80 a9 40 71 4f 01 01 01 01
01 01 01 01 d1 00 8c 73 00 a0 f0 b0 23 40 30 20
36 00 ff ff 00 00 00 1e 01 4a 00 98 a1 00 2a 40
30 70 13 00 ff ff 00 00 00 1e 00 00 00 fc 00 47
4d 2d 4d 41 54 52 49 58 2d 42 0a 00 ae 31 00 a0
50 a0 23 50 30 20 36 00 ff ff 00 00 00 1e 01 38

02 03 19 80 46 90 04 05 07 03 0e 23 00 00 00 83
00 00 00 65 03 0c 00 10 00 16 3c 80 a0 70 b0 23
40 30 20 36 00 ff ff 00 00 00 1e 16 2a 00 98 51
00 2a 40 30 70 13 00 ff ff 00 00 00 1e 83 0f 20
00 31 58 1c 20 28 80 14 00 ff ff 00 00 00 1e e4
39 80 18 71 38 2d 40 58 2c 45 00 ff ff 00 00 00
1e 0e 39 90 30 62 1a 27 40 68 b0 36 00 ff ff 00
00 00 1e 00 00 00 00 00 00 00 00 00 00 00 00 f5

----------------

Block 0, Base EDID:
  EDID Structure Version & Revision: 1.4
  Vendor & Product Identification:
    Manufacturer: GML
    Model: 5120
    Made in: week 1 of 2011
  Basic Display Parameters & Features:
    Digital display
    Bits per primary color channel: 8
    DisplayPort interface
    Image size is variable
    Gamma: 2.20
    DPMS levels: Off
    Supported color formats: RGB 4:4:4
    First detailed timing includes the native pixel format and preferred refresh rate
  Color Characteristics:
    Red  : 0.6738, 0.3193
    Green: 0.1875, 0.7060
    Blue : 0.1484, 0.0644
    White: 0.3134, 0.3291
  Established Timings I & II:
    IBM     :   720x400    70.081663 Hz   9:5     31.467 kHz     28.320000 MHz
    DMT 0x04:   640x480    59.940476 Hz   4:3     31.469 kHz     25.175000 MHz
    DMT 0x06:   640x480    75.000000 Hz   4:3     37.500 kHz     31.500000 MHz
    DMT 0x09:   800x600    60.316541 Hz   4:3     37.879 kHz     40.000000 MHz
    DMT 0x0b:   800x600    75.000000 Hz   4:3     46.875 kHz     49.500000 MHz
    DMT 0x10:  1024x768    60.003840 Hz   4:3     48.363 kHz     65.000000 MHz
    DMT 0x12:  1024x768    75.028582 Hz   4:3     60.023 kHz     78.750000 MHz
    DMT 0x24:  1280x1024   75.024675 Hz   5:4     79.976 kHz    135.000000 MHz
  Standard Timings:
    DMT 0x23:  1280x1024   60.019740 Hz   5:4     63.981 kHz    108.000000 MHz
    DMT 0x33:  1600x1200   60.000000 Hz   4:3     75.000 kHz    162.000000 MHz
    DMT 0x15:  1152x864    75.000000 Hz   4:3     67.500 kHz    108.000000 MHz
    DMT 0x45:  1920x1200   59.884600 Hz  16:10    74.556 kHz    193.250000 MHz
  Detailed Timing Descriptors:
    DTD 1:  3840x1200   59.878543 Hz  16:5     73.950 kHz    295.800000 MHz (255 mm x 255 mm)
                 Hfront   48 Hsync  32 Hback   80 Hpol P
                 Vfront    3 Vsync   6 Vback   26 Vpol P
    DTD 2:  2560x1024   59.878858 Hz   5:2     63.831 kHz    189.450000 MHz (255 mm x 255 mm)
                 Hfront   48 Hsync 112 Hback  248 Hpol P
                 Vfront    1 Vsync   3 Vback   38 Vpol P
    Display Product Name: 'GM-MATRIX-B'
    DTD 3:  1280x1440   59.877589 Hz   8:9     88.319 kHz    127.180000 MHz (255 mm x 255 mm)
                 Hfront   48 Hsync  32 Hback   80 Hpol P
                 Vfront    3 Vsync   6 Vback   26 Vpol P
  Extension blocks: 1
Checksum: 0x38

----------------

Block 1, CTA-861 Extension Block:
  Revision: 3
  Underscans IT Video Formats by default
  Native DTDs: 0
  Video Data Block:
    VIC  16:  1920x1080   60.000000 Hz  16:9     67.500 kHz    148.500000 MHz (native)
    VIC   4:  1280x720    60.000000 Hz  16:9     45.000 kHz     74.250000 MHz
    VIC   5:  1920x1080i  60.000000 Hz  16:9     33.750 kHz     74.250000 MHz
    VIC   7:  1440x480i   59.940060 Hz  16:9     15.734 kHz     27.000000 MHz
    VIC   3:   720x480    59.940060 Hz  16:9     31.469 kHz     27.000000 MHz
    VIC  14:  1440x480    59.940060 Hz   4:3     31.469 kHz     54.000000 MHz
  Audio Data Block:
    Reserved (0x00)
  Speaker Allocation Data Block:
  Vendor-Specific Data Block (HDMI), OUI 00-0C-03:
    Source physical address: 1.0.0.0
  Detailed Timing Descriptors:
    DTD 4:  1920x1200   59.880100 Hz  16:10    73.952 kHz    153.820000 MHz (255 mm x 255 mm)
                 Hfront   48 Hsync  32 Hback   80 Hpol P
                 Vfront    3 Vsync   6 Vback   26 Vpol P
    DTD 5:  1280x1024   59.875248 Hz   5:4     63.827 kHz    107.740000 MHz (255 mm x 255 mm)
                 Hfront   48 Hsync 112 Hback  248 Hpol P
                 Vfront    1 Vsync   3 Vback   38 Vpol P
    DTD 6:   800x600    59.879246 Hz   4:3     37.604 kHz     39.710000 MHz (255 mm x 255 mm)
                 Hfront   40 Hsync 128 Hback   88 Hpol P
                 Vfront    1 Vsync   4 Vback   23 Vpol P
    DTD 7:  1920x1080   59.878788 Hz  16:9     67.364 kHz    148.200000 MHz (255 mm x 255 mm)
                 Hfront   88 Hsync  44 Hback  148 Hpol P
                 Vfront    4 Vsync   5 Vback   36 Vpol P
    DTD 8:  1680x1050   59.876361 Hz  16:10    65.205 kHz    146.060000 MHz (255 mm x 255 mm)
                 Hfront  104 Hsync 176 Hback  280 Hpol P
                 Vfront    3 Vsync   6 Vback   30 Vpol P
Checksum: 0xf5  Unused space in Extension Block: 12 bytes

----------------

Warnings:

Block 0, Base EDID:
  Detailed Timing Descriptor #1: Image size is 255x255 mm, but based on the picture AR it should be 255x79 mm.
  Detailed Timing Descriptor #2: Image size is 255x255 mm, but based on the picture AR it should be 255x102 mm.
  Detailed Timing Descriptor #3: Image size is 255x255 mm, but based on the picture AR it should be 226x255 mm.
Block 1, CTA-861 Extension Block:
  Video Data Block: VIC 16 and the first DTD are not identical. Is this intended?
  Detailed Timing Descriptor #4: Image size is 255x255 mm, but based on the picture AR it should be 255x159 mm.
  Detailed Timing Descriptor #5: Image size is 255x255 mm, but based on the picture AR it should be 255x204 mm.
  Detailed Timing Descriptor #6: Image size is 255x255 mm, but based on the picture AR it should be 255x191 mm.
  Detailed Timing Descriptor #7: Image size is 255x255 mm, but based on the picture AR it should be 255x143 mm.
  Detailed Timing Descriptor #8: Image size is 255x255 mm, but based on the picture AR it should be 255x159 mm.
  Add a Colorimetry Data Block with the sRGB colorimetry bit set to avoid interop issues.
EDID:
  CTA-861: Native progressive resolution of 1920x1080 is smaller than the max preferred progressive resolution 3840x1200.

Failures:

Block 0, Base EDID:
  Display Product Name: Non-space after newline.
  Detailed Timing Descriptor #3: Invalid detailed timing descriptor ordering.
Block 1, CTA-861 Extension Block:
  Audio Data Block: Audio information is present, but bit 6 of Byte 3 of the CTA-861 Extension header indicates no Basic Audio support.
  Audio Data Block: Audio Format Code 0x00 is reserved.
  Speaker Allocation Data Block: Audio information is present, but bit 6 of Byte 3 of the CTA-861 Extension header indicates no Basic Audio support.
  Vendor-Specific Data Block (HDMI), OUI 00-0C-03: The HDMI Specification requires EDID 1.3 instead of 1.4.
  Missing VCDB, needed for Set Selectable RGB Quantization to avoid interop issues.
EDID:
  Base EDID: The DTD max image size is 255x255mm, but the display size is not specified anywhere.

EDID conformity: FAIL
