edid-decode (hex):

00 ff ff ff ff ff ff 00 41 0c 36 08 ae dc 05 00
17 10 01 03 1f 32 1f 78 ea cf b5 a3 55 49 99 25
10 50 54 bf ef 80 81 40 81 80 a9 40 a9 4f 61 59
81 99 d1 c0 01 01 74 4b 80 a0 72 b0 2d 40 80 d0
13 00 ef 36 11 00 00 1c 00 00 00 fd 00 38 55 1e
62 15 00 0a 20 20 20 20 20 20 00 00 00 fc 00 50
68 69 6c 69 70 73 20 32 33 30 57 0a 00 00 00 ff
00 20 42 5a 20 20 33 38 34 31 37 34 0a 20 00 29

00 ff ff ff ff ff ff 00 41 0c 36 08 ae dc 05 00
17 10 01 03 1f 32 1f 78 ea cf b5 a3 55 49 99 25
10 50 54 bf ef 80 81 40 81 80 a9 40 a9 4f 61 59
81 99 d1 c0 01 01 74 4b 80 a0 72 b0 2d 40 80 d0
13 00 ef 36 11 00 00 1c 00 00 00 fd 00 38 55 1e
62 15 00 0a 20 20 20 20 20 20 00 00 00 fc 00 50
68 69 6c 69 70 73 20 32 33 30 57 0a 00 00 00 ff
00 20 42 5a 20 20 33 38 34 31 37 34 0a 20 00 29

----------------

Block 0, Base EDID:
  EDID Structure Version & Revision: 1.3
  Vendor & Product Identification:
    Manufacturer: PHL
    Model: 2102
    Serial Number: ...
    Made in: week 23 of 2006
  Basic Display Parameters & Features:
    Analog display
    Signal Level Standard: 0.700 : 0.300 : 1.000 V p-p
    Blank-to-black setup/pedestal
    Sync: Separate Composite SyncOnGreen Serration
    Maximum image size: 50 cm x 31 cm
    Gamma: 2.20
    DPMS levels: Standby Suspend Off
    RGB color display
    First detailed timing is the preferred timing
  Color Characteristics:
    Red  : 0.6396, 0.3320
    Green: 0.2880, 0.6005
    Blue : 0.1464, 0.0654
    White: 0.3134, 0.3291
  Established Timings I & II:
    IBM     :   720x400    70.081663 Hz   9:5     31.467 kHz     28.320000 MHz
    DMT 0x04:   640x480    59.940476 Hz   4:3     31.469 kHz     25.175000 MHz
    Apple   :   640x480    66.666667 Hz   4:3     35.000 kHz     30.240000 MHz
    DMT 0x05:   640x480    72.808802 Hz   4:3     37.861 kHz     31.500000 MHz
    DMT 0x06:   640x480    75.000000 Hz   4:3     37.500 kHz     31.500000 MHz
    DMT 0x08:   800x600    56.250000 Hz   4:3     35.156 kHz     36.000000 MHz
    DMT 0x09:   800x600    60.316541 Hz   4:3     37.879 kHz     40.000000 MHz
    DMT 0x0a:   800x600    72.187572 Hz   4:3     48.077 kHz     50.000000 MHz
    DMT 0x0b:   800x600    75.000000 Hz   4:3     46.875 kHz     49.500000 MHz
    Apple   :   832x624    74.551266 Hz   4:3     49.726 kHz     57.284000 MHz
    DMT 0x10:  1024x768    60.003840 Hz   4:3     48.363 kHz     65.000000 MHz
    DMT 0x11:  1024x768    70.069359 Hz   4:3     56.476 kHz     75.000000 MHz
    DMT 0x12:  1024x768    75.028582 Hz   4:3     60.023 kHz     78.750000 MHz
    DMT 0x24:  1280x1024   75.024675 Hz   5:4     79.976 kHz    135.000000 MHz
    Apple   :  1152x870    75.061550 Hz 192:145   68.681 kHz    100.000000 MHz
  Standard Timings:
    DMT 0x20:  1280x960    60.000000 Hz   4:3     60.000 kHz    108.000000 MHz
    DMT 0x23:  1280x1024   60.019740 Hz   5:4     63.981 kHz    108.000000 MHz
    DMT 0x33:  1600x1200   60.000000 Hz   4:3     75.000 kHz    162.000000 MHz
    DMT 0x36:  1600x1200   75.000000 Hz   4:3     93.750 kHz    202.500000 MHz
    DMT 0x13:  1024x768    84.996690 Hz   4:3     68.677 kHz     94.500000 MHz
    DMT 0x25:  1280x1024   85.024098 Hz   5:4     91.146 kHz    157.500000 MHz
    DMT 0x52:  1920x1080   60.000000 Hz  16:9     67.500 kHz    148.500000 MHz
  Detailed Timing Descriptors:
    DTD 1:  1920x1200   59.856711 Hz  16:10    74.522 kHz    193.160000 MHz (495 mm x 310 mm)
                 Hfront  128 Hsync 208 Hback  336 Hpol N
                 Vfront    1 Vsync   3 Vback   41 Vpol P
    Display Range Limits:
      Monitor ranges (GTF): 56-85 Hz V, 30-98 kHz H, max dotclock 210 MHz
    Display Product Name: 'Philips 230W'
    Display Product Serial Number: ...
Checksum: 0x29

----------------

Failures:

EDID:
  Extension Block 1 started with EDID header, ignoring Extension Blocks >= 1.

EDID conformity: FAIL
