edid-decode (hex):

00 ff ff ff ff ff ff 00 22 03 20 00 a6 0b 00 00
05 11 01 01 00 46 27 00 0a 6e 87 a2 5a 4d 94 24
1a 51 56 bf ed 00 01 01 01 01 01 01 01 01 01 01
01 01 01 01 01 01 ea 24 00 60 41 00 28 30 30 60
13 00 e9 81 21 00 00 1e 00 00 00 fc 00 33 32 4c
48 30 31 0a 20 20 20 20 20 20 00 00 00 fd 00 37
78 1f 50 10 00 0a 20 20 20 20 20 20 00 00 00 ff
00 47 56 33 32 4d 41 32 53 41 37 30 31 32 00 87

----------------

Block 0, Base EDID:
  EDID Structure Version & Revision: 1.1
  Vendor & Product Identification:
    Manufacturer: HPC
    Model: 32
    Serial Number: ...
    Made in: week 5 of 2007
  Basic Display Parameters & Features:
    Analog display
    Signal Level Standard: 0.700 : 0.300 : 1.000 V p-p
    Blank level equals black level
    Maximum image size: 70 cm x 39 cm
    Gamma: 1.00
    RGB color display
    First detailed timing is the preferred timing
  Color Characteristics:
    Red  : 0.6337, 0.3535
    Green: 0.3037, 0.5800
    Blue : 0.1425, 0.1015
    White: 0.3173, 0.3388
  Established Timings I & II:
    IBM     :   720x400    70.081663 Hz   9:5     31.467 kHz     28.320000 MHz
    DMT 0x04:   640x480    59.940476 Hz   4:3     31.469 kHz     25.175000 MHz
    Apple   :   640x480    66.666667 Hz   4:3     35.000 kHz     30.240000 MHz
    DMT 0x05:   640x480    72.808802 Hz   4:3     37.861 kHz     31.500000 MHz
    DMT 0x06:   640x480    75.000000 Hz   4:3     37.500 kHz     31.500000 MHz
    DMT 0x08:   800x600    56.250000 Hz   4:3     35.156 kHz     36.000000 MHz
    DMT 0x09:   800x600    60.316541 Hz   4:3     37.879 kHz     40.000000 MHz
    DMT 0x0a:   800x600    72.187572 Hz   4:3     48.077 kHz     50.000000 MHz
    DMT 0x0b:   800x600    75.000000 Hz   4:3     46.875 kHz     49.500000 MHz
    Apple   :   832x624    74.551266 Hz   4:3     49.726 kHz     57.284000 MHz
    DMT 0x10:  1024x768    60.003840 Hz   4:3     48.363 kHz     65.000000 MHz
    DMT 0x11:  1024x768    70.069359 Hz   4:3     56.476 kHz     75.000000 MHz
    DMT 0x24:  1280x1024   75.024675 Hz   5:4     79.976 kHz    135.000000 MHz
  Standard Timings: none
  Detailed Timing Descriptors:
    DTD 1:  1024x768    84.996690 Hz   4:3     68.677 kHz     94.500000 MHz (745 mm x 385 mm)
                 Hfront   48 Hsync  96 Hback  208 Hpol P
                 Vfront    1 Vsync   3 Vback   36 Vpol P
    Display Product Name: '32LH01'
    Display Range Limits:
      Monitor ranges (GTF): 55-120 Hz V, 31-80 kHz H, max dotclock 160 MHz
    Display Product Serial Number: ...
Checksum: 0x87

----------------

Warnings:

Block 0, Base EDID:
  EDID Structure Version & Revision: EDID 1.1 is deprecated, do not use.
  Detailed Timing Descriptor #1: Image size is 745x385 mm, but based on the picture AR it should be 745x558 mm.

Failures:

Block 0, Base EDID:
  Detailed Timing Descriptor #1: Mismatch of image size 745x385 mm vs display size 700x390 mm.
EDID:
  Base EDID: The DTD max image size is 745x385mm, which is larger than the display size 700.0x390.0mm.

EDID conformity: FAIL
