edid-decode (hex):

00 ff ff ff ff ff ff 00 30 ae c3 61 00 00 00 00
20 1c 01 04 a5 31 1e 78 3a 3a 65 a7 55 52 9c 27
0f 50 54 31 0c 00 81 00 95 00 a9 4a b3 00 d1 c0
d1 00 81 80 a9 40 28 3c 80 a0 70 b0 23 40 30 20
36 00 06 44 21 00 00 1a 00 00 00 fc 00 54 32 33
64 2d 31 30 0a 20 20 20 20 20 00 00 00 fd 00 32
4b 1e 51 14 00 0a 20 20 20 20 20 20 00 00 00 ff
00 56 39 30 33 5a 56 47 45 0a ff ff ff ff 01 17

02 03 16 b1 4b 90 05 04 03 02 01 1f 12 13 14 11
65 03 0c 00 10 00 01 1d 80 18 71 1c 16 20 58 2c
25 00 c4 8e 21 00 00 9e 7c 2e 90 a0 60 1a 1e 40
30 20 36 00 dc 0b 11 00 00 1c ab 22 a0 a0 50 84
1a 30 30 20 36 00 dc 0b 11 00 00 1c 66 21 56 aa
51 00 1e 30 46 8f 33 00 dc 0b 11 00 00 1e 00 00
00 00 00 00 00 00 00 00 00 00 00 00 00 00 00 00
00 00 00 00 00 00 00 00 00 00 00 00 00 00 00 d5

00 ff ff ff ff ff ff 00 30 ae c3 61 00 00 00 00
20 1c 01 04 a5 31 1e 78 3a 3a 65 a7 55 52 9c 27
0f 50 54 31 0c 00 81 00 95 00 a9 4a b3 00 d1 c0
d1 00 81 80 a9 40 28 3c 80 a0 70 b0 23 40 30 20
36 00 06 44 21 00 00 1a 00 00 00 fc 00 54 32 33
64 2d 31 30 0a 20 20 20 20 20 00 00 00 fd 00 32
4b 1e 51 14 00 0a 20 20 20 20 20 20 00 00 00 ff
00 56 39 30 33 5a 56 47 45 0a ff ff ff ff 01 17

02 03 16 b1 4b 90 05 04 03 02 01 1f 12 13 14 11
65 03 0c 00 10 00 01 1d 80 18 71 1c 16 20 58 2c
25 00 c4 8e 21 00 00 9e 7c 2e 90 a0 60 1a 1e 40
30 20 36 00 dc 0b 11 00 00 1c ab 22 a0 a0 50 84
1a 30 30 20 36 00 dc 0b 11 00 00 1c 66 21 56 aa
51 00 1e 30 46 8f 33 00 dc 0b 11 00 00 1e 00 00
00 00 00 00 00 00 00 00 00 00 00 00 00 00 00 00
00 00 00 00 00 00 00 00 00 00 00 00 00 00 00 d5

----------------

Block 0, Base EDID:
  EDID Structure Version & Revision: 1.4
  Vendor & Product Identification:
    Manufacturer: LEN
    Model: 25027
    Made in: week 32 of 2018
  Basic Display Parameters & Features:
    Digital display
    Bits per primary color channel: 8
    DisplayPort interface
    Maximum image size: 49 cm x 30 cm
    Gamma: 2.20
    DPMS levels: Off
    Supported color formats: RGB 4:4:4, YCrCb 4:4:4, YCrCb 4:2:2
    First detailed timing includes the native pixel format and preferred refresh rate
  Color Characteristics:
    Red  : 0.6523, 0.3349
    Green: 0.3222, 0.6113
    Blue : 0.1533, 0.0605
    White: 0.3134, 0.3291
  Established Timings I & II:
    DMT 0x04:   640x480    59.940476 Hz   4:3     31.469 kHz     25.175000 MHz
    Apple   :   640x480    66.666667 Hz   4:3     35.000 kHz     30.240000 MHz
    DMT 0x09:   800x600    60.316541 Hz   4:3     37.879 kHz     40.000000 MHz
    DMT 0x10:  1024x768    60.003840 Hz   4:3     48.363 kHz     65.000000 MHz
    DMT 0x11:  1024x768    70.069359 Hz   4:3     56.476 kHz     75.000000 MHz
  Standard Timings:
    DMT 0x1c:  1280x800    59.810326 Hz  16:10    49.702 kHz     83.500000 MHz
    DMT 0x2f:  1440x900    59.887445 Hz  16:10    55.935 kHz    106.500000 MHz
    DMT 0x35:  1600x1200   70.000000 Hz   4:3     87.500 kHz    189.000000 MHz
    DMT 0x3a:  1680x1050   59.954250 Hz  16:10    65.290 kHz    146.250000 MHz
    DMT 0x52:  1920x1080   60.000000 Hz  16:9     67.500 kHz    148.500000 MHz
    DMT 0x45:  1920x1200   59.884600 Hz  16:10    74.556 kHz    193.250000 MHz
    DMT 0x23:  1280x1024   60.019740 Hz   5:4     63.981 kHz    108.000000 MHz
    DMT 0x33:  1600x1200   60.000000 Hz   4:3     75.000 kHz    162.000000 MHz
  Detailed Timing Descriptors:
    DTD 1:  1920x1200   59.950171 Hz  16:10    74.038 kHz    154.000000 MHz (518 mm x 324 mm)
                 Hfront   48 Hsync  32 Hback   80 Hpol P
                 Vfront    3 Vsync   6 Vback   26 Vpol N
    Display Product Name: 'T23d-10'
    Display Range Limits:
      Monitor ranges (GTF): 50-75 Hz V, 30-81 kHz H, max dotclock 200 MHz
    Display Product Serial Number: ...
  Extension blocks: 1
Checksum: 0x17

----------------

Block 1, CTA-861 Extension Block:
  Revision: 3
  Underscans IT Video Formats by default
  Supports YCbCr 4:4:4
  Supports YCbCr 4:2:2
  Native detailed modes: 1
  Video Data Block:
    VIC  16:  1920x1080   60.000000 Hz  16:9     67.500 kHz    148.500000 MHz (native)
    VIC   5:  1920x1080i  60.000000 Hz  16:9     33.750 kHz     74.250000 MHz
    VIC   4:  1280x720    60.000000 Hz  16:9     45.000 kHz     74.250000 MHz
    VIC   3:   720x480    59.940060 Hz  16:9     31.469 kHz     27.000000 MHz
    VIC   2:   720x480    59.940060 Hz   4:3     31.469 kHz     27.000000 MHz
    VIC   1:   640x480    59.940476 Hz   4:3     31.469 kHz     25.175000 MHz
    VIC  31:  1920x1080   50.000000 Hz  16:9     56.250 kHz    148.500000 MHz
    VIC  18:   720x576    50.000000 Hz  16:9     31.250 kHz     27.000000 MHz
    VIC  19:  1280x720    50.000000 Hz  16:9     37.500 kHz     74.250000 MHz
    VIC  20:  1920x1080i  50.000000 Hz  16:9     28.125 kHz     74.250000 MHz
    VIC  17:   720x576    50.000000 Hz   4:3     31.250 kHz     27.000000 MHz
  Vendor-Specific Data Block (HDMI), OUI 00-0C-03:
    Source physical address: 1.0.0.0
  Detailed Timing Descriptors:
    DTD 2:  1920x1080i  60.000000 Hz  16:9     33.750 kHz     74.250000 MHz (708 mm x 398 mm)
                 Hfront   88 Hsync  44 Hback  148 Hpol P
                 Vfront    2 Vsync   5 Vback   15 Vpol P Vfront +0.5 Odd Field
                 Vfront    2 Vsync   5 Vback   15 Vpol P Vback  +0.5 Even Field
    DTD 3:  1680x1050   59.883253 Hz  16:10    64.674 kHz    119.000000 MHz (476 mm x 267 mm)
                 Hfront   48 Hsync  32 Hback   80 Hpol N
                 Vfront    3 Vsync   6 Vback   21 Vpol P
    DTD 4:  1440x900    59.901458 Hz  16:10    55.469 kHz     88.750000 MHz (476 mm x 267 mm)
                 Hfront   48 Hsync  32 Hback   80 Hpol N
                 Vfront    3 Vsync   6 Vback   17 Vpol P
    DTD 5:  1366x768    59.789541 Hz 683:384   47.712 kHz     85.500000 MHz (476 mm x 267 mm)
                 Hfront   70 Hsync 143 Hback  213 Hpol P
                 Vfront    3 Vsync   3 Vback   24 Vpol P
Checksum: 0xd5  Unused space in Extension Block: 33 bytes

----------------

Block 2, Unknown EDID Extension Block 0x00:
  00 ff ff ff ff ff ff 00 30 ae c3 61 00 00 00 00 '........0..a....'
  20 1c 01 04 a5 31 1e 78 3a 3a 65 a7 55 52 9c 27 ' ....1.x::e.UR.''
  0f 50 54 31 0c 00 81 00 95 00 a9 4a b3 00 d1 c0 '.PT1.......J....'
  d1 00 81 80 a9 40 28 3c 80 a0 70 b0 23 40 30 20 '.....@(<..p.#@0 '
  36 00 06 44 21 00 00 1a 00 00 00 fc 00 54 32 33 '6..D!........T23'
  64 2d 31 30 0a 20 20 20 20 20 00 00 00 fd 00 32 'd-10.     .....2'
  4b 1e 51 14 00 0a 20 20 20 20 20 20 00 00 00 ff 'K.Q...      ....'
  00 56 39 30 33 5a 56 47 45 0a ff ff ff ff 01 17 '.V903ZVGE.......'
Checksum: 0x17

----------------

Block 3, CTA-861 Extension Block:
  Revision: 3
  Underscans IT Video Formats by default
  Supports YCbCr 4:4:4
  Supports YCbCr 4:2:2
  Native detailed modes: 1
  Video Data Block:
    VIC  16:  1920x1080   60.000000 Hz  16:9     67.500 kHz    148.500000 MHz (native)
    VIC   5:  1920x1080i  60.000000 Hz  16:9     33.750 kHz     74.250000 MHz
    VIC   4:  1280x720    60.000000 Hz  16:9     45.000 kHz     74.250000 MHz
    VIC   3:   720x480    59.940060 Hz  16:9     31.469 kHz     27.000000 MHz
    VIC   2:   720x480    59.940060 Hz   4:3     31.469 kHz     27.000000 MHz
    VIC   1:   640x480    59.940476 Hz   4:3     31.469 kHz     25.175000 MHz
    VIC  31:  1920x1080   50.000000 Hz  16:9     56.250 kHz    148.500000 MHz
    VIC  18:   720x576    50.000000 Hz  16:9     31.250 kHz     27.000000 MHz
    VIC  19:  1280x720    50.000000 Hz  16:9     37.500 kHz     74.250000 MHz
    VIC  20:  1920x1080i  50.000000 Hz  16:9     28.125 kHz     74.250000 MHz
    VIC  17:   720x576    50.000000 Hz   4:3     31.250 kHz     27.000000 MHz
  Vendor-Specific Data Block (HDMI), OUI 00-0C-03:
    Source physical address: 1.0.0.0
  Detailed Timing Descriptors:
    DTD 6:  1920x1080i  60.000000 Hz  16:9     33.750 kHz     74.250000 MHz (708 mm x 398 mm)
                 Hfront   88 Hsync  44 Hback  148 Hpol P
                 Vfront    2 Vsync   5 Vback   15 Vpol P Vfront +0.5 Odd Field
                 Vfront    2 Vsync   5 Vback   15 Vpol P Vback  +0.5 Even Field
    DTD 7:  1680x1050   59.883253 Hz  16:10    64.674 kHz    119.000000 MHz (476 mm x 267 mm)
                 Hfront   48 Hsync  32 Hback   80 Hpol N
                 Vfront    3 Vsync   6 Vback   21 Vpol P
    DTD 8:  1440x900    59.901458 Hz  16:10    55.469 kHz     88.750000 MHz (476 mm x 267 mm)
                 Hfront   48 Hsync  32 Hback   80 Hpol N
                 Vfront    3 Vsync   6 Vback   17 Vpol P
    DTD 9:  1366x768    59.789541 Hz 683:384   47.712 kHz     85.500000 MHz (476 mm x 267 mm)
                 Hfront   70 Hsync 143 Hback  213 Hpol P
                 Vfront    3 Vsync   3 Vback   24 Vpol P
Checksum: 0xd5  Unused space in Extension Block: 33 bytes

----------------

Warnings:

Block 0, Base EDID:
  Display Range Limits: GTF support is deprecated in EDID 1.4.
Block 1, CTA-861 Extension Block:
  Video Data Block: VIC 16 and the first DTD are not identical. Is this intended?
  Detailed Timing Descriptor #3: DTD is similar but not identical to DMT 0x39.
  Detailed Timing Descriptor #3: Image size is 476x267 mm, but based on the picture AR it should be 476x297 mm.
  Detailed Timing Descriptor #4: DTD is similar but not identical to DMT 0x2e.
  Detailed Timing Descriptor #4: Image size is 476x267 mm, but based on the picture AR it should be 476x297 mm.
  Add a Colorimetry Data Block with the sRGB colorimetry bit set to avoid interop issues.
Block 3, CTA-861 Extension Block:
  Detailed Timing Descriptor #7: DTD is similar but not identical to DMT 0x39.
  Detailed Timing Descriptor #7: Image size is 476x267 mm, but based on the picture AR it should be 476x297 mm.
  Detailed Timing Descriptor #8: DTD is similar but not identical to DMT 0x2e.
  Detailed Timing Descriptor #8: Image size is 476x267 mm, but based on the picture AR it should be 476x297 mm.
EDID:
  Base EDID: Some timings are out of range of the Monitor Ranges:
    Horizontal Freq: 28.125 - 87.500 kHz (Monitor: 30.000 - 81.000 kHz)

Failures:

Block 0, Base EDID:
  Display Product Serial Number: ...
  Detailed Timing Descriptor #1: Mismatch of image size 518x324 mm vs display size 490x300 mm.
  Display Range Limits: GTF is supported, but the display does not support continuous frequencies.
Block 1, CTA-861 Extension Block:
  Vendor-Specific Data Block (HDMI), OUI 00-0C-03: The HDMI Specification requires EDID 1.3 instead of 1.4.
  Detailed Timing Descriptor #2: Mismatch of image size 708x398 mm vs display size 490x300 mm.
  Detailed Timing Descriptor #3: Mismatch of image size 476x267 mm vs display size 490x300 mm.
  Detailed Timing Descriptor #4: Mismatch of image size 476x267 mm vs display size 490x300 mm.
  Detailed Timing Descriptor #5: Mismatch of image size 476x267 mm vs display size 490x300 mm.
  Missing VCDB, needed for Set Selectable RGB Quantization to avoid interop issues.
Block 2, Base EDID:
  Unknown Extension Block.
Block 3, CTA-861 Extension Block:
  Video Data Block: Duplicate VIC 16.
  Video Data Block: Duplicate VIC 5.
  Video Data Block: Duplicate VIC 4.
  Video Data Block: Duplicate VIC 3.
  Video Data Block: Duplicate VIC 2.
  Video Data Block: Duplicate VIC 1.
  Video Data Block: Duplicate VIC 31.
  Video Data Block: Duplicate VIC 18.
  Video Data Block: Duplicate VIC 19.
  Video Data Block: Duplicate VIC 20.
  Video Data Block: Duplicate VIC 17.
  Vendor-Specific Data Block (HDMI), OUI 00-0C-03: The HDMI Specification requires EDID 1.3 instead of 1.4.
  Detailed Timing Descriptor #6: Mismatch of image size 708x398 mm vs display size 490x300 mm.
  Detailed Timing Descriptor #7: Mismatch of image size 476x267 mm vs display size 490x300 mm.
  Detailed Timing Descriptor #8: Mismatch of image size 476x267 mm vs display size 490x300 mm.
  Detailed Timing Descriptor #9: Mismatch of image size 476x267 mm vs display size 490x300 mm.
EDID:
  Base EDID: The DTD max image size is 708x398mm, which is larger than the display size 490.0x300.0mm.
  Base EDID: EDID specified 1 extension block(s), but found 3 extension block(s).
  CTA-861: Native progressive timings are a mix of several resolutions.

EDID conformity: FAIL
