edid-decode (hex):

00 ff ff ff ff ff ff 00 4e 14 a8 0c 00 00 00 00
0f 21 01 04 b5 46 27 78 32 af f0 ab 50 53 a3 22
11 50 54 23 08 00 81 c0 81 00 81 40 81 80 95 00
b3 00 d1 c0 01 01 4d d0 00 a0 f0 70 3e 80 30 20
35 00 b9 88 21 00 00 1a 00 00 00 fd 00 28 3c 0f
cc 3c 00 0a 20 20 20 20 20 20 00 00 00 fc 00 53
63 65 70 74 72 65 20 5a 33 32 0a 20 04 74 00 30
f2 70 5a 80 b0 58 36 00 b9 88 21 00 00 00 01 80

02 03 1a 74 44 04 03 12 90 23 09 0f 07 83 01 00
00 68 1a 00 00 01 01 32 46 00 00 dc 00 a0 f0 70
28 80 30 20 35 00 b9 88 21 00 00 1a 56 5e 00 a0
a0 a0 29 50 30 20 35 00 b9 88 21 00 00 1e 2a 44
80 a0 70 38 27 40 30 20 35 00 b9 88 21 00 00 7f
04 76 00 a0 a0 a0 29 50 20 30 35 00 b9 88 21 00
00 7f 38 ee 00 78 f0 70 28 80 20 30 36 00 b9 88
21 00 00 7f 00 00 00 00 00 00 00 00 00 00 00 de

00 ff ff ff ff ff ff 00 4e 14 a8 0c 00 00 00 00
0f 21 01 04 b5 46 27 78 32 af f0 ab 50 53 a3 22
11 50 54 23 08 00 81 c0 81 00 81 40 81 80 95 00
b3 00 d1 c0 01 01 4d d0 00 a0 f0 70 3e 80 30 20
35 00 b9 88 21 00 00 1a 00 00 00 fd 00 28 3c 0f
cc 3c 00 0a 20 20 20 20 20 20 00 00 00 fc 00 53
63 65 70 74 72 65 20 5a 33 32 0a 20 04 74 00 30
f2 70 5a 80 b0 58 36 00 b9 88 21 00 00 00 01 80

02 03 1a 74 44 04 03 12 90 23 09 0f 07 83 01 00
00 68 1a 00 00 01 01 32 46 00 00 dc 00 a0 f0 70
28 80 30 20 35 00 b9 88 21 00 00 1a 56 5e 00 a0
a0 a0 29 50 30 20 35 00 b9 88 21 00 00 1e 2a 44
80 a0 70 38 27 40 30 20 35 00 b9 88 21 00 00 7f
04 76 00 a0 a0 a0 29 50 20 30 35 00 b9 88 21 00
00 7f 38 ee 00 78 f0 70 28 80 20 30 36 00 b9 88
21 00 00 7f 00 00 00 00 00 00 00 00 00 00 00 de

----------------

Block 0, Base EDID:
  EDID Structure Version & Revision: 1.4
  Vendor & Product Identification:
    Manufacturer: SPT
    Model: 3240
    Made in: week 15 of 2023
  Basic Display Parameters & Features:
    Digital display
    Bits per primary color channel: 10
    DisplayPort interface
    Maximum image size: 70 cm x 39 cm
    Gamma: 2.20
    DPMS levels: Off
    Supported color formats: RGB 4:4:4, YCrCb 4:2:2
    First detailed timing includes the native pixel format and preferred refresh rate
  Color Characteristics:
    Red  : 0.6699, 0.3144
    Green: 0.3271, 0.6396
    Blue : 0.1357, 0.0693
    White: 0.3125, 0.3281
  Established Timings I & II:
    DMT 0x04:   640x480    59.940476 Hz   4:3     31.469 kHz     25.175000 MHz
    DMT 0x08:   800x600    56.250000 Hz   4:3     35.156 kHz     36.000000 MHz
    DMT 0x09:   800x600    60.316541 Hz   4:3     37.879 kHz     40.000000 MHz
    DMT 0x10:  1024x768    60.003840 Hz   4:3     48.363 kHz     65.000000 MHz
  Standard Timings:
    DMT 0x55:  1280x720    60.000000 Hz  16:9     45.000 kHz     74.250000 MHz
    DMT 0x1c:  1280x800    59.810326 Hz  16:10    49.702 kHz     83.500000 MHz
    DMT 0x20:  1280x960    60.000000 Hz   4:3     60.000 kHz    108.000000 MHz
    DMT 0x23:  1280x1024   60.019740 Hz   5:4     63.981 kHz    108.000000 MHz
    DMT 0x2f:  1440x900    59.887445 Hz  16:10    55.935 kHz    106.500000 MHz
    DMT 0x3a:  1680x1050   59.954250 Hz  16:10    65.290 kHz    146.250000 MHz
    DMT 0x52:  1920x1080   60.000000 Hz  16:9     67.500 kHz    148.500000 MHz
  Detailed Timing Descriptors:
    DTD 1:  3840x2160   59.996625 Hz  16:9    133.312 kHz    533.250000 MHz (697 mm x 392 mm)
                 Hfront   48 Hsync  32 Hback   80 Hpol P
                 Vfront    3 Vsync   5 Vback   54 Vpol N
    Display Range Limits:
      Monitor ranges (GTF): 40-60 Hz V, 15-204 kHz H, max dotclock 600 MHz
    Display Product Name: 'Sceptre Z32'
    DTD 2:  3840x2160   30.000000 Hz  16:9     67.500 kHz    297.000000 MHz (analog composite, sync-on-green, 697 mm x 392 mm)
                 Hfront  176 Hsync  88 Hback  296 Hpol N
                 Vfront    3 Vsync   6 Vback   81 Vpol N
  Extension blocks: 1
Checksum: 0x80

----------------

Block 1, CTA-861 Extension Block:
  Revision: 3
  Basic audio support
  Supports YCbCr 4:4:4
  Supports YCbCr 4:2:2
  Native DTDs: 4
  Video Data Block:
    VIC   4:  1280x720    60.000000 Hz  16:9     45.000 kHz     74.250000 MHz
    VIC   3:   720x480    59.940060 Hz  16:9     31.469 kHz     27.000000 MHz
    VIC  18:   720x576    50.000000 Hz  16:9     31.250 kHz     27.000000 MHz
    VIC  16:  1920x1080   60.000000 Hz  16:9     67.500 kHz    148.500000 MHz (native)
  Audio Data Block:
    Linear PCM:
      Max channels: 2
      Supported sample rates (kHz): 88.2 48 44.1 32
      Supported sample sizes (bits): 24 20 16
  Speaker Allocation Data Block:
    FL/FR - Front Left/Right
  Vendor-Specific Data Block (AMD), OUI 00-00-1A:
    Version: 1
    Feature Caps: 0x01
    Minimum Refresh Rate: 50 Hz
    Maximum Refresh Rate: 70 Hz
    Flags 1.x: 0x00
  Detailed Timing Descriptors:
    DTD 3:  3840x2160   64.000000 Hz  16:9    140.800 kHz    563.200000 MHz (697 mm x 392 mm)
                 Hfront   48 Hsync  32 Hback   80 Hpol P
                 Vfront    3 Vsync   5 Vback   32 Vpol N
    DTD 4:  2560x1440   59.950550 Hz  16:9     88.787 kHz    241.500000 MHz (697 mm x 392 mm)
                 Hfront   48 Hsync  32 Hback   80 Hpol P
                 Vfront    3 Vsync   5 Vback   33 Vpol P
    DTD 5:  1920x1080   74.972503 Hz  16:9     83.894 kHz    174.500000 MHz (side by side interleaved, 697 mm x 392 mm)
                 Hfront   48 Hsync  32 Hback   80 Hpol P
                 Vfront    3 Vsync   5 Vback   31 Vpol P
    DTD 6:  2560x1440   74.999007 Hz  16:9    111.074 kHz    302.120000 MHz (side by side interleaved, 697 mm x 392 mm)
                 Hfront   32 Hsync  48 Hback   80 Hpol P
                 Vfront    3 Vsync   5 Vback   33 Vpol P
    DTD 7:  3840x2160   70.000000 Hz  16:9    154.000 kHz    609.840000 MHz (side by side interleaved, 697 mm x 392 mm)
                 Hfront   32 Hsync  48 Hback   40 Hpol P
                 Vfront    3 Vsync   6 Vback   31 Vpol P
Checksum: 0xde  Unused space in Extension Block: 11 bytes

----------------

Warnings:

Block 0, Base EDID:
  Display Range Limits: GTF support is deprecated in EDID 1.4.
  Detailed Timing Descriptor #2: DTD is similar but not identical to VIC 95.
Block 1, CTA-861 Extension Block:
  IT Video Formats are overscanned by default, but normally this should be underscanned.
  Video Data Block: VIC 4 and the first DTD are not identical. Is this intended?
  Add a Colorimetry Data Block with the sRGB colorimetry bit set to avoid interop issues.
EDID:
  Base EDID: Some timings are out of range of the Monitor Ranges:
    Vertical Freq: 30.000 - 74.999 Hz (Monitor: 40.000 - 60.000 Hz)
    Maximum Clock: 609.840 MHz (Monitor: 600.000 MHz)

Failures:

Block 0, Base EDID:
  Display Range Limits: GTF is supported, but the display does not support continuous frequencies.
  Detailed Timing Descriptor #2: Invalid detailed timing descriptor ordering.
Block 1, CTA-861 Extension Block:
  Missing VCDB, needed for Set Selectable RGB Quantization to avoid interop issues.
EDID:
  Extension Block 2 started with EDID header, ignoring Extension Blocks >= 2.
  CTA-861: Native progressive timings are a mix of several resolutions.

EDID conformity: FAIL
