edid-decode (hex):

00 ff ff ff ff ff ff 00 1a b3 54 05 bd b8 01 00
1d 11 01 03 80 29 1f 78 2a 29 45 a4 59 49 98 24
12 50 54 a5 4b 00 a9 40 81 80 01 01 01 01 01 01
01 01 01 01 01 01 48 3f 40 30 62 b0 32 40 40 c0
13 00 98 32 11 00 00 1e 00 00 00 fd 00 33 4b 1e
52 11 00 0a 20 20 20 20 20 20 00 00 00 fc 00 50
32 30 2d 32 0a 20 20 20 20 20 20 20 00 00 00 ff
00 59 45 4d 44 31 31 32 38 32 39 0a 20 20 00 cf

00 ff ff ff ff ff ff 00 1a b3 54 05 bd b8 01 00
1d 11 01 03 80 29 1f 78 2a 29 45 a4 59 49 98 24
12 50 54 a5 4b 00 a9 40 81 80 01 01 01 01 01 01
01 01 01 01 01 01 48 3f 40 30 62 b0 32 40 40 c0
13 00 98 32 11 00 00 1e 00 00 00 fd 00 33 4b 1e
52 11 00 0a 20 20 20 20 20 20 00 00 00 fc 00 50
32 30 2d 32 0a 20 20 20 20 20 20 20 00 00 00 ff
00 59 45 4d 44 31 31 32 38 32 39 0a 20 20 00 cf

----------------

Block 0, Base EDID:
  EDID Structure Version & Revision: 1.3
  Vendor & Product Identification:
    Manufacturer: FUS
    Model: 1364
    Serial Number: ...
    Made in: week 29 of 2007
  Basic Display Parameters & Features:
    Digital display
    Maximum image size: 41 cm x 31 cm
    Gamma: 2.20
    DPMS levels: Off
    RGB color display
    First detailed timing is the preferred timing
  Color Characteristics:
    Red  : 0.6406, 0.3496
    Green: 0.2871, 0.5947
    Blue : 0.1416, 0.0703
    White: 0.3134, 0.3291
  Established Timings I & II:
    IBM     :   720x400    70.081663 Hz   9:5     31.467 kHz     28.320000 MHz
    DMT 0x04:   640x480    59.940476 Hz   4:3     31.469 kHz     25.175000 MHz
    DMT 0x06:   640x480    75.000000 Hz   4:3     37.500 kHz     31.500000 MHz
    DMT 0x09:   800x600    60.316541 Hz   4:3     37.879 kHz     40.000000 MHz
    DMT 0x0b:   800x600    75.000000 Hz   4:3     46.875 kHz     49.500000 MHz
    DMT 0x10:  1024x768    60.003840 Hz   4:3     48.363 kHz     65.000000 MHz
    DMT 0x12:  1024x768    75.028582 Hz   4:3     60.023 kHz     78.750000 MHz
    DMT 0x24:  1280x1024   75.024675 Hz   5:4     79.976 kHz    135.000000 MHz
  Standard Timings:
    DMT 0x33:  1600x1200   60.000000 Hz   4:3     75.000 kHz    162.000000 MHz
    DMT 0x23:  1280x1024   60.019740 Hz   5:4     63.981 kHz    108.000000 MHz
  Detailed Timing Descriptors:
    DTD 1:  1600x1200   60.000000 Hz   4:3     75.000 kHz    162.000000 MHz (408 mm x 306 mm)
                 Hfront   64 Hsync 192 Hback  304 Hpol P
                 Vfront    1 Vsync   3 Vback   46 Vpol P
    Display Range Limits:
      Monitor ranges (GTF): 51-75 Hz V, 30-82 kHz H, max dotclock 170 MHz
    Display Product Name: 'P20-2'
    Display Product Serial Number: ...
Checksum: 0xcf

----------------

Failures:

EDID:
  Extension Block 1 started with EDID header, ignoring Extension Blocks >= 1.

EDID conformity: FAIL
