edid-decode (hex):

00 ff ff ff ff ff ff 00 4c 83 ba 41 a1 ff 00 00
00 22 01 04 b5 22 16 78 03 0b d1 af 51 3d b6 23
0b 50 54 00 00 00 01 01 01 01 01 01 01 01 01 01
01 01 01 01 01 01 cb fe 40 64 b0 08 18 70 20 08
88 00 58 d7 10 00 00 1b cb fe 40 64 b0 08 c8 7a
20 08 88 00 58 d7 10 00 00 1b 00 00 00 fd 00 30
78 da da 42 01 00 00 00 00 00 00 00 00 00 00 02
00 00 00 00 19 96 c8 46 1c 5e c8 00 00 00 01 96

70 20 79 02 00 20 00 0c ba 41 59 ba 41 00 00 00
00 00 18 00 21 00 1d 48 0d 98 08 40 0b 08 07 00
f2 ea 50 d7 d3 b6 3d 42 0b 01 45 54 40 5e d0 60
18 10 23 78 26 00 09 07 06 03 00 00 00 50 00 00
22 00 14 e7 f3 09 85 3f 0b 63 00 1f 00 07 00 07
07 17 00 07 00 07 00 81 00 1f 73 1a 00 00 03 0b
30 78 00 a0 74 02 60 02 78 00 00 00 00 8d e3 05
80 00 e6 06 05 01 74 60 02 00 00 00 00 00 41 90

00 ff ff ff ff ff ff 00 4c 83 ba 41 a1 ff 00 00
00 22 01 04 b5 22 16 78 03 0b d1 af 51 3d b6 23
0b 50 54 00 00 00 01 01 01 01 01 01 01 01 01 01
01 01 01 01 01 01 cb fe 40 64 b0 08 18 70 20 08
88 00 58 d7 10 00 00 1b cb fe 40 64 b0 08 c8 7a
20 08 88 00 58 d7 10 00 00 1b 00 00 00 fd 00 30
78 da da 42 01 00 00 00 00 00 00 00 00 00 00 02
00 00 00 00 19 96 c8 46 1c 5e c8 00 00 00 01 96

70 20 79 02 00 20 00 0c ba 41 59 ba 41 00 00 00
00 00 18 00 21 00 1d 48 0d 98 08 40 0b 08 07 00
f2 ea 50 d7 d3 b6 3d 42 0b 01 45 54 40 5e d0 60
18 10 23 78 26 00 09 07 06 03 00 00 00 50 00 00
22 00 14 e7 f3 09 85 3f 0b 63 00 1f 00 07 00 07
07 17 00 07 00 07 00 81 00 1f 73 1a 00 00 03 0b
30 78 00 a0 74 02 60 02 78 00 00 00 00 8d e3 05
80 00 e6 06 05 01 74 60 02 00 00 00 00 00 41 90

----------------

Block 0, Base EDID:
  EDID Structure Version & Revision: 1.4
  Vendor & Product Identification:
    Manufacturer: SDC
    Model: 16826
    Serial Number: ...
    Made in: 2024
  Basic Display Parameters & Features:
    Digital display
    Bits per primary color channel: 10
    DisplayPort interface
    Maximum image size: 34 cm x 22 cm
    Gamma: 2.20
    Supported color formats: RGB 4:4:4
    First detailed timing includes the native pixel format and preferred refresh rate
    Display supports continuous frequencies
  Color Characteristics:
    Red  : 0.6835, 0.3164
    Green: 0.2402, 0.7138
    Blue : 0.1396, 0.0439
    White: 0.3125, 0.3291
  Established Timings I & II: none
  Standard Timings: none
  Detailed Timing Descriptors:
    DTD 1:  2880x1800  120.001398 Hz  16:10   218.883 kHz    652.270000 MHz (344 mm x 215 mm)
                 Hfront   32 Hsync   8 Hback   60 Hpol P
                 Vfront    8 Vsync   8 Vback    8 Vpol N
    DTD 2:  2880x1800   48.000559 Hz  16:10   218.883 kHz    652.270000 MHz (344 mm x 215 mm)
                 Hfront   32 Hsync   8 Hback   60 Hpol P
                 Vfront    8 Vsync   8 Vback 2744 Vpol N
    Display Range Limits:
      Monitor ranges (Range Limits Only): 48-120 Hz V, 218-218 kHz H, max dotclock 660 MHz
    Manufacturer-Specified Display Descriptor (0x02): 00 02 00 00 00 00 19 96 c8 46 1c 5e c8 00 00 00 '.........F.^....'
  Extension blocks: 1
Checksum: 0x96

----------------

Block 1, DisplayID Extension Block:
  Version: 2.0
  Extension Count: 0
  Display Product Primary Use Case: None of the listed primary use cases; generic display
  Product Identification Data Block (0x20), OUI BA-41-59:
    Product Code: 16826
    Year of Manufacture: 2024
  Display Parameters Data Block (0x21):
    Image size: 340.0 mm x 220.0 mm
    Display native pixel format: 2880x1800
    Scan Orientation: Left to Right, Top to Bottom
    Luminance Information: Minimum guaranteed value
    Color Information: CIE 1931
    Audio Speaker Information: integrated
    Native Color Chromaticity:
      Primary #1:  (0.684082, 0.315918)
      Primary #2:  (0.239990, 0.714111)
      Primary #3:  (0.139893, 0.043945)
      White Point: (0.312744, 0.329102)
    Native Maximum Luminance (Full Coverage): 400.000000 cd/m^2
    Native Maximum Luminance (10% Rectangular Coverage): 616.000000 cd/m^2
    Native Minimum Luminance: 0.000500 cd/m^2
    Native Color Depth: 10 bpc
    Display Device Technology: Organic LED
    Native Gamma EOTF: 2.20
  Display Interface Features Data Block:
    Supported bpc for RGB encoding: 6, 8, 10
    Supported bpc for YCbCr 4:4:4 encoding: 8, 10
    Supported bpc for YCbCr 4:2:2 encoding: 8, 10
    Supported color space and EOTF standard combination 1: DCI-P3, BT.2020/SMPTE ST 2084
  Video Timing Modes Type 7 - Detailed Timings Data Block:
    DTD:  2880x1800  120.000294 Hz  16:10   218.881 kHz    652.264000 MHz (aspect 16:10, no 3D stereo, preferred)
               Hfront   32 Hsync   8 Hback   60 Hpol N
               Vfront    8 Vsync   8 Vback    8 Vpol N
  CTA-861 DisplayID Data Block:
  Vendor-Specific Data Block (AMD), OUI 00-00-1A:
    Version: 3
    Flags 1: 0x0b
      FreeSync Supported
      FreeSync 2 HDR Supported
      Local Dimming Supported
    Minimum Refresh Rate: 48 Hz
    Maximum Refresh Rate: 120 Hz
    Flags 5: 0xa0
      Display is OLED
      ST 2084 (PQ) EOTF Supported
    Maximum luminance: 116 (616.884 cd/m^2)
    Minimum luminance: 2 (0.000 cd/m^2)
    Maximum luminance (without local dimming): 96 (400.000 cd/m^2)
    Minimum luminance (without local dimming): 2 (0.000 cd/m^2)
    Additional Sink Information Address: 0x410
  Colorimetry Data Block:
    BT2020RGB
  HDR Static Metadata Data Block:
    Electro optical transfer functions:
      Traditional gamma - SDR luminance range
      SMPTE ST2084
    Supported static metadata descriptors:
      Static metadata type 1
    Desired content max luminance: 116 (616.884 cd/m^2)
    Desired content max frame-average luminance: 96 (400.000 cd/m^2)
    Desired content min luminance: 2 (0.000 cd/m^2)
  Checksum: 0x41
Checksum: 0x90

----------------

Warnings:

Block 0, Base EDID:
  Missing Display Product Name.
Block 1, DisplayID Extension Block:
  Colorimetry Data Block: Set the sRGB colorimetry bit to avoid interop issues.
EDID:
  Base EDID: Some timings are out of range of the Monitor Ranges:
    Horizontal Freq: 218.880 - 218.882 kHz (Monitor: 218.000 - 218.000 kHz)
    Could be due to a Monitor Range off-by-one rounding issue

Failures:

Block 0, Base EDID:
  Display Range Limits: Byte 11 is 0x00 instead of 0x0a.
  Display Range Limits: Bytes 12-17 must be 0x20.
EDID:
  Extension Block 2 started with EDID header, ignoring Extension Blocks >= 2.

EDID conformity: FAIL
