edid-decode (hex):

00 ff ff ff ff ff ff 00 30 ae 0d 12 01 00 00 00
2a 19 01 04 a5 3c 22 78 3a fd 70 a6 54 45 99 24
11 50 54 21 08 00 d1 c0 a9 c0 95 00 81 80 81 00
61 40 45 40 31 40 02 3a 80 18 71 38 2d 40 58 2c
45 00 56 50 21 00 00 1e 00 00 00 fc 00 4c 45 4e
2d 41 39 31 30 2d 41 0a 20 20 00 00 00 fd 00 32
4c 1e 5a 14 00 0a 20 20 20 20 20 20 00 00 00 fc
00 4d 32 37 30 48 56 4e 30 32 2e 30 0a 20 00 60

00 ff ff ff ff ff ff 00 30 ae 0d 12 01 00 00 00
2a 19 01 04 a5 3c 22 78 3a fd 70 a6 54 45 99 24
11 50 54 21 08 00 d1 c0 a9 c0 95 00 81 80 81 00
61 40 45 40 31 40 02 3a 80 18 71 38 2d 40 58 2c
45 00 56 50 21 00 00 1e 00 00 00 fc 00 4c 45 4e
2d 41 39 31 30 2d 41 0a 20 20 00 00 00 fd 00 32
4c 1e 5a 14 00 0a 20 20 20 20 20 20 00 00 00 fc
00 4d 32 37 30 48 56 4e 30 32 2e 30 0a 20 00 60

----------------

Block 0, Base EDID:
  EDID Structure Version & Revision: 1.4
  Vendor & Product Identification:
    Manufacturer: LEN
    Model: 4621
    Serial Number: ...
    Made in: week 42 of 2015
  Basic Display Parameters & Features:
    Digital display
    Bits per primary color channel: 8
    DisplayPort interface
    Maximum image size: 60 cm x 34 cm
    Gamma: 2.20
    DPMS levels: Off
    Supported color formats: RGB 4:4:4, YCrCb 4:4:4, YCrCb 4:2:2
    First detailed timing includes the native pixel format and preferred refresh rate
  Color Characteristics:
    Red  : 0.6513, 0.3310
    Green: 0.2724, 0.5986
    Blue : 0.1416, 0.0693
    White: 0.3125, 0.3281
  Established Timings I & II:
    DMT 0x04:   640x480    59.940476 Hz   4:3     31.469 kHz     25.175000 MHz
    DMT 0x09:   800x600    60.316541 Hz   4:3     37.879 kHz     40.000000 MHz
    DMT 0x10:  1024x768    60.003840 Hz   4:3     48.363 kHz     65.000000 MHz
  Standard Timings:
    DMT 0x52:  1920x1080   60.000000 Hz  16:9     67.500 kHz    148.500000 MHz
    DMT 0x53:  1600x900    60.000000 Hz  16:9     60.000 kHz    108.000000 MHz (RB)
    DMT 0x2f:  1440x900    59.887445 Hz  16:10    55.935 kHz    106.500000 MHz
    DMT 0x23:  1280x1024   60.019740 Hz   5:4     63.981 kHz    108.000000 MHz
    DMT 0x1c:  1280x800    59.810326 Hz  16:10    49.702 kHz     83.500000 MHz
    DMT 0x10:  1024x768    60.003840 Hz   4:3     48.363 kHz     65.000000 MHz
    DMT 0x09:   800x600    60.316541 Hz   4:3     37.879 kHz     40.000000 MHz
    DMT 0x04:   640x480    59.940476 Hz   4:3     31.469 kHz     25.175000 MHz
  Detailed Timing Descriptors:
    DTD 1:  1920x1080   60.000000 Hz  16:9     67.500 kHz    148.500000 MHz (598 mm x 336 mm)
                 Hfront   88 Hsync  44 Hback  148 Hpol P
                 Vfront    4 Vsync   5 Vback   36 Vpol P
    Display Product Name: 'LEN-A910-A'
    Display Range Limits:
      Monitor ranges (GTF): 50-76 Hz V, 30-90 kHz H, max dotclock 200 MHz
    Display Product Name: 'M270HVN02.0'
Checksum: 0x60

----------------

Block 1, Unknown EDID Extension Block 0x00:
  00 ff ff ff ff ff ff 00 30 ae 0d 12 01 00 00 00 '........0.......'
  2a 19 01 04 a5 3c 22 78 3a fd 70 a6 54 45 99 24 '*....<"x:.p.TE.$'
  11 50 54 21 08 00 d1 c0 a9 c0 95 00 81 80 81 00 '.PT!............'
  61 40 45 40 31 40 02 3a 80 18 71 38 2d 40 58 2c 'a@E@1@.:..q8-@X,'
  45 00 56 50 21 00 00 1e 00 00 00 fc 00 4c 45 4e 'E.VP!........LEN'
  2d 41 39 31 30 2d 41 0a 20 20 00 00 00 fd 00 32 '-A910-A.  .....2'
  4c 1e 5a 14 00 0a 20 20 20 20 20 20 00 00 00 fc 'L.Z...      ....'
  00 4d 32 37 30 48 56 4e 30 32 2e 30 0a 20 00 60 '.M270HVN02.0. .`'
Checksum: 0x60

----------------

Warnings:

Block 0, Base EDID:
  Vendor & Product Identification: The serial number is one of the known dummy values, it should probably be set to 0.
  Display Range Limits: GTF support is deprecated in EDID 1.4.

Failures:

Block 0, Base EDID:
  Display Range Limits: GTF is supported, but the display does not support continuous frequencies.
Block 1, Base EDID:
  Unknown Extension Block.
EDID:
  Base EDID: EDID specified 0 extension block(s), but found 1 extension block(s).

EDID conformity: FAIL
