edid-decode (hex):

00 ff ff ff ff ff ff 00 06 af 9d 10 00 00 00 00
01 13 01 03 90 26 15 78 0a c8 95 9e 57 54 92 26
0f 50 54 00 00 00 01 01 01 01 01 01 01 01 01 01
01 01 01 01 01 01 a0 37 80 b4 70 38 32 40 6c 30
aa 00 7d d6 10 00 00 1a a0 37 80 b4 70 38 32 40
6c 30 aa 00 7d d6 10 00 00 1a 00 00 00 fe 00 54
31 39 37 4e 14 42 31 37 33 48 57 31 00 00 00 00
00 00 00 00 00 00 00 00 00 02 01 0a 20 20 00 ff

----------------

Block 0, Base EDID:
  EDID Structure Version & Revision: 1.3
  Vendor & Product Identification:
    Manufacturer: AUO
    Model: 4253
    Made in: week 1 of 2009
  Basic Display Parameters & Features:
    Digital display
    Maximum image size: 38 cm x 21 cm
    Gamma: 2.20
    RGB color display
    First detailed timing is the preferred timing
  Color Characteristics:
    Red  : 0.6201, 0.3398
    Green: 0.3300, 0.5703
    Blue : 0.1503, 0.0595
    White: 0.3134, 0.3291
  Established Timings I & II: none
  Standard Timings: none
  Detailed Timing Descriptors:
    DTD 1:  1920x1080   60.008428 Hz  16:9     67.810 kHz    142.400000 MHz (381 mm x 214 mm)
                 Hfront  108 Hsync  48 Hback   24 Hpol P
                 Vfront   10 Vsync  10 Vback   30 Vpol N
    DTD 2:  1920x1080   60.008428 Hz  16:9     67.810 kHz    142.400000 MHz (381 mm x 214 mm)
                 Hfront  108 Hsync  48 Hback   24 Hpol P
                 Vfront   10 Vsync  10 Vback   30 Vpol N
    Alphanumeric Data String: 'T197N.B173HW1'
    Manufacturer-Specified Display Descriptor (0x00): 00 00 00 00 00 00 00 00 00 00 00 02 01 0a 20 20 '..............  '
Checksum: 0xff

----------------

Warnings:

Block 0, Base EDID:
  Alphanumeric Data String: Non-ASCII character 0x14 at position 5, can cause problems.

Failures:

Block 0, Base EDID:
  Basic Display Parameters & Features: Digital Video Interface Standard set to reserved value 0x10.
  Missing Display Product Name.
  Missing Display Range Limits Descriptor.

EDID conformity: FAIL
