edid-decode (hex):

00 ff ff ff ff ff ff 00 06 af 9d 10 00 00 00 00
01 1a 01 04 95 26 15 78 02 d2 95 a3 56 52 9d 27
0b 50 54 00 00 00 01 01 01 01 01 01 01 01 01 01
01 01 01 01 01 01 b8 3d 80 dc 70 38 95 40 10 10
3e 00 7d d6 10 00 00 1a 6a 31 80 dc 70 38 95 40
10 10 3e 00 7d d6 10 00 00 1a 00 00 00 fe 00 4e
54 59 31 48 80 42 31 37 33 48 41 4e 00 00 00 00
00 01 41 21 9e 00 10 00 00 0a 01 0a 20 20 00 01

00 ff ff ff ff ff ff 00 06 af 9d 10 00 00 00 00
01 1a 01 04 95 26 15 78 02 d2 95 a3 56 52 9d 27
0b 50 54 00 00 00 01 01 01 01 01 01 01 01 01 01
01 01 01 01 01 01 b8 3d 80 dc 70 38 95 40 10 10
3e 00 7d d6 10 00 00 1a 6a 31 80 dc 70 38 95 40
10 10 3e 00 7d d6 10 00 00 1a 00 00 00 fe 00 4e
54 59 31 48 80 42 31 37 33 48 41 4e 00 00 00 00
00 01 41 21 9e 00 10 00 00 0a 01 0a 20 20 00 01

----------------

Block 0, Base EDID:
  EDID Structure Version & Revision: 1.4
  Vendor & Product Identification:
    Manufacturer: AUO
    Model: 4253
    Made in: week 1 of 2016
  Basic Display Parameters & Features:
    Digital display
    Bits per primary color channel: 6
    DisplayPort interface
    Maximum image size: 38 cm x 21 cm
    Gamma: 2.20
    Supported color formats: RGB 4:4:4
    First detailed timing includes the native pixel format and preferred refresh rate
  Color Characteristics:
    Red  : 0.6396, 0.3369
    Green: 0.3203, 0.6152
    Blue : 0.1542, 0.0439
    White: 0.3134, 0.3291
  Established Timings I & II: none
  Standard Timings: none
  Detailed Timing Descriptors:
    DTD 1:  1920x1080   60.074675 Hz  16:9     73.832 kHz    158.000000 MHz (381 mm x 214 mm)
                 Hfront   16 Hsync  16 Hback  188 Hpol P
                 Vfront    3 Vsync  14 Vback  132 Vpol N
    DTD 2:  1920x1080   48.097762 Hz  16:9     59.112 kHz    126.500000 MHz (381 mm x 214 mm)
                 Hfront   16 Hsync  16 Hback  188 Hpol P
                 Vfront    3 Vsync  14 Vback  132 Vpol N
    Alphanumeric Data String: 'NTY1H.B173HAN'
    Manufacturer-Specified Display Descriptor (0x00): 00 00 00 01 41 21 9e 00 10 00 00 0a 01 0a 20 20 '....A!........  '
Checksum: 0x01

----------------

Block 1, Unknown EDID Extension Block 0x00:
  00 ff ff ff ff ff ff 00 06 af 9d 10 00 00 00 00 '................'
  01 1a 01 04 95 26 15 78 02 d2 95 a3 56 52 9d 27 '.....&.x....VR.''
  0b 50 54 00 00 00 01 01 01 01 01 01 01 01 01 01 '.PT.............'
  01 01 01 01 01 01 b8 3d 80 dc 70 38 95 40 10 10 '.......=..p8.@..'
  3e 00 7d d6 10 00 00 1a 6a 31 80 dc 70 38 95 40 '>.}.....j1..p8.@'
  10 10 3e 00 7d d6 10 00 00 1a 00 00 00 fe 00 4e '..>.}..........N'
  54 59 31 48 80 42 31 37 33 48 41 4e 00 00 00 00 'TY1H.B173HAN....'
  00 01 41 21 9e 00 10 00 00 0a 01 0a 20 20 00 01 '..A!........  ..'
Checksum: 0x01

----------------

Warnings:

Block 0, Base EDID:
  Alphanumeric Data String: Non-ASCII character 0x80 at position 5, can cause problems.
  Missing Display Product Name.

Failures:

Block 1, Base EDID:
  Unknown Extension Block.
EDID:
  Base EDID: EDID specified 0 extension block(s), but found 1 extension block(s).

EDID conformity: FAIL
