edid-decode (hex):

00 ff ff ff ff ff ff 00 09 d1 03 ac 0a 02 00 00
2c 1c 01 03 80 00 00 78 0a c9 f0 a3 57 59 94 23
10 4e 5c bd ef 80 81 c0 81 00 81 80 95 00 a9 40
d1 c0 45 7c 81 3c 02 3a 80 18 71 38 2d 40 58 2c
45 00 00 00 00 00 00 1e 00 00 00 fd 00 17 78 0f
66 0f 00 0a 20 20 20 20 20 20 00 00 00 fe 00 42
45 4e 51 0a 20 20 20 20 20 20 20 20 00 00 00 fc
00 42 65 6e 51 20 50 4a 0a 20 20 20 20 20 01 8a

02 03 46 73 50 15 06 1f 10 03 84 05 11 13 14 02
12 20 21 22 01 38 09 7f 07 0f 7f 07 15 07 50 3e
1f c0 4d 02 00 57 06 00 67 54 00 5f 54 01 83 5f
00 00 70 03 0c 00 12 00 b8 2d 20 c0 06 01 00 11
2c 26 36 e2 00 ff 01 1d 80 18 71 1c 16 20 58 2c
25 00 00 00 00 00 00 9e 01 1d 00 bc 52 d0 1e 20
b8 28 55 40 00 00 00 00 00 1e 00 00 00 00 00 00
00 00 00 00 00 00 00 00 00 00 00 00 00 00 00 26

00 ff ff ff ff ff ff 00 09 d1 03 ac 0a 02 00 00
2c 1c 01 03 80 00 00 78 0a c9 f0 a3 57 59 94 23
10 4e 5c bd ef 80 81 c0 81 00 81 80 95 00 a9 40
d1 c0 45 7c 81 3c 02 3a 80 18 71 38 2d 40 58 2c
45 00 00 00 00 00 00 1e 00 00 00 fd 00 17 78 0f
66 0f 00 0a 20 20 20 20 20 20 00 00 00 fe 00 42
45 4e 51 0a 20 20 20 20 20 20 20 20 00 00 00 fc
00 42 65 6e 51 20 50 4a 0a 20 20 20 20 20 01 8a

02 03 46 73 50 15 06 1f 10 03 84 05 11 13 14 02
12 20 21 22 01 38 09 7f 07 0f 7f 07 15 07 50 3e
1f c0 4d 02 00 57 06 00 67 54 00 5f 54 01 83 5f
00 00 70 03 0c 00 12 00 b8 2d 20 c0 06 01 00 11
2c 26 36 e2 00 ff 01 1d 80 18 71 1c 16 20 58 2c
25 00 00 00 00 00 00 9e 01 1d 00 bc 52 d0 1e 20
b8 28 55 40 00 00 00 00 00 1e 00 00 00 00 00 00
00 00 00 00 00 00 00 00 00 00 00 00 00 00 00 26

----------------

Block 0, Base EDID:
  EDID Structure Version & Revision: 1.3
  Vendor & Product Identification:
    Manufacturer: BNQ
    Model: 44035
    Serial Number: ...
    Made in: week 44 of 2018
  Basic Display Parameters & Features:
    Digital display
    Image size is variable
    Gamma: 2.20
    RGB color display
    First detailed timing is the preferred timing
  Color Characteristics:
    Red  : 0.6396, 0.3398
    Green: 0.3496, 0.5791
    Blue : 0.1396, 0.0654
    White: 0.3046, 0.3593
  Established Timings I & II:
    IBM     :   720x400    70.081663 Hz   9:5     31.467 kHz     28.320000 MHz
    DMT 0x04:   640x480    59.940476 Hz   4:3     31.469 kHz     25.175000 MHz
    Apple   :   640x480    66.666667 Hz   4:3     35.000 kHz     30.240000 MHz
    DMT 0x05:   640x480    72.808802 Hz   4:3     37.861 kHz     31.500000 MHz
    DMT 0x06:   640x480    75.000000 Hz   4:3     37.500 kHz     31.500000 MHz
    DMT 0x09:   800x600    60.316541 Hz   4:3     37.879 kHz     40.000000 MHz
    DMT 0x0a:   800x600    72.187572 Hz   4:3     48.077 kHz     50.000000 MHz
    DMT 0x0b:   800x600    75.000000 Hz   4:3     46.875 kHz     49.500000 MHz
    Apple   :   832x624    74.551266 Hz   4:3     49.726 kHz     57.284000 MHz
    DMT 0x10:  1024x768    60.003840 Hz   4:3     48.363 kHz     65.000000 MHz
    DMT 0x11:  1024x768    70.069359 Hz   4:3     56.476 kHz     75.000000 MHz
    DMT 0x12:  1024x768    75.028582 Hz   4:3     60.023 kHz     78.750000 MHz
    DMT 0x24:  1280x1024   75.024675 Hz   5:4     79.976 kHz    135.000000 MHz
    Apple   :  1152x870    75.061550 Hz 192:145   68.681 kHz    100.000000 MHz
  Standard Timings:
    DMT 0x55:  1280x720    60.000000 Hz  16:9     45.000 kHz     74.250000 MHz
    DMT 0x1c:  1280x800    59.810326 Hz  16:10    49.702 kHz     83.500000 MHz
    DMT 0x23:  1280x1024   60.019740 Hz   5:4     63.981 kHz    108.000000 MHz
    DMT 0x2f:  1440x900    59.887445 Hz  16:10    55.935 kHz    106.500000 MHz
    DMT 0x33:  1600x1200   60.000000 Hz   4:3     75.000 kHz    162.000000 MHz
    DMT 0x52:  1920x1080   60.000000 Hz  16:9     67.500 kHz    148.500000 MHz
    GTF     :   800x600   119.999886 Hz   4:3     77.160 kHz     83.950000 MHz
    GTF     :  1280x800   120.000265 Hz  16:10   102.960 kHz    181.210000 MHz
  Detailed Timing Descriptors:
    DTD 1:  1920x1080   60.000000 Hz  16:9     67.500 kHz    148.500000 MHz
                 Hfront   88 Hsync  44 Hback  148 Hpol P
                 Vfront    4 Vsync   5 Vback   36 Vpol P
    Display Range Limits:
      Monitor ranges (GTF): 23-120 Hz V, 15-102 kHz H, max dotclock 150 MHz
    Alphanumeric Data String: 'BENQ'
    Display Product Name: 'BenQ PJ'
  Extension blocks: 1
Checksum: 0x8a

----------------

Block 1, CTA-861 Extension Block:
  Revision: 3
  Basic audio support
  Supports YCbCr 4:4:4
  Supports YCbCr 4:2:2
  Native detailed modes: 3
  Video Data Block:
    VIC  21:  1440x576i   50.000000 Hz   4:3     15.625 kHz     27.000000 MHz
    VIC   6:  1440x480i   59.940060 Hz   4:3     15.734 kHz     27.000000 MHz
    VIC  31:  1920x1080   50.000000 Hz  16:9     56.250 kHz    148.500000 MHz
    VIC  16:  1920x1080   60.000000 Hz  16:9     67.500 kHz    148.500000 MHz
    VIC   3:   720x480    59.940060 Hz  16:9     31.469 kHz     27.000000 MHz
    VIC   4:  1280x720    60.000000 Hz  16:9     45.000 kHz     74.250000 MHz (native)
    VIC   5:  1920x1080i  60.000000 Hz  16:9     33.750 kHz     74.250000 MHz
    VIC  17:   720x576    50.000000 Hz   4:3     31.250 kHz     27.000000 MHz
    VIC  19:  1280x720    50.000000 Hz  16:9     37.500 kHz     74.250000 MHz
    VIC  20:  1920x1080i  50.000000 Hz  16:9     28.125 kHz     74.250000 MHz
    VIC   2:   720x480    59.940060 Hz   4:3     31.469 kHz     27.000000 MHz
    VIC  18:   720x576    50.000000 Hz  16:9     31.250 kHz     27.000000 MHz
    VIC  32:  1920x1080   24.000000 Hz  16:9     27.000 kHz     74.250000 MHz
    VIC  33:  1920x1080   25.000000 Hz  16:9     28.125 kHz     74.250000 MHz
    VIC  34:  1920x1080   30.000000 Hz  16:9     33.750 kHz     74.250000 MHz
    VIC   1:   640x480    59.940476 Hz   4:3     31.469 kHz     25.175000 MHz
  Audio Data Block:
    Linear PCM:
      Max channels: 2
      Supported sample rates (kHz): 192 176.4 96 88.2 48 44.1 32
      Supported sample sizes (bits): 24 20 16
    Linear PCM:
      Max channels: 8
      Supported sample rates (kHz): 192 176.4 96 88.2 48 44.1 32
      Supported sample sizes (bits): 24 20 16
    AC-3:
      Max channels: 6
      Supported sample rates (kHz): 48 44.1 32
      Maximum bit rate: 640 kb/s
    DTS:
      Max channels: 7
      Supported sample rates (kHz): 96 88.2 48 44.1 32
      Maximum bit rate: 1536 kb/s
    One Bit Audio:
      Max channels: 6
      Supported sample rates (kHz): 44.1
      Audio Format Code dependent value: 0x00
    Enhanced AC-3 (DD+):
      Max channels: 8
      Supported sample rates (kHz): 48 44.1
    MAT (MLP):
      Max channels: 8
      Supported sample rates (kHz): 192 96 48
      Supports only Dolby TrueHD
    DTS-HD:
      Max channels: 8
      Supported sample rates (kHz): 192 96 48
      Audio Format Code dependent value: 0x01
  Speaker Allocation Data Block:
    FL/FR - Front Left/Right
    LFE1 - Low Frequency Effects 1
    FC - Front Center
    LS/RS - Left/Right Surround
    BC - Back Center
    BL/BR - Back Left/Right
  Vendor-Specific Data Block (HDMI), OUI 00-0C-03:
    Source physical address: 1.2.0.0
    Supports_AI
    DC_36bit
    DC_30bit
    DC_Y444
    Maximum TMDS clock: 225 MHz
    Extended HDMI video details:
      3D present
      3D-capable-VIC mask present
      3D: Side-by-side (half, horizontal)
      3D VIC indices that support these capabilities:
        VIC  31:  1920x1080   50.000000 Hz  16:9     56.250 kHz    148.500000 MHz
        VIC  16:  1920x1080   60.000000 Hz  16:9     67.500 kHz    148.500000 MHz
        VIC   4:  1280x720    60.000000 Hz  16:9     45.000 kHz     74.250000 MHz
        VIC  19:  1280x720    50.000000 Hz  16:9     37.500 kHz     74.250000 MHz
        VIC  32:  1920x1080   24.000000 Hz  16:9     27.000 kHz     74.250000 MHz
      3D VIC indices with specific capabilities:
        VIC  31:  1920x1080   50.000000 Hz  16:9     56.250 kHz    148.500000 MHz (top-and-bottom)
        VIC  16:  1920x1080   60.000000 Hz  16:9     67.500 kHz    148.500000 MHz (top-and-bottom)
  Video Capability Data Block:
    YCbCr quantization: Selectable (via AVI YQ)
    RGB quantization: Selectable (via AVI Q)
    PT scan behavior: Supports both over- and underscan
    IT scan behavior: Supports both over- and underscan
    CE scan behavior: Supports both over- and underscan
  Detailed Timing Descriptors:
    DTD 2:  1920x1080i  60.000000 Hz  16:9     33.750 kHz     74.250000 MHz
                 Hfront   88 Hsync  44 Hback  148 Hpol P
                 Vfront    2 Vsync   5 Vback   15 Vpol P Vfront +0.5 Odd Field
                 Vfront    2 Vsync   5 Vback   15 Vpol P Vback  +0.5 Even Field
    DTD 3:  1280x720    50.000000 Hz  16:9     37.500 kHz     74.250000 MHz
                 Hfront  440 Hsync  40 Hback  220 Hpol P
                 Vfront    5 Vsync   5 Vback   20 Vpol P
Checksum: 0x26  Unused space in Extension Block: 21 bytes

----------------

Block 2, Unknown EDID Extension Block 0x00:
  00 ff ff ff ff ff ff 00 09 d1 03 ac 0a 02 00 00 '................'
  2c 1c 01 03 80 00 00 78 0a c9 f0 a3 57 59 94 23 ',......x....WY.#'
  10 4e 5c bd ef 80 81 c0 81 00 81 80 95 00 a9 40 '.N\............@'
  d1 c0 45 7c 81 3c 02 3a 80 18 71 38 2d 40 58 2c '..E|.<.:..q8-@X,'
  45 00 00 00 00 00 00 1e 00 00 00 fd 00 17 78 0f 'E.............x.'
  66 0f 00 0a 20 20 20 20 20 20 00 00 00 fe 00 42 'f...      .....B'
  45 4e 51 0a 20 20 20 20 20 20 20 20 00 00 00 fc 'ENQ.        ....'
  00 42 65 6e 51 20 50 4a 0a 20 20 20 20 20 01 8a '.BenQ PJ.     ..'
Checksum: 0x8a

----------------

Block 3, CTA-861 Extension Block:
  Revision: 3
  Basic audio support
  Supports YCbCr 4:4:4
  Supports YCbCr 4:2:2
  Native detailed modes: 3
  Video Data Block:
    VIC  21:  1440x576i   50.000000 Hz   4:3     15.625 kHz     27.000000 MHz
    VIC   6:  1440x480i   59.940060 Hz   4:3     15.734 kHz     27.000000 MHz
    VIC  31:  1920x1080   50.000000 Hz  16:9     56.250 kHz    148.500000 MHz
    VIC  16:  1920x1080   60.000000 Hz  16:9     67.500 kHz    148.500000 MHz
    VIC   3:   720x480    59.940060 Hz  16:9     31.469 kHz     27.000000 MHz
    VIC   4:  1280x720    60.000000 Hz  16:9     45.000 kHz     74.250000 MHz (native)
    VIC   5:  1920x1080i  60.000000 Hz  16:9     33.750 kHz     74.250000 MHz
    VIC  17:   720x576    50.000000 Hz   4:3     31.250 kHz     27.000000 MHz
    VIC  19:  1280x720    50.000000 Hz  16:9     37.500 kHz     74.250000 MHz
    VIC  20:  1920x1080i  50.000000 Hz  16:9     28.125 kHz     74.250000 MHz
    VIC   2:   720x480    59.940060 Hz   4:3     31.469 kHz     27.000000 MHz
    VIC  18:   720x576    50.000000 Hz  16:9     31.250 kHz     27.000000 MHz
    VIC  32:  1920x1080   24.000000 Hz  16:9     27.000 kHz     74.250000 MHz
    VIC  33:  1920x1080   25.000000 Hz  16:9     28.125 kHz     74.250000 MHz
    VIC  34:  1920x1080   30.000000 Hz  16:9     33.750 kHz     74.250000 MHz
    VIC   1:   640x480    59.940476 Hz   4:3     31.469 kHz     25.175000 MHz
  Audio Data Block:
    Linear PCM:
      Max channels: 2
      Supported sample rates (kHz): 192 176.4 96 88.2 48 44.1 32
      Supported sample sizes (bits): 24 20 16
    Linear PCM:
      Max channels: 8
      Supported sample rates (kHz): 192 176.4 96 88.2 48 44.1 32
      Supported sample sizes (bits): 24 20 16
    AC-3:
      Max channels: 6
      Supported sample rates (kHz): 48 44.1 32
      Maximum bit rate: 640 kb/s
    DTS:
      Max channels: 7
      Supported sample rates (kHz): 96 88.2 48 44.1 32
      Maximum bit rate: 1536 kb/s
    One Bit Audio:
      Max channels: 6
      Supported sample rates (kHz): 44.1
      Audio Format Code dependent value: 0x00
    Enhanced AC-3 (DD+):
      Max channels: 8
      Supported sample rates (kHz): 48 44.1
    MAT (MLP):
      Max channels: 8
      Supported sample rates (kHz): 192 96 48
      Supports only Dolby TrueHD
    DTS-HD:
      Max channels: 8
      Supported sample rates (kHz): 192 96 48
      Audio Format Code dependent value: 0x01
  Speaker Allocation Data Block:
    FL/FR - Front Left/Right
    LFE1 - Low Frequency Effects 1
    FC - Front Center
    LS/RS - Left/Right Surround
    BC - Back Center
    BL/BR - Back Left/Right
  Vendor-Specific Data Block (HDMI), OUI 00-0C-03:
    Source physical address: 1.2.0.0
    Supports_AI
    DC_36bit
    DC_30bit
    DC_Y444
    Maximum TMDS clock: 225 MHz
    Extended HDMI video details:
      3D present
      3D-capable-VIC mask present
      3D: Side-by-side (half, horizontal)
      3D VIC indices that support these capabilities:
        VIC  31:  1920x1080   50.000000 Hz  16:9     56.250 kHz    148.500000 MHz
        VIC  16:  1920x1080   60.000000 Hz  16:9     67.500 kHz    148.500000 MHz
        VIC   4:  1280x720    60.000000 Hz  16:9     45.000 kHz     74.250000 MHz
        VIC  19:  1280x720    50.000000 Hz  16:9     37.500 kHz     74.250000 MHz
        VIC  32:  1920x1080   24.000000 Hz  16:9     27.000 kHz     74.250000 MHz
      3D VIC indices with specific capabilities:
        VIC  31:  1920x1080   50.000000 Hz  16:9     56.250 kHz    148.500000 MHz (top-and-bottom)
        VIC  16:  1920x1080   60.000000 Hz  16:9     67.500 kHz    148.500000 MHz (top-and-bottom)
  Video Capability Data Block:
    YCbCr quantization: Selectable (via AVI YQ)
    RGB quantization: Selectable (via AVI Q)
    PT scan behavior: Supports both over- and underscan
    IT scan behavior: Supports both over- and underscan
    CE scan behavior: Supports both over- and underscan
  Detailed Timing Descriptors:
    DTD 4:  1920x1080i  60.000000 Hz  16:9     33.750 kHz     74.250000 MHz
                 Hfront   88 Hsync  44 Hback  148 Hpol P
                 Vfront    2 Vsync   5 Vback   15 Vpol P Vfront +0.5 Odd Field
                 Vfront    2 Vsync   5 Vback   15 Vpol P Vback  +0.5 Even Field
    DTD 5:  1280x720    50.000000 Hz  16:9     37.500 kHz     74.250000 MHz
                 Hfront  440 Hsync  40 Hback  220 Hpol P
                 Vfront    5 Vsync   5 Vback   20 Vpol P
Checksum: 0x26  Unused space in Extension Block: 21 bytes

----------------

Warnings:

Block 1, CTA-861 Extension Block:
  IT Video Formats are overscanned by default, but normally this should be underscanned.
  Video Data Block: VIC 21 and the first DTD are not identical. Is this intended?
  Video Capability Data Block: S_PT is equal to S_IT and S_CE, so should be set to 0 instead.
  Add a Colorimetry Data Block with the sRGB colorimetry bit set to avoid interop issues.
Block 3, CTA-861 Extension Block:
  IT Video Formats are overscanned by default, but normally this should be underscanned.
  Video Capability Data Block: S_PT is equal to S_IT and S_CE, so should be set to 0 instead.
EDID:
  Base EDID: Some timings are out of range of the Monitor Ranges:
    Horizontal Freq: 15.625 - 102.960 kHz (Monitor: 15.000 - 102.000 kHz)
    Maximum Clock: 181.210 MHz (Monitor: 150.000 MHz)

Failures:

Block 2, Base EDID:
  Unknown Extension Block.
Block 3, CTA-861 Extension Block:
  Video Data Block: Duplicate VIC 21.
  Video Data Block: Duplicate VIC 6.
  Video Data Block: Duplicate VIC 31.
  Video Data Block: Duplicate VIC 16.
  Video Data Block: Duplicate VIC 3.
  Video Data Block: Duplicate VIC 4.
  Video Data Block: Duplicate VIC 5.
  Video Data Block: Duplicate VIC 17.
  Video Data Block: Duplicate VIC 19.
  Video Data Block: Duplicate VIC 20.
  Video Data Block: Duplicate VIC 2.
  Video Data Block: Duplicate VIC 18.
  Video Data Block: Duplicate VIC 32.
  Video Data Block: Duplicate VIC 33.
  Video Data Block: Duplicate VIC 34.
  Video Data Block: Duplicate VIC 1.
  Speaker Allocation Data Block: Only one instance of this Data Block is allowed.
  Video Capability Data Block: Only one instance of this Data Block is allowed.
EDID:
  Base EDID: EDID specified 1 extension block(s), but found 3 extension block(s).
  Base EDID: EDID 1.3 requires a Block Map Extension in Block 1 if there are more than 2 blocks in the EDID.
  CTA-861: Native progressive timings are a mix of several resolutions.

EDID conformity: FAIL
