edid-decode (hex):

00 ff ff ff ff ff ff 00 64 74 12 65 01 00 00 00
11 22 01 04 b5 14 23 78 23 ef 65 a6 56 52 9d 28
0b 50 54 21 08 00 71 40 81 80 01 01 01 01 01 01
01 01 01 01 01 01 40 6b 80 a0 70 70 28 80 58 2c
45 00 c7 62 01 00 00 1e 00 00 00 ff 00 0a 20 20
20 20 20 20 20 20 20 20 20 20 00 00 00 fc 00 4d
31 35 36 46 32 35 2d 4a 0a 20 20 20 00 00 00 fd
00 30 3f 84 84 24 01 0a 20 20 20 20 20 20 01 36

02 03 0f c2 42 01 02 23 09 7f 07 83 01 00 00 40
6b 7e a2 70 70 28 80 58 2c 45 00 c7 62 01 00 00
1e b2 20 c0 18 31 38 2d 40 58 2c 45 00 c7 62 01
00 00 1e 00 00 00 00 00 00 00 00 00 00 00 00 00
00 00 00 00 00 00 00 00 00 00 00 00 00 00 00 00
00 00 00 00 00 00 00 00 00 00 00 00 00 00 00 00
00 00 00 00 00 00 00 00 00 00 00 00 00 00 00 00
00 00 00 00 00 00 00 00 00 00 00 00 00 00 00 ba

00 ff ff ff ff ff ff 00 64 74 12 65 01 00 00 00
11 22 01 04 b5 14 23 78 23 ef 65 a6 56 52 9d 28
0b 50 54 21 08 00 71 40 81 80 01 01 01 01 01 01
01 01 01 01 01 01 40 6b 80 a0 70 70 28 80 58 2c
45 00 c7 62 01 00 00 1e 00 00 00 ff 00 0a 20 20
20 20 20 20 20 20 20 20 20 20 00 00 00 fc 00 4d
31 35 36 46 32 35 2d 4a 0a 20 20 20 00 00 00 fd
00 30 3f 84 84 24 01 0a 20 20 20 20 20 20 01 36

02 03 0f c2 42 01 02 23 09 7f 07 83 01 00 00 40
6b 7e a2 70 70 28 80 58 2c 45 00 c7 62 01 00 00
1e b2 20 c0 18 31 38 2d 40 58 2c 45 00 c7 62 01
00 00 1e 00 00 00 00 00 00 00 00 00 00 00 00 00
00 00 00 00 00 00 00 00 00 00 00 00 00 00 00 00
00 00 00 00 00 00 00 00 00 00 00 00 00 00 00 00
00 00 00 00 00 00 00 00 00 00 00 00 00 00 00 00
00 00 00 00 00 00 00 00 00 00 00 00 00 00 00 ba

----------------

Block 0, Base EDID:
  EDID Structure Version & Revision: 1.4
  Vendor & Product Identification:
    Manufacturer: YCT
    Model: 25874
    Serial Number: ...
    Made in: week 17 of 2024
  Basic Display Parameters & Features:
    Digital display
    Bits per primary color channel: 10
    DisplayPort interface
    Maximum image size: 20 cm x 35 cm
    Gamma: 2.20
    DPMS levels: Off
    Supported color formats: RGB 4:4:4
    First detailed timing includes the native pixel format and preferred refresh rate
    Display supports continuous frequencies
  Color Characteristics:
    Red  : 0.6513, 0.3378
    Green: 0.3232, 0.6162
    Blue : 0.1572, 0.0449
    White: 0.3134, 0.3291
  Established Timings I & II:
    DMT 0x04:   640x480    59.940476 Hz   4:3     31.469 kHz     25.175000 MHz
    DMT 0x09:   800x600    60.316541 Hz   4:3     37.879 kHz     40.000000 MHz
    DMT 0x10:  1024x768    60.003840 Hz   4:3     48.363 kHz     65.000000 MHz
  Standard Timings:
    GTF     :  1152x864    60.000000 Hz   4:3     53.700 kHz     81.624000 MHz
    DMT 0x23:  1280x1024   60.019740 Hz   5:4     63.981 kHz    108.000000 MHz
  Detailed Timing Descriptors:
    DTD 1:  1920x2160   60.000000 Hz   8:9    132.000 kHz    274.560000 MHz (199 mm x 354 mm)
                 Hfront   88 Hsync  44 Hback   28 Hpol P
                 Vfront    4 Vsync   5 Vback   31 Vpol P
    Display Product Serial Number: ...
    Display Product Name: 'M156F25-J'
    Display Range Limits:
      Monitor ranges (Range Limits Only): 48-63 Hz V, 132-132 kHz H, max dotclock 360 MHz
  Extension blocks: 1
Checksum: 0x36

----------------

Block 1, CTA-861 Extension Block:
  Revision: 3
  Underscans IT Video Formats by default
  Basic audio support
  Native DTDs: 2
  Video Data Block:
    VIC   1:   640x480    59.940476 Hz   4:3     31.469 kHz     25.175000 MHz
    VIC   2:   720x480    59.940060 Hz   4:3     31.469 kHz     27.000000 MHz
  Audio Data Block:
    Linear PCM:
      Max channels: 2
      Supported sample rates (kHz): 192 176.4 96 88.2 48 44.1 32
      Supported sample sizes (bits): 24 20 16
  Speaker Allocation Data Block:
    FL/FR - Front Left/Right
  Detailed Timing Descriptors:
    DTD 2:  1918x2160   60.000000 Hz 959:1080  132.000 kHz    274.560000 MHz (199 mm x 354 mm)
                 Hfront   88 Hsync  44 Hback   30 Hpol P
                 Vfront    4 Vsync   5 Vback   31 Vpol P
    DTD 3:   960x1080   60.000000 Hz   8:9     67.500 kHz     83.700000 MHz (199 mm x 354 mm)
                 Hfront   88 Hsync  44 Hback  148 Hpol P
                 Vfront    4 Vsync   5 Vback   36 Vpol P
Checksum: 0xba  Unused space in Extension Block: 76 bytes

----------------

Warnings:

Block 0, Base EDID:
  Vendor & Product Identification: The serial number is one of the known dummy values, it should probably be set to 0.
  Detailed Timing Descriptor #1: Image size is 199x354 mm, but based on the picture AR it should be 199x223 mm.
Block 1, CTA-861 Extension Block:
  Video Data Block: VIC 1 and the first DTD are not identical. Is this intended?
  Detailed Timing Descriptor #2: Image size is 199x354 mm, but based on the picture AR it should be 199x224 mm.
  Detailed Timing Descriptor #3: Image size is 199x354 mm, but based on the picture AR it should be 199x223 mm.
  Display Product Serial Number is set, so the Serial Number in the Base EDID should be 0.
  Add a Colorimetry Data Block with the sRGB colorimetry bit set to avoid interop issues.
EDID:
  Base EDID: Some timings are out of range of the Monitor Ranges:
    Horizontal Freq: 31.468 - 132.000 kHz (Monitor: 132.000 - 132.000 kHz)

Failures:

Block 0, Base EDID:
  Display Product Serial Number: ...
Block 1, CTA-861 Extension Block:
  Missing VCDB, needed for Set Selectable RGB Quantization to avoid interop issues.
EDID:
  Extension Block 2 started with EDID header, ignoring Extension Blocks >= 2.
  CTA-861: Native progressive timings are a mix of several resolutions.

EDID conformity: FAIL
