edid-decode (hex):

00 ff ff ff ff ff ff 00 34 a9 77 d0 00 00 00 00
00 12 01 03 0e 00 00 78 0a fe 3c a2 5c 5a a0 25
0e 50 60 3f ff 80 71 4b 81 40 90 40 a9 40 81 00
95 00 b3 00 81 c0 64 19 00 40 41 00 26 30 18 88
36 00 00 00 00 00 00 18 0e 1f 00 80 51 00 1e 30
40 80 37 00 00 00 00 00 00 18 00 00 00 fd 00 32
55 0f 5b 11 00 0a 20 20 20 20 20 20 00 00 00 fc
00 50 54 2d 4c 42 38 30 2f 37 35 20 20 20 00 05

00 ff ff ff ff ff ff 00 34 a9 77 d0 00 00 00 00
00 12 01 03 0e 00 00 78 0a fe 3c a2 5c 5a a0 25
0e 50 60 3f ff 80 71 4b 81 40 90 40 a9 40 81 00
95 00 b3 00 81 c0 64 19 00 40 41 00 26 30 18 88
36 00 00 00 00 00 00 18 0e 1f 00 80 51 00 1e 30
40 80 37 00 00 00 00 00 00 18 00 00 00 fd 00 32
55 0f 5b 11 00 0a 20 20 20 20 20 20 00 00 00 fc
00 50 54 2d 4c 42 38 30 2f 37 35 20 20 20 00 05

----------------

Block 0, Base EDID:
  EDID Structure Version & Revision: 1.3
  Vendor & Product Identification:
    Manufacturer: MEI
    Model: 53367
    Made in: 2008
  Basic Display Parameters & Features:
    Analog display
    Signal Level Standard: 0.700 : 0.300 : 1.000 V p-p
    Blank level equals black level
    Sync: Separate Composite SyncOnGreen
    Image size is variable
    Gamma: 2.20
    RGB color display
    First detailed timing is the preferred timing
  Color Characteristics:
    Red  : 0.6357, 0.3623
    Green: 0.3544, 0.6269
    Blue : 0.1445, 0.0576
    White: 0.3154, 0.3750
  Established Timings I & II:
    DMT 0x04:   640x480    59.940476 Hz   4:3     31.469 kHz     25.175000 MHz
    Apple   :   640x480    66.666667 Hz   4:3     35.000 kHz     30.240000 MHz
    DMT 0x05:   640x480    72.808802 Hz   4:3     37.861 kHz     31.500000 MHz
    DMT 0x06:   640x480    75.000000 Hz   4:3     37.500 kHz     31.500000 MHz
    DMT 0x08:   800x600    56.250000 Hz   4:3     35.156 kHz     36.000000 MHz
    DMT 0x09:   800x600    60.316541 Hz   4:3     37.879 kHz     40.000000 MHz
    DMT 0x0a:   800x600    72.187572 Hz   4:3     48.077 kHz     50.000000 MHz
    DMT 0x0b:   800x600    75.000000 Hz   4:3     46.875 kHz     49.500000 MHz
    Apple   :   832x624    74.551266 Hz   4:3     49.726 kHz     57.284000 MHz
    DMT 0x0f:  1024x768i   86.957532 Hz   4:3     35.522 kHz     44.900000 MHz
    DMT 0x10:  1024x768    60.003840 Hz   4:3     48.363 kHz     65.000000 MHz
    DMT 0x11:  1024x768    70.069359 Hz   4:3     56.476 kHz     75.000000 MHz
    DMT 0x12:  1024x768    75.028582 Hz   4:3     60.023 kHz     78.750000 MHz
    DMT 0x24:  1280x1024   75.024675 Hz   5:4     79.976 kHz    135.000000 MHz
    Apple   :  1152x870    75.061550 Hz 192:145   68.681 kHz    100.000000 MHz
  Standard Timings:
    GTF     :  1152x864    70.999711 Hz   4:3     63.900 kHz     98.150000 MHz
    DMT 0x20:  1280x960    60.000000 Hz   4:3     60.000 kHz    108.000000 MHz
    DMT 0x2a:  1400x1050   59.978442 Hz   4:3     65.317 kHz    121.750000 MHz
    DMT 0x33:  1600x1200   60.000000 Hz   4:3     75.000 kHz    162.000000 MHz
    DMT 0x1c:  1280x800    59.810326 Hz  16:10    49.702 kHz     83.500000 MHz
    DMT 0x2f:  1440x900    59.887445 Hz  16:10    55.935 kHz    106.500000 MHz
    DMT 0x3a:  1680x1050   59.954250 Hz  16:10    65.290 kHz    146.250000 MHz
    DMT 0x55:  1280x720    60.000000 Hz  16:9     45.000 kHz     74.250000 MHz
  Detailed Timing Descriptors:
    DTD 1:  1024x768    60.003840 Hz   4:3     48.363 kHz     65.000000 MHz
                 Hfront   24 Hsync 136 Hback  160 Hpol N
                 Vfront    3 Vsync   6 Vback   29 Vpol N
    DTD 2:  1280x768    59.870228 Hz   5:3     47.776 kHz     79.500000 MHz
                 Hfront   64 Hsync 128 Hback  192 Hpol N
                 Vfront    3 Vsync   7 Vback   20 Vpol N
    Display Range Limits:
      Monitor ranges (GTF): 50-85 Hz V, 15-91 kHz H, max dotclock 170 MHz
    Display Product Name: 'PT-LB80/75   '
Checksum: 0x05

----------------

Warnings:

Block 0, Base EDID:
  Detailed Timing Descriptor #2: DTD is similar but not identical to DMT 0x17.
EDID:
  Base EDID: Some timings are out of range of the Monitor Ranges:
    Vertical Freq: 56.250 - 86.958 Hz (Monitor: 50.000 - 85.000 Hz)

Failures:

Block 0, Base EDID:
  Display Product Name: No newline, but one or more trailing spaces.
EDID:
  Extension Block 1 started with EDID header, ignoring Extension Blocks >= 1.

EDID conformity: FAIL
