edid-decode (hex):

00 ff ff ff ff ff ff 00 4d 67 38 27 01 00 00 00
35 22 01 04 b5 3c 22 78 bf 78 b5 b5 4a 2b cc 21
0b 50 54 a5 4f 00 71 4f 81 40 81 c0 81 8f 61 40
b3 00 a9 c0 d1 c0 56 5e 00 a0 a0 a0 29 50 30 20
35 00 54 4f 21 00 00 1e 00 00 00 ff 00 4b 37 37
32 32 35 30 31 31 30 32 39 00 00 00 00 fd 02 30
2d fe fe 8c 00 0a 20 20 20 20 20 20 00 00 00 fc
00 48 32 37 45 36 0a 20 20 20 20 20 20 20 02 91

02 03 45 f2 23 09 06 07 83 01 00 00 4c 83 04 05
10 1f 02 12 11 13 01 40 3f e2 00 c0 e3 05 c3 01
e6 06 07 01 5c 40 00 68 03 0c 00 20 00 38 ff 00
74 1a 00 00 03 03 30 f0 00 04 00 00 00 00 2c 01
00 00 00 00 00 a7 e5 00 a0 a0 a0 3d 50 30 20 35
00 54 4f 21 00 00 1e 6f c2 00 a0 a0 a0 55 50 30
20 35 00 54 50 21 00 00 1e 00 00 00 00 00 00 00
00 00 00 00 00 00 00 00 00 00 00 00 00 00 00 39

70 12 79 03 00 03 00 64 67 d7 01 04 ff 09 77 00
2f 00 1f 00 9f 05 3c 00 02 00 04 00 c1 7e 01 04
ff 09 9f 00 2f 00 1f 00 9f 05 3c 00 02 00 04 00
25 15 01 05 bf 06 9f 00 2f 00 1f 00 37 04 ac 00
02 00 05 00 2a 14 01 04 7f 07 9f 00 2f 00 1f 00
37 04 34 00 02 00 04 00 8e ef 00 05 8f 06 9f 00
2f 00 1f 00 19 04 3c 00 02 00 05 00 00 00 00 00
00 00 00 00 00 00 00 00 00 00 00 00 00 00 87 90

00 ff ff ff ff ff ff 00 4d 67 38 27 01 00 00 00
35 22 01 04 b5 3c 22 78 bf 78 b5 b5 4a 2b cc 21
0b 50 54 a5 4f 00 71 4f 81 40 81 c0 81 8f 61 40
b3 00 a9 c0 d1 c0 56 5e 00 a0 a0 a0 29 50 30 20
35 00 54 4f 21 00 00 1e 00 00 00 ff 00 4b 37 37
32 32 35 30 31 31 30 32 39 00 00 00 00 fd 02 30
2d fe fe 8c 00 0a 20 20 20 20 20 20 00 00 00 fc
00 48 32 37 45 36 0a 20 20 20 20 20 20 20 02 91

02 03 45 f2 23 09 06 07 83 01 00 00 4c 83 04 05
10 1f 02 12 11 13 01 40 3f e2 00 c0 e3 05 c3 01
e6 06 07 01 5c 40 00 68 03 0c 00 20 00 38 ff 00
74 1a 00 00 03 03 30 f0 00 04 00 00 00 00 2c 01
00 00 00 00 00 a7 e5 00 a0 a0 a0 3d 50 30 20 35
00 54 4f 21 00 00 1e 6f c2 00 a0 a0 a0 55 50 30
20 35 00 54 50 21 00 00 1e 00 00 00 00 00 00 00
00 00 00 00 00 00 00 00 00 00 00 00 00 00 00 39

70 12 79 03 00 03 00 64 67 d7 01 04 ff 09 77 00
2f 00 1f 00 9f 05 3c 00 02 00 04 00 c1 7e 01 04
ff 09 9f 00 2f 00 1f 00 9f 05 3c 00 02 00 04 00
25 15 01 05 bf 06 9f 00 2f 00 1f 00 37 04 ac 00
02 00 05 00 2a 14 01 04 7f 07 9f 00 2f 00 1f 00
37 04 34 00 02 00 04 00 8e ef 00 05 8f 06 9f 00
2f 00 1f 00 19 04 3c 00 02 00 05 00 00 00 00 00
00 00 00 00 00 00 00 00 00 00 00 00 00 00 87 90

----------------

Block 0, Base EDID:
  EDID Structure Version & Revision: 1.4
  Vendor & Product Identification:
    Manufacturer: SKG
    Model: 10040
    Serial Number: ...
    Made in: week 53 of 2024
  Basic Display Parameters & Features:
    Digital display
    Bits per primary color channel: 10
    DisplayPort interface
    Maximum image size: 60 cm x 34 cm
    Gamma: 2.20
    DPMS levels: Standby Off
    Supported color formats: RGB 4:4:4, YCrCb 4:4:4, YCrCb 4:2:2
    Default (sRGB) color space is primary color space
    First detailed timing includes the native pixel format and preferred refresh rate
    Display supports continuous frequencies
  Color Characteristics:
    Red  : 0.7080, 0.2919
    Green: 0.1699, 0.7968
    Blue : 0.1308, 0.0458
    White: 0.3134, 0.3291
  Established Timings I & II:
    IBM     :   720x400    70.081663 Hz   9:5     31.467 kHz     28.320000 MHz
    DMT 0x04:   640x480    59.940476 Hz   4:3     31.469 kHz     25.175000 MHz
    DMT 0x06:   640x480    75.000000 Hz   4:3     37.500 kHz     31.500000 MHz
    DMT 0x09:   800x600    60.316541 Hz   4:3     37.879 kHz     40.000000 MHz
    DMT 0x0b:   800x600    75.000000 Hz   4:3     46.875 kHz     49.500000 MHz
    DMT 0x10:  1024x768    60.003840 Hz   4:3     48.363 kHz     65.000000 MHz
    DMT 0x11:  1024x768    70.069359 Hz   4:3     56.476 kHz     75.000000 MHz
    DMT 0x12:  1024x768    75.028582 Hz   4:3     60.023 kHz     78.750000 MHz
    DMT 0x24:  1280x1024   75.024675 Hz   5:4     79.976 kHz    135.000000 MHz
  Standard Timings:
    DMT 0x15:  1152x864    75.000000 Hz   4:3     67.500 kHz    108.000000 MHz
    DMT 0x20:  1280x960    60.000000 Hz   4:3     60.000 kHz    108.000000 MHz
    DMT 0x55:  1280x720    60.000000 Hz  16:9     45.000 kHz     74.250000 MHz
    DMT 0x24:  1280x1024   75.024675 Hz   5:4     79.976 kHz    135.000000 MHz
    DMT 0x10:  1024x768    60.003840 Hz   4:3     48.363 kHz     65.000000 MHz
    DMT 0x3a:  1680x1050   59.954250 Hz  16:10    65.290 kHz    146.250000 MHz
    DMT 0x53:  1600x900    60.000000 Hz  16:9     60.000 kHz    108.000000 MHz (RB)
    DMT 0x52:  1920x1080   60.000000 Hz  16:9     67.500 kHz    148.500000 MHz
  Detailed Timing Descriptors:
    DTD 1:  2560x1440   59.950550 Hz  16:9     88.787 kHz    241.500000 MHz (596 mm x 335 mm)
                 Hfront   48 Hsync  32 Hback   80 Hpol P
                 Vfront    3 Vsync   5 Vback   33 Vpol P
    Display Product Serial Number: ...
    Display Range Limits:
      Monitor ranges (GTF): 48-300 Hz V, 254-254 kHz H, max dotclock 1400 MHz
    Display Product Name: 'H27E6'
  Extension blocks: 2
Checksum: 0x91

----------------

Block 1, CTA-861 Extension Block:
  Revision: 3
  Underscans IT Video Formats by default
  Basic audio support
  Supports YCbCr 4:4:4
  Supports YCbCr 4:2:2
  Native DTDs: 2
  Audio Data Block:
    Linear PCM:
      Max channels: 2
      Supported sample rates (kHz): 48 44.1
      Supported sample sizes (bits): 24 20 16
  Speaker Allocation Data Block:
    FL/FR - Front Left/Right
  Video Data Block:
    VIC   3:   720x480    59.940060 Hz  16:9     31.469 kHz     27.000000 MHz (native)
    VIC   4:  1280x720    60.000000 Hz  16:9     45.000 kHz     74.250000 MHz
    VIC   5:  1920x1080i  60.000000 Hz  16:9     33.750 kHz     74.250000 MHz
    VIC  16:  1920x1080   60.000000 Hz  16:9     67.500 kHz    148.500000 MHz
    VIC  31:  1920x1080   50.000000 Hz  16:9     56.250 kHz    148.500000 MHz
    VIC   2:   720x480    59.940060 Hz   4:3     31.469 kHz     27.000000 MHz
    VIC  18:   720x576    50.000000 Hz  16:9     31.250 kHz     27.000000 MHz
    VIC  17:   720x576    50.000000 Hz   4:3     31.250 kHz     27.000000 MHz
    VIC  19:  1280x720    50.000000 Hz  16:9     37.500 kHz     74.250000 MHz
    VIC   1:   640x480    59.940476 Hz   4:3     31.469 kHz     25.175000 MHz
    VIC  64:  1920x1080  100.000000 Hz  16:9    112.500 kHz    297.000000 MHz
    VIC  63:  1920x1080  120.000000 Hz  16:9    135.000 kHz    297.000000 MHz
  Video Capability Data Block:
    YCbCr quantization: Selectable (via AVI YQ)
    RGB quantization: Selectable (via AVI Q)
    PT scan behavior: No Data
    IT scan behavior: IT video formats not supported
    CE scan behavior: CE video formats not supported
  Colorimetry Data Block:
    xvYCC601
    xvYCC709
    BT2020YCC
    BT2020RGB
    Gamut Boundary Description Metadata Profile P0
  HDR Static Metadata Data Block:
    Electro optical transfer functions:
      Traditional gamma - SDR luminance range
      Traditional gamma - HDR luminance range
      SMPTE ST2084
    Supported static metadata descriptors:
      Static metadata type 1
    Desired content max luminance: 92 (366.802 cd/m^2)
    Desired content max frame-average luminance: 64 (200.000 cd/m^2)
    Desired content min luminance: 0 (0.000 cd/m^2)
  Vendor-Specific Data Block (HDMI), OUI 00-0C-03:
    Source physical address: 2.0.0.0
    DC_36bit
    DC_30bit
    DC_Y444
    Maximum TMDS clock: 1275 MHz
  Vendor-Specific Data Block (AMD), OUI 00-00-1A:
    Version: 3
    Feature Caps: 0x03
    Minimum Refresh Rate: 48 Hz
    Maximum Refresh Rate: 300 Hz
    Flags 1.x: 0x00
    Flags 2.x: 0x04
      ST 2084 (PQ) EOTF Supported
      Linear EOTF (Windows scRGB, 0.0 - 125.0) Supported
      Gamma 2.2 EOTF Supported
      BT.2020 Gamut Supported
    Maximum luminance: 0 (50.000 cd/m^2)
    Minimum luminance: 0 (0.000 cd/m^2)
  Detailed Timing Descriptors:
    DTD 2:  2560x1440  143.999589 Hz  16:9    216.143 kHz    587.910000 MHz (596 mm x 335 mm)
                 Hfront   48 Hsync  32 Hback   80 Hpol P
                 Vfront    3 Vsync   5 Vback   53 Vpol P
    DTD 3:  2560x1440  119.997589 Hz  16:9    182.996 kHz    497.750000 MHz (596 mm x 336 mm)
                 Hfront   48 Hsync  32 Hback   80 Hpol P
                 Vfront    3 Vsync   5 Vback   77 Vpol P
Checksum: 0x39  Unused space in Extension Block: 22 bytes

----------------

Block 2, DisplayID Extension Block:
  Version: 1.2
  Extension Count: 0
  Display Product Type: Standalone display device
  Video Timing Modes Type 1 - Detailed Timings Data Block:
    DTD:  2560x1440  299.999006 Hz  16:9    450.299 kHz   1206.800000 MHz (aspect 16:9, no 3D stereo)
               Hfront   48 Hsync  32 Hback   40 Hpol N
               Vfront    3 Vsync   5 Vback   53 Vpol N
    DTD:  2560x1440  240.001764 Hz  16:9    360.243 kHz    979.860000 MHz (aspect 16:9, no 3D stereo)
               Hfront   48 Hsync  32 Hback   80 Hpol N
               Vfront    3 Vsync   5 Vback   53 Vpol N
    DTD:  1728x1080  299.915795 Hz  16:10   375.794 kHz    709.500000 MHz (aspect 16:10, no 3D stereo)
               Hfront   48 Hsync  32 Hback   80 Hpol N
               Vfront    3 Vsync   6 Vback  164 Vpol N
    DTD:  1920x1080  299.999151 Hz  16:9    339.899 kHz    706.990000 MHz (aspect 16:9, no 3D stereo)
               Hfront   48 Hsync  32 Hback   80 Hpol N
               Vfront    3 Vsync   5 Vback   45 Vpol N
    DTD:  1680x1050  299.999022 Hz  16:10   333.299 kHz    613.270000 MHz (aspect 16:10, no 3D stereo)
               Hfront   48 Hsync  32 Hback   80 Hpol N
               Vfront    3 Vsync   6 Vback   52 Vpol N
  Checksum: 0x87
Checksum: 0x90

----------------

Warnings:

Block 0, Base EDID:
  Vendor & Product Identification: The serial number is one of the known dummy values, it should probably be set to 0.
  Display Range Limits: GTF support is deprecated in EDID 1.4.
Block 1, CTA-861 Extension Block:
  Video Data Block: VIC 3 and the first DTD are not identical. Is this intended?
  Video Capability Data Block: IT scan behavior is expected to support underscanned.
  Video Capability Data Block: 'CE video formats not supported' makes no sense.
  Display Product Serial Number is set, so the Serial Number in the Base EDID should be 0.
EDID:
  Base EDID: Some timings are out of range of the Monitor Ranges:
    Horizontal Freq: 31.250 - 450.298 kHz (Monitor: 254.000 - 254.000 kHz)

Failures:

Block 0, Base EDID:
  Display Product Serial Number: ...
  Basic Display Parameters & Features: sRGB is signaled, but the chromaticities do not match.
Block 1, CTA-861 Extension Block:
  Vendor-Specific Data Block (HDMI), OUI 00-0C-03: HDMI VSDB Max TMDS rate is > 340.
  Vendor-Specific Data Block (HDMI), OUI 00-0C-03: The HDMI Specification requires EDID 1.3 instead of 1.4.
EDID:
  Extension Block 3 started with EDID header, ignoring Extension Blocks >= 3.
  CTA-861: Native progressive timings are a mix of several resolutions.
  DisplayID: Missing DisplayID Display Parameters Data Block.
  DisplayID: DisplayID expects at least one preferred timing.

EDID conformity: FAIL
