edid-decode (hex):

00 ff ff ff ff ff ff 00 1e f9 1d 06 01 01 01 01
0c 11 01 04 a5 1e 17 89 e2 37 25 9e 58 4a 97 26
19 50 54 af ce 00 01 01 01 01 01 01 01 01 01 01
01 01 01 01 01 01 c3 1e 00 20 41 00 20 30 10 60
13 00 30 e4 10 00 00 18 00 00 00 fc 00 46 50 44
31 35 36 35 0a 20 20 20 20 20 00 00 00 fd 00 38
4c 1e 3c 08 00 0a 20 20 20 20 20 20 00 00 00 ff
00 4b 37 33 20 35 30 56 20 30 30 31 31 36 00 c8

----------------

Block 0, Base EDID:
  EDID Structure Version & Revision: 1.4
  Vendor & Product Identification:
    Manufacturer: GWY
    Model: 1565
    Serial Number: ...
    Made in: week 12 of 2007
  Basic Display Parameters & Features:
    Digital display
    Bits per primary color channel: 8
    DisplayPort interface
    Maximum image size: 30 cm x 23 cm
    Gamma: 2.37
    DPMS levels: Standby Suspend Off
    Supported color formats: RGB 4:4:4
    First detailed timing includes the native pixel format and preferred refresh rate
  Color Characteristics:
    Red  : 0.6171, 0.3466
    Green: 0.2900, 0.5927
    Blue : 0.1484, 0.0996
    White: 0.3134, 0.3291
  Established Timings I & II:
    IBM     :   720x400    70.081663 Hz   9:5     31.467 kHz     28.320000 MHz
    DMT 0x04:   640x480    59.940476 Hz   4:3     31.469 kHz     25.175000 MHz
    DMT 0x05:   640x480    72.808802 Hz   4:3     37.861 kHz     31.500000 MHz
    DMT 0x06:   640x480    75.000000 Hz   4:3     37.500 kHz     31.500000 MHz
    DMT 0x08:   800x600    56.250000 Hz   4:3     35.156 kHz     36.000000 MHz
    DMT 0x09:   800x600    60.316541 Hz   4:3     37.879 kHz     40.000000 MHz
    DMT 0x0a:   800x600    72.187572 Hz   4:3     48.077 kHz     50.000000 MHz
    DMT 0x0b:   800x600    75.000000 Hz   4:3     46.875 kHz     49.500000 MHz
    DMT 0x10:  1024x768    60.003840 Hz   4:3     48.363 kHz     65.000000 MHz
    DMT 0x11:  1024x768    70.069359 Hz   4:3     56.476 kHz     75.000000 MHz
    DMT 0x12:  1024x768    75.028582 Hz   4:3     60.023 kHz     78.750000 MHz
  Standard Timings: none
  Detailed Timing Descriptors:
    DTD 1:  1024x768    75.028582 Hz   4:3     60.023 kHz     78.750000 MHz (304 mm x 228 mm)
                 Hfront   16 Hsync  96 Hback  176 Hpol N
                 Vfront    1 Vsync   3 Vback   28 Vpol N
    Display Product Name: 'FPD1565'
    Display Range Limits:
      Monitor ranges (GTF): 56-76 Hz V, 30-60 kHz H, max dotclock 80 MHz
    Display Product Serial Number: ...
Checksum: 0xc8

----------------

Warnings:

Block 0, Base EDID:
  Vendor & Product Identification: The serial number is one of the known dummy values, it should probably be set to 0.
  Detailed Timing Descriptor #1: DTD is similar but not identical to DMT 0x12.
  Display Range Limits: GTF support is deprecated in EDID 1.4.

Failures:

Block 0, Base EDID:
  Display Range Limits: GTF is supported, but the display does not support continuous frequencies.

EDID conformity: FAIL
