edid-decode (hex):

00 ff ff ff ff ff ff 00 28 9a 3d 30 00 00 00 00
2b 20 01 04 95 1f 11 78 0a 31 25 96 5c 5a 93 2a
23 50 54 00 00 00 01 01 01 01 01 01 01 01 01 01
01 01 01 01 01 01 ce 1d 56 e2 50 00 1e 30 30 20
36 00 35 ae 10 00 00 1a 00 00 00 00 00 00 00 00
00 00 00 00 35 ae 10 00 00 1a 00 00 00 fe 00 48
53 44 20 31 34 2e 30 0a 20 20 20 20 00 00 00 fe
00 47 31 34 30 45 42 30 33 0a 20 20 20 20 00 11

00 ff ff ff ff ff ff 00 28 9a 3d 30 00 00 00 00
2b 20 01 04 95 1f 11 78 0a 31 25 96 5c 5a 93 2a
23 50 54 00 00 00 01 01 01 01 01 01 01 01 01 01
01 01 01 01 01 01 ce 1d 56 e2 50 00 1e 30 30 20
36 00 35 ae 10 00 00 1a 00 00 00 00 00 00 00 00
00 00 00 00 35 ae 10 00 00 1a 00 00 00 fe 00 48
53 44 20 31 34 2e 30 0a 20 20 20 20 00 00 00 fe
00 47 31 34 30 45 42 30 33 0a 20 20 20 20 00 11

----------------

Block 0, Base EDID:
  EDID Structure Version & Revision: 1.4
  Vendor & Product Identification:
    Manufacturer: JDZ
    Model: 12349
    Made in: week 43 of 2022
  Basic Display Parameters & Features:
    Digital display
    Bits per primary color channel: 6
    DisplayPort interface
    Maximum image size: 31 cm x 17 cm
    Gamma: 2.20
    Supported color formats: RGB 4:4:4, YCrCb 4:4:4
    First detailed timing includes the native pixel format and preferred refresh rate
  Color Characteristics:
    Red  : 0.5859, 0.3623
    Green: 0.3515, 0.5751
    Blue : 0.1640, 0.1386
    White: 0.3134, 0.3291
  Established Timings I & II: none
  Standard Timings: none
  Detailed Timing Descriptors:
    DTD 1:  1366x768    60.059067 Hz 683:384   47.927 kHz     76.300000 MHz (309 mm x 174 mm)
                 Hfront   48 Hsync  32 Hback  146 Hpol P
                 Vfront    3 Vsync   6 Vback   21 Vpol N
    Manufacturer-Specified Display Descriptor (0x00): 00 00 00 00 00 00 00 00 00 00 35 ae 10 00 00 1a '..........5.....'
    Alphanumeric Data String: 'HSD 14.0'
    Alphanumeric Data String: 'G140EB03'
Checksum: 0x11

----------------

Warnings:

Block 0, Base EDID:
  Missing Display Product Name.

Failures:

EDID:
  Extension Block 1 started with EDID header, ignoring Extension Blocks >= 1.

EDID conformity: FAIL
