edid-decode (hex):

00 ff ff ff ff ff ff 00 30 ae ec 66 01 01 01 01
1d 20 01 04 b5 3e 23 78 3f 64 35 a5 54 4f 9e 27
12 50 54 23 08 00 d1 c0 81 80 49 40 81 c0 95 00
a9 c0 71 40 b3 00 1a cb 00 3c f0 70 3e 80 08 20
35 00 6c 5e 21 00 00 1a 00 00 00 fc 00 4c 32 38
75 2d 33 35 0a 20 20 20 20 20 00 00 00 fd 00 28
3c 86 86 3c 01 0a 20 20 20 20 20 20 00 00 00 ff
00 55 31 41 4b 56 39 30 37 0a 20 20 20 20 01 71

02 03 3b f2 57 04 05 10 13 14 1f 20 21 22 27 48
49 4a 4b 4c 5d 5e 5f 04 04 69 67 68 e2 00 c0 23
09 7f 07 83 01 00 00 e3 05 c0 00 e6 06 05 01 69
69 4f 68 1a 00 00 01 01 28 3c 00 1a cb 00 3c f0
70 3e 80 08 20 35 00 6c 5e 21 00 00 1e 56 5e 00
a0 a0 a0 29 50 30 20 35 00 6c 5e 21 00 00 1e 66
21 56 aa 51 00 1e 30 46 8f 33 00 6c 5e 21 00 00
1e 00 00 00 00 00 00 00 00 00 00 00 00 00 00 d0

00 ff ff ff ff ff ff 00 30 ae ec 66 01 01 01 01
1d 20 01 04 b5 3e 23 78 3f 64 35 a5 54 4f 9e 27
12 50 54 23 08 00 d1 c0 81 80 49 40 81 c0 95 00
a9 c0 71 40 b3 00 1a cb 00 3c f0 70 3e 80 08 20
35 00 6c 5e 21 00 00 1a 00 00 00 fc 00 4c 32 38
75 2d 33 35 0a 20 20 20 20 20 00 00 00 fd 00 28
3c 86 86 3c 01 0a 20 20 20 20 20 20 00 00 00 ff
00 55 31 41 4b 56 39 30 37 0a 20 20 20 20 01 71

02 03 3b f2 57 04 05 10 13 14 1f 20 21 22 27 48
49 4a 4b 4c 5d 5e 5f 04 04 69 67 68 e2 00 c0 23
09 7f 07 83 01 00 00 e3 05 c0 00 e6 06 05 01 69
69 4f 68 1a 00 00 01 01 28 3c 00 1a cb 00 3c f0
70 3e 80 08 20 35 00 6c 5e 21 00 00 1e 56 5e 00
a0 a0 a0 29 50 30 20 35 00 6c 5e 21 00 00 1e 66
21 56 aa 51 00 1e 30 46 8f 33 00 6c 5e 21 00 00
1e 00 00 00 00 00 00 00 00 00 00 00 00 00 00 d0

----------------

Block 0, Base EDID:
  EDID Structure Version & Revision: 1.4
  Vendor & Product Identification:
    Manufacturer: LEN
    Model: 26348
    Serial Number: ...
    Made in: week 29 of 2022
  Basic Display Parameters & Features:
    Digital display
    Bits per primary color channel: 10
    DisplayPort interface
    Maximum image size: 62 cm x 35 cm
    Gamma: 2.20
    DPMS levels: Off
    Supported color formats: RGB 4:4:4, YCrCb 4:4:4, YCrCb 4:2:2
    Default (sRGB) color space is primary color space
    First detailed timing includes the native pixel format and preferred refresh rate
    Display supports continuous frequencies
  Color Characteristics:
    Red  : 0.6455, 0.3300
    Green: 0.3095, 0.6171
    Blue : 0.1523, 0.0732
    White: 0.3134, 0.3291
  Established Timings I & II:
    DMT 0x04:   640x480    59.940476 Hz   4:3     31.469 kHz     25.175000 MHz
    DMT 0x08:   800x600    56.250000 Hz   4:3     35.156 kHz     36.000000 MHz
    DMT 0x09:   800x600    60.316541 Hz   4:3     37.879 kHz     40.000000 MHz
    DMT 0x10:  1024x768    60.003840 Hz   4:3     48.363 kHz     65.000000 MHz
  Standard Timings:
    DMT 0x52:  1920x1080   60.000000 Hz  16:9     67.500 kHz    148.500000 MHz
    DMT 0x23:  1280x1024   60.019740 Hz   5:4     63.981 kHz    108.000000 MHz
    GTF     :   832x624    60.000404 Hz   4:3     38.760 kHz     41.551000 MHz
    DMT 0x55:  1280x720    60.000000 Hz  16:9     45.000 kHz     74.250000 MHz
    DMT 0x2f:  1440x900    59.887445 Hz  16:10    55.935 kHz    106.500000 MHz
    DMT 0x53:  1600x900    60.000000 Hz  16:9     60.000 kHz    108.000000 MHz (RB)
    GTF     :  1152x864    60.000000 Hz   4:3     53.700 kHz     81.624000 MHz
    DMT 0x3a:  1680x1050   59.954250 Hz  16:10    65.290 kHz    146.250000 MHz
  Detailed Timing Descriptors:
    DTD 1:  3840x2160   59.999077 Hz  16:9    133.318 kHz    519.940000 MHz (620 mm x 350 mm)
                 Hfront    8 Hsync  32 Hback   20 Hpol P
                 Vfront    3 Vsync   5 Vback   54 Vpol N
    Display Product Name: 'L28u-35'
    Display Range Limits:
      Monitor ranges (Range Limits Only): 40-60 Hz V, 134-134 kHz H, max dotclock 600 MHz
    Display Product Serial Number: ...
  Extension blocks: 1
Checksum: 0x71

----------------

Block 1, CTA-861 Extension Block:
  Revision: 3
  Underscans IT Video Formats by default
  Basic audio support
  Supports YCbCr 4:4:4
  Supports YCbCr 4:2:2
  Native DTDs: 2
  Video Data Block:
    VIC   4:  1280x720    60.000000 Hz  16:9     45.000 kHz     74.250000 MHz
    VIC   5:  1920x1080i  60.000000 Hz  16:9     33.750 kHz     74.250000 MHz
    VIC  16:  1920x1080   60.000000 Hz  16:9     67.500 kHz    148.500000 MHz
    VIC  19:  1280x720    50.000000 Hz  16:9     37.500 kHz     74.250000 MHz
    VIC  20:  1920x1080i  50.000000 Hz  16:9     28.125 kHz     74.250000 MHz
    VIC  31:  1920x1080   50.000000 Hz  16:9     56.250 kHz    148.500000 MHz
    VIC  32:  1920x1080   24.000000 Hz  16:9     27.000 kHz     74.250000 MHz
    VIC  33:  1920x1080   25.000000 Hz  16:9     28.125 kHz     74.250000 MHz
    VIC  34:  1920x1080   30.000000 Hz  16:9     33.750 kHz     74.250000 MHz
    VIC  39:  1920x1080i  50.000000 Hz  16:9     31.250 kHz     72.000000 MHz
    VIC  72:  1920x1080   24.000000 Hz  64:27    27.000 kHz     74.250000 MHz
    VIC  73:  1920x1080   25.000000 Hz  64:27    28.125 kHz     74.250000 MHz
    VIC  74:  1920x1080   30.000000 Hz  64:27    33.750 kHz     74.250000 MHz
    VIC  75:  1920x1080   50.000000 Hz  64:27    56.250 kHz    148.500000 MHz
    VIC  76:  1920x1080   60.000000 Hz  64:27    67.500 kHz    148.500000 MHz
    VIC  93:  3840x2160   24.000000 Hz  16:9     54.000 kHz    297.000000 MHz
    VIC  94:  3840x2160   25.000000 Hz  16:9     56.250 kHz    297.000000 MHz
    VIC  95:  3840x2160   30.000000 Hz  16:9     67.500 kHz    297.000000 MHz
    VIC   4:  1280x720    60.000000 Hz  16:9     45.000 kHz     74.250000 MHz
    VIC   4:  1280x720    60.000000 Hz  16:9     45.000 kHz     74.250000 MHz
    VIC 105:  3840x2160   30.000000 Hz  64:27    67.500 kHz    297.000000 MHz
    VIC 103:  3840x2160   24.000000 Hz  64:27    54.000 kHz    297.000000 MHz
    VIC 104:  3840x2160   25.000000 Hz  64:27    56.250 kHz    297.000000 MHz
  Video Capability Data Block:
    YCbCr quantization: Selectable (via AVI YQ)
    RGB quantization: Selectable (via AVI Q)
    PT scan behavior: No Data
    IT scan behavior: IT video formats not supported
    CE scan behavior: CE video formats not supported
  Audio Data Block:
    Linear PCM:
      Max channels: 2
      Supported sample rates (kHz): 192 176.4 96 88.2 48 44.1 32
      Supported sample sizes (bits): 24 20 16
  Speaker Allocation Data Block:
    FL/FR - Front Left/Right
  Colorimetry Data Block:
    BT2020YCC
    BT2020RGB
  HDR Static Metadata Data Block:
    Electro optical transfer functions:
      Traditional gamma - SDR luminance range
      SMPTE ST2084
    Supported static metadata descriptors:
      Static metadata type 1
    Desired content max luminance: 105 (486.099 cd/m^2)
    Desired content max frame-average luminance: 105 (486.099 cd/m^2)
    Desired content min luminance: 79 (0.467 cd/m^2)
  Vendor-Specific Data Block (AMD), OUI 00-00-1A:
    Version: 1
    Flags 1: 0x01
      FreeSync Supported
    Minimum Refresh Rate: 40 Hz
    Maximum Refresh Rate: 60 Hz
  Detailed Timing Descriptors:
    DTD 2:  3840x2160   59.999077 Hz  16:9    133.318 kHz    519.940000 MHz (620 mm x 350 mm)
                 Hfront    8 Hsync  32 Hback   20 Hpol P
                 Vfront    3 Vsync   5 Vback   54 Vpol P
    DTD 3:  2560x1440   59.950550 Hz  16:9     88.787 kHz    241.500000 MHz (620 mm x 350 mm)
                 Hfront   48 Hsync  32 Hback   80 Hpol P
                 Vfront    3 Vsync   5 Vback   33 Vpol P
    DTD 4:  1366x768    59.789541 Hz 683:384   47.712 kHz     85.500000 MHz (620 mm x 350 mm)
                 Hfront   70 Hsync 143 Hback  213 Hpol P
                 Vfront    3 Vsync   3 Vback   24 Vpol P
Checksum: 0xd0  Unused space in Extension Block: 14 bytes

----------------

Warnings:

Block 0, Base EDID:
  Vendor & Product Identification: The serial number is one of the known dummy values, it should probably be set to 0.
Block 1, CTA-861 Extension Block:
  Video Data Block: VIC 4 and the first DTD are not identical. Is this intended?
  Video Capability Data Block: IT scan behavior is expected to support underscanned.
  Video Capability Data Block: 'CE video formats not supported' makes no sense.
  Display Product Serial Number is set, so the Serial Number in the Base EDID should be 0.
EDID:
  Base EDID: Some timings are out of range of the Monitor Ranges:
    Vertical Freq: 24.000 - 60.317 Hz (Monitor: 40.000 - 60.000 Hz)
    Horizontal Freq: 27.000 - 133.317 kHz (Monitor: 134.000 - 134.000 kHz)

Failures:

Block 0, Base EDID:
  Basic Display Parameters & Features: sRGB is signaled, but the chromaticities do not match.
Block 1, CTA-861 Extension Block:
  Video Data Block: Duplicate VIC 4.
EDID:
  Extension Block 2 started with EDID header, ignoring Extension Blocks >= 2.

EDID conformity: FAIL
