edid-decode (hex):

00 ff ff ff ff ff ff 00 06 10 18 92 08 06 00 02
22 0d 01 03 80 31 1f 78 2e dc 45 a3 54 4c 96 25
12 50 54 00 00 00 01 01 01 01 01 01 01 01 01 01
01 01 01 01 01 01 8c 3c 80 e0 70 b0 0c 40 40 20
33 00 ef 36 11 00 00 1e 00 00 00 fc 00 41 70 70
6c 65 20 43 69 6e 65 6d 61 20 00 00 00 fc 00 48
44 20 44 69 73 70 6c 61 79 0a 00 00 00 00 00 00
00 06 10 03 00 1c 00 03 00 00 00 00 00 01 00 f1

00 ff ff ff ff ff ff 00 06 10 18 92 08 06 00 02
22 0d 01 03 80 31 1f 78 2e dc 45 a3 54 4c 96 25
12 50 54 00 00 00 01 01 01 01 01 01 01 01 01 01
01 01 01 01 01 01 8c 3c 80 e0 70 b0 0c 40 40 20
33 00 ef 36 11 00 00 1e 00 00 00 fc 00 41 70 70
6c 65 20 43 69 6e 65 6d 61 20 00 00 00 fc 00 48
44 20 44 69 73 70 6c 61 79 0a 00 00 00 00 00 00
00 06 10 03 00 1c 00 03 00 00 00 00 00 01 00 f1

----------------

Block 0, Base EDID:
  EDID Structure Version & Revision: 1.3
  Vendor & Product Identification:
    Manufacturer: APP
    Model: 37400
    Serial Number: ...
    Made in: week 34 of 2003
  Basic Display Parameters & Features:
    Digital display
    Maximum image size: 49 cm x 31 cm
    Gamma: 2.20
    DPMS levels: Off
    RGB color display
    Default (sRGB) color space is primary color space
    First detailed timing is the preferred timing
  Color Characteristics:
    Red  : 0.6396, 0.3291
    Green: 0.2998, 0.5859
    Blue : 0.1455, 0.0703
    White: 0.3134, 0.3291
  Established Timings I & II: none
  Standard Timings: none
  Detailed Timing Descriptors:
    DTD 1:  1920x1200   59.649155 Hz  16:10    72.295 kHz    155.000000 MHz (495 mm x 310 mm)
                 Hfront   64 Hsync  32 Hback  128 Hpol P
                 Vfront    3 Vsync   3 Vback    6 Vpol P
    Display Product Name: 'Apple Cinema '
    Display Product Name: 'HD Display'
    Manufacturer-Specified Display Descriptor (0x00): 00 00 00 06 10 03 00 1c 00 03 00 00 00 00 00 01 '................'
Checksum: 0xf1

----------------

Block 1, Unknown EDID Extension Block 0x00:
  00 ff ff ff ff ff ff 00 06 10 18 92 08 06 00 02 '................'
  22 0d 01 03 80 31 1f 78 2e dc 45 a3 54 4c 96 25 '"....1.x..E.TL.%'
  12 50 54 00 00 00 01 01 01 01 01 01 01 01 01 01 '.PT.............'
  01 01 01 01 01 01 8c 3c 80 e0 70 b0 0c 40 40 20 '.......<..p..@@ '
  33 00 ef 36 11 00 00 1e 00 00 00 fc 00 41 70 70 '3..6.........App'
  6c 65 20 43 69 6e 65 6d 61 20 00 00 00 fc 00 48 'le Cinema .....H'
  44 20 44 69 73 70 6c 61 79 0a 00 00 00 00 00 00 'D Display.......'
  00 06 10 03 00 1c 00 03 00 00 00 00 00 01 00 f1 '................'
Checksum: 0xf1

----------------

Failures:

Block 0, Base EDID:
  Basic Display Parameters & Features: sRGB is signaled, but the chromaticities do not match.
  Display Product Name: No newline, but one or more trailing spaces.
  Display Product Name: Non-space after newline.
  Missing Display Range Limits Descriptor.
Block 1, Base EDID:
  Unknown Extension Block.
EDID:
  Base EDID: EDID specified 0 extension block(s), but found 1 extension block(s).

EDID conformity: FAIL
