edid-decode (hex):

00 ff ff ff ff ff ff 00 10 ac 3a d0 49 47 39 30
10 17 01 03 0e 29 17 78 ea 2c c5 a4 56 50 a1 28
0f 50 54 a5 4b 00 01 01 01 01 01 01 01 01 01 01
01 01 01 01 01 01 66 21 56 aa 51 00 1e 30 46 8f
33 00 9a e6 10 00 00 1e 00 00 00 ff 00 34 46 46
34 37 33 34 4a 30 39 47 49 0a 00 00 00 fc 00 44
45 4c 4c 20 45 31 39 31 34 48 0a 20 00 00 00 fd
00 38 4b 1e 53 09 00 0a 20 20 20 20 20 20 00 74

00 ff ff ff ff ff ff 00 10 ac 3a d0 49 47 39 30
10 17 01 03 0e 29 17 78 ea 2c c5 a4 56 50 a1 28
0f 50 54 a5 4b 00 01 01 01 01 01 01 01 01 01 01
01 01 01 01 01 01 66 21 56 aa 51 00 1e 30 46 8f
33 00 9a e6 10 00 00 1e 00 00 00 ff 00 34 46 46
34 37 33 34 4a 30 39 47 49 0a 00 00 00 fc 00 44
45 4c 4c 20 45 31 39 31 34 48 0a 20 00 00 00 fd
00 38 4b 1e 53 09 00 0a 20 20 20 20 20 20 00 74

----------------

Block 0, Base EDID:
  EDID Structure Version & Revision: 1.3
  Vendor & Product Identification:
    Manufacturer: DEL
    Model: 53306
    Serial Number: ...
    Made in: week 16 of 2013
  Basic Display Parameters & Features:
    Analog display
    Signal Level Standard: 0.700 : 0.300 : 1.000 V p-p
    Blank level equals black level
    Sync: Separate Composite SyncOnGreen
    Maximum image size: 41 cm x 23 cm
    Gamma: 2.20
    DPMS levels: Standby Suspend Off
    RGB color display
    First detailed timing is the preferred timing
  Color Characteristics:
    Red  : 0.6406, 0.3378
    Green: 0.3154, 0.6289
    Blue : 0.1591, 0.0585
    White: 0.3134, 0.3291
  Established Timings I & II:
    IBM     :   720x400    70.081663 Hz   9:5     31.467 kHz     28.320000 MHz
    DMT 0x04:   640x480    59.940476 Hz   4:3     31.469 kHz     25.175000 MHz
    DMT 0x06:   640x480    75.000000 Hz   4:3     37.500 kHz     31.500000 MHz
    DMT 0x09:   800x600    60.316541 Hz   4:3     37.879 kHz     40.000000 MHz
    DMT 0x0b:   800x600    75.000000 Hz   4:3     46.875 kHz     49.500000 MHz
    DMT 0x10:  1024x768    60.003840 Hz   4:3     48.363 kHz     65.000000 MHz
    DMT 0x12:  1024x768    75.028582 Hz   4:3     60.023 kHz     78.750000 MHz
    DMT 0x24:  1280x1024   75.024675 Hz   5:4     79.976 kHz    135.000000 MHz
  Standard Timings: none
  Detailed Timing Descriptors:
    DTD 1:  1366x768    59.789541 Hz 683:384   47.712 kHz     85.500000 MHz (410 mm x 230 mm)
                 Hfront   70 Hsync 143 Hback  213 Hpol P
                 Vfront    3 Vsync   3 Vback   24 Vpol P
    Display Product Serial Number: ...
    Display Product Name: 'DELL E1914H'
    Display Range Limits:
      Monitor ranges (GTF): 56-75 Hz V, 30-83 kHz H, max dotclock 90 MHz
Checksum: 0x74

----------------

Warnings:

EDID:
  Base EDID: Some timings are out of range of the Monitor Ranges:
    Maximum Clock: 135.000 MHz (Monitor: 90.000 MHz)

Failures:

EDID:
  Extension Block 1 started with EDID header, ignoring Extension Blocks >= 1.

EDID conformity: FAIL
