edid-decode (hex):

00 ff ff ff ff ff ff 00 4e 14 42 85 00 00 00 00
16 20 01 03 a0 50 21 78 2a d4 15 a1 57 56 9c 25
0b 50 54 ad cf 00 81 c0 81 00 81 40 81 80 95 00
a9 c0 b3 00 d1 c0 d6 7e 70 d6 d0 a0 29 50 30 20
35 00 1d 4e 31 00 00 1a 00 00 00 fd 00 30 78 1e
aa 3c 00 0a 20 20 20 20 20 20 00 00 00 fc 00 53
63 65 70 74 72 65 20 4f 33 34 0a 20 e4 6f 70 18
d1 a0 64 50 30 20 35 00 1d 4e 31 00 00 12 01 d0

02 03 42 f3 46 01 02 03 04 90 3f 23 09 07 07 83
01 00 00 e2 00 ca 6a 03 0c 00 10 00 38 78 20 00
00 67 d8 5d c4 01 78 80 03 6d 1a 00 00 02 01 30
78 ed 00 00 00 00 00 e3 05 e3 01 e6 06 07 01 60
60 00 62 d3 70 d6 d0 a0 29 50 58 40 45 00 fe 1f
11 00 00 1e cd 5f 00 c8 a0 a0 29 50 30 20 35 00
fe 1f 11 00 00 1e 8a 6f 80 a0 70 38 40 40 30 20
35 00 fe 19 11 00 00 7f 00 00 00 00 00 00 00 71

00 ff ff ff ff ff ff 00 4e 14 42 85 00 00 00 00
16 20 01 03 a0 50 21 78 2a d4 15 a1 57 56 9c 25
0b 50 54 ad cf 00 81 c0 81 00 81 40 81 80 95 00
a9 c0 b3 00 d1 c0 d6 7e 70 d6 d0 a0 29 50 30 20
35 00 1d 4e 31 00 00 1a 00 00 00 fd 00 30 78 1e
aa 3c 00 0a 20 20 20 20 20 20 00 00 00 fc 00 53
63 65 70 74 72 65 20 4f 33 34 0a 20 e4 6f 70 18
d1 a0 64 50 30 20 35 00 1d 4e 31 00 00 12 01 d0

02 03 42 f3 46 01 02 03 04 90 3f 23 09 07 07 83
01 00 00 e2 00 ca 6a 03 0c 00 10 00 38 78 20 00
00 67 d8 5d c4 01 78 80 03 6d 1a 00 00 02 01 30
78 ed 00 00 00 00 00 e3 05 e3 01 e6 06 07 01 60
60 00 62 d3 70 d6 d0 a0 29 50 58 40 45 00 fe 1f
11 00 00 1e cd 5f 00 c8 a0 a0 29 50 30 20 35 00
fe 1f 11 00 00 1e 8a 6f 80 a0 70 38 40 40 30 20
35 00 fe 19 11 00 00 7f 00 00 00 00 00 00 00 71

----------------

Block 0, Base EDID:
  EDID Structure Version & Revision: 1.3
  Vendor & Product Identification:
    Manufacturer: SPT
    Model: 34114
    Made in: week 22 of 2022
  Basic Display Parameters & Features:
    Digital display
    Maximum image size: 80 cm x 33 cm
    Gamma: 2.20
    DPMS levels: Off
    RGB color display
    First detailed timing is the preferred timing
  Color Characteristics:
    Red  : 0.6318, 0.3408
    Green: 0.3369, 0.6093
    Blue : 0.1445, 0.0439
    White: 0.3134, 0.3291
  Established Timings I & II:
    IBM     :   720x400    70.081663 Hz   9:5     31.467 kHz     28.320000 MHz
    DMT 0x04:   640x480    59.940476 Hz   4:3     31.469 kHz     25.175000 MHz
    DMT 0x05:   640x480    72.808802 Hz   4:3     37.861 kHz     31.500000 MHz
    DMT 0x06:   640x480    75.000000 Hz   4:3     37.500 kHz     31.500000 MHz
    DMT 0x09:   800x600    60.316541 Hz   4:3     37.879 kHz     40.000000 MHz
    DMT 0x0a:   800x600    72.187572 Hz   4:3     48.077 kHz     50.000000 MHz
    DMT 0x0b:   800x600    75.000000 Hz   4:3     46.875 kHz     49.500000 MHz
    DMT 0x10:  1024x768    60.003840 Hz   4:3     48.363 kHz     65.000000 MHz
    DMT 0x11:  1024x768    70.069359 Hz   4:3     56.476 kHz     75.000000 MHz
    DMT 0x12:  1024x768    75.028582 Hz   4:3     60.023 kHz     78.750000 MHz
    DMT 0x24:  1280x1024   75.024675 Hz   5:4     79.976 kHz    135.000000 MHz
  Standard Timings:
    DMT 0x55:  1280x720    60.000000 Hz  16:9     45.000 kHz     74.250000 MHz
    DMT 0x1c:  1280x800    59.810326 Hz  16:10    49.702 kHz     83.500000 MHz
    DMT 0x20:  1280x960    60.000000 Hz   4:3     60.000 kHz    108.000000 MHz
    DMT 0x23:  1280x1024   60.019740 Hz   5:4     63.981 kHz    108.000000 MHz
    DMT 0x2f:  1440x900    59.887445 Hz  16:10    55.935 kHz    106.500000 MHz
    DMT 0x53:  1600x900    60.000000 Hz  16:9     60.000 kHz    108.000000 MHz (RB)
    DMT 0x3a:  1680x1050   59.954250 Hz  16:10    65.290 kHz    146.250000 MHz
    DMT 0x52:  1920x1080   60.000000 Hz  16:9     67.500 kHz    148.500000 MHz
  Detailed Timing Descriptors:
    DTD 1:  3440x1440   60.001027 Hz  43:18    88.862 kHz    324.700000 MHz (797 mm x 334 mm)
                 Hfront   48 Hsync  32 Hback  134 Hpol P
                 Vfront    3 Vsync   5 Vback   33 Vpol N
    Display Range Limits:
      Monitor ranges (GTF): 48-120 Hz V, 30-170 kHz H, max dotclock 600 MHz
    Display Product Name: 'Sceptre O34'
    DTD 2:  3440x1440   50.000000 Hz  43:18    77.000 kHz    286.440000 MHz (digital composite, 797 mm x 334 mm)
                 Hfront   48 Hsync  32 Hback  200 Hpol P
                 Vfront    3 Vsync   5 Vback   92
  Extension blocks: 1
Checksum: 0xd0

----------------

Block 1, CTA-861 Extension Block:
  Revision: 3
  Underscans IT Video Formats by default
  Basic audio support
  Supports YCbCr 4:4:4
  Supports YCbCr 4:2:2
  Native DTDs: 3
  Video Data Block:
    VIC   1:   640x480    59.940476 Hz   4:3     31.469 kHz     25.175000 MHz
    VIC   2:   720x480    59.940060 Hz   4:3     31.469 kHz     27.000000 MHz
    VIC   3:   720x480    59.940060 Hz  16:9     31.469 kHz     27.000000 MHz
    VIC   4:  1280x720    60.000000 Hz  16:9     45.000 kHz     74.250000 MHz
    VIC  16:  1920x1080   60.000000 Hz  16:9     67.500 kHz    148.500000 MHz (native)
    VIC  63:  1920x1080  120.000000 Hz  16:9    135.000 kHz    297.000000 MHz
  Audio Data Block:
    Linear PCM:
      Max channels: 2
      Supported sample rates (kHz): 48 44.1 32
      Supported sample sizes (bits): 24 20 16
  Speaker Allocation Data Block:
    FL/FR - Front Left/Right
  Video Capability Data Block:
    YCbCr quantization: Selectable (via AVI YQ)
    RGB quantization: Selectable (via AVI Q)
    PT scan behavior: No Data
    IT scan behavior: Always Underscanned
    CE scan behavior: Always Underscanned
  Vendor-Specific Data Block (HDMI), OUI 00-0C-03:
    Source physical address: 1.0.0.0
    DC_36bit
    DC_30bit
    DC_Y444
    Maximum TMDS clock: 600 MHz
    Extended HDMI video details:
  Vendor-Specific Data Block (HDMI Forum), OUI C4-5D-D8:
    Version: 1
    Maximum TMDS Character Rate: 600 MHz
    SCDC Present
    Supports 12-bits/component Deep Color 4:2:0 Pixel Encoding
    Supports 10-bits/component Deep Color 4:2:0 Pixel Encoding
  Vendor-Specific Data Block (AMD), OUI 00-00-1A:
    Version: 2
    Flags 1: 0x01
      FreeSync Supported
    Minimum Refresh Rate: 48 Hz
    Maximum Refresh Rate: 120 Hz
    MCCS VCP Code: 0xed
    Flags 5: 0x00
  Colorimetry Data Block:
    xvYCC601
    xvYCC709
    BT2020cYCC
    BT2020YCC
    BT2020RGB
    Gamut Boundary Description Metadata Profile P0
  HDR Static Metadata Data Block:
    Electro optical transfer functions:
      Traditional gamma - SDR luminance range
      Traditional gamma - HDR luminance range
      SMPTE ST2084
    Supported static metadata descriptors:
      Static metadata type 1
    Desired content max luminance: 96 (400.000 cd/m^2)
    Desired content max frame-average luminance: 96 (400.000 cd/m^2)
    Desired content min luminance: 0 (0.000 cd/m^2)
  Detailed Timing Descriptors:
    DTD 3:  3440x1440   99.996785 Hz  43:18   148.095 kHz    541.140000 MHz (510 mm x 287 mm)
                 Hfront   88 Hsync  64 Hback   62 Hpol P
                 Vfront    4 Vsync   5 Vback   32 Vpol P
    DTD 4:  2560x1440   59.999119 Hz  16:9     88.859 kHz    245.250000 MHz (510 mm x 287 mm)
                 Hfront   48 Hsync  32 Hback  120 Hpol P
                 Vfront    3 Vsync   5 Vback   33 Vpol P
    DTD 5:  1920x1080  119.998991 Hz  16:9    137.279 kHz    285.540000 MHz (side by side interleaved, 510 mm x 281 mm)
                 Hfront   48 Hsync  32 Hback   80 Hpol P
                 Vfront    3 Vsync   5 Vback   56 Vpol P
Checksum: 0x71  Unused space in Extension Block: 7 bytes

----------------

Warnings:

Block 1, CTA-861 Extension Block:
  Video Data Block: VIC 1 and the first DTD are not identical. Is this intended?
  Video Data Block: All VICs are in ascending order, and the first (preferred) VIC <= 4, is that intended?
  Colorimetry Data Block: Set the sRGB colorimetry bit to avoid interop issues.
  Detailed Timing Descriptor #3: Image size is 510x287 mm, but based on the picture AR it should be 510x213 mm.

Failures:

Block 0, Base EDID:
  Basic Display Parameters & Features: Digital Video Interface Standard set to reserved value 0x20.
  Detailed Timing Descriptor #2: Invalid detailed timing descriptor ordering.
Block 1, CTA-861 Extension Block:
  Vendor-Specific Data Block (HDMI), OUI 00-0C-03: HDMI VSDB Max TMDS rate is > 340.
  Detailed Timing Descriptor #3: Mismatch of image size 510x287 mm vs display size 800x330 mm.
  Detailed Timing Descriptor #4: Mismatch of image size 510x287 mm vs display size 800x330 mm.
  Detailed Timing Descriptor #5: Mismatch of image size 510x281 mm vs display size 800x330 mm.
EDID:
  Extension Block 2 started with EDID header, ignoring Extension Blocks >= 2.
  CTA-861: Native progressive timings are a mix of several resolutions.

EDID conformity: FAIL
