edid-decode (hex):

00 ff ff ff ff ff ff 00 06 10 2c 9c 00 00 00 00
01 0d 01 03 80 25 17 78 0a 03 1d 9c 57 53 8c 25
1d 51 54 00 00 00 01 01 01 01 01 01 01 01 01 01
01 01 01 01 01 01 95 25 a0 40 51 84 0c 30 40 20
33 00 6f e6 10 00 00 18 00 00 00 01 00 06 10 30
00 00 00 00 00 00 00 00 0a 20 00 00 00 fe 00 4c
50 31 37 31 57 30 31 00 00 00 0a 20 00 00 00 fc
00 43 6f 6c 6f 72 20 4c 43 44 0a 20 20 20 00 56

----------------

Block 0, Base EDID:
  EDID Structure Version & Revision: 1.3
  Vendor & Product Identification:
    Manufacturer: APP
    Model: 39980
    Made in: week 1 of 2003
  Basic Display Parameters & Features:
    Digital display
    Maximum image size: 37 cm x 23 cm
    Gamma: 2.20
    RGB color display
    First detailed timing is the preferred timing
  Color Characteristics:
    Red  : 0.6093, 0.3398
    Green: 0.3242, 0.5498
    Blue : 0.1445, 0.1142
    White: 0.3193, 0.3291
  Established Timings I & II: none
  Standard Timings: none
  Detailed Timing Descriptors:
    DTD 1:  1440x900    59.939444 Hz  16:10    54.665 kHz     96.210000 MHz (367 mm x 230 mm)
                 Hfront   64 Hsync  32 Hback  224 Hpol N
                 Vfront    3 Vsync   3 Vback    6 Vpol N
    Manufacturer-Specified Display Descriptor (0x01): 00 01 00 06 10 30 00 00 00 00 00 00 00 00 0a 20 '.....0......... '
    Alphanumeric Data String: 'LP171W01'
    Display Product Name: 'Color LCD'
Checksum: 0x56

----------------

Failures:

Block 0, Base EDID:
  Alphanumeric Data String: NUL byte at position 8.
  Missing Display Range Limits Descriptor.

EDID conformity: FAIL
