edid-decode (hex):

00 ff ff ff ff ff ff 00 5c 23 76 10 b6 00 00 00
2f 20 01 03 80 3b 21 78 2a 6c 35 af 4f 33 bd 26
0c 50 54 a1 08 00 d1 c0 81 80 81 c0 a9 40 01 01
01 01 01 01 01 01 4d d0 00 a0 f0 70 3e 80 30 20
35 00 54 4f 21 00 00 1a 00 00 00 fc 00 43 69 6e
74 69 71 20 50 72 6f 20 32 37 00 00 00 fd 00 17
78 1b ff 77 00 0a 20 20 20 20 20 20 00 00 00 ff
00 32 4b 48 30 31 41 31 30 30 30 31 38 32 01 82

02 03 6c b0 4e 61 60 72 5d 3f 10 1f 6f 20 04 13
12 03 01 e2 00 ea 6b 03 0c 00 10 00 38 3c 20 00
20 03 6d d8 5d c4 01 78 80 31 00 00 00 81 35 0c
e3 05 c0 81 e2 0e 76 e6 06 0d 01 60 60 00 f6 22
02 5b 6a 10 04 ff 0e 4f 00 07 80 1f 00 6f 08 7e
00 70 00 07 00 f6 22 02 2f 5f 07 04 ff 09 4f 00
07 80 1f 00 9f 05 54 00 46 00 07 00 56 5e 00 a0
a0 a0 29 50 30 20 35 00 54 4f 21 00 00 1a 00 69

00 ff ff ff ff ff ff 00 5c 23 76 10 b6 00 00 00
2f 20 01 03 80 3b 21 78 2a 6c 35 af 4f 33 bd 26
0c 50 54 a1 08 00 d1 c0 81 80 81 c0 a9 40 01 01
01 01 01 01 01 01 4d d0 00 a0 f0 70 3e 80 30 20
35 00 54 4f 21 00 00 1a 00 00 00 fc 00 43 69 6e
74 69 71 20 50 72 6f 20 32 37 00 00 00 fd 00 17
78 1b ff 77 00 0a 20 20 20 20 20 20 00 00 00 ff
00 32 4b 48 30 31 41 31 30 30 30 31 38 32 01 82

02 03 6c b0 4e 61 60 72 5d 3f 10 1f 6f 20 04 13
12 03 01 e2 00 ea 6b 03 0c 00 10 00 38 3c 20 00
20 03 6d d8 5d c4 01 78 80 31 00 00 00 81 35 0c
e3 05 c0 81 e2 0e 76 e6 06 0d 01 60 60 00 f6 22
02 5b 6a 10 04 ff 0e 4f 00 07 80 1f 00 6f 08 7e
00 70 00 07 00 f6 22 02 2f 5f 07 04 ff 09 4f 00
07 80 1f 00 9f 05 54 00 46 00 07 00 56 5e 00 a0
a0 a0 29 50 30 20 35 00 54 4f 21 00 00 1a 00 69

----------------

Block 0, Base EDID:
  EDID Structure Version & Revision: 1.3
  Vendor & Product Identification:
    Manufacturer: WAC
    Model: 4214
    Serial Number: ...
    Made in: week 47 of 2022
  Basic Display Parameters & Features:
    Digital display
    Maximum image size: 59 cm x 33 cm
    Gamma: 2.20
    DPMS levels: Off
    RGB color display
    First detailed timing is the preferred timing
  Color Characteristics:
    Red  : 0.6845, 0.3105
    Green: 0.2021, 0.7382
    Blue : 0.1484, 0.0498
    White: 0.3134, 0.3291
  Established Timings I & II:
    IBM     :   720x400    70.081663 Hz   9:5     31.467 kHz     28.320000 MHz
    DMT 0x04:   640x480    59.940476 Hz   4:3     31.469 kHz     25.175000 MHz
    DMT 0x09:   800x600    60.316541 Hz   4:3     37.879 kHz     40.000000 MHz
    DMT 0x10:  1024x768    60.003840 Hz   4:3     48.363 kHz     65.000000 MHz
  Standard Timings:
    DMT 0x52:  1920x1080   60.000000 Hz  16:9     67.500 kHz    148.500000 MHz
    DMT 0x23:  1280x1024   60.019740 Hz   5:4     63.981 kHz    108.000000 MHz
    DMT 0x55:  1280x720    60.000000 Hz  16:9     45.000 kHz     74.250000 MHz
    DMT 0x33:  1600x1200   60.000000 Hz   4:3     75.000 kHz    162.000000 MHz
  Detailed Timing Descriptors:
    DTD 1:  3840x2160   59.996625 Hz  16:9    133.312 kHz    533.250000 MHz (596 mm x 335 mm)
                 Hfront   48 Hsync  32 Hback   80 Hpol P
                 Vfront    3 Vsync   5 Vback   54 Vpol N
    Display Product Name: 'Cintiq Pro 27'
    Display Range Limits:
      Monitor ranges (GTF): 23-120 Hz V, 27-255 kHz H, max dotclock 1190 MHz
    Display Product Serial Number: ...
  Extension blocks: 1
Checksum: 0x82

----------------

Block 1, CTA-861 Extension Block:
  Revision: 3
  Underscans IT Video Formats by default
  Supports YCbCr 4:4:4
  Supports YCbCr 4:2:2
  Native DTDs: 0
  Video Data Block:
    VIC  97:  3840x2160   60.000000 Hz  16:9    135.000 kHz    594.000000 MHz
    VIC  96:  3840x2160   50.000000 Hz  16:9    112.500 kHz    594.000000 MHz
    VIC 114:  3840x2160   48.000000 Hz  16:9    108.000 kHz    594.000000 MHz
    VIC  93:  3840x2160   24.000000 Hz  16:9     54.000 kHz    297.000000 MHz
    VIC  63:  1920x1080  120.000000 Hz  16:9    135.000 kHz    297.000000 MHz
    VIC  16:  1920x1080   60.000000 Hz  16:9     67.500 kHz    148.500000 MHz
    VIC  31:  1920x1080   50.000000 Hz  16:9     56.250 kHz    148.500000 MHz
    VIC 111:  1920x1080   48.000000 Hz  16:9     54.000 kHz    148.500000 MHz
    VIC  32:  1920x1080   24.000000 Hz  16:9     27.000 kHz     74.250000 MHz
    VIC   4:  1280x720    60.000000 Hz  16:9     45.000 kHz     74.250000 MHz
    VIC  19:  1280x720    50.000000 Hz  16:9     37.500 kHz     74.250000 MHz
    VIC  18:   720x576    50.000000 Hz  16:9     31.250 kHz     27.000000 MHz
    VIC   3:   720x480    59.940060 Hz  16:9     31.469 kHz     27.000000 MHz
    VIC   1:   640x480    59.940476 Hz   4:3     31.469 kHz     25.175000 MHz
  Video Capability Data Block:
    YCbCr quantization: Selectable (via AVI YQ)
    RGB quantization: Selectable (via AVI Q)
    PT scan behavior: Always Underscanned
    IT scan behavior: Always Underscanned
    CE scan behavior: Always Underscanned
  Vendor-Specific Data Block (HDMI), OUI 00-0C-03:
    Source physical address: 1.0.0.0
    DC_36bit
    DC_30bit
    DC_Y444
    Maximum TMDS clock: 300 MHz
    Extended HDMI video details:
      HDMI VICs:
        HDMI VIC 3:  3840x2160   24.000000 Hz  16:9     54.000 kHz    297.000000 MHz
  Vendor-Specific Data Block (HDMI Forum), OUI C4-5D-D8:
    Version: 1
    Maximum TMDS Character Rate: 600 MHz
    SCDC Present
    Max Fixed Rate Link: 3 and 6 Gbps per lane on 3 lanes, 6 Gbps on 4 lanes
    Supports 10-bits/component Deep Color 4:2:0 Pixel Encoding
    VRRmin: 0 Hz
    VRRmax: 0 Hz
    Supports VESA DSC 1.2a compression
    Supports 10 bpc Compressed Video Transport
    DSC Max Slices: up to 8 slices and up to (400 MHz/Ksliceadjust) pixel clock per slice
    DSC Max Fixed Rate Link: 3 and 6 Gbps per lane on 3 lanes, 6 Gbps on 4 lanes
    Maximum number of bytes in a line of chunks: 13312
  Colorimetry Data Block:
    BT2020YCC
    BT2020RGB
    Gamut Boundary Description Metadata Profile P0
    ST2113RGB
  YCbCr 4:2:0 Video Data Block:
    VIC 118:  3840x2160  120.000000 Hz  16:9    270.000 kHz   1188.000000 MHz
  HDR Static Metadata Data Block:
    Electro optical transfer functions:
      Traditional gamma - SDR luminance range
      SMPTE ST2084
      Hybrid Log-Gamma
    Supported static metadata descriptors:
      Static metadata type 1
    Desired content max luminance: 96 (400.000 cd/m^2)
    Desired content max frame-average luminance: 96 (400.000 cd/m^2)
    Desired content min luminance: 0 (0.000 cd/m^2)
  DisplayID Type VII Video Timing Data Block:
    VTDB 1:  3840x2160  119.999911 Hz  16:9    274.440 kHz   1075.804000 MHz (aspect 16:9, no 3D stereo)
                  Hfront    8 Hsync  32 Hback   40 Hpol P
                  Vfront  113 Vsync   8 Vback    6 Vpol N
  DisplayID Type VII Video Timing Data Block:
    VTDB 2:  2560x1440  120.000000 Hz  16:9    183.000 kHz    483.120000 MHz (aspect 16:9, no 3D stereo)
                  Hfront    8 Hsync  32 Hback   40 Hpol P
                  Vfront   71 Vsync   8 Vback    6 Vpol N
  Detailed Timing Descriptors:
    DTD 2:  2560x1440   59.950550 Hz  16:9     88.787 kHz    241.500000 MHz (596 mm x 335 mm)
                 Hfront   48 Hsync  32 Hback   80 Hpol P
                 Vfront    3 Vsync   5 Vback   33 Vpol N
Checksum: 0x69  Unused space in Extension Block: 1 byte

----------------

Warnings:

Block 1, CTA-861 Extension Block:
  Video Data Block: VIC 97 and the first DTD are not identical. Is this intended?
  Video Capability Data Block: S_PT is equal to S_IT and S_CE, so should be set to 0 instead.
  Colorimetry Data Block: Set the sRGB colorimetry bit to avoid interop issues.
  Display Product Serial Number is set, so the Serial Number in the Base EDID should be 0.

Failures:

Block 1, CTA-861 Extension Block:
  Vendor-Specific Data Block (HDMI Forum), OUI C4-5D-D8: HDMI VIC and related CTA VIC codes are present, but the UHD VIC bit is 0.
  DisplayID Type VII Video Timing Data Block: This T7VTDB can be represented as an 18-byte DTD.
EDID:
  Extension Block 2 started with EDID header, ignoring Extension Blocks >= 2.

EDID conformity: FAIL
