edid-decode (hex):

00 ff ff ff ff ff ff 00 06 af 20 10 00 00 00 00
01 12 01 03 80 13 0b 78 0a fa 56 92 56 54 98 24
1a 4f 54 00 00 00 01 01 01 01 01 01 01 01 01 01
01 01 01 01 01 01 b0 13 00 40 41 58 19 20 18 88
03 01 c3 71 00 00 00 18 00 00 00 0f 00 00 00 00
00 00 00 00 00 00 00 00 00 20 00 00 00 fe 00 41
55 4f 0a 20 20 20 20 20 20 20 20 20 00 00 00 fe
00 41 30 38 39 53 57 30 31 20 56 30 20 0a 00 19

----------------

Block 0, Base EDID:
  EDID Structure Version & Revision: 1.3
  Vendor & Product Identification:
    Manufacturer: AUO
    Model: 4128
    Made in: week 1 of 2008
  Basic Display Parameters & Features:
    Digital display
    Maximum image size: 19 cm x 11 cm
    Gamma: 2.20
    RGB color display
    First detailed timing is the preferred timing
  Color Characteristics:
    Red  : 0.5732, 0.3388
    Green: 0.3300, 0.5957
    Blue : 0.1416, 0.1025
    White: 0.3095, 0.3300
  Established Timings I & II: none
  Standard Timings: none
  Detailed Timing Descriptors:
    DTD 1:  1024x600    60.000000 Hz 128:75    37.500 kHz     50.400000 MHz (195 mm x 113 mm)
                 Hfront   24 Hsync 136 Hback  160 Hpol N
                 Vfront    0 Vsync  19 Vback    6 Vpol N
                   b0 13 00 40 41 58 19 20 18 88 03 01 c3 71 00 00 00 18 '...@AX. .....q....'
    Manufacturer-Specified Display Descriptor (0x0f): 00 0f 00 00 00 00 00 00 00 00 00 00 00 00 00 20 '............... '
    Alphanumeric Data String: 'AUO'
    Alphanumeric Data String: 'A089SW01 V0 '
Checksum: 0x19

----------------

Failures:

Block 0, Base EDID:
  Detailed Timing Descriptor #1: 0 values in the video timing:
    Horizontal Active/Blanking 1024/320
    Horizontal Frontporch/Sync Width 24/136
    Vertical Active/Blanking 600/25
    Vertical Frontporch/Sync Width 0/19
  Alphanumeric Data String: One or more trailing spaces before newline.
  Missing Display Product Name.
  Missing Display Range Limits Descriptor.

EDID conformity: FAIL
