edid-decode (hex):

00 ff ff ff ff ff ff 00 0d ae ca 15 00 00 00 00
20 18 01 04 a5 22 13 78 02 c3 c5 91 55 54 94 28
24 50 54 00 00 00 01 01 01 01 01 01 01 01 01 01
01 01 01 01 01 01 64 19 00 40 41 00 26 30 44 2d
47 00 58 c1 10 00 00 1a 00 00 00 10 00 00 20 30
44 2d 47 00 58 c1 10 00 00 1a 00 00 00 fe 00 35
33 4d 50 58 00 31 35 36 42 47 45 0a 00 00 00 00
00 00 41 31 96 01 10 00 00 09 01 0a 20 20 00 9f

00 ff ff ff ff ff ff 00 0d ae ca 15 00 00 00 00
20 18 01 04 a5 22 13 78 02 c3 c5 91 55 54 94 28
24 50 54 00 00 00 01 01 01 01 01 01 01 01 01 01
01 01 01 01 01 01 64 19 00 40 41 00 26 30 44 2d
47 00 58 c1 10 00 00 1a 00 00 00 10 00 00 20 30
44 2d 47 00 58 c1 10 00 00 1a 00 00 00 fe 00 35
33 4d 50 58 00 31 35 36 42 47 45 0a 00 00 00 00
00 00 41 31 96 01 10 00 00 09 01 0a 20 20 00 9f

----------------

Block 0, Base EDID:
  EDID Structure Version & Revision: 1.4
  Vendor & Product Identification:
    Manufacturer: CMN
    Model: 5578
    Made in: week 32 of 2014
  Basic Display Parameters & Features:
    Digital display
    Bits per primary color channel: 8
    DisplayPort interface
    Maximum image size: 34 cm x 19 cm
    Gamma: 2.20
    Supported color formats: RGB 4:4:4
    First detailed timing includes the native pixel format and preferred refresh rate
  Color Characteristics:
    Red  : 0.5693, 0.3320
    Green: 0.3281, 0.5810
    Blue : 0.1591, 0.1406
    White: 0.3134, 0.3291
  Established Timings I & II: none
  Standard Timings: none
  Detailed Timing Descriptors:
    DTD 1:  1024x768    60.003840 Hz   4:3     48.363 kHz     65.000000 MHz (344 mm x 193 mm)
                 Hfront   68 Hsync  45 Hback  207 Hpol P
                 Vfront    4 Vsync   7 Vback   27 Vpol N
    Dummy Descriptor:
    Alphanumeric Data String: '53MPX'
    Manufacturer-Specified Display Descriptor (0x00): 00 00 00 00 41 31 96 01 10 00 00 09 01 0a 20 20 '....A1........  '
Checksum: 0x9f

----------------

Warnings:

Block 0, Base EDID:
  Detailed Timing Descriptor #1: DTD is similar but not identical to DMT 0x10.
  Detailed Timing Descriptor #1: Image size is 344x193 mm, but based on the picture AR it should be 257x193 mm.
  Missing Display Product Name.

Failures:

Block 0, Base EDID:
  Dummy Descriptor: Dummy block filled with garbage.
  Alphanumeric Data String: NUL byte at position 5.
EDID:
  Extension Block 1 started with EDID header, ignoring Extension Blocks >= 1.

EDID conformity: FAIL
