edid-decode (hex):

00 ff ff ff ff ff ff 00 0e 77 04 17 00 00 00 00
00 21 01 04 a5 26 15 78 03 0f 95 ae 52 43 b0 26
0f 50 54 00 00 00 01 01 01 01 01 01 01 01 01 01
01 01 01 01 01 01 37 67 00 a0 a0 a0 b3 50 30 20
35 00 7d d6 10 00 00 18 00 00 00 fd 0c 3c a5 0d
0d 49 01 0a 20 20 20 20 20 20 00 00 00 fc 00 4d
4e 48 33 30 31 43 41 33 2d 33 0a 20 00 00 00 fe
00 43 53 4f 54 20 54 33 0a 20 20 20 20 20 01 8f

70 20 79 02 00 22 00 14 4f 16 0b 84 ff 09 9f 00
2f 00 1f 00 9f 05 b2 00 02 00 04 00 2b 00 0c 27
00 3c a4 00 00 27 00 30 3b 00 00 00 00 00 00 00
00 00 00 00 00 00 00 00 00 00 00 00 00 00 00 00
00 00 00 00 00 00 00 00 00 00 00 00 00 00 00 00
00 00 00 00 00 00 00 00 00 00 00 00 00 00 00 00
00 00 00 00 00 00 00 00 00 00 00 00 00 00 00 00
00 00 00 00 00 00 00 00 00 00 00 00 00 00 1a 90

00 ff ff ff ff ff ff 00 0e 77 04 17 00 00 00 00
00 21 01 04 a5 26 15 78 03 0f 95 ae 52 43 b0 26
0f 50 54 00 00 00 01 01 01 01 01 01 01 01 01 01
01 01 01 01 01 01 37 67 00 a0 a0 a0 b3 50 30 20
35 00 7d d6 10 00 00 18 00 00 00 fd 0c 3c a5 0d
0d 49 01 0a 20 20 20 20 20 20 00 00 00 fc 00 4d
4e 48 33 30 31 43 41 33 2d 33 0a 20 00 00 00 fe
00 43 53 4f 54 20 54 33 0a 20 20 20 20 20 01 8f

70 20 79 02 00 22 00 14 4f 16 0b 84 ff 09 9f 00
2f 00 1f 00 9f 05 b2 00 02 00 04 00 2b 00 0c 27
00 3c a4 00 00 27 00 30 3b 00 00 00 00 00 00 00
00 00 00 00 00 00 00 00 00 00 00 00 00 00 00 00
00 00 00 00 00 00 00 00 00 00 00 00 00 00 00 00
00 00 00 00 00 00 00 00 00 00 00 00 00 00 00 00
00 00 00 00 00 00 00 00 00 00 00 00 00 00 00 00
00 00 00 00 00 00 00 00 00 00 00 00 00 00 1a 90

----------------

Block 0, Base EDID:
  EDID Structure Version & Revision: 1.4
  Vendor & Product Identification:
    Manufacturer: CSW
    Model: 5892
    Made in: 2023
  Basic Display Parameters & Features:
    Digital display
    Bits per primary color channel: 8
    DisplayPort interface
    Maximum image size: 38 cm x 21 cm
    Gamma: 2.20
    Supported color formats: RGB 4:4:4
    First detailed timing includes the native pixel format and preferred refresh rate
    Display supports continuous frequencies
  Color Characteristics:
    Red  : 0.6796, 0.3203
    Green: 0.2646, 0.6904
    Blue : 0.1503, 0.0595
    White: 0.3134, 0.3291
  Established Timings I & II: none
  Standard Timings: none
  Detailed Timing Descriptors:
    DTD 1:  2560x1440   60.002089 Hz  16:9     97.143 kHz    264.230000 MHz (381 mm x 214 mm)
                 Hfront   48 Hsync  32 Hback   80 Hpol N
                 Vfront    3 Vsync   5 Vback  171 Vpol N
    Display Range Limits:
      Monitor ranges (Range Limits Only): 60-165 Hz V, 268-268 kHz H, max dotclock 730 MHz
    Display Product Name: 'MNH301CA3-3'
    Alphanumeric Data String: 'CSOT T3'
  Extension blocks: 1
Checksum: 0x8f

----------------

Block 1, DisplayID Extension Block:
  Version: 2.0
  Extension Count: 0
  Display Product Primary Use Case: None of the listed primary use cases; generic display
  Video Timing Modes Type 7 - Detailed Timings Data Block:
    DTD:  2560x1440  165.000182 Hz  16:9    267.135 kHz    726.608000 MHz (aspect 16:9, no 3D stereo, preferred)
               Hfront   48 Hsync  32 Hback   80 Hpol N
               Vfront    3 Vsync   5 Vback  171 Vpol N
  Adaptive Sync Data Block:
    Descriptor #1:
      Native Panel Range
      Fixed Average V-Total and Adaptive V-Total
      Supports Seamless Transition
      'Max Single Frame Duration Increase' field value without jitter impact
      'Max Single Frame Duration Decrease' field value without jitter impact
      Max Duration Increase: 0.00 ms
      Max Duration Decrease: 0.00 ms
      Min Refresh Rate: 60 Hz
      Max Refresh Rate: 165 Hz
    Descriptor #2:
      Native Panel Range
      Fixed Average V-Total and Adaptive V-Total
      Supports Seamless Transition
      'Max Single Frame Duration Increase' field value without jitter impact
      'Max Single Frame Duration Decrease' field value without jitter impact
      Max Duration Increase: 0.00 ms
      Max Duration Decrease: 0.00 ms
      Min Refresh Rate: 48 Hz
      Max Refresh Rate: 60 Hz
  Checksum: 0x1a
Checksum: 0x90

----------------

Warnings:

EDID:
  Base EDID: Some timings are out of range of the Monitor Ranges:
    Horizontal Freq: 97.143 - 267.135 kHz (Monitor: 268.000 - 268.000 kHz)

Failures:

EDID:
  Extension Block 2 started with EDID header, ignoring Extension Blocks >= 2.
  DisplayID: Missing DisplayID Display Parameters Data Block.

EDID conformity: FAIL
