edid-decode (hex):

00 ff ff ff ff ff ff 00 09 e5 34 08 00 00 00 00
00 14 01 03 80 15 10 78 ea bd 30 91 54 4f 8b 26
21 50 54 21 08 00 01 01 01 01 01 01 01 01 01 01
01 01 01 01 01 01 64 19 00 40 41 00 26 30 18 88
36 00 d2 9e 00 00 00 18 28 15 00 40 41 00 26 30
18 88 36 00 d2 9e 00 00 00 18 00 00 00 fe 00 48
59 44 49 53 0a 20 20 20 20 20 20 20 00 00 00 fe
00 48 58 31 30 34 58 30 31 2d 32 31 31 0a 00 a9

00 ff ff ff ff ff ff 00 09 e5 34 08 00 00 00 00
00 14 01 03 80 15 10 78 ea bd 30 91 54 4f 8b 26
21 50 54 21 08 00 01 01 01 01 01 01 01 01 01 01
01 01 01 01 01 01 64 19 00 40 41 00 26 30 18 88
36 00 d2 9e 00 00 00 18 28 15 00 40 41 00 26 30
18 88 36 00 d2 9e 00 00 00 18 00 00 00 fe 00 48
59 44 49 53 0a 20 20 20 20 20 20 20 00 00 00 fe
00 48 58 31 30 34 58 30 31 2d 32 31 31 0a 00 a9

----------------

Block 0, Base EDID:
  EDID Structure Version & Revision: 1.3
  Vendor & Product Identification:
    Manufacturer: BOE
    Model: 2100
    Made in: 2010
  Basic Display Parameters & Features:
    Digital display
    Maximum image size: 21 cm x 16 cm
    Gamma: 2.20
    DPMS levels: Standby Suspend Off
    RGB color display
    First detailed timing is the preferred timing
  Color Characteristics:
    Red  : 0.5683, 0.3310
    Green: 0.3115, 0.5439
    Blue : 0.1484, 0.1318
    White: 0.3125, 0.3281
  Established Timings I & II:
    DMT 0x04:   640x480    59.940476 Hz   4:3     31.469 kHz     25.175000 MHz
    DMT 0x09:   800x600    60.316541 Hz   4:3     37.879 kHz     40.000000 MHz
    DMT 0x10:  1024x768    60.003840 Hz   4:3     48.363 kHz     65.000000 MHz
  Standard Timings: none
  Detailed Timing Descriptors:
    DTD 1:  1024x768    60.003840 Hz   4:3     48.363 kHz     65.000000 MHz (210 mm x 158 mm)
                 Hfront   24 Hsync 136 Hback  160 Hpol N
                 Vfront    3 Vsync   6 Vback   29 Vpol N
    DTD 2:  1024x768    49.997046 Hz   4:3     40.298 kHz     54.160000 MHz (210 mm x 158 mm)
                 Hfront   24 Hsync 136 Hback  160 Hpol N
                 Vfront    3 Vsync   6 Vback   29 Vpol N
    Alphanumeric Data String: 'HYDIS'
    Alphanumeric Data String: 'HX104X01-211'
Checksum: 0xa9

----------------

Failures:

Block 0, Base EDID:
  Missing Display Product Name.
  Missing Display Range Limits Descriptor.
EDID:
  Extension Block 1 started with EDID header, ignoring Extension Blocks >= 1.

EDID conformity: FAIL
