edid-decode (hex):

00 ff ff ff ff ff ff 00 4a 8b 1a 16 01 00 50 63
2c 20 01 04 b5 23 14 78 2b 8c 75 a9 54 45 98 22
1e 50 54 21 08 00 71 40 81 c0 81 80 95 00 a9 c0
b3 00 d1 c0 01 01 61 69 00 a0 a0 40 29 60 30 20
35 00 62 c7 10 00 00 1a 00 00 00 fd 00 30 90 f6
f6 48 01 0a 20 20 20 20 20 20 00 00 00 fc 00 41
53 4d 2d 31 36 30 51 43 43 0a 20 20 00 00 00 ff
00 4c 35 36 30 35 31 37 39 34 33 30 32 0a 01 95

02 03 1e f4 43 90 10 00 23 09 07 07 83 01 00 00
e2 00 c0 e3 05 c0 00 e6 06 05 01 62 62 00 5b ae
00 a0 a0 40 29 60 30 20 35 00 b9 88 21 00 00 1a
38 d1 00 a0 a0 40 29 60 30 20 35 00 58 4a 21 00
00 1a 14 fb 00 a0 a0 40 29 60 30 20 35 00 58 4a
21 00 00 1a 00 00 00 00 00 00 00 00 00 00 00 00
00 00 00 00 00 00 00 00 00 00 00 00 00 00 00 00
00 00 00 00 00 00 00 00 00 00 00 00 00 00 00 47

00 ff ff ff ff ff ff 00 4a 8b 1a 16 01 00 50 63
2c 20 01 04 b5 23 14 78 2b 8c 75 a9 54 45 98 22
1e 50 54 21 08 00 71 40 81 c0 81 80 95 00 a9 c0
b3 00 d1 c0 01 01 61 69 00 a0 a0 40 29 60 30 20
35 00 62 c7 10 00 00 1a 00 00 00 fd 00 30 90 f6
f6 48 01 0a 20 20 20 20 20 20 00 00 00 fc 00 41
53 4d 2d 31 36 30 51 43 43 0a 20 20 00 00 00 ff
00 4c 35 36 30 35 31 37 39 34 33 30 32 0a 01 95

02 03 1e f4 43 90 10 00 23 09 07 07 83 01 00 00
e2 00 c0 e3 05 c0 00 e6 06 05 01 62 62 00 5b ae
00 a0 a0 40 29 60 30 20 35 00 b9 88 21 00 00 1a
38 d1 00 a0 a0 40 29 60 30 20 35 00 58 4a 21 00
00 1a 14 fb 00 a0 a0 40 29 60 30 20 35 00 58 4a
21 00 00 1a 00 00 00 00 00 00 00 00 00 00 00 00
00 00 00 00 00 00 00 00 00 00 00 00 00 00 00 00
00 00 00 00 00 00 00 00 00 00 00 00 00 00 00 47

----------------

Block 0, Base EDID:
  EDID Structure Version & Revision: 1.4
  Vendor & Product Identification:
    Manufacturer: RTK
    Model: 5658
    Serial Number: ...
    Made in: week 44 of 2022
  Basic Display Parameters & Features:
    Digital display
    Bits per primary color channel: 10
    DisplayPort interface
    Maximum image size: 35 cm x 20 cm
    Gamma: 2.20
    DPMS levels: Off
    Supported color formats: RGB 4:4:4, YCrCb 4:4:4
    First detailed timing includes the native pixel format and preferred refresh rate
    Display supports continuous frequencies
  Color Characteristics:
    Red  : 0.6621, 0.3281
    Green: 0.2724, 0.5937
    Blue : 0.1337, 0.1201
    White: 0.3134, 0.3291
  Established Timings I & II:
    DMT 0x04:   640x480    59.940476 Hz   4:3     31.469 kHz     25.175000 MHz
    DMT 0x09:   800x600    60.316541 Hz   4:3     37.879 kHz     40.000000 MHz
    DMT 0x10:  1024x768    60.003840 Hz   4:3     48.363 kHz     65.000000 MHz
  Standard Timings:
    GTF     :  1152x864    60.000000 Hz   4:3     53.700 kHz     81.624000 MHz
    DMT 0x55:  1280x720    60.000000 Hz  16:9     45.000 kHz     74.250000 MHz
    DMT 0x23:  1280x1024   60.019740 Hz   5:4     63.981 kHz    108.000000 MHz
    DMT 0x2f:  1440x900    59.887445 Hz  16:10    55.935 kHz    106.500000 MHz
    DMT 0x53:  1600x900    60.000000 Hz  16:9     60.000 kHz    108.000000 MHz (RB)
    DMT 0x3a:  1680x1050   59.954250 Hz  16:10    65.290 kHz    146.250000 MHz
    DMT 0x52:  1920x1080   60.000000 Hz  16:9     67.500 kHz    148.500000 MHz
  Detailed Timing Descriptors:
    DTD 1:  2560x1600   60.438846 Hz  16:10    99.180 kHz    269.770000 MHz (354 mm x 199 mm)
                 Hfront   48 Hsync  32 Hback   80 Hpol P
                 Vfront    3 Vsync   5 Vback   33 Vpol N
    Display Range Limits:
      Monitor ranges (Range Limits Only): 48-144 Hz V, 246-246 kHz H, max dotclock 720 MHz
    Display Product Name: 'ASM-160QCC'
    Display Product Serial Number: ...
  Extension blocks: 1
Checksum: 0x95

----------------

Block 1, CTA-861 Extension Block:
  Revision: 3
  Underscans IT Video Formats by default
  Basic audio support
  Supports YCbCr 4:4:4
  Supports YCbCr 4:2:2
  Native detailed modes: 4
  Video Data Block:
    VIC  16:  1920x1080   60.000000 Hz  16:9     67.500 kHz    148.500000 MHz (native)
    VIC  16:  1920x1080   60.000000 Hz  16:9     67.500 kHz    148.500000 MHz
  Audio Data Block:
    Linear PCM:
      Max channels: 2
      Supported sample rates (kHz): 48 44.1 32
      Supported sample sizes (bits): 24 20 16
  Speaker Allocation Data Block:
    FL/FR - Front Left/Right
  Video Capability Data Block:
    YCbCr quantization: Selectable (via AVI YQ)
    RGB quantization: Selectable (via AVI Q)
    PT scan behavior: No Data
    IT scan behavior: IT video formats not supported
    CE scan behavior: CE video formats not supported
  Colorimetry Data Block:
    BT2020YCC
    BT2020RGB
  HDR Static Metadata Data Block:
    Electro optical transfer functions:
      Traditional gamma - SDR luminance range
      SMPTE ST2084
    Supported static metadata descriptors:
      Static metadata type 1
    Desired content max luminance: 98 (417.710 cd/m^2)
    Desired content max frame-average luminance: 98 (417.710 cd/m^2)
    Desired content min luminance: 0 (0.000 cd/m^2)
  Detailed Timing Descriptors:
    DTD 2:  2560x1600   99.999552 Hz  16:10   164.099 kHz    446.350000 MHz (697 mm x 392 mm)
                 Hfront   48 Hsync  32 Hback   80 Hpol P
                 Vfront    3 Vsync   5 Vback   33 Vpol N
    DTD 3:  2560x1600  119.994982 Hz  16:10   196.912 kHz    535.600000 MHz (600 mm x 330 mm)
                 Hfront   48 Hsync  32 Hback   80 Hpol P
                 Vfront    3 Vsync   5 Vback   33 Vpol N
    DTD 4:  2560x1600  144.002939 Hz  16:10   236.309 kHz    642.760000 MHz (600 mm x 330 mm)
                 Hfront   48 Hsync  32 Hback   80 Hpol P
                 Vfront    3 Vsync   5 Vback   33 Vpol N
Checksum: 0x47  Unused space in Extension Block: 43 bytes

----------------

Block 2, Unknown EDID Extension Block 0x00:
  00 ff ff ff ff ff ff 00 4a 8b 1a 16 01 00 50 63 '........J.....Pc'
  2c 20 01 04 b5 23 14 78 2b 8c 75 a9 54 45 98 22 ', ...#.x+.u.TE."'
  1e 50 54 21 08 00 71 40 81 c0 81 80 95 00 a9 c0 '.PT!..q@........'
  b3 00 d1 c0 01 01 61 69 00 a0 a0 40 29 60 30 20 '......ai...@)`0 '
  35 00 62 c7 10 00 00 1a 00 00 00 fd 00 30 90 f6 '5.b..........0..'
  f6 48 01 0a 20 20 20 20 20 20 00 00 00 fc 00 41 '.H..      .....A'
  53 4d 2d 31 36 30 51 43 43 0a 20 20 00 00 00 ff 'SM-160QCC.  ....'
  00 4c 35 36 30 35 31 37 39 34 33 30 32 0a 01 95 '.L56051794302...'
Checksum: 0x95

----------------

Block 3, CTA-861 Extension Block:
  Revision: 3
  Underscans IT Video Formats by default
  Basic audio support
  Supports YCbCr 4:4:4
  Supports YCbCr 4:2:2
  Native detailed modes: 4
  Video Data Block:
    VIC  16:  1920x1080   60.000000 Hz  16:9     67.500 kHz    148.500000 MHz (native)
    VIC  16:  1920x1080   60.000000 Hz  16:9     67.500 kHz    148.500000 MHz
  Audio Data Block:
    Linear PCM:
      Max channels: 2
      Supported sample rates (kHz): 48 44.1 32
      Supported sample sizes (bits): 24 20 16
  Speaker Allocation Data Block:
    FL/FR - Front Left/Right
  Video Capability Data Block:
    YCbCr quantization: Selectable (via AVI YQ)
    RGB quantization: Selectable (via AVI Q)
    PT scan behavior: No Data
    IT scan behavior: IT video formats not supported
    CE scan behavior: CE video formats not supported
  Colorimetry Data Block:
    BT2020YCC
    BT2020RGB
  HDR Static Metadata Data Block:
    Electro optical transfer functions:
      Traditional gamma - SDR luminance range
      SMPTE ST2084
    Supported static metadata descriptors:
      Static metadata type 1
    Desired content max luminance: 98 (417.710 cd/m^2)
    Desired content max frame-average luminance: 98 (417.710 cd/m^2)
    Desired content min luminance: 0 (0.000 cd/m^2)
  Detailed Timing Descriptors:
    DTD 5:  2560x1600   99.999552 Hz  16:10   164.099 kHz    446.350000 MHz (697 mm x 392 mm)
                 Hfront   48 Hsync  32 Hback   80 Hpol P
                 Vfront    3 Vsync   5 Vback   33 Vpol N
    DTD 6:  2560x1600  119.994982 Hz  16:10   196.912 kHz    535.600000 MHz (600 mm x 330 mm)
                 Hfront   48 Hsync  32 Hback   80 Hpol P
                 Vfront    3 Vsync   5 Vback   33 Vpol N
    DTD 7:  2560x1600  144.002939 Hz  16:10   236.309 kHz    642.760000 MHz (600 mm x 330 mm)
                 Hfront   48 Hsync  32 Hback   80 Hpol P
                 Vfront    3 Vsync   5 Vback   33 Vpol N
Checksum: 0x47  Unused space in Extension Block: 43 bytes

----------------

Warnings:

Block 0, Base EDID:
  Detailed Timing Descriptor #1: Image size is 354x199 mm, but based on the picture AR it should be 354x221 mm.
Block 1, CTA-861 Extension Block:
  Video Data Block: VIC 16 and the first DTD are not identical. Is this intended?
  Video Capability Data Block: IT scan behavior is expected to support underscanned.
  Video Capability Data Block: 'CE video formats not supported' makes no sense.
  Colorimetry Data Block: Set the sRGB colorimetry bit to avoid interop issues.
  Detailed Timing Descriptor #2: Image size is 697x392 mm, but based on the picture AR it should be 697x435 mm.
  Detailed Timing Descriptor #3: Image size is 600x330 mm, but based on the picture AR it should be 600x375 mm.
  Detailed Timing Descriptor #4: Image size is 600x330 mm, but based on the picture AR it should be 600x375 mm.
  Display Product Serial Number is set, so the Serial Number in the Base EDID should be 0.
Block 3, CTA-861 Extension Block:
  Video Capability Data Block: IT scan behavior is expected to support underscanned.
  Video Capability Data Block: 'CE video formats not supported' makes no sense.
  Colorimetry Data Block: Set the sRGB colorimetry bit to avoid interop issues.
  Detailed Timing Descriptor #5: Image size is 697x392 mm, but based on the picture AR it should be 697x435 mm.
  Detailed Timing Descriptor #6: Image size is 600x330 mm, but based on the picture AR it should be 600x375 mm.
  Detailed Timing Descriptor #7: Image size is 600x330 mm, but based on the picture AR it should be 600x375 mm.
EDID:
  Base EDID: Some timings are out of range of the Monitor Ranges:
    Horizontal Freq: 31.468 - 236.308 kHz (Monitor: 246.000 - 246.000 kHz)

Failures:

Block 1, CTA-861 Extension Block:
  Video Data Block: Duplicate VIC 16.
  Detailed Timing Descriptor #2: Mismatch of image size 697x392 mm vs display size 350x200 mm.
  Detailed Timing Descriptor #3: Mismatch of image size 600x330 mm vs display size 350x200 mm.
  Detailed Timing Descriptor #4: Mismatch of image size 600x330 mm vs display size 350x200 mm.
Block 2, Base EDID:
  Unknown Extension Block.
Block 3, CTA-861 Extension Block:
  Speaker Allocation Data Block: Only one instance of this Data Block is allowed.
  Video Capability Data Block: Only one instance of this Data Block is allowed.
  Colorimetry Data Block: Only one instance of this Data Block is allowed.
  HDR Static Metadata Data Block: Only one instance of this Data Block is allowed.
  Detailed Timing Descriptor #5: Mismatch of image size 697x392 mm vs display size 350x200 mm.
  Detailed Timing Descriptor #6: Mismatch of image size 600x330 mm vs display size 350x200 mm.
  Detailed Timing Descriptor #7: Mismatch of image size 600x330 mm vs display size 350x200 mm.
EDID:
  Base EDID: The DTD max image size is 697x392mm, which is larger than the display size 350.0x200.0mm.
  Base EDID: EDID specified 1 extension block(s), but found 3 extension block(s).
  CTA-861: Native progressive timings are a mix of several resolutions.

EDID conformity: FAIL
