edid-decode (hex):

00 ff ff ff ff ff ff 00 24 62 00 35 00 00 00 00
23 1c 01 04 b5 40 22 78 3f 76 90 a8 54 4d 9f 25
0e 50 54 bf ef 80 d1 c0 81 c0 81 00 81 80 a9 c0
b3 00 b3 28 21 e8 3e d0 70 a0 d0 a0 29 50 30 20
3a 00 c4 8f 21 00 00 1a e7 7c 70 a0 d0 a0 29 50
30 20 3a 00 c4 8f 21 00 00 1a 00 00 00 fd 00 31
7d a0 a0 41 01 0a 20 20 20 20 20 20 00 00 00 fc
00 44 50 00 20 20 20 20 20 20 20 20 20 20 01 97

02 03 1d f2 4a 05 84 03 02 01 12 93 14 16 07 23
0f 7f 07 83 01 00 00 65 03 0c 00 10 00 8c 0a d0
8a 20 e0 2d 10 10 3e 96 00 c4 8e 21 00 00 18 88
5e 00 a0 a0 a0 29 50 30 20 36 00 c4 8e 21 00 00
1e 59 9d 00 a0 a0 a0 29 50 58 2c 45 00 c4 8e 21
00 00 1e 02 3a 80 18 71 38 2d 40 58 2c 45 00 c4
8e 21 00 00 1e ae 60 80 18 71 38 2d 40 58 2c 45
00 c4 8e 21 00 00 00 00 00 00 00 00 00 00 00 a6

00 ff ff ff ff ff ff 00 24 62 00 35 00 00 00 00
23 1c 01 04 b5 40 22 78 3f 76 90 a8 54 4d 9f 25
0e 50 54 bf ef 80 d1 c0 81 c0 81 00 81 80 a9 c0
b3 00 b3 28 21 e8 3e d0 70 a0 d0 a0 29 50 30 20
3a 00 c4 8f 21 00 00 1a e7 7c 70 a0 d0 a0 29 50
30 20 3a 00 c4 8f 21 00 00 1a 00 00 00 fd 00 31
7d a0 a0 41 01 0a 20 20 20 20 20 20 00 00 00 fc
00 44 50 00 20 20 20 20 20 20 20 20 20 20 01 97

02 03 1d f2 4a 05 84 03 02 01 12 93 14 16 07 23
0f 7f 07 83 01 00 00 65 03 0c 00 10 00 8c 0a d0
8a 20 e0 2d 10 10 3e 96 00 c4 8e 21 00 00 18 88
5e 00 a0 a0 a0 29 50 30 20 36 00 c4 8e 21 00 00
1e 59 9d 00 a0 a0 a0 29 50 58 2c 45 00 c4 8e 21
00 00 1e 02 3a 80 18 71 38 2d 40 58 2c 45 00 c4
8e 21 00 00 1e ae 60 80 18 71 38 2d 40 58 2c 45
00 c4 8e 21 00 00 00 00 00 00 00 00 00 00 00 a6

----------------

Block 0, Base EDID:
  EDID Structure Version & Revision: 1.4
  Vendor & Product Identification:
    Manufacturer: ICB
    Model: 13568
    Made in: week 35 of 2018
  Basic Display Parameters & Features:
    Digital display
    Bits per primary color channel: 10
    DisplayPort interface
    Maximum image size: 64 cm x 34 cm
    Gamma: 2.20
    DPMS levels: Off
    Supported color formats: RGB 4:4:4, YCrCb 4:4:4, YCrCb 4:2:2
    Default (sRGB) color space is primary color space
    First detailed timing includes the native pixel format and preferred refresh rate
    Display supports continuous frequencies
  Color Characteristics:
    Red  : 0.6572, 0.3310
    Green: 0.3017, 0.6230
    Blue : 0.1464, 0.0556
    White: 0.3125, 0.3281
  Established Timings I & II:
    IBM     :   720x400    70.081663 Hz   9:5     31.467 kHz     28.320000 MHz
    DMT 0x04:   640x480    59.940476 Hz   4:3     31.469 kHz     25.175000 MHz
    Apple   :   640x480    66.666667 Hz   4:3     35.000 kHz     30.240000 MHz
    DMT 0x05:   640x480    72.808802 Hz   4:3     37.861 kHz     31.500000 MHz
    DMT 0x06:   640x480    75.000000 Hz   4:3     37.500 kHz     31.500000 MHz
    DMT 0x08:   800x600    56.250000 Hz   4:3     35.156 kHz     36.000000 MHz
    DMT 0x09:   800x600    60.316541 Hz   4:3     37.879 kHz     40.000000 MHz
    DMT 0x0a:   800x600    72.187572 Hz   4:3     48.077 kHz     50.000000 MHz
    DMT 0x0b:   800x600    75.000000 Hz   4:3     46.875 kHz     49.500000 MHz
    Apple   :   832x624    74.551266 Hz   4:3     49.726 kHz     57.284000 MHz
    DMT 0x10:  1024x768    60.003840 Hz   4:3     48.363 kHz     65.000000 MHz
    DMT 0x11:  1024x768    70.069359 Hz   4:3     56.476 kHz     75.000000 MHz
    DMT 0x12:  1024x768    75.028582 Hz   4:3     60.023 kHz     78.750000 MHz
    DMT 0x24:  1280x1024   75.024675 Hz   5:4     79.976 kHz    135.000000 MHz
    Apple   :  1152x870    75.061550 Hz 192:145   68.681 kHz    100.000000 MHz
  Standard Timings:
    DMT 0x52:  1920x1080   60.000000 Hz  16:9     67.500 kHz    148.500000 MHz
    DMT 0x55:  1280x720    60.000000 Hz  16:9     45.000 kHz     74.250000 MHz
    DMT 0x1c:  1280x800    59.810326 Hz  16:10    49.702 kHz     83.500000 MHz
    DMT 0x23:  1280x1024   60.019740 Hz   5:4     63.981 kHz    108.000000 MHz
    DMT 0x53:  1600x900    60.000000 Hz  16:9     60.000 kHz    108.000000 MHz (RB)
    DMT 0x3a:  1680x1050   59.954250 Hz  16:10    65.290 kHz    146.250000 MHz
    GTF     :  1680x1050  100.000078 Hz  16:10   111.200 kHz    256.205000 MHz
    GTF     :   512x288   100.000000 Hz  16:9     30.600 kHz     19.584000 MHz
  Detailed Timing Descriptors:
    DTD 1:  3440x1440   99.988746 Hz  43:18   148.083 kHz    533.100000 MHz (708 mm x 399 mm)
                 Hfront   48 Hsync  32 Hback   80 Hpol P
                 Vfront    3 Vsync  10 Vback   28 Vpol N
    DTD 2:  3440x1440   59.972616 Hz  43:18    88.819 kHz    319.750000 MHz (708 mm x 399 mm)
                 Hfront   48 Hsync  32 Hback   80 Hpol P
                 Vfront    3 Vsync  10 Vback   28 Vpol N
    Display Range Limits:
      Monitor ranges (Range Limits Only): 49-125 Hz V, 160-160 kHz H, max dotclock 650 MHz
    Display Product Name: 'DP'
  Extension blocks: 1
Checksum: 0x97

----------------

Block 1, CTA-861 Extension Block:
  Revision: 3
  Underscans IT Video Formats by default
  Basic audio support
  Supports YCbCr 4:4:4
  Supports YCbCr 4:2:2
  Native DTDs: 2
  Video Data Block:
    VIC   5:  1920x1080i  60.000000 Hz  16:9     33.750 kHz     74.250000 MHz
    VIC   4:  1280x720    60.000000 Hz  16:9     45.000 kHz     74.250000 MHz (native)
    VIC   3:   720x480    59.940060 Hz  16:9     31.469 kHz     27.000000 MHz
    VIC   2:   720x480    59.940060 Hz   4:3     31.469 kHz     27.000000 MHz
    VIC   1:   640x480    59.940476 Hz   4:3     31.469 kHz     25.175000 MHz
    VIC  18:   720x576    50.000000 Hz  16:9     31.250 kHz     27.000000 MHz
    VIC  19:  1280x720    50.000000 Hz  16:9     37.500 kHz     74.250000 MHz (native)
    VIC  20:  1920x1080i  50.000000 Hz  16:9     28.125 kHz     74.250000 MHz
    VIC  22:  1440x576i   50.000000 Hz  16:9     15.625 kHz     27.000000 MHz
    VIC   7:  1440x480i   59.940060 Hz  16:9     15.734 kHz     27.000000 MHz
  Audio Data Block:
    Linear PCM:
      Max channels: 8
      Supported sample rates (kHz): 192 176.4 96 88.2 48 44.1 32
      Supported sample sizes (bits): 24 20 16
  Speaker Allocation Data Block:
    FL/FR - Front Left/Right
  Vendor-Specific Data Block (HDMI), OUI 00-0C-03:
    Source physical address: 1.0.0.0
  Detailed Timing Descriptors:
    DTD 3:   720x480    59.940060 Hz   3:2     31.469 kHz     27.000000 MHz (708 mm x 398 mm)
                 Hfront   16 Hsync  62 Hback   60 Hpol N
                 Vfront    9 Vsync   6 Vback   30 Vpol N
    DTD 4:  2560x1440   60.074671 Hz  16:9     88.971 kHz    242.000000 MHz (708 mm x 398 mm)
                 Hfront   48 Hsync  32 Hback   80 Hpol P
                 Vfront    3 Vsync   6 Vback   32 Vpol P
    DTD 5:  2560x1440   99.994539 Hz  16:9    148.092 kHz    402.810000 MHz (708 mm x 398 mm)
                 Hfront   88 Hsync  44 Hback   28 Hpol P
                 Vfront    4 Vsync   5 Vback   32 Vpol P
    DTD 6:  1920x1080   60.000000 Hz  16:9     67.500 kHz    148.500000 MHz (708 mm x 398 mm)
                 Hfront   88 Hsync  44 Hback  148 Hpol P
                 Vfront    4 Vsync   5 Vback   36 Vpol P
    DTD 7:  1920x1080  100.000000 Hz  16:9    112.500 kHz    247.500000 MHz (analog composite, sync-on-green, 708 mm x 398 mm)
                 Hfront   88 Hsync  44 Hback  148 Hpol N
                 Vfront    4 Vsync   5 Vback   36 Vpol N
Checksum: 0xa6  Unused space in Extension Block: 8 bytes

----------------

Warnings:

Block 0, Base EDID:
  Detailed Timing Descriptor #1: Image size is 708x399 mm, but based on the picture AR it should be 708x296 mm.
  Detailed Timing Descriptor #2: Image size is 708x399 mm, but based on the picture AR it should be 708x296 mm.
Block 1, CTA-861 Extension Block:
  Video Data Block: VIC 5 and the first DTD are not identical. Is this intended?
  Detailed Timing Descriptor #3: Image size is 708x398 mm, but based on the picture AR it should be 597x398 mm.
  Detailed Timing Descriptor #6: DTD is identical to VIC 16, which is not present in the CTA Ext Block.
EDID:
  Base EDID: Some timings are out of range of the Monitor Ranges:
    Horizontal Freq: 15.625 - 148.091 kHz (Monitor: 160.000 - 160.000 kHz)

Failures:

Block 0, Base EDID:
  Basic Display Parameters & Features: sRGB is signaled, but the chromaticities do not match.
  Detailed Timing Descriptor #1: Mismatch of image size 708x399 mm vs display size 640x340 mm.
  Detailed Timing Descriptor #2: Mismatch of image size 708x399 mm vs display size 640x340 mm.
  Display Product Name: NUL byte at position 2.
Block 1, CTA-861 Extension Block:
  Vendor-Specific Data Block (HDMI), OUI 00-0C-03: The HDMI Specification requires EDID 1.3 instead of 1.4.
  Detailed Timing Descriptor #3: Mismatch of image size 708x398 mm vs display size 640x340 mm.
  Detailed Timing Descriptor #4: Mismatch of image size 708x398 mm vs display size 640x340 mm.
  Detailed Timing Descriptor #5: Mismatch of image size 708x398 mm vs display size 640x340 mm.
  Detailed Timing Descriptor #6: Mismatch of image size 708x398 mm vs display size 640x340 mm.
  Detailed Timing Descriptor #7: Mismatch of image size 708x398 mm vs display size 640x340 mm.
  Missing VCDB, needed for Set Selectable RGB Quantization to avoid interop issues.
EDID:
  Extension Block 2 started with EDID header, ignoring Extension Blocks >= 2.
  Base EDID: The DTD max image size is 708x399mm, which is larger than the display size 640.0x340.0mm.
  CTA-861: Native progressive timings are a mix of several resolutions.

EDID conformity: FAIL
