edid-decode (hex):

00 ff ff ff ff ff ff 00 59 25 00 24 01 00 00 00
19 20 01 03 80 34 20 78 ea 2d 36 a7 54 38 ae 26
0d 4f 54 a3 08 00 71 40 b3 00 95 00 81 80 81 00
81 c0 81 40 a9 c0 28 3c 80 a0 70 b0 23 40 30 20
36 00 06 44 21 00 00 1a 02 3a 80 18 71 38 2d 40
58 2c 45 00 99 e6 10 00 00 1c 0e 1f 00 80 51 00
1e 30 10 80 17 00 78 2d 11 00 00 18 00 00 00 fc
00 46 44 32 35 30 56 0a 20 20 20 20 20 20 01 d6

02 03 17 f1 4c 01 02 03 04 05 07 90 12 13 14 16
1f 65 03 0c 00 10 00 90 4b 80 a0 70 b0 28 40 30
20 35 00 fe 1f 11 00 00 1e 01 1d 80 18 71 1c 16
20 58 2c 25 00 fe 1f 11 00 00 9e 01 1d 00 72 51
d0 1e 20 6e 28 55 00 fe 1f 11 00 00 1e 8c 0a d0
8a 20 e0 2d 10 10 3e 96 00 fe 1f 11 00 00 18 01
1d 00 bc 52 d0 1e 20 b8 28 55 40 e8 12 11 00 00
1e 00 00 00 00 00 00 00 00 00 00 00 00 00 00 78

00 ff ff ff ff ff ff 00 59 25 00 24 01 00 00 00
19 20 01 03 80 34 20 78 ea 2d 36 a7 54 38 ae 26
0d 4f 54 a3 08 00 71 40 b3 00 95 00 81 80 81 00
81 c0 81 40 a9 c0 28 3c 80 a0 70 b0 23 40 30 20
36 00 06 44 21 00 00 1a 02 3a 80 18 71 38 2d 40
58 2c 45 00 99 e6 10 00 00 1c 0e 1f 00 80 51 00
1e 30 10 80 17 00 78 2d 11 00 00 18 00 00 00 fc
00 46 44 32 35 30 56 0a 20 20 20 20 20 20 01 d6

02 03 17 f1 4c 01 02 03 04 05 07 90 12 13 14 16
1f 65 03 0c 00 10 00 90 4b 80 a0 70 b0 28 40 30
20 35 00 fe 1f 11 00 00 1e 01 1d 80 18 71 1c 16
20 58 2c 25 00 fe 1f 11 00 00 9e 01 1d 00 72 51
d0 1e 20 6e 28 55 00 fe 1f 11 00 00 1e 8c 0a d0
8a 20 e0 2d 10 10 3e 96 00 fe 1f 11 00 00 18 01
1d 00 bc 52 d0 1e 20 b8 28 55 40 e8 12 11 00 00
1e 00 00 00 00 00 00 00 00 00 00 00 00 00 00 78

----------------

Block 0, Base EDID:
  EDID Structure Version & Revision: 1.3
  Vendor & Product Identification:
    Manufacturer: VIE
    Model: 9216
    Serial Number: ...
    Made in: week 25 of 2022
  Basic Display Parameters & Features:
    Digital display
    Maximum image size: 52 cm x 32 cm
    Gamma: 2.20
    DPMS levels: Standby Suspend Off
    RGB color display
    First detailed timing is the preferred timing
  Color Characteristics:
    Red  : 0.6523, 0.3300
    Green: 0.2216, 0.6806
    Blue : 0.1484, 0.0537
    White: 0.3095, 0.3300
  Established Timings I & II:
    IBM     :   720x400    70.081663 Hz   9:5     31.467 kHz     28.320000 MHz
    DMT 0x04:   640x480    59.940476 Hz   4:3     31.469 kHz     25.175000 MHz
    DMT 0x08:   800x600    56.250000 Hz   4:3     35.156 kHz     36.000000 MHz
    DMT 0x09:   800x600    60.316541 Hz   4:3     37.879 kHz     40.000000 MHz
    DMT 0x10:  1024x768    60.003840 Hz   4:3     48.363 kHz     65.000000 MHz
  Standard Timings:
    GTF     :  1152x864    60.000000 Hz   4:3     53.700 kHz     81.624000 MHz
    DMT 0x3a:  1680x1050   59.954250 Hz  16:10    65.290 kHz    146.250000 MHz
    DMT 0x2f:  1440x900    59.887445 Hz  16:10    55.935 kHz    106.500000 MHz
    DMT 0x23:  1280x1024   60.019740 Hz   5:4     63.981 kHz    108.000000 MHz
    DMT 0x1c:  1280x800    59.810326 Hz  16:10    49.702 kHz     83.500000 MHz
    DMT 0x55:  1280x720    60.000000 Hz  16:9     45.000 kHz     74.250000 MHz
    DMT 0x20:  1280x960    60.000000 Hz   4:3     60.000 kHz    108.000000 MHz
    DMT 0x53:  1600x900    60.000000 Hz  16:9     60.000 kHz    108.000000 MHz (RB)
  Detailed Timing Descriptors:
    DTD 1:  1920x1200   59.950171 Hz  16:10    74.038 kHz    154.000000 MHz (518 mm x 324 mm)
                 Hfront   48 Hsync  32 Hback   80 Hpol P
                 Vfront    3 Vsync   6 Vback   26 Vpol N
    DTD 2:  1920x1080   60.000000 Hz  16:9     67.500 kHz    148.500000 MHz (409 mm x 230 mm)
                 Hfront   88 Hsync  44 Hback  148 Hpol N
                 Vfront    4 Vsync   5 Vback   36 Vpol P
    DTD 3:  1280x768    59.870228 Hz   5:3     47.776 kHz     79.500000 MHz (376 mm x 301 mm)
                 Hfront   16 Hsync 128 Hback  240 Hpol N
                 Vfront    1 Vsync   7 Vback   22 Vpol N
    Display Product Name: 'FD250V'
  Extension blocks: 1
Checksum: 0xd6

----------------

Block 1, CTA-861 Extension Block:
  Revision: 3
  Underscans IT Video Formats by default
  Basic audio support
  Supports YCbCr 4:4:4
  Supports YCbCr 4:2:2
  Native DTDs: 1
  Video Data Block:
    VIC   1:   640x480    59.940476 Hz   4:3     31.469 kHz     25.175000 MHz
    VIC   2:   720x480    59.940060 Hz   4:3     31.469 kHz     27.000000 MHz
    VIC   3:   720x480    59.940060 Hz  16:9     31.469 kHz     27.000000 MHz
    VIC   4:  1280x720    60.000000 Hz  16:9     45.000 kHz     74.250000 MHz
    VIC   5:  1920x1080i  60.000000 Hz  16:9     33.750 kHz     74.250000 MHz
    VIC   7:  1440x480i   59.940060 Hz  16:9     15.734 kHz     27.000000 MHz
    VIC  16:  1920x1080   60.000000 Hz  16:9     67.500 kHz    148.500000 MHz (native)
    VIC  18:   720x576    50.000000 Hz  16:9     31.250 kHz     27.000000 MHz
    VIC  19:  1280x720    50.000000 Hz  16:9     37.500 kHz     74.250000 MHz
    VIC  20:  1920x1080i  50.000000 Hz  16:9     28.125 kHz     74.250000 MHz
    VIC  22:  1440x576i   50.000000 Hz  16:9     15.625 kHz     27.000000 MHz
    VIC  31:  1920x1080   50.000000 Hz  16:9     56.250 kHz    148.500000 MHz
  Vendor-Specific Data Block (HDMI), OUI 00-0C-03:
    Source physical address: 1.0.0.0
  Detailed Timing Descriptors:
    DTD 4:  1920x1200   75.000000 Hz  16:10    93.000 kHz    193.440000 MHz (510 mm x 287 mm)
                 Hfront   48 Hsync  32 Hback   80 Hpol P
                 Vfront    3 Vsync   5 Vback   32 Vpol P
    DTD 5:  1920x1080i  60.000000 Hz  16:9     33.750 kHz     74.250000 MHz (510 mm x 287 mm)
                 Hfront   88 Hsync  44 Hback  148 Hpol P
                 Vfront    2 Vsync   5 Vback   15 Vpol P Vfront +0.5 Odd Field
                 Vfront    2 Vsync   5 Vback   15 Vpol P Vback  +0.5 Even Field
    DTD 6:  1280x720    60.000000 Hz  16:9     45.000 kHz     74.250000 MHz (510 mm x 287 mm)
                 Hfront  110 Hsync  40 Hback  220 Hpol P
                 Vfront    5 Vsync   5 Vback   20 Vpol P
    DTD 7:   720x480    59.940060 Hz   3:2     31.469 kHz     27.000000 MHz (510 mm x 287 mm)
                 Hfront   16 Hsync  62 Hback   60 Hpol N
                 Vfront    9 Vsync   6 Vback   30 Vpol N
    DTD 8:  1280x720    50.000000 Hz  16:9     37.500 kHz     74.250000 MHz (488 mm x 274 mm)
                 Hfront  440 Hsync  40 Hback  220 Hpol P
                 Vfront    5 Vsync   5 Vback   20 Vpol P
Checksum: 0x78  Unused space in Extension Block: 14 bytes

----------------

Warnings:

Block 0, Base EDID:
  Vendor & Product Identification: The serial number is one of the known dummy values, it should probably be set to 0.
  Detailed Timing Descriptor #2: DTD is similar but not identical to VIC 16.
  Detailed Timing Descriptor #3: DTD is similar but not identical to DMT 0x17.
  Detailed Timing Descriptor #3: Image size is 376x301 mm, but based on the picture AR it should be 376x225 mm.
Block 1, CTA-861 Extension Block:
  Video Data Block: VIC 1 and the first DTD are not identical. Is this intended?
  Video Data Block: All VICs are in ascending order, and the first (preferred) VIC <= 4, is that intended?
  Detailed Timing Descriptor #4: Image size is 510x287 mm, but based on the picture AR it should be 459x287 mm.
  Detailed Timing Descriptor #7: Image size is 510x287 mm, but based on the picture AR it should be 430x287 mm.
  Add a Colorimetry Data Block with the sRGB colorimetry bit set to avoid interop issues.

Failures:

Block 0, Base EDID:
  Detailed Timing Descriptor #2: Mismatch of image size 409x230 mm vs display size 520x320 mm.
  Detailed Timing Descriptor #3: Mismatch of image size 376x301 mm vs display size 520x320 mm.
  Missing Display Range Limits Descriptor.
Block 1, CTA-861 Extension Block:
  Detailed Timing Descriptor #4: Mismatch of image size 510x287 mm vs display size 520x320 mm.
  Detailed Timing Descriptor #5: Mismatch of image size 510x287 mm vs display size 520x320 mm.
  Detailed Timing Descriptor #6: Mismatch of image size 510x287 mm vs display size 520x320 mm.
  Detailed Timing Descriptor #7: Mismatch of image size 510x287 mm vs display size 520x320 mm.
  Detailed Timing Descriptor #8: Mismatch of image size 488x274 mm vs display size 520x320 mm.
  Missing VCDB, needed for Set Selectable RGB Quantization to avoid interop issues.
EDID:
  Extension Block 2 started with EDID header, ignoring Extension Blocks >= 2.
  CTA-861: Native progressive timings are a mix of several resolutions.

EDID conformity: FAIL
