edid-decode (hex):

00 ff ff ff ff ff ff 00 30 e4 8b 07 00 00 00 00
00 21 01 04 a5 1d 12 78 07 2e f5 a4 54 4c 97 24
0d 50 54 00 00 00 01 01 01 01 01 01 01 01 01 01
01 01 01 01 01 01 f0 7b 80 a0 70 b0 3e 45 30 20
36 00 20 b4 10 00 00 1a 00 00 00 fd 00 1e 78 99
99 20 01 0a 20 20 20 20 20 20 00 00 00 fe 00 50
46 37 31 4e 80 31 33 34 57 55 32 0a 00 00 00 00
00 02 41 0c b2 00 01 00 00 0b 41 0a 20 20 01 bf

70 20 79 02 00 20 00 13 3c e6 24 8b 07 00 00 00
00 00 17 07 31 33 34 57 55 32 0a 21 00 1d 40 0b
08 07 80 07 b0 04 88 42 8a 54 cd 94 97 4e d2 0d
02 45 54 d0 5f d0 5f 00 34 12 78 26 00 09 02 00
00 00 00 00 01 00 00 22 00 14 5f d7 04 85 7f 07
9f 00 2f 80 1f 00 af 04 46 00 02 00 05 00 25 01
09 5f d7 04 5f d7 04 1e 78 80 81 00 0b e3 05 80
00 e6 06 01 01 6a 6a 39 00 00 00 00 00 00 a3 90

00 ff ff ff ff ff ff 00 30 e4 8b 07 00 00 00 00
00 21 01 04 a5 1d 12 78 07 2e f5 a4 54 4c 97 24
0d 50 54 00 00 00 01 01 01 01 01 01 01 01 01 01
01 01 01 01 01 01 f0 7b 80 a0 70 b0 3e 45 30 20
36 00 20 b4 10 00 00 1a 00 00 00 fd 00 1e 78 99
99 20 01 0a 20 20 20 20 20 20 00 00 00 fe 00 50
46 37 31 4e 80 31 33 34 57 55 32 0a 00 00 00 00
00 02 41 0c b2 00 01 00 00 0b 41 0a 20 20 01 bf

70 20 79 02 00 20 00 13 3c e6 24 8b 07 00 00 00
00 00 17 07 31 33 34 57 55 32 0a 21 00 1d 40 0b
08 07 80 07 b0 04 88 42 8a 54 cd 94 97 4e d2 0d
02 45 54 d0 5f d0 5f 00 34 12 78 26 00 09 02 00
00 00 00 00 01 00 00 22 00 14 5f d7 04 85 7f 07
9f 00 2f 80 1f 00 af 04 46 00 02 00 05 00 25 01
09 5f d7 04 5f d7 04 1e 78 80 81 00 0b e3 05 80
00 e6 06 01 01 6a 6a 39 00 00 00 00 00 00 a3 90

----------------

Block 0, Base EDID:
  EDID Structure Version & Revision: 1.4
  Vendor & Product Identification:
    Manufacturer: LGD
    Model: 1931
    Made in: 2023
  Basic Display Parameters & Features:
    Digital display
    Bits per primary color channel: 8
    DisplayPort interface
    Maximum image size: 29 cm x 18 cm
    Gamma: 2.20
    Supported color formats: RGB 4:4:4
    Default (sRGB) color space is primary color space
    First detailed timing includes the native pixel format and preferred refresh rate
    Display supports continuous frequencies
  Color Characteristics:
    Red  : 0.6406, 0.3300
    Green: 0.2998, 0.5917
    Blue : 0.1435, 0.0537
    White: 0.3134, 0.3291
  Established Timings I & II: none
  Standard Timings: none
  Detailed Timing Descriptors:
    DTD 1:  1920x1200   60.007263 Hz  16:10   152.538 kHz    317.280000 MHz (288 mm x 180 mm)
                 Hfront   48 Hsync  32 Hback   80 Hpol P
                 Vfront    3 Vsync   6 Vback 1333 Vpol N
    Display Range Limits:
      Monitor ranges (Range Limits Only): 30-120 Hz V, 153-153 kHz H, max dotclock 320 MHz
    Alphanumeric Data String: 'PF71N.134WU2'
    Manufacturer-Specified Display Descriptor (0x00): 00 00 00 02 41 0c b2 00 01 00 00 0b 41 0a 20 20 '....A.......A.  '
  Extension blocks: 1
Checksum: 0xbf

----------------

Block 1, DisplayID Extension Block:
  Version: 2.0
  Extension Count: 0
  Display Product Primary Use Case: None of the listed primary use cases; generic display
  Product Identification Data Block (0x20), OUI 3C-E6-24:
    Product Code: 1931
    Year of Manufacture: 2023
    Product ID: 134WU2

  Display Parameters Data Block (0x21):
    Image size: 288.0 mm x 180.0 mm
    Display native pixel format: 1920x1200
    Scan Orientation: Left to Right, Top to Bottom
    Luminance Information: Guidance for the Source device
    Color Information: CIE 1931
    Audio Speaker Information: not integrated
    Native Color Chromaticity:
      Primary #1:  (0.641113, 0.330078)
      Primary #2:  (0.300049, 0.592041)
      Primary #3:  (0.144043, 0.053955)
      White Point: (0.312988, 0.329102)
    Native Maximum Luminance (Full Coverage): 500.000000 cd/m^2
    Native Maximum Luminance (10% Rectangular Coverage): 500.000000 cd/m^2
    Native Minimum Luminance: 0.250000 cd/m^2
    Native Color Depth: 8 bpc
    Display Device Technology: Active Matrix LCD
    Native Gamma EOTF: 2.20
  Display Interface Features Data Block:
    Supported bpc for RGB encoding: 8
    Supported color space and EOTF standard combination 1: sRGB
  Video Timing Modes Type 7 - Detailed Timings Data Block:
    DTD:  1920x1200  120.014525 Hz  16:10   152.538 kHz    317.280000 MHz (aspect 16:10, no 3D stereo, preferred)
               Hfront   48 Hsync  32 Hback   80 Hpol P
               Vfront    3 Vsync   6 Vback   62 Vpol N
  Dynamic Video Timing Range Limits Data Block:
    Minimum Pixel Clock: 317280 kHz
    Maximum Pixel Clock: 317280 kHz
    Minimum Vertical Refresh Rate: 30 Hz
    Maximum Vertical Refresh Rate: 120 Hz
    Seamless Dynamic Video Timing Support: Yes
  CTA-861 DisplayID Data Block:
  Colorimetry Data Block:
    BT2020RGB
  HDR Static Metadata Data Block:
    Electro optical transfer functions:
      Traditional gamma - SDR luminance range
    Supported static metadata descriptors:
      Static metadata type 1
    Desired content max luminance: 106 (496.743 cd/m^2)
    Desired content max frame-average luminance: 106 (496.743 cd/m^2)
    Desired content min luminance: 57 (0.248 cd/m^2)
  Checksum: 0xa3
Checksum: 0x90

----------------

Warnings:

Block 0, Base EDID:
  Alphanumeric Data String: Non-ASCII character 0x80 at position 5, can cause problems.
  Missing Display Product Name.

Failures:

Block 0, Base EDID:
  Basic Display Parameters & Features: sRGB is signaled, but the chromaticities do not match.
EDID:
  Extension Block 2 started with EDID header, ignoring Extension Blocks >= 2.

EDID conformity: FAIL
