edid-decode (hex):

00 ff ff ff ff ff ff 00 1e 6d b9 5a eb 40 00 00
02 1a 01 03 a0 30 1b 78 2a 31 35 a5 55 4e a1 26
0c 50 54 a5 4b 00 71 4f 81 80 95 00 b3 00 a9 c0
81 00 81 c0 90 40 02 3a 80 18 71 38 2d 40 58 2c
45 00 e0 0e 11 00 00 1e 00 00 00 fd 00 38 4b 1e
53 0f 00 0a 20 20 20 20 20 20 00 00 00 fc 00 4c
47 20 46 55 4c 4c 20 48 44 0a 20 20 00 00 00 ff
00 36 30 32 4e 54 46 41 30 47 36 31 39 0a 01 23

02 03 1b 61 23 09 7f 07 83 01 00 00 67 03 0c 00
30 00 80 2d 43 01 10 04 e2 00 0f 00 00 36 00 40
e8 63 00 00 1a 1a 1d 00 80 51 d0 1c 20 40 80 35
00 40 84 63 00 00 1c 00 00 00 00 00 00 00 00 00
00 00 00 00 00 00 00 00 00 00 00 00 00 00 00 00
00 00 00 00 00 00 00 00 00 00 00 00 00 00 00 00
00 00 00 00 00 00 00 00 00 00 00 00 00 00 00 00
00 00 00 00 00 00 00 00 00 00 00 00 00 00 00 86

----------------

Block 0, Base EDID:
  EDID Structure Version & Revision: 1.3
  Vendor & Product Identification:
    Manufacturer: GSM
    Model: 23225
    Serial Number: ...
    Made in: week 2 of 2016
  Basic Display Parameters & Features:
    Digital display
    Maximum image size: 48 cm x 27 cm
    Gamma: 2.20
    DPMS levels: Off
    RGB color display
    First detailed timing is the preferred timing
  Color Characteristics:
    Red  : 0.6445, 0.3349
    Green: 0.3046, 0.6298
    Blue : 0.1484, 0.0498
    White: 0.3134, 0.3291
  Established Timings I & II:
    IBM     :   720x400    70.081663 Hz   9:5     31.467 kHz     28.320000 MHz
    DMT 0x04:   640x480    59.940476 Hz   4:3     31.469 kHz     25.175000 MHz
    DMT 0x06:   640x480    75.000000 Hz   4:3     37.500 kHz     31.500000 MHz
    DMT 0x09:   800x600    60.316541 Hz   4:3     37.879 kHz     40.000000 MHz
    DMT 0x0b:   800x600    75.000000 Hz   4:3     46.875 kHz     49.500000 MHz
    DMT 0x10:  1024x768    60.003840 Hz   4:3     48.363 kHz     65.000000 MHz
    DMT 0x12:  1024x768    75.028582 Hz   4:3     60.023 kHz     78.750000 MHz
    DMT 0x24:  1280x1024   75.024675 Hz   5:4     79.976 kHz    135.000000 MHz
  Standard Timings:
    DMT 0x15:  1152x864    75.000000 Hz   4:3     67.500 kHz    108.000000 MHz
    DMT 0x23:  1280x1024   60.019740 Hz   5:4     63.981 kHz    108.000000 MHz
    DMT 0x2f:  1440x900    59.887445 Hz  16:10    55.935 kHz    106.500000 MHz
    DMT 0x3a:  1680x1050   59.954250 Hz  16:10    65.290 kHz    146.250000 MHz
    DMT 0x53:  1600x900    60.000000 Hz  16:9     60.000 kHz    108.000000 MHz (RB)
    DMT 0x1c:  1280x800    59.810326 Hz  16:10    49.702 kHz     83.500000 MHz
    DMT 0x55:  1280x720    60.000000 Hz  16:9     45.000 kHz     74.250000 MHz
    DMT 0x2a:  1400x1050   59.978442 Hz   4:3     65.317 kHz    121.750000 MHz
  Detailed Timing Descriptors:
    DTD 1:  1920x1080   60.000000 Hz  16:9     67.500 kHz    148.500000 MHz (480 mm x 270 mm)
                 Hfront   88 Hsync  44 Hback  148 Hpol P
                 Vfront    4 Vsync   5 Vback   36 Vpol P
    Display Range Limits:
      Monitor ranges (GTF): 56-75 Hz V, 30-83 kHz H, max dotclock 150 MHz
    Display Product Name: 'LG FULL HD'
    Display Product Serial Number: ...
  Extension blocks: 1
Checksum: 0x23

----------------

Block 1, CTA-861 Extension Block:
  Revision: 3
  Basic audio support
  Supports YCbCr 4:4:4
  Native detailed modes: 1
  Audio Data Block:
    Linear PCM:
      Max channels: 2
      Supported sample rates (kHz): 192 176.4 96 88.2 48 44.1 32
      Supported sample sizes (bits): 24 20 16
  Speaker Allocation Data Block:
    FL/FR - Front Left/Right
  Vendor-Specific Data Block (HDMI), OUI 00-0C-03:
    Source physical address: 3.0.0.0
    Supports_AI
    Maximum TMDS clock: 225 MHz
  Video Data Block:
    VIC   1:   640x480    59.940476 Hz   4:3     31.469 kHz     25.175000 MHz
    VIC  16:  1920x1080   60.000000 Hz  16:9     67.500 kHz    148.500000 MHz
    VIC   4:  1280x720    60.000000 Hz  16:9     45.000 kHz     74.250000 MHz
  Video Capability Data Block:
    YCbCr quantization: No Data
    RGB quantization: No Data
    PT scan behavior: No Data
    IT scan behavior: Supports both over- and underscan
    CE scan behavior: Supports both over- and underscan
  Detailed Timing Descriptors:
    Manufacturer-Specified Display Descriptor (0x00): 36 00 40 e8 63 00 00 1a 1a 1d 00 80 51 d0 1c 20 '6.@.c.......Q.. '
    DTD 2:  1077x132   1319.683102 Hz 359:44   304.847 kHz    328.320000 MHz (analog composite, sync-on-green)
                 Hfront    0 Hsync  28 Hback  -28 Hpol N
                 Vfront    0 Vsync   0 Vback   99 Vpol N
                   40 80 35 00 40 84 63 00 00 1c 00 00 00 00 00 00 00 00 '@.5.@.c...........'
Checksum: 0x86  Unused space in Extension Block: 64 bytes

----------------

Warnings:

Block 1, CTA-861 Extension Block:
  IT Video Formats are overscanned by default, but normally this should be underscanned.
  Video Data Block: VIC 1 and the first DTD are not identical. Is this intended?
  Video Capability Data Block: Set Selectable YCbCr Quantization to avoid interop issues.
  Display Product Serial Number is set, so the Serial Number in the Base EDID should be 0.
  Add a Colorimetry Data Block with the sRGB colorimetry bit set to avoid interop issues.
EDID:
  Base EDID: Some timings are out of range of the Monitor Ranges:
    Vertical Freq: 59.810 - 1319.683 Hz (Monitor: 56.000 - 75.000 Hz)
    Horizontal Freq: 31.466 - 304.846 kHz (Monitor: 30.000 - 83.000 kHz)
    Maximum Clock: 328.320 MHz (Monitor: 150.000 MHz)

Failures:

Block 0, Base EDID:
  Basic Display Parameters & Features: Digital Video Interface Standard set to reserved value 0x20.
Block 1, CTA-861 Extension Block:
  Video Capability Data Block: Set Selectable RGB Quantization to avoid interop issues.
  Display Descriptor #5: Monitor descriptor block has byte 2 nonzero (0x36).
  Display Descriptor #5: Monitor descriptor block has byte 4 nonzero (0x40).
  Detailed Timing Descriptor #2: 0 values in the video timing:
    Horizontal Active/Blanking 1077/0
    Horizontal Frontporch/Sync Width 0/28
    Vertical Active/Blanking 132/99
    Vertical Frontporch/Sync Width 0/0
  Detailed Timing Descriptor #2: 0 or negative horizontal front porch.
  Detailed Timing Descriptor #2: 0 or negative horizontal back porch.
  Detailed Timing Descriptor #2: Mismatch of image size vs display size: image size is not set, but display size is.
  Detailed Timing Descriptor #2: Invalid detailed timing descriptor ordering.
EDID:
  CTA-861: The maximum HDMI TMDS clock is 225000 kHz, but one or more video timings go up to 328320 kHz.

EDID conformity: FAIL
