edid-decode (hex):

00 ff ff ff ff ff ff 00 06 af 3d 1b 00 00 00 00
00 19 01 04 95 1f 11 78 02 67 75 93 57 58 8e 29
21 50 54 00 00 00 01 01 01 01 01 01 01 01 01 01
01 01 01 01 01 01 14 37 80 b8 70 38 24 40 10 10
3e 00 35 ad 10 00 00 1a 10 2c 80 b8 70 38 24 40
10 10 3e 00 14 9b 10 00 00 1a 00 00 00 fe 00 59
37 35 33 57 81 42 31 34 30 48 54 4e 00 00 00 00
00 00 41 01 96 00 11 00 00 0a 01 0a 20 20 00 75

----------------

Block 0, Base EDID:
  EDID Structure Version & Revision: 1.4
  Vendor & Product Identification:
    Manufacturer: AUO
    Model: 6973
    Made in: 2015
  Basic Display Parameters & Features:
    Digital display
    Bits per primary color channel: 6
    DisplayPort interface
    Maximum image size: 31 cm x 17 cm
    Gamma: 2.20
    Supported color formats: RGB 4:4:4
    First detailed timing includes the native pixel format and preferred refresh rate
  Color Characteristics:
    Red  : 0.5751, 0.3417
    Green: 0.3447, 0.5576
    Blue : 0.1611, 0.1318
    White: 0.3134, 0.3291
  Established Timings I & II: none
  Standard Timings: none
  Detailed Timing Descriptors:
    DTD 1:  1920x1080   60.049471 Hz  16:9     67.015 kHz    141.000000 MHz (309 mm x 173 mm)
                 Hfront   16 Hsync  16 Hback  152 Hpol P
                 Vfront    3 Vsync  14 Vback   19 Vpol N
    DTD 2:  1920x1080   48.039576 Hz  16:9     53.612 kHz    112.800000 MHz (276 mm x 155 mm)
                 Hfront   16 Hsync  16 Hback  152 Hpol P
                 Vfront    3 Vsync  14 Vback   19 Vpol N
    Alphanumeric Data String: 'Y753W.B140HTN'
    Manufacturer-Specified Display Descriptor (0x00): 00 00 00 00 41 01 96 00 11 00 00 0a 01 0a 20 20 '....A.........  '
Checksum: 0x75

----------------

Warnings:

Block 0, Base EDID:
  Alphanumeric Data String: Non-ASCII character 0x81 at position 5, can cause problems.
  Missing Display Product Name.

Failures:

Block 0, Base EDID:
  Detailed Timing Descriptor #2: Mismatch of image size 276x155 mm vs display size 310x170 mm.

EDID conformity: FAIL
