edid-decode (hex):

00 ff ff ff ff ff ff 00 06 af 96 10 e4 26 e2 70
00 1a 01 04 a5 26 15 78 02 30 c0 a5 56 55 9e 26
0d 4f 56 00 00 00 01 01 01 01 01 01 01 01 01 01
01 01 01 01 01 01 28 c3 00 a0 a0 a0 5a 50 30 20
35 00 7e d6 10 00 00 1a 28 c3 00 a0 a0 a0 54 56
30 20 35 00 7e d6 10 00 00 1a 00 00 00 fe 00 57
4a 47 44 34 80 42 31 37 33 51 54 4e 00 00 00 00
00 02 41 2f 28 00 01 00 00 0b 01 0a 20 20 00 81

00 ff ff ff ff ff ff 00 06 af 96 10 e4 26 e2 70
00 1a 01 04 a5 26 15 78 02 30 c0 a5 56 55 9e 26
0d 4f 56 00 00 00 01 01 01 01 01 01 01 01 01 01
01 01 01 01 01 01 28 c3 00 a0 a0 a0 5a 50 30 20
35 00 7e d6 10 00 00 1a 28 c3 00 a0 a0 a0 54 56
30 20 35 00 7e d6 10 00 00 1a 00 00 00 fe 00 57
4a 47 44 34 80 42 31 37 33 51 54 4e 00 00 00 00
00 02 41 2f 28 00 01 00 00 0b 01 0a 20 20 00 81

----------------

Block 0, Base EDID:
  EDID Structure Version & Revision: 1.4
  Vendor & Product Identification:
    Manufacturer: AUO
    Model: 4246
    Serial Number: ...
    Made in: 2016
  Basic Display Parameters & Features:
    Digital display
    Bits per primary color channel: 8
    DisplayPort interface
    Maximum image size: 38 cm x 21 cm
    Gamma: 2.20
    Supported color formats: RGB 4:4:4
    First detailed timing includes the native pixel format and preferred refresh rate
  Color Characteristics:
    Red  : 0.6445, 0.3388
    Green: 0.3320, 0.6171
    Blue : 0.1513, 0.0507
    White: 0.3085, 0.3359
  Established Timings I & II: none
  Standard Timings: none
  Detailed Timing Descriptors:
    DTD 1:  2560x1440  120.049981 Hz  16:9    183.676 kHz    499.600000 MHz (382 mm x 214 mm)
                 Hfront   48 Hsync  32 Hback   80 Hpol P
                 Vfront    3 Vsync   5 Vback   82 Vpol N
    DTD 2:  2560x1440   60.024990 Hz  16:9    183.676 kHz    499.600000 MHz (382 mm x 214 mm)
                 Hfront   48 Hsync  32 Hback   80 Hpol P
                 Vfront    3 Vsync   5 Vback 1612 Vpol N
    Alphanumeric Data String: 'WJGD4.B173QTN'
    Manufacturer-Specified Display Descriptor (0x00): 00 00 00 02 41 2f 28 00 01 00 00 0b 01 0a 20 20 '....A/(.......  '
Checksum: 0x81

----------------

Warnings:

Block 0, Base EDID:
  Alphanumeric Data String: Non-ASCII character 0x80 at position 5, can cause problems.
  Missing Display Product Name.

Failures:

EDID:
  Extension Block 1 started with EDID header, ignoring Extension Blocks >= 1.

EDID conformity: FAIL
