edid-decode (hex):

00 ff ff ff ff ff ff 00 26 cd 61 53 18 9d 98 00
04 0e 01 03 80 2b 20 78 0b d0 65 a6 55 4b 9b 24
14 50 54 bf ee 80 a9 40 81 8f 61 40 61 59 45 40
45 59 31 40 31 59 48 3f 40 30 62 b0 62 40 40 c0
13 00 98 32 11 00 00 1e 00 00 00 fd 00 32 55 18
50 11 00 0a 20 20 20 20 20 20 00 00 00 fc 00 50
4c 48 35 34 30 20 20 20 0a 20 20 20 00 00 00 ff
00 0a 20 20 20 20 20 20 20 20 20 20 20 20 00 d3

00 ff ff ff ff ff ff 00 26 cd 61 53 18 9d 98 00
04 0e 01 03 80 2b 20 78 0b d0 65 a6 55 4b 9b 24
14 50 54 bf ee 80 a9 40 81 8f 61 40 61 59 45 40
45 59 31 40 31 59 48 3f 40 30 62 b0 62 40 40 c0
13 00 98 32 11 00 00 1e 00 00 00 fd 00 32 55 18
50 11 00 0a 20 20 20 20 20 20 00 00 00 fc 00 50
4c 48 35 34 30 20 20 20 0a 20 20 20 00 00 00 ff
00 0a 20 20 20 20 20 20 20 20 20 20 20 20 00 d3

----------------

Block 0, Base EDID:
  EDID Structure Version & Revision: 1.3
  Vendor & Product Identification:
    Manufacturer: IVM
    Model: 21345
    Serial Number: ...
    Made in: week 4 of 2004
  Basic Display Parameters & Features:
    Digital display
    Maximum image size: 43 cm x 32 cm
    Gamma: 2.20
    RGB color display
    First detailed timing is the preferred timing
    Supports GTF timings within operating range
  Color Characteristics:
    Red  : 0.6513, 0.3330
    Green: 0.2929, 0.6054
    Blue : 0.1416, 0.0800
    White: 0.3134, 0.3291
  Established Timings I & II:
    IBM     :   720x400    70.081663 Hz   9:5     31.467 kHz     28.320000 MHz
    DMT 0x04:   640x480    59.940476 Hz   4:3     31.469 kHz     25.175000 MHz
    Apple   :   640x480    66.666667 Hz   4:3     35.000 kHz     30.240000 MHz
    DMT 0x05:   640x480    72.808802 Hz   4:3     37.861 kHz     31.500000 MHz
    DMT 0x06:   640x480    75.000000 Hz   4:3     37.500 kHz     31.500000 MHz
    DMT 0x08:   800x600    56.250000 Hz   4:3     35.156 kHz     36.000000 MHz
    DMT 0x09:   800x600    60.316541 Hz   4:3     37.879 kHz     40.000000 MHz
    DMT 0x0a:   800x600    72.187572 Hz   4:3     48.077 kHz     50.000000 MHz
    DMT 0x0b:   800x600    75.000000 Hz   4:3     46.875 kHz     49.500000 MHz
    Apple   :   832x624    74.551266 Hz   4:3     49.726 kHz     57.284000 MHz
    DMT 0x10:  1024x768    60.003840 Hz   4:3     48.363 kHz     65.000000 MHz
    DMT 0x11:  1024x768    70.069359 Hz   4:3     56.476 kHz     75.000000 MHz
    DMT 0x12:  1024x768    75.028582 Hz   4:3     60.023 kHz     78.750000 MHz
    Apple   :  1152x870    75.061550 Hz 192:145   68.681 kHz    100.000000 MHz
  Standard Timings:
    DMT 0x33:  1600x1200   60.000000 Hz   4:3     75.000 kHz    162.000000 MHz
    DMT 0x24:  1280x1024   75.024675 Hz   5:4     79.976 kHz    135.000000 MHz
    DMT 0x10:  1024x768    60.003840 Hz   4:3     48.363 kHz     65.000000 MHz
    DMT 0x13:  1024x768    84.996690 Hz   4:3     68.677 kHz     94.500000 MHz
    DMT 0x09:   800x600    60.316541 Hz   4:3     37.879 kHz     40.000000 MHz
    DMT 0x0c:   800x600    85.061274 Hz   4:3     53.674 kHz     56.250000 MHz
    DMT 0x04:   640x480    59.940476 Hz   4:3     31.469 kHz     25.175000 MHz
    DMT 0x07:   640x480    85.008312 Hz   4:3     43.269 kHz     36.000000 MHz
  Detailed Timing Descriptors:
    DTD 1:  1600x1200   57.781202 Hz   4:3     75.000 kHz    162.000000 MHz (408 mm x 306 mm)
                 Hfront   64 Hsync 192 Hback  304 Hpol P
                 Vfront    1 Vsync   3 Vback   94 Vpol P
    Display Range Limits:
      Monitor ranges (GTF): 50-85 Hz V, 24-80 kHz H, max dotclock 170 MHz
    Display Product Name: 'PLH540   '
    Display Product Serial Number: ...
Checksum: 0xd3

----------------

Block 1, Unknown EDID Extension Block 0x00:
  00 ff ff ff ff ff ff 00 26 cd 61 53 18 9d 98 00 '........&.aS....'
  04 0e 01 03 80 2b 20 78 0b d0 65 a6 55 4b 9b 24 '.....+ x..e.UK.$'
  14 50 54 bf ee 80 a9 40 81 8f 61 40 61 59 45 40 '.PT....@..a@aYE@'
  45 59 31 40 31 59 48 3f 40 30 62 b0 62 40 40 c0 'EY1@1YH?@0b.b@@.'
  13 00 98 32 11 00 00 1e 00 00 00 fd 00 32 55 18 '...2.........2U.'
  50 11 00 0a 20 20 20 20 20 20 00 00 00 fc 00 50 'P...      .....P'
  4c 48 35 34 30 20 20 20 0a 20 20 20 00 00 00 ff 'LH540   .   ....'
  00 0a 20 20 20 20 20 20 20 20 20 20 20 20 00 d3 '..            ..'
Checksum: 0xd3

----------------

Failures:

Block 0, Base EDID:
  Display Product Serial Number: ...
  Detailed Timing Descriptor #1: Mismatch of image size 408x306 mm vs display size 430x320 mm.
  Display Product Name: One or more trailing spaces before newline.
Block 1, Base EDID:
  Unknown Extension Block.
EDID:
  Base EDID: EDID specified 0 extension block(s), but found 1 extension block(s).

EDID conformity: FAIL
