edid-decode (hex):

00 ff ff ff ff ff ff 00 05 e3 20 35 b2 01 00 00
31 1a 01 04 a5 52 23 78 3b 62 f5 aa 52 4c a3 26
0f 50 54 bf ef 00 d1 c0 81 80 31 68 31 7c 45 68
45 7c 61 68 61 7c d8 59 00 60 a3 38 28 40 a0 10
3a 10 34 5a 31 00 00 1a 40 e7 00 6a a0 38 20 40
30 20 3a 00 34 5a 31 00 00 1a 00 00 00 fd 00 1e
ca f0 f0 3c 01 0a 20 20 20 20 20 20 00 00 00 fc
00 41 47 33 35 32 51 47 32 0a 20 20 20 20 01 32

02 03 1e f1 4b 01 03 05 14 04 13 1f 12 02 11 90
23 09 07 07 83 01 00 00 65 03 0c 00 10 00 f4 b0
00 a0 a0 38 4d 40 30 20 3a 00 34 5a 31 00 00 1a
cd 91 00 a0 a0 38 40 40 30 20 3a 00 34 5a 31 00
00 1e 50 78 00 a0 a0 38 35 40 30 20 3a 00 34 5a
31 00 00 1e 02 3a 80 18 71 38 2d 40 58 2c 45 00
34 5a 31 00 00 1e ec 2c 00 b0 51 38 28 40 50 88
3a 00 34 5a 31 00 00 1c 00 00 00 00 00 00 00 3c

00 ff ff ff ff ff ff 00 05 e3 20 35 b2 01 00 00
31 1a 01 04 a5 52 23 78 3b 62 f5 aa 52 4c a3 26
0f 50 54 bf ef 00 d1 c0 81 80 31 68 31 7c 45 68
45 7c 61 68 61 7c d8 59 00 60 a3 38 28 40 a0 10
3a 10 34 5a 31 00 00 1a 40 e7 00 6a a0 38 20 40
30 20 3a 00 34 5a 31 00 00 1a 00 00 00 fd 00 1e
ca f0 f0 3c 01 0a 20 20 20 20 20 20 00 00 00 fc
00 41 47 33 35 32 51 47 32 0a 20 20 20 20 01 32

02 03 1e f1 4b 01 03 05 14 04 13 1f 12 02 11 90
23 09 07 07 83 01 00 00 65 03 0c 00 10 00 f4 b0
00 a0 a0 38 4d 40 30 20 3a 00 34 5a 31 00 00 1a
cd 91 00 a0 a0 38 40 40 30 20 3a 00 34 5a 31 00
00 1e 50 78 00 a0 a0 38 35 40 30 20 3a 00 34 5a
31 00 00 1e 02 3a 80 18 71 38 2d 40 58 2c 45 00
34 5a 31 00 00 1e ec 2c 00 b0 51 38 28 40 50 88
3a 00 34 5a 31 00 00 1c 00 00 00 00 00 00 00 3c

----------------

Block 0, Base EDID:
  EDID Structure Version & Revision: 1.4
  Vendor & Product Identification:
    Manufacturer: AOC
    Model: 13600
    Serial Number: ...
    Made in: week 49 of 2016
  Basic Display Parameters & Features:
    Digital display
    Bits per primary color channel: 8
    DisplayPort interface
    Maximum image size: 82 cm x 35 cm
    Gamma: 2.20
    DPMS levels: Off
    Supported color formats: RGB 4:4:4, YCrCb 4:4:4, YCrCb 4:2:2
    First detailed timing includes the native pixel format and preferred refresh rate
    Display supports continuous frequencies
  Color Characteristics:
    Red  : 0.6650, 0.3222
    Green: 0.2968, 0.6386
    Blue : 0.1513, 0.0615
    White: 0.3134, 0.3291
  Established Timings I & II:
    IBM     :   720x400    70.081663 Hz   9:5     31.467 kHz     28.320000 MHz
    DMT 0x04:   640x480    59.940476 Hz   4:3     31.469 kHz     25.175000 MHz
    Apple   :   640x480    66.666667 Hz   4:3     35.000 kHz     30.240000 MHz
    DMT 0x05:   640x480    72.808802 Hz   4:3     37.861 kHz     31.500000 MHz
    DMT 0x06:   640x480    75.000000 Hz   4:3     37.500 kHz     31.500000 MHz
    DMT 0x08:   800x600    56.250000 Hz   4:3     35.156 kHz     36.000000 MHz
    DMT 0x09:   800x600    60.316541 Hz   4:3     37.879 kHz     40.000000 MHz
    DMT 0x0a:   800x600    72.187572 Hz   4:3     48.077 kHz     50.000000 MHz
    DMT 0x0b:   800x600    75.000000 Hz   4:3     46.875 kHz     49.500000 MHz
    Apple   :   832x624    74.551266 Hz   4:3     49.726 kHz     57.284000 MHz
    DMT 0x10:  1024x768    60.003840 Hz   4:3     48.363 kHz     65.000000 MHz
    DMT 0x11:  1024x768    70.069359 Hz   4:3     56.476 kHz     75.000000 MHz
    DMT 0x12:  1024x768    75.028582 Hz   4:3     60.023 kHz     78.750000 MHz
    DMT 0x24:  1280x1024   75.024675 Hz   5:4     79.976 kHz    135.000000 MHz
  Standard Timings:
    DMT 0x52:  1920x1080   60.000000 Hz  16:9     67.500 kHz    148.500000 MHz
    DMT 0x23:  1280x1024   60.019740 Hz   5:4     63.981 kHz    108.000000 MHz
    GTF     :   640x480    99.999537 Hz   4:3     50.900 kHz     43.163000 MHz
    GTF     :   640x480   119.999084 Hz   4:3     61.800 kHz     52.406000 MHz
    GTF     :   800x600    99.999707 Hz   4:3     63.600 kHz     68.179000 MHz
    GTF     :   800x600   119.999886 Hz   4:3     77.160 kHz     83.950000 MHz
    GTF     :  1024x768   100.000177 Hz   4:3     81.400 kHz    113.309000 MHz
    GTF     :  1024x768   119.999931 Hz   4:3     98.760 kHz    139.054000 MHz
  Detailed Timing Descriptors:
    DTD 1:  2560x1080   59.975801 Hz  64:27    67.173 kHz    230.000000 MHz (820 mm x 346 mm)
                 Hfront  160 Hsync 272 Hback  432 Hpol P
                 Vfront    3 Vsync  10 Vback   27 Vpol N
    DTD 2:  2560x1080  199.690210 Hz  64:27   222.056 kHz    592.000000 MHz (820 mm x 346 mm)
                 Hfront   48 Hsync  32 Hback   26 Hpol P
                 Vfront    3 Vsync  10 Vback   19 Vpol N
    Display Range Limits:
      Monitor ranges (Range Limits Only): 30-202 Hz V, 240-240 kHz H, max dotclock 600 MHz
    Display Product Name: 'AG352QG2'
  Extension blocks: 1
Checksum: 0x32

----------------

Block 1, CTA-861 Extension Block:
  Revision: 3
  Underscans IT Video Formats by default
  Basic audio support
  Supports YCbCr 4:4:4
  Supports YCbCr 4:2:2
  Native DTDs: 1
  Video Data Block:
    VIC   1:   640x480    59.940476 Hz   4:3     31.469 kHz     25.175000 MHz
    VIC   3:   720x480    59.940060 Hz  16:9     31.469 kHz     27.000000 MHz
    VIC   5:  1920x1080i  60.000000 Hz  16:9     33.750 kHz     74.250000 MHz
    VIC  20:  1920x1080i  50.000000 Hz  16:9     28.125 kHz     74.250000 MHz
    VIC   4:  1280x720    60.000000 Hz  16:9     45.000 kHz     74.250000 MHz
    VIC  19:  1280x720    50.000000 Hz  16:9     37.500 kHz     74.250000 MHz
    VIC  31:  1920x1080   50.000000 Hz  16:9     56.250 kHz    148.500000 MHz
    VIC  18:   720x576    50.000000 Hz  16:9     31.250 kHz     27.000000 MHz
    VIC   2:   720x480    59.940060 Hz   4:3     31.469 kHz     27.000000 MHz
    VIC  17:   720x576    50.000000 Hz   4:3     31.250 kHz     27.000000 MHz
    VIC  16:  1920x1080   60.000000 Hz  16:9     67.500 kHz    148.500000 MHz (native)
  Audio Data Block:
    Linear PCM:
      Max channels: 2
      Supported sample rates (kHz): 48 44.1 32
      Supported sample sizes (bits): 24 20 16
  Speaker Allocation Data Block:
    FL/FR - Front Left/Right
  Vendor-Specific Data Block (HDMI), OUI 00-0C-03:
    Source physical address: 1.0.0.0
  Detailed Timing Descriptors:
    DTD 3:  2560x1080  143.944786 Hz  64:27   166.544 kHz    453.000000 MHz (820 mm x 346 mm)
                 Hfront   48 Hsync  32 Hback   80 Hpol P
                 Vfront    3 Vsync  10 Vback   64 Vpol N
    DTD 4:  2560x1080  119.951280 Hz  64:27   137.224 kHz    373.250000 MHz (820 mm x 346 mm)
                 Hfront   48 Hsync  32 Hback   80 Hpol P
                 Vfront    3 Vsync  10 Vback   51 Vpol P
    DTD 5:  2560x1080   99.942890 Hz  64:27   113.235 kHz    308.000000 MHz (820 mm x 346 mm)
                 Hfront   48 Hsync  32 Hback   80 Hpol P
                 Vfront    3 Vsync  10 Vback   40 Vpol P
    DTD 6:  1920x1080   60.000000 Hz  16:9     67.500 kHz    148.500000 MHz (820 mm x 346 mm)
                 Hfront   88 Hsync  44 Hback  148 Hpol P
                 Vfront    4 Vsync   5 Vback   36 Vpol P
    DTD 7:  1280x1080   59.975801 Hz  32:27    67.173 kHz    115.000000 MHz (820 mm x 346 mm)
                 Hfront   80 Hsync 136 Hback  216 Hpol N
                 Vfront    3 Vsync  10 Vback   27 Vpol P
Checksum: 0x3c  Unused space in Extension Block: 7 bytes

----------------

Warnings:

Block 1, CTA-861 Extension Block:
  Video Data Block: VIC 1 and the first DTD are not identical. Is this intended?
  Detailed Timing Descriptor #6: Image size is 820x346 mm, but based on the picture AR it should be 615x346 mm.
  Detailed Timing Descriptor #7: Image size is 820x346 mm, but based on the picture AR it should be 410x346 mm.
  Add a Colorimetry Data Block with the sRGB colorimetry bit set to avoid interop issues.
EDID:
  Base EDID: Some timings are out of range of the Monitor Ranges:
    Horizontal Freq: 28.125 - 222.055 kHz (Monitor: 240.000 - 240.000 kHz)

Failures:

Block 1, CTA-861 Extension Block:
  Vendor-Specific Data Block (HDMI), OUI 00-0C-03: The HDMI Specification requires EDID 1.3 instead of 1.4.
  Missing VCDB, needed for Set Selectable RGB Quantization to avoid interop issues.
EDID:
  Extension Block 2 started with EDID header, ignoring Extension Blocks >= 2.
  CTA-861: Native progressive timings are a mix of several resolutions.

EDID conformity: FAIL
