edid-decode (hex):

00 ff ff ff ff ff ff 00 4d d9 00 95 01 01 01 01
2c 10 01 03 80 46 28 78 0a 0d c9 a0 57 47 98 27
12 48 4c 20 00 00 01 01 01 01 01 01 01 01 01 01
01 01 01 01 01 01 01 1d 80 18 71 1c 16 20 58 2c
25 00 df a4 21 00 00 9e 8c 0a d0 8a 20 e0 2d 10
10 3e 96 00 30 a4 21 00 00 18 00 00 00 fc 00 53
4f 4e 59 20 54 56 0a 20 20 20 20 20 00 00 00 fd
00 3a 3e 0f 2e 08 00 0a 20 20 20 20 20 20 01 2e

02 03 1b 76 47 85 02 03 04 06 07 01 23 09 07 07
83 01 00 00 66 03 0c 00 10 00 80 01 1d 00 72 51
d0 1e 20 6e 28 55 00 df a4 21 00 00 1e 8c 0a a0
14 51 f0 16 00 26 7c 43 00 30 a4 21 00 00 98 8c
0a d0 8a 20 e0 2d 10 10 3e 96 00 df a4 21 00 00
18 8c 0a a0 14 51 f0 16 00 26 7c 43 00 df a4 21
00 00 98 00 00 00 00 00 00 00 00 00 00 00 00 00
00 00 00 00 00 00 00 00 00 00 00 00 00 00 00 86

00 ff ff ff ff ff ff 00 4d d9 00 95 01 01 01 01
2c 10 01 03 80 46 28 78 0a 0d c9 a0 57 47 98 27
12 48 4c 20 00 00 01 01 01 01 01 01 01 01 01 01
01 01 01 01 01 01 01 1d 80 18 71 1c 16 20 58 2c
25 00 df a4 21 00 00 9e 8c 0a d0 8a 20 e0 2d 10
10 3e 96 00 30 a4 21 00 00 18 00 00 00 fc 00 53
4f 4e 59 20 54 56 0a 20 20 20 20 20 00 00 00 fd
00 3a 3e 0f 2e 08 00 0a 20 20 20 20 20 20 01 2e

02 03 1b 76 47 85 02 03 04 06 07 01 23 09 07 07
83 01 00 00 66 03 0c 00 10 00 80 01 1d 00 72 51
d0 1e 20 6e 28 55 00 df a4 21 00 00 1e 8c 0a a0
14 51 f0 16 00 26 7c 43 00 30 a4 21 00 00 98 8c
0a d0 8a 20 e0 2d 10 10 3e 96 00 df a4 21 00 00
18 8c 0a a0 14 51 f0 16 00 26 7c 43 00 df a4 21
00 00 98 00 00 00 00 00 00 00 00 00 00 00 00 00
00 00 00 00 00 00 00 00 00 00 00 00 00 00 00 86

----------------

Block 0, Base EDID:
  EDID Structure Version & Revision: 1.3
  Vendor & Product Identification:
    Manufacturer: SNY
    Model: 38144
    Serial Number: ...
    Made in: week 44 of 2006
  Basic Display Parameters & Features:
    Digital display
    Maximum image size: 70 cm x 40 cm
    Gamma: 2.20
    RGB color display
    First detailed timing is the preferred timing
  Color Characteristics:
    Red  : 0.6250, 0.3398
    Green: 0.2802, 0.5947
    Blue : 0.1552, 0.0703
    White: 0.2832, 0.2978
  Established Timings I & II:
    DMT 0x04:   640x480    59.940476 Hz   4:3     31.469 kHz     25.175000 MHz
  Standard Timings: none
  Detailed Timing Descriptors:
    DTD  1:  1920x1080i  60.000000 Hz  16:9     33.750 kHz     74.250000 MHz (735 mm x 420 mm)
                  Hfront   88 Hsync  44 Hback  148 Hpol P
                  Vfront    2 Vsync   5 Vback   15 Vpol P Vfront +0.5 Odd Field
                  Vfront    2 Vsync   5 Vback   15 Vpol P Vback  +0.5 Even Field
    DTD  2:   720x480    59.940060 Hz   3:2     31.469 kHz     27.000000 MHz (560 mm x 420 mm)
                  Hfront   16 Hsync  62 Hback   60 Hpol N
                  Vfront    9 Vsync   6 Vback   30 Vpol N
    Display Product Name: 'SONY TV'
    Display Range Limits:
      Monitor ranges (GTF): 58-62 Hz V, 15-46 kHz H, max dotclock 80 MHz
  Extension blocks: 1
Checksum: 0x2e

----------------

Block 1, CTA-861 Extension Block:
  Revision: 3
  Basic audio support
  Supports YCbCr 4:4:4
  Supports YCbCr 4:2:2
  Native detailed modes: 6
  Video Data Block:
    VIC   5:  1920x1080i  60.000000 Hz  16:9     33.750 kHz     74.250000 MHz (native)
    VIC   2:   720x480    59.940060 Hz   4:3     31.469 kHz     27.000000 MHz
    VIC   3:   720x480    59.940060 Hz  16:9     31.469 kHz     27.000000 MHz
    VIC   4:  1280x720    60.000000 Hz  16:9     45.000 kHz     74.250000 MHz
    VIC   6:  1440x480i   59.940060 Hz   4:3     15.734 kHz     27.000000 MHz
    VIC   7:  1440x480i   59.940060 Hz  16:9     15.734 kHz     27.000000 MHz
    VIC   1:   640x480    59.940476 Hz   4:3     31.469 kHz     25.175000 MHz
  Audio Data Block:
    Linear PCM:
      Max channels: 2
      Supported sample rates (kHz): 48 44.1 32
      Supported sample sizes (bits): 24 20 16
  Speaker Allocation Data Block:
    FL/FR - Front Left/Right
  Vendor-Specific Data Block (HDMI), OUI 00-0C-03:
    Source physical address: 1.0.0.0
    Supports_AI
  Detailed Timing Descriptors:
    DTD  3:  1280x720    60.000000 Hz  16:9     45.000 kHz     74.250000 MHz (735 mm x 420 mm)
                  Hfront  110 Hsync  40 Hback  220 Hpol P
                  Vfront    5 Vsync   5 Vback   20 Vpol P
    DTD  4:  1440x480i   59.940060 Hz   3:1     15.734 kHz     27.000000 MHz (560 mm x 420 mm)
                  Hfront   38 Hsync 124 Hback  114 Hpol N
                  Vfront    4 Vsync   3 Vback   15 Vpol N Vfront +0.5 Odd Field
                  Vfront    4 Vsync   3 Vback   15 Vpol N Vback  +0.5 Even Field
    DTD  5:   720x480    59.940060 Hz   3:2     31.469 kHz     27.000000 MHz (735 mm x 420 mm)
                  Hfront   16 Hsync  62 Hback   60 Hpol N
                  Vfront    9 Vsync   6 Vback   30 Vpol N
    DTD  6:  1440x480i   59.940060 Hz   3:1     15.734 kHz     27.000000 MHz (735 mm x 420 mm)
                  Hfront   38 Hsync 124 Hback  114 Hpol N
                  Vfront    4 Vsync   3 Vback   15 Vpol N Vfront +0.5 Odd Field
                  Vfront    4 Vsync   3 Vback   15 Vpol N Vback  +0.5 Even Field
Checksum: 0x86  Unused space in Extension Block: 28 bytes

----------------

Block 2, Unknown EDID Extension Block 0x00:
  00 ff ff ff ff ff ff 00 4d d9 00 95 01 01 01 01 '........M.......'
  2c 10 01 03 80 46 28 78 0a 0d c9 a0 57 47 98 27 ',....F(x....WG.''
  12 48 4c 20 00 00 01 01 01 01 01 01 01 01 01 01 '.HL ............'
  01 01 01 01 01 01 01 1d 80 18 71 1c 16 20 58 2c '..........q.. X,'
  25 00 df a4 21 00 00 9e 8c 0a d0 8a 20 e0 2d 10 '%...!....... .-.'
  10 3e 96 00 30 a4 21 00 00 18 00 00 00 fc 00 53 '.>..0.!........S'
  4f 4e 59 20 54 56 0a 20 20 20 20 20 00 00 00 fd 'ONY TV.     ....'
  00 3a 3e 0f 2e 08 00 0a 20 20 20 20 20 20 01 2e '.:>.....      ..'
Checksum: 0x2e

----------------

Block 3, CTA-861 Extension Block:
  Revision: 3
  Basic audio support
  Supports YCbCr 4:4:4
  Supports YCbCr 4:2:2
  Native detailed modes: 6
  Video Data Block:
    VIC   5:  1920x1080i  60.000000 Hz  16:9     33.750 kHz     74.250000 MHz (native)
    VIC   2:   720x480    59.940060 Hz   4:3     31.469 kHz     27.000000 MHz
    VIC   3:   720x480    59.940060 Hz  16:9     31.469 kHz     27.000000 MHz
    VIC   4:  1280x720    60.000000 Hz  16:9     45.000 kHz     74.250000 MHz
    VIC   6:  1440x480i   59.940060 Hz   4:3     15.734 kHz     27.000000 MHz
    VIC   7:  1440x480i   59.940060 Hz  16:9     15.734 kHz     27.000000 MHz
    VIC   1:   640x480    59.940476 Hz   4:3     31.469 kHz     25.175000 MHz
  Audio Data Block:
    Linear PCM:
      Max channels: 2
      Supported sample rates (kHz): 48 44.1 32
      Supported sample sizes (bits): 24 20 16
  Speaker Allocation Data Block:
    FL/FR - Front Left/Right
  Vendor-Specific Data Block (HDMI), OUI 00-0C-03:
    Source physical address: 1.0.0.0
    Supports_AI
  Detailed Timing Descriptors:
    DTD  7:  1280x720    60.000000 Hz  16:9     45.000 kHz     74.250000 MHz (735 mm x 420 mm)
                  Hfront  110 Hsync  40 Hback  220 Hpol P
                  Vfront    5 Vsync   5 Vback   20 Vpol P
    DTD  8:  1440x480i   59.940060 Hz   3:1     15.734 kHz     27.000000 MHz (560 mm x 420 mm)
                  Hfront   38 Hsync 124 Hback  114 Hpol N
                  Vfront    4 Vsync   3 Vback   15 Vpol N Vfront +0.5 Odd Field
                  Vfront    4 Vsync   3 Vback   15 Vpol N Vback  +0.5 Even Field
    DTD  9:   720x480    59.940060 Hz   3:2     31.469 kHz     27.000000 MHz (735 mm x 420 mm)
                  Hfront   16 Hsync  62 Hback   60 Hpol N
                  Vfront    9 Vsync   6 Vback   30 Vpol N
    DTD 10:  1440x480i   59.940060 Hz   3:1     15.734 kHz     27.000000 MHz (735 mm x 420 mm)
                  Hfront   38 Hsync 124 Hback  114 Hpol N
                  Vfront    4 Vsync   3 Vback   15 Vpol N Vfront +0.5 Odd Field
                  Vfront    4 Vsync   3 Vback   15 Vpol N Vback  +0.5 Even Field
Checksum: 0x86  Unused space in Extension Block: 28 bytes

----------------

Warnings:

Block 0, Base EDID:
  Vendor & Product Identification: The serial number is one of the known dummy values, it should probably be set to 0.
  Detailed Timing Descriptor #2: Image size is 560x420 mm, but based on the picture AR it should be 560x373 mm.
Block 1, CTA-861 Extension Block:
  IT Video Formats are overscanned by default, but normally this should be underscanned.
  Detailed Timing Descriptor #4: Image size is 560x420 mm, but based on the picture AR it should be 560x186 mm.
  Detailed Timing Descriptor #5: Image size is 735x420 mm, but based on the picture AR it should be 735x490 mm.
  Detailed Timing Descriptor #6: Image size is 735x420 mm, but based on the picture AR it should be 735x245 mm.
  Add a Colorimetry Data Block with the sRGB colorimetry bit set to avoid interop issues.
Block 3, CTA-861 Extension Block:
  IT Video Formats are overscanned by default, but normally this should be underscanned.
  Detailed Timing Descriptor #8: Image size is 560x420 mm, but based on the picture AR it should be 560x186 mm.
  Detailed Timing Descriptor #9: Image size is 735x420 mm, but based on the picture AR it should be 735x490 mm.
  Detailed Timing Descriptor #10: Image size is 735x420 mm, but based on the picture AR it should be 735x245 mm.

Failures:

Block 0, Base EDID:
  Detailed Timing Descriptor #1: Mismatch of image size 735x420 mm vs display size 700x400 mm.
  Detailed Timing Descriptor #2: Mismatch of image size 560x420 mm vs display size 700x400 mm.
Block 1, CTA-861 Extension Block:
  Detailed Timing Descriptor #3: Mismatch of image size 735x420 mm vs display size 700x400 mm.
  Detailed Timing Descriptor #4: Mismatch of image size 560x420 mm vs display size 700x400 mm.
  Detailed Timing Descriptor #5: Mismatch of image size 735x420 mm vs display size 700x400 mm.
  Detailed Timing Descriptor #6: Mismatch of image size 735x420 mm vs display size 700x400 mm.
  Missing VCDB, needed for Set Selectable RGB Quantization to avoid interop issues.
Block 2, Base EDID:
  Unknown Extension Block.
Block 3, CTA-861 Extension Block:
  Video Data Block: Duplicate VIC 5.
  Video Data Block: Duplicate VIC 2.
  Video Data Block: Duplicate VIC 3.
  Video Data Block: Duplicate VIC 4.
  Video Data Block: Duplicate VIC 6.
  Video Data Block: Duplicate VIC 7.
  Video Data Block: Duplicate VIC 1.
  Speaker Allocation Data Block: Only one instance of this Data Block is allowed.
  Detailed Timing Descriptor #7: Mismatch of image size 735x420 mm vs display size 700x400 mm.
  Detailed Timing Descriptor #8: Mismatch of image size 560x420 mm vs display size 700x400 mm.
  Detailed Timing Descriptor #9: Mismatch of image size 735x420 mm vs display size 700x400 mm.
  Detailed Timing Descriptor #10: Mismatch of image size 735x420 mm vs display size 700x400 mm.
EDID:
  Base EDID: The DTD max image size is 735x420mm, which is larger than the display size 700.0x400.0mm.
  Base EDID: EDID specified 1 extension block(s), but found 3 extension block(s).
  Base EDID: EDID 1.3 requires a Block Map Extension in Block 1 if there are more than 2 blocks in the EDID.
  CTA-861: Native progressive timings are a mix of several resolutions.
  CTA-861: Native interlaced timings are a mix of several resolutions.

EDID conformity: FAIL
