edid-decode (hex):

00 ff ff ff ff ff ff 00 06 af 9b 10 00 00 00 00
00 19 01 04 a5 26 15 78 02 24 25 a8 50 36 b6 26
0e 50 54 00 00 00 01 01 01 01 01 01 01 01 01 01
01 01 01 01 01 01 66 d0 00 a0 f0 70 3e 80 30 20
35 00 7e d6 10 00 00 1a b8 a6 00 a0 f0 70 3e 80
30 20 35 00 7e d6 10 00 00 1a 00 00 00 fe 00 32
52 43 58 39 80 42 31 37 33 5a 41 4e 00 00 00 00
00 02 81 01 a8 00 11 00 00 0b 01 0a 20 20 00 d4

----------------

Block 0, Base EDID:
  EDID Structure Version & Revision: 1.4
  Vendor & Product Identification:
    Manufacturer: AUO
    Model: 4251
    Made in: 2015
  Basic Display Parameters & Features:
    Digital display
    Bits per primary color channel: 8
    DisplayPort interface
    Maximum image size: 38 cm x 21 cm
    Gamma: 2.20
    Supported color formats: RGB 4:4:4
    First detailed timing includes the native pixel format and preferred refresh rate
  Color Characteristics:
    Red  : 0.6562, 0.3144
    Green: 0.2119, 0.7109
    Blue : 0.1484, 0.0566
    White: 0.3134, 0.3291
  Established Timings I & II: none
  Standard Timings: none
  Detailed Timing Descriptors:
    DTD 1:  3840x2160   60.024752 Hz  16:9    133.375 kHz    533.500000 MHz (382 mm x 214 mm)
                 Hfront   48 Hsync  32 Hback   80 Hpol P
                 Vfront    3 Vsync   5 Vback   54 Vpol N
    DTD 2:  3840x2160   48.019802 Hz  16:9    106.700 kHz    426.800000 MHz (382 mm x 214 mm)
                 Hfront   48 Hsync  32 Hback   80 Hpol P
                 Vfront    3 Vsync   5 Vback   54 Vpol N
    Alphanumeric Data String: '2RCX9.B173ZAN'
    Manufacturer-Specified Display Descriptor (0x00): 00 00 00 02 81 01 a8 00 11 00 00 0b 01 0a 20 20 '..............  '
Checksum: 0xd4

----------------

Warnings:

Block 0, Base EDID:
  Alphanumeric Data String: Non-ASCII character 0x80 at position 5, can cause problems.
  Missing Display Product Name.

EDID conformity: PASS
