edid-decode (hex):

00 ff ff ff ff ff ff 00 06 af 91 70 00 00 00 00
13 1e 01 04 a5 22 13 78 02 91 05 a3 54 4b 99 27
0f 50 54 00 00 00 01 01 01 01 01 01 01 01 01 01
01 01 01 01 01 01 64 d2 00 a0 f0 70 54 80 30 20
35 00 58 c1 10 00 00 1a 50 a8 00 a0 f0 70 54 80
30 20 35 00 58 c1 10 00 00 1a 00 00 00 fe 00 34
37 52 33 48 80 42 31 35 36 5a 41 4e 00 00 00 00
00 02 41 22 a8 00 11 00 00 0b 01 0a 20 20 00 14

----------------

Block 0, Base EDID:
  EDID Structure Version & Revision: 1.4
  Vendor & Product Identification:
    Manufacturer: AUO
    Model: 28817
    Made in: week 19 of 2020
  Basic Display Parameters & Features:
    Digital display
    Bits per primary color channel: 8
    DisplayPort interface
    Maximum image size: 34 cm x 19 cm
    Gamma: 2.20
    Supported color formats: RGB 4:4:4
    First detailed timing includes the native pixel format and preferred refresh rate
  Color Characteristics:
    Red  : 0.6386, 0.3291
    Green: 0.2929, 0.5986
    Blue : 0.1523, 0.0585
    White: 0.3134, 0.3291
  Established Timings I & II: none
  Standard Timings: none
  Detailed Timing Descriptors:
    DTD 1:  3840x2160   60.004456 Hz  16:9    134.650 kHz    538.600000 MHz (344 mm x 193 mm)
                 Hfront   48 Hsync  32 Hback   80 Hpol P
                 Vfront    3 Vsync   5 Vback   76 Vpol N
    DTD 2:  3840x2160   48.003565 Hz  16:9    107.720 kHz    430.880000 MHz (344 mm x 193 mm)
                 Hfront   48 Hsync  32 Hback   80 Hpol P
                 Vfront    3 Vsync   5 Vback   76 Vpol N
    Alphanumeric Data String: '47R3H.B156ZAN'
    Manufacturer-Specified Display Descriptor (0x00): 00 00 00 02 41 22 a8 00 11 00 00 0b 01 0a 20 20 '....A"........  '
Checksum: 0x14

----------------

Warnings:

Block 0, Base EDID:
  Alphanumeric Data String: Non-ASCII character 0x80 at position 5, can cause problems.
  Missing Display Product Name.

EDID conformity: PASS
