edid-decode (hex):

00 ff ff ff ff ff ff 00 36 98 00 03 d1 2a 4a 51
26 0f 01 03 0e 29 1f 79 e8 60 e5 a3 57 4b 9c 25
11 50 54 25 4b 00 a9 40 81 80 81 99 81 40 81 59
61 59 45 59 31 59 6f 2c 00 30 81 00 26 30 58 40
3f 00 34 36 31 00 00 1a d5 35 00 f8 80 00 20 30
48 38 1f 00 34 36 31 00 00 1a 26 4a 00 98 a1 00
2a 40 30 70 1c 00 34 36 31 00 00 1a 9b 40 00 68
81 00 28 30 70 48 1c 00 34 36 31 00 00 18 00 43

00 ff ff ff ff ff ff 00 36 98 00 03 d1 2a 4a 51
26 0f 01 03 0e 29 1f 79 e8 60 e5 a3 57 4b 9c 25
11 50 54 25 4b 00 a9 40 81 80 81 99 81 40 81 59
61 59 45 59 31 59 6f 2c 00 30 81 00 26 30 58 40
3f 00 34 36 31 00 00 1a d5 35 00 f8 80 00 20 30
48 38 1f 00 34 36 31 00 00 1a 26 4a 00 98 a1 00
2a 40 30 70 1c 00 34 36 31 00 00 1a 9b 40 00 68
81 00 28 30 70 48 1c 00 34 36 31 00 00 18 00 43

----------------

Block 0, Base EDID:
  EDID Structure Version & Revision: 1.3
  Vendor & Product Identification:
    Manufacturer: MTX
    Model: 768
    Serial Number: ...
    Made in: week 38 of 2005
  Basic Display Parameters & Features:
    Analog display
    Signal Level Standard: 0.700 : 0.300 : 1.000 V p-p
    Blank level equals black level
    Sync: Separate Composite SyncOnGreen
    Maximum image size: 41 cm x 31 cm
    Gamma: 2.21
    DPMS levels: Standby Suspend Off
    RGB color display
  Color Characteristics:
    Red  : 0.6376, 0.3417
    Green: 0.2929, 0.6093
    Blue : 0.1474, 0.0683
    White: 0.3134, 0.3291
  Established Timings I & II:
    DMT 0x04:   640x480    59.940476 Hz   4:3     31.469 kHz     25.175000 MHz
    DMT 0x06:   640x480    75.000000 Hz   4:3     37.500 kHz     31.500000 MHz
    DMT 0x09:   800x600    60.316541 Hz   4:3     37.879 kHz     40.000000 MHz
    DMT 0x0b:   800x600    75.000000 Hz   4:3     46.875 kHz     49.500000 MHz
    DMT 0x10:  1024x768    60.003840 Hz   4:3     48.363 kHz     65.000000 MHz
    DMT 0x12:  1024x768    75.028582 Hz   4:3     60.023 kHz     78.750000 MHz
    DMT 0x24:  1280x1024   75.024675 Hz   5:4     79.976 kHz    135.000000 MHz
  Standard Timings:
    DMT 0x33:  1600x1200   60.000000 Hz   4:3     75.000 kHz    162.000000 MHz
    DMT 0x23:  1280x1024   60.019740 Hz   5:4     63.981 kHz    108.000000 MHz
    DMT 0x25:  1280x1024   85.024098 Hz   5:4     91.146 kHz    157.500000 MHz
    DMT 0x20:  1280x960    60.000000 Hz   4:3     60.000 kHz    108.000000 MHz
    DMT 0x21:  1280x960    85.002473 Hz   4:3     85.938 kHz    148.500000 MHz
    DMT 0x13:  1024x768    84.996690 Hz   4:3     68.677 kHz     94.500000 MHz
    DMT 0x0c:   800x600    85.061274 Hz   4:3     53.674 kHz     56.250000 MHz
    DMT 0x07:   640x480    85.008312 Hz   4:3     43.269 kHz     36.000000 MHz
  Detailed Timing Descriptors:
    DTD 1:  2048x768    60.003840 Hz   8:3     48.363 kHz    113.750000 MHz (820 mm x 310 mm)
                 Hfront   88 Hsync  64 Hback  152 Hpol P
                 Vfront    3 Vsync  15 Vback   20 Vpol N
    DTD 2:  2048x768    75.027221 Hz   8:3     60.022 kHz    137.810000 MHz (820 mm x 310 mm)
                 Hfront   72 Hsync  56 Hback  120 Hpol P
                 Vfront    1 Vsync  15 Vback   16 Vpol N
    DTD 3:  2560x1024   59.995803 Hz   5:2     63.956 kHz    189.820000 MHz (820 mm x 310 mm)
                 Hfront   48 Hsync 112 Hback  248 Hpol P
                 Vfront    1 Vsync  12 Vback   29 Vpol N
    DTD 4:  2048x768    85.004400 Hz   8:3     68.684 kHz    165.390000 MHz (820 mm x 310 mm)
                 Hfront  112 Hsync  72 Hback  176 Hpol N
                 Vfront    1 Vsync  12 Vback   27 Vpol N
Checksum: 0x43

----------------

Warnings:

Block 0, Base EDID:
  Detailed Timing Descriptor #3: Image size is 820x310 mm, but based on the picture AR it should be 775x310 mm.

Failures:

Block 0, Base EDID:
  Basic Display Parameters & Features: EDID 1.3 requires that the first detailed timing is the preferred timing.
  Detailed Timing Descriptor #1: Mismatch of image size 820x310 mm vs display size 410x310 mm.
  Detailed Timing Descriptor #2: Mismatch of image size 820x310 mm vs display size 410x310 mm.
  Detailed Timing Descriptor #3: Mismatch of image size 820x310 mm vs display size 410x310 mm.
  Detailed Timing Descriptor #4: Mismatch of image size 820x310 mm vs display size 410x310 mm.
  Missing Display Product Name.
  Missing Display Range Limits Descriptor.
EDID:
  Extension Block 1 started with EDID header, ignoring Extension Blocks >= 1.
  Base EDID: The DTD max image size is 820x310mm, which is larger than the display size 410.0x310.0mm.

EDID conformity: FAIL
