edid-decode (hex):

00 ff ff ff ff ff ff 00 4c 23 b6 0a 00 00 00 00
02 22 01 04 b5 3c 22 78 3b ca 71 ac 50 34 bc 25
0a 50 54 ad cf 00 81 80 95 00 b3 00 d1 c0 71 4f
a9 c0 b3 3c d1 fc 1c 5f 00 b4 a0 a0 29 50 30 20
35 00 55 50 21 00 00 1a 00 00 00 fd 0c 30 b4 ff
ff 50 01 0a 20 20 20 20 20 20 00 00 00 fc 00 53
55 4e 2d 4d 32 37 42 41 31 30 38 0a 00 00 00 ff
00 30 30 30 30 30 30 30 30 30 30 30 30 30 02 f4

02 03 2d f1 23 09 07 07 83 01 00 00 49 01 03 04
90 11 13 1f 20 3f e2 00 7f e3 05 e3 01 e6 06 07
01 65 65 21 68 1a 00 00 01 03 30 b4 00 02 3a 80
18 71 38 2d 40 58 2c 45 00 55 50 21 00 00 1e 6f
c2 00 a0 a0 a0 55 50 30 20 35 00 55 50 21 00 00
1a a0 83 80 a0 70 38 2d 40 30 20 35 00 55 50 21
00 00 1a 00 00 00 00 00 00 00 00 00 00 00 00 00
00 00 00 00 00 00 00 00 00 00 00 00 00 00 00 b7

70 12 79 03 00 03 01 50 f7 e3 00 04 ff 09 9f 00
2f 80 1f 00 9f 05 31 00 02 80 04 00 f5 1c 01 04
ff 09 9f 00 2f 80 1f 00 9f 05 31 00 02 80 04 00
4f 11 01 04 ff 09 9f 00 2f 00 1f 00 9f 05 76 00
02 00 04 00 fb 31 00 04 ff 04 9f 00 2f 00 1f 00
9f 05 28 00 02 00 04 00 00 00 00 00 00 00 00 00
00 00 00 00 00 00 00 00 00 00 00 00 00 00 00 00
00 00 00 00 00 00 00 00 00 00 00 00 00 00 1e 90

00 ff ff ff ff ff ff 00 4c 23 b6 0a 00 00 00 00
02 22 01 04 b5 3c 22 78 3b ca 71 ac 50 34 bc 25
0a 50 54 ad cf 00 81 80 95 00 b3 00 d1 c0 71 4f
a9 c0 b3 3c d1 fc 1c 5f 00 b4 a0 a0 29 50 30 20
35 00 55 50 21 00 00 1a 00 00 00 fd 0c 30 b4 ff
ff 50 01 0a 20 20 20 20 20 20 00 00 00 fc 00 53
55 4e 2d 4d 32 37 42 41 31 30 38 0a 00 00 00 ff
00 30 30 30 30 30 30 30 30 30 30 30 30 30 02 f4

02 03 2d f1 23 09 07 07 83 01 00 00 49 01 03 04
90 11 13 1f 20 3f e2 00 7f e3 05 e3 01 e6 06 07
01 65 65 21 68 1a 00 00 01 03 30 b4 00 02 3a 80
18 71 38 2d 40 58 2c 45 00 55 50 21 00 00 1e 6f
c2 00 a0 a0 a0 55 50 30 20 35 00 55 50 21 00 00
1a a0 83 80 a0 70 38 2d 40 30 20 35 00 55 50 21
00 00 1a 00 00 00 00 00 00 00 00 00 00 00 00 00
00 00 00 00 00 00 00 00 00 00 00 00 00 00 00 b7

70 12 79 03 00 03 01 50 f7 e3 00 04 ff 09 9f 00
2f 80 1f 00 9f 05 31 00 02 80 04 00 f5 1c 01 04
ff 09 9f 00 2f 80 1f 00 9f 05 31 00 02 80 04 00
4f 11 01 04 ff 09 9f 00 2f 00 1f 00 9f 05 76 00
02 00 04 00 fb 31 00 04 ff 04 9f 00 2f 00 1f 00
9f 05 28 00 02 00 04 00 00 00 00 00 00 00 00 00
00 00 00 00 00 00 00 00 00 00 00 00 00 00 00 00
00 00 00 00 00 00 00 00 00 00 00 00 00 00 1e 90

----------------

Block 0, Base EDID:
  EDID Structure Version & Revision: 1.4
  Vendor & Product Identification:
    Manufacturer: SAC
    Model: 2742
    Made in: week 2 of 2024
  Basic Display Parameters & Features:
    Digital display
    Bits per primary color channel: 10
    DisplayPort interface
    Maximum image size: 60 cm x 34 cm
    Gamma: 2.20
    DPMS levels: Off
    Supported color formats: RGB 4:4:4, YCrCb 4:4:4, YCrCb 4:2:2
    First detailed timing includes the native pixel format and preferred refresh rate
    Display supports continuous frequencies
  Color Characteristics:
    Red  : 0.6748, 0.3125
    Green: 0.2050, 0.7363
    Blue : 0.1455, 0.0419
    White: 0.3125, 0.3291
  Established Timings I & II:
    IBM     :   720x400    70.081663 Hz   9:5     31.467 kHz     28.320000 MHz
    DMT 0x04:   640x480    59.940476 Hz   4:3     31.469 kHz     25.175000 MHz
    DMT 0x05:   640x480    72.808802 Hz   4:3     37.861 kHz     31.500000 MHz
    DMT 0x06:   640x480    75.000000 Hz   4:3     37.500 kHz     31.500000 MHz
    DMT 0x09:   800x600    60.316541 Hz   4:3     37.879 kHz     40.000000 MHz
    DMT 0x0a:   800x600    72.187572 Hz   4:3     48.077 kHz     50.000000 MHz
    DMT 0x0b:   800x600    75.000000 Hz   4:3     46.875 kHz     49.500000 MHz
    DMT 0x10:  1024x768    60.003840 Hz   4:3     48.363 kHz     65.000000 MHz
    DMT 0x11:  1024x768    70.069359 Hz   4:3     56.476 kHz     75.000000 MHz
    DMT 0x12:  1024x768    75.028582 Hz   4:3     60.023 kHz     78.750000 MHz
    DMT 0x24:  1280x1024   75.024675 Hz   5:4     79.976 kHz    135.000000 MHz
  Standard Timings:
    DMT 0x23:  1280x1024   60.019740 Hz   5:4     63.981 kHz    108.000000 MHz
    DMT 0x2f:  1440x900    59.887445 Hz  16:10    55.935 kHz    106.500000 MHz
    DMT 0x3a:  1680x1050   59.954250 Hz  16:10    65.290 kHz    146.250000 MHz
    DMT 0x52:  1920x1080   60.000000 Hz  16:9     67.500 kHz    148.500000 MHz
    DMT 0x15:  1152x864    75.000000 Hz   4:3     67.500 kHz    108.000000 MHz
    DMT 0x53:  1600x900    60.000000 Hz  16:9     60.000 kHz    108.000000 MHz (RB)
    GTF     :  1680x1050  120.000000 Hz  16:10   135.000 kHz    313.200000 MHz
    GTF     :  1920x1080  119.999987 Hz  16:9    138.840 kHz    368.759000 MHz
  Detailed Timing Descriptors:
    DTD 1:  2560x1440   60.000887 Hz  16:9     88.861 kHz    243.480000 MHz (597 mm x 336 mm)
                 Hfront   48 Hsync  32 Hback  100 Hpol P
                 Vfront    3 Vsync   5 Vback   33 Vpol N
    Display Range Limits:
      Monitor ranges (Range Limits Only): 48-180 Hz V, 510-510 kHz H, max dotclock 800 MHz
    Display Product Name: 'SUN-M27BA108'
    Display Product Serial Number: ...
  Extension blocks: 2
Checksum: 0xf4

----------------

Block 1, CTA-861 Extension Block:
  Revision: 3
  Underscans IT Video Formats by default
  Basic audio support
  Supports YCbCr 4:4:4
  Supports YCbCr 4:2:2
  Native DTDs: 1
  Audio Data Block:
    Linear PCM:
      Max channels: 2
      Supported sample rates (kHz): 48 44.1 32
      Supported sample sizes (bits): 24 20 16
  Speaker Allocation Data Block:
    FL/FR - Front Left/Right
  Video Data Block:
    VIC   1:   640x480    59.940476 Hz   4:3     31.469 kHz     25.175000 MHz
    VIC   3:   720x480    59.940060 Hz  16:9     31.469 kHz     27.000000 MHz
    VIC   4:  1280x720    60.000000 Hz  16:9     45.000 kHz     74.250000 MHz
    VIC  16:  1920x1080   60.000000 Hz  16:9     67.500 kHz    148.500000 MHz (native)
    VIC  17:   720x576    50.000000 Hz   4:3     31.250 kHz     27.000000 MHz
    VIC  19:  1280x720    50.000000 Hz  16:9     37.500 kHz     74.250000 MHz
    VIC  31:  1920x1080   50.000000 Hz  16:9     56.250 kHz    148.500000 MHz
    VIC  32:  1920x1080   24.000000 Hz  16:9     27.000 kHz     74.250000 MHz
    VIC  63:  1920x1080  120.000000 Hz  16:9    135.000 kHz    297.000000 MHz
  Video Capability Data Block:
    YCbCr quantization: No Data
    RGB quantization: Selectable (via AVI Q)
    PT scan behavior: Supports both over- and underscan
    IT scan behavior: Supports both over- and underscan
    CE scan behavior: Supports both over- and underscan
  Colorimetry Data Block:
    xvYCC601
    xvYCC709
    BT2020cYCC
    BT2020YCC
    BT2020RGB
    Gamut Boundary Description Metadata Profile P0
  HDR Static Metadata Data Block:
    Electro optical transfer functions:
      Traditional gamma - SDR luminance range
      Traditional gamma - HDR luminance range
      SMPTE ST2084
    Supported static metadata descriptors:
      Static metadata type 1
    Desired content max luminance: 101 (445.755 cd/m^2)
    Desired content max frame-average luminance: 101 (445.755 cd/m^2)
    Desired content min luminance: 33 (0.075 cd/m^2)
  Vendor-Specific Data Block (AMD), OUI 00-00-1A:
    Version: 1
    Feature Caps: 0x03
    Minimum Refresh Rate: 48 Hz
    Maximum Refresh Rate: 180 Hz
    Flags 1.x: 0x00
  Detailed Timing Descriptors:
    DTD 2:  1920x1080   60.000000 Hz  16:9     67.500 kHz    148.500000 MHz (597 mm x 336 mm)
                 Hfront   88 Hsync  44 Hback  148 Hpol P
                 Vfront    4 Vsync   5 Vback   36 Vpol P
    DTD 3:  2560x1440  119.997589 Hz  16:9    182.996 kHz    497.750000 MHz (597 mm x 336 mm)
                 Hfront   48 Hsync  32 Hback   80 Hpol P
                 Vfront    3 Vsync   5 Vback   77 Vpol N
    DTD 4:  1920x1080  144.000000 Hz  16:9    162.000 kHz    336.960000 MHz (597 mm x 336 mm)
                 Hfront   48 Hsync  32 Hback   80 Hpol P
                 Vfront    3 Vsync   5 Vback   37 Vpol N
Checksum: 0xb7  Unused space in Extension Block: 28 bytes

----------------

Block 2, DisplayID Extension Block:
  Version: 1.2
  Extension Count: 0
  Display Product Type: Standalone display device
  Video Timing Modes Type 1 - Detailed Timings Data Block:
    DTD:  2560x1440  143.999210 Hz  16:9    214.559 kHz    583.600000 MHz (aspect 16:9, no 3D stereo)
               Hfront   48 Hsync  32 Hback   80 Hpol P
               Vfront    3 Vsync   5 Vback   42 Vpol P
    DTD:  2560x1440  179.999013 Hz  16:9    268.199 kHz    729.500000 MHz (aspect 16:9, no 3D stereo)
               Hfront   48 Hsync  32 Hback   80 Hpol P
               Vfront    3 Vsync   5 Vback   42 Vpol P
    DTD:  2560x1440  165.000189 Hz  16:9    257.235 kHz    699.680000 MHz (aspect 16:9, no 3D stereo)
               Hfront   48 Hsync  32 Hback   80 Hpol N
               Vfront    3 Vsync   5 Vback  111 Vpol N
    DTD:  1280x1440   60.000750 Hz  16:9     88.861 kHz    127.960000 MHz (aspect 16:9, no 3D stereo)
               Hfront   48 Hsync  32 Hback   80 Hpol N
               Vfront    3 Vsync   5 Vback   33 Vpol N
  Checksum: 0x1e
Checksum: 0x90

----------------

Warnings:

Block 0, Base EDID:
  Display Product Serial Number: ...
Block 1, CTA-861 Extension Block:
  Video Data Block: VIC 1 and the first DTD are not identical. Is this intended?
  Video Data Block: All VICs are in ascending order, and the first (preferred) VIC <= 4, is that intended?
  Video Capability Data Block: Set Selectable YCbCr Quantization to avoid interop issues.
  Video Capability Data Block: S_PT is equal to S_IT and S_CE, so should be set to 0 instead.
  Colorimetry Data Block: Set the sRGB colorimetry bit to avoid interop issues.
EDID:
  Base EDID: Some timings are out of range of the Monitor Ranges:
    Vertical Freq: 24.000 - 179.999 Hz (Monitor: 48.000 - 180.000 Hz)
    Horizontal Freq: 27.000 - 268.198 kHz (Monitor: 510.000 - 510.000 kHz)

Failures:

EDID:
  Extension Block 3 started with EDID header, ignoring Extension Blocks >= 3.
  CTA-861: Native progressive timings are a mix of several resolutions.
  DisplayID: Missing DisplayID Display Parameters Data Block.
  DisplayID: DisplayID expects at least one preferred timing.

EDID conformity: FAIL
