edid-decode (hex):

00 ff ff ff ff ff ff 00 09 e5 2c 0a 00 00 00 00
1a 20 01 04 b5 22 16 78 07 82 35 a5 53 4a 9e 26
0f 50 54 00 00 00 01 01 01 01 01 01 01 01 01 01
01 01 01 01 01 01 8f 70 00 c8 a0 40 8c 60 30 20
36 00 59 d7 10 00 00 1a 00 00 00 fd 0c 3c a5 20
20 4f 01 0a 20 20 20 20 20 20 00 00 00 fe 00 42
4f 45 20 43 51 0a 20 20 20 20 20 20 00 00 00 fe
00 4e 45 31 36 30 51 44 4d 2d 4e 59 31 0a 01 94

70 20 79 02 00 22 00 14 4b 17 0c 85 ff 09 c7 00
2f 00 1f 00 3f 06 8b 00 02 00 05 00 25 01 09 4b
17 0c 4b 17 0c 3c a5 80 81 00 13 72 1a 00 00 03
01 3c a5 00 00 6a 48 6a 48 a5 00 00 00 00 2b 00
06 27 00 3c a4 00 00 00 00 00 00 00 00 00 00 00
00 00 00 00 00 00 00 00 00 00 00 00 00 00 00 00
00 00 00 00 00 00 00 00 00 00 00 00 00 00 00 00
00 00 00 00 00 00 00 00 00 00 00 00 00 00 96 90

00 ff ff ff ff ff ff 00 09 e5 2c 0a 00 00 00 00
1a 20 01 04 b5 22 16 78 07 82 35 a5 53 4a 9e 26
0f 50 54 00 00 00 01 01 01 01 01 01 01 01 01 01
01 01 01 01 01 01 8f 70 00 c8 a0 40 8c 60 30 20
36 00 59 d7 10 00 00 1a 00 00 00 fd 0c 3c a5 20
20 4f 01 0a 20 20 20 20 20 20 00 00 00 fe 00 42
4f 45 20 43 51 0a 20 20 20 20 20 20 00 00 00 fe
00 4e 45 31 36 30 51 44 4d 2d 4e 59 31 0a 01 94

70 20 79 02 00 22 00 14 4b 17 0c 85 ff 09 c7 00
2f 00 1f 00 3f 06 8b 00 02 00 05 00 25 01 09 4b
17 0c 4b 17 0c 3c a5 80 81 00 13 72 1a 00 00 03
01 3c a5 00 00 6a 48 6a 48 a5 00 00 00 00 2b 00
06 27 00 3c a4 00 00 00 00 00 00 00 00 00 00 00
00 00 00 00 00 00 00 00 00 00 00 00 00 00 00 00
00 00 00 00 00 00 00 00 00 00 00 00 00 00 00 00
00 00 00 00 00 00 00 00 00 00 00 00 00 00 96 90

----------------

Block 0, Base EDID:
  EDID Structure Version & Revision: 1.4
  Vendor & Product Identification:
    Manufacturer: BOE
    Model: 2604
    Made in: week 26 of 2022
  Basic Display Parameters & Features:
    Digital display
    Bits per primary color channel: 10
    DisplayPort interface
    Maximum image size: 34 cm x 22 cm
    Gamma: 2.20
    Supported color formats: RGB 4:4:4
    Default (sRGB) color space is primary color space
    First detailed timing includes the native pixel format and preferred refresh rate
    Display supports continuous frequencies
  Color Characteristics:
    Red  : 0.6464, 0.3242
    Green: 0.2890, 0.6191
    Blue : 0.1484, 0.0615
    White: 0.3134, 0.3291
  Established Timings I & II: none
  Standard Timings: none
  Detailed Timing Descriptors:
    DTD 1:  2560x1600   60.001249 Hz  16:10   104.402 kHz    288.150000 MHz (345 mm x 215 mm)
                 Hfront   48 Hsync  32 Hback  120 Hpol P
                 Vfront    3 Vsync   6 Vback  131 Vpol N
    Display Range Limits:
      Monitor ranges (Range Limits Only): 60-165 Hz V, 287-287 kHz H, max dotclock 790 MHz
    Alphanumeric Data String: 'BOE CQ'
    Alphanumeric Data String: 'NE160QDM-NY1'
  Extension blocks: 1
Checksum: 0x94

----------------

Block 1, DisplayID Extension Block:
  Version: 2.0
  Extension Count: 0
  Display Product Primary Use Case: None of the listed primary use cases; generic display
  Video Timing Modes Type 7 - Detailed Timings Data Block:
    DTD:  2560x1600  165.000000 Hz  16:10   287.100 kHz    792.396000 MHz (aspect 16:10, no 3D stereo, preferred)
               Hfront   48 Hsync  32 Hback  120 Hpol N
               Vfront    3 Vsync   6 Vback  131 Vpol N
  Dynamic Video Timing Range Limits Data Block:
    Minimum Pixel Clock: 792396 kHz
    Maximum Pixel Clock: 792396 kHz
    Minimum Vertical Refresh Rate: 60 Hz
    Maximum Vertical Refresh Rate: 165 Hz
    Seamless Dynamic Video Timing Support: Yes
  CTA-861 DisplayID Data Block:
  Vendor-Specific Data Block (AMD), OUI 00-00-1A:
    Version: 3
    Flags 1: 0x01
      FreeSync Supported
    Minimum Refresh Rate: 60 Hz
    Maximum Refresh Rate: 165 Hz
    Flags 5: 0x00
  Adaptive Sync Data Block:
    Descriptor #1:
      Native Panel Range
      Fixed Average V-Total and Adaptive V-Total
      Supports Seamless Transition
      'Max Single Frame Duration Increase' field value without jitter impact
      'Max Single Frame Duration Decrease' field value without jitter impact
      Max Duration Increase: 0.00 ms
      Max Duration Decrease: 0.00 ms
      Min Refresh Rate: 60 Hz
      Max Refresh Rate: 165 Hz
  Checksum: 0x96
Checksum: 0x90

----------------

Warnings:

Block 0, Base EDID:
  Missing Display Product Name.
EDID:
  Base EDID: Some timings are out of range of the Monitor Ranges:
    Horizontal Freq: 104.402 - 287.100 kHz (Monitor: 287.000 - 287.000 kHz)
    Maximum Clock: 792.396 MHz (Monitor: 790.000 MHz)

Failures:

Block 0, Base EDID:
  Basic Display Parameters & Features: sRGB is signaled, but the chromaticities do not match.
EDID:
  Extension Block 2 started with EDID header, ignoring Extension Blocks >= 2.
  DisplayID: Missing DisplayID Display Parameters Data Block.

EDID conformity: FAIL
