edid-decode (hex):

00 ff ff ff ff ff ff 00 1c 54 0e 27 01 01 01 01
01 1f 01 03 81 3c 22 78 e3 cb 85 a7 53 35 b6 25
0d 50 54 bf cf 00 d1 c0 71 4f 81 c0 81 40 81 80
95 00 b3 00 01 01 56 5e 00 a0 a0 a0 29 50 30 20
35 00 54 4f 21 00 00 1e 00 00 00 fd 0c 30 f0 87
87 3c 01 0a 20 20 20 20 20 20 00 00 00 fc 00 41
4f 52 55 53 20 46 49 32 37 51 2d 58 00 00 00 ff
00 32 31 30 31 30 42 30 30 32 30 37 35 0a 01 34

02 03 48 71 4d 01 02 03 11 12 1f 04 13 10 29 2f
40 3f 23 09 17 07 83 01 00 00 67 03 0c 00 10 00
10 3c 67 d8 5d c4 01 78 80 00 e4 0f 00 00 00 6d
1a 00 00 02 01 30 f0 00 00 00 00 00 00 e3 05 c0
00 e6 06 05 01 62 62 4a 9e 7f 00 50 a0 a0 3c 50
18 10 25 00 54 4f 21 00 00 1a a1 99 80 64 70 38
64 40 18 10 25 00 54 4f 21 00 00 1a 04 c0 00 64
a0 a0 64 50 18 10 25 00 54 4f 21 00 00 1a 00 31

00 ff ff ff ff ff ff 00 1c 54 0e 27 01 01 01 01
01 1f 01 03 81 3c 22 78 e3 cb 85 a7 53 35 b6 25
0d 50 54 bf cf 00 d1 c0 71 4f 81 c0 81 40 81 80
95 00 b3 00 01 01 56 5e 00 a0 a0 a0 29 50 30 20
35 00 54 4f 21 00 00 1e 00 00 00 fd 0c 30 f0 87
87 3c 01 0a 20 20 20 20 20 20 00 00 00 fc 00 41
4f 52 55 53 20 46 49 32 37 51 2d 58 00 00 00 ff
00 32 31 30 31 30 42 30 30 32 30 37 35 0a 01 34

02 03 48 71 4d 01 02 03 11 12 1f 04 13 10 29 2f
40 3f 23 09 17 07 83 01 00 00 67 03 0c 00 10 00
10 3c 67 d8 5d c4 01 78 80 00 e4 0f 00 00 00 6d
1a 00 00 02 01 30 f0 00 00 00 00 00 00 e3 05 c0
00 e6 06 05 01 62 62 4a 9e 7f 00 50 a0 a0 3c 50
18 10 25 00 54 4f 21 00 00 1a a1 99 80 64 70 38
64 40 18 10 25 00 54 4f 21 00 00 1a 04 c0 00 64
a0 a0 64 50 18 10 25 00 54 4f 21 00 00 1a 00 31

----------------

Block 0, Base EDID:
  EDID Structure Version & Revision: 1.3
  Vendor & Product Identification:
    Manufacturer: GBT
    Model: 9998
    Serial Number: ...
    Made in: week 1 of 2021
  Basic Display Parameters & Features:
    Digital display
    DFP 1.x compatible TMDS
    Maximum image size: 60 cm x 34 cm
    Gamma: 2.20
    DPMS levels: Standby Suspend Off
    Monochrome or grayscale display
    First detailed timing is the preferred timing
    Supports GTF timings within operating range
  Color Characteristics:
    Red  : 0.6552, 0.3242
    Green: 0.2089, 0.7138
    Blue : 0.1464, 0.0507
    White: 0.3134, 0.3291
  Established Timings I & II:
    IBM     :   720x400    70.081663 Hz   9:5     31.467 kHz     28.320000 MHz
    DMT 0x04:   640x480    59.940476 Hz   4:3     31.469 kHz     25.175000 MHz
    Apple   :   640x480    66.666667 Hz   4:3     35.000 kHz     30.240000 MHz
    DMT 0x05:   640x480    72.808802 Hz   4:3     37.861 kHz     31.500000 MHz
    DMT 0x06:   640x480    75.000000 Hz   4:3     37.500 kHz     31.500000 MHz
    DMT 0x08:   800x600    56.250000 Hz   4:3     35.156 kHz     36.000000 MHz
    DMT 0x09:   800x600    60.316541 Hz   4:3     37.879 kHz     40.000000 MHz
    DMT 0x0a:   800x600    72.187572 Hz   4:3     48.077 kHz     50.000000 MHz
    DMT 0x0b:   800x600    75.000000 Hz   4:3     46.875 kHz     49.500000 MHz
    DMT 0x10:  1024x768    60.003840 Hz   4:3     48.363 kHz     65.000000 MHz
    DMT 0x11:  1024x768    70.069359 Hz   4:3     56.476 kHz     75.000000 MHz
    DMT 0x12:  1024x768    75.028582 Hz   4:3     60.023 kHz     78.750000 MHz
    DMT 0x24:  1280x1024   75.024675 Hz   5:4     79.976 kHz    135.000000 MHz
  Standard Timings:
    DMT 0x52:  1920x1080   60.000000 Hz  16:9     67.500 kHz    148.500000 MHz
    DMT 0x15:  1152x864    75.000000 Hz   4:3     67.500 kHz    108.000000 MHz
    DMT 0x55:  1280x720    60.000000 Hz  16:9     45.000 kHz     74.250000 MHz
    DMT 0x20:  1280x960    60.000000 Hz   4:3     60.000 kHz    108.000000 MHz
    DMT 0x23:  1280x1024   60.019740 Hz   5:4     63.981 kHz    108.000000 MHz
    DMT 0x2f:  1440x900    59.887445 Hz  16:10    55.935 kHz    106.500000 MHz
    DMT 0x3a:  1680x1050   59.954250 Hz  16:10    65.290 kHz    146.250000 MHz
  Detailed Timing Descriptors:
    DTD 1:  2560x1440   59.950550 Hz  16:9     88.787 kHz    241.500000 MHz (596 mm x 335 mm)
                 Hfront   48 Hsync  32 Hback   80 Hpol P
                 Vfront    3 Vsync   5 Vback   33 Vpol P
    Display Range Limits:
      Monitor ranges (Range Limits Only): 48-240 Hz V, 135-135 kHz H, max dotclock 600 MHz
    Display Product Name: 'AORUS FI27Q-X'
    Display Product Serial Number: ...
  Extension blocks: 1
Checksum: 0x34

----------------

Block 1, CTA-861 Extension Block:
  Revision: 3
  Basic audio support
  Supports YCbCr 4:4:4
  Supports YCbCr 4:2:2
  Native DTDs: 1
  Video Data Block:
    VIC   1:   640x480    59.940476 Hz   4:3     31.469 kHz     25.175000 MHz
    VIC   2:   720x480    59.940060 Hz   4:3     31.469 kHz     27.000000 MHz
    VIC   3:   720x480    59.940060 Hz  16:9     31.469 kHz     27.000000 MHz
    VIC  17:   720x576    50.000000 Hz   4:3     31.250 kHz     27.000000 MHz
    VIC  18:   720x576    50.000000 Hz  16:9     31.250 kHz     27.000000 MHz
    VIC  31:  1920x1080   50.000000 Hz  16:9     56.250 kHz    148.500000 MHz
    VIC   4:  1280x720    60.000000 Hz  16:9     45.000 kHz     74.250000 MHz
    VIC  19:  1280x720    50.000000 Hz  16:9     37.500 kHz     74.250000 MHz
    VIC  16:  1920x1080   60.000000 Hz  16:9     67.500 kHz    148.500000 MHz
    VIC  41:  1280x720   100.000000 Hz  16:9     75.000 kHz    148.500000 MHz
    VIC  47:  1280x720   120.000000 Hz  16:9     90.000 kHz    148.500000 MHz
    VIC  64:  1920x1080  100.000000 Hz  16:9    112.500 kHz    297.000000 MHz
    VIC  63:  1920x1080  120.000000 Hz  16:9    135.000 kHz    297.000000 MHz
  Audio Data Block:
    Linear PCM:
      Max channels: 2
      Supported sample rates (kHz): 96 48 44.1 32
      Supported sample sizes (bits): 24 20 16
  Speaker Allocation Data Block:
    FL/FR - Front Left/Right
  Vendor-Specific Data Block (HDMI), OUI 00-0C-03:
    Source physical address: 1.0.0.0
    DC_30bit
    Maximum TMDS clock: 300 MHz
  Vendor-Specific Data Block (HDMI Forum), OUI C4-5D-D8:
    Version: 1
    Maximum TMDS Character Rate: 600 MHz
    SCDC Present
  YCbCr 4:2:0 Capability Map Data Block:
    Empty Capability Map
  Vendor-Specific Data Block (AMD), OUI 00-00-1A:
    Version: 2
    Flags 1: 0x01
      FreeSync Supported
    Minimum Refresh Rate: 48 Hz
    Maximum Refresh Rate: 240 Hz
    Flags 5: 0x00
  Colorimetry Data Block:
    BT2020YCC
    BT2020RGB
  HDR Static Metadata Data Block:
    Electro optical transfer functions:
      Traditional gamma - SDR luminance range
      SMPTE ST2084
    Supported static metadata descriptors:
      Static metadata type 1
    Desired content max luminance: 98 (417.710 cd/m^2)
    Desired content max frame-average luminance: 98 (417.710 cd/m^2)
    Desired content min luminance: 74 (0.352 cd/m^2)
  Detailed Timing Descriptors:
    DTD 2:  2560x1440   82.500000 Hz  16:9    123.750 kHz    326.700000 MHz (596 mm x 335 mm)
                 Hfront   24 Hsync  16 Hback   40 Hpol P
                 Vfront    2 Vsync   5 Vback   53 Vpol N
    DTD 3:  1920x1080  164.998322 Hz  16:9    194.698 kHz    393.290000 MHz (596 mm x 335 mm)
                 Hfront   24 Hsync  16 Hback   60 Hpol P
                 Vfront    2 Vsync   5 Vback   93 Vpol N
    DTD 4:  2560x1440  119.998047 Hz  16:9    184.797 kHz    491.560000 MHz (596 mm x 335 mm)
                 Hfront   24 Hsync  16 Hback   60 Hpol P
                 Vfront    2 Vsync   5 Vback   93 Vpol N
Checksum: 0x31  Unused space in Extension Block: 1 byte

----------------

Warnings:

Block 0, Base EDID:
  Vendor & Product Identification: The serial number is one of the known dummy values, it should probably be set to 0.
Block 1, CTA-861 Extension Block:
  IT Video Formats are overscanned by default, but normally this should be underscanned.
  Video Data Block: VIC 1 and the first DTD are not identical. Is this intended?
  Colorimetry Data Block: Set the sRGB colorimetry bit to avoid interop issues.
  Display Product Serial Number is set, so the Serial Number in the Base EDID should be 0.
EDID:
  Base EDID: Some timings are out of range of the Monitor Ranges:
    Horizontal Freq: 31.250 - 194.698 kHz (Monitor: 135.000 - 135.000 kHz)

Failures:

Block 0, Base EDID:
  Display Descriptor #2: Monitor descriptor block has byte 4 nonzero (0x0c).
  Display Range Limits: 'Range Limits Only' is not allowed for EDID < 1.4.
Block 1, CTA-861 Extension Block:
  YCbCr 4:2:0 Capability Map Data Block: Empty Capability Map.
  Missing VCDB, needed for Set Selectable RGB Quantization to avoid interop issues.
EDID:
  Extension Block 2 started with EDID header, ignoring Extension Blocks >= 2.

EDID conformity: FAIL
