edid-decode (hex):

00 ff ff ff ff ff ff 00 4c ad 24 03 00 00 00 00
00 19 01 03 80 35 1e 78 0a de 5d a3 54 4c 99 26
0f 47 4a 00 00 00 01 01 01 01 01 01 01 01 01 01
01 01 01 01 01 10 02 3a 80 18 71 38 2d 40 58 2c
45 00 0f 28 21 00 00 1e 00 00 00 fd 00 32 3c 1e
51 11 00 0a 20 20 20 20 20 20 00 00 00 ff 00 30
30 0a 20 20 20 20 20 20 20 20 20 20 00 00 00 fc
00 53 45 43 2d 37 30 30 41 34 4b 0a 20 20 01 4b

00 ff ff ff ff ff ff 00 4c ad 24 03 00 00 00 00
00 19 01 03 80 35 1e 78 0a de 5d a3 54 4c 99 26
0f 47 4a 00 00 00 01 01 01 01 01 01 01 01 01 01
01 01 01 01 01 10 02 3a 80 18 71 38 2d 40 58 2c
45 00 0f 28 21 00 00 1e 00 00 00 fd 00 32 3c 1e
51 11 00 0a 20 20 20 20 20 20 00 00 00 ff 00 30
30 0a 20 20 20 20 20 20 20 20 20 20 00 00 00 fc
00 53 45 43 2d 37 30 30 41 34 4b 0a 20 20 01 4b

00 ff ff ff ff ff ff 00 4c ad 24 03 00 00 00 00
00 19 01 03 80 35 1e 78 0a de 5d a3 54 4c 99 26
0f 47 4a 00 00 00 01 01 01 01 01 01 01 01 01 01
01 01 01 01 01 10 02 3a 80 18 71 38 2d 40 58 2c
45 00 0f 28 21 00 00 1e 00 00 00 fd 00 32 3c 1e
51 11 00 0a 20 20 20 20 20 20 00 00 00 ff 00 30
30 0a 20 20 20 20 20 20 20 20 20 20 00 00 00 fc
00 53 45 43 2d 37 30 30 41 34 4b 0a 20 20 01 4b

00 ff ff ff ff ff ff 00 4c ad 24 03 00 00 00 00
00 19 01 03 80 35 1e 78 0a de 5d a3 54 4c 99 26
0f 47 4a 00 00 00 01 01 01 01 01 01 01 01 01 01
01 01 01 01 01 10 02 3a 80 18 71 38 2d 40 58 2c
45 00 0f 28 21 00 00 1e 00 00 00 fd 00 32 3c 1e
51 11 00 0a 20 20 20 20 20 20 00 00 00 ff 00 30
30 0a 20 20 20 20 20 20 20 20 20 20 00 00 00 fc
00 53 45 43 2d 37 30 30 41 34 4b 0a 20 20 01 4b

----------------

Block 0, Base EDID:
  EDID Structure Version & Revision: 1.3
  Vendor & Product Identification:
    Manufacturer: SEM
    Model: 804
    Made in: 2015
  Basic Display Parameters & Features:
    Digital display
    Maximum image size: 53 cm x 30 cm
    Gamma: 2.20
    RGB color display
    First detailed timing is the preferred timing
  Color Characteristics:
    Red  : 0.6396, 0.3291
    Green: 0.2998, 0.5996
    Blue : 0.1494, 0.0595
    White: 0.2802, 0.2900
  Established Timings I & II: none
  Standard Timings:
  Detailed Timing Descriptors:
    DTD 1:  1920x1080   60.000000 Hz  16:9     67.500 kHz    148.500000 MHz (527 mm x 296 mm)
                 Hfront   88 Hsync  44 Hback  148 Hpol P
                 Vfront    4 Vsync   5 Vback   36 Vpol P
    Display Range Limits:
      Monitor ranges (GTF): 50-60 Hz V, 30-81 kHz H, max dotclock 170 MHz
    Display Product Serial Number: ...
    Display Product Name: 'SEC-700A4K'
  Extension blocks: 1
Checksum: 0x4b

----------------

Block 1, Unknown EDID Extension Block 0x00:
  00 ff ff ff ff ff ff 00 4c ad 24 03 00 00 00 00 '........L.$.....'
  00 19 01 03 80 35 1e 78 0a de 5d a3 54 4c 99 26 '.....5.x..].TL.&'
  0f 47 4a 00 00 00 01 01 01 01 01 01 01 01 01 01 '.GJ.............'
  01 01 01 01 01 10 02 3a 80 18 71 38 2d 40 58 2c '.......:..q8-@X,'
  45 00 0f 28 21 00 00 1e 00 00 00 fd 00 32 3c 1e 'E..(!........2<.'
  51 11 00 0a 20 20 20 20 20 20 00 00 00 ff 00 30 'Q...      .....0'
  30 0a 20 20 20 20 20 20 20 20 20 20 00 00 00 fc '0.          ....'
  00 53 45 43 2d 37 30 30 41 34 4b 0a 20 20 01 4b '.SEC-700A4K.  .K'
Checksum: 0x4b

----------------

Block 2, Unknown EDID Extension Block 0x00:
  00 ff ff ff ff ff ff 00 4c ad 24 03 00 00 00 00 '........L.$.....'
  00 19 01 03 80 35 1e 78 0a de 5d a3 54 4c 99 26 '.....5.x..].TL.&'
  0f 47 4a 00 00 00 01 01 01 01 01 01 01 01 01 01 '.GJ.............'
  01 01 01 01 01 10 02 3a 80 18 71 38 2d 40 58 2c '.......:..q8-@X,'
  45 00 0f 28 21 00 00 1e 00 00 00 fd 00 32 3c 1e 'E..(!........2<.'
  51 11 00 0a 20 20 20 20 20 20 00 00 00 ff 00 30 'Q...      .....0'
  30 0a 20 20 20 20 20 20 20 20 20 20 00 00 00 fc '0.          ....'
  00 53 45 43 2d 37 30 30 41 34 4b 0a 20 20 01 4b '.SEC-700A4K.  .K'
Checksum: 0x4b

----------------

Block 3, Unknown EDID Extension Block 0x00:
  00 ff ff ff ff ff ff 00 4c ad 24 03 00 00 00 00 '........L.$.....'
  00 19 01 03 80 35 1e 78 0a de 5d a3 54 4c 99 26 '.....5.x..].TL.&'
  0f 47 4a 00 00 00 01 01 01 01 01 01 01 01 01 01 '.GJ.............'
  01 01 01 01 01 10 02 3a 80 18 71 38 2d 40 58 2c '.......:..q8-@X,'
  45 00 0f 28 21 00 00 1e 00 00 00 fd 00 32 3c 1e 'E..(!........2<.'
  51 11 00 0a 20 20 20 20 20 20 00 00 00 ff 00 30 'Q...      .....0'
  30 0a 20 20 20 20 20 20 20 20 20 20 00 00 00 fc '0.          ....'
  00 53 45 43 2d 37 30 30 41 34 4b 0a 20 20 01 4b '.SEC-700A4K.  .K'
Checksum: 0x4b

----------------

Warnings:

Block 0, Base EDID:
  Display Product Serial Number: ...

Failures:

Block 0, Base EDID:
  Standard Timings: Use 0x0101 as the invalid Standard Timings code, not 0x0110.
Block 1, Base EDID:
  Unknown Extension Block.
Block 2, Base EDID:
  Unknown Extension Block.
Block 3, Base EDID:
  Unknown Extension Block.
EDID:
  Base EDID: EDID specified 1 extension block(s), but found 3 extension block(s).
  Base EDID: EDID 1.3 requires a Block Map Extension in Block 1 if there are more than 2 blocks in the EDID.

EDID conformity: FAIL
