edid-decode (hex):

00 ff ff ff ff ff ff 00 06 af ae b0 00 00 00 00
20 21 01 04 a5 22 16 78 03 34 b5 a9 54 48 a0 24
0e 50 54 00 00 00 01 01 01 01 01 01 01 01 01 01
01 01 01 01 01 01 8c 3c 80 a0 70 b0 28 40 30 20
a5 00 58 d7 10 00 00 18 8c 3c 80 a0 70 b0 96 42
30 20 a5 00 58 d7 10 00 00 18 00 00 00 fd 00 28
3c 4b 4b 10 01 0a 20 20 20 20 20 20 00 00 00 fe
00 42 31 36 30 55 41 4e 30 36 2e 4b 20 0a 00 23

00 ff ff ff ff ff ff 00 06 af ae b0 00 00 00 00
20 21 01 04 a5 22 16 78 03 34 b5 a9 54 48 a0 24
0e 50 54 00 00 00 01 01 01 01 01 01 01 01 01 01
01 01 01 01 01 01 8c 3c 80 a0 70 b0 28 40 30 20
a5 00 58 d7 10 00 00 18 8c 3c 80 a0 70 b0 96 42
30 20 a5 00 58 d7 10 00 00 18 00 00 00 fd 00 28
3c 4b 4b 10 01 0a 20 20 20 20 20 20 00 00 00 fe
00 42 31 36 30 55 41 4e 30 36 2e 4b 20 0a 00 23

----------------

Block 0, Base EDID:
  EDID Structure Version & Revision: 1.4
  Vendor & Product Identification:
    Manufacturer: AUO
    Model: 45230
    Made in: week 32 of 2023
  Basic Display Parameters & Features:
    Digital display
    Bits per primary color channel: 8
    DisplayPort interface
    Maximum image size: 34 cm x 22 cm
    Gamma: 2.20
    Supported color formats: RGB 4:4:4
    First detailed timing includes the native pixel format and preferred refresh rate
    Display supports continuous frequencies
  Color Characteristics:
    Red  : 0.6601, 0.3310
    Green: 0.2822, 0.6250
    Blue : 0.1425, 0.0576
    White: 0.3134, 0.3291
  Established Timings I & II: none
  Standard Timings: none
  Detailed Timing Descriptors:
    DTD 1:  1920x1200   60.096154 Hz  16:10    74.519 kHz    155.000000 MHz (344 mm x 215 mm)
                 Hfront   48 Hsync  32 Hback   80 Hpol N
                 Vfront   10 Vsync   5 Vback   25 Vpol N
    DTD 2:  1920x1200   40.021069 Hz  16:10    74.519 kHz    155.000000 MHz (344 mm x 215 mm)
                 Hfront   48 Hsync  32 Hback   80 Hpol N
                 Vfront   10 Vsync   5 Vback  647 Vpol N
    Display Range Limits:
      Monitor ranges (Range Limits Only): 40-60 Hz V, 75-75 kHz H, max dotclock 160 MHz
    Alphanumeric Data String: 'B160UAN06.K '
Checksum: 0x23

----------------

Warnings:

Block 0, Base EDID:
  Missing Display Product Name.

Failures:

Block 0, Base EDID:
  Alphanumeric Data String: One or more trailing spaces before newline.
EDID:
  Extension Block 1 started with EDID header, ignoring Extension Blocks >= 1.

EDID conformity: FAIL
