edid-decode (hex):

00 ff ff ff ff ff ff 00 42 cf 00 17 00 00 00 00
2c 1d 01 04 95 1f 11 78 0a cd 80 99 54 49 84 26
25 4e 53 00 00 00 01 01 01 01 01 01 01 01 01 01
01 01 01 01 01 01 d5 1c 56 a6 50 00 23 30 29 1b
34 00 35 ad 10 00 00 00 00 00 00 10 00 00 00 00
00 00 00 00 00 00 00 00 00 00 00 00 00 10 00 00
00 00 00 00 00 00 00 00 00 00 00 00 00 00 00 10
00 50 31 34 30 50 4d 52 31 43 20 52 31 00 00 31

00 ff ff ff ff ff ff 00 42 cf 00 17 00 00 00 00
2c 1d 01 04 95 1f 11 78 0a cd 80 99 54 49 84 26
25 4e 53 00 00 00 01 01 01 01 01 01 01 01 01 01
01 01 01 01 01 01 d5 1c 56 a6 50 00 23 30 29 1b
34 00 35 ad 10 00 00 00 00 00 00 10 00 00 00 00
00 00 00 00 00 00 00 00 00 00 00 00 00 10 00 00
00 00 00 00 00 00 00 00 00 00 00 00 00 00 00 10
00 50 31 34 30 50 4d 52 31 43 20 52 31 00 00 31

----------------

Block 0, Base EDID:
  EDID Structure Version & Revision: 1.4
  Vendor & Product Identification:
    Manufacturer: PVO
    Model: 5888
    Made in: week 44 of 2019
  Basic Display Parameters & Features:
    Digital display
    Bits per primary color channel: 6
    DisplayPort interface
    Maximum image size: 31 cm x 17 cm
    Gamma: 2.20
    Supported color formats: RGB 4:4:4, YCrCb 4:4:4
    First detailed timing includes the native pixel format and preferred refresh rate
  Color Characteristics:
    Red  : 0.6005, 0.3281
    Green: 0.2880, 0.5166
    Blue : 0.1503, 0.1445
    White: 0.3046, 0.3242
  Established Timings I & II: none
  Standard Timings: none
  Detailed Timing Descriptors:
    DTD 1:  1366x768    59.998569 Hz 683:384   48.179 kHz     73.810000 MHz (analog composite, sync-on-green, 309 mm x 173 mm)
                 Hfront   41 Hsync  27 Hback   98 Hpol N
                 Vfront    3 Vsync   4 Vback   28 Vpol N
    Dummy Descriptor:
    Dummy Descriptor:
    Dummy Descriptor:
Checksum: 0x31

----------------

Warnings:

Block 0, Base EDID:
  Missing Display Product Name.

Failures:

Block 0, Base EDID:
  Dummy Descriptor: Dummy block filled with garbage.
EDID:
  Extension Block 1 started with EDID header, ignoring Extension Blocks >= 1.

EDID conformity: FAIL
