edid-decode (hex):

00 ff ff ff ff ff ff 00 30 e4 f3 06 00 00 00 00
00 1f 01 04 95 22 13 78 03 e0 b5 a3 54 4e 9b 26
0c 50 54 00 00 00 01 01 01 01 01 01 01 01 01 01
01 01 01 01 01 01 24 36 80 a0 70 38 1f 40 30 20
35 00 58 c2 10 00 00 19 18 24 80 a0 70 38 1f 40
30 20 35 00 58 c2 10 00 00 19 00 00 00 00 00 00
00 00 00 00 00 00 00 00 00 00 00 00 00 00 00 02
00 0c 26 ff 14 3c c8 17 15 38 c8 00 00 00 00 4a

00 ff ff ff ff ff ff 00 30 e4 f3 06 00 00 00 00
00 1f 01 04 95 22 13 78 03 e0 b5 a3 54 4e 9b 26
0c 50 54 00 00 00 01 01 01 01 01 01 01 01 01 01
01 01 01 01 01 01 24 36 80 a0 70 38 1f 40 30 20
35 00 58 c2 10 00 00 19 18 24 80 a0 70 38 1f 40
30 20 35 00 58 c2 10 00 00 19 00 00 00 00 00 00
00 00 00 00 00 00 00 00 00 00 00 00 00 00 00 02
00 0c 26 ff 14 3c c8 17 15 38 c8 00 00 00 00 4a

----------------

Block 0, Base EDID:
  EDID Structure Version & Revision: 1.4
  Vendor & Product Identification:
    Manufacturer: LGD
    Model: 1779
    Made in: 2021
  Basic Display Parameters & Features:
    Digital display
    Bits per primary color channel: 6
    DisplayPort interface
    Maximum image size: 34 cm x 19 cm
    Gamma: 2.20
    Supported color formats: RGB 4:4:4
    First detailed timing includes the native pixel format and preferred refresh rate
    Display supports continuous frequencies
  Color Characteristics:
    Red  : 0.6396, 0.3300
    Green: 0.3046, 0.6054
    Blue : 0.1503, 0.0498
    White: 0.3134, 0.3291
  Established Timings I & II: none
  Standard Timings: none
  Detailed Timing Descriptors:
    DTD 1:  1920x1080   59.977152 Hz  16:9     66.635 kHz    138.600000 MHz (344 mm x 194 mm)
                 Hfront   48 Hsync  32 Hback   80 Hpol N
                 Vfront    3 Vsync   5 Vback   23 Vpol N
    DTD 2:  1920x1080   39.984768 Hz  16:9     44.423 kHz     92.400000 MHz (344 mm x 194 mm)
                 Hfront   48 Hsync  32 Hback   80 Hpol N
                 Vfront    3 Vsync   5 Vback   23 Vpol N
    Empty Descriptor
    Manufacturer-Specified Display Descriptor (0x02): 00 02 00 0c 26 ff 14 3c c8 17 15 38 c8 00 00 00 '....&..<...8....'
Checksum: 0x4a

----------------

Warnings:

Block 0, Base EDID:
  Missing Display Product Name.

Failures:

Block 0, Base EDID:
  Empty Descriptor: Use Dummy Descriptor instead of all zeroes.
  Missing Display Range Limits Descriptor.
EDID:
  Extension Block 1 started with EDID header, ignoring Extension Blocks >= 1.

EDID conformity: FAIL
