edid-decode (hex):

00 ff ff ff ff ff ff 00 0d ae cd 13 00 00 00 00
2c 1f 01 04 95 1d 11 78 03 28 65 97 59 54 8e 27
1e 50 54 00 00 00 01 01 01 01 01 01 01 01 01 01
01 01 01 01 01 01 a4 38 80 e6 70 38 2c 40 30 20
a6 00 25 a5 10 00 00 1a c3 25 80 e6 70 38 2c 40
30 20 a6 00 25 a5 10 00 00 1a 00 00 00 00 00 00
00 00 00 00 00 00 00 00 00 00 00 00 00 00 00 02
00 0c 3d ff 0d 3c 7d 11 0c 1a 7d 00 00 00 00 35

00 ff ff ff ff ff ff 00 0d ae cd 13 00 00 00 00
2c 1f 01 04 95 1d 11 78 03 28 65 97 59 54 8e 27
1e 50 54 00 00 00 01 01 01 01 01 01 01 01 01 01
01 01 01 01 01 01 a4 38 80 e6 70 38 2c 40 30 20
a6 00 25 a5 10 00 00 1a c3 25 80 e6 70 38 2c 40
30 20 a6 00 25 a5 10 00 00 1a 00 00 00 00 00 00
00 00 00 00 00 00 00 00 00 00 00 00 00 00 00 02
00 0c 3d ff 0d 3c 7d 11 0c 1a 7d 00 00 00 00 35

----------------

Block 0, Base EDID:
  EDID Structure Version & Revision: 1.4
  Vendor & Product Identification:
    Manufacturer: CMN
    Model: 5069
    Made in: week 44 of 2021
  Basic Display Parameters & Features:
    Digital display
    Bits per primary color channel: 6
    DisplayPort interface
    Maximum image size: 29 cm x 17 cm
    Gamma: 2.20
    Supported color formats: RGB 4:4:4
    First detailed timing includes the native pixel format and preferred refresh rate
    Display supports continuous frequencies
  Color Characteristics:
    Red  : 0.5898, 0.3496
    Green: 0.3300, 0.5546
    Blue : 0.1533, 0.1191
    White: 0.3134, 0.3291
  Established Timings I & II: none
  Standard Timings: none
  Detailed Timing Descriptors:
    DTD 1:  1920x1080   60.001655 Hz  16:9     67.442 kHz    145.000000 MHz (293 mm x 165 mm)
                 Hfront   48 Hsync  32 Hback  150 Hpol P
                 Vfront   10 Vsync   6 Vback   28 Vpol N
    DTD 2:  1920x1080   40.002483 Hz  16:9     44.963 kHz     96.670000 MHz (293 mm x 165 mm)
                 Hfront   48 Hsync  32 Hback  150 Hpol P
                 Vfront   10 Vsync   6 Vback   28 Vpol N
    Empty Descriptor
    Manufacturer-Specified Display Descriptor (0x02): 00 02 00 0c 3d ff 0d 3c 7d 11 0c 1a 7d 00 00 00 '....=..<}...}...'
Checksum: 0x35

----------------

Warnings:

Block 0, Base EDID:
  Missing Display Product Name.

Failures:

Block 0, Base EDID:
  Empty Descriptor: Use Dummy Descriptor instead of all zeroes.
  Missing Display Range Limits Descriptor.
EDID:
  Extension Block 1 started with EDID header, ignoring Extension Blocks >= 1.

EDID conformity: FAIL
