edid-decode (hex):

00 ff ff ff ff ff ff 00 06 af 8b 9b 00 00 00 00
00 1d 01 04 95 1f 11 78 03 f5 65 8f 55 5a 93 2a
1f 50 54 00 00 00 01 01 01 01 01 01 01 01 01 01
01 01 01 01 01 01 bf 3e 80 04 71 38 94 40 10 10
3e 00 35 ae 10 00 00 18 00 00 00 00 00 00 00 00
00 00 00 00 00 00 00 00 00 00 00 00 00 00 00 00
00 00 00 00 00 00 00 00 00 00 00 00 00 00 00 02
00 10 48 ff 0f 3c 7d 14 0e 1e 7d 00 00 20 00 3c

00 ff ff ff ff ff ff 00 06 af 8b 9b 00 00 00 00
00 1d 01 04 95 1f 11 78 03 f5 65 8f 55 5a 93 2a
1f 50 54 00 00 00 01 01 01 01 01 01 01 01 01 01
01 01 01 01 01 01 bf 3e 80 04 71 38 94 40 10 10
3e 00 35 ae 10 00 00 18 00 00 00 00 00 00 00 00
00 00 00 00 00 00 00 00 00 00 00 00 00 00 00 00
00 00 00 00 00 00 00 00 00 00 00 00 00 00 00 02
00 10 48 ff 0f 3c 7d 14 0e 1e 7d 00 00 20 00 3c

----------------

Block 0, Base EDID:
  EDID Structure Version & Revision: 1.4
  Vendor & Product Identification:
    Manufacturer: AUO
    Model: 39819
    Made in: 2019
  Basic Display Parameters & Features:
    Digital display
    Bits per primary color channel: 6
    DisplayPort interface
    Maximum image size: 31 cm x 17 cm
    Gamma: 2.20
    Supported color formats: RGB 4:4:4
    First detailed timing includes the native pixel format and preferred refresh rate
    Display supports continuous frequencies
  Color Characteristics:
    Red  : 0.5615, 0.3349
    Green: 0.3525, 0.5751
    Blue : 0.1650, 0.1230
    White: 0.3134, 0.3291
  Established Timings I & II: none
  Standard Timings: none
  Detailed Timing Descriptors:
    DTD 1:  1920x1080   60.002839 Hz  16:9     73.683 kHz    160.630000 MHz (309 mm x 174 mm)
                 Hfront   16 Hsync  16 Hback  228 Hpol N
                 Vfront    3 Vsync  14 Vback  131 Vpol N
    Empty Descriptor
    Empty Descriptor
    Manufacturer-Specified Display Descriptor (0x02): 00 02 00 10 48 ff 0f 3c 7d 14 0e 1e 7d 00 00 20 '....H..<}...}.. '
Checksum: 0x3c

----------------

Warnings:

Block 0, Base EDID:
  Missing Display Product Name.

Failures:

Block 0, Base EDID:
  Empty Descriptor: Use Dummy Descriptor instead of all zeroes.
  Empty Descriptor: Use Dummy Descriptor instead of all zeroes.
  Missing Display Range Limits Descriptor.
EDID:
  Extension Block 1 started with EDID header, ignoring Extension Blocks >= 1.

EDID conformity: FAIL
