edid-decode (hex):

00 ff ff ff ff ff ff 00 5a 63 35 de 01 01 01 01
14 1f 01 04 b5 46 27 78 2f 64 35 a5 54 4f 9e 27
12 50 54 bf ef 80 d1 c0 b3 00 a9 40 a9 c0 95 00
90 40 81 80 81 c0 69 5e 00 a0 a0 a0 29 50 30 20
35 00 bc 86 21 00 00 1a 00 00 00 ff 00 56 52 4d
32 31 32 30 30 30 33 32 36 20 00 00 00 fd 00 30
90 d7 d7 3c 01 0a 20 20 20 20 20 20 00 00 00 fc
00 56 58 33 32 35 38 20 73 65 72 69 65 73 01 da

02 03 18 f1 4b 01 02 03 04 05 90 11 12 13 14 1f
23 09 07 07 83 01 00 00 f7 e3 00 a0 a0 a0 32 50
08 20 98 04 bc 86 21 00 00 1e 5b 9d 00 a0 a0 a0
29 50 30 20 35 00 bc 86 21 00 00 1a d4 bc 00 a0
a0 a0 29 50 30 20 35 00 bc 86 21 00 00 1a a4 3d
00 a0 50 d0 29 20 30 20 98 04 bc 86 21 00 00 18
a9 4b 00 a0 50 38 29 40 30 20 98 04 bc 86 21 00
00 18 00 00 00 00 00 00 00 00 00 00 00 00 00 e5

00 ff ff ff ff ff ff 00 5a 63 35 de 01 01 01 01
14 1f 01 04 b5 46 27 78 2f 64 35 a5 54 4f 9e 27
12 50 54 bf ef 80 d1 c0 b3 00 a9 40 a9 c0 95 00
90 40 81 80 81 c0 69 5e 00 a0 a0 a0 29 50 30 20
35 00 bc 86 21 00 00 1a 00 00 00 ff 00 56 52 4d
32 31 32 30 30 30 33 32 36 20 00 00 00 fd 00 30
90 d7 d7 3c 01 0a 20 20 20 20 20 20 00 00 00 fc
00 56 58 33 32 35 38 20 73 65 72 69 65 73 01 da

02 03 18 f1 4b 01 02 03 04 05 90 11 12 13 14 1f
23 09 07 07 83 01 00 00 f7 e3 00 a0 a0 a0 32 50
08 20 98 04 bc 86 21 00 00 1e 5b 9d 00 a0 a0 a0
29 50 30 20 35 00 bc 86 21 00 00 1a d4 bc 00 a0
a0 a0 29 50 30 20 35 00 bc 86 21 00 00 1a a4 3d
00 a0 50 d0 29 20 30 20 98 04 bc 86 21 00 00 18
a9 4b 00 a0 50 38 29 40 30 20 98 04 bc 86 21 00
00 18 00 00 00 00 00 00 00 00 00 00 00 00 00 e5

----------------

Block 0, Base EDID:
  EDID Structure Version & Revision: 1.4
  Vendor & Product Identification:
    Manufacturer: VSC
    Model: 56885
    Serial Number: ...
    Made in: week 20 of 2021
  Basic Display Parameters & Features:
    Digital display
    Bits per primary color channel: 10
    DisplayPort interface
    Maximum image size: 70 cm x 39 cm
    Gamma: 2.20
    DPMS levels: Off
    Supported color formats: RGB 4:4:4, YCrCb 4:4:4
    Default (sRGB) color space is primary color space
    First detailed timing includes the native pixel format and preferred refresh rate
    Display supports continuous frequencies
  Color Characteristics:
    Red  : 0.6455, 0.3300
    Green: 0.3095, 0.6171
    Blue : 0.1523, 0.0732
    White: 0.3134, 0.3291
  Established Timings I & II:
    IBM     :   720x400    70.081663 Hz   9:5     31.467 kHz     28.320000 MHz
    DMT 0x04:   640x480    59.940476 Hz   4:3     31.469 kHz     25.175000 MHz
    Apple   :   640x480    66.666667 Hz   4:3     35.000 kHz     30.240000 MHz
    DMT 0x05:   640x480    72.808802 Hz   4:3     37.861 kHz     31.500000 MHz
    DMT 0x06:   640x480    75.000000 Hz   4:3     37.500 kHz     31.500000 MHz
    DMT 0x08:   800x600    56.250000 Hz   4:3     35.156 kHz     36.000000 MHz
    DMT 0x09:   800x600    60.316541 Hz   4:3     37.879 kHz     40.000000 MHz
    DMT 0x0a:   800x600    72.187572 Hz   4:3     48.077 kHz     50.000000 MHz
    DMT 0x0b:   800x600    75.000000 Hz   4:3     46.875 kHz     49.500000 MHz
    Apple   :   832x624    74.551266 Hz   4:3     49.726 kHz     57.284000 MHz
    DMT 0x10:  1024x768    60.003840 Hz   4:3     48.363 kHz     65.000000 MHz
    DMT 0x11:  1024x768    70.069359 Hz   4:3     56.476 kHz     75.000000 MHz
    DMT 0x12:  1024x768    75.028582 Hz   4:3     60.023 kHz     78.750000 MHz
    DMT 0x24:  1280x1024   75.024675 Hz   5:4     79.976 kHz    135.000000 MHz
    Apple   :  1152x870    75.061550 Hz 192:145   68.681 kHz    100.000000 MHz
  Standard Timings:
    DMT 0x52:  1920x1080   60.000000 Hz  16:9     67.500 kHz    148.500000 MHz
    DMT 0x3a:  1680x1050   59.954250 Hz  16:10    65.290 kHz    146.250000 MHz
    DMT 0x33:  1600x1200   60.000000 Hz   4:3     75.000 kHz    162.000000 MHz
    DMT 0x53:  1600x900    60.000000 Hz  16:9     60.000 kHz    108.000000 MHz (RB)
    DMT 0x2f:  1440x900    59.887445 Hz  16:10    55.935 kHz    106.500000 MHz
    DMT 0x2a:  1400x1050   59.978442 Hz   4:3     65.317 kHz    121.750000 MHz
    DMT 0x23:  1280x1024   60.019740 Hz   5:4     63.981 kHz    108.000000 MHz
    DMT 0x55:  1280x720    60.000000 Hz  16:9     45.000 kHz     74.250000 MHz
  Detailed Timing Descriptors:
    DTD  1:  2560x1440   59.997716 Hz  16:9     88.857 kHz    241.690000 MHz (700 mm x 390 mm)
                  Hfront   48 Hsync  32 Hback   80 Hpol P
                  Vfront    3 Vsync   5 Vback   33 Vpol N
    Display Product Serial Number: ...
    Display Range Limits:
      Monitor ranges (Range Limits Only): 48-144 Hz V, 215-215 kHz H, max dotclock 600 MHz
    Display Product Name: 'VX3258 series'
  Extension blocks: 1
Checksum: 0xda

----------------

Block 1, CTA-861 Extension Block:
  Revision: 3
  Underscans IT Video Formats by default
  Basic audio support
  Supports YCbCr 4:4:4
  Supports YCbCr 4:2:2
  Native detailed modes: 1
  Video Data Block:
    VIC   1:   640x480    59.940476 Hz   4:3     31.469 kHz     25.175000 MHz
    VIC   2:   720x480    59.940060 Hz   4:3     31.469 kHz     27.000000 MHz
    VIC   3:   720x480    59.940060 Hz  16:9     31.469 kHz     27.000000 MHz
    VIC   4:  1280x720    60.000000 Hz  16:9     45.000 kHz     74.250000 MHz
    VIC   5:  1920x1080i  60.000000 Hz  16:9     33.750 kHz     74.250000 MHz
    VIC  16:  1920x1080   60.000000 Hz  16:9     67.500 kHz    148.500000 MHz (native)
    VIC  17:   720x576    50.000000 Hz   4:3     31.250 kHz     27.000000 MHz
    VIC  18:   720x576    50.000000 Hz  16:9     31.250 kHz     27.000000 MHz
    VIC  19:  1280x720    50.000000 Hz  16:9     37.500 kHz     74.250000 MHz
    VIC  20:  1920x1080i  50.000000 Hz  16:9     28.125 kHz     74.250000 MHz
    VIC  31:  1920x1080   50.000000 Hz  16:9     56.250 kHz    148.500000 MHz
  Audio Data Block:
    Linear PCM:
      Max channels: 2
      Supported sample rates (kHz): 48 44.1 32
      Supported sample sizes (bits): 24 20 16
  Speaker Allocation Data Block:
    FL/FR - Front Left/Right
  Detailed Timing Descriptors:
    DTD  2:  2560x1440  143.996743 Hz  16:9    214.555 kHz    583.590000 MHz (700 mm x 390 mm)
                  Hfront    8 Hsync  32 Hback  120 Hpol P
                  Vfront   25 Vsync   8 Vback   17 Vpol P
    DTD  3:  2560x1440   99.999504 Hz  16:9    148.099 kHz    402.830000 MHz (700 mm x 390 mm)
                  Hfront   48 Hsync  32 Hback   80 Hpol P
                  Vfront    3 Vsync   5 Vback   33 Vpol N
    DTD  4:  2560x1440  120.000397 Hz  16:9    177.721 kHz    483.400000 MHz (700 mm x 390 mm)
                  Hfront   48 Hsync  32 Hback   80 Hpol P
                  Vfront    3 Vsync   5 Vback   33 Vpol N
    DTD  5:  1280x720   143.999124 Hz  16:9    109.583 kHz    157.800000 MHz (700 mm x 390 mm)
                  Hfront   48 Hsync  32 Hback   80 Hpol N
                  Vfront   25 Vsync   8 Vback    8 Vpol N
    DTD  6:  1280x1080  119.988354 Hz  32:27   134.507 kHz    193.690000 MHz (700 mm x 390 mm)
                  Hfront   48 Hsync  32 Hback   80 Hpol N
                  Vfront   25 Vsync   8 Vback    8 Vpol N
Checksum: 0xe5  Unused space in Extension Block: 13 bytes

----------------

Block 2, Unknown EDID Extension Block 0x00:
  00 ff ff ff ff ff ff 00 5a 63 35 de 01 01 01 01 '........Zc5.....'
  14 1f 01 04 b5 46 27 78 2f 64 35 a5 54 4f 9e 27 '.....F'x/d5.TO.''
  12 50 54 bf ef 80 d1 c0 b3 00 a9 40 a9 c0 95 00 '.PT........@....'
  90 40 81 80 81 c0 69 5e 00 a0 a0 a0 29 50 30 20 '.@....i^....)P0 '
  35 00 bc 86 21 00 00 1a 00 00 00 ff 00 56 52 4d '5...!........VRM'
  32 31 32 30 30 30 33 32 36 20 00 00 00 fd 00 30 '212000326 .....0'
  90 d7 d7 3c 01 0a 20 20 20 20 20 20 00 00 00 fc '...<..      ....'
  00 56 58 33 32 35 38 20 73 65 72 69 65 73 01 da '.VX3258 series..'
Checksum: 0xda

----------------

Block 3, CTA-861 Extension Block:
  Revision: 3
  Underscans IT Video Formats by default
  Basic audio support
  Supports YCbCr 4:4:4
  Supports YCbCr 4:2:2
  Native detailed modes: 1
  Video Data Block:
    VIC   1:   640x480    59.940476 Hz   4:3     31.469 kHz     25.175000 MHz
    VIC   2:   720x480    59.940060 Hz   4:3     31.469 kHz     27.000000 MHz
    VIC   3:   720x480    59.940060 Hz  16:9     31.469 kHz     27.000000 MHz
    VIC   4:  1280x720    60.000000 Hz  16:9     45.000 kHz     74.250000 MHz
    VIC   5:  1920x1080i  60.000000 Hz  16:9     33.750 kHz     74.250000 MHz
    VIC  16:  1920x1080   60.000000 Hz  16:9     67.500 kHz    148.500000 MHz (native)
    VIC  17:   720x576    50.000000 Hz   4:3     31.250 kHz     27.000000 MHz
    VIC  18:   720x576    50.000000 Hz  16:9     31.250 kHz     27.000000 MHz
    VIC  19:  1280x720    50.000000 Hz  16:9     37.500 kHz     74.250000 MHz
    VIC  20:  1920x1080i  50.000000 Hz  16:9     28.125 kHz     74.250000 MHz
    VIC  31:  1920x1080   50.000000 Hz  16:9     56.250 kHz    148.500000 MHz
  Audio Data Block:
    Linear PCM:
      Max channels: 2
      Supported sample rates (kHz): 48 44.1 32
      Supported sample sizes (bits): 24 20 16
  Speaker Allocation Data Block:
    FL/FR - Front Left/Right
  Detailed Timing Descriptors:
    DTD  7:  2560x1440  143.996743 Hz  16:9    214.555 kHz    583.590000 MHz (700 mm x 390 mm)
                  Hfront    8 Hsync  32 Hback  120 Hpol P
                  Vfront   25 Vsync   8 Vback   17 Vpol P
    DTD  8:  2560x1440   99.999504 Hz  16:9    148.099 kHz    402.830000 MHz (700 mm x 390 mm)
                  Hfront   48 Hsync  32 Hback   80 Hpol P
                  Vfront    3 Vsync   5 Vback   33 Vpol N
    DTD  9:  2560x1440  120.000397 Hz  16:9    177.721 kHz    483.400000 MHz (700 mm x 390 mm)
                  Hfront   48 Hsync  32 Hback   80 Hpol P
                  Vfront    3 Vsync   5 Vback   33 Vpol N
    DTD 10:  1280x720   143.999124 Hz  16:9    109.583 kHz    157.800000 MHz (700 mm x 390 mm)
                  Hfront   48 Hsync  32 Hback   80 Hpol N
                  Vfront   25 Vsync   8 Vback    8 Vpol N
    DTD 11:  1280x1080  119.988354 Hz  32:27   134.507 kHz    193.690000 MHz (700 mm x 390 mm)
                  Hfront   48 Hsync  32 Hback   80 Hpol N
                  Vfront   25 Vsync   8 Vback    8 Vpol N
Checksum: 0xe5  Unused space in Extension Block: 13 bytes

----------------

Warnings:

Block 0, Base EDID:
  Vendor & Product Identification: The serial number is one of the known dummy values, it should probably be set to 0.
Block 1, CTA-861 Extension Block:
  Video Data Block: VIC 1 and the first DTD are not identical. Is this intended?
  Video Data Block: All VICs are in ascending order, and the first (preferred) VIC <= 4, is that intended?
  Detailed Timing Descriptor #6: Image size is 700x390 mm, but based on the picture AR it should be 700x590 mm.
  Display Product Serial Number is set, so the Serial Number in the Base EDID should be 0.
Block 3, CTA-861 Extension Block:
  Video Data Block: All VICs are in ascending order, and the first (preferred) VIC <= 4, is that intended?
  Detailed Timing Descriptor #11: Image size is 700x390 mm, but based on the picture AR it should be 700x590 mm.
EDID:
  Base EDID: Some timings are out of range of the Monitor Ranges:
    Horizontal Freq: 28.125 - 214.555 kHz (Monitor: 215.000 - 215.000 kHz)

Failures:

Block 0, Base EDID:
  Display Product Serial Number: ...
  Basic Display Parameters & Features: sRGB is signaled, but the chromaticities do not match.
Block 1, CTA-861 Extension Block:
  Missing VCDB, needed for Set Selectable RGB Quantization to avoid interop issues.
Block 2, Base EDID:
  Unknown Extension Block.
Block 3, CTA-861 Extension Block:
  Video Data Block: Duplicate VIC 1.
  Video Data Block: Duplicate VIC 2.
  Video Data Block: Duplicate VIC 3.
  Video Data Block: Duplicate VIC 4.
  Video Data Block: Duplicate VIC 5.
  Video Data Block: Duplicate VIC 16.
  Video Data Block: Duplicate VIC 17.
  Video Data Block: Duplicate VIC 18.
  Video Data Block: Duplicate VIC 19.
  Video Data Block: Duplicate VIC 20.
  Video Data Block: Duplicate VIC 31.
  Speaker Allocation Data Block: Only one instance of this Data Block is allowed.
EDID:
  Base EDID: EDID specified 1 extension block(s), but found 3 extension block(s).
  CTA-861: Native progressive timings are a mix of several resolutions.

EDID conformity: FAIL
