edid-decode (hex):

00 ff ff ff ff ff ff 00 22 f0 a2 26 01 01 01 01
05 12 01 03 80 29 1a 78 2a de 95 a3 54 4c 99 26
0f 50 54 21 08 00 95 00 71 00 81 40 81 80 01 01
01 01 01 01 01 01 9a 29 a0 d0 51 84 22 30 50 98
36 00 98 ff 10 00 00 1c 00 00 00 fd 00 32 4c 18
53 0e 00 0a 20 20 20 20 20 20 00 00 00 fc 00 48
50 20 77 31 39 30 37 0a 20 20 20 20 00 00 00 ff
00 43 4e 44 38 30 35 32 51 53 39 0a 20 20 01 3d

02 03 17 70 44 84 03 02 01 23 09 07 07 83 01 00
00 65 03 0c 00 10 00 01 1d 00 72 51 d0 1e 20 6e
28 55 00 10 09 00 00 00 1e 01 1d 00 72 51 d0 1e
20 6e 28 55 00 10 09 00 00 00 1e 8c 0a d0 8a 20
e0 2d 10 10 3e 96 00 10 09 00 00 00 18 00 00 00
00 00 00 00 00 00 00 00 00 00 00 00 00 00 00 00
00 00 00 00 00 00 00 00 00 00 00 00 00 00 00 00
00 00 00 00 00 00 00 00 00 00 00 00 00 00 00 00

----------------

Block 0, Base EDID:
  EDID Structure Version & Revision: 1.3
  Vendor & Product Identification:
    Manufacturer: HWP
    Model: 9890
    Serial Number: ...
    Made in: week 5 of 2008
  Basic Display Parameters & Features:
    Digital display
    Maximum image size: 41 cm x 26 cm
    Gamma: 2.20
    DPMS levels: Off
    RGB color display
    First detailed timing is the preferred timing
  Color Characteristics:
    Red  : 0.6396, 0.3291
    Green: 0.2998, 0.5996
    Blue : 0.1503, 0.0595
    White: 0.3134, 0.3291
  Established Timings I & II:
    DMT 0x04:   640x480    59.940476 Hz   4:3     31.469 kHz     25.175000 MHz
    DMT 0x09:   800x600    60.316541 Hz   4:3     37.879 kHz     40.000000 MHz
    DMT 0x10:  1024x768    60.003840 Hz   4:3     48.363 kHz     65.000000 MHz
  Standard Timings:
    DMT 0x2f:  1440x900    59.887445 Hz  16:10    55.935 kHz    106.500000 MHz
    GTF     :  1152x720    59.999964 Hz  16:10    44.760 kHz     67.319000 MHz
    DMT 0x20:  1280x960    60.000000 Hz   4:3     60.000 kHz    108.000000 MHz
    DMT 0x23:  1280x1024   60.019740 Hz   5:4     63.981 kHz    108.000000 MHz
  Detailed Timing Descriptors:
    DTD 1:  1440x900    59.887445 Hz  16:10    55.935 kHz    106.500000 MHz (408 mm x 255 mm)
                 Hfront   80 Hsync 152 Hback  232 Hpol N
                 Vfront    3 Vsync   6 Vback   25 Vpol P
    Display Range Limits:
      Monitor ranges (GTF): 50-76 Hz V, 24-83 kHz H, max dotclock 140 MHz
    Display Product Name: 'HP w1907'
    Display Product Serial Number: ...
  Extension blocks: 1
Checksum: 0x3d

----------------

Block 1, CTA-861 Extension Block:
  Revision: 3
  Basic audio support
  Supports YCbCr 4:4:4
  Supports YCbCr 4:2:2
  Native detailed modes: 0
  Video Data Block:
    VIC   4:  1280x720    60.000000 Hz  16:9     45.000 kHz     74.250000 MHz (native)
    VIC   3:   720x480    59.940060 Hz  16:9     31.469 kHz     27.000000 MHz
    VIC   2:   720x480    59.940060 Hz   4:3     31.469 kHz     27.000000 MHz
    VIC   1:   640x480    59.940476 Hz   4:3     31.469 kHz     25.175000 MHz
  Audio Data Block:
    Linear PCM:
      Max channels: 2
      Supported sample rates (kHz): 48 44.1 32
      Supported sample sizes (bits): 24 20 16
  Speaker Allocation Data Block:
    FL/FR - Front Left/Right
  Vendor-Specific Data Block (HDMI), OUI 00-0C-03:
    Source physical address: 1.0.0.0
  Detailed Timing Descriptors:
    DTD 2:  1280x720    60.000000 Hz  16:9     45.000 kHz     74.250000 MHz (16 mm x 9 mm)
                 Hfront  110 Hsync  40 Hback  220 Hpol P
                 Vfront    5 Vsync   5 Vback   20 Vpol P
    DTD 3:  1280x720    60.000000 Hz  16:9     45.000 kHz     74.250000 MHz (16 mm x 9 mm)
                 Hfront  110 Hsync  40 Hback  220 Hpol P
                 Vfront    5 Vsync   5 Vback   20 Vpol P
    DTD 4:   720x480    59.940060 Hz   3:2     31.469 kHz     27.000000 MHz (16 mm x 9 mm)
                 Hfront   16 Hsync  62 Hback   60 Hpol N
                 Vfront    9 Vsync   6 Vback   30 Vpol N
Checksum: 0x00  Unused space in Extension Block: 50 bytes

----------------

Warnings:

Block 0, Base EDID:
  Vendor & Product Identification: The serial number is one of the known dummy values, it should probably be set to 0.
Block 1, CTA-861 Extension Block:
  IT Video Formats are overscanned by default, but normally this should be underscanned.
  Video Data Block: VIC 4 and the first DTD are not identical. Is this intended?
  Detailed Timing Descriptor #2: Dubious image size (16x9 mm is smaller than 100x100 mm).
  Detailed Timing Descriptor #3: Dubious image size (16x9 mm is smaller than 100x100 mm).
  Detailed Timing Descriptor #4: Dubious image size (16x9 mm is smaller than 100x100 mm).
  Display Product Serial Number is set, so the Serial Number in the Base EDID should be 0.
  Add a Colorimetry Data Block with the sRGB colorimetry bit set to avoid interop issues.
EDID:
  CTA-861: Native progressive resolution of 1280x720 is smaller than the max preferred progressive resolution 1440x900.

Failures:

Block 1, CTA-861 Extension Block:
  Detailed Timing Descriptor #2: Mismatch of image size 16x9 mm vs display size 410x260 mm.
  Detailed Timing Descriptor #3: Mismatch of image size 16x9 mm vs display size 410x260 mm.
  Detailed Timing Descriptor #4: Mismatch of image size 16x9 mm vs display size 410x260 mm.
  Missing VCDB, needed for Set Selectable RGB Quantization to avoid interop issues.

EDID conformity: FAIL
