edid-decode (hex):

00 ff ff ff ff ff ff 00 30 e4 51 07 00 00 00 00
00 20 01 04 a5 1e 13 78 07 10 e5 a8 54 4c 9a 25
10 50 54 00 00 00 01 01 01 01 01 01 01 01 01 01
01 01 01 01 01 01 35 3c 80 a0 70 b0 23 40 30 20
36 00 2e bc 10 00 00 1a 2a 30 80 a0 70 b0 23 40
30 20 36 00 2e bc 10 00 00 1a 00 00 00 fe 00 56
38 37 31 4e 80 31 34 30 57 55 31 0a 00 00 00 00
00 02 41 11 a8 00 11 00 00 0a 41 0a 20 20 00 3b

00 ff ff ff ff ff ff 00 30 e4 51 07 00 00 00 00
00 20 01 04 a5 1e 13 78 07 10 e5 a8 54 4c 9a 25
10 50 54 00 00 00 01 01 01 01 01 01 01 01 01 01
01 01 01 01 01 01 35 3c 80 a0 70 b0 23 40 30 20
36 00 2e bc 10 00 00 1a 2a 30 80 a0 70 b0 23 40
30 20 36 00 2e bc 10 00 00 1a 00 00 00 fe 00 56
38 37 31 4e 80 31 34 30 57 55 31 0a 00 00 00 00
00 02 41 11 a8 00 11 00 00 0a 41 0a 20 20 00 3b

----------------

Block 0, Base EDID:
  EDID Structure Version & Revision: 1.4
  Vendor & Product Identification:
    Manufacturer: LGD
    Model: 1873
    Made in: 2022
  Basic Display Parameters & Features:
    Digital display
    Bits per primary color channel: 8
    DisplayPort interface
    Maximum image size: 30 cm x 19 cm
    Gamma: 2.20
    Supported color formats: RGB 4:4:4
    Default (sRGB) color space is primary color space
    First detailed timing includes the native pixel format and preferred refresh rate
    Display supports continuous frequencies
  Color Characteristics:
    Red  : 0.6562, 0.3291
    Green: 0.2968, 0.6015
    Blue : 0.1474, 0.0644
    White: 0.3134, 0.3291
  Established Timings I & II: none
  Standard Timings: none
  Detailed Timing Descriptors:
    DTD 1:  1920x1200   60.000779 Hz  16:10    74.101 kHz    154.130000 MHz (302 mm x 188 mm)
                 Hfront   48 Hsync  32 Hback   80 Hpol P
                 Vfront    3 Vsync   6 Vback   26 Vpol N
    DTD 2:  1920x1200   47.999066 Hz  16:10    59.279 kHz    123.300000 MHz (302 mm x 188 mm)
                 Hfront   48 Hsync  32 Hback   80 Hpol P
                 Vfront    3 Vsync   6 Vback   26 Vpol N
    Alphanumeric Data String: 'V871N.140WU1'
    Manufacturer-Specified Display Descriptor (0x00): 00 00 00 02 41 11 a8 00 11 00 00 0a 41 0a 20 20 '....A.......A.  '
Checksum: 0x3b

----------------

Block 1, Unknown EDID Extension Block 0x00:
  00 ff ff ff ff ff ff 00 30 e4 51 07 00 00 00 00 '........0.Q.....'
  00 20 01 04 a5 1e 13 78 07 10 e5 a8 54 4c 9a 25 '. .....x....TL.%'
  10 50 54 00 00 00 01 01 01 01 01 01 01 01 01 01 '.PT.............'
  01 01 01 01 01 01 35 3c 80 a0 70 b0 23 40 30 20 '......5<..p.#@0 '
  36 00 2e bc 10 00 00 1a 2a 30 80 a0 70 b0 23 40 '6.......*0..p.#@'
  30 20 36 00 2e bc 10 00 00 1a 00 00 00 fe 00 56 '0 6............V'
  38 37 31 4e 80 31 34 30 57 55 31 0a 00 00 00 00 '871N.140WU1.....'
  00 02 41 11 a8 00 11 00 00 0a 41 0a 20 20 00 3b '..A.......A.  .;'
Checksum: 0x3b

----------------

Warnings:

Block 0, Base EDID:
  Alphanumeric Data String: Non-ASCII character 0x80 at position 5, can cause problems.
  Missing Display Product Name.

Failures:

Block 0, Base EDID:
  Basic Display Parameters & Features: sRGB is signaled, but the chromaticities do not match.
  Missing Display Range Limits Descriptor.
Block 1, Base EDID:
  Unknown Extension Block.
EDID:
  Base EDID: EDID specified 0 extension block(s), but found 1 extension block(s).

EDID conformity: FAIL
