edid-decode (hex):

00 ff ff ff ff ff ff 00 4d d9 03 6b 01 01 01 01
33 17 01 03 80 10 09 78 0a ee 91 a3 54 4c 99 26
0f 50 54 20 00 00 01 01 01 01 01 01 01 01 01 01
01 01 01 01 01 01 02 3a 80 18 71 38 2d 40 58 2c
45 00 a0 5a 00 00 00 1e 01 1d 00 72 51 d0 1e 20
6e 28 55 00 a0 5a 00 00 00 1e 00 00 00 fc 00 53
41 4d 53 55 4e 47 0a 20 20 20 20 20 00 00 00 fd
00 18 4b 1a 51 17 00 0a 20 20 20 20 20 20 01 73

02 03 35 f5 4b 90 1f 04 13 05 14 03 12 20 21 22
35 0f 7f 07 15 07 55 3d 1f c0 57 07 00 67 54 00
5f 7e 01 4d 02 00 83 5f 00 00 67 03 0c 00 12 00
b8 2d e2 00 0f 01 1d 00 bc 52 d0 1e 20 b8 28 55
40 a0 5a 00 00 00 1e 01 1d 80 18 71 1c 16 20 58
2c 25 00 a0 5a 00 00 00 9e 01 1d 80 d0 72 1c 16
20 10 2c 25 80 a0 5a 00 00 00 9e 00 00 00 00 00
00 00 00 00 00 00 00 00 00 00 00 00 00 00 00 26

00 ff ff ff ff ff ff 00 4d d9 03 6b 01 01 01 01
33 17 01 03 80 10 09 78 0a ee 91 a3 54 4c 99 26
0f 50 54 20 00 00 01 01 01 01 01 01 01 01 01 01
01 01 01 01 01 01 02 3a 80 18 71 38 2d 40 58 2c
45 00 a0 5a 00 00 00 1e 01 1d 00 72 51 d0 1e 20
6e 28 55 00 a0 5a 00 00 00 1e 00 00 00 fc 00 53
41 4d 53 55 4e 47 0a 20 20 20 20 20 00 00 00 fd
00 18 4b 1a 51 17 00 0a 20 20 20 20 20 20 01 73

02 03 35 f5 4b 90 1f 04 13 05 14 03 12 20 21 22
35 0f 7f 07 15 07 55 3d 1f c0 57 07 00 67 54 00
5f 7e 01 4d 02 00 83 5f 00 00 67 03 0c 00 12 00
b8 2d e2 00 0f 01 1d 00 bc 52 d0 1e 20 b8 28 55
40 a0 5a 00 00 00 1e 01 1d 80 18 71 1c 16 20 58
2c 25 00 a0 5a 00 00 00 9e 01 1d 80 d0 72 1c 16
20 10 2c 25 80 a0 5a 00 00 00 9e 00 00 00 00 00
00 00 00 00 00 00 00 00 00 00 00 00 00 00 00 26

----------------

Block 0, Base EDID:
  EDID Structure Version & Revision: 1.3
  Vendor & Product Identification:
    Manufacturer: SNY
    Model: 27395
    Serial Number: ...
    Made in: week 51 of 2013
  Basic Display Parameters & Features:
    Digital display
    Maximum image size: 16 cm x 9 cm
    Gamma: 2.20
    RGB color display
    First detailed timing is the preferred timing
  Color Characteristics:
    Red  : 0.6396, 0.3300
    Green: 0.2998, 0.5996
    Blue : 0.1503, 0.0595
    White: 0.3125, 0.3291
  Established Timings I & II:
    DMT 0x04:   640x480    59.940476 Hz   4:3     31.469 kHz     25.175000 MHz
  Standard Timings: none
  Detailed Timing Descriptors:
    DTD 1:  1920x1080   60.000000 Hz  16:9     67.500 kHz    148.500000 MHz (160 mm x 90 mm)
                 Hfront   88 Hsync  44 Hback  148 Hpol P
                 Vfront    4 Vsync   5 Vback   36 Vpol P
    DTD 2:  1280x720    60.000000 Hz  16:9     45.000 kHz     74.250000 MHz (160 mm x 90 mm)
                 Hfront  110 Hsync  40 Hback  220 Hpol P
                 Vfront    5 Vsync   5 Vback   20 Vpol P
    Display Product Name: 'SAMSUNG'
    Display Range Limits:
      Monitor ranges (GTF): 24-75 Hz V, 26-81 kHz H, max dotclock 230 MHz
  Extension blocks: 1
Checksum: 0x73

----------------

Block 1, CTA-861 Extension Block:
  Revision: 3
  Underscans IT Video Formats by default
  Basic audio support
  Supports YCbCr 4:4:4
  Supports YCbCr 4:2:2
  Native detailed modes: 5
  Video Data Block:
    VIC  16:  1920x1080   60.000000 Hz  16:9     67.500 kHz    148.500000 MHz (native)
    VIC  31:  1920x1080   50.000000 Hz  16:9     56.250 kHz    148.500000 MHz
    VIC   4:  1280x720    60.000000 Hz  16:9     45.000 kHz     74.250000 MHz
    VIC  19:  1280x720    50.000000 Hz  16:9     37.500 kHz     74.250000 MHz
    VIC   5:  1920x1080i  60.000000 Hz  16:9     33.750 kHz     74.250000 MHz
    VIC  20:  1920x1080i  50.000000 Hz  16:9     28.125 kHz     74.250000 MHz
    VIC   3:   720x480    59.940060 Hz  16:9     31.469 kHz     27.000000 MHz
    VIC  18:   720x576    50.000000 Hz  16:9     31.250 kHz     27.000000 MHz
    VIC  32:  1920x1080   24.000000 Hz  16:9     27.000 kHz     74.250000 MHz
    VIC  33:  1920x1080   25.000000 Hz  16:9     28.125 kHz     74.250000 MHz
    VIC  34:  1920x1080   30.000000 Hz  16:9     33.750 kHz     74.250000 MHz
  Audio Data Block:
    Linear PCM:
      Max channels: 8
      Supported sample rates (kHz): 192 176.4 96 88.2 48 44.1 32
      Supported sample sizes (bits): 24 20 16
    AC-3:
      Max channels: 6
      Supported sample rates (kHz): 48 44.1 32
      Maximum bit rate: 680 kb/s
    DTS:
      Max channels: 6
      Supported sample rates (kHz): 96 88.2 48 44.1 32
      Maximum bit rate: 1536 kb/s
    Enhanced AC-3 (DD+):
      Max channels: 8
      Supported sample rates (kHz): 48 44.1 32
    MAT (MLP):
      Max channels: 8
      Supported sample rates (kHz): 192 96 48
      Supports only Dolby TrueHD
    DTS-HD:
      Max channels: 8
      Supported sample rates (kHz): 192 176.4 96 88.2 48 44.1
      Audio Format Code dependent value: 0x01
    One Bit Audio:
      Max channels: 6
      Supported sample rates (kHz): 44.1
      Audio Format Code dependent value: 0x00
  Speaker Allocation Data Block:
    FL/FR - Front Left/Right
    LFE1 - Low Frequency Effects 1
    FC - Front Center
    LS/RS - Left/Right Surround
    BC - Back Center
    BL/BR - Back Left/Right
  Vendor-Specific Data Block (HDMI), OUI 00-0C-03:
    Source physical address: 1.2.0.0
    Supports_AI
    DC_36bit
    DC_30bit
    DC_Y444
    Maximum TMDS clock: 225 MHz
  Video Capability Data Block:
    YCbCr quantization: No Data
    RGB quantization: No Data
    PT scan behavior: No Data
    IT scan behavior: Supports both over- and underscan
    CE scan behavior: Supports both over- and underscan
  Detailed Timing Descriptors:
    DTD 3:  1280x720    50.000000 Hz  16:9     37.500 kHz     74.250000 MHz (160 mm x 90 mm)
                 Hfront  440 Hsync  40 Hback  220 Hpol P
                 Vfront    5 Vsync   5 Vback   20 Vpol P
    DTD 4:  1920x1080i  60.000000 Hz  16:9     33.750 kHz     74.250000 MHz (160 mm x 90 mm)
                 Hfront   88 Hsync  44 Hback  148 Hpol P
                 Vfront    2 Vsync   5 Vback   15 Vpol P Vfront +0.5 Odd Field
                 Vfront    2 Vsync   5 Vback   15 Vpol P Vback  +0.5 Even Field
    DTD 5:  1920x1080i  50.000000 Hz  16:9     28.125 kHz     74.250000 MHz (160 mm x 90 mm)
                 Hfront  528 Hsync  44 Hback  148 Hpol P
                 Vfront    2 Vsync   5 Vback   15 Vpol P Vfront +0.5 Odd Field
                 Vfront    2 Vsync   5 Vback   15 Vpol P Vback  +0.5 Even Field
Checksum: 0x26  Unused space in Extension Block: 20 bytes

----------------

Block 2, Unknown EDID Extension Block 0x00:
  00 ff ff ff ff ff ff 00 4d d9 03 6b 01 01 01 01 '........M..k....'
  33 17 01 03 80 10 09 78 0a ee 91 a3 54 4c 99 26 '3......x....TL.&'
  0f 50 54 20 00 00 01 01 01 01 01 01 01 01 01 01 '.PT ............'
  01 01 01 01 01 01 02 3a 80 18 71 38 2d 40 58 2c '.......:..q8-@X,'
  45 00 a0 5a 00 00 00 1e 01 1d 00 72 51 d0 1e 20 'E..Z.......rQ.. '
  6e 28 55 00 a0 5a 00 00 00 1e 00 00 00 fc 00 53 'n(U..Z.........S'
  41 4d 53 55 4e 47 0a 20 20 20 20 20 00 00 00 fd 'AMSUNG.     ....'
  00 18 4b 1a 51 17 00 0a 20 20 20 20 20 20 01 73 '..K.Q...      .s'
Checksum: 0x73

----------------

Block 3, CTA-861 Extension Block:
  Revision: 3
  Underscans IT Video Formats by default
  Basic audio support
  Supports YCbCr 4:4:4
  Supports YCbCr 4:2:2
  Native detailed modes: 5
  Video Data Block:
    VIC  16:  1920x1080   60.000000 Hz  16:9     67.500 kHz    148.500000 MHz (native)
    VIC  31:  1920x1080   50.000000 Hz  16:9     56.250 kHz    148.500000 MHz
    VIC   4:  1280x720    60.000000 Hz  16:9     45.000 kHz     74.250000 MHz
    VIC  19:  1280x720    50.000000 Hz  16:9     37.500 kHz     74.250000 MHz
    VIC   5:  1920x1080i  60.000000 Hz  16:9     33.750 kHz     74.250000 MHz
    VIC  20:  1920x1080i  50.000000 Hz  16:9     28.125 kHz     74.250000 MHz
    VIC   3:   720x480    59.940060 Hz  16:9     31.469 kHz     27.000000 MHz
    VIC  18:   720x576    50.000000 Hz  16:9     31.250 kHz     27.000000 MHz
    VIC  32:  1920x1080   24.000000 Hz  16:9     27.000 kHz     74.250000 MHz
    VIC  33:  1920x1080   25.000000 Hz  16:9     28.125 kHz     74.250000 MHz
    VIC  34:  1920x1080   30.000000 Hz  16:9     33.750 kHz     74.250000 MHz
  Audio Data Block:
    Linear PCM:
      Max channels: 8
      Supported sample rates (kHz): 192 176.4 96 88.2 48 44.1 32
      Supported sample sizes (bits): 24 20 16
    AC-3:
      Max channels: 6
      Supported sample rates (kHz): 48 44.1 32
      Maximum bit rate: 680 kb/s
    DTS:
      Max channels: 6
      Supported sample rates (kHz): 96 88.2 48 44.1 32
      Maximum bit rate: 1536 kb/s
    Enhanced AC-3 (DD+):
      Max channels: 8
      Supported sample rates (kHz): 48 44.1 32
    MAT (MLP):
      Max channels: 8
      Supported sample rates (kHz): 192 96 48
      Supports only Dolby TrueHD
    DTS-HD:
      Max channels: 8
      Supported sample rates (kHz): 192 176.4 96 88.2 48 44.1
      Audio Format Code dependent value: 0x01
    One Bit Audio:
      Max channels: 6
      Supported sample rates (kHz): 44.1
      Audio Format Code dependent value: 0x00
  Speaker Allocation Data Block:
    FL/FR - Front Left/Right
    LFE1 - Low Frequency Effects 1
    FC - Front Center
    LS/RS - Left/Right Surround
    BC - Back Center
    BL/BR - Back Left/Right
  Vendor-Specific Data Block (HDMI), OUI 00-0C-03:
    Source physical address: 1.2.0.0
    Supports_AI
    DC_36bit
    DC_30bit
    DC_Y444
    Maximum TMDS clock: 225 MHz
  Video Capability Data Block:
    YCbCr quantization: No Data
    RGB quantization: No Data
    PT scan behavior: No Data
    IT scan behavior: Supports both over- and underscan
    CE scan behavior: Supports both over- and underscan
  Detailed Timing Descriptors:
    DTD 6:  1280x720    50.000000 Hz  16:9     37.500 kHz     74.250000 MHz (160 mm x 90 mm)
                 Hfront  440 Hsync  40 Hback  220 Hpol P
                 Vfront    5 Vsync   5 Vback   20 Vpol P
    DTD 7:  1920x1080i  60.000000 Hz  16:9     33.750 kHz     74.250000 MHz (160 mm x 90 mm)
                 Hfront   88 Hsync  44 Hback  148 Hpol P
                 Vfront    2 Vsync   5 Vback   15 Vpol P Vfront +0.5 Odd Field
                 Vfront    2 Vsync   5 Vback   15 Vpol P Vback  +0.5 Even Field
    DTD 8:  1920x1080i  50.000000 Hz  16:9     28.125 kHz     74.250000 MHz (160 mm x 90 mm)
                 Hfront  528 Hsync  44 Hback  148 Hpol P
                 Vfront    2 Vsync   5 Vback   15 Vpol P Vfront +0.5 Odd Field
                 Vfront    2 Vsync   5 Vback   15 Vpol P Vback  +0.5 Even Field
Checksum: 0x26  Unused space in Extension Block: 20 bytes

----------------

Warnings:

Block 0, Base EDID:
  Vendor & Product Identification: The serial number is one of the known dummy values, it should probably be set to 0.
  Basic Display Parameters & Features: Dubious maximum image size (16x9 is smaller than 10x10 cm).
  Detailed Timing Descriptor #1: Dubious image size (160x90 mm is smaller than 100x100 mm).
  Detailed Timing Descriptor #2: Dubious image size (160x90 mm is smaller than 100x100 mm).
Block 1, CTA-861 Extension Block:
  Video Capability Data Block: Set Selectable YCbCr Quantization to avoid interop issues.
  Detailed Timing Descriptor #3: Dubious image size (160x90 mm is smaller than 100x100 mm).
  Detailed Timing Descriptor #4: Dubious image size (160x90 mm is smaller than 100x100 mm).
  Detailed Timing Descriptor #5: Dubious image size (160x90 mm is smaller than 100x100 mm).
Block 3, CTA-861 Extension Block:
  Video Capability Data Block: Set Selectable YCbCr Quantization to avoid interop issues.
  Detailed Timing Descriptor #6: Dubious image size (160x90 mm is smaller than 100x100 mm).
  Detailed Timing Descriptor #7: Dubious image size (160x90 mm is smaller than 100x100 mm).
  Detailed Timing Descriptor #8: Dubious image size (160x90 mm is smaller than 100x100 mm).
EDID:
  CTA-861: Multiple native interlaced timings are defined.

Failures:

Block 0, Base EDID:
  Basic Display Parameters & Features: The chromaticities match sRGB, but sRGB is not signaled.
Block 1, CTA-861 Extension Block:
  Video Capability Data Block: Set Selectable RGB Quantization to avoid interop issues.
Block 2, Base EDID:
  Unknown Extension Block.
Block 3, CTA-861 Extension Block:
  Video Data Block: Duplicate VIC 16.
  Video Data Block: Duplicate VIC 31.
  Video Data Block: Duplicate VIC 4.
  Video Data Block: Duplicate VIC 19.
  Video Data Block: Duplicate VIC 5.
  Video Data Block: Duplicate VIC 20.
  Video Data Block: Duplicate VIC 3.
  Video Data Block: Duplicate VIC 18.
  Video Data Block: Duplicate VIC 32.
  Video Data Block: Duplicate VIC 33.
  Video Data Block: Duplicate VIC 34.
  Speaker Allocation Data Block: Only one instance of this Data Block is allowed.
  Video Capability Data Block: Only one instance of this Data Block is allowed.
  Video Capability Data Block: Set Selectable RGB Quantization to avoid interop issues.
EDID:
  Base EDID: EDID specified 1 extension block(s), but found 3 extension block(s).
  Base EDID: EDID 1.3 requires a Block Map Extension in Block 1 if there are more than 2 blocks in the EDID.
  CTA-861: Native progressive timings are a mix of several resolutions.

EDID conformity: FAIL
