edid-decode (hex):

00 ff ff ff ff ff ff 00 52 55 5c 23 00 00 00 00
09 1f 01 04 95 1a 0e 78 02 5e da a1 4f 4b 83 24
25 4b 53 00 00 00 01 01 01 01 01 01 01 01 01 01
01 01 01 01 01 01 ce 1d 56 e2 50 00 1e 30 30 20
35 00 00 90 10 00 00 1a 00 00 00 00 00 00 00 00
00 00 00 00 00 00 00 00 00 00 00 00 00 fe 00 48
4b 43 20 31 38 38 36 2d 41 30 30 20 00 00 00 fe
00 48 4b 43 20 31 38 38 36 2d 41 30 30 20 00 1d

00 ff ff ff ff ff ff 00 52 55 5c 23 00 00 00 00
09 1f 01 04 95 1a 0e 78 02 5e da a1 4f 4b 83 24
25 4b 53 00 00 00 01 01 01 01 01 01 01 01 01 01
01 01 01 01 01 01 ce 1d 56 e2 50 00 1e 30 30 20
35 00 00 90 10 00 00 1a 00 00 00 00 00 00 00 00
00 00 00 00 00 00 00 00 00 00 00 00 00 fe 00 48
4b 43 20 31 38 38 36 2d 41 30 30 20 00 00 00 fe
00 48 4b 43 20 31 38 38 36 2d 41 30 30 20 00 1d

----------------

Block 0, Base EDID:
  EDID Structure Version & Revision: 1.4
  Vendor & Product Identification:
    Manufacturer: TRU
    Model: 9052
    Made in: week 9 of 2021
  Basic Display Parameters & Features:
    Digital display
    Bits per primary color channel: 6
    DisplayPort interface
    Maximum image size: 26 cm x 14 cm
    Gamma: 2.20
    Supported color formats: RGB 4:4:4
    First detailed timing includes the native pixel format and preferred refresh rate
  Color Characteristics:
    Red  : 0.6298, 0.3095
    Green: 0.2958, 0.5136
    Blue : 0.1435, 0.1455
    White: 0.2949, 0.3261
  Established Timings I & II: none
  Standard Timings: none
  Detailed Timing Descriptors:
    DTD 1:  1366x768    60.059067 Hz 683:384   47.927 kHz     76.300000 MHz (256 mm x 144 mm)
                 Hfront   48 Hsync  32 Hback  146 Hpol P
                 Vfront    3 Vsync   5 Vback   22 Vpol N
    Empty Descriptor
    Alphanumeric Data String: 'HKC 1886-A00 '
    Alphanumeric Data String: 'HKC 1886-A00 '
Checksum: 0x1d

----------------

Warnings:

Block 0, Base EDID:
  Missing Display Product Name.

Failures:

Block 0, Base EDID:
  Empty Descriptor: Use Dummy Descriptor instead of all zeroes.
  Alphanumeric Data String: No newline, but one or more trailing spaces.
  Alphanumeric Data String: No newline, but one or more trailing spaces.
EDID:
  Extension Block 1 started with EDID header, ignoring Extension Blocks >= 1.

EDID conformity: FAIL
