edid-decode (hex):

00 ff ff ff ff ff ff 00 4d 10 c2 14 00 00 00 00
11 1d 01 04 a5 1a 0e 78 0e de 50 a3 54 4c 99 26
0f 50 54 00 00 00 01 01 01 01 01 01 01 01 01 01
01 01 01 01 01 01 1a 36 80 a0 70 38 1e 40 30 20
35 00 00 90 10 00 00 18 00 00 00 10 00 00 00 00
00 00 00 00 00 00 00 00 00 00 00 00 00 fe 00 59
43 52 59 54 80 4c 51 31 31 36 4d 31 00 00 00 00
00 02 41 03 6e 01 12 00 00 0a 01 0a 20 20 00 af

00 ff ff ff ff ff ff 00 4d 10 c2 14 00 00 00 00
11 1d 01 04 a5 1a 0e 78 0e de 50 a3 54 4c 99 26
0f 50 54 00 00 00 01 01 01 01 01 01 01 01 01 01
01 01 01 01 01 01 1a 36 80 a0 70 38 1e 40 30 20
35 00 00 90 10 00 00 18 00 00 00 10 00 00 00 00
00 00 00 00 00 00 00 00 00 00 00 00 00 fe 00 59
43 52 59 54 80 4c 51 31 31 36 4d 31 00 00 00 00
00 02 41 03 6e 01 12 00 00 0a 01 0a 20 20 00 af

----------------

Block 0, Base EDID:
  EDID Structure Version & Revision: 1.4
  Vendor & Product Identification:
    Manufacturer: SHP
    Model: 5314
    Made in: week 17 of 2019
  Basic Display Parameters & Features:
    Digital display
    Bits per primary color channel: 8
    DisplayPort interface
    Maximum image size: 26 cm x 14 cm
    Gamma: 2.20
    Supported color formats: RGB 4:4:4, YCrCb 4:4:4
    Default (sRGB) color space is primary color space
    First detailed timing includes the native pixel format and preferred refresh rate
  Color Characteristics:
    Red  : 0.6396, 0.3291
    Green: 0.2998, 0.5996
    Blue : 0.1494, 0.0595
    White: 0.3125, 0.3281
  Established Timings I & II: none
  Standard Timings: none
  Detailed Timing Descriptors:
    DTD 1:  1920x1080   59.987872 Hz  16:9     66.587 kHz    138.500000 MHz (256 mm x 144 mm)
                 Hfront   48 Hsync  32 Hback   80 Hpol N
                 Vfront    3 Vsync   5 Vback   22 Vpol N
    Dummy Descriptor:
    Alphanumeric Data String: 'YCRYT.LQ116M1'
    Manufacturer-Specified Display Descriptor (0x00): 00 00 00 02 41 03 6e 01 12 00 00 0a 01 0a 20 20 '....A.n.......  '
Checksum: 0xaf

----------------

Block 1, Unknown EDID Extension Block 0x00:
  00 ff ff ff ff ff ff 00 4d 10 c2 14 00 00 00 00 '........M.......'
  11 1d 01 04 a5 1a 0e 78 0e de 50 a3 54 4c 99 26 '.......x..P.TL.&'
  0f 50 54 00 00 00 01 01 01 01 01 01 01 01 01 01 '.PT.............'
  01 01 01 01 01 01 1a 36 80 a0 70 38 1e 40 30 20 '.......6..p8.@0 '
  35 00 00 90 10 00 00 18 00 00 00 10 00 00 00 00 '5...............'
  00 00 00 00 00 00 00 00 00 00 00 00 00 fe 00 59 '...............Y'
  43 52 59 54 80 4c 51 31 31 36 4d 31 00 00 00 00 'CRYT.LQ116M1....'
  00 02 41 03 6e 01 12 00 00 0a 01 0a 20 20 00 af '..A.n.......  ..'
Checksum: 0xaf

----------------

Warnings:

Block 0, Base EDID:
  Alphanumeric Data String: Non-ASCII character 0x80 at position 5, can cause problems.
  Missing Display Product Name.

Failures:

Block 0, Base EDID:
  Basic Display Parameters & Features: sRGB is signaled, but the chromaticities do not match.
Block 1, Base EDID:
  Unknown Extension Block.
EDID:
  Base EDID: EDID specified 0 extension block(s), but found 1 extension block(s).

EDID conformity: FAIL
