edid-decode (hex):

00 ff ff ff ff ff ff 00 06 af 9b 71 00 00 00 00
c2 1f 01 04 a5 1e 13 78 03 e0 35 ad 51 44 b2 27
0c 50 54 00 00 00 01 01 01 01 01 01 01 01 01 01
01 01 01 01 01 01 4a d8 00 a0 a0 40 60 60 30 20
35 00 2d bc 10 00 00 18 2a 6c 00 a0 a0 40 60 60
30 20 35 00 2d bc 10 00 00 18 00 00 00 00 00 00
00 00 00 00 00 00 00 00 00 00 00 00 00 00 00 02
00 0c 24 ff 13 3c fa 1e 10 46 fa 20 20 20 00 72

----------------

Block 0, Base EDID:
  EDID Structure Version & Revision: 1.4
  Vendor & Product Identification:
    Manufacturer: AUO
    Model: 29083
    Made in: week 194 of 2021
  Basic Display Parameters & Features:
    Digital display
    Bits per primary color channel: 8
    DisplayPort interface
    Maximum image size: 30 cm x 19 cm
    Gamma: 2.20
    Supported color formats: RGB 4:4:4
    First detailed timing includes the native pixel format and preferred refresh rate
    Display supports continuous frequencies
  Color Characteristics:
    Red  : 0.6787, 0.3183
    Green: 0.2656, 0.6953
    Blue : 0.1523, 0.0498
    White: 0.3134, 0.3291
  Established Timings I & II: none
  Standard Timings: none
  Detailed Timing Descriptors:
    DTD 1:  2560x1600  120.027227 Hz  16:10   203.566 kHz    553.700000 MHz (301 mm x 188 mm)
                 Hfront   48 Hsync  32 Hback   80 Hpol N
                 Vfront    3 Vsync   5 Vback   88 Vpol N
    DTD 2:  2560x1600   60.024452 Hz  16:10   101.801 kHz    276.900000 MHz (301 mm x 188 mm)
                 Hfront   48 Hsync  32 Hback   80 Hpol N
                 Vfront    3 Vsync   5 Vback   88 Vpol N
    Empty Descriptor
    Manufacturer-Specified Display Descriptor (0x02): 00 02 00 0c 24 ff 13 3c fa 1e 10 46 fa 20 20 20 '....$..<...F.   '
Checksum: 0x72

----------------

Warnings:

Block 0, Base EDID:
  Missing Display Product Name.

Failures:

Block 0, Base EDID:
  Vendor & Product Identification: Invalid week of manufacture (> 54).
  Empty Descriptor: Use Dummy Descriptor instead of all zeroes.
  Missing Display Range Limits Descriptor.

EDID conformity: FAIL
