edid-decode (hex):

00 ff ff ff ff ff ff 00 1e 6d 72 5b dc a0 06 00
07 1c 01 03 80 35 1e 78 ea a4 35 a5 54 4f 9e 27
12 50 54 a5 4b 80 31 7c 45 68 45 7c 61 7c 81 68
81 80 81 bc 95 3c 02 3a 80 18 71 38 2d 40 58 2c
45 00 13 2a 21 00 00 1e 5a 87 80 a0 70 38 4d 40
30 20 3a 00 13 2a 21 00 00 1a 00 00 00 fd 00 30
90 aa aa 24 00 0a 20 20 20 20 20 20 00 00 00 fc
00 4c 47 20 55 4c 54 52 41 47 45 41 52 0a 01 0d

02 03 2f f1 23 09 07 07 4b 01 02 03 04 11 12 13
1f 90 3f 40 83 01 00 00 65 03 0c 00 10 00 67 d8
5d c4 01 78 80 03 68 1a 00 00 01 01 30 90 00 80
48 80 18 71 38 2d 40 58 2c 45 00 13 2a 21 00 00
1e 86 6f 80 a0 70 38 40 40 30 20 35 00 13 2a 21
00 00 1e fe 5b 80 a0 70 38 35 40 30 20 35 00 13
2a 21 00 00 18 00 00 00 ff 00 0a 20 20 20 20 20
20 20 20 20 20 20 20 00 00 00 00 00 00 00 00 2d

00 ff ff ff ff ff ff 00 1e 6d 72 5b dc a0 06 00
07 1c 01 03 80 35 1e 78 ea a4 35 a5 54 4f 9e 27
12 50 54 a5 4b 80 31 7c 45 68 45 7c 61 7c 81 68
81 80 81 bc 95 3c 02 3a 80 18 71 38 2d 40 58 2c
45 00 13 2a 21 00 00 1e 5a 87 80 a0 70 38 4d 40
30 20 3a 00 13 2a 21 00 00 1a 00 00 00 fd 00 30
90 aa aa 24 00 0a 20 20 20 20 20 20 00 00 00 fc
00 4c 47 20 55 4c 54 52 41 47 45 41 52 0a 01 0d

02 03 2f f1 23 09 07 07 4b 01 02 03 04 11 12 13
1f 90 3f 40 83 01 00 00 65 03 0c 00 10 00 67 d8
5d c4 01 78 80 03 68 1a 00 00 01 01 30 90 00 80
48 80 18 71 38 2d 40 58 2c 45 00 13 2a 21 00 00
1e 86 6f 80 a0 70 38 40 40 30 20 35 00 13 2a 21
00 00 1e fe 5b 80 a0 70 38 35 40 30 20 35 00 13
2a 21 00 00 18 00 00 00 ff 00 0a 20 20 20 20 20
20 20 20 20 20 20 20 00 00 00 00 00 00 00 00 2d

----------------

Block 0, Base EDID:
  EDID Structure Version & Revision: 1.3
  Vendor & Product Identification:
    Manufacturer: GSM
    Model: 23410
    Serial Number: ...
    Made in: week 7 of 2018
  Basic Display Parameters & Features:
    Digital display
    Maximum image size: 53 cm x 30 cm
    Gamma: 2.20
    DPMS levels: Standby Suspend Off
    RGB color display
    First detailed timing is the preferred timing
  Color Characteristics:
    Red  : 0.6464, 0.3300
    Green: 0.3095, 0.6171
    Blue : 0.1523, 0.0732
    White: 0.3134, 0.3291
  Established Timings I & II:
    IBM     :   720x400    70.081663 Hz   9:5     31.467 kHz     28.320000 MHz
    DMT 0x04:   640x480    59.940476 Hz   4:3     31.469 kHz     25.175000 MHz
    DMT 0x06:   640x480    75.000000 Hz   4:3     37.500 kHz     31.500000 MHz
    DMT 0x09:   800x600    60.316541 Hz   4:3     37.879 kHz     40.000000 MHz
    DMT 0x0b:   800x600    75.000000 Hz   4:3     46.875 kHz     49.500000 MHz
    DMT 0x10:  1024x768    60.003840 Hz   4:3     48.363 kHz     65.000000 MHz
    DMT 0x12:  1024x768    75.028582 Hz   4:3     60.023 kHz     78.750000 MHz
    DMT 0x24:  1280x1024   75.024675 Hz   5:4     79.976 kHz    135.000000 MHz
    Apple   :  1152x870    75.061550 Hz 192:145   68.681 kHz    100.000000 MHz
  Standard Timings:
    GTF     :   640x480   119.999084 Hz   4:3     61.800 kHz     52.406000 MHz
    GTF     :   800x600    99.999707 Hz   4:3     63.600 kHz     68.179000 MHz
    GTF     :   800x600   119.999886 Hz   4:3     77.160 kHz     83.950000 MHz
    GTF     :  1024x768   119.999931 Hz   4:3     98.760 kHz    139.054000 MHz
    GTF     :  1280x960   100.000000 Hz   4:3    101.700 kHz    178.992000 MHz
    DMT 0x23:  1280x1024   60.019740 Hz   5:4     63.981 kHz    108.000000 MHz
    GTF     :  1280x1024  120.000185 Hz   5:4    131.640 kHz    233.793000 MHz
    GTF     :  1440x900   119.999896 Hz  16:10   115.800 kHz    229.747000 MHz
  Detailed Timing Descriptors:
    DTD 1:  1920x1080   60.000000 Hz  16:9     67.500 kHz    148.500000 MHz (531 mm x 298 mm)
                 Hfront   88 Hsync  44 Hback  148 Hpol P
                 Vfront    4 Vsync   5 Vback   36 Vpol P
    DTD 2:  1920x1080  143.981451 Hz  16:9    166.587 kHz    346.500000 MHz (531 mm x 298 mm)
                 Hfront   48 Hsync  32 Hback   80 Hpol P
                 Vfront    3 Vsync  10 Vback   64 Vpol N
    Display Range Limits:
      Monitor ranges (GTF): 48-144 Hz V, 170-170 kHz H, max dotclock 360 MHz
    Display Product Name: 'LG ULTRAGEAR'
  Extension blocks: 1
Checksum: 0x0d

----------------

Block 1, CTA-861 Extension Block:
  Revision: 3
  Underscans IT Video Formats by default
  Basic audio support
  Supports YCbCr 4:4:4
  Supports YCbCr 4:2:2
  Native detailed modes: 1
  Audio Data Block:
    Linear PCM:
      Max channels: 2
      Supported sample rates (kHz): 48 44.1 32
      Supported sample sizes (bits): 24 20 16
  Video Data Block:
    VIC   1:   640x480    59.940476 Hz   4:3     31.469 kHz     25.175000 MHz
    VIC   2:   720x480    59.940060 Hz   4:3     31.469 kHz     27.000000 MHz
    VIC   3:   720x480    59.940060 Hz  16:9     31.469 kHz     27.000000 MHz
    VIC   4:  1280x720    60.000000 Hz  16:9     45.000 kHz     74.250000 MHz
    VIC  17:   720x576    50.000000 Hz   4:3     31.250 kHz     27.000000 MHz
    VIC  18:   720x576    50.000000 Hz  16:9     31.250 kHz     27.000000 MHz
    VIC  19:  1280x720    50.000000 Hz  16:9     37.500 kHz     74.250000 MHz
    VIC  31:  1920x1080   50.000000 Hz  16:9     56.250 kHz    148.500000 MHz
    VIC  16:  1920x1080   60.000000 Hz  16:9     67.500 kHz    148.500000 MHz (native)
    VIC  63:  1920x1080  120.000000 Hz  16:9    135.000 kHz    297.000000 MHz
    VIC  64:  1920x1080  100.000000 Hz  16:9    112.500 kHz    297.000000 MHz
  Speaker Allocation Data Block:
    FL/FR - Front Left/Right
  Vendor-Specific Data Block (HDMI), OUI 00-0C-03:
    Source physical address: 1.0.0.0
  Vendor-Specific Data Block (HDMI Forum), OUI C4-5D-D8:
    Version: 1
    Maximum TMDS Character Rate: 600 MHz
    SCDC Present
    Supports 12-bits/component Deep Color 4:2:0 Pixel Encoding
    Supports 10-bits/component Deep Color 4:2:0 Pixel Encoding
  Vendor-Specific Data Block (AMD), OUI 00-00-1A:
    Version: 1
    Feature Caps: 0x01
    Minimum Refresh Rate: 48 Hz
    Maximum Refresh Rate: 144 Hz
    Flags 1.x: 0x00
  Detailed Timing Descriptors:
    DTD 3:  1920x1080   74.989899 Hz  16:9     84.364 kHz    185.600000 MHz (531 mm x 298 mm)
                 Hfront   88 Hsync  44 Hback  148 Hpol P
                 Vfront    4 Vsync   5 Vback   36 Vpol P
    DTD 4:  1920x1080  119.982181 Hz  16:9    137.260 kHz    285.500000 MHz (531 mm x 298 mm)
                 Hfront   48 Hsync  32 Hback   80 Hpol P
                 Vfront    3 Vsync   5 Vback   56 Vpol P
    DTD 5:  1920x1080   99.930409 Hz  16:9    113.221 kHz    235.500000 MHz (531 mm x 298 mm)
                 Hfront   48 Hsync  32 Hback   80 Hpol N
                 Vfront    3 Vsync   5 Vback   45 Vpol N
    Display Product Serial Number: ...
Checksum: 0x2d  Unused space in Extension Block: 8 bytes

----------------

Block 2, Unknown EDID Extension Block 0x00:
  00 ff ff ff ff ff ff 00 1e 6d 72 5b dc a0 06 00 '.........mr[....'
  07 1c 01 03 80 35 1e 78 ea a4 35 a5 54 4f 9e 27 '.....5.x..5.TO.''
  12 50 54 a5 4b 80 31 7c 45 68 45 7c 61 7c 81 68 '.PT.K.1|EhE|a|.h'
  81 80 81 bc 95 3c 02 3a 80 18 71 38 2d 40 58 2c '.....<.:..q8-@X,'
  45 00 13 2a 21 00 00 1e 5a 87 80 a0 70 38 4d 40 'E..*!...Z...p8M@'
  30 20 3a 00 13 2a 21 00 00 1a 00 00 00 fd 00 30 '0 :..*!........0'
  90 aa aa 24 00 0a 20 20 20 20 20 20 00 00 00 fc '...$..      ....'
  00 4c 47 20 55 4c 54 52 41 47 45 41 52 0a 01 0d '.LG ULTRAGEAR...'
Checksum: 0x0d

----------------

Block 3, CTA-861 Extension Block:
  Revision: 3
  Underscans IT Video Formats by default
  Basic audio support
  Supports YCbCr 4:4:4
  Supports YCbCr 4:2:2
  Native detailed modes: 1
  Audio Data Block:
    Linear PCM:
      Max channels: 2
      Supported sample rates (kHz): 48 44.1 32
      Supported sample sizes (bits): 24 20 16
  Video Data Block:
    VIC   1:   640x480    59.940476 Hz   4:3     31.469 kHz     25.175000 MHz
    VIC   2:   720x480    59.940060 Hz   4:3     31.469 kHz     27.000000 MHz
    VIC   3:   720x480    59.940060 Hz  16:9     31.469 kHz     27.000000 MHz
    VIC   4:  1280x720    60.000000 Hz  16:9     45.000 kHz     74.250000 MHz
    VIC  17:   720x576    50.000000 Hz   4:3     31.250 kHz     27.000000 MHz
    VIC  18:   720x576    50.000000 Hz  16:9     31.250 kHz     27.000000 MHz
    VIC  19:  1280x720    50.000000 Hz  16:9     37.500 kHz     74.250000 MHz
    VIC  31:  1920x1080   50.000000 Hz  16:9     56.250 kHz    148.500000 MHz
    VIC  16:  1920x1080   60.000000 Hz  16:9     67.500 kHz    148.500000 MHz (native)
    VIC  63:  1920x1080  120.000000 Hz  16:9    135.000 kHz    297.000000 MHz
    VIC  64:  1920x1080  100.000000 Hz  16:9    112.500 kHz    297.000000 MHz
  Speaker Allocation Data Block:
    FL/FR - Front Left/Right
  Vendor-Specific Data Block (HDMI), OUI 00-0C-03:
    Source physical address: 1.0.0.0
  Vendor-Specific Data Block (HDMI Forum), OUI C4-5D-D8:
    Version: 1
    Maximum TMDS Character Rate: 600 MHz
    SCDC Present
    Supports 12-bits/component Deep Color 4:2:0 Pixel Encoding
    Supports 10-bits/component Deep Color 4:2:0 Pixel Encoding
  Vendor-Specific Data Block (AMD), OUI 00-00-1A:
    Version: 1
    Feature Caps: 0x01
    Minimum Refresh Rate: 48 Hz
    Maximum Refresh Rate: 144 Hz
    Flags 1.x: 0x00
  Detailed Timing Descriptors:
    DTD 6:  1920x1080   74.989899 Hz  16:9     84.364 kHz    185.600000 MHz (531 mm x 298 mm)
                 Hfront   88 Hsync  44 Hback  148 Hpol P
                 Vfront    4 Vsync   5 Vback   36 Vpol P
    DTD 7:  1920x1080  119.982181 Hz  16:9    137.260 kHz    285.500000 MHz (531 mm x 298 mm)
                 Hfront   48 Hsync  32 Hback   80 Hpol P
                 Vfront    3 Vsync   5 Vback   56 Vpol P
    DTD 8:  1920x1080   99.930409 Hz  16:9    113.221 kHz    235.500000 MHz (531 mm x 298 mm)
                 Hfront   48 Hsync  32 Hback   80 Hpol N
                 Vfront    3 Vsync   5 Vback   45 Vpol N
    Display Product Serial Number: ...
Checksum: 0x2d  Unused space in Extension Block: 8 bytes

----------------

Warnings:

Block 1, CTA-861 Extension Block:
  Video Data Block: VIC 1 and the first DTD are not identical. Is this intended?
  Display Product Serial Number is set, so the Serial Number in the Base EDID should be 0.
  Add a Colorimetry Data Block with the sRGB colorimetry bit set to avoid interop issues.
EDID:
  Base EDID: Some timings are out of range of the Monitor Ranges:
    Horizontal Freq: 31.250 - 166.586 kHz (Monitor: 170.000 - 170.000 kHz)
  Base EDID: Multiple Display Product Serial Numbers are specified, is that intended?
  CTA-861: Multiple native progressive timings are defined.

Failures:

Block 0, Base EDID:
  Display Product Serial Number: ...
  Display Product Serial Number: ...
Block 1, CTA-861 Extension Block:
  Missing VCDB, needed for Set Selectable RGB Quantization to avoid interop issues.
Block 2, Base EDID:
  Unknown Extension Block.
Block 3, CTA-861 Extension Block:
  Video Data Block: Duplicate VIC 1.
  Video Data Block: Duplicate VIC 2.
  Video Data Block: Duplicate VIC 3.
  Video Data Block: Duplicate VIC 4.
  Video Data Block: Duplicate VIC 17.
  Video Data Block: Duplicate VIC 18.
  Video Data Block: Duplicate VIC 19.
  Video Data Block: Duplicate VIC 31.
  Video Data Block: Duplicate VIC 16.
  Video Data Block: Duplicate VIC 63.
  Video Data Block: Duplicate VIC 64.
  Speaker Allocation Data Block: Only one instance of this Data Block is allowed.
  Vendor-Specific Data Block (HDMI Forum), OUI C4-5D-D8: Duplicate HDMI Forum VSDB/SCDB.
EDID:
  Base EDID: EDID specified 1 extension block(s), but found 3 extension block(s).
  Base EDID: EDID 1.3 requires a Block Map Extension in Block 1 if there are more than 2 blocks in the EDID.

EDID conformity: FAIL
