edid-decode (hex):

00 ff ff ff ff ff ff 00 06 b3 61 27 00 00 00 14
1d 23 01 04 b5 3c 22 78 3b 33 a5 ae 4f 43 a7 25
0d 50 54 25 4a 00 d1 c0 81 c0 a9 40 81 40 81 80
01 01 01 01 01 01 4d d0 00 a0 f0 70 3e 80 30 20
35 00 55 50 21 00 00 1a 00 00 00 fd 0c 30 a0 64
64 8f 01 0a 20 20 20 20 20 20 00 00 00 fc 00 50
41 32 37 55 43 47 45 0a 20 20 20 20 00 00 00 ff
00 54 37 4c 4d 53 42 30 32 32 32 37 39 0a 02 46

02 03 47 71 59 76 75 61 60 5f 5e 5d 3f 40 10 1f
22 21 20 04 13 12 03 11 02 01 05 14 16 07 23 09
17 07 83 01 00 00 e2 00 ea e3 05 e3 01 e6 06 07
01 77 73 06 6f 1a 00 00 03 0b 30 a0 00 20 77 00
77 00 a0 00 e2 0f 0f 6f c2 00 a0 a0 a0 55 50 30
20 35 00 55 50 21 00 00 1a 56 5e 00 a0 a0 a0 29
50 30 20 35 00 55 50 21 00 00 1a 00 00 00 00 00
00 00 00 00 00 00 00 00 00 00 00 00 00 00 00 b1

70 12 79 03 00 03 01 64 eb 2a 02 04 ff 0e 9f 00
2f 80 1f 00 6f 08 3b 00 02 00 04 00 9a 08 02 04
ff 0e 9f 00 2f 80 1f 00 6f 08 99 00 02 00 04 00
01 d0 00 04 ff 0e 9f 00 2f 80 1f 00 6f 08 3d 00
02 00 04 00 89 66 00 04 ff 0e 9f 00 2f 80 1f 00
6f 08 1e 00 02 00 04 00 d5 51 00 04 ff 0e 9f 00
2f 80 1f 00 6f 08 18 00 02 00 04 00 00 00 00 00
00 00 00 00 00 00 00 00 00 00 00 00 00 00 3b 90

00 ff ff ff ff ff ff 00 06 b3 61 27 00 00 00 14
1d 23 01 04 b5 3c 22 78 3b 33 a5 ae 4f 43 a7 25
0d 50 54 25 4a 00 d1 c0 81 c0 a9 40 81 40 81 80
01 01 01 01 01 01 4d d0 00 a0 f0 70 3e 80 30 20
35 00 55 50 21 00 00 1a 00 00 00 fd 0c 30 a0 64
64 8f 01 0a 20 20 20 20 20 20 00 00 00 fc 00 50
41 32 37 55 43 47 45 0a 20 20 20 20 00 00 00 ff
00 54 37 4c 4d 53 42 30 32 32 32 37 39 0a 02 46

02 03 47 71 59 76 75 61 60 5f 5e 5d 3f 40 10 1f
22 21 20 04 13 12 03 11 02 01 05 14 16 07 23 09
17 07 83 01 00 00 e2 00 ea e3 05 e3 01 e6 06 07
01 77 73 06 6f 1a 00 00 03 0b 30 a0 00 20 77 00
77 00 a0 00 e2 0f 0f 6f c2 00 a0 a0 a0 55 50 30
20 35 00 55 50 21 00 00 1a 56 5e 00 a0 a0 a0 29
50 30 20 35 00 55 50 21 00 00 1a 00 00 00 00 00
00 00 00 00 00 00 00 00 00 00 00 00 00 00 00 b1

70 12 79 03 00 03 01 64 eb 2a 02 04 ff 0e 9f 00
2f 80 1f 00 6f 08 3b 00 02 00 04 00 9a 08 02 04
ff 0e 9f 00 2f 80 1f 00 6f 08 99 00 02 00 04 00
01 d0 00 04 ff 0e 9f 00 2f 80 1f 00 6f 08 3d 00
02 00 04 00 89 66 00 04 ff 0e 9f 00 2f 80 1f 00
6f 08 1e 00 02 00 04 00 d5 51 00 04 ff 0e 9f 00
2f 80 1f 00 6f 08 18 00 02 00 04 00 00 00 00 00
00 00 00 00 00 00 00 00 00 00 00 00 00 00 3b 90

----------------

Block 0, Base EDID:
  EDID Structure Version & Revision: 1.4
  Vendor & Product Identification:
    Manufacturer: AUS
    Model: 10081
    Serial Number: ...
    Made in: week 29 of 2025
  Basic Display Parameters & Features:
    Digital display
    Bits per primary color channel: 10
    DisplayPort interface
    Maximum image size: 60 cm x 34 cm
    Gamma: 2.20
    DPMS levels: Off
    Supported color formats: RGB 4:4:4, YCrCb 4:4:4, YCrCb 4:2:2
    First detailed timing includes the native pixel format and preferred refresh rate
    Display supports continuous frequencies
  Color Characteristics:
    Red  : 0.6796, 0.3115
    Green: 0.2617, 0.6552
    Blue : 0.1464, 0.0527
    White: 0.3134, 0.3291
  Established Timings I & II:
    DMT 0x04:   640x480    59.940476 Hz   4:3     31.469 kHz     25.175000 MHz
    DMT 0x06:   640x480    75.000000 Hz   4:3     37.500 kHz     31.500000 MHz
    DMT 0x09:   800x600    60.316541 Hz   4:3     37.879 kHz     40.000000 MHz
    DMT 0x0b:   800x600    75.000000 Hz   4:3     46.875 kHz     49.500000 MHz
    DMT 0x10:  1024x768    60.003840 Hz   4:3     48.363 kHz     65.000000 MHz
    DMT 0x12:  1024x768    75.028582 Hz   4:3     60.023 kHz     78.750000 MHz
  Standard Timings:
    DMT 0x52:  1920x1080   60.000000 Hz  16:9     67.500 kHz    148.500000 MHz
    DMT 0x55:  1280x720    60.000000 Hz  16:9     45.000 kHz     74.250000 MHz
    DMT 0x33:  1600x1200   60.000000 Hz   4:3     75.000 kHz    162.000000 MHz
    DMT 0x20:  1280x960    60.000000 Hz   4:3     60.000 kHz    108.000000 MHz
    DMT 0x23:  1280x1024   60.019740 Hz   5:4     63.981 kHz    108.000000 MHz
  Detailed Timing Descriptors:
    DTD 1:  3840x2160   59.996625 Hz  16:9    133.312 kHz    533.250000 MHz (597 mm x 336 mm)
                 Hfront   48 Hsync  32 Hback   80 Hpol P
                 Vfront    3 Vsync   5 Vback   54 Vpol N
    Display Range Limits:
      Monitor ranges (Range Limits Only): 48-160 Hz V, 355-355 kHz H, max dotclock 1430 MHz
    Display Product Name: 'PA27UCGE'
    Display Product Serial Number: ...
  Extension blocks: 2
Checksum: 0x46

----------------

Block 1, CTA-861 Extension Block:
  Revision: 3
  Basic audio support
  Supports YCbCr 4:4:4
  Supports YCbCr 4:2:2
  Native DTDs: 1
  Video Data Block:
    VIC 118:  3840x2160  120.000000 Hz  16:9    270.000 kHz   1188.000000 MHz
    VIC 117:  3840x2160  100.000000 Hz  16:9    225.000 kHz   1188.000000 MHz
    VIC  97:  3840x2160   60.000000 Hz  16:9    135.000 kHz    594.000000 MHz
    VIC  96:  3840x2160   50.000000 Hz  16:9    112.500 kHz    594.000000 MHz
    VIC  95:  3840x2160   30.000000 Hz  16:9     67.500 kHz    297.000000 MHz
    VIC  94:  3840x2160   25.000000 Hz  16:9     56.250 kHz    297.000000 MHz
    VIC  93:  3840x2160   24.000000 Hz  16:9     54.000 kHz    297.000000 MHz
    VIC  63:  1920x1080  120.000000 Hz  16:9    135.000 kHz    297.000000 MHz
    VIC  64:  1920x1080  100.000000 Hz  16:9    112.500 kHz    297.000000 MHz
    VIC  16:  1920x1080   60.000000 Hz  16:9     67.500 kHz    148.500000 MHz
    VIC  31:  1920x1080   50.000000 Hz  16:9     56.250 kHz    148.500000 MHz
    VIC  34:  1920x1080   30.000000 Hz  16:9     33.750 kHz     74.250000 MHz
    VIC  33:  1920x1080   25.000000 Hz  16:9     28.125 kHz     74.250000 MHz
    VIC  32:  1920x1080   24.000000 Hz  16:9     27.000 kHz     74.250000 MHz
    VIC   4:  1280x720    60.000000 Hz  16:9     45.000 kHz     74.250000 MHz
    VIC  19:  1280x720    50.000000 Hz  16:9     37.500 kHz     74.250000 MHz
    VIC  18:   720x576    50.000000 Hz  16:9     31.250 kHz     27.000000 MHz
    VIC   3:   720x480    59.940060 Hz  16:9     31.469 kHz     27.000000 MHz
    VIC  17:   720x576    50.000000 Hz   4:3     31.250 kHz     27.000000 MHz
    VIC   2:   720x480    59.940060 Hz   4:3     31.469 kHz     27.000000 MHz
    VIC   1:   640x480    59.940476 Hz   4:3     31.469 kHz     25.175000 MHz
    VIC   5:  1920x1080i  60.000000 Hz  16:9     33.750 kHz     74.250000 MHz
    VIC  20:  1920x1080i  50.000000 Hz  16:9     28.125 kHz     74.250000 MHz
    VIC  22:  1440x576i   50.000000 Hz  16:9     15.625 kHz     27.000000 MHz
    VIC   7:  1440x480i   59.940060 Hz  16:9     15.734 kHz     27.000000 MHz
  Audio Data Block:
    Linear PCM:
      Max channels: 2
      Supported sample rates (kHz): 96 48 44.1 32
      Supported sample sizes (bits): 24 20 16
  Speaker Allocation Data Block:
    FL/FR - Front Left/Right
  Video Capability Data Block:
    YCbCr quantization: Selectable (via AVI YQ)
    RGB quantization: Selectable (via AVI Q)
    PT scan behavior: Always Underscanned
    IT scan behavior: Always Underscanned
    CE scan behavior: Always Underscanned
  Colorimetry Data Block:
    xvYCC601
    xvYCC709
    BT2020cYCC
    BT2020YCC
    BT2020RGB
    Gamut Boundary Description Metadata Profile P0
  HDR Static Metadata Data Block:
    Electro optical transfer functions:
      Traditional gamma - SDR luminance range
      Traditional gamma - HDR luminance range
      SMPTE ST2084
    Supported static metadata descriptors:
      Static metadata type 1
    Desired content max luminance: 119 (658.302 cd/m^2)
    Desired content max frame-average luminance: 115 (603.666 cd/m^2)
    Desired content min luminance: 6 (0.004 cd/m^2)
  Vendor-Specific Data Block (AMD), OUI 00-00-1A:
    Version: 3
    Feature Caps: 0x0b
      Local Dimming Supported
    Minimum Refresh Rate: 48 Hz
    Maximum Refresh Rate: 160 Hz
    Flags 1.x: 0x00
    Flags 2.x: 0x20
      ST 2084 (PQ) EOTF Supported
      Linear EOTF (Windows scRGB, 0.0 - 125.0) Supported
      BT.2020 Gamut Supported
      Display is Mini LED
    Maximum luminance: 119 (658.302 cd/m^2)
    Minimum luminance: 0 (0.000 cd/m^2)
    Maximum luminance (without local dimming): 119 (658.302 cd/m^2)
    Minimum luminance (without local dimming): 0 (0.000 cd/m^2)
  YCbCr 4:2:0 Capability Map Data Block:
    VIC 118:  3840x2160  120.000000 Hz  16:9    270.000 kHz   1188.000000 MHz
    VIC 117:  3840x2160  100.000000 Hz  16:9    225.000 kHz   1188.000000 MHz
    VIC  97:  3840x2160   60.000000 Hz  16:9    135.000 kHz    594.000000 MHz
    VIC  96:  3840x2160   50.000000 Hz  16:9    112.500 kHz    594.000000 MHz
  Detailed Timing Descriptors:
    DTD 2:  2560x1440  119.997589 Hz  16:9    182.996 kHz    497.750000 MHz (597 mm x 336 mm)
                 Hfront   48 Hsync  32 Hback   80 Hpol P
                 Vfront    3 Vsync   5 Vback   77 Vpol N
    DTD 3:  2560x1440   59.950550 Hz  16:9     88.787 kHz    241.500000 MHz (597 mm x 336 mm)
                 Hfront   48 Hsync  32 Hback   80 Hpol P
                 Vfront    3 Vsync   5 Vback   33 Vpol N
Checksum: 0xb1  Unused space in Extension Block: 20 bytes

----------------

Block 2, DisplayID Extension Block:
  Version: 1.2
  Extension Count: 0
  Display Product Type: Standalone display device
  Video Timing Modes Type 1 - Detailed Timings Data Block:
    DTD:  3840x2160  159.977477 Hz  16:9    355.150 kHz   1420.600000 MHz (aspect 16:9, no 3D stereo)
               Hfront   48 Hsync  32 Hback   80 Hpol P
               Vfront    3 Vsync   5 Vback   52 Vpol N
    DTD:  3840x2160  143.987684 Hz  16:9    333.188 kHz   1332.750000 MHz (aspect 16:9, no 3D stereo)
               Hfront   48 Hsync  32 Hback   80 Hpol P
               Vfront    3 Vsync   5 Vback  146 Vpol N
    DTD:  3840x2160   59.912241 Hz  16:9    133.125 kHz    532.500000 MHz (aspect 16:9, no 3D stereo)
               Hfront   48 Hsync  32 Hback   80 Hpol P
               Vfront    3 Vsync   5 Vback   54 Vpol N
    DTD:  3840x2160   29.952077 Hz  16:9     65.625 kHz    262.500000 MHz (aspect 16:9, no 3D stereo)
               Hfront   48 Hsync  32 Hback   80 Hpol P
               Vfront    3 Vsync   5 Vback   23 Vpol N
    DTD:  3840x2160   23.970252 Hz  16:9     52.375 kHz    209.500000 MHz (aspect 16:9, no 3D stereo)
               Hfront   48 Hsync  32 Hback   80 Hpol P
               Vfront    3 Vsync   5 Vback   17 Vpol N
  Checksum: 0x3b
Checksum: 0x90

----------------

Warnings:

Block 1, CTA-861 Extension Block:
  IT Video Formats are overscanned by default, but normally this should be underscanned.
  Video Data Block: VIC 118 and the first DTD are not identical. Is this intended?
  Video Capability Data Block: S_PT is equal to S_IT and S_CE, so should be set to 0 instead.
  Colorimetry Data Block: Set the sRGB colorimetry bit to avoid interop issues.
  Display Product Serial Number is set, so the Serial Number in the Base EDID should be 0.
EDID:
  Base EDID: Some timings are out of range of the Monitor Ranges:
    Vertical Freq: 23.970 - 159.977 Hz (Monitor: 48.000 - 160.000 Hz)
    Horizontal Freq: 15.625 - 355.150 kHz (Monitor: 355.000 - 355.000 kHz)

Failures:

Block 1, CTA-861 Extension Block:
  Video Capability Data Block: IT video formats are always underscanned, but bit 7 of Byte 3 of the CTA-861 Extension header is set to overscanned.
EDID:
  Extension Block 3 started with EDID header, ignoring Extension Blocks >= 3.
  DisplayID: Missing DisplayID Display Parameters Data Block.
  DisplayID: DisplayID expects at least one preferred timing.

EDID conformity: FAIL
