edid-decode (hex):

00 ff ff ff ff ff ff 00 4d 67 05 25 00 00 00 00
27 22 01 04 b5 36 1f 78 3b 90 55 a7 55 53 a0 28
13 50 54 25 4b 00 71 40 81 80 81 c0 81 00 95 00
b3 00 d1 c0 a9 c0 02 3a 80 18 71 38 2d 40 58 2c
45 00 55 50 21 00 00 1e 0c df 80 a0 70 38 40 40
30 40 35 00 55 50 21 00 00 1e 00 00 00 fd 02 3c
69 ff ff 5a 01 0a 20 20 20 20 20 20 00 00 00 fc
00 48 32 35 58 37 0a 20 20 20 20 20 20 20 02 04

02 03 20 f1 48 01 03 04 12 13 1f 90 02 23 09 07
07 83 01 00 00 e3 05 e3 00 e6 06 07 01 60 60 43
86 6f 80 a0 70 38 40 40 30 20 35 00 55 50 21 00
00 1e 7d 9f 80 18 71 38 2d 40 58 2c 45 00 55 50
21 00 00 1e 7a ac 80 18 71 38 23 40 30 20 35 00
55 50 21 00 00 1e e6 b9 80 a0 70 38 40 40 08 20
35 00 55 50 21 00 00 1e 00 00 00 00 00 00 00 00
00 00 00 00 00 00 00 00 00 00 00 00 00 00 00 cc

70 12 79 00 00 03 00 28 37 12 01 04 7f 07 9f 00
57 80 2b 00 37 04 2c 00 02 80 04 00 0f 49 01 04
7f 07 9f 00 57 80 2b 00 37 04 2c 00 02 80 04 00
07 00 0a 08 81 00 08 04 00 04 02 00 00 00 00 00
00 00 00 00 00 00 00 00 00 00 00 00 00 00 00 00
00 00 00 00 00 00 00 00 00 00 00 00 00 00 00 00
00 00 00 00 00 00 00 00 00 00 00 00 00 00 00 00
00 00 00 00 00 00 00 00 00 00 00 00 00 00 cb 90

00 ff ff ff ff ff ff 00 4d 67 05 25 00 00 00 00
27 22 01 04 b5 36 1f 78 3b 90 55 a7 55 53 a0 28
13 50 54 25 4b 00 71 40 81 80 81 c0 81 00 95 00
b3 00 d1 c0 a9 c0 02 3a 80 18 71 38 2d 40 58 2c
45 00 55 50 21 00 00 1e 0c df 80 a0 70 38 40 40
30 40 35 00 55 50 21 00 00 1e 00 00 00 fd 02 3c
69 ff ff 5a 01 0a 20 20 20 20 20 20 00 00 00 fc
00 48 32 35 58 37 0a 20 20 20 20 20 20 20 02 04

02 03 20 f1 48 01 03 04 12 13 1f 90 02 23 09 07
07 83 01 00 00 e3 05 e3 00 e6 06 07 01 60 60 43
86 6f 80 a0 70 38 40 40 30 20 35 00 55 50 21 00
00 1e 7d 9f 80 18 71 38 2d 40 58 2c 45 00 55 50
21 00 00 1e 7a ac 80 18 71 38 23 40 30 20 35 00
55 50 21 00 00 1e e6 b9 80 a0 70 38 40 40 08 20
35 00 55 50 21 00 00 1e 00 00 00 00 00 00 00 00
00 00 00 00 00 00 00 00 00 00 00 00 00 00 00 cc

70 12 79 00 00 03 00 28 37 12 01 04 7f 07 9f 00
57 80 2b 00 37 04 2c 00 02 80 04 00 0f 49 01 04
7f 07 9f 00 57 80 2b 00 37 04 2c 00 02 80 04 00
07 00 0a 08 81 00 08 04 00 04 02 00 00 00 00 00
00 00 00 00 00 00 00 00 00 00 00 00 00 00 00 00
00 00 00 00 00 00 00 00 00 00 00 00 00 00 00 00
00 00 00 00 00 00 00 00 00 00 00 00 00 00 00 00
00 00 00 00 00 00 00 00 00 00 00 00 00 00 cb 90

----------------

Block 0, Base EDID:
  EDID Structure Version & Revision: 1.4
  Vendor & Product Identification:
    Manufacturer: SKG
    Model: 9477
    Made in: week 39 of 2024
  Basic Display Parameters & Features:
    Digital display
    Bits per primary color channel: 10
    DisplayPort interface
    Maximum image size: 54 cm x 31 cm
    Gamma: 2.20
    DPMS levels: Off
    Supported color formats: RGB 4:4:4, YCrCb 4:4:4, YCrCb 4:2:2
    First detailed timing includes the native pixel format and preferred refresh rate
    Display supports continuous frequencies
  Color Characteristics:
    Red  : 0.6542, 0.3330
    Green: 0.3242, 0.6250
    Blue : 0.1572, 0.0751
    White: 0.3134, 0.3291
  Established Timings I & II:
    DMT 0x04:   640x480    59.940476 Hz   4:3     31.469 kHz     25.175000 MHz
    DMT 0x06:   640x480    75.000000 Hz   4:3     37.500 kHz     31.500000 MHz
    DMT 0x09:   800x600    60.316541 Hz   4:3     37.879 kHz     40.000000 MHz
    DMT 0x0b:   800x600    75.000000 Hz   4:3     46.875 kHz     49.500000 MHz
    DMT 0x10:  1024x768    60.003840 Hz   4:3     48.363 kHz     65.000000 MHz
    DMT 0x12:  1024x768    75.028582 Hz   4:3     60.023 kHz     78.750000 MHz
    DMT 0x24:  1280x1024   75.024675 Hz   5:4     79.976 kHz    135.000000 MHz
  Standard Timings:
    GTF     :  1152x864    60.000000 Hz   4:3     53.700 kHz     81.624000 MHz
    DMT 0x23:  1280x1024   60.019740 Hz   5:4     63.981 kHz    108.000000 MHz
    DMT 0x55:  1280x720    60.000000 Hz  16:9     45.000 kHz     74.250000 MHz
    DMT 0x1c:  1280x800    59.810326 Hz  16:10    49.702 kHz     83.500000 MHz
    DMT 0x2f:  1440x900    59.887445 Hz  16:10    55.935 kHz    106.500000 MHz
    DMT 0x3a:  1680x1050   59.954250 Hz  16:10    65.290 kHz    146.250000 MHz
    DMT 0x52:  1920x1080   60.000000 Hz  16:9     67.500 kHz    148.500000 MHz
    DMT 0x53:  1600x900    60.000000 Hz  16:9     60.000 kHz    108.000000 MHz (RB)
  Detailed Timing Descriptors:
    DTD 1:  1920x1080   60.000000 Hz  16:9     67.500 kHz    148.500000 MHz (597 mm x 336 mm)
                 Hfront   88 Hsync  44 Hback  148 Hpol P
                 Vfront    4 Vsync   5 Vback   36 Vpol P
    DTD 2:  1920x1080  239.964363 Hz  16:9    274.519 kHz    571.000000 MHz (597 mm x 336 mm)
                 Hfront   48 Hsync  64 Hback   48 Hpol P
                 Vfront    3 Vsync   5 Vback   56 Vpol P
    Display Range Limits:
      Monitor ranges (Range Limits Only): 60-360 Hz V, 255-255 kHz H, max dotclock 900 MHz
    Display Product Name: 'H25X7'
  Extension blocks: 2
Checksum: 0x04

----------------

Block 1, CTA-861 Extension Block:
  Revision: 3
  Underscans IT Video Formats by default
  Basic audio support
  Supports YCbCr 4:4:4
  Supports YCbCr 4:2:2
  Native DTDs: 1
  Video Data Block:
    VIC   1:   640x480    59.940476 Hz   4:3     31.469 kHz     25.175000 MHz
    VIC   3:   720x480    59.940060 Hz  16:9     31.469 kHz     27.000000 MHz
    VIC   4:  1280x720    60.000000 Hz  16:9     45.000 kHz     74.250000 MHz
    VIC  18:   720x576    50.000000 Hz  16:9     31.250 kHz     27.000000 MHz
    VIC  19:  1280x720    50.000000 Hz  16:9     37.500 kHz     74.250000 MHz
    VIC  31:  1920x1080   50.000000 Hz  16:9     56.250 kHz    148.500000 MHz
    VIC  16:  1920x1080   60.000000 Hz  16:9     67.500 kHz    148.500000 MHz (native)
    VIC   2:   720x480    59.940060 Hz   4:3     31.469 kHz     27.000000 MHz
  Audio Data Block:
    Linear PCM:
      Max channels: 2
      Supported sample rates (kHz): 48 44.1 32
      Supported sample sizes (bits): 24 20 16
  Speaker Allocation Data Block:
    FL/FR - Front Left/Right
  Colorimetry Data Block:
    xvYCC601
    xvYCC709
    BT2020cYCC
    BT2020YCC
    BT2020RGB
  HDR Static Metadata Data Block:
    Electro optical transfer functions:
      Traditional gamma - SDR luminance range
      Traditional gamma - HDR luminance range
      SMPTE ST2084
    Supported static metadata descriptors:
      Static metadata type 1
    Desired content max luminance: 96 (400.000 cd/m^2)
    Desired content max frame-average luminance: 96 (400.000 cd/m^2)
    Desired content min luminance: 67 (0.276 cd/m^2)
  Detailed Timing Descriptors:
    DTD 3:  1920x1080  119.982181 Hz  16:9    137.260 kHz    285.500000 MHz (597 mm x 336 mm)
                 Hfront   48 Hsync  32 Hback   80 Hpol P
                 Vfront    3 Vsync   5 Vback   56 Vpol P
    DTD 4:  1920x1080  164.965657 Hz  16:9    185.586 kHz    408.290000 MHz (597 mm x 336 mm)
                 Hfront   88 Hsync  44 Hback  148 Hpol P
                 Vfront    4 Vsync   5 Vback   36 Vpol P
    DTD 5:  1920x1080  180.000000 Hz  16:9    200.700 kHz    441.540000 MHz (597 mm x 336 mm)
                 Hfront   48 Hsync  32 Hback  200 Hpol P
                 Vfront    3 Vsync   5 Vback   27 Vpol P
    DTD 6:  1920x1080  199.998319 Hz  16:9    228.798 kHz    475.900000 MHz (597 mm x 336 mm)
                 Hfront    8 Hsync  32 Hback  120 Hpol P
                 Vfront    3 Vsync   5 Vback   56 Vpol P
Checksum: 0xcc  Unused space in Extension Block: 23 bytes

----------------

Block 2, DisplayID Extension Block:
  Version: 1.2
  Extension Count: 0
  Display Product Type: Extension Section
  Video Timing Modes Type 1 - Detailed Timings Data Block:
    DTD:  1920x1080  300.000000 Hz  16:9    337.500 kHz    702.000000 MHz (aspect 16:9, no 3D stereo)
               Hfront   88 Hsync  44 Hback   28 Hpol P
               Vfront    3 Vsync   5 Vback   37 Vpol P
    DTD:  1920x1080  360.000000 Hz  16:9    405.000 kHz    842.400000 MHz (aspect 16:9, no 3D stereo)
               Hfront   88 Hsync  44 Hback   28 Hpol P
               Vfront    3 Vsync   5 Vback   37 Vpol P
  Supported Timing Modes Type 1 - VESA DMT Timings Data Block:
    DMT 0x04:   640x480    59.940476 Hz   4:3     31.469 kHz     25.175000 MHz
    DMT 0x09:   800x600    60.316541 Hz   4:3     37.879 kHz     40.000000 MHz
    DMT 0x10:  1024x768    60.003840 Hz   4:3     48.363 kHz     65.000000 MHz
    DMT 0x1c:  1280x800    59.810326 Hz  16:10    49.702 kHz     83.500000 MHz
    DMT 0x23:  1280x1024   60.019740 Hz   5:4     63.981 kHz    108.000000 MHz
    DMT 0x33:  1600x1200   60.000000 Hz   4:3     75.000 kHz    162.000000 MHz
    DMT 0x3a:  1680x1050   59.954250 Hz  16:10    65.290 kHz    146.250000 MHz
  Checksum: 0xcb
Checksum: 0x90

----------------

Warnings:

Block 1, CTA-861 Extension Block:
  Video Data Block: VIC 1 and the first DTD are not identical. Is this intended?
  Colorimetry Data Block: Set the sRGB colorimetry bit to avoid interop issues.
EDID:
  Base EDID: Some timings are out of range of the Monitor Ranges:
    Vertical Freq: 50.000 - 360.000 Hz (Monitor: 60.000 - 360.000 Hz)
    Horizontal Freq: 31.250 - 405.000 kHz (Monitor: 255.000 - 255.000 kHz)

Failures:

Block 0, Base EDID:
  Detailed Timing Descriptor #1: Mismatch of image size 597x336 mm vs display size 540x310 mm.
  Detailed Timing Descriptor #2: Mismatch of image size 597x336 mm vs display size 540x310 mm.
Block 1, CTA-861 Extension Block:
  Detailed Timing Descriptor #3: Mismatch of image size 597x336 mm vs display size 540x310 mm.
  Detailed Timing Descriptor #4: Mismatch of image size 597x336 mm vs display size 540x310 mm.
  Detailed Timing Descriptor #5: Mismatch of image size 597x336 mm vs display size 540x310 mm.
  Detailed Timing Descriptor #6: Mismatch of image size 597x336 mm vs display size 540x310 mm.
  Missing VCDB, needed for Set Selectable RGB Quantization to avoid interop issues.
Block 2, DisplayID Extension Block:
  DisplayID Base Block has no product type.
EDID:
  Extension Block 3 started with EDID header, ignoring Extension Blocks >= 3.
  Base EDID: The DTD max image size is 597x336mm, which is larger than the display size 540.0x310.0mm.
  DisplayID: DisplayID expects at least one preferred timing.

EDID conformity: FAIL
