edid-decode (hex):

00 ff ff ff ff ff ff 00 4c a3 43 54 00 00 00 00
00 14 01 03 90 25 17 78 0a 87 f5 94 57 4f 8c 27
27 50 54 00 00 00 01 01 01 01 01 01 01 01 01 01
01 01 01 01 01 01 50 40 80 1c 71 b0 2d 40 30 20
36 00 6f e6 10 00 00 1a 50 40 80 1c 71 b0 2d 40
30 20 36 00 6f e6 10 00 00 1a 00 00 00 fe 00 52
4d 32 32 33 82 31 37 30 43 54 0a 20 00 00 00 00
00 00 00 00 00 00 00 00 00 06 01 0a 20 20 00 f8

00 ff ff ff ff ff ff 00 4c a3 43 54 00 00 00 00
00 14 01 03 90 25 17 78 0a 87 f5 94 57 4f 8c 27
27 50 54 00 00 00 01 01 01 01 01 01 01 01 01 01
01 01 01 01 01 01 50 40 80 1c 71 b0 2d 40 30 20
36 00 6f e6 10 00 00 1a 50 40 80 1c 71 b0 2d 40
30 20 36 00 6f e6 10 00 00 1a 00 00 00 fe 00 52
4d 32 32 33 82 31 37 30 43 54 0a 20 00 00 00 00
00 00 00 00 00 00 00 00 00 06 01 0a 20 20 00 f8

----------------

Block 0, Base EDID:
  EDID Structure Version & Revision: 1.3
  Vendor & Product Identification:
    Manufacturer: SEC
    Model: 21571
    Made in: 2010
  Basic Display Parameters & Features:
    Digital display
    Maximum image size: 37 cm x 23 cm
    Gamma: 2.20
    RGB color display
    First detailed timing is the preferred timing
  Color Characteristics:
    Red  : 0.5800, 0.3398
    Green: 0.3095, 0.5498
    Blue : 0.1552, 0.1552
    White: 0.3134, 0.3291
  Established Timings I & II: none
  Standard Timings: none
  Detailed Timing Descriptors:
    DTD 1:  1920x1200   60.000437 Hz  16:10    74.701 kHz    164.640000 MHz (367 mm x 230 mm)
                 Hfront   48 Hsync  32 Hback  204 Hpol P
                 Vfront    3 Vsync   6 Vback   36 Vpol N
    DTD 2:  1920x1200   60.000437 Hz  16:10    74.701 kHz    164.640000 MHz (367 mm x 230 mm)
                 Hfront   48 Hsync  32 Hback  204 Hpol P
                 Vfront    3 Vsync   6 Vback   36 Vpol N
    Alphanumeric Data String: 'RM223.170CT'
    Manufacturer-Specified Display Descriptor (0x00): 00 00 00 00 00 00 00 00 00 00 00 06 01 0a 20 20 '..............  '
Checksum: 0xf8

----------------

Block 1, Unknown EDID Extension Block 0x00:
  00 ff ff ff ff ff ff 00 4c a3 43 54 00 00 00 00 '........L.CT....'
  00 14 01 03 90 25 17 78 0a 87 f5 94 57 4f 8c 27 '.....%.x....WO.''
  27 50 54 00 00 00 01 01 01 01 01 01 01 01 01 01 ''PT.............'
  01 01 01 01 01 01 50 40 80 1c 71 b0 2d 40 30 20 '......P@..q.-@0 '
  36 00 6f e6 10 00 00 1a 50 40 80 1c 71 b0 2d 40 '6.o.....P@..q.-@'
  30 20 36 00 6f e6 10 00 00 1a 00 00 00 fe 00 52 '0 6.o..........R'
  4d 32 32 33 82 31 37 30 43 54 0a 20 00 00 00 00 'M223.170CT. ....'
  00 00 00 00 00 00 00 00 00 06 01 0a 20 20 00 f8 '............  ..'
Checksum: 0xf8

----------------

Warnings:

Block 0, Base EDID:
  Alphanumeric Data String: Non-ASCII character 0x82 at position 5, can cause problems.

Failures:

Block 0, Base EDID:
  Basic Display Parameters & Features: Digital Video Interface Standard set to reserved value 0x10.
  Missing Display Product Name.
  Missing Display Range Limits Descriptor.
Block 1, Base EDID:
  Unknown Extension Block.
EDID:
  Base EDID: EDID specified 0 extension block(s), but found 1 extension block(s).

EDID conformity: FAIL
