edid-decode (hex):

00 ff ff ff ff ff ff 00 06 af 8d b7 00 00 00 00
26 1d 01 04 a5 22 13 78 03 3e 85 91 56 59 91 28
1f 50 54 00 00 00 01 01 01 01 01 01 01 01 01 01
01 01 01 01 01 01 b6 85 80 a0 70 38 3e 40 6c 30
35 00 58 c1 10 00 00 18 dc 37 80 a0 70 38 3e 40
6c 30 35 00 58 c1 10 00 00 18 00 00 00 fd 00 3c
90 a5 a5 22 01 0a 20 20 20 20 20 20 00 00 00 fe
00 42 31 35 36 48 41 4e 30 39 2e 32 20 0a 00 3d

00 ff ff ff ff ff ff 00 06 af 8d b7 00 00 00 00
26 1d 01 04 a5 22 13 78 03 3e 85 91 56 59 91 28
1f 50 54 00 00 00 01 01 01 01 01 01 01 01 01 01
01 01 01 01 01 01 b6 85 80 a0 70 38 3e 40 6c 30
35 00 58 c1 10 00 00 18 dc 37 80 a0 70 38 3e 40
6c 30 35 00 58 c1 10 00 00 18 00 00 00 fd 00 3c
90 a5 a5 22 01 0a 20 20 20 20 20 20 00 00 00 fe
00 42 31 35 36 48 41 4e 30 39 2e 32 20 0a 00 3d

----------------

Block 0, Base EDID:
  EDID Structure Version & Revision: 1.4
  Vendor & Product Identification:
    Manufacturer: AUO
    Model: 46989
    Made in: week 38 of 2019
  Basic Display Parameters & Features:
    Digital display
    Bits per primary color channel: 8
    DisplayPort interface
    Maximum image size: 34 cm x 19 cm
    Gamma: 2.20
    Supported color formats: RGB 4:4:4
    First detailed timing includes the native pixel format and preferred refresh rate
    Display supports continuous frequencies
  Color Characteristics:
    Red  : 0.5664, 0.3388
    Green: 0.3505, 0.5683
    Blue : 0.1582, 0.1210
    White: 0.3134, 0.3291
  Established Timings I & II: none
  Standard Timings: none
  Detailed Timing Descriptors:
    DTD 1:  1920x1080  144.104473 Hz  16:9    164.567 kHz    342.300000 MHz (344 mm x 193 mm)
                 Hfront  108 Hsync  48 Hback    4 Hpol N
                 Vfront    3 Vsync   5 Vback   54 Vpol N
    DTD 2:  1920x1080   60.201401 Hz  16:9     68.750 kHz    143.000000 MHz (344 mm x 193 mm)
                 Hfront  108 Hsync  48 Hback    4 Hpol N
                 Vfront    3 Vsync   5 Vback   54 Vpol N
    Display Range Limits:
      Monitor ranges (Range Limits Only): 60-144 Hz V, 165-165 kHz H, max dotclock 340 MHz
    Alphanumeric Data String: 'B156HAN09.2 '
Checksum: 0x3d

----------------

Block 1, Unknown EDID Extension Block 0x00:
  00 ff ff ff ff ff ff 00 06 af 8d b7 00 00 00 00 '................'
  26 1d 01 04 a5 22 13 78 03 3e 85 91 56 59 91 28 '&....".x.>..VY.('
  1f 50 54 00 00 00 01 01 01 01 01 01 01 01 01 01 '.PT.............'
  01 01 01 01 01 01 b6 85 80 a0 70 38 3e 40 6c 30 '..........p8>@l0'
  35 00 58 c1 10 00 00 18 dc 37 80 a0 70 38 3e 40 '5.X......7..p8>@'
  6c 30 35 00 58 c1 10 00 00 18 00 00 00 fd 00 3c 'l05.X..........<'
  90 a5 a5 22 01 0a 20 20 20 20 20 20 00 00 00 fe '..."..      ....'
  00 42 31 35 36 48 41 4e 30 39 2e 32 20 0a 00 3d '.B156HAN09.2 ..='
Checksum: 0x3d

----------------

Warnings:

Block 0, Base EDID:
  Missing Display Product Name.
EDID:
  Base EDID: Some timings are out of range of the Monitor Ranges:
    Horizontal Freq: 68.750 - 164.567 kHz (Monitor: 165.000 - 165.000 kHz)
    Maximum Clock: 342.300 MHz (Monitor: 340.000 MHz)

Failures:

Block 0, Base EDID:
  Alphanumeric Data String: One or more trailing spaces before newline.
Block 1, Base EDID:
  Unknown Extension Block.
EDID:
  Base EDID: EDID specified 0 extension block(s), but found 1 extension block(s).

EDID conformity: FAIL
