edid-decode (hex):

00 ff ff ff ff ff ff 00 30 e4 cf 02 00 00 00 00
00 14 01 04 90 22 13 78 0a c1 25 9d 5f 5b 9b 27
19 50 54 00 00 00 01 01 01 01 01 01 01 01 01 01
01 01 01 01 01 01 3e 1c 56 a0 50 00 16 30 30 20
35 00 58 c2 10 00 00 1a c0 12 56 a0 50 00 16 30
30 20 35 00 58 c2 10 00 00 1a 00 00 00 fe 00 43
46 39 46 58 80 31 35 36 57 48 32 0a 00 00 00 00
00 00 41 31 96 01 00 00 00 01 01 0a 20 20 00 75

----------------

Block 0, Base EDID:
  EDID Structure Version & Revision: 1.4
  Vendor & Product Identification:
    Manufacturer: LGD
    Model: 719
    Made in: 2010
  Basic Display Parameters & Features:
    Digital display
    Bits per primary color channel: 6
    Digital interface is not defined
    Maximum image size: 34 cm x 19 cm
    Gamma: 2.20
    Supported color formats: RGB 4:4:4, YCrCb 4:4:4
    First detailed timing includes the native pixel format and preferred refresh rate
  Color Characteristics:
    Red  : 0.6162, 0.3710
    Green: 0.3554, 0.6064
    Blue : 0.1523, 0.0996
    White: 0.3134, 0.3291
  Established Timings I & II: none
  Standard Timings: none
  Detailed Timing Descriptors:
    DTD 1:  1366x768    59.973124 Hz 683:384   47.379 kHz     72.300000 MHz (344 mm x 194 mm)
                 Hfront   48 Hsync  32 Hback   80 Hpol P
                 Vfront    3 Vsync   5 Vback   14 Vpol N
    DTD 2:  1366x768    39.816182 Hz 683:384   31.455 kHz     48.000000 MHz (344 mm x 194 mm)
                 Hfront   48 Hsync  32 Hback   80 Hpol P
                 Vfront    3 Vsync   5 Vback   14 Vpol N
    Alphanumeric Data String: 'CF9FX.156WH2'
    Manufacturer-Specified Display Descriptor (0x00): 00 00 00 00 41 31 96 01 00 00 00 01 01 0a 20 20 '....A1........  '
Checksum: 0x75

----------------

Warnings:

Block 0, Base EDID:
  Alphanumeric Data String: Non-ASCII character 0x80 at position 5, can cause problems.
  Missing Display Product Name.

EDID conformity: PASS
