edid-decode (hex):

00 ff ff ff ff ff ff 00 30 ae ad 40 00 00 00 00
00 1e 01 04 a5 1f 11 78 e2 ee 95 a3 54 4c 99 26
0f 50 54 00 00 00 01 01 01 01 01 01 01 01 01 01
01 01 01 01 01 01 9a 36 80 a0 70 38 28 40 30 20
35 00 35 ad 10 00 00 1a 9a 36 80 a0 70 38 28 40
30 20 35 00 35 ad 10 00 00 1a 00 00 00 0f 00 d1
09 3c d1 09 3c 32 8a 00 0e 8f 7b 37 00 00 00 fe
00 4c 45 42 31 34 32 30 33 4e 2d 57 4a 0a 00 48

00 ff ff ff ff ff ff 00 30 ae ad 40 00 00 00 00
00 1e 01 04 a5 1f 11 78 e2 ee 95 a3 54 4c 99 26
0f 50 54 00 00 00 01 01 01 01 01 01 01 01 01 01
01 01 01 01 01 01 9a 36 80 a0 70 38 28 40 30 20
35 00 35 ad 10 00 00 1a 9a 36 80 a0 70 38 28 40
30 20 35 00 35 ad 10 00 00 1a 00 00 00 0f 00 d1
09 3c d1 09 3c 32 8a 00 0e 8f 7b 37 00 00 00 fe
00 4c 45 42 31 34 32 30 33 4e 2d 57 4a 0a 00 48

----------------

Block 0, Base EDID:
  EDID Structure Version & Revision: 1.4
  Vendor & Product Identification:
    Manufacturer: LEN
    Model: 16557
    Made in: 2020
  Basic Display Parameters & Features:
    Digital display
    Bits per primary color channel: 8
    DisplayPort interface
    Maximum image size: 31 cm x 17 cm
    Gamma: 2.20
    DPMS levels: Standby Suspend Off
    Supported color formats: RGB 4:4:4
    First detailed timing includes the native pixel format and preferred refresh rate
  Color Characteristics:
    Red  : 0.6396, 0.3300
    Green: 0.2998, 0.5996
    Blue : 0.1503, 0.0595
    White: 0.3134, 0.3291
  Established Timings I & II: none
  Standard Timings: none
  Detailed Timing Descriptors:
    DTD 1:  1920x1080   60.001717 Hz  16:9     67.202 kHz    139.780000 MHz (309 mm x 173 mm)
                 Hfront   48 Hsync  32 Hback   80 Hpol P
                 Vfront    3 Vsync   5 Vback   32 Vpol N
    DTD 2:  1920x1080   60.001717 Hz  16:9     67.202 kHz    139.780000 MHz (309 mm x 173 mm)
                 Hfront   48 Hsync  32 Hback   80 Hpol P
                 Vfront    3 Vsync   5 Vback   32 Vpol N
    Manufacturer-Specified Display Descriptor (0x0f): 00 0f 00 d1 09 3c d1 09 3c 32 8a 00 0e 8f 7b 37 '.....<..<2....{7'
    Alphanumeric Data String: 'LEB14203N-WJ'
Checksum: 0x48

----------------

Warnings:

Block 0, Base EDID:
  Missing Display Product Name.

Failures:

EDID:
  Extension Block 1 started with EDID header, ignoring Extension Blocks >= 1.

EDID conformity: FAIL
