edid-decode (hex):

00 ff ff ff ff ff ff 00 54 e4 02 11 10 09 21 20
25 1d 01 03 80 1a 0f 78 ee 2d 8f a6 56 53 9b 25
0c 4f 53 21 08 00 71 c0 81 80 81 c0 8b c0 95 00
01 01 b3 00 01 01 74 3c 80 a0 70 38 a0 40 30 20
36 00 55 c0 10 00 00 1e 00 00 00 fc 00 41 72 74
69 73 74 20 31 32 20 70 72 6f 00 00 00 10 00 34
47 43 48 30 30 30 30 36 33 0a 20 20 00 00 00 fd
00 32 49 1f 46 11 00 0a 20 20 20 20 20 20 01 96

02 03 2e 81 00 00 05 04 03 02 07 16 01 1f 12 13
14 20 15 11 06 00 00 00 00 67 03 0c 00 10 00 38
2d e3 05 03 01 42 10 04 65 03 0c 00 10 00 01 1d
00 72 51 d0 1e 20 6e 28 55 00 06 44 21 00 00 1e
8c 0a d0 8a 20 e0 2d 10 10 3e 96 00 06 44 21 00
00 18 00 00 00 00 00 00 00 00 00 00 00 00 00 00
00 00 00 00 00 00 00 00 00 00 00 00 00 00 00 00
00 00 00 00 00 00 00 00 00 00 00 00 00 00 00 d4

00 ff ff ff ff ff ff 00 54 e4 02 11 10 09 21 20
25 1d 01 03 80 1a 0f 78 ee 2d 8f a6 56 53 9b 25
0c 4f 53 21 08 00 71 c0 81 80 81 c0 8b c0 95 00
01 01 b3 00 01 01 74 3c 80 a0 70 38 a0 40 30 20
36 00 55 c0 10 00 00 1e 00 00 00 fc 00 41 72 74
69 73 74 20 31 32 20 70 72 6f 00 00 00 10 00 34
47 43 48 30 30 30 30 36 33 0a 20 20 00 00 00 fd
00 32 49 1f 46 11 00 0a 20 20 20 20 20 20 01 96

02 03 2e 81 00 00 05 04 03 02 07 16 01 1f 12 13
14 20 15 11 06 00 00 00 00 67 03 0c 00 10 00 38
2d e3 05 03 01 42 10 04 65 03 0c 00 10 00 01 1d
00 72 51 d0 1e 20 6e 28 55 00 06 44 21 00 00 1e
8c 0a d0 8a 20 e0 2d 10 10 3e 96 00 06 44 21 00
00 18 00 00 00 00 00 00 00 00 00 00 00 00 00 00
00 00 00 00 00 00 00 00 00 00 00 00 00 00 00 00
00 00 00 00 00 00 00 00 00 00 00 00 00 00 00 d4

----------------

Block 0, Base EDID:
  EDID Structure Version & Revision: 1.3
  Vendor & Product Identification:
    Manufacturer: UGD
    Model: 4354
    Serial Number: ...
    Made in: week 37 of 2019
  Basic Display Parameters & Features:
    Digital display
    Maximum image size: 26 cm x 15 cm
    Gamma: 2.20
    DPMS levels: Standby Suspend Off
    RGB color display
    Default (sRGB) color space is primary color space
    First detailed timing is the preferred timing
  Color Characteristics:
    Red  : 0.6484, 0.3378
    Green: 0.3271, 0.6064
    Blue : 0.1464, 0.0468
    White: 0.3115, 0.3271
  Established Timings I & II:
    DMT 0x04:   640x480    59.940476 Hz   4:3     31.469 kHz     25.175000 MHz
    DMT 0x09:   800x600    60.316541 Hz   4:3     37.879 kHz     40.000000 MHz
    DMT 0x10:  1024x768    60.003840 Hz   4:3     48.363 kHz     65.000000 MHz
  Standard Timings:
    GTF     :  1152x648    60.000120 Hz  16:9     40.260 kHz     59.907000 MHz
    DMT 0x23:  1280x1024   60.019740 Hz   5:4     63.981 kHz    108.000000 MHz
    DMT 0x55:  1280x720    60.000000 Hz  16:9     45.000 kHz     74.250000 MHz
    GTF     :  1360x765    60.000341 Hz  16:9     47.520 kHz     84.396000 MHz
    DMT 0x2f:  1440x900    59.887445 Hz  16:10    55.935 kHz    106.500000 MHz
    DMT 0x3a:  1680x1050   59.954250 Hz  16:10    65.290 kHz    146.250000 MHz
  Detailed Timing Descriptors:
    DTD 1:  1920x1080   60.003102 Hz  16:9     74.404 kHz    154.760000 MHz (341 mm x 192 mm)
                 Hfront   48 Hsync  32 Hback   80 Hpol P
                 Vfront    3 Vsync   6 Vback  151 Vpol P
    Display Product Name: 'Artist 12 pro'
    Dummy Descriptor:
    Display Range Limits:
      Monitor ranges (GTF): 50-73 Hz V, 31-70 kHz H, max dotclock 170 MHz
  Extension blocks: 1
Checksum: 0x96

----------------

Block 1, CTA-861 Extension Block:
  Revision: 3
  Underscans IT Video Formats by default
  Native DTDs: 1
  Unknown CTA-861 Data Block (tag 0x00, length 0):
  Unknown CTA-861 Data Block (tag 0x00, length 0):
  Unknown CTA-861 Data Block (tag 0x00, length 5):
    04 03 02 07 16                                  '.....'
  Unknown CTA-861 Data Block (tag 0x00, length 1):
    1f                                              '.'
  Unknown CTA-861 Data Block (tag 0x00, length 18):
    13 14 20 15 11 06 00 00 00 00 67 03 0c 00 10 00 '.. .......g.....'
    38 2d                                           '8-'
  Colorimetry Data Block:
    xvYCC601
    xvYCC709
    Gamut Boundary Description Metadata Profile P0
  Video Data Block:
    VIC  16:  1920x1080   60.000000 Hz  16:9     67.500 kHz    148.500000 MHz
    VIC   4:  1280x720    60.000000 Hz  16:9     45.000 kHz     74.250000 MHz
  Vendor-Specific Data Block (HDMI), OUI 00-0C-03:
    Source physical address: 1.0.0.0
  Detailed Timing Descriptors:
    DTD 2:  1280x720    60.000000 Hz  16:9     45.000 kHz     74.250000 MHz (518 mm x 324 mm)
                 Hfront  110 Hsync  40 Hback  220 Hpol P
                 Vfront    5 Vsync   5 Vback   20 Vpol P
    DTD 3:   720x480    59.940060 Hz   3:2     31.469 kHz     27.000000 MHz (518 mm x 324 mm)
                 Hfront   16 Hsync  62 Hback   60 Hpol N
                 Vfront    9 Vsync   6 Vback   30 Vpol N
Checksum: 0xd4  Unused space in Extension Block: 45 bytes

----------------

Warnings:

Block 0, Base EDID:
  Standard Timings: Standard Timing 1360x765 has a dubious odd vertical resolution.
Block 1, CTA-861 Extension Block:
  Unknown CTA-861 Data Block (tag 0x00, length 0).
  Unknown CTA-861 Data Block (tag 0x00, length 0).
  Unknown CTA-861 Data Block (tag 0x00, length 5).
  Unknown CTA-861 Data Block (tag 0x00, length 1).
  Unknown CTA-861 Data Block (tag 0x00, length 18).
  Video Data Block: VIC 16 and the first DTD are not identical. Is this intended?
  Detailed Timing Descriptor #2: Image size is 518x324 mm, but based on the picture AR it should be 518x291 mm.
  Detailed Timing Descriptor #3: Image size is 518x324 mm, but based on the picture AR it should be 486x324 mm.
EDID:
  Base EDID: Some timings are out of range of the Monitor Ranges:
    Horizontal Freq: 31.468 - 74.403 kHz (Monitor: 31.000 - 70.000 kHz)

Failures:

Block 0, Base EDID:
  Basic Display Parameters & Features: sRGB is signaled, but the chromaticities do not match.
  Detailed Timing Descriptor #1: Mismatch of image size 341x192 mm vs display size 260x150 mm.
  Dummy Descriptor: Dummy block filled with garbage.
Block 1, CTA-861 Extension Block:
  Detailed Timing Descriptor #2: Mismatch of image size 518x324 mm vs display size 260x150 mm.
  Detailed Timing Descriptor #3: Mismatch of image size 518x324 mm vs display size 260x150 mm.
  Missing VCDB, needed for Set Selectable RGB Quantization to avoid interop issues.
EDID:
  Extension Block 2 started with EDID header, ignoring Extension Blocks >= 2.
  Base EDID: The DTD max image size is 518x324mm, which is larger than the display size 260.0x150.0mm.

EDID conformity: FAIL
