edid-decode (hex):

00 ff ff ff ff ff ff 00 09 e5 0f 0a 00 00 00 00
1c 1e 01 04 a5 22 15 78 03 b2 d5 ae 50 44 b1 26
0e 50 54 00 00 00 01 01 01 01 01 01 01 01 01 01
01 01 01 01 01 01 62 6b 00 c8 a0 40 3c 60 30 20
36 00 58 d7 10 00 00 18 00 00 00 fd 00 28 3c 64
64 1b 01 0a 20 20 20 20 20 20 00 00 00 fe 00 42
4f 45 20 43 51 0a 20 20 20 20 20 20 00 00 00 fe
00 4e 45 31 36 30 51 44 4d 2d 4e 36 31 0a 00 c2

00 ff ff ff ff ff ff 00 09 e5 0f 0a 00 00 00 00
1c 1e 01 04 a5 22 15 78 03 b2 d5 ae 50 44 b1 26
0e 50 54 00 00 00 01 01 01 01 01 01 01 01 01 01
01 01 01 01 01 01 62 6b 00 c8 a0 40 3c 60 30 20
36 00 58 d7 10 00 00 18 00 00 00 fd 00 28 3c 64
64 1b 01 0a 20 20 20 20 20 20 00 00 00 fe 00 42
4f 45 20 43 51 0a 20 20 20 20 20 20 00 00 00 fe
00 4e 45 31 36 30 51 44 4d 2d 4e 36 31 0a 00 c2

----------------

Block 0, Base EDID:
  EDID Structure Version & Revision: 1.4
  Vendor & Product Identification:
    Manufacturer: BOE
    Model: 2575
    Made in: week 28 of 2020
  Basic Display Parameters & Features:
    Digital display
    Bits per primary color channel: 8
    DisplayPort interface
    Maximum image size: 34 cm x 21 cm
    Gamma: 2.20
    Supported color formats: RGB 4:4:4
    First detailed timing includes the native pixel format and preferred refresh rate
    Display supports continuous frequencies
  Color Characteristics:
    Red  : 0.6816, 0.3154
    Green: 0.2656, 0.6933
    Blue : 0.1513, 0.0556
    White: 0.3134, 0.3291
  Established Timings I & II: none
  Standard Timings: none
  Detailed Timing Descriptors:
    DTD 1:  2560x1600   60.000873 Hz  16:10    99.601 kHz    274.900000 MHz (344 mm x 215 mm)
                 Hfront   48 Hsync  32 Hback  120 Hpol N
                 Vfront    3 Vsync   6 Vback   51 Vpol N
    Display Range Limits:
      Monitor ranges (Range Limits Only): 40-60 Hz V, 100-100 kHz H, max dotclock 270 MHz
    Alphanumeric Data String: 'BOE CQ'
    Alphanumeric Data String: 'NE160QDM-N61'
Checksum: 0xc2

----------------

Warnings:

Block 0, Base EDID:
  Missing Display Product Name.
EDID:
  Base EDID: Some timings are out of range of the Monitor Ranges:
    Maximum Clock: 274.900 MHz (Monitor: 270.000 MHz)
    Could be due to a Monitor Range off-by-one rounding issue

Failures:

EDID:
  Extension Block 1 started with EDID header, ignoring Extension Blocks >= 1.

EDID conformity: FAIL
