edid-decode (hex):

00 ff ff ff ff ff ff 00 1e 6d 3b 77 2c c0 04 00
0a 1d 01 04 b5 50 22 78 9f ca 95 a6 55 4e a1 26
0f 50 54 25 6b 80 d1 cf d1 e8 d1 fc a9 fc 81 bc
81 fc 61 7c 71 7c e4 ac 00 a0 a0 38 32 40 30 20
ca 00 1e 4e 31 00 00 1a 64 4b 00 f0 a0 38 46 40
30 20 aa 00 1e 4e 31 00 00 1a 00 00 00 fd 00 32
90 a4 a4 2d 01 0a 20 20 20 20 20 20 00 00 00 fc
00 33 34 47 4c 37 35 30 0a 20 20 20 20 20 01 b9

02 03 23 71 23 09 07 07 4b 01 02 04 10 29 2f 3f
40 5a 5b 5c 83 01 00 00 e3 05 c0 00 e6 06 05 01
53 49 51 ec 5e 00 f0 a0 38 4e 40 30 20 aa 00 1e
4e 31 00 00 1a 50 78 00 a0 a0 38 35 40 30 20 ca
00 1e 4e 31 00 00 1a 13 90 00 a0 a0 38 32 40 30
20 ca 00 1e 4e 31 00 00 1a 02 3a 80 18 71 38 2d
40 58 2c aa 00 13 2a 21 00 00 1e 00 00 00 00 00
00 00 00 00 00 00 00 00 00 00 00 00 00 00 00 0f

00 ff ff ff ff ff ff 00 59 96 a8 91 6a ff 17 dc
ff 1c 01 03 80 00 00 78 0a 48 97 a1 5b 54 a0 26
13 4a 50 00 00 00 01 01 01 01 01 01 01 01 01 01
01 01 01 01 01 01 00 00 00 10 00 00 00 00 00 00
00 00 00 00 00 00 00 00 00 00 00 fc 00 49 6e 64
65 78 20 48 4d 44 0a 20 20 20 00 00 00 10 00 00
00 00 00 00 00 00 00 00 00 00 00 00 00 00 00 10
00 00 00 00 00 00 00 00 00 00 00 00 00 00 01 27

70 12 5a 00 00 03 01 50 f7 0b 01 80 3f 0b 4f 00
07 00 1f 00 3f 06 ce 03 c4 03 05 00 f7 0b 01 00
3f 0b 4f 00 07 00 1f 00 3f 06 10 05 06 05 05 00
f7 0b 01 00 3f 0b 4f 00 07 00 1f 00 3f 06 4a 01
40 01 05 00 65 0c 01 00 3f 0b 4f 00 07 00 1f 00
3f 06 0b 00 02 00 05 00 81 03 04 23 09 04 01 17
00 00 00 00 00 00 00 00 00 00 00 00 00 00 00 00
00 00 00 00 00 00 00 00 00 00 00 00 00 00 00 90

----------------

Block 0, Base EDID:
  EDID Structure Version & Revision: 1.4
  Vendor & Product Identification:
    Manufacturer: GSM
    Model: 30523
    Serial Number: ...
    Made in: week 10 of 2019
  Basic Display Parameters & Features:
    Digital display
    Bits per primary color channel: 10
    DisplayPort interface
    Maximum image size: 80 cm x 34 cm
    Gamma: 2.20
    DPMS levels: Standby
    Supported color formats: RGB 4:4:4, YCrCb 4:4:4, YCrCb 4:2:2
    Default (sRGB) color space is primary color space
    First detailed timing includes the native pixel format and preferred refresh rate
    Display supports continuous frequencies
  Color Characteristics:
    Red  : 0.6513, 0.3320
    Green: 0.3066, 0.6308
    Blue : 0.1503, 0.0595
    White: 0.3134, 0.3291
  Established Timings I & II:
    DMT 0x04:   640x480    59.940476 Hz   4:3     31.469 kHz     25.175000 MHz
    DMT 0x06:   640x480    75.000000 Hz   4:3     37.500 kHz     31.500000 MHz
    DMT 0x09:   800x600    60.316541 Hz   4:3     37.879 kHz     40.000000 MHz
    DMT 0x0b:   800x600    75.000000 Hz   4:3     46.875 kHz     49.500000 MHz
    Apple   :   832x624    74.551266 Hz   4:3     49.726 kHz     57.284000 MHz
    DMT 0x10:  1024x768    60.003840 Hz   4:3     48.363 kHz     65.000000 MHz
    DMT 0x12:  1024x768    75.028582 Hz   4:3     60.023 kHz     78.750000 MHz
    DMT 0x24:  1280x1024   75.024675 Hz   5:4     79.976 kHz    135.000000 MHz
    Apple   :  1152x870    75.061550 Hz 192:145   68.681 kHz    100.000000 MHz
  Standard Timings:
    GTF     :  1920x1080   75.000068 Hz  16:9     84.600 kHz    220.637000 MHz
    GTF     :  1920x1080  100.000000 Hz  16:9    114.400 kHz    302.016000 MHz
    GTF     :  1920x1080  119.999987 Hz  16:9    138.840 kHz    368.759000 MHz
    GTF     :  1600x900   119.999812 Hz  16:9    115.800 kHz    255.686000 MHz
    GTF     :  1280x1024  120.000185 Hz   5:4    131.640 kHz    233.793000 MHz
    GTF     :  1280x720   119.999881 Hz  16:9     92.640 kHz    161.564000 MHz
    GTF     :  1024x768   119.999931 Hz   4:3     98.760 kHz    139.054000 MHz
    GTF     :  1152x864   119.999945 Hz   4:3    111.120 kHz    176.014000 MHz
  Detailed Timing Descriptors:
    DTD 1:  2560x1080  144.000521 Hz  64:27   162.721 kHz    442.600000 MHz (798 mm x 334 mm)
                 Hfront   48 Hsync  32 Hback   80 Hpol P
                 Vfront   12 Vsync  10 Vback   28 Vpol N
    DTD 2:  2560x1080   59.937888 Hz  64:27    68.929 kHz    193.000000 MHz (798 mm x 334 mm)
                 Hfront   48 Hsync  32 Hback  160 Hpol P
                 Vfront   10 Vsync  10 Vback   50 Vpol N
    Display Range Limits:
      Monitor ranges (Range Limits Only): 50-144 Hz V, 164-164 kHz H, max dotclock 450 MHz
    Display Product Name: '34GL750'
  Extension blocks: 1
Checksum: 0xb9

----------------

Block 1, CTA-861 Extension Block:
  Revision: 3
  Basic audio support
  Supports YCbCr 4:4:4
  Supports YCbCr 4:2:2
  Native detailed modes: 1
  Audio Data Block:
    Linear PCM:
      Max channels: 2
      Supported sample rates (kHz): 48 44.1 32
      Supported sample sizes (bits): 24 20 16
  Video Data Block:
    VIC   1:   640x480    59.940476 Hz   4:3     31.469 kHz     25.175000 MHz
    VIC   2:   720x480    59.940060 Hz   4:3     31.469 kHz     27.000000 MHz
    VIC   4:  1280x720    60.000000 Hz  16:9     45.000 kHz     74.250000 MHz
    VIC  16:  1920x1080   60.000000 Hz  16:9     67.500 kHz    148.500000 MHz
    VIC  41:  1280x720   100.000000 Hz  16:9     75.000 kHz    148.500000 MHz
    VIC  47:  1280x720   120.000000 Hz  16:9     90.000 kHz    148.500000 MHz
    VIC  63:  1920x1080  120.000000 Hz  16:9    135.000 kHz    297.000000 MHz
    VIC  64:  1920x1080  100.000000 Hz  16:9    112.500 kHz    297.000000 MHz
    VIC  90:  2560x1080   60.000000 Hz  64:27    66.000 kHz    198.000000 MHz
    VIC  91:  2560x1080  100.000000 Hz  64:27   125.000 kHz    371.250000 MHz
    VIC  92:  2560x1080  120.000000 Hz  64:27   150.000 kHz    495.000000 MHz
  Speaker Allocation Data Block:
    FL/FR - Front Left/Right
  Colorimetry Data Block:
    BT2020YCC
    BT2020RGB
  HDR Static Metadata Data Block:
    Electro optical transfer functions:
      Traditional gamma - SDR luminance range
      SMPTE ST2084
    Supported static metadata descriptors:
      Static metadata type 1
    Desired content max luminance: 83 (301.833 cd/m^2)
    Desired content max frame-average luminance: 73 (243.049 cd/m^2)
    Desired content min luminance: 81 (0.305 cd/m^2)
  Detailed Timing Descriptors:
    DTD 3:  2560x1080   74.944486 Hz  64:27    86.786 kHz    243.000000 MHz (798 mm x 334 mm)
                 Hfront   48 Hsync  32 Hback  160 Hpol P
                 Vfront   10 Vsync  10 Vback   58 Vpol N
    DTD 4:  2560x1080   99.942890 Hz  64:27   113.235 kHz    308.000000 MHz (798 mm x 334 mm)
                 Hfront   48 Hsync  32 Hback   80 Hpol P
                 Vfront   12 Vsync  10 Vback   31 Vpol N
    DTD 5:  2560x1080  119.999349 Hz  64:27   135.599 kHz    368.830000 MHz (798 mm x 334 mm)
                 Hfront   48 Hsync  32 Hback   80 Hpol P
                 Vfront   12 Vsync  10 Vback   28 Vpol N
    DTD 6:  1920x1080   60.000000 Hz  16:9     67.500 kHz    148.500000 MHz (531 mm x 298 mm)
                 Hfront   88 Hsync  44 Hback  148 Hpol P
                 Vfront   10 Vsync  10 Vback   25 Vpol P
Checksum: 0x0f  Unused space in Extension Block: 20 bytes

----------------

Block 2, Unknown EDID Extension Block 0x00:
  00 ff ff ff ff ff ff 00 59 96 a8 91 6a ff 17 dc '........Y...j...'
  ff 1c 01 03 80 00 00 78 0a 48 97 a1 5b 54 a0 26 '.......x.H..[T.&'
  13 4a 50 00 00 00 01 01 01 01 01 01 01 01 01 01 '.JP.............'
  01 01 01 01 01 01 00 00 00 10 00 00 00 00 00 00 '................'
  00 00 00 00 00 00 00 00 00 00 00 fc 00 49 6e 64 '.............Ind'
  65 78 20 48 4d 44 0a 20 20 20 00 00 00 10 00 00 'ex HMD.   ......'
  00 00 00 00 00 00 00 00 00 00 00 00 00 00 00 10 '................'
  00 00 00 00 00 00 00 00 00 00 00 00 00 00 01 27 '...............''
Checksum: 0x27

----------------

Block 3, DisplayID Extension Block:
  Version: 1.2
  Extension Count: 0
  Display Product Type: Extension Section
  Video Timing Modes Type 1 - Detailed Timings Data Block:
    DTD:  2880x1600   90.002624 Hz   1:1    231.757 kHz    686.000000 MHz (aspect 1:1, no 3D stereo, preferred)
               Hfront    8 Hsync  32 Hback   40 Hpol N
               Vfront  965 Vsync   6 Vback    4 Vpol N
    DTD:  2880x1600   79.998880 Hz   1:1    231.757 kHz    686.000000 MHz (aspect 1:1, no 3D stereo)
               Hfront    8 Hsync  32 Hback   40 Hpol N
               Vfront 1287 Vsync   6 Vback    4 Vpol N
    DTD:  2880x1600  120.019035 Hz   1:1    231.757 kHz    686.000000 MHz (aspect 1:1, no 3D stereo)
               Hfront    8 Hsync  32 Hback   40 Hpol N
               Vfront  321 Vsync   6 Vback    4 Vpol N
    DTD:  2880x1600  144.000235 Hz   1:1    232.128 kHz    687.100000 MHz (aspect 1:1, no 3D stereo)
               Hfront    8 Hsync  32 Hback   40 Hpol N
               Vfront    3 Vsync   6 Vback    3 Vpol N
  CTA-861 DisplayID Data Block:
  Audio Data Block:
    Linear PCM:
      Max channels: 2
      Supported sample rates (kHz): 48
      Supported sample sizes (bits): 16
  Checksum: 0x17
Checksum: 0x90  Unused space in Extension Block: 31 bytes

----------------

Warnings:

Block 1, CTA-861 Extension Block:
  IT Video Formats are overscanned by default, but normally this should be underscanned.
  Video Data Block: VIC 1 and the first DTD are not identical. Is this intended?
  Video Data Block: All VICs are in ascending order, and the first (preferred) VIC <= 4, is that intended?
  Detailed Timing Descriptor #6: DTD is similar but not identical to VIC 16.
Block 3, DisplayID Extension Block:
  CTA-861 DisplayID Data Block: Unexpected revision (3 != 0).
EDID:
  Base EDID: Some timings are out of range of the Monitor Ranges:
    Horizontal Freq: 31.468 - 232.128 kHz (Monitor: 164.000 - 164.000 kHz)
    Maximum Clock: 687.100 MHz (Monitor: 450.000 MHz)

Failures:

Block 0, Base EDID:
  Basic Display Parameters & Features: sRGB is signaled, but the chromaticities do not match.
Block 1, CTA-861 Extension Block:
  Detailed Timing Descriptor #6: Mismatch of image size 531x298 mm vs display size 800x340 mm.
  Missing VCDB, needed for Set Selectable RGB Quantization to avoid interop issues.
Block 2, Base EDID:
  Unknown Extension Block.
Block 3, DisplayID Extension Block:
  DisplayID Base Block has no product type.
EDID:
  Base EDID: EDID specified 1 extension block(s), but found 3 extension block(s).

EDID conformity: FAIL
