edid-decode (hex):

00 ff ff ff ff ff ff 00 1e 6d 3b 77 98 a8 02 00
0a 1f 01 04 b5 50 22 78 9e ca 95 a6 55 4e a1 26
0f 50 54 25 6b 80 d1 cf d1 e8 d1 fc a9 fc 81 bc
81 fc 61 7c 71 7c f4 b0 00 a0 a0 38 4d 40 30 20
3a 00 1e 4e 31 00 00 1a cd 46 00 a0 a0 38 1f 40
30 20 3a 00 1e 4e 31 00 00 1a 00 00 00 fd 00 38
90 1e a7 2e 00 0a 20 20 20 20 20 20 00 00 00 fc
00 4c 47 20 55 4c 54 52 41 47 45 41 52 0a 01 a3

02 03 21 71 23 09 07 07 49 10 04 03 01 1f 13 59
5a 12 83 01 00 00 e3 05 c0 00 e6 06 05 01 53 49
51 29 59 00 a0 a0 38 27 40 30 20 3a 00 1e 4e 31
00 00 1a 50 78 00 a0 a0 38 35 40 30 20 3a 00 1e
4e 31 00 00 1a cd 91 00 a0 a0 38 40 40 30 20 3a
00 1e 4e 31 00 00 1a 02 3a 80 18 71 38 2d 40 58
2c 45 00 13 2a 21 00 00 1e 00 00 00 00 00 00 00
00 00 00 00 00 00 00 00 00 00 00 00 00 00 00 6e

00 ff ff ff ff ff ff 00 1e 6d 3b 77 98 a8 02 00
0a 1f 01 04 b5 50 22 78 9e ca 95 a6 55 4e a1 26
0f 50 54 25 6b 80 d1 cf d1 e8 d1 fc a9 fc 81 bc
81 fc 61 7c 71 7c f4 b0 00 a0 a0 38 4d 40 30 20
3a 00 1e 4e 31 00 00 1a cd 46 00 a0 a0 38 1f 40
30 20 3a 00 1e 4e 31 00 00 1a 00 00 00 fd 00 38
90 1e a7 2e 00 0a 20 20 20 20 20 20 00 00 00 fc
00 4c 47 20 55 4c 54 52 41 47 45 41 52 0a 01 a3

02 03 21 71 23 09 07 07 49 10 04 03 01 1f 13 59
5a 12 83 01 00 00 e3 05 c0 00 e6 06 05 01 53 49
51 29 59 00 a0 a0 38 27 40 30 20 3a 00 1e 4e 31
00 00 1a 50 78 00 a0 a0 38 35 40 30 20 3a 00 1e
4e 31 00 00 1a cd 91 00 a0 a0 38 40 40 30 20 3a
00 1e 4e 31 00 00 1a 02 3a 80 18 71 38 2d 40 58
2c 45 00 13 2a 21 00 00 1e 00 00 00 00 00 00 00
00 00 00 00 00 00 00 00 00 00 00 00 00 00 00 6e

----------------

Block 0, Base EDID:
  EDID Structure Version & Revision: 1.4
  Vendor & Product Identification:
    Manufacturer: GSM
    Model: 30523
    Serial Number: ...
    Made in: week 10 of 2021
  Basic Display Parameters & Features:
    Digital display
    Bits per primary color channel: 10
    DisplayPort interface
    Maximum image size: 80 cm x 34 cm
    Gamma: 2.20
    DPMS levels: Standby
    Supported color formats: RGB 4:4:4, YCrCb 4:4:4, YCrCb 4:2:2
    Default (sRGB) color space is primary color space
    First detailed timing includes the native pixel format and preferred refresh rate
  Color Characteristics:
    Red  : 0.6513, 0.3320
    Green: 0.3066, 0.6308
    Blue : 0.1503, 0.0595
    White: 0.3134, 0.3291
  Established Timings I & II:
    DMT 0x04:   640x480    59.940476 Hz   4:3     31.469 kHz     25.175000 MHz
    DMT 0x06:   640x480    75.000000 Hz   4:3     37.500 kHz     31.500000 MHz
    DMT 0x09:   800x600    60.316541 Hz   4:3     37.879 kHz     40.000000 MHz
    DMT 0x0b:   800x600    75.000000 Hz   4:3     46.875 kHz     49.500000 MHz
    Apple   :   832x624    74.551266 Hz   4:3     49.726 kHz     57.284000 MHz
    DMT 0x10:  1024x768    60.003840 Hz   4:3     48.363 kHz     65.000000 MHz
    DMT 0x12:  1024x768    75.028582 Hz   4:3     60.023 kHz     78.750000 MHz
    DMT 0x24:  1280x1024   75.024675 Hz   5:4     79.976 kHz    135.000000 MHz
    Apple   :  1152x870    75.061550 Hz 192:145   68.681 kHz    100.000000 MHz
  Standard Timings:
    GTF     :  1920x1080   75.000068 Hz  16:9     84.600 kHz    220.637000 MHz
    GTF     :  1920x1080  100.000000 Hz  16:9    114.400 kHz    302.016000 MHz
    GTF     :  1920x1080  119.999987 Hz  16:9    138.840 kHz    368.759000 MHz
    GTF     :  1600x900   119.999812 Hz  16:9    115.800 kHz    255.686000 MHz
    GTF     :  1280x1024  120.000185 Hz   5:4    131.640 kHz    233.793000 MHz
    GTF     :  1280x720   119.999881 Hz  16:9     92.640 kHz    161.564000 MHz
    GTF     :  1024x768   119.999931 Hz   4:3     98.760 kHz    139.054000 MHz
    GTF     :  1152x864   119.999945 Hz   4:3    111.120 kHz    176.014000 MHz
  Detailed Timing Descriptors:
    DTD 1:  2560x1080  143.944786 Hz  64:27   166.544 kHz    453.000000 MHz (798 mm x 334 mm)
                 Hfront   48 Hsync  32 Hback   80 Hpol P
                 Vfront    3 Vsync  10 Vback   64 Vpol N
    DTD 2:  2560x1080   59.978424 Hz  64:27    66.636 kHz    181.250000 MHz (798 mm x 334 mm)
                 Hfront   48 Hsync  32 Hback   80 Hpol P
                 Vfront    3 Vsync  10 Vback   18 Vpol N
    Display Range Limits:
      Monitor ranges (GTF): 56-144 Hz V, 30-167 kHz H, max dotclock 460 MHz
    Display Product Name: 'LG ULTRAGEAR'
  Extension blocks: 1
Checksum: 0xa3

----------------

Block 1, CTA-861 Extension Block:
  Revision: 3
  Basic audio support
  Supports YCbCr 4:4:4
  Supports YCbCr 4:2:2
  Native DTDs: 1
  Audio Data Block:
    Linear PCM:
      Max channels: 2
      Supported sample rates (kHz): 48 44.1 32
      Supported sample sizes (bits): 24 20 16
  Video Data Block:
    VIC  16:  1920x1080   60.000000 Hz  16:9     67.500 kHz    148.500000 MHz
    VIC   4:  1280x720    60.000000 Hz  16:9     45.000 kHz     74.250000 MHz
    VIC   3:   720x480    59.940060 Hz  16:9     31.469 kHz     27.000000 MHz
    VIC   1:   640x480    59.940476 Hz   4:3     31.469 kHz     25.175000 MHz
    VIC  31:  1920x1080   50.000000 Hz  16:9     56.250 kHz    148.500000 MHz
    VIC  19:  1280x720    50.000000 Hz  16:9     37.500 kHz     74.250000 MHz
    VIC  89:  2560x1080   50.000000 Hz  64:27    56.250 kHz    185.625000 MHz
    VIC  90:  2560x1080   60.000000 Hz  64:27    66.000 kHz    198.000000 MHz
    VIC  18:   720x576    50.000000 Hz  16:9     31.250 kHz     27.000000 MHz
  Speaker Allocation Data Block:
    FL/FR - Front Left/Right
  Colorimetry Data Block:
    BT2020YCC
    BT2020RGB
  HDR Static Metadata Data Block:
    Electro optical transfer functions:
      Traditional gamma - SDR luminance range
      SMPTE ST2084
    Supported static metadata descriptors:
      Static metadata type 1
    Desired content max luminance: 83 (301.833 cd/m^2)
    Desired content max frame-average luminance: 73 (243.049 cd/m^2)
    Desired content min luminance: 81 (0.305 cd/m^2)
  Detailed Timing Descriptors:
    DTD 3:  2560x1080   74.991458 Hz  64:27    83.915 kHz    228.250000 MHz (798 mm x 334 mm)
                 Hfront   48 Hsync  32 Hback   80 Hpol P
                 Vfront    3 Vsync  10 Vback   26 Vpol N
    DTD 4:  2560x1080   99.942890 Hz  64:27   113.235 kHz    308.000000 MHz (798 mm x 334 mm)
                 Hfront   48 Hsync  32 Hback   80 Hpol P
                 Vfront    3 Vsync  10 Vback   40 Vpol N
    DTD 5:  2560x1080  119.951280 Hz  64:27   137.224 kHz    373.250000 MHz (798 mm x 334 mm)
                 Hfront   48 Hsync  32 Hback   80 Hpol P
                 Vfront    3 Vsync  10 Vback   51 Vpol N
    DTD 6:  1920x1080   60.000000 Hz  16:9     67.500 kHz    148.500000 MHz (531 mm x 298 mm)
                 Hfront   88 Hsync  44 Hback  148 Hpol P
                 Vfront    4 Vsync   5 Vback   36 Vpol P
Checksum: 0x6e  Unused space in Extension Block: 22 bytes

----------------

Warnings:

Block 0, Base EDID:
  Display Range Limits: GTF support is deprecated in EDID 1.4.
Block 1, CTA-861 Extension Block:
  IT Video Formats are overscanned by default, but normally this should be underscanned.
  Video Data Block: VIC 16 and the first DTD are not identical. Is this intended?
EDID:
  Base EDID: Some timings are out of range of the Monitor Ranges:
    Vertical Freq: 50.000 - 143.945 Hz (Monitor: 56.000 - 144.000 Hz)

Failures:

Block 0, Base EDID:
  Basic Display Parameters & Features: sRGB is signaled, but the chromaticities do not match.
  Display Range Limits: GTF is supported, but the display does not support continuous frequencies.
Block 1, CTA-861 Extension Block:
  Detailed Timing Descriptor #6: Mismatch of image size 531x298 mm vs display size 800x340 mm.
  Missing VCDB, needed for Set Selectable RGB Quantization to avoid interop issues.
EDID:
  Extension Block 2 started with EDID header, ignoring Extension Blocks >= 2.

EDID conformity: FAIL
