edid-decode (hex):

00 ff ff ff ff ff ff 00 22 f0 02 0c a4 8e b0 03
13 06 01 00 2e 1f 17 71 e8 07 65 a0 57 46 9a 26
10 48 4c af de 18 31 59 45 59 81 80 01 01 01 01
01 01 01 01 01 01 10 0e 80 c0 20 e0 1d 10 38 38
13 00 32 e6 10 00 00 18 f9 15 20 f8 30 58 1f 20
20 40 13 00 32 e6 10 00 00 1e 42 2a 00 ac 51 00
20 40 2c b8 33 00 32 e6 10 00 00 18 01 01 01 01
01 01 01 01 01 01 01 01 01 01 01 01 01 01 00 1f

00 ff ff ff ff ff ff 00 22 f0 02 0c a4 8e b0 03
13 06 01 00 2e 1f 17 71 e8 07 65 a0 57 46 9a 26
10 48 4c af de 18 31 59 45 59 81 80 01 01 01 01
01 01 01 01 01 01 10 0e 80 c0 20 e0 1d 10 38 38
13 00 32 e6 10 00 00 18 f9 15 20 f8 30 58 1f 20
20 40 13 00 32 e6 10 00 00 1e 42 2a 00 ac 51 00
20 40 2c b8 33 00 32 e6 10 00 00 18 01 01 01 01
01 01 01 01 01 01 01 01 01 01 01 01 01 01 00 1f

----------------

Block 0, Base EDID:
  EDID Structure Version & Revision: 1.0
  Vendor & Product Identification:
    Manufacturer: HWP
    Model: 3074
    Serial Number: ...
    Made in: week 19 of 1996
  Basic Display Parameters & Features:
    Analog display
    Signal Level Standard: 0.714 : 0.286 : 1.000 V p-p
    Blank level equals black level
    Sync: Separate Composite SyncOnGreen
    Maximum image size: 31 cm x 23 cm
    Gamma: 2.13
    DPMS levels: Standby Suspend Off
    RGB color display
  Color Characteristics:
    Red  : 0.6250, 0.3398
    Green: 0.2744, 0.6044
    Blue : 0.1494, 0.0644
    White: 0.2822, 0.2978
  Established Timings I & II:
    IBM     :   720x400    70.081663 Hz   9:5     31.467 kHz     28.320000 MHz
    DMT 0x04:   640x480    59.940476 Hz   4:3     31.469 kHz     25.175000 MHz
    DMT 0x05:   640x480    72.808802 Hz   4:3     37.861 kHz     31.500000 MHz
    DMT 0x06:   640x480    75.000000 Hz   4:3     37.500 kHz     31.500000 MHz
    DMT 0x08:   800x600    56.250000 Hz   4:3     35.156 kHz     36.000000 MHz
    DMT 0x09:   800x600    60.316541 Hz   4:3     37.879 kHz     40.000000 MHz
    DMT 0x0a:   800x600    72.187572 Hz   4:3     48.077 kHz     50.000000 MHz
    DMT 0x0b:   800x600    75.000000 Hz   4:3     46.875 kHz     49.500000 MHz
    DMT 0x0f:  1024x768i   86.957532 Hz   4:3     35.522 kHz     44.900000 MHz
    DMT 0x10:  1024x768    60.003840 Hz   4:3     48.363 kHz     65.000000 MHz
    DMT 0x11:  1024x768    70.069359 Hz   4:3     56.476 kHz     75.000000 MHz
    DMT 0x12:  1024x768    75.028582 Hz   4:3     60.023 kHz     78.750000 MHz
  Standard Timings:
    DMT 0x07:   640x480    85.008312 Hz   4:3     43.269 kHz     36.000000 MHz
    DMT 0x0c:   800x600    85.061274 Hz   4:3     53.674 kHz     56.250000 MHz
    DMT 0x23:  1280x1024   60.019740 Hz   5:4     63.981 kHz    108.000000 MHz
  Detailed Timing Descriptors:
    DTD 1:   640x480    85.008312 Hz   4:3     43.269 kHz     36.000000 MHz (306 mm x 230 mm)
                 Hfront   56 Hsync  56 Hback   80 Hpol N
                 Vfront    1 Vsync   3 Vback   25 Vpol N
    DTD 2:   800x600    85.061274 Hz   4:3     53.674 kHz     56.250000 MHz (306 mm x 230 mm)
                 Hfront   32 Hsync  64 Hback  152 Hpol P
                 Vfront    1 Vsync   3 Vback   27 Vpol P
    DTD 3:  1280x1024   59.978444 Hz   5:4     63.337 kHz    108.180000 MHz (306 mm x 230 mm)
                 Hfront   44 Hsync 184 Hback  200 Hpol N
                 Vfront    3 Vsync   3 Vback   26 Vpol N
    Detailed mode: 01 01 01 01 01 01 01 01 01 01 01 01 01 01 01 01 01 01 '..................'
Checksum: 0x1f

----------------

Block 1, Unknown EDID Extension Block 0x00:
  00 ff ff ff ff ff ff 00 22 f0 02 0c a4 8e b0 03 '........".......'
  13 06 01 00 2e 1f 17 71 e8 07 65 a0 57 46 9a 26 '.......q..e.WF.&'
  10 48 4c af de 18 31 59 45 59 81 80 01 01 01 01 '.HL...1YEY......'
  01 01 01 01 01 01 10 0e 80 c0 20 e0 1d 10 38 38 '.......... ...88'
  13 00 32 e6 10 00 00 18 f9 15 20 f8 30 58 1f 20 '..2....... .0X. '
  20 40 13 00 32 e6 10 00 00 1e 42 2a 00 ac 51 00 ' @..2.....B*..Q.'
  20 40 2c b8 33 00 32 e6 10 00 00 18 01 01 01 01 ' @,.3.2.........'
  01 01 01 01 01 01 01 01 01 01 01 01 01 01 00 1f '................'
Checksum: 0x1f

----------------

Warnings:

Block 0, Base EDID:
  EDID Structure Version & Revision: EDID 1.0 is deprecated, do not use.
  Detailed Timing Descriptor #3: Image size is 306x230 mm, but based on the picture AR it should be 306x244 mm.

Failures:

Block 0, Base EDID:
  Detailed Timing Descriptor #4: Pixelclock < 10 MHz, assuming invalid data 0x01 0x01.
Block 1, Base EDID:
  Unknown Extension Block.
EDID:
  Base EDID: EDID specified 0 extension block(s), but found 1 extension block(s).

EDID conformity: FAIL
