edid-decode (hex):

00 ff ff ff ff ff ff 00 1e 6d 99 77 4d de 04 00
0a 21 01 03 80 46 27 78 ea 42 61 ad 50 45 ae 26
0e 50 54 21 09 00 d1 c0 61 40 81 c0 01 01 01 01
01 01 01 01 01 01 08 e8 00 30 f2 70 5a 80 b0 58
8a 00 bc 86 21 00 00 1e 00 00 00 fd 08 30 90 1e
4e 86 00 0a 20 20 20 20 20 20 00 00 00 fc 00 4c
47 20 55 4c 54 52 41 47 45 41 52 2b 00 00 00 ff
00 33 31 30 4e 54 42 4b 39 44 30 35 33 0a 03 57

f0 02 70 00 00 00 00 00 00 00 00 00 00 00 00 00
00 00 00 00 00 00 00 00 00 00 00 00 00 00 00 00
00 00 00 00 00 00 00 00 00 00 00 00 00 00 00 00
00 00 00 00 00 00 00 00 00 00 00 00 00 00 00 00
00 00 00 00 00 00 00 00 00 00 00 00 00 00 00 00
00 00 00 00 00 00 00 00 00 00 00 00 00 00 00 00
00 00 00 00 00 00 00 00 00 00 00 00 00 00 00 00
00 00 00 00 00 00 00 00 00 00 00 00 00 00 00 9e

02 03 56 71 23 0f 07 07 83 01 00 00 50 61 60 5f
5e 5d 22 20 1f 12 10 04 03 01 13 3f 76 6d 03 0c
00 20 00 b8 3c 20 00 60 01 02 03 6a d8 5d c4 01
78 80 63 00 30 90 e3 0f 03 80 e2 00 6a e3 05 c0
00 e6 06 05 01 8b 7d 12 6d 1a 00 00 02 0b 30 90
00 04 8b 12 76 17 04 74 00 30 f2 70 5a 80 b0 58
8a 00 bc 86 21 00 00 1e 6f c2 00 a0 a0 a0 55 50
30 20 35 00 bc 86 21 00 00 1a 00 00 00 00 00 b7

70 12 79 03 00 01 00 0c 58 1b 3c 0f 00 0f 70 08
90 78 4e bb 0f 00 0a 74 21 0e 0e 07 01 22 00 00
00 03 01 3c d8 06 02 84 ff 0e 9f 00 2f 80 1f 00
6f 08 91 00 02 00 04 00 08 ec 00 04 ff 09 9f 00
2f 80 1f 00 9f 05 66 00 02 00 09 00 59 87 00 04
7f 07 9f 00 2f 80 1f 00 37 04 4c 00 02 00 09 00
00 00 00 00 00 00 00 00 00 00 00 00 00 00 00 00
00 00 00 00 00 00 00 00 00 00 00 00 00 00 04 90

00 ff ff ff ff ff ff 00 1e 6d 99 77 4d de 04 00
0a 21 01 03 80 46 27 78 ea 42 61 ad 50 45 ae 26
0e 50 54 21 09 00 d1 c0 61 40 81 c0 01 01 01 01
01 01 01 01 01 01 08 e8 00 30 f2 70 5a 80 b0 58
8a 00 bc 86 21 00 00 1e 00 00 00 fd 08 30 90 1e
4e 86 00 0a 20 20 20 20 20 20 00 00 00 fc 00 4c
47 20 55 4c 54 52 41 47 45 41 52 2b 00 00 00 ff
00 33 31 30 4e 54 42 4b 39 44 30 35 33 0a 03 57

f0 02 70 00 00 00 00 00 00 00 00 00 00 00 00 00
00 00 00 00 00 00 00 00 00 00 00 00 00 00 00 00
00 00 00 00 00 00 00 00 00 00 00 00 00 00 00 00
00 00 00 00 00 00 00 00 00 00 00 00 00 00 00 00
00 00 00 00 00 00 00 00 00 00 00 00 00 00 00 00
00 00 00 00 00 00 00 00 00 00 00 00 00 00 00 00
00 00 00 00 00 00 00 00 00 00 00 00 00 00 00 00
00 00 00 00 00 00 00 00 00 00 00 00 00 00 00 9e

02 03 56 71 23 0f 07 07 83 01 00 00 50 61 60 5f
5e 5d 22 20 1f 12 10 04 03 01 13 3f 76 6d 03 0c
00 20 00 b8 3c 20 00 60 01 02 03 6a d8 5d c4 01
78 80 63 00 30 90 e3 0f 03 80 e2 00 6a e3 05 c0
00 e6 06 05 01 8b 7d 12 6d 1a 00 00 02 0b 30 90
00 04 8b 12 76 17 04 74 00 30 f2 70 5a 80 b0 58
8a 00 bc 86 21 00 00 1e 6f c2 00 a0 a0 a0 55 50
30 20 35 00 bc 86 21 00 00 1a 00 00 00 00 00 b7

70 12 79 03 00 01 00 0c 58 1b 3c 0f 00 0f 70 08
90 78 4e bb 0f 00 0a 74 21 0e 0e 07 01 22 00 00
00 03 01 3c d8 06 02 84 ff 0e 9f 00 2f 80 1f 00
6f 08 91 00 02 00 04 00 08 ec 00 04 ff 09 9f 00
2f 80 1f 00 9f 05 66 00 02 00 09 00 59 87 00 04
7f 07 9f 00 2f 80 1f 00 37 04 4c 00 02 00 09 00
00 00 00 00 00 00 00 00 00 00 00 00 00 00 00 00
00 00 00 00 00 00 00 00 00 00 00 00 00 00 04 90

----------------

Block 0, Base EDID:
  EDID Structure Version & Revision: 1.3
  Vendor & Product Identification:
    Manufacturer: GSM
    Model: 30617
    Serial Number: ...
    Made in: week 10 of 2023
  Basic Display Parameters & Features:
    Digital display
    Maximum image size: 70 cm x 39 cm
    Gamma: 2.20
    DPMS levels: Standby Suspend Off
    RGB color display
    First detailed timing is the preferred timing
  Color Characteristics:
    Red  : 0.6767, 0.3125
    Green: 0.2695, 0.6816
    Blue : 0.1494, 0.0566
    White: 0.3125, 0.3291
  Established Timings I & II:
    DMT 0x04:   640x480    59.940476 Hz   4:3     31.469 kHz     25.175000 MHz
    DMT 0x09:   800x600    60.316541 Hz   4:3     37.879 kHz     40.000000 MHz
    DMT 0x10:  1024x768    60.003840 Hz   4:3     48.363 kHz     65.000000 MHz
    DMT 0x24:  1280x1024   75.024675 Hz   5:4     79.976 kHz    135.000000 MHz
  Standard Timings:
    DMT 0x52:  1920x1080   60.000000 Hz  16:9     67.500 kHz    148.500000 MHz
    DMT 0x10:  1024x768    60.003840 Hz   4:3     48.363 kHz     65.000000 MHz
    DMT 0x55:  1280x720    60.000000 Hz  16:9     45.000 kHz     74.250000 MHz
  Detailed Timing Descriptors:
    DTD 1:  3840x2160   60.000000 Hz  16:9    135.000 kHz    594.000000 MHz (700 mm x 390 mm)
                 Hfront  176 Hsync  88 Hback  296 Hpol P
                 Vfront    8 Vsync  10 Vback   72 Vpol P
    Display Range Limits:
      Monitor ranges (GTF): 48-144 Hz V, 30-78 kHz H, max dotclock 1340 MHz
    Display Product Name: 'LG ULTRAGEAR+'
    Display Product Serial Number: ...
  Extension blocks: 3
Checksum: 0x57

----------------

Block 1, Block Map Extension Block:
  Block   2: CTA-861 Extension Block
  Block   3: DisplayID Extension Block
Checksum: 0x9e

----------------

Block 2, CTA-861 Extension Block:
  Revision: 3
  Basic audio support
  Supports YCbCr 4:4:4
  Supports YCbCr 4:2:2
  Native DTDs: 1
  Audio Data Block:
    Linear PCM:
      Max channels: 8
      Supported sample rates (kHz): 48 44.1 32
      Supported sample sizes (bits): 24 20 16
  Speaker Allocation Data Block:
    FL/FR - Front Left/Right
  Video Data Block:
    VIC  97:  3840x2160   60.000000 Hz  16:9    135.000 kHz    594.000000 MHz
    VIC  96:  3840x2160   50.000000 Hz  16:9    112.500 kHz    594.000000 MHz
    VIC  95:  3840x2160   30.000000 Hz  16:9     67.500 kHz    297.000000 MHz
    VIC  94:  3840x2160   25.000000 Hz  16:9     56.250 kHz    297.000000 MHz
    VIC  93:  3840x2160   24.000000 Hz  16:9     54.000 kHz    297.000000 MHz
    VIC  34:  1920x1080   30.000000 Hz  16:9     33.750 kHz     74.250000 MHz
    VIC  32:  1920x1080   24.000000 Hz  16:9     27.000 kHz     74.250000 MHz
    VIC  31:  1920x1080   50.000000 Hz  16:9     56.250 kHz    148.500000 MHz
    VIC  18:   720x576    50.000000 Hz  16:9     31.250 kHz     27.000000 MHz
    VIC  16:  1920x1080   60.000000 Hz  16:9     67.500 kHz    148.500000 MHz
    VIC   4:  1280x720    60.000000 Hz  16:9     45.000 kHz     74.250000 MHz
    VIC   3:   720x480    59.940060 Hz  16:9     31.469 kHz     27.000000 MHz
    VIC   1:   640x480    59.940476 Hz   4:3     31.469 kHz     25.175000 MHz
    VIC  19:  1280x720    50.000000 Hz  16:9     37.500 kHz     74.250000 MHz
    VIC  63:  1920x1080  120.000000 Hz  16:9    135.000 kHz    297.000000 MHz
    VIC 118:  3840x2160  120.000000 Hz  16:9    270.000 kHz   1188.000000 MHz
  Vendor-Specific Data Block (HDMI), OUI 00-0C-03:
    Source physical address: 2.0.0.0
    Supports_AI
    DC_36bit
    DC_30bit
    DC_Y444
    Maximum TMDS clock: 300 MHz
    Extended HDMI video details:
      HDMI VICs:
        HDMI VIC 1:  3840x2160   30.000000 Hz  16:9     67.500 kHz    297.000000 MHz
        HDMI VIC 2:  3840x2160   25.000000 Hz  16:9     56.250 kHz    297.000000 MHz
        HDMI VIC 3:  3840x2160   24.000000 Hz  16:9     54.000 kHz    297.000000 MHz
  Vendor-Specific Data Block (HDMI Forum), OUI C4-5D-D8:
    Version: 1
    Maximum TMDS Character Rate: 600 MHz
    SCDC Present
    Max Fixed Rate Link: 3 and 6 Gbps per lane on 3 lanes, 6, 8, 10 and 12 Gbps on 4 lanes
    Supports 12-bits/component Deep Color 4:2:0 Pixel Encoding
    Supports 10-bits/component Deep Color 4:2:0 Pixel Encoding
    VRRmin: 48 Hz
    VRRmax: 144 Hz
  YCbCr 4:2:0 Capability Map Data Block:
    VIC  97:  3840x2160   60.000000 Hz  16:9    135.000 kHz    594.000000 MHz
    VIC  96:  3840x2160   50.000000 Hz  16:9    112.500 kHz    594.000000 MHz
    VIC 118:  3840x2160  120.000000 Hz  16:9    270.000 kHz   1188.000000 MHz
  Video Capability Data Block:
    YCbCr quantization: No Data
    RGB quantization: Selectable (via AVI Q)
    PT scan behavior: Always Underscanned
    IT scan behavior: Always Underscanned
    CE scan behavior: Always Underscanned
  Colorimetry Data Block:
    BT2020YCC
    BT2020RGB
  HDR Static Metadata Data Block:
    Electro optical transfer functions:
      Traditional gamma - SDR luminance range
      SMPTE ST2084
    Supported static metadata descriptors:
      Static metadata type 1
    Desired content max luminance: 139 (1015.241 cd/m^2)
    Desired content max frame-average luminance: 125 (749.667 cd/m^2)
    Desired content min luminance: 18 (0.051 cd/m^2)
  Vendor-Specific Data Block (AMD), OUI 00-00-1A:
    Version: 2
    Feature Caps: 0x0b
      Local Dimming Supported
    Minimum Refresh Rate: 48 Hz
    Maximum Refresh Rate: 144 Hz
    Flags 1.x: 0x00
    Flags 2.x: 0x04
      ST 2084 (PQ) EOTF Supported
      Linear EOTF (Windows scRGB, 0.0 - 125.0) Supported
      Gamma 2.2 EOTF Supported
      BT.2020 Gamut Supported
    Maximum luminance: 139 (1015.241 cd/m^2)
    Minimum luminance: 18 (0.051 cd/m^2)
    Maximum luminance (without local dimming): 118 (644.196 cd/m^2)
    Minimum luminance (without local dimming): 23 (0.052 cd/m^2)
  Detailed Timing Descriptors:
    DTD 2:  3840x2160   30.000000 Hz  16:9     67.500 kHz    297.000000 MHz (700 mm x 390 mm)
                 Hfront  176 Hsync  88 Hback  296 Hpol P
                 Vfront    8 Vsync  10 Vback   72 Vpol P
    DTD 3:  2560x1440  119.997589 Hz  16:9    182.996 kHz    497.750000 MHz (700 mm x 390 mm)
                 Hfront   48 Hsync  32 Hback   80 Hpol P
                 Vfront    3 Vsync   5 Vback   77 Vpol N
Checksum: 0xb7  Unused space in Extension Block: 5 bytes

----------------

Block 3, DisplayID Extension Block:
  Version: 1.2
  Extension Count: 0
  Display Product Type: Standalone display device
  Display Parameters Data Block (0x01):
    Image size: 700.0 mm x 390.0 mm
    Display native pixel format: 3840x2160
    Feature support flags:
      Power management (DPM)
      Audio support on video interface
    Gamma: 2.20
    Aspect ratio: 1.78
    Dynamic bpc native: 12
    Dynamic bpc overall: 12
  Display Interface Data Block:
    Interface Type: HDMI-A
    Number of Links: 4
    Interface Standard Version: 2.1
    Supported bpc for RGB encoding: 8, 10, 12
    Supported bpc for YCbCr 4:4:4 encoding: 8, 10, 12
    Supported bpc for YCbCr 4:2:2 encoding: 8, 10, 12
    Supported Content Protection: HDCP 2.2
    Spread Spectrum: None
  Video Timing Modes Type 1 - Detailed Timings Data Block:
    DTD:  3840x2160  143.999350 Hz  16:9    332.062 kHz   1328.250000 MHz (aspect 16:9, no 3D stereo, preferred)
               Hfront   48 Hsync  32 Hback   80 Hpol P
               Vfront    3 Vsync   5 Vback  138 Vpol N
    DTD:  2560x1440  143.973257 Hz  16:9    222.151 kHz    604.250000 MHz (aspect 16:9, no 3D stereo)
               Hfront   48 Hsync  32 Hback   80 Hpol P
               Vfront    3 Vsync  10 Vback   90 Vpol N
    DTD:  1920x1080  143.981451 Hz  16:9    166.587 kHz    346.500000 MHz (aspect 16:9, no 3D stereo)
               Hfront   48 Hsync  32 Hback   80 Hpol P
               Vfront    3 Vsync  10 Vback   64 Vpol N
  Checksum: 0x04
Checksum: 0x90

----------------

Warnings:

Block 2, CTA-861 Extension Block:
  IT Video Formats are overscanned by default, but normally this should be underscanned.
  Video Capability Data Block: Set Selectable YCbCr Quantization to avoid interop issues.
  Video Capability Data Block: S_PT is equal to S_IT and S_CE, so should be set to 0 instead.
  Colorimetry Data Block: Set the sRGB colorimetry bit to avoid interop issues.
  Display Product Serial Number is set, so the Serial Number in the Base EDID should be 0.
EDID:
  Base EDID: Some timings are out of range of the Monitor Ranges:
    Vertical Freq: 24.000 - 143.999 Hz (Monitor: 48.000 - 144.000 Hz)
    Horizontal Freq: 27.000 - 332.062 kHz (Monitor: 30.000 - 78.000 kHz)

Failures:

Block 0, Base EDID:
  Display Descriptor #2: Monitor descriptor block has byte 4 nonzero (0x08).
Block 2, CTA-861 Extension Block:
  Vendor-Specific Data Block (HDMI Forum), OUI C4-5D-D8: HDMI VIC and related CTA VIC codes are present, but the UHD VIC bit is 0.
  Video Capability Data Block: IT video formats are always underscanned, but bit 7 of Byte 3 of the CTA-861 Extension header is set to overscanned.
EDID:
  Extension Block 4 started with EDID header, ignoring Extension Blocks >= 4.

EDID conformity: FAIL
