edid-decode (hex):

00 ff ff ff ff ff ff 00 4a 8b 80 10 60 00 00 00
14 21 01 04 b5 22 16 78 3b da e5 95 5d 59 94 29
24 50 54 21 08 00 d1 c0 81 80 a9 c0 d1 c0 01 01
01 01 01 01 01 01 73 3c 80 a0 70 b0 28 40 58 2c
25 00 58 d7 10 00 00 1a 00 00 00 ff 00 30 30 30
0a 20 20 20 20 20 20 20 20 20 00 00 00 fc 00 46
48 44 0a 20 20 20 20 20 20 20 20 20 00 00 00 fd
00 3c 78 3c 82 1f 01 0a 20 20 20 20 20 20 01 b7

02 03 1f f2 44 01 04 02 10 23 09 7f 07 83 01 00
00 e3 05 c0 00 e2 00 c0 e6 06 05 01 62 62 28 e6
78 80 a0 70 b0 28 40 58 2c 45 00 58 d7 10 00 00
1a be 6e 80 b4 70 38 2d 40 30 20 35 00 58 d7 10
00 00 1a 02 3a 80 18 71 38 2d 40 58 2c 45 00 58
d7 10 00 00 1a 00 00 00 00 00 00 00 00 00 00 00
00 00 00 00 00 00 00 00 00 00 00 00 00 00 00 00
00 00 00 00 00 00 00 00 00 00 00 00 00 00 00 aa

00 ff ff ff ff ff ff 00 4a 8b 80 10 60 00 00 00
14 21 01 04 b5 22 16 78 3b da e5 95 5d 59 94 29
24 50 54 21 08 00 d1 c0 81 80 a9 c0 d1 c0 01 01
01 01 01 01 01 01 73 3c 80 a0 70 b0 28 40 58 2c
25 00 58 d7 10 00 00 1a 00 00 00 ff 00 30 30 30
0a 20 20 20 20 20 20 20 20 20 00 00 00 fc 00 46
48 44 0a 20 20 20 20 20 20 20 20 20 00 00 00 fd
00 3c 78 3c 82 1f 01 0a 20 20 20 20 20 20 01 b7

02 03 1f f2 44 01 04 02 10 23 09 7f 07 83 01 00
00 e3 05 c0 00 e2 00 c0 e6 06 05 01 62 62 28 e6
78 80 a0 70 b0 28 40 58 2c 45 00 58 d7 10 00 00
1a be 6e 80 b4 70 38 2d 40 30 20 35 00 58 d7 10
00 00 1a 02 3a 80 18 71 38 2d 40 58 2c 45 00 58
d7 10 00 00 1a 00 00 00 00 00 00 00 00 00 00 00
00 00 00 00 00 00 00 00 00 00 00 00 00 00 00 00
00 00 00 00 00 00 00 00 00 00 00 00 00 00 00 aa

----------------

Block 0, Base EDID:
  EDID Structure Version & Revision: 1.4
  Vendor & Product Identification:
    Manufacturer: RTK
    Model: 4224
    Serial Number: ...
    Made in: week 20 of 2023
  Basic Display Parameters & Features:
    Digital display
    Bits per primary color channel: 10
    DisplayPort interface
    Maximum image size: 34 cm x 22 cm
    Gamma: 2.20
    DPMS levels: Off
    Supported color formats: RGB 4:4:4, YCrCb 4:4:4, YCrCb 4:2:2
    First detailed timing includes the native pixel format and preferred refresh rate
    Display supports continuous frequencies
  Color Characteristics:
    Red  : 0.5849, 0.3642
    Green: 0.3496, 0.5800
    Blue : 0.1630, 0.1425
    White: 0.3134, 0.3291
  Established Timings I & II:
    DMT 0x04:   640x480    59.940476 Hz   4:3     31.469 kHz     25.175000 MHz
    DMT 0x09:   800x600    60.316541 Hz   4:3     37.879 kHz     40.000000 MHz
    DMT 0x10:  1024x768    60.003840 Hz   4:3     48.363 kHz     65.000000 MHz
  Standard Timings:
    DMT 0x52:  1920x1080   60.000000 Hz  16:9     67.500 kHz    148.500000 MHz
    DMT 0x23:  1280x1024   60.019740 Hz   5:4     63.981 kHz    108.000000 MHz
    DMT 0x53:  1600x900    60.000000 Hz  16:9     60.000 kHz    108.000000 MHz (RB)
    DMT 0x52:  1920x1080   60.000000 Hz  16:9     67.500 kHz    148.500000 MHz
  Detailed Timing Descriptors:
    DTD 1:  1920x1200   59.999225 Hz  16:10    74.399 kHz    154.750000 MHz (344 mm x 215 mm)
                 Hfront   88 Hsync  44 Hback   28 Hpol P
                 Vfront    2 Vsync   5 Vback   33 Vpol N
    Display Product Serial Number: ...
    Display Product Name: 'FHD'
    Display Range Limits:
      Monitor ranges (Range Limits Only): 60-120 Hz V, 60-130 kHz H, max dotclock 310 MHz
  Extension blocks: 1
Checksum: 0xb7

----------------

Block 1, CTA-861 Extension Block:
  Revision: 3
  Underscans IT Video Formats by default
  Basic audio support
  Supports YCbCr 4:4:4
  Supports YCbCr 4:2:2
  Native DTDs: 2
  Video Data Block:
    VIC   1:   640x480    59.940476 Hz   4:3     31.469 kHz     25.175000 MHz
    VIC   4:  1280x720    60.000000 Hz  16:9     45.000 kHz     74.250000 MHz
    VIC   2:   720x480    59.940060 Hz   4:3     31.469 kHz     27.000000 MHz
    VIC  16:  1920x1080   60.000000 Hz  16:9     67.500 kHz    148.500000 MHz
  Audio Data Block:
    Linear PCM:
      Max channels: 2
      Supported sample rates (kHz): 192 176.4 96 88.2 48 44.1 32
      Supported sample sizes (bits): 24 20 16
  Speaker Allocation Data Block:
    FL/FR - Front Left/Right
  Colorimetry Data Block:
    BT2020YCC
    BT2020RGB
  Video Capability Data Block:
    YCbCr quantization: Selectable (via AVI YQ)
    RGB quantization: Selectable (via AVI Q)
    PT scan behavior: No Data
    IT scan behavior: IT video formats not supported
    CE scan behavior: CE video formats not supported
  HDR Static Metadata Data Block:
    Electro optical transfer functions:
      Traditional gamma - SDR luminance range
      SMPTE ST2084
    Supported static metadata descriptors:
      Static metadata type 1
    Desired content max luminance: 98 (417.710 cd/m^2)
    Desired content max frame-average luminance: 98 (417.710 cd/m^2)
    Desired content min luminance: 40 (0.103 cd/m^2)
  Detailed Timing Descriptors:
    DTD 2:  1920x1200  119.998449 Hz  16:10   148.798 kHz    309.500000 MHz (344 mm x 215 mm)
                 Hfront   88 Hsync  44 Hback   28 Hpol P
                 Vfront    4 Vsync   5 Vback   31 Vpol N
    DTD 3:  1920x1080  120.000000 Hz  16:9    135.000 kHz    283.500000 MHz (344 mm x 215 mm)
                 Hfront   48 Hsync  32 Hback  100 Hpol P
                 Vfront    3 Vsync   5 Vback   37 Vpol N
    DTD 4:  1920x1080   60.000000 Hz  16:9     67.500 kHz    148.500000 MHz (344 mm x 215 mm)
                 Hfront   88 Hsync  44 Hback  148 Hpol P
                 Vfront    4 Vsync   5 Vback   36 Vpol N
Checksum: 0xaa  Unused space in Extension Block: 42 bytes

----------------

Warnings:

Block 0, Base EDID:
  Display Product Serial Number: ...
Block 1, CTA-861 Extension Block:
  Video Data Block: VIC 1 and the first DTD are not identical. Is this intended?
  Colorimetry Data Block: Set the sRGB colorimetry bit to avoid interop issues.
  Video Capability Data Block: IT scan behavior is expected to support underscanned.
  Video Capability Data Block: 'CE video formats not supported' makes no sense.
  Detailed Timing Descriptor #3: Image size is 344x215 mm, but based on the picture AR it should be 344x193 mm.
  Detailed Timing Descriptor #4: DTD is similar but not identical to VIC 16.
  Detailed Timing Descriptor #4: Image size is 344x215 mm, but based on the picture AR it should be 344x193 mm.
  Display Product Serial Number is set, so the Serial Number in the Base EDID should be 0.
EDID:
  Base EDID: Some timings are out of range of the Monitor Ranges:
    Horizontal Freq: 31.468 - 148.798 kHz (Monitor: 60.000 - 130.000 kHz)

Failures:

EDID:
  Extension Block 2 started with EDID header, ignoring Extension Blocks >= 2.

EDID conformity: FAIL
