edid-decode (hex):

00 ff ff ff ff ff ff 00 4d d9 00 b0 01 01 01 01
1f 10 01 04 a5 22 1b 78 e2 e0 e5 a4 56 45 9a 23
15 50 54 ad cf 00 81 80 81 40 01 01 01 01 01 01
01 01 01 01 01 01 30 2a 00 98 51 00 2a 40 30 70
13 00 52 0e 11 00 00 1e 00 00 00 fd 00 38 4b 1c
51 0e 00 0a 20 20 20 20 20 20 00 00 00 fc 00 53
44 4d 2d 45 37 36 41 0a 20 20 20 20 00 00 00 ff
00 31 36 30 37 35 38 31 0a 20 20 20 20 20 00 a5

00 ff ff ff ff ff ff 00 4d d9 00 b0 01 01 01 01
1f 10 01 04 a5 22 1b 78 e2 e0 e5 a4 56 45 9a 23
15 50 54 ad cf 00 81 80 81 40 01 01 01 01 01 01
01 01 01 01 01 01 30 2a 00 98 51 00 2a 40 30 70
13 00 52 0e 11 00 00 1e 00 00 00 fd 00 38 4b 1c
51 0e 00 0a 20 20 20 20 20 20 00 00 00 fc 00 53
44 4d 2d 45 37 36 41 0a 20 20 20 20 00 00 00 ff
00 31 36 30 37 35 38 31 0a 20 20 20 20 20 00 a5

----------------

Block 0, Base EDID:
  EDID Structure Version & Revision: 1.4
  Vendor & Product Identification:
    Manufacturer: SNY
    Model: 45056
    Serial Number: ...
    Made in: week 31 of 2006
  Basic Display Parameters & Features:
    Digital display
    Bits per primary color channel: 8
    DisplayPort interface
    Maximum image size: 34 cm x 27 cm
    Gamma: 2.20
    DPMS levels: Standby Suspend Off
    Supported color formats: RGB 4:4:4
    First detailed timing includes the native pixel format and preferred refresh rate
  Color Characteristics:
    Red  : 0.6435, 0.3378
    Green: 0.2695, 0.6015
    Blue : 0.1396, 0.0839
    White: 0.3134, 0.3291
  Established Timings I & II:
    IBM     :   720x400    70.081663 Hz   9:5     31.467 kHz     28.320000 MHz
    DMT 0x04:   640x480    59.940476 Hz   4:3     31.469 kHz     25.175000 MHz
    DMT 0x05:   640x480    72.808802 Hz   4:3     37.861 kHz     31.500000 MHz
    DMT 0x06:   640x480    75.000000 Hz   4:3     37.500 kHz     31.500000 MHz
    DMT 0x09:   800x600    60.316541 Hz   4:3     37.879 kHz     40.000000 MHz
    DMT 0x0a:   800x600    72.187572 Hz   4:3     48.077 kHz     50.000000 MHz
    DMT 0x0b:   800x600    75.000000 Hz   4:3     46.875 kHz     49.500000 MHz
    DMT 0x10:  1024x768    60.003840 Hz   4:3     48.363 kHz     65.000000 MHz
    DMT 0x11:  1024x768    70.069359 Hz   4:3     56.476 kHz     75.000000 MHz
    DMT 0x12:  1024x768    75.028582 Hz   4:3     60.023 kHz     78.750000 MHz
    DMT 0x24:  1280x1024   75.024675 Hz   5:4     79.976 kHz    135.000000 MHz
  Standard Timings:
    DMT 0x23:  1280x1024   60.019740 Hz   5:4     63.981 kHz    108.000000 MHz
    DMT 0x20:  1280x960    60.000000 Hz   4:3     60.000 kHz    108.000000 MHz
  Detailed Timing Descriptors:
    DTD 1:  1280x1024   60.019740 Hz   5:4     63.981 kHz    108.000000 MHz (338 mm x 270 mm)
                 Hfront   48 Hsync 112 Hback  248 Hpol P
                 Vfront    1 Vsync   3 Vback   38 Vpol P
    Display Range Limits:
      Monitor ranges (GTF): 56-75 Hz V, 28-81 kHz H, max dotclock 140 MHz
    Display Product Name: 'SDM-E76A'
    Display Product Serial Number: ...
Checksum: 0xa5

----------------

Warnings:

Block 0, Base EDID:
  Vendor & Product Identification: The serial number is one of the known dummy values, it should probably be set to 0.
  Display Range Limits: GTF support is deprecated in EDID 1.4.

Failures:

Block 0, Base EDID:
  Display Range Limits: GTF is supported, but the display does not support continuous frequencies.
EDID:
  Extension Block 1 started with EDID header, ignoring Extension Blocks >= 1.

EDID conformity: FAIL
