edid-decode (hex):

00 ff ff ff ff ff ff 00 10 ac a5 71 45 36 36 32
0a 09 01 01 08 1e 17 b9 e8 0e b2 a0 57 47 99 26
10 48 4f a4 4a 00 61 59 45 59 81 80 31 59 01 01
01 01 01 01 01 01 10 0b d0 b4 20 5e 63 10 12 6c
62 08 fa b8 00 00 00 1a 00 00 00 ff 00 37 32 32
31 44 44 32 36 36 45 33 39 0a 00 00 00 fc 00 44
45 4c 4c 20 4d 37 37 30 0a 20 20 20 00 00 00 fd
00 30 a0 1e 45 ff 00 0a 20 20 20 20 20 20 00 a6

00 ff ff ff ff ff ff 00 10 ac a5 71 45 36 36 32
0a 09 01 01 08 1e 17 b9 e8 0e b2 a0 57 47 99 26
10 48 4f a4 4a 00 61 59 45 59 81 80 31 59 01 01
01 01 01 01 01 01 10 0b d0 b4 20 5e 63 10 12 6c
62 08 fa b8 00 00 00 1a 00 00 00 ff 00 37 32 32
31 44 44 32 36 36 45 33 39 0a 00 00 00 fc 00 44
45 4c 4c 20 4d 37 37 30 0a 20 20 20 00 00 00 fd
00 30 a0 1e 45 ff 00 0a 20 20 20 20 20 20 00 a6

----------------

Block 0, Base EDID:
  EDID Structure Version & Revision: 1.1
  Vendor & Product Identification:
    Manufacturer: DEL
    Model: 29093
    Serial Number: ...
    Made in: week 10 of 1999
  Basic Display Parameters & Features:
    Analog display
    Signal Level Standard: 0.700 : 0.300 : 1.000 V p-p
    Blank level equals black level
    Sync: Separate
    Maximum image size: 30 cm x 23 cm
    Gamma: 2.85
    DPMS levels: Standby Suspend Off
    RGB color display
  Color Characteristics:
    Red  : 0.6250, 0.3398
    Green: 0.2802, 0.5996
    Blue : 0.1503, 0.0654
    White: 0.2812, 0.3105
  Established Timings I & II:
    IBM     :   720x400    70.081663 Hz   9:5     31.467 kHz     28.320000 MHz
    DMT 0x04:   640x480    59.940476 Hz   4:3     31.469 kHz     25.175000 MHz
    DMT 0x06:   640x480    75.000000 Hz   4:3     37.500 kHz     31.500000 MHz
    DMT 0x0b:   800x600    75.000000 Hz   4:3     46.875 kHz     49.500000 MHz
    DMT 0x10:  1024x768    60.003840 Hz   4:3     48.363 kHz     65.000000 MHz
    DMT 0x12:  1024x768    75.028582 Hz   4:3     60.023 kHz     78.750000 MHz
  Standard Timings:
    DMT 0x13:  1024x768    84.996690 Hz   4:3     68.677 kHz     94.500000 MHz
    DMT 0x0c:   800x600    85.061274 Hz   4:3     53.674 kHz     56.250000 MHz
    DMT 0x23:  1280x1024   60.019740 Hz   5:4     63.981 kHz    108.000000 MHz
    DMT 0x07:   640x480    85.008312 Hz   4:3     43.269 kHz     36.000000 MHz
  Detailed Timing Descriptors:
    DTD 1:   720x350    70.081663 Hz  72:35    31.467 kHz     28.320000 MHz (250 mm x 184 mm)
                 Hfront   18 Hsync 108 Hback   54 Hpol P
                 Vfront   38 Vsync   2 Vback   59 Vpol N
    Display Product Serial Number: ...
    Display Product Name: 'DELL M770'
    Display Range Limits:
      Monitor ranges (GTF): 48-160 Hz V, 30-69 kHz H, max dotclock 2550 MHz
Checksum: 0xa6

----------------

Block 1, Unknown EDID Extension Block 0x00:
  00 ff ff ff ff ff ff 00 10 ac a5 71 45 36 36 32 '...........qE662'
  0a 09 01 01 08 1e 17 b9 e8 0e b2 a0 57 47 99 26 '............WG.&'
  10 48 4f a4 4a 00 61 59 45 59 81 80 31 59 01 01 '.HO.J.aYEY..1Y..'
  01 01 01 01 01 01 10 0b d0 b4 20 5e 63 10 12 6c '.......... ^c..l'
  62 08 fa b8 00 00 00 1a 00 00 00 ff 00 37 32 32 'b............722'
  31 44 44 32 36 36 45 33 39 0a 00 00 00 fc 00 44 '1DD266E39......D'
  45 4c 4c 20 4d 37 37 30 0a 20 20 20 00 00 00 fd 'ELL M770.   ....'
  00 30 a0 1e 45 ff 00 0a 20 20 20 20 20 20 00 a6 '.0..E...      ..'
Checksum: 0xa6

----------------

Warnings:

Block 0, Base EDID:
  EDID Structure Version & Revision: EDID 1.1 is deprecated, do not use.
  Detailed Timing Descriptor #1: Image size is 250x184 mm, but based on the picture AR it should be 250x121 mm.

Failures:

Block 0, Base EDID:
  Detailed Timing Descriptor #1: Mismatch of image size 250x184 mm vs display size 300x230 mm.
Block 1, Base EDID:
  Unknown Extension Block.
EDID:
  Base EDID: EDID specified 0 extension block(s), but found 1 extension block(s).

EDID conformity: FAIL
