edid-decode (hex):

00 ff ff ff ff ff ff 00 06 af 5c 30 00 00 00 00
00 15 01 04 90 1a 0e 78 02 99 85 95 55 56 92 28
22 50 54 00 00 00 01 01 01 01 01 01 01 01 01 01
01 01 01 01 01 01 58 1b 56 68 50 00 19 30 30 20
36 00 00 90 10 00 00 1a 58 1b 56 68 50 00 19 30
30 20 36 00 00 90 10 00 00 1a 00 00 00 fe 00 32
56 44 32 4b 81 42 31 31 36 58 57 33 00 00 00 00
00 00 41 0a 96 01 11 00 00 02 01 0a 20 20 00 b3

----------------

Block 0, Base EDID:
  EDID Structure Version & Revision: 1.4
  Vendor & Product Identification:
    Manufacturer: AUO
    Model: 12380
    Made in: 2011
  Basic Display Parameters & Features:
    Digital display
    Bits per primary color channel: 6
    Digital interface is not defined
    Maximum image size: 26 cm x 14 cm
    Gamma: 2.20
    Supported color formats: RGB 4:4:4
    First detailed timing includes the native pixel format and preferred refresh rate
  Color Characteristics:
    Red  : 0.5839, 0.3330
    Green: 0.3378, 0.5712
    Blue : 0.1582, 0.1328
    White: 0.3134, 0.3291
  Established Timings I & II: none
  Standard Timings: none
  Detailed Timing Descriptors:
    DTD 1:  1366x768    60.049240 Hz 683:384   47.619 kHz     70.000000 MHz (256 mm x 144 mm)
                 Hfront   48 Hsync  32 Hback   24 Hpol P
                 Vfront    3 Vsync   6 Vback   16 Vpol N
    DTD 2:  1366x768    60.049240 Hz 683:384   47.619 kHz     70.000000 MHz (256 mm x 144 mm)
                 Hfront   48 Hsync  32 Hback   24 Hpol P
                 Vfront    3 Vsync   6 Vback   16 Vpol N
    Alphanumeric Data String: '2VD2K.B116XW3'
    Manufacturer-Specified Display Descriptor (0x00): 00 00 00 00 41 0a 96 01 11 00 00 02 01 0a 20 20 '....A.........  '
Checksum: 0xb3

----------------

Warnings:

Block 0, Base EDID:
  Alphanumeric Data String: Non-ASCII character 0x81 at position 5, can cause problems.
  Missing Display Product Name.

EDID conformity: PASS
