edid-decode (hex):

00 ff ff ff ff ff ff 00 0e 77 4e 14 00 00 00 00
00 22 01 04 a5 1e 13 78 03 15 f4 9f 57 4e 8c 23
15 51 53 00 00 00 01 01 01 01 01 01 01 01 01 01
01 01 01 01 01 01 42 3c 80 a0 70 b0 24 40 30 20
36 00 2d bc 10 00 00 1a 00 00 00 fd 00 30 3c 4b
4b 10 00 0a 20 20 20 20 20 20 00 00 00 fe 00 43
53 4f 54 20 54 39 0a 20 20 20 20 20 00 00 00 fe
00 53 4e 45 30 30 37 51 53 37 2d 31 0a 20 00 e2

00 ff ff ff ff ff ff 00 0e 77 4e 14 00 00 00 00
00 22 01 04 a5 1e 13 78 03 15 f4 9f 57 4e 8c 23
15 51 53 00 00 00 01 01 01 01 01 01 01 01 01 01
01 01 01 01 01 01 42 3c 80 a0 70 b0 24 40 30 20
36 00 2d bc 10 00 00 1a 00 00 00 fd 00 30 3c 4b
4b 10 00 0a 20 20 20 20 20 20 00 00 00 fe 00 43
53 4f 54 20 54 39 0a 20 20 20 20 20 00 00 00 fe
00 53 4e 45 30 30 37 51 53 37 2d 31 0a 20 00 e2

----------------

Block 0, Base EDID:
  EDID Structure Version & Revision: 1.4
  Vendor & Product Identification:
    Manufacturer: CSW
    Model: 5198
    Made in: 2024
  Basic Display Parameters & Features:
    Digital display
    Bits per primary color channel: 8
    DisplayPort interface
    Maximum image size: 30 cm x 19 cm
    Gamma: 2.20
    Supported color formats: RGB 4:4:4
    First detailed timing includes the native pixel format and preferred refresh rate
    Display supports continuous frequencies
  Color Characteristics:
    Red  : 0.6210, 0.3408
    Green: 0.3056, 0.5478
    Blue : 0.1396, 0.0849
    White: 0.3173, 0.3242
  Established Timings I & II: none
  Standard Timings: none
  Detailed Timing Descriptors:
    DTD 1:  1920x1200   60.002801 Hz  16:10    74.163 kHz    154.260000 MHz (301 mm x 188 mm)
                 Hfront   48 Hsync  32 Hback   80 Hpol P
                 Vfront    3 Vsync   6 Vback   27 Vpol N
    Display Range Limits:
      Monitor ranges (GTF): 48-60 Hz V, 75-75 kHz H, max dotclock 160 MHz
    Alphanumeric Data String: 'CSOT T9'
    Alphanumeric Data String: 'SNE007QS7-1'
Checksum: 0xe2

----------------

Warnings:

Block 0, Base EDID:
  Display Range Limits: GTF support is deprecated in EDID 1.4.
  Missing Display Product Name.
EDID:
  Base EDID: Some timings are out of range of the Monitor Ranges:
    Horizontal Freq: 74.163 - 74.163 kHz (Monitor: 75.000 - 75.000 kHz)
    Could be due to a Monitor Range off-by-one rounding issue

Failures:

EDID:
  Extension Block 1 started with EDID header, ignoring Extension Blocks >= 1.

EDID conformity: FAIL
