edid-decode (hex):

00 ff ff ff ff ff ff 00 26 cf 8e 04 00 00 00 00
00 1e 01 04 95 1a 0e 78 0a 68 d0 93 58 56 93 27
1b 50 54 00 00 00 01 01 01 01 01 01 01 01 01 01
01 01 01 01 01 01 b9 1d 56 c8 50 00 2a 30 28 20
3c 00 00 90 10 00 00 18 c8 17 56 c8 50 00 2a 30
28 20 3c 00 00 90 10 00 00 19 00 00 00 fe 00 31
4a 43 4b 57 80 31 31 36 4e 57 52 36 00 00 00 00
00 00 41 31 16 00 10 00 00 09 01 0a 20 20 00 ce

00 ff ff ff ff ff ff 00 26 cf 8e 04 00 00 00 00
00 1e 01 04 95 1a 0e 78 0a 68 d0 93 58 56 93 27
1b 50 54 00 00 00 01 01 01 01 01 01 01 01 01 01
01 01 01 01 01 01 b9 1d 56 c8 50 00 2a 30 28 20
3c 00 00 90 10 00 00 18 c8 17 56 c8 50 00 2a 30
28 20 3c 00 00 90 10 00 00 19 00 00 00 fe 00 31
4a 43 4b 57 80 31 31 36 4e 57 52 36 00 00 00 00
00 00 41 31 16 00 10 00 00 09 01 0a 20 20 00 ce

----------------

Block 0, Base EDID:
  EDID Structure Version & Revision: 1.4
  Vendor & Product Identification:
    Manufacturer: IVO
    Model: 1166
    Made in: 2020
  Basic Display Parameters & Features:
    Digital display
    Bits per primary color channel: 6
    DisplayPort interface
    Maximum image size: 26 cm x 14 cm
    Gamma: 2.20
    Supported color formats: RGB 4:4:4, YCrCb 4:4:4
    First detailed timing includes the native pixel format and preferred refresh rate
  Color Characteristics:
    Red  : 0.5751, 0.3457
    Green: 0.3378, 0.5742
    Blue : 0.1552, 0.1064
    White: 0.3125, 0.3281
  Established Timings I & II: none
  Standard Timings: none
  Detailed Timing Descriptors:
    DTD 1:  1366x768    59.986125 Hz 683:384   48.589 kHz     76.090000 MHz (256 mm x 144 mm)
                 Hfront   40 Hsync  32 Hback  128 Hpol N
                 Vfront    3 Vsync  12 Vback   27 Vpol N
    DTD 2:  1366x768    47.995207 Hz 683:384   38.876 kHz     60.880000 MHz (256 mm x 144 mm)
                 Hfront   40 Hsync  32 Hback  128 Hpol N
                 Vfront    3 Vsync  12 Vback   27 Vpol N
    Alphanumeric Data String: '1JCKW.116NWR6'
    Manufacturer-Specified Display Descriptor (0x00): 00 00 00 00 41 31 16 00 10 00 00 09 01 0a 20 20 '....A1........  '
Checksum: 0xce

----------------

Block 1, Unknown EDID Extension Block 0x00:
  00 ff ff ff ff ff ff 00 26 cf 8e 04 00 00 00 00 '........&.......'
  00 1e 01 04 95 1a 0e 78 0a 68 d0 93 58 56 93 27 '.......x.h..XV.''
  1b 50 54 00 00 00 01 01 01 01 01 01 01 01 01 01 '.PT.............'
  01 01 01 01 01 01 b9 1d 56 c8 50 00 2a 30 28 20 '........V.P.*0( '
  3c 00 00 90 10 00 00 18 c8 17 56 c8 50 00 2a 30 '<.........V.P.*0'
  28 20 3c 00 00 90 10 00 00 19 00 00 00 fe 00 31 '( <............1'
  4a 43 4b 57 80 31 31 36 4e 57 52 36 00 00 00 00 'JCKW.116NWR6....'
  00 00 41 31 16 00 10 00 00 09 01 0a 20 20 00 ce '..A1........  ..'
Checksum: 0xce

----------------

Warnings:

Block 0, Base EDID:
  Alphanumeric Data String: Non-ASCII character 0x80 at position 5, can cause problems.
  Missing Display Product Name.

Failures:

Block 1, Base EDID:
  Unknown Extension Block.
EDID:
  Base EDID: EDID specified 0 extension block(s), but found 1 extension block(s).

EDID conformity: FAIL
