edid-decode (hex):

00 ff ff ff ff ff ff 00 26 cf 8e 04 00 00 00 00
00 1e 01 04 95 1a 0e 78 0a 68 d0 93 58 56 93 27
1b 50 54 00 00 00 01 01 01 01 01 01 01 01 01 01
01 01 01 01 01 01 d5 1c 56 a6 50 00 23 30 28 20
3c 00 00 90 10 00 00 19 11 17 56 a6 50 00 23 30
28 20 3c 00 00 90 10 00 00 19 00 00 00 fe 00 50
59 4e 58 59 80 31 31 36 4e 57 52 36 00 00 00 00
00 00 41 32 16 00 00 00 00 09 01 0a 20 20 00 82

----------------

Block 0, Base EDID:
  EDID Structure Version & Revision: 1.4
  Vendor & Product Identification:
    Manufacturer: IVO
    Model: 1166
    Made in: 2020
  Basic Display Parameters & Features:
    Digital display
    Bits per primary color channel: 6
    DisplayPort interface
    Maximum image size: 26 cm x 14 cm
    Gamma: 2.20
    Supported color formats: RGB 4:4:4, YCrCb 4:4:4
    First detailed timing includes the native pixel format and preferred refresh rate
  Color Characteristics:
    Red  : 0.5751, 0.3457
    Green: 0.3378, 0.5742
    Blue : 0.1552, 0.1064
    White: 0.3125, 0.3281
  Established Timings I & II: none
  Standard Timings: none
  Detailed Timing Descriptors:
    DTD 1:  1366x768    59.998569 Hz 683:384   48.179 kHz     73.810000 MHz (256 mm x 144 mm)
                 Hfront   40 Hsync  32 Hback   94 Hpol N
                 Vfront    3 Vsync  12 Vback   20 Vpol N
    DTD 2:  1366x768    48.000481 Hz 683:384   38.544 kHz     59.050000 MHz (256 mm x 144 mm)
                 Hfront   40 Hsync  32 Hback   94 Hpol N
                 Vfront    3 Vsync  12 Vback   20 Vpol N
    Alphanumeric Data String: 'PYNXY.116NWR6'
    Manufacturer-Specified Display Descriptor (0x00): 00 00 00 00 41 32 16 00 00 00 00 09 01 0a 20 20 '....A2........  '
Checksum: 0x82

----------------

Warnings:

Block 0, Base EDID:
  Alphanumeric Data String: Non-ASCII character 0x80 at position 5, can cause problems.
  Missing Display Product Name.

EDID conformity: PASS
