edid-decode (hex):

00 ff ff ff ff ff ff 00 41 0c 2c 99 e3 c8 8b 01
24 09 01 01 6c 24 1b af e8 4f 22 a1 57 47 99 25
0f 48 4f a4 43 00 31 59 45 59 61 59 81 59 81 99
01 01 01 01 01 01 86 3d 00 c0 51 00 30 40 40 a0
13 00 68 0e 11 00 00 00 00 00 00 ff 00 20 54 59
20 20 32 35 39 33 38 31 34 37 00 00 00 fd 00 32
82 1e 5d 10 00 0a 20 20 20 20 20 20 00 00 00 fc
00 31 30 39 53 2c 31 39 43 2c 2c 4a 48 20 00 32

----------------

Block 0, Base EDID:
  EDID Structure Version & Revision: 1.1
  Vendor & Product Identification:
    Manufacturer: PHL
    Model: 39212
    Serial Number: ...
    Made in: week 36 of 1999
  Basic Display Parameters & Features:
    Analog display
    Signal Level Standard: 0.700 : 0.000 : 0.700 V p-p
    Blank level equals black level
    Sync: Separate Composite
    Maximum image size: 36 cm x 27 cm
    Gamma: 2.75
    DPMS levels: Standby Suspend Off
    RGB color display
  Color Characteristics:
    Red  : 0.6298, 0.3398
    Green: 0.2802, 0.6005
    Blue : 0.1445, 0.0605
    White: 0.2812, 0.3105
  Established Timings I & II:
    IBM     :   720x400    70.081663 Hz   9:5     31.467 kHz     28.320000 MHz
    DMT 0x04:   640x480    59.940476 Hz   4:3     31.469 kHz     25.175000 MHz
    DMT 0x06:   640x480    75.000000 Hz   4:3     37.500 kHz     31.500000 MHz
    DMT 0x0b:   800x600    75.000000 Hz   4:3     46.875 kHz     49.500000 MHz
    DMT 0x12:  1024x768    75.028582 Hz   4:3     60.023 kHz     78.750000 MHz
    DMT 0x24:  1280x1024   75.024675 Hz   5:4     79.976 kHz    135.000000 MHz
  Standard Timings:
    DMT 0x07:   640x480    85.008312 Hz   4:3     43.269 kHz     36.000000 MHz
    DMT 0x0c:   800x600    85.061274 Hz   4:3     53.674 kHz     56.250000 MHz
    DMT 0x13:  1024x768    84.996690 Hz   4:3     68.677 kHz     94.500000 MHz
    DMT 0x21:  1280x960    85.002473 Hz   4:3     85.938 kHz    148.500000 MHz
    DMT 0x25:  1280x1024   85.024098 Hz   5:4     91.146 kHz    157.500000 MHz
  Detailed Timing Descriptors:
    DTD 1:  1280x1024   85.024098 Hz   5:4     91.146 kHz    157.500000 MHz (analog composite, sync-on-green, 360 mm x 270 mm)
                 Hfront   64 Hsync 160 Hback  224 Hpol N
                 Vfront    1 Vsync   3 Vback   44 Vpol N
    Display Product Serial Number: ...
    Display Range Limits:
      Monitor ranges (GTF): 50-130 Hz V, 30-93 kHz H, max dotclock 160 MHz
    Display Product Name: '109S,19C,,JH '
Checksum: 0x32

----------------

Warnings:

Block 0, Base EDID:
  EDID Structure Version & Revision: EDID 1.1 is deprecated, do not use.
  Detailed Timing Descriptor #1: DTD is similar but not identical to DMT 0x25.
  Detailed Timing Descriptor #1: Image size is 360x270 mm, but based on the picture AR it should be 360x288 mm.

Failures:

Block 0, Base EDID:
  Display Product Name: No newline, but one or more trailing spaces.

EDID conformity: FAIL
