edid-decode (hex):

00 ff ff ff ff ff ff 00 42 93 b9 00 01 01 01 01
0a 14 01 03 08 29 17 89 2a 0e 85 a3 55 48 98 27
15 50 54 a1 08 10 01 01 01 01 01 01 01 01 01 01
01 01 01 01 01 01 66 21 56 b0 51 00 1b 30 40 70
36 00 9a e6 10 00 00 1e 00 00 00 fd 00 3b 47 1e
31 09 00 0a 20 20 20 20 20 20 00 00 00 fc 00 50
72 6f 76 69 65 77 20 54 56 0a 20 20 00 00 00 ff
00 31 4b 59 42 31 30 33 30 30 38 37 31 30 00 0f

00 ff ff ff ff ff ff 00 42 93 b9 00 01 01 01 01
0a 14 01 03 08 29 17 89 2a 0e 85 a3 55 48 98 27
15 50 54 a1 08 10 01 01 01 01 01 01 01 01 01 01
01 01 01 01 01 01 66 21 56 b0 51 00 1b 30 40 70
36 00 9a e6 10 00 00 1e 00 00 00 fd 00 3b 47 1e
31 09 00 0a 20 20 20 20 20 20 00 00 00 fc 00 50
72 6f 76 69 65 77 20 54 56 0a 20 20 00 00 00 ff
00 31 4b 59 42 31 30 33 30 30 38 37 31 30 00 0f

----------------

Block 0, Base EDID:
  EDID Structure Version & Revision: 1.3
  Vendor & Product Identification:
    Manufacturer: PTS
    Model: 185
    Serial Number: ...
    Made in: week 10 of 2010
  Basic Display Parameters & Features:
    Analog display
    Signal Level Standard: 0.700 : 0.300 : 1.000 V p-p
    Blank level equals black level
    Sync: Separate
    Maximum image size: 41 cm x 23 cm
    Gamma: 2.37
    DPMS levels: Off
    RGB color display
    First detailed timing is the preferred timing
  Color Characteristics:
    Red  : 0.6367, 0.3320
    Green: 0.2841, 0.5957
    Blue : 0.1542, 0.0820
    White: 0.3134, 0.3291
  Established Timings I & II:
    IBM     :   720x400    70.081663 Hz   9:5     31.467 kHz     28.320000 MHz
    DMT 0x04:   640x480    59.940476 Hz   4:3     31.469 kHz     25.175000 MHz
    DMT 0x09:   800x600    60.316541 Hz   4:3     37.879 kHz     40.000000 MHz
    DMT 0x10:  1024x768    60.003840 Hz   4:3     48.363 kHz     65.000000 MHz
  Standard Timings: none
  Detailed Timing Descriptors:
    DTD 1:  1366x768    59.814889 Hz 683:384   47.553 kHz     85.500000 MHz (410 mm x 230 mm)
                 Hfront   64 Hsync 112 Hback  256 Hpol P
                 Vfront    3 Vsync   6 Vback   18 Vpol P
    Display Range Limits:
      Monitor ranges (GTF): 59-71 Hz V, 30-49 kHz H, max dotclock 90 MHz
    Display Product Name: 'Proview TV'
    Display Product Serial Number: ...
Checksum: 0x0f

----------------

Warnings:

Block 0, Base EDID:
  Vendor & Product Identification: The serial number is one of the known dummy values, it should probably be set to 0.

Failures:

EDID:
  Extension Block 1 started with EDID header, ignoring Extension Blocks >= 1.

EDID conformity: FAIL
