edid-decode (hex):

00 ff ff ff ff ff ff 00 4c f4 80 23 01 00 00 00
0d 20 01 03 00 34 1f 78 ea c9 05 a3 57 4b 9c 25
12 50 54 2d ce 00 95 00 61 40 01 01 81 80 95 00
01 01 01 01 01 01 9a 29 a0 d0 51 84 22 30 50 98
36 00 0f 28 21 00 00 1e 7f 21 56 aa 51 00 1e 30
46 8f 33 00 58 2c 21 00 00 1c 00 00 00 ff 00 30
30 30 30 30 31 0a 20 20 20 20 20 20 00 00 00 fc
00 59 53 44 0a 20 20 20 20 20 20 20 20 20 00 ed

00 ff ff ff ff ff ff 00 4c f4 80 23 01 00 00 00
0d 20 01 03 00 34 1f 78 ea c9 05 a3 57 4b 9c 25
12 50 54 2d ce 00 95 00 61 40 01 01 81 80 95 00
01 01 01 01 01 01 9a 29 a0 d0 51 84 22 30 50 98
36 00 0f 28 21 00 00 1e 7f 21 56 aa 51 00 1e 30
46 8f 33 00 58 2c 21 00 00 1c 00 00 00 ff 00 30
30 30 30 30 31 0a 20 20 20 20 20 20 00 00 00 fc
00 59 53 44 0a 20 20 20 20 20 20 20 20 20 00 ed

----------------

Block 0, Base EDID:
  EDID Structure Version & Revision: 1.3
  Vendor & Product Identification:
    Manufacturer: SGT
    Model: 9088
    Serial Number: ...
    Made in: week 13 of 2022
  Basic Display Parameters & Features:
    Analog display
    Signal Level Standard: 0.700 : 0.300 : 1.000 V p-p
    Blank level equals black level
    Maximum image size: 52 cm x 31 cm
    Gamma: 2.20
    DPMS levels: Standby Suspend Off
    RGB color display
    First detailed timing is the preferred timing
  Color Characteristics:
    Red  : 0.6396, 0.3398
    Green: 0.2949, 0.6103
    Blue : 0.1445, 0.0703
    White: 0.3134, 0.3291
  Established Timings I & II:
    DMT 0x04:   640x480    59.940476 Hz   4:3     31.469 kHz     25.175000 MHz
    DMT 0x05:   640x480    72.808802 Hz   4:3     37.861 kHz     31.500000 MHz
    DMT 0x06:   640x480    75.000000 Hz   4:3     37.500 kHz     31.500000 MHz
    DMT 0x09:   800x600    60.316541 Hz   4:3     37.879 kHz     40.000000 MHz
    DMT 0x0a:   800x600    72.187572 Hz   4:3     48.077 kHz     50.000000 MHz
    DMT 0x0b:   800x600    75.000000 Hz   4:3     46.875 kHz     49.500000 MHz
    DMT 0x10:  1024x768    60.003840 Hz   4:3     48.363 kHz     65.000000 MHz
    DMT 0x11:  1024x768    70.069359 Hz   4:3     56.476 kHz     75.000000 MHz
    DMT 0x12:  1024x768    75.028582 Hz   4:3     60.023 kHz     78.750000 MHz
  Standard Timings:
    DMT 0x2f:  1440x900    59.887445 Hz  16:10    55.935 kHz    106.500000 MHz
    DMT 0x10:  1024x768    60.003840 Hz   4:3     48.363 kHz     65.000000 MHz
    DMT 0x23:  1280x1024   60.019740 Hz   5:4     63.981 kHz    108.000000 MHz
    DMT 0x2f:  1440x900    59.887445 Hz  16:10    55.935 kHz    106.500000 MHz
  Detailed Timing Descriptors:
    DTD 1:  1440x900    59.887445 Hz  16:10    55.935 kHz    106.500000 MHz (527 mm x 296 mm)
                 Hfront   80 Hsync 152 Hback  232 Hpol P
                 Vfront    3 Vsync   6 Vback   25 Vpol P
    DTD 2:  1366x768    59.964364 Hz 683:384   47.852 kHz     85.750000 MHz (600 mm x 300 mm)
                 Hfront   70 Hsync 143 Hback  213 Hpol N
                 Vfront    3 Vsync   3 Vback   24 Vpol P
    Display Product Serial Number: ...
    Display Product Name: 'YSD'
Checksum: 0xed

----------------

Block 1, Unknown EDID Extension Block 0x00:
  00 ff ff ff ff ff ff 00 4c f4 80 23 01 00 00 00 '........L..#....'
  0d 20 01 03 00 34 1f 78 ea c9 05 a3 57 4b 9c 25 '. ...4.x....WK.%'
  12 50 54 2d ce 00 95 00 61 40 01 01 81 80 95 00 '.PT-....a@......'
  01 01 01 01 01 01 9a 29 a0 d0 51 84 22 30 50 98 '.......)..Q."0P.'
  36 00 0f 28 21 00 00 1e 7f 21 56 aa 51 00 1e 30 '6..(!....!V.Q..0'
  46 8f 33 00 58 2c 21 00 00 1c 00 00 00 ff 00 30 'F.3.X,!........0'
  30 30 30 30 31 0a 20 20 20 20 20 20 00 00 00 fc '00001.      ....'
  00 59 53 44 0a 20 20 20 20 20 20 20 20 20 00 ed '.YSD.         ..'
Checksum: 0xed

----------------

Warnings:

Block 0, Base EDID:
  Vendor & Product Identification: The serial number is one of the known dummy values, it should probably be set to 0.
  Detailed Timing Descriptor #1: DTD is similar but not identical to DMT 0x2f.
  Detailed Timing Descriptor #1: Image size is 527x296 mm, but based on the picture AR it should be 527x329 mm.
  Detailed Timing Descriptor #2: Image size is 600x300 mm, but based on the picture AR it should be 600x337 mm.
  Display Product Serial Number: ...

Failures:

Block 0, Base EDID:
  Detailed Timing Descriptor #2: Mismatch of image size 600x300 mm vs display size 520x310 mm.
  Missing Display Range Limits Descriptor.
Block 1, Base EDID:
  Unknown Extension Block.
EDID:
  Base EDID: The DTD max image size is 600x300mm, which is larger than the display size 520.0x310.0mm.
  Base EDID: EDID specified 0 extension block(s), but found 1 extension block(s).

EDID conformity: FAIL
