edid-decode (hex):

00 ff ff ff ff ff ff 00 22 0e 4c 37 00 00 00 00
0a 20 01 04 b5 3c 22 78 3b 38 00 ac 50 46 ab 25
0e 50 54 a1 08 00 d1 c0 a9 c0 d1 00 b3 00 95 00
a9 40 81 80 01 01 4d d0 00 a0 f0 70 3e 80 30 20
35 00 55 50 21 00 00 1a 00 00 00 fd 0c 30 90 51
51 86 01 0a 20 20 20 20 20 20 00 00 00 fc 00 4f
4d 45 4e 20 32 37 75 0a 20 20 20 20 00 00 00 ff
00 33 43 51 32 31 30 30 32 33 4e 0a 20 20 02 83

02 03 3d f1 51 76 75 61 60 5f 5e 5d 3f 10 1f 04
13 12 03 11 02 01 23 09 07 07 83 01 00 00 e2 0f
0f e6 06 05 01 66 66 20 e3 05 df 00 6d 1a 00 00
02 0b 30 90 00 04 66 20 66 35 e2 00 eb a3 66 00
a0 f0 70 1f 80 30 20 35 00 55 50 21 00 00 1a 00
00 00 00 00 00 00 00 00 00 00 00 00 00 00 00 00
00 00 00 00 00 00 00 00 00 00 00 00 00 00 00 00
00 00 00 00 00 00 00 00 00 00 00 00 00 00 00 52

70 12 79 03 00 03 00 64 9a 08 02 04 ff 0e 9f 00
2f 80 1f 00 6f 08 99 00 02 00 04 00 ce ac 01 04
ff 0e 9f 00 2f 80 1f 00 6f 08 7e 00 02 00 04 00
6e c2 00 04 ff 09 9f 00 2f 80 1f 00 9f 05 54 00
02 00 04 00 59 a0 00 04 ff 09 9f 00 2f 80 1f 00
9f 05 45 00 02 00 04 00 55 5e 00 04 ff 09 9f 00
2f 80 1f 00 9f 05 28 00 02 00 04 00 07 00 0a 08
81 00 0c 44 60 00 02 18 08 00 00 00 00 00 6d 90

00 ff ff ff ff ff ff 00 22 0e 4c 37 00 00 00 00
0a 20 01 04 b5 3c 22 78 3b 38 00 ac 50 46 ab 25
0e 50 54 a1 08 00 d1 c0 a9 c0 d1 00 b3 00 95 00
a9 40 81 80 01 01 4d d0 00 a0 f0 70 3e 80 30 20
35 00 55 50 21 00 00 1a 00 00 00 fd 0c 30 90 51
51 86 01 0a 20 20 20 20 20 20 00 00 00 fc 00 4f
4d 45 4e 20 32 37 75 0a 20 20 20 20 00 00 00 ff
00 33 43 51 32 31 30 30 32 33 4e 0a 20 20 02 83

02 03 3d f1 51 76 75 61 60 5f 5e 5d 3f 10 1f 04
13 12 03 11 02 01 23 09 07 07 83 01 00 00 e2 0f
0f e6 06 05 01 66 66 20 e3 05 df 00 6d 1a 00 00
02 0b 30 90 00 04 66 20 66 35 e2 00 eb a3 66 00
a0 f0 70 1f 80 30 20 35 00 55 50 21 00 00 1a 00
00 00 00 00 00 00 00 00 00 00 00 00 00 00 00 00
00 00 00 00 00 00 00 00 00 00 00 00 00 00 00 00
00 00 00 00 00 00 00 00 00 00 00 00 00 00 00 52

70 12 79 03 00 03 00 64 9a 08 02 04 ff 0e 9f 00
2f 80 1f 00 6f 08 99 00 02 00 04 00 ce ac 01 04
ff 0e 9f 00 2f 80 1f 00 6f 08 7e 00 02 00 04 00
6e c2 00 04 ff 09 9f 00 2f 80 1f 00 9f 05 54 00
02 00 04 00 59 a0 00 04 ff 09 9f 00 2f 80 1f 00
9f 05 45 00 02 00 04 00 55 5e 00 04 ff 09 9f 00
2f 80 1f 00 9f 05 28 00 02 00 04 00 07 00 0a 08
81 00 0c 44 60 00 02 18 08 00 00 00 00 00 6d 90

----------------

Block 0, Base EDID:
  EDID Structure Version & Revision: 1.4
  Vendor & Product Identification:
    Manufacturer: HPN
    Model: 14156
    Made in: week 10 of 2022
  Basic Display Parameters & Features:
    Digital display
    Bits per primary color channel: 10
    DisplayPort interface
    Maximum image size: 60 cm x 34 cm
    Gamma: 2.20
    DPMS levels: Off
    Supported color formats: RGB 4:4:4, YCrCb 4:4:4, YCrCb 4:2:2
    First detailed timing includes the native pixel format and preferred refresh rate
    Display supports continuous frequencies
  Color Characteristics:
    Red  : 0.6718, 0.3154
    Green: 0.2753, 0.6679
    Blue : 0.1445, 0.0546
    White: 0.3125, 0.3281
  Established Timings I & II:
    IBM     :   720x400    70.081663 Hz   9:5     31.467 kHz     28.320000 MHz
    DMT 0x04:   640x480    59.940476 Hz   4:3     31.469 kHz     25.175000 MHz
    DMT 0x09:   800x600    60.316541 Hz   4:3     37.879 kHz     40.000000 MHz
    DMT 0x10:  1024x768    60.003840 Hz   4:3     48.363 kHz     65.000000 MHz
  Standard Timings:
    DMT 0x52:  1920x1080   60.000000 Hz  16:9     67.500 kHz    148.500000 MHz
    DMT 0x53:  1600x900    60.000000 Hz  16:9     60.000 kHz    108.000000 MHz (RB)
    DMT 0x45:  1920x1200   59.884600 Hz  16:10    74.556 kHz    193.250000 MHz
    DMT 0x3a:  1680x1050   59.954250 Hz  16:10    65.290 kHz    146.250000 MHz
    DMT 0x2f:  1440x900    59.887445 Hz  16:10    55.935 kHz    106.500000 MHz
    DMT 0x33:  1600x1200   60.000000 Hz   4:3     75.000 kHz    162.000000 MHz
    DMT 0x23:  1280x1024   60.019740 Hz   5:4     63.981 kHz    108.000000 MHz
  Detailed Timing Descriptors:
    DTD 1:  3840x2160   59.996625 Hz  16:9    133.312 kHz    533.250000 MHz (597 mm x 336 mm)
                 Hfront   48 Hsync  32 Hback   80 Hpol P
                 Vfront    3 Vsync   5 Vback   54 Vpol N
    Display Range Limits:
      Monitor ranges (Range Limits Only): 48-144 Hz V, 336-336 kHz H, max dotclock 1340 MHz
    Display Product Name: 'OMEN 27u'
    Display Product Serial Number: ...
  Extension blocks: 2
Checksum: 0x83

----------------

Block 1, CTA-861 Extension Block:
  Revision: 3
  Underscans IT Video Formats by default
  Basic audio support
  Supports YCbCr 4:4:4
  Supports YCbCr 4:2:2
  Native DTDs: 1
  Video Data Block:
    VIC 118:  3840x2160  120.000000 Hz  16:9    270.000 kHz   1188.000000 MHz
    VIC 117:  3840x2160  100.000000 Hz  16:9    225.000 kHz   1188.000000 MHz
    VIC  97:  3840x2160   60.000000 Hz  16:9    135.000 kHz    594.000000 MHz
    VIC  96:  3840x2160   50.000000 Hz  16:9    112.500 kHz    594.000000 MHz
    VIC  95:  3840x2160   30.000000 Hz  16:9     67.500 kHz    297.000000 MHz
    VIC  94:  3840x2160   25.000000 Hz  16:9     56.250 kHz    297.000000 MHz
    VIC  93:  3840x2160   24.000000 Hz  16:9     54.000 kHz    297.000000 MHz
    VIC  63:  1920x1080  120.000000 Hz  16:9    135.000 kHz    297.000000 MHz
    VIC  16:  1920x1080   60.000000 Hz  16:9     67.500 kHz    148.500000 MHz
    VIC  31:  1920x1080   50.000000 Hz  16:9     56.250 kHz    148.500000 MHz
    VIC   4:  1280x720    60.000000 Hz  16:9     45.000 kHz     74.250000 MHz
    VIC  19:  1280x720    50.000000 Hz  16:9     37.500 kHz     74.250000 MHz
    VIC  18:   720x576    50.000000 Hz  16:9     31.250 kHz     27.000000 MHz
    VIC   3:   720x480    59.940060 Hz  16:9     31.469 kHz     27.000000 MHz
    VIC  17:   720x576    50.000000 Hz   4:3     31.250 kHz     27.000000 MHz
    VIC   2:   720x480    59.940060 Hz   4:3     31.469 kHz     27.000000 MHz
    VIC   1:   640x480    59.940476 Hz   4:3     31.469 kHz     25.175000 MHz
  Audio Data Block:
    Linear PCM:
      Max channels: 2
      Supported sample rates (kHz): 48 44.1 32
      Supported sample sizes (bits): 24 20 16
  Speaker Allocation Data Block:
    FL/FR - Front Left/Right
  YCbCr 4:2:0 Capability Map Data Block:
    VIC 118:  3840x2160  120.000000 Hz  16:9    270.000 kHz   1188.000000 MHz
    VIC 117:  3840x2160  100.000000 Hz  16:9    225.000 kHz   1188.000000 MHz
    VIC  97:  3840x2160   60.000000 Hz  16:9    135.000 kHz    594.000000 MHz
    VIC  96:  3840x2160   50.000000 Hz  16:9    112.500 kHz    594.000000 MHz
  HDR Static Metadata Data Block:
    Electro optical transfer functions:
      Traditional gamma - SDR luminance range
      SMPTE ST2084
    Supported static metadata descriptors:
      Static metadata type 1
    Desired content max luminance: 102 (455.515 cd/m^2)
    Desired content max frame-average luminance: 102 (455.515 cd/m^2)
    Desired content min luminance: 32 (0.072 cd/m^2)
  Colorimetry Data Block:
    xvYCC601
    xvYCC709
    sYCC601
    opYCC601
    opRGB
    BT2020YCC
    BT2020RGB
  Vendor-Specific Data Block (AMD), OUI 00-00-1A:
    Version: 2
    Feature Caps: 0x0b
      Local Dimming Supported
    Minimum Refresh Rate: 48 Hz
    Maximum Refresh Rate: 144 Hz
    Flags 1.x: 0x00
    Flags 2.x: 0x04
      ST 2084 (PQ) EOTF Supported
      Linear EOTF (Windows scRGB, 0.0 - 125.0) Supported
      Gamma 2.2 EOTF Supported
      BT.2020 Gamut Supported
    Maximum luminance: 102 (455.515 cd/m^2)
    Minimum luminance: 32 (0.072 cd/m^2)
    Maximum luminance (without local dimming): 102 (455.515 cd/m^2)
    Minimum luminance (without local dimming): 53 (0.197 cd/m^2)
  Video Capability Data Block:
    YCbCr quantization: Selectable (via AVI YQ)
    RGB quantization: Selectable (via AVI Q)
    PT scan behavior: Always Underscanned
    IT scan behavior: Always Underscanned
    CE scan behavior: Supports both over- and underscan
  Detailed Timing Descriptors:
    DTD 2:  3840x2160   29.980602 Hz  16:9     65.688 kHz    262.750000 MHz (597 mm x 336 mm)
                 Hfront   48 Hsync  32 Hback   80 Hpol P
                 Vfront    3 Vsync   5 Vback   23 Vpol N
Checksum: 0x52  Unused space in Extension Block: 48 bytes

----------------

Block 2, DisplayID Extension Block:
  Version: 1.2
  Extension Count: 0
  Display Product Type: Standalone display device
  Video Timing Modes Type 1 - Detailed Timings Data Block:
    DTD:  3840x2160  143.987684 Hz  16:9    333.188 kHz   1332.750000 MHz (aspect 16:9, no 3D stereo)
               Hfront   48 Hsync  32 Hback   80 Hpol P
               Vfront    3 Vsync   5 Vback  146 Vpol N
    DTD:  3840x2160  119.998907 Hz  16:9    274.438 kHz   1097.750000 MHz (aspect 16:9, no 3D stereo)
               Hfront   48 Hsync  32 Hback   80 Hpol P
               Vfront    3 Vsync   5 Vback  119 Vpol N
    DTD:  2560x1440  119.997589 Hz  16:9    182.996 kHz    497.750000 MHz (aspect 16:9, no 3D stereo)
               Hfront   48 Hsync  32 Hback   80 Hpol P
               Vfront    3 Vsync   5 Vback   77 Vpol N
    DTD:  2560x1440   99.946436 Hz  16:9    150.919 kHz    410.500000 MHz (aspect 16:9, no 3D stereo)
               Hfront   48 Hsync  32 Hback   80 Hpol P
               Vfront    3 Vsync   5 Vback   62 Vpol N
    DTD:  2560x1440   59.950550 Hz  16:9     88.787 kHz    241.500000 MHz (aspect 16:9, no 3D stereo)
               Hfront   48 Hsync  32 Hback   80 Hpol P
               Vfront    3 Vsync   5 Vback   33 Vpol N
  Supported Timing Modes Type 1 - VESA DMT Timings Data Block:
    DMT 0x04:   640x480    59.940476 Hz   4:3     31.469 kHz     25.175000 MHz
    DMT 0x09:   800x600    60.316541 Hz   4:3     37.879 kHz     40.000000 MHz
    DMT 0x10:  1024x768    60.003840 Hz   4:3     48.363 kHz     65.000000 MHz
    DMT 0x1b:  1280x800    59.909545 Hz  16:10    49.306 kHz     71.000000 MHz (RB)
    DMT 0x1c:  1280x800    59.810326 Hz  16:10    49.702 kHz     83.500000 MHz
    DMT 0x23:  1280x1024   60.019740 Hz   5:4     63.981 kHz    108.000000 MHz
    DMT 0x27:  1360x768    60.015162 Hz  85:48    47.712 kHz     85.500000 MHz
    DMT 0x2e:  1440x900    59.901458 Hz  16:10    55.469 kHz     88.750000 MHz (RB)
    DMT 0x2f:  1440x900    59.887445 Hz  16:10    55.935 kHz    106.500000 MHz
    DMT 0x3a:  1680x1050   59.954250 Hz  16:10    65.290 kHz    146.250000 MHz
    DMT 0x44:  1920x1200   59.950171 Hz  16:10    74.038 kHz    154.000000 MHz (RB)
    DMT 0x45:  1920x1200   59.884600 Hz  16:10    74.556 kHz    193.250000 MHz
    DMT 0x4c:  2560x1600   59.971589 Hz  16:10    98.713 kHz    268.500000 MHz (RB)
  Checksum: 0x6d
Checksum: 0x90

----------------

Warnings:

Block 1, CTA-861 Extension Block:
  Video Data Block: VIC 118 and the first DTD are not identical. Is this intended?
  Colorimetry Data Block: Set the sRGB colorimetry bit to avoid interop issues.
EDID:
  Base EDID: Some timings are out of range of the Monitor Ranges:
    Vertical Freq: 24.000 - 143.988 Hz (Monitor: 48.000 - 144.000 Hz)
    Horizontal Freq: 31.250 - 333.187 kHz (Monitor: 336.000 - 336.000 kHz)

Failures:

EDID:
  Extension Block 3 started with EDID header, ignoring Extension Blocks >= 3.
  DisplayID: Missing DisplayID Display Parameters Data Block.
  DisplayID: DisplayID expects at least one preferred timing.

EDID conformity: FAIL
