edid-decode (hex):

00 ff ff ff ff ff ff 00 0d ae 21 16 00 00 00 00
01 21 01 04 a5 22 16 78 03 28 65 97 59 54 8e 27
1e 50 54 00 00 00 01 01 01 01 01 01 01 01 01 01
01 01 01 01 01 01 1a 98 80 a0 70 b0 64 40 30 20
a6 00 58 d7 10 00 00 18 60 3f 80 a0 70 b0 64 40
30 20 a6 00 58 d7 10 00 00 18 00 00 00 fd 00 30
90 bc bc 27 01 0a 20 20 20 20 20 20 00 00 00 fe
00 4e 31 36 30 4a 4d 45 2d 47 54 4b 0a 20 00 67

00 ff ff ff ff ff ff 00 0d ae 21 16 00 00 00 00
01 21 01 04 a5 22 16 78 03 28 65 97 59 54 8e 27
1e 50 54 00 00 00 01 01 01 01 01 01 01 01 01 01
01 01 01 01 01 01 1a 98 80 a0 70 b0 64 40 30 20
a6 00 58 d7 10 00 00 18 60 3f 80 a0 70 b0 64 40
30 20 a6 00 58 d7 10 00 00 18 00 00 00 fd 00 30
90 bc bc 27 01 0a 20 20 20 20 20 20 00 00 00 fe
00 4e 31 36 30 4a 4d 45 2d 47 54 4b 0a 20 00 67

----------------

Block 0, Base EDID:
  EDID Structure Version & Revision: 1.4
  Vendor & Product Identification:
    Manufacturer: CMN
    Model: 5665
    Made in: week 1 of 2023
  Basic Display Parameters & Features:
    Digital display
    Bits per primary color channel: 8
    DisplayPort interface
    Maximum image size: 34 cm x 22 cm
    Gamma: 2.20
    Supported color formats: RGB 4:4:4
    First detailed timing includes the native pixel format and preferred refresh rate
    Display supports continuous frequencies
  Color Characteristics:
    Red  : 0.5898, 0.3496
    Green: 0.3300, 0.5546
    Blue : 0.1533, 0.1191
    White: 0.3134, 0.3291
  Established Timings I & II: none
  Standard Timings: none
  Detailed Timing Descriptors:
    DTD 1:  1920x1200  144.001479 Hz  16:10   187.202 kHz    389.380000 MHz (344 mm x 215 mm)
                 Hfront   48 Hsync  32 Hback   80 Hpol N
                 Vfront   10 Vsync   6 Vback   84 Vpol N
    DTD 2:  1920x1200   60.000000 Hz  16:10    78.000 kHz    162.240000 MHz (344 mm x 215 mm)
                 Hfront   48 Hsync  32 Hback   80 Hpol N
                 Vfront   10 Vsync   6 Vback   84 Vpol N
    Display Range Limits:
      Monitor ranges (Range Limits Only): 48-144 Hz V, 188-188 kHz H, max dotclock 390 MHz
    Alphanumeric Data String: 'N160JME-GTK'
Checksum: 0x67

----------------

Block 1, Unknown EDID Extension Block 0x00:
  00 ff ff ff ff ff ff 00 0d ae 21 16 00 00 00 00 '..........!.....'
  01 21 01 04 a5 22 16 78 03 28 65 97 59 54 8e 27 '.!...".x.(e.YT.''
  1e 50 54 00 00 00 01 01 01 01 01 01 01 01 01 01 '.PT.............'
  01 01 01 01 01 01 1a 98 80 a0 70 b0 64 40 30 20 '..........p.d@0 '
  a6 00 58 d7 10 00 00 18 60 3f 80 a0 70 b0 64 40 '..X.....`?..p.d@'
  30 20 a6 00 58 d7 10 00 00 18 00 00 00 fd 00 30 '0 ..X..........0'
  90 bc bc 27 01 0a 20 20 20 20 20 20 00 00 00 fe '...'..      ....'
  00 4e 31 36 30 4a 4d 45 2d 47 54 4b 0a 20 00 67 '.N160JME-GTK. .g'
Checksum: 0x67

----------------

Warnings:

Block 0, Base EDID:
  Missing Display Product Name.
EDID:
  Base EDID: Some timings are out of range of the Monitor Ranges:
    Horizontal Freq: 78.000 - 187.201 kHz (Monitor: 188.000 - 188.000 kHz)

Failures:

Block 1, Base EDID:
  Unknown Extension Block.
EDID:
  Base EDID: EDID specified 0 extension block(s), but found 1 extension block(s).

EDID conformity: FAIL
