edid-decode (hex):

00 ff ff ff ff ff ff 00 09 e5 23 06 00 00 00 00
01 1a 01 04 95 1a 0f 78 02 5d 40 94 5b 57 94 29
1c 50 54 00 00 00 01 01 01 01 01 01 01 01 01 01
01 01 01 01 01 01 64 1b 56 77 50 00 13 30 30 20
36 00 00 90 10 00 00 1a 70 17 56 8c 50 00 3e 30
30 20 36 00 00 90 10 00 00 1a 00 00 00 fe 00 46
56 33 34 46 80 4e 54 31 31 36 32 31 00 00 00 00
00 00 41 01 94 00 10 00 00 09 01 0a 20 20 00 03

----------------

Block 0, Base EDID:
  EDID Structure Version & Revision: 1.4
  Vendor & Product Identification:
    Manufacturer: BOE
    Model: 1571
    Made in: week 1 of 2016
  Basic Display Parameters & Features:
    Digital display
    Bits per primary color channel: 6
    DisplayPort interface
    Maximum image size: 26 cm x 15 cm
    Gamma: 2.20
    Supported color formats: RGB 4:4:4
    First detailed timing includes the native pixel format and preferred refresh rate
  Color Characteristics:
    Red  : 0.5791, 0.3564
    Green: 0.3427, 0.5791
    Blue : 0.1611, 0.1093
    White: 0.3125, 0.3281
  Established Timings I & II: none
  Standard Timings: none
  Detailed Timing Descriptors:
    DTD 1:  1366x768    59.998545 Hz 683:384   47.219 kHz     70.120000 MHz (256 mm x 144 mm)
                 Hfront   48 Hsync  32 Hback   39 Hpol P
                 Vfront    3 Vsync   6 Vback   10 Vpol N
    DTD 2:  1366x768    48.000768 Hz 683:384   39.841 kHz     60.000000 MHz (256 mm x 144 mm)
                 Hfront   48 Hsync  32 Hback   60 Hpol P
                 Vfront    3 Vsync   6 Vback   53 Vpol N
    Alphanumeric Data String: 'FV34F.NT11621'
    Manufacturer-Specified Display Descriptor (0x00): 00 00 00 00 41 01 94 00 10 00 00 09 01 0a 20 20 '....A.........  '
Checksum: 0x03

----------------

Warnings:

Block 0, Base EDID:
  Alphanumeric Data String: Non-ASCII character 0x80 at position 5, can cause problems.
  Missing Display Product Name.

EDID conformity: PASS
