edid-decode (hex):

00 ff ff ff ff ff ff 00 30 ae b7 41 00 00 00 00
00 22 01 04 a5 22 16 78 23 76 4c 9e 5c 58 95 27
24 52 59 00 00 00 01 01 01 01 01 01 01 01 01 01
01 01 01 01 01 01 61 40 80 04 71 b0 3c 40 30 20
36 00 58 d7 10 00 00 1a 00 00 00 fd 00 28 3c 4c
4c 10 01 0a 20 20 20 20 20 20 00 00 00 0f 00 d1
0a 28 d1 0a 28 28 0a 04 09 e5 37 0d 00 00 00 fc
00 4e 56 31 36 30 57 55 4d 2d 4e 34 45 0a 01 c1

70 20 79 02 00 81 00 15 74 1a 00 00 03 01 28 3c
00 00 00 00 00 00 3c 00 00 00 00 8d 00 00 00 00
00 00 00 00 00 00 00 00 00 00 00 00 00 00 00 00
00 00 00 00 00 00 00 00 00 00 00 00 00 00 00 00
00 00 00 00 00 00 00 00 00 00 00 00 00 00 00 00
00 00 00 00 00 00 00 00 00 00 00 00 00 00 00 00
00 00 00 00 00 00 00 00 00 00 00 00 00 00 00 00
00 00 00 00 00 00 00 00 00 00 00 00 00 00 10 90

00 ff ff ff ff ff ff 00 30 ae b7 41 00 00 00 00
00 22 01 04 a5 22 16 78 23 76 4c 9e 5c 58 95 27
24 52 59 00 00 00 01 01 01 01 01 01 01 01 01 01
01 01 01 01 01 01 61 40 80 04 71 b0 3c 40 30 20
36 00 58 d7 10 00 00 1a 00 00 00 fd 00 28 3c 4c
4c 10 01 0a 20 20 20 20 20 20 00 00 00 0f 00 d1
0a 28 d1 0a 28 28 0a 04 09 e5 37 0d 00 00 00 fc
00 4e 56 31 36 30 57 55 4d 2d 4e 34 45 0a 01 c1

70 20 79 02 00 81 00 15 74 1a 00 00 03 01 28 3c
00 00 00 00 00 00 3c 00 00 00 00 8d 00 00 00 00
00 00 00 00 00 00 00 00 00 00 00 00 00 00 00 00
00 00 00 00 00 00 00 00 00 00 00 00 00 00 00 00
00 00 00 00 00 00 00 00 00 00 00 00 00 00 00 00
00 00 00 00 00 00 00 00 00 00 00 00 00 00 00 00
00 00 00 00 00 00 00 00 00 00 00 00 00 00 00 00
00 00 00 00 00 00 00 00 00 00 00 00 00 00 10 90

----------------

Block 0, Base EDID:
  EDID Structure Version & Revision: 1.4
  Vendor & Product Identification:
    Manufacturer: LEN
    Model: 16823
    Made in: 2024
  Basic Display Parameters & Features:
    Digital display
    Bits per primary color channel: 8
    DisplayPort interface
    Maximum image size: 34 cm x 22 cm
    Gamma: 2.20
    DPMS levels: Off
    Supported color formats: RGB 4:4:4
    First detailed timing includes the native pixel format and preferred refresh rate
    Display supports continuous frequencies
  Color Characteristics:
    Red  : 0.6181, 0.3623
    Green: 0.3447, 0.5839
    Blue : 0.1533, 0.1406
    White: 0.3232, 0.3476
  Established Timings I & II: none
  Standard Timings: none
  Detailed Timing Descriptors:
    DTD 1:  1920x1200   60.000728 Hz  16:10    75.601 kHz    164.810000 MHz (344 mm x 215 mm)
                 Hfront   48 Hsync  32 Hback  180 Hpol P
                 Vfront    3 Vsync   6 Vback   51 Vpol N
    Display Range Limits:
      Monitor ranges (Range Limits Only): 40-60 Hz V, 76-76 kHz H, max dotclock 160 MHz
    Manufacturer-Specified Display Descriptor (0x0f): 00 0f 00 d1 0a 28 d1 0a 28 28 0a 04 09 e5 37 0d '.....(..((....7.'
    Display Product Name: 'NV160WUM-N4E'
  Extension blocks: 1
Checksum: 0xc1

----------------

Block 1, DisplayID Extension Block:
  Version: 2.0
  Extension Count: 0
  Display Product Primary Use Case: None of the listed primary use cases; generic display
  CTA-861 DisplayID Data Block:
  Vendor-Specific Data Block (AMD), OUI 00-00-1A:
    Version: 3
    Feature Caps: 0x01
    Minimum Refresh Rate: 40 Hz
    Maximum Refresh Rate: 60 Hz
    Flags 1.x: 0x00
    Flags 2.x: 0x00
  Checksum: 0x10
Checksum: 0x90

----------------

Warnings:

EDID:
  Base EDID: Some timings are out of range of the Monitor Ranges:
    Maximum Clock: 164.810 MHz (Monitor: 160.000 MHz)
    Could be due to a Monitor Range off-by-one rounding issue

Failures:

EDID:
  Extension Block 2 started with EDID header, ignoring Extension Blocks >= 2.
  DisplayID: Missing DisplayID Display Parameters Data Block.
  DisplayID: Missing DisplayID Type VII Detailed Timing Data Block.
  DisplayID: DisplayID expects at least one preferred timing.

EDID conformity: FAIL
