edid-decode (hex):

00 ff ff ff ff ff ff 00 06 af d2 31 00 00 00 00
01 13 01 03 90 16 0d 78 0a b9 a5 96 59 57 91 28
1f 50 54 00 00 00 01 01 01 01 01 01 01 01 01 01
01 01 01 01 01 01 e2 13 00 40 41 58 1c 20 18 88
31 00 df 7d 00 00 00 1a e2 13 00 40 41 58 1c 20
18 88 31 00 df 7d 00 00 00 1a 00 00 00 fe 00 59
47 33 33 33 80 42 31 30 31 41 57 33 00 00 00 00
00 00 00 00 00 00 00 00 00 01 01 0a 20 20 00 8d

----------------

Block 0, Base EDID:
  EDID Structure Version & Revision: 1.3
  Vendor & Product Identification:
    Manufacturer: AUO
    Model: 12754
    Made in: week 1 of 2009
  Basic Display Parameters & Features:
    Digital display
    Maximum image size: 22 cm x 13 cm
    Gamma: 2.20
    RGB color display
    First detailed timing is the preferred timing
  Color Characteristics:
    Red  : 0.5878, 0.3505
    Green: 0.3417, 0.5673
    Blue : 0.1582, 0.1230
    White: 0.3134, 0.3291
  Established Timings I & II: none
  Standard Timings: none
  Detailed Timing Descriptors:
    DTD 1:  1024x600    60.305770 Hz 128:75    37.872 kHz     50.900000 MHz (223 mm x 125 mm)
                 Hfront   24 Hsync 136 Hback  160 Hpol P
                 Vfront    3 Vsync   1 Vback   24 Vpol N
    DTD 2:  1024x600    60.305770 Hz 128:75    37.872 kHz     50.900000 MHz (223 mm x 125 mm)
                 Hfront   24 Hsync 136 Hback  160 Hpol P
                 Vfront    3 Vsync   1 Vback   24 Vpol N
    Alphanumeric Data String: 'YG333.B101AW3'
    Manufacturer-Specified Display Descriptor (0x00): 00 00 00 00 00 00 00 00 00 00 00 01 01 0a 20 20 '..............  '
Checksum: 0x8d

----------------

Warnings:

Block 0, Base EDID:
  Alphanumeric Data String: Non-ASCII character 0x80 at position 5, can cause problems.

Failures:

Block 0, Base EDID:
  Basic Display Parameters & Features: Digital Video Interface Standard set to reserved value 0x10.
  Missing Display Product Name.
  Missing Display Range Limits Descriptor.

EDID conformity: FAIL
