edid-decode (hex):

00 ff ff ff ff ff ff 00 09 e5 1b 0c 00 00 00 00
12 21 01 04 b5 1e 13 78 03 14 d5 ae 51 42 b2 24
0f 50 54 00 00 00 01 01 01 01 01 01 01 01 01 01
01 01 01 01 01 01 c0 d8 00 a0 a0 40 64 60 30 20
36 00 2e bc 10 00 00 1a 60 6c 00 a0 a0 40 64 60
30 20 36 00 2e bc 10 00 00 1a 00 00 00 fd 00 30
78 cc cc 37 01 0a 20 20 20 20 20 20 00 00 00 fe
00 4e 45 31 34 30 51 44 4d 2d 4e 58 35 0a 01 1b

02 03 22 00 e3 05 80 00 e6 06 05 01 6a 6a 43 72
1a 00 00 03 03 30 78 00 20 6a 43 6a 43 78 00 00
00 00 00 00 00 00 00 00 00 00 00 00 00 00 00 00
00 00 00 00 00 00 00 00 00 00 00 00 00 00 00 00
00 00 00 00 00 00 00 00 00 00 00 00 00 00 00 00
00 00 00 00 00 00 00 00 00 00 00 00 00 00 00 00
00 00 00 00 00 00 00 00 00 00 00 00 00 00 00 00
00 00 00 00 00 00 00 00 00 00 00 00 00 00 00 3c

00 ff ff ff ff ff ff 00 09 e5 1b 0c 00 00 00 00
12 21 01 04 b5 1e 13 78 03 14 d5 ae 51 42 b2 24
0f 50 54 00 00 00 01 01 01 01 01 01 01 01 01 01
01 01 01 01 01 01 c0 d8 00 a0 a0 40 64 60 30 20
36 00 2e bc 10 00 00 1a 60 6c 00 a0 a0 40 64 60
30 20 36 00 2e bc 10 00 00 1a 00 00 00 fd 00 30
78 cc cc 37 01 0a 20 20 20 20 20 20 00 00 00 fe
00 4e 45 31 34 30 51 44 4d 2d 4e 58 35 0a 01 1b

02 03 22 00 e3 05 80 00 e6 06 05 01 6a 6a 43 72
1a 00 00 03 03 30 78 00 20 6a 43 6a 43 78 00 00
00 00 00 00 00 00 00 00 00 00 00 00 00 00 00 00
00 00 00 00 00 00 00 00 00 00 00 00 00 00 00 00
00 00 00 00 00 00 00 00 00 00 00 00 00 00 00 00
00 00 00 00 00 00 00 00 00 00 00 00 00 00 00 00
00 00 00 00 00 00 00 00 00 00 00 00 00 00 00 00
00 00 00 00 00 00 00 00 00 00 00 00 00 00 00 3c

----------------

Block 0, Base EDID:
  EDID Structure Version & Revision: 1.4
  Vendor & Product Identification:
    Manufacturer: BOE
    Model: 3099
    Made in: week 18 of 2023
  Basic Display Parameters & Features:
    Digital display
    Bits per primary color channel: 10
    DisplayPort interface
    Maximum image size: 30 cm x 19 cm
    Gamma: 2.20
    Supported color formats: RGB 4:4:4
    First detailed timing includes the native pixel format and preferred refresh rate
    Display supports continuous frequencies
  Color Characteristics:
    Red  : 0.6796, 0.3173
    Green: 0.2587, 0.6953
    Blue : 0.1435, 0.0595
    White: 0.3134, 0.3291
  Established Timings I & II: none
  Standard Timings: none
  Detailed Timing Descriptors:
    DTD 1:  2560x1600  120.000000 Hz  16:10   204.000 kHz    554.880000 MHz (302 mm x 188 mm)
                 Hfront   48 Hsync  32 Hback   80 Hpol P
                 Vfront    3 Vsync   6 Vback   91 Vpol N
    DTD 2:  2560x1600   60.000000 Hz  16:10   102.000 kHz    277.440000 MHz (302 mm x 188 mm)
                 Hfront   48 Hsync  32 Hback   80 Hpol P
                 Vfront    3 Vsync   6 Vback   91 Vpol N
    Display Range Limits:
      Monitor ranges (Range Limits Only): 48-120 Hz V, 204-204 kHz H, max dotclock 550 MHz
    Alphanumeric Data String: 'NE140QDM-NX5'
  Extension blocks: 1
Checksum: 0x1b

----------------

Block 1, CTA-861 Extension Block:
  Revision: 3
  Native DTDs: 0
  Colorimetry Data Block:
    BT2020RGB
  HDR Static Metadata Data Block:
    Electro optical transfer functions:
      Traditional gamma - SDR luminance range
      SMPTE ST2084
    Supported static metadata descriptors:
      Static metadata type 1
    Desired content max luminance: 106 (496.743 cd/m^2)
    Desired content max frame-average luminance: 106 (496.743 cd/m^2)
    Desired content min luminance: 67 (0.343 cd/m^2)
  Vendor-Specific Data Block (AMD), OUI 00-00-1A:
    Version: 3
    Flags 1: 0x03
      FreeSync Supported
      FreeSync 2 HDR Supported
    Minimum Refresh Rate: 48 Hz
    Maximum Refresh Rate: 120 Hz
    Flags 5: 0x20
      ST 2084 (PQ) EOTF Supported
    Maximum luminance: 106 (496.743 cd/m^2)
    Minimum luminance: 67 (0.343 cd/m^2)
Checksum: 0x3c  Unused space in Extension Block: 93 bytes

----------------

Warnings:

Block 0, Base EDID:
  Missing Display Product Name.
Block 1, CTA-861 Extension Block:
  IT Video Formats are overscanned by default, but normally this should be underscanned.
  Colorimetry Data Block: Set the sRGB colorimetry bit to avoid interop issues.
EDID:
  Base EDID: Some timings are out of range of the Monitor Ranges:
    Horizontal Freq: 102.000 - 204.000 kHz (Monitor: 204.000 - 204.000 kHz)
    Maximum Clock: 554.880 MHz (Monitor: 550.000 MHz)

Failures:

Block 1, CTA-861 Extension Block:
  Required 640x480p60 timings are missing in the established timings and the SVD list (VIC 1).
  Missing VCDB, needed for Set Selectable RGB Quantization to avoid interop issues.
EDID:
  Extension Block 2 started with EDID header, ignoring Extension Blocks >= 2.

EDID conformity: FAIL
