edid-decode (hex):

00 ff ff ff ff ff ff 00 30 e4 88 02 00 00 00 00
00 13 01 03 90 26 15 78 0a 4c 95 9e 59 4f 99 26
1c 50 54 00 00 00 01 01 01 01 01 01 01 01 01 01
01 01 01 01 01 01 2f 26 40 b8 60 84 0c 30 30 30
23 00 7e d7 10 00 00 1a 2f 26 40 b8 60 84 0c 30
30 30 23 00 7e d7 10 00 00 1a 00 00 00 fe 00 38
34 46 47 50 14 31 37 33 57 44 31 0a 00 00 00 00
00 00 59 01 2d 01 00 00 00 02 01 0a 20 20 00 cf

----------------

Block 0, Base EDID:
  EDID Structure Version & Revision: 1.3
  Vendor & Product Identification:
    Manufacturer: LGD
    Model: 648
    Made in: 2009
  Basic Display Parameters & Features:
    Digital display
    Maximum image size: 38 cm x 21 cm
    Gamma: 2.20
    RGB color display
    First detailed timing is the preferred timing
  Color Characteristics:
    Red  : 0.6181, 0.3476
    Green: 0.3115, 0.5976
    Blue : 0.1503, 0.1103
    White: 0.3134, 0.3291
  Established Timings I & II: none
  Standard Timings: none
  Detailed Timing Descriptors:
    DTD 1:  1600x900    60.079606 Hz  16:9     54.793 kHz     97.750000 MHz (382 mm x 215 mm)
                 Hfront   48 Hsync  48 Hback   88 Hpol P
                 Vfront    2 Vsync   3 Vback    7 Vpol N
    DTD 2:  1600x900    60.079606 Hz  16:9     54.793 kHz     97.750000 MHz (382 mm x 215 mm)
                 Hfront   48 Hsync  48 Hback   88 Hpol P
                 Vfront    2 Vsync   3 Vback    7 Vpol N
    Alphanumeric Data String: '84FGP.173WD1'
    Manufacturer-Specified Display Descriptor (0x00): 00 00 00 00 59 01 2d 01 00 00 00 02 01 0a 20 20 '....Y.-.......  '
Checksum: 0xcf

----------------

Warnings:

Block 0, Base EDID:
  Alphanumeric Data String: Non-ASCII character 0x14 at position 5, can cause problems.

Failures:

Block 0, Base EDID:
  Basic Display Parameters & Features: Digital Video Interface Standard set to reserved value 0x10.
  Missing Display Product Name.
  Missing Display Range Limits Descriptor.

EDID conformity: FAIL
