edid-decode (hex):

00 ff ff ff ff ff ff 00 09 e5 00 04 26 09 18 20
01 1c 01 04 85 3c 22 78 3e a2 00 a8 55 4d a3 26
0b 50 54 a3 88 00 d1 c0 81 40 81 80 81 c0 95 00
b3 00 01 01 01 01 4d d0 00 a0 f0 70 3e 80 30 20
35 00 55 50 21 00 00 1a 00 00 00 fd 00 3b 46 1f
87 3c 00 0a 20 20 20 20 20 20 00 00 00 fc 00 5a
32 37 32 53 44 0a 20 20 20 20 20 20 00 00 00 fd
00 31 32 33 36 35 00 0a 20 20 20 20 20 20 00 ff

00 ff ff ff ff ff ff 00 09 e5 00 04 26 09 18 20
01 1c 01 04 85 3c 22 78 3e a2 00 a8 55 4d a3 26
0b 50 54 a3 88 00 d1 c0 81 40 81 80 81 c0 95 00
b3 00 01 01 01 01 4d d0 00 a0 f0 70 3e 80 30 20
35 00 55 50 21 00 00 1a 00 00 00 fd 00 3b 46 1f
87 3c 00 0a 20 20 20 20 20 20 00 00 00 fc 00 5a
32 37 32 53 44 0a 20 20 20 20 20 20 00 00 00 fd
00 31 32 33 36 35 00 0a 20 20 20 20 20 20 00 ff

----------------

Block 0, Base EDID:
  EDID Structure Version & Revision: 1.4
  Vendor & Product Identification:
    Manufacturer: BOE
    Model: 1024
    Serial Number: ...
    Made in: week 1 of 2018
  Basic Display Parameters & Features:
    Digital display
    Color depth is undefined
    DisplayPort interface
    Maximum image size: 60 cm x 34 cm
    Gamma: 2.20
    DPMS levels: Off
    Supported color formats: RGB 4:4:4, YCrCb 4:4:4, YCrCb 4:2:2
    Default (sRGB) color space is primary color space
    First detailed timing includes the native pixel format and preferred refresh rate
  Color Characteristics:
    Red  : 0.6582, 0.3339
    Green: 0.3007, 0.6386
    Blue : 0.1484, 0.0429
    White: 0.3125, 0.3281
  Established Timings I & II:
    IBM     :   720x400    70.081663 Hz   9:5     31.467 kHz     28.320000 MHz
    DMT 0x04:   640x480    59.940476 Hz   4:3     31.469 kHz     25.175000 MHz
    DMT 0x08:   800x600    56.250000 Hz   4:3     35.156 kHz     36.000000 MHz
    DMT 0x09:   800x600    60.316541 Hz   4:3     37.879 kHz     40.000000 MHz
    DMT 0x0a:   800x600    72.187572 Hz   4:3     48.077 kHz     50.000000 MHz
    DMT 0x10:  1024x768    60.003840 Hz   4:3     48.363 kHz     65.000000 MHz
  Standard Timings:
    DMT 0x52:  1920x1080   60.000000 Hz  16:9     67.500 kHz    148.500000 MHz
    DMT 0x20:  1280x960    60.000000 Hz   4:3     60.000 kHz    108.000000 MHz
    DMT 0x23:  1280x1024   60.019740 Hz   5:4     63.981 kHz    108.000000 MHz
    DMT 0x55:  1280x720    60.000000 Hz  16:9     45.000 kHz     74.250000 MHz
    DMT 0x2f:  1440x900    59.887445 Hz  16:10    55.935 kHz    106.500000 MHz
    DMT 0x3a:  1680x1050   59.954250 Hz  16:10    65.290 kHz    146.250000 MHz
  Detailed Timing Descriptors:
    DTD 1:  3840x2160   59.996625 Hz  16:9    133.312 kHz    533.250000 MHz (597 mm x 336 mm)
                 Hfront   48 Hsync  32 Hback   80 Hpol P
                 Vfront    3 Vsync   5 Vback   54 Vpol N
    Display Range Limits:
      Monitor ranges (GTF): 59-70 Hz V, 31-135 kHz H, max dotclock 600 MHz
    Display Product Name: 'Z272SD'
    Display Range Limits:
      Monitor ranges (GTF): 49-50 Hz V, 51-54 kHz H, max dotclock 530 MHz
Checksum: 0xff

----------------

Warnings:

Block 0, Base EDID:
  Display Range Limits: GTF support is deprecated in EDID 1.4.
  Display Range Limits: GTF support is deprecated in EDID 1.4.
EDID:
  Base EDID: Some timings are out of range of the Monitor Ranges:
    Vertical Freq: 56.250 - 72.188 Hz (Monitor: 49.000 - 50.000 Hz)
    Horizontal Freq: 31.466 - 133.312 kHz (Monitor: 51.000 - 54.000 kHz)
    Maximum Clock: 533.250 MHz (Monitor: 530.000 MHz)

Failures:

Block 0, Base EDID:
  Basic Display Parameters & Features: sRGB is signaled, but the chromaticities do not match.
  Display Range Limits: GTF is supported, but the display does not support continuous frequencies.
  Display Range Limits: GTF is supported, but the display does not support continuous frequencies.
EDID:
  Extension Block 1 started with EDID header, ignoring Extension Blocks >= 1.

EDID conformity: FAIL
