edid-decode (hex):

00 ff ff ff ff ff ff 00 22 0e 43 37 01 01 01 01
2c 21 01 03 80 2f 27 78 3a 60 15 af 4f 43 ab 25
0f 50 54 a1 08 00 d1 c0 a9 c0 d1 00 b3 00 81 00
95 00 a9 40 81 80 9a 8d 00 a0 a0 70 3e 80 30 20
3a 00 d1 88 11 00 00 1a 00 00 00 fd 00 32 47 0f
86 25 00 0a 20 20 20 20 20 20 00 00 00 fc 00 48
50 20 5a 34 30 63 20 47 33 0a 20 20 00 00 00 ff
00 43 4e 34 33 34 34 30 43 51 39 0a 20 20 01 22

02 03 32 f1 4f 10 04 03 02 1f 13 12 11 05 14 07
06 15 16 01 23 09 07 07 83 01 00 00 6a 03 0c 00
10 00 38 3c 20 00 00 67 d8 5d c4 01 4a 80 03 e2
00 eb 56 5e 00 a0 a0 a0 29 50 30 20 35 00 d1 88
11 00 00 1a e2 68 00 a0 a0 40 2e 60 30 20 36 00
d1 88 11 00 00 1a d3 45 00 a0 a0 70 1f 80 30 20
3a 00 d1 88 11 00 00 1a 00 00 00 00 00 00 00 00
00 00 00 00 00 00 00 00 00 00 00 00 00 00 00 06

00 ff ff ff ff ff ff 00 22 0e 43 37 01 01 01 01
2c 21 01 03 80 2f 27 78 3a 60 15 af 4f 43 ab 25
0f 50 54 a1 08 00 d1 c0 a9 c0 d1 00 b3 00 81 00
95 00 a9 40 81 80 9a 8d 00 a0 a0 70 3e 80 30 20
3a 00 d1 88 11 00 00 1a 00 00 00 fd 00 32 47 0f
86 25 00 0a 20 20 20 20 20 20 00 00 00 fc 00 48
50 20 5a 34 30 63 20 47 33 0a 20 20 00 00 00 ff
00 43 4e 34 33 34 34 30 43 51 39 0a 20 20 01 22

02 03 32 f1 4f 10 04 03 02 1f 13 12 11 05 14 07
06 15 16 01 23 09 07 07 83 01 00 00 6a 03 0c 00
10 00 38 3c 20 00 00 67 d8 5d c4 01 4a 80 03 e2
00 eb 56 5e 00 a0 a0 a0 29 50 30 20 35 00 d1 88
11 00 00 1a e2 68 00 a0 a0 40 2e 60 30 20 36 00
d1 88 11 00 00 1a d3 45 00 a0 a0 70 1f 80 30 20
3a 00 d1 88 11 00 00 1a 00 00 00 00 00 00 00 00
00 00 00 00 00 00 00 00 00 00 00 00 00 00 00 06

----------------

Block 0, Base EDID:
  EDID Structure Version & Revision: 1.3
  Vendor & Product Identification:
    Manufacturer: HPN
    Model: 14147
    Serial Number: ...
    Made in: week 44 of 2023
  Basic Display Parameters & Features:
    Digital display
    Maximum image size: 47 cm x 39 cm
    Gamma: 2.20
    DPMS levels: Off
    Undefined display color type
    First detailed timing is the preferred timing
  Color Characteristics:
    Red  : 0.6845, 0.3105
    Green: 0.2617, 0.6679
    Blue : 0.1445, 0.0595
    White: 0.3134, 0.3291
  Established Timings I & II:
    IBM     :   720x400    70.081663 Hz   9:5     31.467 kHz     28.320000 MHz
    DMT 0x04:   640x480    59.940476 Hz   4:3     31.469 kHz     25.175000 MHz
    DMT 0x09:   800x600    60.316541 Hz   4:3     37.879 kHz     40.000000 MHz
    DMT 0x10:  1024x768    60.003840 Hz   4:3     48.363 kHz     65.000000 MHz
  Standard Timings:
    DMT 0x52:  1920x1080   60.000000 Hz  16:9     67.500 kHz    148.500000 MHz
    DMT 0x53:  1600x900    60.000000 Hz  16:9     60.000 kHz    108.000000 MHz (RB)
    DMT 0x45:  1920x1200   59.884600 Hz  16:10    74.556 kHz    193.250000 MHz
    DMT 0x3a:  1680x1050   59.954250 Hz  16:10    65.290 kHz    146.250000 MHz
    DMT 0x1c:  1280x800    59.810326 Hz  16:10    49.702 kHz     83.500000 MHz
    DMT 0x2f:  1440x900    59.887445 Hz  16:10    55.935 kHz    106.500000 MHz
    DMT 0x33:  1600x1200   60.000000 Hz   4:3     75.000 kHz    162.000000 MHz
    DMT 0x23:  1280x1024   60.019740 Hz   5:4     63.981 kHz    108.000000 MHz
  Detailed Timing Descriptors:
    DTD 1:  2560x2160   59.978424 Hz  32:27   133.272 kHz    362.500000 MHz (465 mm x 392 mm)
                 Hfront   48 Hsync  32 Hback   80 Hpol P
                 Vfront    3 Vsync  10 Vback   49 Vpol N
    Display Range Limits:
      Monitor ranges (GTF): 50-71 Hz V, 15-134 kHz H, max dotclock 370 MHz
    Display Product Name: 'HP Z40c G3'
    Display Product Serial Number: ...
  Extension blocks: 1
Checksum: 0x22

----------------

Block 1, CTA-861 Extension Block:
  Revision: 3
  Underscans IT Video Formats by default
  Basic audio support
  Supports YCbCr 4:4:4
  Supports YCbCr 4:2:2
  Native DTDs: 1
  Video Data Block:
    VIC  16:  1920x1080   60.000000 Hz  16:9     67.500 kHz    148.500000 MHz
    VIC   4:  1280x720    60.000000 Hz  16:9     45.000 kHz     74.250000 MHz
    VIC   3:   720x480    59.940060 Hz  16:9     31.469 kHz     27.000000 MHz
    VIC   2:   720x480    59.940060 Hz   4:3     31.469 kHz     27.000000 MHz
    VIC  31:  1920x1080   50.000000 Hz  16:9     56.250 kHz    148.500000 MHz
    VIC  19:  1280x720    50.000000 Hz  16:9     37.500 kHz     74.250000 MHz
    VIC  18:   720x576    50.000000 Hz  16:9     31.250 kHz     27.000000 MHz
    VIC  17:   720x576    50.000000 Hz   4:3     31.250 kHz     27.000000 MHz
    VIC   5:  1920x1080i  60.000000 Hz  16:9     33.750 kHz     74.250000 MHz
    VIC  20:  1920x1080i  50.000000 Hz  16:9     28.125 kHz     74.250000 MHz
    VIC   7:  1440x480i   59.940060 Hz  16:9     15.734 kHz     27.000000 MHz
    VIC   6:  1440x480i   59.940060 Hz   4:3     15.734 kHz     27.000000 MHz
    VIC  21:  1440x576i   50.000000 Hz   4:3     15.625 kHz     27.000000 MHz
    VIC  22:  1440x576i   50.000000 Hz  16:9     15.625 kHz     27.000000 MHz
    VIC   1:   640x480    59.940476 Hz   4:3     31.469 kHz     25.175000 MHz
  Audio Data Block:
    Linear PCM:
      Max channels: 2
      Supported sample rates (kHz): 48 44.1 32
      Supported sample sizes (bits): 24 20 16
  Speaker Allocation Data Block:
    FL/FR - Front Left/Right
  Vendor-Specific Data Block (HDMI), OUI 00-0C-03:
    Source physical address: 1.0.0.0
    DC_36bit
    DC_30bit
    DC_Y444
    Maximum TMDS clock: 300 MHz
    Extended HDMI video details:
  Vendor-Specific Data Block (HDMI Forum), OUI C4-5D-D8:
    Version: 1
    Maximum TMDS Character Rate: 370 MHz
    SCDC Present
    Supports 12-bits/component Deep Color 4:2:0 Pixel Encoding
    Supports 10-bits/component Deep Color 4:2:0 Pixel Encoding
  Video Capability Data Block:
    YCbCr quantization: Selectable (via AVI YQ)
    RGB quantization: Selectable (via AVI Q)
    PT scan behavior: Always Underscanned
    IT scan behavior: Always Underscanned
    CE scan behavior: Supports both over- and underscan
  Detailed Timing Descriptors:
    DTD 2:  2560x1440   59.950550 Hz  16:9     88.787 kHz    241.500000 MHz (465 mm x 392 mm)
                 Hfront   48 Hsync  32 Hback   80 Hpol P
                 Vfront    3 Vsync   5 Vback   33 Vpol N
    DTD 3:  2560x1600   59.971589 Hz  16:10    98.713 kHz    268.500000 MHz (465 mm x 392 mm)
                 Hfront   48 Hsync  32 Hback   80 Hpol P
                 Vfront    3 Vsync   6 Vback   37 Vpol N
    DTD 4:  2560x2160   29.994026 Hz  32:27    65.717 kHz    178.750000 MHz (465 mm x 392 mm)
                 Hfront   48 Hsync  32 Hback   80 Hpol P
                 Vfront    3 Vsync  10 Vback   18 Vpol N
Checksum: 0x06  Unused space in Extension Block: 23 bytes

----------------

Warnings:

Block 0, Base EDID:
  Vendor & Product Identification: The serial number is one of the known dummy values, it should probably be set to 0.
Block 1, CTA-861 Extension Block:
  Video Data Block: VIC 16 and the first DTD are not identical. Is this intended?
  Detailed Timing Descriptor #2: Image size is 465x392 mm, but based on the picture AR it should be 465x261 mm.
  Detailed Timing Descriptor #3: Image size is 465x392 mm, but based on the picture AR it should be 465x290 mm.
  Display Product Serial Number is set, so the Serial Number in the Base EDID should be 0.
  Add a Colorimetry Data Block with the sRGB colorimetry bit set to avoid interop issues.
EDID:
  Base EDID: Some timings are out of range of the Monitor Ranges:
    Vertical Freq: 29.994 - 70.082 Hz (Monitor: 50.000 - 71.000 Hz)

Failures:

EDID:
  Extension Block 2 started with EDID header, ignoring Extension Blocks >= 2.

EDID conformity: FAIL
