edid-decode (hex):

00 ff ff ff ff ff ff 00 05 e3 60 24 6e 5d 00 00
20 1b 01 03 80 35 1e 78 2a 64 35 a5 54 4f 9e 27
12 50 54 bf ef 00 d1 c0 81 80 31 68 31 7c 45 68
45 7c 61 68 61 7c 02 3a 80 18 71 38 2d 40 58 2c
45 00 13 2b 21 00 00 1e fc 7e 80 88 70 38 12 40
18 20 35 00 13 2b 21 00 00 1e 00 00 00 fd 00 32
92 1e a0 21 00 0a 20 20 20 20 20 20 00 00 00 fc
00 32 34 36 30 47 34 0a 20 20 20 20 20 20 01 17

02 01 04 00 fe 5b 80 a0 70 38 35 40 30 20 35 00
13 2b 21 00 00 1e 86 6f 80 a0 70 38 40 40 30 20
35 00 13 2b 21 00 00 1e 1a 1d 00 80 51 d0 1c 20
40 80 35 00 13 2b 21 00 00 1c ab 22 a0 a0 50 84
1a 30 30 20 36 00 13 2b 21 00 00 1a 7c 2e 90 a0
60 1a 1e 40 30 20 36 00 13 2b 21 00 00 1a 00 00
00 00 00 00 00 00 00 00 00 00 00 00 00 00 00 00
00 00 00 00 00 00 00 00 00 00 00 00 00 00 00 c3

00 ff ff ff ff ff ff 00 05 e3 60 24 6e 5d 00 00
20 1b 01 03 80 35 1e 78 2a 64 35 a5 54 4f 9e 27
12 50 54 bf ef 00 d1 c0 81 80 31 68 31 7c 45 68
45 7c 61 68 61 7c 02 3a 80 18 71 38 2d 40 58 2c
45 00 13 2b 21 00 00 1e fc 7e 80 88 70 38 12 40
18 20 35 00 13 2b 21 00 00 1e 00 00 00 fd 00 32
92 1e a0 21 00 0a 20 20 20 20 20 20 00 00 00 fc
00 32 34 36 30 47 34 0a 20 20 20 20 20 20 01 17

02 01 04 00 fe 5b 80 a0 70 38 35 40 30 20 35 00
13 2b 21 00 00 1e 86 6f 80 a0 70 38 40 40 30 20
35 00 13 2b 21 00 00 1e 1a 1d 00 80 51 d0 1c 20
40 80 35 00 13 2b 21 00 00 1c ab 22 a0 a0 50 84
1a 30 30 20 36 00 13 2b 21 00 00 1a 7c 2e 90 a0
60 1a 1e 40 30 20 36 00 13 2b 21 00 00 1a 00 00
00 00 00 00 00 00 00 00 00 00 00 00 00 00 00 00
00 00 00 00 00 00 00 00 00 00 00 00 00 00 00 c3

----------------

Block 0, Base EDID:
  EDID Structure Version & Revision: 1.3
  Vendor & Product Identification:
    Manufacturer: AOC
    Model: 9312
    Serial Number: ...
    Made in: week 32 of 2017
  Basic Display Parameters & Features:
    Digital display
    Maximum image size: 53 cm x 30 cm
    Gamma: 2.20
    DPMS levels: Off
    RGB color display
    First detailed timing is the preferred timing
  Color Characteristics:
    Red  : 0.6455, 0.3300
    Green: 0.3095, 0.6171
    Blue : 0.1523, 0.0732
    White: 0.3134, 0.3291
  Established Timings I & II:
    IBM     :   720x400    70.081663 Hz   9:5     31.467 kHz     28.320000 MHz
    DMT 0x04:   640x480    59.940476 Hz   4:3     31.469 kHz     25.175000 MHz
    Apple   :   640x480    66.666667 Hz   4:3     35.000 kHz     30.240000 MHz
    DMT 0x05:   640x480    72.808802 Hz   4:3     37.861 kHz     31.500000 MHz
    DMT 0x06:   640x480    75.000000 Hz   4:3     37.500 kHz     31.500000 MHz
    DMT 0x08:   800x600    56.250000 Hz   4:3     35.156 kHz     36.000000 MHz
    DMT 0x09:   800x600    60.316541 Hz   4:3     37.879 kHz     40.000000 MHz
    DMT 0x0a:   800x600    72.187572 Hz   4:3     48.077 kHz     50.000000 MHz
    DMT 0x0b:   800x600    75.000000 Hz   4:3     46.875 kHz     49.500000 MHz
    Apple   :   832x624    74.551266 Hz   4:3     49.726 kHz     57.284000 MHz
    DMT 0x10:  1024x768    60.003840 Hz   4:3     48.363 kHz     65.000000 MHz
    DMT 0x11:  1024x768    70.069359 Hz   4:3     56.476 kHz     75.000000 MHz
    DMT 0x12:  1024x768    75.028582 Hz   4:3     60.023 kHz     78.750000 MHz
    DMT 0x24:  1280x1024   75.024675 Hz   5:4     79.976 kHz    135.000000 MHz
  Standard Timings:
    DMT 0x52:  1920x1080   60.000000 Hz  16:9     67.500 kHz    148.500000 MHz
    DMT 0x23:  1280x1024   60.019740 Hz   5:4     63.981 kHz    108.000000 MHz
    GTF     :   640x480    99.999537 Hz   4:3     50.900 kHz     43.163000 MHz
    GTF     :   640x480   119.999084 Hz   4:3     61.800 kHz     52.406000 MHz
    GTF     :   800x600    99.999707 Hz   4:3     63.600 kHz     68.179000 MHz
    GTF     :   800x600   119.999886 Hz   4:3     77.160 kHz     83.950000 MHz
    GTF     :  1024x768   100.000177 Hz   4:3     81.400 kHz    113.309000 MHz
    GTF     :  1024x768   119.999931 Hz   4:3     98.760 kHz    139.054000 MHz
  Detailed Timing Descriptors:
    DTD 1:  1920x1080   60.000000 Hz  16:9     67.500 kHz    148.500000 MHz (531 mm x 299 mm)
                 Hfront   88 Hsync  44 Hback  148 Hpol P
                 Vfront    4 Vsync   5 Vback   36 Vpol P
    DTD 2:  1920x1080  144.000765 Hz  16:9    158.113 kHz    325.080000 MHz (531 mm x 299 mm)
                 Hfront   24 Hsync  32 Hback   80 Hpol P
                 Vfront    3 Vsync   5 Vback   10 Vpol P
    Display Range Limits:
      Monitor ranges (GTF): 50-146 Hz V, 30-160 kHz H, max dotclock 330 MHz
    Display Product Name: '2460G4'
  Extension blocks: 1
Checksum: 0x17

----------------

Block 1, CTA-861 Extension Block:
  Revision: 1
  Detailed Timing Descriptors:
    DTD 3:  1920x1080   99.930409 Hz  16:9    113.221 kHz    235.500000 MHz (531 mm x 299 mm)
                 Hfront   48 Hsync  32 Hback   80 Hpol P
                 Vfront    3 Vsync   5 Vback   45 Vpol P
    DTD 4:  1920x1080  119.982181 Hz  16:9    137.260 kHz    285.500000 MHz (531 mm x 299 mm)
                 Hfront   48 Hsync  32 Hback   80 Hpol P
                 Vfront    3 Vsync   5 Vback   56 Vpol P
    DTD 5:  1280x720    59.855126 Hz  16:9     44.772 kHz     74.500000 MHz (531 mm x 299 mm)
                 Hfront   64 Hsync 128 Hback  192 Hpol N
                 Vfront    3 Vsync   5 Vback   20 Vpol P
    DTD 6:  1440x900    59.901458 Hz  16:10    55.469 kHz     88.750000 MHz (531 mm x 299 mm)
                 Hfront   48 Hsync  32 Hback   80 Hpol P
                 Vfront    3 Vsync   6 Vback   17 Vpol N
    DTD 7:  1680x1050   59.883253 Hz  16:10    64.674 kHz    119.000000 MHz (531 mm x 299 mm)
                 Hfront   48 Hsync  32 Hback   80 Hpol P
                 Vfront    3 Vsync   6 Vback   21 Vpol N
Checksum: 0xc3  Unused space in Extension Block: 33 bytes

----------------

Warnings:

Block 0, Base EDID:
  Detailed Timing Descriptor #1: DTD is identical to VIC 16, which is not present in the CTA Ext Block.
Block 1, CTA-861 Extension Block:
  Detailed Timing Descriptor #6: Image size is 531x299 mm, but based on the picture AR it should be 478x299 mm.
  Detailed Timing Descriptor #7: Image size is 531x299 mm, but based on the picture AR it should be 478x299 mm.
  Add a Colorimetry Data Block with the sRGB colorimetry bit set to avoid interop issues.

Failures:

Block 1, CTA-861 Extension Block:
  Missing VCDB, needed for Set Selectable RGB Quantization to avoid interop issues.
EDID:
  Extension Block 2 started with EDID header, ignoring Extension Blocks >= 2.

EDID conformity: FAIL
