edid-decode (hex):

00 ff ff ff ff ff ff 00 12 63 3c 13 00 34 00 00
32 22 01 03 80 1c 16 78 ea ee 95 a3 54 4c 99 26
0f 50 54 00 00 00 01 01 01 01 01 01 01 01 01 01
01 01 01 01 01 01 6c 87 80 80 c2 60 28 90 40 40
b9 40 15 dc 10 00 00 1e 00 00 00 fd 00 0a 28 18
64 3c 00 0a 20 20 20 20 20 20 00 00 00 10 00 00
00 00 00 00 00 00 00 00 00 00 00 00 00 00 00 fc
00 50 61 70 65 72 6c 69 6b 65 31 33 4b 0a 01 e1

02 03 1f f2 23 09 7f 07 83 01 00 00 6a 03 0c 00
00 00 08 78 20 00 00 67 d8 5d c4 01 78 80 00 d2
62 80 80 c2 60 28 90 40 40 b9 40 15 dc 10 00 00
1e 00 00 00 00 00 00 00 00 00 00 00 00 00 00 00
00 00 00 00 00 00 00 00 00 00 00 00 00 00 00 00
00 00 00 00 00 00 00 00 00 00 00 00 00 00 00 00
00 00 00 00 00 00 00 00 00 00 00 00 00 00 00 00
00 00 00 00 00 00 00 00 00 00 00 00 00 00 00 9c

00 ff ff ff ff ff ff 00 12 63 3c 13 00 34 00 00
32 22 01 03 80 1c 16 78 ea ee 95 a3 54 4c 99 26
0f 50 54 00 00 00 01 01 01 01 01 01 01 01 01 01
01 01 01 01 01 01 6c 87 80 80 c2 60 28 90 40 40
b9 40 15 dc 10 00 00 1e 00 00 00 fd 00 0a 28 18
64 3c 00 0a 20 20 20 20 20 20 00 00 00 10 00 00
00 00 00 00 00 00 00 00 00 00 00 00 00 00 00 fc
00 50 61 70 65 72 6c 69 6b 65 31 33 4b 0a 01 e1

02 03 1f f2 23 09 7f 07 83 01 00 00 6a 03 0c 00
00 00 08 78 20 00 00 67 d8 5d c4 01 78 80 00 d2
62 80 80 c2 60 28 90 40 40 b9 40 15 dc 10 00 00
1e 00 00 00 00 00 00 00 00 00 00 00 00 00 00 00
00 00 00 00 00 00 00 00 00 00 00 00 00 00 00 00
00 00 00 00 00 00 00 00 00 00 00 00 00 00 00 00
00 00 00 00 00 00 00 00 00 00 00 00 00 00 00 00
00 00 00 00 00 00 00 00 00 00 00 00 00 00 00 9c

----------------

Block 0, Base EDID:
  EDID Structure Version & Revision: 1.3
  Vendor & Product Identification:
    Manufacturer: DSC
    Model: 4924
    Serial Number: ...
    Made in: week 50 of 2024
  Basic Display Parameters & Features:
    Digital display
    Maximum image size: 28 cm x 22 cm
    Gamma: 2.20
    DPMS levels: Standby Suspend Off
    RGB color display
    First detailed timing is the preferred timing
  Color Characteristics:
    Red  : 0.6396, 0.3300
    Green: 0.2998, 0.5996
    Blue : 0.1503, 0.0595
    White: 0.3134, 0.3291
  Established Timings I & II: none
  Standard Timings: none
  Detailed Timing Descriptors:
    DTD 1:  3200x2400   37.000512 Hz   4:3     90.281 kHz    346.680000 MHz (277 mm x 220 mm)
                 Hfront  320 Hsync  64 Hback  256 Hpol P
                 Vfront   11 Vsync   9 Vback   20 Vpol P
    Display Range Limits:
      Monitor ranges (GTF): 10-40 Hz V, 24-100 kHz H, max dotclock 600 MHz
    Dummy Descriptor:
    Display Product Name: 'Paperlike13K'
  Extension blocks: 1
Checksum: 0xe1

----------------

Block 1, CTA-861 Extension Block:
  Revision: 3
  Underscans IT Video Formats by default
  Basic audio support
  Supports YCbCr 4:4:4
  Supports YCbCr 4:2:2
  Native DTDs: 2
  Audio Data Block:
    Linear PCM:
      Max channels: 2
      Supported sample rates (kHz): 192 176.4 96 88.2 48 44.1 32
      Supported sample sizes (bits): 24 20 16
  Speaker Allocation Data Block:
    FL/FR - Front Left/Right
  Vendor-Specific Data Block (HDMI), OUI 00-0C-03:
    Source physical address: 0.0.0.0
    DC_Y444
    Maximum TMDS clock: 600 MHz
    Extended HDMI video details:
  Vendor-Specific Data Block (HDMI Forum), OUI C4-5D-D8:
    Version: 1
    Maximum TMDS Character Rate: 600 MHz
    SCDC Present
  Detailed Timing Descriptors:
    DTD 2:  3200x2400   27.000085 Hz   4:3     65.880 kHz    252.980000 MHz (277 mm x 220 mm)
                 Hfront  320 Hsync  64 Hback  256 Hpol P
                 Vfront   11 Vsync   9 Vback   20 Vpol P
Checksum: 0x9c  Unused space in Extension Block: 78 bytes

----------------

Warnings:

Block 0, Base EDID:
  Detailed Timing Descriptor #1: Image size is 277x220 mm, but based on the picture AR it should be 277x207 mm.
Block 1, CTA-861 Extension Block:
  Detailed Timing Descriptor #2: Image size is 277x220 mm, but based on the picture AR it should be 277x207 mm.
  Add a Colorimetry Data Block with the sRGB colorimetry bit set to avoid interop issues.

Failures:

Block 1, CTA-861 Extension Block:
  Vendor-Specific Data Block (HDMI), OUI 00-0C-03: HDMI VSDB Max TMDS rate is > 340.
  Required 640x480p60 timings are missing in the established timings and the SVD list (VIC 1).
  Missing VCDB, needed for Set Selectable RGB Quantization to avoid interop issues.
EDID:
  Extension Block 2 started with EDID header, ignoring Extension Blocks >= 2.

EDID conformity: FAIL
