edid-decode (hex):

00 ff ff ff ff ff ff 00 36 69 c3 8c 01 00 00 00
18 21 01 03 80 3c 21 78 ae ee 95 a3 54 4c 99 26
0f 50 54 bd cf 00 81 80 95 00 b3 00 d1 c0 81 bc
95 3c b3 3c d1 fc 6a 5e 00 a0 a0 a0 29 50 30 20
35 00 58 4a 21 00 00 1a 00 00 00 ff 00 43 43 33
48 33 32 33 36 30 30 32 30 35 00 00 00 fd 00 30
90 1e fa 3c 00 0a 20 20 20 20 20 20 00 00 00 fc
00 47 32 37 31 43 51 50 20 45 32 0a 20 20 01 a9

02 03 45 f3 49 5f 02 03 04 90 61 13 1f 3f 23 09
07 07 83 01 00 00 6a 03 0c 00 10 00 38 78 20 00
00 67 d8 5d c4 01 78 c0 00 6d 1a 00 00 02 01 30
90 ed 00 00 00 00 00 e6 06 07 01 00 60 00 e3 05
60 00 e2 00 ff d4 bc 00 a0 a0 a0 29 50 30 20 35
00 58 2c 21 00 00 1e 42 df 00 78 a0 a0 29 50 30
20 35 00 58 2c 21 00 00 1e fc 31 00 a0 50 a0 29
50 30 20 35 00 58 2c 21 00 00 1e 00 00 00 00 03

00 ff ff ff ff ff ff 00 36 69 c3 8c 01 00 00 00
18 21 01 03 80 3c 21 78 ae ee 95 a3 54 4c 99 26
0f 50 54 bd cf 00 81 80 95 00 b3 00 d1 c0 81 bc
95 3c b3 3c d1 fc 6a 5e 00 a0 a0 a0 29 50 30 20
35 00 58 4a 21 00 00 1a 00 00 00 ff 00 43 43 33
48 33 32 33 36 30 30 32 30 35 00 00 00 fd 00 30
90 1e fa 3c 00 0a 20 20 20 20 20 20 00 00 00 fc
00 47 32 37 31 43 51 50 20 45 32 0a 20 20 01 a9

02 03 45 f3 49 5f 02 03 04 90 61 13 1f 3f 23 09
07 07 83 01 00 00 6a 03 0c 00 10 00 38 78 20 00
00 67 d8 5d c4 01 78 c0 00 6d 1a 00 00 02 01 30
90 ed 00 00 00 00 00 e6 06 07 01 00 60 00 e3 05
60 00 e2 00 ff d4 bc 00 a0 a0 a0 29 50 30 20 35
00 58 2c 21 00 00 1e 42 df 00 78 a0 a0 29 50 30
20 35 00 58 2c 21 00 00 1e fc 31 00 a0 50 a0 29
50 30 20 35 00 58 2c 21 00 00 1e 00 00 00 00 03

----------------

Block 0, Base EDID:
  EDID Structure Version & Revision: 1.3
  Vendor & Product Identification:
    Manufacturer: MSI
    Model: 36035
    Serial Number: ...
    Made in: week 24 of 2023
  Basic Display Parameters & Features:
    Digital display
    Maximum image size: 60 cm x 33 cm
    Gamma: 2.20
    DPMS levels: Standby Off
    RGB color display
    Default (sRGB) color space is primary color space
    First detailed timing is the preferred timing
  Color Characteristics:
    Red  : 0.6396, 0.3300
    Green: 0.2998, 0.5996
    Blue : 0.1503, 0.0595
    White: 0.3134, 0.3291
  Established Timings I & II:
    IBM     :   720x400    70.081663 Hz   9:5     31.467 kHz     28.320000 MHz
    DMT 0x04:   640x480    59.940476 Hz   4:3     31.469 kHz     25.175000 MHz
    Apple   :   640x480    66.666667 Hz   4:3     35.000 kHz     30.240000 MHz
    DMT 0x05:   640x480    72.808802 Hz   4:3     37.861 kHz     31.500000 MHz
    DMT 0x06:   640x480    75.000000 Hz   4:3     37.500 kHz     31.500000 MHz
    DMT 0x09:   800x600    60.316541 Hz   4:3     37.879 kHz     40.000000 MHz
    DMT 0x0a:   800x600    72.187572 Hz   4:3     48.077 kHz     50.000000 MHz
    DMT 0x0b:   800x600    75.000000 Hz   4:3     46.875 kHz     49.500000 MHz
    DMT 0x10:  1024x768    60.003840 Hz   4:3     48.363 kHz     65.000000 MHz
    DMT 0x11:  1024x768    70.069359 Hz   4:3     56.476 kHz     75.000000 MHz
    DMT 0x12:  1024x768    75.028582 Hz   4:3     60.023 kHz     78.750000 MHz
    DMT 0x24:  1280x1024   75.024675 Hz   5:4     79.976 kHz    135.000000 MHz
  Standard Timings:
    DMT 0x23:  1280x1024   60.019740 Hz   5:4     63.981 kHz    108.000000 MHz
    DMT 0x2f:  1440x900    59.887445 Hz  16:10    55.935 kHz    106.500000 MHz
    DMT 0x3a:  1680x1050   59.954250 Hz  16:10    65.290 kHz    146.250000 MHz
    DMT 0x52:  1920x1080   60.000000 Hz  16:9     67.500 kHz    148.500000 MHz
    GTF     :  1280x1024  120.000185 Hz   5:4    131.640 kHz    233.793000 MHz
    GTF     :  1440x900   119.999896 Hz  16:10   115.800 kHz    229.747000 MHz
    GTF     :  1680x1050  120.000000 Hz  16:10   135.000 kHz    313.200000 MHz
    GTF     :  1920x1080  119.999987 Hz  16:9    138.840 kHz    368.759000 MHz
  Detailed Timing Descriptors:
    DTD 1:  2560x1440   60.000199 Hz  16:9     88.860 kHz    241.700000 MHz (600 mm x 330 mm)
                 Hfront   48 Hsync  32 Hback   80 Hpol P
                 Vfront    3 Vsync   5 Vback   33 Vpol N
    Display Product Serial Number: ...
    Display Range Limits:
      Monitor ranges (GTF): 48-144 Hz V, 30-250 kHz H, max dotclock 600 MHz
    Display Product Name: 'G271CQP E2'
  Extension blocks: 1
Checksum: 0xa9

----------------

Block 1, CTA-861 Extension Block:
  Revision: 3
  Underscans IT Video Formats by default
  Basic audio support
  Supports YCbCr 4:4:4
  Supports YCbCr 4:2:2
  Native DTDs: 3
  Video Data Block:
    VIC  95:  3840x2160   30.000000 Hz  16:9     67.500 kHz    297.000000 MHz
    VIC   2:   720x480    59.940060 Hz   4:3     31.469 kHz     27.000000 MHz
    VIC   3:   720x480    59.940060 Hz  16:9     31.469 kHz     27.000000 MHz
    VIC   4:  1280x720    60.000000 Hz  16:9     45.000 kHz     74.250000 MHz
    VIC  16:  1920x1080   60.000000 Hz  16:9     67.500 kHz    148.500000 MHz (native)
    VIC  97:  3840x2160   60.000000 Hz  16:9    135.000 kHz    594.000000 MHz
    VIC  19:  1280x720    50.000000 Hz  16:9     37.500 kHz     74.250000 MHz
    VIC  31:  1920x1080   50.000000 Hz  16:9     56.250 kHz    148.500000 MHz
    VIC  63:  1920x1080  120.000000 Hz  16:9    135.000 kHz    297.000000 MHz
  Audio Data Block:
    Linear PCM:
      Max channels: 2
      Supported sample rates (kHz): 48 44.1 32
      Supported sample sizes (bits): 24 20 16
  Speaker Allocation Data Block:
    FL/FR - Front Left/Right
  Vendor-Specific Data Block (HDMI), OUI 00-0C-03:
    Source physical address: 1.0.0.0
    DC_36bit
    DC_30bit
    DC_Y444
    Maximum TMDS clock: 600 MHz
    Extended HDMI video details:
  Vendor-Specific Data Block (HDMI Forum), OUI C4-5D-D8:
    Version: 1
    Maximum TMDS Character Rate: 600 MHz
    SCDC Present
    SCDC Read Request Capable
  Vendor-Specific Data Block (AMD), OUI 00-00-1A:
    Version: 2
    Flags 1: 0x01
      FreeSync Supported
    Minimum Refresh Rate: 48 Hz
    Maximum Refresh Rate: 144 Hz
    MCCS VCP Code: 0xed
    Flags 5: 0x00
  HDR Static Metadata Data Block:
    Electro optical transfer functions:
      Traditional gamma - SDR luminance range
      Traditional gamma - HDR luminance range
      SMPTE ST2084
    Supported static metadata descriptors:
      Static metadata type 1
    Desired content max luminance: 0 (50.000 cd/m^2)
    Desired content max frame-average luminance: 96 (400.000 cd/m^2)
    Desired content min luminance: 0 (0.000 cd/m^2)
  Colorimetry Data Block:
    BT2020cYCC
    BT2020YCC
  Video Capability Data Block:
    YCbCr quantization: Selectable (via AVI YQ)
    RGB quantization: Selectable (via AVI Q)
    PT scan behavior: Supports both over- and underscan
    IT scan behavior: Supports both over- and underscan
    CE scan behavior: Supports both over- and underscan
  Detailed Timing Descriptors:
    DTD 2:  2560x1440  120.000397 Hz  16:9    177.721 kHz    483.400000 MHz (600 mm x 300 mm)
                 Hfront   48 Hsync  32 Hback   80 Hpol P
                 Vfront    3 Vsync   5 Vback   33 Vpol P
    DTD 3:  2560x1440  143.998105 Hz  16:9    213.261 kHz    571.540000 MHz (600 mm x 300 mm)
                 Hfront   48 Hsync  32 Hback   40 Hpol P
                 Vfront    3 Vsync   5 Vback   33 Vpol P
    DTD 4:  1280x1440   60.000750 Hz   8:9     88.861 kHz    127.960000 MHz (600 mm x 300 mm)
                 Hfront   48 Hsync  32 Hback   80 Hpol P
                 Vfront    3 Vsync   5 Vback   33 Vpol P
Checksum: 0x03  Unused space in Extension Block: 4 bytes

----------------

Warnings:

Block 0, Base EDID:
  Vendor & Product Identification: The serial number is one of the known dummy values, it should probably be set to 0.
Block 1, CTA-861 Extension Block:
  Video Data Block: VIC 95 and the first DTD are not identical. Is this intended?
  Video Capability Data Block: S_PT is equal to S_IT and S_CE, so should be set to 0 instead.
  Detailed Timing Descriptor #2: Image size is 600x300 mm, but based on the picture AR it should be 533x300 mm.
  Detailed Timing Descriptor #3: Image size is 600x300 mm, but based on the picture AR it should be 533x300 mm.
  Detailed Timing Descriptor #4: Image size is 600x300 mm, but based on the picture AR it should be 266x300 mm.
  Display Product Serial Number is set, so the Serial Number in the Base EDID should be 0.
EDID:
  Base EDID: Some timings are out of range of the Monitor Ranges:
    Vertical Freq: 30.000 - 143.998 Hz (Monitor: 48.000 - 144.000 Hz)

Failures:

Block 0, Base EDID:
  Basic Display Parameters & Features: sRGB is signaled, but the chromaticities do not match.
Block 1, CTA-861 Extension Block:
  Vendor-Specific Data Block (HDMI), OUI 00-0C-03: HDMI VSDB Max TMDS rate is > 340.
EDID:
  Extension Block 2 started with EDID header, ignoring Extension Blocks >= 2.
  CTA-861: Native progressive timings are a mix of several resolutions.

EDID conformity: FAIL
