edid-decode (hex):

00 ff ff ff ff ff ff 00 22 f0 f7 26 01 01 01 01
25 15 01 03 80 36 23 78 ee ce 50 a3 54 4c 99 26
0f 50 54 a5 6b 80 81 40 81 80 a9 00 a9 40 b3 00
d1 00 d1 c0 01 01 28 3c 80 a0 70 b0 23 40 30 20
36 00 22 60 21 00 00 1a 00 00 00 fc 00 48 50 20
4c 50 32 34 37 35 77 0a 20 20 00 00 00 fd 00 30
55 1e 5e 11 00 0a 20 20 20 20 20 20 00 00 00 ff
00 43 4e 43 31 33 37 30 57 58 31 0a 20 20 00 ba

00 ff ff ff ff ff ff 00 22 f0 f7 26 01 01 01 01
25 15 01 03 80 36 23 78 ee ce 50 a3 54 4c 99 26
0f 50 54 a5 6b 80 81 40 81 80 a9 00 a9 40 b3 00
d1 00 d1 c0 01 01 28 3c 80 a0 70 b0 23 40 30 20
36 00 22 60 21 00 00 1a 00 00 00 fc 00 48 50 20
4c 50 32 34 37 35 77 0a 20 20 00 00 00 fd 00 30
55 1e 5e 11 00 0a 20 20 20 20 20 20 00 00 00 ff
00 43 4e 43 31 33 37 30 57 58 31 0a 20 20 00 ba

----------------

Block 0, Base EDID:
  EDID Structure Version & Revision: 1.3
  Vendor & Product Identification:
    Manufacturer: HWP
    Model: 9975
    Serial Number: ...
    Made in: week 37 of 2011
  Basic Display Parameters & Features:
    Digital display
    Maximum image size: 54 cm x 35 cm
    Gamma: 2.20
    DPMS levels: Standby Suspend Off
    RGB color display
    Default (sRGB) color space is primary color space
    First detailed timing is the preferred timing
  Color Characteristics:
    Red  : 0.6396, 0.3281
    Green: 0.2998, 0.5996
    Blue : 0.1494, 0.0595
    White: 0.3125, 0.3281
  Established Timings I & II:
    IBM     :   720x400    70.081663 Hz   9:5     31.467 kHz     28.320000 MHz
    DMT 0x04:   640x480    59.940476 Hz   4:3     31.469 kHz     25.175000 MHz
    DMT 0x06:   640x480    75.000000 Hz   4:3     37.500 kHz     31.500000 MHz
    DMT 0x09:   800x600    60.316541 Hz   4:3     37.879 kHz     40.000000 MHz
    DMT 0x0b:   800x600    75.000000 Hz   4:3     46.875 kHz     49.500000 MHz
    Apple   :   832x624    74.551266 Hz   4:3     49.726 kHz     57.284000 MHz
    DMT 0x10:  1024x768    60.003840 Hz   4:3     48.363 kHz     65.000000 MHz
    DMT 0x12:  1024x768    75.028582 Hz   4:3     60.023 kHz     78.750000 MHz
    DMT 0x24:  1280x1024   75.024675 Hz   5:4     79.976 kHz    135.000000 MHz
    Apple   :  1152x870    75.061550 Hz 192:145   68.681 kHz    100.000000 MHz
  Standard Timings:
    DMT 0x20:  1280x960    60.000000 Hz   4:3     60.000 kHz    108.000000 MHz
    DMT 0x23:  1280x1024   60.019740 Hz   5:4     63.981 kHz    108.000000 MHz
    GTF     :  1600x1000   59.999820 Hz  16:10    62.100 kHz    133.142000 MHz
    DMT 0x33:  1600x1200   60.000000 Hz   4:3     75.000 kHz    162.000000 MHz
    DMT 0x3a:  1680x1050   59.954250 Hz  16:10    65.290 kHz    146.250000 MHz
    DMT 0x45:  1920x1200   59.884600 Hz  16:10    74.556 kHz    193.250000 MHz
    DMT 0x52:  1920x1080   60.000000 Hz  16:9     67.500 kHz    148.500000 MHz
  Detailed Timing Descriptors:
    DTD 1:  1920x1200   59.950171 Hz  16:10    74.038 kHz    154.000000 MHz (546 mm x 352 mm)
                 Hfront   48 Hsync  32 Hback   80 Hpol P
                 Vfront    3 Vsync   6 Vback   26 Vpol N
    Display Product Name: 'HP LP2475w'
    Display Range Limits:
      Monitor ranges (GTF): 48-85 Hz V, 30-94 kHz H, max dotclock 170 MHz
    Display Product Serial Number: ...
Checksum: 0xba

----------------

Block 1, Unknown EDID Extension Block 0x00:
  00 ff ff ff ff ff ff 00 22 f0 f7 26 01 01 01 01 '........"..&....'
  25 15 01 03 80 36 23 78 ee ce 50 a3 54 4c 99 26 '%....6#x..P.TL.&'
  0f 50 54 a5 6b 80 81 40 81 80 a9 00 a9 40 b3 00 '.PT.k..@.....@..'
  d1 00 d1 c0 01 01 28 3c 80 a0 70 b0 23 40 30 20 '......(<..p.#@0 '
  36 00 22 60 21 00 00 1a 00 00 00 fc 00 48 50 20 '6."`!........HP '
  4c 50 32 34 37 35 77 0a 20 20 00 00 00 fd 00 30 'LP2475w.  .....0'
  55 1e 5e 11 00 0a 20 20 20 20 20 20 00 00 00 ff 'U.^...      ....'
  00 43 4e 43 31 33 37 30 57 58 31 0a 20 20 00 ba '.CNC1370WX1.  ..'
Checksum: 0xba

----------------

Warnings:

Block 0, Base EDID:
  Vendor & Product Identification: The serial number is one of the known dummy values, it should probably be set to 0.
  Detailed Timing Descriptor #1: Image size is 546x352 mm, but based on the picture AR it should be 546x341 mm.
EDID:
  Base EDID: Some timings are out of range of the Monitor Ranges:
    Maximum Clock: 193.250 MHz (Monitor: 170.000 MHz)

Failures:

Block 0, Base EDID:
  Basic Display Parameters & Features: sRGB is signaled, but the chromaticities do not match.
Block 1, Base EDID:
  Unknown Extension Block.
EDID:
  Base EDID: EDID specified 0 extension block(s), but found 1 extension block(s).

EDID conformity: FAIL
