edid-decode (hex):

00 ff ff ff ff ff ff 00 22 f0 3b 30 01 01 01 01
1a 17 01 03 80 35 1e 78 2a b8 50 a3 54 55 9f 27
0c 50 54 a1 08 00 d1 c0 81 c0 a9 c0 95 00 b3 00
81 80 01 01 01 01 02 3a 80 18 71 38 2d 40 58 2c
45 00 12 2c 21 00 00 1e 00 00 00 fd 00 32 4c 18
5e 11 00 0a 20 20 20 20 20 20 00 00 00 fc 00 48
50 20 4c 32 34 30 31 78 0a 20 20 20 00 00 00 ff
00 43 4e 4b 33 32 36 30 32 51 56 0a 20 20 01 71

02 03 12 b2 47 90 9f 04 13 03 12 01 65 03 0c 00
10 00 02 3a 80 18 71 38 2d 40 58 2c 45 00 12 2c
21 00 00 1e 02 3a 80 d0 72 38 2d 40 10 2c 45 80
12 2c 21 00 00 1e 01 1d 00 72 51 d0 1e 20 6e 28
55 00 12 2c 21 00 00 1e 01 1d 00 bc 52 d0 1e 20
b8 28 55 40 12 2c 21 00 00 1e 8c 0a d0 8a 20 e0
2d 10 10 3e 96 00 12 2c 21 00 00 18 8c 0a d0 90
20 40 31 20 0c 40 55 00 12 2c 21 00 00 18 00 f5

00 ff ff ff ff ff ff 00 22 f0 3b 30 01 01 01 01
1a 17 01 03 80 35 1e 78 2a b8 50 a3 54 55 9f 27
0c 50 54 a1 08 00 d1 c0 81 c0 a9 c0 95 00 b3 00
81 80 01 01 01 01 02 3a 80 18 71 38 2d 40 58 2c
45 00 12 2c 21 00 00 1e 00 00 00 fd 00 32 4c 18
5e 11 00 0a 20 20 20 20 20 20 00 00 00 fc 00 48
50 20 4c 32 34 30 31 78 0a 20 20 20 00 00 00 ff
00 43 4e 4b 33 32 36 30 32 51 56 0a 20 20 01 71

02 03 12 b2 47 90 9f 04 13 03 12 01 65 03 0c 00
10 00 02 3a 80 18 71 38 2d 40 58 2c 45 00 12 2c
21 00 00 1e 02 3a 80 d0 72 38 2d 40 10 2c 45 80
12 2c 21 00 00 1e 01 1d 00 72 51 d0 1e 20 6e 28
55 00 12 2c 21 00 00 1e 01 1d 00 bc 52 d0 1e 20
b8 28 55 40 12 2c 21 00 00 1e 8c 0a d0 8a 20 e0
2d 10 10 3e 96 00 12 2c 21 00 00 18 8c 0a d0 90
20 40 31 20 0c 40 55 00 12 2c 21 00 00 18 00 f5

----------------

Block 0, Base EDID:
  EDID Structure Version & Revision: 1.3
  Vendor & Product Identification:
    Manufacturer: HWP
    Model: 12347
    Serial Number: ...
    Made in: week 26 of 2013
  Basic Display Parameters & Features:
    Digital display
    Maximum image size: 53 cm x 30 cm
    Gamma: 2.20
    DPMS levels: Off
    RGB color display
    First detailed timing is the preferred timing
  Color Characteristics:
    Red  : 0.6386, 0.3310
    Green: 0.3339, 0.6210
    Blue : 0.1533, 0.0478
    White: 0.3125, 0.3281
  Established Timings I & II:
    IBM     :   720x400    70.081663 Hz   9:5     31.467 kHz     28.320000 MHz
    DMT 0x04:   640x480    59.940476 Hz   4:3     31.469 kHz     25.175000 MHz
    DMT 0x09:   800x600    60.316541 Hz   4:3     37.879 kHz     40.000000 MHz
    DMT 0x10:  1024x768    60.003840 Hz   4:3     48.363 kHz     65.000000 MHz
  Standard Timings:
    DMT 0x52:  1920x1080   60.000000 Hz  16:9     67.500 kHz    148.500000 MHz
    DMT 0x55:  1280x720    60.000000 Hz  16:9     45.000 kHz     74.250000 MHz
    DMT 0x53:  1600x900    60.000000 Hz  16:9     60.000 kHz    108.000000 MHz (RB)
    DMT 0x2f:  1440x900    59.887445 Hz  16:10    55.935 kHz    106.500000 MHz
    DMT 0x3a:  1680x1050   59.954250 Hz  16:10    65.290 kHz    146.250000 MHz
    DMT 0x23:  1280x1024   60.019740 Hz   5:4     63.981 kHz    108.000000 MHz
  Detailed Timing Descriptors:
    DTD 1:  1920x1080   60.000000 Hz  16:9     67.500 kHz    148.500000 MHz (530 mm x 300 mm)
                 Hfront   88 Hsync  44 Hback  148 Hpol P
                 Vfront    4 Vsync   5 Vback   36 Vpol P
    Display Range Limits:
      Monitor ranges (GTF): 50-76 Hz V, 24-94 kHz H, max dotclock 170 MHz
    Display Product Name: 'HP L2401x'
    Display Product Serial Number: ...
  Extension blocks: 1
Checksum: 0x71

----------------

Block 1, CTA-861 Extension Block:
  Revision: 3
  Underscans IT Video Formats by default
  Supports YCbCr 4:4:4
  Supports YCbCr 4:2:2
  Native DTDs: 2
  Video Data Block:
    VIC  16:  1920x1080   60.000000 Hz  16:9     67.500 kHz    148.500000 MHz (native)
    VIC  31:  1920x1080   50.000000 Hz  16:9     56.250 kHz    148.500000 MHz (native)
    VIC   4:  1280x720    60.000000 Hz  16:9     45.000 kHz     74.250000 MHz
    VIC  19:  1280x720    50.000000 Hz  16:9     37.500 kHz     74.250000 MHz
    VIC   3:   720x480    59.940060 Hz  16:9     31.469 kHz     27.000000 MHz
    VIC  18:   720x576    50.000000 Hz  16:9     31.250 kHz     27.000000 MHz
    VIC   1:   640x480    59.940476 Hz   4:3     31.469 kHz     25.175000 MHz
  Vendor-Specific Data Block (HDMI), OUI 00-0C-03:
    Source physical address: 1.0.0.0
  Detailed Timing Descriptors:
    DTD 2:  1920x1080   60.000000 Hz  16:9     67.500 kHz    148.500000 MHz (530 mm x 300 mm)
                 Hfront   88 Hsync  44 Hback  148 Hpol P
                 Vfront    4 Vsync   5 Vback   36 Vpol P
    DTD 3:  1920x1080   50.000000 Hz  16:9     56.250 kHz    148.500000 MHz (530 mm x 300 mm)
                 Hfront  528 Hsync  44 Hback  148 Hpol P
                 Vfront    4 Vsync   5 Vback   36 Vpol P
    DTD 4:  1280x720    60.000000 Hz  16:9     45.000 kHz     74.250000 MHz (530 mm x 300 mm)
                 Hfront  110 Hsync  40 Hback  220 Hpol P
                 Vfront    5 Vsync   5 Vback   20 Vpol P
    DTD 5:  1280x720    50.000000 Hz  16:9     37.500 kHz     74.250000 MHz (530 mm x 300 mm)
                 Hfront  440 Hsync  40 Hback  220 Hpol P
                 Vfront    5 Vsync   5 Vback   20 Vpol P
    DTD 6:   720x480    59.940060 Hz   3:2     31.469 kHz     27.000000 MHz (530 mm x 300 mm)
                 Hfront   16 Hsync  62 Hback   60 Hpol N
                 Vfront    9 Vsync   6 Vback   30 Vpol N
    DTD 7:   720x576    50.000000 Hz   5:4     31.250 kHz     27.000000 MHz (530 mm x 300 mm)
                 Hfront   12 Hsync  64 Hback   68 Hpol N
                 Vfront    5 Vsync   5 Vback   39 Vpol N
Checksum: 0xf5  Unused space in Extension Block: 1 byte

----------------

Warnings:

Block 0, Base EDID:
  Vendor & Product Identification: The serial number is one of the known dummy values, it should probably be set to 0.
Block 1, CTA-861 Extension Block:
  Detailed Timing Descriptor #6: Image size is 530x300 mm, but based on the picture AR it should be 450x300 mm.
  Detailed Timing Descriptor #7: Image size is 530x300 mm, but based on the picture AR it should be 375x300 mm.
  Display Product Serial Number is set, so the Serial Number in the Base EDID should be 0.
  Add a Colorimetry Data Block with the sRGB colorimetry bit set to avoid interop issues.

Failures:

Block 1, CTA-861 Extension Block:
  Missing VCDB, needed for Set Selectable RGB Quantization to avoid interop issues.
EDID:
  Extension Block 2 started with EDID header, ignoring Extension Blocks >= 2.

EDID conformity: FAIL
