edid-decode (hex):

00 ff ff ff ff ff ff 00 4d 10 79 14 00 00 00 00
31 1a 01 04 a5 1a 11 78 0e 07 30 a4 54 4c 9a 26
0e 50 54 00 00 00 01 01 01 01 01 01 01 01 01 01
01 01 01 01 01 01 d0 41 80 a0 70 00 46 50 30 20
3a 00 03 ad 10 00 00 18 d0 41 80 a0 70 00 97 51
30 20 3a 00 03 ad 10 00 00 18 00 00 00 fe 00 56
4b 4a 43 4e 80 4c 51 31 32 33 4e 31 00 00 00 00
00 02 41 03 28 01 12 00 00 0b 01 0a 20 20 00 72

----------------

Block 0, Base EDID:
  EDID Structure Version & Revision: 1.4
  Vendor & Product Identification:
    Manufacturer: SHP
    Model: 5241
    Made in: week 49 of 2016
  Basic Display Parameters & Features:
    Digital display
    Bits per primary color channel: 8
    DisplayPort interface
    Maximum image size: 26 cm x 17 cm
    Gamma: 2.20
    Supported color formats: RGB 4:4:4, YCrCb 4:4:4
    Default (sRGB) color space is primary color space
    First detailed timing includes the native pixel format and preferred refresh rate
  Color Characteristics:
    Red  : 0.6406, 0.3281
    Green: 0.2978, 0.6044
    Blue : 0.1484, 0.0576
    White: 0.3125, 0.3281
  Established Timings I & II: none
  Standard Timings: none
  Detailed Timing Descriptors:
    DTD 1:  1920x1280   60.000000 Hz   3:2     81.000 kHz    168.480000 MHz (259 mm x 173 mm)
                 Hfront   48 Hsync  32 Hback   80 Hpol N
                 Vfront    3 Vsync  10 Vback   57 Vpol N
    DTD 2:  1920x1280   48.014226 Hz   3:2     81.000 kHz    168.480000 MHz (259 mm x 173 mm)
                 Hfront   48 Hsync  32 Hback   80 Hpol N
                 Vfront    3 Vsync  10 Vback  394 Vpol N
    Alphanumeric Data String: 'VKJCN.LQ123N1'
    Manufacturer-Specified Display Descriptor (0x00): 00 00 00 02 41 03 28 01 12 00 00 0b 01 0a 20 20 '....A.(.......  '
Checksum: 0x72

----------------

Warnings:

Block 0, Base EDID:
  Alphanumeric Data String: Non-ASCII character 0x80 at position 5, can cause problems.
  Missing Display Product Name.

Failures:

Block 0, Base EDID:
  Basic Display Parameters & Features: sRGB is signaled, but the chromaticities do not match.

EDID conformity: FAIL
