edid-decode (hex):

00 ff ff ff ff ff ff 00 0e d4 32 31 00 88 88 88
20 21 01 04 b5 10 0a 78 0a e2 f5 a7 54 49 99 23
10 50 54 00 00 00 01 01 01 01 01 01 01 01 01 01
01 01 01 01 01 01 02 3a 80 18 71 38 2d 40 58 2c
45 00 80 38 74 00 00 1e 04 74 80 18 71 38 2d 40
58 2c 45 00 80 38 74 00 00 1e 00 00 00 fc 00 56
49 54 55 52 45 0a 20 20 20 20 20 20 00 00 00 fd
00 38 78 32 a0 1e 00 0a 20 20 20 20 20 20 01 b4

02 03 14 f6 23 09 07 07 83 01 00 00 67 03 0c 00
01 00 00 3c 02 3a 80 18 71 38 2d 40 58 2c 45 00
80 38 74 00 00 1e 04 74 80 18 71 38 2d 40 58 2c
45 00 80 38 74 00 00 1e 03 57 80 18 71 38 2d 40
58 2c 45 00 80 38 74 00 00 1e 00 00 00 00 00 00
00 00 00 00 00 00 00 00 00 00 00 00 00 00 00 00
00 00 00 00 00 00 00 00 00 00 00 00 00 00 00 00
00 00 00 00 00 00 00 00 00 00 00 00 00 00 00 2f

00 ff ff ff ff ff ff 00 0e d4 32 31 00 88 88 88
20 21 01 04 b5 10 0a 78 0a e2 f5 a7 54 49 99 23
10 50 54 00 00 00 01 01 01 01 01 01 01 01 01 01
01 01 01 01 01 01 02 3a 80 18 71 38 2d 40 58 2c
45 00 80 38 74 00 00 1e 04 74 80 18 71 38 2d 40
58 2c 45 00 80 38 74 00 00 1e 00 00 00 fc 00 56
49 54 55 52 45 0a 20 20 20 20 20 20 00 00 00 fd
00 38 78 32 a0 1e 00 0a 20 20 20 20 20 20 01 b4

02 03 14 f6 23 09 07 07 83 01 00 00 67 03 0c 00
01 00 00 3c 02 3a 80 18 71 38 2d 40 58 2c 45 00
80 38 74 00 00 1e 04 74 80 18 71 38 2d 40 58 2c
45 00 80 38 74 00 00 1e 03 57 80 18 71 38 2d 40
58 2c 45 00 80 38 74 00 00 1e 00 00 00 00 00 00
00 00 00 00 00 00 00 00 00 00 00 00 00 00 00 00
00 00 00 00 00 00 00 00 00 00 00 00 00 00 00 00
00 00 00 00 00 00 00 00 00 00 00 00 00 00 00 2f

----------------

Block 0, Base EDID:
  EDID Structure Version & Revision: 1.4
  Vendor & Product Identification:
    Manufacturer: CVT
    Model: 12594
    Serial Number: ...
    Made in: week 32 of 2023
  Basic Display Parameters & Features:
    Digital display
    Bits per primary color channel: 10
    DisplayPort interface
    Maximum image size: 16 cm x 10 cm
    Gamma: 2.20
    Supported color formats: RGB 4:4:4, YCrCb 4:4:4
    First detailed timing includes the native pixel format and preferred refresh rate
  Color Characteristics:
    Red  : 0.6552, 0.3300
    Green: 0.2851, 0.5996
    Blue : 0.1396, 0.0654
    White: 0.3134, 0.3291
  Established Timings I & II: none
  Standard Timings: none
  Detailed Timing Descriptors:
    DTD 1:  1920x1080   60.000000 Hz  16:9     67.500 kHz    148.500000 MHz (1920 mm x 1080 mm)
                 Hfront   88 Hsync  44 Hback  148 Hpol P
                 Vfront    4 Vsync   5 Vback   36 Vpol P
    DTD 2:  1920x1080  120.000000 Hz  16:9    135.000 kHz    297.000000 MHz (1920 mm x 1080 mm)
                 Hfront   88 Hsync  44 Hback  148 Hpol P
                 Vfront    4 Vsync   5 Vback   36 Vpol P
    Display Product Name: 'VITURE'
    Display Range Limits:
      Monitor ranges (GTF): 56-120 Hz V, 50-160 kHz H, max dotclock 300 MHz
  Extension blocks: 1
Checksum: 0xb4

----------------

Block 1, CTA-861 Extension Block:
  Revision: 3
  Underscans IT Video Formats by default
  Basic audio support
  Supports YCbCr 4:4:4
  Supports YCbCr 4:2:2
  Native DTDs: 6
  Audio Data Block:
    Linear PCM:
      Max channels: 2
      Supported sample rates (kHz): 48 44.1 32
      Supported sample sizes (bits): 24 20 16
  Speaker Allocation Data Block:
    FL/FR - Front Left/Right
  Vendor-Specific Data Block (HDMI), OUI 00-0C-03:
    Source physical address: 0.1.0.0
    Maximum TMDS clock: 300 MHz
  Detailed Timing Descriptors:
    DTD 3:  1920x1080   60.000000 Hz  16:9     67.500 kHz    148.500000 MHz (1920 mm x 1080 mm)
                 Hfront   88 Hsync  44 Hback  148 Hpol P
                 Vfront    4 Vsync   5 Vback   36 Vpol P
    DTD 4:  1920x1080  120.000000 Hz  16:9    135.000 kHz    297.000000 MHz (1920 mm x 1080 mm)
                 Hfront   88 Hsync  44 Hback  148 Hpol P
                 Vfront    4 Vsync   5 Vback   36 Vpol P
    DTD 5:  1920x1080   90.000000 Hz  16:9    101.250 kHz    222.750000 MHz (1920 mm x 1080 mm)
                 Hfront   88 Hsync  44 Hback  148 Hpol P
                 Vfront    4 Vsync   5 Vback   36 Vpol P
Checksum: 0x2f  Unused space in Extension Block: 53 bytes

----------------

Warnings:

Block 0, Base EDID:
  Detailed Timing Descriptor #1: DTD is identical to VIC 16, which is not present in the CTA Ext Block.
  Detailed Timing Descriptor #2: DTD is identical to VIC 63, which is not present in the CTA Ext Block.
  Display Range Limits: GTF support is deprecated in EDID 1.4.
Block 1, CTA-861 Extension Block:
  Detailed Timing Descriptor #3: DTD is identical to VIC 16, which is not present in the CTA Ext Block.
  Detailed Timing Descriptor #4: DTD is identical to VIC 63, which is not present in the CTA Ext Block.
  Add a Colorimetry Data Block with the sRGB colorimetry bit set to avoid interop issues.

Failures:

Block 0, Base EDID:
  Detailed Timing Descriptor #1: Mismatch of image size 1920x1080 mm vs display size 160x100 mm.
  Detailed Timing Descriptor #2: Mismatch of image size 1920x1080 mm vs display size 160x100 mm.
  Display Range Limits: GTF is supported, but the display does not support continuous frequencies.
Block 1, CTA-861 Extension Block:
  There are more Native DTDs (6) than DTDs (5).
  Vendor-Specific Data Block (HDMI), OUI 00-0C-03: The HDMI Specification requires EDID 1.3 instead of 1.4.
  Detailed Timing Descriptor #3: Mismatch of image size 1920x1080 mm vs display size 160x100 mm.
  Detailed Timing Descriptor #4: Mismatch of image size 1920x1080 mm vs display size 160x100 mm.
  Detailed Timing Descriptor #5: Mismatch of image size 1920x1080 mm vs display size 160x100 mm.
  Required 640x480p60 timings are missing in the established timings and the SVD list (VIC 1).
  Missing VCDB, needed for Set Selectable RGB Quantization to avoid interop issues.
EDID:
  Extension Block 2 started with EDID header, ignoring Extension Blocks >= 2.
  Base EDID: The DTD max image size is 1920x1080mm, which is larger than the display size 160.0x100.0mm.

EDID conformity: FAIL
