edid-decode (hex):

00 ff ff ff ff ff ff 00 0d af 07 11 00 00 00 00
09 13 01 03 80 19 0e 78 0a cf 45 90 59 57 95 29
1f 50 54 00 00 00 01 01 01 01 01 01 01 01 01 01
01 01 01 01 01 01 12 1b 56 6c 50 00 10 30 20 16
24 00 00 90 10 00 00 18 00 00 00 fe 00 4e 31 31
36 42 36 2d 4c 30 34 0a 20 20 00 00 00 fe 00 43
4d 4f 0a 20 20 20 20 20 20 20 20 20 00 00 00 fe
00 4e 31 31 36 42 36 2d 4c 30 34 0a 20 20 00 66

00 ff ff ff ff ff ff 00 0d af 07 11 00 00 00 00
09 13 01 03 80 19 0e 78 0a cf 45 90 59 57 95 29
1f 50 54 00 00 00 01 01 01 01 01 01 01 01 01 01
01 01 01 01 01 01 12 1b 56 6c 50 00 10 30 20 16
24 00 00 90 10 00 00 18 00 00 00 fe 00 4e 31 31
36 42 36 2d 4c 30 34 0a 20 20 00 00 00 fe 00 43
4d 4f 0a 20 20 20 20 20 20 20 20 20 00 00 00 fe
00 4e 31 31 36 42 36 2d 4c 30 34 0a 20 20 00 66

----------------

Block 0, Base EDID:
  EDID Structure Version & Revision: 1.3
  Vendor & Product Identification:
    Manufacturer: CMO
    Model: 4359
    Made in: week 9 of 2009
  Basic Display Parameters & Features:
    Digital display
    Maximum image size: 25 cm x 14 cm
    Gamma: 2.20
    RGB color display
    First detailed timing is the preferred timing
  Color Characteristics:
    Red  : 0.5654, 0.3476
    Green: 0.3427, 0.5849
    Blue : 0.1611, 0.1210
    White: 0.3134, 0.3291
  Established Timings I & II: none
  Standard Timings: none
  Detailed Timing Descriptors:
    DTD 1:  1366x768    59.968017 Hz 683:384   47.015 kHz     69.300000 MHz (256 mm x 144 mm)
                 Hfront   32 Hsync  22 Hback   54 Hpol N
                 Vfront    2 Vsync   4 Vback   10 Vpol N
    Alphanumeric Data String: 'N116B6-L04'
    Alphanumeric Data String: 'CMO'
    Alphanumeric Data String: 'N116B6-L04'
Checksum: 0x66

----------------

Failures:

Block 0, Base EDID:
  Missing Display Product Name.
  Missing Display Range Limits Descriptor.
EDID:
  Extension Block 1 started with EDID header, ignoring Extension Blocks >= 1.

EDID conformity: FAIL
