edid-decode (hex):

00 ff ff ff ff ff ff 00 15 c3 57 24 01 01 01 01
20 19 01 03 80 35 1e 78 ea 21 9d a3 5a 52 a0 26
14 4b 54 a5 4b 00 31 7c 45 7c 61 7c 81 80 81 bc
d1 c0 81 c0 01 01 02 3a 80 18 71 38 2d 40 58 2c
45 00 0a 26 21 00 00 1e 00 00 00 ff 00 33 37 35
34 32 30 38 35 0a 20 20 20 20 00 00 00 fd 00 3b
7a 1f 8a 1d 00 0a 20 20 20 20 20 20 00 00 00 fc
00 46 47 32 34 32 31 0a 20 20 20 20 20 20 01 be

02 01 04 00 fe 5b 80 a0 70 38 35 40 30 20 35 00
0a 26 21 00 00 1a 86 6f 80 a0 70 38 40 40 30 20
35 00 0a 26 21 00 00 1a 00 00 00 00 00 00 00 00
00 00 00 00 00 00 00 00 00 00 00 00 00 00 00 00
00 00 00 00 00 00 00 00 00 00 00 00 00 00 00 00
00 00 00 00 00 00 00 00 00 00 00 00 00 00 00 00
00 00 00 00 00 00 00 00 00 00 00 00 00 00 00 00
00 00 00 00 00 00 00 00 00 00 00 00 00 00 00 46

00 ff ff ff ff ff ff 00 15 c3 57 24 01 01 01 01
20 19 01 03 80 35 1e 78 ea 21 9d a3 5a 52 a0 26
14 4b 54 a5 4b 00 31 7c 45 7c 61 7c 81 80 81 bc
d1 c0 81 c0 01 01 02 3a 80 18 71 38 2d 40 58 2c
45 00 0a 26 21 00 00 1e 00 00 00 ff 00 33 37 35
34 32 30 38 35 0a 20 20 20 20 00 00 00 fd 00 3b
7a 1f 8a 1d 00 0a 20 20 20 20 20 20 00 00 00 fc
00 46 47 32 34 32 31 0a 20 20 20 20 20 20 01 be

02 01 04 00 fe 5b 80 a0 70 38 35 40 30 20 35 00
0a 26 21 00 00 1a 86 6f 80 a0 70 38 40 40 30 20
35 00 0a 26 21 00 00 1a 00 00 00 00 00 00 00 00
00 00 00 00 00 00 00 00 00 00 00 00 00 00 00 00
00 00 00 00 00 00 00 00 00 00 00 00 00 00 00 00
00 00 00 00 00 00 00 00 00 00 00 00 00 00 00 00
00 00 00 00 00 00 00 00 00 00 00 00 00 00 00 00
00 00 00 00 00 00 00 00 00 00 00 00 00 00 00 46

----------------

Block 0, Base EDID:
  EDID Structure Version & Revision: 1.3
  Vendor & Product Identification:
    Manufacturer: ENC
    Model: 9303
    Serial Number: ...
    Made in: week 32 of 2015
  Basic Display Parameters & Features:
    Digital display
    Maximum image size: 53 cm x 30 cm
    Gamma: 2.20
    DPMS levels: Standby Suspend Off
    RGB color display
    First detailed timing is the preferred timing
  Color Characteristics:
    Red  : 0.6367, 0.3535
    Green: 0.3203, 0.6259
    Blue : 0.1503, 0.0791
    White: 0.2958, 0.3291
  Established Timings I & II:
    IBM     :   720x400    70.081663 Hz   9:5     31.467 kHz     28.320000 MHz
    DMT 0x04:   640x480    59.940476 Hz   4:3     31.469 kHz     25.175000 MHz
    DMT 0x06:   640x480    75.000000 Hz   4:3     37.500 kHz     31.500000 MHz
    DMT 0x09:   800x600    60.316541 Hz   4:3     37.879 kHz     40.000000 MHz
    DMT 0x0b:   800x600    75.000000 Hz   4:3     46.875 kHz     49.500000 MHz
    DMT 0x10:  1024x768    60.003840 Hz   4:3     48.363 kHz     65.000000 MHz
    DMT 0x12:  1024x768    75.028582 Hz   4:3     60.023 kHz     78.750000 MHz
    DMT 0x24:  1280x1024   75.024675 Hz   5:4     79.976 kHz    135.000000 MHz
  Standard Timings:
    GTF     :   640x480   119.999084 Hz   4:3     61.800 kHz     52.406000 MHz
    GTF     :   800x600   119.999886 Hz   4:3     77.160 kHz     83.950000 MHz
    GTF     :  1024x768   119.999931 Hz   4:3     98.760 kHz    139.054000 MHz
    DMT 0x23:  1280x1024   60.019740 Hz   5:4     63.981 kHz    108.000000 MHz
    GTF     :  1280x1024  120.000185 Hz   5:4    131.640 kHz    233.793000 MHz
    DMT 0x52:  1920x1080   60.000000 Hz  16:9     67.500 kHz    148.500000 MHz
    DMT 0x55:  1280x720    60.000000 Hz  16:9     45.000 kHz     74.250000 MHz
  Detailed Timing Descriptors:
    DTD 1:  1920x1080   60.000000 Hz  16:9     67.500 kHz    148.500000 MHz (522 mm x 294 mm)
                 Hfront   88 Hsync  44 Hback  148 Hpol P
                 Vfront    4 Vsync   5 Vback   36 Vpol P
    Display Product Serial Number: ...
    Display Range Limits:
      Monitor ranges (GTF): 59-122 Hz V, 31-138 kHz H, max dotclock 290 MHz
    Display Product Name: 'FG2421'
  Extension blocks: 1
Checksum: 0xbe

----------------

Block 1, CTA-861 Extension Block:
  Revision: 1
  Detailed Timing Descriptors:
    DTD 2:  1920x1080   99.930409 Hz  16:9    113.221 kHz    235.500000 MHz (522 mm x 294 mm)
                 Hfront   48 Hsync  32 Hback   80 Hpol P
                 Vfront    3 Vsync   5 Vback   45 Vpol N
    DTD 3:  1920x1080  119.982181 Hz  16:9    137.260 kHz    285.500000 MHz (522 mm x 294 mm)
                 Hfront   48 Hsync  32 Hback   80 Hpol P
                 Vfront    3 Vsync   5 Vback   56 Vpol N
Checksum: 0x46  Unused space in Extension Block: 87 bytes

----------------

Block 2, Unknown EDID Extension Block 0x00:
  00 ff ff ff ff ff ff 00 15 c3 57 24 01 01 01 01 '..........W$....'
  20 19 01 03 80 35 1e 78 ea 21 9d a3 5a 52 a0 26 ' ....5.x.!..ZR.&'
  14 4b 54 a5 4b 00 31 7c 45 7c 61 7c 81 80 81 bc '.KT.K.1|E|a|....'
  d1 c0 81 c0 01 01 02 3a 80 18 71 38 2d 40 58 2c '.......:..q8-@X,'
  45 00 0a 26 21 00 00 1e 00 00 00 ff 00 33 37 35 'E..&!........375'
  34 32 30 38 35 0a 20 20 20 20 00 00 00 fd 00 3b '42085.    .....;'
  7a 1f 8a 1d 00 0a 20 20 20 20 20 20 00 00 00 fc 'z.....      ....'
  00 46 47 32 34 32 31 0a 20 20 20 20 20 20 01 be '.FG2421.      ..'
Checksum: 0xbe

----------------

Block 3, CTA-861 Extension Block:
  Revision: 1
  Detailed Timing Descriptors:
    DTD 4:  1920x1080   99.930409 Hz  16:9    113.221 kHz    235.500000 MHz (522 mm x 294 mm)
                 Hfront   48 Hsync  32 Hback   80 Hpol P
                 Vfront    3 Vsync   5 Vback   45 Vpol N
    DTD 5:  1920x1080  119.982181 Hz  16:9    137.260 kHz    285.500000 MHz (522 mm x 294 mm)
                 Hfront   48 Hsync  32 Hback   80 Hpol P
                 Vfront    3 Vsync   5 Vback   56 Vpol N
Checksum: 0x46  Unused space in Extension Block: 87 bytes

----------------

Warnings:

Block 0, Base EDID:
  Vendor & Product Identification: The serial number is one of the known dummy values, it should probably be set to 0.
  Detailed Timing Descriptor #1: DTD is identical to VIC 16, which is not present in the CTA Ext Block.
Block 1, CTA-861 Extension Block:
  Display Product Serial Number is set, so the Serial Number in the Base EDID should be 0.
  Add a Colorimetry Data Block with the sRGB colorimetry bit set to avoid interop issues.

Failures:

Block 1, CTA-861 Extension Block:
  Missing VCDB, needed for Set Selectable RGB Quantization to avoid interop issues.
Block 2, Base EDID:
  Unknown Extension Block.
EDID:
  Base EDID: EDID specified 1 extension block(s), but found 3 extension block(s).
  Base EDID: EDID 1.3 requires a Block Map Extension in Block 1 if there are more than 2 blocks in the EDID.

EDID conformity: FAIL
