edid-decode (hex):

00 ff ff ff ff ff ff 00 06 af a4 d7 00 00 00 00
31 20 01 04 a5 1d 12 78 03 ea c5 a6 54 4a 9a 24
12 50 54 00 00 00 01 01 01 01 01 01 01 01 01 01
01 01 01 01 01 01 fa 3c 80 b8 70 b0 24 40 10 10
3e 00 1e b2 10 00 00 1a c8 30 80 b8 70 b0 24 40
10 10 3e 00 1e b2 10 00 00 1a 00 00 00 fe 00 56
30 39 58 54 80 42 31 33 33 55 41 4b 00 00 00 00
00 02 41 02 9e 00 12 00 00 0a 41 0a 20 20 00 37

00 ff ff ff ff ff ff 00 06 af a4 d7 00 00 00 00
31 20 01 04 a5 1d 12 78 03 ea c5 a6 54 4a 9a 24
12 50 54 00 00 00 01 01 01 01 01 01 01 01 01 01
01 01 01 01 01 01 fa 3c 80 b8 70 b0 24 40 10 10
3e 00 1e b2 10 00 00 1a c8 30 80 b8 70 b0 24 40
10 10 3e 00 1e b2 10 00 00 1a 00 00 00 fe 00 56
30 39 58 54 80 42 31 33 33 55 41 4b 00 00 00 00
00 02 41 02 9e 00 12 00 00 0a 41 0a 20 20 00 37

----------------

Block 0, Base EDID:
  EDID Structure Version & Revision: 1.4
  Vendor & Product Identification:
    Manufacturer: AUO
    Model: 55204
    Made in: week 49 of 2022
  Basic Display Parameters & Features:
    Digital display
    Bits per primary color channel: 8
    DisplayPort interface
    Maximum image size: 29 cm x 18 cm
    Gamma: 2.20
    Supported color formats: RGB 4:4:4
    First detailed timing includes the native pixel format and preferred refresh rate
    Display supports continuous frequencies
  Color Characteristics:
    Red  : 0.6513, 0.3300
    Green: 0.2910, 0.6035
    Blue : 0.1435, 0.0703
    White: 0.3134, 0.3291
  Established Timings I & II: none
  Standard Timings: none
  Detailed Timing Descriptors:
    DTD 1:  1920x1200   60.025902 Hz  16:10    74.192 kHz    156.100000 MHz (286 mm x 178 mm)
                 Hfront   16 Hsync  16 Hback  152 Hpol P
                 Vfront    3 Vsync  14 Vback   19 Vpol N
    DTD 2:  1920x1200   48.020722 Hz  16:10    59.354 kHz    124.880000 MHz (286 mm x 178 mm)
                 Hfront   16 Hsync  16 Hback  152 Hpol P
                 Vfront    3 Vsync  14 Vback   19 Vpol N
    Alphanumeric Data String: 'V09XT.B133UAK'
    Manufacturer-Specified Display Descriptor (0x00): 00 00 00 02 41 02 9e 00 12 00 00 0a 41 0a 20 20 '....A.......A.  '
Checksum: 0x37

----------------

Warnings:

Block 0, Base EDID:
  Alphanumeric Data String: Non-ASCII character 0x80 at position 5, can cause problems.
  Missing Display Product Name.

Failures:

Block 0, Base EDID:
  Missing Display Range Limits Descriptor.
EDID:
  Extension Block 1 started with EDID header, ignoring Extension Blocks >= 1.

EDID conformity: FAIL
