edid-decode (hex):

00 ff ff ff ff ff ff 00 30 ae 63 00 01 00 00 00
05 18 01 03 80 2b 18 78 ee 25 65 a3 54 4f a0 27
ab 50 54 00 00 00 01 01 01 01 01 01 01 01 01 01
01 01 01 01 01 01 49 2f 40 30 62 84 22 30 60 40
84 00 b2 ec 10 00 00 1a 00 00 00 fc 00 4c 65 6e
6f 76 6f 20 41 49 4f 20 50 43 00 00 00 fd 00 3b
3d 1e 47 0f 00 0a 20 20 20 20 20 20 00 00 00 ff
00 4c 45 4e 2d 45 36 33 7a 2d 45 0a 20 20 00 bb

----------------

Block 0, Base EDID:
  EDID Structure Version & Revision: 1.3
  Vendor & Product Identification:
    Manufacturer: LEN
    Model: 99
    Serial Number: ...
    Made in: week 5 of 2014
  Basic Display Parameters & Features:
    Digital display
    Maximum image size: 43 cm x 24 cm
    Gamma: 2.20
    DPMS levels: Standby Suspend Off
    RGB color display
    Default (sRGB) color space is primary color space
    First detailed timing is the preferred timing
  Color Characteristics:
    Red  : 0.6367, 0.3300
    Green: 0.3095, 0.6259
    Blue : 0.1533, 0.6699
    White: 0.3134, 0.3291
  Established Timings I & II: none
  Standard Timings: none
  Detailed Timing Descriptors:
    DTD 1:  1600x900    60.001784 Hz  16:9     56.042 kHz    121.050000 MHz (434 mm x 236 mm)
                 Hfront   96 Hsync  64 Hback  400 Hpol P
                 Vfront    8 Vsync   4 Vback   22 Vpol N
    Display Product Name: 'Lenovo AIO PC'
    Display Range Limits:
      Monitor ranges (GTF): 59-61 Hz V, 30-71 kHz H, max dotclock 150 MHz
    Display Product Serial Number: ...
Checksum: 0xbb

----------------

Warnings:

Block 0, Base EDID:
  Vendor & Product Identification: The serial number is one of the known dummy values, it should probably be set to 0.

Failures:

Block 0, Base EDID:
  Basic Display Parameters & Features: sRGB is signaled, but the chromaticities do not match.

EDID conformity: FAIL
