edid-decode (hex):

00 ff ff ff ff ff ff 00 09 e5 4a 0a 00 00 00 00
11 1f 01 04 a5 22 16 78 03 ee 95 a3 54 4c 99 26
0f 50 54 00 00 00 01 01 01 01 01 01 01 01 01 01
01 01 01 01 01 01 3e d8 00 a0 a0 40 60 60 30 20
36 00 59 d7 10 00 00 1a 1f 6c 00 a0 a0 40 60 60
30 20 36 00 59 d7 10 00 00 1a 00 00 00 fd 00 3c
78 cc cc 37 01 0a 20 20 20 20 20 20 00 00 00 03
00 0d 28 ff 0a 3c c8 23 0f 30 c8 00 00 00 01 53

70 20 79 00 00 25 01 09 65 72 08 65 72 08 3c 78
80 81 00 13 72 1a 00 00 03 01 3c 78 00 00 00 00
00 00 78 00 00 00 00 00 00 00 00 00 00 00 00 00
00 00 00 00 00 00 00 00 00 00 00 00 00 00 00 00
00 00 00 00 00 00 00 00 00 00 00 00 00 00 00 00
00 00 00 00 00 00 00 00 00 00 00 00 00 00 00 00
00 00 00 00 00 00 00 00 00 00 00 00 00 00 00 00
00 00 00 00 00 00 00 00 00 00 00 00 00 00 f6 90

00 ff ff ff ff ff ff 00 09 e5 4a 0a 00 00 00 00
11 1f 01 04 a5 22 16 78 03 ee 95 a3 54 4c 99 26
0f 50 54 00 00 00 01 01 01 01 01 01 01 01 01 01
01 01 01 01 01 01 3e d8 00 a0 a0 40 60 60 30 20
36 00 59 d7 10 00 00 1a 1f 6c 00 a0 a0 40 60 60
30 20 36 00 59 d7 10 00 00 1a 00 00 00 fd 00 3c
78 cc cc 37 01 0a 20 20 20 20 20 20 00 00 00 03
00 0d 28 ff 0a 3c c8 23 0f 30 c8 00 00 00 01 53

70 20 79 00 00 25 01 09 65 72 08 65 72 08 3c 78
80 81 00 13 72 1a 00 00 03 01 3c 78 00 00 00 00
00 00 78 00 00 00 00 00 00 00 00 00 00 00 00 00
00 00 00 00 00 00 00 00 00 00 00 00 00 00 00 00
00 00 00 00 00 00 00 00 00 00 00 00 00 00 00 00
00 00 00 00 00 00 00 00 00 00 00 00 00 00 00 00
00 00 00 00 00 00 00 00 00 00 00 00 00 00 00 00
00 00 00 00 00 00 00 00 00 00 00 00 00 00 f6 90

----------------

Block 0, Base EDID:
  EDID Structure Version & Revision: 1.4
  Vendor & Product Identification:
    Manufacturer: BOE
    Model: 2634
    Made in: week 17 of 2021
  Basic Display Parameters & Features:
    Digital display
    Bits per primary color channel: 8
    DisplayPort interface
    Maximum image size: 34 cm x 22 cm
    Gamma: 2.20
    Supported color formats: RGB 4:4:4
    First detailed timing includes the native pixel format and preferred refresh rate
    Display supports continuous frequencies
  Color Characteristics:
    Red  : 0.6396, 0.3300
    Green: 0.2998, 0.5996
    Blue : 0.1503, 0.0595
    White: 0.3134, 0.3291
  Established Timings I & II: none
  Standard Timings: none
  Detailed Timing Descriptors:
    DTD 1:  2560x1600  120.001214 Hz  16:10   203.522 kHz    553.580000 MHz (345 mm x 215 mm)
                 Hfront   48 Hsync  32 Hback   80 Hpol P
                 Vfront    3 Vsync   6 Vback   87 Vpol N
    DTD 2:  2560x1600   60.000607 Hz  16:10   101.761 kHz    276.790000 MHz (345 mm x 215 mm)
                 Hfront   48 Hsync  32 Hback   80 Hpol P
                 Vfront    3 Vsync   6 Vback   87 Vpol N
    Display Range Limits:
      Monitor ranges (Range Limits Only): 60-120 Hz V, 204-204 kHz H, max dotclock 550 MHz
    Manufacturer-Specified Display Descriptor (0x03): 00 03 00 0d 28 ff 0a 3c c8 23 0f 30 c8 00 00 00 '....(..<.#.0....'
  Extension blocks: 1
Checksum: 0x53

----------------

Block 1, DisplayID Extension Block:
  Version: 2.0
  Extension Count: 0
  Display Product Primary Use Case: Same primary use case as the base section
  Dynamic Video Timing Range Limits Data Block:
    Minimum Pixel Clock: 553574 kHz
    Maximum Pixel Clock: 553574 kHz
    Minimum Vertical Refresh Rate: 60 Hz
    Maximum Vertical Refresh Rate: 120 Hz
    Seamless Dynamic Video Timing Support: Yes
  CTA-861 DisplayID Data Block:
  Vendor-Specific Data Block (AMD), OUI 00-00-1A:
    Version: 3
    Feature Caps: 0x01
    Minimum Refresh Rate: 60 Hz
    Maximum Refresh Rate: 120 Hz
    Flags 1.x: 0x00
    Flags 2.x: 0x00
    Maximum luminance: 0 (50.000 cd/m^2)
    Minimum luminance: 0 (0.000 cd/m^2)
    Unknown: 0x00 0x00
  Checksum: 0xf6
Checksum: 0x90

----------------

Block 2, Unknown EDID Extension Block 0x00:
  00 ff ff ff ff ff ff 00 09 e5 4a 0a 00 00 00 00 '..........J.....'
  11 1f 01 04 a5 22 16 78 03 ee 95 a3 54 4c 99 26 '.....".x....TL.&'
  0f 50 54 00 00 00 01 01 01 01 01 01 01 01 01 01 '.PT.............'
  01 01 01 01 01 01 3e d8 00 a0 a0 40 60 60 30 20 '......>....@``0 '
  36 00 59 d7 10 00 00 1a 1f 6c 00 a0 a0 40 60 60 '6.Y......l...@``'
  30 20 36 00 59 d7 10 00 00 1a 00 00 00 fd 00 3c '0 6.Y..........<'
  78 cc cc 37 01 0a 20 20 20 20 20 20 00 00 00 03 'x..7..      ....'
  00 0d 28 ff 0a 3c c8 23 0f 30 c8 00 00 00 01 53 '..(..<.#.0.....S'
Checksum: 0x53

----------------

Block 3, DisplayID Extension Block:
  Version: 2.0
  Extension Count: 0
  Dynamic Video Timing Range Limits Data Block:
    Minimum Pixel Clock: 553574 kHz
    Maximum Pixel Clock: 553574 kHz
    Minimum Vertical Refresh Rate: 60 Hz
    Maximum Vertical Refresh Rate: 120 Hz
    Seamless Dynamic Video Timing Support: Yes
  CTA-861 DisplayID Data Block:
  Vendor-Specific Data Block (AMD), OUI 00-00-1A:
    Version: 3
    Feature Caps: 0x01
    Minimum Refresh Rate: 60 Hz
    Maximum Refresh Rate: 120 Hz
    Flags 1.x: 0x00
    Flags 2.x: 0x00
    Maximum luminance: 0 (50.000 cd/m^2)
    Minimum luminance: 0 (0.000 cd/m^2)
    Unknown: 0x00 0x00
  Checksum: 0xf6
Checksum: 0x90

----------------

Warnings:

Block 0, Base EDID:
  Missing Display Product Name.
EDID:
  Base EDID: Some timings are out of range of the Monitor Ranges:
    Horizontal Freq: 101.761 - 203.522 kHz (Monitor: 204.000 - 204.000 kHz)
    Maximum Clock: 553.580 MHz (Monitor: 550.000 MHz)

Failures:

Block 1, DisplayID Extension Block:
  DisplayID Base Block has no product type.
  Expected 0 DisplayID Extension Block, but got 1.
Block 2, Base EDID:
  Unknown Extension Block.
EDID:
  Base EDID: EDID specified 1 extension block(s), but found 3 extension block(s).
  DisplayID: DisplayID expects at least one preferred timing.

EDID conformity: FAIL
