edid-decode (hex):

00 ff ff ff ff ff ff 00 1c a3 18 00 88 88 00 00
00 1b 01 03 80 1a 0f 78 ee 43 00 a4 55 4d 9e 27
0e 50 54 21 08 00 81 00 81 80 81 c0 95 00 95 40
b3 00 a9 c0 d1 c0 02 3a 80 18 71 38 2d 40 58 2c
45 00 25 a5 10 00 00 1e 00 00 00 ff 00 38 38 38
38 0a 20 20 20 20 20 20 20 20 00 00 00 fd 00 30
3e 1e 44 11 00 0a 20 20 20 20 20 20 00 00 00 fc
00 4f 6e 6c 61 70 31 33 30 35 48 0a 20 20 01 60

02 03 24 71 4b 01 12 16 13 14 1f 07 03 04 05 90
29 0d 7f 07 15 7f ff 3d 7f ff 83 01 00 00 65 03
0c 00 10 00 00 00 00 10 00 40 31 20 0c 40 55 00
36 d4 31 00 00 18 00 00 00 10 00 1c 16 20 58 2c
25 00 36 d4 31 00 00 9e 00 00 00 10 00 1c 16 20
10 2c 25 80 36 d4 31 00 00 9e 00 00 00 10 00 d0
1e 20 b8 28 55 40 36 d4 31 00 00 1e 02 3a 80 18
71 38 2d 40 58 2c 45 00 25 a5 10 00 00 1e 00 cb

00 ff ff ff ff ff ff 00 1c a3 18 00 88 88 00 00
00 1b 01 03 80 1a 0f 78 ee 43 00 a4 55 4d 9e 27
0e 50 54 21 08 00 81 00 81 80 81 c0 95 00 95 40
b3 00 a9 c0 d1 c0 02 3a 80 18 71 38 2d 40 58 2c
45 00 25 a5 10 00 00 1e 00 00 00 ff 00 38 38 38
38 0a 20 20 20 20 20 20 20 20 00 00 00 fd 00 30
3e 1e 44 11 00 0a 20 20 20 20 20 20 00 00 00 fc
00 4f 6e 6c 61 70 31 33 30 35 48 0a 20 20 01 60

02 03 24 71 4b 01 12 16 13 14 1f 07 03 04 05 90
29 0d 7f 07 15 7f ff 3d 7f ff 83 01 00 00 65 03
0c 00 10 00 00 00 00 10 00 40 31 20 0c 40 55 00
36 d4 31 00 00 18 00 00 00 10 00 1c 16 20 58 2c
25 00 36 d4 31 00 00 9e 00 00 00 10 00 1c 16 20
10 2c 25 80 36 d4 31 00 00 9e 00 00 00 10 00 d0
1e 20 b8 28 55 40 36 d4 31 00 00 1e 02 3a 80 18
71 38 2d 40 58 2c 45 00 25 a5 10 00 00 1e 00 cb

----------------

Block 0, Base EDID:
  EDID Structure Version & Revision: 1.3
  Vendor & Product Identification:
    Manufacturer: GEC
    Model: 24
    Serial Number: ...
    Made in: 2017
  Basic Display Parameters & Features:
    Digital display
    Maximum image size: 26 cm x 15 cm
    Gamma: 2.20
    DPMS levels: Standby Suspend Off
    RGB color display
    Default (sRGB) color space is primary color space
    First detailed timing is the preferred timing
  Color Characteristics:
    Red  : 0.6416, 0.3320
    Green: 0.3007, 0.6201
    Blue : 0.1523, 0.0546
    White: 0.3125, 0.3281
  Established Timings I & II:
    DMT 0x04:   640x480    59.940476 Hz   4:3     31.469 kHz     25.175000 MHz
    DMT 0x09:   800x600    60.316541 Hz   4:3     37.879 kHz     40.000000 MHz
    DMT 0x10:  1024x768    60.003840 Hz   4:3     48.363 kHz     65.000000 MHz
  Standard Timings:
    DMT 0x1c:  1280x800    59.810326 Hz  16:10    49.702 kHz     83.500000 MHz
    DMT 0x23:  1280x1024   60.019740 Hz   5:4     63.981 kHz    108.000000 MHz
    DMT 0x55:  1280x720    60.000000 Hz  16:9     45.000 kHz     74.250000 MHz
    DMT 0x2f:  1440x900    59.887445 Hz  16:10    55.935 kHz    106.500000 MHz
    GTF     :  1440x1080   60.000055 Hz   4:3     67.080 kHz    129.867000 MHz
    DMT 0x3a:  1680x1050   59.954250 Hz  16:10    65.290 kHz    146.250000 MHz
    DMT 0x53:  1600x900    60.000000 Hz  16:9     60.000 kHz    108.000000 MHz (RB)
    DMT 0x52:  1920x1080   60.000000 Hz  16:9     67.500 kHz    148.500000 MHz
  Detailed Timing Descriptors:
    DTD 1:  1920x1080   60.000000 Hz  16:9     67.500 kHz    148.500000 MHz (293 mm x 165 mm)
                 Hfront   88 Hsync  44 Hback  148 Hpol P
                 Vfront    4 Vsync   5 Vback   36 Vpol P
    Display Product Serial Number: ...
    Display Range Limits:
      Monitor ranges (GTF): 48-62 Hz V, 30-68 kHz H, max dotclock 170 MHz
    Display Product Name: 'Onlap1305H'
  Extension blocks: 1
Checksum: 0x60

----------------

Block 1, CTA-861 Extension Block:
  Revision: 3
  Basic audio support
  Supports YCbCr 4:4:4
  Supports YCbCr 4:2:2
  Native DTDs: 1
  Video Data Block:
    VIC   1:   640x480    59.940476 Hz   4:3     31.469 kHz     25.175000 MHz
    VIC  18:   720x576    50.000000 Hz  16:9     31.250 kHz     27.000000 MHz
    VIC  22:  1440x576i   50.000000 Hz  16:9     15.625 kHz     27.000000 MHz
    VIC  19:  1280x720    50.000000 Hz  16:9     37.500 kHz     74.250000 MHz
    VIC  20:  1920x1080i  50.000000 Hz  16:9     28.125 kHz     74.250000 MHz
    VIC  31:  1920x1080   50.000000 Hz  16:9     56.250 kHz    148.500000 MHz
    VIC   7:  1440x480i   59.940060 Hz  16:9     15.734 kHz     27.000000 MHz
    VIC   3:   720x480    59.940060 Hz  16:9     31.469 kHz     27.000000 MHz
    VIC   4:  1280x720    60.000000 Hz  16:9     45.000 kHz     74.250000 MHz
    VIC   5:  1920x1080i  60.000000 Hz  16:9     33.750 kHz     74.250000 MHz
    VIC  16:  1920x1080   60.000000 Hz  16:9     67.500 kHz    148.500000 MHz (native)
  Audio Data Block:
    Linear PCM:
      Max channels: 6
      Supported sample rates (kHz): 192 176.4 96 88.2 48 44.1 32
      Supported sample sizes (bits): 24 20 16
    AC-3:
      Max channels: 6
      Supported sample rates (kHz): 192 176.4 96 88.2 48 44.1 32
      Maximum bit rate: 2040 kb/s
    DTS:
      Max channels: 6
      Supported sample rates (kHz): 192 176.4 96 88.2 48 44.1 32
      Maximum bit rate: 2040 kb/s
  Speaker Allocation Data Block:
    FL/FR - Front Left/Right
  Vendor-Specific Data Block (HDMI), OUI 00-0C-03:
    Source physical address: 1.0.0.0
  Detailed Timing Descriptors:
    Dummy Descriptor:
    Dummy Descriptor:
    Dummy Descriptor:
    Dummy Descriptor:
    DTD 2:  1920x1080   60.000000 Hz  16:9     67.500 kHz    148.500000 MHz (293 mm x 165 mm)
                 Hfront   88 Hsync  44 Hback  148 Hpol P
                 Vfront    4 Vsync   5 Vback   36 Vpol P
Checksum: 0xcb  Unused space in Extension Block: 1 byte

----------------

Warnings:

Block 1, CTA-861 Extension Block:
  IT Video Formats are overscanned by default, but normally this should be underscanned.
  Video Data Block: VIC 1 and the first DTD are not identical. Is this intended?
  Display Product Serial Number is set, so the Serial Number in the Base EDID should be 0.
EDID:
  Base EDID: Some timings are out of range of the Monitor Ranges:
    Horizontal Freq: 15.625 - 67.500 kHz (Monitor: 30.000 - 68.000 kHz)

Failures:

Block 0, Base EDID:
  Basic Display Parameters & Features: sRGB is signaled, but the chromaticities do not match.
  Detailed Timing Descriptor #1: Mismatch of image size 293x165 mm vs display size 260x150 mm.
Block 1, CTA-861 Extension Block:
  Dummy Descriptor: Dummy block filled with garbage.
  Dummy Descriptor: Dummy block filled with garbage.
  Dummy Descriptor: Dummy block filled with garbage.
  Dummy Descriptor: Dummy block filled with garbage.
  Detailed Timing Descriptor #2: Mismatch of image size 293x165 mm vs display size 260x150 mm.
  Detailed Timing Descriptor #2: Invalid detailed timing descriptor ordering.
  Missing VCDB, needed for Set Selectable RGB Quantization to avoid interop issues.
EDID:
  Extension Block 2 started with EDID header, ignoring Extension Blocks >= 2.
  Base EDID: The DTD max image size is 293x165mm, which is larger than the display size 260.0x150.0mm.

EDID conformity: FAIL
