edid-decode (hex):

00 ff ff ff ff ff ff 00 21 6b 00 00 00 00 00 00
1f 1b 01 03 80 31 1c a0 2a aa 33 a4 55 48 93 25
10 45 47 ff ff 80 81 8f 81 99 a9 40 61 59 45 59
31 59 01 01 01 01 02 3a 80 18 71 38 2d 40 46 28
55 00 e8 12 11 00 00 18 01 1d 00 72 51 d0 1e 20
46 28 55 00 e8 12 11 00 00 18 00 00 00 fc 00 4a
42 4c 20 42 61 72 20 35 2e 31 0a 20 00 00 00 fd
00 31 3d 0f 2e 08 00 0a 20 20 20 20 20 20 01 b5

02 03 2a 71 4f 81 82 83 84 85 9f 07 90 91 92 93
94 86 95 96 29 0d 5f 07 15 07 50 3d 1e c0 83 0f
00 00 67 03 0c 00 11 00 38 e1 01 1d 00 72 51 d0
1e 20 6e 28 55 00 e8 12 11 00 00 1e 8c 0a d0 8a
20 e0 2d 10 10 3e 96 00 e8 12 11 00 00 18 01 1d
80 18 71 1c 16 20 58 28 25 00 e8 12 11 00 00 98
01 1d 00 bc 52 d0 1e 20 b8 28 55 40 e8 12 11 00
00 1e 00 00 00 00 00 00 00 00 00 00 00 00 00 2c

00 ff ff ff ff ff ff 00 21 6b 00 00 00 00 00 00
1f 1b 01 03 80 31 1c a0 2a aa 33 a4 55 48 93 25
10 45 47 ff ff 80 81 8f 81 99 a9 40 61 59 45 59
31 59 01 01 01 01 02 3a 80 18 71 38 2d 40 46 28
55 00 e8 12 11 00 00 18 01 1d 00 72 51 d0 1e 20
46 28 55 00 e8 12 11 00 00 18 00 00 00 fc 00 4a
42 4c 20 42 61 72 20 35 2e 31 0a 20 00 00 00 fd
00 31 3d 0f 2e 08 00 0a 20 20 20 20 20 20 01 b5

02 03 2a 71 4f 81 82 83 84 85 9f 07 90 91 92 93
94 86 95 96 29 0d 5f 07 15 07 50 3d 1e c0 83 0f
00 00 67 03 0c 00 11 00 38 e1 01 1d 00 72 51 d0
1e 20 6e 28 55 00 e8 12 11 00 00 1e 8c 0a d0 8a
20 e0 2d 10 10 3e 96 00 e8 12 11 00 00 18 01 1d
80 18 71 1c 16 20 58 28 25 00 e8 12 11 00 00 98
01 1d 00 bc 52 d0 1e 20 b8 28 55 40 e8 12 11 00
00 1e 00 00 00 00 00 00 00 00 00 00 00 00 00 2c

----------------

Block 0, Base EDID:
  EDID Structure Version & Revision: 1.3
  Vendor & Product Identification:
    Manufacturer: HKK
    Model: 0
    Made in: week 31 of 2017
  Basic Display Parameters & Features:
    Digital display
    Maximum image size: 49 cm x 28 cm
    Gamma: 2.60
    DPMS levels: Off
    RGB color display
    First detailed timing is the preferred timing
  Color Characteristics:
    Red  : 0.6425, 0.3339
    Green: 0.2832, 0.5761
    Blue : 0.1445, 0.0654
    White: 0.2695, 0.2802
  Established Timings I & II:
    IBM     :   720x400    70.081663 Hz   9:5     31.467 kHz     28.320000 MHz
    IBM     :   720x400    87.849542 Hz   9:5     39.444 kHz     35.500000 MHz
    DMT 0x04:   640x480    59.940476 Hz   4:3     31.469 kHz     25.175000 MHz
    Apple   :   640x480    66.666667 Hz   4:3     35.000 kHz     30.240000 MHz
    DMT 0x05:   640x480    72.808802 Hz   4:3     37.861 kHz     31.500000 MHz
    DMT 0x06:   640x480    75.000000 Hz   4:3     37.500 kHz     31.500000 MHz
    DMT 0x08:   800x600    56.250000 Hz   4:3     35.156 kHz     36.000000 MHz
    DMT 0x09:   800x600    60.316541 Hz   4:3     37.879 kHz     40.000000 MHz
    DMT 0x0a:   800x600    72.187572 Hz   4:3     48.077 kHz     50.000000 MHz
    DMT 0x0b:   800x600    75.000000 Hz   4:3     46.875 kHz     49.500000 MHz
    Apple   :   832x624    74.551266 Hz   4:3     49.726 kHz     57.284000 MHz
    DMT 0x0f:  1024x768i   86.957532 Hz   4:3     35.522 kHz     44.900000 MHz
    DMT 0x10:  1024x768    60.003840 Hz   4:3     48.363 kHz     65.000000 MHz
    DMT 0x11:  1024x768    70.069359 Hz   4:3     56.476 kHz     75.000000 MHz
    DMT 0x12:  1024x768    75.028582 Hz   4:3     60.023 kHz     78.750000 MHz
    DMT 0x24:  1280x1024   75.024675 Hz   5:4     79.976 kHz    135.000000 MHz
    Apple   :  1152x870    75.061550 Hz 192:145   68.681 kHz    100.000000 MHz
  Standard Timings:
    DMT 0x24:  1280x1024   75.024675 Hz   5:4     79.976 kHz    135.000000 MHz
    DMT 0x25:  1280x1024   85.024098 Hz   5:4     91.146 kHz    157.500000 MHz
    DMT 0x33:  1600x1200   60.000000 Hz   4:3     75.000 kHz    162.000000 MHz
    DMT 0x13:  1024x768    84.996690 Hz   4:3     68.677 kHz     94.500000 MHz
    DMT 0x0c:   800x600    85.061274 Hz   4:3     53.674 kHz     56.250000 MHz
    DMT 0x07:   640x480    85.008312 Hz   4:3     43.269 kHz     36.000000 MHz
  Detailed Timing Descriptors:
    DTD 1:  1920x1080   60.000000 Hz  16:9     67.500 kHz    148.500000 MHz (488 mm x 274 mm)
                 Hfront   70 Hsync  40 Hback  170 Hpol N
                 Vfront    5 Vsync   5 Vback   35 Vpol N
    DTD 2:  1280x720    60.000000 Hz  16:9     45.000 kHz     74.250000 MHz (488 mm x 274 mm)
                 Hfront   70 Hsync  40 Hback  260 Hpol N
                 Vfront    5 Vsync   5 Vback   20 Vpol N
    Display Product Name: 'JBL Bar 5.1'
    Display Range Limits:
      Monitor ranges (GTF): 49-61 Hz V, 15-46 kHz H, max dotclock 80 MHz
  Extension blocks: 1
Checksum: 0xb5

----------------

Block 1, CTA-861 Extension Block:
  Revision: 3
  Basic audio support
  Supports YCbCr 4:4:4
  Supports YCbCr 4:2:2
  Native DTDs: 1
  Video Data Block:
    VIC   1:   640x480    59.940476 Hz   4:3     31.469 kHz     25.175000 MHz (native)
    VIC   2:   720x480    59.940060 Hz   4:3     31.469 kHz     27.000000 MHz (native)
    VIC   3:   720x480    59.940060 Hz  16:9     31.469 kHz     27.000000 MHz (native)
    VIC   4:  1280x720    60.000000 Hz  16:9     45.000 kHz     74.250000 MHz (native)
    VIC   5:  1920x1080i  60.000000 Hz  16:9     33.750 kHz     74.250000 MHz (native)
    VIC  31:  1920x1080   50.000000 Hz  16:9     56.250 kHz    148.500000 MHz (native)
    VIC   7:  1440x480i   59.940060 Hz  16:9     15.734 kHz     27.000000 MHz
    VIC  16:  1920x1080   60.000000 Hz  16:9     67.500 kHz    148.500000 MHz (native)
    VIC  17:   720x576    50.000000 Hz   4:3     31.250 kHz     27.000000 MHz (native)
    VIC  18:   720x576    50.000000 Hz  16:9     31.250 kHz     27.000000 MHz (native)
    VIC  19:  1280x720    50.000000 Hz  16:9     37.500 kHz     74.250000 MHz (native)
    VIC  20:  1920x1080i  50.000000 Hz  16:9     28.125 kHz     74.250000 MHz (native)
    VIC   6:  1440x480i   59.940060 Hz   4:3     15.734 kHz     27.000000 MHz (native)
    VIC  21:  1440x576i   50.000000 Hz   4:3     15.625 kHz     27.000000 MHz (native)
    VIC  22:  1440x576i   50.000000 Hz  16:9     15.625 kHz     27.000000 MHz (native)
  Audio Data Block:
    Linear PCM:
      Max channels: 6
      Supported sample rates (kHz): 192 96 88.2 48 44.1 32
      Supported sample sizes (bits): 24 20 16
    AC-3:
      Max channels: 6
      Supported sample rates (kHz): 48 44.1 32
      Maximum bit rate: 640 kb/s
    DTS:
      Max channels: 6
      Supported sample rates (kHz): 96 88.2 48 44.1
      Maximum bit rate: 1536 kb/s
  Speaker Allocation Data Block:
    FL/FR - Front Left/Right
    LFE1 - Low Frequency Effects 1
    FC - Front Center
    LS/RS - Left/Right Surround
  Vendor-Specific Data Block (HDMI), OUI 00-0C-03:
    Source physical address: 1.1.0.0
    DC_36bit
    DC_30bit
    DC_Y444
    Maximum TMDS clock: 1125 MHz
  Detailed Timing Descriptors:
    DTD 3:  1280x720    60.000000 Hz  16:9     45.000 kHz     74.250000 MHz (488 mm x 274 mm)
                 Hfront  110 Hsync  40 Hback  220 Hpol P
                 Vfront    5 Vsync   5 Vback   20 Vpol P
    DTD 4:   720x480    59.940060 Hz   3:2     31.469 kHz     27.000000 MHz (488 mm x 274 mm)
                 Hfront   16 Hsync  62 Hback   60 Hpol N
                 Vfront    9 Vsync   6 Vback   30 Vpol N
    DTD 5:  1920x1080i  60.000000 Hz  16:9     33.750 kHz     74.250000 MHz (488 mm x 274 mm)
                 Hfront   88 Hsync  40 Hback  152 Hpol N
                 Vfront    2 Vsync   5 Vback   15 Vpol N Vfront +0.5 Odd Field
                 Vfront    2 Vsync   5 Vback   15 Vpol N Vback  +0.5 Even Field
    DTD 6:  1280x720    50.000000 Hz  16:9     37.500 kHz     74.250000 MHz (488 mm x 274 mm)
                 Hfront  440 Hsync  40 Hback  220 Hpol P
                 Vfront    5 Vsync   5 Vback   20 Vpol P
Checksum: 0x2c  Unused space in Extension Block: 13 bytes

----------------

Warnings:

Block 0, Base EDID:
  Detailed Timing Descriptor #1: DTD is similar but not identical to VIC 16.
  Detailed Timing Descriptor #2: DTD is similar but not identical to VIC 4.
Block 1, CTA-861 Extension Block:
  IT Video Formats are overscanned by default, but normally this should be underscanned.
  Video Data Block: VIC 1 and the first DTD are not identical. Is this intended?
  Detailed Timing Descriptor #4: Image size is 488x274 mm, but based on the picture AR it should be 411x274 mm.
  Detailed Timing Descriptor #5: DTD is similar but not identical to VIC 5.
  Add a Colorimetry Data Block with the sRGB colorimetry bit set to avoid interop issues.
EDID:
  Base EDID: Some timings are out of range of the Monitor Ranges:
    Vertical Freq: 50.000 - 87.850 Hz (Monitor: 49.000 - 61.000 Hz)
    Horizontal Freq: 15.625 - 91.145 kHz (Monitor: 15.000 - 46.000 kHz)
    Maximum Clock: 162.000 MHz (Monitor: 80.000 MHz)

Failures:

Block 1, CTA-861 Extension Block:
  Vendor-Specific Data Block (HDMI), OUI 00-0C-03: HDMI VSDB Max TMDS rate is > 340.
  Missing VCDB, needed for Set Selectable RGB Quantization to avoid interop issues.
EDID:
  Extension Block 2 started with EDID header, ignoring Extension Blocks >= 2.
  CTA-861: Native progressive timings are a mix of several resolutions.
  CTA-861: Native interlaced timings are a mix of several resolutions.

EDID conformity: FAIL
