edid-decode (hex):

00 ff ff ff ff ff ff 00 4e 81 0c 00 00 00 00 00
28 21 01 04 a5 1e 13 78 03 55 45 92 5d 58 94 26
17 50 54 00 00 00 01 01 01 01 01 01 01 01 01 01
01 01 01 01 01 01 96 40 80 0b 71 b0 3c 40 30 20
36 00 2e bd 10 00 00 1a ab 33 80 0b 71 b0 3c 40
30 20 36 00 2e bd 10 00 00 1a 00 00 00 fe 00 49
4e 58 20 20 20 0a 20 20 20 20 20 20 00 00 00 fe
00 31 34 30 51 50 38 30 34 32 30 30 31 0a 00 38

00 ff ff ff ff ff ff 00 4e 81 0c 00 00 00 00 00
28 21 01 04 a5 1e 13 78 03 55 45 92 5d 58 94 26
17 50 54 00 00 00 01 01 01 01 01 01 01 01 01 01
01 01 01 01 01 01 96 40 80 0b 71 b0 3c 40 30 20
36 00 2e bd 10 00 00 1a ab 33 80 0b 71 b0 3c 40
30 20 36 00 2e bd 10 00 00 1a 00 00 00 fe 00 49
4e 58 20 20 20 0a 20 20 20 20 20 20 00 00 00 fe
00 31 34 30 51 50 38 30 34 32 30 30 31 0a 00 38

----------------

Block 0, Base EDID:
  EDID Structure Version & Revision: 1.4
  Vendor & Product Identification:
    Manufacturer: STA
    Model: 12
    Made in: week 40 of 2023
  Basic Display Parameters & Features:
    Digital display
    Bits per primary color channel: 8
    DisplayPort interface
    Maximum image size: 30 cm x 19 cm
    Gamma: 2.20
    Supported color formats: RGB 4:4:4
    First detailed timing includes the native pixel format and preferred refresh rate
    Display supports continuous frequencies
  Color Characteristics:
    Red  : 0.5712, 0.3642
    Green: 0.3447, 0.5791
    Blue : 0.1494, 0.0898
    White: 0.3134, 0.3291
  Established Timings I & II: none
  Standard Timings: none
  Detailed Timing Descriptors:
    DTD 1:  1920x1200   60.001016 Hz  16:10    75.601 kHz    165.340000 MHz (302 mm x 189 mm)
                 Hfront   48 Hsync  32 Hback  187 Hpol P
                 Vfront    3 Vsync   6 Vback   51 Vpol N
    DTD 2:  1920x1200   48.000087 Hz  16:10    60.480 kHz    132.270000 MHz (302 mm x 189 mm)
                 Hfront   48 Hsync  32 Hback  187 Hpol P
                 Vfront    3 Vsync   6 Vback   51 Vpol N
    Alphanumeric Data String: 'INX   '
    Alphanumeric Data String: '140QP8042001'
Checksum: 0x38

----------------

Warnings:

Block 0, Base EDID:
  Missing Display Product Name.

Failures:

Block 0, Base EDID:
  Alphanumeric Data String: One or more trailing spaces before newline.
  Missing Display Range Limits Descriptor.
EDID:
  Extension Block 1 started with EDID header, ignoring Extension Blocks >= 1.

EDID conformity: FAIL
