edid-decode (hex):

00 ff ff ff ff ff ff 00 22 0e 5a 35 01 01 01 01
10 1d 01 04 a5 1f 11 78 3a 28 65 97 59 54 8e 27
1e 50 54 a1 08 00 d1 c0 81 c0 81 80 b3 00 95 00
81 00 01 01 01 01 02 3a 80 18 71 38 2d 40 58 2c
45 00 35 ae 10 00 00 1e 00 00 00 fd 00 32 3c 1e
50 11 01 0a 20 20 20 20 20 20 00 00 00 fc 00 48
50 20 53 31 34 0a 20 20 20 20 20 20 00 00 00 ff
00 43 4e 4b 39 31 36 31 4d 57 4d 0a 20 20 00 63

00 ff ff ff ff ff ff 00 22 0e 5a 35 01 01 01 01
10 1d 01 04 a5 1f 11 78 3a 28 65 97 59 54 8e 27
1e 50 54 a1 08 00 d1 c0 81 c0 81 80 b3 00 95 00
81 00 01 01 01 01 02 3a 80 18 71 38 2d 40 58 2c
45 00 35 ae 10 00 00 1e 00 00 00 fd 00 32 3c 1e
50 11 01 0a 20 20 20 20 20 20 00 00 00 fc 00 48
50 20 53 31 34 0a 20 20 20 20 20 20 00 00 00 ff
00 43 4e 4b 39 31 36 31 4d 57 4d 0a 20 20 00 63

----------------

Block 0, Base EDID:
  EDID Structure Version & Revision: 1.4
  Vendor & Product Identification:
    Manufacturer: HPN
    Model: 13658
    Serial Number: ...
    Made in: week 16 of 2019
  Basic Display Parameters & Features:
    Digital display
    Bits per primary color channel: 8
    DisplayPort interface
    Maximum image size: 31 cm x 17 cm
    Gamma: 2.20
    DPMS levels: Off
    Supported color formats: RGB 4:4:4, YCrCb 4:4:4, YCrCb 4:2:2
    First detailed timing includes the native pixel format and preferred refresh rate
  Color Characteristics:
    Red  : 0.5898, 0.3496
    Green: 0.3300, 0.5546
    Blue : 0.1533, 0.1191
    White: 0.3134, 0.3291
  Established Timings I & II:
    IBM     :   720x400    70.081663 Hz   9:5     31.467 kHz     28.320000 MHz
    DMT 0x04:   640x480    59.940476 Hz   4:3     31.469 kHz     25.175000 MHz
    DMT 0x09:   800x600    60.316541 Hz   4:3     37.879 kHz     40.000000 MHz
    DMT 0x10:  1024x768    60.003840 Hz   4:3     48.363 kHz     65.000000 MHz
  Standard Timings:
    DMT 0x52:  1920x1080   60.000000 Hz  16:9     67.500 kHz    148.500000 MHz
    DMT 0x55:  1280x720    60.000000 Hz  16:9     45.000 kHz     74.250000 MHz
    DMT 0x23:  1280x1024   60.019740 Hz   5:4     63.981 kHz    108.000000 MHz
    DMT 0x3a:  1680x1050   59.954250 Hz  16:10    65.290 kHz    146.250000 MHz
    DMT 0x2f:  1440x900    59.887445 Hz  16:10    55.935 kHz    106.500000 MHz
    DMT 0x1c:  1280x800    59.810326 Hz  16:10    49.702 kHz     83.500000 MHz
  Detailed Timing Descriptors:
    DTD 1:  1920x1080   60.000000 Hz  16:9     67.500 kHz    148.500000 MHz (309 mm x 174 mm)
                 Hfront   88 Hsync  44 Hback  148 Hpol P
                 Vfront    4 Vsync   5 Vback   36 Vpol P
    Display Range Limits:
      Monitor ranges (Range Limits Only): 50-60 Hz V, 30-80 kHz H, max dotclock 170 MHz
    Display Product Name: 'HP S14'
    Display Product Serial Number: ...
Checksum: 0x63

----------------

Warnings:

Block 0, Base EDID:
  Vendor & Product Identification: The serial number is one of the known dummy values, it should probably be set to 0.
EDID:
  Base EDID: Some timings are out of range of the Monitor Ranges:
    Vertical Freq: 59.810 - 70.082 Hz (Monitor: 50.000 - 60.000 Hz)

Failures:

EDID:
  Extension Block 1 started with EDID header, ignoring Extension Blocks >= 1.

EDID conformity: FAIL
