edid-decode (hex):

00 ff ff ff ff ff ff 00 30 ae c6 65 01 01 01 01
31 1b 01 03 80 30 1b 78 2a c7 b5 a7 56 53 9c 27
10 50 54 a1 08 00 b3 00 81 80 95 00 a9 c0 d1 c0
01 01 01 01 01 01 02 3a 80 18 71 38 2d 40 58 2c
45 00 dc 0c 11 00 00 1e 68 42 80 6a 70 38 27 40
08 20 98 04 dc 0c 11 00 00 1e 00 00 00 fd 00 30
4c 1e 53 12 00 0a 20 20 20 20 20 20 00 00 00 fc
00 4c 45 4e 20 4c 49 32 32 36 34 64 0a 20 01 0c

02 03 27 f1 4b 90 10 01 1f 1f 04 13 02 03 13 13
23 09 07 07 83 01 00 00 65 03 0c 00 10 00 68 1a
00 00 01 01 00 4c e6 02 3a 80 18 71 38 2d 40 58
2c 45 00 dc 0c 11 00 00 1e 68 42 80 6a 70 38 27
40 08 20 98 04 dc 0c 11 00 00 1e ab 22 a0 a0 50
84 1a 30 30 20 36 00 dc 0c 11 00 00 1a 7c 2e 90
a0 60 1a 1e 40 30 20 36 00 dc 0c 11 00 00 1a 00
00 00 00 00 00 00 00 00 00 00 00 00 00 00 00 28

00 ff ff ff ff ff ff 00 30 ae c6 65 01 01 01 01
31 1b 01 03 80 30 1b 78 2a c7 b5 a7 56 53 9c 27
10 50 54 a1 08 00 b3 00 81 80 95 00 a9 c0 d1 c0
01 01 01 01 01 01 02 3a 80 18 71 38 2d 40 58 2c
45 00 dc 0c 11 00 00 1e 68 42 80 6a 70 38 27 40
08 20 98 04 dc 0c 11 00 00 1e 00 00 00 fd 00 30
4c 1e 53 12 00 0a 20 20 20 20 20 20 00 00 00 fc
00 4c 45 4e 20 4c 49 32 32 36 34 64 0a 20 01 0c

02 03 27 f1 4b 90 10 01 1f 1f 04 13 02 03 13 13
23 09 07 07 83 01 00 00 65 03 0c 00 10 00 68 1a
00 00 01 01 00 4c e6 02 3a 80 18 71 38 2d 40 58
2c 45 00 dc 0c 11 00 00 1e 68 42 80 6a 70 38 27
40 08 20 98 04 dc 0c 11 00 00 1e ab 22 a0 a0 50
84 1a 30 30 20 36 00 dc 0c 11 00 00 1a 7c 2e 90
a0 60 1a 1e 40 30 20 36 00 dc 0c 11 00 00 1a 00
00 00 00 00 00 00 00 00 00 00 00 00 00 00 00 28

----------------

Block 0, Base EDID:
  EDID Structure Version & Revision: 1.3
  Vendor & Product Identification:
    Manufacturer: LEN
    Model: 26054
    Serial Number: ...
    Made in: week 49 of 2017
  Basic Display Parameters & Features:
    Digital display
    Maximum image size: 48 cm x 27 cm
    Gamma: 2.20
    DPMS levels: Off
    RGB color display
    First detailed timing is the preferred timing
  Color Characteristics:
    Red  : 0.6552, 0.3359
    Green: 0.3251, 0.6123
    Blue : 0.1542, 0.0654
    White: 0.3134, 0.3291
  Established Timings I & II:
    IBM     :   720x400    70.081663 Hz   9:5     31.467 kHz     28.320000 MHz
    DMT 0x04:   640x480    59.940476 Hz   4:3     31.469 kHz     25.175000 MHz
    DMT 0x09:   800x600    60.316541 Hz   4:3     37.879 kHz     40.000000 MHz
    DMT 0x10:  1024x768    60.003840 Hz   4:3     48.363 kHz     65.000000 MHz
  Standard Timings:
    DMT 0x3a:  1680x1050   59.954250 Hz  16:10    65.290 kHz    146.250000 MHz
    DMT 0x23:  1280x1024   60.019740 Hz   5:4     63.981 kHz    108.000000 MHz
    DMT 0x2f:  1440x900    59.887445 Hz  16:10    55.935 kHz    106.500000 MHz
    DMT 0x53:  1600x900    60.000000 Hz  16:9     60.000 kHz    108.000000 MHz (RB)
    DMT 0x52:  1920x1080   60.000000 Hz  16:9     67.500 kHz    148.500000 MHz
  Detailed Timing Descriptors:
    DTD 1:  1920x1080   60.000000 Hz  16:9     67.500 kHz    148.500000 MHz (476 mm x 268 mm)
                 Hfront   88 Hsync  44 Hback  148 Hpol P
                 Vfront    4 Vsync   5 Vback   36 Vpol P
    DTD 2:  1920x1080   74.985863 Hz  16:9     83.909 kHz    170.000000 MHz (476 mm x 268 mm)
                 Hfront    8 Hsync  32 Hback   66 Hpol P
                 Vfront   25 Vsync   8 Vback    6 Vpol P
    Display Range Limits:
      Monitor ranges (GTF): 48-76 Hz V, 30-83 kHz H, max dotclock 180 MHz
    Display Product Name: 'LEN LI2264d'
  Extension blocks: 1
Checksum: 0x0c

----------------

Block 1, CTA-861 Extension Block:
  Revision: 3
  Underscans IT Video Formats by default
  Basic audio support
  Supports YCbCr 4:4:4
  Supports YCbCr 4:2:2
  Native DTDs: 1
  Video Data Block:
    VIC  16:  1920x1080   60.000000 Hz  16:9     67.500 kHz    148.500000 MHz (native)
    VIC  16:  1920x1080   60.000000 Hz  16:9     67.500 kHz    148.500000 MHz
    VIC   1:   640x480    59.940476 Hz   4:3     31.469 kHz     25.175000 MHz
    VIC  31:  1920x1080   50.000000 Hz  16:9     56.250 kHz    148.500000 MHz
    VIC  31:  1920x1080   50.000000 Hz  16:9     56.250 kHz    148.500000 MHz
    VIC   4:  1280x720    60.000000 Hz  16:9     45.000 kHz     74.250000 MHz
    VIC  19:  1280x720    50.000000 Hz  16:9     37.500 kHz     74.250000 MHz
    VIC   2:   720x480    59.940060 Hz   4:3     31.469 kHz     27.000000 MHz
    VIC   3:   720x480    59.940060 Hz  16:9     31.469 kHz     27.000000 MHz
    VIC  19:  1280x720    50.000000 Hz  16:9     37.500 kHz     74.250000 MHz
    VIC  19:  1280x720    50.000000 Hz  16:9     37.500 kHz     74.250000 MHz
  Audio Data Block:
    Linear PCM:
      Max channels: 2
      Supported sample rates (kHz): 48 44.1 32
      Supported sample sizes (bits): 24 20 16
  Speaker Allocation Data Block:
    FL/FR - Front Left/Right
  Vendor-Specific Data Block (HDMI), OUI 00-0C-03:
    Source physical address: 1.0.0.0
  Vendor-Specific Data Block (AMD), OUI 00-00-1A:
    Version: 1
    Flags 1: 0x01
      FreeSync Supported
    Minimum Refresh Rate: 0 Hz
    Maximum Refresh Rate: 76 Hz
    MCCS VCP Code: 0xe6
  Detailed Timing Descriptors:
    DTD 3:  1920x1080   60.000000 Hz  16:9     67.500 kHz    148.500000 MHz (476 mm x 268 mm)
                 Hfront   88 Hsync  44 Hback  148 Hpol P
                 Vfront    4 Vsync   5 Vback   36 Vpol P
    DTD 4:  1920x1080   74.985863 Hz  16:9     83.909 kHz    170.000000 MHz (476 mm x 268 mm)
                 Hfront    8 Hsync  32 Hback   66 Hpol P
                 Vfront   25 Vsync   8 Vback    6 Vpol P
    DTD 5:  1440x900    59.901458 Hz  16:10    55.469 kHz     88.750000 MHz (476 mm x 268 mm)
                 Hfront   48 Hsync  32 Hback   80 Hpol P
                 Vfront    3 Vsync   6 Vback   17 Vpol N
    DTD 6:  1680x1050   59.883253 Hz  16:10    64.674 kHz    119.000000 MHz (476 mm x 268 mm)
                 Hfront   48 Hsync  32 Hback   80 Hpol P
                 Vfront    3 Vsync   6 Vback   21 Vpol N
Checksum: 0x28  Unused space in Extension Block: 16 bytes

----------------

Warnings:

Block 0, Base EDID:
  Vendor & Product Identification: The serial number is one of the known dummy values, it should probably be set to 0.
Block 1, CTA-861 Extension Block:
  Detailed Timing Descriptor #5: Image size is 476x268 mm, but based on the picture AR it should be 428x268 mm.
  Detailed Timing Descriptor #6: Image size is 476x268 mm, but based on the picture AR it should be 428x268 mm.
  Add a Colorimetry Data Block with the sRGB colorimetry bit set to avoid interop issues.
EDID:
  Base EDID: Some timings are out of range of the Monitor Ranges:
    Horizontal Freq: 31.466 - 83.909 kHz (Monitor: 30.000 - 83.000 kHz)
    Could be due to a Monitor Range off-by-one rounding issue

Failures:

Block 1, CTA-861 Extension Block:
  Video Data Block: Duplicate VIC 16.
  Video Data Block: Duplicate VIC 31.
  Video Data Block: Duplicate VIC 19.
  Missing VCDB, needed for Set Selectable RGB Quantization to avoid interop issues.
EDID:
  Extension Block 2 started with EDID header, ignoring Extension Blocks >= 2.

EDID conformity: FAIL
