edid-decode (hex):

00 ff ff ff ff ff ff 00 39 ee 70 32 00 00 00 00
02 1d 01 03 80 46 27 78 2e 48 b5 a7 56 4b a0 25
0a 50 54 af cf 00 81 c0 81 00 81 40 81 80 95 00
a9 c0 b3 00 d1 c0 69 5e 00 a0 a0 a0 29 50 30 20
35 00 ba 89 21 00 00 1e 00 00 00 fd 00 32 4c 1e
70 18 00 0a 20 20 20 20 20 20 00 00 00 ff 00 30
30 30 30 30 30 30 30 30 30 30 30 0a 00 00 00 fc
00 45 4d 33 32 37 31 51 48 44 0a 20 20 20 00 8e

00 ff ff ff ff ff ff 00 39 ee 70 32 00 00 00 00
02 1d 01 03 80 46 27 78 2e 48 b5 a7 56 4b a0 25
0a 50 54 af cf 00 81 c0 81 00 81 40 81 80 95 00
a9 c0 b3 00 d1 c0 69 5e 00 a0 a0 a0 29 50 30 20
35 00 ba 89 21 00 00 1e 00 00 00 fd 00 32 4c 1e
70 18 00 0a 20 20 20 20 20 20 00 00 00 ff 00 30
30 30 30 30 30 30 30 30 30 30 30 0a 00 00 00 fc
00 45 4d 33 32 37 31 51 48 44 0a 20 20 20 00 8e

----------------

Block 0, Base EDID:
  EDID Structure Version & Revision: 1.3
  Vendor & Product Identification:
    Manufacturer: NON
    Model: 12912
    Made in: week 2 of 2019
  Basic Display Parameters & Features:
    Digital display
    Maximum image size: 70 cm x 39 cm
    Gamma: 2.20
    DPMS levels: Off
    RGB color display
    Default (sRGB) color space is primary color space
    First detailed timing is the preferred timing
  Color Characteristics:
    Red  : 0.6533, 0.3359
    Green: 0.2949, 0.6250
    Blue : 0.1464, 0.0419
    White: 0.3134, 0.3291
  Established Timings I & II:
    IBM     :   720x400    70.081663 Hz   9:5     31.467 kHz     28.320000 MHz
    DMT 0x04:   640x480    59.940476 Hz   4:3     31.469 kHz     25.175000 MHz
    DMT 0x05:   640x480    72.808802 Hz   4:3     37.861 kHz     31.500000 MHz
    DMT 0x06:   640x480    75.000000 Hz   4:3     37.500 kHz     31.500000 MHz
    DMT 0x08:   800x600    56.250000 Hz   4:3     35.156 kHz     36.000000 MHz
    DMT 0x09:   800x600    60.316541 Hz   4:3     37.879 kHz     40.000000 MHz
    DMT 0x0a:   800x600    72.187572 Hz   4:3     48.077 kHz     50.000000 MHz
    DMT 0x0b:   800x600    75.000000 Hz   4:3     46.875 kHz     49.500000 MHz
    DMT 0x10:  1024x768    60.003840 Hz   4:3     48.363 kHz     65.000000 MHz
    DMT 0x11:  1024x768    70.069359 Hz   4:3     56.476 kHz     75.000000 MHz
    DMT 0x12:  1024x768    75.028582 Hz   4:3     60.023 kHz     78.750000 MHz
    DMT 0x24:  1280x1024   75.024675 Hz   5:4     79.976 kHz    135.000000 MHz
  Standard Timings:
    DMT 0x55:  1280x720    60.000000 Hz  16:9     45.000 kHz     74.250000 MHz
    DMT 0x1c:  1280x800    59.810326 Hz  16:10    49.702 kHz     83.500000 MHz
    DMT 0x20:  1280x960    60.000000 Hz   4:3     60.000 kHz    108.000000 MHz
    DMT 0x23:  1280x1024   60.019740 Hz   5:4     63.981 kHz    108.000000 MHz
    DMT 0x2f:  1440x900    59.887445 Hz  16:10    55.935 kHz    106.500000 MHz
    DMT 0x53:  1600x900    60.000000 Hz  16:9     60.000 kHz    108.000000 MHz (RB)
    DMT 0x3a:  1680x1050   59.954250 Hz  16:10    65.290 kHz    146.250000 MHz
    DMT 0x52:  1920x1080   60.000000 Hz  16:9     67.500 kHz    148.500000 MHz
  Detailed Timing Descriptors:
    DTD 1:  2560x1440   59.997716 Hz  16:9     88.857 kHz    241.690000 MHz (698 mm x 393 mm)
                 Hfront   48 Hsync  32 Hback   80 Hpol P
                 Vfront    3 Vsync   5 Vback   33 Vpol P
    Display Range Limits:
      Monitor ranges (GTF): 50-76 Hz V, 30-112 kHz H, max dotclock 240 MHz
    Display Product Serial Number: ...
    Display Product Name: 'EM3271QHD'
Checksum: 0x8e

----------------

Warnings:

Block 0, Base EDID:
  Display Product Serial Number: ...
EDID:
  Base EDID: Some timings are out of range of the Monitor Ranges:
    Maximum Clock: 241.690 MHz (Monitor: 240.000 MHz)
    Could be due to a Monitor Range off-by-one rounding issue

Failures:

Block 0, Base EDID:
  Basic Display Parameters & Features: sRGB is signaled, but the chromaticities do not match.
EDID:
  Extension Block 1 started with EDID header, ignoring Extension Blocks >= 1.

EDID conformity: FAIL
