edid-decode (hex):

00 ff ff ff ff ff ff 00 06 af ed 25 00 00 00 00
00 1c 01 04 95 22 13 78 02 6e 85 93 58 58 92 28
1e 50 54 00 00 00 01 01 01 01 01 01 01 01 01 01
01 01 01 01 01 01 78 37 80 b4 70 38 2e 40 6c 30
aa 00 58 c2 10 00 00 1a 60 2c 80 b4 70 38 2e 40
6c 30 aa 00 58 c2 10 00 00 1a 00 00 00 fe 00 31
4b 31 44 47 80 42 31 35 36 48 41 4e 00 00 00 00
00 00 41 22 96 00 10 00 00 0a 01 0a 20 20 00 6c

----------------

Block 0, Base EDID:
  EDID Structure Version & Revision: 1.4
  Vendor & Product Identification:
    Manufacturer: AUO
    Model: 9709
    Made in: 2018
  Basic Display Parameters & Features:
    Digital display
    Bits per primary color channel: 6
    DisplayPort interface
    Maximum image size: 34 cm x 19 cm
    Gamma: 2.20
    Supported color formats: RGB 4:4:4
    First detailed timing includes the native pixel format and preferred refresh rate
  Color Characteristics:
    Red  : 0.5751, 0.3457
    Green: 0.3466, 0.5722
    Blue : 0.1582, 0.1171
    White: 0.3134, 0.3291
  Established Timings I & II: none
  Standard Timings: none
  Detailed Timing Descriptors:
    DTD 1:  1920x1080   60.052440 Hz  16:9     67.619 kHz    142.000000 MHz (344 mm x 194 mm)
                 Hfront  108 Hsync  48 Hback   24 Hpol P
                 Vfront   10 Vsync  10 Vback   26 Vpol N
    DTD 2:  1920x1080   48.041952 Hz  16:9     54.095 kHz    113.600000 MHz (344 mm x 194 mm)
                 Hfront  108 Hsync  48 Hback   24 Hpol P
                 Vfront   10 Vsync  10 Vback   26 Vpol N
    Alphanumeric Data String: '1K1DG.B156HAN'
    Manufacturer-Specified Display Descriptor (0x00): 00 00 00 00 41 22 96 00 10 00 00 0a 01 0a 20 20 '....A"........  '
Checksum: 0x6c

----------------

Warnings:

Block 0, Base EDID:
  Alphanumeric Data String: Non-ASCII character 0x80 at position 5, can cause problems.
  Missing Display Product Name.

EDID conformity: PASS
