edid-decode (hex):

00 ff ff ff ff ff ff 00 04 72 9f 07 92 3b 20 11
0c 1f 01 03 61 3c 21 78 09 ee 91 a3 54 4c 99 26
0f 50 54 a5 6b 80 81 c0 a9 c0 d1 c0 95 00 81 40
81 80 90 40 a9 40 f1 44 80 c8 70 38 1e 40 30 20
35 00 55 50 21 00 00 1e 00 00 00 fd 00 30 4b 0a
6e 15 00 0a 20 20 20 20 20 20 00 00 00 fc 00 51
47 32 37 31 0a 20 20 20 20 20 20 20 00 00 00 ff
00 32 31 31 32 30 33 42 39 32 33 57 30 31 00 dc

00 ff ff ff ff ff ff 00 04 72 9f 07 92 3b 20 11
0c 1f 01 03 61 3c 21 78 09 ee 91 a3 54 4c 99 26
0f 50 54 a5 6b 80 81 c0 a9 c0 d1 c0 95 00 81 40
81 80 90 40 a9 40 f1 44 80 c8 70 38 1e 40 30 20
35 00 55 50 21 00 00 1e 00 00 00 fd 00 30 4b 0a
6e 15 00 0a 20 20 20 20 20 20 00 00 00 fc 00 51
47 32 37 31 0a 20 20 20 20 20 20 20 00 00 00 ff
00 32 31 31 32 30 33 42 39 32 33 57 30 31 00 dc

----------------

Block 0, Base EDID:
  EDID Structure Version & Revision: 1.3
  Vendor & Product Identification:
    Manufacturer: ACR
    Model: 1951
    Serial Number: ...
    Made in: week 12 of 2021
  Basic Display Parameters & Features:
    Analog display
    Signal Level Standard: 0.700 : 0.000 : 0.700 V p-p
    Blank level equals black level
    Sync: Serration
    Maximum image size: 60 cm x 33 cm
    Gamma: 2.20
    RGB color display
    Supports GTF timings within operating range
  Color Characteristics:
    Red  : 0.6396, 0.3300
    Green: 0.2998, 0.5996
    Blue : 0.1503, 0.0595
    White: 0.3125, 0.3291
  Established Timings I & II:
    IBM     :   720x400    70.081663 Hz   9:5     31.467 kHz     28.320000 MHz
    DMT 0x04:   640x480    59.940476 Hz   4:3     31.469 kHz     25.175000 MHz
    DMT 0x06:   640x480    75.000000 Hz   4:3     37.500 kHz     31.500000 MHz
    DMT 0x09:   800x600    60.316541 Hz   4:3     37.879 kHz     40.000000 MHz
    DMT 0x0b:   800x600    75.000000 Hz   4:3     46.875 kHz     49.500000 MHz
    Apple   :   832x624    74.551266 Hz   4:3     49.726 kHz     57.284000 MHz
    DMT 0x10:  1024x768    60.003840 Hz   4:3     48.363 kHz     65.000000 MHz
    DMT 0x12:  1024x768    75.028582 Hz   4:3     60.023 kHz     78.750000 MHz
    DMT 0x24:  1280x1024   75.024675 Hz   5:4     79.976 kHz    135.000000 MHz
    Apple   :  1152x870    75.061550 Hz 192:145   68.681 kHz    100.000000 MHz
  Standard Timings:
    DMT 0x55:  1280x720    60.000000 Hz  16:9     45.000 kHz     74.250000 MHz
    DMT 0x53:  1600x900    60.000000 Hz  16:9     60.000 kHz    108.000000 MHz (RB)
    DMT 0x52:  1920x1080   60.000000 Hz  16:9     67.500 kHz    148.500000 MHz
    DMT 0x2f:  1440x900    59.887445 Hz  16:10    55.935 kHz    106.500000 MHz
    DMT 0x20:  1280x960    60.000000 Hz   4:3     60.000 kHz    108.000000 MHz
    DMT 0x23:  1280x1024   60.019740 Hz   5:4     63.981 kHz    108.000000 MHz
    DMT 0x2a:  1400x1050   59.978442 Hz   4:3     65.317 kHz    121.750000 MHz
    DMT 0x33:  1600x1200   60.000000 Hz   4:3     75.000 kHz    162.000000 MHz
  Detailed Timing Descriptors:
    DTD 1:  1920x1080   75.000000 Hz  16:9     83.250 kHz    176.490000 MHz (597 mm x 336 mm)
                 Hfront   48 Hsync  32 Hback  120 Hpol P
                 Vfront    3 Vsync   5 Vback   22 Vpol P
    Display Range Limits:
      Monitor ranges (GTF): 48-75 Hz V, 10-110 kHz H, max dotclock 210 MHz
    Display Product Name: 'QG271'
    Display Product Serial Number: ...
Checksum: 0xdc

----------------

Failures:

Block 0, Base EDID:
  Basic Display Parameters & Features: The chromaticities match sRGB, but sRGB is not signaled.
  Basic Display Parameters & Features: EDID 1.3 requires that the first detailed timing is the preferred timing.
EDID:
  Extension Block 1 started with EDID header, ignoring Extension Blocks >= 1.

EDID conformity: FAIL
