edid-decode (hex):

00 ff ff ff ff ff ff 00 24 d3 b0 00 04 02 00 00
29 20 01 03 0e 00 00 78 0a 26 70 a0 56 57 8b 2c
13 52 61 bf ef 80 95 00 61 7c 81 00 81 80 b3 00
81 c0 81 c0 a9 40 64 19 00 40 41 00 26 30 18 88
36 00 00 00 00 00 00 18 00 00 00 ff 00 43 52 5a
4a 32 34 31 30 30 35 31 36 0a 00 00 00 fc 00 50
72 6f 6a 65 63 74 6f 72 0a 20 20 20 00 00 00 fd
00 18 78 0f 5b 11 00 0a 20 20 20 20 20 20 00 d5

00 ff ff ff ff ff ff 00 24 d3 b0 00 04 02 00 00
29 20 01 03 0e 00 00 78 0a 26 70 a0 56 57 8b 2c
13 52 61 bf ef 80 95 00 61 7c 81 00 81 80 b3 00
81 c0 81 c0 a9 40 64 19 00 40 41 00 26 30 18 88
36 00 00 00 00 00 00 18 00 00 00 ff 00 43 52 5a
4a 32 34 31 30 30 35 31 36 0a 00 00 00 fc 00 50
72 6f 6a 65 63 74 6f 72 0a 20 20 20 00 00 00 fd
00 18 78 0f 5b 11 00 0a 20 20 20 20 20 20 00 d5

----------------

Block 0, Base EDID:
  EDID Structure Version & Revision: 1.3
  Vendor & Product Identification:
    Manufacturer: IFS
    Model: 176
    Serial Number: ...
    Made in: week 41 of 2022
  Basic Display Parameters & Features:
    Analog display
    Signal Level Standard: 0.700 : 0.300 : 1.000 V p-p
    Blank level equals black level
    Sync: Separate Composite SyncOnGreen
    Image size is variable
    Gamma: 2.20
    RGB color display
    First detailed timing is the preferred timing
  Color Characteristics:
    Red  : 0.6250, 0.3378
    Green: 0.3408, 0.5449
    Blue : 0.1728, 0.0771
    White: 0.3203, 0.3789
  Established Timings I & II:
    IBM     :   720x400    70.081663 Hz   9:5     31.467 kHz     28.320000 MHz
    DMT 0x04:   640x480    59.940476 Hz   4:3     31.469 kHz     25.175000 MHz
    Apple   :   640x480    66.666667 Hz   4:3     35.000 kHz     30.240000 MHz
    DMT 0x05:   640x480    72.808802 Hz   4:3     37.861 kHz     31.500000 MHz
    DMT 0x06:   640x480    75.000000 Hz   4:3     37.500 kHz     31.500000 MHz
    DMT 0x08:   800x600    56.250000 Hz   4:3     35.156 kHz     36.000000 MHz
    DMT 0x09:   800x600    60.316541 Hz   4:3     37.879 kHz     40.000000 MHz
    DMT 0x0a:   800x600    72.187572 Hz   4:3     48.077 kHz     50.000000 MHz
    DMT 0x0b:   800x600    75.000000 Hz   4:3     46.875 kHz     49.500000 MHz
    Apple   :   832x624    74.551266 Hz   4:3     49.726 kHz     57.284000 MHz
    DMT 0x10:  1024x768    60.003840 Hz   4:3     48.363 kHz     65.000000 MHz
    DMT 0x11:  1024x768    70.069359 Hz   4:3     56.476 kHz     75.000000 MHz
    DMT 0x12:  1024x768    75.028582 Hz   4:3     60.023 kHz     78.750000 MHz
    DMT 0x24:  1280x1024   75.024675 Hz   5:4     79.976 kHz    135.000000 MHz
    Apple   :  1152x870    75.061550 Hz 192:145   68.681 kHz    100.000000 MHz
  Standard Timings:
    DMT 0x2f:  1440x900    59.887445 Hz  16:10    55.935 kHz    106.500000 MHz
    GTF     :  1024x768   119.999931 Hz   4:3     98.760 kHz    139.054000 MHz
    DMT 0x1c:  1280x800    59.810326 Hz  16:10    49.702 kHz     83.500000 MHz
    DMT 0x23:  1280x1024   60.019740 Hz   5:4     63.981 kHz    108.000000 MHz
    DMT 0x3a:  1680x1050   59.954250 Hz  16:10    65.290 kHz    146.250000 MHz
    DMT 0x55:  1280x720    60.000000 Hz  16:9     45.000 kHz     74.250000 MHz
    DMT 0x55:  1280x720    60.000000 Hz  16:9     45.000 kHz     74.250000 MHz
    DMT 0x33:  1600x1200   60.000000 Hz   4:3     75.000 kHz    162.000000 MHz
  Detailed Timing Descriptors:
    DTD 1:  1024x768    60.003840 Hz   4:3     48.363 kHz     65.000000 MHz
                 Hfront   24 Hsync 136 Hback  160 Hpol N
                 Vfront    3 Vsync   6 Vback   29 Vpol N
    Display Product Serial Number: ...
    Display Product Name: 'Projector'
    Display Range Limits:
      Monitor ranges (GTF): 24-120 Hz V, 15-91 kHz H, max dotclock 170 MHz
Checksum: 0xd5

----------------

Warnings:

EDID:
  Base EDID: Some timings are out of range of the Monitor Ranges:
    Horizontal Freq: 31.466 - 98.759 kHz (Monitor: 15.000 - 91.000 kHz)

Failures:

EDID:
  Extension Block 1 started with EDID header, ignoring Extension Blocks >= 1.

EDID conformity: FAIL
