edid-decode (hex):

00 ff ff ff ff ff ff 00 5a 63 37 4f 01 01 01 01
09 1d 01 04 b5 52 23 78 3f 62 f5 aa 52 4c a3 26
0f 50 54 bf ef 80 d1 c0 d1 e8 b3 00 95 00 90 40
81 80 81 40 81 c0 e7 7c 70 a0 d0 a0 29 50 30 20
3a 00 33 5a 31 00 00 1a 00 00 00 ff 00 56 4b 4d
31 39 30 39 30 30 30 37 36 0a 00 00 00 fd 00 30
64 a0 a0 3c 01 0a 20 20 20 20 20 20 00 00 00 fc
00 58 47 33 35 30 52 2d 43 0a 20 20 20 20 01 28

02 03 2e f1 50 01 03 04 05 07 10 12 13 14 16 1f
20 21 22 40 53 23 09 07 07 83 01 00 00 65 03 0c
00 10 00 e3 05 e0 00 e6 06 05 01 53 53 00 56 5e
00 a0 a0 a0 29 50 30 20 35 00 33 5a 31 00 00 1e
5a a0 00 a0 a0 a0 46 50 30 20 35 00 33 5a 31 00
00 1e 4e d4 70 a0 d0 a0 46 50 30 40 3a 00 33 5a
31 00 00 1c f4 51 70 e0 d4 a0 35 50 00 70 3a 50
33 5a 31 00 00 1e 00 00 00 00 00 00 00 00 00 03

00 ff ff ff ff ff ff 00 5a 63 37 4f 01 01 01 01
09 1d 01 04 b5 52 23 78 3f 62 f5 aa 52 4c a3 26
0f 50 54 bf ef 80 d1 c0 d1 e8 b3 00 95 00 90 40
81 80 81 40 81 c0 e7 7c 70 a0 d0 a0 29 50 30 20
3a 00 33 5a 31 00 00 1a 00 00 00 ff 00 56 4b 4d
31 39 30 39 30 30 30 37 36 0a 00 00 00 fd 00 30
64 a0 a0 3c 01 0a 20 20 20 20 20 20 00 00 00 fc
00 58 47 33 35 30 52 2d 43 0a 20 20 20 20 01 28

02 03 2e f1 50 01 03 04 05 07 10 12 13 14 16 1f
20 21 22 40 53 23 09 07 07 83 01 00 00 65 03 0c
00 10 00 e3 05 e0 00 e6 06 05 01 53 53 00 56 5e
00 a0 a0 a0 29 50 30 20 35 00 33 5a 31 00 00 1e
5a a0 00 a0 a0 a0 46 50 30 20 35 00 33 5a 31 00
00 1e 4e d4 70 a0 d0 a0 46 50 30 40 3a 00 33 5a
31 00 00 1c f4 51 70 e0 d4 a0 35 50 00 70 3a 50
33 5a 31 00 00 1e 00 00 00 00 00 00 00 00 00 03

----------------

Block 0, Base EDID:
  EDID Structure Version & Revision: 1.4
  Vendor & Product Identification:
    Manufacturer: VSC
    Model: 20279
    Serial Number: ...
    Made in: week 9 of 2019
  Basic Display Parameters & Features:
    Digital display
    Bits per primary color channel: 10
    DisplayPort interface
    Maximum image size: 82 cm x 35 cm
    Gamma: 2.20
    DPMS levels: Off
    Supported color formats: RGB 4:4:4, YCrCb 4:4:4, YCrCb 4:2:2
    Default (sRGB) color space is primary color space
    First detailed timing includes the native pixel format and preferred refresh rate
    Display supports continuous frequencies
  Color Characteristics:
    Red  : 0.6650, 0.3222
    Green: 0.2968, 0.6386
    Blue : 0.1513, 0.0615
    White: 0.3134, 0.3291
  Established Timings I & II:
    IBM     :   720x400    70.081663 Hz   9:5     31.467 kHz     28.320000 MHz
    DMT 0x04:   640x480    59.940476 Hz   4:3     31.469 kHz     25.175000 MHz
    Apple   :   640x480    66.666667 Hz   4:3     35.000 kHz     30.240000 MHz
    DMT 0x05:   640x480    72.808802 Hz   4:3     37.861 kHz     31.500000 MHz
    DMT 0x06:   640x480    75.000000 Hz   4:3     37.500 kHz     31.500000 MHz
    DMT 0x08:   800x600    56.250000 Hz   4:3     35.156 kHz     36.000000 MHz
    DMT 0x09:   800x600    60.316541 Hz   4:3     37.879 kHz     40.000000 MHz
    DMT 0x0a:   800x600    72.187572 Hz   4:3     48.077 kHz     50.000000 MHz
    DMT 0x0b:   800x600    75.000000 Hz   4:3     46.875 kHz     49.500000 MHz
    Apple   :   832x624    74.551266 Hz   4:3     49.726 kHz     57.284000 MHz
    DMT 0x10:  1024x768    60.003840 Hz   4:3     48.363 kHz     65.000000 MHz
    DMT 0x11:  1024x768    70.069359 Hz   4:3     56.476 kHz     75.000000 MHz
    DMT 0x12:  1024x768    75.028582 Hz   4:3     60.023 kHz     78.750000 MHz
    DMT 0x24:  1280x1024   75.024675 Hz   5:4     79.976 kHz    135.000000 MHz
    Apple   :  1152x870    75.061550 Hz 192:145   68.681 kHz    100.000000 MHz
  Standard Timings:
    DMT 0x52:  1920x1080   60.000000 Hz  16:9     67.500 kHz    148.500000 MHz
    GTF     :  1920x1080  100.000000 Hz  16:9    114.400 kHz    302.016000 MHz
    DMT 0x3a:  1680x1050   59.954250 Hz  16:10    65.290 kHz    146.250000 MHz
    DMT 0x2f:  1440x900    59.887445 Hz  16:10    55.935 kHz    106.500000 MHz
    DMT 0x2a:  1400x1050   59.978442 Hz   4:3     65.317 kHz    121.750000 MHz
    DMT 0x23:  1280x1024   60.019740 Hz   5:4     63.981 kHz    108.000000 MHz
    DMT 0x20:  1280x960    60.000000 Hz   4:3     60.000 kHz    108.000000 MHz
    DMT 0x55:  1280x720    60.000000 Hz  16:9     45.000 kHz     74.250000 MHz
  Detailed Timing Descriptors:
    DTD 1:  3440x1440   59.972616 Hz  43:18    88.819 kHz    319.750000 MHz (819 mm x 346 mm)
                 Hfront   48 Hsync  32 Hback   80 Hpol P
                 Vfront    3 Vsync  10 Vback   28 Vpol N
    Display Product Serial Number: ...
    Display Range Limits:
      Monitor ranges (Range Limits Only): 48-100 Hz V, 160-160 kHz H, max dotclock 600 MHz
    Display Product Name: 'XG350R-C'
  Extension blocks: 1
Checksum: 0x28

----------------

Block 1, CTA-861 Extension Block:
  Revision: 3
  Underscans IT Video Formats by default
  Basic audio support
  Supports YCbCr 4:4:4
  Supports YCbCr 4:2:2
  Native DTDs: 1
  Video Data Block:
    VIC   1:   640x480    59.940476 Hz   4:3     31.469 kHz     25.175000 MHz
    VIC   3:   720x480    59.940060 Hz  16:9     31.469 kHz     27.000000 MHz
    VIC   4:  1280x720    60.000000 Hz  16:9     45.000 kHz     74.250000 MHz
    VIC   5:  1920x1080i  60.000000 Hz  16:9     33.750 kHz     74.250000 MHz
    VIC   7:  1440x480i   59.940060 Hz  16:9     15.734 kHz     27.000000 MHz
    VIC  16:  1920x1080   60.000000 Hz  16:9     67.500 kHz    148.500000 MHz
    VIC  18:   720x576    50.000000 Hz  16:9     31.250 kHz     27.000000 MHz
    VIC  19:  1280x720    50.000000 Hz  16:9     37.500 kHz     74.250000 MHz
    VIC  20:  1920x1080i  50.000000 Hz  16:9     28.125 kHz     74.250000 MHz
    VIC  22:  1440x576i   50.000000 Hz  16:9     15.625 kHz     27.000000 MHz
    VIC  31:  1920x1080   50.000000 Hz  16:9     56.250 kHz    148.500000 MHz
    VIC  32:  1920x1080   24.000000 Hz  16:9     27.000 kHz     74.250000 MHz
    VIC  33:  1920x1080   25.000000 Hz  16:9     28.125 kHz     74.250000 MHz
    VIC  34:  1920x1080   30.000000 Hz  16:9     33.750 kHz     74.250000 MHz
    VIC  64:  1920x1080  100.000000 Hz  16:9    112.500 kHz    297.000000 MHz
    VIC  83:  1680x720    60.000000 Hz  64:27    45.000 kHz     99.000000 MHz
  Audio Data Block:
    Linear PCM:
      Max channels: 2
      Supported sample rates (kHz): 48 44.1 32
      Supported sample sizes (bits): 24 20 16
  Speaker Allocation Data Block:
    FL/FR - Front Left/Right
  Vendor-Specific Data Block (HDMI), OUI 00-0C-03:
    Source physical address: 1.0.0.0
  Colorimetry Data Block:
    BT2020cYCC
    BT2020YCC
    BT2020RGB
  HDR Static Metadata Data Block:
    Electro optical transfer functions:
      Traditional gamma - SDR luminance range
      SMPTE ST2084
    Supported static metadata descriptors:
      Static metadata type 1
    Desired content max luminance: 83 (301.833 cd/m^2)
    Desired content max frame-average luminance: 83 (301.833 cd/m^2)
    Desired content min luminance: 0 (0.000 cd/m^2)
  Detailed Timing Descriptors:
    DTD 2:  2560x1440   59.950550 Hz  16:9     88.787 kHz    241.500000 MHz (819 mm x 346 mm)
                 Hfront   48 Hsync  32 Hback   80 Hpol P
                 Vfront    3 Vsync   5 Vback   33 Vpol P
    DTD 3:  2560x1440   99.946436 Hz  16:9    150.919 kHz    410.500000 MHz (819 mm x 346 mm)
                 Hfront   48 Hsync  32 Hback   80 Hpol P
                 Vfront    3 Vsync   5 Vback   62 Vpol P
    DTD 4:  3440x1440   99.981604 Hz  43:18   150.972 kHz    543.500000 MHz (819 mm x 346 mm)
                 Hfront   48 Hsync  64 Hback   48 Hpol N
                 Vfront    3 Vsync  10 Vback   57 Vpol P
    DTD 5:  3440x1440   29.974923 Hz  43:18    44.753 kHz    209.800000 MHz (819 mm x 346 mm)
                 Hfront  256 Hsync 368 Hback  624 Hpol P
                 Vfront    3 Vsync  10 Vback   40 Vpol P
Checksum: 0x03  Unused space in Extension Block: 9 bytes

----------------

Warnings:

Block 0, Base EDID:
  Vendor & Product Identification: The serial number is one of the known dummy values, it should probably be set to 0.
Block 1, CTA-861 Extension Block:
  Video Data Block: VIC 1 and the first DTD are not identical. Is this intended?
  Video Data Block: All VICs are in ascending order, and the first (preferred) VIC <= 4, is that intended?
  Detailed Timing Descriptor #2: Image size is 819x346 mm, but based on the picture AR it should be 615x346 mm.
  Detailed Timing Descriptor #3: Image size is 819x346 mm, but based on the picture AR it should be 615x346 mm.
  Display Product Serial Number is set, so the Serial Number in the Base EDID should be 0.
EDID:
  Base EDID: Some timings are out of range of the Monitor Ranges:
    Vertical Freq: 24.000 - 100.000 Hz (Monitor: 48.000 - 100.000 Hz)
    Horizontal Freq: 15.625 - 150.972 kHz (Monitor: 160.000 - 160.000 kHz)

Failures:

Block 0, Base EDID:
  Basic Display Parameters & Features: sRGB is signaled, but the chromaticities do not match.
Block 1, CTA-861 Extension Block:
  Vendor-Specific Data Block (HDMI), OUI 00-0C-03: The HDMI Specification requires EDID 1.3 instead of 1.4.
  Missing VCDB, needed for Set Selectable RGB Quantization to avoid interop issues.
EDID:
  Extension Block 2 started with EDID header, ignoring Extension Blocks >= 2.

EDID conformity: FAIL
