edid-decode (hex):

00 ff ff ff ff ff ff 00 09 e5 4a 0b 00 00 00 00
28 1f 01 04 a5 1d 12 78 07 cf 15 a6 55 4c 9e 25
0f 50 54 00 00 00 01 01 01 01 01 01 01 01 01 01
01 01 01 01 01 01 68 7e 80 c8 70 b0 40 45 30 20
36 00 20 b4 10 00 00 00 00 00 00 fd 00 30 78 99
99 20 01 0a 20 20 20 20 20 20 00 00 00 fc 00 4e
45 31 33 34 57 55 4d 2d 4e 38 32 0a 00 00 00 fe
00 20 20 20 20 20 20 20 20 20 20 20 20 0a 01 dc

70 20 79 02 00 22 00 14 0c f0 04 85 7f 07 c7 00
2f 00 1f 00 af 04 47 00 02 00 05 00 2b 00 06 27
00 30 77 00 00 81 00 13 72 1a 00 00 03 01 30 78
00 00 00 00 00 00 78 00 00 00 00 00 00 00 00 00
00 00 00 00 00 00 00 00 00 00 00 00 00 00 00 00
00 00 00 00 00 00 00 00 00 00 00 00 00 00 00 00
00 00 00 00 00 00 00 00 00 00 00 00 00 00 00 00
00 00 00 00 00 00 00 00 00 00 00 00 00 00 cb 90

00 ff ff ff ff ff ff 00 09 e5 4a 0b 00 00 00 00
28 1f 01 04 a5 1d 12 78 07 cf 15 a6 55 4c 9e 25
0f 50 54 00 00 00 01 01 01 01 01 01 01 01 01 01
01 01 01 01 01 01 68 7e 80 c8 70 b0 40 45 30 20
36 00 20 b4 10 00 00 00 00 00 00 fd 00 30 78 99
99 20 01 0a 20 20 20 20 20 20 00 00 00 fc 00 4e
45 31 33 34 57 55 4d 2d 4e 38 32 0a 00 00 00 fe
00 20 20 20 20 20 20 20 20 20 20 20 20 0a 01 dc

70 20 79 02 00 22 00 14 0c f0 04 85 7f 07 c7 00
2f 00 1f 00 af 04 47 00 02 00 05 00 2b 00 06 27
00 30 77 00 00 81 00 13 72 1a 00 00 03 01 30 78
00 00 00 00 00 00 78 00 00 00 00 00 00 00 00 00
00 00 00 00 00 00 00 00 00 00 00 00 00 00 00 00
00 00 00 00 00 00 00 00 00 00 00 00 00 00 00 00
00 00 00 00 00 00 00 00 00 00 00 00 00 00 00 00
00 00 00 00 00 00 00 00 00 00 00 00 00 00 cb 90

----------------

Block 0, Base EDID:
  EDID Structure Version & Revision: 1.4
  Vendor & Product Identification:
    Manufacturer: BOE
    Model: 2890
    Made in: week 40 of 2021
  Basic Display Parameters & Features:
    Digital display
    Bits per primary color channel: 8
    DisplayPort interface
    Maximum image size: 29 cm x 18 cm
    Gamma: 2.20
    Supported color formats: RGB 4:4:4
    Default (sRGB) color space is primary color space
    First detailed timing includes the native pixel format and preferred refresh rate
    Display supports continuous frequencies
  Color Characteristics:
    Red  : 0.6513, 0.3320
    Green: 0.2998, 0.6201
    Blue : 0.1445, 0.0595
    White: 0.3134, 0.3291
  Established Timings I & II: none
  Standard Timings: none
  Detailed Timing Descriptors:
    DTD 1:  1920x1200   60.000593 Hz  16:10   152.642 kHz    323.600000 MHz (analog composite, sync-on-green, 288 mm x 180 mm)
                 Hfront   48 Hsync  32 Hback  120 Hpol N
                 Vfront    3 Vsync   6 Vback 1335 Vpol N
    Display Range Limits:
      Monitor ranges (Range Limits Only): 48-120 Hz V, 153-153 kHz H, max dotclock 320 MHz
    Display Product Name: 'NE134WUM-N82'
    Alphanumeric Data String: '            '
  Extension blocks: 1
Checksum: 0xdc

----------------

Block 1, DisplayID Extension Block:
  Version: 2.0
  Extension Count: 0
  Display Product Primary Use Case: None of the listed primary use cases; generic display
  Video Timing Modes Type 7 - Detailed Timings Data Block:
    DTD:  1920x1200  120.000074 Hz  16:10   152.640 kHz    323.597000 MHz (aspect 16:10, no 3D stereo, preferred)
               Hfront   48 Hsync  32 Hback  120 Hpol N
               Vfront    3 Vsync   6 Vback   63 Vpol N
  Adaptive Sync Data Block:
    Descriptor #1:
      Native Panel Range
      Fixed Average V-Total and Adaptive V-Total
      Supports Seamless Transition
      'Max Single Frame Duration Increase' field value without jitter impact
      'Max Single Frame Duration Decrease' field value without jitter impact
      Max Duration Increase: 0.00 ms
      Max Duration Decrease: 0.00 ms
      Min Refresh Rate: 48 Hz
      Max Refresh Rate: 120 Hz
  CTA-861 DisplayID Data Block:
  Vendor-Specific Data Block (AMD), OUI 00-00-1A:
    Version: 3
    Feature Caps: 0x01
    Minimum Refresh Rate: 48 Hz
    Maximum Refresh Rate: 120 Hz
    Flags 1.x: 0x00
    Flags 2.x: 0x00
  Checksum: 0xcb
Checksum: 0x90

----------------

Warnings:

EDID:
  Base EDID: Some timings are out of range of the Monitor Ranges:
    Maximum Clock: 323.600 MHz (Monitor: 320.000 MHz)
    Could be due to a Monitor Range off-by-one rounding issue

Failures:

Block 0, Base EDID:
  Basic Display Parameters & Features: sRGB is signaled, but the chromaticities do not match.
  Alphanumeric Data String: One or more trailing spaces before newline.
EDID:
  Extension Block 2 started with EDID header, ignoring Extension Blocks >= 2.
  DisplayID: Missing DisplayID Display Parameters Data Block.

EDID conformity: FAIL
