edid-decode (hex):

00 ff ff ff ff ff ff 00 22 f0 a9 26 01 01 01 01
19 12 01 03 80 2f 1e 78 ee b5 35 a5 56 4a 9a 25
10 50 54 a5 6b 80 71 00 81 40 81 80 95 00 a9 00
b3 00 01 01 01 01 21 39 90 30 62 1a 27 40 68 b0
36 00 d9 28 11 00 00 1c 00 00 00 fd 00 30 4c 18
53 10 00 0a 20 20 20 20 20 20 00 00 00 fc 00 48
50 20 77 32 32 30 37 0a 20 20 20 20 00 00 00 ff
00 43 4e 4b 38 32 35 30 46 46 44 0a 20 20 01 e9

02 03 1b f1 48 84 02 01 07 16 11 10 1f 23 09 07
07 83 01 00 00 65 03 0c 00 10 00 8c 0a d0 8a 20
e0 2d 10 10 3e 96 00 d9 28 11 00 00 18 8c 0a d0
90 20 40 31 20 0c 40 55 00 d9 28 11 00 00 18 01
1d 80 18 71 1c 16 20 58 2c 25 00 d9 28 11 00 00
9e 01 1d 00 bc 52 d0 1e 20 b8 28 55 40 d9 28 11
00 00 1e 01 1d 80 d0 72 1c 16 20 10 2c 25 80 d9
28 11 00 00 9e 00 00 00 00 00 00 00 00 00 00 60

00 ff ff ff ff ff ff 00 22 f0 a9 26 01 01 01 01
19 12 01 03 80 2f 1e 78 ee b5 35 a5 56 4a 9a 25
10 50 54 a5 6b 80 71 00 81 40 81 80 95 00 a9 00
b3 00 01 01 01 01 21 39 90 30 62 1a 27 40 68 b0
36 00 d9 28 11 00 00 1c 00 00 00 fd 00 30 4c 18
53 10 00 0a 20 20 20 20 20 20 00 00 00 fc 00 48
50 20 77 32 32 30 37 0a 20 20 20 20 00 00 00 ff
00 43 4e 4b 38 32 35 30 46 46 44 0a 20 20 01 e9

02 03 1b f1 48 84 02 01 07 16 11 10 1f 23 09 07
07 83 01 00 00 65 03 0c 00 10 00 8c 0a d0 8a 20
e0 2d 10 10 3e 96 00 d9 28 11 00 00 18 8c 0a d0
90 20 40 31 20 0c 40 55 00 d9 28 11 00 00 18 01
1d 80 18 71 1c 16 20 58 2c 25 00 d9 28 11 00 00
9e 01 1d 00 bc 52 d0 1e 20 b8 28 55 40 d9 28 11
00 00 1e 01 1d 80 d0 72 1c 16 20 10 2c 25 80 d9
28 11 00 00 9e 00 00 00 00 00 00 00 00 00 00 60

----------------

Block 0, Base EDID:
  EDID Structure Version & Revision: 1.3
  Vendor & Product Identification:
    Manufacturer: HWP
    Model: 9897
    Serial Number: ...
    Made in: week 25 of 2008
  Basic Display Parameters & Features:
    Digital display
    Maximum image size: 47 cm x 30 cm
    Gamma: 2.20
    DPMS levels: Standby Suspend Off
    RGB color display
    Default (sRGB) color space is primary color space
    First detailed timing is the preferred timing
  Color Characteristics:
    Red  : 0.6464, 0.3388
    Green: 0.2900, 0.6025
    Blue : 0.1445, 0.0654
    White: 0.3134, 0.3291
  Established Timings I & II:
    IBM     :   720x400    70.081663 Hz   9:5     31.467 kHz     28.320000 MHz
    DMT 0x04:   640x480    59.940476 Hz   4:3     31.469 kHz     25.175000 MHz
    DMT 0x06:   640x480    75.000000 Hz   4:3     37.500 kHz     31.500000 MHz
    DMT 0x09:   800x600    60.316541 Hz   4:3     37.879 kHz     40.000000 MHz
    DMT 0x0b:   800x600    75.000000 Hz   4:3     46.875 kHz     49.500000 MHz
    Apple   :   832x624    74.551266 Hz   4:3     49.726 kHz     57.284000 MHz
    DMT 0x10:  1024x768    60.003840 Hz   4:3     48.363 kHz     65.000000 MHz
    DMT 0x12:  1024x768    75.028582 Hz   4:3     60.023 kHz     78.750000 MHz
    DMT 0x24:  1280x1024   75.024675 Hz   5:4     79.976 kHz    135.000000 MHz
    Apple   :  1152x870    75.061550 Hz 192:145   68.681 kHz    100.000000 MHz
  Standard Timings:
    GTF     :  1152x720    59.999964 Hz  16:10    44.760 kHz     67.319000 MHz
    DMT 0x20:  1280x960    60.000000 Hz   4:3     60.000 kHz    108.000000 MHz
    DMT 0x23:  1280x1024   60.019740 Hz   5:4     63.981 kHz    108.000000 MHz
    DMT 0x2f:  1440x900    59.887445 Hz  16:10    55.935 kHz    106.500000 MHz
    GTF     :  1600x1000   59.999820 Hz  16:10    62.100 kHz    133.142000 MHz
    DMT 0x3a:  1680x1050   59.954250 Hz  16:10    65.290 kHz    146.250000 MHz
  Detailed Timing Descriptors:
    DTD  1:  1680x1050   59.954250 Hz  16:10    65.290 kHz    146.250000 MHz (473 mm x 296 mm)
                  Hfront  104 Hsync 176 Hback  280 Hpol N
                  Vfront    3 Vsync   6 Vback   30 Vpol P
    Display Range Limits:
      Monitor ranges (GTF): 48-76 Hz V, 24-83 kHz H, max dotclock 160 MHz
    Display Product Name: 'HP w2207'
    Display Product Serial Number: ...
  Extension blocks: 1
Checksum: 0xe9

----------------

Block 1, CTA-861 Extension Block:
  Revision: 3
  Underscans IT Video Formats by default
  Basic audio support
  Supports YCbCr 4:4:4
  Supports YCbCr 4:2:2
  Native detailed modes: 1
  Video Data Block:
    VIC   4:  1280x720    60.000000 Hz  16:9     45.000 kHz     74.250000 MHz (native)
    VIC   2:   720x480    59.940060 Hz   4:3     31.469 kHz     27.000000 MHz
    VIC   1:   640x480    59.940476 Hz   4:3     31.469 kHz     25.175000 MHz
    VIC   7:  1440x480i   59.940060 Hz  16:9     15.734 kHz     27.000000 MHz
    VIC  22:  1440x576i   50.000000 Hz  16:9     15.625 kHz     27.000000 MHz
    VIC  17:   720x576    50.000000 Hz   4:3     31.250 kHz     27.000000 MHz
    VIC  16:  1920x1080   60.000000 Hz  16:9     67.500 kHz    148.500000 MHz
    VIC  31:  1920x1080   50.000000 Hz  16:9     56.250 kHz    148.500000 MHz
  Audio Data Block:
    Linear PCM:
      Max channels: 2
      Supported sample rates (kHz): 48 44.1 32
      Supported sample sizes (bits): 24 20 16
  Speaker Allocation Data Block:
    FL/FR - Front Left/Right
  Vendor-Specific Data Block (HDMI), OUI 00-0C-03:
    Source physical address: 1.0.0.0
  Detailed Timing Descriptors:
    DTD  2:   720x480    59.940060 Hz   3:2     31.469 kHz     27.000000 MHz (473 mm x 296 mm)
                  Hfront   16 Hsync  62 Hback   60 Hpol N
                  Vfront    9 Vsync   6 Vback   30 Vpol N
    DTD  3:   720x576    50.000000 Hz   5:4     31.250 kHz     27.000000 MHz (473 mm x 296 mm)
                  Hfront   12 Hsync  64 Hback   68 Hpol N
                  Vfront    5 Vsync   5 Vback   39 Vpol N
    DTD  4:  1920x1080i  60.000000 Hz  16:9     33.750 kHz     74.250000 MHz (473 mm x 296 mm)
                  Hfront   88 Hsync  44 Hback  148 Hpol P
                  Vfront    2 Vsync   5 Vback   15 Vpol P Vfront +0.5 Odd Field
                  Vfront    2 Vsync   5 Vback   15 Vpol P Vback  +0.5 Even Field
    DTD  5:  1280x720    50.000000 Hz  16:9     37.500 kHz     74.250000 MHz (473 mm x 296 mm)
                  Hfront  440 Hsync  40 Hback  220 Hpol P
                  Vfront    5 Vsync   5 Vback   20 Vpol P
    DTD  6:  1920x1080i  50.000000 Hz  16:9     28.125 kHz     74.250000 MHz (473 mm x 296 mm)
                  Hfront  528 Hsync  44 Hback  148 Hpol P
                  Vfront    2 Vsync   5 Vback   15 Vpol P Vfront +0.5 Odd Field
                  Vfront    2 Vsync   5 Vback   15 Vpol P Vback  +0.5 Even Field
Checksum: 0x60  Unused space in Extension Block: 10 bytes

----------------

Block 2, Unknown EDID Extension Block 0x00:
  00 ff ff ff ff ff ff 00 22 f0 a9 26 01 01 01 01 '........"..&....'
  19 12 01 03 80 2f 1e 78 ee b5 35 a5 56 4a 9a 25 '...../.x..5.VJ.%'
  10 50 54 a5 6b 80 71 00 81 40 81 80 95 00 a9 00 '.PT.k.q..@......'
  b3 00 01 01 01 01 21 39 90 30 62 1a 27 40 68 b0 '......!9.0b.'@h.'
  36 00 d9 28 11 00 00 1c 00 00 00 fd 00 30 4c 18 '6..(.........0L.'
  53 10 00 0a 20 20 20 20 20 20 00 00 00 fc 00 48 'S...      .....H'
  50 20 77 32 32 30 37 0a 20 20 20 20 00 00 00 ff 'P w2207.    ....'
  00 43 4e 4b 38 32 35 30 46 46 44 0a 20 20 01 e9 '.CNK8250FFD.  ..'
Checksum: 0xe9

----------------

Block 3, CTA-861 Extension Block:
  Revision: 3
  Underscans IT Video Formats by default
  Basic audio support
  Supports YCbCr 4:4:4
  Supports YCbCr 4:2:2
  Native detailed modes: 1
  Video Data Block:
    VIC   4:  1280x720    60.000000 Hz  16:9     45.000 kHz     74.250000 MHz (native)
    VIC   2:   720x480    59.940060 Hz   4:3     31.469 kHz     27.000000 MHz
    VIC   1:   640x480    59.940476 Hz   4:3     31.469 kHz     25.175000 MHz
    VIC   7:  1440x480i   59.940060 Hz  16:9     15.734 kHz     27.000000 MHz
    VIC  22:  1440x576i   50.000000 Hz  16:9     15.625 kHz     27.000000 MHz
    VIC  17:   720x576    50.000000 Hz   4:3     31.250 kHz     27.000000 MHz
    VIC  16:  1920x1080   60.000000 Hz  16:9     67.500 kHz    148.500000 MHz
    VIC  31:  1920x1080   50.000000 Hz  16:9     56.250 kHz    148.500000 MHz
  Audio Data Block:
    Linear PCM:
      Max channels: 2
      Supported sample rates (kHz): 48 44.1 32
      Supported sample sizes (bits): 24 20 16
  Speaker Allocation Data Block:
    FL/FR - Front Left/Right
  Vendor-Specific Data Block (HDMI), OUI 00-0C-03:
    Source physical address: 1.0.0.0
  Detailed Timing Descriptors:
    DTD  7:   720x480    59.940060 Hz   3:2     31.469 kHz     27.000000 MHz (473 mm x 296 mm)
                  Hfront   16 Hsync  62 Hback   60 Hpol N
                  Vfront    9 Vsync   6 Vback   30 Vpol N
    DTD  8:   720x576    50.000000 Hz   5:4     31.250 kHz     27.000000 MHz (473 mm x 296 mm)
                  Hfront   12 Hsync  64 Hback   68 Hpol N
                  Vfront    5 Vsync   5 Vback   39 Vpol N
    DTD  9:  1920x1080i  60.000000 Hz  16:9     33.750 kHz     74.250000 MHz (473 mm x 296 mm)
                  Hfront   88 Hsync  44 Hback  148 Hpol P
                  Vfront    2 Vsync   5 Vback   15 Vpol P Vfront +0.5 Odd Field
                  Vfront    2 Vsync   5 Vback   15 Vpol P Vback  +0.5 Even Field
    DTD 10:  1280x720    50.000000 Hz  16:9     37.500 kHz     74.250000 MHz (473 mm x 296 mm)
                  Hfront  440 Hsync  40 Hback  220 Hpol P
                  Vfront    5 Vsync   5 Vback   20 Vpol P
    DTD 11:  1920x1080i  50.000000 Hz  16:9     28.125 kHz     74.250000 MHz (473 mm x 296 mm)
                  Hfront  528 Hsync  44 Hback  148 Hpol P
                  Vfront    2 Vsync   5 Vback   15 Vpol P Vfront +0.5 Odd Field
                  Vfront    2 Vsync   5 Vback   15 Vpol P Vback  +0.5 Even Field
Checksum: 0x60  Unused space in Extension Block: 10 bytes

----------------

Warnings:

Block 0, Base EDID:
  Vendor & Product Identification: The serial number is one of the known dummy values, it should probably be set to 0.
Block 1, CTA-861 Extension Block:
  Video Data Block: VIC 4 and the first DTD are not identical. Is this intended?
  Detailed Timing Descriptor #2: Image size is 473x296 mm, but based on the picture AR it should be 473x315 mm.
  Detailed Timing Descriptor #3: Image size is 473x296 mm, but based on the picture AR it should be 473x378 mm.
  Detailed Timing Descriptor #4: DTD is identical to VIC 5, which is not present in the CTA Ext Block.
  Detailed Timing Descriptor #4: Image size is 473x296 mm, but based on the picture AR it should be 473x266 mm.
  Detailed Timing Descriptor #5: DTD is identical to VIC 19, which is not present in the CTA Ext Block.
  Detailed Timing Descriptor #5: Image size is 473x296 mm, but based on the picture AR it should be 473x266 mm.
  Detailed Timing Descriptor #6: DTD is identical to VIC 20, which is not present in the CTA Ext Block.
  Detailed Timing Descriptor #6: Image size is 473x296 mm, but based on the picture AR it should be 473x266 mm.
  Display Product Serial Number is set, so the Serial Number in the Base EDID should be 0.
Block 3, CTA-861 Extension Block:
  Detailed Timing Descriptor #7: Image size is 473x296 mm, but based on the picture AR it should be 473x315 mm.
  Detailed Timing Descriptor #8: Image size is 473x296 mm, but based on the picture AR it should be 473x378 mm.
  Detailed Timing Descriptor #9: DTD is identical to VIC 5, which is not present in the CTA Ext Block.
  Detailed Timing Descriptor #9: Image size is 473x296 mm, but based on the picture AR it should be 473x266 mm.
  Detailed Timing Descriptor #10: DTD is identical to VIC 19, which is not present in the CTA Ext Block.
  Detailed Timing Descriptor #10: Image size is 473x296 mm, but based on the picture AR it should be 473x266 mm.
  Detailed Timing Descriptor #11: DTD is identical to VIC 20, which is not present in the CTA Ext Block.
  Detailed Timing Descriptor #11: Image size is 473x296 mm, but based on the picture AR it should be 473x266 mm.
EDID:
  Base EDID: Some timings are out of range of the Monitor Ranges:
    Horizontal Freq: 15.625 - 79.976 kHz (Monitor: 24.000 - 83.000 kHz)

Failures:

Block 0, Base EDID:
  Basic Display Parameters & Features: sRGB is signaled, but the chromaticities do not match.
Block 1, CTA-861 Extension Block:
  Missing VCDB, needed for Set Selectable RGB Quantization to avoid interop issues.
Block 2, Base EDID:
  Unknown Extension Block.
Block 3, CTA-861 Extension Block:
  Video Data Block: Duplicate VIC 4.
  Video Data Block: Duplicate VIC 2.
  Video Data Block: Duplicate VIC 1.
  Video Data Block: Duplicate VIC 7.
  Video Data Block: Duplicate VIC 22.
  Video Data Block: Duplicate VIC 17.
  Video Data Block: Duplicate VIC 16.
  Video Data Block: Duplicate VIC 31.
  Speaker Allocation Data Block: Only one instance of this Data Block is allowed.
EDID:
  Base EDID: EDID specified 1 extension block(s), but found 3 extension block(s).
  Base EDID: EDID 1.3 requires a Block Map Extension in Block 1 if there are more than 2 blocks in the EDID.
  CTA-861: Native progressive timings are a mix of several resolutions.

EDID conformity: FAIL
