edid-decode (hex):

00 ff ff ff ff ff ff 00 1e 6d 06 77 0c ed 05 00
07 21 01 03 80 3c 22 78 ea 3e 31 ae 50 47 ac 27
0c 50 54 21 08 00 71 40 81 80 81 c0 a9 c0 d1 c0
81 00 01 01 01 01 04 74 00 30 f2 70 5a 80 b0 58
8a 00 58 54 21 00 00 1e 04 74 00 30 f2 70 5a 80
b0 58 8a 00 58 54 21 00 00 1a 00 00 00 fd 00 38
3d 1e 87 3c 00 0a 20 20 20 20 20 20 00 00 00 fc
00 4c 47 20 48 44 52 20 34 4b 0a 20 20 20 01 50

02 03 3b f1 4d 90 22 20 1f 1f 03 04 01 5f 5f 5d
5e 5f 23 09 07 07 6d 03 0c 00 10 00 80 3c 20 00
60 01 02 03 67 00 00 00 01 78 80 03 e3 0f 00 03
e3 05 00 00 e6 06 00 00 00 00 00 02 3a 80 18 71
38 2d 40 58 2c 45 00 58 54 21 00 00 1e 56 5e 00
a0 a0 a0 29 50 30 20 35 00 58 54 21 00 00 1a 00
00 00 ff 00 33 30 37 4e 54 51 44 42 45 33 36 34
0a 00 00 00 00 00 00 00 00 00 00 00 00 00 00 49

00 ff ff ff ff ff ff 00 1e 6d 06 77 0c ed 05 00
07 21 01 03 80 3c 22 78 ea 3e 31 ae 50 47 ac 27
0c 50 54 21 08 00 71 40 81 80 81 c0 a9 c0 d1 c0
81 00 01 01 01 01 04 74 00 30 f2 70 5a 80 b0 58
8a 00 58 54 21 00 00 1e 04 74 00 30 f2 70 5a 80
b0 58 8a 00 58 54 21 00 00 1a 00 00 00 fd 00 38
3d 1e 87 3c 00 0a 20 20 20 20 20 20 00 00 00 fc
00 4c 47 20 48 44 52 20 34 4b 0a 20 20 20 01 50

02 03 3b f1 4d 90 22 20 1f 1f 03 04 01 5f 5f 5d
5e 5f 23 09 07 07 6d 03 0c 00 10 00 80 3c 20 00
60 01 02 03 67 00 00 00 01 78 80 03 e3 0f 00 03
e3 05 00 00 e6 06 00 00 00 00 00 02 3a 80 18 71
38 2d 40 58 2c 45 00 58 54 21 00 00 1e 56 5e 00
a0 a0 a0 29 50 30 20 35 00 58 54 21 00 00 1a 00
00 00 ff 00 33 30 37 4e 54 51 44 42 45 33 36 34
0a 00 00 00 00 00 00 00 00 00 00 00 00 00 00 49

----------------

Block 0, Base EDID:
  EDID Structure Version & Revision: 1.3
  Vendor & Product Identification:
    Manufacturer: GSM
    Model: 30470
    Serial Number: ...
    Made in: week 7 of 2023
  Basic Display Parameters & Features:
    Digital display
    Maximum image size: 60 cm x 34 cm
    Gamma: 2.20
    DPMS levels: Standby Suspend Off
    RGB color display
    First detailed timing is the preferred timing
  Color Characteristics:
    Red  : 0.6796, 0.3154
    Green: 0.2802, 0.6738
    Blue : 0.1523, 0.0498
    White: 0.3125, 0.3291
  Established Timings I & II:
    DMT 0x04:   640x480    59.940476 Hz   4:3     31.469 kHz     25.175000 MHz
    DMT 0x09:   800x600    60.316541 Hz   4:3     37.879 kHz     40.000000 MHz
    DMT 0x10:  1024x768    60.003840 Hz   4:3     48.363 kHz     65.000000 MHz
  Standard Timings:
    GTF     :  1152x864    60.000000 Hz   4:3     53.700 kHz     81.624000 MHz
    DMT 0x23:  1280x1024   60.019740 Hz   5:4     63.981 kHz    108.000000 MHz
    DMT 0x55:  1280x720    60.000000 Hz  16:9     45.000 kHz     74.250000 MHz
    DMT 0x53:  1600x900    60.000000 Hz  16:9     60.000 kHz    108.000000 MHz (RB)
    DMT 0x52:  1920x1080   60.000000 Hz  16:9     67.500 kHz    148.500000 MHz
    DMT 0x1c:  1280x800    59.810326 Hz  16:10    49.702 kHz     83.500000 MHz
  Detailed Timing Descriptors:
    DTD 1:  3840x2160   30.000000 Hz  16:9     67.500 kHz    297.000000 MHz (600 mm x 340 mm)
                 Hfront  176 Hsync  88 Hback  296 Hpol P
                 Vfront    8 Vsync  10 Vback   72 Vpol P
    DTD 2:  3840x2160   30.000000 Hz  16:9     67.500 kHz    297.000000 MHz (600 mm x 340 mm)
                 Hfront  176 Hsync  88 Hback  296 Hpol P
                 Vfront    8 Vsync  10 Vback   72 Vpol N
    Display Range Limits:
      Monitor ranges (GTF): 56-61 Hz V, 30-135 kHz H, max dotclock 600 MHz
    Display Product Name: 'LG HDR 4K'
  Extension blocks: 1
Checksum: 0x50

----------------

Block 1, CTA-861 Extension Block:
  Revision: 3
  Underscans IT Video Formats by default
  Basic audio support
  Supports YCbCr 4:4:4
  Supports YCbCr 4:2:2
  Native DTDs: 1
  Video Data Block:
    VIC  16:  1920x1080   60.000000 Hz  16:9     67.500 kHz    148.500000 MHz (native)
    VIC  34:  1920x1080   30.000000 Hz  16:9     33.750 kHz     74.250000 MHz
    VIC  32:  1920x1080   24.000000 Hz  16:9     27.000 kHz     74.250000 MHz
    VIC  31:  1920x1080   50.000000 Hz  16:9     56.250 kHz    148.500000 MHz
    VIC  31:  1920x1080   50.000000 Hz  16:9     56.250 kHz    148.500000 MHz
    VIC   3:   720x480    59.940060 Hz  16:9     31.469 kHz     27.000000 MHz
    VIC   4:  1280x720    60.000000 Hz  16:9     45.000 kHz     74.250000 MHz
    VIC   1:   640x480    59.940476 Hz   4:3     31.469 kHz     25.175000 MHz
    VIC  95:  3840x2160   30.000000 Hz  16:9     67.500 kHz    297.000000 MHz
    VIC  95:  3840x2160   30.000000 Hz  16:9     67.500 kHz    297.000000 MHz
    VIC  93:  3840x2160   24.000000 Hz  16:9     54.000 kHz    297.000000 MHz
    VIC  94:  3840x2160   25.000000 Hz  16:9     56.250 kHz    297.000000 MHz
    VIC  95:  3840x2160   30.000000 Hz  16:9     67.500 kHz    297.000000 MHz
  Audio Data Block:
    Linear PCM:
      Max channels: 2
      Supported sample rates (kHz): 48 44.1 32
      Supported sample sizes (bits): 24 20 16
  Vendor-Specific Data Block (HDMI), OUI 00-0C-03:
    Source physical address: 1.0.0.0
    Supports_AI
    Maximum TMDS clock: 300 MHz
    Extended HDMI video details:
      HDMI VICs:
        HDMI VIC 1:  3840x2160   30.000000 Hz  16:9     67.500 kHz    297.000000 MHz
        HDMI VIC 2:  3840x2160   25.000000 Hz  16:9     56.250 kHz    297.000000 MHz
        HDMI VIC 3:  3840x2160   24.000000 Hz  16:9     54.000 kHz    297.000000 MHz
  Vendor-Specific Data Block, OUI 00-00-00:
    01 78 80 03                                     '.x..'
  YCbCr 4:2:0 Capability Map Data Block:
    VIC  95:  3840x2160   30.000000 Hz  16:9     67.500 kHz    297.000000 MHz
    VIC  95:  3840x2160   30.000000 Hz  16:9     67.500 kHz    297.000000 MHz
  Colorimetry Data Block:
  HDR Static Metadata Data Block:
    Electro optical transfer functions:
    Supported static metadata descriptors:
    Desired content max luminance: 0 (50.000 cd/m^2)
    Desired content max frame-average luminance: 0 (50.000 cd/m^2)
    Desired content min luminance: 0 (0.000 cd/m^2)
  Detailed Timing Descriptors:
    DTD 3:  1920x1080   60.000000 Hz  16:9     67.500 kHz    148.500000 MHz (600 mm x 340 mm)
                 Hfront   88 Hsync  44 Hback  148 Hpol P
                 Vfront    4 Vsync   5 Vback   36 Vpol P
    DTD 4:  2560x1440   59.950550 Hz  16:9     88.787 kHz    241.500000 MHz (600 mm x 340 mm)
                 Hfront   48 Hsync  32 Hback   80 Hpol P
                 Vfront    3 Vsync   5 Vback   33 Vpol N
    Display Product Serial Number: ...
Checksum: 0x49  Unused space in Extension Block: 14 bytes

----------------

Warnings:

Block 0, Base EDID:
  Detailed Timing Descriptor #2: DTD is similar but not identical to VIC 95.
Block 1, CTA-861 Extension Block:
  Video Data Block: VIC 16 and the first DTD are not identical. Is this intended?
  Vendor-Specific Data Block, OUI 00-00-00: All zeroes OUI.
  YCbCr 4:2:0 Capability Map Data Block: Some YCbCr 4:2:0 timings are invalid for HDMI 2.1 (which requires an RGB timings pixel rate >= 590 MHz).
  Colorimetry Data Block: Set the sRGB colorimetry bit to avoid interop issues.
  Display Product Serial Number is set, so the Serial Number in the Base EDID should be 0.
EDID:
  Base EDID: Some timings are out of range of the Monitor Ranges:
    Vertical Freq: 24.000 - 60.317 Hz (Monitor: 56.000 - 61.000 Hz)
    Horizontal Freq: 27.000 - 88.786 kHz (Monitor: 30.000 - 135.000 kHz)

Failures:

Block 1, CTA-861 Extension Block:
  Video Data Block: Duplicate VIC 31.
  Video Data Block: Duplicate VIC 95.
  Missing VCDB, needed for Set Selectable RGB Quantization to avoid interop issues.
EDID:
  Extension Block 2 started with EDID header, ignoring Extension Blocks >= 2.
  CTA-861: Native progressive timings are a mix of several resolutions.

EDID conformity: FAIL
