edid-decode (hex):

00 ff ff ff ff ff ff 00 06 b3 e0 48 01 01 01 01
00 00 01 04 c5 46 27 78 fb 8c e5 ad 52 44 af 25
0c 50 54 25 4a 00 d1 c0 81 80 95 00 b3 00 01 01
01 01 01 01 01 01 4d d0 00 a0 f0 70 3e 80 30 20
35 00 b9 88 21 00 00 1e 00 00 00 fd 0c 30 78 12
12 89 01 0a 20 20 20 20 20 20 00 00 00 fc 00 50
47 34 38 55 51 0a 20 20 20 20 20 20 00 00 00 ff
00 00 00 00 00 00 00 00 00 00 00 00 00 0a 02 6b

02 03 30 71 4a 03 76 02 13 04 29 10 3f 61 5d 23
09 07 07 83 01 00 00 6d 1a 00 00 02 01 30 78 e6
00 73 00 73 00 e3 05 e3 01 e6 06 0d 01 80 80 00
f6 5b 00 6e a0 a0 1f 50 17 20 18 04 b9 88 21 00
00 1e 4d 6c 80 a0 70 70 3e 80 30 20 3a 00 b9 88
21 00 00 1e 00 00 00 00 00 00 00 00 00 00 00 00
00 00 00 00 00 00 00 00 00 00 00 00 00 00 00 00
00 00 00 00 00 00 00 00 00 00 00 00 00 00 00 04

70 12 79 03 00 03 01 64 ba ce 01 04 ff 0e 0f 02
2f 80 1f 00 6f 08 63 00 04 80 07 00 93 3d 01 68
ff 0e 9f 00 2f 80 1f 00 3f 06 5d 00 02 80 09 00
75 fd 00 66 6f 0d 9f 00 2f 80 1f 00 9f 05 3d 00
02 80 04 00 3d c2 00 04 ff 09 9f 00 2f 80 1f 00
9f 05 54 00 02 80 04 00 1f d6 00 08 ff 0e 9f 00
2f 80 1f 00 37 04 3d 00 02 80 04 00 00 00 00 00
00 00 00 00 00 00 00 00 00 00 00 00 00 00 b9 90

00 ff ff ff ff ff ff 00 06 b3 e0 48 01 01 01 01
00 00 01 04 c5 46 27 78 fb 8c e5 ad 52 44 af 25
0c 50 54 25 4a 00 d1 c0 81 80 95 00 b3 00 01 01
01 01 01 01 01 01 4d d0 00 a0 f0 70 3e 80 30 20
35 00 b9 88 21 00 00 1e 00 00 00 fd 0c 30 78 12
12 89 01 0a 20 20 20 20 20 20 00 00 00 fc 00 50
47 34 38 55 51 0a 20 20 20 20 20 20 00 00 00 ff
00 00 00 00 00 00 00 00 00 00 00 00 00 0a 02 6b

02 03 30 71 4a 03 76 02 13 04 29 10 3f 61 5d 23
09 07 07 83 01 00 00 6d 1a 00 00 02 01 30 78 e6
00 73 00 73 00 e3 05 e3 01 e6 06 0d 01 80 80 00
f6 5b 00 6e a0 a0 1f 50 17 20 18 04 b9 88 21 00
00 1e 4d 6c 80 a0 70 70 3e 80 30 20 3a 00 b9 88
21 00 00 1e 00 00 00 00 00 00 00 00 00 00 00 00
00 00 00 00 00 00 00 00 00 00 00 00 00 00 00 00
00 00 00 00 00 00 00 00 00 00 00 00 00 00 00 04

70 12 79 03 00 03 01 64 ba ce 01 04 ff 0e 0f 02
2f 80 1f 00 6f 08 63 00 04 80 07 00 93 3d 01 68
ff 0e 9f 00 2f 80 1f 00 3f 06 5d 00 02 80 09 00
75 fd 00 66 6f 0d 9f 00 2f 80 1f 00 9f 05 3d 00
02 80 04 00 3d c2 00 04 ff 09 9f 00 2f 80 1f 00
9f 05 54 00 02 80 04 00 1f d6 00 08 ff 0e 9f 00
2f 80 1f 00 37 04 3d 00 02 80 04 00 00 00 00 00
00 00 00 00 00 00 00 00 00 00 00 00 00 00 b9 90

----------------

Block 0, Base EDID:
  EDID Structure Version & Revision: 1.4
  Vendor & Product Identification:
    Manufacturer: AUS
    Model: 18656
    Serial Number: ...
    Made in: 1990
  Basic Display Parameters & Features:
    Digital display
    Bits per primary color channel: 12
    DisplayPort interface
    Maximum image size: 70 cm x 39 cm
    Gamma: 2.20
    DPMS levels: Standby Suspend Off
    Supported color formats: RGB 4:4:4, YCrCb 4:4:4, YCrCb 4:2:2
    First detailed timing includes the native pixel format and preferred refresh rate
    Display supports continuous frequencies
  Color Characteristics:
    Red  : 0.6777, 0.3203
    Green: 0.2685, 0.6835
    Blue : 0.1474, 0.0488
    White: 0.3134, 0.3291
  Established Timings I & II:
    DMT 0x04:   640x480    59.940476 Hz   4:3     31.469 kHz     25.175000 MHz
    DMT 0x06:   640x480    75.000000 Hz   4:3     37.500 kHz     31.500000 MHz
    DMT 0x09:   800x600    60.316541 Hz   4:3     37.879 kHz     40.000000 MHz
    DMT 0x0b:   800x600    75.000000 Hz   4:3     46.875 kHz     49.500000 MHz
    DMT 0x10:  1024x768    60.003840 Hz   4:3     48.363 kHz     65.000000 MHz
    DMT 0x12:  1024x768    75.028582 Hz   4:3     60.023 kHz     78.750000 MHz
  Standard Timings:
    DMT 0x52:  1920x1080   60.000000 Hz  16:9     67.500 kHz    148.500000 MHz
    DMT 0x23:  1280x1024   60.019740 Hz   5:4     63.981 kHz    108.000000 MHz
    DMT 0x2f:  1440x900    59.887445 Hz  16:10    55.935 kHz    106.500000 MHz
    DMT 0x3a:  1680x1050   59.954250 Hz  16:10    65.290 kHz    146.250000 MHz
  Detailed Timing Descriptors:
    DTD 1:  3840x2160   59.996625 Hz  16:9    133.312 kHz    533.250000 MHz (697 mm x 392 mm)
                 Hfront   48 Hsync  32 Hback   80 Hpol P
                 Vfront    3 Vsync   5 Vback   54 Vpol P
    Display Range Limits:
      Monitor ranges (Range Limits Only): 48-120 Hz V, 273-273 kHz H, max dotclock 1370 MHz
    Display Product Name: 'PG48UQ'
    Display Product Serial Number: ...
  Extension blocks: 2
Checksum: 0x6b

----------------

Block 1, CTA-861 Extension Block:
  Revision: 3
  Basic audio support
  Supports YCbCr 4:4:4
  Supports YCbCr 4:2:2
  Native detailed modes: 1
  Video Data Block:
    VIC   3:   720x480    59.940060 Hz  16:9     31.469 kHz     27.000000 MHz
    VIC 118:  3840x2160  120.000000 Hz  16:9    270.000 kHz   1188.000000 MHz
    VIC   2:   720x480    59.940060 Hz   4:3     31.469 kHz     27.000000 MHz
    VIC  19:  1280x720    50.000000 Hz  16:9     37.500 kHz     74.250000 MHz
    VIC   4:  1280x720    60.000000 Hz  16:9     45.000 kHz     74.250000 MHz
    VIC  41:  1280x720   100.000000 Hz  16:9     75.000 kHz    148.500000 MHz
    VIC  16:  1920x1080   60.000000 Hz  16:9     67.500 kHz    148.500000 MHz
    VIC  63:  1920x1080  120.000000 Hz  16:9    135.000 kHz    297.000000 MHz
    VIC  97:  3840x2160   60.000000 Hz  16:9    135.000 kHz    594.000000 MHz
    VIC  93:  3840x2160   24.000000 Hz  16:9     54.000 kHz    297.000000 MHz
  Audio Data Block:
    Linear PCM:
      Max channels: 2
      Supported sample rates (kHz): 48 44.1 32
      Supported sample sizes (bits): 24 20 16
  Speaker Allocation Data Block:
    FL/FR - Front Left/Right
  Vendor-Specific Data Block (AMD), OUI 00-00-1A:
    Version: 2
    Feature Caps: 0x01
    Minimum Refresh Rate: 48 Hz
    Maximum Refresh Rate: 120 Hz
    Flags 1.x: 0xe6 (MCCS)
    Flags 2.x: 0x00
  Colorimetry Data Block:
    xvYCC601
    xvYCC709
    BT2020cYCC
    BT2020YCC
    BT2020RGB
    Gamut Boundary Description Metadata Profile P0
  HDR Static Metadata Data Block:
    Electro optical transfer functions:
      Traditional gamma - SDR luminance range
      SMPTE ST2084
      Hybrid Log-Gamma
    Supported static metadata descriptors:
      Static metadata type 1
    Desired content max luminance: 128 (800.000 cd/m^2)
    Desired content max frame-average luminance: 128 (800.000 cd/m^2)
    Desired content min luminance: 0 (0.000 cd/m^2)
  Detailed Timing Descriptors:
    DTD 2:  2560x1440   59.940370 Hz  16:9     88.172 kHz    235.420000 MHz (697 mm x 392 mm)
                 Hfront   23 Hsync  32 Hback   55 Hpol P
                 Vfront   17 Vsync   8 Vback    6 Vpol P
    DTD 3:  1920x2160   59.987970 Hz   8:9    133.293 kHz    277.250000 MHz (697 mm x 392 mm)
                 Hfront   48 Hsync  32 Hback   80 Hpol P
                 Vfront    3 Vsync  10 Vback   49 Vpol P
Checksum: 0x04  Unused space in Extension Block: 43 bytes

----------------

Block 2, DisplayID Extension Block:
  Version: 1.2
  Extension Count: 0
  Display Product Type: Standalone display device
  Video Timing Modes Type 1 - Detailed Timings Data Block:
    DTD:  3840x2160  119.998825 Hz  16:9    271.197 kHz   1184.590000 MHz (aspect 16:9, no 3D stereo)
               Hfront   48 Hsync  32 Hback  448 Hpol P
               Vfront    5 Vsync   8 Vback   87 Vpol P
    DTD:  3840x1600  119.982290 Hz   0:0    203.250 kHz    813.000000 MHz (aspect undefined, reserved)
               Hfront   48 Hsync  32 Hback   80 Hpol P
               Vfront    3 Vsync  10 Vback   81 Vpol P
    DTD:  3440x1440  119.999260 Hz  64:27   180.239 kHz    648.860000 MHz (aspect 64:27, reserved)
               Hfront   48 Hsync  32 Hback   80 Hpol P
               Vfront    3 Vsync   5 Vback   54 Vpol P
    DTD:  2560x1440  119.879460 Hz  16:9    182.816 kHz    497.260000 MHz (aspect 16:9, no 3D stereo)
               Hfront   48 Hsync  32 Hback   80 Hpol P
               Vfront    3 Vsync   5 Vback   77 Vpol P
    DTD:  3840x1080  120.000000 Hz   0:0    137.040 kHz    548.160000 MHz (aspect undefined, no 3D stereo)
               Hfront   48 Hsync  32 Hback   80 Hpol P
               Vfront    3 Vsync   5 Vback   54 Vpol P
  Checksum: 0xb9
Checksum: 0x90

----------------

Block 3, Unknown EDID Extension Block 0x00:
  00 ff ff ff ff ff ff 00 06 b3 e0 48 01 01 01 01 '...........H....'
  00 00 01 04 c5 46 27 78 fb 8c e5 ad 52 44 af 25 '.....F'x....RD.%'
  0c 50 54 25 4a 00 d1 c0 81 80 95 00 b3 00 01 01 '.PT%J...........'
  01 01 01 01 01 01 4d d0 00 a0 f0 70 3e 80 30 20 '......M....p>.0 '
  35 00 b9 88 21 00 00 1e 00 00 00 fd 0c 30 78 12 '5...!........0x.'
  12 89 01 0a 20 20 20 20 20 20 00 00 00 fc 00 50 '....      .....P'
  47 34 38 55 51 0a 20 20 20 20 20 20 00 00 00 ff 'G48UQ.      ....'
  00 00 00 00 00 00 00 00 00 00 00 00 00 0a 02 6b '...............k'
Checksum: 0x6b

----------------

Block 4, CTA-861 Extension Block:
  Revision: 3
  Basic audio support
  Supports YCbCr 4:4:4
  Supports YCbCr 4:2:2
  Native detailed modes: 1
  Video Data Block:
    VIC   3:   720x480    59.940060 Hz  16:9     31.469 kHz     27.000000 MHz
    VIC 118:  3840x2160  120.000000 Hz  16:9    270.000 kHz   1188.000000 MHz
    VIC   2:   720x480    59.940060 Hz   4:3     31.469 kHz     27.000000 MHz
    VIC  19:  1280x720    50.000000 Hz  16:9     37.500 kHz     74.250000 MHz
    VIC   4:  1280x720    60.000000 Hz  16:9     45.000 kHz     74.250000 MHz
    VIC  41:  1280x720   100.000000 Hz  16:9     75.000 kHz    148.500000 MHz
    VIC  16:  1920x1080   60.000000 Hz  16:9     67.500 kHz    148.500000 MHz
    VIC  63:  1920x1080  120.000000 Hz  16:9    135.000 kHz    297.000000 MHz
    VIC  97:  3840x2160   60.000000 Hz  16:9    135.000 kHz    594.000000 MHz
    VIC  93:  3840x2160   24.000000 Hz  16:9     54.000 kHz    297.000000 MHz
  Audio Data Block:
    Linear PCM:
      Max channels: 2
      Supported sample rates (kHz): 48 44.1 32
      Supported sample sizes (bits): 24 20 16
  Speaker Allocation Data Block:
    FL/FR - Front Left/Right
  Vendor-Specific Data Block (AMD), OUI 00-00-1A:
    Version: 2
    Feature Caps: 0x01
    Minimum Refresh Rate: 48 Hz
    Maximum Refresh Rate: 120 Hz
    Flags 1.x: 0xe6 (MCCS)
    Flags 2.x: 0x00
  Colorimetry Data Block:
    xvYCC601
    xvYCC709
    BT2020cYCC
    BT2020YCC
    BT2020RGB
    Gamut Boundary Description Metadata Profile P0
  HDR Static Metadata Data Block:
    Electro optical transfer functions:
      Traditional gamma - SDR luminance range
      SMPTE ST2084
      Hybrid Log-Gamma
    Supported static metadata descriptors:
      Static metadata type 1
    Desired content max luminance: 128 (800.000 cd/m^2)
    Desired content max frame-average luminance: 128 (800.000 cd/m^2)
    Desired content min luminance: 0 (0.000 cd/m^2)
  Detailed Timing Descriptors:
    DTD 4:  2560x1440   59.940370 Hz  16:9     88.172 kHz    235.420000 MHz (697 mm x 392 mm)
                 Hfront   23 Hsync  32 Hback   55 Hpol P
                 Vfront   17 Vsync   8 Vback    6 Vpol P
    DTD 5:  1920x2160   59.987970 Hz   8:9    133.293 kHz    277.250000 MHz (697 mm x 392 mm)
                 Hfront   48 Hsync  32 Hback   80 Hpol P
                 Vfront    3 Vsync  10 Vback   49 Vpol P
Checksum: 0x04  Unused space in Extension Block: 43 bytes

----------------

Block 5, DisplayID Extension Block:
  Version: 1.2
  Extension Count: 0
  Video Timing Modes Type 1 - Detailed Timings Data Block:
    DTD:  3840x2160  119.998825 Hz  16:9    271.197 kHz   1184.590000 MHz (aspect 16:9, no 3D stereo)
               Hfront   48 Hsync  32 Hback  448 Hpol P
               Vfront    5 Vsync   8 Vback   87 Vpol P
    DTD:  3840x1600  119.982290 Hz   0:0    203.250 kHz    813.000000 MHz (aspect undefined, reserved)
               Hfront   48 Hsync  32 Hback   80 Hpol P
               Vfront    3 Vsync  10 Vback   81 Vpol P
    DTD:  3440x1440  119.999260 Hz  64:27   180.239 kHz    648.860000 MHz (aspect 64:27, reserved)
               Hfront   48 Hsync  32 Hback   80 Hpol P
               Vfront    3 Vsync   5 Vback   54 Vpol P
    DTD:  2560x1440  119.879460 Hz  16:9    182.816 kHz    497.260000 MHz (aspect 16:9, no 3D stereo)
               Hfront   48 Hsync  32 Hback   80 Hpol P
               Vfront    3 Vsync   5 Vback   77 Vpol P
    DTD:  3840x1080  120.000000 Hz   0:0    137.040 kHz    548.160000 MHz (aspect undefined, no 3D stereo)
               Hfront   48 Hsync  32 Hback   80 Hpol P
               Vfront    3 Vsync   5 Vback   54 Vpol P
  Checksum: 0xb9
Checksum: 0x90

----------------

Warnings:

Block 0, Base EDID:
  Vendor & Product Identification: The serial number is one of the known dummy values, it should probably be set to 0.
Block 1, CTA-861 Extension Block:
  IT Video Formats are overscanned by default, but normally this should be underscanned.
  Video Data Block: VIC 3 and the first DTD are not identical. Is this intended?
  Colorimetry Data Block: Set the sRGB colorimetry bit to avoid interop issues.
  Detailed Timing Descriptor #3: Image size is 697x392 mm, but based on the picture AR it should be 697x784 mm.
  Display Product Serial Number is set, so the Serial Number in the Base EDID should be 0.
Block 4, CTA-861 Extension Block:
  IT Video Formats are overscanned by default, but normally this should be underscanned.
  Colorimetry Data Block: Set the sRGB colorimetry bit to avoid interop issues.
  Detailed Timing Descriptor #5: Image size is 697x392 mm, but based on the picture AR it should be 697x784 mm.
EDID:
  Base EDID: Some timings are out of range of the Monitor Ranges:
    Vertical Freq: 24.000 - 120.000 Hz (Monitor: 48.000 - 120.000 Hz)
    Horizontal Freq: 31.468 - 271.197 kHz (Monitor: 273.000 - 273.000 kHz)

Failures:

Block 0, Base EDID:
  Display Product Serial Number: ...
Block 1, CTA-861 Extension Block:
  Missing VCDB, needed for Set Selectable RGB Quantization to avoid interop issues.
Block 2, DisplayID Extension Block:
  Expected 0 DisplayID Extension Block, but got 1.
  Video Timing Modes Type 1 - Detailed Timings Data Block: Reserved stereo 0x03.
  Video Timing Modes Type 1 - Detailed Timings Data Block: Reserved stereo 0x03.
Block 3, Base EDID:
  Unknown Extension Block.
Block 4, CTA-861 Extension Block:
  Video Data Block: Duplicate VIC 3.
  Video Data Block: Duplicate VIC 118.
  Video Data Block: Duplicate VIC 2.
  Video Data Block: Duplicate VIC 19.
  Video Data Block: Duplicate VIC 4.
  Video Data Block: Duplicate VIC 41.
  Video Data Block: Duplicate VIC 16.
  Video Data Block: Duplicate VIC 63.
  Video Data Block: Duplicate VIC 97.
  Video Data Block: Duplicate VIC 93.
  Speaker Allocation Data Block: Only one instance of this Data Block is allowed.
  Colorimetry Data Block: Only one instance of this Data Block is allowed.
  HDR Static Metadata Data Block: Only one instance of this Data Block is allowed.
Block 5, DisplayID Extension Block:
  Product Type should be 0 in extension block.
  Video Timing Modes Type 1 - Detailed Timings Data Block: Reserved stereo 0x03.
  Video Timing Modes Type 1 - Detailed Timings Data Block: Reserved stereo 0x03.
EDID:
  Base EDID: EDID specified 2 extension block(s), but found 5 extension block(s).
  DisplayID: Missing DisplayID Display Parameters Data Block.
  DisplayID: DisplayID expects at least one preferred timing.

EDID conformity: FAIL
