edid-decode (hex):

00 ff ff ff ff ff ff 00 22 f0 05 30 01 01 01 01
1d 17 01 03 68 29 17 78 2e b8 b5 a0 58 55 9f 27
0c 50 54 a1 08 00 81 c0 81 80 01 01 01 01 01 01
01 01 01 01 01 01 66 21 56 aa 51 00 1e 30 46 8f
33 00 9a e6 10 00 00 1e 00 00 00 fd 00 32 4c 18
53 0e 00 0a 20 20 20 20 20 20 00 00 00 fc 00 48
50 20 4c 56 31 39 31 31 0a 20 20 20 00 00 00 ff
00 36 43 4d 33 32 39 32 4d 58 38 0a 20 20 00 2c

00 ff ff ff ff ff ff 00 22 f0 05 30 01 01 01 01
1d 17 01 03 68 29 17 78 2e b8 b5 a0 58 55 9f 27
0c 50 54 a1 08 00 81 c0 81 80 01 01 01 01 01 01
01 01 01 01 01 01 66 21 56 aa 51 00 1e 30 46 8f
33 00 9a e6 10 00 00 1e 00 00 00 fd 00 32 4c 18
53 0e 00 0a 20 20 20 20 20 20 00 00 00 fc 00 48
50 20 4c 56 31 39 31 31 0a 20 20 20 00 00 00 ff
00 36 43 4d 33 32 39 32 4d 58 38 0a 20 20 00 2c

----------------

Block 0, Base EDID:
  EDID Structure Version & Revision: 1.3
  Vendor & Product Identification:
    Manufacturer: HWP
    Model: 12293
    Serial Number: ...
    Made in: week 29 of 2013
  Basic Display Parameters & Features:
    Analog display
    Signal Level Standard: 0.700 : 0.000 : 0.700 V p-p
    Blank level equals black level
    Sync: Separate
    Maximum image size: 41 cm x 23 cm
    Gamma: 2.20
    DPMS levels: Off
    RGB color display
    Default (sRGB) color space is primary color space
    First detailed timing is the preferred timing
  Color Characteristics:
    Red  : 0.6269, 0.3466
    Green: 0.3339, 0.6210
    Blue : 0.1542, 0.0498
    White: 0.3134, 0.3291
  Established Timings I & II:
    IBM     :   720x400    70.081663 Hz   9:5     31.467 kHz     28.320000 MHz
    DMT 0x04:   640x480    59.940476 Hz   4:3     31.469 kHz     25.175000 MHz
    DMT 0x09:   800x600    60.316541 Hz   4:3     37.879 kHz     40.000000 MHz
    DMT 0x10:  1024x768    60.003840 Hz   4:3     48.363 kHz     65.000000 MHz
  Standard Timings:
    DMT 0x55:  1280x720    60.000000 Hz  16:9     45.000 kHz     74.250000 MHz
    DMT 0x23:  1280x1024   60.019740 Hz   5:4     63.981 kHz    108.000000 MHz
  Detailed Timing Descriptors:
    DTD 1:  1366x768    59.789541 Hz 683:384   47.712 kHz     85.500000 MHz (410 mm x 230 mm)
                 Hfront   70 Hsync 143 Hback  213 Hpol P
                 Vfront    3 Vsync   3 Vback   24 Vpol P
    Display Range Limits:
      Monitor ranges (GTF): 50-76 Hz V, 24-83 kHz H, max dotclock 140 MHz
    Display Product Name: 'HP LV1911'
    Display Product Serial Number: ...
Checksum: 0x2c

----------------

Block 1, Unknown EDID Extension Block 0x00:
  00 ff ff ff ff ff ff 00 22 f0 05 30 01 01 01 01 '........"..0....'
  1d 17 01 03 68 29 17 78 2e b8 b5 a0 58 55 9f 27 '....h).x....XU.''
  0c 50 54 a1 08 00 81 c0 81 80 01 01 01 01 01 01 '.PT.............'
  01 01 01 01 01 01 66 21 56 aa 51 00 1e 30 46 8f '......f!V.Q..0F.'
  33 00 9a e6 10 00 00 1e 00 00 00 fd 00 32 4c 18 '3............2L.'
  53 0e 00 0a 20 20 20 20 20 20 00 00 00 fc 00 48 'S...      .....H'
  50 20 4c 56 31 39 31 31 0a 20 20 20 00 00 00 ff 'P LV1911.   ....'
  00 36 43 4d 33 32 39 32 4d 58 38 0a 20 20 00 2c '.6CM3292MX8.  .,'
Checksum: 0x2c

----------------

Warnings:

Block 0, Base EDID:
  Vendor & Product Identification: The serial number is one of the known dummy values, it should probably be set to 0.

Failures:

Block 0, Base EDID:
  Basic Display Parameters & Features: sRGB is signaled, but the chromaticities do not match.
Block 1, Base EDID:
  Unknown Extension Block.
EDID:
  Base EDID: EDID specified 0 extension block(s), but found 1 extension block(s).

EDID conformity: FAIL
