edid-decode (hex):

00 ff ff ff ff ff ff 00 04 72 83 0e 43 80 05 ee
26 22 01 04 b5 36 1e 78 3b ad 95 ae 54 4c ab 26
0f 50 54 bf ef 80 d1 c0 95 00 90 40 81 80 81 40
81 c0 01 01 01 01 e6 37 80 c8 70 38 2d 40 58 2c
35 00 1f 2e 21 00 00 1e 00 00 00 ff 00 32 34 33
38 30 30 35 45 45 33 45 30 30 00 00 00 fd 00 30
b4 cb cb 2d 01 0a 20 20 20 20 20 20 00 00 00 fc
00 4b 47 32 35 31 51 20 50 33 0a 20 20 20 01 87

02 03 22 b3 46 04 40 3f 1f 01 03 e3 05 c3 01 e6
06 05 01 5d 5d 4f e2 00 d5 68 1a 00 00 01 01 30
b4 00 38 8b 80 18 71 38 2d 40 58 2c 35 00 1f 2e
21 00 00 1e 88 a4 80 a0 70 38 2d 40 58 2c 35 00
1f 2e 21 00 00 1e b9 99 80 c8 70 38 2d 40 58 2c
35 00 1f 2e 21 00 00 1e 00 00 00 00 00 00 00 00
00 00 00 00 00 00 00 00 00 00 00 00 00 00 00 00
00 00 00 00 00 00 00 00 00 00 00 00 00 00 00 24

00 ff ff ff ff ff ff 00 04 72 83 0e 43 80 05 ee
26 22 01 04 b5 36 1e 78 3b ad 95 ae 54 4c ab 26
0f 50 54 bf ef 80 d1 c0 95 00 90 40 81 80 81 40
81 c0 01 01 01 01 e6 37 80 c8 70 38 2d 40 58 2c
35 00 1f 2e 21 00 00 1e 00 00 00 ff 00 32 34 33
38 30 30 35 45 45 33 45 30 30 00 00 00 fd 00 30
b4 cb cb 2d 01 0a 20 20 20 20 20 20 00 00 00 fc
00 4b 47 32 35 31 51 20 50 33 0a 20 20 20 01 87

02 03 22 b3 46 04 40 3f 1f 01 03 e3 05 c3 01 e6
06 05 01 5d 5d 4f e2 00 d5 68 1a 00 00 01 01 30
b4 00 38 8b 80 18 71 38 2d 40 58 2c 35 00 1f 2e
21 00 00 1e 88 a4 80 a0 70 38 2d 40 58 2c 35 00
1f 2e 21 00 00 1e b9 99 80 c8 70 38 2d 40 58 2c
35 00 1f 2e 21 00 00 1e 00 00 00 00 00 00 00 00
00 00 00 00 00 00 00 00 00 00 00 00 00 00 00 00
00 00 00 00 00 00 00 00 00 00 00 00 00 00 00 24

----------------

Block 0, Base EDID:
  EDID Structure Version & Revision: 1.4
  Vendor & Product Identification:
    Manufacturer: ACR
    Model: 3715
    Serial Number: ...
    Made in: week 38 of 2024
  Basic Display Parameters & Features:
    Digital display
    Bits per primary color channel: 10
    DisplayPort interface
    Maximum image size: 54 cm x 30 cm
    Gamma: 2.20
    DPMS levels: Off
    Supported color formats: RGB 4:4:4, YCrCb 4:4:4, YCrCb 4:2:2
    First detailed timing includes the native pixel format and preferred refresh rate
    Display supports continuous frequencies
  Color Characteristics:
    Red  : 0.6816, 0.3300
    Green: 0.2998, 0.6689
    Blue : 0.1503, 0.0595
    White: 0.3134, 0.3291
  Established Timings I & II:
    IBM     :   720x400    70.081663 Hz   9:5     31.467 kHz     28.320000 MHz
    DMT 0x04:   640x480    59.940476 Hz   4:3     31.469 kHz     25.175000 MHz
    Apple   :   640x480    66.666667 Hz   4:3     35.000 kHz     30.240000 MHz
    DMT 0x05:   640x480    72.808802 Hz   4:3     37.861 kHz     31.500000 MHz
    DMT 0x06:   640x480    75.000000 Hz   4:3     37.500 kHz     31.500000 MHz
    DMT 0x08:   800x600    56.250000 Hz   4:3     35.156 kHz     36.000000 MHz
    DMT 0x09:   800x600    60.316541 Hz   4:3     37.879 kHz     40.000000 MHz
    DMT 0x0a:   800x600    72.187572 Hz   4:3     48.077 kHz     50.000000 MHz
    DMT 0x0b:   800x600    75.000000 Hz   4:3     46.875 kHz     49.500000 MHz
    Apple   :   832x624    74.551266 Hz   4:3     49.726 kHz     57.284000 MHz
    DMT 0x10:  1024x768    60.003840 Hz   4:3     48.363 kHz     65.000000 MHz
    DMT 0x11:  1024x768    70.069359 Hz   4:3     56.476 kHz     75.000000 MHz
    DMT 0x12:  1024x768    75.028582 Hz   4:3     60.023 kHz     78.750000 MHz
    DMT 0x24:  1280x1024   75.024675 Hz   5:4     79.976 kHz    135.000000 MHz
    Apple   :  1152x870    75.061550 Hz 192:145   68.681 kHz    100.000000 MHz
  Standard Timings:
    DMT 0x52:  1920x1080   60.000000 Hz  16:9     67.500 kHz    148.500000 MHz
    DMT 0x2f:  1440x900    59.887445 Hz  16:10    55.935 kHz    106.500000 MHz
    DMT 0x2a:  1400x1050   59.978442 Hz   4:3     65.317 kHz    121.750000 MHz
    DMT 0x23:  1280x1024   60.019740 Hz   5:4     63.981 kHz    108.000000 MHz
    DMT 0x20:  1280x960    60.000000 Hz   4:3     60.000 kHz    108.000000 MHz
    DMT 0x55:  1280x720    60.000000 Hz  16:9     45.000 kHz     74.250000 MHz
  Detailed Timing Descriptors:
    DTD 1:  1920x1080   60.000000 Hz  16:9     67.500 kHz    143.100000 MHz (543 mm x 302 mm)
                 Hfront   88 Hsync  44 Hback   68 Hpol P
                 Vfront    3 Vsync   5 Vback   37 Vpol P
    Display Product Serial Number: ...
    Display Range Limits:
      Monitor ranges (Range Limits Only): 48-180 Hz V, 203-203 kHz H, max dotclock 450 MHz
    Display Product Name: 'KG251Q P3'
  Extension blocks: 1
Checksum: 0x87

----------------

Block 1, CTA-861 Extension Block:
  Revision: 3
  Underscans IT Video Formats by default
  Supports YCbCr 4:4:4
  Supports YCbCr 4:2:2
  Native DTDs: 3
  Video Data Block:
    VIC   4:  1280x720    60.000000 Hz  16:9     45.000 kHz     74.250000 MHz
    VIC  64:  1920x1080  100.000000 Hz  16:9    112.500 kHz    297.000000 MHz
    VIC  63:  1920x1080  120.000000 Hz  16:9    135.000 kHz    297.000000 MHz
    VIC  31:  1920x1080   50.000000 Hz  16:9     56.250 kHz    148.500000 MHz
    VIC   1:   640x480    59.940476 Hz   4:3     31.469 kHz     25.175000 MHz
    VIC   3:   720x480    59.940060 Hz  16:9     31.469 kHz     27.000000 MHz
  Colorimetry Data Block:
    xvYCC601
    xvYCC709
    BT2020YCC
    BT2020RGB
    Gamut Boundary Description Metadata Profile P0
  HDR Static Metadata Data Block:
    Electro optical transfer functions:
      Traditional gamma - SDR luminance range
      SMPTE ST2084
    Supported static metadata descriptors:
      Static metadata type 1
    Desired content max luminance: 93 (374.834 cd/m^2)
    Desired content max frame-average luminance: 93 (374.834 cd/m^2)
    Desired content min luminance: 79 (0.360 cd/m^2)
  Video Capability Data Block:
    YCbCr quantization: Selectable (via AVI YQ)
    RGB quantization: Selectable (via AVI Q)
    PT scan behavior: Always Overscanned
    IT scan behavior: Always Overscanned
    CE scan behavior: Always Overscanned
  Vendor-Specific Data Block (AMD), OUI 00-00-1A:
    Version: 1
    Feature Caps: 0x01
    Minimum Refresh Rate: 48 Hz
    Maximum Refresh Rate: 180 Hz
    Flags 1.x: 0x00
  Detailed Timing Descriptors:
    DTD 2:  1920x1080  144.000000 Hz  16:9    162.000 kHz    356.400000 MHz (543 mm x 302 mm)
                 Hfront   88 Hsync  44 Hback  148 Hpol P
                 Vfront    3 Vsync   5 Vback   37 Vpol P
    DTD 3:  1920x1080  180.000000 Hz  16:9    202.500 kHz    421.200000 MHz (543 mm x 302 mm)
                 Hfront   88 Hsync  44 Hback   28 Hpol P
                 Vfront    3 Vsync   5 Vback   37 Vpol P
    DTD 4:  1920x1080  165.002096 Hz  16:9    185.627 kHz    393.530000 MHz (543 mm x 302 mm)
                 Hfront   88 Hsync  44 Hback   68 Hpol P
                 Vfront    3 Vsync   5 Vback   37 Vpol P
Checksum: 0x24  Unused space in Extension Block: 39 bytes

----------------

Warnings:

Block 1, CTA-861 Extension Block:
  Video Data Block: VIC 4 and the first DTD are not identical. Is this intended?
  Colorimetry Data Block: Set the sRGB colorimetry bit to avoid interop issues.
  Video Capability Data Block: IT scan behavior is expected to support underscanned.
  Video Capability Data Block: S_PT is equal to S_IT and S_CE, so should be set to 0 instead.
  Display Product Serial Number is set, so the Serial Number in the Base EDID should be 0.
EDID:
  Base EDID: Some timings are out of range of the Monitor Ranges:
    Horizontal Freq: 31.466 - 202.500 kHz (Monitor: 203.000 - 203.000 kHz)

Failures:

Block 1, CTA-861 Extension Block:
  Video Capability Data Block: IT video formats are always overscanned, but bit 7 of Byte 3 of the CTA-861 Extension header is set to underscanned.
EDID:
  Extension Block 2 started with EDID header, ignoring Extension Blocks >= 2.

EDID conformity: FAIL
