edid-decode (hex):

00 ff ff ff ff ff ff 00 06 af 44 46 00 00 00 00
01 12 01 03 90 1e 13 78 0a 7d c5 93 55 50 8f 27
20 50 54 00 00 00 01 01 01 01 01 01 01 01 01 01
01 01 01 01 01 01 8a 1b 00 92 50 20 17 30 30 20
36 00 30 be 10 00 00 1a 8a 1b 00 92 50 20 17 30
30 20 36 00 30 be 10 00 00 1a 00 00 00 fe 00 43
59 36 37 32 80 42 31 34 31 45 57 34 00 00 00 00
00 00 00 00 00 00 00 00 00 01 01 0a 20 20 00 a4

----------------

Block 0, Base EDID:
  EDID Structure Version & Revision: 1.3
  Vendor & Product Identification:
    Manufacturer: AUO
    Model: 17988
    Made in: week 1 of 2008
  Basic Display Parameters & Features:
    Digital display
    Maximum image size: 30 cm x 19 cm
    Gamma: 2.20
    RGB color display
    First detailed timing is the preferred timing
  Color Characteristics:
    Red  : 0.5751, 0.3349
    Green: 0.3154, 0.5595
    Blue : 0.1552, 0.1250
    White: 0.3134, 0.3291
  Established Timings I & II: none
  Standard Timings: none
  Detailed Timing Descriptors:
    DTD 1:  1280x800    60.071677 Hz  16:10    49.439 kHz     70.500000 MHz (304 mm x 190 mm)
                 Hfront   48 Hsync  32 Hback   66 Hpol P
                 Vfront    3 Vsync   6 Vback   14 Vpol N
    DTD 2:  1280x800    60.071677 Hz  16:10    49.439 kHz     70.500000 MHz (304 mm x 190 mm)
                 Hfront   48 Hsync  32 Hback   66 Hpol P
                 Vfront    3 Vsync   6 Vback   14 Vpol N
    Alphanumeric Data String: 'CY672.B141EW4'
    Manufacturer-Specified Display Descriptor (0x00): 00 00 00 00 00 00 00 00 00 00 00 01 01 0a 20 20 '..............  '
Checksum: 0xa4

----------------

Warnings:

Block 0, Base EDID:
  Alphanumeric Data String: Non-ASCII character 0x80 at position 5, can cause problems.

Failures:

Block 0, Base EDID:
  Basic Display Parameters & Features: Digital Video Interface Standard set to reserved value 0x10.
  Missing Display Product Name.
  Missing Display Range Limits Descriptor.

EDID conformity: FAIL
