edid-decode (hex):

00 ff ff ff ff ff ff 00 52 62 05 02 01 01 01 01
ff 13 01 04 a5 59 32 78 20 f0 9d a3 55 49 9b 26
0f 47 4a 21 08 00 31 0a 81 80 8b c0 01 01 01 01
01 01 01 01 01 01 66 21 50 b0 51 00 1b 30 40 70
36 00 76 f2 31 00 00 1e 00 00 00 fc 00 54 4f 53
48 49 42 41 2d 54 56 0a 20 20 00 00 00 fd 00 3b
48 1f 40 0b 00 0a 20 20 20 20 20 20 00 00 00 ff
00 30 30 30 30 30 30 30 30 30 0a 20 20 20 00 cb

00 ff ff ff ff ff ff 00 52 62 05 02 01 01 01 01
ff 13 01 04 a5 59 32 78 20 f0 9d a3 55 49 9b 26
0f 47 4a 21 08 00 31 0a 81 80 8b c0 01 01 01 01
01 01 01 01 01 01 66 21 50 b0 51 00 1b 30 40 70
36 00 76 f2 31 00 00 1e 00 00 00 fc 00 54 4f 53
48 49 42 41 2d 54 56 0a 20 20 00 00 00 fd 00 3b
48 1f 40 0b 00 0a 20 20 20 20 20 20 00 00 00 ff
00 30 30 30 30 30 30 30 30 30 0a 20 20 20 00 cb

----------------

Block 0, Base EDID:
  EDID Structure Version & Revision: 1.4
  Vendor & Product Identification:
    Manufacturer: TSB
    Model: 517
    Serial Number: ...
    Model year: 2009
  Basic Display Parameters & Features:
    Digital display
    Bits per primary color channel: 8
    DisplayPort interface
    Maximum image size: 89 cm x 50 cm
    Gamma: 2.20
    DPMS levels: Off
    Supported color formats: RGB 4:4:4
    First detailed timing does not include the native pixel format and preferred refresh rate
  Color Characteristics:
    Red  : 0.6396, 0.3349
    Green: 0.2851, 0.6054
    Blue : 0.1503, 0.0595
    White: 0.2802, 0.2900
  Established Timings I & II:
    DMT 0x04:   640x480    59.940476 Hz   4:3     31.469 kHz     25.175000 MHz
    DMT 0x09:   800x600    60.316541 Hz   4:3     37.879 kHz     40.000000 MHz
    DMT 0x10:  1024x768    60.003840 Hz   4:3     48.363 kHz     65.000000 MHz
  Standard Timings:
    GTF     :   640x400    70.000000 Hz  16:10    29.190 kHz     23.352000 MHz
    DMT 0x23:  1280x1024   60.019740 Hz   5:4     63.981 kHz    108.000000 MHz
    GTF     :  1360x765    60.000341 Hz  16:9     47.520 kHz     84.396000 MHz
  Detailed Timing Descriptors:
    DTD 1:  1360x768    60.015162 Hz  85:48    47.712 kHz     85.500000 MHz (886 mm x 498 mm)
                 Hfront   64 Hsync 112 Hback  256 Hpol P
                 Vfront    3 Vsync   6 Vback   18 Vpol P
    Display Product Name: 'TOSHIBA-TV'
    Display Range Limits:
      Monitor ranges (GTF): 59-72 Hz V, 31-64 kHz H, max dotclock 110 MHz
    Display Product Serial Number: ...
Checksum: 0xcb

----------------

Block 1, Unknown EDID Extension Block 0x00:
  00 ff ff ff ff ff ff 00 52 62 05 02 01 01 01 01 '........Rb......'
  ff 13 01 04 a5 59 32 78 20 f0 9d a3 55 49 9b 26 '.....Y2x ...UI.&'
  0f 47 4a 21 08 00 31 0a 81 80 8b c0 01 01 01 01 '.GJ!..1.........'
  01 01 01 01 01 01 66 21 50 b0 51 00 1b 30 40 70 '......f!P.Q..0@p'
  36 00 76 f2 31 00 00 1e 00 00 00 fc 00 54 4f 53 '6.v.1........TOS'
  48 49 42 41 2d 54 56 0a 20 20 00 00 00 fd 00 3b 'HIBA-TV.  .....;'
  48 1f 40 0b 00 0a 20 20 20 20 20 20 00 00 00 ff 'H.@...      ....'
  00 30 30 30 30 30 30 30 30 30 0a 20 20 20 00 cb '.000000000.   ..'
Checksum: 0xcb

----------------

Warnings:

Block 0, Base EDID:
  Vendor & Product Identification: The serial number is one of the known dummy values, it should probably be set to 0.
  Standard Timings: Standard Timing 1360x765 has a dubious odd vertical resolution.
  Display Range Limits: GTF support is deprecated in EDID 1.4.
  Display Product Serial Number: ...
EDID:
  No Native Video Resolution was defined.
  Base EDID: Some timings are out of range of the Monitor Ranges:
    Horizontal Freq: 29.190 - 63.981 kHz (Monitor: 31.000 - 64.000 kHz)

Failures:

Block 0, Base EDID:
  Display Range Limits: GTF is supported, but the display does not support continuous frequencies.
Block 1, Base EDID:
  Unknown Extension Block.
EDID:
  Base EDID: EDID specified 0 extension block(s), but found 1 extension block(s).

EDID conformity: FAIL
