edid-decode (hex):

00 ff ff ff ff ff ff 00 30 ae b6 67 34 42 38 32
33 21 01 04 b5 3c 22 78 3b 10 6b aa 4f 4d a6 25
0c 46 51 bd ef 00 81 80 81 8a 95 00 a9 c0 b3 00
b3 0a d1 e8 d1 fc 02 3a 80 18 71 38 2d 40 58 2c
45 00 56 50 21 00 00 1e 00 00 00 ff 00 55 52 33
33 32 38 42 34 0a 20 20 20 20 00 00 00 fd 0c 30
f0 69 69 3d 01 0a 20 20 20 20 20 20 00 00 00 fc
00 52 32 37 66 63 2d 33 30 0a 20 20 20 20 01 85

02 03 32 f1 49 01 03 02 04 90 12 11 13 1f 23 09
07 07 83 01 00 00 6d 1a 00 00 02 01 30 f0 00 00
00 00 00 00 e3 05 c0 00 e6 06 05 01 5a 34 3d e2
00 ea 5a 87 80 a0 70 38 4d 40 30 20 35 00 56 50
21 00 00 1a a4 9c 80 a0 70 38 59 40 30 20 35 00
56 50 21 00 00 1a c1 de 80 a0 70 38 40 40 30 40
35 00 56 50 21 00 00 1a 00 00 00 00 00 00 00 00
00 00 00 00 00 00 00 00 00 00 00 00 00 00 00 f7

00 ff ff ff ff ff ff 00 30 ae b6 67 34 42 38 32
33 21 01 04 b5 3c 22 78 3b 10 6b aa 4f 4d a6 25
0c 46 51 bd ef 00 81 80 81 8a 95 00 a9 c0 b3 00
b3 0a d1 e8 d1 fc 02 3a 80 18 71 38 2d 40 58 2c
45 00 56 50 21 00 00 1e 00 00 00 ff 00 55 52 33
33 32 38 42 34 0a 20 20 20 20 00 00 00 fd 0c 30
f0 69 69 3d 01 0a 20 20 20 20 20 20 00 00 00 fc
00 52 32 37 66 63 2d 33 30 0a 20 20 20 20 01 85

02 03 32 f1 49 01 03 02 04 90 12 11 13 1f 23 09
07 07 83 01 00 00 6d 1a 00 00 02 01 30 f0 00 00
00 00 00 00 e3 05 c0 00 e6 06 05 01 5a 34 3d e2
00 ea 5a 87 80 a0 70 38 4d 40 30 20 35 00 56 50
21 00 00 1a a4 9c 80 a0 70 38 59 40 30 20 35 00
56 50 21 00 00 1a c1 de 80 a0 70 38 40 40 30 40
35 00 56 50 21 00 00 1a 00 00 00 00 00 00 00 00
00 00 00 00 00 00 00 00 00 00 00 00 00 00 00 f7

----------------

Block 0, Base EDID:
  EDID Structure Version & Revision: 1.4
  Vendor & Product Identification:
    Manufacturer: LEN
    Model: 26550
    Serial Number: ...
    Made in: week 51 of 2023
  Basic Display Parameters & Features:
    Digital display
    Bits per primary color channel: 10
    DisplayPort interface
    Maximum image size: 60 cm x 34 cm
    Gamma: 2.20
    DPMS levels: Off
    Supported color formats: RGB 4:4:4, YCrCb 4:4:4, YCrCb 4:2:2
    First detailed timing includes the native pixel format and preferred refresh rate
    Display supports continuous frequencies
  Color Characteristics:
    Red  : 0.6640, 0.3095
    Green: 0.3007, 0.6484
    Blue : 0.1455, 0.0488
    White: 0.2753, 0.3193
  Established Timings I & II:
    IBM     :   720x400    70.081663 Hz   9:5     31.467 kHz     28.320000 MHz
    DMT 0x04:   640x480    59.940476 Hz   4:3     31.469 kHz     25.175000 MHz
    Apple   :   640x480    66.666667 Hz   4:3     35.000 kHz     30.240000 MHz
    DMT 0x05:   640x480    72.808802 Hz   4:3     37.861 kHz     31.500000 MHz
    DMT 0x06:   640x480    75.000000 Hz   4:3     37.500 kHz     31.500000 MHz
    DMT 0x09:   800x600    60.316541 Hz   4:3     37.879 kHz     40.000000 MHz
    DMT 0x0a:   800x600    72.187572 Hz   4:3     48.077 kHz     50.000000 MHz
    DMT 0x0b:   800x600    75.000000 Hz   4:3     46.875 kHz     49.500000 MHz
    Apple   :   832x624    74.551266 Hz   4:3     49.726 kHz     57.284000 MHz
    DMT 0x10:  1024x768    60.003840 Hz   4:3     48.363 kHz     65.000000 MHz
    DMT 0x11:  1024x768    70.069359 Hz   4:3     56.476 kHz     75.000000 MHz
    DMT 0x12:  1024x768    75.028582 Hz   4:3     60.023 kHz     78.750000 MHz
    DMT 0x24:  1280x1024   75.024675 Hz   5:4     79.976 kHz    135.000000 MHz
  Standard Timings:
    DMT 0x23:  1280x1024   60.019740 Hz   5:4     63.981 kHz    108.000000 MHz
    GTF     :  1280x1024   69.999805 Hz   5:4     74.620 kHz    128.943000 MHz
    DMT 0x2f:  1440x900    59.887445 Hz  16:10    55.935 kHz    106.500000 MHz
    DMT 0x53:  1600x900    60.000000 Hz  16:9     60.000 kHz    108.000000 MHz (RB)
    DMT 0x3a:  1680x1050   59.954250 Hz  16:10    65.290 kHz    146.250000 MHz
    GTF     :  1680x1050   70.000113 Hz  16:10    76.510 kHz    173.831000 MHz
    GTF     :  1920x1080  100.000000 Hz  16:9    114.400 kHz    302.016000 MHz
    GTF     :  1920x1080  119.999987 Hz  16:9    138.840 kHz    368.759000 MHz
  Detailed Timing Descriptors:
    DTD 1:  1920x1080   60.000000 Hz  16:9     67.500 kHz    148.500000 MHz (598 mm x 336 mm)
                 Hfront   88 Hsync  44 Hback  148 Hpol P
                 Vfront    4 Vsync   5 Vback   36 Vpol P
    Display Product Serial Number: ...
    Display Range Limits:
      Monitor ranges (Range Limits Only): 48-240 Hz V, 360-360 kHz H, max dotclock 610 MHz
    Display Product Name: 'R27fc-30'
  Extension blocks: 1
Checksum: 0x85

----------------

Block 1, CTA-861 Extension Block:
  Revision: 3
  Underscans IT Video Formats by default
  Basic audio support
  Supports YCbCr 4:4:4
  Supports YCbCr 4:2:2
  Native detailed modes: 1
  Video Data Block:
    VIC   1:   640x480    59.940476 Hz   4:3     31.469 kHz     25.175000 MHz
    VIC   3:   720x480    59.940060 Hz  16:9     31.469 kHz     27.000000 MHz
    VIC   2:   720x480    59.940060 Hz   4:3     31.469 kHz     27.000000 MHz
    VIC   4:  1280x720    60.000000 Hz  16:9     45.000 kHz     74.250000 MHz
    VIC  16:  1920x1080   60.000000 Hz  16:9     67.500 kHz    148.500000 MHz (native)
    VIC  18:   720x576    50.000000 Hz  16:9     31.250 kHz     27.000000 MHz
    VIC  17:   720x576    50.000000 Hz   4:3     31.250 kHz     27.000000 MHz
    VIC  19:  1280x720    50.000000 Hz  16:9     37.500 kHz     74.250000 MHz
    VIC  31:  1920x1080   50.000000 Hz  16:9     56.250 kHz    148.500000 MHz
  Audio Data Block:
    Linear PCM:
      Max channels: 2
      Supported sample rates (kHz): 48 44.1 32
      Supported sample sizes (bits): 24 20 16
  Speaker Allocation Data Block:
    FL/FR - Front Left/Right
  Vendor-Specific Data Block (AMD), OUI 00-00-1A:
    Version: 2
    Feature Caps: 0x01
    Minimum Refresh Rate: 48 Hz
    Maximum Refresh Rate: 240 Hz
    Flags 1.x: 0x00
    Flags 2.x: 0x00
  Colorimetry Data Block:
    BT2020YCC
    BT2020RGB
  HDR Static Metadata Data Block:
    Electro optical transfer functions:
      Traditional gamma - SDR luminance range
      SMPTE ST2084
    Supported static metadata descriptors:
      Static metadata type 1
    Desired content max luminance: 90 (351.250 cd/m^2)
    Desired content max frame-average luminance: 52 (154.221 cd/m^2)
    Desired content min luminance: 61 (0.201 cd/m^2)
  Video Capability Data Block:
    YCbCr quantization: Selectable (via AVI YQ)
    RGB quantization: Selectable (via AVI Q)
    PT scan behavior: Always Underscanned
    IT scan behavior: Always Underscanned
    CE scan behavior: Always Underscanned
  Detailed Timing Descriptors:
    DTD 2:  1920x1080  143.981451 Hz  16:9    166.587 kHz    346.500000 MHz (598 mm x 336 mm)
                 Hfront   48 Hsync  32 Hback   80 Hpol P
                 Vfront    3 Vsync   5 Vback   69 Vpol N
    DTD 3:  1920x1080  164.917418 Hz  16:9    192.788 kHz    401.000000 MHz (598 mm x 336 mm)
                 Hfront   48 Hsync  32 Hback   80 Hpol P
                 Vfront    3 Vsync   5 Vback   81 Vpol N
    DTD 4:  1920x1080  239.649173 Hz  16:9    274.159 kHz    570.250000 MHz (598 mm x 336 mm)
                 Hfront   48 Hsync  64 Hback   48 Hpol P
                 Vfront    3 Vsync   5 Vback   56 Vpol N
Checksum: 0xf7  Unused space in Extension Block: 23 bytes

----------------

Block 2, Unknown EDID Extension Block 0x00:
  00 ff ff ff ff ff ff 00 30 ae b6 67 34 42 38 32 '........0..g4B82'
  33 21 01 04 b5 3c 22 78 3b 10 6b aa 4f 4d a6 25 '3!...<"x;.k.OM.%'
  0c 46 51 bd ef 00 81 80 81 8a 95 00 a9 c0 b3 00 '.FQ.............'
  b3 0a d1 e8 d1 fc 02 3a 80 18 71 38 2d 40 58 2c '.......:..q8-@X,'
  45 00 56 50 21 00 00 1e 00 00 00 ff 00 55 52 33 'E.VP!........UR3'
  33 32 38 42 34 0a 20 20 20 20 00 00 00 fd 0c 30 '328B4.    .....0'
  f0 69 69 3d 01 0a 20 20 20 20 20 20 00 00 00 fc '.ii=..      ....'
  00 52 32 37 66 63 2d 33 30 0a 20 20 20 20 01 85 '.R27fc-30.    ..'
Checksum: 0x85

----------------

Block 3, CTA-861 Extension Block:
  Revision: 3
  Underscans IT Video Formats by default
  Basic audio support
  Supports YCbCr 4:4:4
  Supports YCbCr 4:2:2
  Native detailed modes: 1
  Video Data Block:
    VIC   1:   640x480    59.940476 Hz   4:3     31.469 kHz     25.175000 MHz
    VIC   3:   720x480    59.940060 Hz  16:9     31.469 kHz     27.000000 MHz
    VIC   2:   720x480    59.940060 Hz   4:3     31.469 kHz     27.000000 MHz
    VIC   4:  1280x720    60.000000 Hz  16:9     45.000 kHz     74.250000 MHz
    VIC  16:  1920x1080   60.000000 Hz  16:9     67.500 kHz    148.500000 MHz (native)
    VIC  18:   720x576    50.000000 Hz  16:9     31.250 kHz     27.000000 MHz
    VIC  17:   720x576    50.000000 Hz   4:3     31.250 kHz     27.000000 MHz
    VIC  19:  1280x720    50.000000 Hz  16:9     37.500 kHz     74.250000 MHz
    VIC  31:  1920x1080   50.000000 Hz  16:9     56.250 kHz    148.500000 MHz
  Audio Data Block:
    Linear PCM:
      Max channels: 2
      Supported sample rates (kHz): 48 44.1 32
      Supported sample sizes (bits): 24 20 16
  Speaker Allocation Data Block:
    FL/FR - Front Left/Right
  Vendor-Specific Data Block (AMD), OUI 00-00-1A:
    Version: 2
    Feature Caps: 0x01
    Minimum Refresh Rate: 48 Hz
    Maximum Refresh Rate: 240 Hz
    Flags 1.x: 0x00
    Flags 2.x: 0x00
  Colorimetry Data Block:
    BT2020YCC
    BT2020RGB
  HDR Static Metadata Data Block:
    Electro optical transfer functions:
      Traditional gamma - SDR luminance range
      SMPTE ST2084
    Supported static metadata descriptors:
      Static metadata type 1
    Desired content max luminance: 90 (351.250 cd/m^2)
    Desired content max frame-average luminance: 52 (154.221 cd/m^2)
    Desired content min luminance: 61 (0.201 cd/m^2)
  Video Capability Data Block:
    YCbCr quantization: Selectable (via AVI YQ)
    RGB quantization: Selectable (via AVI Q)
    PT scan behavior: Always Underscanned
    IT scan behavior: Always Underscanned
    CE scan behavior: Always Underscanned
  Detailed Timing Descriptors:
    DTD 5:  1920x1080  143.981451 Hz  16:9    166.587 kHz    346.500000 MHz (598 mm x 336 mm)
                 Hfront   48 Hsync  32 Hback   80 Hpol P
                 Vfront    3 Vsync   5 Vback   69 Vpol N
    DTD 6:  1920x1080  164.917418 Hz  16:9    192.788 kHz    401.000000 MHz (598 mm x 336 mm)
                 Hfront   48 Hsync  32 Hback   80 Hpol P
                 Vfront    3 Vsync   5 Vback   81 Vpol N
    DTD 7:  1920x1080  239.649173 Hz  16:9    274.159 kHz    570.250000 MHz (598 mm x 336 mm)
                 Hfront   48 Hsync  64 Hback   48 Hpol P
                 Vfront    3 Vsync   5 Vback   56 Vpol N
Checksum: 0xf7  Unused space in Extension Block: 23 bytes

----------------

Warnings:

Block 1, CTA-861 Extension Block:
  Video Data Block: VIC 1 and the first DTD are not identical. Is this intended?
  Colorimetry Data Block: Set the sRGB colorimetry bit to avoid interop issues.
  Video Capability Data Block: S_PT is equal to S_IT and S_CE, so should be set to 0 instead.
  Display Product Serial Number is set, so the Serial Number in the Base EDID should be 0.
Block 3, CTA-861 Extension Block:
  Colorimetry Data Block: Set the sRGB colorimetry bit to avoid interop issues.
  Video Capability Data Block: S_PT is equal to S_IT and S_CE, so should be set to 0 instead.
EDID:
  Base EDID: Some timings are out of range of the Monitor Ranges:
    Horizontal Freq: 31.250 - 274.158 kHz (Monitor: 360.000 - 360.000 kHz)
  CTA-861: Multiple native progressive timings are defined.

Failures:

Block 2, Base EDID:
  Unknown Extension Block.
Block 3, CTA-861 Extension Block:
  Video Data Block: Duplicate VIC 1.
  Video Data Block: Duplicate VIC 3.
  Video Data Block: Duplicate VIC 2.
  Video Data Block: Duplicate VIC 4.
  Video Data Block: Duplicate VIC 16.
  Video Data Block: Duplicate VIC 18.
  Video Data Block: Duplicate VIC 17.
  Video Data Block: Duplicate VIC 19.
  Video Data Block: Duplicate VIC 31.
  Speaker Allocation Data Block: Only one instance of this Data Block is allowed.
  Colorimetry Data Block: Only one instance of this Data Block is allowed.
  HDR Static Metadata Data Block: Only one instance of this Data Block is allowed.
  Video Capability Data Block: Only one instance of this Data Block is allowed.
EDID:
  Base EDID: EDID specified 1 extension block(s), but found 3 extension block(s).

EDID conformity: FAIL
