edid-decode (hex):

00 ff ff ff ff ff ff 00 22 f0 36 28 01 01 01 01
2e 13 01 03 68 22 13 78 2a 54 15 9b 54 53 95 27
16 50 54 21 08 00 81 c0 81 80 01 01 01 01 01 01
01 01 01 01 01 01 66 21 56 aa 51 00 1e 30 46 8f
33 00 58 c2 10 00 00 1e 00 00 00 fd 00 39 3f 18
53 0e 00 0a 20 20 20 20 20 20 00 00 00 fc 00 43
6f 6d 70 61 71 20 43 51 31 35 36 39 00 00 00 ff
00 43 4e 43 39 34 36 4e 59 43 34 0a 20 20 00 84

00 ff ff ff ff ff ff 00 22 f0 36 28 01 01 01 01
2e 13 01 03 68 22 13 78 2a 54 15 9b 54 53 95 27
16 50 54 21 08 00 81 c0 81 80 01 01 01 01 01 01
01 01 01 01 01 01 66 21 56 aa 51 00 1e 30 46 8f
33 00 58 c2 10 00 00 1e 00 00 00 fd 00 39 3f 18
53 0e 00 0a 20 20 20 20 20 20 00 00 00 fc 00 43
6f 6d 70 61 71 20 43 51 31 35 36 39 00 00 00 ff
00 43 4e 43 39 34 36 4e 59 43 34 0a 20 20 00 84

----------------

Block 0, Base EDID:
  EDID Structure Version & Revision: 1.3
  Vendor & Product Identification:
    Manufacturer: HWP
    Model: 10294
    Serial Number: ...
    Made in: week 46 of 2009
  Basic Display Parameters & Features:
    Analog display
    Signal Level Standard: 0.700 : 0.000 : 0.700 V p-p
    Blank level equals black level
    Sync: Separate
    Maximum image size: 34 cm x 19 cm
    Gamma: 2.20
    DPMS levels: Off
    RGB color display
    First detailed timing is the preferred timing
  Color Characteristics:
    Red  : 0.6064, 0.3291
    Green: 0.3251, 0.5820
    Blue : 0.1523, 0.0869
    White: 0.3134, 0.3291
  Established Timings I & II:
    DMT 0x04:   640x480    59.940476 Hz   4:3     31.469 kHz     25.175000 MHz
    DMT 0x09:   800x600    60.316541 Hz   4:3     37.879 kHz     40.000000 MHz
    DMT 0x10:  1024x768    60.003840 Hz   4:3     48.363 kHz     65.000000 MHz
  Standard Timings:
    DMT 0x55:  1280x720    60.000000 Hz  16:9     45.000 kHz     74.250000 MHz
    DMT 0x23:  1280x1024   60.019740 Hz   5:4     63.981 kHz    108.000000 MHz
  Detailed Timing Descriptors:
    DTD 1:  1366x768    59.789541 Hz 683:384   47.712 kHz     85.500000 MHz (344 mm x 194 mm)
                 Hfront   70 Hsync 143 Hback  213 Hpol P
                 Vfront    3 Vsync   3 Vback   24 Vpol P
    Display Range Limits:
      Monitor ranges (GTF): 57-63 Hz V, 24-83 kHz H, max dotclock 140 MHz
    Display Product Name: 'Compaq CQ1569'
    Display Product Serial Number: ...
Checksum: 0x84

----------------

Block 1, Unknown EDID Extension Block 0x00:
  00 ff ff ff ff ff ff 00 22 f0 36 28 01 01 01 01 '........".6(....'
  2e 13 01 03 68 22 13 78 2a 54 15 9b 54 53 95 27 '....h".x*T..TS.''
  16 50 54 21 08 00 81 c0 81 80 01 01 01 01 01 01 '.PT!............'
  01 01 01 01 01 01 66 21 56 aa 51 00 1e 30 46 8f '......f!V.Q..0F.'
  33 00 58 c2 10 00 00 1e 00 00 00 fd 00 39 3f 18 '3.X..........9?.'
  53 0e 00 0a 20 20 20 20 20 20 00 00 00 fc 00 43 'S...      .....C'
  6f 6d 70 61 71 20 43 51 31 35 36 39 00 00 00 ff 'ompaq CQ1569....'
  00 43 4e 43 39 34 36 4e 59 43 34 0a 20 20 00 84 '.CNC946NYC4.  ..'
Checksum: 0x84

----------------

Warnings:

Block 0, Base EDID:
  Vendor & Product Identification: The serial number is one of the known dummy values, it should probably be set to 0.

Failures:

Block 1, Base EDID:
  Unknown Extension Block.
EDID:
  Base EDID: EDID specified 0 extension block(s), but found 1 extension block(s).

EDID conformity: FAIL
