edid-decode (hex):

00 ff ff ff ff ff ff 00 30 e4 6b 07 00 00 00 00
00 20 01 04 a5 22 13 78 07 a8 05 a6 54 4b 9b 25
0e 50 54 00 00 00 01 01 01 01 01 01 01 01 01 01
01 01 01 01 01 01 70 c2 00 a0 a0 a0 55 50 30 20
35 00 58 c2 10 00 00 1a 38 61 00 a0 a0 a0 55 50
30 20 35 00 58 c2 10 00 00 1a 00 00 00 fd 00 30
78 b7 b7 32 01 0a 20 20 20 20 20 20 00 00 00 02
00 0c 33 ff 0a 3c 96 28 17 36 96 00 00 00 01 ef

70 20 79 02 00 25 01 09 5f 98 07 5f 98 07 30 78
80 81 00 13 72 1a 00 00 03 01 30 78 00 00 53 51
53 51 78 00 00 00 00 00 00 00 00 00 00 00 00 00
00 00 00 00 00 00 00 00 00 00 00 00 00 00 00 00
00 00 00 00 00 00 00 00 00 00 00 00 00 00 00 00
00 00 00 00 00 00 00 00 00 00 00 00 00 00 00 00
00 00 00 00 00 00 00 00 00 00 00 00 00 00 00 00
00 00 00 00 00 00 00 00 00 00 00 00 00 00 86 90

00 ff ff ff ff ff ff 00 30 e4 6b 07 00 00 00 00
00 20 01 04 a5 22 13 78 07 a8 05 a6 54 4b 9b 25
0e 50 54 00 00 00 01 01 01 01 01 01 01 01 01 01
01 01 01 01 01 01 70 c2 00 a0 a0 a0 55 50 30 20
35 00 58 c2 10 00 00 1a 38 61 00 a0 a0 a0 55 50
30 20 35 00 58 c2 10 00 00 1a 00 00 00 fd 00 30
78 b7 b7 32 01 0a 20 20 20 20 20 20 00 00 00 02
00 0c 33 ff 0a 3c 96 28 17 36 96 00 00 00 01 ef

70 20 79 02 00 25 01 09 5f 98 07 5f 98 07 30 78
80 81 00 13 72 1a 00 00 03 01 30 78 00 00 53 51
53 51 78 00 00 00 00 00 00 00 00 00 00 00 00 00
00 00 00 00 00 00 00 00 00 00 00 00 00 00 00 00
00 00 00 00 00 00 00 00 00 00 00 00 00 00 00 00
00 00 00 00 00 00 00 00 00 00 00 00 00 00 00 00
00 00 00 00 00 00 00 00 00 00 00 00 00 00 00 00
00 00 00 00 00 00 00 00 00 00 00 00 00 00 86 90

----------------

Block 0, Base EDID:
  EDID Structure Version & Revision: 1.4
  Vendor & Product Identification:
    Manufacturer: LGD
    Model: 1899
    Made in: 2022
  Basic Display Parameters & Features:
    Digital display
    Bits per primary color channel: 8
    DisplayPort interface
    Maximum image size: 34 cm x 19 cm
    Gamma: 2.20
    Supported color formats: RGB 4:4:4
    Default (sRGB) color space is primary color space
    First detailed timing includes the native pixel format and preferred refresh rate
    Display supports continuous frequencies
  Color Characteristics:
    Red  : 0.6503, 0.3300
    Green: 0.2949, 0.6054
    Blue : 0.1445, 0.0546
    White: 0.3134, 0.3291
  Established Timings I & II: none
  Standard Timings: none
  Detailed Timing Descriptors:
    DTD 1:  2560x1440  120.000000 Hz  16:9    183.000 kHz    497.760000 MHz (344 mm x 194 mm)
                 Hfront   48 Hsync  32 Hback   80 Hpol P
                 Vfront    3 Vsync   5 Vback   77 Vpol N
    DTD 2:  2560x1440   60.000000 Hz  16:9     91.500 kHz    248.880000 MHz (344 mm x 194 mm)
                 Hfront   48 Hsync  32 Hback   80 Hpol P
                 Vfront    3 Vsync   5 Vback   77 Vpol N
    Display Range Limits:
      Monitor ranges (Range Limits Only): 48-120 Hz V, 183-183 kHz H, max dotclock 500 MHz
    Manufacturer-Specified Display Descriptor (0x02): 00 02 00 0c 33 ff 0a 3c 96 28 17 36 96 00 00 00 '....3..<.(.6....'
  Extension blocks: 1
Checksum: 0xef

----------------

Block 1, DisplayID Extension Block:
  Version: 2.0
  Extension Count: 0
  Display Product Primary Use Case: None of the listed primary use cases; generic display
  Dynamic Video Timing Range Limits Data Block:
    Minimum Pixel Clock: 497760 kHz
    Maximum Pixel Clock: 497760 kHz
    Minimum Vertical Refresh Rate: 48 Hz
    Maximum Vertical Refresh Rate: 120 Hz
    Seamless Dynamic Video Timing Support: Yes
  CTA-861 DisplayID Data Block:
  Vendor-Specific Data Block (AMD), OUI 00-00-1A:
    Version: 3
    Flags 1: 0x01
      FreeSync Supported
    Minimum Refresh Rate: 48 Hz
    Maximum Refresh Rate: 120 Hz
    Flags 5: 0x00
  Checksum: 0x86
Checksum: 0x90

----------------

Warnings:

Block 0, Base EDID:
  Missing Display Product Name.
EDID:
  Base EDID: Some timings are out of range of the Monitor Ranges:
    Horizontal Freq: 91.500 - 183.000 kHz (Monitor: 183.000 - 183.000 kHz)

Failures:

Block 0, Base EDID:
  Basic Display Parameters & Features: sRGB is signaled, but the chromaticities do not match.
EDID:
  Extension Block 2 started with EDID header, ignoring Extension Blocks >= 2.
  DisplayID: Missing DisplayID Display Parameters Data Block.
  DisplayID: Missing DisplayID Type VII Detailed Timing Data Block.
  DisplayID: DisplayID expects at least one preferred timing.

EDID conformity: FAIL
