edid-decode (hex):

00 ff ff ff ff ff ff 00 23 35 01 00 01 01 01 01
1f 1a 01 03 68 2a 18 78 2e 4f a5 a4 59 49 99 24
12 50 54 bf ef 00 81 80 81 40 71 4f 95 00 01 01
01 01 01 01 01 01 9a 29 a0 d0 51 84 22 30 50 98
36 00 98 ff 10 00 00 1c 34 21 50 b0 51 00 1b 30
40 70 36 00 20 56 00 00 00 1e 64 19 00 40 41 00
26 30 18 88 36 00 20 56 00 00 00 18 00 00 00 fc
00 42 0a 0a 0a 0a 0a 0a 0a 0a 0a 0a 0a 0a 00 8e

00 ff ff ff ff ff ff 00 23 35 01 00 01 01 01 01
1f 1a 01 03 68 2a 18 78 2e 4f a5 a4 59 49 99 24
12 50 54 bf ef 00 81 80 81 40 71 4f 95 00 01 01
01 01 01 01 01 01 9a 29 a0 d0 51 84 22 30 50 98
36 00 98 ff 10 00 00 1c 34 21 50 b0 51 00 1b 30
40 70 36 00 20 56 00 00 00 1e 64 19 00 40 41 00
26 30 18 88 36 00 20 56 00 00 00 18 00 00 00 fc
00 42 0a 0a 0a 0a 0a 0a 0a 0a 0a 0a 0a 0a 00 8e

----------------

Block 0, Base EDID:
  EDID Structure Version & Revision: 1.3
  Vendor & Product Identification:
    Manufacturer: HYU
    Model: 1
    Serial Number: ...
    Made in: week 31 of 2016
  Basic Display Parameters & Features:
    Analog display
    Signal Level Standard: 0.700 : 0.000 : 0.700 V p-p
    Blank level equals black level
    Sync: Separate
    Maximum image size: 42 cm x 24 cm
    Gamma: 2.20
    DPMS levels: Off
    RGB color display
    Default (sRGB) color space is primary color space
    First detailed timing is the preferred timing
  Color Characteristics:
    Red  : 0.6416, 0.3476
    Green: 0.2880, 0.6005
    Blue : 0.1425, 0.0722
    White: 0.3134, 0.3291
  Established Timings I & II:
    IBM     :   720x400    70.081663 Hz   9:5     31.467 kHz     28.320000 MHz
    DMT 0x04:   640x480    59.940476 Hz   4:3     31.469 kHz     25.175000 MHz
    Apple   :   640x480    66.666667 Hz   4:3     35.000 kHz     30.240000 MHz
    DMT 0x05:   640x480    72.808802 Hz   4:3     37.861 kHz     31.500000 MHz
    DMT 0x06:   640x480    75.000000 Hz   4:3     37.500 kHz     31.500000 MHz
    DMT 0x08:   800x600    56.250000 Hz   4:3     35.156 kHz     36.000000 MHz
    DMT 0x09:   800x600    60.316541 Hz   4:3     37.879 kHz     40.000000 MHz
    DMT 0x0a:   800x600    72.187572 Hz   4:3     48.077 kHz     50.000000 MHz
    DMT 0x0b:   800x600    75.000000 Hz   4:3     46.875 kHz     49.500000 MHz
    Apple   :   832x624    74.551266 Hz   4:3     49.726 kHz     57.284000 MHz
    DMT 0x10:  1024x768    60.003840 Hz   4:3     48.363 kHz     65.000000 MHz
    DMT 0x11:  1024x768    70.069359 Hz   4:3     56.476 kHz     75.000000 MHz
    DMT 0x12:  1024x768    75.028582 Hz   4:3     60.023 kHz     78.750000 MHz
    DMT 0x24:  1280x1024   75.024675 Hz   5:4     79.976 kHz    135.000000 MHz
  Standard Timings:
    DMT 0x23:  1280x1024   60.019740 Hz   5:4     63.981 kHz    108.000000 MHz
    DMT 0x20:  1280x960    60.000000 Hz   4:3     60.000 kHz    108.000000 MHz
    DMT 0x15:  1152x864    75.000000 Hz   4:3     67.500 kHz    108.000000 MHz
    DMT 0x2f:  1440x900    59.887445 Hz  16:10    55.935 kHz    106.500000 MHz
  Detailed Timing Descriptors:
    DTD 1:  1440x900    59.887445 Hz  16:10    55.935 kHz    106.500000 MHz (408 mm x 255 mm)
                 Hfront   80 Hsync 152 Hback  232 Hpol N
                 Vfront    3 Vsync   6 Vback   25 Vpol P
    DTD 2:  1360x768    59.664196 Hz  85:48    47.433 kHz     85.000000 MHz (32 mm x 86 mm)
                 Hfront   64 Hsync 112 Hback  256 Hpol P
                 Vfront    3 Vsync   6 Vback   18 Vpol P
    DTD 3:  1024x768    60.003840 Hz   4:3     48.363 kHz     65.000000 MHz (32 mm x 86 mm)
                 Hfront   24 Hsync 136 Hback  160 Hpol N
                 Vfront    3 Vsync   6 Vback   29 Vpol N
    Display Product Name: 'B'
Checksum: 0x8e

----------------

Warnings:

Block 0, Base EDID:
  Vendor & Product Identification: The serial number is one of the known dummy values, it should probably be set to 0.
  Detailed Timing Descriptor #2: Dubious image size (32x86 mm is smaller than 100x100 mm).
  Detailed Timing Descriptor #3: Dubious image size (32x86 mm is smaller than 100x100 mm).

Failures:

Block 0, Base EDID:
  Basic Display Parameters & Features: sRGB is signaled, but the chromaticities do not match.
  Detailed Timing Descriptor #1: Mismatch of image size 408x255 mm vs display size 420x240 mm.
  Detailed Timing Descriptor #2: Mismatch of image size 32x86 mm vs display size 420x240 mm.
  Detailed Timing Descriptor #3: Mismatch of image size 32x86 mm vs display size 420x240 mm.
  Display Product Name: Non-space after newline.
  Missing Display Range Limits Descriptor.
EDID:
  Extension Block 1 started with EDID header, ignoring Extension Blocks >= 1.
  Base EDID: The DTD max image size is 408x255mm, which is larger than the display size 420.0x240.0mm.

EDID conformity: FAIL
