edid-decode (hex):

00 ff ff ff ff ff ff 00 1c 54 16 27 d2 02 00 00
1c 21 01 04 b5 3c 22 78 3b 0f 65 ad 4f 3f ab 26
17 50 54 bf cf 00 d1 c0 81 c0 81 40 81 80 95 00
b3 00 81 fc 01 01 00 fa 00 50 a0 a0 1f 50 0a 3c
35 00 55 50 21 00 00 1e 69 5e 00 a0 a0 a0 29 50
30 20 b8 04 55 50 21 00 00 1a 00 00 00 fd 00 30
a5 fa fa 41 01 0a 20 20 20 20 20 20 00 00 00 fc
00 47 32 37 51 43 20 41 0a 20 20 20 20 20 01 d7

02 03 2c 71 4e 01 02 03 11 12 13 0f 1d 1e 0e 90
1f 04 3f 23 09 17 07 83 01 00 00 65 03 0c 00 10
00 e3 05 e0 01 e6 06 07 01 61 56 1c 6f c2 00 a0
a0 a0 55 50 30 20 35 00 55 50 21 00 00 1a 5e 91
80 88 70 38 11 40 24 20 38 00 55 50 21 00 00 1a
fc 7e 80 88 70 38 12 40 18 20 35 00 55 50 21 00
00 1e 00 00 00 00 00 00 00 00 00 00 00 00 00 00
00 00 00 00 00 00 00 00 00 00 00 00 00 00 00 74

00 ff ff ff ff ff ff 00 1c 54 16 27 d2 02 00 00
1c 21 01 04 b5 3c 22 78 3b 0f 65 ad 4f 3f ab 26
17 50 54 bf cf 00 d1 c0 81 c0 81 40 81 80 95 00
b3 00 81 fc 01 01 00 fa 00 50 a0 a0 1f 50 0a 3c
35 00 55 50 21 00 00 1e 69 5e 00 a0 a0 a0 29 50
30 20 b8 04 55 50 21 00 00 1a 00 00 00 fd 00 30
a5 fa fa 41 01 0a 20 20 20 20 20 20 00 00 00 fc
00 47 32 37 51 43 20 41 0a 20 20 20 20 20 01 d7

02 03 2c 71 4e 01 02 03 11 12 13 0f 1d 1e 0e 90
1f 04 3f 23 09 17 07 83 01 00 00 65 03 0c 00 10
00 e3 05 e0 01 e6 06 07 01 61 56 1c 6f c2 00 a0
a0 a0 55 50 30 20 35 00 55 50 21 00 00 1a 5e 91
80 88 70 38 11 40 24 20 38 00 55 50 21 00 00 1a
fc 7e 80 88 70 38 12 40 18 20 35 00 55 50 21 00
00 1e 00 00 00 00 00 00 00 00 00 00 00 00 00 00
00 00 00 00 00 00 00 00 00 00 00 00 00 00 00 74

----------------

Block 0, Base EDID:
  EDID Structure Version & Revision: 1.4
  Vendor & Product Identification:
    Manufacturer: GBT
    Model: 10006
    Serial Number: ...
    Made in: week 28 of 2023
  Basic Display Parameters & Features:
    Digital display
    Bits per primary color channel: 10
    DisplayPort interface
    Maximum image size: 60 cm x 34 cm
    Gamma: 2.20
    DPMS levels: Off
    Supported color formats: RGB 4:4:4, YCrCb 4:4:4, YCrCb 4:2:2
    First detailed timing includes the native pixel format and preferred refresh rate
    Display supports continuous frequencies
  Color Characteristics:
    Red  : 0.6757, 0.3085
    Green: 0.2490, 0.6708
    Blue : 0.1494, 0.0917
    White: 0.3134, 0.3291
  Established Timings I & II:
    IBM     :   720x400    70.081663 Hz   9:5     31.467 kHz     28.320000 MHz
    DMT 0x04:   640x480    59.940476 Hz   4:3     31.469 kHz     25.175000 MHz
    Apple   :   640x480    66.666667 Hz   4:3     35.000 kHz     30.240000 MHz
    DMT 0x05:   640x480    72.808802 Hz   4:3     37.861 kHz     31.500000 MHz
    DMT 0x06:   640x480    75.000000 Hz   4:3     37.500 kHz     31.500000 MHz
    DMT 0x08:   800x600    56.250000 Hz   4:3     35.156 kHz     36.000000 MHz
    DMT 0x09:   800x600    60.316541 Hz   4:3     37.879 kHz     40.000000 MHz
    DMT 0x0a:   800x600    72.187572 Hz   4:3     48.077 kHz     50.000000 MHz
    DMT 0x0b:   800x600    75.000000 Hz   4:3     46.875 kHz     49.500000 MHz
    DMT 0x10:  1024x768    60.003840 Hz   4:3     48.363 kHz     65.000000 MHz
    DMT 0x11:  1024x768    70.069359 Hz   4:3     56.476 kHz     75.000000 MHz
    DMT 0x12:  1024x768    75.028582 Hz   4:3     60.023 kHz     78.750000 MHz
    DMT 0x24:  1280x1024   75.024675 Hz   5:4     79.976 kHz    135.000000 MHz
  Standard Timings:
    DMT 0x52:  1920x1080   60.000000 Hz  16:9     67.500 kHz    148.500000 MHz
    DMT 0x55:  1280x720    60.000000 Hz  16:9     45.000 kHz     74.250000 MHz
    DMT 0x20:  1280x960    60.000000 Hz   4:3     60.000 kHz    108.000000 MHz
    DMT 0x23:  1280x1024   60.019740 Hz   5:4     63.981 kHz    108.000000 MHz
    DMT 0x2f:  1440x900    59.887445 Hz  16:10    55.935 kHz    106.500000 MHz
    DMT 0x3a:  1680x1050   59.954250 Hz  16:10    65.290 kHz    146.250000 MHz
    GTF     :  1280x720   119.999881 Hz  16:9     92.640 kHz    161.564000 MHz
  Detailed Timing Descriptors:
    DTD 1:  2560x1440  164.802340 Hz  16:9    242.424 kHz    640.000000 MHz (597 mm x 336 mm)
                 Hfront   10 Hsync  60 Hback   10 Hpol P
                 Vfront    3 Vsync   5 Vback   23 Vpol P
    DTD 2:  2560x1440   59.997716 Hz  16:9     88.857 kHz    241.690000 MHz (597 mm x 336 mm)
                 Hfront   48 Hsync  32 Hback   80 Hpol P
                 Vfront   27 Vsync   8 Vback    6 Vpol N
    Display Range Limits:
      Monitor ranges (Range Limits Only): 48-165 Hz V, 250-250 kHz H, max dotclock 650 MHz
    Display Product Name: 'G27QC A'
  Extension blocks: 1
Checksum: 0xd7

----------------

Block 1, CTA-861 Extension Block:
  Revision: 3
  Basic audio support
  Supports YCbCr 4:4:4
  Supports YCbCr 4:2:2
  Native DTDs: 1
  Video Data Block:
    VIC   1:   640x480    59.940476 Hz   4:3     31.469 kHz     25.175000 MHz
    VIC   2:   720x480    59.940060 Hz   4:3     31.469 kHz     27.000000 MHz
    VIC   3:   720x480    59.940060 Hz  16:9     31.469 kHz     27.000000 MHz
    VIC  17:   720x576    50.000000 Hz   4:3     31.250 kHz     27.000000 MHz
    VIC  18:   720x576    50.000000 Hz  16:9     31.250 kHz     27.000000 MHz
    VIC  19:  1280x720    50.000000 Hz  16:9     37.500 kHz     74.250000 MHz
    VIC  15:  1440x480    59.940060 Hz  16:9     31.469 kHz     54.000000 MHz
    VIC  29:  1440x576    50.000000 Hz   4:3     31.250 kHz     54.000000 MHz
    VIC  30:  1440x576    50.000000 Hz  16:9     31.250 kHz     54.000000 MHz
    VIC  14:  1440x480    59.940060 Hz   4:3     31.469 kHz     54.000000 MHz
    VIC  16:  1920x1080   60.000000 Hz  16:9     67.500 kHz    148.500000 MHz (native)
    VIC  31:  1920x1080   50.000000 Hz  16:9     56.250 kHz    148.500000 MHz
    VIC   4:  1280x720    60.000000 Hz  16:9     45.000 kHz     74.250000 MHz
    VIC  63:  1920x1080  120.000000 Hz  16:9    135.000 kHz    297.000000 MHz
  Audio Data Block:
    Linear PCM:
      Max channels: 2
      Supported sample rates (kHz): 96 48 44.1 32
      Supported sample sizes (bits): 24 20 16
  Speaker Allocation Data Block:
    FL/FR - Front Left/Right
  Vendor-Specific Data Block (HDMI), OUI 00-0C-03:
    Source physical address: 1.0.0.0
  Colorimetry Data Block:
    BT2020cYCC
    BT2020YCC
    BT2020RGB
    Gamut Boundary Description Metadata Profile P0
  HDR Static Metadata Data Block:
    Electro optical transfer functions:
      Traditional gamma - SDR luminance range
      Traditional gamma - HDR luminance range
      SMPTE ST2084
    Supported static metadata descriptors:
      Static metadata type 1
    Desired content max luminance: 97 (408.759 cd/m^2)
    Desired content max frame-average luminance: 86 (322.098 cd/m^2)
    Desired content min luminance: 28 (0.049 cd/m^2)
  Detailed Timing Descriptors:
    DTD 3:  2560x1440  119.997589 Hz  16:9    182.996 kHz    497.750000 MHz (597 mm x 336 mm)
                 Hfront   48 Hsync  32 Hback   80 Hpol P
                 Vfront    3 Vsync   5 Vback   77 Vpol N
    DTD 4:  1920x1080  164.997216 Hz  16:9    181.002 kHz    372.140000 MHz (597 mm x 336 mm)
                 Hfront   36 Hsync  32 Hback   68 Hpol P
                 Vfront    3 Vsync   8 Vback    6 Vpol N
    DTD 5:  1920x1080  144.000765 Hz  16:9    158.113 kHz    325.080000 MHz (597 mm x 336 mm)
                 Hfront   24 Hsync  32 Hback   80 Hpol P
                 Vfront    3 Vsync   5 Vback   10 Vpol P
Checksum: 0x74  Unused space in Extension Block: 29 bytes

----------------

Warnings:

Block 1, CTA-861 Extension Block:
  IT Video Formats are overscanned by default, but normally this should be underscanned.
  Video Data Block: VIC 1 and the first DTD are not identical. Is this intended?
  Colorimetry Data Block: Set the sRGB colorimetry bit to avoid interop issues.
EDID:
  Base EDID: Some timings are out of range of the Monitor Ranges:
    Horizontal Freq: 31.250 - 242.424 kHz (Monitor: 250.000 - 250.000 kHz)

Failures:

Block 1, CTA-861 Extension Block:
  Vendor-Specific Data Block (HDMI), OUI 00-0C-03: The HDMI Specification requires EDID 1.3 instead of 1.4.
  Missing VCDB, needed for Set Selectable RGB Quantization to avoid interop issues.
EDID:
  Extension Block 2 started with EDID header, ignoring Extension Blocks >= 2.
  CTA-861: Native progressive timings are a mix of several resolutions.

EDID conformity: FAIL
