edid-decode (hex):

00 ff ff ff ff ff ff 00 04 72 b0 40 78 56 34 12
28 19 01 03 81 3b 21 78 ea 64 b5 ab 52 38 ab 25
13 50 54 00 00 00 01 01 01 01 01 01 01 01 01 01
01 01 01 01 01 01 9e 37 80 b4 70 38 32 40 2d 2d
5a 00 55 50 21 00 00 1e 00 00 00 10 00 49 6e 73
70 69 72 6f 6e 20 33 34 35 35 00 00 00 10 00 41
49 4f 20 4c 43 44 0a 20 20 20 20 20 00 00 00 fc
00 41 63 65 72 20 41 49 4f 0a 20 20 20 20 00 95

00 ff ff ff ff ff ff 00 04 72 b0 40 78 56 34 12
28 19 01 03 81 3b 21 78 ea 64 b5 ab 52 38 ab 25
13 50 54 00 00 00 01 01 01 01 01 01 01 01 01 01
01 01 01 01 01 01 9e 37 80 b4 70 38 32 40 2d 2d
5a 00 55 50 21 00 00 1e 00 00 00 10 00 49 6e 73
70 69 72 6f 6e 20 33 34 35 35 00 00 00 10 00 41
49 4f 20 4c 43 44 0a 20 20 20 20 20 00 00 00 fc
00 41 63 65 72 20 41 49 4f 0a 20 20 20 20 00 95

----------------

Block 0, Base EDID:
  EDID Structure Version & Revision: 1.3
  Vendor & Product Identification:
    Manufacturer: ACR
    Model: 16560
    Serial Number: ...
    Made in: week 40 of 2015
  Basic Display Parameters & Features:
    Digital display
    DFP 1.x compatible TMDS
    Maximum image size: 59 cm x 33 cm
    Gamma: 2.20
    DPMS levels: Standby Suspend Off
    RGB color display
    First detailed timing is the preferred timing
  Color Characteristics:
    Red  : 0.6689, 0.3222
    Green: 0.2197, 0.6679
    Blue : 0.1464, 0.0771
    White: 0.3134, 0.3291
  Established Timings I & II: none
  Standard Timings: none
  Detailed Timing Descriptors:
    DTD 1:  1920x1080   60.000000 Hz  16:9     67.800 kHz    142.380000 MHz (597 mm x 336 mm)
                 Hfront   45 Hsync  45 Hback   90 Hpol P
                 Vfront    5 Vsync  10 Vback   35 Vpol P
    Dummy Descriptor:
    Dummy Descriptor:
    Display Product Name: 'Acer AIO'
Checksum: 0x95

----------------

Failures:

Block 0, Base EDID:
  Dummy Descriptor: Dummy block filled with garbage.
  Dummy Descriptor: Dummy block filled with garbage.
  Missing Display Range Limits Descriptor.
EDID:
  Extension Block 1 started with EDID header, ignoring Extension Blocks >= 1.

EDID conformity: FAIL
