edid-decode (hex):

00 ff ff ff ff ff ff 00 06 af 3c 2e 00 00 00 00
2f 1b 01 04 95 1f 11 78 02 bb f5 94 55 54 90 27
23 50 54 00 00 00 01 01 01 01 01 01 01 01 01 01
01 01 01 01 01 01 7e 1d 56 dc 50 00 18 30 26 16
36 00 35 ad 10 00 00 1a 98 17 56 dc 50 00 18 30
26 16 36 00 35 ad 10 00 00 1a 00 00 00 fe 00 33
56 52 34 4d 80 42 31 34 30 58 54 4e 00 00 00 00
00 00 81 02 a8 00 11 00 00 09 01 0a 20 20 00 c9

----------------

Block 0, Base EDID:
  EDID Structure Version & Revision: 1.4
  Vendor & Product Identification:
    Manufacturer: AUO
    Model: 11836
    Made in: week 47 of 2017
  Basic Display Parameters & Features:
    Digital display
    Bits per primary color channel: 6
    DisplayPort interface
    Maximum image size: 31 cm x 17 cm
    Gamma: 2.20
    Supported color formats: RGB 4:4:4
    First detailed timing includes the native pixel format and preferred refresh rate
  Color Characteristics:
    Red  : 0.5800, 0.3349
    Green: 0.3300, 0.5654
    Blue : 0.1552, 0.1396
    White: 0.3134, 0.3291
  Established Timings I & II: none
  Standard Timings: none
  Detailed Timing Descriptors:
    DTD 1:  1366x768    60.106105 Hz 683:384   47.604 kHz     75.500000 MHz (309 mm x 173 mm)
                 Hfront   38 Hsync  22 Hback  160 Hpol P
                 Vfront    3 Vsync   6 Vback   15 Vpol N
    DTD 2:  1366x768    48.084884 Hz 683:384   38.083 kHz     60.400000 MHz (309 mm x 173 mm)
                 Hfront   38 Hsync  22 Hback  160 Hpol P
                 Vfront    3 Vsync   6 Vback   15 Vpol N
    Alphanumeric Data String: '3VR4M.B140XTN'
    Manufacturer-Specified Display Descriptor (0x00): 00 00 00 00 81 02 a8 00 11 00 00 09 01 0a 20 20 '..............  '
Checksum: 0xc9

----------------

Warnings:

Block 0, Base EDID:
  Alphanumeric Data String: Non-ASCII character 0x80 at position 5, can cause problems.
  Missing Display Product Name.

EDID conformity: PASS
