edid-decode (hex):

00 ff ff ff ff ff ff 00 38 70 49 00 00 00 00 00
14 1d 01 04 a5 1d 11 78 02 eb c6 93 5b 55 8d 27
1a 4e 51 00 00 00 01 01 01 01 01 01 01 01 01 01
01 01 01 01 01 01 2a 36 80 a0 70 38 1f 40 30 20
35 00 26 a5 10 00 00 18 54 2b 80 a0 70 38 1f 40
30 20 35 00 26 a5 10 00 00 18 00 00 00 10 00 00
00 00 00 00 00 00 00 00 00 00 00 00 00 00 00 fe
00 4c 4d 31 33 33 4c 46 39 4c 30 31 0a 20 00 24

00 ff ff ff ff ff ff 00 38 70 49 00 00 00 00 00
14 1d 01 04 a5 1d 11 78 02 eb c6 93 5b 55 8d 27
1a 4e 51 00 00 00 01 01 01 01 01 01 01 01 01 01
01 01 01 01 01 01 2a 36 80 a0 70 38 1f 40 30 20
35 00 26 a5 10 00 00 18 54 2b 80 a0 70 38 1f 40
30 20 35 00 26 a5 10 00 00 18 00 00 00 10 00 00
00 00 00 00 00 00 00 00 00 00 00 00 00 00 00 fe
00 4c 4d 31 33 33 4c 46 39 4c 30 31 0a 20 00 24

----------------

Block 0, Base EDID:
  EDID Structure Version & Revision: 1.4
  Vendor & Product Identification:
    Manufacturer: NCP
    Model: 73
    Made in: week 20 of 2019
  Basic Display Parameters & Features:
    Digital display
    Bits per primary color channel: 8
    DisplayPort interface
    Maximum image size: 29 cm x 17 cm
    Gamma: 2.20
    Supported color formats: RGB 4:4:4
    First detailed timing includes the native pixel format and preferred refresh rate
  Color Characteristics:
    Red  : 0.5771, 0.3574
    Green: 0.3339, 0.5537
    Blue : 0.1552, 0.1015
    White: 0.3056, 0.3183
  Established Timings I & II: none
  Standard Timings: none
  Detailed Timing Descriptors:
    DTD 1:  1920x1080   60.003116 Hz  16:9     66.663 kHz    138.660000 MHz (294 mm x 165 mm)
                 Hfront   48 Hsync  32 Hback   80 Hpol N
                 Vfront    3 Vsync   5 Vback   23 Vpol N
    DTD 2:  1920x1080   47.999031 Hz  16:9     53.327 kHz    110.920000 MHz (294 mm x 165 mm)
                 Hfront   48 Hsync  32 Hback   80 Hpol N
                 Vfront    3 Vsync   5 Vback   23 Vpol N
    Dummy Descriptor:
    Alphanumeric Data String: 'LM133LF9L01'
Checksum: 0x24

----------------

Warnings:

Block 0, Base EDID:
  Missing Display Product Name.

Failures:

EDID:
  Extension Block 1 started with EDID header, ignoring Extension Blocks >= 1.

EDID conformity: FAIL
