edid-decode (hex):

00 ff ff ff ff ff ff 00 09 e5 0f 0b 00 00 00 00
02 20 01 04 a5 1d 12 78 03 21 e0 97 59 57 8f 29
22 50 54 00 00 00 01 01 01 01 01 01 01 01 01 01
01 01 01 01 01 01 74 3c 80 a0 70 b0 28 40 30 20
36 00 1e b3 10 00 00 1a 5d 30 80 a0 70 b0 28 40
30 20 36 00 1e b3 10 00 00 1a 00 00 00 fe 00 47
43 38 4b 56 80 4e 56 31 33 33 57 55 00 00 00 00
00 02 41 33 99 00 00 00 00 0a 01 0a 20 20 00 f7

00 ff ff ff ff ff ff 00 09 e5 0f 0b 00 00 00 00
02 20 01 04 a5 1d 12 78 03 21 e0 97 59 57 8f 29
22 50 54 00 00 00 01 01 01 01 01 01 01 01 01 01
01 01 01 01 01 01 74 3c 80 a0 70 b0 28 40 30 20
36 00 1e b3 10 00 00 1a 5d 30 80 a0 70 b0 28 40
30 20 36 00 1e b3 10 00 00 1a 00 00 00 fe 00 47
43 38 4b 56 80 4e 56 31 33 33 57 55 00 00 00 00
00 02 41 33 99 00 00 00 00 0a 01 0a 20 20 00 f7

----------------

Block 0, Base EDID:
  EDID Structure Version & Revision: 1.4
  Vendor & Product Identification:
    Manufacturer: BOE
    Model: 2831
    Made in: week 2 of 2022
  Basic Display Parameters & Features:
    Digital display
    Bits per primary color channel: 8
    DisplayPort interface
    Maximum image size: 29 cm x 18 cm
    Gamma: 2.20
    Supported color formats: RGB 4:4:4
    First detailed timing includes the native pixel format and preferred refresh rate
    Display supports continuous frequencies
  Color Characteristics:
    Red  : 0.5898, 0.3496
    Green: 0.3398, 0.5595
    Blue : 0.1630, 0.1347
    White: 0.3125, 0.3281
  Established Timings I & II: none
  Standard Timings: none
  Detailed Timing Descriptors:
    DTD 1:  1920x1200   60.003102 Hz  16:10    74.404 kHz    154.760000 MHz (286 mm x 179 mm)
                 Hfront   48 Hsync  32 Hback   80 Hpol P
                 Vfront    3 Vsync   6 Vback   31 Vpol N
    DTD 2:  1920x1200   48.003257 Hz  16:10    59.524 kHz    123.810000 MHz (286 mm x 179 mm)
                 Hfront   48 Hsync  32 Hback   80 Hpol P
                 Vfront    3 Vsync   6 Vback   31 Vpol N
    Alphanumeric Data String: 'GC8KV.NV133WU'
    Manufacturer-Specified Display Descriptor (0x00): 00 00 00 02 41 33 99 00 00 00 00 0a 01 0a 20 20 '....A3........  '
Checksum: 0xf7

----------------

Warnings:

Block 0, Base EDID:
  Alphanumeric Data String: Non-ASCII character 0x80 at position 5, can cause problems.
  Missing Display Product Name.

Failures:

Block 0, Base EDID:
  Missing Display Range Limits Descriptor.
EDID:
  Extension Block 1 started with EDID header, ignoring Extension Blocks >= 1.

EDID conformity: FAIL
