edid-decode (hex):

00 ff ff ff ff ff ff 00 38 a3 05 2b 01 01 01 01
12 18 01 03 08 36 20 78 ea 21 95 a7 56 52 9c 26
10 50 54 bf ef 80 81 00 81 40 81 80 81 c0 95 00
90 40 b3 00 a9 c0 02 3a 80 18 71 38 2d 40 58 2c
45 00 1f 3d 21 00 00 1e 00 00 00 fd 00 37 4c 1f
53 11 00 0a 20 20 20 20 20 20 00 00 00 fc 00 45
32 34 33 57 4d 69 0a 20 20 20 20 20 00 00 00 ff
00 34 35 31 30 36 31 36 38 4e 42 0a 20 20 00 37

00 ff ff ff ff ff ff 00 38 a3 05 2b 01 01 01 01
12 18 01 03 08 36 20 78 ea 21 95 a7 56 52 9c 26
10 50 54 bf ef 80 81 00 81 40 81 80 81 c0 95 00
90 40 b3 00 a9 c0 02 3a 80 18 71 38 2d 40 58 2c
45 00 1f 3d 21 00 00 1e 00 00 00 fd 00 37 4c 1f
53 11 00 0a 20 20 20 20 20 20 00 00 00 fc 00 45
32 34 33 57 4d 69 0a 20 20 20 20 20 00 00 00 ff
00 34 35 31 30 36 31 36 38 4e 42 0a 20 20 00 37

----------------

Block 0, Base EDID:
  EDID Structure Version & Revision: 1.3
  Vendor & Product Identification:
    Manufacturer: NEC
    Model: 11013
    Serial Number: ...
    Made in: week 18 of 2014
  Basic Display Parameters & Features:
    Analog display
    Signal Level Standard: 0.700 : 0.300 : 1.000 V p-p
    Blank level equals black level
    Sync: Separate
    Maximum image size: 54 cm x 32 cm
    Gamma: 2.20
    DPMS levels: Standby Suspend Off
    RGB color display
    First detailed timing is the preferred timing
  Color Characteristics:
    Red  : 0.6523, 0.3378
    Green: 0.3203, 0.6103
    Blue : 0.1503, 0.0634
    White: 0.3134, 0.3291
  Established Timings I & II:
    IBM     :   720x400    70.081663 Hz   9:5     31.467 kHz     28.320000 MHz
    DMT 0x04:   640x480    59.940476 Hz   4:3     31.469 kHz     25.175000 MHz
    Apple   :   640x480    66.666667 Hz   4:3     35.000 kHz     30.240000 MHz
    DMT 0x05:   640x480    72.808802 Hz   4:3     37.861 kHz     31.500000 MHz
    DMT 0x06:   640x480    75.000000 Hz   4:3     37.500 kHz     31.500000 MHz
    DMT 0x08:   800x600    56.250000 Hz   4:3     35.156 kHz     36.000000 MHz
    DMT 0x09:   800x600    60.316541 Hz   4:3     37.879 kHz     40.000000 MHz
    DMT 0x0a:   800x600    72.187572 Hz   4:3     48.077 kHz     50.000000 MHz
    DMT 0x0b:   800x600    75.000000 Hz   4:3     46.875 kHz     49.500000 MHz
    Apple   :   832x624    74.551266 Hz   4:3     49.726 kHz     57.284000 MHz
    DMT 0x10:  1024x768    60.003840 Hz   4:3     48.363 kHz     65.000000 MHz
    DMT 0x11:  1024x768    70.069359 Hz   4:3     56.476 kHz     75.000000 MHz
    DMT 0x12:  1024x768    75.028582 Hz   4:3     60.023 kHz     78.750000 MHz
    DMT 0x24:  1280x1024   75.024675 Hz   5:4     79.976 kHz    135.000000 MHz
    Apple   :  1152x870    75.061550 Hz 192:145   68.681 kHz    100.000000 MHz
  Standard Timings:
    DMT 0x1c:  1280x800    59.810326 Hz  16:10    49.702 kHz     83.500000 MHz
    DMT 0x20:  1280x960    60.000000 Hz   4:3     60.000 kHz    108.000000 MHz
    DMT 0x23:  1280x1024   60.019740 Hz   5:4     63.981 kHz    108.000000 MHz
    DMT 0x55:  1280x720    60.000000 Hz  16:9     45.000 kHz     74.250000 MHz
    DMT 0x2f:  1440x900    59.887445 Hz  16:10    55.935 kHz    106.500000 MHz
    DMT 0x2a:  1400x1050   59.978442 Hz   4:3     65.317 kHz    121.750000 MHz
    DMT 0x3a:  1680x1050   59.954250 Hz  16:10    65.290 kHz    146.250000 MHz
    DMT 0x53:  1600x900    60.000000 Hz  16:9     60.000 kHz    108.000000 MHz (RB)
  Detailed Timing Descriptors:
    DTD 1:  1920x1080   60.000000 Hz  16:9     67.500 kHz    148.500000 MHz (543 mm x 317 mm)
                 Hfront   88 Hsync  44 Hback  148 Hpol P
                 Vfront    4 Vsync   5 Vback   36 Vpol P
    Display Range Limits:
      Monitor ranges (GTF): 55-76 Hz V, 31-83 kHz H, max dotclock 170 MHz
    Display Product Name: 'E243WMi'
    Display Product Serial Number: ...
Checksum: 0x37

----------------

Block 1, Unknown EDID Extension Block 0x00:
  00 ff ff ff ff ff ff 00 38 a3 05 2b 01 01 01 01 '........8..+....'
  12 18 01 03 08 36 20 78 ea 21 95 a7 56 52 9c 26 '.....6 x.!..VR.&'
  10 50 54 bf ef 80 81 00 81 40 81 80 81 c0 95 00 '.PT......@......'
  90 40 b3 00 a9 c0 02 3a 80 18 71 38 2d 40 58 2c '.@.....:..q8-@X,'
  45 00 1f 3d 21 00 00 1e 00 00 00 fd 00 37 4c 1f 'E..=!........7L.'
  53 11 00 0a 20 20 20 20 20 20 00 00 00 fc 00 45 'S...      .....E'
  32 34 33 57 4d 69 0a 20 20 20 20 20 00 00 00 ff '243WMi.     ....'
  00 34 35 31 30 36 31 36 38 4e 42 0a 20 20 00 37 '.45106168NB.  .7'
Checksum: 0x37

----------------

Warnings:

Block 0, Base EDID:
  Vendor & Product Identification: The serial number is one of the known dummy values, it should probably be set to 0.
  Detailed Timing Descriptor #1: Image size is 543x317 mm, but based on the picture AR it should be 543x305 mm.

Failures:

Block 1, Base EDID:
  Unknown Extension Block.
EDID:
  Base EDID: EDID specified 0 extension block(s), but found 1 extension block(s).

EDID conformity: FAIL
