edid-decode (hex):

00 ff ff ff ff ff ff 00 30 ae 58 14 5b d6 00 00
1f 16 01 03 68 29 1a 78 2a 54 e5 a4 58 52 a0 26
0e 50 54 af ef 00 81 80 81 8a 81 c0 95 00 95 0f
71 4f 01 01 01 01 ab 22 a0 a0 50 84 1a 30 30 20
36 00 98 ff 10 00 00 1a 00 00 00 ff 00 30 35 32
39 34 43 33 31 35 34 38 37 35 00 00 00 fd 00 32
4c 1e 51 15 00 0a 20 20 20 20 20 20 00 00 00 fc
00 4c 54 31 39 35 32 20 57 69 64 65 0a 20 00 ec

00 ff ff ff ff ff ff 00 30 ae 58 14 5b d6 00 00
1f 16 01 03 68 29 1a 78 2a 54 e5 a4 58 52 a0 26
0e 50 54 af ef 00 81 80 81 8a 81 c0 95 00 95 0f
71 4f 01 01 01 01 ab 22 a0 a0 50 84 1a 30 30 20
36 00 98 ff 10 00 00 1a 00 00 00 ff 00 30 35 32
39 34 43 33 31 35 34 38 37 35 00 00 00 fd 00 32
4c 1e 51 15 00 0a 20 20 20 20 20 20 00 00 00 fc
00 4c 54 31 39 35 32 20 57 69 64 65 0a 20 00 ec

----------------

Block 0, Base EDID:
  EDID Structure Version & Revision: 1.3
  Vendor & Product Identification:
    Manufacturer: LEN
    Model: 5208
    Serial Number: ...
    Made in: week 31 of 2012
  Basic Display Parameters & Features:
    Analog display
    Signal Level Standard: 0.700 : 0.000 : 0.700 V p-p
    Blank level equals black level
    Sync: Separate
    Maximum image size: 41 cm x 26 cm
    Gamma: 2.20
    DPMS levels: Off
    RGB color display
    First detailed timing is the preferred timing
  Color Characteristics:
    Red  : 0.6416, 0.3447
    Green: 0.3212, 0.6250
    Blue : 0.1513, 0.0566
    White: 0.3134, 0.3291
  Established Timings I & II:
    IBM     :   720x400    70.081663 Hz   9:5     31.467 kHz     28.320000 MHz
    DMT 0x04:   640x480    59.940476 Hz   4:3     31.469 kHz     25.175000 MHz
    DMT 0x05:   640x480    72.808802 Hz   4:3     37.861 kHz     31.500000 MHz
    DMT 0x06:   640x480    75.000000 Hz   4:3     37.500 kHz     31.500000 MHz
    DMT 0x08:   800x600    56.250000 Hz   4:3     35.156 kHz     36.000000 MHz
    DMT 0x09:   800x600    60.316541 Hz   4:3     37.879 kHz     40.000000 MHz
    DMT 0x0a:   800x600    72.187572 Hz   4:3     48.077 kHz     50.000000 MHz
    DMT 0x0b:   800x600    75.000000 Hz   4:3     46.875 kHz     49.500000 MHz
    Apple   :   832x624    74.551266 Hz   4:3     49.726 kHz     57.284000 MHz
    DMT 0x10:  1024x768    60.003840 Hz   4:3     48.363 kHz     65.000000 MHz
    DMT 0x11:  1024x768    70.069359 Hz   4:3     56.476 kHz     75.000000 MHz
    DMT 0x12:  1024x768    75.028582 Hz   4:3     60.023 kHz     78.750000 MHz
    DMT 0x24:  1280x1024   75.024675 Hz   5:4     79.976 kHz    135.000000 MHz
  Standard Timings:
    DMT 0x23:  1280x1024   60.019740 Hz   5:4     63.981 kHz    108.000000 MHz
    GTF     :  1280x1024   69.999805 Hz   5:4     74.620 kHz    128.943000 MHz
    DMT 0x55:  1280x720    60.000000 Hz  16:9     45.000 kHz     74.250000 MHz
    DMT 0x2f:  1440x900    59.887445 Hz  16:10    55.935 kHz    106.500000 MHz
    DMT 0x30:  1440x900    74.984427 Hz  16:10    70.635 kHz    136.750000 MHz
    DMT 0x15:  1152x864    75.000000 Hz   4:3     67.500 kHz    108.000000 MHz
  Detailed Timing Descriptors:
    DTD 1:  1440x900    59.901458 Hz  16:10    55.469 kHz     88.750000 MHz (408 mm x 255 mm)
                 Hfront   48 Hsync  32 Hback   80 Hpol P
                 Vfront    3 Vsync   6 Vback   17 Vpol N
    Display Product Serial Number: ...
    Display Range Limits:
      Monitor ranges (GTF): 50-76 Hz V, 30-81 kHz H, max dotclock 210 MHz
    Display Product Name: 'LT1952 Wide'
Checksum: 0xec

----------------

Failures:

EDID:
  Extension Block 1 started with EDID header, ignoring Extension Blocks >= 1.

EDID conformity: FAIL
