edid-decode (hex):

00 ff ff ff ff ff ff 00 34 74 14 0a 0e 00 00 00
18 1f 01 03 80 a0 5a 78 ea 08 a5 a2 57 4f a2 28
0f 50 54 a5 4b 00 d1 c0 81 80 81 00 8b 00 95 00
b3 00 01 01 01 01 08 e8 00 30 f2 70 5a 80 b0 58
8a 00 6d 55 21 00 00 1e a3 66 00 a0 f0 70 1f 80
30 20 35 00 55 50 21 00 00 1e 00 00 00 fc 00 4a
56 41 31 34 2d 43 61 70 74 75 72 65 00 00 00 fd
00 32 f0 1e de 3c 00 0a 20 20 20 20 20 20 01 6a

02 03 43 f1 58 61 60 5f 5e 5d 10 1f 5a 3f 05 14
04 13 12 11 03 02 01 22 21 20 15 06 07 23 09 07
01 83 01 00 00 67 03 0c 00 10 38 38 3c 67 d8 5d
c4 01 78 80 03 e2 00 cf e3 05 c0 00 e2 0f 03 e3
06 05 01 56 5e 00 a0 a0 a0 29 50 30 20 35 00 55
50 21 00 00 1e 9e e8 00 78 a0 a0 67 50 08 20 98
04 55 50 21 00 00 1e 0c df 80 a0 70 38 40 40 30
40 35 00 20 2f 21 00 00 1e 00 00 00 00 00 00 f3

00 ff ff ff ff ff ff 00 34 74 14 0a 0e 00 00 00
18 1f 01 03 80 a0 5a 78 ea 08 a5 a2 57 4f a2 28
0f 50 54 a5 4b 00 d1 c0 81 80 81 00 8b 00 95 00
b3 00 01 01 01 01 08 e8 00 30 f2 70 5a 80 b0 58
8a 00 6d 55 21 00 00 1e a3 66 00 a0 f0 70 1f 80
30 20 35 00 55 50 21 00 00 1e 00 00 00 fc 00 4a
56 41 31 34 2d 43 61 70 74 75 72 65 00 00 00 fd
00 32 f0 1e de 3c 00 0a 20 20 20 20 20 20 01 6a

02 03 43 f1 58 61 60 5f 5e 5d 10 1f 5a 3f 05 14
04 13 12 11 03 02 01 22 21 20 15 06 07 23 09 07
01 83 01 00 00 67 03 0c 00 10 38 38 3c 67 d8 5d
c4 01 78 80 03 e2 00 cf e3 05 c0 00 e2 0f 03 e3
06 05 01 56 5e 00 a0 a0 a0 29 50 30 20 35 00 55
50 21 00 00 1e 9e e8 00 78 a0 a0 67 50 08 20 98
04 55 50 21 00 00 1e 0c df 80 a0 70 38 40 40 30
40 35 00 20 2f 21 00 00 1e 00 00 00 00 00 00 f3

----------------

Block 0, Base EDID:
  EDID Structure Version & Revision: 1.3
  Vendor & Product Identification:
    Manufacturer: MCT
    Model: 2580
    Serial Number: ...
    Made in: week 24 of 2021
  Basic Display Parameters & Features:
    Digital display
    Maximum image size: 160 cm x 90 cm
    Gamma: 2.20
    DPMS levels: Standby Suspend Off
    RGB color display
    First detailed timing is the preferred timing
  Color Characteristics:
    Red  : 0.6328, 0.3398
    Green: 0.3105, 0.6328
    Blue : 0.1582, 0.0605
    White: 0.3134, 0.3291
  Established Timings I & II:
    IBM     :   720x400    70.081663 Hz   9:5     31.467 kHz     28.320000 MHz
    DMT 0x04:   640x480    59.940476 Hz   4:3     31.469 kHz     25.175000 MHz
    DMT 0x06:   640x480    75.000000 Hz   4:3     37.500 kHz     31.500000 MHz
    DMT 0x09:   800x600    60.316541 Hz   4:3     37.879 kHz     40.000000 MHz
    DMT 0x0b:   800x600    75.000000 Hz   4:3     46.875 kHz     49.500000 MHz
    DMT 0x10:  1024x768    60.003840 Hz   4:3     48.363 kHz     65.000000 MHz
    DMT 0x12:  1024x768    75.028582 Hz   4:3     60.023 kHz     78.750000 MHz
    DMT 0x24:  1280x1024   75.024675 Hz   5:4     79.976 kHz    135.000000 MHz
  Standard Timings:
    DMT 0x52:  1920x1080   60.000000 Hz  16:9     67.500 kHz    148.500000 MHz
    DMT 0x23:  1280x1024   60.019740 Hz   5:4     63.981 kHz    108.000000 MHz
    DMT 0x1c:  1280x800    59.810326 Hz  16:10    49.702 kHz     83.500000 MHz
    GTF     :  1360x850    60.000254 Hz  16:10    52.800 kHz     94.618000 MHz
    DMT 0x2f:  1440x900    59.887445 Hz  16:10    55.935 kHz    106.500000 MHz
    DMT 0x3a:  1680x1050   59.954250 Hz  16:10    65.290 kHz    146.250000 MHz
  Detailed Timing Descriptors:
    DTD 1:  3840x2160   60.000000 Hz  16:9    135.000 kHz    594.000000 MHz (621 mm x 341 mm)
                 Hfront  176 Hsync  88 Hback  296 Hpol P
                 Vfront    8 Vsync  10 Vback   72 Vpol P
    DTD 2:  3840x2160   29.980602 Hz  16:9     65.688 kHz    262.750000 MHz (597 mm x 336 mm)
                 Hfront   48 Hsync  32 Hback   80 Hpol P
                 Vfront    3 Vsync   5 Vback   23 Vpol P
    Display Product Name: 'JVA14-Capture'
    Display Range Limits:
      Monitor ranges (GTF): 50-240 Hz V, 30-222 kHz H, max dotclock 600 MHz
  Extension blocks: 1
Checksum: 0x6a

----------------

Block 1, CTA-861 Extension Block:
  Revision: 3
  Underscans IT Video Formats by default
  Basic audio support
  Supports YCbCr 4:4:4
  Supports YCbCr 4:2:2
  Native DTDs: 1
  Video Data Block:
    VIC  97:  3840x2160   60.000000 Hz  16:9    135.000 kHz    594.000000 MHz
    VIC  96:  3840x2160   50.000000 Hz  16:9    112.500 kHz    594.000000 MHz
    VIC  95:  3840x2160   30.000000 Hz  16:9     67.500 kHz    297.000000 MHz
    VIC  94:  3840x2160   25.000000 Hz  16:9     56.250 kHz    297.000000 MHz
    VIC  93:  3840x2160   24.000000 Hz  16:9     54.000 kHz    297.000000 MHz
    VIC  16:  1920x1080   60.000000 Hz  16:9     67.500 kHz    148.500000 MHz
    VIC  31:  1920x1080   50.000000 Hz  16:9     56.250 kHz    148.500000 MHz
    VIC  90:  2560x1080   60.000000 Hz  64:27    66.000 kHz    198.000000 MHz
    VIC  63:  1920x1080  120.000000 Hz  16:9    135.000 kHz    297.000000 MHz
    VIC   5:  1920x1080i  60.000000 Hz  16:9     33.750 kHz     74.250000 MHz
    VIC  20:  1920x1080i  50.000000 Hz  16:9     28.125 kHz     74.250000 MHz
    VIC   4:  1280x720    60.000000 Hz  16:9     45.000 kHz     74.250000 MHz
    VIC  19:  1280x720    50.000000 Hz  16:9     37.500 kHz     74.250000 MHz
    VIC  18:   720x576    50.000000 Hz  16:9     31.250 kHz     27.000000 MHz
    VIC  17:   720x576    50.000000 Hz   4:3     31.250 kHz     27.000000 MHz
    VIC   3:   720x480    59.940060 Hz  16:9     31.469 kHz     27.000000 MHz
    VIC   2:   720x480    59.940060 Hz   4:3     31.469 kHz     27.000000 MHz
    VIC   1:   640x480    59.940476 Hz   4:3     31.469 kHz     25.175000 MHz
    VIC  34:  1920x1080   30.000000 Hz  16:9     33.750 kHz     74.250000 MHz
    VIC  33:  1920x1080   25.000000 Hz  16:9     28.125 kHz     74.250000 MHz
    VIC  32:  1920x1080   24.000000 Hz  16:9     27.000 kHz     74.250000 MHz
    VIC  21:  1440x576i   50.000000 Hz   4:3     15.625 kHz     27.000000 MHz
    VIC   6:  1440x480i   59.940060 Hz   4:3     15.734 kHz     27.000000 MHz
    VIC   7:  1440x480i   59.940060 Hz  16:9     15.734 kHz     27.000000 MHz
  Audio Data Block:
    Linear PCM:
      Max channels: 2
      Supported sample rates (kHz): 48 44.1 32
      Supported sample sizes (bits): 16
  Speaker Allocation Data Block:
    FL/FR - Front Left/Right
  Vendor-Specific Data Block (HDMI), OUI 00-0C-03:
    Source physical address: 1.0.3.8
    DC_36bit
    DC_30bit
    DC_Y444
    Maximum TMDS clock: 300 MHz
  Vendor-Specific Data Block (HDMI Forum), OUI C4-5D-D8:
    Version: 1
    Maximum TMDS Character Rate: 600 MHz
    SCDC Present
    Supports 12-bits/component Deep Color 4:2:0 Pixel Encoding
    Supports 10-bits/component Deep Color 4:2:0 Pixel Encoding
  Video Capability Data Block:
    YCbCr quantization: Selectable (via AVI YQ)
    RGB quantization: Selectable (via AVI Q)
    PT scan behavior: No Data
    IT scan behavior: Supports both over- and underscan
    CE scan behavior: Supports both over- and underscan
  Colorimetry Data Block:
    BT2020YCC
    BT2020RGB
  YCbCr 4:2:0 Capability Map Data Block:
    VIC  97:  3840x2160   60.000000 Hz  16:9    135.000 kHz    594.000000 MHz
    VIC  96:  3840x2160   50.000000 Hz  16:9    112.500 kHz    594.000000 MHz
  HDR Static Metadata Data Block:
    Electro optical transfer functions:
      Traditional gamma - SDR luminance range
      SMPTE ST2084
    Supported static metadata descriptors:
      Static metadata type 1
  Detailed Timing Descriptors:
    DTD 3:  2560x1440   59.950550 Hz  16:9     88.787 kHz    241.500000 MHz (597 mm x 336 mm)
                 Hfront   48 Hsync  32 Hback   80 Hpol P
                 Vfront    3 Vsync   5 Vback   33 Vpol P
    DTD 4:  2560x1440  144.006152 Hz  16:9    222.201 kHz    595.500000 MHz (597 mm x 336 mm)
                 Hfront    8 Hsync  32 Hback   80 Hpol P
                 Vfront   25 Vsync   8 Vback   70 Vpol P
    DTD 5:  1920x1080  239.964363 Hz  16:9    274.519 kHz    571.000000 MHz (544 mm x 303 mm)
                 Hfront   48 Hsync  64 Hback   48 Hpol P
                 Vfront    3 Vsync   5 Vback   56 Vpol P
Checksum: 0xf3  Unused space in Extension Block: 6 bytes

----------------

Warnings:

Block 1, CTA-861 Extension Block:
  Colorimetry Data Block: Set the sRGB colorimetry bit to avoid interop issues.
EDID:
  Base EDID: Some timings are out of range of the Monitor Ranges:
    Vertical Freq: 24.000 - 239.964 Hz (Monitor: 50.000 - 240.000 Hz)
    Horizontal Freq: 15.625 - 274.519 kHz (Monitor: 30.000 - 222.000 kHz)

Failures:

Block 0, Base EDID:
  Detailed Timing Descriptor #1: Mismatch of image size 621x341 mm vs display size 1600x900 mm.
  Detailed Timing Descriptor #2: Mismatch of image size 597x336 mm vs display size 1600x900 mm.
Block 1, CTA-861 Extension Block:
  Detailed Timing Descriptor #3: Mismatch of image size 597x336 mm vs display size 1600x900 mm.
  Detailed Timing Descriptor #4: Mismatch of image size 597x336 mm vs display size 1600x900 mm.
  Detailed Timing Descriptor #5: Mismatch of image size 544x303 mm vs display size 1600x900 mm.
EDID:
  Extension Block 2 started with EDID header, ignoring Extension Blocks >= 2.

EDID conformity: FAIL
