edid-decode (hex):

00 ff ff ff ff ff ff 00 30 ae 9f 8b 00 00 00 00
21 20 01 04 b5 22 16 78 03 18 d3 ae 51 44 b0 26
0e 50 53 00 00 00 01 01 01 01 01 01 01 01 01 01
01 01 01 01 01 01 f4 a6 80 a0 c0 d0 78 70 6c 30
aa 00 58 d7 10 00 00 18 00 00 00 fd 0c 30 a5 5f
5f 76 01 0a 20 20 20 20 20 20 00 00 00 fe 00 4c
45 4e 4f 56 4f 0a 20 20 20 20 20 20 00 00 00 fe
00 4c 45 4e 31 36 30 2d 33 2e 32 4b 0a 20 01 9a

70 12 79 00 00 03 01 14 1d cb 01 05 7f 0c 9f 00
6b 00 2f 00 cf 07 77 00 09 00 09 00 00 00 00 00
00 00 00 00 00 00 00 00 00 00 00 00 00 00 00 00
00 00 00 00 00 00 00 00 00 00 00 00 00 00 00 00
00 00 00 00 00 00 00 00 00 00 00 00 00 00 00 00
00 00 00 00 00 00 00 00 00 00 00 00 00 00 00 00
00 00 00 00 00 00 00 00 00 00 00 00 00 00 00 00
00 00 00 00 00 00 00 00 00 00 00 00 00 00 4c 90

00 ff ff ff ff ff ff 00 30 ae 9f 8b 00 00 00 00
21 20 01 04 b5 22 16 78 03 18 d3 ae 51 44 b0 26
0e 50 53 00 00 00 01 01 01 01 01 01 01 01 01 01
01 01 01 01 01 01 f4 a6 80 a0 c0 d0 78 70 6c 30
aa 00 58 d7 10 00 00 18 00 00 00 fd 0c 30 a5 5f
5f 76 01 0a 20 20 20 20 20 20 00 00 00 fe 00 4c
45 4e 4f 56 4f 0a 20 20 20 20 20 20 00 00 00 fe
00 4c 45 4e 31 36 30 2d 33 2e 32 4b 0a 20 01 9a

70 12 79 00 00 03 01 14 1d cb 01 05 7f 0c 9f 00
6b 00 2f 00 cf 07 77 00 09 00 09 00 00 00 00 00
00 00 00 00 00 00 00 00 00 00 00 00 00 00 00 00
00 00 00 00 00 00 00 00 00 00 00 00 00 00 00 00
00 00 00 00 00 00 00 00 00 00 00 00 00 00 00 00
00 00 00 00 00 00 00 00 00 00 00 00 00 00 00 00
00 00 00 00 00 00 00 00 00 00 00 00 00 00 00 00
00 00 00 00 00 00 00 00 00 00 00 00 00 00 4c 90

----------------

Block 0, Base EDID:
  EDID Structure Version & Revision: 1.4
  Vendor & Product Identification:
    Manufacturer: LEN
    Model: 35743
    Made in: week 33 of 2022
  Basic Display Parameters & Features:
    Digital display
    Bits per primary color channel: 10
    DisplayPort interface
    Maximum image size: 34 cm x 22 cm
    Gamma: 2.20
    Supported color formats: RGB 4:4:4
    First detailed timing includes the native pixel format and preferred refresh rate
    Display supports continuous frequencies
  Color Characteristics:
    Red  : 0.6796, 0.3173
    Green: 0.2675, 0.6875
    Blue : 0.1513, 0.0556
    White: 0.3125, 0.3271
  Established Timings I & II: none
  Standard Timings: none
  Detailed Timing Descriptors:
    DTD 1:  3200x2000   60.001123 Hz  16:10   127.202 kHz    427.400000 MHz (344 mm x 215 mm)
                 Hfront  108 Hsync  48 Hback    4 Hpol N
                 Vfront   10 Vsync  10 Vback  100 Vpol N
    Display Range Limits:
      Monitor ranges (Range Limits Only): 48-165 Hz V, 350-350 kHz H, max dotclock 1180 MHz
    Alphanumeric Data String: 'LENOVO'
    Alphanumeric Data String: 'LEN160-3.2K'
  Extension blocks: 1
Checksum: 0x9a

----------------

Block 1, DisplayID Extension Block:
  Version: 1.2
  Extension Count: 0
  Display Product Type: Extension Section
  Video Timing Modes Type 1 - Detailed Timings Data Block:
    DTD:  3200x2000  165.001685 Hz  16:10   349.804 kHz   1175.340000 MHz (aspect 16:10, no 3D stereo)
               Hfront  108 Hsync  48 Hback    4 Hpol N
               Vfront   10 Vsync  10 Vback  100 Vpol N
  Checksum: 0x4c
Checksum: 0x90

----------------

Warnings:

Block 0, Base EDID:
  Missing Display Product Name.
EDID:
  Base EDID: Some timings are out of range of the Monitor Ranges:
    Horizontal Freq: 127.202 - 349.803 kHz (Monitor: 350.000 - 350.000 kHz)

Failures:

Block 1, DisplayID Extension Block:
  DisplayID Base Block has no product type.
EDID:
  Extension Block 2 started with EDID header, ignoring Extension Blocks >= 2.
  DisplayID: DisplayID expects at least one preferred timing.

EDID conformity: FAIL
