edid-decode (hex):

00 ff ff ff ff ff ff 00 22 0e 60 40 01 00 00 00
01 1d 01 03 81 35 1e 78 ea 64 b5 ab 52 38 ab 25
13 50 54 00 00 00 01 01 01 01 01 01 01 01 01 01
01 01 01 01 01 01 40 38 80 00 71 38 14 40 60 40
84 00 0f 29 21 00 00 1c 00 00 00 10 00 00 00 00
00 00 00 00 00 00 00 00 00 00 00 00 00 fc 00 48
50 20 41 4c 4c 2d 69 6e 2d 4f 6e 65 00 00 00 ff
00 4c 4d 32 33 38 57 46 35 2d 53 53 4b 32 00 23

00 ff ff ff ff ff ff 00 22 0e 60 40 01 00 00 00
01 1d 01 03 81 35 1e 78 ea 64 b5 ab 52 38 ab 25
13 50 54 00 00 00 01 01 01 01 01 01 01 01 01 01
01 01 01 01 01 01 40 38 80 00 71 38 14 40 60 40
84 00 0f 29 21 00 00 1c 00 00 00 10 00 00 00 00
00 00 00 00 00 00 00 00 00 00 00 00 00 fc 00 48
50 20 41 4c 4c 2d 69 6e 2d 4f 6e 65 00 00 00 ff
00 4c 4d 32 33 38 57 46 35 2d 53 53 4b 32 00 23

----------------

Block 0, Base EDID:
  EDID Structure Version & Revision: 1.3
  Vendor & Product Identification:
    Manufacturer: HPN
    Model: 16480
    Serial Number: ...
    Made in: week 1 of 2019
  Basic Display Parameters & Features:
    Digital display
    DFP 1.x compatible TMDS
    Maximum image size: 53 cm x 30 cm
    Gamma: 2.20
    DPMS levels: Standby Suspend Off
    RGB color display
    First detailed timing is the preferred timing
  Color Characteristics:
    Red  : 0.6689, 0.3222
    Green: 0.2197, 0.6679
    Blue : 0.1464, 0.0771
    White: 0.3134, 0.3291
  Established Timings I & II: none
  Standard Timings: none
  Detailed Timing Descriptors:
    DTD 1:  1920x1080   60.160428 Hz  16:9     66.176 kHz    144.000000 MHz (527 mm x 297 mm)
                 Hfront   96 Hsync  64 Hback   96 Hpol N
                 Vfront    8 Vsync   4 Vback    8 Vpol P
    Dummy Descriptor:
    Display Product Name: 'HP ALL-in-One'
    Display Product Serial Number: ...
Checksum: 0x23

----------------

Block 1, Unknown EDID Extension Block 0x00:
  00 ff ff ff ff ff ff 00 22 0e 60 40 01 00 00 00 '........".`@....'
  01 1d 01 03 81 35 1e 78 ea 64 b5 ab 52 38 ab 25 '.....5.x.d..R8.%'
  13 50 54 00 00 00 01 01 01 01 01 01 01 01 01 01 '.PT.............'
  01 01 01 01 01 01 40 38 80 00 71 38 14 40 60 40 '......@8..q8.@`@'
  84 00 0f 29 21 00 00 1c 00 00 00 10 00 00 00 00 '...)!...........'
  00 00 00 00 00 00 00 00 00 00 00 00 00 fc 00 48 '...............H'
  50 20 41 4c 4c 2d 69 6e 2d 4f 6e 65 00 00 00 ff 'P ALL-in-One....'
  00 4c 4d 32 33 38 57 46 35 2d 53 53 4b 32 00 23 '.LM238WF5-SSK2.#'
Checksum: 0x23

----------------

Warnings:

Block 0, Base EDID:
  Vendor & Product Identification: The serial number is one of the known dummy values, it should probably be set to 0.

Failures:

Block 0, Base EDID:
  Missing Display Range Limits Descriptor.
Block 1, Base EDID:
  Unknown Extension Block.
EDID:
  Base EDID: EDID specified 0 extension block(s), but found 1 extension block(s).

EDID conformity: FAIL
