edid-decode (hex):

00 ff ff ff ff ff ff 00 34 38 29 0a 01 01 01 01
31 11 01 02 80 37 23 78 ea 31 c5 a5 55 48 9c 03
12 50 54 23 08 00 81 80 95 00 b3 00 d1 00 81 40
31 0a a9 40 01 01 28 3c 80 a0 70 b0 23 40 30 20
36 00 26 57 21 00 00 1e 00 00 00 fc 00 6f 2e 64
69 73 70 33 2e 31 5f 32 36 57 00 00 00 fd 00 28
3f 1e 51 11 00 0a 20 20 20 20 20 20 00 00 00 ff
00 37 34 39 41 44 30 31 34 30 30 39 35 39 01 74

00 ff ff ff ff ff ff 00 34 38 29 0a 01 01 01 01
31 11 01 02 80 37 23 78 ea 31 c5 a5 55 48 9c 03
12 50 54 23 08 00 81 80 95 00 b3 00 d1 00 81 40
31 0a a9 40 01 01 28 3c 80 a0 70 b0 23 40 30 20
36 00 26 57 21 00 00 1e 00 00 00 fc 00 6f 2e 64
69 73 70 33 2e 31 5f 32 36 57 00 00 00 fd 00 28
3f 1e 51 11 00 0a 20 20 20 20 20 20 00 00 00 ff
00 37 34 39 41 44 30 31 34 30 30 39 35 39 01 74

00 ff ff ff ff ff ff 00 34 38 29 0a 01 01 01 01
31 11 01 02 80 37 23 78 ea 31 c5 a5 55 48 9c 03
12 50 54 23 08 00 81 80 95 00 b3 00 d1 00 81 40
31 0a a9 40 01 01 28 3c 80 a0 70 b0 23 40 30 20
36 00 26 57 21 00 00 1e 00 00 00 fc 00 6f 2e 64
69 73 70 33 2e 31 5f 32 36 57 00 00 00 fd 00 28
3f 1e 51 11 00 0a 20 20 20 20 20 20 00 00 00 ff
00 37 34 39 41 44 30 31 34 30 30 39 35 39 01 74

00 ff ff ff ff ff ff 00 34 38 29 0a 01 01 01 01
31 11 01 02 80 37 23 78 ea 31 c5 a5 55 48 9c 03
12 50 54 23 08 00 81 80 95 00 b3 00 d1 00 81 40
31 0a a9 40 01 01 28 3c 80 a0 70 b0 23 40 30 20
36 00 26 57 21 00 00 1e 00 00 00 fc 00 6f 2e 64
69 73 70 33 2e 31 5f 32 36 57 00 00 00 fd 00 28
3f 1e 51 11 00 0a 20 20 20 20 20 20 00 00 00 ff
00 37 34 39 41 44 30 31 34 30 30 39 35 39 01 74

----------------

Block 0, Base EDID:
  EDID Structure Version & Revision: 1.2
  Vendor & Product Identification:
    Manufacturer: MAX
    Model: 2601
    Serial Number: ...
    Made in: week 49 of 2007
  Basic Display Parameters & Features:
    Digital display
    Maximum image size: 55 cm x 35 cm
    Gamma: 2.20
    DPMS levels: Standby Suspend Off
    RGB color display
    First detailed timing is the preferred timing
  Color Characteristics:
    Red  : 0.6445, 0.3349
    Green: 0.2812, 0.6103
    Blue : 0.0146, 0.0703
    White: 0.3134, 0.3291
  Established Timings I & II:
    DMT 0x04:   640x480    59.940476 Hz   4:3     31.469 kHz     25.175000 MHz
    DMT 0x08:   800x600    56.250000 Hz   4:3     35.156 kHz     36.000000 MHz
    DMT 0x09:   800x600    60.316541 Hz   4:3     37.879 kHz     40.000000 MHz
    DMT 0x10:  1024x768    60.003840 Hz   4:3     48.363 kHz     65.000000 MHz
  Standard Timings:
    DMT 0x23:  1280x1024   60.019740 Hz   5:4     63.981 kHz    108.000000 MHz
    DMT 0x2f:  1440x900    59.887445 Hz  16:10    55.935 kHz    106.500000 MHz
    DMT 0x3a:  1680x1050   59.954250 Hz  16:10    65.290 kHz    146.250000 MHz
    DMT 0x45:  1920x1200   59.884600 Hz  16:10    74.556 kHz    193.250000 MHz
    DMT 0x20:  1280x960    60.000000 Hz   4:3     60.000 kHz    108.000000 MHz
    GTF     :   640x640    69.999856 Hz   1:1     46.690 kHz     38.846000 MHz
    DMT 0x33:  1600x1200   60.000000 Hz   4:3     75.000 kHz    162.000000 MHz
  Detailed Timing Descriptors:
    DTD 1:  1920x1200   59.950171 Hz  16:10    74.038 kHz    154.000000 MHz (550 mm x 343 mm)
                 Hfront   48 Hsync  32 Hback   80 Hpol P
                 Vfront    3 Vsync   6 Vback   26 Vpol P
    Display Product Name: 'o.disp3.1_26W'
    Display Range Limits:
      Monitor ranges (GTF): 40-63 Hz V, 30-81 kHz H, max dotclock 170 MHz
    Display Product Serial Number: ...
  Extension blocks: 1
Checksum: 0x74

----------------

Warnings:

Block 0, Base EDID:
  EDID Structure Version & Revision: EDID 1.2 is deprecated, do not use.
  Vendor & Product Identification: The serial number is one of the known dummy values, it should probably be set to 0.
  Detailed Timing Descriptor #1: DTD is similar but not identical to DMT 0x44.
EDID:
  Base EDID: Some timings are out of range of the Monitor Ranges:
    Vertical Freq: 56.250 - 70.000 Hz (Monitor: 40.000 - 63.000 Hz)
    Maximum Clock: 193.250 MHz (Monitor: 170.000 MHz)

Failures:

EDID:
  Extension Block 1 started with EDID header, ignoring Extension Blocks >= 1.
  Base EDID: EDID specified 1 extension block(s), but found 0 extension block(s).

EDID conformity: FAIL
