edid-decode (hex):

00 ff ff ff ff ff ff 00 22 f0 1c 28 01 01 01 01
10 13 01 03 80 33 1d 78 ee c9 61 a4 56 4b 9d 25
12 50 54 a1 2b 80 81 40 81 80 81 c0 95 00 a9 40
b3 00 01 01 01 01 02 3a 80 18 71 38 2d 40 58 2c
45 00 fd 1e 11 00 00 1e 00 00 00 fd 00 30 4c 18
53 11 00 0a 20 20 20 20 20 20 00 00 00 fc 00 48
50 20 77 32 33 33 38 68 0a 20 20 20 00 00 00 ff
00 43 4e 43 39 31 36 30 4d 43 42 0a 20 20 01 9b

02 03 1e 71 4a 02 04 85 06 10 11 13 14 15 1f 23
09 07 07 83 01 00 00 66 03 0c 00 10 00 80 01 1d
80 18 71 1c 16 20 58 2c 25 00 fd 1e 11 00 00 9e
01 1d 80 d0 72 1c 16 20 10 2c 25 80 fd 1e 11 00
00 9e 01 1d 00 72 51 d0 1e 20 6e 28 55 00 fd 1e
11 00 00 1e 01 1d 00 bc 52 d0 1e 20 b8 28 55 40
fd 1e 11 00 00 1e 00 00 00 00 00 00 00 00 00 00
00 00 00 00 00 00 00 00 00 00 00 00 00 00 00 6c

00 ff ff ff ff ff ff 00 22 f0 1c 28 01 01 01 01
10 13 01 03 80 33 1d 78 ee c9 61 a4 56 4b 9d 25
12 50 54 a1 2b 80 81 40 81 80 81 c0 95 00 a9 40
b3 00 01 01 01 01 02 3a 80 18 71 38 2d 40 58 2c
45 00 fd 1e 11 00 00 1e 00 00 00 fd 00 30 4c 18
53 11 00 0a 20 20 20 20 20 20 00 00 00 fc 00 48
50 20 77 32 33 33 38 68 0a 20 20 20 00 00 00 ff
00 43 4e 43 39 31 36 30 4d 43 42 0a 20 20 01 9b

02 03 1e 71 4a 02 04 85 06 10 11 13 14 15 1f 23
09 07 07 83 01 00 00 66 03 0c 00 10 00 80 01 1d
80 18 71 1c 16 20 58 2c 25 00 fd 1e 11 00 00 9e
01 1d 80 d0 72 1c 16 20 10 2c 25 80 fd 1e 11 00
00 9e 01 1d 00 72 51 d0 1e 20 6e 28 55 00 fd 1e
11 00 00 1e 01 1d 00 bc 52 d0 1e 20 b8 28 55 40
fd 1e 11 00 00 1e 00 00 00 00 00 00 00 00 00 00
00 00 00 00 00 00 00 00 00 00 00 00 00 00 00 6c

----------------

Block 0, Base EDID:
  EDID Structure Version & Revision: 1.3
  Vendor & Product Identification:
    Manufacturer: HWP
    Model: 10268
    Serial Number: ...
    Made in: week 16 of 2009
  Basic Display Parameters & Features:
    Digital display
    Maximum image size: 51 cm x 29 cm
    Gamma: 2.20
    DPMS levels: Standby Suspend Off
    RGB color display
    Default (sRGB) color space is primary color space
    First detailed timing is the preferred timing
  Color Characteristics:
    Red  : 0.6435, 0.3359
    Green: 0.2949, 0.6142
    Blue : 0.1455, 0.0722
    White: 0.3125, 0.3291
  Established Timings I & II:
    IBM     :   720x400    70.081663 Hz   9:5     31.467 kHz     28.320000 MHz
    DMT 0x04:   640x480    59.940476 Hz   4:3     31.469 kHz     25.175000 MHz
    DMT 0x09:   800x600    60.316541 Hz   4:3     37.879 kHz     40.000000 MHz
    Apple   :   832x624    74.551266 Hz   4:3     49.726 kHz     57.284000 MHz
    DMT 0x10:  1024x768    60.003840 Hz   4:3     48.363 kHz     65.000000 MHz
    DMT 0x12:  1024x768    75.028582 Hz   4:3     60.023 kHz     78.750000 MHz
    DMT 0x24:  1280x1024   75.024675 Hz   5:4     79.976 kHz    135.000000 MHz
    Apple   :  1152x870    75.061550 Hz 192:145   68.681 kHz    100.000000 MHz
  Standard Timings:
    DMT 0x20:  1280x960    60.000000 Hz   4:3     60.000 kHz    108.000000 MHz
    DMT 0x23:  1280x1024   60.019740 Hz   5:4     63.981 kHz    108.000000 MHz
    DMT 0x55:  1280x720    60.000000 Hz  16:9     45.000 kHz     74.250000 MHz
    DMT 0x2f:  1440x900    59.887445 Hz  16:10    55.935 kHz    106.500000 MHz
    DMT 0x33:  1600x1200   60.000000 Hz   4:3     75.000 kHz    162.000000 MHz
    DMT 0x3a:  1680x1050   59.954250 Hz  16:10    65.290 kHz    146.250000 MHz
  Detailed Timing Descriptors:
    DTD 1:  1920x1080   60.000000 Hz  16:9     67.500 kHz    148.500000 MHz (509 mm x 286 mm)
                 Hfront   88 Hsync  44 Hback  148 Hpol P
                 Vfront    4 Vsync   5 Vback   36 Vpol P
    Display Range Limits:
      Monitor ranges (GTF): 48-76 Hz V, 24-83 kHz H, max dotclock 170 MHz
    Display Product Name: 'HP w2338h'
    Display Product Serial Number: ...
  Extension blocks: 1
Checksum: 0x9b

----------------

Block 1, CTA-861 Extension Block:
  Revision: 3
  Basic audio support
  Supports YCbCr 4:4:4
  Supports YCbCr 4:2:2
  Native detailed modes: 1
  Video Data Block:
    VIC   2:   720x480    59.940060 Hz   4:3     31.469 kHz     27.000000 MHz
    VIC   4:  1280x720    60.000000 Hz  16:9     45.000 kHz     74.250000 MHz
    VIC   5:  1920x1080i  60.000000 Hz  16:9     33.750 kHz     74.250000 MHz (native)
    VIC   6:  1440x480i   59.940060 Hz   4:3     15.734 kHz     27.000000 MHz
    VIC  16:  1920x1080   60.000000 Hz  16:9     67.500 kHz    148.500000 MHz
    VIC  17:   720x576    50.000000 Hz   4:3     31.250 kHz     27.000000 MHz
    VIC  19:  1280x720    50.000000 Hz  16:9     37.500 kHz     74.250000 MHz
    VIC  20:  1920x1080i  50.000000 Hz  16:9     28.125 kHz     74.250000 MHz
    VIC  21:  1440x576i   50.000000 Hz   4:3     15.625 kHz     27.000000 MHz
    VIC  31:  1920x1080   50.000000 Hz  16:9     56.250 kHz    148.500000 MHz
  Audio Data Block:
    Linear PCM:
      Max channels: 2
      Supported sample rates (kHz): 48 44.1 32
      Supported sample sizes (bits): 24 20 16
  Speaker Allocation Data Block:
    FL/FR - Front Left/Right
  Vendor-Specific Data Block (HDMI), OUI 00-0C-03:
    Source physical address: 1.0.0.0
    Supports_AI
  Detailed Timing Descriptors:
    DTD 2:  1920x1080i  60.000000 Hz  16:9     33.750 kHz     74.250000 MHz (509 mm x 286 mm)
                 Hfront   88 Hsync  44 Hback  148 Hpol P
                 Vfront    2 Vsync   5 Vback   15 Vpol P Vfront +0.5 Odd Field
                 Vfront    2 Vsync   5 Vback   15 Vpol P Vback  +0.5 Even Field
    DTD 3:  1920x1080i  50.000000 Hz  16:9     28.125 kHz     74.250000 MHz (509 mm x 286 mm)
                 Hfront  528 Hsync  44 Hback  148 Hpol P
                 Vfront    2 Vsync   5 Vback   15 Vpol P Vfront +0.5 Odd Field
                 Vfront    2 Vsync   5 Vback   15 Vpol P Vback  +0.5 Even Field
    DTD 4:  1280x720    60.000000 Hz  16:9     45.000 kHz     74.250000 MHz (509 mm x 286 mm)
                 Hfront  110 Hsync  40 Hback  220 Hpol P
                 Vfront    5 Vsync   5 Vback   20 Vpol P
    DTD 5:  1280x720    50.000000 Hz  16:9     37.500 kHz     74.250000 MHz (509 mm x 286 mm)
                 Hfront  440 Hsync  40 Hback  220 Hpol P
                 Vfront    5 Vsync   5 Vback   20 Vpol P
Checksum: 0x6c  Unused space in Extension Block: 25 bytes

----------------

Block 2, Unknown EDID Extension Block 0x00:
  00 ff ff ff ff ff ff 00 22 f0 1c 28 01 01 01 01 '........"..(....'
  10 13 01 03 80 33 1d 78 ee c9 61 a4 56 4b 9d 25 '.....3.x..a.VK.%'
  12 50 54 a1 2b 80 81 40 81 80 81 c0 95 00 a9 40 '.PT.+..@.......@'
  b3 00 01 01 01 01 02 3a 80 18 71 38 2d 40 58 2c '.......:..q8-@X,'
  45 00 fd 1e 11 00 00 1e 00 00 00 fd 00 30 4c 18 'E............0L.'
  53 11 00 0a 20 20 20 20 20 20 00 00 00 fc 00 48 'S...      .....H'
  50 20 77 32 33 33 38 68 0a 20 20 20 00 00 00 ff 'P w2338h.   ....'
  00 43 4e 43 39 31 36 30 4d 43 42 0a 20 20 01 9b '.CNC9160MCB.  ..'
Checksum: 0x9b

----------------

Block 3, CTA-861 Extension Block:
  Revision: 3
  Basic audio support
  Supports YCbCr 4:4:4
  Supports YCbCr 4:2:2
  Native detailed modes: 1
  Video Data Block:
    VIC   2:   720x480    59.940060 Hz   4:3     31.469 kHz     27.000000 MHz
    VIC   4:  1280x720    60.000000 Hz  16:9     45.000 kHz     74.250000 MHz
    VIC   5:  1920x1080i  60.000000 Hz  16:9     33.750 kHz     74.250000 MHz (native)
    VIC   6:  1440x480i   59.940060 Hz   4:3     15.734 kHz     27.000000 MHz
    VIC  16:  1920x1080   60.000000 Hz  16:9     67.500 kHz    148.500000 MHz
    VIC  17:   720x576    50.000000 Hz   4:3     31.250 kHz     27.000000 MHz
    VIC  19:  1280x720    50.000000 Hz  16:9     37.500 kHz     74.250000 MHz
    VIC  20:  1920x1080i  50.000000 Hz  16:9     28.125 kHz     74.250000 MHz
    VIC  21:  1440x576i   50.000000 Hz   4:3     15.625 kHz     27.000000 MHz
    VIC  31:  1920x1080   50.000000 Hz  16:9     56.250 kHz    148.500000 MHz
  Audio Data Block:
    Linear PCM:
      Max channels: 2
      Supported sample rates (kHz): 48 44.1 32
      Supported sample sizes (bits): 24 20 16
  Speaker Allocation Data Block:
    FL/FR - Front Left/Right
  Vendor-Specific Data Block (HDMI), OUI 00-0C-03:
    Source physical address: 1.0.0.0
    Supports_AI
  Detailed Timing Descriptors:
    DTD 6:  1920x1080i  60.000000 Hz  16:9     33.750 kHz     74.250000 MHz (509 mm x 286 mm)
                 Hfront   88 Hsync  44 Hback  148 Hpol P
                 Vfront    2 Vsync   5 Vback   15 Vpol P Vfront +0.5 Odd Field
                 Vfront    2 Vsync   5 Vback   15 Vpol P Vback  +0.5 Even Field
    DTD 7:  1920x1080i  50.000000 Hz  16:9     28.125 kHz     74.250000 MHz (509 mm x 286 mm)
                 Hfront  528 Hsync  44 Hback  148 Hpol P
                 Vfront    2 Vsync   5 Vback   15 Vpol P Vfront +0.5 Odd Field
                 Vfront    2 Vsync   5 Vback   15 Vpol P Vback  +0.5 Even Field
    DTD 8:  1280x720    60.000000 Hz  16:9     45.000 kHz     74.250000 MHz (509 mm x 286 mm)
                 Hfront  110 Hsync  40 Hback  220 Hpol P
                 Vfront    5 Vsync   5 Vback   20 Vpol P
    DTD 9:  1280x720    50.000000 Hz  16:9     37.500 kHz     74.250000 MHz (509 mm x 286 mm)
                 Hfront  440 Hsync  40 Hback  220 Hpol P
                 Vfront    5 Vsync   5 Vback   20 Vpol P
Checksum: 0x6c  Unused space in Extension Block: 25 bytes

----------------

Warnings:

Block 0, Base EDID:
  Vendor & Product Identification: The serial number is one of the known dummy values, it should probably be set to 0.
Block 1, CTA-861 Extension Block:
  IT Video Formats are overscanned by default, but normally this should be underscanned.
  Video Data Block: VIC 2 and the first DTD are not identical. Is this intended?
  Video Data Block: All VICs are in ascending order, and the first (preferred) VIC <= 4, is that intended?
  Display Product Serial Number is set, so the Serial Number in the Base EDID should be 0.
Block 3, CTA-861 Extension Block:
  IT Video Formats are overscanned by default, but normally this should be underscanned.
  Video Data Block: All VICs are in ascending order, and the first (preferred) VIC <= 4, is that intended?
EDID:
  Base EDID: Some timings are out of range of the Monitor Ranges:
    Horizontal Freq: 15.625 - 79.976 kHz (Monitor: 24.000 - 83.000 kHz)
  CTA-861: Multiple native interlaced timings are defined.

Failures:

Block 0, Base EDID:
  Basic Display Parameters & Features: sRGB is signaled, but the chromaticities do not match.
Block 1, CTA-861 Extension Block:
  Missing VCDB, needed for Set Selectable RGB Quantization to avoid interop issues.
Block 2, Base EDID:
  Unknown Extension Block.
Block 3, CTA-861 Extension Block:
  Video Data Block: Duplicate VIC 2.
  Video Data Block: Duplicate VIC 4.
  Video Data Block: Duplicate VIC 5.
  Video Data Block: Duplicate VIC 6.
  Video Data Block: Duplicate VIC 16.
  Video Data Block: Duplicate VIC 17.
  Video Data Block: Duplicate VIC 19.
  Video Data Block: Duplicate VIC 20.
  Video Data Block: Duplicate VIC 21.
  Video Data Block: Duplicate VIC 31.
  Speaker Allocation Data Block: Only one instance of this Data Block is allowed.
EDID:
  Base EDID: EDID specified 1 extension block(s), but found 3 extension block(s).
  Base EDID: EDID 1.3 requires a Block Map Extension in Block 1 if there are more than 2 blocks in the EDID.

EDID conformity: FAIL
