edid-decode (hex):

00 ff ff ff ff ff ff 00 22 0e 45 35 01 00 00 00
0c 1e 01 03 80 35 1e 78 2a c0 20 a6 56 52 9c 27
0f 50 54 a1 08 00 d1 c0 a9 c0 81 c0 b3 00 95 00
81 00 81 80 01 01 02 3a 80 18 71 38 2d 40 58 2c
45 00 0f 28 21 00 00 1e 00 00 00 fd 00 30 4b 1e
56 12 00 0a 20 20 20 20 20 20 00 00 00 fc 00 48
50 20 32 34 66 0a 20 20 20 20 20 20 00 00 00 ff
00 33 43 4d 30 31 32 31 39 32 44 20 20 20 01 93

02 03 18 f1 49 90 1f 04 13 03 12 01 02 11 20 65
03 0c 00 11 00 e2 00 2b 0f 50 54 a1 08 00 d1 c0
a9 c0 81 c0 b3 00 95 00 81 00 81 80 01 01 02 3a
80 18 71 38 2d 40 58 2c 45 00 0f 28 21 00 00 1e
00 00 00 fd 00 30 4b 1e 56 12 00 0a 20 20 20 20
20 20 00 00 00 fc 00 48 50 20 32 34 66 0a 20 20
20 20 20 20 00 00 00 ff 00 33 43 4d 30 31 32 31
39 32 00 00 00 00 00 00 00 00 00 00 00 00 00 79

00 ff ff ff ff ff ff 00 22 0e 45 35 01 00 00 00
0c 1e 01 03 80 35 1e 78 2a c0 20 a6 56 52 9c 27
0f 50 54 a1 08 00 d1 c0 a9 c0 81 c0 b3 00 95 00
81 00 81 80 01 01 02 3a 80 18 71 38 2d 40 58 2c
45 00 0f 28 21 00 00 1e 00 00 00 fd 00 30 4b 1e
56 12 00 0a 20 20 20 20 20 20 00 00 00 fc 00 48
50 20 32 34 66 0a 20 20 20 20 20 20 00 00 00 ff
00 33 43 4d 30 31 32 31 39 32 44 20 20 20 01 93

02 03 18 f1 49 90 1f 04 13 03 12 01 02 11 20 65
03 0c 00 11 00 e2 00 2b 0f 50 54 a1 08 00 d1 c0
a9 c0 81 c0 b3 00 95 00 81 00 81 80 01 01 02 3a
80 18 71 38 2d 40 58 2c 45 00 0f 28 21 00 00 1e
00 00 00 fd 00 30 4b 1e 56 12 00 0a 20 20 20 20
20 20 00 00 00 fc 00 48 50 20 32 34 66 0a 20 20
20 20 20 20 00 00 00 ff 00 33 43 4d 30 31 32 31
39 32 00 00 00 00 00 00 00 00 00 00 00 00 00 79

----------------

Block 0, Base EDID:
  EDID Structure Version & Revision: 1.3
  Vendor & Product Identification:
    Manufacturer: HPN
    Model: 13637
    Serial Number: ...
    Made in: week 12 of 2020
  Basic Display Parameters & Features:
    Digital display
    Maximum image size: 53 cm x 30 cm
    Gamma: 2.20
    DPMS levels: Off
    RGB color display
    First detailed timing is the preferred timing
  Color Characteristics:
    Red  : 0.6513, 0.3359
    Green: 0.3203, 0.6093
    Blue : 0.1523, 0.0605
    White: 0.3125, 0.3281
  Established Timings I & II:
    IBM     :   720x400    70.081663 Hz   9:5     31.467 kHz     28.320000 MHz
    DMT 0x04:   640x480    59.940476 Hz   4:3     31.469 kHz     25.175000 MHz
    DMT 0x09:   800x600    60.316541 Hz   4:3     37.879 kHz     40.000000 MHz
    DMT 0x10:  1024x768    60.003840 Hz   4:3     48.363 kHz     65.000000 MHz
  Standard Timings:
    DMT 0x52:  1920x1080   60.000000 Hz  16:9     67.500 kHz    148.500000 MHz
    DMT 0x53:  1600x900    60.000000 Hz  16:9     60.000 kHz    108.000000 MHz (RB)
    DMT 0x55:  1280x720    60.000000 Hz  16:9     45.000 kHz     74.250000 MHz
    DMT 0x3a:  1680x1050   59.954250 Hz  16:10    65.290 kHz    146.250000 MHz
    DMT 0x2f:  1440x900    59.887445 Hz  16:10    55.935 kHz    106.500000 MHz
    DMT 0x1c:  1280x800    59.810326 Hz  16:10    49.702 kHz     83.500000 MHz
    DMT 0x23:  1280x1024   60.019740 Hz   5:4     63.981 kHz    108.000000 MHz
  Detailed Timing Descriptors:
    DTD  1:  1920x1080   60.000000 Hz  16:9     67.500 kHz    148.500000 MHz (527 mm x 296 mm)
                  Hfront   88 Hsync  44 Hback  148 Hpol P
                  Vfront    4 Vsync   5 Vback   36 Vpol P
    Display Range Limits:
      Monitor ranges (GTF): 48-75 Hz V, 30-86 kHz H, max dotclock 180 MHz
    Display Product Name: 'HP 24f'
    Display Product Serial Number: ...
  Extension blocks: 1
Checksum: 0x93

----------------

Block 1, CTA-861 Extension Block:
  Revision: 3
  Underscans IT Video Formats by default
  Basic audio support
  Supports YCbCr 4:4:4
  Supports YCbCr 4:2:2
  Native detailed modes: 1
  Video Data Block:
    VIC  16:  1920x1080   60.000000 Hz  16:9     67.500 kHz    148.500000 MHz (native)
    VIC  31:  1920x1080   50.000000 Hz  16:9     56.250 kHz    148.500000 MHz
    VIC   4:  1280x720    60.000000 Hz  16:9     45.000 kHz     74.250000 MHz
    VIC  19:  1280x720    50.000000 Hz  16:9     37.500 kHz     74.250000 MHz
    VIC   3:   720x480    59.940060 Hz  16:9     31.469 kHz     27.000000 MHz
    VIC  18:   720x576    50.000000 Hz  16:9     31.250 kHz     27.000000 MHz
    VIC   1:   640x480    59.940476 Hz   4:3     31.469 kHz     25.175000 MHz
    VIC   2:   720x480    59.940060 Hz   4:3     31.469 kHz     27.000000 MHz
    VIC  17:   720x576    50.000000 Hz   4:3     31.250 kHz     27.000000 MHz
  Audio Data Block:
  Vendor-Specific Data Block (HDMI), OUI 00-0C-03:
    Source physical address: 1.1.0.0
  Video Capability Data Block:
    YCbCr quantization: No Data
    RGB quantization: No Data
    PT scan behavior: Always Underscanned
    IT scan behavior: Always Underscanned
    CE scan behavior: Supports both over- and underscan
  Detailed Timing Descriptors:
    DTD  2:    84x3072   27.241915 Hz   7:256   89.381 kHz    204.950000 MHz (analog composite, sync-on-green, 2483 mm x 1280 mm)
                  Hfront  937 Hsync 192 Hback 1080 Hpol N
                  Vfront    8 Vsync   1 Vback  -58 Vpol N Vborder 129
    DTD  3:     1x314   257.035926 Hz   1:314  640.019 kHz    328.970000 MHz (bipolar analog composite, sync-on-green, field sequential L/R, 1112 mm x 1324 mm)
                  Hfront  369 Hsync  56 Hback   88 Hpol N
                  Vfront    2 Vsync  13 Vback 2131 Vpol N Vborder 15
    Detailed mode: 21 00 00 1e 00 00 00 fd 00 30 4b 1e 56 12 00 0a 20 20 '!........0K.V...  '
    DTD  5:    32x3840  185.908565 Hz   1:120 1285.000 kHz     82.240000 MHz (analog composite, sync-on-green, field sequential L/R, 1586 mm x 1588 mm)
                  Hfront    0 Hsync 584 Hback -572 Hpol N Hborder 10
                  Vfront    5 Vsync   0 Vback 3003 Vpol N Vborder 32
                   20 20 20 20 00 00 00 fc 00 48 50 20 32 34 66 0a 20 20 '    .....HP 24f.  '
    DTD  6:    32x3840  167.317708 Hz   1:120 1285.000 kHz     82.240000 MHz (digital composite, field sequential L/R, 816 mm x 561 mm)
                  Hfront  256 Hsync  51 Hback -373 Hpol P Hborder 49
                  Vfront   52 Vsync  19 Vback 3655 Vborder 57
Checksum: 0x79  Unused space in Extension Block: 13 bytes

----------------

Block 2, Unknown EDID Extension Block 0x00:
  00 ff ff ff ff ff ff 00 22 0e 45 35 01 00 00 00 '........".E5....'
  0c 1e 01 03 80 35 1e 78 2a c0 20 a6 56 52 9c 27 '.....5.x*. .VR.''
  0f 50 54 a1 08 00 d1 c0 a9 c0 81 c0 b3 00 95 00 '.PT.............'
  81 00 81 80 01 01 02 3a 80 18 71 38 2d 40 58 2c '.......:..q8-@X,'
  45 00 0f 28 21 00 00 1e 00 00 00 fd 00 30 4b 1e 'E..(!........0K.'
  56 12 00 0a 20 20 20 20 20 20 00 00 00 fc 00 48 'V...      .....H'
  50 20 32 34 66 0a 20 20 20 20 20 20 00 00 00 ff 'P 24f.      ....'
  00 33 43 4d 30 31 32 31 39 32 44 20 20 20 01 93 '.3CM012192D   ..'
Checksum: 0x93

----------------

Block 3, CTA-861 Extension Block:
  Revision: 3
  Underscans IT Video Formats by default
  Basic audio support
  Supports YCbCr 4:4:4
  Supports YCbCr 4:2:2
  Native detailed modes: 1
  Video Data Block:
    VIC  16:  1920x1080   60.000000 Hz  16:9     67.500 kHz    148.500000 MHz (native)
    VIC  31:  1920x1080   50.000000 Hz  16:9     56.250 kHz    148.500000 MHz
    VIC   4:  1280x720    60.000000 Hz  16:9     45.000 kHz     74.250000 MHz
    VIC  19:  1280x720    50.000000 Hz  16:9     37.500 kHz     74.250000 MHz
    VIC   3:   720x480    59.940060 Hz  16:9     31.469 kHz     27.000000 MHz
    VIC  18:   720x576    50.000000 Hz  16:9     31.250 kHz     27.000000 MHz
    VIC   1:   640x480    59.940476 Hz   4:3     31.469 kHz     25.175000 MHz
    VIC   2:   720x480    59.940060 Hz   4:3     31.469 kHz     27.000000 MHz
    VIC  17:   720x576    50.000000 Hz   4:3     31.250 kHz     27.000000 MHz
  Audio Data Block:
  Vendor-Specific Data Block (HDMI), OUI 00-0C-03:
    Source physical address: 1.1.0.0
  Video Capability Data Block:
    YCbCr quantization: No Data
    RGB quantization: No Data
    PT scan behavior: Always Underscanned
    IT scan behavior: Always Underscanned
    CE scan behavior: Supports both over- and underscan
  Detailed Timing Descriptors:
    DTD  7:    84x3072   27.241915 Hz   7:256   89.381 kHz    204.950000 MHz (analog composite, sync-on-green, 2483 mm x 1280 mm)
                  Hfront  937 Hsync 192 Hback 1080 Hpol N
                  Vfront    8 Vsync   1 Vback  -58 Vpol N Vborder 129
    DTD  8:     1x314   257.035926 Hz   1:314  640.019 kHz    328.970000 MHz (bipolar analog composite, sync-on-green, field sequential L/R, 1112 mm x 1324 mm)
                  Hfront  369 Hsync  56 Hback   88 Hpol N
                  Vfront    2 Vsync  13 Vback 2131 Vpol N Vborder 15
    Detailed mode: 21 00 00 1e 00 00 00 fd 00 30 4b 1e 56 12 00 0a 20 20 '!........0K.V...  '
    DTD 10:    32x3840  185.908565 Hz   1:120 1285.000 kHz     82.240000 MHz (analog composite, sync-on-green, field sequential L/R, 1586 mm x 1588 mm)
                  Hfront    0 Hsync 584 Hback -572 Hpol N Hborder 10
                  Vfront    5 Vsync   0 Vback 3003 Vpol N Vborder 32
                   20 20 20 20 00 00 00 fc 00 48 50 20 32 34 66 0a 20 20 '    .....HP 24f.  '
    DTD 11:    32x3840  167.317708 Hz   1:120 1285.000 kHz     82.240000 MHz (digital composite, field sequential L/R, 816 mm x 561 mm)
                  Hfront  256 Hsync  51 Hback -373 Hpol P Hborder 49
                  Vfront   52 Vsync  19 Vback 3655 Vborder 57
Checksum: 0x79  Unused space in Extension Block: 13 bytes

----------------

Warnings:

Block 0, Base EDID:
  Vendor & Product Identification: The serial number is one of the known dummy values, it should probably be set to 0.
Block 1, CTA-861 Extension Block:
  Video Capability Data Block: Set Selectable YCbCr Quantization to avoid interop issues.
  Detailed Timing Descriptor #2: Image size is 2483x1280 mm, but based on the picture AR it should be 2483x90806 mm.
  Detailed Timing Descriptor #2: The use of non-zero borders in a DTD is not recommended.
  Detailed Timing Descriptor #3: Image size is 1112x1324 mm, but based on the picture AR it should be 1112x349168 mm.
  Detailed Timing Descriptor #3: The use of non-zero borders in a DTD is not recommended.
  Detailed Timing Descriptor #5: Image size is 1586x1588 mm, but based on the picture AR it should be 1586x190320 mm.
  Detailed Timing Descriptor #5: The use of non-zero borders in a DTD is not recommended.
  Detailed Timing Descriptor #6: Image size is 816x561 mm, but based on the picture AR it should be 816x97920 mm.
  Detailed Timing Descriptor #6: The use of non-zero borders in a DTD is not recommended.
  Display Product Serial Number is set, so the Serial Number in the Base EDID should be 0.
  Add a Colorimetry Data Block with the sRGB colorimetry bit set to avoid interop issues.
Block 3, CTA-861 Extension Block:
  Video Capability Data Block: Set Selectable YCbCr Quantization to avoid interop issues.
  Detailed Timing Descriptor #7: Image size is 2483x1280 mm, but based on the picture AR it should be 2483x90806 mm.
  Detailed Timing Descriptor #7: The use of non-zero borders in a DTD is not recommended.
  Detailed Timing Descriptor #8: Image size is 1112x1324 mm, but based on the picture AR it should be 1112x349168 mm.
  Detailed Timing Descriptor #8: The use of non-zero borders in a DTD is not recommended.
  Detailed Timing Descriptor #10: Image size is 1586x1588 mm, but based on the picture AR it should be 1586x190320 mm.
  Detailed Timing Descriptor #10: The use of non-zero borders in a DTD is not recommended.
  Detailed Timing Descriptor #11: Image size is 816x561 mm, but based on the picture AR it should be 816x97920 mm.
  Detailed Timing Descriptor #11: The use of non-zero borders in a DTD is not recommended.
EDID:
  Base EDID: Some timings are out of range of the Monitor Ranges:
    Vertical Freq: 27.242 - 257.036 Hz (Monitor: 48.000 - 75.000 Hz)
    Horizontal Freq: 31.250 - 1285.000 kHz (Monitor: 30.000 - 86.000 kHz)
    Maximum Clock: 328.970 MHz (Monitor: 180.000 MHz)
  CTA-861: Multiple native progressive timings are defined.

Failures:

Block 0, Base EDID:
  Display Product Serial Number: ...
Block 1, CTA-861 Extension Block:
  Audio Data Block: This Data Block is empty.
  Video Capability Data Block: Set Selectable RGB Quantization to avoid interop issues.
  Detailed Timing Descriptor #2: 0 or negative vertical back porch.
  Detailed Timing Descriptor #2: Mismatch of image size 2483x1280 mm vs display size 530x300 mm.
  Detailed Timing Descriptor #3: Mismatch of image size 1112x1324 mm vs display size 530x300 mm.
  Detailed Timing Descriptor #4: Pixelclock < 10 MHz, assuming invalid data 0x21 0x00.
  Detailed Timing Descriptor #5: 0 values in the video timing:
    Horizontal Active/Blanking 32/32
    Horizontal Frontporch/Sync Width 0/584
    Vertical Active/Blanking 3840/3072
    Vertical Frontporch/Sync Width 5/0
  Detailed Timing Descriptor #5: 0 or negative horizontal front porch.
  Detailed Timing Descriptor #5: 0 or negative horizontal back porch.
  Detailed Timing Descriptor #5: Mismatch of image size 1586x1588 mm vs display size 530x300 mm.
  Detailed Timing Descriptor #6: 0 or negative horizontal back porch.
  Detailed Timing Descriptor #6: Mismatch of image size 816x561 mm vs display size 530x300 mm.
Block 2, Base EDID:
  Unknown Extension Block.
Block 3, CTA-861 Extension Block:
  Video Data Block: Duplicate VIC 16.
  Video Data Block: Duplicate VIC 31.
  Video Data Block: Duplicate VIC 4.
  Video Data Block: Duplicate VIC 19.
  Video Data Block: Duplicate VIC 3.
  Video Data Block: Duplicate VIC 18.
  Video Data Block: Duplicate VIC 1.
  Video Data Block: Duplicate VIC 2.
  Video Data Block: Duplicate VIC 17.
  Audio Data Block: This Data Block is empty.
  Video Capability Data Block: Only one instance of this Data Block is allowed.
  Video Capability Data Block: Set Selectable RGB Quantization to avoid interop issues.
  Detailed Timing Descriptor #7: 0 or negative vertical back porch.
  Detailed Timing Descriptor #7: Mismatch of image size 2483x1280 mm vs display size 530x300 mm.
  Detailed Timing Descriptor #8: Mismatch of image size 1112x1324 mm vs display size 530x300 mm.
  Detailed Timing Descriptor #9: Pixelclock < 10 MHz, assuming invalid data 0x21 0x00.
  Detailed Timing Descriptor #10: 0 values in the video timing:
    Horizontal Active/Blanking 32/32
    Horizontal Frontporch/Sync Width 0/584
    Vertical Active/Blanking 3840/3072
    Vertical Frontporch/Sync Width 5/0
  Detailed Timing Descriptor #10: 0 or negative horizontal front porch.
  Detailed Timing Descriptor #10: 0 or negative horizontal back porch.
  Detailed Timing Descriptor #10: Mismatch of image size 1586x1588 mm vs display size 530x300 mm.
  Detailed Timing Descriptor #11: 0 or negative horizontal back porch.
  Detailed Timing Descriptor #11: Mismatch of image size 816x561 mm vs display size 530x300 mm.
EDID:
  Base EDID: The DTD max image size is 2483x1588mm, which is larger than the display size 530.0x300.0mm.
  Base EDID: EDID specified 1 extension block(s), but found 3 extension block(s).
  Base EDID: EDID 1.3 requires a Block Map Extension in Block 1 if there are more than 2 blocks in the EDID.

EDID conformity: FAIL
