edid-decode (hex):

00 ff ff ff ff ff ff 00 05 e3 19 16 01 01 01 01
00 13 01 03 80 22 13 78 22 b3 70 a2 55 48 98 27
15 50 54 bf ee 00 31 0a 61 4c 01 01 01 01 01 01
01 01 01 01 01 01 66 21 56 a8 51 00 1e 30 45 8f
3a 00 58 c2 10 00 00 1c 66 21 50 b0 51 00 1b 30
40 70 36 00 22 13 00 00 00 1e 00 00 00 fd 00 37
4b 1e 3c 08 00 0a 20 20 20 20 20 20 00 00 00 fc
00 31 36 31 39 77 0a 20 20 20 20 20 20 20 01 5c

02 03 1c 71 47 02 11 13 84 1f 10 03 23 09 7f 07
83 01 00 00 67 03 0c 00 10 00 00 28 66 21 50 b0
51 00 1b 30 40 70 36 00 0f 48 42 00 00 1e 66 21
56 aa 51 00 1e 30 46 8f 33 00 0f 48 42 00 00 1e
8c 0a d0 8a 20 e0 2d 10 10 3e 96 00 10 09 00 00
00 18 00 00 00 00 00 00 00 00 00 00 00 00 00 00
00 00 00 00 00 00 00 00 00 00 00 00 00 00 00 00
00 00 00 00 00 00 00 00 00 00 00 00 00 00 00 80

00 ff ff ff ff ff ff 00 05 e3 19 16 01 01 01 01
00 13 01 03 80 22 13 78 22 b3 70 a2 55 48 98 27
15 50 54 bf ee 00 31 0a 61 4c 01 01 01 01 01 01
01 01 01 01 01 01 66 21 56 a8 51 00 1e 30 45 8f
3a 00 58 c2 10 00 00 1c 66 21 50 b0 51 00 1b 30
40 70 36 00 22 13 00 00 00 1e 00 00 00 fd 00 37
4b 1e 3c 08 00 0a 20 20 20 20 20 20 00 00 00 fc
00 31 36 31 39 77 0a 20 20 20 20 20 20 20 01 5c

02 03 1c 71 47 02 11 13 84 1f 10 03 23 09 7f 07
83 01 00 00 67 03 0c 00 10 00 00 28 66 21 50 b0
51 00 1b 30 40 70 36 00 0f 48 42 00 00 1e 66 21
56 aa 51 00 1e 30 46 8f 33 00 0f 48 42 00 00 1e
8c 0a d0 8a 20 e0 2d 10 10 3e 96 00 10 09 00 00
00 18 00 00 00 00 00 00 00 00 00 00 00 00 00 00
00 00 00 00 00 00 00 00 00 00 00 00 00 00 00 00
00 00 00 00 00 00 00 00 00 00 00 00 00 00 00 80

----------------

Block 0, Base EDID:
  EDID Structure Version & Revision: 1.3
  Vendor & Product Identification:
    Manufacturer: AOC
    Model: 5657
    Serial Number: ...
    Made in: 2009
  Basic Display Parameters & Features:
    Digital display
    Maximum image size: 34 cm x 19 cm
    Gamma: 2.20
    DPMS levels: Off
    Monochrome or grayscale display
    First detailed timing is the preferred timing
  Color Characteristics:
    Red  : 0.6347, 0.3349
    Green: 0.2812, 0.5966
    Blue : 0.1533, 0.0849
    White: 0.3125, 0.3281
  Established Timings I & II:
    IBM     :   720x400    70.081663 Hz   9:5     31.467 kHz     28.320000 MHz
    DMT 0x04:   640x480    59.940476 Hz   4:3     31.469 kHz     25.175000 MHz
    Apple   :   640x480    66.666667 Hz   4:3     35.000 kHz     30.240000 MHz
    DMT 0x05:   640x480    72.808802 Hz   4:3     37.861 kHz     31.500000 MHz
    DMT 0x06:   640x480    75.000000 Hz   4:3     37.500 kHz     31.500000 MHz
    DMT 0x08:   800x600    56.250000 Hz   4:3     35.156 kHz     36.000000 MHz
    DMT 0x09:   800x600    60.316541 Hz   4:3     37.879 kHz     40.000000 MHz
    DMT 0x0a:   800x600    72.187572 Hz   4:3     48.077 kHz     50.000000 MHz
    DMT 0x0b:   800x600    75.000000 Hz   4:3     46.875 kHz     49.500000 MHz
    Apple   :   832x624    74.551266 Hz   4:3     49.726 kHz     57.284000 MHz
    DMT 0x10:  1024x768    60.003840 Hz   4:3     48.363 kHz     65.000000 MHz
    DMT 0x11:  1024x768    70.069359 Hz   4:3     56.476 kHz     75.000000 MHz
    DMT 0x12:  1024x768    75.028582 Hz   4:3     60.023 kHz     78.750000 MHz
  Standard Timings:
    GTF     :   640x400    70.000000 Hz  16:10    29.190 kHz     23.352000 MHz
    GTF     :  1024x768    72.000073 Hz   4:3     57.672 kHz     78.434000 MHz
  Detailed Timing Descriptors:
    DTD 1:  1366x768    59.856345 Hz 683:384   47.765 kHz     85.500000 MHz (344 mm x 194 mm)
                 Hfront   69 Hsync 143 Hback  212 Hpol N
                 Vfront    3 Vsync  10 Vback   17 Vpol P
    DTD 2:  1360x768    60.015162 Hz  85:48    47.712 kHz     85.500000 MHz (34 mm x 19 mm)
                 Hfront   64 Hsync 112 Hback  256 Hpol P
                 Vfront    3 Vsync   6 Vback   18 Vpol P
    Display Range Limits:
      Monitor ranges (GTF): 55-75 Hz V, 30-60 kHz H, max dotclock 80 MHz
    Display Product Name: '1619w'
  Extension blocks: 1
Checksum: 0x5c

----------------

Block 1, CTA-861 Extension Block:
  Revision: 3
  Basic audio support
  Supports YCbCr 4:4:4
  Supports YCbCr 4:2:2
  Native DTDs: 1
  Video Data Block:
    VIC   2:   720x480    59.940060 Hz   4:3     31.469 kHz     27.000000 MHz
    VIC  17:   720x576    50.000000 Hz   4:3     31.250 kHz     27.000000 MHz
    VIC  19:  1280x720    50.000000 Hz  16:9     37.500 kHz     74.250000 MHz
    VIC   4:  1280x720    60.000000 Hz  16:9     45.000 kHz     74.250000 MHz (native)
    VIC  31:  1920x1080   50.000000 Hz  16:9     56.250 kHz    148.500000 MHz
    VIC  16:  1920x1080   60.000000 Hz  16:9     67.500 kHz    148.500000 MHz
    VIC   3:   720x480    59.940060 Hz  16:9     31.469 kHz     27.000000 MHz
  Audio Data Block:
    Linear PCM:
      Max channels: 2
      Supported sample rates (kHz): 192 176.4 96 88.2 48 44.1 32
      Supported sample sizes (bits): 24 20 16
  Speaker Allocation Data Block:
    FL/FR - Front Left/Right
  Vendor-Specific Data Block (HDMI), OUI 00-0C-03:
    Source physical address: 1.0.0.0
    Maximum TMDS clock: 200 MHz
  Detailed Timing Descriptors:
    DTD 3:  1360x768    60.015162 Hz  85:48    47.712 kHz     85.500000 MHz (1039 mm x 584 mm)
                 Hfront   64 Hsync 112 Hback  256 Hpol P
                 Vfront    3 Vsync   6 Vback   18 Vpol P
    DTD 4:  1366x768    59.789541 Hz 683:384   47.712 kHz     85.500000 MHz (1039 mm x 584 mm)
                 Hfront   70 Hsync 143 Hback  213 Hpol P
                 Vfront    3 Vsync   3 Vback   24 Vpol P
    DTD 5:   720x480    59.940060 Hz   3:2     31.469 kHz     27.000000 MHz (16 mm x 9 mm)
                 Hfront   16 Hsync  62 Hback   60 Hpol N
                 Vfront    9 Vsync   6 Vback   30 Vpol N
Checksum: 0x80  Unused space in Extension Block: 45 bytes

----------------

Warnings:

Block 0, Base EDID:
  Vendor & Product Identification: The serial number is one of the known dummy values, it should probably be set to 0.
  Detailed Timing Descriptor #2: Dubious image size (34x19 mm is smaller than 100x100 mm).
Block 1, CTA-861 Extension Block:
  IT Video Formats are overscanned by default, but normally this should be underscanned.
  Video Data Block: VIC 2 and the first DTD are not identical. Is this intended?
  Detailed Timing Descriptor #5: Dubious image size (16x9 mm is smaller than 100x100 mm).
  Add a Colorimetry Data Block with the sRGB colorimetry bit set to avoid interop issues.
EDID:
  Base EDID: Some timings are out of range of the Monitor Ranges:
    Vertical Freq: 50.000 - 75.029 Hz (Monitor: 55.000 - 75.000 Hz)
    Horizontal Freq: 29.190 - 67.500 kHz (Monitor: 30.000 - 60.000 kHz)
    Maximum Clock: 148.500 MHz (Monitor: 80.000 MHz)

Failures:

Block 0, Base EDID:
  Detailed Timing Descriptor #2: Mismatch of image size 34x19 mm vs display size 340x190 mm.
Block 1, CTA-861 Extension Block:
  Detailed Timing Descriptor #3: Mismatch of image size 1039x584 mm vs display size 340x190 mm.
  Detailed Timing Descriptor #4: Mismatch of image size 1039x584 mm vs display size 340x190 mm.
  Detailed Timing Descriptor #5: Mismatch of image size 16x9 mm vs display size 340x190 mm.
  Missing VCDB, needed for Set Selectable RGB Quantization to avoid interop issues.
EDID:
  Extension Block 2 started with EDID header, ignoring Extension Blocks >= 2.
  Base EDID: The DTD max image size is 1039x584mm, which is larger than the display size 340.0x190.0mm.
  CTA-861: Native progressive timings are a mix of several resolutions.

EDID conformity: FAIL
