edid-decode (hex):

00 ff ff ff ff ff ff 00 21 63 50 21 00 00 00 00
01 22 01 03 6c 30 1a 78 2a ee 91 a3 54 4c 99 26
0f 50 54 21 08 00 31 c0 45 40 61 40 81 c0 81 80
95 00 d1 c0 a9 80 02 3a 80 18 71 38 2d 40 58 2c
45 00 e0 04 11 00 00 1e 00 00 00 10 00 00 00 00
00 00 00 00 00 00 00 00 00 00 00 00 00 fc 00 4f
6e 65 73 63 72 65 65 6e 0a 20 20 20 00 00 00 fd
00 30 3c 1e 3c 14 00 0a 20 20 20 20 20 20 00 0e

00 ff ff ff ff ff ff 00 21 63 50 21 00 00 00 00
01 22 01 03 6c 30 1a 78 2a ee 91 a3 54 4c 99 26
0f 50 54 21 08 00 31 c0 45 40 61 40 81 c0 81 80
95 00 d1 c0 a9 80 02 3a 80 18 71 38 2d 40 58 2c
45 00 e0 04 11 00 00 1e 00 00 00 10 00 00 00 00
00 00 00 00 00 00 00 00 00 00 00 00 00 fc 00 4f
6e 65 73 63 72 65 65 6e 0a 20 20 20 00 00 00 fd
00 30 3c 1e 3c 14 00 0a 20 20 20 20 20 20 00 0e

----------------

Block 0, Base EDID:
  EDID Structure Version & Revision: 1.3
  Vendor & Product Identification:
    Manufacturer: HKC
    Model: 8528
    Made in: week 1 of 2024
  Basic Display Parameters & Features:
    Analog display
    Signal Level Standard: 0.700 : 0.000 : 0.700 V p-p
    Blank level equals black level
    Sync: Separate Composite
    Maximum image size: 48 cm x 26 cm
    Gamma: 2.20
    DPMS levels: Off
    RGB color display
    First detailed timing is the preferred timing
  Color Characteristics:
    Red  : 0.6396, 0.3300
    Green: 0.2998, 0.5996
    Blue : 0.1503, 0.0595
    White: 0.3125, 0.3291
  Established Timings I & II:
    DMT 0x04:   640x480    59.940476 Hz   4:3     31.469 kHz     25.175000 MHz
    DMT 0x09:   800x600    60.316541 Hz   4:3     37.879 kHz     40.000000 MHz
    DMT 0x10:  1024x768    60.003840 Hz   4:3     48.363 kHz     65.000000 MHz
  Standard Timings:
    GTF     :   640x360    60.000559 Hz  16:9     22.380 kHz     17.188000 MHz
    DMT 0x09:   800x600    60.316541 Hz   4:3     37.879 kHz     40.000000 MHz
    DMT 0x10:  1024x768    60.003840 Hz   4:3     48.363 kHz     65.000000 MHz
    DMT 0x55:  1280x720    60.000000 Hz  16:9     45.000 kHz     74.250000 MHz
    DMT 0x23:  1280x1024   60.019740 Hz   5:4     63.981 kHz    108.000000 MHz
    DMT 0x2f:  1440x900    59.887445 Hz  16:10    55.935 kHz    106.500000 MHz
    DMT 0x52:  1920x1080   60.000000 Hz  16:9     67.500 kHz    148.500000 MHz
    GTF     :  1600x1280   60.000000 Hz   5:4     79.500 kHz    172.992000 MHz
  Detailed Timing Descriptors:
    DTD 1:  1920x1080   60.000000 Hz  16:9     67.500 kHz    148.500000 MHz (480 mm x 260 mm)
                 Hfront   88 Hsync  44 Hback  148 Hpol P
                 Vfront    4 Vsync   5 Vback   36 Vpol P
    Dummy Descriptor:
    Display Product Name: 'Onescreen'
    Display Range Limits:
      Monitor ranges (GTF): 48-60 Hz V, 30-60 kHz H, max dotclock 200 MHz
Checksum: 0x0e

----------------

Warnings:

EDID:
  Base EDID: Some timings are out of range of the Monitor Ranges:
    Horizontal Freq: 22.380 - 79.500 kHz (Monitor: 30.000 - 60.000 kHz)

Failures:

Block 0, Base EDID:
  Basic Display Parameters & Features: The chromaticities match sRGB, but sRGB is not signaled.
  Standard Timings: 0 values in the video timing:
    Horizontal Active/Blanking 640/128
    Horizontal Frontporch/Sync Width 0/64
    Vertical Active/Blanking 360/13
    Vertical Frontporch/Sync Width 1/3
  Standard Timings: 0 or negative horizontal front porch.
EDID:
  Extension Block 1 started with EDID header, ignoring Extension Blocks >= 1.

EDID conformity: FAIL
