edid-decode (hex):

00 ff ff ff ff ff ff 00 09 e5 19 0c 00 00 00 00
0d 21 01 04 b5 22 16 78 03 6a a5 ae 50 45 b0 26
0b 50 54 00 00 00 01 01 01 01 01 01 01 01 01 01
01 01 01 01 01 01 c0 72 00 a0 a0 40 c8 60 30 20
36 00 58 d7 10 00 00 18 00 00 00 fd 0c 30 f0 b1
b1 76 01 0a 20 20 20 20 20 20 00 00 00 fc 00 4e
45 31 36 30 51 44 4d 2d 4e 5a 37 0a 00 00 00 fe
00 42 4f 45 20 43 51 0a 20 20 20 20 20 20 01 7d

70 20 79 02 00 21 00 1d 7a 0d 66 08 00 0a 40 06
80 e5 6a 50 56 64 b0 66 82 0b 02 35 54 00 80 00
80 00 80 13 78 22 00 14 ff ed 11 85 ff 09 9f 00
2f 00 1f 00 3f 06 c7 00 02 00 05 00 2b 00 0c 27
00 3c ef 00 00 27 00 30 3b 00 00 81 00 13 72 1a
00 00 03 01 30 f0 00 00 00 00 00 00 f0 00 00 00
00 00 00 00 00 00 00 00 00 00 00 00 00 00 00 00
00 00 00 00 00 00 00 00 00 00 00 00 00 00 c1 90

00 ff ff ff ff ff ff 00 09 e5 19 0c 00 00 00 00
0d 21 01 04 b5 22 16 78 03 6a a5 ae 50 45 b0 26
0b 50 54 00 00 00 01 01 01 01 01 01 01 01 01 01
01 01 01 01 01 01 c0 72 00 a0 a0 40 c8 60 30 20
36 00 58 d7 10 00 00 18 00 00 00 fd 0c 30 f0 b1
b1 76 01 0a 20 20 20 20 20 20 00 00 00 fc 00 4e
45 31 36 30 51 44 4d 2d 4e 5a 37 0a 00 00 00 fe
00 42 4f 45 20 43 51 0a 20 20 20 20 20 20 01 7d

70 20 79 02 00 21 00 1d 7a 0d 66 08 00 0a 40 06
80 e5 6a 50 56 64 b0 66 82 0b 02 35 54 00 80 00
80 00 80 13 78 22 00 14 ff ed 11 85 ff 09 9f 00
2f 00 1f 00 3f 06 c7 00 02 00 05 00 2b 00 0c 27
00 3c ef 00 00 27 00 30 3b 00 00 81 00 13 72 1a
00 00 03 01 30 f0 00 00 00 00 00 00 f0 00 00 00
00 00 00 00 00 00 00 00 00 00 00 00 00 00 00 00
00 00 00 00 00 00 00 00 00 00 00 00 00 00 c1 90

----------------

Block 0, Base EDID:
  EDID Structure Version & Revision: 1.4
  Vendor & Product Identification:
    Manufacturer: BOE
    Model: 3097
    Made in: week 13 of 2023
  Basic Display Parameters & Features:
    Digital display
    Bits per primary color channel: 10
    DisplayPort interface
    Maximum image size: 34 cm x 22 cm
    Gamma: 2.20
    Supported color formats: RGB 4:4:4
    First detailed timing includes the native pixel format and preferred refresh rate
    Display supports continuous frequencies
  Color Characteristics:
    Red  : 0.6806, 0.3144
    Green: 0.2714, 0.6894
    Blue : 0.1503, 0.0449
    White: 0.3134, 0.3291
  Established Timings I & II: none
  Standard Timings: none
  Detailed Timing Descriptors:
    DTD 1:  2560x1600   60.000000 Hz  16:10   108.000 kHz    293.760000 MHz (344 mm x 215 mm)
                 Hfront   48 Hsync  32 Hback   80 Hpol N
                 Vfront    3 Vsync   6 Vback  191 Vpol N
    Display Range Limits:
      Monitor ranges (Range Limits Only): 48-240 Hz V, 432-432 kHz H, max dotclock 1180 MHz
    Display Product Name: 'NE160QDM-NZ7'
    Alphanumeric Data String: 'BOE CQ'
  Extension blocks: 1
Checksum: 0x7d

----------------

Block 1, DisplayID Extension Block:
  Version: 2.0
  Extension Count: 0
  Display Product Primary Use Case: None of the listed primary use cases; generic display
  Display Parameters Data Block (0x21):
    Image size: 345.0 mm x 215.0 mm
    Display native pixel format: 2560x1600
    Scan Orientation: Left to Right, Top to Bottom
    Luminance Information: Minimum guaranteed value
    Color Information: CIE 1931
    Audio Speaker Information: not integrated
    Native Color Chromaticity:
      Primary #1:  (0.680908, 0.313965)
      Primary #2:  (0.270996, 0.688965)
      Primary #3:  (0.149902, 0.044922)
      White Point: (0.312988, 0.328857)
    Native Maximum Luminance (Full Coverage): do not use
    Native Maximum Luminance (10% Rectangular Coverage): do not use
    Native Minimum Luminance: do not use
    Native Color Depth: 10 bpc
    Display Device Technology: Active Matrix LCD
    Native Gamma EOTF: 2.20
  Video Timing Modes Type 7 - Detailed Timings Data Block:
    DTD:  2560x1600  240.000000 Hz  16:10   432.000 kHz   1175.040000 MHz (aspect 16:10, no 3D stereo, preferred)
               Hfront   48 Hsync  32 Hback   80 Hpol N
               Vfront    3 Vsync   6 Vback  191 Vpol N
  Adaptive Sync Data Block:
    Descriptor #1:
      Native Panel Range
      Fixed Average V-Total and Adaptive V-Total
      Supports Seamless Transition
      'Max Single Frame Duration Increase' field value without jitter impact
      'Max Single Frame Duration Decrease' field value without jitter impact
      Max Duration Increase: 0.00 ms
      Max Duration Decrease: 0.00 ms
      Min Refresh Rate: 60 Hz
      Max Refresh Rate: 240 Hz
    Descriptor #2:
      Native Panel Range
      Fixed Average V-Total and Adaptive V-Total
      Supports Seamless Transition
      'Max Single Frame Duration Increase' field value without jitter impact
      'Max Single Frame Duration Decrease' field value without jitter impact
      Max Duration Increase: 0.00 ms
      Max Duration Decrease: 0.00 ms
      Min Refresh Rate: 48 Hz
      Max Refresh Rate: 60 Hz
  CTA-861 DisplayID Data Block:
  Vendor-Specific Data Block (AMD), OUI 00-00-1A:
    Version: 3
    Feature Caps: 0x01
    Minimum Refresh Rate: 48 Hz
    Maximum Refresh Rate: 240 Hz
    Flags 1.x: 0x00
    Flags 2.x: 0x00
  Checksum: 0xc1
Checksum: 0x90

----------------

Warnings:

EDID:
  Base EDID: Some timings are out of range of the Monitor Ranges:
    Horizontal Freq: 108.000 - 432.000 kHz (Monitor: 432.000 - 432.000 kHz)

Failures:

EDID:
  Extension Block 2 started with EDID header, ignoring Extension Blocks >= 2.

EDID conformity: FAIL
