edid-decode (hex):

00 ff ff ff ff ff ff 00 30 ae 07 00 01 00 00 00
01 19 01 04 a5 3c 22 78 3a 1d f5 ae 4f 35 b3 25
0d 50 54 00 00 00 01 01 01 01 01 01 01 01 01 01
01 01 01 01 01 01 4d d0 00 a0 f0 70 3e 80 30 20
35 00 54 4f 21 00 00 1a 00 00 00 ff 00 4c 45 4e
37 31 35 30 0a 20 20 20 20 20 00 00 00 fc 00 4c
45 4e 2d 42 37 31 35 30 2d 41 0a 20 00 00 00 fd
00 32 4c 1e a0 3c 00 0a 20 20 20 20 20 20 00 ee

00 ff ff ff ff ff ff 00 30 ae 07 00 01 00 00 00
01 19 01 04 a5 3c 22 78 3a 1d f5 ae 4f 35 b3 25
0d 50 54 00 00 00 01 01 01 01 01 01 01 01 01 01
01 01 01 01 01 01 4d d0 00 a0 f0 70 3e 80 30 20
35 00 54 4f 21 00 00 1a 00 00 00 ff 00 4c 45 4e
37 31 35 30 0a 20 20 20 20 20 00 00 00 fc 00 4c
45 4e 2d 42 37 31 35 30 2d 41 0a 20 00 00 00 fd
00 32 4c 1e a0 3c 00 0a 20 20 20 20 20 20 00 ee

----------------

Block 0, Base EDID:
  EDID Structure Version & Revision: 1.4
  Vendor & Product Identification:
    Manufacturer: LEN
    Model: 7
    Serial Number: ...
    Made in: week 1 of 2015
  Basic Display Parameters & Features:
    Digital display
    Bits per primary color channel: 8
    DisplayPort interface
    Maximum image size: 60 cm x 34 cm
    Gamma: 2.20
    DPMS levels: Off
    Supported color formats: RGB 4:4:4, YCrCb 4:4:4, YCrCb 4:2:2
    First detailed timing includes the native pixel format and preferred refresh rate
  Color Characteristics:
    Red  : 0.6796, 0.3095
    Green: 0.2099, 0.7001
    Blue : 0.1474, 0.0537
    White: 0.3134, 0.3291
  Established Timings I & II: none
  Standard Timings: none
  Detailed Timing Descriptors:
    DTD 1:  3840x2160   59.996625 Hz  16:9    133.312 kHz    533.250000 MHz (596 mm x 335 mm)
                 Hfront   48 Hsync  32 Hback   80 Hpol P
                 Vfront    3 Vsync   5 Vback   54 Vpol N
    Display Product Serial Number: ...
    Display Product Name: 'LEN-B7150-A'
    Display Range Limits:
      Monitor ranges (GTF): 50-76 Hz V, 30-160 kHz H, max dotclock 600 MHz
Checksum: 0xee

----------------

Warnings:

Block 0, Base EDID:
  Vendor & Product Identification: The serial number is one of the known dummy values, it should probably be set to 0.
  Display Range Limits: GTF support is deprecated in EDID 1.4.

Failures:

Block 0, Base EDID:
  Display Range Limits: GTF is supported, but the display does not support continuous frequencies.
EDID:
  Extension Block 1 started with EDID header, ignoring Extension Blocks >= 1.

EDID conformity: FAIL
