edid-decode (hex):

00 ff ff ff ff ff ff 00 61 a9 01 27 01 00 00 00
2a 1f 01 04 b5 3c 21 78 3b eb c5 ad 4f 45 af 27
0c 50 54 bf ef 80 d1 c0 b3 00 95 00 81 80 71 4f
81 c0 81 40 a9 c0 56 5e 00 a0 a0 a0 29 50 30 20
35 00 55 4f 21 00 00 1a 00 00 00 fd 00 30 a5 f2
f2 50 01 0a 20 20 20 20 20 20 00 00 00 fc 00 4d
69 20 4d 6f 6e 69 74 6f 72 0a 20 20 00 00 00 ff
00 32 37 35 37 35 30 30 31 30 33 37 30 30 02 3a

02 03 31 f1 4b 1f 01 02 03 04 05 10 11 12 13 14
23 09 07 07 83 01 00 00 e3 05 c2 00 6d 1a 00 00
02 11 30 a5 00 00 00 00 00 00 e6 06 07 01 62 5f
3e f5 bd 00 a0 a0 a0 32 50 20 40 35 00 b9 88 21
00 00 1a 5b 9d 00 a0 a0 a0 29 50 30 20 35 00 b8
88 21 00 00 1a 86 6f 80 a0 70 38 40 40 30 20 35
00 b9 88 21 00 00 1a 98 e2 00 a0 a0 a0 29 50 30
20 35 00 b9 88 21 00 00 1a 00 00 00 00 00 00 b4

00 ff ff ff ff ff ff 00 61 a9 01 27 01 00 00 00
2a 1f 01 04 b5 3c 21 78 3b eb c5 ad 4f 45 af 27
0c 50 54 bf ef 80 d1 c0 b3 00 95 00 81 80 71 4f
81 c0 81 40 a9 c0 56 5e 00 a0 a0 a0 29 50 30 20
35 00 55 4f 21 00 00 1a 00 00 00 fd 00 30 a5 f2
f2 50 01 0a 20 20 20 20 20 20 00 00 00 fc 00 4d
69 20 4d 6f 6e 69 74 6f 72 0a 20 20 00 00 00 ff
00 32 37 35 37 35 30 30 31 30 33 37 30 30 02 3a

00 ff ff ff ff ff ff 00 61 a9 01 27 01 00 00 00
2a 1f 01 04 b5 3c 21 78 3b eb c5 ad 4f 45 af 27
0c 50 54 bf ef 80 d1 c0 b3 00 95 00 81 80 71 4f
81 c0 81 40 a9 c0 56 5e 00 a0 a0 a0 29 50 30 20
35 00 55 4f 21 00 00 1a 00 00 00 fd 00 30 a5 f2
f2 50 01 0a 20 20 20 20 20 20 00 00 00 fc 00 4d
69 20 4d 6f 6e 69 74 6f 72 0a 20 20 00 00 00 ff
00 32 37 35 37 35 30 30 31 30 33 37 30 30 02 3a

02 03 31 f1 4b 1f 01 02 03 04 05 10 11 12 13 14
23 09 07 07 83 01 00 00 e3 05 c2 00 6d 1a 00 00
02 11 30 a5 00 00 00 00 00 00 e6 06 07 01 62 5f
3e f5 bd 00 a0 a0 a0 32 50 20 40 35 00 b9 88 21
00 00 1a 5b 9d 00 a0 a0 a0 29 50 30 20 35 00 b8
88 21 00 00 1a 86 6f 80 a0 70 38 40 40 30 20 35
00 b9 88 21 00 00 1a 98 e2 00 a0 a0 a0 29 50 30
20 35 00 b9 88 21 00 00 1a 00 00 00 00 00 00 b4

00 ff ff ff ff ff ff 00 61 a9 01 27 01 00 00 00
2a 1f 01 04 b5 3c 21 78 3b eb c5 ad 4f 45 af 27
0c 50 54 bf ef 80 d1 c0 b3 00 95 00 81 80 71 4f
81 c0 81 40 a9 c0 56 5e 00 a0 a0 a0 29 50 30 20
35 00 55 4f 21 00 00 1a 00 00 00 fd 00 30 a5 f2
f2 50 01 0a 20 20 20 20 20 20 00 00 00 fc 00 4d
69 20 4d 6f 6e 69 74 6f 72 0a 20 20 00 00 00 ff
00 32 37 35 37 35 30 30 31 30 33 37 30 30 02 3a

----------------

Block 0, Base EDID:
  EDID Structure Version & Revision: 1.4
  Vendor & Product Identification:
    Manufacturer: XMI
    Model: 9985
    Serial Number: ...
    Made in: week 42 of 2021
  Basic Display Parameters & Features:
    Digital display
    Bits per primary color channel: 10
    DisplayPort interface
    Maximum image size: 60 cm x 33 cm
    Gamma: 2.20
    DPMS levels: Off
    Supported color formats: RGB 4:4:4, YCrCb 4:4:4, YCrCb 4:2:2
    First detailed timing includes the native pixel format and preferred refresh rate
    Display supports continuous frequencies
  Color Characteristics:
    Red  : 0.6787, 0.3105
    Green: 0.2714, 0.6865
    Blue : 0.1552, 0.0468
    White: 0.3134, 0.3291
  Established Timings I & II:
    IBM     :   720x400    70.081663 Hz   9:5     31.467 kHz     28.320000 MHz
    DMT 0x04:   640x480    59.940476 Hz   4:3     31.469 kHz     25.175000 MHz
    Apple   :   640x480    66.666667 Hz   4:3     35.000 kHz     30.240000 MHz
    DMT 0x05:   640x480    72.808802 Hz   4:3     37.861 kHz     31.500000 MHz
    DMT 0x06:   640x480    75.000000 Hz   4:3     37.500 kHz     31.500000 MHz
    DMT 0x08:   800x600    56.250000 Hz   4:3     35.156 kHz     36.000000 MHz
    DMT 0x09:   800x600    60.316541 Hz   4:3     37.879 kHz     40.000000 MHz
    DMT 0x0a:   800x600    72.187572 Hz   4:3     48.077 kHz     50.000000 MHz
    DMT 0x0b:   800x600    75.000000 Hz   4:3     46.875 kHz     49.500000 MHz
    Apple   :   832x624    74.551266 Hz   4:3     49.726 kHz     57.284000 MHz
    DMT 0x10:  1024x768    60.003840 Hz   4:3     48.363 kHz     65.000000 MHz
    DMT 0x11:  1024x768    70.069359 Hz   4:3     56.476 kHz     75.000000 MHz
    DMT 0x12:  1024x768    75.028582 Hz   4:3     60.023 kHz     78.750000 MHz
    DMT 0x24:  1280x1024   75.024675 Hz   5:4     79.976 kHz    135.000000 MHz
    Apple   :  1152x870    75.061550 Hz 192:145   68.681 kHz    100.000000 MHz
  Standard Timings:
    DMT 0x52:  1920x1080   60.000000 Hz  16:9     67.500 kHz    148.500000 MHz
    DMT 0x3a:  1680x1050   59.954250 Hz  16:10    65.290 kHz    146.250000 MHz
    DMT 0x2f:  1440x900    59.887445 Hz  16:10    55.935 kHz    106.500000 MHz
    DMT 0x23:  1280x1024   60.019740 Hz   5:4     63.981 kHz    108.000000 MHz
    DMT 0x15:  1152x864    75.000000 Hz   4:3     67.500 kHz    108.000000 MHz
    DMT 0x55:  1280x720    60.000000 Hz  16:9     45.000 kHz     74.250000 MHz
    DMT 0x20:  1280x960    60.000000 Hz   4:3     60.000 kHz    108.000000 MHz
    DMT 0x53:  1600x900    60.000000 Hz  16:9     60.000 kHz    108.000000 MHz (RB)
  Detailed Timing Descriptors:
    DTD 1:  2560x1440   59.950550 Hz  16:9     88.787 kHz    241.500000 MHz (597 mm x 335 mm)
                 Hfront   48 Hsync  32 Hback   80 Hpol P
                 Vfront    3 Vsync   5 Vback   33 Vpol N
    Display Range Limits:
      Monitor ranges (Range Limits Only): 48-165 Hz V, 242-242 kHz H, max dotclock 800 MHz
    Display Product Name: 'Mi Monitor'
    Display Product Serial Number: ...
  Extension blocks: 2
Checksum: 0x3a

----------------

Block 1, CTA-861 Extension Block:
  Revision: 3
  Underscans IT Video Formats by default
  Basic audio support
  Supports YCbCr 4:4:4
  Supports YCbCr 4:2:2
  Native DTDs: 1
  Video Data Block:
    VIC  31:  1920x1080   50.000000 Hz  16:9     56.250 kHz    148.500000 MHz
    VIC   1:   640x480    59.940476 Hz   4:3     31.469 kHz     25.175000 MHz
    VIC   2:   720x480    59.940060 Hz   4:3     31.469 kHz     27.000000 MHz
    VIC   3:   720x480    59.940060 Hz  16:9     31.469 kHz     27.000000 MHz
    VIC   4:  1280x720    60.000000 Hz  16:9     45.000 kHz     74.250000 MHz
    VIC   5:  1920x1080i  60.000000 Hz  16:9     33.750 kHz     74.250000 MHz
    VIC  16:  1920x1080   60.000000 Hz  16:9     67.500 kHz    148.500000 MHz
    VIC  17:   720x576    50.000000 Hz   4:3     31.250 kHz     27.000000 MHz
    VIC  18:   720x576    50.000000 Hz  16:9     31.250 kHz     27.000000 MHz
    VIC  19:  1280x720    50.000000 Hz  16:9     37.500 kHz     74.250000 MHz
    VIC  20:  1920x1080i  50.000000 Hz  16:9     28.125 kHz     74.250000 MHz
  Audio Data Block:
    Linear PCM:
      Max channels: 2
      Supported sample rates (kHz): 48 44.1 32
      Supported sample sizes (bits): 24 20 16
  Speaker Allocation Data Block:
    FL/FR - Front Left/Right
  Colorimetry Data Block:
    xvYCC709
    BT2020YCC
    BT2020RGB
  Vendor-Specific Data Block (AMD), OUI 00-00-1A:
    Version: 2
    Flags 1: 0x11
      FreeSync Supported
    Minimum Refresh Rate: 48 Hz
    Maximum Refresh Rate: 165 Hz
    Flags 5: 0x00
  HDR Static Metadata Data Block:
    Electro optical transfer functions:
      Traditional gamma - SDR luminance range
      Traditional gamma - HDR luminance range
      SMPTE ST2084
    Supported static metadata descriptors:
      Static metadata type 1
    Desired content max luminance: 98 (417.710 cd/m^2)
    Desired content max frame-average luminance: 95 (391.429 cd/m^2)
    Desired content min luminance: 62 (0.247 cd/m^2)
  Detailed Timing Descriptors:
    DTD 2:  2560x1440  119.988650 Hz  16:9    178.783 kHz    486.290000 MHz (697 mm x 392 mm)
                 Hfront   32 Hsync  64 Hback   64 Hpol P
                 Vfront    3 Vsync   5 Vback   42 Vpol N
    DTD 3:  2560x1440   99.999504 Hz  16:9    148.099 kHz    402.830000 MHz (696 mm x 392 mm)
                 Hfront   48 Hsync  32 Hback   80 Hpol P
                 Vfront    3 Vsync   5 Vback   33 Vpol N
    DTD 4:  1920x1080  119.982181 Hz  16:9    137.260 kHz    285.500000 MHz (697 mm x 392 mm)
                 Hfront   48 Hsync  32 Hback   80 Hpol P
                 Vfront    3 Vsync   5 Vback   56 Vpol N
    DTD 5:  2560x1440  144.000477 Hz  16:9    213.265 kHz    580.080000 MHz (697 mm x 392 mm)
                 Hfront   48 Hsync  32 Hback   80 Hpol P
                 Vfront    3 Vsync   5 Vback   33 Vpol N
Checksum: 0xb4  Unused space in Extension Block: 6 bytes

----------------

Warnings:

Block 0, Base EDID:
  Vendor & Product Identification: The serial number is one of the known dummy values, it should probably be set to 0.
Block 1, CTA-861 Extension Block:
  Video Data Block: VIC 31 and the first DTD are not identical. Is this intended?
  Colorimetry Data Block: Set the sRGB colorimetry bit to avoid interop issues.
  Display Product Serial Number is set, so the Serial Number in the Base EDID should be 0.
EDID:
  Base EDID: Some timings are out of range of the Monitor Ranges:
    Horizontal Freq: 28.125 - 213.264 kHz (Monitor: 242.000 - 242.000 kHz)

Failures:

Block 1, CTA-861 Extension Block:
  Detailed Timing Descriptor #2: Mismatch of image size 697x392 mm vs display size 600x330 mm.
  Detailed Timing Descriptor #3: Mismatch of image size 696x392 mm vs display size 600x330 mm.
  Detailed Timing Descriptor #4: Mismatch of image size 697x392 mm vs display size 600x330 mm.
  Detailed Timing Descriptor #5: Mismatch of image size 697x392 mm vs display size 600x330 mm.
  Missing VCDB, needed for Set Selectable RGB Quantization to avoid interop issues.
EDID:
  Extension Block 2 started with EDID header, ignoring Extension Blocks >= 2.
  Base EDID: The DTD max image size is 697x392mm, which is larger than the display size 600.0x330.0mm.
  Base EDID: EDID specified 2 extension block(s), but found 1 extension block(s).

EDID conformity: FAIL
