edid-decode (hex):

00 ff ff ff ff ff ff 00 08 ab 48 44 01 00 00 00
01 16 01 03 78 52 2e 78 ef d4 6c a3 57 49 9c 25
19 48 4b 27 ce 00 81 00 81 0f 81 40 81 80 01 01
8b 00 90 40 a9 40 94 43 80 90 72 38 28 40 48 c8
05 48 10 60 a4 00 00 1c 00 00 00 fd 00 39 3f 41
44 11 00 0a 20 20 20 20 20 20 00 00 00 ff 00 57
55 58 47 41 38 35 41 5f 30 30 30 31 00 00 00 fc
00 42 4b 20 57 55 58 47 41 0a 20 20 20 20 00 db

00 ff ff ff ff ff ff 00 08 ab 48 44 01 00 00 00
01 16 01 03 78 52 2e 78 ef d4 6c a3 57 49 9c 25
19 48 4b 27 ce 00 81 00 81 0f 81 40 81 80 01 01
8b 00 90 40 a9 40 94 43 80 90 72 38 28 40 48 c8
05 48 10 60 a4 00 00 1c 00 00 00 fd 00 39 3f 41
44 11 00 0a 20 20 20 20 20 20 00 00 00 ff 00 57
55 58 47 41 38 35 41 5f 30 30 30 31 00 00 00 fc
00 42 4b 20 57 55 58 47 41 0a 20 20 20 20 00 db

----------------

Block 0, Base EDID:
  EDID Structure Version & Revision: 1.3
  Vendor & Product Identification:
    Manufacturer: BEK
    Model: 17480
    Serial Number: ...
    Made in: week 1 of 2012
  Basic Display Parameters & Features:
    Analog display
    Signal Level Standard: 0.700 : 0.000 : 0.700 V p-p
    Blank-to-black setup/pedestal
    Sync: Separate
    Maximum image size: 82 cm x 46 cm
    Gamma: 2.20
    DPMS levels: Standby Suspend Off
    RGB color display
    Default (sRGB) color space is primary color space
    First detailed timing is the preferred timing
    Supports GTF timings within operating range
  Color Characteristics:
    Red  : 0.6396, 0.3408
    Green: 0.2861, 0.6093
    Blue : 0.1455, 0.0996
    White: 0.2841, 0.2929
  Established Timings I & II:
    DMT 0x04:   640x480    59.940476 Hz   4:3     31.469 kHz     25.175000 MHz
    DMT 0x06:   640x480    75.000000 Hz   4:3     37.500 kHz     31.500000 MHz
    DMT 0x08:   800x600    56.250000 Hz   4:3     35.156 kHz     36.000000 MHz
    DMT 0x09:   800x600    60.316541 Hz   4:3     37.879 kHz     40.000000 MHz
    DMT 0x0a:   800x600    72.187572 Hz   4:3     48.077 kHz     50.000000 MHz
    DMT 0x0b:   800x600    75.000000 Hz   4:3     46.875 kHz     49.500000 MHz
    DMT 0x10:  1024x768    60.003840 Hz   4:3     48.363 kHz     65.000000 MHz
    DMT 0x11:  1024x768    70.069359 Hz   4:3     56.476 kHz     75.000000 MHz
    DMT 0x12:  1024x768    75.028582 Hz   4:3     60.023 kHz     78.750000 MHz
  Standard Timings:
    DMT 0x1c:  1280x800    59.810326 Hz  16:10    49.702 kHz     83.500000 MHz
    DMT 0x1d:  1280x800    74.934142 Hz  16:10    62.795 kHz    106.500000 MHz
    DMT 0x20:  1280x960    60.000000 Hz   4:3     60.000 kHz    108.000000 MHz
    DMT 0x23:  1280x1024   60.019740 Hz   5:4     63.981 kHz    108.000000 MHz
    GTF     :  1360x850    60.000254 Hz  16:10    52.800 kHz     94.618000 MHz
    DMT 0x2a:  1400x1050   59.978442 Hz   4:3     65.317 kHz    121.750000 MHz
    DMT 0x33:  1600x1200   60.000000 Hz   4:3     75.000 kHz    162.000000 MHz
  Detailed Timing Descriptors:
    DTD 1:  1920x1080   59.962844 Hz  16:9     67.158 kHz    173.000000 MHz (2576 mm x 1120 mm)
                 Hfront  328 Hsync 200 Hback  128 Hpol N
                 Vfront   32 Vsync   5 Vback    3 Vpol P
    Display Range Limits:
      Monitor ranges (GTF): 57-63 Hz V, 65-68 kHz H, max dotclock 170 MHz
    Display Product Serial Number: ...
    Display Product Name: 'BK WUXGA'
Checksum: 0xdb

----------------

Block 1, Unknown EDID Extension Block 0x00:
  00 ff ff ff ff ff ff 00 08 ab 48 44 01 00 00 00 '..........HD....'
  01 16 01 03 78 52 2e 78 ef d4 6c a3 57 49 9c 25 '....xR.x..l.WI.%'
  19 48 4b 27 ce 00 81 00 81 0f 81 40 81 80 01 01 '.HK'.......@....'
  8b 00 90 40 a9 40 94 43 80 90 72 38 28 40 48 c8 '...@.@.C..r8(@H.'
  05 48 10 60 a4 00 00 1c 00 00 00 fd 00 39 3f 41 '.H.`.........9?A'
  44 11 00 0a 20 20 20 20 20 20 00 00 00 ff 00 57 'D...      .....W'
  55 58 47 41 38 35 41 5f 30 30 30 31 00 00 00 fc 'UXGA85A_0001....'
  00 42 4b 20 57 55 58 47 41 0a 20 20 20 20 00 db '.BK WUXGA.    ..'
Checksum: 0xdb

----------------

Warnings:

Block 0, Base EDID:
  Vendor & Product Identification: The serial number is one of the known dummy values, it should probably be set to 0.
  Detailed Timing Descriptor #1: Image size is 2576x1120 mm, but based on the picture AR it should be 2576x1449 mm.
EDID:
  Base EDID: Some timings are out of range of the Monitor Ranges:
    Vertical Freq: 56.250 - 75.029 Hz (Monitor: 57.000 - 63.000 Hz)
    Horizontal Freq: 31.468 - 75.000 kHz (Monitor: 65.000 - 68.000 kHz)
    Maximum Clock: 173.000 MHz (Monitor: 170.000 MHz)

Failures:

Block 0, Base EDID:
  Basic Display Parameters & Features: sRGB is signaled, but the chromaticities do not match.
  Detailed Timing Descriptor #1: Mismatch of image size 2576x1120 mm vs display size 820x460 mm.
Block 1, Base EDID:
  Unknown Extension Block.
EDID:
  Base EDID: The DTD max image size is 2576x1120mm, which is larger than the display size 820.0x460.0mm.
  Base EDID: EDID specified 0 extension block(s), but found 1 extension block(s).

EDID conformity: FAIL
