edid-decode (hex):

00 ff ff ff ff ff ff 00 31 d8 00 00 00 00 00 00
05 16 01 03 6d 37 29 78 ea 5e c0 a4 59 4a 98 25
20 50 54 00 00 00 a9 40 01 01 01 01 01 01 01 01
01 01 01 01 01 01 48 3f 40 30 62 b0 32 40 40 c0
13 00 2b a0 21 00 00 1e 00 00 00 ff 00 4c 69 6e
75 78 20 23 30 0a 20 20 20 20 00 00 00 fd 00 3b
3d 4a 4c 11 00 0a 20 20 20 20 20 20 00 00 00 fc
00 4c 69 6e 75 78 20 55 58 47 41 0a 20 20 00 9d

00 ff ff ff ff ff ff 00 31 d8 00 00 00 00 00 00
05 16 01 03 6d 37 29 78 ea 5e c0 a4 59 4a 98 25
20 50 54 00 00 00 a9 40 01 01 01 01 01 01 01 01
01 01 01 01 01 01 48 3f 40 30 62 b0 32 40 40 c0
13 00 2b a0 21 00 00 1e 00 00 00 ff 00 4c 69 6e
75 78 20 23 30 0a 20 20 20 20 00 00 00 fd 00 3b
3d 4a 4c 11 00 0a 20 20 20 20 20 20 00 00 00 fc
00 4c 69 6e 75 78 20 55 58 47 41 0a 20 20 00 9d

----------------

Block 0, Base EDID:
  EDID Structure Version & Revision: 1.3
  Vendor & Product Identification:
    Manufacturer: LNX
    Model: 0
    Made in: week 5 of 2012
  Basic Display Parameters & Features:
    Analog display
    Signal Level Standard: 0.700 : 0.000 : 0.700 V p-p
    Blank level equals black level
    Sync: Separate Composite Serration
    Maximum image size: 55 cm x 41 cm
    Gamma: 2.20
    DPMS levels: Standby Suspend Off
    RGB color display
    First detailed timing is the preferred timing
  Color Characteristics:
    Red  : 0.6416, 0.3486
    Green: 0.2919, 0.5957
    Blue : 0.1474, 0.1250
    White: 0.3125, 0.3281
  Established Timings I & II: none
  Standard Timings:
    DMT 0x33:  1600x1200   60.000000 Hz   4:3     75.000 kHz    162.000000 MHz
  Detailed Timing Descriptors:
    DTD 1:  1600x1200   60.000000 Hz   4:3     75.000 kHz    162.000000 MHz (555 mm x 416 mm)
                 Hfront   64 Hsync 192 Hback  304 Hpol P
                 Vfront    1 Vsync   3 Vback   46 Vpol P
    Display Product Serial Number: ...
    Display Range Limits:
      Monitor ranges (GTF): 59-61 Hz V, 74-76 kHz H, max dotclock 170 MHz
    Display Product Name: 'Linux UXGA'
Checksum: 0x9d

----------------

Failures:

EDID:
  Extension Block 1 started with EDID header, ignoring Extension Blocks >= 1.

EDID conformity: FAIL
