edid-decode (hex):

00 ff ff ff ff ff ff 00 4c 2d 67 78 53 46 58 30
1c 23 01 04 b5 77 22 78 3b 97 dc ac 51 49 a9 27
0d 50 56 25 cf 00 71 4f 81 c0 81 00 81 80 95 00
a9 c0 b3 00 d1 c0 92 d1 00 a0 f0 38 26 40 30 20
3a 00 a9 50 41 00 00 1a 00 00 00 fd 00 30 90 d7
d7 72 01 0a 20 20 20 20 20 20 00 00 00 fc 00 4f
64 79 73 73 65 79 20 47 39 31 46 0a 00 00 00 ff
00 48 4e 54 59 37 30 30 30 35 39 0a 20 20 03 6b

02 03 37 f0 44 10 3f 04 03 23 09 07 07 83 01 00
00 e3 05 c0 00 e6 06 05 01 73 5a 03 e5 01 8b 84
90 59 74 1a 00 00 03 0f 30 90 00 20 73 17 5a 1e
90 00 00 00 00 00 00 6f c2 00 a0 a0 a0 55 50 30
20 35 00 a9 50 41 00 00 1a 56 5e 00 a0 a0 a0 29
50 30 20 35 00 a9 50 41 00 00 1a c9 68 00 a0 f0
38 26 40 30 20 3a 00 a9 50 41 00 00 1a 00 00 00
00 00 00 00 00 00 00 00 00 00 00 00 00 00 00 70

70 12 79 03 00 03 01 64 bf 70 01 88 ff 13 9f 00
2f 80 1f 00 9f 05 31 00 02 00 09 00 5f b8 00 08
ff 13 9f 00 2f 80 1f 00 9f 05 31 00 02 00 09 00
7a ba 01 08 ff 13 9f 00 2f 80 1f 00 9f 05 31 00
02 00 09 00 ed e3 00 04 ff 09 9f 00 2f 80 1f 00
9f 05 31 00 02 00 04 00 76 fb 00 04 ff 0e 9f 00
2f 80 1f 00 37 04 25 00 02 00 09 00 00 00 00 00
00 00 00 00 00 00 00 00 00 00 00 00 00 00 5b 90

70 12 79 00 00 03 01 14 c2 82 00 04 7f 07 9f 00
2f 80 1f 00 37 04 25 00 02 00 09 00 00 00 00 00
00 00 00 00 00 00 00 00 00 00 00 00 00 00 00 00
00 00 00 00 00 00 00 00 00 00 00 00 00 00 00 00
00 00 00 00 00 00 00 00 00 00 00 00 00 00 00 00
00 00 00 00 00 00 00 00 00 00 00 00 00 00 00 00
00 00 00 00 00 00 00 00 00 00 00 00 00 00 00 00
00 00 00 00 00 00 00 00 00 00 00 00 00 00 b7 90

00 ff ff ff ff ff ff 00 4c 2d 67 78 53 46 58 30
1c 23 01 04 b5 77 22 78 3b 97 dc ac 51 49 a9 27
0d 50 56 25 cf 00 71 4f 81 c0 81 00 81 80 95 00
a9 c0 b3 00 d1 c0 92 d1 00 a0 f0 38 26 40 30 20
3a 00 a9 50 41 00 00 1a 00 00 00 fd 00 30 90 d7
d7 72 01 0a 20 20 20 20 20 20 00 00 00 fc 00 4f
64 79 73 73 65 79 20 47 39 31 46 0a 00 00 00 ff
00 48 4e 54 59 37 30 30 30 35 39 0a 20 20 03 6b

02 03 37 f0 44 10 3f 04 03 23 09 07 07 83 01 00
00 e3 05 c0 00 e6 06 05 01 73 5a 03 e5 01 8b 84
90 59 74 1a 00 00 03 0f 30 90 00 20 73 17 5a 1e
90 00 00 00 00 00 00 6f c2 00 a0 a0 a0 55 50 30
20 35 00 a9 50 41 00 00 1a 56 5e 00 a0 a0 a0 29
50 30 20 35 00 a9 50 41 00 00 1a c9 68 00 a0 f0
38 26 40 30 20 3a 00 a9 50 41 00 00 1a 00 00 00
00 00 00 00 00 00 00 00 00 00 00 00 00 00 00 70

70 12 79 03 00 03 01 64 bf 70 01 88 ff 13 9f 00
2f 80 1f 00 9f 05 31 00 02 00 09 00 5f b8 00 08
ff 13 9f 00 2f 80 1f 00 9f 05 31 00 02 00 09 00
7a ba 01 08 ff 13 9f 00 2f 80 1f 00 9f 05 31 00
02 00 09 00 ed e3 00 04 ff 09 9f 00 2f 80 1f 00
9f 05 31 00 02 00 04 00 76 fb 00 04 ff 0e 9f 00
2f 80 1f 00 37 04 25 00 02 00 09 00 00 00 00 00
00 00 00 00 00 00 00 00 00 00 00 00 00 00 5b 90

70 12 79 00 00 03 01 14 c2 82 00 04 7f 07 9f 00
2f 80 1f 00 37 04 25 00 02 00 09 00 00 00 00 00
00 00 00 00 00 00 00 00 00 00 00 00 00 00 00 00
00 00 00 00 00 00 00 00 00 00 00 00 00 00 00 00
00 00 00 00 00 00 00 00 00 00 00 00 00 00 00 00
00 00 00 00 00 00 00 00 00 00 00 00 00 00 00 00
00 00 00 00 00 00 00 00 00 00 00 00 00 00 00 00
00 00 00 00 00 00 00 00 00 00 00 00 00 00 b7 90

----------------

Block 0, Base EDID:
  EDID Structure Version & Revision: 1.4
  Vendor & Product Identification:
    Manufacturer: SAM
    Model: 30823
    Serial Number: ...
    Made in: week 28 of 2025
  Basic Display Parameters & Features:
    Digital display
    Bits per primary color channel: 10
    DisplayPort interface
    Maximum image size: 119 cm x 34 cm
    Gamma: 2.20
    DPMS levels: Off
    Supported color formats: RGB 4:4:4, YCrCb 4:4:4, YCrCb 4:2:2
    First detailed timing includes the native pixel format and preferred refresh rate
    Display supports continuous frequencies
  Color Characteristics:
    Red  : 0.6738, 0.3173
    Green: 0.2861, 0.6630
    Blue : 0.1552, 0.0517
    White: 0.3154, 0.3359
  Established Timings I & II:
    DMT 0x04:   640x480    59.940476 Hz   4:3     31.469 kHz     25.175000 MHz
    DMT 0x06:   640x480    75.000000 Hz   4:3     37.500 kHz     31.500000 MHz
    DMT 0x09:   800x600    60.316541 Hz   4:3     37.879 kHz     40.000000 MHz
    DMT 0x0a:   800x600    72.187572 Hz   4:3     48.077 kHz     50.000000 MHz
    DMT 0x0b:   800x600    75.000000 Hz   4:3     46.875 kHz     49.500000 MHz
    DMT 0x10:  1024x768    60.003840 Hz   4:3     48.363 kHz     65.000000 MHz
    DMT 0x11:  1024x768    70.069359 Hz   4:3     56.476 kHz     75.000000 MHz
    DMT 0x12:  1024x768    75.028582 Hz   4:3     60.023 kHz     78.750000 MHz
    DMT 0x24:  1280x1024   75.024675 Hz   5:4     79.976 kHz    135.000000 MHz
  Standard Timings:
    DMT 0x15:  1152x864    75.000000 Hz   4:3     67.500 kHz    108.000000 MHz
    DMT 0x55:  1280x720    60.000000 Hz  16:9     45.000 kHz     74.250000 MHz
    DMT 0x1c:  1280x800    59.810326 Hz  16:10    49.702 kHz     83.500000 MHz
    DMT 0x23:  1280x1024   60.019740 Hz   5:4     63.981 kHz    108.000000 MHz
    DMT 0x2f:  1440x900    59.887445 Hz  16:10    55.935 kHz    106.500000 MHz
    DMT 0x53:  1600x900    60.000000 Hz  16:9     60.000 kHz    108.000000 MHz (RB)
    DMT 0x3a:  1680x1050   59.954250 Hz  16:10    65.290 kHz    146.250000 MHz
    DMT 0x52:  1920x1080   60.000000 Hz  16:9     67.500 kHz    148.500000 MHz
  Detailed Timing Descriptors:
    DTD 1:  3840x1080  119.968694 Hz  32:9    134.125 kHz    536.500000 MHz (1193 mm x 336 mm)
                 Hfront   48 Hsync  32 Hback   80 Hpol P
                 Vfront    3 Vsync  10 Vback   25 Vpol N
    Display Range Limits:
      Monitor ranges (Range Limits Only): 48-144 Hz V, 215-215 kHz H, max dotclock 1140 MHz
    Display Product Name: 'Odyssey G91F'
    Display Product Serial Number: ...
  Extension blocks: 3
Checksum: 0x6b

----------------

Block 1, CTA-861 Extension Block:
  Revision: 3
  Underscans IT Video Formats by default
  Basic audio support
  Supports YCbCr 4:4:4
  Supports YCbCr 4:2:2
  Native DTDs: 0
  Video Data Block:
    VIC  16:  1920x1080   60.000000 Hz  16:9     67.500 kHz    148.500000 MHz
    VIC  63:  1920x1080  120.000000 Hz  16:9    135.000 kHz    297.000000 MHz
    VIC   4:  1280x720    60.000000 Hz  16:9     45.000 kHz     74.250000 MHz
    VIC   3:   720x480    59.940060 Hz  16:9     31.469 kHz     27.000000 MHz
  Audio Data Block:
    Linear PCM:
      Max channels: 2
      Supported sample rates (kHz): 48 44.1 32
      Supported sample sizes (bits): 24 20 16
  Speaker Allocation Data Block:
    FL/FR - Front Left/Right
  Colorimetry Data Block:
    BT2020YCC
    BT2020RGB
  HDR Static Metadata Data Block:
    Electro optical transfer functions:
      Traditional gamma - SDR luminance range
      SMPTE ST2084
    Supported static metadata descriptors:
      Static metadata type 1
    Desired content max luminance: 115 (603.666 cd/m^2)
    Desired content max frame-average luminance: 90 (351.250 cd/m^2)
    Desired content min luminance: 3 (0.001 cd/m^2)
  Vendor-Specific Video Data Block (HDR10+), OUI 90-84-8B:
    Application Version: 1
    Full Frame Peak Luminance Index: 2
    Peak Luminance Index: 5
  Vendor-Specific Data Block (AMD), OUI 00-00-1A:
    Version: 3
    Feature Caps: 0x0f
      Global Backlight Control Supported
      Local Dimming Supported
    Minimum Refresh Rate: 48 Hz
    Maximum Refresh Rate: 144 Hz
    Flags 1.x: 0x00
    Flags 2.x: 0x20
      ST 2084 (PQ) EOTF Supported
      Linear EOTF (Windows scRGB, 0.0 - 125.0) Supported
      BT.2020 Gamut Supported
      Display is Mini LED
    Maximum luminance: 115 (603.666 cd/m^2)
    Minimum luminance: 23 (0.049 cd/m^2)
    Maximum luminance (without local dimming): 90 (351.250 cd/m^2)
    Minimum luminance (without local dimming): 30 (0.049 cd/m^2)
  Detailed Timing Descriptors:
    DTD 2:  2560x1440  119.997589 Hz  16:9    182.996 kHz    497.750000 MHz (1193 mm x 336 mm)
                 Hfront   48 Hsync  32 Hback   80 Hpol P
                 Vfront    3 Vsync   5 Vback   77 Vpol N
    DTD 3:  2560x1440   59.950550 Hz  16:9     88.787 kHz    241.500000 MHz (1193 mm x 336 mm)
                 Hfront   48 Hsync  32 Hback   80 Hpol P
                 Vfront    3 Vsync   5 Vback   33 Vpol N
    DTD 4:  3840x1080   59.984347 Hz  32:9     67.062 kHz    268.250000 MHz (1193 mm x 336 mm)
                 Hfront   48 Hsync  32 Hback   80 Hpol P
                 Vfront    3 Vsync  10 Vback   25 Vpol N
Checksum: 0x70  Unused space in Extension Block: 18 bytes

----------------

Block 2, DisplayID Extension Block:
  Version: 1.2
  Extension Count: 0
  Display Product Type: Standalone display device
  Video Timing Modes Type 1 - Detailed Timings Data Block:
    DTD:  5120x1440  119.991865 Hz   0:0    178.788 kHz    944.000000 MHz (aspect undefined, no 3D stereo, preferred)
               Hfront   48 Hsync  32 Hback   80 Hpol P
               Vfront    3 Vsync  10 Vback   37 Vpol N
    DTD:  5120x1440   59.995932 Hz   0:0     89.394 kHz    472.000000 MHz (aspect undefined, no 3D stereo)
               Hfront   48 Hsync  32 Hback   80 Hpol P
               Vfront    3 Vsync  10 Vback   37 Vpol N
    DTD:  5120x1440  143.983882 Hz   0:0    214.536 kHz   1132.750000 MHz (aspect undefined, no 3D stereo)
               Hfront   48 Hsync  32 Hback   80 Hpol P
               Vfront    3 Vsync  10 Vback   37 Vpol N
    DTD:  2560x1440  143.974536 Hz  16:9    214.522 kHz    583.500000 MHz (aspect 16:9, no 3D stereo)
               Hfront   48 Hsync  32 Hback   80 Hpol P
               Vfront    3 Vsync   5 Vback   42 Vpol N
    DTD:  3840x1080  143.951252 Hz  16:9    160.938 kHz    643.750000 MHz (aspect 16:9, no 3D stereo)
               Hfront   48 Hsync  32 Hback   80 Hpol P
               Vfront    3 Vsync  10 Vback   25 Vpol N
  Checksum: 0x5b
Checksum: 0x90

----------------

Block 3, DisplayID Extension Block:
  Version: 1.2
  Extension Count: 0
  Video Timing Modes Type 1 - Detailed Timings Data Block:
    DTD:  1920x1080  143.951252 Hz  16:9    160.938 kHz    334.750000 MHz (aspect 16:9, no 3D stereo)
               Hfront   48 Hsync  32 Hback   80 Hpol P
               Vfront    3 Vsync  10 Vback   25 Vpol N
  Checksum: 0xb7
Checksum: 0x90

----------------

Warnings:

Block 1, CTA-861 Extension Block:
  Video Data Block: VIC 16 and the first DTD are not identical. Is this intended?
  Colorimetry Data Block: Set the sRGB colorimetry bit to avoid interop issues.
  Detailed Timing Descriptor #2: Image size is 1193x336 mm, but based on the picture AR it should be 597x336 mm.
  Detailed Timing Descriptor #3: Image size is 1193x336 mm, but based on the picture AR it should be 597x336 mm.
  Display Product Serial Number is set, so the Serial Number in the Base EDID should be 0.
EDID:
  Base EDID: Some timings are out of range of the Monitor Ranges:
    Horizontal Freq: 31.468 - 214.535 kHz (Monitor: 215.000 - 215.000 kHz)

Failures:

Block 1, CTA-861 Extension Block:
  Missing VCDB, needed for Set Selectable RGB Quantization to avoid interop issues.
Block 2, DisplayID Extension Block:
  Expected 0 DisplayID Extension Block, but got 1.
EDID:
  Extension Block 4 started with EDID header, ignoring Extension Blocks >= 4.
  DisplayID: Missing DisplayID Display Parameters Data Block.

EDID conformity: FAIL
