edid-decode (hex):

00 ff ff ff ff ff ff 00 44 93 05 00 00 00 00 00
00 0d 01 03 80 1d 15 78 0a 8c e9 96 53 4e 90 25
1d 50 54 00 00 00 01 01 01 01 01 01 01 01 01 01
01 01 01 01 01 01 64 19 00 40 41 00 26 30 18 88
36 00 1d d6 10 00 00 18 00 00 00 0f 00 04 c0 2e
c0 02 11 11 11 76 c0 12 63 00 00 00 00 fe 00 43
34 30 31 31 02 00 00 00 00 00 00 00 00 00 00 fe
00 d8 c8 b8 a8 90 70 50 00 01 00 0a 20 20 00 2b

----------------

Block 0, Base EDID:
  EDID Structure Version & Revision: 1.3
  Vendor & Product Identification:
    Manufacturer: QDS
    Model: 5
    Made in: 2003
  Basic Display Parameters & Features:
    Digital display
    Maximum image size: 29 cm x 21 cm
    Gamma: 2.20
    RGB color display
    First detailed timing is the preferred timing
  Color Characteristics:
    Red  : 0.5878, 0.3242
    Green: 0.3076, 0.5625
    Blue : 0.1474, 0.1152
    White: 0.3144, 0.3291
  Established Timings I & II: none
  Standard Timings: none
  Detailed Timing Descriptors:
    DTD 1:  1024x768    60.003840 Hz   4:3     48.363 kHz     65.000000 MHz (285 mm x 214 mm)
                 Hfront   24 Hsync 136 Hback  160 Hpol N
                 Vfront    3 Vsync   6 Vback   29 Vpol N
    Manufacturer-Specified Display Descriptor (0x0f): 00 0f 00 04 c0 2e c0 02 11 11 11 76 c0 12 63 00 '...........v..c.'
    Alphanumeric Data String: 'C4011.'
    Alphanumeric Data String: '.....pP'
Checksum: 0x2b

----------------

Warnings:

Block 0, Base EDID:
  Alphanumeric Data String: Non-ASCII character 0x02 at position 5, can cause problems.
  Alphanumeric Data String: Non-ASCII character 0xd8 at position 0, can cause problems.
  Alphanumeric Data String: Non-ASCII character 0xc8 at position 1, can cause problems.
  Alphanumeric Data String: Non-ASCII character 0xb8 at position 2, can cause problems.
  Alphanumeric Data String: Non-ASCII character 0xa8 at position 3, can cause problems.
  Alphanumeric Data String: Non-ASCII character 0x90 at position 4, can cause problems.

Failures:

Block 0, Base EDID:
  Alphanumeric Data String: NUL byte at position 6.
  Alphanumeric Data String: NUL byte at position 7.
  Missing Display Product Name.
  Missing Display Range Limits Descriptor.

EDID conformity: FAIL
