edid-decode (hex):

00 ff ff ff ff ff ff 00 09 e5 da 06 00 00 00 00
13 1a 01 04 a5 28 17 78 02 0e 7e a7 51 35 b6 26
0e 53 54 00 00 00 01 01 01 01 01 01 01 01 01 01
01 01 01 01 01 01 4d d0 00 a0 f0 70 3e 80 30 20
35 00 98 e6 10 00 00 1a e0 8a 00 a0 f0 70 3e 80
30 20 35 00 98 e6 10 00 00 1a 00 00 00 00 00 00
00 00 00 00 00 00 00 00 00 00 00 00 00 00 00 02
00 0c 2d ff 10 3c a6 32 46 3a a6 00 00 00 00 6d

00 ff ff ff ff ff ff 00 09 e5 da 06 00 00 00 00
13 1a 01 04 a5 28 17 78 02 0e 7e a7 51 35 b6 26
0e 53 54 00 00 00 01 01 01 01 01 01 01 01 01 01
01 01 01 01 01 01 4d d0 00 a0 f0 70 3e 80 30 20
35 00 98 e6 10 00 00 1a e0 8a 00 a0 f0 70 3e 80
30 20 35 00 98 e6 10 00 00 1a 00 00 00 00 00 00
00 00 00 00 00 00 00 00 00 00 00 00 00 00 00 02
00 0c 2d ff 10 3c a6 32 46 3a a6 00 00 00 00 6d

----------------

Block 0, Base EDID:
  EDID Structure Version & Revision: 1.4
  Vendor & Product Identification:
    Manufacturer: BOE
    Model: 1754
    Made in: week 19 of 2016
  Basic Display Parameters & Features:
    Digital display
    Bits per primary color channel: 8
    DisplayPort interface
    Maximum image size: 40 cm x 23 cm
    Gamma: 2.20
    Supported color formats: RGB 4:4:4
    First detailed timing includes the native pixel format and preferred refresh rate
  Color Characteristics:
    Red  : 0.6523, 0.3164
    Green: 0.2099, 0.7128
    Blue : 0.1494, 0.0576
    White: 0.3271, 0.3300
  Established Timings I & II: none
  Standard Timings: none
  Detailed Timing Descriptors:
    DTD 1:  3840x2160   59.996625 Hz  16:9    133.312 kHz    533.250000 MHz (408 mm x 230 mm)
                 Hfront   48 Hsync  32 Hback   80 Hpol P
                 Vfront    3 Vsync   5 Vback   54 Vpol N
    DTD 2:  3840x2160   40.000000 Hz  16:9     88.880 kHz    355.520000 MHz (408 mm x 230 mm)
                 Hfront   48 Hsync  32 Hback   80 Hpol P
                 Vfront    3 Vsync   5 Vback   54 Vpol N
    Empty Descriptor
    Manufacturer-Specified Display Descriptor (0x02): 00 02 00 0c 2d ff 10 3c a6 32 46 3a a6 00 00 00 '....-..<.2F:....'
Checksum: 0x6d

----------------

Warnings:

Block 0, Base EDID:
  Missing Display Product Name.

Failures:

Block 0, Base EDID:
  Empty Descriptor: Use Dummy Descriptor instead of all zeroes.
EDID:
  Extension Block 1 started with EDID header, ignoring Extension Blocks >= 1.

EDID conformity: FAIL
