edid-decode (hex):

00 ff ff ff ff ff ff 00 4c a3 4b 54 00 00 00 00
00 14 01 04 90 22 13 78 0a c8 95 9e 57 54 92 26
0f 50 54 00 00 00 01 01 01 01 01 01 01 01 01 01
01 01 01 01 01 01 b5 25 40 82 60 84 1e 30 30 20
25 00 58 c2 10 00 00 1a b4 1d 40 bc 61 84 1e 30
30 20 25 00 58 c2 10 00 00 1a 00 00 00 fe 00 39
56 4d 47 56 80 31 35 36 4b 54 0a 20 00 00 00 00
00 00 41 01 99 00 00 00 00 02 01 0a 20 20 00 33

----------------

Block 0, Base EDID:
  EDID Structure Version & Revision: 1.4
  Vendor & Product Identification:
    Manufacturer: SEC
    Model: 21579
    Made in: 2010
  Basic Display Parameters & Features:
    Digital display
    Bits per primary color channel: 6
    Digital interface is not defined
    Maximum image size: 34 cm x 19 cm
    Gamma: 2.20
    Supported color formats: RGB 4:4:4, YCrCb 4:4:4
    First detailed timing includes the native pixel format and preferred refresh rate
  Color Characteristics:
    Red  : 0.6201, 0.3398
    Green: 0.3300, 0.5703
    Blue : 0.1503, 0.0595
    White: 0.3134, 0.3291
  Established Timings I & II: none
  Standard Timings: none
  Detailed Timing Descriptors:
    DTD 1:  1600x900    59.997514 Hz  16:9     55.798 kHz     96.530000 MHz (344 mm x 194 mm)
                 Hfront   48 Hsync  32 Hback   50 Hpol P
                 Vfront    2 Vsync   5 Vback   23 Vpol N
    DTD 2:  1600x900    40.001683 Hz  16:9     37.202 kHz     76.040000 MHz (344 mm x 194 mm)
                 Hfront   48 Hsync  32 Hback  364 Hpol P
                 Vfront    2 Vsync   5 Vback   23 Vpol N
    Alphanumeric Data String: '9VMGV.156KT'
    Manufacturer-Specified Display Descriptor (0x00): 00 00 00 00 41 01 99 00 00 00 00 02 01 0a 20 20 '....A.........  '
Checksum: 0x33

----------------

Warnings:

Block 0, Base EDID:
  Alphanumeric Data String: Non-ASCII character 0x80 at position 5, can cause problems.
  Missing Display Product Name.

EDID conformity: PASS
