edid-decode (hex):

00 ff ff ff ff ff ff 00 4c a3 4b 54 00 00 00 00
00 14 01 04 90 1e 11 78 0a 4b c5 9c 57 54 8c 27
17 50 54 00 00 00 01 01 01 01 01 01 01 01 01 01
01 01 01 01 01 01 15 2f 40 30 62 84 1e 30 30 20
25 00 36 ae 10 00 00 1a f1 1c 40 88 61 84 1e 30
30 20 25 00 36 ae 10 00 00 1a 00 00 00 fe 00 36
48 48 38 32 80 31 34 30 4b 54 0a 20 00 00 00 00
00 00 41 01 98 00 00 00 00 02 01 0a 20 20 00 20

----------------

Block 0, Base EDID:
  EDID Structure Version & Revision: 1.4
  Vendor & Product Identification:
    Manufacturer: SEC
    Model: 21579
    Made in: 2010
  Basic Display Parameters & Features:
    Digital display
    Bits per primary color channel: 6
    Digital interface is not defined
    Maximum image size: 30 cm x 17 cm
    Gamma: 2.20
    Supported color formats: RGB 4:4:4, YCrCb 4:4:4
    First detailed timing includes the native pixel format and preferred refresh rate
  Color Characteristics:
    Red  : 0.6103, 0.3398
    Green: 0.3300, 0.5498
    Blue : 0.1552, 0.0898
    White: 0.3134, 0.3291
  Established Timings I & II: none
  Standard Timings: none
  Detailed Timing Descriptors:
    DTD 1:  1600x900    60.000996 Hz  16:9     55.801 kHz    120.530000 MHz (310 mm x 174 mm)
                 Hfront   48 Hsync  32 Hback  480 Hpol P
                 Vfront    2 Vsync   5 Vback   23 Vpol N
    DTD 2:  1600x900    39.993307 Hz  16:9     37.194 kHz     74.090000 MHz (310 mm x 174 mm)
                 Hfront   48 Hsync  32 Hback  312 Hpol P
                 Vfront    2 Vsync   5 Vback   23 Vpol N
    Alphanumeric Data String: '6HH82.140KT'
    Manufacturer-Specified Display Descriptor (0x00): 00 00 00 00 41 01 98 00 00 00 00 02 01 0a 20 20 '....A.........  '
Checksum: 0x20

----------------

Warnings:

Block 0, Base EDID:
  Alphanumeric Data String: Non-ASCII character 0x80 at position 5, can cause problems.
  Missing Display Product Name.

Failures:

Block 0, Base EDID:
  Detailed Timing Descriptor #1: Mismatch of image size 310x174 mm vs display size 300x170 mm.
  Detailed Timing Descriptor #2: Mismatch of image size 310x174 mm vs display size 300x170 mm.
EDID:
  Base EDID: The DTD max image size is 310x174mm, which is larger than the display size 300.0x170.0mm.

EDID conformity: FAIL
