edid-decode (hex):

00 ff ff ff ff ff ff 00 4c a3 4b 54 00 00 00 00
00 15 01 04 90 22 13 78 0a 5d 35 9d 5f 58 9f 26
18 50 54 00 00 00 01 01 01 01 01 01 01 01 01 01
01 01 01 01 01 01 de 32 40 10 62 84 78 30 30 20
25 00 58 c2 10 00 00 1a 3b 2f 40 58 62 84 da 31
30 20 25 00 58 c2 10 00 00 1a 00 00 00 fe 00 4e
32 47 59 37 80 31 35 36 4b 54 0a 20 00 00 00 00
00 00 41 21 99 00 00 00 00 02 01 0a 20 20 00 cb

----------------

Block 0, Base EDID:
  EDID Structure Version & Revision: 1.4
  Vendor & Product Identification:
    Manufacturer: SEC
    Model: 21579
    Made in: 2011
  Basic Display Parameters & Features:
    Digital display
    Bits per primary color channel: 6
    Digital interface is not defined
    Maximum image size: 34 cm x 19 cm
    Gamma: 2.20
    Supported color formats: RGB 4:4:4, YCrCb 4:4:4
    First detailed timing includes the native pixel format and preferred refresh rate
  Color Characteristics:
    Red  : 0.6142, 0.3720
    Green: 0.3466, 0.6220
    Blue : 0.1484, 0.0966
    White: 0.3134, 0.3291
  Established Timings I & II: none
  Standard Timings: none
  Detailed Timing Descriptors:
    DTD 1:  1600x900    59.993734 Hz  16:9     61.194 kHz    130.220000 MHz (344 mm x 194 mm)
                 Hfront   48 Hsync  32 Hback  448 Hpol P
                 Vfront    2 Vsync   5 Vback  113 Vpol N
    DTD 2:  1600x900    39.999338 Hz  16:9     54.959 kHz    120.910000 MHz (344 mm x 194 mm)
                 Hfront   48 Hsync  32 Hback  520 Hpol P
                 Vfront    2 Vsync   5 Vback  467 Vpol N
    Alphanumeric Data String: 'N2GY7.156KT'
    Manufacturer-Specified Display Descriptor (0x00): 00 00 00 00 41 21 99 00 00 00 00 02 01 0a 20 20 '....A!........  '
Checksum: 0xcb

----------------

Warnings:

Block 0, Base EDID:
  Alphanumeric Data String: Non-ASCII character 0x80 at position 5, can cause problems.
  Missing Display Product Name.

EDID conformity: PASS
