edid-decode (hex):

00 ff ff ff ff ff ff 00 4c a3 4b 54 00 00 00 00
00 15 01 04 90 26 15 78 0a 56 25 9d 5b 53 9a 28
17 50 54 00 00 00 01 01 01 01 01 01 01 01 01 01
01 01 01 01 01 01 b7 26 40 b8 60 84 1a 30 30 20
15 00 7e d7 10 00 00 1a d0 19 40 b8 60 84 1a 30
30 20 15 00 7e d7 10 00 00 1a 00 00 00 fe 00 32
35 56 59 37 80 31 37 33 4b 54 0a 20 00 00 00 00
00 00 41 21 96 01 00 00 00 02 01 0a 20 20 00 6f

----------------

Block 0, Base EDID:
  EDID Structure Version & Revision: 1.4
  Vendor & Product Identification:
    Manufacturer: SEC
    Model: 21579
    Made in: 2011
  Basic Display Parameters & Features:
    Digital display
    Bits per primary color channel: 6
    Digital interface is not defined
    Maximum image size: 38 cm x 21 cm
    Gamma: 2.20
    Supported color formats: RGB 4:4:4, YCrCb 4:4:4
    First detailed timing includes the native pixel format and preferred refresh rate
  Color Characteristics:
    Red  : 0.6142, 0.3564
    Green: 0.3251, 0.6035
    Blue : 0.1562, 0.0917
    White: 0.3134, 0.3291
  Established Timings I & II: none
  Standard Timings: none
  Detailed Timing Descriptors:
    DTD 1:  1600x900    59.994528 Hz  16:9     55.555 kHz     99.110000 MHz (382 mm x 215 mm)
                 Hfront   48 Hsync  32 Hback  104 Hpol P
                 Vfront    1 Vsync   5 Vback   20 Vpol N
    DTD 2:  1600x900    40.000387 Hz  16:9     37.040 kHz     66.080000 MHz (382 mm x 215 mm)
                 Hfront   48 Hsync  32 Hback  104 Hpol P
                 Vfront    1 Vsync   5 Vback   20 Vpol N
    Alphanumeric Data String: '25VY7.173KT'
    Manufacturer-Specified Display Descriptor (0x00): 00 00 00 00 41 21 96 01 00 00 00 02 01 0a 20 20 '....A!........  '
Checksum: 0x6f

----------------

Warnings:

Block 0, Base EDID:
  Alphanumeric Data String: Non-ASCII character 0x80 at position 5, can cause problems.
  Missing Display Product Name.

EDID conformity: PASS
