edid-decode (hex):

00 ff ff ff ff ff ff 00 4d 10 43 32 01 01 01 01
00 18 01 03 68 46 27 78 2a c3 dd a5 55 4f a1 24
09 47 4a a3 08 00 81 c0 81 00 81 0f 81 40 81 80
95 00 b3 00 01 01 02 3a 80 18 71 38 2d 40 58 2c
45 00 ba 88 21 00 00 1e a9 1a 00 a0 50 00 16 30
30 20 37 00 ba 88 21 00 00 1a 00 00 00 fd 00 37
4c 1e 51 0f 00 0a 20 20 20 20 20 20 00 00 00 fc
00 4c 43 2d 33 32 4c 42 32 36 31 55 0a 20 00 90

00 ff ff ff ff ff ff 00 4d 10 43 32 01 01 01 01
00 18 01 03 68 46 27 78 2a c3 dd a5 55 4f a1 24
09 47 4a a3 08 00 81 c0 81 00 81 0f 81 40 81 80
95 00 b3 00 01 01 02 3a 80 18 71 38 2d 40 58 2c
45 00 ba 88 21 00 00 1e a9 1a 00 a0 50 00 16 30
30 20 37 00 ba 88 21 00 00 1a 00 00 00 fd 00 37
4c 1e 51 0f 00 0a 20 20 20 20 20 20 00 00 00 fc
00 4c 43 2d 33 32 4c 42 32 36 31 55 0a 20 00 90

----------------

Block 0, Base EDID:
  EDID Structure Version & Revision: 1.3
  Vendor & Product Identification:
    Manufacturer: SHP
    Model: 12867
    Serial Number: ...
    Made in: 2014
  Basic Display Parameters & Features:
    Analog display
    Signal Level Standard: 0.700 : 0.000 : 0.700 V p-p
    Blank level equals black level
    Sync: Separate
    Maximum image size: 70 cm x 39 cm
    Gamma: 2.20
    DPMS levels: Off
    RGB color display
    First detailed timing is the preferred timing
  Color Characteristics:
    Red  : 0.6474, 0.3320
    Green: 0.3085, 0.6318
    Blue : 0.1435, 0.0361
    White: 0.2802, 0.2900
  Established Timings I & II:
    IBM     :   720x400    70.081663 Hz   9:5     31.467 kHz     28.320000 MHz
    DMT 0x04:   640x480    59.940476 Hz   4:3     31.469 kHz     25.175000 MHz
    DMT 0x08:   800x600    56.250000 Hz   4:3     35.156 kHz     36.000000 MHz
    DMT 0x09:   800x600    60.316541 Hz   4:3     37.879 kHz     40.000000 MHz
    DMT 0x10:  1024x768    60.003840 Hz   4:3     48.363 kHz     65.000000 MHz
  Standard Timings:
    DMT 0x55:  1280x720    60.000000 Hz  16:9     45.000 kHz     74.250000 MHz
    DMT 0x1c:  1280x800    59.810326 Hz  16:10    49.702 kHz     83.500000 MHz
    DMT 0x1d:  1280x800    74.934142 Hz  16:10    62.795 kHz    106.500000 MHz
    DMT 0x20:  1280x960    60.000000 Hz   4:3     60.000 kHz    108.000000 MHz
    DMT 0x23:  1280x1024   60.019740 Hz   5:4     63.981 kHz    108.000000 MHz
    DMT 0x2f:  1440x900    59.887445 Hz  16:10    55.935 kHz    106.500000 MHz
    DMT 0x3a:  1680x1050   59.954250 Hz  16:10    65.290 kHz    146.250000 MHz
  Detailed Timing Descriptors:
    DTD 1:  1920x1080   60.000000 Hz  16:9     67.500 kHz    148.500000 MHz (698 mm x 392 mm)
                 Hfront   88 Hsync  44 Hback  148 Hpol P
                 Vfront    4 Vsync   5 Vback   36 Vpol P
    DTD 2:  1280x768    59.994726 Hz   5:3     47.396 kHz     68.250000 MHz (698 mm x 392 mm)
                 Hfront   48 Hsync  32 Hback   80 Hpol P
                 Vfront    3 Vsync   7 Vback   12 Vpol N
    Display Range Limits:
      Monitor ranges (GTF): 55-76 Hz V, 30-81 kHz H, max dotclock 150 MHz
    Display Product Name: 'LC-32LB261U'
Checksum: 0x90

----------------

Warnings:

Block 0, Base EDID:
  Vendor & Product Identification: The serial number is one of the known dummy values, it should probably be set to 0.
  Detailed Timing Descriptor #2: Image size is 698x392 mm, but based on the picture AR it should be 653x392 mm.

Failures:

EDID:
  Extension Block 1 started with EDID header, ignoring Extension Blocks >= 1.

EDID conformity: FAIL
