edid-decode (hex):

00 ff ff ff ff ff ff 00 06 af 5c 23 00 00 00 00
00 1e 01 04 95 1a 0e 78 02 6b f5 91 55 54 91 27
22 50 54 00 00 00 01 01 01 01 01 01 01 01 01 01
01 01 01 01 01 01 ce 1d 56 e2 50 00 1e 30 26 16
36 00 00 90 10 00 00 1a d4 17 56 e2 50 00 1e 30
26 16 36 00 00 90 10 00 00 1a 00 00 00 fe 00 4a
30 4e 35 54 80 42 31 31 36 58 54 4e 00 00 00 00
00 00 41 03 96 00 00 00 00 09 01 0a 20 20 00 a5

00 ff ff ff ff ff ff 00 06 af 5c 23 00 00 00 00
00 1e 01 04 95 1a 0e 78 02 6b f5 91 55 54 91 27
22 50 54 00 00 00 01 01 01 01 01 01 01 01 01 01
01 01 01 01 01 01 ce 1d 56 e2 50 00 1e 30 26 16
36 00 00 90 10 00 00 1a d4 17 56 e2 50 00 1e 30
26 16 36 00 00 90 10 00 00 1a 00 00 00 fe 00 4a
30 4e 35 54 80 42 31 31 36 58 54 4e 00 00 00 00
00 00 41 03 96 00 00 00 00 09 01 0a 20 20 00 a5

----------------

Block 0, Base EDID:
  EDID Structure Version & Revision: 1.4
  Vendor & Product Identification:
    Manufacturer: AUO
    Model: 9052
    Made in: 2020
  Basic Display Parameters & Features:
    Digital display
    Bits per primary color channel: 6
    DisplayPort interface
    Maximum image size: 26 cm x 14 cm
    Gamma: 2.20
    Supported color formats: RGB 4:4:4
    First detailed timing includes the native pixel format and preferred refresh rate
  Color Characteristics:
    Red  : 0.5673, 0.3339
    Green: 0.3300, 0.5693
    Blue : 0.1552, 0.1357
    White: 0.3134, 0.3291
  Established Timings I & II: none
  Standard Timings: none
  Detailed Timing Descriptors:
    DTD 1:  1366x768    60.059067 Hz 683:384   47.927 kHz     76.300000 MHz (256 mm x 144 mm)
                 Hfront   38 Hsync  22 Hback  166 Hpol P
                 Vfront    3 Vsync   6 Vback   21 Vpol N
    DTD 2:  1366x768    48.015768 Hz 683:384   38.317 kHz     61.000000 MHz (256 mm x 144 mm)
                 Hfront   38 Hsync  22 Hback  166 Hpol P
                 Vfront    3 Vsync   6 Vback   21 Vpol N
    Alphanumeric Data String: 'J0N5T.B116XTN'
    Manufacturer-Specified Display Descriptor (0x00): 00 00 00 00 41 03 96 00 00 00 00 09 01 0a 20 20 '....A.........  '
Checksum: 0xa5

----------------

Warnings:

Block 0, Base EDID:
  Alphanumeric Data String: Non-ASCII character 0x80 at position 5, can cause problems.
  Missing Display Product Name.

Failures:

EDID:
  Extension Block 1 started with EDID header, ignoring Extension Blocks >= 1.

EDID conformity: FAIL
