edid-decode (hex):

00 ff ff ff ff ff ff 00 12 96 00 00 01 01 01 01
05 17 01 03 08 00 00 78 8a de bd a3 55 47 99 26
0c 47 4a a1 08 00 81 c0 01 01 01 01 01 01 01 01
01 01 01 01 01 01 66 21 50 b0 51 00 1b 30 40 70
36 00 f8 ae 21 00 00 1e a9 1a 00 a0 50 00 16 30
30 20 37 00 20 56 00 00 00 1a 00 00 00 fd 00 32
4c 1f 4b 10 00 0a 20 20 20 20 20 20 00 00 00 fc
00 43 48 48 57 4a 54 20 20 20 20 0a 20 20 00 b7

----------------

Block 0, Base EDID:
  EDID Structure Version & Revision: 1.3
  Vendor & Product Identification:
    Manufacturer: DTV
    Model: 0
    Serial Number: ...
    Made in: week 5 of 2013
  Basic Display Parameters & Features:
    Analog display
    Signal Level Standard: 0.700 : 0.300 : 1.000 V p-p
    Blank level equals black level
    Sync: Separate
    Image size is variable
    Gamma: 2.20
    DPMS levels: Standby
    RGB color display
    First detailed timing is the preferred timing
  Color Characteristics:
    Red  : 0.6396, 0.3330
    Green: 0.2802, 0.5996
    Blue : 0.1503, 0.0498
    White: 0.2802, 0.2900
  Established Timings I & II:
    IBM     :   720x400    70.081663 Hz   9:5     31.467 kHz     28.320000 MHz
    DMT 0x04:   640x480    59.940476 Hz   4:3     31.469 kHz     25.175000 MHz
    DMT 0x09:   800x600    60.316541 Hz   4:3     37.879 kHz     40.000000 MHz
    DMT 0x10:  1024x768    60.003840 Hz   4:3     48.363 kHz     65.000000 MHz
  Standard Timings:
    DMT 0x55:  1280x720    60.000000 Hz  16:9     45.000 kHz     74.250000 MHz
  Detailed Timing Descriptors:
    DTD 1:  1360x768    60.015162 Hz  85:48    47.712 kHz     85.500000 MHz (760 mm x 430 mm)
                 Hfront   64 Hsync 112 Hback  256 Hpol P
                 Vfront    3 Vsync   6 Vback   18 Vpol P
    DTD 2:  1280x768    59.994726 Hz   5:3     47.396 kHz     68.250000 MHz (32 mm x 86 mm)
                 Hfront   48 Hsync  32 Hback   80 Hpol P
                 Vfront    3 Vsync   7 Vback   12 Vpol N
    Display Range Limits:
      Monitor ranges (GTF): 50-76 Hz V, 31-75 kHz H, max dotclock 160 MHz
    Display Product Name: 'CHHWJT    '
Checksum: 0xb7

----------------

Warnings:

Block 0, Base EDID:
  Vendor & Product Identification: The serial number is one of the known dummy values, it should probably be set to 0.
  Detailed Timing Descriptor #2: Dubious image size (32x86 mm is smaller than 100x100 mm).

Failures:

Block 0, Base EDID:
  Display Product Name: One or more trailing spaces before newline.
EDID:
  Base EDID: The DTD max image size is 760x430mm, but the display size is not specified anywhere.

EDID conformity: FAIL
