edid-decode (hex):

00 ff ff ff ff ff ff 00 09 e5 76 0b 00 00 00 00
1b 20 01 04 a5 22 16 78 03 76 35 96 5d 5b 95 2b
21 50 54 00 00 00 01 01 01 01 01 01 01 01 01 01
01 01 01 01 01 01 af 41 80 54 71 b0 28 40 30 20
36 00 59 d7 10 00 00 1a 00 00 00 00 00 00 00 00
00 00 00 00 00 00 00 00 00 00 00 00 00 fd 00 28
3c 4a 4a 11 01 0a 20 20 20 20 20 20 00 00 00 fe
00 4e 56 31 36 30 57 55 4d 2d 4e 34 38 0a 00 50

00 ff ff ff ff ff ff 00 09 e5 76 0b 00 00 00 00
1b 20 01 04 a5 22 16 78 03 76 35 96 5d 5b 95 2b
21 50 54 00 00 00 01 01 01 01 01 01 01 01 01 01
01 01 01 01 01 01 af 41 80 54 71 b0 28 40 30 20
36 00 59 d7 10 00 00 1a 00 00 00 00 00 00 00 00
00 00 00 00 00 00 00 00 00 00 00 00 00 fd 00 28
3c 4a 4a 11 01 0a 20 20 20 20 20 20 00 00 00 fe
00 4e 56 31 36 30 57 55 4d 2d 4e 34 38 0a 00 50

----------------

Block 0, Base EDID:
  EDID Structure Version & Revision: 1.4
  Vendor & Product Identification:
    Manufacturer: BOE
    Model: 2934
    Made in: week 27 of 2022
  Basic Display Parameters & Features:
    Digital display
    Bits per primary color channel: 8
    DisplayPort interface
    Maximum image size: 34 cm x 22 cm
    Gamma: 2.20
    Supported color formats: RGB 4:4:4
    First detailed timing includes the native pixel format and preferred refresh rate
    Display supports continuous frequencies
  Color Characteristics:
    Red  : 0.5869, 0.3662
    Green: 0.3564, 0.5839
    Blue : 0.1679, 0.1318
    White: 0.3134, 0.3291
  Established Timings I & II: none
  Standard Timings: none
  Detailed Timing Descriptors:
    DTD 1:  1920x1200   60.002141 Hz  16:10    74.403 kHz    168.150000 MHz (345 mm x 215 mm)
                 Hfront   48 Hsync  32 Hback  260 Hpol P
                 Vfront    3 Vsync   6 Vback   31 Vpol N
    Empty Descriptor
    Display Range Limits:
      Monitor ranges (Range Limits Only): 40-60 Hz V, 74-74 kHz H, max dotclock 170 MHz
    Alphanumeric Data String: 'NV160WUM-N48'
Checksum: 0x50

----------------

Warnings:

Block 0, Base EDID:
  Missing Display Product Name.

Failures:

Block 0, Base EDID:
  Empty Descriptor: Use Dummy Descriptor instead of all zeroes.
EDID:
  Extension Block 1 started with EDID header, ignoring Extension Blocks >= 1.

EDID conformity: FAIL
