edid-decode (hex):

00 ff ff ff ff ff ff 00 06 af a4 fd 00 00 00 00
21 20 01 04 a5 22 16 78 03 ad b5 a8 54 48 9e 25
0e 50 54 00 00 00 01 01 01 01 01 01 01 01 01 01
01 01 01 01 01 01 3e d8 00 a0 a0 40 60 60 30 20
aa 00 58 d7 10 00 00 18 1f 6c 00 a0 a0 40 60 60
30 20 aa 00 58 d7 10 00 00 18 00 00 00 fd 00 30
78 cc cc 37 01 0a 20 20 20 20 20 20 00 00 00 02
00 0c 2d ff 10 3c c8 25 0d 2d c8 20 20 20 01 0f

70 20 79 02 00 22 00 14 6b 72 08 84 ff 09 9f 00
2f 80 1f 00 3f 06 5f 00 09 00 09 00 25 01 09 6b
72 08 6b 72 08 30 78 80 81 00 10 72 1a 00 00 03
01 30 78 00 00 60 50 60 50 78 00 00 00 00 00 00
00 00 00 00 00 00 00 00 00 00 00 00 00 00 00 00
00 00 00 00 00 00 00 00 00 00 00 00 00 00 00 00
00 00 00 00 00 00 00 00 00 00 00 00 00 00 00 00
00 00 00 00 00 00 00 00 00 00 00 00 00 00 d9 90

00 ff ff ff ff ff ff 00 06 af a4 fd 00 00 00 00
21 20 01 04 a5 22 16 78 03 ad b5 a8 54 48 9e 25
0e 50 54 00 00 00 01 01 01 01 01 01 01 01 01 01
01 01 01 01 01 01 3e d8 00 a0 a0 40 60 60 30 20
aa 00 58 d7 10 00 00 18 1f 6c 00 a0 a0 40 60 60
30 20 aa 00 58 d7 10 00 00 18 00 00 00 fd 00 30
78 cc cc 37 01 0a 20 20 20 20 20 20 00 00 00 02
00 0c 2d ff 10 3c c8 25 0d 2d c8 20 20 20 01 0f

70 20 79 02 00 22 00 14 6b 72 08 84 ff 09 9f 00
2f 80 1f 00 3f 06 5f 00 09 00 09 00 25 01 09 6b
72 08 6b 72 08 30 78 80 81 00 10 72 1a 00 00 03
01 30 78 00 00 60 50 60 50 78 00 00 00 00 00 00
00 00 00 00 00 00 00 00 00 00 00 00 00 00 00 00
00 00 00 00 00 00 00 00 00 00 00 00 00 00 00 00
00 00 00 00 00 00 00 00 00 00 00 00 00 00 00 00
00 00 00 00 00 00 00 00 00 00 00 00 00 00 d9 90

----------------

Block 0, Base EDID:
  EDID Structure Version & Revision: 1.4
  Vendor & Product Identification:
    Manufacturer: AUO
    Model: 64932
    Made in: week 33 of 2022
  Basic Display Parameters & Features:
    Digital display
    Bits per primary color channel: 8
    DisplayPort interface
    Maximum image size: 34 cm x 22 cm
    Gamma: 2.20
    Supported color formats: RGB 4:4:4
    First detailed timing includes the native pixel format and preferred refresh rate
    Display supports continuous frequencies
  Color Characteristics:
    Red  : 0.6582, 0.3300
    Green: 0.2841, 0.6181
    Blue : 0.1464, 0.0576
    White: 0.3134, 0.3291
  Established Timings I & II: none
  Standard Timings: none
  Detailed Timing Descriptors:
    DTD 1:  2560x1600  120.001214 Hz  16:10   203.522 kHz    553.580000 MHz (344 mm x 215 mm)
                 Hfront   48 Hsync  32 Hback   80 Hpol N
                 Vfront   10 Vsync  10 Vback   76 Vpol N
    DTD 2:  2560x1600   60.000607 Hz  16:10   101.761 kHz    276.790000 MHz (344 mm x 215 mm)
                 Hfront   48 Hsync  32 Hback   80 Hpol N
                 Vfront   10 Vsync  10 Vback   76 Vpol N
    Display Range Limits:
      Monitor ranges (Range Limits Only): 48-120 Hz V, 204-204 kHz H, max dotclock 550 MHz
    Manufacturer-Specified Display Descriptor (0x02): 00 02 00 0c 2d ff 10 3c c8 25 0d 2d c8 20 20 20 '....-..<.%.-.   '
  Extension blocks: 1
Checksum: 0x0f

----------------

Block 1, DisplayID Extension Block:
  Version: 2.0
  Extension Count: 0
  Display Product Primary Use Case: None of the listed primary use cases; generic display
  Video Timing Modes Type 7 - Detailed Timings Data Block:
    DTD:  2560x1600  120.001214 Hz  16:9    203.522 kHz    553.580000 MHz (aspect 16:9, no 3D stereo, preferred)
               Hfront   48 Hsync  32 Hback   80 Hpol P
               Vfront   10 Vsync  10 Vback   76 Vpol N
  Dynamic Video Timing Range Limits Data Block:
    Minimum Pixel Clock: 553580 kHz
    Maximum Pixel Clock: 553580 kHz
    Minimum Vertical Refresh Rate: 48 Hz
    Maximum Vertical Refresh Rate: 120 Hz
    Seamless Dynamic Video Timing Support: Yes
  CTA-861 DisplayID Data Block:
  Vendor-Specific Data Block (AMD), OUI 00-00-1A:
    Version: 3
    Feature Caps: 0x01
    Minimum Refresh Rate: 48 Hz
    Maximum Refresh Rate: 120 Hz
    Flags 1.x: 0x00
    Flags 2.x: 0x00
  Checksum: 0xd9
Checksum: 0x90

----------------

Warnings:

Block 0, Base EDID:
  Missing Display Product Name.
EDID:
  Base EDID: Some timings are out of range of the Monitor Ranges:
    Horizontal Freq: 101.761 - 203.522 kHz (Monitor: 204.000 - 204.000 kHz)
    Maximum Clock: 553.580 MHz (Monitor: 550.000 MHz)

Failures:

Block 1, DisplayID Extension Block:
  Vendor-Specific Data Block (AMD), OUI 00-00-1A: Length is 16 instead of 19.
EDID:
  Extension Block 2 started with EDID header, ignoring Extension Blocks >= 2.
  DisplayID: Missing DisplayID Display Parameters Data Block.

EDID conformity: FAIL
