edid-decode (hex):

00 ff ff ff ff ff ff 00 5c 85 80 51 00 00 00 00
05 11 01 03 80 34 20 78 2e c5 85 a4 59 49 9a 24
12 50 54 bf cf 00 81 00 81 c0 b3 00 95 00 95 0f
01 01 01 01 01 01 28 3c 80 a0 70 b0 23 40 30 20
36 00 06 44 21 00 00 1a 00 00 00 fd 00 38 4b 1e
50 10 00 0a 20 20 20 20 20 20 02 3a 80 18 71 38
2d 40 58 2c 45 00 06 23 21 00 00 1e 00 00 00 fc
00 4c 32 34 31 30 4e 4d 0a 20 20 20 20 20 01 30

02 03 1b f1 47 05 04 02 01 90 06 0e 23 09 07 07
83 01 00 00 66 03 0c 00 10 00 00 02 3a 80 18 71
38 2d 40 58 2c 45 00 06 44 21 00 00 1e 01 1d 80
18 71 1c 16 20 58 2c 25 00 06 44 21 00 00 9e 01
1d 00 72 51 d0 1e 20 6e 28 55 00 06 44 21 00 00
1e 8c 0a d0 8a 20 e0 2d 10 10 3e 96 00 06 44 21
00 00 18 00 00 00 00 00 00 00 00 00 00 00 00 00
00 00 00 00 00 00 00 00 00 00 00 00 00 00 00 57

00 ff ff ff ff ff ff 00 5c 85 80 51 00 00 00 00
05 11 01 03 80 34 20 78 2e c5 85 a4 59 49 9a 24
12 50 54 bf cf 00 81 00 81 c0 b3 00 95 00 95 0f
01 01 01 01 01 01 28 3c 80 a0 70 b0 23 40 30 20
36 00 06 44 21 00 00 1a 00 00 00 fd 00 38 4b 1e
50 10 00 0a 20 20 20 20 20 20 02 3a 80 18 71 38
2d 40 58 2c 45 00 06 23 21 00 00 1e 00 00 00 fc
00 4c 32 34 31 30 4e 4d 0a 20 20 20 20 20 01 30

02 03 1b f1 47 05 04 02 01 90 06 0e 23 09 07 07
83 01 00 00 66 03 0c 00 10 00 00 02 3a 80 18 71
38 2d 40 58 2c 45 00 06 44 21 00 00 1e 01 1d 80
18 71 1c 16 20 58 2c 25 00 06 44 21 00 00 9e 01
1d 00 72 51 d0 1e 20 6e 28 55 00 06 44 21 00 00
1e 8c 0a d0 8a 20 e0 2d 10 10 3e 96 00 06 44 21
00 00 18 00 00 00 00 00 00 00 00 00 00 00 00 00
00 00 00 00 00 00 00 00 00 00 00 00 00 00 00 57

----------------

Block 0, Base EDID:
  EDID Structure Version & Revision: 1.3
  Vendor & Product Identification:
    Manufacturer: WDE
    Model: 20864
    Made in: week 5 of 2007
  Basic Display Parameters & Features:
    Digital display
    Maximum image size: 52 cm x 32 cm
    Gamma: 2.20
    DPMS levels: Off
    RGB color display
    Default (sRGB) color space is primary color space
    First detailed timing is the preferred timing
  Color Characteristics:
    Red  : 0.6435, 0.3476
    Green: 0.2861, 0.6025
    Blue : 0.1425, 0.0703
    White: 0.3134, 0.3291
  Established Timings I & II:
    IBM     :   720x400    70.081663 Hz   9:5     31.467 kHz     28.320000 MHz
    DMT 0x04:   640x480    59.940476 Hz   4:3     31.469 kHz     25.175000 MHz
    Apple   :   640x480    66.666667 Hz   4:3     35.000 kHz     30.240000 MHz
    DMT 0x05:   640x480    72.808802 Hz   4:3     37.861 kHz     31.500000 MHz
    DMT 0x06:   640x480    75.000000 Hz   4:3     37.500 kHz     31.500000 MHz
    DMT 0x08:   800x600    56.250000 Hz   4:3     35.156 kHz     36.000000 MHz
    DMT 0x09:   800x600    60.316541 Hz   4:3     37.879 kHz     40.000000 MHz
    DMT 0x0a:   800x600    72.187572 Hz   4:3     48.077 kHz     50.000000 MHz
    DMT 0x0b:   800x600    75.000000 Hz   4:3     46.875 kHz     49.500000 MHz
    DMT 0x10:  1024x768    60.003840 Hz   4:3     48.363 kHz     65.000000 MHz
    DMT 0x11:  1024x768    70.069359 Hz   4:3     56.476 kHz     75.000000 MHz
    DMT 0x12:  1024x768    75.028582 Hz   4:3     60.023 kHz     78.750000 MHz
    DMT 0x24:  1280x1024   75.024675 Hz   5:4     79.976 kHz    135.000000 MHz
  Standard Timings:
    DMT 0x1c:  1280x800    59.810326 Hz  16:10    49.702 kHz     83.500000 MHz
    DMT 0x55:  1280x720    60.000000 Hz  16:9     45.000 kHz     74.250000 MHz
    DMT 0x3a:  1680x1050   59.954250 Hz  16:10    65.290 kHz    146.250000 MHz
    DMT 0x2f:  1440x900    59.887445 Hz  16:10    55.935 kHz    106.500000 MHz
    DMT 0x30:  1440x900    74.984427 Hz  16:10    70.635 kHz    136.750000 MHz
  Detailed Timing Descriptors:
    DTD 1:  1920x1200   59.950171 Hz  16:10    74.038 kHz    154.000000 MHz (518 mm x 324 mm)
                 Hfront   48 Hsync  32 Hback   80 Hpol P
                 Vfront    3 Vsync   6 Vback   26 Vpol N
    Display Range Limits:
      Monitor ranges (GTF): 56-75 Hz V, 30-80 kHz H, max dotclock 160 MHz
    DTD 2:  1920x1080   60.000000 Hz  16:9     67.500 kHz    148.500000 MHz (518 mm x 291 mm)
                 Hfront   88 Hsync  44 Hback  148 Hpol P
                 Vfront    4 Vsync   5 Vback   36 Vpol P
    Display Product Name: 'L2410NM'
  Extension blocks: 1
Checksum: 0x30

----------------

Block 1, CTA-861 Extension Block:
  Revision: 3
  Underscans IT Video Formats by default
  Basic audio support
  Supports YCbCr 4:4:4
  Supports YCbCr 4:2:2
  Native DTDs: 1
  Video Data Block:
    VIC   5:  1920x1080i  60.000000 Hz  16:9     33.750 kHz     74.250000 MHz
    VIC   4:  1280x720    60.000000 Hz  16:9     45.000 kHz     74.250000 MHz
    VIC   2:   720x480    59.940060 Hz   4:3     31.469 kHz     27.000000 MHz
    VIC   1:   640x480    59.940476 Hz   4:3     31.469 kHz     25.175000 MHz
    VIC  16:  1920x1080   60.000000 Hz  16:9     67.500 kHz    148.500000 MHz (native)
    VIC   6:  1440x480i   59.940060 Hz   4:3     15.734 kHz     27.000000 MHz
    VIC  14:  1440x480    59.940060 Hz   4:3     31.469 kHz     54.000000 MHz
  Audio Data Block:
    Linear PCM:
      Max channels: 2
      Supported sample rates (kHz): 48 44.1 32
      Supported sample sizes (bits): 24 20 16
  Speaker Allocation Data Block:
    FL/FR - Front Left/Right
  Vendor-Specific Data Block (HDMI), OUI 00-0C-03:
    Source physical address: 1.0.0.0
  Detailed Timing Descriptors:
    DTD 3:  1920x1080   60.000000 Hz  16:9     67.500 kHz    148.500000 MHz (518 mm x 324 mm)
                 Hfront   88 Hsync  44 Hback  148 Hpol P
                 Vfront    4 Vsync   5 Vback   36 Vpol P
    DTD 4:  1920x1080i  60.000000 Hz  16:9     33.750 kHz     74.250000 MHz (518 mm x 324 mm)
                 Hfront   88 Hsync  44 Hback  148 Hpol P
                 Vfront    2 Vsync   5 Vback   15 Vpol P Vfront +0.5 Odd Field
                 Vfront    2 Vsync   5 Vback   15 Vpol P Vback  +0.5 Even Field
    DTD 5:  1280x720    60.000000 Hz  16:9     45.000 kHz     74.250000 MHz (518 mm x 324 mm)
                 Hfront  110 Hsync  40 Hback  220 Hpol P
                 Vfront    5 Vsync   5 Vback   20 Vpol P
    DTD 6:   720x480    59.940060 Hz   3:2     31.469 kHz     27.000000 MHz (518 mm x 324 mm)
                 Hfront   16 Hsync  62 Hback   60 Hpol N
                 Vfront    9 Vsync   6 Vback   30 Vpol N
Checksum: 0x57  Unused space in Extension Block: 28 bytes

----------------

Warnings:

Block 1, CTA-861 Extension Block:
  Video Data Block: VIC 5 and the first DTD are not identical. Is this intended?
  Detailed Timing Descriptor #3: Image size is 518x324 mm, but based on the picture AR it should be 518x291 mm.
  Detailed Timing Descriptor #4: Image size is 518x324 mm, but based on the picture AR it should be 518x291 mm.
  Detailed Timing Descriptor #5: Image size is 518x324 mm, but based on the picture AR it should be 518x291 mm.
  Detailed Timing Descriptor #6: Image size is 518x324 mm, but based on the picture AR it should be 486x324 mm.
EDID:
  Base EDID: Some timings are out of range of the Monitor Ranges:
    Horizontal Freq: 15.734 - 79.976 kHz (Monitor: 30.000 - 80.000 kHz)

Failures:

Block 0, Base EDID:
  Basic Display Parameters & Features: sRGB is signaled, but the chromaticities do not match.
  Detailed Timing Descriptor #2: Invalid detailed timing descriptor ordering.
Block 1, CTA-861 Extension Block:
  Missing VCDB, needed for Set Selectable RGB Quantization to avoid interop issues.
EDID:
  Extension Block 2 started with EDID header, ignoring Extension Blocks >= 2.
  CTA-861: Native progressive timings are a mix of several resolutions.

EDID conformity: FAIL
