edid-decode (hex):

00 ff ff ff ff ff ff 00 06 af ec 71 00 00 00 00
26 1a 01 04 95 22 13 78 02 50 25 93 58 57 92 29
22 50 54 00 00 00 01 01 01 01 01 01 01 01 01 01
01 01 01 01 01 01 ce 1d 56 c0 50 00 30 30 08 0a
31 00 58 c1 10 00 00 1a d8 17 56 c0 50 00 30 30
08 0a 31 00 58 c1 10 00 00 1a 00 00 00 fe 00 4b
33 30 4d 35 81 42 31 35 36 58 54 4e 00 00 00 00
00 00 41 21 96 01 11 00 00 09 01 0a 20 20 00 cc

----------------

Block 0, Base EDID:
  EDID Structure Version & Revision: 1.4
  Vendor & Product Identification:
    Manufacturer: AUO
    Model: 29164
    Made in: week 38 of 2016
  Basic Display Parameters & Features:
    Digital display
    Bits per primary color channel: 6
    DisplayPort interface
    Maximum image size: 34 cm x 19 cm
    Gamma: 2.20
    Supported color formats: RGB 4:4:4
    First detailed timing includes the native pixel format and preferred refresh rate
  Color Characteristics:
    Red  : 0.5751, 0.3447
    Green: 0.3398, 0.5703
    Blue : 0.1601, 0.1347
    White: 0.3134, 0.3291
  Established Timings I & II: none
  Standard Timings: none
  Detailed Timing Descriptors:
    DTD 1:  1366x768    60.015983 Hz 683:384   48.973 kHz     76.300000 MHz (344 mm x 193 mm)
                 Hfront    8 Hsync  10 Hback  174 Hpol P
                 Vfront    3 Vsync   1 Vback   44 Vpol N
    DTD 2:  1366x768    48.012787 Hz 683:384   39.178 kHz     61.040000 MHz (344 mm x 193 mm)
                 Hfront    8 Hsync  10 Hback  174 Hpol P
                 Vfront    3 Vsync   1 Vback   44 Vpol N
    Alphanumeric Data String: 'K30M5.B156XTN'
    Manufacturer-Specified Display Descriptor (0x00): 00 00 00 00 41 21 96 01 11 00 00 09 01 0a 20 20 '....A!........  '
Checksum: 0xcc

----------------

Warnings:

Block 0, Base EDID:
  Alphanumeric Data String: Non-ASCII character 0x81 at position 5, can cause problems.
  Missing Display Product Name.

EDID conformity: PASS
