edid-decode (hex):

00 ff ff ff ff ff ff 00 22 f0 56 42 01 00 00 00
01 18 01 04 a5 35 1d 78 fe a2 a0 a3 56 4c 9d 26
0d 50 54 00 00 00 01 01 01 01 01 01 01 01 01 01
01 01 01 01 01 01 02 3a 80 18 71 38 2d 40 30 20
48 00 0f 28 21 00 00 1e 00 00 00 fd 00 32 4b 38
5a 13 00 0a 20 20 20 20 20 20 00 00 00 fc 00 48
50 20 41 6c 6c 2d 69 6e 2d 4f 6e 65 00 00 00 ff
00 4d 56 32 33 38 46 48 4d 2d 4e 31 30 0a 00 c4

----------------

Block 0, Base EDID:
  EDID Structure Version & Revision: 1.4
  Vendor & Product Identification:
    Manufacturer: HWP
    Model: 16982
    Serial Number: ...
    Made in: week 1 of 2014
  Basic Display Parameters & Features:
    Digital display
    Bits per primary color channel: 8
    DisplayPort interface
    Maximum image size: 53 cm x 29 cm
    Gamma: 2.20
    DPMS levels: Standby Suspend Off
    Supported color formats: RGB 4:4:4, YCrCb 4:4:4, YCrCb 4:2:2
    Default (sRGB) color space is primary color space
    First detailed timing includes the native pixel format and preferred refresh rate
  Color Characteristics:
    Red  : 0.6386, 0.3378
    Green: 0.2968, 0.6152
    Blue : 0.1503, 0.0527
    White: 0.3125, 0.3281
  Established Timings I & II: none
  Standard Timings: none
  Detailed Timing Descriptors:
    DTD 1:  1920x1080   60.000000 Hz  16:9     67.500 kHz    148.500000 MHz (527 mm x 296 mm)
                 Hfront   48 Hsync  32 Hback  200 Hpol P
                 Vfront    4 Vsync   8 Vback   33 Vpol P
    Display Range Limits:
      Monitor ranges (GTF): 50-75 Hz V, 56-90 kHz H, max dotclock 190 MHz
    Display Product Name: 'HP All-in-One'
    Display Product Serial Number: ...
Checksum: 0xc4

----------------

Warnings:

Block 0, Base EDID:
  Vendor & Product Identification: The serial number is one of the known dummy values, it should probably be set to 0.
  Detailed Timing Descriptor #1: DTD is similar but not identical to VIC 16.
  Display Range Limits: GTF support is deprecated in EDID 1.4.

Failures:

Block 0, Base EDID:
  Basic Display Parameters & Features: sRGB is signaled, but the chromaticities do not match.
  Display Range Limits: GTF is supported, but the display does not support continuous frequencies.

EDID conformity: FAIL
