edid-decode (hex):

00 ff ff ff ff ff ff 00 06 b3 30 29 d2 df 02 00
26 1f 01 04 b5 43 1c 78 3b c4 25 aa 52 49 af 27
0c 50 54 bf ef 00 d1 c0 b3 00 95 00 81 80 81 40
81 c0 01 01 01 01 d8 59 00 60 a3 38 28 40 a0 10
3a 10 a1 1c 21 00 00 1a 00 00 00 ff 00 4d 39 4c
4d 54 46 31 38 38 33 37 30 0a 00 00 00 fc 00 41
53 55 53 20 56 50 32 39 39 43 4c 0a 00 00 00 fd
00 30 4b 63 63 17 01 0a 20 20 20 20 20 20 01 cf

02 03 2f f1 4b 01 03 04 13 1f 12 02 11 90 59 5a
23 09 07 07 83 01 00 00 e2 00 d5 68 1a 00 00 01
01 30 4b 00 e3 05 c0 01 e6 06 0d 01 5c 5c 1c 29
59 00 a0 a0 38 27 40 30 20 3a 00 a1 1c 21 00 00
1a 02 3a 80 18 71 38 2d 40 58 2c 45 00 a1 1c 21
00 00 1e ec 2c 00 b0 51 38 28 40 50 88 3a 00 a1
1c 21 00 00 1c 00 00 00 00 00 00 00 00 00 00 00
00 00 00 00 00 00 00 00 00 00 00 00 00 00 00 ac

00 ff ff ff ff ff ff 00 06 b3 30 29 d2 df 02 00
26 1f 01 04 b5 43 1c 78 3b c4 25 aa 52 49 af 27
0c 50 54 bf ef 00 d1 c0 b3 00 95 00 81 80 81 40
81 c0 01 01 01 01 d8 59 00 60 a3 38 28 40 a0 10
3a 10 a1 1c 21 00 00 1a 00 00 00 ff 00 4d 39 4c
4d 54 46 31 38 38 33 37 30 0a 00 00 00 fc 00 41
53 55 53 20 56 50 32 39 39 43 4c 0a 00 00 00 fd
00 30 4b 63 63 17 01 0a 20 20 20 20 20 20 01 cf

02 03 2f f1 4b 01 03 04 13 1f 12 02 11 90 59 5a
23 09 07 07 83 01 00 00 e2 00 d5 68 1a 00 00 01
01 30 4b 00 e3 05 c0 01 e6 06 0d 01 5c 5c 1c 29
59 00 a0 a0 38 27 40 30 20 3a 00 a1 1c 21 00 00
1a 02 3a 80 18 71 38 2d 40 58 2c 45 00 a1 1c 21
00 00 1e ec 2c 00 b0 51 38 28 40 50 88 3a 00 a1
1c 21 00 00 1c 00 00 00 00 00 00 00 00 00 00 00
00 00 00 00 00 00 00 00 00 00 00 00 00 00 00 ac

----------------

Block 0, Base EDID:
  EDID Structure Version & Revision: 1.4
  Vendor & Product Identification:
    Manufacturer: AUS
    Model: 10544
    Serial Number: ...
    Made in: week 38 of 2021
  Basic Display Parameters & Features:
    Digital display
    Bits per primary color channel: 10
    DisplayPort interface
    Maximum image size: 67 cm x 28 cm
    Gamma: 2.20
    DPMS levels: Off
    Supported color formats: RGB 4:4:4, YCrCb 4:4:4, YCrCb 4:2:2
    First detailed timing includes the native pixel format and preferred refresh rate
    Display supports continuous frequencies
  Color Characteristics:
    Red  : 0.6669, 0.3203
    Green: 0.2861, 0.6835
    Blue : 0.1523, 0.0488
    White: 0.3134, 0.3291
  Established Timings I & II:
    IBM     :   720x400    70.081663 Hz   9:5     31.467 kHz     28.320000 MHz
    DMT 0x04:   640x480    59.940476 Hz   4:3     31.469 kHz     25.175000 MHz
    Apple   :   640x480    66.666667 Hz   4:3     35.000 kHz     30.240000 MHz
    DMT 0x05:   640x480    72.808802 Hz   4:3     37.861 kHz     31.500000 MHz
    DMT 0x06:   640x480    75.000000 Hz   4:3     37.500 kHz     31.500000 MHz
    DMT 0x08:   800x600    56.250000 Hz   4:3     35.156 kHz     36.000000 MHz
    DMT 0x09:   800x600    60.316541 Hz   4:3     37.879 kHz     40.000000 MHz
    DMT 0x0a:   800x600    72.187572 Hz   4:3     48.077 kHz     50.000000 MHz
    DMT 0x0b:   800x600    75.000000 Hz   4:3     46.875 kHz     49.500000 MHz
    Apple   :   832x624    74.551266 Hz   4:3     49.726 kHz     57.284000 MHz
    DMT 0x10:  1024x768    60.003840 Hz   4:3     48.363 kHz     65.000000 MHz
    DMT 0x11:  1024x768    70.069359 Hz   4:3     56.476 kHz     75.000000 MHz
    DMT 0x12:  1024x768    75.028582 Hz   4:3     60.023 kHz     78.750000 MHz
    DMT 0x24:  1280x1024   75.024675 Hz   5:4     79.976 kHz    135.000000 MHz
  Standard Timings:
    DMT 0x52:  1920x1080   60.000000 Hz  16:9     67.500 kHz    148.500000 MHz
    DMT 0x3a:  1680x1050   59.954250 Hz  16:10    65.290 kHz    146.250000 MHz
    DMT 0x2f:  1440x900    59.887445 Hz  16:10    55.935 kHz    106.500000 MHz
    DMT 0x23:  1280x1024   60.019740 Hz   5:4     63.981 kHz    108.000000 MHz
    DMT 0x20:  1280x960    60.000000 Hz   4:3     60.000 kHz    108.000000 MHz
    DMT 0x55:  1280x720    60.000000 Hz  16:9     45.000 kHz     74.250000 MHz
  Detailed Timing Descriptors:
    DTD 1:  2560x1080   59.975801 Hz  64:27    67.173 kHz    230.000000 MHz (673 mm x 284 mm)
                 Hfront  160 Hsync 272 Hback  432 Hpol P
                 Vfront    3 Vsync  10 Vback   27 Vpol N
    Display Product Serial Number: ...
    Display Product Name: 'ASUS VP299CL'
    Display Range Limits:
      Monitor ranges (Range Limits Only): 48-75 Hz V, 99-99 kHz H, max dotclock 230 MHz
  Extension blocks: 1
Checksum: 0xcf

----------------

Block 1, CTA-861 Extension Block:
  Revision: 3
  Underscans IT Video Formats by default
  Basic audio support
  Supports YCbCr 4:4:4
  Supports YCbCr 4:2:2
  Native detailed modes: 1
  Video Data Block:
    VIC   1:   640x480    59.940476 Hz   4:3     31.469 kHz     25.175000 MHz
    VIC   3:   720x480    59.940060 Hz  16:9     31.469 kHz     27.000000 MHz
    VIC   4:  1280x720    60.000000 Hz  16:9     45.000 kHz     74.250000 MHz
    VIC  19:  1280x720    50.000000 Hz  16:9     37.500 kHz     74.250000 MHz
    VIC  31:  1920x1080   50.000000 Hz  16:9     56.250 kHz    148.500000 MHz
    VIC  18:   720x576    50.000000 Hz  16:9     31.250 kHz     27.000000 MHz
    VIC   2:   720x480    59.940060 Hz   4:3     31.469 kHz     27.000000 MHz
    VIC  17:   720x576    50.000000 Hz   4:3     31.250 kHz     27.000000 MHz
    VIC  16:  1920x1080   60.000000 Hz  16:9     67.500 kHz    148.500000 MHz (native)
    VIC  89:  2560x1080   50.000000 Hz  64:27    56.250 kHz    185.625000 MHz
    VIC  90:  2560x1080   60.000000 Hz  64:27    66.000 kHz    198.000000 MHz
  Audio Data Block:
    Linear PCM:
      Max channels: 2
      Supported sample rates (kHz): 48 44.1 32
      Supported sample sizes (bits): 24 20 16
  Speaker Allocation Data Block:
    FL/FR - Front Left/Right
  Video Capability Data Block:
    YCbCr quantization: Selectable (via AVI YQ)
    RGB quantization: Selectable (via AVI Q)
    PT scan behavior: Always Overscanned
    IT scan behavior: Always Overscanned
    CE scan behavior: Always Overscanned
  Vendor-Specific Data Block (AMD), OUI 00-00-1A:
    Version: 1
    Feature Caps: 0x01
    Minimum Refresh Rate: 48 Hz
    Maximum Refresh Rate: 75 Hz
    Flags 1.x: 0x00
  Colorimetry Data Block:
    BT2020YCC
    BT2020RGB
    Gamut Boundary Description Metadata Profile P0
  HDR Static Metadata Data Block:
    Electro optical transfer functions:
      Traditional gamma - SDR luminance range
      SMPTE ST2084
      Hybrid Log-Gamma
    Supported static metadata descriptors:
      Static metadata type 1
    Desired content max luminance: 92 (366.802 cd/m^2)
    Desired content max frame-average luminance: 92 (366.802 cd/m^2)
    Desired content min luminance: 28 (0.044 cd/m^2)
  Detailed Timing Descriptors:
    DTD 2:  2560x1080   74.991458 Hz  64:27    83.915 kHz    228.250000 MHz (673 mm x 284 mm)
                 Hfront   48 Hsync  32 Hback   80 Hpol P
                 Vfront    3 Vsync  10 Vback   26 Vpol N
    DTD 3:  1920x1080   60.000000 Hz  16:9     67.500 kHz    148.500000 MHz (673 mm x 284 mm)
                 Hfront   88 Hsync  44 Hback  148 Hpol P
                 Vfront    4 Vsync   5 Vback   36 Vpol P
    DTD 4:  1280x1080   59.975801 Hz  32:27    67.173 kHz    115.000000 MHz (673 mm x 284 mm)
                 Hfront   80 Hsync 136 Hback  216 Hpol N
                 Vfront    3 Vsync  10 Vback   27 Vpol P
Checksum: 0xac  Unused space in Extension Block: 26 bytes

----------------

Block 2, Unknown EDID Extension Block 0x00:
  00 ff ff ff ff ff ff 00 06 b3 30 29 d2 df 02 00 '..........0)....'
  26 1f 01 04 b5 43 1c 78 3b c4 25 aa 52 49 af 27 '&....C.x;.%.RI.''
  0c 50 54 bf ef 00 d1 c0 b3 00 95 00 81 80 81 40 '.PT............@'
  81 c0 01 01 01 01 d8 59 00 60 a3 38 28 40 a0 10 '.......Y.`.8(@..'
  3a 10 a1 1c 21 00 00 1a 00 00 00 ff 00 4d 39 4c ':...!........M9L'
  4d 54 46 31 38 38 33 37 30 0a 00 00 00 fc 00 41 'MTF188370......A'
  53 55 53 20 56 50 32 39 39 43 4c 0a 00 00 00 fd 'SUS VP299CL.....'
  00 30 4b 63 63 17 01 0a 20 20 20 20 20 20 01 cf '.0Kcc...      ..'
Checksum: 0xcf

----------------

Block 3, CTA-861 Extension Block:
  Revision: 3
  Underscans IT Video Formats by default
  Basic audio support
  Supports YCbCr 4:4:4
  Supports YCbCr 4:2:2
  Native detailed modes: 1
  Video Data Block:
    VIC   1:   640x480    59.940476 Hz   4:3     31.469 kHz     25.175000 MHz
    VIC   3:   720x480    59.940060 Hz  16:9     31.469 kHz     27.000000 MHz
    VIC   4:  1280x720    60.000000 Hz  16:9     45.000 kHz     74.250000 MHz
    VIC  19:  1280x720    50.000000 Hz  16:9     37.500 kHz     74.250000 MHz
    VIC  31:  1920x1080   50.000000 Hz  16:9     56.250 kHz    148.500000 MHz
    VIC  18:   720x576    50.000000 Hz  16:9     31.250 kHz     27.000000 MHz
    VIC   2:   720x480    59.940060 Hz   4:3     31.469 kHz     27.000000 MHz
    VIC  17:   720x576    50.000000 Hz   4:3     31.250 kHz     27.000000 MHz
    VIC  16:  1920x1080   60.000000 Hz  16:9     67.500 kHz    148.500000 MHz (native)
    VIC  89:  2560x1080   50.000000 Hz  64:27    56.250 kHz    185.625000 MHz
    VIC  90:  2560x1080   60.000000 Hz  64:27    66.000 kHz    198.000000 MHz
  Audio Data Block:
    Linear PCM:
      Max channels: 2
      Supported sample rates (kHz): 48 44.1 32
      Supported sample sizes (bits): 24 20 16
  Speaker Allocation Data Block:
    FL/FR - Front Left/Right
  Video Capability Data Block:
    YCbCr quantization: Selectable (via AVI YQ)
    RGB quantization: Selectable (via AVI Q)
    PT scan behavior: Always Overscanned
    IT scan behavior: Always Overscanned
    CE scan behavior: Always Overscanned
  Vendor-Specific Data Block (AMD), OUI 00-00-1A:
    Version: 1
    Feature Caps: 0x01
    Minimum Refresh Rate: 48 Hz
    Maximum Refresh Rate: 75 Hz
    Flags 1.x: 0x00
  Colorimetry Data Block:
    BT2020YCC
    BT2020RGB
    Gamut Boundary Description Metadata Profile P0
  HDR Static Metadata Data Block:
    Electro optical transfer functions:
      Traditional gamma - SDR luminance range
      SMPTE ST2084
      Hybrid Log-Gamma
    Supported static metadata descriptors:
      Static metadata type 1
    Desired content max luminance: 92 (366.802 cd/m^2)
    Desired content max frame-average luminance: 92 (366.802 cd/m^2)
    Desired content min luminance: 28 (0.044 cd/m^2)
  Detailed Timing Descriptors:
    DTD 5:  2560x1080   74.991458 Hz  64:27    83.915 kHz    228.250000 MHz (673 mm x 284 mm)
                 Hfront   48 Hsync  32 Hback   80 Hpol P
                 Vfront    3 Vsync  10 Vback   26 Vpol N
    DTD 6:  1920x1080   60.000000 Hz  16:9     67.500 kHz    148.500000 MHz (673 mm x 284 mm)
                 Hfront   88 Hsync  44 Hback  148 Hpol P
                 Vfront    4 Vsync   5 Vback   36 Vpol P
    DTD 7:  1280x1080   59.975801 Hz  32:27    67.173 kHz    115.000000 MHz (673 mm x 284 mm)
                 Hfront   80 Hsync 136 Hback  216 Hpol N
                 Vfront    3 Vsync  10 Vback   27 Vpol P
Checksum: 0xac  Unused space in Extension Block: 26 bytes

----------------

Warnings:

Block 1, CTA-861 Extension Block:
  Video Data Block: VIC 1 and the first DTD are not identical. Is this intended?
  Video Capability Data Block: IT scan behavior is expected to support underscanned.
  Video Capability Data Block: S_PT is equal to S_IT and S_CE, so should be set to 0 instead.
  Colorimetry Data Block: Set the sRGB colorimetry bit to avoid interop issues.
  Detailed Timing Descriptor #3: Image size is 673x284 mm, but based on the picture AR it should be 673x378 mm.
  Detailed Timing Descriptor #4: Image size is 673x284 mm, but based on the picture AR it should be 673x567 mm.
  Display Product Serial Number is set, so the Serial Number in the Base EDID should be 0.
Block 3, CTA-861 Extension Block:
  Video Capability Data Block: IT scan behavior is expected to support underscanned.
  Video Capability Data Block: S_PT is equal to S_IT and S_CE, so should be set to 0 instead.
  Colorimetry Data Block: Set the sRGB colorimetry bit to avoid interop issues.
  Detailed Timing Descriptor #6: Image size is 673x284 mm, but based on the picture AR it should be 673x378 mm.
  Detailed Timing Descriptor #7: Image size is 673x284 mm, but based on the picture AR it should be 673x567 mm.
EDID:
  Base EDID: Some timings are out of range of the Monitor Ranges:
    Horizontal Freq: 31.250 - 83.915 kHz (Monitor: 99.000 - 99.000 kHz)
    Maximum Clock: 230.000 MHz (Monitor: 230.000 MHz)

Failures:

Block 1, CTA-861 Extension Block:
  Video Capability Data Block: IT video formats are always overscanned, but bit 7 of Byte 3 of the CTA-861 Extension header is set to underscanned.
Block 2, Base EDID:
  Unknown Extension Block.
Block 3, CTA-861 Extension Block:
  Video Data Block: Duplicate VIC 1.
  Video Data Block: Duplicate VIC 3.
  Video Data Block: Duplicate VIC 4.
  Video Data Block: Duplicate VIC 19.
  Video Data Block: Duplicate VIC 31.
  Video Data Block: Duplicate VIC 18.
  Video Data Block: Duplicate VIC 2.
  Video Data Block: Duplicate VIC 17.
  Video Data Block: Duplicate VIC 16.
  Video Data Block: Duplicate VIC 89.
  Video Data Block: Duplicate VIC 90.
  Speaker Allocation Data Block: Only one instance of this Data Block is allowed.
  Video Capability Data Block: Only one instance of this Data Block is allowed.
  Video Capability Data Block: IT video formats are always overscanned, but bit 7 of Byte 3 of the CTA-861 Extension header is set to underscanned.
  Colorimetry Data Block: Only one instance of this Data Block is allowed.
  HDR Static Metadata Data Block: Only one instance of this Data Block is allowed.
EDID:
  Base EDID: EDID specified 1 extension block(s), but found 3 extension block(s).
  CTA-861: Native progressive timings are a mix of several resolutions.

EDID conformity: FAIL
