edid-decode (hex):

00 ff ff ff ff ff ff 00 30 ae 3d 40 00 00 00 00
14 1f 01 04 a5 1e 13 78 e3 a1 d5 98 5e 59 93 28
20 50 54 00 00 00 01 01 01 01 01 01 01 01 01 01
01 01 01 01 01 01 33 3f 80 dc 70 b0 3c 40 30 20
36 00 2e bd 10 00 00 1a 00 00 00 fd 00 28 3c 4c
4c 10 01 0a 20 20 20 20 20 20 00 00 00 0f 00 d1
0a 3c d1 0a 28 1e 0a 00 09 e5 35 0a 00 00 00 fe
00 4e 56 31 34 30 57 55 4d 2d 4e 34 33 0a 00 7b

00 ff ff ff ff ff ff 00 30 ae 3d 40 00 00 00 00
14 1f 01 04 a5 1e 13 78 e3 a1 d5 98 5e 59 93 28
20 50 54 00 00 00 01 01 01 01 01 01 01 01 01 01
01 01 01 01 01 01 33 3f 80 dc 70 b0 3c 40 30 20
36 00 2e bd 10 00 00 1a 00 00 00 fd 00 28 3c 4c
4c 10 01 0a 20 20 20 20 20 20 00 00 00 0f 00 d1
0a 3c d1 0a 28 1e 0a 00 09 e5 35 0a 00 00 00 fe
00 4e 56 31 34 30 57 55 4d 2d 4e 34 33 0a 00 7b

----------------

Block 0, Base EDID:
  EDID Structure Version & Revision: 1.4
  Vendor & Product Identification:
    Manufacturer: LEN
    Model: 16445
    Made in: week 20 of 2021
  Basic Display Parameters & Features:
    Digital display
    Bits per primary color channel: 8
    DisplayPort interface
    Maximum image size: 30 cm x 19 cm
    Gamma: 2.20
    DPMS levels: Standby Suspend Off
    Supported color formats: RGB 4:4:4
    First detailed timing includes the native pixel format and preferred refresh rate
    Display supports continuous frequencies
  Color Characteristics:
    Red  : 0.5957, 0.3691
    Green: 0.3476, 0.5751
    Blue : 0.1591, 0.1259
    White: 0.3134, 0.3291
  Established Timings I & II: none
  Standard Timings: none
  Detailed Timing Descriptors:
    DTD 1:  1920x1200   60.002225 Hz  16:10    75.603 kHz    161.790000 MHz (302 mm x 189 mm)
                 Hfront   48 Hsync  32 Hback  140 Hpol P
                 Vfront    3 Vsync   6 Vback   51 Vpol N
    Display Range Limits:
      Monitor ranges (Range Limits Only): 40-60 Hz V, 76-76 kHz H, max dotclock 160 MHz
    Manufacturer-Specified Display Descriptor (0x0f): 00 0f 00 d1 0a 3c d1 0a 28 1e 0a 00 09 e5 35 0a '.....<..(.....5.'
    Alphanumeric Data String: 'NV140WUM-N43'
Checksum: 0x7b

----------------

Warnings:

Block 0, Base EDID:
  Missing Display Product Name.
EDID:
  Base EDID: Some timings are out of range of the Monitor Ranges:
    Maximum Clock: 161.790 MHz (Monitor: 160.000 MHz)
    Could be due to a Monitor Range off-by-one rounding issue

Failures:

EDID:
  Extension Block 1 started with EDID header, ignoring Extension Blocks >= 1.

EDID conformity: FAIL
