edid-decode (hex):

00 ff ff ff ff ff ff 00 30 ae 3d 40 00 00 00 00
00 21 01 04 a5 1e 13 78 03 d3 d5 98 5c 54 87 24
21 50 54 00 00 00 01 01 01 01 01 01 01 01 01 01
01 01 01 01 01 01 42 3c 80 a0 70 b0 24 40 30 20
a6 00 2e bc 10 00 00 18 00 00 00 fd 00 28 3c 4a
4a 10 01 0a 20 20 20 20 20 20 00 00 00 0f 00 d1
0a 3c d1 0a 28 28 0a 00 0d ae 72 14 00 00 00 fe
00 4e 31 34 30 4a 43 41 2d 45 45 4c 0a 20 00 52

00 ff ff ff ff ff ff 00 30 ae 3d 40 00 00 00 00
00 21 01 04 a5 1e 13 78 03 d3 d5 98 5c 54 87 24
21 50 54 00 00 00 01 01 01 01 01 01 01 01 01 01
01 01 01 01 01 01 42 3c 80 a0 70 b0 24 40 30 20
a6 00 2e bc 10 00 00 18 00 00 00 fd 00 28 3c 4a
4a 10 01 0a 20 20 20 20 20 20 00 00 00 0f 00 d1
0a 3c d1 0a 28 28 0a 00 0d ae 72 14 00 00 00 fe
00 4e 31 34 30 4a 43 41 2d 45 45 4c 0a 20 00 52

----------------

Block 0, Base EDID:
  EDID Structure Version & Revision: 1.4
  Vendor & Product Identification:
    Manufacturer: LEN
    Model: 16445
    Made in: 2023
  Basic Display Parameters & Features:
    Digital display
    Bits per primary color channel: 8
    DisplayPort interface
    Maximum image size: 30 cm x 19 cm
    Gamma: 2.20
    Supported color formats: RGB 4:4:4
    First detailed timing includes the native pixel format and preferred refresh rate
    Display supports continuous frequencies
  Color Characteristics:
    Red  : 0.5966, 0.3603
    Green: 0.3281, 0.5302
    Blue : 0.1435, 0.1298
    White: 0.3134, 0.3291
  Established Timings I & II: none
  Standard Timings: none
  Detailed Timing Descriptors:
    DTD 1:  1920x1200   60.002801 Hz  16:10    74.163 kHz    154.260000 MHz (302 mm x 188 mm)
                 Hfront   48 Hsync  32 Hback   80 Hpol N
                 Vfront   10 Vsync   6 Vback   20 Vpol N
    Display Range Limits:
      Monitor ranges (Range Limits Only): 40-60 Hz V, 74-74 kHz H, max dotclock 160 MHz
    Manufacturer-Specified Display Descriptor (0x0f): 00 0f 00 d1 0a 3c d1 0a 28 28 0a 00 0d ae 72 14 '.....<..((....r.'
    Alphanumeric Data String: 'N140JCA-EEL'
Checksum: 0x52

----------------

Warnings:

Block 0, Base EDID:
  Missing Display Product Name.

Failures:

EDID:
  Extension Block 1 started with EDID header, ignoring Extension Blocks >= 1.

EDID conformity: FAIL
