edid-decode (hex):

00 ff ff ff ff ff ff 00 30 ae 3d 40 00 00 00 00
00 1f 01 04 a5 1e 13 78 03 b3 d5 99 5e 5b 8c 27
1c 50 54 00 00 00 01 01 01 01 01 01 01 01 01 01
01 01 01 01 01 01 35 3c 80 a0 70 b0 23 40 30 20
36 00 2e bd 10 00 00 1a 00 00 00 fd 00 28 3c 43
43 0e 01 0a 20 20 20 20 20 20 00 00 00 0f 00 d1
0a 3c d1 0a 28 1e 0a 00 30 e4 f7 06 00 00 00 fe
00 4c 50 31 34 30 57 55 32 2d 53 50 44 31 00 b6

00 ff ff ff ff ff ff 00 30 ae 3d 40 00 00 00 00
00 1f 01 04 a5 1e 13 78 03 b3 d5 99 5e 5b 8c 27
1c 50 54 00 00 00 01 01 01 01 01 01 01 01 01 01
01 01 01 01 01 01 35 3c 80 a0 70 b0 23 40 30 20
36 00 2e bd 10 00 00 1a 00 00 00 fd 00 28 3c 43
43 0e 01 0a 20 20 20 20 20 20 00 00 00 0f 00 d1
0a 3c d1 0a 28 1e 0a 00 30 e4 f7 06 00 00 00 fe
00 4c 50 31 34 30 57 55 32 2d 53 50 44 31 00 b6

----------------

Block 0, Base EDID:
  EDID Structure Version & Revision: 1.4
  Vendor & Product Identification:
    Manufacturer: LEN
    Model: 16445
    Made in: 2021
  Basic Display Parameters & Features:
    Digital display
    Bits per primary color channel: 8
    DisplayPort interface
    Maximum image size: 30 cm x 19 cm
    Gamma: 2.20
    Supported color formats: RGB 4:4:4
    First detailed timing includes the native pixel format and preferred refresh rate
    Display supports continuous frequencies
  Color Characteristics:
    Red  : 0.5996, 0.3701
    Green: 0.3554, 0.5498
    Blue : 0.1552, 0.1103
    White: 0.3134, 0.3291
  Established Timings I & II: none
  Standard Timings: none
  Detailed Timing Descriptors:
    DTD 1:  1920x1200   60.000779 Hz  16:10    74.101 kHz    154.130000 MHz (302 mm x 189 mm)
                 Hfront   48 Hsync  32 Hback   80 Hpol P
                 Vfront    3 Vsync   6 Vback   26 Vpol N
    Display Range Limits:
      Monitor ranges (Range Limits Only): 40-60 Hz V, 67-67 kHz H, max dotclock 140 MHz
    Manufacturer-Specified Display Descriptor (0x0f): 00 0f 00 d1 0a 3c d1 0a 28 1e 0a 00 30 e4 f7 06 '.....<..(...0...'
    Alphanumeric Data String: 'LP140WU2-SPD1'
Checksum: 0xb6

----------------

Warnings:

Block 0, Base EDID:
  Missing Display Product Name.
EDID:
  Base EDID: Some timings are out of range of the Monitor Ranges:
    Horizontal Freq: 74.100 - 74.100 kHz (Monitor: 67.000 - 67.000 kHz)
    Maximum Clock: 154.130 MHz (Monitor: 140.000 MHz)

Failures:

EDID:
  Extension Block 1 started with EDID header, ignoring Extension Blocks >= 1.

EDID conformity: FAIL
