edid-decode (hex):

00 ff ff ff ff ff ff 00 41 0c 73 09 b0 18 00 00
19 1f 01 03 80 5e 35 78 2a bc 85 ad 4f 47 aa 27
11 50 54 bf ef 00 d1 c0 b3 00 95 00 81 80 81 40
81 c0 01 01 01 01 a3 66 00 a0 f0 70 1f 80 30 20
35 00 ad 11 32 00 00 1a 00 00 00 ff 00 41 55 30
32 31 32 35 30 30 36 33 32 30 00 00 00 fc 00 50
48 4c 20 34 33 39 50 31 0a 20 20 20 00 00 00 fd
00 30 3c 1e 8c 3c 00 0a 20 20 20 20 20 20 01 56

02 03 25 f1 4a 90 04 03 1f 13 01 12 5d 5e 5f 23
09 07 07 83 01 00 00 6d 03 0c 00 10 00 00 3c 20
00 60 01 02 03 a3 66 00 a0 f0 70 1f 80 30 20 35
00 ad 11 32 00 00 1a 56 5e 00 a0 a0 a0 29 50 30
20 35 00 ad 11 32 00 00 1e 4d 6c 80 a0 70 70 3e
80 30 20 3a 00 ad 11 32 00 00 1a 00 00 00 00 00
00 00 00 00 00 00 00 00 00 00 00 00 00 00 00 00
00 00 00 00 00 00 00 00 00 00 00 00 00 00 00 b7

00 ff ff ff ff ff ff 00 41 0c 73 09 b0 18 00 00
19 1f 01 03 80 5e 35 78 2a bc 85 ad 4f 47 aa 27
11 50 54 bf ef 00 d1 c0 b3 00 95 00 81 80 81 40
81 c0 01 01 01 01 a3 66 00 a0 f0 70 1f 80 30 20
35 00 ad 11 32 00 00 1a 00 00 00 ff 00 41 55 30
32 31 32 35 30 30 36 33 32 30 00 00 00 fc 00 50
48 4c 20 34 33 39 50 31 0a 20 20 20 00 00 00 fd
00 30 3c 1e 8c 3c 00 0a 20 20 20 20 20 20 01 56

02 03 25 f1 4a 90 04 03 1f 13 01 12 5d 5e 5f 23
09 07 07 83 01 00 00 6d 03 0c 00 10 00 00 3c 20
00 60 01 02 03 a3 66 00 a0 f0 70 1f 80 30 20 35
00 ad 11 32 00 00 1a 56 5e 00 a0 a0 a0 29 50 30
20 35 00 ad 11 32 00 00 1e 4d 6c 80 a0 70 70 3e
80 30 20 3a 00 ad 11 32 00 00 1a 00 00 00 00 00
00 00 00 00 00 00 00 00 00 00 00 00 00 00 00 00
00 00 00 00 00 00 00 00 00 00 00 00 00 00 00 b7

----------------

Block 0, Base EDID:
  EDID Structure Version & Revision: 1.3
  Vendor & Product Identification:
    Manufacturer: PHL
    Model: 2419
    Serial Number: ...
    Made in: week 25 of 2021
  Basic Display Parameters & Features:
    Digital display
    Maximum image size: 94 cm x 53 cm
    Gamma: 2.20
    DPMS levels: Off
    RGB color display
    First detailed timing is the preferred timing
  Color Characteristics:
    Red  : 0.6777, 0.3115
    Green: 0.2802, 0.6640
    Blue : 0.1542, 0.0664
    White: 0.3134, 0.3291
  Established Timings I & II:
    IBM     :   720x400    70.081663 Hz   9:5     31.467 kHz     28.320000 MHz
    DMT 0x04:   640x480    59.940476 Hz   4:3     31.469 kHz     25.175000 MHz
    Apple   :   640x480    66.666667 Hz   4:3     35.000 kHz     30.240000 MHz
    DMT 0x05:   640x480    72.808802 Hz   4:3     37.861 kHz     31.500000 MHz
    DMT 0x06:   640x480    75.000000 Hz   4:3     37.500 kHz     31.500000 MHz
    DMT 0x08:   800x600    56.250000 Hz   4:3     35.156 kHz     36.000000 MHz
    DMT 0x09:   800x600    60.316541 Hz   4:3     37.879 kHz     40.000000 MHz
    DMT 0x0a:   800x600    72.187572 Hz   4:3     48.077 kHz     50.000000 MHz
    DMT 0x0b:   800x600    75.000000 Hz   4:3     46.875 kHz     49.500000 MHz
    Apple   :   832x624    74.551266 Hz   4:3     49.726 kHz     57.284000 MHz
    DMT 0x10:  1024x768    60.003840 Hz   4:3     48.363 kHz     65.000000 MHz
    DMT 0x11:  1024x768    70.069359 Hz   4:3     56.476 kHz     75.000000 MHz
    DMT 0x12:  1024x768    75.028582 Hz   4:3     60.023 kHz     78.750000 MHz
    DMT 0x24:  1280x1024   75.024675 Hz   5:4     79.976 kHz    135.000000 MHz
  Standard Timings:
    DMT 0x52:  1920x1080   60.000000 Hz  16:9     67.500 kHz    148.500000 MHz
    DMT 0x3a:  1680x1050   59.954250 Hz  16:10    65.290 kHz    146.250000 MHz
    DMT 0x2f:  1440x900    59.887445 Hz  16:10    55.935 kHz    106.500000 MHz
    DMT 0x23:  1280x1024   60.019740 Hz   5:4     63.981 kHz    108.000000 MHz
    DMT 0x20:  1280x960    60.000000 Hz   4:3     60.000 kHz    108.000000 MHz
    DMT 0x55:  1280x720    60.000000 Hz  16:9     45.000 kHz     74.250000 MHz
  Detailed Timing Descriptors:
    DTD 1:  3840x2160   29.980602 Hz  16:9     65.688 kHz    262.750000 MHz (941 mm x 529 mm)
                 Hfront   48 Hsync  32 Hback   80 Hpol P
                 Vfront    3 Vsync   5 Vback   23 Vpol N
    Display Product Serial Number: ...
    Display Product Name: 'PHL 439P1'
    Display Range Limits:
      Monitor ranges (GTF): 48-60 Hz V, 30-140 kHz H, max dotclock 600 MHz
  Extension blocks: 1
Checksum: 0x56

----------------

Block 1, CTA-861 Extension Block:
  Revision: 3
  Underscans IT Video Formats by default
  Basic audio support
  Supports YCbCr 4:4:4
  Supports YCbCr 4:2:2
  Native DTDs: 1
  Video Data Block:
    VIC  16:  1920x1080   60.000000 Hz  16:9     67.500 kHz    148.500000 MHz (native)
    VIC   4:  1280x720    60.000000 Hz  16:9     45.000 kHz     74.250000 MHz
    VIC   3:   720x480    59.940060 Hz  16:9     31.469 kHz     27.000000 MHz
    VIC  31:  1920x1080   50.000000 Hz  16:9     56.250 kHz    148.500000 MHz
    VIC  19:  1280x720    50.000000 Hz  16:9     37.500 kHz     74.250000 MHz
    VIC   1:   640x480    59.940476 Hz   4:3     31.469 kHz     25.175000 MHz
    VIC  18:   720x576    50.000000 Hz  16:9     31.250 kHz     27.000000 MHz
    VIC  93:  3840x2160   24.000000 Hz  16:9     54.000 kHz    297.000000 MHz
    VIC  94:  3840x2160   25.000000 Hz  16:9     56.250 kHz    297.000000 MHz
    VIC  95:  3840x2160   30.000000 Hz  16:9     67.500 kHz    297.000000 MHz
  Audio Data Block:
    Linear PCM:
      Max channels: 2
      Supported sample rates (kHz): 48 44.1 32
      Supported sample sizes (bits): 24 20 16
  Speaker Allocation Data Block:
    FL/FR - Front Left/Right
  Vendor-Specific Data Block (HDMI), OUI 00-0C-03:
    Source physical address: 1.0.0.0
    Maximum TMDS clock: 300 MHz
    Extended HDMI video details:
      HDMI VICs:
        HDMI VIC 1:  3840x2160   30.000000 Hz  16:9     67.500 kHz    297.000000 MHz
        HDMI VIC 2:  3840x2160   25.000000 Hz  16:9     56.250 kHz    297.000000 MHz
        HDMI VIC 3:  3840x2160   24.000000 Hz  16:9     54.000 kHz    297.000000 MHz
  Detailed Timing Descriptors:
    DTD 2:  3840x2160   29.980602 Hz  16:9     65.688 kHz    262.750000 MHz (941 mm x 529 mm)
                 Hfront   48 Hsync  32 Hback   80 Hpol P
                 Vfront    3 Vsync   5 Vback   23 Vpol N
    DTD 3:  2560x1440   59.950550 Hz  16:9     88.787 kHz    241.500000 MHz (941 mm x 529 mm)
                 Hfront   48 Hsync  32 Hback   80 Hpol P
                 Vfront    3 Vsync   5 Vback   33 Vpol P
    DTD 4:  1920x2160   59.987970 Hz   8:9    133.293 kHz    277.250000 MHz (941 mm x 529 mm)
                 Hfront   48 Hsync  32 Hback   80 Hpol P
                 Vfront    3 Vsync  10 Vback   49 Vpol N
Checksum: 0xb7  Unused space in Extension Block: 36 bytes

----------------

Warnings:

Block 1, CTA-861 Extension Block:
  Video Data Block: VIC 16 and the first DTD are not identical. Is this intended?
  Detailed Timing Descriptor #4: Image size is 941x529 mm, but based on the picture AR it should be 470x529 mm.
  Display Product Serial Number is set, so the Serial Number in the Base EDID should be 0.
  Add a Colorimetry Data Block with the sRGB colorimetry bit set to avoid interop issues.
EDID:
  Base EDID: Some timings are out of range of the Monitor Ranges:
    Vertical Freq: 24.000 - 75.029 Hz (Monitor: 48.000 - 60.000 Hz)

Failures:

Block 1, CTA-861 Extension Block:
  Missing VCDB, needed for Set Selectable RGB Quantization to avoid interop issues.
EDID:
  Extension Block 2 started with EDID header, ignoring Extension Blocks >= 2.
  CTA-861: Native progressive timings are a mix of several resolutions.

EDID conformity: FAIL
