edid-decode (hex):

00 ff ff ff ff ff ff 00 41 0c be c0 51 00 00 00
2b 17 01 03 80 43 1c 78 2a 8e 05 ad 4f 33 b0 26
0d 50 54 bd 4b 00 d1 00 d1 c0 81 80 95 0f 95 00
b3 00 81 c0 a9 40 cd 46 00 a0 a0 38 1f 40 30 20
3a 00 a1 1c 21 00 00 1a 02 3a 80 18 71 38 2d 40
58 2c 45 00 a1 1c 21 00 00 1e 00 00 00 fc 00 50
68 69 6c 69 70 73 20 32 39 38 50 34 00 00 00 fd
00 17 4c 0f 63 15 00 0a 20 20 20 20 20 20 01 70

02 03 24 74 4f 01 02 03 05 06 07 10 11 12 13 14
15 16 1f 04 23 09 07 07 83 01 00 00 67 03 0c 00
20 00 98 2d 02 3a 80 d0 72 38 2d 40 10 2c 96 80
a1 1c 21 00 00 18 01 1d 80 18 71 1c 16 20 58 2c
25 00 a1 1c 21 00 00 9e 01 1d 80 d0 72 1c 16 20
10 2c 25 80 a1 1c 21 00 00 9e 01 1d 00 bc 52 d0
1e 20 b8 28 55 40 a1 1c 21 00 00 1e 8c 0a d0 90
20 40 31 20 0c 40 55 00 a1 1c 21 00 00 18 00 3a

00 ff ff ff ff ff ff 00 41 0c be c0 51 00 00 00
2b 17 01 03 80 43 1c 78 2a 8e 05 ad 4f 33 b0 26
0d 50 54 bd 4b 00 d1 00 d1 c0 81 80 95 0f 95 00
b3 00 81 c0 a9 40 cd 46 00 a0 a0 38 1f 40 30 20
3a 00 a1 1c 21 00 00 1a 02 3a 80 18 71 38 2d 40
58 2c 45 00 a1 1c 21 00 00 1e 00 00 00 fc 00 50
68 69 6c 69 70 73 20 32 39 38 50 34 00 00 00 fd
00 17 4c 0f 63 15 00 0a 20 20 20 20 20 20 01 70

02 03 24 74 4f 01 02 03 05 06 07 10 11 12 13 14
15 16 1f 04 23 09 07 07 83 01 00 00 67 03 0c 00
20 00 98 2d 02 3a 80 d0 72 38 2d 40 10 2c 96 80
a1 1c 21 00 00 18 01 1d 80 18 71 1c 16 20 58 2c
25 00 a1 1c 21 00 00 9e 01 1d 80 d0 72 1c 16 20
10 2c 25 80 a1 1c 21 00 00 9e 01 1d 00 bc 52 d0
1e 20 b8 28 55 40 a1 1c 21 00 00 1e 8c 0a d0 90
20 40 31 20 0c 40 55 00 a1 1c 21 00 00 18 00 3a

----------------

Block 0, Base EDID:
  EDID Structure Version & Revision: 1.3
  Vendor & Product Identification:
    Manufacturer: PHL
    Model: 49342
    Serial Number: ...
    Made in: week 43 of 2013
  Basic Display Parameters & Features:
    Digital display
    Maximum image size: 67 cm x 28 cm
    Gamma: 2.20
    DPMS levels: Off
    RGB color display
    First detailed timing is the preferred timing
  Color Characteristics:
    Red  : 0.6777, 0.3085
    Green: 0.2021, 0.6894
    Blue : 0.1484, 0.0507
    White: 0.3134, 0.3291
  Established Timings I & II:
    IBM     :   720x400    70.081663 Hz   9:5     31.467 kHz     28.320000 MHz
    DMT 0x04:   640x480    59.940476 Hz   4:3     31.469 kHz     25.175000 MHz
    Apple   :   640x480    66.666667 Hz   4:3     35.000 kHz     30.240000 MHz
    DMT 0x05:   640x480    72.808802 Hz   4:3     37.861 kHz     31.500000 MHz
    DMT 0x06:   640x480    75.000000 Hz   4:3     37.500 kHz     31.500000 MHz
    DMT 0x09:   800x600    60.316541 Hz   4:3     37.879 kHz     40.000000 MHz
    DMT 0x0b:   800x600    75.000000 Hz   4:3     46.875 kHz     49.500000 MHz
    DMT 0x10:  1024x768    60.003840 Hz   4:3     48.363 kHz     65.000000 MHz
    DMT 0x12:  1024x768    75.028582 Hz   4:3     60.023 kHz     78.750000 MHz
    DMT 0x24:  1280x1024   75.024675 Hz   5:4     79.976 kHz    135.000000 MHz
  Standard Timings:
    DMT 0x45:  1920x1200   59.884600 Hz  16:10    74.556 kHz    193.250000 MHz
    DMT 0x52:  1920x1080   60.000000 Hz  16:9     67.500 kHz    148.500000 MHz
    DMT 0x23:  1280x1024   60.019740 Hz   5:4     63.981 kHz    108.000000 MHz
    DMT 0x30:  1440x900    74.984427 Hz  16:10    70.635 kHz    136.750000 MHz
    DMT 0x2f:  1440x900    59.887445 Hz  16:10    55.935 kHz    106.500000 MHz
    DMT 0x3a:  1680x1050   59.954250 Hz  16:10    65.290 kHz    146.250000 MHz
    DMT 0x55:  1280x720    60.000000 Hz  16:9     45.000 kHz     74.250000 MHz
    DMT 0x33:  1600x1200   60.000000 Hz   4:3     75.000 kHz    162.000000 MHz
  Detailed Timing Descriptors:
    DTD 1:  2560x1080   59.978424 Hz  64:27    66.636 kHz    181.250000 MHz (673 mm x 284 mm)
                 Hfront   48 Hsync  32 Hback   80 Hpol P
                 Vfront    3 Vsync  10 Vback   18 Vpol N
    DTD 2:  1920x1080   60.000000 Hz  16:9     67.500 kHz    148.500000 MHz (673 mm x 284 mm)
                 Hfront   88 Hsync  44 Hback  148 Hpol P
                 Vfront    4 Vsync   5 Vback   36 Vpol P
    Display Product Name: 'Philips 298P4'
    Display Range Limits:
      Monitor ranges (GTF): 23-76 Hz V, 15-99 kHz H, max dotclock 210 MHz
  Extension blocks: 1
Checksum: 0x70

----------------

Block 1, CTA-861 Extension Block:
  Revision: 3
  Basic audio support
  Supports YCbCr 4:4:4
  Supports YCbCr 4:2:2
  Native DTDs: 4
  Video Data Block:
    VIC   1:   640x480    59.940476 Hz   4:3     31.469 kHz     25.175000 MHz
    VIC   2:   720x480    59.940060 Hz   4:3     31.469 kHz     27.000000 MHz
    VIC   3:   720x480    59.940060 Hz  16:9     31.469 kHz     27.000000 MHz
    VIC   5:  1920x1080i  60.000000 Hz  16:9     33.750 kHz     74.250000 MHz
    VIC   6:  1440x480i   59.940060 Hz   4:3     15.734 kHz     27.000000 MHz
    VIC   7:  1440x480i   59.940060 Hz  16:9     15.734 kHz     27.000000 MHz
    VIC  16:  1920x1080   60.000000 Hz  16:9     67.500 kHz    148.500000 MHz
    VIC  17:   720x576    50.000000 Hz   4:3     31.250 kHz     27.000000 MHz
    VIC  18:   720x576    50.000000 Hz  16:9     31.250 kHz     27.000000 MHz
    VIC  19:  1280x720    50.000000 Hz  16:9     37.500 kHz     74.250000 MHz
    VIC  20:  1920x1080i  50.000000 Hz  16:9     28.125 kHz     74.250000 MHz
    VIC  21:  1440x576i   50.000000 Hz   4:3     15.625 kHz     27.000000 MHz
    VIC  22:  1440x576i   50.000000 Hz  16:9     15.625 kHz     27.000000 MHz
    VIC  31:  1920x1080   50.000000 Hz  16:9     56.250 kHz    148.500000 MHz
    VIC   4:  1280x720    60.000000 Hz  16:9     45.000 kHz     74.250000 MHz
  Audio Data Block:
    Linear PCM:
      Max channels: 2
      Supported sample rates (kHz): 48 44.1 32
      Supported sample sizes (bits): 24 20 16
  Speaker Allocation Data Block:
    FL/FR - Front Left/Right
  Vendor-Specific Data Block (HDMI), OUI 00-0C-03:
    Source physical address: 2.0.0.0
    Supports_AI
    DC_30bit
    DC_Y444
    Maximum TMDS clock: 225 MHz
  Detailed Timing Descriptors:
    DTD 3:  1920x1080   50.000000 Hz  16:9     56.250 kHz    148.500000 MHz (673 mm x 284 mm)
                 Hfront  528 Hsync  44 Hback  148 Hpol N
                 Vfront    9 Vsync   6 Vback   30 Vpol N
    DTD 4:  1920x1080i  60.000000 Hz  16:9     33.750 kHz     74.250000 MHz (673 mm x 284 mm)
                 Hfront   88 Hsync  44 Hback  148 Hpol P
                 Vfront    2 Vsync   5 Vback   15 Vpol P Vfront +0.5 Odd Field
                 Vfront    2 Vsync   5 Vback   15 Vpol P Vback  +0.5 Even Field
    DTD 5:  1920x1080i  50.000000 Hz  16:9     28.125 kHz     74.250000 MHz (673 mm x 284 mm)
                 Hfront  528 Hsync  44 Hback  148 Hpol P
                 Vfront    2 Vsync   5 Vback   15 Vpol P Vfront +0.5 Odd Field
                 Vfront    2 Vsync   5 Vback   15 Vpol P Vback  +0.5 Even Field
    DTD 6:  1280x720    50.000000 Hz  16:9     37.500 kHz     74.250000 MHz (673 mm x 284 mm)
                 Hfront  440 Hsync  40 Hback  220 Hpol P
                 Vfront    5 Vsync   5 Vback   20 Vpol P
    DTD 7:   720x576    50.000000 Hz   5:4     31.250 kHz     27.000000 MHz (673 mm x 284 mm)
                 Hfront   12 Hsync  64 Hback   68 Hpol N
                 Vfront    5 Vsync   5 Vback   39 Vpol N
Checksum: 0x3a  Unused space in Extension Block: 1 byte

----------------

Warnings:

Block 0, Base EDID:
  Detailed Timing Descriptor #2: Image size is 673x284 mm, but based on the picture AR it should be 504x284 mm.
Block 1, CTA-861 Extension Block:
  IT Video Formats are overscanned by default, but normally this should be underscanned.
  Video Data Block: VIC 1 and the first DTD are not identical. Is this intended?
  Detailed Timing Descriptor #3: DTD is similar but not identical to VIC 31.
  Detailed Timing Descriptor #3: Image size is 673x284 mm, but based on the picture AR it should be 504x284 mm.
  Detailed Timing Descriptor #4: Image size is 673x284 mm, but based on the picture AR it should be 504x284 mm.
  Detailed Timing Descriptor #5: Image size is 673x284 mm, but based on the picture AR it should be 504x284 mm.
  Detailed Timing Descriptor #6: Image size is 673x284 mm, but based on the picture AR it should be 504x284 mm.
  Detailed Timing Descriptor #7: Image size is 673x284 mm, but based on the picture AR it should be 355x284 mm.
  Add a Colorimetry Data Block with the sRGB colorimetry bit set to avoid interop issues.

Failures:

Block 1, CTA-861 Extension Block:
  Missing VCDB, needed for Set Selectable RGB Quantization to avoid interop issues.
EDID:
  Extension Block 2 started with EDID header, ignoring Extension Blocks >= 2.
  CTA-861: Native progressive timings are a mix of several resolutions.

EDID conformity: FAIL
