edid-decode (hex):

00 ff ff ff ff ff ff 00 41 0c be c0 77 ca 00 00
25 18 01 04 a5 43 1c 78 3a 8e 05 ad 4f 33 b0 26
0d 50 54 bd 4b 00 d1 00 d1 c0 81 80 95 0f 95 00
b3 00 81 c0 a9 40 cd 46 00 a0 a0 38 1f 40 30 20
3a 00 a1 1c 21 00 00 1a 00 00 00 ff 00 46 58 33
31 34 33 37 30 35 31 38 33 31 00 00 00 fc 00 50
68 69 6c 69 70 73 20 32 39 38 50 34 00 00 00 fd
00 17 4c 0f 63 1e 01 0a 20 20 20 20 20 20 01 23

02 03 18 f4 4b 01 02 03 04 05 90 11 12 13 14 1f
23 09 07 07 83 01 00 00 02 3a 80 d0 72 38 2d 40
10 2c 96 80 a1 1c 21 00 00 18 02 3a 80 18 71 38
2d 40 58 2c 96 00 a1 1c 21 00 00 18 28 3c 80 a0
70 b0 23 40 30 20 36 00 a1 1c 21 00 00 1a 01 1d
00 bc 52 d0 1e 20 b8 28 55 40 a1 1c 21 00 00 1e
8c 0a d0 90 20 40 31 20 0c 40 55 00 a1 1c 21 00
00 18 00 00 00 00 00 00 00 00 00 00 00 00 00 8b

00 ff ff ff ff ff ff 00 41 0c be c0 77 ca 00 00
25 18 01 04 a5 43 1c 78 3a 8e 05 ad 4f 33 b0 26
0d 50 54 bd 4b 00 d1 00 d1 c0 81 80 95 0f 95 00
b3 00 81 c0 a9 40 cd 46 00 a0 a0 38 1f 40 30 20
3a 00 a1 1c 21 00 00 1a 00 00 00 ff 00 46 58 33
31 34 33 37 30 35 31 38 33 31 00 00 00 fc 00 50
68 69 6c 69 70 73 20 32 39 38 50 34 00 00 00 fd
00 17 4c 0f 63 1e 01 0a 20 20 20 20 20 20 01 23

02 03 18 f4 4b 01 02 03 04 05 90 11 12 13 14 1f
23 09 07 07 83 01 00 00 02 3a 80 d0 72 38 2d 40
10 2c 96 80 a1 1c 21 00 00 18 02 3a 80 18 71 38
2d 40 58 2c 96 00 a1 1c 21 00 00 18 28 3c 80 a0
70 b0 23 40 30 20 36 00 a1 1c 21 00 00 1a 01 1d
00 bc 52 d0 1e 20 b8 28 55 40 a1 1c 21 00 00 1e
8c 0a d0 90 20 40 31 20 0c 40 55 00 a1 1c 21 00
00 18 00 00 00 00 00 00 00 00 00 00 00 00 00 8b

----------------

Block 0, Base EDID:
  EDID Structure Version & Revision: 1.4
  Vendor & Product Identification:
    Manufacturer: PHL
    Model: 49342
    Serial Number: ...
    Made in: week 37 of 2014
  Basic Display Parameters & Features:
    Digital display
    Bits per primary color channel: 8
    DisplayPort interface
    Maximum image size: 67 cm x 28 cm
    Gamma: 2.20
    DPMS levels: Off
    Supported color formats: RGB 4:4:4, YCrCb 4:4:4, YCrCb 4:2:2
    First detailed timing includes the native pixel format and preferred refresh rate
  Color Characteristics:
    Red  : 0.6777, 0.3085
    Green: 0.2021, 0.6894
    Blue : 0.1484, 0.0507
    White: 0.3134, 0.3291
  Established Timings I & II:
    IBM     :   720x400    70.081663 Hz   9:5     31.467 kHz     28.320000 MHz
    DMT 0x04:   640x480    59.940476 Hz   4:3     31.469 kHz     25.175000 MHz
    Apple   :   640x480    66.666667 Hz   4:3     35.000 kHz     30.240000 MHz
    DMT 0x05:   640x480    72.808802 Hz   4:3     37.861 kHz     31.500000 MHz
    DMT 0x06:   640x480    75.000000 Hz   4:3     37.500 kHz     31.500000 MHz
    DMT 0x09:   800x600    60.316541 Hz   4:3     37.879 kHz     40.000000 MHz
    DMT 0x0b:   800x600    75.000000 Hz   4:3     46.875 kHz     49.500000 MHz
    DMT 0x10:  1024x768    60.003840 Hz   4:3     48.363 kHz     65.000000 MHz
    DMT 0x12:  1024x768    75.028582 Hz   4:3     60.023 kHz     78.750000 MHz
    DMT 0x24:  1280x1024   75.024675 Hz   5:4     79.976 kHz    135.000000 MHz
  Standard Timings:
    DMT 0x45:  1920x1200   59.884600 Hz  16:10    74.556 kHz    193.250000 MHz
    DMT 0x52:  1920x1080   60.000000 Hz  16:9     67.500 kHz    148.500000 MHz
    DMT 0x23:  1280x1024   60.019740 Hz   5:4     63.981 kHz    108.000000 MHz
    DMT 0x30:  1440x900    74.984427 Hz  16:10    70.635 kHz    136.750000 MHz
    DMT 0x2f:  1440x900    59.887445 Hz  16:10    55.935 kHz    106.500000 MHz
    DMT 0x3a:  1680x1050   59.954250 Hz  16:10    65.290 kHz    146.250000 MHz
    DMT 0x55:  1280x720    60.000000 Hz  16:9     45.000 kHz     74.250000 MHz
    DMT 0x33:  1600x1200   60.000000 Hz   4:3     75.000 kHz    162.000000 MHz
  Detailed Timing Descriptors:
    DTD 1:  2560x1080   59.978424 Hz  64:27    66.636 kHz    181.250000 MHz (673 mm x 284 mm)
                 Hfront   48 Hsync  32 Hback   80 Hpol P
                 Vfront    3 Vsync  10 Vback   18 Vpol N
    Display Product Serial Number: ...
    Display Product Name: 'Philips 298P4'
    Display Range Limits:
      Monitor ranges (Range Limits Only): 23-76 Hz V, 15-99 kHz H, max dotclock 300 MHz
  Extension blocks: 1
Checksum: 0x23

----------------

Block 1, CTA-861 Extension Block:
  Revision: 3
  Underscans IT Video Formats by default
  Basic audio support
  Supports YCbCr 4:4:4
  Supports YCbCr 4:2:2
  Native DTDs: 4
  Video Data Block:
    VIC   1:   640x480    59.940476 Hz   4:3     31.469 kHz     25.175000 MHz
    VIC   2:   720x480    59.940060 Hz   4:3     31.469 kHz     27.000000 MHz
    VIC   3:   720x480    59.940060 Hz  16:9     31.469 kHz     27.000000 MHz
    VIC   4:  1280x720    60.000000 Hz  16:9     45.000 kHz     74.250000 MHz
    VIC   5:  1920x1080i  60.000000 Hz  16:9     33.750 kHz     74.250000 MHz
    VIC  16:  1920x1080   60.000000 Hz  16:9     67.500 kHz    148.500000 MHz (native)
    VIC  17:   720x576    50.000000 Hz   4:3     31.250 kHz     27.000000 MHz
    VIC  18:   720x576    50.000000 Hz  16:9     31.250 kHz     27.000000 MHz
    VIC  19:  1280x720    50.000000 Hz  16:9     37.500 kHz     74.250000 MHz
    VIC  20:  1920x1080i  50.000000 Hz  16:9     28.125 kHz     74.250000 MHz
    VIC  31:  1920x1080   50.000000 Hz  16:9     56.250 kHz    148.500000 MHz
  Audio Data Block:
    Linear PCM:
      Max channels: 2
      Supported sample rates (kHz): 48 44.1 32
      Supported sample sizes (bits): 24 20 16
  Speaker Allocation Data Block:
    FL/FR - Front Left/Right
  Detailed Timing Descriptors:
    DTD 2:  1920x1080   50.000000 Hz  16:9     56.250 kHz    148.500000 MHz (673 mm x 284 mm)
                 Hfront  528 Hsync  44 Hback  148 Hpol N
                 Vfront    9 Vsync   6 Vback   30 Vpol N
    DTD 3:  1920x1080   60.000000 Hz  16:9     67.500 kHz    148.500000 MHz (673 mm x 284 mm)
                 Hfront   88 Hsync  44 Hback  148 Hpol N
                 Vfront    9 Vsync   6 Vback   30 Vpol N
    DTD 4:  1920x1200   59.950171 Hz  16:10    74.038 kHz    154.000000 MHz (673 mm x 284 mm)
                 Hfront   48 Hsync  32 Hback   80 Hpol P
                 Vfront    3 Vsync   6 Vback   26 Vpol N
    DTD 5:  1280x720    50.000000 Hz  16:9     37.500 kHz     74.250000 MHz (673 mm x 284 mm)
                 Hfront  440 Hsync  40 Hback  220 Hpol P
                 Vfront    5 Vsync   5 Vback   20 Vpol P
    DTD 6:   720x576    50.000000 Hz   5:4     31.250 kHz     27.000000 MHz (673 mm x 284 mm)
                 Hfront   12 Hsync  64 Hback   68 Hpol N
                 Vfront    5 Vsync   5 Vback   39 Vpol N
Checksum: 0x8b  Unused space in Extension Block: 13 bytes

----------------

Warnings:

Block 1, CTA-861 Extension Block:
  Video Data Block: VIC 1 and the first DTD are not identical. Is this intended?
  Video Data Block: All VICs are in ascending order, and the first (preferred) VIC <= 4, is that intended?
  Detailed Timing Descriptor #2: DTD is similar but not identical to VIC 31.
  Detailed Timing Descriptor #2: Image size is 673x284 mm, but based on the picture AR it should be 504x284 mm.
  Detailed Timing Descriptor #3: DTD is similar but not identical to VIC 16.
  Detailed Timing Descriptor #3: Image size is 673x284 mm, but based on the picture AR it should be 504x284 mm.
  Detailed Timing Descriptor #4: Image size is 673x284 mm, but based on the picture AR it should be 454x284 mm.
  Detailed Timing Descriptor #5: Image size is 673x284 mm, but based on the picture AR it should be 504x284 mm.
  Detailed Timing Descriptor #6: Image size is 673x284 mm, but based on the picture AR it should be 355x284 mm.
  Display Product Serial Number is set, so the Serial Number in the Base EDID should be 0.
  Add a Colorimetry Data Block with the sRGB colorimetry bit set to avoid interop issues.

Failures:

Block 1, CTA-861 Extension Block:
  Missing VCDB, needed for Set Selectable RGB Quantization to avoid interop issues.
EDID:
  Extension Block 2 started with EDID header, ignoring Extension Blocks >= 2.
  CTA-861: Native progressive timings are a mix of several resolutions.

EDID conformity: FAIL
