edid-decode (hex):

00 ff ff ff ff ff ff 00 09 e5 b3 05 00 00 00 00
01 16 01 04 90 22 13 78 0a f8 90 9e 59 55 9c 26
1a 50 54 00 00 00 01 01 01 01 01 01 01 01 01 01
01 01 01 01 01 01 04 1c 56 93 50 00 16 30 30 20
36 00 58 c1 10 00 00 1a d6 12 56 a0 50 00 16 30
30 20 36 00 58 c1 10 00 00 1a 00 00 00 fe 00 30
47 54 4e 31 80 48 42 31 35 31 30 30 00 00 00 00
00 00 41 01 94 01 00 00 00 01 01 0a 20 20 00 88

----------------

Block 0, Base EDID:
  EDID Structure Version & Revision: 1.4
  Vendor & Product Identification:
    Manufacturer: BOE
    Model: 1459
    Made in: week 1 of 2012
  Basic Display Parameters & Features:
    Digital display
    Bits per primary color channel: 6
    Digital interface is not defined
    Maximum image size: 34 cm x 19 cm
    Gamma: 2.20
    Supported color formats: RGB 4:4:4, YCrCb 4:4:4
    First detailed timing includes the native pixel format and preferred refresh rate
  Color Characteristics:
    Red  : 0.6201, 0.3505
    Green: 0.3339, 0.6093
    Blue : 0.1503, 0.1025
    White: 0.3125, 0.3281
  Established Timings I & II: none
  Standard Timings: none
  Detailed Timing Descriptors:
    DTD 1:  1366x768    60.003179 Hz 683:384   47.403 kHz     71.720000 MHz (344 mm x 193 mm)
                 Hfront   48 Hsync  32 Hback   67 Hpol P
                 Vfront    3 Vsync   6 Vback   13 Vpol N
    DTD 2:  1366x768    39.998673 Hz 683:384   31.599 kHz     48.220000 MHz (344 mm x 193 mm)
                 Hfront   48 Hsync  32 Hback   80 Hpol P
                 Vfront    3 Vsync   6 Vback   13 Vpol N
    Alphanumeric Data String: '0GTN1.HB15100'
    Manufacturer-Specified Display Descriptor (0x00): 00 00 00 00 41 01 94 01 00 00 00 01 01 0a 20 20 '....A.........  '
Checksum: 0x88

----------------

Warnings:

Block 0, Base EDID:
  Alphanumeric Data String: Non-ASCII character 0x80 at position 5, can cause problems.
  Missing Display Product Name.

EDID conformity: PASS
