edid-decode (hex):

00 ff ff ff ff ff ff 00 12 74 00 32 01 00 00 00
32 1b 01 03 80 46 27 78 ee 44 55 a9 55 4d 9d 26
0f 50 54 25 4b 00 e1 40 d1 c0 b3 00 71 4f a9 40
81 80 77 80 81 c0 8b 51 00 a0 80 00 29 60 30 20
35 00 00 80 21 00 00 1a bd 51 00 a0 80 00 2c 60
30 20 34 00 00 80 21 00 00 1a bd 51 00 a0 80 00
2c 60 30 20 34 00 00 80 21 00 00 1a bd 51 00 a0
80 00 2c 60 30 20 34 00 00 80 21 00 00 1a 01 e7

02 03 36 70 4f 10 05 04 03 02 07 16 01 14 1f 12
13 20 21 22 23 09 07 07 83 01 00 00 67 03 0c 00
10 00 38 3d e3 05 03 01 6d d8 5d c4 01 78 80 01
00 00 00 01 00 00 02 3a 80 18 71 38 2d 40 58 2c
25 00 e0 0e 11 00 00 1e 01 1d 80 18 71 1c 16 20
58 2c 25 00 e0 87 10 00 00 9e 01 1d 00 72 51 d0
1e 20 6e 28 55 00 40 b4 10 00 00 1e 8c 0a d0 8a
20 e0 2d 10 10 3e 96 00 b4 78 00 00 00 18 00 d1

00 ff ff ff ff ff ff 00 12 74 00 32 01 00 00 00
32 1b 01 03 80 46 27 78 ee 44 55 a9 55 4d 9d 26
0f 50 54 25 4b 00 e1 40 d1 c0 b3 00 71 4f a9 40
81 80 77 80 81 c0 8b 51 00 a0 80 00 29 60 30 20
35 00 00 80 21 00 00 1a bd 51 00 a0 80 00 2c 60
30 20 34 00 00 80 21 00 00 1a bd 51 00 a0 80 00
2c 60 30 20 34 00 00 80 21 00 00 1a bd 51 00 a0
80 00 2c 60 30 20 34 00 00 80 21 00 00 1a 01 e7

02 03 36 70 4f 10 05 04 03 02 07 16 01 14 1f 12
13 20 21 22 23 09 07 07 83 01 00 00 67 03 0c 00
10 00 38 3d e3 05 03 01 6d d8 5d c4 01 78 80 01
00 00 00 01 00 00 02 3a 80 18 71 38 2d 40 58 2c
25 00 e0 0e 11 00 00 1e 01 1d 80 18 71 1c 16 20
58 2c 25 00 e0 87 10 00 00 9e 01 1d 00 72 51 d0
1e 20 6e 28 55 00 40 b4 10 00 00 1e 8c 0a d0 8a
20 e0 2d 10 10 3e 96 00 b4 78 00 00 00 18 00 d1

----------------

Block 0, Base EDID:
  EDID Structure Version & Revision: 1.3
  Vendor & Product Identification:
    Manufacturer: DST
    Model: 12800
    Serial Number: ...
    Made in: week 50 of 2017
  Basic Display Parameters & Features:
    Digital display
    Maximum image size: 70 cm x 39 cm
    Gamma: 2.20
    DPMS levels: Standby Suspend Off
    RGB color display
    Default (sRGB) color space is primary color space
    First detailed timing is the preferred timing
  Color Characteristics:
    Red  : 0.6611, 0.3320
    Green: 0.3017, 0.6132
    Blue : 0.1494, 0.0595
    White: 0.3134, 0.3291
  Established Timings I & II:
    DMT 0x04:   640x480    59.940476 Hz   4:3     31.469 kHz     25.175000 MHz
    DMT 0x06:   640x480    75.000000 Hz   4:3     37.500 kHz     31.500000 MHz
    DMT 0x09:   800x600    60.316541 Hz   4:3     37.879 kHz     40.000000 MHz
    DMT 0x0b:   800x600    75.000000 Hz   4:3     46.875 kHz     49.500000 MHz
    DMT 0x10:  1024x768    60.003840 Hz   4:3     48.363 kHz     65.000000 MHz
    DMT 0x12:  1024x768    75.028582 Hz   4:3     60.023 kHz     78.750000 MHz
    DMT 0x24:  1280x1024   75.024675 Hz   5:4     79.976 kHz    135.000000 MHz
  Standard Timings:
    GTF     :  2048x1536   60.000000 Hz   4:3     95.340 kHz    266.952000 MHz
    DMT 0x52:  1920x1080   60.000000 Hz  16:9     67.500 kHz    148.500000 MHz
    DMT 0x3a:  1680x1050   59.954250 Hz  16:10    65.290 kHz    146.250000 MHz
    DMT 0x15:  1152x864    75.000000 Hz   4:3     67.500 kHz    108.000000 MHz
    DMT 0x33:  1600x1200   60.000000 Hz   4:3     75.000 kHz    162.000000 MHz
    DMT 0x23:  1280x1024   60.019740 Hz   5:4     63.981 kHz    108.000000 MHz
    GTF     :  1200x960    60.000000 Hz   5:4     59.640 kHz     95.424000 MHz
    DMT 0x55:  1280x720    60.000000 Hz  16:9     45.000 kHz     74.250000 MHz
  Detailed Timing Descriptors:
    DTD 1:  2048x1536   59.950902 Hz   4:3     94.543 kHz    208.750000 MHz (512 mm x 384 mm)
                 Hfront   48 Hsync  32 Hback   80 Hpol P
                 Vfront    3 Vsync   5 Vback   33 Vpol N
    DTD 2:  2048x1536   59.980394 Hz   4:3     94.769 kHz    209.250000 MHz (512 mm x 384 mm)
                 Hfront   48 Hsync  32 Hback   80 Hpol P
                 Vfront    3 Vsync   4 Vback   37 Vpol N
    DTD 3:  2048x1536   59.980394 Hz   4:3     94.769 kHz    209.250000 MHz (512 mm x 384 mm)
                 Hfront   48 Hsync  32 Hback   80 Hpol P
                 Vfront    3 Vsync   4 Vback   37 Vpol N
    DTD 4:  2048x1536   59.980394 Hz   4:3     94.769 kHz    209.250000 MHz (512 mm x 384 mm)
                 Hfront   48 Hsync  32 Hback   80 Hpol P
                 Vfront    3 Vsync   4 Vback   37 Vpol N
  Extension blocks: 1
Checksum: 0xe7

----------------

Block 1, CTA-861 Extension Block:
  Revision: 3
  Basic audio support
  Supports YCbCr 4:4:4
  Supports YCbCr 4:2:2
  Native DTDs: 0
  Video Data Block:
    VIC  16:  1920x1080   60.000000 Hz  16:9     67.500 kHz    148.500000 MHz
    VIC   5:  1920x1080i  60.000000 Hz  16:9     33.750 kHz     74.250000 MHz
    VIC   4:  1280x720    60.000000 Hz  16:9     45.000 kHz     74.250000 MHz
    VIC   3:   720x480    59.940060 Hz  16:9     31.469 kHz     27.000000 MHz
    VIC   2:   720x480    59.940060 Hz   4:3     31.469 kHz     27.000000 MHz
    VIC   7:  1440x480i   59.940060 Hz  16:9     15.734 kHz     27.000000 MHz
    VIC  22:  1440x576i   50.000000 Hz  16:9     15.625 kHz     27.000000 MHz
    VIC   1:   640x480    59.940476 Hz   4:3     31.469 kHz     25.175000 MHz
    VIC  20:  1920x1080i  50.000000 Hz  16:9     28.125 kHz     74.250000 MHz
    VIC  31:  1920x1080   50.000000 Hz  16:9     56.250 kHz    148.500000 MHz
    VIC  18:   720x576    50.000000 Hz  16:9     31.250 kHz     27.000000 MHz
    VIC  19:  1280x720    50.000000 Hz  16:9     37.500 kHz     74.250000 MHz
    VIC  32:  1920x1080   24.000000 Hz  16:9     27.000 kHz     74.250000 MHz
    VIC  33:  1920x1080   25.000000 Hz  16:9     28.125 kHz     74.250000 MHz
    VIC  34:  1920x1080   30.000000 Hz  16:9     33.750 kHz     74.250000 MHz
  Audio Data Block:
    Linear PCM:
      Max channels: 2
      Supported sample rates (kHz): 48 44.1 32
      Supported sample sizes (bits): 24 20 16
  Speaker Allocation Data Block:
    FL/FR - Front Left/Right
  Vendor-Specific Data Block (HDMI), OUI 00-0C-03:
    Source physical address: 1.0.0.0
    DC_36bit
    DC_30bit
    DC_Y444
    Maximum TMDS clock: 305 MHz
  Colorimetry Data Block:
    xvYCC601
    xvYCC709
    Gamut Boundary Description Metadata Profile P0
  Vendor-Specific Data Block (HDMI Forum), OUI C4-5D-D8:
    Version: 1
    Maximum TMDS Character Rate: 600 MHz
    SCDC Present
    Supports 10-bits/component Deep Color 4:2:0 Pixel Encoding
    VRRmin: 0 Hz
    VRRmax: 0 Hz
    Supports 10 bpc Compressed Video Transport
  Detailed Timing Descriptors:
    DTD 5:  1920x1080   60.000000 Hz  16:9     67.500 kHz    148.500000 MHz (480 mm x 270 mm)
                 Hfront   88 Hsync  44 Hback  148 Hpol P
                 Vfront    2 Vsync   5 Vback   38 Vpol P
    DTD 6:  1920x1080i  60.000000 Hz  16:9     33.750 kHz     74.250000 MHz (480 mm x 135 mm)
                 Hfront   88 Hsync  44 Hback  148 Hpol P
                 Vfront    2 Vsync   5 Vback   15 Vpol P Vfront +0.5 Odd Field
                 Vfront    2 Vsync   5 Vback   15 Vpol P Vback  +0.5 Even Field
    DTD 7:  1280x720    60.000000 Hz  16:9     45.000 kHz     74.250000 MHz (320 mm x 180 mm)
                 Hfront  110 Hsync  40 Hback  220 Hpol P
                 Vfront    5 Vsync   5 Vback   20 Vpol P
    DTD 8:   720x480    59.940060 Hz   3:2     31.469 kHz     27.000000 MHz (180 mm x 120 mm)
                 Hfront   16 Hsync  62 Hback   60 Hpol N
                 Vfront    9 Vsync   6 Vback   30 Vpol N
Checksum: 0xd1  Unused space in Extension Block: 1 byte

----------------

Warnings:

Block 0, Base EDID:
  Vendor & Product Identification: The serial number is one of the known dummy values, it should probably be set to 0.
Block 1, CTA-861 Extension Block:
  IT Video Formats are overscanned by default, but normally this should be underscanned.
  Video Data Block: VIC 16 and the first DTD are not identical. Is this intended?
  Detailed Timing Descriptor #5: DTD is similar but not identical to VIC 16.
  Detailed Timing Descriptor #6: Image size is 480x135 mm, but based on the picture AR it should be 240x135 mm.

Failures:

Block 0, Base EDID:
  Basic Display Parameters & Features: sRGB is signaled, but the chromaticities do not match.
  Missing Display Product Name.
  Missing Display Range Limits Descriptor.
Block 1, CTA-861 Extension Block:
  Vendor-Specific Data Block (HDMI Forum), OUI C4-5D-D8: HDMI Forum VSDB did not immediately follow the HDMI VSDB.
  Detailed Timing Descriptor #5: Mismatch of image size 480x270 mm vs display size 700x390 mm.
  Detailed Timing Descriptor #6: Mismatch of image size 480x135 mm vs display size 700x390 mm.
  Detailed Timing Descriptor #7: Mismatch of image size 320x180 mm vs display size 700x390 mm.
  Detailed Timing Descriptor #8: Mismatch of image size 180x120 mm vs display size 700x390 mm.
  Missing VCDB, needed for Set Selectable RGB Quantization to avoid interop issues.
EDID:
  Extension Block 2 started with EDID header, ignoring Extension Blocks >= 2.

EDID conformity: FAIL
