edid-decode (hex):

00 ff ff ff ff ff ff 00 05 e3 63 29 b0 00 00 00
2f 19 01 04 a5 43 1c 78 3a ca 95 a6 55 4e a1 26
0f 50 54 bf ef 00 d1 c0 b3 00 95 00 81 80 81 40
81 c0 01 01 01 01 cd 46 00 a0 a0 38 1f 40 30 20
3a 00 a1 1c 21 00 00 1a 00 00 00 fd 00 32 4c 1e
63 1e 01 0a 20 20 20 20 20 20 00 00 00 fc 00 51
32 39 36 33 0a 20 20 20 20 20 20 20 00 00 00 ff
00 41 46 4a 46 42 39 41 30 30 30 31 37 36 01 d2

02 03 1e f1 4b 01 03 05 14 04 13 1f 12 02 11 90
23 09 07 07 83 01 00 00 65 03 0c 00 10 00 02 3a
80 18 71 38 2d 40 58 2c 45 00 a1 1c 21 00 00 1e
01 1d 00 72 51 d0 1e 20 6e 28 55 00 a1 1c 21 00
00 1e 8c 0a d0 8a 20 e0 2d 10 10 3e 96 00 a1 1c
21 00 00 18 8c 0a d0 90 20 40 31 20 0c 40 55 00
a1 1c 21 00 00 18 ec 2c 00 b0 51 38 28 40 50 88
3a 00 a1 1c 21 00 00 1c 00 00 00 00 00 00 00 c8

00 ff ff ff ff ff ff 00 05 e3 63 29 b0 00 00 00
2f 19 01 04 a5 43 1c 78 3a ca 95 a6 55 4e a1 26
0f 50 54 bf ef 00 d1 c0 b3 00 95 00 81 80 81 40
81 c0 01 01 01 01 cd 46 00 a0 a0 38 1f 40 30 20
3a 00 a1 1c 21 00 00 1a 00 00 00 fd 00 32 4c 1e
63 1e 01 0a 20 20 20 20 20 20 00 00 00 fc 00 51
32 39 36 33 0a 20 20 20 20 20 20 20 00 00 00 ff
00 41 46 4a 46 42 39 41 30 30 30 31 37 36 01 d2

02 03 1e f1 4b 01 03 05 14 04 13 1f 12 02 11 90
23 09 07 07 83 01 00 00 65 03 0c 00 10 00 02 3a
80 18 71 38 2d 40 58 2c 45 00 a1 1c 21 00 00 1e
01 1d 00 72 51 d0 1e 20 6e 28 55 00 a1 1c 21 00
00 1e 8c 0a d0 8a 20 e0 2d 10 10 3e 96 00 a1 1c
21 00 00 18 8c 0a d0 90 20 40 31 20 0c 40 55 00
a1 1c 21 00 00 18 ec 2c 00 b0 51 38 28 40 50 88
3a 00 a1 1c 21 00 00 1c 00 00 00 00 00 00 00 c8

----------------

Block 0, Base EDID:
  EDID Structure Version & Revision: 1.4
  Vendor & Product Identification:
    Manufacturer: AOC
    Model: 10595
    Serial Number: ...
    Made in: week 47 of 2015
  Basic Display Parameters & Features:
    Digital display
    Bits per primary color channel: 8
    DisplayPort interface
    Maximum image size: 67 cm x 28 cm
    Gamma: 2.20
    DPMS levels: Off
    Supported color formats: RGB 4:4:4, YCrCb 4:4:4, YCrCb 4:2:2
    First detailed timing includes the native pixel format and preferred refresh rate
  Color Characteristics:
    Red  : 0.6513, 0.3320
    Green: 0.3066, 0.6308
    Blue : 0.1503, 0.0595
    White: 0.3134, 0.3291
  Established Timings I & II:
    IBM     :   720x400    70.081663 Hz   9:5     31.467 kHz     28.320000 MHz
    DMT 0x04:   640x480    59.940476 Hz   4:3     31.469 kHz     25.175000 MHz
    Apple   :   640x480    66.666667 Hz   4:3     35.000 kHz     30.240000 MHz
    DMT 0x05:   640x480    72.808802 Hz   4:3     37.861 kHz     31.500000 MHz
    DMT 0x06:   640x480    75.000000 Hz   4:3     37.500 kHz     31.500000 MHz
    DMT 0x08:   800x600    56.250000 Hz   4:3     35.156 kHz     36.000000 MHz
    DMT 0x09:   800x600    60.316541 Hz   4:3     37.879 kHz     40.000000 MHz
    DMT 0x0a:   800x600    72.187572 Hz   4:3     48.077 kHz     50.000000 MHz
    DMT 0x0b:   800x600    75.000000 Hz   4:3     46.875 kHz     49.500000 MHz
    Apple   :   832x624    74.551266 Hz   4:3     49.726 kHz     57.284000 MHz
    DMT 0x10:  1024x768    60.003840 Hz   4:3     48.363 kHz     65.000000 MHz
    DMT 0x11:  1024x768    70.069359 Hz   4:3     56.476 kHz     75.000000 MHz
    DMT 0x12:  1024x768    75.028582 Hz   4:3     60.023 kHz     78.750000 MHz
    DMT 0x24:  1280x1024   75.024675 Hz   5:4     79.976 kHz    135.000000 MHz
  Standard Timings:
    DMT 0x52:  1920x1080   60.000000 Hz  16:9     67.500 kHz    148.500000 MHz
    DMT 0x3a:  1680x1050   59.954250 Hz  16:10    65.290 kHz    146.250000 MHz
    DMT 0x2f:  1440x900    59.887445 Hz  16:10    55.935 kHz    106.500000 MHz
    DMT 0x23:  1280x1024   60.019740 Hz   5:4     63.981 kHz    108.000000 MHz
    DMT 0x20:  1280x960    60.000000 Hz   4:3     60.000 kHz    108.000000 MHz
    DMT 0x55:  1280x720    60.000000 Hz  16:9     45.000 kHz     74.250000 MHz
  Detailed Timing Descriptors:
    DTD 1:  2560x1080   59.978424 Hz  64:27    66.636 kHz    181.250000 MHz (673 mm x 284 mm)
                 Hfront   48 Hsync  32 Hback   80 Hpol P
                 Vfront    3 Vsync  10 Vback   18 Vpol N
    Display Range Limits:
      Monitor ranges (Range Limits Only): 50-76 Hz V, 30-99 kHz H, max dotclock 300 MHz
    Display Product Name: 'Q2963'
    Display Product Serial Number: ...
  Extension blocks: 1
Checksum: 0xd2

----------------

Block 1, CTA-861 Extension Block:
  Revision: 3
  Underscans IT Video Formats by default
  Basic audio support
  Supports YCbCr 4:4:4
  Supports YCbCr 4:2:2
  Native DTDs: 1
  Video Data Block:
    VIC   1:   640x480    59.940476 Hz   4:3     31.469 kHz     25.175000 MHz
    VIC   3:   720x480    59.940060 Hz  16:9     31.469 kHz     27.000000 MHz
    VIC   5:  1920x1080i  60.000000 Hz  16:9     33.750 kHz     74.250000 MHz
    VIC  20:  1920x1080i  50.000000 Hz  16:9     28.125 kHz     74.250000 MHz
    VIC   4:  1280x720    60.000000 Hz  16:9     45.000 kHz     74.250000 MHz
    VIC  19:  1280x720    50.000000 Hz  16:9     37.500 kHz     74.250000 MHz
    VIC  31:  1920x1080   50.000000 Hz  16:9     56.250 kHz    148.500000 MHz
    VIC  18:   720x576    50.000000 Hz  16:9     31.250 kHz     27.000000 MHz
    VIC   2:   720x480    59.940060 Hz   4:3     31.469 kHz     27.000000 MHz
    VIC  17:   720x576    50.000000 Hz   4:3     31.250 kHz     27.000000 MHz
    VIC  16:  1920x1080   60.000000 Hz  16:9     67.500 kHz    148.500000 MHz (native)
  Audio Data Block:
    Linear PCM:
      Max channels: 2
      Supported sample rates (kHz): 48 44.1 32
      Supported sample sizes (bits): 24 20 16
  Speaker Allocation Data Block:
    FL/FR - Front Left/Right
  Vendor-Specific Data Block (HDMI), OUI 00-0C-03:
    Source physical address: 1.0.0.0
  Detailed Timing Descriptors:
    DTD 2:  1920x1080   60.000000 Hz  16:9     67.500 kHz    148.500000 MHz (673 mm x 284 mm)
                 Hfront   88 Hsync  44 Hback  148 Hpol P
                 Vfront    4 Vsync   5 Vback   36 Vpol P
    DTD 3:  1280x720    60.000000 Hz  16:9     45.000 kHz     74.250000 MHz (673 mm x 284 mm)
                 Hfront  110 Hsync  40 Hback  220 Hpol P
                 Vfront    5 Vsync   5 Vback   20 Vpol P
    DTD 4:   720x480    59.940060 Hz   3:2     31.469 kHz     27.000000 MHz (673 mm x 284 mm)
                 Hfront   16 Hsync  62 Hback   60 Hpol N
                 Vfront    9 Vsync   6 Vback   30 Vpol N
    DTD 5:   720x576    50.000000 Hz   5:4     31.250 kHz     27.000000 MHz (673 mm x 284 mm)
                 Hfront   12 Hsync  64 Hback   68 Hpol N
                 Vfront    5 Vsync   5 Vback   39 Vpol N
    DTD 6:  1280x1080   59.975801 Hz  32:27    67.173 kHz    115.000000 MHz (673 mm x 284 mm)
                 Hfront   80 Hsync 136 Hback  216 Hpol N
                 Vfront    3 Vsync  10 Vback   27 Vpol P
Checksum: 0xc8  Unused space in Extension Block: 7 bytes

----------------

Warnings:

Block 1, CTA-861 Extension Block:
  Video Data Block: VIC 1 and the first DTD are not identical. Is this intended?
  Detailed Timing Descriptor #2: Image size is 673x284 mm, but based on the picture AR it should be 504x284 mm.
  Detailed Timing Descriptor #3: Image size is 673x284 mm, but based on the picture AR it should be 504x284 mm.
  Detailed Timing Descriptor #4: Image size is 673x284 mm, but based on the picture AR it should be 426x284 mm.
  Detailed Timing Descriptor #5: Image size is 673x284 mm, but based on the picture AR it should be 355x284 mm.
  Detailed Timing Descriptor #6: Image size is 673x284 mm, but based on the picture AR it should be 336x284 mm.
  Display Product Serial Number is set, so the Serial Number in the Base EDID should be 0.
  Add a Colorimetry Data Block with the sRGB colorimetry bit set to avoid interop issues.
EDID:
  Base EDID: Some timings are out of range of the Monitor Ranges:
    Horizontal Freq: 28.125 - 79.976 kHz (Monitor: 30.000 - 99.000 kHz)

Failures:

Block 1, CTA-861 Extension Block:
  Vendor-Specific Data Block (HDMI), OUI 00-0C-03: The HDMI Specification requires EDID 1.3 instead of 1.4.
  Missing VCDB, needed for Set Selectable RGB Quantization to avoid interop issues.
EDID:
  Extension Block 2 started with EDID header, ignoring Extension Blocks >= 2.
  CTA-861: Native progressive timings are a mix of several resolutions.

EDID conformity: FAIL
