edid-decode (hex):

00 ff ff ff ff ff ff 00 5a 63 3f 52 01 01 01 01
26 21 01 03 80 35 1e 78 2e b3 25 a7 53 4c 9b 25
0c 50 54 bf ef 80 b3 00 a9 40 a9 c0 95 00 90 40
81 80 81 40 81 c0 1a 36 80 a0 70 38 1f 40 30 20
35 00 0f 28 21 00 00 1a 00 00 00 ff 00 58 47 4a
32 33 33 38 30 30 35 33 31 0a 00 00 00 fd 00 30
64 1e 73 18 00 0a 20 20 20 20 20 20 00 00 00 fc
00 56 41 32 34 33 36 2d 46 48 44 0a 20 20 01 ee

02 03 2e f1 4d 90 05 04 03 02 12 11 13 14 1e 1d
1f 01 23 09 7f 07 83 01 00 00 67 03 0c 00 10 00
38 30 68 1a 00 00 01 01 30 64 e6 e2 00 ca 02 3a
80 18 71 38 2d 40 58 2c 45 00 0f 28 21 00 00 1e
60 59 80 a0 70 38 14 40 30 20 35 00 0f 28 21 00
00 1a 01 1d 00 72 51 d0 1e 20 6e 28 55 00 0f 28
21 00 50 1e 2a 44 80 a0 70 38 27 40 30 20 35 00
0f 28 21 00 00 1a 00 00 00 00 00 00 00 00 00 55

00 ff ff ff ff ff ff 00 5a 63 3f 52 01 01 01 01
26 21 01 03 80 35 1e 78 2e b3 25 a7 53 4c 9b 25
0c 50 54 bf ef 80 b3 00 a9 40 a9 c0 95 00 90 40
81 80 81 40 81 c0 1a 36 80 a0 70 38 1f 40 30 20
35 00 0f 28 21 00 00 1a 00 00 00 ff 00 58 47 4a
32 33 33 38 30 30 35 33 31 0a 00 00 00 fd 00 30
64 1e 73 18 00 0a 20 20 20 20 20 20 00 00 00 fc
00 56 41 32 34 33 36 2d 46 48 44 0a 20 20 01 ee

02 03 2e f1 4d 90 05 04 03 02 12 11 13 14 1e 1d
1f 01 23 09 7f 07 83 01 00 00 67 03 0c 00 10 00
38 30 68 1a 00 00 01 01 30 64 e6 e2 00 ca 02 3a
80 18 71 38 2d 40 58 2c 45 00 0f 28 21 00 00 1e
60 59 80 a0 70 38 14 40 30 20 35 00 0f 28 21 00
00 1a 01 1d 00 72 51 d0 1e 20 6e 28 55 00 0f 28
21 00 50 1e 2a 44 80 a0 70 38 27 40 30 20 35 00
0f 28 21 00 00 1a 00 00 00 00 00 00 00 00 00 55

----------------

Block 0, Base EDID:
  EDID Structure Version & Revision: 1.3
  Vendor & Product Identification:
    Manufacturer: VSC
    Model: 21055
    Serial Number: ...
    Made in: week 38 of 2023
  Basic Display Parameters & Features:
    Digital display
    Maximum image size: 53 cm x 30 cm
    Gamma: 2.20
    DPMS levels: Off
    RGB color display
    Default (sRGB) color space is primary color space
    First detailed timing is the preferred timing
  Color Characteristics:
    Red  : 0.6542, 0.3271
    Green: 0.2968, 0.6083
    Blue : 0.1445, 0.0488
    White: 0.3134, 0.3291
  Established Timings I & II:
    IBM     :   720x400    70.081663 Hz   9:5     31.467 kHz     28.320000 MHz
    DMT 0x04:   640x480    59.940476 Hz   4:3     31.469 kHz     25.175000 MHz
    Apple   :   640x480    66.666667 Hz   4:3     35.000 kHz     30.240000 MHz
    DMT 0x05:   640x480    72.808802 Hz   4:3     37.861 kHz     31.500000 MHz
    DMT 0x06:   640x480    75.000000 Hz   4:3     37.500 kHz     31.500000 MHz
    DMT 0x08:   800x600    56.250000 Hz   4:3     35.156 kHz     36.000000 MHz
    DMT 0x09:   800x600    60.316541 Hz   4:3     37.879 kHz     40.000000 MHz
    DMT 0x0a:   800x600    72.187572 Hz   4:3     48.077 kHz     50.000000 MHz
    DMT 0x0b:   800x600    75.000000 Hz   4:3     46.875 kHz     49.500000 MHz
    Apple   :   832x624    74.551266 Hz   4:3     49.726 kHz     57.284000 MHz
    DMT 0x10:  1024x768    60.003840 Hz   4:3     48.363 kHz     65.000000 MHz
    DMT 0x11:  1024x768    70.069359 Hz   4:3     56.476 kHz     75.000000 MHz
    DMT 0x12:  1024x768    75.028582 Hz   4:3     60.023 kHz     78.750000 MHz
    DMT 0x24:  1280x1024   75.024675 Hz   5:4     79.976 kHz    135.000000 MHz
    Apple   :  1152x870    75.061550 Hz 192:145   68.681 kHz    100.000000 MHz
  Standard Timings:
    DMT 0x3a:  1680x1050   59.954250 Hz  16:10    65.290 kHz    146.250000 MHz
    DMT 0x33:  1600x1200   60.000000 Hz   4:3     75.000 kHz    162.000000 MHz
    DMT 0x53:  1600x900    60.000000 Hz  16:9     60.000 kHz    108.000000 MHz (RB)
    DMT 0x2f:  1440x900    59.887445 Hz  16:10    55.935 kHz    106.500000 MHz
    DMT 0x2a:  1400x1050   59.978442 Hz   4:3     65.317 kHz    121.750000 MHz
    DMT 0x23:  1280x1024   60.019740 Hz   5:4     63.981 kHz    108.000000 MHz
    DMT 0x20:  1280x960    60.000000 Hz   4:3     60.000 kHz    108.000000 MHz
    DMT 0x55:  1280x720    60.000000 Hz  16:9     45.000 kHz     74.250000 MHz
  Detailed Timing Descriptors:
    DTD 1:  1920x1080   59.933878 Hz  16:9     66.587 kHz    138.500000 MHz (527 mm x 296 mm)
                 Hfront   48 Hsync  32 Hback   80 Hpol P
                 Vfront    3 Vsync   5 Vback   23 Vpol N
    Display Product Serial Number: ...
    Display Range Limits:
      Monitor ranges (GTF): 48-100 Hz V, 30-115 kHz H, max dotclock 240 MHz
    Display Product Name: 'VA2436-FHD'
  Extension blocks: 1
Checksum: 0xee

----------------

Block 1, CTA-861 Extension Block:
  Revision: 3
  Underscans IT Video Formats by default
  Basic audio support
  Supports YCbCr 4:4:4
  Supports YCbCr 4:2:2
  Native DTDs: 1
  Video Data Block:
    VIC  16:  1920x1080   60.000000 Hz  16:9     67.500 kHz    148.500000 MHz (native)
    VIC   5:  1920x1080i  60.000000 Hz  16:9     33.750 kHz     74.250000 MHz
    VIC   4:  1280x720    60.000000 Hz  16:9     45.000 kHz     74.250000 MHz
    VIC   3:   720x480    59.940060 Hz  16:9     31.469 kHz     27.000000 MHz
    VIC   2:   720x480    59.940060 Hz   4:3     31.469 kHz     27.000000 MHz
    VIC  18:   720x576    50.000000 Hz  16:9     31.250 kHz     27.000000 MHz
    VIC  17:   720x576    50.000000 Hz   4:3     31.250 kHz     27.000000 MHz
    VIC  19:  1280x720    50.000000 Hz  16:9     37.500 kHz     74.250000 MHz
    VIC  20:  1920x1080i  50.000000 Hz  16:9     28.125 kHz     74.250000 MHz
    VIC  30:  1440x576    50.000000 Hz  16:9     31.250 kHz     54.000000 MHz
    VIC  29:  1440x576    50.000000 Hz   4:3     31.250 kHz     54.000000 MHz
    VIC  31:  1920x1080   50.000000 Hz  16:9     56.250 kHz    148.500000 MHz
    VIC   1:   640x480    59.940476 Hz   4:3     31.469 kHz     25.175000 MHz
  Audio Data Block:
    Linear PCM:
      Max channels: 2
      Supported sample rates (kHz): 192 176.4 96 88.2 48 44.1 32
      Supported sample sizes (bits): 24 20 16
  Speaker Allocation Data Block:
    FL/FR - Front Left/Right
  Vendor-Specific Data Block (HDMI), OUI 00-0C-03:
    Source physical address: 1.0.0.0
    DC_36bit
    DC_30bit
    DC_Y444
    Maximum TMDS clock: 240 MHz
  Vendor-Specific Data Block (AMD), OUI 00-00-1A:
    Version: 1
    Flags 1: 0x01
      FreeSync Supported
    Minimum Refresh Rate: 48 Hz
    Maximum Refresh Rate: 100 Hz
    MCCS VCP Code: 0xe6
  Video Capability Data Block:
    YCbCr quantization: Selectable (via AVI YQ)
    RGB quantization: Selectable (via AVI Q)
    PT scan behavior: No Data
    IT scan behavior: Always Underscanned
    CE scan behavior: Always Underscanned
  Detailed Timing Descriptors:
    DTD 2:  1920x1080   60.000000 Hz  16:9     67.500 kHz    148.500000 MHz (527 mm x 296 mm)
                 Hfront   88 Hsync  44 Hback  148 Hpol P
                 Vfront    4 Vsync   5 Vback   36 Vpol P
    DTD 3:  1920x1080  100.000000 Hz  16:9    110.000 kHz    228.800000 MHz (527 mm x 296 mm)
                 Hfront   48 Hsync  32 Hback   80 Hpol P
                 Vfront    3 Vsync   5 Vback   12 Vpol N
    DTD 4:  1280x720    60.000000 Hz  16:9     45.000 kHz     74.250000 MHz (527 mm x 296 mm)
                 Hfront  110 Hsync  40 Hback  220 Hpol P
                 Vfront    5 Vsync   5 Vback -140 Vpol P Vborder 80
    DTD 5:  1920x1080   74.972503 Hz  16:9     83.894 kHz    174.500000 MHz (527 mm x 296 mm)
                 Hfront   48 Hsync  32 Hback   80 Hpol P
                 Vfront    3 Vsync   5 Vback   31 Vpol N
Checksum: 0x55  Unused space in Extension Block: 9 bytes

----------------

Warnings:

Block 0, Base EDID:
  Vendor & Product Identification: The serial number is one of the known dummy values, it should probably be set to 0.
Block 1, CTA-861 Extension Block:
  Video Data Block: VIC 16 and the first DTD are not identical. Is this intended?
  Detailed Timing Descriptor #4: The use of non-zero borders in a DTD is not recommended.
  Display Product Serial Number is set, so the Serial Number in the Base EDID should be 0.
EDID:
  Base EDID: Some timings are out of range of the Monitor Ranges:
    Horizontal Freq: 28.125 - 110.000 kHz (Monitor: 30.000 - 115.000 kHz)

Failures:

Block 0, Base EDID:
  Basic Display Parameters & Features: sRGB is signaled, but the chromaticities do not match.
Block 1, CTA-861 Extension Block:
  Detailed Timing Descriptor #4: 0 or negative vertical back porch.
EDID:
  Extension Block 2 started with EDID header, ignoring Extension Blocks >= 2.

EDID conformity: FAIL
