edid-decode (hex):

00 ff ff ff ff ff ff 00 4d d9 00 33 01 01 01 01
1e 0f 01 03 08 00 00 78 0a d9 ad a3 55 46 98 24
10 47 4a ad c8 00 61 4f 01 01 01 01 01 01 01 01
01 01 01 01 01 01 64 19 00 40 41 00 26 30 1d 88
36 00 00 00 00 00 00 18 0e 1f 00 80 51 00 1e 30
40 80 37 00 00 00 00 00 00 1c 00 00 00 fd 00 3a
3e 1e 32 08 00 0a 20 20 20 20 20 20 00 00 00 fc
00 4b 4c 56 2d 53 32 33 41 31 30 0a 20 20 00 a3

00 ff ff ff ff ff ff 00 4d d9 00 33 01 01 01 01
1e 0f 01 03 08 00 00 78 0a d9 ad a3 55 46 98 24
10 47 4a ad c8 00 61 4f 01 01 01 01 01 01 01 01
01 01 01 01 01 01 64 19 00 40 41 00 26 30 1d 88
36 00 00 00 00 00 00 18 0e 1f 00 80 51 00 1e 30
40 80 37 00 00 00 00 00 00 1c 00 00 00 fd 00 3a
3e 1e 32 08 00 0a 20 20 20 20 20 20 00 00 00 fc
00 4b 4c 56 2d 53 32 33 41 31 30 0a 20 20 00 a3

----------------

Block 0, Base EDID:
  EDID Structure Version & Revision: 1.3
  Vendor & Product Identification:
    Manufacturer: SNY
    Model: 13056
    Serial Number: ...
    Made in: week 30 of 2005
  Basic Display Parameters & Features:
    Analog display
    Signal Level Standard: 0.700 : 0.300 : 1.000 V p-p
    Blank level equals black level
    Sync: Separate
    Image size is variable
    Gamma: 2.20
    RGB color display
    First detailed timing is the preferred timing
  Color Characteristics:
    Red  : 0.6396, 0.3330
    Green: 0.2753, 0.5947
    Blue : 0.1425, 0.0644
    White: 0.2802, 0.2900
  Established Timings I & II:
    IBM     :   720x400    70.081663 Hz   9:5     31.467 kHz     28.320000 MHz
    DMT 0x04:   640x480    59.940476 Hz   4:3     31.469 kHz     25.175000 MHz
    DMT 0x05:   640x480    72.808802 Hz   4:3     37.861 kHz     31.500000 MHz
    DMT 0x06:   640x480    75.000000 Hz   4:3     37.500 kHz     31.500000 MHz
    DMT 0x09:   800x600    60.316541 Hz   4:3     37.879 kHz     40.000000 MHz
    DMT 0x0a:   800x600    72.187572 Hz   4:3     48.077 kHz     50.000000 MHz
    DMT 0x0b:   800x600    75.000000 Hz   4:3     46.875 kHz     49.500000 MHz
    DMT 0x10:  1024x768    60.003840 Hz   4:3     48.363 kHz     65.000000 MHz
  Standard Timings:
    DMT 0x12:  1024x768    75.028582 Hz   4:3     60.023 kHz     78.750000 MHz
  Detailed Timing Descriptors:
    DTD 1:  1024x768    60.003840 Hz   4:3     48.363 kHz     65.000000 MHz
                 Hfront   29 Hsync 136 Hback  155 Hpol N
                 Vfront    3 Vsync   6 Vback   29 Vpol N
    DTD 2:  1280x768    59.870228 Hz   5:3     47.776 kHz     79.500000 MHz
                 Hfront   64 Hsync 128 Hback  192 Hpol N
                 Vfront    3 Vsync   7 Vback   20 Vpol P
    Display Range Limits:
      Monitor ranges (GTF): 58-62 Hz V, 30-50 kHz H, max dotclock 80 MHz
    Display Product Name: 'KLV-S23A10'
Checksum: 0xa3

----------------

Block 1, Unknown EDID Extension Block 0x00:
  00 ff ff ff ff ff ff 00 4d d9 00 33 01 01 01 01 '........M..3....'
  1e 0f 01 03 08 00 00 78 0a d9 ad a3 55 46 98 24 '.......x....UF.$'
  10 47 4a ad c8 00 61 4f 01 01 01 01 01 01 01 01 '.GJ...aO........'
  01 01 01 01 01 01 64 19 00 40 41 00 26 30 1d 88 '......d..@A.&0..'
  36 00 00 00 00 00 00 18 0e 1f 00 80 51 00 1e 30 '6...........Q..0'
  40 80 37 00 00 00 00 00 00 1c 00 00 00 fd 00 3a '@.7............:'
  3e 1e 32 08 00 0a 20 20 20 20 20 20 00 00 00 fc '>.2...      ....'
  00 4b 4c 56 2d 53 32 33 41 31 30 0a 20 20 00 a3 '.KLV-S23A10.  ..'
Checksum: 0xa3

----------------

Warnings:

Block 0, Base EDID:
  Vendor & Product Identification: The serial number is one of the known dummy values, it should probably be set to 0.
  Detailed Timing Descriptor #1: DTD is similar but not identical to DMT 0x10.
EDID:
  Base EDID: Some timings are out of range of the Monitor Ranges:
    Vertical Freq: 59.870 - 75.029 Hz (Monitor: 58.000 - 62.000 Hz)
    Horizontal Freq: 31.466 - 60.022 kHz (Monitor: 30.000 - 50.000 kHz)

Failures:

Block 1, Base EDID:
  Unknown Extension Block.
EDID:
  Base EDID: EDID specified 0 extension block(s), but found 1 extension block(s).

EDID conformity: FAIL
