edid-decode (hex):

00 ff ff ff ff ff ff 00 09 e5 e7 0a 00 00 00 00
1b 1f 01 04 a5 21 12 78 02 c4 17 a3 55 4d 9b 26
0f 4b 4f 00 00 00 01 01 01 01 01 01 01 01 01 01
01 01 01 01 01 01 02 3a 80 18 71 38 2d 40 30 20
36 00 4c ba 10 00 00 1a 00 00 00 00 00 00 00 00
00 00 00 00 00 00 00 00 00 1a 00 00 00 fe 00 42
4f 45 20 43 51 0a 20 20 20 20 20 20 00 00 00 fe
00 51 56 31 35 36 46 48 42 2d 4e 38 31 0a 00 f1

00 ff ff ff ff ff ff 00 09 e5 e7 0a 00 00 00 00
1b 1f 01 04 a5 21 12 78 02 c4 17 a3 55 4d 9b 26
0f 4b 4f 00 00 00 01 01 01 01 01 01 01 01 01 01
01 01 01 01 01 01 02 3a 80 18 71 38 2d 40 30 20
36 00 4c ba 10 00 00 1a 00 00 00 00 00 00 00 00
00 00 00 00 00 00 00 00 00 1a 00 00 00 fe 00 42
4f 45 20 43 51 0a 20 20 20 20 20 20 00 00 00 fe
00 51 56 31 35 36 46 48 42 2d 4e 38 31 0a 00 f1

----------------

Block 0, Base EDID:
  EDID Structure Version & Revision: 1.4
  Vendor & Product Identification:
    Manufacturer: BOE
    Model: 2791
    Made in: week 27 of 2021
  Basic Display Parameters & Features:
    Digital display
    Bits per primary color channel: 8
    DisplayPort interface
    Maximum image size: 33 cm x 18 cm
    Gamma: 2.20
    Supported color formats: RGB 4:4:4
    First detailed timing includes the native pixel format and preferred refresh rate
  Color Characteristics:
    Red  : 0.6396, 0.3320
    Green: 0.3017, 0.6054
    Blue : 0.1484, 0.0595
    White: 0.2939, 0.3115
  Established Timings I & II: none
  Standard Timings: none
  Detailed Timing Descriptors:
    DTD 1:  1920x1080   60.000000 Hz  16:9     67.500 kHz    148.500000 MHz (332 mm x 186 mm)
                 Hfront   48 Hsync  32 Hback  200 Hpol P
                 Vfront    3 Vsync   6 Vback   36 Vpol N
    Manufacturer-Specified Display Descriptor (0x00): 00 00 00 00 00 00 00 00 00 00 00 00 00 00 00 1a '................'
    Alphanumeric Data String: 'BOE CQ'
    Alphanumeric Data String: 'QV156FHB-N81'
Checksum: 0xf1

----------------

Warnings:

Block 0, Base EDID:
  Detailed Timing Descriptor #1: DTD is similar but not identical to VIC 16.
  Missing Display Product Name.

Failures:

EDID:
  Extension Block 1 started with EDID header, ignoring Extension Blocks >= 1.

EDID conformity: FAIL
