edid-decode (hex):

00 ff ff ff ff ff ff 00 30 ae 51 11 01 01 01 01
2c 12 01 03 80 2f 1e 78 ee e6 85 a8 50 35 ac 25
14 50 54 ad cf 00 81 80 90 40 95 00 95 0f b3 00
a9 40 d1 c0 01 01 28 3c 80 a0 70 b0 23 40 30 20
36 00 da 28 11 00 00 1a 00 00 00 fd 00 32 4b 1e
4b 11 00 0a 20 20 20 20 20 20 00 00 00 fc 00 4c
45 4e 20 4c 32 32 30 78 77 43 0a 20 00 00 00 ff
00 56 4c 2d 36 39 31 38 32 0a 20 20 20 20 00 66

00 ff ff ff ff ff ff 00 30 ae 51 11 01 01 01 01
2c 12 01 03 80 2f 1e 78 ee e6 85 a8 50 35 ac 25
14 50 54 ad cf 00 81 80 90 40 95 00 95 0f b3 00
a9 40 d1 c0 01 01 28 3c 80 a0 70 b0 23 40 30 20
36 00 da 28 11 00 00 1a 00 00 00 fd 00 32 4b 1e
4b 11 00 0a 20 20 20 20 20 20 00 00 00 fc 00 4c
45 4e 20 4c 32 32 30 78 77 43 0a 20 00 00 00 ff
00 56 4c 2d 36 39 31 38 32 0a 20 20 20 20 00 66

----------------

Block 0, Base EDID:
  EDID Structure Version & Revision: 1.3
  Vendor & Product Identification:
    Manufacturer: LEN
    Model: 4433
    Serial Number: ...
    Made in: week 44 of 2008
  Basic Display Parameters & Features:
    Digital display
    Maximum image size: 47 cm x 30 cm
    Gamma: 2.20
    DPMS levels: Standby Suspend Off
    RGB color display
    Default (sRGB) color space is primary color space
    First detailed timing is the preferred timing
  Color Characteristics:
    Red  : 0.6591, 0.3144
    Green: 0.2080, 0.6738
    Blue : 0.1464, 0.0781
    White: 0.3134, 0.3291
  Established Timings I & II:
    IBM     :   720x400    70.081663 Hz   9:5     31.467 kHz     28.320000 MHz
    DMT 0x04:   640x480    59.940476 Hz   4:3     31.469 kHz     25.175000 MHz
    DMT 0x05:   640x480    72.808802 Hz   4:3     37.861 kHz     31.500000 MHz
    DMT 0x06:   640x480    75.000000 Hz   4:3     37.500 kHz     31.500000 MHz
    DMT 0x09:   800x600    60.316541 Hz   4:3     37.879 kHz     40.000000 MHz
    DMT 0x0a:   800x600    72.187572 Hz   4:3     48.077 kHz     50.000000 MHz
    DMT 0x0b:   800x600    75.000000 Hz   4:3     46.875 kHz     49.500000 MHz
    DMT 0x10:  1024x768    60.003840 Hz   4:3     48.363 kHz     65.000000 MHz
    DMT 0x11:  1024x768    70.069359 Hz   4:3     56.476 kHz     75.000000 MHz
    DMT 0x12:  1024x768    75.028582 Hz   4:3     60.023 kHz     78.750000 MHz
    DMT 0x24:  1280x1024   75.024675 Hz   5:4     79.976 kHz    135.000000 MHz
  Standard Timings:
    DMT 0x23:  1280x1024   60.019740 Hz   5:4     63.981 kHz    108.000000 MHz
    DMT 0x2a:  1400x1050   59.978442 Hz   4:3     65.317 kHz    121.750000 MHz
    DMT 0x2f:  1440x900    59.887445 Hz  16:10    55.935 kHz    106.500000 MHz
    DMT 0x30:  1440x900    74.984427 Hz  16:10    70.635 kHz    136.750000 MHz
    DMT 0x3a:  1680x1050   59.954250 Hz  16:10    65.290 kHz    146.250000 MHz
    DMT 0x33:  1600x1200   60.000000 Hz   4:3     75.000 kHz    162.000000 MHz
    DMT 0x52:  1920x1080   60.000000 Hz  16:9     67.500 kHz    148.500000 MHz
  Detailed Timing Descriptors:
    DTD 1:  1920x1200   59.950171 Hz  16:10    74.038 kHz    154.000000 MHz (474 mm x 296 mm)
                 Hfront   48 Hsync  32 Hback   80 Hpol P
                 Vfront    3 Vsync   6 Vback   26 Vpol N
    Display Range Limits:
      Monitor ranges (GTF): 50-75 Hz V, 30-75 kHz H, max dotclock 170 MHz
    Display Product Name: 'LEN L220xwC'
    Display Product Serial Number: ...
Checksum: 0x66

----------------

Warnings:

Block 0, Base EDID:
  Vendor & Product Identification: The serial number is one of the known dummy values, it should probably be set to 0.
EDID:
  Base EDID: Some timings are out of range of the Monitor Ranges:
    Horizontal Freq: 31.466 - 79.976 kHz (Monitor: 30.000 - 75.000 kHz)

Failures:

Block 0, Base EDID:
  Basic Display Parameters & Features: sRGB is signaled, but the chromaticities do not match.
EDID:
  Extension Block 1 started with EDID header, ignoring Extension Blocks >= 1.

EDID conformity: FAIL
