edid-decode (hex):

00 ff ff ff ff ff ff 00 0e d4 03 00 a9 90 02 00
0f 10 01 03 08 00 00 00 01 ee 95 a3 54 4c 99 26
0f 50 54 ad cf 00 81 80 01 01 01 01 01 01 01 01
01 01 01 01 01 01 6c 39 90 30 62 1a 27 40 68 b0
36 00 00 00 00 00 00 00 00 00 00 10 00 1a 31 40
78 b0 36 00 00 00 00 00 00 00 00 00 00 10 00 1a
31 40 78 b0 36 00 00 00 00 00 00 00 00 00 00 fe
00 43 56 54 45 31 36 38 30 2a 31 30 35 30 00 80

00 ff ff ff ff ff ff 00 0e d4 03 00 a9 90 02 00
0f 10 01 03 08 00 00 00 01 ee 95 a3 54 4c 99 26
0f 50 54 ad cf 00 81 80 01 01 01 01 01 01 01 01
01 01 01 01 01 01 6c 39 90 30 62 1a 27 40 68 b0
36 00 00 00 00 00 00 00 00 00 00 10 00 1a 31 40
78 b0 36 00 00 00 00 00 00 00 00 00 00 10 00 1a
31 40 78 b0 36 00 00 00 00 00 00 00 00 00 00 fe
00 43 56 54 45 31 36 38 30 2a 31 30 35 30 00 80

----------------

Block 0, Base EDID:
  EDID Structure Version & Revision: 1.3
  Vendor & Product Identification:
    Manufacturer: CVT
    Model: 3
    Serial Number: ...
    Made in: week 15 of 2006
  Basic Display Parameters & Features:
    Analog display
    Signal Level Standard: 0.700 : 0.300 : 1.000 V p-p
    Blank level equals black level
    Sync: Separate
    Image size is variable
    Gamma: 1.00
    Monochrome or grayscale display
    Supports GTF timings within operating range
  Color Characteristics:
    Red  : 0.6396, 0.3300
    Green: 0.2998, 0.5996
    Blue : 0.1503, 0.0595
    White: 0.3134, 0.3291
  Established Timings I & II:
    IBM     :   720x400    70.081663 Hz   9:5     31.467 kHz     28.320000 MHz
    DMT 0x04:   640x480    59.940476 Hz   4:3     31.469 kHz     25.175000 MHz
    DMT 0x05:   640x480    72.808802 Hz   4:3     37.861 kHz     31.500000 MHz
    DMT 0x06:   640x480    75.000000 Hz   4:3     37.500 kHz     31.500000 MHz
    DMT 0x09:   800x600    60.316541 Hz   4:3     37.879 kHz     40.000000 MHz
    DMT 0x0a:   800x600    72.187572 Hz   4:3     48.077 kHz     50.000000 MHz
    DMT 0x0b:   800x600    75.000000 Hz   4:3     46.875 kHz     49.500000 MHz
    DMT 0x10:  1024x768    60.003840 Hz   4:3     48.363 kHz     65.000000 MHz
    DMT 0x11:  1024x768    70.069359 Hz   4:3     56.476 kHz     75.000000 MHz
    DMT 0x12:  1024x768    75.028582 Hz   4:3     60.023 kHz     78.750000 MHz
    DMT 0x24:  1280x1024   75.024675 Hz   5:4     79.976 kHz    135.000000 MHz
  Standard Timings:
    DMT 0x23:  1280x1024   60.019740 Hz   5:4     63.981 kHz    108.000000 MHz
  Detailed Timing Descriptors:
    DTD 1:  1680x1050   60.261708 Hz  16:10    65.625 kHz    147.000000 MHz (analog composite, sync-on-green)
                 Hfront  104 Hsync 176 Hback  280 Hpol N
                 Vfront    3 Vsync   6 Vback   30 Vpol N
    Dummy Descriptor:
    Dummy Descriptor:
    Alphanumeric Data String: 'CVTE1680*1050'
Checksum: 0x80

----------------

Failures:

Block 0, Base EDID:
  Basic Display Parameters & Features: EDID 1.3 requires that the first detailed timing is the preferred timing.
  Dummy Descriptor: Dummy block filled with garbage.
  Dummy Descriptor: Dummy block filled with garbage.
  Missing Display Product Name.
  Missing Display Range Limits Descriptor.
EDID:
  Extension Block 1 started with EDID header, ignoring Extension Blocks >= 1.

EDID conformity: FAIL
