edid-decode (hex):

00 ff ff ff ff ff ff 00 22 64 ec 03 87 02 00 00
21 15 01 03 80 16 0e 78 0a 88 65 92 58 51 8a 28
1b 50 54 00 00 00 01 01 01 01 01 01 01 01 01 01
01 01 01 01 01 01 c6 1b 00 a0 50 20 17 30 0e 20
36 00 d9 88 00 00 00 19 00 00 00 fe 00 00 00 00
00 00 00 00 00 00 00 00 00 00 00 00 00 fc 00 48
53 44 31 30 31 50 57 57 31 41 0a 20 00 00 00 10
00 0a 20 20 20 20 20 20 20 20 20 20 20 20 00 4a

----------------

Block 0, Base EDID:
  EDID Structure Version & Revision: 1.3
  Vendor & Product Identification:
    Manufacturer: HSD
    Model: 1004
    Serial Number: ...
    Made in: week 33 of 2011
  Basic Display Parameters & Features:
    Digital display
    Maximum image size: 22 cm x 14 cm
    Gamma: 2.20
    RGB color display
    First detailed timing is the preferred timing
  Color Characteristics:
    Red  : 0.5722, 0.3437
    Green: 0.3183, 0.5390
    Blue : 0.1572, 0.1074
    White: 0.3134, 0.3291
  Established Timings I & II: none
  Standard Timings: none
  Detailed Timing Descriptors:
    DTD 1:  1280x800    59.993925 Hz  16:10    49.375 kHz     71.100000 MHz (217 mm x 136 mm)
                 Hfront   14 Hsync  32 Hback  114 Hpol N
                 Vfront    3 Vsync   6 Vback   14 Vpol N
    Alphanumeric Data String: ''
    Display Product Name: 'HSD101PWW1A'
    Dummy Descriptor:
Checksum: 0x4a

----------------

Failures:

Block 0, Base EDID:
  Alphanumeric Data String: NUL byte at position 0.
  Dummy Descriptor: Dummy block filled with garbage.
  Missing Display Range Limits Descriptor.

EDID conformity: FAIL
