edid-decode (hex):

00 ff ff ff ff ff ff 00 09 e5 d9 0a 00 00 00 00
01 1f 01 04 a5 22 13 78 02 21 10 98 5c 57 8c 28
1b 4e 53 00 00 00 01 01 01 01 01 01 01 01 01 01
01 01 01 01 01 01 b9 37 80 dc 70 38 1f 40 30 20
35 00 58 c2 10 00 00 1a 00 00 00 00 00 00 00 00
00 00 00 00 00 00 00 00 00 1a 00 00 00 fe 00 42
4f 45 20 31 38 0a 20 20 20 20 20 20 00 00 00 fe
00 4e 45 31 35 36 46 48 4d 2d 4e 53 30 0a 00 53

00 ff ff ff ff ff ff 00 09 e5 d9 0a 00 00 00 00
01 1f 01 04 a5 22 13 78 02 21 10 98 5c 57 8c 28
1b 4e 53 00 00 00 01 01 01 01 01 01 01 01 01 01
01 01 01 01 01 01 b9 37 80 dc 70 38 1f 40 30 20
35 00 58 c2 10 00 00 1a 00 00 00 00 00 00 00 00
00 00 00 00 00 00 00 00 00 1a 00 00 00 fe 00 42
4f 45 20 31 38 0a 20 20 20 20 20 20 00 00 00 fe
00 4e 45 31 35 36 46 48 4d 2d 4e 53 30 0a 00 53

----------------

Block 0, Base EDID:
  EDID Structure Version & Revision: 1.4
  Vendor & Product Identification:
    Manufacturer: BOE
    Model: 2777
    Made in: week 1 of 2021
  Basic Display Parameters & Features:
    Digital display
    Bits per primary color channel: 8
    DisplayPort interface
    Maximum image size: 34 cm x 19 cm
    Gamma: 2.20
    Supported color formats: RGB 4:4:4
    First detailed timing includes the native pixel format and preferred refresh rate
  Color Characteristics:
    Red  : 0.5937, 0.3613
    Green: 0.3398, 0.5478
    Blue : 0.1562, 0.1064
    White: 0.3046, 0.3242
  Established Timings I & II: none
  Standard Timings: none
  Detailed Timing Descriptors:
    DTD 1:  1920x1080   59.998991 Hz  16:9     66.659 kHz    142.650000 MHz (344 mm x 194 mm)
                 Hfront   48 Hsync  32 Hback  140 Hpol P
                 Vfront    3 Vsync   5 Vback   23 Vpol N
    Manufacturer-Specified Display Descriptor (0x00): 00 00 00 00 00 00 00 00 00 00 00 00 00 00 00 1a '................'
    Alphanumeric Data String: 'BOE 18'
    Alphanumeric Data String: 'NE156FHM-NS0'
Checksum: 0x53

----------------

Warnings:

Block 0, Base EDID:
  Missing Display Product Name.

Failures:

EDID:
  Extension Block 1 started with EDID header, ignoring Extension Blocks >= 1.

EDID conformity: FAIL
