edid-decode (hex):

00 ff ff ff ff ff ff 00 5a 63 41 58 e8 0f 00 00
32 0a 01 04 68 21 18 a5 eb 20 78 a0 56 48 9a 26
12 48 4c b4 6a 00 31 59 45 59 61 59 81 80 01 01
01 01 01 01 01 01 c3 1e 00 20 41 00 20 30 10 60
13 00 2c e1 10 00 00 1e 00 00 00 ff 00 41 58 30
35 30 30 34 30 37 32 0a 20 20 00 00 00 fd 00 32
a0 1e 46 0b 01 0a 20 20 20 20 20 20 00 00 00 fc
00 41 37 35 66 0a 20 20 20 20 20 20 20 20 00 1c

00 ff ff ff ff ff ff 00 5a 63 41 58 e8 0f 00 00
32 0a 01 04 68 21 18 a5 eb 20 78 a0 56 48 9a 26
12 48 4c b4 6a 00 31 59 45 59 61 59 81 80 01 01
01 01 01 01 01 01 c3 1e 00 20 41 00 20 30 10 60
13 00 2c e1 10 00 00 1e 00 00 00 ff 00 41 58 30
35 30 30 34 30 37 32 0a 20 20 00 00 00 fd 00 32
a0 1e 46 0b 01 0a 20 20 20 20 20 20 00 00 00 fc
00 41 37 35 66 0a 20 20 20 20 20 20 20 20 00 1c

----------------

Block 0, Base EDID:
  EDID Structure Version & Revision: 1.4
  Vendor & Product Identification:
    Manufacturer: VSC
    Model: 22593
    Serial Number: ...
    Made in: week 50 of 2000
  Basic Display Parameters & Features:
    Analog display
    Signal Level Standard: 0.700 : 0.000 : 0.700 V p-p
    Blank level equals black level
    Sync: Separate
    Maximum image size: 33 cm x 24 cm
    Gamma: 2.65
    DPMS levels: Standby Suspend Off
    RGB color display
    First detailed timing includes the native pixel format and preferred refresh rate
    Display supports continuous frequencies
  Color Characteristics:
    Red  : 0.6250, 0.3378
    Green: 0.2812, 0.6015
    Blue : 0.1494, 0.0732
    White: 0.2832, 0.2968
  Established Timings I & II:
    IBM     :   720x400    70.081663 Hz   9:5     31.467 kHz     28.320000 MHz
    DMT 0x04:   640x480    59.940476 Hz   4:3     31.469 kHz     25.175000 MHz
    Apple   :   640x480    66.666667 Hz   4:3     35.000 kHz     30.240000 MHz
    DMT 0x06:   640x480    75.000000 Hz   4:3     37.500 kHz     31.500000 MHz
    DMT 0x0b:   800x600    75.000000 Hz   4:3     46.875 kHz     49.500000 MHz
    Apple   :   832x624    74.551266 Hz   4:3     49.726 kHz     57.284000 MHz
    DMT 0x10:  1024x768    60.003840 Hz   4:3     48.363 kHz     65.000000 MHz
    DMT 0x12:  1024x768    75.028582 Hz   4:3     60.023 kHz     78.750000 MHz
  Standard Timings:
    DMT 0x07:   640x480    85.008312 Hz   4:3     43.269 kHz     36.000000 MHz
    DMT 0x0c:   800x600    85.061274 Hz   4:3     53.674 kHz     56.250000 MHz
    DMT 0x13:  1024x768    84.996690 Hz   4:3     68.677 kHz     94.500000 MHz
    DMT 0x23:  1280x1024   60.019740 Hz   5:4     63.981 kHz    108.000000 MHz
  Detailed Timing Descriptors:
    DTD 1:  1024x768    75.028582 Hz   4:3     60.023 kHz     78.750000 MHz (300 mm x 225 mm)
                 Hfront   16 Hsync  96 Hback  176 Hpol P
                 Vfront    1 Vsync   3 Vback   28 Vpol P
    Display Product Serial Number: ...
    Display Range Limits:
      Monitor ranges (Range Limits Only): 50-160 Hz V, 30-70 kHz H, max dotclock 110 MHz
    Display Product Name: 'A75f'
Checksum: 0x1c

----------------

Failures:

Block 0, Base EDID:
  Detailed Timing Descriptor #1: Mismatch of image size 300x225 mm vs display size 330x240 mm.
EDID:
  Extension Block 1 started with EDID header, ignoring Extension Blocks >= 1.

EDID conformity: FAIL
