edid-decode (hex):

00 ff ff ff ff ff ff 00 06 b3 bb 32 01 01 01 01
24 22 01 04 b5 46 27 78 3b d7 35 af 4e 44 a3 26
10 50 54 25 4a 00 81 40 81 80 81 c0 a9 40 d1 c0
01 01 01 01 01 01 6a 5e 00 a0 a0 a0 29 50 30 20
35 00 b9 88 21 00 00 1e 00 00 00 fd 0e 30 19 a0
a0 71 01 0a 20 20 20 20 20 20 00 00 00 fc 00 58
47 33 32 57 43 4d 53 0a 20 20 20 20 00 00 00 ff
00 53 39 4c 4d 41 53 30 30 34 34 37 30 0a 02 d3

02 03 3a f1 4d 60 61 01 03 12 13 04 1f 90 3f 40
76 75 23 09 07 07 83 01 00 00 e3 05 c0 00 74 1a
00 00 03 01 30 f0 00 00 00 00 00 00 18 01 00 00
00 00 00 e6 06 05 01 66 66 25 5a a0 00 a0 a0 a0
46 50 30 20 35 00 b9 88 21 00 00 1e 6f c2 00 a0
a0 a0 55 50 30 20 35 00 b9 88 21 00 00 1e 00 00
00 00 00 00 00 00 00 00 00 00 00 00 00 00 00 00
00 00 00 00 00 00 00 00 00 00 00 00 00 00 00 38

70 12 79 03 00 03 01 64 08 ec 00 04 ff 09 9f 00
2f 80 1f 00 9f 05 66 00 02 80 07 00 3d 11 01 04
ff 09 9f 00 2f 80 1f 00 9f 05 76 00 02 80 04 00
d5 3c 01 04 ff 09 9f 00 2f 80 1f 00 9f 05 32 00
0f 80 04 00 ca 9c 01 04 ff 09 9f 00 2f 80 1f 00
9f 05 b2 00 02 80 04 00 92 bb 01 04 ff 09 9f 00
2f 80 1f 00 9f 05 32 00 0f 80 04 00 00 00 00 00
00 00 00 00 00 00 00 00 00 00 00 00 00 00 c2 90

00 ff ff ff ff ff ff 00 06 b3 bb 32 01 01 01 01
24 22 01 04 b5 46 27 78 3b d7 35 af 4e 44 a3 26
10 50 54 25 4a 00 81 40 81 80 81 c0 a9 40 d1 c0
01 01 01 01 01 01 6a 5e 00 a0 a0 a0 29 50 30 20
35 00 b9 88 21 00 00 1e 00 00 00 fd 0e 30 19 a0
a0 71 01 0a 20 20 20 20 20 20 00 00 00 fc 00 58
47 33 32 57 43 4d 53 0a 20 20 20 20 00 00 00 ff
00 53 39 4c 4d 41 53 30 30 34 34 37 30 0a 02 d3

02 03 3a f1 4d 60 61 01 03 12 13 04 1f 90 3f 40
76 75 23 09 07 07 83 01 00 00 e3 05 c0 00 74 1a
00 00 03 01 30 f0 00 00 00 00 00 00 18 01 00 00
00 00 00 e6 06 05 01 66 66 25 5a a0 00 a0 a0 a0
46 50 30 20 35 00 b9 88 21 00 00 1e 6f c2 00 a0
a0 a0 55 50 30 20 35 00 b9 88 21 00 00 1e 00 00
00 00 00 00 00 00 00 00 00 00 00 00 00 00 00 00
00 00 00 00 00 00 00 00 00 00 00 00 00 00 00 38

70 12 79 03 00 03 01 64 08 ec 00 04 ff 09 9f 00
2f 80 1f 00 9f 05 66 00 02 80 07 00 3d 11 01 04
ff 09 9f 00 2f 80 1f 00 9f 05 76 00 02 80 04 00
d5 3c 01 04 ff 09 9f 00 2f 80 1f 00 9f 05 32 00
0f 80 04 00 ca 9c 01 04 ff 09 9f 00 2f 80 1f 00
9f 05 b2 00 02 80 04 00 92 bb 01 04 ff 09 9f 00
2f 80 1f 00 9f 05 32 00 0f 80 04 00 00 00 00 00
00 00 00 00 00 00 00 00 00 00 00 00 00 00 c2 90

----------------

Block 0, Base EDID:
  EDID Structure Version & Revision: 1.4
  Vendor & Product Identification:
    Manufacturer: AUS
    Model: 12987
    Serial Number: ...
    Made in: week 36 of 2024
  Basic Display Parameters & Features:
    Digital display
    Bits per primary color channel: 10
    DisplayPort interface
    Maximum image size: 70 cm x 39 cm
    Gamma: 2.20
    DPMS levels: Off
    Supported color formats: RGB 4:4:4, YCrCb 4:4:4, YCrCb 4:2:2
    First detailed timing includes the native pixel format and preferred refresh rate
    Display supports continuous frequencies
  Color Characteristics:
    Red  : 0.6865, 0.3056
    Green: 0.2666, 0.6396
    Blue : 0.1484, 0.0654
    White: 0.3134, 0.3291
  Established Timings I & II:
    DMT 0x04:   640x480    59.940476 Hz   4:3     31.469 kHz     25.175000 MHz
    DMT 0x06:   640x480    75.000000 Hz   4:3     37.500 kHz     31.500000 MHz
    DMT 0x09:   800x600    60.316541 Hz   4:3     37.879 kHz     40.000000 MHz
    DMT 0x0b:   800x600    75.000000 Hz   4:3     46.875 kHz     49.500000 MHz
    DMT 0x10:  1024x768    60.003840 Hz   4:3     48.363 kHz     65.000000 MHz
    DMT 0x12:  1024x768    75.028582 Hz   4:3     60.023 kHz     78.750000 MHz
  Standard Timings:
    DMT 0x20:  1280x960    60.000000 Hz   4:3     60.000 kHz    108.000000 MHz
    DMT 0x23:  1280x1024   60.019740 Hz   5:4     63.981 kHz    108.000000 MHz
    DMT 0x55:  1280x720    60.000000 Hz  16:9     45.000 kHz     74.250000 MHz
    DMT 0x33:  1600x1200   60.000000 Hz   4:3     75.000 kHz    162.000000 MHz
    DMT 0x52:  1920x1080   60.000000 Hz  16:9     67.500 kHz    148.500000 MHz
  Detailed Timing Descriptors:
    DTD 1:  2560x1440   60.000199 Hz  16:9     88.860 kHz    241.700000 MHz (697 mm x 392 mm)
                 Hfront   48 Hsync  32 Hback   80 Hpol P
                 Vfront    3 Vsync   5 Vback   33 Vpol P
    Display Range Limits:
      Monitor ranges (Range Limits Only): 48-280 Hz V, 415-415 kHz H, max dotclock 1130 MHz
    Display Product Name: 'XG32WCMS'
    Display Product Serial Number: ...
  Extension blocks: 2
Checksum: 0xd3

----------------

Block 1, CTA-861 Extension Block:
  Revision: 3
  Underscans IT Video Formats by default
  Basic audio support
  Supports YCbCr 4:4:4
  Supports YCbCr 4:2:2
  Native DTDs: 1
  Video Data Block:
    VIC  96:  3840x2160   50.000000 Hz  16:9    112.500 kHz    594.000000 MHz
    VIC  97:  3840x2160   60.000000 Hz  16:9    135.000 kHz    594.000000 MHz
    VIC   1:   640x480    59.940476 Hz   4:3     31.469 kHz     25.175000 MHz
    VIC   3:   720x480    59.940060 Hz  16:9     31.469 kHz     27.000000 MHz
    VIC  18:   720x576    50.000000 Hz  16:9     31.250 kHz     27.000000 MHz
    VIC  19:  1280x720    50.000000 Hz  16:9     37.500 kHz     74.250000 MHz
    VIC   4:  1280x720    60.000000 Hz  16:9     45.000 kHz     74.250000 MHz
    VIC  31:  1920x1080   50.000000 Hz  16:9     56.250 kHz    148.500000 MHz
    VIC  16:  1920x1080   60.000000 Hz  16:9     67.500 kHz    148.500000 MHz (native)
    VIC  63:  1920x1080  120.000000 Hz  16:9    135.000 kHz    297.000000 MHz
    VIC  64:  1920x1080  100.000000 Hz  16:9    112.500 kHz    297.000000 MHz
    VIC 118:  3840x2160  120.000000 Hz  16:9    270.000 kHz   1188.000000 MHz
    VIC 117:  3840x2160  100.000000 Hz  16:9    225.000 kHz   1188.000000 MHz
  Audio Data Block:
    Linear PCM:
      Max channels: 2
      Supported sample rates (kHz): 48 44.1 32
      Supported sample sizes (bits): 24 20 16
  Speaker Allocation Data Block:
    FL/FR - Front Left/Right
  Colorimetry Data Block:
    BT2020YCC
    BT2020RGB
  Vendor-Specific Data Block (AMD), OUI 00-00-1A:
    Version: 3
    Feature Caps: 0x01
    Minimum Refresh Rate: 48 Hz
    Maximum Refresh Rate: 280 Hz
    Flags 1.x: 0x00
    Flags 2.x: 0x00
  HDR Static Metadata Data Block:
    Electro optical transfer functions:
      Traditional gamma - SDR luminance range
      SMPTE ST2084
    Supported static metadata descriptors:
      Static metadata type 1
    Desired content max luminance: 102 (455.515 cd/m^2)
    Desired content max frame-average luminance: 102 (455.515 cd/m^2)
    Desired content min luminance: 37 (0.096 cd/m^2)
  Detailed Timing Descriptors:
    DTD 2:  2560x1440   99.946436 Hz  16:9    150.919 kHz    410.500000 MHz (697 mm x 392 mm)
                 Hfront   48 Hsync  32 Hback   80 Hpol P
                 Vfront    3 Vsync   5 Vback   62 Vpol P
    DTD 3:  2560x1440  119.997589 Hz  16:9    182.996 kHz    497.750000 MHz (697 mm x 392 mm)
                 Hfront   48 Hsync  32 Hback   80 Hpol P
                 Vfront    3 Vsync   5 Vback   77 Vpol P
Checksum: 0x38  Unused space in Extension Block: 33 bytes

----------------

Block 2, DisplayID Extension Block:
  Version: 1.2
  Extension Count: 0
  Display Product Type: Standalone display device
  Video Timing Modes Type 1 - Detailed Timings Data Block:
    DTD:  2560x1440  143.973257 Hz  16:9    222.151 kHz    604.250000 MHz (aspect 16:9, no 3D stereo)
               Hfront   48 Hsync  32 Hback   80 Hpol P
               Vfront    3 Vsync   8 Vback   92 Vpol P
    DTD:  2560x1440  164.957741 Hz  16:9    257.169 kHz    699.500000 MHz (aspect 16:9, no 3D stereo)
               Hfront   48 Hsync  32 Hback   80 Hpol P
               Vfront    3 Vsync   5 Vback  111 Vpol P
    DTD:  2560x1440  199.999014 Hz  16:9    298.199 kHz    811.100000 MHz (aspect 16:9, no 3D stereo)
               Hfront   48 Hsync  32 Hback   80 Hpol P
               Vfront   16 Vsync   5 Vback   30 Vpol P
    DTD:  2560x1440  239.969753 Hz  16:9    388.511 kHz   1056.750000 MHz (aspect 16:9, no 3D stereo)
               Hfront   48 Hsync  32 Hback   80 Hpol P
               Vfront    3 Vsync   5 Vback  171 Vpol P
    DTD:  2560x1440  280.001085 Hz  16:9    417.482 kHz   1135.550000 MHz (aspect 16:9, no 3D stereo)
               Hfront   48 Hsync  32 Hback   80 Hpol P
               Vfront   16 Vsync   5 Vback   30 Vpol P
  Checksum: 0xc2
Checksum: 0x90

----------------

Warnings:

Block 0, Base EDID:
  Vendor & Product Identification: The serial number is one of the known dummy values, it should probably be set to 0.
Block 1, CTA-861 Extension Block:
  Video Data Block: VIC 96 and the first DTD are not identical. Is this intended?
  Colorimetry Data Block: Set the sRGB colorimetry bit to avoid interop issues.
  Display Product Serial Number is set, so the Serial Number in the Base EDID should be 0.
EDID:
  Base EDID: Some timings are out of range of the Monitor Ranges:
    Horizontal Freq: 31.250 - 417.481 kHz (Monitor: 415.000 - 415.000 kHz)
    Maximum Clock: 1188.000 MHz (Monitor: 1130.000 MHz)

Failures:

Block 1, CTA-861 Extension Block:
  Missing VCDB, needed for Set Selectable RGB Quantization to avoid interop issues.
EDID:
  Extension Block 3 started with EDID header, ignoring Extension Blocks >= 3.
  CTA-861: Native progressive timings are a mix of several resolutions.
  DisplayID: Missing DisplayID Display Parameters Data Block.
  DisplayID: DisplayID expects at least one preferred timing.

EDID conformity: FAIL
