edid-decode (hex):

00 ff ff ff ff ff ff 00 07 0d 68 27 01 00 00 00
29 1c 01 03 80 3c 22 78 2e 61 50 a6 56 50 a0 26
0d 50 54 af eb 80 d1 c0 81 c0 81 00 81 80 a9 c0
b3 00 01 01 01 01 56 5e 00 a0 a0 a0 29 50 30 20
35 00 00 b0 31 00 00 1a 00 00 00 ff 00 4e 41 0a
20 20 20 20 20 20 20 20 20 20 00 00 00 fd 00 28
4c 0f 5f 21 01 0a 20 20 20 20 20 20 00 00 00 fc
00 41 58 4d 2d 32 37 36 38 0a 20 20 20 20 00 f3

00 ff ff ff ff ff ff 00 07 0d 68 27 01 00 00 00
29 1c 01 03 80 3c 22 78 2e 61 50 a6 56 50 a0 26
0d 50 54 af eb 80 d1 c0 81 c0 81 00 81 80 a9 c0
b3 00 01 01 01 01 56 5e 00 a0 a0 a0 29 50 30 20
35 00 00 b0 31 00 00 1a 00 00 00 ff 00 4e 41 0a
20 20 20 20 20 20 20 20 20 20 00 00 00 fd 00 28
4c 0f 5f 21 01 0a 20 20 20 20 20 20 00 00 00 fc
00 41 58 4d 2d 32 37 36 38 0a 20 20 20 20 00 f3

----------------

Block 0, Base EDID:
  EDID Structure Version & Revision: 1.3
  Vendor & Product Identification:
    Manufacturer: AXM
    Model: 10088
    Serial Number: ...
    Made in: week 41 of 2018
  Basic Display Parameters & Features:
    Digital display
    Maximum image size: 60 cm x 34 cm
    Gamma: 2.20
    DPMS levels: Off
    RGB color display
    Default (sRGB) color space is primary color space
    First detailed timing is the preferred timing
  Color Characteristics:
    Red  : 0.6494, 0.3378
    Green: 0.3125, 0.6259
    Blue : 0.1494, 0.0517
    White: 0.3125, 0.3281
  Established Timings I & II:
    IBM     :   720x400    70.081663 Hz   9:5     31.467 kHz     28.320000 MHz
    DMT 0x04:   640x480    59.940476 Hz   4:3     31.469 kHz     25.175000 MHz
    DMT 0x05:   640x480    72.808802 Hz   4:3     37.861 kHz     31.500000 MHz
    DMT 0x06:   640x480    75.000000 Hz   4:3     37.500 kHz     31.500000 MHz
    DMT 0x08:   800x600    56.250000 Hz   4:3     35.156 kHz     36.000000 MHz
    DMT 0x09:   800x600    60.316541 Hz   4:3     37.879 kHz     40.000000 MHz
    DMT 0x0a:   800x600    72.187572 Hz   4:3     48.077 kHz     50.000000 MHz
    DMT 0x0b:   800x600    75.000000 Hz   4:3     46.875 kHz     49.500000 MHz
    Apple   :   832x624    74.551266 Hz   4:3     49.726 kHz     57.284000 MHz
    DMT 0x10:  1024x768    60.003840 Hz   4:3     48.363 kHz     65.000000 MHz
    DMT 0x12:  1024x768    75.028582 Hz   4:3     60.023 kHz     78.750000 MHz
    DMT 0x24:  1280x1024   75.024675 Hz   5:4     79.976 kHz    135.000000 MHz
    Apple   :  1152x870    75.061550 Hz 192:145   68.681 kHz    100.000000 MHz
  Standard Timings:
    DMT 0x52:  1920x1080   60.000000 Hz  16:9     67.500 kHz    148.500000 MHz
    DMT 0x55:  1280x720    60.000000 Hz  16:9     45.000 kHz     74.250000 MHz
    DMT 0x1c:  1280x800    59.810326 Hz  16:10    49.702 kHz     83.500000 MHz
    DMT 0x23:  1280x1024   60.019740 Hz   5:4     63.981 kHz    108.000000 MHz
    DMT 0x53:  1600x900    60.000000 Hz  16:9     60.000 kHz    108.000000 MHz (RB)
    DMT 0x3a:  1680x1050   59.954250 Hz  16:10    65.290 kHz    146.250000 MHz
  Detailed Timing Descriptors:
    DTD 1:  2560x1440   59.950550 Hz  16:9     88.787 kHz    241.500000 MHz (768 mm x 432 mm)
                 Hfront   48 Hsync  32 Hback   80 Hpol P
                 Vfront    3 Vsync   5 Vback   33 Vpol N
    Display Product Serial Number: ...
    Display Range Limits:
      Monitor ranges (Range Limits Only): 40-76 Hz V, 15-95 kHz H, max dotclock 330 MHz
    Display Product Name: 'AXM-2768'
Checksum: 0xf3

----------------

Block 1, Unknown EDID Extension Block 0x00:
  00 ff ff ff ff ff ff 00 07 0d 68 27 01 00 00 00 '..........h'....'
  29 1c 01 03 80 3c 22 78 2e 61 50 a6 56 50 a0 26 ')....<"x.aP.VP.&'
  0d 50 54 af eb 80 d1 c0 81 c0 81 00 81 80 a9 c0 '.PT.............'
  b3 00 01 01 01 01 56 5e 00 a0 a0 a0 29 50 30 20 '......V^....)P0 '
  35 00 00 b0 31 00 00 1a 00 00 00 ff 00 4e 41 0a '5...1........NA.'
  20 20 20 20 20 20 20 20 20 20 00 00 00 fd 00 28 '          .....('
  4c 0f 5f 21 01 0a 20 20 20 20 20 20 00 00 00 fc 'L._!..      ....'
  00 41 58 4d 2d 32 37 36 38 0a 20 20 20 20 00 f3 '.AXM-2768.    ..'
Checksum: 0xf3

----------------

Warnings:

Block 0, Base EDID:
  Vendor & Product Identification: The serial number is one of the known dummy values, it should probably be set to 0.
  Display Product Serial Number: ...

Failures:

Block 0, Base EDID:
  Basic Display Parameters & Features: sRGB is signaled, but the chromaticities do not match.
  Detailed Timing Descriptor #1: Mismatch of image size 768x432 mm vs display size 600x340 mm.
  Display Range Limits: 'Range Limits Only' is not allowed for EDID < 1.4.
Block 1, Base EDID:
  Unknown Extension Block.
EDID:
  Base EDID: The DTD max image size is 768x432mm, which is larger than the display size 600.0x340.0mm.
  Base EDID: EDID specified 0 extension block(s), but found 1 extension block(s).

EDID conformity: FAIL
