edid-decode (hex):

00 ff ff ff ff ff ff 00 08 59 43 26 01 01 01 01
02 14 01 03 80 39 20 78 0a e0 dd a3 54 48 97 24
0f 47 4a af ce 00 81 80 81 c0 95 00 b3 00 a9 40
01 01 01 01 01 01 02 3a 80 18 71 38 2d 40 58 2c
45 00 40 44 21 00 00 1a 0e 1f 00 80 51 00 1e 30
40 80 37 00 40 44 21 00 00 1c 00 00 00 fd 00 32
4b 0f 46 0f 00 0a 20 20 20 20 20 20 00 00 00 fc
00 4e 53 2d 32 36 4c 34 35 30 41 31 31 0a 01 93

02 03 20 71 48 84 05 03 02 10 06 07 01 26 09 07
07 15 07 50 83 01 00 00 67 03 0c 00 30 00 80 12
01 1d 00 72 51 d0 1e 20 6e 28 55 00 40 44 21 00
00 1e 01 1d 80 18 71 1c 16 20 58 2c 25 00 40 44
21 00 00 9e 8c 0a d0 8a 20 e0 2d 10 10 3e 96 00
40 44 21 00 00 18 8c 0a d0 8a 20 e0 2d 10 10 3e
96 00 ae 44 11 00 00 18 02 3a 80 18 71 38 2d 40
58 2c 45 dd 40 44 21 00 00 1a 00 00 00 00 00 c6

00 ff ff ff ff ff ff 00 08 59 43 26 01 01 01 01
02 14 01 03 80 39 20 78 0a e0 dd a3 54 48 97 24
0f 47 4a af ce 00 81 80 81 c0 95 00 b3 00 a9 40
01 01 01 01 01 01 02 3a 80 18 71 38 2d 40 58 2c
45 00 40 44 21 00 00 1a 0e 1f 00 80 51 00 1e 30
40 80 37 00 40 44 21 00 00 1c 00 00 00 fd 00 32
4b 0f 46 0f 00 0a 20 20 20 20 20 20 00 00 00 fc
00 4e 53 2d 32 36 4c 34 35 30 41 31 31 0a 01 93

02 03 20 71 48 84 05 03 02 10 06 07 01 26 09 07
07 15 07 50 83 01 00 00 67 03 0c 00 30 00 80 12
01 1d 00 72 51 d0 1e 20 6e 28 55 00 40 44 21 00
00 1e 01 1d 80 18 71 1c 16 20 58 2c 25 00 40 44
21 00 00 9e 8c 0a d0 8a 20 e0 2d 10 10 3e 96 00
40 44 21 00 00 18 8c 0a d0 8a 20 e0 2d 10 10 3e
96 00 ae 44 11 00 00 18 02 3a 80 18 71 38 2d 40
58 2c 45 dd 40 44 21 00 00 1a 00 00 00 00 00 c6

----------------

Block 0, Base EDID:
  EDID Structure Version & Revision: 1.3
  Vendor & Product Identification:
    Manufacturer: BBY
    Model: 9795
    Serial Number: ...
    Made in: week 2 of 2010
  Basic Display Parameters & Features:
    Digital display
    Maximum image size: 57 cm x 32 cm
    Gamma: 2.20
    RGB color display
    First detailed timing is the preferred timing
  Color Characteristics:
    Red  : 0.6396, 0.3300
    Green: 0.2812, 0.5898
    Blue : 0.1435, 0.0595
    White: 0.2802, 0.2900
  Established Timings I & II:
    IBM     :   720x400    70.081663 Hz   9:5     31.467 kHz     28.320000 MHz
    DMT 0x04:   640x480    59.940476 Hz   4:3     31.469 kHz     25.175000 MHz
    DMT 0x05:   640x480    72.808802 Hz   4:3     37.861 kHz     31.500000 MHz
    DMT 0x06:   640x480    75.000000 Hz   4:3     37.500 kHz     31.500000 MHz
    DMT 0x08:   800x600    56.250000 Hz   4:3     35.156 kHz     36.000000 MHz
    DMT 0x09:   800x600    60.316541 Hz   4:3     37.879 kHz     40.000000 MHz
    DMT 0x0a:   800x600    72.187572 Hz   4:3     48.077 kHz     50.000000 MHz
    DMT 0x0b:   800x600    75.000000 Hz   4:3     46.875 kHz     49.500000 MHz
    DMT 0x10:  1024x768    60.003840 Hz   4:3     48.363 kHz     65.000000 MHz
    DMT 0x11:  1024x768    70.069359 Hz   4:3     56.476 kHz     75.000000 MHz
    DMT 0x12:  1024x768    75.028582 Hz   4:3     60.023 kHz     78.750000 MHz
  Standard Timings:
    DMT 0x23:  1280x1024   60.019740 Hz   5:4     63.981 kHz    108.000000 MHz
    DMT 0x55:  1280x720    60.000000 Hz  16:9     45.000 kHz     74.250000 MHz
    DMT 0x2f:  1440x900    59.887445 Hz  16:10    55.935 kHz    106.500000 MHz
    DMT 0x3a:  1680x1050   59.954250 Hz  16:10    65.290 kHz    146.250000 MHz
    DMT 0x33:  1600x1200   60.000000 Hz   4:3     75.000 kHz    162.000000 MHz
  Detailed Timing Descriptors:
    DTD 1:  1920x1080   60.000000 Hz  16:9     67.500 kHz    148.500000 MHz (576 mm x 324 mm)
                 Hfront   88 Hsync  44 Hback  148 Hpol P
                 Vfront    4 Vsync   5 Vback   36 Vpol N
    DTD 2:  1280x768    59.870228 Hz   5:3     47.776 kHz     79.500000 MHz (576 mm x 324 mm)
                 Hfront   64 Hsync 128 Hback  192 Hpol N
                 Vfront    3 Vsync   7 Vback   20 Vpol P
    Display Range Limits:
      Monitor ranges (GTF): 50-75 Hz V, 15-70 kHz H, max dotclock 150 MHz
    Display Product Name: 'NS-26L450A11'
  Extension blocks: 1
Checksum: 0x93

----------------

Block 1, CTA-861 Extension Block:
  Revision: 3
  Basic audio support
  Supports YCbCr 4:4:4
  Supports YCbCr 4:2:2
  Native DTDs: 1
  Video Data Block:
    VIC   4:  1280x720    60.000000 Hz  16:9     45.000 kHz     74.250000 MHz (native)
    VIC   5:  1920x1080i  60.000000 Hz  16:9     33.750 kHz     74.250000 MHz
    VIC   3:   720x480    59.940060 Hz  16:9     31.469 kHz     27.000000 MHz
    VIC   2:   720x480    59.940060 Hz   4:3     31.469 kHz     27.000000 MHz
    VIC  16:  1920x1080   60.000000 Hz  16:9     67.500 kHz    148.500000 MHz
    VIC   6:  1440x480i   59.940060 Hz   4:3     15.734 kHz     27.000000 MHz
    VIC   7:  1440x480i   59.940060 Hz  16:9     15.734 kHz     27.000000 MHz
    VIC   1:   640x480    59.940476 Hz   4:3     31.469 kHz     25.175000 MHz
  Audio Data Block:
    Linear PCM:
      Max channels: 2
      Supported sample rates (kHz): 48 44.1 32
      Supported sample sizes (bits): 24 20 16
    AC-3:
      Max channels: 6
      Supported sample rates (kHz): 48 44.1 32
      Maximum bit rate: 640 kb/s
  Speaker Allocation Data Block:
    FL/FR - Front Left/Right
  Vendor-Specific Data Block (HDMI), OUI 00-0C-03:
    Source physical address: 3.0.0.0
    Supports_AI
    Maximum TMDS clock: 90 MHz
  Detailed Timing Descriptors:
    DTD 3:  1280x720    60.000000 Hz  16:9     45.000 kHz     74.250000 MHz (576 mm x 324 mm)
                 Hfront  110 Hsync  40 Hback  220 Hpol P
                 Vfront    5 Vsync   5 Vback   20 Vpol P
    DTD 4:  1920x1080i  60.000000 Hz  16:9     33.750 kHz     74.250000 MHz (576 mm x 324 mm)
                 Hfront   88 Hsync  44 Hback  148 Hpol P
                 Vfront    2 Vsync   5 Vback   15 Vpol P Vfront +0.5 Odd Field
                 Vfront    2 Vsync   5 Vback   15 Vpol P Vback  +0.5 Even Field
    DTD 5:   720x480    59.940060 Hz   3:2     31.469 kHz     27.000000 MHz (576 mm x 324 mm)
                 Hfront   16 Hsync  62 Hback   60 Hpol N
                 Vfront    9 Vsync   6 Vback   30 Vpol N
    DTD 6:   720x480    59.940060 Hz   3:2     31.469 kHz     27.000000 MHz (430 mm x 324 mm)
                 Hfront   16 Hsync  62 Hback   60 Hpol N
                 Vfront    9 Vsync   6 Vback   30 Vpol N
    DTD 7:  1920x1080   60.000000 Hz  16:9     67.500 kHz    148.500000 MHz (576 mm x 324 mm)
                 Hfront  856 Hsync 300 Hback -876 Hpol P
                 Vfront   52 Vsync  21 Vback  -28 Vpol N
Checksum: 0xc6  Unused space in Extension Block: 5 bytes

----------------

Warnings:

Block 0, Base EDID:
  Vendor & Product Identification: The serial number is one of the known dummy values, it should probably be set to 0.
  Detailed Timing Descriptor #1: DTD is similar but not identical to VIC 16.
  Detailed Timing Descriptor #2: Image size is 576x324 mm, but based on the picture AR it should be 540x324 mm.
Block 1, CTA-861 Extension Block:
  IT Video Formats are overscanned by default, but normally this should be underscanned.
  Video Data Block: VIC 4 and the first DTD are not identical. Is this intended?
  Detailed Timing Descriptor #5: Image size is 576x324 mm, but based on the picture AR it should be 486x324 mm.
  Detailed Timing Descriptor #6: Image size is 430x324 mm, but based on the picture AR it should be 430x286 mm.
  Detailed Timing Descriptor #7: DTD is similar but not identical to VIC 16.
  Add a Colorimetry Data Block with the sRGB colorimetry bit set to avoid interop issues.
EDID:
  Base EDID: Some timings are out of range of the Monitor Ranges:
    Horizontal Freq: 15.734 - 75.000 kHz (Monitor: 15.000 - 70.000 kHz)
    Maximum Clock: 162.000 MHz (Monitor: 150.000 MHz)

Failures:

Block 1, CTA-861 Extension Block:
  Detailed Timing Descriptor #7: 0 or negative horizontal back porch.
  Detailed Timing Descriptor #7: 0 or negative vertical back porch.
  Missing VCDB, needed for Set Selectable RGB Quantization to avoid interop issues.
EDID:
  Extension Block 2 started with EDID header, ignoring Extension Blocks >= 2.
  CTA-861: The maximum HDMI TMDS clock is 90000 kHz, but one or more video timings go up to 162000 kHz.
  CTA-861: Native progressive timings are a mix of several resolutions.

EDID conformity: FAIL
