edid-decode (hex):

00 ff ff ff ff ff ff 00 4c 2d 0a 01 4e 31 42 41
14 0f 01 03 68 1e 17 78 2a d5 ed a0 5a 4a 98 24
16 4d 53 bf ee 00 01 01 01 01 01 01 01 01 01 01
01 01 01 01 01 01 64 19 00 40 41 00 26 30 18 88
36 00 30 e4 10 00 00 18 00 00 00 fd 00 3c 4b 1e
3d 08 00 0a 20 20 20 20 20 20 00 00 00 fc 00 53
41 4d 53 55 4e 47 0a 20 20 20 20 20 00 00 00 ff
00 33 53 44 59 35 30 32 37 37 30 0a 20 20 00 69

00 ff ff ff ff ff ff 00 4c 2d 0a 01 4e 31 42 41
14 0f 01 03 68 1e 17 78 2a d5 ed a0 5a 4a 98 24
16 4d 53 bf ee 00 01 01 01 01 01 01 01 01 01 01
01 01 01 01 01 01 64 19 00 40 41 00 26 30 18 88
36 00 30 e4 10 00 00 18 00 00 00 fd 00 3c 4b 1e
3d 08 00 0a 20 20 20 20 20 20 00 00 00 fc 00 53
41 4d 53 55 4e 47 0a 20 20 20 20 20 00 00 00 ff
00 33 53 44 59 35 30 32 37 37 30 0a 20 20 00 69

----------------

Block 0, Base EDID:
  EDID Structure Version & Revision: 1.3
  Vendor & Product Identification:
    Manufacturer: SAM
    Model: 266
    Serial Number: ...
    Made in: week 20 of 2005
  Basic Display Parameters & Features:
    Analog display
    Signal Level Standard: 0.700 : 0.000 : 0.700 V p-p
    Blank level equals black level
    Sync: Separate
    Maximum image size: 30 cm x 23 cm
    Gamma: 2.20
    DPMS levels: Off
    RGB color display
    First detailed timing is the preferred timing
  Color Characteristics:
    Red  : 0.6279, 0.3525
    Green: 0.2900, 0.5947
    Blue : 0.1435, 0.0878
    White: 0.3037, 0.3251
  Established Timings I & II:
    IBM     :   720x400    70.081663 Hz   9:5     31.467 kHz     28.320000 MHz
    DMT 0x04:   640x480    59.940476 Hz   4:3     31.469 kHz     25.175000 MHz
    Apple   :   640x480    66.666667 Hz   4:3     35.000 kHz     30.240000 MHz
    DMT 0x05:   640x480    72.808802 Hz   4:3     37.861 kHz     31.500000 MHz
    DMT 0x06:   640x480    75.000000 Hz   4:3     37.500 kHz     31.500000 MHz
    DMT 0x08:   800x600    56.250000 Hz   4:3     35.156 kHz     36.000000 MHz
    DMT 0x09:   800x600    60.316541 Hz   4:3     37.879 kHz     40.000000 MHz
    DMT 0x0a:   800x600    72.187572 Hz   4:3     48.077 kHz     50.000000 MHz
    DMT 0x0b:   800x600    75.000000 Hz   4:3     46.875 kHz     49.500000 MHz
    Apple   :   832x624    74.551266 Hz   4:3     49.726 kHz     57.284000 MHz
    DMT 0x10:  1024x768    60.003840 Hz   4:3     48.363 kHz     65.000000 MHz
    DMT 0x11:  1024x768    70.069359 Hz   4:3     56.476 kHz     75.000000 MHz
    DMT 0x12:  1024x768    75.028582 Hz   4:3     60.023 kHz     78.750000 MHz
  Standard Timings: none
  Detailed Timing Descriptors:
    DTD 1:  1024x768    60.003840 Hz   4:3     48.363 kHz     65.000000 MHz (304 mm x 228 mm)
                 Hfront   24 Hsync 136 Hback  160 Hpol N
                 Vfront    3 Vsync   6 Vback   29 Vpol N
    Display Range Limits:
      Monitor ranges (GTF): 60-75 Hz V, 30-61 kHz H, max dotclock 80 MHz
    Display Product Name: 'SAMSUNG'
    Display Product Serial Number: ...
Checksum: 0x69

----------------

Warnings:

EDID:
  Base EDID: Some timings are out of range of the Monitor Ranges:
    Vertical Freq: 56.250 - 75.029 Hz (Monitor: 60.000 - 75.000 Hz)

Failures:

EDID:
  Extension Block 1 started with EDID header, ignoring Extension Blocks >= 1.

EDID conformity: FAIL
