edid-decode (hex):

00 ff ff ff ff ff ff 00 22 f0 04 32 00 00 00 00
09 1a 01 04 a5 50 21 78 3a a8 35 a5 55 4d a0 28
0d 50 54 21 08 00 d1 c0 a9 c0 81 c0 d1 00 b3 00
95 00 a9 40 81 80 f5 7c 70 a0 d0 a0 29 50 30 20
3a 00 1d 4d 31 00 00 1a 00 00 00 fd 00 1e 3c 1e
5a 20 00 0a 20 20 20 20 20 20 00 00 00 fc 00 48
50 20 45 4e 56 59 20 33 34 63 0a 20 00 00 00 ff
00 43 4e 34 36 30 39 30 30 31 4a 0a 20 20 01 d5

02 03 16 f1 49 10 1f 04 13 03 02 12 11 01 23 09
07 07 83 01 00 00 56 5e 00 a0 a0 a0 29 50 30 20
35 00 1d 4d 31 00 00 1a 58 4d 00 b8 a1 38 14 40
f8 2c 45 00 1d 4d 31 00 00 1e 82 48 00 e4 a2 38
2d 40 24 2c 45 80 1d 4d 31 00 00 1e 40 3c 80 a0
70 b0 23 40 30 20 36 00 1d 4d 31 00 00 1a 00 00
00 00 00 00 00 00 00 00 00 00 00 00 00 00 00 00
00 00 00 00 00 00 00 00 00 00 00 00 00 00 00 6e

00 ff ff ff ff ff ff 00 22 f0 04 32 00 00 00 00
09 1a 01 04 a5 50 21 78 3a a8 35 a5 55 4d a0 28
0d 50 54 21 08 00 d1 c0 a9 c0 81 c0 d1 00 b3 00
95 00 a9 40 81 80 f5 7c 70 a0 d0 a0 29 50 30 20
3a 00 1d 4d 31 00 00 1a 00 00 00 fd 00 1e 3c 1e
5a 20 00 0a 20 20 20 20 20 20 00 00 00 fc 00 48
50 20 45 4e 56 59 20 33 34 63 0a 20 00 00 00 ff
00 43 4e 34 36 30 39 30 30 31 4a 0a 20 20 01 d5

02 03 16 f1 49 10 1f 04 13 03 02 12 11 01 23 09
07 07 83 01 00 00 56 5e 00 a0 a0 a0 29 50 30 20
35 00 1d 4d 31 00 00 1a 58 4d 00 b8 a1 38 14 40
f8 2c 45 00 1d 4d 31 00 00 1e 82 48 00 e4 a2 38
2d 40 24 2c 45 80 1d 4d 31 00 00 1e 40 3c 80 a0
70 b0 23 40 30 20 36 00 1d 4d 31 00 00 1a 00 00
00 00 00 00 00 00 00 00 00 00 00 00 00 00 00 00
00 00 00 00 00 00 00 00 00 00 00 00 00 00 00 6e

----------------

Block 0, Base EDID:
  EDID Structure Version & Revision: 1.4
  Vendor & Product Identification:
    Manufacturer: HWP
    Model: 12804
    Made in: week 9 of 2016
  Basic Display Parameters & Features:
    Digital display
    Bits per primary color channel: 8
    DisplayPort interface
    Maximum image size: 80 cm x 33 cm
    Gamma: 2.20
    DPMS levels: Off
    Supported color formats: RGB 4:4:4, YCrCb 4:4:4, YCrCb 4:2:2
    First detailed timing includes the native pixel format and preferred refresh rate
  Color Characteristics:
    Red  : 0.6464, 0.3339
    Green: 0.3027, 0.6250
    Blue : 0.1562, 0.0537
    White: 0.3134, 0.3291
  Established Timings I & II:
    DMT 0x04:   640x480    59.940476 Hz   4:3     31.469 kHz     25.175000 MHz
    DMT 0x09:   800x600    60.316541 Hz   4:3     37.879 kHz     40.000000 MHz
    DMT 0x10:  1024x768    60.003840 Hz   4:3     48.363 kHz     65.000000 MHz
  Standard Timings:
    DMT 0x52:  1920x1080   60.000000 Hz  16:9     67.500 kHz    148.500000 MHz
    DMT 0x53:  1600x900    60.000000 Hz  16:9     60.000 kHz    108.000000 MHz (RB)
    DMT 0x55:  1280x720    60.000000 Hz  16:9     45.000 kHz     74.250000 MHz
    DMT 0x45:  1920x1200   59.884600 Hz  16:10    74.556 kHz    193.250000 MHz
    DMT 0x3a:  1680x1050   59.954250 Hz  16:10    65.290 kHz    146.250000 MHz
    DMT 0x2f:  1440x900    59.887445 Hz  16:10    55.935 kHz    106.500000 MHz
    DMT 0x33:  1600x1200   60.000000 Hz   4:3     75.000 kHz    162.000000 MHz
    DMT 0x23:  1280x1024   60.019740 Hz   5:4     63.981 kHz    108.000000 MHz
  Detailed Timing Descriptors:
    DTD 1:  3440x1440   59.998875 Hz  43:18    88.858 kHz    319.890000 MHz (797 mm x 333 mm)
                 Hfront   48 Hsync  32 Hback   80 Hpol P
                 Vfront    3 Vsync  10 Vback   28 Vpol N
    Display Range Limits:
      Monitor ranges (GTF): 30-60 Hz V, 30-90 kHz H, max dotclock 320 MHz
    Display Product Name: 'HP ENVY 34c'
    Display Product Serial Number: ...
  Extension blocks: 1
Checksum: 0xd5

----------------

Block 1, CTA-861 Extension Block:
  Revision: 3
  Underscans IT Video Formats by default
  Basic audio support
  Supports YCbCr 4:4:4
  Supports YCbCr 4:2:2
  Native detailed modes: 1
  Video Data Block:
    VIC  16:  1920x1080   60.000000 Hz  16:9     67.500 kHz    148.500000 MHz
    VIC  31:  1920x1080   50.000000 Hz  16:9     56.250 kHz    148.500000 MHz
    VIC   4:  1280x720    60.000000 Hz  16:9     45.000 kHz     74.250000 MHz
    VIC  19:  1280x720    50.000000 Hz  16:9     37.500 kHz     74.250000 MHz
    VIC   3:   720x480    59.940060 Hz  16:9     31.469 kHz     27.000000 MHz
    VIC   2:   720x480    59.940060 Hz   4:3     31.469 kHz     27.000000 MHz
    VIC  18:   720x576    50.000000 Hz  16:9     31.250 kHz     27.000000 MHz
    VIC  17:   720x576    50.000000 Hz   4:3     31.250 kHz     27.000000 MHz
    VIC   1:   640x480    59.940476 Hz   4:3     31.469 kHz     25.175000 MHz
  Audio Data Block:
    Linear PCM:
      Max channels: 2
      Supported sample rates (kHz): 48 44.1 32
      Supported sample sizes (bits): 24 20 16
  Speaker Allocation Data Block:
    FL/FR - Front Left/Right
  Detailed Timing Descriptors:
    DTD 2:  2560x1440   59.950550 Hz  16:9     88.787 kHz    241.500000 MHz (797 mm x 333 mm)
                 Hfront   48 Hsync  32 Hback   80 Hpol P
                 Vfront    3 Vsync   5 Vback   33 Vpol N
    DTD 3:  2560x1080   60.000000 Hz  64:27    66.000 kHz    198.000000 MHz (797 mm x 333 mm)
                 Hfront  248 Hsync  44 Hback  148 Hpol P
                 Vfront    4 Vsync   5 Vback   11 Vpol P
    DTD 4:  2560x1080   49.998653 Hz  64:27    56.248 kHz    185.620000 MHz (797 mm x 333 mm)
                 Hfront  548 Hsync  44 Hback  148 Hpol P
                 Vfront    4 Vsync   5 Vback   36 Vpol P
    DTD 5:  1920x1200   60.043600 Hz  16:10    74.154 kHz    154.240000 MHz (797 mm x 333 mm)
                 Hfront   48 Hsync  32 Hback   80 Hpol P
                 Vfront    3 Vsync   6 Vback   26 Vpol N
Checksum: 0x6e  Unused space in Extension Block: 33 bytes

----------------

Block 2, Unknown EDID Extension Block 0x00:
  00 ff ff ff ff ff ff 00 22 f0 04 32 00 00 00 00 '........"..2....'
  09 1a 01 04 a5 50 21 78 3a a8 35 a5 55 4d a0 28 '.....P!x:.5.UM.('
  0d 50 54 21 08 00 d1 c0 a9 c0 81 c0 d1 00 b3 00 '.PT!............'
  95 00 a9 40 81 80 f5 7c 70 a0 d0 a0 29 50 30 20 '...@...|p...)P0 '
  3a 00 1d 4d 31 00 00 1a 00 00 00 fd 00 1e 3c 1e ':..M1.........<.'
  5a 20 00 0a 20 20 20 20 20 20 00 00 00 fc 00 48 'Z ..      .....H'
  50 20 45 4e 56 59 20 33 34 63 0a 20 00 00 00 ff 'P ENVY 34c. ....'
  00 43 4e 34 36 30 39 30 30 31 4a 0a 20 20 01 d5 '.CN4609001J.  ..'
Checksum: 0xd5

----------------

Block 3, CTA-861 Extension Block:
  Revision: 3
  Underscans IT Video Formats by default
  Basic audio support
  Supports YCbCr 4:4:4
  Supports YCbCr 4:2:2
  Native detailed modes: 1
  Video Data Block:
    VIC  16:  1920x1080   60.000000 Hz  16:9     67.500 kHz    148.500000 MHz
    VIC  31:  1920x1080   50.000000 Hz  16:9     56.250 kHz    148.500000 MHz
    VIC   4:  1280x720    60.000000 Hz  16:9     45.000 kHz     74.250000 MHz
    VIC  19:  1280x720    50.000000 Hz  16:9     37.500 kHz     74.250000 MHz
    VIC   3:   720x480    59.940060 Hz  16:9     31.469 kHz     27.000000 MHz
    VIC   2:   720x480    59.940060 Hz   4:3     31.469 kHz     27.000000 MHz
    VIC  18:   720x576    50.000000 Hz  16:9     31.250 kHz     27.000000 MHz
    VIC  17:   720x576    50.000000 Hz   4:3     31.250 kHz     27.000000 MHz
    VIC   1:   640x480    59.940476 Hz   4:3     31.469 kHz     25.175000 MHz
  Audio Data Block:
    Linear PCM:
      Max channels: 2
      Supported sample rates (kHz): 48 44.1 32
      Supported sample sizes (bits): 24 20 16
  Speaker Allocation Data Block:
    FL/FR - Front Left/Right
  Detailed Timing Descriptors:
    DTD 6:  2560x1440   59.950550 Hz  16:9     88.787 kHz    241.500000 MHz (797 mm x 333 mm)
                 Hfront   48 Hsync  32 Hback   80 Hpol P
                 Vfront    3 Vsync   5 Vback   33 Vpol N
    DTD 7:  2560x1080   60.000000 Hz  64:27    66.000 kHz    198.000000 MHz (797 mm x 333 mm)
                 Hfront  248 Hsync  44 Hback  148 Hpol P
                 Vfront    4 Vsync   5 Vback   11 Vpol P
    DTD 8:  2560x1080   49.998653 Hz  64:27    56.248 kHz    185.620000 MHz (797 mm x 333 mm)
                 Hfront  548 Hsync  44 Hback  148 Hpol P
                 Vfront    4 Vsync   5 Vback   36 Vpol P
    DTD 9:  1920x1200   60.043600 Hz  16:10    74.154 kHz    154.240000 MHz (797 mm x 333 mm)
                 Hfront   48 Hsync  32 Hback   80 Hpol P
                 Vfront    3 Vsync   6 Vback   26 Vpol N
Checksum: 0x6e  Unused space in Extension Block: 33 bytes

----------------

Warnings:

Block 0, Base EDID:
  Display Range Limits: GTF support is deprecated in EDID 1.4.
Block 1, CTA-861 Extension Block:
  Video Data Block: VIC 16 and the first DTD are not identical. Is this intended?
  Detailed Timing Descriptor #2: Image size is 797x333 mm, but based on the picture AR it should be 797x448 mm.
  Detailed Timing Descriptor #3: DTD is identical to VIC 90, which is not present in the CTA Ext Block.
  Detailed Timing Descriptor #5: Image size is 797x333 mm, but based on the picture AR it should be 797x498 mm.
  Add a Colorimetry Data Block with the sRGB colorimetry bit set to avoid interop issues.
Block 3, CTA-861 Extension Block:
  Detailed Timing Descriptor #6: Image size is 797x333 mm, but based on the picture AR it should be 797x448 mm.
  Detailed Timing Descriptor #7: DTD is identical to VIC 90, which is not present in the CTA Ext Block.
  Detailed Timing Descriptor #9: Image size is 797x333 mm, but based on the picture AR it should be 797x498 mm.

Failures:

Block 0, Base EDID:
  Display Range Limits: GTF is supported, but the display does not support continuous frequencies.
Block 1, CTA-861 Extension Block:
  Missing VCDB, needed for Set Selectable RGB Quantization to avoid interop issues.
Block 2, Base EDID:
  Unknown Extension Block.
Block 3, CTA-861 Extension Block:
  Video Data Block: Duplicate VIC 16.
  Video Data Block: Duplicate VIC 31.
  Video Data Block: Duplicate VIC 4.
  Video Data Block: Duplicate VIC 19.
  Video Data Block: Duplicate VIC 3.
  Video Data Block: Duplicate VIC 2.
  Video Data Block: Duplicate VIC 18.
  Video Data Block: Duplicate VIC 17.
  Video Data Block: Duplicate VIC 1.
  Speaker Allocation Data Block: Only one instance of this Data Block is allowed.
EDID:
  Base EDID: EDID specified 1 extension block(s), but found 3 extension block(s).

EDID conformity: FAIL
