edid-decode (hex):

00 ff ff ff ff ff ff 00 4d 67 28 32 00 00 00 00
14 23 01 04 b5 46 27 78 3b 1d f5 ae 4f 35 b3 25
0d 50 54 01 08 00 81 80 81 00 a9 c0 95 00 b3 00
01 01 01 01 01 01 7a 5e 00 a0 a0 a0 2a 50 30 20
35 00 13 2a 21 00 00 00 00 00 00 fd 00 26 64 df
df 2c 01 0a 20 20 20 20 20 20 76 9d 00 a0 a0 a0
2a 50 30 20 35 00 0f 28 21 00 00 00 00 00 00 fc
00 48 33 32 54 31 33 0a 20 20 20 20 20 20 01 11

02 03 44 f1 4b 81 02 03 04 05 10 1f 13 14 1f 13
23 09 87 07 83 01 00 00 67 03 0c 00 10 00 38 78
6d 1a 00 00 02 01 30 64 00 01 00 00 00 00 e2 00
d5 e3 05 e3 01 e6 06 07 01 62 62 2f 67 d8 5d c4
01 78 c0 00 02 3a 80 18 71 38 2d 40 58 2c 45 00
55 50 21 00 00 1a 83 48 80 18 71 38 2d 40 58 2c
45 00 0f 28 21 00 00 1e 18 76 00 a0 a0 a0 2a 50
30 20 35 00 13 2a 21 00 00 1a 00 00 00 00 00 9e

00 ff ff ff ff ff ff 00 4d 67 28 32 00 00 00 00
14 23 01 04 b5 46 27 78 3b 1d f5 ae 4f 35 b3 25
0d 50 54 01 08 00 81 80 81 00 a9 c0 95 00 b3 00
01 01 01 01 01 01 7a 5e 00 a0 a0 a0 2a 50 30 20
35 00 13 2a 21 00 00 00 00 00 00 fd 00 26 64 df
df 2c 01 0a 20 20 20 20 20 20 76 9d 00 a0 a0 a0
2a 50 30 20 35 00 0f 28 21 00 00 00 00 00 00 fc
00 48 33 32 54 31 33 0a 20 20 20 20 20 20 01 11

02 03 44 f1 4b 81 02 03 04 05 10 1f 13 14 1f 13
23 09 87 07 83 01 00 00 67 03 0c 00 10 00 38 78
6d 1a 00 00 02 01 30 64 00 01 00 00 00 00 e2 00
d5 e3 05 e3 01 e6 06 07 01 62 62 2f 67 d8 5d c4
01 78 c0 00 02 3a 80 18 71 38 2d 40 58 2c 45 00
55 50 21 00 00 1a 83 48 80 18 71 38 2d 40 58 2c
45 00 0f 28 21 00 00 1e 18 76 00 a0 a0 a0 2a 50
30 20 35 00 13 2a 21 00 00 1a 00 00 00 00 00 9e

----------------

Block 0, Base EDID:
  EDID Structure Version & Revision: 1.4
  Vendor & Product Identification:
    Manufacturer: SKG
    Model: 12840
    Made in: week 20 of 2025
  Basic Display Parameters & Features:
    Digital display
    Bits per primary color channel: 10
    DisplayPort interface
    Maximum image size: 70 cm x 39 cm
    Gamma: 2.20
    DPMS levels: Off
    Supported color formats: RGB 4:4:4, YCrCb 4:4:4, YCrCb 4:2:2
    First detailed timing includes the native pixel format and preferred refresh rate
    Display supports continuous frequencies
  Color Characteristics:
    Red  : 0.6796, 0.3095
    Green: 0.2099, 0.7001
    Blue : 0.1474, 0.0537
    White: 0.3134, 0.3291
  Established Timings I & II:
    DMT 0x09:   800x600    60.316541 Hz   4:3     37.879 kHz     40.000000 MHz
    DMT 0x10:  1024x768    60.003840 Hz   4:3     48.363 kHz     65.000000 MHz
  Standard Timings:
    DMT 0x23:  1280x1024   60.019740 Hz   5:4     63.981 kHz    108.000000 MHz
    DMT 0x1c:  1280x800    59.810326 Hz  16:10    49.702 kHz     83.500000 MHz
    DMT 0x53:  1600x900    60.000000 Hz  16:9     60.000 kHz    108.000000 MHz (RB)
    DMT 0x2f:  1440x900    59.887445 Hz  16:10    55.935 kHz    106.500000 MHz
    DMT 0x3a:  1680x1050   59.954250 Hz  16:10    65.290 kHz    146.250000 MHz
  Detailed Timing Descriptors:
    DTD 1:  2560x1440   59.999405 Hz  16:9     88.919 kHz    241.860000 MHz (analog composite, sync-on-green, 531 mm x 298 mm)
                 Hfront   48 Hsync  32 Hback   80 Hpol N
                 Vfront    3 Vsync   5 Vback   34 Vpol N
    Display Range Limits:
      Monitor ranges (Range Limits Only): 38-100 Hz V, 223-223 kHz H, max dotclock 440 MHz
    DTD 2:  2560x1440   99.999008 Hz  16:9    148.199 kHz    403.100000 MHz (analog composite, sync-on-green, 527 mm x 296 mm)
                 Hfront   48 Hsync  32 Hback   80 Hpol N
                 Vfront    3 Vsync   5 Vback   34 Vpol N
    Display Product Name: 'H32T13'
  Extension blocks: 1
Checksum: 0x11

----------------

Block 1, CTA-861 Extension Block:
  Revision: 3
  Underscans IT Video Formats by default
  Basic audio support
  Supports YCbCr 4:4:4
  Supports YCbCr 4:2:2
  Native DTDs: 1
  Video Data Block:
    VIC   1:   640x480    59.940476 Hz   4:3     31.469 kHz     25.175000 MHz (native)
    VIC   2:   720x480    59.940060 Hz   4:3     31.469 kHz     27.000000 MHz
    VIC   3:   720x480    59.940060 Hz  16:9     31.469 kHz     27.000000 MHz
    VIC   4:  1280x720    60.000000 Hz  16:9     45.000 kHz     74.250000 MHz
    VIC   5:  1920x1080i  60.000000 Hz  16:9     33.750 kHz     74.250000 MHz
    VIC  16:  1920x1080   60.000000 Hz  16:9     67.500 kHz    148.500000 MHz
    VIC  31:  1920x1080   50.000000 Hz  16:9     56.250 kHz    148.500000 MHz
    VIC  19:  1280x720    50.000000 Hz  16:9     37.500 kHz     74.250000 MHz
    VIC  20:  1920x1080i  50.000000 Hz  16:9     28.125 kHz     74.250000 MHz
    VIC  31:  1920x1080   50.000000 Hz  16:9     56.250 kHz    148.500000 MHz
    VIC  19:  1280x720    50.000000 Hz  16:9     37.500 kHz     74.250000 MHz
  Audio Data Block:
    Linear PCM:
      Max channels: 2
      Supported sample rates (kHz): 48 44.1 32
      Supported sample sizes (bits): 24 20 16
  Speaker Allocation Data Block:
    FL/FR - Front Left/Right
  Vendor-Specific Data Block (HDMI), OUI 00-0C-03:
    Source physical address: 1.0.0.0
    DC_36bit
    DC_30bit
    DC_Y444
    Maximum TMDS clock: 600 MHz
  Vendor-Specific Data Block (AMD), OUI 00-00-1A:
    Version: 2
    Flags 1: 0x01
      FreeSync Supported
    Minimum Refresh Rate: 48 Hz
    Maximum Refresh Rate: 100 Hz
    Flags 5: 0x01
  Video Capability Data Block:
    YCbCr quantization: Selectable (via AVI YQ)
    RGB quantization: Selectable (via AVI Q)
    PT scan behavior: Always Overscanned
    IT scan behavior: Always Overscanned
    CE scan behavior: Always Overscanned
  Colorimetry Data Block:
    xvYCC601
    xvYCC709
    BT2020cYCC
    BT2020YCC
    BT2020RGB
    Gamut Boundary Description Metadata Profile P0
  HDR Static Metadata Data Block:
    Electro optical transfer functions:
      Traditional gamma - SDR luminance range
      Traditional gamma - HDR luminance range
      SMPTE ST2084
    Supported static metadata descriptors:
      Static metadata type 1
    Desired content max luminance: 98 (417.710 cd/m^2)
    Desired content max frame-average luminance: 98 (417.710 cd/m^2)
    Desired content min luminance: 47 (0.142 cd/m^2)
  Vendor-Specific Data Block (HDMI Forum), OUI C4-5D-D8:
    Version: 1
    Maximum TMDS Character Rate: 600 MHz
    SCDC Present
    SCDC Read Request Capable
  Detailed Timing Descriptors:
    DTD 3:  1920x1080   60.000000 Hz  16:9     67.500 kHz    148.500000 MHz (597 mm x 336 mm)
                 Hfront   88 Hsync  44 Hback  148 Hpol P
                 Vfront    4 Vsync   5 Vback   36 Vpol N
    DTD 4:  1920x1080   75.002020 Hz  16:9     84.377 kHz    185.630000 MHz (527 mm x 296 mm)
                 Hfront   88 Hsync  44 Hback  148 Hpol P
                 Vfront    4 Vsync   5 Vback   36 Vpol P
    DTD 5:  2560x1440   74.998015 Hz  16:9    111.147 kHz    302.320000 MHz (531 mm x 298 mm)
                 Hfront   48 Hsync  32 Hback   80 Hpol P
                 Vfront    3 Vsync   5 Vback   34 Vpol N
Checksum: 0x9e  Unused space in Extension Block: 5 bytes

----------------

Warnings:

Block 1, CTA-861 Extension Block:
  Video Data Block: VIC 1 and the first DTD are not identical. Is this intended?
  Video Capability Data Block: IT scan behavior is expected to support underscanned.
  Video Capability Data Block: S_PT is equal to S_IT and S_CE, so should be set to 0 instead.
  Colorimetry Data Block: Set the sRGB colorimetry bit to avoid interop issues.
  Detailed Timing Descriptor #3: DTD is similar but not identical to VIC 16.
EDID:
  Base EDID: Some timings are out of range of the Monitor Ranges:
    Horizontal Freq: 28.125 - 148.198 kHz (Monitor: 223.000 - 223.000 kHz)

Failures:

Block 0, Base EDID:
  Detailed Timing Descriptor #1: Mismatch of image size 531x298 mm vs display size 700x390 mm.
  Detailed Timing Descriptor #2: Mismatch of image size 527x296 mm vs display size 700x390 mm.
  Detailed Timing Descriptor #2: Invalid detailed timing descriptor ordering.
Block 1, CTA-861 Extension Block:
  Video Data Block: Duplicate VIC 31.
  Video Data Block: Duplicate VIC 19.
  Audio Data Block: Bit F27 must be 0.
  Vendor-Specific Data Block (HDMI), OUI 00-0C-03: HDMI VSDB Max TMDS rate is > 340.
  Vendor-Specific Data Block (HDMI), OUI 00-0C-03: The HDMI Specification requires EDID 1.3 instead of 1.4.
  Video Capability Data Block: IT video formats are always overscanned, but bit 7 of Byte 3 of the CTA-861 Extension header is set to underscanned.
  Vendor-Specific Data Block (HDMI Forum), OUI C4-5D-D8: HDMI Forum VSDB did not immediately follow the HDMI VSDB.
  Detailed Timing Descriptor #3: Mismatch of image size 597x336 mm vs display size 700x390 mm.
  Detailed Timing Descriptor #4: Mismatch of image size 527x296 mm vs display size 700x390 mm.
  Detailed Timing Descriptor #5: Mismatch of image size 531x298 mm vs display size 700x390 mm.
EDID:
  Extension Block 2 started with EDID header, ignoring Extension Blocks >= 2.
  CTA-861: Native progressive timings are a mix of several resolutions.

EDID conformity: FAIL
