edid-decode (hex):

00 ff ff ff ff ff ff 00 1d 85 01 12 01 00 00 00
26 12 01 03 68 19 13 78 ef 57 f1 a4 56 4e 94 24
19 50 54 af c0 00 01 01 01 01 01 01 01 01 01 01
01 01 01 01 01 01 a0 0f 20 00 31 58 1c 20 28 80
14 00 f6 b9 00 00 00 1e 10 0e 20 e0 30 58 19 20
18 48 12 00 f6 b9 00 00 00 1e d5 09 80 90 20 e0
1d 10 08 60 22 00 f6 b9 00 00 00 18 00 00 00 fc
20 4c 43 44 20 4d 4f 4e 49 54 4f 52 20 20 00 77

00 ff ff ff ff ff ff 00 1d 85 01 12 01 00 00 00
26 12 01 03 68 19 13 78 ef 57 f1 a4 56 4e 94 24
19 50 54 af c0 00 01 01 01 01 01 01 01 01 01 01
01 01 01 01 01 01 a0 0f 20 00 31 58 1c 20 28 80
14 00 f6 b9 00 00 00 1e 10 0e 20 e0 30 58 19 20
18 48 12 00 f6 b9 00 00 00 1e d5 09 80 90 20 e0
1d 10 08 60 22 00 f6 b9 00 00 00 18 00 00 00 fc
20 4c 43 44 20 4d 4f 4e 49 54 4f 52 20 20 00 77

----------------

Block 0, Base EDID:
  EDID Structure Version & Revision: 1.3
  Vendor & Product Identification:
    Manufacturer: GLE
    Model: 4609
    Serial Number: ...
    Made in: week 38 of 2008
  Basic Display Parameters & Features:
    Analog display
    Signal Level Standard: 0.700 : 0.000 : 0.700 V p-p
    Blank level equals black level
    Sync: Separate
    Maximum image size: 25 cm x 19 cm
    Gamma: 2.20
    DPMS levels: Standby Suspend Off
    RGB color display
    Default (sRGB) color space is primary color space
    First detailed timing is the preferred timing
    Supports GTF timings within operating range
  Color Characteristics:
    Red  : 0.6416, 0.3369
    Green: 0.3056, 0.5810
    Blue : 0.1435, 0.1005
    White: 0.3125, 0.3291
  Established Timings I & II:
    IBM     :   720x400    70.081663 Hz   9:5     31.467 kHz     28.320000 MHz
    DMT 0x04:   640x480    59.940476 Hz   4:3     31.469 kHz     25.175000 MHz
    DMT 0x05:   640x480    72.808802 Hz   4:3     37.861 kHz     31.500000 MHz
    DMT 0x06:   640x480    75.000000 Hz   4:3     37.500 kHz     31.500000 MHz
    DMT 0x08:   800x600    56.250000 Hz   4:3     35.156 kHz     36.000000 MHz
    DMT 0x09:   800x600    60.316541 Hz   4:3     37.879 kHz     40.000000 MHz
    DMT 0x0a:   800x600    72.187572 Hz   4:3     48.077 kHz     50.000000 MHz
    DMT 0x0b:   800x600    75.000000 Hz   4:3     46.875 kHz     49.500000 MHz
  Standard Timings: none
  Detailed Timing Descriptors:
    DTD 1:   800x600    60.316541 Hz   4:3     37.879 kHz     40.000000 MHz (246 mm x 185 mm)
                 Hfront   40 Hsync 128 Hback   88 Hpol P
                 Vfront    1 Vsync   4 Vback   23 Vpol P
    DTD 2:   800x600    56.250000 Hz   4:3     35.156 kHz     36.000000 MHz (246 mm x 185 mm)
                 Hfront   24 Hsync  72 Hback  128 Hpol P
                 Vfront    1 Vsync   2 Vback   22 Vpol P
    DTD 3:   640x480    63.073854 Hz   4:3     32.105 kHz     25.170000 MHz (246 mm x 185 mm)
                 Hfront    8 Hsync  96 Hback   40 Hpol N
                 Vfront    2 Vsync   2 Vback   25 Vpol N
    Display Product Name: 'LCD MONITOR  '
Checksum: 0x77

----------------

Warnings:

Block 0, Base EDID:
  Vendor & Product Identification: The serial number is one of the known dummy values, it should probably be set to 0.

Failures:

Block 0, Base EDID:
  Basic Display Parameters & Features: sRGB is signaled, but the chromaticities do not match.
  Display Descriptor #4: Monitor descriptor block has byte 4 nonzero (0x20).
  Display Product Name: No newline, but one or more trailing spaces.
  Missing Display Range Limits Descriptor.
EDID:
  Extension Block 1 started with EDID header, ignoring Extension Blocks >= 1.

EDID conformity: FAIL
