edid-decode (hex):

00 ff ff ff ff ff ff 00 39 ee 03 15 04 00 00 00
0f 16 01 04 a5 22 13 78 26 1e 95 a3 55 48 98 27
15 50 54 af ce 00 01 01 01 01 01 01 01 01 01 01
01 01 01 01 01 01 1b 21 50 a0 51 00 1e 30 48 88
35 00 58 c2 10 00 00 1c 00 00 00 fc 00 53 4d 49
4c 45 35 36 58 20 20 20 20 20 00 00 00 ff 00 0a
00 00 00 00 00 00 00 00 00 00 00 00 00 00 00 ff
00 35 41 30 38 33 37 33 33 4b 20 20 20 0a 00 cf

00 ff ff ff ff ff ff 00 39 ee 03 15 04 00 00 00
0f 16 01 04 a5 22 13 78 26 1e 95 a3 55 48 98 27
15 50 54 af ce 00 01 01 01 01 01 01 01 01 01 01
01 01 01 01 01 01 1b 21 50 a0 51 00 1e 30 48 88
35 00 58 c2 10 00 00 1c 00 00 00 fc 00 53 4d 49
4c 45 35 36 58 20 20 20 20 20 00 00 00 ff 00 0a
00 00 00 00 00 00 00 00 00 00 00 00 00 00 00 ff
00 35 41 30 38 33 37 33 33 4b 20 20 20 0a 00 cf

----------------

Block 0, Base EDID:
  EDID Structure Version & Revision: 1.4
  Vendor & Product Identification:
    Manufacturer: NON
    Model: 5379
    Serial Number: ...
    Made in: week 15 of 2012
  Basic Display Parameters & Features:
    Digital display
    Bits per primary color channel: 8
    DisplayPort interface
    Maximum image size: 34 cm x 19 cm
    Gamma: 2.20
    DPMS levels: Off
    Supported color formats: RGB 4:4:4
    Default (sRGB) color space is primary color space
    First detailed timing includes the native pixel format and preferred refresh rate
  Color Characteristics:
    Red  : 0.6367, 0.3330
    Green: 0.2841, 0.5957
    Blue : 0.1542, 0.0830
    White: 0.3134, 0.3291
  Established Timings I & II:
    IBM     :   720x400    70.081663 Hz   9:5     31.467 kHz     28.320000 MHz
    DMT 0x04:   640x480    59.940476 Hz   4:3     31.469 kHz     25.175000 MHz
    DMT 0x05:   640x480    72.808802 Hz   4:3     37.861 kHz     31.500000 MHz
    DMT 0x06:   640x480    75.000000 Hz   4:3     37.500 kHz     31.500000 MHz
    DMT 0x08:   800x600    56.250000 Hz   4:3     35.156 kHz     36.000000 MHz
    DMT 0x09:   800x600    60.316541 Hz   4:3     37.879 kHz     40.000000 MHz
    DMT 0x0a:   800x600    72.187572 Hz   4:3     48.077 kHz     50.000000 MHz
    DMT 0x0b:   800x600    75.000000 Hz   4:3     46.875 kHz     49.500000 MHz
    DMT 0x10:  1024x768    60.003840 Hz   4:3     48.363 kHz     65.000000 MHz
    DMT 0x11:  1024x768    70.069359 Hz   4:3     56.476 kHz     75.000000 MHz
    DMT 0x12:  1024x768    75.028582 Hz   4:3     60.023 kHz     78.750000 MHz
  Standard Timings: none
  Detailed Timing Descriptors:
    DTD 1:  1360x768    59.798991 Hz  85:48    47.720 kHz     84.750000 MHz (344 mm x 194 mm)
                 Hfront   72 Hsync 136 Hback  208 Hpol N
                 Vfront    3 Vsync   5 Vback   22 Vpol P
    Display Product Name: 'SMILE56X     '
    Display Product Serial Number: ...
    Display Product Serial Number: ...
Checksum: 0xcf

----------------

Warnings:

EDID:
  Base EDID: Multiple Display Product Serial Numbers are specified, is that intended?

Failures:

Block 0, Base EDID:
  Display Product Serial Number: ...
  Display Product Serial Number: ...
  Display Product Serial Number: ...
  Basic Display Parameters & Features: sRGB is signaled, but the chromaticities do not match.
  Display Product Name: No newline, but one or more trailing spaces.
EDID:
  Extension Block 1 started with EDID header, ignoring Extension Blocks >= 1.

EDID conformity: FAIL
