edid-decode (hex):

00 ff ff ff ff ff ff 00 2a c3 43 22 01 01 01 01
00 15 01 03 80 10 09 78 0a fe 55 a3 57 52 a1 27
0d 50 54 a1 08 00 81 80 95 00 a9 40 01 01 01 01
01 01 01 01 01 01 28 3c 80 a0 70 b0 23 40 30 20
36 00 80 b0 74 00 00 1a 02 3a 80 d0 72 38 2d 40
10 2c 45 80 80 38 74 00 00 1e 00 00 00 fc 00 46
50 44 57 57 44 54 45 4c 34 0a 20 20 00 00 00 fd
00 32 46 20 4b 11 00 0a 20 20 20 20 20 20 01 12

02 03 25 72 52 9f 90 01 02 03 04 05 06 07 11 12
13 14 15 16 20 21 22 23 09 07 01 83 01 00 00 65
03 0c 00 10 00 02 3a 80 18 71 38 2d 40 58 2c 45
00 80 38 74 00 00 1e e5 2f 78 e0 51 1a 25 40 58
98 13 00 78 1a 54 00 00 1c 0e 1f 00 80 51 00 1e
30 40 80 37 00 00 00 53 00 00 1c 66 21 50 b0 51
00 1b 30 40 70 36 00 50 00 53 00 00 1e 00 00 00
00 00 00 00 00 00 00 00 00 00 00 00 00 00 00 f9

00 ff ff ff ff ff ff 00 2a c3 43 22 01 01 01 01
00 15 01 03 80 10 09 78 0a fe 55 a3 57 52 a1 27
0d 50 54 a1 08 00 81 80 95 00 a9 40 01 01 01 01
01 01 01 01 01 01 28 3c 80 a0 70 b0 23 40 30 20
36 00 80 b0 74 00 00 1a 02 3a 80 d0 72 38 2d 40
10 2c 45 80 80 38 74 00 00 1e 00 00 00 fc 00 46
50 44 57 57 44 54 45 4c 34 0a 20 20 00 00 00 fd
00 32 46 20 4b 11 00 0a 20 20 20 20 20 20 01 12

02 03 25 72 52 9f 90 01 02 03 04 05 06 07 11 12
13 14 15 16 20 21 22 23 09 07 01 83 01 00 00 65
03 0c 00 10 00 02 3a 80 18 71 38 2d 40 58 2c 45
00 80 38 74 00 00 1e e5 2f 78 e0 51 1a 25 40 58
98 13 00 78 1a 54 00 00 1c 0e 1f 00 80 51 00 1e
30 40 80 37 00 00 00 53 00 00 1c 66 21 50 b0 51
00 1b 30 40 70 36 00 50 00 53 00 00 1e 00 00 00
00 00 00 00 00 00 00 00 00 00 00 00 00 00 00 f9

----------------

Block 0, Base EDID:
  EDID Structure Version & Revision: 1.3
  Vendor & Product Identification:
    Manufacturer: JVC
    Model: 8771
    Serial Number: ...
    Made in: 2011
  Basic Display Parameters & Features:
    Digital display
    Maximum image size: 16 cm x 9 cm
    Gamma: 2.20
    RGB color display
    First detailed timing is the preferred timing
  Color Characteristics:
    Red  : 0.6396, 0.3427
    Green: 0.3232, 0.6308
    Blue : 0.1533, 0.0517
    White: 0.3134, 0.3291
  Established Timings I & II:
    IBM     :   720x400    70.081663 Hz   9:5     31.467 kHz     28.320000 MHz
    DMT 0x04:   640x480    59.940476 Hz   4:3     31.469 kHz     25.175000 MHz
    DMT 0x09:   800x600    60.316541 Hz   4:3     37.879 kHz     40.000000 MHz
    DMT 0x10:  1024x768    60.003840 Hz   4:3     48.363 kHz     65.000000 MHz
  Standard Timings:
    DMT 0x23:  1280x1024   60.019740 Hz   5:4     63.981 kHz    108.000000 MHz
    DMT 0x2f:  1440x900    59.887445 Hz  16:10    55.935 kHz    106.500000 MHz
    DMT 0x33:  1600x1200   60.000000 Hz   4:3     75.000 kHz    162.000000 MHz
  Detailed Timing Descriptors:
    DTD 1:  1920x1200   59.950171 Hz  16:10    74.038 kHz    154.000000 MHz (1920 mm x 1200 mm)
                 Hfront   48 Hsync  32 Hback   80 Hpol P
                 Vfront    3 Vsync   6 Vback   26 Vpol N
    DTD 2:  1920x1080   50.000000 Hz  16:9     56.250 kHz    148.500000 MHz (1920 mm x 1080 mm)
                 Hfront  528 Hsync  44 Hback  148 Hpol P
                 Vfront    4 Vsync   5 Vback   36 Vpol P
    Display Product Name: 'FPDWWDTEL4'
    Display Range Limits:
      Monitor ranges (GTF): 50-70 Hz V, 32-75 kHz H, max dotclock 170 MHz
  Extension blocks: 1
Checksum: 0x12

----------------

Block 1, CTA-861 Extension Block:
  Revision: 3
  Basic audio support
  Supports YCbCr 4:4:4
  Supports YCbCr 4:2:2
  Native DTDs: 2
  Video Data Block:
    VIC  31:  1920x1080   50.000000 Hz  16:9     56.250 kHz    148.500000 MHz (native)
    VIC  16:  1920x1080   60.000000 Hz  16:9     67.500 kHz    148.500000 MHz (native)
    VIC   1:   640x480    59.940476 Hz   4:3     31.469 kHz     25.175000 MHz
    VIC   2:   720x480    59.940060 Hz   4:3     31.469 kHz     27.000000 MHz
    VIC   3:   720x480    59.940060 Hz  16:9     31.469 kHz     27.000000 MHz
    VIC   4:  1280x720    60.000000 Hz  16:9     45.000 kHz     74.250000 MHz
    VIC   5:  1920x1080i  60.000000 Hz  16:9     33.750 kHz     74.250000 MHz
    VIC   6:  1440x480i   59.940060 Hz   4:3     15.734 kHz     27.000000 MHz
    VIC   7:  1440x480i   59.940060 Hz  16:9     15.734 kHz     27.000000 MHz
    VIC  17:   720x576    50.000000 Hz   4:3     31.250 kHz     27.000000 MHz
    VIC  18:   720x576    50.000000 Hz  16:9     31.250 kHz     27.000000 MHz
    VIC  19:  1280x720    50.000000 Hz  16:9     37.500 kHz     74.250000 MHz
    VIC  20:  1920x1080i  50.000000 Hz  16:9     28.125 kHz     74.250000 MHz
    VIC  21:  1440x576i   50.000000 Hz   4:3     15.625 kHz     27.000000 MHz
    VIC  22:  1440x576i   50.000000 Hz  16:9     15.625 kHz     27.000000 MHz
    VIC  32:  1920x1080   24.000000 Hz  16:9     27.000 kHz     74.250000 MHz
    VIC  33:  1920x1080   25.000000 Hz  16:9     28.125 kHz     74.250000 MHz
    VIC  34:  1920x1080   30.000000 Hz  16:9     33.750 kHz     74.250000 MHz
  Audio Data Block:
    Linear PCM:
      Max channels: 2
      Supported sample rates (kHz): 48 44.1 32
      Supported sample sizes (bits): 16
  Speaker Allocation Data Block:
    FL/FR - Front Left/Right
  Vendor-Specific Data Block (HDMI), OUI 00-0C-03:
    Source physical address: 1.0.0.0
  Detailed Timing Descriptors:
    DTD 3:  1920x1080   60.000000 Hz  16:9     67.500 kHz    148.500000 MHz (1920 mm x 1080 mm)
                 Hfront   88 Hsync  44 Hback  148 Hpol P
                 Vfront    4 Vsync   5 Vback   36 Vpol P
    DTD 4:  1400x1050   59.998238 Hz   4:3     65.218 kHz    122.610000 MHz (1400 mm x 1050 mm)
                 Hfront   88 Hsync 152 Hback  240 Hpol N
                 Vfront    1 Vsync   3 Vback   33 Vpol P
    DTD 5:  1280x768    59.870228 Hz   5:3     47.776 kHz     79.500000 MHz (1280 mm x 768 mm)
                 Hfront   64 Hsync 128 Hback  192 Hpol N
                 Vfront    3 Vsync   7 Vback   20 Vpol P
    DTD 6:  1360x768    60.015162 Hz  85:48    47.712 kHz     85.500000 MHz (1360 mm x 768 mm)
                 Hfront   64 Hsync 112 Hback  256 Hpol P
                 Vfront    3 Vsync   6 Vback   18 Vpol P
Checksum: 0xf9  Unused space in Extension Block: 18 bytes

----------------

Warnings:

Block 0, Base EDID:
  Vendor & Product Identification: The serial number is one of the known dummy values, it should probably be set to 0.
  Basic Display Parameters & Features: Dubious maximum image size (16x9 is smaller than 10x10 cm).
Block 1, CTA-861 Extension Block:
  IT Video Formats are overscanned by default, but normally this should be underscanned.
  Video Data Block: VIC 31 and the first DTD are not identical. Is this intended?
  Add a Colorimetry Data Block with the sRGB colorimetry bit set to avoid interop issues.
EDID:
  Base EDID: Some timings are out of range of the Monitor Ranges:
    Vertical Freq: 24.000 - 70.082 Hz (Monitor: 50.000 - 70.000 Hz)
    Horizontal Freq: 15.625 - 75.000 kHz (Monitor: 32.000 - 75.000 kHz)

Failures:

Block 0, Base EDID:
  Detailed Timing Descriptor #1: Mismatch of image size 1920x1200 mm vs display size 160x90 mm.
  Detailed Timing Descriptor #2: Mismatch of image size 1920x1080 mm vs display size 160x90 mm.
Block 1, CTA-861 Extension Block:
  Detailed Timing Descriptor #3: Mismatch of image size 1920x1080 mm vs display size 160x90 mm.
  Detailed Timing Descriptor #4: Mismatch of image size 1400x1050 mm vs display size 160x90 mm.
  Detailed Timing Descriptor #5: Mismatch of image size 1280x768 mm vs display size 160x90 mm.
  Detailed Timing Descriptor #6: Mismatch of image size 1360x768 mm vs display size 160x90 mm.
  Missing VCDB, needed for Set Selectable RGB Quantization to avoid interop issues.
EDID:
  Extension Block 2 started with EDID header, ignoring Extension Blocks >= 2.
  Base EDID: The DTD max image size is 1920x1200mm, which is larger than the display size 160.0x90.0mm.
  CTA-861: Native progressive timings are a mix of several resolutions.

EDID conformity: FAIL
