edid-decode (hex):

00 ff ff ff ff ff ff 00 06 af 9b 4f 00 00 00 00
00 1f 01 04 a5 1e 13 78 03 44 c5 a8 55 47 a1 24
0e 50 54 00 00 00 01 01 01 01 01 01 01 01 01 01
01 01 01 01 01 01 00 69 00 a0 a0 40 2e 60 30 20
35 00 2d bc 10 00 00 1a 00 54 00 a0 a0 40 2e 60
30 20 35 00 2d bc 10 00 00 1a 00 00 00 fe 00 58
36 4e 52 4d 80 42 31 34 30 51 41 4e 00 00 00 00
00 02 41 01 b2 01 11 00 00 0a 41 0a 20 20 00 c8

----------------

Block 0, Base EDID:
  EDID Structure Version & Revision: 1.4
  Vendor & Product Identification:
    Manufacturer: AUO
    Model: 20379
    Made in: 2021
  Basic Display Parameters & Features:
    Digital display
    Bits per primary color channel: 8
    DisplayPort interface
    Maximum image size: 30 cm x 19 cm
    Gamma: 2.20
    Supported color formats: RGB 4:4:4
    First detailed timing includes the native pixel format and preferred refresh rate
    Display supports continuous frequencies
  Color Characteristics:
    Red  : 0.6572, 0.3320
    Green: 0.2783, 0.6289
    Blue : 0.1435, 0.0546
    White: 0.3134, 0.3291
  Established Timings I & II: none
  Standard Timings: none
  Detailed Timing Descriptors:
    DTD 1:  2560x1600   60.038596 Hz  16:10    98.824 kHz    268.800000 MHz (301 mm x 188 mm)
                 Hfront   48 Hsync  32 Hback   80 Hpol P
                 Vfront    3 Vsync   5 Vback   38 Vpol N
    DTD 2:  2560x1600   48.030877 Hz  16:10    79.059 kHz    215.040000 MHz (301 mm x 188 mm)
                 Hfront   48 Hsync  32 Hback   80 Hpol P
                 Vfront    3 Vsync   5 Vback   38 Vpol N
    Alphanumeric Data String: 'X6NRM.B140QAN'
    Manufacturer-Specified Display Descriptor (0x00): 00 00 00 02 41 01 b2 01 11 00 00 0a 41 0a 20 20 '....A.......A.  '
Checksum: 0xc8

----------------

Warnings:

Block 0, Base EDID:
  Alphanumeric Data String: Non-ASCII character 0x80 at position 5, can cause problems.
  Missing Display Product Name.

Failures:

Block 0, Base EDID:
  Missing Display Range Limits Descriptor.

EDID conformity: FAIL
