edid-decode (hex):

00 ff ff ff ff ff ff 00 0d ae cc 15 00 00 00 00
2a 19 01 04 95 22 13 78 02 82 05 92 56 53 95 29
24 50 54 00 00 00 01 01 01 01 01 01 01 01 01 01
01 01 01 01 01 01 da 1d 56 e2 50 00 20 30 44 2d
47 00 58 c1 10 00 00 1a e2 17 56 e2 50 00 20 30
44 2d 47 00 58 c1 10 00 00 1a 00 00 00 fe 00 58
4d 39 33 48 80 31 35 36 42 47 4e 0a 00 00 00 00
00 00 41 31 94 01 10 00 00 09 01 0a 20 20 00 31

----------------

Block 0, Base EDID:
  EDID Structure Version & Revision: 1.4
  Vendor & Product Identification:
    Manufacturer: CMN
    Model: 5580
    Made in: week 42 of 2015
  Basic Display Parameters & Features:
    Digital display
    Bits per primary color channel: 6
    DisplayPort interface
    Maximum image size: 34 cm x 19 cm
    Gamma: 2.20
    Supported color formats: RGB 4:4:4
    First detailed timing includes the native pixel format and preferred refresh rate
  Color Characteristics:
    Red  : 0.5722, 0.3359
    Green: 0.3242, 0.5839
    Blue : 0.1601, 0.1406
    White: 0.3134, 0.3291
  Established Timings I & II: none
  Standard Timings: none
  Detailed Timing Descriptors:
    DTD 1:  1366x768    60.003141 Hz 683:384   48.003 kHz     76.420000 MHz (344 mm x 193 mm)
                 Hfront   68 Hsync  45 Hback  113 Hpol P
                 Vfront    4 Vsync   7 Vback   21 Vpol N
    DTD 2:  1366x768    48.005653 Hz 683:384   38.405 kHz     61.140000 MHz (344 mm x 193 mm)
                 Hfront   68 Hsync  45 Hback  113 Hpol P
                 Vfront    4 Vsync   7 Vback   21 Vpol N
    Alphanumeric Data String: 'XM93H.156BGN'
    Manufacturer-Specified Display Descriptor (0x00): 00 00 00 00 41 31 94 01 10 00 00 09 01 0a 20 20 '....A1........  '
Checksum: 0x31

----------------

Warnings:

Block 0, Base EDID:
  Alphanumeric Data String: Non-ASCII character 0x80 at position 5, can cause problems.
  Missing Display Product Name.

EDID conformity: PASS
