edid-decode (hex):

00 ff ff ff ff ff ff 00 1e 6d 1b 77 3c 96 01 00
01 1e 01 04 b5 46 27 78 9f 94 95 ab 4f 41 ae 26
13 50 54 25 6b 80 71 40 81 80 81 c0 a9 c0 b3 00
d1 c0 81 00 d1 cf 28 de 00 50 a0 a0 38 50 08 30
08 04 b9 88 21 00 00 1a b8 bc 00 50 a0 a0 55 50
08 38 f8 0c b9 88 21 00 00 1a 00 00 00 fd 00 78
90 e6 e6 3c 01 0a 20 20 20 20 20 20 00 00 00 fc
00 4c 47 20 48 44 52 20 51 48 44 0a 20 20 01 05

02 03 10 71 23 09 06 07 e3 05 c0 00 e3 06 05 01
56 5e 00 a0 a0 a0 29 50 30 20 35 00 b9 88 21 00
00 1a 00 00 00 00 00 00 00 00 00 00 00 00 00 00
00 00 00 00 00 00 00 00 00 00 00 00 00 00 00 00
00 00 00 00 00 00 00 00 00 00 00 00 00 00 00 00
00 00 00 00 00 00 00 00 00 00 00 00 00 00 00 00
00 00 00 00 00 00 00 00 00 00 00 00 00 00 00 00
00 00 00 00 00 00 00 00 00 00 00 00 00 00 00 9c

00 ff ff ff ff ff ff 00 1e 6d 1b 77 3c 96 01 00
01 1e 01 04 b5 46 27 78 9f 94 95 ab 4f 41 ae 26
13 50 54 25 6b 80 71 40 81 80 81 c0 a9 c0 b3 00
d1 c0 81 00 d1 cf 28 de 00 50 a0 a0 38 50 08 30
08 04 b9 88 21 00 00 1a b8 bc 00 50 a0 a0 55 50
08 38 f8 0c b9 88 21 00 00 1a 00 00 00 fd 00 78
90 e6 e6 3c 01 0a 20 20 20 20 20 20 00 00 00 fc
00 4c 47 20 48 44 52 20 51 48 44 0a 20 20 01 05

02 03 10 71 23 09 06 07 e3 05 c0 00 e3 06 05 01
56 5e 00 a0 a0 a0 29 50 30 20 35 00 b9 88 21 00
00 1a 00 00 00 00 00 00 00 00 00 00 00 00 00 00
00 00 00 00 00 00 00 00 00 00 00 00 00 00 00 00
00 00 00 00 00 00 00 00 00 00 00 00 00 00 00 00
00 00 00 00 00 00 00 00 00 00 00 00 00 00 00 00
00 00 00 00 00 00 00 00 00 00 00 00 00 00 00 00
00 00 00 00 00 00 00 00 00 00 00 00 00 00 00 9c

----------------

Block 0, Base EDID:
  EDID Structure Version & Revision: 1.4
  Vendor & Product Identification:
    Manufacturer: GSM
    Model: 30491
    Serial Number: ...
    Made in: week 1 of 2020
  Basic Display Parameters & Features:
    Digital display
    Bits per primary color channel: 10
    DisplayPort interface
    Maximum image size: 70 cm x 39 cm
    Gamma: 2.20
    DPMS levels: Standby
    Supported color formats: RGB 4:4:4, YCrCb 4:4:4, YCrCb 4:2:2
    Default (sRGB) color space is primary color space
    First detailed timing includes the native pixel format and preferred refresh rate
    Display supports continuous frequencies
  Color Characteristics:
    Red  : 0.6699, 0.3095
    Green: 0.2548, 0.6796
    Blue : 0.1503, 0.0751
    White: 0.3134, 0.3291
  Established Timings I & II:
    DMT 0x04:   640x480    59.940476 Hz   4:3     31.469 kHz     25.175000 MHz
    DMT 0x06:   640x480    75.000000 Hz   4:3     37.500 kHz     31.500000 MHz
    DMT 0x09:   800x600    60.316541 Hz   4:3     37.879 kHz     40.000000 MHz
    DMT 0x0b:   800x600    75.000000 Hz   4:3     46.875 kHz     49.500000 MHz
    Apple   :   832x624    74.551266 Hz   4:3     49.726 kHz     57.284000 MHz
    DMT 0x10:  1024x768    60.003840 Hz   4:3     48.363 kHz     65.000000 MHz
    DMT 0x12:  1024x768    75.028582 Hz   4:3     60.023 kHz     78.750000 MHz
    DMT 0x24:  1280x1024   75.024675 Hz   5:4     79.976 kHz    135.000000 MHz
    Apple   :  1152x870    75.061550 Hz 192:145   68.681 kHz    100.000000 MHz
  Standard Timings:
    GTF     :  1152x864    60.000000 Hz   4:3     53.700 kHz     81.624000 MHz
    DMT 0x23:  1280x1024   60.019740 Hz   5:4     63.981 kHz    108.000000 MHz
    DMT 0x55:  1280x720    60.000000 Hz  16:9     45.000 kHz     74.250000 MHz
    DMT 0x53:  1600x900    60.000000 Hz  16:9     60.000 kHz    108.000000 MHz (RB)
    DMT 0x3a:  1680x1050   59.954250 Hz  16:10    65.290 kHz    146.250000 MHz
    DMT 0x52:  1920x1080   60.000000 Hz  16:9     67.500 kHz    148.500000 MHz
    DMT 0x1c:  1280x800    59.810326 Hz  16:10    49.702 kHz     83.500000 MHz
    GTF     :  1920x1080   75.000068 Hz  16:9     84.600 kHz    220.637000 MHz
  Detailed Timing Descriptors:
    DTD 1:  2560x1440  144.000162 Hz  16:9    215.424 kHz    568.720000 MHz (697 mm x 392 mm)
                 Hfront    8 Hsync  48 Hback   24 Hpol P
                 Vfront   16 Vsync   8 Vback   32 Vpol N
    DTD 2:  2560x1440  120.000000 Hz  16:9    183.000 kHz    483.120000 MHz (697 mm x 392 mm)
                 Hfront    8 Hsync  56 Hback   16 Hpol P
                 Vfront   63 Vsync   8 Vback   14 Vpol N
    Display Range Limits:
      Monitor ranges (Range Limits Only): 120-144 Hz V, 230-230 kHz H, max dotclock 600 MHz
    Display Product Name: 'LG HDR QHD'
  Extension blocks: 1
Checksum: 0x05

----------------

Block 1, CTA-861 Extension Block:
  Revision: 3
  Basic audio support
  Supports YCbCr 4:4:4
  Supports YCbCr 4:2:2
  Native DTDs: 1
  Audio Data Block:
    Linear PCM:
      Max channels: 2
      Supported sample rates (kHz): 48 44.1
      Supported sample sizes (bits): 24 20 16
  Colorimetry Data Block:
    BT2020YCC
    BT2020RGB
  HDR Static Metadata Data Block:
    Electro optical transfer functions:
      Traditional gamma - SDR luminance range
      SMPTE ST2084
    Supported static metadata descriptors:
      Static metadata type 1
  Detailed Timing Descriptors:
    DTD 3:  2560x1440   59.950550 Hz  16:9     88.787 kHz    241.500000 MHz (697 mm x 392 mm)
                 Hfront   48 Hsync  32 Hback   80 Hpol P
                 Vfront    3 Vsync   5 Vback   33 Vpol N
Checksum: 0x9c  Unused space in Extension Block: 93 bytes

----------------

Warnings:

Block 1, CTA-861 Extension Block:
  IT Video Formats are overscanned by default, but normally this should be underscanned.
EDID:
  Base EDID: Some timings are out of range of the Monitor Ranges:
    Vertical Freq: 59.810 - 144.000 Hz (Monitor: 120.000 - 144.000 Hz)
    Horizontal Freq: 31.468 - 215.424 kHz (Monitor: 230.000 - 230.000 kHz)

Failures:

Block 0, Base EDID:
  Basic Display Parameters & Features: sRGB is signaled, but the chromaticities do not match.
Block 1, CTA-861 Extension Block:
  Missing VCDB, needed for Set Selectable RGB Quantization to avoid interop issues.
EDID:
  Extension Block 2 started with EDID header, ignoring Extension Blocks >= 2.

EDID conformity: FAIL
