edid-decode (hex):

00 ff ff ff ff ff ff 00 21 f4 33 34 01 00 00 00
14 1e 01 03 80 00 00 78 0a 0d c9 a0 57 47 98 27
12 48 4c 00 00 00 01 01 01 01 01 01 01 01 01 01
01 01 01 01 01 01 cc 10 90 8c 10 00 2a 50 46 0a
4a 04 3c bf 00 00 00 18 c0 12 40 c8 10 c8 4c 50
64 0a ca 0c 40 c8 15 00 00 18 00 00 00 fc 00 57
61 76 65 53 68 73 61 72 65 0a 20 20 00 00 00 fd
00 14 78 01 ff 1d 00 0a 20 20 20 20 20 20 01 1e

02 03 1a 71 47 c6 46 46 46 46 46 46 23 09 07 01
83 01 00 00 65 03 0c 00 10 00 c0 12 40 c8 10 c8
4c 50 64 0a ca 0c 40 c8 15 00 00 18 c0 12 40 c8
10 c8 4c 50 64 0a ca 0c 40 c8 15 00 00 18 c0 12
40 c8 10 c8 4c 50 64 0a ca 0c 40 c8 15 00 00 18
c0 12 40 c8 10 c8 4c 50 64 0a ca 0c 40 c8 15 00
00 18 00 00 00 00 00 00 00 00 00 00 00 00 00 00
00 00 00 00 00 00 00 00 00 00 00 00 00 00 00 67

00 ff ff ff ff ff ff 00 21 f4 33 34 01 00 00 00
14 1e 01 03 80 00 00 78 0a 0d c9 a0 57 47 98 27
12 48 4c 00 00 00 01 01 01 01 01 01 01 01 01 01
01 01 01 01 01 01 cc 10 90 8c 10 00 2a 50 46 0a
4a 04 3c bf 00 00 00 18 c0 12 40 c8 10 c8 4c 50
64 0a ca 0c 40 c8 15 00 00 18 00 00 00 fc 00 57
61 76 65 53 68 73 61 72 65 0a 20 20 00 00 00 fd
00 14 78 01 ff 1d 00 0a 20 20 20 20 20 20 01 1e

02 03 1a 71 47 c6 46 46 46 46 46 46 23 09 07 01
83 01 00 00 65 03 0c 00 10 00 c0 12 40 c8 10 c8
4c 50 64 0a ca 0c 40 c8 15 00 00 18 c0 12 40 c8
10 c8 4c 50 64 0a ca 0c 40 c8 15 00 00 18 c0 12
40 c8 10 c8 4c 50 64 0a ca 0c 40 c8 15 00 00 18
c0 12 40 c8 10 c8 4c 50 64 0a ca 0c 40 c8 15 00
00 18 00 00 00 00 00 00 00 00 00 00 00 00 00 00
00 00 00 00 00 00 00 00 00 00 00 00 00 00 00 67

----------------

Block 0, Base EDID:
  EDID Structure Version & Revision: 1.3
  Vendor & Product Identification:
    Manufacturer: HOT
    Model: 13363
    Serial Number: ...
    Made in: week 20 of 2020
  Basic Display Parameters & Features:
    Digital display
    Image size is variable
    Gamma: 2.20
    RGB color display
    First detailed timing is the preferred timing
  Color Characteristics:
    Red  : 0.6250, 0.3398
    Green: 0.2802, 0.5947
    Blue : 0.1552, 0.0703
    White: 0.2832, 0.2978
  Established Timings I & II: none
  Standard Timings: none
  Detailed Timing Descriptors:
    DTD  1:   400x1280   60.234213 Hz   5:16    79.630 kHz     43.000000 MHz (60 mm x 191 mm)
                  Hfront   70 Hsync  10 Hback   60 Hpol N
                  Vfront   20 Vsync  10 Vback   12 Vpol N
    DTD  2:   320x1480   59.323710 Hz   8:37    92.308 kHz     48.000000 MHz (320 mm x 1480 mm)
                  Hfront  100 Hsync  10 Hback   90 Hpol N
                  Vfront   60 Vsync  10 Vback    6 Vpol N
    Display Product Name: 'WaveShsare'
    Display Range Limits:
      Monitor ranges (GTF): 20-120 Hz V, 1-255 kHz H, max dotclock 290 MHz
  Extension blocks: 1
Checksum: 0x1e

----------------

Block 1, CTA-861 Extension Block:
  Revision: 3
  Basic audio support
  Supports YCbCr 4:4:4
  Supports YCbCr 4:2:2
  Native detailed modes: 1
  Video Data Block:
    VIC 198:  7680x4320   50.000000 Hz  16:9    220.000 kHz   2376.000000 MHz
    VIC  70:  1280x720   100.000000 Hz  64:27    75.000 kHz    148.500000 MHz
    VIC  70:  1280x720   100.000000 Hz  64:27    75.000 kHz    148.500000 MHz
    VIC  70:  1280x720   100.000000 Hz  64:27    75.000 kHz    148.500000 MHz
    VIC  70:  1280x720   100.000000 Hz  64:27    75.000 kHz    148.500000 MHz
    VIC  70:  1280x720   100.000000 Hz  64:27    75.000 kHz    148.500000 MHz
    VIC  70:  1280x720   100.000000 Hz  64:27    75.000 kHz    148.500000 MHz
  Audio Data Block:
    Linear PCM:
      Max channels: 2
      Supported sample rates (kHz): 48 44.1 32
      Supported sample sizes (bits): 16
  Speaker Allocation Data Block:
    FL/FR - Front Left/Right
  Vendor-Specific Data Block (HDMI), OUI 00-0C-03:
    Source physical address: 1.0.0.0
  Detailed Timing Descriptors:
    DTD  3:   320x1480   59.323710 Hz   8:37    92.308 kHz     48.000000 MHz (320 mm x 1480 mm)
                  Hfront  100 Hsync  10 Hback   90 Hpol N
                  Vfront   60 Vsync  10 Vback    6 Vpol N
    DTD  4:   320x1480   59.323710 Hz   8:37    92.308 kHz     48.000000 MHz (320 mm x 1480 mm)
                  Hfront  100 Hsync  10 Hback   90 Hpol N
                  Vfront   60 Vsync  10 Vback    6 Vpol N
    DTD  5:   320x1480   59.323710 Hz   8:37    92.308 kHz     48.000000 MHz (320 mm x 1480 mm)
                  Hfront  100 Hsync  10 Hback   90 Hpol N
                  Vfront   60 Vsync  10 Vback    6 Vpol N
    DTD  6:   320x1480   59.323710 Hz   8:37    92.308 kHz     48.000000 MHz (320 mm x 1480 mm)
                  Hfront  100 Hsync  10 Hback   90 Hpol N
                  Vfront   60 Vsync  10 Vback    6 Vpol N
Checksum: 0x67  Unused space in Extension Block: 29 bytes

----------------

Block 2, Unknown EDID Extension Block 0x00:
  00 ff ff ff ff ff ff 00 21 f4 33 34 01 00 00 00 '........!.34....'
  14 1e 01 03 80 00 00 78 0a 0d c9 a0 57 47 98 27 '.......x....WG.''
  12 48 4c 00 00 00 01 01 01 01 01 01 01 01 01 01 '.HL.............'
  01 01 01 01 01 01 cc 10 90 8c 10 00 2a 50 46 0a '............*PF.'
  4a 04 3c bf 00 00 00 18 c0 12 40 c8 10 c8 4c 50 'J.<.......@...LP'
  64 0a ca 0c 40 c8 15 00 00 18 00 00 00 fc 00 57 'd...@..........W'
  61 76 65 53 68 73 61 72 65 0a 20 20 00 00 00 fd 'aveShsare.  ....'
  00 14 78 01 ff 1d 00 0a 20 20 20 20 20 20 01 1e '..x.....      ..'
Checksum: 0x1e

----------------

Block 3, CTA-861 Extension Block:
  Revision: 3
  Basic audio support
  Supports YCbCr 4:4:4
  Supports YCbCr 4:2:2
  Native detailed modes: 1
  Video Data Block:
    VIC 198:  7680x4320   50.000000 Hz  16:9    220.000 kHz   2376.000000 MHz
    VIC  70:  1280x720   100.000000 Hz  64:27    75.000 kHz    148.500000 MHz
    VIC  70:  1280x720   100.000000 Hz  64:27    75.000 kHz    148.500000 MHz
    VIC  70:  1280x720   100.000000 Hz  64:27    75.000 kHz    148.500000 MHz
    VIC  70:  1280x720   100.000000 Hz  64:27    75.000 kHz    148.500000 MHz
    VIC  70:  1280x720   100.000000 Hz  64:27    75.000 kHz    148.500000 MHz
    VIC  70:  1280x720   100.000000 Hz  64:27    75.000 kHz    148.500000 MHz
  Audio Data Block:
    Linear PCM:
      Max channels: 2
      Supported sample rates (kHz): 48 44.1 32
      Supported sample sizes (bits): 16
  Speaker Allocation Data Block:
    FL/FR - Front Left/Right
  Vendor-Specific Data Block (HDMI), OUI 00-0C-03:
    Source physical address: 1.0.0.0
  Detailed Timing Descriptors:
    DTD  7:   320x1480   59.323710 Hz   8:37    92.308 kHz     48.000000 MHz (320 mm x 1480 mm)
                  Hfront  100 Hsync  10 Hback   90 Hpol N
                  Vfront   60 Vsync  10 Vback    6 Vpol N
    DTD  8:   320x1480   59.323710 Hz   8:37    92.308 kHz     48.000000 MHz (320 mm x 1480 mm)
                  Hfront  100 Hsync  10 Hback   90 Hpol N
                  Vfront   60 Vsync  10 Vback    6 Vpol N
    DTD  9:   320x1480   59.323710 Hz   8:37    92.308 kHz     48.000000 MHz (320 mm x 1480 mm)
                  Hfront  100 Hsync  10 Hback   90 Hpol N
                  Vfront   60 Vsync  10 Vback    6 Vpol N
    DTD 10:   320x1480   59.323710 Hz   8:37    92.308 kHz     48.000000 MHz (320 mm x 1480 mm)
                  Hfront  100 Hsync  10 Hback   90 Hpol N
                  Vfront   60 Vsync  10 Vback    6 Vpol N
Checksum: 0x67  Unused space in Extension Block: 29 bytes

----------------

Warnings:

Block 0, Base EDID:
  Vendor & Product Identification: The serial number is one of the known dummy values, it should probably be set to 0.
  Detailed Timing Descriptor #1: Dubious image size (60x191 mm is smaller than 100x100 mm).
Block 1, CTA-861 Extension Block:
  IT Video Formats are overscanned by default, but normally this should be underscanned.
  Video Data Block: The first VIC 198 has width or height >= 4096, adding a VFPDB and NVRDB is strongly recommended.
  Add a Colorimetry Data Block with the sRGB colorimetry bit set to avoid interop issues.
Block 3, CTA-861 Extension Block:
  IT Video Formats are overscanned by default, but normally this should be underscanned.
EDID:
  Base EDID: Some timings are out of range of the Monitor Ranges:
    Maximum Clock: 2376.000 MHz (Monitor: 290.000 MHz)
  CTA-861: Native progressive resolution of 400x1280 is smaller than the max preferred progressive resolution 7680x4320.

Failures:

Block 1, CTA-861 Extension Block:
  Video Data Block: Duplicate VIC 70.
  Required 640x480p60 timings are missing in the established timings and the SVD list (VIC 1).
  Missing VCDB, needed for Set Selectable RGB Quantization to avoid interop issues.
Block 2, Base EDID:
  Unknown Extension Block.
Block 3, CTA-861 Extension Block:
  Video Data Block: Duplicate VIC 198.
  Speaker Allocation Data Block: Only one instance of this Data Block is allowed.
EDID:
  Base EDID: The DTD max image size is 320x1480mm, but the display size is not specified anywhere.
  Base EDID: EDID specified 1 extension block(s), but found 3 extension block(s).
  Base EDID: EDID 1.3 requires a Block Map Extension in Block 1 if there are more than 2 blocks in the EDID.

EDID conformity: FAIL
