edid-decode (hex):

00 ff ff ff ff ff ff 00 0d ae 56 15 00 00 00 00
1f 20 01 04 a5 22 13 78 03 ee 95 a3 54 4c 99 26
0f 50 54 00 00 00 01 01 01 01 01 01 01 01 01 01
01 01 01 01 01 01 ad 37 80 a0 70 38 3e 40 30 20
a5 00 58 c1 10 00 00 18 00 00 00 fd 00 3c 90 a5
a5 22 01 0a 20 20 20 20 20 20 00 00 00 fc 00 4e
31 35 36 48 4d 41 2d 47 41 31 0a 20 00 00 00 fe
00 43 4d 4e 0a 20 20 20 20 20 20 20 20 20 01 cc

70 20 79 02 00 22 00 14 24 38 05 85 7f 07 9f 00
2f 00 1f 00 37 04 3d 00 09 00 04 00 2b 00 06 27
00 3c 8f 00 00 00 00 00 00 00 00 00 00 00 00 00
00 00 00 00 00 00 00 00 00 00 00 00 00 00 00 00
00 00 00 00 00 00 00 00 00 00 00 00 00 00 00 00
00 00 00 00 00 00 00 00 00 00 00 00 00 00 00 00
00 00 00 00 00 00 00 00 00 00 00 00 00 00 00 00
00 00 00 00 00 00 00 00 00 00 00 00 00 00 2e 90

00 ff ff ff ff ff ff 00 0d ae 56 15 00 00 00 00
1f 20 01 04 a5 22 13 78 03 ee 95 a3 54 4c 99 26
0f 50 54 00 00 00 01 01 01 01 01 01 01 01 01 01
01 01 01 01 01 01 ad 37 80 a0 70 38 3e 40 30 20
a5 00 58 c1 10 00 00 18 00 00 00 fd 00 3c 90 a5
a5 22 01 0a 20 20 20 20 20 20 00 00 00 fc 00 4e
31 35 36 48 4d 41 2d 47 41 31 0a 20 00 00 00 fe
00 43 4d 4e 0a 20 20 20 20 20 20 20 20 20 01 cc

70 20 79 02 00 22 00 14 24 38 05 85 7f 07 9f 00
2f 00 1f 00 37 04 3d 00 09 00 04 00 2b 00 06 27
00 3c 8f 00 00 00 00 00 00 00 00 00 00 00 00 00
00 00 00 00 00 00 00 00 00 00 00 00 00 00 00 00
00 00 00 00 00 00 00 00 00 00 00 00 00 00 00 00
00 00 00 00 00 00 00 00 00 00 00 00 00 00 00 00
00 00 00 00 00 00 00 00 00 00 00 00 00 00 00 00
00 00 00 00 00 00 00 00 00 00 00 00 00 00 2e 90

----------------

Block 0, Base EDID:
  EDID Structure Version & Revision: 1.4
  Vendor & Product Identification:
    Manufacturer: CMN
    Model: 5462
    Made in: week 31 of 2022
  Basic Display Parameters & Features:
    Digital display
    Bits per primary color channel: 8
    DisplayPort interface
    Maximum image size: 34 cm x 19 cm
    Gamma: 2.20
    Supported color formats: RGB 4:4:4
    First detailed timing includes the native pixel format and preferred refresh rate
    Display supports continuous frequencies
  Color Characteristics:
    Red  : 0.6396, 0.3300
    Green: 0.2998, 0.5996
    Blue : 0.1503, 0.0595
    White: 0.3134, 0.3291
  Established Timings I & II: none
  Standard Timings: none
  Detailed Timing Descriptors:
    DTD 1:  1920x1080   60.003536 Hz  16:9     68.524 kHz    142.530000 MHz (344 mm x 193 mm)
                 Hfront   48 Hsync  32 Hback   80 Hpol N
                 Vfront   10 Vsync   5 Vback   47 Vpol N
    Display Range Limits:
      Monitor ranges (Range Limits Only): 60-144 Hz V, 165-165 kHz H, max dotclock 340 MHz
    Display Product Name: 'N156HMA-GA1'
    Alphanumeric Data String: 'CMN'
  Extension blocks: 1
Checksum: 0xcc

----------------

Block 1, DisplayID Extension Block:
  Version: 2.0
  Extension Count: 0
  Display Product Primary Use Case: None of the listed primary use cases; generic display
  Video Timing Modes Type 7 - Detailed Timings Data Block:
    DTD:  1920x1080  144.000488 Hz  16:10   164.449 kHz    342.053000 MHz (aspect 16:10, no 3D stereo, preferred)
               Hfront   48 Hsync  32 Hback   80 Hpol N
               Vfront   10 Vsync   5 Vback   47 Vpol N
  Adaptive Sync Data Block:
    Descriptor #1:
      Native Panel Range
      Fixed Average V-Total and Adaptive V-Total
      Supports Seamless Transition
      'Max Single Frame Duration Increase' field value without jitter impact
      'Max Single Frame Duration Decrease' field value without jitter impact
      Max Duration Increase: 0.00 ms
      Max Duration Decrease: 0.00 ms
      Min Refresh Rate: 60 Hz
      Max Refresh Rate: 144 Hz
  Checksum: 0x2e
Checksum: 0x90

----------------

Block 2, Unknown EDID Extension Block 0x00:
  00 ff ff ff ff ff ff 00 0d ae 56 15 00 00 00 00 '..........V.....'
  1f 20 01 04 a5 22 13 78 03 ee 95 a3 54 4c 99 26 '. ...".x....TL.&'
  0f 50 54 00 00 00 01 01 01 01 01 01 01 01 01 01 '.PT.............'
  01 01 01 01 01 01 ad 37 80 a0 70 38 3e 40 30 20 '.......7..p8>@0 '
  a5 00 58 c1 10 00 00 18 00 00 00 fd 00 3c 90 a5 '..X..........<..'
  a5 22 01 0a 20 20 20 20 20 20 00 00 00 fc 00 4e '."..      .....N'
  31 35 36 48 4d 41 2d 47 41 31 0a 20 00 00 00 fe '156HMA-GA1. ....'
  00 43 4d 4e 0a 20 20 20 20 20 20 20 20 20 01 cc '.CMN.         ..'
Checksum: 0xcc

----------------

Block 3, DisplayID Extension Block:
  Version: 2.0
  Extension Count: 0
  Video Timing Modes Type 7 - Detailed Timings Data Block:
    DTD:  1920x1080  144.000488 Hz  16:10   164.449 kHz    342.053000 MHz (aspect 16:10, no 3D stereo, preferred)
               Hfront   48 Hsync  32 Hback   80 Hpol N
               Vfront   10 Vsync   5 Vback   47 Vpol N
  Adaptive Sync Data Block:
    Descriptor #1:
      Native Panel Range
      Fixed Average V-Total and Adaptive V-Total
      Supports Seamless Transition
      'Max Single Frame Duration Increase' field value without jitter impact
      'Max Single Frame Duration Decrease' field value without jitter impact
      Max Duration Increase: 0.00 ms
      Max Duration Decrease: 0.00 ms
      Min Refresh Rate: 60 Hz
      Max Refresh Rate: 144 Hz
  Checksum: 0x2e
Checksum: 0x90

----------------

Warnings:

EDID:
  Base EDID: Some timings are out of range of the Monitor Ranges:
    Horizontal Freq: 68.524 - 164.448 kHz (Monitor: 165.000 - 165.000 kHz)
    Maximum Clock: 342.053 MHz (Monitor: 340.000 MHz)

Failures:

Block 1, DisplayID Extension Block:
  Expected 0 DisplayID Extension Block, but got 1.
Block 2, Base EDID:
  Unknown Extension Block.
Block 3, DisplayID Extension Block:
  Product Type should be 0 in extension block.
EDID:
  Base EDID: EDID specified 1 extension block(s), but found 3 extension block(s).
  DisplayID: Missing DisplayID Display Parameters Data Block.

EDID conformity: FAIL
