edid-decode (hex):

00 ff ff ff ff ff ff 00 30 ae a2 63 36 59 46 42
2a 20 01 03 80 3c 22 78 2e 6e a5 ad 50 43 a7 23
0f 50 54 b5 6b 00 71 4f 81 80 95 00 95 0f a9 40
a9 4a b3 00 d1 c0 56 5e 00 a0 a0 a0 29 50 30 20
35 00 55 50 21 00 00 1e 00 00 00 ff 00 56 33 30
41 42 46 59 36 0a 20 20 20 20 00 00 00 fd 00 30
46 1e 72 22 00 0a 20 20 20 20 20 20 00 00 00 fc
00 50 32 37 71 2d 33 30 0a 20 20 20 20 20 01 d0

02 03 35 f1 4a 01 03 02 04 90 12 11 13 1f 4c 23
09 07 07 83 01 00 00 67 03 0c 00 10 00 38 44 67
d8 5d c4 01 78 80 00 e3 05 c0 00 e6 06 05 01 5a
34 3d e2 00 6a 0e 1f 00 80 51 00 1e 30 40 80 37
00 55 50 21 00 00 1c 9e 20 00 90 51 20 1f 30 48
80 36 00 55 50 21 00 00 1c 66 21 56 aa 51 00 1e
30 46 8f 33 00 55 50 21 00 00 1e 47 6d 00 a0 a0
a0 1e 50 30 20 35 00 55 50 21 00 00 1a 00 00 fa

00 ff ff ff ff ff ff 00 30 ae a2 63 36 59 46 42
2a 20 01 03 80 3c 22 78 2e 6e a5 ad 50 43 a7 23
0f 50 54 b5 6b 00 71 4f 81 80 95 00 95 0f a9 40
a9 4a b3 00 d1 c0 56 5e 00 a0 a0 a0 29 50 30 20
35 00 55 50 21 00 00 1e 00 00 00 ff 00 56 33 30
41 42 46 59 36 0a 20 20 20 20 00 00 00 fd 00 30
46 1e 72 22 00 0a 20 20 20 20 20 20 00 00 00 fc
00 50 32 37 71 2d 33 30 0a 20 20 20 20 20 01 d0

02 03 35 f1 4a 01 03 02 04 90 12 11 13 1f 4c 23
09 07 07 83 01 00 00 67 03 0c 00 10 00 38 44 67
d8 5d c4 01 78 80 00 e3 05 c0 00 e6 06 05 01 5a
34 3d e2 00 6a 0e 1f 00 80 51 00 1e 30 40 80 37
00 55 50 21 00 00 1c 9e 20 00 90 51 20 1f 30 48
80 36 00 55 50 21 00 00 1c 66 21 56 aa 51 00 1e
30 46 8f 33 00 55 50 21 00 00 1e 47 6d 00 a0 a0
a0 1e 50 30 20 35 00 55 50 21 00 00 1a 00 00 fa

----------------

Block 0, Base EDID:
  EDID Structure Version & Revision: 1.3
  Vendor & Product Identification:
    Manufacturer: LEN
    Model: 25506
    Serial Number: ...
    Made in: week 42 of 2022
  Basic Display Parameters & Features:
    Digital display
    Maximum image size: 60 cm x 34 cm
    Gamma: 2.20
    DPMS levels: Off
    RGB color display
    Default (sRGB) color space is primary color space
    First detailed timing is the preferred timing
  Color Characteristics:
    Red  : 0.6767, 0.3144
    Green: 0.2646, 0.6542
    Blue : 0.1386, 0.0605
    White: 0.3134, 0.3291
  Established Timings I & II:
    IBM     :   720x400    70.081663 Hz   9:5     31.467 kHz     28.320000 MHz
    DMT 0x04:   640x480    59.940476 Hz   4:3     31.469 kHz     25.175000 MHz
    Apple   :   640x480    66.666667 Hz   4:3     35.000 kHz     30.240000 MHz
    DMT 0x06:   640x480    75.000000 Hz   4:3     37.500 kHz     31.500000 MHz
    DMT 0x09:   800x600    60.316541 Hz   4:3     37.879 kHz     40.000000 MHz
    DMT 0x0b:   800x600    75.000000 Hz   4:3     46.875 kHz     49.500000 MHz
    Apple   :   832x624    74.551266 Hz   4:3     49.726 kHz     57.284000 MHz
    DMT 0x10:  1024x768    60.003840 Hz   4:3     48.363 kHz     65.000000 MHz
    DMT 0x12:  1024x768    75.028582 Hz   4:3     60.023 kHz     78.750000 MHz
    DMT 0x24:  1280x1024   75.024675 Hz   5:4     79.976 kHz    135.000000 MHz
  Standard Timings:
    DMT 0x15:  1152x864    75.000000 Hz   4:3     67.500 kHz    108.000000 MHz
    DMT 0x23:  1280x1024   60.019740 Hz   5:4     63.981 kHz    108.000000 MHz
    DMT 0x2f:  1440x900    59.887445 Hz  16:10    55.935 kHz    106.500000 MHz
    DMT 0x30:  1440x900    74.984427 Hz  16:10    70.635 kHz    136.750000 MHz
    DMT 0x33:  1600x1200   60.000000 Hz   4:3     75.000 kHz    162.000000 MHz
    DMT 0x35:  1600x1200   70.000000 Hz   4:3     87.500 kHz    189.000000 MHz
    DMT 0x3a:  1680x1050   59.954250 Hz  16:10    65.290 kHz    146.250000 MHz
    DMT 0x52:  1920x1080   60.000000 Hz  16:9     67.500 kHz    148.500000 MHz
  Detailed Timing Descriptors:
    DTD 1:  2560x1440   59.950550 Hz  16:9     88.787 kHz    241.500000 MHz (597 mm x 336 mm)
                 Hfront   48 Hsync  32 Hback   80 Hpol P
                 Vfront    3 Vsync   5 Vback   33 Vpol P
    Display Product Serial Number: ...
    Display Range Limits:
      Monitor ranges (GTF): 48-70 Hz V, 30-114 kHz H, max dotclock 340 MHz
    Display Product Name: 'P27q-30'
  Extension blocks: 1
Checksum: 0xd0

----------------

Block 1, CTA-861 Extension Block:
  Revision: 3
  Underscans IT Video Formats by default
  Basic audio support
  Supports YCbCr 4:4:4
  Supports YCbCr 4:2:2
  Native DTDs: 1
  Video Data Block:
    VIC   1:   640x480    59.940476 Hz   4:3     31.469 kHz     25.175000 MHz
    VIC   3:   720x480    59.940060 Hz  16:9     31.469 kHz     27.000000 MHz
    VIC   2:   720x480    59.940060 Hz   4:3     31.469 kHz     27.000000 MHz
    VIC   4:  1280x720    60.000000 Hz  16:9     45.000 kHz     74.250000 MHz
    VIC  16:  1920x1080   60.000000 Hz  16:9     67.500 kHz    148.500000 MHz (native)
    VIC  18:   720x576    50.000000 Hz  16:9     31.250 kHz     27.000000 MHz
    VIC  17:   720x576    50.000000 Hz   4:3     31.250 kHz     27.000000 MHz
    VIC  19:  1280x720    50.000000 Hz  16:9     37.500 kHz     74.250000 MHz
    VIC  31:  1920x1080   50.000000 Hz  16:9     56.250 kHz    148.500000 MHz
    VIC  76:  1920x1080   60.000000 Hz  64:27    67.500 kHz    148.500000 MHz
  Audio Data Block:
    Linear PCM:
      Max channels: 2
      Supported sample rates (kHz): 48 44.1 32
      Supported sample sizes (bits): 24 20 16
  Speaker Allocation Data Block:
    FL/FR - Front Left/Right
  Vendor-Specific Data Block (HDMI), OUI 00-0C-03:
    Source physical address: 1.0.0.0
    DC_36bit
    DC_30bit
    DC_Y444
    Maximum TMDS clock: 340 MHz
  Vendor-Specific Data Block (HDMI Forum), OUI C4-5D-D8:
    Version: 1
    Maximum TMDS Character Rate: 600 MHz
    SCDC Present
  Colorimetry Data Block:
    BT2020YCC
    BT2020RGB
  HDR Static Metadata Data Block:
    Electro optical transfer functions:
      Traditional gamma - SDR luminance range
      SMPTE ST2084
    Supported static metadata descriptors:
      Static metadata type 1
    Desired content max luminance: 90 (351.250 cd/m^2)
    Desired content max frame-average luminance: 52 (154.221 cd/m^2)
    Desired content min luminance: 61 (0.201 cd/m^2)
  Video Capability Data Block:
    YCbCr quantization: No Data
    RGB quantization: Selectable (via AVI Q)
    PT scan behavior: Always Underscanned
    IT scan behavior: Always Underscanned
    CE scan behavior: Always Underscanned
  Detailed Timing Descriptors:
    DTD 2:  1280x768    59.870228 Hz   5:3     47.776 kHz     79.500000 MHz (597 mm x 336 mm)
                 Hfront   64 Hsync 128 Hback  192 Hpol N
                 Vfront    3 Vsync   7 Vback   20 Vpol P
    DTD 3:  1280x800    59.810326 Hz  16:10    49.702 kHz     83.500000 MHz (597 mm x 336 mm)
                 Hfront   72 Hsync 128 Hback  200 Hpol N
                 Vfront    3 Vsync   6 Vback   22 Vpol P
    DTD 4:  1366x768    59.789541 Hz 683:384   47.712 kHz     85.500000 MHz (597 mm x 336 mm)
                 Hfront   70 Hsync 143 Hback  213 Hpol P
                 Vfront    3 Vsync   3 Vback   24 Vpol P
    DTD 5:  2560x1440   69.965486 Hz  16:9    102.849 kHz    279.750000 MHz (597 mm x 336 mm)
                 Hfront   48 Hsync  32 Hback   80 Hpol P
                 Vfront    3 Vsync   5 Vback   22 Vpol N
Checksum: 0xfa  Unused space in Extension Block: 2 bytes

----------------

Warnings:

Block 1, CTA-861 Extension Block:
  Video Data Block: VIC 1 and the first DTD are not identical. Is this intended?
  Video Capability Data Block: Set Selectable YCbCr Quantization to avoid interop issues.
  Video Capability Data Block: S_PT is equal to S_IT and S_CE, so should be set to 0 instead.
  Detailed Timing Descriptor #2: Image size is 597x336 mm, but based on the picture AR it should be 560x336 mm.
  Detailed Timing Descriptor #3: Image size is 597x336 mm, but based on the picture AR it should be 537x336 mm.
  Display Product Serial Number is set, so the Serial Number in the Base EDID should be 0.
EDID:
  Base EDID: Some timings are out of range of the Monitor Ranges:
    Vertical Freq: 50.000 - 75.029 Hz (Monitor: 48.000 - 70.000 Hz)

Failures:

Block 0, Base EDID:
  Basic Display Parameters & Features: sRGB is signaled, but the chromaticities do not match.
EDID:
  Extension Block 2 started with EDID header, ignoring Extension Blocks >= 2.
  CTA-861: Native progressive timings are a mix of several resolutions.

EDID conformity: FAIL
