edid-decode (hex):

00 ff ff ff ff ff ff 00 66 64 90 01 01 00 00 00
14 1c 01 03 80 29 1a 78 ca d7 a5 a2 59 4a 96 24
14 50 54 ad cf 00 95 00 81 00 81 40 81 40 81 80
81 c0 61 40 01 01 9a 29 a0 d0 51 84 22 30 50 98
36 00 55 00 11 00 00 1c 0e 1f 00 80 51 00 1e 30
30 20 37 00 70 cf 10 00 00 1a 66 21 50 aa 51 00
1e 30 46 8f 33 00 aa ef 10 00 00 1e 00 00 00 fc
00 48 44 4d 49 0a 20 20 20 20 20 20 20 20 01 f7

02 03 1c f1 49 01 02 03 04 01 07 81 12 13 23 09
07 07 83 01 00 00 65 03 0c 00 10 00 9a 29 a0 d0
51 84 22 30 50 98 36 00 55 00 11 00 00 1e 01 1d
00 bc 52 d0 1e 20 b8 28 55 40 e8 12 11 00 00 1e
00 00 00 00 00 00 00 00 00 00 00 00 00 00 00 00
00 00 00 00 00 00 00 00 00 00 00 00 00 00 00 00
00 00 00 00 00 00 00 00 00 00 00 00 00 00 00 00
00 00 00 00 00 00 00 00 00 00 00 00 00 00 00 d7

00 ff ff ff ff ff ff 00 66 64 90 01 01 00 00 00
14 1c 01 03 80 29 1a 78 ca d7 a5 a2 59 4a 96 24
14 50 54 ad cf 00 95 00 81 00 81 40 81 40 81 80
81 c0 61 40 01 01 9a 29 a0 d0 51 84 22 30 50 98
36 00 55 00 11 00 00 1c 0e 1f 00 80 51 00 1e 30
30 20 37 00 70 cf 10 00 00 1a 66 21 50 aa 51 00
1e 30 46 8f 33 00 aa ef 10 00 00 1e 00 00 00 fc
00 48 44 4d 49 0a 20 20 20 20 20 20 20 20 01 f7

02 03 1c f1 49 01 02 03 04 01 07 81 12 13 23 09
07 07 83 01 00 00 65 03 0c 00 10 00 9a 29 a0 d0
51 84 22 30 50 98 36 00 55 00 11 00 00 1e 01 1d
00 bc 52 d0 1e 20 b8 28 55 40 e8 12 11 00 00 1e
00 00 00 00 00 00 00 00 00 00 00 00 00 00 00 00
00 00 00 00 00 00 00 00 00 00 00 00 00 00 00 00
00 00 00 00 00 00 00 00 00 00 00 00 00 00 00 00
00 00 00 00 00 00 00 00 00 00 00 00 00 00 00 d7

----------------

Block 0, Base EDID:
  EDID Structure Version & Revision: 1.3
  Vendor & Product Identification:
    Manufacturer: YSD
    Model: 400
    Serial Number: ...
    Made in: week 20 of 2018
  Basic Display Parameters & Features:
    Digital display
    Maximum image size: 41 cm x 26 cm
    Gamma: 2.20
    DPMS levels: Standby Suspend
    RGB color display
    First detailed timing is the preferred timing
  Color Characteristics:
    Red  : 0.6357, 0.3486
    Green: 0.2900, 0.5888
    Blue : 0.1425, 0.0800
    White: 0.3134, 0.3291
  Established Timings I & II:
    IBM     :   720x400    70.081663 Hz   9:5     31.467 kHz     28.320000 MHz
    DMT 0x04:   640x480    59.940476 Hz   4:3     31.469 kHz     25.175000 MHz
    DMT 0x05:   640x480    72.808802 Hz   4:3     37.861 kHz     31.500000 MHz
    DMT 0x06:   640x480    75.000000 Hz   4:3     37.500 kHz     31.500000 MHz
    DMT 0x09:   800x600    60.316541 Hz   4:3     37.879 kHz     40.000000 MHz
    DMT 0x0a:   800x600    72.187572 Hz   4:3     48.077 kHz     50.000000 MHz
    DMT 0x0b:   800x600    75.000000 Hz   4:3     46.875 kHz     49.500000 MHz
    DMT 0x10:  1024x768    60.003840 Hz   4:3     48.363 kHz     65.000000 MHz
    DMT 0x11:  1024x768    70.069359 Hz   4:3     56.476 kHz     75.000000 MHz
    DMT 0x12:  1024x768    75.028582 Hz   4:3     60.023 kHz     78.750000 MHz
    DMT 0x24:  1280x1024   75.024675 Hz   5:4     79.976 kHz    135.000000 MHz
  Standard Timings:
    DMT 0x2f:  1440x900    59.887445 Hz  16:10    55.935 kHz    106.500000 MHz
    DMT 0x1c:  1280x800    59.810326 Hz  16:10    49.702 kHz     83.500000 MHz
    DMT 0x20:  1280x960    60.000000 Hz   4:3     60.000 kHz    108.000000 MHz
    DMT 0x20:  1280x960    60.000000 Hz   4:3     60.000 kHz    108.000000 MHz
    DMT 0x23:  1280x1024   60.019740 Hz   5:4     63.981 kHz    108.000000 MHz
    DMT 0x55:  1280x720    60.000000 Hz  16:9     45.000 kHz     74.250000 MHz
    DMT 0x10:  1024x768    60.003840 Hz   4:3     48.363 kHz     65.000000 MHz
  Detailed Timing Descriptors:
    DTD 1:  1440x900    59.887445 Hz  16:10    55.935 kHz    106.500000 MHz (341 mm x 256 mm)
                 Hfront   80 Hsync 152 Hback  232 Hpol N
                 Vfront    3 Vsync   6 Vback   25 Vpol P
    DTD 2:  1280x768    59.870228 Hz   5:3     47.776 kHz     79.500000 MHz (368 mm x 207 mm)
                 Hfront   48 Hsync  32 Hback  304 Hpol P
                 Vfront    3 Vsync   7 Vback   20 Vpol N
    DTD 3:  1360x768    59.990402 Hz  85:48    47.872 kHz     85.500000 MHz (426 mm x 239 mm)
                 Hfront   70 Hsync 143 Hback  213 Hpol P
                 Vfront    3 Vsync   3 Vback   24 Vpol P
    Display Product Name: 'HDMI'
  Extension blocks: 1
Checksum: 0xf7

----------------

Block 1, CTA-861 Extension Block:
  Revision: 3
  Underscans IT Video Formats by default
  Basic audio support
  Supports YCbCr 4:4:4
  Supports YCbCr 4:2:2
  Native DTDs: 1
  Video Data Block:
    VIC   1:   640x480    59.940476 Hz   4:3     31.469 kHz     25.175000 MHz
    VIC   2:   720x480    59.940060 Hz   4:3     31.469 kHz     27.000000 MHz
    VIC   3:   720x480    59.940060 Hz  16:9     31.469 kHz     27.000000 MHz
    VIC   4:  1280x720    60.000000 Hz  16:9     45.000 kHz     74.250000 MHz
    VIC   1:   640x480    59.940476 Hz   4:3     31.469 kHz     25.175000 MHz
    VIC   7:  1440x480i   59.940060 Hz  16:9     15.734 kHz     27.000000 MHz
    VIC   1:   640x480    59.940476 Hz   4:3     31.469 kHz     25.175000 MHz (native)
    VIC  18:   720x576    50.000000 Hz  16:9     31.250 kHz     27.000000 MHz
    VIC  19:  1280x720    50.000000 Hz  16:9     37.500 kHz     74.250000 MHz
  Audio Data Block:
    Linear PCM:
      Max channels: 2
      Supported sample rates (kHz): 48 44.1 32
      Supported sample sizes (bits): 24 20 16
  Speaker Allocation Data Block:
    FL/FR - Front Left/Right
  Vendor-Specific Data Block (HDMI), OUI 00-0C-03:
    Source physical address: 1.0.0.0
  Detailed Timing Descriptors:
    DTD 4:  1440x900    59.887445 Hz  16:10    55.935 kHz    106.500000 MHz (341 mm x 256 mm)
                 Hfront   80 Hsync 152 Hback  232 Hpol P
                 Vfront    3 Vsync   6 Vback   25 Vpol P
    DTD 5:  1280x720    50.000000 Hz  16:9     37.500 kHz     74.250000 MHz (488 mm x 274 mm)
                 Hfront  440 Hsync  40 Hback  220 Hpol P
                 Vfront    5 Vsync   5 Vback   20 Vpol P
Checksum: 0xd7  Unused space in Extension Block: 63 bytes

----------------

Warnings:

Block 0, Base EDID:
  Vendor & Product Identification: The serial number is one of the known dummy values, it should probably be set to 0.
  Detailed Timing Descriptor #1: Image size is 341x256 mm, but based on the picture AR it should be 341x213 mm.
  Detailed Timing Descriptor #2: DTD is similar but not identical to DMT 0x17.
  Detailed Timing Descriptor #2: Image size is 368x207 mm, but based on the picture AR it should be 345x207 mm.
Block 1, CTA-861 Extension Block:
  Video Data Block: VIC 1 and the first DTD are not identical. Is this intended?
  Detailed Timing Descriptor #4: DTD is similar but not identical to DMT 0x2f.
  Detailed Timing Descriptor #4: Image size is 341x256 mm, but based on the picture AR it should be 341x213 mm.
  Add a Colorimetry Data Block with the sRGB colorimetry bit set to avoid interop issues.

Failures:

Block 0, Base EDID:
  Detailed Timing Descriptor #2: Mismatch of image size 368x207 mm vs display size 410x260 mm.
  Detailed Timing Descriptor #3: Mismatch of image size 426x239 mm vs display size 410x260 mm.
  Missing Display Range Limits Descriptor.
Block 1, CTA-861 Extension Block:
  Video Data Block: Duplicate VIC 1.
  Detailed Timing Descriptor #5: Mismatch of image size 488x274 mm vs display size 410x260 mm.
  Missing VCDB, needed for Set Selectable RGB Quantization to avoid interop issues.
EDID:
  Extension Block 2 started with EDID header, ignoring Extension Blocks >= 2.
  Base EDID: The DTD max image size is 488x274mm, which is larger than the display size 410.0x260.0mm.
  CTA-861: Native progressive timings are a mix of several resolutions.

EDID conformity: FAIL
