edid-decode (hex):

00 ff ff ff ff ff ff 00 59 3a 61 00 01 01 01 01
13 13 01 03 80 52 2e 78 0a e6 9d a3 54 4a 99 26
0f 47 4a 2f ca 00 01 01 01 01 01 01 01 01 01 01
01 01 01 01 01 01 02 3a 80 18 71 38 2d 40 58 2c
55 00 fa 3c 32 00 00 1e 00 00 00 fd 00 32 4d 1f
46 0f 00 0a 20 20 20 20 20 20 00 00 00 ff 00 53
41 46 4e 41 4b 31 39 30 30 36 34 33 00 00 00 fc
00 56 4f 33 37 4c 46 48 44 54 56 32 30 41 01 a2

02 03 1c 71 49 00 20 01 03 90 05 12 15 14 23 09
07 03 83 01 00 00 65 03 0c 00 30 00 01 1d 00 72
51 d0 1e 20 6e 28 55 00 fa 3c 32 00 00 1e 01 1d
80 d0 72 1c 16 20 10 2c 25 80 fa 3c 32 00 00 9e
8c 0a d0 8a 20 e0 2d 10 10 3e 96 00 fa 3c 32 00
00 18 01 1d 80 18 71 1c 16 20 58 2c 25 00 fa 3c
32 00 00 9e 8c 0a d0 90 20 40 31 20 0c 40 55 00
fa 3c 32 00 00 18 00 00 00 00 00 00 00 00 00 d9

00 ff ff ff ff ff ff 00 59 3a 61 00 01 01 01 01
13 13 01 03 80 52 2e 78 0a e6 9d a3 54 4a 99 26
0f 47 4a 2f ca 00 01 01 01 01 01 01 01 01 01 01
01 01 01 01 01 01 02 3a 80 18 71 38 2d 40 58 2c
55 00 fa 3c 32 00 00 1e 00 00 00 fd 00 32 4d 1f
46 0f 00 0a 20 20 20 20 20 20 00 00 00 ff 00 53
41 46 4e 41 4b 31 39 30 30 36 34 33 00 00 00 fc
00 56 4f 33 37 4c 46 48 44 54 56 32 30 41 01 a2

02 03 1c 71 49 00 20 01 03 90 05 12 15 14 23 09
07 03 83 01 00 00 65 03 0c 00 30 00 01 1d 00 72
51 d0 1e 20 6e 28 55 00 fa 3c 32 00 00 1e 01 1d
80 d0 72 1c 16 20 10 2c 25 80 fa 3c 32 00 00 9e
8c 0a d0 8a 20 e0 2d 10 10 3e 96 00 fa 3c 32 00
00 18 01 1d 80 18 71 1c 16 20 58 2c 25 00 fa 3c
32 00 00 9e 8c 0a d0 90 20 40 31 20 0c 40 55 00
fa 3c 32 00 00 18 00 00 00 00 00 00 00 00 00 d9

----------------

Block 0, Base EDID:
  EDID Structure Version & Revision: 1.3
  Vendor & Product Identification:
    Manufacturer: VIZ
    Model: 97
    Serial Number: ...
    Made in: week 19 of 2009
  Basic Display Parameters & Features:
    Digital display
    Maximum image size: 82 cm x 46 cm
    Gamma: 2.20
    RGB color display
    First detailed timing is the preferred timing
  Color Characteristics:
    Red  : 0.6396, 0.3300
    Green: 0.2900, 0.5996
    Blue : 0.1503, 0.0595
    White: 0.2802, 0.2900
  Established Timings I & II:
    DMT 0x04:   640x480    59.940476 Hz   4:3     31.469 kHz     25.175000 MHz
    DMT 0x05:   640x480    72.808802 Hz   4:3     37.861 kHz     31.500000 MHz
    DMT 0x06:   640x480    75.000000 Hz   4:3     37.500 kHz     31.500000 MHz
    DMT 0x08:   800x600    56.250000 Hz   4:3     35.156 kHz     36.000000 MHz
    DMT 0x09:   800x600    60.316541 Hz   4:3     37.879 kHz     40.000000 MHz
    DMT 0x0a:   800x600    72.187572 Hz   4:3     48.077 kHz     50.000000 MHz
    DMT 0x0b:   800x600    75.000000 Hz   4:3     46.875 kHz     49.500000 MHz
    DMT 0x10:  1024x768    60.003840 Hz   4:3     48.363 kHz     65.000000 MHz
    DMT 0x12:  1024x768    75.028582 Hz   4:3     60.023 kHz     78.750000 MHz
  Standard Timings: none
  Detailed Timing Descriptors:
    DTD 1:  1920x1080   60.000000 Hz  16:9     67.500 kHz    148.500000 MHz (1018 mm x 572 mm)
                 Hfront   88 Hsync  44 Hback  148 Hpol P
                 Vfront    5 Vsync   5 Vback   35 Vpol P
    Display Range Limits:
      Monitor ranges (GTF): 50-77 Hz V, 31-70 kHz H, max dotclock 150 MHz
    Display Product Serial Number: ...
    Display Product Name: 'VO37LFHDTV20A'
  Extension blocks: 1
Checksum: 0xa2

----------------

Block 1, CTA-861 Extension Block:
  Revision: 3
  Basic audio support
  Supports YCbCr 4:4:4
  Supports YCbCr 4:2:2
  Native DTDs: 1
  Video Data Block:
    VIC  32:  1920x1080   24.000000 Hz  16:9     27.000 kHz     74.250000 MHz
    VIC   1:   640x480    59.940476 Hz   4:3     31.469 kHz     25.175000 MHz
    VIC   3:   720x480    59.940060 Hz  16:9     31.469 kHz     27.000000 MHz
    VIC  16:  1920x1080   60.000000 Hz  16:9     67.500 kHz    148.500000 MHz (native)
    VIC   5:  1920x1080i  60.000000 Hz  16:9     33.750 kHz     74.250000 MHz
    VIC  18:   720x576    50.000000 Hz  16:9     31.250 kHz     27.000000 MHz
    VIC  21:  1440x576i   50.000000 Hz   4:3     15.625 kHz     27.000000 MHz
    VIC  20:  1920x1080i  50.000000 Hz  16:9     28.125 kHz     74.250000 MHz
  Audio Data Block:
    Linear PCM:
      Max channels: 2
      Supported sample rates (kHz): 48 44.1 32
      Supported sample sizes (bits): 20 16
  Speaker Allocation Data Block:
    FL/FR - Front Left/Right
  Vendor-Specific Data Block (HDMI), OUI 00-0C-03:
    Source physical address: 3.0.0.0
  Detailed Timing Descriptors:
    DTD 2:  1280x720    60.000000 Hz  16:9     45.000 kHz     74.250000 MHz (1018 mm x 572 mm)
                 Hfront  110 Hsync  40 Hback  220 Hpol P
                 Vfront    5 Vsync   5 Vback   20 Vpol P
    DTD 3:  1920x1080i  50.000000 Hz  16:9     28.125 kHz     74.250000 MHz (1018 mm x 572 mm)
                 Hfront  528 Hsync  44 Hback  148 Hpol P
                 Vfront    2 Vsync   5 Vback   15 Vpol P Vfront +0.5 Odd Field
                 Vfront    2 Vsync   5 Vback   15 Vpol P Vback  +0.5 Even Field
    DTD 4:   720x480    59.940060 Hz   3:2     31.469 kHz     27.000000 MHz (1018 mm x 572 mm)
                 Hfront   16 Hsync  62 Hback   60 Hpol N
                 Vfront    9 Vsync   6 Vback   30 Vpol N
    DTD 5:  1920x1080i  60.000000 Hz  16:9     33.750 kHz     74.250000 MHz (1018 mm x 572 mm)
                 Hfront   88 Hsync  44 Hback  148 Hpol P
                 Vfront    2 Vsync   5 Vback   15 Vpol P Vfront +0.5 Odd Field
                 Vfront    2 Vsync   5 Vback   15 Vpol P Vback  +0.5 Even Field
    DTD 6:   720x576    50.000000 Hz   5:4     31.250 kHz     27.000000 MHz (1018 mm x 572 mm)
                 Hfront   12 Hsync  64 Hback   68 Hpol N
                 Vfront    5 Vsync   5 Vback   39 Vpol N
Checksum: 0xd9  Unused space in Extension Block: 9 bytes

----------------

Warnings:

Block 0, Base EDID:
  Vendor & Product Identification: The serial number is one of the known dummy values, it should probably be set to 0.
  Detailed Timing Descriptor #1: DTD is similar but not identical to VIC 16.
Block 1, CTA-861 Extension Block:
  IT Video Formats are overscanned by default, but normally this should be underscanned.
  Video Data Block: VIC 32 and the first DTD are not identical. Is this intended?
  Detailed Timing Descriptor #2: DTD is identical to VIC 4, which is not present in the CTA Ext Block.
  Detailed Timing Descriptor #4: Image size is 1018x572 mm, but based on the picture AR it should be 858x572 mm.
  Detailed Timing Descriptor #6: Image size is 1018x572 mm, but based on the picture AR it should be 715x572 mm.
  Display Product Serial Number is set, so the Serial Number in the Base EDID should be 0.
  Add a Colorimetry Data Block with the sRGB colorimetry bit set to avoid interop issues.
EDID:
  Base EDID: Some timings are out of range of the Monitor Ranges:
    Vertical Freq: 24.000 - 75.029 Hz (Monitor: 50.000 - 77.000 Hz)
    Horizontal Freq: 15.625 - 67.500 kHz (Monitor: 31.000 - 70.000 kHz)

Failures:

Block 0, Base EDID:
  Detailed Timing Descriptor #1: Mismatch of image size 1018x572 mm vs display size 820x460 mm.
Block 1, CTA-861 Extension Block:
  Detailed Timing Descriptor #2: Mismatch of image size 1018x572 mm vs display size 820x460 mm.
  Detailed Timing Descriptor #3: Mismatch of image size 1018x572 mm vs display size 820x460 mm.
  Detailed Timing Descriptor #4: Mismatch of image size 1018x572 mm vs display size 820x460 mm.
  Detailed Timing Descriptor #5: Mismatch of image size 1018x572 mm vs display size 820x460 mm.
  Detailed Timing Descriptor #6: Mismatch of image size 1018x572 mm vs display size 820x460 mm.
  Missing VCDB, needed for Set Selectable RGB Quantization to avoid interop issues.
EDID:
  Extension Block 2 started with EDID header, ignoring Extension Blocks >= 2.
  Base EDID: The DTD max image size is 1018x572mm, which is larger than the display size 820.0x460.0mm.

EDID conformity: FAIL
