edid-decode (hex):

00 ff ff ff ff ff ff 00 1c 45 01 00 01 00 00 00
08 12 01 03 80 73 41 78 0a cf 74 a3 57 4c b0 23
09 48 4c 21 08 00 81 80 95 00 90 40 81 00 b3 00
a9 40 d1 00 81 40 02 3a 80 18 71 38 2d 40 58 2c
45 00 10 09 00 00 00 1e 01 1d 80 18 71 1c 16 20
58 2c 25 00 c4 8e 21 00 00 9e 00 00 00 fc 00 4d
61 74 72 69 78 20 53 77 69 74 63 68 00 00 00 fd
00 16 3e 0e 50 10 00 0a 20 20 20 20 20 20 01 ee

02 03 3e 72 4b 90 1f 04 13 85 14 02 11 20 21 22
23 09 07 07 83 01 00 00 e2 00 0f e3 05 03 01 7e
03 0c 00 10 00 08 1e 20 c0 14 00 01 01 0c 08 20
18 20 28 20 38 20 48 20 58 20 88 20 a8 20 8c 0a
d0 8a 20 e0 2d 10 10 3e 96 00 13 8e 21 00 00 18
8c 0a d0 90 20 40 31 20 0c 40 55 00 13 8e 21 00
00 18 01 1d 80 18 71 1c 16 20 58 2c 25 00 c4 8e
21 00 00 9e 00 00 00 00 00 00 00 00 00 00 00 3b

00 ff ff ff ff ff ff 00 1c 45 01 00 01 00 00 00
08 12 01 03 80 73 41 78 0a cf 74 a3 57 4c b0 23
09 48 4c 21 08 00 81 80 95 00 90 40 81 00 b3 00
a9 40 d1 00 81 40 02 3a 80 18 71 38 2d 40 58 2c
45 00 10 09 00 00 00 1e 01 1d 80 18 71 1c 16 20
58 2c 25 00 c4 8e 21 00 00 9e 00 00 00 fc 00 4d
61 74 72 69 78 20 53 77 69 74 63 68 00 00 00 fd
00 16 3e 0e 50 10 00 0a 20 20 20 20 20 20 01 ee

02 03 3e 72 4b 90 1f 04 13 85 14 02 11 20 21 22
23 09 07 07 83 01 00 00 e2 00 0f e3 05 03 01 7e
03 0c 00 10 00 08 1e 20 c0 14 00 01 01 0c 08 20
18 20 28 20 38 20 48 20 58 20 88 20 a8 20 8c 0a
d0 8a 20 e0 2d 10 10 3e 96 00 13 8e 21 00 00 18
8c 0a d0 90 20 40 31 20 0c 40 55 00 13 8e 21 00
00 18 01 1d 80 18 71 1c 16 20 58 2c 25 00 c4 8e
21 00 00 9e 00 00 00 00 00 00 00 00 00 00 00 3b

----------------

Block 0, Base EDID:
  EDID Structure Version & Revision: 1.3
  Vendor & Product Identification:
    Manufacturer: GBE
    Model: 1
    Serial Number: ...
    Made in: week 8 of 2008
  Basic Display Parameters & Features:
    Digital display
    Maximum image size: 115 cm x 65 cm
    Gamma: 2.20
    RGB color display
    First detailed timing is the preferred timing
  Color Characteristics:
    Red  : 0.6396, 0.3398
    Green: 0.2998, 0.6904
    Blue : 0.1376, 0.0380
    White: 0.2822, 0.2968
  Established Timings I & II:
    DMT 0x04:   640x480    59.940476 Hz   4:3     31.469 kHz     25.175000 MHz
    DMT 0x09:   800x600    60.316541 Hz   4:3     37.879 kHz     40.000000 MHz
    DMT 0x10:  1024x768    60.003840 Hz   4:3     48.363 kHz     65.000000 MHz
  Standard Timings:
    DMT 0x23:  1280x1024   60.019740 Hz   5:4     63.981 kHz    108.000000 MHz
    DMT 0x2f:  1440x900    59.887445 Hz  16:10    55.935 kHz    106.500000 MHz
    DMT 0x2a:  1400x1050   59.978442 Hz   4:3     65.317 kHz    121.750000 MHz
    DMT 0x1c:  1280x800    59.810326 Hz  16:10    49.702 kHz     83.500000 MHz
    DMT 0x3a:  1680x1050   59.954250 Hz  16:10    65.290 kHz    146.250000 MHz
    DMT 0x33:  1600x1200   60.000000 Hz   4:3     75.000 kHz    162.000000 MHz
    DMT 0x45:  1920x1200   59.884600 Hz  16:10    74.556 kHz    193.250000 MHz
    DMT 0x20:  1280x960    60.000000 Hz   4:3     60.000 kHz    108.000000 MHz
  Detailed Timing Descriptors:
    DTD 1:  1920x1080   60.000000 Hz  16:9     67.500 kHz    148.500000 MHz (16 mm x 9 mm)
                 Hfront   88 Hsync  44 Hback  148 Hpol P
                 Vfront    4 Vsync   5 Vback   36 Vpol P
    DTD 2:  1920x1080i  60.000000 Hz  16:9     33.750 kHz     74.250000 MHz (708 mm x 398 mm)
                 Hfront   88 Hsync  44 Hback  148 Hpol P
                 Vfront    2 Vsync   5 Vback   15 Vpol P Vfront +0.5 Odd Field
                 Vfront    2 Vsync   5 Vback   15 Vpol P Vback  +0.5 Even Field
    Display Product Name: 'Matrix Switch'
    Display Range Limits:
      Monitor ranges (GTF): 22-62 Hz V, 14-80 kHz H, max dotclock 160 MHz
  Extension blocks: 1
Checksum: 0xee

----------------

Block 1, CTA-861 Extension Block:
  Revision: 3
  Basic audio support
  Supports YCbCr 4:4:4
  Supports YCbCr 4:2:2
  Native detailed modes: 2
  Video Data Block:
    VIC  16:  1920x1080   60.000000 Hz  16:9     67.500 kHz    148.500000 MHz (native)
    VIC  31:  1920x1080   50.000000 Hz  16:9     56.250 kHz    148.500000 MHz
    VIC   4:  1280x720    60.000000 Hz  16:9     45.000 kHz     74.250000 MHz
    VIC  19:  1280x720    50.000000 Hz  16:9     37.500 kHz     74.250000 MHz
    VIC   5:  1920x1080i  60.000000 Hz  16:9     33.750 kHz     74.250000 MHz (native)
    VIC  20:  1920x1080i  50.000000 Hz  16:9     28.125 kHz     74.250000 MHz
    VIC   2:   720x480    59.940060 Hz   4:3     31.469 kHz     27.000000 MHz
    VIC  17:   720x576    50.000000 Hz   4:3     31.250 kHz     27.000000 MHz
    VIC  32:  1920x1080   24.000000 Hz  16:9     27.000 kHz     74.250000 MHz
    VIC  33:  1920x1080   25.000000 Hz  16:9     28.125 kHz     74.250000 MHz
    VIC  34:  1920x1080   30.000000 Hz  16:9     33.750 kHz     74.250000 MHz
  Audio Data Block:
    Linear PCM:
      Max channels: 2
      Supported sample rates (kHz): 48 44.1 32
      Supported sample sizes (bits): 24 20 16
  Speaker Allocation Data Block:
    FL/FR - Front Left/Right
  Video Capability Data Block:
    YCbCr quantization: No Data
    RGB quantization: No Data
    PT scan behavior: No Data
    IT scan behavior: Supports both over- and underscan
    CE scan behavior: Supports both over- and underscan
  Colorimetry Data Block:
    xvYCC601
    xvYCC709
    Gamut Boundary Description Metadata Profile P0
  Vendor-Specific Data Block (HDMI), OUI 00-0C-03:
    Source physical address: 1.0.0.0
    DC_Y444
    Maximum TMDS clock: 150 MHz
    Extended HDMI video details:
      3D present
      3D-capable-VIC mask present
      3D: Frame-packing
      3D VIC indices that support these capabilities:
        VIC   4:  1280x720    60.000000 Hz  16:9     45.000 kHz     74.250000 MHz
        VIC  19:  1280x720    50.000000 Hz  16:9     37.500 kHz     74.250000 MHz
        VIC  32:  1920x1080   24.000000 Hz  16:9     27.000 kHz     74.250000 MHz
      3D VIC indices with specific capabilities:
        VIC  16:  1920x1080   60.000000 Hz  16:9     67.500 kHz    148.500000 MHz (side-by-side, not in use)
        VIC  31:  1920x1080   50.000000 Hz  16:9     56.250 kHz    148.500000 MHz (side-by-side, not in use)
        VIC   4:  1280x720    60.000000 Hz  16:9     45.000 kHz     74.250000 MHz (side-by-side, not in use)
        VIC  19:  1280x720    50.000000 Hz  16:9     37.500 kHz     74.250000 MHz (side-by-side, not in use)
        VIC   5:  1920x1080i  60.000000 Hz  16:9     33.750 kHz     74.250000 MHz (side-by-side, not in use)
        VIC  20:  1920x1080i  50.000000 Hz  16:9     28.125 kHz     74.250000 MHz (side-by-side, not in use)
        VIC  32:  1920x1080   24.000000 Hz  16:9     27.000 kHz     74.250000 MHz (side-by-side, not in use)
        VIC  34:  1920x1080   30.000000 Hz  16:9     33.750 kHz     74.250000 MHz (side-by-side, not in use)
  Detailed Timing Descriptors:
    DTD 3:   720x480    59.940060 Hz   3:2     31.469 kHz     27.000000 MHz (531 mm x 398 mm)
                 Hfront   16 Hsync  62 Hback   60 Hpol N
                 Vfront    9 Vsync   6 Vback   30 Vpol N
    DTD 4:   720x576    50.000000 Hz   5:4     31.250 kHz     27.000000 MHz (531 mm x 398 mm)
                 Hfront   12 Hsync  64 Hback   68 Hpol N
                 Vfront    5 Vsync   5 Vback   39 Vpol N
    DTD 5:  1920x1080i  60.000000 Hz  16:9     33.750 kHz     74.250000 MHz (708 mm x 398 mm)
                 Hfront   88 Hsync  44 Hback  148 Hpol P
                 Vfront    2 Vsync   5 Vback   15 Vpol P Vfront +0.5 Odd Field
                 Vfront    2 Vsync   5 Vback   15 Vpol P Vback  +0.5 Even Field
Checksum: 0x3b  Unused space in Extension Block: 11 bytes

----------------

Block 2, Unknown EDID Extension Block 0x00:
  00 ff ff ff ff ff ff 00 1c 45 01 00 01 00 00 00 '.........E......'
  08 12 01 03 80 73 41 78 0a cf 74 a3 57 4c b0 23 '.....sAx..t.WL.#'
  09 48 4c 21 08 00 81 80 95 00 90 40 81 00 b3 00 '.HL!.......@....'
  a9 40 d1 00 81 40 02 3a 80 18 71 38 2d 40 58 2c '.@...@.:..q8-@X,'
  45 00 10 09 00 00 00 1e 01 1d 80 18 71 1c 16 20 'E...........q.. '
  58 2c 25 00 c4 8e 21 00 00 9e 00 00 00 fc 00 4d 'X,%...!........M'
  61 74 72 69 78 20 53 77 69 74 63 68 00 00 00 fd 'atrix Switch....'
  00 16 3e 0e 50 10 00 0a 20 20 20 20 20 20 01 ee '..>.P...      ..'
Checksum: 0xee

----------------

Block 3, CTA-861 Extension Block:
  Revision: 3
  Basic audio support
  Supports YCbCr 4:4:4
  Supports YCbCr 4:2:2
  Native detailed modes: 2
  Video Data Block:
    VIC  16:  1920x1080   60.000000 Hz  16:9     67.500 kHz    148.500000 MHz (native)
    VIC  31:  1920x1080   50.000000 Hz  16:9     56.250 kHz    148.500000 MHz
    VIC   4:  1280x720    60.000000 Hz  16:9     45.000 kHz     74.250000 MHz
    VIC  19:  1280x720    50.000000 Hz  16:9     37.500 kHz     74.250000 MHz
    VIC   5:  1920x1080i  60.000000 Hz  16:9     33.750 kHz     74.250000 MHz (native)
    VIC  20:  1920x1080i  50.000000 Hz  16:9     28.125 kHz     74.250000 MHz
    VIC   2:   720x480    59.940060 Hz   4:3     31.469 kHz     27.000000 MHz
    VIC  17:   720x576    50.000000 Hz   4:3     31.250 kHz     27.000000 MHz
    VIC  32:  1920x1080   24.000000 Hz  16:9     27.000 kHz     74.250000 MHz
    VIC  33:  1920x1080   25.000000 Hz  16:9     28.125 kHz     74.250000 MHz
    VIC  34:  1920x1080   30.000000 Hz  16:9     33.750 kHz     74.250000 MHz
  Audio Data Block:
    Linear PCM:
      Max channels: 2
      Supported sample rates (kHz): 48 44.1 32
      Supported sample sizes (bits): 24 20 16
  Speaker Allocation Data Block:
    FL/FR - Front Left/Right
  Video Capability Data Block:
    YCbCr quantization: No Data
    RGB quantization: No Data
    PT scan behavior: No Data
    IT scan behavior: Supports both over- and underscan
    CE scan behavior: Supports both over- and underscan
  Colorimetry Data Block:
    xvYCC601
    xvYCC709
    Gamut Boundary Description Metadata Profile P0
  Vendor-Specific Data Block (HDMI), OUI 00-0C-03:
    Source physical address: 1.0.0.0
    DC_Y444
    Maximum TMDS clock: 150 MHz
    Extended HDMI video details:
      3D present
      3D-capable-VIC mask present
      3D: Frame-packing
      3D VIC indices that support these capabilities:
        VIC   4:  1280x720    60.000000 Hz  16:9     45.000 kHz     74.250000 MHz
        VIC  19:  1280x720    50.000000 Hz  16:9     37.500 kHz     74.250000 MHz
        VIC  32:  1920x1080   24.000000 Hz  16:9     27.000 kHz     74.250000 MHz
      3D VIC indices with specific capabilities:
        VIC  16:  1920x1080   60.000000 Hz  16:9     67.500 kHz    148.500000 MHz (side-by-side, not in use)
        VIC  31:  1920x1080   50.000000 Hz  16:9     56.250 kHz    148.500000 MHz (side-by-side, not in use)
        VIC   4:  1280x720    60.000000 Hz  16:9     45.000 kHz     74.250000 MHz (side-by-side, not in use)
        VIC  19:  1280x720    50.000000 Hz  16:9     37.500 kHz     74.250000 MHz (side-by-side, not in use)
        VIC   5:  1920x1080i  60.000000 Hz  16:9     33.750 kHz     74.250000 MHz (side-by-side, not in use)
        VIC  20:  1920x1080i  50.000000 Hz  16:9     28.125 kHz     74.250000 MHz (side-by-side, not in use)
        VIC  32:  1920x1080   24.000000 Hz  16:9     27.000 kHz     74.250000 MHz (side-by-side, not in use)
        VIC  34:  1920x1080   30.000000 Hz  16:9     33.750 kHz     74.250000 MHz (side-by-side, not in use)
  Detailed Timing Descriptors:
    DTD 6:   720x480    59.940060 Hz   3:2     31.469 kHz     27.000000 MHz (531 mm x 398 mm)
                 Hfront   16 Hsync  62 Hback   60 Hpol N
                 Vfront    9 Vsync   6 Vback   30 Vpol N
    DTD 7:   720x576    50.000000 Hz   5:4     31.250 kHz     27.000000 MHz (531 mm x 398 mm)
                 Hfront   12 Hsync  64 Hback   68 Hpol N
                 Vfront    5 Vsync   5 Vback   39 Vpol N
    DTD 8:  1920x1080i  60.000000 Hz  16:9     33.750 kHz     74.250000 MHz (708 mm x 398 mm)
                 Hfront   88 Hsync  44 Hback  148 Hpol P
                 Vfront    2 Vsync   5 Vback   15 Vpol P Vfront +0.5 Odd Field
                 Vfront    2 Vsync   5 Vback   15 Vpol P Vback  +0.5 Even Field
Checksum: 0x3b  Unused space in Extension Block: 11 bytes

----------------

Warnings:

Block 0, Base EDID:
  Vendor & Product Identification: The serial number is one of the known dummy values, it should probably be set to 0.
  Detailed Timing Descriptor #1: Dubious image size (16x9 mm is smaller than 100x100 mm).
Block 1, CTA-861 Extension Block:
  IT Video Formats are overscanned by default, but normally this should be underscanned.
  Video Capability Data Block: Set Selectable YCbCr Quantization to avoid interop issues.
  Colorimetry Data Block: Set the sRGB colorimetry bit to avoid interop issues.
  Detailed Timing Descriptor #3: Image size is 531x398 mm, but based on the picture AR it should be 531x354 mm.
  Detailed Timing Descriptor #4: Image size is 531x398 mm, but based on the picture AR it should be 531x424 mm.
Block 3, CTA-861 Extension Block:
  IT Video Formats are overscanned by default, but normally this should be underscanned.
  Video Capability Data Block: Set Selectable YCbCr Quantization to avoid interop issues.
  Colorimetry Data Block: Set the sRGB colorimetry bit to avoid interop issues.
  Detailed Timing Descriptor #6: Image size is 531x398 mm, but based on the picture AR it should be 531x354 mm.
  Detailed Timing Descriptor #7: Image size is 531x398 mm, but based on the picture AR it should be 531x424 mm.
EDID:
  Base EDID: Some timings are out of range of the Monitor Ranges:
    Maximum Clock: 193.250 MHz (Monitor: 160.000 MHz)
  CTA-861: Multiple native progressive timings are defined.
  CTA-861: Multiple native interlaced timings are defined.

Failures:

Block 0, Base EDID:
  Detailed Timing Descriptor #1: Mismatch of image size 16x9 mm vs display size 1150x650 mm.
  Detailed Timing Descriptor #2: Mismatch of image size 708x398 mm vs display size 1150x650 mm.
Block 1, CTA-861 Extension Block:
  Video Capability Data Block: Set Selectable RGB Quantization to avoid interop issues.
  Vendor-Specific Data Block (HDMI), OUI 00-0C-03: not-in-use 3D_Detail_X value 0x02.
  Vendor-Specific Data Block (HDMI), OUI 00-0C-03: not-in-use 3D_Detail_X value 0x02.
  Vendor-Specific Data Block (HDMI), OUI 00-0C-03: not-in-use 3D_Detail_X value 0x02.
  Vendor-Specific Data Block (HDMI), OUI 00-0C-03: not-in-use 3D_Detail_X value 0x02.
  Vendor-Specific Data Block (HDMI), OUI 00-0C-03: not-in-use 3D_Detail_X value 0x02.
  Vendor-Specific Data Block (HDMI), OUI 00-0C-03: not-in-use 3D_Detail_X value 0x02.
  Vendor-Specific Data Block (HDMI), OUI 00-0C-03: not-in-use 3D_Detail_X value 0x02.
  Vendor-Specific Data Block (HDMI), OUI 00-0C-03: not-in-use 3D_Detail_X value 0x02.
  Detailed Timing Descriptor #3: Mismatch of image size 531x398 mm vs display size 1150x650 mm.
  Detailed Timing Descriptor #4: Mismatch of image size 531x398 mm vs display size 1150x650 mm.
  Detailed Timing Descriptor #5: Mismatch of image size 708x398 mm vs display size 1150x650 mm.
Block 2, Base EDID:
  Unknown Extension Block.
Block 3, CTA-861 Extension Block:
  Video Data Block: Duplicate VIC 16.
  Video Data Block: Duplicate VIC 31.
  Video Data Block: Duplicate VIC 4.
  Video Data Block: Duplicate VIC 19.
  Video Data Block: Duplicate VIC 5.
  Video Data Block: Duplicate VIC 20.
  Video Data Block: Duplicate VIC 2.
  Video Data Block: Duplicate VIC 17.
  Video Data Block: Duplicate VIC 32.
  Video Data Block: Duplicate VIC 33.
  Video Data Block: Duplicate VIC 34.
  Speaker Allocation Data Block: Only one instance of this Data Block is allowed.
  Video Capability Data Block: Only one instance of this Data Block is allowed.
  Video Capability Data Block: Set Selectable RGB Quantization to avoid interop issues.
  Colorimetry Data Block: Only one instance of this Data Block is allowed.
  Vendor-Specific Data Block (HDMI), OUI 00-0C-03: not-in-use 3D_Detail_X value 0x02.
  Vendor-Specific Data Block (HDMI), OUI 00-0C-03: not-in-use 3D_Detail_X value 0x02.
  Vendor-Specific Data Block (HDMI), OUI 00-0C-03: not-in-use 3D_Detail_X value 0x02.
  Vendor-Specific Data Block (HDMI), OUI 00-0C-03: not-in-use 3D_Detail_X value 0x02.
  Vendor-Specific Data Block (HDMI), OUI 00-0C-03: not-in-use 3D_Detail_X value 0x02.
  Vendor-Specific Data Block (HDMI), OUI 00-0C-03: not-in-use 3D_Detail_X value 0x02.
  Vendor-Specific Data Block (HDMI), OUI 00-0C-03: not-in-use 3D_Detail_X value 0x02.
  Vendor-Specific Data Block (HDMI), OUI 00-0C-03: not-in-use 3D_Detail_X value 0x02.
  Detailed Timing Descriptor #6: Mismatch of image size 531x398 mm vs display size 1150x650 mm.
  Detailed Timing Descriptor #7: Mismatch of image size 531x398 mm vs display size 1150x650 mm.
  Detailed Timing Descriptor #8: Mismatch of image size 708x398 mm vs display size 1150x650 mm.
EDID:
  Base EDID: EDID specified 1 extension block(s), but found 3 extension block(s).
  Base EDID: EDID 1.3 requires a Block Map Extension in Block 1 if there are more than 2 blocks in the EDID.
  CTA-861: The maximum HDMI TMDS clock is 150000 kHz, but one or more video timings go up to 193250 kHz.

EDID conformity: FAIL
