edid-decode (hex):

00 ff ff ff ff ff ff 00 0d ae d8 13 00 00 00 00
11 21 01 04 a5 1d 12 78 03 28 65 97 59 54 8e 27
1e 50 54 00 00 00 01 01 01 01 01 01 01 01 01 01
01 01 01 01 01 01 42 3c 80 a0 70 b0 24 40 2e 1e
a6 00 1e b2 10 00 00 1a 30 28 80 a0 70 b0 24 40
2e 1e a6 00 1e b2 10 00 00 1a 00 00 00 10 00 00
00 00 00 00 00 00 00 00 00 00 00 00 00 00 00 02
00 0c 33 ff 0f 3c 96 14 0e 23 96 00 00 00 01 7f

70 20 79 02 00 25 01 09 94 5a 02 94 5a 02 28 3c
80 81 00 10 6f 1a 00 00 03 01 28 3c 00 00 00 00
00 00 3c 00 00 00 00 00 00 00 00 00 00 00 00 00
00 00 00 00 00 00 00 00 00 00 00 00 00 00 00 00
00 00 00 00 00 00 00 00 00 00 00 00 00 00 00 00
00 00 00 00 00 00 00 00 00 00 00 00 00 00 00 00
00 00 00 00 00 00 00 00 00 00 00 00 00 00 00 00
00 00 00 00 00 00 00 00 00 00 00 00 00 00 b4 90

00 ff ff ff ff ff ff 00 0d ae d8 13 00 00 00 00
11 21 01 04 a5 1d 12 78 03 28 65 97 59 54 8e 27
1e 50 54 00 00 00 01 01 01 01 01 01 01 01 01 01
01 01 01 01 01 01 42 3c 80 a0 70 b0 24 40 2e 1e
a6 00 1e b2 10 00 00 1a 30 28 80 a0 70 b0 24 40
2e 1e a6 00 1e b2 10 00 00 1a 00 00 00 10 00 00
00 00 00 00 00 00 00 00 00 00 00 00 00 00 00 02
00 0c 33 ff 0f 3c 96 14 0e 23 96 00 00 00 01 7f

70 20 79 02 00 25 01 09 94 5a 02 94 5a 02 28 3c
80 81 00 10 6f 1a 00 00 03 01 28 3c 00 00 00 00
00 00 3c 00 00 00 00 00 00 00 00 00 00 00 00 00
00 00 00 00 00 00 00 00 00 00 00 00 00 00 00 00
00 00 00 00 00 00 00 00 00 00 00 00 00 00 00 00
00 00 00 00 00 00 00 00 00 00 00 00 00 00 00 00
00 00 00 00 00 00 00 00 00 00 00 00 00 00 00 00
00 00 00 00 00 00 00 00 00 00 00 00 00 00 b4 90

----------------

Block 0, Base EDID:
  EDID Structure Version & Revision: 1.4
  Vendor & Product Identification:
    Manufacturer: CMN
    Model: 5080
    Made in: week 17 of 2023
  Basic Display Parameters & Features:
    Digital display
    Bits per primary color channel: 8
    DisplayPort interface
    Maximum image size: 29 cm x 18 cm
    Gamma: 2.20
    Supported color formats: RGB 4:4:4
    First detailed timing includes the native pixel format and preferred refresh rate
    Display supports continuous frequencies
  Color Characteristics:
    Red  : 0.5898, 0.3496
    Green: 0.3300, 0.5546
    Blue : 0.1533, 0.1191
    White: 0.3134, 0.3291
  Established Timings I & II: none
  Standard Timings: none
  Detailed Timing Descriptors:
    DTD 1:  1920x1200   60.002801 Hz  16:10    74.163 kHz    154.260000 MHz (286 mm x 178 mm)
                 Hfront   46 Hsync  30 Hback   84 Hpol P
                 Vfront   10 Vsync   6 Vback   20 Vpol N
    DTD 2:  1920x1200   40.017426 Hz  16:10    49.462 kHz    102.880000 MHz (286 mm x 178 mm)
                 Hfront   46 Hsync  30 Hback   84 Hpol P
                 Vfront   10 Vsync   6 Vback   20 Vpol N
    Dummy Descriptor:
    Manufacturer-Specified Display Descriptor (0x02): 00 02 00 0c 33 ff 0f 3c 96 14 0e 23 96 00 00 00 '....3..<...#....'
  Extension blocks: 1
Checksum: 0x7f

----------------

Block 1, DisplayID Extension Block:
  Version: 2.0
  Extension Count: 0
  Display Product Primary Use Case: None of the listed primary use cases; generic display
  Dynamic Video Timing Range Limits Data Block:
    Minimum Pixel Clock: 154261 kHz
    Maximum Pixel Clock: 154261 kHz
    Minimum Vertical Refresh Rate: 40 Hz
    Maximum Vertical Refresh Rate: 60 Hz
    Seamless Dynamic Video Timing Support: Yes
  CTA-861 DisplayID Data Block:
  Vendor-Specific Data Block (AMD), OUI 00-00-1A:
    Version: 3
    Flags 1: 0x01
      FreeSync Supported
    Minimum Refresh Rate: 40 Hz
    Maximum Refresh Rate: 60 Hz
    Flags 5: 0x00
  Checksum: 0xb4
Checksum: 0x90

----------------

Warnings:

Block 0, Base EDID:
  Missing Display Product Name.

Failures:

Block 0, Base EDID:
  Missing Display Range Limits Descriptor.
EDID:
  Extension Block 2 started with EDID header, ignoring Extension Blocks >= 2.
  DisplayID: Missing DisplayID Display Parameters Data Block.
  DisplayID: Missing DisplayID Type VII Detailed Timing Data Block.
  DisplayID: DisplayID expects at least one preferred timing.

EDID conformity: FAIL
