edid-decode (hex):

00 ff ff ff ff ff ff 00 15 85 08 63 00 00 00 00
17 1b 01 03 80 56 2f 78 0a 67 55 a5 5b 47 9c 25
1e 4f 54 a1 08 00 61 40 81 c0 81 00 81 40 71 40
01 01 01 01 01 01 66 21 56 aa 51 00 1e 30 46 8f
33 00 56 00 53 00 00 1e 0e 1f 00 80 51 00 1e 30
40 80 37 00 55 00 53 00 00 1c 00 00 00 fd 00 38
3f 1e 50 09 00 0a 20 20 20 20 20 20 00 00 00 fc
00 45 4c 53 57 33 39 31 37 42 46 0a 20 20 01 ac

02 03 2b 71 4e 01 03 84 05 06 10 12 13 14 15 1f
20 21 22 26 15 07 50 09 57 07 83 01 00 00 6c 03
0c 00 10 00 b8 00 00 00 00 00 00 8f 0a d0 8a 20
e0 2d 10 10 3e 96 00 c4 8e 21 00 00 18 8c 0a d0
8a 20 e0 2d 10 10 3e 96 00 13 8e 21 00 00 18 8c
0a d0 90 20 40 31 20 0c 40 55 00 13 8e 21 00 00
18 8c 0a d0 90 20 40 31 20 0c 40 55 00 c4 8e 21
00 00 18 8c 0a d0 8a 20 e0 2d 10 10 3e 96 00 4e

00 ff ff ff ff ff ff 00 15 85 08 63 00 00 00 00
17 1b 01 03 80 56 2f 78 0a 67 55 a5 5b 47 9c 25
1e 4f 54 a1 08 00 61 40 81 c0 81 00 81 40 71 40
01 01 01 01 01 01 66 21 56 aa 51 00 1e 30 46 8f
33 00 56 00 53 00 00 1e 0e 1f 00 80 51 00 1e 30
40 80 37 00 55 00 53 00 00 1c 00 00 00 fd 00 38
3f 1e 50 09 00 0a 20 20 20 20 20 20 00 00 00 fc
00 45 4c 53 57 33 39 31 37 42 46 0a 20 20 01 ac

02 03 2b 71 4e 01 03 84 05 06 10 12 13 14 15 1f
20 21 22 26 15 07 50 09 57 07 83 01 00 00 6c 03
0c 00 10 00 b8 00 00 00 00 00 00 8f 0a d0 8a 20
e0 2d 10 10 3e 96 00 c4 8e 21 00 00 18 8c 0a d0
8a 20 e0 2d 10 10 3e 96 00 13 8e 21 00 00 18 8c
0a d0 90 20 40 31 20 0c 40 55 00 13 8e 21 00 00
18 8c 0a d0 90 20 40 31 20 0c 40 55 00 c4 8e 21
00 00 18 8c 0a d0 8a 20 e0 2d 10 10 3e 96 00 4e

----------------

Block 0, Base EDID:
  EDID Structure Version & Revision: 1.3
  Vendor & Product Identification:
    Manufacturer: ELE
    Model: 25352
    Made in: week 23 of 2017
  Basic Display Parameters & Features:
    Digital display
    Maximum image size: 86 cm x 47 cm
    Gamma: 2.20
    RGB color display
    First detailed timing is the preferred timing
  Color Characteristics:
    Red  : 0.6455, 0.3574
    Green: 0.2783, 0.6123
    Blue : 0.1455, 0.1181
    White: 0.3095, 0.3291
  Established Timings I & II:
    IBM     :   720x400    70.081663 Hz   9:5     31.467 kHz     28.320000 MHz
    DMT 0x04:   640x480    59.940476 Hz   4:3     31.469 kHz     25.175000 MHz
    DMT 0x09:   800x600    60.316541 Hz   4:3     37.879 kHz     40.000000 MHz
    DMT 0x10:  1024x768    60.003840 Hz   4:3     48.363 kHz     65.000000 MHz
  Standard Timings:
    DMT 0x10:  1024x768    60.003840 Hz   4:3     48.363 kHz     65.000000 MHz
    DMT 0x55:  1280x720    60.000000 Hz  16:9     45.000 kHz     74.250000 MHz
    DMT 0x1c:  1280x800    59.810326 Hz  16:10    49.702 kHz     83.500000 MHz
    DMT 0x20:  1280x960    60.000000 Hz   4:3     60.000 kHz    108.000000 MHz
    GTF     :  1152x864    60.000000 Hz   4:3     53.700 kHz     81.624000 MHz
  Detailed Timing Descriptors:
    DTD 1:  1366x768    59.789541 Hz 683:384   47.712 kHz     85.500000 MHz (1366 mm x 768 mm)
                 Hfront   70 Hsync 143 Hback  213 Hpol P
                 Vfront    3 Vsync   3 Vback   24 Vpol P
    DTD 2:  1280x768    59.870228 Hz   5:3     47.776 kHz     79.500000 MHz (1365 mm x 768 mm)
                 Hfront   64 Hsync 128 Hback  192 Hpol N
                 Vfront    3 Vsync   7 Vback   20 Vpol P
    Display Range Limits:
      Monitor ranges (GTF): 56-63 Hz V, 30-80 kHz H, max dotclock 90 MHz
    Display Product Name: 'ELSW3917BF'
  Extension blocks: 1
Checksum: 0xac

----------------

Block 1, CTA-861 Extension Block:
  Revision: 3
  Basic audio support
  Supports YCbCr 4:4:4
  Supports YCbCr 4:2:2
  Native DTDs: 1
  Video Data Block:
    VIC   1:   640x480    59.940476 Hz   4:3     31.469 kHz     25.175000 MHz
    VIC   3:   720x480    59.940060 Hz  16:9     31.469 kHz     27.000000 MHz
    VIC   4:  1280x720    60.000000 Hz  16:9     45.000 kHz     74.250000 MHz (native)
    VIC   5:  1920x1080i  60.000000 Hz  16:9     33.750 kHz     74.250000 MHz
    VIC   6:  1440x480i   59.940060 Hz   4:3     15.734 kHz     27.000000 MHz
    VIC  16:  1920x1080   60.000000 Hz  16:9     67.500 kHz    148.500000 MHz
    VIC  18:   720x576    50.000000 Hz  16:9     31.250 kHz     27.000000 MHz
    VIC  19:  1280x720    50.000000 Hz  16:9     37.500 kHz     74.250000 MHz
    VIC  20:  1920x1080i  50.000000 Hz  16:9     28.125 kHz     74.250000 MHz
    VIC  21:  1440x576i   50.000000 Hz   4:3     15.625 kHz     27.000000 MHz
    VIC  31:  1920x1080   50.000000 Hz  16:9     56.250 kHz    148.500000 MHz
    VIC  32:  1920x1080   24.000000 Hz  16:9     27.000 kHz     74.250000 MHz
    VIC  33:  1920x1080   25.000000 Hz  16:9     28.125 kHz     74.250000 MHz
    VIC  34:  1920x1080   30.000000 Hz  16:9     33.750 kHz     74.250000 MHz
  Audio Data Block:
    AC-3:
      Max channels: 6
      Supported sample rates (kHz): 48 44.1 32
      Maximum bit rate: 640 kb/s
    Linear PCM:
      Max channels: 2
      Supported sample rates (kHz): 192 96 48 44.1 32
      Supported sample sizes (bits): 24 20 16
  Speaker Allocation Data Block:
    FL/FR - Front Left/Right
  Vendor-Specific Data Block (HDMI), OUI 00-0C-03:
    Source physical address: 1.0.0.0
    Supports_AI
    DC_36bit
    DC_30bit
    DC_Y444
    Maximum TMDS clock: 0 MHz
  Detailed Timing Descriptors:
    DTD 3:   720x480    60.006660 Hz   3:2     31.503 kHz     27.030000 MHz (708 mm x 398 mm)
                 Hfront   16 Hsync  62 Hback   60 Hpol N
                 Vfront    9 Vsync   6 Vback   30 Vpol N
    DTD 4:   720x480    59.940060 Hz   3:2     31.469 kHz     27.000000 MHz (531 mm x 398 mm)
                 Hfront   16 Hsync  62 Hback   60 Hpol N
                 Vfront    9 Vsync   6 Vback   30 Vpol N
    DTD 5:   720x576    50.000000 Hz   5:4     31.250 kHz     27.000000 MHz (531 mm x 398 mm)
                 Hfront   12 Hsync  64 Hback   68 Hpol N
                 Vfront    5 Vsync   5 Vback   39 Vpol N
    DTD 6:   720x576    50.000000 Hz   5:4     31.250 kHz     27.000000 MHz (708 mm x 398 mm)
                 Hfront   12 Hsync  64 Hback   68 Hpol N
                 Vfront    5 Vsync   5 Vback   39 Vpol N
Checksum: 0x4e  Unused space in Extension Block: 12 bytes

----------------

Warnings:

Block 0, Base EDID:
  Detailed Timing Descriptor #2: Image size is 1365x768 mm, but based on the picture AR it should be 1280x768 mm.
Block 1, CTA-861 Extension Block:
  IT Video Formats are overscanned by default, but normally this should be underscanned.
  Video Data Block: VIC 1 and the first DTD are not identical. Is this intended?
  Video Data Block: All VICs are in ascending order, and the first (preferred) VIC <= 4, is that intended?
  Detailed Timing Descriptor #3: Image size is 708x398 mm, but based on the picture AR it should be 597x398 mm.
  Detailed Timing Descriptor #4: Image size is 531x398 mm, but based on the picture AR it should be 531x354 mm.
  Detailed Timing Descriptor #5: Image size is 531x398 mm, but based on the picture AR it should be 497x398 mm.
  Detailed Timing Descriptor #6: Image size is 708x398 mm, but based on the picture AR it should be 497x398 mm.
  Add a Colorimetry Data Block with the sRGB colorimetry bit set to avoid interop issues.
EDID:
  Base EDID: Some timings are out of range of the Monitor Ranges:
    Vertical Freq: 24.000 - 70.082 Hz (Monitor: 56.000 - 63.000 Hz)
    Horizontal Freq: 15.625 - 67.500 kHz (Monitor: 30.000 - 80.000 kHz)
    Maximum Clock: 148.500 MHz (Monitor: 90.000 MHz)

Failures:

Block 0, Base EDID:
  Detailed Timing Descriptor #1: Mismatch of image size 1366x768 mm vs display size 860x470 mm.
  Detailed Timing Descriptor #2: Mismatch of image size 1365x768 mm vs display size 860x470 mm.
Block 1, CTA-861 Extension Block:
  Detailed Timing Descriptor #3: Mismatch of image size 708x398 mm vs display size 860x470 mm.
  Detailed Timing Descriptor #4: Mismatch of image size 531x398 mm vs display size 860x470 mm.
  Detailed Timing Descriptor #5: Mismatch of image size 531x398 mm vs display size 860x470 mm.
  Detailed Timing Descriptor #6: Mismatch of image size 708x398 mm vs display size 860x470 mm.
  Padding: Contains non-zero bytes.
  Missing VCDB, needed for Set Selectable RGB Quantization to avoid interop issues.
EDID:
  Extension Block 2 started with EDID header, ignoring Extension Blocks >= 2.
  Base EDID: The DTD max image size is 1366x768mm, which is larger than the display size 860.0x470.0mm.
  CTA-861: Native progressive timings are a mix of several resolutions.

EDID conformity: FAIL
