edid-decode (hex):

00 ff ff ff ff ff ff 00 34 ac fa 47 01 01 01 01
35 14 01 03 80 73 40 78 ea b2 ed a4 54 48 98 24
0f 47 4a a1 09 00 81 80 a9 40 81 c0 d1 00 95 00
01 01 01 01 01 01 02 3a 80 18 71 38 2d 40 58 2c
45 00 80 88 42 00 00 18 00 00 00 fd 00 31 56 1f
5c 11 00 0a 20 20 20 20 20 20 00 00 00 fc 00 4d
44 54 35 32 31 53 0a 20 20 20 20 20 00 00 00 ff
00 30 5a 32 30 33 30 31 36 45 57 0a 20 20 01 82

02 03 1c 71 48 85 03 04 02 07 06 01 10 23 09 57
07 83 01 00 00 66 03 0c 00 10 00 00 8c 0a d0 8a
20 e0 2d 10 10 3e 96 00 80 88 42 00 00 1e 8c 0a
a0 14 51 f0 16 00 26 7c 43 00 80 88 42 00 00 18
01 1d 00 bc 52 d0 1e 20 b8 28 55 40 80 88 42 00
00 98 00 00 00 00 00 00 00 00 00 00 00 00 00 00
00 00 00 00 00 00 00 00 00 00 00 00 00 00 00 00
00 00 00 00 00 00 00 00 00 00 00 00 00 00 00 f5

00 ff ff ff ff ff ff 00 34 ac fa 47 01 01 01 01
35 14 01 03 80 73 40 78 ea b2 ed a4 54 48 98 24
0f 47 4a a1 09 00 81 80 a9 40 81 c0 d1 00 95 00
01 01 01 01 01 01 02 3a 80 18 71 38 2d 40 58 2c
45 00 80 88 42 00 00 18 00 00 00 fd 00 31 56 1f
5c 11 00 0a 20 20 20 20 20 20 00 00 00 fc 00 4d
44 54 35 32 31 53 0a 20 20 20 20 20 00 00 00 ff
00 30 5a 32 30 33 30 31 36 45 57 0a 20 20 01 82

02 03 1c 71 48 85 03 04 02 07 06 01 10 23 09 57
07 83 01 00 00 66 03 0c 00 10 00 00 8c 0a d0 8a
20 e0 2d 10 10 3e 96 00 80 88 42 00 00 1e 8c 0a
a0 14 51 f0 16 00 26 7c 43 00 80 88 42 00 00 18
01 1d 00 bc 52 d0 1e 20 b8 28 55 40 80 88 42 00
00 98 00 00 00 00 00 00 00 00 00 00 00 00 00 00
00 00 00 00 00 00 00 00 00 00 00 00 00 00 00 00
00 00 00 00 00 00 00 00 00 00 00 00 00 00 00 f5

----------------

Block 0, Base EDID:
  EDID Structure Version & Revision: 1.3
  Vendor & Product Identification:
    Manufacturer: MEL
    Model: 18426
    Serial Number: ...
    Made in: week 53 of 2010
  Basic Display Parameters & Features:
    Digital display
    Maximum image size: 115 cm x 64 cm
    Gamma: 2.20
    DPMS levels: Standby Suspend Off
    RGB color display
    First detailed timing is the preferred timing
  Color Characteristics:
    Red  : 0.6425, 0.3310
    Green: 0.2812, 0.5957
    Blue : 0.1435, 0.0605
    White: 0.2802, 0.2900
  Established Timings I & II:
    IBM     :   720x400    70.081663 Hz   9:5     31.467 kHz     28.320000 MHz
    DMT 0x04:   640x480    59.940476 Hz   4:3     31.469 kHz     25.175000 MHz
    DMT 0x09:   800x600    60.316541 Hz   4:3     37.879 kHz     40.000000 MHz
    DMT 0x10:  1024x768    60.003840 Hz   4:3     48.363 kHz     65.000000 MHz
    DMT 0x24:  1280x1024   75.024675 Hz   5:4     79.976 kHz    135.000000 MHz
  Standard Timings:
    DMT 0x23:  1280x1024   60.019740 Hz   5:4     63.981 kHz    108.000000 MHz
    DMT 0x33:  1600x1200   60.000000 Hz   4:3     75.000 kHz    162.000000 MHz
    DMT 0x55:  1280x720    60.000000 Hz  16:9     45.000 kHz     74.250000 MHz
    DMT 0x45:  1920x1200   59.884600 Hz  16:10    74.556 kHz    193.250000 MHz
    DMT 0x2f:  1440x900    59.887445 Hz  16:10    55.935 kHz    106.500000 MHz
  Detailed Timing Descriptors:
    DTD 1:  1920x1080   60.000000 Hz  16:9     67.500 kHz    148.500000 MHz (1152 mm x 648 mm)
                 Hfront   88 Hsync  44 Hback  148 Hpol N
                 Vfront    4 Vsync   5 Vback   36 Vpol N
    Display Range Limits:
      Monitor ranges (GTF): 49-86 Hz V, 31-92 kHz H, max dotclock 170 MHz
    Display Product Name: 'MDT521S'
    Display Product Serial Number: ...
  Extension blocks: 1
Checksum: 0x82

----------------

Block 1, CTA-861 Extension Block:
  Revision: 3
  Basic audio support
  Supports YCbCr 4:4:4
  Supports YCbCr 4:2:2
  Native DTDs: 1
  Video Data Block:
    VIC   5:  1920x1080i  60.000000 Hz  16:9     33.750 kHz     74.250000 MHz (native)
    VIC   3:   720x480    59.940060 Hz  16:9     31.469 kHz     27.000000 MHz
    VIC   4:  1280x720    60.000000 Hz  16:9     45.000 kHz     74.250000 MHz
    VIC   2:   720x480    59.940060 Hz   4:3     31.469 kHz     27.000000 MHz
    VIC   7:  1440x480i   59.940060 Hz  16:9     15.734 kHz     27.000000 MHz
    VIC   6:  1440x480i   59.940060 Hz   4:3     15.734 kHz     27.000000 MHz
    VIC   1:   640x480    59.940476 Hz   4:3     31.469 kHz     25.175000 MHz
    VIC  16:  1920x1080   60.000000 Hz  16:9     67.500 kHz    148.500000 MHz
  Audio Data Block:
    Linear PCM:
      Max channels: 2
      Supported sample rates (kHz): 192 96 48 44.1 32
      Supported sample sizes (bits): 24 20 16
  Speaker Allocation Data Block:
    FL/FR - Front Left/Right
  Vendor-Specific Data Block (HDMI), OUI 00-0C-03:
    Source physical address: 1.0.0.0
  Detailed Timing Descriptors:
    DTD 2:   720x480    59.940060 Hz   3:2     31.469 kHz     27.000000 MHz (1152 mm x 648 mm)
                 Hfront   16 Hsync  62 Hback   60 Hpol P
                 Vfront    9 Vsync   6 Vback   30 Vpol P
    DTD 3:  1440x240    60.054449 Hz   6:1     15.734 kHz     27.000000 MHz (1152 mm x 648 mm)
                 Hfront   38 Hsync 124 Hback  114 Hpol N
                 Vfront    4 Vsync   3 Vback   15 Vpol N
    DTD 4:  1280x1440i  49.966689 Hz   8:9     37.500 kHz     74.250000 MHz (1152 mm x 648 mm)
                 Hfront  440 Hsync  40 Hback  220 Hpol N
                 Vfront    5 Vsync   5 Vback   20 Vpol N Vfront +0.5 Odd Field
                 Vfront    5 Vsync   5 Vback   20 Vpol N Vback  +0.5 Even Field
Checksum: 0xf5  Unused space in Extension Block: 45 bytes

----------------

Warnings:

Block 0, Base EDID:
  Vendor & Product Identification: The serial number is one of the known dummy values, it should probably be set to 0.
  Detailed Timing Descriptor #1: DTD is similar but not identical to VIC 16.
Block 1, CTA-861 Extension Block:
  IT Video Formats are overscanned by default, but normally this should be underscanned.
  Video Data Block: VIC 5 and the first DTD are not identical. Is this intended?
  Detailed Timing Descriptor #2: DTD is similar but not identical to VIC 2.
  Detailed Timing Descriptor #2: Image size is 1152x648 mm, but based on the picture AR it should be 972x648 mm.
  Detailed Timing Descriptor #3: Image size is 1152x648 mm, but based on the picture AR it should be 1152x192 mm.
  Detailed Timing Descriptor #4: Image size is 1152x648 mm, but based on the picture AR it should be 576x648 mm.
  Display Product Serial Number is set, so the Serial Number in the Base EDID should be 0.
  Add a Colorimetry Data Block with the sRGB colorimetry bit set to avoid interop issues.
EDID:
  Base EDID: Some timings are out of range of the Monitor Ranges:
    Horizontal Freq: 15.734 - 79.976 kHz (Monitor: 31.000 - 92.000 kHz)
    Maximum Clock: 193.250 MHz (Monitor: 170.000 MHz)

Failures:

Block 1, CTA-861 Extension Block:
  Missing VCDB, needed for Set Selectable RGB Quantization to avoid interop issues.
EDID:
  Extension Block 2 started with EDID header, ignoring Extension Blocks >= 2.

EDID conformity: FAIL
