edid-decode (hex):

00 ff ff ff ff ff ff 00 22 f0 18 42 01 01 00 00
01 15 01 03 80 2c 18 78 0a f8 60 a2 56 51 9e 27
0c 50 54 00 00 00 01 01 01 01 01 01 01 01 01 01
01 01 01 01 01 01 e0 28 40 90 60 84 64 30 18 50
13 00 bb f9 10 00 00 1e 00 00 00 ff 00 57 4c 45
44 53 4d 53 4c 54 4d 32 30 30 00 00 00 fc 00 48
50 20 54 6f 75 63 68 53 6d 61 72 74 00 00 00 fe
00 4c 54 4d 32 30 30 4b 54 31 30 20 20 20 00 2d

----------------

Block 0, Base EDID:
  EDID Structure Version & Revision: 1.3
  Vendor & Product Identification:
    Manufacturer: HWP
    Model: 16920
    Serial Number: ...
    Made in: week 1 of 2011
  Basic Display Parameters & Features:
    Digital display
    Maximum image size: 44 cm x 24 cm
    Gamma: 2.20
    RGB color display
    First detailed timing is the preferred timing
  Color Characteristics:
    Red  : 0.6357, 0.3388
    Green: 0.3183, 0.6171
    Blue : 0.1533, 0.0488
    White: 0.3125, 0.3281
  Established Timings I & II: none
  Standard Timings: none
  Detailed Timing Descriptors:
    DTD 1:  1600x900    60.000000 Hz  16:9     60.000 kHz    104.640000 MHz (443 mm x 249 mm)
                 Hfront   24 Hsync  80 Hback   40 Hpol P
                 Vfront    1 Vsync   3 Vback   96 Vpol P
    Display Product Serial Number: ...
    Display Product Name: 'HP TouchSmart'
    Alphanumeric Data String: 'LTM200KT10   '
Checksum: 0x2d

----------------

Failures:

Block 0, Base EDID:
  Alphanumeric Data String: No newline, but one or more trailing spaces.
  Missing Display Range Limits Descriptor.

EDID conformity: FAIL
