edid-decode (hex):

00 ff ff ff ff ff ff 00 4c 2d 36 72 00 00 00 00
08 20 01 04 b5 46 27 78 3b 34 f5 ad 4f 46 a7 26
0f 50 54 25 08 00 81 c0 81 00 81 80 95 00 a9 c0
b3 00 01 01 01 01 5c c1 00 e4 a2 38 aa 40 24 2c
45 80 ba 88 21 00 00 1e 00 00 00 fd 0c 3c f0 25
25 50 01 0a 20 20 20 20 20 20 00 00 00 fc 00 4f
64 79 73 73 65 79 20 47 36 35 42 0a 00 00 00 ff
00 48 31 41 4b 35 30 30 30 30 30 0a 20 20 02 df

02 03 2c f1 46 90 3f 04 03 5a 5c 23 09 07 07 83
01 00 00 e3 05 c3 01 6d 1a 00 00 02 0f 3c f0 00
04 73 05 5b 27 e6 06 05 01 73 5a 00 56 5e 00 a0
a0 a0 29 50 30 20 35 00 ba 88 21 00 00 1a 04 74
80 18 71 38 2d 40 58 2c 45 00 ba 88 21 00 00 1e
00 00 00 00 00 00 00 00 00 00 00 00 00 00 00 00
00 00 00 00 00 00 00 00 00 00 00 00 00 00 00 00
00 00 00 00 00 00 00 00 00 00 00 00 00 00 00 a2

70 12 79 03 00 03 01 3c 5b c1 00 86 ff 09 e3 02
23 82 2b 00 37 04 a9 00 03 80 04 00 c3 35 01 06
ff 09 9f 00 2f 80 1f 00 37 04 86 00 02 00 09 00
e9 ec 00 04 7f 07 9f 00 2f 80 1f 00 37 04 86 00
02 00 04 00 00 00 00 00 00 00 00 00 00 00 00 00
00 00 00 00 00 00 00 00 00 00 00 00 00 00 00 00
00 00 00 00 00 00 00 00 00 00 00 00 00 00 00 00
00 00 00 00 00 00 00 00 00 00 00 00 00 00 95 90

00 ff ff ff ff ff ff 00 4c 2d 36 72 00 00 00 00
08 20 01 04 b5 46 27 78 3b 34 f5 ad 4f 46 a7 26
0f 50 54 25 08 00 81 c0 81 00 81 80 95 00 a9 c0
b3 00 01 01 01 01 5c c1 00 e4 a2 38 aa 40 24 2c
45 80 ba 88 21 00 00 1e 00 00 00 fd 0c 3c f0 25
25 50 01 0a 20 20 20 20 20 20 00 00 00 fc 00 4f
64 79 73 73 65 79 20 47 36 35 42 0a 00 00 00 ff
00 48 31 41 4b 35 30 30 30 30 30 0a 20 20 02 df

02 03 2c f1 46 90 3f 04 03 5a 5c 23 09 07 07 83
01 00 00 e3 05 c3 01 6d 1a 00 00 02 0f 3c f0 00
04 73 05 5b 27 e6 06 05 01 73 5a 00 56 5e 00 a0
a0 a0 29 50 30 20 35 00 ba 88 21 00 00 1a 04 74
80 18 71 38 2d 40 58 2c 45 00 ba 88 21 00 00 1e
00 00 00 00 00 00 00 00 00 00 00 00 00 00 00 00
00 00 00 00 00 00 00 00 00 00 00 00 00 00 00 00
00 00 00 00 00 00 00 00 00 00 00 00 00 00 00 a2

70 12 79 03 00 03 01 3c 5b c1 00 86 ff 09 e3 02
23 82 2b 00 37 04 a9 00 03 80 04 00 c3 35 01 06
ff 09 9f 00 2f 80 1f 00 37 04 86 00 02 00 09 00
e9 ec 00 04 7f 07 9f 00 2f 80 1f 00 37 04 86 00
02 00 04 00 00 00 00 00 00 00 00 00 00 00 00 00
00 00 00 00 00 00 00 00 00 00 00 00 00 00 00 00
00 00 00 00 00 00 00 00 00 00 00 00 00 00 00 00
00 00 00 00 00 00 00 00 00 00 00 00 00 00 95 90

----------------

Block 0, Base EDID:
  EDID Structure Version & Revision: 1.4
  Vendor & Product Identification:
    Manufacturer: SAM
    Model: 29238
    Made in: week 8 of 2022
  Basic Display Parameters & Features:
    Digital display
    Bits per primary color channel: 10
    DisplayPort interface
    Maximum image size: 70 cm x 39 cm
    Gamma: 2.20
    DPMS levels: Off
    Supported color formats: RGB 4:4:4, YCrCb 4:4:4, YCrCb 4:2:2
    First detailed timing includes the native pixel format and preferred refresh rate
    Display supports continuous frequencies
  Color Characteristics:
    Red  : 0.6757, 0.3115
    Green: 0.2744, 0.6523
    Blue : 0.1513, 0.0615
    White: 0.3134, 0.3291
  Established Timings I & II:
    DMT 0x04:   640x480    59.940476 Hz   4:3     31.469 kHz     25.175000 MHz
    DMT 0x06:   640x480    75.000000 Hz   4:3     37.500 kHz     31.500000 MHz
    DMT 0x09:   800x600    60.316541 Hz   4:3     37.879 kHz     40.000000 MHz
    DMT 0x10:  1024x768    60.003840 Hz   4:3     48.363 kHz     65.000000 MHz
  Standard Timings:
    DMT 0x55:  1280x720    60.000000 Hz  16:9     45.000 kHz     74.250000 MHz
    DMT 0x1c:  1280x800    59.810326 Hz  16:10    49.702 kHz     83.500000 MHz
    DMT 0x23:  1280x1024   60.019740 Hz   5:4     63.981 kHz    108.000000 MHz
    DMT 0x2f:  1440x900    59.887445 Hz  16:10    55.935 kHz    106.500000 MHz
    DMT 0x53:  1600x900    60.000000 Hz  16:9     60.000 kHz    108.000000 MHz (RB)
    DMT 0x3a:  1680x1050   59.954250 Hz  16:10    65.290 kHz    146.250000 MHz
  Detailed Timing Descriptors:
    DTD 1:  2560x1080  120.000000 Hz  64:27   150.000 kHz    495.000000 MHz (698 mm x 392 mm)
                 Hfront  548 Hsync  44 Hback  148 Hpol P
                 Vfront    4 Vsync   5 Vback  161 Vpol P
    Display Range Limits:
      Monitor ranges (Range Limits Only): 60-240 Hz V, 292-292 kHz H, max dotclock 800 MHz
    Display Product Name: 'Odyssey G65B'
    Display Product Serial Number: ...
  Extension blocks: 2
Checksum: 0xdf

----------------

Block 1, CTA-861 Extension Block:
  Revision: 3
  Underscans IT Video Formats by default
  Basic audio support
  Supports YCbCr 4:4:4
  Supports YCbCr 4:2:2
  Native DTDs: 1
  Video Data Block:
    VIC  16:  1920x1080   60.000000 Hz  16:9     67.500 kHz    148.500000 MHz (native)
    VIC  63:  1920x1080  120.000000 Hz  16:9    135.000 kHz    297.000000 MHz
    VIC   4:  1280x720    60.000000 Hz  16:9     45.000 kHz     74.250000 MHz
    VIC   3:   720x480    59.940060 Hz  16:9     31.469 kHz     27.000000 MHz
    VIC  90:  2560x1080   60.000000 Hz  64:27    66.000 kHz    198.000000 MHz
    VIC  92:  2560x1080  120.000000 Hz  64:27   150.000 kHz    495.000000 MHz
  Audio Data Block:
    Linear PCM:
      Max channels: 2
      Supported sample rates (kHz): 48 44.1 32
      Supported sample sizes (bits): 24 20 16
  Speaker Allocation Data Block:
    FL/FR - Front Left/Right
  Colorimetry Data Block:
    xvYCC601
    xvYCC709
    BT2020YCC
    BT2020RGB
    Gamut Boundary Description Metadata Profile P0
  Vendor-Specific Data Block (AMD), OUI 00-00-1A:
    Version: 2
    Flags 1: 0x0f
      FreeSync Supported
      FreeSync 2 HDR Supported
      Global Backlight Control Supported
      Local Dimming Supported
    Minimum Refresh Rate: 60 Hz
    Maximum Refresh Rate: 240 Hz
    Flags 5: 0x04
      Gamma 2.2 EOTF Supported
    Maximum luminance: 115 (603.666 cd/m^2)
    Minimum luminance: 5 (0.002 cd/m^2)
    Maximum luminance (without local dimming): 91 (358.942 cd/m^2)
    Minimum luminance (without local dimming): 39 (0.084 cd/m^2)
  HDR Static Metadata Data Block:
    Electro optical transfer functions:
      Traditional gamma - SDR luminance range
      SMPTE ST2084
    Supported static metadata descriptors:
      Static metadata type 1
    Desired content max luminance: 115 (603.666 cd/m^2)
    Desired content max frame-average luminance: 90 (351.250 cd/m^2)
    Desired content min luminance: 0 (0.000 cd/m^2)
  Detailed Timing Descriptors:
    DTD 2:  2560x1440   59.950550 Hz  16:9     88.787 kHz    241.500000 MHz (698 mm x 392 mm)
                 Hfront   48 Hsync  32 Hback   80 Hpol P
                 Vfront    3 Vsync   5 Vback   33 Vpol N
    DTD 3:  1920x1080  120.000000 Hz  16:9    135.000 kHz    297.000000 MHz (698 mm x 392 mm)
                 Hfront   88 Hsync  44 Hback  148 Hpol P
                 Vfront    4 Vsync   5 Vback   36 Vpol P
Checksum: 0xa2  Unused space in Extension Block: 47 bytes

----------------

Block 2, DisplayID Extension Block:
  Version: 1.2
  Extension Count: 0
  Display Product Type: Standalone display device
  Video Timing Modes Type 1 - Detailed Timings Data Block:
    DTD:  2560x1080  120.000000 Hz  64:27   150.000 kHz    495.000000 MHz (aspect 64:27, no 3D stereo, preferred)
               Hfront  548 Hsync  44 Hback  148 Hpol P
               Vfront    4 Vsync   5 Vback  161 Vpol P
    DTD:  2560x1080  239.954006 Hz  64:27   291.544 kHz    793.000000 MHz (aspect 64:27, no 3D stereo)
               Hfront   48 Hsync  32 Hback   80 Hpol P
               Vfront    3 Vsync  10 Vback  122 Vpol N
    DTD:  1920x1080  239.988921 Hz  16:9    291.587 kHz    606.500000 MHz (aspect 16:9, no 3D stereo)
               Hfront   48 Hsync  32 Hback   80 Hpol P
               Vfront    3 Vsync   5 Vback  127 Vpol N
  Checksum: 0x95
Checksum: 0x90

----------------

Warnings:

Block 0, Base EDID:
  Detailed Timing Descriptor #1: Image size is 698x392 mm, but based on the picture AR it should be 698x294 mm.
  Display Product Serial Number: ...
Block 1, CTA-861 Extension Block:
  Video Data Block: VIC 16 and the first DTD are not identical. Is this intended?
  Colorimetry Data Block: Set the sRGB colorimetry bit to avoid interop issues.
EDID:
  Base EDID: Some timings are out of range of the Monitor Ranges:
    Horizontal Freq: 31.468 - 291.586 kHz (Monitor: 292.000 - 292.000 kHz)

Failures:

Block 1, CTA-861 Extension Block:
  Missing VCDB, needed for Set Selectable RGB Quantization to avoid interop issues.
EDID:
  Extension Block 3 started with EDID header, ignoring Extension Blocks >= 3.
  CTA-861: Native progressive timings are a mix of several resolutions.
  DisplayID: Missing DisplayID Display Parameters Data Block.

EDID conformity: FAIL
