edid-decode (hex):

00 ff ff ff ff ff ff 00 2a 59 19 32 03 00 00 00
12 13 01 03 68 30 1b 78 2e b1 a5 a1 58 4f 95 26
16 50 54 af ce 00 81 c0 71 40 01 01 01 01 01 01
01 01 01 01 01 01 66 21 50 a0 51 00 1e 30 48 88
35 00 ae fe 10 00 00 1e 00 00 00 ff 00 30 30 30
30 30 30 30 31 30 30 30 30 0a 00 00 00 fd 00 38
4b 1e 51 0e 00 0a 20 20 20 20 20 20 00 00 00 fc
00 4c 43 44 20 4d 4f 4e 49 54 4f 52 0a 20 00 de

00 ff ff ff ff ff ff 00 2a 59 19 32 03 00 00 00
12 13 01 03 68 30 1b 78 2e b1 a5 a1 58 4f 95 26
16 50 54 af ce 00 81 c0 71 40 01 01 01 01 01 01
01 01 01 01 01 01 66 21 50 a0 51 00 1e 30 48 88
35 00 ae fe 10 00 00 1e 00 00 00 ff 00 30 30 30
30 30 30 30 31 30 30 30 30 0a 00 00 00 fd 00 38
4b 1e 51 0e 00 0a 20 20 20 20 20 20 00 00 00 fc
00 4c 43 44 20 4d 4f 4e 49 54 4f 52 0a 20 00 de

----------------

Block 0, Base EDID:
  EDID Structure Version & Revision: 1.3
  Vendor & Product Identification:
    Manufacturer: JRY
    Model: 12825
    Serial Number: ...
    Made in: week 18 of 2009
  Basic Display Parameters & Features:
    Analog display
    Signal Level Standard: 0.700 : 0.000 : 0.700 V p-p
    Blank level equals black level
    Sync: Separate
    Maximum image size: 48 cm x 27 cm
    Gamma: 2.20
    DPMS levels: Off
    RGB color display
    Default (sRGB) color space is primary color space
    First detailed timing is the preferred timing
  Color Characteristics:
    Red  : 0.6308, 0.3466
    Green: 0.3085, 0.5830
    Blue : 0.1503, 0.0878
    White: 0.3134, 0.3291
  Established Timings I & II:
    IBM     :   720x400    70.081663 Hz   9:5     31.467 kHz     28.320000 MHz
    DMT 0x04:   640x480    59.940476 Hz   4:3     31.469 kHz     25.175000 MHz
    DMT 0x05:   640x480    72.808802 Hz   4:3     37.861 kHz     31.500000 MHz
    DMT 0x06:   640x480    75.000000 Hz   4:3     37.500 kHz     31.500000 MHz
    DMT 0x08:   800x600    56.250000 Hz   4:3     35.156 kHz     36.000000 MHz
    DMT 0x09:   800x600    60.316541 Hz   4:3     37.879 kHz     40.000000 MHz
    DMT 0x0a:   800x600    72.187572 Hz   4:3     48.077 kHz     50.000000 MHz
    DMT 0x0b:   800x600    75.000000 Hz   4:3     46.875 kHz     49.500000 MHz
    DMT 0x10:  1024x768    60.003840 Hz   4:3     48.363 kHz     65.000000 MHz
    DMT 0x11:  1024x768    70.069359 Hz   4:3     56.476 kHz     75.000000 MHz
    DMT 0x12:  1024x768    75.028582 Hz   4:3     60.023 kHz     78.750000 MHz
  Standard Timings:
    DMT 0x55:  1280x720    60.000000 Hz  16:9     45.000 kHz     74.250000 MHz
    GTF     :  1152x864    60.000000 Hz   4:3     53.700 kHz     81.624000 MHz
  Detailed Timing Descriptors:
    DTD 1:  1360x768    60.328185 Hz  85:48    48.142 kHz     85.500000 MHz (430 mm x 254 mm)
                 Hfront   72 Hsync 136 Hback  208 Hpol P
                 Vfront    3 Vsync   5 Vback   22 Vpol P
    Display Product Serial Number: ...
    Display Range Limits:
      Monitor ranges (GTF): 56-75 Hz V, 30-81 kHz H, max dotclock 140 MHz
    Display Product Name: 'LCD MONITOR'
Checksum: 0xde

----------------

Warnings:

Block 0, Base EDID:
  Detailed Timing Descriptor #1: Image size is 430x254 mm, but based on the picture AR it should be 430x242 mm.
  Display Product Serial Number: ...

Failures:

Block 0, Base EDID:
  Basic Display Parameters & Features: sRGB is signaled, but the chromaticities do not match.
  Detailed Timing Descriptor #1: Mismatch of image size 430x254 mm vs display size 480x270 mm.
EDID:
  Extension Block 1 started with EDID header, ignoring Extension Blocks >= 1.

EDID conformity: FAIL
