edid-decode (hex):

00 ff ff ff ff ff ff 00 22 64 83 05 96 3c 01 00
1a 14 01 03 80 1f 11 78 0a f7 6f 9f 56 57 9c 26
11 50 53 00 00 00 01 01 01 01 01 01 01 01 01 01
01 01 01 01 01 01 4c 1d 56 ba 50 00 26 30 30 42
68 00 35 ae 10 00 00 19 00 00 00 fe 00 00 00 00
00 00 00 00 00 00 00 00 00 00 00 00 00 fc 00 48
53 44 31 34 30 50 48 57 31 0a 20 20 00 00 00 10
00 0a 20 20 20 20 20 20 20 20 20 20 20 20 00 12

00 ff ff ff ff ff ff 00 22 64 83 05 96 3c 01 00
1a 14 01 03 80 1f 11 78 0a f7 6f 9f 56 57 9c 26
11 50 53 00 00 00 01 01 01 01 01 01 01 01 01 01
01 01 01 01 01 01 4c 1d 56 ba 50 00 26 30 30 42
68 00 35 ae 10 00 00 19 00 00 00 fe 00 00 00 00
00 00 00 00 00 00 00 00 00 00 00 00 00 fc 00 48
53 44 31 34 30 50 48 57 31 0a 20 20 00 00 00 10
00 0a 20 20 20 20 20 20 20 20 20 20 20 20 00 12

----------------

Block 0, Base EDID:
  EDID Structure Version & Revision: 1.3
  Vendor & Product Identification:
    Manufacturer: HSD
    Model: 1411
    Serial Number: ...
    Made in: week 26 of 2010
  Basic Display Parameters & Features:
    Digital display
    Maximum image size: 31 cm x 17 cm
    Gamma: 2.20
    RGB color display
    First detailed timing is the preferred timing
  Color Characteristics:
    Red  : 0.6240, 0.3388
    Green: 0.3408, 0.6123
    Blue : 0.1494, 0.0683
    White: 0.3154, 0.3271
  Established Timings I & II: none
  Standard Timings: none
  Detailed Timing Descriptors:
    DTD 1:  1366x768    59.956256 Hz 683:384   48.325 kHz     75.000000 MHz (309 mm x 174 mm)
                 Hfront   48 Hsync  66 Hback   72 Hpol N
                 Vfront    6 Vsync   8 Vback   24 Vpol N
    Alphanumeric Data String: ''
    Display Product Name: 'HSD140PHW1'
    Dummy Descriptor:
Checksum: 0x12

----------------

Block 1, Unknown EDID Extension Block 0x00:
  00 ff ff ff ff ff ff 00 22 64 83 05 96 3c 01 00 '........"d...<..'
  1a 14 01 03 80 1f 11 78 0a f7 6f 9f 56 57 9c 26 '.......x..o.VW.&'
  11 50 53 00 00 00 01 01 01 01 01 01 01 01 01 01 '.PS.............'
  01 01 01 01 01 01 4c 1d 56 ba 50 00 26 30 30 42 '......L.V.P.&00B'
  68 00 35 ae 10 00 00 19 00 00 00 fe 00 00 00 00 'h.5.............'
  00 00 00 00 00 00 00 00 00 00 00 00 00 fc 00 48 '...............H'
  53 44 31 34 30 50 48 57 31 0a 20 20 00 00 00 10 'SD140PHW1.  ....'
  00 0a 20 20 20 20 20 20 20 20 20 20 20 20 00 12 '..            ..'
Checksum: 0x12

----------------

Failures:

Block 0, Base EDID:
  Alphanumeric Data String: NUL byte at position 0.
  Dummy Descriptor: Dummy block filled with garbage.
  Missing Display Range Limits Descriptor.
Block 1, Base EDID:
  Unknown Extension Block.
EDID:
  Base EDID: EDID specified 0 extension block(s), but found 1 extension block(s).

EDID conformity: FAIL
