edid-decode (hex):

00 ff ff ff ff ff ff 00 06 af 9e 14 00 00 00 00
00 16 01 04 90 26 15 78 02 c4 95 9e 57 53 92 26
0f 50 54 00 00 00 01 01 01 01 01 01 01 01 01 01
01 01 01 01 01 01 10 27 40 c6 60 84 1a 30 30 20
36 00 7e d6 10 00 00 1a 10 27 40 c6 60 84 1a 30
30 20 36 00 7e d6 10 00 00 1a 00 00 00 fe 00 38
47 50 46 4a 80 42 31 37 33 52 57 30 00 00 00 00
00 00 41 02 96 00 01 00 00 02 01 0a 20 20 00 8b

00 ff ff ff ff ff ff 00 06 af 9e 14 00 00 00 00
00 16 01 04 90 26 15 78 02 c4 95 9e 57 53 92 26
0f 50 54 00 00 00 01 01 01 01 01 01 01 01 01 01
01 01 01 01 01 01 10 27 40 c6 60 84 1a 30 30 20
36 00 7e d6 10 00 00 1a 10 27 40 c6 60 84 1a 30
30 20 36 00 7e d6 10 00 00 1a 00 00 00 fe 00 38
47 50 46 4a 80 42 31 37 33 52 57 30 00 00 00 00
00 00 41 02 96 00 01 00 00 02 01 0a 20 20 00 8b

----------------

Block 0, Base EDID:
  EDID Structure Version & Revision: 1.4
  Vendor & Product Identification:
    Manufacturer: AUO
    Model: 5278
    Made in: 2012
  Basic Display Parameters & Features:
    Digital display
    Bits per primary color channel: 6
    Digital interface is not defined
    Maximum image size: 38 cm x 21 cm
    Gamma: 2.20
    Supported color formats: RGB 4:4:4
    First detailed timing includes the native pixel format and preferred refresh rate
  Color Characteristics:
    Red  : 0.6201, 0.3398
    Green: 0.3251, 0.5703
    Blue : 0.1503, 0.0595
    White: 0.3134, 0.3291
  Established Timings I & II: none
  Standard Timings: none
  Detailed Timing Descriptors:
    DTD 1:  1600x900    60.061936 Hz  16:9     55.617 kHz    100.000000 MHz (382 mm x 214 mm)
                 Hfront   48 Hsync  32 Hback  118 Hpol P
                 Vfront    3 Vsync   6 Vback   17 Vpol N
    DTD 2:  1600x900    60.061936 Hz  16:9     55.617 kHz    100.000000 MHz (382 mm x 214 mm)
                 Hfront   48 Hsync  32 Hback  118 Hpol P
                 Vfront    3 Vsync   6 Vback   17 Vpol N
    Alphanumeric Data String: '8GPFJ.B173RW0'
    Manufacturer-Specified Display Descriptor (0x00): 00 00 00 00 41 02 96 00 01 00 00 02 01 0a 20 20 '....A.........  '
Checksum: 0x8b

----------------

Block 1, Unknown EDID Extension Block 0x00:
  00 ff ff ff ff ff ff 00 06 af 9e 14 00 00 00 00 '................'
  00 16 01 04 90 26 15 78 02 c4 95 9e 57 53 92 26 '.....&.x....WS.&'
  0f 50 54 00 00 00 01 01 01 01 01 01 01 01 01 01 '.PT.............'
  01 01 01 01 01 01 10 27 40 c6 60 84 1a 30 30 20 '.......'@.`..00 '
  36 00 7e d6 10 00 00 1a 10 27 40 c6 60 84 1a 30 '6.~......'@.`..0'
  30 20 36 00 7e d6 10 00 00 1a 00 00 00 fe 00 38 '0 6.~..........8'
  47 50 46 4a 80 42 31 37 33 52 57 30 00 00 00 00 'GPFJ.B173RW0....'
  00 00 41 02 96 00 01 00 00 02 01 0a 20 20 00 8b '..A.........  ..'
Checksum: 0x8b

----------------

Warnings:

Block 0, Base EDID:
  Alphanumeric Data String: Non-ASCII character 0x80 at position 5, can cause problems.
  Missing Display Product Name.

Failures:

Block 1, Base EDID:
  Unknown Extension Block.
EDID:
  Base EDID: EDID specified 0 extension block(s), but found 1 extension block(s).

EDID conformity: FAIL
