edid-decode (hex):

00 ff ff ff ff ff ff 00 4c 33 00 20 01 01 01 01
01 1f 01 03 08 29 19 78 2e eb d5 ac 4f 44 a4 22
13 50 54 2d cf 00 01 01 01 01 01 01 01 01 01 01
81 80 01 01 01 01 9a 29 a0 d0 51 84 22 30 50 98
36 00 99 ff 10 00 00 00 19 34 a0 d0 51 84 22 30
50 98 36 00 99 ff 10 00 00 00 00 00 00 fd 00 32
4b 18 53 14 00 0a 20 20 20 20 20 20 00 00 00 fc
00 56 47 41 0a 20 20 20 20 20 20 20 20 20 00 37

00 ff ff ff ff ff ff 00 4c 33 00 20 01 01 01 01
01 1f 01 03 08 29 19 78 2e eb d5 ac 4f 44 a4 22
13 50 54 2d cf 00 01 01 01 01 01 01 01 01 01 01
81 80 01 01 01 01 9a 29 a0 d0 51 84 22 30 50 98
36 00 99 ff 10 00 00 00 19 34 a0 d0 51 84 22 30
50 98 36 00 99 ff 10 00 00 00 00 00 00 fd 00 32
4b 18 53 14 00 0a 20 20 20 20 20 20 00 00 00 fc
00 56 47 41 0a 20 20 20 20 20 20 20 20 20 00 37

----------------

Block 0, Base EDID:
  EDID Structure Version & Revision: 1.3
  Vendor & Product Identification:
    Manufacturer: SAS
    Model: 8192
    Serial Number: ...
    Made in: week 1 of 2021
  Basic Display Parameters & Features:
    Analog display
    Signal Level Standard: 0.700 : 0.300 : 1.000 V p-p
    Blank level equals black level
    Sync: Separate
    Maximum image size: 41 cm x 25 cm
    Gamma: 2.20
    DPMS levels: Off
    RGB color display
    Default (sRGB) color space is primary color space
    First detailed timing is the preferred timing
  Color Characteristics:
    Red  : 0.6748, 0.3105
    Green: 0.2675, 0.6435
    Blue : 0.1357, 0.0751
    White: 0.3134, 0.3291
  Established Timings I & II:
    DMT 0x04:   640x480    59.940476 Hz   4:3     31.469 kHz     25.175000 MHz
    DMT 0x05:   640x480    72.808802 Hz   4:3     37.861 kHz     31.500000 MHz
    DMT 0x06:   640x480    75.000000 Hz   4:3     37.500 kHz     31.500000 MHz
    DMT 0x09:   800x600    60.316541 Hz   4:3     37.879 kHz     40.000000 MHz
    DMT 0x0a:   800x600    72.187572 Hz   4:3     48.077 kHz     50.000000 MHz
    DMT 0x0b:   800x600    75.000000 Hz   4:3     46.875 kHz     49.500000 MHz
    DMT 0x10:  1024x768    60.003840 Hz   4:3     48.363 kHz     65.000000 MHz
    DMT 0x11:  1024x768    70.069359 Hz   4:3     56.476 kHz     75.000000 MHz
    DMT 0x12:  1024x768    75.028582 Hz   4:3     60.023 kHz     78.750000 MHz
    DMT 0x24:  1280x1024   75.024675 Hz   5:4     79.976 kHz    135.000000 MHz
  Standard Timings:
    DMT 0x23:  1280x1024   60.019740 Hz   5:4     63.981 kHz    108.000000 MHz
  Detailed Timing Descriptors:
    DTD 1:  1440x900    59.887445 Hz  16:10    55.935 kHz    106.500000 MHz (analog composite, sync-on-green, 409 mm x 255 mm)
                 Hfront   80 Hsync 152 Hback  232 Hpol N
                 Vfront    3 Vsync   6 Vback   25 Vpol N
    DTD 2:  1440x900    74.997076 Hz  16:10    70.047 kHz    133.370000 MHz (analog composite, sync-on-green, 409 mm x 255 mm)
                 Hfront   80 Hsync 152 Hback  232 Hpol N
                 Vfront    3 Vsync   6 Vback   25 Vpol N
    Display Range Limits:
      Monitor ranges (GTF): 50-75 Hz V, 24-83 kHz H, max dotclock 200 MHz
    Display Product Name: 'VGA'
Checksum: 0x37

----------------

Warnings:

Block 0, Base EDID:
  Vendor & Product Identification: The serial number is one of the known dummy values, it should probably be set to 0.
  Detailed Timing Descriptor #1: DTD is similar but not identical to DMT 0x2f.

Failures:

Block 0, Base EDID:
  Basic Display Parameters & Features: sRGB is signaled, but the chromaticities do not match.
EDID:
  Extension Block 1 started with EDID header, ignoring Extension Blocks >= 1.

EDID conformity: FAIL
