edid-decode (hex):

00 ff ff ff ff ff ff 00 26 cd 2d 76 12 01 00 00
03 21 01 03 80 46 27 78 2a 7e 59 a4 55 54 a1 21
09 4e 52 25 4b 00 e1 00 a9 40 b3 00 95 00 d1 00
d1 c0 a9 c0 01 01 6a 5e 00 a0 a0 a0 29 50 30 20
35 00 bc 86 21 00 00 1e 00 00 00 ff 00 31 32 30
38 35 33 30 33 30 30 32 37 34 00 00 00 fd 00 30
4b 1b 78 21 00 0a 20 20 20 20 20 20 00 00 00 fc
00 50 4c 33 32 39 34 51 0a 20 20 20 20 20 01 b3

02 03 29 f1 49 90 01 02 03 11 12 13 04 1f 23 09
07 07 83 01 00 00 67 03 0c 00 10 00 b8 44 e3 05
c3 01 e6 06 05 01 4b 4b 00 2a 44 80 a0 70 38 27
40 58 2c 45 00 bc 86 21 00 00 1e 01 1d 00 72 51
d0 1e 20 6e 28 55 00 bc 86 21 00 00 1e 66 21 56
aa 51 00 1e 30 30 20 35 00 bc 86 21 00 00 1e d9
76 00 a0 a0 a0 34 50 30 20 35 00 bc 86 21 00 00
1e 00 00 00 00 00 00 00 00 00 00 00 00 00 00 0e

00 ff ff ff ff ff ff 00 26 cd 2d 76 12 01 00 00
03 21 01 03 80 46 27 78 2a 7e 59 a4 55 54 a1 21
09 4e 52 25 4b 00 e1 00 a9 40 b3 00 95 00 d1 00
d1 c0 a9 c0 01 01 6a 5e 00 a0 a0 a0 29 50 30 20
35 00 bc 86 21 00 00 1e 00 00 00 ff 00 31 32 30
38 35 33 30 33 30 30 32 37 34 00 00 00 fd 00 30
4b 1b 78 21 00 0a 20 20 20 20 20 20 00 00 00 fc
00 50 4c 33 32 39 34 51 0a 20 20 20 20 20 01 b3

02 03 29 f1 49 90 01 02 03 11 12 13 04 1f 23 09
07 07 83 01 00 00 67 03 0c 00 10 00 b8 44 e3 05
c3 01 e6 06 05 01 4b 4b 00 2a 44 80 a0 70 38 27
40 58 2c 45 00 bc 86 21 00 00 1e 01 1d 00 72 51
d0 1e 20 6e 28 55 00 bc 86 21 00 00 1e 66 21 56
aa 51 00 1e 30 30 20 35 00 bc 86 21 00 00 1e d9
76 00 a0 a0 a0 34 50 30 20 35 00 bc 86 21 00 00
1e 00 00 00 00 00 00 00 00 00 00 00 00 00 00 0e

----------------

Block 0, Base EDID:
  EDID Structure Version & Revision: 1.3
  Vendor & Product Identification:
    Manufacturer: IVM
    Model: 30253
    Serial Number: ...
    Made in: week 3 of 2023
  Basic Display Parameters & Features:
    Digital display
    Maximum image size: 70 cm x 39 cm
    Gamma: 2.20
    DPMS levels: Off
    RGB color display
    First detailed timing is the preferred timing
  Color Characteristics:
    Red  : 0.6416, 0.3349
    Green: 0.3310, 0.6308
    Blue : 0.1298, 0.0361
    White: 0.3066, 0.3212
  Established Timings I & II:
    DMT 0x04:   640x480    59.940476 Hz   4:3     31.469 kHz     25.175000 MHz
    DMT 0x06:   640x480    75.000000 Hz   4:3     37.500 kHz     31.500000 MHz
    DMT 0x09:   800x600    60.316541 Hz   4:3     37.879 kHz     40.000000 MHz
    DMT 0x0b:   800x600    75.000000 Hz   4:3     46.875 kHz     49.500000 MHz
    DMT 0x10:  1024x768    60.003840 Hz   4:3     48.363 kHz     65.000000 MHz
    DMT 0x12:  1024x768    75.028582 Hz   4:3     60.023 kHz     78.750000 MHz
    DMT 0x24:  1280x1024   75.024675 Hz   5:4     79.976 kHz    135.000000 MHz
  Standard Timings:
    GTF     :  2048x1280   60.000000 Hz  16:10    79.500 kHz    221.328000 MHz
    DMT 0x33:  1600x1200   60.000000 Hz   4:3     75.000 kHz    162.000000 MHz
    DMT 0x3a:  1680x1050   59.954250 Hz  16:10    65.290 kHz    146.250000 MHz
    DMT 0x2f:  1440x900    59.887445 Hz  16:10    55.935 kHz    106.500000 MHz
    DMT 0x45:  1920x1200   59.884600 Hz  16:10    74.556 kHz    193.250000 MHz
    DMT 0x52:  1920x1080   60.000000 Hz  16:9     67.500 kHz    148.500000 MHz
    DMT 0x53:  1600x900    60.000000 Hz  16:9     60.000 kHz    108.000000 MHz (RB)
  Detailed Timing Descriptors:
    DTD 1:  2560x1440   60.000199 Hz  16:9     88.860 kHz    241.700000 MHz (700 mm x 390 mm)
                 Hfront   48 Hsync  32 Hback   80 Hpol P
                 Vfront    3 Vsync   5 Vback   33 Vpol P
    Display Product Serial Number: ...
    Display Range Limits:
      Monitor ranges (GTF): 48-75 Hz V, 27-120 kHz H, max dotclock 330 MHz
    Display Product Name: 'PL3294Q'
  Extension blocks: 1
Checksum: 0xb3

----------------

Block 1, CTA-861 Extension Block:
  Revision: 3
  Underscans IT Video Formats by default
  Basic audio support
  Supports YCbCr 4:4:4
  Supports YCbCr 4:2:2
  Native DTDs: 1
  Video Data Block:
    VIC  16:  1920x1080   60.000000 Hz  16:9     67.500 kHz    148.500000 MHz (native)
    VIC   1:   640x480    59.940476 Hz   4:3     31.469 kHz     25.175000 MHz
    VIC   2:   720x480    59.940060 Hz   4:3     31.469 kHz     27.000000 MHz
    VIC   3:   720x480    59.940060 Hz  16:9     31.469 kHz     27.000000 MHz
    VIC  17:   720x576    50.000000 Hz   4:3     31.250 kHz     27.000000 MHz
    VIC  18:   720x576    50.000000 Hz  16:9     31.250 kHz     27.000000 MHz
    VIC  19:  1280x720    50.000000 Hz  16:9     37.500 kHz     74.250000 MHz
    VIC   4:  1280x720    60.000000 Hz  16:9     45.000 kHz     74.250000 MHz
    VIC  31:  1920x1080   50.000000 Hz  16:9     56.250 kHz    148.500000 MHz
  Audio Data Block:
    Linear PCM:
      Max channels: 2
      Supported sample rates (kHz): 48 44.1 32
      Supported sample sizes (bits): 24 20 16
  Speaker Allocation Data Block:
    FL/FR - Front Left/Right
  Vendor-Specific Data Block (HDMI), OUI 00-0C-03:
    Source physical address: 1.0.0.0
    Supports_AI
    DC_36bit
    DC_30bit
    DC_Y444
    Maximum TMDS clock: 340 MHz
  Colorimetry Data Block:
    xvYCC601
    xvYCC709
    BT2020YCC
    BT2020RGB
    Gamut Boundary Description Metadata Profile P0
  HDR Static Metadata Data Block:
    Electro optical transfer functions:
      Traditional gamma - SDR luminance range
      SMPTE ST2084
    Supported static metadata descriptors:
      Static metadata type 1
    Desired content max luminance: 75 (253.810 cd/m^2)
    Desired content max frame-average luminance: 75 (253.810 cd/m^2)
    Desired content min luminance: 0 (0.000 cd/m^2)
  Detailed Timing Descriptors:
    DTD 2:  1920x1080   74.972503 Hz  16:9     83.894 kHz    174.500000 MHz (700 mm x 390 mm)
                 Hfront   88 Hsync  44 Hback   28 Hpol P
                 Vfront    4 Vsync   5 Vback   30 Vpol P
    DTD 3:  1280x720    60.000000 Hz  16:9     45.000 kHz     74.250000 MHz (700 mm x 390 mm)
                 Hfront  110 Hsync  40 Hback  220 Hpol P
                 Vfront    5 Vsync   5 Vback   20 Vpol P
    DTD 4:  1366x768    59.789541 Hz 683:384   47.712 kHz     85.500000 MHz (700 mm x 390 mm)
                 Hfront   48 Hsync  32 Hback  346 Hpol P
                 Vfront    3 Vsync   5 Vback   22 Vpol P
    DTD 5:  2560x1440   74.970923 Hz  16:9    111.857 kHz    304.250000 MHz (700 mm x 390 mm)
                 Hfront   48 Hsync  32 Hback   80 Hpol P
                 Vfront    3 Vsync   5 Vback   44 Vpol P
Checksum: 0x0e  Unused space in Extension Block: 14 bytes

----------------

Warnings:

Block 1, CTA-861 Extension Block:
  Video Data Block: VIC 16 and the first DTD are not identical. Is this intended?
  Colorimetry Data Block: Set the sRGB colorimetry bit to avoid interop issues.
  Detailed Timing Descriptor #4: DTD is similar but not identical to DMT 0x51.
  Display Product Serial Number is set, so the Serial Number in the Base EDID should be 0.

Failures:

Block 1, CTA-861 Extension Block:
  Missing VCDB, needed for Set Selectable RGB Quantization to avoid interop issues.
EDID:
  Extension Block 2 started with EDID header, ignoring Extension Blocks >= 2.
  CTA-861: Native progressive timings are a mix of several resolutions.

EDID conformity: FAIL
