edid-decode (hex):

00 ff ff ff ff ff ff 00 41 0c 00 00 01 01 01 01
01 14 01 03 08 46 27 78 0a 6e 5b a4 55 4a 9b 25
0e 47 4a 2d ce 00 d1 c0 31 40 45 40 61 40 81 80
01 01 01 01 01 01 1a 36 80 a0 70 38 1f 40 30 20
35 00 bc 86 21 00 00 1a 66 21 50 b0 51 00 1b 30
40 70 36 00 bc 86 21 00 00 1e 00 00 00 fd 00 38
4b 0e 46 10 00 0a 20 20 20 20 20 20 00 00 00 fc
00 50 68 69 6c 69 70 73 0a 20 20 20 20 20 00 e0

00 ff ff ff ff ff ff 00 41 0c 00 00 01 01 01 01
01 14 01 03 08 46 27 78 0a 6e 5b a4 55 4a 9b 25
0e 47 4a 2d ce 00 d1 c0 31 40 45 40 61 40 81 80
01 01 01 01 01 01 1a 36 80 a0 70 38 1f 40 30 20
35 00 bc 86 21 00 00 1a 66 21 50 b0 51 00 1b 30
40 70 36 00 bc 86 21 00 00 1e 00 00 00 fd 00 38
4b 0e 46 10 00 0a 20 20 20 20 20 20 00 00 00 fc
00 50 68 69 6c 69 70 73 0a 20 20 20 20 20 00 e0

----------------

Block 0, Base EDID:
  EDID Structure Version & Revision: 1.3
  Vendor & Product Identification:
    Manufacturer: PHL
    Model: 0
    Serial Number: ...
    Made in: week 1 of 2010
  Basic Display Parameters & Features:
    Analog display
    Signal Level Standard: 0.700 : 0.300 : 1.000 V p-p
    Blank level equals black level
    Sync: Separate
    Maximum image size: 70 cm x 39 cm
    Gamma: 2.20
    RGB color display
    First detailed timing is the preferred timing
  Color Characteristics:
    Red  : 0.6416, 0.3339
    Green: 0.2919, 0.6074
    Blue : 0.1455, 0.0556
    White: 0.2792, 0.2919
  Established Timings I & II:
    DMT 0x04:   640x480    59.940476 Hz   4:3     31.469 kHz     25.175000 MHz
    DMT 0x05:   640x480    72.808802 Hz   4:3     37.861 kHz     31.500000 MHz
    DMT 0x06:   640x480    75.000000 Hz   4:3     37.500 kHz     31.500000 MHz
    DMT 0x09:   800x600    60.316541 Hz   4:3     37.879 kHz     40.000000 MHz
    DMT 0x0a:   800x600    72.187572 Hz   4:3     48.077 kHz     50.000000 MHz
    DMT 0x0b:   800x600    75.000000 Hz   4:3     46.875 kHz     49.500000 MHz
    DMT 0x10:  1024x768    60.003840 Hz   4:3     48.363 kHz     65.000000 MHz
    DMT 0x11:  1024x768    70.069359 Hz   4:3     56.476 kHz     75.000000 MHz
    DMT 0x12:  1024x768    75.028582 Hz   4:3     60.023 kHz     78.750000 MHz
  Standard Timings:
    DMT 0x52:  1920x1080   60.000000 Hz  16:9     67.500 kHz    148.500000 MHz
    DMT 0x04:   640x480    59.940476 Hz   4:3     31.469 kHz     25.175000 MHz
    DMT 0x09:   800x600    60.316541 Hz   4:3     37.879 kHz     40.000000 MHz
    DMT 0x10:  1024x768    60.003840 Hz   4:3     48.363 kHz     65.000000 MHz
    DMT 0x23:  1280x1024   60.019740 Hz   5:4     63.981 kHz    108.000000 MHz
  Detailed Timing Descriptors:
    DTD 1:  1920x1080   59.933878 Hz  16:9     66.587 kHz    138.500000 MHz (700 mm x 390 mm)
                 Hfront   48 Hsync  32 Hback   80 Hpol P
                 Vfront    3 Vsync   5 Vback   23 Vpol N
    DTD 2:  1360x768    60.015162 Hz  85:48    47.712 kHz     85.500000 MHz (700 mm x 390 mm)
                 Hfront   64 Hsync 112 Hback  256 Hpol P
                 Vfront    3 Vsync   6 Vback   18 Vpol P
    Display Range Limits:
      Monitor ranges (GTF): 56-75 Hz V, 14-70 kHz H, max dotclock 160 MHz
    Display Product Name: 'Philips'
Checksum: 0xe0

----------------

Warnings:

Block 0, Base EDID:
  Vendor & Product Identification: The serial number is one of the known dummy values, it should probably be set to 0.

Failures:

EDID:
  Extension Block 1 started with EDID header, ignoring Extension Blocks >= 1.

EDID conformity: FAIL
