edid-decode (hex):

00 ff ff ff ff ff ff 00 06 af b0 cd 00 00 00 00
00 20 01 04 a5 1d 12 78 03 a3 05 a8 54 49 9e 25
0f 50 54 00 00 00 01 01 01 01 01 01 01 01 01 01
01 01 01 01 01 01 f0 68 00 a0 a0 40 2e 60 30 20
35 00 1e b2 10 00 00 1a 00 00 00 fd 00 30 3c 63
63 1b 01 0a 20 20 20 20 20 20 00 00 00 fe 00 57
4e 54 4e 54 80 42 31 33 33 51 41 41 00 00 00 00
00 02 41 21 b2 01 11 00 00 1a 41 0a 20 20 00 61

00 ff ff ff ff ff ff 00 06 af b0 cd 00 00 00 00
00 20 01 04 a5 1d 12 78 03 a3 05 a8 54 49 9e 25
0f 50 54 00 00 00 01 01 01 01 01 01 01 01 01 01
01 01 01 01 01 01 f0 68 00 a0 a0 40 2e 60 30 20
35 00 1e b2 10 00 00 1a 00 00 00 fd 00 30 3c 63
63 1b 01 0a 20 20 20 20 20 20 00 00 00 fe 00 57
4e 54 4e 54 80 42 31 33 33 51 41 41 00 00 00 00
00 02 41 21 b2 01 11 00 00 1a 41 0a 20 20 00 61

----------------

Block 0, Base EDID:
  EDID Structure Version & Revision: 1.4
  Vendor & Product Identification:
    Manufacturer: AUO
    Model: 52656
    Made in: 2022
  Basic Display Parameters & Features:
    Digital display
    Bits per primary color channel: 8
    DisplayPort interface
    Maximum image size: 29 cm x 18 cm
    Gamma: 2.20
    Supported color formats: RGB 4:4:4
    First detailed timing includes the native pixel format and preferred refresh rate
    Display supports continuous frequencies
  Color Characteristics:
    Red  : 0.6582, 0.3300
    Green: 0.2851, 0.6201
    Blue : 0.1445, 0.0585
    White: 0.3134, 0.3291
  Established Timings I & II: none
  Standard Timings: none
  Detailed Timing Descriptors:
    DTD 1:  2560x1600   60.002859 Hz  16:10    98.765 kHz    268.640000 MHz (286 mm x 178 mm)
                 Hfront   48 Hsync  32 Hback   80 Hpol P
                 Vfront    3 Vsync   5 Vback   38 Vpol N
    Display Range Limits:
      Monitor ranges (Range Limits Only): 48-60 Hz V, 99-99 kHz H, max dotclock 270 MHz
    Alphanumeric Data String: 'WNTNT.B133QAA'
    Manufacturer-Specified Display Descriptor (0x00): 00 00 00 02 41 21 b2 01 11 00 00 1a 41 0a 20 20 '....A!......A.  '
Checksum: 0x61

----------------

Warnings:

Block 0, Base EDID:
  Alphanumeric Data String: Non-ASCII character 0x80 at position 5, can cause problems.
  Missing Display Product Name.

Failures:

EDID:
  Extension Block 1 started with EDID header, ignoring Extension Blocks >= 1.

EDID conformity: FAIL
