edid-decode (hex):

00 ff ff ff ff ff ff 00 43 47 32 bc 01 01 01 01
23 1c 01 03 80 34 1f 78 3e ee 91 a3 54 4c 99 26
0f 50 54 0f cf 00 d1 c0 b3 00 a9 c0 a9 c0 95 00
81 80 81 40 81 c0 02 3a 80 18 71 38 2d 40 58 2c
25 00 08 36 21 00 00 1e 00 00 00 fc 00 48 44 4d
49 0a 20 20 20 20 20 20 20 20 00 00 00 ff 00 0a
20 20 20 20 20 20 20 20 20 20 20 20 00 00 00 fd
00 32 4b 1e 82 13 01 0a 20 20 20 20 20 20 01 44

00 ff ff ff ff ff ff 00 43 47 32 bc 01 01 01 01
23 1c 01 03 80 34 1f 78 3e ee 91 a3 54 4c 99 26
0f 50 54 0f cf 00 d1 c0 b3 00 a9 c0 a9 c0 95 00
81 80 81 40 81 c0 02 3a 80 18 71 38 2d 40 58 2c
25 00 08 36 21 00 00 1e 00 00 00 fc 00 48 44 4d
49 0a 20 20 20 20 20 20 20 20 00 00 00 ff 00 0a
20 20 20 20 20 20 20 20 20 20 20 20 00 00 00 fd
00 32 4b 1e 82 13 01 0a 20 20 20 20 20 20 01 44

----------------

Block 0, Base EDID:
  EDID Structure Version & Revision: 1.3
  Vendor & Product Identification:
    Manufacturer: PZG
    Model: 48178
    Serial Number: ...
    Made in: week 35 of 2018
  Basic Display Parameters & Features:
    Digital display
    Maximum image size: 52 cm x 31 cm
    Gamma: 2.20
    DPMS levels: Off
    Undefined display color type
    Default (sRGB) color space is primary color space
    First detailed timing is the preferred timing
  Color Characteristics:
    Red  : 0.6396, 0.3300
    Green: 0.2998, 0.5996
    Blue : 0.1503, 0.0595
    White: 0.3125, 0.3291
  Established Timings I & II:
    DMT 0x05:   640x480    72.808802 Hz   4:3     37.861 kHz     31.500000 MHz
    DMT 0x06:   640x480    75.000000 Hz   4:3     37.500 kHz     31.500000 MHz
    DMT 0x08:   800x600    56.250000 Hz   4:3     35.156 kHz     36.000000 MHz
    DMT 0x09:   800x600    60.316541 Hz   4:3     37.879 kHz     40.000000 MHz
    DMT 0x0a:   800x600    72.187572 Hz   4:3     48.077 kHz     50.000000 MHz
    DMT 0x0b:   800x600    75.000000 Hz   4:3     46.875 kHz     49.500000 MHz
    DMT 0x10:  1024x768    60.003840 Hz   4:3     48.363 kHz     65.000000 MHz
    DMT 0x11:  1024x768    70.069359 Hz   4:3     56.476 kHz     75.000000 MHz
    DMT 0x12:  1024x768    75.028582 Hz   4:3     60.023 kHz     78.750000 MHz
    DMT 0x24:  1280x1024   75.024675 Hz   5:4     79.976 kHz    135.000000 MHz
  Standard Timings:
    DMT 0x52:  1920x1080   60.000000 Hz  16:9     67.500 kHz    148.500000 MHz
    DMT 0x3a:  1680x1050   59.954250 Hz  16:10    65.290 kHz    146.250000 MHz
    DMT 0x53:  1600x900    60.000000 Hz  16:9     60.000 kHz    108.000000 MHz (RB)
    DMT 0x53:  1600x900    60.000000 Hz  16:9     60.000 kHz    108.000000 MHz (RB)
    DMT 0x2f:  1440x900    59.887445 Hz  16:10    55.935 kHz    106.500000 MHz
    DMT 0x23:  1280x1024   60.019740 Hz   5:4     63.981 kHz    108.000000 MHz
    DMT 0x20:  1280x960    60.000000 Hz   4:3     60.000 kHz    108.000000 MHz
    DMT 0x55:  1280x720    60.000000 Hz  16:9     45.000 kHz     74.250000 MHz
  Detailed Timing Descriptors:
    DTD 1:  1920x1080   60.000000 Hz  16:9     67.500 kHz    148.500000 MHz (520 mm x 310 mm)
                 Hfront   88 Hsync  44 Hback  148 Hpol P
                 Vfront    2 Vsync   5 Vback   38 Vpol P
    Display Product Name: 'HDMI'
    Display Product Serial Number: ...
    Display Range Limits:
      Monitor ranges (Range Limits Only): 50-75 Hz V, 30-130 kHz H, max dotclock 190 MHz
  Extension blocks: 1
Checksum: 0x44

----------------

Warnings:

Block 0, Base EDID:
  Vendor & Product Identification: The serial number is one of the known dummy values, it should probably be set to 0.
  Detailed Timing Descriptor #1: DTD is similar but not identical to VIC 16.
  Detailed Timing Descriptor #1: Image size is 520x310 mm, but based on the picture AR it should be 520x292 mm.

Failures:

Block 0, Base EDID:
  Display Product Serial Number: ...
  Display Range Limits: 'Range Limits Only' is not allowed for EDID < 1.4.
EDID:
  Extension Block 1 started with EDID header, ignoring Extension Blocks >= 1.
  Base EDID: EDID specified 1 extension block(s), but found 0 extension block(s).

EDID conformity: FAIL
