edid-decode (hex):

00 ff ff ff ff ff ff 00 4f 2e 22 00 69 12 00 00
0e 11 01 03 81 47 28 78 0b 3f 00 a7 54 46 98 25
11 49 4b 25 4a 00 81 c0 01 01 01 01 01 01 01 01
01 01 01 01 01 01 20 1c 50 a0 50 00 16 30 30 20
35 00 c6 90 21 00 00 1c a9 1a 00 a0 50 00 16 30
30 20 73 00 c6 90 21 00 00 1a 00 00 00 fd 00 38
4b 0f 3a 08 00 0a 20 20 20 20 20 20 00 00 00 fc
00 32 33 32 2d 53 31 32 0a 20 20 20 20 20 01 d3

02 03 19 71 46 85 02 03 04 06 07 23 09 07 07 83
01 00 00 65 03 0c 00 10 00 01 1d 80 18 71 1c 17
20 58 2c 25 00 c6 90 21 00 00 9e 01 1d 00 72 51
d0 1e 20 6e 28 55 00 c6 90 21 00 00 1e 8c 0a d0
8a 20 e0 2d 10 10 3e 96 00 c6 90 21 00 00 18 8c
0a d0 8a 20 e0 2d 10 10 3e 96 00 14 90 21 00 00
18 8c 0a a0 14 51 f0 16 00 26 7c 43 00 c6 90 21
00 00 98 00 00 00 00 00 00 00 00 00 00 00 00 84

00 ff ff ff ff ff ff 00 4f 2e 22 00 69 12 00 00
0e 11 01 03 81 47 28 78 0b 3f 00 a7 54 46 98 25
11 49 4b 25 4a 00 81 c0 01 01 01 01 01 01 01 01
01 01 01 01 01 01 20 1c 50 a0 50 00 16 30 30 20
35 00 c6 90 21 00 00 1c a9 1a 00 a0 50 00 16 30
30 20 73 00 c6 90 21 00 00 1a 00 00 00 fd 00 38
4b 0f 3a 08 00 0a 20 20 20 20 20 20 00 00 00 fc
00 32 33 32 2d 53 31 32 0a 20 20 20 20 20 01 d3

02 03 19 71 46 85 02 03 04 06 07 23 09 07 07 83
01 00 00 65 03 0c 00 10 00 01 1d 80 18 71 1c 17
20 58 2c 25 00 c6 90 21 00 00 9e 01 1d 00 72 51
d0 1e 20 6e 28 55 00 c6 90 21 00 00 1e 8c 0a d0
8a 20 e0 2d 10 10 3e 96 00 c6 90 21 00 00 18 8c
0a d0 8a 20 e0 2d 10 10 3e 96 00 14 90 21 00 00
18 8c 0a a0 14 51 f0 16 00 26 7c 43 00 c6 90 21
00 00 98 00 00 00 00 00 00 00 00 00 00 00 00 84

----------------

Block 0, Base EDID:
  EDID Structure Version & Revision: 1.3
  Vendor & Product Identification:
    Manufacturer: SYN
    Model: 34
    Serial Number: ...
    Made in: week 14 of 2007
  Basic Display Parameters & Features:
    Digital display
    DFP 1.x compatible TMDS
    Maximum image size: 71 cm x 40 cm
    Gamma: 2.20
    RGB color display
    First detailed timing is the preferred timing
    Supports GTF timings within operating range
  Color Characteristics:
    Red  : 0.6523, 0.3310
    Green: 0.2763, 0.5966
    Blue : 0.1445, 0.0664
    White: 0.2851, 0.2929
  Established Timings I & II:
    DMT 0x04:   640x480    59.940476 Hz   4:3     31.469 kHz     25.175000 MHz
    DMT 0x06:   640x480    75.000000 Hz   4:3     37.500 kHz     31.500000 MHz
    DMT 0x09:   800x600    60.316541 Hz   4:3     37.879 kHz     40.000000 MHz
    DMT 0x0b:   800x600    75.000000 Hz   4:3     46.875 kHz     49.500000 MHz
    DMT 0x10:  1024x768    60.003840 Hz   4:3     48.363 kHz     65.000000 MHz
    DMT 0x12:  1024x768    75.028582 Hz   4:3     60.023 kHz     78.750000 MHz
  Standard Timings:
    DMT 0x55:  1280x720    60.000000 Hz  16:9     45.000 kHz     74.250000 MHz
  Detailed Timing Descriptors:
    DTD 1:  1360x768    59.960027 Hz  85:48    47.368 kHz     72.000000 MHz (710 mm x 400 mm)
                 Hfront   48 Hsync  32 Hback   80 Hpol N
                 Vfront    3 Vsync   5 Vback   14 Vpol P
    DTD 2:  1280x768    59.994726 Hz   5:3     47.396 kHz     68.250000 MHz (710 mm x 400 mm)
                 Hfront   48 Hsync  32 Hback   80 Hpol P
                 Vfront    7 Vsync   3 Vback   12 Vpol N
    Display Range Limits:
      Monitor ranges (GTF): 56-75 Hz V, 15-58 kHz H, max dotclock 80 MHz
    Display Product Name: '232-S12'
  Extension blocks: 1
Checksum: 0xd3

----------------

Block 1, CTA-861 Extension Block:
  Revision: 3
  Basic audio support
  Supports YCbCr 4:4:4
  Supports YCbCr 4:2:2
  Native DTDs: 1
  Video Data Block:
    VIC   5:  1920x1080i  60.000000 Hz  16:9     33.750 kHz     74.250000 MHz (native)
    VIC   2:   720x480    59.940060 Hz   4:3     31.469 kHz     27.000000 MHz
    VIC   3:   720x480    59.940060 Hz  16:9     31.469 kHz     27.000000 MHz
    VIC   4:  1280x720    60.000000 Hz  16:9     45.000 kHz     74.250000 MHz
    VIC   6:  1440x480i   59.940060 Hz   4:3     15.734 kHz     27.000000 MHz
    VIC   7:  1440x480i   59.940060 Hz  16:9     15.734 kHz     27.000000 MHz
  Audio Data Block:
    Linear PCM:
      Max channels: 2
      Supported sample rates (kHz): 48 44.1 32
      Supported sample sizes (bits): 24 20 16
  Speaker Allocation Data Block:
    FL/FR - Front Left/Right
  Vendor-Specific Data Block (HDMI), OUI 00-0C-03:
    Source physical address: 1.0.0.0
  Detailed Timing Descriptors:
    DTD 3:  1920x1080i  59.893523 Hz  16:9     33.750 kHz     74.250000 MHz (710 mm x 400 mm)
                 Hfront   88 Hsync  44 Hback  148 Hpol P
                 Vfront    2 Vsync   5 Vback   16 Vpol P Vfront +0.5 Odd Field
                 Vfront    2 Vsync   5 Vback   16 Vpol P Vback  +0.5 Even Field
    DTD 4:  1280x720    60.000000 Hz  16:9     45.000 kHz     74.250000 MHz (710 mm x 400 mm)
                 Hfront  110 Hsync  40 Hback  220 Hpol P
                 Vfront    5 Vsync   5 Vback   20 Vpol P
    DTD 5:   720x480    59.940060 Hz   3:2     31.469 kHz     27.000000 MHz (710 mm x 400 mm)
                 Hfront   16 Hsync  62 Hback   60 Hpol N
                 Vfront    9 Vsync   6 Vback   30 Vpol N
    DTD 6:   720x480    59.940060 Hz   3:2     31.469 kHz     27.000000 MHz (532 mm x 400 mm)
                 Hfront   16 Hsync  62 Hback   60 Hpol N
                 Vfront    9 Vsync   6 Vback   30 Vpol N
    DTD 7:  1440x480i   59.940060 Hz   3:1     15.734 kHz     27.000000 MHz (710 mm x 400 mm)
                 Hfront   38 Hsync 124 Hback  114 Hpol N
                 Vfront    4 Vsync   3 Vback   15 Vpol N Vfront +0.5 Odd Field
                 Vfront    4 Vsync   3 Vback   15 Vpol N Vback  +0.5 Even Field
Checksum: 0x84  Unused space in Extension Block: 12 bytes

----------------

Warnings:

Block 0, Base EDID:
  Detailed Timing Descriptor #2: DTD is similar but not identical to DMT 0x16.
  Detailed Timing Descriptor #2: Image size is 710x400 mm, but based on the picture AR it should be 666x400 mm.
Block 1, CTA-861 Extension Block:
  IT Video Formats are overscanned by default, but normally this should be underscanned.
  Video Data Block: VIC 5 and the first DTD are not identical. Is this intended?
  Detailed Timing Descriptor #5: Image size is 710x400 mm, but based on the picture AR it should be 600x400 mm.
  Detailed Timing Descriptor #6: Image size is 532x400 mm, but based on the picture AR it should be 532x354 mm.
  Detailed Timing Descriptor #7: Image size is 710x400 mm, but based on the picture AR it should be 710x236 mm.
  Add a Colorimetry Data Block with the sRGB colorimetry bit set to avoid interop issues.
EDID:
  Base EDID: Some timings are out of range of the Monitor Ranges:
    Horizontal Freq: 15.734 - 60.022 kHz (Monitor: 15.000 - 58.000 kHz)

Failures:

Block 1, CTA-861 Extension Block:
  Missing VCDB, needed for Set Selectable RGB Quantization to avoid interop issues.
EDID:
  Extension Block 2 started with EDID header, ignoring Extension Blocks >= 2.

EDID conformity: FAIL
