edid-decode (hex):

00 ff ff ff ff ff ff 00 34 a4 f7 86 01 01 01 01
33 11 01 03 80 2f 1e 78 ea ee 95 a3 54 4c 99 26
0f 50 54 a5 4b 00 81 80 b3 00 95 00 01 01 01 01
01 01 01 01 01 01 21 39 90 30 62 1a 27 40 68 b0
36 00 da 28 11 00 00 1c 00 00 00 fc 00 4d 44 33
30 34 32 32 50 56 0a 20 20 20 00 00 00 fd 00 35
4c 39 53 10 00 0a 20 20 20 20 20 20 00 00 00 ff
00 37 31 32 30 32 37 39 38 31 0a 20 20 20 00 87

00 ff ff ff ff ff ff 00 34 a4 f7 86 01 01 01 01
33 11 01 03 80 2f 1e 78 ea ee 95 a3 54 4c 99 26
0f 50 54 a5 4b 00 81 80 b3 00 95 00 01 01 01 01
01 01 01 01 01 01 21 39 90 30 62 1a 27 40 68 b0
36 00 da 28 11 00 00 1c 00 00 00 fc 00 4d 44 33
30 34 32 32 50 56 0a 20 20 20 00 00 00 fd 00 35
4c 39 53 10 00 0a 20 20 20 20 20 20 00 00 00 ff
00 37 31 32 30 32 37 39 38 31 0a 20 20 20 00 87

----------------

Block 0, Base EDID:
  EDID Structure Version & Revision: 1.3
  Vendor & Product Identification:
    Manufacturer: MED
    Model: 34551
    Serial Number: ...
    Made in: week 51 of 2007
  Basic Display Parameters & Features:
    Digital display
    Maximum image size: 47 cm x 30 cm
    Gamma: 2.20
    DPMS levels: Standby Suspend Off
    RGB color display
    First detailed timing is the preferred timing
  Color Characteristics:
    Red  : 0.6396, 0.3300
    Green: 0.2998, 0.5996
    Blue : 0.1503, 0.0595
    White: 0.3134, 0.3291
  Established Timings I & II:
    IBM     :   720x400    70.081663 Hz   9:5     31.467 kHz     28.320000 MHz
    DMT 0x04:   640x480    59.940476 Hz   4:3     31.469 kHz     25.175000 MHz
    DMT 0x06:   640x480    75.000000 Hz   4:3     37.500 kHz     31.500000 MHz
    DMT 0x09:   800x600    60.316541 Hz   4:3     37.879 kHz     40.000000 MHz
    DMT 0x0b:   800x600    75.000000 Hz   4:3     46.875 kHz     49.500000 MHz
    DMT 0x10:  1024x768    60.003840 Hz   4:3     48.363 kHz     65.000000 MHz
    DMT 0x12:  1024x768    75.028582 Hz   4:3     60.023 kHz     78.750000 MHz
    DMT 0x24:  1280x1024   75.024675 Hz   5:4     79.976 kHz    135.000000 MHz
  Standard Timings:
    DMT 0x23:  1280x1024   60.019740 Hz   5:4     63.981 kHz    108.000000 MHz
    DMT 0x3a:  1680x1050   59.954250 Hz  16:10    65.290 kHz    146.250000 MHz
    DMT 0x2f:  1440x900    59.887445 Hz  16:10    55.935 kHz    106.500000 MHz
  Detailed Timing Descriptors:
    DTD 1:  1680x1050   59.954250 Hz  16:10    65.290 kHz    146.250000 MHz (474 mm x 296 mm)
                 Hfront  104 Hsync 176 Hback  280 Hpol N
                 Vfront    3 Vsync   6 Vback   30 Vpol P
    Display Product Name: 'MD30422PV'
    Display Range Limits:
      Monitor ranges (GTF): 53-76 Hz V, 57-83 kHz H, max dotclock 160 MHz
    Display Product Serial Number: ...
Checksum: 0x87

----------------

Block 1, Unknown EDID Extension Block 0x00:
  00 ff ff ff ff ff ff 00 34 a4 f7 86 01 01 01 01 '........4.......'
  33 11 01 03 80 2f 1e 78 ea ee 95 a3 54 4c 99 26 '3..../.x....TL.&'
  0f 50 54 a5 4b 00 81 80 b3 00 95 00 01 01 01 01 '.PT.K...........'
  01 01 01 01 01 01 21 39 90 30 62 1a 27 40 68 b0 '......!9.0b.'@h.'
  36 00 da 28 11 00 00 1c 00 00 00 fc 00 4d 44 33 '6..(.........MD3'
  30 34 32 32 50 56 0a 20 20 20 00 00 00 fd 00 35 '0422PV.   .....5'
  4c 39 53 10 00 0a 20 20 20 20 20 20 00 00 00 ff 'L9S...      ....'
  00 37 31 32 30 32 37 39 38 31 0a 20 20 20 00 87 '.712027981.   ..'
Checksum: 0x87

----------------

Warnings:

Block 0, Base EDID:
  Vendor & Product Identification: The serial number is one of the known dummy values, it should probably be set to 0.
EDID:
  Base EDID: Some timings are out of range of the Monitor Ranges:
    Horizontal Freq: 31.466 - 79.976 kHz (Monitor: 57.000 - 83.000 kHz)

Failures:

Block 1, Base EDID:
  Unknown Extension Block.
EDID:
  Base EDID: EDID specified 0 extension block(s), but found 1 extension block(s).

EDID conformity: FAIL
