edid-decode (hex):

00 ff ff ff ff ff ff 00 4d 67 09 24 01 00 00 00
02 22 01 03 80 35 1e 78 af e7 f0 ac 50 48 a7 26
0c 50 54 a7 cf 00 81 c0 81 80 95 00 a9 c0 b3 00
d1 c0 01 01 01 01 5d 5e 00 a0 a0 a0 29 50 30 20
35 00 55 50 21 00 00 1e 02 3a 80 18 71 38 2d 40
58 2c 45 00 55 50 21 00 00 1e 00 00 00 fd 00 30
92 19 fa 3c 00 0a 20 20 20 20 20 20 00 00 00 fc
00 51 32 34 54 30 39 0a 20 20 20 20 20 20 01 45

02 03 46 f3 4e 01 02 03 04 05 10 12 13 14 1f 5d
5f 61 60 23 09 07 07 83 01 00 00 6a 03 0c 00 10
00 38 78 20 00 00 67 d8 5d c4 01 78 c0 03 68 1a
00 00 01 01 30 92 ed e3 05 c0 00 e6 06 07 01 59
49 37 e3 0f 00 3c 19 76 00 a0 a0 a0 2a 50 30 40
45 00 55 50 21 00 00 1e 6f c2 00 a0 a0 a0 55 50
30 20 35 00 55 50 21 00 00 1e f9 e3 00 a0 a0 a0
32 50 10 40 35 00 55 50 21 00 00 1e 00 00 00 af

00 ff ff ff ff ff ff 00 4d 67 09 24 01 00 00 00
02 22 01 03 80 35 1e 78 af e7 f0 ac 50 48 a7 26
0c 50 54 a7 cf 00 81 c0 81 80 95 00 a9 c0 b3 00
d1 c0 01 01 01 01 5d 5e 00 a0 a0 a0 29 50 30 20
35 00 55 50 21 00 00 1e 02 3a 80 18 71 38 2d 40
58 2c 45 00 55 50 21 00 00 1e 00 00 00 fd 00 30
92 19 fa 3c 00 0a 20 20 20 20 20 20 00 00 00 fc
00 51 32 34 54 30 39 0a 20 20 20 20 20 20 01 45

02 03 46 f3 4e 01 02 03 04 05 10 12 13 14 1f 5d
5f 61 60 23 09 07 07 83 01 00 00 6a 03 0c 00 10
00 38 78 20 00 00 67 d8 5d c4 01 78 c0 03 68 1a
00 00 01 01 30 92 ed e3 05 c0 00 e6 06 07 01 59
49 37 e3 0f 00 3c 19 76 00 a0 a0 a0 2a 50 30 40
45 00 55 50 21 00 00 1e 6f c2 00 a0 a0 a0 55 50
30 20 35 00 55 50 21 00 00 1e f9 e3 00 a0 a0 a0
32 50 10 40 35 00 55 50 21 00 00 1e 00 00 00 af

----------------

Block 0, Base EDID:
  EDID Structure Version & Revision: 1.3
  Vendor & Product Identification:
    Manufacturer: SKG
    Model: 9225
    Serial Number: ...
    Made in: week 2 of 2024
  Basic Display Parameters & Features:
    Digital display
    Maximum image size: 53 cm x 30 cm
    Gamma: 2.20
    DPMS levels: Standby Off
    RGB color display
    Default (sRGB) color space is primary color space
    First detailed timing is the preferred timing
    Supports GTF timings within operating range
  Color Characteristics:
    Red  : 0.6748, 0.3144
    Green: 0.2822, 0.6552
    Blue : 0.1513, 0.0498
    White: 0.3125, 0.3281
  Established Timings I & II:
    IBM     :   720x400    70.081663 Hz   9:5     31.467 kHz     28.320000 MHz
    DMT 0x04:   640x480    59.940476 Hz   4:3     31.469 kHz     25.175000 MHz
    DMT 0x06:   640x480    75.000000 Hz   4:3     37.500 kHz     31.500000 MHz
    DMT 0x08:   800x600    56.250000 Hz   4:3     35.156 kHz     36.000000 MHz
    DMT 0x09:   800x600    60.316541 Hz   4:3     37.879 kHz     40.000000 MHz
    DMT 0x0a:   800x600    72.187572 Hz   4:3     48.077 kHz     50.000000 MHz
    DMT 0x0b:   800x600    75.000000 Hz   4:3     46.875 kHz     49.500000 MHz
    DMT 0x10:  1024x768    60.003840 Hz   4:3     48.363 kHz     65.000000 MHz
    DMT 0x11:  1024x768    70.069359 Hz   4:3     56.476 kHz     75.000000 MHz
    DMT 0x12:  1024x768    75.028582 Hz   4:3     60.023 kHz     78.750000 MHz
    DMT 0x24:  1280x1024   75.024675 Hz   5:4     79.976 kHz    135.000000 MHz
  Standard Timings:
    DMT 0x55:  1280x720    60.000000 Hz  16:9     45.000 kHz     74.250000 MHz
    DMT 0x23:  1280x1024   60.019740 Hz   5:4     63.981 kHz    108.000000 MHz
    DMT 0x2f:  1440x900    59.887445 Hz  16:10    55.935 kHz    106.500000 MHz
    DMT 0x53:  1600x900    60.000000 Hz  16:9     60.000 kHz    108.000000 MHz (RB)
    DMT 0x3a:  1680x1050   59.954250 Hz  16:10    65.290 kHz    146.250000 MHz
    DMT 0x52:  1920x1080   60.000000 Hz  16:9     67.500 kHz    148.500000 MHz
  Detailed Timing Descriptors:
    DTD 1:  2560x1440   59.967927 Hz  16:9     88.812 kHz    241.570000 MHz (597 mm x 336 mm)
                 Hfront   48 Hsync  32 Hback   80 Hpol P
                 Vfront    3 Vsync   5 Vback   33 Vpol P
    DTD 2:  1920x1080   60.000000 Hz  16:9     67.500 kHz    148.500000 MHz (597 mm x 336 mm)
                 Hfront   88 Hsync  44 Hback  148 Hpol P
                 Vfront    4 Vsync   5 Vback   36 Vpol P
    Display Range Limits:
      Monitor ranges (GTF): 48-146 Hz V, 25-250 kHz H, max dotclock 600 MHz
    Display Product Name: 'Q24T09'
  Extension blocks: 1
Checksum: 0x45

----------------

Block 1, CTA-861 Extension Block:
  Revision: 3
  Underscans IT Video Formats by default
  Basic audio support
  Supports YCbCr 4:4:4
  Supports YCbCr 4:2:2
  Native DTDs: 3
  Video Data Block:
    VIC   1:   640x480    59.940476 Hz   4:3     31.469 kHz     25.175000 MHz
    VIC   2:   720x480    59.940060 Hz   4:3     31.469 kHz     27.000000 MHz
    VIC   3:   720x480    59.940060 Hz  16:9     31.469 kHz     27.000000 MHz
    VIC   4:  1280x720    60.000000 Hz  16:9     45.000 kHz     74.250000 MHz
    VIC   5:  1920x1080i  60.000000 Hz  16:9     33.750 kHz     74.250000 MHz
    VIC  16:  1920x1080   60.000000 Hz  16:9     67.500 kHz    148.500000 MHz
    VIC  18:   720x576    50.000000 Hz  16:9     31.250 kHz     27.000000 MHz
    VIC  19:  1280x720    50.000000 Hz  16:9     37.500 kHz     74.250000 MHz
    VIC  20:  1920x1080i  50.000000 Hz  16:9     28.125 kHz     74.250000 MHz
    VIC  31:  1920x1080   50.000000 Hz  16:9     56.250 kHz    148.500000 MHz
    VIC  93:  3840x2160   24.000000 Hz  16:9     54.000 kHz    297.000000 MHz
    VIC  95:  3840x2160   30.000000 Hz  16:9     67.500 kHz    297.000000 MHz
    VIC  97:  3840x2160   60.000000 Hz  16:9    135.000 kHz    594.000000 MHz
    VIC  96:  3840x2160   50.000000 Hz  16:9    112.500 kHz    594.000000 MHz
  Audio Data Block:
    Linear PCM:
      Max channels: 2
      Supported sample rates (kHz): 48 44.1 32
      Supported sample sizes (bits): 24 20 16
  Speaker Allocation Data Block:
    FL/FR - Front Left/Right
  Vendor-Specific Data Block (HDMI), OUI 00-0C-03:
    Source physical address: 1.0.0.0
    DC_36bit
    DC_30bit
    DC_Y444
    Maximum TMDS clock: 600 MHz
    Extended HDMI video details:
  Vendor-Specific Data Block (HDMI Forum), OUI C4-5D-D8:
    Version: 1
    Maximum TMDS Character Rate: 600 MHz
    SCDC Present
    SCDC Read Request Capable
    Supports 12-bits/component Deep Color 4:2:0 Pixel Encoding
    Supports 10-bits/component Deep Color 4:2:0 Pixel Encoding
  Vendor-Specific Data Block (AMD), OUI 00-00-1A:
    Version: 1
    Feature Caps: 0x01
    Minimum Refresh Rate: 48 Hz
    Maximum Refresh Rate: 146 Hz
    Flags 1.x: 0xed (MCCS)
  Colorimetry Data Block:
    BT2020YCC
    BT2020RGB
  HDR Static Metadata Data Block:
    Electro optical transfer functions:
      Traditional gamma - SDR luminance range
      Traditional gamma - HDR luminance range
      SMPTE ST2084
    Supported static metadata descriptors:
      Static metadata type 1
    Desired content max luminance: 89 (343.724 cd/m^2)
    Desired content max frame-average luminance: 73 (243.049 cd/m^2)
    Desired content min luminance: 55 (0.160 cd/m^2)
  YCbCr 4:2:0 Capability Map Data Block:
    VIC  93:  3840x2160   24.000000 Hz  16:9     54.000 kHz    297.000000 MHz
    VIC  95:  3840x2160   30.000000 Hz  16:9     67.500 kHz    297.000000 MHz
    VIC  97:  3840x2160   60.000000 Hz  16:9    135.000 kHz    594.000000 MHz
    VIC  96:  3840x2160   50.000000 Hz  16:9    112.500 kHz    594.000000 MHz
  Detailed Timing Descriptors:
    DTD 3:  2560x1440   75.000496 Hz  16:9    111.151 kHz    302.330000 MHz (597 mm x 336 mm)
                 Hfront   48 Hsync  64 Hback   48 Hpol P
                 Vfront    4 Vsync   5 Vback   33 Vpol P
    DTD 4:  2560x1440  119.997589 Hz  16:9    182.996 kHz    497.750000 MHz (597 mm x 336 mm)
                 Hfront   48 Hsync  32 Hback   80 Hpol P
                 Vfront    3 Vsync   5 Vback   77 Vpol P
    DTD 5:  2560x1440  144.001678 Hz  16:9    214.562 kHz    583.610000 MHz (597 mm x 336 mm)
                 Hfront   16 Hsync  64 Hback   80 Hpol P
                 Vfront    3 Vsync   5 Vback   42 Vpol P
Checksum: 0xaf  Unused space in Extension Block: 3 bytes

----------------

Warnings:

Block 0, Base EDID:
  Vendor & Product Identification: The serial number is one of the known dummy values, it should probably be set to 0.
Block 1, CTA-861 Extension Block:
  Video Data Block: VIC 1 and the first DTD are not identical. Is this intended?
  YCbCr 4:2:0 Capability Map Data Block: Some YCbCr 4:2:0 timings are invalid for HDMI 2.1 (which requires an RGB timings pixel rate >= 590 MHz).
EDID:
  Base EDID: Some timings are out of range of the Monitor Ranges:
    Vertical Freq: 24.000 - 144.002 Hz (Monitor: 48.000 - 146.000 Hz)

Failures:

Block 0, Base EDID:
  Basic Display Parameters & Features: sRGB is signaled, but the chromaticities do not match.
  Detailed Timing Descriptor #1: Mismatch of image size 597x336 mm vs display size 530x300 mm.
  Detailed Timing Descriptor #2: Mismatch of image size 597x336 mm vs display size 530x300 mm.
Block 1, CTA-861 Extension Block:
  Vendor-Specific Data Block (HDMI), OUI 00-0C-03: HDMI VSDB Max TMDS rate is > 340.
  Detailed Timing Descriptor #3: Mismatch of image size 597x336 mm vs display size 530x300 mm.
  Detailed Timing Descriptor #4: Mismatch of image size 597x336 mm vs display size 530x300 mm.
  Detailed Timing Descriptor #5: Mismatch of image size 597x336 mm vs display size 530x300 mm.
  Missing VCDB, needed for Set Selectable RGB Quantization to avoid interop issues.
EDID:
  Extension Block 2 started with EDID header, ignoring Extension Blocks >= 2.
  Base EDID: The DTD max image size is 597x336mm, which is larger than the display size 530.0x300.0mm.
  CTA-861: Native progressive timings are a mix of several resolutions.

EDID conformity: FAIL
