edid-decode (hex):

00 ff ff ff ff ff ff 00 4d 67 09 24 00 00 00 00
1a 22 01 04 b5 35 1e 78 2b 5d d0 a8 53 47 ab 21
05 50 54 af cf 00 71 4f 81 80 81 00 81 c0 a9 c0
95 00 b3 00 d1 fc 02 3a 80 18 71 38 2d 40 30 20
35 00 58 4a 21 00 00 1a 00 00 00 fd 00 30 b4 df
df 28 01 0a 20 20 20 20 20 20 00 00 00 ff 00 30
30 30 30 30 30 30 30 30 30 30 30 0a 00 00 00 fc
00 41 46 32 34 48 31 0a 20 20 20 20 20 20 01 82

02 03 42 f1 4b 01 02 03 04 04 0e 13 28 4d 10 3f
23 09 87 07 83 01 00 00 65 03 0c 00 10 00 6d 1a
00 00 02 01 30 b4 00 00 00 00 00 00 e2 00 c0 e3
05 e3 01 e6 06 07 00 62 62 2f 67 d8 5d c4 01 78
c0 00 14 95 80 a0 70 38 20 40 17 20 35 00 58 4a
21 00 00 1a 9a 80 80 88 70 38 20 40 17 20 35 00
58 4a 21 00 00 1e a1 a2 80 a0 70 38 20 40 17 20
35 00 58 2c 21 00 00 7f 00 00 00 00 00 00 00 e1

00 ff ff ff ff ff ff 00 4d 67 09 24 00 00 00 00
1a 22 01 04 b5 35 1e 78 2b 5d d0 a8 53 47 ab 21
05 50 54 af cf 00 71 4f 81 80 81 00 81 c0 a9 c0
95 00 b3 00 d1 fc 02 3a 80 18 71 38 2d 40 30 20
35 00 58 4a 21 00 00 1a 00 00 00 fd 00 30 b4 df
df 28 01 0a 20 20 20 20 20 20 00 00 00 ff 00 30
30 30 30 30 30 30 30 30 30 30 30 0a 00 00 00 fc
00 41 46 32 34 48 31 0a 20 20 20 20 20 20 01 82

02 03 42 f1 4b 01 02 03 04 04 0e 13 28 4d 10 3f
23 09 87 07 83 01 00 00 65 03 0c 00 10 00 6d 1a
00 00 02 01 30 b4 00 00 00 00 00 00 e2 00 c0 e3
05 e3 01 e6 06 07 00 62 62 2f 67 d8 5d c4 01 78
c0 00 14 95 80 a0 70 38 20 40 17 20 35 00 58 4a
21 00 00 1a 9a 80 80 88 70 38 20 40 17 20 35 00
58 4a 21 00 00 1e a1 a2 80 a0 70 38 20 40 17 20
35 00 58 2c 21 00 00 7f 00 00 00 00 00 00 00 e1

----------------

Block 0, Base EDID:
  EDID Structure Version & Revision: 1.4
  Vendor & Product Identification:
    Manufacturer: SKG
    Model: 9225
    Made in: week 26 of 2024
  Basic Display Parameters & Features:
    Digital display
    Bits per primary color channel: 10
    DisplayPort interface
    Maximum image size: 53 cm x 30 cm
    Gamma: 2.20
    DPMS levels: Off
    Supported color formats: RGB 4:4:4, YCrCb 4:4:4
    First detailed timing includes the native pixel format and preferred refresh rate
    Display supports continuous frequencies
  Color Characteristics:
    Red  : 0.6572, 0.3251
    Green: 0.2802, 0.6689
    Blue : 0.1318, 0.0205
    White: 0.3125, 0.3281
  Established Timings I & II:
    IBM     :   720x400    70.081663 Hz   9:5     31.467 kHz     28.320000 MHz
    DMT 0x04:   640x480    59.940476 Hz   4:3     31.469 kHz     25.175000 MHz
    DMT 0x05:   640x480    72.808802 Hz   4:3     37.861 kHz     31.500000 MHz
    DMT 0x06:   640x480    75.000000 Hz   4:3     37.500 kHz     31.500000 MHz
    DMT 0x08:   800x600    56.250000 Hz   4:3     35.156 kHz     36.000000 MHz
    DMT 0x09:   800x600    60.316541 Hz   4:3     37.879 kHz     40.000000 MHz
    DMT 0x0a:   800x600    72.187572 Hz   4:3     48.077 kHz     50.000000 MHz
    DMT 0x0b:   800x600    75.000000 Hz   4:3     46.875 kHz     49.500000 MHz
    DMT 0x10:  1024x768    60.003840 Hz   4:3     48.363 kHz     65.000000 MHz
    DMT 0x11:  1024x768    70.069359 Hz   4:3     56.476 kHz     75.000000 MHz
    DMT 0x12:  1024x768    75.028582 Hz   4:3     60.023 kHz     78.750000 MHz
    DMT 0x24:  1280x1024   75.024675 Hz   5:4     79.976 kHz    135.000000 MHz
  Standard Timings:
    DMT 0x15:  1152x864    75.000000 Hz   4:3     67.500 kHz    108.000000 MHz
    DMT 0x23:  1280x1024   60.019740 Hz   5:4     63.981 kHz    108.000000 MHz
    DMT 0x1c:  1280x800    59.810326 Hz  16:10    49.702 kHz     83.500000 MHz
    DMT 0x55:  1280x720    60.000000 Hz  16:9     45.000 kHz     74.250000 MHz
    DMT 0x53:  1600x900    60.000000 Hz  16:9     60.000 kHz    108.000000 MHz (RB)
    DMT 0x2f:  1440x900    59.887445 Hz  16:10    55.935 kHz    106.500000 MHz
    DMT 0x3a:  1680x1050   59.954250 Hz  16:10    65.290 kHz    146.250000 MHz
    GTF     :  1920x1080  119.999987 Hz  16:9    138.840 kHz    368.759000 MHz
  Detailed Timing Descriptors:
    DTD 1:  1920x1080   60.000000 Hz  16:9     67.500 kHz    148.500000 MHz (600 mm x 330 mm)
                 Hfront   48 Hsync  32 Hback  200 Hpol P
                 Vfront    3 Vsync   5 Vback   37 Vpol N
    Display Range Limits:
      Monitor ranges (Range Limits Only): 48-180 Hz V, 223-223 kHz H, max dotclock 400 MHz
    Display Product Serial Number: ...
    Display Product Name: 'AF24H1'
  Extension blocks: 1
Checksum: 0x82

----------------

Block 1, CTA-861 Extension Block:
  Revision: 3
  Underscans IT Video Formats by default
  Basic audio support
  Supports YCbCr 4:4:4
  Supports YCbCr 4:2:2
  Native DTDs: 1
  Video Data Block:
    VIC   1:   640x480    59.940476 Hz   4:3     31.469 kHz     25.175000 MHz
    VIC   2:   720x480    59.940060 Hz   4:3     31.469 kHz     27.000000 MHz
    VIC   3:   720x480    59.940060 Hz  16:9     31.469 kHz     27.000000 MHz
    VIC   4:  1280x720    60.000000 Hz  16:9     45.000 kHz     74.250000 MHz
    VIC   4:  1280x720    60.000000 Hz  16:9     45.000 kHz     74.250000 MHz
    VIC  14:  1440x480    59.940060 Hz   4:3     31.469 kHz     54.000000 MHz
    VIC  19:  1280x720    50.000000 Hz  16:9     37.500 kHz     74.250000 MHz
    VIC  40:  1920x1080i 100.000000 Hz  16:9     56.250 kHz    148.500000 MHz
    VIC  77:  1920x1080  100.000000 Hz  64:27   112.500 kHz    297.000000 MHz
    VIC  16:  1920x1080   60.000000 Hz  16:9     67.500 kHz    148.500000 MHz
    VIC  63:  1920x1080  120.000000 Hz  16:9    135.000 kHz    297.000000 MHz
  Audio Data Block:
    Linear PCM:
      Max channels: 2
      Supported sample rates (kHz): 48 44.1 32
      Supported sample sizes (bits): 24 20 16
  Speaker Allocation Data Block:
    FL/FR - Front Left/Right
  Vendor-Specific Data Block (HDMI), OUI 00-0C-03:
    Source physical address: 1.0.0.0
  Vendor-Specific Data Block (AMD), OUI 00-00-1A:
    Version: 2
    Flags 1: 0x01
      FreeSync Supported
    Minimum Refresh Rate: 48 Hz
    Maximum Refresh Rate: 180 Hz
    Flags 5: 0x00
  Video Capability Data Block:
    YCbCr quantization: Selectable (via AVI YQ)
    RGB quantization: Selectable (via AVI Q)
    PT scan behavior: No Data
    IT scan behavior: IT video formats not supported
    CE scan behavior: CE video formats not supported
  Colorimetry Data Block:
    xvYCC601
    xvYCC709
    BT2020cYCC
    BT2020YCC
    BT2020RGB
    Gamut Boundary Description Metadata Profile P0
  HDR Static Metadata Data Block:
    Electro optical transfer functions:
      Traditional gamma - SDR luminance range
      Traditional gamma - HDR luminance range
      SMPTE ST2084
    Supported static metadata descriptors:
    Desired content max luminance: 98 (417.710 cd/m^2)
    Desired content max frame-average luminance: 98 (417.710 cd/m^2)
    Desired content min luminance: 47 (0.142 cd/m^2)
  Vendor-Specific Data Block (HDMI Forum), OUI C4-5D-D8:
    Version: 1
    Maximum TMDS Character Rate: 600 MHz
    SCDC Present
    SCDC Read Request Capable
  Detailed Timing Descriptors:
    DTD 2:  1920x1080  165.000692 Hz  16:9    183.481 kHz    381.640000 MHz (600 mm x 330 mm)
                 Hfront   23 Hsync  32 Hback  105 Hpol P
                 Vfront    3 Vsync   5 Vback   24 Vpol N
    DTD 3:  1920x1080  143.998614 Hz  16:9    160.126 kHz    329.220000 MHz (600 mm x 330 mm)
                 Hfront   23 Hsync  32 Hback   81 Hpol P
                 Vfront    3 Vsync   5 Vback   24 Vpol P
    DTD 4:  1920x1080  179.998789 Hz  16:9    200.159 kHz    416.330000 MHz (side by side interleaved, 600 mm x 300 mm)
                 Hfront   23 Hsync  32 Hback  105 Hpol P
                 Vfront    3 Vsync   5 Vback   24 Vpol P
Checksum: 0xe1  Unused space in Extension Block: 7 bytes

----------------

Warnings:

Block 0, Base EDID:
  Detailed Timing Descriptor #1: DTD is similar but not identical to VIC 16.
  Display Product Serial Number: ...
Block 1, CTA-861 Extension Block:
  Video Data Block: VIC 1 and the first DTD are not identical. Is this intended?
  Video Capability Data Block: IT scan behavior is expected to support underscanned.
  Video Capability Data Block: 'CE video formats not supported' makes no sense.
  Colorimetry Data Block: Set the sRGB colorimetry bit to avoid interop issues.
  Detailed Timing Descriptor #4: Image size is 600x300 mm, but based on the picture AR it should be 533x300 mm.
EDID:
  Base EDID: Some timings are out of range of the Monitor Ranges:
    Horizontal Freq: 31.466 - 200.158 kHz (Monitor: 223.000 - 223.000 kHz)
    Maximum Clock: 416.330 MHz (Monitor: 400.000 MHz)

Failures:

Block 0, Base EDID:
  Detailed Timing Descriptor #1: Mismatch of image size 600x330 mm vs display size 530x300 mm.
Block 1, CTA-861 Extension Block:
  Video Data Block: Duplicate VIC 4.
  Audio Data Block: Bit F27 must be 0.
  Vendor-Specific Data Block (HDMI), OUI 00-0C-03: The HDMI Specification requires EDID 1.3 instead of 1.4.
  Vendor-Specific Data Block (HDMI Forum), OUI C4-5D-D8: HDMI Forum VSDB did not immediately follow the HDMI VSDB.
  Detailed Timing Descriptor #2: Mismatch of image size 600x330 mm vs display size 530x300 mm.
  Detailed Timing Descriptor #3: Mismatch of image size 600x330 mm vs display size 530x300 mm.
  Detailed Timing Descriptor #4: Mismatch of image size 600x300 mm vs display size 530x300 mm.
EDID:
  Extension Block 2 started with EDID header, ignoring Extension Blocks >= 2.
  Base EDID: The DTD max image size is 600x330mm, which is larger than the display size 530.0x300.0mm.

EDID conformity: FAIL
