edid-decode (hex):

00 ff ff ff ff ff ff 00 30 ae b0 40 00 00 00 00
01 1a 01 04 95 22 13 78 ea f1 00 94 5c 58 92 29
21 50 54 00 00 00 01 01 01 01 01 01 01 01 01 01
01 01 01 01 01 01 ce 1d 56 e2 50 00 1e 30 30 20
36 00 58 c2 10 00 00 1a ce 1d 56 59 52 00 28 30
30 20 36 00 58 c2 10 00 00 1a 00 00 00 0f 00 8c
09 30 8c 09 30 16 09 00 09 e5 04 07 00 00 00 fe
00 4e 54 31 35 36 57 48 4d 2d 4e 34 35 0a 00 c3

00 ff ff ff ff ff ff 00 30 ae b0 40 00 00 00 00
01 1a 01 04 95 22 13 78 ea f1 00 94 5c 58 92 29
21 50 54 00 00 00 01 01 01 01 01 01 01 01 01 01
01 01 01 01 01 01 ce 1d 56 e2 50 00 1e 30 30 20
36 00 58 c2 10 00 00 1a ce 1d 56 59 52 00 28 30
30 20 36 00 58 c2 10 00 00 1a 00 00 00 0f 00 8c
09 30 8c 09 30 16 09 00 09 e5 04 07 00 00 00 fe
00 4e 54 31 35 36 57 48 4d 2d 4e 34 35 0a 00 c3

----------------

Block 0, Base EDID:
  EDID Structure Version & Revision: 1.4
  Vendor & Product Identification:
    Manufacturer: LEN
    Model: 16560
    Made in: week 1 of 2016
  Basic Display Parameters & Features:
    Digital display
    Bits per primary color channel: 6
    DisplayPort interface
    Maximum image size: 34 cm x 19 cm
    Gamma: 2.20
    DPMS levels: Standby Suspend Off
    Supported color formats: RGB 4:4:4, YCrCb 4:4:4
    First detailed timing includes the native pixel format and preferred refresh rate
  Color Characteristics:
    Red  : 0.5810, 0.3623
    Green: 0.3437, 0.5712
    Blue : 0.1601, 0.1289
    White: 0.3125, 0.3281
  Established Timings I & II: none
  Standard Timings: none
  Detailed Timing Descriptors:
    DTD 1:  1366x768    60.059067 Hz 683:384   47.927 kHz     76.300000 MHz (344 mm x 194 mm)
                 Hfront   48 Hsync  32 Hback  146 Hpol P
                 Vfront    3 Vsync   6 Vback   21 Vpol N
    DTD 2:  1366x768    48.007470 Hz 683:384   38.790 kHz     76.300000 MHz (344 mm x 194 mm)
                 Hfront   48 Hsync  32 Hback  521 Hpol P
                 Vfront    3 Vsync   6 Vback   31 Vpol N
    Manufacturer-Specified Display Descriptor (0x0f): 00 0f 00 8c 09 30 8c 09 30 16 09 00 09 e5 04 07 '.....0..0.......'
    Alphanumeric Data String: 'NT156WHM-N45'
Checksum: 0xc3

----------------

Warnings:

Block 0, Base EDID:
  Missing Display Product Name.

Failures:

EDID:
  Extension Block 1 started with EDID header, ignoring Extension Blocks >= 1.

EDID conformity: FAIL
