edid-decode (hex):

00 ff ff ff ff ff ff 00 30 ae b0 40 00 00 00 00
0a 13 01 03 80 23 13 78 ea 7b 95 9c 57 57 94 29
15 50 54 00 00 00 01 01 01 01 01 01 01 01 01 01
01 01 01 01 01 01 19 1c 56 8e 50 00 1b 30 17 30
39 00 58 c1 10 00 00 18 d9 16 56 80 50 00 0f 30
26 1a 24 00 58 c1 10 00 00 18 00 00 00 0f 00 8c
09 32 8c 09 28 16 09 00 0d af 50 14 00 00 00 fe
00 4e 31 35 36 42 36 2d 4c 30 38 0a 20 20 00 54

00 ff ff ff ff ff ff 00 30 ae b0 40 00 00 00 00
0a 13 01 03 80 23 13 78 ea 7b 95 9c 57 57 94 29
15 50 54 00 00 00 01 01 01 01 01 01 01 01 01 01
01 01 01 01 01 01 19 1c 56 8e 50 00 1b 30 17 30
39 00 58 c1 10 00 00 18 d9 16 56 80 50 00 0f 30
26 1a 24 00 58 c1 10 00 00 18 00 00 00 0f 00 8c
09 32 8c 09 28 16 09 00 0d af 50 14 00 00 00 fe
00 4e 31 35 36 42 36 2d 4c 30 38 0a 20 20 00 54

----------------

Block 0, Base EDID:
  EDID Structure Version & Revision: 1.3
  Vendor & Product Identification:
    Manufacturer: LEN
    Model: 16560
    Made in: week 10 of 2009
  Basic Display Parameters & Features:
    Digital display
    Maximum image size: 35 cm x 19 cm
    Gamma: 2.20
    DPMS levels: Standby Suspend Off
    RGB color display
    First detailed timing is the preferred timing
  Color Characteristics:
    Red  : 0.6103, 0.3427
    Green: 0.3417, 0.5810
    Blue : 0.1621, 0.0830
    White: 0.3134, 0.3291
  Established Timings I & II: none
  Standard Timings: none
  Detailed Timing Descriptors:
    DTD 1:  1366x768    59.998665 Hz 683:384   47.699 kHz     71.930000 MHz (344 mm x 193 mm)
                 Hfront   23 Hsync  48 Hback   71 Hpol N
                 Vfront    3 Vsync   9 Vback   15 Vpol N
    DTD 2:  1366x768    49.999915 Hz 683:384   39.150 kHz     58.490000 MHz (344 mm x 193 mm)
                 Hfront   38 Hsync  26 Hback   64 Hpol N
                 Vfront    2 Vsync   4 Vback    9 Vpol N
    Manufacturer-Specified Display Descriptor (0x0f): 00 0f 00 8c 09 32 8c 09 28 16 09 00 0d af 50 14 '.....2..(.....P.'
    Alphanumeric Data String: 'N156B6-L08'
Checksum: 0x54

----------------

Failures:

Block 0, Base EDID:
  Missing Display Product Name.
  Missing Display Range Limits Descriptor.
EDID:
  Extension Block 1 started with EDID header, ignoring Extension Blocks >= 1.

EDID conformity: FAIL
