edid-decode (hex):

00 ff ff ff ff ff ff 00 41 0c 08 e0 ab ec 0a 00
05 0b 01 02 68 24 1b b0 e8 00 b8 a0 57 49 9b 26
10 48 4c ad ef 80 31 59 45 59 61 59 81 99 a9 4a
d1 40 01 01 01 01 86 3d 00 c0 51 00 30 40 40 a0
13 00 68 0e 11 00 00 1e 00 00 00 ff 00 20 54 59
20 20 37 31 35 39 34 37 0a 20 00 00 00 fc 00 50
48 49 4c 49 50 53 20 31 30 39 53 32 00 00 00 fd
00 32 a0 1e 5c ff 00 0a 20 20 20 20 20 20 00 a8

00 ff ff ff ff ff ff 00 41 0c 08 e0 ab ec 0a 00
05 0b 01 02 68 24 1b b0 e8 00 b8 a0 57 49 9b 26
10 48 4c ad ef 80 31 59 45 59 61 59 81 99 a9 4a
d1 40 01 01 01 01 86 3d 00 c0 51 00 30 40 40 a0
13 00 68 0e 11 00 00 1e 00 00 00 ff 00 20 54 59
20 20 37 31 35 39 34 37 0a 20 00 00 00 fc 00 50
48 49 4c 49 50 53 20 31 30 39 53 32 00 00 00 fd
00 32 a0 1e 5c ff 00 0a 20 20 20 20 20 20 00 a8

----------------

Block 0, Base EDID:
  EDID Structure Version & Revision: 1.2
  Vendor & Product Identification:
    Manufacturer: PHL
    Model: 57352
    Serial Number: ...
    Made in: week 5 of 2001
  Basic Display Parameters & Features:
    Analog display
    Signal Level Standard: 0.700 : 0.000 : 0.700 V p-p
    Blank level equals black level
    Sync: Separate
    Maximum image size: 36 cm x 27 cm
    Gamma: 2.76
    DPMS levels: Standby Suspend Off
    RGB color display
  Color Characteristics:
    Red  : 0.6250, 0.3398
    Green: 0.2851, 0.6054
    Blue : 0.1503, 0.0654
    White: 0.2832, 0.2968
  Established Timings I & II:
    IBM     :   720x400    70.081663 Hz   9:5     31.467 kHz     28.320000 MHz
    DMT 0x04:   640x480    59.940476 Hz   4:3     31.469 kHz     25.175000 MHz
    DMT 0x05:   640x480    72.808802 Hz   4:3     37.861 kHz     31.500000 MHz
    DMT 0x06:   640x480    75.000000 Hz   4:3     37.500 kHz     31.500000 MHz
    DMT 0x09:   800x600    60.316541 Hz   4:3     37.879 kHz     40.000000 MHz
    DMT 0x0a:   800x600    72.187572 Hz   4:3     48.077 kHz     50.000000 MHz
    DMT 0x0b:   800x600    75.000000 Hz   4:3     46.875 kHz     49.500000 MHz
    Apple   :   832x624    74.551266 Hz   4:3     49.726 kHz     57.284000 MHz
    DMT 0x10:  1024x768    60.003840 Hz   4:3     48.363 kHz     65.000000 MHz
    DMT 0x11:  1024x768    70.069359 Hz   4:3     56.476 kHz     75.000000 MHz
    DMT 0x12:  1024x768    75.028582 Hz   4:3     60.023 kHz     78.750000 MHz
    DMT 0x24:  1280x1024   75.024675 Hz   5:4     79.976 kHz    135.000000 MHz
    Apple   :  1152x870    75.061550 Hz 192:145   68.681 kHz    100.000000 MHz
  Standard Timings:
    DMT 0x07:   640x480    85.008312 Hz   4:3     43.269 kHz     36.000000 MHz
    DMT 0x0c:   800x600    85.061274 Hz   4:3     53.674 kHz     56.250000 MHz
    DMT 0x13:  1024x768    84.996690 Hz   4:3     68.677 kHz     94.500000 MHz
    DMT 0x25:  1280x1024   85.024098 Hz   5:4     91.146 kHz    157.500000 MHz
    DMT 0x35:  1600x1200   70.000000 Hz   4:3     87.500 kHz    189.000000 MHz
    DMT 0x49:  1920x1440   60.000000 Hz   4:3     90.000 kHz    234.000000 MHz
  Detailed Timing Descriptors:
    DTD 1:  1280x1024   85.024098 Hz   5:4     91.146 kHz    157.500000 MHz (360 mm x 270 mm)
                 Hfront   64 Hsync 160 Hback  224 Hpol P
                 Vfront    1 Vsync   3 Vback   44 Vpol P
    Display Product Serial Number: ...
    Display Product Name: 'PHILIPS 109S2'
    Display Range Limits:
      Monitor ranges (GTF): 50-160 Hz V, 30-92 kHz H, max dotclock 2550 MHz
Checksum: 0xa8

----------------

Warnings:

Block 0, Base EDID:
  EDID Structure Version & Revision: EDID 1.2 is deprecated, do not use.
  Detailed Timing Descriptor #1: Image size is 360x270 mm, but based on the picture AR it should be 337x270 mm.

Failures:

EDID:
  Extension Block 1 started with EDID header, ignoring Extension Blocks >= 1.

EDID conformity: FAIL
