edid-decode (hex):

00 ff ff ff ff ff ff 00 49 33 09 07 d2 02 96 49
24 17 01 03 08 29 17 78 ea 72 b4 a6 55 48 9d 25
15 50 54 a5 4a 00 01 01 01 01 01 01 01 01 01 01
01 01 01 01 01 01 66 21 56 aa 51 00 1e 30 46 8f
33 00 9a e6 10 00 00 1e 00 00 00 fc 00 50 52 4f
31 39 31 33 57 45 2d 44 0a 20 00 00 00 fd 00 38
4b 1e 50 09 00 0a 20 20 20 20 20 20 00 00 00 ff
00 33 35 30 31 31 33 33 36 30 30 31 30 36 00 e0

00 ff ff ff ff ff ff 00 49 33 09 07 d2 02 96 49
24 17 01 03 08 29 17 78 ea 72 b4 a6 55 48 9d 25
15 50 54 a5 4a 00 01 01 01 01 01 01 01 01 01 01
01 01 01 01 01 01 66 21 56 aa 51 00 1e 30 46 8f
33 00 9a e6 10 00 00 1e 00 00 00 fc 00 50 52 4f
31 39 31 33 57 45 2d 44 0a 20 00 00 00 fd 00 38
4b 1e 50 09 00 0a 20 20 20 20 20 20 00 00 00 ff
00 33 35 30 31 31 33 33 36 30 30 31 30 36 00 e0

----------------

Block 0, Base EDID:
  EDID Structure Version & Revision: 1.3
  Vendor & Product Identification:
    Manufacturer: RIS
    Model: 1801
    Serial Number: ...
    Made in: week 36 of 2013
  Basic Display Parameters & Features:
    Analog display
    Signal Level Standard: 0.700 : 0.300 : 1.000 V p-p
    Blank level equals black level
    Sync: Separate
    Maximum image size: 41 cm x 23 cm
    Gamma: 2.20
    DPMS levels: Standby Suspend Off
    RGB color display
    First detailed timing is the preferred timing
  Color Characteristics:
    Red  : 0.6494, 0.3349
    Green: 0.2812, 0.6152
    Blue : 0.1464, 0.0849
    White: 0.3134, 0.3281
  Established Timings I & II:
    IBM     :   720x400    70.081663 Hz   9:5     31.467 kHz     28.320000 MHz
    DMT 0x04:   640x480    59.940476 Hz   4:3     31.469 kHz     25.175000 MHz
    DMT 0x06:   640x480    75.000000 Hz   4:3     37.500 kHz     31.500000 MHz
    DMT 0x09:   800x600    60.316541 Hz   4:3     37.879 kHz     40.000000 MHz
    DMT 0x0b:   800x600    75.000000 Hz   4:3     46.875 kHz     49.500000 MHz
    DMT 0x10:  1024x768    60.003840 Hz   4:3     48.363 kHz     65.000000 MHz
    DMT 0x12:  1024x768    75.028582 Hz   4:3     60.023 kHz     78.750000 MHz
  Standard Timings: none
  Detailed Timing Descriptors:
    DTD 1:  1366x768    59.789541 Hz 683:384   47.712 kHz     85.500000 MHz (410 mm x 230 mm)
                 Hfront   70 Hsync 143 Hback  213 Hpol P
                 Vfront    3 Vsync   3 Vback   24 Vpol P
    Display Product Name: 'PRO1913WE-D'
    Display Range Limits:
      Monitor ranges (GTF): 56-75 Hz V, 30-80 kHz H, max dotclock 90 MHz
    Display Product Serial Number: ...
Checksum: 0xe0

----------------

Failures:

EDID:
  Extension Block 1 started with EDID header, ignoring Extension Blocks >= 1.

EDID conformity: FAIL
