edid-decode (hex):

00 ff ff ff ff ff ff 00 4c ab da 0c 0f 00 00 00
05 17 01 03 08 46 27 78 0a 01 c1 a0 57 47 98 27
12 4c 4c ad ce 00 81 00 81 c0 01 01 01 01 01 01
01 01 01 01 01 01 66 21 50 b0 51 00 1b 30 40 70
36 00 40 84 63 00 00 1e 00 00 00 ff 00 33 32 39
30 4d 39 33 30 35 53 30 30 31 00 00 00 fd 00 39
4e 1e 50 08 00 0a 20 20 20 20 20 20 00 00 00 fc
00 53 43 33 32 48 54 30 34 0a 20 20 20 20 00 ef

00 ff ff ff ff ff ff 00 4c ab da 0c 0f 00 00 00
05 17 01 03 08 46 27 78 0a 01 c1 a0 57 47 98 27
12 4c 4c ad ce 00 81 00 81 c0 01 01 01 01 01 01
01 01 01 01 01 01 66 21 50 b0 51 00 1b 30 40 70
36 00 40 84 63 00 00 1e 00 00 00 ff 00 33 32 39
30 4d 39 33 30 35 53 30 30 31 00 00 00 fd 00 39
4e 1e 50 08 00 0a 20 20 20 20 20 20 00 00 00 fc
00 53 43 33 32 48 54 30 34 0a 20 20 20 20 00 ef

----------------

Block 0, Base EDID:
  EDID Structure Version & Revision: 1.3
  Vendor & Product Identification:
    Manufacturer: SEK
    Model: 3290
    Serial Number: ...
    Made in: week 5 of 2013
  Basic Display Parameters & Features:
    Analog display
    Signal Level Standard: 0.700 : 0.300 : 1.000 V p-p
    Blank level equals black level
    Sync: Separate
    Maximum image size: 70 cm x 39 cm
    Gamma: 2.20
    RGB color display
    First detailed timing is the preferred timing
  Color Characteristics:
    Red  : 0.6250, 0.3398
    Green: 0.2773, 0.5947
    Blue : 0.1552, 0.0703
    White: 0.2968, 0.2978
  Established Timings I & II:
    IBM     :   720x400    70.081663 Hz   9:5     31.467 kHz     28.320000 MHz
    DMT 0x04:   640x480    59.940476 Hz   4:3     31.469 kHz     25.175000 MHz
    DMT 0x05:   640x480    72.808802 Hz   4:3     37.861 kHz     31.500000 MHz
    DMT 0x06:   640x480    75.000000 Hz   4:3     37.500 kHz     31.500000 MHz
    DMT 0x09:   800x600    60.316541 Hz   4:3     37.879 kHz     40.000000 MHz
    DMT 0x0a:   800x600    72.187572 Hz   4:3     48.077 kHz     50.000000 MHz
    DMT 0x0b:   800x600    75.000000 Hz   4:3     46.875 kHz     49.500000 MHz
    DMT 0x10:  1024x768    60.003840 Hz   4:3     48.363 kHz     65.000000 MHz
    DMT 0x11:  1024x768    70.069359 Hz   4:3     56.476 kHz     75.000000 MHz
    DMT 0x12:  1024x768    75.028582 Hz   4:3     60.023 kHz     78.750000 MHz
  Standard Timings:
    DMT 0x1c:  1280x800    59.810326 Hz  16:10    49.702 kHz     83.500000 MHz
    DMT 0x55:  1280x720    60.000000 Hz  16:9     45.000 kHz     74.250000 MHz
  Detailed Timing Descriptors:
    DTD 1:  1360x768    60.015162 Hz  85:48    47.712 kHz     85.500000 MHz (1600 mm x 900 mm)
                 Hfront   64 Hsync 112 Hback  256 Hpol P
                 Vfront    3 Vsync   6 Vback   18 Vpol P
    Display Product Serial Number: ...
    Display Range Limits:
      Monitor ranges (GTF): 57-78 Hz V, 30-80 kHz H, max dotclock 80 MHz
    Display Product Name: 'SC32HT04'
Checksum: 0xef

----------------

Warnings:

EDID:
  Base EDID: Some timings are out of range of the Monitor Ranges:
    Maximum Clock: 85.500 MHz (Monitor: 80.000 MHz)
    Could be due to a Monitor Range off-by-one rounding issue

Failures:

Block 0, Base EDID:
  Detailed Timing Descriptor #1: Mismatch of image size 1600x900 mm vs display size 700x390 mm.
EDID:
  Extension Block 1 started with EDID header, ignoring Extension Blocks >= 1.
  Base EDID: The DTD max image size is 1600x900mm, which is larger than the display size 700.0x390.0mm.

EDID conformity: FAIL
