edid-decode (hex):

00 ff ff ff ff ff ff 00 22 f0 72 0a 01 01 01 01
1d 14 01 03 80 29 1f 78 ee a6 a5 a3 57 4a 9d 25
12 50 54 a5 2b 80 31 59 45 59 61 59 81 40 81 80
81 99 a9 40 01 01 48 3f 40 30 62 b0 32 40 40 c0
13 00 98 32 11 00 00 1e 00 00 00 fd 00 30 55 1e
5c 11 00 0a 20 20 20 20 20 20 00 00 00 fc 00 48
50 20 4c 50 32 30 36 35 0a 20 20 20 00 00 00 ff
00 43 4e 47 30 32 39 30 33 31 58 0a 20 20 00 84

00 ff ff ff ff ff ff 00 22 f0 72 0a 01 01 01 01
1d 14 01 03 80 29 1f 78 ee a6 a5 a3 57 4a 9d 25
12 50 54 a5 2b 80 31 59 45 59 61 59 81 40 81 80
81 99 a9 40 01 01 48 3f 40 30 62 b0 32 40 40 c0
13 00 98 32 11 00 00 1e 00 00 00 fd 00 30 55 1e
5c 11 00 0a 20 20 20 20 20 20 00 00 00 fc 00 48
50 20 4c 50 32 30 36 35 0a 20 20 20 00 00 00 ff
00 43 4e 47 30 32 39 30 33 31 58 0a 20 20 00 84

----------------

Block 0, Base EDID:
  EDID Structure Version & Revision: 1.3
  Vendor & Product Identification:
    Manufacturer: HWP
    Model: 2674
    Serial Number: ...
    Made in: week 29 of 2010
  Basic Display Parameters & Features:
    Digital display
    Maximum image size: 41 cm x 31 cm
    Gamma: 2.20
    DPMS levels: Standby Suspend Off
    RGB color display
    Default (sRGB) color space is primary color space
    First detailed timing is the preferred timing
  Color Characteristics:
    Red  : 0.6386, 0.3417
    Green: 0.2900, 0.6152
    Blue : 0.1464, 0.0722
    White: 0.3134, 0.3291
  Established Timings I & II:
    IBM     :   720x400    70.081663 Hz   9:5     31.467 kHz     28.320000 MHz
    DMT 0x04:   640x480    59.940476 Hz   4:3     31.469 kHz     25.175000 MHz
    DMT 0x06:   640x480    75.000000 Hz   4:3     37.500 kHz     31.500000 MHz
    DMT 0x09:   800x600    60.316541 Hz   4:3     37.879 kHz     40.000000 MHz
    Apple   :   832x624    74.551266 Hz   4:3     49.726 kHz     57.284000 MHz
    DMT 0x10:  1024x768    60.003840 Hz   4:3     48.363 kHz     65.000000 MHz
    DMT 0x12:  1024x768    75.028582 Hz   4:3     60.023 kHz     78.750000 MHz
    DMT 0x24:  1280x1024   75.024675 Hz   5:4     79.976 kHz    135.000000 MHz
    Apple   :  1152x870    75.061550 Hz 192:145   68.681 kHz    100.000000 MHz
  Standard Timings:
    DMT 0x07:   640x480    85.008312 Hz   4:3     43.269 kHz     36.000000 MHz
    DMT 0x0c:   800x600    85.061274 Hz   4:3     53.674 kHz     56.250000 MHz
    DMT 0x13:  1024x768    84.996690 Hz   4:3     68.677 kHz     94.500000 MHz
    DMT 0x20:  1280x960    60.000000 Hz   4:3     60.000 kHz    108.000000 MHz
    DMT 0x23:  1280x1024   60.019740 Hz   5:4     63.981 kHz    108.000000 MHz
    DMT 0x25:  1280x1024   85.024098 Hz   5:4     91.146 kHz    157.500000 MHz
    DMT 0x33:  1600x1200   60.000000 Hz   4:3     75.000 kHz    162.000000 MHz
  Detailed Timing Descriptors:
    DTD 1:  1600x1200   60.000000 Hz   4:3     75.000 kHz    162.000000 MHz (408 mm x 306 mm)
                 Hfront   64 Hsync 192 Hback  304 Hpol P
                 Vfront    1 Vsync   3 Vback   46 Vpol P
    Display Range Limits:
      Monitor ranges (GTF): 48-85 Hz V, 30-92 kHz H, max dotclock 170 MHz
    Display Product Name: 'HP LP2065'
    Display Product Serial Number: ...
Checksum: 0x84

----------------

Block 1, Unknown EDID Extension Block 0x00:
  00 ff ff ff ff ff ff 00 22 f0 72 0a 01 01 01 01 '........".r.....'
  1d 14 01 03 80 29 1f 78 ee a6 a5 a3 57 4a 9d 25 '.....).x....WJ.%'
  12 50 54 a5 2b 80 31 59 45 59 61 59 81 40 81 80 '.PT.+.1YEYaY.@..'
  81 99 a9 40 01 01 48 3f 40 30 62 b0 32 40 40 c0 '...@..H?@0b.2@@.'
  13 00 98 32 11 00 00 1e 00 00 00 fd 00 30 55 1e '...2.........0U.'
  5c 11 00 0a 20 20 20 20 20 20 00 00 00 fc 00 48 '\...      .....H'
  50 20 4c 50 32 30 36 35 0a 20 20 20 00 00 00 ff 'P LP2065.   ....'
  00 43 4e 47 30 32 39 30 33 31 58 0a 20 20 00 84 '.CNG029031X.  ..'
Checksum: 0x84

----------------

Warnings:

Block 0, Base EDID:
  Vendor & Product Identification: The serial number is one of the known dummy values, it should probably be set to 0.

Failures:

Block 0, Base EDID:
  Basic Display Parameters & Features: sRGB is signaled, but the chromaticities do not match.
Block 1, Base EDID:
  Unknown Extension Block.
EDID:
  Base EDID: EDID specified 0 extension block(s), but found 1 extension block(s).

EDID conformity: FAIL
