edid-decode (hex):

00 ff ff ff ff ff ff 00 05 e3 70 20 f6 c4 00 00
25 18 01 04 a5 2b 18 78 22 ee d5 a5 55 48 9b 26
12 50 54 bf ef 00 a9 c0 81 80 81 c0 01 01 01 01
01 01 01 01 01 01 30 2a 40 c8 60 84 64 30 18 50
13 00 b2 ec 10 00 00 1e 00 00 00 fd 00 32 4c 1e
53 11 00 0a 20 20 20 20 20 20 00 00 00 fc 00 32
30 37 30 57 0a 20 20 20 20 20 20 20 00 00 00 ff
00 32 56 34 32 45 33 37 35 30 34 32 32 0a 00 a0

00 ff ff ff ff ff ff 00 05 e3 70 20 f6 c4 00 00
25 18 01 04 a5 2b 18 78 22 ee d5 a5 55 48 9b 26
12 50 54 bf ef 00 a9 c0 81 80 81 c0 01 01 01 01
01 01 01 01 01 01 30 2a 40 c8 60 84 64 30 18 50
13 00 b2 ec 10 00 00 1e 00 00 00 fd 00 32 4c 1e
53 11 00 0a 20 20 20 20 20 20 00 00 00 fc 00 32
30 37 30 57 0a 20 20 20 20 20 20 20 00 00 00 ff
00 32 56 34 32 45 33 37 35 30 34 32 32 0a 00 a0

----------------

Block 0, Base EDID:
  EDID Structure Version & Revision: 1.4
  Vendor & Product Identification:
    Manufacturer: AOC
    Model: 8304
    Serial Number: ...
    Made in: week 37 of 2014
  Basic Display Parameters & Features:
    Digital display
    Bits per primary color channel: 8
    DisplayPort interface
    Maximum image size: 43 cm x 24 cm
    Gamma: 2.20
    DPMS levels: Off
    Supported color formats: RGB 4:4:4
    First detailed timing includes the native pixel format and preferred refresh rate
  Color Characteristics:
    Red  : 0.6474, 0.3339
    Green: 0.2841, 0.6074
    Blue : 0.1513, 0.0712
    White: 0.3134, 0.3291
  Established Timings I & II:
    IBM     :   720x400    70.081663 Hz   9:5     31.467 kHz     28.320000 MHz
    DMT 0x04:   640x480    59.940476 Hz   4:3     31.469 kHz     25.175000 MHz
    Apple   :   640x480    66.666667 Hz   4:3     35.000 kHz     30.240000 MHz
    DMT 0x05:   640x480    72.808802 Hz   4:3     37.861 kHz     31.500000 MHz
    DMT 0x06:   640x480    75.000000 Hz   4:3     37.500 kHz     31.500000 MHz
    DMT 0x08:   800x600    56.250000 Hz   4:3     35.156 kHz     36.000000 MHz
    DMT 0x09:   800x600    60.316541 Hz   4:3     37.879 kHz     40.000000 MHz
    DMT 0x0a:   800x600    72.187572 Hz   4:3     48.077 kHz     50.000000 MHz
    DMT 0x0b:   800x600    75.000000 Hz   4:3     46.875 kHz     49.500000 MHz
    Apple   :   832x624    74.551266 Hz   4:3     49.726 kHz     57.284000 MHz
    DMT 0x10:  1024x768    60.003840 Hz   4:3     48.363 kHz     65.000000 MHz
    DMT 0x11:  1024x768    70.069359 Hz   4:3     56.476 kHz     75.000000 MHz
    DMT 0x12:  1024x768    75.028582 Hz   4:3     60.023 kHz     78.750000 MHz
    DMT 0x24:  1280x1024   75.024675 Hz   5:4     79.976 kHz    135.000000 MHz
  Standard Timings:
    DMT 0x53:  1600x900    60.000000 Hz  16:9     60.000 kHz    108.000000 MHz (RB)
    DMT 0x23:  1280x1024   60.019740 Hz   5:4     63.981 kHz    108.000000 MHz
    DMT 0x55:  1280x720    60.000000 Hz  16:9     45.000 kHz     74.250000 MHz
  Detailed Timing Descriptors:
    DTD 1:  1600x900    60.000000 Hz  16:9     60.000 kHz    108.000000 MHz (434 mm x 236 mm)
                 Hfront   24 Hsync  80 Hback   96 Hpol P
                 Vfront    1 Vsync   3 Vback   96 Vpol P
    Display Range Limits:
      Monitor ranges (GTF): 50-76 Hz V, 30-83 kHz H, max dotclock 170 MHz
    Display Product Name: '2070W'
    Display Product Serial Number: ...
Checksum: 0xa0

----------------

Warnings:

Block 0, Base EDID:
  Display Range Limits: GTF support is deprecated in EDID 1.4.

Failures:

Block 0, Base EDID:
  Display Range Limits: GTF is supported, but the display does not support continuous frequencies.
EDID:
  Extension Block 1 started with EDID header, ignoring Extension Blocks >= 1.

EDID conformity: FAIL
