edid-decode (hex):

00 ff ff ff ff ff ff 00 05 e3 70 20 12 0d 00 00
13 1d 01 03 80 2b 18 78 ea d2 05 a5 55 53 9c 26
11 50 54 bf ee 00 a9 c0 81 c0 01 01 01 01 01 01
01 01 01 01 01 01 30 2a 40 c8 60 84 64 30 18 50
13 00 b2 ec 10 00 00 1e 00 00 00 fd 00 32 4c 1e
53 0e 00 0a 20 20 20 20 20 20 00 00 00 fc 00 32
30 37 30 57 0a 20 20 20 20 20 20 20 00 00 00 ff
00 4b 50 58 4b 35 31 41 30 30 33 33 34 36 01 18

02 03 10 00 65 03 0c 00 10 00 45 01 03 12 04 13
00 00 00 00 00 00 00 00 00 00 00 00 00 00 00 00
00 00 00 00 00 00 00 00 00 00 00 00 00 00 00 00
00 00 00 00 00 00 00 00 00 00 00 00 00 00 00 00
00 00 00 00 00 00 00 00 00 00 00 00 00 00 00 00
00 00 00 00 00 00 00 00 00 00 00 00 00 00 00 00
00 00 00 00 00 00 00 00 00 00 00 00 00 00 00 00
00 00 00 00 00 00 00 00 00 00 00 00 00 00 00 f5

00 ff ff ff ff ff ff 00 05 e3 70 20 12 0d 00 00
13 1d 01 03 80 2b 18 78 ea d2 05 a5 55 53 9c 26
11 50 54 bf ee 00 a9 c0 81 c0 01 01 01 01 01 01
01 01 01 01 01 01 30 2a 40 c8 60 84 64 30 18 50
13 00 b2 ec 10 00 00 1e 00 00 00 fd 00 32 4c 1e
53 0e 00 0a 20 20 20 20 20 20 00 00 00 fc 00 32
30 37 30 57 0a 20 20 20 20 20 20 20 00 00 00 ff
00 4b 50 58 4b 35 31 41 30 30 33 33 34 36 01 18

02 03 10 00 65 03 0c 00 10 00 45 01 03 12 04 13
00 00 00 00 00 00 00 00 00 00 00 00 00 00 00 00
00 00 00 00 00 00 00 00 00 00 00 00 00 00 00 00
00 00 00 00 00 00 00 00 00 00 00 00 00 00 00 00
00 00 00 00 00 00 00 00 00 00 00 00 00 00 00 00
00 00 00 00 00 00 00 00 00 00 00 00 00 00 00 00
00 00 00 00 00 00 00 00 00 00 00 00 00 00 00 00
00 00 00 00 00 00 00 00 00 00 00 00 00 00 00 f5

----------------

Block 0, Base EDID:
  EDID Structure Version & Revision: 1.3
  Vendor & Product Identification:
    Manufacturer: AOC
    Model: 8304
    Serial Number: ...
    Made in: week 19 of 2019
  Basic Display Parameters & Features:
    Digital display
    Maximum image size: 43 cm x 24 cm
    Gamma: 2.20
    DPMS levels: Standby Suspend Off
    RGB color display
    First detailed timing is the preferred timing
  Color Characteristics:
    Red  : 0.6474, 0.3330
    Green: 0.3242, 0.6113
    Blue : 0.1484, 0.0664
    White: 0.3134, 0.3291
  Established Timings I & II:
    IBM     :   720x400    70.081663 Hz   9:5     31.467 kHz     28.320000 MHz
    DMT 0x04:   640x480    59.940476 Hz   4:3     31.469 kHz     25.175000 MHz
    Apple   :   640x480    66.666667 Hz   4:3     35.000 kHz     30.240000 MHz
    DMT 0x05:   640x480    72.808802 Hz   4:3     37.861 kHz     31.500000 MHz
    DMT 0x06:   640x480    75.000000 Hz   4:3     37.500 kHz     31.500000 MHz
    DMT 0x08:   800x600    56.250000 Hz   4:3     35.156 kHz     36.000000 MHz
    DMT 0x09:   800x600    60.316541 Hz   4:3     37.879 kHz     40.000000 MHz
    DMT 0x0a:   800x600    72.187572 Hz   4:3     48.077 kHz     50.000000 MHz
    DMT 0x0b:   800x600    75.000000 Hz   4:3     46.875 kHz     49.500000 MHz
    Apple   :   832x624    74.551266 Hz   4:3     49.726 kHz     57.284000 MHz
    DMT 0x10:  1024x768    60.003840 Hz   4:3     48.363 kHz     65.000000 MHz
    DMT 0x11:  1024x768    70.069359 Hz   4:3     56.476 kHz     75.000000 MHz
    DMT 0x12:  1024x768    75.028582 Hz   4:3     60.023 kHz     78.750000 MHz
  Standard Timings:
    DMT 0x53:  1600x900    60.000000 Hz  16:9     60.000 kHz    108.000000 MHz (RB)
    DMT 0x55:  1280x720    60.000000 Hz  16:9     45.000 kHz     74.250000 MHz
  Detailed Timing Descriptors:
    DTD 1:  1600x900    60.000000 Hz  16:9     60.000 kHz    108.000000 MHz (434 mm x 236 mm)
                 Hfront   24 Hsync  80 Hback   96 Hpol P
                 Vfront    1 Vsync   3 Vback   96 Vpol P
    Display Range Limits:
      Monitor ranges (GTF): 50-76 Hz V, 30-83 kHz H, max dotclock 140 MHz
    Display Product Name: '2070W'
    Display Product Serial Number: ...
  Extension blocks: 1
Checksum: 0x18

----------------

Block 1, CTA-861 Extension Block:
  Revision: 3
  Native detailed modes: 0
  Vendor-Specific Data Block (HDMI), OUI 00-0C-03:
    Source physical address: 1.0.0.0
  Video Data Block:
    VIC   1:   640x480    59.940476 Hz   4:3     31.469 kHz     25.175000 MHz
    VIC   3:   720x480    59.940060 Hz  16:9     31.469 kHz     27.000000 MHz
    VIC  18:   720x576    50.000000 Hz  16:9     31.250 kHz     27.000000 MHz
    VIC   4:  1280x720    60.000000 Hz  16:9     45.000 kHz     74.250000 MHz
    VIC  19:  1280x720    50.000000 Hz  16:9     37.500 kHz     74.250000 MHz
Checksum: 0xf5  Unused space in Extension Block: 111 bytes

----------------

Block 2, Unknown EDID Extension Block 0x00:
  00 ff ff ff ff ff ff 00 05 e3 70 20 12 0d 00 00 '..........p ....'
  13 1d 01 03 80 2b 18 78 ea d2 05 a5 55 53 9c 26 '.....+.x....US.&'
  11 50 54 bf ee 00 a9 c0 81 c0 01 01 01 01 01 01 '.PT.............'
  01 01 01 01 01 01 30 2a 40 c8 60 84 64 30 18 50 '......0*@.`.d0.P'
  13 00 b2 ec 10 00 00 1e 00 00 00 fd 00 32 4c 1e '.............2L.'
  53 0e 00 0a 20 20 20 20 20 20 00 00 00 fc 00 32 'S...      .....2'
  30 37 30 57 0a 20 20 20 20 20 20 20 00 00 00 ff '070W.       ....'
  00 4b 50 58 4b 35 31 41 30 30 33 33 34 36 01 18 '.KPXK51A003346..'
Checksum: 0x18

----------------

Block 3, CTA-861 Extension Block:
  Revision: 3
  Native detailed modes: 0
  Vendor-Specific Data Block (HDMI), OUI 00-0C-03:
    Source physical address: 1.0.0.0
  Video Data Block:
    VIC   1:   640x480    59.940476 Hz   4:3     31.469 kHz     25.175000 MHz
    VIC   3:   720x480    59.940060 Hz  16:9     31.469 kHz     27.000000 MHz
    VIC  18:   720x576    50.000000 Hz  16:9     31.250 kHz     27.000000 MHz
    VIC   4:  1280x720    60.000000 Hz  16:9     45.000 kHz     74.250000 MHz
    VIC  19:  1280x720    50.000000 Hz  16:9     37.500 kHz     74.250000 MHz
Checksum: 0xf5  Unused space in Extension Block: 111 bytes

----------------

Warnings:

Block 1, CTA-861 Extension Block:
  IT Video Formats are overscanned by default, but normally this should be underscanned.
  Video Data Block: VIC 1 and the first DTD are not identical. Is this intended?
  Display Product Serial Number is set, so the Serial Number in the Base EDID should be 0.
  Add a Colorimetry Data Block with the sRGB colorimetry bit set to avoid interop issues.
Block 3, CTA-861 Extension Block:
  IT Video Formats are overscanned by default, but normally this should be underscanned.

Failures:

Block 1, CTA-861 Extension Block:
  Missing VCDB, needed for Set Selectable RGB Quantization to avoid interop issues.
Block 2, Base EDID:
  Unknown Extension Block.
Block 3, CTA-861 Extension Block:
  Video Data Block: Duplicate VIC 1.
  Video Data Block: Duplicate VIC 3.
  Video Data Block: Duplicate VIC 18.
  Video Data Block: Duplicate VIC 4.
  Video Data Block: Duplicate VIC 19.
EDID:
  Base EDID: EDID specified 1 extension block(s), but found 3 extension block(s).
  Base EDID: EDID 1.3 requires a Block Map Extension in Block 1 if there are more than 2 blocks in the EDID.

EDID conformity: FAIL
