edid-decode (hex):

00 ff ff ff ff ff ff 00 1c 54 03 27 01 01 01 01
1a 1d 01 04 b5 3b 22 78 eb c7 45 ae 4f 47 a5 26
11 50 54 bf cf 00 d1 c0 71 4f 81 c0 81 40 81 80
95 00 b3 00 01 01 02 3a 80 18 71 38 29 40 58 20
45 00 53 50 21 00 00 1e 00 00 00 fd 00 30 a5 de
de 3c 01 0a 20 20 20 20 20 20 00 00 00 fc 00 41
4f 52 55 53 20 43 56 32 37 46 0a 20 00 00 00 ff
00 31 39 32 36 30 42 30 30 31 33 30 32 0a 01 15

02 03 50 71 52 01 02 03 11 12 13 0f 1d 1e 0e 90
1f 04 05 14 2f 40 3f 23 09 17 07 83 01 00 00 6a
03 0c 00 10 00 38 3c 20 00 00 67 d8 5d c4 01 78
80 03 6d 1a 00 00 02 03 30 a5 00 1f 63 29 63 29
e3 05 c0 00 e4 0f 00 00 00 e6 06 05 01 63 63 29
8a 96 80 50 70 38 59 40 08 20 f8 0c 53 50 21 00
00 1e 08 82 80 50 70 38 4d 40 08 20 f8 0c 53 50
21 00 00 1a 00 00 00 00 00 00 00 00 00 00 00 a7

00 ff ff ff ff ff ff 00 1c 54 03 27 01 01 01 01
1a 1d 01 04 b5 3b 22 78 eb c7 45 ae 4f 47 a5 26
11 50 54 bf cf 00 d1 c0 71 4f 81 c0 81 40 81 80
95 00 b3 00 01 01 02 3a 80 18 71 38 29 40 58 20
45 00 53 50 21 00 00 1e 00 00 00 fd 00 30 a5 de
de 3c 01 0a 20 20 20 20 20 20 00 00 00 fc 00 41
4f 52 55 53 20 43 56 32 37 46 0a 20 00 00 00 ff
00 31 39 32 36 30 42 30 30 31 33 30 32 0a 01 15

02 03 50 71 52 01 02 03 11 12 13 0f 1d 1e 0e 90
1f 04 05 14 2f 40 3f 23 09 17 07 83 01 00 00 6a
03 0c 00 10 00 38 3c 20 00 00 67 d8 5d c4 01 78
80 03 6d 1a 00 00 02 03 30 a5 00 1f 63 29 63 29
e3 05 c0 00 e4 0f 00 00 00 e6 06 05 01 63 63 29
8a 96 80 50 70 38 59 40 08 20 f8 0c 53 50 21 00
00 1e 08 82 80 50 70 38 4d 40 08 20 f8 0c 53 50
21 00 00 1a 00 00 00 00 00 00 00 00 00 00 00 a7

----------------

Block 0, Base EDID:
  EDID Structure Version & Revision: 1.4
  Vendor & Product Identification:
    Manufacturer: GBT
    Model: 9987
    Serial Number: ...
    Made in: week 26 of 2019
  Basic Display Parameters & Features:
    Digital display
    Bits per primary color channel: 10
    DisplayPort interface
    Maximum image size: 59 cm x 34 cm
    Gamma: 2.20
    DPMS levels: Standby Suspend Off
    Supported color formats: RGB 4:4:4, YCrCb 4:4:4
    First detailed timing includes the native pixel format and preferred refresh rate
    Display supports continuous frequencies
  Color Characteristics:
    Red  : 0.6826, 0.3085
    Green: 0.2783, 0.6474
    Blue : 0.1494, 0.0664
    White: 0.3134, 0.3291
  Established Timings I & II:
    IBM     :   720x400    70.081663 Hz   9:5     31.467 kHz     28.320000 MHz
    DMT 0x04:   640x480    59.940476 Hz   4:3     31.469 kHz     25.175000 MHz
    Apple   :   640x480    66.666667 Hz   4:3     35.000 kHz     30.240000 MHz
    DMT 0x05:   640x480    72.808802 Hz   4:3     37.861 kHz     31.500000 MHz
    DMT 0x06:   640x480    75.000000 Hz   4:3     37.500 kHz     31.500000 MHz
    DMT 0x08:   800x600    56.250000 Hz   4:3     35.156 kHz     36.000000 MHz
    DMT 0x09:   800x600    60.316541 Hz   4:3     37.879 kHz     40.000000 MHz
    DMT 0x0a:   800x600    72.187572 Hz   4:3     48.077 kHz     50.000000 MHz
    DMT 0x0b:   800x600    75.000000 Hz   4:3     46.875 kHz     49.500000 MHz
    DMT 0x10:  1024x768    60.003840 Hz   4:3     48.363 kHz     65.000000 MHz
    DMT 0x11:  1024x768    70.069359 Hz   4:3     56.476 kHz     75.000000 MHz
    DMT 0x12:  1024x768    75.028582 Hz   4:3     60.023 kHz     78.750000 MHz
    DMT 0x24:  1280x1024   75.024675 Hz   5:4     79.976 kHz    135.000000 MHz
  Standard Timings:
    DMT 0x52:  1920x1080   60.000000 Hz  16:9     67.500 kHz    148.500000 MHz
    DMT 0x15:  1152x864    75.000000 Hz   4:3     67.500 kHz    108.000000 MHz
    DMT 0x55:  1280x720    60.000000 Hz  16:9     45.000 kHz     74.250000 MHz
    DMT 0x20:  1280x960    60.000000 Hz   4:3     60.000 kHz    108.000000 MHz
    DMT 0x23:  1280x1024   60.019740 Hz   5:4     63.981 kHz    108.000000 MHz
    DMT 0x2f:  1440x900    59.887445 Hz  16:10    55.935 kHz    106.500000 MHz
    DMT 0x3a:  1680x1050   59.954250 Hz  16:10    65.290 kHz    146.250000 MHz
  Detailed Timing Descriptors:
    DTD 1:  1920x1080   60.214095 Hz  16:9     67.500 kHz    148.500000 MHz (595 mm x 336 mm)
                 Hfront   88 Hsync  32 Hback  160 Hpol P
                 Vfront    4 Vsync   5 Vback   32 Vpol P
    Display Range Limits:
      Monitor ranges (Range Limits Only): 48-165 Hz V, 222-222 kHz H, max dotclock 600 MHz
    Display Product Name: 'AORUS CV27F'
    Display Product Serial Number: ...
  Extension blocks: 1
Checksum: 0x15

----------------

Block 1, CTA-861 Extension Block:
  Revision: 3
  Basic audio support
  Supports YCbCr 4:4:4
  Supports YCbCr 4:2:2
  Native DTDs: 1
  Video Data Block:
    VIC   1:   640x480    59.940476 Hz   4:3     31.469 kHz     25.175000 MHz
    VIC   2:   720x480    59.940060 Hz   4:3     31.469 kHz     27.000000 MHz
    VIC   3:   720x480    59.940060 Hz  16:9     31.469 kHz     27.000000 MHz
    VIC  17:   720x576    50.000000 Hz   4:3     31.250 kHz     27.000000 MHz
    VIC  18:   720x576    50.000000 Hz  16:9     31.250 kHz     27.000000 MHz
    VIC  19:  1280x720    50.000000 Hz  16:9     37.500 kHz     74.250000 MHz
    VIC  15:  1440x480    59.940060 Hz  16:9     31.469 kHz     54.000000 MHz
    VIC  29:  1440x576    50.000000 Hz   4:3     31.250 kHz     54.000000 MHz
    VIC  30:  1440x576    50.000000 Hz  16:9     31.250 kHz     54.000000 MHz
    VIC  14:  1440x480    59.940060 Hz   4:3     31.469 kHz     54.000000 MHz
    VIC  16:  1920x1080   60.000000 Hz  16:9     67.500 kHz    148.500000 MHz (native)
    VIC  31:  1920x1080   50.000000 Hz  16:9     56.250 kHz    148.500000 MHz
    VIC   4:  1280x720    60.000000 Hz  16:9     45.000 kHz     74.250000 MHz
    VIC   5:  1920x1080i  60.000000 Hz  16:9     33.750 kHz     74.250000 MHz
    VIC  20:  1920x1080i  50.000000 Hz  16:9     28.125 kHz     74.250000 MHz
    VIC  47:  1280x720   120.000000 Hz  16:9     90.000 kHz    148.500000 MHz
    VIC  64:  1920x1080  100.000000 Hz  16:9    112.500 kHz    297.000000 MHz
    VIC  63:  1920x1080  120.000000 Hz  16:9    135.000 kHz    297.000000 MHz
  Audio Data Block:
    Linear PCM:
      Max channels: 2
      Supported sample rates (kHz): 96 48 44.1 32
      Supported sample sizes (bits): 24 20 16
  Speaker Allocation Data Block:
    FL/FR - Front Left/Right
  Vendor-Specific Data Block (HDMI), OUI 00-0C-03:
    Source physical address: 1.0.0.0
    DC_36bit
    DC_30bit
    DC_Y444
    Maximum TMDS clock: 300 MHz
    Extended HDMI video details:
  Vendor-Specific Data Block (HDMI Forum), OUI C4-5D-D8:
    Version: 1
    Maximum TMDS Character Rate: 600 MHz
    SCDC Present
    Supports 12-bits/component Deep Color 4:2:0 Pixel Encoding
    Supports 10-bits/component Deep Color 4:2:0 Pixel Encoding
  Vendor-Specific Data Block (AMD), OUI 00-00-1A:
    Version: 2
    Flags 1: 0x03
      FreeSync Supported
      FreeSync 2 HDR Supported
    Minimum Refresh Rate: 48 Hz
    Maximum Refresh Rate: 165 Hz
    Flags 5: 0x1f
      sRGB EOTF Supported
      BT.709 EOTF Supported
      Gamma 2.2 EOTF Supported
      Gamma 2.6 EOTF Supported
      PQ-Interim EOTF Supported
    Maximum luminance: 99 (426.856 cd/m^2)
    Minimum luminance: 41 (0.110 cd/m^2)
  Colorimetry Data Block:
    BT2020YCC
    BT2020RGB
  YCbCr 4:2:0 Capability Map Data Block:
    Empty Capability Map
  HDR Static Metadata Data Block:
    Electro optical transfer functions:
      Traditional gamma - SDR luminance range
      SMPTE ST2084
    Supported static metadata descriptors:
      Static metadata type 1
    Desired content max luminance: 99 (426.856 cd/m^2)
    Desired content max frame-average luminance: 99 (426.856 cd/m^2)
    Desired content min luminance: 41 (0.110 cd/m^2)
  Detailed Timing Descriptors:
    DTD 2:  1920x1080  164.833191 Hz  16:9    192.690 kHz    385.380000 MHz (595 mm x 336 mm)
                 Hfront    8 Hsync  32 Hback   40 Hpol P
                 Vfront   63 Vsync   8 Vback   18 Vpol P
    DTD 3:  1920x1080  143.854797 Hz  16:9    166.440 kHz    332.880000 MHz (595 mm x 336 mm)
                 Hfront    8 Hsync  32 Hback   40 Hpol P
                 Vfront   63 Vsync   8 Vback    6 Vpol N
Checksum: 0xa7  Unused space in Extension Block: 11 bytes

----------------

Warnings:

Block 0, Base EDID:
  Vendor & Product Identification: The serial number is one of the known dummy values, it should probably be set to 0.
Block 1, CTA-861 Extension Block:
  IT Video Formats are overscanned by default, but normally this should be underscanned.
  Video Data Block: VIC 1 and the first DTD are not identical. Is this intended?
  Colorimetry Data Block: Set the sRGB colorimetry bit to avoid interop issues.
  Display Product Serial Number is set, so the Serial Number in the Base EDID should be 0.
EDID:
  Base EDID: Some timings are out of range of the Monitor Ranges:
    Horizontal Freq: 28.125 - 192.690 kHz (Monitor: 222.000 - 222.000 kHz)

Failures:

Block 1, CTA-861 Extension Block:
  Vendor-Specific Data Block (HDMI), OUI 00-0C-03: The HDMI Specification requires EDID 1.3 instead of 1.4.
  YCbCr 4:2:0 Capability Map Data Block: Empty Capability Map.
  Missing VCDB, needed for Set Selectable RGB Quantization to avoid interop issues.
EDID:
  Extension Block 2 started with EDID header, ignoring Extension Blocks >= 2.

EDID conformity: FAIL
