edid-decode (hex):

00 ff ff ff ff ff ff 00 10 ac c3 d0 54 30 51 30
2b 1d 01 03 80 35 1e 78 ea ad 75 a9 54 4d 9d 26
0f 50 54 a5 4b 00 81 00 b3 00 d1 00 71 4f a9 40
81 80 d1 c0 01 01 56 5e 00 a0 a0 a0 29 50 30 20
35 00 0e 28 21 00 00 1a 00 00 00 ff 00 36 43 33
56 44 39 41 4e 30 51 30 54 0a 00 00 00 fc 00 44
45 4c 4c 20 50 32 34 31 38 44 0a 20 00 00 00 fd
00 31 56 1d 71 1c 00 0a 20 20 20 20 20 20 01 3b

02 03 19 41 41 10 23 09 07 07 83 01 00 00 67 03
0c 00 10 00 00 3c e2 00 0f 02 3a 80 18 71 38 2d
40 58 2c 45 00 6d 55 21 00 00 1e 00 00 00 00 00
00 00 00 00 00 00 00 00 00 00 00 00 00 00 00 00
00 00 00 00 00 00 00 00 00 00 00 00 00 00 00 00
00 00 00 00 00 00 00 00 00 00 00 00 00 00 00 00
00 00 00 00 00 00 00 00 00 00 00 00 00 00 00 00
00 00 00 00 00 00 00 00 00 00 00 00 00 00 00 2b

00 ff ff ff ff ff ff 00 10 ac c3 d0 54 30 51 30
2b 1d 01 03 80 35 1e 78 ea ad 75 a9 54 4d 9d 26
0f 50 54 a5 4b 00 81 00 b3 00 d1 00 71 4f a9 40
81 80 d1 c0 01 01 56 5e 00 a0 a0 a0 29 50 30 20
35 00 0e 28 21 00 00 1a 00 00 00 ff 00 36 43 33
56 44 39 41 4e 30 51 30 54 0a 00 00 00 fc 00 44
45 4c 4c 20 50 32 34 31 38 44 0a 20 00 00 00 fd
00 31 56 1d 71 1c 00 0a 20 20 20 20 20 20 01 3b

02 03 19 41 41 10 23 09 07 07 83 01 00 00 67 03
0c 00 10 00 00 3c e2 00 0f 02 3a 80 18 71 38 2d
40 58 2c 45 00 6d 55 21 00 00 1e 00 00 00 00 00
00 00 00 00 00 00 00 00 00 00 00 00 00 00 00 00
00 00 00 00 00 00 00 00 00 00 00 00 00 00 00 00
00 00 00 00 00 00 00 00 00 00 00 00 00 00 00 00
00 00 00 00 00 00 00 00 00 00 00 00 00 00 00 00
00 00 00 00 00 00 00 00 00 00 00 00 00 00 00 2b

----------------

Block 0, Base EDID:
  EDID Structure Version & Revision: 1.3
  Vendor & Product Identification:
    Manufacturer: DEL
    Model: 53443
    Serial Number: ...
    Made in: week 43 of 2019
  Basic Display Parameters & Features:
    Digital display
    Maximum image size: 53 cm x 30 cm
    Gamma: 2.20
    DPMS levels: Standby Suspend Off
    RGB color display
    First detailed timing is the preferred timing
  Color Characteristics:
    Red  : 0.6621, 0.3300
    Green: 0.3037, 0.6142
    Blue : 0.1494, 0.0615
    White: 0.3134, 0.3291
  Established Timings I & II:
    IBM     :   720x400    70.081663 Hz   9:5     31.467 kHz     28.320000 MHz
    DMT 0x04:   640x480    59.940476 Hz   4:3     31.469 kHz     25.175000 MHz
    DMT 0x06:   640x480    75.000000 Hz   4:3     37.500 kHz     31.500000 MHz
    DMT 0x09:   800x600    60.316541 Hz   4:3     37.879 kHz     40.000000 MHz
    DMT 0x0b:   800x600    75.000000 Hz   4:3     46.875 kHz     49.500000 MHz
    DMT 0x10:  1024x768    60.003840 Hz   4:3     48.363 kHz     65.000000 MHz
    DMT 0x12:  1024x768    75.028582 Hz   4:3     60.023 kHz     78.750000 MHz
    DMT 0x24:  1280x1024   75.024675 Hz   5:4     79.976 kHz    135.000000 MHz
  Standard Timings:
    DMT 0x1c:  1280x800    59.810326 Hz  16:10    49.702 kHz     83.500000 MHz
    DMT 0x3a:  1680x1050   59.954250 Hz  16:10    65.290 kHz    146.250000 MHz
    DMT 0x45:  1920x1200   59.884600 Hz  16:10    74.556 kHz    193.250000 MHz
    DMT 0x15:  1152x864    75.000000 Hz   4:3     67.500 kHz    108.000000 MHz
    DMT 0x33:  1600x1200   60.000000 Hz   4:3     75.000 kHz    162.000000 MHz
    DMT 0x23:  1280x1024   60.019740 Hz   5:4     63.981 kHz    108.000000 MHz
    DMT 0x52:  1920x1080   60.000000 Hz  16:9     67.500 kHz    148.500000 MHz
  Detailed Timing Descriptors:
    DTD 1:  2560x1440   59.950550 Hz  16:9     88.787 kHz    241.500000 MHz (526 mm x 296 mm)
                 Hfront   48 Hsync  32 Hback   80 Hpol P
                 Vfront    3 Vsync   5 Vback   33 Vpol N
    Display Product Serial Number: ...
    Display Product Name: 'DELL P2418D'
    Display Range Limits:
      Monitor ranges (GTF): 49-86 Hz V, 29-113 kHz H, max dotclock 280 MHz
  Extension blocks: 1
Checksum: 0x3b

----------------

Block 1, CTA-861 Extension Block:
  Revision: 3
  Basic audio support
  Native DTDs: 1
  Video Data Block:
    VIC  16:  1920x1080   60.000000 Hz  16:9     67.500 kHz    148.500000 MHz
  Audio Data Block:
    Linear PCM:
      Max channels: 2
      Supported sample rates (kHz): 48 44.1 32
      Supported sample sizes (bits): 24 20 16
  Speaker Allocation Data Block:
    FL/FR - Front Left/Right
  Vendor-Specific Data Block (HDMI), OUI 00-0C-03:
    Source physical address: 1.0.0.0
    Maximum TMDS clock: 300 MHz
  Video Capability Data Block:
    YCbCr quantization: No Data
    RGB quantization: No Data
    PT scan behavior: No Data
    IT scan behavior: Supports both over- and underscan
    CE scan behavior: Supports both over- and underscan
  Detailed Timing Descriptors:
    DTD 2:  1920x1080   60.000000 Hz  16:9     67.500 kHz    148.500000 MHz (621 mm x 341 mm)
                 Hfront   88 Hsync  44 Hback  148 Hpol P
                 Vfront    4 Vsync   5 Vback   36 Vpol P
Checksum: 0x2b  Unused space in Extension Block: 84 bytes

----------------

Warnings:

Block 1, CTA-861 Extension Block:
  IT Video Formats are overscanned by default, but normally this should be underscanned.
  Video Data Block: VIC 16 and the first DTD are not identical. Is this intended?
  Display Product Serial Number is set, so the Serial Number in the Base EDID should be 0.
  Add a Colorimetry Data Block with the sRGB colorimetry bit set to avoid interop issues.

Failures:

Block 1, CTA-861 Extension Block:
  Video Capability Data Block: Set Selectable RGB Quantization to avoid interop issues.
  Detailed Timing Descriptor #2: Mismatch of image size 621x341 mm vs display size 530x300 mm.
EDID:
  Extension Block 2 started with EDID header, ignoring Extension Blocks >= 2.
  Base EDID: The DTD max image size is 621x341mm, which is larger than the display size 530.0x300.0mm.

EDID conformity: FAIL
