edid-decode (hex):

00 ff ff ff ff ff ff 00 26 cd 3e 66 6a 05 00 00
03 1e 01 03 80 3c 22 78 ea 8c e5 a5 58 50 a0 23
0b 50 54 25 4b 00 95 00 a9 c0 a9 00 a9 40 b3 00
d1 c0 d1 00 e1 00 56 5e 00 a0 a0 a0 29 50 30 20
35 00 55 50 21 00 00 1a 00 00 00 ff 00 31 31 35
34 31 30 30 33 30 31 33 38 36 00 00 00 fd 00 32
90 1e de 3c 00 0a 20 20 20 20 20 20 00 00 00 fc
00 50 4c 32 37 36 30 51 0a 20 20 20 20 20 01 4f

02 03 36 f1 50 90 05 04 03 02 01 11 12 13 14 06
07 15 16 1f 5a 23 09 07 07 83 01 00 00 67 03 0c
00 10 00 38 44 67 d8 5d c4 01 78 80 00 68 1a 00
00 01 01 28 90 e6 9e e8 00 78 a0 a0 67 50 08 20
98 04 55 50 21 00 00 1a 02 3a 80 18 71 38 2d 40
58 2c 45 00 55 50 21 00 00 1a cd 46 00 a0 a0 38
1f 40 30 20 3a 00 55 50 21 00 00 1a 0b 6d 00 78
a0 a0 30 50 1c 20 28 08 55 50 21 00 00 1a 00 33

00 ff ff ff ff ff ff 00 26 cd 3e 66 6a 05 00 00
03 1e 01 03 80 3c 22 78 ea 8c e5 a5 58 50 a0 23
0b 50 54 25 4b 00 95 00 a9 c0 a9 00 a9 40 b3 00
d1 c0 d1 00 e1 00 56 5e 00 a0 a0 a0 29 50 30 20
35 00 55 50 21 00 00 1a 00 00 00 ff 00 31 31 35
34 31 30 30 33 30 31 33 38 36 00 00 00 fd 00 32
90 1e de 3c 00 0a 20 20 20 20 20 20 00 00 00 fc
00 50 4c 32 37 36 30 51 0a 20 20 20 20 20 01 4f

02 03 36 f1 50 90 05 04 03 02 01 11 12 13 14 06
07 15 16 1f 5a 23 09 07 07 83 01 00 00 67 03 0c
00 10 00 38 44 67 d8 5d c4 01 78 80 00 68 1a 00
00 01 01 28 90 e6 9e e8 00 78 a0 a0 67 50 08 20
98 04 55 50 21 00 00 1a 02 3a 80 18 71 38 2d 40
58 2c 45 00 55 50 21 00 00 1a cd 46 00 a0 a0 38
1f 40 30 20 3a 00 55 50 21 00 00 1a 0b 6d 00 78
a0 a0 30 50 1c 20 28 08 55 50 21 00 00 1a 00 33

----------------

Block 0, Base EDID:
  EDID Structure Version & Revision: 1.3
  Vendor & Product Identification:
    Manufacturer: IVM
    Model: 26174
    Serial Number: ...
    Made in: week 3 of 2020
  Basic Display Parameters & Features:
    Digital display
    Maximum image size: 60 cm x 34 cm
    Gamma: 2.20
    DPMS levels: Standby Suspend Off
    RGB color display
    First detailed timing is the preferred timing
  Color Characteristics:
    Red  : 0.6464, 0.3437
    Green: 0.3154, 0.6250
    Blue : 0.1396, 0.0449
    White: 0.3134, 0.3291
  Established Timings I & II:
    DMT 0x04:   640x480    59.940476 Hz   4:3     31.469 kHz     25.175000 MHz
    DMT 0x06:   640x480    75.000000 Hz   4:3     37.500 kHz     31.500000 MHz
    DMT 0x09:   800x600    60.316541 Hz   4:3     37.879 kHz     40.000000 MHz
    DMT 0x0b:   800x600    75.000000 Hz   4:3     46.875 kHz     49.500000 MHz
    DMT 0x10:  1024x768    60.003840 Hz   4:3     48.363 kHz     65.000000 MHz
    DMT 0x12:  1024x768    75.028582 Hz   4:3     60.023 kHz     78.750000 MHz
    DMT 0x24:  1280x1024   75.024675 Hz   5:4     79.976 kHz    135.000000 MHz
  Standard Timings:
    DMT 0x2f:  1440x900    59.887445 Hz  16:10    55.935 kHz    106.500000 MHz
    DMT 0x53:  1600x900    60.000000 Hz  16:9     60.000 kHz    108.000000 MHz (RB)
    GTF     :  1600x1000   59.999820 Hz  16:10    62.100 kHz    133.142000 MHz
    DMT 0x33:  1600x1200   60.000000 Hz   4:3     75.000 kHz    162.000000 MHz
    DMT 0x3a:  1680x1050   59.954250 Hz  16:10    65.290 kHz    146.250000 MHz
    DMT 0x52:  1920x1080   60.000000 Hz  16:9     67.500 kHz    148.500000 MHz
    DMT 0x45:  1920x1200   59.884600 Hz  16:10    74.556 kHz    193.250000 MHz
    GTF     :  2048x1280   60.000000 Hz  16:10    79.500 kHz    221.328000 MHz
  Detailed Timing Descriptors:
    DTD 1:  2560x1440   59.950550 Hz  16:9     88.787 kHz    241.500000 MHz (597 mm x 336 mm)
                 Hfront   48 Hsync  32 Hback   80 Hpol P
                 Vfront    3 Vsync   5 Vback   33 Vpol N
    Display Product Serial Number: ...
    Display Range Limits:
      Monitor ranges (GTF): 50-144 Hz V, 30-222 kHz H, max dotclock 600 MHz
    Display Product Name: 'PL2760Q'
  Extension blocks: 1
Checksum: 0x4f

----------------

Block 1, CTA-861 Extension Block:
  Revision: 3
  Underscans IT Video Formats by default
  Basic audio support
  Supports YCbCr 4:4:4
  Supports YCbCr 4:2:2
  Native detailed modes: 1
  Video Data Block:
    VIC  16:  1920x1080   60.000000 Hz  16:9     67.500 kHz    148.500000 MHz (native)
    VIC   5:  1920x1080i  60.000000 Hz  16:9     33.750 kHz     74.250000 MHz
    VIC   4:  1280x720    60.000000 Hz  16:9     45.000 kHz     74.250000 MHz
    VIC   3:   720x480    59.940060 Hz  16:9     31.469 kHz     27.000000 MHz
    VIC   2:   720x480    59.940060 Hz   4:3     31.469 kHz     27.000000 MHz
    VIC   1:   640x480    59.940476 Hz   4:3     31.469 kHz     25.175000 MHz
    VIC  17:   720x576    50.000000 Hz   4:3     31.250 kHz     27.000000 MHz
    VIC  18:   720x576    50.000000 Hz  16:9     31.250 kHz     27.000000 MHz
    VIC  19:  1280x720    50.000000 Hz  16:9     37.500 kHz     74.250000 MHz
    VIC  20:  1920x1080i  50.000000 Hz  16:9     28.125 kHz     74.250000 MHz
    VIC   6:  1440x480i   59.940060 Hz   4:3     15.734 kHz     27.000000 MHz
    VIC   7:  1440x480i   59.940060 Hz  16:9     15.734 kHz     27.000000 MHz
    VIC  21:  1440x576i   50.000000 Hz   4:3     15.625 kHz     27.000000 MHz
    VIC  22:  1440x576i   50.000000 Hz  16:9     15.625 kHz     27.000000 MHz
    VIC  31:  1920x1080   50.000000 Hz  16:9     56.250 kHz    148.500000 MHz
    VIC  90:  2560x1080   60.000000 Hz  64:27    66.000 kHz    198.000000 MHz
  Audio Data Block:
    Linear PCM:
      Max channels: 2
      Supported sample rates (kHz): 48 44.1 32
      Supported sample sizes (bits): 24 20 16
  Speaker Allocation Data Block:
    FL/FR - Front Left/Right
  Vendor-Specific Data Block (HDMI), OUI 00-0C-03:
    Source physical address: 1.0.0.0
    DC_36bit
    DC_30bit
    DC_Y444
    Maximum TMDS clock: 340 MHz
  Vendor-Specific Data Block (HDMI Forum), OUI C4-5D-D8:
    Version: 1
    Maximum TMDS Character Rate: 600 MHz
    SCDC Present
  Vendor-Specific Data Block (AMD), OUI 00-00-1A:
    Version: 1
    Feature Caps: 0x01
    Minimum Refresh Rate: 40 Hz
    Maximum Refresh Rate: 144 Hz
    Flags 1.x: 0xe6 (MCCS)
  Detailed Timing Descriptors:
    DTD 2:  2560x1440  144.006152 Hz  16:9    222.201 kHz    595.500000 MHz (597 mm x 336 mm)
                 Hfront    8 Hsync  32 Hback   80 Hpol P
                 Vfront   25 Vsync   8 Vback   70 Vpol N
    DTD 3:  1920x1080   60.000000 Hz  16:9     67.500 kHz    148.500000 MHz (597 mm x 336 mm)
                 Hfront   88 Hsync  44 Hback  148 Hpol P
                 Vfront    4 Vsync   5 Vback   36 Vpol N
    DTD 4:  2560x1080   59.978424 Hz  64:27    66.636 kHz    181.250000 MHz (597 mm x 336 mm)
                 Hfront   48 Hsync  32 Hback   80 Hpol P
                 Vfront    3 Vsync  10 Vback   18 Vpol N
    DTD 5:  2560x1440   70.000301 Hz  16:9    104.160 kHz    279.150000 MHz (597 mm x 336 mm)
                 Hfront   28 Hsync  32 Hback   60 Hpol P
                 Vfront   34 Vsync   8 Vback    6 Vpol N
Checksum: 0x33  Unused space in Extension Block: 1 byte

----------------

Block 2, Unknown EDID Extension Block 0x00:
  00 ff ff ff ff ff ff 00 26 cd 3e 66 6a 05 00 00 '........&.>fj...'
  03 1e 01 03 80 3c 22 78 ea 8c e5 a5 58 50 a0 23 '.....<"x....XP.#'
  0b 50 54 25 4b 00 95 00 a9 c0 a9 00 a9 40 b3 00 '.PT%K........@..'
  d1 c0 d1 00 e1 00 56 5e 00 a0 a0 a0 29 50 30 20 '......V^....)P0 '
  35 00 55 50 21 00 00 1a 00 00 00 ff 00 31 31 35 '5.UP!........115'
  34 31 30 30 33 30 31 33 38 36 00 00 00 fd 00 32 '4100301386.....2'
  90 1e de 3c 00 0a 20 20 20 20 20 20 00 00 00 fc '...<..      ....'
  00 50 4c 32 37 36 30 51 0a 20 20 20 20 20 01 4f '.PL2760Q.     .O'
Checksum: 0x4f

----------------

Block 3, CTA-861 Extension Block:
  Revision: 3
  Underscans IT Video Formats by default
  Basic audio support
  Supports YCbCr 4:4:4
  Supports YCbCr 4:2:2
  Native detailed modes: 1
  Video Data Block:
    VIC  16:  1920x1080   60.000000 Hz  16:9     67.500 kHz    148.500000 MHz (native)
    VIC   5:  1920x1080i  60.000000 Hz  16:9     33.750 kHz     74.250000 MHz
    VIC   4:  1280x720    60.000000 Hz  16:9     45.000 kHz     74.250000 MHz
    VIC   3:   720x480    59.940060 Hz  16:9     31.469 kHz     27.000000 MHz
    VIC   2:   720x480    59.940060 Hz   4:3     31.469 kHz     27.000000 MHz
    VIC   1:   640x480    59.940476 Hz   4:3     31.469 kHz     25.175000 MHz
    VIC  17:   720x576    50.000000 Hz   4:3     31.250 kHz     27.000000 MHz
    VIC  18:   720x576    50.000000 Hz  16:9     31.250 kHz     27.000000 MHz
    VIC  19:  1280x720    50.000000 Hz  16:9     37.500 kHz     74.250000 MHz
    VIC  20:  1920x1080i  50.000000 Hz  16:9     28.125 kHz     74.250000 MHz
    VIC   6:  1440x480i   59.940060 Hz   4:3     15.734 kHz     27.000000 MHz
    VIC   7:  1440x480i   59.940060 Hz  16:9     15.734 kHz     27.000000 MHz
    VIC  21:  1440x576i   50.000000 Hz   4:3     15.625 kHz     27.000000 MHz
    VIC  22:  1440x576i   50.000000 Hz  16:9     15.625 kHz     27.000000 MHz
    VIC  31:  1920x1080   50.000000 Hz  16:9     56.250 kHz    148.500000 MHz
    VIC  90:  2560x1080   60.000000 Hz  64:27    66.000 kHz    198.000000 MHz
  Audio Data Block:
    Linear PCM:
      Max channels: 2
      Supported sample rates (kHz): 48 44.1 32
      Supported sample sizes (bits): 24 20 16
  Speaker Allocation Data Block:
    FL/FR - Front Left/Right
  Vendor-Specific Data Block (HDMI), OUI 00-0C-03:
    Source physical address: 1.0.0.0
    DC_36bit
    DC_30bit
    DC_Y444
    Maximum TMDS clock: 340 MHz
  Vendor-Specific Data Block (HDMI Forum), OUI C4-5D-D8:
    Version: 1
    Maximum TMDS Character Rate: 600 MHz
    SCDC Present
  Vendor-Specific Data Block (AMD), OUI 00-00-1A:
    Version: 1
    Feature Caps: 0x01
    Minimum Refresh Rate: 40 Hz
    Maximum Refresh Rate: 144 Hz
    Flags 1.x: 0xe6 (MCCS)
  Detailed Timing Descriptors:
    DTD 6:  2560x1440  144.006152 Hz  16:9    222.201 kHz    595.500000 MHz (597 mm x 336 mm)
                 Hfront    8 Hsync  32 Hback   80 Hpol P
                 Vfront   25 Vsync   8 Vback   70 Vpol N
    DTD 7:  1920x1080   60.000000 Hz  16:9     67.500 kHz    148.500000 MHz (597 mm x 336 mm)
                 Hfront   88 Hsync  44 Hback  148 Hpol P
                 Vfront    4 Vsync   5 Vback   36 Vpol N
    DTD 8:  2560x1080   59.978424 Hz  64:27    66.636 kHz    181.250000 MHz (597 mm x 336 mm)
                 Hfront   48 Hsync  32 Hback   80 Hpol P
                 Vfront    3 Vsync  10 Vback   18 Vpol N
    DTD 9:  2560x1440   70.000301 Hz  16:9    104.160 kHz    279.150000 MHz (597 mm x 336 mm)
                 Hfront   28 Hsync  32 Hback   60 Hpol P
                 Vfront   34 Vsync   8 Vback    6 Vpol N
Checksum: 0x33  Unused space in Extension Block: 1 byte

----------------

Warnings:

Block 1, CTA-861 Extension Block:
  Video Data Block: VIC 16 and the first DTD are not identical. Is this intended?
  Detailed Timing Descriptor #3: DTD is similar but not identical to VIC 16.
  Detailed Timing Descriptor #4: Image size is 597x336 mm, but based on the picture AR it should be 597x251 mm.
  Display Product Serial Number is set, so the Serial Number in the Base EDID should be 0.
  Add a Colorimetry Data Block with the sRGB colorimetry bit set to avoid interop issues.
Block 3, CTA-861 Extension Block:
  Detailed Timing Descriptor #7: DTD is similar but not identical to VIC 16.
  Detailed Timing Descriptor #8: Image size is 597x336 mm, but based on the picture AR it should be 597x251 mm.
EDID:
  Base EDID: Some timings are out of range of the Monitor Ranges:
    Horizontal Freq: 15.625 - 222.201 kHz (Monitor: 30.000 - 222.000 kHz)

Failures:

Block 1, CTA-861 Extension Block:
  Missing VCDB, needed for Set Selectable RGB Quantization to avoid interop issues.
Block 2, Base EDID:
  Unknown Extension Block.
Block 3, CTA-861 Extension Block:
  Video Data Block: Duplicate VIC 16.
  Video Data Block: Duplicate VIC 5.
  Video Data Block: Duplicate VIC 4.
  Video Data Block: Duplicate VIC 3.
  Video Data Block: Duplicate VIC 2.
  Video Data Block: Duplicate VIC 1.
  Video Data Block: Duplicate VIC 17.
  Video Data Block: Duplicate VIC 18.
  Video Data Block: Duplicate VIC 19.
  Video Data Block: Duplicate VIC 20.
  Video Data Block: Duplicate VIC 6.
  Video Data Block: Duplicate VIC 7.
  Video Data Block: Duplicate VIC 21.
  Video Data Block: Duplicate VIC 22.
  Video Data Block: Duplicate VIC 31.
  Video Data Block: Duplicate VIC 90.
  Speaker Allocation Data Block: Only one instance of this Data Block is allowed.
  Vendor-Specific Data Block (HDMI Forum), OUI C4-5D-D8: Duplicate HDMI Forum VSDB/SCDB.
EDID:
  Base EDID: EDID specified 1 extension block(s), but found 3 extension block(s).
  Base EDID: EDID 1.3 requires a Block Map Extension in Block 1 if there are more than 2 blocks in the EDID.
  CTA-861: Native progressive timings are a mix of several resolutions.

EDID conformity: FAIL
