edid-decode (hex):

00 ff ff ff ff ff ff 00 4e 84 01 00 00 00 00 00
1b 1c 01 03 08 21 16 78 0a d7 a5 a2 59 4a 96 24
14 50 54 a1 08 00 81 c0 01 01 01 01 01 01 01 01
01 01 01 01 01 01 66 21 56 aa 51 00 1e 30 46 8f
33 00 10 09 00 00 00 1e a9 1a 00 a0 50 00 16 30
30 20 37 00 10 09 00 00 00 1a 64 19 00 40 41 00
26 30 18 88 36 00 04 03 00 00 00 18 00 00 00 fc
00 4c 45 44 0a 0a 0a 0a 0a 0a 0a 0a 0a 0a 00 76

00 ff ff ff ff ff ff 00 4e 84 01 00 00 00 00 00
1b 1c 01 03 08 21 16 78 0a d7 a5 a2 59 4a 96 24
14 50 54 a1 08 00 81 c0 01 01 01 01 01 01 01 01
01 01 01 01 01 01 66 21 56 aa 51 00 1e 30 46 8f
33 00 10 09 00 00 00 1e a9 1a 00 a0 50 00 16 30
30 20 37 00 10 09 00 00 00 1a 64 19 00 40 41 00
26 30 18 88 36 00 04 03 00 00 00 18 00 00 00 fc
00 4c 45 44 0a 0a 0a 0a 0a 0a 0a 0a 0a 0a 00 76

----------------

Block 0, Base EDID:
  EDID Structure Version & Revision: 1.3
  Vendor & Product Identification:
    Manufacturer: STD
    Model: 1
    Made in: week 27 of 2018
  Basic Display Parameters & Features:
    Analog display
    Signal Level Standard: 0.700 : 0.300 : 1.000 V p-p
    Blank level equals black level
    Sync: Separate
    Maximum image size: 33 cm x 22 cm
    Gamma: 2.20
    RGB color display
    First detailed timing is the preferred timing
  Color Characteristics:
    Red  : 0.6357, 0.3486
    Green: 0.2900, 0.5888
    Blue : 0.1425, 0.0800
    White: 0.3134, 0.3291
  Established Timings I & II:
    IBM     :   720x400    70.081663 Hz   9:5     31.467 kHz     28.320000 MHz
    DMT 0x04:   640x480    59.940476 Hz   4:3     31.469 kHz     25.175000 MHz
    DMT 0x09:   800x600    60.316541 Hz   4:3     37.879 kHz     40.000000 MHz
    DMT 0x10:  1024x768    60.003840 Hz   4:3     48.363 kHz     65.000000 MHz
  Standard Timings:
    DMT 0x55:  1280x720    60.000000 Hz  16:9     45.000 kHz     74.250000 MHz
  Detailed Timing Descriptors:
    DTD 1:  1366x768    59.789541 Hz 683:384   47.712 kHz     85.500000 MHz (16 mm x 9 mm)
                 Hfront   70 Hsync 143 Hback  213 Hpol P
                 Vfront    3 Vsync   3 Vback   24 Vpol P
    DTD 2:  1280x768    59.994726 Hz   5:3     47.396 kHz     68.250000 MHz (16 mm x 9 mm)
                 Hfront   48 Hsync  32 Hback   80 Hpol P
                 Vfront    3 Vsync   7 Vback   12 Vpol N
    DTD 3:  1024x768    60.003840 Hz   4:3     48.363 kHz     65.000000 MHz (4 mm x 3 mm)
                 Hfront   24 Hsync 136 Hback  160 Hpol N
                 Vfront    3 Vsync   6 Vback   29 Vpol N
    Display Product Name: 'LED'
Checksum: 0x76

----------------

Warnings:

Block 0, Base EDID:
  Detailed Timing Descriptor #1: Dubious image size (16x9 mm is smaller than 100x100 mm).
  Detailed Timing Descriptor #2: Dubious image size (16x9 mm is smaller than 100x100 mm).
  Detailed Timing Descriptor #3: Dubious image size (4x3 mm is smaller than 100x100 mm).

Failures:

Block 0, Base EDID:
  Detailed Timing Descriptor #1: Mismatch of image size 16x9 mm vs display size 330x220 mm.
  Detailed Timing Descriptor #2: Mismatch of image size 16x9 mm vs display size 330x220 mm.
  Detailed Timing Descriptor #3: Mismatch of image size 4x3 mm vs display size 330x220 mm.
  Display Product Name: Non-space after newline.
  Missing Display Range Limits Descriptor.
EDID:
  Extension Block 1 started with EDID header, ignoring Extension Blocks >= 1.

EDID conformity: FAIL
