edid-decode (hex):

00 ff ff ff ff ff ff 00 4e 84 01 00 01 00 00 00
01 14 01 03 08 00 00 00 01 ee 95 a3 54 4c 99 26
0f 50 54 ad cf 00 81 80 01 01 01 01 01 01 01 01
01 01 01 01 01 01 6c 39 90 30 62 1a 27 40 68 b0
36 00 00 00 00 00 00 00 02 3a 80 18 71 38 2d 40
58 2c 45 00 00 00 00 00 00 00 cc 29 a0 d0 51 84
22 30 0a 98 36 00 68 22 11 00 00 1e 34 21 50 b0
51 84 22 30 40 70 36 00 00 00 00 00 00 1c 00 69

----------------

Block 0, Base EDID:
  EDID Structure Version & Revision: 1.3
  Vendor & Product Identification:
    Manufacturer: STD
    Model: 1
    Serial Number: ...
    Made in: week 1 of 2010
  Basic Display Parameters & Features:
    Analog display
    Signal Level Standard: 0.700 : 0.300 : 1.000 V p-p
    Blank level equals black level
    Sync: Separate
    Image size is variable
    Gamma: 1.00
    Monochrome or grayscale display
    Supports GTF timings within operating range
  Color Characteristics:
    Red  : 0.6396, 0.3300
    Green: 0.2998, 0.5996
    Blue : 0.1503, 0.0595
    White: 0.3134, 0.3291
  Established Timings I & II:
    IBM     :   720x400    70.081663 Hz   9:5     31.467 kHz     28.320000 MHz
    DMT 0x04:   640x480    59.940476 Hz   4:3     31.469 kHz     25.175000 MHz
    DMT 0x05:   640x480    72.808802 Hz   4:3     37.861 kHz     31.500000 MHz
    DMT 0x06:   640x480    75.000000 Hz   4:3     37.500 kHz     31.500000 MHz
    DMT 0x09:   800x600    60.316541 Hz   4:3     37.879 kHz     40.000000 MHz
    DMT 0x0a:   800x600    72.187572 Hz   4:3     48.077 kHz     50.000000 MHz
    DMT 0x0b:   800x600    75.000000 Hz   4:3     46.875 kHz     49.500000 MHz
    DMT 0x10:  1024x768    60.003840 Hz   4:3     48.363 kHz     65.000000 MHz
    DMT 0x11:  1024x768    70.069359 Hz   4:3     56.476 kHz     75.000000 MHz
    DMT 0x12:  1024x768    75.028582 Hz   4:3     60.023 kHz     78.750000 MHz
    DMT 0x24:  1280x1024   75.024675 Hz   5:4     79.976 kHz    135.000000 MHz
  Standard Timings:
    DMT 0x23:  1280x1024   60.019740 Hz   5:4     63.981 kHz    108.000000 MHz
  Detailed Timing Descriptors:
    DTD 1:  1680x1050   60.261708 Hz  16:10    65.625 kHz    147.000000 MHz (analog composite, sync-on-green)
                 Hfront  104 Hsync 176 Hback  280 Hpol N
                 Vfront    3 Vsync   6 Vback   30 Vpol N
    DTD 2:  1920x1080   60.000000 Hz  16:9     67.500 kHz    148.500000 MHz (analog composite, sync-on-green)
                 Hfront   88 Hsync  44 Hback  148 Hpol N
                 Vfront    4 Vsync   5 Vback   36 Vpol N
    DTD 3:  1440x900    60.168607 Hz  16:10    56.197 kHz    107.000000 MHz (360 mm x 290 mm)
                 Hfront   10 Hsync 152 Hback  302 Hpol P
                 Vfront    3 Vsync   6 Vback   25 Vpol P
    DTD 4:  1360x900    50.784835 Hz  68:45    47.433 kHz     85.000000 MHz
                 Hfront   64 Hsync 112 Hback  256 Hpol N
                 Vfront    3 Vsync   6 Vback   25 Vpol P
Checksum: 0x69

----------------

Warnings:

Block 0, Base EDID:
  Vendor & Product Identification: The serial number is one of the known dummy values, it should probably be set to 0.
  Detailed Timing Descriptor #2: DTD is similar but not identical to VIC 16.
  Detailed Timing Descriptor #3: Image size is 360x290 mm, but based on the picture AR it should be 360x225 mm.

Failures:

Block 0, Base EDID:
  Basic Display Parameters & Features: EDID 1.3 requires that the first detailed timing is the preferred timing.
  Missing Display Product Name.
  Missing Display Range Limits Descriptor.
EDID:
  Base EDID: The DTD max image size is 360x290mm, but the display size is not specified anywhere.

EDID conformity: FAIL
