edid-decode (hex):

00 ff ff ff ff ff ff 00 09 e5 4c 09 00 00 00 00
12 1e 01 04 a5 1e 13 78 03 62 2e a7 54 4d 9a 25
10 52 55 00 00 00 01 01 01 01 01 01 01 01 01 01
01 01 01 01 01 01 9c 3e 80 c8 70 b0 3c 40 30 20
36 00 2e bc 10 00 00 1a 00 00 00 fd 00 1e 3c 4a
4a 10 01 0a 20 20 20 20 20 20 00 00 00 fe 00 42
4f 45 20 43 51 0a 20 20 20 20 20 20 00 00 00 fe
00 4e 45 31 34 30 57 55 4d 2d 4e 36 32 0a 00 63

00 ff ff ff ff ff ff 00 09 e5 4c 09 00 00 00 00
12 1e 01 04 a5 1e 13 78 03 62 2e a7 54 4d 9a 25
10 52 55 00 00 00 01 01 01 01 01 01 01 01 01 01
01 01 01 01 01 01 9c 3e 80 c8 70 b0 3c 40 30 20
36 00 2e bc 10 00 00 1a 00 00 00 fd 00 1e 3c 4a
4a 10 01 0a 20 20 20 20 20 20 00 00 00 fe 00 42
4f 45 20 43 51 0a 20 20 20 20 20 20 00 00 00 fe
00 4e 45 31 34 30 57 55 4d 2d 4e 36 32 0a 00 63

----------------

Block 0, Base EDID:
  EDID Structure Version & Revision: 1.4
  Vendor & Product Identification:
    Manufacturer: BOE
    Model: 2380
    Made in: week 18 of 2020
  Basic Display Parameters & Features:
    Digital display
    Bits per primary color channel: 8
    DisplayPort interface
    Maximum image size: 30 cm x 19 cm
    Gamma: 2.20
    Supported color formats: RGB 4:4:4
    First detailed timing includes the native pixel format and preferred refresh rate
    Display supports continuous frequencies
  Color Characteristics:
    Red  : 0.6533, 0.3300
    Green: 0.3007, 0.6035
    Blue : 0.1445, 0.0644
    White: 0.3232, 0.3339
  Established Timings I & II: none
  Standard Timings: none
  Detailed Timing Descriptors:
    DTD 1:  1920x1200   60.002995 Hz  16:10    75.604 kHz    160.280000 MHz (302 mm x 188 mm)
                 Hfront   48 Hsync  32 Hback  120 Hpol P
                 Vfront    3 Vsync   6 Vback   51 Vpol N
    Display Range Limits:
      Monitor ranges (Range Limits Only): 30-60 Hz V, 74-74 kHz H, max dotclock 160 MHz
    Alphanumeric Data String: 'BOE CQ'
    Alphanumeric Data String: 'NE140WUM-N62'
Checksum: 0x63

----------------

Block 1, Unknown EDID Extension Block 0x00:
  00 ff ff ff ff ff ff 00 09 e5 4c 09 00 00 00 00 '..........L.....'
  12 1e 01 04 a5 1e 13 78 03 62 2e a7 54 4d 9a 25 '.......x.b..TM.%'
  10 52 55 00 00 00 01 01 01 01 01 01 01 01 01 01 '.RU.............'
  01 01 01 01 01 01 9c 3e 80 c8 70 b0 3c 40 30 20 '.......>..p.<@0 '
  36 00 2e bc 10 00 00 1a 00 00 00 fd 00 1e 3c 4a '6.............<J'
  4a 10 01 0a 20 20 20 20 20 20 00 00 00 fe 00 42 'J...      .....B'
  4f 45 20 43 51 0a 20 20 20 20 20 20 00 00 00 fe 'OE CQ.      ....'
  00 4e 45 31 34 30 57 55 4d 2d 4e 36 32 0a 00 63 '.NE140WUM-N62..c'
Checksum: 0x63

----------------

Warnings:

Block 0, Base EDID:
  Missing Display Product Name.
EDID:
  Base EDID: Some timings are out of range of the Monitor Ranges:
    Horizontal Freq: 75.603 - 75.603 kHz (Monitor: 74.000 - 74.000 kHz)
    Maximum Clock: 160.280 MHz (Monitor: 160.000 MHz)

Failures:

Block 1, Base EDID:
  Unknown Extension Block.
EDID:
  Base EDID: EDID specified 0 extension block(s), but found 1 extension block(s).

EDID conformity: FAIL
