edid-decode (hex):

00 ff ff ff ff ff ff 00 1d 58 04 07 00 00 00 00
1c 1e 01 04 95 1f 11 78 02 42 a0 94 5d 5a 92 29
1f 50 54 00 00 00 01 01 01 01 01 01 01 01 01 01
01 01 01 01 01 01 b3 1d 56 de 50 00 1e 30 30 20
36 00 58 c2 10 00 00 1a 00 00 00 00 00 00 00 00
00 00 00 00 00 00 00 00 00 00 00 00 00 fe 00 57
49 44 45 43 4f 52 45 0a 20 20 20 20 00 00 00 fe
00 47 31 35 36 45 41 30 33 2d 41 00 20 0a 00 a5

----------------

Block 0, Base EDID:
  EDID Structure Version & Revision: 1.4
  Vendor & Product Identification:
    Manufacturer: GJX
    Model: 1796
    Made in: week 28 of 2020
  Basic Display Parameters & Features:
    Digital display
    Bits per primary color channel: 6
    DisplayPort interface
    Maximum image size: 31 cm x 17 cm
    Gamma: 2.20
    Supported color formats: RGB 4:4:4
    First detailed timing includes the native pixel format and preferred refresh rate
  Color Characteristics:
    Red  : 0.5791, 0.3632
    Green: 0.3515, 0.5722
    Blue : 0.1621, 0.1230
    White: 0.3125, 0.3281
  Established Timings I & II: none
  Standard Timings: none
  Detailed Timing Descriptors:
    DTD 1:  1366x768    59.997285 Hz 683:384   47.878 kHz     76.030000 MHz (344 mm x 194 mm)
                 Hfront   48 Hsync  32 Hback  142 Hpol P
                 Vfront    3 Vsync   6 Vback   21 Vpol N
    Empty Descriptor
    Alphanumeric Data String: 'WIDECORE'
    Alphanumeric Data String: 'G156EA03-A'
Checksum: 0xa5

----------------

Warnings:

Block 0, Base EDID:
  Missing Display Product Name.

Failures:

Block 0, Base EDID:
  Detailed Timing Descriptor #1: Mismatch of image size 344x194 mm vs display size 310x170 mm.
  Empty Descriptor: Use Dummy Descriptor instead of all zeroes.
  Alphanumeric Data String: NUL byte at position 10.
EDID:
  Base EDID: The DTD max image size is 344x194mm, which is larger than the display size 310.0x170.0mm.

EDID conformity: FAIL
