edid-decode (hex):

00 ff ff ff ff ff ff 00 10 ac bc 42 55 34 36 30
12 22 01 04 b5 36 1e 78 3b 08 75 a6 57 4e a3 26
0c 50 54 a5 4b 00 71 4f 81 00 81 80 b3 00 d1 c0
01 01 01 01 01 01 1a 36 80 a0 70 38 1f 40 30 20
35 00 1f 2e 21 00 00 1a 00 00 00 ff 00 44 31 31
52 4d 30 34 0a 20 20 20 20 20 00 00 00 fc 00 44
45 4c 4c 20 41 57 32 35 32 33 48 46 00 00 00 fd
0e 30 69 a2 a2 61 01 0a 20 20 20 20 20 20 02 90

02 03 38 f1 4d 3f 10 1f 22 20 05 27 2f 04 13 12
03 01 23 09 07 07 83 01 00 00 72 1a 00 00 03 01
30 f0 00 00 00 00 00 00 68 01 00 00 00 e3 05 c0
00 e6 06 05 01 60 56 48 44 9a 80 c8 70 38 31 40
30 20 35 00 1f 2e 21 00 00 1a 88 e9 80 c8 70 38
5f 40 30 20 35 00 1f 2e 21 00 00 1a 00 00 00 00
00 00 00 00 00 00 00 00 00 00 00 00 00 00 00 00
00 00 00 00 00 00 00 00 00 00 00 00 00 00 00 85

70 12 79 03 00 03 01 28 d9 2d 01 04 7f 07 c7 00
2f 80 1f 00 37 04 86 00 02 00 04 00 f2 55 01 04
7f 07 c7 00 2f 80 1f 00 37 04 42 00 02 00 04 00
00 00 00 00 00 00 00 00 00 00 00 00 00 00 00 00
00 00 00 00 00 00 00 00 00 00 00 00 00 00 00 00
00 00 00 00 00 00 00 00 00 00 00 00 00 00 00 00
00 00 00 00 00 00 00 00 00 00 00 00 00 00 00 00
00 00 00 00 00 00 00 00 00 00 00 00 00 00 6f 90

00 ff ff ff ff ff ff 00 10 ac bc 42 55 34 36 30
12 22 01 04 b5 36 1e 78 3b 08 75 a6 57 4e a3 26
0c 50 54 a5 4b 00 71 4f 81 00 81 80 b3 00 d1 c0
01 01 01 01 01 01 1a 36 80 a0 70 38 1f 40 30 20
35 00 1f 2e 21 00 00 1a 00 00 00 ff 00 44 31 31
52 4d 30 34 0a 20 20 20 20 20 00 00 00 fc 00 44
45 4c 4c 20 41 57 32 35 32 33 48 46 00 00 00 fd
0e 30 69 a2 a2 61 01 0a 20 20 20 20 20 20 02 90

02 03 38 f1 4d 3f 10 1f 22 20 05 27 2f 04 13 12
03 01 23 09 07 07 83 01 00 00 72 1a 00 00 03 01
30 f0 00 00 00 00 00 00 68 01 00 00 00 e3 05 c0
00 e6 06 05 01 60 56 48 44 9a 80 c8 70 38 31 40
30 20 35 00 1f 2e 21 00 00 1a 88 e9 80 c8 70 38
5f 40 30 20 35 00 1f 2e 21 00 00 1a 00 00 00 00
00 00 00 00 00 00 00 00 00 00 00 00 00 00 00 00
00 00 00 00 00 00 00 00 00 00 00 00 00 00 00 85

70 12 79 03 00 03 01 28 d9 2d 01 04 7f 07 c7 00
2f 80 1f 00 37 04 86 00 02 00 04 00 f2 55 01 04
7f 07 c7 00 2f 80 1f 00 37 04 42 00 02 00 04 00
00 00 00 00 00 00 00 00 00 00 00 00 00 00 00 00
00 00 00 00 00 00 00 00 00 00 00 00 00 00 00 00
00 00 00 00 00 00 00 00 00 00 00 00 00 00 00 00
00 00 00 00 00 00 00 00 00 00 00 00 00 00 00 00
00 00 00 00 00 00 00 00 00 00 00 00 00 00 6f 90

----------------

Block 0, Base EDID:
  EDID Structure Version & Revision: 1.4
  Vendor & Product Identification:
    Manufacturer: DEL
    Model: 17084
    Serial Number: ...
    Made in: week 18 of 2024
  Basic Display Parameters & Features:
    Digital display
    Bits per primary color channel: 10
    DisplayPort interface
    Maximum image size: 54 cm x 30 cm
    Gamma: 2.20
    DPMS levels: Off
    Supported color formats: RGB 4:4:4, YCrCb 4:4:4, YCrCb 4:2:2
    First detailed timing includes the native pixel format and preferred refresh rate
    Display supports continuous frequencies
  Color Characteristics:
    Red  : 0.6484, 0.3398
    Green: 0.3066, 0.6367
    Blue : 0.1494, 0.0498
    White: 0.3134, 0.3291
  Established Timings I & II:
    IBM     :   720x400    70.081663 Hz   9:5     31.467 kHz     28.320000 MHz
    DMT 0x04:   640x480    59.940476 Hz   4:3     31.469 kHz     25.175000 MHz
    DMT 0x06:   640x480    75.000000 Hz   4:3     37.500 kHz     31.500000 MHz
    DMT 0x09:   800x600    60.316541 Hz   4:3     37.879 kHz     40.000000 MHz
    DMT 0x0b:   800x600    75.000000 Hz   4:3     46.875 kHz     49.500000 MHz
    DMT 0x10:  1024x768    60.003840 Hz   4:3     48.363 kHz     65.000000 MHz
    DMT 0x12:  1024x768    75.028582 Hz   4:3     60.023 kHz     78.750000 MHz
    DMT 0x24:  1280x1024   75.024675 Hz   5:4     79.976 kHz    135.000000 MHz
  Standard Timings:
    DMT 0x15:  1152x864    75.000000 Hz   4:3     67.500 kHz    108.000000 MHz
    DMT 0x1c:  1280x800    59.810326 Hz  16:10    49.702 kHz     83.500000 MHz
    DMT 0x23:  1280x1024   60.019740 Hz   5:4     63.981 kHz    108.000000 MHz
    DMT 0x3a:  1680x1050   59.954250 Hz  16:10    65.290 kHz    146.250000 MHz
    DMT 0x52:  1920x1080   60.000000 Hz  16:9     67.500 kHz    148.500000 MHz
  Detailed Timing Descriptors:
    DTD 1:  1920x1080   59.933878 Hz  16:9     66.587 kHz    138.500000 MHz (543 mm x 302 mm)
                 Hfront   48 Hsync  32 Hback   80 Hpol P
                 Vfront    3 Vsync   5 Vback   23 Vpol N
    Display Product Serial Number: ...
    Display Product Name: 'DELL AW2523HF'
    Display Range Limits:
      Monitor ranges (Range Limits Only): 48-360 Hz V, 417-417 kHz H, max dotclock 970 MHz
  Extension blocks: 2
Checksum: 0x90

----------------

Block 1, CTA-861 Extension Block:
  Revision: 3
  Underscans IT Video Formats by default
  Basic audio support
  Supports YCbCr 4:4:4
  Supports YCbCr 4:2:2
  Native DTDs: 1
  Video Data Block:
    VIC  63:  1920x1080  120.000000 Hz  16:9    135.000 kHz    297.000000 MHz
    VIC  16:  1920x1080   60.000000 Hz  16:9     67.500 kHz    148.500000 MHz
    VIC  31:  1920x1080   50.000000 Hz  16:9     56.250 kHz    148.500000 MHz
    VIC  34:  1920x1080   30.000000 Hz  16:9     33.750 kHz     74.250000 MHz
    VIC  32:  1920x1080   24.000000 Hz  16:9     27.000 kHz     74.250000 MHz
    VIC   5:  1920x1080i  60.000000 Hz  16:9     33.750 kHz     74.250000 MHz
    VIC  39:  1920x1080i  50.000000 Hz  16:9     31.250 kHz     72.000000 MHz
    VIC  47:  1280x720   120.000000 Hz  16:9     90.000 kHz    148.500000 MHz
    VIC   4:  1280x720    60.000000 Hz  16:9     45.000 kHz     74.250000 MHz
    VIC  19:  1280x720    50.000000 Hz  16:9     37.500 kHz     74.250000 MHz
    VIC  18:   720x576    50.000000 Hz  16:9     31.250 kHz     27.000000 MHz
    VIC   3:   720x480    59.940060 Hz  16:9     31.469 kHz     27.000000 MHz
    VIC   1:   640x480    59.940476 Hz   4:3     31.469 kHz     25.175000 MHz
  Audio Data Block:
    Linear PCM:
      Max channels: 2
      Supported sample rates (kHz): 48 44.1 32
      Supported sample sizes (bits): 24 20 16
  Speaker Allocation Data Block:
    FL/FR - Front Left/Right
  Vendor-Specific Data Block (AMD), OUI 00-00-1A:
    Version: 3
    Flags 1: 0x01
      FreeSync Supported
    Minimum Refresh Rate: 48 Hz
    Maximum Refresh Rate: 360 Hz
    Flags 5: 0x00
  Colorimetry Data Block:
    BT2020YCC
    BT2020RGB
  HDR Static Metadata Data Block:
    Electro optical transfer functions:
      Traditional gamma - SDR luminance range
      SMPTE ST2084
    Supported static metadata descriptors:
      Static metadata type 1
    Desired content max luminance: 96 (400.000 cd/m^2)
    Desired content max frame-average luminance: 86 (322.098 cd/m^2)
    Desired content min luminance: 72 (0.319 cd/m^2)
  Detailed Timing Descriptors:
    DTD 2:  1920x1080  164.998245 Hz  16:9    186.283 kHz    394.920000 MHz (543 mm x 302 mm)
                 Hfront   48 Hsync  32 Hback  120 Hpol P
                 Vfront    3 Vsync   5 Vback   41 Vpol N
    DTD 3:  1920x1080  240.000000 Hz  16:9    282.000 kHz    597.840000 MHz (543 mm x 302 mm)
                 Hfront   48 Hsync  32 Hback  120 Hpol P
                 Vfront    3 Vsync   5 Vback   87 Vpol N
Checksum: 0x85  Unused space in Extension Block: 35 bytes

----------------

Block 2, DisplayID Extension Block:
  Version: 1.2
  Extension Count: 0
  Display Product Type: Standalone display device
  Video Timing Modes Type 1 - Detailed Timings Data Block:
    DTD:  1920x1080  300.000000 Hz  16:9    364.500 kHz    772.740000 MHz (aspect 16:9, no 3D stereo)
               Hfront   48 Hsync  32 Hback  120 Hpol P
               Vfront    3 Vsync   5 Vback  127 Vpol N
    DTD:  1920x1080  359.999836 Hz  16:9    412.920 kHz    875.390000 MHz (aspect 16:9, no 3D stereo)
               Hfront   48 Hsync  32 Hback  120 Hpol P
               Vfront    3 Vsync   5 Vback   59 Vpol N
  Checksum: 0x6f
Checksum: 0x90

----------------

Warnings:

Block 1, CTA-861 Extension Block:
  Video Data Block: VIC 63 and the first DTD are not identical. Is this intended?
  Colorimetry Data Block: Set the sRGB colorimetry bit to avoid interop issues.
  Display Product Serial Number is set, so the Serial Number in the Base EDID should be 0.
EDID:
  Base EDID: Some timings are out of range of the Monitor Ranges:
    Vertical Freq: 24.000 - 360.000 Hz (Monitor: 48.000 - 360.000 Hz)
    Horizontal Freq: 27.000 - 412.919 kHz (Monitor: 417.000 - 417.000 kHz)

Failures:

Block 1, CTA-861 Extension Block:
  Missing VCDB, needed for Set Selectable RGB Quantization to avoid interop issues.
EDID:
  Extension Block 3 started with EDID header, ignoring Extension Blocks >= 3.
  DisplayID: Missing DisplayID Display Parameters Data Block.
  DisplayID: DisplayID expects at least one preferred timing.

EDID conformity: FAIL
