edid-decode (hex):

00 ff ff ff ff ff ff 00 4c a3 45 51 00 00 00 00
00 12 01 03 80 21 15 78 0a 0a e5 97 57 54 8b 27
22 50 54 00 00 00 01 01 01 01 01 01 01 01 01 01
01 01 01 01 01 01 12 1b 00 88 50 20 10 30 10 30
13 00 4b cf 10 00 00 19 00 00 00 0f 00 00 00 00
00 00 00 00 00 23 87 02 64 00 00 00 00 fe 00 53
41 4d 53 55 4e 47 0a 20 20 20 20 20 00 00 00 fe
00 31 35 34 41 54 31 30 2d 33 30 31 20 0a 00 21

----------------

Block 0, Base EDID:
  EDID Structure Version & Revision: 1.3
  Vendor & Product Identification:
    Manufacturer: SEC
    Model: 20805
    Made in: 2008
  Basic Display Parameters & Features:
    Digital display
    Maximum image size: 33 cm x 21 cm
    Gamma: 2.20
    RGB color display
    First detailed timing is the preferred timing
  Color Characteristics:
    Red  : 0.5898, 0.3398
    Green: 0.3300, 0.5449
    Blue : 0.1552, 0.1347
    White: 0.3134, 0.3291
  Established Timings I & II: none
  Standard Timings: none
  Detailed Timing Descriptors:
    DTD 1:  1280x800    59.976321 Hz  16:10    48.941 kHz     69.300000 MHz (331 mm x 207 mm)
                 Hfront   16 Hsync  48 Hback   72 Hpol N
                 Vfront    1 Vsync   3 Vback   12 Vpol N
    Manufacturer-Specified Display Descriptor (0x0f): 00 0f 00 00 00 00 00 00 00 00 00 23 87 02 64 00 '...........#..d.'
    Alphanumeric Data String: 'SAMSUNG'
    Alphanumeric Data String: '154AT10-301 '
Checksum: 0x21

----------------

Failures:

Block 0, Base EDID:
  Alphanumeric Data String: One or more trailing spaces before newline.
  Missing Display Product Name.
  Missing Display Range Limits Descriptor.

EDID conformity: FAIL
