edid-decode (hex):

00 ff ff ff ff ff ff 00 38 a3 4f 69 01 01 01 01
30 1a 01 03 80 30 1b 78 ea eb f5 a6 56 51 9c 26
10 50 54 bf ef 80 81 00 81 40 81 80 81 c0 95 00
90 40 b3 00 a9 c0 02 3a 80 18 71 38 2d 40 58 2c
45 00 dc 0b 11 00 00 1e 00 00 00 fd 00 37 4c 1f
53 11 00 0a 20 20 20 20 20 20 00 00 00 fc 00 45
32 32 34 57 69 0a 20 20 20 20 20 20 00 00 00 ff
00 36 5a 35 30 37 31 35 35 4e 42 0a 20 20 01 84

02 01 04 00 66 21 56 aa 51 00 1e 30 46 8f 33 00
dc 0b 11 00 00 1e 01 1d 00 72 51 d0 1e 20 6e 28
55 00 dc 0b 11 00 00 1e 8c 0a d0 8a 20 e0 2d 10
10 3e 96 00 dc 0b 11 00 00 18 8c 0a d0 90 20 40
31 20 0c 40 55 00 dc 0b 11 00 00 18 01 1d 00 bc
52 d0 1e 20 b8 28 55 40 dc 0b 11 00 00 1e 00 00
00 00 00 00 00 00 00 00 00 00 00 00 00 00 00 00
00 00 00 00 00 00 00 00 00 00 00 00 00 00 00 87

00 ff ff ff ff ff ff 00 38 a3 4f 69 01 01 01 01
30 1a 01 03 80 30 1b 78 ea eb f5 a6 56 51 9c 26
10 50 54 bf ef 80 81 00 81 40 81 80 81 c0 95 00
90 40 b3 00 a9 c0 02 3a 80 18 71 38 2d 40 58 2c
45 00 dc 0b 11 00 00 1e 00 00 00 fd 00 37 4c 1f
53 11 00 0a 20 20 20 20 20 20 00 00 00 fc 00 45
32 32 34 57 69 0a 20 20 20 20 20 20 00 00 00 ff
00 36 5a 35 30 37 31 35 35 4e 42 0a 20 20 01 84

02 01 04 00 66 21 56 aa 51 00 1e 30 46 8f 33 00
dc 0b 11 00 00 1e 01 1d 00 72 51 d0 1e 20 6e 28
55 00 dc 0b 11 00 00 1e 8c 0a d0 8a 20 e0 2d 10
10 3e 96 00 dc 0b 11 00 00 18 8c 0a d0 90 20 40
31 20 0c 40 55 00 dc 0b 11 00 00 18 01 1d 00 bc
52 d0 1e 20 b8 28 55 40 dc 0b 11 00 00 1e 00 00
00 00 00 00 00 00 00 00 00 00 00 00 00 00 00 00
00 00 00 00 00 00 00 00 00 00 00 00 00 00 00 87

----------------

Block 0, Base EDID:
  EDID Structure Version & Revision: 1.3
  Vendor & Product Identification:
    Manufacturer: NEC
    Model: 26959
    Serial Number: ...
    Made in: week 48 of 2016
  Basic Display Parameters & Features:
    Digital display
    Maximum image size: 48 cm x 27 cm
    Gamma: 2.20
    DPMS levels: Standby Suspend Off
    RGB color display
    First detailed timing is the preferred timing
  Color Characteristics:
    Red  : 0.6513, 0.3378
    Green: 0.3183, 0.6123
    Blue : 0.1513, 0.0654
    White: 0.3134, 0.3291
  Established Timings I & II:
    IBM     :   720x400    70.081663 Hz   9:5     31.467 kHz     28.320000 MHz
    DMT 0x04:   640x480    59.940476 Hz   4:3     31.469 kHz     25.175000 MHz
    Apple   :   640x480    66.666667 Hz   4:3     35.000 kHz     30.240000 MHz
    DMT 0x05:   640x480    72.808802 Hz   4:3     37.861 kHz     31.500000 MHz
    DMT 0x06:   640x480    75.000000 Hz   4:3     37.500 kHz     31.500000 MHz
    DMT 0x08:   800x600    56.250000 Hz   4:3     35.156 kHz     36.000000 MHz
    DMT 0x09:   800x600    60.316541 Hz   4:3     37.879 kHz     40.000000 MHz
    DMT 0x0a:   800x600    72.187572 Hz   4:3     48.077 kHz     50.000000 MHz
    DMT 0x0b:   800x600    75.000000 Hz   4:3     46.875 kHz     49.500000 MHz
    Apple   :   832x624    74.551266 Hz   4:3     49.726 kHz     57.284000 MHz
    DMT 0x10:  1024x768    60.003840 Hz   4:3     48.363 kHz     65.000000 MHz
    DMT 0x11:  1024x768    70.069359 Hz   4:3     56.476 kHz     75.000000 MHz
    DMT 0x12:  1024x768    75.028582 Hz   4:3     60.023 kHz     78.750000 MHz
    DMT 0x24:  1280x1024   75.024675 Hz   5:4     79.976 kHz    135.000000 MHz
    Apple   :  1152x870    75.061550 Hz 192:145   68.681 kHz    100.000000 MHz
  Standard Timings:
    DMT 0x1c:  1280x800    59.810326 Hz  16:10    49.702 kHz     83.500000 MHz
    DMT 0x20:  1280x960    60.000000 Hz   4:3     60.000 kHz    108.000000 MHz
    DMT 0x23:  1280x1024   60.019740 Hz   5:4     63.981 kHz    108.000000 MHz
    DMT 0x55:  1280x720    60.000000 Hz  16:9     45.000 kHz     74.250000 MHz
    DMT 0x2f:  1440x900    59.887445 Hz  16:10    55.935 kHz    106.500000 MHz
    DMT 0x2a:  1400x1050   59.978442 Hz   4:3     65.317 kHz    121.750000 MHz
    DMT 0x3a:  1680x1050   59.954250 Hz  16:10    65.290 kHz    146.250000 MHz
    DMT 0x53:  1600x900    60.000000 Hz  16:9     60.000 kHz    108.000000 MHz (RB)
  Detailed Timing Descriptors:
    DTD  1:  1920x1080   60.000000 Hz  16:9     67.500 kHz    148.500000 MHz (476 mm x 267 mm)
                  Hfront   88 Hsync  44 Hback  148 Hpol P
                  Vfront    4 Vsync   5 Vback   36 Vpol P
    Display Range Limits:
      Monitor ranges (GTF): 55-76 Hz V, 31-83 kHz H, max dotclock 170 MHz
    Display Product Name: 'E224Wi'
    Display Product Serial Number: ...
  Extension blocks: 1
Checksum: 0x84

----------------

Block 1, CTA-861 Extension Block:
  Revision: 1
  Detailed Timing Descriptors:
    DTD  2:  1366x768    59.789541 Hz 683:384   47.712 kHz     85.500000 MHz (476 mm x 267 mm)
                  Hfront   70 Hsync 143 Hback  213 Hpol P
                  Vfront    3 Vsync   3 Vback   24 Vpol P
    DTD  3:  1280x720    60.000000 Hz  16:9     45.000 kHz     74.250000 MHz (476 mm x 267 mm)
                  Hfront  110 Hsync  40 Hback  220 Hpol P
                  Vfront    5 Vsync   5 Vback   20 Vpol P
    DTD  4:   720x480    59.940060 Hz   3:2     31.469 kHz     27.000000 MHz (476 mm x 267 mm)
                  Hfront   16 Hsync  62 Hback   60 Hpol N
                  Vfront    9 Vsync   6 Vback   30 Vpol N
    DTD  5:   720x576    50.000000 Hz   5:4     31.250 kHz     27.000000 MHz (476 mm x 267 mm)
                  Hfront   12 Hsync  64 Hback   68 Hpol N
                  Vfront    5 Vsync   5 Vback   39 Vpol N
    DTD  6:  1280x720    50.000000 Hz  16:9     37.500 kHz     74.250000 MHz (476 mm x 267 mm)
                  Hfront  440 Hsync  40 Hback  220 Hpol P
                  Vfront    5 Vsync   5 Vback   20 Vpol P
Checksum: 0x87  Unused space in Extension Block: 33 bytes

----------------

Block 2, Unknown EDID Extension Block 0x00:
  00 ff ff ff ff ff ff 00 38 a3 4f 69 01 01 01 01 '........8.Oi....'
  30 1a 01 03 80 30 1b 78 ea eb f5 a6 56 51 9c 26 '0....0.x....VQ.&'
  10 50 54 bf ef 80 81 00 81 40 81 80 81 c0 95 00 '.PT......@......'
  90 40 b3 00 a9 c0 02 3a 80 18 71 38 2d 40 58 2c '.@.....:..q8-@X,'
  45 00 dc 0b 11 00 00 1e 00 00 00 fd 00 37 4c 1f 'E............7L.'
  53 11 00 0a 20 20 20 20 20 20 00 00 00 fc 00 45 'S...      .....E'
  32 32 34 57 69 0a 20 20 20 20 20 20 00 00 00 ff '224Wi.      ....'
  00 36 5a 35 30 37 31 35 35 4e 42 0a 20 20 01 84 '.6Z507155NB.  ..'
Checksum: 0x84

----------------

Block 3, CTA-861 Extension Block:
  Revision: 1
  Detailed Timing Descriptors:
    DTD  7:  1366x768    59.789541 Hz 683:384   47.712 kHz     85.500000 MHz (476 mm x 267 mm)
                  Hfront   70 Hsync 143 Hback  213 Hpol P
                  Vfront    3 Vsync   3 Vback   24 Vpol P
    DTD  8:  1280x720    60.000000 Hz  16:9     45.000 kHz     74.250000 MHz (476 mm x 267 mm)
                  Hfront  110 Hsync  40 Hback  220 Hpol P
                  Vfront    5 Vsync   5 Vback   20 Vpol P
    DTD  9:   720x480    59.940060 Hz   3:2     31.469 kHz     27.000000 MHz (476 mm x 267 mm)
                  Hfront   16 Hsync  62 Hback   60 Hpol N
                  Vfront    9 Vsync   6 Vback   30 Vpol N
    DTD 10:   720x576    50.000000 Hz   5:4     31.250 kHz     27.000000 MHz (476 mm x 267 mm)
                  Hfront   12 Hsync  64 Hback   68 Hpol N
                  Vfront    5 Vsync   5 Vback   39 Vpol N
    DTD 11:  1280x720    50.000000 Hz  16:9     37.500 kHz     74.250000 MHz (476 mm x 267 mm)
                  Hfront  440 Hsync  40 Hback  220 Hpol P
                  Vfront    5 Vsync   5 Vback   20 Vpol P
Checksum: 0x87  Unused space in Extension Block: 33 bytes

----------------

Warnings:

Block 0, Base EDID:
  Vendor & Product Identification: The serial number is one of the known dummy values, it should probably be set to 0.
  Detailed Timing Descriptor #1: DTD is identical to VIC 16, which is not present in the CTA Ext Block.
Block 1, CTA-861 Extension Block:
  Detailed Timing Descriptor #3: DTD is identical to VIC 4, which is not present in the CTA Ext Block.
  Detailed Timing Descriptor #4: Image size is 476x267 mm, but based on the picture AR it should be 476x317 mm.
  Detailed Timing Descriptor #5: Image size is 476x267 mm, but based on the picture AR it should be 476x380 mm.
  Detailed Timing Descriptor #6: DTD is identical to VIC 19, which is not present in the CTA Ext Block.
  Display Product Serial Number is set, so the Serial Number in the Base EDID should be 0.
  Add a Colorimetry Data Block with the sRGB colorimetry bit set to avoid interop issues.
Block 3, CTA-861 Extension Block:
  Detailed Timing Descriptor #8: DTD is identical to VIC 4, which is not present in the CTA Ext Block.
  Detailed Timing Descriptor #9: Image size is 476x267 mm, but based on the picture AR it should be 476x317 mm.
  Detailed Timing Descriptor #10: Image size is 476x267 mm, but based on the picture AR it should be 476x380 mm.
  Detailed Timing Descriptor #11: DTD is identical to VIC 19, which is not present in the CTA Ext Block.
EDID:
  Base EDID: Some timings are out of range of the Monitor Ranges:
    Vertical Freq: 50.000 - 75.062 Hz (Monitor: 55.000 - 76.000 Hz)

Failures:

Block 1, CTA-861 Extension Block:
  Missing VCDB, needed for Set Selectable RGB Quantization to avoid interop issues.
Block 2, Base EDID:
  Unknown Extension Block.
EDID:
  Base EDID: EDID specified 1 extension block(s), but found 3 extension block(s).
  Base EDID: EDID 1.3 requires a Block Map Extension in Block 1 if there are more than 2 blocks in the EDID.

EDID conformity: FAIL
