edid-decode (hex):

00 ff ff ff ff ff ff 00 1e f9 13 00 01 01 01 01
00 09 01 01 0e 24 1b 82 e8 00 b9 a0 57 49 9b 26
10 48 4c ff ef 80 a9 4f 81 99 61 59 61 40 45 59
45 40 3b ca 31 59 1a 4f 40 30 62 b0 32 40 40 c0
13 00 68 0e 11 00 00 1e 00 00 00 fd 00 32 a0 1e
5f ff 00 0a 20 20 20 20 20 20 00 00 00 fc 00 47
41 54 45 57 41 59 20 56 58 39 30 30 00 00 00 ff
00 20 20 20 20 20 20 20 20 20 20 20 20 20 00 ed

00 ff ff ff ff ff ff 00 1e f9 13 00 01 01 01 01
00 09 01 01 0e 24 1b 82 e8 00 b9 a0 57 49 9b 26
10 48 4c ff ef 80 a9 4f 81 99 61 59 61 40 45 59
45 40 3b ca 31 59 1a 4f 40 30 62 b0 32 40 40 c0
13 00 68 0e 11 00 00 1e 00 00 00 fd 00 32 a0 1e
5f ff 00 0a 20 20 20 20 20 20 00 00 00 fc 00 47
41 54 45 57 41 59 20 56 58 39 30 30 00 00 00 ff
00 20 20 20 20 20 20 20 20 20 20 20 20 20 00 ed

----------------

Block 0, Base EDID:
  EDID Structure Version & Revision: 1.1
  Vendor & Product Identification:
    Manufacturer: GWY
    Model: 19
    Serial Number: ...
    Made in: 1999
  Basic Display Parameters & Features:
    Analog display
    Signal Level Standard: 0.700 : 0.300 : 1.000 V p-p
    Blank level equals black level
    Sync: Separate Composite SyncOnGreen
    Maximum image size: 36 cm x 27 cm
    Gamma: 2.30
    DPMS levels: Standby Suspend Off
    RGB color display
  Color Characteristics:
    Red  : 0.6250, 0.3398
    Green: 0.2851, 0.6054
    Blue : 0.1503, 0.0654
    White: 0.2832, 0.2978
  Established Timings I & II:
    IBM     :   720x400    70.081663 Hz   9:5     31.467 kHz     28.320000 MHz
    IBM     :   720x400    87.849542 Hz   9:5     39.444 kHz     35.500000 MHz
    DMT 0x04:   640x480    59.940476 Hz   4:3     31.469 kHz     25.175000 MHz
    Apple   :   640x480    66.666667 Hz   4:3     35.000 kHz     30.240000 MHz
    DMT 0x05:   640x480    72.808802 Hz   4:3     37.861 kHz     31.500000 MHz
    DMT 0x06:   640x480    75.000000 Hz   4:3     37.500 kHz     31.500000 MHz
    DMT 0x08:   800x600    56.250000 Hz   4:3     35.156 kHz     36.000000 MHz
    DMT 0x09:   800x600    60.316541 Hz   4:3     37.879 kHz     40.000000 MHz
    DMT 0x0a:   800x600    72.187572 Hz   4:3     48.077 kHz     50.000000 MHz
    DMT 0x0b:   800x600    75.000000 Hz   4:3     46.875 kHz     49.500000 MHz
    Apple   :   832x624    74.551266 Hz   4:3     49.726 kHz     57.284000 MHz
    DMT 0x10:  1024x768    60.003840 Hz   4:3     48.363 kHz     65.000000 MHz
    DMT 0x11:  1024x768    70.069359 Hz   4:3     56.476 kHz     75.000000 MHz
    DMT 0x12:  1024x768    75.028582 Hz   4:3     60.023 kHz     78.750000 MHz
    DMT 0x24:  1280x1024   75.024675 Hz   5:4     79.976 kHz    135.000000 MHz
    Apple   :  1152x870    75.061550 Hz 192:145   68.681 kHz    100.000000 MHz
  Standard Timings:
    DMT 0x36:  1600x1200   75.000000 Hz   4:3     93.750 kHz    202.500000 MHz
    DMT 0x25:  1280x1024   85.024098 Hz   5:4     91.146 kHz    157.500000 MHz
    DMT 0x13:  1024x768    84.996690 Hz   4:3     68.677 kHz     94.500000 MHz
    DMT 0x10:  1024x768    60.003840 Hz   4:3     48.363 kHz     65.000000 MHz
    DMT 0x0c:   800x600    85.061274 Hz   4:3     53.674 kHz     56.250000 MHz
    DMT 0x09:   800x600    60.316541 Hz   4:3     37.879 kHz     40.000000 MHz
    Unknown :   720x405    70.000 Hz  16:9
    DMT 0x07:   640x480    85.008312 Hz   4:3     43.269 kHz     36.000000 MHz
  Detailed Timing Descriptors:
    DTD 1:  1600x1200   75.000000 Hz   4:3     93.750 kHz    202.500000 MHz (360 mm x 270 mm)
                 Hfront   64 Hsync 192 Hback  304 Hpol P
                 Vfront    1 Vsync   3 Vback   46 Vpol P
    Display Range Limits:
      Monitor ranges (GTF): 50-160 Hz V, 30-95 kHz H, max dotclock 2550 MHz
    Display Product Name: 'GATEWAY VX900'
    Display Product Serial Number: ...
Checksum: 0xed

----------------

Warnings:

Block 0, Base EDID:
  EDID Structure Version & Revision: EDID 1.1 is deprecated, do not use.
  Vendor & Product Identification: The serial number is one of the known dummy values, it should probably be set to 0.
  Standard Timings: Standard Timing 720x405 has a dubious odd vertical resolution.
  Display Product Serial Number: ...

Failures:

Block 0, Base EDID:
  Display Product Serial Number: ...
EDID:
  Extension Block 1 started with EDID header, ignoring Extension Blocks >= 1.

EDID conformity: FAIL
