edid-decode (hex):

00 ff ff ff ff ff ff 00 4c f4 00 19 0a 1a 00 00
01 20 01 03 80 2b 16 78 ea dd 75 a5 53 38 ae 25
0d 4f 53 a9 4f 00 81 00 81 40 90 40 61 40 81 80
81 c0 95 00 45 40 9a 29 a0 d0 51 84 22 30 50 98
36 00 98 ff 10 00 00 1c 1a 34 a0 d0 51 84 22 30
50 98 36 00 90 0e 11 00 00 1e 66 21 56 aa 51 00
1e 30 46 8f 33 00 90 0e 11 00 00 1e 00 00 00 fc
00 0a 20 20 20 20 20 20 20 20 20 20 20 20 00 aa

00 ff ff ff ff ff ff 00 4c f4 00 19 0a 1a 00 00
01 20 01 03 80 2b 16 78 ea dd 75 a5 53 38 ae 25
0d 4f 53 a9 4f 00 81 00 81 40 90 40 61 40 81 80
81 c0 95 00 45 40 9a 29 a0 d0 51 84 22 30 50 98
36 00 98 ff 10 00 00 1c 1a 34 a0 d0 51 84 22 30
50 98 36 00 90 0e 11 00 00 1e 66 21 56 aa 51 00
1e 30 46 8f 33 00 90 0e 11 00 00 1e 00 00 00 fc
00 0a 20 20 20 20 20 20 20 20 20 20 20 20 00 aa

----------------

Block 0, Base EDID:
  EDID Structure Version & Revision: 1.3
  Vendor & Product Identification:
    Manufacturer: SGT
    Model: 6400
    Serial Number: ...
    Made in: week 1 of 2022
  Basic Display Parameters & Features:
    Digital display
    Maximum image size: 43 cm x 22 cm
    Gamma: 2.20
    DPMS levels: Standby Suspend Off
    RGB color display
    First detailed timing is the preferred timing
  Color Characteristics:
    Red  : 0.6474, 0.3251
    Green: 0.2216, 0.6806
    Blue : 0.1455, 0.0537
    White: 0.3095, 0.3251
  Established Timings I & II:
    IBM     :   720x400    70.081663 Hz   9:5     31.467 kHz     28.320000 MHz
    DMT 0x04:   640x480    59.940476 Hz   4:3     31.469 kHz     25.175000 MHz
    DMT 0x05:   640x480    72.808802 Hz   4:3     37.861 kHz     31.500000 MHz
    DMT 0x09:   800x600    60.316541 Hz   4:3     37.879 kHz     40.000000 MHz
    DMT 0x0b:   800x600    75.000000 Hz   4:3     46.875 kHz     49.500000 MHz
    DMT 0x10:  1024x768    60.003840 Hz   4:3     48.363 kHz     65.000000 MHz
    DMT 0x11:  1024x768    70.069359 Hz   4:3     56.476 kHz     75.000000 MHz
    DMT 0x12:  1024x768    75.028582 Hz   4:3     60.023 kHz     78.750000 MHz
    DMT 0x24:  1280x1024   75.024675 Hz   5:4     79.976 kHz    135.000000 MHz
  Standard Timings:
    DMT 0x1c:  1280x800    59.810326 Hz  16:10    49.702 kHz     83.500000 MHz
    DMT 0x20:  1280x960    60.000000 Hz   4:3     60.000 kHz    108.000000 MHz
    DMT 0x2a:  1400x1050   59.978442 Hz   4:3     65.317 kHz    121.750000 MHz
    DMT 0x10:  1024x768    60.003840 Hz   4:3     48.363 kHz     65.000000 MHz
    DMT 0x23:  1280x1024   60.019740 Hz   5:4     63.981 kHz    108.000000 MHz
    DMT 0x55:  1280x720    60.000000 Hz  16:9     45.000 kHz     74.250000 MHz
    DMT 0x2f:  1440x900    59.887445 Hz  16:10    55.935 kHz    106.500000 MHz
    DMT 0x09:   800x600    60.316541 Hz   4:3     37.879 kHz     40.000000 MHz
  Detailed Timing Descriptors:
    DTD 1:  1440x900    59.887445 Hz  16:10    55.935 kHz    106.500000 MHz (408 mm x 255 mm)
                 Hfront   80 Hsync 152 Hback  232 Hpol N
                 Vfront    3 Vsync   6 Vback   25 Vpol P
    DTD 2:  1440x900    75.002699 Hz  16:10    70.053 kHz    133.380000 MHz (400 mm x 270 mm)
                 Hfront   80 Hsync 152 Hback  232 Hpol P
                 Vfront    3 Vsync   6 Vback   25 Vpol P
    DTD 3:  1366x768    59.789541 Hz 683:384   47.712 kHz     85.500000 MHz (400 mm x 270 mm)
                 Hfront   70 Hsync 143 Hback  213 Hpol P
                 Vfront    3 Vsync   3 Vback   24 Vpol P
    Display Product Name: ''
Checksum: 0xaa

----------------

Warnings:

Block 0, Base EDID:
  Vendor & Product Identification: The serial number is one of the known dummy values, it should probably be set to 0.
  Detailed Timing Descriptor #2: Image size is 400x270 mm, but based on the picture AR it should be 400x250 mm.
  Detailed Timing Descriptor #3: Image size is 400x270 mm, but based on the picture AR it should be 400x224 mm.

Failures:

Block 0, Base EDID:
  Detailed Timing Descriptor #1: Mismatch of image size 408x255 mm vs display size 430x220 mm.
  Detailed Timing Descriptor #2: Mismatch of image size 400x270 mm vs display size 430x220 mm.
  Detailed Timing Descriptor #3: Mismatch of image size 400x270 mm vs display size 430x220 mm.
  Display Product Name: Empty string.
  Missing Display Range Limits Descriptor.
EDID:
  Extension Block 1 started with EDID header, ignoring Extension Blocks >= 1.
  Base EDID: The DTD max image size is 408x270mm, which is larger than the display size 430.0x220.0mm.

EDID conformity: FAIL
