edid-decode (hex):

00 ff ff ff ff ff ff 00 4c f4 50 19 0a 1a 00 00
01 21 01 03 80 2c 17 78 2a 31 86 a8 52 46 97 23
1b 4c 58 bf ef 00 a9 c0 95 00 81 80 81 40 81 c0
81 00 01 01 01 01 2f 26 40 a0 60 84 1a 30 30 20
35 00 b8 e6 10 00 00 1e bf 2f 40 a0 60 84 1a 30
18 50 13 00 ba f9 10 00 00 1a 00 00 00 fd 00 32
4c 1e 53 11 00 0a 20 20 20 20 20 20 00 00 00 fc
00 0a 20 20 20 20 20 20 20 20 20 20 20 20 00 b5

00 ff ff ff ff ff ff 00 4c f4 50 19 0a 1a 00 00
01 21 01 03 80 2c 17 78 2a 31 86 a8 52 46 97 23
1b 4c 58 bf ef 00 a9 c0 95 00 81 80 81 40 81 c0
81 00 01 01 01 01 2f 26 40 a0 60 84 1a 30 30 20
35 00 b8 e6 10 00 00 1e bf 2f 40 a0 60 84 1a 30
18 50 13 00 ba f9 10 00 00 1a 00 00 00 fd 00 32
4c 1e 53 11 00 0a 20 20 20 20 20 20 00 00 00 fc
00 0a 20 20 20 20 20 20 20 20 20 20 20 20 00 b5

----------------

Block 0, Base EDID:
  EDID Structure Version & Revision: 1.3
  Vendor & Product Identification:
    Manufacturer: SGT
    Model: 6480
    Serial Number: ...
    Made in: week 1 of 2023
  Basic Display Parameters & Features:
    Digital display
    Maximum image size: 44 cm x 23 cm
    Gamma: 2.20
    DPMS levels: Off
    RGB color display
    First detailed timing is the preferred timing
  Color Characteristics:
    Red  : 0.6562, 0.3232
    Green: 0.2734, 0.5908
    Blue : 0.1386, 0.1054
    White: 0.2978, 0.3457
  Established Timings I & II:
    IBM     :   720x400    70.081663 Hz   9:5     31.467 kHz     28.320000 MHz
    DMT 0x04:   640x480    59.940476 Hz   4:3     31.469 kHz     25.175000 MHz
    Apple   :   640x480    66.666667 Hz   4:3     35.000 kHz     30.240000 MHz
    DMT 0x05:   640x480    72.808802 Hz   4:3     37.861 kHz     31.500000 MHz
    DMT 0x06:   640x480    75.000000 Hz   4:3     37.500 kHz     31.500000 MHz
    DMT 0x08:   800x600    56.250000 Hz   4:3     35.156 kHz     36.000000 MHz
    DMT 0x09:   800x600    60.316541 Hz   4:3     37.879 kHz     40.000000 MHz
    DMT 0x0a:   800x600    72.187572 Hz   4:3     48.077 kHz     50.000000 MHz
    DMT 0x0b:   800x600    75.000000 Hz   4:3     46.875 kHz     49.500000 MHz
    Apple   :   832x624    74.551266 Hz   4:3     49.726 kHz     57.284000 MHz
    DMT 0x10:  1024x768    60.003840 Hz   4:3     48.363 kHz     65.000000 MHz
    DMT 0x11:  1024x768    70.069359 Hz   4:3     56.476 kHz     75.000000 MHz
    DMT 0x12:  1024x768    75.028582 Hz   4:3     60.023 kHz     78.750000 MHz
    DMT 0x24:  1280x1024   75.024675 Hz   5:4     79.976 kHz    135.000000 MHz
  Standard Timings:
    DMT 0x53:  1600x900    60.000000 Hz  16:9     60.000 kHz    108.000000 MHz (RB)
    DMT 0x2f:  1440x900    59.887445 Hz  16:10    55.935 kHz    106.500000 MHz
    DMT 0x23:  1280x1024   60.019740 Hz   5:4     63.981 kHz    108.000000 MHz
    DMT 0x20:  1280x960    60.000000 Hz   4:3     60.000 kHz    108.000000 MHz
    DMT 0x55:  1280x720    60.000000 Hz  16:9     45.000 kHz     74.250000 MHz
    DMT 0x1c:  1280x800    59.810326 Hz  16:10    49.702 kHz     83.500000 MHz
  Detailed Timing Descriptors:
    DTD 1:  1600x900    59.978156 Hz  16:9     55.540 kHz     97.750000 MHz (440 mm x 230 mm)
                 Hfront   48 Hsync  32 Hback   80 Hpol P
                 Vfront    3 Vsync   5 Vback   18 Vpol P
    DTD 2:  1600x900    74.998773 Hz  16:9     69.449 kHz    122.230000 MHz (442 mm x 249 mm)
                 Hfront   24 Hsync  80 Hback   56 Hpol P
                 Vfront    1 Vsync   3 Vback   22 Vpol N
    Display Range Limits:
      Monitor ranges (GTF): 50-76 Hz V, 30-83 kHz H, max dotclock 170 MHz
    Display Product Name: ''
Checksum: 0xb5

----------------

Warnings:

Block 0, Base EDID:
  Vendor & Product Identification: The serial number is one of the known dummy values, it should probably be set to 0.
  Detailed Timing Descriptor #1: Image size is 440x230 mm, but based on the picture AR it should be 408x230 mm.

Failures:

Block 0, Base EDID:
  Detailed Timing Descriptor #2: Mismatch of image size 442x249 mm vs display size 440x230 mm.
  Display Product Name: Empty string.
EDID:
  Extension Block 1 started with EDID header, ignoring Extension Blocks >= 1.
  Base EDID: The DTD max image size is 442x249mm, which is larger than the display size 440.0x230.0mm.

EDID conformity: FAIL
