edid-decode (hex):

00 ff ff ff ff ff ff 00 06 af a0 9a 00 00 00 00
2b 1f 01 04 a5 26 16 78 03 1a b5 a8 54 46 9d 25
0d 50 54 00 00 00 01 01 01 01 01 01 01 01 01 01
01 01 01 01 01 01 34 9e 80 a0 70 38 70 48 30 20
a5 00 7e d7 10 00 00 18 00 00 00 0f 00 00 00 00
00 00 00 00 00 00 00 00 00 20 00 00 00 fd 00 3c
a5 c3 c3 29 01 0a 20 20 20 20 20 20 00 00 00 fe
00 42 31 37 33 48 41 4e 30 35 2e 35 20 0a 01 e8

70 20 79 02 00 22 00 14 07 2e 06 84 7f 07 9f 00
2f 80 1f 00 37 04 63 00 09 00 04 00 25 00 09 07
2e 06 07 2e 06 3c a5 80 81 00 10 72 1a 00 00 03
01 3c a5 00 00 60 50 60 50 a5 00 00 00 00 00 00
00 00 00 00 00 00 00 00 00 00 00 00 00 00 00 00
00 00 00 00 00 00 00 00 00 00 00 00 00 00 00 00
00 00 00 00 00 00 00 00 00 00 00 00 00 00 00 00
00 00 00 00 00 00 00 00 00 00 00 00 00 00 c6 90

00 ff ff ff ff ff ff 00 06 af a0 9a 00 00 00 00
2b 1f 01 04 a5 26 16 78 03 1a b5 a8 54 46 9d 25
0d 50 54 00 00 00 01 01 01 01 01 01 01 01 01 01
01 01 01 01 01 01 34 9e 80 a0 70 38 70 48 30 20
a5 00 7e d7 10 00 00 18 00 00 00 0f 00 00 00 00
00 00 00 00 00 00 00 00 00 20 00 00 00 fd 00 3c
a5 c3 c3 29 01 0a 20 20 20 20 20 20 00 00 00 fe
00 42 31 37 33 48 41 4e 30 35 2e 35 20 0a 01 e8

70 20 79 02 00 22 00 14 07 2e 06 84 7f 07 9f 00
2f 80 1f 00 37 04 63 00 09 00 04 00 25 00 09 07
2e 06 07 2e 06 3c a5 80 81 00 10 72 1a 00 00 03
01 3c a5 00 00 60 50 60 50 a5 00 00 00 00 00 00
00 00 00 00 00 00 00 00 00 00 00 00 00 00 00 00
00 00 00 00 00 00 00 00 00 00 00 00 00 00 00 00
00 00 00 00 00 00 00 00 00 00 00 00 00 00 00 00
00 00 00 00 00 00 00 00 00 00 00 00 00 00 c6 90

----------------

Block 0, Base EDID:
  EDID Structure Version & Revision: 1.4
  Vendor & Product Identification:
    Manufacturer: AUO
    Model: 39584
    Made in: week 43 of 2021
  Basic Display Parameters & Features:
    Digital display
    Bits per primary color channel: 8
    DisplayPort interface
    Maximum image size: 38 cm x 22 cm
    Gamma: 2.20
    Supported color formats: RGB 4:4:4
    First detailed timing includes the native pixel format and preferred refresh rate
    Display supports continuous frequencies
  Color Characteristics:
    Red  : 0.6562, 0.3291
    Green: 0.2753, 0.6152
    Blue : 0.1464, 0.0537
    White: 0.3134, 0.3291
  Established Timings I & II: none
  Standard Timings: none
  Detailed Timing Descriptors:
    DTD 1:  1920x1080   60.096154 Hz  16:9    194.712 kHz    405.000000 MHz (382 mm x 215 mm)
                 Hfront   48 Hsync  32 Hback   80 Hpol N
                 Vfront   10 Vsync   5 Vback 2145 Vpol N
    Manufacturer-Specified Display Descriptor (0x0f): 00 0f 00 00 00 00 00 00 00 00 00 00 00 00 00 20 '............... '
    Display Range Limits:
      Monitor ranges (Range Limits Only): 60-165 Hz V, 195-195 kHz H, max dotclock 410 MHz
    Alphanumeric Data String: 'B173HAN05.5 '
  Extension blocks: 1
Checksum: 0xe8

----------------

Block 1, DisplayID Extension Block:
  Version: 2.0
  Extension Count: 0
  Display Product Primary Use Case: None of the listed primary use cases; generic display
  Video Timing Modes Type 7 - Detailed Timings Data Block:
    DTD:  1920x1080  165.009778 Hz  16:9    194.712 kHz    405.000000 MHz (aspect 16:9, no 3D stereo, preferred)
               Hfront   48 Hsync  32 Hback   80 Hpol P
               Vfront   10 Vsync   5 Vback   85 Vpol N
  Dynamic Video Timing Range Limits Data Block:
    Minimum Pixel Clock: 405000 kHz
    Maximum Pixel Clock: 405000 kHz
    Minimum Vertical Refresh Rate: 60 Hz
    Maximum Vertical Refresh Rate: 165 Hz
    Seamless Dynamic Video Timing Support: Yes
  CTA-861 DisplayID Data Block:
  Vendor-Specific Data Block (AMD), OUI 00-00-1A:
    Version: 3
    Feature Caps: 0x01
    Minimum Refresh Rate: 60 Hz
    Maximum Refresh Rate: 165 Hz
    Flags 1.x: 0x00
    Flags 2.x: 0x00
  Checksum: 0xc6
Checksum: 0x90

----------------

Warnings:

Block 0, Base EDID:
  Missing Display Product Name.

Failures:

Block 0, Base EDID:
  Alphanumeric Data String: One or more trailing spaces before newline.
Block 1, DisplayID Extension Block:
  Vendor-Specific Data Block (AMD), OUI 00-00-1A: Length is 16 instead of 19.
EDID:
  Extension Block 2 started with EDID header, ignoring Extension Blocks >= 2.
  DisplayID: Missing DisplayID Display Parameters Data Block.

EDID conformity: FAIL
