edid-decode (hex):

00 ff ff ff ff ff ff 00 51 b8 07 20 30 48 54 46
1f 21 01 04 b5 1e 14 78 07 ee 95 a3 54 4c 99 26
0f 50 54 00 00 00 01 01 01 01 01 01 01 01 01 01
01 01 01 01 01 01 9d df d8 a0 90 90 58 67 30 20
36 00 2c c8 10 00 00 18 9d df d8 a0 90 90 64 60
30 20 36 00 2c c8 10 00 00 18 00 00 00 fd 00 30
78 d6 d6 3a 00 0a 20 20 20 20 20 20 00 00 00 fc
00 54 4c 31 34 32 47 56 58 50 31 32 2d 30 00 55

00 ff ff ff ff ff ff 00 51 b8 07 20 30 48 54 46
1f 21 01 04 b5 1e 14 78 07 ee 95 a3 54 4c 99 26
0f 50 54 00 00 00 01 01 01 01 01 01 01 01 01 01
01 01 01 01 01 01 9d df d8 a0 90 90 58 67 30 20
36 00 2c c8 10 00 00 18 9d df d8 a0 90 90 64 60
30 20 36 00 2c c8 10 00 00 18 00 00 00 fd 00 30
78 d6 d6 3a 00 0a 20 20 20 20 20 20 00 00 00 fc
00 54 4c 31 34 32 47 56 58 50 31 32 2d 30 00 55

----------------

Block 0, Base EDID:
  EDID Structure Version & Revision: 1.4
  Vendor & Product Identification:
    Manufacturer: TMX
    Model: 8199
    Serial Number: ...
    Made in: week 31 of 2023
  Basic Display Parameters & Features:
    Digital display
    Bits per primary color channel: 10
    DisplayPort interface
    Maximum image size: 30 cm x 20 cm
    Gamma: 2.20
    Supported color formats: RGB 4:4:4
    Default (sRGB) color space is primary color space
    First detailed timing includes the native pixel format and preferred refresh rate
    Display supports continuous frequencies
  Color Characteristics:
    Red  : 0.6396, 0.3300
    Green: 0.2998, 0.5996
    Blue : 0.1503, 0.0595
    White: 0.3134, 0.3291
  Established Timings I & II: none
  Standard Timings: none
  Detailed Timing Descriptors:
    DTD 1:  2520x1680   60.000210 Hz   3:2    213.601 kHz    572.450000 MHz (300 mm x 200 mm)
                 Hfront   48 Hsync  32 Hback   80 Hpol N
                 Vfront    3 Vsync   6 Vback 1871 Vpol N
    DTD 2:  2520x1680  120.000419 Hz   3:2    213.601 kHz    572.450000 MHz (300 mm x 200 mm)
                 Hfront   48 Hsync  32 Hback   80 Hpol N
                 Vfront    3 Vsync   6 Vback   91 Vpol N
    Display Range Limits:
      Monitor ranges (GTF): 48-120 Hz V, 214-214 kHz H, max dotclock 580 MHz
    Display Product Name: 'TL142GVXP12-0'
Checksum: 0x55

----------------

Warnings:

Block 0, Base EDID:
  Display Range Limits: GTF support is deprecated in EDID 1.4.

Failures:

Block 0, Base EDID:
  Basic Display Parameters & Features: sRGB is signaled, but the chromaticities do not match.
EDID:
  Extension Block 1 started with EDID header, ignoring Extension Blocks >= 1.

EDID conformity: FAIL
