edid-decode (hex):

00 ff ff ff ff ff ff 00 4c 83 85 41 00 00 00 00
00 20 01 04 b5 22 16 78 03 0c f1 ae 52 3c b9 23
0c 4e 52 00 00 00 01 01 01 01 01 01 01 01 01 01
01 01 01 01 01 01 e9 ff 40 64 b0 08 20 70 20 08
88 00 58 d7 10 00 00 1b 00 00 00 fd 00 30 78 db
db 42 01 00 00 00 00 00 00 00 00 00 00 00 00 00
00 00 00 00 00 00 00 00 00 00 00 00 00 00 00 fe
00 41 54 4e 41 36 30 43 4c 30 33 2d 30 20 01 9f

02 03 1e 00 e3 05 80 00 e6 06 05 01 70 60 07 72
1a 00 00 03 03 30 78 00 a4 70 07 00 00 78 00 00
00 00 00 00 00 00 00 00 00 00 00 00 00 00 00 00
00 00 00 00 00 00 00 00 00 00 00 00 00 00 00 00
00 00 00 00 00 00 00 00 00 00 00 00 00 00 00 00
00 00 00 00 00 00 00 00 00 00 00 00 00 00 00 00
00 00 00 00 00 00 00 00 00 00 00 00 00 00 00 00
00 00 00 00 00 00 00 00 00 00 00 00 00 00 00 df

00 ff ff ff ff ff ff 00 4c 83 85 41 00 00 00 00
00 20 01 04 b5 22 16 78 03 0c f1 ae 52 3c b9 23
0c 4e 52 00 00 00 01 01 01 01 01 01 01 01 01 01
01 01 01 01 01 01 e9 ff 40 64 b0 08 20 70 20 08
88 00 58 d7 10 00 00 1b 00 00 00 fd 00 30 78 db
db 42 01 00 00 00 00 00 00 00 00 00 00 00 00 00
00 00 00 00 00 00 00 00 00 00 00 00 00 00 00 fe
00 41 54 4e 41 36 30 43 4c 30 33 2d 30 20 01 9f

02 03 1e 00 e3 05 80 00 e6 06 05 01 70 60 07 72
1a 00 00 03 03 30 78 00 a4 70 07 00 00 78 00 00
00 00 00 00 00 00 00 00 00 00 00 00 00 00 00 00
00 00 00 00 00 00 00 00 00 00 00 00 00 00 00 00
00 00 00 00 00 00 00 00 00 00 00 00 00 00 00 00
00 00 00 00 00 00 00 00 00 00 00 00 00 00 00 00
00 00 00 00 00 00 00 00 00 00 00 00 00 00 00 00
00 00 00 00 00 00 00 00 00 00 00 00 00 00 00 df

----------------

Block 0, Base EDID:
  EDID Structure Version & Revision: 1.4
  Vendor & Product Identification:
    Manufacturer: SDC
    Model: 16773
    Made in: 2022
  Basic Display Parameters & Features:
    Digital display
    Bits per primary color channel: 10
    DisplayPort interface
    Maximum image size: 34 cm x 22 cm
    Gamma: 2.20
    Supported color formats: RGB 4:4:4
    First detailed timing includes the native pixel format and preferred refresh rate
    Display supports continuous frequencies
  Color Characteristics:
    Red  : 0.6796, 0.3203
    Green: 0.2373, 0.7226
    Blue : 0.1396, 0.0498
    White: 0.3046, 0.3212
  Established Timings I & II: none
  Standard Timings: none
  Detailed Timing Descriptors:
    DTD 1:  2880x1800  120.001246 Hz  16:10   219.842 kHz    655.130000 MHz (344 mm x 215 mm)
                 Hfront   32 Hsync   8 Hback   60 Hpol P
                 Vfront    8 Vsync   8 Vback   16 Vpol N
    Display Range Limits:
      Monitor ranges (Range Limits Only): 48-120 Hz V, 219-219 kHz H, max dotclock 660 MHz
    Empty Descriptor
    Alphanumeric Data String: 'ATNA60CL03-0 '
  Extension blocks: 1
Checksum: 0x9f

----------------

Block 1, CTA-861 Extension Block:
  Revision: 3
  Native detailed modes: 0
  Colorimetry Data Block:
    BT2020RGB
  HDR Static Metadata Data Block:
    Electro optical transfer functions:
      Traditional gamma - SDR luminance range
      SMPTE ST2084
    Supported static metadata descriptors:
      Static metadata type 1
    Desired content max luminance: 112 (565.685 cd/m^2)
    Desired content max frame-average luminance: 96 (400.000 cd/m^2)
    Desired content min luminance: 7 (0.004 cd/m^2)
  Vendor-Specific Data Block (AMD), OUI 00-00-1A:
    Version: 3
    Feature Caps: 0x03
    Minimum Refresh Rate: 48 Hz
    Maximum Refresh Rate: 120 Hz
    Flags 1.x: 0x00
    Flags 2.x: 0xa4
    Maximum luminance: 112 (565.685 cd/m^2)
    Minimum luminance: 7 (0.004 cd/m^2)
    Maximum luminance (without local dimming): 0 (50.000 cd/m^2)
    Minimum luminance (without local dimming): 0 (0.000 cd/m^2)
Checksum: 0xdf  Unused space in Extension Block: 97 bytes

----------------

Block 2, Unknown EDID Extension Block 0x00:
  00 ff ff ff ff ff ff 00 4c 83 85 41 00 00 00 00 '........L..A....'
  00 20 01 04 b5 22 16 78 03 0c f1 ae 52 3c b9 23 '. ...".x....R<.#'
  0c 4e 52 00 00 00 01 01 01 01 01 01 01 01 01 01 '.NR.............'
  01 01 01 01 01 01 e9 ff 40 64 b0 08 20 70 20 08 '........@d.. p .'
  88 00 58 d7 10 00 00 1b 00 00 00 fd 00 30 78 db '..X..........0x.'
  db 42 01 00 00 00 00 00 00 00 00 00 00 00 00 00 '.B..............'
  00 00 00 00 00 00 00 00 00 00 00 00 00 00 00 fe '................'
  00 41 54 4e 41 36 30 43 4c 30 33 2d 30 20 01 9f '.ATNA60CL03-0 ..'
Checksum: 0x9f

----------------

Block 3, CTA-861 Extension Block:
  Revision: 3
  Native detailed modes: 0
  Colorimetry Data Block:
    BT2020RGB
  HDR Static Metadata Data Block:
    Electro optical transfer functions:
      Traditional gamma - SDR luminance range
      SMPTE ST2084
    Supported static metadata descriptors:
      Static metadata type 1
    Desired content max luminance: 112 (565.685 cd/m^2)
    Desired content max frame-average luminance: 96 (400.000 cd/m^2)
    Desired content min luminance: 7 (0.004 cd/m^2)
  Vendor-Specific Data Block (AMD), OUI 00-00-1A:
    Version: 3
    Feature Caps: 0x03
    Minimum Refresh Rate: 48 Hz
    Maximum Refresh Rate: 120 Hz
    Flags 1.x: 0x00
    Flags 2.x: 0xa4
    Maximum luminance: 112 (565.685 cd/m^2)
    Minimum luminance: 7 (0.004 cd/m^2)
    Maximum luminance (without local dimming): 0 (50.000 cd/m^2)
    Minimum luminance (without local dimming): 0 (0.000 cd/m^2)
Checksum: 0xdf  Unused space in Extension Block: 97 bytes

----------------

Warnings:

Block 0, Base EDID:
  Missing Display Product Name.
Block 1, CTA-861 Extension Block:
  IT Video Formats are overscanned by default, but normally this should be underscanned.
  Colorimetry Data Block: Set the sRGB colorimetry bit to avoid interop issues.
Block 3, CTA-861 Extension Block:
  IT Video Formats are overscanned by default, but normally this should be underscanned.
  Colorimetry Data Block: Set the sRGB colorimetry bit to avoid interop issues.
EDID:
  Base EDID: Some timings are out of range of the Monitor Ranges:
    Horizontal Freq: 219.842 - 219.842 kHz (Monitor: 219.000 - 219.000 kHz)
    Could be due to a Monitor Range off-by-one rounding issue

Failures:

Block 0, Base EDID:
  Display Range Limits: Byte 11 is 0x00 instead of 0x0a.
  Display Range Limits: Bytes 12-17 must be 0x20.
  Empty Descriptor: Use Dummy Descriptor instead of all zeroes.
  Alphanumeric Data String: No newline, but one or more trailing spaces.
Block 1, CTA-861 Extension Block:
  Offset is 30, but should be 34.
  Required 640x480p60 timings are missing in the established timings and the SVD list (VIC 1).
  Missing VCDB, needed for Set Selectable RGB Quantization to avoid interop issues.
Block 2, Base EDID:
  Unknown Extension Block.
Block 3, CTA-861 Extension Block:
  Colorimetry Data Block: Only one instance of this Data Block is allowed.
  HDR Static Metadata Data Block: Only one instance of this Data Block is allowed.
  Offset is 30, but should be 34.
EDID:
  Base EDID: EDID specified 1 extension block(s), but found 3 extension block(s).

EDID conformity: FAIL
