edid-decode (hex):

00 ff ff ff ff ff ff 00 4c a3 57 31 00 00 00 00
00 0f 01 03 80 1e 13 78 0a 87 f5 94 57 4f 8c 27
27 50 54 00 00 00 01 01 01 01 01 01 01 01 01 01
01 01 01 01 01 01 ee 1a 00 80 50 20 10 30 0c 40
33 00 2f be 10 00 00 19 00 00 00 0f 00 00 00 00
00 00 00 00 00 23 87 02 64 00 00 00 00 fe 00 54
44 35 30 38 01 31 34 31 57 31 0a 20 00 00 00 fe
00 e8 d8 d0 c0 98 78 50 40 01 01 0a 20 20 00 63

00 ff ff ff ff ff ff 00 4c a3 57 31 00 00 00 00
00 0f 01 03 80 1e 13 78 0a 87 f5 94 57 4f 8c 27
27 50 54 00 00 00 01 01 01 01 01 01 01 01 01 01
01 01 01 01 01 01 ee 1a 00 80 50 20 10 30 0c 40
33 00 2f be 10 00 00 19 00 00 00 0f 00 00 00 00
00 00 00 00 00 23 87 02 64 00 00 00 00 fe 00 54
44 35 30 38 01 31 34 31 57 31 0a 20 00 00 00 fe
00 e8 d8 d0 c0 98 78 50 40 01 01 0a 20 20 00 63

----------------

Block 0, Base EDID:
  EDID Structure Version & Revision: 1.3
  Vendor & Product Identification:
    Manufacturer: SEC
    Model: 12631
    Made in: 2005
  Basic Display Parameters & Features:
    Digital display
    Maximum image size: 30 cm x 19 cm
    Gamma: 2.20
    RGB color display
    First detailed timing is the preferred timing
  Color Characteristics:
    Red  : 0.5800, 0.3398
    Green: 0.3095, 0.5498
    Blue : 0.1552, 0.1552
    White: 0.3134, 0.3291
  Established Timings I & II: none
  Standard Timings: none
  Detailed Timing Descriptors:
    DTD 1:  1280x800    60.003760 Hz  16:10    48.963 kHz     68.940000 MHz (303 mm x 190 mm)
                 Hfront   12 Hsync  64 Hback   52 Hpol N
                 Vfront    3 Vsync   3 Vback   10 Vpol N
    Manufacturer-Specified Display Descriptor (0x0f): 00 0f 00 00 00 00 00 00 00 00 00 23 87 02 64 00 '...........#..d.'
    Alphanumeric Data String: 'TD508.141W1'
    Alphanumeric Data String: '.....xP@..'
Checksum: 0x63

----------------

Warnings:

Block 0, Base EDID:
  Alphanumeric Data String: Non-ASCII character 0x01 at position 5, can cause problems.
  Alphanumeric Data String: Non-ASCII character 0xe8 at position 0, can cause problems.
  Alphanumeric Data String: Non-ASCII character 0xd8 at position 1, can cause problems.
  Alphanumeric Data String: Non-ASCII character 0xd0 at position 2, can cause problems.
  Alphanumeric Data String: Non-ASCII character 0xc0 at position 3, can cause problems.
  Alphanumeric Data String: Non-ASCII character 0x98 at position 4, can cause problems.
  Alphanumeric Data String: Non-ASCII character 0x01 at position 8, can cause problems.
  Alphanumeric Data String: Non-ASCII character 0x01 at position 9, can cause problems.

Failures:

Block 0, Base EDID:
  Missing Display Product Name.
  Missing Display Range Limits Descriptor.
EDID:
  Extension Block 1 started with EDID header, ignoring Extension Blocks >= 1.

EDID conformity: FAIL
