edid-decode (hex):

00 ff ff ff ff ff ff 00 4c a3 57 31 00 00 00 00
00 10 01 03 80 21 15 78 0a 87 f5 94 57 4f 8c 27
27 50 54 00 00 00 01 01 01 01 01 01 01 01 01 01
01 01 01 01 01 01 48 25 a0 30 51 84 0c 30 40 20
33 00 2f be 10 00 00 19 00 00 00 0f 00 00 00 00
00 00 00 00 00 78 e6 02 23 00 00 00 00 fe 00 47
52 34 34 38 01 31 35 34 57 31 0a 20 00 00 00 fe
00 17 26 39 45 69 91 c3 ff 02 01 0a 20 20 00 30

00 ff ff ff ff ff ff 00 4c a3 57 31 00 00 00 00
00 10 01 03 80 21 15 78 0a 87 f5 94 57 4f 8c 27
27 50 54 00 00 00 01 01 01 01 01 01 01 01 01 01
01 01 01 01 01 01 48 25 a0 30 51 84 0c 30 40 20
33 00 2f be 10 00 00 19 00 00 00 0f 00 00 00 00
00 00 00 00 00 78 e6 02 23 00 00 00 00 fe 00 47
52 34 34 38 01 31 35 34 57 31 0a 20 00 00 00 fe
00 17 26 39 45 69 91 c3 ff 02 01 0a 20 20 00 30

----------------

Block 0, Base EDID:
  EDID Structure Version & Revision: 1.3
  Vendor & Product Identification:
    Manufacturer: SEC
    Model: 12631
    Made in: 2006
  Basic Display Parameters & Features:
    Digital display
    Maximum image size: 33 cm x 21 cm
    Gamma: 2.20
    RGB color display
    First detailed timing is the preferred timing
  Color Characteristics:
    Red  : 0.5800, 0.3398
    Green: 0.3095, 0.5498
    Blue : 0.1552, 0.1552
    White: 0.3134, 0.3291
  Established Timings I & II: none
  Standard Timings: none
  Detailed Timing Descriptors:
    DTD 1:  1440x900    60.005231 Hz  16:10    54.725 kHz     95.440000 MHz (303 mm x 190 mm)
                 Hfront   64 Hsync  32 Hback  208 Hpol N
                 Vfront    3 Vsync   3 Vback    6 Vpol N
    Manufacturer-Specified Display Descriptor (0x0f): 00 0f 00 00 00 00 00 00 00 00 00 78 e6 02 23 00 '...........x..#.'
    Alphanumeric Data String: 'GR448.154W1'
    Alphanumeric Data String: '.&9Ei..'
Checksum: 0x30

----------------

Warnings:

Block 0, Base EDID:
  Alphanumeric Data String: Non-ASCII character 0x01 at position 5, can cause problems.
  Alphanumeric Data String: Non-ASCII character 0x17 at position 0, can cause problems.
  Alphanumeric Data String: Non-ASCII character 0x91 at position 5, can cause problems.
  Alphanumeric Data String: Non-ASCII character 0xc3 at position 6, can cause problems.

Failures:

Block 0, Base EDID:
  Detailed Timing Descriptor #1: Mismatch of image size 303x190 mm vs display size 330x210 mm.
  Alphanumeric Data String: 0xff byte at position 7.
  Missing Display Product Name.
  Missing Display Range Limits Descriptor.
EDID:
  Extension Block 1 started with EDID header, ignoring Extension Blocks >= 1.

EDID conformity: FAIL
