edid-decode (hex):

00 ff ff ff ff ff ff 00 4c a3 57 31 00 00 00 00
00 10 01 03 80 1a 10 78 0a 87 f5 94 57 4f 8c 27
27 50 54 00 00 00 01 01 01 01 01 01 01 01 01 01
01 01 01 01 01 01 c7 1b 00 ab 50 20 11 30 30 20
36 00 05 a3 10 00 00 19 00 00 00 0f 00 00 00 00
00 00 00 00 00 32 d2 02 32 00 00 00 00 fe 00 50
4d 38 32 32 01 31 32 31 57 31 0a 20 00 00 00 fe
00 2e 3f 4f 5e 7f b0 df ff 01 01 0a 20 20 00 40

----------------

Block 0, Base EDID:
  EDID Structure Version & Revision: 1.3
  Vendor & Product Identification:
    Manufacturer: SEC
    Model: 12631
    Made in: 2006
  Basic Display Parameters & Features:
    Digital display
    Maximum image size: 26 cm x 16 cm
    Gamma: 2.20
    RGB color display
    First detailed timing is the preferred timing
  Color Characteristics:
    Red  : 0.5800, 0.3398
    Green: 0.3095, 0.5498
    Blue : 0.1552, 0.1552
    White: 0.3134, 0.3291
  Established Timings I & II: none
  Standard Timings: none
  Detailed Timing Descriptors:
    DTD 1:  1280x800    59.984799 Hz  16:10    49.008 kHz     71.110000 MHz (261 mm x 163 mm)
                 Hfront   48 Hsync  32 Hback   91 Hpol N
                 Vfront    3 Vsync   6 Vback    8 Vpol N
    Manufacturer-Specified Display Descriptor (0x0f): 00 0f 00 00 00 00 00 00 00 00 00 32 d2 02 32 00 '...........2..2.'
    Alphanumeric Data String: 'PM822.121W1'
    Alphanumeric Data String: '.?O^...'
Checksum: 0x40

----------------

Warnings:

Block 0, Base EDID:
  Alphanumeric Data String: Non-ASCII character 0x01 at position 5, can cause problems.
  Alphanumeric Data String: Non-ASCII character 0x7f at position 4, can cause problems.
  Alphanumeric Data String: Non-ASCII character 0xb0 at position 5, can cause problems.
  Alphanumeric Data String: Non-ASCII character 0xdf at position 6, can cause problems.

Failures:

Block 0, Base EDID:
  Alphanumeric Data String: 0xff byte at position 7.
  Missing Display Product Name.
  Missing Display Range Limits Descriptor.

EDID conformity: FAIL
