edid-decode (hex):

00 ff ff ff ff ff ff 00 06 af 9d 48 00 00 00 00
00 1d 01 04 a5 26 15 78 02 67 95 93 58 59 94 29
20 50 54 00 00 00 01 01 01 01 01 01 01 01 01 01
01 01 01 01 01 01 40 38 80 b4 70 38 3e 40 10 10
3e 00 7d d6 10 00 00 1a 40 38 80 b4 70 38 5c 41
10 10 3e 00 7d d6 10 00 00 1a 00 00 00 fe 00 35
59 31 44 52 80 42 31 37 33 48 41 4e 00 00 00 00
00 02 41 21 96 00 11 00 00 0a 01 0a 20 20 00 bf

00 ff ff ff ff ff ff 00 06 af 9d 48 00 00 00 00
00 1d 01 04 a5 26 15 78 02 67 95 93 58 59 94 29
20 50 54 00 00 00 01 01 01 01 01 01 01 01 01 01
01 01 01 01 01 01 40 38 80 b4 70 38 3e 40 10 10
3e 00 7d d6 10 00 00 1a 40 38 80 b4 70 38 5c 41
10 10 3e 00 7d d6 10 00 00 1a 00 00 00 fe 00 35
59 31 44 52 80 42 31 37 33 48 41 4e 00 00 00 00
00 02 41 21 96 00 11 00 00 0a 01 0a 20 20 00 bf

----------------

Block 0, Base EDID:
  EDID Structure Version & Revision: 1.4
  Vendor & Product Identification:
    Manufacturer: AUO
    Model: 18589
    Made in: 2019
  Basic Display Parameters & Features:
    Digital display
    Bits per primary color channel: 8
    DisplayPort interface
    Maximum image size: 38 cm x 21 cm
    Gamma: 2.20
    Supported color formats: RGB 4:4:4
    First detailed timing includes the native pixel format and preferred refresh rate
  Color Characteristics:
    Red  : 0.5751, 0.3457
    Green: 0.3486, 0.5810
    Blue : 0.1621, 0.1259
    White: 0.3134, 0.3291
  Established Timings I & II: none
  Standard Timings: none
  Detailed Timing Descriptors:
    DTD 1:  1920x1080   60.045034 Hz  16:9     68.571 kHz    144.000000 MHz (381 mm x 214 mm)
                 Hfront   16 Hsync  16 Hback  148 Hpol P
                 Vfront    3 Vsync  14 Vback   45 Vpol N
    DTD 2:  1920x1080   48.019208 Hz  16:9     68.571 kHz    144.000000 MHz (381 mm x 214 mm)
                 Hfront   16 Hsync  16 Hback  148 Hpol P
                 Vfront    3 Vsync  14 Vback  331 Vpol N
    Alphanumeric Data String: '5Y1DR.B173HAN'
    Manufacturer-Specified Display Descriptor (0x00): 00 00 00 02 41 21 96 00 11 00 00 0a 01 0a 20 20 '....A!........  '
Checksum: 0xbf

----------------

Warnings:

Block 0, Base EDID:
  Alphanumeric Data String: Non-ASCII character 0x80 at position 5, can cause problems.
  Missing Display Product Name.

Failures:

EDID:
  Extension Block 1 started with EDID header, ignoring Extension Blocks >= 1.

EDID conformity: FAIL
