edid-decode (hex):

00 ff ff ff ff ff ff 00 21 63 bb 36 00 00 00 00
00 20 01 04 a5 1e 13 78 0a 43 90 97 5b 5b 90 28
20 50 54 00 00 00 01 01 01 01 01 01 01 01 01 01
01 01 01 01 01 01 32 3c 80 a0 70 b0 23 40 30 20
36 00 2e bd 10 00 00 18 2a 30 80 a0 70 b0 23 40
30 20 36 00 2e bd 10 00 00 18 00 00 00 fe 00 58
43 4a 4e 4d 80 31 34 30 44 53 30 31 00 00 00 00
00 01 41 21 19 00 10 00 00 0a 01 0a 20 20 00 bc

00 ff ff ff ff ff ff 00 21 63 bb 36 00 00 00 00
00 20 01 04 a5 1e 13 78 0a 43 90 97 5b 5b 90 28
20 50 54 00 00 00 01 01 01 01 01 01 01 01 01 01
01 01 01 01 01 01 32 3c 80 a0 70 b0 23 40 30 20
36 00 2e bd 10 00 00 18 2a 30 80 a0 70 b0 23 40
30 20 36 00 2e bd 10 00 00 18 00 00 00 fe 00 58
43 4a 4e 4d 80 31 34 30 44 53 30 31 00 00 00 00
00 01 41 21 19 00 10 00 00 0a 01 0a 20 20 00 bc

----------------

Block 0, Base EDID:
  EDID Structure Version & Revision: 1.4
  Vendor & Product Identification:
    Manufacturer: HKC
    Model: 14011
    Made in: 2022
  Basic Display Parameters & Features:
    Digital display
    Bits per primary color channel: 8
    DisplayPort interface
    Maximum image size: 30 cm x 19 cm
    Gamma: 2.20
    Supported color formats: RGB 4:4:4, YCrCb 4:4:4
    First detailed timing includes the native pixel format and preferred refresh rate
  Color Characteristics:
    Red  : 0.5908, 0.3554
    Green: 0.3554, 0.5654
    Blue : 0.1582, 0.1259
    White: 0.3125, 0.3281
  Established Timings I & II: none
  Standard Timings: none
  Detailed Timing Descriptors:
    DTD 1:  1920x1200   59.989100 Hz  16:10    74.087 kHz    154.100000 MHz (302 mm x 189 mm)
                 Hfront   48 Hsync  32 Hback   80 Hpol N
                 Vfront    3 Vsync   6 Vback   26 Vpol N
    DTD 2:  1920x1200   47.999066 Hz  16:10    59.279 kHz    123.300000 MHz (302 mm x 189 mm)
                 Hfront   48 Hsync  32 Hback   80 Hpol N
                 Vfront    3 Vsync   6 Vback   26 Vpol N
    Alphanumeric Data String: 'XCJNM.140DS01'
    Manufacturer-Specified Display Descriptor (0x00): 00 00 00 01 41 21 19 00 10 00 00 0a 01 0a 20 20 '....A!........  '
Checksum: 0xbc

----------------

Warnings:

Block 0, Base EDID:
  Alphanumeric Data String: Non-ASCII character 0x80 at position 5, can cause problems.
  Missing Display Product Name.

Failures:

EDID:
  Extension Block 1 started with EDID header, ignoring Extension Blocks >= 1.

EDID conformity: FAIL
