edid-decode (hex):

00 ff ff ff ff ff ff 00 10 ac 4d d0 01 01 01 01
1c 16 01 03 08 29 17 78 ea c9 05 a4 54 56 9f 28
0c 50 54 25 4b 00 71 40 71 4f 81 80 01 01 01 01
01 01 01 01 01 01 66 21 56 aa 51 00 1b 30 40 70
13 00 9a e6 10 00 00 1e 9a 29 a0 d0 51 84 22 30
50 98 36 00 9a e6 10 00 00 1c 00 00 00 fd 00 3c
4b 1c 52 0e 00 0a 20 20 20 20 20 20 00 00 00 fc
00 46 50 4d 31 38 35 0a 20 20 20 20 20 20 00 01

00 ff ff ff ff ff ff 00 10 ac 4d d0 01 01 01 01
1c 16 01 03 08 29 17 78 ea c9 05 a4 54 56 9f 28
0c 50 54 25 4b 00 71 40 71 4f 81 80 01 01 01 01
01 01 01 01 01 01 66 21 56 aa 51 00 1b 30 40 70
13 00 9a e6 10 00 00 1e 9a 29 a0 d0 51 84 22 30
50 98 36 00 9a e6 10 00 00 1c 00 00 00 fd 00 3c
4b 1c 52 0e 00 0a 20 20 20 20 20 20 00 00 00 fc
00 46 50 4d 31 38 35 0a 20 20 20 20 20 20 00 01

----------------

Block 0, Base EDID:
  EDID Structure Version & Revision: 1.3
  Vendor & Product Identification:
    Manufacturer: DEL
    Model: 53325
    Serial Number: ...
    Made in: week 28 of 2012
  Basic Display Parameters & Features:
    Analog display
    Signal Level Standard: 0.700 : 0.300 : 1.000 V p-p
    Blank level equals black level
    Sync: Separate
    Maximum image size: 41 cm x 23 cm
    Gamma: 2.20
    DPMS levels: Standby Suspend Off
    RGB color display
    First detailed timing is the preferred timing
  Color Characteristics:
    Red  : 0.6435, 0.3281
    Green: 0.3378, 0.6220
    Blue : 0.1562, 0.0468
    White: 0.3134, 0.3291
  Established Timings I & II:
    DMT 0x04:   640x480    59.940476 Hz   4:3     31.469 kHz     25.175000 MHz
    DMT 0x06:   640x480    75.000000 Hz   4:3     37.500 kHz     31.500000 MHz
    DMT 0x09:   800x600    60.316541 Hz   4:3     37.879 kHz     40.000000 MHz
    DMT 0x0b:   800x600    75.000000 Hz   4:3     46.875 kHz     49.500000 MHz
    DMT 0x10:  1024x768    60.003840 Hz   4:3     48.363 kHz     65.000000 MHz
    DMT 0x12:  1024x768    75.028582 Hz   4:3     60.023 kHz     78.750000 MHz
    DMT 0x24:  1280x1024   75.024675 Hz   5:4     79.976 kHz    135.000000 MHz
  Standard Timings:
    GTF     :  1152x864    60.000000 Hz   4:3     53.700 kHz     81.624000 MHz
    DMT 0x15:  1152x864    75.000000 Hz   4:3     67.500 kHz    108.000000 MHz
    DMT 0x23:  1280x1024   60.019740 Hz   5:4     63.981 kHz    108.000000 MHz
  Detailed Timing Descriptors:
    DTD 1:  1366x768    60.015162 Hz 683:384   47.712 kHz     85.500000 MHz (410 mm x 230 mm)
                 Hfront   64 Hsync 112 Hback  250 Hpol P
                 Vfront    1 Vsync   3 Vback   23 Vpol P
    DTD 2:  1440x900    59.887445 Hz  16:10    55.935 kHz    106.500000 MHz (410 mm x 230 mm)
                 Hfront   80 Hsync 152 Hback  232 Hpol N
                 Vfront    3 Vsync   6 Vback   25 Vpol P
    Display Range Limits:
      Monitor ranges (GTF): 60-75 Hz V, 28-82 kHz H, max dotclock 140 MHz
    Display Product Name: 'FPM185'
Checksum: 0x01

----------------

Block 1, Unknown EDID Extension Block 0x00:
  00 ff ff ff ff ff ff 00 10 ac 4d d0 01 01 01 01 '..........M.....'
  1c 16 01 03 08 29 17 78 ea c9 05 a4 54 56 9f 28 '.....).x....TV.('
  0c 50 54 25 4b 00 71 40 71 4f 81 80 01 01 01 01 '.PT%K.q@qO......'
  01 01 01 01 01 01 66 21 56 aa 51 00 1b 30 40 70 '......f!V.Q..0@p'
  13 00 9a e6 10 00 00 1e 9a 29 a0 d0 51 84 22 30 '.........)..Q."0'
  50 98 36 00 9a e6 10 00 00 1c 00 00 00 fd 00 3c 'P.6............<'
  4b 1c 52 0e 00 0a 20 20 20 20 20 20 00 00 00 fc 'K.R...      ....'
  00 46 50 4d 31 38 35 0a 20 20 20 20 20 20 00 01 '.FPM185.      ..'
Checksum: 0x01

----------------

Warnings:

Block 0, Base EDID:
  Vendor & Product Identification: The serial number is one of the known dummy values, it should probably be set to 0.
  Detailed Timing Descriptor #2: Image size is 410x230 mm, but based on the picture AR it should be 410x256 mm.

Failures:

Block 1, Base EDID:
  Unknown Extension Block.
EDID:
  Base EDID: EDID specified 0 extension block(s), but found 1 extension block(s).

EDID conformity: FAIL
