edid-decode (hex):

00 ff ff ff ff ff ff 00 41 0c 1d c0 a5 d5 00 00
22 12 01 04 a5 25 17 78 20 10 85 a0 58 53 8e 27
25 4f 54 bf ee 80 71 4f 95 00 95 0f 01 01 01 01
01 01 01 01 01 01 9a 29 a0 d0 51 84 22 30 50 98
36 00 6f e6 10 00 00 1c 00 00 00 ff 00 46 58 35
30 38 33 34 30 35 34 36 39 33 00 00 00 fc 00 50
68 69 6c 69 70 73 20 31 37 30 43 57 00 00 00 fd
00 38 4c 1e 53 0e 00 0a 20 20 20 20 20 20 00 5d

00 ff ff ff ff ff ff 00 41 0c 1d c0 a5 d5 00 00
22 12 01 04 a5 25 17 78 20 10 85 a0 58 53 8e 27
25 4f 54 bf ee 80 71 4f 95 00 95 0f 01 01 01 01
01 01 01 01 01 01 9a 29 a0 d0 51 84 22 30 50 98
36 00 6f e6 10 00 00 1c 00 00 00 ff 00 46 58 35
30 38 33 34 30 35 34 36 39 33 00 00 00 fc 00 50
68 69 6c 69 70 73 20 31 37 30 43 57 00 00 00 fd
00 38 4c 1e 53 0e 00 0a 20 20 20 20 20 20 00 5d

----------------

Block 0, Base EDID:
  EDID Structure Version & Revision: 1.4
  Vendor & Product Identification:
    Manufacturer: PHL
    Model: 49181
    Serial Number: ...
    Made in: week 34 of 2008
  Basic Display Parameters & Features:
    Digital display
    Bits per primary color channel: 8
    DisplayPort interface
    Maximum image size: 37 cm x 23 cm
    Gamma: 2.20
    DPMS levels: Off
    Supported color formats: RGB 4:4:4
    First detailed timing does not include the native pixel format and preferred refresh rate
  Color Characteristics:
    Red  : 0.6250, 0.3447
    Green: 0.3242, 0.5546
    Blue : 0.1542, 0.1445
    White: 0.3095, 0.3291
  Established Timings I & II:
    IBM     :   720x400    70.081663 Hz   9:5     31.467 kHz     28.320000 MHz
    DMT 0x04:   640x480    59.940476 Hz   4:3     31.469 kHz     25.175000 MHz
    Apple   :   640x480    66.666667 Hz   4:3     35.000 kHz     30.240000 MHz
    DMT 0x05:   640x480    72.808802 Hz   4:3     37.861 kHz     31.500000 MHz
    DMT 0x06:   640x480    75.000000 Hz   4:3     37.500 kHz     31.500000 MHz
    DMT 0x08:   800x600    56.250000 Hz   4:3     35.156 kHz     36.000000 MHz
    DMT 0x09:   800x600    60.316541 Hz   4:3     37.879 kHz     40.000000 MHz
    DMT 0x0a:   800x600    72.187572 Hz   4:3     48.077 kHz     50.000000 MHz
    DMT 0x0b:   800x600    75.000000 Hz   4:3     46.875 kHz     49.500000 MHz
    Apple   :   832x624    74.551266 Hz   4:3     49.726 kHz     57.284000 MHz
    DMT 0x10:  1024x768    60.003840 Hz   4:3     48.363 kHz     65.000000 MHz
    DMT 0x11:  1024x768    70.069359 Hz   4:3     56.476 kHz     75.000000 MHz
    DMT 0x12:  1024x768    75.028582 Hz   4:3     60.023 kHz     78.750000 MHz
    Apple   :  1152x870    75.061550 Hz 192:145   68.681 kHz    100.000000 MHz
  Standard Timings:
    DMT 0x15:  1152x864    75.000000 Hz   4:3     67.500 kHz    108.000000 MHz
    DMT 0x2f:  1440x900    59.887445 Hz  16:10    55.935 kHz    106.500000 MHz
    DMT 0x30:  1440x900    74.984427 Hz  16:10    70.635 kHz    136.750000 MHz
  Detailed Timing Descriptors:
    DTD 1:  1440x900    59.887445 Hz  16:10    55.935 kHz    106.500000 MHz (367 mm x 230 mm)
                 Hfront   80 Hsync 152 Hback  232 Hpol N
                 Vfront    3 Vsync   6 Vback   25 Vpol P
    Display Product Serial Number: ...
    Display Product Name: 'Philips 170CW'
    Display Range Limits:
      Monitor ranges (GTF): 56-76 Hz V, 30-83 kHz H, max dotclock 140 MHz
Checksum: 0x5d

----------------

Block 1, Unknown EDID Extension Block 0x00:
  00 ff ff ff ff ff ff 00 41 0c 1d c0 a5 d5 00 00 '........A.......'
  22 12 01 04 a5 25 17 78 20 10 85 a0 58 53 8e 27 '"....%.x ...XS.''
  25 4f 54 bf ee 80 71 4f 95 00 95 0f 01 01 01 01 '%OT...qO........'
  01 01 01 01 01 01 9a 29 a0 d0 51 84 22 30 50 98 '.......)..Q."0P.'
  36 00 6f e6 10 00 00 1c 00 00 00 ff 00 46 58 35 '6.o..........FX5'
  30 38 33 34 30 35 34 36 39 33 00 00 00 fc 00 50 '0834054693.....P'
  68 69 6c 69 70 73 20 31 37 30 43 57 00 00 00 fd 'hilips 170CW....'
  00 38 4c 1e 53 0e 00 0a 20 20 20 20 20 20 00 5d '.8L.S...      .]'
Checksum: 0x5d

----------------

Warnings:

Block 0, Base EDID:
  Display Range Limits: GTF support is deprecated in EDID 1.4.
EDID:
  No Native Video Resolution was defined.

Failures:

Block 0, Base EDID:
  Display Range Limits: GTF is supported, but the display does not support continuous frequencies.
Block 1, Base EDID:
  Unknown Extension Block.
EDID:
  Base EDID: EDID specified 0 extension block(s), but found 1 extension block(s).

EDID conformity: FAIL
