edid-decode (hex):

00 ff ff ff ff ff ff 00 09 e5 75 27 00 00 00 00
1f 21 01 03 80 23 15 78 2a 82 35 a5 53 4a 9e 26
0f 50 54 21 08 00 d1 c0 d1 fc 81 c0 81 40 81 80
81 80 81 c0 a9 40 d6 d6 00 a0 a0 40 55 60 30 20
35 00 59 d7 10 00 00 1e 70 c2 00 a0 a0 a0 55 50
30 20 35 00 59 d7 10 00 00 1a 00 00 00 fc 00 4a
35 36 30 4a 31 35 0a 20 20 20 20 20 00 00 00 fd
00 30 83 0f fa 41 00 0a 20 20 20 20 20 20 01 5f

02 03 36 f2 44 61 10 04 4e e2 00 d5 e3 05 c0 00
23 09 7f 07 83 01 00 00 e5 0f 00 00 0c 00 68 03
0c 00 10 00 38 82 00 67 d8 5d c4 01 82 88 01 e6
06 05 01 72 72 00 6b 6b 00 a0 a0 40 55 60 30 20
36 00 59 d7 10 00 00 1a 38 61 00 a0 a0 a0 55 50
30 20 35 00 59 d7 10 00 00 1e 70 c2 00 a0 a0 a0
55 50 30 20 35 00 59 d7 10 00 00 1e 58 e3 00 a0
a0 40 2e 60 30 20 36 00 59 d7 10 00 00 1e 00 01

00 ff ff ff ff ff ff 00 09 e5 75 27 00 00 00 00
1f 21 01 03 80 23 15 78 2a 82 35 a5 53 4a 9e 26
0f 50 54 21 08 00 d1 c0 d1 fc 81 c0 81 40 81 80
81 80 81 c0 a9 40 d6 d6 00 a0 a0 40 55 60 30 20
35 00 59 d7 10 00 00 1e 70 c2 00 a0 a0 a0 55 50
30 20 35 00 59 d7 10 00 00 1a 00 00 00 fc 00 4a
35 36 30 4a 31 35 0a 20 20 20 20 20 00 00 00 fd
00 30 83 0f fa 41 00 0a 20 20 20 20 20 20 01 5f

02 03 36 f2 44 61 10 04 4e e2 00 d5 e3 05 c0 00
23 09 7f 07 83 01 00 00 e5 0f 00 00 0c 00 68 03
0c 00 10 00 38 82 00 67 d8 5d c4 01 82 88 01 e6
06 05 01 72 72 00 6b 6b 00 a0 a0 40 55 60 30 20
36 00 59 d7 10 00 00 1a 38 61 00 a0 a0 a0 55 50
30 20 35 00 59 d7 10 00 00 1e 70 c2 00 a0 a0 a0
55 50 30 20 35 00 59 d7 10 00 00 1e 58 e3 00 a0
a0 40 2e 60 30 20 36 00 59 d7 10 00 00 1e 00 01

----------------

Block 0, Base EDID:
  EDID Structure Version & Revision: 1.3
  Vendor & Product Identification:
    Manufacturer: BOE
    Model: 10101
    Made in: week 31 of 2023
  Basic Display Parameters & Features:
    Digital display
    Maximum image size: 35 cm x 21 cm
    Gamma: 2.20
    DPMS levels: Off
    RGB color display
    First detailed timing is the preferred timing
  Color Characteristics:
    Red  : 0.6464, 0.3242
    Green: 0.2890, 0.6191
    Blue : 0.1484, 0.0615
    White: 0.3134, 0.3291
  Established Timings I & II:
    DMT 0x04:   640x480    59.940476 Hz   4:3     31.469 kHz     25.175000 MHz
    DMT 0x09:   800x600    60.316541 Hz   4:3     37.879 kHz     40.000000 MHz
    DMT 0x10:  1024x768    60.003840 Hz   4:3     48.363 kHz     65.000000 MHz
  Standard Timings:
    DMT 0x52:  1920x1080   60.000000 Hz  16:9     67.500 kHz    148.500000 MHz
    GTF     :  1920x1080  119.999987 Hz  16:9    138.840 kHz    368.759000 MHz
    DMT 0x55:  1280x720    60.000000 Hz  16:9     45.000 kHz     74.250000 MHz
    DMT 0x20:  1280x960    60.000000 Hz   4:3     60.000 kHz    108.000000 MHz
    DMT 0x23:  1280x1024   60.019740 Hz   5:4     63.981 kHz    108.000000 MHz
    DMT 0x23:  1280x1024   60.019740 Hz   5:4     63.981 kHz    108.000000 MHz
    DMT 0x55:  1280x720    60.000000 Hz  16:9     45.000 kHz     74.250000 MHz
    DMT 0x33:  1600x1200   60.000000 Hz   4:3     75.000 kHz    162.000000 MHz
  Detailed Timing Descriptors:
    DTD 1:  2560x1600  119.999127 Hz  16:10   202.199 kHz    549.980000 MHz (345 mm x 215 mm)
                 Hfront   48 Hsync  32 Hback   80 Hpol P
                 Vfront    3 Vsync   5 Vback   77 Vpol P
    DTD 2:  2560x1440  120.000000 Hz  16:9    183.000 kHz    497.760000 MHz (345 mm x 215 mm)
                 Hfront   48 Hsync  32 Hback   80 Hpol P
                 Vfront    3 Vsync   5 Vback   77 Vpol N
    Display Product Name: 'J560J15'
    Display Range Limits:
      Monitor ranges (GTF): 48-131 Hz V, 15-250 kHz H, max dotclock 650 MHz
  Extension blocks: 1
Checksum: 0x5f

----------------

Block 1, CTA-861 Extension Block:
  Revision: 3
  Underscans IT Video Formats by default
  Basic audio support
  Supports YCbCr 4:4:4
  Supports YCbCr 4:2:2
  Native DTDs: 2
  Video Data Block:
    VIC  97:  3840x2160   60.000000 Hz  16:9    135.000 kHz    594.000000 MHz
    VIC  16:  1920x1080   60.000000 Hz  16:9     67.500 kHz    148.500000 MHz
    VIC   4:  1280x720    60.000000 Hz  16:9     45.000 kHz     74.250000 MHz
    VIC  78:  1920x1080  120.000000 Hz  64:27   135.000 kHz    297.000000 MHz
  Video Capability Data Block:
    YCbCr quantization: Selectable (via AVI YQ)
    RGB quantization: Selectable (via AVI Q)
    PT scan behavior: Always Overscanned
    IT scan behavior: Always Overscanned
    CE scan behavior: Always Overscanned
  Colorimetry Data Block:
    BT2020YCC
    BT2020RGB
  Audio Data Block:
    Linear PCM:
      Max channels: 2
      Supported sample rates (kHz): 192 176.4 96 88.2 48 44.1 32
      Supported sample sizes (bits): 24 20 16
  Speaker Allocation Data Block:
    FL/FR - Front Left/Right
  YCbCr 4:2:0 Capability Map Data Block:
    SVD Index 19 is out of range
    SVD Index 20 is out of range
  Vendor-Specific Data Block (HDMI), OUI 00-0C-03:
    Source physical address: 1.0.0.0
    DC_36bit
    DC_30bit
    DC_Y444
    Maximum TMDS clock: 650 MHz
  Vendor-Specific Data Block (HDMI Forum), OUI C4-5D-D8:
    Version: 1
    Maximum TMDS Character Rate: 650 MHz
    SCDC Present
    Supports scrambling for <= 340 Mcsc
    Supports 10-bits/component Deep Color 4:2:0 Pixel Encoding
  HDR Static Metadata Data Block:
    Electro optical transfer functions:
      Traditional gamma - SDR luminance range
      SMPTE ST2084
    Supported static metadata descriptors:
      Static metadata type 1
    Desired content max luminance: 114 (590.730 cd/m^2)
    Desired content max frame-average luminance: 114 (590.730 cd/m^2)
    Desired content min luminance: 0 (0.000 cd/m^2)
  Detailed Timing Descriptors:
    DTD 3:  2560x1600   59.999564 Hz  16:10   101.099 kHz    274.990000 MHz (345 mm x 215 mm)
                 Hfront   48 Hsync  32 Hback   80 Hpol P
                 Vfront    3 Vsync   6 Vback   76 Vpol N
    DTD 4:  2560x1440   60.000000 Hz  16:9     91.500 kHz    248.880000 MHz (345 mm x 215 mm)
                 Hfront   48 Hsync  32 Hback   80 Hpol P
                 Vfront    3 Vsync   5 Vback   77 Vpol P
    DTD 5:  2560x1440  120.000000 Hz  16:9    183.000 kHz    497.760000 MHz (345 mm x 215 mm)
                 Hfront   48 Hsync  32 Hback   80 Hpol P
                 Vfront    3 Vsync   5 Vback   77 Vpol P
    DTD 6:  2560x1600  129.994282 Hz  16:10   213.971 kHz    582.000000 MHz (345 mm x 215 mm)
                 Hfront   48 Hsync  32 Hback   80 Hpol P
                 Vfront    3 Vsync   6 Vback   37 Vpol P
Checksum: 0x01  Unused space in Extension Block: 1 byte

----------------

Warnings:

Block 0, Base EDID:
  Detailed Timing Descriptor #2: Image size is 345x215 mm, but based on the picture AR it should be 345x194 mm.
Block 1, CTA-861 Extension Block:
  Video Data Block: VIC 97 and the first DTD are not identical. Is this intended?
  Video Capability Data Block: IT scan behavior is expected to support underscanned.
  Video Capability Data Block: S_PT is equal to S_IT and S_CE, so should be set to 0 instead.
  Colorimetry Data Block: Set the sRGB colorimetry bit to avoid interop issues.
  Detailed Timing Descriptor #4: Image size is 345x215 mm, but based on the picture AR it should be 345x194 mm.
  Detailed Timing Descriptor #5: Image size is 345x215 mm, but based on the picture AR it should be 345x194 mm.

Failures:

Block 1, CTA-861 Extension Block:
  Video Capability Data Block: IT video formats are always overscanned, but bit 7 of Byte 3 of the CTA-861 Extension header is set to underscanned.
  YCbCr 4:2:0 Capability Map Data Block: Max index 20 > 4 (#SVDs).
  Vendor-Specific Data Block (HDMI), OUI 00-0C-03: HDMI VSDB Max TMDS rate is > 340.
  Vendor-Specific Data Block (HDMI Forum), OUI C4-5D-D8: Max TMDS rate is > 0 and <= 340 or > 600.
EDID:
  Extension Block 2 started with EDID header, ignoring Extension Blocks >= 2.
  CTA-861: Native progressive timings are a mix of several resolutions.

EDID conformity: FAIL
