edid-decode (hex):

00 ff ff ff ff ff ff 00 12 53 55 25 01 00 40 23
0c 22 01 04 b5 1d 11 78 3a 35 85 a6 56 48 9a 24
12 50 54 a1 08 00 59 c0 d1 c0 81 c0 81 40 81 80
81 c0 d1 c0 01 01 34 13 c0 10 31 80 19 20 28 60
3a 00 25 a5 10 00 00 1e 00 00 00 fd 00 38 3e 0f
78 1c 00 0a 20 20 20 20 20 20 00 00 00 fc 00 54
59 50 45 2d 43 0a 20 20 20 20 20 20 00 00 00 ff
00 4c 35 36 30 35 31 37 39 34 33 30 32 0a 01 bc

02 03 16 72 44 10 01 02 04 23 09 7f 07 83 01 00
00 65 03 0c 00 10 ef 68 00 a0 a0 40 2e 60 30 20
36 00 a0 5a 00 00 00 1a 04 10 c0 00 31 1c 16 20
30 20 35 00 a0 5a 00 00 00 1a d8 09 e0 40 11 40
cd 10 60 10 a2 00 a0 5a 00 00 00 1e 02 3a 80 18
71 38 2d 40 58 2c 35 00 a0 5a 00 00 00 1e 34 13
c0 10 31 80 19 20 28 60 3a 00 a0 5a 00 00 00 1e
00 00 00 00 00 00 00 00 00 00 00 00 00 00 00 80

00 ff ff ff ff ff ff 00 12 53 55 25 01 00 40 23
0c 22 01 04 b5 1d 11 78 3a 35 85 a6 56 48 9a 24
12 50 54 a1 08 00 59 c0 d1 c0 81 c0 81 40 81 80
81 c0 d1 c0 01 01 34 13 c0 10 31 80 19 20 28 60
3a 00 25 a5 10 00 00 1e 00 00 00 fd 00 38 3e 0f
78 1c 00 0a 20 20 20 20 20 20 00 00 00 fc 00 54
59 50 45 2d 43 0a 20 20 20 20 20 20 00 00 00 ff
00 4c 35 36 30 35 31 37 39 34 33 30 32 0a 01 bc

02 03 16 72 44 10 01 02 04 23 09 7f 07 83 01 00
00 65 03 0c 00 10 ef 68 00 a0 a0 40 2e 60 30 20
36 00 a0 5a 00 00 00 1a 04 10 c0 00 31 1c 16 20
30 20 35 00 a0 5a 00 00 00 1a d8 09 e0 40 11 40
cd 10 60 10 a2 00 a0 5a 00 00 00 1e 02 3a 80 18
71 38 2d 40 58 2c 35 00 a0 5a 00 00 00 1e 34 13
c0 10 31 80 19 20 28 60 3a 00 a0 5a 00 00 00 1e
00 00 00 00 00 00 00 00 00 00 00 00 00 00 00 80

----------------

Block 0, Base EDID:
  EDID Structure Version & Revision: 1.4
  Vendor & Product Identification:
    Manufacturer: DRS
    Model: 9557
    Serial Number: ...
    Made in: week 12 of 2024
  Basic Display Parameters & Features:
    Digital display
    Bits per primary color channel: 10
    DisplayPort interface
    Maximum image size: 29 cm x 17 cm
    Gamma: 2.20
    DPMS levels: Off
    Supported color formats: RGB 4:4:4, YCrCb 4:4:4, YCrCb 4:2:2
    First detailed timing includes the native pixel format and preferred refresh rate
  Color Characteristics:
    Red  : 0.6484, 0.3388
    Green: 0.2822, 0.6025
    Blue : 0.1425, 0.0703
    White: 0.3134, 0.3291
  Established Timings I & II:
    IBM     :   720x400    70.081663 Hz   9:5     31.467 kHz     28.320000 MHz
    DMT 0x04:   640x480    59.940476 Hz   4:3     31.469 kHz     25.175000 MHz
    DMT 0x09:   800x600    60.316541 Hz   4:3     37.879 kHz     40.000000 MHz
    DMT 0x10:  1024x768    60.003840 Hz   4:3     48.363 kHz     65.000000 MHz
  Standard Timings:
    GTF     :   960x540    60.000530 Hz  16:9     33.540 kHz     40.785000 MHz
    DMT 0x52:  1920x1080   60.000000 Hz  16:9     67.500 kHz    148.500000 MHz
    DMT 0x55:  1280x720    60.000000 Hz  16:9     45.000 kHz     74.250000 MHz
    DMT 0x20:  1280x960    60.000000 Hz   4:3     60.000 kHz    108.000000 MHz
    DMT 0x23:  1280x1024   60.019740 Hz   5:4     63.981 kHz    108.000000 MHz
    DMT 0x55:  1280x720    60.000000 Hz  16:9     45.000 kHz     74.250000 MHz
    DMT 0x52:  1920x1080   60.000000 Hz  16:9     67.500 kHz    148.500000 MHz
  Detailed Timing Descriptors:
    DTD 1:   960x640    60.003906 Hz   3:2     39.903 kHz     49.160000 MHz (293 mm x 165 mm)
                 Hfront   40 Hsync  96 Hback  136 Hpol P
                 Vfront    3 Vsync  10 Vback   12 Vpol P
    Display Range Limits:
      Monitor ranges (GTF): 56-62 Hz V, 15-120 kHz H, max dotclock 280 MHz
    Display Product Name: 'TYPE-C'
    Display Product Serial Number: ...
  Extension blocks: 1
Checksum: 0xbc

----------------

Block 1, CTA-861 Extension Block:
  Revision: 3
  Basic audio support
  Supports YCbCr 4:4:4
  Supports YCbCr 4:2:2
  Native DTDs: 2
  Video Data Block:
    VIC  16:  1920x1080   60.000000 Hz  16:9     67.500 kHz    148.500000 MHz
    VIC   1:   640x480    59.940476 Hz   4:3     31.469 kHz     25.175000 MHz
    VIC   2:   720x480    59.940060 Hz   4:3     31.469 kHz     27.000000 MHz
    VIC   4:  1280x720    60.000000 Hz  16:9     45.000 kHz     74.250000 MHz
  Audio Data Block:
    Linear PCM:
      Max channels: 2
      Supported sample rates (kHz): 192 176.4 96 88.2 48 44.1 32
      Supported sample sizes (bits): 24 20 16
  Speaker Allocation Data Block:
    FL/FR - Front Left/Right
  Vendor-Specific Data Block (HDMI), OUI 00-0C-03:
    Source physical address: 1.0.e.f
  Detailed Timing Descriptors:
    DTD 2:  2560x1600   60.000625 Hz  16:10    98.761 kHz    268.630000 MHz (160 mm x 90 mm)
                 Hfront   48 Hsync  32 Hback   80 Hpol P
                 Vfront    3 Vsync   6 Vback   37 Vpol N
    DTD 3:   960x540    59.994849 Hz  16:9     33.717 kHz     41.000000 MHz (160 mm x 90 mm)
                 Hfront   48 Hsync  32 Hback  176 Hpol P
                 Vfront    3 Vsync   5 Vback   14 Vpol N
    DTD 4:   480x320    60.000000 Hz   3:2     31.500 kHz     25.200000 MHz (160 mm x 90 mm)
                 Hfront   96 Hsync  16 Hback  208 Hpol P
                 Vfront   10 Vsync   2 Vback  193 Vpol P
    DTD 5:  1920x1080   60.000000 Hz  16:9     67.500 kHz    148.500000 MHz (160 mm x 90 mm)
                 Hfront   88 Hsync  44 Hback  148 Hpol P
                 Vfront    3 Vsync   5 Vback   37 Vpol P
    DTD 6:   960x640    60.003906 Hz   3:2     39.903 kHz     49.160000 MHz (160 mm x 90 mm)
                 Hfront   40 Hsync  96 Hback  136 Hpol P
                 Vfront    3 Vsync  10 Vback   12 Vpol P
Checksum: 0x80  Unused space in Extension Block: 15 bytes

----------------

Warnings:

Block 0, Base EDID:
  Detailed Timing Descriptor #1: Image size is 293x165 mm, but based on the picture AR it should be 247x165 mm.
  Display Range Limits: GTF support is deprecated in EDID 1.4.
Block 1, CTA-861 Extension Block:
  IT Video Formats are overscanned by default, but normally this should be underscanned.
  Video Data Block: VIC 16 and the first DTD are not identical. Is this intended?
  Detailed Timing Descriptor #2: Dubious image size (160x90 mm is smaller than 100x100 mm).
  Detailed Timing Descriptor #3: Dubious image size (160x90 mm is smaller than 100x100 mm).
  Detailed Timing Descriptor #4: Dubious image size (160x90 mm is smaller than 100x100 mm).
  Detailed Timing Descriptor #5: DTD is similar but not identical to VIC 16.
  Detailed Timing Descriptor #5: Dubious image size (160x90 mm is smaller than 100x100 mm).
  Detailed Timing Descriptor #6: Dubious image size (160x90 mm is smaller than 100x100 mm).
  Display Product Serial Number is set, so the Serial Number in the Base EDID should be 0.
  Add a Colorimetry Data Block with the sRGB colorimetry bit set to avoid interop issues.
EDID:
  Base EDID: Some timings are out of range of the Monitor Ranges:
    Vertical Freq: 59.940 - 70.082 Hz (Monitor: 56.000 - 62.000 Hz)

Failures:

Block 0, Base EDID:
  Display Range Limits: GTF is supported, but the display does not support continuous frequencies.
Block 1, CTA-861 Extension Block:
  Vendor-Specific Data Block (HDMI), OUI 00-0C-03: The HDMI Specification requires EDID 1.3 instead of 1.4.
  Offset is 22, but should be 23.
  Detailed Timing Descriptor #2: Mismatch of image size 160x90 mm vs display size 290x170 mm.
  Detailed Timing Descriptor #3: Mismatch of image size 160x90 mm vs display size 290x170 mm.
  Detailed Timing Descriptor #4: Mismatch of image size 160x90 mm vs display size 290x170 mm.
  Detailed Timing Descriptor #5: Mismatch of image size 160x90 mm vs display size 290x170 mm.
  Detailed Timing Descriptor #6: Mismatch of image size 160x90 mm vs display size 290x170 mm.
  Missing VCDB, needed for Set Selectable RGB Quantization to avoid interop issues.
EDID:
  Extension Block 2 started with EDID header, ignoring Extension Blocks >= 2.
  CTA-861: Native progressive timings are a mix of several resolutions.

EDID conformity: FAIL
