edid-decode (hex):

00 ff ff ff ff ff ff 00 21 31 01 50 65 08 00 00
12 0f 01 04 a5 21 1b 78 e0 ae a5 a6 54 4c 99 26
14 50 54 a5 4f 00 81 80 01 01 01 01 01 01 01 01
01 01 01 01 01 01 30 2a 00 98 51 00 2a 40 30 70
13 00 51 0e 11 00 00 1e 10 0b d0 b4 20 90 31 10
12 6c d2 00 51 0e 11 00 00 1c d5 09 80 a0 20 e0
2d 10 10 60 a2 00 51 0e 11 00 00 18 00 00 00 fc
00 4c 37 32 53 0a 20 20 20 20 20 20 20 20 00 47

00 ff ff ff ff ff ff 00 21 31 01 50 65 08 00 00
12 0f 01 04 a5 21 1b 78 e0 ae a5 a6 54 4c 99 26
14 50 54 a5 4f 00 81 80 01 01 01 01 01 01 01 01
01 01 01 01 01 01 30 2a 00 98 51 00 2a 40 30 70
13 00 51 0e 11 00 00 1e 10 0b d0 b4 20 90 31 10
12 6c d2 00 51 0e 11 00 00 1c d5 09 80 a0 20 e0
2d 10 10 60 a2 00 51 0e 11 00 00 18 00 00 00 fc
00 4c 37 32 53 0a 20 20 20 20 20 20 20 20 00 47

----------------

Block 0, Base EDID:
  EDID Structure Version & Revision: 1.4
  Vendor & Product Identification:
    Manufacturer: HIQ
    Model: 20481
    Serial Number: ...
    Made in: week 18 of 2005
  Basic Display Parameters & Features:
    Digital display
    Bits per primary color channel: 8
    DisplayPort interface
    Maximum image size: 33 cm x 27 cm
    Gamma: 2.20
    DPMS levels: Standby Suspend Off
    Supported color formats: RGB 4:4:4
    First detailed timing does not include the native pixel format and preferred refresh rate
  Color Characteristics:
    Red  : 0.6503, 0.3300
    Green: 0.2998, 0.5996
    Blue : 0.1503, 0.0800
    White: 0.3134, 0.3291
  Established Timings I & II:
    IBM     :   720x400    70.081663 Hz   9:5     31.467 kHz     28.320000 MHz
    DMT 0x04:   640x480    59.940476 Hz   4:3     31.469 kHz     25.175000 MHz
    DMT 0x06:   640x480    75.000000 Hz   4:3     37.500 kHz     31.500000 MHz
    DMT 0x09:   800x600    60.316541 Hz   4:3     37.879 kHz     40.000000 MHz
    DMT 0x0b:   800x600    75.000000 Hz   4:3     46.875 kHz     49.500000 MHz
    DMT 0x10:  1024x768    60.003840 Hz   4:3     48.363 kHz     65.000000 MHz
    DMT 0x11:  1024x768    70.069359 Hz   4:3     56.476 kHz     75.000000 MHz
    DMT 0x12:  1024x768    75.028582 Hz   4:3     60.023 kHz     78.750000 MHz
    DMT 0x24:  1280x1024   75.024675 Hz   5:4     79.976 kHz    135.000000 MHz
  Standard Timings:
    DMT 0x23:  1280x1024   60.019740 Hz   5:4     63.981 kHz    108.000000 MHz
  Detailed Timing Descriptors:
    DTD 1:  1280x1024   60.019740 Hz   5:4     63.981 kHz    108.000000 MHz (337 mm x 270 mm)
                 Hfront   48 Hsync 112 Hback  248 Hpol P
                 Vfront    1 Vsync   3 Vback   38 Vpol P
    DTD 2:   720x400    70.081663 Hz   9:5     31.467 kHz     28.320000 MHz (337 mm x 270 mm)
                 Hfront   18 Hsync 108 Hback   54 Hpol N
                 Vfront   13 Vsync   2 Vback   34 Vpol P
    DTD 3:   640x480    59.928571 Hz   4:3     31.462 kHz     25.170000 MHz (337 mm x 270 mm)
                 Hfront   16 Hsync  96 Hback   48 Hpol N
                 Vfront   10 Vsync   2 Vback   33 Vpol N
    Display Product Name: 'L72S'
Checksum: 0x47

----------------

Warnings:

Block 0, Base EDID:
  Detailed Timing Descriptor #2: Image size is 337x270 mm, but based on the picture AR it should be 337x187 mm.
  Detailed Timing Descriptor #3: Image size is 337x270 mm, but based on the picture AR it should be 337x252 mm.
EDID:
  No Native Video Resolution was defined.

Failures:

EDID:
  Extension Block 1 started with EDID header, ignoring Extension Blocks >= 1.

EDID conformity: FAIL
