edid-decode (hex):

00 ff ff ff ff ff ff 00 0d ae e5 14 00 00 00 00
24 1f 01 04 a5 1f 11 78 02 08 65 97 5b 54 8e 27
1e 50 54 00 00 00 01 01 01 01 01 01 01 01 01 01
01 01 01 01 01 01 b4 3b 80 4a 71 38 34 40 50 3c
68 00 35 ad 10 00 00 18 00 00 00 fe 00 4e 31 34
30 48 47 41 2d 45 41 31 0a 20 00 00 00 fe 00 43
4d 4e 0a 20 20 20 20 20 20 20 20 20 00 00 00 fe
00 4e 31 34 30 48 47 41 2d 45 41 31 0a 20 00 29

00 ff ff ff ff ff ff 00 0d ae e5 14 00 00 00 00
24 1f 01 04 a5 1f 11 78 02 08 65 97 5b 54 8e 27
1e 50 54 00 00 00 01 01 01 01 01 01 01 01 01 01
01 01 01 01 01 01 b4 3b 80 4a 71 38 34 40 50 3c
68 00 35 ad 10 00 00 18 00 00 00 fe 00 4e 31 34
30 48 47 41 2d 45 41 31 0a 20 00 00 00 fe 00 43
4d 4e 0a 20 20 20 20 20 20 20 20 20 00 00 00 fe
00 4e 31 34 30 48 47 41 2d 45 41 31 0a 20 00 29

----------------

Block 0, Base EDID:
  EDID Structure Version & Revision: 1.4
  Vendor & Product Identification:
    Manufacturer: CMN
    Model: 5349
    Made in: week 36 of 2021
  Basic Display Parameters & Features:
    Digital display
    Bits per primary color channel: 8
    DisplayPort interface
    Maximum image size: 31 cm x 17 cm
    Gamma: 2.20
    Supported color formats: RGB 4:4:4
    First detailed timing includes the native pixel format and preferred refresh rate
  Color Characteristics:
    Red  : 0.5898, 0.3554
    Green: 0.3300, 0.5546
    Blue : 0.1533, 0.1191
    White: 0.3134, 0.3291
  Established Timings I & II: none
  Standard Timings: none
  Detailed Timing Descriptors:
    DTD 1:  1920x1080   60.007852 Hz  16:9     67.929 kHz    152.840000 MHz (309 mm x 173 mm)
                 Hfront   80 Hsync  60 Hback  190 Hpol N
                 Vfront    6 Vsync   8 Vback   38 Vpol N
    Alphanumeric Data String: 'N140HGA-EA1'
    Alphanumeric Data String: 'CMN'
    Alphanumeric Data String: 'N140HGA-EA1'
Checksum: 0x29

----------------

Warnings:

Block 0, Base EDID:
  Missing Display Product Name.

Failures:

EDID:
  Extension Block 1 started with EDID header, ignoring Extension Blocks >= 1.

EDID conformity: FAIL
