edid-decode (hex):

00 ff ff ff ff ff ff 00 34 a4 4c c6 00 00 00 00
0e 0f 01 03 80 47 28 78 0a 03 20 a7 55 45 96 24
11 49 4b a1 08 00 81 80 81 c0 8c c0 01 01 01 01
01 01 01 01 01 01 42 21 56 a0 51 00 1e 30 50 38
35 00 c5 8f 21 00 00 1e 0e 1f 00 80 51 00 1e 30
48 80 37 00 c5 8f 21 00 00 1e 00 00 00 fc 00 4d
65 64 69 6f 6e 20 33 30 31 33 32 0a 00 00 00 fd
00 32 3c 1c 41 08 00 0a 20 20 20 20 20 20 00 4b

----------------

Block 0, Base EDID:
  EDID Structure Version & Revision: 1.3
  Vendor & Product Identification:
    Manufacturer: MED
    Model: 50764
    Made in: week 14 of 2005
  Basic Display Parameters & Features:
    Digital display
    Maximum image size: 71 cm x 40 cm
    Gamma: 2.20
    RGB color display
    First detailed timing is the preferred timing
  Color Characteristics:
    Red  : 0.6523, 0.3320
    Green: 0.2695, 0.5888
    Blue : 0.1406, 0.0683
    White: 0.2851, 0.2929
  Established Timings I & II:
    IBM     :   720x400    70.081663 Hz   9:5     31.467 kHz     28.320000 MHz
    DMT 0x04:   640x480    59.940476 Hz   4:3     31.469 kHz     25.175000 MHz
    DMT 0x09:   800x600    60.316541 Hz   4:3     37.879 kHz     40.000000 MHz
    DMT 0x10:  1024x768    60.003840 Hz   4:3     48.363 kHz     65.000000 MHz
  Standard Timings:
    DMT 0x23:  1280x1024   60.019740 Hz   5:4     63.981 kHz    108.000000 MHz
    DMT 0x55:  1280x720    60.000000 Hz  16:9     45.000 kHz     74.250000 MHz
    GTF     :  1368x769    60.000000 Hz  16:9     47.760 kHz     85.968000 MHz
  Detailed Timing Descriptors:
    DTD 1:  1366x768    59.871902 Hz 683:384   47.778 kHz     85.140000 MHz (709 mm x 399 mm)
                 Hfront   80 Hsync  56 Hback  280 Hpol P
                 Vfront    3 Vsync   5 Vback   22 Vpol P
    DTD 2:  1280x768    59.870228 Hz   5:3     47.776 kHz     79.500000 MHz (709 mm x 399 mm)
                 Hfront   72 Hsync 128 Hback  184 Hpol P
                 Vfront    3 Vsync   7 Vback   20 Vpol P
    Display Product Name: 'Medion 30132'
    Display Range Limits:
      Monitor ranges (GTF): 50-60 Hz V, 28-65 kHz H, max dotclock 80 MHz
Checksum: 0x4b

----------------

Warnings:

Block 0, Base EDID:
  Standard Timings: Standard Timing 1368x769 has a dubious odd vertical resolution.
  Detailed Timing Descriptor #2: DTD is similar but not identical to DMT 0x17.
  Detailed Timing Descriptor #2: Image size is 709x399 mm, but based on the picture AR it should be 665x399 mm.
EDID:
  Base EDID: Some timings are out of range of the Monitor Ranges:
    Vertical Freq: 59.870 - 70.082 Hz (Monitor: 50.000 - 60.000 Hz)
    Maximum Clock: 108.000 MHz (Monitor: 80.000 MHz)

EDID conformity: PASS
