edid-decode (hex):

00 ff ff ff ff ff ff 00 30 e4 c3 05 00 00 00 00
00 1b 01 04 a5 26 15 78 0a 0b b5 a3 59 55 a0 27
0c 50 54 00 00 00 01 01 01 01 01 01 01 01 01 01
01 01 01 01 01 01 b4 34 80 68 70 38 1f 40 30 20
35 00 7e d7 10 00 00 1a 2a 2a 80 68 70 38 1f 40
30 20 35 00 7e d7 10 00 00 1a 00 00 00 fe 00 47
43 57 4b 59 80 31 37 33 57 46 34 0a 00 00 00 00
00 01 41 31 9e 00 10 00 00 0a 01 0a 20 20 00 ff

----------------

Block 0, Base EDID:
  EDID Structure Version & Revision: 1.4
  Vendor & Product Identification:
    Manufacturer: LGD
    Model: 1475
    Made in: 2017
  Basic Display Parameters & Features:
    Digital display
    Bits per primary color channel: 8
    DisplayPort interface
    Maximum image size: 38 cm x 21 cm
    Gamma: 2.20
    Supported color formats: RGB 4:4:4, YCrCb 4:4:4
    First detailed timing includes the native pixel format and preferred refresh rate
  Color Characteristics:
    Red  : 0.6367, 0.3476
    Green: 0.3339, 0.6279
    Blue : 0.1542, 0.0498
    White: 0.3134, 0.3291
  Established Timings I & II: none
  Standard Timings: none
  Detailed Timing Descriptors:
    DTD 1:  1920x1080   60.000071 Hz  16:9     66.660 kHz    134.920000 MHz (382 mm x 215 mm)
                 Hfront   48 Hsync  32 Hback   24 Hpol P
                 Vfront    3 Vsync   5 Vback   23 Vpol N
    DTD 2:  1920x1080   48.001836 Hz  16:9     53.330 kHz    107.940000 MHz (382 mm x 215 mm)
                 Hfront   48 Hsync  32 Hback   24 Hpol P
                 Vfront    3 Vsync   5 Vback   23 Vpol N
    Alphanumeric Data String: 'GCWKY.173WF4'
    Manufacturer-Specified Display Descriptor (0x00): 00 00 00 01 41 31 9e 00 10 00 00 0a 01 0a 20 20 '....A1........  '
Checksum: 0xff

----------------

Warnings:

Block 0, Base EDID:
  Alphanumeric Data String: Non-ASCII character 0x80 at position 5, can cause problems.
  Missing Display Product Name.

EDID conformity: PASS
