edid-decode (hex):

00 ff ff ff ff ff ff 00 09 e5 38 0b 03 00 00 00
14 20 01 04 b5 22 15 78 03 a5 a5 a7 53 4c 9b 25
0e 50 54 00 00 00 01 01 01 01 01 01 01 01 01 01
01 01 01 01 01 01 90 6f 00 a0 a0 40 96 60 30 20
36 00 58 d7 10 00 00 1a 00 00 00 fd 0c 3c a5 21
21 4f 01 0a 20 20 20 20 20 20 00 00 00 fe 00 42
4f 45 20 4e 4a 0a 20 20 20 20 20 20 00 00 00 fe
00 4e 45 31 36 30 51 44 4d 2d 4e 59 43 0a 01 04

70 12 79 00 00 03 01 14 cc 32 01 85 ff 09 9f 00
2f 00 1f 00 3f 06 95 00 02 00 05 00 00 00 00 00
00 00 00 00 00 00 00 00 00 00 00 00 00 00 00 00
00 00 00 00 00 00 00 00 00 00 00 00 00 00 00 00
00 00 00 00 00 00 00 00 00 00 00 00 00 00 00 00
00 00 00 00 00 00 00 00 00 00 00 00 00 00 00 00
00 00 00 00 00 00 00 00 00 00 00 00 00 00 00 00
00 00 00 00 00 00 00 00 00 00 00 00 00 00 03 90

00 ff ff ff ff ff ff 00 09 e5 38 0b 03 00 00 00
14 20 01 04 b5 22 15 78 03 a5 a5 a7 53 4c 9b 25
0e 50 54 00 00 00 01 01 01 01 01 01 01 01 01 01
01 01 01 01 01 01 90 6f 00 a0 a0 40 96 60 30 20
36 00 58 d7 10 00 00 1a 00 00 00 fd 0c 3c a5 21
21 4f 01 0a 20 20 20 20 20 20 00 00 00 fe 00 42
4f 45 20 4e 4a 0a 20 20 20 20 20 20 00 00 00 fe
00 4e 45 31 36 30 51 44 4d 2d 4e 59 43 0a 01 04

70 12 79 00 00 03 01 14 cc 32 01 85 ff 09 9f 00
2f 00 1f 00 3f 06 95 00 02 00 05 00 00 00 00 00
00 00 00 00 00 00 00 00 00 00 00 00 00 00 00 00
00 00 00 00 00 00 00 00 00 00 00 00 00 00 00 00
00 00 00 00 00 00 00 00 00 00 00 00 00 00 00 00
00 00 00 00 00 00 00 00 00 00 00 00 00 00 00 00
00 00 00 00 00 00 00 00 00 00 00 00 00 00 00 00
00 00 00 00 00 00 00 00 00 00 00 00 00 00 03 90

----------------

Block 0, Base EDID:
  EDID Structure Version & Revision: 1.4
  Vendor & Product Identification:
    Manufacturer: BOE
    Model: 2872
    Serial Number: ...
    Made in: week 20 of 2022
  Basic Display Parameters & Features:
    Digital display
    Bits per primary color channel: 10
    DisplayPort interface
    Maximum image size: 34 cm x 21 cm
    Gamma: 2.20
    Supported color formats: RGB 4:4:4
    First detailed timing includes the native pixel format and preferred refresh rate
    Display supports continuous frequencies
  Color Characteristics:
    Red  : 0.6542, 0.3261
    Green: 0.2978, 0.6064
    Blue : 0.1464, 0.0566
    White: 0.3134, 0.3291
  Established Timings I & II: none
  Standard Timings: none
  Detailed Timing Descriptors:
    DTD 1:  2560x1600   60.000000 Hz  16:10   105.000 kHz    285.600000 MHz (344 mm x 215 mm)
                 Hfront   48 Hsync  32 Hback   80 Hpol P
                 Vfront    3 Vsync   6 Vback  141 Vpol N
    Display Range Limits:
      Monitor ranges (Range Limits Only): 60-165 Hz V, 288-288 kHz H, max dotclock 790 MHz
    Alphanumeric Data String: 'BOE NJ'
    Alphanumeric Data String: 'NE160QDM-NYC'
  Extension blocks: 1
Checksum: 0x04

----------------

Block 1, DisplayID Extension Block:
  Version: 1.2
  Extension Count: 0
  Display Product Type: Extension Section
  Video Timing Modes Type 1 - Detailed Timings Data Block:
    DTD:  2560x1600  165.002101 Hz  16:10   288.754 kHz    785.410000 MHz (aspect 16:10, no 3D stereo, preferred)
               Hfront   48 Hsync  32 Hback   80 Hpol N
               Vfront    3 Vsync   6 Vback  141 Vpol N
  Checksum: 0x03
Checksum: 0x90

----------------

Block 2, Unknown EDID Extension Block 0x00:
  00 ff ff ff ff ff ff 00 09 e5 38 0b 03 00 00 00 '..........8.....'
  14 20 01 04 b5 22 15 78 03 a5 a5 a7 53 4c 9b 25 '. ...".x....SL.%'
  0e 50 54 00 00 00 01 01 01 01 01 01 01 01 01 01 '.PT.............'
  01 01 01 01 01 01 90 6f 00 a0 a0 40 96 60 30 20 '.......o...@.`0 '
  36 00 58 d7 10 00 00 1a 00 00 00 fd 0c 3c a5 21 '6.X..........<.!'
  21 4f 01 0a 20 20 20 20 20 20 00 00 00 fe 00 42 '!O..      .....B'
  4f 45 20 4e 4a 0a 20 20 20 20 20 20 00 00 00 fe 'OE NJ.      ....'
  00 4e 45 31 36 30 51 44 4d 2d 4e 59 43 0a 01 04 '.NE160QDM-NYC...'
Checksum: 0x04

----------------

Block 3, DisplayID Extension Block:
  Version: 1.2
  Extension Count: 0
  Video Timing Modes Type 1 - Detailed Timings Data Block:
    DTD:  2560x1600  165.002101 Hz  16:10   288.754 kHz    785.410000 MHz (aspect 16:10, no 3D stereo, preferred)
               Hfront   48 Hsync  32 Hback   80 Hpol N
               Vfront    3 Vsync   6 Vback  141 Vpol N
  Checksum: 0x03
Checksum: 0x90

----------------

Warnings:

Block 0, Base EDID:
  Missing Display Product Name.
EDID:
  Base EDID: Some timings are out of range of the Monitor Ranges:
    Horizontal Freq: 105.000 - 288.753 kHz (Monitor: 288.000 - 288.000 kHz)

Failures:

Block 1, DisplayID Extension Block:
  DisplayID Base Block has no product type.
  Expected 0 DisplayID Extension Block, but got 1.
Block 2, Base EDID:
  Unknown Extension Block.
EDID:
  Base EDID: EDID specified 1 extension block(s), but found 3 extension block(s).

EDID conformity: FAIL
