edid-decode (hex):

00 ff ff ff ff ff ff 00 51 a1 56 20 00 00 00 00
28 20 01 04 b5 1e 13 78 03 66 e5 a3 53 4c 98 24
10 50 54 00 00 00 01 01 01 01 01 01 01 01 01 01
01 01 01 01 01 01 98 86 40 a0 b0 08 59 70 30 20
36 00 2c be 10 00 00 18 00 00 00 fd 00 28 78 e3
e3 45 01 0a 20 20 20 20 20 20 00 00 00 10 00 0a
20 20 20 20 20 20 20 20 20 20 20 20 00 00 00 fc
00 54 4c 31 34 30 41 44 58 50 32 32 0a 20 01 d2

70 20 79 02 00 22 00 14 d5 83 0a 05 3f 0b 9f 00
2f 00 1f 00 07 07 58 00 02 00 05 00 2b 00 0c 27
00 28 77 00 00 27 00 28 3b 00 00 81 00 14 73 1a
00 00 03 01 28 78 00 00 60 41 60 41 78 00 00 00
00 8d 00 00 00 00 00 00 00 00 00 00 00 00 00 00
00 00 00 00 00 00 00 00 00 00 00 00 00 00 00 00
00 00 00 00 00 00 00 00 00 00 00 00 00 00 00 00
00 00 00 00 00 00 00 00 00 00 00 00 00 00 90 90

00 ff ff ff ff ff ff 00 51 a1 56 20 00 00 00 00
28 20 01 04 b5 1e 13 78 03 66 e5 a3 53 4c 98 24
10 50 54 00 00 00 01 01 01 01 01 01 01 01 01 01
01 01 01 01 01 01 98 86 40 a0 b0 08 59 70 30 20
36 00 2c be 10 00 00 18 00 00 00 fd 00 28 78 e3
e3 45 01 0a 20 20 20 20 20 20 00 00 00 10 00 0a
20 20 20 20 20 20 20 20 20 20 20 20 00 00 00 fc
00 54 4c 31 34 30 41 44 58 50 32 32 0a 20 01 d2

70 20 79 02 00 22 00 14 d5 83 0a 05 3f 0b 9f 00
2f 00 1f 00 07 07 58 00 02 00 05 00 2b 00 0c 27
00 28 77 00 00 27 00 28 3b 00 00 81 00 14 73 1a
00 00 03 01 28 78 00 00 60 41 60 41 78 00 00 00
00 8d 00 00 00 00 00 00 00 00 00 00 00 00 00 00
00 00 00 00 00 00 00 00 00 00 00 00 00 00 00 00
00 00 00 00 00 00 00 00 00 00 00 00 00 00 00 00
00 00 00 00 00 00 00 00 00 00 00 00 00 00 90 90

----------------

Block 0, Base EDID:
  EDID Structure Version & Revision: 1.4
  Vendor & Product Identification:
    Manufacturer: TMA
    Model: 8278
    Made in: week 40 of 2022
  Basic Display Parameters & Features:
    Digital display
    Bits per primary color channel: 10
    DisplayPort interface
    Maximum image size: 30 cm x 19 cm
    Gamma: 2.20
    Supported color formats: RGB 4:4:4
    First detailed timing includes the native pixel format and preferred refresh rate
    Display supports continuous frequencies
  Color Characteristics:
    Red  : 0.6376, 0.3261
    Green: 0.2978, 0.5957
    Blue : 0.1435, 0.0644
    White: 0.3134, 0.3291
  Established Timings I & II: none
  Standard Timings: none
  Detailed Timing Descriptors:
    DTD 1:  2880x1800   60.001114 Hz  16:10   113.342 kHz    344.560000 MHz (300 mm x 190 mm)
                 Hfront   48 Hsync  32 Hback   80 Hpol N
                 Vfront    3 Vsync   6 Vback   80 Vpol N
    Display Range Limits:
      Monitor ranges (Range Limits Only): 40-120 Hz V, 227-227 kHz H, max dotclock 690 MHz
    Dummy Descriptor:
    Display Product Name: 'TL140ADXP22'
  Extension blocks: 1
Checksum: 0xd2

----------------

Block 1, DisplayID Extension Block:
  Version: 2.0
  Extension Count: 0
  Display Product Primary Use Case: None of the listed primary use cases; generic display
  Video Timing Modes Type 7 - Detailed Timings Data Block:
    DTD:  2880x1800  120.000488 Hz  16:10   226.681 kHz    689.110000 MHz (aspect 16:10, no 3D stereo)
               Hfront   48 Hsync  32 Hback   80 Hpol N
               Vfront    3 Vsync   6 Vback   80 Vpol N
  Adaptive Sync Data Block:
    Descriptor #1:
      Native Panel Range
      Fixed Average V-Total and Adaptive V-Total
      Supports Seamless Transition
      'Max Single Frame Duration Increase' field value without jitter impact
      'Max Single Frame Duration Decrease' field value without jitter impact
      Max Duration Increase: 0.00 ms
      Max Duration Decrease: 0.00 ms
      Min Refresh Rate: 40 Hz
      Max Refresh Rate: 120 Hz
    Descriptor #2:
      Native Panel Range
      Fixed Average V-Total and Adaptive V-Total
      Supports Seamless Transition
      'Max Single Frame Duration Increase' field value without jitter impact
      'Max Single Frame Duration Decrease' field value without jitter impact
      Max Duration Increase: 0.00 ms
      Max Duration Decrease: 0.00 ms
      Min Refresh Rate: 40 Hz
      Max Refresh Rate: 60 Hz
  CTA-861 DisplayID Data Block:
  Vendor-Specific Data Block (AMD), OUI 00-00-1A:
    Version: 3
    Feature Caps: 0x01
    Minimum Refresh Rate: 40 Hz
    Maximum Refresh Rate: 120 Hz
    Flags 1.x: 0x00
    Flags 2.x: 0x00
  Checksum: 0x90
Checksum: 0x90

----------------

Warnings:

EDID:
  Base EDID: Some timings are out of range of the Monitor Ranges:
    Horizontal Freq: 113.342 - 226.680 kHz (Monitor: 227.000 - 227.000 kHz)

Failures:

Block 0, Base EDID:
  Dummy Descriptor: Dummy block filled with garbage.
EDID:
  Extension Block 2 started with EDID header, ignoring Extension Blocks >= 2.
  DisplayID: Missing DisplayID Display Parameters Data Block.
  DisplayID: DisplayID expects at least one preferred timing.

EDID conformity: FAIL
