edid-decode (hex):

00 ff ff ff ff ff ff 00 41 0c 42 08 00 d5 01 00
05 11 01 03 1e 2b 1b 78 ee 85 c5 a4 55 4a 9c 24
14 50 54 bf ef 80 71 4a 71 4f 81 40 81 80 a9 40
b3 00 b3 0f a9 4f 08 39 90 30 62 1a 27 40 68 b0
36 00 b1 0f 11 00 00 1a 00 00 00 ff 00 42 5a 33
30 37 30 35 31 32 30 30 36 34 00 00 00 fc 00 50
68 69 6c 69 70 73 20 32 30 30 57 42 00 00 00 fd
00 38 4c 1e 62 15 00 0a 20 20 20 20 20 20 00 0b

00 ff ff ff ff ff ff 00 41 0c 42 08 00 d5 01 00
05 11 01 03 1e 2b 1b 78 ee 85 c5 a4 55 4a 9c 24
14 50 54 bf ef 80 71 4a 71 4f 81 40 81 80 a9 40
b3 00 b3 0f a9 4f 08 39 90 30 62 1a 27 40 68 b0
36 00 b1 0f 11 00 00 1a 00 00 00 ff 00 42 5a 33
30 37 30 35 31 32 30 30 36 34 00 00 00 fc 00 50
68 69 6c 69 70 73 20 32 30 30 57 42 00 00 00 fd
00 38 4c 1e 62 15 00 0a 20 20 20 20 20 20 00 0b

----------------

Block 0, Base EDID:
  EDID Structure Version & Revision: 1.3
  Vendor & Product Identification:
    Manufacturer: PHL
    Model: 2114
    Serial Number: ...
    Made in: week 5 of 2007
  Basic Display Parameters & Features:
    Analog display
    Signal Level Standard: 0.700 : 0.300 : 1.000 V p-p
    Blank-to-black setup/pedestal
    Sync: Separate Composite SyncOnGreen
    Maximum image size: 43 cm x 27 cm
    Gamma: 2.20
    DPMS levels: Standby Suspend Off
    RGB color display
    Default (sRGB) color space is primary color space
    First detailed timing is the preferred timing
  Color Characteristics:
    Red  : 0.6425, 0.3320
    Green: 0.2900, 0.6103
    Blue : 0.1435, 0.0781
    White: 0.3134, 0.3291
  Established Timings I & II:
    IBM     :   720x400    70.081663 Hz   9:5     31.467 kHz     28.320000 MHz
    DMT 0x04:   640x480    59.940476 Hz   4:3     31.469 kHz     25.175000 MHz
    Apple   :   640x480    66.666667 Hz   4:3     35.000 kHz     30.240000 MHz
    DMT 0x05:   640x480    72.808802 Hz   4:3     37.861 kHz     31.500000 MHz
    DMT 0x06:   640x480    75.000000 Hz   4:3     37.500 kHz     31.500000 MHz
    DMT 0x08:   800x600    56.250000 Hz   4:3     35.156 kHz     36.000000 MHz
    DMT 0x09:   800x600    60.316541 Hz   4:3     37.879 kHz     40.000000 MHz
    DMT 0x0a:   800x600    72.187572 Hz   4:3     48.077 kHz     50.000000 MHz
    DMT 0x0b:   800x600    75.000000 Hz   4:3     46.875 kHz     49.500000 MHz
    Apple   :   832x624    74.551266 Hz   4:3     49.726 kHz     57.284000 MHz
    DMT 0x10:  1024x768    60.003840 Hz   4:3     48.363 kHz     65.000000 MHz
    DMT 0x11:  1024x768    70.069359 Hz   4:3     56.476 kHz     75.000000 MHz
    DMT 0x12:  1024x768    75.028582 Hz   4:3     60.023 kHz     78.750000 MHz
    DMT 0x24:  1280x1024   75.024675 Hz   5:4     79.976 kHz    135.000000 MHz
    Apple   :  1152x870    75.061550 Hz 192:145   68.681 kHz    100.000000 MHz
  Standard Timings:
    GTF     :  1152x864    70.000000 Hz   4:3     63.000 kHz     96.768000 MHz
    DMT 0x15:  1152x864    75.000000 Hz   4:3     67.500 kHz    108.000000 MHz
    DMT 0x20:  1280x960    60.000000 Hz   4:3     60.000 kHz    108.000000 MHz
    DMT 0x23:  1280x1024   60.019740 Hz   5:4     63.981 kHz    108.000000 MHz
    DMT 0x33:  1600x1200   60.000000 Hz   4:3     75.000 kHz    162.000000 MHz
    DMT 0x3a:  1680x1050   59.954250 Hz  16:10    65.290 kHz    146.250000 MHz
    DMT 0x3b:  1680x1050   74.892027 Hz  16:10    82.306 kHz    187.000000 MHz
    DMT 0x36:  1600x1200   75.000000 Hz   4:3     93.750 kHz    202.500000 MHz
  Detailed Timing Descriptors:
    DTD 1:  1680x1050   59.851764 Hz  16:10    65.179 kHz    146.000000 MHz (433 mm x 271 mm)
                 Hfront  104 Hsync 176 Hback  280 Hpol P
                 Vfront    3 Vsync   6 Vback   30 Vpol N
    Display Product Serial Number: ...
    Display Product Name: 'Philips 200WB'
    Display Range Limits:
      Monitor ranges (GTF): 56-76 Hz V, 30-98 kHz H, max dotclock 210 MHz
Checksum: 0x0b

----------------

Failures:

Block 0, Base EDID:
  Basic Display Parameters & Features: sRGB is signaled, but the chromaticities do not match.
EDID:
  Extension Block 1 started with EDID header, ignoring Extension Blocks >= 1.

EDID conformity: FAIL
