edid-decode (hex):

00 ff ff ff ff ff ff 00 3d ef 24 22 01 01 01 01
02 1b 01 03 80 34 1e 78 ea 2d 36 a7 54 38 ae 26
0d 4f 54 bd cf 00 d1 c0 b3 00 95 00 81 80 a9 c0
81 00 71 40 81 40 02 3a 80 18 71 38 2d 40 58 2c
45 00 dd 0c 11 00 00 1e 66 21 56 b0 51 00 1b 30
40 70 36 00 9a e6 10 00 00 1e 00 00 00 fd 00 38
4c 1e 53 0f 00 0a 20 20 20 20 20 20 00 00 00 fc
00 4d 41 32 32 32 34 57 0a 20 20 20 20 20 01 b6

02 03 1e f1 4b 10 1f 05 14 04 13 03 12 02 11 01
23 09 07 07 83 01 00 00 65 03 0c 00 10 00 8c 0a
d0 8a 20 e0 2d 10 10 3e 96 00 56 50 21 00 00 18
01 1d 00 72 51 d0 1e 20 6e 28 55 00 56 50 21 00
00 1e 8c 0a d0 8a 20 e0 2d 10 10 3e 96 00 56 50
21 00 00 18 8c 0a d0 90 20 40 31 20 0c 40 55 00
56 50 21 00 00 18 00 00 00 00 00 00 00 00 00 00
00 00 00 00 00 00 00 00 00 00 00 00 00 00 00 11

00 ff ff ff ff ff ff 00 3d ef 24 22 01 01 01 01
02 1b 01 03 80 34 1e 78 ea 2d 36 a7 54 38 ae 26
0d 4f 54 bd cf 00 d1 c0 b3 00 95 00 81 80 a9 c0
81 00 71 40 81 40 02 3a 80 18 71 38 2d 40 58 2c
45 00 dd 0c 11 00 00 1e 66 21 56 b0 51 00 1b 30
40 70 36 00 9a e6 10 00 00 1e 00 00 00 fd 00 38
4c 1e 53 0f 00 0a 20 20 20 20 20 20 00 00 00 fc
00 4d 41 32 32 32 34 57 0a 20 20 20 20 20 01 b6

02 03 1e f1 4b 10 1f 05 14 04 13 03 12 02 11 01
23 09 07 07 83 01 00 00 65 03 0c 00 10 00 8c 0a
d0 8a 20 e0 2d 10 10 3e 96 00 56 50 21 00 00 18
01 1d 00 72 51 d0 1e 20 6e 28 55 00 56 50 21 00
00 1e 8c 0a d0 8a 20 e0 2d 10 10 3e 96 00 56 50
21 00 00 18 8c 0a d0 90 20 40 31 20 0c 40 55 00
56 50 21 00 00 18 00 00 00 00 00 00 00 00 00 00
00 00 00 00 00 00 00 00 00 00 00 00 00 00 00 11

----------------

Block 0, Base EDID:
  EDID Structure Version & Revision: 1.3
  Vendor & Product Identification:
    Manufacturer: OOO
    Model: 8740
    Serial Number: ...
    Made in: week 2 of 2017
  Basic Display Parameters & Features:
    Digital display
    Maximum image size: 52 cm x 30 cm
    Gamma: 2.20
    DPMS levels: Standby Suspend Off
    RGB color display
    First detailed timing is the preferred timing
  Color Characteristics:
    Red  : 0.6523, 0.3300
    Green: 0.2216, 0.6806
    Blue : 0.1484, 0.0537
    White: 0.3095, 0.3300
  Established Timings I & II:
    IBM     :   720x400    70.081663 Hz   9:5     31.467 kHz     28.320000 MHz
    DMT 0x04:   640x480    59.940476 Hz   4:3     31.469 kHz     25.175000 MHz
    Apple   :   640x480    66.666667 Hz   4:3     35.000 kHz     30.240000 MHz
    DMT 0x05:   640x480    72.808802 Hz   4:3     37.861 kHz     31.500000 MHz
    DMT 0x06:   640x480    75.000000 Hz   4:3     37.500 kHz     31.500000 MHz
    DMT 0x09:   800x600    60.316541 Hz   4:3     37.879 kHz     40.000000 MHz
    DMT 0x0a:   800x600    72.187572 Hz   4:3     48.077 kHz     50.000000 MHz
    DMT 0x0b:   800x600    75.000000 Hz   4:3     46.875 kHz     49.500000 MHz
    DMT 0x10:  1024x768    60.003840 Hz   4:3     48.363 kHz     65.000000 MHz
    DMT 0x11:  1024x768    70.069359 Hz   4:3     56.476 kHz     75.000000 MHz
    DMT 0x12:  1024x768    75.028582 Hz   4:3     60.023 kHz     78.750000 MHz
    DMT 0x24:  1280x1024   75.024675 Hz   5:4     79.976 kHz    135.000000 MHz
  Standard Timings:
    DMT 0x52:  1920x1080   60.000000 Hz  16:9     67.500 kHz    148.500000 MHz
    DMT 0x3a:  1680x1050   59.954250 Hz  16:10    65.290 kHz    146.250000 MHz
    DMT 0x2f:  1440x900    59.887445 Hz  16:10    55.935 kHz    106.500000 MHz
    DMT 0x23:  1280x1024   60.019740 Hz   5:4     63.981 kHz    108.000000 MHz
    DMT 0x53:  1600x900    60.000000 Hz  16:9     60.000 kHz    108.000000 MHz (RB)
    DMT 0x1c:  1280x800    59.810326 Hz  16:10    49.702 kHz     83.500000 MHz
    GTF     :  1152x864    60.000000 Hz   4:3     53.700 kHz     81.624000 MHz
    DMT 0x20:  1280x960    60.000000 Hz   4:3     60.000 kHz    108.000000 MHz
  Detailed Timing Descriptors:
    DTD 1:  1920x1080   60.000000 Hz  16:9     67.500 kHz    148.500000 MHz (477 mm x 268 mm)
                 Hfront   88 Hsync  44 Hback  148 Hpol P
                 Vfront    4 Vsync   5 Vback   36 Vpol P
    DTD 2:  1366x768    59.814889 Hz 683:384   47.553 kHz     85.500000 MHz (410 mm x 230 mm)
                 Hfront   64 Hsync 112 Hback  256 Hpol P
                 Vfront    3 Vsync   6 Vback   18 Vpol P
    Display Range Limits:
      Monitor ranges (GTF): 56-76 Hz V, 30-83 kHz H, max dotclock 150 MHz
    Display Product Name: 'MA2224W'
  Extension blocks: 1
Checksum: 0xb6

----------------

Block 1, CTA-861 Extension Block:
  Revision: 3
  Underscans IT Video Formats by default
  Basic audio support
  Supports YCbCr 4:4:4
  Supports YCbCr 4:2:2
  Native DTDs: 1
  Video Data Block:
    VIC  16:  1920x1080   60.000000 Hz  16:9     67.500 kHz    148.500000 MHz
    VIC  31:  1920x1080   50.000000 Hz  16:9     56.250 kHz    148.500000 MHz
    VIC   5:  1920x1080i  60.000000 Hz  16:9     33.750 kHz     74.250000 MHz
    VIC  20:  1920x1080i  50.000000 Hz  16:9     28.125 kHz     74.250000 MHz
    VIC   4:  1280x720    60.000000 Hz  16:9     45.000 kHz     74.250000 MHz
    VIC  19:  1280x720    50.000000 Hz  16:9     37.500 kHz     74.250000 MHz
    VIC   3:   720x480    59.940060 Hz  16:9     31.469 kHz     27.000000 MHz
    VIC  18:   720x576    50.000000 Hz  16:9     31.250 kHz     27.000000 MHz
    VIC   2:   720x480    59.940060 Hz   4:3     31.469 kHz     27.000000 MHz
    VIC  17:   720x576    50.000000 Hz   4:3     31.250 kHz     27.000000 MHz
    VIC   1:   640x480    59.940476 Hz   4:3     31.469 kHz     25.175000 MHz
  Audio Data Block:
    Linear PCM:
      Max channels: 2
      Supported sample rates (kHz): 48 44.1 32
      Supported sample sizes (bits): 24 20 16
  Speaker Allocation Data Block:
    FL/FR - Front Left/Right
  Vendor-Specific Data Block (HDMI), OUI 00-0C-03:
    Source physical address: 1.0.0.0
  Detailed Timing Descriptors:
    DTD 3:   720x480    59.940060 Hz   3:2     31.469 kHz     27.000000 MHz (598 mm x 336 mm)
                 Hfront   16 Hsync  62 Hback   60 Hpol N
                 Vfront    9 Vsync   6 Vback   30 Vpol N
    DTD 4:  1280x720    60.000000 Hz  16:9     45.000 kHz     74.250000 MHz (598 mm x 336 mm)
                 Hfront  110 Hsync  40 Hback  220 Hpol P
                 Vfront    5 Vsync   5 Vback   20 Vpol P
    DTD 5:   720x480    59.940060 Hz   3:2     31.469 kHz     27.000000 MHz (598 mm x 336 mm)
                 Hfront   16 Hsync  62 Hback   60 Hpol N
                 Vfront    9 Vsync   6 Vback   30 Vpol N
    DTD 6:   720x576    50.000000 Hz   5:4     31.250 kHz     27.000000 MHz (598 mm x 336 mm)
                 Hfront   12 Hsync  64 Hback   68 Hpol N
                 Vfront    5 Vsync   5 Vback   39 Vpol N
Checksum: 0x11  Unused space in Extension Block: 25 bytes

----------------

Warnings:

Block 0, Base EDID:
  Vendor & Product Identification: The serial number is one of the known dummy values, it should probably be set to 0.
Block 1, CTA-861 Extension Block:
  Detailed Timing Descriptor #3: Image size is 598x336 mm, but based on the picture AR it should be 504x336 mm.
  Detailed Timing Descriptor #5: Image size is 598x336 mm, but based on the picture AR it should be 504x336 mm.
  Detailed Timing Descriptor #6: Image size is 598x336 mm, but based on the picture AR it should be 420x336 mm.
  Add a Colorimetry Data Block with the sRGB colorimetry bit set to avoid interop issues.
EDID:
  Base EDID: Some timings are out of range of the Monitor Ranges:
    Vertical Freq: 50.000 - 75.029 Hz (Monitor: 56.000 - 76.000 Hz)
    Horizontal Freq: 28.125 - 79.976 kHz (Monitor: 30.000 - 83.000 kHz)

Failures:

Block 0, Base EDID:
  Detailed Timing Descriptor #1: Mismatch of image size 477x268 mm vs display size 520x300 mm.
  Detailed Timing Descriptor #2: Mismatch of image size 410x230 mm vs display size 520x300 mm.
Block 1, CTA-861 Extension Block:
  Detailed Timing Descriptor #3: Mismatch of image size 598x336 mm vs display size 520x300 mm.
  Detailed Timing Descriptor #4: Mismatch of image size 598x336 mm vs display size 520x300 mm.
  Detailed Timing Descriptor #5: Mismatch of image size 598x336 mm vs display size 520x300 mm.
  Detailed Timing Descriptor #6: Mismatch of image size 598x336 mm vs display size 520x300 mm.
  Missing VCDB, needed for Set Selectable RGB Quantization to avoid interop issues.
EDID:
  Extension Block 2 started with EDID header, ignoring Extension Blocks >= 2.
  Base EDID: The DTD max image size is 598x336mm, which is larger than the display size 520.0x300.0mm.

EDID conformity: FAIL
