edid-decode (hex):

00 ff ff ff ff ff ff 00 30 ae d9 60 01 01 01 01
08 1b 01 03 81 2a 1a 78 2a 59 e5 a7 56 52 9c 26
10 50 54 bd cf 00 71 4f 81 80 81 8c 95 00 95 0f
81 00 01 01 01 01 9a 29 a0 d0 51 84 22 30 50 98
36 00 a3 06 11 00 00 1c 00 00 00 fd 00 32 4b 1e
51 15 00 0a 20 20 20 20 20 20 00 00 00 fc 00 4c
45 4e 20 54 32 30 35 34 70 43 0a 20 00 00 00 ff
00 56 4e 2d 41 31 4d 56 4d 34 0a 20 20 20 01 64

02 03 1e f1 4b 04 03 02 07 16 01 06 11 12 15 13
23 09 7f 07 83 01 00 00 65 03 0c 00 10 00 66 21
56 aa 51 00 1e 30 46 8f 33 00 a3 06 11 00 00 1e
8c 0a d0 8a 20 e0 2d 10 10 3e 96 00 a3 06 11 00
00 18 01 1d 00 72 51 d0 1e 20 6e 28 55 00 a3 06
11 00 00 1e a9 1a 00 a0 50 00 16 30 30 20 37 00
a3 06 11 00 00 1a 00 00 00 00 00 00 00 00 00 00
00 00 00 00 00 00 00 00 00 00 00 00 00 00 00 80

00 ff ff ff ff ff ff 00 30 ae d9 60 01 01 01 01
08 1b 01 03 81 2a 1a 78 2a 59 e5 a7 56 52 9c 26
10 50 54 bd cf 00 71 4f 81 80 81 8c 95 00 95 0f
81 00 01 01 01 01 9a 29 a0 d0 51 84 22 30 50 98
36 00 a3 06 11 00 00 1c 00 00 00 fd 00 32 4b 1e
51 15 00 0a 20 20 20 20 20 20 00 00 00 fc 00 4c
45 4e 20 54 32 30 35 34 70 43 0a 20 00 00 00 ff
00 56 4e 2d 41 31 4d 56 4d 34 0a 20 20 20 01 64

02 03 1e f1 4b 04 03 02 07 16 01 06 11 12 15 13
23 09 7f 07 83 01 00 00 65 03 0c 00 10 00 66 21
56 aa 51 00 1e 30 46 8f 33 00 a3 06 11 00 00 1e
8c 0a d0 8a 20 e0 2d 10 10 3e 96 00 a3 06 11 00
00 18 01 1d 00 72 51 d0 1e 20 6e 28 55 00 a3 06
11 00 00 1e a9 1a 00 a0 50 00 16 30 30 20 37 00
a3 06 11 00 00 1a 00 00 00 00 00 00 00 00 00 00
00 00 00 00 00 00 00 00 00 00 00 00 00 00 00 80

----------------

Block 0, Base EDID:
  EDID Structure Version & Revision: 1.3
  Vendor & Product Identification:
    Manufacturer: LEN
    Model: 24793
    Serial Number: ...
    Made in: week 8 of 2017
  Basic Display Parameters & Features:
    Digital display
    DFP 1.x compatible TMDS
    Maximum image size: 42 cm x 26 cm
    Gamma: 2.20
    DPMS levels: Off
    RGB color display
    First detailed timing is the preferred timing
  Color Characteristics:
    Red  : 0.6533, 0.3369
    Green: 0.3222, 0.6103
    Blue : 0.1513, 0.0644
    White: 0.3134, 0.3291
  Established Timings I & II:
    IBM     :   720x400    70.081663 Hz   9:5     31.467 kHz     28.320000 MHz
    DMT 0x04:   640x480    59.940476 Hz   4:3     31.469 kHz     25.175000 MHz
    Apple   :   640x480    66.666667 Hz   4:3     35.000 kHz     30.240000 MHz
    DMT 0x05:   640x480    72.808802 Hz   4:3     37.861 kHz     31.500000 MHz
    DMT 0x06:   640x480    75.000000 Hz   4:3     37.500 kHz     31.500000 MHz
    DMT 0x09:   800x600    60.316541 Hz   4:3     37.879 kHz     40.000000 MHz
    DMT 0x0a:   800x600    72.187572 Hz   4:3     48.077 kHz     50.000000 MHz
    DMT 0x0b:   800x600    75.000000 Hz   4:3     46.875 kHz     49.500000 MHz
    DMT 0x10:  1024x768    60.003840 Hz   4:3     48.363 kHz     65.000000 MHz
    DMT 0x11:  1024x768    70.069359 Hz   4:3     56.476 kHz     75.000000 MHz
    DMT 0x12:  1024x768    75.028582 Hz   4:3     60.023 kHz     78.750000 MHz
    DMT 0x24:  1280x1024   75.024675 Hz   5:4     79.976 kHz    135.000000 MHz
  Standard Timings:
    DMT 0x15:  1152x864    75.000000 Hz   4:3     67.500 kHz    108.000000 MHz
    DMT 0x23:  1280x1024   60.019740 Hz   5:4     63.981 kHz    108.000000 MHz
    GTF     :  1280x1024   72.000069 Hz   5:4     76.824 kHz    132.752000 MHz
    DMT 0x2f:  1440x900    59.887445 Hz  16:10    55.935 kHz    106.500000 MHz
    DMT 0x30:  1440x900    74.984427 Hz  16:10    70.635 kHz    136.750000 MHz
    DMT 0x1c:  1280x800    59.810326 Hz  16:10    49.702 kHz     83.500000 MHz
  Detailed Timing Descriptors:
    DTD 1:  1440x900    59.887445 Hz  16:10    55.935 kHz    106.500000 MHz (419 mm x 262 mm)
                 Hfront   80 Hsync 152 Hback  232 Hpol N
                 Vfront    3 Vsync   6 Vback   25 Vpol P
    Display Range Limits:
      Monitor ranges (GTF): 50-75 Hz V, 30-81 kHz H, max dotclock 210 MHz
    Display Product Name: 'LEN T2054pC'
    Display Product Serial Number: ...
  Extension blocks: 1
Checksum: 0x64

----------------

Block 1, CTA-861 Extension Block:
  Revision: 3
  Underscans IT Video Formats by default
  Basic audio support
  Supports YCbCr 4:4:4
  Supports YCbCr 4:2:2
  Native detailed modes: 1
  Video Data Block:
    VIC   4:  1280x720    60.000000 Hz  16:9     45.000 kHz     74.250000 MHz
    VIC   3:   720x480    59.940060 Hz  16:9     31.469 kHz     27.000000 MHz
    VIC   2:   720x480    59.940060 Hz   4:3     31.469 kHz     27.000000 MHz
    VIC   7:  1440x480i   59.940060 Hz  16:9     15.734 kHz     27.000000 MHz
    VIC  22:  1440x576i   50.000000 Hz  16:9     15.625 kHz     27.000000 MHz
    VIC   1:   640x480    59.940476 Hz   4:3     31.469 kHz     25.175000 MHz
    VIC   6:  1440x480i   59.940060 Hz   4:3     15.734 kHz     27.000000 MHz
    VIC  17:   720x576    50.000000 Hz   4:3     31.250 kHz     27.000000 MHz
    VIC  18:   720x576    50.000000 Hz  16:9     31.250 kHz     27.000000 MHz
    VIC  21:  1440x576i   50.000000 Hz   4:3     15.625 kHz     27.000000 MHz
    VIC  19:  1280x720    50.000000 Hz  16:9     37.500 kHz     74.250000 MHz
  Audio Data Block:
    Linear PCM:
      Max channels: 2
      Supported sample rates (kHz): 192 176.4 96 88.2 48 44.1 32
      Supported sample sizes (bits): 24 20 16
  Speaker Allocation Data Block:
    FL/FR - Front Left/Right
  Vendor-Specific Data Block (HDMI), OUI 00-0C-03:
    Source physical address: 1.0.0.0
  Detailed Timing Descriptors:
    DTD 2:  1366x768    59.789541 Hz 683:384   47.712 kHz     85.500000 MHz (419 mm x 262 mm)
                 Hfront   70 Hsync 143 Hback  213 Hpol P
                 Vfront    3 Vsync   3 Vback   24 Vpol P
    DTD 3:   720x480    59.940060 Hz   3:2     31.469 kHz     27.000000 MHz (419 mm x 262 mm)
                 Hfront   16 Hsync  62 Hback   60 Hpol N
                 Vfront    9 Vsync   6 Vback   30 Vpol N
    DTD 4:  1280x720    60.000000 Hz  16:9     45.000 kHz     74.250000 MHz (419 mm x 262 mm)
                 Hfront  110 Hsync  40 Hback  220 Hpol P
                 Vfront    5 Vsync   5 Vback   20 Vpol P
    DTD 5:  1280x768    59.994726 Hz   5:3     47.396 kHz     68.250000 MHz (419 mm x 262 mm)
                 Hfront   48 Hsync  32 Hback   80 Hpol P
                 Vfront    3 Vsync   7 Vback   12 Vpol N
Checksum: 0x80  Unused space in Extension Block: 25 bytes

----------------

Block 2, Unknown EDID Extension Block 0x00:
  00 ff ff ff ff ff ff 00 30 ae d9 60 01 01 01 01 '........0..`....'
  08 1b 01 03 81 2a 1a 78 2a 59 e5 a7 56 52 9c 26 '.....*.x*Y..VR.&'
  10 50 54 bd cf 00 71 4f 81 80 81 8c 95 00 95 0f '.PT...qO........'
  81 00 01 01 01 01 9a 29 a0 d0 51 84 22 30 50 98 '.......)..Q."0P.'
  36 00 a3 06 11 00 00 1c 00 00 00 fd 00 32 4b 1e '6............2K.'
  51 15 00 0a 20 20 20 20 20 20 00 00 00 fc 00 4c 'Q...      .....L'
  45 4e 20 54 32 30 35 34 70 43 0a 20 00 00 00 ff 'EN T2054pC. ....'
  00 56 4e 2d 41 31 4d 56 4d 34 0a 20 20 20 01 64 '.VN-A1MVM4.   .d'
Checksum: 0x64

----------------

Block 3, CTA-861 Extension Block:
  Revision: 3
  Underscans IT Video Formats by default
  Basic audio support
  Supports YCbCr 4:4:4
  Supports YCbCr 4:2:2
  Native detailed modes: 1
  Video Data Block:
    VIC   4:  1280x720    60.000000 Hz  16:9     45.000 kHz     74.250000 MHz
    VIC   3:   720x480    59.940060 Hz  16:9     31.469 kHz     27.000000 MHz
    VIC   2:   720x480    59.940060 Hz   4:3     31.469 kHz     27.000000 MHz
    VIC   7:  1440x480i   59.940060 Hz  16:9     15.734 kHz     27.000000 MHz
    VIC  22:  1440x576i   50.000000 Hz  16:9     15.625 kHz     27.000000 MHz
    VIC   1:   640x480    59.940476 Hz   4:3     31.469 kHz     25.175000 MHz
    VIC   6:  1440x480i   59.940060 Hz   4:3     15.734 kHz     27.000000 MHz
    VIC  17:   720x576    50.000000 Hz   4:3     31.250 kHz     27.000000 MHz
    VIC  18:   720x576    50.000000 Hz  16:9     31.250 kHz     27.000000 MHz
    VIC  21:  1440x576i   50.000000 Hz   4:3     15.625 kHz     27.000000 MHz
    VIC  19:  1280x720    50.000000 Hz  16:9     37.500 kHz     74.250000 MHz
  Audio Data Block:
    Linear PCM:
      Max channels: 2
      Supported sample rates (kHz): 192 176.4 96 88.2 48 44.1 32
      Supported sample sizes (bits): 24 20 16
  Speaker Allocation Data Block:
    FL/FR - Front Left/Right
  Vendor-Specific Data Block (HDMI), OUI 00-0C-03:
    Source physical address: 1.0.0.0
  Detailed Timing Descriptors:
    DTD 6:  1366x768    59.789541 Hz 683:384   47.712 kHz     85.500000 MHz (419 mm x 262 mm)
                 Hfront   70 Hsync 143 Hback  213 Hpol P
                 Vfront    3 Vsync   3 Vback   24 Vpol P
    DTD 7:   720x480    59.940060 Hz   3:2     31.469 kHz     27.000000 MHz (419 mm x 262 mm)
                 Hfront   16 Hsync  62 Hback   60 Hpol N
                 Vfront    9 Vsync   6 Vback   30 Vpol N
    DTD 8:  1280x720    60.000000 Hz  16:9     45.000 kHz     74.250000 MHz (419 mm x 262 mm)
                 Hfront  110 Hsync  40 Hback  220 Hpol P
                 Vfront    5 Vsync   5 Vback   20 Vpol P
    DTD 9:  1280x768    59.994726 Hz   5:3     47.396 kHz     68.250000 MHz (419 mm x 262 mm)
                 Hfront   48 Hsync  32 Hback   80 Hpol P
                 Vfront    3 Vsync   7 Vback   12 Vpol N
Checksum: 0x80  Unused space in Extension Block: 25 bytes

----------------

Warnings:

Block 0, Base EDID:
  Vendor & Product Identification: The serial number is one of the known dummy values, it should probably be set to 0.
Block 1, CTA-861 Extension Block:
  Video Data Block: VIC 4 and the first DTD are not identical. Is this intended?
  Detailed Timing Descriptor #2: Image size is 419x262 mm, but based on the picture AR it should be 419x235 mm.
  Detailed Timing Descriptor #3: Image size is 419x262 mm, but based on the picture AR it should be 419x279 mm.
  Detailed Timing Descriptor #4: Image size is 419x262 mm, but based on the picture AR it should be 419x235 mm.
  Detailed Timing Descriptor #5: Image size is 419x262 mm, but based on the picture AR it should be 419x251 mm.
  Display Product Serial Number is set, so the Serial Number in the Base EDID should be 0.
  Add a Colorimetry Data Block with the sRGB colorimetry bit set to avoid interop issues.
Block 3, CTA-861 Extension Block:
  Detailed Timing Descriptor #6: Image size is 419x262 mm, but based on the picture AR it should be 419x235 mm.
  Detailed Timing Descriptor #7: Image size is 419x262 mm, but based on the picture AR it should be 419x279 mm.
  Detailed Timing Descriptor #8: Image size is 419x262 mm, but based on the picture AR it should be 419x235 mm.
  Detailed Timing Descriptor #9: Image size is 419x262 mm, but based on the picture AR it should be 419x251 mm.
EDID:
  Base EDID: Some timings are out of range of the Monitor Ranges:
    Horizontal Freq: 15.625 - 79.976 kHz (Monitor: 30.000 - 81.000 kHz)

Failures:

Block 1, CTA-861 Extension Block:
  Missing VCDB, needed for Set Selectable RGB Quantization to avoid interop issues.
Block 2, Base EDID:
  Unknown Extension Block.
Block 3, CTA-861 Extension Block:
  Video Data Block: Duplicate VIC 4.
  Video Data Block: Duplicate VIC 3.
  Video Data Block: Duplicate VIC 2.
  Video Data Block: Duplicate VIC 7.
  Video Data Block: Duplicate VIC 22.
  Video Data Block: Duplicate VIC 1.
  Video Data Block: Duplicate VIC 6.
  Video Data Block: Duplicate VIC 17.
  Video Data Block: Duplicate VIC 18.
  Video Data Block: Duplicate VIC 21.
  Video Data Block: Duplicate VIC 19.
  Speaker Allocation Data Block: Only one instance of this Data Block is allowed.
EDID:
  Base EDID: EDID specified 1 extension block(s), but found 3 extension block(s).
  Base EDID: EDID 1.3 requires a Block Map Extension in Block 1 if there are more than 2 blocks in the EDID.

EDID conformity: FAIL
