edid-decode (hex):

00 ff ff ff ff ff ff 00 20 a3 29 00 01 00 00 00
23 12 01 03 80 73 41 78 0a f3 30 a7 54 42 aa 26
0f 50 54 21 08 00 81 c0 81 40 81 80 01 01 01 01
01 01 01 01 01 01 02 3a 80 18 71 38 2d 40 58 2c
45 00 80 88 42 00 00 1e 1b 21 50 a0 51 00 1e 30
48 88 35 00 44 4a 21 00 00 1c 00 00 00 fc 00 48
44 4d 49 20 20 20 20 0a 20 20 20 20 00 00 00 fd
00 32 4b 0f 45 0f 00 0a 20 20 20 20 20 20 01 8b

02 03 1d 72 23 09 07 07 47 90 05 04 03 11 14 1f
83 01 00 00 68 03 0c 00 10 00 38 2d 00 01 1d 80
18 71 1c 16 20 58 2c 25 00 c4 8e 21 00 00 9e 01
1d 00 72 51 d0 1e 20 6e 28 55 00 c4 8e 21 00 00
18 01 1d 80 d0 72 1c 16 20 10 2c 25 80 c4 8e 21
00 00 9e 00 00 00 00 00 00 00 00 00 00 00 00 00
00 00 00 00 00 00 00 00 00 00 00 00 00 00 00 00
00 00 00 00 00 00 00 00 00 00 00 00 00 00 00 df

00 ff ff ff ff ff ff 00 20 a3 29 00 01 00 00 00
23 12 01 03 80 73 41 78 0a f3 30 a7 54 42 aa 26
0f 50 54 21 08 00 81 c0 81 40 81 80 01 01 01 01
01 01 01 01 01 01 02 3a 80 18 71 38 2d 40 58 2c
45 00 80 88 42 00 00 1e 1b 21 50 a0 51 00 1e 30
48 88 35 00 44 4a 21 00 00 1c 00 00 00 fc 00 48
44 4d 49 20 20 20 20 0a 20 20 20 20 00 00 00 fd
00 32 4b 0f 45 0f 00 0a 20 20 20 20 20 20 01 8b

02 03 1d 72 23 09 07 07 47 90 05 04 03 11 14 1f
83 01 00 00 68 03 0c 00 10 00 38 2d 00 01 1d 80
18 71 1c 16 20 58 2c 25 00 c4 8e 21 00 00 9e 01
1d 00 72 51 d0 1e 20 6e 28 55 00 c4 8e 21 00 00
18 01 1d 80 d0 72 1c 16 20 10 2c 25 80 c4 8e 21
00 00 9e 00 00 00 00 00 00 00 00 00 00 00 00 00
00 00 00 00 00 00 00 00 00 00 00 00 00 00 00 00
00 00 00 00 00 00 00 00 00 00 00 00 00 00 00 df

----------------

Block 0, Base EDID:
  EDID Structure Version & Revision: 1.3
  Vendor & Product Identification:
    Manufacturer: HEC
    Model: 41
    Serial Number: ...
    Made in: week 35 of 2008
  Basic Display Parameters & Features:
    Digital display
    Maximum image size: 115 cm x 65 cm
    Gamma: 2.20
    RGB color display
    First detailed timing is the preferred timing
  Color Characteristics:
    Red  : 0.6552, 0.3310
    Green: 0.2578, 0.6669
    Blue : 0.1484, 0.0615
    White: 0.3125, 0.3281
  Established Timings I & II:
    DMT 0x04:   640x480    59.940476 Hz   4:3     31.469 kHz     25.175000 MHz
    DMT 0x09:   800x600    60.316541 Hz   4:3     37.879 kHz     40.000000 MHz
    DMT 0x10:  1024x768    60.003840 Hz   4:3     48.363 kHz     65.000000 MHz
  Standard Timings:
    DMT 0x55:  1280x720    60.000000 Hz  16:9     45.000 kHz     74.250000 MHz
    DMT 0x20:  1280x960    60.000000 Hz   4:3     60.000 kHz    108.000000 MHz
    DMT 0x23:  1280x1024   60.019740 Hz   5:4     63.981 kHz    108.000000 MHz
  Detailed Timing Descriptors:
    DTD 1:  1920x1080   60.000000 Hz  16:9     67.500 kHz    148.500000 MHz (1152 mm x 648 mm)
                 Hfront   88 Hsync  44 Hback  148 Hpol P
                 Vfront    4 Vsync   5 Vback   36 Vpol P
    DTD 2:  1360x768    59.798991 Hz  85:48    47.720 kHz     84.750000 MHz (580 mm x 330 mm)
                 Hfront   72 Hsync 136 Hback  208 Hpol N
                 Vfront    3 Vsync   5 Vback   22 Vpol P
    Display Product Name: 'HDMI    '
    Display Range Limits:
      Monitor ranges (GTF): 50-75 Hz V, 15-69 kHz H, max dotclock 150 MHz
  Extension blocks: 1
Checksum: 0x8b

----------------

Block 1, CTA-861 Extension Block:
  Revision: 3
  Basic audio support
  Supports YCbCr 4:4:4
  Supports YCbCr 4:2:2
  Native detailed modes: 2
  Audio Data Block:
    Linear PCM:
      Max channels: 2
      Supported sample rates (kHz): 48 44.1 32
      Supported sample sizes (bits): 24 20 16
  Video Data Block:
    VIC  16:  1920x1080   60.000000 Hz  16:9     67.500 kHz    148.500000 MHz (native)
    VIC   5:  1920x1080i  60.000000 Hz  16:9     33.750 kHz     74.250000 MHz
    VIC   4:  1280x720    60.000000 Hz  16:9     45.000 kHz     74.250000 MHz
    VIC   3:   720x480    59.940060 Hz  16:9     31.469 kHz     27.000000 MHz
    VIC  17:   720x576    50.000000 Hz   4:3     31.250 kHz     27.000000 MHz
    VIC  20:  1920x1080i  50.000000 Hz  16:9     28.125 kHz     74.250000 MHz
    VIC  31:  1920x1080   50.000000 Hz  16:9     56.250 kHz    148.500000 MHz
  Speaker Allocation Data Block:
    FL/FR - Front Left/Right
  Vendor-Specific Data Block (HDMI), OUI 00-0C-03:
    Source physical address: 1.0.0.0
    DC_36bit
    DC_30bit
    DC_Y444
    Maximum TMDS clock: 225 MHz
  Detailed Timing Descriptors:
    DTD 3:  1920x1080i  60.000000 Hz  16:9     33.750 kHz     74.250000 MHz (708 mm x 398 mm)
                 Hfront   88 Hsync  44 Hback  148 Hpol P
                 Vfront    2 Vsync   5 Vback   15 Vpol P Vfront +0.5 Odd Field
                 Vfront    2 Vsync   5 Vback   15 Vpol P Vback  +0.5 Even Field
    DTD 4:  1280x720    60.000000 Hz  16:9     45.000 kHz     74.250000 MHz (708 mm x 398 mm)
                 Hfront  110 Hsync  40 Hback  220 Hpol N
                 Vfront    5 Vsync   5 Vback   20 Vpol N
    DTD 5:  1920x1080i  50.000000 Hz  16:9     28.125 kHz     74.250000 MHz (708 mm x 398 mm)
                 Hfront  528 Hsync  44 Hback  148 Hpol P
                 Vfront    2 Vsync   5 Vback   15 Vpol P Vfront +0.5 Odd Field
                 Vfront    2 Vsync   5 Vback   15 Vpol P Vback  +0.5 Even Field
Checksum: 0xdf  Unused space in Extension Block: 44 bytes

----------------

Block 2, Unknown EDID Extension Block 0x00:
  00 ff ff ff ff ff ff 00 20 a3 29 00 01 00 00 00 '........ .).....'
  23 12 01 03 80 73 41 78 0a f3 30 a7 54 42 aa 26 '#....sAx..0.TB.&'
  0f 50 54 21 08 00 81 c0 81 40 81 80 01 01 01 01 '.PT!.....@......'
  01 01 01 01 01 01 02 3a 80 18 71 38 2d 40 58 2c '.......:..q8-@X,'
  45 00 80 88 42 00 00 1e 1b 21 50 a0 51 00 1e 30 'E...B....!P.Q..0'
  48 88 35 00 44 4a 21 00 00 1c 00 00 00 fc 00 48 'H.5.DJ!........H'
  44 4d 49 20 20 20 20 0a 20 20 20 20 00 00 00 fd 'DMI    .    ....'
  00 32 4b 0f 45 0f 00 0a 20 20 20 20 20 20 01 8b '.2K.E...      ..'
Checksum: 0x8b

----------------

Block 3, CTA-861 Extension Block:
  Revision: 3
  Basic audio support
  Supports YCbCr 4:4:4
  Supports YCbCr 4:2:2
  Native detailed modes: 2
  Audio Data Block:
    Linear PCM:
      Max channels: 2
      Supported sample rates (kHz): 48 44.1 32
      Supported sample sizes (bits): 24 20 16
  Video Data Block:
    VIC  16:  1920x1080   60.000000 Hz  16:9     67.500 kHz    148.500000 MHz (native)
    VIC   5:  1920x1080i  60.000000 Hz  16:9     33.750 kHz     74.250000 MHz
    VIC   4:  1280x720    60.000000 Hz  16:9     45.000 kHz     74.250000 MHz
    VIC   3:   720x480    59.940060 Hz  16:9     31.469 kHz     27.000000 MHz
    VIC  17:   720x576    50.000000 Hz   4:3     31.250 kHz     27.000000 MHz
    VIC  20:  1920x1080i  50.000000 Hz  16:9     28.125 kHz     74.250000 MHz
    VIC  31:  1920x1080   50.000000 Hz  16:9     56.250 kHz    148.500000 MHz
  Speaker Allocation Data Block:
    FL/FR - Front Left/Right
  Vendor-Specific Data Block (HDMI), OUI 00-0C-03:
    Source physical address: 1.0.0.0
    DC_36bit
    DC_30bit
    DC_Y444
    Maximum TMDS clock: 225 MHz
  Detailed Timing Descriptors:
    DTD 6:  1920x1080i  60.000000 Hz  16:9     33.750 kHz     74.250000 MHz (708 mm x 398 mm)
                 Hfront   88 Hsync  44 Hback  148 Hpol P
                 Vfront    2 Vsync   5 Vback   15 Vpol P Vfront +0.5 Odd Field
                 Vfront    2 Vsync   5 Vback   15 Vpol P Vback  +0.5 Even Field
    DTD 7:  1280x720    60.000000 Hz  16:9     45.000 kHz     74.250000 MHz (708 mm x 398 mm)
                 Hfront  110 Hsync  40 Hback  220 Hpol N
                 Vfront    5 Vsync   5 Vback   20 Vpol N
    DTD 8:  1920x1080i  50.000000 Hz  16:9     28.125 kHz     74.250000 MHz (708 mm x 398 mm)
                 Hfront  528 Hsync  44 Hback  148 Hpol P
                 Vfront    2 Vsync   5 Vback   15 Vpol P Vfront +0.5 Odd Field
                 Vfront    2 Vsync   5 Vback   15 Vpol P Vback  +0.5 Even Field
Checksum: 0xdf  Unused space in Extension Block: 44 bytes

----------------

Warnings:

Block 0, Base EDID:
  Vendor & Product Identification: The serial number is one of the known dummy values, it should probably be set to 0.
Block 1, CTA-861 Extension Block:
  IT Video Formats are overscanned by default, but normally this should be underscanned.
  Detailed Timing Descriptor #4: DTD is similar but not identical to VIC 4.
  Add a Colorimetry Data Block with the sRGB colorimetry bit set to avoid interop issues.
Block 3, CTA-861 Extension Block:
  IT Video Formats are overscanned by default, but normally this should be underscanned.
  Detailed Timing Descriptor #7: DTD is similar but not identical to VIC 4.

Failures:

Block 0, Base EDID:
  Detailed Timing Descriptor #2: Mismatch of image size 580x330 mm vs display size 1150x650 mm.
  Display Product Name: One or more trailing spaces before newline.
Block 1, CTA-861 Extension Block:
  Detailed Timing Descriptor #3: Mismatch of image size 708x398 mm vs display size 1150x650 mm.
  Detailed Timing Descriptor #4: Mismatch of image size 708x398 mm vs display size 1150x650 mm.
  Detailed Timing Descriptor #5: Mismatch of image size 708x398 mm vs display size 1150x650 mm.
  Missing VCDB, needed for Set Selectable RGB Quantization to avoid interop issues.
Block 2, Base EDID:
  Unknown Extension Block.
Block 3, CTA-861 Extension Block:
  Video Data Block: Duplicate VIC 16.
  Video Data Block: Duplicate VIC 5.
  Video Data Block: Duplicate VIC 4.
  Video Data Block: Duplicate VIC 3.
  Video Data Block: Duplicate VIC 17.
  Video Data Block: Duplicate VIC 20.
  Video Data Block: Duplicate VIC 31.
  Speaker Allocation Data Block: Only one instance of this Data Block is allowed.
  Detailed Timing Descriptor #6: Mismatch of image size 708x398 mm vs display size 1150x650 mm.
  Detailed Timing Descriptor #7: Mismatch of image size 708x398 mm vs display size 1150x650 mm.
  Detailed Timing Descriptor #8: Mismatch of image size 708x398 mm vs display size 1150x650 mm.
EDID:
  Base EDID: EDID specified 1 extension block(s), but found 3 extension block(s).
  Base EDID: EDID 1.3 requires a Block Map Extension in Block 1 if there are more than 2 blocks in the EDID.
  CTA-861: Native progressive timings are a mix of several resolutions.

EDID conformity: FAIL
