edid-decode (hex):

00 ff ff ff ff ff ff 00 22 f0 20 33 01 00 00 00
20 1a 01 03 80 35 1e 78 2a c0 20 a6 56 52 9c 27
0f 50 54 a1 08 00 d1 c0 b3 00 a9 c0 95 00 81 80
81 00 81 c0 01 01 02 3a 80 18 71 38 2d 40 58 2c
45 00 0f 28 21 00 00 1e 00 00 00 fd 00 32 3c 1e
50 11 00 0a 20 20 20 20 20 20 00 00 00 fc 00 48
50 20 32 34 65 72 0a 20 20 20 20 20 00 00 00 ff
00 33 43 4d 36 33 32 30 32 4d 47 20 20 20 01 6d

02 03 19 b1 49 90 1f 04 13 03 13 01 02 01 67 03
0c 00 10 00 00 22 e2 00 2b 02 3a 80 18 71 38 2d
40 58 2c 45 00 0f 28 21 00 00 1e 02 3a 80 d0 72
38 2d 40 10 2c 45 80 0f 28 21 00 00 1e 01 1d 00
72 51 d0 1e 20 6e 28 55 00 0f 28 21 00 00 1e 01
1d 00 bc 52 d0 1e 20 b8 28 55 40 0f 28 21 00 00
1e 01 1d 00 72 51 d0 1e 20 6e 28 55 00 0f 28 21
00 00 18 00 00 00 00 00 00 00 00 00 00 00 00 51

00 ff ff ff ff ff ff 00 22 f0 20 33 01 00 00 00
20 1a 01 03 80 35 1e 78 2a c0 20 a6 56 52 9c 27
0f 50 54 a1 08 00 d1 c0 b3 00 a9 c0 95 00 81 80
81 00 81 c0 01 01 02 3a 80 18 71 38 2d 40 58 2c
45 00 0f 28 21 00 00 1e 00 00 00 fd 00 32 3c 1e
50 11 00 0a 20 20 20 20 20 20 00 00 00 fc 00 48
50 20 32 34 65 72 0a 20 20 20 20 20 00 00 00 ff
00 33 43 4d 36 33 32 30 32 4d 47 20 20 20 01 6d

02 03 19 b1 49 90 1f 04 13 03 13 01 02 01 67 03
0c 00 10 00 00 22 e2 00 2b 02 3a 80 18 71 38 2d
40 58 2c 45 00 0f 28 21 00 00 1e 02 3a 80 d0 72
38 2d 40 10 2c 45 80 0f 28 21 00 00 1e 01 1d 00
72 51 d0 1e 20 6e 28 55 00 0f 28 21 00 00 1e 01
1d 00 bc 52 d0 1e 20 b8 28 55 40 0f 28 21 00 00
1e 01 1d 00 72 51 d0 1e 20 6e 28 55 00 0f 28 21
00 00 18 00 00 00 00 00 00 00 00 00 00 00 00 51

----------------

Block 0, Base EDID:
  EDID Structure Version & Revision: 1.3
  Vendor & Product Identification:
    Manufacturer: HWP
    Model: 13088
    Serial Number: ...
    Made in: week 32 of 2016
  Basic Display Parameters & Features:
    Digital display
    Maximum image size: 53 cm x 30 cm
    Gamma: 2.20
    DPMS levels: Off
    RGB color display
    First detailed timing is the preferred timing
  Color Characteristics:
    Red  : 0.6513, 0.3359
    Green: 0.3203, 0.6093
    Blue : 0.1523, 0.0605
    White: 0.3125, 0.3281
  Established Timings I & II:
    IBM     :   720x400    70.081663 Hz   9:5     31.467 kHz     28.320000 MHz
    DMT 0x04:   640x480    59.940476 Hz   4:3     31.469 kHz     25.175000 MHz
    DMT 0x09:   800x600    60.316541 Hz   4:3     37.879 kHz     40.000000 MHz
    DMT 0x10:  1024x768    60.003840 Hz   4:3     48.363 kHz     65.000000 MHz
  Standard Timings:
    DMT 0x52:  1920x1080   60.000000 Hz  16:9     67.500 kHz    148.500000 MHz
    DMT 0x3a:  1680x1050   59.954250 Hz  16:10    65.290 kHz    146.250000 MHz
    DMT 0x53:  1600x900    60.000000 Hz  16:9     60.000 kHz    108.000000 MHz (RB)
    DMT 0x2f:  1440x900    59.887445 Hz  16:10    55.935 kHz    106.500000 MHz
    DMT 0x23:  1280x1024   60.019740 Hz   5:4     63.981 kHz    108.000000 MHz
    DMT 0x1c:  1280x800    59.810326 Hz  16:10    49.702 kHz     83.500000 MHz
    DMT 0x55:  1280x720    60.000000 Hz  16:9     45.000 kHz     74.250000 MHz
  Detailed Timing Descriptors:
    DTD 1:  1920x1080   60.000000 Hz  16:9     67.500 kHz    148.500000 MHz (527 mm x 296 mm)
                 Hfront   88 Hsync  44 Hback  148 Hpol P
                 Vfront    4 Vsync   5 Vback   36 Vpol P
    Display Range Limits:
      Monitor ranges (GTF): 50-60 Hz V, 30-80 kHz H, max dotclock 170 MHz
    Display Product Name: 'HP 24er'
    Display Product Serial Number: ...
  Extension blocks: 1
Checksum: 0x6d

----------------

Block 1, CTA-861 Extension Block:
  Revision: 3
  Underscans IT Video Formats by default
  Supports YCbCr 4:4:4
  Supports YCbCr 4:2:2
  Native DTDs: 1
  Video Data Block:
    VIC  16:  1920x1080   60.000000 Hz  16:9     67.500 kHz    148.500000 MHz (native)
    VIC  31:  1920x1080   50.000000 Hz  16:9     56.250 kHz    148.500000 MHz
    VIC   4:  1280x720    60.000000 Hz  16:9     45.000 kHz     74.250000 MHz
    VIC  19:  1280x720    50.000000 Hz  16:9     37.500 kHz     74.250000 MHz
    VIC   3:   720x480    59.940060 Hz  16:9     31.469 kHz     27.000000 MHz
    VIC  19:  1280x720    50.000000 Hz  16:9     37.500 kHz     74.250000 MHz
    VIC   1:   640x480    59.940476 Hz   4:3     31.469 kHz     25.175000 MHz
    VIC   2:   720x480    59.940060 Hz   4:3     31.469 kHz     27.000000 MHz
    VIC   1:   640x480    59.940476 Hz   4:3     31.469 kHz     25.175000 MHz
  Vendor-Specific Data Block (HDMI), OUI 00-0C-03:
    Source physical address: 1.0.0.0
    Maximum TMDS clock: 170 MHz
  Video Capability Data Block:
    YCbCr quantization: No Data
    RGB quantization: No Data
    PT scan behavior: Always Underscanned
    IT scan behavior: Always Underscanned
    CE scan behavior: Supports both over- and underscan
  Detailed Timing Descriptors:
    DTD 2:  1920x1080   60.000000 Hz  16:9     67.500 kHz    148.500000 MHz (527 mm x 296 mm)
                 Hfront   88 Hsync  44 Hback  148 Hpol P
                 Vfront    4 Vsync   5 Vback   36 Vpol P
    DTD 3:  1920x1080   50.000000 Hz  16:9     56.250 kHz    148.500000 MHz (527 mm x 296 mm)
                 Hfront  528 Hsync  44 Hback  148 Hpol P
                 Vfront    4 Vsync   5 Vback   36 Vpol P
    DTD 4:  1280x720    60.000000 Hz  16:9     45.000 kHz     74.250000 MHz (527 mm x 296 mm)
                 Hfront  110 Hsync  40 Hback  220 Hpol P
                 Vfront    5 Vsync   5 Vback   20 Vpol P
    DTD 5:  1280x720    50.000000 Hz  16:9     37.500 kHz     74.250000 MHz (527 mm x 296 mm)
                 Hfront  440 Hsync  40 Hback  220 Hpol P
                 Vfront    5 Vsync   5 Vback   20 Vpol P
    DTD 6:  1280x720    60.000000 Hz  16:9     45.000 kHz     74.250000 MHz (527 mm x 296 mm)
                 Hfront  110 Hsync  40 Hback  220 Hpol N
                 Vfront    5 Vsync   5 Vback   20 Vpol N
Checksum: 0x51  Unused space in Extension Block: 12 bytes

----------------

Warnings:

Block 0, Base EDID:
  Vendor & Product Identification: The serial number is one of the known dummy values, it should probably be set to 0.
Block 1, CTA-861 Extension Block:
  Video Capability Data Block: Set Selectable YCbCr Quantization to avoid interop issues.
  Detailed Timing Descriptor #6: DTD is similar but not identical to VIC 4.
  Display Product Serial Number is set, so the Serial Number in the Base EDID should be 0.
  Add a Colorimetry Data Block with the sRGB colorimetry bit set to avoid interop issues.
EDID:
  Base EDID: Some timings are out of range of the Monitor Ranges:
    Vertical Freq: 50.000 - 70.082 Hz (Monitor: 50.000 - 60.000 Hz)

Failures:

Block 0, Base EDID:
  Display Product Serial Number: ...
Block 1, CTA-861 Extension Block:
  Video Data Block: Duplicate VIC 19.
  Video Data Block: Duplicate VIC 1.
  Video Capability Data Block: Set Selectable RGB Quantization to avoid interop issues.
EDID:
  Extension Block 2 started with EDID header, ignoring Extension Blocks >= 2.

EDID conformity: FAIL
