edid-decode (hex):

00 ff ff ff ff ff ff 00 15 a1 09 03 78 e2 00 00
34 0f 01 03 08 20 18 c6 ea 5c 11 9e 59 47 9b 27
10 48 4f a1 4a 00 31 59 45 59 45 68 61 59 71 4f
81 80 01 01 01 01 ea 24 00 60 41 00 28 30 30 60
13 00 40 f0 10 00 00 1e 00 00 00 fc 00 65 56 69
65 77 20 31 37 66 33 0a 20 20 00 00 00 fd 00 32
a0 1e 46 0b 00 0a 20 20 20 20 20 20 00 00 00 ff
00 4d 52 4a 35 43 35 30 4e 35 37 39 37 36 00 c4

00 ff ff ff ff ff ff 00 15 a1 09 03 78 e2 00 00
34 0f 01 03 08 20 18 c6 ea 5c 11 9e 59 47 9b 27
10 48 4f a1 4a 00 31 59 45 59 45 68 61 59 71 4f
81 80 01 01 01 01 ea 24 00 60 41 00 28 30 30 60
13 00 40 f0 10 00 00 1e 00 00 00 fc 00 65 56 69
65 77 20 31 37 66 33 0a 20 20 00 00 00 fd 00 32
a0 1e 46 0b 00 0a 20 20 20 20 20 20 00 00 00 ff
00 4d 52 4a 35 43 35 30 4e 35 37 39 37 36 00 c4

----------------

Block 0, Base EDID:
  EDID Structure Version & Revision: 1.3
  Vendor & Product Identification:
    Manufacturer: EMA
    Model: 777
    Serial Number: ...
    Made in: week 52 of 2005
  Basic Display Parameters & Features:
    Analog display
    Signal Level Standard: 0.700 : 0.300 : 1.000 V p-p
    Blank level equals black level
    Sync: Separate
    Maximum image size: 32 cm x 24 cm
    Gamma: 2.98
    DPMS levels: Standby Suspend Off
    RGB color display
    First detailed timing is the preferred timing
  Color Characteristics:
    Red  : 0.6181, 0.3486
    Green: 0.2802, 0.6054
    Blue : 0.1523, 0.0634
    White: 0.2812, 0.3095
  Established Timings I & II:
    IBM     :   720x400    70.081663 Hz   9:5     31.467 kHz     28.320000 MHz
    DMT 0x04:   640x480    59.940476 Hz   4:3     31.469 kHz     25.175000 MHz
    DMT 0x09:   800x600    60.316541 Hz   4:3     37.879 kHz     40.000000 MHz
    DMT 0x0b:   800x600    75.000000 Hz   4:3     46.875 kHz     49.500000 MHz
    DMT 0x10:  1024x768    60.003840 Hz   4:3     48.363 kHz     65.000000 MHz
    DMT 0x12:  1024x768    75.028582 Hz   4:3     60.023 kHz     78.750000 MHz
  Standard Timings:
    DMT 0x07:   640x480    85.008312 Hz   4:3     43.269 kHz     36.000000 MHz
    DMT 0x0c:   800x600    85.061274 Hz   4:3     53.674 kHz     56.250000 MHz
    GTF     :   800x600    99.999707 Hz   4:3     63.600 kHz     68.179000 MHz
    DMT 0x13:  1024x768    84.996690 Hz   4:3     68.677 kHz     94.500000 MHz
    DMT 0x15:  1152x864    75.000000 Hz   4:3     67.500 kHz    108.000000 MHz
    DMT 0x23:  1280x1024   60.019740 Hz   5:4     63.981 kHz    108.000000 MHz
  Detailed Timing Descriptors:
    DTD 1:  1024x768    84.996690 Hz   4:3     68.677 kHz     94.500000 MHz (320 mm x 240 mm)
                 Hfront   48 Hsync  96 Hback  208 Hpol P
                 Vfront    1 Vsync   3 Vback   36 Vpol P
    Display Product Name: 'eView 17f3'
    Display Range Limits:
      Monitor ranges (GTF): 50-160 Hz V, 30-70 kHz H, max dotclock 110 MHz
    Display Product Serial Number: ...
Checksum: 0xc4

----------------

Failures:

EDID:
  Extension Block 1 started with EDID header, ignoring Extension Blocks >= 1.

EDID conformity: FAIL
