edid-decode (hex):

00 ff ff ff ff ff ff 00 5e 78 43 48 21 03 00 00
0d 1a 01 03 81 46 27 78 eb d5 7c a3 57 49 9c 25
11 48 4b bf ef 00 a9 40 81 59 81 80 61 59 45 59
31 59 31 19 31 d9 02 3a 80 18 71 38 2d 40 58 2c
45 00 c4 8e 21 00 00 1e 02 3a 80 d0 72 38 2d 40
10 2c 45 80 c4 8e 21 00 00 1e 00 00 00 fc 00 53
47 44 20 53 58 38 0a 20 20 20 20 20 00 00 00 fd
00 17 78 0f 8c 1e 00 0a 20 20 20 20 20 20 01 54

02 03 4c f1 54 1f 20 5d 62 5f 64 21 22 5e 10 01
04 07 06 03 02 11 12 13 15 26 3f 07 50 09 7f 01
83 4f 00 00 70 03 0c 00 20 00 b8 44 af 5b 5b 00
80 01 02 03 04 e2 00 ff 00 00 00 00 00 00 00 00
00 00 00 00 00 00 00 00 00 00 00 00 00 00 00 00
00 00 00 00 00 00 00 00 00 00 00 00 00 00 00 00
00 00 00 00 00 00 00 00 00 00 00 00 00 00 00 00
00 00 00 00 00 00 00 00 00 00 00 00 00 00 00 14

00 ff ff ff ff ff ff 00 5e 78 43 48 21 03 00 00
0d 1a 01 03 81 46 27 78 eb d5 7c a3 57 49 9c 25
11 48 4b bf ef 00 a9 40 81 59 81 80 61 59 45 59
31 59 31 19 31 d9 02 3a 80 18 71 38 2d 40 58 2c
45 00 c4 8e 21 00 00 1e 02 3a 80 d0 72 38 2d 40
10 2c 45 80 c4 8e 21 00 00 1e 00 00 00 fc 00 53
47 44 20 53 58 38 0a 20 20 20 20 20 00 00 00 fd
00 17 78 0f 8c 1e 00 0a 20 20 20 20 20 20 01 54

02 03 4c f1 54 1f 20 5d 62 5f 64 21 22 5e 10 01
04 07 06 03 02 11 12 13 15 26 3f 07 50 09 7f 01
83 4f 00 00 70 03 0c 00 20 00 b8 44 af 5b 5b 00
80 01 02 03 04 e2 00 ff 00 00 00 00 00 00 00 00
00 00 00 00 00 00 00 00 00 00 00 00 00 00 00 00
00 00 00 00 00 00 00 00 00 00 00 00 00 00 00 00
00 00 00 00 00 00 00 00 00 00 00 00 00 00 00 00
00 00 00 00 00 00 00 00 00 00 00 00 00 00 00 14

----------------

Block 0, Base EDID:
  EDID Structure Version & Revision: 1.3
  Vendor & Product Identification:
    Manufacturer: WSX
    Model: 18499
    Serial Number: ...
    Made in: week 13 of 2016
  Basic Display Parameters & Features:
    Digital display
    DFP 1.x compatible TMDS
    Maximum image size: 70 cm x 39 cm
    Gamma: 2.20
    DPMS levels: Standby Suspend Off
    RGB color display
    First detailed timing is the preferred timing
    Supports GTF timings within operating range
  Color Characteristics:
    Red  : 0.6396, 0.3408
    Green: 0.2861, 0.6103
    Blue : 0.1455, 0.0693
    White: 0.2841, 0.2929
  Established Timings I & II:
    IBM     :   720x400    70.081663 Hz   9:5     31.467 kHz     28.320000 MHz
    DMT 0x04:   640x480    59.940476 Hz   4:3     31.469 kHz     25.175000 MHz
    Apple   :   640x480    66.666667 Hz   4:3     35.000 kHz     30.240000 MHz
    DMT 0x05:   640x480    72.808802 Hz   4:3     37.861 kHz     31.500000 MHz
    DMT 0x06:   640x480    75.000000 Hz   4:3     37.500 kHz     31.500000 MHz
    DMT 0x08:   800x600    56.250000 Hz   4:3     35.156 kHz     36.000000 MHz
    DMT 0x09:   800x600    60.316541 Hz   4:3     37.879 kHz     40.000000 MHz
    DMT 0x0a:   800x600    72.187572 Hz   4:3     48.077 kHz     50.000000 MHz
    DMT 0x0b:   800x600    75.000000 Hz   4:3     46.875 kHz     49.500000 MHz
    Apple   :   832x624    74.551266 Hz   4:3     49.726 kHz     57.284000 MHz
    DMT 0x10:  1024x768    60.003840 Hz   4:3     48.363 kHz     65.000000 MHz
    DMT 0x11:  1024x768    70.069359 Hz   4:3     56.476 kHz     75.000000 MHz
    DMT 0x12:  1024x768    75.028582 Hz   4:3     60.023 kHz     78.750000 MHz
    DMT 0x24:  1280x1024   75.024675 Hz   5:4     79.976 kHz    135.000000 MHz
  Standard Timings:
    DMT 0x33:  1600x1200   60.000000 Hz   4:3     75.000 kHz    162.000000 MHz
    DMT 0x21:  1280x960    85.002473 Hz   4:3     85.938 kHz    148.500000 MHz
    DMT 0x23:  1280x1024   60.019740 Hz   5:4     63.981 kHz    108.000000 MHz
    DMT 0x13:  1024x768    84.996690 Hz   4:3     68.677 kHz     94.500000 MHz
    DMT 0x0c:   800x600    85.061274 Hz   4:3     53.674 kHz     56.250000 MHz
    DMT 0x07:   640x480    85.008312 Hz   4:3     43.269 kHz     36.000000 MHz
    DMT 0x02:   640x400    85.079948 Hz  16:10    37.861 kHz     31.500000 MHz
    GTF     :   640x360    85.000000 Hz  16:9     32.215 kHz     25.772000 MHz
  Detailed Timing Descriptors:
    DTD 1:  1920x1080   60.000000 Hz  16:9     67.500 kHz    148.500000 MHz (708 mm x 398 mm)
                 Hfront   88 Hsync  44 Hback  148 Hpol P
                 Vfront    4 Vsync   5 Vback   36 Vpol P
    DTD 2:  1920x1080   50.000000 Hz  16:9     56.250 kHz    148.500000 MHz (708 mm x 398 mm)
                 Hfront  528 Hsync  44 Hback  148 Hpol P
                 Vfront    4 Vsync   5 Vback   36 Vpol P
    Display Product Name: 'SGD SX8'
    Display Range Limits:
      Monitor ranges (GTF): 23-120 Hz V, 15-140 kHz H, max dotclock 300 MHz
  Extension blocks: 1
Checksum: 0x54

----------------

Block 1, CTA-861 Extension Block:
  Revision: 3
  Underscans IT Video Formats by default
  Basic audio support
  Supports YCbCr 4:4:4
  Supports YCbCr 4:2:2
  Native detailed modes: 1
  Video Data Block:
    VIC  31:  1920x1080   50.000000 Hz  16:9     56.250 kHz    148.500000 MHz
    VIC  32:  1920x1080   24.000000 Hz  16:9     27.000 kHz     74.250000 MHz
    VIC  93:  3840x2160   24.000000 Hz  16:9     54.000 kHz    297.000000 MHz
    VIC  98:  4096x2160   24.000000 Hz 256:135   54.000 kHz    297.000000 MHz
    VIC  95:  3840x2160   30.000000 Hz  16:9     67.500 kHz    297.000000 MHz
    VIC 100:  4096x2160   30.000000 Hz 256:135   67.500 kHz    297.000000 MHz
    VIC  33:  1920x1080   25.000000 Hz  16:9     28.125 kHz     74.250000 MHz
    VIC  34:  1920x1080   30.000000 Hz  16:9     33.750 kHz     74.250000 MHz
    VIC  94:  3840x2160   25.000000 Hz  16:9     56.250 kHz    297.000000 MHz
    VIC  16:  1920x1080   60.000000 Hz  16:9     67.500 kHz    148.500000 MHz
    VIC   1:   640x480    59.940476 Hz   4:3     31.469 kHz     25.175000 MHz
    VIC   4:  1280x720    60.000000 Hz  16:9     45.000 kHz     74.250000 MHz
    VIC   7:  1440x480i   59.940060 Hz  16:9     15.734 kHz     27.000000 MHz
    VIC   6:  1440x480i   59.940060 Hz   4:3     15.734 kHz     27.000000 MHz
    VIC   3:   720x480    59.940060 Hz  16:9     31.469 kHz     27.000000 MHz
    VIC   2:   720x480    59.940060 Hz   4:3     31.469 kHz     27.000000 MHz
    VIC  17:   720x576    50.000000 Hz   4:3     31.250 kHz     27.000000 MHz
    VIC  18:   720x576    50.000000 Hz  16:9     31.250 kHz     27.000000 MHz
    VIC  19:  1280x720    50.000000 Hz  16:9     37.500 kHz     74.250000 MHz
    VIC  21:  1440x576i   50.000000 Hz   4:3     15.625 kHz     27.000000 MHz
  Audio Data Block:
    DTS:
      Max channels: 8
      Supported sample rates (kHz): 48 44.1 32
      Maximum bit rate: 640 kb/s
    Linear PCM:
      Max channels: 2
      Supported sample rates (kHz): 192 176.4 96 88.2 48 44.1 32
      Supported sample sizes (bits): 16
  Speaker Allocation Data Block:
    FL/FR - Front Left/Right
    LFE1 - Low Frequency Effects 1
    FC - Front Center
    LS/RS - Left/Right Surround
    BL/BR - Back Left/Right
  Vendor-Specific Data Block (HDMI), OUI 00-0C-03:
    Source physical address: 2.0.0.0
    Supports_AI
    DC_36bit
    DC_30bit
    DC_Y444
    Maximum TMDS clock: 340 MHz
    Supported Content Types:
      Graphics
      Photo
      Cinema
      Game
    Video latency: 180 ms
    Audio latency: 180 ms
    Extended HDMI video details:
      HDMI VICs:
        HDMI VIC 1:  3840x2160   30.000000 Hz  16:9     67.500 kHz    297.000000 MHz
        HDMI VIC 2:  3840x2160   25.000000 Hz  16:9     56.250 kHz    297.000000 MHz
        HDMI VIC 3:  3840x2160   24.000000 Hz  16:9     54.000 kHz    297.000000 MHz
        HDMI VIC 4:  4096x2160   24.000000 Hz 256:135   54.000 kHz    297.000000 MHz
  Video Capability Data Block:
    YCbCr quantization: Selectable (via AVI YQ)
    RGB quantization: Selectable (via AVI Q)
    PT scan behavior: Supports both over- and underscan
    IT scan behavior: Supports both over- and underscan
    CE scan behavior: Supports both over- and underscan
  Unknown CTA-861 Data Block (tag 0x00, length 0):
  Unknown CTA-861 Data Block (tag 0x00, length 0):
  Unknown CTA-861 Data Block (tag 0x00, length 0):
  Unknown CTA-861 Data Block (tag 0x00, length 0):
  Unknown CTA-861 Data Block (tag 0x00, length 0):
  Unknown CTA-861 Data Block (tag 0x00, length 0):
  Unknown CTA-861 Data Block (tag 0x00, length 0):
  Unknown CTA-861 Data Block (tag 0x00, length 0):
  Unknown CTA-861 Data Block (tag 0x00, length 0):
  Unknown CTA-861 Data Block (tag 0x00, length 0):
  Unknown CTA-861 Data Block (tag 0x00, length 0):
  Unknown CTA-861 Data Block (tag 0x00, length 0):
  Unknown CTA-861 Data Block (tag 0x00, length 0):
  Unknown CTA-861 Data Block (tag 0x00, length 0):
  Unknown CTA-861 Data Block (tag 0x00, length 0):
  Unknown CTA-861 Data Block (tag 0x00, length 0):
  Unknown CTA-861 Data Block (tag 0x00, length 0):
  Unknown CTA-861 Data Block (tag 0x00, length 0):
  Unknown CTA-861 Data Block (tag 0x00, length 0):
  Unknown CTA-861 Data Block (tag 0x00, length 0):
Checksum: 0x14  Unused space in Extension Block: 51 bytes

----------------

Block 2, Unknown EDID Extension Block 0x00:
  00 ff ff ff ff ff ff 00 5e 78 43 48 21 03 00 00 '........^xCH!...'
  0d 1a 01 03 81 46 27 78 eb d5 7c a3 57 49 9c 25 '.....F'x..|.WI.%'
  11 48 4b bf ef 00 a9 40 81 59 81 80 61 59 45 59 '.HK....@.Y..aYEY'
  31 59 31 19 31 d9 02 3a 80 18 71 38 2d 40 58 2c '1Y1.1..:..q8-@X,'
  45 00 c4 8e 21 00 00 1e 02 3a 80 d0 72 38 2d 40 'E...!....:..r8-@'
  10 2c 45 80 c4 8e 21 00 00 1e 00 00 00 fc 00 53 '.,E...!........S'
  47 44 20 53 58 38 0a 20 20 20 20 20 00 00 00 fd 'GD SX8.     ....'
  00 17 78 0f 8c 1e 00 0a 20 20 20 20 20 20 01 54 '..x.....      .T'
Checksum: 0x54

----------------

Block 3, CTA-861 Extension Block:
  Revision: 3
  Underscans IT Video Formats by default
  Basic audio support
  Supports YCbCr 4:4:4
  Supports YCbCr 4:2:2
  Native detailed modes: 1
  Video Data Block:
    VIC  31:  1920x1080   50.000000 Hz  16:9     56.250 kHz    148.500000 MHz
    VIC  32:  1920x1080   24.000000 Hz  16:9     27.000 kHz     74.250000 MHz
    VIC  93:  3840x2160   24.000000 Hz  16:9     54.000 kHz    297.000000 MHz
    VIC  98:  4096x2160   24.000000 Hz 256:135   54.000 kHz    297.000000 MHz
    VIC  95:  3840x2160   30.000000 Hz  16:9     67.500 kHz    297.000000 MHz
    VIC 100:  4096x2160   30.000000 Hz 256:135   67.500 kHz    297.000000 MHz
    VIC  33:  1920x1080   25.000000 Hz  16:9     28.125 kHz     74.250000 MHz
    VIC  34:  1920x1080   30.000000 Hz  16:9     33.750 kHz     74.250000 MHz
    VIC  94:  3840x2160   25.000000 Hz  16:9     56.250 kHz    297.000000 MHz
    VIC  16:  1920x1080   60.000000 Hz  16:9     67.500 kHz    148.500000 MHz
    VIC   1:   640x480    59.940476 Hz   4:3     31.469 kHz     25.175000 MHz
    VIC   4:  1280x720    60.000000 Hz  16:9     45.000 kHz     74.250000 MHz
    VIC   7:  1440x480i   59.940060 Hz  16:9     15.734 kHz     27.000000 MHz
    VIC   6:  1440x480i   59.940060 Hz   4:3     15.734 kHz     27.000000 MHz
    VIC   3:   720x480    59.940060 Hz  16:9     31.469 kHz     27.000000 MHz
    VIC   2:   720x480    59.940060 Hz   4:3     31.469 kHz     27.000000 MHz
    VIC  17:   720x576    50.000000 Hz   4:3     31.250 kHz     27.000000 MHz
    VIC  18:   720x576    50.000000 Hz  16:9     31.250 kHz     27.000000 MHz
    VIC  19:  1280x720    50.000000 Hz  16:9     37.500 kHz     74.250000 MHz
    VIC  21:  1440x576i   50.000000 Hz   4:3     15.625 kHz     27.000000 MHz
  Audio Data Block:
    DTS:
      Max channels: 8
      Supported sample rates (kHz): 48 44.1 32
      Maximum bit rate: 640 kb/s
    Linear PCM:
      Max channels: 2
      Supported sample rates (kHz): 192 176.4 96 88.2 48 44.1 32
      Supported sample sizes (bits): 16
  Speaker Allocation Data Block:
    FL/FR - Front Left/Right
    LFE1 - Low Frequency Effects 1
    FC - Front Center
    LS/RS - Left/Right Surround
    BL/BR - Back Left/Right
  Vendor-Specific Data Block (HDMI), OUI 00-0C-03:
    Source physical address: 2.0.0.0
    Supports_AI
    DC_36bit
    DC_30bit
    DC_Y444
    Maximum TMDS clock: 340 MHz
    Supported Content Types:
      Graphics
      Photo
      Cinema
      Game
    Video latency: 180 ms
    Audio latency: 180 ms
    Extended HDMI video details:
      HDMI VICs:
        HDMI VIC 1:  3840x2160   30.000000 Hz  16:9     67.500 kHz    297.000000 MHz
        HDMI VIC 2:  3840x2160   25.000000 Hz  16:9     56.250 kHz    297.000000 MHz
        HDMI VIC 3:  3840x2160   24.000000 Hz  16:9     54.000 kHz    297.000000 MHz
        HDMI VIC 4:  4096x2160   24.000000 Hz 256:135   54.000 kHz    297.000000 MHz
  Video Capability Data Block:
    YCbCr quantization: Selectable (via AVI YQ)
    RGB quantization: Selectable (via AVI Q)
    PT scan behavior: Supports both over- and underscan
    IT scan behavior: Supports both over- and underscan
    CE scan behavior: Supports both over- and underscan
  Unknown CTA-861 Data Block (tag 0x00, length 0):
  Unknown CTA-861 Data Block (tag 0x00, length 0):
  Unknown CTA-861 Data Block (tag 0x00, length 0):
  Unknown CTA-861 Data Block (tag 0x00, length 0):
  Unknown CTA-861 Data Block (tag 0x00, length 0):
  Unknown CTA-861 Data Block (tag 0x00, length 0):
  Unknown CTA-861 Data Block (tag 0x00, length 0):
  Unknown CTA-861 Data Block (tag 0x00, length 0):
  Unknown CTA-861 Data Block (tag 0x00, length 0):
  Unknown CTA-861 Data Block (tag 0x00, length 0):
  Unknown CTA-861 Data Block (tag 0x00, length 0):
  Unknown CTA-861 Data Block (tag 0x00, length 0):
  Unknown CTA-861 Data Block (tag 0x00, length 0):
  Unknown CTA-861 Data Block (tag 0x00, length 0):
  Unknown CTA-861 Data Block (tag 0x00, length 0):
  Unknown CTA-861 Data Block (tag 0x00, length 0):
  Unknown CTA-861 Data Block (tag 0x00, length 0):
  Unknown CTA-861 Data Block (tag 0x00, length 0):
  Unknown CTA-861 Data Block (tag 0x00, length 0):
  Unknown CTA-861 Data Block (tag 0x00, length 0):
Checksum: 0x14  Unused space in Extension Block: 51 bytes

----------------

Warnings:

Block 1, CTA-861 Extension Block:
  Video Data Block: VIC 31 and the first DTD are not identical. Is this intended?
  Video Capability Data Block: S_PT is equal to S_IT and S_CE, so should be set to 0 instead.
  Unknown CTA-861 Data Block (tag 0x00, length 0).
  Unknown CTA-861 Data Block (tag 0x00, length 0).
  Unknown CTA-861 Data Block (tag 0x00, length 0).
  Unknown CTA-861 Data Block (tag 0x00, length 0).
  Unknown CTA-861 Data Block (tag 0x00, length 0).
  Unknown CTA-861 Data Block (tag 0x00, length 0).
  Unknown CTA-861 Data Block (tag 0x00, length 0).
  Unknown CTA-861 Data Block (tag 0x00, length 0).
  Unknown CTA-861 Data Block (tag 0x00, length 0).
  Unknown CTA-861 Data Block (tag 0x00, length 0).
  Unknown CTA-861 Data Block (tag 0x00, length 0).
  Unknown CTA-861 Data Block (tag 0x00, length 0).
  Unknown CTA-861 Data Block (tag 0x00, length 0).
  Unknown CTA-861 Data Block (tag 0x00, length 0).
  Unknown CTA-861 Data Block (tag 0x00, length 0).
  Unknown CTA-861 Data Block (tag 0x00, length 0).
  Unknown CTA-861 Data Block (tag 0x00, length 0).
  Unknown CTA-861 Data Block (tag 0x00, length 0).
  Unknown CTA-861 Data Block (tag 0x00, length 0).
  Unknown CTA-861 Data Block (tag 0x00, length 0).
  Add a Colorimetry Data Block with the sRGB colorimetry bit set to avoid interop issues.
Block 3, CTA-861 Extension Block:
  Video Capability Data Block: S_PT is equal to S_IT and S_CE, so should be set to 0 instead.
  Unknown CTA-861 Data Block (tag 0x00, length 0).
  Unknown CTA-861 Data Block (tag 0x00, length 0).
  Unknown CTA-861 Data Block (tag 0x00, length 0).
  Unknown CTA-861 Data Block (tag 0x00, length 0).
  Unknown CTA-861 Data Block (tag 0x00, length 0).
  Unknown CTA-861 Data Block (tag 0x00, length 0).
  Unknown CTA-861 Data Block (tag 0x00, length 0).
  Unknown CTA-861 Data Block (tag 0x00, length 0).
  Unknown CTA-861 Data Block (tag 0x00, length 0).
  Unknown CTA-861 Data Block (tag 0x00, length 0).
  Unknown CTA-861 Data Block (tag 0x00, length 0).
  Unknown CTA-861 Data Block (tag 0x00, length 0).
  Unknown CTA-861 Data Block (tag 0x00, length 0).
  Unknown CTA-861 Data Block (tag 0x00, length 0).
  Unknown CTA-861 Data Block (tag 0x00, length 0).
  Unknown CTA-861 Data Block (tag 0x00, length 0).
  Unknown CTA-861 Data Block (tag 0x00, length 0).
  Unknown CTA-861 Data Block (tag 0x00, length 0).
  Unknown CTA-861 Data Block (tag 0x00, length 0).
  Unknown CTA-861 Data Block (tag 0x00, length 0).

Failures:

Block 2, Base EDID:
  Unknown Extension Block.
Block 3, CTA-861 Extension Block:
  Video Data Block: Duplicate VIC 31.
  Video Data Block: Duplicate VIC 32.
  Video Data Block: Duplicate VIC 93.
  Video Data Block: Duplicate VIC 98.
  Video Data Block: Duplicate VIC 95.
  Video Data Block: Duplicate VIC 100.
  Video Data Block: Duplicate VIC 33.
  Video Data Block: Duplicate VIC 34.
  Video Data Block: Duplicate VIC 94.
  Video Data Block: Duplicate VIC 16.
  Video Data Block: Duplicate VIC 1.
  Video Data Block: Duplicate VIC 4.
  Video Data Block: Duplicate VIC 7.
  Video Data Block: Duplicate VIC 6.
  Video Data Block: Duplicate VIC 3.
  Video Data Block: Duplicate VIC 2.
  Video Data Block: Duplicate VIC 17.
  Video Data Block: Duplicate VIC 18.
  Video Data Block: Duplicate VIC 19.
  Video Data Block: Duplicate VIC 21.
  Speaker Allocation Data Block: Only one instance of this Data Block is allowed.
  Video Capability Data Block: Only one instance of this Data Block is allowed.
EDID:
  Base EDID: EDID specified 1 extension block(s), but found 3 extension block(s).
  Base EDID: EDID 1.3 requires a Block Map Extension in Block 1 if there are more than 2 blocks in the EDID.

EDID conformity: FAIL
