edid-decode (hex):

00 ff ff ff ff ff ff 00 05 2f 00 00 00 00 00 00
34 20 01 04 a5 00 00 78 e2 84 96 ac 51 30 b4 25
10 50 53 00 00 00 01 c0 01 00 01 00 01 00 01 00
01 00 01 00 01 00 a2 36 80 b4 70 38 1e 40 2a 10
72 04 0f 28 21 00 00 1a 00 00 00 00 00 00 00 00
00 00 00 00 00 00 00 00 00 00 00 00 00 fd 00 38
4c 1e 53 11 00 0a 20 20 20 20 20 20 00 00 00 fc
00 4d 6f 6e 69 74 6f 72 0a 20 20 20 20 20 00 50

00 ff ff ff ff ff ff 00 05 2f 00 00 00 00 00 00
34 20 01 04 a5 00 00 78 e2 84 96 ac 51 30 b4 25
10 50 53 00 00 00 01 c0 01 00 01 00 01 00 01 00
01 00 01 00 01 00 a2 36 80 b4 70 38 1e 40 2a 10
72 04 0f 28 21 00 00 1a 00 00 00 00 00 00 00 00
00 00 00 00 00 00 00 00 00 00 00 00 00 fd 00 38
4c 1e 53 11 00 0a 20 20 20 20 20 20 00 00 00 fc
00 4d 6f 6e 69 74 6f 72 0a 20 20 20 20 20 00 50

----------------

Block 0, Base EDID:
  EDID Structure Version & Revision: 1.4
  Vendor & Product Identification:
    Manufacturer: AIO
    Model: 0
    Made in: week 52 of 2022
  Basic Display Parameters & Features:
    Digital display
    Bits per primary color channel: 8
    DisplayPort interface
    Image size is variable
    Gamma: 2.20
    DPMS levels: Standby Suspend Off
    Supported color formats: RGB 4:4:4
    First detailed timing includes the native pixel format and preferred refresh rate
  Color Characteristics:
    Red  : 0.6738, 0.3164
    Green: 0.1884, 0.7031
    Blue : 0.1464, 0.0634
    White: 0.3134, 0.3261
  Established Timings I & II: none
  Standard Timings:
  Detailed Timing Descriptors:
    DTD 1:  1920x1080   60.000000 Hz  16:9     66.600 kHz    139.860000 MHz (527 mm x 296 mm)
                 Hfront   42 Hsync  16 Hback  122 Hpol P
                 Vfront   23 Vsync   2 Vback    5 Vpol N
    Empty Descriptor
    Display Range Limits:
      Monitor ranges (GTF): 56-76 Hz V, 30-83 kHz H, max dotclock 170 MHz
    Display Product Name: 'Monitor'
Checksum: 0x50

----------------

Block 1, Unknown EDID Extension Block 0x00:
  00 ff ff ff ff ff ff 00 05 2f 00 00 00 00 00 00 '........./......'
  34 20 01 04 a5 00 00 78 e2 84 96 ac 51 30 b4 25 '4 .....x....Q0.%'
  10 50 53 00 00 00 01 c0 01 00 01 00 01 00 01 00 '.PS.............'
  01 00 01 00 01 00 a2 36 80 b4 70 38 1e 40 2a 10 '.......6..p8.@*.'
  72 04 0f 28 21 00 00 1a 00 00 00 00 00 00 00 00 'r..(!...........'
  00 00 00 00 00 00 00 00 00 00 00 00 00 fd 00 38 '...............8'
  4c 1e 53 11 00 0a 20 20 20 20 20 20 00 00 00 fc 'L.S...      ....'
  00 4d 6f 6e 69 74 6f 72 0a 20 20 20 20 20 00 50 '.Monitor.     .P'
Checksum: 0x50

----------------

Warnings:

Block 0, Base EDID:
  Display Range Limits: GTF support is deprecated in EDID 1.4.

Failures:

Block 0, Base EDID:
  Standard Timings: Use 0x0101 as the invalid Standard Timings code, not 0x01c0.
  Standard Timings: Use 0x0101 as the invalid Standard Timings code, not 0x0100.
  Standard Timings: Use 0x0101 as the invalid Standard Timings code, not 0x0100.
  Standard Timings: Use 0x0101 as the invalid Standard Timings code, not 0x0100.
  Standard Timings: Use 0x0101 as the invalid Standard Timings code, not 0x0100.
  Standard Timings: Use 0x0101 as the invalid Standard Timings code, not 0x0100.
  Standard Timings: Use 0x0101 as the invalid Standard Timings code, not 0x0100.
  Standard Timings: Use 0x0101 as the invalid Standard Timings code, not 0x0100.
  Empty Descriptor: Use Dummy Descriptor instead of all zeroes.
  Display Range Limits: GTF is supported, but the display does not support continuous frequencies.
Block 1, Base EDID:
  Unknown Extension Block.
EDID:
  Base EDID: The DTD max image size is 527x296mm, but the display size is not specified anywhere.
  Base EDID: EDID specified 0 extension block(s), but found 1 extension block(s).

EDID conformity: FAIL
