edid-decode (hex):

00 ff ff ff ff ff ff 00 06 af 3b 14 00 00 00 00
1a 1d 01 04 a5 1f 11 78 02 ce 35 a7 54 4a 9b 26
0f 50 54 00 00 00 01 01 01 01 01 01 01 01 01 01
01 01 01 01 01 01 66 d0 00 a0 f0 70 3e 80 30 20
35 00 35 ad 10 00 00 1a b8 a6 00 a0 f0 70 3e 80
30 20 35 00 35 ad 10 00 00 1a 00 00 00 fe 00 56
4a 33 37 57 80 42 31 34 30 5a 41 4e 00 00 00 00
00 03 41 21 a8 00 11 00 00 0b 01 0a 20 20 00 66

----------------

Block 0, Base EDID:
  EDID Structure Version & Revision: 1.4
  Vendor & Product Identification:
    Manufacturer: AUO
    Model: 5179
    Made in: week 26 of 2019
  Basic Display Parameters & Features:
    Digital display
    Bits per primary color channel: 8
    DisplayPort interface
    Maximum image size: 31 cm x 17 cm
    Gamma: 2.20
    Supported color formats: RGB 4:4:4
    First detailed timing includes the native pixel format and preferred refresh rate
  Color Characteristics:
    Red  : 0.6552, 0.3281
    Green: 0.2919, 0.6074
    Blue : 0.1484, 0.0615
    White: 0.3134, 0.3291
  Established Timings I & II: none
  Standard Timings: none
  Detailed Timing Descriptors:
    DTD 1:  3840x2160   60.024752 Hz  16:9    133.375 kHz    533.500000 MHz (309 mm x 173 mm)
                 Hfront   48 Hsync  32 Hback   80 Hpol P
                 Vfront    3 Vsync   5 Vback   54 Vpol N
    DTD 2:  3840x2160   48.019802 Hz  16:9    106.700 kHz    426.800000 MHz (309 mm x 173 mm)
                 Hfront   48 Hsync  32 Hback   80 Hpol P
                 Vfront    3 Vsync   5 Vback   54 Vpol N
    Alphanumeric Data String: 'VJ37W.B140ZAN'
    Manufacturer-Specified Display Descriptor (0x00): 00 00 00 03 41 21 a8 00 11 00 00 0b 01 0a 20 20 '....A!........  '
Checksum: 0x66

----------------

Warnings:

Block 0, Base EDID:
  Alphanumeric Data String: Non-ASCII character 0x80 at position 5, can cause problems.
  Missing Display Product Name.

EDID conformity: PASS
