edid-decode (hex):

00 ff ff ff ff ff ff 00 09 e5 d4 0a 00 00 00 00
28 1f 01 04 a5 1d 12 78 03 7a 75 a7 51 4b 9a 26
0e 50 54 00 00 00 01 01 01 01 01 01 01 01 01 01
01 01 01 01 01 01 d8 3c 80 a0 70 b0 30 40 30 20
36 00 1e b3 10 00 00 1a 90 28 80 a0 70 b0 30 40
30 20 36 00 1e b3 10 00 00 1a 00 00 00 00 00 00
00 00 00 00 00 00 00 00 00 00 00 00 00 00 00 03
00 0d 28 ff 0a 3c c8 0b 0c 26 c8 00 00 00 01 72

70 20 79 00 00 25 01 09 99 95 01 65 60 02 28 3c
80 81 00 13 72 1a 00 00 03 01 28 3c 00 00 00 00
00 00 3c 00 00 00 00 00 00 00 00 00 00 00 00 00
00 00 00 00 00 00 00 00 00 00 00 00 00 00 00 00
00 00 00 00 00 00 00 00 00 00 00 00 00 00 00 00
00 00 00 00 00 00 00 00 00 00 00 00 00 00 00 00
00 00 00 00 00 00 00 00 00 00 00 00 00 00 00 00
00 00 00 00 00 00 00 00 00 00 00 00 00 00 9a 90

00 ff ff ff ff ff ff 00 09 e5 d4 0a 00 00 00 00
28 1f 01 04 a5 1d 12 78 03 7a 75 a7 51 4b 9a 26
0e 50 54 00 00 00 01 01 01 01 01 01 01 01 01 01
01 01 01 01 01 01 d8 3c 80 a0 70 b0 30 40 30 20
36 00 1e b3 10 00 00 1a 90 28 80 a0 70 b0 30 40
30 20 36 00 1e b3 10 00 00 1a 00 00 00 00 00 00
00 00 00 00 00 00 00 00 00 00 00 00 00 00 00 03
00 0d 28 ff 0a 3c c8 0b 0c 26 c8 00 00 00 01 72

70 20 79 00 00 25 01 09 99 95 01 65 60 02 28 3c
80 81 00 13 72 1a 00 00 03 01 28 3c 00 00 00 00
00 00 3c 00 00 00 00 00 00 00 00 00 00 00 00 00
00 00 00 00 00 00 00 00 00 00 00 00 00 00 00 00
00 00 00 00 00 00 00 00 00 00 00 00 00 00 00 00
00 00 00 00 00 00 00 00 00 00 00 00 00 00 00 00
00 00 00 00 00 00 00 00 00 00 00 00 00 00 00 00
00 00 00 00 00 00 00 00 00 00 00 00 00 00 9a 90

----------------

Block 0, Base EDID:
  EDID Structure Version & Revision: 1.4
  Vendor & Product Identification:
    Manufacturer: BOE
    Model: 2772
    Made in: week 40 of 2021
  Basic Display Parameters & Features:
    Digital display
    Bits per primary color channel: 8
    DisplayPort interface
    Maximum image size: 29 cm x 18 cm
    Gamma: 2.20
    Supported color formats: RGB 4:4:4
    First detailed timing includes the native pixel format and preferred refresh rate
    Display supports continuous frequencies
  Color Characteristics:
    Red  : 0.6533, 0.3193
    Green: 0.2949, 0.6035
    Blue : 0.1494, 0.0576
    White: 0.3134, 0.3291
  Established Timings I & II: none
  Standard Timings: none
  Detailed Timing Descriptors:
    DTD 1:  1920x1200   60.003698 Hz  16:10    74.885 kHz    155.760000 MHz (286 mm x 179 mm)
                 Hfront   48 Hsync  32 Hback   80 Hpol P
                 Vfront    3 Vsync   6 Vback   39 Vpol N
    DTD 2:  1920x1200   40.002465 Hz  16:10    49.923 kHz    103.840000 MHz (286 mm x 179 mm)
                 Hfront   48 Hsync  32 Hback   80 Hpol P
                 Vfront    3 Vsync   6 Vback   39 Vpol N
    Empty Descriptor
    Manufacturer-Specified Display Descriptor (0x03): 00 03 00 0d 28 ff 0a 3c c8 0b 0c 26 c8 00 00 00 '....(..<...&....'
  Extension blocks: 1
Checksum: 0x72

----------------

Block 1, DisplayID Extension Block:
  Version: 2.0
  Extension Count: 0
  Display Product Primary Use Case: Same primary use case as the base section
  Dynamic Video Timing Range Limits Data Block:
    Minimum Pixel Clock: 103834 kHz
    Maximum Pixel Clock: 155750 kHz
    Minimum Vertical Refresh Rate: 40 Hz
    Maximum Vertical Refresh Rate: 60 Hz
    Seamless Dynamic Video Timing Support: Yes
  CTA-861 DisplayID Data Block:
  Vendor-Specific Data Block (AMD), OUI 00-00-1A:
    Version: 3
    Feature Caps: 0x01
    Minimum Refresh Rate: 40 Hz
    Maximum Refresh Rate: 60 Hz
    Flags 1.x: 0x00
    Flags 2.x: 0x00
  Checksum: 0x9a
Checksum: 0x90

----------------

Warnings:

Block 0, Base EDID:
  Missing Display Product Name.

Failures:

Block 0, Base EDID:
  Empty Descriptor: Use Dummy Descriptor instead of all zeroes.
  Missing Display Range Limits Descriptor.
Block 1, DisplayID Extension Block:
  DisplayID Base Block has no product type.
EDID:
  Extension Block 2 started with EDID header, ignoring Extension Blocks >= 2.
  DisplayID: DisplayID expects at least one preferred timing.

EDID conformity: FAIL
