edid-decode (hex):

00 ff ff ff ff ff ff 00 59 3a 27 10 01 01 01 01
03 1b 01 03 80 60 36 78 0a e6 9d a3 54 4a 99 26
0f 47 4a 21 08 00 81 80 95 00 b3 00 01 01 01 01
01 01 01 01 01 01 02 3a 80 18 71 38 2d 40 58 2c
45 00 ac 12 32 00 00 1e 0e 1f 00 80 51 00 1e 30
40 80 37 00 ac 12 32 00 00 1c 00 00 00 fd 00 32
4b 1e 46 0f 00 0a 20 20 20 20 20 20 00 00 00 fc
00 44 34 33 66 2d 45 32 0a 20 20 20 20 20 01 bc

02 03 32 71 4f 02 03 04 05 06 07 90 13 14 1f 20
22 01 11 12 2c 09 07 07 15 07 50 57 07 00 3d 07
bc 83 01 00 00 6c 03 0c 00 20 00 38 2d c0 02 02
02 02 01 1d 00 72 51 d0 1e 20 6e 28 55 00 9a e6
10 00 00 1a 01 1d 80 18 71 1c 16 20 58 2c 25 00
9a e6 10 00 00 9e 8c 0a d0 8a 20 e0 2d 10 10 3a
96 00 9a e6 10 00 00 18 02 3a 80 18 71 38 2d 40
58 2c 45 00 9a e6 10 00 00 1e 00 00 00 00 00 6f

00 ff ff ff ff ff ff 00 59 3a 27 10 01 01 01 01
03 1b 01 03 80 60 36 78 0a e6 9d a3 54 4a 99 26
0f 47 4a 21 08 00 81 80 95 00 b3 00 01 01 01 01
01 01 01 01 01 01 02 3a 80 18 71 38 2d 40 58 2c
45 00 ac 12 32 00 00 1e 0e 1f 00 80 51 00 1e 30
40 80 37 00 ac 12 32 00 00 1c 00 00 00 fd 00 32
4b 1e 46 0f 00 0a 20 20 20 20 20 20 00 00 00 fc
00 44 34 33 66 2d 45 32 0a 20 20 20 20 20 01 bc

02 03 32 71 4f 02 03 04 05 06 07 90 13 14 1f 20
22 01 11 12 2c 09 07 07 15 07 50 57 07 00 3d 07
bc 83 01 00 00 6c 03 0c 00 20 00 38 2d c0 02 02
02 02 01 1d 00 72 51 d0 1e 20 6e 28 55 00 9a e6
10 00 00 1a 01 1d 80 18 71 1c 16 20 58 2c 25 00
9a e6 10 00 00 9e 8c 0a d0 8a 20 e0 2d 10 10 3a
96 00 9a e6 10 00 00 18 02 3a 80 18 71 38 2d 40
58 2c 45 00 9a e6 10 00 00 1e 00 00 00 00 00 6f

----------------

Block 0, Base EDID:
  EDID Structure Version & Revision: 1.3
  Vendor & Product Identification:
    Manufacturer: VIZ
    Model: 4135
    Serial Number: ...
    Made in: week 3 of 2017
  Basic Display Parameters & Features:
    Digital display
    Maximum image size: 96 cm x 54 cm
    Gamma: 2.20
    RGB color display
    First detailed timing is the preferred timing
  Color Characteristics:
    Red  : 0.6396, 0.3300
    Green: 0.2900, 0.5996
    Blue : 0.1503, 0.0595
    White: 0.2802, 0.2900
  Established Timings I & II:
    DMT 0x04:   640x480    59.940476 Hz   4:3     31.469 kHz     25.175000 MHz
    DMT 0x09:   800x600    60.316541 Hz   4:3     37.879 kHz     40.000000 MHz
    DMT 0x10:  1024x768    60.003840 Hz   4:3     48.363 kHz     65.000000 MHz
  Standard Timings:
    DMT 0x23:  1280x1024   60.019740 Hz   5:4     63.981 kHz    108.000000 MHz
    DMT 0x2f:  1440x900    59.887445 Hz  16:10    55.935 kHz    106.500000 MHz
    DMT 0x3a:  1680x1050   59.954250 Hz  16:10    65.290 kHz    146.250000 MHz
  Detailed Timing Descriptors:
    DTD 1:  1920x1080   60.000000 Hz  16:9     67.500 kHz    148.500000 MHz (940 mm x 530 mm)
                 Hfront   88 Hsync  44 Hback  148 Hpol P
                 Vfront    4 Vsync   5 Vback   36 Vpol P
    DTD 2:  1280x768    59.870228 Hz   5:3     47.776 kHz     79.500000 MHz (940 mm x 530 mm)
                 Hfront   64 Hsync 128 Hback  192 Hpol N
                 Vfront    3 Vsync   7 Vback   20 Vpol P
    Display Range Limits:
      Monitor ranges (GTF): 50-75 Hz V, 30-70 kHz H, max dotclock 150 MHz
    Display Product Name: 'D43f-E2'
  Extension blocks: 1
Checksum: 0xbc

----------------

Block 1, CTA-861 Extension Block:
  Revision: 3
  Basic audio support
  Supports YCbCr 4:4:4
  Supports YCbCr 4:2:2
  Native DTDs: 1
  Video Data Block:
    VIC   2:   720x480    59.940060 Hz   4:3     31.469 kHz     27.000000 MHz
    VIC   3:   720x480    59.940060 Hz  16:9     31.469 kHz     27.000000 MHz
    VIC   4:  1280x720    60.000000 Hz  16:9     45.000 kHz     74.250000 MHz
    VIC   5:  1920x1080i  60.000000 Hz  16:9     33.750 kHz     74.250000 MHz
    VIC   6:  1440x480i   59.940060 Hz   4:3     15.734 kHz     27.000000 MHz
    VIC   7:  1440x480i   59.940060 Hz  16:9     15.734 kHz     27.000000 MHz
    VIC  16:  1920x1080   60.000000 Hz  16:9     67.500 kHz    148.500000 MHz (native)
    VIC  19:  1280x720    50.000000 Hz  16:9     37.500 kHz     74.250000 MHz
    VIC  20:  1920x1080i  50.000000 Hz  16:9     28.125 kHz     74.250000 MHz
    VIC  31:  1920x1080   50.000000 Hz  16:9     56.250 kHz    148.500000 MHz
    VIC  32:  1920x1080   24.000000 Hz  16:9     27.000 kHz     74.250000 MHz
    VIC  34:  1920x1080   30.000000 Hz  16:9     33.750 kHz     74.250000 MHz
    VIC   1:   640x480    59.940476 Hz   4:3     31.469 kHz     25.175000 MHz
    VIC  17:   720x576    50.000000 Hz   4:3     31.250 kHz     27.000000 MHz
    VIC  18:   720x576    50.000000 Hz  16:9     31.250 kHz     27.000000 MHz
  Audio Data Block:
    Linear PCM:
      Max channels: 2
      Supported sample rates (kHz): 48 44.1 32
      Supported sample sizes (bits): 24 20 16
    AC-3:
      Max channels: 6
      Supported sample rates (kHz): 48 44.1 32
      Maximum bit rate: 640 kb/s
    Enhanced AC-3 (DD+):
      Max channels: 8
      Supported sample rates (kHz): 48 44.1 32
    DTS:
      Max channels: 6
      Supported sample rates (kHz): 48 44.1 32
      Maximum bit rate: 1504 kb/s
  Speaker Allocation Data Block:
    FL/FR - Front Left/Right
  Vendor-Specific Data Block (HDMI), OUI 00-0C-03:
    Source physical address: 2.0.0.0
    DC_36bit
    DC_30bit
    DC_Y444
    Maximum TMDS clock: 225 MHz
    Video latency: 2 ms
    Audio latency: 2 ms
    Interlaced video latency: 2 ms
    Interlaced audio latency: 2 ms
  Detailed Timing Descriptors:
    DTD 3:  1280x720    60.000000 Hz  16:9     45.000 kHz     74.250000 MHz (410 mm x 230 mm)
                 Hfront  110 Hsync  40 Hback  220 Hpol P
                 Vfront    5 Vsync   5 Vback   20 Vpol N
    DTD 4:  1920x1080i  60.000000 Hz  16:9     33.750 kHz     74.250000 MHz (410 mm x 230 mm)
                 Hfront   88 Hsync  44 Hback  148 Hpol P
                 Vfront    2 Vsync   5 Vback   15 Vpol P Vfront +0.5 Odd Field
                 Vfront    2 Vsync   5 Vback   15 Vpol P Vback  +0.5 Even Field
    DTD 5:   720x480    59.940060 Hz   3:2     31.469 kHz     27.000000 MHz (410 mm x 230 mm)
                 Hfront   16 Hsync  58 Hback   64 Hpol N
                 Vfront    9 Vsync   6 Vback   30 Vpol N
    DTD 6:  1920x1080   60.000000 Hz  16:9     67.500 kHz    148.500000 MHz (410 mm x 230 mm)
                 Hfront   88 Hsync  44 Hback  148 Hpol P
                 Vfront    4 Vsync   5 Vback   36 Vpol P
Checksum: 0x6f  Unused space in Extension Block: 5 bytes

----------------

Warnings:

Block 0, Base EDID:
  Vendor & Product Identification: The serial number is one of the known dummy values, it should probably be set to 0.
  Detailed Timing Descriptor #2: Image size is 940x530 mm, but based on the picture AR it should be 883x530 mm.
Block 1, CTA-861 Extension Block:
  IT Video Formats are overscanned by default, but normally this should be underscanned.
  Video Data Block: VIC 2 and the first DTD are not identical. Is this intended?
  Vendor-Specific Data Block (HDMI), OUI 00-0C-03: Progressive and Interlaced latency values are identical, no need for both.
  Detailed Timing Descriptor #3: DTD is similar but not identical to VIC 4.
  Detailed Timing Descriptor #5: DTD is similar but not identical to VIC 2.
  Detailed Timing Descriptor #5: Image size is 410x230 mm, but based on the picture AR it should be 345x230 mm.
  Add a Colorimetry Data Block with the sRGB colorimetry bit set to avoid interop issues.
EDID:
  Base EDID: Some timings are out of range of the Monitor Ranges:
    Vertical Freq: 24.000 - 60.317 Hz (Monitor: 50.000 - 75.000 Hz)
    Horizontal Freq: 15.734 - 67.500 kHz (Monitor: 30.000 - 70.000 kHz)

Failures:

Block 0, Base EDID:
  Detailed Timing Descriptor #1: Mismatch of image size 940x530 mm vs display size 960x540 mm.
  Detailed Timing Descriptor #2: Mismatch of image size 940x530 mm vs display size 960x540 mm.
Block 1, CTA-861 Extension Block:
  Detailed Timing Descriptor #3: Mismatch of image size 410x230 mm vs display size 960x540 mm.
  Detailed Timing Descriptor #4: Mismatch of image size 410x230 mm vs display size 960x540 mm.
  Detailed Timing Descriptor #5: Mismatch of image size 410x230 mm vs display size 960x540 mm.
  Detailed Timing Descriptor #6: Mismatch of image size 410x230 mm vs display size 960x540 mm.
  Missing VCDB, needed for Set Selectable RGB Quantization to avoid interop issues.
EDID:
  Extension Block 2 started with EDID header, ignoring Extension Blocks >= 2.

EDID conformity: FAIL
