edid-decode (hex):

00 ff ff ff ff ff ff 00 30 e4 42 07 00 00 00 00
00 1f 01 04 a5 22 13 78 03 71 c5 98 5e 5b 8f 27
1b 50 54 00 00 00 01 01 01 01 01 01 01 01 01 01
01 01 01 01 01 01 5f 87 80 a0 70 38 a0 46 30 20
35 00 58 c2 10 00 00 1a 00 00 00 fd 00 3c 90 a7
a7 23 01 0a 20 20 20 20 20 20 00 00 00 fe 00 4c
47 20 44 49 53 50 4c 41 59 0a 20 20 00 00 00 fe
00 4c 50 31 35 36 57 46 4a 2d 53 50 42 34 01 4d

70 13 79 00 00 03 01 14 5e 87 00 84 7f 07 9f 00
2f 80 1f 00 37 04 4c 00 02 00 04 00 00 00 00 00
00 00 00 00 00 00 00 00 00 00 00 00 00 00 00 00
00 00 00 00 00 00 00 00 00 00 00 00 00 00 00 00
00 00 00 00 00 00 00 00 00 00 00 00 00 00 00 00
00 00 00 00 00 00 00 00 00 00 00 00 00 00 00 00
00 00 00 00 00 00 00 00 00 00 00 00 00 00 00 00
00 00 00 00 00 00 00 00 00 00 00 00 00 00 73 90

00 ff ff ff ff ff ff 00 30 e4 42 07 00 00 00 00
00 1f 01 04 a5 22 13 78 03 71 c5 98 5e 5b 8f 27
1b 50 54 00 00 00 01 01 01 01 01 01 01 01 01 01
01 01 01 01 01 01 5f 87 80 a0 70 38 a0 46 30 20
35 00 58 c2 10 00 00 1a 00 00 00 fd 00 3c 90 a7
a7 23 01 0a 20 20 20 20 20 20 00 00 00 fe 00 4c
47 20 44 49 53 50 4c 41 59 0a 20 20 00 00 00 fe
00 4c 50 31 35 36 57 46 4a 2d 53 50 42 34 01 4d

70 13 79 00 00 03 01 14 5e 87 00 84 7f 07 9f 00
2f 80 1f 00 37 04 4c 00 02 00 04 00 00 00 00 00
00 00 00 00 00 00 00 00 00 00 00 00 00 00 00 00
00 00 00 00 00 00 00 00 00 00 00 00 00 00 00 00
00 00 00 00 00 00 00 00 00 00 00 00 00 00 00 00
00 00 00 00 00 00 00 00 00 00 00 00 00 00 00 00
00 00 00 00 00 00 00 00 00 00 00 00 00 00 00 00
00 00 00 00 00 00 00 00 00 00 00 00 00 00 73 90

----------------

Block 0, Base EDID:
  EDID Structure Version & Revision: 1.4
  Vendor & Product Identification:
    Manufacturer: LGD
    Model: 1858
    Made in: 2021
  Basic Display Parameters & Features:
    Digital display
    Bits per primary color channel: 8
    DisplayPort interface
    Maximum image size: 34 cm x 19 cm
    Gamma: 2.20
    Supported color formats: RGB 4:4:4
    First detailed timing includes the native pixel format and preferred refresh rate
    Display supports continuous frequencies
  Color Characteristics:
    Red  : 0.5947, 0.3701
    Green: 0.3554, 0.5595
    Blue : 0.1552, 0.1054
    White: 0.3134, 0.3291
  Established Timings I & II: none
  Standard Timings: none
  Detailed Timing Descriptors:
    DTD 1:  1920x1080   60.018219 Hz  16:9    166.611 kHz    346.550000 MHz (344 mm x 194 mm)
                 Hfront   48 Hsync  32 Hback   80 Hpol P
                 Vfront    3 Vsync   5 Vback 1688 Vpol N
    Display Range Limits:
      Monitor ranges (Range Limits Only): 60-144 Hz V, 167-167 kHz H, max dotclock 350 MHz
    Alphanumeric Data String: 'LG DISPLAY'
    Alphanumeric Data String: 'LP156WFJ-SPB4'
  Extension blocks: 1
Checksum: 0x4d

----------------

Block 1, DisplayID Extension Block:
  Version: 1.3
  Extension Count: 0
  Display Product Type: Extension Section
  Video Timing Modes Type 1 - Detailed Timings Data Block:
    DTD:  1920x1080  144.002227 Hz  16:9    166.611 kHz    346.550000 MHz (aspect 16:9, no 3D stereo, preferred)
               Hfront   48 Hsync  32 Hback   80 Hpol P
               Vfront    3 Vsync   5 Vback   69 Vpol N
  Checksum: 0x73
Checksum: 0x90

----------------

Warnings:

Block 0, Base EDID:
  Missing Display Product Name.

Failures:

Block 1, DisplayID Extension Block:
  DisplayID Base Block has no product type.
EDID:
  Extension Block 2 started with EDID header, ignoring Extension Blocks >= 2.

EDID conformity: FAIL
