edid-decode (hex):

00 ff ff ff ff ff ff 00 4c 2d 36 74 35 44 5a 35
2a 21 01 04 b5 35 1e 78 3b bc 55 a7 52 4c a2 27
0a 50 54 bb 8c 00 b3 00 81 c0 81 00 81 80 95 00
a9 c0 01 01 01 01 02 3a 80 18 71 38 2d 40 58 2c
45 00 0f 28 21 00 00 1e 00 00 00 fd 00 30 64 6e
6e 17 01 0a 20 20 20 20 20 20 00 00 00 fc 00 4c
53 32 34 43 33 33 78 47 0a 20 20 20 00 00 00 ff
00 48 39 54 57 41 30 30 35 32 38 0a 20 20 01 43

02 03 14 b1 46 90 04 1f 13 12 03 68 1a 00 00 01
01 30 64 00 01 1d 00 bc 52 d0 1e 20 b8 28 55 40
0f 28 21 00 00 1e 8c 0a d0 90 20 40 31 20 0c 40
55 00 0f 28 21 00 00 18 8c 0a d0 8a 20 e0 2d 10
10 3e 96 00 0f 28 21 00 00 18 84 58 80 8c 70 38
14 40 30 20 35 00 0f 28 21 00 00 1a 00 00 00 00
00 00 00 00 00 00 00 00 00 00 00 00 00 00 00 00
00 00 00 00 00 00 00 00 00 00 00 00 00 00 00 c4

00 ff ff ff ff ff ff 00 4c 2d 36 74 35 44 5a 35
2a 21 01 04 b5 35 1e 78 3b bc 55 a7 52 4c a2 27
0a 50 54 bb 8c 00 b3 00 81 c0 81 00 81 80 95 00
a9 c0 01 01 01 01 02 3a 80 18 71 38 2d 40 58 2c
45 00 0f 28 21 00 00 1e 00 00 00 fd 00 30 64 6e
6e 17 01 0a 20 20 20 20 20 20 00 00 00 fc 00 4c
53 32 34 43 33 33 78 47 0a 20 20 20 00 00 00 ff
00 48 39 54 57 41 30 30 35 32 38 0a 20 20 01 43

02 03 14 b1 46 90 04 1f 13 12 03 68 1a 00 00 01
01 30 64 00 01 1d 00 bc 52 d0 1e 20 b8 28 55 40
0f 28 21 00 00 1e 8c 0a d0 90 20 40 31 20 0c 40
55 00 0f 28 21 00 00 18 8c 0a d0 8a 20 e0 2d 10
10 3e 96 00 0f 28 21 00 00 18 84 58 80 8c 70 38
14 40 30 20 35 00 0f 28 21 00 00 1a 00 00 00 00
00 00 00 00 00 00 00 00 00 00 00 00 00 00 00 00
00 00 00 00 00 00 00 00 00 00 00 00 00 00 00 c4

----------------

Block 0, Base EDID:
  EDID Structure Version & Revision: 1.4
  Vendor & Product Identification:
    Manufacturer: SAM
    Model: 29750
    Serial Number: ...
    Made in: week 42 of 2023
  Basic Display Parameters & Features:
    Digital display
    Bits per primary color channel: 10
    DisplayPort interface
    Maximum image size: 53 cm x 30 cm
    Gamma: 2.20
    DPMS levels: Off
    Supported color formats: RGB 4:4:4, YCrCb 4:4:4, YCrCb 4:2:2
    First detailed timing includes the native pixel format and preferred refresh rate
    Display supports continuous frequencies
  Color Characteristics:
    Red  : 0.6542, 0.3232
    Green: 0.2998, 0.6328
    Blue : 0.1533, 0.0400
    White: 0.3134, 0.3291
  Established Timings I & II:
    IBM     :   720x400    70.081663 Hz   9:5     31.467 kHz     28.320000 MHz
    DMT 0x04:   640x480    59.940476 Hz   4:3     31.469 kHz     25.175000 MHz
    Apple   :   640x480    66.666667 Hz   4:3     35.000 kHz     30.240000 MHz
    DMT 0x05:   640x480    72.808802 Hz   4:3     37.861 kHz     31.500000 MHz
    DMT 0x08:   800x600    56.250000 Hz   4:3     35.156 kHz     36.000000 MHz
    DMT 0x09:   800x600    60.316541 Hz   4:3     37.879 kHz     40.000000 MHz
    DMT 0x0a:   800x600    72.187572 Hz   4:3     48.077 kHz     50.000000 MHz
    DMT 0x10:  1024x768    60.003840 Hz   4:3     48.363 kHz     65.000000 MHz
    DMT 0x11:  1024x768    70.069359 Hz   4:3     56.476 kHz     75.000000 MHz
  Standard Timings:
    DMT 0x3a:  1680x1050   59.954250 Hz  16:10    65.290 kHz    146.250000 MHz
    DMT 0x55:  1280x720    60.000000 Hz  16:9     45.000 kHz     74.250000 MHz
    DMT 0x1c:  1280x800    59.810326 Hz  16:10    49.702 kHz     83.500000 MHz
    DMT 0x23:  1280x1024   60.019740 Hz   5:4     63.981 kHz    108.000000 MHz
    DMT 0x2f:  1440x900    59.887445 Hz  16:10    55.935 kHz    106.500000 MHz
    DMT 0x53:  1600x900    60.000000 Hz  16:9     60.000 kHz    108.000000 MHz (RB)
  Detailed Timing Descriptors:
    DTD 1:  1920x1080   60.000000 Hz  16:9     67.500 kHz    148.500000 MHz (527 mm x 296 mm)
                 Hfront   88 Hsync  44 Hback  148 Hpol P
                 Vfront    4 Vsync   5 Vback   36 Vpol P
    Display Range Limits:
      Monitor ranges (Range Limits Only): 48-100 Hz V, 110-110 kHz H, max dotclock 230 MHz
    Display Product Name: 'LS24C33xG'
    Display Product Serial Number: ...
  Extension blocks: 1
Checksum: 0x43

----------------

Block 1, CTA-861 Extension Block:
  Revision: 3
  Underscans IT Video Formats by default
  Supports YCbCr 4:4:4
  Supports YCbCr 4:2:2
  Native DTDs: 1
  Video Data Block:
    VIC  16:  1920x1080   60.000000 Hz  16:9     67.500 kHz    148.500000 MHz (native)
    VIC   4:  1280x720    60.000000 Hz  16:9     45.000 kHz     74.250000 MHz
    VIC  31:  1920x1080   50.000000 Hz  16:9     56.250 kHz    148.500000 MHz
    VIC  19:  1280x720    50.000000 Hz  16:9     37.500 kHz     74.250000 MHz
    VIC  18:   720x576    50.000000 Hz  16:9     31.250 kHz     27.000000 MHz
    VIC   3:   720x480    59.940060 Hz  16:9     31.469 kHz     27.000000 MHz
  Vendor-Specific Data Block (AMD), OUI 00-00-1A:
    Version: 1
    Flags 1: 0x01
      FreeSync Supported
    Minimum Refresh Rate: 48 Hz
    Maximum Refresh Rate: 100 Hz
  Detailed Timing Descriptors:
    DTD 2:  1280x720    50.000000 Hz  16:9     37.500 kHz     74.250000 MHz (527 mm x 296 mm)
                 Hfront  440 Hsync  40 Hback  220 Hpol P
                 Vfront    5 Vsync   5 Vback   20 Vpol P
    DTD 3:   720x576    50.000000 Hz   5:4     31.250 kHz     27.000000 MHz (527 mm x 296 mm)
                 Hfront   12 Hsync  64 Hback   68 Hpol N
                 Vfront    5 Vsync   5 Vback   39 Vpol N
    DTD 4:   720x480    59.940060 Hz   3:2     31.469 kHz     27.000000 MHz (527 mm x 296 mm)
                 Hfront   16 Hsync  62 Hback   60 Hpol N
                 Vfront    9 Vsync   6 Vback   30 Vpol N
    DTD 5:  1920x1080  100.000000 Hz  16:9    110.000 kHz    226.600000 MHz (527 mm x 296 mm)
                 Hfront   48 Hsync  32 Hback   60 Hpol P
                 Vfront    3 Vsync   5 Vback   12 Vpol N
Checksum: 0xc4  Unused space in Extension Block: 35 bytes

----------------

Warnings:

Block 1, CTA-861 Extension Block:
  Detailed Timing Descriptor #3: Image size is 527x296 mm, but based on the picture AR it should be 370x296 mm.
  Detailed Timing Descriptor #4: Image size is 527x296 mm, but based on the picture AR it should be 444x296 mm.
  Display Product Serial Number is set, so the Serial Number in the Base EDID should be 0.
  Add a Colorimetry Data Block with the sRGB colorimetry bit set to avoid interop issues.
EDID:
  Base EDID: Some timings are out of range of the Monitor Ranges:
    Horizontal Freq: 31.250 - 110.000 kHz (Monitor: 110.000 - 110.000 kHz)

Failures:

Block 1, CTA-861 Extension Block:
  Missing VCDB, needed for Set Selectable RGB Quantization to avoid interop issues.
EDID:
  Extension Block 2 started with EDID header, ignoring Extension Blocks >= 2.

EDID conformity: FAIL
