edid-decode (hex):

00 ff ff ff ff ff ff 00 4d 10 f6 14 00 00 00 00
0a 1e 01 04 a5 1d 11 78 06 de 50 a3 54 4c 99 26
0f 50 54 00 00 00 01 01 01 01 01 01 01 01 01 01
01 01 01 01 01 01 ad 36 80 62 70 38 4c 40 09 09
05 00 26 a5 10 00 00 18 56 1b 80 62 70 38 4c 40
09 09 05 00 26 a5 10 00 00 18 00 00 00 10 00 00
00 00 00 00 00 00 00 00 00 00 00 00 00 00 00 fc
00 4c 51 31 33 33 4d 31 4a 57 35 32 0a 20 00 aa

00 ff ff ff ff ff ff 00 4d 10 f6 14 00 00 00 00
0a 1e 01 04 a5 1d 11 78 06 de 50 a3 54 4c 99 26
0f 50 54 00 00 00 01 01 01 01 01 01 01 01 01 01
01 01 01 01 01 01 ad 36 80 62 70 38 4c 40 09 09
05 00 26 a5 10 00 00 18 56 1b 80 62 70 38 4c 40
09 09 05 00 26 a5 10 00 00 18 00 00 00 10 00 00
00 00 00 00 00 00 00 00 00 00 00 00 00 00 00 fc
00 4c 51 31 33 33 4d 31 4a 57 35 32 0a 20 00 aa

----------------

Block 0, Base EDID:
  EDID Structure Version & Revision: 1.4
  Vendor & Product Identification:
    Manufacturer: SHP
    Model: 5366
    Made in: week 10 of 2020
  Basic Display Parameters & Features:
    Digital display
    Bits per primary color channel: 8
    DisplayPort interface
    Maximum image size: 29 cm x 17 cm
    Gamma: 2.20
    Supported color formats: RGB 4:4:4
    Default (sRGB) color space is primary color space
    First detailed timing includes the native pixel format and preferred refresh rate
  Color Characteristics:
    Red  : 0.6396, 0.3291
    Green: 0.2998, 0.5996
    Blue : 0.1494, 0.0595
    White: 0.3125, 0.3281
  Established Timings I & II: none
  Standard Timings: none
  Detailed Timing Descriptors:
    DTD 1:  1920x1080   60.000652 Hz  16:9     69.361 kHz    139.970000 MHz (294 mm x 165 mm)
                 Hfront    9 Hsync   9 Hback   80 Hpol N
                 Vfront    0 Vsync   5 Vback   71 Vpol N
                   ad 36 80 62 70 38 4c 40 09 09 05 00 26 a5 10 00 00 18 '.6.bp8L@....&.....'
    DTD 2:  1920x1080   29.998182 Hz  16:9     34.678 kHz     69.980000 MHz (294 mm x 165 mm)
                 Hfront    9 Hsync   9 Hback   80 Hpol N
                 Vfront    0 Vsync   5 Vback   71 Vpol N
                   56 1b 80 62 70 38 4c 40 09 09 05 00 26 a5 10 00 00 18 'V..bp8L@....&.....'
    Dummy Descriptor:
    Display Product Name: 'LQ133M1JW52'
Checksum: 0xaa

----------------

Failures:

Block 0, Base EDID:
  Basic Display Parameters & Features: sRGB is signaled, but the chromaticities do not match.
  Detailed Timing Descriptor #1: 0 values in the video timing:
    Horizontal Active/Blanking 1920/98
    Horizontal Frontporch/Sync Width 9/9
    Vertical Active/Blanking 1080/76
    Vertical Frontporch/Sync Width 0/5
  Detailed Timing Descriptor #2: 0 values in the video timing:
    Horizontal Active/Blanking 1920/98
    Horizontal Frontporch/Sync Width 9/9
    Vertical Active/Blanking 1080/76
    Vertical Frontporch/Sync Width 0/5
EDID:
  Extension Block 1 started with EDID header, ignoring Extension Blocks >= 1.

EDID conformity: FAIL
