edid-decode (hex):

00 ff ff ff ff ff ff 00 4c f4 83 23 01 00 00 00
1e 1e 01 03 80 24 19 78 ea 1e c5 ae 4f 34 b1 26
0e 50 54 2d cf 00 61 40 01 01 81 00 81 80 01 01
01 01 01 01 01 01 30 2a 00 98 51 00 2a 40 30 70
16 00 68 fa 10 00 00 1c 0e 1f 00 80 51 00 20 30
40 80 37 00 68 fa 10 00 00 1c 00 00 00 fc 00 48
44 4d 49 0a 20 20 20 20 20 20 20 20 00 00 00 ff
00 30 30 30 30 30 30 31 0a 20 20 20 20 20 01 13

02 03 10 f1 43 03 01 04 23 09 07 07 83 01 00 00
64 19 00 40 41 00 26 30 18 88 36 00 72 0c 11 00
00 1e 00 00 00 00 00 00 00 00 00 00 00 00 00 00
00 00 00 00 00 00 00 00 00 00 00 00 00 00 00 00
00 00 00 00 00 00 00 00 00 00 00 00 00 00 00 00
00 00 00 00 00 00 00 00 00 00 00 00 00 00 00 00
00 00 00 00 00 00 00 00 00 00 00 00 00 00 00 00
00 00 00 00 00 00 00 00 00 00 00 00 00 00 00 1a

----------------

Block 0, Base EDID:
  EDID Structure Version & Revision: 1.3
  Vendor & Product Identification:
    Manufacturer: SGT
    Model: 9091
    Serial Number: ...
    Made in: week 30 of 2020
  Basic Display Parameters & Features:
    Digital display
    Maximum image size: 36 cm x 25 cm
    Gamma: 2.20
    DPMS levels: Standby Suspend Off
    RGB color display
    First detailed timing is the preferred timing
  Color Characteristics:
    Red  : 0.6796, 0.3095
    Green: 0.2060, 0.6933
    Blue : 0.1513, 0.0546
    White: 0.3134, 0.3291
  Established Timings I & II:
    DMT 0x04:   640x480    59.940476 Hz   4:3     31.469 kHz     25.175000 MHz
    DMT 0x05:   640x480    72.808802 Hz   4:3     37.861 kHz     31.500000 MHz
    DMT 0x06:   640x480    75.000000 Hz   4:3     37.500 kHz     31.500000 MHz
    DMT 0x09:   800x600    60.316541 Hz   4:3     37.879 kHz     40.000000 MHz
    DMT 0x0a:   800x600    72.187572 Hz   4:3     48.077 kHz     50.000000 MHz
    DMT 0x0b:   800x600    75.000000 Hz   4:3     46.875 kHz     49.500000 MHz
    DMT 0x10:  1024x768    60.003840 Hz   4:3     48.363 kHz     65.000000 MHz
    DMT 0x11:  1024x768    70.069359 Hz   4:3     56.476 kHz     75.000000 MHz
    DMT 0x12:  1024x768    75.028582 Hz   4:3     60.023 kHz     78.750000 MHz
    DMT 0x24:  1280x1024   75.024675 Hz   5:4     79.976 kHz    135.000000 MHz
  Standard Timings:
    DMT 0x10:  1024x768    60.003840 Hz   4:3     48.363 kHz     65.000000 MHz
    DMT 0x1c:  1280x800    59.810326 Hz  16:10    49.702 kHz     83.500000 MHz
    DMT 0x23:  1280x1024   60.019740 Hz   5:4     63.981 kHz    108.000000 MHz
  Detailed Timing Descriptors:
    DTD 1:  1280x1024   60.019740 Hz   5:4     63.981 kHz    108.000000 MHz (360 mm x 250 mm)
                 Hfront   48 Hsync 112 Hback  248 Hpol N
                 Vfront    1 Vsync   6 Vback   35 Vpol P
    DTD 2:  1280x768    59.720553 Hz   5:3     47.776 kHz     79.500000 MHz (360 mm x 250 mm)
                 Hfront   64 Hsync 128 Hback  192 Hpol N
                 Vfront    3 Vsync   7 Vback   22 Vpol P
    Display Product Name: 'HDMI'
    Display Product Serial Number: ...
  Extension blocks: 1
Checksum: 0x13

----------------

Block 1, CTA-861 Extension Block:
  Revision: 3
  Underscans IT Video Formats by default
  Basic audio support
  Supports YCbCr 4:4:4
  Supports YCbCr 4:2:2
  Native DTDs: 1
  Video Data Block:
    VIC   3:   720x480    59.940060 Hz  16:9     31.469 kHz     27.000000 MHz
    VIC   1:   640x480    59.940476 Hz   4:3     31.469 kHz     25.175000 MHz
    VIC   4:  1280x720    60.000000 Hz  16:9     45.000 kHz     74.250000 MHz
  Audio Data Block:
    Linear PCM:
      Max channels: 2
      Supported sample rates (kHz): 48 44.1 32
      Supported sample sizes (bits): 24 20 16
  Speaker Allocation Data Block:
    FL/FR - Front Left/Right
  Detailed Timing Descriptors:
    DTD 3:  1024x768    60.003840 Hz   4:3     48.363 kHz     65.000000 MHz (370 mm x 268 mm)
                 Hfront   24 Hsync 136 Hback  160 Hpol P
                 Vfront    3 Vsync   6 Vback   29 Vpol P
Checksum: 0x1a  Unused space in Extension Block: 93 bytes

----------------

Warnings:

Block 0, Base EDID:
  Vendor & Product Identification: The serial number is one of the known dummy values, it should probably be set to 0.
  Detailed Timing Descriptor #1: DTD is similar but not identical to DMT 0x23.
  Detailed Timing Descriptor #1: Image size is 360x250 mm, but based on the picture AR it should be 312x250 mm.
  Detailed Timing Descriptor #2: Image size is 360x250 mm, but based on the picture AR it should be 360x216 mm.
  Display Product Serial Number: ...
Block 1, CTA-861 Extension Block:
  Video Data Block: VIC 3 and the first DTD are not identical. Is this intended?
  Detailed Timing Descriptor #3: DTD is similar but not identical to DMT 0x10.
  Display Product Serial Number is set, so the Serial Number in the Base EDID should be 0.
  Add a Colorimetry Data Block with the sRGB colorimetry bit set to avoid interop issues.

Failures:

Block 0, Base EDID:
  Missing Display Range Limits Descriptor.
Block 1, CTA-861 Extension Block:
  Detailed Timing Descriptor #3: Mismatch of image size 370x268 mm vs display size 360x250 mm.
  Missing VCDB, needed for Set Selectable RGB Quantization to avoid interop issues.
EDID:
  Base EDID: The DTD max image size is 370x268mm, which is larger than the display size 360.0x250.0mm.

EDID conformity: FAIL
