edid-decode (hex):

00 ff ff ff ff ff ff 00 34 38 d6 07 e2 01 00 00
0a 11 01 03 0e 29 1f 78 2e fd 56 a5 53 4a 9d 24
14 4f 54 bf ef 00 71 4f 81 80 90 40 81 40 61 4c
01 01 01 01 01 01 a8 2f 78 d0 51 1a 27 40 58 90
34 00 9d 37 11 00 00 1e 00 00 00 fd 00 32 4b 1e
53 0e 00 0a 20 20 20 20 20 20 00 00 00 fc 00 42
32 30 32 35 53 31 0a 20 20 20 20 20 00 00 00 fe
00 4d 41 58 44 41 54 41 0a 20 20 20 20 20 00 4f

00 ff ff ff ff ff ff 00 34 38 d6 07 e2 01 00 00
0a 11 01 03 0e 29 1f 78 2e fd 56 a5 53 4a 9d 24
14 4f 54 bf ef 00 71 4f 81 80 90 40 81 40 61 4c
01 01 01 01 01 01 a8 2f 78 d0 51 1a 27 40 58 90
34 00 9d 37 11 00 00 1e 00 00 00 fd 00 32 4b 1e
53 0e 00 0a 20 20 20 20 20 20 00 00 00 fc 00 42
32 30 32 35 53 31 0a 20 20 20 20 20 00 00 00 fe
00 4d 41 58 44 41 54 41 0a 20 20 20 20 20 00 4f

----------------

Block 0, Base EDID:
  EDID Structure Version & Revision: 1.3
  Vendor & Product Identification:
    Manufacturer: MAX
    Model: 2006
    Serial Number: ...
    Made in: week 10 of 2007
  Basic Display Parameters & Features:
    Analog display
    Signal Level Standard: 0.700 : 0.300 : 1.000 V p-p
    Blank level equals black level
    Sync: Separate Composite SyncOnGreen
    Maximum image size: 41 cm x 31 cm
    Gamma: 2.20
    DPMS levels: Off
    RGB color display
    Default (sRGB) color space is primary color space
    First detailed timing is the preferred timing
  Color Characteristics:
    Red  : 0.6474, 0.3271
    Green: 0.2919, 0.6142
    Blue : 0.1416, 0.0791
    White: 0.3095, 0.3300
  Established Timings I & II:
    IBM     :   720x400    70.081663 Hz   9:5     31.467 kHz     28.320000 MHz
    DMT 0x04:   640x480    59.940476 Hz   4:3     31.469 kHz     25.175000 MHz
    Apple   :   640x480    66.666667 Hz   4:3     35.000 kHz     30.240000 MHz
    DMT 0x05:   640x480    72.808802 Hz   4:3     37.861 kHz     31.500000 MHz
    DMT 0x06:   640x480    75.000000 Hz   4:3     37.500 kHz     31.500000 MHz
    DMT 0x08:   800x600    56.250000 Hz   4:3     35.156 kHz     36.000000 MHz
    DMT 0x09:   800x600    60.316541 Hz   4:3     37.879 kHz     40.000000 MHz
    DMT 0x0a:   800x600    72.187572 Hz   4:3     48.077 kHz     50.000000 MHz
    DMT 0x0b:   800x600    75.000000 Hz   4:3     46.875 kHz     49.500000 MHz
    Apple   :   832x624    74.551266 Hz   4:3     49.726 kHz     57.284000 MHz
    DMT 0x10:  1024x768    60.003840 Hz   4:3     48.363 kHz     65.000000 MHz
    DMT 0x11:  1024x768    70.069359 Hz   4:3     56.476 kHz     75.000000 MHz
    DMT 0x12:  1024x768    75.028582 Hz   4:3     60.023 kHz     78.750000 MHz
    DMT 0x24:  1280x1024   75.024675 Hz   5:4     79.976 kHz    135.000000 MHz
  Standard Timings:
    DMT 0x15:  1152x864    75.000000 Hz   4:3     67.500 kHz    108.000000 MHz
    DMT 0x23:  1280x1024   60.019740 Hz   5:4     63.981 kHz    108.000000 MHz
    DMT 0x2a:  1400x1050   59.978442 Hz   4:3     65.317 kHz    121.750000 MHz
    DMT 0x20:  1280x960    60.000000 Hz   4:3     60.000 kHz    108.000000 MHz
    GTF     :  1024x768    72.000073 Hz   4:3     57.672 kHz     78.434000 MHz
  Detailed Timing Descriptors:
    DTD 1:  1400x1050   60.101601 Hz   4:3     65.451 kHz    122.000000 MHz (413 mm x 311 mm)
                 Hfront   88 Hsync 144 Hback  232 Hpol P
                 Vfront    3 Vsync   4 Vback   32 Vpol P
    Display Range Limits:
      Monitor ranges (GTF): 50-75 Hz V, 30-83 kHz H, max dotclock 140 MHz
    Display Product Name: 'B2025S1'
    Alphanumeric Data String: 'MAXDATA'
Checksum: 0x4f

----------------

Failures:

Block 0, Base EDID:
  Basic Display Parameters & Features: sRGB is signaled, but the chromaticities do not match.
EDID:
  Extension Block 1 started with EDID header, ignoring Extension Blocks >= 1.

EDID conformity: FAIL
