edid-decode (hex):

00 ff ff ff ff ff ff 00 68 88 f6 22 01 01 01 01
00 1a 01 03 68 2e 1a 78 2a 0b 75 a2 57 4b 9e 27
0d 50 54 bf ef 80 b3 00 a9 40 95 00 81 c0 81 80
81 40 71 4f 81 00 02 3a 80 18 71 38 2d 40 58 2c
45 00 ca 02 11 00 00 1e 94 43 80 90 72 38 27 40
80 c8 25 00 ca 02 11 00 00 1c 00 00 00 fd 00 37
4c 1e 52 12 00 0a 20 20 20 20 20 20 00 00 00 fc
00 44 48 4c 32 32 2d 46 36 30 30 0a 20 20 00 4a

00 ff ff ff ff ff ff 00 68 88 f6 22 01 01 01 01
00 1a 01 03 68 2e 1a 78 2a 0b 75 a2 57 4b 9e 27
0d 50 54 bf ef 80 b3 00 a9 40 95 00 81 c0 81 80
81 40 71 4f 81 00 02 3a 80 18 71 38 2d 40 58 2c
45 00 ca 02 11 00 00 1e 94 43 80 90 72 38 27 40
80 c8 25 00 ca 02 11 00 00 1c 00 00 00 fd 00 37
4c 1e 52 12 00 0a 20 20 20 20 20 20 00 00 00 fc
00 44 48 4c 32 32 2d 46 36 30 30 0a 20 20 00 4a

----------------

Block 0, Base EDID:
  EDID Structure Version & Revision: 1.3
  Vendor & Product Identification:
    Manufacturer: ZDH
    Model: 8950
    Serial Number: ...
    Made in: 2016
  Basic Display Parameters & Features:
    Analog display
    Signal Level Standard: 0.700 : 0.000 : 0.700 V p-p
    Blank level equals black level
    Sync: Separate
    Maximum image size: 46 cm x 26 cm
    Gamma: 2.20
    DPMS levels: Off
    RGB color display
    First detailed timing is the preferred timing
  Color Characteristics:
    Red  : 0.6328, 0.3398
    Green: 0.2949, 0.6201
    Blue : 0.1533, 0.0537
    White: 0.3134, 0.3291
  Established Timings I & II:
    IBM     :   720x400    70.081663 Hz   9:5     31.467 kHz     28.320000 MHz
    DMT 0x04:   640x480    59.940476 Hz   4:3     31.469 kHz     25.175000 MHz
    Apple   :   640x480    66.666667 Hz   4:3     35.000 kHz     30.240000 MHz
    DMT 0x05:   640x480    72.808802 Hz   4:3     37.861 kHz     31.500000 MHz
    DMT 0x06:   640x480    75.000000 Hz   4:3     37.500 kHz     31.500000 MHz
    DMT 0x08:   800x600    56.250000 Hz   4:3     35.156 kHz     36.000000 MHz
    DMT 0x09:   800x600    60.316541 Hz   4:3     37.879 kHz     40.000000 MHz
    DMT 0x0a:   800x600    72.187572 Hz   4:3     48.077 kHz     50.000000 MHz
    DMT 0x0b:   800x600    75.000000 Hz   4:3     46.875 kHz     49.500000 MHz
    Apple   :   832x624    74.551266 Hz   4:3     49.726 kHz     57.284000 MHz
    DMT 0x10:  1024x768    60.003840 Hz   4:3     48.363 kHz     65.000000 MHz
    DMT 0x11:  1024x768    70.069359 Hz   4:3     56.476 kHz     75.000000 MHz
    DMT 0x12:  1024x768    75.028582 Hz   4:3     60.023 kHz     78.750000 MHz
    DMT 0x24:  1280x1024   75.024675 Hz   5:4     79.976 kHz    135.000000 MHz
    Apple   :  1152x870    75.061550 Hz 192:145   68.681 kHz    100.000000 MHz
  Standard Timings:
    DMT 0x3a:  1680x1050   59.954250 Hz  16:10    65.290 kHz    146.250000 MHz
    DMT 0x33:  1600x1200   60.000000 Hz   4:3     75.000 kHz    162.000000 MHz
    DMT 0x2f:  1440x900    59.887445 Hz  16:10    55.935 kHz    106.500000 MHz
    DMT 0x55:  1280x720    60.000000 Hz  16:9     45.000 kHz     74.250000 MHz
    DMT 0x23:  1280x1024   60.019740 Hz   5:4     63.981 kHz    108.000000 MHz
    DMT 0x20:  1280x960    60.000000 Hz   4:3     60.000 kHz    108.000000 MHz
    DMT 0x15:  1152x864    75.000000 Hz   4:3     67.500 kHz    108.000000 MHz
    DMT 0x1c:  1280x800    59.810326 Hz  16:10    49.702 kHz     83.500000 MHz
  Detailed Timing Descriptors:
    DTD 1:  1920x1080   60.000000 Hz  16:9     67.500 kHz    148.500000 MHz (458 mm x 258 mm)
                 Hfront   88 Hsync  44 Hback  148 Hpol P
                 Vfront    4 Vsync   5 Vback   36 Vpol P
    DTD 2:  1920x1080   60.016430 Hz  16:9     67.158 kHz    173.000000 MHz (458 mm x 258 mm)
                 Hfront  128 Hsync 200 Hback  328 Hpol N
                 Vfront    2 Vsync   5 Vback   32 Vpol P
    Display Range Limits:
      Monitor ranges (GTF): 55-76 Hz V, 30-82 kHz H, max dotclock 180 MHz
    Display Product Name: 'DHL22-F600'
Checksum: 0x4a

----------------

Warnings:

Block 0, Base EDID:
  Vendor & Product Identification: The serial number is one of the known dummy values, it should probably be set to 0.

Failures:

EDID:
  Extension Block 1 started with EDID header, ignoring Extension Blocks >= 1.

EDID conformity: FAIL
