edid-decode (hex):

00 ff ff ff ff ff ff 00 09 e5 22 0b 00 00 00 00
01 20 01 04 b5 22 15 78 03 e7 10 ad 51 41 b3 25
0e 50 54 00 00 00 01 01 01 01 01 01 01 01 01 01
01 01 01 01 01 01 90 e7 00 a0 f0 60 46 90 46 20
35 00 58 d7 10 00 00 1a 00 00 00 fd 00 28 3c 94
94 3b 01 0a 20 20 20 20 20 20 00 00 00 fe 00 42
4f 45 20 4e 4a 0a 20 20 20 20 20 20 00 00 00 fe
00 4e 45 31 36 30 51 41 4d 2d 4e 36 31 0a 01 84

02 03 1d 00 e3 05 80 00 e6 06 05 01 80 80 39 6d
1a 00 00 02 03 28 3c 00 04 80 39 80 39 00 00 00
00 00 00 00 00 00 00 00 00 00 00 00 00 00 00 00
00 00 00 00 00 00 00 00 00 00 00 00 00 00 00 00
00 00 00 00 00 00 00 00 00 00 00 00 00 00 00 00
00 00 00 00 00 00 00 00 00 00 00 00 00 00 00 00
00 00 00 00 00 00 00 00 00 00 00 00 00 00 00 00
00 00 00 00 00 00 00 00 00 00 00 00 00 00 00 e5

00 ff ff ff ff ff ff 00 09 e5 22 0b 00 00 00 00
01 20 01 04 b5 22 15 78 03 e7 10 ad 51 41 b3 25
0e 50 54 00 00 00 01 01 01 01 01 01 01 01 01 01
01 01 01 01 01 01 90 e7 00 a0 f0 60 46 90 46 20
35 00 58 d7 10 00 00 1a 00 00 00 fd 00 28 3c 94
94 3b 01 0a 20 20 20 20 20 20 00 00 00 fe 00 42
4f 45 20 4e 4a 0a 20 20 20 20 20 20 00 00 00 fe
00 4e 45 31 36 30 51 41 4d 2d 4e 36 31 0a 01 84

02 03 1d 00 e3 05 80 00 e6 06 05 01 80 80 39 6d
1a 00 00 02 03 28 3c 00 04 80 39 80 39 00 00 00
00 00 00 00 00 00 00 00 00 00 00 00 00 00 00 00
00 00 00 00 00 00 00 00 00 00 00 00 00 00 00 00
00 00 00 00 00 00 00 00 00 00 00 00 00 00 00 00
00 00 00 00 00 00 00 00 00 00 00 00 00 00 00 00
00 00 00 00 00 00 00 00 00 00 00 00 00 00 00 00
00 00 00 00 00 00 00 00 00 00 00 00 00 00 00 e5

----------------

Block 0, Base EDID:
  EDID Structure Version & Revision: 1.4
  Vendor & Product Identification:
    Manufacturer: BOE
    Model: 2850
    Made in: week 1 of 2022
  Basic Display Parameters & Features:
    Digital display
    Bits per primary color channel: 10
    DisplayPort interface
    Maximum image size: 34 cm x 21 cm
    Gamma: 2.20
    Supported color formats: RGB 4:4:4
    First detailed timing includes the native pixel format and preferred refresh rate
    Display supports continuous frequencies
  Color Characteristics:
    Red  : 0.6787, 0.3183
    Green: 0.2548, 0.7021
    Blue : 0.1445, 0.0556
    White: 0.3125, 0.3281
  Established Timings I & II: none
  Standard Timings: none
  Detailed Timing Descriptors:
    DTD 1:  3840x2400   60.000000 Hz  16:10   148.200 kHz    592.800000 MHz (344 mm x 215 mm)
                 Hfront   70 Hsync  32 Hback   58 Hpol P
                 Vfront    3 Vsync   5 Vback   62 Vpol N
    Display Range Limits:
      Monitor ranges (Range Limits Only): 40-60 Hz V, 148-148 kHz H, max dotclock 590 MHz
    Alphanumeric Data String: 'BOE NJ'
    Alphanumeric Data String: 'NE160QAM-N61'
  Extension blocks: 1
Checksum: 0x84

----------------

Block 1, CTA-861 Extension Block:
  Revision: 3
  Native detailed modes: 0
  Colorimetry Data Block:
    BT2020RGB
  HDR Static Metadata Data Block:
    Electro optical transfer functions:
      Traditional gamma - SDR luminance range
      SMPTE ST2084
    Supported static metadata descriptors:
      Static metadata type 1
    Desired content max luminance: 128 (800.000 cd/m^2)
    Desired content max frame-average luminance: 128 (800.000 cd/m^2)
    Desired content min luminance: 57 (0.400 cd/m^2)
  Vendor-Specific Data Block (AMD), OUI 00-00-1A:
    Version: 2
    Feature Caps: 0x03
    Minimum Refresh Rate: 40 Hz
    Maximum Refresh Rate: 60 Hz
    Flags 1.x: 0x00
    Flags 2.x: 0x04
      ST 2084 (PQ) EOTF Supported
      Linear EOTF (Windows scRGB, 0.0 - 125.0) Supported
      Gamma 2.2 EOTF Supported
      BT.2020 Gamut Supported
    Maximum luminance: 128 (800.000 cd/m^2)
    Minimum luminance: 57 (0.400 cd/m^2)
Checksum: 0xe5  Unused space in Extension Block: 98 bytes

----------------

Block 2, Unknown EDID Extension Block 0x00:
  00 ff ff ff ff ff ff 00 09 e5 22 0b 00 00 00 00 '..........".....'
  01 20 01 04 b5 22 15 78 03 e7 10 ad 51 41 b3 25 '. ...".x....QA.%'
  0e 50 54 00 00 00 01 01 01 01 01 01 01 01 01 01 '.PT.............'
  01 01 01 01 01 01 90 e7 00 a0 f0 60 46 90 46 20 '...........`F.F '
  35 00 58 d7 10 00 00 1a 00 00 00 fd 00 28 3c 94 '5.X..........(<.'
  94 3b 01 0a 20 20 20 20 20 20 00 00 00 fe 00 42 '.;..      .....B'
  4f 45 20 4e 4a 0a 20 20 20 20 20 20 00 00 00 fe 'OE NJ.      ....'
  00 4e 45 31 36 30 51 41 4d 2d 4e 36 31 0a 01 84 '.NE160QAM-N61...'
Checksum: 0x84

----------------

Block 3, CTA-861 Extension Block:
  Revision: 3
  Native detailed modes: 0
  Colorimetry Data Block:
    BT2020RGB
  HDR Static Metadata Data Block:
    Electro optical transfer functions:
      Traditional gamma - SDR luminance range
      SMPTE ST2084
    Supported static metadata descriptors:
      Static metadata type 1
    Desired content max luminance: 128 (800.000 cd/m^2)
    Desired content max frame-average luminance: 128 (800.000 cd/m^2)
    Desired content min luminance: 57 (0.400 cd/m^2)
  Vendor-Specific Data Block (AMD), OUI 00-00-1A:
    Version: 2
    Feature Caps: 0x03
    Minimum Refresh Rate: 40 Hz
    Maximum Refresh Rate: 60 Hz
    Flags 1.x: 0x00
    Flags 2.x: 0x04
      ST 2084 (PQ) EOTF Supported
      Linear EOTF (Windows scRGB, 0.0 - 125.0) Supported
      Gamma 2.2 EOTF Supported
      BT.2020 Gamut Supported
    Maximum luminance: 128 (800.000 cd/m^2)
    Minimum luminance: 57 (0.400 cd/m^2)
Checksum: 0xe5  Unused space in Extension Block: 98 bytes

----------------

Warnings:

Block 0, Base EDID:
  Missing Display Product Name.
Block 1, CTA-861 Extension Block:
  IT Video Formats are overscanned by default, but normally this should be underscanned.
  Colorimetry Data Block: Set the sRGB colorimetry bit to avoid interop issues.
Block 3, CTA-861 Extension Block:
  IT Video Formats are overscanned by default, but normally this should be underscanned.
  Colorimetry Data Block: Set the sRGB colorimetry bit to avoid interop issues.
EDID:
  Base EDID: Some timings are out of range of the Monitor Ranges:
    Maximum Clock: 592.800 MHz (Monitor: 590.000 MHz)
    Could be due to a Monitor Range off-by-one rounding issue

Failures:

Block 1, CTA-861 Extension Block:
  Required 640x480p60 timings are missing in the established timings and the SVD list (VIC 1).
  Missing VCDB, needed for Set Selectable RGB Quantization to avoid interop issues.
Block 2, Base EDID:
  Unknown Extension Block.
Block 3, CTA-861 Extension Block:
  Colorimetry Data Block: Only one instance of this Data Block is allowed.
  HDR Static Metadata Data Block: Only one instance of this Data Block is allowed.
EDID:
  Base EDID: EDID specified 1 extension block(s), but found 3 extension block(s).

EDID conformity: FAIL
