edid-decode (hex):

00 ff ff ff ff ff ff 00 09 e5 54 07 00 00 00 00
01 1b 01 04 95 1a 0e 78 0a dd c0 96 59 59 9a 29
1f 50 54 00 00 00 01 01 01 01 01 01 01 01 01 01
01 01 01 01 01 01 6b 1b 56 64 50 00 1e 30 26 16
44 00 00 90 10 00 00 1a 00 00 00 00 00 00 00 00
00 00 00 00 00 00 00 00 00 00 00 00 00 fe 00 42
4f 45 20 48 46 0a 20 20 20 20 20 20 00 00 00 fe
00 4e 56 31 31 36 57 48 4d 2d 4e 34 35 0a 00 6a

00 ff ff ff ff ff ff 00 09 e5 54 07 00 00 00 00
01 1b 01 04 95 1a 0e 78 0a dd c0 96 59 59 9a 29
1f 50 54 00 00 00 01 01 01 01 01 01 01 01 01 01
01 01 01 01 01 01 6b 1b 56 64 50 00 1e 30 26 16
44 00 00 90 10 00 00 1a 00 00 00 00 00 00 00 00
00 00 00 00 00 00 00 00 00 00 00 00 00 fe 00 42
4f 45 20 48 46 0a 20 20 20 20 20 20 00 00 00 fe
00 4e 56 31 31 36 57 48 4d 2d 4e 34 35 0a 00 6a

----------------

Block 0, Base EDID:
  EDID Structure Version & Revision: 1.4
  Vendor & Product Identification:
    Manufacturer: BOE
    Model: 1876
    Made in: week 1 of 2017
  Basic Display Parameters & Features:
    Digital display
    Bits per primary color channel: 6
    DisplayPort interface
    Maximum image size: 26 cm x 14 cm
    Gamma: 2.20
    Supported color formats: RGB 4:4:4, YCrCb 4:4:4
    First detailed timing includes the native pixel format and preferred refresh rate
  Color Characteristics:
    Red  : 0.5888, 0.3486
    Green: 0.3505, 0.6025
    Blue : 0.1630, 0.1210
    White: 0.3125, 0.3281
  Established Timings I & II: none
  Standard Timings: none
  Detailed Timing Descriptors:
    DTD 1:  1366x768    59.998222 Hz 683:384   47.879 kHz     70.190000 MHz (256 mm x 144 mm)
                 Hfront   38 Hsync  22 Hback   40 Hpol P
                 Vfront    4 Vsync   4 Vback   22 Vpol N
    Empty Descriptor
    Alphanumeric Data String: 'BOE HF'
    Alphanumeric Data String: 'NV116WHM-N45'
Checksum: 0x6a

----------------

Warnings:

Block 0, Base EDID:
  Missing Display Product Name.

Failures:

Block 0, Base EDID:
  Empty Descriptor: Use Dummy Descriptor instead of all zeroes.
EDID:
  Extension Block 1 started with EDID header, ignoring Extension Blocks >= 1.

EDID conformity: FAIL
