edid-decode (hex):

00 ff ff ff ff ff ff 00 15 93 50 03 01 00 00 00
27 20 01 04 b5 52 23 78 3b 8e 05 ad 4f 33 b0 26
0d 50 54 a5 cb 00 81 c0 81 80 01 01 01 01 01 01
d1 c0 01 01 01 01 f5 7c 70 a0 d0 a0 29 50 30 20
35 00 33 59 31 00 00 1a 00 00 00 ff 00 30 30 30
30 30 30 30 30 30 30 30 30 31 00 00 00 fd 00 30
78 a0 a0 41 01 0a 20 20 20 20 20 20 00 00 00 fc
00 33 34 47 31 0a 20 20 20 20 20 20 20 20 01 3e

02 03 17 f4 23 09 07 07 83 01 00 00 e3 05 e3 01
e6 06 07 01 60 50 02 02 3a 80 18 71 38 2d 40 58
2c 96 00 56 50 21 00 00 18 41 d1 70 a0 d0 a0 30
50 5f 2e 45 00 55 50 21 00 00 1e 98 fa 70 a0 d0
a0 2d 50 58 44 45 00 00 00 00 00 00 1e 11 68 70
a0 d0 a0 28 50 30 2c 45 00 00 00 00 00 00 1e 00
00 00 00 00 00 00 00 00 00 00 00 00 00 00 00 00
00 00 00 00 00 00 00 00 00 00 00 00 00 00 00 57

00 ff ff ff ff ff ff 00 15 93 50 03 01 00 00 00
27 20 01 04 b5 52 23 78 3b 8e 05 ad 4f 33 b0 26
0d 50 54 a5 cb 00 81 c0 81 80 01 01 01 01 01 01
d1 c0 01 01 01 01 f5 7c 70 a0 d0 a0 29 50 30 20
35 00 33 59 31 00 00 1a 00 00 00 ff 00 30 30 30
30 30 30 30 30 30 30 30 30 31 00 00 00 fd 00 30
78 a0 a0 41 01 0a 20 20 20 20 20 20 00 00 00 fc
00 33 34 47 31 0a 20 20 20 20 20 20 20 20 01 3e

02 03 17 f4 23 09 07 07 83 01 00 00 e3 05 e3 01
e6 06 07 01 60 50 02 02 3a 80 18 71 38 2d 40 58
2c 96 00 56 50 21 00 00 18 41 d1 70 a0 d0 a0 30
50 5f 2e 45 00 55 50 21 00 00 1e 98 fa 70 a0 d0
a0 2d 50 58 44 45 00 00 00 00 00 00 1e 11 68 70
a0 d0 a0 28 50 30 2c 45 00 00 00 00 00 00 1e 00
00 00 00 00 00 00 00 00 00 00 00 00 00 00 00 00
00 00 00 00 00 00 00 00 00 00 00 00 00 00 00 57

----------------

Block 0, Base EDID:
  EDID Structure Version & Revision: 1.4
  Vendor & Product Identification:
    Manufacturer: ELS
    Model: 848
    Serial Number: ...
    Made in: week 39 of 2022
  Basic Display Parameters & Features:
    Digital display
    Bits per primary color channel: 10
    DisplayPort interface
    Maximum image size: 82 cm x 35 cm
    Gamma: 2.20
    DPMS levels: Off
    Supported color formats: RGB 4:4:4, YCrCb 4:4:4, YCrCb 4:2:2
    First detailed timing includes the native pixel format and preferred refresh rate
    Display supports continuous frequencies
  Color Characteristics:
    Red  : 0.6777, 0.3085
    Green: 0.2021, 0.6894
    Blue : 0.1484, 0.0507
    White: 0.3134, 0.3291
  Established Timings I & II:
    IBM     :   720x400    70.081663 Hz   9:5     31.467 kHz     28.320000 MHz
    DMT 0x04:   640x480    59.940476 Hz   4:3     31.469 kHz     25.175000 MHz
    DMT 0x06:   640x480    75.000000 Hz   4:3     37.500 kHz     31.500000 MHz
    DMT 0x09:   800x600    60.316541 Hz   4:3     37.879 kHz     40.000000 MHz
    DMT 0x0a:   800x600    72.187572 Hz   4:3     48.077 kHz     50.000000 MHz
    DMT 0x0b:   800x600    75.000000 Hz   4:3     46.875 kHz     49.500000 MHz
    DMT 0x10:  1024x768    60.003840 Hz   4:3     48.363 kHz     65.000000 MHz
    DMT 0x12:  1024x768    75.028582 Hz   4:3     60.023 kHz     78.750000 MHz
    DMT 0x24:  1280x1024   75.024675 Hz   5:4     79.976 kHz    135.000000 MHz
  Standard Timings:
    DMT 0x55:  1280x720    60.000000 Hz  16:9     45.000 kHz     74.250000 MHz
    DMT 0x23:  1280x1024   60.019740 Hz   5:4     63.981 kHz    108.000000 MHz
    DMT 0x52:  1920x1080   60.000000 Hz  16:9     67.500 kHz    148.500000 MHz
  Detailed Timing Descriptors:
    DTD 1:  3440x1440   59.998875 Hz  43:18    88.858 kHz    319.890000 MHz (819 mm x 345 mm)
                 Hfront   48 Hsync  32 Hback   80 Hpol P
                 Vfront    3 Vsync   5 Vback   33 Vpol N
    Display Product Serial Number: ...
    Display Range Limits:
      Monitor ranges (Range Limits Only): 48-120 Hz V, 160-160 kHz H, max dotclock 650 MHz
    Display Product Name: '34G1'
  Extension blocks: 1
Checksum: 0x3e

----------------

Block 1, CTA-861 Extension Block:
  Revision: 3
  Underscans IT Video Formats by default
  Basic audio support
  Supports YCbCr 4:4:4
  Supports YCbCr 4:2:2
  Native DTDs: 4
  Audio Data Block:
    Linear PCM:
      Max channels: 2
      Supported sample rates (kHz): 48 44.1 32
      Supported sample sizes (bits): 24 20 16
  Speaker Allocation Data Block:
    FL/FR - Front Left/Right
  Colorimetry Data Block:
    xvYCC601
    xvYCC709
    BT2020cYCC
    BT2020YCC
    BT2020RGB
    Gamut Boundary Description Metadata Profile P0
  HDR Static Metadata Data Block:
    Electro optical transfer functions:
      Traditional gamma - SDR luminance range
      Traditional gamma - HDR luminance range
      SMPTE ST2084
    Supported static metadata descriptors:
      Static metadata type 1
    Desired content max luminance: 96 (400.000 cd/m^2)
    Desired content max frame-average luminance: 80 (282.843 cd/m^2)
    Desired content min luminance: 2 (0.000 cd/m^2)
  Detailed Timing Descriptors:
    DTD 2:  1920x1080   60.000000 Hz  16:9     67.500 kHz    148.500000 MHz (598 mm x 336 mm)
                 Hfront   88 Hsync  44 Hback  148 Hpol N
                 Vfront    9 Vsync   6 Vback   30 Vpol N
    DTD 3:  3440x1440  100.001867 Hz  43:18   148.803 kHz    535.690000 MHz (597 mm x 336 mm)
                 Hfront   95 Hsync  46 Hback   19 Hpol P
                 Vfront    4 Vsync   5 Vback   39 Vpol P
    DTD 4:  3440x1440  120.000000 Hz  43:18   178.200 kHz    641.520000 MHz
                 Hfront   88 Hsync  68 Hback    4 Hpol P
                 Vfront    4 Vsync   5 Vback   36 Vpol P
    DTD 5:  3440x1440   50.001877 Hz  43:18    74.003 kHz    266.410000 MHz
                 Hfront   48 Hsync  44 Hback   68 Hpol P
                 Vfront    4 Vsync   5 Vback   31 Vpol P
Checksum: 0x57  Unused space in Extension Block: 32 bytes

----------------

Warnings:

Block 0, Base EDID:
  Vendor & Product Identification: The serial number is one of the known dummy values, it should probably be set to 0.
  Display Product Serial Number: ...
Block 1, CTA-861 Extension Block:
  Colorimetry Data Block: Set the sRGB colorimetry bit to avoid interop issues.
  Detailed Timing Descriptor #2: DTD is similar but not identical to VIC 16.
  Detailed Timing Descriptor #3: Image size is 597x336 mm, but based on the picture AR it should be 597x249 mm.
  Display Product Serial Number is set, so the Serial Number in the Base EDID should be 0.
EDID:
  Base EDID: Some timings are out of range of the Monitor Ranges:
    Horizontal Freq: 31.466 - 178.200 kHz (Monitor: 160.000 - 160.000 kHz)

Failures:

Block 1, CTA-861 Extension Block:
  Detailed Timing Descriptor #2: Mismatch of image size 598x336 mm vs display size 820x350 mm.
  Detailed Timing Descriptor #3: Mismatch of image size 597x336 mm vs display size 820x350 mm.
  Detailed Timing Descriptor #4: Mismatch of image size vs display size: image size is not set, but display size is.
  Detailed Timing Descriptor #5: Mismatch of image size vs display size: image size is not set, but display size is.
  Missing VCDB, needed for Set Selectable RGB Quantization to avoid interop issues.
EDID:
  Extension Block 2 started with EDID header, ignoring Extension Blocks >= 2.
  CTA-861: Native progressive timings are a mix of several resolutions.

EDID conformity: FAIL
