edid-decode (hex):

00 ff ff ff ff ff ff 00 06 83 21 33 00 00 00 00
1e 1c 01 03 81 30 1b 78 aa 3d 85 a6 56 4a 9a 24
b5 50 54 af cf 00 71 40 71 4f 81 40 81 80 81 c0
81 00 01 01 01 01 02 3a 80 18 71 38 2d 40 58 2c
45 00 dd 0c 11 00 00 1e 00 00 00 fd 00 32 4b 1e
52 0e 00 0a 20 20 20 20 20 20 00 00 00 fa 00 81
8f 8b c0 95 00 a9 00 b3 00 d1 c0 0a 00 00 00 fc
00 4c 44 41 2d 33 32 31 57 20 48 44 4d 49 01 cf

02 03 22 f1 4f 01 02 03 04 05 06 07 90 11 12 13
14 15 16 1f 23 09 7f 07 83 01 00 00 64 03 0c 00
10 00 01 1d 00 72 51 d0 1e 20 6e 28 55 00 c4 8e
21 00 00 1e 01 1d 80 18 71 1c 16 20 58 2c 22 00
c4 8e 21 00 00 9e 8c 0a a0 14 51 f0 16 00 26 7c
43 00 13 8e 21 00 00 98 8c 0a d0 8a 20 e0 2d 10
10 3e 96 00 13 8e 21 00 00 18 02 3a 80 18 71 38
2d 40 58 2c 45 00 c4 8e 21 00 00 1e 00 00 00 f6

00 ff ff ff ff ff ff 00 06 83 21 33 00 00 00 00
1e 1c 01 03 81 30 1b 78 aa 3d 85 a6 56 4a 9a 24
b5 50 54 af cf 00 71 40 71 4f 81 40 81 80 81 c0
81 00 01 01 01 01 02 3a 80 18 71 38 2d 40 58 2c
45 00 dd 0c 11 00 00 1e 00 00 00 fd 00 32 4b 1e
52 0e 00 0a 20 20 20 20 20 20 00 00 00 fa 00 81
8f 8b c0 95 00 a9 00 b3 00 d1 c0 0a 00 00 00 fc
00 4c 44 41 2d 33 32 31 57 20 48 44 4d 49 01 cf

02 03 22 f1 4f 01 02 03 04 05 06 07 90 11 12 13
14 15 16 1f 23 09 7f 07 83 01 00 00 64 03 0c 00
10 00 01 1d 00 72 51 d0 1e 20 6e 28 55 00 c4 8e
21 00 00 1e 01 1d 80 18 71 1c 16 20 58 2c 22 00
c4 8e 21 00 00 9e 8c 0a a0 14 51 f0 16 00 26 7c
43 00 13 8e 21 00 00 98 8c 0a d0 8a 20 e0 2d 10
10 3e 96 00 13 8e 21 00 00 18 02 3a 80 18 71 38
2d 40 58 2c 45 00 c4 8e 21 00 00 1e 00 00 00 f6

----------------

Block 0, Base EDID:
  EDID Structure Version & Revision: 1.3
  Vendor & Product Identification:
    Manufacturer: ATC
    Model: 13089
    Made in: week 30 of 2018
  Basic Display Parameters & Features:
    Digital display
    DFP 1.x compatible TMDS
    Maximum image size: 48 cm x 27 cm
    Gamma: 2.20
    DPMS levels: Standby Off
    RGB color display
    First detailed timing is the preferred timing
  Color Characteristics:
    Red  : 0.6484, 0.3388
    Green: 0.2919, 0.6025
    Blue : 0.1425, 0.7070
    White: 0.3134, 0.3291
  Established Timings I & II:
    IBM     :   720x400    70.081663 Hz   9:5     31.467 kHz     28.320000 MHz
    DMT 0x04:   640x480    59.940476 Hz   4:3     31.469 kHz     25.175000 MHz
    DMT 0x05:   640x480    72.808802 Hz   4:3     37.861 kHz     31.500000 MHz
    DMT 0x06:   640x480    75.000000 Hz   4:3     37.500 kHz     31.500000 MHz
    DMT 0x08:   800x600    56.250000 Hz   4:3     35.156 kHz     36.000000 MHz
    DMT 0x09:   800x600    60.316541 Hz   4:3     37.879 kHz     40.000000 MHz
    DMT 0x0a:   800x600    72.187572 Hz   4:3     48.077 kHz     50.000000 MHz
    DMT 0x0b:   800x600    75.000000 Hz   4:3     46.875 kHz     49.500000 MHz
    DMT 0x10:  1024x768    60.003840 Hz   4:3     48.363 kHz     65.000000 MHz
    DMT 0x11:  1024x768    70.069359 Hz   4:3     56.476 kHz     75.000000 MHz
    DMT 0x12:  1024x768    75.028582 Hz   4:3     60.023 kHz     78.750000 MHz
    DMT 0x24:  1280x1024   75.024675 Hz   5:4     79.976 kHz    135.000000 MHz
  Standard Timings:
    GTF     :  1152x864    60.000000 Hz   4:3     53.700 kHz     81.624000 MHz
    DMT 0x15:  1152x864    75.000000 Hz   4:3     67.500 kHz    108.000000 MHz
    DMT 0x20:  1280x960    60.000000 Hz   4:3     60.000 kHz    108.000000 MHz
    DMT 0x23:  1280x1024   60.019740 Hz   5:4     63.981 kHz    108.000000 MHz
    DMT 0x55:  1280x720    60.000000 Hz  16:9     45.000 kHz     74.250000 MHz
    DMT 0x1c:  1280x800    59.810326 Hz  16:10    49.702 kHz     83.500000 MHz
  Detailed Timing Descriptors:
    DTD 1:  1920x1080   60.000000 Hz  16:9     67.500 kHz    148.500000 MHz (477 mm x 268 mm)
                 Hfront   88 Hsync  44 Hback  148 Hpol P
                 Vfront    4 Vsync   5 Vback   36 Vpol P
    Display Range Limits:
      Monitor ranges (GTF): 50-75 Hz V, 30-82 kHz H, max dotclock 140 MHz
    Standard Timing Identifications:
      DMT 0x24:  1280x1024   75.024675 Hz   5:4     79.976 kHz    135.000000 MHz
      GTF     :  1360x765    60.000341 Hz  16:9     47.520 kHz     84.396000 MHz
      DMT 0x2f:  1440x900    59.887445 Hz  16:10    55.935 kHz    106.500000 MHz
      GTF     :  1600x1000   59.999820 Hz  16:10    62.100 kHz    133.142000 MHz
      DMT 0x3a:  1680x1050   59.954250 Hz  16:10    65.290 kHz    146.250000 MHz
      DMT 0x52:  1920x1080   60.000000 Hz  16:9     67.500 kHz    148.500000 MHz
    Display Product Name: 'LDA-321W HDMI'
  Extension blocks: 1
Checksum: 0xcf

----------------

Block 1, CTA-861 Extension Block:
  Revision: 3
  Underscans IT Video Formats by default
  Basic audio support
  Supports YCbCr 4:4:4
  Supports YCbCr 4:2:2
  Native DTDs: 1
  Video Data Block:
    VIC   1:   640x480    59.940476 Hz   4:3     31.469 kHz     25.175000 MHz
    VIC   2:   720x480    59.940060 Hz   4:3     31.469 kHz     27.000000 MHz
    VIC   3:   720x480    59.940060 Hz  16:9     31.469 kHz     27.000000 MHz
    VIC   4:  1280x720    60.000000 Hz  16:9     45.000 kHz     74.250000 MHz
    VIC   5:  1920x1080i  60.000000 Hz  16:9     33.750 kHz     74.250000 MHz
    VIC   6:  1440x480i   59.940060 Hz   4:3     15.734 kHz     27.000000 MHz
    VIC   7:  1440x480i   59.940060 Hz  16:9     15.734 kHz     27.000000 MHz
    VIC  16:  1920x1080   60.000000 Hz  16:9     67.500 kHz    148.500000 MHz (native)
    VIC  17:   720x576    50.000000 Hz   4:3     31.250 kHz     27.000000 MHz
    VIC  18:   720x576    50.000000 Hz  16:9     31.250 kHz     27.000000 MHz
    VIC  19:  1280x720    50.000000 Hz  16:9     37.500 kHz     74.250000 MHz
    VIC  20:  1920x1080i  50.000000 Hz  16:9     28.125 kHz     74.250000 MHz
    VIC  21:  1440x576i   50.000000 Hz   4:3     15.625 kHz     27.000000 MHz
    VIC  22:  1440x576i   50.000000 Hz  16:9     15.625 kHz     27.000000 MHz
    VIC  31:  1920x1080   50.000000 Hz  16:9     56.250 kHz    148.500000 MHz
  Audio Data Block:
    Linear PCM:
      Max channels: 2
      Supported sample rates (kHz): 192 176.4 96 88.2 48 44.1 32
      Supported sample sizes (bits): 24 20 16
  Speaker Allocation Data Block:
    FL/FR - Front Left/Right
  Vendor-Specific Data Block (HDMI), OUI 00-0C-03:
    Source physical address: 1.0.0.0
  Unknown CTA-861 Data Block (tag 0x00, length 0):
  Detailed Timing Descriptors:
    DTD 2:  1280x720    60.000000 Hz  16:9     45.000 kHz     74.250000 MHz (708 mm x 398 mm)
                 Hfront  110 Hsync  40 Hback  220 Hpol P
                 Vfront    5 Vsync   5 Vback   20 Vpol P
    DTD 3:  1920x1080i  60.000000 Hz  16:9     33.750 kHz     74.250000 MHz (708 mm x 398 mm)
                 Hfront   88 Hsync  44 Hback  148 Hpol P
                 Vfront    2 Vsync   2 Vback   18 Vpol P Vfront +0.5 Odd Field
                 Vfront    2 Vsync   2 Vback   18 Vpol P Vback  +0.5 Even Field
    DTD 4:  1440x480i   59.940060 Hz   3:1     15.734 kHz     27.000000 MHz (531 mm x 398 mm)
                 Hfront   38 Hsync 124 Hback  114 Hpol N
                 Vfront    4 Vsync   3 Vback   15 Vpol N Vfront +0.5 Odd Field
                 Vfront    4 Vsync   3 Vback   15 Vpol N Vback  +0.5 Even Field
    DTD 5:   720x480    59.940060 Hz   3:2     31.469 kHz     27.000000 MHz (531 mm x 398 mm)
                 Hfront   16 Hsync  62 Hback   60 Hpol N
                 Vfront    9 Vsync   6 Vback   30 Vpol N
    DTD 6:  1920x1080   60.000000 Hz  16:9     67.500 kHz    148.500000 MHz (708 mm x 398 mm)
                 Hfront   88 Hsync  44 Hback  148 Hpol P
                 Vfront    4 Vsync   5 Vback   36 Vpol P
Checksum: 0xf6  Unused space in Extension Block: 3 bytes

----------------

Warnings:

Block 0, Base EDID:
  Standard Timing Identifications: Standard Timing 1360x765 has a dubious odd vertical resolution.
Block 1, CTA-861 Extension Block:
  Video Data Block: VIC 1 and the first DTD are not identical. Is this intended?
  Video Data Block: All VICs are in ascending order, and the first (preferred) VIC <= 4, is that intended?
  Unknown CTA-861 Data Block (tag 0x00, length 0).
  Detailed Timing Descriptor #3: DTD is similar but not identical to VIC 5.
  Detailed Timing Descriptor #4: Image size is 531x398 mm, but based on the picture AR it should be 531x177 mm.
  Detailed Timing Descriptor #5: Image size is 531x398 mm, but based on the picture AR it should be 531x354 mm.
  Add a Colorimetry Data Block with the sRGB colorimetry bit set to avoid interop issues.
EDID:
  Base EDID: Some timings are out of range of the Monitor Ranges:
    Horizontal Freq: 15.625 - 79.976 kHz (Monitor: 30.000 - 82.000 kHz)
    Maximum Clock: 148.500 MHz (Monitor: 140.000 MHz)

Failures:

Block 1, CTA-861 Extension Block:
  Detailed Timing Descriptor #2: Mismatch of image size 708x398 mm vs display size 480x270 mm.
  Detailed Timing Descriptor #3: Mismatch of image size 708x398 mm vs display size 480x270 mm.
  Detailed Timing Descriptor #4: Mismatch of image size 531x398 mm vs display size 480x270 mm.
  Detailed Timing Descriptor #5: Mismatch of image size 531x398 mm vs display size 480x270 mm.
  Detailed Timing Descriptor #6: Mismatch of image size 708x398 mm vs display size 480x270 mm.
  Missing VCDB, needed for Set Selectable RGB Quantization to avoid interop issues.
EDID:
  Extension Block 2 started with EDID header, ignoring Extension Blocks >= 2.
  Base EDID: The DTD max image size is 708x398mm, which is larger than the display size 480.0x270.0mm.

EDID conformity: FAIL
