edid-decode (hex):

00 ff ff ff ff ff ff 00 22 64 50 04 00 00 00 00
1e 19 01 01 80 1a 0e 78 0a c3 a2 9e 55 48 88 25
21 4d 53 00 00 00 01 01 01 01 01 01 01 01 01 01
01 01 01 01 01 01 12 1b 56 5a 50 00 19 30 1e 0e
66 00 04 8c 10 00 00 19 00 00 00 fe 00 00 20 20
20 20 20 20 20 20 20 20 20 20 00 00 00 fc 00 48
53 44 31 31 36 50 48 57 32 41 0a 20 00 00 00 fe
00 00 00 00 00 00 00 00 00 00 00 00 00 00 00 6f

----------------

Block 0, Base EDID:
  EDID Structure Version & Revision: 1.1
  Vendor & Product Identification:
    Manufacturer: HSD
    Model: 1104
    Made in: week 30 of 2015
  Basic Display Parameters & Features:
    Digital display
    Maximum image size: 26 cm x 14 cm
    Gamma: 2.20
    RGB color display
    First detailed timing is the preferred timing
  Color Characteristics:
    Red  : 0.6201, 0.3320
    Green: 0.2812, 0.5341
    Blue : 0.1464, 0.1308
    White: 0.3007, 0.3261
  Established Timings I & II: none
  Standard Timings: none
  Detailed Timing Descriptors:
    DTD 1:  1366x768    60.020371 Hz 683:384   47.596 kHz     69.300000 MHz (260 mm x 140 mm)
                 Hfront   30 Hsync  14 Hback   46 Hpol N
                 Vfront    6 Vsync   6 Vback   13 Vpol N
    Alphanumeric Data String: ''
    Display Product Name: 'HSD116PHW2A'
    Alphanumeric Data String: ''
Checksum: 0x6f

----------------

Warnings:

Block 0, Base EDID:
  EDID Structure Version & Revision: EDID 1.1 is deprecated, do not use.

Failures:

Block 0, Base EDID:
  Alphanumeric Data String: NUL byte at position 0.
  Alphanumeric Data String: NUL byte at position 0.

EDID conformity: FAIL
