edid-decode (hex):

00 ff ff ff ff ff ff 00 09 e5 39 0d 00 00 00 00
1d 22 01 04 a5 22 13 78 03 64 b5 95 56 59 92 28
1f 50 54 00 00 00 01 01 01 01 01 01 01 01 01 01
01 01 01 01 01 01 87 39 80 a0 70 38 64 40 30 20
35 00 58 c2 10 00 00 1a 00 00 00 fd 00 30 a5 c3
c3 29 01 0a 20 20 20 20 20 20 00 00 00 fe 00 4e
45 31 35 36 46 48 4d 2d 4e 58 41 0a 00 00 00 00
00 00 00 00 00 00 00 00 00 00 00 00 00 00 01 e7

70 20 79 02 00 22 00 14 ef 2d 06 84 7f 07 9f 00
2f 00 1f 00 37 04 63 00 02 00 04 00 81 00 13 72
1a 00 00 03 01 30 a5 00 00 53 4a 53 4a a5 00 00
00 00 00 00 00 00 00 00 00 00 00 00 00 00 00 00
00 00 00 00 00 00 00 00 00 00 00 00 00 00 00 00
00 00 00 00 00 00 00 00 00 00 00 00 00 00 00 00
00 00 00 00 00 00 00 00 00 00 00 00 00 00 00 00
00 00 00 00 00 00 00 00 00 00 00 00 00 00 9a 90

00 ff ff ff ff ff ff 00 09 e5 39 0d 00 00 00 00
1d 22 01 04 a5 22 13 78 03 64 b5 95 56 59 92 28
1f 50 54 00 00 00 01 01 01 01 01 01 01 01 01 01
01 01 01 01 01 01 87 39 80 a0 70 38 64 40 30 20
35 00 58 c2 10 00 00 1a 00 00 00 fd 00 30 a5 c3
c3 29 01 0a 20 20 20 20 20 20 00 00 00 fe 00 4e
45 31 35 36 46 48 4d 2d 4e 58 41 0a 00 00 00 00
00 00 00 00 00 00 00 00 00 00 00 00 00 00 01 e7

70 20 79 02 00 22 00 14 ef 2d 06 84 7f 07 9f 00
2f 00 1f 00 37 04 63 00 02 00 04 00 81 00 13 72
1a 00 00 03 01 30 a5 00 00 53 4a 53 4a a5 00 00
00 00 00 00 00 00 00 00 00 00 00 00 00 00 00 00
00 00 00 00 00 00 00 00 00 00 00 00 00 00 00 00
00 00 00 00 00 00 00 00 00 00 00 00 00 00 00 00
00 00 00 00 00 00 00 00 00 00 00 00 00 00 00 00
00 00 00 00 00 00 00 00 00 00 00 00 00 00 9a 90

----------------

Block 0, Base EDID:
  EDID Structure Version & Revision: 1.4
  Vendor & Product Identification:
    Manufacturer: BOE
    Model: 3385
    Made in: week 29 of 2024
  Basic Display Parameters & Features:
    Digital display
    Bits per primary color channel: 8
    DisplayPort interface
    Maximum image size: 34 cm x 19 cm
    Gamma: 2.20
    Supported color formats: RGB 4:4:4
    First detailed timing includes the native pixel format and preferred refresh rate
    Display supports continuous frequencies
  Color Characteristics:
    Red  : 0.5830, 0.3378
    Green: 0.3486, 0.5703
    Blue : 0.1582, 0.1240
    White: 0.3134, 0.3291
  Established Timings I & II: none
  Standard Timings: none
  Detailed Timing Descriptors:
    DTD 1:  1920x1080   60.002445 Hz  16:9     70.803 kHz    147.270000 MHz (344 mm x 194 mm)
                 Hfront   48 Hsync  32 Hback   80 Hpol P
                 Vfront    3 Vsync   5 Vback   92 Vpol N
    Display Range Limits:
      Monitor ranges (Range Limits Only): 48-165 Hz V, 195-195 kHz H, max dotclock 410 MHz
    Alphanumeric Data String: 'NE156FHM-NXA'
    Empty Descriptor
  Extension blocks: 1
Checksum: 0xe7

----------------

Block 1, DisplayID Extension Block:
  Version: 2.0
  Extension Count: 0
  Display Product Primary Use Case: None of the listed primary use cases; generic display
  Video Timing Modes Type 7 - Detailed Timings Data Block:
    DTD:  1920x1080  165.000000 Hz  16:9    194.700 kHz    404.976000 MHz (aspect 16:9, no 3D stereo, preferred)
               Hfront   48 Hsync  32 Hback   80 Hpol N
               Vfront    3 Vsync   5 Vback   92 Vpol N
  CTA-861 DisplayID Data Block:
  Vendor-Specific Data Block (AMD), OUI 00-00-1A:
    Version: 3
    Feature Caps: 0x01
    Minimum Refresh Rate: 48 Hz
    Maximum Refresh Rate: 165 Hz
    Flags 1.x: 0x00
    Flags 2.x: 0x00
  Checksum: 0x9a
Checksum: 0x90

----------------

Warnings:

Block 0, Base EDID:
  Missing Display Product Name.
EDID:
  Base EDID: Some timings are out of range of the Monitor Ranges:
    Horizontal Freq: 70.802 - 194.700 kHz (Monitor: 195.000 - 195.000 kHz)

Failures:

Block 0, Base EDID:
  Empty Descriptor: Use Dummy Descriptor instead of all zeroes.
EDID:
  Extension Block 2 started with EDID header, ignoring Extension Blocks >= 2.
  DisplayID: Missing DisplayID Display Parameters Data Block.

EDID conformity: FAIL
