edid-decode (hex):

00 ff ff ff ff ff ff 00 30 ae c1 66 01 01 01 01
2a 1f 01 03 80 3c 22 78 2a 1f d5 a6 52 4d 98 24
0f 50 54 bf cf 00 d1 c0 d1 00 b3 00 a9 c0 95 00
81 80 81 c0 81 00 56 5e 00 a0 a0 a0 29 50 30 20
35 00 55 50 21 00 00 1a 00 00 00 ff 00 55 42 50
30 48 32 57 4b 0a 20 20 20 20 00 00 00 fd 00 30
4b 0f 6e 1f 00 0a 20 20 20 20 20 20 00 00 00 fc
00 51 32 37 71 2d 31 4c 0a 20 20 20 20 20 01 9c

02 03 29 f0 4b 10 05 04 03 02 1f 14 13 12 11 01
23 09 07 07 83 01 00 00 67 03 0c 00 10 00 38 3e
68 1a 00 00 01 01 30 4b 00 7b 75 00 80 a0 a0 34
50 42 20 68 00 55 50 21 00 00 1a 66 21 56 aa 51
00 1e 30 46 8f 33 00 55 50 21 00 00 1e ab 22 a0
a0 50 84 1a 30 30 20 36 00 55 50 21 00 00 1a 7c
2e 90 a0 60 1a 1e 40 30 20 36 00 55 50 21 00 00
1a 00 00 00 00 00 00 00 00 00 00 00 00 00 00 bd

00 ff ff ff ff ff ff 00 30 ae c1 66 01 01 01 01
2a 1f 01 03 80 3c 22 78 2a 1f d5 a6 52 4d 98 24
0f 50 54 bf cf 00 d1 c0 d1 00 b3 00 a9 c0 95 00
81 80 81 c0 81 00 56 5e 00 a0 a0 a0 29 50 30 20
35 00 55 50 21 00 00 1a 00 00 00 ff 00 55 42 50
30 48 32 57 4b 0a 20 20 20 20 00 00 00 fd 00 30
4b 0f 6e 1f 00 0a 20 20 20 20 20 20 00 00 00 fc
00 51 32 37 71 2d 31 4c 0a 20 20 20 20 20 01 9c

02 03 29 f0 4b 10 05 04 03 02 1f 14 13 12 11 01
23 09 07 07 83 01 00 00 67 03 0c 00 10 00 38 3e
68 1a 00 00 01 01 30 4b 00 7b 75 00 80 a0 a0 34
50 42 20 68 00 55 50 21 00 00 1a 66 21 56 aa 51
00 1e 30 46 8f 33 00 55 50 21 00 00 1e ab 22 a0
a0 50 84 1a 30 30 20 36 00 55 50 21 00 00 1a 7c
2e 90 a0 60 1a 1e 40 30 20 36 00 55 50 21 00 00
1a 00 00 00 00 00 00 00 00 00 00 00 00 00 00 bd

----------------

Block 0, Base EDID:
  EDID Structure Version & Revision: 1.3
  Vendor & Product Identification:
    Manufacturer: LEN
    Model: 26305
    Serial Number: ...
    Made in: week 42 of 2021
  Basic Display Parameters & Features:
    Digital display
    Maximum image size: 60 cm x 34 cm
    Gamma: 2.20
    DPMS levels: Off
    RGB color display
    First detailed timing is the preferred timing
  Color Characteristics:
    Red  : 0.6484, 0.3212
    Green: 0.3037, 0.5966
    Blue : 0.1435, 0.0595
    White: 0.3134, 0.3291
  Established Timings I & II:
    IBM     :   720x400    70.081663 Hz   9:5     31.467 kHz     28.320000 MHz
    DMT 0x04:   640x480    59.940476 Hz   4:3     31.469 kHz     25.175000 MHz
    Apple   :   640x480    66.666667 Hz   4:3     35.000 kHz     30.240000 MHz
    DMT 0x05:   640x480    72.808802 Hz   4:3     37.861 kHz     31.500000 MHz
    DMT 0x06:   640x480    75.000000 Hz   4:3     37.500 kHz     31.500000 MHz
    DMT 0x08:   800x600    56.250000 Hz   4:3     35.156 kHz     36.000000 MHz
    DMT 0x09:   800x600    60.316541 Hz   4:3     37.879 kHz     40.000000 MHz
    DMT 0x0a:   800x600    72.187572 Hz   4:3     48.077 kHz     50.000000 MHz
    DMT 0x0b:   800x600    75.000000 Hz   4:3     46.875 kHz     49.500000 MHz
    DMT 0x10:  1024x768    60.003840 Hz   4:3     48.363 kHz     65.000000 MHz
    DMT 0x11:  1024x768    70.069359 Hz   4:3     56.476 kHz     75.000000 MHz
    DMT 0x12:  1024x768    75.028582 Hz   4:3     60.023 kHz     78.750000 MHz
    DMT 0x24:  1280x1024   75.024675 Hz   5:4     79.976 kHz    135.000000 MHz
  Standard Timings:
    DMT 0x52:  1920x1080   60.000000 Hz  16:9     67.500 kHz    148.500000 MHz
    DMT 0x45:  1920x1200   59.884600 Hz  16:10    74.556 kHz    193.250000 MHz
    DMT 0x3a:  1680x1050   59.954250 Hz  16:10    65.290 kHz    146.250000 MHz
    DMT 0x53:  1600x900    60.000000 Hz  16:9     60.000 kHz    108.000000 MHz (RB)
    DMT 0x2f:  1440x900    59.887445 Hz  16:10    55.935 kHz    106.500000 MHz
    DMT 0x23:  1280x1024   60.019740 Hz   5:4     63.981 kHz    108.000000 MHz
    DMT 0x55:  1280x720    60.000000 Hz  16:9     45.000 kHz     74.250000 MHz
    DMT 0x1c:  1280x800    59.810326 Hz  16:10    49.702 kHz     83.500000 MHz
  Detailed Timing Descriptors:
    DTD 1:  2560x1440   59.950550 Hz  16:9     88.787 kHz    241.500000 MHz (597 mm x 336 mm)
                 Hfront   48 Hsync  32 Hback   80 Hpol P
                 Vfront    3 Vsync   5 Vback   33 Vpol N
    Display Product Serial Number: ...
    Display Range Limits:
      Monitor ranges (GTF): 48-75 Hz V, 15-110 kHz H, max dotclock 310 MHz
    Display Product Name: 'Q27q-1L'
  Extension blocks: 1
Checksum: 0x9c

----------------

Block 1, CTA-861 Extension Block:
  Revision: 3
  Underscans IT Video Formats by default
  Basic audio support
  Supports YCbCr 4:4:4
  Supports YCbCr 4:2:2
  Native DTDs: 0
  Video Data Block:
    VIC  16:  1920x1080   60.000000 Hz  16:9     67.500 kHz    148.500000 MHz
    VIC   5:  1920x1080i  60.000000 Hz  16:9     33.750 kHz     74.250000 MHz
    VIC   4:  1280x720    60.000000 Hz  16:9     45.000 kHz     74.250000 MHz
    VIC   3:   720x480    59.940060 Hz  16:9     31.469 kHz     27.000000 MHz
    VIC   2:   720x480    59.940060 Hz   4:3     31.469 kHz     27.000000 MHz
    VIC  31:  1920x1080   50.000000 Hz  16:9     56.250 kHz    148.500000 MHz
    VIC  20:  1920x1080i  50.000000 Hz  16:9     28.125 kHz     74.250000 MHz
    VIC  19:  1280x720    50.000000 Hz  16:9     37.500 kHz     74.250000 MHz
    VIC  18:   720x576    50.000000 Hz  16:9     31.250 kHz     27.000000 MHz
    VIC  17:   720x576    50.000000 Hz   4:3     31.250 kHz     27.000000 MHz
    VIC   1:   640x480    59.940476 Hz   4:3     31.469 kHz     25.175000 MHz
  Audio Data Block:
    Linear PCM:
      Max channels: 2
      Supported sample rates (kHz): 48 44.1 32
      Supported sample sizes (bits): 24 20 16
  Speaker Allocation Data Block:
    FL/FR - Front Left/Right
  Vendor-Specific Data Block (HDMI), OUI 00-0C-03:
    Source physical address: 1.0.0.0
    DC_36bit
    DC_30bit
    DC_Y444
    Maximum TMDS clock: 310 MHz
  Vendor-Specific Data Block (AMD), OUI 00-00-1A:
    Version: 1
    Flags 1: 0x01
      FreeSync Supported
    Minimum Refresh Rate: 48 Hz
    Maximum Refresh Rate: 75 Hz
  Detailed Timing Descriptors:
    DTD 2:  2560x1440   74.990724 Hz  16:9    111.886 kHz    300.750000 MHz (597 mm x 336 mm)
                 Hfront   66 Hsync  32 Hback   30 Hpol P
                 Vfront    6 Vsync   8 Vback   38 Vpol N
    DTD 3:  1366x768    59.789541 Hz 683:384   47.712 kHz     85.500000 MHz (597 mm x 336 mm)
                 Hfront   70 Hsync 143 Hback  213 Hpol P
                 Vfront    3 Vsync   3 Vback   24 Vpol P
    DTD 4:  1440x900    59.901458 Hz  16:10    55.469 kHz     88.750000 MHz (597 mm x 336 mm)
                 Hfront   48 Hsync  32 Hback   80 Hpol P
                 Vfront    3 Vsync   6 Vback   17 Vpol N
    DTD 5:  1680x1050   59.883253 Hz  16:10    64.674 kHz    119.000000 MHz (597 mm x 336 mm)
                 Hfront   48 Hsync  32 Hback   80 Hpol P
                 Vfront    3 Vsync   6 Vback   21 Vpol N
Checksum: 0xbd  Unused space in Extension Block: 14 bytes

----------------

Warnings:

Block 0, Base EDID:
  Vendor & Product Identification: The serial number is one of the known dummy values, it should probably be set to 0.
Block 1, CTA-861 Extension Block:
  Video Data Block: VIC 16 and the first DTD are not identical. Is this intended?
  Detailed Timing Descriptor #4: Image size is 597x336 mm, but based on the picture AR it should be 537x336 mm.
  Detailed Timing Descriptor #5: Image size is 597x336 mm, but based on the picture AR it should be 537x336 mm.
  Display Product Serial Number is set, so the Serial Number in the Base EDID should be 0.
  Add a Colorimetry Data Block with the sRGB colorimetry bit set to avoid interop issues.
EDID:
  Base EDID: Some timings are out of range of the Monitor Ranges:
    Horizontal Freq: 28.125 - 111.886 kHz (Monitor: 15.000 - 110.000 kHz)

Failures:

Block 1, CTA-861 Extension Block:
  Missing VCDB, needed for Set Selectable RGB Quantization to avoid interop issues.
EDID:
  Extension Block 2 started with EDID header, ignoring Extension Blocks >= 2.

EDID conformity: FAIL
