edid-decode (hex):

00 ff ff ff ff ff ff 00 1e 6d d4 77 be b0 04 00
02 22 01 04 b5 58 25 78 f9 42 f5 b0 4f 42 ab 25
0f 50 54 21 09 00 d1 c0 61 40 45 40 81 c0 01 01
01 01 01 01 01 01 3d c2 00 a0 f0 40 3a 60 30 20
3a 00 70 6f 31 00 00 1a 00 00 00 fd 00 30 90 fa
fa 63 01 0a 20 20 20 20 20 20 00 00 00 fc 00 4c
47 20 55 4c 54 52 41 57 49 44 45 0a 00 00 00 ff
00 34 30 32 4e 54 53 55 39 31 33 39 30 0a 02 76

02 03 30 72 23 09 07 07 83 01 00 00 47 76 61 3f
10 04 03 01 e2 00 6a e3 05 c0 00 e6 06 05 01 7d
6c 1d 6d 1a 00 00 02 0b 30 90 00 04 7d 1e 6c 23
4c 9a 00 a0 f0 40 2e 60 30 20 3a 00 70 6f 31 00
00 1a 13 4c 00 a0 f0 40 17 60 30 20 3a 00 70 6f
31 00 00 1a 00 00 00 00 00 00 00 00 00 00 00 00
00 00 00 00 00 00 00 00 00 00 00 00 00 00 00 00
00 00 00 00 00 00 00 00 00 00 00 00 00 00 00 66

70 12 79 03 00 01 00 0c 60 22 56 0e 00 0f 40 06
90 78 4e bb 0f 00 0a a4 14 0e 0e 07 01 23 00 00
00 03 01 3c c8 81 01 86 ff 0e 9f 00 07 80 1f 00
3f 06 71 00 63 00 07 00 bc 3d 01 86 ff 0e 9f 00
07 80 1f 00 3f 06 5d 00 4f 00 07 00 47 06 01 86
ff 0e 9f 00 07 80 1f 00 3f 06 4d 00 3f 00 07 00
00 00 00 00 00 00 00 00 00 00 00 00 00 00 00 00
00 00 00 00 00 00 00 00 00 00 00 00 00 00 b7 90

00 ff ff ff ff ff ff 00 1e 6d d4 77 be b0 04 00
02 22 01 04 b5 58 25 78 f9 42 f5 b0 4f 42 ab 25
0f 50 54 21 09 00 d1 c0 61 40 45 40 81 c0 01 01
01 01 01 01 01 01 3d c2 00 a0 f0 40 3a 60 30 20
3a 00 70 6f 31 00 00 1a 00 00 00 fd 00 30 90 fa
fa 63 01 0a 20 20 20 20 20 20 00 00 00 fc 00 4c
47 20 55 4c 54 52 41 57 49 44 45 0a 00 00 00 ff
00 34 30 32 4e 54 53 55 39 31 33 39 30 0a 02 76

02 03 30 72 23 09 07 07 83 01 00 00 47 76 61 3f
10 04 03 01 e2 00 6a e3 05 c0 00 e6 06 05 01 7d
6c 1d 6d 1a 00 00 02 0b 30 90 00 04 7d 1e 6c 23
4c 9a 00 a0 f0 40 2e 60 30 20 3a 00 70 6f 31 00
00 1a 13 4c 00 a0 f0 40 17 60 30 20 3a 00 70 6f
31 00 00 1a 00 00 00 00 00 00 00 00 00 00 00 00
00 00 00 00 00 00 00 00 00 00 00 00 00 00 00 00
00 00 00 00 00 00 00 00 00 00 00 00 00 00 00 66

70 12 79 03 00 01 00 0c 60 22 56 0e 00 0f 40 06
90 78 4e bb 0f 00 0a a4 14 0e 0e 07 01 23 00 00
00 03 01 3c c8 81 01 86 ff 0e 9f 00 07 80 1f 00
3f 06 71 00 63 00 07 00 bc 3d 01 86 ff 0e 9f 00
07 80 1f 00 3f 06 5d 00 4f 00 07 00 47 06 01 86
ff 0e 9f 00 07 80 1f 00 3f 06 4d 00 3f 00 07 00
00 00 00 00 00 00 00 00 00 00 00 00 00 00 00 00
00 00 00 00 00 00 00 00 00 00 00 00 00 00 b7 90

----------------

Block 0, Base EDID:
  EDID Structure Version & Revision: 1.4
  Vendor & Product Identification:
    Manufacturer: GSM
    Model: 30676
    Serial Number: ...
    Made in: week 2 of 2024
  Basic Display Parameters & Features:
    Digital display
    Bits per primary color channel: 10
    DisplayPort interface
    Maximum image size: 88 cm x 37 cm
    Gamma: 2.20
    DPMS levels: Standby Suspend Off
    Supported color formats: RGB 4:4:4, YCrCb 4:4:4, YCrCb 4:2:2
    First detailed timing does not include the native pixel format and preferred refresh rate
    Display supports continuous frequencies
  Color Characteristics:
    Red  : 0.6884, 0.3085
    Green: 0.2578, 0.6699
    Blue : 0.1474, 0.0615
    White: 0.3134, 0.3291
  Established Timings I & II:
    DMT 0x04:   640x480    59.940476 Hz   4:3     31.469 kHz     25.175000 MHz
    DMT 0x09:   800x600    60.316541 Hz   4:3     37.879 kHz     40.000000 MHz
    DMT 0x10:  1024x768    60.003840 Hz   4:3     48.363 kHz     65.000000 MHz
    DMT 0x24:  1280x1024   75.024675 Hz   5:4     79.976 kHz    135.000000 MHz
  Standard Timings:
    DMT 0x52:  1920x1080   60.000000 Hz  16:9     67.500 kHz    148.500000 MHz
    DMT 0x10:  1024x768    60.003840 Hz   4:3     48.363 kHz     65.000000 MHz
    DMT 0x09:   800x600    60.316541 Hz   4:3     37.879 kHz     40.000000 MHz
    DMT 0x55:  1280x720    60.000000 Hz  16:9     45.000 kHz     74.250000 MHz
  Detailed Timing Descriptors:
    DTD 1:  3840x1600   74.977382 Hz  12:5    124.312 kHz    497.250000 MHz (880 mm x 367 mm)
                 Hfront   48 Hsync  32 Hback   80 Hpol P
                 Vfront    3 Vsync  10 Vback   45 Vpol N
    Display Range Limits:
      Monitor ranges (Range Limits Only): 48-144 Hz V, 250-250 kHz H, max dotclock 990 MHz
    Display Product Name: 'LG ULTRAWIDE'
    Display Product Serial Number: ...
  Extension blocks: 2
Checksum: 0x76

----------------

Block 1, CTA-861 Extension Block:
  Revision: 3
  Basic audio support
  Supports YCbCr 4:4:4
  Supports YCbCr 4:2:2
  Native DTDs: 2
  Audio Data Block:
    Linear PCM:
      Max channels: 2
      Supported sample rates (kHz): 48 44.1 32
      Supported sample sizes (bits): 24 20 16
  Speaker Allocation Data Block:
    FL/FR - Front Left/Right
  Video Data Block:
    VIC 118:  3840x2160  120.000000 Hz  16:9    270.000 kHz   1188.000000 MHz
    VIC  97:  3840x2160   60.000000 Hz  16:9    135.000 kHz    594.000000 MHz
    VIC  63:  1920x1080  120.000000 Hz  16:9    135.000 kHz    297.000000 MHz
    VIC  16:  1920x1080   60.000000 Hz  16:9     67.500 kHz    148.500000 MHz
    VIC   4:  1280x720    60.000000 Hz  16:9     45.000 kHz     74.250000 MHz
    VIC   3:   720x480    59.940060 Hz  16:9     31.469 kHz     27.000000 MHz
    VIC   1:   640x480    59.940476 Hz   4:3     31.469 kHz     25.175000 MHz
  Video Capability Data Block:
    YCbCr quantization: No Data
    RGB quantization: Selectable (via AVI Q)
    PT scan behavior: Always Underscanned
    IT scan behavior: Always Underscanned
    CE scan behavior: Always Underscanned
  Colorimetry Data Block:
    BT2020YCC
    BT2020RGB
  HDR Static Metadata Data Block:
    Electro optical transfer functions:
      Traditional gamma - SDR luminance range
      SMPTE ST2084
    Supported static metadata descriptors:
      Static metadata type 1
    Desired content max luminance: 125 (749.667 cd/m^2)
    Desired content max frame-average luminance: 108 (518.736 cd/m^2)
    Desired content min luminance: 29 (0.097 cd/m^2)
  Vendor-Specific Data Block (AMD), OUI 00-00-1A:
    Version: 2
    Feature Caps: 0x0b
      Local Dimming Supported
    Minimum Refresh Rate: 48 Hz
    Maximum Refresh Rate: 144 Hz
    Flags 1.x: 0x00
    Flags 2.x: 0x04
      ST 2084 (PQ) EOTF Supported
      Linear EOTF (Windows scRGB, 0.0 - 125.0) Supported
      Gamma 2.2 EOTF Supported
      BT.2020 Gamut Supported
    Maximum luminance: 125 (749.667 cd/m^2)
    Minimum luminance: 30 (0.104 cd/m^2)
    Maximum luminance (without local dimming): 108 (518.736 cd/m^2)
    Minimum luminance (without local dimming): 35 (0.098 cd/m^2)
  Detailed Timing Descriptors:
    DTD 2:  3840x1600   59.993925 Hz  12:5     98.750 kHz    395.000000 MHz (880 mm x 367 mm)
                 Hfront   48 Hsync  32 Hback   80 Hpol P
                 Vfront    3 Vsync  10 Vback   33 Vpol N
    DTD 3:  3840x1600   29.998460 Hz  12:5     48.688 kHz    194.750000 MHz (880 mm x 367 mm)
                 Hfront   48 Hsync  32 Hback   80 Hpol P
                 Vfront    3 Vsync  10 Vback   10 Vpol N
Checksum: 0x66  Unused space in Extension Block: 43 bytes

----------------

Block 2, DisplayID Extension Block:
  Version: 1.2
  Extension Count: 0
  Display Product Type: Standalone display device
  Display Parameters Data Block (0x01):
    Image size: 880.0 mm x 367.0 mm
    Display native pixel format: 3840x1600
    Feature support flags:
      Power management (DPM)
      Audio support on video interface
    Gamma: 2.20
    Aspect ratio: 1.78
    Dynamic bpc native: 12
    Dynamic bpc overall: 12
  Display Interface Data Block:
    Interface Type: DisplayPort
    Number of Links: 4
    Interface Standard Version: 1.4
    Supported bpc for RGB encoding: 8, 10, 12
    Supported bpc for YCbCr 4:4:4 encoding: 8, 10, 12
    Supported bpc for YCbCr 4:2:2 encoding: 8, 10, 12
    Supported Content Protection: HDCP 2.3
    Spread Spectrum: None
  Video Timing Modes Type 1 - Detailed Timings Data Block:
    DTD:  3840x1600  144.050467 Hz  64:27   246.903 kHz    987.610000 MHz (aspect 64:27, no 3D stereo, preferred)
               Hfront    8 Hsync  32 Hback  120 Hpol P
               Vfront  100 Vsync   8 Vback    6 Vpol N
    DTD:  3840x1600  120.042798 Hz  64:27   203.352 kHz    813.410000 MHz (aspect 64:27, no 3D stereo, preferred)
               Hfront    8 Hsync  32 Hback  120 Hpol P
               Vfront   80 Vsync   8 Vback    6 Vpol N
    DTD:  3840x1600  100.035757 Hz  64:27   167.860 kHz    671.440000 MHz (aspect 64:27, no 3D stereo, preferred)
               Hfront    8 Hsync  32 Hback  120 Hpol P
               Vfront   64 Vsync   8 Vback    6 Vpol N
  Checksum: 0xb7
Checksum: 0x90

----------------

Warnings:

Block 1, CTA-861 Extension Block:
  IT Video Formats are overscanned by default, but normally this should be underscanned.
  Video Data Block: VIC 118 and the first DTD are not identical. Is this intended?
  Video Capability Data Block: Set Selectable YCbCr Quantization to avoid interop issues.
  Video Capability Data Block: S_PT is equal to S_IT and S_CE, so should be set to 0 instead.
  Colorimetry Data Block: Set the sRGB colorimetry bit to avoid interop issues.
  Display Product Serial Number is set, so the Serial Number in the Base EDID should be 0.
EDID:
  Base EDID: Some timings are out of range of the Monitor Ranges:
    Vertical Freq: 29.998 - 144.050 Hz (Monitor: 48.000 - 144.000 Hz)
    Horizontal Freq: 31.468 - 270.000 kHz (Monitor: 250.000 - 250.000 kHz)
    Maximum Clock: 1188.000 MHz (Monitor: 990.000 MHz)
  CTA-861: Native progressive resolution of 3840x1600 is smaller than the max preferred progressive resolution 3840x2160.

Failures:

Block 1, CTA-861 Extension Block:
  Video Capability Data Block: IT video formats are always underscanned, but bit 7 of Byte 3 of the CTA-861 Extension header is set to overscanned.
EDID:
  Extension Block 3 started with EDID header, ignoring Extension Blocks >= 3.

EDID conformity: FAIL
