edid-decode (hex):

00 ff ff ff ff ff ff 00 32 0c 00 00 00 00 00 00
00 0e 01 03 80 25 17 78 0a 8e f0 97 58 51 8d 28
24 50 54 00 00 00 01 01 01 01 01 01 01 01 01 01
01 01 01 01 01 01 95 25 a0 3e 51 84 0c 30 40 20
33 00 6f e6 10 00 00 18 00 00 00 00 00 00 00 00
00 00 00 00 00 00 00 00 00 00 00 00 00 fe 00 54
34 39 37 36 10 31 37 31 57 58 32 0a 00 00 00 fe
00 d8 c8 b8 b0 88 58 30 00 02 01 0a 20 20 00 51

00 ff ff ff ff ff ff 00 32 0c 00 00 00 00 00 00
00 0e 01 03 80 25 17 78 0a 8e f0 97 58 51 8d 28
24 50 54 00 00 00 01 01 01 01 01 01 01 01 01 01
01 01 01 01 01 01 95 25 a0 3e 51 84 0c 30 40 20
33 00 6f e6 10 00 00 18 00 00 00 00 00 00 00 00
00 00 00 00 00 00 00 00 00 00 00 00 00 fe 00 54
34 39 37 36 10 31 37 31 57 58 32 0a 00 00 00 fe
00 d8 c8 b8 b0 88 58 30 00 02 01 0a 20 20 00 51

----------------

Block 0, Base EDID:
  EDID Structure Version & Revision: 1.3
  Vendor & Product Identification:
    Manufacturer: LPL
    Model: 0
    Made in: 2004
  Basic Display Parameters & Features:
    Digital display
    Maximum image size: 37 cm x 23 cm
    Gamma: 2.20
    RGB color display
    First detailed timing is the preferred timing
  Color Characteristics:
    Red  : 0.5917, 0.3437
    Green: 0.3193, 0.5527
    Blue : 0.1591, 0.1435
    White: 0.3125, 0.3281
  Established Timings I & II: none
  Standard Timings: none
  Detailed Timing Descriptors:
    DTD 1:  1440x900    60.007634 Hz  16:10    54.727 kHz     96.210000 MHz (367 mm x 230 mm)
                 Hfront   64 Hsync  32 Hback  222 Hpol N
                 Vfront    3 Vsync   3 Vback    6 Vpol N
    Empty Descriptor
    Alphanumeric Data String: 'T4976.171WX2'
    Alphanumeric Data String: '.....X0'
Checksum: 0x51

----------------

Block 1, Unknown EDID Extension Block 0x00:
  00 ff ff ff ff ff ff 00 32 0c 00 00 00 00 00 00 '........2.......'
  00 0e 01 03 80 25 17 78 0a 8e f0 97 58 51 8d 28 '.....%.x....XQ.('
  24 50 54 00 00 00 01 01 01 01 01 01 01 01 01 01 '$PT.............'
  01 01 01 01 01 01 95 25 a0 3e 51 84 0c 30 40 20 '.......%.>Q..0@ '
  33 00 6f e6 10 00 00 18 00 00 00 00 00 00 00 00 '3.o.............'
  00 00 00 00 00 00 00 00 00 00 00 00 00 fe 00 54 '...............T'
  34 39 37 36 10 31 37 31 57 58 32 0a 00 00 00 fe '4976.171WX2.....'
  00 d8 c8 b8 b0 88 58 30 00 02 01 0a 20 20 00 51 '......X0....  .Q'
Checksum: 0x51

----------------

Warnings:

Block 0, Base EDID:
  Alphanumeric Data String: Non-ASCII character 0x10 at position 5, can cause problems.
  Alphanumeric Data String: Non-ASCII character 0xd8 at position 0, can cause problems.
  Alphanumeric Data String: Non-ASCII character 0xc8 at position 1, can cause problems.
  Alphanumeric Data String: Non-ASCII character 0xb8 at position 2, can cause problems.
  Alphanumeric Data String: Non-ASCII character 0xb0 at position 3, can cause problems.
  Alphanumeric Data String: Non-ASCII character 0x88 at position 4, can cause problems.

Failures:

Block 0, Base EDID:
  Empty Descriptor: Use Dummy Descriptor instead of all zeroes.
  Alphanumeric Data String: NUL byte at position 7.
  Missing Display Product Name.
  Missing Display Range Limits Descriptor.
Block 1, Base EDID:
  Unknown Extension Block.
EDID:
  Base EDID: EDID specified 0 extension block(s), but found 1 extension block(s).

EDID conformity: FAIL
