edid-decode (hex):

00 ff ff ff ff ff ff 00 32 0c 00 00 00 00 00 00
00 11 01 03 80 1e 13 78 0a 08 85 95 58 53 8c 28
23 50 54 00 00 00 01 01 01 01 01 01 01 01 01 01
01 01 01 01 01 01 7e 1d 00 e8 50 20 20 30 40 30
36 00 30 be 10 00 00 19 00 00 00 00 00 00 00 00
00 00 00 00 00 00 00 00 00 00 00 00 00 fe 00 43
59 31 38 35 00 31 34 31 57 58 31 0a 00 00 00 fe
00 1d 2d 39 45 6f 97 b7 fb 01 01 0a 20 20 00 a6

----------------

Block 0, Base EDID:
  EDID Structure Version & Revision: 1.3
  Vendor & Product Identification:
    Manufacturer: LPL
    Model: 0
    Made in: 2007
  Basic Display Parameters & Features:
    Digital display
    Maximum image size: 30 cm x 19 cm
    Gamma: 2.20
    RGB color display
    First detailed timing is the preferred timing
  Color Characteristics:
    Red  : 0.5820, 0.3437
    Green: 0.3261, 0.5468
    Blue : 0.1582, 0.1367
    White: 0.3134, 0.3291
  Established Timings I & II: none
  Standard Timings: none
  Detailed Timing Descriptors:
    DTD 1:  1280x800    60.016662 Hz  16:10    49.934 kHz     75.500000 MHz (304 mm x 190 mm)
                 Hfront   64 Hsync  48 Hback  120 Hpol N
                 Vfront    3 Vsync   6 Vback   23 Vpol N
    Empty Descriptor
    Alphanumeric Data String: 'CY185'
    Alphanumeric Data String: '.-9Eo.....'
Checksum: 0xa6

----------------

Warnings:

Block 0, Base EDID:
  Alphanumeric Data String: Non-ASCII character 0x1d at position 0, can cause problems.
  Alphanumeric Data String: Non-ASCII character 0x97 at position 5, can cause problems.
  Alphanumeric Data String: Non-ASCII character 0xb7 at position 6, can cause problems.
  Alphanumeric Data String: Non-ASCII character 0xfb at position 7, can cause problems.
  Alphanumeric Data String: Non-ASCII character 0x01 at position 8, can cause problems.
  Alphanumeric Data String: Non-ASCII character 0x01 at position 9, can cause problems.

Failures:

Block 0, Base EDID:
  Empty Descriptor: Use Dummy Descriptor instead of all zeroes.
  Alphanumeric Data String: NUL byte at position 5.
  Missing Display Product Name.
  Missing Display Range Limits Descriptor.

EDID conformity: FAIL
