edid-decode (hex):

00 ff ff ff ff ff ff 00 32 0c 00 00 00 00 00 00
00 11 01 03 80 25 17 78 0a b8 d5 97 58 54 8c 27
22 50 54 00 00 00 01 01 01 01 01 01 01 01 01 01
01 01 01 01 01 01 95 25 a0 40 51 84 0c 30 40 20
13 00 6f e6 10 00 00 19 00 00 00 00 00 00 00 00
00 00 00 00 00 00 00 00 00 00 00 00 00 fe 00 55
4d 36 30 36 01 31 37 31 57 58 32 0a 00 00 00 fe
00 27 38 43 4b 6a 91 c4 ff 02 01 0a 20 20 00 c9

----------------

Block 0, Base EDID:
  EDID Structure Version & Revision: 1.3
  Vendor & Product Identification:
    Manufacturer: LPL
    Model: 0
    Made in: 2007
  Basic Display Parameters & Features:
    Digital display
    Maximum image size: 37 cm x 23 cm
    Gamma: 2.20
    RGB color display
    First detailed timing is the preferred timing
  Color Characteristics:
    Red  : 0.5917, 0.3466
    Green: 0.3300, 0.5468
    Blue : 0.1552, 0.1337
    White: 0.3134, 0.3291
  Established Timings I & II: none
  Standard Timings: none
  Detailed Timing Descriptors:
    DTD 1:  1440x900    59.939444 Hz  16:10    54.665 kHz     96.210000 MHz (367 mm x 230 mm)
                 Hfront   64 Hsync  32 Hback  224 Hpol N
                 Vfront    1 Vsync   3 Vback    8 Vpol N
    Empty Descriptor
    Alphanumeric Data String: 'UM606.171WX2'
    Alphanumeric Data String: ''8CKj..'
Checksum: 0xc9

----------------

Warnings:

Block 0, Base EDID:
  Alphanumeric Data String: Non-ASCII character 0x01 at position 5, can cause problems.
  Alphanumeric Data String: Non-ASCII character 0x91 at position 5, can cause problems.
  Alphanumeric Data String: Non-ASCII character 0xc4 at position 6, can cause problems.

Failures:

Block 0, Base EDID:
  Empty Descriptor: Use Dummy Descriptor instead of all zeroes.
  Alphanumeric Data String: 0xff byte at position 7.
  Missing Display Product Name.
  Missing Display Range Limits Descriptor.

EDID conformity: FAIL
