edid-decode (hex):

00 ff ff ff ff ff ff 00 32 0c 00 00 00 00 00 00
00 12 01 03 90 21 15 78 0a b7 85 99 59 53 8d 27
25 50 54 00 00 00 01 01 01 01 01 01 01 01 01 01
01 01 01 01 01 01 d1 19 00 48 50 20 10 30 18 18
36 00 4b cf 10 00 00 1b d1 19 00 48 50 20 10 30
18 18 36 00 4b cf 10 00 00 1b 00 00 00 fe 00 57
55 36 38 32 81 31 35 34 57 58 35 0a 00 00 00 00
00 24 32 3d 45 68 8b a7 ff 01 01 0a 20 20 00 32

----------------

Block 0, Base EDID:
  EDID Structure Version & Revision: 1.3
  Vendor & Product Identification:
    Manufacturer: LPL
    Model: 0
    Made in: 2008
  Basic Display Parameters & Features:
    Digital display
    Maximum image size: 33 cm x 21 cm
    Gamma: 2.20
    RGB color display
    First detailed timing is the preferred timing
  Color Characteristics:
    Red  : 0.5996, 0.3505
    Green: 0.3251, 0.5537
    Blue : 0.1542, 0.1445
    White: 0.3134, 0.3291
  Established Timings I & II: none
  Standard Timings: none
  Detailed Timing Descriptors:
    DTD 1:  1280x800    59.905804 Hz  16:10    48.883 kHz     66.090000 MHz (331 mm x 207 mm)
                 Hfront   24 Hsync  24 Hback   24 Hpol P
                 Vfront    3 Vsync   6 Vback    7 Vpol N
    DTD 2:  1280x800    59.905804 Hz  16:10    48.883 kHz     66.090000 MHz (331 mm x 207 mm)
                 Hfront   24 Hsync  24 Hback   24 Hpol P
                 Vfront    3 Vsync   6 Vback    7 Vpol N
    Alphanumeric Data String: 'WU682.154WX5'
    Manufacturer-Specified Display Descriptor (0x00): 00 00 00 24 32 3d 45 68 8b a7 ff 01 01 0a 20 20 '...$2=Eh......  '
Checksum: 0x32

----------------

Warnings:

Block 0, Base EDID:
  Alphanumeric Data String: Non-ASCII character 0x81 at position 5, can cause problems.

Failures:

Block 0, Base EDID:
  Basic Display Parameters & Features: Digital Video Interface Standard set to reserved value 0x10.
  Missing Display Product Name.
  Missing Display Range Limits Descriptor.

EDID conformity: FAIL
