edid-decode (hex):

00 ff ff ff ff ff ff 00 0e 14 c7 14 00 00 00 00
2f 14 01 03 80 22 13 78 0a 4e 4d 9e 57 54 91 26
0f 50 54 00 00 00 01 01 01 01 01 01 01 01 01 01
01 01 01 01 01 01 78 1d 56 c2 50 00 26 30 3b 27
36 00 58 c2 10 00 00 18 78 1d 56 c2 50 00 26 30
3b 27 36 00 58 c2 10 00 00 18 00 00 00 fe 00 43
50 54 0a 20 20 20 20 20 20 20 20 20 00 00 00 00
00 43 4c 41 41 31 35 36 57 42 31 31 41 20 00 bb

00 ff ff ff ff ff ff 00 0e 14 c7 14 00 00 00 00
2f 14 01 03 80 22 13 78 0a 4e 4d 9e 57 54 91 26
0f 50 54 00 00 00 01 01 01 01 01 01 01 01 01 01
01 01 01 01 01 01 78 1d 56 c2 50 00 26 30 3b 27
36 00 58 c2 10 00 00 18 78 1d 56 c2 50 00 26 30
3b 27 36 00 58 c2 10 00 00 18 00 00 00 fe 00 43
50 54 0a 20 20 20 20 20 20 20 20 20 00 00 00 00
00 43 4c 41 41 31 35 36 57 42 31 31 41 20 00 bb

----------------

Block 0, Base EDID:
  EDID Structure Version & Revision: 1.3
  Vendor & Product Identification:
    Manufacturer: CPT
    Model: 5319
    Made in: week 47 of 2010
  Basic Display Parameters & Features:
    Digital display
    Maximum image size: 34 cm x 19 cm
    Gamma: 2.20
    RGB color display
    First detailed timing is the preferred timing
  Color Characteristics:
    Red  : 0.6181, 0.3398
    Green: 0.3310, 0.5683
    Blue : 0.1494, 0.0585
    White: 0.3154, 0.3291
  Established Timings I & II: none
  Standard Timings: none
  Detailed Timing Descriptors:
    DTD 1:  1366x768    59.998727 Hz 683:384   48.359 kHz     75.440000 MHz (344 mm x 194 mm)
                 Hfront   59 Hsync  39 Hback   96 Hpol N
                 Vfront    3 Vsync   6 Vback   29 Vpol N
    DTD 2:  1366x768    59.998727 Hz 683:384   48.359 kHz     75.440000 MHz (344 mm x 194 mm)
                 Hfront   59 Hsync  39 Hback   96 Hpol N
                 Vfront    3 Vsync   6 Vback   29 Vpol N
    Alphanumeric Data String: 'CPT'
    Manufacturer-Specified Display Descriptor (0x00): 00 00 00 43 4c 41 41 31 35 36 57 42 31 31 41 20 '...CLAA156WB11A '
Checksum: 0xbb

----------------

Failures:

Block 0, Base EDID:
  Missing Display Product Name.
  Missing Display Range Limits Descriptor.
EDID:
  Extension Block 1 started with EDID header, ignoring Extension Blocks >= 1.

EDID conformity: FAIL
