edid-decode (hex):

00 ff ff ff ff ff ff 00 1e 6d f7 55 0e 8c 00 00
06 0d 01 03 88 32 1f 78 2a 28 0b a3 54 4d 96 25
12 50 54 a5 6a 80 81 80 61 59 45 59 31 59 01 01
01 01 01 01 01 01 30 2a 00 98 51 00 2a 40 30 70
13 00 f0 36 11 00 00 1e 00 00 00 fd 00 38 55 1e
47 0b 00 0a 20 20 20 20 20 20 00 00 00 fc 00 4c
32 33 32 30 41 0a 20 20 20 20 20 20 00 00 00 fc
00 0a 20 20 20 20 20 20 20 20 20 20 20 20 00 88

00 ff ff ff ff ff ff 00 1e 6d f7 55 0e 8c 00 00
06 0d 01 03 88 32 1f 78 2a 28 0b a3 54 4d 96 25
12 50 54 a5 6a 80 81 80 61 59 45 59 31 59 01 01
01 01 01 01 01 01 30 2a 00 98 51 00 2a 40 30 70
13 00 f0 36 11 00 00 1e 00 00 00 fd 00 38 55 1e
47 0b 00 0a 20 20 20 20 20 20 00 00 00 fc 00 4c
32 33 32 30 41 0a 20 20 20 20 20 20 00 00 00 fc
00 0a 20 20 20 20 20 20 20 20 20 20 20 20 00 88

----------------

Block 0, Base EDID:
  EDID Structure Version & Revision: 1.3
  Vendor & Product Identification:
    Manufacturer: GSM
    Model: 22007
    Serial Number: ...
    Made in: week 6 of 2003
  Basic Display Parameters & Features:
    Digital display
    Maximum image size: 50 cm x 31 cm
    Gamma: 2.20
    DPMS levels: Off
    RGB color display
    First detailed timing is the preferred timing
  Color Characteristics:
    Red  : 0.6367, 0.3300
    Green: 0.3027, 0.5859
    Blue : 0.1445, 0.0703
    White: 0.3144, 0.3310
  Established Timings I & II:
    IBM     :   720x400    70.081663 Hz   9:5     31.467 kHz     28.320000 MHz
    DMT 0x04:   640x480    59.940476 Hz   4:3     31.469 kHz     25.175000 MHz
    DMT 0x06:   640x480    75.000000 Hz   4:3     37.500 kHz     31.500000 MHz
    DMT 0x09:   800x600    60.316541 Hz   4:3     37.879 kHz     40.000000 MHz
    DMT 0x0b:   800x600    75.000000 Hz   4:3     46.875 kHz     49.500000 MHz
    Apple   :   832x624    74.551266 Hz   4:3     49.726 kHz     57.284000 MHz
    DMT 0x10:  1024x768    60.003840 Hz   4:3     48.363 kHz     65.000000 MHz
    DMT 0x12:  1024x768    75.028582 Hz   4:3     60.023 kHz     78.750000 MHz
    Apple   :  1152x870    75.061550 Hz 192:145   68.681 kHz    100.000000 MHz
  Standard Timings:
    DMT 0x23:  1280x1024   60.019740 Hz   5:4     63.981 kHz    108.000000 MHz
    DMT 0x13:  1024x768    84.996690 Hz   4:3     68.677 kHz     94.500000 MHz
    DMT 0x0c:   800x600    85.061274 Hz   4:3     53.674 kHz     56.250000 MHz
    DMT 0x07:   640x480    85.008312 Hz   4:3     43.269 kHz     36.000000 MHz
  Detailed Timing Descriptors:
    DTD 1:  1280x1024   60.019740 Hz   5:4     63.981 kHz    108.000000 MHz (496 mm x 310 mm)
                 Hfront   48 Hsync 112 Hback  248 Hpol P
                 Vfront    1 Vsync   3 Vback   38 Vpol P
    Display Range Limits:
      Monitor ranges (GTF): 56-85 Hz V, 30-71 kHz H, max dotclock 110 MHz
    Display Product Name: 'L2320A'
    Display Product Name: ''
Checksum: 0x88

----------------

Block 1, Unknown EDID Extension Block 0x00:
  00 ff ff ff ff ff ff 00 1e 6d f7 55 0e 8c 00 00 '.........m.U....'
  06 0d 01 03 88 32 1f 78 2a 28 0b a3 54 4d 96 25 '.....2.x*(..TM.%'
  12 50 54 a5 6a 80 81 80 61 59 45 59 31 59 01 01 '.PT.j...aYEY1Y..'
  01 01 01 01 01 01 30 2a 00 98 51 00 2a 40 30 70 '......0*..Q.*@0p'
  13 00 f0 36 11 00 00 1e 00 00 00 fd 00 38 55 1e '...6.........8U.'
  47 0b 00 0a 20 20 20 20 20 20 00 00 00 fc 00 4c 'G...      .....L'
  32 33 32 30 41 0a 20 20 20 20 20 20 00 00 00 fc '2320A.      ....'
  00 0a 20 20 20 20 20 20 20 20 20 20 20 20 00 88 '..            ..'
Checksum: 0x88

----------------

Warnings:

Block 0, Base EDID:
  Detailed Timing Descriptor #1: Image size is 496x310 mm, but based on the picture AR it should be 496x396 mm.

Failures:

Block 0, Base EDID:
  Basic Display Parameters & Features: Digital Video Interface Standard set to reserved value 0x08.
  Display Product Name: Empty string.
Block 1, Base EDID:
  Unknown Extension Block.
EDID:
  Base EDID: EDID specified 0 extension block(s), but found 1 extension block(s).

EDID conformity: FAIL
