edid-decode (hex):

00 ff ff ff ff ff ff 00 09 e5 0a 0c 00 00 00 00
07 21 01 04 a5 22 16 78 07 c1 25 94 5d 5b 95 2b
21 50 54 00 00 00 01 01 01 01 01 01 01 01 01 01
01 01 01 01 01 01 33 3f 80 dc 70 b0 3c 40 30 20
36 00 59 d7 10 00 00 1a 8f 32 80 dc 70 b0 3c 40
30 20 36 00 59 d7 10 00 00 00 00 00 00 fd 00 28
3c 4c 4c 10 01 0a 20 20 20 20 20 20 00 00 00 fe
00 4e 56 31 36 30 57 55 4d 2d 4e 34 33 0a 01 f6

02 03 00 00 68 1a 00 00 01 01 28 3c 00 00 00 00
00 00 00 00 00 00 00 00 00 00 00 00 00 00 00 00
00 00 00 00 00 00 00 00 00 00 00 00 00 00 00 00
00 00 00 00 00 00 00 00 00 00 00 00 00 00 00 00
00 00 00 00 00 00 00 00 00 00 00 00 00 00 00 00
00 00 00 00 00 00 00 00 00 00 00 00 00 00 00 00
00 00 00 00 00 00 00 00 00 00 00 00 00 00 00 00
00 00 00 00 00 00 00 00 00 00 00 00 00 00 15 fe

00 ff ff ff ff ff ff 00 09 e5 0a 0c 00 00 00 00
07 21 01 04 a5 22 16 78 07 c1 25 94 5d 5b 95 2b
21 50 54 00 00 00 01 01 01 01 01 01 01 01 01 01
01 01 01 01 01 01 33 3f 80 dc 70 b0 3c 40 30 20
36 00 59 d7 10 00 00 1a 8f 32 80 dc 70 b0 3c 40
30 20 36 00 59 d7 10 00 00 00 00 00 00 fd 00 28
3c 4c 4c 10 01 0a 20 20 20 20 20 20 00 00 00 fe
00 4e 56 31 36 30 57 55 4d 2d 4e 34 33 0a 01 f6

02 03 00 00 68 1a 00 00 01 01 28 3c 00 00 00 00
00 00 00 00 00 00 00 00 00 00 00 00 00 00 00 00
00 00 00 00 00 00 00 00 00 00 00 00 00 00 00 00
00 00 00 00 00 00 00 00 00 00 00 00 00 00 00 00
00 00 00 00 00 00 00 00 00 00 00 00 00 00 00 00
00 00 00 00 00 00 00 00 00 00 00 00 00 00 00 00
00 00 00 00 00 00 00 00 00 00 00 00 00 00 00 00
00 00 00 00 00 00 00 00 00 00 00 00 00 00 15 fe

----------------

Block 0, Base EDID:
  EDID Structure Version & Revision: 1.4
  Vendor & Product Identification:
    Manufacturer: BOE
    Model: 3082
    Made in: week 7 of 2023
  Basic Display Parameters & Features:
    Digital display
    Bits per primary color channel: 8
    DisplayPort interface
    Maximum image size: 34 cm x 22 cm
    Gamma: 2.20
    Supported color formats: RGB 4:4:4
    Default (sRGB) color space is primary color space
    First detailed timing includes the native pixel format and preferred refresh rate
    Display supports continuous frequencies
  Color Characteristics:
    Red  : 0.5810, 0.3632
    Green: 0.3554, 0.5830
    Blue : 0.1679, 0.1308
    White: 0.3134, 0.3291
  Established Timings I & II: none
  Standard Timings: none
  Detailed Timing Descriptors:
    DTD 1:  1920x1200   60.002225 Hz  16:10    75.603 kHz    161.790000 MHz (345 mm x 215 mm)
                 Hfront   48 Hsync  32 Hback  140 Hpol P
                 Vfront    3 Vsync   6 Vback   51 Vpol N
    DTD 2:  1920x1200   48.001038 Hz  16:10    60.481 kHz    129.430000 MHz (analog composite, sync-on-green, 345 mm x 215 mm)
                 Hfront   48 Hsync  32 Hback  140 Hpol N
                 Vfront    3 Vsync   6 Vback   51 Vpol N
    Display Range Limits:
      Monitor ranges (Range Limits Only): 40-60 Hz V, 76-76 kHz H, max dotclock 160 MHz
    Alphanumeric Data String: 'NV160WUM-N43'
  Extension blocks: 1
Checksum: 0xf6

----------------

Block 1, CTA-861 Extension Block:
  Revision: 3
  Native DTDs: 0
Checksum: 0xfe

----------------

Warnings:

Block 0, Base EDID:
  Missing Display Product Name.
Block 1, CTA-861 Extension Block:
  IT Video Formats are overscanned by default, but normally this should be underscanned.
EDID:
  Base EDID: Some timings are out of range of the Monitor Ranges:
    Horizontal Freq: 60.481 - 75.602 kHz (Monitor: 76.000 - 76.000 kHz)
    Maximum Clock: 161.790 MHz (Monitor: 160.000 MHz)

Failures:

Block 0, Base EDID:
  Basic Display Parameters & Features: sRGB is signaled, but the chromaticities do not match.
Block 1, CTA-861 Extension Block:
  Padding: Contains non-zero bytes.
  Required 640x480p60 timings are missing in the established timings and the SVD list (VIC 1).
  Missing VCDB, needed for Set Selectable RGB Quantization to avoid interop issues.
EDID:
  Extension Block 2 started with EDID header, ignoring Extension Blocks >= 2.

EDID conformity: FAIL
