edid-decode (hex):

00 ff ff ff ff ff ff 00 06 10 a7 9c 00 00 00 00
02 13 01 03 80 1d 13 78 0a f5 95 a3 55 4f 9c 26
0f 50 54 00 00 00 01 01 01 01 01 01 01 01 01 01
01 01 01 01 01 01 52 1c 00 a0 50 20 17 30 30 20
36 00 1e b2 10 00 00 18 00 00 00 01 00 06 10 20
00 00 00 00 00 00 00 00 0a 20 00 00 00 fe 00 4e
31 33 33 49 36 2d 4c 30 38 0a 20 20 00 00 00 fc
00 43 6f 6c 6f 72 20 4c 43 44 0a 20 20 20 00 83

00 ff ff ff ff ff ff 00 06 10 a7 9c 00 00 00 00
02 13 01 03 80 1d 13 78 0a f5 95 a3 55 4f 9c 26
0f 50 54 00 00 00 01 01 01 01 01 01 01 01 01 01
01 01 01 01 01 01 52 1c 00 a0 50 20 17 30 30 20
36 00 1e b2 10 00 00 18 00 00 00 01 00 06 10 20
00 00 00 00 00 00 00 00 0a 20 00 00 00 fe 00 4e
31 33 33 49 36 2d 4c 30 38 0a 20 20 00 00 00 fc
00 43 6f 6c 6f 72 20 4c 43 44 0a 20 20 20 00 83

----------------

Block 0, Base EDID:
  EDID Structure Version & Revision: 1.3
  Vendor & Product Identification:
    Manufacturer: APP
    Model: 40103
    Made in: week 2 of 2009
  Basic Display Parameters & Features:
    Digital display
    Maximum image size: 29 cm x 19 cm
    Gamma: 2.20
    RGB color display
    First detailed timing is the preferred timing
  Color Characteristics:
    Red  : 0.6396, 0.3349
    Green: 0.3095, 0.6103
    Blue : 0.1503, 0.0595
    White: 0.3134, 0.3291
  Established Timings I & II: none
  Standard Timings: none
  Detailed Timing Descriptors:
    DTD 1:  1280x800    61.175240 Hz  16:10    50.347 kHz     72.500000 MHz (286 mm x 178 mm)
                 Hfront   48 Hsync  32 Hback   80 Hpol N
                 Vfront    3 Vsync   6 Vback   14 Vpol N
    Manufacturer-Specified Display Descriptor (0x01): 00 01 00 06 10 20 00 00 00 00 00 00 00 00 0a 20 '..... ......... '
    Alphanumeric Data String: 'N133I6-L08'
    Display Product Name: 'Color LCD'
Checksum: 0x83

----------------

Failures:

Block 0, Base EDID:
  Missing Display Range Limits Descriptor.
EDID:
  Extension Block 1 started with EDID header, ignoring Extension Blocks >= 1.

EDID conformity: FAIL
