edid-decode (hex):

00 ff ff ff ff ff ff 00 06 af 6c 10 00 00 00 00
00 14 01 04 90 1c 10 78 02 20 e5 92 55 54 92 28
25 50 54 00 00 00 01 01 01 01 01 01 01 01 01 01
01 01 01 01 01 01 12 1b 56 58 50 00 19 30 30 20
36 00 15 9c 10 00 00 1a 0c 12 56 58 50 00 19 30
30 20 36 00 15 9c 10 00 00 1a 00 00 00 fe 00 4e
48 36 32 37 80 42 31 32 35 58 57 31 00 00 00 00
00 00 41 21 94 00 11 00 00 01 01 0a 20 20 00 58

----------------

Block 0, Base EDID:
  EDID Structure Version & Revision: 1.4
  Vendor & Product Identification:
    Manufacturer: AUO
    Model: 4204
    Made in: 2010
  Basic Display Parameters & Features:
    Digital display
    Bits per primary color channel: 6
    Digital interface is not defined
    Maximum image size: 28 cm x 16 cm
    Gamma: 2.20
    Supported color formats: RGB 4:4:4
    First detailed timing includes the native pixel format and preferred refresh rate
  Color Characteristics:
    Red  : 0.5703, 0.3339
    Green: 0.3281, 0.5703
    Blue : 0.1591, 0.1464
    White: 0.3134, 0.3291
  Established Timings I & II: none
  Standard Timings: none
  Detailed Timing Descriptors:
    DTD 1:  1366x768    60.102930 Hz 683:384   47.662 kHz     69.300000 MHz (277 mm x 156 mm)
                 Hfront   48 Hsync  32 Hback    8 Hpol P
                 Vfront    3 Vsync   6 Vback   16 Vpol N
    DTD 2:  1366x768    40.068620 Hz 683:384   31.774 kHz     46.200000 MHz (277 mm x 156 mm)
                 Hfront   48 Hsync  32 Hback    8 Hpol P
                 Vfront    3 Vsync   6 Vback   16 Vpol N
    Alphanumeric Data String: 'NH627.B125XW1'
    Manufacturer-Specified Display Descriptor (0x00): 00 00 00 00 41 21 94 00 11 00 00 01 01 0a 20 20 '....A!........  '
Checksum: 0x58

----------------

Warnings:

Block 0, Base EDID:
  Alphanumeric Data String: Non-ASCII character 0x80 at position 5, can cause problems.
  Missing Display Product Name.

EDID conformity: PASS
