edid-decode (hex):

00 ff ff ff ff ff ff 00 06 af 6c 10 00 00 00 00
12 1a 01 04 95 1c 10 78 02 76 05 93 57 58 92 29
21 50 54 00 00 00 01 01 01 01 01 01 01 01 01 01
01 01 01 01 01 01 fa 1e 56 e2 50 00 3c 30 26 16
36 00 14 9b 10 00 00 1a c8 18 56 e2 50 00 3c 30
26 16 36 00 14 9b 10 00 00 1a 00 00 00 fe 00 39
58 35 47 31 80 42 31 32 35 58 54 4e 00 00 00 00
00 00 41 01 94 00 11 00 00 09 01 0a 20 20 00 db

----------------

Block 0, Base EDID:
  EDID Structure Version & Revision: 1.4
  Vendor & Product Identification:
    Manufacturer: AUO
    Model: 4204
    Made in: week 18 of 2016
  Basic Display Parameters & Features:
    Digital display
    Bits per primary color channel: 6
    DisplayPort interface
    Maximum image size: 28 cm x 16 cm
    Gamma: 2.20
    Supported color formats: RGB 4:4:4
    First detailed timing includes the native pixel format and preferred refresh rate
  Color Characteristics:
    Red  : 0.5751, 0.3427
    Green: 0.3447, 0.5722
    Blue : 0.1601, 0.1289
    White: 0.3134, 0.3291
  Established Timings I & II: none
  Standard Timings: none
  Detailed Timing Descriptors:
    DTD 1:  1366x768    60.158886 Hz 683:384   49.812 kHz     79.300000 MHz (276 mm x 155 mm)
                 Hfront   38 Hsync  22 Hback  166 Hpol P
                 Vfront    3 Vsync   6 Vback   51 Vpol N
    DTD 2:  1366x768    48.127109 Hz 683:384   39.849 kHz     63.440000 MHz (276 mm x 155 mm)
                 Hfront   38 Hsync  22 Hback  166 Hpol P
                 Vfront    3 Vsync   6 Vback   51 Vpol N
    Alphanumeric Data String: '9X5G1.B125XTN'
    Manufacturer-Specified Display Descriptor (0x00): 00 00 00 00 41 01 94 00 11 00 00 09 01 0a 20 20 '....A.........  '
Checksum: 0xdb

----------------

Warnings:

Block 0, Base EDID:
  Alphanumeric Data String: Non-ASCII character 0x80 at position 5, can cause problems.
  Missing Display Product Name.

EDID conformity: PASS
