edid-decode (hex):

00 ff ff ff ff ff ff 00 06 af 6c 10 00 00 00 00
00 15 01 04 90 1c 10 78 02 20 e5 92 55 54 92 28
25 50 54 00 00 00 01 01 01 01 01 01 01 01 01 01
01 01 01 01 01 01 12 1b 56 64 50 00 12 30 30 20
6c 00 15 9c 10 00 00 1a 12 1b 56 3e 52 00 7c 30
36 20 6c 00 15 9c 10 00 00 1a 00 00 00 fe 00 38
58 39 4b 54 80 42 31 32 35 58 57 31 00 00 00 00
00 00 41 21 96 00 10 00 00 01 01 0a 20 20 00 52

----------------

Block 0, Base EDID:
  EDID Structure Version & Revision: 1.4
  Vendor & Product Identification:
    Manufacturer: AUO
    Model: 4204
    Made in: 2011
  Basic Display Parameters & Features:
    Digital display
    Bits per primary color channel: 6
    Digital interface is not defined
    Maximum image size: 28 cm x 16 cm
    Gamma: 2.20
    Supported color formats: RGB 4:4:4
    First detailed timing includes the native pixel format and preferred refresh rate
  Color Characteristics:
    Red  : 0.5703, 0.3339
    Green: 0.3281, 0.5703
    Blue : 0.1591, 0.1464
    White: 0.3134, 0.3291
  Established Timings I & II: none
  Standard Timings: none
  Detailed Timing Descriptors:
    DTD 1:  1366x768    60.141841 Hz 683:384   47.271 kHz     69.300000 MHz (277 mm x 156 mm)
                 Hfront   48 Hsync  32 Hback   20 Hpol P
                 Vfront    6 Vsync  12 Vback    0 Vpol N
    DTD 2:  1366x768    40.046692 Hz 683:384   35.722 kHz     69.300000 MHz (277 mm x 156 mm)
                 Hfront   54 Hsync  32 Hback  488 Hpol P
                 Vfront    6 Vsync  12 Vback  106 Vpol N
    Alphanumeric Data String: '8X9KT.B125XW1'
    Manufacturer-Specified Display Descriptor (0x00): 00 00 00 00 41 21 96 00 10 00 00 01 01 0a 20 20 '....A!........  '
Checksum: 0x52

----------------

Warnings:

Block 0, Base EDID:
  Alphanumeric Data String: Non-ASCII character 0x80 at position 5, can cause problems.
  Missing Display Product Name.

Failures:

Block 0, Base EDID:
  Detailed Timing Descriptor #1: 0 or negative vertical back porch.

EDID conformity: FAIL
