edid-decode (hex):

00 ff ff ff ff ff ff 00 4d 67 71 27 00 00 00 00
0a 23 01 03 80 3c 21 78 2b 1d f5 ae 4f 35 b3 25
0d 50 54 25 4b 80 81 c0 81 40 81 80 95 00 b3 00
d1 c0 01 01 01 01 6a 5e 00 a0 a0 a0 29 50 30 20
35 00 13 2a 21 00 00 1e 00 00 00 fd 00 30 64 17
64 2d 00 0a 20 20 20 20 20 20 40 9c 00 8c a0 a0
2a 50 30 20 35 00 0f 28 21 00 00 1e 00 00 00 fc
00 44 45 58 50 20 44 51 32 37 4e 32 0a 20 01 34

02 03 45 f1 4c 10 1f 05 14 45 44 02 11 01 12 04
3f 23 09 07 07 83 01 00 00 67 03 0c 00 10 00 38
78 67 d8 5d c4 01 50 80 03 6d 1a 00 00 02 01 30
64 e6 00 00 00 00 00 e3 05 e3 01 e6 06 07 01 62
62 2f e2 00 d5 02 3a 80 18 71 38 2d 40 58 2c 45
00 55 50 21 00 00 1e 83 48 80 18 71 38 2d 40 58
2c 45 00 0f 28 21 00 00 1e 00 00 00 00 00 00 00
00 00 00 00 00 00 00 00 00 00 00 00 00 00 00 5a

00 ff ff ff ff ff ff 00 4d 67 71 27 00 00 00 00
0a 23 01 03 80 3c 21 78 2b 1d f5 ae 4f 35 b3 25
0d 50 54 25 4b 80 81 c0 81 40 81 80 95 00 b3 00
d1 c0 01 01 01 01 6a 5e 00 a0 a0 a0 29 50 30 20
35 00 13 2a 21 00 00 1e 00 00 00 fd 00 30 64 17
64 2d 00 0a 20 20 20 20 20 20 40 9c 00 8c a0 a0
2a 50 30 20 35 00 0f 28 21 00 00 1e 00 00 00 fc
00 44 45 58 50 20 44 51 32 37 4e 32 0a 20 01 34

02 03 45 f1 4c 10 1f 05 14 45 44 02 11 01 12 04
3f 23 09 07 07 83 01 00 00 67 03 0c 00 10 00 38
78 67 d8 5d c4 01 50 80 03 6d 1a 00 00 02 01 30
64 e6 00 00 00 00 00 e3 05 e3 01 e6 06 07 01 62
62 2f e2 00 d5 02 3a 80 18 71 38 2d 40 58 2c 45
00 55 50 21 00 00 1e 83 48 80 18 71 38 2d 40 58
2c 45 00 0f 28 21 00 00 1e 00 00 00 00 00 00 00
00 00 00 00 00 00 00 00 00 00 00 00 00 00 00 5a

----------------

Block 0, Base EDID:
  EDID Structure Version & Revision: 1.3
  Vendor & Product Identification:
    Manufacturer: SKG
    Model: 10097
    Made in: week 10 of 2025
  Basic Display Parameters & Features:
    Digital display
    Maximum image size: 60 cm x 33 cm
    Gamma: 2.20
    DPMS levels: Off
    RGB color display
    First detailed timing is the preferred timing
    Supports GTF timings within operating range
  Color Characteristics:
    Red  : 0.6796, 0.3095
    Green: 0.2099, 0.7001
    Blue : 0.1474, 0.0537
    White: 0.3134, 0.3291
  Established Timings I & II:
    DMT 0x04:   640x480    59.940476 Hz   4:3     31.469 kHz     25.175000 MHz
    DMT 0x06:   640x480    75.000000 Hz   4:3     37.500 kHz     31.500000 MHz
    DMT 0x09:   800x600    60.316541 Hz   4:3     37.879 kHz     40.000000 MHz
    DMT 0x0b:   800x600    75.000000 Hz   4:3     46.875 kHz     49.500000 MHz
    DMT 0x10:  1024x768    60.003840 Hz   4:3     48.363 kHz     65.000000 MHz
    DMT 0x12:  1024x768    75.028582 Hz   4:3     60.023 kHz     78.750000 MHz
    DMT 0x24:  1280x1024   75.024675 Hz   5:4     79.976 kHz    135.000000 MHz
    Apple   :  1152x870    75.061550 Hz 192:145   68.681 kHz    100.000000 MHz
  Standard Timings:
    DMT 0x55:  1280x720    60.000000 Hz  16:9     45.000 kHz     74.250000 MHz
    DMT 0x20:  1280x960    60.000000 Hz   4:3     60.000 kHz    108.000000 MHz
    DMT 0x23:  1280x1024   60.019740 Hz   5:4     63.981 kHz    108.000000 MHz
    DMT 0x2f:  1440x900    59.887445 Hz  16:10    55.935 kHz    106.500000 MHz
    DMT 0x3a:  1680x1050   59.954250 Hz  16:10    65.290 kHz    146.250000 MHz
    DMT 0x52:  1920x1080   60.000000 Hz  16:9     67.500 kHz    148.500000 MHz
  Detailed Timing Descriptors:
    DTD 1:  2560x1440   60.000199 Hz  16:9     88.860 kHz    241.700000 MHz (531 mm x 298 mm)
                 Hfront   48 Hsync  32 Hback   80 Hpol P
                 Vfront    3 Vsync   5 Vback   33 Vpol P
    Display Range Limits:
      Monitor ranges (GTF): 48-100 Hz V, 23-100 kHz H, max dotclock 450 MHz
    DTD 2:  2560x1440   99.965012 Hz  16:9    148.148 kHz    400.000000 MHz (527 mm x 296 mm)
                 Hfront   48 Hsync  32 Hback   60 Hpol P
                 Vfront    3 Vsync   5 Vback   34 Vpol P
    Display Product Name: 'DEXP DQ27N2'
  Extension blocks: 1
Checksum: 0x34

----------------

Block 1, CTA-861 Extension Block:
  Revision: 3
  Underscans IT Video Formats by default
  Basic audio support
  Supports YCbCr 4:4:4
  Supports YCbCr 4:2:2
  Native DTDs: 1
  Video Data Block:
    VIC  16:  1920x1080   60.000000 Hz  16:9     67.500 kHz    148.500000 MHz
    VIC  31:  1920x1080   50.000000 Hz  16:9     56.250 kHz    148.500000 MHz
    VIC   5:  1920x1080i  60.000000 Hz  16:9     33.750 kHz     74.250000 MHz
    VIC  20:  1920x1080i  50.000000 Hz  16:9     28.125 kHz     74.250000 MHz
    VIC  69:  1280x720    60.000000 Hz  64:27    45.000 kHz     74.250000 MHz
    VIC  68:  1280x720    50.000000 Hz  64:27    37.500 kHz     74.250000 MHz
    VIC   2:   720x480    59.940060 Hz   4:3     31.469 kHz     27.000000 MHz
    VIC  17:   720x576    50.000000 Hz   4:3     31.250 kHz     27.000000 MHz
    VIC   1:   640x480    59.940476 Hz   4:3     31.469 kHz     25.175000 MHz
    VIC  18:   720x576    50.000000 Hz  16:9     31.250 kHz     27.000000 MHz
    VIC   4:  1280x720    60.000000 Hz  16:9     45.000 kHz     74.250000 MHz
    VIC  63:  1920x1080  120.000000 Hz  16:9    135.000 kHz    297.000000 MHz
  Audio Data Block:
    Linear PCM:
      Max channels: 2
      Supported sample rates (kHz): 48 44.1 32
      Supported sample sizes (bits): 24 20 16
  Speaker Allocation Data Block:
    FL/FR - Front Left/Right
  Vendor-Specific Data Block (HDMI), OUI 00-0C-03:
    Source physical address: 1.0.0.0
    DC_36bit
    DC_30bit
    DC_Y444
    Maximum TMDS clock: 600 MHz
  Vendor-Specific Data Block (HDMI Forum), OUI C4-5D-D8:
    Version: 1
    Maximum TMDS Character Rate: 400 MHz
    SCDC Present
    Supports 12-bits/component Deep Color 4:2:0 Pixel Encoding
    Supports 10-bits/component Deep Color 4:2:0 Pixel Encoding
  Vendor-Specific Data Block (AMD), OUI 00-00-1A:
    Version: 2
    Feature Caps: 0x01
    Minimum Refresh Rate: 48 Hz
    Maximum Refresh Rate: 100 Hz
    Flags 1.x: 0xe6 (MCCS)
    Flags 2.x: 0x00
  Colorimetry Data Block:
    xvYCC601
    xvYCC709
    BT2020cYCC
    BT2020YCC
    BT2020RGB
    Gamut Boundary Description Metadata Profile P0
  HDR Static Metadata Data Block:
    Electro optical transfer functions:
      Traditional gamma - SDR luminance range
      Traditional gamma - HDR luminance range
      SMPTE ST2084
    Supported static metadata descriptors:
      Static metadata type 1
    Desired content max luminance: 98 (417.710 cd/m^2)
    Desired content max frame-average luminance: 98 (417.710 cd/m^2)
    Desired content min luminance: 47 (0.142 cd/m^2)
  Video Capability Data Block:
    YCbCr quantization: Selectable (via AVI YQ)
    RGB quantization: Selectable (via AVI Q)
    PT scan behavior: Always Overscanned
    IT scan behavior: Always Overscanned
    CE scan behavior: Always Overscanned
  Detailed Timing Descriptors:
    DTD 3:  1920x1080   60.000000 Hz  16:9     67.500 kHz    148.500000 MHz (597 mm x 336 mm)
                 Hfront   88 Hsync  44 Hback  148 Hpol P
                 Vfront    4 Vsync   5 Vback   36 Vpol P
    DTD 4:  1920x1080   75.002020 Hz  16:9     84.377 kHz    185.630000 MHz (527 mm x 296 mm)
                 Hfront   88 Hsync  44 Hback  148 Hpol P
                 Vfront    4 Vsync   5 Vback   36 Vpol P
Checksum: 0x5a  Unused space in Extension Block: 22 bytes

----------------

Warnings:

Block 1, CTA-861 Extension Block:
  Video Data Block: VIC 16 and the first DTD are not identical. Is this intended?
  Colorimetry Data Block: Set the sRGB colorimetry bit to avoid interop issues.
  Video Capability Data Block: IT scan behavior is expected to support underscanned.
  Video Capability Data Block: S_PT is equal to S_IT and S_CE, so should be set to 0 instead.
EDID:
  Base EDID: Some timings are out of range of the Monitor Ranges:
    Vertical Freq: 50.000 - 120.000 Hz (Monitor: 48.000 - 100.000 Hz)
    Horizontal Freq: 28.125 - 148.148 kHz (Monitor: 23.000 - 100.000 kHz)

Failures:

Block 0, Base EDID:
  Detailed Timing Descriptor #1: Mismatch of image size 531x298 mm vs display size 600x330 mm.
  Detailed Timing Descriptor #2: Mismatch of image size 527x296 mm vs display size 600x330 mm.
  Detailed Timing Descriptor #2: Invalid detailed timing descriptor ordering.
Block 1, CTA-861 Extension Block:
  Vendor-Specific Data Block (HDMI), OUI 00-0C-03: HDMI VSDB Max TMDS rate is > 340.
  Vendor-Specific Data Block (HDMI Forum), OUI C4-5D-D8: HDMI Forum VSDB rate < HDMI VSDB rate.
  Video Capability Data Block: IT video formats are always overscanned, but bit 7 of Byte 3 of the CTA-861 Extension header is set to underscanned.
  Detailed Timing Descriptor #4: Mismatch of image size 527x296 mm vs display size 600x330 mm.
EDID:
  Extension Block 2 started with EDID header, ignoring Extension Blocks >= 2.

EDID conformity: FAIL
