edid-decode (hex):

00 ff ff ff ff ff ff 00 06 af 99 13 00 00 00 00
02 1f 01 04 95 1f 11 78 02 c0 d5 8f 56 58 93 29
20 50 54 00 00 00 01 01 01 01 01 01 01 01 01 01
01 01 01 01 01 01 ce 1d 56 e2 50 00 1e 30 26 16
36 00 35 ae 10 00 00 1a d8 17 56 e2 50 00 1e 30
26 16 36 00 35 ae 10 00 00 1a 00 00 00 fe 00 43
44 4a 4a 38 80 42 31 34 30 58 54 4e 00 00 00 00
00 01 81 22 a8 00 11 00 00 09 01 0a 20 20 00 07

00 ff ff ff ff ff ff 00 06 af 99 13 00 00 00 00
02 1f 01 04 95 1f 11 78 02 c0 d5 8f 56 58 93 29
20 50 54 00 00 00 01 01 01 01 01 01 01 01 01 01
01 01 01 01 01 01 ce 1d 56 e2 50 00 1e 30 26 16
36 00 35 ae 10 00 00 1a d8 17 56 e2 50 00 1e 30
26 16 36 00 35 ae 10 00 00 1a 00 00 00 fe 00 43
44 4a 4a 38 80 42 31 34 30 58 54 4e 00 00 00 00
00 01 81 22 a8 00 11 00 00 09 01 0a 20 20 00 07

----------------

Block 0, Base EDID:
  EDID Structure Version & Revision: 1.4
  Vendor & Product Identification:
    Manufacturer: AUO
    Model: 5017
    Made in: week 2 of 2021
  Basic Display Parameters & Features:
    Digital display
    Bits per primary color channel: 6
    DisplayPort interface
    Maximum image size: 31 cm x 17 cm
    Gamma: 2.20
    Supported color formats: RGB 4:4:4
    First detailed timing includes the native pixel format and preferred refresh rate
  Color Characteristics:
    Red  : 0.5615, 0.3359
    Green: 0.3437, 0.5742
    Blue : 0.1630, 0.1259
    White: 0.3134, 0.3291
  Established Timings I & II: none
  Standard Timings: none
  Detailed Timing Descriptors:
    DTD 1:  1366x768    60.059067 Hz 683:384   47.927 kHz     76.300000 MHz (309 mm x 174 mm)
                 Hfront   38 Hsync  22 Hback  166 Hpol P
                 Vfront    3 Vsync   6 Vback   21 Vpol N
    DTD 2:  1366x768    48.047254 Hz 683:384   38.342 kHz     61.040000 MHz (309 mm x 174 mm)
                 Hfront   38 Hsync  22 Hback  166 Hpol P
                 Vfront    3 Vsync   6 Vback   21 Vpol N
    Alphanumeric Data String: 'CDJJ8.B140XTN'
    Manufacturer-Specified Display Descriptor (0x00): 00 00 00 01 81 22 a8 00 11 00 00 09 01 0a 20 20 '....."........  '
Checksum: 0x07

----------------

Warnings:

Block 0, Base EDID:
  Alphanumeric Data String: Non-ASCII character 0x80 at position 5, can cause problems.
  Missing Display Product Name.

Failures:

EDID:
  Extension Block 1 started with EDID header, ignoring Extension Blocks >= 1.

EDID conformity: FAIL
