edid-decode (hex):

00 ff ff ff ff ff ff 00 28 9a 07 02 00 00 00 00
1e 21 01 04 a5 26 16 78 07 9e 05 94 5c 59 95 2b
23 50 54 00 00 00 01 01 01 01 01 01 01 01 01 01
01 01 01 01 01 01 38 70 80 b4 70 38 3c 40 30 20
35 00 7e d7 10 00 00 1a 1c 38 80 b4 70 38 3c 40
30 20 36 00 7e d7 10 00 00 00 00 00 00 fe 00 47
31 37 33 45 43 30 31 0a 20 20 20 20 00 00 00 fe
00 47 31 37 33 45 43 30 31 0a 20 20 20 20 00 d3

00 ff ff ff ff ff ff 00 28 9a 07 02 00 00 00 00
1e 21 01 04 a5 26 16 78 07 9e 05 94 5c 59 95 2b
23 50 54 00 00 00 01 01 01 01 01 01 01 01 01 01
01 01 01 01 01 01 38 70 80 b4 70 38 3c 40 30 20
35 00 7e d7 10 00 00 1a 1c 38 80 b4 70 38 3c 40
30 20 36 00 7e d7 10 00 00 00 00 00 00 fe 00 47
31 37 33 45 43 30 31 0a 20 20 20 20 00 00 00 fe
00 47 31 37 33 45 43 30 31 0a 20 20 20 20 00 d3

----------------

Block 0, Base EDID:
  EDID Structure Version & Revision: 1.4
  Vendor & Product Identification:
    Manufacturer: JDZ
    Model: 519
    Made in: week 30 of 2023
  Basic Display Parameters & Features:
    Digital display
    Bits per primary color channel: 8
    DisplayPort interface
    Maximum image size: 38 cm x 22 cm
    Gamma: 2.20
    Supported color formats: RGB 4:4:4
    Default (sRGB) color space is primary color space
    First detailed timing includes the native pixel format and preferred refresh rate
    Display supports continuous frequencies
  Color Characteristics:
    Red  : 0.5800, 0.3603
    Green: 0.3505, 0.5839
    Blue : 0.1679, 0.1367
    White: 0.3134, 0.3291
  Established Timings I & II: none
  Standard Timings: none
  Detailed Timing Descriptors:
    DTD 1:  1920x1080  120.000000 Hz  16:9    136.800 kHz    287.280000 MHz (382 mm x 215 mm)
                 Hfront   48 Hsync  32 Hback  100 Hpol P
                 Vfront    3 Vsync   5 Vback   52 Vpol N
    DTD 2:  1920x1080   60.000000 Hz  16:9     68.400 kHz    143.640000 MHz (analog composite, sync-on-green, 382 mm x 215 mm)
                 Hfront   48 Hsync  32 Hback  100 Hpol N
                 Vfront    3 Vsync   6 Vback   51 Vpol N
    Alphanumeric Data String: 'G173EC01'
    Alphanumeric Data String: 'G173EC01'
Checksum: 0xd3

----------------

Warnings:

Block 0, Base EDID:
  Missing Display Product Name.

Failures:

Block 0, Base EDID:
  Basic Display Parameters & Features: sRGB is signaled, but the chromaticities do not match.
  Missing Display Range Limits Descriptor.
EDID:
  Extension Block 1 started with EDID header, ignoring Extension Blocks >= 1.

EDID conformity: FAIL
