edid-decode (hex):

00 ff ff ff ff ff ff 00 4e 14 07 6c 01 01 01 01
0d 1f 01 04 b5 3c 21 78 29 c1 b6 a4 56 4e 9d 23
10 50 54 21 08 00 d1 c0 b3 00 a9 c0 01 01 01 01
81 40 81 80 81 c0 02 3a 80 18 71 38 2d 40 58 2c
3a 00 56 50 21 00 00 1e 00 00 00 fd 00 30 a5 ba
ba 2b 01 0a 20 20 20 20 20 20 00 00 00 fc 00 53
63 65 70 74 72 65 20 4d 32 37 0a 20 00 00 00 ff
00 20 20 20 20 20 20 20 20 20 20 20 20 0a 01 14

02 03 25 f1 4a 11 12 04 03 02 01 1f 13 05 3f 23
09 07 07 83 01 00 00 6d 1a 00 00 02 01 30 a5 00
00 00 00 00 00 38 8b 80 18 71 38 2d 40 58 2c 3a
00 c4 8e 21 00 00 1e 49 96 80 a0 70 38 29 40 3c
30 35 00 c4 8e 21 00 00 1e ae 60 80 18 71 38 2d
40 58 2c 3a 00 c4 8e 21 00 00 1e 4a 23 a0 a0 50
84 29 30 30 20 35 00 00 00 00 00 00 1e 00 00 00
00 00 00 00 00 00 00 00 00 00 00 00 00 00 00 51

00 ff ff ff ff ff ff 00 4e 14 07 6c 01 01 01 01
0d 1f 01 04 b5 3c 21 78 29 c1 b6 a4 56 4e 9d 23
10 50 54 21 08 00 d1 c0 b3 00 a9 c0 01 01 01 01
81 40 81 80 81 c0 02 3a 80 18 71 38 2d 40 58 2c
3a 00 56 50 21 00 00 1e 00 00 00 fd 00 30 a5 ba
ba 2b 01 0a 20 20 20 20 20 20 00 00 00 fc 00 53
63 65 70 74 72 65 20 4d 32 37 0a 20 00 00 00 ff
00 20 20 20 20 20 20 20 20 20 20 20 20 0a 01 14

02 03 25 f1 4a 11 12 04 03 02 01 1f 13 05 3f 23
09 07 07 83 01 00 00 6d 1a 00 00 02 01 30 a5 00
00 00 00 00 00 38 8b 80 18 71 38 2d 40 58 2c 3a
00 c4 8e 21 00 00 1e 49 96 80 a0 70 38 29 40 3c
30 35 00 c4 8e 21 00 00 1e ae 60 80 18 71 38 2d
40 58 2c 3a 00 c4 8e 21 00 00 1e 4a 23 a0 a0 50
84 29 30 30 20 35 00 00 00 00 00 00 1e 00 00 00
00 00 00 00 00 00 00 00 00 00 00 00 00 00 00 51

----------------

Block 0, Base EDID:
  EDID Structure Version & Revision: 1.4
  Vendor & Product Identification:
    Manufacturer: SPT
    Model: 27655
    Serial Number: ...
    Made in: week 13 of 2021
  Basic Display Parameters & Features:
    Digital display
    Bits per primary color channel: 10
    DisplayPort interface
    Maximum image size: 60 cm x 33 cm
    Gamma: 2.20
    DPMS levels: Off
    Supported color formats: RGB 4:4:4, YCrCb 4:4:4
    First detailed timing does not include the native pixel format and preferred refresh rate
    Display supports continuous frequencies
  Color Characteristics:
    Red  : 0.6435, 0.3359
    Green: 0.3046, 0.6142
    Blue : 0.1386, 0.0654
    White: 0.3134, 0.3300
  Established Timings I & II:
    DMT 0x04:   640x480    59.940476 Hz   4:3     31.469 kHz     25.175000 MHz
    DMT 0x09:   800x600    60.316541 Hz   4:3     37.879 kHz     40.000000 MHz
    DMT 0x10:  1024x768    60.003840 Hz   4:3     48.363 kHz     65.000000 MHz
  Standard Timings:
    DMT 0x52:  1920x1080   60.000000 Hz  16:9     67.500 kHz    148.500000 MHz
    DMT 0x3a:  1680x1050   59.954250 Hz  16:10    65.290 kHz    146.250000 MHz
    DMT 0x53:  1600x900    60.000000 Hz  16:9     60.000 kHz    108.000000 MHz (RB)
    DMT 0x20:  1280x960    60.000000 Hz   4:3     60.000 kHz    108.000000 MHz
    DMT 0x23:  1280x1024   60.019740 Hz   5:4     63.981 kHz    108.000000 MHz
    DMT 0x55:  1280x720    60.000000 Hz  16:9     45.000 kHz     74.250000 MHz
  Detailed Timing Descriptors:
    DTD 1:  1920x1080   60.000000 Hz  16:9     67.500 kHz    148.500000 MHz (598 mm x 336 mm)
                 Hfront   88 Hsync  44 Hback  148 Hpol P
                 Vfront    3 Vsync  10 Vback   32 Vpol P
    Display Range Limits:
      Monitor ranges (Range Limits Only): 48-165 Hz V, 186-186 kHz H, max dotclock 430 MHz
    Display Product Name: 'Sceptre M27'
    Display Product Serial Number: ...
  Extension blocks: 1
Checksum: 0x14

----------------

Block 1, CTA-861 Extension Block:
  Revision: 3
  Underscans IT Video Formats by default
  Basic audio support
  Supports YCbCr 4:4:4
  Supports YCbCr 4:2:2
  Native DTDs: 1
  Video Data Block:
    VIC  17:   720x576    50.000000 Hz   4:3     31.250 kHz     27.000000 MHz
    VIC  18:   720x576    50.000000 Hz  16:9     31.250 kHz     27.000000 MHz
    VIC   4:  1280x720    60.000000 Hz  16:9     45.000 kHz     74.250000 MHz
    VIC   3:   720x480    59.940060 Hz  16:9     31.469 kHz     27.000000 MHz
    VIC   2:   720x480    59.940060 Hz   4:3     31.469 kHz     27.000000 MHz
    VIC   1:   640x480    59.940476 Hz   4:3     31.469 kHz     25.175000 MHz
    VIC  31:  1920x1080   50.000000 Hz  16:9     56.250 kHz    148.500000 MHz
    VIC  19:  1280x720    50.000000 Hz  16:9     37.500 kHz     74.250000 MHz
    VIC   5:  1920x1080i  60.000000 Hz  16:9     33.750 kHz     74.250000 MHz
    VIC  63:  1920x1080  120.000000 Hz  16:9    135.000 kHz    297.000000 MHz
  Audio Data Block:
    Linear PCM:
      Max channels: 2
      Supported sample rates (kHz): 48 44.1 32
      Supported sample sizes (bits): 24 20 16
  Speaker Allocation Data Block:
    FL/FR - Front Left/Right
  Vendor-Specific Data Block (AMD), OUI 00-00-1A:
    Version: 2
    Flags 1: 0x01
      FreeSync Supported
    Minimum Refresh Rate: 48 Hz
    Maximum Refresh Rate: 165 Hz
    Flags 5: 0x00
  Detailed Timing Descriptors:
    DTD 2:  1920x1080  144.000000 Hz  16:9    162.000 kHz    356.400000 MHz (708 mm x 398 mm)
                 Hfront   88 Hsync  44 Hback  148 Hpol P
                 Vfront    3 Vsync  10 Vback   32 Vpol P
    DTD 3:  1920x1080  165.001201 Hz  16:9    184.966 kHz    384.730000 MHz (708 mm x 398 mm)
                 Hfront   60 Hsync  48 Hback   52 Hpol P
                 Vfront    3 Vsync   5 Vback   33 Vpol P
    DTD 4:  1920x1080  100.000000 Hz  16:9    112.500 kHz    247.500000 MHz (708 mm x 398 mm)
                 Hfront   88 Hsync  44 Hback  148 Hpol P
                 Vfront    3 Vsync  10 Vback   32 Vpol P
    DTD 5:  1440x900    60.002657 Hz  16:10    56.462 kHz     90.340000 MHz
                 Hfront   48 Hsync  32 Hback   80 Hpol P
                 Vfront    3 Vsync   5 Vback   33 Vpol P
Checksum: 0x51  Unused space in Extension Block: 18 bytes

----------------

Warnings:

Block 0, Base EDID:
  Vendor & Product Identification: The serial number is one of the known dummy values, it should probably be set to 0.
  Detailed Timing Descriptor #1: DTD is similar but not identical to VIC 16.
  Display Product Serial Number: ...
Block 1, CTA-861 Extension Block:
  Video Data Block: VIC 17 and the first DTD are not identical. Is this intended?
  Display Product Serial Number is set, so the Serial Number in the Base EDID should be 0.
  Add a Colorimetry Data Block with the sRGB colorimetry bit set to avoid interop issues.
EDID:
  Base EDID: Some timings are out of range of the Monitor Ranges:
    Horizontal Freq: 31.250 - 184.966 kHz (Monitor: 186.000 - 186.000 kHz)

Failures:

Block 0, Base EDID:
  Display Product Serial Number: ...
Block 1, CTA-861 Extension Block:
  Detailed Timing Descriptor #2: Mismatch of image size 708x398 mm vs display size 600x330 mm.
  Detailed Timing Descriptor #3: Mismatch of image size 708x398 mm vs display size 600x330 mm.
  Detailed Timing Descriptor #4: Mismatch of image size 708x398 mm vs display size 600x330 mm.
  Detailed Timing Descriptor #5: Mismatch of image size vs display size: image size is not set, but display size is.
  Missing VCDB, needed for Set Selectable RGB Quantization to avoid interop issues.
EDID:
  Extension Block 2 started with EDID header, ignoring Extension Blocks >= 2.
  Base EDID: The DTD max image size is 708x398mm, which is larger than the display size 600.0x330.0mm.

EDID conformity: FAIL
