edid-decode (hex):

00 ff ff ff ff ff ff 00 0e 77 4b 14 00 00 00 00
25 22 01 04 a5 1f 11 78 03 2c c5 94 5c 59 95 29
1e 50 54 00 00 00 01 01 01 01 01 01 01 01 01 01
01 01 01 01 01 01 9a 36 80 a0 70 38 28 40 30 20
36 00 35 ae 10 00 00 1a 00 00 00 fd 00 28 3c 43
43 0e 01 0a 20 20 20 20 20 20 ae 2b 80 a0 70 38
28 40 30 20 36 00 35 ae 10 00 00 1a 00 00 00 fc
00 4d 4e 45 30 30 31 42 53 31 2d 34 0a 20 01 0e

70 20 79 02 00 81 00 1e 72 1a 00 00 03 01 28 3c
00 00 53 ff 53 ff 3c 00 00 00 00 e3 05 04 00 e6
06 01 01 53 53 ff 2b 00 06 27 00 28 3b 00 00 00
00 00 00 00 00 00 00 00 00 00 00 00 00 00 00 00
00 00 00 00 00 00 00 00 00 00 00 00 00 00 00 00
00 00 00 00 00 00 00 00 00 00 00 00 00 00 00 00
00 00 00 00 00 00 00 00 00 00 00 00 00 00 00 00
00 00 00 00 00 00 00 00 00 00 00 00 00 00 b8 90

00 ff ff ff ff ff ff 00 0e 77 4b 14 00 00 00 00
25 22 01 04 a5 1f 11 78 03 2c c5 94 5c 59 95 29
1e 50 54 00 00 00 01 01 01 01 01 01 01 01 01 01
01 01 01 01 01 01 9a 36 80 a0 70 38 28 40 30 20
36 00 35 ae 10 00 00 1a 00 00 00 fd 00 28 3c 43
43 0e 01 0a 20 20 20 20 20 20 ae 2b 80 a0 70 38
28 40 30 20 36 00 35 ae 10 00 00 1a 00 00 00 fc
00 4d 4e 45 30 30 31 42 53 31 2d 34 0a 20 01 0e

70 20 79 02 00 81 00 1e 72 1a 00 00 03 01 28 3c
00 00 53 ff 53 ff 3c 00 00 00 00 e3 05 04 00 e6
06 01 01 53 53 ff 2b 00 06 27 00 28 3b 00 00 00
00 00 00 00 00 00 00 00 00 00 00 00 00 00 00 00
00 00 00 00 00 00 00 00 00 00 00 00 00 00 00 00
00 00 00 00 00 00 00 00 00 00 00 00 00 00 00 00
00 00 00 00 00 00 00 00 00 00 00 00 00 00 00 00
00 00 00 00 00 00 00 00 00 00 00 00 00 00 b8 90

----------------

Block 0, Base EDID:
  EDID Structure Version & Revision: 1.4
  Vendor & Product Identification:
    Manufacturer: CSW
    Model: 5195
    Made in: week 37 of 2024
  Basic Display Parameters & Features:
    Digital display
    Bits per primary color channel: 8
    DisplayPort interface
    Maximum image size: 31 cm x 17 cm
    Gamma: 2.20
    Supported color formats: RGB 4:4:4
    First detailed timing includes the native pixel format and preferred refresh rate
    Display supports continuous frequencies
  Color Characteristics:
    Red  : 0.5781, 0.3613
    Green: 0.3505, 0.5820
    Blue : 0.1630, 0.1171
    White: 0.3134, 0.3291
  Established Timings I & II: none
  Standard Timings: none
  Detailed Timing Descriptors:
    DTD 1:  1920x1080   60.001717 Hz  16:9     67.202 kHz    139.780000 MHz (309 mm x 174 mm)
                 Hfront   48 Hsync  32 Hback   80 Hpol P
                 Vfront    3 Vsync   6 Vback   31 Vpol N
    Display Range Limits:
      Monitor ranges (Range Limits Only): 40-60 Hz V, 67-67 kHz H, max dotclock 140 MHz
    DTD 2:  1920x1080   47.999657 Hz  16:9     53.760 kHz    111.820000 MHz (309 mm x 174 mm)
                 Hfront   48 Hsync  32 Hback   80 Hpol P
                 Vfront    3 Vsync   6 Vback   31 Vpol N
    Display Product Name: 'MNE001BS1-4'
  Extension blocks: 1
Checksum: 0x0e

----------------

Block 1, DisplayID Extension Block:
  Version: 2.0
  Extension Count: 0
  Display Product Primary Use Case: None of the listed primary use cases; generic display
  CTA-861 DisplayID Data Block:
  Vendor-Specific Data Block (AMD), OUI 00-00-1A:
    Version: 3
    Flags 1: 0x01
      FreeSync Supported
    Minimum Refresh Rate: 40 Hz
    Maximum Refresh Rate: 60 Hz
    Flags 5: 0x00
  Colorimetry Data Block:
    sYCC601
  HDR Static Metadata Data Block:
    Electro optical transfer functions:
      Traditional gamma - SDR luminance range
    Supported static metadata descriptors:
      Static metadata type 1
    Desired content max luminance: 83 (301.833 cd/m^2)
    Desired content max frame-average luminance: 83 (301.833 cd/m^2)
    Desired content min luminance: 255 (3.018 cd/m^2)
  Adaptive Sync Data Block:
    Descriptor #1:
      Native Panel Range
      Fixed Average V-Total and Adaptive V-Total
      Supports Seamless Transition
      'Max Single Frame Duration Increase' field value without jitter impact
      'Max Single Frame Duration Decrease' field value without jitter impact
      Max Duration Increase: 0.00 ms
      Max Duration Decrease: 0.00 ms
      Min Refresh Rate: 40 Hz
      Max Refresh Rate: 60 Hz
  Checksum: 0xb8
Checksum: 0x90

----------------

Warnings:

Block 1, DisplayID Extension Block:
  Colorimetry Data Block: Set the sRGB colorimetry bit to avoid interop issues.
EDID:
  Base EDID: Some timings are out of range of the Monitor Ranges:
    Horizontal Freq: 53.759 - 67.201 kHz (Monitor: 67.000 - 67.000 kHz)

Failures:

Block 0, Base EDID:
  Detailed Timing Descriptor #2: Invalid detailed timing descriptor ordering.
EDID:
  Extension Block 2 started with EDID header, ignoring Extension Blocks >= 2.
  DisplayID: Missing DisplayID Display Parameters Data Block.
  DisplayID: Missing DisplayID Type VII Detailed Timing Data Block.
  DisplayID: DisplayID expects at least one preferred timing.

EDID conformity: FAIL
