edid-decode (hex):

00 ff ff ff ff ff ff 00 1e 6d 7b 56 85 2c 01 00
0c 12 01 03 80 2f 1e 78 0a ae c5 a2 57 4a 9c 25
12 50 54 a5 6e 00 31 40 45 40 61 40 90 40 b3 00
81 80 01 01 01 01 6c 39 90 40 62 1a 25 40 68 b8
16 00 d9 28 11 00 00 1c 0e 21 50 a0 51 00 1b 30
40 90 15 00 d9 28 11 00 00 1c 00 00 00 fd 00 3a
4b 1f 54 12 00 0a 20 20 20 20 20 20 00 00 00 fc
00 32 32 4c 47 33 30 35 30 0a 20 20 20 20 01 89

02 03 25 f1 50 07 01 16 02 03 11 12 13 04 14 85
20 21 22 1f 10 23 09 07 07 83 01 00 10 67 03 0c
00 10 00 b8 2d 01 1d 00 72 51 d0 1e 20 38 88 15
00 d9 28 11 00 00 1e 01 1d 80 18 71 1c 16 20 58
2c 25 00 c4 8e 21 00 00 9e 8c 0a d0 8a 20 e0 2d
10 10 3e 96 00 c4 8e 21 00 00 18 8c 0a d0 8a 20
e0 2d 10 00 3e 96 00 13 8e 21 00 00 18 02 3a 80
18 71 38 2d 40 58 2c 45 00 06 44 21 00 00 1e fa

00 ff ff ff ff ff ff 00 1e 6d 7b 56 85 2c 01 00
0c 12 01 03 80 2f 1e 78 0a ae c5 a2 57 4a 9c 25
12 50 54 a5 6e 00 31 40 45 40 61 40 90 40 b3 00
81 80 01 01 01 01 6c 39 90 40 62 1a 25 40 68 b8
16 00 d9 28 11 00 00 1c 0e 21 50 a0 51 00 1b 30
40 90 15 00 d9 28 11 00 00 1c 00 00 00 fd 00 3a
4b 1f 54 12 00 0a 20 20 20 20 20 20 00 00 00 fc
00 32 32 4c 47 33 30 35 30 0a 20 20 20 20 01 89

02 03 25 f1 50 07 01 16 02 03 11 12 13 04 14 85
20 21 22 1f 10 23 09 07 07 83 01 00 10 67 03 0c
00 10 00 b8 2d 01 1d 00 72 51 d0 1e 20 38 88 15
00 d9 28 11 00 00 1e 01 1d 80 18 71 1c 16 20 58
2c 25 00 c4 8e 21 00 00 9e 8c 0a d0 8a 20 e0 2d
10 10 3e 96 00 c4 8e 21 00 00 18 8c 0a d0 8a 20
e0 2d 10 00 3e 96 00 13 8e 21 00 00 18 02 3a 80
18 71 38 2d 40 58 2c 45 00 06 44 21 00 00 1e fa

----------------

Block 0, Base EDID:
  EDID Structure Version & Revision: 1.3
  Vendor & Product Identification:
    Manufacturer: GSM
    Model: 22139
    Serial Number: ...
    Made in: week 12 of 2008
  Basic Display Parameters & Features:
    Digital display
    Maximum image size: 47 cm x 30 cm
    Gamma: 2.20
    RGB color display
    First detailed timing is the preferred timing
  Color Characteristics:
    Red  : 0.6347, 0.3417
    Green: 0.2919, 0.6113
    Blue : 0.1474, 0.0703
    White: 0.3134, 0.3291
  Established Timings I & II:
    IBM     :   720x400    70.081663 Hz   9:5     31.467 kHz     28.320000 MHz
    DMT 0x04:   640x480    59.940476 Hz   4:3     31.469 kHz     25.175000 MHz
    DMT 0x06:   640x480    75.000000 Hz   4:3     37.500 kHz     31.500000 MHz
    DMT 0x09:   800x600    60.316541 Hz   4:3     37.879 kHz     40.000000 MHz
    DMT 0x0b:   800x600    75.000000 Hz   4:3     46.875 kHz     49.500000 MHz
    Apple   :   832x624    74.551266 Hz   4:3     49.726 kHz     57.284000 MHz
    DMT 0x10:  1024x768    60.003840 Hz   4:3     48.363 kHz     65.000000 MHz
    DMT 0x11:  1024x768    70.069359 Hz   4:3     56.476 kHz     75.000000 MHz
    DMT 0x12:  1024x768    75.028582 Hz   4:3     60.023 kHz     78.750000 MHz
  Standard Timings:
    DMT 0x04:   640x480    59.940476 Hz   4:3     31.469 kHz     25.175000 MHz
    DMT 0x09:   800x600    60.316541 Hz   4:3     37.879 kHz     40.000000 MHz
    DMT 0x10:  1024x768    60.003840 Hz   4:3     48.363 kHz     65.000000 MHz
    DMT 0x2a:  1400x1050   59.978442 Hz   4:3     65.317 kHz    121.750000 MHz
    DMT 0x3a:  1680x1050   59.954250 Hz  16:10    65.290 kHz    146.250000 MHz
    DMT 0x23:  1280x1024   60.019740 Hz   5:4     63.981 kHz    108.000000 MHz
  Detailed Timing Descriptors:
    DTD  1:  1680x1050   59.944411 Hz  16:10    65.160 kHz    147.000000 MHz (473 mm x 296 mm)
                  Hfront  104 Hsync 184 Hback  288 Hpol N
                  Vfront    1 Vsync   6 Vback   30 Vpol P
    DTD  2:  1360x768    59.932574 Hz  85:48    47.646 kHz     84.620000 MHz (473 mm x 296 mm)
                  Hfront   64 Hsync 144 Hback  208 Hpol N
                  Vfront    1 Vsync   5 Vback   21 Vpol P
    Display Range Limits:
      Monitor ranges (GTF): 58-75 Hz V, 31-84 kHz H, max dotclock 180 MHz
    Display Product Name: '22LG3050'
  Extension blocks: 1
Checksum: 0x89

----------------

Block 1, CTA-861 Extension Block:
  Revision: 3
  Underscans IT Video Formats by default
  Basic audio support
  Supports YCbCr 4:4:4
  Supports YCbCr 4:2:2
  Native detailed modes: 1
  Video Data Block:
    VIC   7:  1440x480i   59.940060 Hz  16:9     15.734 kHz     27.000000 MHz
    VIC   1:   640x480    59.940476 Hz   4:3     31.469 kHz     25.175000 MHz
    VIC  22:  1440x576i   50.000000 Hz  16:9     15.625 kHz     27.000000 MHz
    VIC   2:   720x480    59.940060 Hz   4:3     31.469 kHz     27.000000 MHz
    VIC   3:   720x480    59.940060 Hz  16:9     31.469 kHz     27.000000 MHz
    VIC  17:   720x576    50.000000 Hz   4:3     31.250 kHz     27.000000 MHz
    VIC  18:   720x576    50.000000 Hz  16:9     31.250 kHz     27.000000 MHz
    VIC  19:  1280x720    50.000000 Hz  16:9     37.500 kHz     74.250000 MHz
    VIC   4:  1280x720    60.000000 Hz  16:9     45.000 kHz     74.250000 MHz
    VIC  20:  1920x1080i  50.000000 Hz  16:9     28.125 kHz     74.250000 MHz
    VIC   5:  1920x1080i  60.000000 Hz  16:9     33.750 kHz     74.250000 MHz (native)
    VIC  32:  1920x1080   24.000000 Hz  16:9     27.000 kHz     74.250000 MHz
    VIC  33:  1920x1080   25.000000 Hz  16:9     28.125 kHz     74.250000 MHz
    VIC  34:  1920x1080   30.000000 Hz  16:9     33.750 kHz     74.250000 MHz
    VIC  31:  1920x1080   50.000000 Hz  16:9     56.250 kHz    148.500000 MHz
    VIC  16:  1920x1080   60.000000 Hz  16:9     67.500 kHz    148.500000 MHz
  Audio Data Block:
    Linear PCM:
      Max channels: 2
      Supported sample rates (kHz): 48 44.1 32
      Supported sample sizes (bits): 24 20 16
  Speaker Allocation Data Block:
    FL/FR - Front Left/Right
  Vendor-Specific Data Block (HDMI), OUI 00-0C-03:
    Source physical address: 1.0.0.0
    Supports_AI
    DC_36bit
    DC_30bit
    DC_Y444
    Maximum TMDS clock: 225 MHz
  Detailed Timing Descriptors:
    DTD  3:  1280x720    60.000000 Hz  16:9     45.000 kHz     74.250000 MHz (473 mm x 296 mm)
                  Hfront   56 Hsync 136 Hback  178 Hpol P
                  Vfront    1 Vsync   5 Vback   24 Vpol P
    DTD  4:  1920x1080i  60.000000 Hz  16:9     33.750 kHz     74.250000 MHz (708 mm x 398 mm)
                  Hfront   88 Hsync  44 Hback  148 Hpol P
                  Vfront    2 Vsync   5 Vback   15 Vpol P Vfront +0.5 Odd Field
                  Vfront    2 Vsync   5 Vback   15 Vpol P Vback  +0.5 Even Field
    DTD  5:   720x480    59.940060 Hz   3:2     31.469 kHz     27.000000 MHz (708 mm x 398 mm)
                  Hfront   16 Hsync  62 Hback   60 Hpol N
                  Vfront    9 Vsync   6 Vback   30 Vpol N
    DTD  6:   720x480    59.940060 Hz   3:2     31.469 kHz     27.000000 MHz (531 mm x 398 mm)
                  Hfront    0 Hsync  62 Hback   76 Hpol N
                  Vfront    9 Vsync   6 Vback   30 Vpol N
                   8c 0a d0 8a 20 e0 2d 10 00 3e 96 00 13 8e 21 00 00 18 '.... .-..>....!...'
    DTD  7:  1920x1080   60.000000 Hz  16:9     67.500 kHz    148.500000 MHz (518 mm x 324 mm)
                  Hfront   88 Hsync  44 Hback  148 Hpol P
                  Vfront    4 Vsync   5 Vback   36 Vpol P
Checksum: 0xfa

----------------

Block 2, Unknown EDID Extension Block 0x00:
  00 ff ff ff ff ff ff 00 1e 6d 7b 56 85 2c 01 00 '.........m{V.,..'
  0c 12 01 03 80 2f 1e 78 0a ae c5 a2 57 4a 9c 25 '...../.x....WJ.%'
  12 50 54 a5 6e 00 31 40 45 40 61 40 90 40 b3 00 '.PT.n.1@E@a@.@..'
  81 80 01 01 01 01 6c 39 90 40 62 1a 25 40 68 b8 '......l9.@b.%@h.'
  16 00 d9 28 11 00 00 1c 0e 21 50 a0 51 00 1b 30 '...(.....!P.Q..0'
  40 90 15 00 d9 28 11 00 00 1c 00 00 00 fd 00 3a '@....(.........:'
  4b 1f 54 12 00 0a 20 20 20 20 20 20 00 00 00 fc 'K.T...      ....'
  00 32 32 4c 47 33 30 35 30 0a 20 20 20 20 01 89 '.22LG3050.    ..'
Checksum: 0x89

----------------

Block 3, CTA-861 Extension Block:
  Revision: 3
  Underscans IT Video Formats by default
  Basic audio support
  Supports YCbCr 4:4:4
  Supports YCbCr 4:2:2
  Native detailed modes: 1
  Video Data Block:
    VIC   7:  1440x480i   59.940060 Hz  16:9     15.734 kHz     27.000000 MHz
    VIC   1:   640x480    59.940476 Hz   4:3     31.469 kHz     25.175000 MHz
    VIC  22:  1440x576i   50.000000 Hz  16:9     15.625 kHz     27.000000 MHz
    VIC   2:   720x480    59.940060 Hz   4:3     31.469 kHz     27.000000 MHz
    VIC   3:   720x480    59.940060 Hz  16:9     31.469 kHz     27.000000 MHz
    VIC  17:   720x576    50.000000 Hz   4:3     31.250 kHz     27.000000 MHz
    VIC  18:   720x576    50.000000 Hz  16:9     31.250 kHz     27.000000 MHz
    VIC  19:  1280x720    50.000000 Hz  16:9     37.500 kHz     74.250000 MHz
    VIC   4:  1280x720    60.000000 Hz  16:9     45.000 kHz     74.250000 MHz
    VIC  20:  1920x1080i  50.000000 Hz  16:9     28.125 kHz     74.250000 MHz
    VIC   5:  1920x1080i  60.000000 Hz  16:9     33.750 kHz     74.250000 MHz (native)
    VIC  32:  1920x1080   24.000000 Hz  16:9     27.000 kHz     74.250000 MHz
    VIC  33:  1920x1080   25.000000 Hz  16:9     28.125 kHz     74.250000 MHz
    VIC  34:  1920x1080   30.000000 Hz  16:9     33.750 kHz     74.250000 MHz
    VIC  31:  1920x1080   50.000000 Hz  16:9     56.250 kHz    148.500000 MHz
    VIC  16:  1920x1080   60.000000 Hz  16:9     67.500 kHz    148.500000 MHz
  Audio Data Block:
    Linear PCM:
      Max channels: 2
      Supported sample rates (kHz): 48 44.1 32
      Supported sample sizes (bits): 24 20 16
  Speaker Allocation Data Block:
    FL/FR - Front Left/Right
  Vendor-Specific Data Block (HDMI), OUI 00-0C-03:
    Source physical address: 1.0.0.0
    Supports_AI
    DC_36bit
    DC_30bit
    DC_Y444
    Maximum TMDS clock: 225 MHz
  Detailed Timing Descriptors:
    DTD  8:  1280x720    60.000000 Hz  16:9     45.000 kHz     74.250000 MHz (473 mm x 296 mm)
                  Hfront   56 Hsync 136 Hback  178 Hpol P
                  Vfront    1 Vsync   5 Vback   24 Vpol P
    DTD  9:  1920x1080i  60.000000 Hz  16:9     33.750 kHz     74.250000 MHz (708 mm x 398 mm)
                  Hfront   88 Hsync  44 Hback  148 Hpol P
                  Vfront    2 Vsync   5 Vback   15 Vpol P Vfront +0.5 Odd Field
                  Vfront    2 Vsync   5 Vback   15 Vpol P Vback  +0.5 Even Field
    DTD 10:   720x480    59.940060 Hz   3:2     31.469 kHz     27.000000 MHz (708 mm x 398 mm)
                  Hfront   16 Hsync  62 Hback   60 Hpol N
                  Vfront    9 Vsync   6 Vback   30 Vpol N
    DTD 11:   720x480    59.940060 Hz   3:2     31.469 kHz     27.000000 MHz (531 mm x 398 mm)
                  Hfront    0 Hsync  62 Hback   76 Hpol N
                  Vfront    9 Vsync   6 Vback   30 Vpol N
                   8c 0a d0 8a 20 e0 2d 10 00 3e 96 00 13 8e 21 00 00 18 '.... .-..>....!...'
    DTD 12:  1920x1080   60.000000 Hz  16:9     67.500 kHz    148.500000 MHz (518 mm x 324 mm)
                  Hfront   88 Hsync  44 Hback  148 Hpol P
                  Vfront    4 Vsync   5 Vback   36 Vpol P
Checksum: 0xfa

----------------

Warnings:

Block 0, Base EDID:
  Detailed Timing Descriptor #2: Image size is 473x296 mm, but based on the picture AR it should be 473x267 mm.
Block 1, CTA-861 Extension Block:
  Video Data Block: VIC 7 and the first DTD are not identical. Is this intended?
  Speaker Allocation Data Block: Specifies deprecated speakers.
  Detailed Timing Descriptor #3: DTD is similar but not identical to VIC 4.
  Detailed Timing Descriptor #3: Image size is 473x296 mm, but based on the picture AR it should be 473x266 mm.
  Detailed Timing Descriptor #5: Image size is 708x398 mm, but based on the picture AR it should be 708x472 mm.
  Detailed Timing Descriptor #6: DTD is similar but not identical to VIC 2.
  Detailed Timing Descriptor #6: Image size is 531x398 mm, but based on the picture AR it should be 531x354 mm.
  Detailed Timing Descriptor #7: Image size is 518x324 mm, but based on the picture AR it should be 518x291 mm.
  Add a Colorimetry Data Block with the sRGB colorimetry bit set to avoid interop issues.
Block 3, CTA-861 Extension Block:
  Speaker Allocation Data Block: Specifies deprecated speakers.
  Detailed Timing Descriptor #8: DTD is similar but not identical to VIC 4.
  Detailed Timing Descriptor #8: Image size is 473x296 mm, but based on the picture AR it should be 473x266 mm.
  Detailed Timing Descriptor #10: Image size is 708x398 mm, but based on the picture AR it should be 708x472 mm.
  Detailed Timing Descriptor #11: DTD is similar but not identical to VIC 2.
  Detailed Timing Descriptor #11: Image size is 531x398 mm, but based on the picture AR it should be 531x354 mm.
  Detailed Timing Descriptor #12: Image size is 518x324 mm, but based on the picture AR it should be 518x291 mm.
EDID:
  Base EDID: Some timings are out of range of the Monitor Ranges:
    Vertical Freq: 24.000 - 75.029 Hz (Monitor: 58.000 - 75.000 Hz)
    Horizontal Freq: 15.625 - 67.500 kHz (Monitor: 31.000 - 84.000 kHz)
  CTA-861: Multiple native interlaced timings are defined.

Failures:

Block 1, CTA-861 Extension Block:
  Detailed Timing Descriptor #4: Mismatch of image size 708x398 mm vs display size 470x300 mm.
  Detailed Timing Descriptor #5: Mismatch of image size 708x398 mm vs display size 470x300 mm.
  Detailed Timing Descriptor #6: 0 values in the video timing:
    Horizontal Active/Blanking 720/138
    Horizontal Frontporch/Sync Width 0/62
    Vertical Active/Blanking 480/45
    Vertical Frontporch/Sync Width 9/6
  Detailed Timing Descriptor #6: 0 or negative horizontal front porch.
  Detailed Timing Descriptor #6: Mismatch of image size 531x398 mm vs display size 470x300 mm.
  Detailed Timing Descriptor #7: Mismatch of image size 518x324 mm vs display size 470x300 mm.
  Missing VCDB, needed for Set Selectable RGB Quantization to avoid interop issues.
Block 2, Base EDID:
  Unknown Extension Block.
Block 3, CTA-861 Extension Block:
  Video Data Block: Duplicate VIC 7.
  Video Data Block: Duplicate VIC 1.
  Video Data Block: Duplicate VIC 22.
  Video Data Block: Duplicate VIC 2.
  Video Data Block: Duplicate VIC 3.
  Video Data Block: Duplicate VIC 17.
  Video Data Block: Duplicate VIC 18.
  Video Data Block: Duplicate VIC 19.
  Video Data Block: Duplicate VIC 4.
  Video Data Block: Duplicate VIC 20.
  Video Data Block: Duplicate VIC 5.
  Video Data Block: Duplicate VIC 32.
  Video Data Block: Duplicate VIC 33.
  Video Data Block: Duplicate VIC 34.
  Video Data Block: Duplicate VIC 31.
  Video Data Block: Duplicate VIC 16.
  Speaker Allocation Data Block: Only one instance of this Data Block is allowed.
  Detailed Timing Descriptor #9: Mismatch of image size 708x398 mm vs display size 470x300 mm.
  Detailed Timing Descriptor #10: Mismatch of image size 708x398 mm vs display size 470x300 mm.
  Detailed Timing Descriptor #11: 0 values in the video timing:
    Horizontal Active/Blanking 720/138
    Horizontal Frontporch/Sync Width 0/62
    Vertical Active/Blanking 480/45
    Vertical Frontporch/Sync Width 9/6
  Detailed Timing Descriptor #11: 0 or negative horizontal front porch.
  Detailed Timing Descriptor #11: Mismatch of image size 531x398 mm vs display size 470x300 mm.
  Detailed Timing Descriptor #12: Mismatch of image size 518x324 mm vs display size 470x300 mm.
EDID:
  Base EDID: The DTD max image size is 708x398mm, which is larger than the display size 470.0x300.0mm.
  Base EDID: EDID specified 1 extension block(s), but found 3 extension block(s).
  Base EDID: EDID 1.3 requires a Block Map Extension in Block 1 if there are more than 2 blocks in the EDID.

EDID conformity: FAIL
