edid-decode (hex):

00 ff ff ff ff ff ff 00 05 e3 20 b3 32 02 00 00
19 21 01 04 b5 3c 22 78 3b a5 25 ae 4f 44 a6 24
0f 50 54 bf ef 00 d1 c0 81 80 31 68 31 7c 45 68
45 7c 61 68 61 7c 4d d0 00 a0 f0 70 3e 80 30 40
35 00 54 4f 21 00 00 1a 00 00 00 ff 00 57 47 4b
50 36 48 41 30 30 30 35 36 32 00 00 00 fc 00 55
32 37 47 33 58 0a 20 20 20 20 20 20 00 00 00 fd
00 30 a0 ff ff 8c 01 0a 20 20 20 20 20 20 02 f4

02 03 35 f1 4c 01 03 05 14 04 13 1f 12 02 11 90
3f 23 09 07 07 83 01 00 00 e2 00 d5 e3 05 c3 01
e6 06 05 01 62 62 00 6d 1a 00 00 02 01 30 a0 00
00 00 00 00 00 a3 66 00 a0 f0 70 1f 80 30 20 35
00 54 4f 21 00 00 1a 40 e7 00 6a a0 a0 67 50 08
20 98 04 54 4f 21 00 00 1a 6f c2 00 a0 a0 a0 55
50 30 20 35 00 54 4f 21 00 00 1e 4d 6c 80 a0 70
70 3e 80 30 20 3a 00 54 4f 21 00 00 1a 00 00 e0

70 12 79 03 00 03 01 64 e3 19 02 04 ff 0e 59 00
2f 00 1f 00 6f 08 1d 00 02 00 04 00 f2 07 02 04
ff 0e 3f 01 5f 80 7f 00 6f 08 3d 00 02 00 04 00
a4 a0 01 84 ff 0e 9f 00 2f 80 3f 00 6f 08 3d 00
02 00 04 00 30 5b 01 04 ff 0e 9f 00 2f 80 3f 00
6f 08 3d 00 02 00 04 00 64 04 01 04 ff 0e 9f 00
2f 80 3f 00 6f 08 3d 00 02 00 04 00 00 00 00 00
00 00 00 00 00 00 00 00 00 00 00 00 00 00 94 90

00 ff ff ff ff ff ff 00 05 e3 20 b3 32 02 00 00
19 21 01 04 b5 3c 22 78 3b a5 25 ae 4f 44 a6 24
0f 50 54 bf ef 00 d1 c0 81 80 31 68 31 7c 45 68
45 7c 61 68 61 7c 4d d0 00 a0 f0 70 3e 80 30 40
35 00 54 4f 21 00 00 1a 00 00 00 ff 00 57 47 4b
50 36 48 41 30 30 30 35 36 32 00 00 00 fc 00 55
32 37 47 33 58 0a 20 20 20 20 20 20 00 00 00 fd
00 30 a0 ff ff 8c 01 0a 20 20 20 20 20 20 02 f4

02 03 35 f1 4c 01 03 05 14 04 13 1f 12 02 11 90
3f 23 09 07 07 83 01 00 00 e2 00 d5 e3 05 c3 01
e6 06 05 01 62 62 00 6d 1a 00 00 02 01 30 a0 00
00 00 00 00 00 a3 66 00 a0 f0 70 1f 80 30 20 35
00 54 4f 21 00 00 1a 40 e7 00 6a a0 a0 67 50 08
20 98 04 54 4f 21 00 00 1a 6f c2 00 a0 a0 a0 55
50 30 20 35 00 54 4f 21 00 00 1e 4d 6c 80 a0 70
70 3e 80 30 20 3a 00 54 4f 21 00 00 1a 00 00 e0

70 12 79 03 00 03 01 64 e3 19 02 04 ff 0e 59 00
2f 00 1f 00 6f 08 1d 00 02 00 04 00 f2 07 02 04
ff 0e 3f 01 5f 80 7f 00 6f 08 3d 00 02 00 04 00
a4 a0 01 84 ff 0e 9f 00 2f 80 3f 00 6f 08 3d 00
02 00 04 00 30 5b 01 04 ff 0e 9f 00 2f 80 3f 00
6f 08 3d 00 02 00 04 00 64 04 01 04 ff 0e 9f 00
2f 80 3f 00 6f 08 3d 00 02 00 04 00 00 00 00 00
00 00 00 00 00 00 00 00 00 00 00 00 00 00 94 90

----------------

Block 0, Base EDID:
  EDID Structure Version & Revision: 1.4
  Vendor & Product Identification:
    Manufacturer: AOC
    Model: 45856
    Serial Number: ...
    Made in: week 25 of 2023
  Basic Display Parameters & Features:
    Digital display
    Bits per primary color channel: 10
    DisplayPort interface
    Maximum image size: 60 cm x 34 cm
    Gamma: 2.20
    DPMS levels: Off
    Supported color formats: RGB 4:4:4, YCrCb 4:4:4, YCrCb 4:2:2
    First detailed timing includes the native pixel format and preferred refresh rate
    Display supports continuous frequencies
  Color Characteristics:
    Red  : 0.6816, 0.3105
    Green: 0.2666, 0.6494
    Blue : 0.1406, 0.0605
    White: 0.3134, 0.3291
  Established Timings I & II:
    IBM     :   720x400    70.081663 Hz   9:5     31.467 kHz     28.320000 MHz
    DMT 0x04:   640x480    59.940476 Hz   4:3     31.469 kHz     25.175000 MHz
    Apple   :   640x480    66.666667 Hz   4:3     35.000 kHz     30.240000 MHz
    DMT 0x05:   640x480    72.808802 Hz   4:3     37.861 kHz     31.500000 MHz
    DMT 0x06:   640x480    75.000000 Hz   4:3     37.500 kHz     31.500000 MHz
    DMT 0x08:   800x600    56.250000 Hz   4:3     35.156 kHz     36.000000 MHz
    DMT 0x09:   800x600    60.316541 Hz   4:3     37.879 kHz     40.000000 MHz
    DMT 0x0a:   800x600    72.187572 Hz   4:3     48.077 kHz     50.000000 MHz
    DMT 0x0b:   800x600    75.000000 Hz   4:3     46.875 kHz     49.500000 MHz
    Apple   :   832x624    74.551266 Hz   4:3     49.726 kHz     57.284000 MHz
    DMT 0x10:  1024x768    60.003840 Hz   4:3     48.363 kHz     65.000000 MHz
    DMT 0x11:  1024x768    70.069359 Hz   4:3     56.476 kHz     75.000000 MHz
    DMT 0x12:  1024x768    75.028582 Hz   4:3     60.023 kHz     78.750000 MHz
    DMT 0x24:  1280x1024   75.024675 Hz   5:4     79.976 kHz    135.000000 MHz
  Standard Timings:
    DMT 0x52:  1920x1080   60.000000 Hz  16:9     67.500 kHz    148.500000 MHz
    DMT 0x23:  1280x1024   60.019740 Hz   5:4     63.981 kHz    108.000000 MHz
    GTF     :   640x480    99.999537 Hz   4:3     50.900 kHz     43.163000 MHz
    GTF     :   640x480   119.999084 Hz   4:3     61.800 kHz     52.406000 MHz
    GTF     :   800x600    99.999707 Hz   4:3     63.600 kHz     68.179000 MHz
    GTF     :   800x600   119.999886 Hz   4:3     77.160 kHz     83.950000 MHz
    GTF     :  1024x768   100.000177 Hz   4:3     81.400 kHz    113.309000 MHz
    GTF     :  1024x768   119.999931 Hz   4:3     98.760 kHz    139.054000 MHz
  Detailed Timing Descriptors:
    DTD 1:  3840x2160   59.996625 Hz  16:9    133.312 kHz    533.250000 MHz (596 mm x 335 mm)
                 Hfront   48 Hsync  64 Hback   48 Hpol P
                 Vfront    3 Vsync   5 Vback   54 Vpol N
    Display Product Serial Number: ...
    Display Product Name: 'U27G3X'
    Display Range Limits:
      Monitor ranges (Range Limits Only): 48-160 Hz V, 255-255 kHz H, max dotclock 1400 MHz
  Extension blocks: 2
Checksum: 0xf4

----------------

Block 1, CTA-861 Extension Block:
  Revision: 3
  Underscans IT Video Formats by default
  Basic audio support
  Supports YCbCr 4:4:4
  Supports YCbCr 4:2:2
  Native detailed modes: 1
  Video Data Block:
    VIC   1:   640x480    59.940476 Hz   4:3     31.469 kHz     25.175000 MHz
    VIC   3:   720x480    59.940060 Hz  16:9     31.469 kHz     27.000000 MHz
    VIC   5:  1920x1080i  60.000000 Hz  16:9     33.750 kHz     74.250000 MHz
    VIC  20:  1920x1080i  50.000000 Hz  16:9     28.125 kHz     74.250000 MHz
    VIC   4:  1280x720    60.000000 Hz  16:9     45.000 kHz     74.250000 MHz
    VIC  19:  1280x720    50.000000 Hz  16:9     37.500 kHz     74.250000 MHz
    VIC  31:  1920x1080   50.000000 Hz  16:9     56.250 kHz    148.500000 MHz
    VIC  18:   720x576    50.000000 Hz  16:9     31.250 kHz     27.000000 MHz
    VIC   2:   720x480    59.940060 Hz   4:3     31.469 kHz     27.000000 MHz
    VIC  17:   720x576    50.000000 Hz   4:3     31.250 kHz     27.000000 MHz
    VIC  16:  1920x1080   60.000000 Hz  16:9     67.500 kHz    148.500000 MHz (native)
    VIC  63:  1920x1080  120.000000 Hz  16:9    135.000 kHz    297.000000 MHz
  Audio Data Block:
    Linear PCM:
      Max channels: 2
      Supported sample rates (kHz): 48 44.1 32
      Supported sample sizes (bits): 24 20 16
  Speaker Allocation Data Block:
    FL/FR - Front Left/Right
  Video Capability Data Block:
    YCbCr quantization: Selectable (via AVI YQ)
    RGB quantization: Selectable (via AVI Q)
    PT scan behavior: Always Overscanned
    IT scan behavior: Always Overscanned
    CE scan behavior: Always Overscanned
  Colorimetry Data Block:
    xvYCC601
    xvYCC709
    BT2020YCC
    BT2020RGB
    Gamut Boundary Description Metadata Profile P0
  HDR Static Metadata Data Block:
    Electro optical transfer functions:
      Traditional gamma - SDR luminance range
      SMPTE ST2084
    Supported static metadata descriptors:
      Static metadata type 1
    Desired content max luminance: 98 (417.710 cd/m^2)
    Desired content max frame-average luminance: 98 (417.710 cd/m^2)
    Desired content min luminance: 0 (0.000 cd/m^2)
  Vendor-Specific Data Block (AMD), OUI 00-00-1A:
    Version: 2
    Feature Caps: 0x01
    Minimum Refresh Rate: 48 Hz
    Maximum Refresh Rate: 160 Hz
    Flags 1.x: 0x00
    Flags 2.x: 0x00
  Detailed Timing Descriptors:
    DTD 2:  3840x2160   29.980602 Hz  16:9     65.688 kHz    262.750000 MHz (596 mm x 335 mm)
                 Hfront   48 Hsync  32 Hback   80 Hpol P
                 Vfront    3 Vsync   5 Vback   23 Vpol N
    DTD 3:  2560x1440  143.911545 Hz  16:9    222.056 kHz    592.000000 MHz (596 mm x 335 mm)
                 Hfront    8 Hsync  32 Hback   66 Hpol P
                 Vfront   25 Vsync   8 Vback   70 Vpol N
    DTD 4:  2560x1440  119.997589 Hz  16:9    182.996 kHz    497.750000 MHz (596 mm x 335 mm)
                 Hfront   48 Hsync  32 Hback   80 Hpol P
                 Vfront    3 Vsync   5 Vback   77 Vpol P
    DTD 5:  1920x2160   59.987970 Hz   8:9    133.293 kHz    277.250000 MHz (596 mm x 335 mm)
                 Hfront   48 Hsync  32 Hback   80 Hpol P
                 Vfront    3 Vsync  10 Vback   49 Vpol N
Checksum: 0xe0  Unused space in Extension Block: 2 bytes

----------------

Block 2, DisplayID Extension Block:
  Version: 1.2
  Extension Count: 0
  Display Product Type: Standalone display device
  Video Timing Modes Type 1 - Detailed Timings Data Block:
    DTD:  3840x2160  159.991634 Hz  16:9    350.382 kHz   1377.000000 MHz (aspect 16:9, no 3D stereo)
               Hfront   48 Hsync  32 Hback   10 Hpol N
               Vfront    3 Vsync   5 Vback   22 Vpol N
    DTD:  3840x2160  144.000338 Hz  16:9    319.969 kHz   1331.070000 MHz (aspect 16:9, no 3D stereo)
               Hfront   96 Hsync 128 Hback   96 Hpol P
               Vfront    3 Vsync   5 Vback   54 Vpol N
    DTD:  3840x2160  120.005626 Hz  16:9    266.652 kHz   1066.610000 MHz (aspect 16:9, no 3D stereo, preferred)
               Hfront   48 Hsync  64 Hback   48 Hpol P
               Vfront    3 Vsync   5 Vback   54 Vpol N
    DTD:  3840x2160  100.001125 Hz  16:9    222.202 kHz    888.810000 MHz (aspect 16:9, no 3D stereo)
               Hfront   48 Hsync  64 Hback   48 Hpol P
               Vfront    3 Vsync   5 Vback   54 Vpol N
    DTD:  3840x2160   75.001125 Hz  16:9    166.653 kHz    666.610000 MHz (aspect 16:9, no 3D stereo)
               Hfront   48 Hsync  64 Hback   48 Hpol P
               Vfront    3 Vsync   5 Vback   54 Vpol N
  Checksum: 0x94
Checksum: 0x90

----------------

Block 3, Unknown EDID Extension Block 0x00:
  00 ff ff ff ff ff ff 00 05 e3 20 b3 32 02 00 00 '.......... .2...'
  19 21 01 04 b5 3c 22 78 3b a5 25 ae 4f 44 a6 24 '.!...<"x;.%.OD.$'
  0f 50 54 bf ef 00 d1 c0 81 80 31 68 31 7c 45 68 '.PT.......1h1|Eh'
  45 7c 61 68 61 7c 4d d0 00 a0 f0 70 3e 80 30 40 'E|aha|M....p>.0@'
  35 00 54 4f 21 00 00 1a 00 00 00 ff 00 57 47 4b '5.TO!........WGK'
  50 36 48 41 30 30 30 35 36 32 00 00 00 fc 00 55 'P6HA000562.....U'
  32 37 47 33 58 0a 20 20 20 20 20 20 00 00 00 fd '27G3X.      ....'
  00 30 a0 ff ff 8c 01 0a 20 20 20 20 20 20 02 f4 '.0......      ..'
Checksum: 0xf4

----------------

Block 4, CTA-861 Extension Block:
  Revision: 3
  Underscans IT Video Formats by default
  Basic audio support
  Supports YCbCr 4:4:4
  Supports YCbCr 4:2:2
  Native detailed modes: 1
  Video Data Block:
    VIC   1:   640x480    59.940476 Hz   4:3     31.469 kHz     25.175000 MHz
    VIC   3:   720x480    59.940060 Hz  16:9     31.469 kHz     27.000000 MHz
    VIC   5:  1920x1080i  60.000000 Hz  16:9     33.750 kHz     74.250000 MHz
    VIC  20:  1920x1080i  50.000000 Hz  16:9     28.125 kHz     74.250000 MHz
    VIC   4:  1280x720    60.000000 Hz  16:9     45.000 kHz     74.250000 MHz
    VIC  19:  1280x720    50.000000 Hz  16:9     37.500 kHz     74.250000 MHz
    VIC  31:  1920x1080   50.000000 Hz  16:9     56.250 kHz    148.500000 MHz
    VIC  18:   720x576    50.000000 Hz  16:9     31.250 kHz     27.000000 MHz
    VIC   2:   720x480    59.940060 Hz   4:3     31.469 kHz     27.000000 MHz
    VIC  17:   720x576    50.000000 Hz   4:3     31.250 kHz     27.000000 MHz
    VIC  16:  1920x1080   60.000000 Hz  16:9     67.500 kHz    148.500000 MHz (native)
    VIC  63:  1920x1080  120.000000 Hz  16:9    135.000 kHz    297.000000 MHz
  Audio Data Block:
    Linear PCM:
      Max channels: 2
      Supported sample rates (kHz): 48 44.1 32
      Supported sample sizes (bits): 24 20 16
  Speaker Allocation Data Block:
    FL/FR - Front Left/Right
  Video Capability Data Block:
    YCbCr quantization: Selectable (via AVI YQ)
    RGB quantization: Selectable (via AVI Q)
    PT scan behavior: Always Overscanned
    IT scan behavior: Always Overscanned
    CE scan behavior: Always Overscanned
  Colorimetry Data Block:
    xvYCC601
    xvYCC709
    BT2020YCC
    BT2020RGB
    Gamut Boundary Description Metadata Profile P0
  HDR Static Metadata Data Block:
    Electro optical transfer functions:
      Traditional gamma - SDR luminance range
      SMPTE ST2084
    Supported static metadata descriptors:
      Static metadata type 1
    Desired content max luminance: 98 (417.710 cd/m^2)
    Desired content max frame-average luminance: 98 (417.710 cd/m^2)
    Desired content min luminance: 0 (0.000 cd/m^2)
  Vendor-Specific Data Block (AMD), OUI 00-00-1A:
    Version: 2
    Feature Caps: 0x01
    Minimum Refresh Rate: 48 Hz
    Maximum Refresh Rate: 160 Hz
    Flags 1.x: 0x00
    Flags 2.x: 0x00
  Detailed Timing Descriptors:
    DTD 6:  3840x2160   29.980602 Hz  16:9     65.688 kHz    262.750000 MHz (596 mm x 335 mm)
                 Hfront   48 Hsync  32 Hback   80 Hpol P
                 Vfront    3 Vsync   5 Vback   23 Vpol N
    DTD 7:  2560x1440  143.911545 Hz  16:9    222.056 kHz    592.000000 MHz (596 mm x 335 mm)
                 Hfront    8 Hsync  32 Hback   66 Hpol P
                 Vfront   25 Vsync   8 Vback   70 Vpol N
    DTD 8:  2560x1440  119.997589 Hz  16:9    182.996 kHz    497.750000 MHz (596 mm x 335 mm)
                 Hfront   48 Hsync  32 Hback   80 Hpol P
                 Vfront    3 Vsync   5 Vback   77 Vpol P
    DTD 9:  1920x2160   59.987970 Hz   8:9    133.293 kHz    277.250000 MHz (596 mm x 335 mm)
                 Hfront   48 Hsync  32 Hback   80 Hpol P
                 Vfront    3 Vsync  10 Vback   49 Vpol N
Checksum: 0xe0  Unused space in Extension Block: 2 bytes

----------------

Block 5, DisplayID Extension Block:
  Version: 1.2
  Extension Count: 0
  Video Timing Modes Type 1 - Detailed Timings Data Block:
    DTD:  3840x2160  159.991634 Hz  16:9    350.382 kHz   1377.000000 MHz (aspect 16:9, no 3D stereo)
               Hfront   48 Hsync  32 Hback   10 Hpol N
               Vfront    3 Vsync   5 Vback   22 Vpol N
    DTD:  3840x2160  144.000338 Hz  16:9    319.969 kHz   1331.070000 MHz (aspect 16:9, no 3D stereo)
               Hfront   96 Hsync 128 Hback   96 Hpol P
               Vfront    3 Vsync   5 Vback   54 Vpol N
    DTD:  3840x2160  120.005626 Hz  16:9    266.652 kHz   1066.610000 MHz (aspect 16:9, no 3D stereo, preferred)
               Hfront   48 Hsync  64 Hback   48 Hpol P
               Vfront    3 Vsync   5 Vback   54 Vpol N
    DTD:  3840x2160  100.001125 Hz  16:9    222.202 kHz    888.810000 MHz (aspect 16:9, no 3D stereo)
               Hfront   48 Hsync  64 Hback   48 Hpol P
               Vfront    3 Vsync   5 Vback   54 Vpol N
    DTD:  3840x2160   75.001125 Hz  16:9    166.653 kHz    666.610000 MHz (aspect 16:9, no 3D stereo)
               Hfront   48 Hsync  64 Hback   48 Hpol P
               Vfront    3 Vsync   5 Vback   54 Vpol N
  Checksum: 0x94
Checksum: 0x90

----------------

Warnings:

Block 1, CTA-861 Extension Block:
  Video Data Block: VIC 1 and the first DTD are not identical. Is this intended?
  Video Capability Data Block: IT scan behavior is expected to support underscanned.
  Video Capability Data Block: S_PT is equal to S_IT and S_CE, so should be set to 0 instead.
  Colorimetry Data Block: Set the sRGB colorimetry bit to avoid interop issues.
  Detailed Timing Descriptor #5: Image size is 596x335 mm, but based on the picture AR it should be 596x670 mm.
  Display Product Serial Number is set, so the Serial Number in the Base EDID should be 0.
Block 4, CTA-861 Extension Block:
  Video Capability Data Block: IT scan behavior is expected to support underscanned.
  Video Capability Data Block: S_PT is equal to S_IT and S_CE, so should be set to 0 instead.
  Colorimetry Data Block: Set the sRGB colorimetry bit to avoid interop issues.
  Detailed Timing Descriptor #9: Image size is 596x335 mm, but based on the picture AR it should be 596x670 mm.
EDID:
  Base EDID: Some timings are out of range of the Monitor Ranges:
    Vertical Freq: 29.981 - 159.992 Hz (Monitor: 48.000 - 160.000 Hz)
    Horizontal Freq: 28.125 - 350.381 kHz (Monitor: 255.000 - 255.000 kHz)

Failures:

Block 1, CTA-861 Extension Block:
  Video Capability Data Block: IT video formats are always overscanned, but bit 7 of Byte 3 of the CTA-861 Extension header is set to underscanned.
Block 2, DisplayID Extension Block:
  Expected 0 DisplayID Extension Block, but got 1.
Block 3, Base EDID:
  Unknown Extension Block.
Block 4, CTA-861 Extension Block:
  Video Data Block: Duplicate VIC 1.
  Video Data Block: Duplicate VIC 3.
  Video Data Block: Duplicate VIC 5.
  Video Data Block: Duplicate VIC 20.
  Video Data Block: Duplicate VIC 4.
  Video Data Block: Duplicate VIC 19.
  Video Data Block: Duplicate VIC 31.
  Video Data Block: Duplicate VIC 18.
  Video Data Block: Duplicate VIC 2.
  Video Data Block: Duplicate VIC 17.
  Video Data Block: Duplicate VIC 16.
  Video Data Block: Duplicate VIC 63.
  Speaker Allocation Data Block: Only one instance of this Data Block is allowed.
  Video Capability Data Block: Only one instance of this Data Block is allowed.
  Video Capability Data Block: IT video formats are always overscanned, but bit 7 of Byte 3 of the CTA-861 Extension header is set to underscanned.
  Colorimetry Data Block: Only one instance of this Data Block is allowed.
  HDR Static Metadata Data Block: Only one instance of this Data Block is allowed.
Block 5, DisplayID Extension Block:
  Product Type should be 0 in extension block.
EDID:
  Base EDID: EDID specified 2 extension block(s), but found 5 extension block(s).
  CTA-861: Native progressive timings are a mix of several resolutions.
  DisplayID: Missing DisplayID Display Parameters Data Block.

EDID conformity: FAIL
