edid-decode (hex):

00 ff ff ff ff ff ff 00 06 b3 28 32 01 01 01 01
1c 21 01 04 b5 47 28 78 3b 5d 71 b0 4e 2f be 27
0d 50 54 bf cf 00 81 40 81 80 95 00 71 4f 81 c0
b3 00 d1 c0 01 01 4d d0 00 a0 f0 70 3e 80 30 20
35 00 c4 8e 21 00 00 1a 00 00 00 fd 0c 30 a0 61
61 96 01 0a 20 20 20 20 20 20 00 00 00 fc 00 50
47 33 32 55 51 58 52 0a 20 20 20 20 00 00 00 ff
00 52 37 4c 4d 51 53 30 35 37 31 33 31 0a 02 5c

02 03 45 f1 55 12 03 04 13 1e 1d 0f 20 21 22 1f
10 40 3f 5d 5e 5f 60 61 75 76 23 09 07 07 83 01
00 00 e3 05 c0 00 e6 06 05 01 8e 8e 00 e2 00 6a
74 1a 00 00 03 0b 30 a0 00 20 8e 05 8e 05 a0 00
00 00 00 89 00 56 5e 00 a0 a0 a0 29 50 30 20 35
00 c4 8e 21 00 00 1a b8 bc 00 50 a0 a0 55 50 08
20 68 00 c4 8e 21 00 00 1a 00 00 00 00 00 00 00
00 00 00 00 00 00 00 00 00 00 00 00 00 00 00 a3

70 12 79 03 00 03 01 50 1c 0a 01 04 ff 09 9f 00
2f 80 1f 00 9f 05 73 00 02 00 04 00 ce ac 01 04
ff 0e 9f 00 6f 80 1f 00 6f 08 7e 00 76 00 04 00
7f f3 01 04 ff 0e 9f 00 6f 80 1f 00 6f 08 3b 00
31 00 04 00 3f 22 02 04 ff 0e 9f 00 2f 80 1f 00
6f 08 18 00 0b 00 04 00 00 00 00 00 00 00 00 00
00 00 00 00 00 00 00 00 00 00 00 00 00 00 00 00
00 00 00 00 00 00 00 00 00 00 00 00 00 00 22 90

00 ff ff ff ff ff ff 00 06 b3 28 32 01 01 01 01
1c 21 01 04 b5 47 28 78 3b 5d 71 b0 4e 2f be 27
0d 50 54 bf cf 00 81 40 81 80 95 00 71 4f 81 c0
b3 00 d1 c0 01 01 4d d0 00 a0 f0 70 3e 80 30 20
35 00 c4 8e 21 00 00 1a 00 00 00 fd 0c 30 a0 61
61 96 01 0a 20 20 20 20 20 20 00 00 00 fc 00 50
47 33 32 55 51 58 52 0a 20 20 20 20 00 00 00 ff
00 52 37 4c 4d 51 53 30 35 37 31 33 31 0a 02 5c

02 03 45 f1 55 12 03 04 13 1e 1d 0f 20 21 22 1f
10 40 3f 5d 5e 5f 60 61 75 76 23 09 07 07 83 01
00 00 e3 05 c0 00 e6 06 05 01 8e 8e 00 e2 00 6a
74 1a 00 00 03 0b 30 a0 00 20 8e 05 8e 05 a0 00
00 00 00 89 00 56 5e 00 a0 a0 a0 29 50 30 20 35
00 c4 8e 21 00 00 1a b8 bc 00 50 a0 a0 55 50 08
20 68 00 c4 8e 21 00 00 1a 00 00 00 00 00 00 00
00 00 00 00 00 00 00 00 00 00 00 00 00 00 00 a3

70 12 79 03 00 03 01 50 1c 0a 01 04 ff 09 9f 00
2f 80 1f 00 9f 05 73 00 02 00 04 00 ce ac 01 04
ff 0e 9f 00 6f 80 1f 00 6f 08 7e 00 76 00 04 00
7f f3 01 04 ff 0e 9f 00 6f 80 1f 00 6f 08 3b 00
31 00 04 00 3f 22 02 04 ff 0e 9f 00 2f 80 1f 00
6f 08 18 00 0b 00 04 00 00 00 00 00 00 00 00 00
00 00 00 00 00 00 00 00 00 00 00 00 00 00 00 00
00 00 00 00 00 00 00 00 00 00 00 00 00 00 22 90

----------------

Block 0, Base EDID:
  EDID Structure Version & Revision: 1.4
  Vendor & Product Identification:
    Manufacturer: AUS
    Model: 12840
    Serial Number: ...
    Made in: week 28 of 2023
  Basic Display Parameters & Features:
    Digital display
    Bits per primary color channel: 10
    DisplayPort interface
    Maximum image size: 71 cm x 40 cm
    Gamma: 2.20
    DPMS levels: Off
    Supported color formats: RGB 4:4:4, YCrCb 4:4:4, YCrCb 4:2:2
    First detailed timing includes the native pixel format and preferred refresh rate
    Display supports continuous frequencies
  Color Characteristics:
    Red  : 0.6884, 0.3056
    Green: 0.1865, 0.7431
    Blue : 0.1533, 0.0537
    White: 0.3125, 0.3291
  Established Timings I & II:
    IBM     :   720x400    70.081663 Hz   9:5     31.467 kHz     28.320000 MHz
    DMT 0x04:   640x480    59.940476 Hz   4:3     31.469 kHz     25.175000 MHz
    Apple   :   640x480    66.666667 Hz   4:3     35.000 kHz     30.240000 MHz
    DMT 0x05:   640x480    72.808802 Hz   4:3     37.861 kHz     31.500000 MHz
    DMT 0x06:   640x480    75.000000 Hz   4:3     37.500 kHz     31.500000 MHz
    DMT 0x08:   800x600    56.250000 Hz   4:3     35.156 kHz     36.000000 MHz
    DMT 0x09:   800x600    60.316541 Hz   4:3     37.879 kHz     40.000000 MHz
    DMT 0x0a:   800x600    72.187572 Hz   4:3     48.077 kHz     50.000000 MHz
    DMT 0x0b:   800x600    75.000000 Hz   4:3     46.875 kHz     49.500000 MHz
    DMT 0x10:  1024x768    60.003840 Hz   4:3     48.363 kHz     65.000000 MHz
    DMT 0x11:  1024x768    70.069359 Hz   4:3     56.476 kHz     75.000000 MHz
    DMT 0x12:  1024x768    75.028582 Hz   4:3     60.023 kHz     78.750000 MHz
    DMT 0x24:  1280x1024   75.024675 Hz   5:4     79.976 kHz    135.000000 MHz
  Standard Timings:
    DMT 0x20:  1280x960    60.000000 Hz   4:3     60.000 kHz    108.000000 MHz
    DMT 0x23:  1280x1024   60.019740 Hz   5:4     63.981 kHz    108.000000 MHz
    DMT 0x2f:  1440x900    59.887445 Hz  16:10    55.935 kHz    106.500000 MHz
    DMT 0x15:  1152x864    75.000000 Hz   4:3     67.500 kHz    108.000000 MHz
    DMT 0x55:  1280x720    60.000000 Hz  16:9     45.000 kHz     74.250000 MHz
    DMT 0x3a:  1680x1050   59.954250 Hz  16:10    65.290 kHz    146.250000 MHz
    DMT 0x52:  1920x1080   60.000000 Hz  16:9     67.500 kHz    148.500000 MHz
  Detailed Timing Descriptors:
    DTD 1:  3840x2160   59.996625 Hz  16:9    133.312 kHz    533.250000 MHz (708 mm x 398 mm)
                 Hfront   48 Hsync  32 Hback   80 Hpol P
                 Vfront    3 Vsync   5 Vback   54 Vpol N
    Display Range Limits:
      Monitor ranges (Range Limits Only): 48-160 Hz V, 352-352 kHz H, max dotclock 1500 MHz
    Display Product Name: 'PG32UQXR'
    Display Product Serial Number: ...
  Extension blocks: 2
Checksum: 0x5c

----------------

Block 1, CTA-861 Extension Block:
  Revision: 3
  Underscans IT Video Formats by default
  Basic audio support
  Supports YCbCr 4:4:4
  Supports YCbCr 4:2:2
  Native DTDs: 1
  Video Data Block:
    VIC  18:   720x576    50.000000 Hz  16:9     31.250 kHz     27.000000 MHz
    VIC   3:   720x480    59.940060 Hz  16:9     31.469 kHz     27.000000 MHz
    VIC   4:  1280x720    60.000000 Hz  16:9     45.000 kHz     74.250000 MHz
    VIC  19:  1280x720    50.000000 Hz  16:9     37.500 kHz     74.250000 MHz
    VIC  30:  1440x576    50.000000 Hz  16:9     31.250 kHz     54.000000 MHz
    VIC  29:  1440x576    50.000000 Hz   4:3     31.250 kHz     54.000000 MHz
    VIC  15:  1440x480    59.940060 Hz  16:9     31.469 kHz     54.000000 MHz
    VIC  32:  1920x1080   24.000000 Hz  16:9     27.000 kHz     74.250000 MHz
    VIC  33:  1920x1080   25.000000 Hz  16:9     28.125 kHz     74.250000 MHz
    VIC  34:  1920x1080   30.000000 Hz  16:9     33.750 kHz     74.250000 MHz
    VIC  31:  1920x1080   50.000000 Hz  16:9     56.250 kHz    148.500000 MHz
    VIC  16:  1920x1080   60.000000 Hz  16:9     67.500 kHz    148.500000 MHz
    VIC  64:  1920x1080  100.000000 Hz  16:9    112.500 kHz    297.000000 MHz
    VIC  63:  1920x1080  120.000000 Hz  16:9    135.000 kHz    297.000000 MHz
    VIC  93:  3840x2160   24.000000 Hz  16:9     54.000 kHz    297.000000 MHz
    VIC  94:  3840x2160   25.000000 Hz  16:9     56.250 kHz    297.000000 MHz
    VIC  95:  3840x2160   30.000000 Hz  16:9     67.500 kHz    297.000000 MHz
    VIC  96:  3840x2160   50.000000 Hz  16:9    112.500 kHz    594.000000 MHz
    VIC  97:  3840x2160   60.000000 Hz  16:9    135.000 kHz    594.000000 MHz
    VIC 117:  3840x2160  100.000000 Hz  16:9    225.000 kHz   1188.000000 MHz
    VIC 118:  3840x2160  120.000000 Hz  16:9    270.000 kHz   1188.000000 MHz
  Audio Data Block:
    Linear PCM:
      Max channels: 2
      Supported sample rates (kHz): 48 44.1 32
      Supported sample sizes (bits): 24 20 16
  Speaker Allocation Data Block:
    FL/FR - Front Left/Right
  Colorimetry Data Block:
    BT2020YCC
    BT2020RGB
  HDR Static Metadata Data Block:
    Electro optical transfer functions:
      Traditional gamma - SDR luminance range
      SMPTE ST2084
    Supported static metadata descriptors:
      Static metadata type 1
    Desired content max luminance: 142 (1083.404 cd/m^2)
    Desired content max frame-average luminance: 142 (1083.404 cd/m^2)
    Desired content min luminance: 0 (0.000 cd/m^2)
  Video Capability Data Block:
    YCbCr quantization: No Data
    RGB quantization: Selectable (via AVI Q)
    PT scan behavior: Always Underscanned
    IT scan behavior: Always Underscanned
    CE scan behavior: Always Underscanned
  Vendor-Specific Data Block (AMD), OUI 00-00-1A:
    Version: 3
    Flags 1: 0x0b
      FreeSync Supported
      FreeSync 2 HDR Supported
      Local Dimming Supported
    Minimum Refresh Rate: 48 Hz
    Maximum Refresh Rate: 160 Hz
    Flags 5: 0x20
      ST 2084 (PQ) EOTF Supported
    Maximum luminance: 142 (1083.404 cd/m^2)
    Minimum luminance: 5 (0.004 cd/m^2)
    Maximum luminance (without local dimming): 142 (1083.404 cd/m^2)
    Minimum luminance (without local dimming): 5 (0.004 cd/m^2)
    Additional Sink Information Address: 0x40c
  Detailed Timing Descriptors:
    DTD 2:  2560x1440   59.950550 Hz  16:9     88.787 kHz    241.500000 MHz (708 mm x 398 mm)
                 Hfront   48 Hsync  32 Hback   80 Hpol P
                 Vfront    3 Vsync   5 Vback   33 Vpol N
    DTD 3:  2560x1440  120.000000 Hz  16:9    183.000 kHz    483.120000 MHz (708 mm x 398 mm)
                 Hfront    8 Hsync  32 Hback   40 Hpol P
                 Vfront    6 Vsync   8 Vback   71 Vpol N
Checksum: 0xa3  Unused space in Extension Block: 22 bytes

----------------

Block 2, DisplayID Extension Block:
  Version: 1.2
  Extension Count: 0
  Display Product Type: Standalone display device
  Video Timing Modes Type 1 - Detailed Timings Data Block:
    DTD:  2560x1440  160.963727 Hz  16:9    250.460 kHz    681.250000 MHz (aspect 16:9, no 3D stereo)
               Hfront   48 Hsync  32 Hback   80 Hpol P
               Vfront    3 Vsync   5 Vback  108 Vpol N
    DTD:  3840x2160  119.998907 Hz  16:9    274.438 kHz   1097.750000 MHz (aspect 16:9, no 3D stereo)
               Hfront  112 Hsync  32 Hback   16 Hpol P
               Vfront  119 Vsync   5 Vback    3 Vpol N
    DTD:  3840x2160  144.000000 Hz  16:9    319.680 kHz   1278.720000 MHz (aspect 16:9, no 3D stereo)
               Hfront  112 Hsync  32 Hback   16 Hpol P
               Vfront   50 Vsync   5 Vback    5 Vpol N
    DTD:  3840x2160  160.000000 Hz  16:9    349.600 kHz   1398.400000 MHz (aspect 16:9, no 3D stereo)
               Hfront   48 Hsync  32 Hback   80 Hpol P
               Vfront   12 Vsync   5 Vback    8 Vpol N
  Checksum: 0x22
Checksum: 0x90

----------------

Warnings:

Block 0, Base EDID:
  Vendor & Product Identification: The serial number is one of the known dummy values, it should probably be set to 0.
Block 1, CTA-861 Extension Block:
  Video Data Block: VIC 18 and the first DTD are not identical. Is this intended?
  Colorimetry Data Block: Set the sRGB colorimetry bit to avoid interop issues.
  Video Capability Data Block: Set Selectable YCbCr Quantization to avoid interop issues.
  Video Capability Data Block: S_PT is equal to S_IT and S_CE, so should be set to 0 instead.
  Display Product Serial Number is set, so the Serial Number in the Base EDID should be 0.
EDID:
  Base EDID: Some timings are out of range of the Monitor Ranges:
    Vertical Freq: 24.000 - 160.964 Hz (Monitor: 48.000 - 160.000 Hz)
    Horizontal Freq: 27.000 - 349.600 kHz (Monitor: 352.000 - 352.000 kHz)

Failures:

EDID:
  Extension Block 3 started with EDID header, ignoring Extension Blocks >= 3.
  DisplayID: Missing DisplayID Display Parameters Data Block.
  DisplayID: DisplayID expects at least one preferred timing.

EDID conformity: FAIL
