edid-decode (hex):

00 ff ff ff ff ff ff 00 09 e5 ef 0c 00 00 00 00
0a 22 01 04 a5 27 18 78 07 e8 f5 a7 55 4e a0 26
0e 50 54 00 00 00 01 01 01 01 01 01 01 01 01 01
01 01 01 01 01 01 98 40 80 c8 70 b0 64 40 30 20
66 00 84 f2 10 00 00 1a 00 00 00 fd 00 30 90 d7
d7 28 01 0a 20 20 20 20 20 20 00 00 00 fe 00 3d
4c 33 30 31 31 20 20 20 20 20 20 ff 00 00 00 fc
00 4e 45 31 38 30 57 55 4d 2d 4e 59 33 0a 01 04

70 20 79 02 00 21 00 1d 28 0f 74 09 80 07 b0 04
00 7b 8a 55 e9 04 a0 6a e2 0e 02 45 54 b0 5c b0
5c 00 42 12 78 22 00 14 3f 0e 06 85 7f 07 c7 00
2f 00 1f 00 af 04 63 00 05 00 05 00 2b 00 0c 27
00 30 8f 00 00 27 00 30 3b 00 00 2e 00 06 00 42
b0 5c b0 5c 81 00 1e 72 1a 00 00 03 71 30 90 00
00 53 ff 53 ff 90 00 00 00 00 e3 05 04 00 e6 06
01 01 53 53 ff 00 00 00 00 00 00 00 00 00 60 90

00 ff ff ff ff ff ff 00 09 e5 ef 0c 00 00 00 00
0a 22 01 04 a5 27 18 78 07 e8 f5 a7 55 4e a0 26
0e 50 54 00 00 00 01 01 01 01 01 01 01 01 01 01
01 01 01 01 01 01 98 40 80 c8 70 b0 64 40 30 20
66 00 84 f2 10 00 00 1a 00 00 00 fd 00 30 90 d7
d7 28 01 0a 20 20 20 20 20 20 00 00 00 fe 00 3d
4c 33 30 31 31 20 20 20 20 20 20 ff 00 00 00 fc
00 4e 45 31 38 30 57 55 4d 2d 4e 59 33 0a 01 04

70 20 79 02 00 21 00 1d 28 0f 74 09 80 07 b0 04
00 7b 8a 55 e9 04 a0 6a e2 0e 02 45 54 b0 5c b0
5c 00 42 12 78 22 00 14 3f 0e 06 85 7f 07 c7 00
2f 00 1f 00 af 04 63 00 05 00 05 00 2b 00 0c 27
00 30 8f 00 00 27 00 30 3b 00 00 2e 00 06 00 42
b0 5c b0 5c 81 00 1e 72 1a 00 00 03 71 30 90 00
00 53 ff 53 ff 90 00 00 00 00 e3 05 04 00 e6 06
01 01 53 53 ff 00 00 00 00 00 00 00 00 00 60 90

----------------

Block 0, Base EDID:
  EDID Structure Version & Revision: 1.4
  Vendor & Product Identification:
    Manufacturer: BOE
    Model: 3311
    Made in: week 10 of 2024
  Basic Display Parameters & Features:
    Digital display
    Bits per primary color channel: 8
    DisplayPort interface
    Maximum image size: 39 cm x 24 cm
    Gamma: 2.20
    Supported color formats: RGB 4:4:4
    Default (sRGB) color space is primary color space
    First detailed timing includes the native pixel format and preferred refresh rate
    Display supports continuous frequencies
  Color Characteristics:
    Red  : 0.6552, 0.3339
    Green: 0.3066, 0.6250
    Blue : 0.1513, 0.0576
    White: 0.3134, 0.3291
  Established Timings I & II: none
  Standard Timings: none
  Detailed Timing Descriptors:
    DTD 1:  1920x1200   60.000000 Hz  16:10    78.000 kHz    165.360000 MHz (388 mm x 242 mm)
                 Hfront   48 Hsync  32 Hback  120 Hpol P
                 Vfront    6 Vsync   6 Vback   88 Vpol N
    Display Range Limits:
      Monitor ranges (Range Limits Only): 48-144 Hz V, 215-215 kHz H, max dotclock 400 MHz
    Alphanumeric Data String: '=L3011      '
    Display Product Name: 'NE180WUM-NY3'
  Extension blocks: 1
Checksum: 0x04

----------------

Block 1, DisplayID Extension Block:
  Version: 2.0
  Extension Count: 0
  Display Product Primary Use Case: None of the listed primary use cases; generic display
  Display Parameters Data Block (0x21):
    Image size: 388.0 mm x 242.0 mm
    Display native pixel format: 1920x1200
    Scan Orientation: Left to Right, Top to Bottom
    Luminance Information: Minimum guaranteed value
    Color Information: CIE 1931
    Audio Speaker Information: integrated
    Native Color Chromaticity:
      Primary #1:  (0.655029, 0.333984)
      Primary #2:  (0.306885, 0.625000)
      Primary #3:  (0.150879, 0.058105)
      White Point: (0.312988, 0.329102)
    Native Maximum Luminance (Full Coverage): 300.000000 cd/m^2
    Native Maximum Luminance (10% Rectangular Coverage): 300.000000 cd/m^2
    Native Minimum Luminance: 3.000000 cd/m^2
    Native Color Depth: 8 bpc
    Display Device Technology: Active Matrix LCD
    Native Gamma EOTF: 2.20
  Video Timing Modes Type 7 - Detailed Timings Data Block:
    DTD:  1920x1200  144.000000 Hz  16:10   187.200 kHz    396.864000 MHz (aspect 16:10, no 3D stereo, preferred)
               Hfront   48 Hsync  32 Hback  120 Hpol N
               Vfront    6 Vsync   6 Vback   88 Vpol N
  Adaptive Sync Data Block:
    Descriptor #1:
      Native Panel Range
      Fixed Average V-Total and Adaptive V-Total
      Supports Seamless Transition
      'Max Single Frame Duration Increase' field value without jitter impact
      'Max Single Frame Duration Decrease' field value without jitter impact
      Max Duration Increase: 0.00 ms
      Max Duration Decrease: 0.00 ms
      Min Refresh Rate: 48 Hz
      Max Refresh Rate: 144 Hz
    Descriptor #2:
      Native Panel Range
      Fixed Average V-Total and Adaptive V-Total
      Supports Seamless Transition
      'Max Single Frame Duration Increase' field value without jitter impact
      'Max Single Frame Duration Decrease' field value without jitter impact
      Max Duration Increase: 0.00 ms
      Max Duration Decrease: 0.00 ms
      Min Refresh Rate: 48 Hz
      Max Refresh Rate: 60 Hz
  Brightness Luminance Range Data Block:
    Minimum SDR Luminance (Full Coverage): 3.000000 cd/m^2
    Maximum Suggested SDR Luminance (Full Coverage): 300.000000 cd/m^2
    Maximum Boost SDR Luminance: 300.000000 cd/m^2
  CTA-861 DisplayID Data Block:
  Vendor-Specific Data Block (AMD), OUI 00-00-1A:
    Version: 3
    Feature Caps: 0x71
      FreeSync Panel Replay Supported
    Minimum Refresh Rate: 48 Hz
    Maximum Refresh Rate: 144 Hz
    Flags 1.x: 0x00
    Flags 2.x: 0x00
  Colorimetry Data Block:
    sYCC601
  HDR Static Metadata Data Block:
    Electro optical transfer functions:
      Traditional gamma - SDR luminance range
    Supported static metadata descriptors:
      Static metadata type 1
    Desired content max luminance: 83 (301.833 cd/m^2)
    Desired content max frame-average luminance: 83 (301.833 cd/m^2)
    Desired content min luminance: 255 (3.018 cd/m^2)
  Checksum: 0x60
Checksum: 0x90

----------------

Warnings:

EDID:
  Base EDID: Some timings are out of range of the Monitor Ranges:
    Horizontal Freq: 78.000 - 187.200 kHz (Monitor: 215.000 - 215.000 kHz)

Failures:

Block 0, Base EDID:
  Basic Display Parameters & Features: sRGB is signaled, but the chromaticities do not match.
  Alphanumeric Data String: 0xff byte at position 12.
EDID:
  Extension Block 2 started with EDID header, ignoring Extension Blocks >= 2.

EDID conformity: FAIL
