edid-decode (hex):

00 ff ff ff ff ff ff 00 0e 11 59 14 57 57 48 31
18 0e 01 03 68 1e 16 8c ee 12 e5 9a 57 4f 93 26
21 4e 53 ad ee 00 01 01 01 01 01 01 01 01 01 01
01 01 01 01 01 01 64 19 00 40 41 00 26 30 18 88
36 00 2c dc 10 00 00 18 00 00 00 ff 00 43 4e 43
34 32 34 31 48 57 57 0a 20 20 00 00 00 fd 00 38
4c 1e 3d 08 00 0a 20 20 20 20 20 20 00 00 00 fc
00 43 4f 4d 50 41 51 20 46 50 35 33 31 35 00 8f

00 ff ff ff ff ff ff 00 0e 11 59 14 57 57 48 31
18 0e 01 03 68 1e 16 8c ee 12 e5 9a 57 4f 93 26
21 4e 53 ad ee 00 01 01 01 01 01 01 01 01 01 01
01 01 01 01 01 01 64 19 00 40 41 00 26 30 18 88
36 00 2c dc 10 00 00 18 00 00 00 ff 00 43 4e 43
34 32 34 31 48 57 57 0a 20 20 00 00 00 fd 00 38
4c 1e 3d 08 00 0a 20 20 20 20 20 20 00 00 00 fc
00 43 4f 4d 50 41 51 20 46 50 35 33 31 35 00 8f

----------------

Block 0, Base EDID:
  EDID Structure Version & Revision: 1.3
  Vendor & Product Identification:
    Manufacturer: CPQ
    Model: 5209
    Serial Number: ...
    Made in: week 24 of 2004
  Basic Display Parameters & Features:
    Analog display
    Signal Level Standard: 0.700 : 0.000 : 0.700 V p-p
    Blank level equals black level
    Sync: Separate
    Maximum image size: 30 cm x 22 cm
    Gamma: 2.40
    DPMS levels: Standby Suspend Off
    RGB color display
    Default (sRGB) color space is primary color space
    First detailed timing is the preferred timing
  Color Characteristics:
    Red  : 0.6015, 0.3408
    Green: 0.3085, 0.5761
    Blue : 0.1513, 0.1308
    White: 0.3056, 0.3251
  Established Timings I & II:
    IBM     :   720x400    70.081663 Hz   9:5     31.467 kHz     28.320000 MHz
    DMT 0x04:   640x480    59.940476 Hz   4:3     31.469 kHz     25.175000 MHz
    DMT 0x05:   640x480    72.808802 Hz   4:3     37.861 kHz     31.500000 MHz
    DMT 0x06:   640x480    75.000000 Hz   4:3     37.500 kHz     31.500000 MHz
    DMT 0x09:   800x600    60.316541 Hz   4:3     37.879 kHz     40.000000 MHz
    DMT 0x0a:   800x600    72.187572 Hz   4:3     48.077 kHz     50.000000 MHz
    DMT 0x0b:   800x600    75.000000 Hz   4:3     46.875 kHz     49.500000 MHz
    Apple   :   832x624    74.551266 Hz   4:3     49.726 kHz     57.284000 MHz
    DMT 0x10:  1024x768    60.003840 Hz   4:3     48.363 kHz     65.000000 MHz
    DMT 0x11:  1024x768    70.069359 Hz   4:3     56.476 kHz     75.000000 MHz
    DMT 0x12:  1024x768    75.028582 Hz   4:3     60.023 kHz     78.750000 MHz
  Standard Timings: none
  Detailed Timing Descriptors:
    DTD 1:  1024x768    60.003840 Hz   4:3     48.363 kHz     65.000000 MHz (300 mm x 220 mm)
                 Hfront   24 Hsync 136 Hback  160 Hpol N
                 Vfront    3 Vsync   6 Vback   29 Vpol N
    Display Product Serial Number: ...
    Display Range Limits:
      Monitor ranges (GTF): 56-76 Hz V, 30-61 kHz H, max dotclock 80 MHz
    Display Product Name: 'COMPAQ FP5315'
Checksum: 0x8f

----------------

Warnings:

Block 0, Base EDID:
  Basic Display Parameters & Features: sRGB is signaled, but the gamma != 2.2.

Failures:

Block 0, Base EDID:
  Basic Display Parameters & Features: sRGB is signaled, but the chromaticities do not match.
EDID:
  Extension Block 1 started with EDID header, ignoring Extension Blocks >= 1.

EDID conformity: FAIL
