edid-decode (hex):

00 ff ff ff ff ff ff 00 4d d9 90 11 01 01 01 01
2f 0e 01 03 0c 26 1e 78 ea 2c 99 a6 58 4a 9a 26
21 48 4c a1 08 00 81 80 81 40 01 01 01 01 01 01
01 01 01 01 01 01 30 2a 00 98 51 00 2a 40 30 70
13 00 65 1e 11 00 00 1e 00 00 00 fd 00 30 41 1c
41 0b 00 0a 20 20 20 20 20 20 00 00 00 fc 00 53
44 4d 2d 48 53 39 33 0a 20 20 20 20 00 00 00 ff
00 31 33 35 35 33 37 31 0a 20 20 20 20 20 00 ed

----------------

Block 0, Base EDID:
  EDID Structure Version & Revision: 1.3
  Vendor & Product Identification:
    Manufacturer: SNY
    Model: 4496
    Serial Number: ...
    Made in: week 47 of 2004
  Basic Display Parameters & Features:
    Analog display
    Signal Level Standard: 0.700 : 0.300 : 1.000 V p-p
    Blank level equals black level
    Sync: Separate Composite
    Maximum image size: 38 cm x 30 cm
    Gamma: 2.20
    DPMS levels: Standby Suspend Off
    RGB color display
    First detailed timing is the preferred timing
  Color Characteristics:
    Red  : 0.6484, 0.3457
    Green: 0.2919, 0.6015
    Blue : 0.1503, 0.1298
    White: 0.2832, 0.2978
  Established Timings I & II:
    IBM     :   720x400    70.081663 Hz   9:5     31.467 kHz     28.320000 MHz
    DMT 0x04:   640x480    59.940476 Hz   4:3     31.469 kHz     25.175000 MHz
    DMT 0x09:   800x600    60.316541 Hz   4:3     37.879 kHz     40.000000 MHz
    DMT 0x10:  1024x768    60.003840 Hz   4:3     48.363 kHz     65.000000 MHz
  Standard Timings:
    DMT 0x23:  1280x1024   60.019740 Hz   5:4     63.981 kHz    108.000000 MHz
    DMT 0x20:  1280x960    60.000000 Hz   4:3     60.000 kHz    108.000000 MHz
  Detailed Timing Descriptors:
    DTD 1:  1280x1024   60.019740 Hz   5:4     63.981 kHz    108.000000 MHz (357 mm x 286 mm)
                 Hfront   48 Hsync 112 Hback  248 Hpol P
                 Vfront    1 Vsync   3 Vback   38 Vpol P
    Display Range Limits:
      Monitor ranges (GTF): 48-65 Hz V, 28-65 kHz H, max dotclock 110 MHz
    Display Product Name: 'SDM-HS93'
    Display Product Serial Number: ...
Checksum: 0xed

----------------

Warnings:

Block 0, Base EDID:
  Vendor & Product Identification: The serial number is one of the known dummy values, it should probably be set to 0.
EDID:
  Base EDID: Some timings are out of range of the Monitor Ranges:
    Vertical Freq: 59.940 - 70.082 Hz (Monitor: 48.000 - 65.000 Hz)

Failures:

Block 0, Base EDID:
  Detailed Timing Descriptor #1: Mismatch of image size 357x286 mm vs display size 380x300 mm.

EDID conformity: FAIL
