edid-decode (hex):

00 ff ff ff ff ff ff 00 10 ac 07 a1 42 37 42 30
23 1e 01 03 80 78 22 78 ec ee 91 a3 54 4c 99 26
0f 50 54 a5 4b 00 71 4f 81 00 81 80 a9 40 d1 c0
01 01 01 01 01 01 1a 68 00 a0 f0 38 1f 40 30 20
3a 00 ae 51 41 00 00 1a 00 00 00 fe 00 31 33 30
34 30 38 31 39 2d 31 33 30 34 00 00 00 fc 00 44
65 6c 6c 20 55 34 39 31 39 44 57 0a 00 00 00 fd
00 18 56 19 73 2f 00 0a 20 20 20 20 20 20 02 94

02 03 20 b1 4b 90 05 04 03 02 01 14 1f 12 13 5a
67 03 0c 00 10 00 38 44 67 d8 5d c4 01 78 80 00
cd 46 00 a0 a0 38 1f 40 30 20 3a 00 ae 51 41 00
00 1a 00 00 00 00 00 00 00 00 00 00 00 00 00 00
00 00 00 00 00 00 00 00 00 00 00 00 00 00 00 00
00 00 00 00 00 00 00 00 00 00 00 00 00 00 00 00
00 00 00 00 00 00 00 00 00 00 00 00 00 00 00 00
00 00 00 00 00 00 00 00 00 00 00 00 00 00 00 65

00 ff ff ff ff ff ff 00 10 ac 07 a1 42 37 42 30
23 1e 01 03 80 78 22 78 ec ee 91 a3 54 4c 99 26
0f 50 54 a5 4b 00 71 4f 81 00 81 80 a9 40 d1 c0
01 01 01 01 01 01 1a 68 00 a0 f0 38 1f 40 30 20
3a 00 ae 51 41 00 00 1a 00 00 00 fe 00 31 33 30
34 30 38 31 39 2d 31 33 30 34 00 00 00 fc 00 44
65 6c 6c 20 55 34 39 31 39 44 57 0a 00 00 00 fd
00 18 56 19 73 2f 00 0a 20 20 20 20 20 20 02 94

00 ff ff ff ff ff ff 00 10 ac 07 a1 42 37 42 30
23 1e 01 03 80 78 22 78 ec ee 91 a3 54 4c 99 26
0f 50 54 a5 4b 00 71 4f 81 00 81 80 a9 40 d1 c0
01 01 01 01 01 01 1a 68 00 a0 f0 38 1f 40 30 20
3a 00 ae 51 41 00 00 1a 00 00 00 fe 00 31 33 30
34 30 38 31 39 2d 31 33 30 34 00 00 00 fc 00 44
65 6c 6c 20 55 34 39 31 39 44 57 0a 00 00 00 fd
00 18 56 19 73 2f 00 0a 20 20 20 20 20 20 02 94

02 03 20 b1 4b 90 05 04 03 02 01 14 1f 12 13 5a
67 03 0c 00 10 00 38 44 67 d8 5d c4 01 78 80 00
cd 46 00 a0 a0 38 1f 40 30 20 3a 00 ae 51 41 00
00 1a 00 00 00 00 00 00 00 00 00 00 00 00 00 00
00 00 00 00 00 00 00 00 00 00 00 00 00 00 00 00
00 00 00 00 00 00 00 00 00 00 00 00 00 00 00 00
00 00 00 00 00 00 00 00 00 00 00 00 00 00 00 00
00 00 00 00 00 00 00 00 00 00 00 00 00 00 00 65

00 ff ff ff ff ff ff 00 10 ac 07 a1 42 37 42 30
23 1e 01 03 80 78 22 78 ec ee 91 a3 54 4c 99 26
0f 50 54 a5 4b 00 71 4f 81 00 81 80 a9 40 d1 c0
01 01 01 01 01 01 1a 68 00 a0 f0 38 1f 40 30 20
3a 00 ae 51 41 00 00 1a 00 00 00 fe 00 31 33 30
34 30 38 31 39 2d 31 33 30 34 00 00 00 fc 00 44
65 6c 6c 20 55 34 39 31 39 44 57 0a 00 00 00 fd
00 18 56 19 73 2f 00 0a 20 20 20 20 20 20 02 94

----------------

Block 0, Base EDID:
  EDID Structure Version & Revision: 1.3
  Vendor & Product Identification:
    Manufacturer: DEL
    Model: 41223
    Serial Number: ...
    Made in: week 35 of 2020
  Basic Display Parameters & Features:
    Digital display
    Maximum image size: 120 cm x 34 cm
    Gamma: 2.20
    DPMS levels: Standby Suspend Off
    RGB color display
    Default (sRGB) color space is primary color space
  Color Characteristics:
    Red  : 0.6396, 0.3300
    Green: 0.2998, 0.5996
    Blue : 0.1503, 0.0595
    White: 0.3125, 0.3291
  Established Timings I & II:
    IBM     :   720x400    70.081663 Hz   9:5     31.467 kHz     28.320000 MHz
    DMT 0x04:   640x480    59.940476 Hz   4:3     31.469 kHz     25.175000 MHz
    DMT 0x06:   640x480    75.000000 Hz   4:3     37.500 kHz     31.500000 MHz
    DMT 0x09:   800x600    60.316541 Hz   4:3     37.879 kHz     40.000000 MHz
    DMT 0x0b:   800x600    75.000000 Hz   4:3     46.875 kHz     49.500000 MHz
    DMT 0x10:  1024x768    60.003840 Hz   4:3     48.363 kHz     65.000000 MHz
    DMT 0x12:  1024x768    75.028582 Hz   4:3     60.023 kHz     78.750000 MHz
    DMT 0x24:  1280x1024   75.024675 Hz   5:4     79.976 kHz    135.000000 MHz
  Standard Timings:
    DMT 0x15:  1152x864    75.000000 Hz   4:3     67.500 kHz    108.000000 MHz
    DMT 0x1c:  1280x800    59.810326 Hz  16:10    49.702 kHz     83.500000 MHz
    DMT 0x23:  1280x1024   60.019740 Hz   5:4     63.981 kHz    108.000000 MHz
    DMT 0x33:  1600x1200   60.000000 Hz   4:3     75.000 kHz    162.000000 MHz
    DMT 0x52:  1920x1080   60.000000 Hz  16:9     67.500 kHz    148.500000 MHz
  Detailed Timing Descriptors:
    DTD 1:  3840x1080   59.968497 Hz  32:9     66.625 kHz    266.500000 MHz (1198 mm x 337 mm)
                 Hfront   48 Hsync  32 Hback   80 Hpol P
                 Vfront    3 Vsync  10 Vback   18 Vpol N
    Alphanumeric Data String: '13040819-1304'
    Display Product Name: 'Dell U4919DW'
    Display Range Limits:
      Monitor ranges (GTF): 24-86 Hz V, 25-115 kHz H, max dotclock 470 MHz
  Extension blocks: 2
Checksum: 0x94

----------------

Block 1, CTA-861 Extension Block:
  Revision: 3
  Underscans IT Video Formats by default
  Supports YCbCr 4:4:4
  Supports YCbCr 4:2:2
  Native DTDs: 1
  Video Data Block:
    VIC  16:  1920x1080   60.000000 Hz  16:9     67.500 kHz    148.500000 MHz (native)
    VIC   5:  1920x1080i  60.000000 Hz  16:9     33.750 kHz     74.250000 MHz
    VIC   4:  1280x720    60.000000 Hz  16:9     45.000 kHz     74.250000 MHz
    VIC   3:   720x480    59.940060 Hz  16:9     31.469 kHz     27.000000 MHz
    VIC   2:   720x480    59.940060 Hz   4:3     31.469 kHz     27.000000 MHz
    VIC   1:   640x480    59.940476 Hz   4:3     31.469 kHz     25.175000 MHz
    VIC  20:  1920x1080i  50.000000 Hz  16:9     28.125 kHz     74.250000 MHz
    VIC  31:  1920x1080   50.000000 Hz  16:9     56.250 kHz    148.500000 MHz
    VIC  18:   720x576    50.000000 Hz  16:9     31.250 kHz     27.000000 MHz
    VIC  19:  1280x720    50.000000 Hz  16:9     37.500 kHz     74.250000 MHz
    VIC  90:  2560x1080   60.000000 Hz  64:27    66.000 kHz    198.000000 MHz
  Vendor-Specific Data Block (HDMI), OUI 00-0C-03:
    Source physical address: 1.0.0.0
    DC_36bit
    DC_30bit
    DC_Y444
    Maximum TMDS clock: 340 MHz
  Vendor-Specific Data Block (HDMI Forum), OUI C4-5D-D8:
    Version: 1
    Maximum TMDS Character Rate: 600 MHz
    SCDC Present
  Detailed Timing Descriptors:
    DTD 2:  2560x1080   59.978424 Hz  64:27    66.636 kHz    181.250000 MHz (1198 mm x 337 mm)
                 Hfront   48 Hsync  32 Hback   80 Hpol P
                 Vfront    3 Vsync  10 Vback   18 Vpol N
Checksum: 0x65  Unused space in Extension Block: 77 bytes

----------------

Warnings:

Block 1, CTA-861 Extension Block:
  Video Data Block: VIC 16 and the first DTD are not identical. Is this intended?
  Detailed Timing Descriptor #2: Image size is 1198x337 mm, but based on the picture AR it should be 798x337 mm.

Failures:

Block 0, Base EDID:
  Basic Display Parameters & Features: EDID 1.3 requires that the first detailed timing is the preferred timing.
Block 1, CTA-861 Extension Block:
  Missing VCDB, needed for Set Selectable RGB Quantization to avoid interop issues.
EDID:
  Extension Block 2 started with EDID header, ignoring Extension Blocks >= 2.
  Base EDID: EDID specified 2 extension block(s), but found 1 extension block(s).
  CTA-861: Native progressive timings are a mix of several resolutions.

EDID conformity: FAIL
