edid-decode (hex):

00 ff ff ff ff ff ff 00 21 34 02 8d 03 00 00 00
0b 12 01 03 88 2f 1e 78 ea ee 95 a3 54 4c 99 26
0f 50 54 ad cf 00 95 00 81 80 01 01 01 01 01 01
01 01 01 01 01 01 7c 2e 90 a0 60 1a 1e 40 30 20
36 00 da 28 11 00 00 1a 66 21 50 b0 51 00 1b 30
40 70 36 00 da 28 11 00 00 1f 00 00 00 fc 00 48
44 49 54 32 32 44 0a 20 20 20 20 20 00 00 00 fd
00 38 4c 1f 50 0f 00 0a 20 20 20 20 20 20 01 90

00 ff ff ff ff ff ff 00 21 34 02 8d 03 00 00 00
0b 12 01 03 88 2f 1e 78 ea ee 95 a3 54 4c 99 26
0f 50 54 ad cf 00 95 00 81 80 01 01 01 01 01 01
01 01 01 01 01 01 7c 2e 90 a0 60 1a 1e 40 30 20
36 00 da 28 11 00 00 1a 66 21 50 b0 51 00 1b 30
40 70 36 00 da 28 11 00 00 1f 00 00 00 fc 00 48
44 49 54 32 32 44 0a 20 20 20 20 20 00 00 00 fd
00 38 4c 1f 50 0f 00 0a 20 20 20 20 20 20 01 90

----------------

Block 0, Base EDID:
  EDID Structure Version & Revision: 1.3
  Vendor & Product Identification:
    Manufacturer: HIT
    Model: 36098
    Serial Number: ...
    Made in: week 11 of 2008
  Basic Display Parameters & Features:
    Digital display
    Maximum image size: 47 cm x 30 cm
    Gamma: 2.20
    DPMS levels: Standby Suspend Off
    RGB color display
    First detailed timing is the preferred timing
  Color Characteristics:
    Red  : 0.6396, 0.3300
    Green: 0.2998, 0.5996
    Blue : 0.1503, 0.0595
    White: 0.3134, 0.3291
  Established Timings I & II:
    IBM     :   720x400    70.081663 Hz   9:5     31.467 kHz     28.320000 MHz
    DMT 0x04:   640x480    59.940476 Hz   4:3     31.469 kHz     25.175000 MHz
    DMT 0x05:   640x480    72.808802 Hz   4:3     37.861 kHz     31.500000 MHz
    DMT 0x06:   640x480    75.000000 Hz   4:3     37.500 kHz     31.500000 MHz
    DMT 0x09:   800x600    60.316541 Hz   4:3     37.879 kHz     40.000000 MHz
    DMT 0x0a:   800x600    72.187572 Hz   4:3     48.077 kHz     50.000000 MHz
    DMT 0x0b:   800x600    75.000000 Hz   4:3     46.875 kHz     49.500000 MHz
    DMT 0x10:  1024x768    60.003840 Hz   4:3     48.363 kHz     65.000000 MHz
    DMT 0x11:  1024x768    70.069359 Hz   4:3     56.476 kHz     75.000000 MHz
    DMT 0x12:  1024x768    75.028582 Hz   4:3     60.023 kHz     78.750000 MHz
    DMT 0x24:  1280x1024   75.024675 Hz   5:4     79.976 kHz    135.000000 MHz
  Standard Timings:
    DMT 0x2f:  1440x900    59.887445 Hz  16:10    55.935 kHz    106.500000 MHz
    DMT 0x23:  1280x1024   60.019740 Hz   5:4     63.981 kHz    108.000000 MHz
  Detailed Timing Descriptors:
    DTD 1:  1680x1050   59.883253 Hz  16:10    64.674 kHz    119.000000 MHz (474 mm x 296 mm)
                 Hfront   48 Hsync  32 Hback   80 Hpol P
                 Vfront    3 Vsync   6 Vback   21 Vpol N
    DTD 2:  1360x768    60.015162 Hz  85:48    47.712 kHz     85.500000 MHz (474 mm x 296 mm)
                 Hfront   64 Hsync 112 Hback  256 Hpol P
                 Vfront    3 Vsync   6 Vback   18 Vpol P
    Display Product Name: 'HDIT22D'
    Display Range Limits:
      Monitor ranges (GTF): 56-76 Hz V, 31-80 kHz H, max dotclock 150 MHz
  Extension blocks: 1
Checksum: 0x90

----------------

Block 1, Unknown EDID Extension Block 0x00:
  00 ff ff ff ff ff ff 00 21 34 02 8d 03 00 00 00 '........!4......'
  0b 12 01 03 88 2f 1e 78 ea ee 95 a3 54 4c 99 26 '...../.x....TL.&'
  0f 50 54 ad cf 00 95 00 81 80 01 01 01 01 01 01 '.PT.............'
  01 01 01 01 01 01 7c 2e 90 a0 60 1a 1e 40 30 20 '......|...`..@0 '
  36 00 da 28 11 00 00 1a 66 21 50 b0 51 00 1b 30 '6..(....f!P.Q..0'
  40 70 36 00 da 28 11 00 00 1f 00 00 00 fc 00 48 '@p6..(.........H'
  44 49 54 32 32 44 0a 20 20 20 20 20 00 00 00 fd 'DIT22D.     ....'
  00 38 4c 1f 50 0f 00 0a 20 20 20 20 20 20 01 90 '.8L.P...      ..'
Checksum: 0x90

----------------

Warnings:

Block 0, Base EDID:
  Detailed Timing Descriptor #2: Image size is 474x296 mm, but based on the picture AR it should be 474x267 mm.

Failures:

Block 0, Base EDID:
  Basic Display Parameters & Features: Digital Video Interface Standard set to reserved value 0x08.
Block 1, Base EDID:
  Unknown Extension Block.

EDID conformity: FAIL
