edid-decode (hex):

00 ff ff ff ff ff ff 00 4d d9 5a 07 00 00 00 03
0a 1f 01 04 b5 3c 22 78 bb 11 85 ae 50 46 a8 24
0f 50 54 21 08 00 81 80 d1 c0 01 01 01 01 01 01
01 01 01 01 01 01 4d d0 00 a0 f0 70 3e 80 30 20
35 00 54 4f 21 00 00 1a 00 00 00 ff 00 30 30 30
30 30 30 31 0a 20 20 20 20 20 00 00 00 fc 00 53
44 4d 55 32 37 4d 39 30 2a 33 30 0a 00 00 00 fd
0c 30 90 4f 4f 86 01 0a 20 20 20 20 20 20 02 0b

02 03 2b f1 53 76 61 10 60 5f 5e 5d 3f 1f 20 21
22 04 13 03 02 12 11 01 23 09 07 07 83 01 00 00
e3 05 c0 00 e6 06 05 01 7d 7d 0d 56 5e 00 a0 a0
a0 29 50 30 20 35 00 54 4f 21 00 00 1a 79 c2 00
a0 a0 a0 55 50 30 20 35 00 54 4f 21 00 00 1a 09
ec 00 a0 a0 a0 67 50 30 20 35 00 54 4f 21 00 00
1a 4d d0 00 a0 f0 70 3e 80 30 20 35 00 54 4f 21
00 00 1a 00 00 00 00 00 00 00 00 00 00 00 00 0b

00 ff ff ff ff ff ff 00 4d d9 5a 07 00 00 00 03
0a 1f 01 04 b5 3c 22 78 bb 11 85 ae 50 46 a8 24
0f 50 54 21 08 00 81 80 d1 c0 01 01 01 01 01 01
01 01 01 01 01 01 4d d0 00 a0 f0 70 3e 80 30 20
35 00 54 4f 21 00 00 1a 00 00 00 ff 00 30 30 30
30 30 30 31 0a 20 20 20 20 20 00 00 00 fc 00 53
44 4d 55 32 37 4d 39 30 2a 33 30 0a 00 00 00 fd
0c 30 90 4f 4f 86 01 0a 20 20 20 20 20 20 02 0b

00 ff ff ff ff ff ff 00 4d d9 5a 07 00 00 00 03
0a 1f 01 04 b5 3c 22 78 bb 11 85 ae 50 46 a8 24
0f 50 54 21 08 00 81 80 d1 c0 01 01 01 01 01 01
01 01 01 01 01 01 4d d0 00 a0 f0 70 3e 80 30 20
35 00 54 4f 21 00 00 1a 00 00 00 ff 00 30 30 30
30 30 30 31 0a 20 20 20 20 20 00 00 00 fc 00 53
44 4d 55 32 37 4d 39 30 2a 33 30 0a 00 00 00 fd
0c 30 90 4f 4f 86 01 0a 20 20 20 20 20 20 02 0b

02 03 2b f1 53 76 61 10 60 5f 5e 5d 3f 1f 20 21
22 04 13 03 02 12 11 01 23 09 07 07 83 01 00 00
e3 05 c0 00 e6 06 05 01 7d 7d 0d 56 5e 00 a0 a0
a0 29 50 30 20 35 00 54 4f 21 00 00 1a 79 c2 00
a0 a0 a0 55 50 30 20 35 00 54 4f 21 00 00 1a 09
ec 00 a0 a0 a0 67 50 30 20 35 00 54 4f 21 00 00
1a 4d d0 00 a0 f0 70 3e 80 30 20 35 00 54 4f 21
00 00 1a 00 00 00 00 00 00 00 00 00 00 00 00 0b

00 ff ff ff ff ff ff 00 4d d9 5a 07 00 00 00 03
0a 1f 01 04 b5 3c 22 78 bb 11 85 ae 50 46 a8 24
0f 50 54 21 08 00 81 80 d1 c0 01 01 01 01 01 01
01 01 01 01 01 01 4d d0 00 a0 f0 70 3e 80 30 20
35 00 54 4f 21 00 00 1a 00 00 00 ff 00 30 30 30
30 30 30 31 0a 20 20 20 20 20 00 00 00 fc 00 53
44 4d 55 32 37 4d 39 30 2a 33 30 0a 00 00 00 fd
0c 30 90 4f 4f 86 01 0a 20 20 20 20 20 20 02 0b

----------------

Block 0, Base EDID:
  EDID Structure Version & Revision: 1.4
  Vendor & Product Identification:
    Manufacturer: SNY
    Model: 1882
    Serial Number: ...
    Made in: week 10 of 2021
  Basic Display Parameters & Features:
    Digital display
    Bits per primary color channel: 10
    DisplayPort interface
    Maximum image size: 60 cm x 34 cm
    Gamma: 2.20
    DPMS levels: Standby Off
    Supported color formats: RGB 4:4:4, YCrCb 4:4:4, YCrCb 4:2:2
    First detailed timing includes the native pixel format and preferred refresh rate
    Display supports continuous frequencies
  Color Characteristics:
    Red  : 0.6796, 0.3134
    Green: 0.2734, 0.6572
    Blue : 0.1425, 0.0585
    White: 0.3134, 0.3291
  Established Timings I & II:
    DMT 0x04:   640x480    59.940476 Hz   4:3     31.469 kHz     25.175000 MHz
    DMT 0x09:   800x600    60.316541 Hz   4:3     37.879 kHz     40.000000 MHz
    DMT 0x10:  1024x768    60.003840 Hz   4:3     48.363 kHz     65.000000 MHz
  Standard Timings:
    DMT 0x23:  1280x1024   60.019740 Hz   5:4     63.981 kHz    108.000000 MHz
    DMT 0x52:  1920x1080   60.000000 Hz  16:9     67.500 kHz    148.500000 MHz
  Detailed Timing Descriptors:
    DTD 1:  3840x2160   59.996625 Hz  16:9    133.312 kHz    533.250000 MHz (596 mm x 335 mm)
                 Hfront   48 Hsync  32 Hback   80 Hpol P
                 Vfront    3 Vsync   5 Vback   54 Vpol N
    Display Product Serial Number: ...
    Display Product Name: 'SDMU27M90*30'
    Display Range Limits:
      Monitor ranges (Range Limits Only): 48-144 Hz V, 334-334 kHz H, max dotclock 1340 MHz
  Extension blocks: 2
Checksum: 0x0b

----------------

Block 1, CTA-861 Extension Block:
  Revision: 3
  Underscans IT Video Formats by default
  Basic audio support
  Supports YCbCr 4:4:4
  Supports YCbCr 4:2:2
  Native detailed modes: 1
  Video Data Block:
    VIC 118:  3840x2160  120.000000 Hz  16:9    270.000 kHz   1188.000000 MHz
    VIC  97:  3840x2160   60.000000 Hz  16:9    135.000 kHz    594.000000 MHz
    VIC  16:  1920x1080   60.000000 Hz  16:9     67.500 kHz    148.500000 MHz
    VIC  96:  3840x2160   50.000000 Hz  16:9    112.500 kHz    594.000000 MHz
    VIC  95:  3840x2160   30.000000 Hz  16:9     67.500 kHz    297.000000 MHz
    VIC  94:  3840x2160   25.000000 Hz  16:9     56.250 kHz    297.000000 MHz
    VIC  93:  3840x2160   24.000000 Hz  16:9     54.000 kHz    297.000000 MHz
    VIC  63:  1920x1080  120.000000 Hz  16:9    135.000 kHz    297.000000 MHz
    VIC  31:  1920x1080   50.000000 Hz  16:9     56.250 kHz    148.500000 MHz
    VIC  32:  1920x1080   24.000000 Hz  16:9     27.000 kHz     74.250000 MHz
    VIC  33:  1920x1080   25.000000 Hz  16:9     28.125 kHz     74.250000 MHz
    VIC  34:  1920x1080   30.000000 Hz  16:9     33.750 kHz     74.250000 MHz
    VIC   4:  1280x720    60.000000 Hz  16:9     45.000 kHz     74.250000 MHz
    VIC  19:  1280x720    50.000000 Hz  16:9     37.500 kHz     74.250000 MHz
    VIC   3:   720x480    59.940060 Hz  16:9     31.469 kHz     27.000000 MHz
    VIC   2:   720x480    59.940060 Hz   4:3     31.469 kHz     27.000000 MHz
    VIC  18:   720x576    50.000000 Hz  16:9     31.250 kHz     27.000000 MHz
    VIC  17:   720x576    50.000000 Hz   4:3     31.250 kHz     27.000000 MHz
    VIC   1:   640x480    59.940476 Hz   4:3     31.469 kHz     25.175000 MHz
  Audio Data Block:
    Linear PCM:
      Max channels: 2
      Supported sample rates (kHz): 48 44.1 32
      Supported sample sizes (bits): 24 20 16
  Speaker Allocation Data Block:
    FL/FR - Front Left/Right
  Colorimetry Data Block:
    BT2020YCC
    BT2020RGB
  HDR Static Metadata Data Block:
    Electro optical transfer functions:
      Traditional gamma - SDR luminance range
      SMPTE ST2084
    Supported static metadata descriptors:
      Static metadata type 1
    Desired content max luminance: 125 (749.667 cd/m^2)
    Desired content max frame-average luminance: 125 (749.667 cd/m^2)
    Desired content min luminance: 13 (0.019 cd/m^2)
  Detailed Timing Descriptors:
    DTD 2:  2560x1440   59.950550 Hz  16:9     88.787 kHz    241.500000 MHz (596 mm x 335 mm)
                 Hfront   48 Hsync  32 Hback   80 Hpol P
                 Vfront    3 Vsync   5 Vback   33 Vpol N
    DTD 3:  2560x1440  120.021697 Hz  16:9    183.033 kHz    497.850000 MHz (596 mm x 335 mm)
                 Hfront   48 Hsync  32 Hback   80 Hpol P
                 Vfront    3 Vsync   5 Vback   77 Vpol N
    DTD 4:  2560x1440  143.973257 Hz  16:9    222.151 kHz    604.250000 MHz (596 mm x 335 mm)
                 Hfront   48 Hsync  32 Hback   80 Hpol P
                 Vfront    3 Vsync   5 Vback   95 Vpol N
    DTD 5:  3840x2160   59.996625 Hz  16:9    133.312 kHz    533.250000 MHz (596 mm x 335 mm)
                 Hfront   48 Hsync  32 Hback   80 Hpol P
                 Vfront    3 Vsync   5 Vback   54 Vpol N
Checksum: 0x0b  Unused space in Extension Block: 12 bytes

----------------

Block 2, Unknown EDID Extension Block 0x00:
  00 ff ff ff ff ff ff 00 4d d9 5a 07 00 00 00 03 '........M.Z.....'
  0a 1f 01 04 b5 3c 22 78 bb 11 85 ae 50 46 a8 24 '.....<"x....PF.$'
  0f 50 54 21 08 00 81 80 d1 c0 01 01 01 01 01 01 '.PT!............'
  01 01 01 01 01 01 4d d0 00 a0 f0 70 3e 80 30 20 '......M....p>.0 '
  35 00 54 4f 21 00 00 1a 00 00 00 ff 00 30 30 30 '5.TO!........000'
  30 30 30 31 0a 20 20 20 20 20 00 00 00 fc 00 53 '0001.     .....S'
  44 4d 55 32 37 4d 39 30 2a 33 30 0a 00 00 00 fd 'DMU27M90*30.....'
  0c 30 90 4f 4f 86 01 0a 20 20 20 20 20 20 02 0b '.0.OO...      ..'
Checksum: 0x0b

----------------

Block 3, Unknown EDID Extension Block 0x00:
  00 ff ff ff ff ff ff 00 4d d9 5a 07 00 00 00 03 '........M.Z.....'
  0a 1f 01 04 b5 3c 22 78 bb 11 85 ae 50 46 a8 24 '.....<"x....PF.$'
  0f 50 54 21 08 00 81 80 d1 c0 01 01 01 01 01 01 '.PT!............'
  01 01 01 01 01 01 4d d0 00 a0 f0 70 3e 80 30 20 '......M....p>.0 '
  35 00 54 4f 21 00 00 1a 00 00 00 ff 00 30 30 30 '5.TO!........000'
  30 30 30 31 0a 20 20 20 20 20 00 00 00 fc 00 53 '0001.     .....S'
  44 4d 55 32 37 4d 39 30 2a 33 30 0a 00 00 00 fd 'DMU27M90*30.....'
  0c 30 90 4f 4f 86 01 0a 20 20 20 20 20 20 02 0b '.0.OO...      ..'
Checksum: 0x0b

----------------

Block 4, CTA-861 Extension Block:
  Revision: 3
  Underscans IT Video Formats by default
  Basic audio support
  Supports YCbCr 4:4:4
  Supports YCbCr 4:2:2
  Native detailed modes: 1
  Video Data Block:
    VIC 118:  3840x2160  120.000000 Hz  16:9    270.000 kHz   1188.000000 MHz
    VIC  97:  3840x2160   60.000000 Hz  16:9    135.000 kHz    594.000000 MHz
    VIC  16:  1920x1080   60.000000 Hz  16:9     67.500 kHz    148.500000 MHz
    VIC  96:  3840x2160   50.000000 Hz  16:9    112.500 kHz    594.000000 MHz
    VIC  95:  3840x2160   30.000000 Hz  16:9     67.500 kHz    297.000000 MHz
    VIC  94:  3840x2160   25.000000 Hz  16:9     56.250 kHz    297.000000 MHz
    VIC  93:  3840x2160   24.000000 Hz  16:9     54.000 kHz    297.000000 MHz
    VIC  63:  1920x1080  120.000000 Hz  16:9    135.000 kHz    297.000000 MHz
    VIC  31:  1920x1080   50.000000 Hz  16:9     56.250 kHz    148.500000 MHz
    VIC  32:  1920x1080   24.000000 Hz  16:9     27.000 kHz     74.250000 MHz
    VIC  33:  1920x1080   25.000000 Hz  16:9     28.125 kHz     74.250000 MHz
    VIC  34:  1920x1080   30.000000 Hz  16:9     33.750 kHz     74.250000 MHz
    VIC   4:  1280x720    60.000000 Hz  16:9     45.000 kHz     74.250000 MHz
    VIC  19:  1280x720    50.000000 Hz  16:9     37.500 kHz     74.250000 MHz
    VIC   3:   720x480    59.940060 Hz  16:9     31.469 kHz     27.000000 MHz
    VIC   2:   720x480    59.940060 Hz   4:3     31.469 kHz     27.000000 MHz
    VIC  18:   720x576    50.000000 Hz  16:9     31.250 kHz     27.000000 MHz
    VIC  17:   720x576    50.000000 Hz   4:3     31.250 kHz     27.000000 MHz
    VIC   1:   640x480    59.940476 Hz   4:3     31.469 kHz     25.175000 MHz
  Audio Data Block:
    Linear PCM:
      Max channels: 2
      Supported sample rates (kHz): 48 44.1 32
      Supported sample sizes (bits): 24 20 16
  Speaker Allocation Data Block:
    FL/FR - Front Left/Right
  Colorimetry Data Block:
    BT2020YCC
    BT2020RGB
  HDR Static Metadata Data Block:
    Electro optical transfer functions:
      Traditional gamma - SDR luminance range
      SMPTE ST2084
    Supported static metadata descriptors:
      Static metadata type 1
    Desired content max luminance: 125 (749.667 cd/m^2)
    Desired content max frame-average luminance: 125 (749.667 cd/m^2)
    Desired content min luminance: 13 (0.019 cd/m^2)
  Detailed Timing Descriptors:
    DTD 6:  2560x1440   59.950550 Hz  16:9     88.787 kHz    241.500000 MHz (596 mm x 335 mm)
                 Hfront   48 Hsync  32 Hback   80 Hpol P
                 Vfront    3 Vsync   5 Vback   33 Vpol N
    DTD 7:  2560x1440  120.021697 Hz  16:9    183.033 kHz    497.850000 MHz (596 mm x 335 mm)
                 Hfront   48 Hsync  32 Hback   80 Hpol P
                 Vfront    3 Vsync   5 Vback   77 Vpol N
    DTD 8:  2560x1440  143.973257 Hz  16:9    222.151 kHz    604.250000 MHz (596 mm x 335 mm)
                 Hfront   48 Hsync  32 Hback   80 Hpol P
                 Vfront    3 Vsync   5 Vback   95 Vpol N
    DTD 9:  3840x2160   59.996625 Hz  16:9    133.312 kHz    533.250000 MHz (596 mm x 335 mm)
                 Hfront   48 Hsync  32 Hback   80 Hpol P
                 Vfront    3 Vsync   5 Vback   54 Vpol N
Checksum: 0x0b  Unused space in Extension Block: 12 bytes

----------------

Block 5, Unknown EDID Extension Block 0x00:
  00 ff ff ff ff ff ff 00 4d d9 5a 07 00 00 00 03 '........M.Z.....'
  0a 1f 01 04 b5 3c 22 78 bb 11 85 ae 50 46 a8 24 '.....<"x....PF.$'
  0f 50 54 21 08 00 81 80 d1 c0 01 01 01 01 01 01 '.PT!............'
  01 01 01 01 01 01 4d d0 00 a0 f0 70 3e 80 30 20 '......M....p>.0 '
  35 00 54 4f 21 00 00 1a 00 00 00 ff 00 30 30 30 '5.TO!........000'
  30 30 30 31 0a 20 20 20 20 20 00 00 00 fc 00 53 '0001.     .....S'
  44 4d 55 32 37 4d 39 30 2a 33 30 0a 00 00 00 fd 'DMU27M90*30.....'
  0c 30 90 4f 4f 86 01 0a 20 20 20 20 20 20 02 0b '.0.OO...      ..'
Checksum: 0x0b

----------------

Warnings:

Block 0, Base EDID:
  Display Product Serial Number: ...
Block 1, CTA-861 Extension Block:
  Video Data Block: VIC 118 and the first DTD are not identical. Is this intended?
  Colorimetry Data Block: Set the sRGB colorimetry bit to avoid interop issues.
  Display Product Serial Number is set, so the Serial Number in the Base EDID should be 0.
Block 4, CTA-861 Extension Block:
  Colorimetry Data Block: Set the sRGB colorimetry bit to avoid interop issues.
EDID:
  Base EDID: Some timings are out of range of the Monitor Ranges:
    Vertical Freq: 24.000 - 143.973 Hz (Monitor: 48.000 - 144.000 Hz)
    Horizontal Freq: 27.000 - 270.000 kHz (Monitor: 334.000 - 334.000 kHz)

Failures:

Block 1, CTA-861 Extension Block:
  Missing VCDB, needed for Set Selectable RGB Quantization to avoid interop issues.
Block 2, Base EDID:
  Unknown Extension Block.
Block 3, Base EDID:
  Unknown Extension Block.
Block 4, CTA-861 Extension Block:
  Video Data Block: Duplicate VIC 118.
  Video Data Block: Duplicate VIC 97.
  Video Data Block: Duplicate VIC 16.
  Video Data Block: Duplicate VIC 96.
  Video Data Block: Duplicate VIC 95.
  Video Data Block: Duplicate VIC 94.
  Video Data Block: Duplicate VIC 93.
  Video Data Block: Duplicate VIC 63.
  Video Data Block: Duplicate VIC 31.
  Video Data Block: Duplicate VIC 32.
  Video Data Block: Duplicate VIC 33.
  Video Data Block: Duplicate VIC 34.
  Video Data Block: Duplicate VIC 4.
  Video Data Block: Duplicate VIC 19.
  Video Data Block: Duplicate VIC 3.
  Video Data Block: Duplicate VIC 2.
  Video Data Block: Duplicate VIC 18.
  Video Data Block: Duplicate VIC 17.
  Video Data Block: Duplicate VIC 1.
  Speaker Allocation Data Block: Only one instance of this Data Block is allowed.
  Colorimetry Data Block: Only one instance of this Data Block is allowed.
  HDR Static Metadata Data Block: Only one instance of this Data Block is allowed.
Block 5, Base EDID:
  Unknown Extension Block.
EDID:
  Base EDID: EDID specified 2 extension block(s), but found 5 extension block(s).

EDID conformity: FAIL
