edid-decode (hex):

00 ff ff ff ff ff ff 00 04 72 42 0d 2a 67 91 42
1d 22 01 03 80 3c 21 78 2a 9b 81 ad 4f 40 9e 25
11 50 54 bf ef 00 71 4f 81 40 81 80 01 01 81 c0
95 00 b3 00 d1 fc 56 5e 00 a0 a0 a0 29 50 30 20
35 00 55 50 21 00 00 1e 00 00 00 fd 00 30 90 1e
d6 3c 00 0a 20 20 20 20 20 20 00 00 00 fc 00 45
44 41 32 37 30 55 20 50 0a 20 20 20 00 00 00 ff
00 31 34 32 39 31 36 37 32 41 33 57 30 31 01 3c

02 03 40 f1 4a 90 01 03 04 12 11 13 1f 3f 61 23
09 07 07 83 01 00 00 e3 05 e3 01 67 03 0c 00 10
00 38 44 67 d8 5d c4 01 78 80 00 e6 06 07 01 54
54 45 6d 1a 00 00 02 01 30 90 e6 00 00 00 00 00
02 3a 80 18 71 38 2d 40 58 2c 45 00 55 50 21 00
00 1e 6f c2 00 a0 a0 a0 55 50 30 20 35 00 55 50
21 00 00 1e 51 e9 00 a0 a0 a0 55 50 30 20 35 00
55 50 21 00 00 1e 00 00 00 00 00 00 00 00 00 1f

00 ff ff ff ff ff ff 00 04 72 42 0d 2a 67 91 42
1d 22 01 03 80 3c 21 78 2a 9b 81 ad 4f 40 9e 25
11 50 54 bf ef 00 71 4f 81 40 81 80 01 01 81 c0
95 00 b3 00 d1 fc 56 5e 00 a0 a0 a0 29 50 30 20
35 00 55 50 21 00 00 1e 00 00 00 fd 00 30 90 1e
d6 3c 00 0a 20 20 20 20 20 20 00 00 00 fc 00 45
44 41 32 37 30 55 20 50 0a 20 20 20 00 00 00 ff
00 31 34 32 39 31 36 37 32 41 33 57 30 31 01 3c

02 03 40 f1 4a 90 01 03 04 12 11 13 1f 3f 61 23
09 07 07 83 01 00 00 e3 05 e3 01 67 03 0c 00 10
00 38 44 67 d8 5d c4 01 78 80 00 e6 06 07 01 54
54 45 6d 1a 00 00 02 01 30 90 e6 00 00 00 00 00
02 3a 80 18 71 38 2d 40 58 2c 45 00 55 50 21 00
00 1e 6f c2 00 a0 a0 a0 55 50 30 20 35 00 55 50
21 00 00 1e 51 e9 00 a0 a0 a0 55 50 30 20 35 00
55 50 21 00 00 1e 00 00 00 00 00 00 00 00 00 1f

----------------

Block 0, Base EDID:
  EDID Structure Version & Revision: 1.3
  Vendor & Product Identification:
    Manufacturer: ACR
    Model: 3394
    Serial Number: ...
    Made in: week 29 of 2024
  Basic Display Parameters & Features:
    Digital display
    Maximum image size: 60 cm x 33 cm
    Gamma: 2.20
    DPMS levels: Off
    RGB color display
    First detailed timing is the preferred timing
  Color Characteristics:
    Red  : 0.6777, 0.3095
    Green: 0.2519, 0.6201
    Blue : 0.1464, 0.0664
    White: 0.3125, 0.3291
  Established Timings I & II:
    IBM     :   720x400    70.081663 Hz   9:5     31.467 kHz     28.320000 MHz
    DMT 0x04:   640x480    59.940476 Hz   4:3     31.469 kHz     25.175000 MHz
    Apple   :   640x480    66.666667 Hz   4:3     35.000 kHz     30.240000 MHz
    DMT 0x05:   640x480    72.808802 Hz   4:3     37.861 kHz     31.500000 MHz
    DMT 0x06:   640x480    75.000000 Hz   4:3     37.500 kHz     31.500000 MHz
    DMT 0x08:   800x600    56.250000 Hz   4:3     35.156 kHz     36.000000 MHz
    DMT 0x09:   800x600    60.316541 Hz   4:3     37.879 kHz     40.000000 MHz
    DMT 0x0a:   800x600    72.187572 Hz   4:3     48.077 kHz     50.000000 MHz
    DMT 0x0b:   800x600    75.000000 Hz   4:3     46.875 kHz     49.500000 MHz
    Apple   :   832x624    74.551266 Hz   4:3     49.726 kHz     57.284000 MHz
    DMT 0x10:  1024x768    60.003840 Hz   4:3     48.363 kHz     65.000000 MHz
    DMT 0x11:  1024x768    70.069359 Hz   4:3     56.476 kHz     75.000000 MHz
    DMT 0x12:  1024x768    75.028582 Hz   4:3     60.023 kHz     78.750000 MHz
    DMT 0x24:  1280x1024   75.024675 Hz   5:4     79.976 kHz    135.000000 MHz
  Standard Timings:
    DMT 0x15:  1152x864    75.000000 Hz   4:3     67.500 kHz    108.000000 MHz
    DMT 0x20:  1280x960    60.000000 Hz   4:3     60.000 kHz    108.000000 MHz
    DMT 0x23:  1280x1024   60.019740 Hz   5:4     63.981 kHz    108.000000 MHz
    DMT 0x55:  1280x720    60.000000 Hz  16:9     45.000 kHz     74.250000 MHz
    DMT 0x2f:  1440x900    59.887445 Hz  16:10    55.935 kHz    106.500000 MHz
    DMT 0x3a:  1680x1050   59.954250 Hz  16:10    65.290 kHz    146.250000 MHz
    GTF     :  1920x1080  119.999987 Hz  16:9    138.840 kHz    368.759000 MHz
  Detailed Timing Descriptors:
    DTD 1:  2560x1440   59.950550 Hz  16:9     88.787 kHz    241.500000 MHz (597 mm x 336 mm)
                 Hfront   48 Hsync  32 Hback   80 Hpol P
                 Vfront    3 Vsync   5 Vback   33 Vpol P
    Display Range Limits:
      Monitor ranges (GTF): 48-144 Hz V, 30-214 kHz H, max dotclock 600 MHz
    Display Product Name: 'EDA270U P'
    Display Product Serial Number: ...
  Extension blocks: 1
Checksum: 0x3c

----------------

Block 1, CTA-861 Extension Block:
  Revision: 3
  Underscans IT Video Formats by default
  Basic audio support
  Supports YCbCr 4:4:4
  Supports YCbCr 4:2:2
  Native DTDs: 1
  Video Data Block:
    VIC  16:  1920x1080   60.000000 Hz  16:9     67.500 kHz    148.500000 MHz (native)
    VIC   1:   640x480    59.940476 Hz   4:3     31.469 kHz     25.175000 MHz
    VIC   3:   720x480    59.940060 Hz  16:9     31.469 kHz     27.000000 MHz
    VIC   4:  1280x720    60.000000 Hz  16:9     45.000 kHz     74.250000 MHz
    VIC  18:   720x576    50.000000 Hz  16:9     31.250 kHz     27.000000 MHz
    VIC  17:   720x576    50.000000 Hz   4:3     31.250 kHz     27.000000 MHz
    VIC  19:  1280x720    50.000000 Hz  16:9     37.500 kHz     74.250000 MHz
    VIC  31:  1920x1080   50.000000 Hz  16:9     56.250 kHz    148.500000 MHz
    VIC  63:  1920x1080  120.000000 Hz  16:9    135.000 kHz    297.000000 MHz
    VIC  97:  3840x2160   60.000000 Hz  16:9    135.000 kHz    594.000000 MHz
  Audio Data Block:
    Linear PCM:
      Max channels: 2
      Supported sample rates (kHz): 48 44.1 32
      Supported sample sizes (bits): 24 20 16
  Speaker Allocation Data Block:
    FL/FR - Front Left/Right
  Colorimetry Data Block:
    xvYCC601
    xvYCC709
    BT2020cYCC
    BT2020YCC
    BT2020RGB
    Gamut Boundary Description Metadata Profile P0
  Vendor-Specific Data Block (HDMI), OUI 00-0C-03:
    Source physical address: 1.0.0.0
    DC_36bit
    DC_30bit
    DC_Y444
    Maximum TMDS clock: 340 MHz
  Vendor-Specific Data Block (HDMI Forum), OUI C4-5D-D8:
    Version: 1
    Maximum TMDS Character Rate: 600 MHz
    SCDC Present
  HDR Static Metadata Data Block:
    Electro optical transfer functions:
      Traditional gamma - SDR luminance range
      Traditional gamma - HDR luminance range
      SMPTE ST2084
    Supported static metadata descriptors:
      Static metadata type 1
    Desired content max luminance: 84 (308.442 cd/m^2)
    Desired content max frame-average luminance: 84 (308.442 cd/m^2)
    Desired content min luminance: 69 (0.226 cd/m^2)
  Vendor-Specific Data Block (AMD), OUI 00-00-1A:
    Version: 2
    Feature Caps: 0x01
    Minimum Refresh Rate: 48 Hz
    Maximum Refresh Rate: 144 Hz
    Flags 1.x: 0xe6 (MCCS)
    Flags 2.x: 0x00
  Detailed Timing Descriptors:
    DTD 2:  1920x1080   60.000000 Hz  16:9     67.500 kHz    148.500000 MHz (597 mm x 336 mm)
                 Hfront   88 Hsync  44 Hback  148 Hpol P
                 Vfront    4 Vsync   5 Vback   36 Vpol P
    DTD 3:  2560x1440  119.997589 Hz  16:9    182.996 kHz    497.750000 MHz (597 mm x 336 mm)
                 Hfront   48 Hsync  32 Hback   80 Hpol P
                 Vfront    3 Vsync   5 Vback   77 Vpol P
    DTD 4:  2560x1440  143.994696 Hz  16:9    219.592 kHz    597.290000 MHz (597 mm x 336 mm)
                 Hfront   48 Hsync  32 Hback   80 Hpol P
                 Vfront    3 Vsync   5 Vback   77 Vpol P
Checksum: 0x1f  Unused space in Extension Block: 9 bytes

----------------

Warnings:

Block 1, CTA-861 Extension Block:
  Video Data Block: VIC 16 and the first DTD are not identical. Is this intended?
  Colorimetry Data Block: Set the sRGB colorimetry bit to avoid interop issues.
  Display Product Serial Number is set, so the Serial Number in the Base EDID should be 0.
EDID:
  Base EDID: Some timings are out of range of the Monitor Ranges:
    Horizontal Freq: 31.250 - 219.591 kHz (Monitor: 30.000 - 214.000 kHz)

Failures:

Block 1, CTA-861 Extension Block:
  Missing VCDB, needed for Set Selectable RGB Quantization to avoid interop issues.
EDID:
  Extension Block 2 started with EDID header, ignoring Extension Blocks >= 2.
  CTA-861: Native progressive timings are a mix of several resolutions.

EDID conformity: FAIL
