edid-decode (hex):

00 ff ff ff ff ff ff 00 12 e5 a3 70 01 01 01 01
1c 0a 01 02 68 21 19 78 e8 00 b2 a0 57 49 9b 26
10 48 4f 2f de 00 81 80 61 59 45 59 31 59 01 01
01 01 01 01 01 01 00 00 00 ff 00 47 43 30 37 34
32 30 36 39 35 0a 20 20 00 00 00 fc 00 50 6e 50
20 4d 6f 6e 69 74 6f 72 0a 20 00 00 00 fd 00 32
a0 1e 46 09 00 0a 20 20 20 20 20 20 00 00 00 fe
00 44 41 45 57 4f 4f 00 0a 20 20 20 20 20 00 5e

----------------

Block 0, Base EDID:
  EDID Structure Version & Revision: 1.2
  Vendor & Product Identification:
    Manufacturer: DWE
    Model: 28835
    Serial Number: ...
    Made in: week 28 of 2000
  Basic Display Parameters & Features:
    Analog display
    Signal Level Standard: 0.700 : 0.000 : 0.700 V p-p
    Blank level equals black level
    Sync: Separate
    Maximum image size: 33 cm x 25 cm
    Gamma: 2.20
    DPMS levels: Standby Suspend Off
    RGB color display
  Color Characteristics:
    Red  : 0.6250, 0.3398
    Green: 0.2851, 0.6054
    Blue : 0.1503, 0.0654
    White: 0.2812, 0.3105
  Established Timings I & II:
    DMT 0x04:   640x480    59.940476 Hz   4:3     31.469 kHz     25.175000 MHz
    DMT 0x05:   640x480    72.808802 Hz   4:3     37.861 kHz     31.500000 MHz
    DMT 0x06:   640x480    75.000000 Hz   4:3     37.500 kHz     31.500000 MHz
    DMT 0x08:   800x600    56.250000 Hz   4:3     35.156 kHz     36.000000 MHz
    DMT 0x09:   800x600    60.316541 Hz   4:3     37.879 kHz     40.000000 MHz
    DMT 0x0a:   800x600    72.187572 Hz   4:3     48.077 kHz     50.000000 MHz
    DMT 0x0b:   800x600    75.000000 Hz   4:3     46.875 kHz     49.500000 MHz
    DMT 0x0f:  1024x768i   86.957532 Hz   4:3     35.522 kHz     44.900000 MHz
    DMT 0x10:  1024x768    60.003840 Hz   4:3     48.363 kHz     65.000000 MHz
    DMT 0x11:  1024x768    70.069359 Hz   4:3     56.476 kHz     75.000000 MHz
    DMT 0x12:  1024x768    75.028582 Hz   4:3     60.023 kHz     78.750000 MHz
  Standard Timings:
    DMT 0x23:  1280x1024   60.019740 Hz   5:4     63.981 kHz    108.000000 MHz
    DMT 0x13:  1024x768    84.996690 Hz   4:3     68.677 kHz     94.500000 MHz
    DMT 0x0c:   800x600    85.061274 Hz   4:3     53.674 kHz     56.250000 MHz
    DMT 0x07:   640x480    85.008312 Hz   4:3     43.269 kHz     36.000000 MHz
  Detailed Timing Descriptors:
    Display Product Serial Number: ...
    Display Product Name: 'PnP Monitor'
    Display Range Limits:
      Monitor ranges (GTF): 50-160 Hz V, 30-70 kHz H, max dotclock 90 MHz
    Alphanumeric Data String: 'DAEWOO'
Checksum: 0x5e

----------------

Warnings:

Block 0, Base EDID:
  EDID Structure Version & Revision: EDID 1.2 is deprecated, do not use.
  Vendor & Product Identification: The serial number is one of the known dummy values, it should probably be set to 0.
EDID:
  Base EDID: Some timings are out of range of the Monitor Ranges:
    Maximum Clock: 108.000 MHz (Monitor: 90.000 MHz)

Failures:

Block 0, Base EDID:
  Alphanumeric Data String: NUL byte at position 6.

EDID conformity: FAIL
