edid-decode (hex):

00 ff ff ff ff ff ff 00 06 10 f0 9c 00 00 00 00
19 15 01 04 95 1d 12 78 02 ef 05 97 57 54 92 27
22 50 54 00 00 00 01 01 01 01 01 01 01 01 01 01
01 01 01 01 01 01 b9 22 a0 a0 50 84 1a 30 30 20
36 00 1e b3 00 00 00 18 00 00 00 10 00 00 00 00
00 00 00 00 00 00 00 00 00 00 00 00 00 fe 00 4c
54 48 31 33 33 42 54 30 31 41 30 33 00 00 00 fc
00 43 6f 6c 6f 72 20 4c 43 44 0a 20 20 20 00 06

----------------

Block 0, Base EDID:
  EDID Structure Version & Revision: 1.4
  Vendor & Product Identification:
    Manufacturer: APP
    Model: 40176
    Made in: week 25 of 2011
  Basic Display Parameters & Features:
    Digital display
    Bits per primary color channel: 6
    DisplayPort interface
    Maximum image size: 29 cm x 18 cm
    Gamma: 2.20
    Supported color formats: RGB 4:4:4
    First detailed timing includes the native pixel format and preferred refresh rate
  Color Characteristics:
    Red  : 0.5927, 0.3417
    Green: 0.3310, 0.5732
    Blue : 0.1523, 0.1328
    White: 0.3134, 0.3291
  Established Timings I & II: none
  Standard Timings: none
  Detailed Timing Descriptors:
    DTD 1:  1440x900    59.995950 Hz  16:10    55.556 kHz     88.890000 MHz (30 mm x 179 mm)
                 Hfront   48 Hsync  32 Hback   80 Hpol N
                 Vfront    3 Vsync   6 Vback   17 Vpol N
    Dummy Descriptor:
    Alphanumeric Data String: 'LTH133BT01A03'
    Display Product Name: 'Color LCD'
Checksum: 0x06

----------------

Warnings:

Block 0, Base EDID:
  Detailed Timing Descriptor #1: Dubious image size (30x179 mm is smaller than 100x100 mm).

EDID conformity: PASS
