edid-decode (hex):

00 ff ff ff ff ff ff 00 4d 10 b3 14 a0 25 0d 39
05 1d 01 04 a5 1d 13 78 07 de 50 a3 54 4c 99 26
0f 50 54 00 00 00 01 01 01 01 01 01 01 01 01 01
01 01 01 01 01 01 99 57 d0 a0 80 e0 2b 50 30 20
3a 00 1d be 10 00 00 18 00 00 00 fd 00 14 3c 70
70 1c 01 00 00 00 00 00 00 00 00 00 00 10 00 00
00 00 00 00 00 00 00 00 00 00 00 00 00 00 00 fc
00 4c 51 31 33 35 50 31 4a 58 35 31 0a 20 00 62

00 ff ff ff ff ff ff 00 4d 10 b3 14 a0 25 0d 39
05 1d 01 04 a5 1d 13 78 07 de 50 a3 54 4c 99 26
0f 50 54 00 00 00 01 01 01 01 01 01 01 01 01 01
01 01 01 01 01 01 99 57 d0 a0 80 e0 2b 50 30 20
3a 00 1d be 10 00 00 18 00 00 00 fd 00 14 3c 70
70 1c 01 00 00 00 00 00 00 00 00 00 00 10 00 00
00 00 00 00 00 00 00 00 00 00 00 00 00 00 00 fc
00 4c 51 31 33 35 50 31 4a 58 35 31 0a 20 00 62

----------------

Block 0, Base EDID:
  EDID Structure Version & Revision: 1.4
  Vendor & Product Identification:
    Manufacturer: SHP
    Model: 5299
    Serial Number: ...
    Made in: week 5 of 2019
  Basic Display Parameters & Features:
    Digital display
    Bits per primary color channel: 8
    DisplayPort interface
    Maximum image size: 29 cm x 19 cm
    Gamma: 2.20
    Supported color formats: RGB 4:4:4
    Default (sRGB) color space is primary color space
    First detailed timing includes the native pixel format and preferred refresh rate
    Display supports continuous frequencies
  Color Characteristics:
    Red  : 0.6396, 0.3291
    Green: 0.2998, 0.5996
    Blue : 0.1494, 0.0595
    White: 0.3125, 0.3281
  Established Timings I & II: none
  Standard Timings: none
  Detailed Timing Descriptors:
    DTD 1:  2256x1504   59.999165 Hz   3:2     92.819 kHz    224.250000 MHz (285 mm x 190 mm)
                 Hfront   48 Hsync  32 Hback   80 Hpol N
                 Vfront    3 Vsync  10 Vback   30 Vpol N
    Display Range Limits:
      Monitor ranges (Range Limits Only): 20-60 Hz V, 112-112 kHz H, max dotclock 280 MHz
    Dummy Descriptor:
    Display Product Name: 'LQ135P1JX51'
Checksum: 0x62

----------------

Warnings:

EDID:
  Base EDID: Some timings are out of range of the Monitor Ranges:
    Horizontal Freq: 92.818 - 92.818 kHz (Monitor: 112.000 - 112.000 kHz)

Failures:

Block 0, Base EDID:
  Basic Display Parameters & Features: sRGB is signaled, but the chromaticities do not match.
  Display Range Limits: Byte 11 is 0x00 instead of 0x0a.
  Display Range Limits: Bytes 12-17 must be 0x20.
EDID:
  Extension Block 1 started with EDID header, ignoring Extension Blocks >= 1.

EDID conformity: FAIL
