edid-decode (hex):

00 ff ff ff ff ff ff 00 4c 2d 6f 79 57 44 30 31
1f 23 01 04 b5 5d 28 78 3b 50 25 ad 51 48 a8 27
09 50 54 21 08 00 01 01 81 c0 81 00 81 80 95 00
a9 c0 b3 00 d1 c0 e7 7c 70 a0 d0 a0 29 50 30 20
3a 00 a2 90 31 00 00 1a 00 00 00 fd 0c 30 b4 af
af eb 01 0a 20 20 20 20 20 20 00 00 00 fc 00 4f
64 79 73 73 65 79 20 47 37 35 46 0a 00 00 00 ff
00 48 4e 54 59 38 30 30 30 37 36 0a 20 20 03 d7

02 03 3c f0 49 61 5f 10 3f 04 03 76 5a 5c 23 09
07 07 83 01 00 00 e3 05 c0 00 e6 06 05 01 73 5a
00 e5 01 8b 84 90 59 74 1a 00 00 03 0f 30 b4 00
20 73 07 5a 28 b4 00 00 00 00 00 00 6f c2 00 a0
a0 a0 55 50 30 20 35 00 a2 90 31 00 00 1a 56 5e
00 a0 a0 a0 29 50 30 20 35 00 a2 90 31 00 00 1a
02 3a 80 18 71 38 2d 40 58 2c 45 00 a2 90 31 00
00 1e 00 00 00 00 00 00 00 00 00 00 00 00 00 f2

70 20 79 05 00 22 00 3c 2d 50 22 86 ff 13 7f 01
9f 80 1f 00 6f 08 6d 00 02 00 09 00 63 0c 17 06
ff 13 7f 01 9f 80 1f 00 6f 08 7e 00 02 00 09 00
35 55 1a 04 ff 0e 7f 01 9f 80 1f 00 6f 08 6d 00
02 00 09 00 2a 00 0c 01 ff 13 6f 08 3b 01 6f 0d
9f 05 77 00 00 00 00 00 00 00 00 00 00 00 00 00
00 00 00 00 00 00 00 00 00 00 00 00 00 00 00 00
00 00 00 00 00 00 00 00 00 00 00 00 00 00 cf 90

70 20 79 00 00 22 00 50 2d 7b 06 04 7f 07 9f 00
2f 80 1f 00 37 04 36 00 02 00 09 00 eb 79 08 06
ff 09 9f 00 2f 80 1f 00 37 04 36 00 02 00 09 00
19 f5 0e 08 6f 0d 9f 00 2f 80 1f 00 9f 05 48 00
02 00 09 00 8d 4d 0b 04 ff 09 9f 00 2f 80 1f 00
9f 05 48 00 02 00 09 00 00 00 00 00 00 00 00 00
00 00 00 00 00 00 00 00 00 00 00 00 00 00 00 00
00 00 00 00 00 00 00 00 00 00 00 00 00 00 18 90

00 ff ff ff ff ff ff 00 4c 2d 6f 79 57 44 30 31
1f 23 01 04 b5 5d 28 78 3b 50 25 ad 51 48 a8 27
09 50 54 21 08 00 01 01 81 c0 81 00 81 80 95 00
a9 c0 b3 00 d1 c0 e7 7c 70 a0 d0 a0 29 50 30 20
3a 00 a2 90 31 00 00 1a 00 00 00 fd 0c 30 b4 af
af eb 01 0a 20 20 20 20 20 20 00 00 00 fc 00 4f
64 79 73 73 65 79 20 47 37 35 46 0a 00 00 00 ff
00 48 4e 54 59 38 30 30 30 37 36 0a 20 20 03 d7

02 03 3c f0 49 61 5f 10 3f 04 03 76 5a 5c 23 09
07 07 83 01 00 00 e3 05 c0 00 e6 06 05 01 73 5a
00 e5 01 8b 84 90 59 74 1a 00 00 03 0f 30 b4 00
20 73 07 5a 28 b4 00 00 00 00 00 00 6f c2 00 a0
a0 a0 55 50 30 20 35 00 a2 90 31 00 00 1a 56 5e
00 a0 a0 a0 29 50 30 20 35 00 a2 90 31 00 00 1a
02 3a 80 18 71 38 2d 40 58 2c 45 00 a2 90 31 00
00 1e 00 00 00 00 00 00 00 00 00 00 00 00 00 f2

70 20 79 05 00 22 00 3c 2d 50 22 86 ff 13 7f 01
9f 80 1f 00 6f 08 6d 00 02 00 09 00 63 0c 17 06
ff 13 7f 01 9f 80 1f 00 6f 08 7e 00 02 00 09 00
35 55 1a 04 ff 0e 7f 01 9f 80 1f 00 6f 08 6d 00
02 00 09 00 2a 00 0c 01 ff 13 6f 08 3b 01 6f 0d
9f 05 77 00 00 00 00 00 00 00 00 00 00 00 00 00
00 00 00 00 00 00 00 00 00 00 00 00 00 00 00 00
00 00 00 00 00 00 00 00 00 00 00 00 00 00 cf 90

70 20 79 00 00 22 00 50 2d 7b 06 04 7f 07 9f 00
2f 80 1f 00 37 04 36 00 02 00 09 00 eb 79 08 06
ff 09 9f 00 2f 80 1f 00 37 04 36 00 02 00 09 00
19 f5 0e 08 6f 0d 9f 00 2f 80 1f 00 9f 05 48 00
02 00 09 00 8d 4d 0b 04 ff 09 9f 00 2f 80 1f 00
9f 05 48 00 02 00 09 00 00 00 00 00 00 00 00 00
00 00 00 00 00 00 00 00 00 00 00 00 00 00 00 00
00 00 00 00 00 00 00 00 00 00 00 00 00 00 18 90

----------------

Block 0, Base EDID:
  EDID Structure Version & Revision: 1.4
  Vendor & Product Identification:
    Manufacturer: SAM
    Model: 31087
    Serial Number: ...
    Made in: week 31 of 2025
  Basic Display Parameters & Features:
    Digital display
    Bits per primary color channel: 10
    DisplayPort interface
    Maximum image size: 93 cm x 40 cm
    Gamma: 2.20
    DPMS levels: Off
    Supported color formats: RGB 4:4:4, YCrCb 4:4:4, YCrCb 4:2:2
    First detailed timing includes the native pixel format and preferred refresh rate
    Display supports continuous frequencies
  Color Characteristics:
    Red  : 0.6767, 0.3173
    Green: 0.2812, 0.6562
    Blue : 0.1523, 0.0371
    White: 0.3134, 0.3291
  Established Timings I & II:
    DMT 0x04:   640x480    59.940476 Hz   4:3     31.469 kHz     25.175000 MHz
    DMT 0x09:   800x600    60.316541 Hz   4:3     37.879 kHz     40.000000 MHz
    DMT 0x10:  1024x768    60.003840 Hz   4:3     48.363 kHz     65.000000 MHz
  Standard Timings:
    DMT 0x55:  1280x720    60.000000 Hz  16:9     45.000 kHz     74.250000 MHz
    DMT 0x1c:  1280x800    59.810326 Hz  16:10    49.702 kHz     83.500000 MHz
    DMT 0x23:  1280x1024   60.019740 Hz   5:4     63.981 kHz    108.000000 MHz
    DMT 0x2f:  1440x900    59.887445 Hz  16:10    55.935 kHz    106.500000 MHz
    DMT 0x53:  1600x900    60.000000 Hz  16:9     60.000 kHz    108.000000 MHz (RB)
    DMT 0x3a:  1680x1050   59.954250 Hz  16:10    65.290 kHz    146.250000 MHz
    DMT 0x52:  1920x1080   60.000000 Hz  16:9     67.500 kHz    148.500000 MHz
  Detailed Timing Descriptors:
    DTD 1:  3440x1440   59.972616 Hz  43:18    88.819 kHz    319.750000 MHz (930 mm x 400 mm)
                 Hfront   48 Hsync  32 Hback   80 Hpol P
                 Vfront    3 Vsync  10 Vback   28 Vpol N
    Display Range Limits:
      Monitor ranges (Range Limits Only): 48-180 Hz V, 430-430 kHz H, max dotclock 2350 MHz
    Display Product Name: 'Odyssey G75F'
    Display Product Serial Number: ...
  Extension blocks: 3
Checksum: 0xd7

----------------

Block 1, CTA-861 Extension Block:
  Revision: 3
  Underscans IT Video Formats by default
  Basic audio support
  Supports YCbCr 4:4:4
  Supports YCbCr 4:2:2
  Native DTDs: 0
  Video Data Block:
    VIC  97:  3840x2160   60.000000 Hz  16:9    135.000 kHz    594.000000 MHz
    VIC  95:  3840x2160   30.000000 Hz  16:9     67.500 kHz    297.000000 MHz
    VIC  16:  1920x1080   60.000000 Hz  16:9     67.500 kHz    148.500000 MHz
    VIC  63:  1920x1080  120.000000 Hz  16:9    135.000 kHz    297.000000 MHz
    VIC   4:  1280x720    60.000000 Hz  16:9     45.000 kHz     74.250000 MHz
    VIC   3:   720x480    59.940060 Hz  16:9     31.469 kHz     27.000000 MHz
    VIC 118:  3840x2160  120.000000 Hz  16:9    270.000 kHz   1188.000000 MHz
    VIC  90:  2560x1080   60.000000 Hz  64:27    66.000 kHz    198.000000 MHz
    VIC  92:  2560x1080  120.000000 Hz  64:27   150.000 kHz    495.000000 MHz
  Audio Data Block:
    Linear PCM:
      Max channels: 2
      Supported sample rates (kHz): 48 44.1 32
      Supported sample sizes (bits): 24 20 16
  Speaker Allocation Data Block:
    FL/FR - Front Left/Right
  Colorimetry Data Block:
    BT2020YCC
    BT2020RGB
  HDR Static Metadata Data Block:
    Electro optical transfer functions:
      Traditional gamma - SDR luminance range
      SMPTE ST2084
    Supported static metadata descriptors:
      Static metadata type 1
    Desired content max luminance: 115 (603.666 cd/m^2)
    Desired content max frame-average luminance: 90 (351.250 cd/m^2)
    Desired content min luminance: 0 (0.000 cd/m^2)
  Vendor-Specific Video Data Block (HDR10+), OUI 90-84-8B:
    Application Version: 1
    Full Frame Peak Luminance Index: 2
    Peak Luminance Index: 5
  Vendor-Specific Data Block (AMD), OUI 00-00-1A:
    Version: 3
    Feature Caps: 0x0f
      Global Backlight Control Supported
      Local Dimming Supported
    Minimum Refresh Rate: 48 Hz
    Maximum Refresh Rate: 180 Hz
    Flags 1.x: 0x00
    Flags 2.x: 0x20
      ST 2084 (PQ) EOTF Supported
      Linear EOTF (Windows scRGB, 0.0 - 125.0) Supported
      BT.2020 Gamut Supported
      Display is Mini LED
    Maximum luminance: 115 (603.666 cd/m^2)
    Minimum luminance: 7 (0.005 cd/m^2)
    Maximum luminance (without local dimming): 90 (351.250 cd/m^2)
    Minimum luminance (without local dimming): 40 (0.086 cd/m^2)
  Detailed Timing Descriptors:
    DTD 2:  2560x1440  119.997589 Hz  16:9    182.996 kHz    497.750000 MHz (930 mm x 400 mm)
                 Hfront   48 Hsync  32 Hback   80 Hpol P
                 Vfront    3 Vsync   5 Vback   77 Vpol N
    DTD 3:  2560x1440   59.950550 Hz  16:9     88.787 kHz    241.500000 MHz (930 mm x 400 mm)
                 Hfront   48 Hsync  32 Hback   80 Hpol P
                 Vfront    3 Vsync   5 Vback   33 Vpol N
    DTD 4:  1920x1080   60.000000 Hz  16:9     67.500 kHz    148.500000 MHz (930 mm x 400 mm)
                 Hfront   88 Hsync  44 Hback  148 Hpol P
                 Vfront    4 Vsync   5 Vback   36 Vpol P
Checksum: 0xf2  Unused space in Extension Block: 13 bytes

----------------

Block 2, DisplayID Extension Block:
  Version: 2.0
  Extension Count: 0
  Display Product Primary Use Case: Desktop gaming display
  Video Timing Modes Type 7 - Detailed Timings Data Block:
    DTD:  5120x2160  179.985241 Hz  64:27   408.566 kHz   2248.750000 MHz (aspect 64:27, no 3D stereo, preferred)
               Hfront  160 Hsync  32 Hback  192 Hpol P
               Vfront    3 Vsync  10 Vback   97 Vpol N
    DTD:  5120x2160  119.998589 Hz  64:27   274.437 kHz   1510.500000 MHz (aspect 64:27, no 3D stereo)
               Hfront  160 Hsync  32 Hback  192 Hpol P
               Vfront    3 Vsync  10 Vback  114 Vpol N
    DTD:  3840x2160  179.981603 Hz  16:9    408.558 kHz   1725.750000 MHz (aspect 16:9, no 3D stereo)
               Hfront  160 Hsync  32 Hback  192 Hpol P
               Vfront    3 Vsync  10 Vback   97 Vpol N
  Video Timing Modes Type 10 - Formula-based Timings Data Block:
    CVT:  5120x2160   59.984692 Hz  64:27   133.286 kHz    703.750000 MHz (RB, aspect 64:27, no 3D stereo)
    CVT:  3440x1440  119.990893 Hz  43:18   182.986 kHz    658.750000 MHz (RB, aspect 43:18, no 3D stereo)
  Checksum: 0xcf
Checksum: 0x90

----------------

Block 3, DisplayID Extension Block:
  Version: 2.0
  Extension Count: 0
  Video Timing Modes Type 7 - Detailed Timings Data Block:
    DTD:  1920x1080  179.917824 Hz  16:9    204.207 kHz    424.750000 MHz (aspect 16:9, no 3D stereo)
               Hfront   48 Hsync  32 Hback   80 Hpol P
               Vfront    3 Vsync  10 Vback   42 Vpol N
    DTD:  2560x1080  179.936512 Hz  64:27   204.228 kHz    555.500000 MHz (aspect 64:27, no 3D stereo)
               Hfront   48 Hsync  32 Hback   80 Hpol P
               Vfront    3 Vsync  10 Vback   42 Vpol N
    DTD:  3440x1440  179.968055 Hz   0:0    272.292 kHz    980.250000 MHz (aspect undefined, no 3D stereo)
               Hfront   48 Hsync  32 Hback   80 Hpol P
               Vfront    3 Vsync  10 Vback   60 Vpol N
    DTD:  2560x1440  179.996404 Hz  16:9    272.335 kHz    740.750000 MHz (aspect 16:9, no 3D stereo)
               Hfront   48 Hsync  32 Hback   80 Hpol P
               Vfront    3 Vsync  10 Vback   60 Vpol N
  Checksum: 0x18
Checksum: 0x90

----------------

Warnings:

Block 0, Base EDID:
  Detailed Timing Descriptor #1: Image size is 930x400 mm, but based on the picture AR it should be 930x389 mm.
Block 1, CTA-861 Extension Block:
  Video Data Block: VIC 97 and the first DTD are not identical. Is this intended?
  Colorimetry Data Block: Set the sRGB colorimetry bit to avoid interop issues.
  Detailed Timing Descriptor #2: Image size is 930x400 mm, but based on the picture AR it should be 711x400 mm.
  Detailed Timing Descriptor #3: Image size is 930x400 mm, but based on the picture AR it should be 711x400 mm.
  Detailed Timing Descriptor #4: Image size is 930x400 mm, but based on the picture AR it should be 711x400 mm.
  Display Product Serial Number is set, so the Serial Number in the Base EDID should be 0.
EDID:
  Base EDID: Some timings are out of range of the Monitor Ranges:
    Vertical Freq: 30.000 - 179.996 Hz (Monitor: 48.000 - 180.000 Hz)
    Horizontal Freq: 31.468 - 408.566 kHz (Monitor: 430.000 - 430.000 kHz)

Failures:

Block 1, CTA-861 Extension Block:
  Missing VCDB, needed for Set Selectable RGB Quantization to avoid interop issues.
Block 2, DisplayID Extension Block:
  Expected 0 DisplayID Extension Block, but got 1.
EDID:
  Extension Block 4 started with EDID header, ignoring Extension Blocks >= 4.
  DisplayID: Missing DisplayID Display Parameters Data Block.

EDID conformity: FAIL
