edid-decode (hex):

00 ff ff ff ff ff ff 00 4e 81 c9 af 00 00 00 00
2c 1e 01 04 a5 22 13 78 03 4e 61 94 5d 55 8c 26
1b 4e 52 00 00 00 01 01 01 01 01 01 01 01 01 01
01 01 01 01 01 01 c7 3a 80 18 71 38 3c 40 30 20
36 00 58 c2 10 00 00 1a 00 00 00 00 00 00 00 00
00 00 00 00 00 00 00 00 00 1a 00 00 00 fe 00 49
4e 58 20 20 20 0a 20 20 20 20 20 20 00 00 00 fe
00 58 52 31 35 36 45 41 33 54 2d 38 32 0a 00 fe

00 ff ff ff ff ff ff 00 4e 81 c9 af 00 00 00 00
2c 1e 01 04 a5 22 13 78 03 4e 61 94 5d 55 8c 26
1b 4e 52 00 00 00 01 01 01 01 01 01 01 01 01 01
01 01 01 01 01 01 c7 3a 80 18 71 38 3c 40 30 20
36 00 58 c2 10 00 00 1a 00 00 00 00 00 00 00 00
00 00 00 00 00 00 00 00 00 1a 00 00 00 fe 00 49
4e 58 20 20 20 0a 20 20 20 20 20 20 00 00 00 fe
00 58 52 31 35 36 45 41 33 54 2d 38 32 0a 00 fe

----------------

Block 0, Base EDID:
  EDID Structure Version & Revision: 1.4
  Vendor & Product Identification:
    Manufacturer: STA
    Model: 45001
    Made in: week 44 of 2020
  Basic Display Parameters & Features:
    Digital display
    Bits per primary color channel: 8
    DisplayPort interface
    Maximum image size: 34 cm x 19 cm
    Gamma: 2.20
    Supported color formats: RGB 4:4:4
    First detailed timing includes the native pixel format and preferred refresh rate
    Display supports continuous frequencies
  Color Characteristics:
    Red  : 0.5791, 0.3632
    Green: 0.3349, 0.5488
    Blue : 0.1494, 0.1074
    White: 0.3046, 0.3212
  Established Timings I & II: none
  Standard Timings: none
  Detailed Timing Descriptors:
    DTD 1:  1920x1080   59.996013 Hz  16:9     68.395 kHz    150.470000 MHz (344 mm x 194 mm)
                 Hfront   48 Hsync  32 Hback  200 Hpol P
                 Vfront    3 Vsync   6 Vback   51 Vpol N
    Manufacturer-Specified Display Descriptor (0x00): 00 00 00 00 00 00 00 00 00 00 00 00 00 00 00 1a '................'
    Alphanumeric Data String: 'INX   '
    Alphanumeric Data String: 'XR156EA3T-82'
Checksum: 0xfe

----------------

Warnings:

Block 0, Base EDID:
  Missing Display Product Name.

Failures:

Block 0, Base EDID:
  Alphanumeric Data String: One or more trailing spaces before newline.
  Missing Display Range Limits Descriptor.
EDID:
  Extension Block 1 started with EDID header, ignoring Extension Blocks >= 1.

EDID conformity: FAIL
