edid-decode (hex):

00 ff ff ff ff ff ff 00 08 59 32 00 00 00 00 00
1a 18 01 04 08 46 27 78 0a 30 bd 9d 59 52 a0 26
0d 47 4a a3 08 00 31 40 81 80 81 c0 81 00 81 40
81 0f 95 00 01 01 98 21 50 b0 51 00 1b 30 40 70
36 00 40 84 63 00 00 1e 40 1f 00 80 51 00 1e 30
40 80 37 00 40 84 63 00 00 1c 00 00 00 fd 00 39
3f 1e 31 09 00 0a 20 20 20 20 20 20 00 00 00 fc
00 4e 53 2d 33 32 44 33 31 32 4e 41 31 35 00 18

00 ff ff ff ff ff ff 00 08 59 32 00 00 00 00 00
1a 18 01 04 08 46 27 78 0a 30 bd 9d 59 52 a0 26
0d 47 4a a3 08 00 31 40 81 80 81 c0 81 00 81 40
81 0f 95 00 01 01 98 21 50 b0 51 00 1b 30 40 70
36 00 40 84 63 00 00 1e 40 1f 00 80 51 00 1e 30
40 80 37 00 40 84 63 00 00 1c 00 00 00 fd 00 39
3f 1e 31 09 00 0a 20 20 20 20 20 20 00 00 00 fc
00 4e 53 2d 33 32 44 33 31 32 4e 41 31 35 00 18

----------------

Block 0, Base EDID:
  EDID Structure Version & Revision: 1.4
  Vendor & Product Identification:
    Manufacturer: BBY
    Model: 50
    Made in: week 26 of 2014
  Basic Display Parameters & Features:
    Analog display
    Signal Level Standard: 0.700 : 0.300 : 1.000 V p-p
    Blank level equals black level
    Sync: Separate
    Maximum image size: 70 cm x 39 cm
    Gamma: 2.20
    RGB color display
    First detailed timing includes the native pixel format and preferred refresh rate
  Color Characteristics:
    Red  : 0.6132, 0.3505
    Green: 0.3203, 0.6250
    Blue : 0.1503, 0.0537
    White: 0.2802, 0.2900
  Established Timings I & II:
    IBM     :   720x400    70.081663 Hz   9:5     31.467 kHz     28.320000 MHz
    DMT 0x04:   640x480    59.940476 Hz   4:3     31.469 kHz     25.175000 MHz
    DMT 0x08:   800x600    56.250000 Hz   4:3     35.156 kHz     36.000000 MHz
    DMT 0x09:   800x600    60.316541 Hz   4:3     37.879 kHz     40.000000 MHz
    DMT 0x10:  1024x768    60.003840 Hz   4:3     48.363 kHz     65.000000 MHz
  Standard Timings:
    DMT 0x04:   640x480    59.940476 Hz   4:3     31.469 kHz     25.175000 MHz
    DMT 0x23:  1280x1024   60.019740 Hz   5:4     63.981 kHz    108.000000 MHz
    DMT 0x55:  1280x720    60.000000 Hz  16:9     45.000 kHz     74.250000 MHz
    DMT 0x1c:  1280x800    59.810326 Hz  16:10    49.702 kHz     83.500000 MHz
    DMT 0x20:  1280x960    60.000000 Hz   4:3     60.000 kHz    108.000000 MHz
    DMT 0x1d:  1280x800    74.934142 Hz  16:10    62.795 kHz    106.500000 MHz
    DMT 0x2f:  1440x900    59.887445 Hz  16:10    55.935 kHz    106.500000 MHz
  Detailed Timing Descriptors:
    DTD 1:  1360x768    60.366128 Hz  85:48    47.991 kHz     86.000000 MHz (1600 mm x 900 mm)
                 Hfront   64 Hsync 112 Hback  256 Hpol P
                 Vfront    3 Vsync   6 Vback   18 Vpol P
    DTD 2:  1280x768    60.246771 Hz   5:3     48.077 kHz     80.000000 MHz (1600 mm x 900 mm)
                 Hfront   64 Hsync 128 Hback  192 Hpol N
                 Vfront    3 Vsync   7 Vback   20 Vpol P
    Display Range Limits:
      Monitor ranges (GTF): 57-63 Hz V, 30-49 kHz H, max dotclock 90 MHz
    Display Product Name: 'NS-32D312NA15'
Checksum: 0x18

----------------

Warnings:

Block 0, Base EDID:
  Detailed Timing Descriptor #2: Image size is 1600x900 mm, but based on the picture AR it should be 1500x900 mm.
  Display Range Limits: GTF support is deprecated in EDID 1.4.
EDID:
  Base EDID: Some timings are out of range of the Monitor Ranges:
    Vertical Freq: 56.250 - 74.934 Hz (Monitor: 57.000 - 63.000 Hz)
    Horizontal Freq: 31.466 - 63.981 kHz (Monitor: 30.000 - 49.000 kHz)
    Maximum Clock: 108.000 MHz (Monitor: 90.000 MHz)

Failures:

Block 0, Base EDID:
  Detailed Timing Descriptor #1: Mismatch of image size 1600x900 mm vs display size 700x390 mm.
  Detailed Timing Descriptor #2: Mismatch of image size 1600x900 mm vs display size 700x390 mm.
  Display Range Limits: GTF is supported, but the display does not support continuous frequencies.
EDID:
  Extension Block 1 started with EDID header, ignoring Extension Blocks >= 1.
  Base EDID: The DTD max image size is 1600x900mm, which is larger than the display size 700.0x390.0mm.

EDID conformity: FAIL
