edid-decode (hex):

00 ff ff ff ff ff ff 00 4c 2d 5a 73 00 0e 00 01
01 21 01 03 80 6f 3e 78 0a a8 33 ab 50 45 a5 27
0d 48 48 bd ef 80 71 4f 81 c0 81 00 81 80 95 00
a9 c0 b3 00 d1 c0 04 74 00 30 f2 70 5a 80 b0 58
8a 00 50 1d 74 00 00 1e 56 5e 00 a0 a0 a0 29 50
30 20 35 00 50 1d 74 00 00 1a 00 00 00 fd 00 18
4b 0f 51 1e 00 0a 20 20 20 20 20 20 00 00 00 fc
00 53 41 4d 53 55 4e 47 0a 20 20 20 20 20 01 f8

02 03 51 f0 52 5f 10 1f 04 13 05 14 3f ff ff ff
ff ff ff ff ff ff ff ff ff ff ff ff ff ff ff ff
ff ff ff ff ff ff ff ff ff ff ff ff ff ff ff ff
ff ff ff ff ff ff ff ff ff ff ff ff ff ff ff ff
ff ff ff ff ff ff ff ff ff ff ff ff ff ff ff ff
ff ff ff ff ff ff ff ff ff ff ff ff ff ff ff ff
ff ff ff ff ff ff ff ff ff ff ff ff ff ff ff ff
ff ff ff ff ff ff ff ff ff ff ff ff ff ff ff ff

00 ff ff ff ff ff ff 00 4c 2d 5a 73 00 0e 00 01
01 21 01 03 80 6f 3e 78 0a a8 33 ab 50 45 a5 27
0d 48 48 bd ef 80 71 4f 81 c0 81 00 81 80 95 00
a9 c0 b3 00 d1 c0 04 74 00 30 f2 70 5a 80 b0 58
8a 00 50 1d 74 00 00 1e 56 5e 00 a0 a0 a0 29 50
30 20 35 00 50 1d 74 00 00 1a 00 00 00 fd 00 18
4b 0f 51 1e 00 0a 20 20 20 20 20 20 00 00 00 fc
00 53 41 4d 53 55 4e 47 0a 20 20 20 20 20 01 f8

02 03 51 f0 52 5f 10 1f 04 13 05 14 3f ff ff ff
ff ff ff ff ff ff ff ff ff ff ff ff ff ff ff ff
ff ff ff ff ff ff ff ff ff ff ff ff ff ff ff ff
ff ff ff ff ff ff ff ff ff ff ff ff ff ff ff ff
ff ff ff ff ff ff ff ff ff ff ff ff ff ff ff ff
ff ff ff ff ff ff ff ff ff ff ff ff ff ff ff ff
ff ff ff ff ff ff ff ff ff ff ff ff ff ff ff ff
ff ff ff ff ff ff ff ff ff ff ff ff ff ff ff ff

----------------

Block 0, Base EDID:
  EDID Structure Version & Revision: 1.3
  Vendor & Product Identification:
    Manufacturer: SAM
    Model: 29530
    Serial Number: ...
    Made in: week 1 of 2023
  Basic Display Parameters & Features:
    Digital display
    Maximum image size: 111 cm x 62 cm
    Gamma: 2.20
    RGB color display
    First detailed timing is the preferred timing
  Color Characteristics:
    Red  : 0.6699, 0.3144
    Green: 0.2714, 0.6445
    Blue : 0.1523, 0.0537
    White: 0.2812, 0.2841
  Established Timings I & II:
    IBM     :   720x400    70.081663 Hz   9:5     31.467 kHz     28.320000 MHz
    DMT 0x04:   640x480    59.940476 Hz   4:3     31.469 kHz     25.175000 MHz
    Apple   :   640x480    66.666667 Hz   4:3     35.000 kHz     30.240000 MHz
    DMT 0x05:   640x480    72.808802 Hz   4:3     37.861 kHz     31.500000 MHz
    DMT 0x06:   640x480    75.000000 Hz   4:3     37.500 kHz     31.500000 MHz
    DMT 0x09:   800x600    60.316541 Hz   4:3     37.879 kHz     40.000000 MHz
    DMT 0x0a:   800x600    72.187572 Hz   4:3     48.077 kHz     50.000000 MHz
    DMT 0x0b:   800x600    75.000000 Hz   4:3     46.875 kHz     49.500000 MHz
    Apple   :   832x624    74.551266 Hz   4:3     49.726 kHz     57.284000 MHz
    DMT 0x10:  1024x768    60.003840 Hz   4:3     48.363 kHz     65.000000 MHz
    DMT 0x11:  1024x768    70.069359 Hz   4:3     56.476 kHz     75.000000 MHz
    DMT 0x12:  1024x768    75.028582 Hz   4:3     60.023 kHz     78.750000 MHz
    DMT 0x24:  1280x1024   75.024675 Hz   5:4     79.976 kHz    135.000000 MHz
    Apple   :  1152x870    75.061550 Hz 192:145   68.681 kHz    100.000000 MHz
  Standard Timings:
    DMT 0x15:  1152x864    75.000000 Hz   4:3     67.500 kHz    108.000000 MHz
    DMT 0x55:  1280x720    60.000000 Hz  16:9     45.000 kHz     74.250000 MHz
    DMT 0x1c:  1280x800    59.810326 Hz  16:10    49.702 kHz     83.500000 MHz
    DMT 0x23:  1280x1024   60.019740 Hz   5:4     63.981 kHz    108.000000 MHz
    DMT 0x2f:  1440x900    59.887445 Hz  16:10    55.935 kHz    106.500000 MHz
    DMT 0x53:  1600x900    60.000000 Hz  16:9     60.000 kHz    108.000000 MHz (RB)
    DMT 0x3a:  1680x1050   59.954250 Hz  16:10    65.290 kHz    146.250000 MHz
    DMT 0x52:  1920x1080   60.000000 Hz  16:9     67.500 kHz    148.500000 MHz
  Detailed Timing Descriptors:
    DTD 1:  3840x2160   30.000000 Hz  16:9     67.500 kHz    297.000000 MHz (1872 mm x 1053 mm)
                 Hfront  176 Hsync  88 Hback  296 Hpol P
                 Vfront    8 Vsync  10 Vback   72 Vpol P
    DTD 2:  2560x1440   59.950550 Hz  16:9     88.787 kHz    241.500000 MHz (1872 mm x 1053 mm)
                 Hfront   48 Hsync  32 Hback   80 Hpol P
                 Vfront    3 Vsync   5 Vback   33 Vpol N
    Display Range Limits:
      Monitor ranges (GTF): 24-75 Hz V, 15-81 kHz H, max dotclock 300 MHz
    Display Product Name: 'SAMSUNG'
  Extension blocks: 1
Checksum: 0xf8

----------------

Block 1, CTA-861 Extension Block:
  Revision: 3
  Underscans IT Video Formats by default
  Basic audio support
  Supports YCbCr 4:4:4
  Supports YCbCr 4:2:2
  Native DTDs: 0
  Video Data Block:
    VIC  95:  3840x2160   30.000000 Hz  16:9     67.500 kHz    297.000000 MHz
    VIC  16:  1920x1080   60.000000 Hz  16:9     67.500 kHz    148.500000 MHz
    VIC  31:  1920x1080   50.000000 Hz  16:9     56.250 kHz    148.500000 MHz
    VIC   4:  1280x720    60.000000 Hz  16:9     45.000 kHz     74.250000 MHz
    VIC  19:  1280x720    50.000000 Hz  16:9     37.500 kHz     74.250000 MHz
    VIC   5:  1920x1080i  60.000000 Hz  16:9     33.750 kHz     74.250000 MHz
    VIC  20:  1920x1080i  50.000000 Hz  16:9     28.125 kHz     74.250000 MHz
    VIC  63:  1920x1080  120.000000 Hz  16:9    135.000 kHz    297.000000 MHz
    Unknown (VIC 255)
    Unknown (VIC 255)
    Unknown (VIC 255)
    Unknown (VIC 255)
    Unknown (VIC 255)
    Unknown (VIC 255)
    Unknown (VIC 255)
    Unknown (VIC 255)
    Unknown (VIC 255)
    Unknown (VIC 255)
  Unknown CTA-861 Data Block (extended tag 0xff, length 30):
    ff ff ff ff ff ff ff ff ff ff ff ff ff ff ff ff '................'
    ff ff ff ff ff ff ff ff ff ff ff ff ff ff       '..............'
  Unknown CTA-861 Data Block (extended tag 0xff, length 30):
    ff ff ff ff ff ff ff ff ff ff ff ff ff ff ff ff '................'
    ff ff ff ff ff ff ff ff ff ff ff ff ff ff       '..............'
  Detailed Timing Descriptors:
    DTD 3:  4095x8190i  10.418373 Hz   1:2     80.018 kHz    655.350000 MHz (side by side interleaved, 4095 mm x 4095 mm)
                 Hfront 1023 Hsync 1023 Hback 1539 Hpol P Hborder 255
                 Vfront   63 Vsync  63 Vback 3459 Vpol P Vborder 255 Vfront +0.5 Odd Field
                 Vfront   63 Vsync  63 Vback 3459 Vpol P Vborder 255 Vback  +0.5 Even Field
    DTD 4:  4095x8190i  10.418373 Hz   1:2     80.018 kHz    655.350000 MHz (side by side interleaved, 4095 mm x 4095 mm)
                 Hfront 1023 Hsync 1023 Hback 1539 Hpol P Hborder 255
                 Vfront   63 Vsync  63 Vback 3459 Vpol P Vborder 255 Vfront +0.5 Odd Field
                 Vfront   63 Vsync  63 Vback 3459 Vpol P Vborder 255 Vback  +0.5 Even Field
Checksum: 0xff (should be 0xdd)  Unused space in Extension Block: 10 bytes

----------------

Warnings:

Block 1, CTA-861 Extension Block:
  Video Data Block: For improved preferred timing interoperability, set 'Native DTDs' to 1.
  Unknown CTA-861 Data Block (extended tag 0xff, length 30).
  Unknown CTA-861 Data Block (extended tag 0xff, length 30).
  Detailed Timing Descriptor #3: Image size is 4095x4095 mm, but based on the picture AR it should be 2047x4095 mm.
  Detailed Timing Descriptor #3: The use of non-zero borders in a DTD is not recommended.
  Detailed Timing Descriptor #4: Image size is 4095x4095 mm, but based on the picture AR it should be 2047x4095 mm.
  Detailed Timing Descriptor #4: The use of non-zero borders in a DTD is not recommended.
  Add a Colorimetry Data Block with the sRGB colorimetry bit set to avoid interop issues.
EDID:
  Base EDID: Some timings are out of range of the Monitor Ranges:
    Vertical Freq: 10.418 - 120.000 Hz (Monitor: 24.000 - 75.000 Hz)
    Horizontal Freq: 28.125 - 135.000 kHz (Monitor: 15.000 - 81.000 kHz)
    Maximum Clock: 655.350 MHz (Monitor: 300.000 MHz)

Failures:

Block 0, Base EDID:
  Detailed Timing Descriptor #1: Mismatch of image size 1872x1053 mm vs display size 1110x620 mm.
  Detailed Timing Descriptor #2: Mismatch of image size 1872x1053 mm vs display size 1110x620 mm.
Block 1, CTA-861 Extension Block:
  Video Data Block: Unknown VIC 255.
  Video Data Block: Unknown VIC 255.
  Video Data Block: Duplicate VIC 255.
  Video Data Block: Unknown VIC 255.
  Video Data Block: Unknown VIC 255.
  Video Data Block: Unknown VIC 255.
  Video Data Block: Unknown VIC 255.
  Video Data Block: Unknown VIC 255.
  Video Data Block: Unknown VIC 255.
  Video Data Block: Unknown VIC 255.
  Video Data Block: Unknown VIC 255.
  Offset is 81, but should be 87.
  Detailed Timing Descriptor #3: Mismatch of image size 4095x4095 mm vs display size 1110x620 mm.
  Detailed Timing Descriptor #4: Mismatch of image size 4095x4095 mm vs display size 1110x620 mm.
  Padding: Contains non-zero bytes.
  Missing VCDB, needed for Set Selectable RGB Quantization to avoid interop issues.
  Invalid checksum 0xff (should be 0xdd).
EDID:
  Extension Block 2 started with EDID header, ignoring Extension Blocks >= 2.
  Base EDID: The DTD max image size is 4095x4095mm, which is larger than the display size 1110.0x620.0mm.

EDID conformity: FAIL
