edid-decode (hex):

00 ff ff ff ff ff ff 00 04 72 05 26 a3 00 20 82
16 1c 01 03 80 00 00 78 0a 26 7c a2 58 58 94 26
0c 4c 57 3f cf 80 31 7c 45 7c 61 7c 81 00 81 80
81 c0 95 00 d1 c0 28 3c 80 a0 70 b0 23 40 30 20
36 00 00 00 00 00 00 1e 00 00 00 fd 00 32 f0 1e
ff 3c 00 0a 20 20 20 20 20 20 00 00 00 fc 00 48
36 35 33 30 42 44 0a 20 20 20 20 20 00 00 00 ff
00 4a 51 35 31 31 30 30 31 38 34 30 30 0a 01 01

02 03 2a f1 4e 06 02 15 11 04 13 05 14 90 1f 20
21 22 01 23 09 17 07 83 01 00 00 6a 03 0c 00 10
00 38 3c 20 80 00 e3 05 03 01 21 39 00 a0 50 20
2f 30 30 20 36 00 00 00 00 00 00 1c 66 21 56 aa
51 00 1e 30 46 8f 33 00 00 00 00 00 00 1e 86 6f
80 a0 70 38 40 40 30 20 35 00 20 2f 21 00 00 1a
02 3a 80 18 71 38 2d 40 58 2c 45 00 c4 8e 21 00
00 1e 00 00 00 00 00 00 00 00 00 00 00 00 00 83

00 ff ff ff ff ff ff 00 04 72 05 26 a3 00 20 82
16 1c 01 03 80 00 00 78 0a 26 7c a2 58 58 94 26
0c 4c 57 3f cf 80 31 7c 45 7c 61 7c 81 00 81 80
81 c0 95 00 d1 c0 28 3c 80 a0 70 b0 23 40 30 20
36 00 00 00 00 00 00 1e 00 00 00 fd 00 32 f0 1e
ff 3c 00 0a 20 20 20 20 20 20 00 00 00 fc 00 48
36 35 33 30 42 44 0a 20 20 20 20 20 00 00 00 ff
00 4a 51 35 31 31 30 30 31 38 34 30 30 0a 01 01

02 03 2a f1 4e 06 02 15 11 04 13 05 14 90 1f 20
21 22 01 23 09 17 07 83 01 00 00 6a 03 0c 00 10
00 38 3c 20 80 00 e3 05 03 01 21 39 00 a0 50 20
2f 30 30 20 36 00 00 00 00 00 00 1c 66 21 56 aa
51 00 1e 30 46 8f 33 00 00 00 00 00 00 1e 86 6f
80 a0 70 38 40 40 30 20 35 00 20 2f 21 00 00 1a
02 3a 80 18 71 38 2d 40 58 2c 45 00 c4 8e 21 00
00 1e 00 00 00 00 00 00 00 00 00 00 00 00 00 83

----------------

Block 0, Base EDID:
  EDID Structure Version & Revision: 1.3
  Vendor & Product Identification:
    Manufacturer: ACR
    Model: 9733
    Serial Number: ...
    Made in: week 22 of 2018
  Basic Display Parameters & Features:
    Digital display
    Image size is variable
    Gamma: 2.20
    RGB color display
    First detailed timing is the preferred timing
  Color Characteristics:
    Red  : 0.6328, 0.3457
    Green: 0.3447, 0.5800
    Blue : 0.1494, 0.0498
    White: 0.2998, 0.3398
  Established Timings I & II:
    DMT 0x04:   640x480    59.940476 Hz   4:3     31.469 kHz     25.175000 MHz
    Apple   :   640x480    66.666667 Hz   4:3     35.000 kHz     30.240000 MHz
    DMT 0x05:   640x480    72.808802 Hz   4:3     37.861 kHz     31.500000 MHz
    DMT 0x06:   640x480    75.000000 Hz   4:3     37.500 kHz     31.500000 MHz
    DMT 0x08:   800x600    56.250000 Hz   4:3     35.156 kHz     36.000000 MHz
    DMT 0x09:   800x600    60.316541 Hz   4:3     37.879 kHz     40.000000 MHz
    DMT 0x0a:   800x600    72.187572 Hz   4:3     48.077 kHz     50.000000 MHz
    DMT 0x0b:   800x600    75.000000 Hz   4:3     46.875 kHz     49.500000 MHz
    DMT 0x10:  1024x768    60.003840 Hz   4:3     48.363 kHz     65.000000 MHz
    DMT 0x11:  1024x768    70.069359 Hz   4:3     56.476 kHz     75.000000 MHz
    DMT 0x12:  1024x768    75.028582 Hz   4:3     60.023 kHz     78.750000 MHz
    DMT 0x24:  1280x1024   75.024675 Hz   5:4     79.976 kHz    135.000000 MHz
    Apple   :  1152x870    75.061550 Hz 192:145   68.681 kHz    100.000000 MHz
  Standard Timings:
    GTF     :   640x480   119.999084 Hz   4:3     61.800 kHz     52.406000 MHz
    GTF     :   800x600   119.999886 Hz   4:3     77.160 kHz     83.950000 MHz
    GTF     :  1024x768   119.999931 Hz   4:3     98.760 kHz    139.054000 MHz
    DMT 0x1c:  1280x800    59.810326 Hz  16:10    49.702 kHz     83.500000 MHz
    DMT 0x23:  1280x1024   60.019740 Hz   5:4     63.981 kHz    108.000000 MHz
    DMT 0x55:  1280x720    60.000000 Hz  16:9     45.000 kHz     74.250000 MHz
    DMT 0x2f:  1440x900    59.887445 Hz  16:10    55.935 kHz    106.500000 MHz
    DMT 0x52:  1920x1080   60.000000 Hz  16:9     67.500 kHz    148.500000 MHz
  Detailed Timing Descriptors:
    DTD 1:  1920x1200   59.950171 Hz  16:10    74.038 kHz    154.000000 MHz
                 Hfront   48 Hsync  32 Hback   80 Hpol P
                 Vfront    3 Vsync   6 Vback   26 Vpol P
    Display Range Limits:
      Monitor ranges (GTF): 50-240 Hz V, 30-255 kHz H, max dotclock 600 MHz
    Display Product Name: 'H6530BD'
    Display Product Serial Number: ...
  Extension blocks: 1
Checksum: 0x01

----------------

Block 1, CTA-861 Extension Block:
  Revision: 3
  Underscans IT Video Formats by default
  Basic audio support
  Supports YCbCr 4:4:4
  Supports YCbCr 4:2:2
  Native DTDs: 1
  Video Data Block:
    VIC   6:  1440x480i   59.940060 Hz   4:3     15.734 kHz     27.000000 MHz
    VIC   2:   720x480    59.940060 Hz   4:3     31.469 kHz     27.000000 MHz
    VIC  21:  1440x576i   50.000000 Hz   4:3     15.625 kHz     27.000000 MHz
    VIC  17:   720x576    50.000000 Hz   4:3     31.250 kHz     27.000000 MHz
    VIC   4:  1280x720    60.000000 Hz  16:9     45.000 kHz     74.250000 MHz
    VIC  19:  1280x720    50.000000 Hz  16:9     37.500 kHz     74.250000 MHz
    VIC   5:  1920x1080i  60.000000 Hz  16:9     33.750 kHz     74.250000 MHz
    VIC  20:  1920x1080i  50.000000 Hz  16:9     28.125 kHz     74.250000 MHz
    VIC  16:  1920x1080   60.000000 Hz  16:9     67.500 kHz    148.500000 MHz (native)
    VIC  31:  1920x1080   50.000000 Hz  16:9     56.250 kHz    148.500000 MHz
    VIC  32:  1920x1080   24.000000 Hz  16:9     27.000 kHz     74.250000 MHz
    VIC  33:  1920x1080   25.000000 Hz  16:9     28.125 kHz     74.250000 MHz
    VIC  34:  1920x1080   30.000000 Hz  16:9     33.750 kHz     74.250000 MHz
    VIC   1:   640x480    59.940476 Hz   4:3     31.469 kHz     25.175000 MHz
  Audio Data Block:
    Linear PCM:
      Max channels: 2
      Supported sample rates (kHz): 96 48 44.1 32
      Supported sample sizes (bits): 24 20 16
  Speaker Allocation Data Block:
    FL/FR - Front Left/Right
  Vendor-Specific Data Block (HDMI), OUI 00-0C-03:
    Source physical address: 1.0.0.0
    DC_36bit
    DC_30bit
    DC_Y444
    Maximum TMDS clock: 300 MHz
    Extended HDMI video details:
      3D present
  Colorimetry Data Block:
    xvYCC601
    xvYCC709
    Gamut Boundary Description Metadata Profile P0
  Detailed Timing Descriptors:
    DTD 2:  1280x800   119.908501 Hz  16:10   101.562 kHz    146.250000 MHz
                 Hfront   48 Hsync  32 Hback   80 Hpol N
                 Vfront    3 Vsync   6 Vback   38 Vpol P
    DTD 3:  1366x768    59.789541 Hz 683:384   47.712 kHz     85.500000 MHz
                 Hfront   70 Hsync 143 Hback  213 Hpol P
                 Vfront    3 Vsync   3 Vback   24 Vpol P
    DTD 4:  1920x1080  119.982181 Hz  16:9    137.260 kHz    285.500000 MHz (544 mm x 303 mm)
                 Hfront   48 Hsync  32 Hback   80 Hpol P
                 Vfront    3 Vsync   5 Vback   56 Vpol N
    DTD 5:  1920x1080   60.000000 Hz  16:9     67.500 kHz    148.500000 MHz (708 mm x 398 mm)
                 Hfront   88 Hsync  44 Hback  148 Hpol P
                 Vfront    4 Vsync   5 Vback   36 Vpol P
Checksum: 0x83  Unused space in Extension Block: 13 bytes

----------------

Warnings:

Block 0, Base EDID:
  Detailed Timing Descriptor #1: DTD is similar but not identical to DMT 0x44.
Block 1, CTA-861 Extension Block:
  Video Data Block: VIC 6 and the first DTD are not identical. Is this intended?
  Colorimetry Data Block: Set the sRGB colorimetry bit to avoid interop issues.
  Detailed Timing Descriptor #2: DTD is similar but not identical to DMT 0x1f.
  Display Product Serial Number is set, so the Serial Number in the Base EDID should be 0.
EDID:
  Base EDID: Some timings are out of range of the Monitor Ranges:
    Vertical Freq: 24.000 - 120.000 Hz (Monitor: 50.000 - 240.000 Hz)
    Horizontal Freq: 15.625 - 137.259 kHz (Monitor: 30.000 - 510.000 kHz)

Failures:

Block 1, CTA-861 Extension Block:
  Missing VCDB, needed for Set Selectable RGB Quantization to avoid interop issues.
EDID:
  Extension Block 2 started with EDID header, ignoring Extension Blocks >= 2.
  Base EDID: The DTD max image size is 708x398mm, but the display size is not specified anywhere.
  CTA-861: Native progressive timings are a mix of several resolutions.

EDID conformity: FAIL
