edid-decode (hex):

00 ff ff ff ff ff ff 00 30 e4 4d 05 00 00 00 00
00 1a 01 04 a5 1d 10 78 ea 23 f5 a2 51 47 9c 27
10 50 54 00 00 00 01 01 01 01 01 01 01 01 01 01
01 01 01 01 01 01 4d d0 00 a0 f0 70 3e 80 30 20
35 00 25 a5 10 00 00 1b 4d d0 00 a0 f0 70 ec 88
30 20 35 00 25 a5 10 00 00 1b 00 00 00 00 00 00
00 00 00 00 00 00 00 00 00 00 00 00 00 00 00 02
00 0c 2d ff 0a 3c aa 29 15 38 aa 00 00 00 00 ca

00 ff ff ff ff ff ff 00 30 e4 4d 05 00 00 00 00
00 1a 01 04 a5 1d 10 78 ea 23 f5 a2 51 47 9c 27
10 50 54 00 00 00 01 01 01 01 01 01 01 01 01 01
01 01 01 01 01 01 4d d0 00 a0 f0 70 3e 80 30 20
35 00 25 a5 10 00 00 1b 4d d0 00 a0 f0 70 ec 88
30 20 35 00 25 a5 10 00 00 1b 00 00 00 00 00 00
00 00 00 00 00 00 00 00 00 00 00 00 00 00 00 02
00 0c 2d ff 0a 3c aa 29 15 38 aa 00 00 00 00 ca

----------------

Block 0, Base EDID:
  EDID Structure Version & Revision: 1.4
  Vendor & Product Identification:
    Manufacturer: LGD
    Model: 1357
    Made in: 2016
  Basic Display Parameters & Features:
    Digital display
    Bits per primary color channel: 8
    DisplayPort interface
    Maximum image size: 29 cm x 16 cm
    Gamma: 2.20
    DPMS levels: Standby Suspend Off
    Supported color formats: RGB 4:4:4, YCrCb 4:4:4
    First detailed timing includes the native pixel format and preferred refresh rate
  Color Characteristics:
    Red  : 0.6328, 0.3183
    Green: 0.2773, 0.6123
    Blue : 0.1552, 0.0654
    White: 0.3134, 0.3291
  Established Timings I & II: none
  Standard Timings: none
  Detailed Timing Descriptors:
    DTD 1:  3840x2160   59.996625 Hz  16:9    133.312 kHz    533.250000 MHz (293 mm x 165 mm)
                 Hfront   48 Hsync  32 Hback   80 Hpol P
                 Vfront    3 Vsync   5 Vback   54 Vpol N
    DTD 2:  3840x2160   29.998312 Hz  16:9    133.312 kHz    533.250000 MHz (293 mm x 165 mm)
                 Hfront   48 Hsync  32 Hback   80 Hpol P
                 Vfront    3 Vsync   5 Vback 2276 Vpol N
    Empty Descriptor
    Manufacturer-Specified Display Descriptor (0x02): 00 02 00 0c 2d ff 0a 3c aa 29 15 38 aa 00 00 00 '....-..<.).8....'
Checksum: 0xca

----------------

Warnings:

Block 0, Base EDID:
  Missing Display Product Name.

Failures:

Block 0, Base EDID:
  Empty Descriptor: Use Dummy Descriptor instead of all zeroes.
EDID:
  Extension Block 1 started with EDID header, ignoring Extension Blocks >= 1.

EDID conformity: FAIL
