edid-decode (hex):

00 ff ff ff ff ff ff 00 05 e3 59 17 7e 51 33 01
0d 18 01 03 81 26 15 78 2a 1a 05 9e 56 57 96 28
13 50 54 01 08 00 81 c0 81 00 95 00 01 01 01 01
01 01 01 01 01 01 1c 2a 40 54 61 84 1a 30 30 20
35 00 7e d7 10 00 00 1e 00 00 00 ff 00 31 32 33
34 35 36 37 38 39 41 42 43 44 00 00 00 fd 00 0f
f0 0f 7f 11 00 0a 20 20 20 20 20 20 00 00 00 fc
00 45 31 37 35 39 46 77 75 0a 20 20 20 20 00 ac

00 ff ff ff ff ff ff 00 05 e3 59 17 7e 51 33 01
0d 18 01 03 81 26 15 78 2a 1a 05 9e 56 57 96 28
13 50 54 01 08 00 81 c0 81 00 95 00 01 01 01 01
01 01 01 01 01 01 1c 2a 40 54 61 84 1a 30 30 20
35 00 7e d7 10 00 00 1e 00 00 00 ff 00 31 32 33
34 35 36 37 38 39 41 42 43 44 00 00 00 fd 00 0f
f0 0f 7f 11 00 0a 20 20 20 20 20 20 00 00 00 fc
00 45 31 37 35 39 46 77 75 0a 20 20 20 20 00 ac

----------------

Block 0, Base EDID:
  EDID Structure Version & Revision: 1.3
  Vendor & Product Identification:
    Manufacturer: AOC
    Model: 5977
    Serial Number: ...
    Made in: week 13 of 2014
  Basic Display Parameters & Features:
    Digital display
    DFP 1.x compatible TMDS
    Maximum image size: 38 cm x 21 cm
    Gamma: 2.20
    DPMS levels: Off
    RGB color display
    First detailed timing is the preferred timing
  Color Characteristics:
    Red  : 0.6171, 0.3369
    Green: 0.3417, 0.5878
    Blue : 0.1562, 0.0742
    White: 0.3134, 0.3291
  Established Timings I & II:
    DMT 0x09:   800x600    60.316541 Hz   4:3     37.879 kHz     40.000000 MHz
    DMT 0x10:  1024x768    60.003840 Hz   4:3     48.363 kHz     65.000000 MHz
  Standard Timings:
    DMT 0x55:  1280x720    60.000000 Hz  16:9     45.000 kHz     74.250000 MHz
    DMT 0x1c:  1280x800    59.810326 Hz  16:10    49.702 kHz     83.500000 MHz
    DMT 0x2f:  1440x900    59.887445 Hz  16:10    55.935 kHz    106.500000 MHz
  Detailed Timing Descriptors:
    DTD 1:  1600x900    60.007571 Hz  16:9     55.567 kHz    107.800000 MHz (382 mm x 215 mm)
                 Hfront   48 Hsync  32 Hback  260 Hpol P
                 Vfront    3 Vsync   5 Vback   18 Vpol P
    Display Product Serial Number: ...
    Display Range Limits:
      Monitor ranges (GTF): 15-240 Hz V, 15-127 kHz H, max dotclock 170 MHz
    Display Product Name: 'E1759Fwu'
Checksum: 0xac

----------------

Failures:

EDID:
  Extension Block 1 started with EDID header, ignoring Extension Blocks >= 1.

EDID conformity: FAIL
