edid-decode (hex):

00 ff ff ff ff ff ff 00 0d ae 39 15 00 00 00 00
10 1e 01 04 a5 22 13 78 03 0f 95 ae 52 43 b0 26
0f 50 54 00 00 00 01 01 01 01 01 01 01 01 01 01
01 01 01 01 01 01 63 63 00 a0 a0 a0 77 50 30 20
6a 00 58 c1 10 00 00 18 00 00 00 00 00 00 00 00
00 00 00 00 00 00 00 00 00 00 00 00 00 00 00 00
00 00 00 00 00 00 00 00 00 00 00 00 00 00 00 02
00 0c 33 ff 0f 3c 96 41 17 3a 96 00 00 00 01 43

70 13 79 00 00 03 01 14 50 11 01 84 ff 09 9f 00
2f 00 1f 00 9f 05 76 00 05 00 09 00 00 00 00 00
00 00 00 00 00 00 00 00 00 00 00 00 00 00 00 00
00 00 00 00 00 00 00 00 00 00 00 00 00 00 00 00
00 00 00 00 00 00 00 00 00 00 00 00 00 00 00 00
00 00 00 00 00 00 00 00 00 00 00 00 00 00 00 00
00 00 54 35 31 31 55 35 39 32 41 4c 31 33 00 00
00 00 00 00 00 00 00 00 00 00 00 00 00 00 88 90

00 ff ff ff ff ff ff 00 0d ae 39 15 00 00 00 00
10 1e 01 04 a5 22 13 78 03 0f 95 ae 52 43 b0 26
0f 50 54 00 00 00 01 01 01 01 01 01 01 01 01 01
01 01 01 01 01 01 63 63 00 a0 a0 a0 77 50 30 20
6a 00 58 c1 10 00 00 18 00 00 00 00 00 00 00 00
00 00 00 00 00 00 00 00 00 00 00 00 00 00 00 00
00 00 00 00 00 00 00 00 00 00 00 00 00 00 00 02
00 0c 33 ff 0f 3c 96 41 17 3a 96 00 00 00 01 43

70 13 79 00 00 03 01 14 50 11 01 84 ff 09 9f 00
2f 00 1f 00 9f 05 76 00 05 00 09 00 00 00 00 00
00 00 00 00 00 00 00 00 00 00 00 00 00 00 00 00
00 00 00 00 00 00 00 00 00 00 00 00 00 00 00 00
00 00 00 00 00 00 00 00 00 00 00 00 00 00 00 00
00 00 00 00 00 00 00 00 00 00 00 00 00 00 00 00
00 00 54 35 31 31 55 35 39 32 41 4c 31 33 00 00
00 00 00 00 00 00 00 00 00 00 00 00 00 00 88 90

----------------

Block 0, Base EDID:
  EDID Structure Version & Revision: 1.4
  Vendor & Product Identification:
    Manufacturer: CMN
    Model: 5433
    Made in: week 16 of 2020
  Basic Display Parameters & Features:
    Digital display
    Bits per primary color channel: 8
    DisplayPort interface
    Maximum image size: 34 cm x 19 cm
    Gamma: 2.20
    Supported color formats: RGB 4:4:4
    First detailed timing includes the native pixel format and preferred refresh rate
    Display supports continuous frequencies
  Color Characteristics:
    Red  : 0.6796, 0.3203
    Green: 0.2646, 0.6904
    Blue : 0.1503, 0.0595
    White: 0.3134, 0.3291
  Established Timings I & II: none
  Standard Timings: none
  Detailed Timing Descriptors:
    DTD 1:  2560x1440   60.000283 Hz  16:9     93.540 kHz    254.430000 MHz (344 mm x 193 mm)
                 Hfront   48 Hsync  32 Hback   80 Hpol N
                 Vfront    6 Vsync  10 Vback  103 Vpol N
    Empty Descriptor
    Empty Descriptor
    Manufacturer-Specified Display Descriptor (0x02): 00 02 00 0c 33 ff 0f 3c 96 41 17 3a 96 00 00 00 '....3..<.A.:....'
  Extension blocks: 1
Checksum: 0x43

----------------

Block 1, DisplayID Extension Block:
  Version: 1.3
  Extension Count: 0
  Display Product Type: Extension Section
  Video Timing Modes Type 1 - Detailed Timings Data Block:
    DTD:  2560x1440  165.002547 Hz  16:9    257.239 kHz    699.690000 MHz (aspect 16:9, no 3D stereo, preferred)
               Hfront   48 Hsync  32 Hback   80 Hpol N
               Vfront    6 Vsync  10 Vback  103 Vpol N
  Filler:
    00 00 00 00 00 00 00 00 00 00 00 00 00 00 00 00 '................'
    00 00 00 00 00 00 00 00 00 00 00 00 00 00 00 00 '................'
    00 00 00 00 00 00 00 00 00 00 00 00 00 00 00 00 '................'
    00 00 00 00 00 00 00 00 00 00 00 00 00 00 00 00 '................'
    00 00 00 00 00 00 54 35 31 31 55 35 39 32 41 4c '......T511U592AL'
    31 33 00 00 00 00 00 00 00 00 00 00 00 00 00 00 '13..............'
    00 00                                           '..'
  Checksum: 0x88
Checksum: 0x90

----------------

Warnings:

Block 0, Base EDID:
  Missing Display Product Name.

Failures:

Block 0, Base EDID:
  Empty Descriptor: Use Dummy Descriptor instead of all zeroes.
  Empty Descriptor: Use Dummy Descriptor instead of all zeroes.
  Missing Display Range Limits Descriptor.
Block 1, DisplayID Extension Block:
  DisplayID Base Block has no product type.
  Non-0 filler bytes in the DisplayID block.
EDID:
  Extension Block 2 started with EDID header, ignoring Extension Blocks >= 2.

EDID conformity: FAIL
