edid-decode (hex):

00 ff ff ff ff ff ff 00 5a 63 21 00 01 01 01 01
03 12 01 03 08 23 14 78 2e b7 b5 a2 55 48 98 27
15 50 54 bf e8 00 71 4f 81 c0 81 40 81 80 01 01
01 01 01 01 01 01 66 21 56 a8 51 00 1e 30 45 8f
3a 00 5c c5 10 00 00 1c 00 00 00 ff 00 51 56 4d
30 38 30 33 32 31 39 38 38 0a 00 00 00 fd 00 32
4b 18 52 0e 00 0a 20 20 20 20 20 20 00 00 00 fc
00 56 41 31 36 31 36 77 53 45 52 49 45 53 00 df

00 ff ff ff ff ff ff 00 5a 63 21 00 01 01 01 01
03 12 01 03 08 23 14 78 2e b7 b5 a2 55 48 98 27
15 50 54 bf e8 00 71 4f 81 c0 81 40 81 80 01 01
01 01 01 01 01 01 66 21 56 a8 51 00 1e 30 45 8f
3a 00 5c c5 10 00 00 1c 00 00 00 ff 00 51 56 4d
30 38 30 33 32 31 39 38 38 0a 00 00 00 fd 00 32
4b 18 52 0e 00 0a 20 20 20 20 20 20 00 00 00 fc
00 56 41 31 36 31 36 77 53 45 52 49 45 53 00 df

----------------

Block 0, Base EDID:
  EDID Structure Version & Revision: 1.3
  Vendor & Product Identification:
    Manufacturer: VSC
    Model: 33
    Serial Number: ...
    Made in: week 3 of 2008
  Basic Display Parameters & Features:
    Analog display
    Signal Level Standard: 0.700 : 0.300 : 1.000 V p-p
    Blank level equals black level
    Sync: Separate
    Maximum image size: 35 cm x 20 cm
    Gamma: 2.20
    DPMS levels: Off
    RGB color display
    Default (sRGB) color space is primary color space
    First detailed timing is the preferred timing
  Color Characteristics:
    Red  : 0.6347, 0.3349
    Green: 0.2822, 0.5966
    Blue : 0.1542, 0.0849
    White: 0.3134, 0.3291
  Established Timings I & II:
    IBM     :   720x400    70.081663 Hz   9:5     31.467 kHz     28.320000 MHz
    DMT 0x04:   640x480    59.940476 Hz   4:3     31.469 kHz     25.175000 MHz
    Apple   :   640x480    66.666667 Hz   4:3     35.000 kHz     30.240000 MHz
    DMT 0x05:   640x480    72.808802 Hz   4:3     37.861 kHz     31.500000 MHz
    DMT 0x06:   640x480    75.000000 Hz   4:3     37.500 kHz     31.500000 MHz
    DMT 0x08:   800x600    56.250000 Hz   4:3     35.156 kHz     36.000000 MHz
    DMT 0x09:   800x600    60.316541 Hz   4:3     37.879 kHz     40.000000 MHz
    DMT 0x0a:   800x600    72.187572 Hz   4:3     48.077 kHz     50.000000 MHz
    DMT 0x0b:   800x600    75.000000 Hz   4:3     46.875 kHz     49.500000 MHz
    Apple   :   832x624    74.551266 Hz   4:3     49.726 kHz     57.284000 MHz
    DMT 0x10:  1024x768    60.003840 Hz   4:3     48.363 kHz     65.000000 MHz
  Standard Timings:
    DMT 0x15:  1152x864    75.000000 Hz   4:3     67.500 kHz    108.000000 MHz
    DMT 0x55:  1280x720    60.000000 Hz  16:9     45.000 kHz     74.250000 MHz
    DMT 0x20:  1280x960    60.000000 Hz   4:3     60.000 kHz    108.000000 MHz
    DMT 0x23:  1280x1024   60.019740 Hz   5:4     63.981 kHz    108.000000 MHz
  Detailed Timing Descriptors:
    DTD 1:  1366x768    59.856345 Hz 683:384   47.765 kHz     85.500000 MHz (348 mm x 197 mm)
                 Hfront   69 Hsync 143 Hback  212 Hpol N
                 Vfront    3 Vsync  10 Vback   17 Vpol P
    Display Product Serial Number: ...
    Display Range Limits:
      Monitor ranges (GTF): 50-75 Hz V, 24-82 kHz H, max dotclock 140 MHz
    Display Product Name: 'VA1616wSERIES'
Checksum: 0xdf

----------------

Block 1, Unknown EDID Extension Block 0x00:
  00 ff ff ff ff ff ff 00 5a 63 21 00 01 01 01 01 '........Zc!.....'
  03 12 01 03 08 23 14 78 2e b7 b5 a2 55 48 98 27 '.....#.x....UH.''
  15 50 54 bf e8 00 71 4f 81 c0 81 40 81 80 01 01 '.PT...qO...@....'
  01 01 01 01 01 01 66 21 56 a8 51 00 1e 30 45 8f '......f!V.Q..0E.'
  3a 00 5c c5 10 00 00 1c 00 00 00 ff 00 51 56 4d ':.\..........QVM'
  30 38 30 33 32 31 39 38 38 0a 00 00 00 fd 00 32 '080321988......2'
  4b 18 52 0e 00 0a 20 20 20 20 20 20 00 00 00 fc 'K.R...      ....'
  00 56 41 31 36 31 36 77 53 45 52 49 45 53 00 df '.VA1616wSERIES..'
Checksum: 0xdf

----------------

Warnings:

Block 0, Base EDID:
  Vendor & Product Identification: The serial number is one of the known dummy values, it should probably be set to 0.

Failures:

Block 0, Base EDID:
  Basic Display Parameters & Features: sRGB is signaled, but the chromaticities do not match.
Block 1, Base EDID:
  Unknown Extension Block.
EDID:
  Base EDID: EDID specified 0 extension block(s), but found 1 extension block(s).

EDID conformity: FAIL
