edid-decode (hex):

00 ff ff ff ff ff ff 00 09 e5 e3 0a 00 00 00 00
30 1f 01 04 a5 22 13 78 03 76 65 91 57 59 92 29
1f 50 54 00 00 00 01 01 01 01 01 01 01 01 01 01
01 01 01 01 01 01 82 87 80 a0 70 38 4e 40 30 20
36 00 58 c2 10 00 00 1a 00 00 00 fd 00 30 90 a7
a7 23 01 0a 20 20 20 20 20 20 00 00 00 fe 00 42
4f 45 20 4e 4a 0a 20 20 20 20 20 20 00 00 00 fe
00 4e 45 31 35 36 46 48 4d 2d 4e 58 33 0a 00 48

00 ff ff ff ff ff ff 00 09 e5 e3 0a 00 00 00 00
30 1f 01 04 a5 22 13 78 03 76 65 91 57 59 92 29
1f 50 54 00 00 00 01 01 01 01 01 01 01 01 01 01
01 01 01 01 01 01 82 87 80 a0 70 38 4e 40 30 20
36 00 58 c2 10 00 00 1a 00 00 00 fd 00 30 90 a7
a7 23 01 0a 20 20 20 20 20 20 00 00 00 fe 00 42
4f 45 20 4e 4a 0a 20 20 20 20 20 20 00 00 00 fe
00 4e 45 31 35 36 46 48 4d 2d 4e 58 33 0a 00 48

----------------

Block 0, Base EDID:
  EDID Structure Version & Revision: 1.4
  Vendor & Product Identification:
    Manufacturer: BOE
    Model: 2787
    Made in: week 48 of 2021
  Basic Display Parameters & Features:
    Digital display
    Bits per primary color channel: 8
    DisplayPort interface
    Maximum image size: 34 cm x 19 cm
    Gamma: 2.20
    Supported color formats: RGB 4:4:4
    First detailed timing includes the native pixel format and preferred refresh rate
    Display supports continuous frequencies
  Color Characteristics:
    Red  : 0.5673, 0.3427
    Green: 0.3486, 0.5722
    Blue : 0.1611, 0.1230
    White: 0.3134, 0.3291
  Established Timings I & II: none
  Standard Timings: none
  Detailed Timing Descriptors:
    DTD 1:  1920x1080  144.023183 Hz  16:9    166.779 kHz    346.900000 MHz (344 mm x 194 mm)
                 Hfront   48 Hsync  32 Hback   80 Hpol P
                 Vfront    3 Vsync   6 Vback   69 Vpol N
    Display Range Limits:
      Monitor ranges (Range Limits Only): 48-144 Hz V, 167-167 kHz H, max dotclock 350 MHz
    Alphanumeric Data String: 'BOE NJ'
    Alphanumeric Data String: 'NE156FHM-NX3'
Checksum: 0x48

----------------

Warnings:

Block 0, Base EDID:
  Missing Display Product Name.

Failures:

EDID:
  Extension Block 1 started with EDID header, ignoring Extension Blocks >= 1.

EDID conformity: FAIL
