edid-decode (hex):

00 ff ff ff ff ff ff 00 0e 6f 02 14 00 00 00 00
00 1e 01 04 b5 1e 13 78 02 ee 95 a3 54 4c 99 26
0f 50 54 00 00 00 01 01 01 01 01 01 01 01 01 01
01 01 01 01 01 01 b6 c8 40 a0 b0 08 4e 70 30 20
36 00 2e bc 10 00 00 18 00 00 00 00 00 00 00 00
00 00 00 00 00 00 00 00 00 18 00 00 00 fe 00 43
53 4f 54 20 54 33 0a 20 20 20 20 20 00 00 00 fe
00 4d 4e 45 30 30 37 5a 41 31 2d 31 0a 20 00 d3

00 ff ff ff ff ff ff 00 0e 6f 02 14 00 00 00 00
00 1e 01 04 b5 1e 13 78 02 ee 95 a3 54 4c 99 26
0f 50 54 00 00 00 01 01 01 01 01 01 01 01 01 01
01 01 01 01 01 01 b6 c8 40 a0 b0 08 4e 70 30 20
36 00 2e bc 10 00 00 18 00 00 00 00 00 00 00 00
00 00 00 00 00 00 00 00 00 18 00 00 00 fe 00 43
53 4f 54 20 54 33 0a 20 20 20 20 20 00 00 00 fe
00 4d 4e 45 30 30 37 5a 41 31 2d 31 0a 20 00 d3

----------------

Block 0, Base EDID:
  EDID Structure Version & Revision: 1.4
  Vendor & Product Identification:
    Manufacturer: CSO
    Model: 5122
    Made in: 2020
  Basic Display Parameters & Features:
    Digital display
    Bits per primary color channel: 10
    DisplayPort interface
    Maximum image size: 30 cm x 19 cm
    Gamma: 2.20
    Supported color formats: RGB 4:4:4
    First detailed timing includes the native pixel format and preferred refresh rate
  Color Characteristics:
    Red  : 0.6396, 0.3300
    Green: 0.2998, 0.5996
    Blue : 0.1503, 0.0595
    White: 0.3134, 0.3291
  Established Timings I & II: none
  Standard Timings: none
  Detailed Timing Descriptors:
    DTD 1:  2880x1800   89.999860 Hz  16:10   169.020 kHz    513.820000 MHz (302 mm x 188 mm)
                 Hfront   48 Hsync  32 Hback   80 Hpol N
                 Vfront    3 Vsync   6 Vback   69 Vpol N
    Manufacturer-Specified Display Descriptor (0x00): 00 00 00 00 00 00 00 00 00 00 00 00 00 00 00 18 '................'
    Alphanumeric Data String: 'CSOT T3'
    Alphanumeric Data String: 'MNE007ZA1-1'
Checksum: 0xd3

----------------

Warnings:

Block 0, Base EDID:
  Missing Display Product Name.

Failures:

EDID:
  Extension Block 1 started with EDID header, ignoring Extension Blocks >= 1.

EDID conformity: FAIL
