edid-decode (hex):

00 ff ff ff ff ff ff 00 06 93 08 a7 01 00 00 00
01 14 01 03 80 4f 00 78 1a da ff a3 58 4a a2 29
17 49 4b 00 00 00 01 01 01 01 01 01 01 01 01 01
01 01 01 01 01 01 02 3a 80 18 71 38 2d 40 58 2c
45 00 00 00 00 00 00 1e 01 1d 80 18 71 38 2d 40
58 2c 45 00 00 00 00 00 00 1e 00 00 00 fc 00 41
54 4f 4d 4f 53 20 53 48 4f 47 55 4e 00 00 00 fd
00 18 78 0f 87 1e 00 0a 20 20 20 20 20 20 01 4c

02 03 2c 70 51 5f 5e 5d 3f 40 10 1f 22 21 20 05
14 2f 29 04 13 01 23 0f 04 07 83 0f 00 00 6d 03
0c 00 10 00 00 3c 21 00 60 01 02 03 02 3a 80 18
71 38 2d 40 58 2c 45 00 00 00 00 00 00 1e 02 3a
80 d0 72 38 2d 40 10 2c 45 80 00 00 00 00 00 1e
01 1d 80 18 71 38 2d 40 58 2c 45 00 00 00 00 00
00 1e 01 1d 80 d0 72 38 2d 40 10 2c 45 80 00 00
00 00 00 1e 00 00 00 00 00 00 00 00 00 00 00 52

----------------

Block 0, Base EDID:
  EDID Structure Version & Revision: 1.3
  Vendor & Product Identification:
    Manufacturer: ATS
    Model: 42760
    Serial Number: ...
    Made in: week 1 of 2010
  Basic Display Parameters & Features:
    Digital display
    Image size is variable
    Gamma: 2.20
    Undefined display color type
    First detailed timing is the preferred timing
  Color Characteristics:
    Red  : 0.6396, 0.3447
    Green: 0.2910, 0.6347
    Blue : 0.1630, 0.0927
    White: 0.2880, 0.2958
  Established Timings I & II: none
  Standard Timings: none
  Detailed Timing Descriptors:
    DTD 1:  1920x1080   60.000000 Hz  16:9     67.500 kHz    148.500000 MHz
                 Hfront   88 Hsync  44 Hback  148 Hpol P
                 Vfront    4 Vsync   5 Vback   36 Vpol P
    DTD 2:  1920x1080   30.000000 Hz  16:9     33.750 kHz     74.250000 MHz
                 Hfront   88 Hsync  44 Hback  148 Hpol P
                 Vfront    4 Vsync   5 Vback   36 Vpol P
    Display Product Name: 'ATOMOS SHOGUN'
    Display Range Limits:
      Monitor ranges (GTF): 24-120 Hz V, 15-135 kHz H, max dotclock 300 MHz
  Extension blocks: 1
Checksum: 0x4c

----------------

Block 1, CTA-861 Extension Block:
  Revision: 3
  Basic audio support
  Supports YCbCr 4:4:4
  Supports YCbCr 4:2:2
  Native DTDs: 0
  Video Data Block:
    VIC  95:  3840x2160   30.000000 Hz  16:9     67.500 kHz    297.000000 MHz
    VIC  94:  3840x2160   25.000000 Hz  16:9     56.250 kHz    297.000000 MHz
    VIC  93:  3840x2160   24.000000 Hz  16:9     54.000 kHz    297.000000 MHz
    VIC  63:  1920x1080  120.000000 Hz  16:9    135.000 kHz    297.000000 MHz
    VIC  64:  1920x1080  100.000000 Hz  16:9    112.500 kHz    297.000000 MHz
    VIC  16:  1920x1080   60.000000 Hz  16:9     67.500 kHz    148.500000 MHz
    VIC  31:  1920x1080   50.000000 Hz  16:9     56.250 kHz    148.500000 MHz
    VIC  34:  1920x1080   30.000000 Hz  16:9     33.750 kHz     74.250000 MHz
    VIC  33:  1920x1080   25.000000 Hz  16:9     28.125 kHz     74.250000 MHz
    VIC  32:  1920x1080   24.000000 Hz  16:9     27.000 kHz     74.250000 MHz
    VIC   5:  1920x1080i  60.000000 Hz  16:9     33.750 kHz     74.250000 MHz
    VIC  20:  1920x1080i  50.000000 Hz  16:9     28.125 kHz     74.250000 MHz
    VIC  47:  1280x720   120.000000 Hz  16:9     90.000 kHz    148.500000 MHz
    VIC  41:  1280x720   100.000000 Hz  16:9     75.000 kHz    148.500000 MHz
    VIC   4:  1280x720    60.000000 Hz  16:9     45.000 kHz     74.250000 MHz
    VIC  19:  1280x720    50.000000 Hz  16:9     37.500 kHz     74.250000 MHz
    VIC   1:   640x480    59.940476 Hz   4:3     31.469 kHz     25.175000 MHz
  Audio Data Block:
    Linear PCM:
      Max channels: 8
      Supported sample rates (kHz): 48
      Supported sample sizes (bits): 24 20 16
  Speaker Allocation Data Block:
    FL/FR - Front Left/Right
    LFE1 - Low Frequency Effects 1
    FC - Front Center
    LS/RS - Left/Right Surround
  Vendor-Specific Data Block (HDMI), OUI 00-0C-03:
    Source physical address: 1.0.0.0
    Maximum TMDS clock: 300 MHz
    Supported Content Types:
      Graphics
    Extended HDMI video details:
      HDMI VICs:
        HDMI VIC 1:  3840x2160   30.000000 Hz  16:9     67.500 kHz    297.000000 MHz
        HDMI VIC 2:  3840x2160   25.000000 Hz  16:9     56.250 kHz    297.000000 MHz
        HDMI VIC 3:  3840x2160   24.000000 Hz  16:9     54.000 kHz    297.000000 MHz
  Detailed Timing Descriptors:
    DTD 3:  1920x1080   60.000000 Hz  16:9     67.500 kHz    148.500000 MHz
                 Hfront   88 Hsync  44 Hback  148 Hpol P
                 Vfront    4 Vsync   5 Vback   36 Vpol P
    DTD 4:  1920x1080   50.000000 Hz  16:9     56.250 kHz    148.500000 MHz
                 Hfront  528 Hsync  44 Hback  148 Hpol P
                 Vfront    4 Vsync   5 Vback   36 Vpol P
    DTD 5:  1920x1080   30.000000 Hz  16:9     33.750 kHz     74.250000 MHz
                 Hfront   88 Hsync  44 Hback  148 Hpol P
                 Vfront    4 Vsync   5 Vback   36 Vpol P
    DTD 6:  1920x1080   25.000000 Hz  16:9     28.125 kHz     74.250000 MHz
                 Hfront  528 Hsync  44 Hback  148 Hpol P
                 Vfront    4 Vsync   5 Vback   36 Vpol P
Checksum: 0x52  Unused space in Extension Block: 11 bytes

----------------

Warnings:

Block 0, Base EDID:
  Vendor & Product Identification: The serial number is one of the known dummy values, it should probably be set to 0.
Block 1, CTA-861 Extension Block:
  IT Video Formats are overscanned by default, but normally this should be underscanned.
  Video Data Block: VIC 95 and the first DTD are not identical. Is this intended?
  Add a Colorimetry Data Block with the sRGB colorimetry bit set to avoid interop issues.

Failures:

Block 1, CTA-861 Extension Block:
  Missing VCDB, needed for Set Selectable RGB Quantization to avoid interop issues.

EDID conformity: FAIL
