edid-decode (hex):

00 ff ff ff ff ff ff 00 0e 77 00 08 00 00 00 00
00 22 01 04 a5 11 0b 78 03 b2 41 a5 54 4c 9e 24
0d 4e 53 00 00 00 01 01 01 01 01 01 01 01 01 01
01 01 01 01 01 01 3e 7b 80 a0 70 b0 40 40 30 20
66 0c ac 6b 00 00 00 18 9f 3d 80 a0 70 b0 40 40
30 20 66 0c ac 6b 00 00 00 18 00 00 00 fd 00 30
78 98 98 20 01 0a 20 20 20 20 20 20 00 00 00 fc
00 50 4e 38 30 30 37 51 42 31 2d 31 0a 20 01 f1

70 20 79 02 00 81 00 14 74 1a 00 00 03 01 30 78
00 00 00 00 00 00 78 00 00 00 00 80 00 00 00 00
00 00 00 00 00 00 00 00 00 00 00 00 00 00 00 00
00 00 00 00 00 00 00 00 00 00 00 00 00 00 00 00
00 00 00 00 00 00 00 00 00 00 00 00 00 00 00 00
00 00 00 00 00 00 00 00 00 00 00 00 00 00 00 00
00 00 00 00 00 00 00 00 00 00 00 00 00 00 00 00
00 00 00 00 00 00 00 00 00 00 00 00 00 00 9e 90

00 ff ff ff ff ff ff 00 0e 77 00 08 00 00 00 00
00 22 01 04 a5 11 0b 78 03 b2 41 a5 54 4c 9e 24
0d 4e 53 00 00 00 01 01 01 01 01 01 01 01 01 01
01 01 01 01 01 01 3e 7b 80 a0 70 b0 40 40 30 20
66 0c ac 6b 00 00 00 18 9f 3d 80 a0 70 b0 40 40
30 20 66 0c ac 6b 00 00 00 18 00 00 00 fd 00 30
78 98 98 20 01 0a 20 20 20 20 20 20 00 00 00 fc
00 50 4e 38 30 30 37 51 42 31 2d 31 0a 20 01 f1

70 20 79 02 00 81 00 14 74 1a 00 00 03 01 30 78
00 00 00 00 00 00 78 00 00 00 00 80 00 00 00 00
00 00 00 00 00 00 00 00 00 00 00 00 00 00 00 00
00 00 00 00 00 00 00 00 00 00 00 00 00 00 00 00
00 00 00 00 00 00 00 00 00 00 00 00 00 00 00 00
00 00 00 00 00 00 00 00 00 00 00 00 00 00 00 00
00 00 00 00 00 00 00 00 00 00 00 00 00 00 00 00
00 00 00 00 00 00 00 00 00 00 00 00 00 00 9e 90

----------------

Block 0, Base EDID:
  EDID Structure Version & Revision: 1.4
  Vendor & Product Identification:
    Manufacturer: CSW
    Model: 2048
    Made in: 2024
  Basic Display Parameters & Features:
    Digital display
    Bits per primary color channel: 8
    DisplayPort interface
    Maximum image size: 17 cm x 11 cm
    Gamma: 2.20
    Supported color formats: RGB 4:4:4
    First detailed timing includes the native pixel format and preferred refresh rate
    Display supports continuous frequencies
  Color Characteristics:
    Red  : 0.6464, 0.3310
    Green: 0.2968, 0.6191
    Blue : 0.1416, 0.0507
    White: 0.3046, 0.3251
  Established Timings I & II: none
  Standard Timings: none
  Detailed Timing Descriptors:
    DTD 1:  1920x1200  120.002130 Hz  16:10   151.683 kHz    315.500000 MHz (172 mm x 107 mm)
                 Hfront   48 Hsync  32 Hback   80 Hpol N
                 Vfront   54 Vsync   6 Vback    4 Vpol N
    DTD 2:  1920x1200   60.001065 Hz  16:10    75.841 kHz    157.750000 MHz (172 mm x 107 mm)
                 Hfront   48 Hsync  32 Hback   80 Hpol N
                 Vfront   54 Vsync   6 Vback    4 Vpol N
    Display Range Limits:
      Monitor ranges (Range Limits Only): 48-120 Hz V, 152-152 kHz H, max dotclock 320 MHz
    Display Product Name: 'PN8007QB1-1'
  Extension blocks: 1
Checksum: 0xf1

----------------

Block 1, DisplayID Extension Block:
  Version: 2.0
  Extension Count: 0
  Display Product Primary Use Case: None of the listed primary use cases; generic display
  CTA-861 DisplayID Data Block:
  Vendor-Specific Data Block (AMD), OUI 00-00-1A:
    Version: 3
    Flags 1: 0x01
      FreeSync Supported
    Minimum Refresh Rate: 48 Hz
    Maximum Refresh Rate: 120 Hz
    Flags 5: 0x00
    Additional Sink Information Address: 0x403
  Checksum: 0x9e
Checksum: 0x90

----------------

Warnings:

EDID:
  Base EDID: Some timings are out of range of the Monitor Ranges:
    Horizontal Freq: 75.841 - 151.682 kHz (Monitor: 152.000 - 152.000 kHz)

Failures:

Block 1, DisplayID Extension Block:
  Vendor-Specific Data Block (AMD), OUI 00-00-1A: Length is 20 instead of 21.
EDID:
  Extension Block 2 started with EDID header, ignoring Extension Blocks >= 2.
  DisplayID: Missing DisplayID Display Parameters Data Block.
  DisplayID: Missing DisplayID Type VII Detailed Timing Data Block.
  DisplayID: DisplayID expects at least one preferred timing.

EDID conformity: FAIL
