edid-decode (hex):

00 ff ff ff ff ff ff 00 5a 63 3b ff 01 01 01 01
19 21 01 04 b5 43 1c 78 3b 11 05 a5 57 4f ad 2a
0a 50 54 bf ef 80 b3 00 d1 c0 a9 c0 95 00 90 40
81 80 81 40 81 c0 b4 46 00 a0 a0 38 1f 40 12 20
28 00 a1 1c 21 00 00 1e 00 00 00 ff 00 57 4c 35
32 33 32 35 30 30 31 33 35 0a 00 00 00 fd 00 30
4b 56 56 17 01 0a 20 20 20 20 20 20 00 00 00 fc
00 56 41 32 39 33 32 20 53 45 52 49 45 53 01 ba

02 03 2f f1 4e 01 02 03 04 05 10 12 11 13 14 1e
1d 1f da 23 09 7f 07 83 01 00 00 e3 05 e3 01 e6
06 07 01 60 60 29 68 1a 00 00 01 01 30 4b 00 88
58 00 a0 a0 38 1f 40 12 20 28 00 a1 1c 21 00 00
1e 02 3a 80 18 71 38 2d 40 58 2c 45 00 a1 1c 21
00 00 1e 01 1d 00 72 51 d0 1e 20 6e 28 55 00 a1
1c 21 00 00 1e 01 1d 00 bc 52 d0 1e 20 b8 28 55
40 a1 1c 21 00 00 1e 00 00 00 00 00 00 00 00 d5

00 ff ff ff ff ff ff 00 5a 63 3b ff 01 01 01 01
19 21 01 04 b5 43 1c 78 3b 11 05 a5 57 4f ad 2a
0a 50 54 bf ef 80 b3 00 d1 c0 a9 c0 95 00 90 40
81 80 81 40 81 c0 b4 46 00 a0 a0 38 1f 40 12 20
28 00 a1 1c 21 00 00 1e 00 00 00 ff 00 57 4c 35
32 33 32 35 30 30 31 33 35 0a 00 00 00 fd 00 30
4b 56 56 17 01 0a 20 20 20 20 20 20 00 00 00 fc
00 56 41 32 39 33 32 20 53 45 52 49 45 53 01 ba

02 03 2f f1 4e 01 02 03 04 05 10 12 11 13 14 1e
1d 1f da 23 09 7f 07 83 01 00 00 e3 05 e3 01 e6
06 07 01 60 60 29 68 1a 00 00 01 01 30 4b 00 88
58 00 a0 a0 38 1f 40 12 20 28 00 a1 1c 21 00 00
1e 02 3a 80 18 71 38 2d 40 58 2c 45 00 a1 1c 21
00 00 1e 01 1d 00 72 51 d0 1e 20 6e 28 55 00 a1
1c 21 00 00 1e 01 1d 00 bc 52 d0 1e 20 b8 28 55
40 a1 1c 21 00 00 1e 00 00 00 00 00 00 00 00 d5

----------------

Block 0, Base EDID:
  EDID Structure Version & Revision: 1.4
  Vendor & Product Identification:
    Manufacturer: VSC
    Model: 65339
    Serial Number: ...
    Made in: week 25 of 2023
  Basic Display Parameters & Features:
    Digital display
    Bits per primary color channel: 10
    DisplayPort interface
    Maximum image size: 67 cm x 28 cm
    Gamma: 2.20
    DPMS levels: Off
    Supported color formats: RGB 4:4:4, YCrCb 4:4:4, YCrCb 4:2:2
    First detailed timing includes the native pixel format and preferred refresh rate
    Display supports continuous frequencies
  Color Characteristics:
    Red  : 0.6445, 0.3408
    Green: 0.3085, 0.6767
    Blue : 0.1640, 0.0390
    White: 0.3134, 0.3291
  Established Timings I & II:
    IBM     :   720x400    70.081663 Hz   9:5     31.467 kHz     28.320000 MHz
    DMT 0x04:   640x480    59.940476 Hz   4:3     31.469 kHz     25.175000 MHz
    Apple   :   640x480    66.666667 Hz   4:3     35.000 kHz     30.240000 MHz
    DMT 0x05:   640x480    72.808802 Hz   4:3     37.861 kHz     31.500000 MHz
    DMT 0x06:   640x480    75.000000 Hz   4:3     37.500 kHz     31.500000 MHz
    DMT 0x08:   800x600    56.250000 Hz   4:3     35.156 kHz     36.000000 MHz
    DMT 0x09:   800x600    60.316541 Hz   4:3     37.879 kHz     40.000000 MHz
    DMT 0x0a:   800x600    72.187572 Hz   4:3     48.077 kHz     50.000000 MHz
    DMT 0x0b:   800x600    75.000000 Hz   4:3     46.875 kHz     49.500000 MHz
    Apple   :   832x624    74.551266 Hz   4:3     49.726 kHz     57.284000 MHz
    DMT 0x10:  1024x768    60.003840 Hz   4:3     48.363 kHz     65.000000 MHz
    DMT 0x11:  1024x768    70.069359 Hz   4:3     56.476 kHz     75.000000 MHz
    DMT 0x12:  1024x768    75.028582 Hz   4:3     60.023 kHz     78.750000 MHz
    DMT 0x24:  1280x1024   75.024675 Hz   5:4     79.976 kHz    135.000000 MHz
    Apple   :  1152x870    75.061550 Hz 192:145   68.681 kHz    100.000000 MHz
  Standard Timings:
    DMT 0x3a:  1680x1050   59.954250 Hz  16:10    65.290 kHz    146.250000 MHz
    DMT 0x52:  1920x1080   60.000000 Hz  16:9     67.500 kHz    148.500000 MHz
    DMT 0x53:  1600x900    60.000000 Hz  16:9     60.000 kHz    108.000000 MHz (RB)
    DMT 0x2f:  1440x900    59.887445 Hz  16:10    55.935 kHz    106.500000 MHz
    DMT 0x2a:  1400x1050   59.978442 Hz   4:3     65.317 kHz    121.750000 MHz
    DMT 0x23:  1280x1024   60.019740 Hz   5:4     63.981 kHz    108.000000 MHz
    DMT 0x20:  1280x960    60.000000 Hz   4:3     60.000 kHz    108.000000 MHz
    DMT 0x55:  1280x720    60.000000 Hz  16:9     45.000 kHz     74.250000 MHz
  Detailed Timing Descriptors:
    DTD 1:  2560x1080   59.895695 Hz  64:27    66.544 kHz    181.000000 MHz (673 mm x 284 mm)
                 Hfront   18 Hsync  32 Hback  110 Hpol P
                 Vfront    2 Vsync   8 Vback   21 Vpol P
    Display Product Serial Number: ...
    Display Range Limits:
      Monitor ranges (Range Limits Only): 48-75 Hz V, 86-86 kHz H, max dotclock 230 MHz
    Display Product Name: 'VA2932 SERIES'
  Extension blocks: 1
Checksum: 0xba

----------------

Block 1, CTA-861 Extension Block:
  Revision: 3
  Underscans IT Video Formats by default
  Basic audio support
  Supports YCbCr 4:4:4
  Supports YCbCr 4:2:2
  Native DTDs: 1
  Video Data Block:
    VIC   1:   640x480    59.940476 Hz   4:3     31.469 kHz     25.175000 MHz
    VIC   2:   720x480    59.940060 Hz   4:3     31.469 kHz     27.000000 MHz
    VIC   3:   720x480    59.940060 Hz  16:9     31.469 kHz     27.000000 MHz
    VIC   4:  1280x720    60.000000 Hz  16:9     45.000 kHz     74.250000 MHz
    VIC   5:  1920x1080i  60.000000 Hz  16:9     33.750 kHz     74.250000 MHz
    VIC  16:  1920x1080   60.000000 Hz  16:9     67.500 kHz    148.500000 MHz
    VIC  18:   720x576    50.000000 Hz  16:9     31.250 kHz     27.000000 MHz
    VIC  17:   720x576    50.000000 Hz   4:3     31.250 kHz     27.000000 MHz
    VIC  19:  1280x720    50.000000 Hz  16:9     37.500 kHz     74.250000 MHz
    VIC  20:  1920x1080i  50.000000 Hz  16:9     28.125 kHz     74.250000 MHz
    VIC  30:  1440x576    50.000000 Hz  16:9     31.250 kHz     54.000000 MHz
    VIC  29:  1440x576    50.000000 Hz   4:3     31.250 kHz     54.000000 MHz
    VIC  31:  1920x1080   50.000000 Hz  16:9     56.250 kHz    148.500000 MHz
    VIC 218:  4096x2160  100.000000 Hz 256:135  225.000 kHz   1188.000000 MHz
  Audio Data Block:
    Linear PCM:
      Max channels: 2
      Supported sample rates (kHz): 192 176.4 96 88.2 48 44.1 32
      Supported sample sizes (bits): 24 20 16
  Speaker Allocation Data Block:
    FL/FR - Front Left/Right
  Colorimetry Data Block:
    xvYCC601
    xvYCC709
    BT2020cYCC
    BT2020YCC
    BT2020RGB
    Gamut Boundary Description Metadata Profile P0
  HDR Static Metadata Data Block:
    Electro optical transfer functions:
      Traditional gamma - SDR luminance range
      Traditional gamma - HDR luminance range
      SMPTE ST2084
    Supported static metadata descriptors:
      Static metadata type 1
    Desired content max luminance: 96 (400.000 cd/m^2)
    Desired content max frame-average luminance: 96 (400.000 cd/m^2)
    Desired content min luminance: 41 (0.103 cd/m^2)
  Vendor-Specific Data Block (AMD), OUI 00-00-1A:
    Version: 1
    Feature Caps: 0x01
    Minimum Refresh Rate: 48 Hz
    Maximum Refresh Rate: 75 Hz
    Flags 1.x: 0x00
  Detailed Timing Descriptors:
    DTD 2:  2560x1080   74.998676 Hz  64:27    83.324 kHz    226.640000 MHz (673 mm x 284 mm)
                 Hfront   18 Hsync  32 Hback  110 Hpol P
                 Vfront    2 Vsync   8 Vback   21 Vpol P
    DTD 3:  1920x1080   60.000000 Hz  16:9     67.500 kHz    148.500000 MHz (673 mm x 284 mm)
                 Hfront   88 Hsync  44 Hback  148 Hpol P
                 Vfront    4 Vsync   5 Vback   36 Vpol P
    DTD 4:  1280x720    60.000000 Hz  16:9     45.000 kHz     74.250000 MHz (673 mm x 284 mm)
                 Hfront  110 Hsync  40 Hback  220 Hpol P
                 Vfront    5 Vsync   5 Vback   20 Vpol P
    DTD 5:  1280x720    50.000000 Hz  16:9     37.500 kHz     74.250000 MHz (673 mm x 284 mm)
                 Hfront  440 Hsync  40 Hback  220 Hpol P
                 Vfront    5 Vsync   5 Vback   20 Vpol P
Checksum: 0xd5  Unused space in Extension Block: 8 bytes

----------------

Warnings:

Block 0, Base EDID:
  Vendor & Product Identification: The serial number is one of the known dummy values, it should probably be set to 0.
Block 1, CTA-861 Extension Block:
  Video Data Block: VIC 1 and the first DTD are not identical. Is this intended?
  Colorimetry Data Block: Set the sRGB colorimetry bit to avoid interop issues.
  Detailed Timing Descriptor #3: Image size is 673x284 mm, but based on the picture AR it should be 504x284 mm.
  Detailed Timing Descriptor #4: Image size is 673x284 mm, but based on the picture AR it should be 504x284 mm.
  Detailed Timing Descriptor #5: Image size is 673x284 mm, but based on the picture AR it should be 504x284 mm.
  Display Product Serial Number is set, so the Serial Number in the Base EDID should be 0.
EDID:
  Base EDID: Some timings are out of range of the Monitor Ranges:
    Vertical Freq: 50.000 - 100.000 Hz (Monitor: 48.000 - 75.000 Hz)
    Horizontal Freq: 28.125 - 225.000 kHz (Monitor: 86.000 - 86.000 kHz)
    Maximum Clock: 1188.000 MHz (Monitor: 230.000 MHz)

Failures:

Block 1, CTA-861 Extension Block:
  Missing VCDB, needed for Set Selectable RGB Quantization to avoid interop issues.
EDID:
  Extension Block 2 started with EDID header, ignoring Extension Blocks >= 2.

EDID conformity: FAIL
