edid-decode (hex):

00 ff ff ff ff ff ff 00 06 af a7 1c 00 00 00 00
0e 20 01 04 a5 22 16 78 02 ca 35 a6 55 49 99 25
10 50 54 00 00 00 01 01 01 01 01 01 01 01 01 01
01 01 01 01 01 01 04 d8 00 a0 a0 40 5e 60 30 20
aa 00 58 d7 10 00 00 18 04 d8 00 a0 a0 40 fc 66
30 20 aa 00 58 d7 10 00 00 18 00 00 00 fe 00 41
55 4f 0a 20 20 20 20 20 20 20 20 20 00 00 00 fe
00 42 31 36 30 51 41 4e 30 33 2e 48 20 0a 00 fe

00 ff ff ff ff ff ff 00 06 af a7 1c 00 00 00 00
0e 20 01 04 a5 22 16 78 02 ca 35 a6 55 49 99 25
10 50 54 00 00 00 01 01 01 01 01 01 01 01 01 01
01 01 01 01 01 01 04 d8 00 a0 a0 40 5e 60 30 20
aa 00 58 d7 10 00 00 18 04 d8 00 a0 a0 40 fc 66
30 20 aa 00 58 d7 10 00 00 18 00 00 00 fe 00 41
55 4f 0a 20 20 20 20 20 20 20 20 20 00 00 00 fe
00 42 31 36 30 51 41 4e 30 33 2e 48 20 0a 00 fe

----------------

Block 0, Base EDID:
  EDID Structure Version & Revision: 1.4
  Vendor & Product Identification:
    Manufacturer: AUO
    Model: 7335
    Made in: week 14 of 2022
  Basic Display Parameters & Features:
    Digital display
    Bits per primary color channel: 8
    DisplayPort interface
    Maximum image size: 34 cm x 22 cm
    Gamma: 2.20
    Supported color formats: RGB 4:4:4
    First detailed timing includes the native pixel format and preferred refresh rate
  Color Characteristics:
    Red  : 0.6513, 0.3320
    Green: 0.2871, 0.5996
    Blue : 0.1445, 0.0654
    White: 0.3134, 0.3291
  Established Timings I & II: none
  Standard Timings: none
  Detailed Timing Descriptors:
    DTD 1:  2560x1600  120.017015 Hz  16:10   203.309 kHz    553.000000 MHz (344 mm x 215 mm)
                 Hfront   48 Hsync  32 Hback   80 Hpol N
                 Vfront   10 Vsync  10 Vback   74 Vpol N
    DTD 2:  2560x1600   60.008508 Hz  16:10   203.309 kHz    553.000000 MHz (344 mm x 215 mm)
                 Hfront   48 Hsync  32 Hback   80 Hpol N
                 Vfront   10 Vsync  10 Vback 1768 Vpol N
    Alphanumeric Data String: 'AUO'
    Alphanumeric Data String: 'B160QAN03.H '
Checksum: 0xfe

----------------

Warnings:

Block 0, Base EDID:
  Missing Display Product Name.

Failures:

Block 0, Base EDID:
  Alphanumeric Data String: One or more trailing spaces before newline.
EDID:
  Extension Block 1 started with EDID header, ignoring Extension Blocks >= 1.

EDID conformity: FAIL
