edid-decode (hex):

00 ff ff ff ff ff ff 00 4c a3 4c 36 00 00 00 00
00 12 01 03 80 24 15 78 0a 85 d5 99 57 4f 8f 27
21 50 54 00 00 00 01 01 01 01 01 01 01 01 01 01
01 01 01 01 01 01 12 1b 56 70 50 00 0e 30 30 20
25 00 6d d6 10 00 00 19 00 00 00 0f 00 00 00 00
00 00 00 00 00 1e b4 02 74 00 00 00 00 fe 00 53
41 4d 53 55 4e 47 0a 20 20 20 20 20 00 00 00 fe
00 31 36 30 41 54 30 36 2d 48 30 31 0a 20 00 11

00 ff ff ff ff ff ff 00 4c a3 4c 36 00 00 00 00
00 12 01 03 80 24 15 78 0a 85 d5 99 57 4f 8f 27
21 50 54 00 00 00 01 01 01 01 01 01 01 01 01 01
01 01 01 01 01 01 12 1b 56 70 50 00 0e 30 30 20
25 00 6d d6 10 00 00 19 00 00 00 0f 00 00 00 00
00 00 00 00 00 1e b4 02 74 00 00 00 00 fe 00 53
41 4d 53 55 4e 47 0a 20 20 20 20 20 00 00 00 fe
00 31 36 30 41 54 30 36 2d 48 30 31 0a 20 00 11

----------------

Block 0, Base EDID:
  EDID Structure Version & Revision: 1.3
  Vendor & Product Identification:
    Manufacturer: SEC
    Model: 13900
    Made in: 2008
  Basic Display Parameters & Features:
    Digital display
    Maximum image size: 36 cm x 21 cm
    Gamma: 2.20
    RGB color display
    First detailed timing is the preferred timing
  Color Characteristics:
    Red  : 0.5996, 0.3398
    Green: 0.3095, 0.5595
    Blue : 0.1552, 0.1298
    White: 0.3134, 0.3291
  Established Timings I & II: none
  Standard Timings: none
  Detailed Timing Descriptors:
    DTD 1:  1366x768    59.958678 Hz 683:384   46.888 kHz     69.300000 MHz (365 mm x 214 mm)
                 Hfront   48 Hsync  32 Hback   32 Hpol N
                 Vfront    2 Vsync   5 Vback    7 Vpol N
    Manufacturer-Specified Display Descriptor (0x0f): 00 0f 00 00 00 00 00 00 00 00 00 1e b4 02 74 00 '..............t.'
    Alphanumeric Data String: 'SAMSUNG'
    Alphanumeric Data String: '160AT06-H01'
Checksum: 0x11

----------------

Failures:

Block 0, Base EDID:
  Missing Display Product Name.
  Missing Display Range Limits Descriptor.
EDID:
  Extension Block 1 started with EDID header, ignoring Extension Blocks >= 1.

EDID conformity: FAIL
