edid-decode (hex):

00 ff ff ff ff ff ff 00 4a 8b 47 bc 01 01 01 01
09 21 01 03 80 22 13 78 3e ee 91 a3 54 4c 99 26
0f 50 54 21 08 00 d1 c0 01 01 01 01 95 00 90 40
81 80 81 40 81 c0 2e 40 80 18 71 b0 2d 40 58 2c
25 00 5a c2 10 00 00 1e 00 00 00 fc 00 52 54 4b
20 46 48 44 20 48 44 52 20 0a 00 00 00 ff 00 64
65 6d 6f 73 65 74 2d 31 0a 20 30 20 00 00 00 fd
00 30 4b 54 54 13 01 0a 20 20 20 20 20 20 01 e2

02 03 26 f2 43 05 10 1f e2 00 d5 e3 05 c0 00 23
09 7f 07 83 01 00 00 67 03 0c 00 10 00 38 3c e6
06 05 01 62 62 00 02 3a 80 18 71 38 2d 40 58 2c
25 00 5a c2 10 00 00 9e 57 30 80 18 71 38 2d 40
58 2c 25 00 5a c2 10 00 00 ff 00 00 00 00 00 00
00 00 00 00 00 00 00 00 00 00 00 00 00 00 00 00
00 00 00 00 00 00 00 00 00 00 00 00 00 00 00 00
00 00 00 00 00 00 00 00 00 00 00 00 00 00 00 c1

00 ff ff ff ff ff ff 00 4a 8b 47 bc 01 01 01 01
09 21 01 03 80 22 13 78 3e ee 91 a3 54 4c 99 26
0f 50 54 21 08 00 d1 c0 01 01 01 01 95 00 90 40
81 80 81 40 81 c0 2e 40 80 18 71 b0 2d 40 58 2c
25 00 5a c2 10 00 00 1e 00 00 00 fc 00 52 54 4b
20 46 48 44 20 48 44 52 20 0a 00 00 00 ff 00 64
65 6d 6f 73 65 74 2d 31 0a 20 30 20 00 00 00 fd
00 30 4b 54 54 13 01 0a 20 20 20 20 20 20 01 e2

02 03 26 f2 43 05 10 1f e2 00 d5 e3 05 c0 00 23
09 7f 07 83 01 00 00 67 03 0c 00 10 00 38 3c e6
06 05 01 62 62 00 02 3a 80 18 71 38 2d 40 58 2c
25 00 5a c2 10 00 00 9e 57 30 80 18 71 38 2d 40
58 2c 25 00 5a c2 10 00 00 ff 00 00 00 00 00 00
00 00 00 00 00 00 00 00 00 00 00 00 00 00 00 00
00 00 00 00 00 00 00 00 00 00 00 00 00 00 00 00
00 00 00 00 00 00 00 00 00 00 00 00 00 00 00 c1

----------------

Block 0, Base EDID:
  EDID Structure Version & Revision: 1.3
  Vendor & Product Identification:
    Manufacturer: RTK
    Model: 48199
    Serial Number: ...
    Made in: week 9 of 2023
  Basic Display Parameters & Features:
    Digital display
    Maximum image size: 34 cm x 19 cm
    Gamma: 2.20
    DPMS levels: Off
    Undefined display color type
    Default (sRGB) color space is primary color space
    First detailed timing is the preferred timing
  Color Characteristics:
    Red  : 0.6396, 0.3300
    Green: 0.2998, 0.5996
    Blue : 0.1503, 0.0595
    White: 0.3125, 0.3291
  Established Timings I & II:
    DMT 0x04:   640x480    59.940476 Hz   4:3     31.469 kHz     25.175000 MHz
    DMT 0x09:   800x600    60.316541 Hz   4:3     37.879 kHz     40.000000 MHz
    DMT 0x10:  1024x768    60.003840 Hz   4:3     48.363 kHz     65.000000 MHz
  Standard Timings:
    DMT 0x52:  1920x1080   60.000000 Hz  16:9     67.500 kHz    148.500000 MHz
    DMT 0x2f:  1440x900    59.887445 Hz  16:10    55.935 kHz    106.500000 MHz
    DMT 0x2a:  1400x1050   59.978442 Hz   4:3     65.317 kHz    121.750000 MHz
    DMT 0x23:  1280x1024   60.019740 Hz   5:4     63.981 kHz    108.000000 MHz
    DMT 0x20:  1280x960    60.000000 Hz   4:3     60.000 kHz    108.000000 MHz
    DMT 0x55:  1280x720    60.000000 Hz  16:9     45.000 kHz     74.250000 MHz
  Detailed Timing Descriptors:
    DTD 1:  1920x1200   59.985396 Hz  16:10    74.682 kHz    164.300000 MHz (346 mm x 194 mm)
                 Hfront   88 Hsync  44 Hback  148 Hpol P
                 Vfront    2 Vsync   5 Vback   38 Vpol P
    Display Product Name: 'RTK FHD HDR '
    Display Product Serial Number: ...
    Display Range Limits:
      Monitor ranges (Range Limits Only): 48-75 Hz V, 84-84 kHz H, max dotclock 190 MHz
  Extension blocks: 1
Checksum: 0xe2

----------------

Block 1, CTA-861 Extension Block:
  Revision: 3
  Underscans IT Video Formats by default
  Basic audio support
  Supports YCbCr 4:4:4
  Supports YCbCr 4:2:2
  Native DTDs: 2
  Video Data Block:
    VIC   5:  1920x1080i  60.000000 Hz  16:9     33.750 kHz     74.250000 MHz
    VIC  16:  1920x1080   60.000000 Hz  16:9     67.500 kHz    148.500000 MHz
    VIC  31:  1920x1080   50.000000 Hz  16:9     56.250 kHz    148.500000 MHz
  Video Capability Data Block:
    YCbCr quantization: Selectable (via AVI YQ)
    RGB quantization: Selectable (via AVI Q)
    PT scan behavior: Always Overscanned
    IT scan behavior: Always Overscanned
    CE scan behavior: Always Overscanned
  Colorimetry Data Block:
    BT2020YCC
    BT2020RGB
  Audio Data Block:
    Linear PCM:
      Max channels: 2
      Supported sample rates (kHz): 192 176.4 96 88.2 48 44.1 32
      Supported sample sizes (bits): 24 20 16
  Speaker Allocation Data Block:
    FL/FR - Front Left/Right
  Vendor-Specific Data Block (HDMI), OUI 00-0C-03:
    Source physical address: 1.0.0.0
    DC_36bit
    DC_30bit
    DC_Y444
    Maximum TMDS clock: 300 MHz
  HDR Static Metadata Data Block:
    Electro optical transfer functions:
      Traditional gamma - SDR luminance range
      SMPTE ST2084
    Supported static metadata descriptors:
      Static metadata type 1
    Desired content max luminance: 98 (417.710 cd/m^2)
    Desired content max frame-average luminance: 98 (417.710 cd/m^2)
    Desired content min luminance: 0 (0.000 cd/m^2)
  Detailed Timing Descriptors:
    DTD 2:  1920x2160i  59.973345 Hz   8:9     67.500 kHz    148.500000 MHz (346 mm x 194 mm)
                 Hfront   88 Hsync  44 Hback  148 Hpol P
                 Vfront    2 Vsync   5 Vback   38 Vpol P Vfront +0.5 Odd Field
                 Vfront    2 Vsync   5 Vback   38 Vpol P Vback  +0.5 Even Field
    DTD 3:  1920x2160i  49.977788 Hz   8:9     56.250 kHz    123.750000 MHz (side by side interleaved, 346 mm x 194 mm)
                 Hfront   88 Hsync  44 Hback  148 Hpol P
                 Vfront    2 Vsync   5 Vback   38 Vpol P Vfront +0.5 Odd Field
                 Vfront    2 Vsync   5 Vback   38 Vpol P Vback  +0.5 Even Field
Checksum: 0xc1  Unused space in Extension Block: 53 bytes

----------------

Warnings:

Block 0, Base EDID:
  Vendor & Product Identification: The serial number is one of the known dummy values, it should probably be set to 0.
  Detailed Timing Descriptor #1: Image size is 346x194 mm, but based on the picture AR it should be 310x194 mm.
  Display Product Serial Number: ...
Block 1, CTA-861 Extension Block:
  Video Data Block: VIC 5 and the first DTD are not identical. Is this intended?
  Video Capability Data Block: IT scan behavior is expected to support underscanned.
  Video Capability Data Block: S_PT is equal to S_IT and S_CE, so should be set to 0 instead.
  Detailed Timing Descriptor #2: Image size is 346x194 mm, but based on the picture AR it should be 172x194 mm.
  Detailed Timing Descriptor #3: Image size is 346x194 mm, but based on the picture AR it should be 172x194 mm.
  Display Product Serial Number is set, so the Serial Number in the Base EDID should be 0.
EDID:
  Base EDID: Some timings are out of range of the Monitor Ranges:
    Horizontal Freq: 31.468 - 74.681 kHz (Monitor: 84.000 - 84.000 kHz)

Failures:

Block 0, Base EDID:
  Display Product Serial Number: ...
  Display Product Name: One or more trailing spaces before newline.
  Display Range Limits: 'Range Limits Only' is not allowed for EDID < 1.4.
Block 1, CTA-861 Extension Block:
  Video Capability Data Block: IT video formats are always overscanned, but bit 7 of Byte 3 of the CTA-861 Extension header is set to underscanned.
EDID:
  Extension Block 2 started with EDID header, ignoring Extension Blocks >= 2.

EDID conformity: FAIL
