edid-decode (hex):

00 ff ff ff ff ff ff 00 15 8f 67 14 f7 0e 00 00
01 19 01 03 80 1e 17 78 2a d8 05 9a 5b 56 97 26
19 50 54 bf ee 00 61 45 01 01 01 01 01 01 01 01
01 01 01 01 01 01 64 19 00 40 41 00 26 30 18 88
36 00 30 e4 10 00 00 18 00 00 00 fc 00 45 54 31
35 33 37 4c 2d 38 43 57 41 0a 00 00 00 fd 00 37
4c 1e 3d 08 00 00 00 00 00 00 00 00 00 00 00 10
00 0a 20 20 20 20 20 20 20 20 20 20 20 20 00 8c

00 ff ff ff ff ff ff 00 15 8f 67 14 f7 0e 00 00
01 19 01 03 80 1e 17 78 2a d8 05 9a 5b 56 97 26
19 50 54 bf ee 00 61 45 01 01 01 01 01 01 01 01
01 01 01 01 01 01 64 19 00 40 41 00 26 30 18 88
36 00 30 e4 10 00 00 18 00 00 00 fc 00 45 54 31
35 33 37 4c 2d 38 43 57 41 0a 00 00 00 fd 00 37
4c 1e 3d 08 00 00 00 00 00 00 00 00 00 00 00 10
00 0a 20 20 20 20 20 20 20 20 20 20 20 20 00 8c

----------------

Block 0, Base EDID:
  EDID Structure Version & Revision: 1.3
  Vendor & Product Identification:
    Manufacturer: ELO
    Model: 5223
    Serial Number: ...
    Made in: week 1 of 2015
  Basic Display Parameters & Features:
    Digital display
    Maximum image size: 30 cm x 23 cm
    Gamma: 2.20
    DPMS levels: Off
    RGB color display
    First detailed timing is the preferred timing
  Color Characteristics:
    Red  : 0.6044, 0.3564
    Green: 0.3378, 0.5898
    Blue : 0.1484, 0.0976
    White: 0.3134, 0.3291
  Established Timings I & II:
    IBM     :   720x400    70.081663 Hz   9:5     31.467 kHz     28.320000 MHz
    DMT 0x04:   640x480    59.940476 Hz   4:3     31.469 kHz     25.175000 MHz
    Apple   :   640x480    66.666667 Hz   4:3     35.000 kHz     30.240000 MHz
    DMT 0x05:   640x480    72.808802 Hz   4:3     37.861 kHz     31.500000 MHz
    DMT 0x06:   640x480    75.000000 Hz   4:3     37.500 kHz     31.500000 MHz
    DMT 0x08:   800x600    56.250000 Hz   4:3     35.156 kHz     36.000000 MHz
    DMT 0x09:   800x600    60.316541 Hz   4:3     37.879 kHz     40.000000 MHz
    DMT 0x0a:   800x600    72.187572 Hz   4:3     48.077 kHz     50.000000 MHz
    DMT 0x0b:   800x600    75.000000 Hz   4:3     46.875 kHz     49.500000 MHz
    Apple   :   832x624    74.551266 Hz   4:3     49.726 kHz     57.284000 MHz
    DMT 0x10:  1024x768    60.003840 Hz   4:3     48.363 kHz     65.000000 MHz
    DMT 0x11:  1024x768    70.069359 Hz   4:3     56.476 kHz     75.000000 MHz
    DMT 0x12:  1024x768    75.028582 Hz   4:3     60.023 kHz     78.750000 MHz
  Standard Timings:
    GTF     :  1024x768    64.999739 Hz   4:3     51.870 kHz     69.713000 MHz
  Detailed Timing Descriptors:
    DTD 1:  1024x768    60.003840 Hz   4:3     48.363 kHz     65.000000 MHz (304 mm x 228 mm)
                 Hfront   24 Hsync 136 Hback  160 Hpol N
                 Vfront    3 Vsync   6 Vback   29 Vpol N
    Display Product Name: 'ET1537L-8CWA'
    Display Range Limits:
      Monitor ranges (GTF): 55-76 Hz V, 30-61 kHz H, max dotclock 80 MHz
    Dummy Descriptor:
Checksum: 0x8c

----------------

Failures:

Block 0, Base EDID:
  Display Range Limits: Byte 11 is 0x00 instead of 0x0a.
  Display Range Limits: Bytes 12-17 must be 0x20.
  Dummy Descriptor: Dummy block filled with garbage.
EDID:
  Extension Block 1 started with EDID header, ignoring Extension Blocks >= 1.

EDID conformity: FAIL
