edid-decode (hex):

00 ff ff ff ff ff ff 00 1d ae 85 0d 00 00 00 00
0b 21 01 03 80 50 22 78 2b 2e a5 ad 4f 46 a5 25
12 50 54 a5 4b 00 71 4f 81 c0 81 40 81 80 95 00
a9 c0 b3 00 d1 c0 4d 7d 70 a0 d0 a0 2d 50 30 20
35 00 1d 4e 31 00 00 1a 6b 68 70 a0 d0 a0 2d 50
30 20 35 00 1d 4e 31 00 00 1a 00 00 00 fd 00 30
64 a0 a0 3c 00 0a 20 20 20 20 20 20 00 00 00 fc
00 47 4d 2d 33 34 43 31 31 57 0a 20 20 20 01 eb

02 03 3e f1 4a 01 02 03 04 05 90 11 12 13 1f 23
09 07 07 83 01 00 00 6a 03 0c 00 10 00 38 42 20
00 00 67 d8 5d c4 01 78 80 03 68 1a 00 00 01 01
30 64 ed e3 05 e3 01 e6 06 07 01 65 65 0d d5 d0
70 a0 d0 a0 2d 50 58 40 45 00 1d 4e 31 00 00 1e
69 5e 00 a0 a0 a0 29 50 30 20 35 00 1d 4e 31 00
00 1a 9c 45 b8 18 61 a0 2d 50 30 20 35 00 9e 83
31 00 00 1a 00 00 00 00 00 00 00 00 00 00 00 01

00 ff ff ff ff ff ff 00 1d ae 85 0d 00 00 00 00
0b 21 01 03 80 50 22 78 2b 2e a5 ad 4f 46 a5 25
12 50 54 a5 4b 00 71 4f 81 c0 81 40 81 80 95 00
a9 c0 b3 00 d1 c0 4d 7d 70 a0 d0 a0 2d 50 30 20
35 00 1d 4e 31 00 00 1a 6b 68 70 a0 d0 a0 2d 50
30 20 35 00 1d 4e 31 00 00 1a 00 00 00 fd 00 30
64 a0 a0 3c 00 0a 20 20 20 20 20 20 00 00 00 fc
00 47 4d 2d 33 34 43 31 31 57 0a 20 20 20 01 eb

02 03 3e f1 4a 01 02 03 04 05 90 11 12 13 1f 23
09 07 07 83 01 00 00 6a 03 0c 00 10 00 38 42 20
00 00 67 d8 5d c4 01 78 80 03 68 1a 00 00 01 01
30 64 ed e3 05 e3 01 e6 06 07 01 65 65 0d d5 d0
70 a0 d0 a0 2d 50 58 40 45 00 1d 4e 31 00 00 1e
69 5e 00 a0 a0 a0 29 50 30 20 35 00 1d 4e 31 00
00 1a 9c 45 b8 18 61 a0 2d 50 30 20 35 00 9e 83
31 00 00 1a 00 00 00 00 00 00 00 00 00 00 00 01

----------------

Block 0, Base EDID:
  EDID Structure Version & Revision: 1.3
  Vendor & Product Identification:
    Manufacturer: GMN
    Model: 3461
    Made in: week 11 of 2023
  Basic Display Parameters & Features:
    Digital display
    Maximum image size: 80 cm x 34 cm
    Gamma: 2.20
    DPMS levels: Off
    RGB color display
    First detailed timing is the preferred timing
    Supports GTF timings within operating range
  Color Characteristics:
    Red  : 0.6757, 0.3105
    Green: 0.2763, 0.6464
    Blue : 0.1464, 0.0722
    White: 0.3134, 0.3291
  Established Timings I & II:
    IBM     :   720x400    70.081663 Hz   9:5     31.467 kHz     28.320000 MHz
    DMT 0x04:   640x480    59.940476 Hz   4:3     31.469 kHz     25.175000 MHz
    DMT 0x06:   640x480    75.000000 Hz   4:3     37.500 kHz     31.500000 MHz
    DMT 0x09:   800x600    60.316541 Hz   4:3     37.879 kHz     40.000000 MHz
    DMT 0x0b:   800x600    75.000000 Hz   4:3     46.875 kHz     49.500000 MHz
    DMT 0x10:  1024x768    60.003840 Hz   4:3     48.363 kHz     65.000000 MHz
    DMT 0x12:  1024x768    75.028582 Hz   4:3     60.023 kHz     78.750000 MHz
    DMT 0x24:  1280x1024   75.024675 Hz   5:4     79.976 kHz    135.000000 MHz
  Standard Timings:
    DMT 0x15:  1152x864    75.000000 Hz   4:3     67.500 kHz    108.000000 MHz
    DMT 0x55:  1280x720    60.000000 Hz  16:9     45.000 kHz     74.250000 MHz
    DMT 0x20:  1280x960    60.000000 Hz   4:3     60.000 kHz    108.000000 MHz
    DMT 0x23:  1280x1024   60.019740 Hz   5:4     63.981 kHz    108.000000 MHz
    DMT 0x2f:  1440x900    59.887445 Hz  16:10    55.935 kHz    106.500000 MHz
    DMT 0x53:  1600x900    60.000000 Hz  16:9     60.000 kHz    108.000000 MHz (RB)
    DMT 0x3a:  1680x1050   59.954250 Hz  16:10    65.290 kHz    146.250000 MHz
    DMT 0x52:  1920x1080   60.000000 Hz  16:9     67.500 kHz    148.500000 MHz
  Detailed Timing Descriptors:
    DTD 1:  3440x1440   60.001871 Hz  43:18    89.103 kHz    320.770000 MHz (797 mm x 334 mm)
                 Hfront   48 Hsync  32 Hback   80 Hpol P
                 Vfront    3 Vsync   5 Vback   37 Vpol N
    DTD 2:  3440x1440   50.001871 Hz  43:18    74.253 kHz    267.310000 MHz (797 mm x 334 mm)
                 Hfront   48 Hsync  32 Hback   80 Hpol P
                 Vfront    3 Vsync   5 Vback   37 Vpol N
    Display Range Limits:
      Monitor ranges (GTF): 48-100 Hz V, 160-160 kHz H, max dotclock 600 MHz
    Display Product Name: 'GM-34C11W'
  Extension blocks: 1
Checksum: 0xeb

----------------

Block 1, CTA-861 Extension Block:
  Revision: 3
  Underscans IT Video Formats by default
  Basic audio support
  Supports YCbCr 4:4:4
  Supports YCbCr 4:2:2
  Native DTDs: 1
  Video Data Block:
    VIC   1:   640x480    59.940476 Hz   4:3     31.469 kHz     25.175000 MHz
    VIC   2:   720x480    59.940060 Hz   4:3     31.469 kHz     27.000000 MHz
    VIC   3:   720x480    59.940060 Hz  16:9     31.469 kHz     27.000000 MHz
    VIC   4:  1280x720    60.000000 Hz  16:9     45.000 kHz     74.250000 MHz
    VIC   5:  1920x1080i  60.000000 Hz  16:9     33.750 kHz     74.250000 MHz
    VIC  16:  1920x1080   60.000000 Hz  16:9     67.500 kHz    148.500000 MHz (native)
    VIC  17:   720x576    50.000000 Hz   4:3     31.250 kHz     27.000000 MHz
    VIC  18:   720x576    50.000000 Hz  16:9     31.250 kHz     27.000000 MHz
    VIC  19:  1280x720    50.000000 Hz  16:9     37.500 kHz     74.250000 MHz
    VIC  31:  1920x1080   50.000000 Hz  16:9     56.250 kHz    148.500000 MHz
  Audio Data Block:
    Linear PCM:
      Max channels: 2
      Supported sample rates (kHz): 48 44.1 32
      Supported sample sizes (bits): 24 20 16
  Speaker Allocation Data Block:
    FL/FR - Front Left/Right
  Vendor-Specific Data Block (HDMI), OUI 00-0C-03:
    Source physical address: 1.0.0.0
    DC_36bit
    DC_30bit
    DC_Y444
    Maximum TMDS clock: 330 MHz
    Extended HDMI video details:
  Vendor-Specific Data Block (HDMI Forum), OUI C4-5D-D8:
    Version: 1
    Maximum TMDS Character Rate: 600 MHz
    SCDC Present
    Supports 12-bits/component Deep Color 4:2:0 Pixel Encoding
    Supports 10-bits/component Deep Color 4:2:0 Pixel Encoding
  Vendor-Specific Data Block (AMD), OUI 00-00-1A:
    Version: 1
    Flags 1: 0x01
      FreeSync Supported
    Minimum Refresh Rate: 48 Hz
    Maximum Refresh Rate: 100 Hz
    MCCS VCP Code: 0xed
  Colorimetry Data Block:
    xvYCC601
    xvYCC709
    BT2020cYCC
    BT2020YCC
    BT2020RGB
    Gamut Boundary Description Metadata Profile P0
  HDR Static Metadata Data Block:
    Electro optical transfer functions:
      Traditional gamma - SDR luminance range
      Traditional gamma - HDR luminance range
      SMPTE ST2084
    Supported static metadata descriptors:
      Static metadata type 1
    Desired content max luminance: 101 (445.755 cd/m^2)
    Desired content max frame-average luminance: 101 (445.755 cd/m^2)
    Desired content min luminance: 13 (0.012 cd/m^2)
  Detailed Timing Descriptors:
    DTD 3:  3440x1440  100.001871 Hz  43:18   148.503 kHz    534.610000 MHz (797 mm x 334 mm)
                 Hfront   88 Hsync  64 Hback    8 Hpol P
                 Vfront    4 Vsync   5 Vback   36 Vpol P
    DTD 4:  2560x1440   59.997716 Hz  16:9     88.857 kHz    241.690000 MHz (797 mm x 334 mm)
                 Hfront   48 Hsync  32 Hback   80 Hpol P
                 Vfront    3 Vsync   5 Vback   33 Vpol N
    DTD 5:  1720x1440   60.000000 Hz  43:36    89.100 kHz    178.200000 MHz (926 mm x 387 mm)
                 Hfront   48 Hsync  32 Hback  200 Hpol P
                 Vfront    3 Vsync   5 Vback   37 Vpol N
Checksum: 0x01  Unused space in Extension Block: 11 bytes

----------------

Warnings:

Block 1, CTA-861 Extension Block:
  Video Data Block: VIC 1 and the first DTD are not identical. Is this intended?
  Video Data Block: All VICs are in ascending order, and the first (preferred) VIC <= 4, is that intended?
  Colorimetry Data Block: Set the sRGB colorimetry bit to avoid interop issues.
  Detailed Timing Descriptor #4: Image size is 797x334 mm, but based on the picture AR it should be 593x334 mm.
  Detailed Timing Descriptor #5: Image size is 926x387 mm, but based on the picture AR it should be 462x387 mm.
EDID:
  Base EDID: Some timings are out of range of the Monitor Ranges:
    Horizontal Freq: 31.250 - 148.502 kHz (Monitor: 160.000 - 160.000 kHz)

Failures:

Block 1, CTA-861 Extension Block:
  Detailed Timing Descriptor #5: Mismatch of image size 926x387 mm vs display size 800x340 mm.
  Missing VCDB, needed for Set Selectable RGB Quantization to avoid interop issues.
EDID:
  Extension Block 2 started with EDID header, ignoring Extension Blocks >= 2.
  Base EDID: The DTD max image size is 926x387mm, which is larger than the display size 800.0x340.0mm.
  CTA-861: Native progressive timings are a mix of several resolutions.

EDID conformity: FAIL
