edid-decode (hex):

00 ff ff ff ff ff ff 00 15 c3 46 21 01 01 01 01
18 14 01 04 b5 2c 21 78 e2 e6 9b a3 54 4a 99 26
0f 4c 50 a1 08 00 a9 40 81 80 81 40 01 01 01 01
01 01 01 01 01 01 48 3f 40 30 62 b0 32 40 40 c0
13 00 b0 44 11 00 00 1e 00 00 00 ff 00 32 33 34
33 31 30 36 30 0a 20 20 20 20 00 00 00 fd 00 3b
3d 1f 64 11 00 0a 20 20 20 20 20 20 00 00 00 fc
00 52 58 32 32 30 0a 20 20 20 20 20 20 20 00 e8

00 ff ff ff ff ff ff 00 15 c3 46 21 01 01 01 01
18 14 01 04 b5 2c 21 78 e2 e6 9b a3 54 4a 99 26
0f 4c 50 a1 08 00 a9 40 81 80 81 40 01 01 01 01
01 01 01 01 01 01 48 3f 40 30 62 b0 32 40 40 c0
13 00 b0 44 11 00 00 1e 00 00 00 ff 00 32 33 34
33 31 30 36 30 0a 20 20 20 20 00 00 00 fd 00 3b
3d 1f 64 11 00 0a 20 20 20 20 20 20 00 00 00 fc
00 52 58 32 32 30 0a 20 20 20 20 20 20 20 00 e8

----------------

Block 0, Base EDID:
  EDID Structure Version & Revision: 1.4
  Vendor & Product Identification:
    Manufacturer: ENC
    Model: 8518
    Serial Number: ...
    Made in: week 24 of 2010
  Basic Display Parameters & Features:
    Digital display
    Bits per primary color channel: 10
    DisplayPort interface
    Maximum image size: 44 cm x 33 cm
    Gamma: 2.20
    DPMS levels: Standby Suspend Off
    Supported color formats: RGB 4:4:4
    First detailed timing includes the native pixel format and preferred refresh rate
  Color Characteristics:
    Red  : 0.6396, 0.3300
    Green: 0.2900, 0.5996
    Blue : 0.1503, 0.0595
    White: 0.2988, 0.3154
  Established Timings I & II:
    IBM     :   720x400    70.081663 Hz   9:5     31.467 kHz     28.320000 MHz
    DMT 0x04:   640x480    59.940476 Hz   4:3     31.469 kHz     25.175000 MHz
    DMT 0x09:   800x600    60.316541 Hz   4:3     37.879 kHz     40.000000 MHz
    DMT 0x10:  1024x768    60.003840 Hz   4:3     48.363 kHz     65.000000 MHz
  Standard Timings:
    DMT 0x33:  1600x1200   60.000000 Hz   4:3     75.000 kHz    162.000000 MHz
    DMT 0x23:  1280x1024   60.019740 Hz   5:4     63.981 kHz    108.000000 MHz
    DMT 0x20:  1280x960    60.000000 Hz   4:3     60.000 kHz    108.000000 MHz
  Detailed Timing Descriptors:
    DTD 1:  1600x1200   60.000000 Hz   4:3     75.000 kHz    162.000000 MHz (432 mm x 324 mm)
                 Hfront   64 Hsync 192 Hback  304 Hpol P
                 Vfront    1 Vsync   3 Vback   46 Vpol P
    Display Product Serial Number: ...
    Display Range Limits:
      Monitor ranges (GTF): 59-61 Hz V, 31-100 kHz H, max dotclock 170 MHz
    Display Product Name: 'RX220'
Checksum: 0xe8

----------------

Block 1, Unknown EDID Extension Block 0x00:
  00 ff ff ff ff ff ff 00 15 c3 46 21 01 01 01 01 '..........F!....'
  18 14 01 04 b5 2c 21 78 e2 e6 9b a3 54 4a 99 26 '.....,!x....TJ.&'
  0f 4c 50 a1 08 00 a9 40 81 80 81 40 01 01 01 01 '.LP....@...@....'
  01 01 01 01 01 01 48 3f 40 30 62 b0 32 40 40 c0 '......H?@0b.2@@.'
  13 00 b0 44 11 00 00 1e 00 00 00 ff 00 32 33 34 '...D.........234'
  33 31 30 36 30 0a 20 20 20 20 00 00 00 fd 00 3b '31060.    .....;'
  3d 1f 64 11 00 0a 20 20 20 20 20 20 00 00 00 fc '=.d...      ....'
  00 52 58 32 32 30 0a 20 20 20 20 20 20 20 00 e8 '.RX220.       ..'
Checksum: 0xe8

----------------

Warnings:

Block 0, Base EDID:
  Vendor & Product Identification: The serial number is one of the known dummy values, it should probably be set to 0.
  Display Range Limits: GTF support is deprecated in EDID 1.4.
EDID:
  Base EDID: Some timings are out of range of the Monitor Ranges:
    Vertical Freq: 59.940 - 70.082 Hz (Monitor: 59.000 - 61.000 Hz)

Failures:

Block 0, Base EDID:
  Display Range Limits: GTF is supported, but the display does not support continuous frequencies.
Block 1, Base EDID:
  Unknown Extension Block.
EDID:
  Base EDID: EDID specified 0 extension block(s), but found 1 extension block(s).

EDID conformity: FAIL
