edid-decode (hex):

00 ff ff ff ff ff ff 00 0d ae 45 15 00 00 00 00
14 1f 01 04 a5 22 13 78 03 ee 95 a3 54 4c 99 26
0f 50 54 00 00 00 01 01 01 01 01 01 01 01 01 01
01 01 01 01 01 01 9e 85 80 a0 70 38 3e 40 30 20
a5 00 58 c1 10 00 00 18 ad 37 80 a0 70 38 3e 40
30 20 a5 00 58 c1 10 00 00 18 00 00 00 fd 00 30
90 a5 a5 22 01 0a 20 20 20 20 20 20 00 00 00 fe
00 4e 31 35 36 48 4d 41 2d 47 41 31 0a 20 00 5b

00 ff ff ff ff ff ff 00 0d ae 45 15 00 00 00 00
14 1f 01 04 a5 22 13 78 03 ee 95 a3 54 4c 99 26
0f 50 54 00 00 00 01 01 01 01 01 01 01 01 01 01
01 01 01 01 01 01 9e 85 80 a0 70 38 3e 40 30 20
a5 00 58 c1 10 00 00 18 ad 37 80 a0 70 38 3e 40
30 20 a5 00 58 c1 10 00 00 18 00 00 00 fd 00 30
90 a5 a5 22 01 0a 20 20 20 20 20 20 00 00 00 fe
00 4e 31 35 36 48 4d 41 2d 47 41 31 0a 20 00 5b

----------------

Block 0, Base EDID:
  EDID Structure Version & Revision: 1.4
  Vendor & Product Identification:
    Manufacturer: CMN
    Model: 5445
    Made in: week 20 of 2021
  Basic Display Parameters & Features:
    Digital display
    Bits per primary color channel: 8
    DisplayPort interface
    Maximum image size: 34 cm x 19 cm
    Gamma: 2.20
    Supported color formats: RGB 4:4:4
    First detailed timing includes the native pixel format and preferred refresh rate
    Display supports continuous frequencies
  Color Characteristics:
    Red  : 0.6396, 0.3300
    Green: 0.2998, 0.5996
    Blue : 0.1503, 0.0595
    White: 0.3134, 0.3291
  Established Timings I & II: none
  Standard Timings: none
  Detailed Timing Descriptors:
    DTD 1:  1920x1080  144.003435 Hz  16:9    164.452 kHz    342.060000 MHz (344 mm x 193 mm)
                 Hfront   48 Hsync  32 Hback   80 Hpol N
                 Vfront   10 Vsync   5 Vback   47 Vpol N
    DTD 2:  1920x1080   60.003536 Hz  16:9     68.524 kHz    142.530000 MHz (344 mm x 193 mm)
                 Hfront   48 Hsync  32 Hback   80 Hpol N
                 Vfront   10 Vsync   5 Vback   47 Vpol N
    Display Range Limits:
      Monitor ranges (Range Limits Only): 48-144 Hz V, 165-165 kHz H, max dotclock 340 MHz
    Alphanumeric Data String: 'N156HMA-GA1'
Checksum: 0x5b

----------------

Warnings:

Block 0, Base EDID:
  Missing Display Product Name.
EDID:
  Base EDID: Some timings are out of range of the Monitor Ranges:
    Horizontal Freq: 68.524 - 164.451 kHz (Monitor: 165.000 - 165.000 kHz)
    Maximum Clock: 342.060 MHz (Monitor: 340.000 MHz)

Failures:

EDID:
  Extension Block 1 started with EDID header, ignoring Extension Blocks >= 1.

EDID conformity: FAIL
