edid-decode (hex):

00 ff ff ff ff ff ff 00 30 ae b5 41 00 00 00 00
0f 1f 01 04 a5 22 16 78 e3 37 55 96 5d 58 92 29
20 50 54 00 00 00 01 01 01 01 01 01 01 01 01 01
01 01 01 01 01 01 33 3f 80 dc 70 b0 3c 40 30 20
36 00 59 d7 10 00 00 1a 00 00 00 fd 00 28 3c 4c
4c 10 01 0a 20 20 20 20 20 20 00 00 00 0f 00 d1
0a 3c d1 0a 28 1e 0a 00 09 e5 31 0a 00 00 00 fe
00 4e 56 31 36 30 57 55 4d 2d 4e 34 33 0a 01 aa

00 ff ff ff ff ff ff 00 30 ae b5 41 00 00 00 00
1b 1f 01 04 a5 22 16 78 e3 64 f5 a6 55 4a 99 23
10 50 54 00 00 00 01 01 01 01 01 01 01 01 01 01
01 01 01 01 01 01 33 3f 80 dc 70 b0 3c 40 30 20
36 00 59 d7 10 00 00 1a 00 00 00 fd 00 28 3c 4c
4c 10 01 0a 20 20 20 20 20 20 00 00 00 0f 00 d1
0a 3c d1 0a 28 1e 0e 00 09 e5 7d 0a 00 00 00 fe
00 4e 45 31 36 30 57 55 4d 2d 4e 36 34 0a 00 a5

00 ff ff ff ff ff ff 00 30 ae b5 41 00 00 00 00
0f 1f 01 04 a5 22 16 78 e3 37 55 96 5d 58 92 29
20 50 54 00 00 00 01 01 01 01 01 01 01 01 01 01
01 01 01 01 01 01 33 3f 80 dc 70 b0 3c 40 30 20
36 00 59 d7 10 00 00 1a 00 00 00 fd 00 28 3c 4c
4c 10 01 0a 20 20 20 20 20 20 00 00 00 0f 00 d1
0a 3c d1 0a 28 1e 0a 00 09 e5 31 0a 00 00 00 fe
00 4e 56 31 36 30 57 55 4d 2d 4e 34 33 0a 01 aa

00 ff ff ff ff ff ff 00 30 ae b5 41 00 00 00 00
1b 1f 01 04 a5 22 16 78 e3 64 f5 a6 55 4a 99 23
10 50 54 00 00 00 01 01 01 01 01 01 01 01 01 01
01 01 01 01 01 01 33 3f 80 dc 70 b0 3c 40 30 20
36 00 59 d7 10 00 00 1a 00 00 00 fd 00 28 3c 4c
4c 10 01 0a 20 20 20 20 20 20 00 00 00 0f 00 d1
0a 3c d1 0a 28 1e 0e 00 09 e5 7d 0a 00 00 00 fe
00 4e 45 31 36 30 57 55 4d 2d 4e 36 34 0a 00 a5

----------------

Block 0, Base EDID:
  EDID Structure Version & Revision: 1.4
  Vendor & Product Identification:
    Manufacturer: LEN
    Model: 16821
    Made in: week 15 of 2021
  Basic Display Parameters & Features:
    Digital display
    Bits per primary color channel: 8
    DisplayPort interface
    Maximum image size: 34 cm x 22 cm
    Gamma: 2.20
    DPMS levels: Standby Suspend Off
    Supported color formats: RGB 4:4:4
    First detailed timing includes the native pixel format and preferred refresh rate
    Display supports continuous frequencies
  Color Characteristics:
    Red  : 0.5859, 0.3662
    Green: 0.3447, 0.5732
    Blue : 0.1611, 0.1259
    White: 0.3134, 0.3291
  Established Timings I & II: none
  Standard Timings: none
  Detailed Timing Descriptors:
    DTD 1:  1920x1200   60.002225 Hz  16:10    75.603 kHz    161.790000 MHz (345 mm x 215 mm)
                 Hfront   48 Hsync  32 Hback  140 Hpol P
                 Vfront    3 Vsync   6 Vback   51 Vpol N
    Display Range Limits:
      Monitor ranges (Range Limits Only): 40-60 Hz V, 76-76 kHz H, max dotclock 160 MHz
    Manufacturer-Specified Display Descriptor (0x0f): 00 0f 00 d1 0a 3c d1 0a 28 1e 0a 00 09 e5 31 0a '.....<..(.....1.'
    Alphanumeric Data String: 'NV160WUM-N43'
  Extension blocks: 1
Checksum: 0xaa

----------------

Warnings:

Block 0, Base EDID:
  Missing Display Product Name.
EDID:
  Base EDID: Some timings are out of range of the Monitor Ranges:
    Maximum Clock: 161.790 MHz (Monitor: 160.000 MHz)
    Could be due to a Monitor Range off-by-one rounding issue

Failures:

EDID:
  Extension Block 1 started with EDID header, ignoring Extension Blocks >= 1.
  Base EDID: EDID specified 1 extension block(s), but found 0 extension block(s).

EDID conformity: FAIL
