edid-decode (hex):

00 ff ff ff ff ff ff 00 09 e5 ff 0c 00 00 00 00
14 22 01 04 a5 11 0b 78 07 1e db a7 57 4c 9e 24
0b 4c 50 00 00 00 01 01 01 01 01 01 01 01 01 01
01 01 01 01 01 01 3e 7b 80 a0 70 b0 40 40 30 20
66 0c ac 6c 00 00 00 1a 9f 3d 80 a0 70 b0 40 40
30 20 66 0c ac 6c 00 00 00 1a 00 00 00 fd 00 30
78 98 98 20 01 0a 20 20 20 20 20 20 00 00 00 fc
00 4e 53 30 38 30 57 55 4d 2d 4c 58 31 0a 01 de

70 20 79 02 00 25 00 09 66 d0 04 66 d0 04 30 78
80 81 00 15 74 1a 00 00 03 01 30 78 00 00 6a 4a
6a 4a 78 00 00 00 00 80 00 2b 00 0c 27 00 30 78
00 00 27 00 30 3c 00 00 00 00 00 00 00 00 00 00
00 00 00 00 00 00 00 00 00 00 00 00 00 00 00 00
00 00 00 00 00 00 00 00 00 00 00 00 00 00 00 00
00 00 00 00 00 00 00 00 00 00 00 00 00 00 00 00
00 00 00 00 00 00 00 00 00 00 00 00 00 00 d2 90

00 ff ff ff ff ff ff 00 09 e5 ff 0c 00 00 00 00
14 22 01 04 a5 11 0b 78 07 1e db a7 57 4c 9e 24
0b 4c 50 00 00 00 01 01 01 01 01 01 01 01 01 01
01 01 01 01 01 01 3e 7b 80 a0 70 b0 40 40 30 20
66 0c ac 6c 00 00 00 1a 9f 3d 80 a0 70 b0 40 40
30 20 66 0c ac 6c 00 00 00 1a 00 00 00 fd 00 30
78 98 98 20 01 0a 20 20 20 20 20 20 00 00 00 fc
00 4e 53 30 38 30 57 55 4d 2d 4c 58 31 0a 01 de

70 20 79 02 00 25 00 09 66 d0 04 66 d0 04 30 78
80 81 00 15 74 1a 00 00 03 01 30 78 00 00 6a 4a
6a 4a 78 00 00 00 00 80 00 2b 00 0c 27 00 30 78
00 00 27 00 30 3c 00 00 00 00 00 00 00 00 00 00
00 00 00 00 00 00 00 00 00 00 00 00 00 00 00 00
00 00 00 00 00 00 00 00 00 00 00 00 00 00 00 00
00 00 00 00 00 00 00 00 00 00 00 00 00 00 00 00
00 00 00 00 00 00 00 00 00 00 00 00 00 00 d2 90

----------------

Block 0, Base EDID:
  EDID Structure Version & Revision: 1.4
  Vendor & Product Identification:
    Manufacturer: BOE
    Model: 3327
    Made in: week 20 of 2024
  Basic Display Parameters & Features:
    Digital display
    Bits per primary color channel: 8
    DisplayPort interface
    Maximum image size: 17 cm x 11 cm
    Gamma: 2.20
    Supported color formats: RGB 4:4:4
    Default (sRGB) color space is primary color space
    First detailed timing includes the native pixel format and preferred refresh rate
    Display supports continuous frequencies
  Color Characteristics:
    Red  : 0.6523, 0.3408
    Green: 0.2998, 0.6191
    Blue : 0.1435, 0.0439
    White: 0.2988, 0.3154
  Established Timings I & II: none
  Standard Timings: none
  Detailed Timing Descriptors:
    DTD 1:  1920x1200  120.002130 Hz  16:10   151.683 kHz    315.500000 MHz (172 mm x 108 mm)
                 Hfront   48 Hsync  32 Hback   80 Hpol P
                 Vfront   54 Vsync   6 Vback    4 Vpol N
    DTD 2:  1920x1200   60.001065 Hz  16:10    75.841 kHz    157.750000 MHz (172 mm x 108 mm)
                 Hfront   48 Hsync  32 Hback   80 Hpol P
                 Vfront   54 Vsync   6 Vback    4 Vpol N
    Display Range Limits:
      Monitor ranges (Range Limits Only): 48-120 Hz V, 152-152 kHz H, max dotclock 320 MHz
    Display Product Name: 'NS080WUM-LX1'
  Extension blocks: 1
Checksum: 0xde

----------------

Block 1, DisplayID Extension Block:
  Version: 2.0
  Extension Count: 0
  Display Product Primary Use Case: None of the listed primary use cases; generic display
  Dynamic Video Timing Range Limits Data Block:
    Minimum Pixel Clock: 315495 kHz
    Maximum Pixel Clock: 315495 kHz
    Minimum Vertical Refresh Rate: 48 Hz
    Maximum Vertical Refresh Rate: 120 Hz
    Seamless Dynamic Video Timing Support: Yes
  CTA-861 DisplayID Data Block:
  Vendor-Specific Data Block (AMD), OUI 00-00-1A:
    Version: 3
    Flags 1: 0x01
      FreeSync Supported
    Minimum Refresh Rate: 48 Hz
    Maximum Refresh Rate: 120 Hz
    Flags 5: 0x00
    Additional Sink Information Address: 0x403
  Adaptive Sync Data Block:
    Descriptor #1:
      Native Panel Range
      Fixed Average V-Total and Adaptive V-Total
      Supports Seamless Transition
      'Max Single Frame Duration Increase' field value without jitter impact
      'Max Single Frame Duration Decrease' field value without jitter impact
      Max Duration Increase: 0.00 ms
      Max Duration Decrease: 0.00 ms
      Min Refresh Rate: 48 Hz
      Max Refresh Rate: 121 Hz
    Descriptor #2:
      Native Panel Range
      Fixed Average V-Total and Adaptive V-Total
      Supports Seamless Transition
      'Max Single Frame Duration Increase' field value without jitter impact
      'Max Single Frame Duration Decrease' field value without jitter impact
      Max Duration Increase: 0.00 ms
      Max Duration Decrease: 0.00 ms
      Min Refresh Rate: 48 Hz
      Max Refresh Rate: 61 Hz
  Checksum: 0xd2
Checksum: 0x90

----------------

Warnings:

EDID:
  Base EDID: Some timings are out of range of the Monitor Ranges:
    Horizontal Freq: 75.841 - 151.682 kHz (Monitor: 152.000 - 152.000 kHz)

Failures:

Block 0, Base EDID:
  Basic Display Parameters & Features: sRGB is signaled, but the chromaticities do not match.
EDID:
  Extension Block 2 started with EDID header, ignoring Extension Blocks >= 2.
  DisplayID: Missing DisplayID Display Parameters Data Block.
  DisplayID: Missing DisplayID Type VII Detailed Timing Data Block.
  DisplayID: DisplayID expects at least one preferred timing.

EDID conformity: FAIL
