edid-decode (hex):

00 ff ff ff ff ff ff 00 1e 6d c0 5c b5 69 0f 00
1a 22 01 03 80 3c 22 78 2a da 85 ac 50 47 a7 26
0d 50 54 21 08 00 d1 c0 81 c0 45 68 61 40 01 01
01 01 01 01 01 01 56 5e 00 a0 a0 a0 29 50 30 20
35 00 55 50 21 00 00 1e 00 00 00 ff 00 35 30 33
54 46 42 57 31 4b 38 37 37 0a 00 00 00 fc 00 4c
47 20 49 50 53 20 51 48 44 0a 20 20 00 00 00 fd
00 30 64 1e 96 28 00 0a 20 20 20 20 20 20 01 7b

02 03 35 f1 4a 01 03 02 04 10 12 11 13 1f 22 23
09 07 07 83 01 00 00 67 03 0c 00 10 00 38 44 67
d8 5d c4 01 78 80 00 e3 05 c3 01 e6 06 05 01 4a
4a 25 e2 00 6a 02 3a 80 18 71 38 2d 40 58 2c 45
00 55 50 21 00 00 1e 5a a0 00 a0 a0 a0 46 50 30
20 35 00 55 50 21 00 00 1a 00 00 00 00 00 00 00
00 00 00 00 00 00 00 00 00 00 00 00 00 00 00 00
00 00 00 00 00 00 00 00 00 00 00 00 00 00 00 d2

00 ff ff ff ff ff ff 00 1e 6d c0 5c b5 69 0f 00
1a 22 01 03 80 3c 22 78 2a da 85 ac 50 47 a7 26
0d 50 54 21 08 00 d1 c0 81 c0 45 68 61 40 01 01
01 01 01 01 01 01 56 5e 00 a0 a0 a0 29 50 30 20
35 00 55 50 21 00 00 1e 00 00 00 ff 00 35 30 33
54 46 42 57 31 4b 38 37 37 0a 00 00 00 fc 00 4c
47 20 49 50 53 20 51 48 44 0a 20 20 00 00 00 fd
00 30 64 1e 96 28 00 0a 20 20 20 20 20 20 01 7b

02 03 35 f1 4a 01 03 02 04 10 12 11 13 1f 22 23
09 07 07 83 01 00 00 67 03 0c 00 10 00 38 44 67
d8 5d c4 01 78 80 00 e3 05 c3 01 e6 06 05 01 4a
4a 25 e2 00 6a 02 3a 80 18 71 38 2d 40 58 2c 45
00 55 50 21 00 00 1e 5a a0 00 a0 a0 a0 46 50 30
20 35 00 55 50 21 00 00 1a 00 00 00 00 00 00 00
00 00 00 00 00 00 00 00 00 00 00 00 00 00 00 00
00 00 00 00 00 00 00 00 00 00 00 00 00 00 00 d2

----------------

Block 0, Base EDID:
  EDID Structure Version & Revision: 1.3
  Vendor & Product Identification:
    Manufacturer: GSM
    Model: 23744
    Serial Number: ...
    Made in: week 26 of 2024
  Basic Display Parameters & Features:
    Digital display
    Maximum image size: 60 cm x 34 cm
    Gamma: 2.20
    DPMS levels: Off
    RGB color display
    First detailed timing is the preferred timing
  Color Characteristics:
    Red  : 0.6748, 0.3134
    Green: 0.2792, 0.6542
    Blue : 0.1503, 0.0507
    White: 0.3134, 0.3291
  Established Timings I & II:
    DMT 0x04:   640x480    59.940476 Hz   4:3     31.469 kHz     25.175000 MHz
    DMT 0x09:   800x600    60.316541 Hz   4:3     37.879 kHz     40.000000 MHz
    DMT 0x10:  1024x768    60.003840 Hz   4:3     48.363 kHz     65.000000 MHz
  Standard Timings:
    DMT 0x52:  1920x1080   60.000000 Hz  16:9     67.500 kHz    148.500000 MHz
    DMT 0x55:  1280x720    60.000000 Hz  16:9     45.000 kHz     74.250000 MHz
    GTF     :   800x600    99.999707 Hz   4:3     63.600 kHz     68.179000 MHz
    DMT 0x10:  1024x768    60.003840 Hz   4:3     48.363 kHz     65.000000 MHz
  Detailed Timing Descriptors:
    DTD 1:  2560x1440   59.950550 Hz  16:9     88.787 kHz    241.500000 MHz (597 mm x 336 mm)
                 Hfront   48 Hsync  32 Hback   80 Hpol P
                 Vfront    3 Vsync   5 Vback   33 Vpol P
    Display Product Serial Number: ...
    Display Product Name: 'LG IPS QHD'
    Display Range Limits:
      Monitor ranges (GTF): 48-100 Hz V, 30-150 kHz H, max dotclock 400 MHz
  Extension blocks: 1
Checksum: 0x7b

----------------

Block 1, CTA-861 Extension Block:
  Revision: 3
  Underscans IT Video Formats by default
  Basic audio support
  Supports YCbCr 4:4:4
  Supports YCbCr 4:2:2
  Native DTDs: 1
  Video Data Block:
    VIC   1:   640x480    59.940476 Hz   4:3     31.469 kHz     25.175000 MHz
    VIC   3:   720x480    59.940060 Hz  16:9     31.469 kHz     27.000000 MHz
    VIC   2:   720x480    59.940060 Hz   4:3     31.469 kHz     27.000000 MHz
    VIC   4:  1280x720    60.000000 Hz  16:9     45.000 kHz     74.250000 MHz
    VIC  16:  1920x1080   60.000000 Hz  16:9     67.500 kHz    148.500000 MHz
    VIC  18:   720x576    50.000000 Hz  16:9     31.250 kHz     27.000000 MHz
    VIC  17:   720x576    50.000000 Hz   4:3     31.250 kHz     27.000000 MHz
    VIC  19:  1280x720    50.000000 Hz  16:9     37.500 kHz     74.250000 MHz
    VIC  31:  1920x1080   50.000000 Hz  16:9     56.250 kHz    148.500000 MHz
    VIC  34:  1920x1080   30.000000 Hz  16:9     33.750 kHz     74.250000 MHz
  Audio Data Block:
    Linear PCM:
      Max channels: 2
      Supported sample rates (kHz): 48 44.1 32
      Supported sample sizes (bits): 24 20 16
  Speaker Allocation Data Block:
    FL/FR - Front Left/Right
  Vendor-Specific Data Block (HDMI), OUI 00-0C-03:
    Source physical address: 1.0.0.0
    DC_36bit
    DC_30bit
    DC_Y444
    Maximum TMDS clock: 340 MHz
  Vendor-Specific Data Block (HDMI Forum), OUI C4-5D-D8:
    Version: 1
    Maximum TMDS Character Rate: 600 MHz
    SCDC Present
  Colorimetry Data Block:
    xvYCC601
    xvYCC709
    BT2020YCC
    BT2020RGB
    Gamut Boundary Description Metadata Profile P0
  HDR Static Metadata Data Block:
    Electro optical transfer functions:
      Traditional gamma - SDR luminance range
      SMPTE ST2084
    Supported static metadata descriptors:
      Static metadata type 1
    Desired content max luminance: 74 (248.372 cd/m^2)
    Desired content max frame-average luminance: 74 (248.372 cd/m^2)
    Desired content min luminance: 37 (0.052 cd/m^2)
  Video Capability Data Block:
    YCbCr quantization: No Data
    RGB quantization: Selectable (via AVI Q)
    PT scan behavior: Always Underscanned
    IT scan behavior: Always Underscanned
    CE scan behavior: Always Underscanned
  Detailed Timing Descriptors:
    DTD 2:  1920x1080   60.000000 Hz  16:9     67.500 kHz    148.500000 MHz (597 mm x 336 mm)
                 Hfront   88 Hsync  44 Hback  148 Hpol P
                 Vfront    4 Vsync   5 Vback   36 Vpol P
    DTD 3:  2560x1440   99.946436 Hz  16:9    150.919 kHz    410.500000 MHz (597 mm x 336 mm)
                 Hfront   48 Hsync  32 Hback   80 Hpol P
                 Vfront    3 Vsync   5 Vback   62 Vpol N
Checksum: 0xd2  Unused space in Extension Block: 38 bytes

----------------

Warnings:

Block 0, Base EDID:
  Vendor & Product Identification: The serial number is one of the known dummy values, it should probably be set to 0.
Block 1, CTA-861 Extension Block:
  Video Data Block: VIC 1 and the first DTD are not identical. Is this intended?
  Colorimetry Data Block: Set the sRGB colorimetry bit to avoid interop issues.
  Video Capability Data Block: Set Selectable YCbCr Quantization to avoid interop issues.
  Video Capability Data Block: S_PT is equal to S_IT and S_CE, so should be set to 0 instead.
  Display Product Serial Number is set, so the Serial Number in the Base EDID should be 0.
EDID:
  Base EDID: Some timings are out of range of the Monitor Ranges:
    Vertical Freq: 30.000 - 100.000 Hz (Monitor: 48.000 - 100.000 Hz)
    Horizontal Freq: 31.250 - 150.919 kHz (Monitor: 30.000 - 150.000 kHz)
    Maximum Clock: 410.500 MHz (Monitor: 400.000 MHz)

Failures:

EDID:
  Extension Block 2 started with EDID header, ignoring Extension Blocks >= 2.

EDID conformity: FAIL
