edid-decode (hex):

00 ff ff ff ff ff ff 00 26 cd 04 76 b9 01 00 00
14 1a 01 03 80 50 22 78 2a ca 95 a6 55 4e a1 26
0f 50 54 bd 4b 00 d1 c0 81 80 81 40 95 0f 95 00
b3 00 81 c0 01 01 de a3 70 e0 d4 a0 35 50 00 70
3a 50 20 4f 31 00 00 1c ef 51 70 e0 d4 a0 35 50
00 70 3a 50 20 4f 31 00 00 1c 00 00 00 fc 00 50
4c 33 34 39 30 57 51 0a 20 20 20 20 00 00 00 fd
00 17 50 1e 63 2d 00 0a 20 20 20 20 20 20 01 37

02 03 35 f1 55 10 1f 04 13 03 12 02 11 01 05 14
07 06 16 15 44 45 4b 4c 59 5a 23 09 07 07 83 01
00 00 6a 03 0c 00 10 00 39 3c 20 00 00 67 d8 5d
c4 01 78 88 03 56 5e 00 a0 a0 a0 29 50 30 20 35
00 20 4f 31 00 00 1e b3 39 00 a0 80 38 1f 40 30
20 3a 00 20 4f 31 00 00 1e ef 51 b8 70 62 a0 35
50 80 b8 3a 00 20 4f 31 00 00 1c 00 00 00 00 00
00 00 00 00 00 00 00 00 00 00 00 00 00 00 00 55

00 ff ff ff ff ff ff 00 26 cd 04 76 b9 01 00 00
14 1a 01 03 80 50 22 78 2a ca 95 a6 55 4e a1 26
0f 50 54 bd 4b 00 d1 c0 81 80 81 40 95 0f 95 00
b3 00 81 c0 01 01 de a3 70 e0 d4 a0 35 50 00 70
3a 50 20 4f 31 00 00 1c ef 51 70 e0 d4 a0 35 50
00 70 3a 50 20 4f 31 00 00 1c 00 00 00 fc 00 50
4c 33 34 39 30 57 51 0a 20 20 20 20 00 00 00 fd
00 17 50 1e 63 2d 00 0a 20 20 20 20 20 20 01 37

02 03 35 f1 55 10 1f 04 13 03 12 02 11 01 05 14
07 06 16 15 44 45 4b 4c 59 5a 23 09 07 07 83 01
00 00 6a 03 0c 00 10 00 39 3c 20 00 00 67 d8 5d
c4 01 78 88 03 56 5e 00 a0 a0 a0 29 50 30 20 35
00 20 4f 31 00 00 1e b3 39 00 a0 80 38 1f 40 30
20 3a 00 20 4f 31 00 00 1e ef 51 b8 70 62 a0 35
50 80 b8 3a 00 20 4f 31 00 00 1c 00 00 00 00 00
00 00 00 00 00 00 00 00 00 00 00 00 00 00 00 55

----------------

Block 0, Base EDID:
  EDID Structure Version & Revision: 1.3
  Vendor & Product Identification:
    Manufacturer: IVM
    Model: 30212
    Serial Number: ...
    Made in: week 20 of 2016
  Basic Display Parameters & Features:
    Digital display
    Maximum image size: 80 cm x 34 cm
    Gamma: 2.20
    DPMS levels: Off
    RGB color display
    First detailed timing is the preferred timing
  Color Characteristics:
    Red  : 0.6513, 0.3320
    Green: 0.3066, 0.6308
    Blue : 0.1503, 0.0595
    White: 0.3134, 0.3291
  Established Timings I & II:
    IBM     :   720x400    70.081663 Hz   9:5     31.467 kHz     28.320000 MHz
    DMT 0x04:   640x480    59.940476 Hz   4:3     31.469 kHz     25.175000 MHz
    Apple   :   640x480    66.666667 Hz   4:3     35.000 kHz     30.240000 MHz
    DMT 0x05:   640x480    72.808802 Hz   4:3     37.861 kHz     31.500000 MHz
    DMT 0x06:   640x480    75.000000 Hz   4:3     37.500 kHz     31.500000 MHz
    DMT 0x09:   800x600    60.316541 Hz   4:3     37.879 kHz     40.000000 MHz
    DMT 0x0b:   800x600    75.000000 Hz   4:3     46.875 kHz     49.500000 MHz
    DMT 0x10:  1024x768    60.003840 Hz   4:3     48.363 kHz     65.000000 MHz
    DMT 0x12:  1024x768    75.028582 Hz   4:3     60.023 kHz     78.750000 MHz
    DMT 0x24:  1280x1024   75.024675 Hz   5:4     79.976 kHz    135.000000 MHz
  Standard Timings:
    DMT 0x52:  1920x1080   60.000000 Hz  16:9     67.500 kHz    148.500000 MHz
    DMT 0x23:  1280x1024   60.019740 Hz   5:4     63.981 kHz    108.000000 MHz
    DMT 0x20:  1280x960    60.000000 Hz   4:3     60.000 kHz    108.000000 MHz
    DMT 0x30:  1440x900    74.984427 Hz  16:10    70.635 kHz    136.750000 MHz
    DMT 0x2f:  1440x900    59.887445 Hz  16:10    55.935 kHz    106.500000 MHz
    DMT 0x3a:  1680x1050   59.954250 Hz  16:10    65.290 kHz    146.250000 MHz
    DMT 0x55:  1280x720    60.000000 Hz  16:9     45.000 kHz     74.250000 MHz
  Detailed Timing Descriptors:
    DTD 1:  3440x1440   59.935558 Hz  43:18    89.484 kHz    419.500000 MHz (800 mm x 335 mm)
                 Hfront  256 Hsync 368 Hback  624 Hpol N
                 Vfront    3 Vsync  10 Vback   40 Vpol P
    DTD 2:  3440x1440   29.967779 Hz  43:18    44.742 kHz    209.750000 MHz (800 mm x 335 mm)
                 Hfront  256 Hsync 368 Hback  624 Hpol N
                 Vfront    3 Vsync  10 Vback   40 Vpol P
    Display Product Name: 'PL3490WQ'
    Display Range Limits:
      Monitor ranges (GTF): 23-80 Hz V, 30-99 kHz H, max dotclock 450 MHz
  Extension blocks: 1
Checksum: 0x37

----------------

Block 1, CTA-861 Extension Block:
  Revision: 3
  Underscans IT Video Formats by default
  Basic audio support
  Supports YCbCr 4:4:4
  Supports YCbCr 4:2:2
  Native DTDs: 1
  Video Data Block:
    VIC  16:  1920x1080   60.000000 Hz  16:9     67.500 kHz    148.500000 MHz
    VIC  31:  1920x1080   50.000000 Hz  16:9     56.250 kHz    148.500000 MHz
    VIC   4:  1280x720    60.000000 Hz  16:9     45.000 kHz     74.250000 MHz
    VIC  19:  1280x720    50.000000 Hz  16:9     37.500 kHz     74.250000 MHz
    VIC   3:   720x480    59.940060 Hz  16:9     31.469 kHz     27.000000 MHz
    VIC  18:   720x576    50.000000 Hz  16:9     31.250 kHz     27.000000 MHz
    VIC   2:   720x480    59.940060 Hz   4:3     31.469 kHz     27.000000 MHz
    VIC  17:   720x576    50.000000 Hz   4:3     31.250 kHz     27.000000 MHz
    VIC   1:   640x480    59.940476 Hz   4:3     31.469 kHz     25.175000 MHz
    VIC   5:  1920x1080i  60.000000 Hz  16:9     33.750 kHz     74.250000 MHz
    VIC  20:  1920x1080i  50.000000 Hz  16:9     28.125 kHz     74.250000 MHz
    VIC   7:  1440x480i   59.940060 Hz  16:9     15.734 kHz     27.000000 MHz
    VIC   6:  1440x480i   59.940060 Hz   4:3     15.734 kHz     27.000000 MHz
    VIC  22:  1440x576i   50.000000 Hz  16:9     15.625 kHz     27.000000 MHz
    VIC  21:  1440x576i   50.000000 Hz   4:3     15.625 kHz     27.000000 MHz
    VIC  68:  1280x720    50.000000 Hz  64:27    37.500 kHz     74.250000 MHz
    VIC  69:  1280x720    60.000000 Hz  64:27    45.000 kHz     74.250000 MHz
    VIC  75:  1920x1080   50.000000 Hz  64:27    56.250 kHz    148.500000 MHz
    VIC  76:  1920x1080   60.000000 Hz  64:27    67.500 kHz    148.500000 MHz
    VIC  89:  2560x1080   50.000000 Hz  64:27    56.250 kHz    185.625000 MHz
    VIC  90:  2560x1080   60.000000 Hz  64:27    66.000 kHz    198.000000 MHz
  Audio Data Block:
    Linear PCM:
      Max channels: 2
      Supported sample rates (kHz): 48 44.1 32
      Supported sample sizes (bits): 24 20 16
  Speaker Allocation Data Block:
    FL/FR - Front Left/Right
  Vendor-Specific Data Block (HDMI), OUI 00-0C-03:
    Source physical address: 1.0.0.0
    DC_36bit
    DC_30bit
    DC_Y444
    DVI_Dual
    Maximum TMDS clock: 300 MHz
    Extended HDMI video details:
  Vendor-Specific Data Block (HDMI Forum), OUI C4-5D-D8:
    Version: 1
    Maximum TMDS Character Rate: 600 MHz
    SCDC Present
    Supports scrambling for <= 340 Mcsc
    Supports 12-bits/component Deep Color 4:2:0 Pixel Encoding
    Supports 10-bits/component Deep Color 4:2:0 Pixel Encoding
  Detailed Timing Descriptors:
    DTD 3:  2560x1440   59.950550 Hz  16:9     88.787 kHz    241.500000 MHz (800 mm x 335 mm)
                 Hfront   48 Hsync  32 Hback   80 Hpol P
                 Vfront    3 Vsync   5 Vback   33 Vpol P
    DTD 4:  2048x1080   60.213902 Hz 256:135   66.898 kHz    147.710000 MHz (800 mm x 335 mm)
                 Hfront   48 Hsync  32 Hback   80 Hpol P
                 Vfront    3 Vsync  10 Vback   18 Vpol P
    DTD 5:  1720x1440   59.935558 Hz  43:36    89.484 kHz    209.750000 MHz (800 mm x 335 mm)
                 Hfront  128 Hsync 184 Hback  312 Hpol N
                 Vfront    3 Vsync  10 Vback   40 Vpol P
Checksum: 0x55  Unused space in Extension Block: 20 bytes

----------------

Warnings:

Block 1, CTA-861 Extension Block:
  Video Data Block: VIC 16 and the first DTD are not identical. Is this intended?
  Detailed Timing Descriptor #3: Image size is 800x335 mm, but based on the picture AR it should be 595x335 mm.
  Detailed Timing Descriptor #4: Image size is 800x335 mm, but based on the picture AR it should be 635x335 mm.
  Detailed Timing Descriptor #5: Image size is 800x335 mm, but based on the picture AR it should be 400x335 mm.
  Add a Colorimetry Data Block with the sRGB colorimetry bit set to avoid interop issues.
EDID:
  Base EDID: Some timings are out of range of the Monitor Ranges:
    Horizontal Freq: 15.625 - 89.483 kHz (Monitor: 30.000 - 99.000 kHz)

Failures:

Block 1, CTA-861 Extension Block:
  Missing VCDB, needed for Set Selectable RGB Quantization to avoid interop issues.
EDID:
  Extension Block 2 started with EDID header, ignoring Extension Blocks >= 2.

EDID conformity: FAIL
