edid-decode (hex):

00 ff ff ff ff ff ff 00 06 10 85 9c 00 00 00 00
19 12 01 03 80 22 16 78 0a 5c 20 98 58 51 8e 27
25 50 54 00 00 00 01 01 01 01 01 01 01 01 01 01
01 01 01 01 01 01 ab 22 a0 a0 50 84 1a 30 30 20
36 00 21 15 10 00 00 19 00 00 00 01 00 06 10 30
00 00 00 00 00 00 00 00 0a 20 00 00 00 fe 00 4e
31 35 34 43 36 2d 4c 30 34 0a 20 20 00 00 00 fc
00 43 6f 6c 6f 72 20 4c 43 44 0a 20 20 20 00 bc

----------------

Block 0, Base EDID:
  EDID Structure Version & Revision: 1.3
  Vendor & Product Identification:
    Manufacturer: APP
    Model: 40069
    Made in: week 25 of 2008
  Basic Display Parameters & Features:
    Digital display
    Maximum image size: 34 cm x 22 cm
    Gamma: 2.20
    RGB color display
    First detailed timing is the preferred timing
  Color Characteristics:
    Red  : 0.5947, 0.3447
    Green: 0.3193, 0.5546
    Blue : 0.1523, 0.1464
    White: 0.3125, 0.3281
  Established Timings I & II: none
  Standard Timings: none
  Detailed Timing Descriptors:
    DTD 1:  1440x900    59.901458 Hz  16:10    55.469 kHz     88.750000 MHz (289 mm x 21 mm)
                 Hfront   48 Hsync  32 Hback   80 Hpol N
                 Vfront    3 Vsync   6 Vback   17 Vpol N
    Manufacturer-Specified Display Descriptor (0x01): 00 01 00 06 10 30 00 00 00 00 00 00 00 00 0a 20 '.....0......... '
    Alphanumeric Data String: 'N154C6-L04'
    Display Product Name: 'Color LCD'
Checksum: 0xbc

----------------

Warnings:

Block 0, Base EDID:
  Detailed Timing Descriptor #1: DTD is similar but not identical to DMT 0x2e.
  Detailed Timing Descriptor #1: Dubious image size (289x21 mm is smaller than 100x100 mm).

Failures:

Block 0, Base EDID:
  Detailed Timing Descriptor #1: Mismatch of image size 289x21 mm vs display size 340x220 mm.
  Missing Display Range Limits Descriptor.

EDID conformity: FAIL
