edid-decode (hex):

00 ff ff ff ff ff ff 00 59 96 02 30 01 00 00 00
1e 1c 01 04 a5 0a 0f 78 16 00 00 00 00 00 00 00
00 00 00 00 00 00 01 00 01 00 01 00 01 00 01 00
01 00 01 00 01 00 63 1b 20 54 30 00 2a 50 28 04
e4 04 3c 3c 00 00 00 1e 00 00 00 fc 00 41 4e 58
37 35 33 30 20 55 0a 20 20 20 00 00 00 10 00 00
00 00 00 00 00 00 00 00 00 00 00 00 00 00 00 10
00 00 00 00 00 00 00 00 00 00 00 00 00 00 00 5a

00 ff ff ff ff ff ff 00 59 96 02 30 01 00 00 00
1e 1c 01 04 a5 0a 0f 78 16 00 00 00 00 00 00 00
00 00 00 00 00 00 01 00 01 00 01 00 01 00 01 00
01 00 01 00 01 00 63 1b 20 54 30 00 2a 50 28 04
e4 04 3c 3c 00 00 00 1e 00 00 00 fc 00 41 4e 58
37 35 33 30 20 55 0a 20 20 20 00 00 00 10 00 00
00 00 00 00 00 00 00 00 00 00 00 00 00 00 00 10
00 00 00 00 00 00 00 00 00 00 00 00 00 00 00 5a

----------------

Block 0, Base EDID:
  EDID Structure Version & Revision: 1.4
  Vendor & Product Identification:
    Manufacturer: VLV
    Model: 12290
    Serial Number: ...
    Made in: week 30 of 2018
  Basic Display Parameters & Features:
    Digital display
    Bits per primary color channel: 8
    DisplayPort interface
    Maximum image size: 10 cm x 15 cm
    Gamma: 2.20
    Supported color formats: RGB 4:4:4, YCrCb 4:2:2
    Default (sRGB) color space is primary color space
    First detailed timing includes the native pixel format and preferred refresh rate
  Color Characteristics:
    Red  : 0.0000, 0.0000
    Green: 0.0000, 0.0000
    Blue : 0.0000, 0.0000
    White: 0.0000, 0.0000
  Established Timings I & II: none
  Standard Timings:
  Detailed Timing Descriptors:
    DTD 1:   800x1280   59.992401 Hz   5:8     79.310 kHz     70.110000 MHz (60 mm x 60 mm)
                 Hfront   40 Hsync   4 Hback   40 Hpol P
                 Vfront   30 Vsync   4 Vback    8 Vpol P
    Display Product Name: 'ANX7530 U'
    Dummy Descriptor:
    Dummy Descriptor:
Checksum: 0x5a

----------------

Warnings:

Block 0, Base EDID:
  Vendor & Product Identification: The serial number is one of the known dummy values, it should probably be set to 0.
  Detailed Timing Descriptor #1: Dubious image size (60x60 mm is smaller than 100x100 mm).

Failures:

Block 0, Base EDID:
  Basic Display Parameters & Features: sRGB is signaled, but the chromaticities do not match.
  Standard Timings: Use 0x0101 as the invalid Standard Timings code, not 0x0100.
  Standard Timings: Use 0x0101 as the invalid Standard Timings code, not 0x0100.
  Standard Timings: Use 0x0101 as the invalid Standard Timings code, not 0x0100.
  Standard Timings: Use 0x0101 as the invalid Standard Timings code, not 0x0100.
  Standard Timings: Use 0x0101 as the invalid Standard Timings code, not 0x0100.
  Standard Timings: Use 0x0101 as the invalid Standard Timings code, not 0x0100.
  Standard Timings: Use 0x0101 as the invalid Standard Timings code, not 0x0100.
  Standard Timings: Use 0x0101 as the invalid Standard Timings code, not 0x0100.
  Detailed Timing Descriptor #1: Mismatch of image size 60x60 mm vs display size 100x150 mm.
EDID:
  Extension Block 1 started with EDID header, ignoring Extension Blocks >= 1.

EDID conformity: FAIL
