edid-decode (hex):

00 ff ff ff ff ff ff 00 0d ae 24 16 00 00 00 00
1b 20 01 04 a5 22 16 78 03 ee 95 a3 54 4c 99 26
0f 50 54 00 00 00 01 01 01 01 01 01 01 01 01 01
01 01 01 01 01 01 4d ae 80 a0 70 b0 47 49 30 20
a6 00 58 d7 10 00 00 18 00 00 00 fd 00 3a a5 d7
d7 2d 01 0a 20 20 20 20 20 20 00 00 00 fc 00 4e
31 36 30 4a 4d 45 5f 47 45 31 0a 20 00 00 00 fe
00 43 4d 4e 0a 20 20 20 20 20 20 20 20 20 01 8d

70 20 79 02 00 22 00 14 02 cf 06 85 7f 07 9f 00
2f 00 1f 00 af 04 63 00 09 00 05 00 2b 00 06 27
00 3c a4 00 00 81 00 13 72 1a 00 00 03 01 3a a5
00 00 00 00 00 00 a5 00 00 00 00 00 00 00 00 00
00 00 00 00 00 00 00 00 00 00 00 00 00 00 00 00
00 00 00 00 00 00 00 00 00 00 00 00 00 00 00 00
00 00 00 00 00 00 00 00 00 00 00 00 00 00 00 00
00 00 00 00 00 00 00 00 00 00 00 00 00 00 5c 90

00 ff ff ff ff ff ff 00 0d ae 24 16 00 00 00 00
1b 20 01 04 a5 22 16 78 03 ee 95 a3 54 4c 99 26
0f 50 54 00 00 00 01 01 01 01 01 01 01 01 01 01
01 01 01 01 01 01 4d ae 80 a0 70 b0 47 49 30 20
a6 00 58 d7 10 00 00 18 00 00 00 fd 00 3a a5 d7
d7 2d 01 0a 20 20 20 20 20 20 00 00 00 fc 00 4e
31 36 30 4a 4d 45 5f 47 45 31 0a 20 00 00 00 fe
00 43 4d 4e 0a 20 20 20 20 20 20 20 20 20 01 8d

70 20 79 02 00 22 00 14 02 cf 06 85 7f 07 9f 00
2f 00 1f 00 af 04 63 00 09 00 05 00 2b 00 06 27
00 3c a4 00 00 81 00 13 72 1a 00 00 03 01 3a a5
00 00 00 00 00 00 a5 00 00 00 00 00 00 00 00 00
00 00 00 00 00 00 00 00 00 00 00 00 00 00 00 00
00 00 00 00 00 00 00 00 00 00 00 00 00 00 00 00
00 00 00 00 00 00 00 00 00 00 00 00 00 00 00 00
00 00 00 00 00 00 00 00 00 00 00 00 00 00 5c 90

----------------

Block 0, Base EDID:
  EDID Structure Version & Revision: 1.4
  Vendor & Product Identification:
    Manufacturer: CMN
    Model: 5668
    Made in: week 27 of 2022
  Basic Display Parameters & Features:
    Digital display
    Bits per primary color channel: 8
    DisplayPort interface
    Maximum image size: 34 cm x 22 cm
    Gamma: 2.20
    Supported color formats: RGB 4:4:4
    First detailed timing includes the native pixel format and preferred refresh rate
    Display supports continuous frequencies
  Color Characteristics:
    Red  : 0.6396, 0.3300
    Green: 0.2998, 0.5996
    Blue : 0.1503, 0.0595
    White: 0.3134, 0.3291
  Established Timings I & II: none
  Standard Timings: none
  Detailed Timing Descriptors:
    DTD 1:  1920x1200   60.006724 Hz  16:10   214.524 kHz    446.210000 MHz (344 mm x 215 mm)
                 Hfront   48 Hsync  32 Hback   80 Hpol N
                 Vfront   10 Vsync   6 Vback 2359 Vpol N
    Display Range Limits:
      Monitor ranges (Range Limits Only): 58-165 Hz V, 215-215 kHz H, max dotclock 450 MHz
    Display Product Name: 'N160JME_GE1'
    Alphanumeric Data String: 'CMN'
  Extension blocks: 1
Checksum: 0x8d

----------------

Block 1, DisplayID Extension Block:
  Version: 2.0
  Extension Count: 0
  Display Product Primary Use Case: None of the listed primary use cases; generic display
  Video Timing Modes Type 7 - Detailed Timings Data Block:
    DTD:  1920x1200  165.018861 Hz  16:10   214.525 kHz    446.211000 MHz (aspect 16:10, no 3D stereo, preferred)
               Hfront   48 Hsync  32 Hback   80 Hpol N
               Vfront   10 Vsync   6 Vback   84 Vpol N
  Adaptive Sync Data Block:
    Descriptor #1:
      Native Panel Range
      Fixed Average V-Total and Adaptive V-Total
      Supports Seamless Transition
      'Max Single Frame Duration Increase' field value without jitter impact
      'Max Single Frame Duration Decrease' field value without jitter impact
      Max Duration Increase: 0.00 ms
      Max Duration Decrease: 0.00 ms
      Min Refresh Rate: 60 Hz
      Max Refresh Rate: 165 Hz
  CTA-861 DisplayID Data Block:
  Vendor-Specific Data Block (AMD), OUI 00-00-1A:
    Version: 3
    Flags 1: 0x01
      FreeSync Supported
    Minimum Refresh Rate: 58 Hz
    Maximum Refresh Rate: 165 Hz
    Flags 5: 0x00
  Checksum: 0x5c
Checksum: 0x90

----------------

Failures:

EDID:
  Extension Block 2 started with EDID header, ignoring Extension Blocks >= 2.
  DisplayID: Missing DisplayID Display Parameters Data Block.

EDID conformity: FAIL
