edid-decode (hex):

00 ff ff ff ff ff ff 00 09 e5 00 16 00 00 00 00
01 21 01 03 80 22 14 78 2a ee 91 a3 54 4c 99 26
0f 50 54 21 08 00 d1 c0 d1 00 81 00 95 00 a9 00
01 01 01 01 01 01 9c 68 00 a0 a0 40 29 60 30 20
35 00 58 c4 10 00 00 1a 00 00 00 fc 00 44 69 73
70 6c 61 79 0a 20 20 20 20 20 3b d1 00 a0 a0 40
29 60 30 20 35 00 58 c4 10 00 00 1a 00 00 00 fd
00 30 78 0f de 46 00 0a 20 20 20 20 20 20 01 29

02 03 40 f2 46 90 01 02 03 04 10 e2 00 d5 e3 05
c0 00 23 09 7f 07 83 01 00 00 e5 0f 00 00 0c 00
67 03 0c 00 10 00 18 78 67 d8 5d c4 01 78 88 01
e6 06 05 01 73 73 00 68 1a 00 00 01 01 30 78 e6
a9 e2 00 a0 a0 40 29 60 30 20 35 00 58 c4 10 00
00 1a 56 5e 00 a0 a0 a0 29 50 30 20 35 00 58 c4
10 00 00 1a 70 c2 00 a0 a0 a0 55 50 30 20 35 00
58 c4 10 00 00 1a 00 00 00 00 00 00 00 00 00 29

00 ff ff ff ff ff ff 00 09 e5 00 16 00 00 00 00
01 21 01 03 80 22 14 78 2a ee 91 a3 54 4c 99 26
0f 50 54 21 08 00 d1 c0 d1 00 81 00 95 00 a9 00
01 01 01 01 01 01 9c 68 00 a0 a0 40 29 60 30 20
35 00 58 c4 10 00 00 1a 00 00 00 fc 00 44 69 73
70 6c 61 79 0a 20 20 20 20 20 3b d1 00 a0 a0 40
29 60 30 20 35 00 58 c4 10 00 00 1a 00 00 00 fd
00 30 78 0f de 46 00 0a 20 20 20 20 20 20 01 29

02 03 40 f2 46 90 01 02 03 04 10 e2 00 d5 e3 05
c0 00 23 09 7f 07 83 01 00 00 e5 0f 00 00 0c 00
67 03 0c 00 10 00 18 78 67 d8 5d c4 01 78 88 01
e6 06 05 01 73 73 00 68 1a 00 00 01 01 30 78 e6
a9 e2 00 a0 a0 40 29 60 30 20 35 00 58 c4 10 00
00 1a 56 5e 00 a0 a0 a0 29 50 30 20 35 00 58 c4
10 00 00 1a 70 c2 00 a0 a0 a0 55 50 30 20 35 00
58 c4 10 00 00 1a 00 00 00 00 00 00 00 00 00 29

----------------

Block 0, Base EDID:
  EDID Structure Version & Revision: 1.3
  Vendor & Product Identification:
    Manufacturer: BOE
    Model: 5632
    Made in: week 1 of 2023
  Basic Display Parameters & Features:
    Digital display
    Maximum image size: 34 cm x 20 cm
    Gamma: 2.20
    DPMS levels: Off
    RGB color display
    First detailed timing is the preferred timing
  Color Characteristics:
    Red  : 0.6396, 0.3300
    Green: 0.2998, 0.5996
    Blue : 0.1503, 0.0595
    White: 0.3125, 0.3291
  Established Timings I & II:
    DMT 0x04:   640x480    59.940476 Hz   4:3     31.469 kHz     25.175000 MHz
    DMT 0x09:   800x600    60.316541 Hz   4:3     37.879 kHz     40.000000 MHz
    DMT 0x10:  1024x768    60.003840 Hz   4:3     48.363 kHz     65.000000 MHz
  Standard Timings:
    DMT 0x52:  1920x1080   60.000000 Hz  16:9     67.500 kHz    148.500000 MHz
    DMT 0x45:  1920x1200   59.884600 Hz  16:10    74.556 kHz    193.250000 MHz
    DMT 0x1c:  1280x800    59.810326 Hz  16:10    49.702 kHz     83.500000 MHz
    DMT 0x2f:  1440x900    59.887445 Hz  16:10    55.935 kHz    106.500000 MHz
    GTF     :  1600x1000   59.999820 Hz  16:10    62.100 kHz    133.142000 MHz
  Detailed Timing Descriptors:
    DTD 1:  2560x1600   59.997491 Hz  16:10    98.456 kHz    267.800000 MHz (344 mm x 196 mm)
                 Hfront   48 Hsync  32 Hback   80 Hpol P
                 Vfront    3 Vsync   5 Vback   33 Vpol N
    Display Product Name: 'Display'
    DTD 2:  2560x1600  120.001703 Hz  16:10   196.923 kHz    535.630000 MHz (344 mm x 196 mm)
                 Hfront   48 Hsync  32 Hback   80 Hpol P
                 Vfront    3 Vsync   5 Vback   33 Vpol N
    Display Range Limits:
      Monitor ranges (GTF): 48-120 Hz V, 15-222 kHz H, max dotclock 700 MHz
  Extension blocks: 1
Checksum: 0x29

----------------

Block 1, CTA-861 Extension Block:
  Revision: 3
  Underscans IT Video Formats by default
  Basic audio support
  Supports YCbCr 4:4:4
  Supports YCbCr 4:2:2
  Native DTDs: 2
  Video Data Block:
    VIC  16:  1920x1080   60.000000 Hz  16:9     67.500 kHz    148.500000 MHz (native)
    VIC   1:   640x480    59.940476 Hz   4:3     31.469 kHz     25.175000 MHz
    VIC   2:   720x480    59.940060 Hz   4:3     31.469 kHz     27.000000 MHz
    VIC   3:   720x480    59.940060 Hz  16:9     31.469 kHz     27.000000 MHz
    VIC   4:  1280x720    60.000000 Hz  16:9     45.000 kHz     74.250000 MHz
    VIC  16:  1920x1080   60.000000 Hz  16:9     67.500 kHz    148.500000 MHz
  Video Capability Data Block:
    YCbCr quantization: Selectable (via AVI YQ)
    RGB quantization: Selectable (via AVI Q)
    PT scan behavior: Always Overscanned
    IT scan behavior: Always Overscanned
    CE scan behavior: Always Overscanned
  Colorimetry Data Block:
    BT2020YCC
    BT2020RGB
  Audio Data Block:
    Linear PCM:
      Max channels: 2
      Supported sample rates (kHz): 192 176.4 96 88.2 48 44.1 32
      Supported sample sizes (bits): 24 20 16
  Speaker Allocation Data Block:
    FL/FR - Front Left/Right
  YCbCr 4:2:0 Capability Map Data Block:
    SVD Index 19 is out of range
    SVD Index 20 is out of range
  Vendor-Specific Data Block (HDMI), OUI 00-0C-03:
    Source physical address: 1.0.0.0
    DC_30bit
    DC_Y444
    Maximum TMDS clock: 600 MHz
  Vendor-Specific Data Block (HDMI Forum), OUI C4-5D-D8:
    Version: 1
    Maximum TMDS Character Rate: 600 MHz
    SCDC Present
    Supports scrambling for <= 340 Mcsc
    Supports 10-bits/component Deep Color 4:2:0 Pixel Encoding
  HDR Static Metadata Data Block:
    Electro optical transfer functions:
      Traditional gamma - SDR luminance range
      SMPTE ST2084
    Supported static metadata descriptors:
      Static metadata type 1
    Desired content max luminance: 115 (603.666 cd/m^2)
    Desired content max frame-average luminance: 115 (603.666 cd/m^2)
    Desired content min luminance: 0 (0.000 cd/m^2)
  Vendor-Specific Data Block (AMD), OUI 00-00-1A:
    Version: 1
    Feature Caps: 0x01
    Minimum Refresh Rate: 48 Hz
    Maximum Refresh Rate: 120 Hz
    Flags 1.x: 0xe6 (MCCS)
  Detailed Timing Descriptors:
    DTD 3:  2560x1600  129.998297 Hz  16:10   213.327 kHz    580.250000 MHz (344 mm x 196 mm)
                 Hfront   48 Hsync  32 Hback   80 Hpol P
                 Vfront    3 Vsync   5 Vback   33 Vpol N
    DTD 4:  2560x1440   59.950550 Hz  16:9     88.787 kHz    241.500000 MHz (344 mm x 196 mm)
                 Hfront   48 Hsync  32 Hback   80 Hpol P
                 Vfront    3 Vsync   5 Vback   33 Vpol N
    DTD 5:  2560x1440  120.000000 Hz  16:9    183.000 kHz    497.760000 MHz (344 mm x 196 mm)
                 Hfront   48 Hsync  32 Hback   80 Hpol P
                 Vfront    3 Vsync   5 Vback   77 Vpol N
Checksum: 0x29  Unused space in Extension Block: 9 bytes

----------------

Warnings:

Block 0, Base EDID:
  Detailed Timing Descriptor #1: Image size is 344x196 mm, but based on the picture AR it should be 313x196 mm.
  Detailed Timing Descriptor #2: Image size is 344x196 mm, but based on the picture AR it should be 313x196 mm.
Block 1, CTA-861 Extension Block:
  Video Data Block: VIC 16 and the first DTD are not identical. Is this intended?
  Video Capability Data Block: IT scan behavior is expected to support underscanned.
  Video Capability Data Block: S_PT is equal to S_IT and S_CE, so should be set to 0 instead.
  Detailed Timing Descriptor #3: Image size is 344x196 mm, but based on the picture AR it should be 313x196 mm.
EDID:
  Base EDID: Some timings are out of range of the Monitor Ranges:
    Vertical Freq: 59.810 - 129.998 Hz (Monitor: 48.000 - 120.000 Hz)

Failures:

Block 0, Base EDID:
  Basic Display Parameters & Features: The chromaticities match sRGB, but sRGB is not signaled.
  Detailed Timing Descriptor #2: Invalid detailed timing descriptor ordering.
Block 1, CTA-861 Extension Block:
  Video Data Block: Duplicate VIC 16.
  Video Capability Data Block: IT video formats are always overscanned, but bit 7 of Byte 3 of the CTA-861 Extension header is set to underscanned.
  YCbCr 4:2:0 Capability Map Data Block: Max index 20 > 6 (#SVDs).
  Vendor-Specific Data Block (HDMI), OUI 00-0C-03: HDMI VSDB Max TMDS rate is > 340.
EDID:
  Extension Block 2 started with EDID header, ignoring Extension Blocks >= 2.
  CTA-861: Native progressive timings are a mix of several resolutions.

EDID conformity: FAIL
