edid-decode (hex):

00 ff ff ff ff ff ff 00 30 ae 42 40 00 00 00 00
00 0f 01 03 80 1e 17 78 ea 2d 05 97 57 51 8a 27
23 50 54 21 08 00 81 80 01 01 01 01 01 01 01 01
01 01 01 01 01 01 30 2a 78 20 51 1a 10 40 30 70
13 00 30 e4 10 00 00 19 25 23 78 20 51 1a 10 40
30 70 13 00 30 e4 10 00 00 19 00 00 00 0f 00 90
43 32 90 43 28 14 01 00 4c a3 50 46 00 00 00 fe
00 4c 54 4e 31 35 30 50 46 2d 4c 30 33 0a 00 8c

00 ff ff ff ff ff ff 00 30 ae 42 40 00 00 00 00
00 0f 01 03 80 1e 17 78 ea 2d 05 97 57 51 8a 27
23 50 54 21 08 00 81 80 01 01 01 01 01 01 01 01
01 01 01 01 01 01 30 2a 78 20 51 1a 10 40 30 70
13 00 30 e4 10 00 00 19 25 23 78 20 51 1a 10 40
30 70 13 00 30 e4 10 00 00 19 00 00 00 0f 00 90
43 32 90 43 28 14 01 00 4c a3 50 46 00 00 00 fe
00 4c 54 4e 31 35 30 50 46 2d 4c 30 33 0a 00 8c

----------------

Block 0, Base EDID:
  EDID Structure Version & Revision: 1.3
  Vendor & Product Identification:
    Manufacturer: LEN
    Model: 16450
    Made in: 2005
  Basic Display Parameters & Features:
    Digital display
    Maximum image size: 30 cm x 23 cm
    Gamma: 2.20
    DPMS levels: Standby Suspend Off
    RGB color display
    First detailed timing is the preferred timing
  Color Characteristics:
    Red  : 0.5898, 0.3417
    Green: 0.3193, 0.5400
    Blue : 0.1523, 0.1367
    White: 0.3134, 0.3291
  Established Timings I & II:
    DMT 0x04:   640x480    59.940476 Hz   4:3     31.469 kHz     25.175000 MHz
    DMT 0x09:   800x600    60.316541 Hz   4:3     37.879 kHz     40.000000 MHz
    DMT 0x10:  1024x768    60.003840 Hz   4:3     48.363 kHz     65.000000 MHz
  Standard Timings:
    DMT 0x23:  1280x1024   60.019740 Hz   5:4     63.981 kHz    108.000000 MHz
  Detailed Timing Descriptors:
    DTD 1:  1400x1050   60.019740 Hz   4:3     63.981 kHz    108.000000 MHz (304 mm x 228 mm)
                 Hfront   48 Hsync 112 Hback  128 Hpol N
                 Vfront    1 Vsync   3 Vback   12 Vpol N
    DTD 2:  1400x1050   49.999778 Hz   4:3     53.300 kHz     89.970000 MHz (304 mm x 228 mm)
                 Hfront   48 Hsync 112 Hback  128 Hpol N
                 Vfront    1 Vsync   3 Vback   12 Vpol N
    Manufacturer-Specified Display Descriptor (0x0f): 00 0f 00 90 43 32 90 43 28 14 01 00 4c a3 50 46 '....C2.C(...L.PF'
    Alphanumeric Data String: 'LTN150PF-L03'
Checksum: 0x8c

----------------

Failures:

Block 0, Base EDID:
  Missing Display Product Name.
  Missing Display Range Limits Descriptor.
EDID:
  Extension Block 1 started with EDID header, ignoring Extension Blocks >= 1.

EDID conformity: FAIL
