edid-decode (hex):

00 ff ff ff ff ff ff 00 30 e4 a8 06 00 00 00 00
00 1e 01 04 a5 22 13 78 07 ef 85 a3 54 4c 9e 26
0e 50 54 00 00 00 01 01 01 01 01 01 01 01 01 01
01 01 01 01 01 01 00 39 80 a0 70 38 59 40 30 20
35 00 58 c2 10 00 00 1a 00 00 00 fd 00 3c 90 a7
a7 23 01 0a 20 20 20 20 20 20 00 00 00 fe 00 30
34 35 58 44 80 31 35 36 57 46 47 0a 00 00 00 00
00 02 41 3f 9e 00 01 00 00 0f 01 0a 20 20 01 6a

70 13 79 00 00 03 01 14 5e 87 00 84 7f 07 9f 00
2f 80 1f 00 37 04 4c 00 02 00 04 00 00 00 00 00
00 00 00 00 00 00 00 00 00 00 00 00 00 00 00 00
00 00 00 00 00 00 00 00 00 00 00 00 00 00 00 00
00 00 00 00 00 00 00 00 00 00 00 00 00 00 00 00
00 00 00 00 00 00 00 00 00 00 00 00 00 00 00 00
00 00 00 00 00 00 00 00 00 00 00 00 00 00 00 00
00 00 00 00 00 00 00 00 00 00 00 00 00 00 73 90

----------------

Block 0, Base EDID:
  EDID Structure Version & Revision: 1.4
  Vendor & Product Identification:
    Manufacturer: LGD
    Model: 1704
    Made in: 2020
  Basic Display Parameters & Features:
    Digital display
    Bits per primary color channel: 8
    DisplayPort interface
    Maximum image size: 34 cm x 19 cm
    Gamma: 2.20
    Supported color formats: RGB 4:4:4
    Default (sRGB) color space is primary color space
    First detailed timing includes the native pixel format and preferred refresh rate
    Display supports continuous frequencies
  Color Characteristics:
    Red  : 0.6396, 0.3300
    Green: 0.2998, 0.6201
    Blue : 0.1503, 0.0546
    White: 0.3134, 0.3291
  Established Timings I & II: none
  Standard Timings: none
  Detailed Timing Descriptors:
    DTD 1:  1920x1080   60.011844 Hz  16:9     70.154 kHz    145.920000 MHz (344 mm x 194 mm)
                 Hfront   48 Hsync  32 Hback   80 Hpol P
                 Vfront    3 Vsync   5 Vback   81 Vpol N
    Display Range Limits:
      Monitor ranges (Range Limits Only): 60-144 Hz V, 167-167 kHz H, max dotclock 350 MHz
    Alphanumeric Data String: '045XD.156WFG'
    Manufacturer-Specified Display Descriptor (0x00): 00 00 00 02 41 3f 9e 00 01 00 00 0f 01 0a 20 20 '....A?........  '
  Extension blocks: 1
Checksum: 0x6a

----------------

Block 1, DisplayID Extension Block:
  Version: 1.3
  Extension Count: 0
  Display Product Type: Extension Section
  Video Timing Modes Type 1 - Detailed Timings Data Block:
    DTD:  1920x1080  144.002227 Hz  16:9    166.611 kHz    346.550000 MHz (aspect 16:9, no 3D stereo, preferred)
               Hfront   48 Hsync  32 Hback   80 Hpol P
               Vfront    3 Vsync   5 Vback   69 Vpol N
  Checksum: 0x73
Checksum: 0x90

----------------

Warnings:

Block 0, Base EDID:
  Alphanumeric Data String: Non-ASCII character 0x80 at position 5, can cause problems.
  Missing Display Product Name.
EDID:
  Base EDID: Some timings are out of range of the Monitor Ranges:
    Horizontal Freq: 70.153 - 166.610 kHz (Monitor: 167.000 - 167.000 kHz)

Failures:

Block 0, Base EDID:
  Basic Display Parameters & Features: sRGB is signaled, but the chromaticities do not match.
Block 1, DisplayID Extension Block:
  DisplayID Base Block has no product type.

EDID conformity: FAIL
