edid-decode (hex):

00 ff ff ff ff ff ff 00 09 e5 92 0a 00 00 00 00
13 20 01 04 a5 1e 13 78 03 ee 96 a3 54 4c 99 26
0f 4e 51 00 00 00 01 01 01 01 01 01 01 01 01 01
01 01 01 01 01 01 60 d2 00 a0 a0 40 32 60 30 20
35 00 2e bd 10 00 00 18 c8 9d 00 a0 a0 40 32 60
30 20 35 00 2e bd 10 00 00 18 00 00 00 fd 00 30
78 c6 c6 36 01 0a 20 20 20 20 20 20 00 00 00 fe
00 4e 45 31 34 30 51 44 4d 2d 4e 58 32 20 01 64

70 13 79 00 00 03 01 14 30 69 00 05 ff 09 9f 00
2f 00 1f 00 3f 06 31 00 02 00 04 00 00 00 00 00
00 00 00 00 00 00 00 00 00 00 00 00 00 00 00 00
00 00 00 00 00 00 00 00 00 00 00 00 00 00 00 00
00 00 00 00 00 00 00 00 00 00 00 00 00 00 00 00
00 00 00 00 00 00 00 00 00 00 00 00 00 00 00 00
00 00 00 00 00 00 00 00 00 00 00 00 00 00 00 00
00 00 00 00 00 00 00 00 00 00 00 00 00 00 4d 90

00 ff ff ff ff ff ff 00 09 e5 92 0a 00 00 00 00
13 20 01 04 a5 1e 13 78 03 ee 96 a3 54 4c 99 26
0f 4e 51 00 00 00 01 01 01 01 01 01 01 01 01 01
01 01 01 01 01 01 60 d2 00 a0 a0 40 32 60 30 20
35 00 2e bd 10 00 00 18 c8 9d 00 a0 a0 40 32 60
30 20 35 00 2e bd 10 00 00 18 00 00 00 fd 00 30
78 c6 c6 36 01 0a 20 20 20 20 20 20 00 00 00 fe
00 4e 45 31 34 30 51 44 4d 2d 4e 58 32 20 01 64

70 13 79 00 00 03 01 14 30 69 00 05 ff 09 9f 00
2f 00 1f 00 3f 06 31 00 02 00 04 00 00 00 00 00
00 00 00 00 00 00 00 00 00 00 00 00 00 00 00 00
00 00 00 00 00 00 00 00 00 00 00 00 00 00 00 00
00 00 00 00 00 00 00 00 00 00 00 00 00 00 00 00
00 00 00 00 00 00 00 00 00 00 00 00 00 00 00 00
00 00 00 00 00 00 00 00 00 00 00 00 00 00 00 00
00 00 00 00 00 00 00 00 00 00 00 00 00 00 4d 90

----------------

Block 0, Base EDID:
  EDID Structure Version & Revision: 1.4
  Vendor & Product Identification:
    Manufacturer: BOE
    Model: 2706
    Made in: week 19 of 2022
  Basic Display Parameters & Features:
    Digital display
    Bits per primary color channel: 8
    DisplayPort interface
    Maximum image size: 30 cm x 19 cm
    Gamma: 2.20
    Supported color formats: RGB 4:4:4
    First detailed timing includes the native pixel format and preferred refresh rate
    Display supports continuous frequencies
  Color Characteristics:
    Red  : 0.6396, 0.3300
    Green: 0.2998, 0.5996
    Blue : 0.1503, 0.0595
    White: 0.3056, 0.3183
  Established Timings I & II: none
  Standard Timings: none
  Detailed Timing Descriptors:
    DTD 1:  2560x1600  120.000000 Hz  16:10   198.000 kHz    538.560000 MHz (302 mm x 189 mm)
                 Hfront   48 Hsync  32 Hback   80 Hpol N
                 Vfront    3 Vsync   5 Vback   42 Vpol N
    DTD 2:  2560x1600   90.000000 Hz  16:10   148.500 kHz    403.920000 MHz (302 mm x 189 mm)
                 Hfront   48 Hsync  32 Hback   80 Hpol N
                 Vfront    3 Vsync   5 Vback   42 Vpol N
    Display Range Limits:
      Monitor ranges (Range Limits Only): 48-120 Hz V, 198-198 kHz H, max dotclock 540 MHz
    Alphanumeric Data String: 'NE140QDM-NX2 '
  Extension blocks: 1
Checksum: 0x64

----------------

Block 1, DisplayID Extension Block:
  Version: 1.3
  Extension Count: 0
  Display Product Type: Extension Section
  Video Timing Modes Type 1 - Detailed Timings Data Block:
    DTD:  2560x1600   60.002228 Hz  16:10    99.004 kHz    269.290000 MHz (aspect 16:10, no 3D stereo)
               Hfront   48 Hsync  32 Hback   80 Hpol N
               Vfront    3 Vsync   5 Vback   42 Vpol N
  Checksum: 0x4d
Checksum: 0x90

----------------

Block 2, Unknown EDID Extension Block 0x00:
  00 ff ff ff ff ff ff 00 09 e5 92 0a 00 00 00 00 '................'
  13 20 01 04 a5 1e 13 78 03 ee 96 a3 54 4c 99 26 '. .....x....TL.&'
  0f 4e 51 00 00 00 01 01 01 01 01 01 01 01 01 01 '.NQ.............'
  01 01 01 01 01 01 60 d2 00 a0 a0 40 32 60 30 20 '......`....@2`0 '
  35 00 2e bd 10 00 00 18 c8 9d 00 a0 a0 40 32 60 '5............@2`'
  30 20 35 00 2e bd 10 00 00 18 00 00 00 fd 00 30 '0 5............0'
  78 c6 c6 36 01 0a 20 20 20 20 20 20 00 00 00 fe 'x..6..      ....'
  00 4e 45 31 34 30 51 44 4d 2d 4e 58 32 20 01 64 '.NE140QDM-NX2 .d'
Checksum: 0x64

----------------

Block 3, DisplayID Extension Block:
  Version: 1.3
  Extension Count: 0
  Video Timing Modes Type 1 - Detailed Timings Data Block:
    DTD:  2560x1600   60.002228 Hz  16:10    99.004 kHz    269.290000 MHz (aspect 16:10, no 3D stereo)
               Hfront   48 Hsync  32 Hback   80 Hpol N
               Vfront    3 Vsync   5 Vback   42 Vpol N
  Checksum: 0x4d
Checksum: 0x90

----------------

Warnings:

Block 0, Base EDID:
  Missing Display Product Name.
EDID:
  Base EDID: Some timings are out of range of the Monitor Ranges:
    Horizontal Freq: 99.003 - 198.000 kHz (Monitor: 198.000 - 198.000 kHz)

Failures:

Block 0, Base EDID:
  Alphanumeric Data String: No newline, but one or more trailing spaces.
Block 1, DisplayID Extension Block:
  DisplayID Base Block has no product type.
  Expected 0 DisplayID Extension Block, but got 1.
Block 2, Base EDID:
  Unknown Extension Block.
EDID:
  Base EDID: EDID specified 1 extension block(s), but found 3 extension block(s).
  DisplayID: DisplayID expects at least one preferred timing.

EDID conformity: FAIL
