edid-decode (hex):

00 ff ff ff ff ff ff 00 22 f0 17 42 01 00 00 00
19 16 01 03 80 30 1b 78 0a 80 90 a2 5a 52 a2 26
0d 50 54 00 00 00 01 01 01 01 01 01 01 01 01 01
01 01 01 01 01 01 02 3a 80 18 71 38 2d 40 58 2c
45 00 dd 0d 11 00 00 18 00 00 00 fe 00 56 30 36
0a 20 20 20 20 20 20 20 20 20 00 00 00 fc 00 48
50 51 20 36 33 30 30 20 41 69 4f 0a 00 00 00 fe
00 4d 32 31 35 48 47 45 2d 4c 32 31 0a 20 00 db

----------------

Block 0, Base EDID:
  EDID Structure Version & Revision: 1.3
  Vendor & Product Identification:
    Manufacturer: HWP
    Model: 16919
    Serial Number: ...
    Made in: week 25 of 2012
  Basic Display Parameters & Features:
    Digital display
    Maximum image size: 48 cm x 27 cm
    Gamma: 2.20
    RGB color display
    First detailed timing is the preferred timing
  Color Characteristics:
    Red  : 0.6347, 0.3515
    Green: 0.3203, 0.6328
    Blue : 0.1503, 0.0517
    White: 0.3125, 0.3281
  Established Timings I & II: none
  Standard Timings: none
  Detailed Timing Descriptors:
    DTD 1:  1920x1080   60.000000 Hz  16:9     67.500 kHz    148.500000 MHz (477 mm x 269 mm)
                 Hfront   88 Hsync  44 Hback  148 Hpol N
                 Vfront    4 Vsync   5 Vback   36 Vpol N
    Alphanumeric Data String: 'V06'
    Display Product Name: 'HPQ 6300 AiO'
    Alphanumeric Data String: 'M215HGE-L21'
Checksum: 0xdb

----------------

Warnings:

Block 0, Base EDID:
  Vendor & Product Identification: The serial number is one of the known dummy values, it should probably be set to 0.
  Detailed Timing Descriptor #1: DTD is similar but not identical to VIC 16.

Failures:

Block 0, Base EDID:
  Missing Display Range Limits Descriptor.

EDID conformity: FAIL
