edid-decode (hex):

00 ff ff ff ff ff ff 00 0e 6f 2a 14 00 00 00 00
00 21 01 04 a5 1e 13 78 02 2c e5 94 5c 59 95 29
20 50 54 00 00 00 01 01 01 01 01 01 01 01 01 01
01 01 01 01 01 01 e9 3d 80 c8 70 b0 2e 40 30 20
36 00 2d bc 10 00 00 1a 87 31 80 c8 70 b0 2e 40
30 20 36 00 2d bc 10 00 00 1a 00 00 00 fe 00 50
30 4b 32 47 80 43 53 4f 54 20 54 39 00 00 00 00
00 01 41 31 99 00 10 00 00 0a 01 0a 20 20 00 14

00 ff ff ff ff ff ff 00 0e 6f 2a 14 00 00 00 00
00 21 01 04 a5 1e 13 78 02 2c e5 94 5c 59 95 29
20 50 54 00 00 00 01 01 01 01 01 01 01 01 01 01
01 01 01 01 01 01 e9 3d 80 c8 70 b0 2e 40 30 20
36 00 2d bc 10 00 00 1a 87 31 80 c8 70 b0 2e 40
30 20 36 00 2d bc 10 00 00 1a 00 00 00 fe 00 50
30 4b 32 47 80 43 53 4f 54 20 54 39 00 00 00 00
00 01 41 31 99 00 10 00 00 0a 01 0a 20 20 00 14

----------------

Block 0, Base EDID:
  EDID Structure Version & Revision: 1.4
  Vendor & Product Identification:
    Manufacturer: CSO
    Model: 5162
    Made in: 2023
  Basic Display Parameters & Features:
    Digital display
    Bits per primary color channel: 8
    DisplayPort interface
    Maximum image size: 30 cm x 19 cm
    Gamma: 2.20
    Supported color formats: RGB 4:4:4
    First detailed timing includes the native pixel format and preferred refresh rate
  Color Characteristics:
    Red  : 0.5781, 0.3613
    Green: 0.3505, 0.5820
    Blue : 0.1630, 0.1269
    White: 0.3134, 0.3291
  Established Timings I & II: none
  Standard Timings: none
  Detailed Timing Descriptors:
    DTD 1:  1920x1200   59.999546 Hz  16:10    74.759 kHz    158.490000 MHz (301 mm x 188 mm)
                 Hfront   48 Hsync  32 Hback  120 Hpol P
                 Vfront    3 Vsync   6 Vback   37 Vpol N
    DTD 2:  1920x1200   47.998879 Hz  16:10    59.807 kHz    126.790000 MHz (301 mm x 188 mm)
                 Hfront   48 Hsync  32 Hback  120 Hpol P
                 Vfront    3 Vsync   6 Vback   37 Vpol N
    Alphanumeric Data String: 'P0K2G.CSOT T9'
    Manufacturer-Specified Display Descriptor (0x00): 00 00 00 01 41 31 99 00 10 00 00 0a 01 0a 20 20 '....A1........  '
Checksum: 0x14

----------------

Warnings:

Block 0, Base EDID:
  Alphanumeric Data String: Non-ASCII character 0x80 at position 5, can cause problems.
  Missing Display Product Name.

Failures:

EDID:
  Extension Block 1 started with EDID header, ignoring Extension Blocks >= 1.

EDID conformity: FAIL
