edid-decode (hex):

00 ff ff ff ff ff ff 00 22 f0 07 28 01 01 01 01
29 13 01 03 80 2f 1e 78 ee ce 50 a3 54 4c 99 26
0f 50 54 a1 6b 80 81 40 81 80 95 00 b3 00 a9 00
01 01 01 01 01 01 21 39 90 30 62 1a 27 40 68 b0
36 00 d6 2c 11 00 00 1c 00 00 00 fd 00 30 55 1e
5d 11 00 0a 20 20 20 20 20 20 00 00 00 fc 00 48
50 20 4c 50 32 32 37 35 77 0a 20 20 00 00 00 ff
00 43 4e 43 39 34 31 30 58 35 32 0a 20 20 00 59

00 ff ff ff ff ff ff 00 22 f0 07 28 01 01 01 01
29 13 01 03 80 2f 1e 78 ee ce 50 a3 54 4c 99 26
0f 50 54 a1 6b 80 81 40 81 80 95 00 b3 00 a9 00
01 01 01 01 01 01 21 39 90 30 62 1a 27 40 68 b0
36 00 d6 2c 11 00 00 1c 00 00 00 fd 00 30 55 1e
5d 11 00 0a 20 20 20 20 20 20 00 00 00 fc 00 48
50 20 4c 50 32 32 37 35 77 0a 20 20 00 00 00 ff
00 43 4e 43 39 34 31 30 58 35 32 0a 20 20 00 59

----------------

Block 0, Base EDID:
  EDID Structure Version & Revision: 1.3
  Vendor & Product Identification:
    Manufacturer: HWP
    Model: 10247
    Serial Number: ...
    Made in: week 41 of 2009
  Basic Display Parameters & Features:
    Digital display
    Maximum image size: 47 cm x 30 cm
    Gamma: 2.20
    DPMS levels: Standby Suspend Off
    RGB color display
    Default (sRGB) color space is primary color space
    First detailed timing is the preferred timing
  Color Characteristics:
    Red  : 0.6396, 0.3281
    Green: 0.2998, 0.5996
    Blue : 0.1494, 0.0595
    White: 0.3125, 0.3281
  Established Timings I & II:
    IBM     :   720x400    70.081663 Hz   9:5     31.467 kHz     28.320000 MHz
    DMT 0x04:   640x480    59.940476 Hz   4:3     31.469 kHz     25.175000 MHz
    DMT 0x09:   800x600    60.316541 Hz   4:3     37.879 kHz     40.000000 MHz
    DMT 0x0b:   800x600    75.000000 Hz   4:3     46.875 kHz     49.500000 MHz
    Apple   :   832x624    74.551266 Hz   4:3     49.726 kHz     57.284000 MHz
    DMT 0x10:  1024x768    60.003840 Hz   4:3     48.363 kHz     65.000000 MHz
    DMT 0x12:  1024x768    75.028582 Hz   4:3     60.023 kHz     78.750000 MHz
    DMT 0x24:  1280x1024   75.024675 Hz   5:4     79.976 kHz    135.000000 MHz
    Apple   :  1152x870    75.061550 Hz 192:145   68.681 kHz    100.000000 MHz
  Standard Timings:
    DMT 0x20:  1280x960    60.000000 Hz   4:3     60.000 kHz    108.000000 MHz
    DMT 0x23:  1280x1024   60.019740 Hz   5:4     63.981 kHz    108.000000 MHz
    DMT 0x2f:  1440x900    59.887445 Hz  16:10    55.935 kHz    106.500000 MHz
    DMT 0x3a:  1680x1050   59.954250 Hz  16:10    65.290 kHz    146.250000 MHz
    GTF     :  1600x1000   59.999820 Hz  16:10    62.100 kHz    133.142000 MHz
  Detailed Timing Descriptors:
    DTD 1:  1680x1050   59.954250 Hz  16:10    65.290 kHz    146.250000 MHz (470 mm x 300 mm)
                 Hfront  104 Hsync 176 Hback  280 Hpol N
                 Vfront    3 Vsync   6 Vback   30 Vpol P
    Display Range Limits:
      Monitor ranges (GTF): 48-85 Hz V, 30-93 kHz H, max dotclock 170 MHz
    Display Product Name: 'HP LP2275w'
    Display Product Serial Number: ...
Checksum: 0x59

----------------

Warnings:

Block 0, Base EDID:
  Vendor & Product Identification: The serial number is one of the known dummy values, it should probably be set to 0.

Failures:

Block 0, Base EDID:
  Basic Display Parameters & Features: sRGB is signaled, but the chromaticities do not match.
EDID:
  Extension Block 1 started with EDID header, ignoring Extension Blocks >= 1.

EDID conformity: FAIL
