edid-decode (hex):

00 ff ff ff ff ff ff 00 25 c4 32 22 00 00 00 00
01 11 01 01 28 29 1a 8c 08 dc 5f a3 54 43 97 26
0f 45 46 af cf 00 81 c0 81 c0 8b c0 8b c0 8b cf
81 cf 8b cf 01 01 7c 2e 90 a0 60 1a 1e 40 30 20
36 00 d9 28 11 00 00 1c 00 00 00 ff 00 30 30 30
30 30 30 30 30 30 30 30 30 0a 00 00 00 fd 00 37
4b 1e 45 0e 00 0a 20 20 20 20 20 20 00 00 00 fc
00 00 00 00 00 4c 43 44 54 56 0a 20 20 00 00 22

00 ff ff ff ff ff ff 00 25 c4 32 22 00 00 00 00
01 11 01 01 28 29 1a 8c 08 dc 5f a3 54 43 97 26
0f 45 46 af cf 00 81 c0 81 c0 8b c0 8b c0 8b cf
81 cf 8b cf 01 01 7c 2e 90 a0 60 1a 1e 40 30 20
36 00 d9 28 11 00 00 1c 00 00 00 ff 00 30 30 30
30 30 30 30 30 30 30 30 30 0a 00 00 00 fd 00 37
4b 1e 45 0e 00 0a 20 20 20 20 20 20 00 00 00 fc
00 00 00 00 00 4c 43 44 54 56 0a 20 20 00 00 22

----------------

Block 0, Base EDID:
  EDID Structure Version & Revision: 1.1
  Vendor & Product Identification:
    Manufacturer: IND
    Model: 8754
    Made in: week 1 of 2007
  Basic Display Parameters & Features:
    Analog display
    Signal Level Standard: 0.714 : 0.286 : 1.000 V p-p
    Blank level equals black level
    Sync: Separate
    Maximum image size: 41 cm x 26 cm
    Gamma: 2.40
    RGB color display
  Color Characteristics:
    Red  : 0.6396, 0.3291
    Green: 0.2646, 0.5898
    Blue : 0.1494, 0.0595
    White: 0.2724, 0.2763
  Established Timings I & II:
    IBM     :   720x400    70.081663 Hz   9:5     31.467 kHz     28.320000 MHz
    DMT 0x04:   640x480    59.940476 Hz   4:3     31.469 kHz     25.175000 MHz
    DMT 0x05:   640x480    72.808802 Hz   4:3     37.861 kHz     31.500000 MHz
    DMT 0x06:   640x480    75.000000 Hz   4:3     37.500 kHz     31.500000 MHz
    DMT 0x08:   800x600    56.250000 Hz   4:3     35.156 kHz     36.000000 MHz
    DMT 0x09:   800x600    60.316541 Hz   4:3     37.879 kHz     40.000000 MHz
    DMT 0x0a:   800x600    72.187572 Hz   4:3     48.077 kHz     50.000000 MHz
    DMT 0x0b:   800x600    75.000000 Hz   4:3     46.875 kHz     49.500000 MHz
    DMT 0x10:  1024x768    60.003840 Hz   4:3     48.363 kHz     65.000000 MHz
    DMT 0x11:  1024x768    70.069359 Hz   4:3     56.476 kHz     75.000000 MHz
    DMT 0x12:  1024x768    75.028582 Hz   4:3     60.023 kHz     78.750000 MHz
    DMT 0x24:  1280x1024   75.024675 Hz   5:4     79.976 kHz    135.000000 MHz
  Standard Timings:
    DMT 0x55:  1280x720    60.000000 Hz  16:9     45.000 kHz     74.250000 MHz
    DMT 0x55:  1280x720    60.000000 Hz  16:9     45.000 kHz     74.250000 MHz
    Unknown :  1360x765    60.000 Hz  16:9
    Unknown :  1360x765    60.000 Hz  16:9
    Unknown :  1360x765    75.000 Hz  16:9
    Unknown :  1280x720    75.000 Hz  16:9
    Unknown :  1360x765    75.000 Hz  16:9
  Detailed Timing Descriptors:
    DTD 1:  1680x1050   59.883253 Hz  16:10    64.674 kHz    119.000000 MHz (473 mm x 296 mm)
                 Hfront   48 Hsync  32 Hback   80 Hpol N
                 Vfront    3 Vsync   6 Vback   21 Vpol P
    Display Product Serial Number: ...
    Display Range Limits:
      Monitor ranges (GTF): 55-75 Hz V, 30-69 kHz H, max dotclock 140 MHz
    Display Product Name: ''
Checksum: 0x22

----------------

Warnings:

Block 0, Base EDID:
  EDID Structure Version & Revision: EDID 1.1 is deprecated, do not use.
  Standard Timings: Standard Timing 1360x765 has a dubious odd vertical resolution.
  Standard Timings: Standard Timing 1360x765 has a dubious odd vertical resolution.
  Standard Timings: Standard Timing 1360x765 has a dubious odd vertical resolution.
  Standard Timings: Standard Timing 1360x765 has a dubious odd vertical resolution.
  Detailed Timing Descriptor #1: DTD is similar but not identical to DMT 0x39.
  Display Product Serial Number: ...
EDID:
  Base EDID: Some timings are out of range of the Monitor Ranges:
    Horizontal Freq: 31.466 - 79.976 kHz (Monitor: 30.000 - 69.000 kHz)

Failures:

Block 0, Base EDID:
  Detailed Timing Descriptor #1: Mismatch of image size 473x296 mm vs display size 410x260 mm.
  Display Product Name: NUL byte at position 0.
EDID:
  Extension Block 1 started with EDID header, ignoring Extension Blocks >= 1.
  Base EDID: The DTD max image size is 473x296mm, which is larger than the display size 410.0x260.0mm.

EDID conformity: FAIL
