edid-decode (hex):

00 ff ff ff ff ff ff 00 20 29 54 4c 01 00 00 00
0f 14 01 03 81 16 0e 78 8a a5 8e a6 54 4a 9c 26
12 45 46 21 08 00 81 c0 81 40 81 80 95 00 d1 c0
01 01 01 01 01 01 9e 20 00 90 51 20 1f 30 48 80
36 00 d9 88 00 00 00 1e 0e 1f 00 80 51 00 1e 30
40 80 37 00 d9 88 00 00 00 18 00 00 00 fc 00 33
32 56 33 48 2d 48 36 41 0a 20 20 20 00 00 00 fd
00 32 3c 18 96 0f 00 0a 20 20 20 20 20 20 01 5e

02 03 21 71 4e 06 07 02 03 15 96 11 12 13 04 14
05 1f 90 23 09 07 07 83 01 00 00 65 03 0c 00 10
00 8c 0a d0 90 20 40 31 20 0c 40 55 00 b9 88 21
00 00 18 01 1d 80 18 71 1c 16 20 58 2c 25 00 b9
88 21 00 00 9e 01 1d 80 d0 72 1c 16 20 10 2c 25
80 b9 88 21 00 00 9e 01 1d 00 bc 52 d0 1e 20 b8
28 55 40 b9 88 21 00 00 1e 02 3a 80 d0 72 38 2d
40 10 2c 45 80 b9 88 21 00 00 1e 00 00 00 00 d0

00 ff ff ff ff ff ff 00 20 29 54 4c 01 00 00 00
0f 14 01 03 81 16 0e 78 8a a5 8e a6 54 4a 9c 26
12 45 46 21 08 00 81 c0 81 40 81 80 95 00 d1 c0
01 01 01 01 01 01 9e 20 00 90 51 20 1f 30 48 80
36 00 d9 88 00 00 00 1e 0e 1f 00 80 51 00 1e 30
40 80 37 00 d9 88 00 00 00 18 00 00 00 fc 00 33
32 56 33 48 2d 48 36 41 0a 20 20 20 00 00 00 fd
00 32 3c 18 96 0f 00 0a 20 20 20 20 20 20 01 5e

02 03 21 71 4e 06 07 02 03 15 96 11 12 13 04 14
05 1f 90 23 09 07 07 83 01 00 00 65 03 0c 00 10
00 8c 0a d0 90 20 40 31 20 0c 40 55 00 b9 88 21
00 00 18 01 1d 80 18 71 1c 16 20 58 2c 25 00 b9
88 21 00 00 9e 01 1d 80 d0 72 1c 16 20 10 2c 25
80 b9 88 21 00 00 9e 01 1d 00 bc 52 d0 1e 20 b8
28 55 40 b9 88 21 00 00 1e 02 3a 80 d0 72 38 2d
40 10 2c 45 80 b9 88 21 00 00 1e 00 00 00 00 d0

----------------

Block 0, Base EDID:
  EDID Structure Version & Revision: 1.3
  Vendor & Product Identification:
    Manufacturer: HAI
    Model: 19540
    Serial Number: ...
    Made in: week 15 of 2010
  Basic Display Parameters & Features:
    Digital display
    DFP 1.x compatible TMDS
    Maximum image size: 22 cm x 14 cm
    Gamma: 2.20
    DPMS levels: Standby
    RGB color display
    First detailed timing is the preferred timing
  Color Characteristics:
    Red  : 0.6503, 0.3300
    Green: 0.2900, 0.6103
    Blue : 0.1503, 0.0703
    White: 0.2724, 0.2753
  Established Timings I & II:
    DMT 0x04:   640x480    59.940476 Hz   4:3     31.469 kHz     25.175000 MHz
    DMT 0x09:   800x600    60.316541 Hz   4:3     37.879 kHz     40.000000 MHz
    DMT 0x10:  1024x768    60.003840 Hz   4:3     48.363 kHz     65.000000 MHz
  Standard Timings:
    DMT 0x55:  1280x720    60.000000 Hz  16:9     45.000 kHz     74.250000 MHz
    DMT 0x20:  1280x960    60.000000 Hz   4:3     60.000 kHz    108.000000 MHz
    DMT 0x23:  1280x1024   60.019740 Hz   5:4     63.981 kHz    108.000000 MHz
    DMT 0x2f:  1440x900    59.887445 Hz  16:10    55.935 kHz    106.500000 MHz
    DMT 0x52:  1920x1080   60.000000 Hz  16:9     67.500 kHz    148.500000 MHz
  Detailed Timing Descriptors:
    DTD 1:  1280x800    59.810326 Hz  16:10    49.702 kHz     83.500000 MHz (217 mm x 136 mm)
                 Hfront   72 Hsync 128 Hback  200 Hpol P
                 Vfront    3 Vsync   6 Vback   22 Vpol P
    DTD 2:  1280x768    59.870228 Hz   5:3     47.776 kHz     79.500000 MHz (217 mm x 136 mm)
                 Hfront   64 Hsync 128 Hback  192 Hpol N
                 Vfront    3 Vsync   7 Vback   20 Vpol N
    Display Product Name: '32V3H-H6A'
    Display Range Limits:
      Monitor ranges (GTF): 50-60 Hz V, 24-150 kHz H, max dotclock 150 MHz
  Extension blocks: 1
Checksum: 0x5e

----------------

Block 1, CTA-861 Extension Block:
  Revision: 3
  Basic audio support
  Supports YCbCr 4:4:4
  Supports YCbCr 4:2:2
  Native DTDs: 1
  Video Data Block:
    VIC   6:  1440x480i   59.940060 Hz   4:3     15.734 kHz     27.000000 MHz
    VIC   7:  1440x480i   59.940060 Hz  16:9     15.734 kHz     27.000000 MHz
    VIC   2:   720x480    59.940060 Hz   4:3     31.469 kHz     27.000000 MHz
    VIC   3:   720x480    59.940060 Hz  16:9     31.469 kHz     27.000000 MHz
    VIC  21:  1440x576i   50.000000 Hz   4:3     15.625 kHz     27.000000 MHz
    VIC  22:  1440x576i   50.000000 Hz  16:9     15.625 kHz     27.000000 MHz (native)
    VIC  17:   720x576    50.000000 Hz   4:3     31.250 kHz     27.000000 MHz
    VIC  18:   720x576    50.000000 Hz  16:9     31.250 kHz     27.000000 MHz
    VIC  19:  1280x720    50.000000 Hz  16:9     37.500 kHz     74.250000 MHz
    VIC   4:  1280x720    60.000000 Hz  16:9     45.000 kHz     74.250000 MHz
    VIC  20:  1920x1080i  50.000000 Hz  16:9     28.125 kHz     74.250000 MHz
    VIC   5:  1920x1080i  60.000000 Hz  16:9     33.750 kHz     74.250000 MHz
    VIC  31:  1920x1080   50.000000 Hz  16:9     56.250 kHz    148.500000 MHz
    VIC  16:  1920x1080   60.000000 Hz  16:9     67.500 kHz    148.500000 MHz (native)
  Audio Data Block:
    Linear PCM:
      Max channels: 2
      Supported sample rates (kHz): 48 44.1 32
      Supported sample sizes (bits): 24 20 16
  Speaker Allocation Data Block:
    FL/FR - Front Left/Right
  Vendor-Specific Data Block (HDMI), OUI 00-0C-03:
    Source physical address: 1.0.0.0
  Detailed Timing Descriptors:
    DTD 3:   720x576    50.000000 Hz   5:4     31.250 kHz     27.000000 MHz (697 mm x 392 mm)
                 Hfront   12 Hsync  64 Hback   68 Hpol N
                 Vfront    5 Vsync   5 Vback   39 Vpol N
    DTD 4:  1920x1080i  60.000000 Hz  16:9     33.750 kHz     74.250000 MHz (697 mm x 392 mm)
                 Hfront   88 Hsync  44 Hback  148 Hpol P
                 Vfront    2 Vsync   5 Vback   15 Vpol P Vfront +0.5 Odd Field
                 Vfront    2 Vsync   5 Vback   15 Vpol P Vback  +0.5 Even Field
    DTD 5:  1920x1080i  50.000000 Hz  16:9     28.125 kHz     74.250000 MHz (697 mm x 392 mm)
                 Hfront  528 Hsync  44 Hback  148 Hpol P
                 Vfront    2 Vsync   5 Vback   15 Vpol P Vfront +0.5 Odd Field
                 Vfront    2 Vsync   5 Vback   15 Vpol P Vback  +0.5 Even Field
    DTD 6:  1280x720    50.000000 Hz  16:9     37.500 kHz     74.250000 MHz (697 mm x 392 mm)
                 Hfront  440 Hsync  40 Hback  220 Hpol P
                 Vfront    5 Vsync   5 Vback   20 Vpol P
    DTD 7:  1920x1080   50.000000 Hz  16:9     56.250 kHz    148.500000 MHz (697 mm x 392 mm)
                 Hfront  528 Hsync  44 Hback  148 Hpol P
                 Vfront    4 Vsync   5 Vback   36 Vpol P
Checksum: 0xd0  Unused space in Extension Block: 4 bytes

----------------

Warnings:

Block 0, Base EDID:
  Vendor & Product Identification: The serial number is one of the known dummy values, it should probably be set to 0.
  Detailed Timing Descriptor #1: DTD is similar but not identical to DMT 0x1c.
  Detailed Timing Descriptor #2: DTD is similar but not identical to DMT 0x17.
Block 1, CTA-861 Extension Block:
  IT Video Formats are overscanned by default, but normally this should be underscanned.
  Video Data Block: VIC 6 and the first DTD are not identical. Is this intended?
  Detailed Timing Descriptor #3: Image size is 697x392 mm, but based on the picture AR it should be 490x392 mm.
  Add a Colorimetry Data Block with the sRGB colorimetry bit set to avoid interop issues.
EDID:
  Base EDID: Some timings are out of range of the Monitor Ranges:
    Horizontal Freq: 15.625 - 67.500 kHz (Monitor: 24.000 - 150.000 kHz)

Failures:

Block 1, CTA-861 Extension Block:
  Detailed Timing Descriptor #3: Mismatch of image size 697x392 mm vs display size 220x140 mm.
  Detailed Timing Descriptor #4: Mismatch of image size 697x392 mm vs display size 220x140 mm.
  Detailed Timing Descriptor #5: Mismatch of image size 697x392 mm vs display size 220x140 mm.
  Detailed Timing Descriptor #6: Mismatch of image size 697x392 mm vs display size 220x140 mm.
  Detailed Timing Descriptor #7: Mismatch of image size 697x392 mm vs display size 220x140 mm.
  Missing VCDB, needed for Set Selectable RGB Quantization to avoid interop issues.
EDID:
  Extension Block 2 started with EDID header, ignoring Extension Blocks >= 2.
  Base EDID: The DTD max image size is 697x392mm, which is larger than the display size 220.0x140.0mm.
  CTA-861: Native progressive timings are a mix of several resolutions.

EDID conformity: FAIL
