edid-decode (hex):

00 ff ff ff ff ff ff 00 22 70 16 00 01 01 01 01
2d 15 01 04 08 30 1b 78 8a de bd a3 55 47 99 26
0c 47 4a 21 08 00 d1 c0 b3 00 95 00 81 80 81 40
81 c0 01 01 01 01 1a 36 80 a0 70 38 1f 40 30 20
35 00 00 40 42 00 00 1a 66 21 50 b0 51 00 1b 30
40 70 36 00 f8 ae 21 00 00 1e 00 00 00 fd 00 32
4c 1f 4b 10 00 0a 20 20 20 20 20 20 00 00 00 fc
00 48 53 47 31 32 33 32 0a 20 20 20 20 20 00 ea

00 ff ff ff ff ff ff 00 22 70 16 00 01 01 01 01
2d 15 01 04 08 30 1b 78 8a de bd a3 55 47 99 26
0c 47 4a 21 08 00 d1 c0 b3 00 95 00 81 80 81 40
81 c0 01 01 01 01 1a 36 80 a0 70 38 1f 40 30 20
35 00 00 40 42 00 00 1a 66 21 50 b0 51 00 1b 30
40 70 36 00 f8 ae 21 00 00 1e 00 00 00 fd 00 32
4c 1f 4b 10 00 0a 20 20 20 20 20 20 00 00 00 fc
00 48 53 47 31 32 33 32 0a 20 20 20 20 20 00 ea

----------------

Block 0, Base EDID:
  EDID Structure Version & Revision: 1.4
  Vendor & Product Identification:
    Manufacturer: HSP
    Model: 22
    Serial Number: ...
    Made in: week 45 of 2011
  Basic Display Parameters & Features:
    Analog display
    Signal Level Standard: 0.700 : 0.300 : 1.000 V p-p
    Blank level equals black level
    Sync: Separate
    Maximum image size: 48 cm x 27 cm
    Gamma: 2.20
    DPMS levels: Standby
    RGB color display
    First detailed timing includes the native pixel format and preferred refresh rate
  Color Characteristics:
    Red  : 0.6396, 0.3330
    Green: 0.2802, 0.5996
    Blue : 0.1503, 0.0498
    White: 0.2802, 0.2900
  Established Timings I & II:
    DMT 0x04:   640x480    59.940476 Hz   4:3     31.469 kHz     25.175000 MHz
    DMT 0x09:   800x600    60.316541 Hz   4:3     37.879 kHz     40.000000 MHz
    DMT 0x10:  1024x768    60.003840 Hz   4:3     48.363 kHz     65.000000 MHz
  Standard Timings:
    DMT 0x52:  1920x1080   60.000000 Hz  16:9     67.500 kHz    148.500000 MHz
    DMT 0x3a:  1680x1050   59.954250 Hz  16:10    65.290 kHz    146.250000 MHz
    DMT 0x2f:  1440x900    59.887445 Hz  16:10    55.935 kHz    106.500000 MHz
    DMT 0x23:  1280x1024   60.019740 Hz   5:4     63.981 kHz    108.000000 MHz
    DMT 0x20:  1280x960    60.000000 Hz   4:3     60.000 kHz    108.000000 MHz
    DMT 0x55:  1280x720    60.000000 Hz  16:9     45.000 kHz     74.250000 MHz
  Detailed Timing Descriptors:
    DTD 1:  1920x1080   59.933878 Hz  16:9     66.587 kHz    138.500000 MHz (1024 mm x 576 mm)
                 Hfront   48 Hsync  32 Hback   80 Hpol P
                 Vfront    3 Vsync   5 Vback   23 Vpol N
    DTD 2:  1360x768    60.015162 Hz  85:48    47.712 kHz     85.500000 MHz (760 mm x 430 mm)
                 Hfront   64 Hsync 112 Hback  256 Hpol P
                 Vfront    3 Vsync   6 Vback   18 Vpol P
    Display Range Limits:
      Monitor ranges (GTF): 50-76 Hz V, 31-75 kHz H, max dotclock 160 MHz
    Display Product Name: 'HSG1232'
Checksum: 0xea

----------------

Warnings:

Block 0, Base EDID:
  Vendor & Product Identification: The serial number is one of the known dummy values, it should probably be set to 0.
  Display Range Limits: GTF support is deprecated in EDID 1.4.

Failures:

Block 0, Base EDID:
  Detailed Timing Descriptor #1: Mismatch of image size 1024x576 mm vs display size 480x270 mm.
  Detailed Timing Descriptor #2: Mismatch of image size 760x430 mm vs display size 480x270 mm.
  Display Range Limits: GTF is supported, but the display does not support continuous frequencies.
EDID:
  Extension Block 1 started with EDID header, ignoring Extension Blocks >= 1.
  Base EDID: The DTD max image size is 1024x576mm, which is larger than the display size 480.0x270.0mm.

EDID conformity: FAIL
