edid-decode (hex):

00 ff ff ff ff ff ff 00 4d d9 05 b2 01 01 01 01
01 1f 01 03 80 7a 44 78 0a 0d c9 a0 57 47 98 27
12 48 4c 21 08 00 81 80 a9 c0 71 4f b3 00 01 01
01 01 01 01 01 01 04 74 00 30 f2 70 5a 80 b0 58
8a 00 c2 ad 42 00 00 1e 02 3a 80 18 71 38 2d 40
58 2c 45 00 c2 ad 42 00 00 1e 00 00 00 fc 00 53
4f 4e 59 20 54 56 20 20 2a 33 30 0a 00 00 00 fd
00 17 4b 0e 46 1e 00 0a 20 20 20 20 20 20 01 71

02 03 60 f0 52 5d 5e 5f 62 1f 10 14 05 13 04 20
22 3c 3e 12 03 11 02 35 0d 07 01 67 7e 03 57 17
03 15 07 50 3d 1e c0 5f 7e 03 5f 7e 01 83 0f 00
00 6e 03 0c 00 10 00 b8 3c 2b 00 80 01 02 03 04
eb 01 46 d0 00 48 1b 7a 88 62 76 97 e2 00 f9 e3
05 df 01 e5 0e 60 61 65 66 e6 06 0d 01 a4 a4 10
01 1d 00 72 51 d0 1e 20 6e 28 55 00 c2 ad 42 00
00 1e 00 00 00 00 00 00 00 00 00 00 00 00 00 f7

00 ff ff ff ff ff ff 00 4d d9 05 b2 01 01 01 01
01 1f 01 03 80 7a 44 78 0a 0d c9 a0 57 47 98 27
12 48 4c 21 08 00 81 80 a9 c0 71 4f b3 00 01 01
01 01 01 01 01 01 04 74 00 30 f2 70 5a 80 b0 58
8a 00 c2 ad 42 00 00 1e 02 3a 80 18 71 38 2d 40
58 2c 45 00 c2 ad 42 00 00 1e 00 00 00 fc 00 53
4f 4e 59 20 54 56 20 20 2a 33 30 0a 00 00 00 fd
00 17 4b 0e 46 1e 00 0a 20 20 20 20 20 20 01 71

02 03 60 f0 52 5d 5e 5f 62 1f 10 14 05 13 04 20
22 3c 3e 12 03 11 02 35 0d 07 01 67 7e 03 57 17
03 15 07 50 3d 1e c0 5f 7e 03 5f 7e 01 83 0f 00
00 6e 03 0c 00 10 00 b8 3c 2b 00 80 01 02 03 04
eb 01 46 d0 00 48 1b 7a 88 62 76 97 e2 00 f9 e3
05 df 01 e5 0e 60 61 65 66 e6 06 0d 01 a4 a4 10
01 1d 00 72 51 d0 1e 20 6e 28 55 00 c2 ad 42 00
00 1e 00 00 00 00 00 00 00 00 00 00 00 00 00 f7

----------------

Block 0, Base EDID:
  EDID Structure Version & Revision: 1.3
  Vendor & Product Identification:
    Manufacturer: SNY
    Model: 45573
    Serial Number: ...
    Made in: week 1 of 2021
  Basic Display Parameters & Features:
    Digital display
    Maximum image size: 122 cm x 68 cm
    Gamma: 2.20
    RGB color display
    First detailed timing is the preferred timing
  Color Characteristics:
    Red  : 0.6250, 0.3398
    Green: 0.2802, 0.5947
    Blue : 0.1552, 0.0703
    White: 0.2832, 0.2978
  Established Timings I & II:
    DMT 0x04:   640x480    59.940476 Hz   4:3     31.469 kHz     25.175000 MHz
    DMT 0x09:   800x600    60.316541 Hz   4:3     37.879 kHz     40.000000 MHz
    DMT 0x10:  1024x768    60.003840 Hz   4:3     48.363 kHz     65.000000 MHz
  Standard Timings:
    DMT 0x23:  1280x1024   60.019740 Hz   5:4     63.981 kHz    108.000000 MHz
    DMT 0x53:  1600x900    60.000000 Hz  16:9     60.000 kHz    108.000000 MHz (RB)
    DMT 0x15:  1152x864    75.000000 Hz   4:3     67.500 kHz    108.000000 MHz
    DMT 0x3a:  1680x1050   59.954250 Hz  16:10    65.290 kHz    146.250000 MHz
  Detailed Timing Descriptors:
    DTD 1:  3840x2160   30.000000 Hz  16:9     67.500 kHz    297.000000 MHz (1218 mm x 685 mm)
                 Hfront  176 Hsync  88 Hback  296 Hpol P
                 Vfront    8 Vsync  10 Vback   72 Vpol P
    DTD 2:  1920x1080   60.000000 Hz  16:9     67.500 kHz    148.500000 MHz (1218 mm x 685 mm)
                 Hfront   88 Hsync  44 Hback  148 Hpol P
                 Vfront    4 Vsync   5 Vback   36 Vpol P
    Display Product Name: 'SONY TV  *30'
    Display Range Limits:
      Monitor ranges (GTF): 23-75 Hz V, 14-70 kHz H, max dotclock 300 MHz
  Extension blocks: 1
Checksum: 0x71

----------------

Block 1, CTA-861 Extension Block:
  Revision: 3
  Underscans IT Video Formats by default
  Basic audio support
  Supports YCbCr 4:4:4
  Supports YCbCr 4:2:2
  Native DTDs: 0
  Video Data Block:
    VIC  93:  3840x2160   24.000000 Hz  16:9     54.000 kHz    297.000000 MHz
    VIC  94:  3840x2160   25.000000 Hz  16:9     56.250 kHz    297.000000 MHz
    VIC  95:  3840x2160   30.000000 Hz  16:9     67.500 kHz    297.000000 MHz
    VIC  98:  4096x2160   24.000000 Hz 256:135   54.000 kHz    297.000000 MHz
    VIC  31:  1920x1080   50.000000 Hz  16:9     56.250 kHz    148.500000 MHz
    VIC  16:  1920x1080   60.000000 Hz  16:9     67.500 kHz    148.500000 MHz
    VIC  20:  1920x1080i  50.000000 Hz  16:9     28.125 kHz     74.250000 MHz
    VIC   5:  1920x1080i  60.000000 Hz  16:9     33.750 kHz     74.250000 MHz
    VIC  19:  1280x720    50.000000 Hz  16:9     37.500 kHz     74.250000 MHz
    VIC   4:  1280x720    60.000000 Hz  16:9     45.000 kHz     74.250000 MHz
    VIC  32:  1920x1080   24.000000 Hz  16:9     27.000 kHz     74.250000 MHz
    VIC  34:  1920x1080   30.000000 Hz  16:9     33.750 kHz     74.250000 MHz
    VIC  60:  1280x720    24.000000 Hz  16:9     18.000 kHz     59.400000 MHz
    VIC  62:  1280x720    30.000000 Hz  16:9     22.500 kHz     74.250000 MHz
    VIC  18:   720x576    50.000000 Hz  16:9     31.250 kHz     27.000000 MHz
    VIC   3:   720x480    59.940060 Hz  16:9     31.469 kHz     27.000000 MHz
    VIC  17:   720x576    50.000000 Hz   4:3     31.250 kHz     27.000000 MHz
    VIC   2:   720x480    59.940060 Hz   4:3     31.469 kHz     27.000000 MHz
  Audio Data Block:
    Linear PCM:
      Max channels: 6
      Supported sample rates (kHz): 48 44.1 32
      Supported sample sizes (bits): 16
    MAT (MLP):
      Max channels: 8
      Supported sample rates (kHz): 192 176.4 96 88.2 48 44.1
      Supports Dolby TrueHD, object audio PCM and channel-based PCM
      Hash calculation not required for object audio PCM or channel-based PCM
    Enhanced AC-3 (DD+):
      Max channels: 8
      Supported sample rates (kHz): 96 48 44.1 32
      Supports Joint Object Coding
      Supports Joint Object Coding with ACMOD28
    AC-3:
      Max channels: 6
      Supported sample rates (kHz): 48 44.1 32
      Maximum bit rate: 640 kb/s
    DTS:
      Max channels: 6
      Supported sample rates (kHz): 96 88.2 48 44.1
      Maximum bit rate: 1536 kb/s
    DTS-HD:
      Max channels: 8
      Supported sample rates (kHz): 192 176.4 96 88.2 48 44.1
      Supports DTS:X
      Audio Format Code dependent value: 0x03
    DTS-HD:
      Max channels: 8
      Supported sample rates (kHz): 192 176.4 96 88.2 48 44.1
      Audio Format Code dependent value: 0x01
  Speaker Allocation Data Block:
    FL/FR - Front Left/Right
    LFE1 - Low Frequency Effects 1
    FC - Front Center
    LS/RS - Left/Right Surround
  Vendor-Specific Data Block (HDMI), OUI 00-0C-03:
    Source physical address: 1.0.0.0
    Supports_AI
    DC_36bit
    DC_30bit
    DC_Y444
    Maximum TMDS clock: 300 MHz
    Supported Content Types:
      Graphics
      Photo
      Game
    Extended HDMI video details:
      HDMI VICs:
        HDMI VIC 1:  3840x2160   30.000000 Hz  16:9     67.500 kHz    297.000000 MHz
        HDMI VIC 2:  3840x2160   25.000000 Hz  16:9     56.250 kHz    297.000000 MHz
        HDMI VIC 3:  3840x2160   24.000000 Hz  16:9     54.000 kHz    297.000000 MHz
        HDMI VIC 4:  4096x2160   24.000000 Hz 256:135   54.000 kHz    297.000000 MHz
  Vendor-Specific Video Data Block (Dolby), OUI 00-D0-46:
    Version: 2 (12 bytes)
    DM Version: 4.x
    Backlt Min Luma: 100 cd/m^2
    Interface: Standard + Low-Latency
    Supports 10b 12b 444: Not supported
    Target Min PQ v2: 60 (0.00473386 cd/m^2)
    Target Max PQ v2: 3030 (896 cd/m^2)
    Unique Rx, Ry: 0.67968750, 0.32031250
    Unique Gx, Gy: 0.26562500, 0.69140625
    Unique Bx, By: 0.14843750, 0.05859375
  Video Capability Data Block:
    YCbCr quantization: Selectable (via AVI YQ)
    RGB quantization: Selectable (via AVI Q)
    PT scan behavior: Supports both over- and underscan
    IT scan behavior: Always Underscanned
    CE scan behavior: Always Overscanned
  Colorimetry Data Block:
    xvYCC601
    xvYCC709
    sYCC601
    opYCC601
    opRGB
    BT2020YCC
    BT2020RGB
    Gamut Boundary Description Metadata Profile P0
  YCbCr 4:2:0 Video Data Block:
    VIC  96:  3840x2160   50.000000 Hz  16:9    112.500 kHz    594.000000 MHz
    VIC  97:  3840x2160   60.000000 Hz  16:9    135.000 kHz    594.000000 MHz
    VIC 101:  4096x2160   50.000000 Hz 256:135  112.500 kHz    594.000000 MHz
    VIC 102:  4096x2160   60.000000 Hz 256:135  135.000 kHz    594.000000 MHz
  HDR Static Metadata Data Block:
    Electro optical transfer functions:
      Traditional gamma - SDR luminance range
      SMPTE ST2084
      Hybrid Log-Gamma
    Supported static metadata descriptors:
      Static metadata type 1
    Desired content max luminance: 164 (1744.812 cd/m^2)
    Desired content max frame-average luminance: 164 (1744.812 cd/m^2)
    Desired content min luminance: 16 (0.069 cd/m^2)
  Detailed Timing Descriptors:
    DTD 3:  1280x720    60.000000 Hz  16:9     45.000 kHz     74.250000 MHz (1218 mm x 685 mm)
                 Hfront  110 Hsync  40 Hback  220 Hpol P
                 Vfront    5 Vsync   5 Vback   20 Vpol P
Checksum: 0xf7  Unused space in Extension Block: 13 bytes

----------------

Warnings:

Block 0, Base EDID:
  Vendor & Product Identification: The serial number is one of the known dummy values, it should probably be set to 0.
Block 1, CTA-861 Extension Block:
  Video Data Block: VIC 93 and the first DTD are not identical. Is this intended?
  Colorimetry Data Block: Set the sRGB colorimetry bit to avoid interop issues.

Failures:

EDID:
  Extension Block 2 started with EDID header, ignoring Extension Blocks >= 2.

EDID conformity: FAIL
