edid-decode (hex):

00 ff ff ff ff ff ff 00 30 e4 cd 06 00 00 00 00
00 1f 01 04 a5 1d 11 78 03 b2 f5 a5 53 4e 9b 27
0c 50 54 00 00 00 01 01 01 01 01 01 01 01 01 01
01 01 01 01 01 01 2e 36 80 a0 70 38 1f 40 30 20
35 00 26 a5 10 00 00 1a 00 00 00 fd 00 28 3c 43
43 0e 01 0a 20 20 20 20 20 20 00 00 00 fe 00 4c
47 20 44 69 73 70 6c 61 79 0a 20 20 00 00 00 fe
00 4c 50 31 33 33 57 46 37 2d 53 50 41 31 00 61

00 ff ff ff ff ff ff 00 30 e4 cd 06 00 00 00 00
00 1f 01 04 a5 1d 11 78 03 b2 f5 a5 53 4e 9b 27
0c 50 54 00 00 00 01 01 01 01 01 01 01 01 01 01
01 01 01 01 01 01 2e 36 80 a0 70 38 1f 40 30 20
35 00 26 a5 10 00 00 1a 00 00 00 fd 00 28 3c 43
43 0e 01 0a 20 20 20 20 20 20 00 00 00 fe 00 4c
47 20 44 69 73 70 6c 61 79 0a 20 20 00 00 00 fe
00 4c 50 31 33 33 57 46 37 2d 53 50 41 31 00 61

----------------

Block 0, Base EDID:
  EDID Structure Version & Revision: 1.4
  Vendor & Product Identification:
    Manufacturer: LGD
    Model: 1741
    Made in: 2021
  Basic Display Parameters & Features:
    Digital display
    Bits per primary color channel: 8
    DisplayPort interface
    Maximum image size: 29 cm x 17 cm
    Gamma: 2.20
    Supported color formats: RGB 4:4:4
    First detailed timing includes the native pixel format and preferred refresh rate
    Display supports continuous frequencies
  Color Characteristics:
    Red  : 0.6464, 0.3271
    Green: 0.3046, 0.6074
    Blue : 0.1552, 0.0498
    White: 0.3134, 0.3291
  Established Timings I & II: none
  Standard Timings: none
  Detailed Timing Descriptors:
    DTD 1:  1920x1080   60.020425 Hz  16:9     66.683 kHz    138.700000 MHz (294 mm x 165 mm)
                 Hfront   48 Hsync  32 Hback   80 Hpol P
                 Vfront    3 Vsync   5 Vback   23 Vpol N
    Display Range Limits:
      Monitor ranges (Range Limits Only): 40-60 Hz V, 67-67 kHz H, max dotclock 140 MHz
    Alphanumeric Data String: 'LG Display'
    Alphanumeric Data String: 'LP133WF7-SPA1'
Checksum: 0x61

----------------

Block 1, Unknown EDID Extension Block 0x00:
  00 ff ff ff ff ff ff 00 30 e4 cd 06 00 00 00 00 '........0.......'
  00 1f 01 04 a5 1d 11 78 03 b2 f5 a5 53 4e 9b 27 '.......x....SN.''
  0c 50 54 00 00 00 01 01 01 01 01 01 01 01 01 01 '.PT.............'
  01 01 01 01 01 01 2e 36 80 a0 70 38 1f 40 30 20 '.......6..p8.@0 '
  35 00 26 a5 10 00 00 1a 00 00 00 fd 00 28 3c 43 '5.&..........(<C'
  43 0e 01 0a 20 20 20 20 20 20 00 00 00 fe 00 4c 'C...      .....L'
  47 20 44 69 73 70 6c 61 79 0a 20 20 00 00 00 fe 'G Display.  ....'
  00 4c 50 31 33 33 57 46 37 2d 53 50 41 31 00 61 '.LP133WF7-SPA1.a'
Checksum: 0x61

----------------

Warnings:

Block 0, Base EDID:
  Missing Display Product Name.

Failures:

Block 1, Base EDID:
  Unknown Extension Block.
EDID:
  Base EDID: EDID specified 0 extension block(s), but found 1 extension block(s).

EDID conformity: FAIL
