edid-decode (hex):

00 ff ff ff ff ff ff 00 40 89 30 00 01 00 00 00
32 13 01 04 a5 52 2e 78 0a 01 4c a7 55 46 99 24
12 48 4b 21 08 00 81 80 95 00 90 40 a9 c0 01 01
01 01 01 01 01 01 02 3a 80 18 71 38 2d 40 58 2c
45 00 72 16 11 00 00 59 00 00 00 10 00 d0 1e 20
6e 28 55 00 c4 8e 21 00 00 1e 00 00 00 10 00 a0
29 50 30 20 35 00 55 50 21 00 00 1a 00 00 00 fc
00 50 41 52 41 44 45 54 45 43 48 49 4e 43 00 b6

----------------

Block 0, Base EDID:
  EDID Structure Version & Revision: 1.4
  Vendor & Product Identification:
    Manufacturer: PDI
    Model: 48
    Serial Number: ...
    Made in: week 50 of 2009
  Basic Display Parameters & Features:
    Digital display
    Bits per primary color channel: 8
    DisplayPort interface
    Maximum image size: 82 cm x 46 cm
    Gamma: 2.20
    Supported color formats: RGB 4:4:4, YCrCb 4:4:4
    First detailed timing includes the native pixel format and preferred refresh rate
  Color Characteristics:
    Red  : 0.6523, 0.3320
    Green: 0.2734, 0.5986
    Blue : 0.1416, 0.0703
    White: 0.2841, 0.2929
  Established Timings I & II:
    DMT 0x04:   640x480    59.940476 Hz   4:3     31.469 kHz     25.175000 MHz
    DMT 0x09:   800x600    60.316541 Hz   4:3     37.879 kHz     40.000000 MHz
    DMT 0x10:  1024x768    60.003840 Hz   4:3     48.363 kHz     65.000000 MHz
  Standard Timings:
    DMT 0x23:  1280x1024   60.019740 Hz   5:4     63.981 kHz    108.000000 MHz
    DMT 0x2f:  1440x900    59.887445 Hz  16:10    55.935 kHz    106.500000 MHz
    DMT 0x2a:  1400x1050   59.978442 Hz   4:3     65.317 kHz    121.750000 MHz
    DMT 0x53:  1600x900    60.000000 Hz  16:9     60.000 kHz    108.000000 MHz (RB)
  Detailed Timing Descriptors:
    DTD 1:  1920x1080   60.000000 Hz  16:9     67.500 kHz    148.500000 MHz (interleaved left even, 370 mm x 278 mm)
                 Hfront   88 Hsync  44 Hback  148 Hpol N
                 Vfront    4 Vsync   5 Vback   36 Vpol N
    Dummy Descriptor:
    Dummy Descriptor:
    Display Product Name: 'PARADETECHINC'
Checksum: 0xb6

----------------

Warnings:

Block 0, Base EDID:
  Vendor & Product Identification: The serial number is one of the known dummy values, it should probably be set to 0.
  Detailed Timing Descriptor #1: DTD is similar but not identical to VIC 16.
  Detailed Timing Descriptor #1: Image size is 370x278 mm, but based on the picture AR it should be 370x208 mm.

Failures:

Block 0, Base EDID:
  Detailed Timing Descriptor #1: Mismatch of image size 370x278 mm vs display size 820x460 mm.
  Dummy Descriptor: Dummy block filled with garbage.
  Dummy Descriptor: Dummy block filled with garbage.

EDID conformity: FAIL
