edid-decode (hex):

00 ff ff ff ff ff ff 00 35 d4 00 28 01 00 00 00
1a 21 01 03 80 3e 23 78 2a ee 91 a3 54 4c 99 26
0f 50 54 21 08 00 31 40 45 40 01 01 81 c0 01 01
01 01 01 01 a9 c0 5a d0 00 a0 f0 70 3e 80 3c 30
35 00 6c 5e 21 00 00 1e 28 68 00 a0 f0 70 3e 80
3c 30 35 00 00 00 00 00 00 1e 00 00 00 fd 00 30
3c 1e ba 3c 01 0a 20 20 20 20 20 20 00 00 00 fc
00 4a 41 50 41 4e 4e 45 58 54 2e 4d 4e 54 01 63

02 03 3a f1 46 10 03 04 01 05 61 23 09 07 07 83
01 00 00 67 03 0c 00 10 00 38 42 67 d8 5d c4 01
78 80 00 68 1a 00 00 01 01 30 3c ed e3 05 e3 01
e6 06 07 01 60 50 01 e2 0f 20 02 3a 80 18 71 38
2d 40 58 2c 45 00 00 00 00 00 00 1e 00 00 00 00
00 00 00 00 00 00 00 00 00 00 00 00 00 00 00 00
00 00 00 00 00 00 00 00 00 00 00 00 00 00 00 00
00 00 00 00 00 00 00 00 00 00 00 00 00 00 00 c5

00 ff ff ff ff ff ff 00 35 d4 00 28 01 00 00 00
1a 21 01 03 80 3e 23 78 2a ee 91 a3 54 4c 99 26
0f 50 54 21 08 00 31 40 45 40 01 01 81 c0 01 01
01 01 01 01 a9 c0 5a d0 00 a0 f0 70 3e 80 3c 30
35 00 6c 5e 21 00 00 1e 28 68 00 a0 f0 70 3e 80
3c 30 35 00 00 00 00 00 00 1e 00 00 00 fd 00 30
3c 1e ba 3c 01 0a 20 20 20 20 20 20 00 00 00 fc
00 4a 41 50 41 4e 4e 45 58 54 2e 4d 4e 54 01 63

02 03 3a f1 46 10 03 04 01 05 61 23 09 07 07 83
01 00 00 67 03 0c 00 10 00 38 42 67 d8 5d c4 01
78 80 00 68 1a 00 00 01 01 30 3c ed e3 05 e3 01
e6 06 07 01 60 50 01 e2 0f 20 02 3a 80 18 71 38
2d 40 58 2c 45 00 00 00 00 00 00 1e 00 00 00 00
00 00 00 00 00 00 00 00 00 00 00 00 00 00 00 00
00 00 00 00 00 00 00 00 00 00 00 00 00 00 00 00
00 00 00 00 00 00 00 00 00 00 00 00 00 00 00 c5

----------------

Block 0, Base EDID:
  EDID Structure Version & Revision: 1.3
  Vendor & Product Identification:
    Manufacturer: MNT
    Model: 10240
    Serial Number: ...
    Made in: week 26 of 2023
  Basic Display Parameters & Features:
    Digital display
    Maximum image size: 62 cm x 35 cm
    Gamma: 2.20
    DPMS levels: Off
    RGB color display
    First detailed timing is the preferred timing
  Color Characteristics:
    Red  : 0.6396, 0.3300
    Green: 0.2998, 0.5996
    Blue : 0.1503, 0.0595
    White: 0.3125, 0.3291
  Established Timings I & II:
    DMT 0x04:   640x480    59.940476 Hz   4:3     31.469 kHz     25.175000 MHz
    DMT 0x09:   800x600    60.316541 Hz   4:3     37.879 kHz     40.000000 MHz
    DMT 0x10:  1024x768    60.003840 Hz   4:3     48.363 kHz     65.000000 MHz
  Standard Timings:
    DMT 0x04:   640x480    59.940476 Hz   4:3     31.469 kHz     25.175000 MHz
    DMT 0x09:   800x600    60.316541 Hz   4:3     37.879 kHz     40.000000 MHz
    DMT 0x55:  1280x720    60.000000 Hz  16:9     45.000 kHz     74.250000 MHz
    DMT 0x53:  1600x900    60.000000 Hz  16:9     60.000 kHz    108.000000 MHz (RB)
  Detailed Timing Descriptors:
    DTD 1:  3840x2160   60.011251 Hz  16:9    133.345 kHz    533.380000 MHz (620 mm x 350 mm)
                 Hfront   60 Hsync  48 Hback   52 Hpol P
                 Vfront    3 Vsync   5 Vback   54 Vpol P
    DTD 2:  3840x2160   30.000000 Hz  16:9     66.660 kHz    266.640000 MHz
                 Hfront   60 Hsync  48 Hback   52 Hpol P
                 Vfront    3 Vsync   5 Vback   54 Vpol P
    Display Range Limits:
      Monitor ranges (Range Limits Only): 48-60 Hz V, 30-186 kHz H, max dotclock 600 MHz
    Display Product Name: 'JAPANNEXT.MNT'
  Extension blocks: 1
Checksum: 0x63

----------------

Block 1, CTA-861 Extension Block:
  Revision: 3
  Underscans IT Video Formats by default
  Basic audio support
  Supports YCbCr 4:4:4
  Supports YCbCr 4:2:2
  Native DTDs: 1
  Video Data Block:
    VIC  16:  1920x1080   60.000000 Hz  16:9     67.500 kHz    148.500000 MHz
    VIC   3:   720x480    59.940060 Hz  16:9     31.469 kHz     27.000000 MHz
    VIC   4:  1280x720    60.000000 Hz  16:9     45.000 kHz     74.250000 MHz
    VIC   1:   640x480    59.940476 Hz   4:3     31.469 kHz     25.175000 MHz
    VIC   5:  1920x1080i  60.000000 Hz  16:9     33.750 kHz     74.250000 MHz
    VIC  97:  3840x2160   60.000000 Hz  16:9    135.000 kHz    594.000000 MHz
  Audio Data Block:
    Linear PCM:
      Max channels: 2
      Supported sample rates (kHz): 48 44.1 32
      Supported sample sizes (bits): 24 20 16
  Speaker Allocation Data Block:
    FL/FR - Front Left/Right
  Vendor-Specific Data Block (HDMI), OUI 00-0C-03:
    Source physical address: 1.0.0.0
    DC_36bit
    DC_30bit
    DC_Y444
    Maximum TMDS clock: 330 MHz
  Vendor-Specific Data Block (HDMI Forum), OUI C4-5D-D8:
    Version: 1
    Maximum TMDS Character Rate: 600 MHz
    SCDC Present
  Vendor-Specific Data Block (AMD), OUI 00-00-1A:
    Version: 1
    Flags 1: 0x01
      FreeSync Supported
    Minimum Refresh Rate: 48 Hz
    Maximum Refresh Rate: 60 Hz
    MCCS VCP Code: 0xed
  Colorimetry Data Block:
    xvYCC601
    xvYCC709
    BT2020cYCC
    BT2020YCC
    BT2020RGB
    Gamut Boundary Description Metadata Profile P0
  HDR Static Metadata Data Block:
    Electro optical transfer functions:
      Traditional gamma - SDR luminance range
      Traditional gamma - HDR luminance range
      SMPTE ST2084
    Supported static metadata descriptors:
      Static metadata type 1
    Desired content max luminance: 96 (400.000 cd/m^2)
    Desired content max frame-average luminance: 80 (282.843 cd/m^2)
    Desired content min luminance: 1 (0.000 cd/m^2)
  YCbCr 4:2:0 Capability Map Data Block:
    VIC  97:  3840x2160   60.000000 Hz  16:9    135.000 kHz    594.000000 MHz
  Detailed Timing Descriptors:
    DTD 3:  1920x1080   60.000000 Hz  16:9     67.500 kHz    148.500000 MHz
                 Hfront   88 Hsync  44 Hback  148 Hpol P
                 Vfront    4 Vsync   5 Vback   36 Vpol P
Checksum: 0xc5  Unused space in Extension Block: 51 bytes

----------------

Warnings:

Block 0, Base EDID:
  Vendor & Product Identification: The serial number is one of the known dummy values, it should probably be set to 0.
Block 1, CTA-861 Extension Block:
  Video Data Block: VIC 16 and the first DTD are not identical. Is this intended?
EDID:
  Base EDID: Some timings are out of range of the Monitor Ranges:
    Vertical Freq: 30.000 - 60.317 Hz (Monitor: 48.000 - 60.000 Hz)

Failures:

Block 0, Base EDID:
  Basic Display Parameters & Features: The chromaticities match sRGB, but sRGB is not signaled.
  Detailed Timing Descriptor #2: Mismatch of image size vs display size: image size is not set, but display size is.
  Display Range Limits: 'Range Limits Only' is not allowed for EDID < 1.4.
Block 1, CTA-861 Extension Block:
  Detailed Timing Descriptor #3: Mismatch of image size vs display size: image size is not set, but display size is.
  Missing VCDB, needed for Set Selectable RGB Quantization to avoid interop issues.
EDID:
  Extension Block 2 started with EDID header, ignoring Extension Blocks >= 2.

EDID conformity: FAIL
