edid-decode (hex):

00 ff ff ff ff ff ff 00 4e 14 cc 0b 00 00 00 00
34 20 01 03 80 45 1d 78 2e c7 55 a7 56 50 a1 26
0f 50 54 bf ef 80 81 c0 81 00 81 40 81 80 95 00
a9 c0 b3 00 d1 c0 0a 48 00 a0 a0 38 32 40 30 20
35 00 b2 23 21 00 00 1a 00 00 00 fd 00 30 be 36
bb 3c 00 0a 20 20 20 20 20 20 00 00 00 fc 00 53
63 65 70 74 72 65 20 50 33 30 0a 20 1c e3 00 a0
a0 38 2d 40 30 20 35 00 b2 23 21 00 00 00 01 34

02 03 48 f1 4f 01 02 03 04 05 90 11 12 13 14 1f
21 22 3f 5c 23 08 1f 07 83 01 00 00 e2 00 ca 67
03 0c 00 10 00 38 42 67 d8 5d c4 01 78 80 01 6d
1a 00 00 02 01 30 c8 ed 00 00 00 00 00 e3 05 e3
01 e6 06 07 01 60 60 00 3a c5 00 a0 a0 38 2d 40
30 40 35 00 b2 23 21 00 00 1a 1e ac 00 a0 a0 38
2d 40 30 40 35 00 b2 23 21 00 00 1a 6e 8f 00 a0
a0 38 2d 40 30 40 35 00 b2 23 21 00 00 1a 00 2f

00 ff ff ff ff ff ff 00 4e 14 cc 0b 00 00 00 00
34 20 01 03 80 45 1d 78 2e c7 55 a7 56 50 a1 26
0f 50 54 bf ef 80 81 c0 81 00 81 40 81 80 95 00
a9 c0 b3 00 d1 c0 0a 48 00 a0 a0 38 32 40 30 20
35 00 b2 23 21 00 00 1a 00 00 00 fd 00 30 be 36
bb 3c 00 0a 20 20 20 20 20 20 00 00 00 fc 00 53
63 65 70 74 72 65 20 50 33 30 0a 20 1c e3 00 a0
a0 38 2d 40 30 20 35 00 b2 23 21 00 00 00 01 34

02 03 48 f1 4f 01 02 03 04 05 90 11 12 13 14 1f
21 22 3f 5c 23 08 1f 07 83 01 00 00 e2 00 ca 67
03 0c 00 10 00 38 42 67 d8 5d c4 01 78 80 01 6d
1a 00 00 02 01 30 c8 ed 00 00 00 00 00 e3 05 e3
01 e6 06 07 01 60 60 00 3a c5 00 a0 a0 38 2d 40
30 40 35 00 b2 23 21 00 00 1a 1e ac 00 a0 a0 38
2d 40 30 40 35 00 b2 23 21 00 00 1a 6e 8f 00 a0
a0 38 2d 40 30 40 35 00 b2 23 21 00 00 1a 00 2f

----------------

Block 0, Base EDID:
  EDID Structure Version & Revision: 1.3
  Vendor & Product Identification:
    Manufacturer: SPT
    Model: 3020
    Made in: week 52 of 2022
  Basic Display Parameters & Features:
    Digital display
    Maximum image size: 69 cm x 29 cm
    Gamma: 2.20
    DPMS levels: Off
    RGB color display
    Default (sRGB) color space is primary color space
    First detailed timing is the preferred timing
  Color Characteristics:
    Red  : 0.6552, 0.3359
    Green: 0.3134, 0.6318
    Blue : 0.1494, 0.0595
    White: 0.3134, 0.3291
  Established Timings I & II:
    IBM     :   720x400    70.081663 Hz   9:5     31.467 kHz     28.320000 MHz
    DMT 0x04:   640x480    59.940476 Hz   4:3     31.469 kHz     25.175000 MHz
    Apple   :   640x480    66.666667 Hz   4:3     35.000 kHz     30.240000 MHz
    DMT 0x05:   640x480    72.808802 Hz   4:3     37.861 kHz     31.500000 MHz
    DMT 0x06:   640x480    75.000000 Hz   4:3     37.500 kHz     31.500000 MHz
    DMT 0x08:   800x600    56.250000 Hz   4:3     35.156 kHz     36.000000 MHz
    DMT 0x09:   800x600    60.316541 Hz   4:3     37.879 kHz     40.000000 MHz
    DMT 0x0a:   800x600    72.187572 Hz   4:3     48.077 kHz     50.000000 MHz
    DMT 0x0b:   800x600    75.000000 Hz   4:3     46.875 kHz     49.500000 MHz
    Apple   :   832x624    74.551266 Hz   4:3     49.726 kHz     57.284000 MHz
    DMT 0x10:  1024x768    60.003840 Hz   4:3     48.363 kHz     65.000000 MHz
    DMT 0x11:  1024x768    70.069359 Hz   4:3     56.476 kHz     75.000000 MHz
    DMT 0x12:  1024x768    75.028582 Hz   4:3     60.023 kHz     78.750000 MHz
    DMT 0x24:  1280x1024   75.024675 Hz   5:4     79.976 kHz    135.000000 MHz
    Apple   :  1152x870    75.061550 Hz 192:145   68.681 kHz    100.000000 MHz
  Standard Timings:
    DMT 0x55:  1280x720    60.000000 Hz  16:9     45.000 kHz     74.250000 MHz
    DMT 0x1c:  1280x800    59.810326 Hz  16:10    49.702 kHz     83.500000 MHz
    DMT 0x20:  1280x960    60.000000 Hz   4:3     60.000 kHz    108.000000 MHz
    DMT 0x23:  1280x1024   60.019740 Hz   5:4     63.981 kHz    108.000000 MHz
    DMT 0x2f:  1440x900    59.887445 Hz  16:10    55.935 kHz    106.500000 MHz
    DMT 0x53:  1600x900    60.000000 Hz  16:9     60.000 kHz    108.000000 MHz (RB)
    DMT 0x3a:  1680x1050   59.954250 Hz  16:10    65.290 kHz    146.250000 MHz
    DMT 0x52:  1920x1080   60.000000 Hz  16:9     67.500 kHz    148.500000 MHz
  Detailed Timing Descriptors:
    DTD 1:  2560x1080   60.001301 Hz  64:27    67.801 kHz    184.420000 MHz (690 mm x 291 mm)
                 Hfront   48 Hsync  32 Hback   80 Hpol P
                 Vfront    3 Vsync   5 Vback   42 Vpol N
    Display Range Limits:
      Monitor ranges (GTF): 48-190 Hz V, 54-187 kHz H, max dotclock 600 MHz
    Display Product Name: 'Sceptre P30'
    DTD 2:  2560x1080  190.000000 Hz  64:27   213.750 kHz    581.400000 MHz (analog composite, sync-on-green, 690 mm x 291 mm)
                 Hfront   48 Hsync  32 Hback   80 Hpol N
                 Vfront    3 Vsync   5 Vback   37 Vpol N
  Extension blocks: 1
Checksum: 0x34

----------------

Block 1, CTA-861 Extension Block:
  Revision: 3
  Underscans IT Video Formats by default
  Basic audio support
  Supports YCbCr 4:4:4
  Supports YCbCr 4:2:2
  Native DTDs: 1
  Video Data Block:
    VIC   1:   640x480    59.940476 Hz   4:3     31.469 kHz     25.175000 MHz
    VIC   2:   720x480    59.940060 Hz   4:3     31.469 kHz     27.000000 MHz
    VIC   3:   720x480    59.940060 Hz  16:9     31.469 kHz     27.000000 MHz
    VIC   4:  1280x720    60.000000 Hz  16:9     45.000 kHz     74.250000 MHz
    VIC   5:  1920x1080i  60.000000 Hz  16:9     33.750 kHz     74.250000 MHz
    VIC  16:  1920x1080   60.000000 Hz  16:9     67.500 kHz    148.500000 MHz (native)
    VIC  17:   720x576    50.000000 Hz   4:3     31.250 kHz     27.000000 MHz
    VIC  18:   720x576    50.000000 Hz  16:9     31.250 kHz     27.000000 MHz
    VIC  19:  1280x720    50.000000 Hz  16:9     37.500 kHz     74.250000 MHz
    VIC  20:  1920x1080i  50.000000 Hz  16:9     28.125 kHz     74.250000 MHz
    VIC  31:  1920x1080   50.000000 Hz  16:9     56.250 kHz    148.500000 MHz
    VIC  33:  1920x1080   25.000000 Hz  16:9     28.125 kHz     74.250000 MHz
    VIC  34:  1920x1080   30.000000 Hz  16:9     33.750 kHz     74.250000 MHz
    VIC  63:  1920x1080  120.000000 Hz  16:9    135.000 kHz    297.000000 MHz
    VIC  92:  2560x1080  120.000000 Hz  64:27   150.000 kHz    495.000000 MHz
  Audio Data Block:
    Linear PCM:
      Max channels: 1
      Supported sample rates (kHz): 96 88.2 48 44.1 32
      Supported sample sizes (bits): 24 20 16
  Speaker Allocation Data Block:
    FL/FR - Front Left/Right
  Video Capability Data Block:
    YCbCr quantization: Selectable (via AVI YQ)
    RGB quantization: Selectable (via AVI Q)
    PT scan behavior: No Data
    IT scan behavior: Always Underscanned
    CE scan behavior: Always Underscanned
  Vendor-Specific Data Block (HDMI), OUI 00-0C-03:
    Source physical address: 1.0.0.0
    DC_36bit
    DC_30bit
    DC_Y444
    Maximum TMDS clock: 330 MHz
  Vendor-Specific Data Block (HDMI Forum), OUI C4-5D-D8:
    Version: 1
    Maximum TMDS Character Rate: 600 MHz
    SCDC Present
    Supports 10-bits/component Deep Color 4:2:0 Pixel Encoding
  Vendor-Specific Data Block (AMD), OUI 00-00-1A:
    Version: 2
    Flags 1: 0x01
      FreeSync Supported
    Minimum Refresh Rate: 48 Hz
    Maximum Refresh Rate: 200 Hz
    MCCS VCP Code: 0xed
    Flags 5: 0x00
  Colorimetry Data Block:
    xvYCC601
    xvYCC709
    BT2020cYCC
    BT2020YCC
    BT2020RGB
    Gamut Boundary Description Metadata Profile P0
  HDR Static Metadata Data Block:
    Electro optical transfer functions:
      Traditional gamma - SDR luminance range
      Traditional gamma - HDR luminance range
      SMPTE ST2084
    Supported static metadata descriptors:
      Static metadata type 1
    Desired content max luminance: 96 (400.000 cd/m^2)
    Desired content max frame-average luminance: 96 (400.000 cd/m^2)
    Desired content min luminance: 0 (0.000 cd/m^2)
  Detailed Timing Descriptors:
    DTD 3:  2560x1080  165.000000 Hz  64:27   185.625 kHz    504.900000 MHz (690 mm x 291 mm)
                 Hfront   48 Hsync  64 Hback   48 Hpol P
                 Vfront    3 Vsync   5 Vback   37 Vpol N
    DTD 4:  2560x1080  143.993464 Hz  64:27   161.993 kHz    440.620000 MHz (690 mm x 291 mm)
                 Hfront   48 Hsync  64 Hback   48 Hpol P
                 Vfront    3 Vsync   5 Vback   37 Vpol N
    DTD 5:  2560x1080  119.993464 Hz  64:27   134.993 kHz    367.180000 MHz (690 mm x 291 mm)
                 Hfront   48 Hsync  64 Hback   48 Hpol P
                 Vfront    3 Vsync   5 Vback   37 Vpol N
Checksum: 0x2f  Unused space in Extension Block: 1 byte

----------------

Warnings:

Block 1, CTA-861 Extension Block:
  Video Data Block: VIC 1 and the first DTD are not identical. Is this intended?
  Video Data Block: All VICs are in ascending order, and the first (preferred) VIC <= 4, is that intended?
EDID:
  Base EDID: Some timings are out of range of the Monitor Ranges:
    Vertical Freq: 25.000 - 190.000 Hz (Monitor: 48.000 - 190.000 Hz)
    Horizontal Freq: 28.125 - 213.750 kHz (Monitor: 54.000 - 187.000 kHz)

Failures:

Block 0, Base EDID:
  Basic Display Parameters & Features: sRGB is signaled, but the chromaticities do not match.
  Detailed Timing Descriptor #2: Invalid detailed timing descriptor ordering.
EDID:
  Extension Block 2 started with EDID header, ignoring Extension Blocks >= 2.
  CTA-861: Native progressive timings are a mix of several resolutions.

EDID conformity: FAIL
