edid-decode (hex):

00 ff ff ff ff ff ff 00 04 72 15 00 e8 05 40 81
0e 12 01 03 68 22 13 78 2e 1e 95 a3 55 48 98 27
15 50 54 bf ef 00 71 4f 81 c0 81 40 81 80 95 00
01 01 01 01 01 01 66 21 56 a8 51 00 1e 30 45 8f
3a 00 58 c1 10 00 00 1c 00 00 00 fd 00 32 4b 1e
50 10 00 0a 20 20 20 20 20 20 00 00 00 fc 00 41
63 65 72 20 58 31 36 33 57 0a 20 20 00 00 00 ff
00 4c 42 46 30 39 30 33 30 33 36 30 30 0a 00 ea

00 ff ff ff ff ff ff 00 04 72 15 00 e8 05 40 81
0e 12 01 03 68 22 13 78 2e 1e 95 a3 55 48 98 27
15 50 54 bf ef 00 71 4f 81 c0 81 40 81 80 95 00
01 01 01 01 01 01 66 21 56 a8 51 00 1e 30 45 8f
3a 00 58 c1 10 00 00 1c 00 00 00 fd 00 32 4b 1e
50 10 00 0a 20 20 20 20 20 20 00 00 00 fc 00 41
63 65 72 20 58 31 36 33 57 0a 20 20 00 00 00 ff
00 4c 42 46 30 39 30 33 30 33 36 30 30 0a 00 ea

----------------

Block 0, Base EDID:
  EDID Structure Version & Revision: 1.3
  Vendor & Product Identification:
    Manufacturer: ACR
    Model: 21
    Serial Number: ...
    Made in: week 14 of 2008
  Basic Display Parameters & Features:
    Analog display
    Signal Level Standard: 0.700 : 0.000 : 0.700 V p-p
    Blank level equals black level
    Sync: Separate
    Maximum image size: 34 cm x 19 cm
    Gamma: 2.20
    DPMS levels: Off
    RGB color display
    Default (sRGB) color space is primary color space
    First detailed timing is the preferred timing
  Color Characteristics:
    Red  : 0.6367, 0.3330
    Green: 0.2841, 0.5957
    Blue : 0.1542, 0.0830
    White: 0.3134, 0.3291
  Established Timings I & II:
    IBM     :   720x400    70.081663 Hz   9:5     31.467 kHz     28.320000 MHz
    DMT 0x04:   640x480    59.940476 Hz   4:3     31.469 kHz     25.175000 MHz
    Apple   :   640x480    66.666667 Hz   4:3     35.000 kHz     30.240000 MHz
    DMT 0x05:   640x480    72.808802 Hz   4:3     37.861 kHz     31.500000 MHz
    DMT 0x06:   640x480    75.000000 Hz   4:3     37.500 kHz     31.500000 MHz
    DMT 0x08:   800x600    56.250000 Hz   4:3     35.156 kHz     36.000000 MHz
    DMT 0x09:   800x600    60.316541 Hz   4:3     37.879 kHz     40.000000 MHz
    DMT 0x0a:   800x600    72.187572 Hz   4:3     48.077 kHz     50.000000 MHz
    DMT 0x0b:   800x600    75.000000 Hz   4:3     46.875 kHz     49.500000 MHz
    Apple   :   832x624    74.551266 Hz   4:3     49.726 kHz     57.284000 MHz
    DMT 0x10:  1024x768    60.003840 Hz   4:3     48.363 kHz     65.000000 MHz
    DMT 0x11:  1024x768    70.069359 Hz   4:3     56.476 kHz     75.000000 MHz
    DMT 0x12:  1024x768    75.028582 Hz   4:3     60.023 kHz     78.750000 MHz
    DMT 0x24:  1280x1024   75.024675 Hz   5:4     79.976 kHz    135.000000 MHz
  Standard Timings:
    DMT 0x15:  1152x864    75.000000 Hz   4:3     67.500 kHz    108.000000 MHz
    DMT 0x55:  1280x720    60.000000 Hz  16:9     45.000 kHz     74.250000 MHz
    DMT 0x20:  1280x960    60.000000 Hz   4:3     60.000 kHz    108.000000 MHz
    DMT 0x23:  1280x1024   60.019740 Hz   5:4     63.981 kHz    108.000000 MHz
    DMT 0x2f:  1440x900    59.887445 Hz  16:10    55.935 kHz    106.500000 MHz
  Detailed Timing Descriptors:
    DTD 1:  1366x768    59.856345 Hz 683:384   47.765 kHz     85.500000 MHz (344 mm x 193 mm)
                 Hfront   69 Hsync 143 Hback  212 Hpol N
                 Vfront    3 Vsync  10 Vback   17 Vpol P
    Display Range Limits:
      Monitor ranges (GTF): 50-75 Hz V, 30-80 kHz H, max dotclock 160 MHz
    Display Product Name: 'Acer X163W'
    Display Product Serial Number: ...
Checksum: 0xea

----------------

Failures:

Block 0, Base EDID:
  Basic Display Parameters & Features: sRGB is signaled, but the chromaticities do not match.
EDID:
  Extension Block 1 started with EDID header, ignoring Extension Blocks >= 1.

EDID conformity: FAIL
