edid-decode (hex):

00 ff ff ff ff ff ff 00 65 ab 68 4a 01 00 00 00
29 22 01 03 80 22 16 78 2c ee 91 a3 54 4c 99 26
0f 50 54 21 08 00 d1 00 d1 3c d1 c0 a9 c0 81 80
81 c0 81 40 81 00 ec db 40 a0 b0 08 34 70 30 20
36 00 56 dc 10 00 00 1a dd 68 00 a0 a0 40 2d 60
30 20 35 00 56 dc 10 00 00 1a 00 00 00 fc 00 45
4d 31 36 30 20 54 4f 55 43 48 0a 20 00 00 00 fd
00 30 78 0f d8 3c 00 0a 20 20 20 20 20 20 01 42

02 03 3f f2 48 90 01 02 04 13 1f 2f 3f e3 05 c3
01 23 09 1f 07 83 01 00 00 e5 0f 00 00 0c 00 67
03 0c 00 10 00 38 78 67 d8 5d c4 01 78 88 03 e6
06 05 01 62 62 00 68 1a 00 00 01 01 30 78 e6 56
5e 00 a0 a0 a0 29 50 30 20 35 00 56 dc 10 00 00
1a bc d1 00 a0 a0 40 2d 60 30 20 35 00 56 dc 10
00 00 1e 6f c2 00 a0 a0 a0 55 50 30 20 35 00 56
dc 10 00 00 1e 00 00 00 00 00 00 00 00 00 00 5f

00 ff ff ff ff ff ff 00 65 ab 68 4a 01 00 00 00
29 22 01 03 80 22 16 78 2c ee 91 a3 54 4c 99 26
0f 50 54 21 08 00 d1 00 d1 3c d1 c0 a9 c0 81 80
81 c0 81 40 81 00 ec db 40 a0 b0 08 34 70 30 20
36 00 56 dc 10 00 00 1a dd 68 00 a0 a0 40 2d 60
30 20 35 00 56 dc 10 00 00 1a 00 00 00 fc 00 45
4d 31 36 30 20 54 4f 55 43 48 0a 20 00 00 00 fd
00 30 78 0f d8 3c 00 0a 20 20 20 20 20 20 01 42

02 03 3f f2 48 90 01 02 04 13 1f 2f 3f e3 05 c3
01 23 09 1f 07 83 01 00 00 e5 0f 00 00 0c 00 67
03 0c 00 10 00 38 78 67 d8 5d c4 01 78 88 03 e6
06 05 01 62 62 00 68 1a 00 00 01 01 30 78 e6 56
5e 00 a0 a0 a0 29 50 30 20 35 00 56 dc 10 00 00
1a bc d1 00 a0 a0 40 2d 60 30 20 35 00 56 dc 10
00 00 1e 6f c2 00 a0 a0 a0 55 50 30 20 35 00 56
dc 10 00 00 1e 00 00 00 00 00 00 00 00 00 00 5f

----------------

Block 0, Base EDID:
  EDID Structure Version & Revision: 1.3
  Vendor & Product Identification:
    Manufacturer: YMK
    Model: 19048
    Serial Number: ...
    Made in: week 41 of 2024
  Basic Display Parameters & Features:
    Digital display
    Maximum image size: 34 cm x 22 cm
    Gamma: 2.20
    DPMS levels: Off
    RGB color display
    Default (sRGB) color space is primary color space
  Color Characteristics:
    Red  : 0.6396, 0.3300
    Green: 0.2998, 0.5996
    Blue : 0.1503, 0.0595
    White: 0.3125, 0.3291
  Established Timings I & II:
    DMT 0x04:   640x480    59.940476 Hz   4:3     31.469 kHz     25.175000 MHz
    DMT 0x09:   800x600    60.316541 Hz   4:3     37.879 kHz     40.000000 MHz
    DMT 0x10:  1024x768    60.003840 Hz   4:3     48.363 kHz     65.000000 MHz
  Standard Timings:
    DMT 0x45:  1920x1200   59.884600 Hz  16:10    74.556 kHz    193.250000 MHz
    GTF     :  1920x1200  119.999988 Hz  16:10   154.320 kHz    412.343000 MHz
    DMT 0x52:  1920x1080   60.000000 Hz  16:9     67.500 kHz    148.500000 MHz
    DMT 0x53:  1600x900    60.000000 Hz  16:9     60.000 kHz    108.000000 MHz (RB)
    DMT 0x23:  1280x1024   60.019740 Hz   5:4     63.981 kHz    108.000000 MHz
    DMT 0x55:  1280x720    60.000000 Hz  16:9     45.000 kHz     74.250000 MHz
    DMT 0x20:  1280x960    60.000000 Hz   4:3     60.000 kHz    108.000000 MHz
    DMT 0x1c:  1280x800    59.810326 Hz  16:10    49.702 kHz     83.500000 MHz
  Detailed Timing Descriptors:
    DTD 1:  2880x1800   99.998579 Hz  16:10   185.197 kHz    563.000000 MHz (342 mm x 220 mm)
                 Hfront   48 Hsync  32 Hback   80 Hpol P
                 Vfront    3 Vsync   6 Vback   43 Vpol N
    DTD 2:  2560x1600   59.996871 Hz  16:10    98.695 kHz    268.450000 MHz (342 mm x 220 mm)
                 Hfront   48 Hsync  32 Hback   80 Hpol P
                 Vfront    3 Vsync   5 Vback   37 Vpol N
    Display Product Name: 'EM160 TOUCH'
    Display Range Limits:
      Monitor ranges (GTF): 48-120 Hz V, 15-216 kHz H, max dotclock 600 MHz
  Extension blocks: 1
Checksum: 0x42

----------------

Block 1, CTA-861 Extension Block:
  Revision: 3
  Underscans IT Video Formats by default
  Basic audio support
  Supports YCbCr 4:4:4
  Supports YCbCr 4:2:2
  Native DTDs: 2
  Video Data Block:
    VIC  16:  1920x1080   60.000000 Hz  16:9     67.500 kHz    148.500000 MHz (native)
    VIC   1:   640x480    59.940476 Hz   4:3     31.469 kHz     25.175000 MHz
    VIC   2:   720x480    59.940060 Hz   4:3     31.469 kHz     27.000000 MHz
    VIC   4:  1280x720    60.000000 Hz  16:9     45.000 kHz     74.250000 MHz
    VIC  19:  1280x720    50.000000 Hz  16:9     37.500 kHz     74.250000 MHz
    VIC  31:  1920x1080   50.000000 Hz  16:9     56.250 kHz    148.500000 MHz
    VIC  47:  1280x720   120.000000 Hz  16:9     90.000 kHz    148.500000 MHz
    VIC  63:  1920x1080  120.000000 Hz  16:9    135.000 kHz    297.000000 MHz
  Colorimetry Data Block:
    xvYCC601
    xvYCC709
    BT2020YCC
    BT2020RGB
    Gamut Boundary Description Metadata Profile P0
  Audio Data Block:
    Linear PCM:
      Max channels: 2
      Supported sample rates (kHz): 96 88.2 48 44.1 32
      Supported sample sizes (bits): 24 20 16
  Speaker Allocation Data Block:
    FL/FR - Front Left/Right
  YCbCr 4:2:0 Capability Map Data Block:
    SVD Index 19 is out of range
    SVD Index 20 is out of range
  Vendor-Specific Data Block (HDMI), OUI 00-0C-03:
    Source physical address: 1.0.0.0
    DC_36bit
    DC_30bit
    DC_Y444
    Maximum TMDS clock: 600 MHz
  Vendor-Specific Data Block (HDMI Forum), OUI C4-5D-D8:
    Version: 1
    Maximum TMDS Character Rate: 600 MHz
    SCDC Present
    Supports scrambling for <= 340 Mcsc
    Supports 12-bits/component Deep Color 4:2:0 Pixel Encoding
    Supports 10-bits/component Deep Color 4:2:0 Pixel Encoding
  HDR Static Metadata Data Block:
    Electro optical transfer functions:
      Traditional gamma - SDR luminance range
      SMPTE ST2084
    Supported static metadata descriptors:
      Static metadata type 1
    Desired content max luminance: 98 (417.710 cd/m^2)
    Desired content max frame-average luminance: 98 (417.710 cd/m^2)
    Desired content min luminance: 0 (0.000 cd/m^2)
  Vendor-Specific Data Block (AMD), OUI 00-00-1A:
    Version: 1
    Flags 1: 0x01
      FreeSync Supported
    Minimum Refresh Rate: 48 Hz
    Maximum Refresh Rate: 120 Hz
    MCCS VCP Code: 0xe6
  Detailed Timing Descriptors:
    DTD 3:  2560x1440   59.950550 Hz  16:9     88.787 kHz    241.500000 MHz (342 mm x 220 mm)
                 Hfront   48 Hsync  32 Hback   80 Hpol P
                 Vfront    3 Vsync   5 Vback   33 Vpol N
    DTD 4:  2560x1600  119.998212 Hz  16:10   197.397 kHz    536.920000 MHz (342 mm x 220 mm)
                 Hfront   48 Hsync  32 Hback   80 Hpol P
                 Vfront    3 Vsync   5 Vback   37 Vpol P
    DTD 5:  2560x1440  119.997589 Hz  16:9    182.996 kHz    497.750000 MHz (342 mm x 220 mm)
                 Hfront   48 Hsync  32 Hback   80 Hpol P
                 Vfront    3 Vsync   5 Vback   77 Vpol P
Checksum: 0x5f  Unused space in Extension Block: 10 bytes

----------------

Warnings:

Block 0, Base EDID:
  Vendor & Product Identification: The serial number is one of the known dummy values, it should probably be set to 0.
Block 1, CTA-861 Extension Block:
  Video Data Block: VIC 16 and the first DTD are not identical. Is this intended?
  Detailed Timing Descriptor #3: Image size is 342x220 mm, but based on the picture AR it should be 342x192 mm.
  Detailed Timing Descriptor #5: Image size is 342x220 mm, but based on the picture AR it should be 342x192 mm.

Failures:

Block 0, Base EDID:
  Basic Display Parameters & Features: EDID 1.3 requires that the first detailed timing is the preferred timing.
Block 1, CTA-861 Extension Block:
  YCbCr 4:2:0 Capability Map Data Block: Max index 20 > 8 (#SVDs).
  Vendor-Specific Data Block (HDMI), OUI 00-0C-03: HDMI VSDB Max TMDS rate is > 340.
  Missing VCDB, needed for Set Selectable RGB Quantization to avoid interop issues.
EDID:
  Extension Block 2 started with EDID header, ignoring Extension Blocks >= 2.
  CTA-861: Native progressive timings are a mix of several resolutions.

EDID conformity: FAIL
