edid-decode (hex):

00 ff ff ff ff ff ff 00 06 af 3d 26 00 00 00 00
00 1b 01 04 95 1f 11 78 02 a2 b5 91 57 58 94 28
1c 50 54 00 00 00 01 01 01 01 01 01 01 01 01 01
01 01 01 01 01 01 84 3a 80 34 71 38 28 40 30 64
31 00 35 ad 10 00 00 1a d0 2e 80 34 71 38 28 40
30 64 31 00 35 ad 10 00 00 1a 00 00 00 fe 00 56
38 48 4b 39 14 42 31 34 30 48 41 4e 00 00 00 00
00 00 81 02 a8 00 11 00 00 0a 01 0a 20 20 00 d9

----------------

Block 0, Base EDID:
  EDID Structure Version & Revision: 1.4
  Vendor & Product Identification:
    Manufacturer: AUO
    Model: 9789
    Made in: 2017
  Basic Display Parameters & Features:
    Digital display
    Bits per primary color channel: 6
    DisplayPort interface
    Maximum image size: 31 cm x 17 cm
    Gamma: 2.20
    Supported color formats: RGB 4:4:4
    First detailed timing includes the native pixel format and preferred refresh rate
  Color Characteristics:
    Red  : 0.5683, 0.3417
    Green: 0.3437, 0.5800
    Blue : 0.1582, 0.1123
    White: 0.3134, 0.3291
  Established Timings I & II: none
  Standard Timings: none
  Detailed Timing Descriptors:
    DTD 1:  1920x1080   60.031418 Hz  16:9     67.235 kHz    149.800000 MHz (309 mm x 173 mm)
                 Hfront   48 Hsync 100 Hback  160 Hpol P
                 Vfront    3 Vsync   1 Vback   36 Vpol N
    DTD 2:  1920x1080   48.025135 Hz  16:9     53.788 kHz    119.840000 MHz (309 mm x 173 mm)
                 Hfront   48 Hsync 100 Hback  160 Hpol P
                 Vfront    3 Vsync   1 Vback   36 Vpol N
    Alphanumeric Data String: 'V8HK9.B140HAN'
    Manufacturer-Specified Display Descriptor (0x00): 00 00 00 00 81 02 a8 00 11 00 00 0a 01 0a 20 20 '..............  '
Checksum: 0xd9

----------------

Warnings:

Block 0, Base EDID:
  Alphanumeric Data String: Non-ASCII character 0x14 at position 5, can cause problems.
  Missing Display Product Name.

EDID conformity: PASS
