edid-decode (hex):

00 ff ff ff ff ff ff 00 22 70 00 00 00 00 00 00
18 1f 01 04 b5 50 22 78 fb d0 34 ab 50 43 a5 23
13 4e 54 bf ef 80 d1 40 d1 c0 b3 00 a9 40 a9 c0
81 80 81 00 81 c0 f5 7c 70 a0 d0 a0 29 50 30 20
35 00 1d 4e 31 00 00 1c 1a 36 80 a0 70 38 1f 40
30 20 25 00 1d 4e 31 00 00 1a 00 00 00 fd 00 30
90 de de 4e 01 0a 20 20 20 20 20 20 00 00 00 fc
00 48 47 33 34 32 50 43 42 0a 20 20 20 20 02 e7

02 03 37 f2 4f 01 02 04 10 11 12 13 1f 4d 4e 5a
5b 5f 60 61 23 09 7f 07 83 01 00 00 e3 05 e3 01
68 1a 00 00 01 01 30 90 00 e6 06 07 01 62 60 0e
e6 01 02 03 04 10 11 18 cd 70 90 d0 a0 19 50 30
20 35 00 1d 4e 31 00 00 1a 56 5e 00 a0 a0 a0 29
50 30 20 25 00 1d 4e 31 00 00 1e 43 41 b8 a0 60
a0 29 50 30 20 35 00 1d 4e 31 00 00 1c 00 00 00
00 00 00 00 00 00 00 00 00 00 00 00 00 00 00 c5

70 12 79 00 00 07 00 0a 08 81 00 00 00 00 00 00
00 00 03 01 28 ea f9 00 84 6f 0d 9f 00 2f 00 1f
00 9f 05 28 00 02 00 04 00 e6 2b 01 04 6f 0d 9f
00 2f 00 1f 00 9f 05 28 00 02 00 04 00 00 00 00
00 00 00 00 00 00 00 00 00 00 00 00 00 00 00 00
00 00 00 00 00 00 00 00 00 00 00 00 00 00 00 00
00 00 00 00 00 00 00 00 00 00 00 00 00 00 00 00
00 00 00 00 00 00 00 00 00 00 00 00 00 00 bc 90

00 ff ff ff ff ff ff 00 22 70 00 00 00 00 00 00
18 1f 01 04 b5 50 22 78 fb d0 34 ab 50 43 a5 23
13 4e 54 bf ef 80 d1 40 d1 c0 b3 00 a9 40 a9 c0
81 80 81 00 81 c0 f5 7c 70 a0 d0 a0 29 50 30 20
35 00 1d 4e 31 00 00 1c 1a 36 80 a0 70 38 1f 40
30 20 25 00 1d 4e 31 00 00 1a 00 00 00 fd 00 30
90 de de 4e 01 0a 20 20 20 20 20 20 00 00 00 fc
00 48 47 33 34 32 50 43 42 0a 20 20 20 20 02 e7

02 03 37 f2 4f 01 02 04 10 11 12 13 1f 4d 4e 5a
5b 5f 60 61 23 09 7f 07 83 01 00 00 e3 05 e3 01
68 1a 00 00 01 01 30 90 00 e6 06 07 01 62 60 0e
e6 01 02 03 04 10 11 18 cd 70 90 d0 a0 19 50 30
20 35 00 1d 4e 31 00 00 1a 56 5e 00 a0 a0 a0 29
50 30 20 25 00 1d 4e 31 00 00 1e 43 41 b8 a0 60
a0 29 50 30 20 35 00 1d 4e 31 00 00 1c 00 00 00
00 00 00 00 00 00 00 00 00 00 00 00 00 00 00 c5

70 12 79 00 00 07 00 0a 08 81 00 00 00 00 00 00
00 00 03 01 28 ea f9 00 84 6f 0d 9f 00 2f 00 1f
00 9f 05 28 00 02 00 04 00 e6 2b 01 04 6f 0d 9f
00 2f 00 1f 00 9f 05 28 00 02 00 04 00 00 00 00
00 00 00 00 00 00 00 00 00 00 00 00 00 00 00 00
00 00 00 00 00 00 00 00 00 00 00 00 00 00 00 00
00 00 00 00 00 00 00 00 00 00 00 00 00 00 00 00
00 00 00 00 00 00 00 00 00 00 00 00 00 00 bc 90

----------------

Block 0, Base EDID:
  EDID Structure Version & Revision: 1.4
  Vendor & Product Identification:
    Manufacturer: HSP
    Model: 0
    Made in: week 24 of 2021
  Basic Display Parameters & Features:
    Digital display
    Bits per primary color channel: 10
    DisplayPort interface
    Maximum image size: 80 cm x 34 cm
    Gamma: 2.20
    DPMS levels: Standby Suspend Off
    Supported color formats: RGB 4:4:4, YCrCb 4:4:4, YCrCb 4:2:2
    First detailed timing includes the native pixel format and preferred refresh rate
    Display supports continuous frequencies
  Color Characteristics:
    Red  : 0.6708, 0.3134
    Green: 0.2617, 0.6445
    Blue : 0.1367, 0.0771
    White: 0.3056, 0.3281
  Established Timings I & II:
    IBM     :   720x400    70.081663 Hz   9:5     31.467 kHz     28.320000 MHz
    DMT 0x04:   640x480    59.940476 Hz   4:3     31.469 kHz     25.175000 MHz
    Apple   :   640x480    66.666667 Hz   4:3     35.000 kHz     30.240000 MHz
    DMT 0x05:   640x480    72.808802 Hz   4:3     37.861 kHz     31.500000 MHz
    DMT 0x06:   640x480    75.000000 Hz   4:3     37.500 kHz     31.500000 MHz
    DMT 0x08:   800x600    56.250000 Hz   4:3     35.156 kHz     36.000000 MHz
    DMT 0x09:   800x600    60.316541 Hz   4:3     37.879 kHz     40.000000 MHz
    DMT 0x0a:   800x600    72.187572 Hz   4:3     48.077 kHz     50.000000 MHz
    DMT 0x0b:   800x600    75.000000 Hz   4:3     46.875 kHz     49.500000 MHz
    Apple   :   832x624    74.551266 Hz   4:3     49.726 kHz     57.284000 MHz
    DMT 0x10:  1024x768    60.003840 Hz   4:3     48.363 kHz     65.000000 MHz
    DMT 0x11:  1024x768    70.069359 Hz   4:3     56.476 kHz     75.000000 MHz
    DMT 0x12:  1024x768    75.028582 Hz   4:3     60.023 kHz     78.750000 MHz
    DMT 0x24:  1280x1024   75.024675 Hz   5:4     79.976 kHz    135.000000 MHz
    Apple   :  1152x870    75.061550 Hz 192:145   68.681 kHz    100.000000 MHz
  Standard Timings:
    DMT 0x49:  1920x1440   60.000000 Hz   4:3     90.000 kHz    234.000000 MHz
    DMT 0x52:  1920x1080   60.000000 Hz  16:9     67.500 kHz    148.500000 MHz
    DMT 0x3a:  1680x1050   59.954250 Hz  16:10    65.290 kHz    146.250000 MHz
    DMT 0x33:  1600x1200   60.000000 Hz   4:3     75.000 kHz    162.000000 MHz
    DMT 0x53:  1600x900    60.000000 Hz  16:9     60.000 kHz    108.000000 MHz (RB)
    DMT 0x23:  1280x1024   60.019740 Hz   5:4     63.981 kHz    108.000000 MHz
    DMT 0x1c:  1280x800    59.810326 Hz  16:10    49.702 kHz     83.500000 MHz
    DMT 0x55:  1280x720    60.000000 Hz  16:9     45.000 kHz     74.250000 MHz
  Detailed Timing Descriptors:
    DTD 1:  3440x1440   59.998875 Hz  43:18    88.858 kHz    319.890000 MHz (797 mm x 334 mm)
                 Hfront   48 Hsync  32 Hback   80 Hpol N
                 Vfront    3 Vsync   5 Vback   33 Vpol P
    DTD 2:  1920x1080   59.933878 Hz  16:9     66.587 kHz    138.500000 MHz (797 mm x 334 mm)
                 Hfront   48 Hsync  32 Hback   80 Hpol P
                 Vfront    2 Vsync   5 Vback   24 Vpol N
    Display Range Limits:
      Monitor ranges (Range Limits Only): 48-144 Hz V, 222-222 kHz H, max dotclock 780 MHz
    Display Product Name: 'HG342PCB'
  Extension blocks: 2
Checksum: 0xe7

----------------

Block 1, CTA-861 Extension Block:
  Revision: 3
  Underscans IT Video Formats by default
  Basic audio support
  Supports YCbCr 4:4:4
  Supports YCbCr 4:2:2
  Native DTDs: 2
  Video Data Block:
    VIC   1:   640x480    59.940476 Hz   4:3     31.469 kHz     25.175000 MHz
    VIC   2:   720x480    59.940060 Hz   4:3     31.469 kHz     27.000000 MHz
    VIC   4:  1280x720    60.000000 Hz  16:9     45.000 kHz     74.250000 MHz
    VIC  16:  1920x1080   60.000000 Hz  16:9     67.500 kHz    148.500000 MHz
    VIC  17:   720x576    50.000000 Hz   4:3     31.250 kHz     27.000000 MHz
    VIC  18:   720x576    50.000000 Hz  16:9     31.250 kHz     27.000000 MHz
    VIC  19:  1280x720    50.000000 Hz  16:9     37.500 kHz     74.250000 MHz
    VIC  31:  1920x1080   50.000000 Hz  16:9     56.250 kHz    148.500000 MHz
    VIC  77:  1920x1080  100.000000 Hz  64:27   112.500 kHz    297.000000 MHz
    VIC  78:  1920x1080  120.000000 Hz  64:27   135.000 kHz    297.000000 MHz
    VIC  90:  2560x1080   60.000000 Hz  64:27    66.000 kHz    198.000000 MHz
    VIC  91:  2560x1080  100.000000 Hz  64:27   125.000 kHz    371.250000 MHz
    VIC  95:  3840x2160   30.000000 Hz  16:9     67.500 kHz    297.000000 MHz
    VIC  96:  3840x2160   50.000000 Hz  16:9    112.500 kHz    594.000000 MHz
    VIC  97:  3840x2160   60.000000 Hz  16:9    135.000 kHz    594.000000 MHz
  Audio Data Block:
    Linear PCM:
      Max channels: 2
      Supported sample rates (kHz): 192 176.4 96 88.2 48 44.1 32
      Supported sample sizes (bits): 24 20 16
  Speaker Allocation Data Block:
    FL/FR - Front Left/Right
  Colorimetry Data Block:
    xvYCC601
    xvYCC709
    BT2020cYCC
    BT2020YCC
    BT2020RGB
    Gamut Boundary Description Metadata Profile P0
  Vendor-Specific Data Block (AMD), OUI 00-00-1A:
    Version: 1
    Flags 1: 0x01
      FreeSync Supported
    Minimum Refresh Rate: 48 Hz
    Maximum Refresh Rate: 144 Hz
  HDR Static Metadata Data Block:
    Electro optical transfer functions:
      Traditional gamma - SDR luminance range
      Traditional gamma - HDR luminance range
      SMPTE ST2084
    Supported static metadata descriptors:
      Static metadata type 1
    Desired content max luminance: 98 (417.710 cd/m^2)
    Desired content max frame-average luminance: 96 (400.000 cd/m^2)
    Desired content min luminance: 14 (0.013 cd/m^2)
  Vendor-Specific Video Data Block, OUI 04-03-02:
    10 11                                           '..'
  Detailed Timing Descriptors:
    DTD 3:  3440x1440   99.996953 Hz  43:18   146.496 kHz    525.040000 MHz (797 mm x 334 mm)
                 Hfront   48 Hsync  32 Hback   64 Hpol P
                 Vfront    3 Vsync   5 Vback   17 Vpol N
    DTD 4:  2560x1440   59.950550 Hz  16:9     88.787 kHz    241.500000 MHz (797 mm x 334 mm)
                 Hfront   48 Hsync  32 Hback   80 Hpol P
                 Vfront    2 Vsync   5 Vback   34 Vpol P
    DTD 5:  1720x1440   60.004741 Hz  43:36    88.867 kHz    167.070000 MHz (797 mm x 334 mm)
                 Hfront   48 Hsync  32 Hback   80 Hpol N
                 Vfront    3 Vsync   5 Vback   33 Vpol P
Checksum: 0xc5  Unused space in Extension Block: 18 bytes

----------------

Block 2, DisplayID Extension Block:
  Version: 1.2
  Extension Count: 0
  Display Product Type: Extension Section
  Supported Timing Modes Type 1 - VESA DMT Timings Data Block:
    DMT 0x04:   640x480    59.940476 Hz   4:3     31.469 kHz     25.175000 MHz
    DMT 0x09:   800x600    60.316541 Hz   4:3     37.879 kHz     40.000000 MHz
    DMT 0x10:  1024x768    60.003840 Hz   4:3     48.363 kHz     65.000000 MHz
  Video Timing Modes Type 1 - Detailed Timings Data Block:
    DTD:  3440x1440  119.999625 Hz  16:9    177.719 kHz    639.790000 MHz (aspect 16:9, no 3D stereo, preferred)
               Hfront   48 Hsync  32 Hback   80 Hpol N
               Vfront    3 Vsync   5 Vback   33 Vpol N
    DTD:  3440x1440  143.999925 Hz  16:9    213.264 kHz    767.750000 MHz (aspect 16:9, no 3D stereo)
               Hfront   48 Hsync  32 Hback   80 Hpol N
               Vfront    3 Vsync   5 Vback   33 Vpol N
  Checksum: 0xbc
Checksum: 0x90

----------------

Warnings:

Block 0, Base EDID:
  Detailed Timing Descriptor #2: Image size is 797x334 mm, but based on the picture AR it should be 593x334 mm.
Block 1, CTA-861 Extension Block:
  Video Data Block: VIC 1 and the first DTD are not identical. Is this intended?
  Video Data Block: All VICs are in ascending order, and the first (preferred) VIC <= 4, is that intended?
  Colorimetry Data Block: Set the sRGB colorimetry bit to avoid interop issues.
  Detailed Timing Descriptor #4: Image size is 797x334 mm, but based on the picture AR it should be 593x334 mm.
  Detailed Timing Descriptor #5: Image size is 797x334 mm, but based on the picture AR it should be 398x334 mm.
EDID:
  Base EDID: Some timings are out of range of the Monitor Ranges:
    Vertical Freq: 30.000 - 144.000 Hz (Monitor: 48.000 - 144.000 Hz)
    Horizontal Freq: 31.250 - 213.263 kHz (Monitor: 222.000 - 222.000 kHz)

Failures:

Block 1, CTA-861 Extension Block:
  Missing VCDB, needed for Set Selectable RGB Quantization to avoid interop issues.
Block 2, DisplayID Extension Block:
  DisplayID Base Block has no product type.
EDID:
  Extension Block 3 started with EDID header, ignoring Extension Blocks >= 3.
  CTA-861: Native progressive timings are a mix of several resolutions.

EDID conformity: FAIL
