edid-decode (hex):

00 ff ff ff ff ff ff 00 1a 6e 41 00 01 01 01 01
1b 20 01 03 81 3a 21 78 ef e2 9f a7 54 4e 9d 26
0f 4c 55 af cf fc 31 4a a9 40 81 80 d1 c0 81 c0
01 01 01 01 01 01 02 3a 80 18 71 38 2d 40 28 40
82 08 c0 6c 00 00 00 1e ee 32 40 a0 60 b0 23 40
30 20 24 00 40 44 21 00 00 00 00 00 00 fd 00 2d
56 19 50 11 00 0a 20 20 20 20 20 20 00 00 00 fc
00 46 53 2d 50 32 36 30 34 44 0a 20 20 20 00 c1

00 ff ff ff ff ff ff 00 1a 6e 41 00 01 01 01 01
1b 20 01 03 81 3a 21 78 ef e2 9f a7 54 4e 9d 26
0f 4c 55 af cf fc 31 4a a9 40 81 80 d1 c0 81 c0
01 01 01 01 01 01 02 3a 80 18 71 38 2d 40 28 40
82 08 c0 6c 00 00 00 1e ee 32 40 a0 60 b0 23 40
30 20 24 00 40 44 21 00 00 00 00 00 00 fd 00 2d
56 19 50 11 00 0a 20 20 20 20 20 20 00 00 00 fc
00 46 53 2d 50 32 36 30 34 44 0a 20 20 20 00 c1

----------------

Block 0, Base EDID:
  EDID Structure Version & Revision: 1.3
  Vendor & Product Identification:
    Manufacturer: FSN
    Model: 65
    Serial Number: ...
    Made in: week 27 of 2022
  Basic Display Parameters & Features:
    Digital display
    DFP 1.x compatible TMDS
    Maximum image size: 58 cm x 33 cm
    Gamma: 2.20
    DPMS levels: Standby Suspend Off
    RGB color display
    Default (sRGB) color space is primary color space
    First detailed timing is the preferred timing
    Supports GTF timings within operating range
  Color Characteristics:
    Red  : 0.6552, 0.3300
    Green: 0.3046, 0.6152
    Blue : 0.1503, 0.0595
    White: 0.2998, 0.3349
  Established Timings I & II:
    IBM     :   720x400    70.081663 Hz   9:5     31.467 kHz     28.320000 MHz
    DMT 0x04:   640x480    59.940476 Hz   4:3     31.469 kHz     25.175000 MHz
    DMT 0x05:   640x480    72.808802 Hz   4:3     37.861 kHz     31.500000 MHz
    DMT 0x06:   640x480    75.000000 Hz   4:3     37.500 kHz     31.500000 MHz
    DMT 0x08:   800x600    56.250000 Hz   4:3     35.156 kHz     36.000000 MHz
    DMT 0x09:   800x600    60.316541 Hz   4:3     37.879 kHz     40.000000 MHz
    DMT 0x0a:   800x600    72.187572 Hz   4:3     48.077 kHz     50.000000 MHz
    DMT 0x0b:   800x600    75.000000 Hz   4:3     46.875 kHz     49.500000 MHz
    DMT 0x10:  1024x768    60.003840 Hz   4:3     48.363 kHz     65.000000 MHz
    DMT 0x11:  1024x768    70.069359 Hz   4:3     56.476 kHz     75.000000 MHz
    DMT 0x12:  1024x768    75.028582 Hz   4:3     60.023 kHz     78.750000 MHz
    DMT 0x24:  1280x1024   75.024675 Hz   5:4     79.976 kHz    135.000000 MHz
    Apple   :  1152x870    75.061550 Hz 192:145   68.681 kHz    100.000000 MHz
  Standard Timings:
    GTF     :   640x480    70.000000 Hz   4:3     35.000 kHz     28.560000 MHz
    DMT 0x33:  1600x1200   60.000000 Hz   4:3     75.000 kHz    162.000000 MHz
    DMT 0x23:  1280x1024   60.019740 Hz   5:4     63.981 kHz    108.000000 MHz
    DMT 0x52:  1920x1080   60.000000 Hz  16:9     67.500 kHz    148.500000 MHz
    DMT 0x55:  1280x720    60.000000 Hz  16:9     45.000 kHz     74.250000 MHz
  Detailed Timing Descriptors:
    DTD 1:  1920x1080   60.000000 Hz  16:9     67.500 kHz    148.500000 MHz (192 mm x 108 mm)
                 Hfront   40 Hsync  64 Hback  176 Hpol P
                 Vfront   40 Vsync   2 Vback    3 Vpol P
    DTD 2:  1600x1200   59.983438 Hz   4:3     74.080 kHz    130.380000 MHz (analog composite, sync-on-green, 576 mm x 324 mm)
                 Hfront   48 Hsync  32 Hback   80 Hpol N
                 Vfront    2 Vsync   4 Vback   29 Vpol N
    Display Range Limits:
      Monitor ranges (GTF): 45-86 Hz V, 25-80 kHz H, max dotclock 170 MHz
    Display Product Name: 'FS-P2604D'
Checksum: 0xc1

----------------

Block 1, Unknown EDID Extension Block 0x00:
  00 ff ff ff ff ff ff 00 1a 6e 41 00 01 01 01 01 '.........nA.....'
  1b 20 01 03 81 3a 21 78 ef e2 9f a7 54 4e 9d 26 '. ...:!x....TN.&'
  0f 4c 55 af cf fc 31 4a a9 40 81 80 d1 c0 81 c0 '.LU...1J.@......'
  01 01 01 01 01 01 02 3a 80 18 71 38 2d 40 28 40 '.......:..q8-@(@'
  82 08 c0 6c 00 00 00 1e ee 32 40 a0 60 b0 23 40 '...l.....2@.`.#@'
  30 20 24 00 40 44 21 00 00 00 00 00 00 fd 00 2d '0 $.@D!........-'
  56 19 50 11 00 0a 20 20 20 20 20 20 00 00 00 fc 'V.P...      ....'
  00 46 53 2d 50 32 36 30 34 44 0a 20 20 20 00 c1 '.FS-P2604D.   ..'
Checksum: 0xc1

----------------

Warnings:

Block 0, Base EDID:
  Vendor & Product Identification: The serial number is one of the known dummy values, it should probably be set to 0.
  Detailed Timing Descriptor #1: DTD is similar but not identical to VIC 16.
  Detailed Timing Descriptor #2: Image size is 576x324 mm, but based on the picture AR it should be 576x432 mm.

Failures:

Block 0, Base EDID:
  Basic Display Parameters & Features: sRGB is signaled, but the chromaticities do not match.
  Detailed Timing Descriptor #1: Mismatch of image size 192x108 mm vs display size 580x330 mm.
Block 1, Base EDID:
  Unknown Extension Block.
EDID:
  Base EDID: EDID specified 0 extension block(s), but found 1 extension block(s).

EDID conformity: FAIL
