edid-decode (hex):

00 ff ff ff ff ff ff 00 05 f0 a5 06 01 01 01 01
1a 1e 01 03 68 2b 18 78 2a 6c a0 a8 52 45 98 23
19 4c 57 bf ef 00 81 80 81 40 81 c0 01 01 01 01
01 01 01 01 01 01 66 21 56 aa 51 00 1e 30 46 90
33 00 b2 ec 10 00 00 1e 00 00 00 fd 00 32 4c 1e
53 09 00 0a 20 20 20 20 20 20 00 00 00 fc 00 32
30 43 48 31 51 0a 20 20 20 20 20 20 00 00 00 ff
00 30 32 36 30 31 35 42 41 33 4c 41 4a 00 00 b3

00 ff ff ff ff ff ff 00 05 f0 a5 06 01 01 01 01
1a 1e 01 03 68 2b 18 78 2a 6c a0 a8 52 45 98 23
19 4c 57 bf ef 00 81 80 81 40 81 c0 01 01 01 01
01 01 01 01 01 01 66 21 56 aa 51 00 1e 30 46 90
33 00 b2 ec 10 00 00 1e 00 00 00 fd 00 32 4c 1e
53 09 00 0a 20 20 20 20 20 20 00 00 00 fc 00 32
30 43 48 31 51 0a 20 20 20 20 20 20 00 00 00 ff
00 30 32 36 30 31 35 42 41 33 4c 41 4a 00 00 b3

----------------

Block 0, Base EDID:
  EDID Structure Version & Revision: 1.3
  Vendor & Product Identification:
    Manufacturer: AOP
    Model: 1701
    Serial Number: ...
    Made in: week 26 of 2020
  Basic Display Parameters & Features:
    Analog display
    Signal Level Standard: 0.700 : 0.000 : 0.700 V p-p
    Blank level equals black level
    Sync: Separate
    Maximum image size: 43 cm x 24 cm
    Gamma: 2.20
    DPMS levels: Off
    RGB color display
    First detailed timing is the preferred timing
  Color Characteristics:
    Red  : 0.6572, 0.3222
    Green: 0.2724, 0.5937
    Blue : 0.1386, 0.0996
    White: 0.2968, 0.3398
  Established Timings I & II:
    IBM     :   720x400    70.081663 Hz   9:5     31.467 kHz     28.320000 MHz
    DMT 0x04:   640x480    59.940476 Hz   4:3     31.469 kHz     25.175000 MHz
    Apple   :   640x480    66.666667 Hz   4:3     35.000 kHz     30.240000 MHz
    DMT 0x05:   640x480    72.808802 Hz   4:3     37.861 kHz     31.500000 MHz
    DMT 0x06:   640x480    75.000000 Hz   4:3     37.500 kHz     31.500000 MHz
    DMT 0x08:   800x600    56.250000 Hz   4:3     35.156 kHz     36.000000 MHz
    DMT 0x09:   800x600    60.316541 Hz   4:3     37.879 kHz     40.000000 MHz
    DMT 0x0a:   800x600    72.187572 Hz   4:3     48.077 kHz     50.000000 MHz
    DMT 0x0b:   800x600    75.000000 Hz   4:3     46.875 kHz     49.500000 MHz
    Apple   :   832x624    74.551266 Hz   4:3     49.726 kHz     57.284000 MHz
    DMT 0x10:  1024x768    60.003840 Hz   4:3     48.363 kHz     65.000000 MHz
    DMT 0x11:  1024x768    70.069359 Hz   4:3     56.476 kHz     75.000000 MHz
    DMT 0x12:  1024x768    75.028582 Hz   4:3     60.023 kHz     78.750000 MHz
    DMT 0x24:  1280x1024   75.024675 Hz   5:4     79.976 kHz    135.000000 MHz
  Standard Timings:
    DMT 0x23:  1280x1024   60.019740 Hz   5:4     63.981 kHz    108.000000 MHz
    DMT 0x20:  1280x960    60.000000 Hz   4:3     60.000 kHz    108.000000 MHz
    DMT 0x55:  1280x720    60.000000 Hz  16:9     45.000 kHz     74.250000 MHz
  Detailed Timing Descriptors:
    DTD 1:  1366x768    59.789541 Hz 683:384   47.712 kHz     85.500000 MHz (434 mm x 236 mm)
                 Hfront   70 Hsync 144 Hback  212 Hpol P
                 Vfront    3 Vsync   3 Vback   24 Vpol P
    Display Range Limits:
      Monitor ranges (GTF): 50-76 Hz V, 30-83 kHz H, max dotclock 90 MHz
    Display Product Name: '20CH1Q'
    Display Product Serial Number: ...
Checksum: 0xb3

----------------

Warnings:

Block 0, Base EDID:
  Vendor & Product Identification: The serial number is one of the known dummy values, it should probably be set to 0.
  Detailed Timing Descriptor #1: DTD is similar but not identical to DMT 0x51.
EDID:
  Base EDID: Some timings are out of range of the Monitor Ranges:
    Maximum Clock: 135.000 MHz (Monitor: 90.000 MHz)

Failures:

Block 0, Base EDID:
  Display Product Serial Number: ...
EDID:
  Extension Block 1 started with EDID header, ignoring Extension Blocks >= 1.

EDID conformity: FAIL
