edid-decode (hex):

00 ff ff ff ff ff ff 00 0d 04 30 00 01 00 00 00
01 18 01 03 80 8b 4e 78 2a 50 1f a3 59 49 97 24
bb 4f 53 21 08 00 81 80 81 c0 81 00 d1 c0 61 7c
81 fc 01 01 01 01 04 74 00 7c f6 70 5a 80 fc 58
8a 00 72 10 53 00 00 1e 02 3a 80 18 71 38 2d 40
58 2c 45 00 72 10 53 00 00 1e 00 00 00 fc 00 43
48 55 44 0a 20 20 20 20 20 20 20 20 00 00 00 fd
00 17 4c 0f 50 1e 00 0a 20 20 20 20 20 20 01 88

02 03 32 f2 51 01 02 03 04 05 07 90 12 13 14 16
9f 20 22 06 11 15 29 09 17 07 15 07 50 57 07 00
83 01 00 00 6d 03 0c 00 10 00 b8 3c 20 00 60 01
02 03 16 22 56 9e 51 00 31 30 3e 90 a5 00 72 10
53 00 00 18 02 3a 80 d0 72 38 2d 40 10 2c 45 80
72 10 53 00 00 1e 02 3a 80 18 71 38 2d 40 58 28
45 00 72 10 53 00 00 1e 0e 1f 00 80 51 00 1e 30
50 80 37 00 72 10 53 00 00 1c 00 00 00 00 00 25

00 ff ff ff ff ff ff 00 0d 04 30 00 01 00 00 00
01 18 01 03 80 8b 4e 78 2a 50 1f a3 59 49 97 24
bb 4f 53 21 08 00 81 80 81 c0 81 00 d1 c0 61 7c
81 fc 01 01 01 01 04 74 00 7c f6 70 5a 80 fc 58
8a 00 72 10 53 00 00 1e 02 3a 80 18 71 38 2d 40
58 2c 45 00 72 10 53 00 00 1e 00 00 00 fc 00 43
48 55 44 0a 20 20 20 20 20 20 20 20 00 00 00 fd
00 17 4c 0f 50 1e 00 0a 20 20 20 20 20 20 01 88

02 03 32 f2 51 01 02 03 04 05 07 90 12 13 14 16
9f 20 22 06 11 15 29 09 17 07 15 07 50 57 07 00
83 01 00 00 6d 03 0c 00 10 00 b8 3c 20 00 60 01
02 03 16 22 56 9e 51 00 31 30 3e 90 a5 00 72 10
53 00 00 18 02 3a 80 d0 72 38 2d 40 10 2c 45 80
72 10 53 00 00 1e 02 3a 80 18 71 38 2d 40 58 28
45 00 72 10 53 00 00 1e 0e 1f 00 80 51 00 1e 30
50 80 37 00 72 10 53 00 00 1c 00 00 00 00 00 25

----------------

Block 0, Base EDID:
  EDID Structure Version & Revision: 1.3
  Vendor & Product Identification:
    Manufacturer: CHD
    Model: 48
    Serial Number: ...
    Made in: week 1 of 2014
  Basic Display Parameters & Features:
    Digital display
    Maximum image size: 139 cm x 78 cm
    Gamma: 2.20
    DPMS levels: Off
    RGB color display
    First detailed timing is the preferred timing
  Color Characteristics:
    Red  : 0.6376, 0.3486
    Green: 0.2851, 0.5898
    Blue : 0.1406, 0.7314
    White: 0.3115, 0.3271
  Established Timings I & II:
    DMT 0x04:   640x480    59.940476 Hz   4:3     31.469 kHz     25.175000 MHz
    DMT 0x09:   800x600    60.316541 Hz   4:3     37.879 kHz     40.000000 MHz
    DMT 0x10:  1024x768    60.003840 Hz   4:3     48.363 kHz     65.000000 MHz
  Standard Timings:
    DMT 0x23:  1280x1024   60.019740 Hz   5:4     63.981 kHz    108.000000 MHz
    DMT 0x55:  1280x720    60.000000 Hz  16:9     45.000 kHz     74.250000 MHz
    DMT 0x1c:  1280x800    59.810326 Hz  16:10    49.702 kHz     83.500000 MHz
    DMT 0x52:  1920x1080   60.000000 Hz  16:9     67.500 kHz    148.500000 MHz
    GTF     :  1024x768   119.999931 Hz   4:3     98.760 kHz    139.054000 MHz
    GTF     :  1280x720   119.999881 Hz  16:9     92.640 kHz    161.564000 MHz
  Detailed Timing Descriptors:
    DTD  1:  3840x2160   24.000000 Hz  16:9     54.000 kHz    297.000000 MHz (1394 mm x 784 mm)
                  Hfront  252 Hsync  88 Hback 1320 Hpol P
                  Vfront    8 Vsync  10 Vback   72 Vpol P
    DTD  2:  1920x1080   60.000000 Hz  16:9     67.500 kHz    148.500000 MHz (1394 mm x 784 mm)
                  Hfront   88 Hsync  44 Hback  148 Hpol P
                  Vfront    4 Vsync   5 Vback   36 Vpol P
    Display Product Name: 'CHUD'
    Display Range Limits:
      Monitor ranges (GTF): 23-76 Hz V, 15-80 kHz H, max dotclock 300 MHz
  Extension blocks: 1
Checksum: 0x88

----------------

Block 1, CTA-861 Extension Block:
  Revision: 3
  Underscans IT Video Formats by default
  Basic audio support
  Supports YCbCr 4:4:4
  Supports YCbCr 4:2:2
  Native detailed modes: 2
  Video Data Block:
    VIC   1:   640x480    59.940476 Hz   4:3     31.469 kHz     25.175000 MHz
    VIC   2:   720x480    59.940060 Hz   4:3     31.469 kHz     27.000000 MHz
    VIC   3:   720x480    59.940060 Hz  16:9     31.469 kHz     27.000000 MHz
    VIC   4:  1280x720    60.000000 Hz  16:9     45.000 kHz     74.250000 MHz
    VIC   5:  1920x1080i  60.000000 Hz  16:9     33.750 kHz     74.250000 MHz
    VIC   7:  1440x480i   59.940060 Hz  16:9     15.734 kHz     27.000000 MHz
    VIC  16:  1920x1080   60.000000 Hz  16:9     67.500 kHz    148.500000 MHz (native)
    VIC  18:   720x576    50.000000 Hz  16:9     31.250 kHz     27.000000 MHz
    VIC  19:  1280x720    50.000000 Hz  16:9     37.500 kHz     74.250000 MHz
    VIC  20:  1920x1080i  50.000000 Hz  16:9     28.125 kHz     74.250000 MHz
    VIC  22:  1440x576i   50.000000 Hz  16:9     15.625 kHz     27.000000 MHz
    VIC  31:  1920x1080   50.000000 Hz  16:9     56.250 kHz    148.500000 MHz (native)
    VIC  32:  1920x1080   24.000000 Hz  16:9     27.000 kHz     74.250000 MHz
    VIC  34:  1920x1080   30.000000 Hz  16:9     33.750 kHz     74.250000 MHz
    VIC   6:  1440x480i   59.940060 Hz   4:3     15.734 kHz     27.000000 MHz
    VIC  17:   720x576    50.000000 Hz   4:3     31.250 kHz     27.000000 MHz
    VIC  21:  1440x576i   50.000000 Hz   4:3     15.625 kHz     27.000000 MHz
  Audio Data Block:
    Linear PCM:
      Max channels: 2
      Supported sample rates (kHz): 96 48 44.1 32
      Supported sample sizes (bits): 24 20 16
    AC-3:
      Max channels: 6
      Supported sample rates (kHz): 48 44.1 32
      Maximum bit rate: 640 kb/s
    Enhanced AC-3 (DD+):
      Max channels: 8
      Supported sample rates (kHz): 48 44.1 32
  Speaker Allocation Data Block:
    FL/FR - Front Left/Right
  Vendor-Specific Data Block (HDMI), OUI 00-0C-03:
    Source physical address: 1.0.0.0
    Supports_AI
    DC_36bit
    DC_30bit
    DC_Y444
    Maximum TMDS clock: 300 MHz
    Extended HDMI video details:
      HDMI VICs:
        HDMI VIC 1:  3840x2160   30.000000 Hz  16:9     67.500 kHz    297.000000 MHz
        HDMI VIC 2:  3840x2160   25.000000 Hz  16:9     56.250 kHz    297.000000 MHz
        HDMI VIC 3:  3840x2160   24.000000 Hz  16:9     54.000 kHz    297.000000 MHz
  Detailed Timing Descriptors:
    DTD  3:  1366x768    60.003026 Hz 683:384   49.022 kHz     87.260000 MHz (1394 mm x 784 mm)
                  Hfront   62 Hsync 144 Hback  208 Hpol N
                  Vfront   10 Vsync   5 Vback   34 Vpol N
    DTD  4:  1920x1080   50.000000 Hz  16:9     56.250 kHz    148.500000 MHz (1394 mm x 784 mm)
                  Hfront  528 Hsync  44 Hback  148 Hpol P
                  Vfront    4 Vsync   5 Vback   36 Vpol P
    DTD  5:  1920x1080   60.000000 Hz  16:9     67.500 kHz    148.500000 MHz (1394 mm x 784 mm)
                  Hfront   88 Hsync  40 Hback  152 Hpol P
                  Vfront    4 Vsync   5 Vback   36 Vpol P
    DTD  6:  1280x768    59.870228 Hz   5:3     47.776 kHz     79.500000 MHz (1394 mm x 784 mm)
                  Hfront   80 Hsync 128 Hback  176 Hpol N
                  Vfront    3 Vsync   7 Vback   20 Vpol P
Checksum: 0x25  Unused space in Extension Block: 5 bytes

----------------

Block 2, Unknown EDID Extension Block 0x00:
  00 ff ff ff ff ff ff 00 0d 04 30 00 01 00 00 00 '..........0.....'
  01 18 01 03 80 8b 4e 78 2a 50 1f a3 59 49 97 24 '......Nx*P..YI.$'
  bb 4f 53 21 08 00 81 80 81 c0 81 00 d1 c0 61 7c '.OS!..........a|'
  81 fc 01 01 01 01 04 74 00 7c f6 70 5a 80 fc 58 '.......t.|.pZ..X'
  8a 00 72 10 53 00 00 1e 02 3a 80 18 71 38 2d 40 '..r.S....:..q8-@'
  58 2c 45 00 72 10 53 00 00 1e 00 00 00 fc 00 43 'X,E.r.S........C'
  48 55 44 0a 20 20 20 20 20 20 20 20 00 00 00 fd 'HUD.        ....'
  00 17 4c 0f 50 1e 00 0a 20 20 20 20 20 20 01 88 '..L.P...      ..'
Checksum: 0x88

----------------

Block 3, CTA-861 Extension Block:
  Revision: 3
  Underscans IT Video Formats by default
  Basic audio support
  Supports YCbCr 4:4:4
  Supports YCbCr 4:2:2
  Native detailed modes: 2
  Video Data Block:
    VIC   1:   640x480    59.940476 Hz   4:3     31.469 kHz     25.175000 MHz
    VIC   2:   720x480    59.940060 Hz   4:3     31.469 kHz     27.000000 MHz
    VIC   3:   720x480    59.940060 Hz  16:9     31.469 kHz     27.000000 MHz
    VIC   4:  1280x720    60.000000 Hz  16:9     45.000 kHz     74.250000 MHz
    VIC   5:  1920x1080i  60.000000 Hz  16:9     33.750 kHz     74.250000 MHz
    VIC   7:  1440x480i   59.940060 Hz  16:9     15.734 kHz     27.000000 MHz
    VIC  16:  1920x1080   60.000000 Hz  16:9     67.500 kHz    148.500000 MHz (native)
    VIC  18:   720x576    50.000000 Hz  16:9     31.250 kHz     27.000000 MHz
    VIC  19:  1280x720    50.000000 Hz  16:9     37.500 kHz     74.250000 MHz
    VIC  20:  1920x1080i  50.000000 Hz  16:9     28.125 kHz     74.250000 MHz
    VIC  22:  1440x576i   50.000000 Hz  16:9     15.625 kHz     27.000000 MHz
    VIC  31:  1920x1080   50.000000 Hz  16:9     56.250 kHz    148.500000 MHz (native)
    VIC  32:  1920x1080   24.000000 Hz  16:9     27.000 kHz     74.250000 MHz
    VIC  34:  1920x1080   30.000000 Hz  16:9     33.750 kHz     74.250000 MHz
    VIC   6:  1440x480i   59.940060 Hz   4:3     15.734 kHz     27.000000 MHz
    VIC  17:   720x576    50.000000 Hz   4:3     31.250 kHz     27.000000 MHz
    VIC  21:  1440x576i   50.000000 Hz   4:3     15.625 kHz     27.000000 MHz
  Audio Data Block:
    Linear PCM:
      Max channels: 2
      Supported sample rates (kHz): 96 48 44.1 32
      Supported sample sizes (bits): 24 20 16
    AC-3:
      Max channels: 6
      Supported sample rates (kHz): 48 44.1 32
      Maximum bit rate: 640 kb/s
    Enhanced AC-3 (DD+):
      Max channels: 8
      Supported sample rates (kHz): 48 44.1 32
  Speaker Allocation Data Block:
    FL/FR - Front Left/Right
  Vendor-Specific Data Block (HDMI), OUI 00-0C-03:
    Source physical address: 1.0.0.0
    Supports_AI
    DC_36bit
    DC_30bit
    DC_Y444
    Maximum TMDS clock: 300 MHz
    Extended HDMI video details:
      HDMI VICs:
        HDMI VIC 1:  3840x2160   30.000000 Hz  16:9     67.500 kHz    297.000000 MHz
        HDMI VIC 2:  3840x2160   25.000000 Hz  16:9     56.250 kHz    297.000000 MHz
        HDMI VIC 3:  3840x2160   24.000000 Hz  16:9     54.000 kHz    297.000000 MHz
  Detailed Timing Descriptors:
    DTD  7:  1366x768    60.003026 Hz 683:384   49.022 kHz     87.260000 MHz (1394 mm x 784 mm)
                  Hfront   62 Hsync 144 Hback  208 Hpol N
                  Vfront   10 Vsync   5 Vback   34 Vpol N
    DTD  8:  1920x1080   50.000000 Hz  16:9     56.250 kHz    148.500000 MHz (1394 mm x 784 mm)
                  Hfront  528 Hsync  44 Hback  148 Hpol P
                  Vfront    4 Vsync   5 Vback   36 Vpol P
    DTD  9:  1920x1080   60.000000 Hz  16:9     67.500 kHz    148.500000 MHz (1394 mm x 784 mm)
                  Hfront   88 Hsync  40 Hback  152 Hpol P
                  Vfront    4 Vsync   5 Vback   36 Vpol P
    DTD 10:  1280x768    59.870228 Hz   5:3     47.776 kHz     79.500000 MHz (1394 mm x 784 mm)
                  Hfront   80 Hsync 128 Hback  176 Hpol N
                  Vfront    3 Vsync   7 Vback   20 Vpol P
Checksum: 0x25  Unused space in Extension Block: 5 bytes

----------------

Warnings:

Block 0, Base EDID:
  Vendor & Product Identification: The serial number is one of the known dummy values, it should probably be set to 0.
  Detailed Timing Descriptor #1: DTD is similar but not identical to VIC 93.
Block 1, CTA-861 Extension Block:
  Video Data Block: VIC 1 and the first DTD are not identical. Is this intended?
  Detailed Timing Descriptor #5: DTD is similar but not identical to VIC 16.
  Detailed Timing Descriptor #6: DTD is similar but not identical to DMT 0x17.
  Detailed Timing Descriptor #6: Image size is 1394x784 mm, but based on the picture AR it should be 1394x836 mm.
  Add a Colorimetry Data Block with the sRGB colorimetry bit set to avoid interop issues.
Block 3, CTA-861 Extension Block:
  Detailed Timing Descriptor #9: DTD is similar but not identical to VIC 16.
  Detailed Timing Descriptor #10: DTD is similar but not identical to DMT 0x17.
  Detailed Timing Descriptor #10: Image size is 1394x784 mm, but based on the picture AR it should be 1394x836 mm.
EDID:
  Base EDID: Some timings are out of range of the Monitor Ranges:
    Vertical Freq: 24.000 - 120.000 Hz (Monitor: 23.000 - 76.000 Hz)
    Horizontal Freq: 15.625 - 98.759 kHz (Monitor: 15.000 - 80.000 kHz)

Failures:

Block 1, CTA-861 Extension Block:
  Vendor-Specific Data Block (HDMI), OUI 00-0C-03: HDMI VIC Codes must have their CTA-861 VIC equivalents in the VSB.
  Missing VCDB, needed for Set Selectable RGB Quantization to avoid interop issues.
Block 2, Base EDID:
  Unknown Extension Block.
Block 3, CTA-861 Extension Block:
  Video Data Block: Duplicate VIC 1.
  Video Data Block: Duplicate VIC 2.
  Video Data Block: Duplicate VIC 3.
  Video Data Block: Duplicate VIC 4.
  Video Data Block: Duplicate VIC 5.
  Video Data Block: Duplicate VIC 7.
  Video Data Block: Duplicate VIC 16.
  Video Data Block: Duplicate VIC 18.
  Video Data Block: Duplicate VIC 19.
  Video Data Block: Duplicate VIC 20.
  Video Data Block: Duplicate VIC 22.
  Video Data Block: Duplicate VIC 31.
  Video Data Block: Duplicate VIC 32.
  Video Data Block: Duplicate VIC 34.
  Video Data Block: Duplicate VIC 6.
  Video Data Block: Duplicate VIC 17.
  Video Data Block: Duplicate VIC 21.
  Speaker Allocation Data Block: Only one instance of this Data Block is allowed.
  Vendor-Specific Data Block (HDMI), OUI 00-0C-03: HDMI VIC Codes must have their CTA-861 VIC equivalents in the VSB.
EDID:
  Base EDID: EDID specified 1 extension block(s), but found 3 extension block(s).
  Base EDID: EDID 1.3 requires a Block Map Extension in Block 1 if there are more than 2 blocks in the EDID.
  CTA-861: Native progressive timings are a mix of several resolutions.

EDID conformity: FAIL
