edid-decode (hex):

00 ff ff ff ff ff ff 00 06 af 8c 25 00 00 00 00
31 1d 01 04 a5 1f 11 78 03 b8 1a a6 54 4a 9b 26
0e 52 55 00 00 00 01 01 01 01 01 01 01 01 01 01
01 01 01 01 01 01 14 37 80 b8 70 38 24 40 10 10
3e 00 35 ae 10 00 00 18 10 2c 80 b8 70 38 24 40
10 10 3e 00 35 ae 10 00 00 18 00 00 00 fd 00 30
3c 43 43 0e 01 0a 20 20 20 20 20 20 00 00 00 fe
00 42 31 34 30 48 41 4e 30 36 2e 39 20 0a 00 15

----------------

Block 0, Base EDID:
  EDID Structure Version & Revision: 1.4
  Vendor & Product Identification:
    Manufacturer: AUO
    Model: 9612
    Made in: week 49 of 2019
  Basic Display Parameters & Features:
    Digital display
    Bits per primary color channel: 8
    DisplayPort interface
    Maximum image size: 31 cm x 17 cm
    Gamma: 2.20
    Supported color formats: RGB 4:4:4
    First detailed timing includes the native pixel format and preferred refresh rate
    Display supports continuous frequencies
  Color Characteristics:
    Red  : 0.6503, 0.3310
    Green: 0.2910, 0.6054
    Blue : 0.1484, 0.0556
    White: 0.3222, 0.3339
  Established Timings I & II: none
  Standard Timings: none
  Detailed Timing Descriptors:
    DTD 1:  1920x1080   60.049471 Hz  16:9     67.015 kHz    141.000000 MHz (309 mm x 174 mm)
                 Hfront   16 Hsync  16 Hback  152 Hpol N
                 Vfront    3 Vsync  14 Vback   19 Vpol N
    DTD 2:  1920x1080   48.039576 Hz  16:9     53.612 kHz    112.800000 MHz (309 mm x 174 mm)
                 Hfront   16 Hsync  16 Hback  152 Hpol N
                 Vfront    3 Vsync  14 Vback   19 Vpol N
    Display Range Limits:
      Monitor ranges (Range Limits Only): 48-60 Hz V, 67-67 kHz H, max dotclock 140 MHz
    Alphanumeric Data String: 'B140HAN06.9 '
Checksum: 0x15

----------------

Warnings:

Block 0, Base EDID:
  Missing Display Product Name.
EDID:
  Base EDID: Some timings are out of range of the Monitor Ranges:
    Horizontal Freq: 53.612 - 67.015 kHz (Monitor: 67.000 - 67.000 kHz)
    Maximum Clock: 141.000 MHz (Monitor: 140.000 MHz)

Failures:

Block 0, Base EDID:
  Alphanumeric Data String: One or more trailing spaces before newline.

EDID conformity: FAIL
