edid-decode (hex):

00 ff ff ff ff ff ff 00 30 ae 90 8a 00 00 00 00
00 1f 01 04 b5 1e 13 78 02 ee 95 a3 54 4c 99 26
0f 50 54 00 00 00 01 01 01 01 01 01 01 01 01 01
01 01 01 01 01 01 cf 85 40 a0 b0 08 4e 70 30 20
36 00 2e bc 10 00 00 18 b6 c8 40 a0 b0 08 4e 70
30 20 36 00 2e bc 10 00 00 18 00 00 00 fe 00 4c
45 4e 4f 56 4f 0a 20 20 20 20 20 20 00 00 00 fe
00 4c 45 4e 31 34 30 57 51 2b 20 20 20 20 00 34

00 ff ff ff ff ff ff 00 30 ae 90 8a 00 00 00 00
00 1f 01 04 b5 1e 13 78 02 ee 95 a3 54 4c 99 26
0f 50 54 00 00 00 01 01 01 01 01 01 01 01 01 01
01 01 01 01 01 01 cf 85 40 a0 b0 08 4e 70 30 20
36 00 2e bc 10 00 00 18 b6 c8 40 a0 b0 08 4e 70
30 20 36 00 2e bc 10 00 00 18 00 00 00 fe 00 4c
45 4e 4f 56 4f 0a 20 20 20 20 20 20 00 00 00 fe
00 4c 45 4e 31 34 30 57 51 2b 20 20 20 20 00 34

----------------

Block 0, Base EDID:
  EDID Structure Version & Revision: 1.4
  Vendor & Product Identification:
    Manufacturer: LEN
    Model: 35472
    Made in: 2021
  Basic Display Parameters & Features:
    Digital display
    Bits per primary color channel: 10
    DisplayPort interface
    Maximum image size: 30 cm x 19 cm
    Gamma: 2.20
    Supported color formats: RGB 4:4:4
    First detailed timing includes the native pixel format and preferred refresh rate
  Color Characteristics:
    Red  : 0.6396, 0.3300
    Green: 0.2998, 0.5996
    Blue : 0.1503, 0.0595
    White: 0.3134, 0.3291
  Established Timings I & II: none
  Standard Timings: none
  Detailed Timing Descriptors:
    DTD 1:  2880x1800   60.000490 Hz  16:10   112.681 kHz    342.550000 MHz (302 mm x 188 mm)
                 Hfront   48 Hsync  32 Hback   80 Hpol N
                 Vfront    3 Vsync   6 Vback   69 Vpol N
    DTD 2:  2880x1800   89.999860 Hz  16:10   169.020 kHz    513.820000 MHz (302 mm x 188 mm)
                 Hfront   48 Hsync  32 Hback   80 Hpol N
                 Vfront    3 Vsync   6 Vback   69 Vpol N
    Alphanumeric Data String: 'LENOVO'
    Alphanumeric Data String: 'LEN140WQ+    '
Checksum: 0x34

----------------

Warnings:

Block 0, Base EDID:
  Missing Display Product Name.

Failures:

Block 0, Base EDID:
  Alphanumeric Data String: No newline, but one or more trailing spaces.
EDID:
  Extension Block 1 started with EDID header, ignoring Extension Blocks >= 1.

EDID conformity: FAIL
