edid-decode (hex):

00 ff ff ff ff ff ff 00 08 59 42 00 01 00 00 00
01 15 01 03 81 66 39 78 0a de 58 a3 54 4c 99 26
0f 45 47 af 4f 00 81 80 81 8f d1 c0 81 c0 01 01
01 01 01 01 01 01 52 35 80 80 70 38 1f 40 20 20
13 00 c4 8e 21 00 00 1e f1 27 00 a0 51 00 25 30
50 80 37 00 80 80 21 00 00 1c 00 00 00 fc 00 44
58 34 36 4c 32 36 31 41 31 32 0d 0a 00 00 00 fd
00 30 4c 0f 50 0f 00 0a 20 20 20 20 20 20 01 82

02 03 20 73 48 05 04 03 02 01 06 07 90 26 09 07
07 11 07 50 83 01 00 00 67 03 0c 00 10 00 b8 2d
01 1d 00 72 51 d0 1e 20 6e 28 55 00 c4 8e 21 00
00 1e 8c 0a d0 8a 20 e0 2d 10 10 3e 96 00 13 8e
21 00 00 18 01 1d 80 18 71 1c 16 20 58 2c 25 00
c4 8e 21 00 00 9e 00 00 00 00 00 00 00 00 00 00
00 00 00 00 00 00 00 00 00 00 00 00 00 00 00 00
00 00 00 00 00 00 00 00 00 00 00 00 00 00 00 57

00 ff ff ff ff ff ff 00 08 59 42 00 01 00 00 00
01 15 01 03 81 66 39 78 0a de 58 a3 54 4c 99 26
0f 45 47 af 4f 00 81 80 81 8f d1 c0 81 c0 01 01
01 01 01 01 01 01 52 35 80 80 70 38 1f 40 20 20
13 00 c4 8e 21 00 00 1e f1 27 00 a0 51 00 25 30
50 80 37 00 80 80 21 00 00 1c 00 00 00 fc 00 44
58 34 36 4c 32 36 31 41 31 32 0d 0a 00 00 00 fd
00 30 4c 0f 50 0f 00 0a 20 20 20 20 20 20 01 82

02 03 20 73 48 05 04 03 02 01 06 07 90 26 09 07
07 11 07 50 83 01 00 00 67 03 0c 00 10 00 b8 2d
01 1d 00 72 51 d0 1e 20 6e 28 55 00 c4 8e 21 00
00 1e 8c 0a d0 8a 20 e0 2d 10 10 3e 96 00 13 8e
21 00 00 18 01 1d 80 18 71 1c 16 20 58 2c 25 00
c4 8e 21 00 00 9e 00 00 00 00 00 00 00 00 00 00
00 00 00 00 00 00 00 00 00 00 00 00 00 00 00 00
00 00 00 00 00 00 00 00 00 00 00 00 00 00 00 57

----------------

Block 0, Base EDID:
  EDID Structure Version & Revision: 1.3
  Vendor & Product Identification:
    Manufacturer: BBY
    Model: 66
    Serial Number: ...
    Made in: week 1 of 2011
  Basic Display Parameters & Features:
    Digital display
    DFP 1.x compatible TMDS
    Maximum image size: 102 cm x 57 cm
    Gamma: 2.20
    RGB color display
    First detailed timing is the preferred timing
  Color Characteristics:
    Red  : 0.6396, 0.3291
    Green: 0.2998, 0.5996
    Blue : 0.1494, 0.0595
    White: 0.2714, 0.2773
  Established Timings I & II:
    IBM     :   720x400    70.081663 Hz   9:5     31.467 kHz     28.320000 MHz
    DMT 0x04:   640x480    59.940476 Hz   4:3     31.469 kHz     25.175000 MHz
    DMT 0x05:   640x480    72.808802 Hz   4:3     37.861 kHz     31.500000 MHz
    DMT 0x06:   640x480    75.000000 Hz   4:3     37.500 kHz     31.500000 MHz
    DMT 0x08:   800x600    56.250000 Hz   4:3     35.156 kHz     36.000000 MHz
    DMT 0x09:   800x600    60.316541 Hz   4:3     37.879 kHz     40.000000 MHz
    DMT 0x0b:   800x600    75.000000 Hz   4:3     46.875 kHz     49.500000 MHz
    DMT 0x10:  1024x768    60.003840 Hz   4:3     48.363 kHz     65.000000 MHz
    DMT 0x11:  1024x768    70.069359 Hz   4:3     56.476 kHz     75.000000 MHz
    DMT 0x12:  1024x768    75.028582 Hz   4:3     60.023 kHz     78.750000 MHz
    DMT 0x24:  1280x1024   75.024675 Hz   5:4     79.976 kHz    135.000000 MHz
  Standard Timings:
    DMT 0x23:  1280x1024   60.019740 Hz   5:4     63.981 kHz    108.000000 MHz
    DMT 0x24:  1280x1024   75.024675 Hz   5:4     79.976 kHz    135.000000 MHz
    DMT 0x52:  1920x1080   60.000000 Hz  16:9     67.500 kHz    148.500000 MHz
    DMT 0x55:  1280x720    60.000000 Hz  16:9     45.000 kHz     74.250000 MHz
  Detailed Timing Descriptors:
    DTD 1:  1920x1080   59.991351 Hz  16:9     66.650 kHz    136.500000 MHz (708 mm x 398 mm)
                 Hfront   32 Hsync  32 Hback   64 Hpol P
                 Vfront    1 Vsync   3 Vback   27 Vpol P
    DTD 2:  1280x768    74.893062 Hz   5:3     60.289 kHz    102.250000 MHz (640 mm x 384 mm)
                 Hfront   80 Hsync 128 Hback  208 Hpol N
                 Vfront    3 Vsync   7 Vback   27 Vpol P
    Display Product Name: 'DX46L261A12.'
    Display Range Limits:
      Monitor ranges (GTF): 48-76 Hz V, 15-80 kHz H, max dotclock 150 MHz
  Extension blocks: 1
Checksum: 0x82

----------------

Block 1, CTA-861 Extension Block:
  Revision: 3
  Basic audio support
  Supports YCbCr 4:4:4
  Supports YCbCr 4:2:2
  Native DTDs: 3
  Video Data Block:
    VIC   5:  1920x1080i  60.000000 Hz  16:9     33.750 kHz     74.250000 MHz
    VIC   4:  1280x720    60.000000 Hz  16:9     45.000 kHz     74.250000 MHz
    VIC   3:   720x480    59.940060 Hz  16:9     31.469 kHz     27.000000 MHz
    VIC   2:   720x480    59.940060 Hz   4:3     31.469 kHz     27.000000 MHz
    VIC   1:   640x480    59.940476 Hz   4:3     31.469 kHz     25.175000 MHz
    VIC   6:  1440x480i   59.940060 Hz   4:3     15.734 kHz     27.000000 MHz
    VIC   7:  1440x480i   59.940060 Hz  16:9     15.734 kHz     27.000000 MHz
    VIC  16:  1920x1080   60.000000 Hz  16:9     67.500 kHz    148.500000 MHz (native)
  Audio Data Block:
    Linear PCM:
      Max channels: 2
      Supported sample rates (kHz): 48 44.1 32
      Supported sample sizes (bits): 24 20 16
    AC-3:
      Max channels: 2
      Supported sample rates (kHz): 48 44.1 32
      Maximum bit rate: 640 kb/s
  Speaker Allocation Data Block:
    FL/FR - Front Left/Right
  Vendor-Specific Data Block (HDMI), OUI 00-0C-03:
    Source physical address: 1.0.0.0
    Supports_AI
    DC_36bit
    DC_30bit
    DC_Y444
    Maximum TMDS clock: 225 MHz
  Detailed Timing Descriptors:
    DTD 3:  1280x720    60.000000 Hz  16:9     45.000 kHz     74.250000 MHz (708 mm x 398 mm)
                 Hfront  110 Hsync  40 Hback  220 Hpol P
                 Vfront    5 Vsync   5 Vback   20 Vpol P
    DTD 4:   720x480    59.940060 Hz   3:2     31.469 kHz     27.000000 MHz (531 mm x 398 mm)
                 Hfront   16 Hsync  62 Hback   60 Hpol N
                 Vfront    9 Vsync   6 Vback   30 Vpol N
    DTD 5:  1920x1080i  60.000000 Hz  16:9     33.750 kHz     74.250000 MHz (708 mm x 398 mm)
                 Hfront   88 Hsync  44 Hback  148 Hpol P
                 Vfront    2 Vsync   5 Vback   15 Vpol P Vfront +0.5 Odd Field
                 Vfront    2 Vsync   5 Vback   15 Vpol P Vback  +0.5 Even Field
Checksum: 0x57  Unused space in Extension Block: 41 bytes

----------------

Warnings:

Block 0, Base EDID:
  Vendor & Product Identification: The serial number is one of the known dummy values, it should probably be set to 0.
  Display Product Name: Non-ASCII character 0x0d at position 11, can cause problems.
Block 1, CTA-861 Extension Block:
  IT Video Formats are overscanned by default, but normally this should be underscanned.
  Video Data Block: VIC 5 and the first DTD are not identical. Is this intended?
  Detailed Timing Descriptor #4: Image size is 531x398 mm, but based on the picture AR it should be 531x354 mm.
  Add a Colorimetry Data Block with the sRGB colorimetry bit set to avoid interop issues.

Failures:

Block 0, Base EDID:
  Detailed Timing Descriptor #1: Mismatch of image size 708x398 mm vs display size 1020x570 mm.
  Detailed Timing Descriptor #2: Mismatch of image size 640x384 mm vs display size 1020x570 mm.
Block 1, CTA-861 Extension Block:
  Detailed Timing Descriptor #3: Mismatch of image size 708x398 mm vs display size 1020x570 mm.
  Detailed Timing Descriptor #4: Mismatch of image size 531x398 mm vs display size 1020x570 mm.
  Detailed Timing Descriptor #5: Mismatch of image size 708x398 mm vs display size 1020x570 mm.
  Missing VCDB, needed for Set Selectable RGB Quantization to avoid interop issues.
EDID:
  Extension Block 2 started with EDID header, ignoring Extension Blocks >= 2.
  CTA-861: Native progressive timings are a mix of several resolutions.

EDID conformity: FAIL
