edid-decode (hex):

00 ff ff ff ff ff ff 00 06 af 9e b6 00 00 00 00
21 1f 01 04 a5 26 16 78 03 96 75 a3 56 52 9c 27
0c 50 54 00 00 00 01 01 01 01 01 01 01 01 01 01
01 01 01 01 01 01 ce 8f 80 b6 70 38 88 40 30 20
a5 00 7e d7 10 00 00 18 ce 8f 80 b6 70 38 2e 47
30 20 a5 00 7e d7 10 00 00 18 00 00 00 fd 00 3c
90 b0 b0 25 01 0a 20 20 20 20 20 20 00 00 00 fe
00 42 31 37 33 48 41 4e 30 34 2e 30 20 0a 01 34

70 20 79 02 00 22 00 14 0b 9e 05 84 7f 07 b5 00
2f 80 1f 00 37 04 87 00 09 00 04 00 25 00 09 0b
9e 05 0b 9e 05 3c 90 80 81 00 10 72 1a 00 00 03
01 3c 90 00 00 53 52 53 52 90 00 00 00 00 00 00
00 00 00 00 00 00 00 00 00 00 00 00 00 00 00 00
00 00 00 00 00 00 00 00 00 00 00 00 00 00 00 00
00 00 00 00 00 00 00 00 00 00 00 00 00 00 00 00
00 00 00 00 00 00 00 00 00 00 00 00 00 00 88 90

----------------

Block 0, Base EDID:
  EDID Structure Version & Revision: 1.4
  Vendor & Product Identification:
    Manufacturer: AUO
    Model: 46750
    Made in: week 33 of 2021
  Basic Display Parameters & Features:
    Digital display
    Bits per primary color channel: 8
    DisplayPort interface
    Maximum image size: 38 cm x 22 cm
    Gamma: 2.20
    Supported color formats: RGB 4:4:4
    First detailed timing includes the native pixel format and preferred refresh rate
    Display supports continuous frequencies
  Color Characteristics:
    Red  : 0.6386, 0.3369
    Green: 0.3212, 0.6113
    Blue : 0.1533, 0.0498
    White: 0.3134, 0.3291
  Established Timings I & II: none
  Standard Timings: none
  Detailed Timing Descriptors:
    DTD 1:  1920x1080  144.027931 Hz  16:9    175.138 kHz    368.140000 MHz (382 mm x 215 mm)
                 Hfront   48 Hsync  32 Hback  102 Hpol N
                 Vfront   10 Vsync   5 Vback  121 Vpol N
    DTD 2:  1920x1080   60.019864 Hz  16:9    175.138 kHz    368.140000 MHz (382 mm x 215 mm)
                 Hfront   48 Hsync  32 Hback  102 Hpol N
                 Vfront   10 Vsync   5 Vback 1823 Vpol N
    Display Range Limits:
      Monitor ranges (Range Limits Only): 60-144 Hz V, 176-176 kHz H, max dotclock 370 MHz
    Alphanumeric Data String: 'B173HAN04.0 '
  Extension blocks: 1
Checksum: 0x34

----------------

Block 1, DisplayID Extension Block:
  Version: 2.0
  Extension Count: 0
  Display Product Primary Use Case: None of the listed primary use cases; generic display
  Video Timing Modes Type 7 - Detailed Timings Data Block:
    DTD:  1920x1080  144.027931 Hz  16:9    175.138 kHz    368.140000 MHz (aspect 16:9, no 3D stereo, preferred)
               Hfront   48 Hsync  32 Hback  102 Hpol P
               Vfront   10 Vsync   5 Vback  121 Vpol N
  Dynamic Video Timing Range Limits Data Block:
    Minimum Pixel Clock: 368140 kHz
    Maximum Pixel Clock: 368140 kHz
    Minimum Vertical Refresh Rate: 60 Hz
    Maximum Vertical Refresh Rate: 144 Hz
    Seamless Dynamic Video Timing Support: Yes
  CTA-861 DisplayID Data Block:
  Vendor-Specific Data Block (AMD), OUI 00-00-1A:
    Version: 3
    Feature Caps: 0x01
    Minimum Refresh Rate: 60 Hz
    Maximum Refresh Rate: 144 Hz
    Flags 1.x: 0x00
    Flags 2.x: 0x00
    Maximum luminance: 83 (301.833 cd/m^2)
    Minimum luminance: 82 (0.312 cd/m^2)
    Unknown: 0x53 0x52
  Checksum: 0x88
Checksum: 0x90

----------------

Warnings:

Block 0, Base EDID:
  Missing Display Product Name.
EDID:
  Base EDID: Some timings are out of range of the Monitor Ranges:
    Horizontal Freq: 175.137 - 175.137 kHz (Monitor: 176.000 - 176.000 kHz)
    Could be due to a Monitor Range off-by-one rounding issue

Failures:

Block 0, Base EDID:
  Alphanumeric Data String: One or more trailing spaces before newline.
Block 1, DisplayID Extension Block:
  Vendor-Specific Data Block (AMD), OUI 00-00-1A: Length is 16 instead of 19.
EDID:
  DisplayID: Missing DisplayID Display Parameters Data Block.

EDID conformity: FAIL
