edid-decode (hex):

00 ff ff ff ff ff ff 00 06 af b2 a3 00 00 00 00
12 22 01 04 a5 27 18 78 03 97 e5 a6 54 4a 9e 26
0c 50 54 00 00 00 01 01 01 01 01 01 01 01 01 01
01 01 01 01 01 01 4c 3f 80 b4 70 b0 56 40 30 20
35 00 83 f2 10 00 00 18 00 00 00 fd 00 30 90 ba
ba 27 01 0a 20 20 20 20 20 20 00 00 00 fe 00 3d
4c 33 30 31 31 20 20 20 20 20 20 01 00 00 00 fc
00 42 31 38 30 55 41 4e 30 31 2e 32 20 0a 01 b2

70 20 79 02 00 21 01 1d 26 0f 78 09 80 07 b0 04
88 66 3a 54 a3 b4 9e 6a 82 0c 02 35 54 b0 5c b0
5c 00 42 12 78 22 00 14 19 ef 05 85 7f 07 b3 00
2f 80 1f 00 af 04 55 00 02 00 04 00 2b 00 0c 27
00 30 8f 00 00 27 00 30 3b 00 00 2e 00 06 00 42
b0 5c b0 5c 81 00 1e 72 1a 00 00 03 71 30 90 00
00 53 ff 53 ff 90 00 00 00 00 e3 05 04 00 e6 06
01 01 53 53 ff 2c 00 00 00 00 00 00 00 00 05 90

00 ff ff ff ff ff ff 00 06 af b2 a3 00 00 00 00
12 22 01 04 a5 27 18 78 03 97 e5 a6 54 4a 9e 26
0c 50 54 00 00 00 01 01 01 01 01 01 01 01 01 01
01 01 01 01 01 01 4c 3f 80 b4 70 b0 56 40 30 20
35 00 83 f2 10 00 00 18 00 00 00 fd 00 30 90 ba
ba 27 01 0a 20 20 20 20 20 20 00 00 00 fe 00 3d
4c 33 30 31 31 20 20 20 20 20 20 01 00 00 00 fc
00 42 31 38 30 55 41 4e 30 31 2e 32 20 0a 01 b2

70 20 79 02 00 21 01 1d 26 0f 78 09 80 07 b0 04
88 66 3a 54 a3 b4 9e 6a 82 0c 02 35 54 b0 5c b0
5c 00 42 12 78 22 00 14 19 ef 05 85 7f 07 b3 00
2f 80 1f 00 af 04 55 00 02 00 04 00 2b 00 0c 27
00 30 8f 00 00 27 00 30 3b 00 00 2e 00 06 00 42
b0 5c b0 5c 81 00 1e 72 1a 00 00 03 71 30 90 00
00 53 ff 53 ff 90 00 00 00 00 e3 05 04 00 e6 06
01 01 53 53 ff 2c 00 00 00 00 00 00 00 00 05 90

----------------

Block 0, Base EDID:
  EDID Structure Version & Revision: 1.4
  Vendor & Product Identification:
    Manufacturer: AUO
    Model: 41906
    Made in: week 18 of 2024
  Basic Display Parameters & Features:
    Digital display
    Bits per primary color channel: 8
    DisplayPort interface
    Maximum image size: 39 cm x 24 cm
    Gamma: 2.20
    Supported color formats: RGB 4:4:4
    First detailed timing includes the native pixel format and preferred refresh rate
    Display supports continuous frequencies
  Color Characteristics:
    Red  : 0.6503, 0.3291
    Green: 0.2900, 0.6201
    Blue : 0.1513, 0.0488
    White: 0.3134, 0.3291
  Established Timings I & II: none
  Standard Timings: none
  Detailed Timing Descriptors:
    DTD 1:  1920x1200   60.001481 Hz  16:10    77.162 kHz    162.040000 MHz (387 mm x 242 mm)
                 Hfront   48 Hsync  32 Hback  100 Hpol N
                 Vfront    3 Vsync   5 Vback   78 Vpol N
    Display Range Limits:
      Monitor ranges (Range Limits Only): 48-144 Hz V, 186-186 kHz H, max dotclock 390 MHz
    Alphanumeric Data String: '=L3011      .'
    Display Product Name: 'B180UAN01.2 '
  Extension blocks: 1
Checksum: 0xb2

----------------

Block 1, DisplayID Extension Block:
  Version: 2.0
  Extension Count: 0
  Display Product Primary Use Case: None of the listed primary use cases; generic display
  Display Parameters Data Block (0x21):
    Image size: 387.8 mm x 242.4 mm
    Display native pixel format: 1920x1200
    Scan Orientation: Left to Right, Top to Bottom
    Luminance Information: Guidance for the Source device
    Color Information: CIE 1931
    Audio Speaker Information: not integrated
    Native Color Chromaticity:
      Primary #1:  (0.649902, 0.328857)
      Primary #2:  (0.289795, 0.619873)
      Primary #3:  (0.150879, 0.048828)
      White Point: (0.312988, 0.328857)
    Native Maximum Luminance (Full Coverage): 300.000000 cd/m^2
    Native Maximum Luminance (10% Rectangular Coverage): 300.000000 cd/m^2
    Native Minimum Luminance: 3.000000 cd/m^2
    Native Color Depth: 8 bpc
    Display Device Technology: Active Matrix LCD
    Display Device Theme Preference: No Preference
    Native Gamma EOTF: 2.20
  Video Timing Modes Type 7 - Detailed Timings Data Block:
    DTD:  1920x1200  144.001333 Hz  16:10   185.186 kHz    388.890000 MHz (aspect 16:10, no 3D stereo, preferred)
               Hfront   48 Hsync  32 Hback  100 Hpol P
               Vfront    3 Vsync   5 Vback   78 Vpol N
  Adaptive Sync Data Block:
    Descriptor #1:
      Native Panel Range
      Fixed Average V-Total and Adaptive V-Total
      Supports Seamless Transition
      'Max Single Frame Duration Increase' field value without jitter impact
      'Max Single Frame Duration Decrease' field value without jitter impact
      Max Duration Increase: 0.00 ms
      Max Duration Decrease: 0.00 ms
      Min Refresh Rate: 48 Hz
      Max Refresh Rate: 144 Hz
    Descriptor #2:
      Native Panel Range
      Fixed Average V-Total and Adaptive V-Total
      Supports Seamless Transition
      'Max Single Frame Duration Increase' field value without jitter impact
      'Max Single Frame Duration Decrease' field value without jitter impact
      Max Duration Increase: 0.00 ms
      Max Duration Decrease: 0.00 ms
      Min Refresh Rate: 48 Hz
      Max Refresh Rate: 60 Hz
  Brightness Luminance Range Data Block:
    Minimum SDR Luminance (Full Coverage): 3.000000 cd/m^2
    Maximum Suggested SDR Luminance (Full Coverage): 300.000000 cd/m^2
    Maximum Boost SDR Luminance: 300.000000 cd/m^2
  CTA-861 DisplayID Data Block:
  Vendor-Specific Data Block (AMD), OUI 00-00-1A:
    Version: 3
    Feature Caps: 0x71
      FreeSync Panel Replay Supported
    Minimum Refresh Rate: 48 Hz
    Maximum Refresh Rate: 144 Hz
    Flags 1.x: 0x00
    Flags 2.x: 0x00
  Colorimetry Data Block:
    sYCC601
  HDR Static Metadata Data Block:
    Electro optical transfer functions:
      Traditional gamma - SDR luminance range
    Supported static metadata descriptors:
      Static metadata type 1
    Desired content max luminance: 83 (301.833 cd/m^2)
    Desired content max frame-average luminance: 83 (301.833 cd/m^2)
    Desired content min luminance: 255 (3.018 cd/m^2)
  ARVR_HMD Data Block:
  Checksum: 0x05
Checksum: 0x90

----------------

Warnings:

Block 0, Base EDID:
  Alphanumeric Data String: Non-ASCII character 0x01 at position 12, can cause problems.
Block 1, DisplayID Extension Block:
  Colorimetry Data Block: Set the sRGB colorimetry bit to avoid interop issues.
EDID:
  Base EDID: Some timings are out of range of the Monitor Ranges:
    Horizontal Freq: 77.161 - 185.185 kHz (Monitor: 186.000 - 186.000 kHz)

Failures:

Block 0, Base EDID:
  Display Product Name: One or more trailing spaces before newline.
Block 1, DisplayID Extension Block:
  ARVR_HMD Data Block: DisplayID payload length is different than expected (0 != 79).
EDID:
  Extension Block 2 started with EDID header, ignoring Extension Blocks >= 2.

EDID conformity: FAIL
