edid-decode (hex):

00 ff ff ff ff ff ff 00 4a 8b 00 00 01 01 01 01
1e 0c 01 04 a5 24 1b 78 e2 8a 01 9a 58 52 8b 28
1e 50 54 ff ff 80 61 40 61 4f 61 59 71 4f 81 40
81 59 81 99 a9 40 00 00 00 fc 00 31 37 27 27 20
4c 43 44 0a 20 20 20 20 00 00 00 fc 00 4d 6f 6e
69 74 6f 72 0a 20 20 20 20 20 00 00 00 fd 00 2b
55 14 5c 0e 00 0a 20 20 20 20 20 20 00 00 00 ff
00 30 30 30 30 30 31 0a 20 20 20 20 20 20 00 29

00 ff ff ff ff ff ff 00 4a 8b 00 00 01 01 01 01
1e 0c 01 04 a5 24 1b 78 e2 8a 01 9a 58 52 8b 28
1e 50 54 ff ff 80 61 40 61 4f 61 59 71 4f 81 40
81 59 81 99 a9 40 00 00 00 fc 00 31 37 27 27 20
4c 43 44 0a 20 20 20 20 00 00 00 fc 00 4d 6f 6e
69 74 6f 72 0a 20 20 20 20 20 00 00 00 fd 00 2b
55 14 5c 0e 00 0a 20 20 20 20 20 20 00 00 00 ff
00 30 30 30 30 30 31 0a 20 20 20 20 20 20 00 29

----------------

Block 0, Base EDID:
  EDID Structure Version & Revision: 1.4
  Vendor & Product Identification:
    Manufacturer: RTK
    Model: 0
    Serial Number: ...
    Made in: week 30 of 2002
  Basic Display Parameters & Features:
    Digital display
    Bits per primary color channel: 8
    DisplayPort interface
    Maximum image size: 36 cm x 27 cm
    Gamma: 2.20
    DPMS levels: Standby Suspend Off
    Supported color formats: RGB 4:4:4
    First detailed timing includes the native pixel format and preferred refresh rate
  Color Characteristics:
    Red  : 0.6035, 0.3437
    Green: 0.3222, 0.5449
    Blue : 0.1562, 0.1171
    White: 0.3125, 0.3291
  Established Timings I & II:
    IBM     :   720x400    70.081663 Hz   9:5     31.467 kHz     28.320000 MHz
    IBM     :   720x400    87.849542 Hz   9:5     39.444 kHz     35.500000 MHz
    DMT 0x04:   640x480    59.940476 Hz   4:3     31.469 kHz     25.175000 MHz
    Apple   :   640x480    66.666667 Hz   4:3     35.000 kHz     30.240000 MHz
    DMT 0x05:   640x480    72.808802 Hz   4:3     37.861 kHz     31.500000 MHz
    DMT 0x06:   640x480    75.000000 Hz   4:3     37.500 kHz     31.500000 MHz
    DMT 0x08:   800x600    56.250000 Hz   4:3     35.156 kHz     36.000000 MHz
    DMT 0x09:   800x600    60.316541 Hz   4:3     37.879 kHz     40.000000 MHz
    DMT 0x0a:   800x600    72.187572 Hz   4:3     48.077 kHz     50.000000 MHz
    DMT 0x0b:   800x600    75.000000 Hz   4:3     46.875 kHz     49.500000 MHz
    Apple   :   832x624    74.551266 Hz   4:3     49.726 kHz     57.284000 MHz
    DMT 0x0f:  1024x768i   86.957532 Hz   4:3     35.522 kHz     44.900000 MHz
    DMT 0x10:  1024x768    60.003840 Hz   4:3     48.363 kHz     65.000000 MHz
    DMT 0x11:  1024x768    70.069359 Hz   4:3     56.476 kHz     75.000000 MHz
    DMT 0x12:  1024x768    75.028582 Hz   4:3     60.023 kHz     78.750000 MHz
    DMT 0x24:  1280x1024   75.024675 Hz   5:4     79.976 kHz    135.000000 MHz
    Apple   :  1152x870    75.061550 Hz 192:145   68.681 kHz    100.000000 MHz
  Standard Timings:
    DMT 0x10:  1024x768    60.003840 Hz   4:3     48.363 kHz     65.000000 MHz
    DMT 0x12:  1024x768    75.028582 Hz   4:3     60.023 kHz     78.750000 MHz
    DMT 0x13:  1024x768    84.996690 Hz   4:3     68.677 kHz     94.500000 MHz
    DMT 0x15:  1152x864    75.000000 Hz   4:3     67.500 kHz    108.000000 MHz
    DMT 0x20:  1280x960    60.000000 Hz   4:3     60.000 kHz    108.000000 MHz
    DMT 0x21:  1280x960    85.002473 Hz   4:3     85.938 kHz    148.500000 MHz
    DMT 0x25:  1280x1024   85.024098 Hz   5:4     91.146 kHz    157.500000 MHz
    DMT 0x33:  1600x1200   60.000000 Hz   4:3     75.000 kHz    162.000000 MHz
  Detailed Timing Descriptors:
    Display Product Name: '17'' LCD'
    Display Product Name: 'Monitor'
    Display Range Limits:
      Monitor ranges (GTF): 43-85 Hz V, 20-92 kHz H, max dotclock 140 MHz
    Display Product Serial Number: ...
Checksum: 0x29

----------------

Block 1, Unknown EDID Extension Block 0x00:
  00 ff ff ff ff ff ff 00 4a 8b 00 00 01 01 01 01 '........J.......'
  1e 0c 01 04 a5 24 1b 78 e2 8a 01 9a 58 52 8b 28 '.....$.x....XR.('
  1e 50 54 ff ff 80 61 40 61 4f 61 59 71 4f 81 40 '.PT...a@aOaYqO.@'
  81 59 81 99 a9 40 00 00 00 fc 00 31 37 27 27 20 '.Y...@.....17'' '
  4c 43 44 0a 20 20 20 20 00 00 00 fc 00 4d 6f 6e 'LCD.    .....Mon'
  69 74 6f 72 0a 20 20 20 20 20 00 00 00 fd 00 2b 'itor.     .....+'
  55 14 5c 0e 00 0a 20 20 20 20 20 20 00 00 00 ff 'U.\...      ....'
  00 30 30 30 30 30 31 0a 20 20 20 20 20 20 00 29 '.000001.      .)'
Checksum: 0x29

----------------

Warnings:

Block 0, Base EDID:
  Vendor & Product Identification: The serial number is one of the known dummy values, it should probably be set to 0.
  Display Range Limits: GTF support is deprecated in EDID 1.4.
  Display Product Serial Number: ...
EDID:
  No Native Video Resolution was defined.
  Base EDID: Some timings are out of range of the Monitor Ranges:
    Vertical Freq: 56.250 - 87.850 Hz (Monitor: 43.000 - 85.000 Hz)
    Maximum Clock: 162.000 MHz (Monitor: 140.000 MHz)

Failures:

Block 0, Base EDID:
  Standard Timings: Missing preferred timing.
  Display Range Limits: GTF is supported, but the display does not support continuous frequencies.
Block 1, Base EDID:
  Unknown Extension Block.
EDID:
  Base EDID: EDID specified 0 extension block(s), but found 1 extension block(s).

EDID conformity: FAIL
