edid-decode (hex):

00 ff ff ff ff ff ff 00 4a 8b 00 00 01 01 01 01
00 20 01 03 80 23 13 78 3e 58 f8 a6 58 55 9d 26
0e 4f 55 a1 08 00 d1 cf b3 00 a9 c0 95 00 8b c0
81 80 81 40 81 c0 02 3a 80 18 71 38 2d 40 58 2c
45 00 00 00 00 00 00 1e 54 6f 80 a0 70 38 3e 40
30 20 35 00 00 00 00 00 00 1e 00 00 00 fc 00 00
0a 20 20 20 20 20 20 20 20 20 20 20 00 00 00 fd
00 30 91 0f aa 24 01 0a 20 20 20 20 20 20 01 f3

02 03 33 f2 50 04 05 10 13 14 1f 20 21 22 27 48
49 4a 4b 4c 3f e2 00 d5 e3 05 c0 00 23 09 7f 07
83 01 00 00 67 03 0c 00 10 00 38 48 e6 06 05 01
62 62 00 a4 83 80 a0 70 38 2d 40 30 20 35 00 00
00 00 00 00 1e 97 45 80 a0 70 38 3e 40 30 20 35
00 00 00 00 00 00 7f c9 5c 80 a0 70 38 3e 40 30
20 35 00 00 00 00 00 00 7f 00 00 00 00 00 00 00
00 00 00 00 00 00 00 00 00 00 00 00 00 00 00 07

00 ff ff ff ff ff ff 00 4a 8b 00 00 01 01 01 01
00 20 01 03 80 23 13 78 3e 58 f8 a6 58 55 9d 26
0e 4f 55 a1 08 00 d1 cf b3 00 a9 c0 95 00 8b c0
81 80 81 40 81 c0 02 3a 80 18 71 38 2d 40 58 2c
45 00 00 00 00 00 00 1e 54 6f 80 a0 70 38 3e 40
30 20 35 00 00 00 00 00 00 1e 00 00 00 fc 00 00
0a 20 20 20 20 20 20 20 20 20 20 20 00 00 00 fd
00 30 91 0f aa 24 01 0a 20 20 20 20 20 20 01 f3

02 03 33 f2 50 04 05 10 13 14 1f 20 21 22 27 48
49 4a 4b 4c 3f e2 00 d5 e3 05 c0 00 23 09 7f 07
83 01 00 00 67 03 0c 00 10 00 38 48 e6 06 05 01
62 62 00 a4 83 80 a0 70 38 2d 40 30 20 35 00 00
00 00 00 00 1e 97 45 80 a0 70 38 3e 40 30 20 35
00 00 00 00 00 00 7f c9 5c 80 a0 70 38 3e 40 30
20 35 00 00 00 00 00 00 7f 00 00 00 00 00 00 00
00 00 00 00 00 00 00 00 00 00 00 00 00 00 00 07

----------------

Block 0, Base EDID:
  EDID Structure Version & Revision: 1.3
  Vendor & Product Identification:
    Manufacturer: RTK
    Model: 0
    Serial Number: ...
    Made in: 2022
  Basic Display Parameters & Features:
    Digital display
    Maximum image size: 35 cm x 19 cm
    Gamma: 2.20
    DPMS levels: Off
    Undefined display color type
    Default (sRGB) color space is primary color space
    First detailed timing is the preferred timing
  Color Characteristics:
    Red  : 0.6494, 0.3447
    Green: 0.3339, 0.6132
    Blue : 0.1513, 0.0576
    White: 0.3105, 0.3320
  Established Timings I & II:
    IBM     :   720x400    70.081663 Hz   9:5     31.467 kHz     28.320000 MHz
    DMT 0x04:   640x480    59.940476 Hz   4:3     31.469 kHz     25.175000 MHz
    DMT 0x09:   800x600    60.316541 Hz   4:3     37.879 kHz     40.000000 MHz
    DMT 0x10:  1024x768    60.003840 Hz   4:3     48.363 kHz     65.000000 MHz
  Standard Timings:
    GTF     :  1920x1080   75.000068 Hz  16:9     84.600 kHz    220.637000 MHz
    DMT 0x3a:  1680x1050   59.954250 Hz  16:10    65.290 kHz    146.250000 MHz
    DMT 0x53:  1600x900    60.000000 Hz  16:9     60.000 kHz    108.000000 MHz (RB)
    DMT 0x2f:  1440x900    59.887445 Hz  16:10    55.935 kHz    106.500000 MHz
    GTF     :  1360x765    60.000341 Hz  16:9     47.520 kHz     84.396000 MHz
    DMT 0x23:  1280x1024   60.019740 Hz   5:4     63.981 kHz    108.000000 MHz
    DMT 0x20:  1280x960    60.000000 Hz   4:3     60.000 kHz    108.000000 MHz
    DMT 0x55:  1280x720    60.000000 Hz  16:9     45.000 kHz     74.250000 MHz
  Detailed Timing Descriptors:
    DTD 1:  1920x1080   60.000000 Hz  16:9     67.500 kHz    148.500000 MHz
                 Hfront   88 Hsync  44 Hback  148 Hpol P
                 Vfront    4 Vsync   5 Vback   36 Vpol P
    DTD 2:  1920x1080  119.981813 Hz  16:9    137.019 kHz    285.000000 MHz
                 Hfront   48 Hsync  32 Hback   80 Hpol P
                 Vfront    3 Vsync   5 Vback   54 Vpol P
    Display Product Name: ''
    Display Range Limits:
      Monitor ranges (Range Limits Only): 48-145 Hz V, 15-170 kHz H, max dotclock 360 MHz
  Extension blocks: 1
Checksum: 0xf3

----------------

Block 1, CTA-861 Extension Block:
  Revision: 3
  Underscans IT Video Formats by default
  Basic audio support
  Supports YCbCr 4:4:4
  Supports YCbCr 4:2:2
  Native DTDs: 2
  Video Data Block:
    VIC   4:  1280x720    60.000000 Hz  16:9     45.000 kHz     74.250000 MHz
    VIC   5:  1920x1080i  60.000000 Hz  16:9     33.750 kHz     74.250000 MHz
    VIC  16:  1920x1080   60.000000 Hz  16:9     67.500 kHz    148.500000 MHz
    VIC  19:  1280x720    50.000000 Hz  16:9     37.500 kHz     74.250000 MHz
    VIC  20:  1920x1080i  50.000000 Hz  16:9     28.125 kHz     74.250000 MHz
    VIC  31:  1920x1080   50.000000 Hz  16:9     56.250 kHz    148.500000 MHz
    VIC  32:  1920x1080   24.000000 Hz  16:9     27.000 kHz     74.250000 MHz
    VIC  33:  1920x1080   25.000000 Hz  16:9     28.125 kHz     74.250000 MHz
    VIC  34:  1920x1080   30.000000 Hz  16:9     33.750 kHz     74.250000 MHz
    VIC  39:  1920x1080i  50.000000 Hz  16:9     31.250 kHz     72.000000 MHz
    VIC  72:  1920x1080   24.000000 Hz  64:27    27.000 kHz     74.250000 MHz
    VIC  73:  1920x1080   25.000000 Hz  64:27    28.125 kHz     74.250000 MHz
    VIC  74:  1920x1080   30.000000 Hz  64:27    33.750 kHz     74.250000 MHz
    VIC  75:  1920x1080   50.000000 Hz  64:27    56.250 kHz    148.500000 MHz
    VIC  76:  1920x1080   60.000000 Hz  64:27    67.500 kHz    148.500000 MHz
    VIC  63:  1920x1080  120.000000 Hz  16:9    135.000 kHz    297.000000 MHz
  Video Capability Data Block:
    YCbCr quantization: Selectable (via AVI YQ)
    RGB quantization: Selectable (via AVI Q)
    PT scan behavior: Always Overscanned
    IT scan behavior: Always Overscanned
    CE scan behavior: Always Overscanned
  Colorimetry Data Block:
    BT2020YCC
    BT2020RGB
  Audio Data Block:
    Linear PCM:
      Max channels: 2
      Supported sample rates (kHz): 192 176.4 96 88.2 48 44.1 32
      Supported sample sizes (bits): 24 20 16
  Speaker Allocation Data Block:
    FL/FR - Front Left/Right
  Vendor-Specific Data Block (HDMI), OUI 00-0C-03:
    Source physical address: 1.0.0.0
    DC_36bit
    DC_30bit
    DC_Y444
    Maximum TMDS clock: 360 MHz
  HDR Static Metadata Data Block:
    Electro optical transfer functions:
      Traditional gamma - SDR luminance range
      SMPTE ST2084
    Supported static metadata descriptors:
      Static metadata type 1
    Desired content max luminance: 98 (417.710 cd/m^2)
    Desired content max frame-average luminance: 98 (417.710 cd/m^2)
    Desired content min luminance: 0 (0.000 cd/m^2)
  Detailed Timing Descriptors:
    DTD 3:  1920x1080  144.017094 Hz  16:9    162.019 kHz    337.000000 MHz
                 Hfront   48 Hsync  32 Hback   80 Hpol P
                 Vfront    3 Vsync   5 Vback   37 Vpol P
    DTD 4:  1920x1080   74.999158 Hz  16:9     85.649 kHz    178.150000 MHz (side by side interleaved)
                 Hfront   48 Hsync  32 Hback   80 Hpol P
                 Vfront    3 Vsync   5 Vback   54 Vpol P
    DTD 5:  1920x1080   99.997474 Hz  16:9    114.197 kHz    237.530000 MHz (side by side interleaved)
                 Hfront   48 Hsync  32 Hback   80 Hpol P
                 Vfront    3 Vsync   5 Vback   54 Vpol P
Checksum: 0x07  Unused space in Extension Block: 22 bytes

----------------

Warnings:

Block 0, Base EDID:
  Vendor & Product Identification: The serial number is one of the known dummy values, it should probably be set to 0.
  Standard Timings: Standard Timing 1360x765 has a dubious odd vertical resolution.
Block 1, CTA-861 Extension Block:
  Video Data Block: VIC 4 and the first DTD are not identical. Is this intended?
  Video Capability Data Block: IT scan behavior is expected to support underscanned.
  Video Capability Data Block: S_PT is equal to S_IT and S_CE, so should be set to 0 instead.
EDID:
  Base EDID: Some timings are out of range of the Monitor Ranges:
    Vertical Freq: 24.000 - 144.017 Hz (Monitor: 48.000 - 145.000 Hz)

Failures:

Block 0, Base EDID:
  Basic Display Parameters & Features: sRGB is signaled, but the chromaticities do not match.
  Detailed Timing Descriptor #1: Mismatch of image size vs display size: image size is not set, but display size is.
  Detailed Timing Descriptor #2: Mismatch of image size vs display size: image size is not set, but display size is.
  Display Product Name: NUL byte at position 0.
  Display Range Limits: 'Range Limits Only' is not allowed for EDID < 1.4.
Block 1, CTA-861 Extension Block:
  Video Capability Data Block: IT video formats are always overscanned, but bit 7 of Byte 3 of the CTA-861 Extension header is set to underscanned.
  Vendor-Specific Data Block (HDMI), OUI 00-0C-03: HDMI VSDB Max TMDS rate is > 340.
  Detailed Timing Descriptor #3: Mismatch of image size vs display size: image size is not set, but display size is.
  Detailed Timing Descriptor #4: Mismatch of image size vs display size: image size is not set, but display size is.
  Detailed Timing Descriptor #5: Mismatch of image size vs display size: image size is not set, but display size is.
EDID:
  Extension Block 2 started with EDID header, ignoring Extension Blocks >= 2.

EDID conformity: FAIL
