edid-decode (hex):

00 ff ff ff ff ff ff 00 30 e4 1e 02 00 00 00 00
00 13 01 03 80 1a 0e 78 0a 08 85 95 58 53 8c 28
23 50 54 00 00 00 01 01 01 01 01 01 01 01 01 01
01 01 01 01 01 01 c6 1b 56 84 50 00 16 30 30 20
35 00 00 90 10 00 00 1b c6 1b 56 84 50 00 16 30
30 20 35 00 00 90 10 00 00 1b 00 00 00 fe 00 35
39 4a 57 54 80 31 31 36 57 48 32 0a 00 00 00 00
00 00 84 02 94 01 00 00 00 02 01 0a 20 20 00 5b

00 ff ff ff ff ff ff 00 30 e4 1e 02 00 00 00 00
00 13 01 03 80 1a 0e 78 0a 08 85 95 58 53 8c 28
23 50 54 00 00 00 01 01 01 01 01 01 01 01 01 01
01 01 01 01 01 01 c6 1b 56 84 50 00 16 30 30 20
35 00 00 90 10 00 00 1b c6 1b 56 84 50 00 16 30
30 20 35 00 00 90 10 00 00 1b 00 00 00 fe 00 35
39 4a 57 54 80 31 31 36 57 48 32 0a 00 00 00 00
00 00 84 02 94 01 00 00 00 02 01 0a 20 20 00 5b

----------------

Block 0, Base EDID:
  EDID Structure Version & Revision: 1.3
  Vendor & Product Identification:
    Manufacturer: LGD
    Model: 542
    Made in: 2009
  Basic Display Parameters & Features:
    Digital display
    Maximum image size: 26 cm x 14 cm
    Gamma: 2.20
    RGB color display
    First detailed timing is the preferred timing
  Color Characteristics:
    Red  : 0.5820, 0.3437
    Green: 0.3261, 0.5468
    Blue : 0.1582, 0.1367
    White: 0.3134, 0.3291
  Established Timings I & II: none
  Standard Timings: none
  Detailed Timing Descriptors:
    DTD 1:  1366x768    60.080107 Hz 683:384   47.463 kHz     71.100000 MHz (256 mm x 144 mm)
                 Hfront   48 Hsync  32 Hback   52 Hpol P
                 Vfront    3 Vsync   5 Vback   14 Vpol N
    DTD 2:  1366x768    60.080107 Hz 683:384   47.463 kHz     71.100000 MHz (256 mm x 144 mm)
                 Hfront   48 Hsync  32 Hback   52 Hpol P
                 Vfront    3 Vsync   5 Vback   14 Vpol N
    Alphanumeric Data String: '59JWT.116WH2'
    Manufacturer-Specified Display Descriptor (0x00): 00 00 00 00 84 02 94 01 00 00 00 02 01 0a 20 20 '..............  '
Checksum: 0x5b

----------------

Block 1, Unknown EDID Extension Block 0x00:
  00 ff ff ff ff ff ff 00 30 e4 1e 02 00 00 00 00 '........0.......'
  00 13 01 03 80 1a 0e 78 0a 08 85 95 58 53 8c 28 '.......x....XS.('
  23 50 54 00 00 00 01 01 01 01 01 01 01 01 01 01 '#PT.............'
  01 01 01 01 01 01 c6 1b 56 84 50 00 16 30 30 20 '........V.P..00 '
  35 00 00 90 10 00 00 1b c6 1b 56 84 50 00 16 30 '5.........V.P..0'
  30 20 35 00 00 90 10 00 00 1b 00 00 00 fe 00 35 '0 5............5'
  39 4a 57 54 80 31 31 36 57 48 32 0a 00 00 00 00 '9JWT.116WH2.....'
  00 00 84 02 94 01 00 00 00 02 01 0a 20 20 00 5b '............  .['
Checksum: 0x5b

----------------

Warnings:

Block 0, Base EDID:
  Alphanumeric Data String: Non-ASCII character 0x80 at position 5, can cause problems.

Failures:

Block 0, Base EDID:
  Missing Display Product Name.
  Missing Display Range Limits Descriptor.
Block 1, Base EDID:
  Unknown Extension Block.
EDID:
  Base EDID: EDID specified 0 extension block(s), but found 1 extension block(s).

EDID conformity: FAIL
