edid-decode (hex):

00 ff ff ff ff ff ff 00 4e 14 03 6c 01 00 00 00
0c 1f 01 03 80 35 1e 78 2e 64 c5 ad 50 49 a3 22
12 50 54 bf ef 80 71 4f 81 c0 81 40 81 80 95 00
a9 c0 b3 00 d1 c0 02 3a 80 18 71 38 2d 40 58 2c
45 00 12 2c 21 00 00 1e 00 00 00 fd 00 30 90 36
a2 21 00 0a 20 20 20 20 20 20 00 00 00 fc 00 53
63 65 70 74 72 65 20 4d 32 37 20 20 00 00 00 ff
00 4e 4d 32 37 35 42 49 51 30 30 30 31 20 01 e1

02 03 30 f1 4d 01 02 04 05 90 11 12 13 14 1f 22
03 3f 23 08 07 07 83 01 00 00 67 03 0c 00 30 00
b8 42 6d 1a 00 00 02 01 30 90 ed 00 00 00 00 00
1d 7f 80 72 70 38 1f 40 30 20 35 00 12 2c 21 00
00 1e 8a 6f 80 a0 70 38 40 40 30 20 35 00 12 2c
21 00 00 1a 84 21 56 aa 51 00 1e 30 46 8f 33 00
12 2c 21 00 00 9e 00 00 00 00 00 00 00 00 00 00
00 00 00 00 00 00 00 00 00 00 00 00 00 00 00 71

00 ff ff ff ff ff ff 00 4e 14 03 6c 01 00 00 00
0c 1f 01 03 80 35 1e 78 2e 64 c5 ad 50 49 a3 22
12 50 54 bf ef 80 71 4f 81 c0 81 40 81 80 95 00
a9 c0 b3 00 d1 c0 02 3a 80 18 71 38 2d 40 58 2c
45 00 12 2c 21 00 00 1e 00 00 00 fd 00 30 90 36
a2 21 00 0a 20 20 20 20 20 20 00 00 00 fc 00 53
63 65 70 74 72 65 20 4d 32 37 20 20 00 00 00 ff
00 4e 4d 32 37 35 42 49 51 30 30 30 31 20 01 e1

02 03 30 f1 4d 01 02 04 05 90 11 12 13 14 1f 22
03 3f 23 08 07 07 83 01 00 00 67 03 0c 00 30 00
b8 42 6d 1a 00 00 02 01 30 90 ed 00 00 00 00 00
1d 7f 80 72 70 38 1f 40 30 20 35 00 12 2c 21 00
00 1e 8a 6f 80 a0 70 38 40 40 30 20 35 00 12 2c
21 00 00 1a 84 21 56 aa 51 00 1e 30 46 8f 33 00
12 2c 21 00 00 9e 00 00 00 00 00 00 00 00 00 00
00 00 00 00 00 00 00 00 00 00 00 00 00 00 00 71

----------------

Block 0, Base EDID:
  EDID Structure Version & Revision: 1.3
  Vendor & Product Identification:
    Manufacturer: SPT
    Model: 27651
    Serial Number: ...
    Made in: week 12 of 2021
  Basic Display Parameters & Features:
    Digital display
    Maximum image size: 53 cm x 30 cm
    Gamma: 2.20
    DPMS levels: Off
    RGB color display
    Default (sRGB) color space is primary color space
    First detailed timing is the preferred timing
  Color Characteristics:
    Red  : 0.6767, 0.3144
    Green: 0.2861, 0.6367
    Blue : 0.1357, 0.0703
    White: 0.3134, 0.3291
  Established Timings I & II:
    IBM     :   720x400    70.081663 Hz   9:5     31.467 kHz     28.320000 MHz
    DMT 0x04:   640x480    59.940476 Hz   4:3     31.469 kHz     25.175000 MHz
    Apple   :   640x480    66.666667 Hz   4:3     35.000 kHz     30.240000 MHz
    DMT 0x05:   640x480    72.808802 Hz   4:3     37.861 kHz     31.500000 MHz
    DMT 0x06:   640x480    75.000000 Hz   4:3     37.500 kHz     31.500000 MHz
    DMT 0x08:   800x600    56.250000 Hz   4:3     35.156 kHz     36.000000 MHz
    DMT 0x09:   800x600    60.316541 Hz   4:3     37.879 kHz     40.000000 MHz
    DMT 0x0a:   800x600    72.187572 Hz   4:3     48.077 kHz     50.000000 MHz
    DMT 0x0b:   800x600    75.000000 Hz   4:3     46.875 kHz     49.500000 MHz
    Apple   :   832x624    74.551266 Hz   4:3     49.726 kHz     57.284000 MHz
    DMT 0x10:  1024x768    60.003840 Hz   4:3     48.363 kHz     65.000000 MHz
    DMT 0x11:  1024x768    70.069359 Hz   4:3     56.476 kHz     75.000000 MHz
    DMT 0x12:  1024x768    75.028582 Hz   4:3     60.023 kHz     78.750000 MHz
    DMT 0x24:  1280x1024   75.024675 Hz   5:4     79.976 kHz    135.000000 MHz
    Apple   :  1152x870    75.061550 Hz 192:145   68.681 kHz    100.000000 MHz
  Standard Timings:
    DMT 0x15:  1152x864    75.000000 Hz   4:3     67.500 kHz    108.000000 MHz
    DMT 0x55:  1280x720    60.000000 Hz  16:9     45.000 kHz     74.250000 MHz
    DMT 0x20:  1280x960    60.000000 Hz   4:3     60.000 kHz    108.000000 MHz
    DMT 0x23:  1280x1024   60.019740 Hz   5:4     63.981 kHz    108.000000 MHz
    DMT 0x2f:  1440x900    59.887445 Hz  16:10    55.935 kHz    106.500000 MHz
    DMT 0x53:  1600x900    60.000000 Hz  16:9     60.000 kHz    108.000000 MHz (RB)
    DMT 0x3a:  1680x1050   59.954250 Hz  16:10    65.290 kHz    146.250000 MHz
    DMT 0x52:  1920x1080   60.000000 Hz  16:9     67.500 kHz    148.500000 MHz
  Detailed Timing Descriptors:
    DTD 1:  1920x1080   60.000000 Hz  16:9     67.500 kHz    148.500000 MHz (530 mm x 300 mm)
                 Hfront   88 Hsync  44 Hback  148 Hpol P
                 Vfront    4 Vsync   5 Vback   36 Vpol P
    Display Range Limits:
      Monitor ranges (GTF): 48-144 Hz V, 54-162 kHz H, max dotclock 330 MHz
    Display Product Name: 'Sceptre M27  '
    Display Product Serial Number: ...
  Extension blocks: 1
Checksum: 0xe1

----------------

Block 1, CTA-861 Extension Block:
  Revision: 3
  Underscans IT Video Formats by default
  Basic audio support
  Supports YCbCr 4:4:4
  Supports YCbCr 4:2:2
  Native DTDs: 1
  Video Data Block:
    VIC   1:   640x480    59.940476 Hz   4:3     31.469 kHz     25.175000 MHz
    VIC   2:   720x480    59.940060 Hz   4:3     31.469 kHz     27.000000 MHz
    VIC   4:  1280x720    60.000000 Hz  16:9     45.000 kHz     74.250000 MHz
    VIC   5:  1920x1080i  60.000000 Hz  16:9     33.750 kHz     74.250000 MHz
    VIC  16:  1920x1080   60.000000 Hz  16:9     67.500 kHz    148.500000 MHz (native)
    VIC  17:   720x576    50.000000 Hz   4:3     31.250 kHz     27.000000 MHz
    VIC  18:   720x576    50.000000 Hz  16:9     31.250 kHz     27.000000 MHz
    VIC  19:  1280x720    50.000000 Hz  16:9     37.500 kHz     74.250000 MHz
    VIC  20:  1920x1080i  50.000000 Hz  16:9     28.125 kHz     74.250000 MHz
    VIC  31:  1920x1080   50.000000 Hz  16:9     56.250 kHz    148.500000 MHz
    VIC  34:  1920x1080   30.000000 Hz  16:9     33.750 kHz     74.250000 MHz
    VIC   3:   720x480    59.940060 Hz  16:9     31.469 kHz     27.000000 MHz
    VIC  63:  1920x1080  120.000000 Hz  16:9    135.000 kHz    297.000000 MHz
  Audio Data Block:
    Linear PCM:
      Max channels: 1
      Supported sample rates (kHz): 48 44.1 32
      Supported sample sizes (bits): 24 20 16
  Speaker Allocation Data Block:
    FL/FR - Front Left/Right
  Vendor-Specific Data Block (HDMI), OUI 00-0C-03:
    Source physical address: 3.0.0.0
    Supports_AI
    DC_36bit
    DC_30bit
    DC_Y444
    Maximum TMDS clock: 330 MHz
  Vendor-Specific Data Block (AMD), OUI 00-00-1A:
    Version: 2
    Flags 1: 0x01
      FreeSync Supported
    Minimum Refresh Rate: 48 Hz
    Maximum Refresh Rate: 144 Hz
    MCCS VCP Code: 0xed
    Flags 5: 0x00
  Detailed Timing Descriptors:
    DTD 2:  1920x1080  144.001126 Hz  16:9    159.985 kHz    325.410000 MHz (530 mm x 300 mm)
                 Hfront   48 Hsync  32 Hback   34 Hpol P
                 Vfront    3 Vsync   5 Vback   23 Vpol P
    DTD 3:  1920x1080  119.998991 Hz  16:9    137.279 kHz    285.540000 MHz (530 mm x 300 mm)
                 Hfront   48 Hsync  32 Hback   80 Hpol P
                 Vfront    3 Vsync   5 Vback   56 Vpol N
    DTD 4:  1366x1536i  59.961759 Hz 683:768   47.879 kHz     85.800000 MHz (530 mm x 300 mm)
                 Hfront   70 Hsync 143 Hback  213 Hpol P
                 Vfront    3 Vsync   3 Vback   24 Vpol P Vfront +0.5 Odd Field
                 Vfront    3 Vsync   3 Vback   24 Vpol P Vback  +0.5 Even Field
Checksum: 0x71  Unused space in Extension Block: 25 bytes

----------------

Warnings:

Block 0, Base EDID:
  Vendor & Product Identification: The serial number is one of the known dummy values, it should probably be set to 0.
Block 1, CTA-861 Extension Block:
  Video Data Block: VIC 1 and the first DTD are not identical. Is this intended?
  Detailed Timing Descriptor #4: Image size is 530x300 mm, but based on the picture AR it should be 266x300 mm.
  Display Product Serial Number is set, so the Serial Number in the Base EDID should be 0.
EDID:
  Base EDID: Some timings are out of range of the Monitor Ranges:
    Vertical Freq: 30.000 - 144.001 Hz (Monitor: 48.000 - 144.000 Hz)
    Horizontal Freq: 28.125 - 159.985 kHz (Monitor: 54.000 - 162.000 kHz)

Failures:

Block 0, Base EDID:
  Display Product Serial Number: ...
  Basic Display Parameters & Features: sRGB is signaled, but the chromaticities do not match.
  Display Product Name: No newline, but one or more trailing spaces.
Block 1, CTA-861 Extension Block:
  Missing VCDB, needed for Set Selectable RGB Quantization to avoid interop issues.
EDID:
  Extension Block 2 started with EDID header, ignoring Extension Blocks >= 2.

EDID conformity: FAIL
