edid-decode (hex):

00 ff ff ff ff ff ff 00 06 af 8c 0a 00 00 00 00
00 1d 01 04 95 22 13 78 03 8a a5 8f 56 55 93 29
1f 50 54 00 00 00 01 01 01 01 01 01 01 01 01 01
01 01 01 01 01 01 ce 1d 56 e2 50 00 1e 30 26 16
36 00 58 c2 10 00 00 1a d8 17 56 e2 50 00 1e 30
26 16 36 00 58 c2 10 00 00 1a 00 00 00 fe 00 46
35 56 54 4a 80 42 31 35 36 58 54 4e 00 00 00 00
00 00 41 21 96 00 11 00 00 09 01 0a 20 20 00 48

00 ff ff ff ff ff ff 00 06 af 8c 0a 00 00 00 00
00 1d 01 04 95 22 13 78 03 8a a5 8f 56 55 93 29
1f 50 54 00 00 00 01 01 01 01 01 01 01 01 01 01
01 01 01 01 01 01 ce 1d 56 e2 50 00 1e 30 26 16
36 00 58 c2 10 00 00 1a d8 17 56 e2 50 00 1e 30
26 16 36 00 58 c2 10 00 00 1a 00 00 00 fe 00 46
35 56 54 4a 80 42 31 35 36 58 54 4e 00 00 00 00
00 00 41 21 96 00 11 00 00 09 01 0a 20 20 00 48

----------------

Block 0, Base EDID:
  EDID Structure Version & Revision: 1.4
  Vendor & Product Identification:
    Manufacturer: AUO
    Model: 2700
    Made in: 2019
  Basic Display Parameters & Features:
    Digital display
    Bits per primary color channel: 6
    DisplayPort interface
    Maximum image size: 34 cm x 19 cm
    Gamma: 2.20
    Supported color formats: RGB 4:4:4
    First detailed timing includes the native pixel format and preferred refresh rate
    Display supports continuous frequencies
  Color Characteristics:
    Red  : 0.5605, 0.3359
    Green: 0.3339, 0.5761
    Blue : 0.1621, 0.1230
    White: 0.3134, 0.3291
  Established Timings I & II: none
  Standard Timings: none
  Detailed Timing Descriptors:
    DTD 1:  1366x768    60.059067 Hz 683:384   47.927 kHz     76.300000 MHz (344 mm x 194 mm)
                 Hfront   38 Hsync  22 Hback  166 Hpol P
                 Vfront    3 Vsync   6 Vback   21 Vpol N
    DTD 2:  1366x768    48.047254 Hz 683:384   38.342 kHz     61.040000 MHz (344 mm x 194 mm)
                 Hfront   38 Hsync  22 Hback  166 Hpol P
                 Vfront    3 Vsync   6 Vback   21 Vpol N
    Alphanumeric Data String: 'F5VTJ.B156XTN'
    Manufacturer-Specified Display Descriptor (0x00): 00 00 00 00 41 21 96 00 11 00 00 09 01 0a 20 20 '....A!........  '
Checksum: 0x48

----------------

Warnings:

Block 0, Base EDID:
  Alphanumeric Data String: Non-ASCII character 0x80 at position 5, can cause problems.
  Missing Display Product Name.

Failures:

Block 0, Base EDID:
  Missing Display Range Limits Descriptor.
EDID:
  Extension Block 1 started with EDID header, ignoring Extension Blocks >= 1.

EDID conformity: FAIL
