edid-decode (hex):

00 ff ff ff ff ff ff 00 25 e3 f9 ff 00 00 00 00
1c 21 01 03 80 2e 34 78 2e 00 00 ad 4f 3b b2 26
0e 50 54 25 6b 80 d1 c0 b3 00 01 01 81 80 71 4f
81 c0 81 40 a9 c0 29 bc 00 b4 a0 40 32 b0 30 18
88 00 d1 0b 12 00 00 1a 00 00 00 fd 00 30 3c 26
b4 3c 00 0a 20 20 20 20 20 20 00 00 00 fc 00 32
38 43 31 51 0a 20 20 20 20 20 20 20 00 00 00 ff
00 30 30 30 30 30 30 30 30 30 30 30 30 30 01 f9

02 03 39 f2 4b 01 02 03 04 05 11 12 13 14 1f 90
23 09 7f 07 83 01 00 00 6a 03 0c 00 10 00 38 42
20 00 00 67 d8 5d c4 01 78 80 03 e2 0f 01 e6 06
07 01 62 5e 22 e3 05 e3 01 65 5d 00 a0 a0 40 32
b0 30 18 88 00 d1 0b 12 00 00 1a 6a 5e 00 a0 a0
a0 29 50 30 20 35 00 d1 0b 12 00 00 1a 02 3a 80
18 71 38 2d 40 30 20 88 00 d1 0b 12 00 00 1a 00
00 00 00 00 00 00 00 00 00 00 00 00 00 00 00 c0

00 ff ff ff ff ff ff 00 25 e3 f9 ff 00 00 00 00
1c 21 01 03 80 2e 34 78 2e 00 00 ad 4f 3b b2 26
0e 50 54 25 6b 80 d1 c0 b3 00 01 01 81 80 71 4f
81 c0 81 40 a9 c0 29 bc 00 b4 a0 40 32 b0 30 18
88 00 d1 0b 12 00 00 1a 00 00 00 fd 00 30 3c 26
b4 3c 00 0a 20 20 20 20 20 20 00 00 00 fc 00 32
38 43 31 51 0a 20 20 20 20 20 20 20 00 00 00 ff
00 30 30 30 30 30 30 30 30 30 30 30 30 30 01 f9

02 03 39 f2 4b 01 02 03 04 05 11 12 13 14 1f 90
23 09 7f 07 83 01 00 00 6a 03 0c 00 10 00 38 42
20 00 00 67 d8 5d c4 01 78 80 03 e2 0f 01 e6 06
07 01 62 5e 22 e3 05 e3 01 65 5d 00 a0 a0 40 32
b0 30 18 88 00 d1 0b 12 00 00 1a 6a 5e 00 a0 a0
a0 29 50 30 20 35 00 d1 0b 12 00 00 1a 02 3a 80
18 71 38 2d 40 30 20 88 00 d1 0b 12 00 00 1a 00
00 00 00 00 00 00 00 00 00 00 00 00 00 00 00 c0

----------------

Block 0, Base EDID:
  EDID Structure Version & Revision: 1.3
  Vendor & Product Identification:
    Manufacturer: IOC
    Model: 65529
    Made in: week 28 of 2023
  Basic Display Parameters & Features:
    Digital display
    Maximum image size: 46 cm x 52 cm
    Gamma: 2.20
    DPMS levels: Off
    RGB color display
    Default (sRGB) color space is primary color space
    First detailed timing is the preferred timing
  Color Characteristics:
    Red  : 0.6757, 0.3085
    Green: 0.2304, 0.6953
    Blue : 0.1484, 0.0546
    White: 0.3125, 0.3281
  Established Timings I & II:
    DMT 0x04:   640x480    59.940476 Hz   4:3     31.469 kHz     25.175000 MHz
    DMT 0x06:   640x480    75.000000 Hz   4:3     37.500 kHz     31.500000 MHz
    DMT 0x09:   800x600    60.316541 Hz   4:3     37.879 kHz     40.000000 MHz
    DMT 0x0b:   800x600    75.000000 Hz   4:3     46.875 kHz     49.500000 MHz
    Apple   :   832x624    74.551266 Hz   4:3     49.726 kHz     57.284000 MHz
    DMT 0x10:  1024x768    60.003840 Hz   4:3     48.363 kHz     65.000000 MHz
    DMT 0x12:  1024x768    75.028582 Hz   4:3     60.023 kHz     78.750000 MHz
    DMT 0x24:  1280x1024   75.024675 Hz   5:4     79.976 kHz    135.000000 MHz
    Apple   :  1152x870    75.061550 Hz 192:145   68.681 kHz    100.000000 MHz
  Standard Timings:
    DMT 0x52:  1920x1080   60.000000 Hz  16:9     67.500 kHz    148.500000 MHz
    DMT 0x3a:  1680x1050   59.954250 Hz  16:10    65.290 kHz    146.250000 MHz
    DMT 0x23:  1280x1024   60.019740 Hz   5:4     63.981 kHz    108.000000 MHz
    DMT 0x15:  1152x864    75.000000 Hz   4:3     67.500 kHz    108.000000 MHz
    DMT 0x55:  1280x720    60.000000 Hz  16:9     45.000 kHz     74.250000 MHz
    DMT 0x20:  1280x960    60.000000 Hz   4:3     60.000 kHz    108.000000 MHz
    DMT 0x53:  1600x900    60.000000 Hz  16:9     60.000 kHz    108.000000 MHz (RB)
  Detailed Timing Descriptors:
    DTD 1:  2560x2880   59.999751 Hz   8:9    175.799 kHz    481.690000 MHz (465 mm x 523 mm)
                 Hfront   48 Hsync  24 Hback  108 Hpol P
                 Vfront    8 Vsync   8 Vback   34 Vpol N
    Display Range Limits:
      Monitor ranges (GTF): 48-60 Hz V, 38-180 kHz H, max dotclock 600 MHz
    Display Product Name: '28C1Q'
    Display Product Serial Number: ...
  Extension blocks: 1
Checksum: 0xf9

----------------

Block 1, CTA-861 Extension Block:
  Revision: 3
  Underscans IT Video Formats by default
  Basic audio support
  Supports YCbCr 4:4:4
  Supports YCbCr 4:2:2
  Native DTDs: 2
  Video Data Block:
    VIC   1:   640x480    59.940476 Hz   4:3     31.469 kHz     25.175000 MHz
    VIC   2:   720x480    59.940060 Hz   4:3     31.469 kHz     27.000000 MHz
    VIC   3:   720x480    59.940060 Hz  16:9     31.469 kHz     27.000000 MHz
    VIC   4:  1280x720    60.000000 Hz  16:9     45.000 kHz     74.250000 MHz
    VIC   5:  1920x1080i  60.000000 Hz  16:9     33.750 kHz     74.250000 MHz
    VIC  17:   720x576    50.000000 Hz   4:3     31.250 kHz     27.000000 MHz
    VIC  18:   720x576    50.000000 Hz  16:9     31.250 kHz     27.000000 MHz
    VIC  19:  1280x720    50.000000 Hz  16:9     37.500 kHz     74.250000 MHz
    VIC  20:  1920x1080i  50.000000 Hz  16:9     28.125 kHz     74.250000 MHz
    VIC  31:  1920x1080   50.000000 Hz  16:9     56.250 kHz    148.500000 MHz
    VIC  16:  1920x1080   60.000000 Hz  16:9     67.500 kHz    148.500000 MHz (native)
  Audio Data Block:
    Linear PCM:
      Max channels: 2
      Supported sample rates (kHz): 192 176.4 96 88.2 48 44.1 32
      Supported sample sizes (bits): 24 20 16
  Speaker Allocation Data Block:
    FL/FR - Front Left/Right
  Vendor-Specific Data Block (HDMI), OUI 00-0C-03:
    Source physical address: 1.0.0.0
    DC_36bit
    DC_30bit
    DC_Y444
    Maximum TMDS clock: 330 MHz
    Extended HDMI video details:
  Vendor-Specific Data Block (HDMI Forum), OUI C4-5D-D8:
    Version: 1
    Maximum TMDS Character Rate: 600 MHz
    SCDC Present
    Supports 12-bits/component Deep Color 4:2:0 Pixel Encoding
    Supports 10-bits/component Deep Color 4:2:0 Pixel Encoding
  YCbCr 4:2:0 Capability Map Data Block:
    VIC   1:   640x480    59.940476 Hz   4:3     31.469 kHz     25.175000 MHz
  HDR Static Metadata Data Block:
    Electro optical transfer functions:
      Traditional gamma - SDR luminance range
      Traditional gamma - HDR luminance range
      SMPTE ST2084
    Supported static metadata descriptors:
      Static metadata type 1
    Desired content max luminance: 98 (417.710 cd/m^2)
    Desired content max frame-average luminance: 94 (383.041 cd/m^2)
    Desired content min luminance: 34 (0.074 cd/m^2)
  Colorimetry Data Block:
    xvYCC601
    xvYCC709
    BT2020cYCC
    BT2020YCC
    BT2020RGB
    Gamut Boundary Description Metadata Profile P0
  Detailed Timing Descriptors:
    DTD 2:  2560x2880   30.000251 Hz   8:9     87.901 kHz    239.090000 MHz (465 mm x 523 mm)
                 Hfront   48 Hsync  24 Hback   88 Hpol P
                 Vfront    8 Vsync   8 Vback   34 Vpol N
    DTD 3:  2560x1440   60.000199 Hz  16:9     88.860 kHz    241.700000 MHz (465 mm x 523 mm)
                 Hfront   48 Hsync  32 Hback   80 Hpol P
                 Vfront    3 Vsync   5 Vback   33 Vpol N
    DTD 4:  1920x1080   60.000000 Hz  16:9     67.500 kHz    148.500000 MHz (465 mm x 523 mm)
                 Hfront   48 Hsync  32 Hback  200 Hpol P
                 Vfront    8 Vsync   8 Vback   29 Vpol N
Checksum: 0xc0  Unused space in Extension Block: 16 bytes

----------------

Warnings:

Block 0, Base EDID:
  Display Product Serial Number: ...
Block 1, CTA-861 Extension Block:
  Video Data Block: VIC 1 and the first DTD are not identical. Is this intended?
  YCbCr 4:2:0 Capability Map Data Block: Some YCbCr 4:2:0 timings are invalid for HDMI 2.1 (which requires an RGB timings pixel rate >= 590 MHz).
  Detailed Timing Descriptor #3: Image size is 465x523 mm, but based on the picture AR it should be 465x261 mm.
  Detailed Timing Descriptor #4: DTD is similar but not identical to VIC 16.
  Detailed Timing Descriptor #4: Image size is 465x523 mm, but based on the picture AR it should be 465x261 mm.
EDID:
  Base EDID: Some timings are out of range of the Monitor Ranges:
    Vertical Freq: 30.000 - 75.062 Hz (Monitor: 48.000 - 60.000 Hz)
    Horizontal Freq: 15.734 - 175.799 kHz (Monitor: 38.000 - 180.000 kHz)

Failures:

Block 0, Base EDID:
  Basic Display Parameters & Features: sRGB is signaled, but the chromaticities do not match.
Block 1, CTA-861 Extension Block:
  Missing VCDB, needed for Set Selectable RGB Quantization to avoid interop issues.
EDID:
  Extension Block 2 started with EDID header, ignoring Extension Blocks >= 2.
  CTA-861: Native progressive timings are a mix of several resolutions.

EDID conformity: FAIL
