edid-decode (hex):

00 ff ff ff ff ff ff 00 30 ae 00 80 01 00 00 00
14 18 01 03 80 2f 1a 78 0a eb f5 a6 56 51 9c 26
10 50 54 00 00 00 01 01 01 01 01 01 01 01 01 01
01 01 01 01 01 01 1a 38 80 00 71 38 14 40 60 40
84 00 dd 0c 11 00 00 1e 00 00 00 ff 00 57 4c 45
44 4c 47 44 4c 4d 32 31 35 57 00 00 00 fc 00 4c
42 47 20 41 49 4f 20 50 43 0a 20 20 00 00 00 fe
00 4c 4d 32 31 35 57 46 33 2d 53 4c 4b 31 00 d6

----------------

Block 0, Base EDID:
  EDID Structure Version & Revision: 1.3
  Vendor & Product Identification:
    Manufacturer: LEN
    Model: 32768
    Serial Number: ...
    Made in: week 20 of 2014
  Basic Display Parameters & Features:
    Digital display
    Maximum image size: 47 cm x 26 cm
    Gamma: 2.20
    RGB color display
    First detailed timing is the preferred timing
  Color Characteristics:
    Red  : 0.6513, 0.3378
    Green: 0.3183, 0.6123
    Blue : 0.1513, 0.0654
    White: 0.3134, 0.3291
  Established Timings I & II: none
  Standard Timings: none
  Detailed Timing Descriptors:
    DTD 1:  1920x1080   60.001671 Hz  16:9     66.002 kHz    143.620000 MHz (477 mm x 268 mm)
                 Hfront   96 Hsync  64 Hback   96 Hpol P
                 Vfront    8 Vsync   4 Vback    8 Vpol P
    Display Product Serial Number: ...
    Display Product Name: 'LBG AIO PC'
    Alphanumeric Data String: 'LM215WF3-SLK1'
Checksum: 0xd6

----------------

Warnings:

Block 0, Base EDID:
  Vendor & Product Identification: The serial number is one of the known dummy values, it should probably be set to 0.

Failures:

Block 0, Base EDID:
  Missing Display Range Limits Descriptor.

EDID conformity: FAIL
