edid-decode (hex):

00 ff ff ff ff ff ff 00 30 ae 00 80 00 00 00 00
21 19 01 04 a5 2c 17 78 e2 0a 85 a5 56 51 9d 25
0e 50 54 00 00 00 01 00 01 00 01 01 01 01 01 01
01 01 01 01 01 01 36 2e 40 00 62 84 22 30 58 a8
35 00 b8 e6 10 00 00 1c 00 00 00 fd 00 32 4b 30
4c 0d 00 0a 20 20 20 20 20 20 00 00 00 fc 00 4c
42 47 20 41 49 4f 20 50 43 0a 20 20 00 00 00 ff
00 30 30 30 30 30 31 0a 20 20 20 20 20 20 00 71

----------------

Block 0, Base EDID:
  EDID Structure Version & Revision: 1.4
  Vendor & Product Identification:
    Manufacturer: LEN
    Model: 32768
    Made in: week 33 of 2015
  Basic Display Parameters & Features:
    Digital display
    Bits per primary color channel: 8
    DisplayPort interface
    Maximum image size: 44 cm x 23 cm
    Gamma: 2.20
    DPMS levels: Standby Suspend Off
    Supported color formats: RGB 4:4:4
    First detailed timing includes the native pixel format and preferred refresh rate
  Color Characteristics:
    Red  : 0.6445, 0.3359
    Green: 0.3183, 0.6152
    Blue : 0.1464, 0.0546
    White: 0.3134, 0.3291
  Established Timings I & II: none
  Standard Timings:
  Detailed Timing Descriptors:
    DTD 1:  1600x900    59.971368 Hz  16:9     56.013 kHz    118.300000 MHz (440 mm x 230 mm)
                 Hfront   88 Hsync 168 Hback  256 Hpol N
                 Vfront    3 Vsync   5 Vback   26 Vpol P
    Display Range Limits:
      Monitor ranges (GTF): 50-75 Hz V, 48-76 kHz H, max dotclock 130 MHz
    Display Product Name: 'LBG AIO PC'
    Display Product Serial Number: ...
Checksum: 0x71

----------------

Warnings:

Block 0, Base EDID:
  Detailed Timing Descriptor #1: Image size is 440x230 mm, but based on the picture AR it should be 440x247 mm.
  Display Range Limits: GTF support is deprecated in EDID 1.4.
  Display Product Serial Number: ...

Failures:

Block 0, Base EDID:
  Standard Timings: Use 0x0101 as the invalid Standard Timings code, not 0x0100.
  Standard Timings: Use 0x0101 as the invalid Standard Timings code, not 0x0100.
  Display Range Limits: GTF is supported, but the display does not support continuous frequencies.

EDID conformity: FAIL
