edid-decode (hex):

00 ff ff ff ff ff ff 00 06 b3 ef 27 01 01 01 01
03 22 01 03 80 3c 22 78 ee a2 55 ac 50 46 ab 26
0c 50 54 bf cf 00 d1 c0 b3 00 95 00 81 40 81 80
81 c0 71 40 01 01 6a 5e 00 a0 a0 a0 29 50 30 20
35 00 55 50 21 00 00 1a 00 00 00 fd 00 30 90 1e
df 3c 00 0a 20 20 20 20 20 20 00 00 00 fc 00 56
47 32 37 41 51 33 41 0a 20 20 20 20 00 00 00 ff
00 53 31 4c 4d 41 53 30 30 34 39 38 38 0a 01 1f

02 03 48 71 49 61 03 04 90 12 13 1f 3f 40 23 09
07 07 83 01 00 00 67 03 0c 00 10 00 38 44 6a d8
5d c4 01 78 80 03 00 30 90 6d 1a 00 00 02 01 30
90 f0 00 00 00 00 00 e3 05 df 01 e2 0f 01 e6 06
05 01 50 50 44 e2 00 ea f6 e7 00 99 a0 a0 50 50
30 20 35 00 55 50 21 00 00 1a 70 c2 00 a0 a0 a0
55 50 30 20 35 00 55 50 21 00 00 1a 70 a0 00 a0
a0 a0 46 50 30 20 35 00 55 50 21 00 00 1a 00 07

00 ff ff ff ff ff ff 00 06 b3 ef 27 01 01 01 01
03 22 01 03 80 3c 22 78 ee a2 55 ac 50 46 ab 26
0c 50 54 bf cf 00 d1 c0 b3 00 95 00 81 40 81 80
81 c0 71 40 01 01 6a 5e 00 a0 a0 a0 29 50 30 20
35 00 55 50 21 00 00 1a 00 00 00 fd 00 30 90 1e
df 3c 00 0a 20 20 20 20 20 20 00 00 00 fc 00 56
47 32 37 41 51 33 41 0a 20 20 20 20 00 00 00 ff
00 53 31 4c 4d 41 53 30 30 34 39 38 38 0a 01 1f

02 03 48 71 49 61 03 04 90 12 13 1f 3f 40 23 09
07 07 83 01 00 00 67 03 0c 00 10 00 38 44 6a d8
5d c4 01 78 80 03 00 30 90 6d 1a 00 00 02 01 30
90 f0 00 00 00 00 00 e3 05 df 01 e2 0f 01 e6 06
05 01 50 50 44 e2 00 ea f6 e7 00 99 a0 a0 50 50
30 20 35 00 55 50 21 00 00 1a 70 c2 00 a0 a0 a0
55 50 30 20 35 00 55 50 21 00 00 1a 70 a0 00 a0
a0 a0 46 50 30 20 35 00 55 50 21 00 00 1a 00 07

----------------

Block 0, Base EDID:
  EDID Structure Version & Revision: 1.3
  Vendor & Product Identification:
    Manufacturer: AUS
    Model: 10223
    Serial Number: ...
    Made in: week 3 of 2024
  Basic Display Parameters & Features:
    Digital display
    Maximum image size: 60 cm x 34 cm
    Gamma: 2.20
    DPMS levels: Standby Suspend Off
    RGB color display
    Default (sRGB) color space is primary color space
    First detailed timing is the preferred timing
  Color Characteristics:
    Red  : 0.6738, 0.3144
    Green: 0.2734, 0.6699
    Blue : 0.1494, 0.0478
    White: 0.3134, 0.3291
  Established Timings I & II:
    IBM     :   720x400    70.081663 Hz   9:5     31.467 kHz     28.320000 MHz
    DMT 0x04:   640x480    59.940476 Hz   4:3     31.469 kHz     25.175000 MHz
    Apple   :   640x480    66.666667 Hz   4:3     35.000 kHz     30.240000 MHz
    DMT 0x05:   640x480    72.808802 Hz   4:3     37.861 kHz     31.500000 MHz
    DMT 0x06:   640x480    75.000000 Hz   4:3     37.500 kHz     31.500000 MHz
    DMT 0x08:   800x600    56.250000 Hz   4:3     35.156 kHz     36.000000 MHz
    DMT 0x09:   800x600    60.316541 Hz   4:3     37.879 kHz     40.000000 MHz
    DMT 0x0a:   800x600    72.187572 Hz   4:3     48.077 kHz     50.000000 MHz
    DMT 0x0b:   800x600    75.000000 Hz   4:3     46.875 kHz     49.500000 MHz
    DMT 0x10:  1024x768    60.003840 Hz   4:3     48.363 kHz     65.000000 MHz
    DMT 0x11:  1024x768    70.069359 Hz   4:3     56.476 kHz     75.000000 MHz
    DMT 0x12:  1024x768    75.028582 Hz   4:3     60.023 kHz     78.750000 MHz
    DMT 0x24:  1280x1024   75.024675 Hz   5:4     79.976 kHz    135.000000 MHz
  Standard Timings:
    DMT 0x52:  1920x1080   60.000000 Hz  16:9     67.500 kHz    148.500000 MHz
    DMT 0x3a:  1680x1050   59.954250 Hz  16:10    65.290 kHz    146.250000 MHz
    DMT 0x2f:  1440x900    59.887445 Hz  16:10    55.935 kHz    106.500000 MHz
    DMT 0x20:  1280x960    60.000000 Hz   4:3     60.000 kHz    108.000000 MHz
    DMT 0x23:  1280x1024   60.019740 Hz   5:4     63.981 kHz    108.000000 MHz
    DMT 0x55:  1280x720    60.000000 Hz  16:9     45.000 kHz     74.250000 MHz
    GTF     :  1152x864    60.000000 Hz   4:3     53.700 kHz     81.624000 MHz
  Detailed Timing Descriptors:
    DTD 1:  2560x1440   60.000199 Hz  16:9     88.860 kHz    241.700000 MHz (597 mm x 336 mm)
                 Hfront   48 Hsync  32 Hback   80 Hpol P
                 Vfront    3 Vsync   5 Vback   33 Vpol N
    Display Range Limits:
      Monitor ranges (GTF): 48-144 Hz V, 30-223 kHz H, max dotclock 600 MHz
    Display Product Name: 'VG27AQ3A'
    Display Product Serial Number: ...
  Extension blocks: 1
Checksum: 0x1f

----------------

Block 1, CTA-861 Extension Block:
  Revision: 3
  Basic audio support
  Supports YCbCr 4:4:4
  Supports YCbCr 4:2:2
  Native DTDs: 1
  Video Data Block:
    VIC  97:  3840x2160   60.000000 Hz  16:9    135.000 kHz    594.000000 MHz
    VIC   3:   720x480    59.940060 Hz  16:9     31.469 kHz     27.000000 MHz
    VIC   4:  1280x720    60.000000 Hz  16:9     45.000 kHz     74.250000 MHz
    VIC  16:  1920x1080   60.000000 Hz  16:9     67.500 kHz    148.500000 MHz (native)
    VIC  18:   720x576    50.000000 Hz  16:9     31.250 kHz     27.000000 MHz
    VIC  19:  1280x720    50.000000 Hz  16:9     37.500 kHz     74.250000 MHz
    VIC  31:  1920x1080   50.000000 Hz  16:9     56.250 kHz    148.500000 MHz
    VIC  63:  1920x1080  120.000000 Hz  16:9    135.000 kHz    297.000000 MHz
    VIC  64:  1920x1080  100.000000 Hz  16:9    112.500 kHz    297.000000 MHz
  Audio Data Block:
    Linear PCM:
      Max channels: 2
      Supported sample rates (kHz): 48 44.1 32
      Supported sample sizes (bits): 24 20 16
  Speaker Allocation Data Block:
    FL/FR - Front Left/Right
  Vendor-Specific Data Block (HDMI), OUI 00-0C-03:
    Source physical address: 1.0.0.0
    DC_36bit
    DC_30bit
    DC_Y444
    Maximum TMDS clock: 340 MHz
  Vendor-Specific Data Block (HDMI Forum), OUI C4-5D-D8:
    Version: 1
    Maximum TMDS Character Rate: 600 MHz
    SCDC Present
    Supports 12-bits/component Deep Color 4:2:0 Pixel Encoding
    Supports 10-bits/component Deep Color 4:2:0 Pixel Encoding
    VRRmin: 48 Hz
    VRRmax: 144 Hz
  Vendor-Specific Data Block (AMD), OUI 00-00-1A:
    Version: 2
    Flags 1: 0x01
      FreeSync Supported
    Minimum Refresh Rate: 48 Hz
    Maximum Refresh Rate: 144 Hz
    MCCS VCP Code: 0xf0
    Flags 5: 0x00
  Colorimetry Data Block:
    xvYCC601
    xvYCC709
    sYCC601
    opYCC601
    opRGB
    BT2020YCC
    BT2020RGB
    Gamut Boundary Description Metadata Profile P0
  YCbCr 4:2:0 Capability Map Data Block:
    VIC  97:  3840x2160   60.000000 Hz  16:9    135.000 kHz    594.000000 MHz
  HDR Static Metadata Data Block:
    Electro optical transfer functions:
      Traditional gamma - SDR luminance range
      SMPTE ST2084
    Supported static metadata descriptors:
      Static metadata type 1
    Desired content max luminance: 80 (282.843 cd/m^2)
    Desired content max frame-average luminance: 80 (282.843 cd/m^2)
    Desired content min luminance: 68 (0.201 cd/m^2)
  Video Capability Data Block:
    YCbCr quantization: Selectable (via AVI YQ)
    RGB quantization: Selectable (via AVI Q)
    PT scan behavior: Always Underscanned
    IT scan behavior: Always Underscanned
    CE scan behavior: Always Underscanned
  Detailed Timing Descriptors:
    DTD 2:  2560x1440  143.999651 Hz  16:9    218.879 kHz    593.820000 MHz (597 mm x 336 mm)
                 Hfront   48 Hsync  32 Hback   73 Hpol P
                 Vfront    3 Vsync   5 Vback   72 Vpol N
    DTD 3:  2560x1440  120.000000 Hz  16:9    183.000 kHz    497.760000 MHz (597 mm x 336 mm)
                 Hfront   48 Hsync  32 Hback   80 Hpol P
                 Vfront    3 Vsync   5 Vback   77 Vpol N
    DTD 4:  2560x1440  100.000000 Hz  16:9    151.000 kHz    410.720000 MHz (597 mm x 336 mm)
                 Hfront   48 Hsync  32 Hback   80 Hpol P
                 Vfront    3 Vsync   5 Vback   62 Vpol N
Checksum: 0x07  Unused space in Extension Block: 1 byte

----------------

Warnings:

Block 0, Base EDID:
  Vendor & Product Identification: The serial number is one of the known dummy values, it should probably be set to 0.
Block 1, CTA-861 Extension Block:
  IT Video Formats are overscanned by default, but normally this should be underscanned.
  Video Data Block: VIC 97 and the first DTD are not identical. Is this intended?
  Video Capability Data Block: S_PT is equal to S_IT and S_CE, so should be set to 0 instead.
  Display Product Serial Number is set, so the Serial Number in the Base EDID should be 0.

Failures:

Block 0, Base EDID:
  Basic Display Parameters & Features: sRGB is signaled, but the chromaticities do not match.
Block 1, CTA-861 Extension Block:
  Video Capability Data Block: IT video formats are always underscanned, but bit 7 of Byte 3 of the CTA-861 Extension header is set to overscanned.
EDID:
  Extension Block 2 started with EDID header, ignoring Extension Blocks >= 2.
  CTA-861: Native progressive timings are a mix of several resolutions.

EDID conformity: FAIL
