edid-decode (hex):

00 ff ff ff ff ff ff 00 09 e5 6b 0d 00 00 00 00
2e 22 01 04 a5 26 15 78 03 9e 05 94 5c 59 95 2b
23 50 54 00 00 00 01 01 01 01 01 01 01 01 01 01
01 01 01 01 01 01 ed 89 80 a5 70 38 60 40 30 20
36 00 7e d7 10 00 00 1a 78 39 80 a5 70 38 60 40
30 20 36 00 7e d7 10 00 00 1a 00 00 00 fd 00 30
90 a9 a9 23 01 0a 20 20 20 20 20 20 00 00 00 fc
00 4e 56 31 37 33 46 48 4d 2d 4e 58 34 0a 01 3d

70 20 79 02 00 81 00 15 74 1a 00 00 03 01 30 90
00 00 4a 5a 4a 5a 90 00 00 00 00 00 00 00 00 00
00 00 00 00 00 00 00 00 00 00 00 00 00 00 00 00
00 00 00 00 00 00 00 00 00 00 00 00 00 00 00 00
00 00 00 00 00 00 00 00 00 00 00 00 00 00 00 00
00 00 00 00 00 00 00 00 00 00 00 00 00 00 00 00
00 00 00 00 00 00 00 00 00 00 00 00 00 00 00 00
00 00 00 00 00 00 00 00 00 00 00 00 00 00 a5 90

00 ff ff ff ff ff ff 00 09 e5 6b 0d 00 00 00 00
2e 22 01 04 a5 26 15 78 03 9e 05 94 5c 59 95 2b
23 50 54 00 00 00 01 01 01 01 01 01 01 01 01 01
01 01 01 01 01 01 ed 89 80 a5 70 38 60 40 30 20
36 00 7e d7 10 00 00 1a 78 39 80 a5 70 38 60 40
30 20 36 00 7e d7 10 00 00 1a 00 00 00 fd 00 30
90 a9 a9 23 01 0a 20 20 20 20 20 20 00 00 00 fc
00 4e 56 31 37 33 46 48 4d 2d 4e 58 34 0a 01 3d

70 20 79 02 00 81 00 15 74 1a 00 00 03 01 30 90
00 00 4a 5a 4a 5a 90 00 00 00 00 00 00 00 00 00
00 00 00 00 00 00 00 00 00 00 00 00 00 00 00 00
00 00 00 00 00 00 00 00 00 00 00 00 00 00 00 00
00 00 00 00 00 00 00 00 00 00 00 00 00 00 00 00
00 00 00 00 00 00 00 00 00 00 00 00 00 00 00 00
00 00 00 00 00 00 00 00 00 00 00 00 00 00 00 00
00 00 00 00 00 00 00 00 00 00 00 00 00 00 a5 90

----------------

Block 0, Base EDID:
  EDID Structure Version & Revision: 1.4
  Vendor & Product Identification:
    Manufacturer: BOE
    Model: 3435
    Made in: week 46 of 2024
  Basic Display Parameters & Features:
    Digital display
    Bits per primary color channel: 8
    DisplayPort interface
    Maximum image size: 38 cm x 21 cm
    Gamma: 2.20
    Supported color formats: RGB 4:4:4
    First detailed timing includes the native pixel format and preferred refresh rate
    Display supports continuous frequencies
  Color Characteristics:
    Red  : 0.5800, 0.3603
    Green: 0.3505, 0.5839
    Blue : 0.1679, 0.1367
    White: 0.3134, 0.3291
  Established Timings I & II: none
  Standard Timings: none
  Detailed Timing Descriptors:
    DTD 1:  1920x1080  144.003165 Hz  16:9    169.348 kHz    353.090000 MHz (382 mm x 215 mm)
                 Hfront   48 Hsync  32 Hback   85 Hpol P
                 Vfront    3 Vsync   6 Vback   87 Vpol N
    DTD 2:  1920x1080   60.000979 Hz  16:9     70.561 kHz    147.120000 MHz (382 mm x 215 mm)
                 Hfront   48 Hsync  32 Hback   85 Hpol P
                 Vfront    3 Vsync   6 Vback   87 Vpol N
    Display Range Limits:
      Monitor ranges (Range Limits Only): 48-144 Hz V, 169-169 kHz H, max dotclock 350 MHz
    Display Product Name: 'NV173FHM-NX4'
  Extension blocks: 1
Checksum: 0x3d

----------------

Block 1, DisplayID Extension Block:
  Version: 2.0
  Extension Count: 0
  Display Product Primary Use Case: None of the listed primary use cases; generic display
  CTA-861 DisplayID Data Block:
  Vendor-Specific Data Block (AMD), OUI 00-00-1A:
    Version: 3
    Flags 1: 0x01
      FreeSync Supported
    Minimum Refresh Rate: 48 Hz
    Maximum Refresh Rate: 144 Hz
    Flags 5: 0x00
  Checksum: 0xa5
Checksum: 0x90

----------------

Warnings:

EDID:
  Base EDID: Some timings are out of range of the Monitor Ranges:
    Horizontal Freq: 70.561 - 169.347 kHz (Monitor: 169.000 - 169.000 kHz)
    Maximum Clock: 353.090 MHz (Monitor: 350.000 MHz)

Failures:

EDID:
  Extension Block 2 started with EDID header, ignoring Extension Blocks >= 2.
  DisplayID: Missing DisplayID Display Parameters Data Block.
  DisplayID: Missing DisplayID Type VII Detailed Timing Data Block.
  DisplayID: DisplayID expects at least one preferred timing.

EDID conformity: FAIL
