edid-decode (hex):

00 ff ff ff ff ff ff 00 0e 77 31 14 00 00 00 00
00 21 01 04 b5 1e 13 78 03 2f 55 a6 54 4c 9b 24
0d 50 54 00 00 00 01 01 01 01 01 01 01 01 01 01
01 01 01 01 01 01 17 88 40 a0 b0 08 6e 70 30 20
66 00 2d bc 10 00 00 18 00 00 00 fd 00 1e 78 e6
e6 46 01 0a 20 20 20 20 20 20 00 00 00 fe 00 43
53 4f 54 20 54 33 0a 20 20 20 20 20 00 00 00 fc
00 4d 4e 45 30 30 37 5a 41 33 2d 32 0a 20 01 cc

70 20 79 02 00 22 00 14 bf a1 0a 85 3f 0b 9f 00
2f 00 1f 00 07 07 6d 00 05 00 05 00 2b 00 0c 27
00 1e 77 00 00 27 00 1e 3b 00 00 81 00 15 74 1a
00 00 03 51 1e 78 00 00 00 00 00 00 78 00 00 00
00 00 00 00 00 00 00 00 00 00 00 00 00 00 00 00
00 00 00 00 00 00 00 00 00 00 00 00 00 00 00 00
00 00 00 00 00 00 00 00 00 00 00 00 00 00 00 00
00 00 00 00 00 00 00 00 00 00 00 00 00 00 8b 90

00 ff ff ff ff ff ff 00 0e 77 31 14 00 00 00 00
00 21 01 04 b5 1e 13 78 03 2f 55 a6 54 4c 9b 24
0d 50 54 00 00 00 01 01 01 01 01 01 01 01 01 01
01 01 01 01 01 01 17 88 40 a0 b0 08 6e 70 30 20
66 00 2d bc 10 00 00 18 00 00 00 fd 00 1e 78 e6
e6 46 01 0a 20 20 20 20 20 20 00 00 00 fe 00 43
53 4f 54 20 54 33 0a 20 20 20 20 20 00 00 00 fc
00 4d 4e 45 30 30 37 5a 41 33 2d 32 0a 20 01 cc

70 20 79 02 00 22 00 14 bf a1 0a 85 3f 0b 9f 00
2f 00 1f 00 07 07 6d 00 05 00 05 00 2b 00 0c 27
00 1e 77 00 00 27 00 1e 3b 00 00 81 00 15 74 1a
00 00 03 51 1e 78 00 00 00 00 00 00 78 00 00 00
00 00 00 00 00 00 00 00 00 00 00 00 00 00 00 00
00 00 00 00 00 00 00 00 00 00 00 00 00 00 00 00
00 00 00 00 00 00 00 00 00 00 00 00 00 00 00 00
00 00 00 00 00 00 00 00 00 00 00 00 00 00 8b 90

----------------

Block 0, Base EDID:
  EDID Structure Version & Revision: 1.4
  Vendor & Product Identification:
    Manufacturer: CSW
    Model: 5169
    Made in: 2023
  Basic Display Parameters & Features:
    Digital display
    Bits per primary color channel: 10
    DisplayPort interface
    Maximum image size: 30 cm x 19 cm
    Gamma: 2.20
    Supported color formats: RGB 4:4:4
    First detailed timing includes the native pixel format and preferred refresh rate
    Display supports continuous frequencies
  Color Characteristics:
    Red  : 0.6484, 0.3300
    Green: 0.2998, 0.6083
    Blue : 0.1416, 0.0517
    White: 0.3134, 0.3291
  Established Timings I & II: none
  Standard Timings: none
  Detailed Timing Descriptors:
    DTD 1:  2880x1800   60.001033 Hz  16:10   114.602 kHz    348.390000 MHz (301 mm x 188 mm)
                 Hfront   48 Hsync  32 Hback   80 Hpol N
                 Vfront    6 Vsync   6 Vback   98 Vpol N
    Display Range Limits:
      Monitor ranges (Range Limits Only): 30-120 Hz V, 230-230 kHz H, max dotclock 700 MHz
    Alphanumeric Data String: 'CSOT T3'
    Display Product Name: 'MNE007ZA3-2'
  Extension blocks: 1
Checksum: 0xcc

----------------

Block 1, DisplayID Extension Block:
  Version: 2.0
  Extension Count: 0
  Display Product Primary Use Case: None of the listed primary use cases; generic display
  Video Timing Modes Type 7 - Detailed Timings Data Block:
    DTD:  2880x1800  120.000000 Hz  16:10   229.200 kHz    696.768000 MHz (aspect 16:10, no 3D stereo, preferred)
               Hfront   48 Hsync  32 Hback   80 Hpol N
               Vfront    6 Vsync   6 Vback   98 Vpol N
  Adaptive Sync Data Block:
    Descriptor #1:
      Native Panel Range
      Fixed Average V-Total and Adaptive V-Total
      Supports Seamless Transition
      'Max Single Frame Duration Increase' field value without jitter impact
      'Max Single Frame Duration Decrease' field value without jitter impact
      Max Duration Increase: 0.00 ms
      Max Duration Decrease: 0.00 ms
      Min Refresh Rate: 30 Hz
      Max Refresh Rate: 120 Hz
    Descriptor #2:
      Native Panel Range
      Fixed Average V-Total and Adaptive V-Total
      Supports Seamless Transition
      'Max Single Frame Duration Increase' field value without jitter impact
      'Max Single Frame Duration Decrease' field value without jitter impact
      Max Duration Increase: 0.00 ms
      Max Duration Decrease: 0.00 ms
      Min Refresh Rate: 30 Hz
      Max Refresh Rate: 60 Hz
  CTA-861 DisplayID Data Block:
  Vendor-Specific Data Block (AMD), OUI 00-00-1A:
    Version: 3
    Flags 1: 0x51
      FreeSync Supported
      Panel Replay/PSR Switch Supported
      Panel Replay Supported
    Minimum Refresh Rate: 30 Hz
    Maximum Refresh Rate: 120 Hz
    Flags 5: 0x00
  Checksum: 0x8b
Checksum: 0x90

----------------

Warnings:

EDID:
  Base EDID: Some timings are out of range of the Monitor Ranges:
    Horizontal Freq: 114.601 - 229.200 kHz (Monitor: 230.000 - 230.000 kHz)

Failures:

EDID:
  Extension Block 2 started with EDID header, ignoring Extension Blocks >= 2.
  DisplayID: Missing DisplayID Display Parameters Data Block.

EDID conformity: FAIL
