edid-decode (hex):

00 ff ff ff ff ff ff 00 4e 84 60 07 01 00 00 00
05 11 01 03 80 46 27 78 0a 92 03 a2 56 48 99 25
14 4a 4d 81 08 00 95 00 8b c0 01 01 01 01 01 01
01 01 01 01 01 01 66 21 50 b0 51 00 1b 30 40 70
36 00 00 00 00 00 00 1e 01 1d 80 18 71 1c 16 20
58 2c 25 00 00 00 00 00 00 9e 00 00 00 fc 00 53
54 44 20 48 44 4d 49 20 54 56 0a 20 00 00 00 fd
00 3b 3d 0f 32 09 00 0a 20 20 20 20 20 20 01 02

02 03 19 71 47 84 04 02 01 14 13 12 26 09 07 07
00 00 00 65 03 0c 00 10 00 01 1d 00 72 51 d0 1e
20 6e 28 55 00 00 00 00 00 00 1e 8c 0a d0 8a 20
e0 2d 10 10 3e 96 00 00 00 00 00 00 18 01 1d 80
d0 72 1c 16 20 10 2c 25 80 00 00 00 00 00 9e 01
1d 00 bc 52 d0 1e 20 b8 28 55 40 00 00 00 00 00
1e 8c 0a d0 90 20 40 31 20 0c 40 55 00 00 00 00
00 00 18 00 00 00 00 00 00 00 00 00 00 00 00 a6

00 ff ff ff ff ff ff 00 4e 84 60 07 01 00 00 00
05 11 01 03 80 46 27 78 0a 92 03 a2 56 48 99 25
14 4a 4d 81 08 00 95 00 8b c0 01 01 01 01 01 01
01 01 01 01 01 01 66 21 50 b0 51 00 1b 30 40 70
36 00 00 00 00 00 00 1e 01 1d 80 18 71 1c 16 20
58 2c 25 00 00 00 00 00 00 9e 00 00 00 fc 00 53
54 44 20 48 44 4d 49 20 54 56 0a 20 00 00 00 fd
00 3b 3d 0f 32 09 00 0a 20 20 20 20 20 20 01 02

02 03 19 71 47 84 04 02 01 14 13 12 26 09 07 07
00 00 00 65 03 0c 00 10 00 01 1d 00 72 51 d0 1e
20 6e 28 55 00 00 00 00 00 00 1e 8c 0a d0 8a 20
e0 2d 10 10 3e 96 00 00 00 00 00 00 18 01 1d 80
d0 72 1c 16 20 10 2c 25 80 00 00 00 00 00 9e 01
1d 00 bc 52 d0 1e 20 b8 28 55 40 00 00 00 00 00
1e 8c 0a d0 90 20 40 31 20 0c 40 55 00 00 00 00
00 00 18 00 00 00 00 00 00 00 00 00 00 00 00 a6

----------------

Block 0, Base EDID:
  EDID Structure Version & Revision: 1.3
  Vendor & Product Identification:
    Manufacturer: STD
    Model: 1888
    Serial Number: ...
    Made in: week 5 of 2007
  Basic Display Parameters & Features:
    Digital display
    Maximum image size: 70 cm x 39 cm
    Gamma: 2.20
    RGB color display
    First detailed timing is the preferred timing
  Color Characteristics:
    Red  : 0.6347, 0.3369
    Green: 0.2812, 0.5996
    Blue : 0.1445, 0.0781
    White: 0.2890, 0.3037
  Established Timings I & II:
    IBM     :   720x400    70.081663 Hz   9:5     31.467 kHz     28.320000 MHz
    DMT 0x09:   800x600    60.316541 Hz   4:3     37.879 kHz     40.000000 MHz
    DMT 0x10:  1024x768    60.003840 Hz   4:3     48.363 kHz     65.000000 MHz
  Standard Timings:
    DMT 0x2f:  1440x900    59.887445 Hz  16:10    55.935 kHz    106.500000 MHz
    GTF     :  1360x765    60.000341 Hz  16:9     47.520 kHz     84.396000 MHz
  Detailed Timing Descriptors:
    DTD 1:  1360x768    60.015162 Hz  85:48    47.712 kHz     85.500000 MHz
                 Hfront   64 Hsync 112 Hback  256 Hpol P
                 Vfront    3 Vsync   6 Vback   18 Vpol P
    DTD 2:  1920x1080i  60.000000 Hz  16:9     33.750 kHz     74.250000 MHz
                 Hfront   88 Hsync  44 Hback  148 Hpol P
                 Vfront    2 Vsync   5 Vback   15 Vpol P Vfront +0.5 Odd Field
                 Vfront    2 Vsync   5 Vback   15 Vpol P Vback  +0.5 Even Field
    Display Product Name: 'STD HDMI TV'
    Display Range Limits:
      Monitor ranges (GTF): 59-61 Hz V, 15-50 kHz H, max dotclock 90 MHz
  Extension blocks: 1
Checksum: 0x02

----------------

Block 1, CTA-861 Extension Block:
  Revision: 3
  Basic audio support
  Supports YCbCr 4:4:4
  Supports YCbCr 4:2:2
  Native DTDs: 1
  Video Data Block:
    VIC   4:  1280x720    60.000000 Hz  16:9     45.000 kHz     74.250000 MHz (native)
    VIC   4:  1280x720    60.000000 Hz  16:9     45.000 kHz     74.250000 MHz
    VIC   2:   720x480    59.940060 Hz   4:3     31.469 kHz     27.000000 MHz
    VIC   1:   640x480    59.940476 Hz   4:3     31.469 kHz     25.175000 MHz
    VIC  20:  1920x1080i  50.000000 Hz  16:9     28.125 kHz     74.250000 MHz
    VIC  19:  1280x720    50.000000 Hz  16:9     37.500 kHz     74.250000 MHz
    VIC  18:   720x576    50.000000 Hz  16:9     31.250 kHz     27.000000 MHz
  Audio Data Block:
    Linear PCM:
      Max channels: 2
      Supported sample rates (kHz): 48 44.1 32
      Supported sample sizes (bits): 24 20 16
    Reserved (0x00)
  Vendor-Specific Data Block (HDMI), OUI 00-0C-03:
    Source physical address: 1.0.0.0
  Detailed Timing Descriptors:
    DTD 3:  1280x720    60.000000 Hz  16:9     45.000 kHz     74.250000 MHz
                 Hfront  110 Hsync  40 Hback  220 Hpol P
                 Vfront    5 Vsync   5 Vback   20 Vpol P
    DTD 4:   720x480    59.940060 Hz   3:2     31.469 kHz     27.000000 MHz
                 Hfront   16 Hsync  62 Hback   60 Hpol N
                 Vfront    9 Vsync   6 Vback   30 Vpol N
    DTD 5:  1920x1080i  50.000000 Hz  16:9     28.125 kHz     74.250000 MHz
                 Hfront  528 Hsync  44 Hback  148 Hpol P
                 Vfront    2 Vsync   5 Vback   15 Vpol P Vfront +0.5 Odd Field
                 Vfront    2 Vsync   5 Vback   15 Vpol P Vback  +0.5 Even Field
    DTD 6:  1280x720    50.000000 Hz  16:9     37.500 kHz     74.250000 MHz
                 Hfront  440 Hsync  40 Hback  220 Hpol P
                 Vfront    5 Vsync   5 Vback   20 Vpol P
    DTD 7:   720x576    50.000000 Hz   5:4     31.250 kHz     27.000000 MHz
                 Hfront   12 Hsync  64 Hback   68 Hpol N
                 Vfront    5 Vsync   5 Vback   39 Vpol N
Checksum: 0xa6  Unused space in Extension Block: 12 bytes

----------------

Warnings:

Block 0, Base EDID:
  Vendor & Product Identification: The serial number is one of the known dummy values, it should probably be set to 0.
  Standard Timings: Standard Timing 1360x765 has a dubious odd vertical resolution.
  Detailed Timing Descriptor #2: DTD is identical to VIC 5, which is not present in the CTA Ext Block.
Block 1, CTA-861 Extension Block:
  IT Video Formats are overscanned by default, but normally this should be underscanned.
  Video Data Block: VIC 4 and the first DTD are not identical. Is this intended?
  Add a Colorimetry Data Block with the sRGB colorimetry bit set to avoid interop issues.
EDID:
  Base EDID: Some timings are out of range of the Monitor Ranges:
    Vertical Freq: 50.000 - 70.082 Hz (Monitor: 59.000 - 61.000 Hz)
    Horizontal Freq: 28.125 - 55.934 kHz (Monitor: 15.000 - 50.000 kHz)
    Maximum Clock: 106.500 MHz (Monitor: 90.000 MHz)

Failures:

Block 0, Base EDID:
  Detailed Timing Descriptor #1: Mismatch of image size vs display size: image size is not set, but display size is.
  Detailed Timing Descriptor #2: Mismatch of image size vs display size: image size is not set, but display size is.
Block 1, CTA-861 Extension Block:
  Video Data Block: Duplicate VIC 4.
  Audio Data Block: Audio Format Code 0x00 is reserved.
  Detailed Timing Descriptor #3: Mismatch of image size vs display size: image size is not set, but display size is.
  Detailed Timing Descriptor #4: Mismatch of image size vs display size: image size is not set, but display size is.
  Detailed Timing Descriptor #5: Mismatch of image size vs display size: image size is not set, but display size is.
  Detailed Timing Descriptor #6: Mismatch of image size vs display size: image size is not set, but display size is.
  Detailed Timing Descriptor #7: Mismatch of image size vs display size: image size is not set, but display size is.
  Missing VCDB, needed for Set Selectable RGB Quantization to avoid interop issues.
EDID:
  Extension Block 2 started with EDID header, ignoring Extension Blocks >= 2.
  CTA-861: Native progressive timings are a mix of several resolutions.

EDID conformity: FAIL
