edid-decode (hex):

00 ff ff ff ff ff ff 00 38 70 33 00 00 00 00 00
1e 1c 01 04 95 22 13 78 02 b3 70 98 5d 59 8e 28
1c 50 54 00 00 00 01 01 01 01 01 01 01 01 01 01
01 01 01 01 01 01 29 36 80 a0 70 38 1f 40 30 20
35 00 58 c2 10 00 00 1a 52 2b 80 a0 70 38 1f 40
30 20 35 00 58 c2 10 00 00 1a 00 00 00 fe 00 31
47 32 58 57 14 31 35 36 43 4c 30 34 00 00 00 00
00 00 41 21 96 00 10 00 00 0a 01 0a 20 20 00 9e

00 ff ff ff ff ff ff 00 38 70 33 00 00 00 00 00
1e 1c 01 04 95 22 13 78 02 b3 70 98 5d 59 8e 28
1c 50 54 00 00 00 01 01 01 01 01 01 01 01 01 01
01 01 01 01 01 01 29 36 80 a0 70 38 1f 40 30 20
35 00 58 c2 10 00 00 1a 52 2b 80 a0 70 38 1f 40
30 20 35 00 58 c2 10 00 00 1a 00 00 00 fe 00 31
47 32 58 57 14 31 35 36 43 4c 30 34 00 00 00 00
00 00 41 21 96 00 10 00 00 0a 01 0a 20 20 00 9e

----------------

Block 0, Base EDID:
  EDID Structure Version & Revision: 1.4
  Vendor & Product Identification:
    Manufacturer: NCP
    Model: 51
    Made in: week 30 of 2018
  Basic Display Parameters & Features:
    Digital display
    Bits per primary color channel: 6
    DisplayPort interface
    Maximum image size: 34 cm x 19 cm
    Gamma: 2.20
    Supported color formats: RGB 4:4:4
    First detailed timing includes the native pixel format and preferred refresh rate
  Color Characteristics:
    Red  : 0.5957, 0.3662
    Green: 0.3476, 0.5576
    Blue : 0.1572, 0.1123
    White: 0.3125, 0.3281
  Established Timings I & II: none
  Standard Timings: none
  Detailed Timing Descriptors:
    DTD 1:  1920x1080   59.998788 Hz  16:9     66.659 kHz    138.650000 MHz (344 mm x 194 mm)
                 Hfront   48 Hsync  32 Hback   80 Hpol P
                 Vfront    3 Vsync   5 Vback   23 Vpol N
    DTD 2:  1920x1080   47.990376 Hz  16:9     53.317 kHz    110.900000 MHz (344 mm x 194 mm)
                 Hfront   48 Hsync  32 Hback   80 Hpol P
                 Vfront    3 Vsync   5 Vback   23 Vpol N
    Alphanumeric Data String: '1G2XW.156CL04'
    Manufacturer-Specified Display Descriptor (0x00): 00 00 00 00 41 21 96 00 10 00 00 0a 01 0a 20 20 '....A!........  '
Checksum: 0x9e

----------------

Block 1, Unknown EDID Extension Block 0x00:
  00 ff ff ff ff ff ff 00 38 70 33 00 00 00 00 00 '........8p3.....'
  1e 1c 01 04 95 22 13 78 02 b3 70 98 5d 59 8e 28 '.....".x..p.]Y.('
  1c 50 54 00 00 00 01 01 01 01 01 01 01 01 01 01 '.PT.............'
  01 01 01 01 01 01 29 36 80 a0 70 38 1f 40 30 20 '......)6..p8.@0 '
  35 00 58 c2 10 00 00 1a 52 2b 80 a0 70 38 1f 40 '5.X.....R+..p8.@'
  30 20 35 00 58 c2 10 00 00 1a 00 00 00 fe 00 31 '0 5.X..........1'
  47 32 58 57 14 31 35 36 43 4c 30 34 00 00 00 00 'G2XW.156CL04....'
  00 00 41 21 96 00 10 00 00 0a 01 0a 20 20 00 9e '..A!........  ..'
Checksum: 0x9e

----------------

Warnings:

Block 0, Base EDID:
  Alphanumeric Data String: Non-ASCII character 0x14 at position 5, can cause problems.
  Missing Display Product Name.

Failures:

Block 1, Base EDID:
  Unknown Extension Block.
EDID:
  Base EDID: EDID specified 0 extension block(s), but found 1 extension block(s).

EDID conformity: FAIL
