edid-decode (hex):

00 ff ff ff ff ff ff 00 4c f4 34 12 01 01 01 01
09 21 01 03 80 35 1e 78 2e ee 91 a3 54 4c 99 26
0f 50 54 21 08 00 81 c0 d1 e8 01 01 01 01 01 01
01 01 01 01 01 01 02 3a 80 18 71 38 2d 40 58 2c
25 00 13 2b 21 00 00 1e 00 00 00 fc 00 45 32 33
38 46 49 46 2d 44 0a 20 20 20 d0 b6 80 a0 70 38
2d 40 30 20 35 00 13 2b 21 00 00 1e 00 00 00 fd
00 30 c8 32 ff 3c 00 0a 20 20 20 20 20 20 01 ea

02 03 37 f5 43 90 1f 04 23 09 07 07 83 01 00 00
67 03 0c 00 01 00 18 78 67 d8 5d c4 01 78 80 00
e2 00 d5 e3 05 c0 00 68 1a 00 00 01 01 30 c8 00
e6 06 05 01 62 62 00 b4 2d 80 a0 70 38 2d 40 30
20 35 00 13 2b 21 00 00 1e b0 6d 80 a0 70 38 2d
40 30 20 35 00 13 2b 21 00 00 1e a0 83 80 a0 70
38 2d 40 30 20 35 00 13 2b 21 00 00 1e d2 96 80
a0 70 38 2d 40 30 20 35 00 0f 28 21 00 00 1e cc

00 ff ff ff ff ff ff 00 4c f4 34 12 01 01 01 01
09 21 01 03 80 35 1e 78 2e ee 91 a3 54 4c 99 26
0f 50 54 21 08 00 81 c0 d1 e8 01 01 01 01 01 01
01 01 01 01 01 01 02 3a 80 18 71 38 2d 40 58 2c
25 00 13 2b 21 00 00 1e 00 00 00 fc 00 45 32 33
38 46 49 46 2d 44 0a 20 20 20 d0 b6 80 a0 70 38
2d 40 30 20 35 00 13 2b 21 00 00 1e 00 00 00 fd
00 30 c8 32 ff 3c 00 0a 20 20 20 20 20 20 01 ea

02 03 37 f5 43 90 1f 04 23 09 07 07 83 01 00 00
67 03 0c 00 01 00 18 78 67 d8 5d c4 01 78 80 00
e2 00 d5 e3 05 c0 00 68 1a 00 00 01 01 30 c8 00
e6 06 05 01 62 62 00 b4 2d 80 a0 70 38 2d 40 30
20 35 00 13 2b 21 00 00 1e b0 6d 80 a0 70 38 2d
40 30 20 35 00 13 2b 21 00 00 1e a0 83 80 a0 70
38 2d 40 30 20 35 00 13 2b 21 00 00 1e d2 96 80
a0 70 38 2d 40 30 20 35 00 0f 28 21 00 00 1e cc

----------------

Block 0, Base EDID:
  EDID Structure Version & Revision: 1.3
  Vendor & Product Identification:
    Manufacturer: SGT
    Model: 4660
    Serial Number: ...
    Made in: week 9 of 2023
  Basic Display Parameters & Features:
    Digital display
    Maximum image size: 53 cm x 30 cm
    Gamma: 2.20
    DPMS levels: Off
    RGB color display
    Default (sRGB) color space is primary color space
    First detailed timing is the preferred timing
  Color Characteristics:
    Red  : 0.6396, 0.3300
    Green: 0.2998, 0.5996
    Blue : 0.1503, 0.0595
    White: 0.3125, 0.3291
  Established Timings I & II:
    DMT 0x04:   640x480    59.940476 Hz   4:3     31.469 kHz     25.175000 MHz
    DMT 0x09:   800x600    60.316541 Hz   4:3     37.879 kHz     40.000000 MHz
    DMT 0x10:  1024x768    60.003840 Hz   4:3     48.363 kHz     65.000000 MHz
  Standard Timings:
    DMT 0x55:  1280x720    60.000000 Hz  16:9     45.000 kHz     74.250000 MHz
    GTF     :  1920x1080  100.000000 Hz  16:9    114.400 kHz    302.016000 MHz
  Detailed Timing Descriptors:
    DTD 1:  1920x1080   60.000000 Hz  16:9     67.500 kHz    148.500000 MHz (531 mm x 299 mm)
                 Hfront   88 Hsync  44 Hback  148 Hpol P
                 Vfront    2 Vsync   5 Vback   38 Vpol P
    Display Product Name: 'E238FIF-D'
    DTD 2:  1920x1080  200.000000 Hz  16:9    225.000 kHz    468.000000 MHz (531 mm x 299 mm)
                 Hfront   48 Hsync  32 Hback   80 Hpol P
                 Vfront    3 Vsync   5 Vback   37 Vpol P
    Display Range Limits:
      Monitor ranges (GTF): 48-200 Hz V, 50-255 kHz H, max dotclock 600 MHz
  Extension blocks: 1
Checksum: 0xea

----------------

Block 1, CTA-861 Extension Block:
  Revision: 3
  Underscans IT Video Formats by default
  Basic audio support
  Supports YCbCr 4:4:4
  Supports YCbCr 4:2:2
  Native DTDs: 5
  Video Data Block:
    VIC  16:  1920x1080   60.000000 Hz  16:9     67.500 kHz    148.500000 MHz (native)
    VIC  31:  1920x1080   50.000000 Hz  16:9     56.250 kHz    148.500000 MHz
    VIC   4:  1280x720    60.000000 Hz  16:9     45.000 kHz     74.250000 MHz
  Audio Data Block:
    Linear PCM:
      Max channels: 2
      Supported sample rates (kHz): 48 44.1 32
      Supported sample sizes (bits): 24 20 16
  Speaker Allocation Data Block:
    FL/FR - Front Left/Right
  Vendor-Specific Data Block (HDMI), OUI 00-0C-03:
    Source physical address: 0.1.0.0
    DC_30bit
    DC_Y444
    Maximum TMDS clock: 600 MHz
  Vendor-Specific Data Block (HDMI Forum), OUI C4-5D-D8:
    Version: 1
    Maximum TMDS Character Rate: 600 MHz
    SCDC Present
  Video Capability Data Block:
    YCbCr quantization: Selectable (via AVI YQ)
    RGB quantization: Selectable (via AVI Q)
    PT scan behavior: Always Overscanned
    IT scan behavior: Always Overscanned
    CE scan behavior: Always Overscanned
  Colorimetry Data Block:
    BT2020YCC
    BT2020RGB
  Vendor-Specific Data Block (AMD), OUI 00-00-1A:
    Version: 1
    Feature Caps: 0x01
    Minimum Refresh Rate: 48 Hz
    Maximum Refresh Rate: 200 Hz
    Flags 1.x: 0x00
  HDR Static Metadata Data Block:
    Electro optical transfer functions:
      Traditional gamma - SDR luminance range
      SMPTE ST2084
    Supported static metadata descriptors:
      Static metadata type 1
    Desired content max luminance: 98 (417.710 cd/m^2)
    Desired content max frame-average luminance: 98 (417.710 cd/m^2)
    Desired content min luminance: 0 (0.000 cd/m^2)
  Detailed Timing Descriptors:
    DTD 3:  1920x1080   50.000000 Hz  16:9     56.250 kHz    117.000000 MHz (531 mm x 299 mm)
                 Hfront   48 Hsync  32 Hback   80 Hpol P
                 Vfront    3 Vsync   5 Vback   37 Vpol P
    DTD 4:  1920x1080  120.000000 Hz  16:9    135.000 kHz    280.800000 MHz (531 mm x 299 mm)
                 Hfront   48 Hsync  32 Hback   80 Hpol P
                 Vfront    3 Vsync   5 Vback   37 Vpol P
    DTD 5:  1920x1080  144.000000 Hz  16:9    162.000 kHz    336.960000 MHz (531 mm x 299 mm)
                 Hfront   48 Hsync  32 Hback   80 Hpol P
                 Vfront    3 Vsync   5 Vback   37 Vpol P
    DTD 6:  1920x1080  165.000000 Hz  16:9    185.625 kHz    386.100000 MHz (527 mm x 296 mm)
                 Hfront   48 Hsync  32 Hback   80 Hpol P
                 Vfront    3 Vsync   5 Vback   37 Vpol P
Checksum: 0xcc

----------------

Warnings:

Block 0, Base EDID:
  Vendor & Product Identification: The serial number is one of the known dummy values, it should probably be set to 0.
  Detailed Timing Descriptor #1: DTD is similar but not identical to VIC 16.
Block 1, CTA-861 Extension Block:
  Video Data Block: VIC 16 and the first DTD are not identical. Is this intended?
  Video Capability Data Block: IT scan behavior is expected to support underscanned.
  Video Capability Data Block: S_PT is equal to S_IT and S_CE, so should be set to 0 instead.
EDID:
  Base EDID: Some timings are out of range of the Monitor Ranges:
    Horizontal Freq: 31.468 - 225.000 kHz (Monitor: 50.000 - 510.000 kHz)

Failures:

Block 0, Base EDID:
  Detailed Timing Descriptor #2: Invalid detailed timing descriptor ordering.
Block 1, CTA-861 Extension Block:
  Vendor-Specific Data Block (HDMI), OUI 00-0C-03: HDMI VSDB Max TMDS rate is > 340.
  Video Capability Data Block: IT video formats are always overscanned, but bit 7 of Byte 3 of the CTA-861 Extension header is set to underscanned.
EDID:
  Extension Block 2 started with EDID header, ignoring Extension Blocks >= 2.

EDID conformity: FAIL
