edid-decode (hex):

00 ff ff ff ff ff ff 00 09 e5 59 09 00 00 00 00
16 1e 01 04 95 22 13 78 02 4c a5 92 5c 59 94 2a
1e 50 54 00 00 00 01 01 01 01 01 01 01 01 01 01
01 01 01 01 01 01 65 1b 56 77 50 00 13 30 30 20
36 00 58 c2 10 00 00 1a a5 17 56 b9 50 00 2d 30
30 20 36 00 58 c2 10 00 00 1a 00 00 00 fe 00 57
30 30 54 46 80 4e 54 31 35 4e 34 32 00 00 00 00
00 00 41 21 96 00 10 00 00 09 01 0a 20 20 00 9e

----------------

Block 0, Base EDID:
  EDID Structure Version & Revision: 1.4
  Vendor & Product Identification:
    Manufacturer: BOE
    Model: 2393
    Made in: week 22 of 2020
  Basic Display Parameters & Features:
    Digital display
    Bits per primary color channel: 6
    DisplayPort interface
    Maximum image size: 34 cm x 19 cm
    Gamma: 2.20
    Supported color formats: RGB 4:4:4
    First detailed timing includes the native pixel format and preferred refresh rate
  Color Characteristics:
    Red  : 0.5712, 0.3593
    Green: 0.3505, 0.5781
    Blue : 0.1660, 0.1191
    White: 0.3134, 0.3291
  Established Timings I & II: none
  Standard Timings: none
  Detailed Timing Descriptors:
    DTD 1:  1366x768    60.007102 Hz 683:384   47.226 kHz     70.130000 MHz (344 mm x 194 mm)
                 Hfront   48 Hsync  32 Hback   39 Hpol P
                 Vfront    3 Vsync   6 Vback   10 Vpol N
    DTD 2:  1366x768    48.002995 Hz 683:384   39.026 kHz     60.530000 MHz (344 mm x 194 mm)
                 Hfront   48 Hsync  32 Hback  105 Hpol P
                 Vfront    3 Vsync   6 Vback   36 Vpol N
    Alphanumeric Data String: 'W00TF.NT15N42'
    Manufacturer-Specified Display Descriptor (0x00): 00 00 00 00 41 21 96 00 10 00 00 09 01 0a 20 20 '....A!........  '
Checksum: 0x9e

----------------

Warnings:

Block 0, Base EDID:
  Alphanumeric Data String: Non-ASCII character 0x80 at position 5, can cause problems.
  Missing Display Product Name.

EDID conformity: PASS
