edid-decode (hex):

00 ff ff ff ff ff ff 00 0d ae 32 11 00 00 00 00
32 19 01 04 95 1a 0e 78 02 14 35 92 55 53 95 29
24 50 54 00 00 00 01 01 01 01 01 01 01 01 01 01
01 01 01 01 01 01 da 1d 56 e2 50 00 20 30 88 1e
8c 00 00 90 10 00 00 1a e2 17 56 e2 50 00 20 30
88 1e 8c 00 00 90 10 00 00 1a 00 00 00 fe 00 34
44 31 4a 32 80 31 31 36 42 47 45 0a 00 00 00 00
00 00 41 31 96 00 10 00 00 09 01 0a 20 20 00 71

----------------

Block 0, Base EDID:
  EDID Structure Version & Revision: 1.4
  Vendor & Product Identification:
    Manufacturer: CMN
    Model: 4402
    Made in: week 50 of 2015
  Basic Display Parameters & Features:
    Digital display
    Bits per primary color channel: 6
    DisplayPort interface
    Maximum image size: 26 cm x 14 cm
    Gamma: 2.20
    Supported color formats: RGB 4:4:4
    First detailed timing includes the native pixel format and preferred refresh rate
  Color Characteristics:
    Red  : 0.5703, 0.3330
    Green: 0.3251, 0.5820
    Blue : 0.1601, 0.1435
    White: 0.3134, 0.3291
  Established Timings I & II: none
  Standard Timings: none
  Detailed Timing Descriptors:
    DTD 1:  1366x768    60.003141 Hz 683:384   48.003 kHz     76.420000 MHz (256 mm x 144 mm)
                 Hfront  136 Hsync  30 Hback   60 Hpol P
                 Vfront    8 Vsync  12 Vback   12 Vpol N
    DTD 2:  1366x768    48.005653 Hz 683:384   38.405 kHz     61.140000 MHz (256 mm x 144 mm)
                 Hfront  136 Hsync  30 Hback   60 Hpol P
                 Vfront    8 Vsync  12 Vback   12 Vpol N
    Alphanumeric Data String: '4D1J2.116BGE'
    Manufacturer-Specified Display Descriptor (0x00): 00 00 00 00 41 31 96 00 10 00 00 09 01 0a 20 20 '....A1........  '
Checksum: 0x71

----------------

Warnings:

Block 0, Base EDID:
  Alphanumeric Data String: Non-ASCII character 0x80 at position 5, can cause problems.
  Missing Display Product Name.

EDID conformity: PASS
