edid-decode (hex):

00 ff ff ff ff ff ff 00 12 6f 01 50 01 00 00 00
01 23 01 04 a5 09 10 78 f6 b9 74 ae 50 3d b7 23
0b 4f 51 00 00 00 01 01 01 01 01 01 01 01 01 01
01 01 01 01 01 01 ea 37 38 88 40 80 2a 70 3c 3c
55 00 5a a0 00 00 00 1e 00 00 00 fc 00 44 65 63
6b 53 69 67 68 74 0a 20 20 20 00 00 00 fd 00 28
50 2f 61 14 00 0a 20 20 20 20 20 20 8e 4a 38 88
40 80 2a 70 3c 3c 55 00 5a a0 00 00 00 1e 00 2b

00 ff ff ff ff ff ff 00 12 6f 01 50 01 00 00 00
01 23 01 04 a5 09 10 78 f6 b9 74 ae 50 3d b7 23
0b 4f 51 00 00 00 01 01 01 01 01 01 01 01 01 01
01 01 01 01 01 01 ea 37 38 88 40 80 2a 70 3c 3c
55 00 5a a0 00 00 00 1e 00 00 00 fc 00 44 65 63
6b 53 69 67 68 74 0a 20 20 20 00 00 00 fd 00 28
50 2f 61 14 00 0a 20 20 20 20 20 20 8e 4a 38 88
40 80 2a 70 3c 3c 55 00 5a a0 00 00 00 1e 00 2b

----------------

Block 0, Base EDID:
  EDID Structure Version & Revision: 1.4
  Vendor & Product Identification:
    Manufacturer: DSO
    Model: 20481
    Serial Number: ...
    Made in: week 1 of 2025
  Basic Display Parameters & Features:
    Digital display
    Bits per primary color channel: 8
    DisplayPort interface
    Maximum image size: 9 cm x 16 cm
    Gamma: 2.20
    DPMS levels: Standby Suspend Off
    Supported color formats: RGB 4:4:4, YCrCb 4:2:2
    Default (sRGB) color space is primary color space
    First detailed timing includes the native pixel format and preferred refresh rate
  Color Characteristics:
    Red  : 0.6816, 0.3154
    Green: 0.2402, 0.7158
    Blue : 0.1376, 0.0458
    White: 0.3095, 0.3164
  Established Timings I & II: none
  Standard Timings: none
  Detailed Timing Descriptors:
    DTD 1:  1080x1920   59.996848 Hz   9:16   117.714 kHz    143.140000 MHz (90 mm x 160 mm)
                 Hfront   60 Hsync  60 Hback   16 Hpol P
                 Vfront    5 Vsync   5 Vback   32 Vpol P
    Display Product Name: 'DeckSight'
    Display Range Limits:
      Monitor ranges (GTF): 40-80 Hz V, 47-97 kHz H, max dotclock 200 MHz
    DTD 2:  1080x1920   79.998592 Hz   9:16   156.957 kHz    190.860000 MHz (90 mm x 160 mm)
                 Hfront   60 Hsync  60 Hback   16 Hpol P
                 Vfront    5 Vsync   5 Vback   32 Vpol P
Checksum: 0x2b

----------------

Warnings:

Block 0, Base EDID:
  Vendor & Product Identification: The serial number is one of the known dummy values, it should probably be set to 0.
  Basic Display Parameters & Features: Dubious maximum image size (9x16 is smaller than 10x10 cm).
  Detailed Timing Descriptor #1: Dubious image size (90x160 mm is smaller than 100x100 mm).
  Display Range Limits: GTF support is deprecated in EDID 1.4.
  Detailed Timing Descriptor #2: Dubious image size (90x160 mm is smaller than 100x100 mm).
EDID:
  Base EDID: Some timings are out of range of the Monitor Ranges:
    Horizontal Freq: 117.713 - 156.957 kHz (Monitor: 47.000 - 97.000 kHz)

Failures:

Block 0, Base EDID:
  Basic Display Parameters & Features: sRGB is signaled, but the chromaticities do not match.
  Display Range Limits: GTF is supported, but the display does not support continuous frequencies.
  Detailed Timing Descriptor #2: Invalid detailed timing descriptor ordering.
EDID:
  Extension Block 1 started with EDID header, ignoring Extension Blocks >= 1.

EDID conformity: FAIL
