edid-decode (hex):

00 ff ff ff ff ff ff 00 26 cf 7a 05 01 00 00 00
06 14 01 03 80 1f 11 78 0a 13 60 97 58 57 91 26
1e 50 54 00 00 00 01 01 01 01 01 01 01 01 01 01
01 01 01 01 01 01 6e 1e 56 f0 50 00 28 30 30 20
3c 00 35 ae 10 00 00 19 00 00 00 00 00 00 00 00
00 00 00 00 00 00 00 00 00 00 00 00 00 fd 00 37
41 2f 3d 08 00 0a 20 20 20 20 20 20 00 00 00 fc
00 4d 31 34 30 4e 57 52 32 20 52 31 20 0a 00 66

----------------

Block 0, Base EDID:
  EDID Structure Version & Revision: 1.3
  Vendor & Product Identification:
    Manufacturer: IVO
    Model: 1402
    Serial Number: ...
    Made in: week 6 of 2010
  Basic Display Parameters & Features:
    Digital display
    Maximum image size: 31 cm x 17 cm
    Gamma: 2.20
    RGB color display
    First detailed timing is the preferred timing
  Color Characteristics:
    Red  : 0.5898, 0.3447
    Green: 0.3398, 0.5693
    Blue : 0.1494, 0.1191
    White: 0.3125, 0.3281
  Established Timings I & II: none
  Standard Timings: none
  Detailed Timing Descriptors:
    DTD 1:  1366x768    60.031688 Hz 683:384   48.506 kHz     77.900000 MHz (309 mm x 174 mm)
                 Hfront   48 Hsync  32 Hback  160 Hpol N
                 Vfront    3 Vsync  12 Vback   25 Vpol N
    Empty Descriptor
    Display Range Limits:
      Monitor ranges (GTF): 55-65 Hz V, 47-61 kHz H, max dotclock 80 MHz
    Display Product Name: 'M140NWR2 R1 '
Checksum: 0x66

----------------

Warnings:

Block 0, Base EDID:
  Vendor & Product Identification: The serial number is one of the known dummy values, it should probably be set to 0.

Failures:

Block 0, Base EDID:
  Empty Descriptor: Use Dummy Descriptor instead of all zeroes.
  Display Product Name: One or more trailing spaces before newline.

EDID conformity: FAIL
