edid-decode (hex):

00 ff ff ff ff ff ff 00 30 64 00 10 01 00 00 00
24 15 01 03 80 57 34 78 0a d0 dd a9 53 49 9d 23
11 47 4a a3 0e 40 d1 c0 01 01 01 01 01 01 01 01
81 80 01 01 01 01 64 19 00 40 41 00 26 30 18 87
36 00 c4 8e 21 00 00 18 64 19 00 40 41 00 26 30
18 87 36 00 c4 8e 21 00 00 18 00 00 00 fc 00 53
41 4e 54 45 43 20 53 4c 4d 0a 20 20 00 00 00 fd
00 30 56 1e 60 11 00 0a 20 20 20 20 20 20 01 5f

02 03 1e 75 4b 81 82 04 85 06 0e 90 12 13 94 9f
23 09 07 07 83 01 00 00 65 03 0c 00 10 00 01 1d
00 72 51 d0 1e 20 6e 28 55 00 c4 8e 21 00 00 1e
8c 0a a0 14 51 f0 16 00 26 7c 43 00 13 8e 21 00
00 98 02 3a 80 18 71 38 2d 40 58 2c 45 00 c4 8e
21 00 00 1e 00 00 00 00 00 00 00 00 00 00 00 00
00 00 00 00 00 00 00 00 00 00 00 00 00 00 00 00
00 00 00 00 00 00 00 00 00 00 00 00 00 00 00 c4

00 ff ff ff ff ff ff 00 30 64 00 10 01 00 00 00
24 15 01 03 80 57 34 78 0a d0 dd a9 53 49 9d 23
11 47 4a a3 0e 40 d1 c0 01 01 01 01 01 01 01 01
81 80 01 01 01 01 64 19 00 40 41 00 26 30 18 87
36 00 c4 8e 21 00 00 18 64 19 00 40 41 00 26 30
18 87 36 00 c4 8e 21 00 00 18 00 00 00 fc 00 53
41 4e 54 45 43 20 53 4c 4d 0a 20 20 00 00 00 fd
00 30 56 1e 60 11 00 0a 20 20 20 20 20 20 01 5f

02 03 1e 75 4b 81 82 04 85 06 0e 90 12 13 94 9f
23 09 07 07 83 01 00 00 65 03 0c 00 10 00 01 1d
00 72 51 d0 1e 20 6e 28 55 00 c4 8e 21 00 00 1e
8c 0a a0 14 51 f0 16 00 26 7c 43 00 13 8e 21 00
00 98 02 3a 80 18 71 38 2d 40 58 2c 45 00 c4 8e
21 00 00 1e 00 00 00 00 00 00 00 00 00 00 00 00
00 00 00 00 00 00 00 00 00 00 00 00 00 00 00 00
00 00 00 00 00 00 00 00 00 00 00 00 00 00 00 c4

----------------

Block 0, Base EDID:
  EDID Structure Version & Revision: 1.3
  Vendor & Product Identification:
    Manufacturer: LCD
    Model: 4096
    Serial Number: ...
    Made in: week 36 of 2011
  Basic Display Parameters & Features:
    Digital display
    Maximum image size: 87 cm x 52 cm
    Gamma: 2.20
    RGB color display
    First detailed timing is the preferred timing
  Color Characteristics:
    Red  : 0.6630, 0.3251
    Green: 0.2851, 0.6132
    Blue : 0.1396, 0.0673
    White: 0.2802, 0.2900
  Established Timings I & II:
    IBM     :   720x400    70.081663 Hz   9:5     31.467 kHz     28.320000 MHz
    DMT 0x04:   640x480    59.940476 Hz   4:3     31.469 kHz     25.175000 MHz
    DMT 0x08:   800x600    56.250000 Hz   4:3     35.156 kHz     36.000000 MHz
    DMT 0x09:   800x600    60.316541 Hz   4:3     37.879 kHz     40.000000 MHz
    DMT 0x10:  1024x768    60.003840 Hz   4:3     48.363 kHz     65.000000 MHz
    DMT 0x11:  1024x768    70.069359 Hz   4:3     56.476 kHz     75.000000 MHz
    DMT 0x12:  1024x768    75.028582 Hz   4:3     60.023 kHz     78.750000 MHz
  Standard Timings:
    DMT 0x52:  1920x1080   60.000000 Hz  16:9     67.500 kHz    148.500000 MHz
    DMT 0x23:  1280x1024   60.019740 Hz   5:4     63.981 kHz    108.000000 MHz
  Detailed Timing Descriptors:
    DTD 1:  1024x768    60.003840 Hz   4:3     48.363 kHz     65.000000 MHz (708 mm x 398 mm)
                 Hfront   24 Hsync 135 Hback  161 Hpol N
                 Vfront    3 Vsync   6 Vback   29 Vpol N
    DTD 2:  1024x768    60.003840 Hz   4:3     48.363 kHz     65.000000 MHz (708 mm x 398 mm)
                 Hfront   24 Hsync 135 Hback  161 Hpol N
                 Vfront    3 Vsync   6 Vback   29 Vpol N
    Display Product Name: 'SANTEC SLM'
    Display Range Limits:
      Monitor ranges (GTF): 48-86 Hz V, 30-96 kHz H, max dotclock 170 MHz
  Extension blocks: 1
Checksum: 0x5f

----------------

Block 1, CTA-861 Extension Block:
  Revision: 3
  Basic audio support
  Supports YCbCr 4:4:4
  Supports YCbCr 4:2:2
  Native DTDs: 5
  Video Data Block:
    VIC   1:   640x480    59.940476 Hz   4:3     31.469 kHz     25.175000 MHz (native)
    VIC   2:   720x480    59.940060 Hz   4:3     31.469 kHz     27.000000 MHz (native)
    VIC   4:  1280x720    60.000000 Hz  16:9     45.000 kHz     74.250000 MHz
    VIC   5:  1920x1080i  60.000000 Hz  16:9     33.750 kHz     74.250000 MHz (native)
    VIC   6:  1440x480i   59.940060 Hz   4:3     15.734 kHz     27.000000 MHz
    VIC  14:  1440x480    59.940060 Hz   4:3     31.469 kHz     54.000000 MHz
    VIC  16:  1920x1080   60.000000 Hz  16:9     67.500 kHz    148.500000 MHz (native)
    VIC  18:   720x576    50.000000 Hz  16:9     31.250 kHz     27.000000 MHz
    VIC  19:  1280x720    50.000000 Hz  16:9     37.500 kHz     74.250000 MHz
    VIC  20:  1920x1080i  50.000000 Hz  16:9     28.125 kHz     74.250000 MHz (native)
    VIC  31:  1920x1080   50.000000 Hz  16:9     56.250 kHz    148.500000 MHz (native)
  Audio Data Block:
    Linear PCM:
      Max channels: 2
      Supported sample rates (kHz): 48 44.1 32
      Supported sample sizes (bits): 24 20 16
  Speaker Allocation Data Block:
    FL/FR - Front Left/Right
  Vendor-Specific Data Block (HDMI), OUI 00-0C-03:
    Source physical address: 1.0.0.0
  Detailed Timing Descriptors:
    DTD 3:  1280x720    60.000000 Hz  16:9     45.000 kHz     74.250000 MHz (708 mm x 398 mm)
                 Hfront  110 Hsync  40 Hback  220 Hpol P
                 Vfront    5 Vsync   5 Vback   20 Vpol P
    DTD 4:  1440x480i   59.940060 Hz   3:1     15.734 kHz     27.000000 MHz (531 mm x 398 mm)
                 Hfront   38 Hsync 124 Hback  114 Hpol N
                 Vfront    4 Vsync   3 Vback   15 Vpol N Vfront +0.5 Odd Field
                 Vfront    4 Vsync   3 Vback   15 Vpol N Vback  +0.5 Even Field
    DTD 5:  1920x1080   60.000000 Hz  16:9     67.500 kHz    148.500000 MHz (708 mm x 398 mm)
                 Hfront   88 Hsync  44 Hback  148 Hpol P
                 Vfront    4 Vsync   5 Vback   36 Vpol P
Checksum: 0xc4  Unused space in Extension Block: 43 bytes

----------------

Warnings:

Block 0, Base EDID:
  Vendor & Product Identification: The serial number is one of the known dummy values, it should probably be set to 0.
  Detailed Timing Descriptor #1: DTD is similar but not identical to DMT 0x10.
  Detailed Timing Descriptor #1: Image size is 708x398 mm, but based on the picture AR it should be 530x398 mm.
  Detailed Timing Descriptor #2: DTD is similar but not identical to DMT 0x10.
  Detailed Timing Descriptor #2: Image size is 708x398 mm, but based on the picture AR it should be 530x398 mm.
Block 1, CTA-861 Extension Block:
  IT Video Formats are overscanned by default, but normally this should be underscanned.
  Video Data Block: VIC 1 and the first DTD are not identical. Is this intended?
  Video Data Block: All VICs are in ascending order, and the first (preferred) VIC <= 4, is that intended?
  Detailed Timing Descriptor #4: Image size is 531x398 mm, but based on the picture AR it should be 531x177 mm.
  Add a Colorimetry Data Block with the sRGB colorimetry bit set to avoid interop issues.
EDID:
  Base EDID: Some timings are out of range of the Monitor Ranges:
    Horizontal Freq: 15.734 - 67.500 kHz (Monitor: 30.000 - 96.000 kHz)

Failures:

Block 0, Base EDID:
  Detailed Timing Descriptor #1: Mismatch of image size 708x398 mm vs display size 870x520 mm.
  Detailed Timing Descriptor #2: Mismatch of image size 708x398 mm vs display size 870x520 mm.
Block 1, CTA-861 Extension Block:
  Detailed Timing Descriptor #3: Mismatch of image size 708x398 mm vs display size 870x520 mm.
  Detailed Timing Descriptor #4: Mismatch of image size 531x398 mm vs display size 870x520 mm.
  Detailed Timing Descriptor #5: Mismatch of image size 708x398 mm vs display size 870x520 mm.
  Missing VCDB, needed for Set Selectable RGB Quantization to avoid interop issues.
EDID:
  Extension Block 2 started with EDID header, ignoring Extension Blocks >= 2.
  CTA-861: Native progressive timings are a mix of several resolutions.
  CTA-861: Native interlaced timings are a mix of several resolutions.

EDID conformity: FAIL
