edid-decode (hex):

00 ff ff ff ff ff ff 00 10 ac 03 42 4c 39 38 35
12 1f 01 03 80 5d 27 78 ea 52 f5 b0 4f 42 ab 25
0f 50 54 a5 4b 00 71 4f 81 00 81 80 a9 40 b3 00
d1 c0 d1 00 e1 c0 cd 46 00 a0 a0 38 1f 40 30 20
3a 00 a1 88 31 00 00 1a 00 00 00 ff 00 36 59 31
35 54 38 33 0a 20 20 20 20 20 00 00 00 fc 00 44
45 4c 4c 20 55 34 30 32 31 51 57 0a 00 00 00 fd
00 18 56 19 8c 3c 00 0a 20 20 20 20 20 20 02 34

02 03 37 f1 51 61 60 5f 5e 5d 10 1f 20 05 14 04
13 12 11 03 02 01 23 09 07 07 83 01 00 00 6d 03
0c 00 10 00 38 3c 20 00 60 01 02 03 67 d8 5d c4
01 78 80 03 e2 0f 03 08 e8 00 30 f2 70 5a 80 b0
58 8a 00 a1 88 31 00 00 1e 56 5e 00 a0 a0 a0 29
50 30 20 35 00 a1 88 31 00 00 1e 02 3a 80 18 71
38 2d 40 58 2c 45 00 a1 88 31 00 00 1e 00 00 00
00 00 00 00 00 00 00 00 00 00 00 00 00 00 00 d0

70 12 79 03 00 01 00 0c 4d 24 50 0f 00 14 70 08
10 78 89 99 03 01 14 8b 87 00 06 ff 13 9f 00 2f
80 1f 00 6f 08 1e 00 02 00 09 00 00 00 00 00 00
00 00 00 00 00 00 00 00 00 00 00 00 00 00 00 00
00 00 00 00 00 00 00 00 00 00 00 00 00 00 00 00
00 00 00 00 00 00 00 00 00 00 00 00 00 00 00 00
00 00 00 00 00 00 00 00 00 00 00 00 00 00 00 00
00 00 00 00 00 00 00 00 00 00 00 00 00 00 10 90

00 ff ff ff ff ff ff 00 10 ac 03 42 4c 39 38 35
12 1f 01 03 80 5d 27 78 ea 52 f5 b0 4f 42 ab 25
0f 50 54 a5 4b 00 71 4f 81 00 81 80 a9 40 b3 00
d1 c0 d1 00 e1 c0 cd 46 00 a0 a0 38 1f 40 30 20
3a 00 a1 88 31 00 00 1a 00 00 00 ff 00 36 59 31
35 54 38 33 0a 20 20 20 20 20 00 00 00 fc 00 44
45 4c 4c 20 55 34 30 32 31 51 57 0a 00 00 00 fd
00 18 56 19 8c 3c 00 0a 20 20 20 20 20 20 02 34

02 03 37 f1 51 61 60 5f 5e 5d 10 1f 20 05 14 04
13 12 11 03 02 01 23 09 07 07 83 01 00 00 6d 03
0c 00 10 00 38 3c 20 00 60 01 02 03 67 d8 5d c4
01 78 80 03 e2 0f 03 08 e8 00 30 f2 70 5a 80 b0
58 8a 00 a1 88 31 00 00 1e 56 5e 00 a0 a0 a0 29
50 30 20 35 00 a1 88 31 00 00 1e 02 3a 80 18 71
38 2d 40 58 2c 45 00 a1 88 31 00 00 1e 00 00 00
00 00 00 00 00 00 00 00 00 00 00 00 00 00 00 d0

70 12 79 03 00 01 00 0c 4d 24 50 0f 00 14 70 08
10 78 89 99 03 01 14 8b 87 00 06 ff 13 9f 00 2f
80 1f 00 6f 08 1e 00 02 00 09 00 00 00 00 00 00
00 00 00 00 00 00 00 00 00 00 00 00 00 00 00 00
00 00 00 00 00 00 00 00 00 00 00 00 00 00 00 00
00 00 00 00 00 00 00 00 00 00 00 00 00 00 00 00
00 00 00 00 00 00 00 00 00 00 00 00 00 00 00 00
00 00 00 00 00 00 00 00 00 00 00 00 00 00 10 90

----------------

Block 0, Base EDID:
  EDID Structure Version & Revision: 1.3
  Vendor & Product Identification:
    Manufacturer: DEL
    Model: 16899
    Serial Number: ...
    Made in: week 18 of 2021
  Basic Display Parameters & Features:
    Digital display
    Maximum image size: 93 cm x 39 cm
    Gamma: 2.20
    DPMS levels: Standby Suspend Off
    RGB color display
    First detailed timing is the preferred timing
  Color Characteristics:
    Red  : 0.6884, 0.3095
    Green: 0.2578, 0.6699
    Blue : 0.1474, 0.0615
    White: 0.3134, 0.3291
  Established Timings I & II:
    IBM     :   720x400    70.081663 Hz   9:5     31.467 kHz     28.320000 MHz
    DMT 0x04:   640x480    59.940476 Hz   4:3     31.469 kHz     25.175000 MHz
    DMT 0x06:   640x480    75.000000 Hz   4:3     37.500 kHz     31.500000 MHz
    DMT 0x09:   800x600    60.316541 Hz   4:3     37.879 kHz     40.000000 MHz
    DMT 0x0b:   800x600    75.000000 Hz   4:3     46.875 kHz     49.500000 MHz
    DMT 0x10:  1024x768    60.003840 Hz   4:3     48.363 kHz     65.000000 MHz
    DMT 0x12:  1024x768    75.028582 Hz   4:3     60.023 kHz     78.750000 MHz
    DMT 0x24:  1280x1024   75.024675 Hz   5:4     79.976 kHz    135.000000 MHz
  Standard Timings:
    DMT 0x15:  1152x864    75.000000 Hz   4:3     67.500 kHz    108.000000 MHz
    DMT 0x1c:  1280x800    59.810326 Hz  16:10    49.702 kHz     83.500000 MHz
    DMT 0x23:  1280x1024   60.019740 Hz   5:4     63.981 kHz    108.000000 MHz
    DMT 0x33:  1600x1200   60.000000 Hz   4:3     75.000 kHz    162.000000 MHz
    DMT 0x3a:  1680x1050   59.954250 Hz  16:10    65.290 kHz    146.250000 MHz
    DMT 0x52:  1920x1080   60.000000 Hz  16:9     67.500 kHz    148.500000 MHz
    DMT 0x45:  1920x1200   59.884600 Hz  16:10    74.556 kHz    193.250000 MHz
    DMT 0x54:  2048x1152   60.000000 Hz  16:9     72.000 kHz    162.000000 MHz (RB)
  Detailed Timing Descriptors:
    DTD 1:  2560x1080   59.978424 Hz  64:27    66.636 kHz    181.250000 MHz (929 mm x 392 mm)
                 Hfront   48 Hsync  32 Hback   80 Hpol P
                 Vfront    3 Vsync  10 Vback   18 Vpol N
    Display Product Serial Number: ...
    Display Product Name: 'DELL U4021QW'
    Display Range Limits:
      Monitor ranges (GTF): 24-86 Hz V, 25-140 kHz H, max dotclock 600 MHz
  Extension blocks: 2
Checksum: 0x34

----------------

Block 1, CTA-861 Extension Block:
  Revision: 3
  Underscans IT Video Formats by default
  Basic audio support
  Supports YCbCr 4:4:4
  Supports YCbCr 4:2:2
  Native DTDs: 1
  Video Data Block:
    VIC  97:  3840x2160   60.000000 Hz  16:9    135.000 kHz    594.000000 MHz
    VIC  96:  3840x2160   50.000000 Hz  16:9    112.500 kHz    594.000000 MHz
    VIC  95:  3840x2160   30.000000 Hz  16:9     67.500 kHz    297.000000 MHz
    VIC  94:  3840x2160   25.000000 Hz  16:9     56.250 kHz    297.000000 MHz
    VIC  93:  3840x2160   24.000000 Hz  16:9     54.000 kHz    297.000000 MHz
    VIC  16:  1920x1080   60.000000 Hz  16:9     67.500 kHz    148.500000 MHz
    VIC  31:  1920x1080   50.000000 Hz  16:9     56.250 kHz    148.500000 MHz
    VIC  32:  1920x1080   24.000000 Hz  16:9     27.000 kHz     74.250000 MHz
    VIC   5:  1920x1080i  60.000000 Hz  16:9     33.750 kHz     74.250000 MHz
    VIC  20:  1920x1080i  50.000000 Hz  16:9     28.125 kHz     74.250000 MHz
    VIC   4:  1280x720    60.000000 Hz  16:9     45.000 kHz     74.250000 MHz
    VIC  19:  1280x720    50.000000 Hz  16:9     37.500 kHz     74.250000 MHz
    VIC  18:   720x576    50.000000 Hz  16:9     31.250 kHz     27.000000 MHz
    VIC  17:   720x576    50.000000 Hz   4:3     31.250 kHz     27.000000 MHz
    VIC   3:   720x480    59.940060 Hz  16:9     31.469 kHz     27.000000 MHz
    VIC   2:   720x480    59.940060 Hz   4:3     31.469 kHz     27.000000 MHz
    VIC   1:   640x480    59.940476 Hz   4:3     31.469 kHz     25.175000 MHz
  Audio Data Block:
    Linear PCM:
      Max channels: 2
      Supported sample rates (kHz): 48 44.1 32
      Supported sample sizes (bits): 24 20 16
  Speaker Allocation Data Block:
    FL/FR - Front Left/Right
  Vendor-Specific Data Block (HDMI), OUI 00-0C-03:
    Source physical address: 1.0.0.0
    DC_36bit
    DC_30bit
    DC_Y444
    Maximum TMDS clock: 300 MHz
    Extended HDMI video details:
      HDMI VICs:
        HDMI VIC 1:  3840x2160   30.000000 Hz  16:9     67.500 kHz    297.000000 MHz
        HDMI VIC 2:  3840x2160   25.000000 Hz  16:9     56.250 kHz    297.000000 MHz
        HDMI VIC 3:  3840x2160   24.000000 Hz  16:9     54.000 kHz    297.000000 MHz
  Vendor-Specific Data Block (HDMI Forum), OUI C4-5D-D8:
    Version: 1
    Maximum TMDS Character Rate: 600 MHz
    SCDC Present
    Supports 12-bits/component Deep Color 4:2:0 Pixel Encoding
    Supports 10-bits/component Deep Color 4:2:0 Pixel Encoding
  YCbCr 4:2:0 Capability Map Data Block:
    VIC  97:  3840x2160   60.000000 Hz  16:9    135.000 kHz    594.000000 MHz
    VIC  96:  3840x2160   50.000000 Hz  16:9    112.500 kHz    594.000000 MHz
  Detailed Timing Descriptors:
    DTD 2:  3840x2160   60.000000 Hz  16:9    135.000 kHz    594.000000 MHz (929 mm x 392 mm)
                 Hfront  176 Hsync  88 Hback  296 Hpol P
                 Vfront    8 Vsync  10 Vback   72 Vpol P
    DTD 3:  2560x1440   59.950550 Hz  16:9     88.787 kHz    241.500000 MHz (929 mm x 392 mm)
                 Hfront   48 Hsync  32 Hback   80 Hpol P
                 Vfront    3 Vsync   5 Vback   33 Vpol P
    DTD 4:  1920x1080   60.000000 Hz  16:9     67.500 kHz    148.500000 MHz (929 mm x 392 mm)
                 Hfront   88 Hsync  44 Hback  148 Hpol P
                 Vfront    4 Vsync   5 Vback   36 Vpol P
Checksum: 0xd0  Unused space in Extension Block: 18 bytes

----------------

Block 2, DisplayID Extension Block:
  Version: 1.2
  Extension Count: 0
  Display Product Type: Standalone display device
  Display Parameters Data Block (0x01):
    Image size: 929.3 mm x 392.0 mm
    Display native pixel format: 5120x2160
    Feature support flags:
      Power management (DPM)
    Gamma: 2.20
    Aspect ratio: 2.37
    Dynamic bpc native: 10
    Dynamic bpc overall: 10
  Video Timing Modes Type 1 - Detailed Timings Data Block:
    DTD:  5120x2160   29.995298 Hz  64:27    65.720 kHz    347.000000 MHz (aspect 64:27, no 3D stereo)
               Hfront   48 Hsync  32 Hback   80 Hpol P
               Vfront    3 Vsync  10 Vback   18 Vpol N
  Checksum: 0x10
Checksum: 0x90

----------------

Warnings:

Block 1, CTA-861 Extension Block:
  Video Data Block: VIC 97 and the first DTD are not identical. Is this intended?
  Detailed Timing Descriptor #2: Image size is 929x392 mm, but based on the picture AR it should be 696x392 mm.
  Detailed Timing Descriptor #3: Image size is 929x392 mm, but based on the picture AR it should be 696x392 mm.
  Detailed Timing Descriptor #4: Image size is 929x392 mm, but based on the picture AR it should be 696x392 mm.
  Display Product Serial Number is set, so the Serial Number in the Base EDID should be 0.
  Add a Colorimetry Data Block with the sRGB colorimetry bit set to avoid interop issues.
EDID:
  CTA-861: Native progressive resolution of 2560x1080 is smaller than the max preferred progressive resolution 3840x2160.

Failures:

Block 1, CTA-861 Extension Block:
  Vendor-Specific Data Block (HDMI Forum), OUI C4-5D-D8: HDMI VIC and related CTA VIC codes are present, but the UHD VIC bit is 0.
  Missing VCDB, needed for Set Selectable RGB Quantization to avoid interop issues.
EDID:
  Extension Block 3 started with EDID header, ignoring Extension Blocks >= 3.
  Base EDID: EDID 1.3 requires a Block Map Extension in Block 1 if there are more than 2 blocks in the EDID.
  CTA-861: Mismatch between CTA-861 and DisplayID native progressive resolution.
  DisplayID: DisplayID expects at least one preferred timing.

EDID conformity: FAIL
