edid-decode (hex):

00 ff ff ff ff ff ff 00 2a 59 00 11 01 00 00 00
0b 1d 01 03 80 16 0d 78 2a ca a5 95 5b 4c 95 27
22 50 54 21 00 00 01 01 01 01 01 01 01 01 01 01
01 01 01 01 01 01 1e 14 00 40 41 58 26 20 18 88
36 00 14 cf 10 00 00 1e 00 00 00 10 00 35 30 35
33 44 30 30 31 30 30 30 31 0a 00 00 00 10 00 0a
20 20 20 20 20 20 20 20 20 20 20 20 00 00 00 fc
00 48 44 4d 49 31 0a 20 20 20 20 20 20 20 01 19

02 03 15 f2 42 81 83 23 09 07 07 83 01 00 00 65
03 0c 00 10 00 8c 0a d0 8a 20 e0 2d 10 10 3e 96
00 55 50 21 00 00 18 00 00 00 00 00 00 00 00 00
00 00 00 00 00 00 00 00 00 00 00 00 00 00 00 00
00 00 00 00 00 00 00 00 00 00 00 00 00 00 00 00
00 00 00 00 00 00 00 00 00 00 00 00 00 00 00 00
00 00 00 00 00 00 00 00 00 00 00 00 00 00 00 00
00 00 00 00 00 00 00 00 00 00 00 00 00 00 00 7d

00 ff ff ff ff ff ff 00 2a 59 00 11 01 00 00 00
0b 1d 01 03 80 16 0d 78 2a ca a5 95 5b 4c 95 27
22 50 54 21 00 00 01 01 01 01 01 01 01 01 01 01
01 01 01 01 01 01 1e 14 00 40 41 58 26 20 18 88
36 00 14 cf 10 00 00 1e 00 00 00 10 00 35 30 35
33 44 30 30 31 30 30 30 31 0a 00 00 00 10 00 0a
20 20 20 20 20 20 20 20 20 20 20 20 00 00 00 fc
00 48 44 4d 49 31 0a 20 20 20 20 20 20 20 01 19

02 03 15 f2 42 81 83 23 09 07 07 83 01 00 00 65
03 0c 00 10 00 8c 0a d0 8a 20 e0 2d 10 10 3e 96
00 55 50 21 00 00 18 00 00 00 00 00 00 00 00 00
00 00 00 00 00 00 00 00 00 00 00 00 00 00 00 00
00 00 00 00 00 00 00 00 00 00 00 00 00 00 00 00
00 00 00 00 00 00 00 00 00 00 00 00 00 00 00 00
00 00 00 00 00 00 00 00 00 00 00 00 00 00 00 00
00 00 00 00 00 00 00 00 00 00 00 00 00 00 00 7d

----------------

Block 0, Base EDID:
  EDID Structure Version & Revision: 1.3
  Vendor & Product Identification:
    Manufacturer: JRY
    Model: 4352
    Serial Number: ...
    Made in: week 11 of 2019
  Basic Display Parameters & Features:
    Digital display
    Maximum image size: 22 cm x 13 cm
    Gamma: 2.20
    DPMS levels: Off
    RGB color display
    First detailed timing is the preferred timing
  Color Characteristics:
    Red  : 0.5849, 0.3554
    Green: 0.2988, 0.5839
    Blue : 0.1542, 0.1347
    White: 0.3134, 0.3291
  Established Timings I & II:
    DMT 0x04:   640x480    59.940476 Hz   4:3     31.469 kHz     25.175000 MHz
    DMT 0x09:   800x600    60.316541 Hz   4:3     37.879 kHz     40.000000 MHz
  Standard Timings: none
  Detailed Timing Descriptors:
    DTD 1:  1024x600    60.060270 Hz 128:75    38.318 kHz     51.500000 MHz (276 mm x 207 mm)
                 Hfront   24 Hsync 136 Hback  160 Hpol P
                 Vfront    3 Vsync   6 Vback   29 Vpol P
    Dummy Descriptor:
    Dummy Descriptor:
    Display Product Name: 'HDMI1'
  Extension blocks: 1
Checksum: 0x19

----------------

Block 1, CTA-861 Extension Block:
  Revision: 3
  Underscans IT Video Formats by default
  Basic audio support
  Supports YCbCr 4:4:4
  Supports YCbCr 4:2:2
  Native detailed modes: 2
  Video Data Block:
    VIC   1:   640x480    59.940476 Hz   4:3     31.469 kHz     25.175000 MHz (native)
    VIC   3:   720x480    59.940060 Hz  16:9     31.469 kHz     27.000000 MHz (native)
  Audio Data Block:
    Linear PCM:
      Max channels: 2
      Supported sample rates (kHz): 48 44.1 32
      Supported sample sizes (bits): 24 20 16
  Speaker Allocation Data Block:
    FL/FR - Front Left/Right
  Vendor-Specific Data Block (HDMI), OUI 00-0C-03:
    Source physical address: 1.0.0.0
  Detailed Timing Descriptors:
    DTD 2:   720x480    59.940060 Hz   3:2     31.469 kHz     27.000000 MHz (597 mm x 336 mm)
                 Hfront   16 Hsync  62 Hback   60 Hpol N
                 Vfront    9 Vsync   6 Vback   30 Vpol N
Checksum: 0x7d  Unused space in Extension Block: 88 bytes

----------------

Block 2, Unknown EDID Extension Block 0x00:
  00 ff ff ff ff ff ff 00 2a 59 00 11 01 00 00 00 '........*Y......'
  0b 1d 01 03 80 16 0d 78 2a ca a5 95 5b 4c 95 27 '.......x*...[L.''
  22 50 54 21 00 00 01 01 01 01 01 01 01 01 01 01 '"PT!............'
  01 01 01 01 01 01 1e 14 00 40 41 58 26 20 18 88 '.........@AX& ..'
  36 00 14 cf 10 00 00 1e 00 00 00 10 00 35 30 35 '6............505'
  33 44 30 30 31 30 30 30 31 0a 00 00 00 10 00 0a '3D0010001.......'
  20 20 20 20 20 20 20 20 20 20 20 20 00 00 00 fc '            ....'
  00 48 44 4d 49 31 0a 20 20 20 20 20 20 20 01 19 '.HDMI1.       ..'
Checksum: 0x19

----------------

Block 3, CTA-861 Extension Block:
  Revision: 3
  Underscans IT Video Formats by default
  Basic audio support
  Supports YCbCr 4:4:4
  Supports YCbCr 4:2:2
  Native detailed modes: 2
  Video Data Block:
    VIC   1:   640x480    59.940476 Hz   4:3     31.469 kHz     25.175000 MHz (native)
    VIC   3:   720x480    59.940060 Hz  16:9     31.469 kHz     27.000000 MHz (native)
  Audio Data Block:
    Linear PCM:
      Max channels: 2
      Supported sample rates (kHz): 48 44.1 32
      Supported sample sizes (bits): 24 20 16
  Speaker Allocation Data Block:
    FL/FR - Front Left/Right
  Vendor-Specific Data Block (HDMI), OUI 00-0C-03:
    Source physical address: 1.0.0.0
  Detailed Timing Descriptors:
    DTD 3:   720x480    59.940060 Hz   3:2     31.469 kHz     27.000000 MHz (597 mm x 336 mm)
                 Hfront   16 Hsync  62 Hback   60 Hpol N
                 Vfront    9 Vsync   6 Vback   30 Vpol N
Checksum: 0x7d  Unused space in Extension Block: 88 bytes

----------------

Warnings:

Block 0, Base EDID:
  Vendor & Product Identification: The serial number is one of the known dummy values, it should probably be set to 0.
  Detailed Timing Descriptor #1: Image size is 276x207 mm, but based on the picture AR it should be 276x161 mm.
Block 1, CTA-861 Extension Block:
  Video Data Block: VIC 1 and the first DTD are not identical. Is this intended?
  Detailed Timing Descriptor #2: Image size is 597x336 mm, but based on the picture AR it should be 597x398 mm.
  Add a Colorimetry Data Block with the sRGB colorimetry bit set to avoid interop issues.
Block 3, CTA-861 Extension Block:
  Detailed Timing Descriptor #3: Image size is 597x336 mm, but based on the picture AR it should be 597x398 mm.

Failures:

Block 0, Base EDID:
  Detailed Timing Descriptor #1: Mismatch of image size 276x207 mm vs display size 220x130 mm.
  Dummy Descriptor: Dummy block filled with garbage.
  Dummy Descriptor: Dummy block filled with garbage.
  Missing Display Range Limits Descriptor.
Block 1, CTA-861 Extension Block:
  Detailed Timing Descriptor #2: Mismatch of image size 597x336 mm vs display size 220x130 mm.
  Missing VCDB, needed for Set Selectable RGB Quantization to avoid interop issues.
Block 2, Base EDID:
  Unknown Extension Block.
Block 3, CTA-861 Extension Block:
  Video Data Block: Duplicate VIC 1.
  Video Data Block: Duplicate VIC 3.
  Speaker Allocation Data Block: Only one instance of this Data Block is allowed.
  Detailed Timing Descriptor #3: Mismatch of image size 597x336 mm vs display size 220x130 mm.
EDID:
  Base EDID: The DTD max image size is 597x336mm, which is larger than the display size 220.0x130.0mm.
  Base EDID: EDID specified 1 extension block(s), but found 3 extension block(s).
  Base EDID: EDID 1.3 requires a Block Map Extension in Block 1 if there are more than 2 blocks in the EDID.
  CTA-861: Native progressive timings are a mix of several resolutions.

EDID conformity: FAIL
