edid-decode (hex):

00 ff ff ff ff ff ff 00 4c 2e 00 00 01 01 01 01
02 19 01 03 08 59 32 78 0a 32 31 a1 54 52 9e 26
0a 47 4a af cf 80 95 00 b3 00 a9 c0 01 01 01 01
01 01 01 01 01 01 02 3a 80 18 71 38 2d 40 58 2c
45 00 00 00 00 00 00 1e 66 21 50 b0 51 00 1b 30
40 70 36 00 00 00 00 00 00 1e 00 00 00 fc 00 53
41 4e 59 4f 20 4c 43 44 0a 20 20 20 00 00 00 fd
00 38 4b 1e 50 10 00 0a 20 20 20 20 20 20 00 ef

00 ff ff ff ff ff ff 00 4c 2e 00 00 01 01 01 01
02 19 01 03 08 59 32 78 0a 32 31 a1 54 52 9e 26
0a 47 4a af cf 80 95 00 b3 00 a9 c0 01 01 01 01
01 01 01 01 01 01 02 3a 80 18 71 38 2d 40 58 2c
45 00 00 00 00 00 00 1e 66 21 50 b0 51 00 1b 30
40 70 36 00 00 00 00 00 00 1e 00 00 00 fc 00 53
41 4e 59 4f 20 4c 43 44 0a 20 20 20 00 00 00 fd
00 38 4b 1e 50 10 00 0a 20 20 20 20 20 20 00 ef

----------------

Block 0, Base EDID:
  EDID Structure Version & Revision: 1.3
  Vendor & Product Identification:
    Manufacturer: SAN
    Model: 0
    Serial Number: ...
    Made in: week 2 of 2015
  Basic Display Parameters & Features:
    Analog display
    Signal Level Standard: 0.700 : 0.300 : 1.000 V p-p
    Blank level equals black level
    Sync: Separate
    Maximum image size: 89 cm x 50 cm
    Gamma: 2.20
    RGB color display
    First detailed timing is the preferred timing
  Color Characteristics:
    Red  : 0.6289, 0.3310
    Green: 0.3203, 0.6191
    Blue : 0.1484, 0.0419
    White: 0.2773, 0.2900
  Established Timings I & II:
    IBM     :   720x400    70.081663 Hz   9:5     31.467 kHz     28.320000 MHz
    DMT 0x04:   640x480    59.940476 Hz   4:3     31.469 kHz     25.175000 MHz
    DMT 0x05:   640x480    72.808802 Hz   4:3     37.861 kHz     31.500000 MHz
    DMT 0x06:   640x480    75.000000 Hz   4:3     37.500 kHz     31.500000 MHz
    DMT 0x08:   800x600    56.250000 Hz   4:3     35.156 kHz     36.000000 MHz
    DMT 0x09:   800x600    60.316541 Hz   4:3     37.879 kHz     40.000000 MHz
    DMT 0x0a:   800x600    72.187572 Hz   4:3     48.077 kHz     50.000000 MHz
    DMT 0x0b:   800x600    75.000000 Hz   4:3     46.875 kHz     49.500000 MHz
    DMT 0x10:  1024x768    60.003840 Hz   4:3     48.363 kHz     65.000000 MHz
    DMT 0x11:  1024x768    70.069359 Hz   4:3     56.476 kHz     75.000000 MHz
    DMT 0x12:  1024x768    75.028582 Hz   4:3     60.023 kHz     78.750000 MHz
    DMT 0x24:  1280x1024   75.024675 Hz   5:4     79.976 kHz    135.000000 MHz
    Apple   :  1152x870    75.061550 Hz 192:145   68.681 kHz    100.000000 MHz
  Standard Timings:
    DMT 0x2f:  1440x900    59.887445 Hz  16:10    55.935 kHz    106.500000 MHz
    DMT 0x3a:  1680x1050   59.954250 Hz  16:10    65.290 kHz    146.250000 MHz
    DMT 0x53:  1600x900    60.000000 Hz  16:9     60.000 kHz    108.000000 MHz (RB)
  Detailed Timing Descriptors:
    DTD 1:  1920x1080   60.000000 Hz  16:9     67.500 kHz    148.500000 MHz
                 Hfront   88 Hsync  44 Hback  148 Hpol P
                 Vfront    4 Vsync   5 Vback   36 Vpol P
    DTD 2:  1360x768    60.015162 Hz  85:48    47.712 kHz     85.500000 MHz
                 Hfront   64 Hsync 112 Hback  256 Hpol P
                 Vfront    3 Vsync   6 Vback   18 Vpol P
    Display Product Name: 'SANYO LCD'
    Display Range Limits:
      Monitor ranges (GTF): 56-75 Hz V, 30-80 kHz H, max dotclock 160 MHz
Checksum: 0xef

----------------

Warnings:

Block 0, Base EDID:
  Vendor & Product Identification: The serial number is one of the known dummy values, it should probably be set to 0.

Failures:

Block 0, Base EDID:
  Detailed Timing Descriptor #1: Mismatch of image size vs display size: image size is not set, but display size is.
  Detailed Timing Descriptor #2: Mismatch of image size vs display size: image size is not set, but display size is.
EDID:
  Extension Block 1 started with EDID header, ignoring Extension Blocks >= 1.

EDID conformity: FAIL
