edid-decode (hex):

00 ff ff ff ff ff ff 00 06 af 92 6a 00 00 00 00
00 1f 01 04 a5 22 13 78 02 a5 95 a6 54 4a 9c 26
0f 50 54 00 00 00 01 01 01 01 01 01 01 01 01 01
01 01 01 01 01 01 14 37 80 b4 70 38 26 40 6c 30
aa 00 58 c2 10 00 00 1a 10 2c 80 b4 70 38 26 40
6c 30 aa 00 58 c2 10 00 00 1a 00 00 00 fe 00 37
47 48 44 50 80 42 31 35 36 48 41 4e 00 00 00 00
00 03 41 22 9e 00 11 00 00 0a 01 0a 20 20 00 c4

----------------

Block 0, Base EDID:
  EDID Structure Version & Revision: 1.4
  Vendor & Product Identification:
    Manufacturer: AUO
    Model: 27282
    Made in: 2021
  Basic Display Parameters & Features:
    Digital display
    Bits per primary color channel: 8
    DisplayPort interface
    Maximum image size: 34 cm x 19 cm
    Gamma: 2.20
    Supported color formats: RGB 4:4:4
    First detailed timing includes the native pixel format and preferred refresh rate
  Color Characteristics:
    Red  : 0.6503, 0.3300
    Green: 0.2900, 0.6103
    Blue : 0.1503, 0.0595
    White: 0.3134, 0.3291
  Established Timings I & II: none
  Standard Timings: none
  Detailed Timing Descriptors:
    DTD 1:  1920x1080   60.056223 Hz  16:9     67.143 kHz    141.000000 MHz (344 mm x 194 mm)
                 Hfront  108 Hsync  48 Hback   24 Hpol P
                 Vfront   10 Vsync  10 Vback   18 Vpol N
    DTD 2:  1920x1080   48.044978 Hz  16:9     53.714 kHz    112.800000 MHz (344 mm x 194 mm)
                 Hfront  108 Hsync  48 Hback   24 Hpol P
                 Vfront   10 Vsync  10 Vback   18 Vpol N
    Alphanumeric Data String: '7GHDP.B156HAN'
    Manufacturer-Specified Display Descriptor (0x00): 00 00 00 03 41 22 9e 00 11 00 00 0a 01 0a 20 20 '....A"........  '
Checksum: 0xc4

----------------

Warnings:

Block 0, Base EDID:
  Alphanumeric Data String: Non-ASCII character 0x80 at position 5, can cause problems.
  Missing Display Product Name.

EDID conformity: PASS
