edid-decode (hex):

00 ff ff ff ff ff ff 00 5a 63 3a b1 17 01 01 01
11 20 01 04 a5 50 21 78 3b 59 95 ac 50 48 a6 27
12 50 54 bf ef 80 d1 00 d1 c0 b3 00 a9 c0 95 00
81 80 81 00 81 c0 e7 7c 70 a0 d0 a0 29 50 30 20
3a 00 1d 4d 31 00 00 1a 00 00 00 ff 00 57 41 45
32 32 31 37 32 30 34 31 35 0a 00 00 00 fd 00 18
4b 0f 96 20 00 0a 20 20 20 20 20 20 00 00 00 fc
00 56 50 33 34 38 31 61 0a 20 20 20 20 20 01 d6

02 03 20 f1 53 5a 59 58 57 56 10 05 1f 14 22 21
20 04 13 12 16 03 07 01 23 09 07 07 83 01 00 00
9f 3d 70 a0 d0 a0 15 50 30 20 3a 00 1d 4d 31 00
00 1a 80 3e 70 a0 d0 d0 15 20 30 20 3a 00 1d 4d
31 00 00 1a 3c 41 b8 a0 60 a0 29 50 30 20 3a 00
1d 4d 31 00 00 1a 9e 20 b8 a0 60 d0 15 20 30 20
3a 00 1d 4d 31 00 00 1a 00 00 00 00 00 00 00 00
00 00 00 00 00 00 00 00 00 00 00 00 00 00 00 03

00 ff ff ff ff ff ff 00 5a 63 3a b1 17 01 01 01
11 20 01 04 a5 50 21 78 3b 59 95 ac 50 48 a6 27
12 50 54 bf ef 80 d1 00 d1 c0 b3 00 a9 c0 95 00
81 80 81 00 81 c0 e7 7c 70 a0 d0 a0 29 50 30 20
3a 00 1d 4d 31 00 00 1a 00 00 00 ff 00 57 41 45
32 32 31 37 32 30 34 31 35 0a 00 00 00 fd 00 18
4b 0f 96 20 00 0a 20 20 20 20 20 20 00 00 00 fc
00 56 50 33 34 38 31 61 0a 20 20 20 20 20 01 d6

02 03 20 f1 53 5a 59 58 57 56 10 05 1f 14 22 21
20 04 13 12 16 03 07 01 23 09 07 07 83 01 00 00
9f 3d 70 a0 d0 a0 15 50 30 20 3a 00 1d 4d 31 00
00 1a 80 3e 70 a0 d0 d0 15 20 30 20 3a 00 1d 4d
31 00 00 1a 3c 41 b8 a0 60 a0 29 50 30 20 3a 00
1d 4d 31 00 00 1a 9e 20 b8 a0 60 d0 15 20 30 20
3a 00 1d 4d 31 00 00 1a 00 00 00 00 00 00 00 00
00 00 00 00 00 00 00 00 00 00 00 00 00 00 00 03

----------------

Block 0, Base EDID:
  EDID Structure Version & Revision: 1.4
  Vendor & Product Identification:
    Manufacturer: VSC
    Model: 45370
    Serial Number: ...
    Made in: week 17 of 2022
  Basic Display Parameters & Features:
    Digital display
    Bits per primary color channel: 8
    DisplayPort interface
    Maximum image size: 80 cm x 33 cm
    Gamma: 2.20
    DPMS levels: Off
    Supported color formats: RGB 4:4:4, YCrCb 4:4:4, YCrCb 4:2:2
    First detailed timing includes the native pixel format and preferred refresh rate
    Display supports continuous frequencies
  Color Characteristics:
    Red  : 0.6728, 0.3134
    Green: 0.2832, 0.6494
    Blue : 0.1542, 0.0712
    White: 0.3134, 0.3291
  Established Timings I & II:
    IBM     :   720x400    70.081663 Hz   9:5     31.467 kHz     28.320000 MHz
    DMT 0x04:   640x480    59.940476 Hz   4:3     31.469 kHz     25.175000 MHz
    Apple   :   640x480    66.666667 Hz   4:3     35.000 kHz     30.240000 MHz
    DMT 0x05:   640x480    72.808802 Hz   4:3     37.861 kHz     31.500000 MHz
    DMT 0x06:   640x480    75.000000 Hz   4:3     37.500 kHz     31.500000 MHz
    DMT 0x08:   800x600    56.250000 Hz   4:3     35.156 kHz     36.000000 MHz
    DMT 0x09:   800x600    60.316541 Hz   4:3     37.879 kHz     40.000000 MHz
    DMT 0x0a:   800x600    72.187572 Hz   4:3     48.077 kHz     50.000000 MHz
    DMT 0x0b:   800x600    75.000000 Hz   4:3     46.875 kHz     49.500000 MHz
    Apple   :   832x624    74.551266 Hz   4:3     49.726 kHz     57.284000 MHz
    DMT 0x10:  1024x768    60.003840 Hz   4:3     48.363 kHz     65.000000 MHz
    DMT 0x11:  1024x768    70.069359 Hz   4:3     56.476 kHz     75.000000 MHz
    DMT 0x12:  1024x768    75.028582 Hz   4:3     60.023 kHz     78.750000 MHz
    DMT 0x24:  1280x1024   75.024675 Hz   5:4     79.976 kHz    135.000000 MHz
    Apple   :  1152x870    75.061550 Hz 192:145   68.681 kHz    100.000000 MHz
  Standard Timings:
    DMT 0x45:  1920x1200   59.884600 Hz  16:10    74.556 kHz    193.250000 MHz
    DMT 0x52:  1920x1080   60.000000 Hz  16:9     67.500 kHz    148.500000 MHz
    DMT 0x3a:  1680x1050   59.954250 Hz  16:10    65.290 kHz    146.250000 MHz
    DMT 0x53:  1600x900    60.000000 Hz  16:9     60.000 kHz    108.000000 MHz (RB)
    DMT 0x2f:  1440x900    59.887445 Hz  16:10    55.935 kHz    106.500000 MHz
    DMT 0x23:  1280x1024   60.019740 Hz   5:4     63.981 kHz    108.000000 MHz
    DMT 0x1c:  1280x800    59.810326 Hz  16:10    49.702 kHz     83.500000 MHz
    DMT 0x55:  1280x720    60.000000 Hz  16:9     45.000 kHz     74.250000 MHz
  Detailed Timing Descriptors:
    DTD 1:  3440x1440   59.972616 Hz  43:18    88.819 kHz    319.750000 MHz (797 mm x 333 mm)
                 Hfront   48 Hsync  32 Hback   80 Hpol P
                 Vfront    3 Vsync  10 Vback   28 Vpol N
    Display Product Serial Number: ...
    Display Range Limits:
      Monitor ranges (GTF): 24-75 Hz V, 15-150 kHz H, max dotclock 320 MHz
    Display Product Name: 'VP3481a'
  Extension blocks: 1
Checksum: 0xd6

----------------

Block 1, CTA-861 Extension Block:
  Revision: 3
  Underscans IT Video Formats by default
  Basic audio support
  Supports YCbCr 4:4:4
  Supports YCbCr 4:2:2
  Native DTDs: 1
  Video Data Block:
    VIC  90:  2560x1080   60.000000 Hz  64:27    66.000 kHz    198.000000 MHz
    VIC  89:  2560x1080   50.000000 Hz  64:27    56.250 kHz    185.625000 MHz
    VIC  88:  2560x1080   30.000000 Hz  64:27    33.750 kHz    118.800000 MHz
    VIC  87:  2560x1080   25.000000 Hz  64:27    28.125 kHz     90.000000 MHz
    VIC  86:  2560x1080   24.000000 Hz  64:27    26.400 kHz     99.000000 MHz
    VIC  16:  1920x1080   60.000000 Hz  16:9     67.500 kHz    148.500000 MHz
    VIC   5:  1920x1080i  60.000000 Hz  16:9     33.750 kHz     74.250000 MHz
    VIC  31:  1920x1080   50.000000 Hz  16:9     56.250 kHz    148.500000 MHz
    VIC  20:  1920x1080i  50.000000 Hz  16:9     28.125 kHz     74.250000 MHz
    VIC  34:  1920x1080   30.000000 Hz  16:9     33.750 kHz     74.250000 MHz
    VIC  33:  1920x1080   25.000000 Hz  16:9     28.125 kHz     74.250000 MHz
    VIC  32:  1920x1080   24.000000 Hz  16:9     27.000 kHz     74.250000 MHz
    VIC   4:  1280x720    60.000000 Hz  16:9     45.000 kHz     74.250000 MHz
    VIC  19:  1280x720    50.000000 Hz  16:9     37.500 kHz     74.250000 MHz
    VIC  18:   720x576    50.000000 Hz  16:9     31.250 kHz     27.000000 MHz
    VIC  22:  1440x576i   50.000000 Hz  16:9     15.625 kHz     27.000000 MHz
    VIC   3:   720x480    59.940060 Hz  16:9     31.469 kHz     27.000000 MHz
    VIC   7:  1440x480i   59.940060 Hz  16:9     15.734 kHz     27.000000 MHz
    VIC   1:   640x480    59.940476 Hz   4:3     31.469 kHz     25.175000 MHz
  Audio Data Block:
    Linear PCM:
      Max channels: 2
      Supported sample rates (kHz): 48 44.1 32
      Supported sample sizes (bits): 24 20 16
  Speaker Allocation Data Block:
    FL/FR - Front Left/Right
  Detailed Timing Descriptors:
    DTD 2:  3440x1440   29.992775 Hz  43:18    43.819 kHz    157.750000 MHz (797 mm x 333 mm)
                 Hfront   48 Hsync  32 Hback   80 Hpol P
                 Vfront    3 Vsync  10 Vback    8 Vpol N
    DTD 3:  3440x720    59.979007 Hz  43:9     44.444 kHz    160.000000 MHz (797 mm x 333 mm)
                 Hfront   48 Hsync  32 Hback   80 Hpol P
                 Vfront    3 Vsync  10 Vback    8 Vpol N
    DTD 4:  1720x1440   59.979600 Hz  43:36    88.830 kHz    167.000000 MHz (797 mm x 333 mm)
                 Hfront   48 Hsync  32 Hback   80 Hpol P
                 Vfront    3 Vsync  10 Vback   28 Vpol N
    DTD 5:  1720x720    59.939128 Hz  43:18    44.415 kHz     83.500000 MHz (797 mm x 333 mm)
                 Hfront   48 Hsync  32 Hback   80 Hpol P
                 Vfront    3 Vsync  10 Vback    8 Vpol N
Checksum: 0x03  Unused space in Extension Block: 23 bytes

----------------

Warnings:

Block 0, Base EDID:
  Display Range Limits: GTF support is deprecated in EDID 1.4.
Block 1, CTA-861 Extension Block:
  Video Data Block: VIC 90 and the first DTD are not identical. Is this intended?
  Detailed Timing Descriptor #3: Image size is 797x333 mm, but based on the picture AR it should be 797x166 mm.
  Detailed Timing Descriptor #4: Image size is 797x333 mm, but based on the picture AR it should be 397x333 mm.
  Display Product Serial Number is set, so the Serial Number in the Base EDID should be 0.
  Add a Colorimetry Data Block with the sRGB colorimetry bit set to avoid interop issues.

Failures:

Block 1, CTA-861 Extension Block:
  Missing VCDB, needed for Set Selectable RGB Quantization to avoid interop issues.
EDID:
  Extension Block 2 started with EDID header, ignoring Extension Blocks >= 2.

EDID conformity: FAIL
