edid-decode (hex):

00 ff ff ff ff ff ff 00 3e 8d 50 05 14 00 00 00
14 1f 01 03 80 00 00 78 0a af e5 ab 54 35 b5 23
14 50 54 bf ef 80 45 7c 61 7c 81 00 81 80 b3 00
81 c0 81 40 81 40 9e 20 00 90 51 20 1f 30 48 80
36 00 00 00 00 00 00 1e 00 00 00 ff 00 51 38 55
41 31 32 30 41 30 30 32 30 0a 00 00 00 fd 00 32
78 0f 64 0f 00 0a 20 20 20 20 20 20 00 00 00 fc
00 4f 70 74 6f 6d 61 20 57 58 47 41 0a 20 01 b4

02 03 25 f2 4d 06 15 02 11 84 93 05 14 10 1f 01
20 20 23 09 07 07 83 01 00 00 67 03 0c 00 10 00
38 2d e2 00 7f 01 1d 00 72 51 d0 1e 20 6e 28 55
00 00 00 00 00 00 1e 66 21 56 aa 51 00 1e 30 46
8f 33 00 00 00 00 00 00 1e 01 1d 80 18 71 1c 16
20 58 2c 25 00 00 00 00 00 00 9e 8c 0a d0 8a 20
e0 2d 10 10 3e 96 00 00 00 00 00 00 18 00 00 00
00 00 00 00 00 00 00 00 00 00 00 00 00 00 00 92

00 ff ff ff ff ff ff 00 3e 8d 50 05 14 00 00 00
14 1f 01 03 80 00 00 78 0a af e5 ab 54 35 b5 23
14 50 54 bf ef 80 45 7c 61 7c 81 00 81 80 b3 00
81 c0 81 40 81 40 9e 20 00 90 51 20 1f 30 48 80
36 00 00 00 00 00 00 1e 00 00 00 ff 00 51 38 55
41 31 32 30 41 30 30 32 30 0a 00 00 00 fd 00 32
78 0f 64 0f 00 0a 20 20 20 20 20 20 00 00 00 fc
00 4f 70 74 6f 6d 61 20 57 58 47 41 0a 20 01 b4

02 03 25 f2 4d 06 15 02 11 84 93 05 14 10 1f 01
20 20 23 09 07 07 83 01 00 00 67 03 0c 00 10 00
38 2d e2 00 7f 01 1d 00 72 51 d0 1e 20 6e 28 55
00 00 00 00 00 00 1e 66 21 56 aa 51 00 1e 30 46
8f 33 00 00 00 00 00 00 1e 01 1d 80 18 71 1c 16
20 58 2c 25 00 00 00 00 00 00 9e 8c 0a d0 8a 20
e0 2d 10 10 3e 96 00 00 00 00 00 00 18 00 00 00
00 00 00 00 00 00 00 00 00 00 00 00 00 00 00 92

----------------

Block 0, Base EDID:
  EDID Structure Version & Revision: 1.3
  Vendor & Product Identification:
    Manufacturer: OTM
    Model: 1360
    Serial Number: ...
    Made in: week 20 of 2021
  Basic Display Parameters & Features:
    Digital display
    Image size is variable
    Gamma: 2.20
    RGB color display
    First detailed timing is the preferred timing
  Color Characteristics:
    Red  : 0.6699, 0.3300
    Green: 0.2099, 0.7099
    Blue : 0.1396, 0.0800
    White: 0.3134, 0.3291
  Established Timings I & II:
    IBM     :   720x400    70.081663 Hz   9:5     31.467 kHz     28.320000 MHz
    DMT 0x04:   640x480    59.940476 Hz   4:3     31.469 kHz     25.175000 MHz
    Apple   :   640x480    66.666667 Hz   4:3     35.000 kHz     30.240000 MHz
    DMT 0x05:   640x480    72.808802 Hz   4:3     37.861 kHz     31.500000 MHz
    DMT 0x06:   640x480    75.000000 Hz   4:3     37.500 kHz     31.500000 MHz
    DMT 0x08:   800x600    56.250000 Hz   4:3     35.156 kHz     36.000000 MHz
    DMT 0x09:   800x600    60.316541 Hz   4:3     37.879 kHz     40.000000 MHz
    DMT 0x0a:   800x600    72.187572 Hz   4:3     48.077 kHz     50.000000 MHz
    DMT 0x0b:   800x600    75.000000 Hz   4:3     46.875 kHz     49.500000 MHz
    Apple   :   832x624    74.551266 Hz   4:3     49.726 kHz     57.284000 MHz
    DMT 0x10:  1024x768    60.003840 Hz   4:3     48.363 kHz     65.000000 MHz
    DMT 0x11:  1024x768    70.069359 Hz   4:3     56.476 kHz     75.000000 MHz
    DMT 0x12:  1024x768    75.028582 Hz   4:3     60.023 kHz     78.750000 MHz
    DMT 0x24:  1280x1024   75.024675 Hz   5:4     79.976 kHz    135.000000 MHz
    Apple   :  1152x870    75.061550 Hz 192:145   68.681 kHz    100.000000 MHz
  Standard Timings:
    GTF     :   800x600   119.999886 Hz   4:3     77.160 kHz     83.950000 MHz
    GTF     :  1024x768   119.999931 Hz   4:3     98.760 kHz    139.054000 MHz
    DMT 0x1c:  1280x800    59.810326 Hz  16:10    49.702 kHz     83.500000 MHz
    DMT 0x23:  1280x1024   60.019740 Hz   5:4     63.981 kHz    108.000000 MHz
    DMT 0x3a:  1680x1050   59.954250 Hz  16:10    65.290 kHz    146.250000 MHz
    DMT 0x55:  1280x720    60.000000 Hz  16:9     45.000 kHz     74.250000 MHz
    DMT 0x20:  1280x960    60.000000 Hz   4:3     60.000 kHz    108.000000 MHz
    DMT 0x20:  1280x960    60.000000 Hz   4:3     60.000 kHz    108.000000 MHz
  Detailed Timing Descriptors:
    DTD 1:  1280x800    59.810326 Hz  16:10    49.702 kHz     83.500000 MHz
                 Hfront   72 Hsync 128 Hback  200 Hpol P
                 Vfront    3 Vsync   6 Vback   22 Vpol P
    Display Product Serial Number: ...
    Display Range Limits:
      Monitor ranges (GTF): 50-120 Hz V, 15-100 kHz H, max dotclock 150 MHz
    Display Product Name: 'Optoma WXGA'
  Extension blocks: 1
Checksum: 0xb4

----------------

Block 1, CTA-861 Extension Block:
  Revision: 3
  Underscans IT Video Formats by default
  Basic audio support
  Supports YCbCr 4:4:4
  Supports YCbCr 4:2:2
  Native DTDs: 2
  Video Data Block:
    VIC   6:  1440x480i   59.940060 Hz   4:3     15.734 kHz     27.000000 MHz
    VIC  21:  1440x576i   50.000000 Hz   4:3     15.625 kHz     27.000000 MHz
    VIC   2:   720x480    59.940060 Hz   4:3     31.469 kHz     27.000000 MHz
    VIC  17:   720x576    50.000000 Hz   4:3     31.250 kHz     27.000000 MHz
    VIC   4:  1280x720    60.000000 Hz  16:9     45.000 kHz     74.250000 MHz (native)
    VIC  19:  1280x720    50.000000 Hz  16:9     37.500 kHz     74.250000 MHz (native)
    VIC   5:  1920x1080i  60.000000 Hz  16:9     33.750 kHz     74.250000 MHz
    VIC  20:  1920x1080i  50.000000 Hz  16:9     28.125 kHz     74.250000 MHz
    VIC  16:  1920x1080   60.000000 Hz  16:9     67.500 kHz    148.500000 MHz
    VIC  31:  1920x1080   50.000000 Hz  16:9     56.250 kHz    148.500000 MHz
    VIC   1:   640x480    59.940476 Hz   4:3     31.469 kHz     25.175000 MHz
    VIC  32:  1920x1080   24.000000 Hz  16:9     27.000 kHz     74.250000 MHz
    VIC  32:  1920x1080   24.000000 Hz  16:9     27.000 kHz     74.250000 MHz
  Audio Data Block:
    Linear PCM:
      Max channels: 2
      Supported sample rates (kHz): 48 44.1 32
      Supported sample sizes (bits): 24 20 16
  Speaker Allocation Data Block:
    FL/FR - Front Left/Right
  Vendor-Specific Data Block (HDMI), OUI 00-0C-03:
    Source physical address: 1.0.0.0
    DC_36bit
    DC_30bit
    DC_Y444
    Maximum TMDS clock: 225 MHz
  Video Capability Data Block:
    YCbCr quantization: No Data
    RGB quantization: Selectable (via AVI Q)
    PT scan behavior: Supports both over- and underscan
    IT scan behavior: Supports both over- and underscan
    CE scan behavior: Supports both over- and underscan
  Detailed Timing Descriptors:
    DTD 2:  1280x720    60.000000 Hz  16:9     45.000 kHz     74.250000 MHz
                 Hfront  110 Hsync  40 Hback  220 Hpol P
                 Vfront    5 Vsync   5 Vback   20 Vpol P
    DTD 3:  1366x768    59.789541 Hz 683:384   47.712 kHz     85.500000 MHz
                 Hfront   70 Hsync 143 Hback  213 Hpol P
                 Vfront    3 Vsync   3 Vback   24 Vpol P
    DTD 4:  1920x1080i  60.000000 Hz  16:9     33.750 kHz     74.250000 MHz
                 Hfront   88 Hsync  44 Hback  148 Hpol P
                 Vfront    2 Vsync   5 Vback   15 Vpol P Vfront +0.5 Odd Field
                 Vfront    2 Vsync   5 Vback   15 Vpol P Vback  +0.5 Even Field
    DTD 5:   720x480    59.940060 Hz   3:2     31.469 kHz     27.000000 MHz
                 Hfront   16 Hsync  62 Hback   60 Hpol N
                 Vfront    9 Vsync   6 Vback   30 Vpol N
Checksum: 0x92  Unused space in Extension Block: 18 bytes

----------------

Warnings:

Block 0, Base EDID:
  Detailed Timing Descriptor #1: DTD is similar but not identical to DMT 0x1c.
Block 1, CTA-861 Extension Block:
  Video Data Block: VIC 6 and the first DTD are not identical. Is this intended?
  Video Capability Data Block: Set Selectable YCbCr Quantization to avoid interop issues.
  Video Capability Data Block: S_PT is equal to S_IT and S_CE, so should be set to 0 instead.
  Display Product Serial Number is set, so the Serial Number in the Base EDID should be 0.
  Add a Colorimetry Data Block with the sRGB colorimetry bit set to avoid interop issues.
EDID:
  Base EDID: Some timings are out of range of the Monitor Ranges:
    Vertical Freq: 24.000 - 120.000 Hz (Monitor: 50.000 - 120.000 Hz)

Failures:

Block 1, CTA-861 Extension Block:
  Video Data Block: Duplicate VIC 32.
EDID:
  Extension Block 2 started with EDID header, ignoring Extension Blocks >= 2.
  CTA-861: Native progressive timings are a mix of several resolutions.

EDID conformity: FAIL
