edid-decode (hex):

00 ff ff ff ff ff ff 00 42 93 a8 06 01 01 01 01
0e 12 01 03 08 25 15 78 ea 06 31 97 57 4a 94 26
1e 50 54 af ce 00 81 c0 81 cf 81 00 01 01 01 01
01 01 01 01 01 01 1a 1d 00 80 51 d0 1c 20 40 80
35 00 74 d1 10 00 00 1e 4c 1d 00 30 41 00 26 30
18 88 36 00 30 e4 10 00 00 00 00 00 00 fd 00 32
4b 24 39 0a 00 0a 20 20 20 20 20 20 00 00 00 ff
00 41 43 47 55 38 34 30 30 31 30 36 34 37 00 f5

00 ff ff ff ff ff ff 00 42 93 a8 06 01 01 01 01
0e 12 01 03 08 25 15 78 ea 06 31 97 57 4a 94 26
1e 50 54 af ce 00 81 c0 81 cf 81 00 01 01 01 01
01 01 01 01 01 01 1a 1d 00 80 51 d0 1c 20 40 80
35 00 74 d1 10 00 00 1e 4c 1d 00 30 41 00 26 30
18 88 36 00 30 e4 10 00 00 00 00 00 00 fd 00 32
4b 24 39 0a 00 0a 20 20 20 20 20 20 00 00 00 ff
00 41 43 47 55 38 34 30 30 31 30 36 34 37 00 f5

----------------

Block 0, Base EDID:
  EDID Structure Version & Revision: 1.3
  Vendor & Product Identification:
    Manufacturer: PTS
    Model: 1704
    Serial Number: ...
    Made in: week 14 of 2008
  Basic Display Parameters & Features:
    Analog display
    Signal Level Standard: 0.700 : 0.300 : 1.000 V p-p
    Blank level equals black level
    Sync: Separate
    Maximum image size: 37 cm x 21 cm
    Gamma: 2.20
    DPMS levels: Standby Suspend Off
    RGB color display
    First detailed timing is the preferred timing
  Color Characteristics:
    Red  : 0.5898, 0.3398
    Green: 0.2900, 0.5800
    Blue : 0.1484, 0.1201
    White: 0.3125, 0.3291
  Established Timings I & II:
    IBM     :   720x400    70.081663 Hz   9:5     31.467 kHz     28.320000 MHz
    DMT 0x04:   640x480    59.940476 Hz   4:3     31.469 kHz     25.175000 MHz
    DMT 0x05:   640x480    72.808802 Hz   4:3     37.861 kHz     31.500000 MHz
    DMT 0x06:   640x480    75.000000 Hz   4:3     37.500 kHz     31.500000 MHz
    DMT 0x08:   800x600    56.250000 Hz   4:3     35.156 kHz     36.000000 MHz
    DMT 0x09:   800x600    60.316541 Hz   4:3     37.879 kHz     40.000000 MHz
    DMT 0x0a:   800x600    72.187572 Hz   4:3     48.077 kHz     50.000000 MHz
    DMT 0x0b:   800x600    75.000000 Hz   4:3     46.875 kHz     49.500000 MHz
    DMT 0x10:  1024x768    60.003840 Hz   4:3     48.363 kHz     65.000000 MHz
    DMT 0x11:  1024x768    70.069359 Hz   4:3     56.476 kHz     75.000000 MHz
    DMT 0x12:  1024x768    75.028582 Hz   4:3     60.023 kHz     78.750000 MHz
  Standard Timings:
    DMT 0x55:  1280x720    60.000000 Hz  16:9     45.000 kHz     74.250000 MHz
    GTF     :  1280x720    74.999686 Hz  16:9     56.400 kHz     95.654000 MHz
    DMT 0x1c:  1280x800    59.810326 Hz  16:10    49.702 kHz     83.500000 MHz
  Detailed Timing Descriptors:
    DTD 1:  1280x720    59.855126 Hz  16:9     44.772 kHz     74.500000 MHz (372 mm x 209 mm)
                 Hfront   64 Hsync 128 Hback  192 Hpol P
                 Vfront    3 Vsync   5 Vback   20 Vpol P
    DTD 2:  1024x768    70.069359 Hz   4:3     56.476 kHz     75.000000 MHz (analog composite, sync-on-green, 304 mm x 228 mm)
                 Hfront   24 Hsync 136 Hback  144 Hpol N
                 Vfront    3 Vsync   6 Vback   29 Vpol N
    Display Range Limits:
      Monitor ranges (GTF): 50-75 Hz V, 36-57 kHz H, max dotclock 100 MHz
    Display Product Serial Number: ...
Checksum: 0xf5

----------------

Warnings:

Block 0, Base EDID:
  Vendor & Product Identification: The serial number is one of the known dummy values, it should probably be set to 0.
EDID:
  Base EDID: Some timings are out of range of the Monitor Ranges:
    Horizontal Freq: 31.466 - 60.022 kHz (Monitor: 36.000 - 57.000 kHz)

Failures:

Block 0, Base EDID:
  Detailed Timing Descriptor #2: Mismatch of image size 304x228 mm vs display size 370x210 mm.
  Missing Display Product Name.
EDID:
  Extension Block 1 started with EDID header, ignoring Extension Blocks >= 1.
  Base EDID: The DTD max image size is 372x228mm, which is larger than the display size 370.0x210.0mm.

EDID conformity: FAIL
