edid-decode (hex):

00 ff ff ff ff ff ff 00 22 f0 8b 10 01 00 00 00
15 17 01 03 80 30 1b 78 0a 05 30 a6 55 51 9e 27
10 50 54 00 00 00 01 01 01 01 01 01 01 01 01 01
01 01 01 01 01 01 98 34 80 64 70 38 1f 40 60 40
84 00 dd 0c 11 00 00 18 00 00 00 fe 00 56 30 38
0a 20 20 20 20 20 20 20 20 20 00 00 00 fc 00 48
50 51 20 36 30 30 20 41 49 4f 0a 20 00 00 00 fe
00 4c 54 4d 32 31 35 48 4c 30 31 0a 20 20 00 7e

----------------

Block 0, Base EDID:
  EDID Structure Version & Revision: 1.3
  Vendor & Product Identification:
    Manufacturer: HWP
    Model: 4235
    Serial Number: ...
    Made in: week 21 of 2013
  Basic Display Parameters & Features:
    Digital display
    Maximum image size: 48 cm x 27 cm
    Gamma: 2.20
    RGB color display
    First detailed timing is the preferred timing
  Color Characteristics:
    Red  : 0.6484, 0.3320
    Green: 0.3173, 0.6181
    Blue : 0.1523, 0.0654
    White: 0.3125, 0.3281
  Established Timings I & II: none
  Standard Timings: none
  Detailed Timing Descriptors:
    DTD 1:  1920x1080   59.994118 Hz  16:9     66.653 kHz    134.640000 MHz (477 mm x 268 mm)
                 Hfront   96 Hsync  64 Hback  -60 Hpol N
                 Vfront    8 Vsync   4 Vback   19 Vpol N
    Alphanumeric Data String: 'V08'
    Display Product Name: 'HPQ 600 AIO'
    Alphanumeric Data String: 'LTM215HL01'
Checksum: 0x7e

----------------

Warnings:

Block 0, Base EDID:
  Vendor & Product Identification: The serial number is one of the known dummy values, it should probably be set to 0.

Failures:

Block 0, Base EDID:
  Detailed Timing Descriptor #1: 0 or negative horizontal back porch.
  Missing Display Range Limits Descriptor.

EDID conformity: FAIL
