edid-decode (hex):

00 ff ff ff ff ff ff 00 26 cf 79 05 01 00 00 00
31 13 01 03 80 1f 11 78 0a 56 00 96 59 56 90 27
1c 50 54 00 00 00 01 01 01 01 01 01 01 01 01 01
01 01 01 01 01 01 dc 1e 56 e6 50 00 39 30 34 26
3c 20 35 ae 10 00 00 19 00 00 0f 00 00 00 00 00
00 00 00 00 00 00 00 00 00 01 00 00 00 fe 00 49
6e 66 6f 56 69 73 69 6f 6e 0a 20 20 00 00 00 fe
00 4d 31 34 30 4e 57 52 31 20 52 30 0a 20 00 15

----------------

Block 0, Base EDID:
  EDID Structure Version & Revision: 1.3
  Vendor & Product Identification:
    Manufacturer: IVO
    Model: 1401
    Serial Number: ...
    Made in: week 49 of 2009
  Basic Display Parameters & Features:
    Digital display
    Maximum image size: 31 cm x 17 cm
    Gamma: 2.20
    RGB color display
    First detailed timing is the preferred timing
  Color Characteristics:
    Red  : 0.5869, 0.3486
    Green: 0.3369, 0.5644
    Blue : 0.1523, 0.1093
    White: 0.3125, 0.3281
  Established Timings I & II: none
  Standard Timings: none
  Detailed Timing Descriptors:
    DTD 1:  1366x768    59.998481 Hz 683:384   49.499 kHz     79.000000 MHz (309 mm x 174 mm)
                 Hfront   52 Hsync 550 Hback -372 Hpol N
                 Vfront    3 Vsync  12 Vback   42 Vpol N
    Manufacturer-Specified Display Descriptor (0x00): 0f 00 00 00 00 00 00 00 00 00 00 00 00 00 00 01 '................'
    Alphanumeric Data String: 'InfoVision'
    Alphanumeric Data String: 'M140NWR1 R0'
Checksum: 0x15

----------------

Warnings:

Block 0, Base EDID:
  Vendor & Product Identification: The serial number is one of the known dummy values, it should probably be set to 0.

Failures:

Block 0, Base EDID:
  Detailed Timing Descriptor #1: 0 or negative horizontal back porch.
  Display Descriptor #2: Monitor descriptor block has byte 2 nonzero (0x0f).
  Missing Display Product Name.
  Missing Display Range Limits Descriptor.

EDID conformity: FAIL
