edid-decode (hex):

00 ff ff ff ff ff ff 00 09 e5 11 0c 00 00 00 00
0a 21 01 04 b5 1d 13 78 07 ee 9f a3 54 4c 99 26
0f 4f 53 00 00 00 01 01 01 01 01 01 01 01 01 01
01 01 01 01 01 01 11 91 40 a0 b0 80 74 70 30 20
36 00 1d be 10 00 00 1a 00 00 00 fd 00 1e 78 f4
f4 4a 01 0a 20 20 20 20 20 20 00 00 00 fe 00 42
4f 45 20 4e 4a 0a 20 20 20 20 20 20 00 00 00 fe
00 4e 45 31 33 35 41 31 4d 2d 4e 36 31 0a 02 39

02 03 0f 00 e3 05 80 00 e6 06 05 01 6a 6a 42 00
00 00 00 00 00 00 00 00 00 00 00 00 00 00 00 00
00 00 00 00 00 00 00 00 00 00 00 00 00 00 00 00
00 00 00 00 00 00 00 00 00 00 00 00 00 00 00 00
00 00 00 00 00 00 00 00 00 00 00 00 00 00 00 00
00 00 00 00 00 00 00 00 00 00 00 00 00 00 00 00
00 00 00 00 00 00 00 00 00 00 00 00 00 00 00 00
00 00 00 00 00 00 00 00 00 00 00 00 00 00 00 7c

70 20 79 02 00 22 00 14 4c 55 0b 08 3f 0b 9f 00
2f 00 1f 00 7f 07 73 00 02 00 05 00 25 00 09 4c
55 0b 4c 55 0b 1e 78 80 2b 00 06 27 00 1e 77 00
00 81 00 13 72 1a 00 00 03 03 1e 78 00 04 6a 42
6a 42 78 00 00 00 00 00 00 00 00 00 00 00 00 00
00 00 00 00 00 00 00 00 00 00 00 00 00 00 00 00
00 00 00 00 00 00 00 00 00 00 00 00 00 00 00 00
00 00 00 00 00 00 00 00 00 00 00 00 00 00 2b 90

00 ff ff ff ff ff ff 00 09 e5 11 0c 00 00 00 00
0a 21 01 04 b5 1d 13 78 07 ee 9f a3 54 4c 99 26
0f 4f 53 00 00 00 01 01 01 01 01 01 01 01 01 01
01 01 01 01 01 01 11 91 40 a0 b0 80 74 70 30 20
36 00 1d be 10 00 00 1a 00 00 00 fd 00 1e 78 f4
f4 4a 01 0a 20 20 20 20 20 20 00 00 00 fe 00 42
4f 45 20 4e 4a 0a 20 20 20 20 20 20 00 00 00 fe
00 4e 45 31 33 35 41 31 4d 2d 4e 36 31 0a 02 39

02 03 0f 00 e3 05 80 00 e6 06 05 01 6a 6a 42 00
00 00 00 00 00 00 00 00 00 00 00 00 00 00 00 00
00 00 00 00 00 00 00 00 00 00 00 00 00 00 00 00
00 00 00 00 00 00 00 00 00 00 00 00 00 00 00 00
00 00 00 00 00 00 00 00 00 00 00 00 00 00 00 00
00 00 00 00 00 00 00 00 00 00 00 00 00 00 00 00
00 00 00 00 00 00 00 00 00 00 00 00 00 00 00 00
00 00 00 00 00 00 00 00 00 00 00 00 00 00 00 7c

70 20 79 02 00 22 00 14 4c 55 0b 08 3f 0b 9f 00
2f 00 1f 00 7f 07 73 00 02 00 05 00 25 00 09 4c
55 0b 4c 55 0b 1e 78 80 2b 00 06 27 00 1e 77 00
00 81 00 13 72 1a 00 00 03 03 1e 78 00 04 6a 42
6a 42 78 00 00 00 00 00 00 00 00 00 00 00 00 00
00 00 00 00 00 00 00 00 00 00 00 00 00 00 00 00
00 00 00 00 00 00 00 00 00 00 00 00 00 00 00 00
00 00 00 00 00 00 00 00 00 00 00 00 00 00 2b 90

----------------

Block 0, Base EDID:
  EDID Structure Version & Revision: 1.4
  Vendor & Product Identification:
    Manufacturer: BOE
    Model: 3089
    Made in: week 10 of 2023
  Basic Display Parameters & Features:
    Digital display
    Bits per primary color channel: 10
    DisplayPort interface
    Maximum image size: 29 cm x 19 cm
    Gamma: 2.20
    Supported color formats: RGB 4:4:4
    Default (sRGB) color space is primary color space
    First detailed timing includes the native pixel format and preferred refresh rate
    Display supports continuous frequencies
  Color Characteristics:
    Red  : 0.6396, 0.3300
    Green: 0.2998, 0.5996
    Blue : 0.1503, 0.0595
    White: 0.3115, 0.3271
  Established Timings I & II: none
  Standard Timings: none
  Detailed Timing Descriptors:
    DTD 1:  2880x1920   60.000582 Hz   3:2    122.161 kHz    371.370000 MHz (285 mm x 190 mm)
                 Hfront   48 Hsync  32 Hback   80 Hpol P
                 Vfront    3 Vsync   6 Vback  107 Vpol N
    Display Range Limits:
      Monitor ranges (Range Limits Only): 30-120 Hz V, 244-244 kHz H, max dotclock 740 MHz
    Alphanumeric Data String: 'BOE NJ'
    Alphanumeric Data String: 'NE135A1M-N61'
  Extension blocks: 2
Checksum: 0x39

----------------

Block 1, CTA-861 Extension Block:
  Revision: 3
  Native DTDs: 0
  Colorimetry Data Block:
    BT2020RGB
  HDR Static Metadata Data Block:
    Electro optical transfer functions:
      Traditional gamma - SDR luminance range
      SMPTE ST2084
    Supported static metadata descriptors:
      Static metadata type 1
    Desired content max luminance: 106 (496.743 cd/m^2)
    Desired content max frame-average luminance: 106 (496.743 cd/m^2)
    Desired content min luminance: 66 (0.333 cd/m^2)
Checksum: 0x7c  Unused space in Extension Block: 112 bytes

----------------

Block 2, DisplayID Extension Block:
  Version: 2.0
  Extension Count: 0
  Display Product Primary Use Case: None of the listed primary use cases; generic display
  Video Timing Modes Type 7 - Detailed Timings Data Block:
    DTD:  2880x1920  120.000032 Hz   0:0    244.320 kHz    742.733000 MHz (aspect undefined, no 3D stereo)
               Hfront   48 Hsync  32 Hback   80 Hpol N
               Vfront    3 Vsync   6 Vback  107 Vpol N
  Dynamic Video Timing Range Limits Data Block:
    Minimum Pixel Clock: 742733 kHz
    Maximum Pixel Clock: 742733 kHz
    Minimum Vertical Refresh Rate: 30 Hz
    Maximum Vertical Refresh Rate: 120 Hz
    Seamless Dynamic Video Timing Support: Yes
  Adaptive Sync Data Block:
    Descriptor #1:
      Native Panel Range
      Fixed Average V-Total and Adaptive V-Total
      Supports Seamless Transition
      'Max Single Frame Duration Increase' field value without jitter impact
      'Max Single Frame Duration Decrease' field value without jitter impact
      Max Duration Increase: 0.00 ms
      Max Duration Decrease: 0.00 ms
      Min Refresh Rate: 30 Hz
      Max Refresh Rate: 120 Hz
  CTA-861 DisplayID Data Block:
  Vendor-Specific Data Block (AMD), OUI 00-00-1A:
    Version: 3
    Feature Caps: 0x03
    Minimum Refresh Rate: 30 Hz
    Maximum Refresh Rate: 120 Hz
    Flags 1.x: 0x00
    Flags 2.x: 0x04
      ST 2084 (PQ) EOTF Supported
      Linear EOTF (Windows scRGB, 0.0 - 125.0) Supported
      Gamma 2.2 EOTF Supported
      BT.2020 Gamut Supported
    Maximum luminance: 106 (496.743 cd/m^2)
    Minimum luminance: 66 (0.333 cd/m^2)
  Checksum: 0x2b
Checksum: 0x90

----------------

Warnings:

Block 0, Base EDID:
  Missing Display Product Name.
Block 1, CTA-861 Extension Block:
  IT Video Formats are overscanned by default, but normally this should be underscanned.
EDID:
  Base EDID: Some timings are out of range of the Monitor Ranges:
    Horizontal Freq: 122.161 - 244.320 kHz (Monitor: 244.000 - 244.000 kHz)
    Maximum Clock: 742.733 MHz (Monitor: 740.000 MHz)

Failures:

Block 0, Base EDID:
  Basic Display Parameters & Features: sRGB is signaled, but the chromaticities do not match.
Block 1, CTA-861 Extension Block:
  Required 640x480p60 timings are missing in the established timings and the SVD list (VIC 1).
  Missing VCDB, needed for Set Selectable RGB Quantization to avoid interop issues.
EDID:
  Extension Block 3 started with EDID header, ignoring Extension Blocks >= 3.
  DisplayID: Missing DisplayID Display Parameters Data Block.
  DisplayID: DisplayID expects at least one preferred timing.

EDID conformity: FAIL
