edid-decode (hex):

00 ff ff ff ff ff ff 00 06 af a9 a0 00 00 00 00
22 20 01 04 a5 22 16 78 03 ad b5 a8 54 48 9e 25
0e 50 54 00 00 00 01 01 01 01 01 01 01 01 01 01
01 01 01 01 01 01 d1 e8 00 a0 a0 40 e2 60 30 20
aa 00 58 d7 10 00 00 18 d1 e8 00 a0 a0 40 04 68
30 20 aa 00 58 d7 10 00 00 18 00 00 00 00 00 00
00 00 00 00 00 00 00 00 00 00 00 00 00 00 00 02
00 0c 2d ff 10 3c c8 7e 0e 2d c8 20 20 20 01 4c

70 20 79 02 00 22 00 14 29 18 09 85 ff 09 9f 00
2f 80 1f 00 3f 06 e1 00 09 00 09 00 25 01 09 29
18 09 29 18 09 30 78 80 81 00 10 6f 1a 00 00 03
01 30 78 00 00 60 50 60 50 78 00 00 00 00 00 00
00 00 00 00 00 00 00 00 00 00 00 00 00 00 00 00
00 00 00 00 00 00 00 00 00 00 00 00 00 00 00 00
00 00 00 00 00 00 00 00 00 00 00 00 00 00 00 00
00 00 00 00 00 00 00 00 00 00 00 00 00 00 2a 90

00 ff ff ff ff ff ff 00 06 af a9 a0 00 00 00 00
22 20 01 04 a5 22 16 78 03 ad b5 a8 54 48 9e 25
0e 50 54 00 00 00 01 01 01 01 01 01 01 01 01 01
01 01 01 01 01 01 d1 e8 00 a0 a0 40 e2 60 30 20
aa 00 58 d7 10 00 00 18 d1 e8 00 a0 a0 40 04 68
30 20 aa 00 58 d7 10 00 00 18 00 00 00 00 00 00
00 00 00 00 00 00 00 00 00 00 00 00 00 00 00 02
00 0c 2d ff 10 3c c8 7e 0e 2d c8 20 20 20 01 4c

70 20 79 02 00 22 00 14 29 18 09 85 ff 09 9f 00
2f 80 1f 00 3f 06 e1 00 09 00 09 00 25 01 09 29
18 09 29 18 09 30 78 80 81 00 10 6f 1a 00 00 03
01 30 78 00 00 60 50 60 50 78 00 00 00 00 00 00
00 00 00 00 00 00 00 00 00 00 00 00 00 00 00 00
00 00 00 00 00 00 00 00 00 00 00 00 00 00 00 00
00 00 00 00 00 00 00 00 00 00 00 00 00 00 00 00
00 00 00 00 00 00 00 00 00 00 00 00 00 00 2a 90

----------------

Block 0, Base EDID:
  EDID Structure Version & Revision: 1.4
  Vendor & Product Identification:
    Manufacturer: AUO
    Model: 41129
    Made in: week 34 of 2022
  Basic Display Parameters & Features:
    Digital display
    Bits per primary color channel: 8
    DisplayPort interface
    Maximum image size: 34 cm x 22 cm
    Gamma: 2.20
    Supported color formats: RGB 4:4:4
    First detailed timing includes the native pixel format and preferred refresh rate
    Display supports continuous frequencies
  Color Characteristics:
    Red  : 0.6582, 0.3300
    Green: 0.2841, 0.6181
    Blue : 0.1464, 0.0576
    White: 0.3134, 0.3291
  Established Timings I & II: none
  Standard Timings: none
  Detailed Timing Descriptors:
    DTD 1:  2560x1600  120.000725 Hz  16:10   219.121 kHz    596.010000 MHz (344 mm x 215 mm)
                 Hfront   48 Hsync  32 Hback   80 Hpol N
                 Vfront   10 Vsync  10 Vback  206 Vpol N
    DTD 2:  2560x1600   60.000362 Hz  16:10   219.121 kHz    596.010000 MHz (344 mm x 215 mm)
                 Hfront   48 Hsync  32 Hback   80 Hpol N
                 Vfront   10 Vsync  10 Vback 2032 Vpol N
    Empty Descriptor
    Manufacturer-Specified Display Descriptor (0x02): 00 02 00 0c 2d ff 10 3c c8 7e 0e 2d c8 20 20 20 '....-..<.~.-.   '
  Extension blocks: 1
Checksum: 0x4c

----------------

Block 1, DisplayID Extension Block:
  Version: 2.0
  Extension Count: 0
  Display Product Primary Use Case: None of the listed primary use cases; generic display
  Video Timing Modes Type 7 - Detailed Timings Data Block:
    DTD:  2560x1600  120.000725 Hz  16:10   219.121 kHz    596.010000 MHz (aspect 16:10, no 3D stereo, preferred)
               Hfront   48 Hsync  32 Hback   80 Hpol P
               Vfront   10 Vsync  10 Vback  206 Vpol N
  Dynamic Video Timing Range Limits Data Block:
    Minimum Pixel Clock: 596010 kHz
    Maximum Pixel Clock: 596010 kHz
    Minimum Vertical Refresh Rate: 48 Hz
    Maximum Vertical Refresh Rate: 120 Hz
    Seamless Dynamic Video Timing Support: Yes
  CTA-861 DisplayID Data Block:
  Vendor-Specific Data Block (AMD), OUI 00-00-1A:
    Version: 3
    Flags 1: 0x01
      FreeSync Supported
    Minimum Refresh Rate: 48 Hz
    Maximum Refresh Rate: 120 Hz
    Flags 5: 0x00
  Checksum: 0x2a
Checksum: 0x90

----------------

Warnings:

Block 0, Base EDID:
  Missing Display Product Name.

Failures:

Block 0, Base EDID:
  Empty Descriptor: Use Dummy Descriptor instead of all zeroes.
  Missing Display Range Limits Descriptor.
EDID:
  Extension Block 2 started with EDID header, ignoring Extension Blocks >= 2.
  DisplayID: Missing DisplayID Display Parameters Data Block.

EDID conformity: FAIL
