edid-decode (hex):

00 ff ff ff ff ff ff 00 0d ae e5 15 00 00 00 00
1f 1e 01 04 95 22 13 78 02 28 65 97 59 54 8e 27
1e 50 54 00 00 00 01 01 01 01 01 01 01 01 01 01
01 01 01 01 01 01 b4 3b 80 4a 71 38 34 40 50 36
68 00 58 c1 10 00 00 1a c3 2f 80 4a 71 38 34 40
50 36 68 00 58 c1 10 00 00 1a 00 00 00 fe 00 32
30 50 44 52 80 31 35 36 48 43 41 0a 00 00 00 00
00 00 41 31 96 00 10 00 00 0a 01 0a 20 20 00 bd

00 ff ff ff ff ff ff 00 0d ae e5 15 00 00 00 00
1f 1e 01 04 95 22 13 78 02 28 65 97 59 54 8e 27
1e 50 54 00 00 00 01 01 01 01 01 01 01 01 01 01
01 01 01 01 01 01 b4 3b 80 4a 71 38 34 40 50 36
68 00 58 c1 10 00 00 1a c3 2f 80 4a 71 38 34 40
50 36 68 00 58 c1 10 00 00 1a 00 00 00 fe 00 32
30 50 44 52 80 31 35 36 48 43 41 0a 00 00 00 00
00 00 41 31 96 00 10 00 00 0a 01 0a 20 20 00 bd

----------------

Block 0, Base EDID:
  EDID Structure Version & Revision: 1.4
  Vendor & Product Identification:
    Manufacturer: CMN
    Model: 5605
    Made in: week 31 of 2020
  Basic Display Parameters & Features:
    Digital display
    Bits per primary color channel: 6
    DisplayPort interface
    Maximum image size: 34 cm x 19 cm
    Gamma: 2.20
    Supported color formats: RGB 4:4:4
    First detailed timing includes the native pixel format and preferred refresh rate
  Color Characteristics:
    Red  : 0.5898, 0.3496
    Green: 0.3300, 0.5546
    Blue : 0.1533, 0.1191
    White: 0.3134, 0.3291
  Established Timings I & II: none
  Standard Timings: none
  Detailed Timing Descriptors:
    DTD 1:  1920x1080   60.007852 Hz  16:9     67.929 kHz    152.840000 MHz (344 mm x 193 mm)
                 Hfront   80 Hsync  54 Hback  196 Hpol P
                 Vfront    6 Vsync   8 Vback   38 Vpol N
    DTD 2:  1920x1080   48.005497 Hz  16:9     54.342 kHz    122.270000 MHz (344 mm x 193 mm)
                 Hfront   80 Hsync  54 Hback  196 Hpol P
                 Vfront    6 Vsync   8 Vback   38 Vpol N
    Alphanumeric Data String: '20PDR.156HCA'
    Manufacturer-Specified Display Descriptor (0x00): 00 00 00 00 41 31 96 00 10 00 00 0a 01 0a 20 20 '....A1........  '
Checksum: 0xbd

----------------

Block 1, Unknown EDID Extension Block 0x00:
  00 ff ff ff ff ff ff 00 0d ae e5 15 00 00 00 00 '................'
  1f 1e 01 04 95 22 13 78 02 28 65 97 59 54 8e 27 '.....".x.(e.YT.''
  1e 50 54 00 00 00 01 01 01 01 01 01 01 01 01 01 '.PT.............'
  01 01 01 01 01 01 b4 3b 80 4a 71 38 34 40 50 36 '.......;.Jq84@P6'
  68 00 58 c1 10 00 00 1a c3 2f 80 4a 71 38 34 40 'h.X....../.Jq84@'
  50 36 68 00 58 c1 10 00 00 1a 00 00 00 fe 00 32 'P6h.X..........2'
  30 50 44 52 80 31 35 36 48 43 41 0a 00 00 00 00 '0PDR.156HCA.....'
  00 00 41 31 96 00 10 00 00 0a 01 0a 20 20 00 bd '..A1........  ..'
Checksum: 0xbd

----------------

Warnings:

Block 0, Base EDID:
  Alphanumeric Data String: Non-ASCII character 0x80 at position 5, can cause problems.
  Missing Display Product Name.

Failures:

Block 1, Base EDID:
  Unknown Extension Block.
EDID:
  Base EDID: EDID specified 0 extension block(s), but found 1 extension block(s).

EDID conformity: FAIL
