edid-decode (hex):

00 ff ff ff ff ff ff 00 30 ae ba 40 00 00 00 00
2a 1d 01 04 a5 22 13 78 e2 28 65 97 59 54 8e 27
1e 50 54 00 00 00 01 01 01 01 01 01 01 01 01 01
01 01 01 01 01 01 36 36 80 a0 70 38 20 40 44 2d
35 00 58 c1 10 00 00 18 36 36 80 a0 70 38 20 40
44 2d 35 00 58 c1 10 00 00 18 00 00 00 0f 00 d1
09 3c d1 09 30 1e 0a 00 0d ae 1e 15 00 00 00 fe
00 4e 31 35 36 48 43 41 2d 45 41 43 0a 20 00 47

00 ff ff ff ff ff ff 00 30 ae ba 40 00 00 00 00
2a 1d 01 04 a5 22 13 78 e2 28 65 97 59 54 8e 27
1e 50 54 00 00 00 01 01 01 01 01 01 01 01 01 01
01 01 01 01 01 01 36 36 80 a0 70 38 20 40 44 2d
35 00 58 c1 10 00 00 18 36 36 80 a0 70 38 20 40
44 2d 35 00 58 c1 10 00 00 18 00 00 00 0f 00 d1
09 3c d1 09 30 1e 0a 00 0d ae 1e 15 00 00 00 fe
00 4e 31 35 36 48 43 41 2d 45 41 43 0a 20 00 47

----------------

Block 0, Base EDID:
  EDID Structure Version & Revision: 1.4
  Vendor & Product Identification:
    Manufacturer: LEN
    Model: 16570
    Made in: week 42 of 2019
  Basic Display Parameters & Features:
    Digital display
    Bits per primary color channel: 8
    DisplayPort interface
    Maximum image size: 34 cm x 19 cm
    Gamma: 2.20
    DPMS levels: Standby Suspend Off
    Supported color formats: RGB 4:4:4
    First detailed timing includes the native pixel format and preferred refresh rate
  Color Characteristics:
    Red  : 0.5898, 0.3496
    Green: 0.3300, 0.5546
    Blue : 0.1533, 0.1191
    White: 0.3134, 0.3291
  Established Timings I & II: none
  Standard Timings: none
  Detailed Timing Descriptors:
    DTD 1:  1920x1080   60.001038 Hz  16:9     66.721 kHz    138.780000 MHz (344 mm x 193 mm)
                 Hfront   68 Hsync  45 Hback   47 Hpol N
                 Vfront    3 Vsync   5 Vback   24 Vpol N
    DTD 2:  1920x1080   60.001038 Hz  16:9     66.721 kHz    138.780000 MHz (344 mm x 193 mm)
                 Hfront   68 Hsync  45 Hback   47 Hpol N
                 Vfront    3 Vsync   5 Vback   24 Vpol N
    Manufacturer-Specified Display Descriptor (0x0f): 00 0f 00 d1 09 3c d1 09 30 1e 0a 00 0d ae 1e 15 '.....<..0.......'
    Alphanumeric Data String: 'N156HCA-EAC'
Checksum: 0x47

----------------

Warnings:

Block 0, Base EDID:
  Missing Display Product Name.

Failures:

EDID:
  Extension Block 1 started with EDID header, ignoring Extension Blocks >= 1.

EDID conformity: FAIL
