edid-decode (hex):

00 ff ff ff ff ff ff 00 30 ae ba 40 00 00 00 00
1f 1d 01 04 a5 22 13 78 e2 da e5 95 5d 59 94 29
24 50 54 00 00 00 01 01 01 01 01 01 01 01 01 01
01 01 01 01 01 01 96 3b 80 36 71 38 3c 40 30 20
36 00 58 c2 10 00 00 1a ab 2f 80 36 71 38 3c 40
30 20 36 00 58 c2 10 00 00 1a 00 00 00 0f 00 d1
09 3c d1 09 30 19 0a 00 09 e5 c6 08 00 00 00 fe
00 4e 56 31 35 36 46 48 4d 2d 4e 34 38 0a 00 0d

00 ff ff ff ff ff ff 00 30 ae ba 40 00 00 00 00
1f 1d 01 04 a5 22 13 78 e2 da e5 95 5d 59 94 29
24 50 54 00 00 00 01 01 01 01 01 01 01 01 01 01
01 01 01 01 01 01 96 3b 80 36 71 38 3c 40 30 20
36 00 58 c2 10 00 00 1a ab 2f 80 36 71 38 3c 40
30 20 36 00 58 c2 10 00 00 1a 00 00 00 0f 00 d1
09 3c d1 09 30 19 0a 00 09 e5 c6 08 00 00 00 fe
00 4e 56 31 35 36 46 48 4d 2d 4e 34 38 0a 00 0d

----------------

Block 0, Base EDID:
  EDID Structure Version & Revision: 1.4
  Vendor & Product Identification:
    Manufacturer: LEN
    Model: 16570
    Made in: week 31 of 2019
  Basic Display Parameters & Features:
    Digital display
    Bits per primary color channel: 8
    DisplayPort interface
    Maximum image size: 34 cm x 19 cm
    Gamma: 2.20
    DPMS levels: Standby Suspend Off
    Supported color formats: RGB 4:4:4
    First detailed timing includes the native pixel format and preferred refresh rate
  Color Characteristics:
    Red  : 0.5849, 0.3642
    Green: 0.3496, 0.5800
    Blue : 0.1630, 0.1425
    White: 0.3134, 0.3291
  Established Timings I & II: none
  Standard Timings: none
  Detailed Timing Descriptors:
    DTD 1:  1920x1080   60.003147 Hz  16:9     68.404 kHz    152.540000 MHz (344 mm x 194 mm)
                 Hfront   48 Hsync  32 Hback  230 Hpol P
                 Vfront    3 Vsync   6 Vback   51 Vpol N
    DTD 2:  1920x1080   48.001731 Hz  16:9     54.722 kHz    122.030000 MHz (344 mm x 194 mm)
                 Hfront   48 Hsync  32 Hback  230 Hpol P
                 Vfront    3 Vsync   6 Vback   51 Vpol N
    Manufacturer-Specified Display Descriptor (0x0f): 00 0f 00 d1 09 3c d1 09 30 19 0a 00 09 e5 c6 08 '.....<..0.......'
    Alphanumeric Data String: 'NV156FHM-N48'
Checksum: 0x0d

----------------

Warnings:

Block 0, Base EDID:
  Missing Display Product Name.

Failures:

EDID:
  Extension Block 1 started with EDID header, ignoring Extension Blocks >= 1.

EDID conformity: FAIL
