edid-decode (hex):

00 ff ff ff ff ff ff 00 30 ae ba 40 00 00 00 00
21 1a 01 04 a5 22 13 78 e2 28 65 97 59 54 8e 27
1e 50 54 00 00 00 01 01 01 01 01 01 01 01 01 01
01 01 01 01 01 01 b4 3b 80 4a 71 38 34 40 50 36
68 00 58 c1 10 00 00 18 c2 2f 80 4a 71 38 34 40
50 36 68 00 58 c1 10 00 00 18 00 00 00 0f 00 d1
09 3c d1 09 30 19 0a 00 0d ae e7 15 00 00 00 fe
00 4e 31 35 36 48 43 41 2d 45 41 42 0a 20 00 7a

00 ff ff ff ff ff ff 00 30 ae ba 40 00 00 00 00
21 1a 01 04 a5 22 13 78 e2 28 65 97 59 54 8e 27
1e 50 54 00 00 00 01 01 01 01 01 01 01 01 01 01
01 01 01 01 01 01 b4 3b 80 4a 71 38 34 40 50 36
68 00 58 c1 10 00 00 18 c2 2f 80 4a 71 38 34 40
50 36 68 00 58 c1 10 00 00 18 00 00 00 0f 00 d1
09 3c d1 09 30 19 0a 00 0d ae e7 15 00 00 00 fe
00 4e 31 35 36 48 43 41 2d 45 41 42 0a 20 00 7a

----------------

Block 0, Base EDID:
  EDID Structure Version & Revision: 1.4
  Vendor & Product Identification:
    Manufacturer: LEN
    Model: 16570
    Made in: week 33 of 2016
  Basic Display Parameters & Features:
    Digital display
    Bits per primary color channel: 8
    DisplayPort interface
    Maximum image size: 34 cm x 19 cm
    Gamma: 2.20
    DPMS levels: Standby Suspend Off
    Supported color formats: RGB 4:4:4
    First detailed timing includes the native pixel format and preferred refresh rate
  Color Characteristics:
    Red  : 0.5898, 0.3496
    Green: 0.3300, 0.5546
    Blue : 0.1533, 0.1191
    White: 0.3134, 0.3291
  Established Timings I & II: none
  Standard Timings: none
  Detailed Timing Descriptors:
    DTD 1:  1920x1080   60.007852 Hz  16:9     67.929 kHz    152.840000 MHz (344 mm x 193 mm)
                 Hfront   80 Hsync  54 Hback  196 Hpol N
                 Vfront    6 Vsync   8 Vback   38 Vpol N
    DTD 2:  1920x1080   48.001570 Hz  16:9     54.338 kHz    122.260000 MHz (344 mm x 193 mm)
                 Hfront   80 Hsync  54 Hback  196 Hpol N
                 Vfront    6 Vsync   8 Vback   38 Vpol N
    Manufacturer-Specified Display Descriptor (0x0f): 00 0f 00 d1 09 3c d1 09 30 19 0a 00 0d ae e7 15 '.....<..0.......'
    Alphanumeric Data String: 'N156HCA-EAB'
Checksum: 0x7a

----------------

Warnings:

Block 0, Base EDID:
  Missing Display Product Name.

Failures:

EDID:
  Extension Block 1 started with EDID header, ignoring Extension Blocks >= 1.

EDID conformity: FAIL
