edid-decode (hex):

00 ff ff ff ff ff ff 00 22 0e 40 37 00 00 00 00
31 20 01 04 b5 5d 27 78 3a 60 15 af 4f 43 ab 25
0f 50 54 a1 08 00 d1 c0 a9 c0 d1 00 b3 00 81 00
95 00 a9 40 81 80 cd 46 00 a0 a0 38 1f 40 30 20
3a 00 a1 88 31 00 00 1a 00 00 00 fd 00 1d 47 1f
86 47 01 0a 20 20 20 20 20 20 00 00 00 fc 00 48
50 20 5a 34 30 63 20 47 33 0a 20 20 00 00 00 ff
00 43 4e 34 32 34 39 30 47 48 52 0a 20 20 02 45

02 03 19 f1 49 10 04 03 02 1f 13 12 11 01 23 09
07 07 83 01 00 00 e2 00 eb 4d d0 00 a0 f0 70 3e
80 30 20 35 00 a1 88 31 00 00 1a a3 66 00 a0 f0
70 1f 80 30 20 35 00 a1 88 31 00 00 1a 56 5e 00
a0 a0 a0 29 50 30 20 35 00 a1 88 31 00 00 1a 4c
9a 00 a0 f0 40 2e 60 30 20 3a 00 a1 88 31 00 00
1a 00 00 00 00 00 00 00 00 00 00 00 00 00 00 00
00 00 00 00 00 00 00 00 00 00 00 00 00 00 00 f1

00 ff ff ff ff ff ff 00 22 0e 40 37 00 00 00 00
31 20 01 04 b5 5d 27 78 3a 60 15 af 4f 43 ab 25
0f 50 54 a1 08 00 d1 c0 a9 c0 d1 00 b3 00 81 00
95 00 a9 40 81 80 cd 46 00 a0 a0 38 1f 40 30 20
3a 00 a1 88 31 00 00 1a 00 00 00 fd 00 1d 47 1f
86 47 01 0a 20 20 20 20 20 20 00 00 00 fc 00 48
50 20 5a 34 30 63 20 47 33 0a 20 20 00 00 00 ff
00 43 4e 34 32 34 39 30 47 48 52 0a 20 20 02 45

00 ff ff ff ff ff ff 00 22 0e 40 37 00 00 00 00
31 20 01 04 b5 5d 27 78 3a 60 15 af 4f 43 ab 25
0f 50 54 a1 08 00 d1 c0 a9 c0 d1 00 b3 00 81 00
95 00 a9 40 81 80 cd 46 00 a0 a0 38 1f 40 30 20
3a 00 a1 88 31 00 00 1a 00 00 00 fd 00 1d 47 1f
86 47 01 0a 20 20 20 20 20 20 00 00 00 fc 00 48
50 20 5a 34 30 63 20 47 33 0a 20 20 00 00 00 ff
00 43 4e 34 32 34 39 30 47 48 52 0a 20 20 02 45

02 03 19 f1 49 10 04 03 02 1f 13 12 11 01 23 09
07 07 83 01 00 00 e2 00 eb 4d d0 00 a0 f0 70 3e
80 30 20 35 00 a1 88 31 00 00 1a a3 66 00 a0 f0
70 1f 80 30 20 35 00 a1 88 31 00 00 1a 56 5e 00
a0 a0 a0 29 50 30 20 35 00 a1 88 31 00 00 1a 4c
9a 00 a0 f0 40 2e 60 30 20 3a 00 a1 88 31 00 00
1a 00 00 00 00 00 00 00 00 00 00 00 00 00 00 00
00 00 00 00 00 00 00 00 00 00 00 00 00 00 00 f1

00 ff ff ff ff ff ff 00 22 0e 40 37 00 00 00 00
31 20 01 04 b5 5d 27 78 3a 60 15 af 4f 43 ab 25
0f 50 54 a1 08 00 d1 c0 a9 c0 d1 00 b3 00 81 00
95 00 a9 40 81 80 cd 46 00 a0 a0 38 1f 40 30 20
3a 00 a1 88 31 00 00 1a 00 00 00 fd 00 1d 47 1f
86 47 01 0a 20 20 20 20 20 20 00 00 00 fc 00 48
50 20 5a 34 30 63 20 47 33 0a 20 20 00 00 00 ff
00 43 4e 34 32 34 39 30 47 48 52 0a 20 20 02 45

----------------

Block 0, Base EDID:
  EDID Structure Version & Revision: 1.4
  Vendor & Product Identification:
    Manufacturer: HPN
    Model: 14144
    Made in: week 49 of 2022
  Basic Display Parameters & Features:
    Digital display
    Bits per primary color channel: 10
    DisplayPort interface
    Maximum image size: 93 cm x 39 cm
    Gamma: 2.20
    DPMS levels: Off
    Supported color formats: RGB 4:4:4, YCrCb 4:4:4, YCrCb 4:2:2
    First detailed timing includes the native pixel format and preferred refresh rate
  Color Characteristics:
    Red  : 0.6845, 0.3105
    Green: 0.2617, 0.6679
    Blue : 0.1445, 0.0595
    White: 0.3134, 0.3291
  Established Timings I & II:
    IBM     :   720x400    70.081663 Hz   9:5     31.467 kHz     28.320000 MHz
    DMT 0x04:   640x480    59.940476 Hz   4:3     31.469 kHz     25.175000 MHz
    DMT 0x09:   800x600    60.316541 Hz   4:3     37.879 kHz     40.000000 MHz
    DMT 0x10:  1024x768    60.003840 Hz   4:3     48.363 kHz     65.000000 MHz
  Standard Timings:
    DMT 0x52:  1920x1080   60.000000 Hz  16:9     67.500 kHz    148.500000 MHz
    DMT 0x53:  1600x900    60.000000 Hz  16:9     60.000 kHz    108.000000 MHz (RB)
    DMT 0x45:  1920x1200   59.884600 Hz  16:10    74.556 kHz    193.250000 MHz
    DMT 0x3a:  1680x1050   59.954250 Hz  16:10    65.290 kHz    146.250000 MHz
    DMT 0x1c:  1280x800    59.810326 Hz  16:10    49.702 kHz     83.500000 MHz
    DMT 0x2f:  1440x900    59.887445 Hz  16:10    55.935 kHz    106.500000 MHz
    DMT 0x33:  1600x1200   60.000000 Hz   4:3     75.000 kHz    162.000000 MHz
    DMT 0x23:  1280x1024   60.019740 Hz   5:4     63.981 kHz    108.000000 MHz
  Detailed Timing Descriptors:
    DTD 1:  2560x1080   59.978424 Hz  64:27    66.636 kHz    181.250000 MHz (929 mm x 392 mm)
                 Hfront   48 Hsync  32 Hback   80 Hpol P
                 Vfront    3 Vsync  10 Vback   18 Vpol N
    Display Range Limits:
      Monitor ranges (Range Limits Only): 29-71 Hz V, 31-134 kHz H, max dotclock 710 MHz
    Display Product Name: 'HP Z40c G3'
    Display Product Serial Number: ...
  Extension blocks: 2
Checksum: 0x45

----------------

Block 1, CTA-861 Extension Block:
  Revision: 3
  Underscans IT Video Formats by default
  Basic audio support
  Supports YCbCr 4:4:4
  Supports YCbCr 4:2:2
  Native DTDs: 1
  Video Data Block:
    VIC  16:  1920x1080   60.000000 Hz  16:9     67.500 kHz    148.500000 MHz
    VIC   4:  1280x720    60.000000 Hz  16:9     45.000 kHz     74.250000 MHz
    VIC   3:   720x480    59.940060 Hz  16:9     31.469 kHz     27.000000 MHz
    VIC   2:   720x480    59.940060 Hz   4:3     31.469 kHz     27.000000 MHz
    VIC  31:  1920x1080   50.000000 Hz  16:9     56.250 kHz    148.500000 MHz
    VIC  19:  1280x720    50.000000 Hz  16:9     37.500 kHz     74.250000 MHz
    VIC  18:   720x576    50.000000 Hz  16:9     31.250 kHz     27.000000 MHz
    VIC  17:   720x576    50.000000 Hz   4:3     31.250 kHz     27.000000 MHz
    VIC   1:   640x480    59.940476 Hz   4:3     31.469 kHz     25.175000 MHz
  Audio Data Block:
    Linear PCM:
      Max channels: 2
      Supported sample rates (kHz): 48 44.1 32
      Supported sample sizes (bits): 24 20 16
  Speaker Allocation Data Block:
    FL/FR - Front Left/Right
  Video Capability Data Block:
    YCbCr quantization: Selectable (via AVI YQ)
    RGB quantization: Selectable (via AVI Q)
    PT scan behavior: Always Underscanned
    IT scan behavior: Always Underscanned
    CE scan behavior: Supports both over- and underscan
  Detailed Timing Descriptors:
    DTD 2:  3840x2160   59.996625 Hz  16:9    133.312 kHz    533.250000 MHz (929 mm x 392 mm)
                 Hfront   48 Hsync  32 Hback   80 Hpol P
                 Vfront    3 Vsync   5 Vback   54 Vpol N
    DTD 3:  3840x2160   29.980602 Hz  16:9     65.688 kHz    262.750000 MHz (929 mm x 392 mm)
                 Hfront   48 Hsync  32 Hback   80 Hpol P
                 Vfront    3 Vsync   5 Vback   23 Vpol N
    DTD 4:  2560x1440   59.950550 Hz  16:9     88.787 kHz    241.500000 MHz (929 mm x 392 mm)
                 Hfront   48 Hsync  32 Hback   80 Hpol P
                 Vfront    3 Vsync   5 Vback   33 Vpol N
    DTD 5:  3840x1600   59.993925 Hz  12:5     98.750 kHz    395.000000 MHz (929 mm x 392 mm)
                 Hfront   48 Hsync  32 Hback   80 Hpol P
                 Vfront    3 Vsync  10 Vback   33 Vpol N
Checksum: 0xf1  Unused space in Extension Block: 30 bytes

----------------

Warnings:

Block 1, CTA-861 Extension Block:
  Video Data Block: VIC 16 and the first DTD are not identical. Is this intended?
  Detailed Timing Descriptor #2: Image size is 929x392 mm, but based on the picture AR it should be 696x392 mm.
  Detailed Timing Descriptor #3: Image size is 929x392 mm, but based on the picture AR it should be 696x392 mm.
  Detailed Timing Descriptor #4: Image size is 929x392 mm, but based on the picture AR it should be 696x392 mm.
  Add a Colorimetry Data Block with the sRGB colorimetry bit set to avoid interop issues.

Failures:

EDID:
  Extension Block 2 started with EDID header, ignoring Extension Blocks >= 2.
  Base EDID: EDID specified 2 extension block(s), but found 1 extension block(s).

EDID conformity: FAIL
