edid-decode (hex):

00 ff ff ff ff ff ff 00 15 c3 68 25 01 01 01 01
2b 1b 01 03 80 35 1e 78 ea 7e 75 a7 55 52 9c 27
0f 50 54 a1 08 00 81 80 b3 00 a9 c0 81 c0 81 00
01 01 01 01 01 01 02 3a 80 18 71 38 2d 40 58 2c
45 00 10 29 21 00 00 1e 00 00 00 ff 00 36 30 36
34 36 31 30 37 0a 20 20 20 20 00 00 00 fd 00 3b
3d 1f 44 0f 00 0a 20 20 20 20 20 20 00 00 00 fc
00 45 56 32 34 35 30 0a 20 20 20 20 20 20 00 aa

00 ff ff ff ff ff ff 00 15 c3 68 25 01 01 01 01
2b 1b 01 03 80 35 1e 78 ea 7e 75 a7 55 52 9c 27
0f 50 54 a1 08 00 81 80 b3 00 a9 c0 81 c0 81 00
01 01 01 01 01 01 02 3a 80 18 71 38 2d 40 58 2c
45 00 10 29 21 00 00 1e 00 00 00 ff 00 36 30 36
34 36 31 30 37 0a 20 20 20 20 00 00 00 fd 00 3b
3d 1f 44 0f 00 0a 20 20 20 20 20 20 00 00 00 fc
00 45 56 32 34 35 30 0a 20 20 20 20 20 20 00 aa

----------------

Block 0, Base EDID:
  EDID Structure Version & Revision: 1.3
  Vendor & Product Identification:
    Manufacturer: ENC
    Model: 9576
    Serial Number: ...
    Made in: week 43 of 2017
  Basic Display Parameters & Features:
    Digital display
    Maximum image size: 53 cm x 30 cm
    Gamma: 2.20
    DPMS levels: Standby Suspend Off
    RGB color display
    First detailed timing is the preferred timing
  Color Characteristics:
    Red  : 0.6533, 0.3349
    Green: 0.3232, 0.6113
    Blue : 0.1533, 0.0615
    White: 0.3134, 0.3291
  Established Timings I & II:
    IBM     :   720x400    70.081663 Hz   9:5     31.467 kHz     28.320000 MHz
    DMT 0x04:   640x480    59.940476 Hz   4:3     31.469 kHz     25.175000 MHz
    DMT 0x09:   800x600    60.316541 Hz   4:3     37.879 kHz     40.000000 MHz
    DMT 0x10:  1024x768    60.003840 Hz   4:3     48.363 kHz     65.000000 MHz
  Standard Timings:
    DMT 0x23:  1280x1024   60.019740 Hz   5:4     63.981 kHz    108.000000 MHz
    DMT 0x3a:  1680x1050   59.954250 Hz  16:10    65.290 kHz    146.250000 MHz
    DMT 0x53:  1600x900    60.000000 Hz  16:9     60.000 kHz    108.000000 MHz (RB)
    DMT 0x55:  1280x720    60.000000 Hz  16:9     45.000 kHz     74.250000 MHz
    DMT 0x1c:  1280x800    59.810326 Hz  16:10    49.702 kHz     83.500000 MHz
  Detailed Timing Descriptors:
    DTD 1:  1920x1080   60.000000 Hz  16:9     67.500 kHz    148.500000 MHz (528 mm x 297 mm)
                 Hfront   88 Hsync  44 Hback  148 Hpol P
                 Vfront    4 Vsync   5 Vback   36 Vpol P
    Display Product Serial Number: ...
    Display Range Limits:
      Monitor ranges (GTF): 59-61 Hz V, 31-68 kHz H, max dotclock 150 MHz
    Display Product Name: 'EV2450'
Checksum: 0xaa

----------------

Block 1, Unknown EDID Extension Block 0x00:
  00 ff ff ff ff ff ff 00 15 c3 68 25 01 01 01 01 '..........h%....'
  2b 1b 01 03 80 35 1e 78 ea 7e 75 a7 55 52 9c 27 '+....5.x.~u.UR.''
  0f 50 54 a1 08 00 81 80 b3 00 a9 c0 81 c0 81 00 '.PT.............'
  01 01 01 01 01 01 02 3a 80 18 71 38 2d 40 58 2c '.......:..q8-@X,'
  45 00 10 29 21 00 00 1e 00 00 00 ff 00 36 30 36 'E..)!........606'
  34 36 31 30 37 0a 20 20 20 20 00 00 00 fd 00 3b '46107.    .....;'
  3d 1f 44 0f 00 0a 20 20 20 20 20 20 00 00 00 fc '=.D...      ....'
  00 45 56 32 34 35 30 0a 20 20 20 20 20 20 00 aa '.EV2450.      ..'
Checksum: 0xaa

----------------

Warnings:

Block 0, Base EDID:
  Vendor & Product Identification: The serial number is one of the known dummy values, it should probably be set to 0.
EDID:
  Base EDID: Some timings are out of range of the Monitor Ranges:
    Vertical Freq: 59.810 - 70.082 Hz (Monitor: 59.000 - 61.000 Hz)

Failures:

Block 1, Base EDID:
  Unknown Extension Block.
EDID:
  Base EDID: EDID specified 0 extension block(s), but found 1 extension block(s).

EDID conformity: FAIL
