edid-decode (hex):

00 ff ff ff ff ff ff 00 26 cd 02 56 49 03 00 00
21 11 01 03 80 31 20 78 2a 95 10 a6 54 44 a1 25
14 50 54 bf ef 80 71 4f 81 80 81 40 81 4f 81 0f
95 00 90 40 b3 00 21 39 90 30 62 1a 27 40 68 b0
36 00 ea 40 11 00 00 1c 00 00 00 ff 00 30 35 38
38 31 4d 37 38 30 30 38 34 31 00 00 00 fd 00 37
4b 1e 50 11 00 0a 20 20 20 20 20 20 00 00 00 fc
00 50 4c 32 32 30 31 57 0a 20 20 20 20 20 00 b7

00 ff ff ff ff ff ff 00 26 cd 02 56 49 03 00 00
21 11 01 03 80 31 20 78 2a 95 10 a6 54 44 a1 25
14 50 54 bf ef 80 71 4f 81 80 81 40 81 4f 81 0f
95 00 90 40 b3 00 21 39 90 30 62 1a 27 40 68 b0
36 00 ea 40 11 00 00 1c 00 00 00 ff 00 30 35 38
38 31 4d 37 38 30 30 38 34 31 00 00 00 fd 00 37
4b 1e 50 11 00 0a 20 20 20 20 20 20 00 00 00 fc
00 50 4c 32 32 30 31 57 0a 20 20 20 20 20 00 b7

----------------

Block 0, Base EDID:
  EDID Structure Version & Revision: 1.3
  Vendor & Product Identification:
    Manufacturer: IVM
    Model: 22018
    Serial Number: ...
    Made in: week 33 of 2007
  Basic Display Parameters & Features:
    Digital display
    Maximum image size: 49 cm x 32 cm
    Gamma: 2.20
    DPMS levels: Off
    RGB color display
    First detailed timing is the preferred timing
  Color Characteristics:
    Red  : 0.6503, 0.3291
    Green: 0.2666, 0.6298
    Blue : 0.1445, 0.0791
    White: 0.3125, 0.3281
  Established Timings I & II:
    IBM     :   720x400    70.081663 Hz   9:5     31.467 kHz     28.320000 MHz
    DMT 0x04:   640x480    59.940476 Hz   4:3     31.469 kHz     25.175000 MHz
    Apple   :   640x480    66.666667 Hz   4:3     35.000 kHz     30.240000 MHz
    DMT 0x05:   640x480    72.808802 Hz   4:3     37.861 kHz     31.500000 MHz
    DMT 0x06:   640x480    75.000000 Hz   4:3     37.500 kHz     31.500000 MHz
    DMT 0x08:   800x600    56.250000 Hz   4:3     35.156 kHz     36.000000 MHz
    DMT 0x09:   800x600    60.316541 Hz   4:3     37.879 kHz     40.000000 MHz
    DMT 0x0a:   800x600    72.187572 Hz   4:3     48.077 kHz     50.000000 MHz
    DMT 0x0b:   800x600    75.000000 Hz   4:3     46.875 kHz     49.500000 MHz
    Apple   :   832x624    74.551266 Hz   4:3     49.726 kHz     57.284000 MHz
    DMT 0x10:  1024x768    60.003840 Hz   4:3     48.363 kHz     65.000000 MHz
    DMT 0x11:  1024x768    70.069359 Hz   4:3     56.476 kHz     75.000000 MHz
    DMT 0x12:  1024x768    75.028582 Hz   4:3     60.023 kHz     78.750000 MHz
    DMT 0x24:  1280x1024   75.024675 Hz   5:4     79.976 kHz    135.000000 MHz
    Apple   :  1152x870    75.061550 Hz 192:145   68.681 kHz    100.000000 MHz
  Standard Timings:
    DMT 0x15:  1152x864    75.000000 Hz   4:3     67.500 kHz    108.000000 MHz
    DMT 0x23:  1280x1024   60.019740 Hz   5:4     63.981 kHz    108.000000 MHz
    DMT 0x20:  1280x960    60.000000 Hz   4:3     60.000 kHz    108.000000 MHz
    GTF     :  1280x960    74.999884 Hz   4:3     75.150 kHz    129.859000 MHz
    DMT 0x1d:  1280x800    74.934142 Hz  16:10    62.795 kHz    106.500000 MHz
    DMT 0x2f:  1440x900    59.887445 Hz  16:10    55.935 kHz    106.500000 MHz
    DMT 0x2a:  1400x1050   59.978442 Hz   4:3     65.317 kHz    121.750000 MHz
    DMT 0x3a:  1680x1050   59.954250 Hz  16:10    65.290 kHz    146.250000 MHz
  Detailed Timing Descriptors:
    DTD 1:  1680x1050   59.954250 Hz  16:10    65.290 kHz    146.250000 MHz (490 mm x 320 mm)
                 Hfront  104 Hsync 176 Hback  280 Hpol N
                 Vfront    3 Vsync   6 Vback   30 Vpol P
    Display Product Serial Number: ...
    Display Range Limits:
      Monitor ranges (GTF): 55-75 Hz V, 30-80 kHz H, max dotclock 170 MHz
    Display Product Name: 'PL2201W'
Checksum: 0xb7

----------------

Block 1, Unknown EDID Extension Block 0x00:
  00 ff ff ff ff ff ff 00 26 cd 02 56 49 03 00 00 '........&..VI...'
  21 11 01 03 80 31 20 78 2a 95 10 a6 54 44 a1 25 '!....1 x*...TD.%'
  14 50 54 bf ef 80 71 4f 81 80 81 40 81 4f 81 0f '.PT...qO...@.O..'
  95 00 90 40 b3 00 21 39 90 30 62 1a 27 40 68 b0 '...@..!9.0b.'@h.'
  36 00 ea 40 11 00 00 1c 00 00 00 ff 00 30 35 38 '6..@.........058'
  38 31 4d 37 38 30 30 38 34 31 00 00 00 fd 00 37 '81M7800841.....7'
  4b 1e 50 11 00 0a 20 20 20 20 20 20 00 00 00 fc 'K.P...      ....'
  00 50 4c 32 32 30 31 57 0a 20 20 20 20 20 00 b7 '.PL2201W.     ..'
Checksum: 0xb7

----------------

Warnings:

Block 0, Base EDID:
  Detailed Timing Descriptor #1: Image size is 490x320 mm, but based on the picture AR it should be 490x306 mm.

Failures:

Block 1, Base EDID:
  Unknown Extension Block.
EDID:
  Base EDID: EDID specified 0 extension block(s), but found 1 extension block(s).

EDID conformity: FAIL
