edid-decode (hex):

00 ff ff ff ff ff ff 00 61 a9 44 34 00 00 00 00
10 1e 01 03 80 50 21 78 2a 64 f5 ad 50 49 a3 22
13 50 54 ad cf 00 71 4f 81 c0 81 40 81 80 95 00
a9 c0 b3 00 d1 c0 21 68 70 a0 d0 a0 29 50 30 20
35 00 1d 4e 31 00 00 1a 00 00 00 fd 00 30 79 1e
aa 3c 00 0a 20 20 20 20 20 20 00 00 00 fc 00 4d
69 20 4d 6f 6e 69 74 6f 72 0a 20 20 00 00 00 ff
d0 30 30 30 30 30 30 30 30 30 30 30 30 30 01 ae

02 03 35 f1 4c 01 02 03 04 04 90 11 12 13 04 1f
3f 23 09 07 07 83 01 00 00 6a 03 0c 00 20 00 38
3c 20 00 00 67 d8 5d c4 01 78 c0 03 68 1a 00 00
01 01 30 79 ed 40 d0 70 a0 d0 a0 29 50 58 40 45
00 1d 4e 31 00 00 1e a3 48 b8 68 61 a0 32 50 30
40 35 00 1d 4e 31 00 00 1e f5 7c 70 a0 d0 a0 29
50 30 20 35 00 1d 4e 31 00 00 1a 56 5e 00 a0 a0
a0 29 50 30 20 35 00 1d 4d 31 00 00 1a 00 00 39

00 ff ff ff ff ff ff 00 61 a9 44 34 00 00 00 00
10 1e 01 03 80 50 21 78 2a 64 f5 ad 50 49 a3 22
13 50 54 ad cf 00 71 4f 81 c0 81 40 81 80 95 00
a9 c0 b3 00 d1 c0 21 68 70 a0 d0 a0 29 50 30 20
35 00 1d 4e 31 00 00 1a 00 00 00 fd 00 30 79 1e
aa 3c 00 0a 20 20 20 20 20 20 00 00 00 fc 00 4d
69 20 4d 6f 6e 69 74 6f 72 0a 20 20 00 00 00 ff
d0 30 30 30 30 30 30 30 30 30 30 30 30 30 01 ae

02 03 35 f1 4c 01 02 03 04 04 90 11 12 13 04 1f
3f 23 09 07 07 83 01 00 00 6a 03 0c 00 20 00 38
3c 20 00 00 67 d8 5d c4 01 78 c0 03 68 1a 00 00
01 01 30 79 ed 40 d0 70 a0 d0 a0 29 50 58 40 45
00 1d 4e 31 00 00 1e a3 48 b8 68 61 a0 32 50 30
40 35 00 1d 4e 31 00 00 1e f5 7c 70 a0 d0 a0 29
50 30 20 35 00 1d 4e 31 00 00 1a 56 5e 00 a0 a0
a0 29 50 30 20 35 00 1d 4d 31 00 00 1a 00 00 39

----------------

Block 0, Base EDID:
  EDID Structure Version & Revision: 1.3
  Vendor & Product Identification:
    Manufacturer: XMI
    Model: 13380
    Made in: week 16 of 2020
  Basic Display Parameters & Features:
    Digital display
    Maximum image size: 80 cm x 33 cm
    Gamma: 2.20
    DPMS levels: Off
    RGB color display
    First detailed timing is the preferred timing
  Color Characteristics:
    Red  : 0.6767, 0.3144
    Green: 0.2861, 0.6367
    Blue : 0.1357, 0.0771
    White: 0.3134, 0.3291
  Established Timings I & II:
    IBM     :   720x400    70.081663 Hz   9:5     31.467 kHz     28.320000 MHz
    DMT 0x04:   640x480    59.940476 Hz   4:3     31.469 kHz     25.175000 MHz
    DMT 0x05:   640x480    72.808802 Hz   4:3     37.861 kHz     31.500000 MHz
    DMT 0x06:   640x480    75.000000 Hz   4:3     37.500 kHz     31.500000 MHz
    DMT 0x09:   800x600    60.316541 Hz   4:3     37.879 kHz     40.000000 MHz
    DMT 0x0a:   800x600    72.187572 Hz   4:3     48.077 kHz     50.000000 MHz
    DMT 0x0b:   800x600    75.000000 Hz   4:3     46.875 kHz     49.500000 MHz
    DMT 0x10:  1024x768    60.003840 Hz   4:3     48.363 kHz     65.000000 MHz
    DMT 0x11:  1024x768    70.069359 Hz   4:3     56.476 kHz     75.000000 MHz
    DMT 0x12:  1024x768    75.028582 Hz   4:3     60.023 kHz     78.750000 MHz
    DMT 0x24:  1280x1024   75.024675 Hz   5:4     79.976 kHz    135.000000 MHz
  Standard Timings:
    DMT 0x15:  1152x864    75.000000 Hz   4:3     67.500 kHz    108.000000 MHz
    DMT 0x55:  1280x720    60.000000 Hz  16:9     45.000 kHz     74.250000 MHz
    DMT 0x20:  1280x960    60.000000 Hz   4:3     60.000 kHz    108.000000 MHz
    DMT 0x23:  1280x1024   60.019740 Hz   5:4     63.981 kHz    108.000000 MHz
    DMT 0x2f:  1440x900    59.887445 Hz  16:10    55.935 kHz    106.500000 MHz
    DMT 0x53:  1600x900    60.000000 Hz  16:9     60.000 kHz    108.000000 MHz (RB)
    DMT 0x3a:  1680x1050   59.954250 Hz  16:10    65.290 kHz    146.250000 MHz
    DMT 0x52:  1920x1080   60.000000 Hz  16:9     67.500 kHz    148.500000 MHz
  Detailed Timing Descriptors:
    DTD 1:  3440x1440   49.998124 Hz  43:18    74.047 kHz    266.570000 MHz (797 mm x 334 mm)
                 Hfront   48 Hsync  32 Hback   80 Hpol P
                 Vfront    3 Vsync   5 Vback   33 Vpol N
    Display Range Limits:
      Monitor ranges (GTF): 48-121 Hz V, 30-170 kHz H, max dotclock 600 MHz
    Display Product Name: 'Mi Monitor'
    Display Product Serial Number: ...
  Extension blocks: 1
Checksum: 0xae

----------------

Block 1, CTA-861 Extension Block:
  Revision: 3
  Underscans IT Video Formats by default
  Basic audio support
  Supports YCbCr 4:4:4
  Supports YCbCr 4:2:2
  Native detailed modes: 1
  Video Data Block:
    VIC   1:   640x480    59.940476 Hz   4:3     31.469 kHz     25.175000 MHz
    VIC   2:   720x480    59.940060 Hz   4:3     31.469 kHz     27.000000 MHz
    VIC   3:   720x480    59.940060 Hz  16:9     31.469 kHz     27.000000 MHz
    VIC   4:  1280x720    60.000000 Hz  16:9     45.000 kHz     74.250000 MHz
    VIC   4:  1280x720    60.000000 Hz  16:9     45.000 kHz     74.250000 MHz
    VIC  16:  1920x1080   60.000000 Hz  16:9     67.500 kHz    148.500000 MHz (native)
    VIC  17:   720x576    50.000000 Hz   4:3     31.250 kHz     27.000000 MHz
    VIC  18:   720x576    50.000000 Hz  16:9     31.250 kHz     27.000000 MHz
    VIC  19:  1280x720    50.000000 Hz  16:9     37.500 kHz     74.250000 MHz
    VIC   4:  1280x720    60.000000 Hz  16:9     45.000 kHz     74.250000 MHz
    VIC  31:  1920x1080   50.000000 Hz  16:9     56.250 kHz    148.500000 MHz
    VIC  63:  1920x1080  120.000000 Hz  16:9    135.000 kHz    297.000000 MHz
  Audio Data Block:
    Linear PCM:
      Max channels: 2
      Supported sample rates (kHz): 48 44.1 32
      Supported sample sizes (bits): 24 20 16
  Speaker Allocation Data Block:
    FL/FR - Front Left/Right
  Vendor-Specific Data Block (HDMI), OUI 00-0C-03:
    Source physical address: 2.0.0.0
    DC_36bit
    DC_30bit
    DC_Y444
    Maximum TMDS clock: 300 MHz
    Extended HDMI video details:
  Vendor-Specific Data Block (HDMI Forum), OUI C4-5D-D8:
    Version: 1
    Maximum TMDS Character Rate: 600 MHz
    SCDC Present
    SCDC Read Request Capable
    Supports 12-bits/component Deep Color 4:2:0 Pixel Encoding
    Supports 10-bits/component Deep Color 4:2:0 Pixel Encoding
  Vendor-Specific Data Block (AMD), OUI 00-00-1A:
    Version: 1
    Feature Caps: 0x01
    Minimum Refresh Rate: 48 Hz
    Maximum Refresh Rate: 121 Hz
    Flags 1.x: 0xed (MCCS)
  Detailed Timing Descriptors:
    DTD 2:  3440x1440   99.992498 Hz  43:18   148.089 kHz    533.120000 MHz (797 mm x 334 mm)
                 Hfront   88 Hsync  64 Hback    8 Hpol P
                 Vfront    4 Vsync   5 Vback   32 Vpol P
    DTD 3:  1720x1440   59.999355 Hz  43:36    89.399 kHz    185.950000 MHz (797 mm x 334 mm)
                 Hfront   48 Hsync  64 Hback  248 Hpol P
                 Vfront    3 Vsync   5 Vback   42 Vpol P
    DTD 4:  3440x1440   59.998875 Hz  43:18    88.858 kHz    319.890000 MHz (797 mm x 334 mm)
                 Hfront   48 Hsync  32 Hback   80 Hpol P
                 Vfront    3 Vsync   5 Vback   33 Vpol N
    DTD 5:  2560x1440   59.950550 Hz  16:9     88.787 kHz    241.500000 MHz (797 mm x 333 mm)
                 Hfront   48 Hsync  32 Hback   80 Hpol P
                 Vfront    3 Vsync   5 Vback   33 Vpol N
Checksum: 0x39  Unused space in Extension Block: 2 bytes

----------------

Block 2, Unknown EDID Extension Block 0x00:
  00 ff ff ff ff ff ff 00 61 a9 44 34 00 00 00 00 '........a.D4....'
  10 1e 01 03 80 50 21 78 2a 64 f5 ad 50 49 a3 22 '.....P!x*d..PI."'
  13 50 54 ad cf 00 71 4f 81 c0 81 40 81 80 95 00 '.PT...qO...@....'
  a9 c0 b3 00 d1 c0 21 68 70 a0 d0 a0 29 50 30 20 '......!hp...)P0 '
  35 00 1d 4e 31 00 00 1a 00 00 00 fd 00 30 79 1e '5..N1........0y.'
  aa 3c 00 0a 20 20 20 20 20 20 00 00 00 fc 00 4d '.<..      .....M'
  69 20 4d 6f 6e 69 74 6f 72 0a 20 20 00 00 00 ff 'i Monitor.  ....'
  d0 30 30 30 30 30 30 30 30 30 30 30 30 30 01 ae '.0000000000000..'
Checksum: 0xae

----------------

Block 3, CTA-861 Extension Block:
  Revision: 3
  Underscans IT Video Formats by default
  Basic audio support
  Supports YCbCr 4:4:4
  Supports YCbCr 4:2:2
  Native detailed modes: 1
  Video Data Block:
    VIC   1:   640x480    59.940476 Hz   4:3     31.469 kHz     25.175000 MHz
    VIC   2:   720x480    59.940060 Hz   4:3     31.469 kHz     27.000000 MHz
    VIC   3:   720x480    59.940060 Hz  16:9     31.469 kHz     27.000000 MHz
    VIC   4:  1280x720    60.000000 Hz  16:9     45.000 kHz     74.250000 MHz
    VIC   4:  1280x720    60.000000 Hz  16:9     45.000 kHz     74.250000 MHz
    VIC  16:  1920x1080   60.000000 Hz  16:9     67.500 kHz    148.500000 MHz (native)
    VIC  17:   720x576    50.000000 Hz   4:3     31.250 kHz     27.000000 MHz
    VIC  18:   720x576    50.000000 Hz  16:9     31.250 kHz     27.000000 MHz
    VIC  19:  1280x720    50.000000 Hz  16:9     37.500 kHz     74.250000 MHz
    VIC   4:  1280x720    60.000000 Hz  16:9     45.000 kHz     74.250000 MHz
    VIC  31:  1920x1080   50.000000 Hz  16:9     56.250 kHz    148.500000 MHz
    VIC  63:  1920x1080  120.000000 Hz  16:9    135.000 kHz    297.000000 MHz
  Audio Data Block:
    Linear PCM:
      Max channels: 2
      Supported sample rates (kHz): 48 44.1 32
      Supported sample sizes (bits): 24 20 16
  Speaker Allocation Data Block:
    FL/FR - Front Left/Right
  Vendor-Specific Data Block (HDMI), OUI 00-0C-03:
    Source physical address: 2.0.0.0
    DC_36bit
    DC_30bit
    DC_Y444
    Maximum TMDS clock: 300 MHz
    Extended HDMI video details:
  Vendor-Specific Data Block (HDMI Forum), OUI C4-5D-D8:
    Version: 1
    Maximum TMDS Character Rate: 600 MHz
    SCDC Present
    SCDC Read Request Capable
    Supports 12-bits/component Deep Color 4:2:0 Pixel Encoding
    Supports 10-bits/component Deep Color 4:2:0 Pixel Encoding
  Vendor-Specific Data Block (AMD), OUI 00-00-1A:
    Version: 1
    Feature Caps: 0x01
    Minimum Refresh Rate: 48 Hz
    Maximum Refresh Rate: 121 Hz
    Flags 1.x: 0xed (MCCS)
  Detailed Timing Descriptors:
    DTD 6:  3440x1440   99.992498 Hz  43:18   148.089 kHz    533.120000 MHz (797 mm x 334 mm)
                 Hfront   88 Hsync  64 Hback    8 Hpol P
                 Vfront    4 Vsync   5 Vback   32 Vpol P
    DTD 7:  1720x1440   59.999355 Hz  43:36    89.399 kHz    185.950000 MHz (797 mm x 334 mm)
                 Hfront   48 Hsync  64 Hback  248 Hpol P
                 Vfront    3 Vsync   5 Vback   42 Vpol P
    DTD 8:  3440x1440   59.998875 Hz  43:18    88.858 kHz    319.890000 MHz (797 mm x 334 mm)
                 Hfront   48 Hsync  32 Hback   80 Hpol P
                 Vfront    3 Vsync   5 Vback   33 Vpol N
    DTD 9:  2560x1440   59.950550 Hz  16:9     88.787 kHz    241.500000 MHz (797 mm x 333 mm)
                 Hfront   48 Hsync  32 Hback   80 Hpol P
                 Vfront    3 Vsync   5 Vback   33 Vpol N
Checksum: 0x39  Unused space in Extension Block: 2 bytes

----------------

Warnings:

Block 0, Base EDID:
  Display Product Serial Number: ...
Block 1, CTA-861 Extension Block:
  Video Data Block: VIC 1 and the first DTD are not identical. Is this intended?
  Detailed Timing Descriptor #3: Image size is 797x334 mm, but based on the picture AR it should be 797x667 mm.
  Detailed Timing Descriptor #5: Image size is 797x333 mm, but based on the picture AR it should be 797x448 mm.
  Add a Colorimetry Data Block with the sRGB colorimetry bit set to avoid interop issues.
Block 3, CTA-861 Extension Block:
  Detailed Timing Descriptor #7: Image size is 797x334 mm, but based on the picture AR it should be 797x667 mm.
  Detailed Timing Descriptor #9: Image size is 797x333 mm, but based on the picture AR it should be 797x448 mm.

Failures:

Block 0, Base EDID:
  Display Descriptor #4: Monitor descriptor block has byte 4 nonzero (0xd0).
Block 1, CTA-861 Extension Block:
  Video Data Block: Duplicate VIC 4.
  Missing VCDB, needed for Set Selectable RGB Quantization to avoid interop issues.
Block 2, Base EDID:
  Unknown Extension Block.
Block 3, CTA-861 Extension Block:
  Video Data Block: Duplicate VIC 1.
  Video Data Block: Duplicate VIC 2.
  Video Data Block: Duplicate VIC 3.
  Video Data Block: Duplicate VIC 16.
  Video Data Block: Duplicate VIC 17.
  Video Data Block: Duplicate VIC 18.
  Video Data Block: Duplicate VIC 19.
  Video Data Block: Duplicate VIC 31.
  Video Data Block: Duplicate VIC 63.
  Speaker Allocation Data Block: Only one instance of this Data Block is allowed.
  Vendor-Specific Data Block (HDMI Forum), OUI C4-5D-D8: Duplicate HDMI Forum VSDB/SCDB.
EDID:
  Base EDID: EDID specified 1 extension block(s), but found 3 extension block(s).
  Base EDID: EDID 1.3 requires a Block Map Extension in Block 1 if there are more than 2 blocks in the EDID.
  CTA-861: Native progressive timings are a mix of several resolutions.

EDID conformity: FAIL
