edid-decode (hex):

00 ff ff ff ff ff ff 00 1e 6d f3 76 59 2b 05 00
0c 1a 01 03 68 46 27 78 ea f3 53 a5 54 51 93 26
12 48 49 23 08 00 01 01 81 c0 81 00 81 80 95 00
90 40 a9 c0 b3 00 02 3a 80 18 71 38 2d 40 58 2c
45 00 ba 88 21 00 00 1a 00 00 00 fd 00 38 3f 1e
53 0f 00 0a 20 20 20 20 20 20 00 00 00 fc 00 33
32 69 6e 63 68 20 4c 47 20 46 48 44 00 00 00 ff
00 36 31 32 4e 54 57 47 39 59 37 37 37 0a 00 1c

00 ff ff ff ff ff ff 00 1e 6d f3 76 59 2b 05 00
0c 1a 01 03 68 46 27 78 ea f3 53 a5 54 51 93 26
12 48 49 23 08 00 01 01 81 c0 81 00 81 80 95 00
90 40 a9 c0 b3 00 02 3a 80 18 71 38 2d 40 58 2c
45 00 ba 88 21 00 00 1a 00 00 00 fd 00 38 3f 1e
53 0f 00 0a 20 20 20 20 20 20 00 00 00 fc 00 33
32 69 6e 63 68 20 4c 47 20 46 48 44 00 00 00 ff
00 36 31 32 4e 54 57 47 39 59 37 37 37 0a 00 1c

----------------

Block 0, Base EDID:
  EDID Structure Version & Revision: 1.3
  Vendor & Product Identification:
    Manufacturer: GSM
    Model: 30451
    Serial Number: ...
    Made in: week 12 of 2016
  Basic Display Parameters & Features:
    Analog display
    Signal Level Standard: 0.700 : 0.000 : 0.700 V p-p
    Blank level equals black level
    Sync: Separate
    Maximum image size: 70 cm x 39 cm
    Gamma: 2.20
    DPMS levels: Standby Suspend Off
    RGB color display
    First detailed timing is the preferred timing
  Color Characteristics:
    Red  : 0.6474, 0.3310
    Green: 0.3164, 0.5771
    Blue : 0.1494, 0.0712
    White: 0.2812, 0.2880
  Established Timings I & II:
    DMT 0x04:   640x480    59.940476 Hz   4:3     31.469 kHz     25.175000 MHz
    DMT 0x08:   800x600    56.250000 Hz   4:3     35.156 kHz     36.000000 MHz
    DMT 0x09:   800x600    60.316541 Hz   4:3     37.879 kHz     40.000000 MHz
    DMT 0x10:  1024x768    60.003840 Hz   4:3     48.363 kHz     65.000000 MHz
  Standard Timings:
    DMT 0x55:  1280x720    60.000000 Hz  16:9     45.000 kHz     74.250000 MHz
    DMT 0x1c:  1280x800    59.810326 Hz  16:10    49.702 kHz     83.500000 MHz
    DMT 0x23:  1280x1024   60.019740 Hz   5:4     63.981 kHz    108.000000 MHz
    DMT 0x2f:  1440x900    59.887445 Hz  16:10    55.935 kHz    106.500000 MHz
    DMT 0x2a:  1400x1050   59.978442 Hz   4:3     65.317 kHz    121.750000 MHz
    DMT 0x53:  1600x900    60.000000 Hz  16:9     60.000 kHz    108.000000 MHz (RB)
    DMT 0x3a:  1680x1050   59.954250 Hz  16:10    65.290 kHz    146.250000 MHz
  Detailed Timing Descriptors:
    DTD 1:  1920x1080   60.000000 Hz  16:9     67.500 kHz    148.500000 MHz (698 mm x 392 mm)
                 Hfront   88 Hsync  44 Hback  148 Hpol P
                 Vfront    4 Vsync   5 Vback   36 Vpol N
    Display Range Limits:
      Monitor ranges (GTF): 56-63 Hz V, 30-83 kHz H, max dotclock 150 MHz
    Display Product Name: '32inch LG FHD'
    Display Product Serial Number: ...
Checksum: 0x1c

----------------

Warnings:

Block 0, Base EDID:
  Detailed Timing Descriptor #1: DTD is similar but not identical to VIC 16.

Failures:

EDID:
  Extension Block 1 started with EDID header, ignoring Extension Blocks >= 1.

EDID conformity: FAIL
