edid-decode (hex):

00 ff ff ff ff ff ff 00 09 e5 1a 09 00 00 00 00
17 1f 01 04 a5 26 15 78 02 e2 35 a1 59 56 98 28
18 50 54 00 00 00 01 01 01 01 01 01 01 01 01 01
01 01 01 01 01 01 31 29 40 fa 60 84 32 30 30 20
36 00 7e d7 10 00 00 1a 00 00 00 00 00 00 00 00
00 00 00 00 00 00 00 00 00 00 00 00 00 fe 00 42
4f 45 20 43 51 0a 20 20 20 20 20 20 00 00 00 fe
00 4e 54 31 37 33 57 44 4d 2d 4e 32 34 0a 00 2e

00 ff ff ff ff ff ff 00 09 e5 1a 09 00 00 00 00
17 1f 01 04 a5 26 15 78 02 e2 35 a1 59 56 98 28
18 50 54 00 00 00 01 01 01 01 01 01 01 01 01 01
01 01 01 01 01 01 31 29 40 fa 60 84 32 30 30 20
36 00 7e d7 10 00 00 1a 00 00 00 00 00 00 00 00
00 00 00 00 00 00 00 00 00 00 00 00 00 fe 00 42
4f 45 20 43 51 0a 20 20 20 20 20 20 00 00 00 fe
00 4e 54 31 37 33 57 44 4d 2d 4e 32 34 0a 00 2e

----------------

Block 0, Base EDID:
  EDID Structure Version & Revision: 1.4
  Vendor & Product Identification:
    Manufacturer: BOE
    Model: 2330
    Made in: week 23 of 2021
  Basic Display Parameters & Features:
    Digital display
    Bits per primary color channel: 8
    DisplayPort interface
    Maximum image size: 38 cm x 21 cm
    Gamma: 2.20
    Supported color formats: RGB 4:4:4
    First detailed timing includes the native pixel format and preferred refresh rate
  Color Characteristics:
    Red  : 0.6318, 0.3496
    Green: 0.3359, 0.5957
    Blue : 0.1562, 0.0966
    White: 0.3134, 0.3291
  Established Timings I & II: none
  Standard Timings: none
  Detailed Timing Descriptors:
    DTD 1:  1600x900    60.000000 Hz  16:9     57.000 kHz    105.450000 MHz (382 mm x 215 mm)
                 Hfront   48 Hsync  32 Hback  170 Hpol P
                 Vfront    3 Vsync   6 Vback   41 Vpol N
    Empty Descriptor
    Alphanumeric Data String: 'BOE CQ'
    Alphanumeric Data String: 'NT173WDM-N24'
Checksum: 0x2e

----------------

Warnings:

Block 0, Base EDID:
  Missing Display Product Name.

Failures:

Block 0, Base EDID:
  Empty Descriptor: Use Dummy Descriptor instead of all zeroes.
EDID:
  Extension Block 1 started with EDID header, ignoring Extension Blocks >= 1.

EDID conformity: FAIL
