edid-decode (hex):

00 ff ff ff ff ff ff 00 06 af a6 84 00 00 00 00
17 20 01 04 a5 25 17 78 03 08 b5 ae 52 42 b2 26
0c 50 54 00 00 00 01 01 01 01 01 01 01 01 01 01
01 01 01 01 01 01 8d 68 00 a0 a0 40 28 60 30 20
a5 00 6e e4 10 00 00 18 00 00 00 0f 00 00 00 00
00 00 00 00 00 00 00 00 00 20 00 00 00 fd 0c 3c
f0 8b 8b 6b 01 0a 20 20 20 20 20 20 00 00 00 fe
00 42 31 37 30 51 41 4e 30 31 2e 32 20 0a 01 38

70 13 79 00 00 03 01 14 34 a2 01 84 ff 09 9f 00
2f 00 1f 00 3f 06 27 00 09 00 04 00 00 00 00 00
00 00 00 00 00 00 00 00 00 00 00 00 00 00 00 00
00 00 00 00 00 00 00 00 00 00 00 00 00 00 00 00
00 00 00 00 00 00 00 00 00 00 00 00 00 00 00 00
00 00 00 00 00 00 00 00 00 00 00 00 00 00 00 00
00 00 00 00 00 00 00 00 00 00 00 00 00 00 00 00
00 00 00 00 00 00 00 00 00 00 00 00 00 00 93 90

00 ff ff ff ff ff ff 00 06 af a6 84 00 00 00 00
17 20 01 04 a5 25 17 78 03 08 b5 ae 52 42 b2 26
0c 50 54 00 00 00 01 01 01 01 01 01 01 01 01 01
01 01 01 01 01 01 8d 68 00 a0 a0 40 28 60 30 20
a5 00 6e e4 10 00 00 18 00 00 00 0f 00 00 00 00
00 00 00 00 00 00 00 00 00 20 00 00 00 fd 0c 3c
f0 8b 8b 6b 01 0a 20 20 20 20 20 20 00 00 00 fe
00 42 31 37 30 51 41 4e 30 31 2e 32 20 0a 01 38

70 13 79 00 00 03 01 14 34 a2 01 84 ff 09 9f 00
2f 00 1f 00 3f 06 27 00 09 00 04 00 00 00 00 00
00 00 00 00 00 00 00 00 00 00 00 00 00 00 00 00
00 00 00 00 00 00 00 00 00 00 00 00 00 00 00 00
00 00 00 00 00 00 00 00 00 00 00 00 00 00 00 00
00 00 00 00 00 00 00 00 00 00 00 00 00 00 00 00
00 00 00 00 00 00 00 00 00 00 00 00 00 00 00 00
00 00 00 00 00 00 00 00 00 00 00 00 00 00 93 90

----------------

Block 0, Base EDID:
  EDID Structure Version & Revision: 1.4
  Vendor & Product Identification:
    Manufacturer: AUO
    Model: 33958
    Made in: week 23 of 2022
  Basic Display Parameters & Features:
    Digital display
    Bits per primary color channel: 8
    DisplayPort interface
    Maximum image size: 37 cm x 23 cm
    Gamma: 2.20
    Supported color formats: RGB 4:4:4
    First detailed timing includes the native pixel format and preferred refresh rate
    Display supports continuous frequencies
  Color Characteristics:
    Red  : 0.6796, 0.3203
    Green: 0.2597, 0.6953
    Blue : 0.1503, 0.0498
    White: 0.3134, 0.3291
  Established Timings I & II: none
  Standard Timings: none
  Detailed Timing Descriptors:
    DTD 1:  2560x1600   60.000448 Hz  16:10    98.401 kHz    267.650000 MHz (366 mm x 228 mm)
                 Hfront   48 Hsync  32 Hback   80 Hpol N
                 Vfront   10 Vsync   5 Vback   25 Vpol N
    Manufacturer-Specified Display Descriptor (0x0f): 00 0f 00 00 00 00 00 00 00 00 00 00 00 00 00 20 '............... '
    Display Range Limits:
      Monitor ranges (Range Limits Only): 60-240 Hz V, 394-394 kHz H, max dotclock 1070 MHz
    Alphanumeric Data String: 'B170QAN01.2 '
  Extension blocks: 1
Checksum: 0x38

----------------

Block 1, DisplayID Extension Block:
  Version: 1.3
  Extension Count: 0
  Display Product Type: Extension Section
  Video Timing Modes Type 1 - Detailed Timings Data Block:
    DTD:  2560x1600  240.004035 Hz  16:9    393.607 kHz   1070.610000 MHz (aspect 16:9, no 3D stereo, preferred)
               Hfront   48 Hsync  32 Hback   80 Hpol N
               Vfront   10 Vsync   5 Vback   25 Vpol N
  Checksum: 0x93
Checksum: 0x90

----------------

Block 2, Unknown EDID Extension Block 0x00:
  00 ff ff ff ff ff ff 00 06 af a6 84 00 00 00 00 '................'
  17 20 01 04 a5 25 17 78 03 08 b5 ae 52 42 b2 26 '. ...%.x....RB.&'
  0c 50 54 00 00 00 01 01 01 01 01 01 01 01 01 01 '.PT.............'
  01 01 01 01 01 01 8d 68 00 a0 a0 40 28 60 30 20 '.......h...@(`0 '
  a5 00 6e e4 10 00 00 18 00 00 00 0f 00 00 00 00 '..n.............'
  00 00 00 00 00 00 00 00 00 20 00 00 00 fd 0c 3c '......... .....<'
  f0 8b 8b 6b 01 0a 20 20 20 20 20 20 00 00 00 fe '...k..      ....'
  00 42 31 37 30 51 41 4e 30 31 2e 32 20 0a 01 38 '.B170QAN01.2 ..8'
Checksum: 0x38

----------------

Block 3, DisplayID Extension Block:
  Version: 1.3
  Extension Count: 0
  Video Timing Modes Type 1 - Detailed Timings Data Block:
    DTD:  2560x1600  240.004035 Hz  16:9    393.607 kHz   1070.610000 MHz (aspect 16:9, no 3D stereo, preferred)
               Hfront   48 Hsync  32 Hback   80 Hpol N
               Vfront   10 Vsync   5 Vback   25 Vpol N
  Checksum: 0x93
Checksum: 0x90

----------------

Warnings:

Block 0, Base EDID:
  Missing Display Product Name.
EDID:
  Base EDID: Some timings are out of range of the Monitor Ranges:
    Horizontal Freq: 98.400 - 393.606 kHz (Monitor: 394.000 - 394.000 kHz)
    Maximum Clock: 1070.610 MHz (Monitor: 1070.000 MHz)

Failures:

Block 0, Base EDID:
  Alphanumeric Data String: One or more trailing spaces before newline.
Block 1, DisplayID Extension Block:
  DisplayID Base Block has no product type.
  Expected 0 DisplayID Extension Block, but got 1.
Block 2, Base EDID:
  Unknown Extension Block.
EDID:
  Base EDID: EDID specified 1 extension block(s), but found 3 extension block(s).

EDID conformity: FAIL
