edid-decode (hex):

00 ff ff ff ff ff ff 00 66 64 01 00 01 00 00 00
08 1d 01 03 80 29 17 78 ea b1 a5 a1 58 4f 95 26
16 50 54 ad ce 00 61 4f 61 4a 61 4f 45 4f 45 4c
31 4f 31 40 31 4c 66 21 56 aa 51 00 1f 30 46 8f
33 00 c4 fe 10 00 00 00 00 00 00 fd 00 38 50 1e
50 11 00 0a 20 20 20 20 20 20 86 0b d0 d8 20 90
2e 10 24 48 13 00 c4 fe 10 00 00 00 00 00 00 fc
00 48 44 4d 49 0a 20 20 20 20 20 20 20 20 01 53

02 03 1c f2 47 00 06 16 01 02 07 03 23 09 07 07
83 01 00 00 67 03 0c 00 10 00 38 2d 00 00 00 00
00 00 00 00 00 00 00 00 00 00 00 00 00 00 00 00
00 00 00 00 00 00 00 00 00 00 00 00 00 00 00 00
00 00 00 00 00 00 00 00 00 00 00 00 00 00 00 00
00 00 00 00 00 00 00 00 00 00 00 00 00 00 00 00
00 00 00 00 00 00 00 00 00 00 00 00 00 00 00 00
00 00 00 00 00 00 00 00 00 00 00 00 00 00 00 d4

00 ff ff ff ff ff ff 00 66 64 01 00 01 00 00 00
08 1d 01 03 80 29 17 78 ea b1 a5 a1 58 4f 95 26
16 50 54 ad ce 00 61 4f 61 4a 61 4f 45 4f 45 4c
31 4f 31 40 31 4c 66 21 56 aa 51 00 1f 30 46 8f
33 00 c4 fe 10 00 00 00 00 00 00 fd 00 38 50 1e
50 11 00 0a 20 20 20 20 20 20 86 0b d0 d8 20 90
2e 10 24 48 13 00 c4 fe 10 00 00 00 00 00 00 fc
00 48 44 4d 49 0a 20 20 20 20 20 20 20 20 01 53

02 03 1c f2 47 00 06 16 01 02 07 03 23 09 07 07
83 01 00 00 67 03 0c 00 10 00 38 2d 00 00 00 00
00 00 00 00 00 00 00 00 00 00 00 00 00 00 00 00
00 00 00 00 00 00 00 00 00 00 00 00 00 00 00 00
00 00 00 00 00 00 00 00 00 00 00 00 00 00 00 00
00 00 00 00 00 00 00 00 00 00 00 00 00 00 00 00
00 00 00 00 00 00 00 00 00 00 00 00 00 00 00 00
00 00 00 00 00 00 00 00 00 00 00 00 00 00 00 d4

----------------

Block 0, Base EDID:
  EDID Structure Version & Revision: 1.3
  Vendor & Product Identification:
    Manufacturer: YSD
    Model: 1
    Serial Number: ...
    Made in: week 8 of 2019
  Basic Display Parameters & Features:
    Digital display
    Maximum image size: 41 cm x 23 cm
    Gamma: 2.20
    DPMS levels: Standby Suspend Off
    RGB color display
    First detailed timing is the preferred timing
  Color Characteristics:
    Red  : 0.6308, 0.3466
    Green: 0.3085, 0.5830
    Blue : 0.1503, 0.0878
    White: 0.3134, 0.3291
  Established Timings I & II:
    IBM     :   720x400    70.081663 Hz   9:5     31.467 kHz     28.320000 MHz
    DMT 0x04:   640x480    59.940476 Hz   4:3     31.469 kHz     25.175000 MHz
    DMT 0x05:   640x480    72.808802 Hz   4:3     37.861 kHz     31.500000 MHz
    DMT 0x06:   640x480    75.000000 Hz   4:3     37.500 kHz     31.500000 MHz
    DMT 0x09:   800x600    60.316541 Hz   4:3     37.879 kHz     40.000000 MHz
    DMT 0x0a:   800x600    72.187572 Hz   4:3     48.077 kHz     50.000000 MHz
    DMT 0x0b:   800x600    75.000000 Hz   4:3     46.875 kHz     49.500000 MHz
    DMT 0x10:  1024x768    60.003840 Hz   4:3     48.363 kHz     65.000000 MHz
    DMT 0x11:  1024x768    70.069359 Hz   4:3     56.476 kHz     75.000000 MHz
    DMT 0x12:  1024x768    75.028582 Hz   4:3     60.023 kHz     78.750000 MHz
  Standard Timings:
    DMT 0x12:  1024x768    75.028582 Hz   4:3     60.023 kHz     78.750000 MHz
    DMT 0x11:  1024x768    70.069359 Hz   4:3     56.476 kHz     75.000000 MHz
    DMT 0x12:  1024x768    75.028582 Hz   4:3     60.023 kHz     78.750000 MHz
    DMT 0x0b:   800x600    75.000000 Hz   4:3     46.875 kHz     49.500000 MHz
    DMT 0x0a:   800x600    72.187572 Hz   4:3     48.077 kHz     50.000000 MHz
    DMT 0x06:   640x480    75.000000 Hz   4:3     37.500 kHz     31.500000 MHz
    DMT 0x04:   640x480    59.940476 Hz   4:3     31.469 kHz     25.175000 MHz
    DMT 0x05:   640x480    72.808802 Hz   4:3     37.861 kHz     31.500000 MHz
  Detailed Timing Descriptors:
    DTD 1:  1366x768    59.714710 Hz 683:384   47.712 kHz     85.500000 MHz (analog composite, sync-on-green, 452 mm x 254 mm)
                 Hfront   70 Hsync 143 Hback  213 Hpol N
                 Vfront    3 Vsync   3 Vback   25 Vpol N
    Display Range Limits:
      Monitor ranges (GTF): 56-80 Hz V, 30-80 kHz H, max dotclock 170 MHz
    DTD 2:   720x400    70.666130 Hz   9:5     31.517 kHz     29.500000 MHz (analog composite, sync-on-green, 452 mm x 254 mm)
                 Hfront   36 Hsync  72 Hback  108 Hpol N
                 Vfront    1 Vsync   3 Vback   42 Vpol N
    Display Product Name: 'HDMI'
  Extension blocks: 1
Checksum: 0x53

----------------

Block 1, CTA-861 Extension Block:
  Revision: 3
  Underscans IT Video Formats by default
  Basic audio support
  Supports YCbCr 4:4:4
  Supports YCbCr 4:2:2
  Native DTDs: 2
  Video Data Block:
    VIC   6:  1440x480i   59.940060 Hz   4:3     15.734 kHz     27.000000 MHz
    VIC  22:  1440x576i   50.000000 Hz  16:9     15.625 kHz     27.000000 MHz
    VIC   1:   640x480    59.940476 Hz   4:3     31.469 kHz     25.175000 MHz
    VIC   2:   720x480    59.940060 Hz   4:3     31.469 kHz     27.000000 MHz
    VIC   7:  1440x480i   59.940060 Hz  16:9     15.734 kHz     27.000000 MHz
    VIC   3:   720x480    59.940060 Hz  16:9     31.469 kHz     27.000000 MHz
  Audio Data Block:
    Linear PCM:
      Max channels: 2
      Supported sample rates (kHz): 48 44.1 32
      Supported sample sizes (bits): 24 20 16
  Speaker Allocation Data Block:
    FL/FR - Front Left/Right
  Vendor-Specific Data Block (HDMI), OUI 00-0C-03:
    Source physical address: 1.0.0.0
    DC_36bit
    DC_30bit
    DC_Y444
    Maximum TMDS clock: 225 MHz
Checksum: 0xd4  Unused space in Extension Block: 99 bytes

----------------

Warnings:

Block 0, Base EDID:
  Vendor & Product Identification: The serial number is one of the known dummy values, it should probably be set to 0.
Block 1, CTA-861 Extension Block:
  Video Data Block: VIC 6 and the first DTD are not identical. Is this intended?
  Add a Colorimetry Data Block with the sRGB colorimetry bit set to avoid interop issues.
EDID:
  Base EDID: Some timings are out of range of the Monitor Ranges:
    Vertical Freq: 50.000 - 75.029 Hz (Monitor: 56.000 - 80.000 Hz)
    Horizontal Freq: 15.625 - 60.022 kHz (Monitor: 30.000 - 80.000 kHz)

Failures:

Block 0, Base EDID:
  Detailed Timing Descriptor #1: Mismatch of image size 452x254 mm vs display size 410x230 mm.
  Detailed Timing Descriptor #2: Mismatch of image size 452x254 mm vs display size 410x230 mm.
  Detailed Timing Descriptor #2: Invalid detailed timing descriptor ordering.
Block 1, CTA-861 Extension Block:
  Missing VCDB, needed for Set Selectable RGB Quantization to avoid interop issues.
EDID:
  Extension Block 2 started with EDID header, ignoring Extension Blocks >= 2.
  Base EDID: The DTD max image size is 452x254mm, which is larger than the display size 410.0x230.0mm.
  CTA-861: Native progressive timings are a mix of several resolutions.

EDID conformity: FAIL
