edid-decode (hex):

00 ff ff ff ff ff ff 00 06 af 47 10 00 00 00 00
01 0f 01 03 80 1e 13 78 0a 87 c5 94 57 4f 8c 27
25 50 54 00 00 00 01 01 01 01 01 01 01 01 01 01
01 01 01 01 01 01 38 22 a0 a0 50 84 0c 30 30 20
36 00 30 be 10 00 00 19 00 00 00 00 00 00 00 00
00 00 00 00 00 00 00 00 00 00 00 00 00 fe 00 4b
43 32 33 32 00 42 31 34 31 50 57 31 00 00 00 fe
00 20 30 40 48 70 98 b8 ff 02 01 0a 20 20 00 a5

----------------

Block 0, Base EDID:
  EDID Structure Version & Revision: 1.3
  Vendor & Product Identification:
    Manufacturer: AUO
    Model: 4167
    Made in: week 1 of 2005
  Basic Display Parameters & Features:
    Digital display
    Maximum image size: 30 cm x 19 cm
    Gamma: 2.20
    RGB color display
    First detailed timing is the preferred timing
  Color Characteristics:
    Red  : 0.5800, 0.3398
    Green: 0.3095, 0.5498
    Blue : 0.1552, 0.1445
    White: 0.3134, 0.3291
  Established Timings I & II: none
  Standard Timings: none
  Detailed Timing Descriptors:
    DTD 1:  1440x900    60.032895 Hz  16:10    54.750 kHz     87.600000 MHz (304 mm x 190 mm)
                 Hfront   48 Hsync  32 Hback   80 Hpol N
                 Vfront    3 Vsync   6 Vback    3 Vpol N
    Empty Descriptor
    Alphanumeric Data String: 'KC232'
    Alphanumeric Data String: ' 0@Hp..'
Checksum: 0xa5

----------------

Warnings:

Block 0, Base EDID:
  Alphanumeric Data String: Non-ASCII character 0x98 at position 5, can cause problems.
  Alphanumeric Data String: Non-ASCII character 0xb8 at position 6, can cause problems.

Failures:

Block 0, Base EDID:
  Empty Descriptor: Use Dummy Descriptor instead of all zeroes.
  Alphanumeric Data String: NUL byte at position 5.
  Alphanumeric Data String: 0xff byte at position 7.
  Missing Display Product Name.
  Missing Display Range Limits Descriptor.

EDID conformity: FAIL
