edid-decode (hex):

00 ff ff ff ff ff ff 00 0d ae 20 11 00 00 00 00
1d 15 01 04 90 1a 0e 78 0a 69 65 96 57 52 8f 27
22 50 54 00 00 00 01 01 01 01 01 01 01 01 01 01
01 01 01 01 01 01 58 1b 56 7a 50 00 10 30 25 18
23 00 00 90 10 00 00 1a 3a 12 56 7a 50 00 10 30
25 18 23 00 00 90 10 00 00 1a 00 00 00 00 00 00
00 00 00 00 00 00 00 00 00 00 00 00 00 00 00 02
00 0c 4c ff 08 3c 64 10 0d 15 64 00 00 00 00 c6

00 ff ff ff ff ff ff 00 0d ae 20 11 00 00 00 00
1d 15 01 04 90 1a 0e 78 0a 69 65 96 57 52 8f 27
22 50 54 00 00 00 01 01 01 01 01 01 01 01 01 01
01 01 01 01 01 01 58 1b 56 7a 50 00 10 30 25 18
23 00 00 90 10 00 00 1a 3a 12 56 7a 50 00 10 30
25 18 23 00 00 90 10 00 00 1a 00 00 00 00 00 00
00 00 00 00 00 00 00 00 00 00 00 00 00 00 00 02
00 0c 4c ff 08 3c 64 10 0d 15 64 00 00 00 00 c6

----------------

Block 0, Base EDID:
  EDID Structure Version & Revision: 1.4
  Vendor & Product Identification:
    Manufacturer: CMN
    Model: 4384
    Made in: week 29 of 2011
  Basic Display Parameters & Features:
    Digital display
    Bits per primary color channel: 6
    Digital interface is not defined
    Maximum image size: 26 cm x 14 cm
    Gamma: 2.20
    Supported color formats: RGB 4:4:4, YCrCb 4:4:4
    First detailed timing includes the native pixel format and preferred refresh rate
  Color Characteristics:
    Red  : 0.5869, 0.3417
    Green: 0.3222, 0.5595
    Blue : 0.1533, 0.1347
    White: 0.3134, 0.3291
  Established Timings I & II: none
  Standard Timings: none
  Detailed Timing Descriptors:
    DTD 1:  1366x768    60.003840 Hz 683:384   47.043 kHz     70.000000 MHz (256 mm x 144 mm)
                 Hfront   37 Hsync  24 Hback   61 Hpol P
                 Vfront    2 Vsync   3 Vback   11 Vpol N
    DTD 2:  1366x768    39.996846 Hz 683:384   31.358 kHz     46.660000 MHz (256 mm x 144 mm)
                 Hfront   37 Hsync  24 Hback   61 Hpol P
                 Vfront    2 Vsync   3 Vback   11 Vpol N
    Empty Descriptor
    Manufacturer-Specified Display Descriptor (0x02): 00 02 00 0c 4c ff 08 3c 64 10 0d 15 64 00 00 00 '....L..<d...d...'
Checksum: 0xc6

----------------

Warnings:

Block 0, Base EDID:
  Missing Display Product Name.

Failures:

Block 0, Base EDID:
  Empty Descriptor: Use Dummy Descriptor instead of all zeroes.
EDID:
  Extension Block 1 started with EDID header, ignoring Extension Blocks >= 1.

EDID conformity: FAIL
