edid-decode (hex):

00 ff ff ff ff ff ff 00 4c 2d 13 73 00 06 00 00
08 20 01 03 80 5f 36 78 2a d4 15 ae 4f 42 b0 26
0b 50 54 21 88 00 81 00 81 c0 81 80 a9 c0 b3 00
95 00 01 01 01 01 b8 ce 00 50 f0 70 5a 80 18 10
8a 00 ba 88 21 00 00 1e 00 00 00 fd 00 1e 90 1e
ff 8f 00 0a 20 20 20 20 20 20 00 00 00 fc 00 4f
64 79 73 73 65 79 20 47 37 30 4e 43 00 00 00 ff
00 48 31 41 4b 35 30 30 30 30 30 0a 20 20 01 2d

02 03 62 f0 e2 78 03 47 61 10 3f 04 03 5f 76 2f
0d 57 07 15 07 50 57 07 00 67 54 00 09 07 07 83
0f 00 00 e2 00 4f e3 05 c3 01 6b 03 0c 00 20 00
b8 44 28 00 20 01 6d d8 5d c4 01 78 80 6b 02 30
90 c3 64 0b 6d 1a 00 00 02 0f 30 90 00 04 73 03
60 0f e6 06 05 01 73 61 00 e2 0f 41 e5 01 8b 84
90 59 56 5e 00 a0 a0 a0 29 50 30 20 35 00 ad 11
32 00 00 1a 00 00 00 00 00 00 00 00 00 00 00 84

02 03 04 f0 6f c2 00 a0 a0 a0 55 50 30 20 35 00
ad 11 32 00 00 1a 02 3a 80 18 71 38 2d 40 58 2c
45 00 ad 11 32 00 00 1e 04 74 80 18 71 38 2d 40
58 2c 45 00 ad 11 32 00 00 1e 5a 87 80 a0 70 38
4d 40 30 20 35 00 ad 11 32 00 00 1a 00 00 00 00
00 00 00 00 00 00 00 00 00 00 00 00 00 00 00 00
00 00 00 00 00 00 00 00 00 00 00 00 00 00 00 00
00 00 00 00 00 00 00 00 00 00 00 00 00 00 00 3f

70 12 79 03 00 03 01 50 0f d0 01 84 ff 0e 2f 02
af 80 57 00 6f 08 59 00 07 80 09 00 d5 2c 02 04
ff 0e 2f 02 f7 80 1f 00 6f 08 59 00 02 00 04 00
07 e8 00 04 ff 0e 2f 02 af 80 57 00 6f 08 59 00
07 80 09 00 08 ec 00 04 ff 09 9f 00 2f 80 1f 00
9f 05 66 00 02 00 04 00 00 00 00 00 00 00 00 00
00 00 00 00 00 00 00 00 00 00 00 00 00 00 00 00
00 00 00 00 00 00 00 00 00 00 00 00 00 00 51 90

00 ff ff ff ff ff ff 00 4c 2d 13 73 00 06 00 00
08 20 01 03 80 5f 36 78 2a d4 15 ae 4f 42 b0 26
0b 50 54 21 88 00 81 00 81 c0 81 80 a9 c0 b3 00
95 00 01 01 01 01 b8 ce 00 50 f0 70 5a 80 18 10
8a 00 ba 88 21 00 00 1e 00 00 00 fd 00 1e 90 1e
ff 8f 00 0a 20 20 20 20 20 20 00 00 00 fc 00 4f
64 79 73 73 65 79 20 47 37 30 4e 43 00 00 00 ff
00 48 31 41 4b 35 30 30 30 30 30 0a 20 20 01 2d

02 03 62 f0 e2 78 03 47 61 10 3f 04 03 5f 76 2f
0d 57 07 15 07 50 57 07 00 67 54 00 09 07 07 83
0f 00 00 e2 00 4f e3 05 c3 01 6b 03 0c 00 20 00
b8 44 28 00 20 01 6d d8 5d c4 01 78 80 6b 02 30
90 c3 64 0b 6d 1a 00 00 02 0f 30 90 00 04 73 03
60 0f e6 06 05 01 73 61 00 e2 0f 41 e5 01 8b 84
90 59 56 5e 00 a0 a0 a0 29 50 30 20 35 00 ad 11
32 00 00 1a 00 00 00 00 00 00 00 00 00 00 00 84

02 03 04 f0 6f c2 00 a0 a0 a0 55 50 30 20 35 00
ad 11 32 00 00 1a 02 3a 80 18 71 38 2d 40 58 2c
45 00 ad 11 32 00 00 1e 04 74 80 18 71 38 2d 40
58 2c 45 00 ad 11 32 00 00 1e 5a 87 80 a0 70 38
4d 40 30 20 35 00 ad 11 32 00 00 1a 00 00 00 00
00 00 00 00 00 00 00 00 00 00 00 00 00 00 00 00
00 00 00 00 00 00 00 00 00 00 00 00 00 00 00 00
00 00 00 00 00 00 00 00 00 00 00 00 00 00 00 3f

70 12 79 03 00 03 01 50 0f d0 01 84 ff 0e 2f 02
af 80 57 00 6f 08 59 00 07 80 09 00 d5 2c 02 04
ff 0e 2f 02 f7 80 1f 00 6f 08 59 00 02 00 04 00
07 e8 00 04 ff 0e 2f 02 af 80 57 00 6f 08 59 00
07 80 09 00 08 ec 00 04 ff 09 9f 00 2f 80 1f 00
9f 05 66 00 02 00 04 00 00 00 00 00 00 00 00 00
00 00 00 00 00 00 00 00 00 00 00 00 00 00 00 00
00 00 00 00 00 00 00 00 00 00 00 00 00 00 51 90

----------------

Block 0, Base EDID:
  EDID Structure Version & Revision: 1.3
  Vendor & Product Identification:
    Manufacturer: SAM
    Model: 29459
    Serial Number: ...
    Made in: week 8 of 2022
  Basic Display Parameters & Features:
    Digital display
    Maximum image size: 95 cm x 54 cm
    Gamma: 2.20
    DPMS levels: Off
    RGB color display
    First detailed timing is the preferred timing
  Color Characteristics:
    Red  : 0.6826, 0.3095
    Green: 0.2587, 0.6875
    Blue : 0.1484, 0.0439
    White: 0.3134, 0.3291
  Established Timings I & II:
    DMT 0x04:   640x480    59.940476 Hz   4:3     31.469 kHz     25.175000 MHz
    DMT 0x09:   800x600    60.316541 Hz   4:3     37.879 kHz     40.000000 MHz
    DMT 0x0a:   800x600    72.187572 Hz   4:3     48.077 kHz     50.000000 MHz
    DMT 0x10:  1024x768    60.003840 Hz   4:3     48.363 kHz     65.000000 MHz
  Standard Timings:
    DMT 0x1c:  1280x800    59.810326 Hz  16:10    49.702 kHz     83.500000 MHz
    DMT 0x55:  1280x720    60.000000 Hz  16:9     45.000 kHz     74.250000 MHz
    DMT 0x23:  1280x1024   60.019740 Hz   5:4     63.981 kHz    108.000000 MHz
    DMT 0x53:  1600x900    60.000000 Hz  16:9     60.000 kHz    108.000000 MHz (RB)
    DMT 0x3a:  1680x1050   59.954250 Hz  16:10    65.290 kHz    146.250000 MHz
    DMT 0x2f:  1440x900    59.887445 Hz  16:10    55.935 kHz    106.500000 MHz
  Detailed Timing Descriptors:
    DTD 1:  3840x2160   60.000000 Hz  16:9    135.000 kHz    529.200000 MHz (698 mm x 392 mm)
                 Hfront   24 Hsync  16 Hback   40 Hpol P
                 Vfront    8 Vsync  10 Vback   72 Vpol P
    Display Range Limits:
      Monitor ranges (GTF): 30-144 Hz V, 30-255 kHz H, max dotclock 1430 MHz
    Display Product Name: 'Odyssey G70NC'
    Display Product Serial Number: ...
  Extension blocks: 1
Checksum: 0x2d

----------------

Block 1, CTA-861 Extension Block:
  Revision: 3
  Underscans IT Video Formats by default
  Basic audio support
  Supports YCbCr 4:4:4
  Supports YCbCr 4:2:2
  Native DTDs: 0
  HDMI Forum EDID Extension Override Data Block:
    EDID Extension Block Count: 3
  Video Data Block:
    VIC  97:  3840x2160   60.000000 Hz  16:9    135.000 kHz    594.000000 MHz
    VIC  16:  1920x1080   60.000000 Hz  16:9     67.500 kHz    148.500000 MHz
    VIC  63:  1920x1080  120.000000 Hz  16:9    135.000 kHz    297.000000 MHz
    VIC   4:  1280x720    60.000000 Hz  16:9     45.000 kHz     74.250000 MHz
    VIC   3:   720x480    59.940060 Hz  16:9     31.469 kHz     27.000000 MHz
    VIC  95:  3840x2160   30.000000 Hz  16:9     67.500 kHz    297.000000 MHz
    VIC 118:  3840x2160  120.000000 Hz  16:9    270.000 kHz   1188.000000 MHz
  Audio Data Block:
    Linear PCM:
      Max channels: 6
      Supported sample rates (kHz): 192 96 48 44.1 32
      Supported sample sizes (bits): 24 20 16
    AC-3:
      Max channels: 6
      Supported sample rates (kHz): 48 44.1 32
      Maximum bit rate: 640 kb/s
    Enhanced AC-3 (DD+):
      Max channels: 8
      Supported sample rates (kHz): 48 44.1 32
    MAT (MLP):
      Max channels: 8
      Supported sample rates (kHz): 192 96 48
      Supports only Dolby TrueHD
    Linear PCM:
      Max channels: 2
      Supported sample rates (kHz): 48 44.1 32
      Supported sample sizes (bits): 24 20 16
  Speaker Allocation Data Block:
    FL/FR - Front Left/Right
    LFE1 - Low Frequency Effects 1
    FC - Front Center
    LS/RS - Left/Right Surround
  Video Capability Data Block:
    YCbCr quantization: No Data
    RGB quantization: Selectable (via AVI Q)
    PT scan behavior: No Data
    IT scan behavior: Supports both over- and underscan
    CE scan behavior: Supports both over- and underscan
  Colorimetry Data Block:
    xvYCC601
    xvYCC709
    BT2020YCC
    BT2020RGB
    Gamut Boundary Description Metadata Profile P0
  Vendor-Specific Data Block (HDMI), OUI 00-0C-03:
    Source physical address: 2.0.0.0
    Supports_AI
    DC_36bit
    DC_30bit
    DC_Y444
    Maximum TMDS clock: 340 MHz
    Supported Content Types:
      Game
    Extended HDMI video details:
      HDMI VICs:
        HDMI VIC 1:  3840x2160   30.000000 Hz  16:9     67.500 kHz    297.000000 MHz
  Vendor-Specific Data Block (HDMI Forum), OUI C4-5D-D8:
    Version: 1
    Maximum TMDS Character Rate: 600 MHz
    SCDC Present
    Max Fixed Rate Link: 3 and 6 Gbps per lane on 3 lanes, 6, 8, 10 and 12 Gbps on 4 lanes
    Supports UHD VIC
    Supports 12-bits/component Deep Color 4:2:0 Pixel Encoding
    Supports 10-bits/component Deep Color 4:2:0 Pixel Encoding
    Supports Auto Low-Latency Mode
    VRRmin: 48 Hz
    VRRmax: 144 Hz
    Supports VESA DSC 1.2a compression
    Supports Compressed Video Transport for 4:2:0 Pixel Encoding
    Supports 12 bpc Compressed Video Transport
    Supports 10 bpc Compressed Video Transport
    DSC Max Slices: up to 8 slices and up to (340 MHz/Ksliceadjust) pixel clock per slice
    DSC Max Fixed Rate Link: 3 and 6 Gbps per lane on 3 lanes, 6, 8, 10 and 12 Gbps on 4 lanes
    Maximum number of bytes in a line of chunks: 12288
  Vendor-Specific Data Block (AMD), OUI 00-00-1A:
    Version: 2
    Flags 1: 0x0f
      FreeSync Supported
      FreeSync 2 HDR Supported
      Global Backlight Control Supported
      Local Dimming Supported
    Minimum Refresh Rate: 48 Hz
    Maximum Refresh Rate: 144 Hz
    Flags 5: 0x04
      Gamma 2.2 EOTF Supported
    Maximum luminance: 115 (603.666 cd/m^2)
    Minimum luminance: 3 (0.001 cd/m^2)
    Maximum luminance (without local dimming): 96 (400.000 cd/m^2)
    Minimum luminance (without local dimming): 15 (0.014 cd/m^2)
  HDR Static Metadata Data Block:
    Electro optical transfer functions:
      Traditional gamma - SDR luminance range
      SMPTE ST2084
    Supported static metadata descriptors:
      Static metadata type 1
    Desired content max luminance: 115 (603.666 cd/m^2)
    Desired content max frame-average luminance: 97 (408.759 cd/m^2)
    Desired content min luminance: 0 (0.000 cd/m^2)
  YCbCr 4:2:0 Capability Map Data Block:
    VIC  97:  3840x2160   60.000000 Hz  16:9    135.000 kHz    594.000000 MHz
    VIC 118:  3840x2160  120.000000 Hz  16:9    270.000 kHz   1188.000000 MHz
  Vendor-Specific Video Data Block (HDR10+), OUI 90-84-8B:
    Application Version: 1
    Full Frame Peak Luminance Index: 2
    Peak Luminance Index: 5
  Detailed Timing Descriptors:
    DTD 2:  2560x1440   59.950550 Hz  16:9     88.787 kHz    241.500000 MHz (941 mm x 529 mm)
                 Hfront   48 Hsync  32 Hback   80 Hpol P
                 Vfront    3 Vsync   5 Vback   33 Vpol N
Checksum: 0x84  Unused space in Extension Block: 11 bytes

----------------

Block 2, CTA-861 Extension Block:
  Revision: 3
  Underscans IT Video Formats by default
  Basic audio support
  Supports YCbCr 4:4:4
  Supports YCbCr 4:2:2
  Native DTDs: 0
  Detailed Timing Descriptors:
    DTD 3:  2560x1440  119.997589 Hz  16:9    182.996 kHz    497.750000 MHz (941 mm x 529 mm)
                 Hfront   48 Hsync  32 Hback   80 Hpol P
                 Vfront    3 Vsync   5 Vback   77 Vpol N
    DTD 4:  1920x1080   60.000000 Hz  16:9     67.500 kHz    148.500000 MHz (941 mm x 529 mm)
                 Hfront   88 Hsync  44 Hback  148 Hpol P
                 Vfront    4 Vsync   5 Vback   36 Vpol P
    DTD 5:  1920x1080  120.000000 Hz  16:9    135.000 kHz    297.000000 MHz (941 mm x 529 mm)
                 Hfront   88 Hsync  44 Hback  148 Hpol P
                 Vfront    4 Vsync   5 Vback   36 Vpol P
    DTD 6:  1920x1080  143.981451 Hz  16:9    166.587 kHz    346.500000 MHz (941 mm x 529 mm)
                 Hfront   48 Hsync  32 Hback   80 Hpol P
                 Vfront    3 Vsync   5 Vback   69 Vpol N
Checksum: 0x3f  Unused space in Extension Block: 51 bytes

----------------

Block 3, DisplayID Extension Block:
  Version: 1.2
  Extension Count: 0
  Display Product Type: Standalone display device
  Video Timing Modes Type 1 - Detailed Timings Data Block:
    DTD:  3840x2160  120.000000 Hz  16:9    270.000 kHz   1188.000000 MHz (aspect 16:9, no 3D stereo, preferred)
               Hfront  176 Hsync  88 Hback  296 Hpol P
               Vfront    8 Vsync  10 Vback   72 Vpol P
    DTD:  3840x2160  143.989899 Hz  16:9    323.977 kHz   1425.500000 MHz (aspect 16:9, no 3D stereo)
               Hfront  248 Hsync  32 Hback  280 Hpol P
               Vfront    3 Vsync   5 Vback   82 Vpol N
    DTD:  3840x2160   60.000000 Hz  16:9    135.000 kHz    594.000000 MHz (aspect 16:9, no 3D stereo)
               Hfront  176 Hsync  88 Hback  296 Hpol P
               Vfront    8 Vsync  10 Vback   72 Vpol P
    DTD:  2560x1440  143.973257 Hz  16:9    222.151 kHz    604.250000 MHz (aspect 16:9, no 3D stereo)
               Hfront   48 Hsync  32 Hback   80 Hpol P
               Vfront    3 Vsync   5 Vback   95 Vpol N
  Checksum: 0x51
Checksum: 0x90

----------------

Warnings:

Block 0, Base EDID:
  Display Product Serial Number: ...
Block 1, CTA-861 Extension Block:
  Video Data Block: VIC 97 and the first DTD are not identical. Is this intended?
  Video Capability Data Block: Set Selectable YCbCr Quantization to avoid interop issues.
  Colorimetry Data Block: Set the sRGB colorimetry bit to avoid interop issues.
  Display Product Serial Number is set, so the Serial Number in the Base EDID should be 0.

Failures:

Block 0, Base EDID:
  Detailed Timing Descriptor #1: Mismatch of image size 698x392 mm vs display size 950x540 mm.
EDID:
  Extension Block 4 started with EDID header, ignoring Extension Blocks >= 4.
  DisplayID: Missing DisplayID Display Parameters Data Block.

EDID conformity: FAIL
