edid-decode (hex):

00 ff ff ff ff ff ff 00 22 64 ef 66 10 09 00 00
2f 14 01 03 68 37 22 78 2a 82 10 a4 56 4f 9d 24
12 50 54 bf ee 80 31 0a 71 4f 81 c0 95 00 95 0f
a9 c0 01 01 01 01 30 2a 40 c8 60 84 64 30 18 50
13 00 ba f9 10 00 00 1e 00 00 00 ff 00 30 34 37
53 46 33 41 59 30 32 33 32 30 00 00 00 fd 00 32
4b 1e 55 11 00 0a 20 20 20 20 20 20 00 00 00 fc
00 48 5a 32 30 31 44 0a 20 20 20 20 20 20 00 d3

00 ff ff ff ff ff ff 00 22 64 ef 66 10 09 00 00
2f 14 01 03 68 37 22 78 2a 82 10 a4 56 4f 9d 24
12 50 54 bf ee 80 31 0a 71 4f 81 c0 95 00 95 0f
a9 c0 01 01 01 01 30 2a 40 c8 60 84 64 30 18 50
13 00 ba f9 10 00 00 1e 00 00 00 ff 00 30 34 37
53 46 33 41 59 30 32 33 32 30 00 00 00 fd 00 32
4b 1e 55 11 00 0a 20 20 20 20 20 20 00 00 00 fc
00 48 5a 32 30 31 44 0a 20 20 20 20 20 20 00 d3

----------------

Block 0, Base EDID:
  EDID Structure Version & Revision: 1.3
  Vendor & Product Identification:
    Manufacturer: HSD
    Model: 26351
    Serial Number: ...
    Made in: week 47 of 2010
  Basic Display Parameters & Features:
    Analog display
    Signal Level Standard: 0.700 : 0.000 : 0.700 V p-p
    Blank level equals black level
    Sync: Separate
    Maximum image size: 55 cm x 34 cm
    Gamma: 2.20
    DPMS levels: Off
    RGB color display
    First detailed timing is the preferred timing
  Color Characteristics:
    Red  : 0.6425, 0.3359
    Green: 0.3085, 0.6152
    Blue : 0.1406, 0.0712
    White: 0.3125, 0.3281
  Established Timings I & II:
    IBM     :   720x400    70.081663 Hz   9:5     31.467 kHz     28.320000 MHz
    DMT 0x04:   640x480    59.940476 Hz   4:3     31.469 kHz     25.175000 MHz
    Apple   :   640x480    66.666667 Hz   4:3     35.000 kHz     30.240000 MHz
    DMT 0x05:   640x480    72.808802 Hz   4:3     37.861 kHz     31.500000 MHz
    DMT 0x06:   640x480    75.000000 Hz   4:3     37.500 kHz     31.500000 MHz
    DMT 0x08:   800x600    56.250000 Hz   4:3     35.156 kHz     36.000000 MHz
    DMT 0x09:   800x600    60.316541 Hz   4:3     37.879 kHz     40.000000 MHz
    DMT 0x0a:   800x600    72.187572 Hz   4:3     48.077 kHz     50.000000 MHz
    DMT 0x0b:   800x600    75.000000 Hz   4:3     46.875 kHz     49.500000 MHz
    Apple   :   832x624    74.551266 Hz   4:3     49.726 kHz     57.284000 MHz
    DMT 0x10:  1024x768    60.003840 Hz   4:3     48.363 kHz     65.000000 MHz
    DMT 0x11:  1024x768    70.069359 Hz   4:3     56.476 kHz     75.000000 MHz
    DMT 0x12:  1024x768    75.028582 Hz   4:3     60.023 kHz     78.750000 MHz
    Apple   :  1152x870    75.061550 Hz 192:145   68.681 kHz    100.000000 MHz
  Standard Timings:
    GTF     :   640x400    70.000000 Hz  16:10    29.190 kHz     23.352000 MHz
    DMT 0x15:  1152x864    75.000000 Hz   4:3     67.500 kHz    108.000000 MHz
    DMT 0x55:  1280x720    60.000000 Hz  16:9     45.000 kHz     74.250000 MHz
    DMT 0x2f:  1440x900    59.887445 Hz  16:10    55.935 kHz    106.500000 MHz
    DMT 0x30:  1440x900    74.984427 Hz  16:10    70.635 kHz    136.750000 MHz
    DMT 0x53:  1600x900    60.000000 Hz  16:9     60.000 kHz    108.000000 MHz (RB)
  Detailed Timing Descriptors:
    DTD 1:  1600x900    60.000000 Hz  16:9     60.000 kHz    108.000000 MHz (442 mm x 249 mm)
                 Hfront   24 Hsync  80 Hback   96 Hpol P
                 Vfront    1 Vsync   3 Vback   96 Vpol P
    Display Product Serial Number: ...
    Display Range Limits:
      Monitor ranges (GTF): 50-75 Hz V, 30-85 kHz H, max dotclock 170 MHz
    Display Product Name: 'HZ201D'
Checksum: 0xd3

----------------

Warnings:

EDID:
  Base EDID: Some timings are out of range of the Monitor Ranges:
    Horizontal Freq: 29.190 - 70.635 kHz (Monitor: 30.000 - 85.000 kHz)
    Could be due to a Monitor Range off-by-one rounding issue

Failures:

Block 0, Base EDID:
  Detailed Timing Descriptor #1: Mismatch of image size 442x249 mm vs display size 550x340 mm.
EDID:
  Extension Block 1 started with EDID header, ignoring Extension Blocks >= 1.

EDID conformity: FAIL
