edid-decode (hex):

00 ff ff ff ff ff ff 00 4c a3 58 42 00 00 00 00
00 0d 01 03 80 1d 15 78 0a 43 de 98 57 52 8c 27
21 50 54 00 00 00 01 01 01 01 01 01 01 01 01 01
01 01 01 01 01 01 64 19 00 40 41 00 26 30 18 88
36 00 1e d6 10 00 00 19 00 00 00 0f 00 00 00 00
00 00 00 00 00 03 16 0e 32 00 00 00 00 fe 00 36
4a 35 36 34 34 31 34 31 58 42 0a 20 00 00 00 fe
00 e0 d0 c0 b6 9b 7d 50 00 01 00 0a 20 20 00 1d

----------------

Block 0, Base EDID:
  EDID Structure Version & Revision: 1.3
  Vendor & Product Identification:
    Manufacturer: SEC
    Model: 16984
    Made in: 2003
  Basic Display Parameters & Features:
    Digital display
    Maximum image size: 29 cm x 21 cm
    Gamma: 2.20
    RGB color display
    First detailed timing is the preferred timing
  Color Characteristics:
    Red  : 0.5947, 0.3398
    Green: 0.3203, 0.5498
    Blue : 0.1552, 0.1298
    White: 0.3154, 0.3300
  Established Timings I & II: none
  Standard Timings: none
  Detailed Timing Descriptors:
    DTD 1:  1024x768    60.003840 Hz   4:3     48.363 kHz     65.000000 MHz (286 mm x 214 mm)
                 Hfront   24 Hsync 136 Hback  160 Hpol N
                 Vfront    3 Vsync   6 Vback   29 Vpol N
    Manufacturer-Specified Display Descriptor (0x0f): 00 0f 00 00 00 00 00 00 00 00 00 03 16 0e 32 00 '..............2.'
    Alphanumeric Data String: '6J5644141XB'
    Alphanumeric Data String: '.....}P'
Checksum: 0x1d

----------------

Warnings:

Block 0, Base EDID:
  Alphanumeric Data String: Non-ASCII character 0xe0 at position 0, can cause problems.
  Alphanumeric Data String: Non-ASCII character 0xd0 at position 1, can cause problems.
  Alphanumeric Data String: Non-ASCII character 0xc0 at position 2, can cause problems.
  Alphanumeric Data String: Non-ASCII character 0xb6 at position 3, can cause problems.
  Alphanumeric Data String: Non-ASCII character 0x9b at position 4, can cause problems.

Failures:

Block 0, Base EDID:
  Alphanumeric Data String: NUL byte at position 7.
  Missing Display Product Name.
  Missing Display Range Limits Descriptor.

EDID conformity: FAIL
