edid-decode (hex):

00 ff ff ff ff ff ff 00 30 ae e0 66 5a 43 30 44
1d 20 01 03 80 35 1e 78 2e 87 c5 a8 55 4f 9e 25
12 50 54 ad ef 00 71 4f 81 80 81 8a 95 00 a9 c0
a9 cf b3 00 d1 cf 28 9e 00 a0 a0 a0 32 50 20 40
48 08 0f 28 21 00 00 1a 00 00 00 ff 00 55 35 36
33 44 30 43 5a 0a 20 20 20 20 00 00 00 fd 00 30
64 1e b9 32 00 0a 20 20 20 20 20 20 00 00 00 fc
00 47 32 34 71 65 2d 32 30 0a 20 20 20 20 01 01

02 03 30 f1 4a 01 02 03 04 90 11 12 13 1f 4c 23
09 07 07 83 01 00 00 67 03 0c 00 10 00 00 3c 67
d8 5d c4 01 78 80 00 68 1a 00 00 01 01 30 64 e6
02 3a 80 18 71 38 2d 40 58 2c 45 00 0f 28 21 00
00 1e 56 5e 00 a0 a0 a0 29 50 30 20 35 00 0f 28
21 00 00 1e 96 5c 80 c8 70 38 26 40 80 20 08 04
0f 28 21 00 00 1a 00 00 00 00 00 00 00 00 00 00
00 00 00 00 00 00 00 00 00 00 00 00 00 00 00 e7

00 ff ff ff ff ff ff 00 30 ae e0 66 5a 43 30 44
1d 20 01 03 80 35 1e 78 2e 87 c5 a8 55 4f 9e 25
12 50 54 ad ef 00 71 4f 81 80 81 8a 95 00 a9 c0
a9 cf b3 00 d1 cf 28 9e 00 a0 a0 a0 32 50 20 40
48 08 0f 28 21 00 00 1a 00 00 00 ff 00 55 35 36
33 44 30 43 5a 0a 20 20 20 20 00 00 00 fd 00 30
64 1e b9 32 00 0a 20 20 20 20 20 20 00 00 00 fc
00 47 32 34 71 65 2d 32 30 0a 20 20 20 20 01 01

02 03 30 f1 4a 01 02 03 04 90 11 12 13 1f 4c 23
09 07 07 83 01 00 00 67 03 0c 00 10 00 00 3c 67
d8 5d c4 01 78 80 00 68 1a 00 00 01 01 30 64 e6
02 3a 80 18 71 38 2d 40 58 2c 45 00 0f 28 21 00
00 1e 56 5e 00 a0 a0 a0 29 50 30 20 35 00 0f 28
21 00 00 1e 96 5c 80 c8 70 38 26 40 80 20 08 04
0f 28 21 00 00 1a 00 00 00 00 00 00 00 00 00 00
00 00 00 00 00 00 00 00 00 00 00 00 00 00 00 e7

----------------

Block 0, Base EDID:
  EDID Structure Version & Revision: 1.3
  Vendor & Product Identification:
    Manufacturer: LEN
    Model: 26336
    Serial Number: ...
    Made in: week 29 of 2022
  Basic Display Parameters & Features:
    Digital display
    Maximum image size: 53 cm x 30 cm
    Gamma: 2.20
    DPMS levels: Off
    RGB color display
    Default (sRGB) color space is primary color space
    First detailed timing is the preferred timing
  Color Characteristics:
    Red  : 0.6582, 0.3320
    Green: 0.3095, 0.6201
    Blue : 0.1474, 0.0703
    White: 0.3134, 0.3291
  Established Timings I & II:
    IBM     :   720x400    70.081663 Hz   9:5     31.467 kHz     28.320000 MHz
    DMT 0x04:   640x480    59.940476 Hz   4:3     31.469 kHz     25.175000 MHz
    DMT 0x05:   640x480    72.808802 Hz   4:3     37.861 kHz     31.500000 MHz
    DMT 0x06:   640x480    75.000000 Hz   4:3     37.500 kHz     31.500000 MHz
    DMT 0x09:   800x600    60.316541 Hz   4:3     37.879 kHz     40.000000 MHz
    DMT 0x0a:   800x600    72.187572 Hz   4:3     48.077 kHz     50.000000 MHz
    DMT 0x0b:   800x600    75.000000 Hz   4:3     46.875 kHz     49.500000 MHz
    Apple   :   832x624    74.551266 Hz   4:3     49.726 kHz     57.284000 MHz
    DMT 0x10:  1024x768    60.003840 Hz   4:3     48.363 kHz     65.000000 MHz
    DMT 0x11:  1024x768    70.069359 Hz   4:3     56.476 kHz     75.000000 MHz
    DMT 0x12:  1024x768    75.028582 Hz   4:3     60.023 kHz     78.750000 MHz
    DMT 0x24:  1280x1024   75.024675 Hz   5:4     79.976 kHz    135.000000 MHz
  Standard Timings:
    DMT 0x15:  1152x864    75.000000 Hz   4:3     67.500 kHz    108.000000 MHz
    DMT 0x23:  1280x1024   60.019740 Hz   5:4     63.981 kHz    108.000000 MHz
    GTF     :  1280x1024   69.999805 Hz   5:4     74.620 kHz    128.943000 MHz
    DMT 0x2f:  1440x900    59.887445 Hz  16:10    55.935 kHz    106.500000 MHz
    DMT 0x53:  1600x900    60.000000 Hz  16:9     60.000 kHz    108.000000 MHz (RB)
    GTF     :  1600x900    75.000000 Hz  16:9     70.500 kHz    152.280000 MHz
    DMT 0x3a:  1680x1050   59.954250 Hz  16:10    65.290 kHz    146.250000 MHz
    GTF     :  1920x1080   75.000068 Hz  16:9     84.600 kHz    220.637000 MHz
  Detailed Timing Descriptors:
    DTD 1:  2560x1440   99.901303 Hz  16:9    148.853 kHz    404.880000 MHz (527 mm x 296 mm)
                 Hfront   32 Hsync  64 Hback   64 Hpol P
                 Vfront   36 Vsync   8 Vback    6 Vpol N
    Display Product Serial Number: ...
    Display Range Limits:
      Monitor ranges (GTF): 48-100 Hz V, 30-185 kHz H, max dotclock 500 MHz
    Display Product Name: 'G24qe-20'
  Extension blocks: 1
Checksum: 0x01

----------------

Block 1, CTA-861 Extension Block:
  Revision: 3
  Underscans IT Video Formats by default
  Basic audio support
  Supports YCbCr 4:4:4
  Supports YCbCr 4:2:2
  Native DTDs: 1
  Video Data Block:
    VIC   1:   640x480    59.940476 Hz   4:3     31.469 kHz     25.175000 MHz
    VIC   2:   720x480    59.940060 Hz   4:3     31.469 kHz     27.000000 MHz
    VIC   3:   720x480    59.940060 Hz  16:9     31.469 kHz     27.000000 MHz
    VIC   4:  1280x720    60.000000 Hz  16:9     45.000 kHz     74.250000 MHz
    VIC  16:  1920x1080   60.000000 Hz  16:9     67.500 kHz    148.500000 MHz (native)
    VIC  17:   720x576    50.000000 Hz   4:3     31.250 kHz     27.000000 MHz
    VIC  18:   720x576    50.000000 Hz  16:9     31.250 kHz     27.000000 MHz
    VIC  19:  1280x720    50.000000 Hz  16:9     37.500 kHz     74.250000 MHz
    VIC  31:  1920x1080   50.000000 Hz  16:9     56.250 kHz    148.500000 MHz
    VIC  76:  1920x1080   60.000000 Hz  64:27    67.500 kHz    148.500000 MHz
  Audio Data Block:
    Linear PCM:
      Max channels: 2
      Supported sample rates (kHz): 48 44.1 32
      Supported sample sizes (bits): 24 20 16
  Speaker Allocation Data Block:
    FL/FR - Front Left/Right
  Vendor-Specific Data Block (HDMI), OUI 00-0C-03:
    Source physical address: 1.0.0.0
    Maximum TMDS clock: 300 MHz
  Vendor-Specific Data Block (HDMI Forum), OUI C4-5D-D8:
    Version: 1
    Maximum TMDS Character Rate: 600 MHz
    SCDC Present
  Vendor-Specific Data Block (AMD), OUI 00-00-1A:
    Version: 1
    Flags 1: 0x01
      FreeSync Supported
    Minimum Refresh Rate: 48 Hz
    Maximum Refresh Rate: 100 Hz
    MCCS VCP Code: 0xe6
  Detailed Timing Descriptors:
    DTD 2:  1920x1080   60.000000 Hz  16:9     67.500 kHz    148.500000 MHz (527 mm x 296 mm)
                 Hfront   88 Hsync  44 Hback  148 Hpol P
                 Vfront    4 Vsync   5 Vback   36 Vpol P
    DTD 3:  2560x1440   59.950550 Hz  16:9     88.787 kHz    241.500000 MHz (527 mm x 296 mm)
                 Hfront   48 Hsync  32 Hback   80 Hpol P
                 Vfront    3 Vsync   5 Vback   33 Vpol P
    DTD 4:  1920x1080  100.001688 Hz  16:9    111.802 kHz    237.020000 MHz (527 mm x 296 mm)
                 Hfront  128 Hsync  32 Hback   40 Hpol P
                 Vfront   16 Vsync   8 Vback   14 Vpol N
Checksum: 0xe7  Unused space in Extension Block: 25 bytes

----------------

Warnings:

Block 1, CTA-861 Extension Block:
  Video Data Block: VIC 1 and the first DTD are not identical. Is this intended?
  Video Data Block: All VICs are in ascending order, and the first (preferred) VIC <= 4, is that intended?
  Display Product Serial Number is set, so the Serial Number in the Base EDID should be 0.

Failures:

Block 0, Base EDID:
  Basic Display Parameters & Features: sRGB is signaled, but the chromaticities do not match.
Block 1, CTA-861 Extension Block:
  Missing VCDB, needed for Set Selectable RGB Quantization to avoid interop issues.
EDID:
  Extension Block 2 started with EDID header, ignoring Extension Blocks >= 2.
  CTA-861: Native progressive timings are a mix of several resolutions.

EDID conformity: FAIL
