edid-decode (hex):

00 ff ff ff ff ff ff 00 49 ec 07 c7 0b 06 00 00
24 0d 01 01 08 1e 16 b4 c8 00 b2 a0 57 49 9b 26
10 48 4f a4 c3 7c 31 59 45 59 a9 40 a9 45 81 4f
61 59 01 01 01 01 10 0b d0 b4 20 5e 63 10 12 6c
62 08 fa b8 00 00 00 1a 00 00 00 fa 00 31 59 45
59 a9 40 a9 45 81 4f 61 59 a0 00 00 00 fc 00 52
4f 4c 53 45 4e 20 43 37 30 37 4e 20 00 00 00 fd
00 32 5a 1e 58 12 00 0a 20 20 20 20 20 20 00 bd

----------------

Block 0, Base EDID:
  EDID Structure Version & Revision: 1.1
  Vendor & Product Identification:
    Manufacturer: ROL
    Model: 50951
    Serial Number: ...
    Made in: week 36 of 2003
  Basic Display Parameters & Features:
    Analog display
    Signal Level Standard: 0.700 : 0.300 : 1.000 V p-p
    Blank level equals black level
    Sync: Separate
    Maximum image size: 30 cm x 22 cm
    Gamma: 2.80
    DPMS levels: Standby Suspend
    RGB color display
  Color Characteristics:
    Red  : 0.6250, 0.3398
    Green: 0.2851, 0.6054
    Blue : 0.1503, 0.0654
    White: 0.2812, 0.3105
  Established Timings I & II:
    IBM     :   720x400    70.081663 Hz   9:5     31.467 kHz     28.320000 MHz
    DMT 0x04:   640x480    59.940476 Hz   4:3     31.469 kHz     25.175000 MHz
    DMT 0x06:   640x480    75.000000 Hz   4:3     37.500 kHz     31.500000 MHz
    DMT 0x0a:   800x600    72.187572 Hz   4:3     48.077 kHz     50.000000 MHz
    DMT 0x0b:   800x600    75.000000 Hz   4:3     46.875 kHz     49.500000 MHz
    DMT 0x12:  1024x768    75.028582 Hz   4:3     60.023 kHz     78.750000 MHz
    DMT 0x24:  1280x1024   75.024675 Hz   5:4     79.976 kHz    135.000000 MHz
  Standard Timings:
    DMT 0x07:   640x480    85.008312 Hz   4:3     43.269 kHz     36.000000 MHz
    DMT 0x0c:   800x600    85.061274 Hz   4:3     53.674 kHz     56.250000 MHz
    DMT 0x33:  1600x1200   60.000000 Hz   4:3     75.000 kHz    162.000000 MHz
    DMT 0x34:  1600x1200   65.000000 Hz   4:3     81.250 kHz    175.500000 MHz
    Unknown :  1280x960    75.000 Hz   4:3
    DMT 0x13:  1024x768    84.996690 Hz   4:3     68.677 kHz     94.500000 MHz
  Detailed Timing Descriptors:
    DTD 1:   720x350    70.081663 Hz  72:35    31.467 kHz     28.320000 MHz (250 mm x 184 mm)
                 Hfront   18 Hsync 108 Hback   54 Hpol P
                 Vfront   38 Vsync   2 Vback   59 Vpol N
    Standard Timing Identifications:
      DMT 0x07:   640x480    85.008312 Hz   4:3     43.269 kHz     36.000000 MHz
      DMT 0x0c:   800x600    85.061274 Hz   4:3     53.674 kHz     56.250000 MHz
      DMT 0x33:  1600x1200   60.000000 Hz   4:3     75.000 kHz    162.000000 MHz
      DMT 0x34:  1600x1200   65.000000 Hz   4:3     81.250 kHz    175.500000 MHz
      Unknown :  1280x960    75.000 Hz   4:3
      DMT 0x13:  1024x768    84.996690 Hz   4:3     68.677 kHz     94.500000 MHz
    Display Product Name: 'ROLSEN C707N '
    Display Range Limits:
      Monitor ranges (GTF): 50-90 Hz V, 30-88 kHz H, max dotclock 180 MHz
Checksum: 0xbd

----------------

Warnings:

Block 0, Base EDID:
  EDID Structure Version & Revision: EDID 1.1 is deprecated, do not use.
  Detailed Timing Descriptor #1: Image size is 250x184 mm, but based on the picture AR it should be 250x121 mm.

Failures:

Block 0, Base EDID:
  Detailed Timing Descriptor #1: Mismatch of image size 250x184 mm vs display size 300x220 mm.
  Display Product Name: No newline, but one or more trailing spaces.

EDID conformity: FAIL
