edid-decode (hex):

00 ff ff ff ff ff ff 00 66 70 50 21 0a 1a 00 00
23 15 01 03 00 30 1b 78 ea d6 a5 a2 59 4a 95 24
14 50 54 af cf 00 81 80 81 40 71 40 a9 c0 81 00
81 c0 01 01 a9 40 02 3a 80 18 71 38 2d 40 58 2c
45 00 70 cf 10 00 00 1a 21 39 90 30 62 1a 27 40
68 b0 36 00 55 00 11 00 00 1c 9a 29 a0 c9 51 84
22 30 50 98 36 00 54 ff 10 00 00 1c 00 00 00 fc
00 4d 46 32 31 35 42 48 0a 20 20 20 20 20 00 46

00 ff ff ff ff ff ff 00 66 70 50 21 0a 1a 00 00
23 15 01 03 00 30 1b 78 ea d6 a5 a2 59 4a 95 24
14 50 54 af cf 00 81 80 81 40 71 40 a9 c0 81 00
81 c0 01 01 a9 40 02 3a 80 18 71 38 2d 40 58 2c
45 00 70 cf 10 00 00 1a 21 39 90 30 62 1a 27 40
68 b0 36 00 55 00 11 00 00 1c 9a 29 a0 c9 51 84
22 30 50 98 36 00 54 ff 10 00 00 1c 00 00 00 fc
00 4d 46 32 31 35 42 48 0a 20 20 20 20 20 00 46

----------------

Block 0, Base EDID:
  EDID Structure Version & Revision: 1.3
  Vendor & Product Identification:
    Manufacturer: YSP
    Model: 8528
    Serial Number: ...
    Made in: week 35 of 2011
  Basic Display Parameters & Features:
    Analog display
    Signal Level Standard: 0.700 : 0.300 : 1.000 V p-p
    Blank level equals black level
    Maximum image size: 48 cm x 27 cm
    Gamma: 2.20
    DPMS levels: Standby Suspend Off
    RGB color display
    First detailed timing is the preferred timing
  Color Characteristics:
    Red  : 0.6357, 0.3486
    Green: 0.2900, 0.5839
    Blue : 0.1425, 0.0800
    White: 0.3134, 0.3291
  Established Timings I & II:
    IBM     :   720x400    70.081663 Hz   9:5     31.467 kHz     28.320000 MHz
    DMT 0x04:   640x480    59.940476 Hz   4:3     31.469 kHz     25.175000 MHz
    DMT 0x05:   640x480    72.808802 Hz   4:3     37.861 kHz     31.500000 MHz
    DMT 0x06:   640x480    75.000000 Hz   4:3     37.500 kHz     31.500000 MHz
    DMT 0x08:   800x600    56.250000 Hz   4:3     35.156 kHz     36.000000 MHz
    DMT 0x09:   800x600    60.316541 Hz   4:3     37.879 kHz     40.000000 MHz
    DMT 0x0a:   800x600    72.187572 Hz   4:3     48.077 kHz     50.000000 MHz
    DMT 0x0b:   800x600    75.000000 Hz   4:3     46.875 kHz     49.500000 MHz
    DMT 0x10:  1024x768    60.003840 Hz   4:3     48.363 kHz     65.000000 MHz
    DMT 0x11:  1024x768    70.069359 Hz   4:3     56.476 kHz     75.000000 MHz
    DMT 0x12:  1024x768    75.028582 Hz   4:3     60.023 kHz     78.750000 MHz
    DMT 0x24:  1280x1024   75.024675 Hz   5:4     79.976 kHz    135.000000 MHz
  Standard Timings:
    DMT 0x23:  1280x1024   60.019740 Hz   5:4     63.981 kHz    108.000000 MHz
    DMT 0x20:  1280x960    60.000000 Hz   4:3     60.000 kHz    108.000000 MHz
    GTF     :  1152x864    60.000000 Hz   4:3     53.700 kHz     81.624000 MHz
    DMT 0x53:  1600x900    60.000000 Hz  16:9     60.000 kHz    108.000000 MHz (RB)
    DMT 0x1c:  1280x800    59.810326 Hz  16:10    49.702 kHz     83.500000 MHz
    DMT 0x55:  1280x720    60.000000 Hz  16:9     45.000 kHz     74.250000 MHz
    DMT 0x33:  1600x1200   60.000000 Hz   4:3     75.000 kHz    162.000000 MHz
  Detailed Timing Descriptors:
    DTD 1:  1920x1080   60.000000 Hz  16:9     67.500 kHz    148.500000 MHz (368 mm x 207 mm)
                 Hfront   88 Hsync  44 Hback  148 Hpol P
                 Vfront    4 Vsync   5 Vback   36 Vpol N
    DTD 2:  1680x1050   59.954250 Hz  16:10    65.290 kHz    146.250000 MHz (341 mm x 256 mm)
                 Hfront  104 Hsync 176 Hback  280 Hpol N
                 Vfront    3 Vsync   6 Vback   30 Vpol P
    DTD 3:  1440x900    60.108432 Hz  16:10    56.141 kHz    106.500000 MHz (340 mm x 255 mm)
                 Hfront   80 Hsync 152 Hback  225 Hpol N
                 Vfront    3 Vsync   6 Vback   25 Vpol P
    Display Product Name: 'MF215BH'
Checksum: 0x46

----------------

Block 1, Unknown EDID Extension Block 0x00:
  00 ff ff ff ff ff ff 00 66 70 50 21 0a 1a 00 00 '........fpP!....'
  23 15 01 03 00 30 1b 78 ea d6 a5 a2 59 4a 95 24 '#....0.x....YJ.$'
  14 50 54 af cf 00 81 80 81 40 71 40 a9 c0 81 00 '.PT......@q@....'
  81 c0 01 01 a9 40 02 3a 80 18 71 38 2d 40 58 2c '.....@.:..q8-@X,'
  45 00 70 cf 10 00 00 1a 21 39 90 30 62 1a 27 40 'E.p.....!9.0b.'@'
  68 b0 36 00 55 00 11 00 00 1c 9a 29 a0 c9 51 84 'h.6.U......)..Q.'
  22 30 50 98 36 00 54 ff 10 00 00 1c 00 00 00 fc '"0P.6.T.........'
  00 4d 46 32 31 35 42 48 0a 20 20 20 20 20 00 46 '.MF215BH.     .F'
Checksum: 0x46

----------------

Warnings:

Block 0, Base EDID:
  Vendor & Product Identification: The serial number is one of the known dummy values, it should probably be set to 0.
  Detailed Timing Descriptor #1: DTD is similar but not identical to VIC 16.
  Detailed Timing Descriptor #2: Image size is 341x256 mm, but based on the picture AR it should be 341x213 mm.
  Detailed Timing Descriptor #3: Image size is 340x255 mm, but based on the picture AR it should be 340x212 mm.

Failures:

Block 0, Base EDID:
  Detailed Timing Descriptor #1: Mismatch of image size 368x207 mm vs display size 480x270 mm.
  Detailed Timing Descriptor #2: Mismatch of image size 341x256 mm vs display size 480x270 mm.
  Detailed Timing Descriptor #3: Mismatch of image size 340x255 mm vs display size 480x270 mm.
  Missing Display Range Limits Descriptor.
Block 1, Base EDID:
  Unknown Extension Block.
EDID:
  Base EDID: EDID specified 0 extension block(s), but found 1 extension block(s).

EDID conformity: FAIL
