edid-decode (hex):

00 ff ff ff ff ff ff 00 20 a3 00 00 00 00 00 00
2e 21 01 03 80 5f 36 78 0a 8a 9d a4 55 52 9f 25
0e 47 4a ad cf 00 71 4f 81 40 81 80 81 00 95 00
b3 00 d1 c0 81 c0 08 e8 00 30 f2 70 5a 80 b0 58
8a 00 20 c2 31 00 00 1e 04 74 00 30 f2 70 5a 80
b0 58 8a 00 20 c2 31 00 00 1e 00 00 00 fc 00 52
34 33 42 37 31 32 30 55 4b 0a 20 20 00 00 00 fd
00 18 4b 0f 87 3c 00 0a 20 20 20 20 20 20 01 7d

02 03 66 71 5f 61 60 5f 5e 5d 66 65 64 63 62 10
1f 22 21 20 05 14 04 13 3e 3d 3c 12 11 16 15 03
02 07 06 01 2c 09 07 07 15 07 50 57 07 00 67 04
02 83 01 00 00 6e 03 0c 00 10 00 b8 3c 20 10 80
01 02 03 04 68 d8 5d c4 01 78 80 03 02 e2 00 cf
e3 05 c0 00 e3 06 0d 01 e6 11 46 d0 00 70 80 e1
0f e4 20 00 00 03 02 3a 80 d0 72 38 2d 40 58 2c
45 00 20 c2 31 00 00 1e 00 00 00 00 00 00 00 a3

00 ff ff ff ff ff ff 00 20 a3 00 00 00 00 00 00
2e 21 01 03 80 5f 36 78 0a 8a 9d a4 55 52 9f 25
0e 47 4a ad cf 00 71 4f 81 40 81 80 81 00 95 00
b3 00 d1 c0 81 c0 08 e8 00 30 f2 70 5a 80 b0 58
8a 00 20 c2 31 00 00 1e 04 74 00 30 f2 70 5a 80
b0 58 8a 00 20 c2 31 00 00 1e 00 00 00 fc 00 52
34 33 42 37 31 32 30 55 4b 0a 20 20 00 00 00 fd
00 18 4b 0f 87 3c 00 0a 20 20 20 20 20 20 01 7d

02 03 66 71 5f 61 60 5f 5e 5d 66 65 64 63 62 10
1f 22 21 20 05 14 04 13 3e 3d 3c 12 11 16 15 03
02 07 06 01 2c 09 07 07 15 07 50 57 07 00 67 04
02 83 01 00 00 6e 03 0c 00 10 00 b8 3c 20 10 80
01 02 03 04 68 d8 5d c4 01 78 80 03 02 e2 00 cf
e3 05 c0 00 e3 06 0d 01 e6 11 46 d0 00 70 80 e1
0f e4 20 00 00 03 02 3a 80 d0 72 38 2d 40 58 2c
45 00 20 c2 31 00 00 1e 00 00 00 00 00 00 00 a3

----------------

Block 0, Base EDID:
  EDID Structure Version & Revision: 1.3
  Vendor & Product Identification:
    Manufacturer: HEC
    Model: 0
    Made in: week 46 of 2023
  Basic Display Parameters & Features:
    Digital display
    Maximum image size: 95 cm x 54 cm
    Gamma: 2.20
    RGB color display
    First detailed timing is the preferred timing
  Color Characteristics:
    Red  : 0.6425, 0.3320
    Green: 0.3222, 0.6230
    Blue : 0.1464, 0.0556
    White: 0.2802, 0.2900
  Established Timings I & II:
    IBM     :   720x400    70.081663 Hz   9:5     31.467 kHz     28.320000 MHz
    DMT 0x04:   640x480    59.940476 Hz   4:3     31.469 kHz     25.175000 MHz
    DMT 0x05:   640x480    72.808802 Hz   4:3     37.861 kHz     31.500000 MHz
    DMT 0x06:   640x480    75.000000 Hz   4:3     37.500 kHz     31.500000 MHz
    DMT 0x09:   800x600    60.316541 Hz   4:3     37.879 kHz     40.000000 MHz
    DMT 0x0a:   800x600    72.187572 Hz   4:3     48.077 kHz     50.000000 MHz
    DMT 0x0b:   800x600    75.000000 Hz   4:3     46.875 kHz     49.500000 MHz
    DMT 0x10:  1024x768    60.003840 Hz   4:3     48.363 kHz     65.000000 MHz
    DMT 0x11:  1024x768    70.069359 Hz   4:3     56.476 kHz     75.000000 MHz
    DMT 0x12:  1024x768    75.028582 Hz   4:3     60.023 kHz     78.750000 MHz
    DMT 0x24:  1280x1024   75.024675 Hz   5:4     79.976 kHz    135.000000 MHz
  Standard Timings:
    DMT 0x15:  1152x864    75.000000 Hz   4:3     67.500 kHz    108.000000 MHz
    DMT 0x20:  1280x960    60.000000 Hz   4:3     60.000 kHz    108.000000 MHz
    DMT 0x23:  1280x1024   60.019740 Hz   5:4     63.981 kHz    108.000000 MHz
    DMT 0x1c:  1280x800    59.810326 Hz  16:10    49.702 kHz     83.500000 MHz
    DMT 0x2f:  1440x900    59.887445 Hz  16:10    55.935 kHz    106.500000 MHz
    DMT 0x3a:  1680x1050   59.954250 Hz  16:10    65.290 kHz    146.250000 MHz
    DMT 0x52:  1920x1080   60.000000 Hz  16:9     67.500 kHz    148.500000 MHz
    DMT 0x55:  1280x720    60.000000 Hz  16:9     45.000 kHz     74.250000 MHz
  Detailed Timing Descriptors:
    DTD 1:  3840x2160   60.000000 Hz  16:9    135.000 kHz    594.000000 MHz (800 mm x 450 mm)
                 Hfront  176 Hsync  88 Hback  296 Hpol P
                 Vfront    8 Vsync  10 Vback   72 Vpol P
    DTD 2:  3840x2160   30.000000 Hz  16:9     67.500 kHz    297.000000 MHz (800 mm x 450 mm)
                 Hfront  176 Hsync  88 Hback  296 Hpol P
                 Vfront    8 Vsync  10 Vback   72 Vpol P
    Display Product Name: 'R43B7120UK'
    Display Range Limits:
      Monitor ranges (GTF): 24-75 Hz V, 15-135 kHz H, max dotclock 600 MHz
  Extension blocks: 1
Checksum: 0x7d

----------------

Block 1, CTA-861 Extension Block:
  Revision: 3
  Basic audio support
  Supports YCbCr 4:4:4
  Supports YCbCr 4:2:2
  Native DTDs: 1
  Video Data Block:
    VIC  97:  3840x2160   60.000000 Hz  16:9    135.000 kHz    594.000000 MHz
    VIC  96:  3840x2160   50.000000 Hz  16:9    112.500 kHz    594.000000 MHz
    VIC  95:  3840x2160   30.000000 Hz  16:9     67.500 kHz    297.000000 MHz
    VIC  94:  3840x2160   25.000000 Hz  16:9     56.250 kHz    297.000000 MHz
    VIC  93:  3840x2160   24.000000 Hz  16:9     54.000 kHz    297.000000 MHz
    VIC 102:  4096x2160   60.000000 Hz 256:135  135.000 kHz    594.000000 MHz
    VIC 101:  4096x2160   50.000000 Hz 256:135  112.500 kHz    594.000000 MHz
    VIC 100:  4096x2160   30.000000 Hz 256:135   67.500 kHz    297.000000 MHz
    VIC  99:  4096x2160   25.000000 Hz 256:135   56.250 kHz    297.000000 MHz
    VIC  98:  4096x2160   24.000000 Hz 256:135   54.000 kHz    297.000000 MHz
    VIC  16:  1920x1080   60.000000 Hz  16:9     67.500 kHz    148.500000 MHz
    VIC  31:  1920x1080   50.000000 Hz  16:9     56.250 kHz    148.500000 MHz
    VIC  34:  1920x1080   30.000000 Hz  16:9     33.750 kHz     74.250000 MHz
    VIC  33:  1920x1080   25.000000 Hz  16:9     28.125 kHz     74.250000 MHz
    VIC  32:  1920x1080   24.000000 Hz  16:9     27.000 kHz     74.250000 MHz
    VIC   5:  1920x1080i  60.000000 Hz  16:9     33.750 kHz     74.250000 MHz
    VIC  20:  1920x1080i  50.000000 Hz  16:9     28.125 kHz     74.250000 MHz
    VIC   4:  1280x720    60.000000 Hz  16:9     45.000 kHz     74.250000 MHz
    VIC  19:  1280x720    50.000000 Hz  16:9     37.500 kHz     74.250000 MHz
    VIC  62:  1280x720    30.000000 Hz  16:9     22.500 kHz     74.250000 MHz
    VIC  61:  1280x720    25.000000 Hz  16:9     18.750 kHz     74.250000 MHz
    VIC  60:  1280x720    24.000000 Hz  16:9     18.000 kHz     59.400000 MHz
    VIC  18:   720x576    50.000000 Hz  16:9     31.250 kHz     27.000000 MHz
    VIC  17:   720x576    50.000000 Hz   4:3     31.250 kHz     27.000000 MHz
    VIC  22:  1440x576i   50.000000 Hz  16:9     15.625 kHz     27.000000 MHz
    VIC  21:  1440x576i   50.000000 Hz   4:3     15.625 kHz     27.000000 MHz
    VIC   3:   720x480    59.940060 Hz  16:9     31.469 kHz     27.000000 MHz
    VIC   2:   720x480    59.940060 Hz   4:3     31.469 kHz     27.000000 MHz
    VIC   7:  1440x480i   59.940060 Hz  16:9     15.734 kHz     27.000000 MHz
    VIC   6:  1440x480i   59.940060 Hz   4:3     15.734 kHz     27.000000 MHz
    VIC   1:   640x480    59.940476 Hz   4:3     31.469 kHz     25.175000 MHz
  Audio Data Block:
    Linear PCM:
      Max channels: 2
      Supported sample rates (kHz): 48 44.1 32
      Supported sample sizes (bits): 24 20 16
    AC-3:
      Max channels: 6
      Supported sample rates (kHz): 48 44.1 32
      Maximum bit rate: 640 kb/s
    Enhanced AC-3 (DD+):
      Max channels: 8
      Supported sample rates (kHz): 48 44.1 32
    MAT (MLP):
      Max channels: 8
      Supported sample rates (kHz): 48
      Supports only Dolby TrueHD
  Speaker Allocation Data Block:
    FL/FR - Front Left/Right
  Vendor-Specific Data Block (HDMI), OUI 00-0C-03:
    Source physical address: 1.0.0.0
    Supports_AI
    DC_36bit
    DC_30bit
    DC_Y444
    Maximum TMDS clock: 300 MHz
    Extended HDMI video details:
      Base EDID image size is in units of 1 cm
      HDMI VICs:
        HDMI VIC 1:  3840x2160   30.000000 Hz  16:9     67.500 kHz    297.000000 MHz
        HDMI VIC 2:  3840x2160   25.000000 Hz  16:9     56.250 kHz    297.000000 MHz
        HDMI VIC 3:  3840x2160   24.000000 Hz  16:9     54.000 kHz    297.000000 MHz
        HDMI VIC 4:  4096x2160   24.000000 Hz 256:135   54.000 kHz    297.000000 MHz
  Vendor-Specific Data Block (HDMI Forum), OUI C4-5D-D8:
    Version: 1
    Maximum TMDS Character Rate: 600 MHz
    SCDC Present
    Supports 12-bits/component Deep Color 4:2:0 Pixel Encoding
    Supports 10-bits/component Deep Color 4:2:0 Pixel Encoding
    Supports Auto Low-Latency Mode
  Video Capability Data Block:
    YCbCr quantization: Selectable (via AVI YQ)
    RGB quantization: Selectable (via AVI Q)
    PT scan behavior: No Data
    IT scan behavior: Supports both over- and underscan
    CE scan behavior: Supports both over- and underscan
  Colorimetry Data Block:
    BT2020YCC
    BT2020RGB
  HDR Static Metadata Data Block:
    Electro optical transfer functions:
      Traditional gamma - SDR luminance range
      SMPTE ST2084
      Hybrid Log-Gamma
    Supported static metadata descriptors:
      Static metadata type 1
  Vendor-Specific Audio Data Block (Dolby), OUI 00-D0-46:
    Version: 1 (7 bytes)
    Height speaker zone present
    Surround speaker zone present
    Center speaker zone present
  YCbCr 4:2:0 Capability Map Data Block:
    All VDB SVDs
  InfoFrame Data Block:
    VSIFs: 0
    Source Product Description InfoFrame (3)
  Detailed Timing Descriptors:
    DTD 3:  1920x1080   50.000000 Hz  16:9     56.250 kHz    148.500000 MHz (800 mm x 450 mm)
                 Hfront   88 Hsync  44 Hback  588 Hpol P
                 Vfront    4 Vsync   5 Vback   36 Vpol P
Checksum: 0xa3  Unused space in Extension Block: 7 bytes

----------------

Warnings:

Block 1, CTA-861 Extension Block:
  IT Video Formats are overscanned by default, but normally this should be underscanned.
  Colorimetry Data Block: Set the sRGB colorimetry bit to avoid interop issues.
  Detailed Timing Descriptor #3: DTD is similar but not identical to VIC 31.

Failures:

Block 0, Base EDID:
  Detailed Timing Descriptor #1: Mismatch of image size 800x450 mm vs display size 950x540 mm.
  Detailed Timing Descriptor #2: Mismatch of image size 800x450 mm vs display size 950x540 mm.
Block 1, CTA-861 Extension Block:
  Vendor-Specific Data Block (HDMI Forum), OUI C4-5D-D8: HDMI VIC and related CTA VIC codes are present, but the UHD VIC bit is 0.
  Detailed Timing Descriptor #3: Mismatch of image size 800x450 mm vs display size 950x540 mm.
EDID:
  Extension Block 2 started with EDID header, ignoring Extension Blocks >= 2.

EDID conformity: FAIL
