edid-decode (hex):

00 ff ff ff ff ff ff 00 0e 6f 26 16 02 60 00 00
00 20 01 04 b5 22 16 78 03 81 d8 ad 51 44 af 23
0e 51 55 00 00 00 01 01 01 01 01 01 01 01 01 01
01 01 01 01 01 01 bb aa 80 a0 c0 d0 a8 70 30 20
36 00 58 d7 10 00 00 18 00 00 00 fd 0c 30 a5 67
67 78 01 0a 20 20 20 20 20 20 00 00 00 fe 00 43
53 4f 54 20 54 33 0a 20 20 20 20 20 00 00 00 fe
00 4d 4e 47 30 30 37 5a 41 31 2d 32 0a 20 01 df

70 12 79 00 00 03 01 14 82 d5 01 05 7f 0c 9f 00
2f 00 1f 00 cf 07 a7 00 02 00 05 00 00 00 00 00
00 00 00 00 00 00 00 00 00 00 00 00 00 00 00 00
00 00 00 00 00 00 00 00 00 00 00 00 00 00 00 00
00 00 00 00 00 00 00 00 00 00 00 00 00 00 00 00
00 00 00 00 00 00 00 00 00 00 00 00 00 00 00 00
00 00 00 00 00 00 00 00 00 00 00 00 00 00 00 00
00 00 00 00 00 00 00 00 00 00 00 00 00 00 04 90

00 ff ff ff ff ff ff 00 0e 6f 26 16 02 60 00 00
00 20 01 04 b5 22 16 78 03 81 d8 ad 51 44 af 23
0e 51 55 00 00 00 01 01 01 01 01 01 01 01 01 01
01 01 01 01 01 01 bb aa 80 a0 c0 d0 a8 70 30 20
36 00 58 d7 10 00 00 18 00 00 00 fd 0c 30 a5 67
67 78 01 0a 20 20 20 20 20 20 00 00 00 fe 00 43
53 4f 54 20 54 33 0a 20 20 20 20 20 00 00 00 fe
00 4d 4e 47 30 30 37 5a 41 31 2d 32 0a 20 01 df

70 12 79 00 00 03 01 14 82 d5 01 05 7f 0c 9f 00
2f 00 1f 00 cf 07 a7 00 02 00 05 00 00 00 00 00
00 00 00 00 00 00 00 00 00 00 00 00 00 00 00 00
00 00 00 00 00 00 00 00 00 00 00 00 00 00 00 00
00 00 00 00 00 00 00 00 00 00 00 00 00 00 00 00
00 00 00 00 00 00 00 00 00 00 00 00 00 00 00 00
00 00 00 00 00 00 00 00 00 00 00 00 00 00 00 00
00 00 00 00 00 00 00 00 00 00 00 00 00 00 04 90

----------------

Block 0, Base EDID:
  EDID Structure Version & Revision: 1.4
  Vendor & Product Identification:
    Manufacturer: CSO
    Model: 5670
    Serial Number: ...
    Made in: 2022
  Basic Display Parameters & Features:
    Digital display
    Bits per primary color channel: 10
    DisplayPort interface
    Maximum image size: 34 cm x 22 cm
    Gamma: 2.20
    Supported color formats: RGB 4:4:4
    First detailed timing includes the native pixel format and preferred refresh rate
    Display supports continuous frequencies
  Color Characteristics:
    Red  : 0.6777, 0.3164
    Green: 0.2656, 0.6845
    Blue : 0.1396, 0.0556
    White: 0.3183, 0.3320
  Established Timings I & II: none
  Standard Timings: none
  Detailed Timing Descriptors:
    DTD 1:  3200x2000   60.000165 Hz  16:10   130.080 kHz    437.070000 MHz (344 mm x 215 mm)
                 Hfront   48 Hsync  32 Hback   80 Hpol N
                 Vfront    3 Vsync   6 Vback  159 Vpol N
    Display Range Limits:
      Monitor ranges (Range Limits Only): 48-165 Hz V, 358-358 kHz H, max dotclock 1200 MHz
    Alphanumeric Data String: 'CSOT T3'
    Alphanumeric Data String: 'MNG007ZA1-2'
  Extension blocks: 1
Checksum: 0xdf

----------------

Block 1, DisplayID Extension Block:
  Version: 1.2
  Extension Count: 0
  Display Product Type: Extension Section
  Video Timing Modes Type 1 - Detailed Timings Data Block:
    DTD:  3200x2000  165.001483 Hz  16:10   357.723 kHz   1201.950000 MHz (aspect 16:10, no 3D stereo)
               Hfront   48 Hsync  32 Hback   80 Hpol N
               Vfront    3 Vsync   6 Vback  159 Vpol N
  Checksum: 0x04
Checksum: 0x90

----------------

Block 2, Unknown EDID Extension Block 0x00:
  00 ff ff ff ff ff ff 00 0e 6f 26 16 02 60 00 00 '.........o&..`..'
  00 20 01 04 b5 22 16 78 03 81 d8 ad 51 44 af 23 '. ...".x....QD.#'
  0e 51 55 00 00 00 01 01 01 01 01 01 01 01 01 01 '.QU.............'
  01 01 01 01 01 01 bb aa 80 a0 c0 d0 a8 70 30 20 '.............p0 '
  36 00 58 d7 10 00 00 18 00 00 00 fd 0c 30 a5 67 '6.X..........0.g'
  67 78 01 0a 20 20 20 20 20 20 00 00 00 fe 00 43 'gx..      .....C'
  53 4f 54 20 54 33 0a 20 20 20 20 20 00 00 00 fe 'SOT T3.     ....'
  00 4d 4e 47 30 30 37 5a 41 31 2d 32 0a 20 01 df '.MNG007ZA1-2. ..'
Checksum: 0xdf

----------------

Block 3, DisplayID Extension Block:
  Version: 1.2
  Extension Count: 0
  Video Timing Modes Type 1 - Detailed Timings Data Block:
    DTD:  3200x2000  165.001483 Hz  16:10   357.723 kHz   1201.950000 MHz (aspect 16:10, no 3D stereo)
               Hfront   48 Hsync  32 Hback   80 Hpol N
               Vfront    3 Vsync   6 Vback  159 Vpol N
  Checksum: 0x04
Checksum: 0x90

----------------

Warnings:

Block 0, Base EDID:
  Missing Display Product Name.
EDID:
  Base EDID: Some timings are out of range of the Monitor Ranges:
    Horizontal Freq: 130.080 - 357.723 kHz (Monitor: 358.000 - 358.000 kHz)
    Maximum Clock: 1201.950 MHz (Monitor: 1200.000 MHz)

Failures:

Block 1, DisplayID Extension Block:
  DisplayID Base Block has no product type.
  Expected 0 DisplayID Extension Block, but got 1.
Block 2, Base EDID:
  Unknown Extension Block.
EDID:
  Base EDID: EDID specified 1 extension block(s), but found 3 extension block(s).
  DisplayID: DisplayID expects at least one preferred timing.

EDID conformity: FAIL
