edid-decode (hex):

00 ff ff ff ff ff ff 00 15 c3 10 21 01 01 01 01
1b 14 01 04 a5 34 21 78 e2 f9 f5 a8 53 37 ae 25
12 50 54 a1 08 00 a9 40 81 80 81 40 b3 00 01 01
01 01 01 01 01 01 28 3c 80 a0 70 b0 23 40 30 20
36 00 07 44 21 00 00 1a 00 00 00 ff 00 30 32 37
35 36 30 37 30 0a 20 20 20 20 00 00 00 fd 00 3b
3d 1f 4c 11 00 0a 20 20 20 20 20 20 00 00 00 fc
00 53 32 34 33 33 57 0a 20 20 20 20 20 20 01 8a

02 03 18 c0 44 01 02 03 04 23 09 1f 07 83 01 00
00 66 03 0c 00 10 00 80 d5 09 80 a0 20 e0 2d 10
10 60 a2 00 07 44 21 00 00 18 8c 0a d0 8a 20 e0
2d 10 10 3e 96 00 07 44 21 00 00 18 8c 0a d0 8a
20 e0 2d 10 10 3e 96 00 07 44 21 00 00 18 01 1d
00 72 51 d0 1e 20 6e 28 55 00 07 44 21 00 00 1e
00 00 00 00 00 00 00 00 00 00 00 00 00 00 00 00
00 00 00 00 00 00 00 00 00 00 00 00 00 00 00 9b

00 ff ff ff ff ff ff 00 15 c3 10 21 01 01 01 01
1b 14 01 04 a5 34 21 78 e2 f9 f5 a8 53 37 ae 25
12 50 54 a1 08 00 a9 40 81 80 81 40 b3 00 01 01
01 01 01 01 01 01 28 3c 80 a0 70 b0 23 40 30 20
36 00 07 44 21 00 00 1a 00 00 00 ff 00 30 32 37
35 36 30 37 30 0a 20 20 20 20 00 00 00 fd 00 3b
3d 1f 4c 11 00 0a 20 20 20 20 20 20 00 00 00 fc
00 53 32 34 33 33 57 0a 20 20 20 20 20 20 01 8a

02 03 18 c0 44 01 02 03 04 23 09 1f 07 83 01 00
00 66 03 0c 00 10 00 80 d5 09 80 a0 20 e0 2d 10
10 60 a2 00 07 44 21 00 00 18 8c 0a d0 8a 20 e0
2d 10 10 3e 96 00 07 44 21 00 00 18 8c 0a d0 8a
20 e0 2d 10 10 3e 96 00 07 44 21 00 00 18 01 1d
00 72 51 d0 1e 20 6e 28 55 00 07 44 21 00 00 1e
00 00 00 00 00 00 00 00 00 00 00 00 00 00 00 00
00 00 00 00 00 00 00 00 00 00 00 00 00 00 00 9b

----------------

Block 0, Base EDID:
  EDID Structure Version & Revision: 1.4
  Vendor & Product Identification:
    Manufacturer: ENC
    Model: 8464
    Serial Number: ...
    Made in: week 27 of 2010
  Basic Display Parameters & Features:
    Digital display
    Bits per primary color channel: 8
    DisplayPort interface
    Maximum image size: 52 cm x 33 cm
    Gamma: 2.20
    DPMS levels: Standby Suspend Off
    Supported color formats: RGB 4:4:4
    First detailed timing includes the native pixel format and preferred refresh rate
  Color Characteristics:
    Red  : 0.6591, 0.3271
    Green: 0.2167, 0.6806
    Blue : 0.1474, 0.0732
    White: 0.3134, 0.3291
  Established Timings I & II:
    IBM     :   720x400    70.081663 Hz   9:5     31.467 kHz     28.320000 MHz
    DMT 0x04:   640x480    59.940476 Hz   4:3     31.469 kHz     25.175000 MHz
    DMT 0x09:   800x600    60.316541 Hz   4:3     37.879 kHz     40.000000 MHz
    DMT 0x10:  1024x768    60.003840 Hz   4:3     48.363 kHz     65.000000 MHz
  Standard Timings:
    DMT 0x33:  1600x1200   60.000000 Hz   4:3     75.000 kHz    162.000000 MHz
    DMT 0x23:  1280x1024   60.019740 Hz   5:4     63.981 kHz    108.000000 MHz
    DMT 0x20:  1280x960    60.000000 Hz   4:3     60.000 kHz    108.000000 MHz
    DMT 0x3a:  1680x1050   59.954250 Hz  16:10    65.290 kHz    146.250000 MHz
  Detailed Timing Descriptors:
    DTD 1:  1920x1200   59.950171 Hz  16:10    74.038 kHz    154.000000 MHz (519 mm x 324 mm)
                 Hfront   48 Hsync  32 Hback   80 Hpol P
                 Vfront    3 Vsync   6 Vback   26 Vpol N
    Display Product Serial Number: ...
    Display Range Limits:
      Monitor ranges (GTF): 59-61 Hz V, 31-76 kHz H, max dotclock 170 MHz
    Display Product Name: 'S2433W'
  Extension blocks: 1
Checksum: 0x8a

----------------

Block 1, CTA-861 Extension Block:
  Revision: 3
  Underscans IT Video Formats by default
  Basic audio support
  Native DTDs: 0
  Video Data Block:
    VIC   1:   640x480    59.940476 Hz   4:3     31.469 kHz     25.175000 MHz
    VIC   2:   720x480    59.940060 Hz   4:3     31.469 kHz     27.000000 MHz
    VIC   3:   720x480    59.940060 Hz  16:9     31.469 kHz     27.000000 MHz
    VIC   4:  1280x720    60.000000 Hz  16:9     45.000 kHz     74.250000 MHz
  Audio Data Block:
    Linear PCM:
      Max channels: 2
      Supported sample rates (kHz): 96 88.2 48 44.1 32
      Supported sample sizes (bits): 24 20 16
  Speaker Allocation Data Block:
    FL/FR - Front Left/Right
  Vendor-Specific Data Block (HDMI), OUI 00-0C-03:
    Source physical address: 1.0.0.0
    Supports_AI
  Detailed Timing Descriptors:
    DTD 2:   640x480    59.928571 Hz   4:3     31.462 kHz     25.170000 MHz (519 mm x 324 mm)
                 Hfront   16 Hsync  96 Hback   48 Hpol N
                 Vfront   10 Vsync   2 Vback   33 Vpol N
    DTD 3:   720x480    59.940060 Hz   3:2     31.469 kHz     27.000000 MHz (519 mm x 324 mm)
                 Hfront   16 Hsync  62 Hback   60 Hpol N
                 Vfront    9 Vsync   6 Vback   30 Vpol N
    DTD 4:   720x480    59.940060 Hz   3:2     31.469 kHz     27.000000 MHz (519 mm x 324 mm)
                 Hfront   16 Hsync  62 Hback   60 Hpol N
                 Vfront    9 Vsync   6 Vback   30 Vpol N
    DTD 5:  1280x720    60.000000 Hz  16:9     45.000 kHz     74.250000 MHz (519 mm x 324 mm)
                 Hfront  110 Hsync  40 Hback  220 Hpol P
                 Vfront    5 Vsync   5 Vback   20 Vpol P
Checksum: 0x9b  Unused space in Extension Block: 31 bytes

----------------

Warnings:

Block 0, Base EDID:
  Vendor & Product Identification: The serial number is one of the known dummy values, it should probably be set to 0.
  Display Range Limits: GTF support is deprecated in EDID 1.4.
Block 1, CTA-861 Extension Block:
  Video Data Block: VIC 1 and the first DTD are not identical. Is this intended?
  Detailed Timing Descriptor #2: Image size is 519x324 mm, but based on the picture AR it should be 432x324 mm.
  Detailed Timing Descriptor #3: Image size is 519x324 mm, but based on the picture AR it should be 486x324 mm.
  Detailed Timing Descriptor #4: Image size is 519x324 mm, but based on the picture AR it should be 486x324 mm.
  Detailed Timing Descriptor #5: Image size is 519x324 mm, but based on the picture AR it should be 519x291 mm.
  Display Product Serial Number is set, so the Serial Number in the Base EDID should be 0.
  Add a Colorimetry Data Block with the sRGB colorimetry bit set to avoid interop issues.
EDID:
  Base EDID: Some timings are out of range of the Monitor Ranges:
    Vertical Freq: 59.929 - 70.082 Hz (Monitor: 59.000 - 61.000 Hz)

Failures:

Block 0, Base EDID:
  Display Range Limits: GTF is supported, but the display does not support continuous frequencies.
Block 1, CTA-861 Extension Block:
  Vendor-Specific Data Block (HDMI), OUI 00-0C-03: The HDMI Specification requires EDID 1.3 instead of 1.4.
  Missing VCDB, needed for Set Selectable RGB Quantization to avoid interop issues.
EDID:
  Extension Block 2 started with EDID header, ignoring Extension Blocks >= 2.

EDID conformity: FAIL
