edid-decode (hex):

00 ff ff ff ff ff ff 00 34 a4 09 36 8a 31 09 00
2f 13 01 03 68 37 22 78 2a 7b 65 a5 55 48 99 26
12 50 54 bf ef 80 d1 00 d1 c0 b3 00 a9 40 95 00
81 80 61 40 31 00 7d 4b 80 a0 72 b0 2d 40 88 c8
36 00 26 36 21 00 00 1c 00 00 00 ff 00 31 39 34
37 54 4b 36 30 32 35 30 36 0a 00 00 00 fd 00 32
4b 1e 52 14 00 0a 20 20 20 20 20 20 00 00 00 fc
00 4d 44 20 32 30 30 39 34 0a 20 20 20 20 00 13

00 ff ff ff ff ff ff 00 34 a4 09 36 8a 31 09 00
2f 13 01 03 68 37 22 78 2a 7b 65 a5 55 48 99 26
12 50 54 bf ef 80 d1 00 d1 c0 b3 00 a9 40 95 00
81 80 61 40 31 00 7d 4b 80 a0 72 b0 2d 40 88 c8
36 00 26 36 21 00 00 1c 00 00 00 ff 00 31 39 34
37 54 4b 36 30 32 35 30 36 0a 00 00 00 fd 00 32
4b 1e 52 14 00 0a 20 20 20 20 20 20 00 00 00 fc
00 4d 44 20 32 30 30 39 34 0a 20 20 20 20 00 13

----------------

Block 0, Base EDID:
  EDID Structure Version & Revision: 1.3
  Vendor & Product Identification:
    Manufacturer: MED
    Model: 13833
    Serial Number: ...
    Made in: week 47 of 2009
  Basic Display Parameters & Features:
    Analog display
    Signal Level Standard: 0.700 : 0.000 : 0.700 V p-p
    Blank level equals black level
    Sync: Separate
    Maximum image size: 55 cm x 34 cm
    Gamma: 2.20
    DPMS levels: Off
    RGB color display
    First detailed timing is the preferred timing
  Color Characteristics:
    Red  : 0.6455, 0.3349
    Green: 0.2832, 0.6005
    Blue : 0.1494, 0.0722
    White: 0.3134, 0.3291
  Established Timings I & II:
    IBM     :   720x400    70.081663 Hz   9:5     31.467 kHz     28.320000 MHz
    DMT 0x04:   640x480    59.940476 Hz   4:3     31.469 kHz     25.175000 MHz
    Apple   :   640x480    66.666667 Hz   4:3     35.000 kHz     30.240000 MHz
    DMT 0x05:   640x480    72.808802 Hz   4:3     37.861 kHz     31.500000 MHz
    DMT 0x06:   640x480    75.000000 Hz   4:3     37.500 kHz     31.500000 MHz
    DMT 0x08:   800x600    56.250000 Hz   4:3     35.156 kHz     36.000000 MHz
    DMT 0x09:   800x600    60.316541 Hz   4:3     37.879 kHz     40.000000 MHz
    DMT 0x0a:   800x600    72.187572 Hz   4:3     48.077 kHz     50.000000 MHz
    DMT 0x0b:   800x600    75.000000 Hz   4:3     46.875 kHz     49.500000 MHz
    Apple   :   832x624    74.551266 Hz   4:3     49.726 kHz     57.284000 MHz
    DMT 0x10:  1024x768    60.003840 Hz   4:3     48.363 kHz     65.000000 MHz
    DMT 0x11:  1024x768    70.069359 Hz   4:3     56.476 kHz     75.000000 MHz
    DMT 0x12:  1024x768    75.028582 Hz   4:3     60.023 kHz     78.750000 MHz
    DMT 0x24:  1280x1024   75.024675 Hz   5:4     79.976 kHz    135.000000 MHz
    Apple   :  1152x870    75.061550 Hz 192:145   68.681 kHz    100.000000 MHz
  Standard Timings:
    DMT 0x45:  1920x1200   59.884600 Hz  16:10    74.556 kHz    193.250000 MHz
    DMT 0x52:  1920x1080   60.000000 Hz  16:9     67.500 kHz    148.500000 MHz
    DMT 0x3a:  1680x1050   59.954250 Hz  16:10    65.290 kHz    146.250000 MHz
    DMT 0x33:  1600x1200   60.000000 Hz   4:3     75.000 kHz    162.000000 MHz
    DMT 0x2f:  1440x900    59.887445 Hz  16:10    55.935 kHz    106.500000 MHz
    DMT 0x23:  1280x1024   60.019740 Hz   5:4     63.981 kHz    108.000000 MHz
    DMT 0x10:  1024x768    60.003840 Hz   4:3     48.363 kHz     65.000000 MHz
    GTF     :   640x400    60.001229 Hz  16:10    24.901 kHz     19.522000 MHz
  Detailed Timing Descriptors:
    DTD 1:  1920x1200   59.884600 Hz  16:10    74.556 kHz    193.250000 MHz (550 mm x 310 mm)
                 Hfront  136 Hsync 200 Hback  336 Hpol N
                 Vfront    3 Vsync   6 Vback   36 Vpol P
    Display Product Serial Number: ...
    Display Range Limits:
      Monitor ranges (GTF): 50-75 Hz V, 30-82 kHz H, max dotclock 200 MHz
    Display Product Name: 'MD 20094'
Checksum: 0x13

----------------

Block 1, Unknown EDID Extension Block 0x00:
  00 ff ff ff ff ff ff 00 34 a4 09 36 8a 31 09 00 '........4..6.1..'
  2f 13 01 03 68 37 22 78 2a 7b 65 a5 55 48 99 26 '/...h7"x*{e.UH.&'
  12 50 54 bf ef 80 d1 00 d1 c0 b3 00 a9 40 95 00 '.PT..........@..'
  81 80 61 40 31 00 7d 4b 80 a0 72 b0 2d 40 88 c8 '..a@1.}K..r.-@..'
  36 00 26 36 21 00 00 1c 00 00 00 ff 00 31 39 34 '6.&6!........194'
  37 54 4b 36 30 32 35 30 36 0a 00 00 00 fd 00 32 '7TK602506......2'
  4b 1e 52 14 00 0a 20 20 20 20 20 20 00 00 00 fc 'K.R...      ....'
  00 4d 44 20 32 30 30 39 34 0a 20 20 20 20 00 13 '.MD 20094.    ..'
Checksum: 0x13

----------------

Warnings:

Block 0, Base EDID:
  Detailed Timing Descriptor #1: Image size is 550x310 mm, but based on the picture AR it should be 550x343 mm.
EDID:
  Base EDID: Some timings are out of range of the Monitor Ranges:
    Horizontal Freq: 24.900 - 79.976 kHz (Monitor: 30.000 - 82.000 kHz)

Failures:

Block 1, Base EDID:
  Unknown Extension Block.
EDID:
  Base EDID: EDID specified 0 extension block(s), but found 1 extension block(s).

EDID conformity: FAIL
