edid-decode (hex):

00 ff ff ff ff ff ff 00 04 72 74 05 05 07 70 82
1b 1c 01 03 80 46 27 78 2a 4e c0 a6 55 50 9c 26
11 50 54 bf ef 00 d1 c0 b3 00 95 00 81 80 81 40
81 c0 01 01 01 01 02 3a 80 18 71 38 2d 40 58 2c
45 00 09 25 21 00 00 1e 00 00 00 fd 00 32 4c 1e
53 11 00 0a 20 20 20 20 20 20 00 00 00 fc 00 45
44 33 32 32 51 0a 20 20 20 20 20 20 00 00 00 ff
00 54 38 50 45 45 30 30 37 33 39 30 30 0a 01 00

02 03 21 f2 4d 9f 90 14 13 12 1e 16 01 04 05 07
03 0e 83 01 00 00 67 03 0c 00 10 00 38 2d e2 00
4f 02 3a 80 d0 72 38 2d 40 10 2c 45 80 09 25 21
00 00 1e 01 1d 80 d0 72 1c 16 20 10 2c 25 00 09
25 21 00 00 9e 01 1d 00 bc 52 d0 1e 20 b8 28 55
40 09 25 21 00 00 1e 8c 0a d0 90 20 40 31 20 0c
40 55 00 09 25 21 00 00 9e 02 3a 80 18 71 38 2d
40 58 2c 45 00 09 25 21 00 00 1e 00 00 1e 1e ff

00 ff ff ff ff ff ff 00 04 72 74 05 05 07 70 82
1b 1c 01 03 80 46 27 78 2a 4e c0 a6 55 50 9c 26
11 50 54 bf ef 00 d1 c0 b3 00 95 00 81 80 81 40
81 c0 01 01 01 01 02 3a 80 18 71 38 2d 40 58 2c
45 00 09 25 21 00 00 1e 00 00 00 fd 00 32 4c 1e
53 11 00 0a 20 20 20 20 20 20 00 00 00 fc 00 45
44 33 32 32 51 0a 20 20 20 20 20 20 00 00 00 ff
00 54 38 50 45 45 30 30 37 33 39 30 30 0a 01 00

02 03 21 f2 4d 9f 90 14 13 12 1e 16 01 04 05 07
03 0e 83 01 00 00 67 03 0c 00 10 00 38 2d e2 00
4f 02 3a 80 d0 72 38 2d 40 10 2c 45 80 09 25 21
00 00 1e 01 1d 80 d0 72 1c 16 20 10 2c 25 00 09
25 21 00 00 9e 01 1d 00 bc 52 d0 1e 20 b8 28 55
40 09 25 21 00 00 1e 8c 0a d0 90 20 40 31 20 0c
40 55 00 09 25 21 00 00 9e 02 3a 80 18 71 38 2d
40 58 2c 45 00 09 25 21 00 00 1e 00 00 1e 1e ff

----------------

Block 0, Base EDID:
  EDID Structure Version & Revision: 1.3
  Vendor & Product Identification:
    Manufacturer: ACR
    Model: 1396
    Serial Number: ...
    Made in: week 27 of 2018
  Basic Display Parameters & Features:
    Digital display
    Maximum image size: 70 cm x 39 cm
    Gamma: 2.20
    DPMS levels: Off
    RGB color display
    First detailed timing is the preferred timing
  Color Characteristics:
    Red  : 0.6494, 0.3320
    Green: 0.3154, 0.6113
    Blue : 0.1513, 0.0664
    White: 0.3125, 0.3281
  Established Timings I & II:
    IBM     :   720x400    70.081663 Hz   9:5     31.467 kHz     28.320000 MHz
    DMT 0x04:   640x480    59.940476 Hz   4:3     31.469 kHz     25.175000 MHz
    Apple   :   640x480    66.666667 Hz   4:3     35.000 kHz     30.240000 MHz
    DMT 0x05:   640x480    72.808802 Hz   4:3     37.861 kHz     31.500000 MHz
    DMT 0x06:   640x480    75.000000 Hz   4:3     37.500 kHz     31.500000 MHz
    DMT 0x08:   800x600    56.250000 Hz   4:3     35.156 kHz     36.000000 MHz
    DMT 0x09:   800x600    60.316541 Hz   4:3     37.879 kHz     40.000000 MHz
    DMT 0x0a:   800x600    72.187572 Hz   4:3     48.077 kHz     50.000000 MHz
    DMT 0x0b:   800x600    75.000000 Hz   4:3     46.875 kHz     49.500000 MHz
    Apple   :   832x624    74.551266 Hz   4:3     49.726 kHz     57.284000 MHz
    DMT 0x10:  1024x768    60.003840 Hz   4:3     48.363 kHz     65.000000 MHz
    DMT 0x11:  1024x768    70.069359 Hz   4:3     56.476 kHz     75.000000 MHz
    DMT 0x12:  1024x768    75.028582 Hz   4:3     60.023 kHz     78.750000 MHz
    DMT 0x24:  1280x1024   75.024675 Hz   5:4     79.976 kHz    135.000000 MHz
  Standard Timings:
    DMT 0x52:  1920x1080   60.000000 Hz  16:9     67.500 kHz    148.500000 MHz
    DMT 0x3a:  1680x1050   59.954250 Hz  16:10    65.290 kHz    146.250000 MHz
    DMT 0x2f:  1440x900    59.887445 Hz  16:10    55.935 kHz    106.500000 MHz
    DMT 0x23:  1280x1024   60.019740 Hz   5:4     63.981 kHz    108.000000 MHz
    DMT 0x20:  1280x960    60.000000 Hz   4:3     60.000 kHz    108.000000 MHz
    DMT 0x55:  1280x720    60.000000 Hz  16:9     45.000 kHz     74.250000 MHz
  Detailed Timing Descriptors:
    DTD 1:  1920x1080   60.000000 Hz  16:9     67.500 kHz    148.500000 MHz (521 mm x 293 mm)
                 Hfront   88 Hsync  44 Hback  148 Hpol P
                 Vfront    4 Vsync   5 Vback   36 Vpol P
    Display Range Limits:
      Monitor ranges (GTF): 50-76 Hz V, 30-83 kHz H, max dotclock 170 MHz
    Display Product Name: 'ED322Q'
    Display Product Serial Number: ...
  Extension blocks: 1
Checksum: 0x00

----------------

Block 1, CTA-861 Extension Block:
  Revision: 3
  Underscans IT Video Formats by default
  Basic audio support
  Supports YCbCr 4:4:4
  Supports YCbCr 4:2:2
  Native DTDs: 2
  Video Data Block:
    VIC  31:  1920x1080   50.000000 Hz  16:9     56.250 kHz    148.500000 MHz (native)
    VIC  16:  1920x1080   60.000000 Hz  16:9     67.500 kHz    148.500000 MHz (native)
    VIC  20:  1920x1080i  50.000000 Hz  16:9     28.125 kHz     74.250000 MHz
    VIC  19:  1280x720    50.000000 Hz  16:9     37.500 kHz     74.250000 MHz
    VIC  18:   720x576    50.000000 Hz  16:9     31.250 kHz     27.000000 MHz
    VIC  30:  1440x576    50.000000 Hz  16:9     31.250 kHz     54.000000 MHz
    VIC  22:  1440x576i   50.000000 Hz  16:9     15.625 kHz     27.000000 MHz
    VIC   1:   640x480    59.940476 Hz   4:3     31.469 kHz     25.175000 MHz
    VIC   4:  1280x720    60.000000 Hz  16:9     45.000 kHz     74.250000 MHz
    VIC   5:  1920x1080i  60.000000 Hz  16:9     33.750 kHz     74.250000 MHz
    VIC   7:  1440x480i   59.940060 Hz  16:9     15.734 kHz     27.000000 MHz
    VIC   3:   720x480    59.940060 Hz  16:9     31.469 kHz     27.000000 MHz
    VIC  14:  1440x480    59.940060 Hz   4:3     31.469 kHz     54.000000 MHz
  Speaker Allocation Data Block:
    FL/FR - Front Left/Right
  Vendor-Specific Data Block (HDMI), OUI 00-0C-03:
    Source physical address: 1.0.0.0
    DC_36bit
    DC_30bit
    DC_Y444
    Maximum TMDS clock: 225 MHz
  Video Capability Data Block:
    YCbCr quantization: No Data
    RGB quantization: Selectable (via AVI Q)
    PT scan behavior: No Data
    IT scan behavior: Supports both over- and underscan
    CE scan behavior: Supports both over- and underscan
  Detailed Timing Descriptors:
    DTD 2:  1920x1080   50.000000 Hz  16:9     56.250 kHz    148.500000 MHz (521 mm x 293 mm)
                 Hfront  528 Hsync  44 Hback  148 Hpol P
                 Vfront    4 Vsync   5 Vback   36 Vpol P
    DTD 3:  1920x1080i  50.000000 Hz  16:9     28.125 kHz     74.250000 MHz (521 mm x 293 mm)
                 Hfront   16 Hsync  44 Hback  660 Hpol P
                 Vfront    2 Vsync   5 Vback   15 Vpol P Vfront +0.5 Odd Field
                 Vfront    2 Vsync   5 Vback   15 Vpol P Vback  +0.5 Even Field
    DTD 4:  1280x720    50.000000 Hz  16:9     37.500 kHz     74.250000 MHz (521 mm x 293 mm)
                 Hfront  440 Hsync  40 Hback  220 Hpol P
                 Vfront    5 Vsync   5 Vback   20 Vpol P
    DTD 5:   720x1152i  49.960032 Hz   5:8     31.250 kHz     27.000000 MHz (521 mm x 293 mm)
                 Hfront   12 Hsync  64 Hback   68 Hpol P
                 Vfront    5 Vsync   5 Vback   39 Vpol P Vfront +0.5 Odd Field
                 Vfront    5 Vsync   5 Vback   39 Vpol P Vback  +0.5 Even Field
    DTD 6:  1920x1080   60.000000 Hz  16:9     67.500 kHz    148.500000 MHz (521 mm x 293 mm)
                 Hfront   88 Hsync  44 Hback  148 Hpol P
                 Vfront    4 Vsync   5 Vback   36 Vpol P
Checksum: 0xff  Unused space in Extension Block: 4 bytes

----------------

Warnings:

Block 1, CTA-861 Extension Block:
  Video Data Block: VIC 31 and the first DTD are not identical. Is this intended?
  Video Capability Data Block: Set Selectable YCbCr Quantization to avoid interop issues.
  Detailed Timing Descriptor #3: DTD is similar but not identical to VIC 20.
  Detailed Timing Descriptor #5: Image size is 521x293 mm, but based on the picture AR it should be 183x293 mm.
  Display Product Serial Number is set, so the Serial Number in the Base EDID should be 0.
  Add a Colorimetry Data Block with the sRGB colorimetry bit set to avoid interop issues.
EDID:
  Base EDID: Some timings are out of range of the Monitor Ranges:
    Horizontal Freq: 15.625 - 79.976 kHz (Monitor: 30.000 - 83.000 kHz)

Failures:

Block 0, Base EDID:
  Detailed Timing Descriptor #1: Mismatch of image size 521x293 mm vs display size 700x390 mm.
Block 1, CTA-861 Extension Block:
  Detailed Timing Descriptor #2: Mismatch of image size 521x293 mm vs display size 700x390 mm.
  Detailed Timing Descriptor #3: Mismatch of image size 521x293 mm vs display size 700x390 mm.
  Detailed Timing Descriptor #4: Mismatch of image size 521x293 mm vs display size 700x390 mm.
  Detailed Timing Descriptor #5: Mismatch of image size 521x293 mm vs display size 700x390 mm.
  Detailed Timing Descriptor #6: Mismatch of image size 521x293 mm vs display size 700x390 mm.
  Padding: Contains non-zero bytes.
EDID:
  Extension Block 2 started with EDID header, ignoring Extension Blocks >= 2.

EDID conformity: FAIL
