edid-decode (hex):

00 ff ff ff ff ff ff 00 13 2e 50 21 00 00 00 00
11 22 01 03 80 2f 1c 78 2a ca 75 a9 54 45 98 22
1f 50 54 a5 4b 00 71 40 81 c0 81 80 95 00 a9 c0
b3 00 90 40 01 01 02 3a 80 18 71 38 2d 40 58 2c
45 00 d6 18 11 00 00 1e 00 00 00 fd 00 30 64 1f
9f 1e 00 0a 20 20 20 20 20 20 00 00 00 fc 00 46
49 4e 47 45 52 53 20 32 31 35 30 0a 66 21 56 aa
51 00 1e 30 46 8f 33 00 ae ff 10 00 00 1e 01 3f

02 03 21 f1 45 40 02 04 10 1f 23 09 07 07 83 01
00 00 65 03 0c 00 10 00 68 1a 00 00 01 01 30 64
ed 2f 58 80 88 70 38 12 40 2c 16 45 00 d6 18 11
00 00 1e 7f 48 80 18 71 38 2d 40 30 28 55 00 d6
18 11 00 00 1e 00 00 00 00 00 00 00 00 00 00 00
00 00 00 00 00 00 00 00 00 00 00 00 00 00 00 00
00 00 00 00 00 00 00 00 00 00 00 00 00 00 00 00
00 00 00 00 00 00 00 00 00 00 00 00 00 00 00 7c

00 ff ff ff ff ff ff 00 13 2e 50 21 00 00 00 00
11 22 01 03 80 2f 1c 78 2a ca 75 a9 54 45 98 22
1f 50 54 a5 4b 00 71 40 81 c0 81 80 95 00 a9 c0
b3 00 90 40 01 01 02 3a 80 18 71 38 2d 40 58 2c
45 00 d6 18 11 00 00 1e 00 00 00 fd 00 30 64 1f
9f 1e 00 0a 20 20 20 20 20 20 00 00 00 fc 00 46
49 4e 47 45 52 53 20 32 31 35 30 0a 66 21 56 aa
51 00 1e 30 46 8f 33 00 ae ff 10 00 00 1e 01 3f

02 03 21 f1 45 40 02 04 10 1f 23 09 07 07 83 01
00 00 65 03 0c 00 10 00 68 1a 00 00 01 01 30 64
ed 2f 58 80 88 70 38 12 40 2c 16 45 00 d6 18 11
00 00 1e 7f 48 80 18 71 38 2d 40 30 28 55 00 d6
18 11 00 00 1e 00 00 00 00 00 00 00 00 00 00 00
00 00 00 00 00 00 00 00 00 00 00 00 00 00 00 00
00 00 00 00 00 00 00 00 00 00 00 00 00 00 00 00
00 00 00 00 00 00 00 00 00 00 00 00 00 00 00 7c

----------------

Block 0, Base EDID:
  EDID Structure Version & Revision: 1.3
  Vendor & Product Identification:
    Manufacturer: DYN
    Model: 8528
    Made in: week 17 of 2024
  Basic Display Parameters & Features:
    Digital display
    Maximum image size: 47 cm x 28 cm
    Gamma: 2.20
    DPMS levels: Off
    RGB color display
    First detailed timing is the preferred timing
  Color Characteristics:
    Red  : 0.6630, 0.3281
    Green: 0.2714, 0.5957
    Blue : 0.1337, 0.1240
    White: 0.3134, 0.3291
  Established Timings I & II:
    IBM     :   720x400    70.081663 Hz   9:5     31.467 kHz     28.320000 MHz
    DMT 0x04:   640x480    59.940476 Hz   4:3     31.469 kHz     25.175000 MHz
    DMT 0x06:   640x480    75.000000 Hz   4:3     37.500 kHz     31.500000 MHz
    DMT 0x09:   800x600    60.316541 Hz   4:3     37.879 kHz     40.000000 MHz
    DMT 0x0b:   800x600    75.000000 Hz   4:3     46.875 kHz     49.500000 MHz
    DMT 0x10:  1024x768    60.003840 Hz   4:3     48.363 kHz     65.000000 MHz
    DMT 0x12:  1024x768    75.028582 Hz   4:3     60.023 kHz     78.750000 MHz
    DMT 0x24:  1280x1024   75.024675 Hz   5:4     79.976 kHz    135.000000 MHz
  Standard Timings:
    GTF     :  1152x864    60.000000 Hz   4:3     53.700 kHz     81.624000 MHz
    DMT 0x55:  1280x720    60.000000 Hz  16:9     45.000 kHz     74.250000 MHz
    DMT 0x23:  1280x1024   60.019740 Hz   5:4     63.981 kHz    108.000000 MHz
    DMT 0x2f:  1440x900    59.887445 Hz  16:10    55.935 kHz    106.500000 MHz
    DMT 0x53:  1600x900    60.000000 Hz  16:9     60.000 kHz    108.000000 MHz (RB)
    DMT 0x3a:  1680x1050   59.954250 Hz  16:10    65.290 kHz    146.250000 MHz
    DMT 0x2a:  1400x1050   59.978442 Hz   4:3     65.317 kHz    121.750000 MHz
  Detailed Timing Descriptors:
    DTD 1:  1920x1080   60.000000 Hz  16:9     67.500 kHz    148.500000 MHz (470 mm x 280 mm)
                 Hfront   88 Hsync  44 Hback  148 Hpol P
                 Vfront    4 Vsync   5 Vback   36 Vpol P
    Display Range Limits:
      Monitor ranges (GTF): 48-100 Hz V, 31-159 kHz H, max dotclock 300 MHz
    Display Product Name: 'FINGERS 2150'
    DTD 2:  1366x768    59.789541 Hz 683:384   47.712 kHz     85.500000 MHz (430 mm x 255 mm)
                 Hfront   70 Hsync 143 Hback  213 Hpol P
                 Vfront    3 Vsync   3 Vback   24 Vpol P
  Extension blocks: 1
Checksum: 0x3f

----------------

Block 1, CTA-861 Extension Block:
  Revision: 3
  Underscans IT Video Formats by default
  Basic audio support
  Supports YCbCr 4:4:4
  Supports YCbCr 4:2:2
  Native DTDs: 1
  Video Data Block:
    VIC  64:  1920x1080  100.000000 Hz  16:9    112.500 kHz    297.000000 MHz
    VIC   2:   720x480    59.940060 Hz   4:3     31.469 kHz     27.000000 MHz
    VIC   4:  1280x720    60.000000 Hz  16:9     45.000 kHz     74.250000 MHz
    VIC  16:  1920x1080   60.000000 Hz  16:9     67.500 kHz    148.500000 MHz
    VIC  31:  1920x1080   50.000000 Hz  16:9     56.250 kHz    148.500000 MHz
  Audio Data Block:
    Linear PCM:
      Max channels: 2
      Supported sample rates (kHz): 48 44.1 32
      Supported sample sizes (bits): 24 20 16
  Speaker Allocation Data Block:
    FL/FR - Front Left/Right
  Vendor-Specific Data Block (HDMI), OUI 00-0C-03:
    Source physical address: 1.0.0.0
  Vendor-Specific Data Block (AMD), OUI 00-00-1A:
    Version: 1
    Feature Caps: 0x01
    Minimum Refresh Rate: 48 Hz
    Maximum Refresh Rate: 100 Hz
    Flags 1.x: 0xed (MCCS)
  Detailed Timing Descriptors:
    DTD 3:  1920x1080  100.000532 Hz  16:9    109.801 kHz    225.750000 MHz (470 mm x 280 mm)
                 Hfront   44 Hsync  22 Hback   70 Hpol P
                 Vfront    4 Vsync   5 Vback    9 Vpol P
    DTD 4:  1920x1080   74.985859 Hz  16:9     84.359 kHz    185.590000 MHz (470 mm x 280 mm)
                 Hfront   48 Hsync  40 Hback  192 Hpol P
                 Vfront    5 Vsync   5 Vback   35 Vpol P
Checksum: 0x7c  Unused space in Extension Block: 58 bytes

----------------

Warnings:

Block 0, Base EDID:
  Detailed Timing Descriptor #1: Image size is 470x280 mm, but based on the picture AR it should be 470x264 mm.
  Detailed Timing Descriptor #2: Image size is 430x255 mm, but based on the picture AR it should be 430x241 mm.
Block 1, CTA-861 Extension Block:
  Video Data Block: VIC 64 and the first DTD are not identical. Is this intended?
  Detailed Timing Descriptor #3: Image size is 470x280 mm, but based on the picture AR it should be 470x264 mm.
  Detailed Timing Descriptor #4: Image size is 470x280 mm, but based on the picture AR it should be 470x264 mm.
  Add a Colorimetry Data Block with the sRGB colorimetry bit set to avoid interop issues.

Failures:

Block 0, Base EDID:
  Detailed Timing Descriptor #2: Mismatch of image size 430x255 mm vs display size 470x280 mm.
  Detailed Timing Descriptor #2: Invalid detailed timing descriptor ordering.
Block 1, CTA-861 Extension Block:
  Missing VCDB, needed for Set Selectable RGB Quantization to avoid interop issues.
EDID:
  Extension Block 2 started with EDID header, ignoring Extension Blocks >= 2.

EDID conformity: FAIL
