edid-decode (hex):

00 ff ff ff ff ff ff 00 10 ac 1c d0 53 58 59 31
2c 12 01 03 80 33 1d 78 ea 18 55 a9 53 37 ad 25
13 50 54 a5 4b 00 71 4f 81 80 b3 00 01 01 01 01
01 01 01 01 01 01 3b 3d 00 a0 80 80 21 40 30 20
35 00 fe 22 11 00 00 1a 00 00 00 ff 00 55 37 38
33 46 38 41 54 31 59 58 53 0a 00 00 00 fd 00 38
55 1e 5c 11 00 0a 20 20 20 20 20 20 00 00 00 fc
00 44 45 4c 4c 20 53 50 32 33 30 39 57 0a 00 9f

00 ff ff ff ff ff ff 00 10 ac 1c d0 53 58 59 31
2c 12 01 03 80 33 1d 78 ea 18 55 a9 53 37 ad 25
13 50 54 a5 4b 00 71 4f 81 80 b3 00 01 01 01 01
01 01 01 01 01 01 3b 3d 00 a0 80 80 21 40 30 20
35 00 fe 22 11 00 00 1a 00 00 00 ff 00 55 37 38
33 46 38 41 54 31 59 58 53 0a 00 00 00 fd 00 38
55 1e 5c 11 00 0a 20 20 20 20 20 20 00 00 00 fc
00 44 45 4c 4c 20 53 50 32 33 30 39 57 0a 00 9f

----------------

Block 0, Base EDID:
  EDID Structure Version & Revision: 1.3
  Vendor & Product Identification:
    Manufacturer: DEL
    Model: 53276
    Serial Number: ...
    Made in: week 44 of 2008
  Basic Display Parameters & Features:
    Digital display
    Maximum image size: 51 cm x 29 cm
    Gamma: 2.20
    DPMS levels: Standby Suspend Off
    RGB color display
    First detailed timing is the preferred timing
  Color Characteristics:
    Red  : 0.6601, 0.3251
    Green: 0.2167, 0.6757
    Blue : 0.1455, 0.0751
    White: 0.3134, 0.3291
  Established Timings I & II:
    IBM     :   720x400    70.081663 Hz   9:5     31.467 kHz     28.320000 MHz
    DMT 0x04:   640x480    59.940476 Hz   4:3     31.469 kHz     25.175000 MHz
    DMT 0x06:   640x480    75.000000 Hz   4:3     37.500 kHz     31.500000 MHz
    DMT 0x09:   800x600    60.316541 Hz   4:3     37.879 kHz     40.000000 MHz
    DMT 0x0b:   800x600    75.000000 Hz   4:3     46.875 kHz     49.500000 MHz
    DMT 0x10:  1024x768    60.003840 Hz   4:3     48.363 kHz     65.000000 MHz
    DMT 0x12:  1024x768    75.028582 Hz   4:3     60.023 kHz     78.750000 MHz
    DMT 0x24:  1280x1024   75.024675 Hz   5:4     79.976 kHz    135.000000 MHz
  Standard Timings:
    DMT 0x15:  1152x864    75.000000 Hz   4:3     67.500 kHz    108.000000 MHz
    DMT 0x23:  1280x1024   60.019740 Hz   5:4     63.981 kHz    108.000000 MHz
    DMT 0x3a:  1680x1050   59.954250 Hz  16:10    65.290 kHz    146.250000 MHz
  Detailed Timing Descriptors:
    DTD 1:  2048x1152   59.908732 Hz  16:9     70.992 kHz    156.750000 MHz (510 mm x 290 mm)
                 Hfront   48 Hsync  32 Hback   80 Hpol P
                 Vfront    3 Vsync   5 Vback   25 Vpol N
    Display Product Serial Number: ...
    Display Range Limits:
      Monitor ranges (GTF): 56-85 Hz V, 30-92 kHz H, max dotclock 170 MHz
    Display Product Name: 'DELL SP2309W'
Checksum: 0x9f

----------------

Failures:

EDID:
  Extension Block 1 started with EDID header, ignoring Extension Blocks >= 1.

EDID conformity: FAIL
