edid-decode (hex):

00 ff ff ff ff ff ff 00 22 f0 94 30 01 01 01 01
10 18 01 03 80 32 1d 78 2e eb f5 a6 56 51 9c 26
10 50 54 a1 08 00 d1 c0 81 c0 81 80 95 00 a9 c0
b3 00 01 01 01 01 02 3a 80 18 71 38 2d 40 58 2c
45 00 f1 24 11 00 00 1e 00 00 00 fd 00 32 4c 18
5e 11 00 0a 20 20 20 20 20 20 00 00 00 fc 00 48
50 20 45 32 32 31 63 0a 20 20 20 20 00 00 00 ff
00 43 4e 4b 34 31 36 30 58 56 34 0a 20 20 01 a6

02 03 1b 61 23 09 07 07 83 01 00 00 67 03 0c 00
20 00 80 2d 43 90 84 02 e2 00 0f 8c 0a d0 8a 20
e0 2d 10 10 3e 96 00 a0 5a 00 00 00 00 00 00 00
00 00 00 00 00 00 00 00 00 00 00 00 00 00 00 00
00 00 00 00 00 00 00 00 00 00 00 00 00 00 00 00
00 00 00 00 00 00 00 00 00 00 00 00 00 00 00 00
00 00 00 00 00 00 00 00 00 00 00 00 00 00 00 00
00 00 00 00 00 00 00 00 00 00 00 00 00 00 00 29

00 ff ff ff ff ff ff 00 22 f0 94 30 01 01 01 01
10 18 01 03 80 32 1d 78 2e eb f5 a6 56 51 9c 26
10 50 54 a1 08 00 d1 c0 81 c0 81 80 95 00 a9 c0
b3 00 01 01 01 01 02 3a 80 18 71 38 2d 40 58 2c
45 00 f1 24 11 00 00 1e 00 00 00 fd 00 32 4c 18
5e 11 00 0a 20 20 20 20 20 20 00 00 00 fc 00 48
50 20 45 32 32 31 63 0a 20 20 20 20 00 00 00 ff
00 43 4e 4b 34 31 36 30 58 56 34 0a 20 20 01 a6

02 03 1b 61 23 09 07 07 83 01 00 00 67 03 0c 00
20 00 80 2d 43 90 84 02 e2 00 0f 8c 0a d0 8a 20
e0 2d 10 10 3e 96 00 a0 5a 00 00 00 00 00 00 00
00 00 00 00 00 00 00 00 00 00 00 00 00 00 00 00
00 00 00 00 00 00 00 00 00 00 00 00 00 00 00 00
00 00 00 00 00 00 00 00 00 00 00 00 00 00 00 00
00 00 00 00 00 00 00 00 00 00 00 00 00 00 00 00
00 00 00 00 00 00 00 00 00 00 00 00 00 00 00 29

----------------

Block 0, Base EDID:
  EDID Structure Version & Revision: 1.3
  Vendor & Product Identification:
    Manufacturer: HWP
    Model: 12436
    Serial Number: ...
    Made in: week 16 of 2014
  Basic Display Parameters & Features:
    Digital display
    Maximum image size: 50 cm x 29 cm
    Gamma: 2.20
    DPMS levels: Off
    RGB color display
    Default (sRGB) color space is primary color space
    First detailed timing is the preferred timing
  Color Characteristics:
    Red  : 0.6513, 0.3378
    Green: 0.3183, 0.6123
    Blue : 0.1513, 0.0654
    White: 0.3134, 0.3291
  Established Timings I & II:
    IBM     :   720x400    70.081663 Hz   9:5     31.467 kHz     28.320000 MHz
    DMT 0x04:   640x480    59.940476 Hz   4:3     31.469 kHz     25.175000 MHz
    DMT 0x09:   800x600    60.316541 Hz   4:3     37.879 kHz     40.000000 MHz
    DMT 0x10:  1024x768    60.003840 Hz   4:3     48.363 kHz     65.000000 MHz
  Standard Timings:
    DMT 0x52:  1920x1080   60.000000 Hz  16:9     67.500 kHz    148.500000 MHz
    DMT 0x55:  1280x720    60.000000 Hz  16:9     45.000 kHz     74.250000 MHz
    DMT 0x23:  1280x1024   60.019740 Hz   5:4     63.981 kHz    108.000000 MHz
    DMT 0x2f:  1440x900    59.887445 Hz  16:10    55.935 kHz    106.500000 MHz
    DMT 0x53:  1600x900    60.000000 Hz  16:9     60.000 kHz    108.000000 MHz (RB)
    DMT 0x3a:  1680x1050   59.954250 Hz  16:10    65.290 kHz    146.250000 MHz
  Detailed Timing Descriptors:
    DTD 1:  1920x1080   60.000000 Hz  16:9     67.500 kHz    148.500000 MHz (497 mm x 292 mm)
                 Hfront   88 Hsync  44 Hback  148 Hpol P
                 Vfront    4 Vsync   5 Vback   36 Vpol P
    Display Range Limits:
      Monitor ranges (GTF): 50-76 Hz V, 24-94 kHz H, max dotclock 170 MHz
    Display Product Name: 'HP E221c'
    Display Product Serial Number: ...
  Extension blocks: 1
Checksum: 0xa6

----------------

Block 1, CTA-861 Extension Block:
  Revision: 3
  Basic audio support
  Supports YCbCr 4:4:4
  Native DTDs: 1
  Audio Data Block:
    Linear PCM:
      Max channels: 2
      Supported sample rates (kHz): 48 44.1 32
      Supported sample sizes (bits): 24 20 16
  Speaker Allocation Data Block:
    FL/FR - Front Left/Right
  Vendor-Specific Data Block (HDMI), OUI 00-0C-03:
    Source physical address: 2.0.0.0
    Supports_AI
    Maximum TMDS clock: 225 MHz
  Video Data Block:
    VIC  16:  1920x1080   60.000000 Hz  16:9     67.500 kHz    148.500000 MHz (native)
    VIC   4:  1280x720    60.000000 Hz  16:9     45.000 kHz     74.250000 MHz (native)
    VIC   2:   720x480    59.940060 Hz   4:3     31.469 kHz     27.000000 MHz
  Video Capability Data Block:
    YCbCr quantization: No Data
    RGB quantization: No Data
    PT scan behavior: No Data
    IT scan behavior: Supports both over- and underscan
    CE scan behavior: Supports both over- and underscan
  Detailed Timing Descriptors:
    DTD 2:   720x480    59.940060 Hz   3:2     31.469 kHz     27.000000 MHz (analog composite, sync-on-green, 160 mm x 90 mm)
                 Hfront   16 Hsync  62 Hback   60 Hpol N
                 Vfront    9 Vsync   6 Vback   30 Vpol N
Checksum: 0x29  Unused space in Extension Block: 82 bytes

----------------

Warnings:

Block 0, Base EDID:
  Vendor & Product Identification: The serial number is one of the known dummy values, it should probably be set to 0.
  Detailed Timing Descriptor #1: Image size is 497x292 mm, but based on the picture AR it should be 497x279 mm.
Block 1, CTA-861 Extension Block:
  IT Video Formats are overscanned by default, but normally this should be underscanned.
  Video Capability Data Block: Set Selectable YCbCr Quantization to avoid interop issues.
  Detailed Timing Descriptor #2: Dubious image size (160x90 mm is smaller than 100x100 mm).
  Display Product Serial Number is set, so the Serial Number in the Base EDID should be 0.

Failures:

Block 0, Base EDID:
  Basic Display Parameters & Features: sRGB is signaled, but the chromaticities do not match.
Block 1, CTA-861 Extension Block:
  Video Capability Data Block: Set Selectable RGB Quantization to avoid interop issues.
  Detailed Timing Descriptor #2: Mismatch of image size 160x90 mm vs display size 500x290 mm.
EDID:
  Extension Block 2 started with EDID header, ignoring Extension Blocks >= 2.
  CTA-861: Native progressive timings are a mix of several resolutions.

EDID conformity: FAIL
