edid-decode (hex):

00 ff ff ff ff ff ff 00 38 a3 d9 2d 00 00 00 00
05 1f 01 04 b5 3c 22 78 e2 28 95 a7 55 4e a3 26
0f 50 54 bf ef 80 81 c0 81 00 81 80 90 40 95 00
a9 40 b3 00 d1 c0 4d d0 00 a0 f0 70 3e 80 30 20
35 00 55 50 21 00 00 1a 00 00 00 fd 00 1e 4c 1f
8c 36 00 0a 20 20 20 20 20 20 00 00 00 fc 00 45
41 32 37 31 55 0a 20 20 20 20 20 20 00 00 00 ff
00 31 32 35 30 31 35 35 39 4e 42 0a 20 20 01 86

02 03 1c c1 4c 01 02 03 11 12 04 13 90 1f 5f 60
61 23 09 07 07 83 01 00 00 e2 00 40 0e 1f 00 80
51 00 1e 30 40 80 37 00 55 50 21 00 00 1c 66 21
50 b0 51 00 1b 30 40 70 36 00 55 50 21 00 00 1e
66 21 56 aa 51 00 1e 30 46 8f 33 00 55 50 21 00
00 1e 4d 6c 80 a0 70 70 3e 80 30 20 3a 00 55 50
21 00 00 1a a3 66 00 a0 f0 70 1f 80 30 20 35 00
55 50 21 00 00 1a 00 00 00 00 00 00 00 00 00 d1

00 ff ff ff ff ff ff 00 38 a3 d9 2d 00 00 00 00
05 1f 01 04 b5 3c 22 78 e2 28 95 a7 55 4e a3 26
0f 50 54 bf ef 80 81 c0 81 00 81 80 90 40 95 00
a9 40 b3 00 d1 c0 4d d0 00 a0 f0 70 3e 80 30 20
35 00 55 50 21 00 00 1a 00 00 00 fd 00 1e 4c 1f
8c 36 00 0a 20 20 20 20 20 20 00 00 00 fc 00 45
41 32 37 31 55 0a 20 20 20 20 20 20 00 00 00 ff
00 31 32 35 30 31 35 35 39 4e 42 0a 20 20 01 86

02 03 1c c1 4c 01 02 03 11 12 04 13 90 1f 5f 60
61 23 09 07 07 83 01 00 00 e2 00 40 0e 1f 00 80
51 00 1e 30 40 80 37 00 55 50 21 00 00 1c 66 21
50 b0 51 00 1b 30 40 70 36 00 55 50 21 00 00 1e
66 21 56 aa 51 00 1e 30 46 8f 33 00 55 50 21 00
00 1e 4d 6c 80 a0 70 70 3e 80 30 20 3a 00 55 50
21 00 00 1a a3 66 00 a0 f0 70 1f 80 30 20 35 00
55 50 21 00 00 1a 00 00 00 00 00 00 00 00 00 d1

----------------

Block 0, Base EDID:
  EDID Structure Version & Revision: 1.4
  Vendor & Product Identification:
    Manufacturer: NEC
    Model: 11737
    Made in: week 5 of 2021
  Basic Display Parameters & Features:
    Digital display
    Bits per primary color channel: 10
    DisplayPort interface
    Maximum image size: 60 cm x 34 cm
    Gamma: 2.20
    DPMS levels: Standby Suspend Off
    Supported color formats: RGB 4:4:4
    First detailed timing includes the native pixel format and preferred refresh rate
  Color Characteristics:
    Red  : 0.6523, 0.3339
    Green: 0.3066, 0.6367
    Blue : 0.1503, 0.0595
    White: 0.3134, 0.3291
  Established Timings I & II:
    IBM     :   720x400    70.081663 Hz   9:5     31.467 kHz     28.320000 MHz
    DMT 0x04:   640x480    59.940476 Hz   4:3     31.469 kHz     25.175000 MHz
    Apple   :   640x480    66.666667 Hz   4:3     35.000 kHz     30.240000 MHz
    DMT 0x05:   640x480    72.808802 Hz   4:3     37.861 kHz     31.500000 MHz
    DMT 0x06:   640x480    75.000000 Hz   4:3     37.500 kHz     31.500000 MHz
    DMT 0x08:   800x600    56.250000 Hz   4:3     35.156 kHz     36.000000 MHz
    DMT 0x09:   800x600    60.316541 Hz   4:3     37.879 kHz     40.000000 MHz
    DMT 0x0a:   800x600    72.187572 Hz   4:3     48.077 kHz     50.000000 MHz
    DMT 0x0b:   800x600    75.000000 Hz   4:3     46.875 kHz     49.500000 MHz
    Apple   :   832x624    74.551266 Hz   4:3     49.726 kHz     57.284000 MHz
    DMT 0x10:  1024x768    60.003840 Hz   4:3     48.363 kHz     65.000000 MHz
    DMT 0x11:  1024x768    70.069359 Hz   4:3     56.476 kHz     75.000000 MHz
    DMT 0x12:  1024x768    75.028582 Hz   4:3     60.023 kHz     78.750000 MHz
    DMT 0x24:  1280x1024   75.024675 Hz   5:4     79.976 kHz    135.000000 MHz
    Apple   :  1152x870    75.061550 Hz 192:145   68.681 kHz    100.000000 MHz
  Standard Timings:
    DMT 0x55:  1280x720    60.000000 Hz  16:9     45.000 kHz     74.250000 MHz
    DMT 0x1c:  1280x800    59.810326 Hz  16:10    49.702 kHz     83.500000 MHz
    DMT 0x23:  1280x1024   60.019740 Hz   5:4     63.981 kHz    108.000000 MHz
    DMT 0x2a:  1400x1050   59.978442 Hz   4:3     65.317 kHz    121.750000 MHz
    DMT 0x2f:  1440x900    59.887445 Hz  16:10    55.935 kHz    106.500000 MHz
    DMT 0x33:  1600x1200   60.000000 Hz   4:3     75.000 kHz    162.000000 MHz
    DMT 0x3a:  1680x1050   59.954250 Hz  16:10    65.290 kHz    146.250000 MHz
    DMT 0x52:  1920x1080   60.000000 Hz  16:9     67.500 kHz    148.500000 MHz
  Detailed Timing Descriptors:
    DTD 1:  3840x2160   59.996625 Hz  16:9    133.312 kHz    533.250000 MHz (597 mm x 336 mm)
                 Hfront   48 Hsync  32 Hback   80 Hpol P
                 Vfront    3 Vsync   5 Vback   54 Vpol N
    Display Range Limits:
      Monitor ranges (GTF): 30-76 Hz V, 31-140 kHz H, max dotclock 540 MHz
    Display Product Name: 'EA271U'
    Display Product Serial Number: ...
  Extension blocks: 1
Checksum: 0x86

----------------

Block 1, CTA-861 Extension Block:
  Revision: 3
  Underscans IT Video Formats by default
  Basic audio support
  Native DTDs: 1
  Video Data Block:
    VIC   1:   640x480    59.940476 Hz   4:3     31.469 kHz     25.175000 MHz
    VIC   2:   720x480    59.940060 Hz   4:3     31.469 kHz     27.000000 MHz
    VIC   3:   720x480    59.940060 Hz  16:9     31.469 kHz     27.000000 MHz
    VIC  17:   720x576    50.000000 Hz   4:3     31.250 kHz     27.000000 MHz
    VIC  18:   720x576    50.000000 Hz  16:9     31.250 kHz     27.000000 MHz
    VIC   4:  1280x720    60.000000 Hz  16:9     45.000 kHz     74.250000 MHz
    VIC  19:  1280x720    50.000000 Hz  16:9     37.500 kHz     74.250000 MHz
    VIC  16:  1920x1080   60.000000 Hz  16:9     67.500 kHz    148.500000 MHz (native)
    VIC  31:  1920x1080   50.000000 Hz  16:9     56.250 kHz    148.500000 MHz
    VIC  95:  3840x2160   30.000000 Hz  16:9     67.500 kHz    297.000000 MHz
    VIC  96:  3840x2160   50.000000 Hz  16:9    112.500 kHz    594.000000 MHz
    VIC  97:  3840x2160   60.000000 Hz  16:9    135.000 kHz    594.000000 MHz
  Audio Data Block:
    Linear PCM:
      Max channels: 2
      Supported sample rates (kHz): 48 44.1 32
      Supported sample sizes (bits): 24 20 16
  Speaker Allocation Data Block:
    FL/FR - Front Left/Right
  Video Capability Data Block:
    YCbCr quantization: No Data
    RGB quantization: Selectable (via AVI Q)
    PT scan behavior: No Data
    IT scan behavior: IT video formats not supported
    CE scan behavior: CE video formats not supported
  Detailed Timing Descriptors:
    DTD 2:  1280x768    59.870228 Hz   5:3     47.776 kHz     79.500000 MHz (597 mm x 336 mm)
                 Hfront   64 Hsync 128 Hback  192 Hpol N
                 Vfront    3 Vsync   7 Vback   20 Vpol P
    DTD 3:  1360x768    60.015162 Hz  85:48    47.712 kHz     85.500000 MHz (597 mm x 336 mm)
                 Hfront   64 Hsync 112 Hback  256 Hpol P
                 Vfront    3 Vsync   6 Vback   18 Vpol P
    DTD 4:  1366x768    59.789541 Hz 683:384   47.712 kHz     85.500000 MHz (597 mm x 336 mm)
                 Hfront   70 Hsync 143 Hback  213 Hpol P
                 Vfront    3 Vsync   3 Vback   24 Vpol P
    DTD 5:  1920x2160   59.987970 Hz   8:9    133.293 kHz    277.250000 MHz (597 mm x 336 mm)
                 Hfront   48 Hsync  32 Hback   80 Hpol P
                 Vfront    3 Vsync  10 Vback   49 Vpol N
    DTD 6:  3840x2160   29.980602 Hz  16:9     65.688 kHz    262.750000 MHz (597 mm x 336 mm)
                 Hfront   48 Hsync  32 Hback   80 Hpol P
                 Vfront    3 Vsync   5 Vback   23 Vpol N
Checksum: 0xd1  Unused space in Extension Block: 9 bytes

----------------

Warnings:

Block 0, Base EDID:
  Display Range Limits: GTF support is deprecated in EDID 1.4.
Block 1, CTA-861 Extension Block:
  Video Data Block: VIC 1 and the first DTD are not identical. Is this intended?
  Video Capability Data Block: IT scan behavior is expected to support underscanned.
  Video Capability Data Block: 'CE video formats not supported' makes no sense.
  Detailed Timing Descriptor #2: Image size is 597x336 mm, but based on the picture AR it should be 560x336 mm.
  Detailed Timing Descriptor #5: Image size is 597x336 mm, but based on the picture AR it should be 298x336 mm.
  Add a Colorimetry Data Block with the sRGB colorimetry bit set to avoid interop issues.
EDID:
  Base EDID: Some timings are out of range of the Monitor Ranges:
    Maximum Clock: 594.000 MHz (Monitor: 540.000 MHz)

Failures:

Block 0, Base EDID:
  Display Range Limits: GTF is supported, but the display does not support continuous frequencies.
EDID:
  Extension Block 2 started with EDID header, ignoring Extension Blocks >= 2.
  CTA-861: Native progressive timings are a mix of several resolutions.

EDID conformity: FAIL
