edid-decode (hex):

00 ff ff ff ff ff ff 00 4c f4 b6 6d 00 00 00 00
29 1e 01 03 80 24 19 78 3e 64 35 a5 54 4f 9e 27
12 50 54 21 08 00 d1 c0 d1 c0 d1 c0 95 00 90 40
81 80 81 40 81 c0 02 3a 80 18 71 38 2d 40 58 2c
25 00 7f d7 10 00 00 1a 00 00 00 fc 00 4d 44 53
2d 31 37 33 46 30 31 0a 20 20 00 00 00 ff 00 31
38 32 35 30 30 32 33 0a 20 20 20 20 00 00 00 fd
00 30 3c 1e 54 13 00 0a 20 20 20 20 20 20 01 c2

02 03 3a f1 43 10 04 05 23 09 07 07 83 01 00 00
67 03 0c 00 10 00 38 44 67 d8 5d c4 01 44 80 01
68 1a 00 00 01 09 30 3c e6 e5 0f 00 00 06 00 e3
05 c0 00 e6 06 05 01 59 59 49 02 3a 80 18 71 38
2d 40 58 2c 4a 00 80 d6 10 00 00 1a 00 00 00 00
00 00 00 00 00 00 00 00 00 00 00 00 00 00 00 00
00 00 00 00 00 00 00 00 00 00 00 00 00 00 00 00
00 00 00 00 00 00 00 00 00 00 00 00 00 00 00 e9

00 ff ff ff ff ff ff 00 4c f4 b6 6d 00 00 00 00
29 1e 01 03 80 24 19 78 3e 64 35 a5 54 4f 9e 27
12 50 54 21 08 00 d1 c0 d1 c0 d1 c0 95 00 90 40
81 80 81 40 81 c0 02 3a 80 18 71 38 2d 40 58 2c
25 00 7f d7 10 00 00 1a 00 00 00 fc 00 4d 44 53
2d 31 37 33 46 30 31 0a 20 20 00 00 00 ff 00 31
38 32 35 30 30 32 33 0a 20 20 20 20 00 00 00 fd
00 30 3c 1e 54 13 00 0a 20 20 20 20 20 20 01 c2

02 03 3a f1 43 10 04 05 23 09 07 07 83 01 00 00
67 03 0c 00 10 00 38 44 67 d8 5d c4 01 44 80 01
68 1a 00 00 01 09 30 3c e6 e5 0f 00 00 06 00 e3
05 c0 00 e6 06 05 01 59 59 49 02 3a 80 18 71 38
2d 40 58 2c 4a 00 80 d6 10 00 00 1a 00 00 00 00
00 00 00 00 00 00 00 00 00 00 00 00 00 00 00 00
00 00 00 00 00 00 00 00 00 00 00 00 00 00 00 00
00 00 00 00 00 00 00 00 00 00 00 00 00 00 00 e9

----------------

Block 0, Base EDID:
  EDID Structure Version & Revision: 1.3
  Vendor & Product Identification:
    Manufacturer: SGT
    Model: 28086
    Made in: week 41 of 2020
  Basic Display Parameters & Features:
    Digital display
    Maximum image size: 36 cm x 25 cm
    Gamma: 2.20
    DPMS levels: Off
    Undefined display color type
    Default (sRGB) color space is primary color space
    First detailed timing is the preferred timing
  Color Characteristics:
    Red  : 0.6455, 0.3300
    Green: 0.3095, 0.6171
    Blue : 0.1523, 0.0732
    White: 0.3134, 0.3291
  Established Timings I & II:
    DMT 0x04:   640x480    59.940476 Hz   4:3     31.469 kHz     25.175000 MHz
    DMT 0x09:   800x600    60.316541 Hz   4:3     37.879 kHz     40.000000 MHz
    DMT 0x10:  1024x768    60.003840 Hz   4:3     48.363 kHz     65.000000 MHz
  Standard Timings:
    DMT 0x52:  1920x1080   60.000000 Hz  16:9     67.500 kHz    148.500000 MHz
    DMT 0x52:  1920x1080   60.000000 Hz  16:9     67.500 kHz    148.500000 MHz
    DMT 0x52:  1920x1080   60.000000 Hz  16:9     67.500 kHz    148.500000 MHz
    DMT 0x2f:  1440x900    59.887445 Hz  16:10    55.935 kHz    106.500000 MHz
    DMT 0x2a:  1400x1050   59.978442 Hz   4:3     65.317 kHz    121.750000 MHz
    DMT 0x23:  1280x1024   60.019740 Hz   5:4     63.981 kHz    108.000000 MHz
    DMT 0x20:  1280x960    60.000000 Hz   4:3     60.000 kHz    108.000000 MHz
    DMT 0x55:  1280x720    60.000000 Hz  16:9     45.000 kHz     74.250000 MHz
  Detailed Timing Descriptors:
    DTD 1:  1920x1080   60.000000 Hz  16:9     67.500 kHz    148.500000 MHz (383 mm x 215 mm)
                 Hfront   88 Hsync  44 Hback  148 Hpol P
                 Vfront    2 Vsync   5 Vback   38 Vpol N
    Display Product Name: 'MDS-173F01'
    Display Product Serial Number: ...
    Display Range Limits:
      Monitor ranges (GTF): 48-60 Hz V, 30-84 kHz H, max dotclock 190 MHz
  Extension blocks: 1
Checksum: 0xc2

----------------

Block 1, CTA-861 Extension Block:
  Revision: 3
  Underscans IT Video Formats by default
  Basic audio support
  Supports YCbCr 4:4:4
  Supports YCbCr 4:2:2
  Native DTDs: 1
  Video Data Block:
    VIC  16:  1920x1080   60.000000 Hz  16:9     67.500 kHz    148.500000 MHz
    VIC   4:  1280x720    60.000000 Hz  16:9     45.000 kHz     74.250000 MHz
    VIC   5:  1920x1080i  60.000000 Hz  16:9     33.750 kHz     74.250000 MHz
  Audio Data Block:
    Linear PCM:
      Max channels: 2
      Supported sample rates (kHz): 48 44.1 32
      Supported sample sizes (bits): 24 20 16
  Speaker Allocation Data Block:
    FL/FR - Front Left/Right
  Vendor-Specific Data Block (HDMI), OUI 00-0C-03:
    Source physical address: 1.0.0.0
    DC_36bit
    DC_30bit
    DC_Y444
    Maximum TMDS clock: 340 MHz
  Vendor-Specific Data Block (HDMI Forum), OUI C4-5D-D8:
    Version: 1
    Maximum TMDS Character Rate: 340 MHz
    SCDC Present
    Supports 10-bits/component Deep Color 4:2:0 Pixel Encoding
  Vendor-Specific Data Block (AMD), OUI 00-00-1A:
    Version: 1
    Flags 1: 0x09
      FreeSync Supported
    Minimum Refresh Rate: 48 Hz
    Maximum Refresh Rate: 60 Hz
    MCCS VCP Code: 0xe6
  YCbCr 4:2:0 Capability Map Data Block:
    SVD Index 18 is out of range
    SVD Index 19 is out of range
  Colorimetry Data Block:
    BT2020YCC
    BT2020RGB
  HDR Static Metadata Data Block:
    Electro optical transfer functions:
      Traditional gamma - SDR luminance range
      SMPTE ST2084
    Supported static metadata descriptors:
      Static metadata type 1
    Desired content max luminance: 89 (343.724 cd/m^2)
    Desired content max frame-average luminance: 89 (343.724 cd/m^2)
    Desired content min luminance: 73 (0.282 cd/m^2)
  Detailed Timing Descriptors:
    DTD 2:  1920x1080   60.000000 Hz  16:9     67.500 kHz    148.500000 MHz (384 mm x 214 mm)
                 Hfront   88 Hsync  44 Hback  148 Hpol P
                 Vfront    4 Vsync  10 Vback   31 Vpol N
Checksum: 0xe9  Unused space in Extension Block: 51 bytes

----------------

Warnings:

Block 0, Base EDID:
  Detailed Timing Descriptor #1: DTD is similar but not identical to VIC 16.
Block 1, CTA-861 Extension Block:
  Video Data Block: VIC 16 and the first DTD are not identical. Is this intended?
  Detailed Timing Descriptor #2: DTD is similar but not identical to VIC 16.

Failures:

Block 0, Base EDID:
  Basic Display Parameters & Features: sRGB is signaled, but the chromaticities do not match.
  Detailed Timing Descriptor #1: Mismatch of image size 383x215 mm vs display size 360x250 mm.
Block 1, CTA-861 Extension Block:
  Vendor-Specific Data Block (HDMI Forum), OUI C4-5D-D8: Max TMDS rate is > 0 and <= 340 or > 600.
  YCbCr 4:2:0 Capability Map Data Block: Max index 19 > 3 (#SVDs).
  Detailed Timing Descriptor #2: Mismatch of image size 384x214 mm vs display size 360x250 mm.
  Missing VCDB, needed for Set Selectable RGB Quantization to avoid interop issues.
EDID:
  Extension Block 2 started with EDID header, ignoring Extension Blocks >= 2.
  Base EDID: The DTD max image size is 384x215mm, which is larger than the display size 360.0x250.0mm.

EDID conformity: FAIL
