edid-decode (hex):

00 ff ff ff ff ff ff 00 0d ae 90 13 00 00 00 00
10 1c 01 04 a5 1d 11 78 02 ee 95 a3 54 4c 99 26
0f 50 54 00 00 00 01 01 01 01 01 01 01 01 01 01
01 01 01 01 01 01 b4 3b 80 4a 71 38 34 40 30 20
35 00 25 a5 10 00 00 1a b4 3b 80 4a 71 38 4f 41
30 20 35 00 25 a5 10 00 00 1a 00 00 00 fe 00 4d
46 39 35 46 80 31 33 33 48 43 47 0a 00 00 00 00
00 01 41 01 9e 00 10 00 00 0a 01 0a 20 20 00 aa

----------------

Block 0, Base EDID:
  EDID Structure Version & Revision: 1.4
  Vendor & Product Identification:
    Manufacturer: CMN
    Model: 5008
    Made in: week 16 of 2018
  Basic Display Parameters & Features:
    Digital display
    Bits per primary color channel: 8
    DisplayPort interface
    Maximum image size: 29 cm x 17 cm
    Gamma: 2.20
    Supported color formats: RGB 4:4:4
    First detailed timing includes the native pixel format and preferred refresh rate
  Color Characteristics:
    Red  : 0.6396, 0.3300
    Green: 0.2998, 0.5996
    Blue : 0.1503, 0.0595
    White: 0.3134, 0.3291
  Established Timings I & II: none
  Standard Timings: none
  Detailed Timing Descriptors:
    DTD 1:  1920x1080   60.007852 Hz  16:9     67.929 kHz    152.840000 MHz (293 mm x 165 mm)
                 Hfront   48 Hsync  32 Hback  250 Hpol P
                 Vfront    3 Vsync   5 Vback   44 Vpol N
    DTD 2:  1920x1080   48.006282 Hz  16:9     67.929 kHz    152.840000 MHz (293 mm x 165 mm)
                 Hfront   48 Hsync  32 Hback  250 Hpol P
                 Vfront    3 Vsync   5 Vback  327 Vpol N
    Alphanumeric Data String: 'MF95F.133HCG'
    Manufacturer-Specified Display Descriptor (0x00): 00 00 00 01 41 01 9e 00 10 00 00 0a 01 0a 20 20 '....A.........  '
Checksum: 0xaa

----------------

Warnings:

Block 0, Base EDID:
  Alphanumeric Data String: Non-ASCII character 0x80 at position 5, can cause problems.
  Missing Display Product Name.

EDID conformity: PASS
