edid-decode (hex):

00 ff ff ff ff ff ff 00 22 f0 4a 33 01 01 01 01
06 1b 01 03 80 34 1d 78 ea 7f 15 a3 54 51 9f 27
0c 50 54 a1 08 00 d1 c0 81 c0 a9 c0 b3 00 95 00
81 80 81 00 01 01 02 3a 80 18 71 38 2d 40 58 2c
45 00 08 22 21 00 00 1e 00 00 00 fd 00 32 3c 1e
50 11 00 0a 20 20 20 20 20 20 00 00 00 fc 00 48
50 20 56 32 32 33 0a 20 20 20 20 20 00 00 00 ff
00 33 43 51 37 30 36 30 34 5a 31 0a 20 20 01 61

02 03 12 00 65 03 0c 00 10 00 47 01 03 12 04 13
10 1f 00 00 00 00 00 00 00 00 00 00 00 00 00 00
00 00 00 00 00 00 00 00 00 00 00 00 00 00 00 00
00 00 00 00 00 00 00 00 00 00 00 00 00 00 00 00
00 00 00 00 00 00 00 00 00 00 00 00 00 00 00 00
00 00 00 00 00 00 00 00 00 00 00 00 00 00 00 00
00 00 00 00 00 00 00 00 00 00 00 00 00 00 00 00
00 00 00 00 00 00 00 00 00 00 00 00 00 00 00 c2

00 ff ff ff ff ff ff 00 22 f0 4a 33 01 01 01 01
06 1b 01 03 80 34 1d 78 ea 7f 15 a3 54 51 9f 27
0c 50 54 a1 08 00 d1 c0 81 c0 a9 c0 b3 00 95 00
81 80 81 00 01 01 02 3a 80 18 71 38 2d 40 58 2c
45 00 08 22 21 00 00 1e 00 00 00 fd 00 32 3c 1e
50 11 00 0a 20 20 20 20 20 20 00 00 00 fc 00 48
50 20 56 32 32 33 0a 20 20 20 20 20 00 00 00 ff
00 33 43 51 37 30 36 30 34 5a 31 0a 20 20 01 61

02 03 12 00 65 03 0c 00 10 00 47 01 03 12 04 13
10 1f 00 00 00 00 00 00 00 00 00 00 00 00 00 00
00 00 00 00 00 00 00 00 00 00 00 00 00 00 00 00
00 00 00 00 00 00 00 00 00 00 00 00 00 00 00 00
00 00 00 00 00 00 00 00 00 00 00 00 00 00 00 00
00 00 00 00 00 00 00 00 00 00 00 00 00 00 00 00
00 00 00 00 00 00 00 00 00 00 00 00 00 00 00 00
00 00 00 00 00 00 00 00 00 00 00 00 00 00 00 c2

----------------

Block 0, Base EDID:
  EDID Structure Version & Revision: 1.3
  Vendor & Product Identification:
    Manufacturer: HWP
    Model: 13130
    Serial Number: ...
    Made in: week 6 of 2017
  Basic Display Parameters & Features:
    Digital display
    Maximum image size: 52 cm x 29 cm
    Gamma: 2.20
    DPMS levels: Standby Suspend Off
    RGB color display
    First detailed timing is the preferred timing
  Color Characteristics:
    Red  : 0.6376, 0.3310
    Green: 0.3193, 0.6240
    Blue : 0.1523, 0.0478
    White: 0.3134, 0.3291
  Established Timings I & II:
    IBM     :   720x400    70.081663 Hz   9:5     31.467 kHz     28.320000 MHz
    DMT 0x04:   640x480    59.940476 Hz   4:3     31.469 kHz     25.175000 MHz
    DMT 0x09:   800x600    60.316541 Hz   4:3     37.879 kHz     40.000000 MHz
    DMT 0x10:  1024x768    60.003840 Hz   4:3     48.363 kHz     65.000000 MHz
  Standard Timings:
    DMT 0x52:  1920x1080   60.000000 Hz  16:9     67.500 kHz    148.500000 MHz
    DMT 0x55:  1280x720    60.000000 Hz  16:9     45.000 kHz     74.250000 MHz
    DMT 0x53:  1600x900    60.000000 Hz  16:9     60.000 kHz    108.000000 MHz (RB)
    DMT 0x3a:  1680x1050   59.954250 Hz  16:10    65.290 kHz    146.250000 MHz
    DMT 0x2f:  1440x900    59.887445 Hz  16:10    55.935 kHz    106.500000 MHz
    DMT 0x23:  1280x1024   60.019740 Hz   5:4     63.981 kHz    108.000000 MHz
    DMT 0x1c:  1280x800    59.810326 Hz  16:10    49.702 kHz     83.500000 MHz
  Detailed Timing Descriptors:
    DTD 1:  1920x1080   60.000000 Hz  16:9     67.500 kHz    148.500000 MHz (520 mm x 290 mm)
                 Hfront   88 Hsync  44 Hback  148 Hpol P
                 Vfront    4 Vsync   5 Vback   36 Vpol P
    Display Range Limits:
      Monitor ranges (GTF): 50-60 Hz V, 30-80 kHz H, max dotclock 170 MHz
    Display Product Name: 'HP V223'
    Display Product Serial Number: ...
  Extension blocks: 1
Checksum: 0x61

----------------

Block 1, CTA-861 Extension Block:
  Revision: 3
  Native detailed modes: 0
  Vendor-Specific Data Block (HDMI), OUI 00-0C-03:
    Source physical address: 1.0.0.0
  Video Data Block:
    VIC   1:   640x480    59.940476 Hz   4:3     31.469 kHz     25.175000 MHz
    VIC   3:   720x480    59.940060 Hz  16:9     31.469 kHz     27.000000 MHz
    VIC  18:   720x576    50.000000 Hz  16:9     31.250 kHz     27.000000 MHz
    VIC   4:  1280x720    60.000000 Hz  16:9     45.000 kHz     74.250000 MHz
    VIC  19:  1280x720    50.000000 Hz  16:9     37.500 kHz     74.250000 MHz
    VIC  16:  1920x1080   60.000000 Hz  16:9     67.500 kHz    148.500000 MHz
    VIC  31:  1920x1080   50.000000 Hz  16:9     56.250 kHz    148.500000 MHz
Checksum: 0xc2  Unused space in Extension Block: 109 bytes

----------------

Block 2, Unknown EDID Extension Block 0x00:
  00 ff ff ff ff ff ff 00 22 f0 4a 33 01 01 01 01 '........".J3....'
  06 1b 01 03 80 34 1d 78 ea 7f 15 a3 54 51 9f 27 '.....4.x....TQ.''
  0c 50 54 a1 08 00 d1 c0 81 c0 a9 c0 b3 00 95 00 '.PT.............'
  81 80 81 00 01 01 02 3a 80 18 71 38 2d 40 58 2c '.......:..q8-@X,'
  45 00 08 22 21 00 00 1e 00 00 00 fd 00 32 3c 1e 'E.."!........2<.'
  50 11 00 0a 20 20 20 20 20 20 00 00 00 fc 00 48 'P...      .....H'
  50 20 56 32 32 33 0a 20 20 20 20 20 00 00 00 ff 'P V223.     ....'
  00 33 43 51 37 30 36 30 34 5a 31 0a 20 20 01 61 '.3CQ70604Z1.  .a'
Checksum: 0x61

----------------

Block 3, CTA-861 Extension Block:
  Revision: 3
  Native detailed modes: 0
  Vendor-Specific Data Block (HDMI), OUI 00-0C-03:
    Source physical address: 1.0.0.0
  Video Data Block:
    VIC   1:   640x480    59.940476 Hz   4:3     31.469 kHz     25.175000 MHz
    VIC   3:   720x480    59.940060 Hz  16:9     31.469 kHz     27.000000 MHz
    VIC  18:   720x576    50.000000 Hz  16:9     31.250 kHz     27.000000 MHz
    VIC   4:  1280x720    60.000000 Hz  16:9     45.000 kHz     74.250000 MHz
    VIC  19:  1280x720    50.000000 Hz  16:9     37.500 kHz     74.250000 MHz
    VIC  16:  1920x1080   60.000000 Hz  16:9     67.500 kHz    148.500000 MHz
    VIC  31:  1920x1080   50.000000 Hz  16:9     56.250 kHz    148.500000 MHz
Checksum: 0xc2  Unused space in Extension Block: 109 bytes

----------------

Warnings:

Block 0, Base EDID:
  Vendor & Product Identification: The serial number is one of the known dummy values, it should probably be set to 0.
Block 1, CTA-861 Extension Block:
  IT Video Formats are overscanned by default, but normally this should be underscanned.
  Video Data Block: VIC 1 and the first DTD are not identical. Is this intended?
  Display Product Serial Number is set, so the Serial Number in the Base EDID should be 0.
  Add a Colorimetry Data Block with the sRGB colorimetry bit set to avoid interop issues.
Block 3, CTA-861 Extension Block:
  IT Video Formats are overscanned by default, but normally this should be underscanned.
EDID:
  Base EDID: Some timings are out of range of the Monitor Ranges:
    Vertical Freq: 50.000 - 70.082 Hz (Monitor: 50.000 - 60.000 Hz)

Failures:

Block 1, CTA-861 Extension Block:
  Missing VCDB, needed for Set Selectable RGB Quantization to avoid interop issues.
Block 2, Base EDID:
  Unknown Extension Block.
Block 3, CTA-861 Extension Block:
  Video Data Block: Duplicate VIC 1.
  Video Data Block: Duplicate VIC 3.
  Video Data Block: Duplicate VIC 18.
  Video Data Block: Duplicate VIC 4.
  Video Data Block: Duplicate VIC 19.
  Video Data Block: Duplicate VIC 16.
  Video Data Block: Duplicate VIC 31.
EDID:
  Base EDID: EDID specified 1 extension block(s), but found 3 extension block(s).
  Base EDID: EDID 1.3 requires a Block Map Extension in Block 1 if there are more than 2 blocks in the EDID.

EDID conformity: FAIL
