edid-decode (hex):

00 ff ff ff ff ff ff 00 61 a4 9a 00 00 00 00 00
27 1b 01 03 80 3c 22 78 0a cf 74 a3 57 4c b0 23
09 48 4c 21 08 00 81 80 81 00 61 40 95 00 a9 c0
b3 00 a9 40 d1 00 08 e8 00 30 f2 70 5a 80 b0 58
8a 00 c0 1c 32 00 00 1e 78 e7 00 a0 f0 60 45 90
30 20 36 00 c0 58 32 00 00 1a 64 80 00 30 f2 60
5a 90 b0 58 8a 00 c0 58 32 00 00 1e 00 00 00 fc
00 44 75 6d 6d 79 50 6c 75 67 0a 20 20 20 01 94

02 03 4a 70 4f 03 04 05 61 10 12 13 14 16 20 21
22 1f 3f 5f 29 09 07 07 11 17 50 51 07 00 83 01
00 00 6b 03 0c 00 30 00 f8 76 2f 80 20 01 e2 0e
76 e3 06 0f 01 6d d8 5d c4 01 78 80 27 00 00 00
c7 00 00 e3 05 ff ff e2 00 c0 08 e8 00 30 f2 70
5a 80 b0 58 8a 00 c0 1c 32 00 00 1e ec f9 70 a0
d0 a0 29 50 30 20 3a 00 5c 68 31 00 00 1a 00 00
00 00 00 00 00 00 00 00 00 00 00 00 00 00 00 c5

00 ff ff ff ff ff ff 00 61 a4 9a 00 00 00 00 00
27 1b 01 03 80 3c 22 78 0a cf 74 a3 57 4c b0 23
09 48 4c 21 08 00 81 80 81 00 61 40 95 00 a9 c0
b3 00 a9 40 d1 00 08 e8 00 30 f2 70 5a 80 b0 58
8a 00 c0 1c 32 00 00 1e 78 e7 00 a0 f0 60 45 90
30 20 36 00 c0 58 32 00 00 1a 64 80 00 30 f2 60
5a 90 b0 58 8a 00 c0 58 32 00 00 1e 00 00 00 fc
00 44 75 6d 6d 79 50 6c 75 67 0a 20 20 20 01 94

02 03 4a 70 4f 03 04 05 61 10 12 13 14 16 20 21
22 1f 3f 5f 29 09 07 07 11 17 50 51 07 00 83 01
00 00 6b 03 0c 00 30 00 f8 76 2f 80 20 01 e2 0e
76 e3 06 0f 01 6d d8 5d c4 01 78 80 27 00 00 00
c7 00 00 e3 05 ff ff e2 00 c0 08 e8 00 30 f2 70
5a 80 b0 58 8a 00 c0 1c 32 00 00 1e ec f9 70 a0
d0 a0 29 50 30 20 3a 00 5c 68 31 00 00 1a 00 00
00 00 00 00 00 00 00 00 00 00 00 00 00 00 00 c5

----------------

Block 0, Base EDID:
  EDID Structure Version & Revision: 1.3
  Vendor & Product Identification:
    Manufacturer: XMD
    Model: 154
    Made in: week 39 of 2017
  Basic Display Parameters & Features:
    Digital display
    Maximum image size: 60 cm x 34 cm
    Gamma: 2.20
    RGB color display
    First detailed timing is the preferred timing
  Color Characteristics:
    Red  : 0.6396, 0.3398
    Green: 0.2998, 0.6904
    Blue : 0.1376, 0.0380
    White: 0.2822, 0.2968
  Established Timings I & II:
    DMT 0x04:   640x480    59.940476 Hz   4:3     31.469 kHz     25.175000 MHz
    DMT 0x09:   800x600    60.316541 Hz   4:3     37.879 kHz     40.000000 MHz
    DMT 0x10:  1024x768    60.003840 Hz   4:3     48.363 kHz     65.000000 MHz
  Standard Timings:
    DMT 0x23:  1280x1024   60.019740 Hz   5:4     63.981 kHz    108.000000 MHz
    DMT 0x1c:  1280x800    59.810326 Hz  16:10    49.702 kHz     83.500000 MHz
    DMT 0x10:  1024x768    60.003840 Hz   4:3     48.363 kHz     65.000000 MHz
    DMT 0x2f:  1440x900    59.887445 Hz  16:10    55.935 kHz    106.500000 MHz
    DMT 0x53:  1600x900    60.000000 Hz  16:9     60.000 kHz    108.000000 MHz (RB)
    DMT 0x3a:  1680x1050   59.954250 Hz  16:10    65.290 kHz    146.250000 MHz
    DMT 0x33:  1600x1200   60.000000 Hz   4:3     75.000 kHz    162.000000 MHz
    DMT 0x45:  1920x1200   59.884600 Hz  16:10    74.556 kHz    193.250000 MHz
  Detailed Timing Descriptors:
    DTD 1:  3840x2160   60.000000 Hz  16:9    135.000 kHz    594.000000 MHz (960 mm x 540 mm)
                 Hfront  176 Hsync  88 Hback  296 Hpol P
                 Vfront    8 Vsync  10 Vback   72 Vpol P
    DTD 2:  3840x2400   60.000000 Hz  16:10   148.140 kHz    592.560000 MHz (960 mm x 600 mm)
                 Hfront   48 Hsync  32 Hback   80 Hpol P
                 Vfront    3 Vsync   6 Vback   60 Vpol N
    DTD 3:  3840x2400   30.000000 Hz  16:10    74.700 kHz    328.680000 MHz (960 mm x 600 mm)
                 Hfront  176 Hsync  88 Hback  296 Hpol P
                 Vfront    8 Vsync  10 Vback   72 Vpol P
    Display Product Name: 'DummyPlug'
  Extension blocks: 1
Checksum: 0x94

----------------

Block 1, CTA-861 Extension Block:
  Revision: 3
  Basic audio support
  Supports YCbCr 4:4:4
  Supports YCbCr 4:2:2
  Native DTDs: 0
  Video Data Block:
    VIC   3:   720x480    59.940060 Hz  16:9     31.469 kHz     27.000000 MHz
    VIC   4:  1280x720    60.000000 Hz  16:9     45.000 kHz     74.250000 MHz
    VIC   5:  1920x1080i  60.000000 Hz  16:9     33.750 kHz     74.250000 MHz
    VIC  97:  3840x2160   60.000000 Hz  16:9    135.000 kHz    594.000000 MHz
    VIC  16:  1920x1080   60.000000 Hz  16:9     67.500 kHz    148.500000 MHz
    VIC  18:   720x576    50.000000 Hz  16:9     31.250 kHz     27.000000 MHz
    VIC  19:  1280x720    50.000000 Hz  16:9     37.500 kHz     74.250000 MHz
    VIC  20:  1920x1080i  50.000000 Hz  16:9     28.125 kHz     74.250000 MHz
    VIC  22:  1440x576i   50.000000 Hz  16:9     15.625 kHz     27.000000 MHz
    VIC  32:  1920x1080   24.000000 Hz  16:9     27.000 kHz     74.250000 MHz
    VIC  33:  1920x1080   25.000000 Hz  16:9     28.125 kHz     74.250000 MHz
    VIC  34:  1920x1080   30.000000 Hz  16:9     33.750 kHz     74.250000 MHz
    VIC  31:  1920x1080   50.000000 Hz  16:9     56.250 kHz    148.500000 MHz
    VIC  63:  1920x1080  120.000000 Hz  16:9    135.000 kHz    297.000000 MHz
    VIC  95:  3840x2160   30.000000 Hz  16:9     67.500 kHz    297.000000 MHz
  Audio Data Block:
    Linear PCM:
      Max channels: 2
      Supported sample rates (kHz): 48 44.1 32
      Supported sample sizes (bits): 24 20 16
    AC-3:
      Max channels: 2
      Supported sample rates (kHz): 96 48 44.1 32
      Maximum bit rate: 640 kb/s
    Enhanced AC-3 (DD+):
      Max channels: 2
      Supported sample rates (kHz): 48 44.1 32
  Speaker Allocation Data Block:
    FL/FR - Front Left/Right
  Vendor-Specific Data Block (HDMI), OUI 00-0C-03:
    Source physical address: 3.0.0.0
    Supports_AI
    DC_48bit
    DC_36bit
    DC_30bit
    DC_Y444
    Maximum TMDS clock: 590 MHz
    Supported Content Types:
      Graphics
      Photo
      Cinema
      Game
    Extended HDMI video details:
      3D present
      HDMI VICs:
        HDMI VIC 1:  3840x2160   30.000000 Hz  16:9     67.500 kHz    297.000000 MHz
  YCbCr 4:2:0 Video Data Block:
    VIC 118:  3840x2160  120.000000 Hz  16:9    270.000 kHz   1188.000000 MHz
  HDR Static Metadata Data Block:
    Electro optical transfer functions:
      Traditional gamma - SDR luminance range
      Traditional gamma - HDR luminance range
      SMPTE ST2084
      Hybrid Log-Gamma
    Supported static metadata descriptors:
      Static metadata type 1
  Vendor-Specific Data Block (HDMI Forum), OUI C4-5D-D8:
    Version: 1
    Maximum TMDS Character Rate: 600 MHz
    SCDC Present
    Max Fixed Rate Link: 3 and 6 Gbps per lane on 3 lanes
    Supports 16-bits/component Deep Color 4:2:0 Pixel Encoding
    Supports 12-bits/component Deep Color 4:2:0 Pixel Encoding
    Supports 10-bits/component Deep Color 4:2:0 Pixel Encoding
    VRRmin: 0 Hz
    VRRmax: 0 Hz
    Supports VESA DSC 1.2a compression
    Supports Compressed Video Transport for 4:2:0 Pixel Encoding
    Supports 16 bpc Compressed Video Transport
    Supports 12 bpc Compressed Video Transport
    Supports 10 bpc Compressed Video Transport
  Colorimetry Data Block:
    xvYCC601
    xvYCC709
    sYCC601
    opYCC601
    opRGB
    BT2020cYCC
    BT2020YCC
    BT2020RGB
    Gamut Boundary Description Metadata Profile P0
    Reserved F41
    Reserved F42
    Reserved F43
    Default
    sRGB
    ICtCp
    ST2113RGB
  Video Capability Data Block:
    YCbCr quantization: Selectable (via AVI YQ)
    RGB quantization: Selectable (via AVI Q)
    PT scan behavior: No Data
    IT scan behavior: IT video formats not supported
    CE scan behavior: CE video formats not supported
  Detailed Timing Descriptors:
    DTD 4:  3840x2160   60.000000 Hz  16:9    135.000 kHz    594.000000 MHz (960 mm x 540 mm)
                 Hfront  176 Hsync  88 Hback  296 Hpol P
                 Vfront    8 Vsync  10 Vback   72 Vpol P
    DTD 5:  3440x1440  120.001500 Hz  43:18   177.722 kHz    639.800000 MHz (860 mm x 360 mm)
                 Hfront   48 Hsync  32 Hback   80 Hpol P
                 Vfront    3 Vsync  10 Vback   28 Vpol N
Checksum: 0xc5  Unused space in Extension Block: 17 bytes

----------------

Warnings:

Block 1, CTA-861 Extension Block:
  IT Video Formats are overscanned by default, but normally this should be underscanned.
  Video Data Block: VIC 3 and the first DTD are not identical. Is this intended?
  Video Capability Data Block: IT scan behavior is expected to support underscanned.
  Video Capability Data Block: 'CE video formats not supported' makes no sense.

Failures:

Block 0, Base EDID:
  Detailed Timing Descriptor #1: Mismatch of image size 960x540 mm vs display size 600x340 mm.
  Detailed Timing Descriptor #2: Mismatch of image size 960x600 mm vs display size 600x340 mm.
  Detailed Timing Descriptor #3: Mismatch of image size 960x600 mm vs display size 600x340 mm.
  Missing Display Range Limits Descriptor.
Block 1, CTA-861 Extension Block:
  Vendor-Specific Data Block (HDMI), OUI 00-0C-03: HDMI VSDB Max TMDS rate is > 340.
  Vendor-Specific Data Block (HDMI Forum), OUI C4-5D-D8: HDMI Forum VSDB did not immediately follow the HDMI VSDB.
  Vendor-Specific Data Block (HDMI Forum), OUI C4-5D-D8: HDMI VIC and related CTA VIC codes are present, but the UHD VIC bit is 0.
  Colorimetry Data Block: Reserved bits F41-F43 must be 0.
  Detailed Timing Descriptor #4: Mismatch of image size 960x540 mm vs display size 600x340 mm.
  Detailed Timing Descriptor #5: Mismatch of image size 860x360 mm vs display size 600x340 mm.
EDID:
  Extension Block 2 started with EDID header, ignoring Extension Blocks >= 2.
  Base EDID: The DTD max image size is 960x600mm, which is larger than the display size 600.0x340.0mm.

EDID conformity: FAIL
