edid-decode (hex):

00 ff ff ff ff ff ff 00 11 26 80 73 22 08 00 00
07 0f 01 04 a5 21 1b 96 e2 d1 e0 a0 5a 4a 98 24
16 50 54 bf ef 80 81 40 71 4f 81 80 01 01 01 01
01 01 01 01 01 01 00 00 00 fc 00 0a 20 20 20 20
20 20 20 20 20 20 20 20 00 00 00 fd 00 32 4b 1e
50 0e 0a 20 20 20 20 20 20 20 00 00 00 fc 00 0a
20 20 20 20 20 20 20 20 20 20 20 20 00 00 00 fc
00 50 31 37 36 0a 20 20 20 20 20 20 20 20 00 39

00 ff ff ff ff ff ff 00 11 26 80 73 22 08 00 00
07 0f 01 04 a5 21 1b 96 e2 d1 e0 a0 5a 4a 98 24
16 50 54 bf ef 80 81 40 71 4f 81 80 01 01 01 01
01 01 01 01 01 01 00 00 00 fc 00 0a 20 20 20 20
20 20 20 20 20 20 20 20 00 00 00 fd 00 32 4b 1e
50 0e 0a 20 20 20 20 20 20 20 00 00 00 fc 00 0a
20 20 20 20 20 20 20 20 20 20 20 20 00 00 00 fc
00 50 31 37 36 0a 20 20 20 20 20 20 20 20 00 39

----------------

Block 0, Base EDID:
  EDID Structure Version & Revision: 1.4
  Vendor & Product Identification:
    Manufacturer: DIF
    Model: 29568
    Serial Number: ...
    Made in: week 7 of 2005
  Basic Display Parameters & Features:
    Digital display
    Bits per primary color channel: 8
    DisplayPort interface
    Maximum image size: 33 cm x 27 cm
    Gamma: 2.50
    DPMS levels: Standby Suspend Off
    Supported color formats: RGB 4:4:4
    First detailed timing includes the native pixel format and preferred refresh rate
  Color Characteristics:
    Red  : 0.6279, 0.3525
    Green: 0.2890, 0.5947
    Blue : 0.1435, 0.0878
    White: 0.3125, 0.3281
  Established Timings I & II:
    IBM     :   720x400    70.081663 Hz   9:5     31.467 kHz     28.320000 MHz
    DMT 0x04:   640x480    59.940476 Hz   4:3     31.469 kHz     25.175000 MHz
    Apple   :   640x480    66.666667 Hz   4:3     35.000 kHz     30.240000 MHz
    DMT 0x05:   640x480    72.808802 Hz   4:3     37.861 kHz     31.500000 MHz
    DMT 0x06:   640x480    75.000000 Hz   4:3     37.500 kHz     31.500000 MHz
    DMT 0x08:   800x600    56.250000 Hz   4:3     35.156 kHz     36.000000 MHz
    DMT 0x09:   800x600    60.316541 Hz   4:3     37.879 kHz     40.000000 MHz
    DMT 0x0a:   800x600    72.187572 Hz   4:3     48.077 kHz     50.000000 MHz
    DMT 0x0b:   800x600    75.000000 Hz   4:3     46.875 kHz     49.500000 MHz
    Apple   :   832x624    74.551266 Hz   4:3     49.726 kHz     57.284000 MHz
    DMT 0x10:  1024x768    60.003840 Hz   4:3     48.363 kHz     65.000000 MHz
    DMT 0x11:  1024x768    70.069359 Hz   4:3     56.476 kHz     75.000000 MHz
    DMT 0x12:  1024x768    75.028582 Hz   4:3     60.023 kHz     78.750000 MHz
    DMT 0x24:  1280x1024   75.024675 Hz   5:4     79.976 kHz    135.000000 MHz
    Apple   :  1152x870    75.061550 Hz 192:145   68.681 kHz    100.000000 MHz
  Standard Timings:
    DMT 0x20:  1280x960    60.000000 Hz   4:3     60.000 kHz    108.000000 MHz
    DMT 0x15:  1152x864    75.000000 Hz   4:3     67.500 kHz    108.000000 MHz
    DMT 0x23:  1280x1024   60.019740 Hz   5:4     63.981 kHz    108.000000 MHz
  Detailed Timing Descriptors:
    Display Product Name: ''
    Display Range Limits:
      Monitor ranges (Unknown (0x0a)): 50-75 Hz V, 30-80 kHz H, max dotclock 140 MHz
    Display Product Name: ''
    Display Product Name: 'P176'
Checksum: 0x39

----------------

Warnings:

EDID:
  No Native Video Resolution was defined.

Failures:

Block 0, Base EDID:
  Standard Timings: Missing preferred timing.
  Display Product Name: Empty string.
  Display Range Limits: Unknown range class (0x0a).
  Display Range Limits: Byte 11 is 0x20 instead of 0x0a.
  Display Product Name: Empty string.
EDID:
  Extension Block 1 started with EDID header, ignoring Extension Blocks >= 1.

EDID conformity: FAIL
