edid-decode (hex):

00 ff ff ff ff ff ff 00 4d 10 6c 15 00 00 00 00
2d 1f 01 04 a5 1d 11 78 07 de 50 a3 54 4c 99 26
0f 50 54 00 00 00 01 01 01 01 01 01 01 01 01 01
01 01 01 01 01 01 1a 36 80 9c 70 38 1f 40 30 20
35 00 26 a5 10 00 00 18 00 00 00 fd 00 1e 3c 43
43 0e 01 00 00 00 00 00 00 00 00 00 00 10 00 00
00 00 00 00 00 00 00 00 00 00 00 00 00 00 00 fc
00 4c 51 31 33 33 4d 31 4a 57 36 32 41 0a 00 a9

00 ff ff ff ff ff ff 00 4d 10 6c 15 00 00 00 00
2d 1f 01 04 a5 1d 11 78 07 de 50 a3 54 4c 99 26
0f 50 54 00 00 00 01 01 01 01 01 01 01 01 01 01
01 01 01 01 01 01 1a 36 80 9c 70 38 1f 40 30 20
35 00 26 a5 10 00 00 18 00 00 00 fd 00 1e 3c 43
43 0e 01 00 00 00 00 00 00 00 00 00 00 10 00 00
00 00 00 00 00 00 00 00 00 00 00 00 00 00 00 fc
00 4c 51 31 33 33 4d 31 4a 57 36 32 41 0a 00 a9

----------------

Block 0, Base EDID:
  EDID Structure Version & Revision: 1.4
  Vendor & Product Identification:
    Manufacturer: SHP
    Model: 5484
    Made in: week 45 of 2021
  Basic Display Parameters & Features:
    Digital display
    Bits per primary color channel: 8
    DisplayPort interface
    Maximum image size: 29 cm x 17 cm
    Gamma: 2.20
    Supported color formats: RGB 4:4:4
    Default (sRGB) color space is primary color space
    First detailed timing includes the native pixel format and preferred refresh rate
    Display supports continuous frequencies
  Color Characteristics:
    Red  : 0.6396, 0.3291
    Green: 0.2998, 0.5996
    Blue : 0.1494, 0.0595
    White: 0.3125, 0.3281
  Established Timings I & II: none
  Standard Timings: none
  Detailed Timing Descriptors:
    DTD 1:  1920x1080   60.049358 Hz  16:9     66.715 kHz    138.500000 MHz (294 mm x 165 mm)
                 Hfront   48 Hsync  32 Hback   76 Hpol N
                 Vfront    3 Vsync   5 Vback   23 Vpol N
    Display Range Limits:
      Monitor ranges (Range Limits Only): 30-60 Hz V, 67-67 kHz H, max dotclock 140 MHz
    Dummy Descriptor:
    Display Product Name: 'LQ133M1JW62A'
Checksum: 0xa9

----------------

Block 1, Unknown EDID Extension Block 0x00:
  00 ff ff ff ff ff ff 00 4d 10 6c 15 00 00 00 00 '........M.l.....'
  2d 1f 01 04 a5 1d 11 78 07 de 50 a3 54 4c 99 26 '-......x..P.TL.&'
  0f 50 54 00 00 00 01 01 01 01 01 01 01 01 01 01 '.PT.............'
  01 01 01 01 01 01 1a 36 80 9c 70 38 1f 40 30 20 '.......6..p8.@0 '
  35 00 26 a5 10 00 00 18 00 00 00 fd 00 1e 3c 43 '5.&...........<C'
  43 0e 01 00 00 00 00 00 00 00 00 00 00 10 00 00 'C...............'
  00 00 00 00 00 00 00 00 00 00 00 00 00 00 00 fc '................'
  00 4c 51 31 33 33 4d 31 4a 57 36 32 41 0a 00 a9 '.LQ133M1JW62A...'
Checksum: 0xa9

----------------

Failures:

Block 0, Base EDID:
  Basic Display Parameters & Features: sRGB is signaled, but the chromaticities do not match.
  Display Range Limits: Byte 11 is 0x00 instead of 0x0a.
  Display Range Limits: Bytes 12-17 must be 0x20.
Block 1, Base EDID:
  Unknown Extension Block.
EDID:
  Base EDID: EDID specified 0 extension block(s), but found 1 extension block(s).

EDID conformity: FAIL
