edid-decode (hex):

00 ff ff ff ff ff ff 00 4d d9 fa 06 00 00 00 00
2d 0c 01 04 90 24 14 00 ea a8 e0 99 57 4b 92 25
1c 50 54 00 00 00 01 01 01 01 01 01 01 01 01 01
01 01 01 01 01 01 30 2a 40 5e 61 84 18 30 74 74
88 00 68 c8 10 00 00 18 30 2a 40 90 61 84 b4 30
85 85 cc 00 68 c8 10 00 00 18 00 00 00 fc 00 4e
76 69 64 69 61 20 44 65 66 61 75 6c 00 00 00 fc
00 74 20 46 6c 61 74 20 50 61 6e 65 6c 00 00 a9

----------------

Block 0, Base EDID:
  EDID Structure Version & Revision: 1.4
  Vendor & Product Identification:
    Manufacturer: SNY
    Model: 1786
    Made in: week 45 of 2002
  Basic Display Parameters & Features:
    Digital display
    Bits per primary color channel: 6
    Digital interface is not defined
    Maximum image size: 36 cm x 20 cm
    Gamma: 1.00
    DPMS levels: Standby Suspend Off
    Supported color formats: RGB 4:4:4, YCrCb 4:4:4
    First detailed timing includes the native pixel format and preferred refresh rate
  Color Characteristics:
    Red  : 0.5996, 0.3417
    Green: 0.2949, 0.5703
    Blue : 0.1474, 0.1113
    White: 0.3125, 0.3281
  Established Timings I & II: none
  Standard Timings: none
  Detailed Timing Descriptors:
    DTD 1:  1600x900    59.940060 Hz  16:9     55.385 kHz    108.000000 MHz (360 mm x 200 mm)
                 Hfront  116 Hsync 116 Hback  118 Hpol N
                 Vfront    8 Vsync   8 Vback    8 Vpol N
    DTD 2:  1600x900    50.000000 Hz  16:9     54.000 kHz    108.000000 MHz (360 mm x 200 mm)
                 Hfront  133 Hsync 133 Hback  134 Hpol N
                 Vfront   12 Vsync  12 Vback  156 Vpol N
    Display Product Name: 'Nvidia Defaul'
    Display Product Name: 't Flat Panel'
Checksum: 0xa9

----------------

Failures:

Block 0, Base EDID:
  Display Product Name: NUL byte at position 12.

EDID conformity: FAIL
