edid-decode (hex):

00 ff ff ff ff ff ff 00 09 e5 54 0d 00 00 00 00
28 22 01 04 a5 27 18 78 03 88 b1 ad 52 43 b1 24
0d 50 54 00 00 00 01 01 01 01 01 01 01 01 01 01
01 01 01 01 01 01 c0 e4 00 a0 f0 60 28 90 30 20
36 00 84 f2 10 00 00 1a 00 00 00 00 00 00 00 00
00 00 00 00 00 00 00 00 00 00 00 00 00 fe 00 42
4f 45 20 4e 4a 0a 20 20 20 20 20 20 00 00 00 fc
00 4e 45 31 38 30 51 41 4d 2d 4e 5a 31 0a 02 17

70 20 79 02 00 21 01 1d 26 0f 78 09 00 0f 60 09
88 d9 ea 51 39 e4 b0 49 d2 0d 00 35 54 d0 5f d0
5f a8 36 12 78 22 00 28 ff bd 23 85 ff 0e 9f 00
2f 00 1f 00 5f 09 27 00 02 00 05 00 ff 1a 12 85
ff 0e 9f 00 2f 00 1f 00 5f 09 47 00 02 00 05 00
2b 00 12 27 00 30 3b 00 00 27 00 30 77 00 00 27
00 64 ef 00 00 2e 00 06 00 45 d0 5f d0 5f 00 00
00 00 00 00 00 00 00 00 00 00 00 00 00 00 8c 90

70 20 79 00 00 81 00 15 74 1a 00 00 03 01 30 f0
00 00 6a 4a 6a 4a f0 00 00 00 00 00 00 00 00 00
00 00 00 00 00 00 00 00 00 00 00 00 00 00 00 00
00 00 00 00 00 00 00 00 00 00 00 00 00 00 00 00
00 00 00 00 00 00 00 00 00 00 00 00 00 00 00 00
00 00 00 00 00 00 00 00 00 00 00 00 00 00 00 00
00 00 00 00 00 00 00 00 00 00 00 00 00 00 00 00
00 00 00 00 00 00 00 00 00 00 00 00 00 00 c7 90

00 ff ff ff ff ff ff 00 09 e5 54 0d 00 00 00 00
28 22 01 04 a5 27 18 78 03 88 b1 ad 52 43 b1 24
0d 50 54 00 00 00 01 01 01 01 01 01 01 01 01 01
01 01 01 01 01 01 c0 e4 00 a0 f0 60 28 90 30 20
36 00 84 f2 10 00 00 1a 00 00 00 00 00 00 00 00
00 00 00 00 00 00 00 00 00 00 00 00 00 fe 00 42
4f 45 20 4e 4a 0a 20 20 20 20 20 20 00 00 00 fc
00 4e 45 31 38 30 51 41 4d 2d 4e 5a 31 0a 02 17

70 20 79 02 00 21 01 1d 26 0f 78 09 00 0f 60 09
88 d9 ea 51 39 e4 b0 49 d2 0d 00 35 54 d0 5f d0
5f a8 36 12 78 22 00 28 ff bd 23 85 ff 0e 9f 00
2f 00 1f 00 5f 09 27 00 02 00 05 00 ff 1a 12 85
ff 0e 9f 00 2f 00 1f 00 5f 09 47 00 02 00 05 00
2b 00 12 27 00 30 3b 00 00 27 00 30 77 00 00 27
00 64 ef 00 00 2e 00 06 00 45 d0 5f d0 5f 00 00
00 00 00 00 00 00 00 00 00 00 00 00 00 00 8c 90

70 20 79 00 00 81 00 15 74 1a 00 00 03 01 30 f0
00 00 6a 4a 6a 4a f0 00 00 00 00 00 00 00 00 00
00 00 00 00 00 00 00 00 00 00 00 00 00 00 00 00
00 00 00 00 00 00 00 00 00 00 00 00 00 00 00 00
00 00 00 00 00 00 00 00 00 00 00 00 00 00 00 00
00 00 00 00 00 00 00 00 00 00 00 00 00 00 00 00
00 00 00 00 00 00 00 00 00 00 00 00 00 00 00 00
00 00 00 00 00 00 00 00 00 00 00 00 00 00 c7 90

----------------

Block 0, Base EDID:
  EDID Structure Version & Revision: 1.4
  Vendor & Product Identification:
    Manufacturer: BOE
    Model: 3412
    Made in: week 40 of 2024
  Basic Display Parameters & Features:
    Digital display
    Bits per primary color channel: 8
    DisplayPort interface
    Maximum image size: 39 cm x 24 cm
    Gamma: 2.20
    Supported color formats: RGB 4:4:4
    First detailed timing includes the native pixel format and preferred refresh rate
    Display supports continuous frequencies
  Color Characteristics:
    Red  : 0.6777, 0.3203
    Green: 0.2636, 0.6914
    Blue : 0.1425, 0.0537
    White: 0.3125, 0.3291
  Established Timings I & II: none
  Standard Timings: none
  Detailed Timing Descriptors:
    DTD 1:  3840x2400   60.000000 Hz  16:10   146.400 kHz    585.600000 MHz (388 mm x 242 mm)
                 Hfront   48 Hsync  32 Hback   80 Hpol P
                 Vfront    3 Vsync   6 Vback   31 Vpol N
    Empty Descriptor
    Alphanumeric Data String: 'BOE NJ'
    Display Product Name: 'NE180QAM-NZ1'
  Extension blocks: 2
Checksum: 0x17

----------------

Block 1, DisplayID Extension Block:
  Version: 2.0
  Extension Count: 0
  Display Product Primary Use Case: None of the listed primary use cases; generic display
  Display Parameters Data Block (0x21):
    Image size: 387.8 mm x 242.4 mm
    Display native pixel format: 3840x2400
    Scan Orientation: Left to Right, Top to Bottom
    Luminance Information: Guidance for the Source device
    Color Information: CIE 1931
    Audio Speaker Information: not integrated
    Native Color Chromaticity:
      Primary #1:  (0.677979, 0.319824)
      Primary #2:  (0.263916, 0.690918)
      Primary #3:  (0.142822, 0.053955)
      White Point: (0.312500, 0.328857)
    Native Maximum Luminance (Full Coverage): 500.000000 cd/m^2
    Native Maximum Luminance (10% Rectangular Coverage): 500.000000 cd/m^2
    Native Minimum Luminance: 0.416016 cd/m^2
    Native Color Depth: 8 bpc
    Display Device Technology: Active Matrix LCD
    Display Device Theme Preference: No Preference
    Native Gamma EOTF: 2.20
  Video Timing Modes Type 7 - Detailed Timings Data Block:
    DTD:  3840x2400  240.000000 Hz  16:10   585.600 kHz   2342.400000 MHz (aspect 16:10, no 3D stereo, preferred)
               Hfront   48 Hsync  32 Hback   80 Hpol N
               Vfront    3 Vsync   6 Vback   31 Vpol N
    DTD:  3840x2400  120.000000 Hz  16:10   296.640 kHz   1186.560000 MHz (aspect 16:10, no 3D stereo, preferred)
               Hfront   48 Hsync  32 Hback   80 Hpol N
               Vfront    3 Vsync   6 Vback   63 Vpol N
  Adaptive Sync Data Block:
    Descriptor #1:
      Native Panel Range
      Fixed Average V-Total and Adaptive V-Total
      Supports Seamless Transition
      'Max Single Frame Duration Increase' field value without jitter impact
      'Max Single Frame Duration Decrease' field value without jitter impact
      Max Duration Increase: 0.00 ms
      Max Duration Decrease: 0.00 ms
      Min Refresh Rate: 48 Hz
      Max Refresh Rate: 60 Hz
    Descriptor #2:
      Native Panel Range
      Fixed Average V-Total and Adaptive V-Total
      Supports Seamless Transition
      'Max Single Frame Duration Increase' field value without jitter impact
      'Max Single Frame Duration Decrease' field value without jitter impact
      Max Duration Increase: 0.00 ms
      Max Duration Decrease: 0.00 ms
      Min Refresh Rate: 48 Hz
      Max Refresh Rate: 120 Hz
    Descriptor #3:
      Native Panel Range
      Fixed Average V-Total and Adaptive V-Total
      Supports Seamless Transition
      'Max Single Frame Duration Increase' field value without jitter impact
      'Max Single Frame Duration Decrease' field value without jitter impact
      Max Duration Increase: 0.00 ms
      Max Duration Decrease: 0.00 ms
      Min Refresh Rate: 100 Hz
      Max Refresh Rate: 240 Hz
  Brightness Luminance Range Data Block:
    Minimum SDR Luminance (Full Coverage): 5.000000 cd/m^2
    Maximum Suggested SDR Luminance (Full Coverage): 500.000000 cd/m^2
    Maximum Boost SDR Luminance: 500.000000 cd/m^2
  Checksum: 0x8c
Checksum: 0x90

----------------

Block 2, DisplayID Extension Block:
  Version: 2.0
  Extension Count: 0
  CTA-861 DisplayID Data Block:
  Vendor-Specific Data Block (AMD), OUI 00-00-1A:
    Version: 3
    Feature Caps: 0x01
    Minimum Refresh Rate: 48 Hz
    Maximum Refresh Rate: 240 Hz
    Flags 1.x: 0x00
    Flags 2.x: 0x00
  Checksum: 0xc7
Checksum: 0x90

----------------

Failures:

Block 0, Base EDID:
  Empty Descriptor: Use Dummy Descriptor instead of all zeroes.
  Missing Display Range Limits Descriptor.
Block 1, DisplayID Extension Block:
  Expected 0 DisplayID Extension Block, but got 1.
EDID:
  Extension Block 3 started with EDID header, ignoring Extension Blocks >= 3.

EDID conformity: FAIL
