edid-decode (hex):

00 ff ff ff ff ff ff 00 2a 59 70 02 01 00 00 00
26 21 01 04 b5 3c 21 78 3b 72 c5 ad 4f 45 af 24
0c 50 54 23 48 00 81 40 81 80 81 c0 81 00 95 00
b3 00 d1 c0 01 01 4d d0 00 a0 f0 70 3e 80 30 20
35 00 55 50 21 00 00 1a 00 00 00 ff 00 30 30 30
30 30 30 30 30 30 30 30 30 30 00 00 00 fd 0c 30
64 ff ff 78 01 0a 20 20 20 20 20 20 00 00 00 fc
00 44 50 0a 20 20 20 20 20 20 20 20 20 20 02 d1

02 03 27 f1 4c 01 03 04 12 13 05 14 1f 90 7d 02
7e 23 09 1f 07 83 01 00 00 e2 00 c0 e3 05 e3 01
e6 06 07 01 57 57 0a 02 3a 80 18 71 38 2d 40 30
20 35 00 b6 54 31 00 00 1a 56 5e 00 a0 a0 a0 29
50 30 20 35 00 b6 54 31 00 00 1e 00 00 00 00 00
00 00 00 00 00 00 00 00 00 00 00 00 00 00 00 00
00 00 00 00 00 00 00 00 00 00 00 00 00 00 00 00
00 00 00 00 00 00 00 00 00 00 00 00 00 00 00 06

70 12 79 00 00 03 01 28 4d 1b 01 84 ff 13 3f 01
5f 00 3f 00 6f 08 3d 00 02 80 09 00 35 62 01 04
ff 13 3f 01 5f 00 3f 00 6f 08 3b 00 02 80 09 00
00 00 00 00 00 00 00 00 00 00 00 00 00 00 00 00
00 00 00 00 00 00 00 00 00 00 00 00 00 00 00 00
00 00 00 00 00 00 00 00 00 00 00 00 00 00 00 00
00 00 00 00 00 00 00 00 00 00 00 00 00 00 00 00
00 00 00 00 00 00 00 00 00 00 00 00 00 00 64 90

00 ff ff ff ff ff ff 00 2a 59 70 02 01 00 00 00
26 21 01 04 b5 3c 21 78 3b 72 c5 ad 4f 45 af 24
0c 50 54 23 48 00 81 40 81 80 81 c0 81 00 95 00
b3 00 d1 c0 01 01 4d d0 00 a0 f0 70 3e 80 30 20
35 00 55 50 21 00 00 1a 00 00 00 ff 00 30 30 30
30 30 30 30 30 30 30 30 30 30 00 00 00 fd 0c 30
64 ff ff 78 01 0a 20 20 20 20 20 20 00 00 00 fc
00 44 50 0a 20 20 20 20 20 20 20 20 20 20 02 d1

02 03 27 f1 4c 01 03 04 12 13 05 14 1f 90 7d 02
7e 23 09 1f 07 83 01 00 00 e2 00 c0 e3 05 e3 01
e6 06 07 01 57 57 0a 02 3a 80 18 71 38 2d 40 30
20 35 00 b6 54 31 00 00 1a 56 5e 00 a0 a0 a0 29
50 30 20 35 00 b6 54 31 00 00 1e 00 00 00 00 00
00 00 00 00 00 00 00 00 00 00 00 00 00 00 00 00
00 00 00 00 00 00 00 00 00 00 00 00 00 00 00 00
00 00 00 00 00 00 00 00 00 00 00 00 00 00 00 06

70 12 79 00 00 03 01 28 4d 1b 01 84 ff 13 3f 01
5f 00 3f 00 6f 08 3d 00 02 80 09 00 35 62 01 04
ff 13 3f 01 5f 00 3f 00 6f 08 3b 00 02 80 09 00
00 00 00 00 00 00 00 00 00 00 00 00 00 00 00 00
00 00 00 00 00 00 00 00 00 00 00 00 00 00 00 00
00 00 00 00 00 00 00 00 00 00 00 00 00 00 00 00
00 00 00 00 00 00 00 00 00 00 00 00 00 00 00 00
00 00 00 00 00 00 00 00 00 00 00 00 00 00 64 90

----------------

Block 0, Base EDID:
  EDID Structure Version & Revision: 1.4
  Vendor & Product Identification:
    Manufacturer: JRY
    Model: 624
    Serial Number: ...
    Made in: week 38 of 2023
  Basic Display Parameters & Features:
    Digital display
    Bits per primary color channel: 10
    DisplayPort interface
    Maximum image size: 60 cm x 33 cm
    Gamma: 2.20
    DPMS levels: Off
    Supported color formats: RGB 4:4:4, YCrCb 4:4:4, YCrCb 4:2:2
    First detailed timing includes the native pixel format and preferred refresh rate
    Display supports continuous frequencies
  Color Characteristics:
    Red  : 0.6767, 0.3115
    Green: 0.2695, 0.6855
    Blue : 0.1435, 0.0468
    White: 0.3134, 0.3291
  Established Timings I & II:
    DMT 0x04:   640x480    59.940476 Hz   4:3     31.469 kHz     25.175000 MHz
    DMT 0x08:   800x600    56.250000 Hz   4:3     35.156 kHz     36.000000 MHz
    DMT 0x09:   800x600    60.316541 Hz   4:3     37.879 kHz     40.000000 MHz
    DMT 0x0b:   800x600    75.000000 Hz   4:3     46.875 kHz     49.500000 MHz
    DMT 0x10:  1024x768    60.003840 Hz   4:3     48.363 kHz     65.000000 MHz
  Standard Timings:
    DMT 0x20:  1280x960    60.000000 Hz   4:3     60.000 kHz    108.000000 MHz
    DMT 0x23:  1280x1024   60.019740 Hz   5:4     63.981 kHz    108.000000 MHz
    DMT 0x55:  1280x720    60.000000 Hz  16:9     45.000 kHz     74.250000 MHz
    DMT 0x1c:  1280x800    59.810326 Hz  16:10    49.702 kHz     83.500000 MHz
    DMT 0x2f:  1440x900    59.887445 Hz  16:10    55.935 kHz    106.500000 MHz
    DMT 0x3a:  1680x1050   59.954250 Hz  16:10    65.290 kHz    146.250000 MHz
    DMT 0x52:  1920x1080   60.000000 Hz  16:9     67.500 kHz    148.500000 MHz
  Detailed Timing Descriptors:
    DTD 1:  3840x2160   59.996625 Hz  16:9    133.312 kHz    533.250000 MHz (597 mm x 336 mm)
                 Hfront   48 Hsync  32 Hback   80 Hpol P
                 Vfront    3 Vsync   5 Vback   54 Vpol N
    Display Product Serial Number: ...
    Display Range Limits:
      Monitor ranges (Range Limits Only): 48-100 Hz V, 510-510 kHz H, max dotclock 1200 MHz
    Display Product Name: 'DP'
  Extension blocks: 2
Checksum: 0xd1

----------------

Block 1, CTA-861 Extension Block:
  Revision: 3
  Underscans IT Video Formats by default
  Basic audio support
  Supports YCbCr 4:4:4
  Supports YCbCr 4:2:2
  Native DTDs: 1
  Video Data Block:
    VIC   1:   640x480    59.940476 Hz   4:3     31.469 kHz     25.175000 MHz
    VIC   3:   720x480    59.940060 Hz  16:9     31.469 kHz     27.000000 MHz
    VIC   4:  1280x720    60.000000 Hz  16:9     45.000 kHz     74.250000 MHz
    VIC  18:   720x576    50.000000 Hz  16:9     31.250 kHz     27.000000 MHz
    VIC  19:  1280x720    50.000000 Hz  16:9     37.500 kHz     74.250000 MHz
    VIC   5:  1920x1080i  60.000000 Hz  16:9     33.750 kHz     74.250000 MHz
    VIC  20:  1920x1080i  50.000000 Hz  16:9     28.125 kHz     74.250000 MHz
    VIC  31:  1920x1080   50.000000 Hz  16:9     56.250 kHz    148.500000 MHz
    VIC  16:  1920x1080   60.000000 Hz  16:9     67.500 kHz    148.500000 MHz (native)
    VIC 125:  5120x2160   50.000000 Hz  64:27   112.500 kHz    742.500000 MHz
    VIC   2:   720x480    59.940060 Hz   4:3     31.469 kHz     27.000000 MHz
    VIC 126:  5120x2160   60.000000 Hz  64:27   135.000 kHz    742.500000 MHz
  Audio Data Block:
    Linear PCM:
      Max channels: 2
      Supported sample rates (kHz): 96 88.2 48 44.1 32
      Supported sample sizes (bits): 24 20 16
  Speaker Allocation Data Block:
    FL/FR - Front Left/Right
  Video Capability Data Block:
    YCbCr quantization: Selectable (via AVI YQ)
    RGB quantization: Selectable (via AVI Q)
    PT scan behavior: No Data
    IT scan behavior: IT video formats not supported
    CE scan behavior: CE video formats not supported
  Colorimetry Data Block:
    xvYCC601
    xvYCC709
    BT2020cYCC
    BT2020YCC
    BT2020RGB
    Gamut Boundary Description Metadata Profile P0
  HDR Static Metadata Data Block:
    Electro optical transfer functions:
      Traditional gamma - SDR luminance range
      Traditional gamma - HDR luminance range
      SMPTE ST2084
    Supported static metadata descriptors:
      Static metadata type 1
    Desired content max luminance: 87 (329.151 cd/m^2)
    Desired content max frame-average luminance: 87 (329.151 cd/m^2)
    Desired content min luminance: 10 (0.005 cd/m^2)
  Detailed Timing Descriptors:
    DTD 2:  1920x1080   60.000000 Hz  16:9     67.500 kHz    148.500000 MHz (950 mm x 340 mm)
                 Hfront   48 Hsync  32 Hback  200 Hpol P
                 Vfront    3 Vsync   5 Vback   37 Vpol N
    DTD 3:  2560x1440   59.950550 Hz  16:9     88.787 kHz    241.500000 MHz (950 mm x 340 mm)
                 Hfront   48 Hsync  32 Hback   80 Hpol P
                 Vfront    3 Vsync   5 Vback   33 Vpol P
Checksum: 0x06  Unused space in Extension Block: 52 bytes

----------------

Block 2, DisplayID Extension Block:
  Version: 1.2
  Extension Count: 0
  Display Product Type: Extension Section
  Video Timing Modes Type 1 - Detailed Timings Data Block:
    DTD:  5120x2160   59.999934 Hz  16:9    133.320 kHz    725.260000 MHz (aspect 16:9, no 3D stereo, preferred)
               Hfront   96 Hsync  64 Hback  160 Hpol N
               Vfront    3 Vsync  10 Vback   49 Vpol P
    DTD:  5120x2160   75.084459 Hz  16:9    166.688 kHz    906.780000 MHz (aspect 16:9, no 3D stereo)
               Hfront   96 Hsync  64 Hback  160 Hpol N
               Vfront    3 Vsync  10 Vback   47 Vpol P
  Checksum: 0x64
Checksum: 0x90

----------------

Warnings:

Block 0, Base EDID:
  Vendor & Product Identification: The serial number is one of the known dummy values, it should probably be set to 0.
  Display Product Serial Number: ...
Block 1, CTA-861 Extension Block:
  Video Data Block: VIC 1 and the first DTD are not identical. Is this intended?
  Video Capability Data Block: IT scan behavior is expected to support underscanned.
  Video Capability Data Block: 'CE video formats not supported' makes no sense.
  Colorimetry Data Block: Set the sRGB colorimetry bit to avoid interop issues.
  Detailed Timing Descriptor #2: DTD is similar but not identical to VIC 16.
  Detailed Timing Descriptor #2: Image size is 950x340 mm, but based on the picture AR it should be 604x340 mm.
  Detailed Timing Descriptor #3: Image size is 950x340 mm, but based on the picture AR it should be 604x340 mm.
  Display Product Serial Number is set, so the Serial Number in the Base EDID should be 0.
EDID:
  Base EDID: Some timings are out of range of the Monitor Ranges:
    Horizontal Freq: 28.125 - 166.687 kHz (Monitor: 510.000 - 510.000 kHz)

Failures:

Block 1, CTA-861 Extension Block:
  Detailed Timing Descriptor #2: Mismatch of image size 950x340 mm vs display size 600x330 mm.
  Detailed Timing Descriptor #3: Mismatch of image size 950x340 mm vs display size 600x330 mm.
Block 2, DisplayID Extension Block:
  DisplayID Base Block has no product type.
EDID:
  Extension Block 3 started with EDID header, ignoring Extension Blocks >= 3.
  Base EDID: The DTD max image size is 950x340mm, which is larger than the display size 600.0x330.0mm.
  CTA-861: Native progressive timings are a mix of several resolutions.

EDID conformity: FAIL
