edid-decode (hex):

00 ff ff ff ff ff ff 00 09 e5 fc 0a 00 00 00 00
0d 1e 01 04 95 1f 11 78 02 ef 35 95 5d 59 94 2a
21 50 54 00 00 00 01 01 01 01 01 01 01 01 01 01
01 01 01 01 01 01 3a 39 80 04 71 38 28 40 30 20
36 00 e0 0e 11 00 00 1a c8 2d 80 04 71 38 28 40
30 20 36 00 e0 0e 11 00 00 1a ad 43 80 18 71 38
2d 40 58 2c 45 00 e0 0e 11 00 00 1e 58 4d 80 18
71 38 2d 40 58 2c 45 00 e0 0e 11 00 00 1e 00 14

00 ff ff ff ff ff ff 00 09 e5 fc 0a 00 00 00 00
0d 1e 01 04 95 1f 11 78 02 ef 35 95 5d 59 94 2a
21 50 54 00 00 00 01 01 01 01 01 01 01 01 01 01
01 01 01 01 01 01 3a 39 80 04 71 38 28 40 30 20
36 00 e0 0e 11 00 00 1a c8 2d 80 04 71 38 28 40
30 20 36 00 e0 0e 11 00 00 1a ad 43 80 18 71 38
2d 40 58 2c 45 00 e0 0e 11 00 00 1e 58 4d 80 18
71 38 2d 40 58 2c 45 00 e0 0e 11 00 00 1e 00 14

----------------

Block 0, Base EDID:
  EDID Structure Version & Revision: 1.4
  Vendor & Product Identification:
    Manufacturer: BOE
    Model: 2812
    Made in: week 13 of 2020
  Basic Display Parameters & Features:
    Digital display
    Bits per primary color channel: 6
    DisplayPort interface
    Maximum image size: 31 cm x 17 cm
    Gamma: 2.20
    Supported color formats: RGB 4:4:4
    First detailed timing includes the native pixel format and preferred refresh rate
  Color Characteristics:
    Red  : 0.5849, 0.3652
    Green: 0.3505, 0.5810
    Blue : 0.1640, 0.1318
    White: 0.3134, 0.3291
  Established Timings I & II: none
  Standard Timings: none
  Detailed Timing Descriptors:
    DTD 1:  1920x1080   60.001638 Hz  16:9     67.202 kHz    146.500000 MHz (480 mm x 270 mm)
                 Hfront   48 Hsync  32 Hback  180 Hpol P
                 Vfront    3 Vsync   6 Vback   31 Vpol N
    DTD 2:  1920x1080   48.001311 Hz  16:9     53.761 kHz    117.200000 MHz (480 mm x 270 mm)
                 Hfront   48 Hsync  32 Hback  180 Hpol P
                 Vfront    3 Vsync   6 Vback   31 Vpol N
    DTD 3:  1920x1080   70.000000 Hz  16:9     78.750 kHz    173.250000 MHz (480 mm x 270 mm)
                 Hfront   88 Hsync  44 Hback  148 Hpol P
                 Vfront    4 Vsync   5 Vback   36 Vpol P
    DTD 4:  1920x1080   80.000000 Hz  16:9     90.000 kHz    198.000000 MHz (480 mm x 270 mm)
                 Hfront   88 Hsync  44 Hback  148 Hpol P
                 Vfront    4 Vsync   5 Vback   36 Vpol P
Checksum: 0x14

----------------

Warnings:

Block 0, Base EDID:
  Missing Display Product Name.

Failures:

Block 0, Base EDID:
  Detailed Timing Descriptor #1: Mismatch of image size 480x270 mm vs display size 310x170 mm.
  Detailed Timing Descriptor #2: Mismatch of image size 480x270 mm vs display size 310x170 mm.
  Detailed Timing Descriptor #3: Mismatch of image size 480x270 mm vs display size 310x170 mm.
  Detailed Timing Descriptor #4: Mismatch of image size 480x270 mm vs display size 310x170 mm.
EDID:
  Extension Block 1 started with EDID header, ignoring Extension Blocks >= 1.
  Base EDID: The DTD max image size is 480x270mm, which is larger than the display size 310.0x170.0mm.

EDID conformity: FAIL
