edid-decode (hex):

00 ff ff ff ff ff ff 00 41 0c 74 d0 01 01 01 01
00 14 01 03 80 40 24 78 0a 1f 1b 9f 58 55 9e 27
0c 47 4a af ce 00 01 01 01 01 01 01 01 01 01 01
01 01 01 01 01 01 1b 21 50 a0 51 00 1e 30 48 88
35 00 80 68 21 00 00 18 02 3a 80 d0 72 38 2d 40
10 2c 45 80 80 68 21 00 00 1e 00 00 00 fc 00 50
48 49 32 36 50 46 4c 33 34 30 35 48 00 00 00 fd
00 38 4c 1e 53 11 00 0a 20 20 20 20 20 20 01 b9

02 03 26 70 4e 13 04 1f 10 20 21 22 14 05 11 02
15 06 01 26 09 07 03 15 07 50 83 01 00 00 67 03
0c 00 20 00 b8 2d 01 1d 80 3e 73 38 2d 40 7e 2c
45 80 80 68 21 00 00 1e 01 1d 80 d0 72 1c 16 20
10 2c 25 80 80 68 21 00 00 9e 01 1d 00 bc 52 d0
1e 20 b8 28 55 40 80 68 21 00 00 1e 8c 0a d0 90
20 40 31 20 0c 40 55 00 90 2c 11 00 00 18 00 00
00 00 00 00 00 00 00 00 00 00 00 00 00 00 00 3b

00 ff ff ff ff ff ff 00 41 0c 74 d0 01 01 01 01
00 14 01 03 80 40 24 78 0a 1f 1b 9f 58 55 9e 27
0c 47 4a af ce 00 01 01 01 01 01 01 01 01 01 01
01 01 01 01 01 01 1b 21 50 a0 51 00 1e 30 48 88
35 00 80 68 21 00 00 18 02 3a 80 d0 72 38 2d 40
10 2c 45 80 80 68 21 00 00 1e 00 00 00 fc 00 50
48 49 32 36 50 46 4c 33 34 30 35 48 00 00 00 fd
00 38 4c 1e 53 11 00 0a 20 20 20 20 20 20 01 b9

02 03 26 70 4e 13 04 1f 10 20 21 22 14 05 11 02
15 06 01 26 09 07 03 15 07 50 83 01 00 00 67 03
0c 00 20 00 b8 2d 01 1d 80 3e 73 38 2d 40 7e 2c
45 80 80 68 21 00 00 1e 01 1d 80 d0 72 1c 16 20
10 2c 25 80 80 68 21 00 00 9e 01 1d 00 bc 52 d0
1e 20 b8 28 55 40 80 68 21 00 00 1e 8c 0a d0 90
20 40 31 20 0c 40 55 00 90 2c 11 00 00 18 00 00
00 00 00 00 00 00 00 00 00 00 00 00 00 00 00 3b

----------------

Block 0, Base EDID:
  EDID Structure Version & Revision: 1.3
  Vendor & Product Identification:
    Manufacturer: PHL
    Model: 53364
    Serial Number: ...
    Made in: 2010
  Basic Display Parameters & Features:
    Digital display
    Maximum image size: 64 cm x 36 cm
    Gamma: 2.20
    RGB color display
    First detailed timing is the preferred timing
  Color Characteristics:
    Red  : 0.6210, 0.3447
    Green: 0.3349, 0.6201
    Blue : 0.1523, 0.0478
    White: 0.2792, 0.2919
  Established Timings I & II:
    IBM     :   720x400    70.081663 Hz   9:5     31.467 kHz     28.320000 MHz
    DMT 0x04:   640x480    59.940476 Hz   4:3     31.469 kHz     25.175000 MHz
    DMT 0x05:   640x480    72.808802 Hz   4:3     37.861 kHz     31.500000 MHz
    DMT 0x06:   640x480    75.000000 Hz   4:3     37.500 kHz     31.500000 MHz
    DMT 0x08:   800x600    56.250000 Hz   4:3     35.156 kHz     36.000000 MHz
    DMT 0x09:   800x600    60.316541 Hz   4:3     37.879 kHz     40.000000 MHz
    DMT 0x0a:   800x600    72.187572 Hz   4:3     48.077 kHz     50.000000 MHz
    DMT 0x0b:   800x600    75.000000 Hz   4:3     46.875 kHz     49.500000 MHz
    DMT 0x10:  1024x768    60.003840 Hz   4:3     48.363 kHz     65.000000 MHz
    DMT 0x11:  1024x768    70.069359 Hz   4:3     56.476 kHz     75.000000 MHz
    DMT 0x12:  1024x768    75.028582 Hz   4:3     60.023 kHz     78.750000 MHz
  Standard Timings: none
  Detailed Timing Descriptors:
    DTD  1:  1360x768    59.798991 Hz  85:48    47.720 kHz     84.750000 MHz (640 mm x 360 mm)
                  Hfront   72 Hsync 136 Hback  208 Hpol N
                  Vfront    3 Vsync   5 Vback   22 Vpol N
    DTD  2:  1920x1080   50.000000 Hz  16:9     56.250 kHz    148.500000 MHz (640 mm x 360 mm)
                  Hfront  528 Hsync  44 Hback  148 Hpol P
                  Vfront    4 Vsync   5 Vback   36 Vpol P
    Display Product Name: 'PHI26PFL3405H'
    Display Range Limits:
      Monitor ranges (GTF): 56-76 Hz V, 30-83 kHz H, max dotclock 170 MHz
  Extension blocks: 1
Checksum: 0xb9

----------------

Block 1, CTA-861 Extension Block:
  Revision: 3
  Basic audio support
  Supports YCbCr 4:4:4
  Supports YCbCr 4:2:2
  Native detailed modes: 0
  Video Data Block:
    VIC  19:  1280x720    50.000000 Hz  16:9     37.500 kHz     74.250000 MHz
    VIC   4:  1280x720    60.000000 Hz  16:9     45.000 kHz     74.250000 MHz
    VIC  31:  1920x1080   50.000000 Hz  16:9     56.250 kHz    148.500000 MHz
    VIC  16:  1920x1080   60.000000 Hz  16:9     67.500 kHz    148.500000 MHz
    VIC  32:  1920x1080   24.000000 Hz  16:9     27.000 kHz     74.250000 MHz
    VIC  33:  1920x1080   25.000000 Hz  16:9     28.125 kHz     74.250000 MHz
    VIC  34:  1920x1080   30.000000 Hz  16:9     33.750 kHz     74.250000 MHz
    VIC  20:  1920x1080i  50.000000 Hz  16:9     28.125 kHz     74.250000 MHz
    VIC   5:  1920x1080i  60.000000 Hz  16:9     33.750 kHz     74.250000 MHz
    VIC  17:   720x576    50.000000 Hz   4:3     31.250 kHz     27.000000 MHz
    VIC   2:   720x480    59.940060 Hz   4:3     31.469 kHz     27.000000 MHz
    VIC  21:  1440x576i   50.000000 Hz   4:3     15.625 kHz     27.000000 MHz
    VIC   6:  1440x480i   59.940060 Hz   4:3     15.734 kHz     27.000000 MHz
    VIC   1:   640x480    59.940476 Hz   4:3     31.469 kHz     25.175000 MHz
  Audio Data Block:
    Linear PCM:
      Max channels: 2
      Supported sample rates (kHz): 48 44.1 32
      Supported sample sizes (bits): 20 16
    AC-3:
      Max channels: 6
      Supported sample rates (kHz): 48 44.1 32
      Maximum bit rate: 640 kb/s
  Speaker Allocation Data Block:
    FL/FR - Front Left/Right
  Vendor-Specific Data Block (HDMI), OUI 00-0C-03:
    Source physical address: 2.0.0.0
    Supports_AI
    DC_36bit
    DC_30bit
    DC_Y444
    Maximum TMDS clock: 225 MHz
  Detailed Timing Descriptors:
    DTD  3:  1920x1080   24.000000 Hz  16:9     27.000 kHz     74.250000 MHz (640 mm x 360 mm)
                  Hfront  638 Hsync  44 Hback  148 Hpol P
                  Vfront    4 Vsync   5 Vback   36 Vpol P
    DTD  4:  1920x1080i  50.000000 Hz  16:9     28.125 kHz     74.250000 MHz (640 mm x 360 mm)
                  Hfront  528 Hsync  44 Hback  148 Hpol P
                  Vfront    2 Vsync   5 Vback   15 Vpol P Vfront +0.5 Odd Field
                  Vfront    2 Vsync   5 Vback   15 Vpol P Vback  +0.5 Even Field
    DTD  5:  1280x720    50.000000 Hz  16:9     37.500 kHz     74.250000 MHz (640 mm x 360 mm)
                  Hfront  440 Hsync  40 Hback  220 Hpol P
                  Vfront    5 Vsync   5 Vback   20 Vpol P
    DTD  6:   720x576    50.000000 Hz   5:4     31.250 kHz     27.000000 MHz (400 mm x 300 mm)
                  Hfront   12 Hsync  64 Hback   68 Hpol N
                  Vfront    5 Vsync   5 Vback   39 Vpol N
Checksum: 0x3b  Unused space in Extension Block: 17 bytes

----------------

Block 2, Unknown EDID Extension Block 0x00:
  00 ff ff ff ff ff ff 00 41 0c 74 d0 01 01 01 01 '........A.t.....'
  00 14 01 03 80 40 24 78 0a 1f 1b 9f 58 55 9e 27 '.....@$x....XU.''
  0c 47 4a af ce 00 01 01 01 01 01 01 01 01 01 01 '.GJ.............'
  01 01 01 01 01 01 1b 21 50 a0 51 00 1e 30 48 88 '.......!P.Q..0H.'
  35 00 80 68 21 00 00 18 02 3a 80 d0 72 38 2d 40 '5..h!....:..r8-@'
  10 2c 45 80 80 68 21 00 00 1e 00 00 00 fc 00 50 '.,E..h!........P'
  48 49 32 36 50 46 4c 33 34 30 35 48 00 00 00 fd 'HI26PFL3405H....'
  00 38 4c 1e 53 11 00 0a 20 20 20 20 20 20 01 b9 '.8L.S...      ..'
Checksum: 0xb9

----------------

Block 3, CTA-861 Extension Block:
  Revision: 3
  Basic audio support
  Supports YCbCr 4:4:4
  Supports YCbCr 4:2:2
  Native detailed modes: 0
  Video Data Block:
    VIC  19:  1280x720    50.000000 Hz  16:9     37.500 kHz     74.250000 MHz
    VIC   4:  1280x720    60.000000 Hz  16:9     45.000 kHz     74.250000 MHz
    VIC  31:  1920x1080   50.000000 Hz  16:9     56.250 kHz    148.500000 MHz
    VIC  16:  1920x1080   60.000000 Hz  16:9     67.500 kHz    148.500000 MHz
    VIC  32:  1920x1080   24.000000 Hz  16:9     27.000 kHz     74.250000 MHz
    VIC  33:  1920x1080   25.000000 Hz  16:9     28.125 kHz     74.250000 MHz
    VIC  34:  1920x1080   30.000000 Hz  16:9     33.750 kHz     74.250000 MHz
    VIC  20:  1920x1080i  50.000000 Hz  16:9     28.125 kHz     74.250000 MHz
    VIC   5:  1920x1080i  60.000000 Hz  16:9     33.750 kHz     74.250000 MHz
    VIC  17:   720x576    50.000000 Hz   4:3     31.250 kHz     27.000000 MHz
    VIC   2:   720x480    59.940060 Hz   4:3     31.469 kHz     27.000000 MHz
    VIC  21:  1440x576i   50.000000 Hz   4:3     15.625 kHz     27.000000 MHz
    VIC   6:  1440x480i   59.940060 Hz   4:3     15.734 kHz     27.000000 MHz
    VIC   1:   640x480    59.940476 Hz   4:3     31.469 kHz     25.175000 MHz
  Audio Data Block:
    Linear PCM:
      Max channels: 2
      Supported sample rates (kHz): 48 44.1 32
      Supported sample sizes (bits): 20 16
    AC-3:
      Max channels: 6
      Supported sample rates (kHz): 48 44.1 32
      Maximum bit rate: 640 kb/s
  Speaker Allocation Data Block:
    FL/FR - Front Left/Right
  Vendor-Specific Data Block (HDMI), OUI 00-0C-03:
    Source physical address: 2.0.0.0
    Supports_AI
    DC_36bit
    DC_30bit
    DC_Y444
    Maximum TMDS clock: 225 MHz
  Detailed Timing Descriptors:
    DTD  7:  1920x1080   24.000000 Hz  16:9     27.000 kHz     74.250000 MHz (640 mm x 360 mm)
                  Hfront  638 Hsync  44 Hback  148 Hpol P
                  Vfront    4 Vsync   5 Vback   36 Vpol P
    DTD  8:  1920x1080i  50.000000 Hz  16:9     28.125 kHz     74.250000 MHz (640 mm x 360 mm)
                  Hfront  528 Hsync  44 Hback  148 Hpol P
                  Vfront    2 Vsync   5 Vback   15 Vpol P Vfront +0.5 Odd Field
                  Vfront    2 Vsync   5 Vback   15 Vpol P Vback  +0.5 Even Field
    DTD  9:  1280x720    50.000000 Hz  16:9     37.500 kHz     74.250000 MHz (640 mm x 360 mm)
                  Hfront  440 Hsync  40 Hback  220 Hpol P
                  Vfront    5 Vsync   5 Vback   20 Vpol P
    DTD 10:   720x576    50.000000 Hz   5:4     31.250 kHz     27.000000 MHz (400 mm x 300 mm)
                  Hfront   12 Hsync  64 Hback   68 Hpol N
                  Vfront    5 Vsync   5 Vback   39 Vpol N
Checksum: 0x3b  Unused space in Extension Block: 17 bytes

----------------

Warnings:

Block 0, Base EDID:
  Vendor & Product Identification: The serial number is one of the known dummy values, it should probably be set to 0.
Block 1, CTA-861 Extension Block:
  IT Video Formats are overscanned by default, but normally this should be underscanned.
  Video Data Block: VIC 19 and the first DTD are not identical. Is this intended?
  Detailed Timing Descriptor #6: Image size is 400x300 mm, but based on the picture AR it should be 400x320 mm.
  Add a Colorimetry Data Block with the sRGB colorimetry bit set to avoid interop issues.
Block 3, CTA-861 Extension Block:
  IT Video Formats are overscanned by default, but normally this should be underscanned.
  Detailed Timing Descriptor #10: Image size is 400x300 mm, but based on the picture AR it should be 400x320 mm.
EDID:
  Base EDID: Some timings are out of range of the Monitor Ranges:
    Vertical Freq: 24.000 - 75.029 Hz (Monitor: 56.000 - 76.000 Hz)
    Horizontal Freq: 15.625 - 67.500 kHz (Monitor: 30.000 - 83.000 kHz)

Failures:

Block 1, CTA-861 Extension Block:
  Detailed Timing Descriptor #6: Mismatch of image size 400x300 mm vs display size 640x360 mm.
  Missing VCDB, needed for Set Selectable RGB Quantization to avoid interop issues.
Block 2, Base EDID:
  Unknown Extension Block.
Block 3, CTA-861 Extension Block:
  Video Data Block: Duplicate VIC 19.
  Video Data Block: Duplicate VIC 4.
  Video Data Block: Duplicate VIC 31.
  Video Data Block: Duplicate VIC 16.
  Video Data Block: Duplicate VIC 32.
  Video Data Block: Duplicate VIC 33.
  Video Data Block: Duplicate VIC 34.
  Video Data Block: Duplicate VIC 20.
  Video Data Block: Duplicate VIC 5.
  Video Data Block: Duplicate VIC 17.
  Video Data Block: Duplicate VIC 2.
  Video Data Block: Duplicate VIC 21.
  Video Data Block: Duplicate VIC 6.
  Video Data Block: Duplicate VIC 1.
  Speaker Allocation Data Block: Only one instance of this Data Block is allowed.
  Detailed Timing Descriptor #10: Mismatch of image size 400x300 mm vs display size 640x360 mm.
EDID:
  Base EDID: EDID specified 1 extension block(s), but found 3 extension block(s).
  Base EDID: EDID 1.3 requires a Block Map Extension in Block 1 if there are more than 2 blocks in the EDID.

EDID conformity: FAIL
