edid-decode (hex):

00 ff ff ff ff ff ff 00 26 cf fa 03 01 00 00 00
00 16 01 03 80 16 0d 78 0a 21 d0 94 58 56 8f 27
1f 50 54 00 00 00 01 01 01 01 01 01 01 01 01 01
01 01 01 01 01 01 05 1e 56 c2 50 00 35 30 30 20
3c 00 df 7d 00 00 00 19 47 14 56 f0 50 00 28 30
30 20 3c 00 35 ae 10 00 00 19 00 00 00 fe 00 49
6e 66 6f 56 69 73 69 6f 6e 0a 20 20 00 00 00 fe
00 4d 31 30 31 4e 57 4e 38 20 52 30 20 0a 00 26

----------------

Block 0, Base EDID:
  EDID Structure Version & Revision: 1.3
  Vendor & Product Identification:
    Manufacturer: IVO
    Model: 1018
    Serial Number: ...
    Made in: 2012
  Basic Display Parameters & Features:
    Digital display
    Maximum image size: 22 cm x 13 cm
    Gamma: 2.20
    RGB color display
    First detailed timing is the preferred timing
  Color Characteristics:
    Red  : 0.5781, 0.3457
    Green: 0.3359, 0.5595
    Blue : 0.1552, 0.1220
    White: 0.3125, 0.3281
  Established Timings I & II: none
  Standard Timings: none
  Detailed Timing Descriptors:
    DTD 1:  1366x768    60.003435 Hz 683:384   49.263 kHz     76.850000 MHz (223 mm x 125 mm)
                 Hfront   48 Hsync  32 Hback  114 Hpol N
                 Vfront    3 Vsync  12 Vback   38 Vpol N
    DTD 2:  1366x768    40.003144 Hz 683:384   32.323 kHz     51.910000 MHz (309 mm x 174 mm)
                 Hfront   48 Hsync  32 Hback  160 Hpol N
                 Vfront    3 Vsync  12 Vback   25 Vpol N
    Alphanumeric Data String: 'InfoVision'
    Alphanumeric Data String: 'M101NWN8 R0 '
Checksum: 0x26

----------------

Warnings:

Block 0, Base EDID:
  Vendor & Product Identification: The serial number is one of the known dummy values, it should probably be set to 0.

Failures:

Block 0, Base EDID:
  Detailed Timing Descriptor #2: Mismatch of image size 309x174 mm vs display size 220x130 mm.
  Alphanumeric Data String: One or more trailing spaces before newline.
  Missing Display Product Name.
  Missing Display Range Limits Descriptor.
EDID:
  Base EDID: The DTD max image size is 309x174mm, which is larger than the display size 220.0x130.0mm.

EDID conformity: FAIL
