edid-decode (hex):

00 ff ff ff ff ff ff 00 09 e5 03 0b 00 00 00 00
1d 20 01 04 a5 27 18 78 03 e5 f5 ae 50 44 b1 24
0e 50 54 00 00 00 01 01 01 01 01 01 01 01 01 01
01 01 01 01 01 01 9a 74 80 56 70 b0 28 40 30 20
36 00 84 f2 10 00 00 1a 00 00 00 00 00 00 00 00
00 00 00 00 00 00 00 00 00 00 00 00 00 fe 00 57
58 46 59 58 80 4e 45 31 38 4e 5a 31 00 00 00 00
00 02 41 0f 9e 00 03 00 00 0f 41 0a 20 20 01 9d

70 20 79 02 00 22 00 28 f2 37 12 85 7f 07 55 00
2f 00 1f 00 af 04 27 00 02 00 05 00 f9 1b 09 05
7f 07 55 00 2f 00 1f 00 af 04 27 00 02 00 05 00
25 01 09 f2 37 12 f2 37 12 78 e0 81 81 00 13 72
1a 00 00 03 01 78 f0 00 00 53 51 53 51 e0 01 00
00 00 00 00 00 00 00 00 00 00 00 00 00 00 00 00
00 00 00 00 00 00 00 00 00 00 00 00 00 00 00 00
00 00 00 00 00 00 00 00 00 00 00 00 00 00 f2 90

00 ff ff ff ff ff ff 00 09 e5 03 0b 00 00 00 00
1d 20 01 04 a5 27 18 78 03 e5 f5 ae 50 44 b1 24
0e 50 54 00 00 00 01 01 01 01 01 01 01 01 01 01
01 01 01 01 01 01 9a 74 80 56 70 b0 28 40 30 20
36 00 84 f2 10 00 00 1a 00 00 00 00 00 00 00 00
00 00 00 00 00 00 00 00 00 00 00 00 00 fe 00 57
58 46 59 58 80 4e 45 31 38 4e 5a 31 00 00 00 00
00 02 41 0f 9e 00 03 00 00 0f 41 0a 20 20 01 9d

70 20 79 02 00 22 00 28 f2 37 12 85 7f 07 55 00
2f 00 1f 00 af 04 27 00 02 00 05 00 f9 1b 09 05
7f 07 55 00 2f 00 1f 00 af 04 27 00 02 00 05 00
25 01 09 f2 37 12 f2 37 12 78 e0 81 81 00 13 72
1a 00 00 03 01 78 f0 00 00 53 51 53 51 e0 01 00
00 00 00 00 00 00 00 00 00 00 00 00 00 00 00 00
00 00 00 00 00 00 00 00 00 00 00 00 00 00 00 00
00 00 00 00 00 00 00 00 00 00 00 00 00 00 f2 90

----------------

Block 0, Base EDID:
  EDID Structure Version & Revision: 1.4
  Vendor & Product Identification:
    Manufacturer: BOE
    Model: 2819
    Made in: week 29 of 2022
  Basic Display Parameters & Features:
    Digital display
    Bits per primary color channel: 8
    DisplayPort interface
    Maximum image size: 39 cm x 24 cm
    Gamma: 2.20
    Supported color formats: RGB 4:4:4
    First detailed timing includes the native pixel format and preferred refresh rate
    Display supports continuous frequencies
  Color Characteristics:
    Red  : 0.6826, 0.3144
    Green: 0.2666, 0.6923
    Blue : 0.1435, 0.0576
    White: 0.3134, 0.3291
  Established Timings I & II: none
  Standard Timings: none
  Detailed Timing Descriptors:
    DTD 1:  1920x1200  120.002895 Hz  16:10   148.804 kHz    298.500000 MHz (388 mm x 242 mm)
                 Hfront   48 Hsync  32 Hback    6 Hpol P
                 Vfront    3 Vsync   6 Vback   31 Vpol N
    Empty Descriptor
    Alphanumeric Data String: 'WXFYX.NE18NZ1'
    Manufacturer-Specified Display Descriptor (0x00): 00 00 00 02 41 0f 9e 00 03 00 00 0f 41 0a 20 20 '....A.......A.  '
  Extension blocks: 1
Checksum: 0x9d

----------------

Block 1, DisplayID Extension Block:
  Version: 2.0
  Extension Count: 0
  Display Product Primary Use Case: None of the listed primary use cases; generic display
  Video Timing Modes Type 7 - Detailed Timings Data Block:
    DTD:  1920x1200  479.999920 Hz  16:10   595.200 kHz   1193.971000 MHz (aspect 16:10, no 3D stereo, preferred)
               Hfront   48 Hsync  32 Hback    6 Hpol N
               Vfront    3 Vsync   6 Vback   31 Vpol N
    DTD:  1920x1200  240.000161 Hz  16:10   297.600 kHz    596.986000 MHz (aspect 16:10, no 3D stereo)
               Hfront   48 Hsync  32 Hback    6 Hpol N
               Vfront    3 Vsync   6 Vback   31 Vpol N
  Dynamic Video Timing Range Limits Data Block:
    Minimum Pixel Clock: 1193971 kHz
    Maximum Pixel Clock: 1193971 kHz
    Minimum Vertical Refresh Rate: 120 Hz
    Maximum Vertical Refresh Rate: 480 Hz
    Seamless Dynamic Video Timing Support: Yes
  CTA-861 DisplayID Data Block:
  Vendor-Specific Data Block (AMD), OUI 00-00-1A:
    Version: 3
    Feature Caps: 0x01
    Minimum Refresh Rate: 120 Hz
    Maximum Refresh Rate: 480 Hz
    Flags 1.x: 0x00
    Flags 2.x: 0x00
  Checksum: 0xf2
Checksum: 0x90

----------------

Warnings:

Block 0, Base EDID:
  Alphanumeric Data String: Non-ASCII character 0x80 at position 5, can cause problems.
  Missing Display Product Name.

Failures:

Block 0, Base EDID:
  Empty Descriptor: Use Dummy Descriptor instead of all zeroes.
  Missing Display Range Limits Descriptor.
EDID:
  Extension Block 2 started with EDID header, ignoring Extension Blocks >= 2.
  DisplayID: Missing DisplayID Display Parameters Data Block.

EDID conformity: FAIL
