edid-decode (hex):

00 ff ff ff ff ff ff 00 04 72 91 00 a4 23 50 91
0f 13 01 03 80 3c 22 78 2a 97 b5 a9 54 38 ae 25
13 50 54 23 08 00 81 c0 81 00 81 40 81 80 b3 00
01 01 01 01 01 01 3b 3d 00 a0 80 80 21 40 30 20
35 00 55 50 21 00 00 1a 00 00 00 fd 00 38 3c 1f
5e 11 00 0a 20 20 20 20 20 20 00 00 00 fc 00 41
63 65 72 20 42 32 37 33 48 55 0a 20 00 00 00 ff
00 4c 46 42 30 57 30 30 36 34 33 30 30 0a 01 99

02 03 20 70 46 01 02 03 04 05 10 23 09 07 07 83
01 00 00 6c 03 0c 00 10 00 b8 2d 00 00 00 00 00
02 3a 80 d0 72 38 2d 40 10 2c 96 80 fe 1f 11 00
00 18 01 1d 80 18 71 1c 16 20 58 2c 25 00 fe 1f
11 00 00 9e 01 1d 00 72 51 00 1e 20 6e 28 55 00
fe 1f 11 00 00 1e 8c 0a d0 8a 20 e0 2d 10 10 3e
96 00 fe 1f 11 00 00 18 00 00 00 00 00 00 00 00
00 00 00 00 00 00 00 00 00 00 00 00 00 00 00 02

00 ff ff ff ff ff ff 00 04 72 91 00 a4 23 50 91
0f 13 01 03 80 3c 22 78 2a 97 b5 a9 54 38 ae 25
13 50 54 23 08 00 81 c0 81 00 81 40 81 80 b3 00
01 01 01 01 01 01 3b 3d 00 a0 80 80 21 40 30 20
35 00 55 50 21 00 00 1a 00 00 00 fd 00 38 3c 1f
5e 11 00 0a 20 20 20 20 20 20 00 00 00 fc 00 41
63 65 72 20 42 32 37 33 48 55 0a 20 00 00 00 ff
00 4c 46 42 30 57 30 30 36 34 33 30 30 0a 01 99

02 03 20 70 46 01 02 03 04 05 10 23 09 07 07 83
01 00 00 6c 03 0c 00 10 00 b8 2d 00 00 00 00 00
02 3a 80 d0 72 38 2d 40 10 2c 96 80 fe 1f 11 00
00 18 01 1d 80 18 71 1c 16 20 58 2c 25 00 fe 1f
11 00 00 9e 01 1d 00 72 51 00 1e 20 6e 28 55 00
fe 1f 11 00 00 1e 8c 0a d0 8a 20 e0 2d 10 10 3e
96 00 fe 1f 11 00 00 18 00 00 00 00 00 00 00 00
00 00 00 00 00 00 00 00 00 00 00 00 00 00 00 02

----------------

Block 0, Base EDID:
  EDID Structure Version & Revision: 1.3
  Vendor & Product Identification:
    Manufacturer: ACR
    Model: 145
    Serial Number: ...
    Made in: week 15 of 2009
  Basic Display Parameters & Features:
    Digital display
    Maximum image size: 60 cm x 34 cm
    Gamma: 2.20
    DPMS levels: Off
    RGB color display
    First detailed timing is the preferred timing
  Color Characteristics:
    Red  : 0.6621, 0.3291
    Green: 0.2197, 0.6826
    Blue : 0.1464, 0.0771
    White: 0.3134, 0.3291
  Established Timings I & II:
    DMT 0x04:   640x480    59.940476 Hz   4:3     31.469 kHz     25.175000 MHz
    DMT 0x08:   800x600    56.250000 Hz   4:3     35.156 kHz     36.000000 MHz
    DMT 0x09:   800x600    60.316541 Hz   4:3     37.879 kHz     40.000000 MHz
    DMT 0x10:  1024x768    60.003840 Hz   4:3     48.363 kHz     65.000000 MHz
  Standard Timings:
    DMT 0x55:  1280x720    60.000000 Hz  16:9     45.000 kHz     74.250000 MHz
    DMT 0x1c:  1280x800    59.810326 Hz  16:10    49.702 kHz     83.500000 MHz
    DMT 0x20:  1280x960    60.000000 Hz   4:3     60.000 kHz    108.000000 MHz
    DMT 0x23:  1280x1024   60.019740 Hz   5:4     63.981 kHz    108.000000 MHz
    DMT 0x3a:  1680x1050   59.954250 Hz  16:10    65.290 kHz    146.250000 MHz
  Detailed Timing Descriptors:
    DTD 1:  2048x1152   59.908732 Hz  16:9     70.992 kHz    156.750000 MHz (597 mm x 336 mm)
                 Hfront   48 Hsync  32 Hback   80 Hpol P
                 Vfront    3 Vsync   5 Vback   25 Vpol N
    Display Range Limits:
      Monitor ranges (GTF): 56-60 Hz V, 31-94 kHz H, max dotclock 170 MHz
    Display Product Name: 'Acer B273HU'
    Display Product Serial Number: ...
  Extension blocks: 1
Checksum: 0x99

----------------

Block 1, CTA-861 Extension Block:
  Revision: 3
  Basic audio support
  Supports YCbCr 4:4:4
  Supports YCbCr 4:2:2
  Native DTDs: 0
  Video Data Block:
    VIC   1:   640x480    59.940476 Hz   4:3     31.469 kHz     25.175000 MHz
    VIC   2:   720x480    59.940060 Hz   4:3     31.469 kHz     27.000000 MHz
    VIC   3:   720x480    59.940060 Hz  16:9     31.469 kHz     27.000000 MHz
    VIC   4:  1280x720    60.000000 Hz  16:9     45.000 kHz     74.250000 MHz
    VIC   5:  1920x1080i  60.000000 Hz  16:9     33.750 kHz     74.250000 MHz
    VIC  16:  1920x1080   60.000000 Hz  16:9     67.500 kHz    148.500000 MHz
  Audio Data Block:
    Linear PCM:
      Max channels: 2
      Supported sample rates (kHz): 48 44.1 32
      Supported sample sizes (bits): 24 20 16
  Speaker Allocation Data Block:
    FL/FR - Front Left/Right
  Vendor-Specific Data Block (HDMI), OUI 00-0C-03:
    Source physical address: 1.0.0.0
    Supports_AI
    DC_36bit
    DC_30bit
    DC_Y444
    Maximum TMDS clock: 225 MHz
  Detailed Timing Descriptors:
    DTD 2:  1920x1080   50.000000 Hz  16:9     56.250 kHz    148.500000 MHz (510 mm x 287 mm)
                 Hfront  528 Hsync  44 Hback  148 Hpol N
                 Vfront    9 Vsync   6 Vback   30 Vpol N
    DTD 3:  1920x1080i  60.000000 Hz  16:9     33.750 kHz     74.250000 MHz (510 mm x 287 mm)
                 Hfront   88 Hsync  44 Hback  148 Hpol P
                 Vfront    2 Vsync   5 Vback   15 Vpol P Vfront +0.5 Odd Field
                 Vfront    2 Vsync   5 Vback   15 Vpol P Vback  +0.5 Even Field
    DTD 4:  1280x512    83.025830 Hz   5:2     45.000 kHz     74.250000 MHz (510 mm x 287 mm)
                 Hfront  110 Hsync  40 Hback  220 Hpol P
                 Vfront    5 Vsync   5 Vback   20 Vpol P
    DTD 5:   720x480    59.940060 Hz   3:2     31.469 kHz     27.000000 MHz (510 mm x 287 mm)
                 Hfront   16 Hsync  62 Hback   60 Hpol N
                 Vfront    9 Vsync   6 Vback   30 Vpol N
Checksum: 0x02  Unused space in Extension Block: 23 bytes

----------------

Warnings:

Block 1, CTA-861 Extension Block:
  IT Video Formats are overscanned by default, but normally this should be underscanned.
  Video Data Block: VIC 1 and the first DTD are not identical. Is this intended?
  Video Data Block: All VICs are in ascending order, and the first (preferred) VIC <= 4, is that intended?
  Detailed Timing Descriptor #2: DTD is similar but not identical to VIC 31.
  Detailed Timing Descriptor #4: Image size is 510x287 mm, but based on the picture AR it should be 510x204 mm.
  Detailed Timing Descriptor #5: Image size is 510x287 mm, but based on the picture AR it should be 430x287 mm.
  Display Product Serial Number is set, so the Serial Number in the Base EDID should be 0.
  Add a Colorimetry Data Block with the sRGB colorimetry bit set to avoid interop issues.
EDID:
  Base EDID: Some timings are out of range of the Monitor Ranges:
    Vertical Freq: 50.000 - 83.026 Hz (Monitor: 56.000 - 60.000 Hz)

Failures:

Block 1, CTA-861 Extension Block:
  Detailed Timing Descriptor #2: Mismatch of image size 510x287 mm vs display size 600x340 mm.
  Detailed Timing Descriptor #3: Mismatch of image size 510x287 mm vs display size 600x340 mm.
  Detailed Timing Descriptor #4: Mismatch of image size 510x287 mm vs display size 600x340 mm.
  Detailed Timing Descriptor #5: Mismatch of image size 510x287 mm vs display size 600x340 mm.
  Missing VCDB, needed for Set Selectable RGB Quantization to avoid interop issues.
EDID:
  Extension Block 2 started with EDID header, ignoring Extension Blocks >= 2.

EDID conformity: FAIL
