edid-decode (hex):

00 ff ff ff ff ff ff 00 04 72 8e 05 13 5d 90 72
1d 1b 01 03 80 30 1b 78 2a e1 e5 a6 55 51 a0 27
13 50 54 b3 0c 00 d1 c0 b3 00 95 00 81 80 81 00
81 c0 71 4f 01 01 68 42 80 6a 70 38 27 40 08 20
98 04 dd 0c 11 00 00 1e 02 3a 80 18 71 38 2d 40
58 2c 45 00 dd 0c 11 00 00 1e 00 00 00 fd 00 30
4b 1e 53 11 00 0a 20 20 20 20 20 20 00 00 00 fc
00 41 63 65 72 20 4b 47 32 32 31 51 0a 20 01 ed

02 03 27 f1 4b 90 02 03 04 11 12 13 05 14 1f 01
23 09 07 01 83 01 00 00 65 03 0c 00 10 00 68 1a
00 00 01 01 30 4b e6 02 3a 80 18 71 38 2d 40 58
2c 45 00 dd 0c 11 00 00 1e 8c 0a d0 8a 20 e0 2d
10 10 3e 96 00 dd 0c 11 00 00 18 01 1d 00 72 51
d0 1e 20 6e 28 55 00 dd 0c 11 00 00 1e 8c 0a d0
90 20 40 31 20 0c 40 55 00 dd 0c 11 00 00 18 00
00 00 00 00 00 00 00 00 00 00 00 00 00 00 00 35

00 ff ff ff ff ff ff 00 04 72 8e 05 13 5d 90 72
1d 1b 01 03 80 30 1b 78 2a e1 e5 a6 55 51 a0 27
13 50 54 b3 0c 00 d1 c0 b3 00 95 00 81 80 81 00
81 c0 71 4f 01 01 68 42 80 6a 70 38 27 40 08 20
98 04 dd 0c 11 00 00 1e 02 3a 80 18 71 38 2d 40
58 2c 45 00 dd 0c 11 00 00 1e 00 00 00 fd 00 30
4b 1e 53 11 00 0a 20 20 20 20 20 20 00 00 00 fc
00 41 63 65 72 20 4b 47 32 32 31 51 0a 20 01 ed

02 03 27 f1 4b 90 02 03 04 11 12 13 05 14 1f 01
23 09 07 01 83 01 00 00 65 03 0c 00 10 00 68 1a
00 00 01 01 30 4b e6 02 3a 80 18 71 38 2d 40 58
2c 45 00 dd 0c 11 00 00 1e 8c 0a d0 8a 20 e0 2d
10 10 3e 96 00 dd 0c 11 00 00 18 01 1d 00 72 51
d0 1e 20 6e 28 55 00 dd 0c 11 00 00 1e 8c 0a d0
90 20 40 31 20 0c 40 55 00 dd 0c 11 00 00 18 00
00 00 00 00 00 00 00 00 00 00 00 00 00 00 00 35

----------------

Block 0, Base EDID:
  EDID Structure Version & Revision: 1.3
  Vendor & Product Identification:
    Manufacturer: ACR
    Model: 1422
    Serial Number: ...
    Made in: week 29 of 2017
  Basic Display Parameters & Features:
    Digital display
    Maximum image size: 48 cm x 27 cm
    Gamma: 2.20
    DPMS levels: Off
    RGB color display
    First detailed timing is the preferred timing
  Color Characteristics:
    Red  : 0.6513, 0.3339
    Green: 0.3164, 0.6259
    Blue : 0.1552, 0.0761
    White: 0.3134, 0.3291
  Established Timings I & II:
    IBM     :   720x400    70.081663 Hz   9:5     31.467 kHz     28.320000 MHz
    DMT 0x04:   640x480    59.940476 Hz   4:3     31.469 kHz     25.175000 MHz
    Apple   :   640x480    66.666667 Hz   4:3     35.000 kHz     30.240000 MHz
    DMT 0x08:   800x600    56.250000 Hz   4:3     35.156 kHz     36.000000 MHz
    DMT 0x09:   800x600    60.316541 Hz   4:3     37.879 kHz     40.000000 MHz
    DMT 0x10:  1024x768    60.003840 Hz   4:3     48.363 kHz     65.000000 MHz
    DMT 0x11:  1024x768    70.069359 Hz   4:3     56.476 kHz     75.000000 MHz
  Standard Timings:
    DMT 0x52:  1920x1080   60.000000 Hz  16:9     67.500 kHz    148.500000 MHz
    DMT 0x3a:  1680x1050   59.954250 Hz  16:10    65.290 kHz    146.250000 MHz
    DMT 0x2f:  1440x900    59.887445 Hz  16:10    55.935 kHz    106.500000 MHz
    DMT 0x23:  1280x1024   60.019740 Hz   5:4     63.981 kHz    108.000000 MHz
    DMT 0x1c:  1280x800    59.810326 Hz  16:10    49.702 kHz     83.500000 MHz
    DMT 0x55:  1280x720    60.000000 Hz  16:9     45.000 kHz     74.250000 MHz
    DMT 0x15:  1152x864    75.000000 Hz   4:3     67.500 kHz    108.000000 MHz
  Detailed Timing Descriptors:
    DTD 1:  1920x1080   74.985863 Hz  16:9     83.909 kHz    170.000000 MHz (477 mm x 268 mm)
                 Hfront    8 Hsync  32 Hback   66 Hpol P
                 Vfront   25 Vsync   8 Vback    6 Vpol P
    DTD 2:  1920x1080   60.000000 Hz  16:9     67.500 kHz    148.500000 MHz (477 mm x 268 mm)
                 Hfront   88 Hsync  44 Hback  148 Hpol P
                 Vfront    4 Vsync   5 Vback   36 Vpol P
    Display Range Limits:
      Monitor ranges (GTF): 48-75 Hz V, 30-83 kHz H, max dotclock 170 MHz
    Display Product Name: 'Acer KG221Q'
  Extension blocks: 1
Checksum: 0xed

----------------

Block 1, CTA-861 Extension Block:
  Revision: 3
  Underscans IT Video Formats by default
  Basic audio support
  Supports YCbCr 4:4:4
  Supports YCbCr 4:2:2
  Native DTDs: 1
  Video Data Block:
    VIC  16:  1920x1080   60.000000 Hz  16:9     67.500 kHz    148.500000 MHz (native)
    VIC   2:   720x480    59.940060 Hz   4:3     31.469 kHz     27.000000 MHz
    VIC   3:   720x480    59.940060 Hz  16:9     31.469 kHz     27.000000 MHz
    VIC   4:  1280x720    60.000000 Hz  16:9     45.000 kHz     74.250000 MHz
    VIC  17:   720x576    50.000000 Hz   4:3     31.250 kHz     27.000000 MHz
    VIC  18:   720x576    50.000000 Hz  16:9     31.250 kHz     27.000000 MHz
    VIC  19:  1280x720    50.000000 Hz  16:9     37.500 kHz     74.250000 MHz
    VIC   5:  1920x1080i  60.000000 Hz  16:9     33.750 kHz     74.250000 MHz
    VIC  20:  1920x1080i  50.000000 Hz  16:9     28.125 kHz     74.250000 MHz
    VIC  31:  1920x1080   50.000000 Hz  16:9     56.250 kHz    148.500000 MHz
    VIC   1:   640x480    59.940476 Hz   4:3     31.469 kHz     25.175000 MHz
  Audio Data Block:
    Linear PCM:
      Max channels: 2
      Supported sample rates (kHz): 48 44.1 32
      Supported sample sizes (bits): 16
  Speaker Allocation Data Block:
    FL/FR - Front Left/Right
  Vendor-Specific Data Block (HDMI), OUI 00-0C-03:
    Source physical address: 1.0.0.0
  Vendor-Specific Data Block (AMD), OUI 00-00-1A:
    Version: 1
    Flags 1: 0x01
      FreeSync Supported
    Minimum Refresh Rate: 48 Hz
    Maximum Refresh Rate: 75 Hz
    MCCS VCP Code: 0xe6
  Detailed Timing Descriptors:
    DTD 3:  1920x1080   60.000000 Hz  16:9     67.500 kHz    148.500000 MHz (477 mm x 268 mm)
                 Hfront   88 Hsync  44 Hback  148 Hpol P
                 Vfront    4 Vsync   5 Vback   36 Vpol P
    DTD 4:   720x480    59.940060 Hz   3:2     31.469 kHz     27.000000 MHz (477 mm x 268 mm)
                 Hfront   16 Hsync  62 Hback   60 Hpol N
                 Vfront    9 Vsync   6 Vback   30 Vpol N
    DTD 5:  1280x720    60.000000 Hz  16:9     45.000 kHz     74.250000 MHz (477 mm x 268 mm)
                 Hfront  110 Hsync  40 Hback  220 Hpol P
                 Vfront    5 Vsync   5 Vback   20 Vpol P
    DTD 6:   720x576    50.000000 Hz   5:4     31.250 kHz     27.000000 MHz (477 mm x 268 mm)
                 Hfront   12 Hsync  64 Hback   68 Hpol N
                 Vfront    5 Vsync   5 Vback   39 Vpol N
Checksum: 0x35  Unused space in Extension Block: 16 bytes

----------------

Warnings:

Block 1, CTA-861 Extension Block:
  Video Data Block: VIC 16 and the first DTD are not identical. Is this intended?
  Detailed Timing Descriptor #4: Image size is 477x268 mm, but based on the picture AR it should be 402x268 mm.
  Detailed Timing Descriptor #6: Image size is 477x268 mm, but based on the picture AR it should be 335x268 mm.
  Add a Colorimetry Data Block with the sRGB colorimetry bit set to avoid interop issues.
EDID:
  Base EDID: Some timings are out of range of the Monitor Ranges:
    Horizontal Freq: 28.125 - 83.909 kHz (Monitor: 30.000 - 83.000 kHz)
    Maximum Clock: 170.000 MHz (Monitor: 170.000 MHz)

Failures:

Block 1, CTA-861 Extension Block:
  Missing VCDB, needed for Set Selectable RGB Quantization to avoid interop issues.
EDID:
  Extension Block 2 started with EDID header, ignoring Extension Blocks >= 2.

EDID conformity: FAIL
