edid-decode (hex):

00 ff ff ff ff ff ff 00 34 65 ea 03 01 01 01 01
00 14 01 03 80 10 09 78 0a ee 95 a3 54 4c 99 26
0f 50 54 21 08 00 81 00 81 80 90 40 95 00 a9 40
b3 00 01 01 01 01 02 3a 80 18 71 38 2d 40 58 2c
45 00 a0 5a 00 00 00 1e 66 21 50 b0 51 00 1b 30
40 70 36 00 a0 5a 00 00 00 1e 00 00 00 fc 00 4d
65 74 7a 20 54 56 0a 20 20 20 20 20 00 00 00 fd
00 18 3c 0f 4b 17 00 0a 20 20 20 20 20 20 01 d8

02 03 27 f1 83 01 00 00 67 03 0c 00 10 00 b8 2d
23 09 07 01 52 90 1f 20 22 21 05 14 04 13 12 11
03 02 16 15 07 06 01 01 1d 00 72 51 d0 1e 20 6e
28 55 00 a0 5a 00 00 00 1e 01 1d 00 bc 52 d0 1e
20 b8 28 55 40 a0 5a 00 00 00 1e 8c 0a d0 8a 20
e0 2d 10 10 3e 96 00 a0 5a 00 00 00 18 8c 0a d0
90 20 40 31 20 0c 40 55 00 a0 5a 00 00 00 18 00
00 00 00 00 00 00 00 00 00 00 00 00 00 00 00 95

00 ff ff ff ff ff ff 00 34 65 ea 03 01 01 01 01
00 14 01 03 80 10 09 78 0a ee 95 a3 54 4c 99 26
0f 50 54 21 08 00 81 00 81 80 90 40 95 00 a9 40
b3 00 01 01 01 01 02 3a 80 18 71 38 2d 40 58 2c
45 00 a0 5a 00 00 00 1e 66 21 50 b0 51 00 1b 30
40 70 36 00 a0 5a 00 00 00 1e 00 00 00 fc 00 4d
65 74 7a 20 54 56 0a 20 20 20 20 20 00 00 00 fd
00 18 3c 0f 4b 17 00 0a 20 20 20 20 20 20 01 d8

02 03 27 f1 83 01 00 00 67 03 0c 00 10 00 b8 2d
23 09 07 01 52 90 1f 20 22 21 05 14 04 13 12 11
03 02 16 15 07 06 01 01 1d 00 72 51 d0 1e 20 6e
28 55 00 a0 5a 00 00 00 1e 01 1d 00 bc 52 d0 1e
20 b8 28 55 40 a0 5a 00 00 00 1e 8c 0a d0 8a 20
e0 2d 10 10 3e 96 00 a0 5a 00 00 00 18 8c 0a d0
90 20 40 31 20 0c 40 55 00 a0 5a 00 00 00 18 00
00 00 00 00 00 00 00 00 00 00 00 00 00 00 00 95

----------------

Block 0, Base EDID:
  EDID Structure Version & Revision: 1.3
  Vendor & Product Identification:
    Manufacturer: MCE
    Model: 1002
    Serial Number: ...
    Made in: 2010
  Basic Display Parameters & Features:
    Digital display
    Maximum image size: 16 cm x 9 cm
    Gamma: 2.20
    RGB color display
    First detailed timing is the preferred timing
  Color Characteristics:
    Red  : 0.6396, 0.3300
    Green: 0.2998, 0.5996
    Blue : 0.1503, 0.0595
    White: 0.3134, 0.3291
  Established Timings I & II:
    DMT 0x04:   640x480    59.940476 Hz   4:3     31.469 kHz     25.175000 MHz
    DMT 0x09:   800x600    60.316541 Hz   4:3     37.879 kHz     40.000000 MHz
    DMT 0x10:  1024x768    60.003840 Hz   4:3     48.363 kHz     65.000000 MHz
  Standard Timings:
    DMT 0x1c:  1280x800    59.810326 Hz  16:10    49.702 kHz     83.500000 MHz
    DMT 0x23:  1280x1024   60.019740 Hz   5:4     63.981 kHz    108.000000 MHz
    DMT 0x2a:  1400x1050   59.978442 Hz   4:3     65.317 kHz    121.750000 MHz
    DMT 0x2f:  1440x900    59.887445 Hz  16:10    55.935 kHz    106.500000 MHz
    DMT 0x33:  1600x1200   60.000000 Hz   4:3     75.000 kHz    162.000000 MHz
    DMT 0x3a:  1680x1050   59.954250 Hz  16:10    65.290 kHz    146.250000 MHz
  Detailed Timing Descriptors:
    DTD 1:  1920x1080   60.000000 Hz  16:9     67.500 kHz    148.500000 MHz (160 mm x 90 mm)
                 Hfront   88 Hsync  44 Hback  148 Hpol P
                 Vfront    4 Vsync   5 Vback   36 Vpol P
    DTD 2:  1360x768    60.015162 Hz  85:48    47.712 kHz     85.500000 MHz (160 mm x 90 mm)
                 Hfront   64 Hsync 112 Hback  256 Hpol P
                 Vfront    3 Vsync   6 Vback   18 Vpol P
    Display Product Name: 'Metz TV'
    Display Range Limits:
      Monitor ranges (GTF): 24-60 Hz V, 15-75 kHz H, max dotclock 230 MHz
  Extension blocks: 1
Checksum: 0xd8

----------------

Block 1, CTA-861 Extension Block:
  Revision: 3
  Underscans IT Video Formats by default
  Basic audio support
  Supports YCbCr 4:4:4
  Supports YCbCr 4:2:2
  Native DTDs: 1
  Speaker Allocation Data Block:
    FL/FR - Front Left/Right
  Vendor-Specific Data Block (HDMI), OUI 00-0C-03:
    Source physical address: 1.0.0.0
    Supports_AI
    DC_36bit
    DC_30bit
    DC_Y444
    Maximum TMDS clock: 225 MHz
  Audio Data Block:
    Linear PCM:
      Max channels: 2
      Supported sample rates (kHz): 48 44.1 32
      Supported sample sizes (bits): 16
  Video Data Block:
    VIC  16:  1920x1080   60.000000 Hz  16:9     67.500 kHz    148.500000 MHz (native)
    VIC  31:  1920x1080   50.000000 Hz  16:9     56.250 kHz    148.500000 MHz
    VIC  32:  1920x1080   24.000000 Hz  16:9     27.000 kHz     74.250000 MHz
    VIC  34:  1920x1080   30.000000 Hz  16:9     33.750 kHz     74.250000 MHz
    VIC  33:  1920x1080   25.000000 Hz  16:9     28.125 kHz     74.250000 MHz
    VIC   5:  1920x1080i  60.000000 Hz  16:9     33.750 kHz     74.250000 MHz
    VIC  20:  1920x1080i  50.000000 Hz  16:9     28.125 kHz     74.250000 MHz
    VIC   4:  1280x720    60.000000 Hz  16:9     45.000 kHz     74.250000 MHz
    VIC  19:  1280x720    50.000000 Hz  16:9     37.500 kHz     74.250000 MHz
    VIC  18:   720x576    50.000000 Hz  16:9     31.250 kHz     27.000000 MHz
    VIC  17:   720x576    50.000000 Hz   4:3     31.250 kHz     27.000000 MHz
    VIC   3:   720x480    59.940060 Hz  16:9     31.469 kHz     27.000000 MHz
    VIC   2:   720x480    59.940060 Hz   4:3     31.469 kHz     27.000000 MHz
    VIC  22:  1440x576i   50.000000 Hz  16:9     15.625 kHz     27.000000 MHz
    VIC  21:  1440x576i   50.000000 Hz   4:3     15.625 kHz     27.000000 MHz
    VIC   7:  1440x480i   59.940060 Hz  16:9     15.734 kHz     27.000000 MHz
    VIC   6:  1440x480i   59.940060 Hz   4:3     15.734 kHz     27.000000 MHz
    VIC   1:   640x480    59.940476 Hz   4:3     31.469 kHz     25.175000 MHz
  Detailed Timing Descriptors:
    DTD 3:  1280x720    60.000000 Hz  16:9     45.000 kHz     74.250000 MHz (160 mm x 90 mm)
                 Hfront  110 Hsync  40 Hback  220 Hpol P
                 Vfront    5 Vsync   5 Vback   20 Vpol P
    DTD 4:  1280x720    50.000000 Hz  16:9     37.500 kHz     74.250000 MHz (160 mm x 90 mm)
                 Hfront  440 Hsync  40 Hback  220 Hpol P
                 Vfront    5 Vsync   5 Vback   20 Vpol P
    DTD 5:   720x480    59.940060 Hz   3:2     31.469 kHz     27.000000 MHz (160 mm x 90 mm)
                 Hfront   16 Hsync  62 Hback   60 Hpol N
                 Vfront    9 Vsync   6 Vback   30 Vpol N
    DTD 6:   720x576    50.000000 Hz   5:4     31.250 kHz     27.000000 MHz (160 mm x 90 mm)
                 Hfront   12 Hsync  64 Hback   68 Hpol N
                 Vfront    5 Vsync   5 Vback   39 Vpol N
Checksum: 0x95  Unused space in Extension Block: 16 bytes

----------------

Warnings:

Block 0, Base EDID:
  Vendor & Product Identification: The serial number is one of the known dummy values, it should probably be set to 0.
  Basic Display Parameters & Features: Dubious maximum image size (16x9 is smaller than 10x10 cm).
  Detailed Timing Descriptor #1: Dubious image size (160x90 mm is smaller than 100x100 mm).
  Detailed Timing Descriptor #2: Dubious image size (160x90 mm is smaller than 100x100 mm).
Block 1, CTA-861 Extension Block:
  Detailed Timing Descriptor #3: Dubious image size (160x90 mm is smaller than 100x100 mm).
  Detailed Timing Descriptor #4: Dubious image size (160x90 mm is smaller than 100x100 mm).
  Detailed Timing Descriptor #5: Dubious image size (160x90 mm is smaller than 100x100 mm).
  Detailed Timing Descriptor #6: Dubious image size (160x90 mm is smaller than 100x100 mm).
  Add a Colorimetry Data Block with the sRGB colorimetry bit set to avoid interop issues.

Failures:

Block 1, CTA-861 Extension Block:
  Missing VCDB, needed for Set Selectable RGB Quantization to avoid interop issues.
EDID:
  Extension Block 2 started with EDID header, ignoring Extension Blocks >= 2.

EDID conformity: FAIL
