edid-decode (hex):

00 ff ff ff ff ff ff 00 06 b3 31 30 00 00 00 00
19 1f 01 04 b5 45 1d 78 3b 85 25 a6 57 4e a3 26
0c 50 54 bf ef 80 d1 c0 b3 00 95 00 81 80 81 40
81 c0 01 01 01 01 cd ff 00 70 a0 38 22 40 18 20
fa 00 b2 23 21 00 00 1a 00 00 00 ff 00 4e 33 4c
4d 54 46 30 31 35 33 33 32 0a 00 00 00 fc 00 58
47 33 30 39 43 4d 0a 20 20 20 20 20 00 00 00 fd
00 30 dd fa fa 42 01 0a 20 20 20 20 20 20 01 49

02 03 38 f1 4f 01 02 03 11 12 13 04 1f 90 3f 59
5a 60 61 5c 23 09 07 07 83 01 00 00 e2 00 6a 6d
1a 00 00 02 01 30 dd 00 00 00 00 00 00 e3 05 c0
01 e6 06 05 01 55 55 1c cf ca 00 a0 a0 38 4e 40
30 20 d8 0c b2 23 21 00 00 1a 41 f6 00 a0 a0 38
50 40 30 20 f8 0c b2 23 21 00 00 1a 58 4d 00 b8
a1 38 14 40 f8 2c 45 00 b2 23 21 00 00 1e 00 00
00 00 00 00 00 00 00 00 00 00 00 00 00 00 00 f6

00 ff ff ff ff ff ff 00 06 b3 31 30 00 00 00 00
19 1f 01 04 b5 45 1d 78 3b 85 25 a6 57 4e a3 26
0c 50 54 bf ef 80 d1 c0 b3 00 95 00 81 80 81 40
81 c0 01 01 01 01 cd ff 00 70 a0 38 22 40 18 20
fa 00 b2 23 21 00 00 1a 00 00 00 ff 00 4e 33 4c
4d 54 46 30 31 35 33 33 32 0a 00 00 00 fc 00 58
47 33 30 39 43 4d 0a 20 20 20 20 20 00 00 00 fd
00 30 dd fa fa 42 01 0a 20 20 20 20 20 20 01 49

02 03 38 f1 4f 01 02 03 11 12 13 04 1f 90 3f 59
5a 60 61 5c 23 09 07 07 83 01 00 00 e2 00 6a 6d
1a 00 00 02 01 30 dd 00 00 00 00 00 00 e3 05 c0
01 e6 06 05 01 55 55 1c cf ca 00 a0 a0 38 4e 40
30 20 d8 0c b2 23 21 00 00 1a 41 f6 00 a0 a0 38
50 40 30 20 f8 0c b2 23 21 00 00 1a 58 4d 00 b8
a1 38 14 40 f8 2c 45 00 b2 23 21 00 00 1e 00 00
00 00 00 00 00 00 00 00 00 00 00 00 00 00 00 f6

----------------

Block 0, Base EDID:
  EDID Structure Version & Revision: 1.4
  Vendor & Product Identification:
    Manufacturer: AUS
    Model: 12337
    Made in: week 25 of 2021
  Basic Display Parameters & Features:
    Digital display
    Bits per primary color channel: 10
    DisplayPort interface
    Maximum image size: 69 cm x 29 cm
    Gamma: 2.20
    DPMS levels: Off
    Supported color formats: RGB 4:4:4, YCrCb 4:4:4, YCrCb 4:2:2
    First detailed timing includes the native pixel format and preferred refresh rate
    Display supports continuous frequencies
  Color Characteristics:
    Red  : 0.6503, 0.3398
    Green: 0.3056, 0.6376
    Blue : 0.1484, 0.0488
    White: 0.3134, 0.3291
  Established Timings I & II:
    IBM     :   720x400    70.081663 Hz   9:5     31.467 kHz     28.320000 MHz
    DMT 0x04:   640x480    59.940476 Hz   4:3     31.469 kHz     25.175000 MHz
    Apple   :   640x480    66.666667 Hz   4:3     35.000 kHz     30.240000 MHz
    DMT 0x05:   640x480    72.808802 Hz   4:3     37.861 kHz     31.500000 MHz
    DMT 0x06:   640x480    75.000000 Hz   4:3     37.500 kHz     31.500000 MHz
    DMT 0x08:   800x600    56.250000 Hz   4:3     35.156 kHz     36.000000 MHz
    DMT 0x09:   800x600    60.316541 Hz   4:3     37.879 kHz     40.000000 MHz
    DMT 0x0a:   800x600    72.187572 Hz   4:3     48.077 kHz     50.000000 MHz
    DMT 0x0b:   800x600    75.000000 Hz   4:3     46.875 kHz     49.500000 MHz
    Apple   :   832x624    74.551266 Hz   4:3     49.726 kHz     57.284000 MHz
    DMT 0x10:  1024x768    60.003840 Hz   4:3     48.363 kHz     65.000000 MHz
    DMT 0x11:  1024x768    70.069359 Hz   4:3     56.476 kHz     75.000000 MHz
    DMT 0x12:  1024x768    75.028582 Hz   4:3     60.023 kHz     78.750000 MHz
    DMT 0x24:  1280x1024   75.024675 Hz   5:4     79.976 kHz    135.000000 MHz
    Apple   :  1152x870    75.061550 Hz 192:145   68.681 kHz    100.000000 MHz
  Standard Timings:
    DMT 0x52:  1920x1080   60.000000 Hz  16:9     67.500 kHz    148.500000 MHz
    DMT 0x3a:  1680x1050   59.954250 Hz  16:10    65.290 kHz    146.250000 MHz
    DMT 0x2f:  1440x900    59.887445 Hz  16:10    55.935 kHz    106.500000 MHz
    DMT 0x23:  1280x1024   60.019740 Hz   5:4     63.981 kHz    108.000000 MHz
    DMT 0x20:  1280x960    60.000000 Hz   4:3     60.000 kHz    108.000000 MHz
    DMT 0x55:  1280x720    60.000000 Hz  16:9     45.000 kHz     74.250000 MHz
  Detailed Timing Descriptors:
    DTD 1:  2560x1080  219.998737 Hz  64:27   245.079 kHz    654.850000 MHz (690 mm x 291 mm)
                 Hfront   24 Hsync  32 Hback   56 Hpol P
                 Vfront   15 Vsync  10 Vback    9 Vpol N
    Display Product Serial Number: ...
    Display Product Name: 'XG309CM'
    Display Range Limits:
      Monitor ranges (Range Limits Only): 48-221 Hz V, 250-250 kHz H, max dotclock 660 MHz
  Extension blocks: 1
Checksum: 0x49

----------------

Block 1, CTA-861 Extension Block:
  Revision: 3
  Underscans IT Video Formats by default
  Basic audio support
  Supports YCbCr 4:4:4
  Supports YCbCr 4:2:2
  Native DTDs: 1
  Video Data Block:
    VIC   1:   640x480    59.940476 Hz   4:3     31.469 kHz     25.175000 MHz
    VIC   2:   720x480    59.940060 Hz   4:3     31.469 kHz     27.000000 MHz
    VIC   3:   720x480    59.940060 Hz  16:9     31.469 kHz     27.000000 MHz
    VIC  17:   720x576    50.000000 Hz   4:3     31.250 kHz     27.000000 MHz
    VIC  18:   720x576    50.000000 Hz  16:9     31.250 kHz     27.000000 MHz
    VIC  19:  1280x720    50.000000 Hz  16:9     37.500 kHz     74.250000 MHz
    VIC   4:  1280x720    60.000000 Hz  16:9     45.000 kHz     74.250000 MHz
    VIC  31:  1920x1080   50.000000 Hz  16:9     56.250 kHz    148.500000 MHz
    VIC  16:  1920x1080   60.000000 Hz  16:9     67.500 kHz    148.500000 MHz (native)
    VIC  63:  1920x1080  120.000000 Hz  16:9    135.000 kHz    297.000000 MHz
    VIC  89:  2560x1080   50.000000 Hz  64:27    56.250 kHz    185.625000 MHz
    VIC  90:  2560x1080   60.000000 Hz  64:27    66.000 kHz    198.000000 MHz
    VIC  96:  3840x2160   50.000000 Hz  16:9    112.500 kHz    594.000000 MHz
    VIC  97:  3840x2160   60.000000 Hz  16:9    135.000 kHz    594.000000 MHz
    VIC  92:  2560x1080  120.000000 Hz  64:27   150.000 kHz    495.000000 MHz
  Audio Data Block:
    Linear PCM:
      Max channels: 2
      Supported sample rates (kHz): 48 44.1 32
      Supported sample sizes (bits): 24 20 16
  Speaker Allocation Data Block:
    FL/FR - Front Left/Right
  Video Capability Data Block:
    YCbCr quantization: No Data
    RGB quantization: Selectable (via AVI Q)
    PT scan behavior: Always Underscanned
    IT scan behavior: Always Underscanned
    CE scan behavior: Always Underscanned
  Vendor-Specific Data Block (AMD), OUI 00-00-1A:
    Version: 2
    Flags 1: 0x01
      FreeSync Supported
    Minimum Refresh Rate: 48 Hz
    Maximum Refresh Rate: 221 Hz
    Flags 5: 0x00
  Colorimetry Data Block:
    BT2020YCC
    BT2020RGB
    Gamut Boundary Description Metadata Profile P0
  HDR Static Metadata Data Block:
    Electro optical transfer functions:
      Traditional gamma - SDR luminance range
      SMPTE ST2084
    Supported static metadata descriptors:
      Static metadata type 1
    Desired content max luminance: 85 (315.196 cd/m^2)
    Desired content max frame-average luminance: 85 (315.196 cd/m^2)
    Desired content min luminance: 28 (0.038 cd/m^2)
  Detailed Timing Descriptors:
    DTD 2:  2560x1080  164.834781 Hz  64:27   190.879 kHz    519.190000 MHz (690 mm x 291 mm)
                 Hfront   48 Hsync  32 Hback   80 Hpol P
                 Vfront   61 Vsync   8 Vback    9 Vpol N
    DTD 3:  2560x1080  199.800330 Hz  64:27   231.768 kHz    630.410000 MHz (690 mm x 291 mm)
                 Hfront   48 Hsync  32 Hback   80 Hpol P
                 Vfront   63 Vsync   8 Vback    9 Vpol N
    DTD 4:  2560x1080   60.000000 Hz  64:27    66.000 kHz    198.000000 MHz (690 mm x 291 mm)
                 Hfront  248 Hsync  44 Hback  148 Hpol P
                 Vfront    4 Vsync   5 Vback   11 Vpol P
Checksum: 0xf6  Unused space in Extension Block: 17 bytes

----------------

Warnings:

Block 1, CTA-861 Extension Block:
  Video Data Block: VIC 1 and the first DTD are not identical. Is this intended?
  Video Capability Data Block: Set Selectable YCbCr Quantization to avoid interop issues.
  Video Capability Data Block: S_PT is equal to S_IT and S_CE, so should be set to 0 instead.
  Colorimetry Data Block: Set the sRGB colorimetry bit to avoid interop issues.
EDID:
  Base EDID: Some timings are out of range of the Monitor Ranges:
    Horizontal Freq: 31.250 - 245.078 kHz (Monitor: 250.000 - 250.000 kHz)

Failures:

EDID:
  Extension Block 2 started with EDID header, ignoring Extension Blocks >= 2.
  CTA-861: Native progressive timings are a mix of several resolutions.

EDID conformity: FAIL
