edid-decode (hex):

00 ff ff ff ff ff ff 00 21 63 00 20 01 00 00 00
12 15 01 04 00 2c 19 78 ca 00 10 a0 57 49 9b 26
10 48 4c ad cf 00 61 4c 81 80 81 8a 81 8c 01 01
01 01 01 01 01 01 ab 22 a0 a0 50 84 1a 30 30 20
36 00 c7 00 11 00 00 1a 30 2a 40 c8 60 84 64 30
18 50 13 00 b4 f5 10 00 00 1a 00 00 00 ff 00 00
0a 20 20 20 20 20 20 20 20 20 20 20 00 00 00 fc
00 00 0a 20 20 20 20 20 20 20 20 20 20 20 00 15

00 ff ff ff ff ff ff 00 21 63 00 20 01 00 00 00
12 15 01 04 00 2c 19 78 ca 00 10 a0 57 49 9b 26
10 48 4c ad cf 00 61 4c 81 80 81 8a 81 8c 01 01
01 01 01 01 01 01 ab 22 a0 a0 50 84 1a 30 30 20
36 00 c7 00 11 00 00 1a 30 2a 40 c8 60 84 64 30
18 50 13 00 b4 f5 10 00 00 1a 00 00 00 ff 00 00
0a 20 20 20 20 20 20 20 20 20 20 20 00 00 00 fc
00 00 0a 20 20 20 20 20 20 20 20 20 20 20 00 15

----------------

Block 0, Base EDID:
  EDID Structure Version & Revision: 1.4
  Vendor & Product Identification:
    Manufacturer: HKC
    Model: 8192
    Serial Number: ...
    Made in: week 18 of 2011
  Basic Display Parameters & Features:
    Analog display
    Signal Level Standard: 0.700 : 0.300 : 1.000 V p-p
    Blank level equals black level
    Maximum image size: 44 cm x 25 cm
    Gamma: 2.20
    DPMS levels: Standby Suspend
    RGB color display
    First detailed timing includes the native pixel format and preferred refresh rate
  Color Characteristics:
    Red  : 0.6250, 0.3398
    Green: 0.2851, 0.6054
    Blue : 0.1484, 0.0634
    White: 0.2812, 0.2968
  Established Timings I & II:
    IBM     :   720x400    70.081663 Hz   9:5     31.467 kHz     28.320000 MHz
    DMT 0x04:   640x480    59.940476 Hz   4:3     31.469 kHz     25.175000 MHz
    DMT 0x05:   640x480    72.808802 Hz   4:3     37.861 kHz     31.500000 MHz
    DMT 0x06:   640x480    75.000000 Hz   4:3     37.500 kHz     31.500000 MHz
    DMT 0x09:   800x600    60.316541 Hz   4:3     37.879 kHz     40.000000 MHz
    DMT 0x0a:   800x600    72.187572 Hz   4:3     48.077 kHz     50.000000 MHz
    DMT 0x0b:   800x600    75.000000 Hz   4:3     46.875 kHz     49.500000 MHz
    DMT 0x10:  1024x768    60.003840 Hz   4:3     48.363 kHz     65.000000 MHz
    DMT 0x11:  1024x768    70.069359 Hz   4:3     56.476 kHz     75.000000 MHz
    DMT 0x12:  1024x768    75.028582 Hz   4:3     60.023 kHz     78.750000 MHz
    DMT 0x24:  1280x1024   75.024675 Hz   5:4     79.976 kHz    135.000000 MHz
  Standard Timings:
    DMT 0x11:  1024x768    70.069359 Hz   4:3     56.476 kHz     75.000000 MHz
    DMT 0x23:  1280x1024   60.019740 Hz   5:4     63.981 kHz    108.000000 MHz
    GTF     :  1280x1024   69.999805 Hz   5:4     74.620 kHz    128.943000 MHz
    GTF     :  1280x1024   72.000069 Hz   5:4     76.824 kHz    132.752000 MHz
  Detailed Timing Descriptors:
    DTD 1:  1440x900    59.901458 Hz  16:10    55.469 kHz     88.750000 MHz (455 mm x 256 mm)
                 Hfront   48 Hsync  32 Hback   80 Hpol P
                 Vfront    3 Vsync   6 Vback   17 Vpol N
    DTD 2:  1600x900    60.000000 Hz  16:9     60.000 kHz    108.000000 MHz (436 mm x 245 mm)
                 Hfront   24 Hsync  80 Hback   96 Hpol P
                 Vfront    1 Vsync   3 Vback   96 Vpol N
    Display Product Serial Number: ...
    Display Product Name: ''
Checksum: 0x15

----------------

Block 1, Unknown EDID Extension Block 0x00:
  00 ff ff ff ff ff ff 00 21 63 00 20 01 00 00 00 '........!c. ....'
  12 15 01 04 00 2c 19 78 ca 00 10 a0 57 49 9b 26 '.....,.x....WI.&'
  10 48 4c ad cf 00 61 4c 81 80 81 8a 81 8c 01 01 '.HL...aL........'
  01 01 01 01 01 01 ab 22 a0 a0 50 84 1a 30 30 20 '......."..P..00 '
  36 00 c7 00 11 00 00 1a 30 2a 40 c8 60 84 64 30 '6.......0*@.`.d0'
  18 50 13 00 b4 f5 10 00 00 1a 00 00 00 ff 00 00 '.P..............'
  0a 20 20 20 20 20 20 20 20 20 20 20 00 00 00 fc '.           ....'
  00 00 0a 20 20 20 20 20 20 20 20 20 20 20 00 15 '...           ..'
Checksum: 0x15

----------------

Warnings:

Block 0, Base EDID:
  Vendor & Product Identification: The serial number is one of the known dummy values, it should probably be set to 0.
  Detailed Timing Descriptor #1: Image size is 455x256 mm, but based on the picture AR it should be 455x284 mm.
  Detailed Timing Descriptor #2: DTD is similar but not identical to DMT 0x53.

Failures:

Block 0, Base EDID:
  Display Product Serial Number: ...
  Detailed Timing Descriptor #1: Mismatch of image size 455x256 mm vs display size 440x250 mm.
  Display Product Name: NUL byte at position 0.
Block 1, Base EDID:
  Unknown Extension Block.
EDID:
  Base EDID: The DTD max image size is 455x256mm, which is larger than the display size 440.0x250.0mm.
  Base EDID: EDID specified 0 extension block(s), but found 1 extension block(s).

EDID conformity: FAIL
