edid-decode (hex):

00 ff ff ff ff ff ff 00 3d ef 70 02 01 00 00 00
1f 1e 01 04 a5 3c 21 78 3b dc 5b a3 54 4c 99 26
0f 47 49 ad 4b 00 81 80 61 7c 81 bc 95 00 95 3c
b3 00 b3 3c d1 fc 02 3a 80 18 71 38 2d 40 58 2c
45 00 55 50 21 00 00 1e 26 96 80 a0 70 38 28 40
58 2c 45 00 ba 89 21 00 00 1e 00 00 00 fd 00 32
a5 de de 27 01 0a 20 20 20 20 20 20 00 00 00 fc
00 32 37 6d 6f 6e 69 74 6f 72 0a 20 20 20 01 88

02 03 0c c1 23 09 07 07 83 01 00 00 fe 5b 80 a0
70 38 35 40 30 20 35 00 09 25 21 00 00 1e 86 6f
80 a0 70 38 40 40 30 20 35 00 09 25 21 00 00 1e
fb 81 80 a0 70 38 1f 40 30 20 35 00 09 25 21 00
00 1e 00 00 00 00 00 00 00 00 00 00 00 00 00 00
00 00 00 00 00 00 00 00 00 00 00 00 00 00 00 00
00 00 00 00 00 00 00 00 00 00 00 00 00 00 00 00
00 00 00 00 00 00 00 00 00 00 00 00 00 00 00 24

00 ff ff ff ff ff ff 00 3d ef 70 02 01 00 00 00
1f 1e 01 04 a5 3c 21 78 3b dc 5b a3 54 4c 99 26
0f 47 49 ad 4b 00 81 80 61 7c 81 bc 95 00 95 3c
b3 00 b3 3c d1 fc 02 3a 80 18 71 38 2d 40 58 2c
45 00 55 50 21 00 00 1e 26 96 80 a0 70 38 28 40
58 2c 45 00 ba 89 21 00 00 1e 00 00 00 fd 00 32
a5 de de 27 01 0a 20 20 20 20 20 20 00 00 00 fc
00 32 37 6d 6f 6e 69 74 6f 72 0a 20 20 20 01 88

02 03 0c c1 23 09 07 07 83 01 00 00 fe 5b 80 a0
70 38 35 40 30 20 35 00 09 25 21 00 00 1e 86 6f
80 a0 70 38 40 40 30 20 35 00 09 25 21 00 00 1e
fb 81 80 a0 70 38 1f 40 30 20 35 00 09 25 21 00
00 1e 00 00 00 00 00 00 00 00 00 00 00 00 00 00
00 00 00 00 00 00 00 00 00 00 00 00 00 00 00 00
00 00 00 00 00 00 00 00 00 00 00 00 00 00 00 00
00 00 00 00 00 00 00 00 00 00 00 00 00 00 00 24

----------------

Block 0, Base EDID:
  EDID Structure Version & Revision: 1.4
  Vendor & Product Identification:
    Manufacturer: OOO
    Model: 624
    Serial Number: ...
    Made in: week 31 of 2020
  Basic Display Parameters & Features:
    Digital display
    Bits per primary color channel: 8
    DisplayPort interface
    Maximum image size: 60 cm x 33 cm
    Gamma: 2.20
    DPMS levels: Off
    Supported color formats: RGB 4:4:4, YCrCb 4:4:4, YCrCb 4:2:2
    First detailed timing includes the native pixel format and preferred refresh rate
    Display supports continuous frequencies
  Color Characteristics:
    Red  : 0.6396, 0.3291
    Green: 0.2998, 0.5976
    Blue : 0.1494, 0.0595
    White: 0.2792, 0.2880
  Established Timings I & II:
    IBM     :   720x400    70.081663 Hz   9:5     31.467 kHz     28.320000 MHz
    DMT 0x04:   640x480    59.940476 Hz   4:3     31.469 kHz     25.175000 MHz
    DMT 0x05:   640x480    72.808802 Hz   4:3     37.861 kHz     31.500000 MHz
    DMT 0x06:   640x480    75.000000 Hz   4:3     37.500 kHz     31.500000 MHz
    DMT 0x09:   800x600    60.316541 Hz   4:3     37.879 kHz     40.000000 MHz
    DMT 0x0b:   800x600    75.000000 Hz   4:3     46.875 kHz     49.500000 MHz
    DMT 0x10:  1024x768    60.003840 Hz   4:3     48.363 kHz     65.000000 MHz
    DMT 0x12:  1024x768    75.028582 Hz   4:3     60.023 kHz     78.750000 MHz
    DMT 0x24:  1280x1024   75.024675 Hz   5:4     79.976 kHz    135.000000 MHz
  Standard Timings:
    DMT 0x23:  1280x1024   60.019740 Hz   5:4     63.981 kHz    108.000000 MHz
    GTF     :  1024x768   119.999931 Hz   4:3     98.760 kHz    139.054000 MHz
    GTF     :  1280x1024  120.000185 Hz   5:4    131.640 kHz    233.793000 MHz
    DMT 0x2f:  1440x900    59.887445 Hz  16:10    55.935 kHz    106.500000 MHz
    GTF     :  1440x900   119.999896 Hz  16:10   115.800 kHz    229.747000 MHz
    DMT 0x3a:  1680x1050   59.954250 Hz  16:10    65.290 kHz    146.250000 MHz
    GTF     :  1680x1050  120.000000 Hz  16:10   135.000 kHz    313.200000 MHz
    GTF     :  1920x1080  119.999987 Hz  16:9    138.840 kHz    368.759000 MHz
  Detailed Timing Descriptors:
    DTD 1:  1920x1080   60.000000 Hz  16:9     67.500 kHz    148.500000 MHz (597 mm x 336 mm)
                 Hfront   88 Hsync  44 Hback  148 Hpol P
                 Vfront    4 Vsync   5 Vback   36 Vpol P
    DTD 2:  1920x1080  164.998283 Hz  16:9    184.798 kHz    384.380000 MHz (698 mm x 393 mm)
                 Hfront   88 Hsync  44 Hback   28 Hpol P
                 Vfront    4 Vsync   5 Vback   31 Vpol P
    Display Range Limits:
      Monitor ranges (Range Limits Only): 50-165 Hz V, 222-222 kHz H, max dotclock 390 MHz
    Display Product Name: '27monitor'
  Extension blocks: 1
Checksum: 0x88

----------------

Block 1, CTA-861 Extension Block:
  Revision: 3
  Underscans IT Video Formats by default
  Basic audio support
  Native detailed modes: 1
  Audio Data Block:
    Linear PCM:
      Max channels: 2
      Supported sample rates (kHz): 48 44.1 32
      Supported sample sizes (bits): 24 20 16
  Speaker Allocation Data Block:
    FL/FR - Front Left/Right
  Detailed Timing Descriptors:
    DTD 3:  1920x1080   99.930409 Hz  16:9    113.221 kHz    235.500000 MHz (521 mm x 293 mm)
                 Hfront   48 Hsync  32 Hback   80 Hpol P
                 Vfront    3 Vsync   5 Vback   45 Vpol P
    DTD 4:  1920x1080  119.982181 Hz  16:9    137.260 kHz    285.500000 MHz (521 mm x 293 mm)
                 Hfront   48 Hsync  32 Hback   80 Hpol P
                 Vfront    3 Vsync   5 Vback   56 Vpol P
    DTD 5:  1920x1080  143.992765 Hz  16:9    159.976 kHz    332.750000 MHz (521 mm x 293 mm)
                 Hfront   48 Hsync  32 Hback   80 Hpol P
                 Vfront    3 Vsync   5 Vback   23 Vpol P
Checksum: 0x24  Unused space in Extension Block: 61 bytes

----------------

Block 2, Unknown EDID Extension Block 0x00:
  00 ff ff ff ff ff ff 00 3d ef 70 02 01 00 00 00 '........=.p.....'
  1f 1e 01 04 a5 3c 21 78 3b dc 5b a3 54 4c 99 26 '.....<!x;.[.TL.&'
  0f 47 49 ad 4b 00 81 80 61 7c 81 bc 95 00 95 3c '.GI.K...a|.....<'
  b3 00 b3 3c d1 fc 02 3a 80 18 71 38 2d 40 58 2c '...<...:..q8-@X,'
  45 00 55 50 21 00 00 1e 26 96 80 a0 70 38 28 40 'E.UP!...&...p8(@'
  58 2c 45 00 ba 89 21 00 00 1e 00 00 00 fd 00 32 'X,E...!........2'
  a5 de de 27 01 0a 20 20 20 20 20 20 00 00 00 fc '...'..      ....'
  00 32 37 6d 6f 6e 69 74 6f 72 0a 20 20 20 01 88 '.27monitor.   ..'
Checksum: 0x88

----------------

Block 3, CTA-861 Extension Block:
  Revision: 3
  Underscans IT Video Formats by default
  Basic audio support
  Native detailed modes: 1
  Audio Data Block:
    Linear PCM:
      Max channels: 2
      Supported sample rates (kHz): 48 44.1 32
      Supported sample sizes (bits): 24 20 16
  Speaker Allocation Data Block:
    FL/FR - Front Left/Right
  Detailed Timing Descriptors:
    DTD 6:  1920x1080   99.930409 Hz  16:9    113.221 kHz    235.500000 MHz (521 mm x 293 mm)
                 Hfront   48 Hsync  32 Hback   80 Hpol P
                 Vfront    3 Vsync   5 Vback   45 Vpol P
    DTD 7:  1920x1080  119.982181 Hz  16:9    137.260 kHz    285.500000 MHz (521 mm x 293 mm)
                 Hfront   48 Hsync  32 Hback   80 Hpol P
                 Vfront    3 Vsync   5 Vback   56 Vpol P
    DTD 8:  1920x1080  143.992765 Hz  16:9    159.976 kHz    332.750000 MHz (521 mm x 293 mm)
                 Hfront   48 Hsync  32 Hback   80 Hpol P
                 Vfront    3 Vsync   5 Vback   23 Vpol P
Checksum: 0x24  Unused space in Extension Block: 61 bytes

----------------

Warnings:

Block 0, Base EDID:
  Vendor & Product Identification: The serial number is one of the known dummy values, it should probably be set to 0.
  Detailed Timing Descriptor #1: DTD is identical to VIC 16, which is not present in the CTA Ext Block.
Block 1, CTA-861 Extension Block:
  Add a Colorimetry Data Block with the sRGB colorimetry bit set to avoid interop issues.
EDID:
  Base EDID: Some timings are out of range of the Monitor Ranges:
    Horizontal Freq: 31.466 - 184.798 kHz (Monitor: 222.000 - 222.000 kHz)

Failures:

Block 0, Base EDID:
  Detailed Timing Descriptor #2: Mismatch of image size 698x393 mm vs display size 600x330 mm.
Block 1, CTA-861 Extension Block:
  Detailed Timing Descriptor #3: Mismatch of image size 521x293 mm vs display size 600x330 mm.
  Detailed Timing Descriptor #4: Mismatch of image size 521x293 mm vs display size 600x330 mm.
  Detailed Timing Descriptor #5: Mismatch of image size 521x293 mm vs display size 600x330 mm.
  Missing VCDB, needed for Set Selectable RGB Quantization to avoid interop issues.
Block 2, Base EDID:
  Unknown Extension Block.
Block 3, CTA-861 Extension Block:
  Speaker Allocation Data Block: Only one instance of this Data Block is allowed.
  Detailed Timing Descriptor #6: Mismatch of image size 521x293 mm vs display size 600x330 mm.
  Detailed Timing Descriptor #7: Mismatch of image size 521x293 mm vs display size 600x330 mm.
  Detailed Timing Descriptor #8: Mismatch of image size 521x293 mm vs display size 600x330 mm.
EDID:
  Base EDID: The DTD max image size is 698x393mm, which is larger than the display size 600.0x330.0mm.
  Base EDID: EDID specified 1 extension block(s), but found 3 extension block(s).

EDID conformity: FAIL
