edid-decode (hex):

00 ff ff ff ff ff ff 00 06 af 9d 15 00 00 00 00
00 15 01 04 90 26 15 78 02 76 25 a3 54 4d 9c 26
0e 50 54 00 00 00 01 01 01 01 01 01 01 01 01 01
01 01 01 01 01 01 a0 37 80 ae 70 38 34 40 6c 30
aa 00 7d d6 10 00 00 18 15 25 80 ae 70 38 34 40
6c 30 aa 00 7d d6 10 00 00 18 00 00 00 fe 00 41
55 4f 0a 20 20 20 20 20 20 20 20 20 00 00 00 fe
00 42 31 37 33 48 57 30 31 20 56 35 20 0a 00 f9

----------------

Block 0, Base EDID:
  EDID Structure Version & Revision: 1.4
  Vendor & Product Identification:
    Manufacturer: AUO
    Model: 5533
    Made in: 2011
  Basic Display Parameters & Features:
    Digital display
    Bits per primary color channel: 6
    Digital interface is not defined
    Maximum image size: 38 cm x 21 cm
    Gamma: 2.20
    Supported color formats: RGB 4:4:4
    First detailed timing includes the native pixel format and preferred refresh rate
  Color Characteristics:
    Red  : 0.6376, 0.3310
    Green: 0.3017, 0.6113
    Blue : 0.1484, 0.0566
    White: 0.3134, 0.3291
  Established Timings I & II: none
  Standard Timings: none
  Detailed Timing Descriptors:
    DTD 1:  1920x1080   60.074046 Hz  16:9     68.004 kHz    142.400000 MHz (381 mm x 214 mm)
                 Hfront  108 Hsync  48 Hback   18 Hpol N
                 Vfront   10 Vsync  10 Vback   32 Vpol N
    DTD 2:  1920x1080   40.047958 Hz  16:9     45.334 kHz     94.930000 MHz (381 mm x 214 mm)
                 Hfront  108 Hsync  48 Hback   18 Hpol N
                 Vfront   10 Vsync  10 Vback   32 Vpol N
    Alphanumeric Data String: 'AUO'
    Alphanumeric Data String: 'B173HW01 V5 '
Checksum: 0xf9

----------------

Warnings:

Block 0, Base EDID:
  Missing Display Product Name.

Failures:

Block 0, Base EDID:
  Alphanumeric Data String: One or more trailing spaces before newline.

EDID conformity: FAIL
