edid-decode (hex):

00 ff ff ff ff ff ff 00 30 e4 0a 04 00 00 00 00
00 17 01 04 95 1f 11 78 ea dc 95 a3 58 55 a0 26
0d 50 54 00 00 00 01 01 01 01 01 01 01 01 01 01
01 01 01 01 01 01 ba 36 80 ac 70 38 24 40 3c 24
35 00 35 af 10 00 00 1a 00 00 00 00 00 00 00 00
00 00 00 00 00 00 00 00 00 00 00 00 00 fe 00 57
59 50 58 47 80 31 34 30 57 46 31 0a 00 00 00 00
00 00 41 31 9e 01 10 00 00 0a 01 0a 20 20 00 8e

----------------

Block 0, Base EDID:
  EDID Structure Version & Revision: 1.4
  Vendor & Product Identification:
    Manufacturer: LGD
    Model: 1034
    Made in: 2013
  Basic Display Parameters & Features:
    Digital display
    Bits per primary color channel: 6
    DisplayPort interface
    Maximum image size: 31 cm x 17 cm
    Gamma: 2.20
    DPMS levels: Standby Suspend Off
    Supported color formats: RGB 4:4:4, YCrCb 4:4:4
    First detailed timing includes the native pixel format and preferred refresh rate
  Color Characteristics:
    Red  : 0.6396, 0.3447
    Green: 0.3349, 0.6250
    Blue : 0.1503, 0.0517
    White: 0.3134, 0.3291
  Established Timings I & II: none
  Standard Timings: none
  Detailed Timing Descriptors:
    DTD 1:  1920x1080   60.008429 Hz  16:9     66.969 kHz    140.100000 MHz (309 mm x 175 mm)
                 Hfront   60 Hsync  36 Hback   76 Hpol P
                 Vfront    3 Vsync   5 Vback   28 Vpol N
    Empty Descriptor
    Alphanumeric Data String: 'WYPXG.140WF1'
    Manufacturer-Specified Display Descriptor (0x00): 00 00 00 00 41 31 9e 01 10 00 00 0a 01 0a 20 20 '....A1........  '
Checksum: 0x8e

----------------

Warnings:

Block 0, Base EDID:
  Alphanumeric Data String: Non-ASCII character 0x80 at position 5, can cause problems.
  Missing Display Product Name.

Failures:

Block 0, Base EDID:
  Empty Descriptor: Use Dummy Descriptor instead of all zeroes.

EDID conformity: FAIL
