edid-decode (hex):

00 ff ff ff ff ff ff 00 09 e5 a4 08 00 00 00 00
17 1d 01 04 a5 22 13 78 03 aa 25 a5 55 4d 9c 27
10 50 54 00 00 00 01 01 01 01 01 01 01 01 01 01
01 01 01 01 01 01 be 3a 80 cc 70 38 64 40 30 20
36 00 58 c2 10 00 00 1a ff 2e 80 cc 70 38 64 40
30 20 36 00 58 c2 10 00 00 1a 00 00 00 fe 00 52
46 43 4d 44 81 4e 56 31 35 41 31 39 00 00 00 00
00 02 41 21 9e 00 10 00 00 0a 01 0a 20 20 00 51

----------------

Block 0, Base EDID:
  EDID Structure Version & Revision: 1.4
  Vendor & Product Identification:
    Manufacturer: BOE
    Model: 2212
    Made in: week 23 of 2019
  Basic Display Parameters & Features:
    Digital display
    Bits per primary color channel: 8
    DisplayPort interface
    Maximum image size: 34 cm x 19 cm
    Gamma: 2.20
    Supported color formats: RGB 4:4:4
    First detailed timing includes the native pixel format and preferred refresh rate
    Display supports continuous frequencies
  Color Characteristics:
    Red  : 0.6464, 0.3339
    Green: 0.3027, 0.6113
    Blue : 0.1523, 0.0644
    White: 0.3134, 0.3291
  Established Timings I & II: none
  Standard Timings: none
  Detailed Timing Descriptors:
    DTD 1:  1920x1080   60.000319 Hz  16:9     70.800 kHz    150.380000 MHz (344 mm x 194 mm)
                 Hfront   48 Hsync  32 Hback  124 Hpol P
                 Vfront    3 Vsync   6 Vback   91 Vpol N
    DTD 2:  1920x1080   48.002649 Hz  16:9     56.643 kHz    120.310000 MHz (344 mm x 194 mm)
                 Hfront   48 Hsync  32 Hback  124 Hpol P
                 Vfront    3 Vsync   6 Vback   91 Vpol N
    Alphanumeric Data String: 'RFCMD.NV15A19'
    Manufacturer-Specified Display Descriptor (0x00): 00 00 00 02 41 21 9e 00 10 00 00 0a 01 0a 20 20 '....A!........  '
Checksum: 0x51

----------------

Warnings:

Block 0, Base EDID:
  Alphanumeric Data String: Non-ASCII character 0x81 at position 5, can cause problems.
  Missing Display Product Name.

Failures:

Block 0, Base EDID:
  Missing Display Range Limits Descriptor.

EDID conformity: FAIL
