edid-decode (hex):

00 ff ff ff ff ff ff 00 06 af a3 40 00 00 00 00
04 20 01 04 a5 1e 13 78 03 0f 95 ae 52 43 b0 26
0f 50 54 00 00 00 01 01 01 01 01 01 01 01 01 01
01 01 01 01 01 01 78 6e 00 a0 a0 40 84 60 30 20
aa 00 2d bc 10 00 00 1a 00 00 00 00 00 00 00 00
00 00 00 00 00 00 00 00 00 00 00 00 00 fe 00 4a
34 36 57 52 80 42 31 34 30 51 41 4e 00 00 00 00
00 02 41 0f 9e 00 01 00 00 0f 41 0a 20 20 01 ff

70 20 79 02 00 22 00 14 1b dd 0b 85 ff 09 9f 00
2f 80 1f 00 3f 06 83 00 09 00 09 00 25 01 09 1b
dd 0b 1b dd 0b 3c a5 80 81 00 10 72 1a 00 00 03
01 3c a5 00 00 53 51 53 51 a5 00 00 00 00 00 00
00 00 00 00 00 00 00 00 00 00 00 00 00 00 00 00
00 00 00 00 00 00 00 00 00 00 00 00 00 00 00 00
00 00 00 00 00 00 00 00 00 00 00 00 00 00 00 00
00 00 00 00 00 00 00 00 00 00 00 00 00 00 d3 90

00 ff ff ff ff ff ff 00 06 af a3 40 00 00 00 00
04 20 01 04 a5 1e 13 78 03 0f 95 ae 52 43 b0 26
0f 50 54 00 00 00 01 01 01 01 01 01 01 01 01 01
01 01 01 01 01 01 78 6e 00 a0 a0 40 84 60 30 20
aa 00 2d bc 10 00 00 1a 00 00 00 00 00 00 00 00
00 00 00 00 00 00 00 00 00 00 00 00 00 fe 00 4a
34 36 57 52 80 42 31 34 30 51 41 4e 00 00 00 00
00 02 41 0f 9e 00 01 00 00 0f 41 0a 20 20 01 ff

70 20 79 02 00 22 00 14 1b dd 0b 85 ff 09 9f 00
2f 80 1f 00 3f 06 83 00 09 00 09 00 25 01 09 1b
dd 0b 1b dd 0b 3c a5 80 81 00 10 72 1a 00 00 03
01 3c a5 00 00 53 51 53 51 a5 00 00 00 00 00 00
00 00 00 00 00 00 00 00 00 00 00 00 00 00 00 00
00 00 00 00 00 00 00 00 00 00 00 00 00 00 00 00
00 00 00 00 00 00 00 00 00 00 00 00 00 00 00 00
00 00 00 00 00 00 00 00 00 00 00 00 00 00 d3 90

----------------

Block 0, Base EDID:
  EDID Structure Version & Revision: 1.4
  Vendor & Product Identification:
    Manufacturer: AUO
    Model: 16547
    Made in: week 4 of 2022
  Basic Display Parameters & Features:
    Digital display
    Bits per primary color channel: 8
    DisplayPort interface
    Maximum image size: 30 cm x 19 cm
    Gamma: 2.20
    Supported color formats: RGB 4:4:4
    First detailed timing includes the native pixel format and preferred refresh rate
    Display supports continuous frequencies
  Color Characteristics:
    Red  : 0.6796, 0.3203
    Green: 0.2646, 0.6904
    Blue : 0.1503, 0.0595
    White: 0.3134, 0.3291
  Established Timings I & II: none
  Standard Timings: none
  Detailed Timing Descriptors:
    DTD 1:  2560x1600   60.029208 Hz  16:10   103.971 kHz    282.800000 MHz (301 mm x 188 mm)
                 Hfront   48 Hsync  32 Hback   80 Hpol P
                 Vfront   10 Vsync  10 Vback  112 Vpol N
    Empty Descriptor
    Alphanumeric Data String: 'J46WR.B140QAN'
    Manufacturer-Specified Display Descriptor (0x00): 00 00 00 02 41 0f 9e 00 01 00 00 0f 41 0a 20 20 '....A.......A.  '
  Extension blocks: 1
Checksum: 0xff

----------------

Block 1, DisplayID Extension Block:
  Version: 2.0
  Extension Count: 0
  Display Product Primary Use Case: None of the listed primary use cases; generic display
  Video Timing Modes Type 7 - Detailed Timings Data Block:
    DTD:  2560x1600  165.037868 Hz  16:10   285.846 kHz    777.500000 MHz (aspect 16:10, no 3D stereo, preferred)
               Hfront   48 Hsync  32 Hback   80 Hpol P
               Vfront   10 Vsync  10 Vback  112 Vpol N
  Dynamic Video Timing Range Limits Data Block:
    Minimum Pixel Clock: 777500 kHz
    Maximum Pixel Clock: 777500 kHz
    Minimum Vertical Refresh Rate: 60 Hz
    Maximum Vertical Refresh Rate: 165 Hz
    Seamless Dynamic Video Timing Support: Yes
  CTA-861 DisplayID Data Block:
  Vendor-Specific Data Block (AMD), OUI 00-00-1A:
    Version: 3
    Feature Caps: 0x01
    Minimum Refresh Rate: 60 Hz
    Maximum Refresh Rate: 165 Hz
    Flags 1.x: 0x00
    Flags 2.x: 0x00
  Checksum: 0xd3
Checksum: 0x90

----------------

Warnings:

Block 0, Base EDID:
  Alphanumeric Data String: Non-ASCII character 0x80 at position 5, can cause problems.
  Missing Display Product Name.

Failures:

Block 0, Base EDID:
  Empty Descriptor: Use Dummy Descriptor instead of all zeroes.
  Missing Display Range Limits Descriptor.
Block 1, DisplayID Extension Block:
  Vendor-Specific Data Block (AMD), OUI 00-00-1A: Length is 16 instead of 19.
EDID:
  Extension Block 2 started with EDID header, ignoring Extension Blocks >= 2.
  DisplayID: Missing DisplayID Display Parameters Data Block.

EDID conformity: FAIL
