edid-decode (hex):

00 ff ff ff ff ff ff 00 2a 59 10 10 01 00 00 00
05 20 01 03 80 25 16 78 ea 2d 36 a7 54 38 ae 26
0d 4f 54 00 00 00 01 01 01 01 01 01 01 01 01 01
01 01 01 01 01 01 28 3c 80 a0 70 b0 23 40 30 20
36 00 6e e5 10 00 00 1a 02 3a 80 18 71 38 2d 40
58 2c 45 00 99 e6 10 00 00 1c 0e 1f 00 80 51 00
1e 30 10 80 17 00 78 2d 11 00 00 18 00 00 00 fc
00 48 44 4d 49 0a 20 20 20 20 20 20 20 20 01 a0

02 03 2a f1 4c 01 02 03 04 05 07 90 12 13 14 16
1f 23 09 07 07 83 01 00 00 67 03 0c 00 10 00 38
28 68 1a 00 00 01 01 32 4b ed 02 3a 80 18 71 38
2d 40 58 2c 45 00 fe 1f 11 00 00 1e 01 1d 00 72
51 d0 1e 20 6e 28 55 00 fe 1f 11 00 00 1e 01 1d
00 bc 52 d0 1e 20 b8 28 55 40 e8 12 11 00 00 1e
00 00 00 00 00 00 00 00 00 00 00 00 00 00 00 00
00 00 00 00 00 00 00 00 00 00 00 00 00 00 00 f1

00 ff ff ff ff ff ff 00 2a 59 10 10 01 00 00 00
05 20 01 03 80 25 16 78 ea 2d 36 a7 54 38 ae 26
0d 4f 54 00 00 00 01 01 01 01 01 01 01 01 01 01
01 01 01 01 01 01 28 3c 80 a0 70 b0 23 40 30 20
36 00 6e e5 10 00 00 1a 02 3a 80 18 71 38 2d 40
58 2c 45 00 99 e6 10 00 00 1c 0e 1f 00 80 51 00
1e 30 10 80 17 00 78 2d 11 00 00 18 00 00 00 fc
00 48 44 4d 49 0a 20 20 20 20 20 20 20 20 01 a0

02 03 2a f1 4c 01 02 03 04 05 07 90 12 13 14 16
1f 23 09 07 07 83 01 00 00 67 03 0c 00 10 00 38
28 68 1a 00 00 01 01 32 4b ed 02 3a 80 18 71 38
2d 40 58 2c 45 00 fe 1f 11 00 00 1e 01 1d 00 72
51 d0 1e 20 6e 28 55 00 fe 1f 11 00 00 1e 01 1d
00 bc 52 d0 1e 20 b8 28 55 40 e8 12 11 00 00 1e
00 00 00 00 00 00 00 00 00 00 00 00 00 00 00 00
00 00 00 00 00 00 00 00 00 00 00 00 00 00 00 f1

----------------

Block 0, Base EDID:
  EDID Structure Version & Revision: 1.3
  Vendor & Product Identification:
    Manufacturer: JRY
    Model: 4112
    Serial Number: ...
    Made in: week 5 of 2022
  Basic Display Parameters & Features:
    Digital display
    Maximum image size: 37 cm x 22 cm
    Gamma: 2.20
    DPMS levels: Standby Suspend Off
    RGB color display
    First detailed timing is the preferred timing
  Color Characteristics:
    Red  : 0.6523, 0.3300
    Green: 0.2216, 0.6806
    Blue : 0.1484, 0.0537
    White: 0.3095, 0.3300
  Established Timings I & II: none
  Standard Timings: none
  Detailed Timing Descriptors:
    DTD 1:  1920x1200   59.950171 Hz  16:10    74.038 kHz    154.000000 MHz (366 mm x 229 mm)
                 Hfront   48 Hsync  32 Hback   80 Hpol P
                 Vfront    3 Vsync   6 Vback   26 Vpol N
    DTD 2:  1920x1080   60.000000 Hz  16:9     67.500 kHz    148.500000 MHz (409 mm x 230 mm)
                 Hfront   88 Hsync  44 Hback  148 Hpol N
                 Vfront    4 Vsync   5 Vback   36 Vpol P
    DTD 3:  1280x768    59.870228 Hz   5:3     47.776 kHz     79.500000 MHz (376 mm x 301 mm)
                 Hfront   16 Hsync 128 Hback  240 Hpol N
                 Vfront    1 Vsync   7 Vback   22 Vpol N
    Display Product Name: 'HDMI'
  Extension blocks: 1
Checksum: 0xa0

----------------

Block 1, CTA-861 Extension Block:
  Revision: 3
  Underscans IT Video Formats by default
  Basic audio support
  Supports YCbCr 4:4:4
  Supports YCbCr 4:2:2
  Native DTDs: 1
  Video Data Block:
    VIC   1:   640x480    59.940476 Hz   4:3     31.469 kHz     25.175000 MHz
    VIC   2:   720x480    59.940060 Hz   4:3     31.469 kHz     27.000000 MHz
    VIC   3:   720x480    59.940060 Hz  16:9     31.469 kHz     27.000000 MHz
    VIC   4:  1280x720    60.000000 Hz  16:9     45.000 kHz     74.250000 MHz
    VIC   5:  1920x1080i  60.000000 Hz  16:9     33.750 kHz     74.250000 MHz
    VIC   7:  1440x480i   59.940060 Hz  16:9     15.734 kHz     27.000000 MHz
    VIC  16:  1920x1080   60.000000 Hz  16:9     67.500 kHz    148.500000 MHz (native)
    VIC  18:   720x576    50.000000 Hz  16:9     31.250 kHz     27.000000 MHz
    VIC  19:  1280x720    50.000000 Hz  16:9     37.500 kHz     74.250000 MHz
    VIC  20:  1920x1080i  50.000000 Hz  16:9     28.125 kHz     74.250000 MHz
    VIC  22:  1440x576i   50.000000 Hz  16:9     15.625 kHz     27.000000 MHz
    VIC  31:  1920x1080   50.000000 Hz  16:9     56.250 kHz    148.500000 MHz
  Audio Data Block:
    Linear PCM:
      Max channels: 2
      Supported sample rates (kHz): 48 44.1 32
      Supported sample sizes (bits): 24 20 16
  Speaker Allocation Data Block:
    FL/FR - Front Left/Right
  Vendor-Specific Data Block (HDMI), OUI 00-0C-03:
    Source physical address: 1.0.0.0
    DC_36bit
    DC_30bit
    DC_Y444
    Maximum TMDS clock: 200 MHz
  Vendor-Specific Data Block (AMD), OUI 00-00-1A:
    Version: 1
    Feature Caps: 0x01
    Minimum Refresh Rate: 50 Hz
    Maximum Refresh Rate: 75 Hz
    Flags 1.x: 0xed (MCCS)
  Detailed Timing Descriptors:
    DTD 4:  1920x1080   60.000000 Hz  16:9     67.500 kHz    148.500000 MHz (510 mm x 287 mm)
                 Hfront   88 Hsync  44 Hback  148 Hpol P
                 Vfront    4 Vsync   5 Vback   36 Vpol P
    DTD 5:  1280x720    60.000000 Hz  16:9     45.000 kHz     74.250000 MHz (510 mm x 287 mm)
                 Hfront  110 Hsync  40 Hback  220 Hpol P
                 Vfront    5 Vsync   5 Vback   20 Vpol P
    DTD 6:  1280x720    50.000000 Hz  16:9     37.500 kHz     74.250000 MHz (488 mm x 274 mm)
                 Hfront  440 Hsync  40 Hback  220 Hpol P
                 Vfront    5 Vsync   5 Vback   20 Vpol P
Checksum: 0xf1  Unused space in Extension Block: 31 bytes

----------------

Warnings:

Block 0, Base EDID:
  Vendor & Product Identification: The serial number is one of the known dummy values, it should probably be set to 0.
  Detailed Timing Descriptor #2: DTD is similar but not identical to VIC 16.
  Detailed Timing Descriptor #3: DTD is similar but not identical to DMT 0x17.
  Detailed Timing Descriptor #3: Image size is 376x301 mm, but based on the picture AR it should be 376x225 mm.
Block 1, CTA-861 Extension Block:
  Video Data Block: VIC 1 and the first DTD are not identical. Is this intended?
  Video Data Block: All VICs are in ascending order, and the first (preferred) VIC <= 4, is that intended?
  Add a Colorimetry Data Block with the sRGB colorimetry bit set to avoid interop issues.

Failures:

Block 0, Base EDID:
  Detailed Timing Descriptor #2: Mismatch of image size 409x230 mm vs display size 370x220 mm.
  Detailed Timing Descriptor #3: Mismatch of image size 376x301 mm vs display size 370x220 mm.
  Missing Display Range Limits Descriptor.
Block 1, CTA-861 Extension Block:
  Detailed Timing Descriptor #4: Mismatch of image size 510x287 mm vs display size 370x220 mm.
  Detailed Timing Descriptor #5: Mismatch of image size 510x287 mm vs display size 370x220 mm.
  Detailed Timing Descriptor #6: Mismatch of image size 488x274 mm vs display size 370x220 mm.
  Missing VCDB, needed for Set Selectable RGB Quantization to avoid interop issues.
EDID:
  Extension Block 2 started with EDID header, ignoring Extension Blocks >= 2.
  Base EDID: The DTD max image size is 510x301mm, which is larger than the display size 370.0x220.0mm.
  CTA-861: Native progressive timings are a mix of several resolutions.

EDID conformity: FAIL
