edid-decode (hex):

00 ff ff ff ff ff ff 00 0d af 28 14 00 00 00 00
00 00 01 03 80 1e 13 78 0a 47 a0 94 57 4f 8c 27
27 50 54 00 00 00 01 01 01 01 01 01 01 01 01 01
01 01 01 01 01 01 b1 25 a0 18 51 84 23 30 2e 46
99 00 2f be 10 00 00 19 00 00 00 00 00 00 00 00
00 00 00 00 00 00 00 00 00 00 00 00 00 fe 00 59
32 37 37 47 38 4e 31 34 31 43 33 0a 00 00 00 fe
00 2d 40 4e 56 7a 9b ce ff 02 01 0a 20 20 00 37

00 ff ff ff ff ff ff 00 0d af 28 14 00 00 00 00
00 00 01 03 80 1e 13 78 0a 47 a0 94 57 4f 8c 27
27 50 54 00 00 00 01 01 01 01 01 01 01 01 01 01
01 01 01 01 01 01 b1 25 a0 18 51 84 23 30 2e 46
99 00 2f be 10 00 00 19 00 00 00 00 00 00 00 00
00 00 00 00 00 00 00 00 00 00 00 00 00 fe 00 59
32 37 37 47 38 4e 31 34 31 43 33 0a 00 00 00 fe
00 2d 40 4e 56 7a 9b ce ff 02 01 0a 20 20 00 37

----------------

Block 0, Base EDID:
  EDID Structure Version & Revision: 1.3
  Vendor & Product Identification:
    Manufacturer: CMO
    Model: 5160
    Made in: 1990
  Basic Display Parameters & Features:
    Digital display
    Maximum image size: 30 cm x 19 cm
    Gamma: 2.20
    RGB color display
    First detailed timing is the preferred timing
  Color Characteristics:
    Red  : 0.5791, 0.3398
    Green: 0.3095, 0.5498
    Blue : 0.1542, 0.1542
    White: 0.3125, 0.3281
  Established Timings I & II: none
  Standard Timings: none
  Detailed Timing Descriptors:
    DTD 1:  1440x900    59.998756 Hz  16:10    56.099 kHz     96.490000 MHz (303 mm x 190 mm)
                 Hfront   46 Hsync  70 Hback  164 Hpol N
                 Vfront    9 Vsync   9 Vback   17 Vpol N
    Empty Descriptor
    Alphanumeric Data String: 'Y277G8N141C3'
    Alphanumeric Data String: '-@NVz..'
Checksum: 0x37

----------------

Warnings:

Block 0, Base EDID:
  Alphanumeric Data String: Non-ASCII character 0x9b at position 5, can cause problems.
  Alphanumeric Data String: Non-ASCII character 0xce at position 6, can cause problems.

Failures:

Block 0, Base EDID:
  Empty Descriptor: Use Dummy Descriptor instead of all zeroes.
  Alphanumeric Data String: 0xff byte at position 7.
  Missing Display Product Name.
  Missing Display Range Limits Descriptor.
EDID:
  Extension Block 1 started with EDID header, ignoring Extension Blocks >= 1.

EDID conformity: FAIL
