edid-decode (hex):

00 ff ff ff ff ff ff 00 0e 77 5a 16 00 00 00 00
00 22 01 04 a5 22 16 78 03 dd 00 a5 54 4a 9c 24
0f 50 54 00 00 00 01 01 01 01 01 01 01 01 01 01
01 01 01 01 01 01 ff 6b 00 a0 a0 40 5e 60 30 20
36 00 58 d7 10 00 00 18 00 00 00 fd 00 30 78 c9
c9 38 01 0a 20 20 20 20 20 20 00 00 00 fe 00 43
53 4f 54 20 54 33 0a 20 20 20 20 20 00 00 00 fc
00 4d 4e 47 30 30 37 44 41 38 2d 31 0a 20 01 ed

70 20 79 02 00 22 00 14 da 6f 08 05 ff 09 9f 00
2f 00 1f 00 3f 06 5d 00 02 00 05 00 81 00 14 74
1a 00 00 03 01 30 78 00 00 00 00 00 00 78 00 00
00 00 8d 00 00 00 00 00 00 00 00 00 00 00 00 00
00 00 00 00 00 00 00 00 00 00 00 00 00 00 00 00
00 00 00 00 00 00 00 00 00 00 00 00 00 00 00 00
00 00 00 00 00 00 00 00 00 00 00 00 00 00 00 00
00 00 00 00 00 00 00 00 00 00 00 00 00 00 67 90

00 ff ff ff ff ff ff 00 0e 77 5a 16 00 00 00 00
00 22 01 04 a5 22 16 78 03 dd 00 a5 54 4a 9c 24
0f 50 54 00 00 00 01 01 01 01 01 01 01 01 01 01
01 01 01 01 01 01 ff 6b 00 a0 a0 40 5e 60 30 20
36 00 58 d7 10 00 00 18 00 00 00 fd 00 30 78 c9
c9 38 01 0a 20 20 20 20 20 20 00 00 00 fe 00 43
53 4f 54 20 54 33 0a 20 20 20 20 20 00 00 00 fc
00 4d 4e 47 30 30 37 44 41 38 2d 31 0a 20 01 ed

70 20 79 02 00 22 00 14 da 6f 08 05 ff 09 9f 00
2f 00 1f 00 3f 06 5d 00 02 00 05 00 81 00 14 74
1a 00 00 03 01 30 78 00 00 00 00 00 00 78 00 00
00 00 8d 00 00 00 00 00 00 00 00 00 00 00 00 00
00 00 00 00 00 00 00 00 00 00 00 00 00 00 00 00
00 00 00 00 00 00 00 00 00 00 00 00 00 00 00 00
00 00 00 00 00 00 00 00 00 00 00 00 00 00 00 00
00 00 00 00 00 00 00 00 00 00 00 00 00 00 67 90

----------------

Block 0, Base EDID:
  EDID Structure Version & Revision: 1.4
  Vendor & Product Identification:
    Manufacturer: CSW
    Model: 5722
    Made in: 2024
  Basic Display Parameters & Features:
    Digital display
    Bits per primary color channel: 8
    DisplayPort interface
    Maximum image size: 34 cm x 22 cm
    Gamma: 2.20
    Supported color formats: RGB 4:4:4
    First detailed timing includes the native pixel format and preferred refresh rate
    Display supports continuous frequencies
  Color Characteristics:
    Red  : 0.6474, 0.3291
    Green: 0.2919, 0.6103
    Blue : 0.1406, 0.0585
    White: 0.3125, 0.3281
  Established Timings I & II: none
  Standard Timings: none
  Detailed Timing Descriptors:
    DTD 1:  2560x1600   60.001997 Hz  16:10   101.643 kHz    276.470000 MHz (344 mm x 215 mm)
                 Hfront   48 Hsync  32 Hback   80 Hpol N
                 Vfront    3 Vsync   6 Vback   85 Vpol N
    Display Range Limits:
      Monitor ranges (Range Limits Only): 48-120 Hz V, 201-201 kHz H, max dotclock 560 MHz
    Alphanumeric Data String: 'CSOT T3'
    Display Product Name: 'MNG007DA8-1'
  Extension blocks: 1
Checksum: 0xed

----------------

Block 1, DisplayID Extension Block:
  Version: 2.0
  Extension Count: 0
  Display Product Primary Use Case: None of the listed primary use cases; generic display
  Video Timing Modes Type 7 - Detailed Timings Data Block:
    DTD:  2560x1600  120.000304 Hz  16:10   203.281 kHz    552.923000 MHz (aspect 16:10, no 3D stereo)
               Hfront   48 Hsync  32 Hback   80 Hpol N
               Vfront    3 Vsync   6 Vback   85 Vpol N
  CTA-861 DisplayID Data Block:
  Vendor-Specific Data Block (AMD), OUI 00-00-1A:
    Version: 3
    Flags 1: 0x01
      FreeSync Supported
    Minimum Refresh Rate: 48 Hz
    Maximum Refresh Rate: 120 Hz
    Flags 5: 0x00
    Additional Sink Information Address: 0x410
  Checksum: 0x67
Checksum: 0x90

----------------

Warnings:

EDID:
  Base EDID: Some timings are out of range of the Monitor Ranges:
    Horizontal Freq: 101.643 - 203.280 kHz (Monitor: 201.000 - 201.000 kHz)

Failures:

Block 1, DisplayID Extension Block:
  Vendor-Specific Data Block (AMD), OUI 00-00-1A: Length is 20 instead of 21.
EDID:
  Extension Block 2 started with EDID header, ignoring Extension Blocks >= 2.
  DisplayID: Missing DisplayID Display Parameters Data Block.
  DisplayID: DisplayID expects at least one preferred timing.

EDID conformity: FAIL
