edid-decode (hex):

00 ff ff ff ff ff ff 00 22 0e 7f 36 01 01 01 01
1e 1f 01 03 80 3e 22 78 2a 08 a5 a2 57 4f a2 28
0f 50 54 a1 08 00 d1 c0 a9 c0 81 c0 d1 00 b3 00
95 00 a9 40 81 80 08 e8 00 30 f2 70 5a 80 b0 58
8a 00 6d 55 21 00 00 1a 00 00 00 fd 00 28 3c 87
87 3c 00 0a 20 20 20 20 20 20 00 00 00 fc 00 48
50 20 56 32 38 20 34 4b 0a 20 20 20 00 00 00 ff
00 43 4e 43 31 33 30 31 33 34 32 0a 20 20 01 a8

02 03 3a f1 4d 61 60 10 1f 04 13 03 12 02 11 01
6a 6b 23 09 07 07 83 01 00 00 67 03 0c 00 10 00
38 3c 67 d8 5d c4 01 78 80 00 68 1a 00 00 01 01
28 3c ed e3 0f 03 18 e2 00 6b 56 5e 00 a0 a0 a0
29 50 30 20 35 00 6d 55 21 00 00 1a e2 68 00 a0
a0 40 2e 60 20 30 63 00 6d 55 21 00 00 1c 28 3c
80 a0 70 b0 23 40 30 20 36 00 6d 55 21 00 00 1a
00 00 00 00 00 00 00 00 00 00 00 00 00 00 00 1b

00 ff ff ff ff ff ff 00 22 0e 7f 36 01 01 01 01
1e 1f 01 03 80 3e 22 78 2a 08 a5 a2 57 4f a2 28
0f 50 54 a1 08 00 d1 c0 a9 c0 81 c0 d1 00 b3 00
95 00 a9 40 81 80 08 e8 00 30 f2 70 5a 80 b0 58
8a 00 6d 55 21 00 00 1a 00 00 00 fd 00 28 3c 87
87 3c 00 0a 20 20 20 20 20 20 00 00 00 fc 00 48
50 20 56 32 38 20 34 4b 0a 20 20 20 00 00 00 ff
00 43 4e 43 31 33 30 31 33 34 32 0a 20 20 01 a8

02 03 3a f1 4d 61 60 10 1f 04 13 03 12 02 11 01
6a 6b 23 09 07 07 83 01 00 00 67 03 0c 00 10 00
38 3c 67 d8 5d c4 01 78 80 00 68 1a 00 00 01 01
28 3c ed e3 0f 03 18 e2 00 6b 56 5e 00 a0 a0 a0
29 50 30 20 35 00 6d 55 21 00 00 1a e2 68 00 a0
a0 40 2e 60 20 30 63 00 6d 55 21 00 00 1c 28 3c
80 a0 70 b0 23 40 30 20 36 00 6d 55 21 00 00 1a
00 00 00 00 00 00 00 00 00 00 00 00 00 00 00 1b

----------------

Block 0, Base EDID:
  EDID Structure Version & Revision: 1.3
  Vendor & Product Identification:
    Manufacturer: HPN
    Model: 13951
    Serial Number: ...
    Made in: week 30 of 2021
  Basic Display Parameters & Features:
    Digital display
    Maximum image size: 62 cm x 34 cm
    Gamma: 2.20
    DPMS levels: Off
    RGB color display
    First detailed timing is the preferred timing
  Color Characteristics:
    Red  : 0.6328, 0.3398
    Green: 0.3105, 0.6328
    Blue : 0.1582, 0.0605
    White: 0.3134, 0.3291
  Established Timings I & II:
    IBM     :   720x400    70.081663 Hz   9:5     31.467 kHz     28.320000 MHz
    DMT 0x04:   640x480    59.940476 Hz   4:3     31.469 kHz     25.175000 MHz
    DMT 0x09:   800x600    60.316541 Hz   4:3     37.879 kHz     40.000000 MHz
    DMT 0x10:  1024x768    60.003840 Hz   4:3     48.363 kHz     65.000000 MHz
  Standard Timings:
    DMT 0x52:  1920x1080   60.000000 Hz  16:9     67.500 kHz    148.500000 MHz
    DMT 0x53:  1600x900    60.000000 Hz  16:9     60.000 kHz    108.000000 MHz (RB)
    DMT 0x55:  1280x720    60.000000 Hz  16:9     45.000 kHz     74.250000 MHz
    DMT 0x45:  1920x1200   59.884600 Hz  16:10    74.556 kHz    193.250000 MHz
    DMT 0x3a:  1680x1050   59.954250 Hz  16:10    65.290 kHz    146.250000 MHz
    DMT 0x2f:  1440x900    59.887445 Hz  16:10    55.935 kHz    106.500000 MHz
    DMT 0x33:  1600x1200   60.000000 Hz   4:3     75.000 kHz    162.000000 MHz
    DMT 0x23:  1280x1024   60.019740 Hz   5:4     63.981 kHz    108.000000 MHz
  Detailed Timing Descriptors:
    DTD 1:  3840x2160   60.000000 Hz  16:9    135.000 kHz    594.000000 MHz (621 mm x 341 mm)
                 Hfront  176 Hsync  88 Hback  296 Hpol P
                 Vfront    8 Vsync  10 Vback   72 Vpol N
    Display Range Limits:
      Monitor ranges (GTF): 40-60 Hz V, 135-135 kHz H, max dotclock 600 MHz
    Display Product Name: 'HP V28 4K'
    Display Product Serial Number: ...
  Extension blocks: 1
Checksum: 0xa8

----------------

Block 1, CTA-861 Extension Block:
  Revision: 3
  Underscans IT Video Formats by default
  Basic audio support
  Supports YCbCr 4:4:4
  Supports YCbCr 4:2:2
  Native DTDs: 1
  Video Data Block:
    VIC  97:  3840x2160   60.000000 Hz  16:9    135.000 kHz    594.000000 MHz
    VIC  96:  3840x2160   50.000000 Hz  16:9    112.500 kHz    594.000000 MHz
    VIC  16:  1920x1080   60.000000 Hz  16:9     67.500 kHz    148.500000 MHz
    VIC  31:  1920x1080   50.000000 Hz  16:9     56.250 kHz    148.500000 MHz
    VIC   4:  1280x720    60.000000 Hz  16:9     45.000 kHz     74.250000 MHz
    VIC  19:  1280x720    50.000000 Hz  16:9     37.500 kHz     74.250000 MHz
    VIC   3:   720x480    59.940060 Hz  16:9     31.469 kHz     27.000000 MHz
    VIC  18:   720x576    50.000000 Hz  16:9     31.250 kHz     27.000000 MHz
    VIC   2:   720x480    59.940060 Hz   4:3     31.469 kHz     27.000000 MHz
    VIC  17:   720x576    50.000000 Hz   4:3     31.250 kHz     27.000000 MHz
    VIC   1:   640x480    59.940476 Hz   4:3     31.469 kHz     25.175000 MHz
    VIC 106:  3840x2160   50.000000 Hz  64:27   112.500 kHz    594.000000 MHz
    VIC 107:  3840x2160   60.000000 Hz  64:27   135.000 kHz    594.000000 MHz
  Audio Data Block:
    Linear PCM:
      Max channels: 2
      Supported sample rates (kHz): 48 44.1 32
      Supported sample sizes (bits): 24 20 16
  Speaker Allocation Data Block:
    FL/FR - Front Left/Right
  Vendor-Specific Data Block (HDMI), OUI 00-0C-03:
    Source physical address: 1.0.0.0
    DC_36bit
    DC_30bit
    DC_Y444
    Maximum TMDS clock: 300 MHz
  Vendor-Specific Data Block (HDMI Forum), OUI C4-5D-D8:
    Version: 1
    Maximum TMDS Character Rate: 600 MHz
    SCDC Present
  Vendor-Specific Data Block (AMD), OUI 00-00-1A:
    Version: 1
    Flags 1: 0x01
      FreeSync Supported
    Minimum Refresh Rate: 40 Hz
    Maximum Refresh Rate: 60 Hz
    MCCS VCP Code: 0xed
  YCbCr 4:2:0 Capability Map Data Block:
    VIC  97:  3840x2160   60.000000 Hz  16:9    135.000 kHz    594.000000 MHz
    VIC  96:  3840x2160   50.000000 Hz  16:9    112.500 kHz    594.000000 MHz
    VIC 106:  3840x2160   50.000000 Hz  64:27   112.500 kHz    594.000000 MHz
    VIC 107:  3840x2160   60.000000 Hz  64:27   135.000 kHz    594.000000 MHz
  Video Capability Data Block:
    YCbCr quantization: No Data
    RGB quantization: Selectable (via AVI Q)
    PT scan behavior: Always Underscanned
    IT scan behavior: Always Underscanned
    CE scan behavior: Supports both over- and underscan
  Detailed Timing Descriptors:
    DTD 2:  2560x1440   59.950550 Hz  16:9     88.787 kHz    241.500000 MHz (621 mm x 341 mm)
                 Hfront   48 Hsync  32 Hback   80 Hpol P
                 Vfront    3 Vsync   5 Vback   33 Vpol N
    DTD 3:  2560x1600   59.971589 Hz  16:10    98.713 kHz    268.500000 MHz (621 mm x 341 mm)
                 Hfront   32 Hsync  48 Hback   80 Hpol N
                 Vfront    6 Vsync   3 Vback   37 Vpol P
    DTD 4:  1920x1200   59.950171 Hz  16:10    74.038 kHz    154.000000 MHz (621 mm x 341 mm)
                 Hfront   48 Hsync  32 Hback   80 Hpol P
                 Vfront    3 Vsync   6 Vback   26 Vpol N
Checksum: 0x1b  Unused space in Extension Block: 15 bytes

----------------

Warnings:

Block 0, Base EDID:
  Vendor & Product Identification: The serial number is one of the known dummy values, it should probably be set to 0.
  Detailed Timing Descriptor #1: DTD is similar but not identical to VIC 97.
Block 1, CTA-861 Extension Block:
  Video Data Block: VIC 97 and the first DTD are not identical. Is this intended?
  Video Capability Data Block: Set Selectable YCbCr Quantization to avoid interop issues.
  Detailed Timing Descriptor #3: DTD is similar but not identical to DMT 0x4c.
  Detailed Timing Descriptor #3: Image size is 621x341 mm, but based on the picture AR it should be 545x341 mm.
  Detailed Timing Descriptor #4: Image size is 621x341 mm, but based on the picture AR it should be 545x341 mm.
  Display Product Serial Number is set, so the Serial Number in the Base EDID should be 0.
  Add a Colorimetry Data Block with the sRGB colorimetry bit set to avoid interop issues.
EDID:
  Base EDID: Some timings are out of range of the Monitor Ranges:
    Vertical Freq: 50.000 - 70.082 Hz (Monitor: 40.000 - 60.000 Hz)
    Horizontal Freq: 31.250 - 135.000 kHz (Monitor: 135.000 - 135.000 kHz)

Failures:

EDID:
  Extension Block 2 started with EDID header, ignoring Extension Blocks >= 2.

EDID conformity: FAIL
