edid-decode (hex):

00 ff ff ff ff ff ff 00 1e 6d d6 4b 10 10 10 00
0f 15 01 03 6c 29 17 78 ea 23 05 a2 58 53 9c 26
11 50 54 a7 6a 00 31 4f 45 4f 61 4f 01 01 01 01
01 01 01 01 01 01 66 21 50 b0 51 00 1b 30 40 70
36 00 96 e5 10 00 00 1e 00 00 00 fd 00 38 4b 1e
3d 0e 00 0a 20 20 20 20 20 20 00 00 00 fc 00 45
31 39 34 30 0a 20 20 20 20 20 20 20 00 00 00 ff
00 53 65 72 69 61 6c 5f 4e 75 6d 62 65 72 00 a4

00 ff ff ff ff ff ff 00 1e 6d d6 4b 10 10 10 00
0f 15 01 03 6c 29 17 78 ea 23 05 a2 58 53 9c 26
11 50 54 a7 6a 00 31 4f 45 4f 61 4f 01 01 01 01
01 01 01 01 01 01 66 21 50 b0 51 00 1b 30 40 70
36 00 96 e5 10 00 00 1e 00 00 00 fd 00 38 4b 1e
3d 0e 00 0a 20 20 20 20 20 20 00 00 00 fc 00 45
31 39 34 30 0a 20 20 20 20 20 20 20 00 00 00 ff
00 53 65 72 69 61 6c 5f 4e 75 6d 62 65 72 00 a4

----------------

Block 0, Base EDID:
  EDID Structure Version & Revision: 1.3
  Vendor & Product Identification:
    Manufacturer: GSM
    Model: 19414
    Serial Number: ...
    Made in: week 15 of 2011
  Basic Display Parameters & Features:
    Analog display
    Signal Level Standard: 0.700 : 0.000 : 0.700 V p-p
    Blank level equals black level
    Sync: Separate Composite
    Maximum image size: 41 cm x 23 cm
    Gamma: 2.20
    DPMS levels: Standby Suspend Off
    RGB color display
    First detailed timing is the preferred timing
  Color Characteristics:
    Red  : 0.6328, 0.3457
    Green: 0.3242, 0.6123
    Blue : 0.1484, 0.0664
    White: 0.3134, 0.3291
  Established Timings I & II:
    IBM     :   720x400    70.081663 Hz   9:5     31.467 kHz     28.320000 MHz
    DMT 0x04:   640x480    59.940476 Hz   4:3     31.469 kHz     25.175000 MHz
    DMT 0x06:   640x480    75.000000 Hz   4:3     37.500 kHz     31.500000 MHz
    DMT 0x08:   800x600    56.250000 Hz   4:3     35.156 kHz     36.000000 MHz
    DMT 0x09:   800x600    60.316541 Hz   4:3     37.879 kHz     40.000000 MHz
    DMT 0x0b:   800x600    75.000000 Hz   4:3     46.875 kHz     49.500000 MHz
    Apple   :   832x624    74.551266 Hz   4:3     49.726 kHz     57.284000 MHz
    DMT 0x10:  1024x768    60.003840 Hz   4:3     48.363 kHz     65.000000 MHz
    DMT 0x12:  1024x768    75.028582 Hz   4:3     60.023 kHz     78.750000 MHz
  Standard Timings:
    DMT 0x06:   640x480    75.000000 Hz   4:3     37.500 kHz     31.500000 MHz
    DMT 0x0b:   800x600    75.000000 Hz   4:3     46.875 kHz     49.500000 MHz
    DMT 0x12:  1024x768    75.028582 Hz   4:3     60.023 kHz     78.750000 MHz
  Detailed Timing Descriptors:
    DTD 1:  1360x768    60.015162 Hz  85:48    47.712 kHz     85.500000 MHz (406 mm x 229 mm)
                 Hfront   64 Hsync 112 Hback  256 Hpol P
                 Vfront    3 Vsync   6 Vback   18 Vpol P
    Display Range Limits:
      Monitor ranges (GTF): 56-75 Hz V, 30-61 kHz H, max dotclock 140 MHz
    Display Product Name: 'E1940'
    Display Product Serial Number: ...
Checksum: 0xa4

----------------

Block 1, Unknown EDID Extension Block 0x00:
  00 ff ff ff ff ff ff 00 1e 6d d6 4b 10 10 10 00 '.........m.K....'
  0f 15 01 03 6c 29 17 78 ea 23 05 a2 58 53 9c 26 '....l).x.#..XS.&'
  11 50 54 a7 6a 00 31 4f 45 4f 61 4f 01 01 01 01 '.PT.j.1OEOaO....'
  01 01 01 01 01 01 66 21 50 b0 51 00 1b 30 40 70 '......f!P.Q..0@p'
  36 00 96 e5 10 00 00 1e 00 00 00 fd 00 38 4b 1e '6............8K.'
  3d 0e 00 0a 20 20 20 20 20 20 00 00 00 fc 00 45 '=...      .....E'
  31 39 34 30 0a 20 20 20 20 20 20 20 00 00 00 ff '1940.       ....'
  00 53 65 72 69 61 6c 5f 4e 75 6d 62 65 72 00 a4 '.Serial_Number..'
Checksum: 0xa4

----------------

Warnings:

Block 0, Base EDID:
  Display Product Serial Number: ...

Failures:

Block 1, Base EDID:
  Unknown Extension Block.
EDID:
  Base EDID: EDID specified 0 extension block(s), but found 1 extension block(s).

EDID conformity: FAIL
