edid-decode (hex):

00 ff ff ff ff ff ff 00 2c 83 22 04 00 00 00 00
0f 1f 01 04 a5 1f 11 78 03 e1 37 a4 57 4f 9e 27
0f 4f 50 00 00 00 01 01 01 01 01 01 01 01 01 01
01 01 01 01 01 01 02 3a 80 18 71 38 2d 40 30 20
45 00 35 ae 10 00 00 1a 00 00 00 00 00 00 00 00
00 00 00 00 00 00 00 00 00 00 00 00 00 fe 00 4b
44 43 20 20 20 0a 20 20 20 20 20 20 00 00 00 fe
00 4b 44 31 34 30 4e 31 36 33 30 41 30 31 00 67

00 ff ff ff ff ff ff 00 2c 83 22 04 00 00 00 00
0f 1f 01 04 a5 1f 11 78 03 e1 37 a4 57 4f 9e 27
0f 4f 50 00 00 00 01 01 01 01 01 01 01 01 01 01
01 01 01 01 01 01 02 3a 80 18 71 38 2d 40 30 20
45 00 35 ae 10 00 00 1a 00 00 00 00 00 00 00 00
00 00 00 00 00 00 00 00 00 00 00 00 00 fe 00 4b
44 43 20 20 20 0a 20 20 20 20 20 20 00 00 00 fe
00 4b 44 31 34 30 4e 31 36 33 30 41 30 31 00 67

----------------

Block 0, Base EDID:
  EDID Structure Version & Revision: 1.4
  Vendor & Product Identification:
    Manufacturer: KDC
    Model: 1058
    Made in: week 15 of 2021
  Basic Display Parameters & Features:
    Digital display
    Bits per primary color channel: 8
    DisplayPort interface
    Maximum image size: 31 cm x 17 cm
    Gamma: 2.20
    Supported color formats: RGB 4:4:4
    First detailed timing includes the native pixel format and preferred refresh rate
    Display supports continuous frequencies
  Color Characteristics:
    Red  : 0.6435, 0.3417
    Green: 0.3085, 0.6181
    Blue : 0.1523, 0.0615
    White: 0.3095, 0.3154
  Established Timings I & II: none
  Standard Timings: none
  Detailed Timing Descriptors:
    DTD 1:  1920x1080   60.000000 Hz  16:9     67.500 kHz    148.500000 MHz (309 mm x 174 mm)
                 Hfront   48 Hsync  32 Hback  200 Hpol P
                 Vfront    4 Vsync   5 Vback   36 Vpol N
    Empty Descriptor
    Alphanumeric Data String: 'KDC   '
    Alphanumeric Data String: 'KD140N1630A01'
Checksum: 0x67

----------------

Warnings:

Block 0, Base EDID:
  Detailed Timing Descriptor #1: DTD is similar but not identical to VIC 16.
  Missing Display Product Name.

Failures:

Block 0, Base EDID:
  Empty Descriptor: Use Dummy Descriptor instead of all zeroes.
  Alphanumeric Data String: One or more trailing spaces before newline.
  Missing Display Range Limits Descriptor.
EDID:
  Extension Block 1 started with EDID header, ignoring Extension Blocks >= 1.

EDID conformity: FAIL
