edid-decode (hex):

00 ff ff ff ff ff ff 00 4d 10 c1 15 00 00 00 00
31 22 01 04 b5 22 16 78 07 ee 95 a3 54 4c 99 26
0f 50 54 00 00 00 01 01 01 01 01 01 01 01 01 01
01 01 01 01 01 01 fd d7 00 a0 a0 40 5e 60 30 20
66 00 59 d7 10 00 00 1a 65 56 00 a0 a0 40 5e 60
30 20 66 00 59 d7 10 00 00 1a 00 00 00 fe 00 47
56 32 35 30 80 4c 51 31 36 30 52 31 00 00 00 00
00 03 41 3d 9e 00 01 00 00 0b 41 0a 20 20 01 7c

70 20 79 02 00 20 00 13 8c 52 19 c1 15 00 00 00
00 31 18 07 4c 51 31 36 30 52 31 21 00 1d 77 0d
6a 08 00 0a 40 06 88 3d 8a 54 cd a4 99 66 62 0f
02 45 54 b0 5c b0 5c 66 32 13 78 22 00 14 d9 6f
08 05 ff 09 9f 00 2f 00 1f 00 3f 06 5d 00 05 00
05 00 25 01 09 d9 6f 08 d9 6f 08 30 78 80 2e 00
06 66 32 b0 5c b0 5c 81 00 13 72 1a 00 00 03 51
30 78 00 00 53 42 53 42 78 00 00 00 00 00 bb 90

00 ff ff ff ff ff ff 00 4d 10 c1 15 00 00 00 00
31 22 01 04 b5 22 16 78 07 ee 95 a3 54 4c 99 26
0f 50 54 00 00 00 01 01 01 01 01 01 01 01 01 01
01 01 01 01 01 01 fd d7 00 a0 a0 40 5e 60 30 20
66 00 59 d7 10 00 00 1a 65 56 00 a0 a0 40 5e 60
30 20 66 00 59 d7 10 00 00 1a 00 00 00 fe 00 47
56 32 35 30 80 4c 51 31 36 30 52 31 00 00 00 00
00 03 41 3d 9e 00 01 00 00 0b 41 0a 20 20 01 7c

70 20 79 02 00 20 00 13 8c 52 19 c1 15 00 00 00
00 31 18 07 4c 51 31 36 30 52 31 21 00 1d 77 0d
6a 08 00 0a 40 06 88 3d 8a 54 cd a4 99 66 62 0f
02 45 54 b0 5c b0 5c 66 32 13 78 22 00 14 d9 6f
08 05 ff 09 9f 00 2f 00 1f 00 3f 06 5d 00 05 00
05 00 25 01 09 d9 6f 08 d9 6f 08 30 78 80 2e 00
06 66 32 b0 5c b0 5c 81 00 13 72 1a 00 00 03 51
30 78 00 00 53 42 53 42 78 00 00 00 00 00 bb 90

----------------

Block 0, Base EDID:
  EDID Structure Version & Revision: 1.4
  Vendor & Product Identification:
    Manufacturer: SHP
    Model: 5569
    Made in: week 49 of 2024
  Basic Display Parameters & Features:
    Digital display
    Bits per primary color channel: 10
    DisplayPort interface
    Maximum image size: 34 cm x 22 cm
    Gamma: 2.20
    Supported color formats: RGB 4:4:4
    Default (sRGB) color space is primary color space
    First detailed timing includes the native pixel format and preferred refresh rate
    Display supports continuous frequencies
  Color Characteristics:
    Red  : 0.6396, 0.3300
    Green: 0.2998, 0.5996
    Blue : 0.1503, 0.0595
    White: 0.3134, 0.3291
  Established Timings I & II: none
  Standard Timings: none
  Detailed Timing Descriptors:
    DTD 1:  2560x1600  120.001823 Hz  16:10   203.283 kHz    552.930000 MHz (345 mm x 215 mm)
                 Hfront   48 Hsync  32 Hback   80 Hpol P
                 Vfront    6 Vsync   6 Vback   82 Vpol N
    DTD 2:  2560x1600   48.000295 Hz  16:10    81.312 kHz    221.170000 MHz (345 mm x 215 mm)
                 Hfront   48 Hsync  32 Hback   80 Hpol P
                 Vfront    6 Vsync   6 Vback   82 Vpol N
    Alphanumeric Data String: 'GV250.LQ160R1'
    Manufacturer-Specified Display Descriptor (0x00): 00 00 00 03 41 3d 9e 00 01 00 00 0b 41 0a 20 20 '....A=......A.  '
  Extension blocks: 1
Checksum: 0x7c

----------------

Block 1, DisplayID Extension Block:
  Version: 2.0
  Extension Count: 0
  Display Product Primary Use Case: None of the listed primary use cases; generic display
  Product Identification Data Block (0x20), OUI 8C-52-19:
    Product Code: 5569
    Year of Manufacture: 2024, Week 49
    Product ID: LQ160R1
  Display Parameters Data Block (0x21):
    Image size: 344.7 mm x 215.4 mm
    Display native pixel format: 2560x1600
    Scan Orientation: Left to Right, Top to Bottom
    Luminance Information: Guidance for the Source device
    Color Information: CIE 1931
    Audio Speaker Information: not integrated
    Native Color Chromaticity:
      Primary #1:  (0.639893, 0.330078)
      Primary #2:  (0.300049, 0.600098)
      Primary #3:  (0.149902, 0.060059)
      White Point: (0.312988, 0.329102)
    Native Maximum Luminance (Full Coverage): 300.000000 cd/m^2
    Native Maximum Luminance (10% Rectangular Coverage): 300.000000 cd/m^2
    Native Minimum Luminance: 0.199951 cd/m^2
    Native Color Depth: 10 bpc
    Display Device Technology: Active Matrix LCD
    Native Gamma EOTF: 2.20
  Video Timing Modes Type 7 - Detailed Timings Data Block:
    DTD:  2560x1600  120.000087 Hz  16:10   203.280 kHz    552.922000 MHz (aspect 16:10, no 3D stereo)
               Hfront   48 Hsync  32 Hback   80 Hpol N
               Vfront    6 Vsync   6 Vback   82 Vpol N
  Dynamic Video Timing Range Limits Data Block:
    Minimum Pixel Clock: 552922 kHz
    Maximum Pixel Clock: 552922 kHz
    Minimum Vertical Refresh Rate: 48 Hz
    Maximum Vertical Refresh Rate: 120 Hz
    Seamless Dynamic Video Timing Support: Yes
  Brightness Luminance Range Data Block:
    Minimum SDR Luminance (Full Coverage): 0.199951 cd/m^2
    Maximum Suggested SDR Luminance (Full Coverage): 300.000000 cd/m^2
    Maximum Boost SDR Luminance: 300.000000 cd/m^2
  CTA-861 DisplayID Data Block:
  Vendor-Specific Data Block (AMD), OUI 00-00-1A:
    Version: 3
    Feature Caps: 0x51
      FreeSync Panel Replay Supported
    Minimum Refresh Rate: 48 Hz
    Maximum Refresh Rate: 120 Hz
    Flags 1.x: 0x00
    Flags 2.x: 0x00
  Checksum: 0xbb
Checksum: 0x90

----------------

Warnings:

Block 0, Base EDID:
  Alphanumeric Data String: Non-ASCII character 0x80 at position 5, can cause problems.
  Missing Display Product Name.

Failures:

Block 0, Base EDID:
  Basic Display Parameters & Features: sRGB is signaled, but the chromaticities do not match.
  Missing Display Range Limits Descriptor.
EDID:
  Extension Block 2 started with EDID header, ignoring Extension Blocks >= 2.
  DisplayID: DisplayID expects at least one preferred timing.

EDID conformity: FAIL
