edid-decode (hex):

00 ff ff ff ff ff ff 00 04 72 6a 00 8c 1e 50 92
19 13 01 03 80 29 17 78 2a 3d 85 a6 56 4a 9a 24
12 50 54 21 08 00 71 4f 81 40 81 80 81 c0 81 00
01 01 01 01 01 01 66 21 56 aa 51 00 1e 30 46 8f
33 00 9a e6 10 00 00 1e 00 00 00 fd 00 37 4c 1f
50 0e 00 0a 20 20 20 20 20 20 00 00 00 fc 00 58
31 38 33 48 0a 0a 0a 0a 0a 0a 0a 0a 00 00 00 ff
00 4c 45 4c 30 44 30 30 31 38 35 30 32 0a 00 34

00 ff ff ff ff ff ff 00 04 72 6a 00 8c 1e 50 92
19 13 01 03 80 29 17 78 2a 3d 85 a6 56 4a 9a 24
12 50 54 21 08 00 71 4f 81 40 81 80 81 c0 81 00
01 01 01 01 01 01 66 21 56 aa 51 00 1e 30 46 8f
33 00 9a e6 10 00 00 1e 00 00 00 fd 00 37 4c 1f
50 0e 00 0a 20 20 20 20 20 20 00 00 00 fc 00 58
31 38 33 48 0a 0a 0a 0a 0a 0a 0a 0a 00 00 00 ff
00 4c 45 4c 30 44 30 30 31 38 35 30 32 0a 00 34

----------------

Block 0, Base EDID:
  EDID Structure Version & Revision: 1.3
  Vendor & Product Identification:
    Manufacturer: ACR
    Model: 106
    Serial Number: ...
    Made in: week 25 of 2009
  Basic Display Parameters & Features:
    Digital display
    Maximum image size: 41 cm x 23 cm
    Gamma: 2.20
    DPMS levels: Off
    RGB color display
    First detailed timing is the preferred timing
  Color Characteristics:
    Red  : 0.6484, 0.3388
    Green: 0.2919, 0.6025
    Blue : 0.1425, 0.0703
    White: 0.3134, 0.3291
  Established Timings I & II:
    DMT 0x04:   640x480    59.940476 Hz   4:3     31.469 kHz     25.175000 MHz
    DMT 0x09:   800x600    60.316541 Hz   4:3     37.879 kHz     40.000000 MHz
    DMT 0x10:  1024x768    60.003840 Hz   4:3     48.363 kHz     65.000000 MHz
  Standard Timings:
    DMT 0x15:  1152x864    75.000000 Hz   4:3     67.500 kHz    108.000000 MHz
    DMT 0x20:  1280x960    60.000000 Hz   4:3     60.000 kHz    108.000000 MHz
    DMT 0x23:  1280x1024   60.019740 Hz   5:4     63.981 kHz    108.000000 MHz
    DMT 0x55:  1280x720    60.000000 Hz  16:9     45.000 kHz     74.250000 MHz
    DMT 0x1c:  1280x800    59.810326 Hz  16:10    49.702 kHz     83.500000 MHz
  Detailed Timing Descriptors:
    DTD 1:  1366x768    59.789541 Hz 683:384   47.712 kHz     85.500000 MHz (410 mm x 230 mm)
                 Hfront   70 Hsync 143 Hback  213 Hpol P
                 Vfront    3 Vsync   3 Vback   24 Vpol P
    Display Range Limits:
      Monitor ranges (GTF): 55-76 Hz V, 31-80 kHz H, max dotclock 140 MHz
    Display Product Name: 'X183H'
    Display Product Serial Number: ...
Checksum: 0x34

----------------

Failures:

Block 0, Base EDID:
  Display Product Name: Non-space after newline.
EDID:
  Extension Block 1 started with EDID header, ignoring Extension Blocks >= 1.

EDID conformity: FAIL
