edid-decode (hex):

00 ff ff ff ff ff ff 00 17 10 01 09 01 00 00 00
00 0e 01 03 80 73 41 78 2a 7c 11 9e 59 47 9b 27
10 50 54 00 00 00 01 01 01 01 01 01 01 01 01 01
01 01 01 01 01 01 02 3a 80 18 71 38 2d 40 58 2c
45 00 10 09 00 00 00 1e 8c 0a d0 8a 20 e0 2d 10
10 3e 96 00 04 03 00 00 00 18 00 00 00 fc 00 45
50 2d 48 44 4d 49 2d 52 58 0a 20 20 00 00 00 fd
00 3b 3d 0f 2e 08 00 0a 20 20 20 20 20 20 01 fb

02 03 19 72 46 90 04 05 01 02 03 23 09 07 07 83
01 00 00 65 03 0c 00 10 00 01 1d 00 72 51 d0 1e
20 20 28 55 00 10 09 00 00 00 1e 01 1d 80 18 71
1c 16 20 58 2c 25 00 10 09 00 00 00 9e d6 09 80
a0 20 e0 2d 10 10 60 a2 00 04 03 00 00 00 18 8c
0a d0 8a 20 e0 2d 10 10 3e 96 00 10 09 00 00 00
18 00 00 00 00 00 00 00 00 00 00 00 00 00 00 00
00 00 00 00 00 00 00 00 00 00 00 00 00 00 00 fe

----------------

Block 0, Base EDID:
  EDID Structure Version & Revision: 1.3
  Vendor & Product Identification:
    Manufacturer: EXP
    Model: 2305
    Serial Number: ...
    Made in: 2004
  Basic Display Parameters & Features:
    Digital display
    Maximum image size: 115 cm x 65 cm
    Gamma: 2.20
    DPMS levels: Off
    RGB color display
    First detailed timing is the preferred timing
  Color Characteristics:
    Red  : 0.6181, 0.3505
    Green: 0.2802, 0.6054
    Blue : 0.1523, 0.0634
    White: 0.3125, 0.3291
  Established Timings I & II: none
  Standard Timings: none
  Detailed Timing Descriptors:
    DTD 1:  1920x1080   60.000000 Hz  16:9     67.500 kHz    148.500000 MHz (16 mm x 9 mm)
                 Hfront   88 Hsync  44 Hback  148 Hpol P
                 Vfront    4 Vsync   5 Vback   36 Vpol P
    DTD 2:   720x480    59.940060 Hz   3:2     31.469 kHz     27.000000 MHz (4 mm x 3 mm)
                 Hfront   16 Hsync  62 Hback   60 Hpol N
                 Vfront    9 Vsync   6 Vback   30 Vpol N
    Display Product Name: 'EP-HDMI-RX'
    Display Range Limits:
      Monitor ranges (GTF): 59-61 Hz V, 15-46 kHz H, max dotclock 80 MHz
  Extension blocks: 1
Checksum: 0xfb

----------------

Block 1, CTA-861 Extension Block:
  Revision: 3
  Basic audio support
  Supports YCbCr 4:4:4
  Supports YCbCr 4:2:2
  Native DTDs: 2
  Video Data Block:
    VIC  16:  1920x1080   60.000000 Hz  16:9     67.500 kHz    148.500000 MHz (native)
    VIC   4:  1280x720    60.000000 Hz  16:9     45.000 kHz     74.250000 MHz
    VIC   5:  1920x1080i  60.000000 Hz  16:9     33.750 kHz     74.250000 MHz
    VIC   1:   640x480    59.940476 Hz   4:3     31.469 kHz     25.175000 MHz
    VIC   2:   720x480    59.940060 Hz   4:3     31.469 kHz     27.000000 MHz
    VIC   3:   720x480    59.940060 Hz  16:9     31.469 kHz     27.000000 MHz
  Audio Data Block:
    Linear PCM:
      Max channels: 2
      Supported sample rates (kHz): 48 44.1 32
      Supported sample sizes (bits): 24 20 16
  Speaker Allocation Data Block:
    FL/FR - Front Left/Right
  Vendor-Specific Data Block (HDMI), OUI 00-0C-03:
    Source physical address: 1.0.0.0
  Detailed Timing Descriptors:
    DTD 3:  1280x720    60.000000 Hz  16:9     45.000 kHz     74.250000 MHz (16 mm x 9 mm)
                 Hfront   32 Hsync  40 Hback  298 Hpol P
                 Vfront    5 Vsync   5 Vback   20 Vpol P
    DTD 4:  1920x1080i  60.000000 Hz  16:9     33.750 kHz     74.250000 MHz (16 mm x 9 mm)
                 Hfront   88 Hsync  44 Hback  148 Hpol P
                 Vfront    2 Vsync   5 Vback   15 Vpol P Vfront +0.5 Odd Field
                 Vfront    2 Vsync   5 Vback   15 Vpol P Vback  +0.5 Even Field
    DTD 5:   640x480    59.952381 Hz   4:3     31.475 kHz     25.180000 MHz (4 mm x 3 mm)
                 Hfront   16 Hsync  96 Hback   48 Hpol N
                 Vfront   10 Vsync   2 Vback   33 Vpol N
    DTD 6:   720x480    59.940060 Hz   3:2     31.469 kHz     27.000000 MHz (16 mm x 9 mm)
                 Hfront   16 Hsync  62 Hback   60 Hpol N
                 Vfront    9 Vsync   6 Vback   30 Vpol N
Checksum: 0xfe  Unused space in Extension Block: 30 bytes

----------------

Warnings:

Block 0, Base EDID:
  Vendor & Product Identification: The serial number is one of the known dummy values, it should probably be set to 0.
  Detailed Timing Descriptor #1: Dubious image size (16x9 mm is smaller than 100x100 mm).
  Detailed Timing Descriptor #2: Dubious image size (4x3 mm is smaller than 100x100 mm).
Block 1, CTA-861 Extension Block:
  IT Video Formats are overscanned by default, but normally this should be underscanned.
  Detailed Timing Descriptor #3: DTD is similar but not identical to VIC 4.
  Detailed Timing Descriptor #3: Dubious image size (16x9 mm is smaller than 100x100 mm).
  Detailed Timing Descriptor #4: Dubious image size (16x9 mm is smaller than 100x100 mm).
  Detailed Timing Descriptor #5: Dubious image size (4x3 mm is smaller than 100x100 mm).
  Detailed Timing Descriptor #6: Dubious image size (16x9 mm is smaller than 100x100 mm).
  Add a Colorimetry Data Block with the sRGB colorimetry bit set to avoid interop issues.
EDID:
  Base EDID: Some timings are out of range of the Monitor Ranges:
    Horizontal Freq: 31.468 - 67.500 kHz (Monitor: 15.000 - 46.000 kHz)
    Maximum Clock: 148.500 MHz (Monitor: 80.000 MHz)

Failures:

Block 0, Base EDID:
  Detailed Timing Descriptor #1: Mismatch of image size 16x9 mm vs display size 1150x650 mm.
  Detailed Timing Descriptor #2: Mismatch of image size 4x3 mm vs display size 1150x650 mm.
Block 1, CTA-861 Extension Block:
  Detailed Timing Descriptor #3: Mismatch of image size 16x9 mm vs display size 1150x650 mm.
  Detailed Timing Descriptor #4: Mismatch of image size 16x9 mm vs display size 1150x650 mm.
  Detailed Timing Descriptor #5: Mismatch of image size 4x3 mm vs display size 1150x650 mm.
  Detailed Timing Descriptor #6: Mismatch of image size 16x9 mm vs display size 1150x650 mm.
  Missing VCDB, needed for Set Selectable RGB Quantization to avoid interop issues.
EDID:
  CTA-861: Native progressive timings are a mix of several resolutions.

EDID conformity: FAIL
