edid-decode (hex):

00 ff ff ff ff ff ff 00 17 10 01 09 01 00 00 00
00 0f 01 03 80 33 1d 78 2a c5 c8 a3 57 4a 9c 23
12 48 4c 21 08 00 81 00 81 80 a9 40 90 40 d1 c0
81 c0 95 00 b3 00 f3 39 80 18 71 38 2d 40 58 2c
55 00 10 09 00 00 00 1e 48 3f 40 30 62 b0 32 40
40 c0 13 00 04 03 00 00 00 1e 00 00 00 fc 00 48
44 4d 49 42 4f 58 2d 39 30 31 0a 20 00 00 00 fd
00 3b 3d 0f 4b 11 00 0a 20 20 20 20 20 20 00 5c

----------------

Block 0, Base EDID:
  EDID Structure Version & Revision: 1.3
  Vendor & Product Identification:
    Manufacturer: EXP
    Model: 2305
    Serial Number: ...
    Made in: 2005
  Basic Display Parameters & Features:
    Digital display
    Maximum image size: 51 cm x 29 cm
    Gamma: 2.20
    DPMS levels: Off
    RGB color display
    First detailed timing is the preferred timing
  Color Characteristics:
    Red  : 0.6396, 0.3398
    Green: 0.2900, 0.6103
    Blue : 0.1396, 0.0703
    White: 0.2832, 0.2968
  Established Timings I & II:
    DMT 0x04:   640x480    59.940476 Hz   4:3     31.469 kHz     25.175000 MHz
    DMT 0x09:   800x600    60.316541 Hz   4:3     37.879 kHz     40.000000 MHz
    DMT 0x10:  1024x768    60.003840 Hz   4:3     48.363 kHz     65.000000 MHz
  Standard Timings:
    DMT 0x1c:  1280x800    59.810326 Hz  16:10    49.702 kHz     83.500000 MHz
    DMT 0x23:  1280x1024   60.019740 Hz   5:4     63.981 kHz    108.000000 MHz
    DMT 0x33:  1600x1200   60.000000 Hz   4:3     75.000 kHz    162.000000 MHz
    DMT 0x2a:  1400x1050   59.978442 Hz   4:3     65.317 kHz    121.750000 MHz
    DMT 0x52:  1920x1080   60.000000 Hz  16:9     67.500 kHz    148.500000 MHz
    DMT 0x55:  1280x720    60.000000 Hz  16:9     45.000 kHz     74.250000 MHz
    DMT 0x2f:  1440x900    59.887445 Hz  16:10    55.935 kHz    106.500000 MHz
    DMT 0x3a:  1680x1050   59.954250 Hz  16:10    65.290 kHz    146.250000 MHz
  Detailed Timing Descriptors:
    DTD 1:  1920x1080   59.939394 Hz  16:9     67.432 kHz    148.350000 MHz (16 mm x 9 mm)
                 Hfront   88 Hsync  44 Hback  148 Hpol P
                 Vfront    5 Vsync   5 Vback   35 Vpol P
    DTD 2:  1600x1200   60.000000 Hz   4:3     75.000 kHz    162.000000 MHz (4 mm x 3 mm)
                 Hfront   64 Hsync 192 Hback  304 Hpol P
                 Vfront    1 Vsync   3 Vback   46 Vpol P
    Display Product Name: 'HDMIBOX-901'
    Display Range Limits:
      Monitor ranges (GTF): 59-61 Hz V, 15-75 kHz H, max dotclock 170 MHz
Checksum: 0x5c

----------------

Warnings:

Block 0, Base EDID:
  Vendor & Product Identification: The serial number is one of the known dummy values, it should probably be set to 0.
  Detailed Timing Descriptor #1: Dubious image size (16x9 mm is smaller than 100x100 mm).
  Detailed Timing Descriptor #2: Dubious image size (4x3 mm is smaller than 100x100 mm).

Failures:

Block 0, Base EDID:
  Detailed Timing Descriptor #1: Mismatch of image size 16x9 mm vs display size 510x290 mm.
  Detailed Timing Descriptor #2: Mismatch of image size 4x3 mm vs display size 510x290 mm.

EDID conformity: FAIL
