edid-decode (hex):

00 ff ff ff ff ff ff 00 26 cf ab 05 00 00 00 00
00 20 01 04 b5 1f 14 78 03 de 50 a3 54 4c 99 26
0f 50 54 00 00 00 01 01 01 01 01 01 01 01 01 01
01 01 01 01 01 01 b2 9f 00 a0 a0 40 89 63 18 30
76 0a 38 c3 10 00 00 19 b2 9f 00 a0 a0 40 46 60
18 30 3c 00 38 c3 10 00 00 19 00 00 00 fd 00 28
5a 96 96 29 01 0a 20 20 20 20 20 20 00 00 00 fe
00 4d 31 34 35 4e 57 4b 31 20 52 30 20 0a 00 ad

00 ff ff ff ff ff ff 00 26 cf ab 05 00 00 00 00
00 20 01 04 b5 1f 14 78 03 de 50 a3 54 4c 99 26
0f 50 54 00 00 00 01 01 01 01 01 01 01 01 01 01
01 01 01 01 01 01 b2 9f 00 a0 a0 40 89 63 18 30
76 0a 38 c3 10 00 00 19 b2 9f 00 a0 a0 40 46 60
18 30 3c 00 38 c3 10 00 00 19 00 00 00 fd 00 28
5a 96 96 29 01 0a 20 20 20 20 20 20 00 00 00 fe
00 4d 31 34 35 4e 57 4b 31 20 52 30 20 0a 00 ad

----------------

Block 0, Base EDID:
  EDID Structure Version & Revision: 1.4
  Vendor & Product Identification:
    Manufacturer: IVO
    Model: 1451
    Made in: 2022
  Basic Display Parameters & Features:
    Digital display
    Bits per primary color channel: 10
    DisplayPort interface
    Maximum image size: 31 cm x 20 cm
    Gamma: 2.20
    Supported color formats: RGB 4:4:4
    First detailed timing includes the native pixel format and preferred refresh rate
    Display supports continuous frequencies
  Color Characteristics:
    Red  : 0.6396, 0.3291
    Green: 0.2998, 0.5996
    Blue : 0.1494, 0.0595
    White: 0.3125, 0.3281
  Established Timings I & II: none
  Standard Timings: none
  Detailed Timing Descriptors:
    DTD 1:  2560x1600   60.000587 Hz  16:10   150.301 kHz    408.820000 MHz (312 mm x 195 mm)
                 Hfront   24 Hsync  48 Hback   88 Hpol N
                 Vfront   39 Vsync  38 Vback  828 Vpol N
    DTD 2:  2560x1600   90.000881 Hz  16:10   150.301 kHz    408.820000 MHz (312 mm x 195 mm)
                 Hfront   24 Hsync  48 Hback   88 Hpol N
                 Vfront    3 Vsync  12 Vback   55 Vpol N
    Display Range Limits:
      Monitor ranges (Range Limits Only): 40-90 Hz V, 150-150 kHz H, max dotclock 410 MHz
    Alphanumeric Data String: 'M145NWK1 R0 '
Checksum: 0xad

----------------

Warnings:

Block 0, Base EDID:
  Missing Display Product Name.

Failures:

Block 0, Base EDID:
  Alphanumeric Data String: One or more trailing spaces before newline.
EDID:
  Extension Block 1 started with EDID header, ignoring Extension Blocks >= 1.

EDID conformity: FAIL
