edid-decode (hex):

00 ff ff ff ff ff ff 00 04 72 01 ad d7 69 41 03
22 14 01 03 80 29 17 78 ce 2e f0 a2 58 52 9c 25
10 50 54 bf ee 00 81 c0 01 01 01 01 01 01 01 01
01 01 01 01 01 01 66 21 56 aa 51 00 1e 30 46 8f
33 00 9a e6 10 00 00 1e 00 00 00 fd 00 38 4b 1e
53 09 00 0a 20 20 20 20 20 20 00 00 00 fc 00 41
54 31 39 32 36 44 5f 4d 31 39 30 44 00 00 00 ff
00 4d 41 4c 30 44 30 30 36 38 35 30 30 0a 01 b7

02 03 22 f1 4f 13 04 12 11 16 15 03 02 07 06 01
10 1f 14 05 23 09 07 07 83 01 00 00 65 03 0c 00
10 00 8c 0a d0 8a 20 e0 2d 10 10 3e 96 00 9a e6
10 00 00 18 8c 0a d0 90 20 40 31 20 0c 40 55 00
9a e6 10 00 00 19 01 1d 00 72 51 d0 1e 20 6e 28
55 00 9a e6 10 00 00 1e 8c 0a a0 20 51 20 18 10
18 7e 23 00 9a e6 10 00 00 99 01 1d 00 bc 52 d0
1e 20 b8 28 55 40 9a e6 10 00 00 1e 00 00 00 37

00 ff ff ff ff ff ff 00 04 72 01 ad d7 69 41 03
22 14 01 03 80 29 17 78 ce 2e f0 a2 58 52 9c 25
10 50 54 bf ee 00 81 c0 01 01 01 01 01 01 01 01
01 01 01 01 01 01 66 21 56 aa 51 00 1e 30 46 8f
33 00 9a e6 10 00 00 1e 00 00 00 fd 00 38 4b 1e
53 09 00 0a 20 20 20 20 20 20 00 00 00 fc 00 41
54 31 39 32 36 44 5f 4d 31 39 30 44 00 00 00 ff
00 4d 41 4c 30 44 30 30 36 38 35 30 30 0a 01 b7

02 03 22 f1 4f 13 04 12 11 16 15 03 02 07 06 01
10 1f 14 05 23 09 07 07 83 01 00 00 65 03 0c 00
10 00 8c 0a d0 8a 20 e0 2d 10 10 3e 96 00 9a e6
10 00 00 18 8c 0a d0 90 20 40 31 20 0c 40 55 00
9a e6 10 00 00 19 01 1d 00 72 51 d0 1e 20 6e 28
55 00 9a e6 10 00 00 1e 8c 0a a0 20 51 20 18 10
18 7e 23 00 9a e6 10 00 00 99 01 1d 00 bc 52 d0
1e 20 b8 28 55 40 9a e6 10 00 00 1e 00 00 00 37

----------------

Block 0, Base EDID:
  EDID Structure Version & Revision: 1.3
  Vendor & Product Identification:
    Manufacturer: ACR
    Model: 44289
    Serial Number: ...
    Made in: week 34 of 2010
  Basic Display Parameters & Features:
    Digital display
    Maximum image size: 41 cm x 23 cm
    Gamma: 2.20
    DPMS levels: Standby Suspend
    RGB color display
    Default (sRGB) color space is primary color space
    First detailed timing is the preferred timing
  Color Characteristics:
    Red  : 0.6328, 0.3457
    Green: 0.3232, 0.6113
    Blue : 0.1474, 0.0654
    White: 0.3125, 0.3281
  Established Timings I & II:
    IBM     :   720x400    70.081663 Hz   9:5     31.467 kHz     28.320000 MHz
    DMT 0x04:   640x480    59.940476 Hz   4:3     31.469 kHz     25.175000 MHz
    Apple   :   640x480    66.666667 Hz   4:3     35.000 kHz     30.240000 MHz
    DMT 0x05:   640x480    72.808802 Hz   4:3     37.861 kHz     31.500000 MHz
    DMT 0x06:   640x480    75.000000 Hz   4:3     37.500 kHz     31.500000 MHz
    DMT 0x08:   800x600    56.250000 Hz   4:3     35.156 kHz     36.000000 MHz
    DMT 0x09:   800x600    60.316541 Hz   4:3     37.879 kHz     40.000000 MHz
    DMT 0x0a:   800x600    72.187572 Hz   4:3     48.077 kHz     50.000000 MHz
    DMT 0x0b:   800x600    75.000000 Hz   4:3     46.875 kHz     49.500000 MHz
    Apple   :   832x624    74.551266 Hz   4:3     49.726 kHz     57.284000 MHz
    DMT 0x10:  1024x768    60.003840 Hz   4:3     48.363 kHz     65.000000 MHz
    DMT 0x11:  1024x768    70.069359 Hz   4:3     56.476 kHz     75.000000 MHz
    DMT 0x12:  1024x768    75.028582 Hz   4:3     60.023 kHz     78.750000 MHz
  Standard Timings:
    DMT 0x55:  1280x720    60.000000 Hz  16:9     45.000 kHz     74.250000 MHz
  Detailed Timing Descriptors:
    DTD  1:  1366x768    59.789541 Hz 683:384   47.712 kHz     85.500000 MHz (410 mm x 230 mm)
                  Hfront   70 Hsync 143 Hback  213 Hpol P
                  Vfront    3 Vsync   3 Vback   24 Vpol P
    Display Range Limits:
      Monitor ranges (GTF): 56-75 Hz V, 30-83 kHz H, max dotclock 90 MHz
    Display Product Name: 'AT1926D_M190D'
    Display Product Serial Number: ...
  Extension blocks: 1
Checksum: 0xb7

----------------

Block 1, CTA-861 Extension Block:
  Revision: 3
  Underscans IT Video Formats by default
  Basic audio support
  Supports YCbCr 4:4:4
  Supports YCbCr 4:2:2
  Native detailed modes: 1
  Video Data Block:
    VIC  19:  1280x720    50.000000 Hz  16:9     37.500 kHz     74.250000 MHz
    VIC   4:  1280x720    60.000000 Hz  16:9     45.000 kHz     74.250000 MHz
    VIC  18:   720x576    50.000000 Hz  16:9     31.250 kHz     27.000000 MHz
    VIC  17:   720x576    50.000000 Hz   4:3     31.250 kHz     27.000000 MHz
    VIC  22:  1440x576i   50.000000 Hz  16:9     15.625 kHz     27.000000 MHz
    VIC  21:  1440x576i   50.000000 Hz   4:3     15.625 kHz     27.000000 MHz
    VIC   3:   720x480    59.940060 Hz  16:9     31.469 kHz     27.000000 MHz
    VIC   2:   720x480    59.940060 Hz   4:3     31.469 kHz     27.000000 MHz
    VIC   7:  1440x480i   59.940060 Hz  16:9     15.734 kHz     27.000000 MHz
    VIC   6:  1440x480i   59.940060 Hz   4:3     15.734 kHz     27.000000 MHz
    VIC   1:   640x480    59.940476 Hz   4:3     31.469 kHz     25.175000 MHz
    VIC  16:  1920x1080   60.000000 Hz  16:9     67.500 kHz    148.500000 MHz
    VIC  31:  1920x1080   50.000000 Hz  16:9     56.250 kHz    148.500000 MHz
    VIC  20:  1920x1080i  50.000000 Hz  16:9     28.125 kHz     74.250000 MHz
    VIC   5:  1920x1080i  60.000000 Hz  16:9     33.750 kHz     74.250000 MHz
  Audio Data Block:
    Linear PCM:
      Max channels: 2
      Supported sample rates (kHz): 48 44.1 32
      Supported sample sizes (bits): 24 20 16
  Speaker Allocation Data Block:
    FL/FR - Front Left/Right
  Vendor-Specific Data Block (HDMI), OUI 00-0C-03:
    Source physical address: 1.0.0.0
  Detailed Timing Descriptors:
    DTD  2:   720x480    59.940060 Hz   3:2     31.469 kHz     27.000000 MHz (410 mm x 230 mm)
                  Hfront   16 Hsync  62 Hback   60 Hpol N
                  Vfront    9 Vsync   6 Vback   30 Vpol N
    DTD  3:   720x576    50.000000 Hz   5:4     31.250 kHz     27.000000 MHz (410 mm x 230 mm)
                  Hfront   12 Hsync  64 Hback   68 Hpol N
                  Vfront    5 Vsync   5 Vback   39 Vpol N
    DTD  4:  1280x720    60.000000 Hz  16:9     45.000 kHz     74.250000 MHz (410 mm x 230 mm)
                  Hfront  110 Hsync  40 Hback  220 Hpol P
                  Vfront    5 Vsync   5 Vback   20 Vpol P
    DTD  5:  1440x576i   50.000000 Hz   5:2     15.625 kHz     27.000000 MHz (410 mm x 230 mm)
                  Hfront   24 Hsync 126 Hback  138 Hpol N
                  Vfront    2 Vsync   3 Vback   19 Vpol N Vfront +0.5 Odd Field
                  Vfront    2 Vsync   3 Vback   19 Vpol N Vback  +0.5 Even Field
    DTD  6:  1280x720    50.000000 Hz  16:9     37.500 kHz     74.250000 MHz (410 mm x 230 mm)
                  Hfront  440 Hsync  40 Hback  220 Hpol P
                  Vfront    5 Vsync   5 Vback   20 Vpol P
Checksum: 0x37  Unused space in Extension Block: 3 bytes

----------------

Block 2, Unknown EDID Extension Block 0x00:
  00 ff ff ff ff ff ff 00 04 72 01 ad d7 69 41 03 '.........r...iA.'
  22 14 01 03 80 29 17 78 ce 2e f0 a2 58 52 9c 25 '"....).x....XR.%'
  10 50 54 bf ee 00 81 c0 01 01 01 01 01 01 01 01 '.PT.............'
  01 01 01 01 01 01 66 21 56 aa 51 00 1e 30 46 8f '......f!V.Q..0F.'
  33 00 9a e6 10 00 00 1e 00 00 00 fd 00 38 4b 1e '3............8K.'
  53 09 00 0a 20 20 20 20 20 20 00 00 00 fc 00 41 'S...      .....A'
  54 31 39 32 36 44 5f 4d 31 39 30 44 00 00 00 ff 'T1926D_M190D....'
  00 4d 41 4c 30 44 30 30 36 38 35 30 30 0a 01 b7 '.MAL0D0068500...'
Checksum: 0xb7

----------------

Block 3, CTA-861 Extension Block:
  Revision: 3
  Underscans IT Video Formats by default
  Basic audio support
  Supports YCbCr 4:4:4
  Supports YCbCr 4:2:2
  Native detailed modes: 1
  Video Data Block:
    VIC  19:  1280x720    50.000000 Hz  16:9     37.500 kHz     74.250000 MHz
    VIC   4:  1280x720    60.000000 Hz  16:9     45.000 kHz     74.250000 MHz
    VIC  18:   720x576    50.000000 Hz  16:9     31.250 kHz     27.000000 MHz
    VIC  17:   720x576    50.000000 Hz   4:3     31.250 kHz     27.000000 MHz
    VIC  22:  1440x576i   50.000000 Hz  16:9     15.625 kHz     27.000000 MHz
    VIC  21:  1440x576i   50.000000 Hz   4:3     15.625 kHz     27.000000 MHz
    VIC   3:   720x480    59.940060 Hz  16:9     31.469 kHz     27.000000 MHz
    VIC   2:   720x480    59.940060 Hz   4:3     31.469 kHz     27.000000 MHz
    VIC   7:  1440x480i   59.940060 Hz  16:9     15.734 kHz     27.000000 MHz
    VIC   6:  1440x480i   59.940060 Hz   4:3     15.734 kHz     27.000000 MHz
    VIC   1:   640x480    59.940476 Hz   4:3     31.469 kHz     25.175000 MHz
    VIC  16:  1920x1080   60.000000 Hz  16:9     67.500 kHz    148.500000 MHz
    VIC  31:  1920x1080   50.000000 Hz  16:9     56.250 kHz    148.500000 MHz
    VIC  20:  1920x1080i  50.000000 Hz  16:9     28.125 kHz     74.250000 MHz
    VIC   5:  1920x1080i  60.000000 Hz  16:9     33.750 kHz     74.250000 MHz
  Audio Data Block:
    Linear PCM:
      Max channels: 2
      Supported sample rates (kHz): 48 44.1 32
      Supported sample sizes (bits): 24 20 16
  Speaker Allocation Data Block:
    FL/FR - Front Left/Right
  Vendor-Specific Data Block (HDMI), OUI 00-0C-03:
    Source physical address: 1.0.0.0
  Detailed Timing Descriptors:
    DTD  7:   720x480    59.940060 Hz   3:2     31.469 kHz     27.000000 MHz (410 mm x 230 mm)
                  Hfront   16 Hsync  62 Hback   60 Hpol N
                  Vfront    9 Vsync   6 Vback   30 Vpol N
    DTD  8:   720x576    50.000000 Hz   5:4     31.250 kHz     27.000000 MHz (410 mm x 230 mm)
                  Hfront   12 Hsync  64 Hback   68 Hpol N
                  Vfront    5 Vsync   5 Vback   39 Vpol N
    DTD  9:  1280x720    60.000000 Hz  16:9     45.000 kHz     74.250000 MHz (410 mm x 230 mm)
                  Hfront  110 Hsync  40 Hback  220 Hpol P
                  Vfront    5 Vsync   5 Vback   20 Vpol P
    DTD 10:  1440x576i   50.000000 Hz   5:2     15.625 kHz     27.000000 MHz (410 mm x 230 mm)
                  Hfront   24 Hsync 126 Hback  138 Hpol N
                  Vfront    2 Vsync   3 Vback   19 Vpol N Vfront +0.5 Odd Field
                  Vfront    2 Vsync   3 Vback   19 Vpol N Vback  +0.5 Even Field
    DTD 11:  1280x720    50.000000 Hz  16:9     37.500 kHz     74.250000 MHz (410 mm x 230 mm)
                  Hfront  440 Hsync  40 Hback  220 Hpol P
                  Vfront    5 Vsync   5 Vback   20 Vpol P
Checksum: 0x37  Unused space in Extension Block: 3 bytes

----------------

Warnings:

Block 1, CTA-861 Extension Block:
  Video Data Block: VIC 19 and the first DTD are not identical. Is this intended?
  Detailed Timing Descriptor #2: Image size is 410x230 mm, but based on the picture AR it should be 410x273 mm.
  Detailed Timing Descriptor #3: Image size is 410x230 mm, but based on the picture AR it should be 410x328 mm.
  Detailed Timing Descriptor #5: Image size is 410x230 mm, but based on the picture AR it should be 410x164 mm.
  Display Product Serial Number is set, so the Serial Number in the Base EDID should be 0.
Block 3, CTA-861 Extension Block:
  Detailed Timing Descriptor #7: Image size is 410x230 mm, but based on the picture AR it should be 410x273 mm.
  Detailed Timing Descriptor #8: Image size is 410x230 mm, but based on the picture AR it should be 410x328 mm.
  Detailed Timing Descriptor #10: Image size is 410x230 mm, but based on the picture AR it should be 410x164 mm.
EDID:
  Base EDID: Some timings are out of range of the Monitor Ranges:
    Vertical Freq: 50.000 - 75.029 Hz (Monitor: 56.000 - 75.000 Hz)
    Horizontal Freq: 15.625 - 67.500 kHz (Monitor: 30.000 - 83.000 kHz)
    Maximum Clock: 148.500 MHz (Monitor: 90.000 MHz)

Failures:

Block 0, Base EDID:
  Basic Display Parameters & Features: sRGB is signaled, but the chromaticities do not match.
Block 1, CTA-861 Extension Block:
  Missing VCDB, needed for Set Selectable RGB Quantization to avoid interop issues.
Block 2, Base EDID:
  Unknown Extension Block.
Block 3, CTA-861 Extension Block:
  Video Data Block: Duplicate VIC 19.
  Video Data Block: Duplicate VIC 4.
  Video Data Block: Duplicate VIC 18.
  Video Data Block: Duplicate VIC 17.
  Video Data Block: Duplicate VIC 22.
  Video Data Block: Duplicate VIC 21.
  Video Data Block: Duplicate VIC 3.
  Video Data Block: Duplicate VIC 2.
  Video Data Block: Duplicate VIC 7.
  Video Data Block: Duplicate VIC 6.
  Video Data Block: Duplicate VIC 1.
  Video Data Block: Duplicate VIC 16.
  Video Data Block: Duplicate VIC 31.
  Video Data Block: Duplicate VIC 20.
  Video Data Block: Duplicate VIC 5.
  Speaker Allocation Data Block: Only one instance of this Data Block is allowed.
EDID:
  Base EDID: EDID specified 1 extension block(s), but found 3 extension block(s).
  Base EDID: EDID 1.3 requires a Block Map Extension in Block 1 if there are more than 2 blocks in the EDID.

EDID conformity: FAIL
