edid-decode (hex):

00 ff ff ff ff ff ff 00 04 72 94 04 10 c2 47 62
18 1a 01 04 b5 50 22 78 3b ca 95 a6 55 4e a1 26
0f 50 54 bf ef 80 d1 c0 b3 00 95 00 81 80 81 40
81 c0 81 00 71 4f b5 99 70 50 d0 a0 34 50 08 20
68 08 20 4f 31 00 00 1c 0f 7a 70 50 d0 a0 29 50
08 20 b8 04 20 4f 31 00 00 1c 00 00 00 fd 00 23
4b a0 a0 3c 01 0a 20 20 20 20 20 20 00 00 00 fc
00 41 63 65 72 20 42 58 33 34 30 43 4b 0a 01 c4

02 03 24 f1 4c 01 03 04 12 13 05 14 22 1f 90 07
20 23 09 07 07 83 01 00 00 6a 03 0c 00 10 00 38
78 20 00 00 02 3a 80 18 71 38 2d 40 58 2c 45 00
20 4f 31 00 00 1e 01 1d 00 72 51 d0 1e 20 6e 28
55 00 20 4f 31 00 00 1e 8c 0a d0 8a 20 e0 2d 10
10 3e 96 00 20 4f 31 00 00 18 8c 0a d0 90 20 40
31 20 0c 40 55 00 20 4f 31 00 00 18 00 00 00 00
00 00 00 00 00 00 00 00 00 00 00 00 00 00 00 73

00 ff ff ff ff ff ff 00 04 72 94 04 10 c2 47 62
18 1a 01 04 b5 50 22 78 3b ca 95 a6 55 4e a1 26
0f 50 54 bf ef 80 d1 c0 b3 00 95 00 81 80 81 40
81 c0 81 00 71 4f b5 99 70 50 d0 a0 34 50 08 20
68 08 20 4f 31 00 00 1c 0f 7a 70 50 d0 a0 29 50
08 20 b8 04 20 4f 31 00 00 1c 00 00 00 fd 00 23
4b a0 a0 3c 01 0a 20 20 20 20 20 20 00 00 00 fc
00 41 63 65 72 20 42 58 33 34 30 43 4b 0a 01 c4

02 03 24 f1 4c 01 03 04 12 13 05 14 22 1f 90 07
20 23 09 07 07 83 01 00 00 6a 03 0c 00 10 00 38
78 20 00 00 02 3a 80 18 71 38 2d 40 58 2c 45 00
20 4f 31 00 00 1e 01 1d 00 72 51 d0 1e 20 6e 28
55 00 20 4f 31 00 00 1e 8c 0a d0 8a 20 e0 2d 10
10 3e 96 00 20 4f 31 00 00 18 8c 0a d0 90 20 40
31 20 0c 40 55 00 20 4f 31 00 00 18 00 00 00 00
00 00 00 00 00 00 00 00 00 00 00 00 00 00 00 73

----------------

Block 0, Base EDID:
  EDID Structure Version & Revision: 1.4
  Vendor & Product Identification:
    Manufacturer: ACR
    Model: 1172
    Serial Number: ...
    Made in: week 24 of 2016
  Basic Display Parameters & Features:
    Digital display
    Bits per primary color channel: 10
    DisplayPort interface
    Maximum image size: 80 cm x 34 cm
    Gamma: 2.20
    DPMS levels: Off
    Supported color formats: RGB 4:4:4, YCrCb 4:4:4, YCrCb 4:2:2
    First detailed timing includes the native pixel format and preferred refresh rate
    Display supports continuous frequencies
  Color Characteristics:
    Red  : 0.6513, 0.3320
    Green: 0.3066, 0.6308
    Blue : 0.1503, 0.0595
    White: 0.3134, 0.3291
  Established Timings I & II:
    IBM     :   720x400    70.081663 Hz   9:5     31.467 kHz     28.320000 MHz
    DMT 0x04:   640x480    59.940476 Hz   4:3     31.469 kHz     25.175000 MHz
    Apple   :   640x480    66.666667 Hz   4:3     35.000 kHz     30.240000 MHz
    DMT 0x05:   640x480    72.808802 Hz   4:3     37.861 kHz     31.500000 MHz
    DMT 0x06:   640x480    75.000000 Hz   4:3     37.500 kHz     31.500000 MHz
    DMT 0x08:   800x600    56.250000 Hz   4:3     35.156 kHz     36.000000 MHz
    DMT 0x09:   800x600    60.316541 Hz   4:3     37.879 kHz     40.000000 MHz
    DMT 0x0a:   800x600    72.187572 Hz   4:3     48.077 kHz     50.000000 MHz
    DMT 0x0b:   800x600    75.000000 Hz   4:3     46.875 kHz     49.500000 MHz
    Apple   :   832x624    74.551266 Hz   4:3     49.726 kHz     57.284000 MHz
    DMT 0x10:  1024x768    60.003840 Hz   4:3     48.363 kHz     65.000000 MHz
    DMT 0x11:  1024x768    70.069359 Hz   4:3     56.476 kHz     75.000000 MHz
    DMT 0x12:  1024x768    75.028582 Hz   4:3     60.023 kHz     78.750000 MHz
    DMT 0x24:  1280x1024   75.024675 Hz   5:4     79.976 kHz    135.000000 MHz
    Apple   :  1152x870    75.061550 Hz 192:145   68.681 kHz    100.000000 MHz
  Standard Timings:
    DMT 0x52:  1920x1080   60.000000 Hz  16:9     67.500 kHz    148.500000 MHz
    DMT 0x3a:  1680x1050   59.954250 Hz  16:10    65.290 kHz    146.250000 MHz
    DMT 0x2f:  1440x900    59.887445 Hz  16:10    55.935 kHz    106.500000 MHz
    DMT 0x23:  1280x1024   60.019740 Hz   5:4     63.981 kHz    108.000000 MHz
    DMT 0x20:  1280x960    60.000000 Hz   4:3     60.000 kHz    108.000000 MHz
    DMT 0x55:  1280x720    60.000000 Hz  16:9     45.000 kHz     74.250000 MHz
    DMT 0x1c:  1280x800    59.810326 Hz  16:10    49.702 kHz     83.500000 MHz
    DMT 0x15:  1152x864    75.000000 Hz   4:3     67.500 kHz    108.000000 MHz
  Detailed Timing Descriptors:
    DTD 1:  3440x1440   74.924217 Hz  43:18   111.787 kHz    393.490000 MHz (800 mm x 335 mm)
                 Hfront    8 Hsync  32 Hback   40 Hpol N
                 Vfront   38 Vsync   8 Vback    6 Vpol P
    DTD 2:  3440x1440   59.939154 Hz  43:18    88.770 kHz    312.470000 MHz (800 mm x 335 mm)
                 Hfront    8 Hsync  32 Hback   40 Hpol N
                 Vfront   27 Vsync   8 Vback    6 Vpol P
    Display Range Limits:
      Monitor ranges (Range Limits Only): 35-75 Hz V, 160-160 kHz H, max dotclock 600 MHz
    Display Product Name: 'Acer BX340CK'
  Extension blocks: 1
Checksum: 0xc4

----------------

Block 1, CTA-861 Extension Block:
  Revision: 3
  Underscans IT Video Formats by default
  Basic audio support
  Supports YCbCr 4:4:4
  Supports YCbCr 4:2:2
  Native DTDs: 1
  Video Data Block:
    VIC   1:   640x480    59.940476 Hz   4:3     31.469 kHz     25.175000 MHz
    VIC   3:   720x480    59.940060 Hz  16:9     31.469 kHz     27.000000 MHz
    VIC   4:  1280x720    60.000000 Hz  16:9     45.000 kHz     74.250000 MHz
    VIC  18:   720x576    50.000000 Hz  16:9     31.250 kHz     27.000000 MHz
    VIC  19:  1280x720    50.000000 Hz  16:9     37.500 kHz     74.250000 MHz
    VIC   5:  1920x1080i  60.000000 Hz  16:9     33.750 kHz     74.250000 MHz
    VIC  20:  1920x1080i  50.000000 Hz  16:9     28.125 kHz     74.250000 MHz
    VIC  34:  1920x1080   30.000000 Hz  16:9     33.750 kHz     74.250000 MHz
    VIC  31:  1920x1080   50.000000 Hz  16:9     56.250 kHz    148.500000 MHz
    VIC  16:  1920x1080   60.000000 Hz  16:9     67.500 kHz    148.500000 MHz (native)
    VIC   7:  1440x480i   59.940060 Hz  16:9     15.734 kHz     27.000000 MHz
    VIC  32:  1920x1080   24.000000 Hz  16:9     27.000 kHz     74.250000 MHz
  Audio Data Block:
    Linear PCM:
      Max channels: 2
      Supported sample rates (kHz): 48 44.1 32
      Supported sample sizes (bits): 24 20 16
  Speaker Allocation Data Block:
    FL/FR - Front Left/Right
  Vendor-Specific Data Block (HDMI), OUI 00-0C-03:
    Source physical address: 1.0.0.0
    DC_36bit
    DC_30bit
    DC_Y444
    Maximum TMDS clock: 600 MHz
    Extended HDMI video details:
  Detailed Timing Descriptors:
    DTD 3:  1920x1080   60.000000 Hz  16:9     67.500 kHz    148.500000 MHz (800 mm x 335 mm)
                 Hfront   88 Hsync  44 Hback  148 Hpol P
                 Vfront    4 Vsync   5 Vback   36 Vpol P
    DTD 4:  1280x720    60.000000 Hz  16:9     45.000 kHz     74.250000 MHz (800 mm x 335 mm)
                 Hfront  110 Hsync  40 Hback  220 Hpol P
                 Vfront    5 Vsync   5 Vback   20 Vpol P
    DTD 5:   720x480    59.940060 Hz   3:2     31.469 kHz     27.000000 MHz (800 mm x 335 mm)
                 Hfront   16 Hsync  62 Hback   60 Hpol N
                 Vfront    9 Vsync   6 Vback   30 Vpol N
    DTD 6:   720x576    50.000000 Hz   5:4     31.250 kHz     27.000000 MHz (800 mm x 335 mm)
                 Hfront   12 Hsync  64 Hback   68 Hpol N
                 Vfront    5 Vsync   5 Vback   39 Vpol N
Checksum: 0x73  Unused space in Extension Block: 19 bytes

----------------

Warnings:

Block 1, CTA-861 Extension Block:
  Video Data Block: VIC 1 and the first DTD are not identical. Is this intended?
  Detailed Timing Descriptor #3: Image size is 800x335 mm, but based on the picture AR it should be 595x335 mm.
  Detailed Timing Descriptor #4: Image size is 800x335 mm, but based on the picture AR it should be 595x335 mm.
  Detailed Timing Descriptor #5: Image size is 800x335 mm, but based on the picture AR it should be 502x335 mm.
  Detailed Timing Descriptor #6: Image size is 800x335 mm, but based on the picture AR it should be 418x335 mm.
  Add a Colorimetry Data Block with the sRGB colorimetry bit set to avoid interop issues.
EDID:
  Base EDID: Some timings are out of range of the Monitor Ranges:
    Vertical Freq: 24.000 - 75.062 Hz (Monitor: 35.000 - 75.000 Hz)
    Horizontal Freq: 15.734 - 111.786 kHz (Monitor: 160.000 - 160.000 kHz)

Failures:

Block 1, CTA-861 Extension Block:
  Vendor-Specific Data Block (HDMI), OUI 00-0C-03: HDMI VSDB Max TMDS rate is > 340.
  Vendor-Specific Data Block (HDMI), OUI 00-0C-03: The HDMI Specification requires EDID 1.3 instead of 1.4.
  Missing VCDB, needed for Set Selectable RGB Quantization to avoid interop issues.
EDID:
  Extension Block 2 started with EDID header, ignoring Extension Blocks >= 2.
  CTA-861: Native progressive timings are a mix of several resolutions.

EDID conformity: FAIL
