edid-decode (hex):

00 ff ff ff ff ff ff 00 12 cd 55 55 34 04 00 00
28 0d 01 03 68 1e 17 78 ea 8f 3d a4 58 4d 90 24
15 4f 51 af ee 00 01 01 01 01 01 01 01 01 01 01
01 01 01 01 01 01 c3 1e 00 20 41 00 20 30 10 60
13 00 30 e4 10 00 00 1e 00 00 00 fd 00 31 4b 18
3d 08 00 0a 20 20 20 20 20 20 00 00 00 fc 00 4f
70 74 69 6d 61 20 31 35 31 0a 20 20 00 00 00 ff
00 34 30 37 48 30 30 32 32 30 31 30 37 36 00 e0

00 ff ff ff ff ff ff 00 12 cd 55 55 34 04 00 00
28 0d 01 03 68 1e 17 78 ea 8f 3d a4 58 4d 90 24
15 4f 51 af ee 00 01 01 01 01 01 01 01 01 01 01
01 01 01 01 01 01 c3 1e 00 20 41 00 20 30 10 60
13 00 30 e4 10 00 00 1e 00 00 00 fd 00 31 4b 18
3d 08 00 0a 20 20 20 20 20 20 00 00 00 fc 00 4f
70 74 69 6d 61 20 31 35 31 0a 20 20 00 00 00 ff
00 34 30 37 48 30 30 32 32 30 31 30 37 36 00 e0

----------------

Block 0, Base EDID:
  EDID Structure Version & Revision: 1.3
  Vendor & Product Identification:
    Manufacturer: DVM
    Model: 21845
    Serial Number: ...
    Made in: week 40 of 2003
  Basic Display Parameters & Features:
    Analog display
    Signal Level Standard: 0.700 : 0.000 : 0.700 V p-p
    Blank level equals black level
    Sync: Separate
    Maximum image size: 30 cm x 23 cm
    Gamma: 2.20
    DPMS levels: Standby Suspend Off
    RGB color display
    First detailed timing is the preferred timing
  Color Characteristics:
    Red  : 0.6425, 0.3437
    Green: 0.3037, 0.5654
    Blue : 0.1406, 0.0849
    White: 0.3115, 0.3173
  Established Timings I & II:
    IBM     :   720x400    70.081663 Hz   9:5     31.467 kHz     28.320000 MHz
    DMT 0x04:   640x480    59.940476 Hz   4:3     31.469 kHz     25.175000 MHz
    DMT 0x05:   640x480    72.808802 Hz   4:3     37.861 kHz     31.500000 MHz
    DMT 0x06:   640x480    75.000000 Hz   4:3     37.500 kHz     31.500000 MHz
    DMT 0x08:   800x600    56.250000 Hz   4:3     35.156 kHz     36.000000 MHz
    DMT 0x09:   800x600    60.316541 Hz   4:3     37.879 kHz     40.000000 MHz
    DMT 0x0a:   800x600    72.187572 Hz   4:3     48.077 kHz     50.000000 MHz
    DMT 0x0b:   800x600    75.000000 Hz   4:3     46.875 kHz     49.500000 MHz
    Apple   :   832x624    74.551266 Hz   4:3     49.726 kHz     57.284000 MHz
    DMT 0x10:  1024x768    60.003840 Hz   4:3     48.363 kHz     65.000000 MHz
    DMT 0x11:  1024x768    70.069359 Hz   4:3     56.476 kHz     75.000000 MHz
    DMT 0x12:  1024x768    75.028582 Hz   4:3     60.023 kHz     78.750000 MHz
  Standard Timings: none
  Detailed Timing Descriptors:
    DTD 1:  1024x768    75.028582 Hz   4:3     60.023 kHz     78.750000 MHz (304 mm x 228 mm)
                 Hfront   16 Hsync  96 Hback  176 Hpol P
                 Vfront    1 Vsync   3 Vback   28 Vpol P
    Display Range Limits:
      Monitor ranges (GTF): 49-75 Hz V, 24-61 kHz H, max dotclock 80 MHz
    Display Product Name: 'Optima 151'
    Display Product Serial Number: ...
Checksum: 0xe0

----------------

Failures:

EDID:
  Extension Block 1 started with EDID header, ignoring Extension Blocks >= 1.

EDID conformity: FAIL
