edid-decode (hex):

00 ff ff ff ff ff ff 00 0e 7f 11 52 01 04 00 00
05 17 01 04 95 2b 1d 78 02 80 42 ac 51 30 b4 25
10 50 53 00 00 00 01 01 01 01 01 01 01 01 01 01
01 01 01 01 01 01 4a 1c 56 a0 50 00 17 30 30 20
3a 00 06 4d 21 00 00 1a 93 17 56 a0 50 00 17 30
30 20 3a 00 06 4d 21 00 00 1a 00 00 00 fe 00 0a
20 20 20 20 20 20 20 20 20 20 20 20 00 00 00 fe
00 31 33 36 36 78 37 36 38 0a 20 20 20 20 00 b7

----------------

Block 0, Base EDID:
  EDID Structure Version & Revision: 1.4
  Vendor & Product Identification:
    Manufacturer: CS_
    Model: 21009
    Serial Number: ...
    Made in: week 5 of 2013
  Basic Display Parameters & Features:
    Digital display
    Bits per primary color channel: 6
    DisplayPort interface
    Maximum image size: 43 cm x 29 cm
    Gamma: 2.20
    Supported color formats: RGB 4:4:4
    First detailed timing includes the native pixel format and preferred refresh rate
  Color Characteristics:
    Red  : 0.6738, 0.3164
    Green: 0.1875, 0.7031
    Blue : 0.1455, 0.0625
    White: 0.3125, 0.3261
  Established Timings I & II: none
  Standard Timings: none
  Detailed Timing Descriptors:
    DTD 1:  1366x768    59.996719 Hz 683:384   47.457 kHz     72.420000 MHz (518 mm x 333 mm)
                 Hfront   48 Hsync  32 Hback   80 Hpol P
                 Vfront    3 Vsync  10 Vback   10 Vpol N
    DTD 2:  1366x768    49.997266 Hz 683:384   39.548 kHz     60.350000 MHz (518 mm x 333 mm)
                 Hfront   48 Hsync  32 Hback   80 Hpol P
                 Vfront    3 Vsync  10 Vback   10 Vpol N
    Alphanumeric Data String: ''
    Alphanumeric Data String: '1366x768'
Checksum: 0xb7

----------------

Warnings:

Block 0, Base EDID:
  Detailed Timing Descriptor #1: Image size is 518x333 mm, but based on the picture AR it should be 518x291 mm.
  Detailed Timing Descriptor #2: Image size is 518x333 mm, but based on the picture AR it should be 518x291 mm.
  Missing Display Product Name.

Failures:

Block 0, Base EDID:
  Vendor & Product Identification: Manufacturer name field contains garbage.
  Detailed Timing Descriptor #1: Mismatch of image size 518x333 mm vs display size 430x290 mm.
  Detailed Timing Descriptor #2: Mismatch of image size 518x333 mm vs display size 430x290 mm.
  Alphanumeric Data String: Empty string.
EDID:
  Base EDID: The DTD max image size is 518x333mm, which is larger than the display size 430.0x290.0mm.

EDID conformity: FAIL
