edid-decode (hex):

00 ff ff ff ff ff ff 00 0e 7f 11 52 01 04 00 00
00 1e 01 04 a5 2b 1d 78 02 80 42 ac 51 30 b4 25
10 50 53 00 00 00 01 01 01 01 01 01 01 01 01 01
01 01 01 01 01 01 2c 2a 00 98 51 00 2a 40 30 70
13 00 06 4d 21 00 00 1a 25 23 00 98 51 00 2a 40
30 70 13 00 06 4d 21 00 00 1a 00 00 00 fe 00 0a
20 20 20 20 20 20 20 20 20 20 20 20 00 00 00 fe
00 31 32 38 30 58 31 30 32 34 20 20 20 20 00 46

----------------

Block 0, Base EDID:
  EDID Structure Version & Revision: 1.4
  Vendor & Product Identification:
    Manufacturer: CS_
    Model: 21009
    Serial Number: ...
    Made in: 2020
  Basic Display Parameters & Features:
    Digital display
    Bits per primary color channel: 8
    DisplayPort interface
    Maximum image size: 43 cm x 29 cm
    Gamma: 2.20
    Supported color formats: RGB 4:4:4
    First detailed timing includes the native pixel format and preferred refresh rate
  Color Characteristics:
    Red  : 0.6738, 0.3164
    Green: 0.1875, 0.7031
    Blue : 0.1455, 0.0625
    White: 0.3125, 0.3261
  Established Timings I & II: none
  Standard Timings: none
  Detailed Timing Descriptors:
    DTD 1:  1280x1024   59.997510 Hz   5:4     63.957 kHz    107.960000 MHz (518 mm x 333 mm)
                 Hfront   48 Hsync 112 Hback  248 Hpol P
                 Vfront    1 Vsync   3 Vback   38 Vpol N
    DTD 2:  1280x1024   49.999778 Hz   5:4     53.300 kHz     89.970000 MHz (518 mm x 333 mm)
                 Hfront   48 Hsync 112 Hback  248 Hpol P
                 Vfront    1 Vsync   3 Vback   38 Vpol N
    Alphanumeric Data String: ''
    Alphanumeric Data String: '1280X1024    '
Checksum: 0x46

----------------

Warnings:

Block 0, Base EDID:
  Detailed Timing Descriptor #1: Image size is 518x333 mm, but based on the picture AR it should be 416x333 mm.
  Detailed Timing Descriptor #2: Image size is 518x333 mm, but based on the picture AR it should be 416x333 mm.
  Missing Display Product Name.

Failures:

Block 0, Base EDID:
  Vendor & Product Identification: Manufacturer name field contains garbage.
  Detailed Timing Descriptor #1: Mismatch of image size 518x333 mm vs display size 430x290 mm.
  Detailed Timing Descriptor #2: Mismatch of image size 518x333 mm vs display size 430x290 mm.
  Alphanumeric Data String: Empty string.
  Alphanumeric Data String: No newline, but one or more trailing spaces.
EDID:
  Base EDID: The DTD max image size is 518x333mm, which is larger than the display size 430.0x290.0mm.

EDID conformity: FAIL
