edid-decode (hex):

00 ff ff ff ff ff ff 00 61 13 15 a2 11 00 00 00
2d 1f 01 03 80 30 1a 78 2a f6 e5 a7 53 4d 99 24
14 50 54 25 4f 00 d1 cf b3 00 95 00 81 80 81 40
81 c0 d1 cf 01 01 02 3a 80 18 71 38 2d 40 58 2c
45 00 e0 04 11 00 00 1e 00 00 00 ff 00 54 39 58
43 4e 30 30 31 33 39 30 30 0a 00 00 00 fd 00 30
4b 53 53 14 00 0a 20 20 20 20 20 20 00 00 00 fc
00 4e 32 32 31 0a 20 20 20 20 20 20 20 20 01 ee

02 03 1f b1 4b 10 1f 05 14 04 13 03 12 02 11 01
65 03 0c 00 10 00 68 1a 00 00 01 01 30 4b 00 2a
44 80 a0 70 38 27 40 30 20 35 00 e0 04 11 00 00
18 01 1d 00 72 51 d0 1e 20 6e 28 55 00 e0 04 11
00 00 1e 8c 0a d0 8a 20 e0 2d 10 10 3e 96 00 e0
04 11 00 00 18 8c 0a d0 90 20 40 31 20 0c 40 55
00 e0 04 11 00 00 18 00 00 00 00 00 00 00 00 00
00 00 00 00 00 00 00 00 00 00 00 00 00 00 00 46

00 ff ff ff ff ff ff 00 61 13 15 a2 11 00 00 00
2d 1f 01 03 80 30 1a 78 2a f6 e5 a7 53 4d 99 24
14 50 54 25 4f 00 d1 cf b3 00 95 00 81 80 81 40
81 c0 d1 cf 01 01 02 3a 80 18 71 38 2d 40 58 2c
45 00 e0 04 11 00 00 1e 00 00 00 ff 00 54 39 58
43 4e 30 30 31 33 39 30 30 0a 00 00 00 fd 00 30
4b 53 53 14 00 0a 20 20 20 20 20 20 00 00 00 fc
00 4e 32 32 31 0a 20 20 20 20 20 20 20 20 01 ee

02 03 1f b1 4b 10 1f 05 14 04 13 03 12 02 11 01
65 03 0c 00 10 00 68 1a 00 00 01 01 30 4b 00 2a
44 80 a0 70 38 27 40 30 20 35 00 e0 04 11 00 00
18 01 1d 00 72 51 d0 1e 20 6e 28 55 00 e0 04 11
00 00 1e 8c 0a d0 8a 20 e0 2d 10 10 3e 96 00 e0
04 11 00 00 18 8c 0a d0 90 20 40 31 20 0c 40 55
00 e0 04 11 00 00 18 00 00 00 00 00 00 00 00 00
00 00 00 00 00 00 00 00 00 00 00 00 00 00 00 46

----------------

Block 0, Base EDID:
  EDID Structure Version & Revision: 1.3
  Vendor & Product Identification:
    Manufacturer: XHS
    Model: 41493
    Serial Number: ...
    Made in: week 45 of 2021
  Basic Display Parameters & Features:
    Digital display
    Maximum image size: 48 cm x 26 cm
    Gamma: 2.20
    DPMS levels: Off
    RGB color display
    First detailed timing is the preferred timing
  Color Characteristics:
    Red  : 0.6552, 0.3271
    Green: 0.3017, 0.5996
    Blue : 0.1435, 0.0800
    White: 0.3134, 0.3291
  Established Timings I & II:
    DMT 0x04:   640x480    59.940476 Hz   4:3     31.469 kHz     25.175000 MHz
    DMT 0x06:   640x480    75.000000 Hz   4:3     37.500 kHz     31.500000 MHz
    DMT 0x09:   800x600    60.316541 Hz   4:3     37.879 kHz     40.000000 MHz
    DMT 0x0b:   800x600    75.000000 Hz   4:3     46.875 kHz     49.500000 MHz
    DMT 0x10:  1024x768    60.003840 Hz   4:3     48.363 kHz     65.000000 MHz
    DMT 0x11:  1024x768    70.069359 Hz   4:3     56.476 kHz     75.000000 MHz
    DMT 0x12:  1024x768    75.028582 Hz   4:3     60.023 kHz     78.750000 MHz
    DMT 0x24:  1280x1024   75.024675 Hz   5:4     79.976 kHz    135.000000 MHz
  Standard Timings:
    GTF     :  1920x1080   75.000068 Hz  16:9     84.600 kHz    220.637000 MHz
    DMT 0x3a:  1680x1050   59.954250 Hz  16:10    65.290 kHz    146.250000 MHz
    DMT 0x2f:  1440x900    59.887445 Hz  16:10    55.935 kHz    106.500000 MHz
    DMT 0x23:  1280x1024   60.019740 Hz   5:4     63.981 kHz    108.000000 MHz
    DMT 0x20:  1280x960    60.000000 Hz   4:3     60.000 kHz    108.000000 MHz
    DMT 0x55:  1280x720    60.000000 Hz  16:9     45.000 kHz     74.250000 MHz
    GTF     :  1920x1080   75.000068 Hz  16:9     84.600 kHz    220.637000 MHz
  Detailed Timing Descriptors:
    DTD 1:  1920x1080   60.000000 Hz  16:9     67.500 kHz    148.500000 MHz (480 mm x 260 mm)
                 Hfront   88 Hsync  44 Hback  148 Hpol P
                 Vfront    4 Vsync   5 Vback   36 Vpol P
    Display Product Serial Number: ...
    Display Range Limits:
      Monitor ranges (GTF): 48-75 Hz V, 83-83 kHz H, max dotclock 200 MHz
    Display Product Name: 'N221'
  Extension blocks: 1
Checksum: 0xee

----------------

Block 1, CTA-861 Extension Block:
  Revision: 3
  Underscans IT Video Formats by default
  Supports YCbCr 4:4:4
  Supports YCbCr 4:2:2
  Native DTDs: 1
  Video Data Block:
    VIC  16:  1920x1080   60.000000 Hz  16:9     67.500 kHz    148.500000 MHz
    VIC  31:  1920x1080   50.000000 Hz  16:9     56.250 kHz    148.500000 MHz
    VIC   5:  1920x1080i  60.000000 Hz  16:9     33.750 kHz     74.250000 MHz
    VIC  20:  1920x1080i  50.000000 Hz  16:9     28.125 kHz     74.250000 MHz
    VIC   4:  1280x720    60.000000 Hz  16:9     45.000 kHz     74.250000 MHz
    VIC  19:  1280x720    50.000000 Hz  16:9     37.500 kHz     74.250000 MHz
    VIC   3:   720x480    59.940060 Hz  16:9     31.469 kHz     27.000000 MHz
    VIC  18:   720x576    50.000000 Hz  16:9     31.250 kHz     27.000000 MHz
    VIC   2:   720x480    59.940060 Hz   4:3     31.469 kHz     27.000000 MHz
    VIC  17:   720x576    50.000000 Hz   4:3     31.250 kHz     27.000000 MHz
    VIC   1:   640x480    59.940476 Hz   4:3     31.469 kHz     25.175000 MHz
  Vendor-Specific Data Block (HDMI), OUI 00-0C-03:
    Source physical address: 1.0.0.0
  Vendor-Specific Data Block (AMD), OUI 00-00-1A:
    Version: 1
    Feature Caps: 0x01
    Minimum Refresh Rate: 48 Hz
    Maximum Refresh Rate: 75 Hz
    Flags 1.x: 0x00
  Detailed Timing Descriptors:
    DTD 2:  1920x1080   74.972503 Hz  16:9     83.894 kHz    174.500000 MHz (480 mm x 260 mm)
                 Hfront   48 Hsync  32 Hback   80 Hpol N
                 Vfront    3 Vsync   5 Vback   31 Vpol N
    DTD 3:  1280x720    60.000000 Hz  16:9     45.000 kHz     74.250000 MHz (480 mm x 260 mm)
                 Hfront  110 Hsync  40 Hback  220 Hpol P
                 Vfront    5 Vsync   5 Vback   20 Vpol P
    DTD 4:   720x480    59.940060 Hz   3:2     31.469 kHz     27.000000 MHz (480 mm x 260 mm)
                 Hfront   16 Hsync  62 Hback   60 Hpol N
                 Vfront    9 Vsync   6 Vback   30 Vpol N
    DTD 5:   720x576    50.000000 Hz   5:4     31.250 kHz     27.000000 MHz (480 mm x 260 mm)
                 Hfront   12 Hsync  64 Hback   68 Hpol N
                 Vfront    5 Vsync   5 Vback   39 Vpol N
Checksum: 0x46  Unused space in Extension Block: 24 bytes

----------------

Warnings:

Block 1, CTA-861 Extension Block:
  Detailed Timing Descriptor #4: Image size is 480x260 mm, but based on the picture AR it should be 390x260 mm.
  Detailed Timing Descriptor #5: Image size is 480x260 mm, but based on the picture AR it should be 325x260 mm.
  Display Product Serial Number is set, so the Serial Number in the Base EDID should be 0.
  Add a Colorimetry Data Block with the sRGB colorimetry bit set to avoid interop issues.
EDID:
  Base EDID: Some timings are out of range of the Monitor Ranges:
    Horizontal Freq: 28.125 - 84.600 kHz (Monitor: 83.000 - 83.000 kHz)
    Maximum Clock: 220.637 MHz (Monitor: 200.000 MHz)

Failures:

Block 1, CTA-861 Extension Block:
  Missing VCDB, needed for Set Selectable RGB Quantization to avoid interop issues.
EDID:
  Extension Block 2 started with EDID header, ignoring Extension Blocks >= 2.

EDID conformity: FAIL
