edid-decode (hex):

00 ff ff ff ff ff ff 00 41 0c d0 08 f9 98 00 00
02 1d 01 03 6e 22 1b 78 2a 4b e5 a7 54 4d 9b 24
10 50 54 bd 4b 00 81 80 81 c0 81 40 01 01 01 01
01 01 01 01 01 01 30 2a 00 98 51 00 2a 40 30 70
13 00 52 0e 11 00 00 1e 00 00 00 ff 00 55 4b 31
31 39 30 32 30 33 39 31 36 31 00 00 00 fc 00 50
68 69 6c 69 70 73 20 31 37 53 34 0a 00 00 00 fd
00 38 4c 1e 53 0e 00 0a 20 20 20 20 20 20 00 69

00 ff ff ff ff ff ff 00 41 0c d0 08 f9 98 00 00
02 1d 01 03 6e 22 1b 78 2a 4b e5 a7 54 4d 9b 24
10 50 54 bd 4b 00 81 80 81 c0 81 40 01 01 01 01
01 01 01 01 01 01 30 2a 00 98 51 00 2a 40 30 70
13 00 52 0e 11 00 00 1e 00 00 00 ff 00 55 4b 31
31 39 30 32 30 33 39 31 36 31 00 00 00 fc 00 50
68 69 6c 69 70 73 20 31 37 53 34 0a 00 00 00 fd
00 38 4c 1e 53 0e 00 0a 20 20 20 20 20 20 00 69

----------------

Block 0, Base EDID:
  EDID Structure Version & Revision: 1.3
  Vendor & Product Identification:
    Manufacturer: PHL
    Model: 2256
    Serial Number: ...
    Made in: week 2 of 2019
  Basic Display Parameters & Features:
    Analog display
    Signal Level Standard: 0.700 : 0.000 : 0.700 V p-p
    Blank level equals black level
    Sync: Separate Composite SyncOnGreen
    Maximum image size: 34 cm x 27 cm
    Gamma: 2.20
    DPMS levels: Off
    RGB color display
    First detailed timing is the preferred timing
  Color Characteristics:
    Red  : 0.6533, 0.3281
    Green: 0.3027, 0.6083
    Blue : 0.1435, 0.0644
    White: 0.3134, 0.3291
  Established Timings I & II:
    IBM     :   720x400    70.081663 Hz   9:5     31.467 kHz     28.320000 MHz
    DMT 0x04:   640x480    59.940476 Hz   4:3     31.469 kHz     25.175000 MHz
    Apple   :   640x480    66.666667 Hz   4:3     35.000 kHz     30.240000 MHz
    DMT 0x05:   640x480    72.808802 Hz   4:3     37.861 kHz     31.500000 MHz
    DMT 0x06:   640x480    75.000000 Hz   4:3     37.500 kHz     31.500000 MHz
    DMT 0x09:   800x600    60.316541 Hz   4:3     37.879 kHz     40.000000 MHz
    DMT 0x0b:   800x600    75.000000 Hz   4:3     46.875 kHz     49.500000 MHz
    DMT 0x10:  1024x768    60.003840 Hz   4:3     48.363 kHz     65.000000 MHz
    DMT 0x12:  1024x768    75.028582 Hz   4:3     60.023 kHz     78.750000 MHz
    DMT 0x24:  1280x1024   75.024675 Hz   5:4     79.976 kHz    135.000000 MHz
  Standard Timings:
    DMT 0x23:  1280x1024   60.019740 Hz   5:4     63.981 kHz    108.000000 MHz
    DMT 0x55:  1280x720    60.000000 Hz  16:9     45.000 kHz     74.250000 MHz
    DMT 0x20:  1280x960    60.000000 Hz   4:3     60.000 kHz    108.000000 MHz
  Detailed Timing Descriptors:
    DTD 1:  1280x1024   60.019740 Hz   5:4     63.981 kHz    108.000000 MHz (338 mm x 270 mm)
                 Hfront   48 Hsync 112 Hback  248 Hpol P
                 Vfront    1 Vsync   3 Vback   38 Vpol P
    Display Product Serial Number: ...
    Display Product Name: 'Philips 17S4'
    Display Range Limits:
      Monitor ranges (GTF): 56-76 Hz V, 30-83 kHz H, max dotclock 140 MHz
Checksum: 0x69

----------------

Failures:

EDID:
  Extension Block 1 started with EDID header, ignoring Extension Blocks >= 1.

EDID conformity: FAIL
