edid-decode (hex):

00 ff ff ff ff ff ff 00 06 10 19 ae 21 d2 e6 56
21 1a 01 04 b5 30 1b 78 20 0c 61 ae 52 41 b3 26
0d 50 54 00 00 00 01 01 01 01 01 01 01 01 01 01
01 01 01 01 01 01 4d d0 00 a0 f0 70 3e 80 30 20
35 00 db 0b 11 00 00 1a 1a 36 80 a0 70 38 1f 40
30 20 35 00 db 0b 11 00 00 1a 00 00 00 fc 00 69
4d 61 63 0a 20 20 20 20 20 20 20 20 00 00 00 ff
00 38 33 34 32 37 43 46 32 31 44 32 32 36 01 0a

02 03 25 c0 23 09 07 07 83 01 00 00 70 fa 10 00
00 12 76 31 fc 78 fb b2 02 10 88 64 d4 69 fa 10
00 f6 f6 f7 f8 fe ff 5a a0 20 a0 d0 62 36 70 30
20 35 00 db 0b 11 00 00 1a 56 5e 00 a0 a0 a0 29
50 30 20 35 00 db 0b 11 00 00 1a 00 00 00 00 00
00 00 00 00 00 00 00 00 00 00 00 00 00 00 00 00
00 00 00 00 00 00 00 00 00 00 00 00 00 00 00 00
00 00 00 00 00 00 00 00 00 00 00 00 00 00 00 1c

00 ff ff ff ff ff ff 00 06 10 19 ae 21 d2 e6 56
21 1a 01 04 b5 30 1b 78 20 0c 61 ae 52 41 b3 26
0d 50 54 00 00 00 01 01 01 01 01 01 01 01 01 01
01 01 01 01 01 01 4d d0 00 a0 f0 70 3e 80 30 20
35 00 db 0b 11 00 00 1a 1a 36 80 a0 70 38 1f 40
30 20 35 00 db 0b 11 00 00 1a 00 00 00 fc 00 69
4d 61 63 0a 20 20 20 20 20 20 20 20 00 00 00 ff
00 38 33 34 32 37 43 46 32 31 44 32 32 36 01 0a

02 03 25 c0 23 09 07 07 83 01 00 00 70 fa 10 00
00 12 76 31 fc 78 fb b2 02 10 88 64 d4 69 fa 10
00 f6 f6 f7 f8 fe ff 5a a0 20 a0 d0 62 36 70 30
20 35 00 db 0b 11 00 00 1a 56 5e 00 a0 a0 a0 29
50 30 20 35 00 db 0b 11 00 00 1a 00 00 00 00 00
00 00 00 00 00 00 00 00 00 00 00 00 00 00 00 00
00 00 00 00 00 00 00 00 00 00 00 00 00 00 00 00
00 00 00 00 00 00 00 00 00 00 00 00 00 00 00 1c

----------------

Block 0, Base EDID:
  EDID Structure Version & Revision: 1.4
  Vendor & Product Identification:
    Manufacturer: APP
    Model: 44569
    Serial Number: ...
    Made in: week 33 of 2016
  Basic Display Parameters & Features:
    Digital display
    Bits per primary color channel: 10
    DisplayPort interface
    Maximum image size: 48 cm x 27 cm
    Gamma: 2.20
    DPMS levels: Off
    Supported color formats: RGB 4:4:4
    First detailed timing does not include the native pixel format and preferred refresh rate
  Color Characteristics:
    Red  : 0.6796, 0.3203
    Green: 0.2568, 0.6992
    Blue : 0.1494, 0.0527
    White: 0.3125, 0.3291
  Established Timings I & II: none
  Standard Timings: none
  Detailed Timing Descriptors:
    DTD 1:  3840x2160   59.996625 Hz  16:9    133.312 kHz    533.250000 MHz (475 mm x 267 mm)
                 Hfront   48 Hsync  32 Hback   80 Hpol P
                 Vfront    3 Vsync   5 Vback   54 Vpol N
    DTD 2:  1920x1080   59.933878 Hz  16:9     66.587 kHz    138.500000 MHz (475 mm x 267 mm)
                 Hfront   48 Hsync  32 Hback   80 Hpol P
                 Vfront    3 Vsync   5 Vback   23 Vpol N
    Display Product Name: 'iMac'
    Display Product Serial Number: ...
  Extension blocks: 1
Checksum: 0x0a

----------------

Block 1, CTA-861 Extension Block:
  Revision: 3
  Underscans IT Video Formats by default
  Basic audio support
  Native detailed modes: 0
  Audio Data Block:
    Linear PCM:
      Max channels: 2
      Supported sample rates (kHz): 48 44.1 32
      Supported sample sizes (bits): 24 20 16
  Speaker Allocation Data Block:
    FL/FR - Front Left/Right
  Vendor-Specific Data Block (Apple), OUI 00-10-FA:
    00 12 76 31 fc 78 fb b2 02 10 88 64 d4          '..v1.x.....d.'
  Vendor-Specific Data Block (Apple), OUI 00-10-FA:
    f6 f6 f7 f8 fe ff                               '......'
  Detailed Timing Descriptors:
    DTD 3:   602x1696  355.971129 Hz 301:848  860.026 kHz    655.340000 MHz (analog composite, sync-on-green, 3381 mm x 2816 mm)
                 Hfront   54 Hsync 624 Hback -540 Hpol N Hborder 11
                 Vfront    3 Vsync   0 Vback  683 Vpol N Vborder 17
                   fe ff 5a a0 20 a0 d0 62 36 70 30 20 35 00 db 0b 11 00 '..Z. ..b6p0 5.....'
    DTD 4:    86x2720  128.395062 Hz  43:1360  369.778 kHz     66.560000 MHz (analog composite, sync-on-green, 3381 mm x 2816 mm)
                 Hfront   41 Hsync 592 Hback -561 Hpol N Hborder 11
                 Vfront    3 Vsync   0 Vback  123 Vpol N Vborder 17
                   00 1a 56 5e 00 a0 a0 a0 29 50 30 20 35 00 db 0b 11 00 '..V^....)P0 5.....'
    DTD 5:     0x0            inf Hz   0:0      0.000 kHz     66.560000 MHz (analog composite, sync-on-green)
                 Hfront    0 Hsync   0 Hback    0 Hpol N
                 Vfront    0 Vsync   0 Vback    0 Vpol N
                   00 1a 00 00 00 00 00 00 00 00 00 00 00 00 00 00 00 00 '..................'
Checksum: 0x1c  Unused space in Extension Block: 36 bytes

----------------

Block 2, Unknown EDID Extension Block 0x00:
  00 ff ff ff ff ff ff 00 06 10 19 ae 21 d2 e6 56 '............!..V'
  21 1a 01 04 b5 30 1b 78 20 0c 61 ae 52 41 b3 26 '!....0.x .a.RA.&'
  0d 50 54 00 00 00 01 01 01 01 01 01 01 01 01 01 '.PT.............'
  01 01 01 01 01 01 4d d0 00 a0 f0 70 3e 80 30 20 '......M....p>.0 '
  35 00 db 0b 11 00 00 1a 1a 36 80 a0 70 38 1f 40 '5........6..p8.@'
  30 20 35 00 db 0b 11 00 00 1a 00 00 00 fc 00 69 '0 5............i'
  4d 61 63 0a 20 20 20 20 20 20 20 20 00 00 00 ff 'Mac.        ....'
  00 38 33 34 32 37 43 46 32 31 44 32 32 36 01 0a '.83427CF21D226..'
Checksum: 0x0a

----------------

Block 3, CTA-861 Extension Block:
  Revision: 3
  Underscans IT Video Formats by default
  Basic audio support
  Native detailed modes: 0
  Audio Data Block:
    Linear PCM:
      Max channels: 2
      Supported sample rates (kHz): 48 44.1 32
      Supported sample sizes (bits): 24 20 16
  Speaker Allocation Data Block:
    FL/FR - Front Left/Right
  Vendor-Specific Data Block (Apple), OUI 00-10-FA:
    00 12 76 31 fc 78 fb b2 02 10 88 64 d4          '..v1.x.....d.'
  Vendor-Specific Data Block (Apple), OUI 00-10-FA:
    f6 f6 f7 f8 fe ff                               '......'
  Detailed Timing Descriptors:
    DTD 6:   602x1696  355.971129 Hz 301:848  860.026 kHz    655.340000 MHz (analog composite, sync-on-green, 3381 mm x 2816 mm)
                 Hfront   54 Hsync 624 Hback -540 Hpol N Hborder 11
                 Vfront    3 Vsync   0 Vback  683 Vpol N Vborder 17
                   fe ff 5a a0 20 a0 d0 62 36 70 30 20 35 00 db 0b 11 00 '..Z. ..b6p0 5.....'
    DTD 7:    86x2720  128.395062 Hz  43:1360  369.778 kHz     66.560000 MHz (analog composite, sync-on-green, 3381 mm x 2816 mm)
                 Hfront   41 Hsync 592 Hback -561 Hpol N Hborder 11
                 Vfront    3 Vsync   0 Vback  123 Vpol N Vborder 17
                   00 1a 56 5e 00 a0 a0 a0 29 50 30 20 35 00 db 0b 11 00 '..V^....)P0 5.....'
    DTD 8:     0x0            inf Hz   0:0      0.000 kHz     66.560000 MHz (analog composite, sync-on-green)
                 Hfront    0 Hsync   0 Hback    0 Hpol N
                 Vfront    0 Vsync   0 Vback    0 Vpol N
                   00 1a 00 00 00 00 00 00 00 00 00 00 00 00 00 00 00 00 '..................'
Checksum: 0x1c  Unused space in Extension Block: 36 bytes

----------------

Warnings:

Block 1, CTA-861 Extension Block:
  Detailed Timing Descriptor #3: Image size is 3381x2816 mm, but based on the picture AR it should be 3381x9525 mm.
  Detailed Timing Descriptor #3: The use of non-zero borders in a DTD is not recommended.
  Detailed Timing Descriptor #4: Image size is 3381x2816 mm, but based on the picture AR it should be 3381x106933 mm.
  Detailed Timing Descriptor #4: The use of non-zero borders in a DTD is not recommended.
  Display Product Serial Number is set, so the Serial Number in the Base EDID should be 0.
  Add a Colorimetry Data Block with the sRGB colorimetry bit set to avoid interop issues.
Block 3, CTA-861 Extension Block:
  Detailed Timing Descriptor #6: Image size is 3381x2816 mm, but based on the picture AR it should be 3381x9525 mm.
  Detailed Timing Descriptor #6: The use of non-zero borders in a DTD is not recommended.
  Detailed Timing Descriptor #7: Image size is 3381x2816 mm, but based on the picture AR it should be 3381x106933 mm.
  Detailed Timing Descriptor #7: The use of non-zero borders in a DTD is not recommended.
EDID:
  No Native Video Resolution was defined.
    Hint: set 'Native detailed modes' to a non-0 value, or add a Native Video Resolution Data Block.

Failures:

Block 1, CTA-861 Extension Block:
  Offset is 37, but should be 39.
  Detailed Timing Descriptor #3: 0 values in the video timing:
    Horizontal Active/Blanking 602/160
    Horizontal Frontporch/Sync Width 54/624
    Vertical Active/Blanking 1696/720
    Vertical Frontporch/Sync Width 3/0
  Detailed Timing Descriptor #3: 0 or negative horizontal back porch.
  Detailed Timing Descriptor #3: Mismatch of image size 3381x2816 mm vs display size 480x270 mm.
  Detailed Timing Descriptor #4: 0 values in the video timing:
    Horizontal Active/Blanking 86/94
    Horizontal Frontporch/Sync Width 41/592
    Vertical Active/Blanking 2720/160
    Vertical Frontporch/Sync Width 3/0
  Detailed Timing Descriptor #4: 0 or negative horizontal back porch.
  Detailed Timing Descriptor #4: Mismatch of image size 3381x2816 mm vs display size 480x270 mm.
  Detailed Timing Descriptor #5: 0 values in the video timing:
    Horizontal Active/Blanking 0/0
    Horizontal Frontporch/Sync Width 0/0
    Vertical Active/Blanking 0/0
    Vertical Frontporch/Sync Width 0/0
  Detailed Timing Descriptor #5: 0 or negative horizontal front porch.
  Detailed Timing Descriptor #5: 0 or negative horizontal back porch.
  Detailed Timing Descriptor #5: 0 or negative vertical back porch.
  Detailed Timing Descriptor #5: Mismatch of image size vs display size: image size is not set, but display size is.
  Required 640x480p60 timings are missing in the established timings and the SVD list (VIC 1).
  Missing VCDB, needed for Set Selectable RGB Quantization to avoid interop issues.
Block 2, Base EDID:
  Unknown Extension Block.
Block 3, CTA-861 Extension Block:
  Speaker Allocation Data Block: Only one instance of this Data Block is allowed.
  Offset is 37, but should be 39.
  Detailed Timing Descriptor #6: 0 values in the video timing:
    Horizontal Active/Blanking 602/160
    Horizontal Frontporch/Sync Width 54/624
    Vertical Active/Blanking 1696/720
    Vertical Frontporch/Sync Width 3/0
  Detailed Timing Descriptor #6: 0 or negative horizontal back porch.
  Detailed Timing Descriptor #6: Mismatch of image size 3381x2816 mm vs display size 480x270 mm.
  Detailed Timing Descriptor #7: 0 values in the video timing:
    Horizontal Active/Blanking 86/94
    Horizontal Frontporch/Sync Width 41/592
    Vertical Active/Blanking 2720/160
    Vertical Frontporch/Sync Width 3/0
  Detailed Timing Descriptor #7: 0 or negative horizontal back porch.
  Detailed Timing Descriptor #7: Mismatch of image size 3381x2816 mm vs display size 480x270 mm.
  Detailed Timing Descriptor #8: 0 values in the video timing:
    Horizontal Active/Blanking 0/0
    Horizontal Frontporch/Sync Width 0/0
    Vertical Active/Blanking 0/0
    Vertical Frontporch/Sync Width 0/0
  Detailed Timing Descriptor #8: 0 or negative horizontal front porch.
  Detailed Timing Descriptor #8: 0 or negative horizontal back porch.
  Detailed Timing Descriptor #8: 0 or negative vertical back porch.
  Detailed Timing Descriptor #8: Mismatch of image size vs display size: image size is not set, but display size is.
EDID:
  Base EDID: The DTD max image size is 3381x2816mm, which is larger than the display size 480.0x270.0mm.
  Base EDID: EDID specified 1 extension block(s), but found 3 extension block(s).

EDID conformity: FAIL
