edid-decode (hex):

00 ff ff ff ff ff ff 00 22 0e 51 3a 00 00 00 00
23 22 01 03 80 34 20 78 2a 8e 35 ad 51 4b a1 25
0d 50 54 a5 4b 00 d1 c0 a9 c0 81 00 b3 00 95 00
d1 00 a9 40 81 80 28 3c 80 a0 70 b0 23 40 30 20
36 00 06 44 21 00 00 1a 00 00 00 fd 00 32 64 1e
82 1e 00 0a 20 20 20 20 20 20 00 00 00 fc 00 48
50 20 35 32 34 70 6e 0a 20 20 20 20 00 00 00 ff
00 43 4e 34 34 33 35 31 5a 54 5a 0a 20 20 01 d3

02 03 1b b1 4b 40 10 1f 29 04 13 12 03 11 02 01
67 03 0c 00 10 00 00 3c e2 00 ea 26 66 80 a0 70
b0 3a 40 30 20 36 00 06 44 21 00 00 1a af 4b 80
a0 70 b0 2b 40 30 20 36 00 06 44 21 00 00 1c 80
41 80 50 70 38 27 40 08 20 98 04 06 44 21 00 00
1a 02 3a 80 18 71 38 2d 40 58 2c 45 00 06 44 21
00 00 1e 02 3a 80 d0 72 38 2d 40 10 2c 45 80 06
44 21 00 00 1e 00 00 00 00 00 00 00 00 00 00 29

00 ff ff ff ff ff ff 00 22 0e 51 3a 00 00 00 00
23 22 01 03 80 34 20 78 2a 8e 35 ad 51 4b a1 25
0d 50 54 a5 4b 00 d1 c0 a9 c0 81 00 b3 00 95 00
d1 00 a9 40 81 80 28 3c 80 a0 70 b0 23 40 30 20
36 00 06 44 21 00 00 1a 00 00 00 fd 00 32 64 1e
82 1e 00 0a 20 20 20 20 20 20 00 00 00 fc 00 48
50 20 35 32 34 70 6e 0a 20 20 20 20 00 00 00 ff
00 43 4e 34 34 33 35 31 5a 54 5a 0a 20 20 01 d3

02 03 1b b1 4b 40 10 1f 29 04 13 12 03 11 02 01
67 03 0c 00 10 00 00 3c e2 00 ea 26 66 80 a0 70
b0 3a 40 30 20 36 00 06 44 21 00 00 1a af 4b 80
a0 70 b0 2b 40 30 20 36 00 06 44 21 00 00 1c 80
41 80 50 70 38 27 40 08 20 98 04 06 44 21 00 00
1a 02 3a 80 18 71 38 2d 40 58 2c 45 00 06 44 21
00 00 1e 02 3a 80 d0 72 38 2d 40 10 2c 45 80 06
44 21 00 00 1e 00 00 00 00 00 00 00 00 00 00 29

----------------

Block 0, Base EDID:
  EDID Structure Version & Revision: 1.3
  Vendor & Product Identification:
    Manufacturer: HPN
    Model: 14929
    Made in: week 35 of 2024
  Basic Display Parameters & Features:
    Digital display
    Maximum image size: 52 cm x 32 cm
    Gamma: 2.20
    DPMS levels: Off
    RGB color display
    First detailed timing is the preferred timing
  Color Characteristics:
    Red  : 0.6777, 0.3164
    Green: 0.2958, 0.6308
    Blue : 0.1445, 0.0537
    White: 0.3134, 0.3291
  Established Timings I & II:
    IBM     :   720x400    70.081663 Hz   9:5     31.467 kHz     28.320000 MHz
    DMT 0x04:   640x480    59.940476 Hz   4:3     31.469 kHz     25.175000 MHz
    DMT 0x06:   640x480    75.000000 Hz   4:3     37.500 kHz     31.500000 MHz
    DMT 0x09:   800x600    60.316541 Hz   4:3     37.879 kHz     40.000000 MHz
    DMT 0x0b:   800x600    75.000000 Hz   4:3     46.875 kHz     49.500000 MHz
    DMT 0x10:  1024x768    60.003840 Hz   4:3     48.363 kHz     65.000000 MHz
    DMT 0x12:  1024x768    75.028582 Hz   4:3     60.023 kHz     78.750000 MHz
    DMT 0x24:  1280x1024   75.024675 Hz   5:4     79.976 kHz    135.000000 MHz
  Standard Timings:
    DMT 0x52:  1920x1080   60.000000 Hz  16:9     67.500 kHz    148.500000 MHz
    DMT 0x53:  1600x900    60.000000 Hz  16:9     60.000 kHz    108.000000 MHz (RB)
    DMT 0x1c:  1280x800    59.810326 Hz  16:10    49.702 kHz     83.500000 MHz
    DMT 0x3a:  1680x1050   59.954250 Hz  16:10    65.290 kHz    146.250000 MHz
    DMT 0x2f:  1440x900    59.887445 Hz  16:10    55.935 kHz    106.500000 MHz
    DMT 0x45:  1920x1200   59.884600 Hz  16:10    74.556 kHz    193.250000 MHz
    DMT 0x33:  1600x1200   60.000000 Hz   4:3     75.000 kHz    162.000000 MHz
    DMT 0x23:  1280x1024   60.019740 Hz   5:4     63.981 kHz    108.000000 MHz
  Detailed Timing Descriptors:
    DTD 1:  1920x1200   59.950171 Hz  16:10    74.038 kHz    154.000000 MHz (518 mm x 324 mm)
                 Hfront   48 Hsync  32 Hback   80 Hpol P
                 Vfront    3 Vsync   6 Vback   26 Vpol N
    Display Range Limits:
      Monitor ranges (GTF): 50-100 Hz V, 30-130 kHz H, max dotclock 300 MHz
    Display Product Name: 'HP 524pn'
    Display Product Serial Number: ...
  Extension blocks: 1
Checksum: 0xd3

----------------

Block 1, CTA-861 Extension Block:
  Revision: 3
  Underscans IT Video Formats by default
  Supports YCbCr 4:4:4
  Supports YCbCr 4:2:2
  Native DTDs: 1
  Video Data Block:
    VIC  64:  1920x1080  100.000000 Hz  16:9    112.500 kHz    297.000000 MHz
    VIC  16:  1920x1080   60.000000 Hz  16:9     67.500 kHz    148.500000 MHz
    VIC  31:  1920x1080   50.000000 Hz  16:9     56.250 kHz    148.500000 MHz
    VIC  41:  1280x720   100.000000 Hz  16:9     75.000 kHz    148.500000 MHz
    VIC   4:  1280x720    60.000000 Hz  16:9     45.000 kHz     74.250000 MHz
    VIC  19:  1280x720    50.000000 Hz  16:9     37.500 kHz     74.250000 MHz
    VIC  18:   720x576    50.000000 Hz  16:9     31.250 kHz     27.000000 MHz
    VIC   3:   720x480    59.940060 Hz  16:9     31.469 kHz     27.000000 MHz
    VIC  17:   720x576    50.000000 Hz   4:3     31.250 kHz     27.000000 MHz
    VIC   2:   720x480    59.940060 Hz   4:3     31.469 kHz     27.000000 MHz
    VIC   1:   640x480    59.940476 Hz   4:3     31.469 kHz     25.175000 MHz
  Vendor-Specific Data Block (HDMI), OUI 00-0C-03:
    Source physical address: 1.0.0.0
    Maximum TMDS clock: 300 MHz
  Video Capability Data Block:
    YCbCr quantization: Selectable (via AVI YQ)
    RGB quantization: Selectable (via AVI Q)
    PT scan behavior: Always Underscanned
    IT scan behavior: Always Underscanned
    CE scan behavior: Always Underscanned
  Detailed Timing Descriptors:
    DTD 2:  1920x1200   99.937324 Hz  16:10   125.721 kHz    261.500000 MHz (518 mm x 324 mm)
                 Hfront   48 Hsync  32 Hback   80 Hpol P
                 Vfront    3 Vsync   6 Vback   49 Vpol N
    DTD 3:  1920x1200   74.938889 Hz  16:10    93.149 kHz    193.750000 MHz (518 mm x 324 mm)
                 Hfront   48 Hsync  32 Hback   80 Hpol N
                 Vfront    3 Vsync   6 Vback   34 Vpol P
    DTD 4:  1920x1080   74.924039 Hz  16:9     83.840 kHz    167.680000 MHz (518 mm x 324 mm)
                 Hfront    8 Hsync  32 Hback   40 Hpol P
                 Vfront   25 Vsync   8 Vback    6 Vpol N
    DTD 5:  1920x1080   60.000000 Hz  16:9     67.500 kHz    148.500000 MHz (518 mm x 324 mm)
                 Hfront   88 Hsync  44 Hback  148 Hpol P
                 Vfront    4 Vsync   5 Vback   36 Vpol P
    DTD 6:  1920x1080   50.000000 Hz  16:9     56.250 kHz    148.500000 MHz (518 mm x 324 mm)
                 Hfront  528 Hsync  44 Hback  148 Hpol P
                 Vfront    4 Vsync   5 Vback   36 Vpol P
Checksum: 0x29  Unused space in Extension Block: 10 bytes

----------------

Warnings:

Block 1, CTA-861 Extension Block:
  Video Data Block: VIC 64 and the first DTD are not identical. Is this intended?
  Video Capability Data Block: S_PT is equal to S_IT and S_CE, so should be set to 0 instead.
  Detailed Timing Descriptor #4: Image size is 518x324 mm, but based on the picture AR it should be 518x291 mm.
  Detailed Timing Descriptor #5: Image size is 518x324 mm, but based on the picture AR it should be 518x291 mm.
  Detailed Timing Descriptor #6: Image size is 518x324 mm, but based on the picture AR it should be 518x291 mm.
  Add a Colorimetry Data Block with the sRGB colorimetry bit set to avoid interop issues.

Failures:

EDID:
  Extension Block 2 started with EDID header, ignoring Extension Blocks >= 2.

EDID conformity: FAIL
