edid-decode (hex):

00 ff ff ff ff ff ff 00 19 c9 00 00 00 00 00 00
00 14 01 03 80 00 00 78 0a 53 0d a0 54 46 94 27
11 46 47 00 00 00 01 01 01 01 01 01 01 01 01 01
01 01 01 01 01 01 01 1d 00 72 51 d0 1e 20 6e 28
55 00 10 09 00 00 00 1e 8c 0a d0 8a 20 e0 2d 10
10 3e 96 00 10 09 00 00 00 18 00 00 00 fc 00 4c
43 44 20 54 56 0a 20 20 20 20 20 20 00 00 00 fd
00 39 3f 0f 31 09 00 0a 20 20 20 20 20 20 01 c8

02 03 24 70 47 04 03 02 05 06 07 01 26 09 07 07
15 07 50 83 01 00 00 6c 03 0c 00 10 00 00 1e c0
16 16 26 26 8c 0a d0 8a 20 e0 2d 10 10 3e 96 00
04 03 00 00 00 18 01 1d 80 18 71 1c 16 20 58 2c
25 00 10 09 00 00 00 9e 8c 0a a0 14 51 f0 16 00
26 7c 43 00 04 03 00 00 00 98 8c 0a a0 14 51 f0
16 00 26 7c 43 00 10 09 00 00 00 98 00 00 00 00
00 00 00 00 00 00 00 00 00 00 00 00 00 00 00 91

00 ff ff ff ff ff ff 00 19 c9 00 00 00 00 00 00
00 14 01 03 80 00 00 78 0a 53 0d a0 54 46 94 27
11 46 47 00 00 00 01 01 01 01 01 01 01 01 01 01
01 01 01 01 01 01 01 1d 00 72 51 d0 1e 20 6e 28
55 00 10 09 00 00 00 1e 8c 0a d0 8a 20 e0 2d 10
10 3e 96 00 10 09 00 00 00 18 00 00 00 fc 00 4c
43 44 20 54 56 0a 20 20 20 20 20 20 00 00 00 fd
00 39 3f 0f 31 09 00 0a 20 20 20 20 20 20 01 c8

02 03 24 70 47 04 03 02 05 06 07 01 26 09 07 07
15 07 50 83 01 00 00 6c 03 0c 00 10 00 00 1e c0
16 16 26 26 8c 0a d0 8a 20 e0 2d 10 10 3e 96 00
04 03 00 00 00 18 01 1d 80 18 71 1c 16 20 58 2c
25 00 10 09 00 00 00 9e 8c 0a a0 14 51 f0 16 00
26 7c 43 00 04 03 00 00 00 98 8c 0a a0 14 51 f0
16 00 26 7c 43 00 10 09 00 00 00 98 00 00 00 00
00 00 00 00 00 00 00 00 00 00 00 00 00 00 00 91

----------------

Block 0, Base EDID:
  EDID Structure Version & Revision: 1.3
  Vendor & Product Identification:
    Manufacturer: FNI
    Model: 0
    Made in: 2010
  Basic Display Parameters & Features:
    Digital display
    Image size is variable
    Gamma: 2.20
    RGB color display
    First detailed timing is the preferred timing
  Color Characteristics:
    Red  : 0.6259, 0.3291
    Green: 0.2734, 0.5810
    Blue : 0.1523, 0.0664
    White: 0.2763, 0.2783
  Established Timings I & II: none
  Standard Timings: none
  Detailed Timing Descriptors:
    DTD 1:  1280x720    60.000000 Hz  16:9     45.000 kHz     74.250000 MHz (16 mm x 9 mm)
                 Hfront  110 Hsync  40 Hback  220 Hpol P
                 Vfront    5 Vsync   5 Vback   20 Vpol P
    DTD 2:   720x480    59.940060 Hz   3:2     31.469 kHz     27.000000 MHz (16 mm x 9 mm)
                 Hfront   16 Hsync  62 Hback   60 Hpol N
                 Vfront    9 Vsync   6 Vback   30 Vpol N
    Display Product Name: 'LCD TV'
    Display Range Limits:
      Monitor ranges (GTF): 57-63 Hz V, 15-49 kHz H, max dotclock 90 MHz
  Extension blocks: 1
Checksum: 0xc8

----------------

Block 1, CTA-861 Extension Block:
  Revision: 3
  Basic audio support
  Supports YCbCr 4:4:4
  Supports YCbCr 4:2:2
  Native DTDs: 0
  Video Data Block:
    VIC   4:  1280x720    60.000000 Hz  16:9     45.000 kHz     74.250000 MHz
    VIC   3:   720x480    59.940060 Hz  16:9     31.469 kHz     27.000000 MHz
    VIC   2:   720x480    59.940060 Hz   4:3     31.469 kHz     27.000000 MHz
    VIC   5:  1920x1080i  60.000000 Hz  16:9     33.750 kHz     74.250000 MHz
    VIC   6:  1440x480i   59.940060 Hz   4:3     15.734 kHz     27.000000 MHz
    VIC   7:  1440x480i   59.940060 Hz  16:9     15.734 kHz     27.000000 MHz
    VIC   1:   640x480    59.940476 Hz   4:3     31.469 kHz     25.175000 MHz
  Audio Data Block:
    Linear PCM:
      Max channels: 2
      Supported sample rates (kHz): 48 44.1 32
      Supported sample sizes (bits): 24 20 16
    AC-3:
      Max channels: 6
      Supported sample rates (kHz): 48 44.1 32
      Maximum bit rate: 640 kb/s
  Speaker Allocation Data Block:
    FL/FR - Front Left/Right
  Vendor-Specific Data Block (HDMI), OUI 00-0C-03:
    Source physical address: 1.0.0.0
    Maximum TMDS clock: 150 MHz
    Video latency: 42 ms
    Audio latency: 42 ms
    Interlaced video latency: 74 ms
    Interlaced audio latency: 74 ms
  Detailed Timing Descriptors:
    DTD 3:   720x480    59.940060 Hz   3:2     31.469 kHz     27.000000 MHz (4 mm x 3 mm)
                 Hfront   16 Hsync  62 Hback   60 Hpol N
                 Vfront    9 Vsync   6 Vback   30 Vpol N
    DTD 4:  1920x1080i  60.000000 Hz  16:9     33.750 kHz     74.250000 MHz (16 mm x 9 mm)
                 Hfront   88 Hsync  44 Hback  148 Hpol P
                 Vfront    2 Vsync   5 Vback   15 Vpol P Vfront +0.5 Odd Field
                 Vfront    2 Vsync   5 Vback   15 Vpol P Vback  +0.5 Even Field
    DTD 5:  1440x480i   59.940060 Hz   3:1     15.734 kHz     27.000000 MHz (4 mm x 3 mm)
                 Hfront   38 Hsync 124 Hback  114 Hpol N
                 Vfront    4 Vsync   3 Vback   15 Vpol N Vfront +0.5 Odd Field
                 Vfront    4 Vsync   3 Vback   15 Vpol N Vback  +0.5 Even Field
    DTD 6:  1440x480i   59.940060 Hz   3:1     15.734 kHz     27.000000 MHz (16 mm x 9 mm)
                 Hfront   38 Hsync 124 Hback  114 Hpol N
                 Vfront    4 Vsync   3 Vback   15 Vpol N Vfront +0.5 Odd Field
                 Vfront    4 Vsync   3 Vback   15 Vpol N Vback  +0.5 Even Field
Checksum: 0x91  Unused space in Extension Block: 19 bytes

----------------

Warnings:

Block 0, Base EDID:
  Detailed Timing Descriptor #1: Dubious image size (16x9 mm is smaller than 100x100 mm).
  Detailed Timing Descriptor #2: Dubious image size (16x9 mm is smaller than 100x100 mm).
Block 1, CTA-861 Extension Block:
  IT Video Formats are overscanned by default, but normally this should be underscanned.
  Video Data Block: For improved preferred timing interoperability, set 'Native DTDs' to 1.
  Detailed Timing Descriptor #3: Dubious image size (4x3 mm is smaller than 100x100 mm).
  Detailed Timing Descriptor #4: Dubious image size (16x9 mm is smaller than 100x100 mm).
  Detailed Timing Descriptor #5: Dubious image size (4x3 mm is smaller than 100x100 mm).
  Detailed Timing Descriptor #6: Dubious image size (16x9 mm is smaller than 100x100 mm).
  Add a Colorimetry Data Block with the sRGB colorimetry bit set to avoid interop issues.

Failures:

Block 1, CTA-861 Extension Block:
  Missing VCDB, needed for Set Selectable RGB Quantization to avoid interop issues.
EDID:
  Extension Block 2 started with EDID header, ignoring Extension Blocks >= 2.
  Base EDID: The DTD max image size is 16x9mm, but the display size is not specified anywhere.

EDID conformity: FAIL
