edid-decode (hex):

00 ff ff ff ff ff ff 00 19 c9 00 00 00 00 00 00
00 15 01 04 a5 00 00 78 02 53 0d a0 54 46 94 27
11 46 47 21 08 00 01 01 01 01 01 01 01 01 01 01
01 01 01 01 01 01 66 21 50 b0 51 00 1b 30 40 70
36 00 10 09 00 00 00 1e a9 1a 00 a0 50 00 16 30
30 20 37 00 05 03 00 00 00 1a 00 00 00 fd 00 17
3f 0f 45 0f 00 0a 20 20 20 20 20 20 00 00 00 fc
00 4c 43 44 20 54 56 0a 20 20 20 20 20 20 00 fa

00 ff ff ff ff ff ff 00 19 c9 00 00 00 00 00 00
00 15 01 04 a5 00 00 78 02 53 0d a0 54 46 94 27
11 46 47 21 08 00 01 01 01 01 01 01 01 01 01 01
01 01 01 01 01 01 66 21 50 b0 51 00 1b 30 40 70
36 00 10 09 00 00 00 1e a9 1a 00 a0 50 00 16 30
30 20 37 00 05 03 00 00 00 1a 00 00 00 fd 00 17
3f 0f 45 0f 00 0a 20 20 20 20 20 20 00 00 00 fc
00 4c 43 44 20 54 56 0a 20 20 20 20 20 20 00 fa

----------------

Block 0, Base EDID:
  EDID Structure Version & Revision: 1.4
  Vendor & Product Identification:
    Manufacturer: FNI
    Model: 0
    Made in: 2011
  Basic Display Parameters & Features:
    Digital display
    Bits per primary color channel: 8
    DisplayPort interface
    Image size is variable
    Gamma: 2.20
    Supported color formats: RGB 4:4:4
    First detailed timing includes the native pixel format and preferred refresh rate
  Color Characteristics:
    Red  : 0.6259, 0.3291
    Green: 0.2734, 0.5810
    Blue : 0.1523, 0.0664
    White: 0.2763, 0.2783
  Established Timings I & II:
    DMT 0x04:   640x480    59.940476 Hz   4:3     31.469 kHz     25.175000 MHz
    DMT 0x09:   800x600    60.316541 Hz   4:3     37.879 kHz     40.000000 MHz
    DMT 0x10:  1024x768    60.003840 Hz   4:3     48.363 kHz     65.000000 MHz
  Standard Timings: none
  Detailed Timing Descriptors:
    DTD 1:  1360x768    60.015162 Hz  85:48    47.712 kHz     85.500000 MHz (16 mm x 9 mm)
                 Hfront   64 Hsync 112 Hback  256 Hpol P
                 Vfront    3 Vsync   6 Vback   18 Vpol P
    DTD 2:  1280x768    59.994726 Hz   5:3     47.396 kHz     68.250000 MHz (5 mm x 3 mm)
                 Hfront   48 Hsync  32 Hback   80 Hpol P
                 Vfront    3 Vsync   7 Vback   12 Vpol N
    Display Range Limits:
      Monitor ranges (GTF): 23-63 Hz V, 15-69 kHz H, max dotclock 150 MHz
    Display Product Name: 'LCD TV'
Checksum: 0xfa

----------------

Warnings:

Block 0, Base EDID:
  Detailed Timing Descriptor #1: Dubious image size (16x9 mm is smaller than 100x100 mm).
  Detailed Timing Descriptor #2: Dubious image size (5x3 mm is smaller than 100x100 mm).
  Display Range Limits: GTF support is deprecated in EDID 1.4.

Failures:

Block 0, Base EDID:
  Display Range Limits: GTF is supported, but the display does not support continuous frequencies.
EDID:
  Extension Block 1 started with EDID header, ignoring Extension Blocks >= 1.
  Base EDID: The DTD max image size is 16x9mm, but the display size is not specified anywhere.

EDID conformity: FAIL
