edid-decode (hex):

00 ff ff ff ff ff ff 00 5a 63 32 be 01 01 01 01
19 1d 01 03 0e 29 17 78 2e af 05 a3 5a 53 9e 25
12 50 54 bf ef 80 81 80 81 40 81 00 81 c0 01 01
01 01 01 01 01 01 66 21 56 aa 51 00 1e 30 46 8f
33 00 9a e6 10 00 00 1e 00 00 00 ff 00 55 4e 4e
31 39 32 35 35 30 39 30 36 0a 00 00 00 fd 00 32
4b 18 52 11 00 0a 20 20 20 20 20 20 00 00 00 fc
00 56 41 31 39 30 31 20 53 65 72 69 65 73 00 9d

00 ff ff ff ff ff ff 00 5a 63 32 be 01 01 01 01
19 1d 01 03 0e 29 17 78 2e af 05 a3 5a 53 9e 25
12 50 54 bf ef 80 81 80 81 40 81 00 81 c0 01 01
01 01 01 01 01 01 66 21 56 aa 51 00 1e 30 46 8f
33 00 9a e6 10 00 00 1e 00 00 00 ff 00 55 4e 4e
31 39 32 35 35 30 39 30 36 0a 00 00 00 fd 00 32
4b 18 52 11 00 0a 20 20 20 20 20 20 00 00 00 fc
00 56 41 31 39 30 31 20 53 65 72 69 65 73 00 9d

----------------

Block 0, Base EDID:
  EDID Structure Version & Revision: 1.3
  Vendor & Product Identification:
    Manufacturer: VSC
    Model: 48690
    Serial Number: ...
    Made in: week 25 of 2019
  Basic Display Parameters & Features:
    Analog display
    Signal Level Standard: 0.700 : 0.300 : 1.000 V p-p
    Blank level equals black level
    Sync: Separate Composite SyncOnGreen
    Maximum image size: 41 cm x 23 cm
    Gamma: 2.20
    DPMS levels: Off
    RGB color display
    Default (sRGB) color space is primary color space
    First detailed timing is the preferred timing
  Color Characteristics:
    Red  : 0.6386, 0.3535
    Green: 0.3271, 0.6201
    Blue : 0.1445, 0.0703
    White: 0.3134, 0.3291
  Established Timings I & II:
    IBM     :   720x400    70.081663 Hz   9:5     31.467 kHz     28.320000 MHz
    DMT 0x04:   640x480    59.940476 Hz   4:3     31.469 kHz     25.175000 MHz
    Apple   :   640x480    66.666667 Hz   4:3     35.000 kHz     30.240000 MHz
    DMT 0x05:   640x480    72.808802 Hz   4:3     37.861 kHz     31.500000 MHz
    DMT 0x06:   640x480    75.000000 Hz   4:3     37.500 kHz     31.500000 MHz
    DMT 0x08:   800x600    56.250000 Hz   4:3     35.156 kHz     36.000000 MHz
    DMT 0x09:   800x600    60.316541 Hz   4:3     37.879 kHz     40.000000 MHz
    DMT 0x0a:   800x600    72.187572 Hz   4:3     48.077 kHz     50.000000 MHz
    DMT 0x0b:   800x600    75.000000 Hz   4:3     46.875 kHz     49.500000 MHz
    Apple   :   832x624    74.551266 Hz   4:3     49.726 kHz     57.284000 MHz
    DMT 0x10:  1024x768    60.003840 Hz   4:3     48.363 kHz     65.000000 MHz
    DMT 0x11:  1024x768    70.069359 Hz   4:3     56.476 kHz     75.000000 MHz
    DMT 0x12:  1024x768    75.028582 Hz   4:3     60.023 kHz     78.750000 MHz
    DMT 0x24:  1280x1024   75.024675 Hz   5:4     79.976 kHz    135.000000 MHz
    Apple   :  1152x870    75.061550 Hz 192:145   68.681 kHz    100.000000 MHz
  Standard Timings:
    DMT 0x23:  1280x1024   60.019740 Hz   5:4     63.981 kHz    108.000000 MHz
    DMT 0x20:  1280x960    60.000000 Hz   4:3     60.000 kHz    108.000000 MHz
    DMT 0x1c:  1280x800    59.810326 Hz  16:10    49.702 kHz     83.500000 MHz
    DMT 0x55:  1280x720    60.000000 Hz  16:9     45.000 kHz     74.250000 MHz
  Detailed Timing Descriptors:
    DTD 1:  1366x768    59.789541 Hz 683:384   47.712 kHz     85.500000 MHz (410 mm x 230 mm)
                 Hfront   70 Hsync 143 Hback  213 Hpol P
                 Vfront    3 Vsync   3 Vback   24 Vpol P
    Display Product Serial Number: ...
    Display Range Limits:
      Monitor ranges (GTF): 50-75 Hz V, 24-82 kHz H, max dotclock 170 MHz
    Display Product Name: 'VA1901 Series'
Checksum: 0x9d

----------------

Warnings:

Block 0, Base EDID:
  Vendor & Product Identification: The serial number is one of the known dummy values, it should probably be set to 0.

Failures:

Block 0, Base EDID:
  Basic Display Parameters & Features: sRGB is signaled, but the chromaticities do not match.
EDID:
  Extension Block 1 started with EDID header, ignoring Extension Blocks >= 1.

EDID conformity: FAIL
