edid-decode (hex):

00 ff ff ff ff ff ff 00 36 69 b6 4d 00 00 00 00
0f 22 01 03 80 4f 21 78 ae ee 95 a3 54 4c 99 26
0f 50 54 bf cf 00 81 80 95 00 b3 00 d1 c0 d1 e8
81 a8 b3 28 01 01 f5 7c 70 a0 d0 a0 29 50 30 20
35 00 1d 4d 31 00 00 1a 00 00 00 ff 00 44 42 36
48 35 30 34 34 30 30 30 39 32 00 00 00 fd 00 30
64 1e a0 22 00 0a 20 20 20 20 20 20 00 00 00 fc
00 4d 41 47 33 34 32 43 51 50 56 0a 20 20 01 21

02 03 2b f3 4a 01 02 03 04 00 12 13 1f 45 5f 23
09 07 07 83 01 00 00 6a 03 0c 00 10 00 98 44 20
00 00 68 1a 00 00 01 01 30 64 ed 42 41 b8 a0 60
a0 29 50 30 20 35 00 1d 4d 31 00 00 1e 56 5e 00
a0 a0 a0 29 50 30 20 35 00 1d 4d 31 00 00 1e 22
68 70 a0 d0 a0 29 50 30 20 35 00 1d 4d 31 00 00
1e 00 00 00 00 00 00 00 00 00 00 00 00 00 00 00
00 00 00 00 00 00 00 00 00 00 00 00 00 00 00 bb

00 ff ff ff ff ff ff 00 36 69 b6 4d 00 00 00 00
0f 22 01 03 80 4f 21 78 ae ee 95 a3 54 4c 99 26
0f 50 54 bf cf 00 81 80 95 00 b3 00 d1 c0 d1 e8
81 a8 b3 28 01 01 f5 7c 70 a0 d0 a0 29 50 30 20
35 00 1d 4d 31 00 00 1a 00 00 00 ff 00 44 42 36
48 35 30 34 34 30 30 30 39 32 00 00 00 fd 00 30
64 1e a0 22 00 0a 20 20 20 20 20 20 00 00 00 fc
00 4d 41 47 33 34 32 43 51 50 56 0a 20 20 01 21

02 03 2b f3 4a 01 02 03 04 00 12 13 1f 45 5f 23
09 07 07 83 01 00 00 6a 03 0c 00 10 00 98 44 20
00 00 68 1a 00 00 01 01 30 64 ed 42 41 b8 a0 60
a0 29 50 30 20 35 00 1d 4d 31 00 00 1e 56 5e 00
a0 a0 a0 29 50 30 20 35 00 1d 4d 31 00 00 1e 22
68 70 a0 d0 a0 29 50 30 20 35 00 1d 4d 31 00 00
1e 00 00 00 00 00 00 00 00 00 00 00 00 00 00 00
00 00 00 00 00 00 00 00 00 00 00 00 00 00 00 bb

----------------

Block 0, Base EDID:
  EDID Structure Version & Revision: 1.3
  Vendor & Product Identification:
    Manufacturer: MSI
    Model: 19894
    Made in: week 15 of 2024
  Basic Display Parameters & Features:
    Digital display
    Maximum image size: 79 cm x 33 cm
    Gamma: 2.20
    DPMS levels: Standby Off
    RGB color display
    Default (sRGB) color space is primary color space
    First detailed timing is the preferred timing
  Color Characteristics:
    Red  : 0.6396, 0.3300
    Green: 0.2998, 0.5996
    Blue : 0.1503, 0.0595
    White: 0.3134, 0.3291
  Established Timings I & II:
    IBM     :   720x400    70.081663 Hz   9:5     31.467 kHz     28.320000 MHz
    DMT 0x04:   640x480    59.940476 Hz   4:3     31.469 kHz     25.175000 MHz
    Apple   :   640x480    66.666667 Hz   4:3     35.000 kHz     30.240000 MHz
    DMT 0x05:   640x480    72.808802 Hz   4:3     37.861 kHz     31.500000 MHz
    DMT 0x06:   640x480    75.000000 Hz   4:3     37.500 kHz     31.500000 MHz
    DMT 0x08:   800x600    56.250000 Hz   4:3     35.156 kHz     36.000000 MHz
    DMT 0x09:   800x600    60.316541 Hz   4:3     37.879 kHz     40.000000 MHz
    DMT 0x0a:   800x600    72.187572 Hz   4:3     48.077 kHz     50.000000 MHz
    DMT 0x0b:   800x600    75.000000 Hz   4:3     46.875 kHz     49.500000 MHz
    DMT 0x10:  1024x768    60.003840 Hz   4:3     48.363 kHz     65.000000 MHz
    DMT 0x11:  1024x768    70.069359 Hz   4:3     56.476 kHz     75.000000 MHz
    DMT 0x12:  1024x768    75.028582 Hz   4:3     60.023 kHz     78.750000 MHz
    DMT 0x24:  1280x1024   75.024675 Hz   5:4     79.976 kHz    135.000000 MHz
  Standard Timings:
    DMT 0x23:  1280x1024   60.019740 Hz   5:4     63.981 kHz    108.000000 MHz
    DMT 0x2f:  1440x900    59.887445 Hz  16:10    55.935 kHz    106.500000 MHz
    DMT 0x3a:  1680x1050   59.954250 Hz  16:10    65.290 kHz    146.250000 MHz
    DMT 0x52:  1920x1080   60.000000 Hz  16:9     67.500 kHz    148.500000 MHz
    GTF     :  1920x1080  100.000000 Hz  16:9    114.400 kHz    302.016000 MHz
    GTF     :  1280x1024  100.000000 Hz   5:4    108.500 kHz    190.960000 MHz
    GTF     :  1680x1050  100.000078 Hz  16:10   111.200 kHz    256.205000 MHz
  Detailed Timing Descriptors:
    DTD 1:  3440x1440   59.998875 Hz  43:18    88.858 kHz    319.890000 MHz (797 mm x 333 mm)
                 Hfront   48 Hsync  32 Hback   80 Hpol P
                 Vfront    3 Vsync   5 Vback   33 Vpol N
    Display Product Serial Number: ...
    Display Range Limits:
      Monitor ranges (GTF): 48-100 Hz V, 30-160 kHz H, max dotclock 340 MHz
    Display Product Name: 'MAG342CQPV'
  Extension blocks: 1
Checksum: 0x21

----------------

Block 1, CTA-861 Extension Block:
  Revision: 3
  Underscans IT Video Formats by default
  Basic audio support
  Supports YCbCr 4:4:4
  Supports YCbCr 4:2:2
  Native DTDs: 3
  Video Data Block:
    VIC   1:   640x480    59.940476 Hz   4:3     31.469 kHz     25.175000 MHz
    VIC   2:   720x480    59.940060 Hz   4:3     31.469 kHz     27.000000 MHz
    VIC   3:   720x480    59.940060 Hz  16:9     31.469 kHz     27.000000 MHz
    VIC   4:  1280x720    60.000000 Hz  16:9     45.000 kHz     74.250000 MHz
    VIC  18:   720x576    50.000000 Hz  16:9     31.250 kHz     27.000000 MHz
    VIC  19:  1280x720    50.000000 Hz  16:9     37.500 kHz     74.250000 MHz
    VIC  31:  1920x1080   50.000000 Hz  16:9     56.250 kHz    148.500000 MHz
    VIC  69:  1280x720    60.000000 Hz  64:27    45.000 kHz     74.250000 MHz
    VIC  95:  3840x2160   30.000000 Hz  16:9     67.500 kHz    297.000000 MHz
  Audio Data Block:
    Linear PCM:
      Max channels: 2
      Supported sample rates (kHz): 48 44.1 32
      Supported sample sizes (bits): 24 20 16
  Speaker Allocation Data Block:
    FL/FR - Front Left/Right
  Vendor-Specific Data Block (HDMI), OUI 00-0C-03:
    Source physical address: 1.0.0.0
    Supports_AI
    DC_30bit
    DC_Y444
    Maximum TMDS clock: 340 MHz
    Extended HDMI video details:
  Vendor-Specific Data Block (AMD), OUI 00-00-1A:
    Version: 1
    Flags 1: 0x01
      FreeSync Supported
    Minimum Refresh Rate: 48 Hz
    Maximum Refresh Rate: 100 Hz
    MCCS VCP Code: 0xed
  Detailed Timing Descriptors:
    DTD 2:  1720x1440   60.001149 Hz  43:36    88.862 kHz    167.060000 MHz (797 mm x 333 mm)
                 Hfront   48 Hsync  32 Hback   80 Hpol P
                 Vfront    3 Vsync   5 Vback   33 Vpol P
    DTD 3:  2560x1440   59.950550 Hz  16:9     88.787 kHz    241.500000 MHz (797 mm x 333 mm)
                 Hfront   48 Hsync  32 Hback   80 Hpol P
                 Vfront    3 Vsync   5 Vback   33 Vpol P
    DTD 4:  3440x1440   50.000000 Hz  43:18    74.050 kHz    266.580000 MHz (797 mm x 333 mm)
                 Hfront   48 Hsync  32 Hback   80 Hpol P
                 Vfront    3 Vsync   5 Vback   33 Vpol P
Checksum: 0xbb  Unused space in Extension Block: 30 bytes

----------------

Warnings:

Block 1, CTA-861 Extension Block:
  Video Data Block: VIC 1 and the first DTD are not identical. Is this intended?
  Video Data Block: All VICs are in ascending order, and the first (preferred) VIC <= 4, is that intended?
  Detailed Timing Descriptor #2: Image size is 797x333 mm, but based on the picture AR it should be 397x333 mm.
  Detailed Timing Descriptor #3: Image size is 797x333 mm, but based on the picture AR it should be 592x333 mm.
EDID:
  Base EDID: Some timings are out of range of the Monitor Ranges:
    Vertical Freq: 30.000 - 100.000 Hz (Monitor: 48.000 - 100.000 Hz)

Failures:

Block 0, Base EDID:
  Basic Display Parameters & Features: sRGB is signaled, but the chromaticities do not match.
Block 1, CTA-861 Extension Block:
  Missing VCDB, needed for Set Selectable RGB Quantization to avoid interop issues.
EDID:
  Extension Block 2 started with EDID header, ignoring Extension Blocks >= 2.
  CTA-861: Native progressive timings are a mix of several resolutions.

EDID conformity: FAIL
