edid-decode (hex):

00 ff ff ff ff ff ff 00 4c 2d 28 05 30 32 46 45
33 13 01 03 80 2c 19 78 2a 98 d1 a6 56 4b 9b 25
13 50 54 bf ee 80 71 4f 81 00 95 00 01 01 01 01
01 01 01 01 01 01 30 2a 40 c8 60 84 64 30 18 50
13 00 bb fa 10 00 00 1e 00 00 00 fd 00 38 4b 1e
51 0e 00 0a 20 20 20 20 20 20 00 00 00 fc 00 53
79 6e 63 4d 61 73 74 65 72 0a 20 20 00 00 00 ff
00 48 39 4d 53 43 30 31 39 37 37 0a 20 20 01 8a

02 01 04 00 8c 0a d0 8a 20 e0 2d 10 10 3e 96 00
bb fa 10 00 00 18 8c 0a d0 90 20 40 31 20 0c 40
55 00 bb fa 10 00 00 18 01 1d 00 bc 52 d0 1e 20
b8 28 55 40 bb fa 10 00 00 1e 01 1d 00 72 51 d0
1e 20 6e 28 55 00 bb fa 10 00 00 1e 00 00 00 00
00 00 00 00 00 00 00 00 00 00 00 00 00 00 00 00
00 00 00 00 00 00 00 00 00 00 00 00 00 00 00 00
00 00 00 00 00 00 00 00 00 00 00 00 00 00 00 97

00 ff ff ff ff ff ff 00 4c 2d 28 05 30 32 46 45
33 13 01 03 80 2c 19 78 2a 98 d1 a6 56 4b 9b 25
13 50 54 bf ee 80 71 4f 81 00 95 00 01 01 01 01
01 01 01 01 01 01 30 2a 40 c8 60 84 64 30 18 50
13 00 bb fa 10 00 00 1e 00 00 00 fd 00 38 4b 1e
51 0e 00 0a 20 20 20 20 20 20 00 00 00 fc 00 53
79 6e 63 4d 61 73 74 65 72 0a 20 20 00 00 00 ff
00 48 39 4d 53 43 30 31 39 37 37 0a 20 20 01 8a

02 01 04 00 8c 0a d0 8a 20 e0 2d 10 10 3e 96 00
bb fa 10 00 00 18 8c 0a d0 90 20 40 31 20 0c 40
55 00 bb fa 10 00 00 18 01 1d 00 bc 52 d0 1e 20
b8 28 55 40 bb fa 10 00 00 1e 01 1d 00 72 51 d0
1e 20 6e 28 55 00 bb fa 10 00 00 1e 00 00 00 00
00 00 00 00 00 00 00 00 00 00 00 00 00 00 00 00
00 00 00 00 00 00 00 00 00 00 00 00 00 00 00 00
00 00 00 00 00 00 00 00 00 00 00 00 00 00 00 97

----------------

Block 0, Base EDID:
  EDID Structure Version & Revision: 1.3
  Vendor & Product Identification:
    Manufacturer: SAM
    Model: 1320
    Serial Number: ...
    Made in: week 51 of 2009
  Basic Display Parameters & Features:
    Digital display
    Maximum image size: 44 cm x 25 cm
    Gamma: 2.20
    DPMS levels: Off
    RGB color display
    First detailed timing is the preferred timing
  Color Characteristics:
    Red  : 0.6503, 0.3369
    Green: 0.2949, 0.6054
    Blue : 0.1474, 0.0751
    White: 0.3125, 0.3291
  Established Timings I & II:
    IBM     :   720x400    70.081663 Hz   9:5     31.467 kHz     28.320000 MHz
    DMT 0x04:   640x480    59.940476 Hz   4:3     31.469 kHz     25.175000 MHz
    Apple   :   640x480    66.666667 Hz   4:3     35.000 kHz     30.240000 MHz
    DMT 0x05:   640x480    72.808802 Hz   4:3     37.861 kHz     31.500000 MHz
    DMT 0x06:   640x480    75.000000 Hz   4:3     37.500 kHz     31.500000 MHz
    DMT 0x08:   800x600    56.250000 Hz   4:3     35.156 kHz     36.000000 MHz
    DMT 0x09:   800x600    60.316541 Hz   4:3     37.879 kHz     40.000000 MHz
    DMT 0x0a:   800x600    72.187572 Hz   4:3     48.077 kHz     50.000000 MHz
    DMT 0x0b:   800x600    75.000000 Hz   4:3     46.875 kHz     49.500000 MHz
    Apple   :   832x624    74.551266 Hz   4:3     49.726 kHz     57.284000 MHz
    DMT 0x10:  1024x768    60.003840 Hz   4:3     48.363 kHz     65.000000 MHz
    DMT 0x11:  1024x768    70.069359 Hz   4:3     56.476 kHz     75.000000 MHz
    DMT 0x12:  1024x768    75.028582 Hz   4:3     60.023 kHz     78.750000 MHz
    Apple   :  1152x870    75.061550 Hz 192:145   68.681 kHz    100.000000 MHz
  Standard Timings:
    DMT 0x15:  1152x864    75.000000 Hz   4:3     67.500 kHz    108.000000 MHz
    DMT 0x1c:  1280x800    59.810326 Hz  16:10    49.702 kHz     83.500000 MHz
    DMT 0x2f:  1440x900    59.887445 Hz  16:10    55.935 kHz    106.500000 MHz
  Detailed Timing Descriptors:
    DTD 1:  1600x900    60.000000 Hz  16:9     60.000 kHz    108.000000 MHz (443 mm x 250 mm)
                 Hfront   24 Hsync  80 Hback   96 Hpol P
                 Vfront    1 Vsync   3 Vback   96 Vpol P
    Display Range Limits:
      Monitor ranges (GTF): 56-75 Hz V, 30-81 kHz H, max dotclock 140 MHz
    Display Product Name: 'SyncMaster'
    Display Product Serial Number: ...
  Extension blocks: 1
Checksum: 0x8a

----------------

Block 1, CTA-861 Extension Block:
  Revision: 1
  Detailed Timing Descriptors:
    DTD 2:   720x480    59.940060 Hz   3:2     31.469 kHz     27.000000 MHz (443 mm x 250 mm)
                 Hfront   16 Hsync  62 Hback   60 Hpol N
                 Vfront    9 Vsync   6 Vback   30 Vpol N
    DTD 3:   720x576    50.000000 Hz   5:4     31.250 kHz     27.000000 MHz (443 mm x 250 mm)
                 Hfront   12 Hsync  64 Hback   68 Hpol N
                 Vfront    5 Vsync   5 Vback   39 Vpol N
    DTD 4:  1280x720    50.000000 Hz  16:9     37.500 kHz     74.250000 MHz (443 mm x 250 mm)
                 Hfront  440 Hsync  40 Hback  220 Hpol P
                 Vfront    5 Vsync   5 Vback   20 Vpol P
    DTD 5:  1280x720    60.000000 Hz  16:9     45.000 kHz     74.250000 MHz (443 mm x 250 mm)
                 Hfront  110 Hsync  40 Hback  220 Hpol P
                 Vfront    5 Vsync   5 Vback   20 Vpol P
Checksum: 0x97  Unused space in Extension Block: 51 bytes

----------------

Block 2, Unknown EDID Extension Block 0x00:
  00 ff ff ff ff ff ff 00 4c 2d 28 05 30 32 46 45 '........L-(.02FE'
  33 13 01 03 80 2c 19 78 2a 98 d1 a6 56 4b 9b 25 '3....,.x*...VK.%'
  13 50 54 bf ee 80 71 4f 81 00 95 00 01 01 01 01 '.PT...qO........'
  01 01 01 01 01 01 30 2a 40 c8 60 84 64 30 18 50 '......0*@.`.d0.P'
  13 00 bb fa 10 00 00 1e 00 00 00 fd 00 38 4b 1e '.............8K.'
  51 0e 00 0a 20 20 20 20 20 20 00 00 00 fc 00 53 'Q...      .....S'
  79 6e 63 4d 61 73 74 65 72 0a 20 20 00 00 00 ff 'yncMaster.  ....'
  00 48 39 4d 53 43 30 31 39 37 37 0a 20 20 01 8a '.H9MSC01977.  ..'
Checksum: 0x8a

----------------

Block 3, CTA-861 Extension Block:
  Revision: 1
  Detailed Timing Descriptors:
    DTD 6:   720x480    59.940060 Hz   3:2     31.469 kHz     27.000000 MHz (443 mm x 250 mm)
                 Hfront   16 Hsync  62 Hback   60 Hpol N
                 Vfront    9 Vsync   6 Vback   30 Vpol N
    DTD 7:   720x576    50.000000 Hz   5:4     31.250 kHz     27.000000 MHz (443 mm x 250 mm)
                 Hfront   12 Hsync  64 Hback   68 Hpol N
                 Vfront    5 Vsync   5 Vback   39 Vpol N
    DTD 8:  1280x720    50.000000 Hz  16:9     37.500 kHz     74.250000 MHz (443 mm x 250 mm)
                 Hfront  440 Hsync  40 Hback  220 Hpol P
                 Vfront    5 Vsync   5 Vback   20 Vpol P
    DTD 9:  1280x720    60.000000 Hz  16:9     45.000 kHz     74.250000 MHz (443 mm x 250 mm)
                 Hfront  110 Hsync  40 Hback  220 Hpol P
                 Vfront    5 Vsync   5 Vback   20 Vpol P
Checksum: 0x97  Unused space in Extension Block: 51 bytes

----------------

Warnings:

Block 1, CTA-861 Extension Block:
  Detailed Timing Descriptor #2: Image size is 443x250 mm, but based on the picture AR it should be 443x295 mm.
  Detailed Timing Descriptor #3: Image size is 443x250 mm, but based on the picture AR it should be 443x354 mm.
  Detailed Timing Descriptor #4: DTD is identical to VIC 19, which is not present in the CTA Ext Block.
  Detailed Timing Descriptor #5: DTD is identical to VIC 4, which is not present in the CTA Ext Block.
  Display Product Serial Number is set, so the Serial Number in the Base EDID should be 0.
  Add a Colorimetry Data Block with the sRGB colorimetry bit set to avoid interop issues.
Block 3, CTA-861 Extension Block:
  Detailed Timing Descriptor #6: Image size is 443x250 mm, but based on the picture AR it should be 443x295 mm.
  Detailed Timing Descriptor #7: Image size is 443x250 mm, but based on the picture AR it should be 443x354 mm.
  Detailed Timing Descriptor #8: DTD is identical to VIC 19, which is not present in the CTA Ext Block.
  Detailed Timing Descriptor #9: DTD is identical to VIC 4, which is not present in the CTA Ext Block.
EDID:
  Base EDID: Some timings are out of range of the Monitor Ranges:
    Vertical Freq: 50.000 - 75.062 Hz (Monitor: 56.000 - 75.000 Hz)

Failures:

Block 1, CTA-861 Extension Block:
  Missing VCDB, needed for Set Selectable RGB Quantization to avoid interop issues.
Block 2, Base EDID:
  Unknown Extension Block.
EDID:
  Base EDID: EDID specified 1 extension block(s), but found 3 extension block(s).
  Base EDID: EDID 1.3 requires a Block Map Extension in Block 1 if there are more than 2 blocks in the EDID.

EDID conformity: FAIL
