edid-decode (hex):

00 ff ff ff ff ff ff 00 59 3a 70 00 01 01 01 01
00 14 01 04 08 30 1b 78 2a 18 15 a4 5d 53 a4 27
13 50 54 a5 4e 00 01 01 01 01 01 01 01 01 01 01
01 01 01 01 01 01 02 3a 80 18 71 38 2d 40 58 2c
45 00 dc 0c 11 00 00 1e 00 00 00 ff 00 0a 20 20
20 20 20 20 20 20 20 20 20 20 00 00 00 fc 00 4d
32 32 30 56 41 0a 20 20 20 20 20 20 00 00 00 fd
00 3a 4c 1e 46 0f 00 0a 20 20 20 20 20 20 00 9a

00 ff ff ff ff ff ff 00 59 3a 70 00 01 01 01 01
00 14 01 04 08 30 1b 78 2a 18 15 a4 5d 53 a4 27
13 50 54 a5 4e 00 01 01 01 01 01 01 01 01 01 01
01 01 01 01 01 01 02 3a 80 18 71 38 2d 40 58 2c
45 00 dc 0c 11 00 00 1e 00 00 00 ff 00 0a 20 20
20 20 20 20 20 20 20 20 20 20 00 00 00 fc 00 4d
32 32 30 56 41 0a 20 20 20 20 20 20 00 00 00 fd
00 3a 4c 1e 46 0f 00 0a 20 20 20 20 20 20 00 9a

----------------

Block 0, Base EDID:
  EDID Structure Version & Revision: 1.4
  Vendor & Product Identification:
    Manufacturer: VIZ
    Model: 112
    Serial Number: ...
    Made in: 2010
  Basic Display Parameters & Features:
    Analog display
    Signal Level Standard: 0.700 : 0.300 : 1.000 V p-p
    Blank level equals black level
    Sync: Separate
    Maximum image size: 48 cm x 27 cm
    Gamma: 2.20
    DPMS levels: Off
    RGB color display
    First detailed timing includes the native pixel format and preferred refresh rate
  Color Characteristics:
    Red  : 0.6406, 0.3642
    Green: 0.3261, 0.6406
    Blue : 0.1523, 0.0751
    White: 0.3134, 0.3291
  Established Timings I & II:
    IBM     :   720x400    70.081663 Hz   9:5     31.467 kHz     28.320000 MHz
    DMT 0x04:   640x480    59.940476 Hz   4:3     31.469 kHz     25.175000 MHz
    DMT 0x06:   640x480    75.000000 Hz   4:3     37.500 kHz     31.500000 MHz
    DMT 0x09:   800x600    60.316541 Hz   4:3     37.879 kHz     40.000000 MHz
    DMT 0x0b:   800x600    75.000000 Hz   4:3     46.875 kHz     49.500000 MHz
    DMT 0x10:  1024x768    60.003840 Hz   4:3     48.363 kHz     65.000000 MHz
    DMT 0x11:  1024x768    70.069359 Hz   4:3     56.476 kHz     75.000000 MHz
    DMT 0x12:  1024x768    75.028582 Hz   4:3     60.023 kHz     78.750000 MHz
  Standard Timings: none
  Detailed Timing Descriptors:
    DTD 1:  1920x1080   60.000000 Hz  16:9     67.500 kHz    148.500000 MHz (476 mm x 268 mm)
                 Hfront   88 Hsync  44 Hback  148 Hpol P
                 Vfront    4 Vsync   5 Vback   36 Vpol P
    Display Product Serial Number: ...
    Display Product Name: 'M220VA'
    Display Range Limits:
      Monitor ranges (GTF): 58-76 Hz V, 30-70 kHz H, max dotclock 150 MHz
Checksum: 0x9a

----------------

Block 1, Unknown EDID Extension Block 0x00:
  00 ff ff ff ff ff ff 00 59 3a 70 00 01 01 01 01 '........Y:p.....'
  00 14 01 04 08 30 1b 78 2a 18 15 a4 5d 53 a4 27 '.....0.x*...]S.''
  13 50 54 a5 4e 00 01 01 01 01 01 01 01 01 01 01 '.PT.N...........'
  01 01 01 01 01 01 02 3a 80 18 71 38 2d 40 58 2c '.......:..q8-@X,'
  45 00 dc 0c 11 00 00 1e 00 00 00 ff 00 0a 20 20 'E.............  '
  20 20 20 20 20 20 20 20 20 20 00 00 00 fc 00 4d '          .....M'
  32 32 30 56 41 0a 20 20 20 20 20 20 00 00 00 fd '220VA.      ....'
  00 3a 4c 1e 46 0f 00 0a 20 20 20 20 20 20 00 9a '.:L.F...      ..'
Checksum: 0x9a

----------------

Warnings:

Block 0, Base EDID:
  Vendor & Product Identification: The serial number is one of the known dummy values, it should probably be set to 0.
  Display Range Limits: GTF support is deprecated in EDID 1.4.

Failures:

Block 0, Base EDID:
  Display Product Serial Number: ...
  Display Range Limits: GTF is supported, but the display does not support continuous frequencies.
Block 1, Base EDID:
  Unknown Extension Block.
EDID:
  Base EDID: EDID specified 0 extension block(s), but found 1 extension block(s).

EDID conformity: FAIL
