edid-decode (hex):

00 ff ff ff ff ff ff 00 4c 83 52 49 00 00 00 00
00 18 01 04 95 22 13 78 0a b9 95 a2 55 4b 9c 26
0f 50 54 00 00 00 01 01 01 01 01 01 01 01 01 01
01 01 01 01 01 01 d2 37 80 a2 70 38 40 40 30 20
25 00 58 c2 10 00 00 19 00 00 00 0f 00 00 00 00
00 00 00 00 00 1e 82 10 52 00 00 00 00 fe 00 53
41 4d 53 55 4e 47 0a 20 4c 83 48 4c 00 00 00 fe
00 4c 54 4e 31 35 36 48 4c 30 32 4c 30 31 00 2e

00 ff ff ff ff ff ff 00 4c 83 52 49 00 00 00 00
00 18 01 04 95 22 13 78 0a b9 95 a2 55 4b 9c 26
0f 50 54 00 00 00 01 01 01 01 01 01 01 01 01 01
01 01 01 01 01 01 d2 37 80 a2 70 38 40 40 30 20
25 00 58 c2 10 00 00 19 00 00 00 0f 00 00 00 00
00 00 00 00 00 1e 82 10 52 00 00 00 00 fe 00 53
41 4d 53 55 4e 47 0a 20 4c 83 48 4c 00 00 00 fe
00 4c 54 4e 31 35 36 48 4c 30 32 4c 30 31 00 2e

----------------

Block 0, Base EDID:
  EDID Structure Version & Revision: 1.4
  Vendor & Product Identification:
    Manufacturer: SDC
    Model: 18770
    Made in: 2014
  Basic Display Parameters & Features:
    Digital display
    Bits per primary color channel: 6
    DisplayPort interface
    Maximum image size: 34 cm x 19 cm
    Gamma: 2.20
    Supported color formats: RGB 4:4:4, YCrCb 4:4:4
    First detailed timing includes the native pixel format and preferred refresh rate
  Color Characteristics:
    Red  : 0.6347, 0.3349
    Green: 0.2949, 0.6103
    Blue : 0.1503, 0.0595
    White: 0.3134, 0.3291
  Established Timings I & II: none
  Standard Timings: none
  Detailed Timing Descriptors:
    DTD 1:  1920x1080   59.996440 Hz  16:9     68.636 kHz    142.900000 MHz (344 mm x 194 mm)
                 Hfront   48 Hsync  32 Hback   82 Hpol N
                 Vfront    2 Vsync   5 Vback   57 Vpol N
    Manufacturer-Specified Display Descriptor (0x0f): 00 0f 00 00 00 00 00 00 00 00 00 1e 82 10 52 00 '..............R.'
    Alphanumeric Data String: 'SAMSUNG'
    Alphanumeric Data String: 'LTN156HL02L01'
Checksum: 0x2e

----------------

Warnings:

Block 0, Base EDID:
  Missing Display Product Name.

Failures:

Block 0, Base EDID:
  Alphanumeric Data String: Non-space after newline.
EDID:
  Extension Block 1 started with EDID header, ignoring Extension Blocks >= 1.

EDID conformity: FAIL
