edid-decode (hex):

00 ff ff ff ff ff ff 00 30 ae ff ff 01 00 00 00
1f 16 01 03 80 2b 19 78 ee ee d5 a5 55 48 9b 26
12 50 54 ad ea 00 81 80 8b c0 01 01 01 01 01 01
01 01 01 01 01 01 66 21 56 a8 51 00 1e 30 45 8f
3a 00 9a e6 10 00 00 1c 00 00 00 fd 00 30 4c 1e
41 10 00 0a 20 20 20 20 20 20 00 00 00 fc 00 4c
45 4e 2d 45 64 67 65 36 32 5a 0a 20 00 00 00 ff
00 54 43 4e 38 33 31 30 30 30 31 0a 20 20 00 d7

00 ff ff ff ff ff ff 00 30 ae ff ff 01 00 00 00
1f 16 01 03 80 2b 19 78 ee ee d5 a5 55 48 9b 26
12 50 54 ad ea 00 81 80 8b c0 01 01 01 01 01 01
01 01 01 01 01 01 66 21 56 a8 51 00 1e 30 45 8f
3a 00 9a e6 10 00 00 1c 00 00 00 fd 00 30 4c 1e
41 10 00 0a 20 20 20 20 20 20 00 00 00 fc 00 4c
45 4e 2d 45 64 67 65 36 32 5a 0a 20 00 00 00 ff
00 54 43 4e 38 33 31 30 30 30 31 0a 20 20 00 d7

----------------

Block 0, Base EDID:
  EDID Structure Version & Revision: 1.3
  Vendor & Product Identification:
    Manufacturer: LEN
    Model: 65535
    Serial Number: ...
    Made in: week 31 of 2012
  Basic Display Parameters & Features:
    Digital display
    Maximum image size: 43 cm x 25 cm
    Gamma: 2.20
    DPMS levels: Standby Suspend Off
    RGB color display
    Default (sRGB) color space is primary color space
    First detailed timing is the preferred timing
  Color Characteristics:
    Red  : 0.6474, 0.3339
    Green: 0.2841, 0.6074
    Blue : 0.1513, 0.0712
    White: 0.3134, 0.3291
  Established Timings I & II:
    IBM     :   720x400    70.081663 Hz   9:5     31.467 kHz     28.320000 MHz
    DMT 0x04:   640x480    59.940476 Hz   4:3     31.469 kHz     25.175000 MHz
    DMT 0x05:   640x480    72.808802 Hz   4:3     37.861 kHz     31.500000 MHz
    DMT 0x06:   640x480    75.000000 Hz   4:3     37.500 kHz     31.500000 MHz
    DMT 0x09:   800x600    60.316541 Hz   4:3     37.879 kHz     40.000000 MHz
    DMT 0x0a:   800x600    72.187572 Hz   4:3     48.077 kHz     50.000000 MHz
    DMT 0x0b:   800x600    75.000000 Hz   4:3     46.875 kHz     49.500000 MHz
    Apple   :   832x624    74.551266 Hz   4:3     49.726 kHz     57.284000 MHz
    DMT 0x10:  1024x768    60.003840 Hz   4:3     48.363 kHz     65.000000 MHz
    DMT 0x12:  1024x768    75.028582 Hz   4:3     60.023 kHz     78.750000 MHz
  Standard Timings:
    DMT 0x23:  1280x1024   60.019740 Hz   5:4     63.981 kHz    108.000000 MHz
    GTF     :  1360x765    60.000341 Hz  16:9     47.520 kHz     84.396000 MHz
  Detailed Timing Descriptors:
    DTD 1:  1366x768    59.856345 Hz 683:384   47.765 kHz     85.500000 MHz (410 mm x 230 mm)
                 Hfront   69 Hsync 143 Hback  212 Hpol N
                 Vfront    3 Vsync  10 Vback   17 Vpol P
    Display Range Limits:
      Monitor ranges (GTF): 48-76 Hz V, 30-65 kHz H, max dotclock 160 MHz
    Display Product Name: 'LEN-Edge62Z'
    Display Product Serial Number: ...
Checksum: 0xd7

----------------

Warnings:

Block 0, Base EDID:
  Vendor & Product Identification: The serial number is one of the known dummy values, it should probably be set to 0.
  Standard Timings: Standard Timing 1360x765 has a dubious odd vertical resolution.

Failures:

Block 0, Base EDID:
  Basic Display Parameters & Features: sRGB is signaled, but the chromaticities do not match.
  Detailed Timing Descriptor #1: Mismatch of image size 410x230 mm vs display size 430x250 mm.
EDID:
  Extension Block 1 started with EDID header, ignoring Extension Blocks >= 1.

EDID conformity: FAIL
