edid-decode (hex):

00 ff ff ff ff ff ff 00 30 64 25 08 01 01 01 01
2d 14 01 03 80 1d 12 78 0a a1 a5 94 54 4e 8a 26
26 50 54 00 00 00 81 00 01 01 01 01 01 01 01 01
01 01 01 01 01 01 bc 1b 00 a4 50 20 14 30 20 20
22 00 1f b4 10 00 00 18 00 00 00 fd 00 3b 3d 30
33 07 00 0a 20 20 20 20 20 20 00 00 00 fc 00 54
4d 44 49 53 50 4c 41 59 0a 20 20 20 00 00 00 ff
00 4c 54 31 33 33 44 45 56 4a 4b 30 30 0a 00 e0

00 ff ff ff ff ff ff 00 30 64 25 08 01 01 01 01
2d 14 01 03 80 1d 12 78 0a a1 a5 94 54 4e 8a 26
26 50 54 00 00 00 81 00 01 01 01 01 01 01 01 01
01 01 01 01 01 01 bc 1b 00 a4 50 20 14 30 20 20
22 00 1f b4 10 00 00 18 00 00 00 fd 00 3b 3d 30
33 07 00 0a 20 20 20 20 20 20 00 00 00 fc 00 54
4d 44 49 53 50 4c 41 59 0a 20 20 20 00 00 00 ff
00 4c 54 31 33 33 44 45 56 4a 4b 30 30 0a 00 e0

----------------

Block 0, Base EDID:
  EDID Structure Version & Revision: 1.3
  Vendor & Product Identification:
    Manufacturer: LCD
    Model: 2085
    Serial Number: ...
    Made in: week 45 of 2010
  Basic Display Parameters & Features:
    Digital display
    Maximum image size: 29 cm x 18 cm
    Gamma: 2.20
    RGB color display
    First detailed timing is the preferred timing
  Color Characteristics:
    Red  : 0.5800, 0.3300
    Green: 0.3046, 0.5400
    Blue : 0.1503, 0.1503
    White: 0.3134, 0.3291
  Established Timings I & II: none
  Standard Timings:
    DMT 0x1c:  1280x800    59.810326 Hz  16:10    49.702 kHz     83.500000 MHz
  Detailed Timing Descriptors:
    DTD 1:  1280x800    59.962165 Hz  16:10    49.169 kHz     71.000000 MHz (287 mm x 180 mm)
                 Hfront   32 Hsync  32 Hback  100 Hpol N
                 Vfront    2 Vsync   2 Vback   16 Vpol N
    Display Range Limits:
      Monitor ranges (GTF): 59-61 Hz V, 48-51 kHz H, max dotclock 70 MHz
    Display Product Name: 'TMDISPLAY'
    Display Product Serial Number: ...
Checksum: 0xe0

----------------

Warnings:

Block 0, Base EDID:
  Vendor & Product Identification: The serial number is one of the known dummy values, it should probably be set to 0.
EDID:
  Base EDID: Some timings are out of range of the Monitor Ranges:
    Maximum Clock: 83.500 MHz (Monitor: 70.000 MHz)

Failures:

EDID:
  Extension Block 1 started with EDID header, ignoring Extension Blocks >= 1.

EDID conformity: FAIL
