edid-decode (hex):

00 ff ff ff ff ff ff 00 4e 14 01 23 a0 07 00 00
0b 11 01 03 68 46 28 78 2e d0 05 a3 55 49 9a 27
13 50 54 bf ef 80 71 40 71 4a 71 4f 81 40 81 4a
81 4f 81 80 95 0f 66 21 50 b0 51 00 1b 30 40 70
36 00 c3 8d 21 00 00 08 6b 35 a0 f0 51 84 2a 30
60 98 36 00 c3 8d 21 00 00 1c f1 27 00 a0 51 00
25 30 50 80 37 00 c3 8d 21 00 00 1c 00 00 00 fc
00 58 32 33 57 47 2d 31 30 38 30 50 20 20 00 e9

00 ff ff ff ff ff ff 00 4e 14 01 23 a0 07 00 00
0b 11 01 03 68 46 28 78 2e d0 05 a3 55 49 9a 27
13 50 54 bf ef 80 71 40 71 4a 71 4f 81 40 81 4a
81 4f 81 80 95 0f 66 21 50 b0 51 00 1b 30 40 70
36 00 c3 8d 21 00 00 08 6b 35 a0 f0 51 84 2a 30
60 98 36 00 c3 8d 21 00 00 1c f1 27 00 a0 51 00
25 30 50 80 37 00 c3 8d 21 00 00 1c 00 00 00 fc
00 58 32 33 57 47 2d 31 30 38 30 50 20 20 00 e9

----------------

Block 0, Base EDID:
  EDID Structure Version & Revision: 1.3
  Vendor & Product Identification:
    Manufacturer: SPT
    Model: 8961
    Serial Number: ...
    Made in: week 11 of 2007
  Basic Display Parameters & Features:
    Analog display
    Signal Level Standard: 0.700 : 0.000 : 0.700 V p-p
    Blank level equals black level
    Sync: Separate
    Maximum image size: 70 cm x 40 cm
    Gamma: 2.20
    DPMS levels: Off
    RGB color display
    Default (sRGB) color space is primary color space
    First detailed timing is the preferred timing
  Color Characteristics:
    Red  : 0.6396, 0.3330
    Green: 0.2851, 0.6015
    Blue : 0.1523, 0.0742
    White: 0.3134, 0.3291
  Established Timings I & II:
    IBM     :   720x400    70.081663 Hz   9:5     31.467 kHz     28.320000 MHz
    DMT 0x04:   640x480    59.940476 Hz   4:3     31.469 kHz     25.175000 MHz
    Apple   :   640x480    66.666667 Hz   4:3     35.000 kHz     30.240000 MHz
    DMT 0x05:   640x480    72.808802 Hz   4:3     37.861 kHz     31.500000 MHz
    DMT 0x06:   640x480    75.000000 Hz   4:3     37.500 kHz     31.500000 MHz
    DMT 0x08:   800x600    56.250000 Hz   4:3     35.156 kHz     36.000000 MHz
    DMT 0x09:   800x600    60.316541 Hz   4:3     37.879 kHz     40.000000 MHz
    DMT 0x0a:   800x600    72.187572 Hz   4:3     48.077 kHz     50.000000 MHz
    DMT 0x0b:   800x600    75.000000 Hz   4:3     46.875 kHz     49.500000 MHz
    Apple   :   832x624    74.551266 Hz   4:3     49.726 kHz     57.284000 MHz
    DMT 0x10:  1024x768    60.003840 Hz   4:3     48.363 kHz     65.000000 MHz
    DMT 0x11:  1024x768    70.069359 Hz   4:3     56.476 kHz     75.000000 MHz
    DMT 0x12:  1024x768    75.028582 Hz   4:3     60.023 kHz     78.750000 MHz
    DMT 0x24:  1280x1024   75.024675 Hz   5:4     79.976 kHz    135.000000 MHz
    Apple   :  1152x870    75.061550 Hz 192:145   68.681 kHz    100.000000 MHz
  Standard Timings:
    GTF     :  1152x864    60.000000 Hz   4:3     53.700 kHz     81.624000 MHz
    GTF     :  1152x864    70.000000 Hz   4:3     63.000 kHz     96.768000 MHz
    DMT 0x15:  1152x864    75.000000 Hz   4:3     67.500 kHz    108.000000 MHz
    DMT 0x20:  1280x960    60.000000 Hz   4:3     60.000 kHz    108.000000 MHz
    GTF     :  1280x960    69.999977 Hz   4:3     69.930 kHz    120.839000 MHz
    GTF     :  1280x960    74.999884 Hz   4:3     75.150 kHz    129.859000 MHz
    DMT 0x23:  1280x1024   60.019740 Hz   5:4     63.981 kHz    108.000000 MHz
    DMT 0x30:  1440x900    74.984427 Hz  16:10    70.635 kHz    136.750000 MHz
  Detailed Timing Descriptors:
    DTD 1:  1360x768    60.015162 Hz  85:48    47.712 kHz     85.500000 MHz (bipolar analog composite, sync-on-green, 707 mm x 397 mm)
                 Hfront   64 Hsync 112 Hback  256 Hpol N
                 Vfront    3 Vsync   6 Vback   18 Vpol N
    DTD 2:  1440x900    74.984427 Hz  16:10    70.635 kHz    136.750000 MHz (707 mm x 397 mm)
                 Hfront   96 Hsync 152 Hback  248 Hpol N
                 Vfront    3 Vsync   6 Vback   33 Vpol P
    DTD 3:  1280x768    74.893062 Hz   5:3     60.289 kHz    102.250000 MHz (707 mm x 397 mm)
                 Hfront   80 Hsync 128 Hback  208 Hpol N
                 Vfront    3 Vsync   7 Vback   27 Vpol P
    Display Product Name: 'X23WG-1080P  '
Checksum: 0xe9

----------------

Warnings:

Block 0, Base EDID:
  Detailed Timing Descriptor #1: DTD is similar but not identical to DMT 0x27.
  Detailed Timing Descriptor #2: Image size is 707x397 mm, but based on the picture AR it should be 635x397 mm.
  Detailed Timing Descriptor #3: Image size is 707x397 mm, but based on the picture AR it should be 661x397 mm.

Failures:

Block 0, Base EDID:
  Basic Display Parameters & Features: sRGB is signaled, but the chromaticities do not match.
  Display Product Name: No newline, but one or more trailing spaces.
  Missing Display Range Limits Descriptor.
EDID:
  Extension Block 1 started with EDID header, ignoring Extension Blocks >= 1.

EDID conformity: FAIL
