edid-decode (hex):

00 ff ff ff ff ff ff 00 1e 6d 69 75 01 01 01 01
0c 0f 01 03 08 46 27 78 0a d9 b0 a3 57 49 9c 25
11 49 4b a1 08 00 31 40 01 01 01 01 45 40 01 01
61 40 01 01 01 01 1b 21 50 a0 51 00 1e 30 48 88
35 00 bc 88 21 00 00 1c 4e 1f 00 80 51 00 1e 30
40 80 37 00 bc 88 21 00 00 18 00 00 00 fd 00 38
3f 1f 32 09 00 0a 20 20 20 20 20 20 00 00 00 fc
00 33 32 4c 43 32 52 2d 5a 4a 0a 20 20 20 00 6f

----------------

Block 0, Base EDID:
  EDID Structure Version & Revision: 1.3
  Vendor & Product Identification:
    Manufacturer: GSM
    Model: 30057
    Serial Number: ...
    Made in: week 12 of 2005
  Basic Display Parameters & Features:
    Analog display
    Signal Level Standard: 0.700 : 0.300 : 1.000 V p-p
    Blank level equals black level
    Sync: Separate
    Maximum image size: 70 cm x 39 cm
    Gamma: 2.20
    RGB color display
    First detailed timing is the preferred timing
  Color Characteristics:
    Red  : 0.6396, 0.3408
    Green: 0.2871, 0.6103
    Blue : 0.1464, 0.0693
    White: 0.2851, 0.2929
  Established Timings I & II:
    IBM     :   720x400    70.081663 Hz   9:5     31.467 kHz     28.320000 MHz
    DMT 0x04:   640x480    59.940476 Hz   4:3     31.469 kHz     25.175000 MHz
    DMT 0x09:   800x600    60.316541 Hz   4:3     37.879 kHz     40.000000 MHz
    DMT 0x10:  1024x768    60.003840 Hz   4:3     48.363 kHz     65.000000 MHz
  Standard Timings:
    DMT 0x04:   640x480    59.940476 Hz   4:3     31.469 kHz     25.175000 MHz
    DMT 0x09:   800x600    60.316541 Hz   4:3     37.879 kHz     40.000000 MHz
    DMT 0x10:  1024x768    60.003840 Hz   4:3     48.363 kHz     65.000000 MHz
  Detailed Timing Descriptors:
    DTD 1:  1360x768    59.798991 Hz  85:48    47.720 kHz     84.750000 MHz (700 mm x 392 mm)
                 Hfront   72 Hsync 136 Hback  208 Hpol N
                 Vfront    3 Vsync   5 Vback   22 Vpol P
    DTD 2:  1280x768    60.352203 Hz   5:3     48.161 kHz     80.140000 MHz (700 mm x 392 mm)
                 Hfront   64 Hsync 128 Hback  192 Hpol N
                 Vfront    3 Vsync   7 Vback   20 Vpol N
    Display Range Limits:
      Monitor ranges (GTF): 56-63 Hz V, 31-50 kHz H, max dotclock 90 MHz
    Display Product Name: '32LC2R-ZJ'
Checksum: 0x6f

----------------

Warnings:

Block 0, Base EDID:
  Vendor & Product Identification: The serial number is one of the known dummy values, it should probably be set to 0.
  Detailed Timing Descriptor #2: Image size is 700x392 mm, but based on the picture AR it should be 653x392 mm.
EDID:
  Base EDID: Some timings are out of range of the Monitor Ranges:
    Vertical Freq: 59.799 - 70.082 Hz (Monitor: 56.000 - 63.000 Hz)

EDID conformity: PASS
