edid-decode (hex):

00 ff ff ff ff ff ff 00 31 8c 01 00 01 00 00 00
1b 14 01 03 68 00 00 ff ea bb b9 a3 52 46 98 24
0f 48 4c af ce 01 01 01 01 01 01 01 01 01 01 01
01 01 01 01 01 01 d0 20 00 98 51 20 1e 30 d0 80
47 04 68 22 11 00 00 1c 48 26 00 98 51 20 1e 30
d0 80 47 04 68 22 11 00 00 1c 36 29 00 98 51 20
1e 30 d0 80 47 04 68 22 11 00 00 1c 00 00 00 fc
00 4c 43 44 20 20 20 20 20 20 20 20 20 20 00 60

----------------

Block 0, Base EDID:
  EDID Structure Version & Revision: 1.3
  Vendor & Product Identification:
    Manufacturer: LLL
    Model: 1
    Serial Number: ...
    Made in: week 27 of 2010
  Basic Display Parameters & Features:
    Analog display
    Signal Level Standard: 0.700 : 0.000 : 0.700 V p-p
    Blank level equals black level
    Sync: Separate
    Image size is variable
    Gamma is defined in an extension block
    DPMS levels: Standby Suspend Off
    RGB color display
    First detailed timing is the preferred timing
  Color Characteristics:
    Red  : 0.6386, 0.3232
    Green: 0.2753, 0.5966
    Blue : 0.1425, 0.0615
    White: 0.2832, 0.2978
  Established Timings I & II:
    IBM     :   720x400    70.081663 Hz   9:5     31.467 kHz     28.320000 MHz
    DMT 0x04:   640x480    59.940476 Hz   4:3     31.469 kHz     25.175000 MHz
    DMT 0x05:   640x480    72.808802 Hz   4:3     37.861 kHz     31.500000 MHz
    DMT 0x06:   640x480    75.000000 Hz   4:3     37.500 kHz     31.500000 MHz
    DMT 0x08:   800x600    56.250000 Hz   4:3     35.156 kHz     36.000000 MHz
    DMT 0x09:   800x600    60.316541 Hz   4:3     37.879 kHz     40.000000 MHz
    DMT 0x0a:   800x600    72.187572 Hz   4:3     48.077 kHz     50.000000 MHz
    DMT 0x0b:   800x600    75.000000 Hz   4:3     46.875 kHz     49.500000 MHz
    DMT 0x10:  1024x768    60.003840 Hz   4:3     48.363 kHz     65.000000 MHz
    DMT 0x11:  1024x768    70.069359 Hz   4:3     56.476 kHz     75.000000 MHz
    DMT 0x12:  1024x768    75.028582 Hz   4:3     60.023 kHz     78.750000 MHz
  Standard Timings: none
  Detailed Timing Descriptors:
    DTD 1:  1280x800    59.955462 Hz  16:10    49.763 kHz     84.000000 MHz (360 mm x 290 mm)
                 Hfront  208 Hsync 128 Hback   72 Hpol N
                 Vfront   20 Vsync   7 Vback    3 Vpol P
    DTD 2:  1280x800    69.948039 Hz  16:10    58.057 kHz     98.000000 MHz (360 mm x 290 mm)
                 Hfront  208 Hsync 128 Hback   72 Hpol N
                 Vfront   20 Vsync   7 Vback    3 Vpol P
    DTD 3:  1280x800    75.301205 Hz  16:10    62.500 kHz    105.500000 MHz (360 mm x 290 mm)
                 Hfront  208 Hsync 128 Hback   72 Hpol N
                 Vfront   20 Vsync   7 Vback    3 Vpol P
    Display Product Name: 'LCD          '
Checksum: 0x60

----------------

Warnings:

Block 0, Base EDID:
  Vendor & Product Identification: The serial number is one of the known dummy values, it should probably be set to 0.
  Detailed Timing Descriptor #1: Image size is 360x290 mm, but based on the picture AR it should be 360x225 mm.
  Detailed Timing Descriptor #2: Image size is 360x290 mm, but based on the picture AR it should be 360x225 mm.
  Detailed Timing Descriptor #3: Image size is 360x290 mm, but based on the picture AR it should be 360x225 mm.

Failures:

Block 0, Base EDID:
  Display Product Name: No newline, but one or more trailing spaces.
  Missing Display Range Limits Descriptor.
EDID:
  Base EDID: The DTD max image size is 360x290mm, but the display size is not specified anywhere.

EDID conformity: FAIL
