edid-decode (hex):

00 ff ff ff ff ff ff 00 31 8c 01 00 01 00 00 00
1b 14 01 03 08 00 00 00 8e 00 00 00 00 00 00 00
00 00 00 ad ce 00 01 01 01 01 01 01 01 01 01 01
01 01 01 01 01 01 34 21 50 b0 51 00 1b 30 40 70
36 00 20 56 00 00 00 1e 99 21 56 aa 51 00 20 30
46 8f 33 00 20 56 00 00 00 18 f4 1c 00 78 51 d0
1a 20 60 a0 37 00 00 00 00 00 00 18 0e 1f 00 80
51 00 20 30 40 80 37 00 20 56 00 00 00 1a 00 90

00 ff ff ff ff ff ff 00 31 8c 01 00 01 00 00 00
1b 14 01 03 08 00 00 00 8e 00 00 00 00 00 00 00
00 00 00 ad ce 00 01 01 01 01 01 01 01 01 01 01
01 01 01 01 01 01 34 21 50 b0 51 00 1b 30 40 70
36 00 20 56 00 00 00 1e 99 21 56 aa 51 00 20 30
46 8f 33 00 20 56 00 00 00 18 f4 1c 00 78 51 d0
1a 20 60 a0 37 00 00 00 00 00 00 18 0e 1f 00 80
51 00 20 30 40 80 37 00 20 56 00 00 00 1a 00 90

----------------

Block 0, Base EDID:
  EDID Structure Version & Revision: 1.3
  Vendor & Product Identification:
    Manufacturer: LLL
    Model: 1
    Serial Number: ...
    Made in: week 27 of 2010
  Basic Display Parameters & Features:
    Analog display
    Signal Level Standard: 0.700 : 0.300 : 1.000 V p-p
    Blank level equals black level
    Sync: Separate
    Image size is variable
    Gamma: 1.00
    DPMS levels: Standby
    RGB color display
    Default (sRGB) color space is primary color space
    First detailed timing is the preferred timing
  Color Characteristics:
    Red  : 0.0000, 0.0000
    Green: 0.0000, 0.0000
    Blue : 0.0000, 0.0000
    White: 0.0000, 0.0000
  Established Timings I & II:
    IBM     :   720x400    70.081663 Hz   9:5     31.467 kHz     28.320000 MHz
    DMT 0x04:   640x480    59.940476 Hz   4:3     31.469 kHz     25.175000 MHz
    DMT 0x05:   640x480    72.808802 Hz   4:3     37.861 kHz     31.500000 MHz
    DMT 0x06:   640x480    75.000000 Hz   4:3     37.500 kHz     31.500000 MHz
    DMT 0x09:   800x600    60.316541 Hz   4:3     37.879 kHz     40.000000 MHz
    DMT 0x0a:   800x600    72.187572 Hz   4:3     48.077 kHz     50.000000 MHz
    DMT 0x0b:   800x600    75.000000 Hz   4:3     46.875 kHz     49.500000 MHz
    DMT 0x10:  1024x768    60.003840 Hz   4:3     48.363 kHz     65.000000 MHz
    DMT 0x11:  1024x768    70.069359 Hz   4:3     56.476 kHz     75.000000 MHz
    DMT 0x12:  1024x768    75.028582 Hz   4:3     60.023 kHz     78.750000 MHz
  Standard Timings: none
  Detailed Timing Descriptors:
    DTD 1:  1360x768    59.664196 Hz  85:48    47.433 kHz     85.000000 MHz (32 mm x 86 mm)
                 Hfront   64 Hsync 112 Hback  256 Hpol P
                 Vfront    3 Vsync   6 Vback   18 Vpol P
    DTD 2:  1366x768    59.995815 Hz 683:384   47.997 kHz     86.010000 MHz (32 mm x 86 mm)
                 Hfront   70 Hsync 143 Hback  213 Hpol N
                 Vfront    3 Vsync   3 Vback   26 Vpol N
    DTD 3:  1280x720    59.997928 Hz  16:9     44.758 kHz     74.120000 MHz
                 Hfront   96 Hsync 160 Hback  120 Hpol N
                 Vfront    3 Vsync   7 Vback   16 Vpol N
    DTD 4:  1280x768    59.720553 Hz   5:3     47.776 kHz     79.500000 MHz (32 mm x 86 mm)
                 Hfront   64 Hsync 128 Hback  192 Hpol P
                 Vfront    3 Vsync   7 Vback   22 Vpol N
Checksum: 0x90

----------------

Warnings:

Block 0, Base EDID:
  Vendor & Product Identification: The serial number is one of the known dummy values, it should probably be set to 0.
  Basic Display Parameters & Features: sRGB is signaled, but the gamma != 2.2.
  Detailed Timing Descriptor #1: Dubious image size (32x86 mm is smaller than 100x100 mm).
  Detailed Timing Descriptor #2: Dubious image size (32x86 mm is smaller than 100x100 mm).
  Detailed Timing Descriptor #4: Dubious image size (32x86 mm is smaller than 100x100 mm).

Failures:

Block 0, Base EDID:
  Basic Display Parameters & Features: sRGB is signaled, but the chromaticities do not match.
  Missing Display Product Name.
  Missing Display Range Limits Descriptor.
EDID:
  Extension Block 1 started with EDID header, ignoring Extension Blocks >= 1.
  Base EDID: The DTD max image size is 32x86mm, but the display size is not specified anywhere.

EDID conformity: FAIL
