edid-decode (hex):

00 ff ff ff ff ff ff 00 0e 77 4d 14 00 00 00 00
00 22 01 04 b5 1f 14 78 03 b8 5c ad 51 44 b0 26
0f 4f 54 00 00 00 01 01 01 01 01 01 01 01 01 01
01 01 01 01 01 01 18 99 00 a0 c0 80 65 70 30 20
36 00 38 c3 10 00 00 18 00 00 00 fd 00 1e 78 f0
f0 4e 01 0a 20 20 20 20 20 20 00 00 00 fe 00 43
53 4f 54 20 54 33 0a 20 20 20 20 20 00 00 00 fc
00 4d 4e 45 35 30 37 5a 41 32 2d 33 0a 20 01 b5

70 20 79 02 00 22 00 14 cf f5 0b 05 ff 0b 9f 00
2f 00 1f 00 7f 07 64 00 02 00 05 00 2b 00 0c 27
00 1e 77 00 00 27 00 1e 3b 00 00 81 00 15 74 1a
00 00 03 01 1e 78 00 00 00 00 00 00 78 00 00 00
00 8d 00 00 00 00 00 00 00 00 00 00 00 00 00 00
00 00 00 00 00 00 00 00 00 00 00 00 00 00 00 00
00 00 00 00 00 00 00 00 00 00 00 00 00 00 00 00
00 00 00 00 00 00 00 00 00 00 00 00 00 00 3d 90

00 ff ff ff ff ff ff 00 0e 77 4d 14 00 00 00 00
00 22 01 04 b5 1f 14 78 03 b8 5c ad 51 44 b0 26
0f 4f 54 00 00 00 01 01 01 01 01 01 01 01 01 01
01 01 01 01 01 01 18 99 00 a0 c0 80 65 70 30 20
36 00 38 c3 10 00 00 18 00 00 00 fd 00 1e 78 f0
f0 4e 01 0a 20 20 20 20 20 20 00 00 00 fe 00 43
53 4f 54 20 54 33 0a 20 20 20 20 20 00 00 00 fc
00 4d 4e 45 35 30 37 5a 41 32 2d 33 0a 20 01 b5

70 20 79 02 00 22 00 14 cf f5 0b 05 ff 0b 9f 00
2f 00 1f 00 7f 07 64 00 02 00 05 00 2b 00 0c 27
00 1e 77 00 00 27 00 1e 3b 00 00 81 00 15 74 1a
00 00 03 01 1e 78 00 00 00 00 00 00 78 00 00 00
00 8d 00 00 00 00 00 00 00 00 00 00 00 00 00 00
00 00 00 00 00 00 00 00 00 00 00 00 00 00 00 00
00 00 00 00 00 00 00 00 00 00 00 00 00 00 00 00
00 00 00 00 00 00 00 00 00 00 00 00 00 00 3d 90

----------------

Block 0, Base EDID:
  EDID Structure Version & Revision: 1.4
  Vendor & Product Identification:
    Manufacturer: CSW
    Model: 5197
    Made in: 2024
  Basic Display Parameters & Features:
    Digital display
    Bits per primary color channel: 10
    DisplayPort interface
    Maximum image size: 31 cm x 20 cm
    Gamma: 2.20
    Supported color formats: RGB 4:4:4
    First detailed timing includes the native pixel format and preferred refresh rate
    Display supports continuous frequencies
  Color Characteristics:
    Red  : 0.6777, 0.3193
    Green: 0.2675, 0.6875
    Blue : 0.1494, 0.0595
    White: 0.3115, 0.3281
  Established Timings I & II: none
  Standard Timings: none
  Detailed Timing Descriptors:
    DTD 1:  3072x1920   60.001176 Hz  16:10   121.262 kHz    391.920000 MHz (312 mm x 195 mm)
                 Hfront   48 Hsync  32 Hback   80 Hpol N
                 Vfront    3 Vsync   6 Vback   92 Vpol N
    Display Range Limits:
      Monitor ranges (Range Limits Only): 30-120 Hz V, 240-240 kHz H, max dotclock 780 MHz
    Alphanumeric Data String: 'CSOT T3'
    Display Product Name: 'MNE507ZA2-3'
  Extension blocks: 1
Checksum: 0xb5

----------------

Block 1, DisplayID Extension Block:
  Version: 2.0
  Extension Count: 0
  Display Product Primary Use Case: None of the listed primary use cases; generic display
  Video Timing Modes Type 7 - Detailed Timings Data Block:
    DTD:  3072x1920  119.999902 Hz  16:10   242.520 kHz    783.824000 MHz (aspect 16:10, no 3D stereo)
               Hfront   48 Hsync  32 Hback   80 Hpol N
               Vfront    3 Vsync   6 Vback   92 Vpol N
  Adaptive Sync Data Block:
    Descriptor #1:
      Native Panel Range
      Fixed Average V-Total and Adaptive V-Total
      Supports Seamless Transition
      'Max Single Frame Duration Increase' field value without jitter impact
      'Max Single Frame Duration Decrease' field value without jitter impact
      Max Duration Increase: 0.00 ms
      Max Duration Decrease: 0.00 ms
      Min Refresh Rate: 30 Hz
      Max Refresh Rate: 120 Hz
    Descriptor #2:
      Native Panel Range
      Fixed Average V-Total and Adaptive V-Total
      Supports Seamless Transition
      'Max Single Frame Duration Increase' field value without jitter impact
      'Max Single Frame Duration Decrease' field value without jitter impact
      Max Duration Increase: 0.00 ms
      Max Duration Decrease: 0.00 ms
      Min Refresh Rate: 30 Hz
      Max Refresh Rate: 60 Hz
  CTA-861 DisplayID Data Block:
  Vendor-Specific Data Block (AMD), OUI 00-00-1A:
    Version: 3
    Flags 1: 0x01
      FreeSync Supported
    Minimum Refresh Rate: 30 Hz
    Maximum Refresh Rate: 120 Hz
    Flags 5: 0x00
    Additional Sink Information Address: 0x410
  Checksum: 0x3d
Checksum: 0x90

----------------

Warnings:

EDID:
  Base EDID: Some timings are out of range of the Monitor Ranges:
    Horizontal Freq: 121.262 - 242.519 kHz (Monitor: 240.000 - 240.000 kHz)
    Maximum Clock: 783.824 MHz (Monitor: 780.000 MHz)

Failures:

EDID:
  Extension Block 2 started with EDID header, ignoring Extension Blocks >= 2.
  DisplayID: Missing DisplayID Display Parameters Data Block.
  DisplayID: DisplayID expects at least one preferred timing.

EDID conformity: FAIL
