edid-decode (hex):

00 ff ff ff ff ff ff 00 61 78 51 21 00 00 00 00
05 1d 01 03 81 30 1a 78 3a 8e 05 ad 4f 33 b0 26
0d 50 54 a5 4b 00 71 4f 81 c0 81 80 95 00 b3 00
d1 c0 01 01 01 01 02 3a 80 18 71 38 2d 40 58 2c
45 00 e0 04 11 00 00 1e 00 00 00 ff 00 30 30 0a
20 20 20 20 20 20 20 20 20 20 00 00 00 fd 00 17
4c 0f 63 19 00 0a 20 20 20 20 20 20 00 00 00 fc
00 4c 45 44 2d 32 31 35 31 0a 20 20 20 20 01 8a

02 03 18 74 4b 90 9f 85 94 04 13 03 12 01 02 11
23 09 07 07 83 01 00 00 02 3a 80 d0 72 38 2d 40
10 2c 96 80 56 50 21 00 00 18 02 3a 80 18 71 38
2d 40 58 2c 96 00 56 50 21 00 00 18 28 3c 80 a0
70 b0 23 40 30 20 36 00 56 50 21 00 00 1a 01 1d
00 bc 52 d0 1e 20 b8 28 55 40 56 50 21 00 00 1e
8c 0a d0 90 20 40 31 20 0c 40 55 00 56 50 21 00
00 18 00 00 00 00 00 00 00 00 00 00 00 00 00 fe

00 ff ff ff ff ff ff 00 61 78 51 21 00 00 00 00
05 1d 01 03 81 30 1a 78 3a 8e 05 ad 4f 33 b0 26
0d 50 54 a5 4b 00 71 4f 81 c0 81 80 95 00 b3 00
d1 c0 01 01 01 01 02 3a 80 18 71 38 2d 40 58 2c
45 00 e0 04 11 00 00 1e 00 00 00 ff 00 30 30 0a
20 20 20 20 20 20 20 20 20 20 00 00 00 fd 00 17
4c 0f 63 19 00 0a 20 20 20 20 20 20 00 00 00 fc
00 4c 45 44 2d 32 31 35 31 0a 20 20 20 20 01 8a

02 03 18 74 4b 90 9f 85 94 04 13 03 12 01 02 11
23 09 07 07 83 01 00 00 02 3a 80 d0 72 38 2d 40
10 2c 96 80 56 50 21 00 00 18 02 3a 80 18 71 38
2d 40 58 2c 96 00 56 50 21 00 00 18 28 3c 80 a0
70 b0 23 40 30 20 36 00 56 50 21 00 00 1a 01 1d
00 bc 52 d0 1e 20 b8 28 55 40 56 50 21 00 00 1e
8c 0a d0 90 20 40 31 20 0c 40 55 00 56 50 21 00
00 18 00 00 00 00 00 00 00 00 00 00 00 00 00 fe

----------------

Block 0, Base EDID:
  EDID Structure Version & Revision: 1.3
  Vendor & Product Identification:
    Manufacturer: XKX
    Model: 8529
    Made in: week 5 of 2019
  Basic Display Parameters & Features:
    Digital display
    DFP 1.x compatible TMDS
    Maximum image size: 48 cm x 26 cm
    Gamma: 2.20
    DPMS levels: Off
    Undefined display color type
    First detailed timing is the preferred timing
  Color Characteristics:
    Red  : 0.6777, 0.3085
    Green: 0.2021, 0.6894
    Blue : 0.1484, 0.0507
    White: 0.3134, 0.3291
  Established Timings I & II:
    IBM     :   720x400    70.081663 Hz   9:5     31.467 kHz     28.320000 MHz
    DMT 0x04:   640x480    59.940476 Hz   4:3     31.469 kHz     25.175000 MHz
    DMT 0x06:   640x480    75.000000 Hz   4:3     37.500 kHz     31.500000 MHz
    DMT 0x09:   800x600    60.316541 Hz   4:3     37.879 kHz     40.000000 MHz
    DMT 0x0b:   800x600    75.000000 Hz   4:3     46.875 kHz     49.500000 MHz
    DMT 0x10:  1024x768    60.003840 Hz   4:3     48.363 kHz     65.000000 MHz
    DMT 0x12:  1024x768    75.028582 Hz   4:3     60.023 kHz     78.750000 MHz
    DMT 0x24:  1280x1024   75.024675 Hz   5:4     79.976 kHz    135.000000 MHz
  Standard Timings:
    DMT 0x15:  1152x864    75.000000 Hz   4:3     67.500 kHz    108.000000 MHz
    DMT 0x55:  1280x720    60.000000 Hz  16:9     45.000 kHz     74.250000 MHz
    DMT 0x23:  1280x1024   60.019740 Hz   5:4     63.981 kHz    108.000000 MHz
    DMT 0x2f:  1440x900    59.887445 Hz  16:10    55.935 kHz    106.500000 MHz
    DMT 0x3a:  1680x1050   59.954250 Hz  16:10    65.290 kHz    146.250000 MHz
    DMT 0x52:  1920x1080   60.000000 Hz  16:9     67.500 kHz    148.500000 MHz
  Detailed Timing Descriptors:
    DTD  1:  1920x1080   60.000000 Hz  16:9     67.500 kHz    148.500000 MHz (480 mm x 260 mm)
                  Hfront   88 Hsync  44 Hback  148 Hpol P
                  Vfront    4 Vsync   5 Vback   36 Vpol P
    Display Product Serial Number: ...
    Display Range Limits:
      Monitor ranges (GTF): 23-76 Hz V, 15-99 kHz H, max dotclock 250 MHz
    Display Product Name: 'LED-2151'
  Extension blocks: 1
Checksum: 0x8a

----------------

Block 1, CTA-861 Extension Block:
  Revision: 3
  Basic audio support
  Supports YCbCr 4:4:4
  Supports YCbCr 4:2:2
  Native detailed modes: 4
  Video Data Block:
    VIC  16:  1920x1080   60.000000 Hz  16:9     67.500 kHz    148.500000 MHz (native)
    VIC  31:  1920x1080   50.000000 Hz  16:9     56.250 kHz    148.500000 MHz (native)
    VIC   5:  1920x1080i  60.000000 Hz  16:9     33.750 kHz     74.250000 MHz (native)
    VIC  20:  1920x1080i  50.000000 Hz  16:9     28.125 kHz     74.250000 MHz (native)
    VIC   4:  1280x720    60.000000 Hz  16:9     45.000 kHz     74.250000 MHz
    VIC  19:  1280x720    50.000000 Hz  16:9     37.500 kHz     74.250000 MHz
    VIC   3:   720x480    59.940060 Hz  16:9     31.469 kHz     27.000000 MHz
    VIC  18:   720x576    50.000000 Hz  16:9     31.250 kHz     27.000000 MHz
    VIC   1:   640x480    59.940476 Hz   4:3     31.469 kHz     25.175000 MHz
    VIC   2:   720x480    59.940060 Hz   4:3     31.469 kHz     27.000000 MHz
    VIC  17:   720x576    50.000000 Hz   4:3     31.250 kHz     27.000000 MHz
  Audio Data Block:
    Linear PCM:
      Max channels: 2
      Supported sample rates (kHz): 48 44.1 32
      Supported sample sizes (bits): 24 20 16
  Speaker Allocation Data Block:
    FL/FR - Front Left/Right
  Detailed Timing Descriptors:
    DTD  2:  1920x1080   50.000000 Hz  16:9     56.250 kHz    148.500000 MHz (598 mm x 336 mm)
                  Hfront  528 Hsync  44 Hback  148 Hpol N
                  Vfront    9 Vsync   6 Vback   30 Vpol N
    DTD  3:  1920x1080   60.000000 Hz  16:9     67.500 kHz    148.500000 MHz (598 mm x 336 mm)
                  Hfront   88 Hsync  44 Hback  148 Hpol N
                  Vfront    9 Vsync   6 Vback   30 Vpol N
    DTD  4:  1920x1200   59.950171 Hz  16:10    74.038 kHz    154.000000 MHz (598 mm x 336 mm)
                  Hfront   48 Hsync  32 Hback   80 Hpol P
                  Vfront    3 Vsync   6 Vback   26 Vpol N
    DTD  5:  1280x720    50.000000 Hz  16:9     37.500 kHz     74.250000 MHz (598 mm x 336 mm)
                  Hfront  440 Hsync  40 Hback  220 Hpol P
                  Vfront    5 Vsync   5 Vback   20 Vpol P
    DTD  6:   720x576    50.000000 Hz   5:4     31.250 kHz     27.000000 MHz (598 mm x 336 mm)
                  Hfront   12 Hsync  64 Hback   68 Hpol N
                  Vfront    5 Vsync   5 Vback   39 Vpol N
Checksum: 0xfe  Unused space in Extension Block: 13 bytes

----------------

Block 2, Unknown EDID Extension Block 0x00:
  00 ff ff ff ff ff ff 00 61 78 51 21 00 00 00 00 '........axQ!....'
  05 1d 01 03 81 30 1a 78 3a 8e 05 ad 4f 33 b0 26 '.....0.x:...O3.&'
  0d 50 54 a5 4b 00 71 4f 81 c0 81 80 95 00 b3 00 '.PT.K.qO........'
  d1 c0 01 01 01 01 02 3a 80 18 71 38 2d 40 58 2c '.......:..q8-@X,'
  45 00 e0 04 11 00 00 1e 00 00 00 ff 00 30 30 0a 'E............00.'
  20 20 20 20 20 20 20 20 20 20 00 00 00 fd 00 17 '          ......'
  4c 0f 63 19 00 0a 20 20 20 20 20 20 00 00 00 fc 'L.c...      ....'
  00 4c 45 44 2d 32 31 35 31 0a 20 20 20 20 01 8a '.LED-2151.    ..'
Checksum: 0x8a

----------------

Block 3, CTA-861 Extension Block:
  Revision: 3
  Basic audio support
  Supports YCbCr 4:4:4
  Supports YCbCr 4:2:2
  Native detailed modes: 4
  Video Data Block:
    VIC  16:  1920x1080   60.000000 Hz  16:9     67.500 kHz    148.500000 MHz (native)
    VIC  31:  1920x1080   50.000000 Hz  16:9     56.250 kHz    148.500000 MHz (native)
    VIC   5:  1920x1080i  60.000000 Hz  16:9     33.750 kHz     74.250000 MHz (native)
    VIC  20:  1920x1080i  50.000000 Hz  16:9     28.125 kHz     74.250000 MHz (native)
    VIC   4:  1280x720    60.000000 Hz  16:9     45.000 kHz     74.250000 MHz
    VIC  19:  1280x720    50.000000 Hz  16:9     37.500 kHz     74.250000 MHz
    VIC   3:   720x480    59.940060 Hz  16:9     31.469 kHz     27.000000 MHz
    VIC  18:   720x576    50.000000 Hz  16:9     31.250 kHz     27.000000 MHz
    VIC   1:   640x480    59.940476 Hz   4:3     31.469 kHz     25.175000 MHz
    VIC   2:   720x480    59.940060 Hz   4:3     31.469 kHz     27.000000 MHz
    VIC  17:   720x576    50.000000 Hz   4:3     31.250 kHz     27.000000 MHz
  Audio Data Block:
    Linear PCM:
      Max channels: 2
      Supported sample rates (kHz): 48 44.1 32
      Supported sample sizes (bits): 24 20 16
  Speaker Allocation Data Block:
    FL/FR - Front Left/Right
  Detailed Timing Descriptors:
    DTD  7:  1920x1080   50.000000 Hz  16:9     56.250 kHz    148.500000 MHz (598 mm x 336 mm)
                  Hfront  528 Hsync  44 Hback  148 Hpol N
                  Vfront    9 Vsync   6 Vback   30 Vpol N
    DTD  8:  1920x1080   60.000000 Hz  16:9     67.500 kHz    148.500000 MHz (598 mm x 336 mm)
                  Hfront   88 Hsync  44 Hback  148 Hpol N
                  Vfront    9 Vsync   6 Vback   30 Vpol N
    DTD  9:  1920x1200   59.950171 Hz  16:10    74.038 kHz    154.000000 MHz (598 mm x 336 mm)
                  Hfront   48 Hsync  32 Hback   80 Hpol P
                  Vfront    3 Vsync   6 Vback   26 Vpol N
    DTD 10:  1280x720    50.000000 Hz  16:9     37.500 kHz     74.250000 MHz (598 mm x 336 mm)
                  Hfront  440 Hsync  40 Hback  220 Hpol P
                  Vfront    5 Vsync   5 Vback   20 Vpol P
    DTD 11:   720x576    50.000000 Hz   5:4     31.250 kHz     27.000000 MHz (598 mm x 336 mm)
                  Hfront   12 Hsync  64 Hback   68 Hpol N
                  Vfront    5 Vsync   5 Vback   39 Vpol N
Checksum: 0xfe  Unused space in Extension Block: 13 bytes

----------------

Warnings:

Block 0, Base EDID:
  Display Product Serial Number: ...
Block 1, CTA-861 Extension Block:
  IT Video Formats are overscanned by default, but normally this should be underscanned.
  Detailed Timing Descriptor #2: DTD is similar but not identical to VIC 31.
  Detailed Timing Descriptor #3: DTD is similar but not identical to VIC 16.
  Detailed Timing Descriptor #4: Image size is 598x336 mm, but based on the picture AR it should be 598x373 mm.
  Detailed Timing Descriptor #6: Image size is 598x336 mm, but based on the picture AR it should be 598x478 mm.
  Add a Colorimetry Data Block with the sRGB colorimetry bit set to avoid interop issues.
Block 3, CTA-861 Extension Block:
  IT Video Formats are overscanned by default, but normally this should be underscanned.
  Detailed Timing Descriptor #7: DTD is similar but not identical to VIC 31.
  Detailed Timing Descriptor #8: DTD is similar but not identical to VIC 16.
  Detailed Timing Descriptor #9: Image size is 598x336 mm, but based on the picture AR it should be 598x373 mm.
  Detailed Timing Descriptor #11: Image size is 598x336 mm, but based on the picture AR it should be 598x478 mm.
EDID:
  CTA-861: Multiple native interlaced timings are defined.

Failures:

Block 1, CTA-861 Extension Block:
  Detailed Timing Descriptor #2: Mismatch of image size 598x336 mm vs display size 480x260 mm.
  Detailed Timing Descriptor #3: Mismatch of image size 598x336 mm vs display size 480x260 mm.
  Detailed Timing Descriptor #4: Mismatch of image size 598x336 mm vs display size 480x260 mm.
  Detailed Timing Descriptor #5: Mismatch of image size 598x336 mm vs display size 480x260 mm.
  Detailed Timing Descriptor #6: Mismatch of image size 598x336 mm vs display size 480x260 mm.
  Missing VCDB, needed for Set Selectable RGB Quantization to avoid interop issues.
Block 2, Base EDID:
  Unknown Extension Block.
Block 3, CTA-861 Extension Block:
  Video Data Block: Duplicate VIC 16.
  Video Data Block: Duplicate VIC 31.
  Video Data Block: Duplicate VIC 5.
  Video Data Block: Duplicate VIC 20.
  Video Data Block: Duplicate VIC 4.
  Video Data Block: Duplicate VIC 19.
  Video Data Block: Duplicate VIC 3.
  Video Data Block: Duplicate VIC 18.
  Video Data Block: Duplicate VIC 1.
  Video Data Block: Duplicate VIC 2.
  Video Data Block: Duplicate VIC 17.
  Speaker Allocation Data Block: Only one instance of this Data Block is allowed.
  Detailed Timing Descriptor #7: Mismatch of image size 598x336 mm vs display size 480x260 mm.
  Detailed Timing Descriptor #8: Mismatch of image size 598x336 mm vs display size 480x260 mm.
  Detailed Timing Descriptor #9: Mismatch of image size 598x336 mm vs display size 480x260 mm.
  Detailed Timing Descriptor #10: Mismatch of image size 598x336 mm vs display size 480x260 mm.
  Detailed Timing Descriptor #11: Mismatch of image size 598x336 mm vs display size 480x260 mm.
EDID:
  Base EDID: The DTD max image size is 598x336mm, which is larger than the display size 480.0x260.0mm.
  Base EDID: EDID specified 1 extension block(s), but found 3 extension block(s).
  Base EDID: EDID 1.3 requires a Block Map Extension in Block 1 if there are more than 2 blocks in the EDID.
  CTA-861: Native progressive timings are a mix of several resolutions.

EDID conformity: FAIL
