edid-decode (hex):

00 ff ff ff ff ff ff 00 0e 14 73 17 00 00 00 00
18 10 01 03 80 1e 13 78 0a ad 0f 96 53 50 8a 27
20 50 54 00 00 00 01 01 01 01 01 01 01 01 01 01
01 01 01 01 01 01 c7 1b 00 a0 50 20 17 30 30 20
36 00 30 be 10 00 00 18 00 00 00 0f 00 20 20 20
20 20 20 20 20 20 20 20 20 20 00 00 00 fe 00 43
50 54 20 20 20 20 20 20 20 20 20 20 00 00 00 fe
00 43 4c 41 41 31 34 31 57 42 30 32 20 20 00 f8

00 ff ff ff ff ff ff 00 0e 14 73 17 00 00 00 00
18 10 01 03 80 1e 13 78 0a ad 0f 96 53 50 8a 27
20 50 54 00 00 00 01 01 01 01 01 01 01 01 01 01
01 01 01 01 01 01 c7 1b 00 a0 50 20 17 30 30 20
36 00 30 be 10 00 00 18 00 00 00 0f 00 20 20 20
20 20 20 20 20 20 20 20 20 20 00 00 00 fe 00 43
50 54 20 20 20 20 20 20 20 20 20 20 00 00 00 fe
00 43 4c 41 41 31 34 31 57 42 30 32 20 20 00 f8

----------------

Block 0, Base EDID:
  EDID Structure Version & Revision: 1.3
  Vendor & Product Identification:
    Manufacturer: CPT
    Model: 6003
    Made in: week 24 of 2006
  Basic Display Parameters & Features:
    Digital display
    Maximum image size: 30 cm x 19 cm
    Gamma: 2.20
    RGB color display
    First detailed timing is the preferred timing
  Color Characteristics:
    Red  : 0.5878, 0.3261
    Green: 0.3154, 0.5400
    Blue : 0.1523, 0.1250
    White: 0.3154, 0.3310
  Established Timings I & II: none
  Standard Timings: none
  Detailed Timing Descriptors:
    DTD 1:  1280x800    60.002363 Hz  16:10    49.382 kHz     71.110000 MHz (304 mm x 190 mm)
                 Hfront   48 Hsync  32 Hback   80 Hpol N
                 Vfront    3 Vsync   6 Vback   14 Vpol N
    Manufacturer-Specified Display Descriptor (0x0f): 00 0f 00 20 20 20 20 20 20 20 20 20 20 20 20 20 '...             '
    Alphanumeric Data String: 'CPT          '
    Alphanumeric Data String: 'CLAA141WB02  '
Checksum: 0xf8

----------------

Block 1, Unknown EDID Extension Block 0x00:
  00 ff ff ff ff ff ff 00 0e 14 73 17 00 00 00 00 '..........s.....'
  18 10 01 03 80 1e 13 78 0a ad 0f 96 53 50 8a 27 '.......x....SP.''
  20 50 54 00 00 00 01 01 01 01 01 01 01 01 01 01 ' PT.............'
  01 01 01 01 01 01 c7 1b 00 a0 50 20 17 30 30 20 '..........P .00 '
  36 00 30 be 10 00 00 18 00 00 00 0f 00 20 20 20 '6.0..........   '
  20 20 20 20 20 20 20 20 20 20 00 00 00 fe 00 43 '          .....C'
  50 54 20 20 20 20 20 20 20 20 20 20 00 00 00 fe 'PT          ....'
  00 43 4c 41 41 31 34 31 57 42 30 32 20 20 00 f8 '.CLAA141WB02  ..'
Checksum: 0xf8

----------------

Failures:

Block 0, Base EDID:
  Alphanumeric Data String: No newline, but one or more trailing spaces.
  Alphanumeric Data String: No newline, but one or more trailing spaces.
  Missing Display Product Name.
  Missing Display Range Limits Descriptor.
Block 1, Base EDID:
  Unknown Extension Block.
EDID:
  Base EDID: EDID specified 0 extension block(s), but found 1 extension block(s).

EDID conformity: FAIL
