edid-decode (hex):

00 ff ff ff ff ff ff 00 09 e5 db 07 00 00 00 00
2b 1f 01 04 80 1f 11 78 02 7d 50 a6 57 52 9f 27
12 50 54 00 00 00 01 01 01 01 01 01 01 01 01 01
01 01 01 01 01 01 3a 38 80 de 70 38 28 40 30 20
36 00 35 ae 10 00 00 1a fb 2c 80 de 70 38 28 40
30 20 36 00 35 ae 10 00 00 1a 00 00 00 fe 00 42
4f 45 20 43 51 0a 20 20 20 20 20 20 00 00 00 fe
00 4e 56 31 34 30 46 48 4d 2d 4e 36 31 0a 00 2a

00 ff ff ff ff ff ff 00 09 e5 db 07 00 00 00 00
2b 1f 01 04 80 1f 11 78 02 7d 50 a6 57 52 9f 27
12 50 54 00 00 00 01 01 01 01 01 01 01 01 01 01
01 01 01 01 01 01 3a 38 80 de 70 38 28 40 30 20
36 00 35 ae 10 00 00 1a fb 2c 80 de 70 38 28 40
30 20 36 00 35 ae 10 00 00 1a 00 00 00 fe 00 42
4f 45 20 43 51 0a 20 20 20 20 20 20 00 00 00 fe
00 4e 56 31 34 30 46 48 4d 2d 4e 36 31 0a 00 2a

----------------

Block 0, Base EDID:
  EDID Structure Version & Revision: 1.4
  Vendor & Product Identification:
    Manufacturer: BOE
    Model: 2011
    Made in: week 43 of 2021
  Basic Display Parameters & Features:
    Digital display
    Color depth is undefined
    Digital interface is not defined
    Maximum image size: 31 cm x 17 cm
    Gamma: 2.20
    Supported color formats: RGB 4:4:4
    First detailed timing includes the native pixel format and preferred refresh rate
  Color Characteristics:
    Red  : 0.6494, 0.3427
    Green: 0.3232, 0.6220
    Blue : 0.1533, 0.0712
    White: 0.3125, 0.3281
  Established Timings I & II: none
  Standard Timings: none
  Detailed Timing Descriptors:
    DTD 1:  1920x1080   59.999000 Hz  16:9     67.199 kHz    143.940000 MHz (309 mm x 174 mm)
                 Hfront   48 Hsync  32 Hback  142 Hpol P
                 Vfront    3 Vsync   6 Vback   31 Vpol N
    DTD 2:  1920x1080   47.998366 Hz  16:9     53.758 kHz    115.150000 MHz (309 mm x 174 mm)
                 Hfront   48 Hsync  32 Hback  142 Hpol P
                 Vfront    3 Vsync   6 Vback   31 Vpol N
    Alphanumeric Data String: 'BOE CQ'
    Alphanumeric Data String: 'NV140FHM-N61'
Checksum: 0x2a

----------------

Warnings:

Block 0, Base EDID:
  Missing Display Product Name.

Failures:

EDID:
  Extension Block 1 started with EDID header, ignoring Extension Blocks >= 1.

EDID conformity: FAIL
