edid-decode (hex):

00 ff ff ff ff ff ff 00 09 e5 96 0b 00 00 00 00
22 20 01 04 95 1d 11 78 02 c4 75 97 5e 59 95 29
20 50 54 00 00 00 01 01 01 01 01 01 01 01 01 01
01 01 01 01 01 01 35 3d 80 25 71 38 64 40 30 20
36 00 26 a5 10 00 00 1a f7 30 80 25 71 38 64 40
30 20 36 00 26 a5 10 00 00 1a 00 00 00 fe 00 38
50 4d 52 37 80 4e 56 31 33 4e 34 41 00 00 00 00
00 00 41 21 99 00 10 00 00 0a 01 0a 20 20 00 60

00 ff ff ff ff ff ff 00 09 e5 96 0b 00 00 00 00
22 20 01 04 95 1d 11 78 02 c4 75 97 5e 59 95 29
20 50 54 00 00 00 01 01 01 01 01 01 01 01 01 01
01 01 01 01 01 01 35 3d 80 25 71 38 64 40 30 20
36 00 26 a5 10 00 00 1a f7 30 80 25 71 38 64 40
30 20 36 00 26 a5 10 00 00 1a 00 00 00 fe 00 38
50 4d 52 37 80 4e 56 31 33 4e 34 41 00 00 00 00
00 00 41 21 99 00 10 00 00 0a 01 0a 20 20 00 60

----------------

Block 0, Base EDID:
  EDID Structure Version & Revision: 1.4
  Vendor & Product Identification:
    Manufacturer: BOE
    Model: 2966
    Made in: week 34 of 2022
  Basic Display Parameters & Features:
    Digital display
    Bits per primary color channel: 6
    DisplayPort interface
    Maximum image size: 29 cm x 17 cm
    Gamma: 2.20
    Supported color formats: RGB 4:4:4
    First detailed timing includes the native pixel format and preferred refresh rate
  Color Characteristics:
    Red  : 0.5927, 0.3671
    Green: 0.3486, 0.5820
    Blue : 0.1611, 0.1279
    White: 0.3134, 0.3291
  Established Timings I & II: none
  Standard Timings: none
  Detailed Timing Descriptors:
    DTD 1:  1920x1080   60.003676 Hz  16:9     70.804 kHz    156.690000 MHz (294 mm x 165 mm)
                 Hfront   48 Hsync  32 Hback  213 Hpol P
                 Vfront    3 Vsync   6 Vback   91 Vpol N
    DTD 2:  1920x1080   48.002175 Hz  16:9     56.643 kHz    125.350000 MHz (294 mm x 165 mm)
                 Hfront   48 Hsync  32 Hback  213 Hpol P
                 Vfront    3 Vsync   6 Vback   91 Vpol N
    Alphanumeric Data String: '8PMR7.NV13N4A'
    Manufacturer-Specified Display Descriptor (0x00): 00 00 00 00 41 21 99 00 10 00 00 0a 01 0a 20 20 '....A!........  '
Checksum: 0x60

----------------

Block 1, Unknown EDID Extension Block 0x00:
  00 ff ff ff ff ff ff 00 09 e5 96 0b 00 00 00 00 '................'
  22 20 01 04 95 1d 11 78 02 c4 75 97 5e 59 95 29 '" .....x..u.^Y.)'
  20 50 54 00 00 00 01 01 01 01 01 01 01 01 01 01 ' PT.............'
  01 01 01 01 01 01 35 3d 80 25 71 38 64 40 30 20 '......5=.%q8d@0 '
  36 00 26 a5 10 00 00 1a f7 30 80 25 71 38 64 40 '6.&......0.%q8d@'
  30 20 36 00 26 a5 10 00 00 1a 00 00 00 fe 00 38 '0 6.&..........8'
  50 4d 52 37 80 4e 56 31 33 4e 34 41 00 00 00 00 'PMR7.NV13N4A....'
  00 00 41 21 99 00 10 00 00 0a 01 0a 20 20 00 60 '..A!........  .`'
Checksum: 0x60

----------------

Warnings:

Block 0, Base EDID:
  Alphanumeric Data String: Non-ASCII character 0x80 at position 5, can cause problems.
  Missing Display Product Name.

Failures:

Block 1, Base EDID:
  Unknown Extension Block.
EDID:
  Base EDID: EDID specified 0 extension block(s), but found 1 extension block(s).

EDID conformity: FAIL
