edid-decode (hex):

00 ff ff ff ff ff ff 00 4c 2d a2 03 00 00 00 00
2e 11 01 04 a5 29 1a 78 22 93 41 a3 55 4a 98 27
15 50 54 ad cf 00 95 0f 81 80 01 01 01 01 01 01
01 01 01 01 01 01 9a 29 a0 d0 51 84 22 30 50 98
36 00 98 ff 10 00 00 1c 66 21 50 b0 51 00 1b 30
40 70 36 00 98 ff 10 00 00 1e 00 00 00 fd 00 3c
4b 1e 51 0e 00 0a 20 20 20 20 20 20 00 00 00 fc
00 53 41 4d 53 55 4e 47 0a 20 20 20 20 20 00 cf

00 ff ff ff ff ff ff 00 4c 2d a2 03 00 00 00 00
2e 11 01 04 a5 29 1a 78 22 93 41 a3 55 4a 98 27
15 50 54 ad cf 00 95 0f 81 80 01 01 01 01 01 01
01 01 01 01 01 01 9a 29 a0 d0 51 84 22 30 50 98
36 00 98 ff 10 00 00 1c 66 21 50 b0 51 00 1b 30
40 70 36 00 98 ff 10 00 00 1e 00 00 00 fd 00 3c
4b 1e 51 0e 00 0a 20 20 20 20 20 20 00 00 00 fc
00 53 41 4d 53 55 4e 47 0a 20 20 20 20 20 00 cf

----------------

Block 0, Base EDID:
  EDID Structure Version & Revision: 1.4
  Vendor & Product Identification:
    Manufacturer: SAM
    Model: 930
    Made in: week 46 of 2007
  Basic Display Parameters & Features:
    Digital display
    Bits per primary color channel: 8
    DisplayPort interface
    Maximum image size: 41 cm x 26 cm
    Gamma: 2.20
    DPMS levels: Off
    Supported color formats: RGB 4:4:4
    First detailed timing includes the native pixel format and preferred refresh rate
  Color Characteristics:
    Red  : 0.6386, 0.3330
    Green: 0.2890, 0.5966
    Blue : 0.1533, 0.0820
    White: 0.3125, 0.3291
  Established Timings I & II:
    IBM     :   720x400    70.081663 Hz   9:5     31.467 kHz     28.320000 MHz
    DMT 0x04:   640x480    59.940476 Hz   4:3     31.469 kHz     25.175000 MHz
    DMT 0x05:   640x480    72.808802 Hz   4:3     37.861 kHz     31.500000 MHz
    DMT 0x06:   640x480    75.000000 Hz   4:3     37.500 kHz     31.500000 MHz
    DMT 0x09:   800x600    60.316541 Hz   4:3     37.879 kHz     40.000000 MHz
    DMT 0x0a:   800x600    72.187572 Hz   4:3     48.077 kHz     50.000000 MHz
    DMT 0x0b:   800x600    75.000000 Hz   4:3     46.875 kHz     49.500000 MHz
    DMT 0x10:  1024x768    60.003840 Hz   4:3     48.363 kHz     65.000000 MHz
    DMT 0x11:  1024x768    70.069359 Hz   4:3     56.476 kHz     75.000000 MHz
    DMT 0x12:  1024x768    75.028582 Hz   4:3     60.023 kHz     78.750000 MHz
    DMT 0x24:  1280x1024   75.024675 Hz   5:4     79.976 kHz    135.000000 MHz
  Standard Timings:
    DMT 0x30:  1440x900    74.984427 Hz  16:10    70.635 kHz    136.750000 MHz
    DMT 0x23:  1280x1024   60.019740 Hz   5:4     63.981 kHz    108.000000 MHz
  Detailed Timing Descriptors:
    DTD 1:  1440x900    59.887445 Hz  16:10    55.935 kHz    106.500000 MHz (408 mm x 255 mm)
                 Hfront   80 Hsync 152 Hback  232 Hpol N
                 Vfront    3 Vsync   6 Vback   25 Vpol P
    DTD 2:  1360x768    60.015162 Hz  85:48    47.712 kHz     85.500000 MHz (408 mm x 255 mm)
                 Hfront   64 Hsync 112 Hback  256 Hpol P
                 Vfront    3 Vsync   6 Vback   18 Vpol P
    Display Range Limits:
      Monitor ranges (GTF): 60-75 Hz V, 30-81 kHz H, max dotclock 140 MHz
    Display Product Name: 'SAMSUNG'
Checksum: 0xcf

----------------

Block 1, Unknown EDID Extension Block 0x00:
  00 ff ff ff ff ff ff 00 4c 2d a2 03 00 00 00 00 '........L-......'
  2e 11 01 04 a5 29 1a 78 22 93 41 a3 55 4a 98 27 '.....).x".A.UJ.''
  15 50 54 ad cf 00 95 0f 81 80 01 01 01 01 01 01 '.PT.............'
  01 01 01 01 01 01 9a 29 a0 d0 51 84 22 30 50 98 '.......)..Q."0P.'
  36 00 98 ff 10 00 00 1c 66 21 50 b0 51 00 1b 30 '6.......f!P.Q..0'
  40 70 36 00 98 ff 10 00 00 1e 00 00 00 fd 00 3c '@p6............<'
  4b 1e 51 0e 00 0a 20 20 20 20 20 20 00 00 00 fc 'K.Q...      ....'
  00 53 41 4d 53 55 4e 47 0a 20 20 20 20 20 00 cf '.SAMSUNG.     ..'
Checksum: 0xcf

----------------

Warnings:

Block 0, Base EDID:
  Detailed Timing Descriptor #2: Image size is 408x255 mm, but based on the picture AR it should be 408x230 mm.
  Display Range Limits: GTF support is deprecated in EDID 1.4.

Failures:

Block 0, Base EDID:
  Display Range Limits: GTF is supported, but the display does not support continuous frequencies.
Block 1, Base EDID:
  Unknown Extension Block.
EDID:
  Base EDID: EDID specified 0 extension block(s), but found 1 extension block(s).

EDID conformity: FAIL
