edid-decode (hex):

00 ff ff ff ff ff ff 00 06 af 14 a1 00 00 00 00
01 12 01 03 90 1a 10 78 0a 50 c5 98 58 52 8e 27
25 50 54 00 00 00 01 01 01 01 01 01 01 01 01 01
01 01 01 01 01 01 ea 1a 00 7e 50 20 10 30 30 20
36 00 05 a3 10 00 00 1a ea 1a 00 7e 50 20 10 30
30 20 36 00 05 a3 10 00 00 1a 00 00 00 fe 00 46
33 32 35 46 80 42 31 32 31 45 57 30 00 00 00 00
00 00 00 00 00 00 00 00 00 01 01 0a 20 20 00 be

----------------

Block 0, Base EDID:
  EDID Structure Version & Revision: 1.3
  Vendor & Product Identification:
    Manufacturer: AUO
    Model: 41236
    Made in: week 1 of 2008
  Basic Display Parameters & Features:
    Digital display
    Maximum image size: 26 cm x 16 cm
    Gamma: 2.20
    RGB color display
    First detailed timing is the preferred timing
  Color Characteristics:
    Red  : 0.5947, 0.3447
    Green: 0.3203, 0.5546
    Blue : 0.1552, 0.1445
    White: 0.3134, 0.3291
  Established Timings I & II: none
  Standard Timings: none
  Detailed Timing Descriptors:
    DTD 1:  1280x800    60.054249 Hz  16:10    49.004 kHz     68.900000 MHz (261 mm x 163 mm)
                 Hfront   48 Hsync  32 Hback   46 Hpol P
                 Vfront    3 Vsync   6 Vback    7 Vpol N
    DTD 2:  1280x800    60.054249 Hz  16:10    49.004 kHz     68.900000 MHz (261 mm x 163 mm)
                 Hfront   48 Hsync  32 Hback   46 Hpol P
                 Vfront    3 Vsync   6 Vback    7 Vpol N
    Alphanumeric Data String: 'F325F.B121EW0'
    Manufacturer-Specified Display Descriptor (0x00): 00 00 00 00 00 00 00 00 00 00 00 01 01 0a 20 20 '..............  '
Checksum: 0xbe

----------------

Warnings:

Block 0, Base EDID:
  Alphanumeric Data String: Non-ASCII character 0x80 at position 5, can cause problems.

Failures:

Block 0, Base EDID:
  Basic Display Parameters & Features: Digital Video Interface Standard set to reserved value 0x10.
  Missing Display Product Name.
  Missing Display Range Limits Descriptor.

EDID conformity: FAIL
