edid-decode (hex):

00 ff ff ff ff ff ff 00 1e 6d 9f 4b 2d e2 00 00
03 13 01 03 80 29 1a 78 ea 36 c5 a4 55 4c 9c 25
12 50 54 a7 6f 80 95 00 81 80 81 40 71 4f 01 01
01 01 01 01 01 01 ab 22 a0 a0 50 84 1a 30 30 20
36 00 98 f1 10 00 00 1a 9a 29 a0 d0 51 84 22 30
50 98 36 00 98 f1 10 00 00 1c 00 00 00 fd 00 38
4b 1c 53 0f 00 0a 20 20 20 20 20 20 00 00 00 fc
00 4d 31 39 39 34 41 0a 20 20 20 20 20 20 01 52

02 03 1d 72 23 09 07 02 49 07 16 81 03 05 14 13
12 04 83 01 00 00 66 03 0c 00 10 00 80 01 1d 80
18 71 1c 16 20 58 2c 25 00 b1 0e 11 00 00 9e 01
1d 80 d0 72 1c 16 20 10 2c 25 80 b1 0e 11 00 00
9e 01 1d 00 bc 52 d0 1e 20 b8 28 55 40 b1 0e 11
00 00 1e 8c 0a d0 90 20 40 31 20 0c 40 55 00 b1
0e 11 00 00 18 01 1d 00 72 51 d0 1e 20 6e 28 55
00 b1 0e 11 00 00 1e 00 00 00 00 00 00 00 00 dc

00 ff ff ff ff ff ff 00 1e 6d 9f 4b 2d e2 00 00
03 13 01 03 80 29 1a 78 ea 36 c5 a4 55 4c 9c 25
12 50 54 a7 6f 80 95 00 81 80 81 40 71 4f 01 01
01 01 01 01 01 01 ab 22 a0 a0 50 84 1a 30 30 20
36 00 98 f1 10 00 00 1a 9a 29 a0 d0 51 84 22 30
50 98 36 00 98 f1 10 00 00 1c 00 00 00 fd 00 38
4b 1c 53 0f 00 0a 20 20 20 20 20 20 00 00 00 fc
00 4d 31 39 39 34 41 0a 20 20 20 20 20 20 01 52

02 03 1d 72 23 09 07 02 49 07 16 81 03 05 14 13
12 04 83 01 00 00 66 03 0c 00 10 00 80 01 1d 80
18 71 1c 16 20 58 2c 25 00 b1 0e 11 00 00 9e 01
1d 80 d0 72 1c 16 20 10 2c 25 80 b1 0e 11 00 00
9e 01 1d 00 bc 52 d0 1e 20 b8 28 55 40 b1 0e 11
00 00 1e 8c 0a d0 90 20 40 31 20 0c 40 55 00 b1
0e 11 00 00 18 01 1d 00 72 51 d0 1e 20 6e 28 55
00 b1 0e 11 00 00 1e 00 00 00 00 00 00 00 00 dc

----------------

Block 0, Base EDID:
  EDID Structure Version & Revision: 1.3
  Vendor & Product Identification:
    Manufacturer: GSM
    Model: 19359
    Serial Number: ...
    Made in: week 3 of 2009
  Basic Display Parameters & Features:
    Digital display
    Maximum image size: 41 cm x 26 cm
    Gamma: 2.20
    DPMS levels: Standby Suspend Off
    RGB color display
    First detailed timing is the preferred timing
  Color Characteristics:
    Red  : 0.6406, 0.3349
    Green: 0.2978, 0.6113
    Blue : 0.1474, 0.0703
    White: 0.3134, 0.3291
  Established Timings I & II:
    IBM     :   720x400    70.081663 Hz   9:5     31.467 kHz     28.320000 MHz
    DMT 0x04:   640x480    59.940476 Hz   4:3     31.469 kHz     25.175000 MHz
    DMT 0x06:   640x480    75.000000 Hz   4:3     37.500 kHz     31.500000 MHz
    DMT 0x08:   800x600    56.250000 Hz   4:3     35.156 kHz     36.000000 MHz
    DMT 0x09:   800x600    60.316541 Hz   4:3     37.879 kHz     40.000000 MHz
    DMT 0x0b:   800x600    75.000000 Hz   4:3     46.875 kHz     49.500000 MHz
    Apple   :   832x624    74.551266 Hz   4:3     49.726 kHz     57.284000 MHz
    DMT 0x10:  1024x768    60.003840 Hz   4:3     48.363 kHz     65.000000 MHz
    DMT 0x11:  1024x768    70.069359 Hz   4:3     56.476 kHz     75.000000 MHz
    DMT 0x12:  1024x768    75.028582 Hz   4:3     60.023 kHz     78.750000 MHz
    DMT 0x24:  1280x1024   75.024675 Hz   5:4     79.976 kHz    135.000000 MHz
    Apple   :  1152x870    75.061550 Hz 192:145   68.681 kHz    100.000000 MHz
  Standard Timings:
    DMT 0x2f:  1440x900    59.887445 Hz  16:10    55.935 kHz    106.500000 MHz
    DMT 0x23:  1280x1024   60.019740 Hz   5:4     63.981 kHz    108.000000 MHz
    DMT 0x20:  1280x960    60.000000 Hz   4:3     60.000 kHz    108.000000 MHz
    DMT 0x15:  1152x864    75.000000 Hz   4:3     67.500 kHz    108.000000 MHz
  Detailed Timing Descriptors:
    DTD 1:  1440x900    59.901458 Hz  16:10    55.469 kHz     88.750000 MHz (408 mm x 241 mm)
                 Hfront   48 Hsync  32 Hback   80 Hpol P
                 Vfront    3 Vsync   6 Vback   17 Vpol N
    DTD 2:  1440x900    59.887445 Hz  16:10    55.935 kHz    106.500000 MHz (408 mm x 241 mm)
                 Hfront   80 Hsync 152 Hback  232 Hpol N
                 Vfront    3 Vsync   6 Vback   25 Vpol P
    Display Range Limits:
      Monitor ranges (GTF): 56-75 Hz V, 28-83 kHz H, max dotclock 150 MHz
    Display Product Name: 'M1994A'
  Extension blocks: 1
Checksum: 0x52

----------------

Block 1, CTA-861 Extension Block:
  Revision: 3
  Basic audio support
  Supports YCbCr 4:4:4
  Supports YCbCr 4:2:2
  Native DTDs: 2
  Audio Data Block:
    Linear PCM:
      Max channels: 2
      Supported sample rates (kHz): 48 44.1 32
      Supported sample sizes (bits): 20
  Video Data Block:
    VIC   7:  1440x480i   59.940060 Hz  16:9     15.734 kHz     27.000000 MHz
    VIC  22:  1440x576i   50.000000 Hz  16:9     15.625 kHz     27.000000 MHz
    VIC   1:   640x480    59.940476 Hz   4:3     31.469 kHz     25.175000 MHz (native)
    VIC   3:   720x480    59.940060 Hz  16:9     31.469 kHz     27.000000 MHz
    VIC   5:  1920x1080i  60.000000 Hz  16:9     33.750 kHz     74.250000 MHz
    VIC  20:  1920x1080i  50.000000 Hz  16:9     28.125 kHz     74.250000 MHz
    VIC  19:  1280x720    50.000000 Hz  16:9     37.500 kHz     74.250000 MHz
    VIC  18:   720x576    50.000000 Hz  16:9     31.250 kHz     27.000000 MHz
    VIC   4:  1280x720    60.000000 Hz  16:9     45.000 kHz     74.250000 MHz
  Speaker Allocation Data Block:
    FL/FR - Front Left/Right
  Vendor-Specific Data Block (HDMI), OUI 00-0C-03:
    Source physical address: 1.0.0.0
    Supports_AI
  Detailed Timing Descriptors:
    DTD 3:  1920x1080i  60.000000 Hz  16:9     33.750 kHz     74.250000 MHz (433 mm x 270 mm)
                 Hfront   88 Hsync  44 Hback  148 Hpol P
                 Vfront    2 Vsync   5 Vback   15 Vpol P Vfront +0.5 Odd Field
                 Vfront    2 Vsync   5 Vback   15 Vpol P Vback  +0.5 Even Field
    DTD 4:  1920x1080i  50.000000 Hz  16:9     28.125 kHz     74.250000 MHz (433 mm x 270 mm)
                 Hfront  528 Hsync  44 Hback  148 Hpol P
                 Vfront    2 Vsync   5 Vback   15 Vpol P Vfront +0.5 Odd Field
                 Vfront    2 Vsync   5 Vback   15 Vpol P Vback  +0.5 Even Field
    DTD 5:  1280x720    50.000000 Hz  16:9     37.500 kHz     74.250000 MHz (433 mm x 270 mm)
                 Hfront  440 Hsync  40 Hback  220 Hpol P
                 Vfront    5 Vsync   5 Vback   20 Vpol P
    DTD 6:   720x576    50.000000 Hz   5:4     31.250 kHz     27.000000 MHz (433 mm x 270 mm)
                 Hfront   12 Hsync  64 Hback   68 Hpol N
                 Vfront    5 Vsync   5 Vback   39 Vpol N
    DTD 7:  1280x720    60.000000 Hz  16:9     45.000 kHz     74.250000 MHz (433 mm x 270 mm)
                 Hfront  110 Hsync  40 Hback  220 Hpol P
                 Vfront    5 Vsync   5 Vback   20 Vpol P
Checksum: 0xdc  Unused space in Extension Block: 8 bytes

----------------

Warnings:

Block 0, Base EDID:
  Detailed Timing Descriptor #1: Image size is 408x241 mm, but based on the picture AR it should be 385x241 mm.
  Detailed Timing Descriptor #2: Image size is 408x241 mm, but based on the picture AR it should be 385x241 mm.
Block 1, CTA-861 Extension Block:
  IT Video Formats are overscanned by default, but normally this should be underscanned.
  Video Data Block: VIC 7 and the first DTD are not identical. Is this intended?
  Detailed Timing Descriptor #3: Image size is 433x270 mm, but based on the picture AR it should be 433x243 mm.
  Detailed Timing Descriptor #4: Image size is 433x270 mm, but based on the picture AR it should be 433x243 mm.
  Detailed Timing Descriptor #5: Image size is 433x270 mm, but based on the picture AR it should be 433x243 mm.
  Detailed Timing Descriptor #6: Image size is 433x270 mm, but based on the picture AR it should be 337x270 mm.
  Detailed Timing Descriptor #7: Image size is 433x270 mm, but based on the picture AR it should be 433x243 mm.
  Add a Colorimetry Data Block with the sRGB colorimetry bit set to avoid interop issues.
EDID:
  Base EDID: Some timings are out of range of the Monitor Ranges:
    Vertical Freq: 50.000 - 75.062 Hz (Monitor: 56.000 - 75.000 Hz)
    Horizontal Freq: 15.625 - 79.976 kHz (Monitor: 28.000 - 83.000 kHz)

Failures:

Block 1, CTA-861 Extension Block:
  Detailed Timing Descriptor #3: Mismatch of image size 433x270 mm vs display size 410x260 mm.
  Detailed Timing Descriptor #4: Mismatch of image size 433x270 mm vs display size 410x260 mm.
  Detailed Timing Descriptor #5: Mismatch of image size 433x270 mm vs display size 410x260 mm.
  Detailed Timing Descriptor #6: Mismatch of image size 433x270 mm vs display size 410x260 mm.
  Detailed Timing Descriptor #7: Mismatch of image size 433x270 mm vs display size 410x260 mm.
  Missing VCDB, needed for Set Selectable RGB Quantization to avoid interop issues.
EDID:
  Extension Block 2 started with EDID header, ignoring Extension Blocks >= 2.
  Base EDID: The DTD max image size is 433x270mm, which is larger than the display size 410.0x260.0mm.
  CTA-861: Native progressive timings are a mix of several resolutions.

EDID conformity: FAIL
