edid-decode (hex):

00 ff ff ff ff ff ff 00 09 e5 70 0b 00 00 00 00
1e 20 01 04 a5 22 13 78 03 ee 95 a3 54 4c 99 26
0f 50 54 00 00 00 01 01 01 01 01 01 01 01 01 01
01 01 01 01 01 01 74 38 80 a0 70 38 4e 40 30 20
35 00 58 c2 10 00 00 1a 00 00 00 fd 00 3c 90 a7
a7 23 01 0a 20 20 20 20 20 20 00 00 00 fc 00 4e
45 31 35 36 46 48 4d 2d 4e 58 36 0a 00 00 00 00
00 00 00 00 00 00 00 00 00 00 00 00 00 00 01 d3

70 20 79 02 00 22 00 14 db 4a 05 84 7f 07 9f 00
2f 00 1f 00 37 04 4d 00 02 00 04 00 2b 00 06 27
00 3c 8f 00 00 00 00 00 00 00 00 00 00 00 00 00
00 00 00 00 00 00 00 00 00 00 00 00 00 00 00 00
00 00 00 00 00 00 00 00 00 00 00 00 00 00 00 00
00 00 00 00 00 00 00 00 00 00 00 00 00 00 00 00
00 00 00 00 00 00 00 00 00 00 00 00 00 00 00 00
00 00 00 00 00 00 00 00 00 00 00 00 00 00 5d 90

00 ff ff ff ff ff ff 00 09 e5 70 0b 00 00 00 00
1e 20 01 04 a5 22 13 78 03 ee 95 a3 54 4c 99 26
0f 50 54 00 00 00 01 01 01 01 01 01 01 01 01 01
01 01 01 01 01 01 74 38 80 a0 70 38 4e 40 30 20
35 00 58 c2 10 00 00 1a 00 00 00 fd 00 3c 90 a7
a7 23 01 0a 20 20 20 20 20 20 00 00 00 fc 00 4e
45 31 35 36 46 48 4d 2d 4e 58 36 0a 00 00 00 00
00 00 00 00 00 00 00 00 00 00 00 00 00 00 01 d3

70 20 79 02 00 22 00 14 db 4a 05 84 7f 07 9f 00
2f 00 1f 00 37 04 4d 00 02 00 04 00 2b 00 06 27
00 3c 8f 00 00 00 00 00 00 00 00 00 00 00 00 00
00 00 00 00 00 00 00 00 00 00 00 00 00 00 00 00
00 00 00 00 00 00 00 00 00 00 00 00 00 00 00 00
00 00 00 00 00 00 00 00 00 00 00 00 00 00 00 00
00 00 00 00 00 00 00 00 00 00 00 00 00 00 00 00
00 00 00 00 00 00 00 00 00 00 00 00 00 00 5d 90

----------------

Block 0, Base EDID:
  EDID Structure Version & Revision: 1.4
  Vendor & Product Identification:
    Manufacturer: BOE
    Model: 2928
    Made in: week 30 of 2022
  Basic Display Parameters & Features:
    Digital display
    Bits per primary color channel: 8
    DisplayPort interface
    Maximum image size: 34 cm x 19 cm
    Gamma: 2.20
    Supported color formats: RGB 4:4:4
    First detailed timing includes the native pixel format and preferred refresh rate
    Display supports continuous frequencies
  Color Characteristics:
    Red  : 0.6396, 0.3300
    Green: 0.2998, 0.5996
    Blue : 0.1503, 0.0595
    White: 0.3134, 0.3291
  Established Timings I & II: none
  Standard Timings: none
  Detailed Timing Descriptors:
    DTD 1:  1920x1080   60.000664 Hz  16:9     69.481 kHz    144.520000 MHz (344 mm x 194 mm)
                 Hfront   48 Hsync  32 Hback   80 Hpol P
                 Vfront    3 Vsync   5 Vback   70 Vpol N
    Display Range Limits:
      Monitor ranges (Range Limits Only): 60-144 Hz V, 167-167 kHz H, max dotclock 350 MHz
    Display Product Name: 'NE156FHM-NX6'
    Empty Descriptor
  Extension blocks: 1
Checksum: 0xd3

----------------

Block 1, DisplayID Extension Block:
  Version: 2.0
  Extension Count: 0
  Display Product Primary Use Case: None of the listed primary use cases; generic display
  Video Timing Modes Type 7 - Detailed Timings Data Block:
    DTD:  1920x1080  143.999934 Hz  16:9    166.752 kHz    346.844000 MHz (aspect 16:9, no 3D stereo, preferred)
               Hfront   48 Hsync  32 Hback   80 Hpol N
               Vfront    3 Vsync   5 Vback   70 Vpol N
  Adaptive Sync Data Block:
    Descriptor #1:
      Native Panel Range
      Fixed Average V-Total and Adaptive V-Total
      Supports Seamless Transition
      'Max Single Frame Duration Increase' field value without jitter impact
      'Max Single Frame Duration Decrease' field value without jitter impact
      Max Duration Increase: 0.00 ms
      Max Duration Decrease: 0.00 ms
      Min Refresh Rate: 60 Hz
      Max Refresh Rate: 144 Hz
  Checksum: 0x5d
Checksum: 0x90

----------------

Block 2, Unknown EDID Extension Block 0x00:
  00 ff ff ff ff ff ff 00 09 e5 70 0b 00 00 00 00 '..........p.....'
  1e 20 01 04 a5 22 13 78 03 ee 95 a3 54 4c 99 26 '. ...".x....TL.&'
  0f 50 54 00 00 00 01 01 01 01 01 01 01 01 01 01 '.PT.............'
  01 01 01 01 01 01 74 38 80 a0 70 38 4e 40 30 20 '......t8..p8N@0 '
  35 00 58 c2 10 00 00 1a 00 00 00 fd 00 3c 90 a7 '5.X..........<..'
  a7 23 01 0a 20 20 20 20 20 20 00 00 00 fc 00 4e '.#..      .....N'
  45 31 35 36 46 48 4d 2d 4e 58 36 0a 00 00 00 00 'E156FHM-NX6.....'
  00 00 00 00 00 00 00 00 00 00 00 00 00 00 01 d3 '................'
Checksum: 0xd3

----------------

Block 3, DisplayID Extension Block:
  Version: 2.0
  Extension Count: 0
  Video Timing Modes Type 7 - Detailed Timings Data Block:
    DTD:  1920x1080  143.999934 Hz  16:9    166.752 kHz    346.844000 MHz (aspect 16:9, no 3D stereo, preferred)
               Hfront   48 Hsync  32 Hback   80 Hpol N
               Vfront    3 Vsync   5 Vback   70 Vpol N
  Adaptive Sync Data Block:
    Descriptor #1:
      Native Panel Range
      Fixed Average V-Total and Adaptive V-Total
      Supports Seamless Transition
      'Max Single Frame Duration Increase' field value without jitter impact
      'Max Single Frame Duration Decrease' field value without jitter impact
      Max Duration Increase: 0.00 ms
      Max Duration Decrease: 0.00 ms
      Min Refresh Rate: 60 Hz
      Max Refresh Rate: 144 Hz
  Checksum: 0x5d
Checksum: 0x90

----------------

Warnings:

EDID:
  Base EDID: Some timings are out of range of the Monitor Ranges:
    Horizontal Freq: 69.480 - 166.751 kHz (Monitor: 167.000 - 167.000 kHz)

Failures:

Block 0, Base EDID:
  Empty Descriptor: Use Dummy Descriptor instead of all zeroes.
Block 1, DisplayID Extension Block:
  Expected 0 DisplayID Extension Block, but got 1.
Block 2, Base EDID:
  Unknown Extension Block.
Block 3, DisplayID Extension Block:
  Product Type should be 0 in extension block.
EDID:
  Base EDID: EDID specified 1 extension block(s), but found 3 extension block(s).
  DisplayID: Missing DisplayID Display Parameters Data Block.

EDID conformity: FAIL
