edid-decode (hex):

00 ff ff ff ff ff ff 00 30 e4 da 02 00 00 00 00
00 14 01 04 90 26 15 78 0a f1 95 a3 55 52 a1 26
0f 50 54 00 00 00 01 01 01 01 01 01 01 01 01 01
01 01 01 01 01 01 b0 36 80 b0 70 38 21 40 30 20
35 00 7e d7 10 00 00 18 b0 36 80 b0 70 38 21 40
30 20 35 00 7e d7 10 00 00 18 00 00 00 fe 00 4b
36 50 4a 31 80 31 37 33 57 46 31 0a 00 00 00 00
00 00 41 31 9e 00 00 00 00 02 01 0a 20 20 00 7a

----------------

Block 0, Base EDID:
  EDID Structure Version & Revision: 1.4
  Vendor & Product Identification:
    Manufacturer: LGD
    Model: 730
    Made in: 2010
  Basic Display Parameters & Features:
    Digital display
    Bits per primary color channel: 6
    Digital interface is not defined
    Maximum image size: 38 cm x 21 cm
    Gamma: 2.20
    Supported color formats: RGB 4:4:4, YCrCb 4:4:4
    First detailed timing includes the native pixel format and preferred refresh rate
  Color Characteristics:
    Red  : 0.6396, 0.3349
    Green: 0.3203, 0.6298
    Blue : 0.1503, 0.0595
    White: 0.3134, 0.3291
  Established Timings I & II: none
  Standard Timings: none
  Detailed Timing Descriptors:
    DTD 1:  1920x1080   60.012483 Hz  16:9     66.794 kHz    140.000000 MHz (382 mm x 215 mm)
                 Hfront   48 Hsync  32 Hback   96 Hpol N
                 Vfront    3 Vsync   5 Vback   25 Vpol N
    DTD 2:  1920x1080   60.012483 Hz  16:9     66.794 kHz    140.000000 MHz (382 mm x 215 mm)
                 Hfront   48 Hsync  32 Hback   96 Hpol N
                 Vfront    3 Vsync   5 Vback   25 Vpol N
    Alphanumeric Data String: 'K6PJ1.173WF1'
    Manufacturer-Specified Display Descriptor (0x00): 00 00 00 00 41 31 9e 00 00 00 00 02 01 0a 20 20 '....A1........  '
Checksum: 0x7a

----------------

Warnings:

Block 0, Base EDID:
  Alphanumeric Data String: Non-ASCII character 0x80 at position 5, can cause problems.
  Missing Display Product Name.

EDID conformity: PASS
