edid-decode (hex):

00 ff ff ff ff ff ff 00 5c 2d 00 28 01 00 00 00
13 1e 01 04 b5 3e 23 78 3f 59 95 af 4f 42 af 26
0f 50 54 a3 08 00 d1 c0 b3 00 a9 40 95 00 90 40
81 80 81 40 81 c0 4d d0 00 a0 f0 70 3e 80 30 20
35 00 78 68 21 00 00 1a 00 00 00 ff 00 30 30 30
30 30 30 30 30 30 30 30 30 31 00 00 00 fd 00 30
3c a0 a0 3c 01 0a 20 20 20 20 20 20 00 00 00 fc
00 57 32 38 30 20 20 4d 41 58 0a 20 20 20 01 42

02 03 2a f1 52 01 03 04 05 07 10 12 13 14 16 1f
20 21 22 5d 5e 60 61 23 09 07 07 83 01 00 00 e3
05 e3 01 e6 06 07 01 62 62 30 4d d0 00 a0 f0 70
3e 80 30 20 35 00 ba 89 21 00 00 1a 56 5e 00 a0
a0 a0 29 50 30 20 35 00 ba 89 21 00 00 1e a3 66
00 a0 f0 70 1f 80 30 20 35 00 ba 89 21 00 00 1a
00 00 00 00 00 00 00 00 00 00 00 00 00 00 00 00
00 00 00 00 00 00 00 00 00 00 00 00 00 00 00 0e

00 ff ff ff ff ff ff 00 5c 2d 00 28 01 00 00 00
13 1e 01 04 b5 3e 23 78 3f 59 95 af 4f 42 af 26
0f 50 54 a3 08 00 d1 c0 b3 00 a9 40 95 00 90 40
81 80 81 40 81 c0 4d d0 00 a0 f0 70 3e 80 30 20
35 00 78 68 21 00 00 1a 00 00 00 ff 00 30 30 30
30 30 30 30 30 30 30 30 30 31 00 00 00 fd 00 30
3c a0 a0 3c 01 0a 20 20 20 20 20 20 00 00 00 fc
00 57 32 38 30 20 20 4d 41 58 0a 20 20 20 01 42

02 03 2a f1 52 01 03 04 05 07 10 12 13 14 16 1f
20 21 22 5d 5e 60 61 23 09 07 07 83 01 00 00 e3
05 e3 01 e6 06 07 01 62 62 30 4d d0 00 a0 f0 70
3e 80 30 20 35 00 ba 89 21 00 00 1a 56 5e 00 a0
a0 a0 29 50 30 20 35 00 ba 89 21 00 00 1e a3 66
00 a0 f0 70 1f 80 30 20 35 00 ba 89 21 00 00 1a
00 00 00 00 00 00 00 00 00 00 00 00 00 00 00 00
00 00 00 00 00 00 00 00 00 00 00 00 00 00 00 0e

----------------

Block 0, Base EDID:
  EDID Structure Version & Revision: 1.4
  Vendor & Product Identification:
    Manufacturer: WAM
    Model: 10240
    Serial Number: ...
    Made in: week 19 of 2020
  Basic Display Parameters & Features:
    Digital display
    Bits per primary color channel: 10
    DisplayPort interface
    Maximum image size: 62 cm x 35 cm
    Gamma: 2.20
    DPMS levels: Off
    Supported color formats: RGB 4:4:4, YCrCb 4:4:4, YCrCb 4:2:2
    Default (sRGB) color space is primary color space
    First detailed timing includes the native pixel format and preferred refresh rate
    Display supports continuous frequencies
  Color Characteristics:
    Red  : 0.6845, 0.3095
    Green: 0.2597, 0.6845
    Blue : 0.1503, 0.0595
    White: 0.3134, 0.3291
  Established Timings I & II:
    IBM     :   720x400    70.081663 Hz   9:5     31.467 kHz     28.320000 MHz
    DMT 0x04:   640x480    59.940476 Hz   4:3     31.469 kHz     25.175000 MHz
    DMT 0x08:   800x600    56.250000 Hz   4:3     35.156 kHz     36.000000 MHz
    DMT 0x09:   800x600    60.316541 Hz   4:3     37.879 kHz     40.000000 MHz
    DMT 0x10:  1024x768    60.003840 Hz   4:3     48.363 kHz     65.000000 MHz
  Standard Timings:
    DMT 0x52:  1920x1080   60.000000 Hz  16:9     67.500 kHz    148.500000 MHz
    DMT 0x3a:  1680x1050   59.954250 Hz  16:10    65.290 kHz    146.250000 MHz
    DMT 0x33:  1600x1200   60.000000 Hz   4:3     75.000 kHz    162.000000 MHz
    DMT 0x2f:  1440x900    59.887445 Hz  16:10    55.935 kHz    106.500000 MHz
    DMT 0x2a:  1400x1050   59.978442 Hz   4:3     65.317 kHz    121.750000 MHz
    DMT 0x23:  1280x1024   60.019740 Hz   5:4     63.981 kHz    108.000000 MHz
    DMT 0x20:  1280x960    60.000000 Hz   4:3     60.000 kHz    108.000000 MHz
    DMT 0x55:  1280x720    60.000000 Hz  16:9     45.000 kHz     74.250000 MHz
  Detailed Timing Descriptors:
    DTD 1:  3840x2160   59.996625 Hz  16:9    133.312 kHz    533.250000 MHz (632 mm x 360 mm)
                 Hfront   48 Hsync  32 Hback   80 Hpol P
                 Vfront    3 Vsync   5 Vback   54 Vpol N
    Display Product Serial Number: ...
    Display Range Limits:
      Monitor ranges (Range Limits Only): 48-60 Hz V, 160-160 kHz H, max dotclock 600 MHz
    Display Product Name: 'W280  MAX'
  Extension blocks: 1
Checksum: 0x42

----------------

Block 1, CTA-861 Extension Block:
  Revision: 3
  Underscans IT Video Formats by default
  Basic audio support
  Supports YCbCr 4:4:4
  Supports YCbCr 4:2:2
  Native DTDs: 1
  Video Data Block:
    VIC   1:   640x480    59.940476 Hz   4:3     31.469 kHz     25.175000 MHz
    VIC   3:   720x480    59.940060 Hz  16:9     31.469 kHz     27.000000 MHz
    VIC   4:  1280x720    60.000000 Hz  16:9     45.000 kHz     74.250000 MHz
    VIC   5:  1920x1080i  60.000000 Hz  16:9     33.750 kHz     74.250000 MHz
    VIC   7:  1440x480i   59.940060 Hz  16:9     15.734 kHz     27.000000 MHz
    VIC  16:  1920x1080   60.000000 Hz  16:9     67.500 kHz    148.500000 MHz
    VIC  18:   720x576    50.000000 Hz  16:9     31.250 kHz     27.000000 MHz
    VIC  19:  1280x720    50.000000 Hz  16:9     37.500 kHz     74.250000 MHz
    VIC  20:  1920x1080i  50.000000 Hz  16:9     28.125 kHz     74.250000 MHz
    VIC  22:  1440x576i   50.000000 Hz  16:9     15.625 kHz     27.000000 MHz
    VIC  31:  1920x1080   50.000000 Hz  16:9     56.250 kHz    148.500000 MHz
    VIC  32:  1920x1080   24.000000 Hz  16:9     27.000 kHz     74.250000 MHz
    VIC  33:  1920x1080   25.000000 Hz  16:9     28.125 kHz     74.250000 MHz
    VIC  34:  1920x1080   30.000000 Hz  16:9     33.750 kHz     74.250000 MHz
    VIC  93:  3840x2160   24.000000 Hz  16:9     54.000 kHz    297.000000 MHz
    VIC  94:  3840x2160   25.000000 Hz  16:9     56.250 kHz    297.000000 MHz
    VIC  96:  3840x2160   50.000000 Hz  16:9    112.500 kHz    594.000000 MHz
    VIC  97:  3840x2160   60.000000 Hz  16:9    135.000 kHz    594.000000 MHz
  Audio Data Block:
    Linear PCM:
      Max channels: 2
      Supported sample rates (kHz): 48 44.1 32
      Supported sample sizes (bits): 24 20 16
  Speaker Allocation Data Block:
    FL/FR - Front Left/Right
  Colorimetry Data Block:
    xvYCC601
    xvYCC709
    BT2020cYCC
    BT2020YCC
    BT2020RGB
    Gamut Boundary Description Metadata Profile P0
  HDR Static Metadata Data Block:
    Electro optical transfer functions:
      Traditional gamma - SDR luminance range
      Traditional gamma - HDR luminance range
      SMPTE ST2084
    Supported static metadata descriptors:
      Static metadata type 1
    Desired content max luminance: 98 (417.710 cd/m^2)
    Desired content max frame-average luminance: 98 (417.710 cd/m^2)
    Desired content min luminance: 48 (0.148 cd/m^2)
  Detailed Timing Descriptors:
    DTD 2:  3840x2160   59.996625 Hz  16:9    133.312 kHz    533.250000 MHz (698 mm x 393 mm)
                 Hfront   48 Hsync  32 Hback   80 Hpol P
                 Vfront    3 Vsync   5 Vback   54 Vpol N
    DTD 3:  2560x1440   59.950550 Hz  16:9     88.787 kHz    241.500000 MHz (698 mm x 393 mm)
                 Hfront   48 Hsync  32 Hback   80 Hpol P
                 Vfront    3 Vsync   5 Vback   33 Vpol P
    DTD 4:  3840x2160   29.980602 Hz  16:9     65.688 kHz    262.750000 MHz (698 mm x 393 mm)
                 Hfront   48 Hsync  32 Hback   80 Hpol P
                 Vfront    3 Vsync   5 Vback   23 Vpol N
Checksum: 0x0e  Unused space in Extension Block: 31 bytes

----------------

Warnings:

Block 0, Base EDID:
  Vendor & Product Identification: The serial number is one of the known dummy values, it should probably be set to 0.
  Display Product Serial Number: ...
Block 1, CTA-861 Extension Block:
  Video Data Block: VIC 1 and the first DTD are not identical. Is this intended?
  Video Data Block: All VICs are in ascending order, and the first (preferred) VIC <= 4, is that intended?
  Display Product Serial Number is set, so the Serial Number in the Base EDID should be 0.
EDID:
  Base EDID: Some timings are out of range of the Monitor Ranges:
    Vertical Freq: 24.000 - 70.082 Hz (Monitor: 48.000 - 60.000 Hz)
    Horizontal Freq: 15.625 - 135.000 kHz (Monitor: 160.000 - 160.000 kHz)

Failures:

Block 0, Base EDID:
  Basic Display Parameters & Features: sRGB is signaled, but the chromaticities do not match.
  Detailed Timing Descriptor #1: Mismatch of image size 632x360 mm vs display size 620x350 mm.
Block 1, CTA-861 Extension Block:
  Detailed Timing Descriptor #2: Mismatch of image size 698x393 mm vs display size 620x350 mm.
  Detailed Timing Descriptor #3: Mismatch of image size 698x393 mm vs display size 620x350 mm.
  Detailed Timing Descriptor #4: Mismatch of image size 698x393 mm vs display size 620x350 mm.
  Missing VCDB, needed for Set Selectable RGB Quantization to avoid interop issues.
EDID:
  Extension Block 2 started with EDID header, ignoring Extension Blocks >= 2.
  Base EDID: The DTD max image size is 698x393mm, which is larger than the display size 620.0x350.0mm.

EDID conformity: FAIL
