edid-decode (hex):

00 ff ff ff ff ff ff 00 06 af 9d b3 00 00 00 00
01 1f 01 04 a5 22 13 78 03 59 25 93 58 59 93 29
1d 50 54 00 00 00 01 01 01 01 01 01 01 01 01 01
01 01 01 01 01 01 fa 37 80 c8 70 38 2e 40 6c 30
aa 00 58 c2 10 00 00 18 18 2e 00 00 00 00 00 00
00 00 00 00 58 c2 10 00 00 18 00 00 00 fd 00 28
3c 44 44 0e 01 0a 20 20 20 20 20 20 00 00 00 fe
00 42 31 35 36 48 41 4b 30 32 2e 34 20 0a 00 39

00 ff ff ff ff ff ff 00 06 af 9d b3 00 00 00 00
01 1f 01 04 a5 22 13 78 03 59 25 93 58 59 93 29
1d 50 54 00 00 00 01 01 01 01 01 01 01 01 01 01
01 01 01 01 01 01 fa 37 80 c8 70 38 2e 40 6c 30
aa 00 58 c2 10 00 00 18 18 2e 00 00 00 00 00 00
00 00 00 00 58 c2 10 00 00 18 00 00 00 fd 00 28
3c 44 44 0e 01 0a 20 20 20 20 20 20 00 00 00 fe
00 42 31 35 36 48 41 4b 30 32 2e 34 20 0a 00 39

----------------

Block 0, Base EDID:
  EDID Structure Version & Revision: 1.4
  Vendor & Product Identification:
    Manufacturer: AUO
    Model: 45981
    Made in: week 1 of 2021
  Basic Display Parameters & Features:
    Digital display
    Bits per primary color channel: 8
    DisplayPort interface
    Maximum image size: 34 cm x 19 cm
    Gamma: 2.20
    Supported color formats: RGB 4:4:4
    First detailed timing includes the native pixel format and preferred refresh rate
    Display supports continuous frequencies
  Color Characteristics:
    Red  : 0.5751, 0.3447
    Green: 0.3496, 0.5751
    Blue : 0.1601, 0.1152
    White: 0.3134, 0.3291
  Established Timings I & II: none
  Standard Timings: none
  Detailed Timing Descriptors:
    DTD 1:  1920x1080   60.030497 Hz  16:9     67.594 kHz    143.300000 MHz (344 mm x 194 mm)
                 Hfront  108 Hsync  48 Hback   44 Hpol N
                 Vfront   10 Vsync  10 Vback   26 Vpol N
    DTD 2:     0x0            inf Hz   0:0      0.000 kHz    118.000000 MHz (344 mm x 194 mm)
                 Hfront    0 Hsync   0 Hback    0 Hpol N
                 Vfront    0 Vsync   0 Vback    0 Vpol N
                   18 2e 00 00 00 00 00 00 00 00 00 00 58 c2 10 00 00 18 '............X.....'
    Display Range Limits:
      Monitor ranges (Range Limits Only): 40-60 Hz V, 68-68 kHz H, max dotclock 140 MHz
    Alphanumeric Data String: 'B156HAK02.4 '
Checksum: 0x39

----------------

Warnings:

Block 0, Base EDID:
  Missing Display Product Name.
EDID:
  Base EDID: Some timings are out of range of the Monitor Ranges:
    Vertical Freq: 60.030 - inf Hz (Monitor: 40.000 - 60.000 Hz)
    Maximum Clock: 143.300 MHz (Monitor: 140.000 MHz)

Failures:

Block 0, Base EDID:
  Detailed Timing Descriptor #2: 0 values in the video timing:
    Horizontal Active/Blanking 0/0
    Horizontal Frontporch/Sync Width 0/0
    Vertical Active/Blanking 0/0
    Vertical Frontporch/Sync Width 0/0
  Detailed Timing Descriptor #2: 0 or negative horizontal front porch.
  Detailed Timing Descriptor #2: 0 or negative horizontal back porch.
  Detailed Timing Descriptor #2: 0 or negative vertical back porch.
  Alphanumeric Data String: One or more trailing spaces before newline.
EDID:
  Extension Block 1 started with EDID header, ignoring Extension Blocks >= 1.

EDID conformity: FAIL
