edid-decode (hex):

00 ff ff ff ff ff ff 00 30 e4 ce 06 00 00 00 00
00 20 01 04 a5 1d 12 78 07 81 a5 a5 54 4c 9a 24
10 50 54 00 00 00 01 01 01 01 01 01 01 01 01 01
01 01 01 01 01 01 28 3c 80 a0 70 b0 23 40 30 20
36 00 20 b4 10 00 00 1a 00 00 00 fd 00 1e 3c 4a
4a 10 01 0a 20 20 20 20 20 20 00 00 00 fe 00 4d
39 31 47 57 81 31 33 34 57 55 31 0a 00 00 00 00
00 02 41 00 b2 00 01 00 00 0a 41 0a 20 20 00 8a

00 ff ff ff ff ff ff 00 30 e4 ce 06 00 00 00 00
00 20 01 04 a5 1d 12 78 07 81 a5 a5 54 4c 9a 24
10 50 54 00 00 00 01 01 01 01 01 01 01 01 01 01
01 01 01 01 01 01 28 3c 80 a0 70 b0 23 40 30 20
36 00 20 b4 10 00 00 1a 00 00 00 fd 00 1e 3c 4a
4a 10 01 0a 20 20 20 20 20 20 00 00 00 fe 00 4d
39 31 47 57 81 31 33 34 57 55 31 0a 00 00 00 00
00 02 41 00 b2 00 01 00 00 0a 41 0a 20 20 00 8a

----------------

Block 0, Base EDID:
  EDID Structure Version & Revision: 1.4
  Vendor & Product Identification:
    Manufacturer: LGD
    Model: 1742
    Made in: 2022
  Basic Display Parameters & Features:
    Digital display
    Bits per primary color channel: 8
    DisplayPort interface
    Maximum image size: 29 cm x 18 cm
    Gamma: 2.20
    Supported color formats: RGB 4:4:4
    Default (sRGB) color space is primary color space
    First detailed timing includes the native pixel format and preferred refresh rate
    Display supports continuous frequencies
  Color Characteristics:
    Red  : 0.6464, 0.3281
    Green: 0.2968, 0.6025
    Blue : 0.1425, 0.0644
    White: 0.3134, 0.3291
  Established Timings I & II: none
  Standard Timings: none
  Detailed Timing Descriptors:
    DTD 1:  1920x1200   59.950171 Hz  16:10    74.038 kHz    154.000000 MHz (288 mm x 180 mm)
                 Hfront   48 Hsync  32 Hback   80 Hpol P
                 Vfront    3 Vsync   6 Vback   26 Vpol N
    Display Range Limits:
      Monitor ranges (Range Limits Only): 30-60 Hz V, 74-74 kHz H, max dotclock 160 MHz
    Alphanumeric Data String: 'M91GW.134WU1'
    Manufacturer-Specified Display Descriptor (0x00): 00 00 00 02 41 00 b2 00 01 00 00 0a 41 0a 20 20 '....A.......A.  '
Checksum: 0x8a

----------------

Block 1, Unknown EDID Extension Block 0x00:
  00 ff ff ff ff ff ff 00 30 e4 ce 06 00 00 00 00 '........0.......'
  00 20 01 04 a5 1d 12 78 07 81 a5 a5 54 4c 9a 24 '. .....x....TL.$'
  10 50 54 00 00 00 01 01 01 01 01 01 01 01 01 01 '.PT.............'
  01 01 01 01 01 01 28 3c 80 a0 70 b0 23 40 30 20 '......(<..p.#@0 '
  36 00 20 b4 10 00 00 1a 00 00 00 fd 00 1e 3c 4a '6. ...........<J'
  4a 10 01 0a 20 20 20 20 20 20 00 00 00 fe 00 4d 'J...      .....M'
  39 31 47 57 81 31 33 34 57 55 31 0a 00 00 00 00 '91GW.134WU1.....'
  00 02 41 00 b2 00 01 00 00 0a 41 0a 20 20 00 8a '..A.......A.  ..'
Checksum: 0x8a

----------------

Warnings:

Block 0, Base EDID:
  Alphanumeric Data String: Non-ASCII character 0x81 at position 5, can cause problems.
  Missing Display Product Name.

Failures:

Block 0, Base EDID:
  Basic Display Parameters & Features: sRGB is signaled, but the chromaticities do not match.
Block 1, Base EDID:
  Unknown Extension Block.
EDID:
  Base EDID: EDID specified 0 extension block(s), but found 1 extension block(s).

EDID conformity: FAIL
