edid-decode (hex):

00 ff ff ff ff ff ff 00 4c ee c0 11 5c 8c 34 01
2b 20 01 03 81 11 0a 78 ea f8 d0 a0 54 47 8d 23
24 4d 54 00 00 00 01 01 01 01 01 01 01 01 01 01
01 01 01 01 01 01 98 1c 20 88 30 00 18 50 3c 10
a4 00 20 00 35 00 00 1e 00 00 00 fc 00 4c 30 31
4e 38 41 0a 20 20 20 20 20 20 00 00 00 00 00 00
00 00 00 00 00 00 00 00 00 00 00 00 00 00 00 10
00 00 00 00 00 00 00 00 00 00 00 00 00 00 00 68

00 ff ff ff ff ff ff 00 4c ee c0 11 5c 8c 34 01
2b 20 01 03 81 11 0a 78 ea f8 d0 a0 54 47 8d 23
24 4d 54 00 00 00 01 01 01 01 01 01 01 01 01 01
01 01 01 01 01 01 98 1c 20 88 30 00 18 50 3c 10
a4 00 20 00 35 00 00 1e 00 00 00 fc 00 4c 30 31
4e 38 41 0a 20 20 20 20 20 20 00 00 00 00 00 00
00 00 00 00 00 00 00 00 00 00 00 00 00 00 00 10
00 00 00 00 00 00 00 00 00 00 00 00 00 00 00 68

----------------

Block 0, Base EDID:
  EDID Structure Version & Revision: 1.3
  Vendor & Product Identification:
    Manufacturer: SGN
    Model: 4544
    Serial Number: ...
    Made in: week 43 of 2022
  Basic Display Parameters & Features:
    Digital display
    DFP 1.x compatible TMDS
    Maximum image size: 17 cm x 10 cm
    Gamma: 2.20
    DPMS levels: Standby Suspend Off
    RGB color display
    First detailed timing is the preferred timing
  Color Characteristics:
    Red  : 0.6279, 0.3310
    Green: 0.2792, 0.5507
    Blue : 0.1396, 0.1416
    White: 0.3007, 0.3281
  Established Timings I & II: none
  Standard Timings: none
  Detailed Timing Descriptors:
    DTD 1:   800x1280   59.973258 Hz   5:8     78.205 kHz     73.200000 MHz (800 mm x 1280 mm)
                 Hfront   60 Hsync  16 Hback   60 Hpol P
                 Vfront   10 Vsync   4 Vback   10 Vpol P
    Display Product Name: 'L01N8A'
    Empty Descriptor
    Dummy Descriptor:
Checksum: 0x68

----------------

Failures:

Block 0, Base EDID:
  Detailed Timing Descriptor #1: Mismatch of image size 800x1280 mm vs display size 170x100 mm.
  Empty Descriptor: Use Dummy Descriptor instead of all zeroes.
  Missing Display Range Limits Descriptor.
EDID:
  Extension Block 1 started with EDID header, ignoring Extension Blocks >= 1.
  Base EDID: The DTD max image size is 800x1280mm, which is larger than the display size 170.0x100.0mm.

EDID conformity: FAIL
