edid-decode (hex):

00 ff ff ff ff ff ff 00 41 0c c3 04 01 01 01 01
13 1d 01 03 80 90 51 78 0a e6 92 a3 54 4a 99 26
0f 4a 4c 21 08 00 b3 00 95 00 a9 40 90 40 81 00
81 80 81 40 01 01 02 3a 80 18 71 38 2d 40 58 2c
45 00 a0 2a 53 00 00 1e 02 3a 80 d0 72 38 2d 40
10 2c 45 80 a0 2a 53 00 00 1e 00 00 00 fc 00 50
68 69 6c 69 70 73 20 46 54 56 0a 20 00 00 00 fd
00 30 3e 0f 46 3c 00 0a 20 20 20 20 20 20 01 a8

02 03 75 f1 5b 61 60 5d 5f 5e 10 1f 20 22 21 05
14 04 13 12 03 11 02 16 07 15 06 01 40 3f 29 2f
32 09 1f 07 15 07 50 3d 07 c0 57 06 01 5d 1f 01
67 04 03 83 01 00 00 6d 03 0c 00 20 00 38 3c 20
08 60 01 02 03 68 d8 5d c4 01 78 80 03 02 e2 00
49 e2 0f 03 e3 05 c0 00 e3 06 0d 01 eb 01 46 d0
00 44 97 43 9e 3f 27 bf e5 01 8b 84 90 01 e6 11
46 d0 00 70 00 00 00 00 00 00 00 00 00 00 00 26

00 ff ff ff ff ff ff 00 41 0c c3 04 01 01 01 01
13 1d 01 03 80 90 51 78 0a e6 92 a3 54 4a 99 26
0f 4a 4c 21 08 00 b3 00 95 00 a9 40 90 40 81 00
81 80 81 40 01 01 02 3a 80 18 71 38 2d 40 58 2c
45 00 a0 2a 53 00 00 1e 02 3a 80 d0 72 38 2d 40
10 2c 45 80 a0 2a 53 00 00 1e 00 00 00 fc 00 50
68 69 6c 69 70 73 20 46 54 56 0a 20 00 00 00 fd
00 30 3e 0f 46 3c 00 0a 20 20 20 20 20 20 01 a8

02 03 75 f1 5b 61 60 5d 5f 5e 10 1f 20 22 21 05
14 04 13 12 03 11 02 16 07 15 06 01 40 3f 29 2f
32 09 1f 07 15 07 50 3d 07 c0 57 06 01 5d 1f 01
67 04 03 83 01 00 00 6d 03 0c 00 20 00 38 3c 20
08 60 01 02 03 68 d8 5d c4 01 78 80 03 02 e2 00
49 e2 0f 03 e3 05 c0 00 e3 06 0d 01 eb 01 46 d0
00 44 97 43 9e 3f 27 bf e5 01 8b 84 90 01 e6 11
46 d0 00 70 00 00 00 00 00 00 00 00 00 00 00 26

----------------

Block 0, Base EDID:
  EDID Structure Version & Revision: 1.3
  Vendor & Product Identification:
    Manufacturer: PHL
    Model: 1219
    Serial Number: ...
    Made in: week 19 of 2019
  Basic Display Parameters & Features:
    Digital display
    Maximum image size: 144 cm x 81 cm
    Gamma: 2.20
    RGB color display
    First detailed timing is the preferred timing
  Color Characteristics:
    Red  : 0.6396, 0.3300
    Green: 0.2900, 0.5996
    Blue : 0.1503, 0.0595
    White: 0.2890, 0.2988
  Established Timings I & II:
    DMT 0x04:   640x480    59.940476 Hz   4:3     31.469 kHz     25.175000 MHz
    DMT 0x09:   800x600    60.316541 Hz   4:3     37.879 kHz     40.000000 MHz
    DMT 0x10:  1024x768    60.003840 Hz   4:3     48.363 kHz     65.000000 MHz
  Standard Timings:
    DMT 0x3a:  1680x1050   59.954250 Hz  16:10    65.290 kHz    146.250000 MHz
    DMT 0x2f:  1440x900    59.887445 Hz  16:10    55.935 kHz    106.500000 MHz
    DMT 0x33:  1600x1200   60.000000 Hz   4:3     75.000 kHz    162.000000 MHz
    DMT 0x2a:  1400x1050   59.978442 Hz   4:3     65.317 kHz    121.750000 MHz
    DMT 0x1c:  1280x800    59.810326 Hz  16:10    49.702 kHz     83.500000 MHz
    DMT 0x23:  1280x1024   60.019740 Hz   5:4     63.981 kHz    108.000000 MHz
    DMT 0x20:  1280x960    60.000000 Hz   4:3     60.000 kHz    108.000000 MHz
  Detailed Timing Descriptors:
    DTD 1:  1920x1080   60.000000 Hz  16:9     67.500 kHz    148.500000 MHz (1440 mm x 810 mm)
                 Hfront   88 Hsync  44 Hback  148 Hpol P
                 Vfront    4 Vsync   5 Vback   36 Vpol P
    DTD 2:  1920x1080   50.000000 Hz  16:9     56.250 kHz    148.500000 MHz (1440 mm x 810 mm)
                 Hfront  528 Hsync  44 Hback  148 Hpol P
                 Vfront    4 Vsync   5 Vback   36 Vpol P
    Display Product Name: 'Philips FTV'
    Display Range Limits:
      Monitor ranges (GTF): 48-62 Hz V, 15-70 kHz H, max dotclock 600 MHz
  Extension blocks: 1
Checksum: 0xa8

----------------

Block 1, CTA-861 Extension Block:
  Revision: 3
  Underscans IT Video Formats by default
  Basic audio support
  Supports YCbCr 4:4:4
  Supports YCbCr 4:2:2
  Native DTDs: 1
  Video Data Block:
    VIC  97:  3840x2160   60.000000 Hz  16:9    135.000 kHz    594.000000 MHz
    VIC  96:  3840x2160   50.000000 Hz  16:9    112.500 kHz    594.000000 MHz
    VIC  93:  3840x2160   24.000000 Hz  16:9     54.000 kHz    297.000000 MHz
    VIC  95:  3840x2160   30.000000 Hz  16:9     67.500 kHz    297.000000 MHz
    VIC  94:  3840x2160   25.000000 Hz  16:9     56.250 kHz    297.000000 MHz
    VIC  16:  1920x1080   60.000000 Hz  16:9     67.500 kHz    148.500000 MHz
    VIC  31:  1920x1080   50.000000 Hz  16:9     56.250 kHz    148.500000 MHz
    VIC  32:  1920x1080   24.000000 Hz  16:9     27.000 kHz     74.250000 MHz
    VIC  34:  1920x1080   30.000000 Hz  16:9     33.750 kHz     74.250000 MHz
    VIC  33:  1920x1080   25.000000 Hz  16:9     28.125 kHz     74.250000 MHz
    VIC   5:  1920x1080i  60.000000 Hz  16:9     33.750 kHz     74.250000 MHz
    VIC  20:  1920x1080i  50.000000 Hz  16:9     28.125 kHz     74.250000 MHz
    VIC   4:  1280x720    60.000000 Hz  16:9     45.000 kHz     74.250000 MHz
    VIC  19:  1280x720    50.000000 Hz  16:9     37.500 kHz     74.250000 MHz
    VIC  18:   720x576    50.000000 Hz  16:9     31.250 kHz     27.000000 MHz
    VIC   3:   720x480    59.940060 Hz  16:9     31.469 kHz     27.000000 MHz
    VIC  17:   720x576    50.000000 Hz   4:3     31.250 kHz     27.000000 MHz
    VIC   2:   720x480    59.940060 Hz   4:3     31.469 kHz     27.000000 MHz
    VIC  22:  1440x576i   50.000000 Hz  16:9     15.625 kHz     27.000000 MHz
    VIC   7:  1440x480i   59.940060 Hz  16:9     15.734 kHz     27.000000 MHz
    VIC  21:  1440x576i   50.000000 Hz   4:3     15.625 kHz     27.000000 MHz
    VIC   6:  1440x480i   59.940060 Hz   4:3     15.734 kHz     27.000000 MHz
    VIC   1:   640x480    59.940476 Hz   4:3     31.469 kHz     25.175000 MHz
    VIC  64:  1920x1080  100.000000 Hz  16:9    112.500 kHz    297.000000 MHz
    VIC  63:  1920x1080  120.000000 Hz  16:9    135.000 kHz    297.000000 MHz
    VIC  41:  1280x720   100.000000 Hz  16:9     75.000 kHz    148.500000 MHz
    VIC  47:  1280x720   120.000000 Hz  16:9     90.000 kHz    148.500000 MHz
  Audio Data Block:
    Linear PCM:
      Max channels: 2
      Supported sample rates (kHz): 96 88.2 48 44.1 32
      Supported sample sizes (bits): 24 20 16
    AC-3:
      Max channels: 6
      Supported sample rates (kHz): 48 44.1 32
      Maximum bit rate: 640 kb/s
    DTS:
      Max channels: 6
      Supported sample rates (kHz): 48 44.1 32
      Maximum bit rate: 1536 kb/s
    Enhanced AC-3 (DD+):
      Max channels: 8
      Supported sample rates (kHz): 48 44.1
      Supports Joint Object Coding
    DTS-HD:
      Max channels: 6
      Supported sample rates (kHz): 96 88.2 48 44.1 32
      Audio Format Code dependent value: 0x01
    MAT (MLP):
      Max channels: 8
      Supported sample rates (kHz): 48
      Supports Dolby TrueHD, object audio PCM and channel-based PCM
      Hash calculation not required for object audio PCM or channel-based PCM
  Speaker Allocation Data Block:
    FL/FR - Front Left/Right
  Vendor-Specific Data Block (HDMI), OUI 00-0C-03:
    Source physical address: 2.0.0.0
    DC_36bit
    DC_30bit
    DC_Y444
    Maximum TMDS clock: 300 MHz
    Extended HDMI video details:
      Base EDID image size indicates aspect ratio
      HDMI VICs:
        HDMI VIC 1:  3840x2160   30.000000 Hz  16:9     67.500 kHz    297.000000 MHz
        HDMI VIC 2:  3840x2160   25.000000 Hz  16:9     56.250 kHz    297.000000 MHz
        HDMI VIC 3:  3840x2160   24.000000 Hz  16:9     54.000 kHz    297.000000 MHz
  Vendor-Specific Data Block (HDMI Forum), OUI C4-5D-D8:
    Version: 1
    Maximum TMDS Character Rate: 600 MHz
    SCDC Present
    Supports 12-bits/component Deep Color 4:2:0 Pixel Encoding
    Supports 10-bits/component Deep Color 4:2:0 Pixel Encoding
    Supports Auto Low-Latency Mode
  Video Capability Data Block:
    YCbCr quantization: No Data
    RGB quantization: Selectable (via AVI Q)
    PT scan behavior: No Data
    IT scan behavior: Always Underscanned
    CE scan behavior: Always Overscanned
  YCbCr 4:2:0 Capability Map Data Block:
    VIC  97:  3840x2160   60.000000 Hz  16:9    135.000 kHz    594.000000 MHz
    VIC  96:  3840x2160   50.000000 Hz  16:9    112.500 kHz    594.000000 MHz
  Colorimetry Data Block:
    BT2020YCC
    BT2020RGB
  HDR Static Metadata Data Block:
    Electro optical transfer functions:
      Traditional gamma - SDR luminance range
      SMPTE ST2084
      Hybrid Log-Gamma
    Supported static metadata descriptors:
      Static metadata type 1
  Vendor-Specific Video Data Block (Dolby), OUI 00-D0-46:
    Version: 2 (12 bytes)
    Supports global dimming
    DM Version: 3.x
    Backlt Min Luma: 100 cd/m^2
    Interface: Standard + Low-Latency + Low-Latency-HDMI
    Supports 10b 12b 444: 10 bit
    Target Min PQ v2: 360 (0.23250339 cd/m^2)
    Target Max PQ v2: 2575 (320 cd/m^2)
    Unique Rx, Ry: 0.64062500, 0.33984375
    Unique Gx, Gy: 0.30859375, 0.62109375
    Unique Bx, By: 0.15234375, 0.05859375
  Vendor-Specific Video Data Block (HDR10+), OUI 90-84-8B:
    Application Version: 1
    Full Frame Peak Luminance Index: 0
    Peak Luminance Index: 0
  Vendor-Specific Audio Data Block (Dolby), OUI 00-D0-46:
    Version: 1 (7 bytes)
    Height speaker zone present
    Surround speaker zone present
    Center speaker zone present
Checksum: 0x26  Unused space in Extension Block: 10 bytes

----------------

Warnings:

Block 0, Base EDID:
  Vendor & Product Identification: The serial number is one of the known dummy values, it should probably be set to 0.
Block 1, CTA-861 Extension Block:
  Video Data Block: VIC 97 and the first DTD are not identical. Is this intended?
  Vendor-Specific Data Block (HDMI), OUI 00-0C-03: 'Indicates Aspect Ratio' is used for a small display (<= 255 cm), it is better to fill in the actual size
  Video Capability Data Block: Set Selectable YCbCr Quantization to avoid interop issues.
  Colorimetry Data Block: Set the sRGB colorimetry bit to avoid interop issues.
EDID:
  Base EDID: Some timings are out of range of the Monitor Ranges:
    Vertical Freq: 24.000 - 120.000 Hz (Monitor: 48.000 - 62.000 Hz)
    Horizontal Freq: 15.625 - 135.000 kHz (Monitor: 15.000 - 70.000 kHz)
  CTA-861: Native progressive resolution of 1920x1080 is smaller than the max preferred progressive resolution 3840x2160.

Failures:

Block 1, CTA-861 Extension Block:
  Vendor-Specific Data Block (HDMI Forum), OUI C4-5D-D8: HDMI VIC and related CTA VIC codes are present, but the UHD VIC bit is 0.
EDID:
  Extension Block 2 started with EDID header, ignoring Extension Blocks >= 2.

EDID conformity: FAIL
