edid-decode (hex):

00 ff ff ff ff ff ff 00 06 af ed 10 00 00 00 00
00 1a 01 04 95 22 13 78 02 2e 8e 95 58 59 93 29
25 53 5a 00 00 00 01 01 01 01 01 01 01 01 01 01
01 01 01 01 01 01 14 37 80 b4 70 38 26 40 6c 30
aa 00 58 c1 10 00 00 1a 24 2c 80 b8 70 38 26 40
6c 30 aa 00 58 c1 10 00 00 1a 00 00 00 fe 00 32
59 56 32 30 80 42 31 35 36 48 41 42 00 00 00 00
00 00 41 22 96 01 11 00 00 0a 01 0a 20 20 00 52

00 ff ff ff ff ff ff 00 06 af ed 10 00 00 00 00
00 1a 01 04 95 22 13 78 02 2e 8e 95 58 59 93 29
25 53 5a 00 00 00 01 01 01 01 01 01 01 01 01 01
01 01 01 01 01 01 14 37 80 b4 70 38 26 40 6c 30
aa 00 58 c1 10 00 00 1a 24 2c 80 b8 70 38 26 40
6c 30 aa 00 58 c1 10 00 00 1a 00 00 00 fe 00 32
59 56 32 30 80 42 31 35 36 48 41 42 00 00 00 00
00 00 41 22 96 01 11 00 00 0a 01 0a 20 20 00 52

----------------

Block 0, Base EDID:
  EDID Structure Version & Revision: 1.4
  Vendor & Product Identification:
    Manufacturer: AUO
    Model: 4333
    Made in: 2016
  Basic Display Parameters & Features:
    Digital display
    Bits per primary color channel: 6
    DisplayPort interface
    Maximum image size: 34 cm x 19 cm
    Gamma: 2.20
    Supported color formats: RGB 4:4:4
    First detailed timing includes the native pixel format and preferred refresh rate
  Color Characteristics:
    Red  : 0.5820, 0.3457
    Green: 0.3505, 0.5761
    Blue : 0.1621, 0.1445
    White: 0.3271, 0.3535
  Established Timings I & II: none
  Standard Timings: none
  Detailed Timing Descriptors:
    DTD 1:  1920x1080   60.056223 Hz  16:9     67.143 kHz    141.000000 MHz (344 mm x 193 mm)
                 Hfront  108 Hsync  48 Hback   24 Hpol P
                 Vfront   10 Vsync  10 Vback   18 Vpol N
    DTD 2:  1920x1080   48.038662 Hz  16:9     53.707 kHz    113.000000 MHz (344 mm x 193 mm)
                 Hfront  108 Hsync  48 Hback   28 Hpol P
                 Vfront   10 Vsync  10 Vback   18 Vpol N
    Alphanumeric Data String: '2YV20.B156HAB'
    Manufacturer-Specified Display Descriptor (0x00): 00 00 00 00 41 22 96 01 11 00 00 0a 01 0a 20 20 '....A"........  '
Checksum: 0x52

----------------

Warnings:

Block 0, Base EDID:
  Alphanumeric Data String: Non-ASCII character 0x80 at position 5, can cause problems.
  Missing Display Product Name.

Failures:

EDID:
  Extension Block 1 started with EDID header, ignoring Extension Blocks >= 1.

EDID conformity: FAIL
