edid-decode (hex):

00 ff ff ff ff ff ff 00 06 af ed 10 00 00 00 00
00 16 01 04 90 22 13 78 02 d1 15 9e 59 53 9b 27
1e 50 54 00 00 00 01 01 01 01 01 01 01 01 01 01
01 01 01 01 01 01 34 35 80 a6 70 38 08 40 30 64
31 00 58 c1 10 00 00 1a 78 23 80 a6 70 38 08 40
30 64 31 00 58 c1 10 00 00 1a 00 00 00 fe 00 46
54 4b 4b 4e 80 42 31 35 36 48 54 46 00 00 00 00
00 00 41 22 96 01 11 00 00 02 01 0a 20 20 00 e2

----------------

Block 0, Base EDID:
  EDID Structure Version & Revision: 1.4
  Vendor & Product Identification:
    Manufacturer: AUO
    Model: 4333
    Made in: 2012
  Basic Display Parameters & Features:
    Digital display
    Bits per primary color channel: 6
    Digital interface is not defined
    Maximum image size: 34 cm x 19 cm
    Gamma: 2.20
    Supported color formats: RGB 4:4:4
    First detailed timing includes the native pixel format and preferred refresh rate
  Color Characteristics:
    Red  : 0.6201, 0.3486
    Green: 0.3242, 0.6064
    Blue : 0.1523, 0.1181
    White: 0.3134, 0.3291
  Established Timings I & II: none
  Standard Timings: none
  Detailed Timing Descriptors:
    DTD 1:  1920x1080   60.011421 Hz  16:9     65.292 kHz    136.200000 MHz (344 mm x 193 mm)
                 Hfront   48 Hsync 100 Hback   18 Hpol P
                 Vfront    3 Vsync   1 Vback    4 Vpol N
    DTD 2:  1920x1080   40.007614 Hz  16:9     43.528 kHz     90.800000 MHz (344 mm x 193 mm)
                 Hfront   48 Hsync 100 Hback   18 Hpol P
                 Vfront    3 Vsync   1 Vback    4 Vpol N
    Alphanumeric Data String: 'FTKKN.B156HTF'
    Manufacturer-Specified Display Descriptor (0x00): 00 00 00 00 41 22 96 01 11 00 00 02 01 0a 20 20 '....A"........  '
Checksum: 0xe2

----------------

Warnings:

Block 0, Base EDID:
  Alphanumeric Data String: Non-ASCII character 0x80 at position 5, can cause problems.
  Missing Display Product Name.

EDID conformity: PASS
