edid-decode (hex):

00 ff ff ff ff ff ff 00 08 59 48 02 68 04 00 00
27 1b 01 04 a5 35 1e 78 37 64 35 a5 54 4f 9e 27
12 50 54 bf ef 80 b3 00 a9 40 95 00 90 40 81 80
81 40 81 c0 01 01 86 6f 80 a0 70 38 40 40 30 20
35 00 13 2b 21 00 00 1e 02 3a 80 18 71 38 2d 40
58 2c 45 00 13 2b 21 00 00 1e 00 00 00 fd 00 30
92 b4 b4 22 01 0a 20 20 20 20 20 20 00 00 00 fc
00 4e 53 2d 50 4d 47 32 34 38 0a 20 20 20 01 37

02 03 19 f1 4c bf 40 10 05 04 03 07 1f 13 12 16
01 23 09 7f 07 83 01 00 00 02 3a 80 18 71 38 2d
40 58 2c 45 00 13 2b 21 00 00 1e 08 82 80 50 70
38 4d 40 08 20 f8 0c 13 2b 21 00 00 1c 01 1d 00
72 51 d0 1e 20 6e 28 55 00 13 2b 21 00 00 1e 8c
0a d0 8a 20 e0 2d 10 10 3e 96 00 13 2b 21 00 00
18 6d 58 80 50 70 38 35 40 08 20 78 08 13 2b 21
00 00 1c 00 00 00 00 00 00 00 00 00 00 00 00 d8

00 ff ff ff ff ff ff 00 08 59 48 02 68 04 00 00
27 1b 01 04 a5 35 1e 78 37 64 35 a5 54 4f 9e 27
12 50 54 bf ef 80 b3 00 a9 40 95 00 90 40 81 80
81 40 81 c0 01 01 86 6f 80 a0 70 38 40 40 30 20
35 00 13 2b 21 00 00 1e 02 3a 80 18 71 38 2d 40
58 2c 45 00 13 2b 21 00 00 1e 00 00 00 fd 00 30
92 b4 b4 22 01 0a 20 20 20 20 20 20 00 00 00 fc
00 4e 53 2d 50 4d 47 32 34 38 0a 20 20 20 01 37

02 03 19 f1 4c bf 40 10 05 04 03 07 1f 13 12 16
01 23 09 7f 07 83 01 00 00 02 3a 80 18 71 38 2d
40 58 2c 45 00 13 2b 21 00 00 1e 08 82 80 50 70
38 4d 40 08 20 f8 0c 13 2b 21 00 00 1c 01 1d 00
72 51 d0 1e 20 6e 28 55 00 13 2b 21 00 00 1e 8c
0a d0 8a 20 e0 2d 10 10 3e 96 00 13 2b 21 00 00
18 6d 58 80 50 70 38 35 40 08 20 78 08 13 2b 21
00 00 1c 00 00 00 00 00 00 00 00 00 00 00 00 d8

----------------

Block 0, Base EDID:
  EDID Structure Version & Revision: 1.4
  Vendor & Product Identification:
    Manufacturer: BBY
    Model: 584
    Serial Number: ...
    Made in: week 39 of 2017
  Basic Display Parameters & Features:
    Digital display
    Bits per primary color channel: 8
    DisplayPort interface
    Maximum image size: 53 cm x 30 cm
    Gamma: 2.20
    DPMS levels: Off
    Supported color formats: RGB 4:4:4, YCrCb 4:2:2
    Default (sRGB) color space is primary color space
    First detailed timing includes the native pixel format and preferred refresh rate
    Display supports continuous frequencies
  Color Characteristics:
    Red  : 0.6455, 0.3300
    Green: 0.3095, 0.6171
    Blue : 0.1523, 0.0732
    White: 0.3134, 0.3291
  Established Timings I & II:
    IBM     :   720x400    70.081663 Hz   9:5     31.467 kHz     28.320000 MHz
    DMT 0x04:   640x480    59.940476 Hz   4:3     31.469 kHz     25.175000 MHz
    Apple   :   640x480    66.666667 Hz   4:3     35.000 kHz     30.240000 MHz
    DMT 0x05:   640x480    72.808802 Hz   4:3     37.861 kHz     31.500000 MHz
    DMT 0x06:   640x480    75.000000 Hz   4:3     37.500 kHz     31.500000 MHz
    DMT 0x08:   800x600    56.250000 Hz   4:3     35.156 kHz     36.000000 MHz
    DMT 0x09:   800x600    60.316541 Hz   4:3     37.879 kHz     40.000000 MHz
    DMT 0x0a:   800x600    72.187572 Hz   4:3     48.077 kHz     50.000000 MHz
    DMT 0x0b:   800x600    75.000000 Hz   4:3     46.875 kHz     49.500000 MHz
    Apple   :   832x624    74.551266 Hz   4:3     49.726 kHz     57.284000 MHz
    DMT 0x10:  1024x768    60.003840 Hz   4:3     48.363 kHz     65.000000 MHz
    DMT 0x11:  1024x768    70.069359 Hz   4:3     56.476 kHz     75.000000 MHz
    DMT 0x12:  1024x768    75.028582 Hz   4:3     60.023 kHz     78.750000 MHz
    DMT 0x24:  1280x1024   75.024675 Hz   5:4     79.976 kHz    135.000000 MHz
    Apple   :  1152x870    75.061550 Hz 192:145   68.681 kHz    100.000000 MHz
  Standard Timings:
    DMT 0x3a:  1680x1050   59.954250 Hz  16:10    65.290 kHz    146.250000 MHz
    DMT 0x33:  1600x1200   60.000000 Hz   4:3     75.000 kHz    162.000000 MHz
    DMT 0x2f:  1440x900    59.887445 Hz  16:10    55.935 kHz    106.500000 MHz
    DMT 0x2a:  1400x1050   59.978442 Hz   4:3     65.317 kHz    121.750000 MHz
    DMT 0x23:  1280x1024   60.019740 Hz   5:4     63.981 kHz    108.000000 MHz
    DMT 0x20:  1280x960    60.000000 Hz   4:3     60.000 kHz    108.000000 MHz
    DMT 0x55:  1280x720    60.000000 Hz  16:9     45.000 kHz     74.250000 MHz
  Detailed Timing Descriptors:
    DTD 1:  1920x1080  119.982181 Hz  16:9    137.260 kHz    285.500000 MHz (531 mm x 299 mm)
                 Hfront   48 Hsync  32 Hback   80 Hpol P
                 Vfront    3 Vsync   5 Vback   56 Vpol P
    DTD 2:  1920x1080   60.000000 Hz  16:9     67.500 kHz    148.500000 MHz (531 mm x 299 mm)
                 Hfront   88 Hsync  44 Hback  148 Hpol P
                 Vfront    4 Vsync   5 Vback   36 Vpol P
    Display Range Limits:
      Monitor ranges (Range Limits Only): 48-146 Hz V, 180-180 kHz H, max dotclock 340 MHz
    Display Product Name: 'NS-PMG248'
  Extension blocks: 1
Checksum: 0x37

----------------

Block 1, CTA-861 Extension Block:
  Revision: 3
  Underscans IT Video Formats by default
  Basic audio support
  Supports YCbCr 4:4:4
  Supports YCbCr 4:2:2
  Native DTDs: 1
  Video Data Block:
    VIC  63:  1920x1080  120.000000 Hz  16:9    135.000 kHz    297.000000 MHz (native)
    VIC  64:  1920x1080  100.000000 Hz  16:9    112.500 kHz    297.000000 MHz
    VIC  16:  1920x1080   60.000000 Hz  16:9     67.500 kHz    148.500000 MHz
    VIC   5:  1920x1080i  60.000000 Hz  16:9     33.750 kHz     74.250000 MHz
    VIC   4:  1280x720    60.000000 Hz  16:9     45.000 kHz     74.250000 MHz
    VIC   3:   720x480    59.940060 Hz  16:9     31.469 kHz     27.000000 MHz
    VIC   7:  1440x480i   59.940060 Hz  16:9     15.734 kHz     27.000000 MHz
    VIC  31:  1920x1080   50.000000 Hz  16:9     56.250 kHz    148.500000 MHz
    VIC  19:  1280x720    50.000000 Hz  16:9     37.500 kHz     74.250000 MHz
    VIC  18:   720x576    50.000000 Hz  16:9     31.250 kHz     27.000000 MHz
    VIC  22:  1440x576i   50.000000 Hz  16:9     15.625 kHz     27.000000 MHz
    VIC   1:   640x480    59.940476 Hz   4:3     31.469 kHz     25.175000 MHz
  Audio Data Block:
    Linear PCM:
      Max channels: 2
      Supported sample rates (kHz): 192 176.4 96 88.2 48 44.1 32
      Supported sample sizes (bits): 24 20 16
  Speaker Allocation Data Block:
    FL/FR - Front Left/Right
  Detailed Timing Descriptors:
    DTD 3:  1920x1080   60.000000 Hz  16:9     67.500 kHz    148.500000 MHz (531 mm x 299 mm)
                 Hfront   88 Hsync  44 Hback  148 Hpol P
                 Vfront    4 Vsync   5 Vback   36 Vpol P
    DTD 4:  1920x1080  143.854797 Hz  16:9    166.440 kHz    332.880000 MHz (531 mm x 299 mm)
                 Hfront    8 Hsync  32 Hback   40 Hpol N
                 Vfront   63 Vsync   8 Vback    6 Vpol P
    DTD 5:  1280x720    60.000000 Hz  16:9     45.000 kHz     74.250000 MHz (531 mm x 299 mm)
                 Hfront  110 Hsync  40 Hback  220 Hpol P
                 Vfront    5 Vsync   5 Vback   20 Vpol P
    DTD 6:   720x480    59.940060 Hz   3:2     31.469 kHz     27.000000 MHz (531 mm x 299 mm)
                 Hfront   16 Hsync  62 Hback   60 Hpol N
                 Vfront    9 Vsync   6 Vback   30 Vpol N
    DTD 7:  1920x1080   99.898500 Hz  16:9    113.185 kHz    226.370000 MHz (531 mm x 299 mm)
                 Hfront    8 Hsync  32 Hback   40 Hpol N
                 Vfront   39 Vsync   8 Vback    6 Vpol P
Checksum: 0xd8  Unused space in Extension Block: 12 bytes

----------------

Warnings:

Block 1, CTA-861 Extension Block:
  Video Data Block: VIC 63 and the first DTD are not identical. Is this intended?
  Detailed Timing Descriptor #6: Image size is 531x299 mm, but based on the picture AR it should be 448x299 mm.
EDID:
  Base EDID: Some timings are out of range of the Monitor Ranges:
    Horizontal Freq: 15.625 - 166.440 kHz (Monitor: 180.000 - 180.000 kHz)

Failures:

Block 0, Base EDID:
  Basic Display Parameters & Features: sRGB is signaled, but the chromaticities do not match.
Block 1, CTA-861 Extension Block:
  Missing VCDB, needed for Set Selectable RGB Quantization to avoid interop issues.
EDID:
  Extension Block 2 started with EDID header, ignoring Extension Blocks >= 2.

EDID conformity: FAIL
