edid-decode (hex):

00 ff ff ff ff ff ff 00 06 af ae 71 00 00 00 00
00 21 01 04 a5 22 13 78 03 6e 85 93 58 58 92 28
1e 50 54 00 00 00 01 01 01 01 01 01 01 01 01 01
01 01 01 01 01 01 78 37 80 b4 70 38 2e 40 6c 30
aa 00 58 c1 10 00 00 18 00 00 00 0f 00 00 00 00
00 00 00 00 00 00 00 00 00 20 00 00 00 fd 00 28
3c 44 44 0e 01 0a 20 20 20 20 20 20 00 00 00 fe
00 42 31 35 36 48 41 4e 30 32 2e 31 20 0a 01 e5

70 20 79 02 00 22 00 14 af 2a 02 84 7f 07 b3 00
6b 80 2f 00 37 04 2d 00 09 00 09 00 25 01 09 af
2a 02 af 2a 02 28 3c 80 81 00 10 72 1a 00 00 03
01 28 3c 00 00 53 59 53 59 3c 00 00 00 00 00 00
00 00 00 00 00 00 00 00 00 00 00 00 00 00 00 00
00 00 00 00 00 00 00 00 00 00 00 00 00 00 00 00
00 00 00 00 00 00 00 00 00 00 00 00 00 00 00 00
00 00 00 00 00 00 00 00 00 00 00 00 00 00 21 90

00 ff ff ff ff ff ff 00 06 af ae 71 00 00 00 00
00 21 01 04 a5 22 13 78 03 6e 85 93 58 58 92 28
1e 50 54 00 00 00 01 01 01 01 01 01 01 01 01 01
01 01 01 01 01 01 78 37 80 b4 70 38 2e 40 6c 30
aa 00 58 c1 10 00 00 18 00 00 00 0f 00 00 00 00
00 00 00 00 00 00 00 00 00 20 00 00 00 fd 00 28
3c 44 44 0e 01 0a 20 20 20 20 20 20 00 00 00 fe
00 42 31 35 36 48 41 4e 30 32 2e 31 20 0a 01 e5

70 20 79 02 00 22 00 14 af 2a 02 84 7f 07 b3 00
6b 80 2f 00 37 04 2d 00 09 00 09 00 25 01 09 af
2a 02 af 2a 02 28 3c 80 81 00 10 72 1a 00 00 03
01 28 3c 00 00 53 59 53 59 3c 00 00 00 00 00 00
00 00 00 00 00 00 00 00 00 00 00 00 00 00 00 00
00 00 00 00 00 00 00 00 00 00 00 00 00 00 00 00
00 00 00 00 00 00 00 00 00 00 00 00 00 00 00 00
00 00 00 00 00 00 00 00 00 00 00 00 00 00 21 90

----------------

Block 0, Base EDID:
  EDID Structure Version & Revision: 1.4
  Vendor & Product Identification:
    Manufacturer: AUO
    Model: 29102
    Made in: 2023
  Basic Display Parameters & Features:
    Digital display
    Bits per primary color channel: 8
    DisplayPort interface
    Maximum image size: 34 cm x 19 cm
    Gamma: 2.20
    Supported color formats: RGB 4:4:4
    First detailed timing includes the native pixel format and preferred refresh rate
    Display supports continuous frequencies
  Color Characteristics:
    Red  : 0.5751, 0.3457
    Green: 0.3466, 0.5722
    Blue : 0.1582, 0.1171
    White: 0.3134, 0.3291
  Established Timings I & II: none
  Standard Timings: none
  Detailed Timing Descriptors:
    DTD 1:  1920x1080   60.052440 Hz  16:9     67.619 kHz    142.000000 MHz (344 mm x 193 mm)
                 Hfront  108 Hsync  48 Hback   24 Hpol N
                 Vfront   10 Vsync  10 Vback   26 Vpol N
    Manufacturer-Specified Display Descriptor (0x0f): 00 0f 00 00 00 00 00 00 00 00 00 00 00 00 00 20 '............... '
    Display Range Limits:
      Monitor ranges (Range Limits Only): 40-60 Hz V, 68-68 kHz H, max dotclock 140 MHz
    Alphanumeric Data String: 'B156HAN02.1 '
  Extension blocks: 1
Checksum: 0xe5

----------------

Block 1, DisplayID Extension Block:
  Version: 2.0
  Extension Count: 0
  Display Product Primary Use Case: None of the listed primary use cases; generic display
  Video Timing Modes Type 7 - Detailed Timings Data Block:
    DTD:  1920x1080   60.052440 Hz  16:9     67.619 kHz    142.000000 MHz (aspect 16:9, no 3D stereo, preferred)
               Hfront  108 Hsync  48 Hback   24 Hpol P
               Vfront   10 Vsync  10 Vback   26 Vpol N
  Dynamic Video Timing Range Limits Data Block:
    Minimum Pixel Clock: 142000 kHz
    Maximum Pixel Clock: 142000 kHz
    Minimum Vertical Refresh Rate: 40 Hz
    Maximum Vertical Refresh Rate: 60 Hz
    Seamless Dynamic Video Timing Support: Yes
  CTA-861 DisplayID Data Block:
  Vendor-Specific Data Block (AMD), OUI 00-00-1A:
    Version: 3
    Feature Caps: 0x01
    Minimum Refresh Rate: 40 Hz
    Maximum Refresh Rate: 60 Hz
    Flags 1.x: 0x00
    Flags 2.x: 0x00
    Maximum luminance: 83 (301.833 cd/m^2)
    Minimum luminance: 89 (0.368 cd/m^2)
    Unknown: 0x53 0x59
  Checksum: 0x21
Checksum: 0x90

----------------

Block 2, Unknown EDID Extension Block 0x00:
  00 ff ff ff ff ff ff 00 06 af ae 71 00 00 00 00 '...........q....'
  00 21 01 04 a5 22 13 78 03 6e 85 93 58 58 92 28 '.!...".x.n..XX.('
  1e 50 54 00 00 00 01 01 01 01 01 01 01 01 01 01 '.PT.............'
  01 01 01 01 01 01 78 37 80 b4 70 38 2e 40 6c 30 '......x7..p8.@l0'
  aa 00 58 c1 10 00 00 18 00 00 00 0f 00 00 00 00 '..X.............'
  00 00 00 00 00 00 00 00 00 20 00 00 00 fd 00 28 '......... .....('
  3c 44 44 0e 01 0a 20 20 20 20 20 20 00 00 00 fe '<DD...      ....'
  00 42 31 35 36 48 41 4e 30 32 2e 31 20 0a 01 e5 '.B156HAN02.1 ...'
Checksum: 0xe5

----------------

Block 3, DisplayID Extension Block:
  Version: 2.0
  Extension Count: 0
  Video Timing Modes Type 7 - Detailed Timings Data Block:
    DTD:  1920x1080   60.052440 Hz  16:9     67.619 kHz    142.000000 MHz (aspect 16:9, no 3D stereo, preferred)
               Hfront  108 Hsync  48 Hback   24 Hpol P
               Vfront   10 Vsync  10 Vback   26 Vpol N
  Dynamic Video Timing Range Limits Data Block:
    Minimum Pixel Clock: 142000 kHz
    Maximum Pixel Clock: 142000 kHz
    Minimum Vertical Refresh Rate: 40 Hz
    Maximum Vertical Refresh Rate: 60 Hz
    Seamless Dynamic Video Timing Support: Yes
  CTA-861 DisplayID Data Block:
  Vendor-Specific Data Block (AMD), OUI 00-00-1A:
    Version: 3
    Feature Caps: 0x01
    Minimum Refresh Rate: 40 Hz
    Maximum Refresh Rate: 60 Hz
    Flags 1.x: 0x00
    Flags 2.x: 0x00
    Maximum luminance: 83 (301.833 cd/m^2)
    Minimum luminance: 89 (0.368 cd/m^2)
    Unknown: 0x53 0x59
  Checksum: 0x21
Checksum: 0x90

----------------

Warnings:

Block 0, Base EDID:
  Missing Display Product Name.
EDID:
  Base EDID: Some timings are out of range of the Monitor Ranges:
    Maximum Clock: 142.000 MHz (Monitor: 140.000 MHz)
    Could be due to a Monitor Range off-by-one rounding issue

Failures:

Block 0, Base EDID:
  Alphanumeric Data String: One or more trailing spaces before newline.
Block 1, DisplayID Extension Block:
  Expected 0 DisplayID Extension Block, but got 1.
  Vendor-Specific Data Block (AMD), OUI 00-00-1A: Length is 16 instead of 19.
Block 2, Base EDID:
  Unknown Extension Block.
Block 3, DisplayID Extension Block:
  Product Type should be 0 in extension block.
  Vendor-Specific Data Block (AMD), OUI 00-00-1A: Length is 16 instead of 19.
EDID:
  Base EDID: EDID specified 1 extension block(s), but found 3 extension block(s).
  DisplayID: Missing DisplayID Display Parameters Data Block.

EDID conformity: FAIL
