edid-decode (hex):

00 ff ff ff ff ff ff 00 30 ae 20 90 00 00 00 00
2a 1a 01 04 95 1f 11 78 02 8e d5 94 57 53 93 27
21 50 54 00 00 00 01 01 01 01 01 01 01 01 01 01
01 01 01 01 01 01 da 1d 56 e2 50 00 20 30 44 2d
47 00 35 ad 10 00 00 18 00 00 00 fe 00 0a 20 20
20 20 20 20 20 20 20 20 20 20 00 00 00 fe 00 4c
45 4e 4f 56 4f 0a 20 20 20 20 20 20 00 00 00 fe
00 4c 45 4e 31 34 30 48 44 20 20 20 20 20 00 6e

00 ff ff ff ff ff ff 00 30 ae 20 90 00 00 00 00
2a 1a 01 04 95 1f 11 78 02 8e d5 94 57 53 93 27
21 50 54 00 00 00 01 01 01 01 01 01 01 01 01 01
01 01 01 01 01 01 da 1d 56 e2 50 00 20 30 44 2d
47 00 35 ad 10 00 00 18 00 00 00 fe 00 0a 20 20
20 20 20 20 20 20 20 20 20 20 00 00 00 fe 00 4c
45 4e 4f 56 4f 0a 20 20 20 20 20 20 00 00 00 fe
00 4c 45 4e 31 34 30 48 44 20 20 20 20 20 00 6e

----------------

Block 0, Base EDID:
  EDID Structure Version & Revision: 1.4
  Vendor & Product Identification:
    Manufacturer: LEN
    Model: 36896
    Made in: week 42 of 2016
  Basic Display Parameters & Features:
    Digital display
    Bits per primary color channel: 6
    DisplayPort interface
    Maximum image size: 31 cm x 17 cm
    Gamma: 2.20
    Supported color formats: RGB 4:4:4
    First detailed timing includes the native pixel format and preferred refresh rate
  Color Characteristics:
    Red  : 0.5800, 0.3398
    Green: 0.3271, 0.5761
    Blue : 0.1552, 0.1298
    White: 0.3134, 0.3291
  Established Timings I & II: none
  Standard Timings: none
  Detailed Timing Descriptors:
    DTD 1:  1366x768    60.003141 Hz 683:384   48.003 kHz     76.420000 MHz (309 mm x 173 mm)
                 Hfront   68 Hsync  45 Hback  113 Hpol N
                 Vfront    4 Vsync   7 Vback   21 Vpol N
    Alphanumeric Data String: ''
    Alphanumeric Data String: 'LENOVO'
    Alphanumeric Data String: 'LEN140HD     '
Checksum: 0x6e

----------------

Warnings:

Block 0, Base EDID:
  Missing Display Product Name.

Failures:

Block 0, Base EDID:
  Alphanumeric Data String: Empty string.
  Alphanumeric Data String: No newline, but one or more trailing spaces.
EDID:
  Extension Block 1 started with EDID header, ignoring Extension Blocks >= 1.

EDID conformity: FAIL
