edid-decode (hex):

00 ff ff ff ff ff ff 00 54 e4 10 24 26 11 21 20
1f 1d 01 03 80 35 1e 78 ee ee 91 a3 54 4c 99 26
0f 50 54 21 08 00 d1 c0 d1 00 71 4f a9 40 81 80
77 80 01 01 01 01 56 5e 00 a0 a0 a0 29 50 30 20
35 00 0f 28 21 00 00 1a 00 00 00 fc 00 43 44 32
34 30 51 0a 20 20 20 20 20 20 00 00 00 10 00 41
72 74 69 73 74 20 32 34 52 50 72 6f 00 00 00 fd
00 38 56 1e 71 1e 00 0a 20 20 20 20 20 20 01 7a

02 03 1e c1 45 5a 04 10 4c 5a 23 09 7f 07 83 01
00 00 67 03 0c 00 10 00 38 3d e3 05 03 01 02 3a
80 18 71 38 2d 40 58 2c 25 00 0f 28 21 00 00 1e
00 00 00 00 00 00 00 00 00 00 00 00 00 00 00 00
00 00 00 00 00 00 00 00 00 00 00 00 00 00 00 00
00 00 00 00 00 00 00 00 00 00 00 00 00 00 00 00
00 00 00 00 00 00 00 00 00 00 00 00 00 00 00 00
00 00 00 00 00 00 00 00 00 00 00 00 00 00 00 9d

00 ff ff ff ff ff ff 00 54 e4 10 24 26 11 21 20
1f 1d 01 03 80 35 1e 78 ee ee 91 a3 54 4c 99 26
0f 50 54 21 08 00 d1 c0 d1 00 71 4f a9 40 81 80
77 80 01 01 01 01 56 5e 00 a0 a0 a0 29 50 30 20
35 00 0f 28 21 00 00 1a 00 00 00 fc 00 43 44 32
34 30 51 0a 20 20 20 20 20 20 00 00 00 10 00 41
72 74 69 73 74 20 32 34 52 50 72 6f 00 00 00 fd
00 38 56 1e 71 1e 00 0a 20 20 20 20 20 20 01 7a

02 03 1e c1 45 5a 04 10 4c 5a 23 09 7f 07 83 01
00 00 67 03 0c 00 10 00 38 3d e3 05 03 01 02 3a
80 18 71 38 2d 40 58 2c 25 00 0f 28 21 00 00 1e
00 00 00 00 00 00 00 00 00 00 00 00 00 00 00 00
00 00 00 00 00 00 00 00 00 00 00 00 00 00 00 00
00 00 00 00 00 00 00 00 00 00 00 00 00 00 00 00
00 00 00 00 00 00 00 00 00 00 00 00 00 00 00 00
00 00 00 00 00 00 00 00 00 00 00 00 00 00 00 9d

----------------

Block 0, Base EDID:
  EDID Structure Version & Revision: 1.3
  Vendor & Product Identification:
    Manufacturer: UGD
    Model: 9232
    Serial Number: ...
    Made in: week 31 of 2019
  Basic Display Parameters & Features:
    Digital display
    Maximum image size: 53 cm x 30 cm
    Gamma: 2.20
    DPMS levels: Standby Suspend Off
    RGB color display
    Default (sRGB) color space is primary color space
    First detailed timing is the preferred timing
  Color Characteristics:
    Red  : 0.6396, 0.3300
    Green: 0.2998, 0.5996
    Blue : 0.1503, 0.0595
    White: 0.3125, 0.3291
  Established Timings I & II:
    DMT 0x04:   640x480    59.940476 Hz   4:3     31.469 kHz     25.175000 MHz
    DMT 0x09:   800x600    60.316541 Hz   4:3     37.879 kHz     40.000000 MHz
    DMT 0x10:  1024x768    60.003840 Hz   4:3     48.363 kHz     65.000000 MHz
  Standard Timings:
    DMT 0x52:  1920x1080   60.000000 Hz  16:9     67.500 kHz    148.500000 MHz
    DMT 0x45:  1920x1200   59.884600 Hz  16:10    74.556 kHz    193.250000 MHz
    DMT 0x15:  1152x864    75.000000 Hz   4:3     67.500 kHz    108.000000 MHz
    DMT 0x33:  1600x1200   60.000000 Hz   4:3     75.000 kHz    162.000000 MHz
    DMT 0x23:  1280x1024   60.019740 Hz   5:4     63.981 kHz    108.000000 MHz
    GTF     :  1200x960    60.000000 Hz   5:4     59.640 kHz     95.424000 MHz
  Detailed Timing Descriptors:
    DTD 1:  2560x1440   59.950550 Hz  16:9     88.787 kHz    241.500000 MHz (527 mm x 296 mm)
                 Hfront   48 Hsync  32 Hback   80 Hpol P
                 Vfront    3 Vsync   5 Vback   33 Vpol N
    Display Product Name: 'CD240Q'
    Dummy Descriptor:
    Display Range Limits:
      Monitor ranges (GTF): 56-86 Hz V, 30-113 kHz H, max dotclock 300 MHz
  Extension blocks: 1
Checksum: 0x7a

----------------

Block 1, CTA-861 Extension Block:
  Revision: 3
  Underscans IT Video Formats by default
  Basic audio support
  Native DTDs: 1
  Video Data Block:
    VIC  90:  2560x1080   60.000000 Hz  64:27    66.000 kHz    198.000000 MHz
    VIC   4:  1280x720    60.000000 Hz  16:9     45.000 kHz     74.250000 MHz
    VIC  16:  1920x1080   60.000000 Hz  16:9     67.500 kHz    148.500000 MHz
    VIC  76:  1920x1080   60.000000 Hz  64:27    67.500 kHz    148.500000 MHz
    VIC  90:  2560x1080   60.000000 Hz  64:27    66.000 kHz    198.000000 MHz
  Audio Data Block:
    Linear PCM:
      Max channels: 2
      Supported sample rates (kHz): 192 176.4 96 88.2 48 44.1 32
      Supported sample sizes (bits): 24 20 16
  Speaker Allocation Data Block:
    FL/FR - Front Left/Right
  Vendor-Specific Data Block (HDMI), OUI 00-0C-03:
    Source physical address: 1.0.0.0
    DC_36bit
    DC_30bit
    DC_Y444
    Maximum TMDS clock: 305 MHz
  Colorimetry Data Block:
    xvYCC601
    xvYCC709
    Gamut Boundary Description Metadata Profile P0
  Detailed Timing Descriptors:
    DTD 2:  1920x1080   60.000000 Hz  16:9     67.500 kHz    148.500000 MHz (527 mm x 296 mm)
                 Hfront   88 Hsync  44 Hback  148 Hpol P
                 Vfront    2 Vsync   5 Vback   38 Vpol P
Checksum: 0x9d  Unused space in Extension Block: 79 bytes

----------------

Warnings:

Block 1, CTA-861 Extension Block:
  Video Data Block: VIC 90 and the first DTD are not identical. Is this intended?
  Detailed Timing Descriptor #2: DTD is similar but not identical to VIC 16.

Failures:

Block 0, Base EDID:
  Dummy Descriptor: Dummy block filled with garbage.
Block 1, CTA-861 Extension Block:
  Video Data Block: Duplicate VIC 90.
  Missing VCDB, needed for Set Selectable RGB Quantization to avoid interop issues.
EDID:
  Extension Block 2 started with EDID header, ignoring Extension Blocks >= 2.

EDID conformity: FAIL
