edid-decode (hex):

00 ff ff ff ff ff ff 00 41 0c 75 d0 40 e2 01 00
01 14 01 03 1c 30 1b 78 2e 49 ab 9f 58 56 9e 26
0b 47 4a bf ee 00 81 c0 81 00 01 01 01 01 01 01
01 01 01 01 01 01 20 21 50 a0 51 00 1e 30 48 88
35 00 dd 0c 11 00 00 18 1a 36 80 a0 70 38 1f 40
30 20 35 00 dd 0c 11 00 00 1c 00 00 00 fc 00 50
48 49 32 36 50 46 4c 33 34 30 35 0a 00 00 00 fd
00 38 4c 1e 55 10 00 0a 20 20 20 20 20 20 00 4b

00 ff ff ff ff ff ff 00 41 0c 75 d0 40 e2 01 00
01 14 01 03 1c 30 1b 78 2e 49 ab 9f 58 56 9e 26
0b 47 4a bf ee 00 81 c0 81 00 01 01 01 01 01 01
01 01 01 01 01 01 20 21 50 a0 51 00 1e 30 48 88
35 00 dd 0c 11 00 00 18 1a 36 80 a0 70 38 1f 40
30 20 35 00 dd 0c 11 00 00 1c 00 00 00 fc 00 50
48 49 32 36 50 46 4c 33 34 30 35 0a 00 00 00 fd
00 38 4c 1e 55 10 00 0a 20 20 20 20 20 20 00 4b

----------------

Block 0, Base EDID:
  EDID Structure Version & Revision: 1.3
  Vendor & Product Identification:
    Manufacturer: PHL
    Model: 53365
    Serial Number: ...
    Made in: week 1 of 2010
  Basic Display Parameters & Features:
    Analog display
    Signal Level Standard: 0.700 : 0.300 : 1.000 V p-p
    Blank-to-black setup/pedestal
    Sync: Separate Composite
    Maximum image size: 48 cm x 27 cm
    Gamma: 2.20
    DPMS levels: Off
    RGB color display
    Default (sRGB) color space is primary color space
    First detailed timing is the preferred timing
  Color Characteristics:
    Red  : 0.6220, 0.3437
    Green: 0.3378, 0.6181
    Blue : 0.1503, 0.0449
    White: 0.2792, 0.2919
  Established Timings I & II:
    IBM     :   720x400    70.081663 Hz   9:5     31.467 kHz     28.320000 MHz
    DMT 0x04:   640x480    59.940476 Hz   4:3     31.469 kHz     25.175000 MHz
    Apple   :   640x480    66.666667 Hz   4:3     35.000 kHz     30.240000 MHz
    DMT 0x05:   640x480    72.808802 Hz   4:3     37.861 kHz     31.500000 MHz
    DMT 0x06:   640x480    75.000000 Hz   4:3     37.500 kHz     31.500000 MHz
    DMT 0x08:   800x600    56.250000 Hz   4:3     35.156 kHz     36.000000 MHz
    DMT 0x09:   800x600    60.316541 Hz   4:3     37.879 kHz     40.000000 MHz
    DMT 0x0a:   800x600    72.187572 Hz   4:3     48.077 kHz     50.000000 MHz
    DMT 0x0b:   800x600    75.000000 Hz   4:3     46.875 kHz     49.500000 MHz
    Apple   :   832x624    74.551266 Hz   4:3     49.726 kHz     57.284000 MHz
    DMT 0x10:  1024x768    60.003840 Hz   4:3     48.363 kHz     65.000000 MHz
    DMT 0x11:  1024x768    70.069359 Hz   4:3     56.476 kHz     75.000000 MHz
    DMT 0x12:  1024x768    75.028582 Hz   4:3     60.023 kHz     78.750000 MHz
  Standard Timings:
    DMT 0x55:  1280x720    60.000000 Hz  16:9     45.000 kHz     74.250000 MHz
    DMT 0x1c:  1280x800    59.810326 Hz  16:10    49.702 kHz     83.500000 MHz
  Detailed Timing Descriptors:
    DTD 1:  1360x768    59.834270 Hz  85:48    47.748 kHz     84.800000 MHz (477 mm x 268 mm)
                 Hfront   72 Hsync 136 Hback  208 Hpol N
                 Vfront    3 Vsync   5 Vback   22 Vpol N
    DTD 2:  1920x1080   59.933878 Hz  16:9     66.587 kHz    138.500000 MHz (477 mm x 268 mm)
                 Hfront   48 Hsync  32 Hback   80 Hpol N
                 Vfront    3 Vsync   5 Vback   23 Vpol P
    Display Product Name: 'PHI26PFL3405'
    Display Range Limits:
      Monitor ranges (GTF): 56-76 Hz V, 30-85 kHz H, max dotclock 160 MHz
Checksum: 0x4b

----------------

Failures:

Block 0, Base EDID:
  Basic Display Parameters & Features: sRGB is signaled, but the chromaticities do not match.
EDID:
  Extension Block 1 started with EDID header, ignoring Extension Blocks >= 1.

EDID conformity: FAIL
