edid-decode (hex):

00 ff ff ff ff ff ff 00 59 14 91 56 00 00 00 00
00 11 01 04 a5 23 14 00 e2 91 19 a2 55 49 98 27
10 48 4c bf ee 00 31 40 31 4a 45 4a 61 4c 01 01
01 01 01 01 01 01 86 20 00 80 51 20 1e 30 80 c0
74 01 54 d2 10 00 00 00 00 00 00 fd 00 37 4c 1e
50 0f 01 30 30 30 30 30 30 0a 00 00 00 ff 00 30
30 30 30 30 30 30 30 30 30 0a 20 20 00 00 00 fc
00 47 31 35 30 20 20 20 20 20 20 20 20 0a 00 b0

----------------

Block 0, Base EDID:
  EDID Structure Version & Revision: 1.4
  Vendor & Product Identification:
    Manufacturer: VHT
    Model: 22161
    Made in: 2007
  Basic Display Parameters & Features:
    Digital display
    Bits per primary color channel: 8
    DisplayPort interface
    Maximum image size: 35 cm x 20 cm
    Gamma: 1.00
    DPMS levels: Standby Suspend Off
    Supported color formats: RGB 4:4:4
    First detailed timing includes the native pixel format and preferred refresh rate
  Color Characteristics:
    Red  : 0.6347, 0.3330
    Green: 0.2851, 0.5947
    Blue : 0.1523, 0.0634
    White: 0.2832, 0.2978
  Established Timings I & II:
    IBM     :   720x400    70.081663 Hz   9:5     31.467 kHz     28.320000 MHz
    DMT 0x04:   640x480    59.940476 Hz   4:3     31.469 kHz     25.175000 MHz
    Apple   :   640x480    66.666667 Hz   4:3     35.000 kHz     30.240000 MHz
    DMT 0x05:   640x480    72.808802 Hz   4:3     37.861 kHz     31.500000 MHz
    DMT 0x06:   640x480    75.000000 Hz   4:3     37.500 kHz     31.500000 MHz
    DMT 0x08:   800x600    56.250000 Hz   4:3     35.156 kHz     36.000000 MHz
    DMT 0x09:   800x600    60.316541 Hz   4:3     37.879 kHz     40.000000 MHz
    DMT 0x0a:   800x600    72.187572 Hz   4:3     48.077 kHz     50.000000 MHz
    DMT 0x0b:   800x600    75.000000 Hz   4:3     46.875 kHz     49.500000 MHz
    Apple   :   832x624    74.551266 Hz   4:3     49.726 kHz     57.284000 MHz
    DMT 0x10:  1024x768    60.003840 Hz   4:3     48.363 kHz     65.000000 MHz
    DMT 0x11:  1024x768    70.069359 Hz   4:3     56.476 kHz     75.000000 MHz
    DMT 0x12:  1024x768    75.028582 Hz   4:3     60.023 kHz     78.750000 MHz
  Standard Timings:
    DMT 0x04:   640x480    59.940476 Hz   4:3     31.469 kHz     25.175000 MHz
    GTF     :   640x480    70.000000 Hz   4:3     35.000 kHz     28.560000 MHz
    GTF     :   800x600    70.000000 Hz   4:3     43.750 kHz     45.500000 MHz
    GTF     :  1024x768    72.000073 Hz   4:3     57.672 kHz     78.434000 MHz
  Detailed Timing Descriptors:
    DTD 1:  1280x800    60.284407 Hz  16:10    50.036 kHz     83.260000 MHz (analog composite, sync-on-green, 340 mm x 210 mm)
                 Hfront  128 Hsync 192 Hback   64 Hpol N
                 Vfront    7 Vsync  20 Vback    3 Vpol N
    Display Range Limits:
      Monitor ranges (Range Limits Only): 55-76 Hz V, 30-80 kHz H, max dotclock 150 MHz
    Display Product Serial Number: ...
    Display Product Name: 'G150        '
Checksum: 0xb0

----------------

Warnings:

Block 0, Base EDID:
  Display Product Serial Number: ...

Failures:

Block 0, Base EDID:
  Detailed Timing Descriptor #1: Mismatch of image size 340x210 mm vs display size 350x200 mm.
  Display Range Limits: Byte 11 is 0x30 instead of 0x0a.
  Display Range Limits: Bytes 12-17 must be 0x20.
  Display Product Name: One or more trailing spaces before newline.
EDID:
  Base EDID: The DTD max image size is 340x210mm, which is larger than the display size 350.0x200.0mm.

EDID conformity: FAIL
