edid-decode (hex):

00 ff ff ff ff ff ff 00 06 af b7 90 00 00 00 00
24 22 01 04 a5 26 16 78 03 70 75 93 58 5a 94 29
20 50 54 00 00 00 01 01 01 01 01 01 01 01 01 01
01 01 01 01 01 01 23 3a 80 b6 70 38 64 40 30 20
f5 0c 7e d7 10 00 00 18 00 00 00 0f 00 00 00 00
00 00 00 00 00 00 00 00 00 20 00 00 00 fe 00 41
55 4f 0a 20 20 20 20 20 20 20 20 20 00 00 00 fc
00 42 31 37 33 48 41 4e 30 34 2e 39 20 0a 01 19

70 20 79 02 00 22 00 14 33 73 05 84 7f 07 b5 00
2f 80 1f 00 37 04 63 00 3e 00 04 00 25 01 09 33
73 05 33 73 05 30 90 80 2b 00 0c 27 00 3c 8f 00
00 27 00 30 3b 00 00 81 00 15 74 1a 00 00 03 51
30 90 00 00 00 00 00 00 90 00 00 00 00 00 00 00
00 00 00 00 00 00 00 00 00 00 00 00 00 00 00 00
00 00 00 00 00 00 00 00 00 00 00 00 00 00 00 00
00 00 00 00 00 00 00 00 00 00 00 00 00 00 cf 90

00 ff ff ff ff ff ff 00 06 af b7 90 00 00 00 00
24 22 01 04 a5 26 16 78 03 70 75 93 58 5a 94 29
20 50 54 00 00 00 01 01 01 01 01 01 01 01 01 01
01 01 01 01 01 01 23 3a 80 b6 70 38 64 40 30 20
f5 0c 7e d7 10 00 00 18 00 00 00 0f 00 00 00 00
00 00 00 00 00 00 00 00 00 20 00 00 00 fe 00 41
55 4f 0a 20 20 20 20 20 20 20 20 20 00 00 00 fc
00 42 31 37 33 48 41 4e 30 34 2e 39 20 0a 01 19

70 20 79 02 00 22 00 14 33 73 05 84 7f 07 b5 00
2f 80 1f 00 37 04 63 00 3e 00 04 00 25 01 09 33
73 05 33 73 05 30 90 80 2b 00 0c 27 00 3c 8f 00
00 27 00 30 3b 00 00 81 00 15 74 1a 00 00 03 51
30 90 00 00 00 00 00 00 90 00 00 00 00 00 00 00
00 00 00 00 00 00 00 00 00 00 00 00 00 00 00 00
00 00 00 00 00 00 00 00 00 00 00 00 00 00 00 00
00 00 00 00 00 00 00 00 00 00 00 00 00 00 cf 90

----------------

Block 0, Base EDID:
  EDID Structure Version & Revision: 1.4
  Vendor & Product Identification:
    Manufacturer: AUO
    Model: 37047
    Made in: week 36 of 2024
  Basic Display Parameters & Features:
    Digital display
    Bits per primary color channel: 8
    DisplayPort interface
    Maximum image size: 38 cm x 22 cm
    Gamma: 2.20
    Supported color formats: RGB 4:4:4
    First detailed timing includes the native pixel format and preferred refresh rate
    Display supports continuous frequencies
  Color Characteristics:
    Red  : 0.5751, 0.3466
    Green: 0.3515, 0.5781
    Blue : 0.1611, 0.1279
    White: 0.3134, 0.3291
  Established Timings I & II: none
  Standard Timings: none
  Detailed Timing Descriptors:
    DTD 1:  1920x1080   60.003387 Hz  16:9     70.804 kHz    148.830000 MHz (382 mm x 215 mm)
                 Hfront   48 Hsync  32 Hback  102 Hpol N
                 Vfront   63 Vsync   5 Vback   32 Vpol N
    Manufacturer-Specified Display Descriptor (0x0f): 00 0f 00 00 00 00 00 00 00 00 00 00 00 00 00 20 '............... '
    Alphanumeric Data String: 'AUO'
    Display Product Name: 'B173HAN04.9 '
  Extension blocks: 1
Checksum: 0x19

----------------

Block 1, DisplayID Extension Block:
  Version: 2.0
  Extension Count: 0
  Display Product Primary Use Case: None of the listed primary use cases; generic display
  Video Timing Modes Type 7 - Detailed Timings Data Block:
    DTD:  1920x1080  144.000065 Hz  16:9    169.920 kHz    357.172000 MHz (aspect 16:9, no 3D stereo, preferred)
               Hfront   48 Hsync  32 Hback  102 Hpol P
               Vfront   63 Vsync   5 Vback   32 Vpol N
  Dynamic Video Timing Range Limits Data Block:
    Minimum Pixel Clock: 357172 kHz
    Maximum Pixel Clock: 357172 kHz
    Minimum Vertical Refresh Rate: 48 Hz
    Maximum Vertical Refresh Rate: 144 Hz
    Seamless Dynamic Video Timing Support: Yes
  Adaptive Sync Data Block:
    Descriptor #1:
      Native Panel Range
      Fixed Average V-Total and Adaptive V-Total
      Supports Seamless Transition
      'Max Single Frame Duration Increase' field value without jitter impact
      'Max Single Frame Duration Decrease' field value without jitter impact
      Max Duration Increase: 0.00 ms
      Max Duration Decrease: 0.00 ms
      Min Refresh Rate: 60 Hz
      Max Refresh Rate: 144 Hz
    Descriptor #2:
      Native Panel Range
      Fixed Average V-Total and Adaptive V-Total
      Supports Seamless Transition
      'Max Single Frame Duration Increase' field value without jitter impact
      'Max Single Frame Duration Decrease' field value without jitter impact
      Max Duration Increase: 0.00 ms
      Max Duration Decrease: 0.00 ms
      Min Refresh Rate: 48 Hz
      Max Refresh Rate: 60 Hz
  CTA-861 DisplayID Data Block:
  Vendor-Specific Data Block (AMD), OUI 00-00-1A:
    Version: 3
    Feature Caps: 0x51
      FreeSync Panel Replay Supported
    Minimum Refresh Rate: 48 Hz
    Maximum Refresh Rate: 144 Hz
    Flags 1.x: 0x00
    Flags 2.x: 0x00
  Checksum: 0xcf
Checksum: 0x90

----------------

Failures:

Block 0, Base EDID:
  Display Product Name: One or more trailing spaces before newline.
  Missing Display Range Limits Descriptor.
EDID:
  Extension Block 2 started with EDID header, ignoring Extension Blocks >= 2.
  DisplayID: Missing DisplayID Display Parameters Data Block.

EDID conformity: FAIL
