edid-decode (hex):

00 ff ff ff ff ff ff 00 06 b3 a1 43 01 01 01 01
01 1d 01 04 b5 5e 35 78 3b ba 35 ae 4f 47 aa 27
10 50 54 bf cf 00 81 40 81 80 95 00 71 4f 81 c0
b3 00 d1 c0 01 01 4d d0 00 a0 f0 70 3e 80 30 20
35 00 ad 11 32 00 00 1a 14 ec 00 a0 a0 a0 67 50
20 30 35 00 ad 11 32 00 00 1a 00 00 00 fd 00 30
90 fe fe 6c 01 0a 20 20 20 20 20 20 00 00 00 fc
00 41 53 55 53 20 50 47 34 33 55 0a 20 20 02 ec

02 03 3b f1 4f 01 03 04 13 1f 12 02 11 90 0f 0e
1d 1e 60 61 23 09 07 07 83 01 00 00 65 03 0c 00
20 00 6d 1a 00 00 02 0b 30 90 00 05 8e 25 80 2b
e3 05 c0 01 e6 06 05 01 8e 75 12 34 6c 80 a0 70
70 3e 80 30 20 08 0c ad 11 32 00 00 1a 8a 6f 80
a0 70 38 40 40 30 20 28 0c ad 11 32 00 00 1a 6f
c2 00 a0 a0 a0 55 50 30 20 35 00 ad 11 32 00 00
1a 00 00 00 00 00 00 00 00 00 00 00 00 00 00 df

70 12 79 00 00 03 01 64 47 f8 01 04 ff 0e 4f 00
07 00 1f 00 6f 08 7e 00 70 00 07 00 eb a3 01 04
ff 0e 4f 00 07 00 1f 00 6f 08 7e 00 70 00 07 00
d0 50 01 04 ff 0e 9f 00 10 00 3e 00 6f 08 27 00
14 00 07 00 9b 12 01 04 ff 0e 4f 00 07 80 1f 00
6f 08 52 00 44 00 07 00 cc 7c 01 00 ff 0e 4f 00
07 00 1f 00 3f 06 7e 00 70 00 07 00 00 00 00 00
00 00 00 00 00 00 00 00 00 00 00 00 00 00 b5 90

00 ff ff ff ff ff ff 00 06 b3 a1 43 01 01 01 01
01 1d 01 04 b5 5e 35 78 3b ba 35 ae 4f 47 aa 27
10 50 54 bf cf 00 81 40 81 80 95 00 71 4f 81 c0
b3 00 d1 c0 01 01 4d d0 00 a0 f0 70 3e 80 30 20
35 00 ad 11 32 00 00 1a 14 ec 00 a0 a0 a0 67 50
20 30 35 00 ad 11 32 00 00 1a 00 00 00 fd 00 30
90 fe fe 6c 01 0a 20 20 20 20 20 20 00 00 00 fc
00 41 53 55 53 20 50 47 34 33 55 0a 20 20 02 ec

02 03 3b f1 4f 01 03 04 13 1f 12 02 11 90 0f 0e
1d 1e 60 61 23 09 07 07 83 01 00 00 65 03 0c 00
20 00 6d 1a 00 00 02 0b 30 90 00 05 8e 25 80 2b
e3 05 c0 01 e6 06 05 01 8e 75 12 34 6c 80 a0 70
70 3e 80 30 20 08 0c ad 11 32 00 00 1a 8a 6f 80
a0 70 38 40 40 30 20 28 0c ad 11 32 00 00 1a 6f
c2 00 a0 a0 a0 55 50 30 20 35 00 ad 11 32 00 00
1a 00 00 00 00 00 00 00 00 00 00 00 00 00 00 df

70 12 79 00 00 03 01 64 47 f8 01 04 ff 0e 4f 00
07 00 1f 00 6f 08 7e 00 70 00 07 00 eb a3 01 04
ff 0e 4f 00 07 00 1f 00 6f 08 7e 00 70 00 07 00
d0 50 01 04 ff 0e 9f 00 10 00 3e 00 6f 08 27 00
14 00 07 00 9b 12 01 04 ff 0e 4f 00 07 80 1f 00
6f 08 52 00 44 00 07 00 cc 7c 01 00 ff 0e 4f 00
07 00 1f 00 3f 06 7e 00 70 00 07 00 00 00 00 00
00 00 00 00 00 00 00 00 00 00 00 00 00 00 b5 90

----------------

Block 0, Base EDID:
  EDID Structure Version & Revision: 1.4
  Vendor & Product Identification:
    Manufacturer: AUS
    Model: 17313
    Serial Number: ...
    Made in: week 1 of 2019
  Basic Display Parameters & Features:
    Digital display
    Bits per primary color channel: 10
    DisplayPort interface
    Maximum image size: 94 cm x 53 cm
    Gamma: 2.20
    DPMS levels: Off
    Supported color formats: RGB 4:4:4, YCrCb 4:4:4, YCrCb 4:2:2
    First detailed timing includes the native pixel format and preferred refresh rate
    Display supports continuous frequencies
  Color Characteristics:
    Red  : 0.6816, 0.3115
    Green: 0.2792, 0.6660
    Blue : 0.1523, 0.0654
    White: 0.3134, 0.3291
  Established Timings I & II:
    IBM     :   720x400    70.081663 Hz   9:5     31.467 kHz     28.320000 MHz
    DMT 0x04:   640x480    59.940476 Hz   4:3     31.469 kHz     25.175000 MHz
    Apple   :   640x480    66.666667 Hz   4:3     35.000 kHz     30.240000 MHz
    DMT 0x05:   640x480    72.808802 Hz   4:3     37.861 kHz     31.500000 MHz
    DMT 0x06:   640x480    75.000000 Hz   4:3     37.500 kHz     31.500000 MHz
    DMT 0x08:   800x600    56.250000 Hz   4:3     35.156 kHz     36.000000 MHz
    DMT 0x09:   800x600    60.316541 Hz   4:3     37.879 kHz     40.000000 MHz
    DMT 0x0a:   800x600    72.187572 Hz   4:3     48.077 kHz     50.000000 MHz
    DMT 0x0b:   800x600    75.000000 Hz   4:3     46.875 kHz     49.500000 MHz
    DMT 0x10:  1024x768    60.003840 Hz   4:3     48.363 kHz     65.000000 MHz
    DMT 0x11:  1024x768    70.069359 Hz   4:3     56.476 kHz     75.000000 MHz
    DMT 0x12:  1024x768    75.028582 Hz   4:3     60.023 kHz     78.750000 MHz
    DMT 0x24:  1280x1024   75.024675 Hz   5:4     79.976 kHz    135.000000 MHz
  Standard Timings:
    DMT 0x20:  1280x960    60.000000 Hz   4:3     60.000 kHz    108.000000 MHz
    DMT 0x23:  1280x1024   60.019740 Hz   5:4     63.981 kHz    108.000000 MHz
    DMT 0x2f:  1440x900    59.887445 Hz  16:10    55.935 kHz    106.500000 MHz
    DMT 0x15:  1152x864    75.000000 Hz   4:3     67.500 kHz    108.000000 MHz
    DMT 0x55:  1280x720    60.000000 Hz  16:9     45.000 kHz     74.250000 MHz
    DMT 0x3a:  1680x1050   59.954250 Hz  16:10    65.290 kHz    146.250000 MHz
    DMT 0x52:  1920x1080   60.000000 Hz  16:9     67.500 kHz    148.500000 MHz
  Detailed Timing Descriptors:
    DTD 1:  3840x2160   59.996625 Hz  16:9    133.312 kHz    533.250000 MHz (941 mm x 529 mm)
                 Hfront   48 Hsync  32 Hback   80 Hpol P
                 Vfront    3 Vsync   5 Vback   54 Vpol N
    DTD 2:  2560x1440  143.999466 Hz  16:9    222.191 kHz    604.360000 MHz (941 mm x 529 mm)
                 Hfront   32 Hsync  48 Hback   80 Hpol P
                 Vfront    3 Vsync   5 Vback   95 Vpol N
    Display Range Limits:
      Monitor ranges (Range Limits Only): 48-144 Hz V, 254-254 kHz H, max dotclock 1080 MHz
    Display Product Name: 'ASUS PG43U'
  Extension blocks: 2
Checksum: 0xec

----------------

Block 1, CTA-861 Extension Block:
  Revision: 3
  Underscans IT Video Formats by default
  Basic audio support
  Supports YCbCr 4:4:4
  Supports YCbCr 4:2:2
  Native detailed modes: 1
  Video Data Block:
    VIC   1:   640x480    59.940476 Hz   4:3     31.469 kHz     25.175000 MHz
    VIC   3:   720x480    59.940060 Hz  16:9     31.469 kHz     27.000000 MHz
    VIC   4:  1280x720    60.000000 Hz  16:9     45.000 kHz     74.250000 MHz
    VIC  19:  1280x720    50.000000 Hz  16:9     37.500 kHz     74.250000 MHz
    VIC  31:  1920x1080   50.000000 Hz  16:9     56.250 kHz    148.500000 MHz
    VIC  18:   720x576    50.000000 Hz  16:9     31.250 kHz     27.000000 MHz
    VIC   2:   720x480    59.940060 Hz   4:3     31.469 kHz     27.000000 MHz
    VIC  17:   720x576    50.000000 Hz   4:3     31.250 kHz     27.000000 MHz
    VIC  16:  1920x1080   60.000000 Hz  16:9     67.500 kHz    148.500000 MHz (native)
    VIC  15:  1440x480    59.940060 Hz  16:9     31.469 kHz     54.000000 MHz
    VIC  14:  1440x480    59.940060 Hz   4:3     31.469 kHz     54.000000 MHz
    VIC  29:  1440x576    50.000000 Hz   4:3     31.250 kHz     54.000000 MHz
    VIC  30:  1440x576    50.000000 Hz  16:9     31.250 kHz     54.000000 MHz
    VIC  96:  3840x2160   50.000000 Hz  16:9    112.500 kHz    594.000000 MHz
    VIC  97:  3840x2160   60.000000 Hz  16:9    135.000 kHz    594.000000 MHz
  Audio Data Block:
    Linear PCM:
      Max channels: 2
      Supported sample rates (kHz): 48 44.1 32
      Supported sample sizes (bits): 24 20 16
  Speaker Allocation Data Block:
    FL/FR - Front Left/Right
  Vendor-Specific Data Block (HDMI), OUI 00-0C-03:
    Source physical address: 2.0.0.0
  Vendor-Specific Data Block (AMD), OUI 00-00-1A:
    Version: 2
    Feature Caps: 0x0b
      Local Dimming Supported
    Minimum Refresh Rate: 48 Hz
    Maximum Refresh Rate: 144 Hz
    Flags 1.x: 0x00
    Flags 2.x: 0x05
      ST 2084 (PQ) EOTF Supported
      Linear EOTF (Windows scRGB, 0.0 - 125.0) Supported
      Gamma 2.2 EOTF Supported
      BT.2020 Gamut Supported
    Maximum luminance: 142 (1083.404 cd/m^2)
    Minimum luminance: 37 (0.228 cd/m^2)
    Maximum luminance (without local dimming): 128 (800.000 cd/m^2)
    Minimum luminance (without local dimming): 43 (0.227 cd/m^2)
  Colorimetry Data Block:
    BT2020YCC
    BT2020RGB
    Gamut Boundary Description Metadata Profile P0
  HDR Static Metadata Data Block:
    Electro optical transfer functions:
      Traditional gamma - SDR luminance range
      SMPTE ST2084
    Supported static metadata descriptors:
      Static metadata type 1
    Desired content max luminance: 142 (1083.404 cd/m^2)
    Desired content max frame-average luminance: 117 (630.392 cd/m^2)
    Desired content min luminance: 18 (0.054 cd/m^2)
  Detailed Timing Descriptors:
    DTD 3:  1920x2160   59.933878 Hz   8:9    133.173 kHz    277.000000 MHz (941 mm x 529 mm)
                 Hfront   48 Hsync  32 Hback   80 Hpol P
                 Vfront   48 Vsync   8 Vback    6 Vpol N
    DTD 4:  1920x1080  119.998991 Hz  16:9    137.279 kHz    285.540000 MHz (941 mm x 529 mm)
                 Hfront   48 Hsync  32 Hback   80 Hpol P
                 Vfront   50 Vsync   8 Vback    6 Vpol N
    DTD 5:  2560x1440  119.997589 Hz  16:9    182.996 kHz    497.750000 MHz (941 mm x 529 mm)
                 Hfront   48 Hsync  32 Hback   80 Hpol P
                 Vfront    3 Vsync   5 Vback   77 Vpol N
Checksum: 0xdf  Unused space in Extension Block: 14 bytes

----------------

Block 2, DisplayID Extension Block:
  Version: 1.2
  Extension Count: 0
  Display Product Type: Extension Section
  Video Timing Modes Type 1 - Detailed Timings Data Block:
    DTD:  3840x2160  143.999358 Hz  16:9    329.327 kHz   1290.960000 MHz (aspect 16:9, no 3D stereo)
               Hfront    8 Hsync  32 Hback   40 Hpol N
               Vfront  113 Vsync   8 Vback    6 Vpol N
    DTD:  3840x2160  119.910229 Hz  16:9    274.235 kHz   1075.000000 MHz (aspect 16:9, no 3D stereo)
               Hfront    8 Hsync  32 Hback   40 Hpol N
               Vfront  113 Vsync   8 Vback    6 Vpol N
    DTD:  3840x2160   97.982955 Hz  16:9    215.562 kHz    862.250000 MHz (aspect 16:9, no 3D stereo)
               Hfront   17 Hsync  63 Hback   80 Hpol N
               Vfront   21 Vsync   8 Vback   11 Vpol N
    DTD:  3840x2160   79.953961 Hz  16:9    179.337 kHz    703.000000 MHz (aspect 16:9, no 3D stereo)
               Hfront    8 Hsync  32 Hback   40 Hpol P
               Vfront   69 Vsync   8 Vback    6 Vpol N
    DTD:  3840x1600  143.998972 Hz   1:1    248.686 kHz    974.850000 MHz (aspect 1:1, no 3D stereo)
               Hfront    8 Hsync  32 Hback   40 Hpol N
               Vfront  113 Vsync   8 Vback    6 Vpol N
  Checksum: 0xb5
Checksum: 0x90

----------------

Block 3, Unknown EDID Extension Block 0x00:
  00 ff ff ff ff ff ff 00 06 b3 a1 43 01 01 01 01 '...........C....'
  01 1d 01 04 b5 5e 35 78 3b ba 35 ae 4f 47 aa 27 '.....^5x;.5.OG.''
  10 50 54 bf cf 00 81 40 81 80 95 00 71 4f 81 c0 '.PT....@....qO..'
  b3 00 d1 c0 01 01 4d d0 00 a0 f0 70 3e 80 30 20 '......M....p>.0 '
  35 00 ad 11 32 00 00 1a 14 ec 00 a0 a0 a0 67 50 '5...2.........gP'
  20 30 35 00 ad 11 32 00 00 1a 00 00 00 fd 00 30 ' 05...2........0'
  90 fe fe 6c 01 0a 20 20 20 20 20 20 00 00 00 fc '...l..      ....'
  00 41 53 55 53 20 50 47 34 33 55 0a 20 20 02 ec '.ASUS PG43U.  ..'
Checksum: 0xec

----------------

Block 4, CTA-861 Extension Block:
  Revision: 3
  Underscans IT Video Formats by default
  Basic audio support
  Supports YCbCr 4:4:4
  Supports YCbCr 4:2:2
  Native detailed modes: 1
  Video Data Block:
    VIC   1:   640x480    59.940476 Hz   4:3     31.469 kHz     25.175000 MHz
    VIC   3:   720x480    59.940060 Hz  16:9     31.469 kHz     27.000000 MHz
    VIC   4:  1280x720    60.000000 Hz  16:9     45.000 kHz     74.250000 MHz
    VIC  19:  1280x720    50.000000 Hz  16:9     37.500 kHz     74.250000 MHz
    VIC  31:  1920x1080   50.000000 Hz  16:9     56.250 kHz    148.500000 MHz
    VIC  18:   720x576    50.000000 Hz  16:9     31.250 kHz     27.000000 MHz
    VIC   2:   720x480    59.940060 Hz   4:3     31.469 kHz     27.000000 MHz
    VIC  17:   720x576    50.000000 Hz   4:3     31.250 kHz     27.000000 MHz
    VIC  16:  1920x1080   60.000000 Hz  16:9     67.500 kHz    148.500000 MHz (native)
    VIC  15:  1440x480    59.940060 Hz  16:9     31.469 kHz     54.000000 MHz
    VIC  14:  1440x480    59.940060 Hz   4:3     31.469 kHz     54.000000 MHz
    VIC  29:  1440x576    50.000000 Hz   4:3     31.250 kHz     54.000000 MHz
    VIC  30:  1440x576    50.000000 Hz  16:9     31.250 kHz     54.000000 MHz
    VIC  96:  3840x2160   50.000000 Hz  16:9    112.500 kHz    594.000000 MHz
    VIC  97:  3840x2160   60.000000 Hz  16:9    135.000 kHz    594.000000 MHz
  Audio Data Block:
    Linear PCM:
      Max channels: 2
      Supported sample rates (kHz): 48 44.1 32
      Supported sample sizes (bits): 24 20 16
  Speaker Allocation Data Block:
    FL/FR - Front Left/Right
  Vendor-Specific Data Block (HDMI), OUI 00-0C-03:
    Source physical address: 2.0.0.0
  Vendor-Specific Data Block (AMD), OUI 00-00-1A:
    Version: 2
    Feature Caps: 0x0b
      Local Dimming Supported
    Minimum Refresh Rate: 48 Hz
    Maximum Refresh Rate: 144 Hz
    Flags 1.x: 0x00
    Flags 2.x: 0x05
      ST 2084 (PQ) EOTF Supported
      Linear EOTF (Windows scRGB, 0.0 - 125.0) Supported
      Gamma 2.2 EOTF Supported
      BT.2020 Gamut Supported
    Maximum luminance: 142 (1083.404 cd/m^2)
    Minimum luminance: 37 (0.228 cd/m^2)
    Maximum luminance (without local dimming): 128 (800.000 cd/m^2)
    Minimum luminance (without local dimming): 43 (0.227 cd/m^2)
  Colorimetry Data Block:
    BT2020YCC
    BT2020RGB
    Gamut Boundary Description Metadata Profile P0
  HDR Static Metadata Data Block:
    Electro optical transfer functions:
      Traditional gamma - SDR luminance range
      SMPTE ST2084
    Supported static metadata descriptors:
      Static metadata type 1
    Desired content max luminance: 142 (1083.404 cd/m^2)
    Desired content max frame-average luminance: 117 (630.392 cd/m^2)
    Desired content min luminance: 18 (0.054 cd/m^2)
  Detailed Timing Descriptors:
    DTD 6:  1920x2160   59.933878 Hz   8:9    133.173 kHz    277.000000 MHz (941 mm x 529 mm)
                 Hfront   48 Hsync  32 Hback   80 Hpol P
                 Vfront   48 Vsync   8 Vback    6 Vpol N
    DTD 7:  1920x1080  119.998991 Hz  16:9    137.279 kHz    285.540000 MHz (941 mm x 529 mm)
                 Hfront   48 Hsync  32 Hback   80 Hpol P
                 Vfront   50 Vsync   8 Vback    6 Vpol N
    DTD 8:  2560x1440  119.997589 Hz  16:9    182.996 kHz    497.750000 MHz (941 mm x 529 mm)
                 Hfront   48 Hsync  32 Hback   80 Hpol P
                 Vfront    3 Vsync   5 Vback   77 Vpol N
Checksum: 0xdf  Unused space in Extension Block: 14 bytes

----------------

Block 5, DisplayID Extension Block:
  Version: 1.2
  Extension Count: 0
  Video Timing Modes Type 1 - Detailed Timings Data Block:
    DTD:  3840x2160  143.999358 Hz  16:9    329.327 kHz   1290.960000 MHz (aspect 16:9, no 3D stereo)
               Hfront    8 Hsync  32 Hback   40 Hpol N
               Vfront  113 Vsync   8 Vback    6 Vpol N
    DTD:  3840x2160  119.910229 Hz  16:9    274.235 kHz   1075.000000 MHz (aspect 16:9, no 3D stereo)
               Hfront    8 Hsync  32 Hback   40 Hpol N
               Vfront  113 Vsync   8 Vback    6 Vpol N
    DTD:  3840x2160   97.982955 Hz  16:9    215.562 kHz    862.250000 MHz (aspect 16:9, no 3D stereo)
               Hfront   17 Hsync  63 Hback   80 Hpol N
               Vfront   21 Vsync   8 Vback   11 Vpol N
    DTD:  3840x2160   79.953961 Hz  16:9    179.337 kHz    703.000000 MHz (aspect 16:9, no 3D stereo)
               Hfront    8 Hsync  32 Hback   40 Hpol P
               Vfront   69 Vsync   8 Vback    6 Vpol N
    DTD:  3840x1600  143.998972 Hz   1:1    248.686 kHz    974.850000 MHz (aspect 1:1, no 3D stereo)
               Hfront    8 Hsync  32 Hback   40 Hpol N
               Vfront  113 Vsync   8 Vback    6 Vpol N
  Checksum: 0xb5
Checksum: 0x90

----------------

Warnings:

Block 0, Base EDID:
  Vendor & Product Identification: The serial number is one of the known dummy values, it should probably be set to 0.
Block 1, CTA-861 Extension Block:
  Video Data Block: VIC 1 and the first DTD are not identical. Is this intended?
  Colorimetry Data Block: Set the sRGB colorimetry bit to avoid interop issues.
  Detailed Timing Descriptor #3: Image size is 941x529 mm, but based on the picture AR it should be 941x1058 mm.
Block 4, CTA-861 Extension Block:
  Colorimetry Data Block: Set the sRGB colorimetry bit to avoid interop issues.
  Detailed Timing Descriptor #6: Image size is 941x529 mm, but based on the picture AR it should be 941x1058 mm.
EDID:
  Base EDID: Some timings are out of range of the Monitor Ranges:
    Horizontal Freq: 31.250 - 329.326 kHz (Monitor: 254.000 - 254.000 kHz)
    Maximum Clock: 1290.960 MHz (Monitor: 1080.000 MHz)

Failures:

Block 1, CTA-861 Extension Block:
  Vendor-Specific Data Block (HDMI), OUI 00-0C-03: The HDMI Specification requires EDID 1.3 instead of 1.4.
  Missing VCDB, needed for Set Selectable RGB Quantization to avoid interop issues.
Block 2, DisplayID Extension Block:
  DisplayID Base Block has no product type.
  Expected 0 DisplayID Extension Block, but got 1.
Block 3, Base EDID:
  Unknown Extension Block.
Block 4, CTA-861 Extension Block:
  Video Data Block: Duplicate VIC 1.
  Video Data Block: Duplicate VIC 3.
  Video Data Block: Duplicate VIC 4.
  Video Data Block: Duplicate VIC 19.
  Video Data Block: Duplicate VIC 31.
  Video Data Block: Duplicate VIC 18.
  Video Data Block: Duplicate VIC 2.
  Video Data Block: Duplicate VIC 17.
  Video Data Block: Duplicate VIC 16.
  Video Data Block: Duplicate VIC 15.
  Video Data Block: Duplicate VIC 14.
  Video Data Block: Duplicate VIC 29.
  Video Data Block: Duplicate VIC 30.
  Video Data Block: Duplicate VIC 96.
  Video Data Block: Duplicate VIC 97.
  Speaker Allocation Data Block: Only one instance of this Data Block is allowed.
  Vendor-Specific Data Block (HDMI), OUI 00-0C-03: The HDMI Specification requires EDID 1.3 instead of 1.4.
  Colorimetry Data Block: Only one instance of this Data Block is allowed.
  HDR Static Metadata Data Block: Only one instance of this Data Block is allowed.
EDID:
  Base EDID: EDID specified 2 extension block(s), but found 5 extension block(s).
  CTA-861: Native progressive timings are a mix of several resolutions.
  DisplayID: DisplayID expects at least one preferred timing.

EDID conformity: FAIL
