edid-decode (hex):

00 ff ff ff ff ff ff 00 38 a3 e4 67 01 01 01 01
27 15 01 03 80 33 1d 78 ea 40 65 a3 56 4c 9e 25
11 50 54 20 00 00 01 c1 01 c1 01 c1 01 c1 01 c1
01 c1 01 c1 01 c1 f3 39 80 18 71 38 2d 40 58 2c
45 00 fe 1f 11 00 00 1e 01 1d 00 bc 52 d0 1e 20
b8 28 55 40 fe 1f 11 00 00 1e 00 00 00 fd 00 31
3d 1b 46 0f 00 0a 20 20 20 20 20 20 00 00 00 fc
00 50 41 32 33 31 57 0a 20 20 20 20 20 20 01 04

02 01 04 00 8c 0a d0 8a 20 e0 2d 10 10 3e 96 00
fe 1f 11 00 00 18 8c 0a d0 90 20 40 31 20 0c 40
55 00 fe 1f 11 00 00 18 f9 1c 00 72 51 d0 1e 20
6e 28 55 00 fe 1f 11 00 00 1e 02 3a 80 d0 72 38
2d 40 10 2c 45 80 fe 1f 11 00 00 1e 00 00 00 00
00 00 00 00 00 00 00 00 00 00 00 00 00 00 00 00
00 00 00 00 00 00 00 00 00 00 00 00 00 00 00 00
00 00 00 00 00 00 00 00 00 00 00 00 00 00 00 07

----------------

Block 0, Base EDID:
  EDID Structure Version & Revision: 1.3
  Vendor & Product Identification:
    Manufacturer: NEC
    Model: 26596
    Serial Number: ...
    Made in: week 39 of 2011
  Basic Display Parameters & Features:
    Digital display
    Maximum image size: 51 cm x 29 cm
    Gamma: 2.20
    DPMS levels: Standby Suspend Off
    RGB color display
    First detailed timing is the preferred timing
  Color Characteristics:
    Red  : 0.6376, 0.3359
    Green: 0.2968, 0.6171
    Blue : 0.1455, 0.0683
    White: 0.3134, 0.3291
  Established Timings I & II:
    DMT 0x04:   640x480    59.940476 Hz   4:3     31.469 kHz     25.175000 MHz
  Standard Timings:
  Detailed Timing Descriptors:
    DTD 1:  1920x1080   59.939394 Hz  16:9     67.432 kHz    148.350000 MHz (510 mm x 287 mm)
                 Hfront   88 Hsync  44 Hback  148 Hpol P
                 Vfront    4 Vsync   5 Vback   36 Vpol P
    DTD 2:  1280x720    50.000000 Hz  16:9     37.500 kHz     74.250000 MHz (510 mm x 287 mm)
                 Hfront  440 Hsync  40 Hback  220 Hpol P
                 Vfront    5 Vsync   5 Vback   20 Vpol P
    Display Range Limits:
      Monitor ranges (GTF): 49-61 Hz V, 27-70 kHz H, max dotclock 150 MHz
    Display Product Name: 'PA231W'
  Extension blocks: 1
Checksum: 0x04

----------------

Block 1, CTA-861 Extension Block:
  Revision: 1
  Detailed Timing Descriptors:
    DTD 3:   720x480    59.940060 Hz   3:2     31.469 kHz     27.000000 MHz (510 mm x 287 mm)
                 Hfront   16 Hsync  62 Hback   60 Hpol N
                 Vfront    9 Vsync   6 Vback   30 Vpol N
    DTD 4:   720x576    50.000000 Hz   5:4     31.250 kHz     27.000000 MHz (510 mm x 287 mm)
                 Hfront   12 Hsync  64 Hback   68 Hpol N
                 Vfront    5 Vsync   5 Vback   39 Vpol N
    DTD 5:  1280x720    59.935354 Hz  16:9     44.952 kHz     74.170000 MHz (510 mm x 287 mm)
                 Hfront  110 Hsync  40 Hback  220 Hpol P
                 Vfront    5 Vsync   5 Vback   20 Vpol P
    DTD 6:  1920x1080   50.000000 Hz  16:9     56.250 kHz    148.500000 MHz (510 mm x 287 mm)
                 Hfront  528 Hsync  44 Hback  148 Hpol P
                 Vfront    4 Vsync   5 Vback   36 Vpol P
Checksum: 0x07  Unused space in Extension Block: 51 bytes

----------------

Warnings:

Block 0, Base EDID:
  Vendor & Product Identification: The serial number is one of the known dummy values, it should probably be set to 0.
  Detailed Timing Descriptor #2: DTD is identical to VIC 19, which is not present in the CTA Ext Block.
Block 1, CTA-861 Extension Block:
  Detailed Timing Descriptor #3: Image size is 510x287 mm, but based on the picture AR it should be 430x287 mm.
  Detailed Timing Descriptor #4: Image size is 510x287 mm, but based on the picture AR it should be 358x287 mm.
  Detailed Timing Descriptor #6: DTD is identical to VIC 31, which is not present in the CTA Ext Block.
  Add a Colorimetry Data Block with the sRGB colorimetry bit set to avoid interop issues.

Failures:

Block 0, Base EDID:
  Standard Timings: Use 0x0101 as the invalid Standard Timings code, not 0x01c1.
  Standard Timings: Use 0x0101 as the invalid Standard Timings code, not 0x01c1.
  Standard Timings: Use 0x0101 as the invalid Standard Timings code, not 0x01c1.
  Standard Timings: Use 0x0101 as the invalid Standard Timings code, not 0x01c1.
  Standard Timings: Use 0x0101 as the invalid Standard Timings code, not 0x01c1.
  Standard Timings: Use 0x0101 as the invalid Standard Timings code, not 0x01c1.
  Standard Timings: Use 0x0101 as the invalid Standard Timings code, not 0x01c1.
  Standard Timings: Use 0x0101 as the invalid Standard Timings code, not 0x01c1.
Block 1, CTA-861 Extension Block:
  Missing VCDB, needed for Set Selectable RGB Quantization to avoid interop issues.

EDID conformity: FAIL
