edid-decode (hex):

00 ff ff ff ff ff ff 00 4d d9 00 1a 8b 0b 20 00
03 0f 01 03 80 45 27 78 ea 95 91 a3 54 41 94 24
0f 49 4b a1 08 00 4b c0 81 c0 8b c0 71 40 81 40
81 80 90 40 a9 40 1b 21 50 a0 51 00 1e 30 48 88
35 00 ba 88 21 00 00 1c d5 09 80 a0 20 e0 2d 10
10 60 42 04 ba 88 21 00 00 18 00 00 00 fd 00 31
40 0f 5c 11 00 0a 20 20 20 20 20 20 00 00 00 fc
00 46 57 44 2d 33 32 4c 58 31 0a 20 20 20 01 69

02 02 04 86 f9 1c 00 72 51 d0 1e 20 6e 28 55 00
ba 88 21 00 00 1e f9 1c 80 18 71 1c 16 20 58 2c
25 00 ba 88 21 00 00 9e 8c 0a d0 8a 20 e0 2d 10
10 3e 9c 00 ba 88 21 00 00 18 01 1d 00 bc 52 d0
1e 20 b8 28 55 40 ba 88 21 00 00 1e 01 1d 80 d0
72 1c 16 20 10 2c 25 80 ba 88 21 00 00 9e 8c 0a
d0 90 20 40 31 20 0c 40 55 00 ba 88 21 00 00 18
00 00 00 00 00 00 00 00 00 00 00 00 00 00 00 6d

00 ff ff ff ff ff ff 00 4d d9 00 1a 8b 0b 20 00
03 0f 01 03 80 45 27 78 ea 95 91 a3 54 41 94 24
0f 49 4b a1 08 00 4b c0 81 c0 8b c0 71 40 81 40
81 80 90 40 a9 40 1b 21 50 a0 51 00 1e 30 48 88
35 00 ba 88 21 00 00 1c d5 09 80 a0 20 e0 2d 10
10 60 42 04 ba 88 21 00 00 18 00 00 00 fd 00 31
40 0f 5c 11 00 0a 20 20 20 20 20 20 00 00 00 fc
00 46 57 44 2d 33 32 4c 58 31 0a 20 20 20 01 69

02 02 04 86 f9 1c 00 72 51 d0 1e 20 6e 28 55 00
ba 88 21 00 00 1e f9 1c 80 18 71 1c 16 20 58 2c
25 00 ba 88 21 00 00 9e 8c 0a d0 8a 20 e0 2d 10
10 3e 9c 00 ba 88 21 00 00 18 01 1d 00 bc 52 d0
1e 20 b8 28 55 40 ba 88 21 00 00 1e 01 1d 80 d0
72 1c 16 20 10 2c 25 80 ba 88 21 00 00 9e 8c 0a
d0 90 20 40 31 20 0c 40 55 00 ba 88 21 00 00 18
00 00 00 00 00 00 00 00 00 00 00 00 00 00 00 6d

----------------

Block 0, Base EDID:
  EDID Structure Version & Revision: 1.3
  Vendor & Product Identification:
    Manufacturer: SNY
    Model: 6656
    Serial Number: ...
    Made in: week 3 of 2005
  Basic Display Parameters & Features:
    Digital display
    Maximum image size: 69 cm x 39 cm
    Gamma: 2.20
    DPMS levels: Standby Suspend Off
    RGB color display
    First detailed timing is the preferred timing
  Color Characteristics:
    Red  : 0.6386, 0.3291
    Green: 0.2548, 0.5791
    Blue : 0.1425, 0.0595
    White: 0.2851, 0.2939
  Established Timings I & II:
    IBM     :   720x400    70.081663 Hz   9:5     31.467 kHz     28.320000 MHz
    DMT 0x04:   640x480    59.940476 Hz   4:3     31.469 kHz     25.175000 MHz
    DMT 0x09:   800x600    60.316541 Hz   4:3     37.879 kHz     40.000000 MHz
    DMT 0x10:  1024x768    60.003840 Hz   4:3     48.363 kHz     65.000000 MHz
  Standard Timings:
    GTF     :   848x477    60.000307 Hz  16:9     29.640 kHz     31.300000 MHz
    DMT 0x55:  1280x720    60.000000 Hz  16:9     45.000 kHz     74.250000 MHz
    GTF     :  1360x765    60.000341 Hz  16:9     47.520 kHz     84.396000 MHz
    GTF     :  1152x864    60.000000 Hz   4:3     53.700 kHz     81.624000 MHz
    DMT 0x20:  1280x960    60.000000 Hz   4:3     60.000 kHz    108.000000 MHz
    DMT 0x23:  1280x1024   60.019740 Hz   5:4     63.981 kHz    108.000000 MHz
    DMT 0x2a:  1400x1050   59.978442 Hz   4:3     65.317 kHz    121.750000 MHz
    DMT 0x33:  1600x1200   60.000000 Hz   4:3     75.000 kHz    162.000000 MHz
  Detailed Timing Descriptors:
    DTD 1:  1360x768    59.798991 Hz  85:48    47.720 kHz     84.750000 MHz (698 mm x 392 mm)
                 Hfront   72 Hsync 136 Hback  208 Hpol N
                 Vfront    3 Vsync   5 Vback   22 Vpol P
    DTD 2:   640x480    59.928571 Hz   4:3     31.462 kHz     25.170000 MHz (698 mm x 392 mm)
                 Hfront   16 Hsync  96 Hback   48 Hpol N
                 Vfront   20 Vsync   2 Vback   23 Vpol N
    Display Range Limits:
      Monitor ranges (GTF): 49-64 Hz V, 15-92 kHz H, max dotclock 170 MHz
    Display Product Name: 'FWD-32LX1'
  Extension blocks: 1
Checksum: 0x69

----------------

Block 1, CTA-861 Extension Block:
  Revision: 2
  Underscans IT Video Formats by default
  Native DTDs: 6
  Detailed Timing Descriptors:
    DTD 3:  1280x720    59.935354 Hz  16:9     44.952 kHz     74.170000 MHz (698 mm x 392 mm)
                 Hfront  110 Hsync  40 Hback  220 Hpol P
                 Vfront    5 Vsync   5 Vback   20 Vpol P
    DTD 4:  1920x1080i  59.935354 Hz  16:9     33.714 kHz     74.170000 MHz (698 mm x 392 mm)
                 Hfront   88 Hsync  44 Hback  148 Hpol P
                 Vfront    2 Vsync   5 Vback   15 Vpol P Vfront +0.5 Odd Field
                 Vfront    2 Vsync   5 Vback   15 Vpol P Vback  +0.5 Even Field
    DTD 5:   720x480    59.940060 Hz   3:2     31.469 kHz     27.000000 MHz (698 mm x 392 mm)
                 Hfront   16 Hsync  62 Hback   60 Hpol N
                 Vfront    9 Vsync  12 Vback   24 Vpol N
    DTD 6:  1280x720    50.000000 Hz  16:9     37.500 kHz     74.250000 MHz (698 mm x 392 mm)
                 Hfront  440 Hsync  40 Hback  220 Hpol P
                 Vfront    5 Vsync   5 Vback   20 Vpol P
    DTD 7:  1920x1080i  50.000000 Hz  16:9     28.125 kHz     74.250000 MHz (698 mm x 392 mm)
                 Hfront  528 Hsync  44 Hback  148 Hpol P
                 Vfront    2 Vsync   5 Vback   15 Vpol P Vfront +0.5 Odd Field
                 Vfront    2 Vsync   5 Vback   15 Vpol P Vback  +0.5 Even Field
    DTD 8:   720x576    50.000000 Hz   5:4     31.250 kHz     27.000000 MHz (698 mm x 392 mm)
                 Hfront   12 Hsync  64 Hback   68 Hpol N
                 Vfront    5 Vsync   5 Vback   39 Vpol N
Checksum: 0x6d  Unused space in Extension Block: 15 bytes

----------------

Warnings:

Block 0, Base EDID:
  Standard Timings: Standard Timing 848x477 has a dubious odd vertical resolution.
  Standard Timings: Standard Timing 1360x765 has a dubious odd vertical resolution.
  Detailed Timing Descriptor #2: Image size is 698x392 mm, but based on the picture AR it should be 522x392 mm.
Block 1, CTA-861 Extension Block:
  Detailed Timing Descriptor #5: DTD is similar but not identical to VIC 2.
  Detailed Timing Descriptor #5: Image size is 698x392 mm, but based on the picture AR it should be 588x392 mm.
  Detailed Timing Descriptor #6: DTD is identical to VIC 19, which is not present in the CTA Ext Block.
  Detailed Timing Descriptor #7: DTD is identical to VIC 20, which is not present in the CTA Ext Block.
  Detailed Timing Descriptor #8: Image size is 698x392 mm, but based on the picture AR it should be 490x392 mm.
  Add a Colorimetry Data Block with the sRGB colorimetry bit set to avoid interop issues.
EDID:
  Base EDID: Some timings are out of range of the Monitor Ranges:
    Vertical Freq: 50.000 - 70.082 Hz (Monitor: 49.000 - 64.000 Hz)

Failures:

Block 1, CTA-861 Extension Block:
  Deprecated CTA-861 Extension revision 2.
  Missing VCDB, needed for Set Selectable RGB Quantization to avoid interop issues.
EDID:
  Extension Block 2 started with EDID header, ignoring Extension Blocks >= 2.
  CTA-861: Native progressive timings are a mix of several resolutions.

EDID conformity: FAIL
