edid-decode (hex):

00 ff ff ff ff ff ff 00 42 93 0c 03 93 17 00 00
17 0f 01 03 80 22 1b 96 ea 67 55 a5 5b 47 9c 25
1e 4f 54 ad ce 00 81 80 01 01 01 01 01 01 01 01
01 01 01 01 01 01 30 2a 00 98 51 00 2c 40 30 70
13 00 51 0e 11 00 00 1e 00 00 00 ff 00 36 30 33
35 0a 20 20 20 20 20 20 20 20 00 00 00 fc 00 58
41 37 2d 31 37 69 0a 20 20 20 20 20 00 00 00 fd
00 38 4c 1f 41 0b 00 0a 20 20 20 20 20 20 00 11

00 ff ff ff ff ff ff 00 42 93 0c 03 93 17 00 00
17 0f 01 03 80 22 1b 96 ea 67 55 a5 5b 47 9c 25
1e 4f 54 ad ce 00 81 80 01 01 01 01 01 01 01 01
01 01 01 01 01 01 30 2a 00 98 51 00 2c 40 30 70
13 00 51 0e 11 00 00 1e 00 00 00 ff 00 36 30 33
35 0a 20 20 20 20 20 20 20 20 00 00 00 fc 00 58
41 37 2d 31 37 69 0a 20 20 20 20 20 00 00 00 fd
00 38 4c 1f 41 0b 00 0a 20 20 20 20 20 20 00 11

----------------

Block 0, Base EDID:
  EDID Structure Version & Revision: 1.3
  Vendor & Product Identification:
    Manufacturer: PTS
    Model: 780
    Serial Number: ...
    Made in: week 23 of 2005
  Basic Display Parameters & Features:
    Digital display
    Maximum image size: 34 cm x 27 cm
    Gamma: 2.50
    DPMS levels: Standby Suspend Off
    RGB color display
    First detailed timing is the preferred timing
  Color Characteristics:
    Red  : 0.6455, 0.3574
    Green: 0.2783, 0.6123
    Blue : 0.1455, 0.1181
    White: 0.3095, 0.3291
  Established Timings I & II:
    IBM     :   720x400    70.081663 Hz   9:5     31.467 kHz     28.320000 MHz
    DMT 0x04:   640x480    59.940476 Hz   4:3     31.469 kHz     25.175000 MHz
    DMT 0x05:   640x480    72.808802 Hz   4:3     37.861 kHz     31.500000 MHz
    DMT 0x06:   640x480    75.000000 Hz   4:3     37.500 kHz     31.500000 MHz
    DMT 0x09:   800x600    60.316541 Hz   4:3     37.879 kHz     40.000000 MHz
    DMT 0x0a:   800x600    72.187572 Hz   4:3     48.077 kHz     50.000000 MHz
    DMT 0x0b:   800x600    75.000000 Hz   4:3     46.875 kHz     49.500000 MHz
    DMT 0x10:  1024x768    60.003840 Hz   4:3     48.363 kHz     65.000000 MHz
    DMT 0x11:  1024x768    70.069359 Hz   4:3     56.476 kHz     75.000000 MHz
    DMT 0x12:  1024x768    75.028582 Hz   4:3     60.023 kHz     78.750000 MHz
  Standard Timings:
    DMT 0x23:  1280x1024   60.019740 Hz   5:4     63.981 kHz    108.000000 MHz
  Detailed Timing Descriptors:
    DTD 1:  1280x1024   59.907343 Hz   5:4     63.981 kHz    108.000000 MHz (337 mm x 270 mm)
                 Hfront   48 Hsync 112 Hback  248 Hpol P
                 Vfront    1 Vsync   3 Vback   40 Vpol P
    Display Product Serial Number: ...
    Display Product Name: 'XA7-17i'
    Display Range Limits:
      Monitor ranges (GTF): 56-76 Hz V, 31-65 kHz H, max dotclock 110 MHz
Checksum: 0x11

----------------

Failures:

EDID:
  Extension Block 1 started with EDID header, ignoring Extension Blocks >= 1.

EDID conformity: FAIL
