edid-decode (hex):

00 ff ff ff ff ff ff 00 22 0e 00 70 00 00 00 00
22 19 01 04 a5 34 1d 78 3a d5 a5 a8 54 4c 9e 24
0c 50 54 00 00 00 01 01 01 01 01 01 01 01 01 01
01 01 01 01 01 01 4d d0 00 a0 f0 70 3e 80 30 20
35 00 0a 26 21 00 00 1a 00 00 00 fd 00 18 3c 1e
87 3c 01 0a 20 20 20 20 20 20 00 00 00 fc 00 48
50 20 5a 31 20 47 65 6e 20 33 0a 20 00 00 00 10
00 00 00 00 00 00 00 00 00 00 00 00 00 00 00 6c

00 ff ff ff ff ff ff 00 22 0e 00 70 00 00 00 00
22 19 01 04 a5 34 1d 78 3a d5 a5 a8 54 4c 9e 24
0c 50 54 00 00 00 01 01 01 01 01 01 01 01 01 01
01 01 01 01 01 01 4d d0 00 a0 f0 70 3e 80 30 20
35 00 0a 26 21 00 00 1a 00 00 00 fd 00 18 3c 1e
87 3c 01 0a 20 20 20 20 20 20 00 00 00 fc 00 48
50 20 5a 31 20 47 65 6e 20 33 0a 20 00 00 00 10
00 00 00 00 00 00 00 00 00 00 00 00 00 00 00 6c

----------------

Block 0, Base EDID:
  EDID Structure Version & Revision: 1.4
  Vendor & Product Identification:
    Manufacturer: HPN
    Model: 28672
    Made in: week 34 of 2015
  Basic Display Parameters & Features:
    Digital display
    Bits per primary color channel: 8
    DisplayPort interface
    Maximum image size: 52 cm x 29 cm
    Gamma: 2.20
    DPMS levels: Off
    Supported color formats: RGB 4:4:4, YCrCb 4:4:4, YCrCb 4:2:2
    First detailed timing includes the native pixel format and preferred refresh rate
  Color Characteristics:
    Red  : 0.6591, 0.3291
    Green: 0.2978, 0.6181
    Blue : 0.1425, 0.0488
    White: 0.3134, 0.3291
  Established Timings I & II: none
  Standard Timings: none
  Detailed Timing Descriptors:
    DTD 1:  3840x2160   59.996625 Hz  16:9    133.312 kHz    533.250000 MHz (522 mm x 294 mm)
                 Hfront   48 Hsync  32 Hback   80 Hpol P
                 Vfront    3 Vsync   5 Vback   54 Vpol N
    Display Range Limits:
      Monitor ranges (Range Limits Only): 24-60 Hz V, 30-135 kHz H, max dotclock 600 MHz
    Display Product Name: 'HP Z1 Gen 3'
    Dummy Descriptor:
Checksum: 0x6c

----------------

Failures:

EDID:
  Extension Block 1 started with EDID header, ignoring Extension Blocks >= 1.

EDID conformity: FAIL
