edid-decode (hex):

00 ff ff ff ff ff ff 00 2a 59 73 01 00 00 00 00
13 15 01 03 68 26 15 78 8a 00 13 a0 57 49 9b 26
10 48 4e ad cf 00 81 80 81 8c 45 4a 81 8a 61 4a
61 4c 45 4c 01 01 30 2a 40 c8 60 84 64 30 18 50
13 00 c7 00 11 00 00 1c 00 00 00 ff 00 4e 55 4c
4c 0a 20 20 20 20 20 20 20 20 00 00 00 fc 00 30
30 30 30 30 30 0a 20 20 20 20 20 20 00 00 00 fc
00 41 6e 61 6c 6f 67 0a 20 20 20 20 20 20 00 ea

00 ff ff ff ff ff ff 00 2a 59 73 01 00 00 00 00
13 15 01 03 68 26 15 78 8a 00 13 a0 57 49 9b 26
10 48 4e ad cf 00 81 80 81 8c 45 4a 81 8a 61 4a
61 4c 45 4c 01 01 30 2a 40 c8 60 84 64 30 18 50
13 00 c7 00 11 00 00 1c 00 00 00 ff 00 4e 55 4c
4c 0a 20 20 20 20 20 20 20 20 00 00 00 fc 00 30
30 30 30 30 30 0a 20 20 20 20 20 20 00 00 00 fc
00 41 6e 61 6c 6f 67 0a 20 20 20 20 20 20 00 ea

----------------

Block 0, Base EDID:
  EDID Structure Version & Revision: 1.3
  Vendor & Product Identification:
    Manufacturer: JRY
    Model: 371
    Made in: week 19 of 2011
  Basic Display Parameters & Features:
    Analog display
    Signal Level Standard: 0.700 : 0.000 : 0.700 V p-p
    Blank level equals black level
    Sync: Separate
    Maximum image size: 38 cm x 21 cm
    Gamma: 2.20
    DPMS levels: Standby
    RGB color display
    First detailed timing is the preferred timing
  Color Characteristics:
    Red  : 0.6250, 0.3398
    Green: 0.2851, 0.6054
    Blue : 0.1484, 0.0634
    White: 0.2812, 0.3076
  Established Timings I & II:
    IBM     :   720x400    70.081663 Hz   9:5     31.467 kHz     28.320000 MHz
    DMT 0x04:   640x480    59.940476 Hz   4:3     31.469 kHz     25.175000 MHz
    DMT 0x05:   640x480    72.808802 Hz   4:3     37.861 kHz     31.500000 MHz
    DMT 0x06:   640x480    75.000000 Hz   4:3     37.500 kHz     31.500000 MHz
    DMT 0x09:   800x600    60.316541 Hz   4:3     37.879 kHz     40.000000 MHz
    DMT 0x0a:   800x600    72.187572 Hz   4:3     48.077 kHz     50.000000 MHz
    DMT 0x0b:   800x600    75.000000 Hz   4:3     46.875 kHz     49.500000 MHz
    DMT 0x10:  1024x768    60.003840 Hz   4:3     48.363 kHz     65.000000 MHz
    DMT 0x11:  1024x768    70.069359 Hz   4:3     56.476 kHz     75.000000 MHz
    DMT 0x12:  1024x768    75.028582 Hz   4:3     60.023 kHz     78.750000 MHz
    DMT 0x24:  1280x1024   75.024675 Hz   5:4     79.976 kHz    135.000000 MHz
  Standard Timings:
    DMT 0x23:  1280x1024   60.019740 Hz   5:4     63.981 kHz    108.000000 MHz
    GTF     :  1280x1024   72.000069 Hz   5:4     76.824 kHz    132.752000 MHz
    GTF     :   800x600    70.000000 Hz   4:3     43.750 kHz     45.500000 MHz
    GTF     :  1280x1024   69.999805 Hz   5:4     74.620 kHz    128.943000 MHz
    DMT 0x11:  1024x768    70.069359 Hz   4:3     56.476 kHz     75.000000 MHz
    GTF     :  1024x768    72.000073 Hz   4:3     57.672 kHz     78.434000 MHz
    DMT 0x0a:   800x600    72.187572 Hz   4:3     48.077 kHz     50.000000 MHz
  Detailed Timing Descriptors:
    DTD 1:  1600x900    60.000000 Hz  16:9     60.000 kHz    108.000000 MHz (455 mm x 256 mm)
                 Hfront   24 Hsync  80 Hback   96 Hpol N
                 Vfront    1 Vsync   3 Vback   96 Vpol P
    Display Product Serial Number: ...
    Display Product Name: '000000'
    Display Product Name: 'Analog'
Checksum: 0xea

----------------

Warnings:

Block 0, Base EDID:
  Detailed Timing Descriptor #1: DTD is similar but not identical to DMT 0x53.

Failures:

Block 0, Base EDID:
  Detailed Timing Descriptor #1: Mismatch of image size 455x256 mm vs display size 380x210 mm.
  Missing Display Range Limits Descriptor.
EDID:
  Extension Block 1 started with EDID header, ignoring Extension Blocks >= 1.
  Base EDID: The DTD max image size is 455x256mm, which is larger than the display size 380.0x210.0mm.

EDID conformity: FAIL
