edid-decode (hex):

00 ff ff ff ff ff ff 00 1e 6d 11 5b c4 a2 00 00
04 1c 01 04 b5 3c 22 78 80 0f 91 ae 52 43 b0 26
0f 50 54 20 00 00 01 01 01 01 01 01 01 01 01 01
01 01 01 01 01 01 25 cc 00 50 f0 70 3e 80 08 20
18 00 58 54 21 00 00 1a a3 5b 00 50 a0 a0 29 50
08 20 18 00 58 54 21 00 00 1a 00 00 00 ff 00 38
30 34 4e 54 45 50 31 37 36 36 38 0a 00 00 00 fc
00 4c 47 20 55 6c 74 72 61 46 69 6e 65 0a 02 fc

70 12 79 03 00 01 00 0c 3e 17 16 0d 00 14 40 0b
50 78 4e 99 29 00 10 87 27 98 8d 8f 49 4d 79 bf
ab 31 a1 90 0c 82 57 03 00 28 f5 e7 00 04 ff 0f
4f 00 07 80 1f 00 ff 08 41 00 00 00 07 00 5e 8e
00 04 7f 0c 4f 00 07 80 1f 00 07 07 33 00 00 00
07 00 00 00 00 00 00 00 00 00 00 00 00 00 00 00
00 00 00 00 00 00 00 00 00 00 00 00 00 00 00 00
00 00 00 00 00 00 00 00 00 00 00 00 00 00 6f 90

70 12 79 03 00 12 00 16 82 10 00 00 ff 09 3f 0b
00 00 00 00 00 47 53 4d 11 5b 01 01 01 01 03 00
14 45 b7 00 08 ff 09 4f 00 07 80 1f 00 3f 0b 51
00 00 00 07 00 00 00 00 00 00 00 00 00 00 00 00
00 00 00 00 00 00 00 00 00 00 00 00 00 00 00 00
00 00 00 00 00 00 00 00 00 00 00 00 00 00 00 00
00 00 00 00 00 00 00 00 00 00 00 00 00 00 00 00
00 00 00 00 00 00 00 00 00 00 00 00 00 00 55 90

00 ff ff ff ff ff ff 00 1e 6d 11 5b c4 a2 00 00
04 1c 01 04 b5 3c 22 78 80 0f 91 ae 52 43 b0 26
0f 50 54 20 00 00 01 01 01 01 01 01 01 01 01 01
01 01 01 01 01 01 25 cc 00 50 f0 70 3e 80 08 20
18 00 58 54 21 00 00 1a a3 5b 00 50 a0 a0 29 50
08 20 18 00 58 54 21 00 00 1a 00 00 00 ff 00 38
30 34 4e 54 45 50 31 37 36 36 38 0a 00 00 00 fc
00 4c 47 20 55 6c 74 72 61 46 69 6e 65 0a 02 fc

70 12 79 03 00 01 00 0c 3e 17 16 0d 00 14 40 0b
50 78 4e 99 29 00 10 87 27 98 8d 8f 49 4d 79 bf
ab 31 a1 90 0c 82 57 03 00 28 f5 e7 00 04 ff 0f
4f 00 07 80 1f 00 ff 08 41 00 00 00 07 00 5e 8e
00 04 7f 0c 4f 00 07 80 1f 00 07 07 33 00 00 00
07 00 00 00 00 00 00 00 00 00 00 00 00 00 00 00
00 00 00 00 00 00 00 00 00 00 00 00 00 00 00 00
00 00 00 00 00 00 00 00 00 00 00 00 00 00 6f 90

70 12 79 03 00 12 00 16 82 10 00 00 ff 09 3f 0b
00 00 00 00 00 47 53 4d 11 5b 01 01 01 01 03 00
14 45 b7 00 08 ff 09 4f 00 07 80 1f 00 3f 0b 51
00 00 00 07 00 00 00 00 00 00 00 00 00 00 00 00
00 00 00 00 00 00 00 00 00 00 00 00 00 00 00 00
00 00 00 00 00 00 00 00 00 00 00 00 00 00 00 00
00 00 00 00 00 00 00 00 00 00 00 00 00 00 00 00
00 00 00 00 00 00 00 00 00 00 00 00 00 00 55 90

----------------

Block 0, Base EDID:
  EDID Structure Version & Revision: 1.4
  Vendor & Product Identification:
    Manufacturer: GSM
    Model: 23313
    Serial Number: ...
    Made in: week 4 of 2018
  Basic Display Parameters & Features:
    Digital display
    Bits per primary color channel: 10
    DisplayPort interface
    Maximum image size: 60 cm x 34 cm
    Gamma: 2.20
    DPMS levels: Standby
    Supported color formats: RGB 4:4:4
    First detailed timing does not include the native pixel format and preferred refresh rate
  Color Characteristics:
    Red  : 0.6796, 0.3203
    Green: 0.2646, 0.6904
    Blue : 0.1503, 0.0595
    White: 0.3125, 0.3291
  Established Timings I & II:
    DMT 0x04:   640x480    59.940476 Hz   4:3     31.469 kHz     25.175000 MHz
  Standard Timings: none
  Detailed Timing Descriptors:
    DTD 1:  3840x2160   59.999495 Hz  16:9    133.319 kHz    522.610000 MHz (600 mm x 340 mm)
                 Hfront    8 Hsync  32 Hback   40 Hpol P
                 Vfront    1 Vsync   8 Vback   53 Vpol N
    DTD 2:  2560x1440   59.999898 Hz  16:9     88.860 kHz    234.590000 MHz (600 mm x 340 mm)
                 Hfront    8 Hsync  32 Hback   40 Hpol P
                 Vfront    1 Vsync   8 Vback   32 Vpol N
    Display Product Serial Number: ...
    Display Product Name: 'LG UltraFine'
  Extension blocks: 2
Checksum: 0xfc

----------------

Block 1, DisplayID Extension Block:
  Version: 1.2
  Extension Count: 0
  Display Product Type: Standalone display device
  Display Parameters Data Block (0x01):
    Image size: 595.0 mm x 335.0 mm
    Display native pixel format: 5120x2880
    Feature support flags:
      Power management (DPM)
      Separate audio inputs provided
    Gamma: 2.20
    Aspect ratio: 1.78
    Dynamic bpc native: 10
    Dynamic bpc overall: 10
  ContainerID Data Block:
    Container ID: 8727988d-8f49-4d79-bfab-31a1900c8257
  Video Timing Modes Type 1 - Detailed Timings Data Block:
    DTD:  4096x2304   59.999273 Hz  16:9    142.198 kHz    593.820000 MHz (aspect 16:9, no 3D stereo)
               Hfront    8 Hsync  32 Hback   40 Hpol P
               Vfront    1 Vsync   8 Vback   57 Vpol N
    DTD:  3200x1800   59.999407 Hz  16:9    111.119 kHz    364.470000 MHz (aspect 16:9, no 3D stereo)
               Hfront    8 Hsync  32 Hback   40 Hpol P
               Vfront    1 Vsync   8 Vback   43 Vpol N
  Checksum: 0x6f
Checksum: 0x90

----------------

Block 2, DisplayID Extension Block:
  Version: 1.2
  Extension Count: 0
  Tiled Display Topology Data Block (0x12):
    Capabilities:
      Behavior if it is the only tile: Image is scaled to fit the entire tiled display
      Behavior if more than one tile and fewer than total number of tiles: Undefined
    Tiled display consists of a single physical display enclosure
    Num horizontal tiles: 2 Num vertical tiles: 1
    Tile location: 0, 0
    Tile resolution: 2560x2880
    Tiled Display Manufacturer/Vendor ID: GSM
    Tiled Display Product ID Code: 23313
    Tiled Display Serial Number: ...
  Video Timing Modes Type 1 - Detailed Timings Data Block:
    DTD:  2560x2880   59.999898 Hz   0:0    177.720 kHz    469.180000 MHz (aspect undefined, no 3D stereo)
               Hfront    8 Hsync  32 Hback   40 Hpol P
               Vfront    1 Vsync   8 Vback   73 Vpol N
  Checksum: 0x55
Checksum: 0x90

----------------

Failures:

Block 1, DisplayID Extension Block:
  Expected 0 DisplayID Extension Block, but got 1.
  ContainerID Data Block: Use of DisplayID v2.0 tag for DisplayID v1.2.
Block 2, DisplayID Extension Block:
  Product Type should be 0 in extension block.
EDID:
  Extension Block 3 started with EDID header, ignoring Extension Blocks >= 3.
  DisplayID: Missing DisplayID Product Identification Data Block.
  DisplayID: DisplayID expects at least one preferred timing.

EDID conformity: FAIL
