edid-decode (hex):

00 ff ff ff ff ff ff 00 49 f7 00 00 00 00 00 00
19 1a 01 03 80 00 00 00 0a d7 a5 a2 59 4a 96 24
14 50 54 af ce 00 d1 00 b3 00 81 00 81 80 81 40
81 c0 d1 c0 01 01 28 3c 80 a0 70 b0 23 40 30 20
36 00 3f 43 21 00 00 1a 9a 29 a0 d0 51 84 22 30
50 98 36 00 3f 43 21 00 00 1c 00 00 00 fd 00 32
4c 1e 50 10 00 0a 20 20 20 20 20 20 00 00 00 fc
00 41 41 41 0a 20 20 20 20 20 20 20 20 20 01 8c

02 03 23 74 4f 10 9f 14 05 04 13 12 16 11 15 03
07 02 06 01 23 09 0f 03 83 01 00 00 66 03 0c 00
10 00 80 01 1d 00 bc 52 d0 1e 20 b8 28 55 40 c4
8e 21 00 00 1e 01 1d 80 d0 72 1c 16 20 10 2c 25
80 c4 8e 21 00 00 9e 8c 0a d0 8a 20 e0 2d 10 10
3e 96 00 13 8e 21 00 00 18 8c 0a d0 90 20 40 31
20 0c 40 55 00 13 8e 21 00 00 18 00 00 00 00 00
00 00 00 00 00 00 00 00 00 00 00 00 00 00 00 9d

00 ff ff ff ff ff ff 00 49 f7 00 00 00 00 00 00
19 1a 01 03 80 00 00 00 0a d7 a5 a2 59 4a 96 24
14 50 54 af ce 00 d1 00 b3 00 81 00 81 80 81 40
81 c0 d1 c0 01 01 28 3c 80 a0 70 b0 23 40 30 20
36 00 3f 43 21 00 00 1a 9a 29 a0 d0 51 84 22 30
50 98 36 00 3f 43 21 00 00 1c 00 00 00 fd 00 32
4c 1e 50 10 00 0a 20 20 20 20 20 20 00 00 00 fc
00 41 41 41 0a 20 20 20 20 20 20 20 20 20 01 8c

02 03 23 74 4f 10 9f 14 05 04 13 12 16 11 15 03
07 02 06 01 23 09 0f 03 83 01 00 00 66 03 0c 00
10 00 80 01 1d 00 bc 52 d0 1e 20 b8 28 55 40 c4
8e 21 00 00 1e 01 1d 80 d0 72 1c 16 20 10 2c 25
80 c4 8e 21 00 00 9e 8c 0a d0 8a 20 e0 2d 10 10
3e 96 00 13 8e 21 00 00 18 8c 0a d0 90 20 40 31
20 0c 40 55 00 13 8e 21 00 00 18 00 00 00 00 00
00 00 00 00 00 00 00 00 00 00 00 00 00 00 00 9d

----------------

Block 0, Base EDID:
  EDID Structure Version & Revision: 1.3
  Vendor & Product Identification:
    Manufacturer: ROW
    Model: 0
    Made in: week 25 of 2016
  Basic Display Parameters & Features:
    Digital display
    Image size is variable
    Gamma: 1.00
    RGB color display
    First detailed timing is the preferred timing
  Color Characteristics:
    Red  : 0.6357, 0.3486
    Green: 0.2900, 0.5888
    Blue : 0.1425, 0.0800
    White: 0.3134, 0.3291
  Established Timings I & II:
    IBM     :   720x400    70.081663 Hz   9:5     31.467 kHz     28.320000 MHz
    DMT 0x04:   640x480    59.940476 Hz   4:3     31.469 kHz     25.175000 MHz
    DMT 0x05:   640x480    72.808802 Hz   4:3     37.861 kHz     31.500000 MHz
    DMT 0x06:   640x480    75.000000 Hz   4:3     37.500 kHz     31.500000 MHz
    DMT 0x08:   800x600    56.250000 Hz   4:3     35.156 kHz     36.000000 MHz
    DMT 0x09:   800x600    60.316541 Hz   4:3     37.879 kHz     40.000000 MHz
    DMT 0x0a:   800x600    72.187572 Hz   4:3     48.077 kHz     50.000000 MHz
    DMT 0x0b:   800x600    75.000000 Hz   4:3     46.875 kHz     49.500000 MHz
    DMT 0x10:  1024x768    60.003840 Hz   4:3     48.363 kHz     65.000000 MHz
    DMT 0x11:  1024x768    70.069359 Hz   4:3     56.476 kHz     75.000000 MHz
    DMT 0x12:  1024x768    75.028582 Hz   4:3     60.023 kHz     78.750000 MHz
  Standard Timings:
    DMT 0x45:  1920x1200   59.884600 Hz  16:10    74.556 kHz    193.250000 MHz
    DMT 0x3a:  1680x1050   59.954250 Hz  16:10    65.290 kHz    146.250000 MHz
    DMT 0x1c:  1280x800    59.810326 Hz  16:10    49.702 kHz     83.500000 MHz
    DMT 0x23:  1280x1024   60.019740 Hz   5:4     63.981 kHz    108.000000 MHz
    DMT 0x20:  1280x960    60.000000 Hz   4:3     60.000 kHz    108.000000 MHz
    DMT 0x55:  1280x720    60.000000 Hz  16:9     45.000 kHz     74.250000 MHz
    DMT 0x52:  1920x1080   60.000000 Hz  16:9     67.500 kHz    148.500000 MHz
  Detailed Timing Descriptors:
    DTD 1:  1920x1200   59.950171 Hz  16:10    74.038 kHz    154.000000 MHz (575 mm x 323 mm)
                 Hfront   48 Hsync  32 Hback   80 Hpol P
                 Vfront    3 Vsync   6 Vback   26 Vpol N
    DTD 2:  1440x900    59.887445 Hz  16:10    55.935 kHz    106.500000 MHz (575 mm x 323 mm)
                 Hfront   80 Hsync 152 Hback  232 Hpol N
                 Vfront    3 Vsync   6 Vback   25 Vpol P
    Display Range Limits:
      Monitor ranges (GTF): 50-76 Hz V, 30-80 kHz H, max dotclock 160 MHz
    Display Product Name: 'AAA'
  Extension blocks: 1
Checksum: 0x8c

----------------

Block 1, CTA-861 Extension Block:
  Revision: 3
  Basic audio support
  Supports YCbCr 4:4:4
  Supports YCbCr 4:2:2
  Native DTDs: 4
  Video Data Block:
    VIC  16:  1920x1080   60.000000 Hz  16:9     67.500 kHz    148.500000 MHz
    VIC  31:  1920x1080   50.000000 Hz  16:9     56.250 kHz    148.500000 MHz (native)
    VIC  20:  1920x1080i  50.000000 Hz  16:9     28.125 kHz     74.250000 MHz
    VIC   5:  1920x1080i  60.000000 Hz  16:9     33.750 kHz     74.250000 MHz
    VIC   4:  1280x720    60.000000 Hz  16:9     45.000 kHz     74.250000 MHz
    VIC  19:  1280x720    50.000000 Hz  16:9     37.500 kHz     74.250000 MHz
    VIC  18:   720x576    50.000000 Hz  16:9     31.250 kHz     27.000000 MHz
    VIC  22:  1440x576i   50.000000 Hz  16:9     15.625 kHz     27.000000 MHz
    VIC  17:   720x576    50.000000 Hz   4:3     31.250 kHz     27.000000 MHz
    VIC  21:  1440x576i   50.000000 Hz   4:3     15.625 kHz     27.000000 MHz
    VIC   3:   720x480    59.940060 Hz  16:9     31.469 kHz     27.000000 MHz
    VIC   7:  1440x480i   59.940060 Hz  16:9     15.734 kHz     27.000000 MHz
    VIC   2:   720x480    59.940060 Hz   4:3     31.469 kHz     27.000000 MHz
    VIC   6:  1440x480i   59.940060 Hz   4:3     15.734 kHz     27.000000 MHz
    VIC   1:   640x480    59.940476 Hz   4:3     31.469 kHz     25.175000 MHz
  Audio Data Block:
    Linear PCM:
      Max channels: 2
      Supported sample rates (kHz): 88.2 48 44.1 32
      Supported sample sizes (bits): 20 16
  Speaker Allocation Data Block:
    FL/FR - Front Left/Right
  Vendor-Specific Data Block (HDMI), OUI 00-0C-03:
    Source physical address: 1.0.0.0
    Supports_AI
  Detailed Timing Descriptors:
    DTD 3:  1280x720    50.000000 Hz  16:9     37.500 kHz     74.250000 MHz (708 mm x 398 mm)
                 Hfront  440 Hsync  40 Hback  220 Hpol P
                 Vfront    5 Vsync   5 Vback   20 Vpol P
    DTD 4:  1920x1080i  50.000000 Hz  16:9     28.125 kHz     74.250000 MHz (708 mm x 398 mm)
                 Hfront  528 Hsync  44 Hback  148 Hpol P
                 Vfront    2 Vsync   5 Vback   15 Vpol P Vfront +0.5 Odd Field
                 Vfront    2 Vsync   5 Vback   15 Vpol P Vback  +0.5 Even Field
    DTD 5:   720x480    59.940060 Hz   3:2     31.469 kHz     27.000000 MHz (531 mm x 398 mm)
                 Hfront   16 Hsync  62 Hback   60 Hpol N
                 Vfront    9 Vsync   6 Vback   30 Vpol N
    DTD 6:   720x576    50.000000 Hz   5:4     31.250 kHz     27.000000 MHz (531 mm x 398 mm)
                 Hfront   12 Hsync  64 Hback   68 Hpol N
                 Vfront    5 Vsync   5 Vback   39 Vpol N
Checksum: 0x9d  Unused space in Extension Block: 20 bytes

----------------

Warnings:

Block 0, Base EDID:
  Detailed Timing Descriptor #1: Image size is 575x323 mm, but based on the picture AR it should be 516x323 mm.
  Detailed Timing Descriptor #2: Image size is 575x323 mm, but based on the picture AR it should be 516x323 mm.
Block 1, CTA-861 Extension Block:
  IT Video Formats are overscanned by default, but normally this should be underscanned.
  Video Data Block: VIC 16 and the first DTD are not identical. Is this intended?
  Detailed Timing Descriptor #5: Image size is 531x398 mm, but based on the picture AR it should be 531x354 mm.
  Detailed Timing Descriptor #6: Image size is 531x398 mm, but based on the picture AR it should be 497x398 mm.
  Add a Colorimetry Data Block with the sRGB colorimetry bit set to avoid interop issues.
EDID:
  Base EDID: Some timings are out of range of the Monitor Ranges:
    Horizontal Freq: 15.625 - 74.556 kHz (Monitor: 30.000 - 80.000 kHz)
    Maximum Clock: 193.250 MHz (Monitor: 160.000 MHz)

Failures:

Block 1, CTA-861 Extension Block:
  Missing VCDB, needed for Set Selectable RGB Quantization to avoid interop issues.
EDID:
  Extension Block 2 started with EDID header, ignoring Extension Blocks >= 2.
  Base EDID: The DTD max image size is 708x398mm, but the display size is not specified anywhere.
  CTA-861: Native progressive timings are a mix of several resolutions.

EDID conformity: FAIL
