edid-decode (hex):

00 ff ff ff ff ff ff 00 04 69 a7 28 b0 35 00 00
28 1a 01 03 80 3e 22 78 3a 08 a5 a2 57 4f a2 28
0f 50 54 bf ef 00 d1 c0 81 40 81 80 95 00 b3 00
81 c0 81 00 71 4f 04 74 00 30 f2 70 5a 80 b0 58
8a 00 6d 55 21 00 00 1a 02 3a 80 18 71 38 2d 40
58 2c 45 00 6d 55 21 00 00 1e 00 00 00 fd 00 17
50 18 8a 1e 00 0a 20 20 20 20 20 20 00 00 00 fc
00 41 53 55 53 20 4d 47 32 38 55 0a 20 20 01 c5

02 03 2e f1 53 02 03 11 12 13 04 14 05 0e 0f 1d
1e 1f 90 22 20 21 5e 5f 23 09 17 07 83 01 00 00
6d 03 0c 00 30 00 00 3c 20 00 60 01 02 03 56 5e
00 a0 a0 a0 29 50 30 20 35 00 6d 55 21 00 00 1e
e2 68 00 a0 a0 40 2e 60 30 20 36 00 6d 55 21 00
00 1a 01 1d 00 bc 52 d0 1e 20 b8 28 55 40 6d 55
21 00 00 1e d5 09 80 a0 20 5e 63 10 30 60 b2 0c
6d 55 21 00 00 1a 00 00 00 00 00 00 00 00 00 76

00 ff ff ff ff ff ff 00 04 69 a7 28 b0 35 00 00
28 1a 01 03 80 3e 22 78 3a 08 a5 a2 57 4f a2 28
0f 50 54 bf ef 00 d1 c0 81 40 81 80 95 00 b3 00
81 c0 81 00 71 4f 04 74 00 30 f2 70 5a 80 b0 58
8a 00 6d 55 21 00 00 1a 02 3a 80 18 71 38 2d 40
58 2c 45 00 6d 55 21 00 00 1e 00 00 00 fd 00 17
50 18 8a 1e 00 0a 20 20 20 20 20 20 00 00 00 fc
00 41 53 55 53 20 4d 47 32 38 55 0a 20 20 01 c5

02 03 2e f1 53 02 03 11 12 13 04 14 05 0e 0f 1d
1e 1f 90 22 20 21 5e 5f 23 09 17 07 83 01 00 00
6d 03 0c 00 30 00 00 3c 20 00 60 01 02 03 56 5e
00 a0 a0 a0 29 50 30 20 35 00 6d 55 21 00 00 1e
e2 68 00 a0 a0 40 2e 60 30 20 36 00 6d 55 21 00
00 1a 01 1d 00 bc 52 d0 1e 20 b8 28 55 40 6d 55
21 00 00 1e d5 09 80 a0 20 5e 63 10 30 60 b2 0c
6d 55 21 00 00 1a 00 00 00 00 00 00 00 00 00 76

----------------

Block 0, Base EDID:
  EDID Structure Version & Revision: 1.3
  Vendor & Product Identification:
    Manufacturer: ACI
    Model: 10407
    Serial Number: ...
    Made in: week 40 of 2016
  Basic Display Parameters & Features:
    Digital display
    Maximum image size: 62 cm x 34 cm
    Gamma: 2.20
    DPMS levels: Off
    Undefined display color type
    First detailed timing is the preferred timing
  Color Characteristics:
    Red  : 0.6328, 0.3398
    Green: 0.3105, 0.6328
    Blue : 0.1582, 0.0605
    White: 0.3134, 0.3291
  Established Timings I & II:
    IBM     :   720x400    70.081663 Hz   9:5     31.467 kHz     28.320000 MHz
    DMT 0x04:   640x480    59.940476 Hz   4:3     31.469 kHz     25.175000 MHz
    Apple   :   640x480    66.666667 Hz   4:3     35.000 kHz     30.240000 MHz
    DMT 0x05:   640x480    72.808802 Hz   4:3     37.861 kHz     31.500000 MHz
    DMT 0x06:   640x480    75.000000 Hz   4:3     37.500 kHz     31.500000 MHz
    DMT 0x08:   800x600    56.250000 Hz   4:3     35.156 kHz     36.000000 MHz
    DMT 0x09:   800x600    60.316541 Hz   4:3     37.879 kHz     40.000000 MHz
    DMT 0x0a:   800x600    72.187572 Hz   4:3     48.077 kHz     50.000000 MHz
    DMT 0x0b:   800x600    75.000000 Hz   4:3     46.875 kHz     49.500000 MHz
    Apple   :   832x624    74.551266 Hz   4:3     49.726 kHz     57.284000 MHz
    DMT 0x10:  1024x768    60.003840 Hz   4:3     48.363 kHz     65.000000 MHz
    DMT 0x11:  1024x768    70.069359 Hz   4:3     56.476 kHz     75.000000 MHz
    DMT 0x12:  1024x768    75.028582 Hz   4:3     60.023 kHz     78.750000 MHz
    DMT 0x24:  1280x1024   75.024675 Hz   5:4     79.976 kHz    135.000000 MHz
  Standard Timings:
    DMT 0x52:  1920x1080   60.000000 Hz  16:9     67.500 kHz    148.500000 MHz
    DMT 0x20:  1280x960    60.000000 Hz   4:3     60.000 kHz    108.000000 MHz
    DMT 0x23:  1280x1024   60.019740 Hz   5:4     63.981 kHz    108.000000 MHz
    DMT 0x2f:  1440x900    59.887445 Hz  16:10    55.935 kHz    106.500000 MHz
    DMT 0x3a:  1680x1050   59.954250 Hz  16:10    65.290 kHz    146.250000 MHz
    DMT 0x55:  1280x720    60.000000 Hz  16:9     45.000 kHz     74.250000 MHz
    DMT 0x1c:  1280x800    59.810326 Hz  16:10    49.702 kHz     83.500000 MHz
    DMT 0x15:  1152x864    75.000000 Hz   4:3     67.500 kHz    108.000000 MHz
  Detailed Timing Descriptors:
    DTD  1:  3840x2160   30.000000 Hz  16:9     67.500 kHz    297.000000 MHz (621 mm x 341 mm)
                  Hfront  176 Hsync  88 Hback  296 Hpol P
                  Vfront    8 Vsync  10 Vback   72 Vpol N
    DTD  2:  1920x1080   60.000000 Hz  16:9     67.500 kHz    148.500000 MHz (621 mm x 341 mm)
                  Hfront   88 Hsync  44 Hback  148 Hpol P
                  Vfront    4 Vsync   5 Vback   36 Vpol P
    Display Range Limits:
      Monitor ranges (GTF): 23-80 Hz V, 24-138 kHz H, max dotclock 300 MHz
    Display Product Name: 'ASUS MG28U'
  Extension blocks: 1
Checksum: 0xc5

----------------

Block 1, CTA-861 Extension Block:
  Revision: 3
  Underscans IT Video Formats by default
  Basic audio support
  Supports YCbCr 4:4:4
  Supports YCbCr 4:2:2
  Native detailed modes: 1
  Video Data Block:
    VIC   2:   720x480    59.940060 Hz   4:3     31.469 kHz     27.000000 MHz
    VIC   3:   720x480    59.940060 Hz  16:9     31.469 kHz     27.000000 MHz
    VIC  17:   720x576    50.000000 Hz   4:3     31.250 kHz     27.000000 MHz
    VIC  18:   720x576    50.000000 Hz  16:9     31.250 kHz     27.000000 MHz
    VIC  19:  1280x720    50.000000 Hz  16:9     37.500 kHz     74.250000 MHz
    VIC   4:  1280x720    60.000000 Hz  16:9     45.000 kHz     74.250000 MHz
    VIC  20:  1920x1080i  50.000000 Hz  16:9     28.125 kHz     74.250000 MHz
    VIC   5:  1920x1080i  60.000000 Hz  16:9     33.750 kHz     74.250000 MHz
    VIC  14:  1440x480    59.940060 Hz   4:3     31.469 kHz     54.000000 MHz
    VIC  15:  1440x480    59.940060 Hz  16:9     31.469 kHz     54.000000 MHz
    VIC  29:  1440x576    50.000000 Hz   4:3     31.250 kHz     54.000000 MHz
    VIC  30:  1440x576    50.000000 Hz  16:9     31.250 kHz     54.000000 MHz
    VIC  31:  1920x1080   50.000000 Hz  16:9     56.250 kHz    148.500000 MHz
    VIC  16:  1920x1080   60.000000 Hz  16:9     67.500 kHz    148.500000 MHz (native)
    VIC  34:  1920x1080   30.000000 Hz  16:9     33.750 kHz     74.250000 MHz
    VIC  32:  1920x1080   24.000000 Hz  16:9     27.000 kHz     74.250000 MHz
    VIC  33:  1920x1080   25.000000 Hz  16:9     28.125 kHz     74.250000 MHz
    VIC  94:  3840x2160   25.000000 Hz  16:9     56.250 kHz    297.000000 MHz
    VIC  95:  3840x2160   30.000000 Hz  16:9     67.500 kHz    297.000000 MHz
  Audio Data Block:
    Linear PCM:
      Max channels: 2
      Supported sample rates (kHz): 96 48 44.1 32
      Supported sample sizes (bits): 24 20 16
  Speaker Allocation Data Block:
    FL/FR - Front Left/Right
  Vendor-Specific Data Block (HDMI), OUI 00-0C-03:
    Source physical address: 3.0.0.0
    Maximum TMDS clock: 300 MHz
    Extended HDMI video details:
      HDMI VICs:
        HDMI VIC 1:  3840x2160   30.000000 Hz  16:9     67.500 kHz    297.000000 MHz
        HDMI VIC 2:  3840x2160   25.000000 Hz  16:9     56.250 kHz    297.000000 MHz
        HDMI VIC 3:  3840x2160   24.000000 Hz  16:9     54.000 kHz    297.000000 MHz
  Detailed Timing Descriptors:
    DTD  3:  2560x1440   59.950550 Hz  16:9     88.787 kHz    241.500000 MHz (621 mm x 341 mm)
                  Hfront   48 Hsync  32 Hback   80 Hpol P
                  Vfront    3 Vsync   5 Vback   33 Vpol P
    DTD  4:  2560x1600   59.971589 Hz  16:10    98.713 kHz    268.500000 MHz (621 mm x 341 mm)
                  Hfront   48 Hsync  32 Hback   80 Hpol P
                  Vfront    3 Vsync   6 Vback   37 Vpol N
    DTD  5:  1280x720    50.000000 Hz  16:9     37.500 kHz     74.250000 MHz (621 mm x 341 mm)
                  Hfront  440 Hsync  40 Hback  220 Hpol P
                  Vfront    5 Vsync   5 Vback   20 Vpol P
    DTD  6:   640x350    70.072383 Hz  64:35    31.462 kHz     25.170000 MHz (621 mm x 341 mm)
                  Hfront   48 Hsync  96 Hback   16 Hpol P
                  Vfront   59 Vsync   2 Vback   38 Vpol N
Checksum: 0x76  Unused space in Extension Block: 9 bytes

----------------

Block 2, Unknown EDID Extension Block 0x00:
  00 ff ff ff ff ff ff 00 04 69 a7 28 b0 35 00 00 '.........i.(.5..'
  28 1a 01 03 80 3e 22 78 3a 08 a5 a2 57 4f a2 28 '(....>"x:...WO.('
  0f 50 54 bf ef 00 d1 c0 81 40 81 80 95 00 b3 00 '.PT......@......'
  81 c0 81 00 71 4f 04 74 00 30 f2 70 5a 80 b0 58 '....qO.t.0.pZ..X'
  8a 00 6d 55 21 00 00 1a 02 3a 80 18 71 38 2d 40 '..mU!....:..q8-@'
  58 2c 45 00 6d 55 21 00 00 1e 00 00 00 fd 00 17 'X,E.mU!.........'
  50 18 8a 1e 00 0a 20 20 20 20 20 20 00 00 00 fc 'P.....      ....'
  00 41 53 55 53 20 4d 47 32 38 55 0a 20 20 01 c5 '.ASUS MG28U.  ..'
Checksum: 0xc5

----------------

Block 3, CTA-861 Extension Block:
  Revision: 3
  Underscans IT Video Formats by default
  Basic audio support
  Supports YCbCr 4:4:4
  Supports YCbCr 4:2:2
  Native detailed modes: 1
  Video Data Block:
    VIC   2:   720x480    59.940060 Hz   4:3     31.469 kHz     27.000000 MHz
    VIC   3:   720x480    59.940060 Hz  16:9     31.469 kHz     27.000000 MHz
    VIC  17:   720x576    50.000000 Hz   4:3     31.250 kHz     27.000000 MHz
    VIC  18:   720x576    50.000000 Hz  16:9     31.250 kHz     27.000000 MHz
    VIC  19:  1280x720    50.000000 Hz  16:9     37.500 kHz     74.250000 MHz
    VIC   4:  1280x720    60.000000 Hz  16:9     45.000 kHz     74.250000 MHz
    VIC  20:  1920x1080i  50.000000 Hz  16:9     28.125 kHz     74.250000 MHz
    VIC   5:  1920x1080i  60.000000 Hz  16:9     33.750 kHz     74.250000 MHz
    VIC  14:  1440x480    59.940060 Hz   4:3     31.469 kHz     54.000000 MHz
    VIC  15:  1440x480    59.940060 Hz  16:9     31.469 kHz     54.000000 MHz
    VIC  29:  1440x576    50.000000 Hz   4:3     31.250 kHz     54.000000 MHz
    VIC  30:  1440x576    50.000000 Hz  16:9     31.250 kHz     54.000000 MHz
    VIC  31:  1920x1080   50.000000 Hz  16:9     56.250 kHz    148.500000 MHz
    VIC  16:  1920x1080   60.000000 Hz  16:9     67.500 kHz    148.500000 MHz (native)
    VIC  34:  1920x1080   30.000000 Hz  16:9     33.750 kHz     74.250000 MHz
    VIC  32:  1920x1080   24.000000 Hz  16:9     27.000 kHz     74.250000 MHz
    VIC  33:  1920x1080   25.000000 Hz  16:9     28.125 kHz     74.250000 MHz
    VIC  94:  3840x2160   25.000000 Hz  16:9     56.250 kHz    297.000000 MHz
    VIC  95:  3840x2160   30.000000 Hz  16:9     67.500 kHz    297.000000 MHz
  Audio Data Block:
    Linear PCM:
      Max channels: 2
      Supported sample rates (kHz): 96 48 44.1 32
      Supported sample sizes (bits): 24 20 16
  Speaker Allocation Data Block:
    FL/FR - Front Left/Right
  Vendor-Specific Data Block (HDMI), OUI 00-0C-03:
    Source physical address: 3.0.0.0
    Maximum TMDS clock: 300 MHz
    Extended HDMI video details:
      HDMI VICs:
        HDMI VIC 1:  3840x2160   30.000000 Hz  16:9     67.500 kHz    297.000000 MHz
        HDMI VIC 2:  3840x2160   25.000000 Hz  16:9     56.250 kHz    297.000000 MHz
        HDMI VIC 3:  3840x2160   24.000000 Hz  16:9     54.000 kHz    297.000000 MHz
  Detailed Timing Descriptors:
    DTD  7:  2560x1440   59.950550 Hz  16:9     88.787 kHz    241.500000 MHz (621 mm x 341 mm)
                  Hfront   48 Hsync  32 Hback   80 Hpol P
                  Vfront    3 Vsync   5 Vback   33 Vpol P
    DTD  8:  2560x1600   59.971589 Hz  16:10    98.713 kHz    268.500000 MHz (621 mm x 341 mm)
                  Hfront   48 Hsync  32 Hback   80 Hpol P
                  Vfront    3 Vsync   6 Vback   37 Vpol N
    DTD  9:  1280x720    50.000000 Hz  16:9     37.500 kHz     74.250000 MHz (621 mm x 341 mm)
                  Hfront  440 Hsync  40 Hback  220 Hpol P
                  Vfront    5 Vsync   5 Vback   20 Vpol P
    DTD 10:   640x350    70.072383 Hz  64:35    31.462 kHz     25.170000 MHz (621 mm x 341 mm)
                  Hfront   48 Hsync  96 Hback   16 Hpol P
                  Vfront   59 Vsync   2 Vback   38 Vpol N
Checksum: 0x76  Unused space in Extension Block: 9 bytes

----------------

Warnings:

Block 0, Base EDID:
  Detailed Timing Descriptor #1: DTD is similar but not identical to VIC 95.
Block 1, CTA-861 Extension Block:
  Video Data Block: VIC 2 and the first DTD are not identical. Is this intended?
  Detailed Timing Descriptor #4: Image size is 621x341 mm, but based on the picture AR it should be 621x388 mm.
  Add a Colorimetry Data Block with the sRGB colorimetry bit set to avoid interop issues.
Block 3, CTA-861 Extension Block:
  Detailed Timing Descriptor #8: Image size is 621x341 mm, but based on the picture AR it should be 621x388 mm.

Failures:

Block 1, CTA-861 Extension Block:
  Vendor-Specific Data Block (HDMI), OUI 00-0C-03: HDMI VIC Codes must have their CTA-861 VIC equivalents in the VSB.
  Missing VCDB, needed for Set Selectable RGB Quantization to avoid interop issues.
Block 2, Base EDID:
  Unknown Extension Block.
Block 3, CTA-861 Extension Block:
  Video Data Block: Duplicate VIC 2.
  Video Data Block: Duplicate VIC 3.
  Video Data Block: Duplicate VIC 17.
  Video Data Block: Duplicate VIC 18.
  Video Data Block: Duplicate VIC 19.
  Video Data Block: Duplicate VIC 4.
  Video Data Block: Duplicate VIC 20.
  Video Data Block: Duplicate VIC 5.
  Video Data Block: Duplicate VIC 14.
  Video Data Block: Duplicate VIC 15.
  Video Data Block: Duplicate VIC 29.
  Video Data Block: Duplicate VIC 30.
  Video Data Block: Duplicate VIC 31.
  Video Data Block: Duplicate VIC 16.
  Video Data Block: Duplicate VIC 34.
  Video Data Block: Duplicate VIC 32.
  Video Data Block: Duplicate VIC 33.
  Video Data Block: Duplicate VIC 94.
  Video Data Block: Duplicate VIC 95.
  Speaker Allocation Data Block: Only one instance of this Data Block is allowed.
  Vendor-Specific Data Block (HDMI), OUI 00-0C-03: HDMI VIC Codes must have their CTA-861 VIC equivalents in the VSB.
EDID:
  Base EDID: EDID specified 1 extension block(s), but found 3 extension block(s).
  Base EDID: EDID 1.3 requires a Block Map Extension in Block 1 if there are more than 2 blocks in the EDID.
  CTA-861: Native progressive timings are a mix of several resolutions.

EDID conformity: FAIL
