edid-decode (hex):

00 ff ff ff ff ff ff 00 3c 88 02 27 00 00 00 00
15 20 01 03 68 3b 21 78 ea d7 a5 a2 59 4a 96 24
14 50 54 21 4b 00 95 00 b3 00 01 01 81 c0 81 80
81 00 a9 c0 01 01 2a 44 80 a0 70 38 27 40 30 2c
45 00 55 50 21 00 00 06 02 3a 80 18 71 38 2d 40
58 2c 45 00 00 00 00 00 00 06 66 21 56 aa 51 00
1e 30 46 8f 33 00 dc 0b 11 00 00 06 00 00 00 fc
00 4c 4d 32 37 2d 4c 32 30 30 2d 44 53 0a 00 dd

00 ff ff ff ff ff ff 00 3c 88 02 27 00 00 00 00
15 20 01 03 68 3b 21 78 ea d7 a5 a2 59 4a 96 24
14 50 54 21 4b 00 95 00 b3 00 01 01 81 c0 81 80
81 00 a9 c0 01 01 2a 44 80 a0 70 38 27 40 30 2c
45 00 55 50 21 00 00 06 02 3a 80 18 71 38 2d 40
58 2c 45 00 00 00 00 00 00 06 66 21 56 aa 51 00
1e 30 46 8f 33 00 dc 0b 11 00 00 06 00 00 00 fc
00 4c 4d 32 37 2d 4c 32 30 30 2d 44 53 0a 00 dd

----------------

Block 0, Base EDID:
  EDID Structure Version & Revision: 1.3
  Vendor & Product Identification:
    Manufacturer: ODH
    Model: 9986
    Made in: week 21 of 2022
  Basic Display Parameters & Features:
    Analog display
    Signal Level Standard: 0.700 : 0.000 : 0.700 V p-p
    Blank level equals black level
    Sync: Separate
    Maximum image size: 59 cm x 33 cm
    Gamma: 2.20
    DPMS levels: Standby Suspend Off
    RGB color display
    First detailed timing is the preferred timing
  Color Characteristics:
    Red  : 0.6357, 0.3486
    Green: 0.2900, 0.5888
    Blue : 0.1425, 0.0800
    White: 0.3134, 0.3291
  Established Timings I & II:
    DMT 0x04:   640x480    59.940476 Hz   4:3     31.469 kHz     25.175000 MHz
    DMT 0x09:   800x600    60.316541 Hz   4:3     37.879 kHz     40.000000 MHz
    DMT 0x0b:   800x600    75.000000 Hz   4:3     46.875 kHz     49.500000 MHz
    DMT 0x10:  1024x768    60.003840 Hz   4:3     48.363 kHz     65.000000 MHz
    DMT 0x12:  1024x768    75.028582 Hz   4:3     60.023 kHz     78.750000 MHz
    DMT 0x24:  1280x1024   75.024675 Hz   5:4     79.976 kHz    135.000000 MHz
  Standard Timings:
    DMT 0x2f:  1440x900    59.887445 Hz  16:10    55.935 kHz    106.500000 MHz
    DMT 0x3a:  1680x1050   59.954250 Hz  16:10    65.290 kHz    146.250000 MHz
    DMT 0x55:  1280x720    60.000000 Hz  16:9     45.000 kHz     74.250000 MHz
    DMT 0x23:  1280x1024   60.019740 Hz   5:4     63.981 kHz    108.000000 MHz
    DMT 0x1c:  1280x800    59.810326 Hz  16:10    49.702 kHz     83.500000 MHz
    DMT 0x53:  1600x900    60.000000 Hz  16:9     60.000 kHz    108.000000 MHz (RB)
  Detailed Timing Descriptors:
    DTD 1:  1920x1080   74.972503 Hz  16:9     83.894 kHz    174.500000 MHz (analog composite, serrate, 597 mm x 336 mm)
                 Hfront   48 Hsync  44 Hback   68 Hpol N
                 Vfront    4 Vsync   5 Vback   30 Vpol N
    DTD 2:  1920x1080   60.000000 Hz  16:9     67.500 kHz    148.500000 MHz (analog composite, serrate)
                 Hfront   88 Hsync  44 Hback  148 Hpol N
                 Vfront    4 Vsync   5 Vback   36 Vpol N
    DTD 3:  1366x768    59.789541 Hz 683:384   47.712 kHz     85.500000 MHz (analog composite, serrate, 476 mm x 267 mm)
                 Hfront   70 Hsync 143 Hback  213 Hpol N
                 Vfront    3 Vsync   3 Vback   24 Vpol N
    Display Product Name: 'LM27-L200-DS'
Checksum: 0xdd

----------------

Warnings:

Block 0, Base EDID:
  Detailed Timing Descriptor #2: DTD is similar but not identical to VIC 16.
  Detailed Timing Descriptor #3: DTD is similar but not identical to DMT 0x51.

Failures:

Block 0, Base EDID:
  Detailed Timing Descriptor #2: Mismatch of image size vs display size: image size is not set, but display size is.
  Detailed Timing Descriptor #3: Mismatch of image size 476x267 mm vs display size 590x330 mm.
  Missing Display Range Limits Descriptor.
EDID:
  Extension Block 1 started with EDID header, ignoring Extension Blocks >= 1.

EDID conformity: FAIL
