edid-decode (hex):

00 ff ff ff ff ff ff 00 38 70 56 00 00 00 00 00
12 1e 01 04 95 1f 11 78 02 75 35 95 5c 57 8f 28
1d 50 54 00 00 00 01 01 01 01 01 01 01 01 01 01
01 01 01 01 01 01 2a 36 80 a0 70 38 1f 40 30 20
35 00 35 ae 10 00 00 1a 52 2b 80 a0 70 38 1f 40
30 20 35 00 35 ae 10 00 00 1a 00 00 00 fe 00 4a
34 59 4b 47 80 31 34 30 35 4c 30 31 00 00 00 00
00 00 41 21 99 00 11 00 00 0a 01 0a 20 20 00 0c

----------------

Block 0, Base EDID:
  EDID Structure Version & Revision: 1.4
  Vendor & Product Identification:
    Manufacturer: NCP
    Model: 86
    Made in: week 18 of 2020
  Basic Display Parameters & Features:
    Digital display
    Bits per primary color channel: 6
    DisplayPort interface
    Maximum image size: 31 cm x 17 cm
    Gamma: 2.20
    Supported color formats: RGB 4:4:4
    First detailed timing includes the native pixel format and preferred refresh rate
  Color Characteristics:
    Red  : 0.5830, 0.3623
    Green: 0.3408, 0.5595
    Blue : 0.1562, 0.1162
    White: 0.3134, 0.3291
  Established Timings I & II: none
  Standard Timings: none
  Detailed Timing Descriptors:
    DTD 1:  1920x1080   60.003116 Hz  16:9     66.663 kHz    138.660000 MHz (309 mm x 174 mm)
                 Hfront   48 Hsync  32 Hback   80 Hpol P
                 Vfront    3 Vsync   5 Vback   23 Vpol N
    DTD 2:  1920x1080   47.990376 Hz  16:9     53.317 kHz    110.900000 MHz (309 mm x 174 mm)
                 Hfront   48 Hsync  32 Hback   80 Hpol P
                 Vfront    3 Vsync   5 Vback   23 Vpol N
    Alphanumeric Data String: 'J4YKG.1405L01'
    Manufacturer-Specified Display Descriptor (0x00): 00 00 00 00 41 21 99 00 11 00 00 0a 01 0a 20 20 '....A!........  '
Checksum: 0x0c

----------------

Warnings:

Block 0, Base EDID:
  Alphanumeric Data String: Non-ASCII character 0x80 at position 5, can cause problems.
  Missing Display Product Name.

EDID conformity: PASS
