edid-decode (hex):

00 ff ff ff ff ff ff 00 04 72 28 0a 22 33 00 00
10 0f 01 03 80 39 22 78 e8 27 96 a5 56 48 9d 24
14 49 4e af ee 00 31 59 45 59 61 59 00 00 00 00
00 00 00 00 00 00 0e 1f 00 80 51 00 1e 30 40 80
37 00 3a 54 21 00 00 1e 00 00 00 fd 00 32 55 1e
50 08 00 0a 20 20 20 20 20 20 00 00 00 ff 00 31
32 33 34 0a 20 20 20 20 20 20 20 20 00 00 00 fc
00 41 63 65 72 20 41 4c 32 36 37 31 57 0a 00 c4

00 ff ff ff ff ff ff 00 04 72 28 0a 22 33 00 00
10 0f 01 03 80 39 22 78 e8 27 96 a5 56 48 9d 24
14 49 4e af ee 00 31 59 45 59 61 59 00 00 00 00
00 00 00 00 00 00 0e 1f 00 80 51 00 1e 30 40 80
37 00 3a 54 21 00 00 1e 00 00 00 fd 00 32 55 1e
50 08 00 0a 20 20 20 20 20 20 00 00 00 ff 00 31
32 33 34 0a 20 20 20 20 20 20 20 20 00 00 00 fc
00 41 63 65 72 20 41 4c 32 36 37 31 57 0a 00 c4

----------------

Block 0, Base EDID:
  EDID Structure Version & Revision: 1.3
  Vendor & Product Identification:
    Manufacturer: ACR
    Model: 2600
    Serial Number: ...
    Made in: week 16 of 2005
  Basic Display Parameters & Features:
    Digital display
    Maximum image size: 57 cm x 34 cm
    Gamma: 2.20
    DPMS levels: Standby Suspend Off
    RGB color display
  Color Characteristics:
    Red  : 0.6445, 0.3378
    Green: 0.2822, 0.6162
    Blue : 0.1425, 0.0791
    White: 0.2861, 0.3066
  Established Timings I & II:
    IBM     :   720x400    70.081663 Hz   9:5     31.467 kHz     28.320000 MHz
    DMT 0x04:   640x480    59.940476 Hz   4:3     31.469 kHz     25.175000 MHz
    DMT 0x05:   640x480    72.808802 Hz   4:3     37.861 kHz     31.500000 MHz
    DMT 0x06:   640x480    75.000000 Hz   4:3     37.500 kHz     31.500000 MHz
    DMT 0x08:   800x600    56.250000 Hz   4:3     35.156 kHz     36.000000 MHz
    DMT 0x09:   800x600    60.316541 Hz   4:3     37.879 kHz     40.000000 MHz
    DMT 0x0a:   800x600    72.187572 Hz   4:3     48.077 kHz     50.000000 MHz
    DMT 0x0b:   800x600    75.000000 Hz   4:3     46.875 kHz     49.500000 MHz
    Apple   :   832x624    74.551266 Hz   4:3     49.726 kHz     57.284000 MHz
    DMT 0x10:  1024x768    60.003840 Hz   4:3     48.363 kHz     65.000000 MHz
    DMT 0x11:  1024x768    70.069359 Hz   4:3     56.476 kHz     75.000000 MHz
    DMT 0x12:  1024x768    75.028582 Hz   4:3     60.023 kHz     78.750000 MHz
  Standard Timings:
    DMT 0x07:   640x480    85.008312 Hz   4:3     43.269 kHz     36.000000 MHz
    DMT 0x0c:   800x600    85.061274 Hz   4:3     53.674 kHz     56.250000 MHz
    DMT 0x13:  1024x768    84.996690 Hz   4:3     68.677 kHz     94.500000 MHz
  Detailed Timing Descriptors:
    DTD 1:  1280x768    59.870228 Hz   5:3     47.776 kHz     79.500000 MHz (570 mm x 340 mm)
                 Hfront   64 Hsync 128 Hback  192 Hpol P
                 Vfront    3 Vsync   7 Vback   20 Vpol P
    Display Range Limits:
      Monitor ranges (GTF): 50-85 Hz V, 30-80 kHz H, max dotclock 80 MHz
    Display Product Serial Number: ...
    Display Product Name: 'Acer AL2671W'
Checksum: 0xc4

----------------

Warnings:

Block 0, Base EDID:
  Detailed Timing Descriptor #1: DTD is similar but not identical to DMT 0x17.
EDID:
  No Native Video Resolution was defined.
  Base EDID: Some timings are out of range of the Monitor Ranges:
    Maximum Clock: 94.500 MHz (Monitor: 80.000 MHz)

Failures:

Block 0, Base EDID:
  Basic Display Parameters & Features: EDID 1.3 requires that the first detailed timing is the preferred timing.
  Standard Timings: Use 0x0101 as the invalid Standard Timings code, not 0x0000.
  Standard Timings: Use 0x0101 as the invalid Standard Timings code, not 0x0000.
  Standard Timings: Use 0x0101 as the invalid Standard Timings code, not 0x0000.
  Standard Timings: Use 0x0101 as the invalid Standard Timings code, not 0x0000.
  Standard Timings: Use 0x0101 as the invalid Standard Timings code, not 0x0000.
EDID:
  Extension Block 1 started with EDID header, ignoring Extension Blocks >= 1.

EDID conformity: FAIL
