edid-decode (hex):

00 ff ff ff ff ff ff 00 3c ad 00 37 00 00 00 00
0a 12 01 03 80 10 09 78 0a 68 37 a4 54 48 9a 25
0f 4a 4c 3f ef 80 01 01 01 01 01 01 01 01 01 01
01 01 01 01 01 01 01 1d 80 18 71 1c 16 20 58 2c
25 00 10 09 00 00 00 9e 01 1d 00 72 51 d0 1e 20
6e 28 55 00 10 09 00 00 00 1e 00 00 00 fc 00 20
32 32 5f 4c 43 44 5f 54 56 0a 20 20 00 00 00 fd
00 31 3d 0f 2e 08 00 0a 20 20 20 20 20 20 01 40

00 ff ff ff ff ff ff 00 3c ad 00 37 00 00 00 00
0a 12 01 03 80 10 09 78 0a 68 37 a4 54 48 9a 25
0f 4a 4c 3f ef 80 01 01 01 01 01 01 01 01 01 01
01 01 01 01 01 01 01 1d 80 18 71 1c 16 20 58 2c
25 00 10 09 00 00 00 9e 01 1d 00 72 51 d0 1e 20
6e 28 55 00 10 09 00 00 00 1e 00 00 00 fc 00 20
32 32 5f 4c 43 44 5f 54 56 0a 20 20 00 00 00 fd
00 31 3d 0f 2e 08 00 0a 20 20 20 20 20 20 01 40

----------------

Block 0, Base EDID:
  EDID Structure Version & Revision: 1.3
  Vendor & Product Identification:
    Manufacturer: OEM
    Model: 14080
    Made in: week 10 of 2008
  Basic Display Parameters & Features:
    Digital display
    Maximum image size: 16 cm x 9 cm
    Gamma: 2.20
    RGB color display
    First detailed timing is the preferred timing
  Color Characteristics:
    Red  : 0.6416, 0.3300
    Green: 0.2832, 0.6015
    Blue : 0.1445, 0.0615
    White: 0.2900, 0.2998
  Established Timings I & II:
    DMT 0x04:   640x480    59.940476 Hz   4:3     31.469 kHz     25.175000 MHz
    Apple   :   640x480    66.666667 Hz   4:3     35.000 kHz     30.240000 MHz
    DMT 0x05:   640x480    72.808802 Hz   4:3     37.861 kHz     31.500000 MHz
    DMT 0x06:   640x480    75.000000 Hz   4:3     37.500 kHz     31.500000 MHz
    DMT 0x08:   800x600    56.250000 Hz   4:3     35.156 kHz     36.000000 MHz
    DMT 0x09:   800x600    60.316541 Hz   4:3     37.879 kHz     40.000000 MHz
    DMT 0x0a:   800x600    72.187572 Hz   4:3     48.077 kHz     50.000000 MHz
    DMT 0x0b:   800x600    75.000000 Hz   4:3     46.875 kHz     49.500000 MHz
    Apple   :   832x624    74.551266 Hz   4:3     49.726 kHz     57.284000 MHz
    DMT 0x10:  1024x768    60.003840 Hz   4:3     48.363 kHz     65.000000 MHz
    DMT 0x11:  1024x768    70.069359 Hz   4:3     56.476 kHz     75.000000 MHz
    DMT 0x12:  1024x768    75.028582 Hz   4:3     60.023 kHz     78.750000 MHz
    DMT 0x24:  1280x1024   75.024675 Hz   5:4     79.976 kHz    135.000000 MHz
    Apple   :  1152x870    75.061550 Hz 192:145   68.681 kHz    100.000000 MHz
  Standard Timings: none
  Detailed Timing Descriptors:
    DTD 1:  1920x1080i  60.000000 Hz  16:9     33.750 kHz     74.250000 MHz (16 mm x 9 mm)
                 Hfront   88 Hsync  44 Hback  148 Hpol P
                 Vfront    2 Vsync   5 Vback   15 Vpol P Vfront +0.5 Odd Field
                 Vfront    2 Vsync   5 Vback   15 Vpol P Vback  +0.5 Even Field
    DTD 2:  1280x720    60.000000 Hz  16:9     45.000 kHz     74.250000 MHz (16 mm x 9 mm)
                 Hfront  110 Hsync  40 Hback  220 Hpol P
                 Vfront    5 Vsync   5 Vback   20 Vpol P
    Display Product Name: ' 22_LCD_TV'
    Display Range Limits:
      Monitor ranges (GTF): 49-61 Hz V, 15-46 kHz H, max dotclock 80 MHz
  Extension blocks: 1
Checksum: 0x40

----------------

Block 1, Unknown EDID Extension Block 0x00:
  00 ff ff ff ff ff ff 00 3c ad 00 37 00 00 00 00 '........<..7....'
  0a 12 01 03 80 10 09 78 0a 68 37 a4 54 48 9a 25 '.......x.h7.TH.%'
  0f 4a 4c 3f ef 80 01 01 01 01 01 01 01 01 01 01 '.JL?............'
  01 01 01 01 01 01 01 1d 80 18 71 1c 16 20 58 2c '..........q.. X,'
  25 00 10 09 00 00 00 9e 01 1d 00 72 51 d0 1e 20 '%..........rQ.. '
  6e 28 55 00 10 09 00 00 00 1e 00 00 00 fc 00 20 'n(U............ '
  32 32 5f 4c 43 44 5f 54 56 0a 20 20 00 00 00 fd '22_LCD_TV.  ....'
  00 31 3d 0f 2e 08 00 0a 20 20 20 20 20 20 01 40 '.1=.....      .@'
Checksum: 0x40

----------------

Warnings:

Block 0, Base EDID:
  Basic Display Parameters & Features: Dubious maximum image size (16x9 is smaller than 10x10 cm).
  Detailed Timing Descriptor #1: Dubious image size (16x9 mm is smaller than 100x100 mm).
  Detailed Timing Descriptor #2: Dubious image size (16x9 mm is smaller than 100x100 mm).
EDID:
  Base EDID: Some timings are out of range of the Monitor Ranges:
    Vertical Freq: 56.250 - 75.062 Hz (Monitor: 49.000 - 61.000 Hz)
    Horizontal Freq: 31.468 - 79.976 kHz (Monitor: 15.000 - 46.000 kHz)
    Maximum Clock: 135.000 MHz (Monitor: 80.000 MHz)

Failures:

Block 0, Base EDID:
  Detailed Timing Descriptor #1: Mismatch of image size 16x9 mm vs display size 160x90 mm.
  Detailed Timing Descriptor #2: Mismatch of image size 16x9 mm vs display size 160x90 mm.
Block 1, Base EDID:
  Unknown Extension Block.

EDID conformity: FAIL
