edid-decode (hex):

00 ff ff ff ff ff ff 00 09 d1 02 1c 5c 09 00 00
2c 15 01 03 80 00 00 78 2a c9 f0 a3 57 59 94 23
10 4e 5c bd ef 80 45 7c 61 7c 61 c0 81 40 81 80
90 40 a9 40 81 3c 9e 20 00 90 51 20 1f 30 48 80
36 00 00 00 00 00 00 1c 00 00 00 fd 00 17 78 1f
66 11 00 0a 20 20 20 20 20 20 00 00 00 fe 00 42
45 4e 51 0a 20 20 20 20 20 20 20 20 00 00 00 fc
00 4d 57 35 31 36 0a 20 20 20 20 20 20 20 01 39

02 03 25 71 52 15 16 06 07 1f 10 03 84 05 11 13
14 02 12 20 21 22 01 23 09 07 07 83 01 00 00 65
03 0c 00 10 00 01 1d 00 72 51 d0 1e 20 6e 28 55
00 c4 8e 21 00 00 1f 01 1d 80 18 71 1c 16 20 58
2c 25 00 00 00 00 00 00 9f 01 1d 80 d0 72 1c 16
20 10 2c 25 80 00 00 00 00 00 9e 8c 0a d0 8a 20
e0 2d 10 10 3e 96 00 00 00 00 00 00 19 01 1d 00
bc 52 d0 1e 20 b8 28 55 40 c4 8e 21 00 00 1e e6

00 ff ff ff ff ff ff 00 09 d1 02 1c 5c 09 00 00
2c 15 01 03 80 00 00 78 2a c9 f0 a3 57 59 94 23
10 4e 5c bd ef 80 45 7c 61 7c 61 c0 81 40 81 80
90 40 a9 40 81 3c 9e 20 00 90 51 20 1f 30 48 80
36 00 00 00 00 00 00 1c 00 00 00 fd 00 17 78 1f
66 11 00 0a 20 20 20 20 20 20 00 00 00 fe 00 42
45 4e 51 0a 20 20 20 20 20 20 20 20 00 00 00 fc
00 4d 57 35 31 36 0a 20 20 20 20 20 20 20 01 39

02 03 25 71 52 15 16 06 07 1f 10 03 84 05 11 13
14 02 12 20 21 22 01 23 09 07 07 83 01 00 00 65
03 0c 00 10 00 01 1d 00 72 51 d0 1e 20 6e 28 55
00 c4 8e 21 00 00 1f 01 1d 80 18 71 1c 16 20 58
2c 25 00 00 00 00 00 00 9f 01 1d 80 d0 72 1c 16
20 10 2c 25 80 00 00 00 00 00 9e 8c 0a d0 8a 20
e0 2d 10 10 3e 96 00 00 00 00 00 00 19 01 1d 00
bc 52 d0 1e 20 b8 28 55 40 c4 8e 21 00 00 1e e6

----------------

Block 0, Base EDID:
  EDID Structure Version & Revision: 1.3
  Vendor & Product Identification:
    Manufacturer: BNQ
    Model: 7170
    Serial Number: ...
    Made in: week 44 of 2011
  Basic Display Parameters & Features:
    Digital display
    Image size is variable
    Gamma: 2.20
    DPMS levels: Off
    RGB color display
    First detailed timing is the preferred timing
  Color Characteristics:
    Red  : 0.6396, 0.3398
    Green: 0.3496, 0.5791
    Blue : 0.1396, 0.0654
    White: 0.3046, 0.3593
  Established Timings I & II:
    IBM     :   720x400    70.081663 Hz   9:5     31.467 kHz     28.320000 MHz
    DMT 0x04:   640x480    59.940476 Hz   4:3     31.469 kHz     25.175000 MHz
    Apple   :   640x480    66.666667 Hz   4:3     35.000 kHz     30.240000 MHz
    DMT 0x05:   640x480    72.808802 Hz   4:3     37.861 kHz     31.500000 MHz
    DMT 0x06:   640x480    75.000000 Hz   4:3     37.500 kHz     31.500000 MHz
    DMT 0x09:   800x600    60.316541 Hz   4:3     37.879 kHz     40.000000 MHz
    DMT 0x0a:   800x600    72.187572 Hz   4:3     48.077 kHz     50.000000 MHz
    DMT 0x0b:   800x600    75.000000 Hz   4:3     46.875 kHz     49.500000 MHz
    Apple   :   832x624    74.551266 Hz   4:3     49.726 kHz     57.284000 MHz
    DMT 0x10:  1024x768    60.003840 Hz   4:3     48.363 kHz     65.000000 MHz
    DMT 0x11:  1024x768    70.069359 Hz   4:3     56.476 kHz     75.000000 MHz
    DMT 0x12:  1024x768    75.028582 Hz   4:3     60.023 kHz     78.750000 MHz
    DMT 0x24:  1280x1024   75.024675 Hz   5:4     79.976 kHz    135.000000 MHz
    Apple   :  1152x870    75.061550 Hz 192:145   68.681 kHz    100.000000 MHz
  Standard Timings:
    GTF     :   800x600   119.999886 Hz   4:3     77.160 kHz     83.950000 MHz
    GTF     :  1024x768   119.999931 Hz   4:3     98.760 kHz    139.054000 MHz
    GTF     :  1024x576    60.000204 Hz  16:9     35.820 kHz     46.996000 MHz
    DMT 0x20:  1280x960    60.000000 Hz   4:3     60.000 kHz    108.000000 MHz
    DMT 0x23:  1280x1024   60.019740 Hz   5:4     63.981 kHz    108.000000 MHz
    DMT 0x2a:  1400x1050   59.978442 Hz   4:3     65.317 kHz    121.750000 MHz
    DMT 0x33:  1600x1200   60.000000 Hz   4:3     75.000 kHz    162.000000 MHz
    GTF     :  1280x800   120.000265 Hz  16:10   102.960 kHz    181.210000 MHz
  Detailed Timing Descriptors:
    DTD 1:  1280x800    59.810326 Hz  16:10    49.702 kHz     83.500000 MHz
                 Hfront   72 Hsync 128 Hback  200 Hpol N
                 Vfront    3 Vsync   6 Vback   22 Vpol P
    Display Range Limits:
      Monitor ranges (GTF): 23-120 Hz V, 31-102 kHz H, max dotclock 170 MHz
    Alphanumeric Data String: 'BENQ'
    Display Product Name: 'MW516'
  Extension blocks: 1
Checksum: 0x39

----------------

Block 1, CTA-861 Extension Block:
  Revision: 3
  Basic audio support
  Supports YCbCr 4:4:4
  Supports YCbCr 4:2:2
  Native DTDs: 1
  Video Data Block:
    VIC  21:  1440x576i   50.000000 Hz   4:3     15.625 kHz     27.000000 MHz
    VIC  22:  1440x576i   50.000000 Hz  16:9     15.625 kHz     27.000000 MHz
    VIC   6:  1440x480i   59.940060 Hz   4:3     15.734 kHz     27.000000 MHz
    VIC   7:  1440x480i   59.940060 Hz  16:9     15.734 kHz     27.000000 MHz
    VIC  31:  1920x1080   50.000000 Hz  16:9     56.250 kHz    148.500000 MHz
    VIC  16:  1920x1080   60.000000 Hz  16:9     67.500 kHz    148.500000 MHz
    VIC   3:   720x480    59.940060 Hz  16:9     31.469 kHz     27.000000 MHz
    VIC   4:  1280x720    60.000000 Hz  16:9     45.000 kHz     74.250000 MHz (native)
    VIC   5:  1920x1080i  60.000000 Hz  16:9     33.750 kHz     74.250000 MHz
    VIC  17:   720x576    50.000000 Hz   4:3     31.250 kHz     27.000000 MHz
    VIC  19:  1280x720    50.000000 Hz  16:9     37.500 kHz     74.250000 MHz
    VIC  20:  1920x1080i  50.000000 Hz  16:9     28.125 kHz     74.250000 MHz
    VIC   2:   720x480    59.940060 Hz   4:3     31.469 kHz     27.000000 MHz
    VIC  18:   720x576    50.000000 Hz  16:9     31.250 kHz     27.000000 MHz
    VIC  32:  1920x1080   24.000000 Hz  16:9     27.000 kHz     74.250000 MHz
    VIC  33:  1920x1080   25.000000 Hz  16:9     28.125 kHz     74.250000 MHz
    VIC  34:  1920x1080   30.000000 Hz  16:9     33.750 kHz     74.250000 MHz
    VIC   1:   640x480    59.940476 Hz   4:3     31.469 kHz     25.175000 MHz
  Audio Data Block:
    Linear PCM:
      Max channels: 2
      Supported sample rates (kHz): 48 44.1 32
      Supported sample sizes (bits): 24 20 16
  Speaker Allocation Data Block:
    FL/FR - Front Left/Right
  Vendor-Specific Data Block (HDMI), OUI 00-0C-03:
    Source physical address: 1.0.0.0
  Detailed Timing Descriptors:
    DTD 2:  1280x720    60.000000 Hz  16:9     45.000 kHz     74.250000 MHz (708 mm x 398 mm)
                 Hfront  110 Hsync  40 Hback  220 Hpol P
                 Vfront    5 Vsync   5 Vback   20 Vpol P
    DTD 3:  1920x1080i  60.000000 Hz  16:9     33.750 kHz     74.250000 MHz
                 Hfront   88 Hsync  44 Hback  148 Hpol P
                 Vfront    2 Vsync   5 Vback   15 Vpol P Vfront +0.5 Odd Field
                 Vfront    2 Vsync   5 Vback   15 Vpol P Vback  +0.5 Even Field
    DTD 4:  1920x1080i  50.000000 Hz  16:9     28.125 kHz     74.250000 MHz
                 Hfront  528 Hsync  44 Hback  148 Hpol P
                 Vfront    2 Vsync   5 Vback   15 Vpol P Vfront +0.5 Odd Field
                 Vfront    2 Vsync   5 Vback   15 Vpol P Vback  +0.5 Even Field
    DTD 5:   720x480    59.940060 Hz   3:2     31.469 kHz     27.000000 MHz
                 Hfront   16 Hsync  62 Hback   60 Hpol N
                 Vfront    9 Vsync   6 Vback   30 Vpol N
    DTD 6:  1280x720    50.000000 Hz  16:9     37.500 kHz     74.250000 MHz (708 mm x 398 mm)
                 Hfront  440 Hsync  40 Hback  220 Hpol P
                 Vfront    5 Vsync   5 Vback   20 Vpol P
Checksum: 0xe6

----------------

Warnings:

Block 1, CTA-861 Extension Block:
  IT Video Formats are overscanned by default, but normally this should be underscanned.
  Video Data Block: VIC 21 and the first DTD are not identical. Is this intended?
  Add a Colorimetry Data Block with the sRGB colorimetry bit set to avoid interop issues.
EDID:
  Base EDID: Some timings are out of range of the Monitor Ranges:
    Horizontal Freq: 15.625 - 102.960 kHz (Monitor: 31.000 - 102.000 kHz)
    Maximum Clock: 181.210 MHz (Monitor: 170.000 MHz)

Failures:

Block 1, CTA-861 Extension Block:
  Missing VCDB, needed for Set Selectable RGB Quantization to avoid interop issues.
EDID:
  Extension Block 2 started with EDID header, ignoring Extension Blocks >= 2.
  Base EDID: The DTD max image size is 708x398mm, but the display size is not specified anywhere.
  CTA-861: Native progressive timings are a mix of several resolutions.

EDID conformity: FAIL
