edid-decode (hex):

00 ff ff ff ff ff ff 00 30 ae ba 66 00 00 00 00
27 1f 01 03 68 3c 22 78 2a ad b5 a3 55 4e 9e 26
0e 50 54 a1 08 00 81 80 95 00 a9 c0 b3 00 81 8c
81 00 01 01 01 01 02 3a 80 18 71 38 2d 40 58 2c
45 00 55 50 21 00 00 1e 00 00 00 fc 00 43 32 37
2d 33 35 0a 20 20 20 20 20 20 00 00 00 fd 00 32
4b 1e 51 11 00 0a 20 20 20 20 20 20 00 00 00 ff
00 55 52 48 47 42 39 56 30 0a 20 20 20 20 00 29

00 ff ff ff ff ff ff 00 30 ae ba 66 00 00 00 00
27 1f 01 03 68 3c 22 78 2a ad b5 a3 55 4e 9e 26
0e 50 54 a1 08 00 81 80 95 00 a9 c0 b3 00 81 8c
81 00 01 01 01 01 02 3a 80 18 71 38 2d 40 58 2c
45 00 55 50 21 00 00 1e 00 00 00 fc 00 43 32 37
2d 33 35 0a 20 20 20 20 20 20 00 00 00 fd 00 32
4b 1e 51 11 00 0a 20 20 20 20 20 20 00 00 00 ff
00 55 52 48 47 42 39 56 30 0a 20 20 20 20 00 29

----------------

Block 0, Base EDID:
  EDID Structure Version & Revision: 1.3
  Vendor & Product Identification:
    Manufacturer: LEN
    Model: 26298
    Made in: week 39 of 2021
  Basic Display Parameters & Features:
    Analog display
    Signal Level Standard: 0.700 : 0.000 : 0.700 V p-p
    Blank level equals black level
    Sync: Separate
    Maximum image size: 60 cm x 34 cm
    Gamma: 2.20
    DPMS levels: Off
    RGB color display
    First detailed timing is the preferred timing
  Color Characteristics:
    Red  : 0.6386, 0.3339
    Green: 0.3076, 0.6181
    Blue : 0.1503, 0.0576
    White: 0.3134, 0.3291
  Established Timings I & II:
    IBM     :   720x400    70.081663 Hz   9:5     31.467 kHz     28.320000 MHz
    DMT 0x04:   640x480    59.940476 Hz   4:3     31.469 kHz     25.175000 MHz
    DMT 0x09:   800x600    60.316541 Hz   4:3     37.879 kHz     40.000000 MHz
    DMT 0x10:  1024x768    60.003840 Hz   4:3     48.363 kHz     65.000000 MHz
  Standard Timings:
    DMT 0x23:  1280x1024   60.019740 Hz   5:4     63.981 kHz    108.000000 MHz
    DMT 0x2f:  1440x900    59.887445 Hz  16:10    55.935 kHz    106.500000 MHz
    DMT 0x53:  1600x900    60.000000 Hz  16:9     60.000 kHz    108.000000 MHz (RB)
    DMT 0x3a:  1680x1050   59.954250 Hz  16:10    65.290 kHz    146.250000 MHz
    GTF     :  1280x1024   72.000069 Hz   5:4     76.824 kHz    132.752000 MHz
    DMT 0x1c:  1280x800    59.810326 Hz  16:10    49.702 kHz     83.500000 MHz
  Detailed Timing Descriptors:
    DTD 1:  1920x1080   60.000000 Hz  16:9     67.500 kHz    148.500000 MHz (597 mm x 336 mm)
                 Hfront   88 Hsync  44 Hback  148 Hpol P
                 Vfront    4 Vsync   5 Vback   36 Vpol P
    Display Product Name: 'C27-35'
    Display Range Limits:
      Monitor ranges (GTF): 50-75 Hz V, 30-81 kHz H, max dotclock 170 MHz
    Display Product Serial Number: ...
Checksum: 0x29

----------------

Failures:

EDID:
  Extension Block 1 started with EDID header, ignoring Extension Blocks >= 1.

EDID conformity: FAIL
