edid-decode (hex):

00 ff ff ff ff ff ff 00 1e 6d 2f 5a 50 cc 04 00
0b 19 01 03 80 30 1e 78 ea 23 c5 a5 57 4f 9e 26
0f 50 54 a5 4b 80 71 4f 81 8f 81 80 61 40 61 4f
01 01 01 01 01 01 7c 2e 90 a0 60 1a 1e 40 30 20
36 00 e0 2c 11 00 00 1a 00 00 00 fd 00 38 4b 1e
53 0f 00 0a 20 20 20 20 20 20 00 00 00 fc 00 32
32 4d 42 36 35 0a 20 20 20 20 20 20 00 00 00 ff
00 35 31 31 4e 54 50 43 39 38 34 34 38 0a 00 f5

00 ff ff ff ff ff ff 00 1e 6d 2f 5a 50 cc 04 00
0b 19 01 03 80 30 1e 78 ea 23 c5 a5 57 4f 9e 26
0f 50 54 a5 4b 80 71 4f 81 8f 81 80 61 40 61 4f
01 01 01 01 01 01 7c 2e 90 a0 60 1a 1e 40 30 20
36 00 e0 2c 11 00 00 1a 00 00 00 fd 00 38 4b 1e
53 0f 00 0a 20 20 20 20 20 20 00 00 00 fc 00 32
32 4d 42 36 35 0a 20 20 20 20 20 20 00 00 00 ff
00 35 31 31 4e 54 50 43 39 38 34 34 38 0a 00 f5

----------------

Block 0, Base EDID:
  EDID Structure Version & Revision: 1.3
  Vendor & Product Identification:
    Manufacturer: GSM
    Model: 23087
    Serial Number: ...
    Made in: week 11 of 2015
  Basic Display Parameters & Features:
    Digital display
    Maximum image size: 48 cm x 30 cm
    Gamma: 2.20
    DPMS levels: Standby Suspend Off
    RGB color display
    First detailed timing is the preferred timing
  Color Characteristics:
    Red  : 0.6445, 0.3417
    Green: 0.3085, 0.6201
    Blue : 0.1513, 0.0585
    White: 0.3134, 0.3291
  Established Timings I & II:
    IBM     :   720x400    70.081663 Hz   9:5     31.467 kHz     28.320000 MHz
    DMT 0x04:   640x480    59.940476 Hz   4:3     31.469 kHz     25.175000 MHz
    DMT 0x06:   640x480    75.000000 Hz   4:3     37.500 kHz     31.500000 MHz
    DMT 0x09:   800x600    60.316541 Hz   4:3     37.879 kHz     40.000000 MHz
    DMT 0x0b:   800x600    75.000000 Hz   4:3     46.875 kHz     49.500000 MHz
    DMT 0x10:  1024x768    60.003840 Hz   4:3     48.363 kHz     65.000000 MHz
    DMT 0x12:  1024x768    75.028582 Hz   4:3     60.023 kHz     78.750000 MHz
    DMT 0x24:  1280x1024   75.024675 Hz   5:4     79.976 kHz    135.000000 MHz
    Apple   :  1152x870    75.061550 Hz 192:145   68.681 kHz    100.000000 MHz
  Standard Timings:
    DMT 0x15:  1152x864    75.000000 Hz   4:3     67.500 kHz    108.000000 MHz
    DMT 0x24:  1280x1024   75.024675 Hz   5:4     79.976 kHz    135.000000 MHz
    DMT 0x23:  1280x1024   60.019740 Hz   5:4     63.981 kHz    108.000000 MHz
    DMT 0x10:  1024x768    60.003840 Hz   4:3     48.363 kHz     65.000000 MHz
    DMT 0x12:  1024x768    75.028582 Hz   4:3     60.023 kHz     78.750000 MHz
  Detailed Timing Descriptors:
    DTD 1:  1680x1050   59.883253 Hz  16:10    64.674 kHz    119.000000 MHz (480 mm x 300 mm)
                 Hfront   48 Hsync  32 Hback   80 Hpol P
                 Vfront    3 Vsync   6 Vback   21 Vpol N
    Display Range Limits:
      Monitor ranges (GTF): 56-75 Hz V, 30-83 kHz H, max dotclock 150 MHz
    Display Product Name: '22MB65'
    Display Product Serial Number: ...
Checksum: 0xf5

----------------

Failures:

EDID:
  Extension Block 1 started with EDID header, ignoring Extension Blocks >= 1.

EDID conformity: FAIL
