edid-decode (hex):

00 ff ff ff ff ff ff 00 22 f0 9a 30 01 01 01 01
1f 19 01 03 80 40 28 78 2a 1d f5 ae 4f 35 b3 25
0d 50 54 a1 08 00 d1 00 b3 00 95 00 81 00 a9 40
81 80 d1 c0 81 c0 e2 68 00 a0 a0 40 2e 60 30 20
36 00 81 90 21 00 00 1a 00 00 00 fd 00 32 46 18
62 1b 00 0a 20 20 20 20 20 20 00 00 00 fc 00 48
50 20 5a 33 30 69 0a 20 20 20 20 20 00 00 00 ff
00 43 4e 34 35 33 31 30 59 56 51 0a 20 20 00 3b

00 ff ff ff ff ff ff 00 22 f0 9a 30 01 01 01 01
1f 19 01 03 80 40 28 78 2a 1d f5 ae 4f 35 b3 25
0d 50 54 a1 08 00 d1 00 b3 00 95 00 81 00 a9 40
81 80 d1 c0 81 c0 e2 68 00 a0 a0 40 2e 60 30 20
36 00 81 90 21 00 00 1a 00 00 00 fd 00 32 46 18
62 1b 00 0a 20 20 20 20 20 20 00 00 00 fc 00 48
50 20 5a 33 30 69 0a 20 20 20 20 20 00 00 00 ff
00 43 4e 34 35 33 31 30 59 56 51 0a 20 20 00 3b

----------------

Block 0, Base EDID:
  EDID Structure Version & Revision: 1.3
  Vendor & Product Identification:
    Manufacturer: HWP
    Model: 12442
    Serial Number: ...
    Made in: week 31 of 2015
  Basic Display Parameters & Features:
    Digital display
    Maximum image size: 64 cm x 40 cm
    Gamma: 2.20
    DPMS levels: Off
    RGB color display
    First detailed timing is the preferred timing
  Color Characteristics:
    Red  : 0.6796, 0.3095
    Green: 0.2099, 0.7001
    Blue : 0.1474, 0.0537
    White: 0.3134, 0.3291
  Established Timings I & II:
    IBM     :   720x400    70.081663 Hz   9:5     31.467 kHz     28.320000 MHz
    DMT 0x04:   640x480    59.940476 Hz   4:3     31.469 kHz     25.175000 MHz
    DMT 0x09:   800x600    60.316541 Hz   4:3     37.879 kHz     40.000000 MHz
    DMT 0x10:  1024x768    60.003840 Hz   4:3     48.363 kHz     65.000000 MHz
  Standard Timings:
    DMT 0x45:  1920x1200   59.884600 Hz  16:10    74.556 kHz    193.250000 MHz
    DMT 0x3a:  1680x1050   59.954250 Hz  16:10    65.290 kHz    146.250000 MHz
    DMT 0x2f:  1440x900    59.887445 Hz  16:10    55.935 kHz    106.500000 MHz
    DMT 0x1c:  1280x800    59.810326 Hz  16:10    49.702 kHz     83.500000 MHz
    DMT 0x33:  1600x1200   60.000000 Hz   4:3     75.000 kHz    162.000000 MHz
    DMT 0x23:  1280x1024   60.019740 Hz   5:4     63.981 kHz    108.000000 MHz
    DMT 0x52:  1920x1080   60.000000 Hz  16:9     67.500 kHz    148.500000 MHz
    DMT 0x55:  1280x720    60.000000 Hz  16:9     45.000 kHz     74.250000 MHz
  Detailed Timing Descriptors:
    DTD 1:  2560x1600   59.971589 Hz  16:10    98.713 kHz    268.500000 MHz (641 mm x 400 mm)
                 Hfront   48 Hsync  32 Hback   80 Hpol P
                 Vfront    3 Vsync   6 Vback   37 Vpol N
    Display Range Limits:
      Monitor ranges (GTF): 50-70 Hz V, 24-98 kHz H, max dotclock 270 MHz
    Display Product Name: 'HP Z30i'
    Display Product Serial Number: ...
Checksum: 0x3b

----------------

Warnings:

Block 0, Base EDID:
  Vendor & Product Identification: The serial number is one of the known dummy values, it should probably be set to 0.
EDID:
  Base EDID: Some timings are out of range of the Monitor Ranges:
    Horizontal Freq: 31.466 - 98.713 kHz (Monitor: 24.000 - 98.000 kHz)
    Could be due to a Monitor Range off-by-one rounding issue

Failures:

EDID:
  Extension Block 1 started with EDID header, ignoring Extension Blocks >= 1.

EDID conformity: FAIL
