edid-decode (hex):

00 ff ff ff ff ff ff 00 63 18 00 24 00 00 00 00
28 22 01 04 b5 36 1f 78 bb 7a 01 b3 4a 35 b8 25
0e 50 54 a5 cb 00 81 80 81 8f 95 00 a9 c0 b3 00
01 01 01 01 01 01 02 3a 80 18 71 38 2d 40 58 2c
45 00 1e 31 21 00 00 1e 00 00 00 ff 00 0a 20 20
20 20 20 20 20 20 20 20 20 20 00 00 00 fa 00 01
00 01 00 01 00 01 00 01 00 01 00 00 00 00 00 fc
00 47 46 32 34 30 41 0a 20 20 20 20 20 20 01 72

02 03 30 f1 4a 01 03 12 13 04 00 00 00 00 40 23
09 07 07 83 01 00 00 6d 1a 00 00 02 0b 30 b4 00
04 60 00 59 00 e3 05 e0 00 e6 06 07 01 60 60 00
e0 ab 80 50 70 38 14 40 18 20 35 00 1e 31 21 00
00 18 2a 44 80 a0 70 38 27 40 30 20 35 00 1e 31
21 00 00 1e 4c 98 80 a0 70 38 38 40 30 2c 35 00
1e 31 21 00 00 1a 56 a2 80 a0 70 38 1e 40 30 20
35 00 1e 31 21 00 00 1e 00 00 00 00 00 00 00 48

00 ff ff ff ff ff ff 00 63 18 00 24 00 00 00 00
28 22 01 04 b5 36 1f 78 bb 7a 01 b3 4a 35 b8 25
0e 50 54 a5 cb 00 81 80 81 8f 95 00 a9 c0 b3 00
01 01 01 01 01 01 02 3a 80 18 71 38 2d 40 58 2c
45 00 1e 31 21 00 00 1e 00 00 00 ff 00 0a 20 20
20 20 20 20 20 20 20 20 20 20 00 00 00 fa 00 01
00 01 00 01 00 01 00 01 00 01 00 00 00 00 00 fc
00 47 46 32 34 30 41 0a 20 20 20 20 20 20 01 72

02 03 30 f1 4a 01 03 12 13 04 00 00 00 00 40 23
09 07 07 83 01 00 00 6d 1a 00 00 02 0b 30 b4 00
04 60 00 59 00 e3 05 e0 00 e6 06 07 01 60 60 00
e0 ab 80 50 70 38 14 40 18 20 35 00 1e 31 21 00
00 18 2a 44 80 a0 70 38 27 40 30 20 35 00 1e 31
21 00 00 1e 4c 98 80 a0 70 38 38 40 30 2c 35 00
1e 31 21 00 00 1a 56 a2 80 a0 70 38 1e 40 30 20
35 00 1e 31 21 00 00 1e 00 00 00 00 00 00 00 48

----------------

Block 0, Base EDID:
  EDID Structure Version & Revision: 1.4
  Vendor & Product Identification:
    Manufacturer: XXX
    Model: 9216
    Made in: week 40 of 2024
  Basic Display Parameters & Features:
    Digital display
    Bits per primary color channel: 10
    DisplayPort interface
    Maximum image size: 54 cm x 31 cm
    Gamma: 2.20
    DPMS levels: Standby Off
    Supported color formats: RGB 4:4:4, YCrCb 4:4:4, YCrCb 4:2:2
    First detailed timing includes the native pixel format and preferred refresh rate
    Display supports continuous frequencies
  Color Characteristics:
    Red  : 0.7001, 0.2919
    Green: 0.2089, 0.7207
    Blue : 0.1445, 0.0546
    White: 0.3125, 0.3291
  Established Timings I & II:
    IBM     :   720x400    70.081663 Hz   9:5     31.467 kHz     28.320000 MHz
    DMT 0x04:   640x480    59.940476 Hz   4:3     31.469 kHz     25.175000 MHz
    DMT 0x06:   640x480    75.000000 Hz   4:3     37.500 kHz     31.500000 MHz
    DMT 0x09:   800x600    60.316541 Hz   4:3     37.879 kHz     40.000000 MHz
    DMT 0x0a:   800x600    72.187572 Hz   4:3     48.077 kHz     50.000000 MHz
    DMT 0x0b:   800x600    75.000000 Hz   4:3     46.875 kHz     49.500000 MHz
    DMT 0x10:  1024x768    60.003840 Hz   4:3     48.363 kHz     65.000000 MHz
    DMT 0x12:  1024x768    75.028582 Hz   4:3     60.023 kHz     78.750000 MHz
    DMT 0x24:  1280x1024   75.024675 Hz   5:4     79.976 kHz    135.000000 MHz
  Standard Timings:
    DMT 0x23:  1280x1024   60.019740 Hz   5:4     63.981 kHz    108.000000 MHz
    DMT 0x24:  1280x1024   75.024675 Hz   5:4     79.976 kHz    135.000000 MHz
    DMT 0x2f:  1440x900    59.887445 Hz  16:10    55.935 kHz    106.500000 MHz
    DMT 0x53:  1600x900    60.000000 Hz  16:9     60.000 kHz    108.000000 MHz (RB)
    DMT 0x3a:  1680x1050   59.954250 Hz  16:10    65.290 kHz    146.250000 MHz
  Detailed Timing Descriptors:
    DTD 1:  1920x1080   60.000000 Hz  16:9     67.500 kHz    148.500000 MHz (542 mm x 305 mm)
                 Hfront   88 Hsync  44 Hback  148 Hpol P
                 Vfront    4 Vsync   5 Vback   36 Vpol P
    Display Product Serial Number: ...
    Standard Timing Identifications:
    Display Product Name: 'GF240A'
  Extension blocks: 1
Checksum: 0x72

----------------

Block 1, CTA-861 Extension Block:
  Revision: 3
  Underscans IT Video Formats by default
  Basic audio support
  Supports YCbCr 4:4:4
  Supports YCbCr 4:2:2
  Native DTDs: 1
  Video Data Block:
    VIC   1:   640x480    59.940476 Hz   4:3     31.469 kHz     25.175000 MHz
    VIC   3:   720x480    59.940060 Hz  16:9     31.469 kHz     27.000000 MHz
    VIC  18:   720x576    50.000000 Hz  16:9     31.250 kHz     27.000000 MHz
    VIC  19:  1280x720    50.000000 Hz  16:9     37.500 kHz     74.250000 MHz
    VIC   4:  1280x720    60.000000 Hz  16:9     45.000 kHz     74.250000 MHz
    VIC  64:  1920x1080  100.000000 Hz  16:9    112.500 kHz    297.000000 MHz
  Audio Data Block:
    Linear PCM:
      Max channels: 2
      Supported sample rates (kHz): 48 44.1 32
      Supported sample sizes (bits): 24 20 16
  Speaker Allocation Data Block:
    FL/FR - Front Left/Right
  Vendor-Specific Data Block (AMD), OUI 00-00-1A:
    Version: 2
    Flags 1: 0x0b
      FreeSync Supported
      FreeSync 2 HDR Supported
      Local Dimming Supported
    Minimum Refresh Rate: 48 Hz
    Maximum Refresh Rate: 180 Hz
    Flags 5: 0x04
      Gamma 2.2 EOTF Supported
    Maximum luminance: 96 (400.000 cd/m^2)
    Minimum luminance: 0 (0.000 cd/m^2)
    Maximum luminance (without local dimming): 89 (343.724 cd/m^2)
    Minimum luminance (without local dimming): 0 (0.000 cd/m^2)
  Colorimetry Data Block:
    BT2020cYCC
    BT2020YCC
    BT2020RGB
  HDR Static Metadata Data Block:
    Electro optical transfer functions:
      Traditional gamma - SDR luminance range
      Traditional gamma - HDR luminance range
      SMPTE ST2084
    Supported static metadata descriptors:
      Static metadata type 1
    Desired content max luminance: 96 (400.000 cd/m^2)
    Desired content max frame-average luminance: 96 (400.000 cd/m^2)
    Desired content min luminance: 0 (0.000 cd/m^2)
  Detailed Timing Descriptors:
    DTD 2:  1920x1080  200.000000 Hz  16:9    220.000 kHz    440.000000 MHz (542 mm x 305 mm)
                 Hfront   24 Hsync  32 Hback   24 Hpol N
                 Vfront    3 Vsync   5 Vback   12 Vpol N
    DTD 3:  1920x1080   74.972503 Hz  16:9     83.894 kHz    174.500000 MHz (542 mm x 305 mm)
                 Hfront   48 Hsync  32 Hback   80 Hpol P
                 Vfront    3 Vsync   5 Vback   31 Vpol P
    DTD 4:  1920x1080  165.002031 Hz  16:9    187.442 kHz    389.880000 MHz (542 mm x 305 mm)
                 Hfront   48 Hsync  44 Hback   68 Hpol P
                 Vfront    3 Vsync   5 Vback   48 Vpol N
    DTD 5:  1920x1080  179.998267 Hz  16:9    199.798 kHz    415.580000 MHz (542 mm x 305 mm)
                 Hfront   48 Hsync  32 Hback   80 Hpol P
                 Vfront    3 Vsync   5 Vback   22 Vpol P
Checksum: 0x48  Unused space in Extension Block: 7 bytes

----------------

Warnings:

Block 0, Base EDID:
  Detailed Timing Descriptor #1: DTD is identical to VIC 16, which is not present in the CTA Ext Block.
Block 1, CTA-861 Extension Block:
  Video Data Block: VIC 1 and the first DTD are not identical. Is this intended?
  Colorimetry Data Block: Set the sRGB colorimetry bit to avoid interop issues.

Failures:

Block 0, Base EDID:
  Display Product Serial Number: ...
  Standard Timing Identifications: Use 0x0101 as the invalid Standard Timings code, not 0x0100.
  Standard Timing Identifications: Use 0x0101 as the invalid Standard Timings code, not 0x0100.
  Standard Timing Identifications: Use 0x0101 as the invalid Standard Timings code, not 0x0100.
  Standard Timing Identifications: Use 0x0101 as the invalid Standard Timings code, not 0x0100.
  Standard Timing Identifications: Use 0x0101 as the invalid Standard Timings code, not 0x0100.
  Standard Timing Identifications: Use 0x0101 as the invalid Standard Timings code, not 0x0100.
  Missing Display Range Limits Descriptor.
Block 1, CTA-861 Extension Block:
  Missing VCDB, needed for Set Selectable RGB Quantization to avoid interop issues.
EDID:
  Extension Block 2 started with EDID header, ignoring Extension Blocks >= 2.

EDID conformity: FAIL
