edid-decode (hex):

00 ff ff ff ff ff ff 00 30 e4 88 07 00 00 00 00
00 21 01 04 a5 22 16 78 03 0f 95 ae 52 43 b0 26
0f 50 54 00 00 00 01 01 01 01 01 01 01 01 01 01
01 01 01 01 01 01 35 3c 80 a0 70 b0 23 40 30 20
36 00 59 d7 10 00 00 1a 2a 30 80 a0 70 b0 23 40
30 20 36 00 59 d7 10 00 00 1a 00 00 00 fe 00 4d
34 57 35 35 80 31 36 30 57 55 34 0a 00 00 00 00
00 02 41 31 b2 00 10 00 00 0a 41 0a 20 20 00 88

00 ff ff ff ff ff ff 00 30 e4 88 07 00 00 00 00
00 21 01 04 a5 22 16 78 03 0f 95 ae 52 43 b0 26
0f 50 54 00 00 00 01 01 01 01 01 01 01 01 01 01
01 01 01 01 01 01 35 3c 80 a0 70 b0 23 40 30 20
36 00 59 d7 10 00 00 1a 2a 30 80 a0 70 b0 23 40
30 20 36 00 59 d7 10 00 00 1a 00 00 00 fe 00 4d
34 57 35 35 80 31 36 30 57 55 34 0a 00 00 00 00
00 02 41 31 b2 00 10 00 00 0a 41 0a 20 20 00 88

----------------

Block 0, Base EDID:
  EDID Structure Version & Revision: 1.4
  Vendor & Product Identification:
    Manufacturer: LGD
    Model: 1928
    Made in: 2023
  Basic Display Parameters & Features:
    Digital display
    Bits per primary color channel: 8
    DisplayPort interface
    Maximum image size: 34 cm x 22 cm
    Gamma: 2.20
    Supported color formats: RGB 4:4:4
    First detailed timing includes the native pixel format and preferred refresh rate
    Display supports continuous frequencies
  Color Characteristics:
    Red  : 0.6796, 0.3203
    Green: 0.2646, 0.6904
    Blue : 0.1503, 0.0595
    White: 0.3134, 0.3291
  Established Timings I & II: none
  Standard Timings: none
  Detailed Timing Descriptors:
    DTD 1:  1920x1200   60.000779 Hz  16:10    74.101 kHz    154.130000 MHz (345 mm x 215 mm)
                 Hfront   48 Hsync  32 Hback   80 Hpol P
                 Vfront    3 Vsync   6 Vback   26 Vpol N
    DTD 2:  1920x1200   47.999066 Hz  16:10    59.279 kHz    123.300000 MHz (345 mm x 215 mm)
                 Hfront   48 Hsync  32 Hback   80 Hpol P
                 Vfront    3 Vsync   6 Vback   26 Vpol N
    Alphanumeric Data String: 'M4W55.160WU4'
    Manufacturer-Specified Display Descriptor (0x00): 00 00 00 02 41 31 b2 00 10 00 00 0a 41 0a 20 20 '....A1......A.  '
Checksum: 0x88

----------------

Warnings:

Block 0, Base EDID:
  Alphanumeric Data String: Non-ASCII character 0x80 at position 5, can cause problems.
  Missing Display Product Name.

Failures:

Block 0, Base EDID:
  Missing Display Range Limits Descriptor.
EDID:
  Extension Block 1 started with EDID header, ignoring Extension Blocks >= 1.

EDID conformity: FAIL
