edid-decode (hex):

00 ff ff ff ff ff ff 00 51 b8 02 16 00 00 00 00
28 1f 01 04 b5 22 15 78 07 5d d5 a3 53 4b 98 24
0f 50 54 00 00 00 01 01 01 01 01 01 01 01 01 01
01 01 01 01 01 01 26 ae 80 a0 70 b0 63 40 30 20
36 00 59 d7 10 00 00 18 99 ab 80 a0 70 b0 79 4c
30 20 75 04 58 d7 10 00 00 18 00 00 00 fd 00 30
a5 d7 d7 2c 01 0a 20 20 20 20 20 20 00 00 00 fe
00 4c 45 4e 31 36 30 57 55 58 47 41 20 20 00 87

00 ff ff ff ff ff ff 00 51 b8 02 16 00 00 00 00
28 1f 01 04 b5 22 15 78 07 5d d5 a3 53 4b 98 24
0f 50 54 00 00 00 01 01 01 01 01 01 01 01 01 01
01 01 01 01 01 01 26 ae 80 a0 70 b0 63 40 30 20
36 00 59 d7 10 00 00 18 99 ab 80 a0 70 b0 79 4c
30 20 75 04 58 d7 10 00 00 18 00 00 00 fd 00 30
a5 d7 d7 2c 01 0a 20 20 20 20 20 20 00 00 00 fe
00 4c 45 4e 31 36 30 57 55 58 47 41 20 20 00 87

----------------

Block 0, Base EDID:
  EDID Structure Version & Revision: 1.4
  Vendor & Product Identification:
    Manufacturer: TMX
    Model: 5634
    Made in: week 40 of 2021
  Basic Display Parameters & Features:
    Digital display
    Bits per primary color channel: 10
    DisplayPort interface
    Maximum image size: 34 cm x 21 cm
    Gamma: 2.20
    Supported color formats: RGB 4:4:4
    Default (sRGB) color space is primary color space
    First detailed timing includes the native pixel format and preferred refresh rate
    Display supports continuous frequencies
  Color Characteristics:
    Red  : 0.6376, 0.3251
    Green: 0.2958, 0.5947
    Blue : 0.1435, 0.0595
    White: 0.3134, 0.3291
  Established Timings I & II: none
  Standard Timings: none
  Detailed Timing Descriptors:
    DTD 1:  1920x1200  165.001184 Hz  16:10   214.337 kHz    445.820000 MHz (345 mm x 215 mm)
                 Hfront   48 Hsync  32 Hback   80 Hpol N
                 Vfront    3 Vsync   6 Vback   90 Vpol N
    DTD 2:  1920x1200   48.075829 Hz  16:10   211.197 kHz    439.290000 MHz (344 mm x 215 mm)
                 Hfront   48 Hsync  32 Hback   80 Hpol N
                 Vfront   23 Vsync   5 Vback 3165 Vpol N
    Display Range Limits:
      Monitor ranges (Range Limits Only): 48-165 Hz V, 215-215 kHz H, max dotclock 440 MHz
    Alphanumeric Data String: 'LEN160WUXGA  '
Checksum: 0x87

----------------

Warnings:

Block 0, Base EDID:
  Missing Display Product Name.
EDID:
  Base EDID: Some timings are out of range of the Monitor Ranges:
    Horizontal Freq: 211.197 - 214.336 kHz (Monitor: 215.000 - 215.000 kHz)
    Maximum Clock: 445.820 MHz (Monitor: 440.000 MHz)

Failures:

Block 0, Base EDID:
  Basic Display Parameters & Features: sRGB is signaled, but the chromaticities do not match.
  Alphanumeric Data String: No newline, but one or more trailing spaces.
EDID:
  Extension Block 1 started with EDID header, ignoring Extension Blocks >= 1.

EDID conformity: FAIL
