edid-decode (hex):

00 ff ff ff ff ff ff 00 0e d4 69 46 00 00 00 00
1a 13 01 03 00 24 1d 78 ef 0d c2 a0 57 47 98 27
12 48 4f bf ce 00 01 01 01 01 01 01 01 01 01 01
01 01 01 01 01 01 cc 29 a0 d0 51 84 22 30 0a 98
36 00 68 22 11 00 00 1e 00 00 00 10 00 00 1e 30
40 80 37 00 68 22 11 00 00 1c d0 20 00 90 51 20
1f 30 10 90 13 00 4a 00 10 00 00 1c 84 35 a0 f0
51 84 2a 30 0c 98 36 00 68 22 11 00 00 1e 00 ed

00 ff ff ff ff ff ff 00 0e d4 69 46 00 00 00 00
1a 13 01 03 00 24 1d 78 ef 0d c2 a0 57 47 98 27
12 48 4f bf ce 00 01 01 01 01 01 01 01 01 01 01
01 01 01 01 01 01 cc 29 a0 d0 51 84 22 30 0a 98
36 00 68 22 11 00 00 1e 00 00 00 10 00 00 1e 30
40 80 37 00 68 22 11 00 00 1c d0 20 00 90 51 20
1f 30 10 90 13 00 4a 00 10 00 00 1c 84 35 a0 f0
51 84 2a 30 0c 98 36 00 68 22 11 00 00 1e 00 ed

----------------

Block 0, Base EDID:
  EDID Structure Version & Revision: 1.3
  Vendor & Product Identification:
    Manufacturer: CVT
    Model: 18025
    Made in: week 26 of 2009
  Basic Display Parameters & Features:
    Analog display
    Signal Level Standard: 0.700 : 0.300 : 1.000 V p-p
    Blank level equals black level
    Maximum image size: 36 cm x 29 cm
    Gamma: 2.20
    DPMS levels: Standby Suspend Off
    RGB color display
    Default (sRGB) color space is primary color space
    First detailed timing is the preferred timing
    Supports GTF timings within operating range
  Color Characteristics:
    Red  : 0.6250, 0.3398
    Green: 0.2802, 0.5947
    Blue : 0.1552, 0.0703
    White: 0.2812, 0.3105
  Established Timings I & II:
    IBM     :   720x400    70.081663 Hz   9:5     31.467 kHz     28.320000 MHz
    DMT 0x04:   640x480    59.940476 Hz   4:3     31.469 kHz     25.175000 MHz
    Apple   :   640x480    66.666667 Hz   4:3     35.000 kHz     30.240000 MHz
    DMT 0x05:   640x480    72.808802 Hz   4:3     37.861 kHz     31.500000 MHz
    DMT 0x06:   640x480    75.000000 Hz   4:3     37.500 kHz     31.500000 MHz
    DMT 0x08:   800x600    56.250000 Hz   4:3     35.156 kHz     36.000000 MHz
    DMT 0x09:   800x600    60.316541 Hz   4:3     37.879 kHz     40.000000 MHz
    DMT 0x0a:   800x600    72.187572 Hz   4:3     48.077 kHz     50.000000 MHz
    DMT 0x0b:   800x600    75.000000 Hz   4:3     46.875 kHz     49.500000 MHz
    DMT 0x10:  1024x768    60.003840 Hz   4:3     48.363 kHz     65.000000 MHz
    DMT 0x11:  1024x768    70.069359 Hz   4:3     56.476 kHz     75.000000 MHz
    DMT 0x12:  1024x768    75.028582 Hz   4:3     60.023 kHz     78.750000 MHz
  Standard Timings: none
  Detailed Timing Descriptors:
    DTD 1:  1440x900    60.168607 Hz  16:10    56.197 kHz    107.000000 MHz (360 mm x 290 mm)
                 Hfront   10 Hsync 152 Hback  302 Hpol P
                 Vfront    3 Vsync   6 Vback   25 Vpol P
    Dummy Descriptor:
    DTD 2:  1280x800    60.168472 Hz  16:10    50.000 kHz     84.000000 MHz (330 mm x 0 mm)
                 Hfront   16 Hsync 144 Hback  240 Hpol N
                 Vfront    1 Vsync   3 Vback   27 Vpol P
    DTD 3:  1440x900    75.121510 Hz  16:10    70.764 kHz    137.000000 MHz (360 mm x 290 mm)
                 Hfront   12 Hsync 152 Hback  332 Hpol P
                 Vfront    3 Vsync   6 Vback   33 Vpol P
Checksum: 0xed

----------------

Block 1, Unknown EDID Extension Block 0x00:
  00 ff ff ff ff ff ff 00 0e d4 69 46 00 00 00 00 '..........iF....'
  1a 13 01 03 00 24 1d 78 ef 0d c2 a0 57 47 98 27 '.....$.x....WG.''
  12 48 4f bf ce 00 01 01 01 01 01 01 01 01 01 01 '.HO.............'
  01 01 01 01 01 01 cc 29 a0 d0 51 84 22 30 0a 98 '.......)..Q."0..'
  36 00 68 22 11 00 00 1e 00 00 00 10 00 00 1e 30 '6.h"...........0'
  40 80 37 00 68 22 11 00 00 1c d0 20 00 90 51 20 '@.7.h"..... ..Q '
  1f 30 10 90 13 00 4a 00 10 00 00 1c 84 35 a0 f0 '.0....J......5..'
  51 84 2a 30 0c 98 36 00 68 22 11 00 00 1e 00 ed 'Q.*0..6.h"......'
Checksum: 0xed

----------------

Warnings:

Block 0, Base EDID:
  Detailed Timing Descriptor #1: Image size is 360x290 mm, but based on the picture AR it should be 360x225 mm.
  Detailed Timing Descriptor #3: Image size is 360x290 mm, but based on the picture AR it should be 360x225 mm.

Failures:

Block 0, Base EDID:
  Basic Display Parameters & Features: sRGB is signaled, but the chromaticities do not match.
  Dummy Descriptor: Dummy block filled with garbage.
  Detailed Timing Descriptor #2: Mismatch of image size 330x0 mm vs display size 360x290 mm.
  Detailed Timing Descriptor #2: Mismatch of image size vs display size: image size is not set, but display size is.
  Detailed Timing Descriptor #2: Invalid detailed timing descriptor ordering.
  Detailed Timing Descriptor #3: Invalid detailed timing descriptor ordering.
  Missing Display Product Name.
  Missing Display Range Limits Descriptor.
Block 1, Base EDID:
  Unknown Extension Block.
EDID:
  Base EDID: EDID specified 0 extension block(s), but found 1 extension block(s).

EDID conformity: FAIL
