edid-decode (hex):

00 ff ff ff ff ff ff 00 5a 63 40 10 01 00 00 00
11 23 01 04 b5 3c 22 78 3b 7e 70 b1 4d 43 a6 22
0e 50 54 bf ef 80 d1 c0 b3 00 a9 40 95 00 90 40
81 80 81 40 81 c0 6a 5e 00 a0 a0 a0 29 50 30 20
35 00 55 50 21 00 00 1a 00 00 00 ff 00 59 35 34
32 35 31 37 32 30 32 33 30 0a 00 00 00 fd 00 30
b4 ff ff 48 01 0a 20 20 20 20 20 20 00 00 00 fc
00 56 58 32 37 35 38 41 2d 32 4b 0a 20 20 02 cd

02 03 2e f1 4d 1f 01 02 03 04 05 10 11 12 13 14
3f 4d 23 09 07 07 83 01 00 00 68 1a 00 00 01 01
30 b4 00 e3 05 e3 01 e6 06 07 01 60 60 4f d4 bc
00 a0 a0 a0 29 50 30 20 35 00 55 50 21 00 00 1a
5c 9d 00 a0 a0 a0 29 50 30 20 35 00 55 50 21 00
00 1a 1c 82 80 88 70 38 2d 40 18 20 35 00 55 50
21 00 00 1a 98 e2 00 a0 a0 a0 29 50 30 20 35 00
55 50 21 00 00 1a 00 00 00 00 00 00 00 00 00 41

70 12 79 00 00 03 01 28 a3 03 01 04 ff 09 9f 00
2f 80 1f 00 9f 05 28 00 02 80 04 00 13 17 01 04
ff 09 77 00 2f 00 1f 00 9f 05 28 00 02 00 04 00
00 00 00 00 00 00 00 00 00 00 00 00 00 00 00 00
00 00 00 00 00 00 00 00 00 00 00 00 00 00 00 00
00 00 00 00 00 00 00 00 00 00 00 00 00 00 00 00
00 00 00 00 00 00 00 00 00 00 00 00 00 00 00 00
00 00 00 00 00 00 00 00 00 00 00 00 00 00 09 90

00 ff ff ff ff ff ff 00 5a 63 40 10 01 00 00 00
11 23 01 04 b5 3c 22 78 3b 7e 70 b1 4d 43 a6 22
0e 50 54 bf ef 80 d1 c0 b3 00 a9 40 95 00 90 40
81 80 81 40 81 c0 6a 5e 00 a0 a0 a0 29 50 30 20
35 00 55 50 21 00 00 1a 00 00 00 ff 00 59 35 34
32 35 31 37 32 30 32 33 30 0a 00 00 00 fd 00 30
b4 ff ff 48 01 0a 20 20 20 20 20 20 00 00 00 fc
00 56 58 32 37 35 38 41 2d 32 4b 0a 20 20 02 cd

02 03 2e f1 4d 1f 01 02 03 04 05 10 11 12 13 14
3f 4d 23 09 07 07 83 01 00 00 68 1a 00 00 01 01
30 b4 00 e3 05 e3 01 e6 06 07 01 60 60 4f d4 bc
00 a0 a0 a0 29 50 30 20 35 00 55 50 21 00 00 1a
5c 9d 00 a0 a0 a0 29 50 30 20 35 00 55 50 21 00
00 1a 1c 82 80 88 70 38 2d 40 18 20 35 00 55 50
21 00 00 1a 98 e2 00 a0 a0 a0 29 50 30 20 35 00
55 50 21 00 00 1a 00 00 00 00 00 00 00 00 00 41

70 12 79 00 00 03 01 28 a3 03 01 04 ff 09 9f 00
2f 80 1f 00 9f 05 28 00 02 80 04 00 13 17 01 04
ff 09 77 00 2f 00 1f 00 9f 05 28 00 02 00 04 00
00 00 00 00 00 00 00 00 00 00 00 00 00 00 00 00
00 00 00 00 00 00 00 00 00 00 00 00 00 00 00 00
00 00 00 00 00 00 00 00 00 00 00 00 00 00 00 00
00 00 00 00 00 00 00 00 00 00 00 00 00 00 00 00
00 00 00 00 00 00 00 00 00 00 00 00 00 00 09 90

----------------

Block 0, Base EDID:
  EDID Structure Version & Revision: 1.4
  Vendor & Product Identification:
    Manufacturer: VSC
    Model: 4160
    Serial Number: ...
    Made in: week 17 of 2025
  Basic Display Parameters & Features:
    Digital display
    Bits per primary color channel: 10
    DisplayPort interface
    Maximum image size: 60 cm x 34 cm
    Gamma: 2.20
    DPMS levels: Off
    Supported color formats: RGB 4:4:4, YCrCb 4:4:4, YCrCb 4:2:2
    First detailed timing includes the native pixel format and preferred refresh rate
    Display supports continuous frequencies
  Color Characteristics:
    Red  : 0.6923, 0.3037
    Green: 0.2646, 0.6503
    Blue : 0.1337, 0.0576
    White: 0.3125, 0.3281
  Established Timings I & II:
    IBM     :   720x400    70.081663 Hz   9:5     31.467 kHz     28.320000 MHz
    DMT 0x04:   640x480    59.940476 Hz   4:3     31.469 kHz     25.175000 MHz
    Apple   :   640x480    66.666667 Hz   4:3     35.000 kHz     30.240000 MHz
    DMT 0x05:   640x480    72.808802 Hz   4:3     37.861 kHz     31.500000 MHz
    DMT 0x06:   640x480    75.000000 Hz   4:3     37.500 kHz     31.500000 MHz
    DMT 0x08:   800x600    56.250000 Hz   4:3     35.156 kHz     36.000000 MHz
    DMT 0x09:   800x600    60.316541 Hz   4:3     37.879 kHz     40.000000 MHz
    DMT 0x0a:   800x600    72.187572 Hz   4:3     48.077 kHz     50.000000 MHz
    DMT 0x0b:   800x600    75.000000 Hz   4:3     46.875 kHz     49.500000 MHz
    Apple   :   832x624    74.551266 Hz   4:3     49.726 kHz     57.284000 MHz
    DMT 0x10:  1024x768    60.003840 Hz   4:3     48.363 kHz     65.000000 MHz
    DMT 0x11:  1024x768    70.069359 Hz   4:3     56.476 kHz     75.000000 MHz
    DMT 0x12:  1024x768    75.028582 Hz   4:3     60.023 kHz     78.750000 MHz
    DMT 0x24:  1280x1024   75.024675 Hz   5:4     79.976 kHz    135.000000 MHz
    Apple   :  1152x870    75.061550 Hz 192:145   68.681 kHz    100.000000 MHz
  Standard Timings:
    DMT 0x52:  1920x1080   60.000000 Hz  16:9     67.500 kHz    148.500000 MHz
    DMT 0x3a:  1680x1050   59.954250 Hz  16:10    65.290 kHz    146.250000 MHz
    DMT 0x33:  1600x1200   60.000000 Hz   4:3     75.000 kHz    162.000000 MHz
    DMT 0x2f:  1440x900    59.887445 Hz  16:10    55.935 kHz    106.500000 MHz
    DMT 0x2a:  1400x1050   59.978442 Hz   4:3     65.317 kHz    121.750000 MHz
    DMT 0x23:  1280x1024   60.019740 Hz   5:4     63.981 kHz    108.000000 MHz
    DMT 0x20:  1280x960    60.000000 Hz   4:3     60.000 kHz    108.000000 MHz
    DMT 0x55:  1280x720    60.000000 Hz  16:9     45.000 kHz     74.250000 MHz
  Detailed Timing Descriptors:
    DTD 1:  2560x1440   60.000199 Hz  16:9     88.860 kHz    241.700000 MHz (597 mm x 336 mm)
                 Hfront   48 Hsync  32 Hback   80 Hpol P
                 Vfront    3 Vsync   5 Vback   33 Vpol N
    Display Product Serial Number: ...
    Display Range Limits:
      Monitor ranges (Range Limits Only): 48-180 Hz V, 255-255 kHz H, max dotclock 720 MHz
    Display Product Name: 'VX2758A-2K'
  Extension blocks: 2
Checksum: 0xcd

----------------

Block 1, CTA-861 Extension Block:
  Revision: 3
  Underscans IT Video Formats by default
  Basic audio support
  Supports YCbCr 4:4:4
  Supports YCbCr 4:2:2
  Native DTDs: 1
  Video Data Block:
    VIC  31:  1920x1080   50.000000 Hz  16:9     56.250 kHz    148.500000 MHz
    VIC   1:   640x480    59.940476 Hz   4:3     31.469 kHz     25.175000 MHz
    VIC   2:   720x480    59.940060 Hz   4:3     31.469 kHz     27.000000 MHz
    VIC   3:   720x480    59.940060 Hz  16:9     31.469 kHz     27.000000 MHz
    VIC   4:  1280x720    60.000000 Hz  16:9     45.000 kHz     74.250000 MHz
    VIC   5:  1920x1080i  60.000000 Hz  16:9     33.750 kHz     74.250000 MHz
    VIC  16:  1920x1080   60.000000 Hz  16:9     67.500 kHz    148.500000 MHz
    VIC  17:   720x576    50.000000 Hz   4:3     31.250 kHz     27.000000 MHz
    VIC  18:   720x576    50.000000 Hz  16:9     31.250 kHz     27.000000 MHz
    VIC  19:  1280x720    50.000000 Hz  16:9     37.500 kHz     74.250000 MHz
    VIC  20:  1920x1080i  50.000000 Hz  16:9     28.125 kHz     74.250000 MHz
    VIC  63:  1920x1080  120.000000 Hz  16:9    135.000 kHz    297.000000 MHz
    VIC  77:  1920x1080  100.000000 Hz  64:27   112.500 kHz    297.000000 MHz
  Audio Data Block:
    Linear PCM:
      Max channels: 2
      Supported sample rates (kHz): 48 44.1 32
      Supported sample sizes (bits): 24 20 16
  Speaker Allocation Data Block:
    FL/FR - Front Left/Right
  Vendor-Specific Data Block (AMD), OUI 00-00-1A:
    Version: 1
    Feature Caps: 0x01
    Minimum Refresh Rate: 48 Hz
    Maximum Refresh Rate: 180 Hz
    Flags 1.x: 0x00
  Colorimetry Data Block:
    xvYCC601
    xvYCC709
    BT2020cYCC
    BT2020YCC
    BT2020RGB
    Gamut Boundary Description Metadata Profile P0
  HDR Static Metadata Data Block:
    Electro optical transfer functions:
      Traditional gamma - SDR luminance range
      Traditional gamma - HDR luminance range
      SMPTE ST2084
    Supported static metadata descriptors:
      Static metadata type 1
    Desired content max luminance: 96 (400.000 cd/m^2)
    Desired content max frame-average luminance: 96 (400.000 cd/m^2)
    Desired content min luminance: 79 (0.384 cd/m^2)
  Detailed Timing Descriptors:
    DTD 2:  2560x1440  120.000397 Hz  16:9    177.721 kHz    483.400000 MHz (597 mm x 336 mm)
                 Hfront   48 Hsync  32 Hback   80 Hpol P
                 Vfront    3 Vsync   5 Vback   33 Vpol N
    DTD 3:  2560x1440  100.001986 Hz  16:9    148.103 kHz    402.840000 MHz (597 mm x 336 mm)
                 Hfront   48 Hsync  32 Hback   80 Hpol P
                 Vfront    3 Vsync   5 Vback   33 Vpol N
    DTD 4:  1920x1080  144.003459 Hz  16:9    162.004 kHz    333.080000 MHz (597 mm x 336 mm)
                 Hfront   24 Hsync  32 Hback   80 Hpol P
                 Vfront    3 Vsync   5 Vback   37 Vpol N
    DTD 5:  2560x1440  144.000477 Hz  16:9    213.265 kHz    580.080000 MHz (597 mm x 336 mm)
                 Hfront   48 Hsync  32 Hback   80 Hpol P
                 Vfront    3 Vsync   5 Vback   33 Vpol N
Checksum: 0x41  Unused space in Extension Block: 9 bytes

----------------

Block 2, DisplayID Extension Block:
  Version: 1.2
  Extension Count: 0
  Display Product Type: Extension Section
  Video Timing Modes Type 1 - Detailed Timings Data Block:
    DTD:  2560x1440  165.001787 Hz  16:9    244.368 kHz    664.680000 MHz (aspect 16:9, no 3D stereo)
               Hfront   48 Hsync  32 Hback   80 Hpol P
               Vfront    3 Vsync   5 Vback   33 Vpol P
    DTD:  2560x1440  180.001411 Hz  16:9    266.582 kHz    714.440000 MHz (aspect 16:9, no 3D stereo)
               Hfront   48 Hsync  32 Hback   40 Hpol N
               Vfront    3 Vsync   5 Vback   33 Vpol N
  Checksum: 0x09
Checksum: 0x90

----------------

Warnings:

Block 0, Base EDID:
  Vendor & Product Identification: The serial number is one of the known dummy values, it should probably be set to 0.
Block 1, CTA-861 Extension Block:
  Video Data Block: VIC 31 and the first DTD are not identical. Is this intended?
  Colorimetry Data Block: Set the sRGB colorimetry bit to avoid interop issues.
  Display Product Serial Number is set, so the Serial Number in the Base EDID should be 0.
EDID:
  Base EDID: Some timings are out of range of the Monitor Ranges:
    Horizontal Freq: 28.125 - 266.582 kHz (Monitor: 255.000 - 255.000 kHz)

Failures:

Block 1, CTA-861 Extension Block:
  Missing VCDB, needed for Set Selectable RGB Quantization to avoid interop issues.
Block 2, DisplayID Extension Block:
  DisplayID Base Block has no product type.
EDID:
  Extension Block 3 started with EDID header, ignoring Extension Blocks >= 3.
  DisplayID: DisplayID expects at least one preferred timing.

EDID conformity: FAIL
