edid-decode (hex):

00 ff ff ff ff ff ff 00 06 af ac cb 00 00 00 00
1b 21 01 04 b5 22 16 78 03 dc b5 af 4f 41 b6 25
0b 50 54 00 00 00 01 01 01 01 01 01 01 01 01 01
01 01 01 01 01 01 b2 9f 00 a0 a0 40 46 60 30 20
aa 00 58 d7 10 00 00 1a 2c 55 00 a0 a0 40 46 60
30 20 aa 00 58 d7 10 00 00 1a 00 00 00 fe 00 35
58 47 43 32 80 42 31 36 30 51 41 4e 00 00 00 00
00 03 41 26 bc 01 03 00 00 0f 41 0a 20 20 02 bd

70 20 79 02 00 20 00 13 4f 55 41 ac cb 00 00 00
00 1b 17 07 42 31 36 30 51 41 4e 21 01 1d 77 0d
6a 08 00 0a 40 06 88 fd 5a 4f 1c 04 b6 56 c2 0b
02 35 54 78 61 78 61 66 2e 13 78 22 00 14 f3 3c
06 85 ff 09 9f 00 2f 80 1f 00 3f 06 45 00 09 00
09 00 25 01 09 f3 3c 06 f3 3c 06 30 5a 80 26 00
09 07 06 03 00 00 00 50 00 00 00 00 00 00 00 00
00 00 00 00 00 00 00 00 00 00 00 00 00 00 a9 90

70 20 79 02 00 81 00 20 e3 05 80 00 e6 06 07 01
7a 7a 1e 74 1a 00 00 03 01 30 5a 00 24 7a 1e 7a
1e 5a 00 00 00 00 8d 00 00 00 00 00 00 00 00 00
00 00 00 00 00 00 00 00 00 00 00 00 00 00 00 00
00 00 00 00 00 00 00 00 00 00 00 00 00 00 00 00
00 00 00 00 00 00 00 00 00 00 00 00 00 00 00 00
00 00 00 00 00 00 00 00 00 00 00 00 00 00 00 00
00 00 00 00 00 00 00 00 00 00 00 00 00 00 ff 90

00 ff ff ff ff ff ff 00 06 af ac cb 00 00 00 00
1b 21 01 04 b5 22 16 78 03 dc b5 af 4f 41 b6 25
0b 50 54 00 00 00 01 01 01 01 01 01 01 01 01 01
01 01 01 01 01 01 b2 9f 00 a0 a0 40 46 60 30 20
aa 00 58 d7 10 00 00 1a 2c 55 00 a0 a0 40 46 60
30 20 aa 00 58 d7 10 00 00 1a 00 00 00 fe 00 35
58 47 43 32 80 42 31 36 30 51 41 4e 00 00 00 00
00 03 41 26 bc 01 03 00 00 0f 41 0a 20 20 02 bd

70 20 79 02 00 20 00 13 4f 55 41 ac cb 00 00 00
00 1b 17 07 42 31 36 30 51 41 4e 21 01 1d 77 0d
6a 08 00 0a 40 06 88 fd 5a 4f 1c 04 b6 56 c2 0b
02 35 54 78 61 78 61 66 2e 13 78 22 00 14 f3 3c
06 85 ff 09 9f 00 2f 80 1f 00 3f 06 45 00 09 00
09 00 25 01 09 f3 3c 06 f3 3c 06 30 5a 80 26 00
09 07 06 03 00 00 00 50 00 00 00 00 00 00 00 00
00 00 00 00 00 00 00 00 00 00 00 00 00 00 a9 90

70 20 79 02 00 81 00 20 e3 05 80 00 e6 06 07 01
7a 7a 1e 74 1a 00 00 03 01 30 5a 00 24 7a 1e 7a
1e 5a 00 00 00 00 8d 00 00 00 00 00 00 00 00 00
00 00 00 00 00 00 00 00 00 00 00 00 00 00 00 00
00 00 00 00 00 00 00 00 00 00 00 00 00 00 00 00
00 00 00 00 00 00 00 00 00 00 00 00 00 00 00 00
00 00 00 00 00 00 00 00 00 00 00 00 00 00 00 00
00 00 00 00 00 00 00 00 00 00 00 00 00 00 ff 90

----------------

Block 0, Base EDID:
  EDID Structure Version & Revision: 1.4
  Vendor & Product Identification:
    Manufacturer: AUO
    Model: 52140
    Made in: week 27 of 2023
  Basic Display Parameters & Features:
    Digital display
    Bits per primary color channel: 10
    DisplayPort interface
    Maximum image size: 34 cm x 22 cm
    Gamma: 2.20
    Supported color formats: RGB 4:4:4
    First detailed timing includes the native pixel format and preferred refresh rate
    Display supports continuous frequencies
  Color Characteristics:
    Red  : 0.6865, 0.3095
    Green: 0.2568, 0.7109
    Blue : 0.1464, 0.0458
    White: 0.3134, 0.3291
  Established Timings I & II: none
  Standard Timings: none
  Detailed Timing Descriptors:
    DTD 1:  2560x1600   90.000881 Hz  16:10   150.301 kHz    408.820000 MHz (344 mm x 215 mm)
                 Hfront   48 Hsync  32 Hback   80 Hpol P
                 Vfront   10 Vsync  10 Vback   50 Vpol N
    DTD 2:  2560x1600   48.001057 Hz  16:10    80.162 kHz    218.040000 MHz (344 mm x 215 mm)
                 Hfront   48 Hsync  32 Hback   80 Hpol P
                 Vfront   10 Vsync  10 Vback   50 Vpol N
    Alphanumeric Data String: '5XGC2.B160QAN'
    Manufacturer-Specified Display Descriptor (0x00): 00 00 00 03 41 26 bc 01 03 00 00 0f 41 0a 20 20 '....A&......A.  '
  Extension blocks: 2
Checksum: 0xbd

----------------

Block 1, DisplayID Extension Block:
  Version: 2.0
  Extension Count: 0
  Display Product Primary Use Case: None of the listed primary use cases; generic display
  Product Identification Data Block (0x20), OUI 4F-55-41:
    Product Code: 52140
    Year of Manufacture: 2023, Week 27
    Product ID: B160QAN
  Display Parameters Data Block (0x21):
    Image size: 344.7 mm x 215.4 mm
    Display native pixel format: 2560x1600
    Scan Orientation: Left to Right, Top to Bottom
    Luminance Information: Guidance for the Source device
    Color Information: CIE 1931
    Audio Speaker Information: not integrated
    Native Color Chromaticity:
      Primary #1:  (0.686768, 0.309814)
      Primary #2:  (0.256836, 0.710938)
      Primary #3:  (0.145996, 0.045898)
      White Point: (0.312988, 0.328857)
    Native Maximum Luminance (Full Coverage): 700.000000 cd/m^2
    Native Maximum Luminance (10% Rectangular Coverage): 700.000000 cd/m^2
    Native Minimum Luminance: 0.099976 cd/m^2
    Native Color Depth: 10 bpc
    Display Device Technology: Active Matrix LCD
    Display Device Theme Preference: No Preference
    Native Gamma EOTF: 2.20
  Video Timing Modes Type 7 - Detailed Timings Data Block:
    DTD:  2560x1600   90.000881 Hz  16:10   150.301 kHz    408.820000 MHz (aspect 16:10, no 3D stereo, preferred)
               Hfront   48 Hsync  32 Hback   80 Hpol P
               Vfront   10 Vsync  10 Vback   50 Vpol N
  Dynamic Video Timing Range Limits Data Block:
    Minimum Pixel Clock: 408820 kHz
    Maximum Pixel Clock: 408820 kHz
    Minimum Vertical Refresh Rate: 48 Hz
    Maximum Vertical Refresh Rate: 90 Hz
    Seamless Dynamic Video Timing Support: Yes
  Display Interface Features Data Block:
    Supported bpc for RGB encoding: 6, 8, 10
    Supported bpc for YCbCr 4:4:4 encoding: 8, 10
    Supported bpc for YCbCr 4:2:2 encoding: 8, 10
    Supported color space and EOTF standard combination 1: DCI-P3, BT.2020/SMPTE ST 2084
  Checksum: 0xa9
Checksum: 0x90

----------------

Block 2, DisplayID Extension Block:
  Version: 2.0
  Extension Count: 0
  CTA-861 DisplayID Data Block:
  Colorimetry Data Block:
    BT2020RGB
  HDR Static Metadata Data Block:
    Electro optical transfer functions:
      Traditional gamma - SDR luminance range
      Traditional gamma - HDR luminance range
      SMPTE ST2084
    Supported static metadata descriptors:
      Static metadata type 1
    Desired content max luminance: 122 (702.501 cd/m^2)
    Desired content max frame-average luminance: 122 (702.501 cd/m^2)
    Desired content min luminance: 30 (0.097 cd/m^2)
  Vendor-Specific Data Block (AMD), OUI 00-00-1A:
    Version: 3
    Flags 1: 0x01
      FreeSync Supported
    Minimum Refresh Rate: 48 Hz
    Maximum Refresh Rate: 90 Hz
    Flags 5: 0x24
    Additional Sink Information Address: 0x410
  Checksum: 0xff
Checksum: 0x90

----------------

Warnings:

Block 0, Base EDID:
  Alphanumeric Data String: Non-ASCII character 0x80 at position 5, can cause problems.
  Missing Display Product Name.
Block 1, DisplayID Extension Block:
  Product Identification Data Block (0x20), OUI 4F-55-41: Unknown OUI 4F-55-41 (possible PNP OUA).
Block 2, DisplayID Extension Block:
  Colorimetry Data Block: Set the sRGB colorimetry bit to avoid interop issues.

Failures:

Block 0, Base EDID:
  Missing Display Range Limits Descriptor.
Block 1, DisplayID Extension Block:
  Expected 0 DisplayID Extension Block, but got 1.
Block 2, DisplayID Extension Block:
  Product Type should be 0 in extension block.
EDID:
  Extension Block 3 started with EDID header, ignoring Extension Blocks >= 3.

EDID conformity: FAIL
