edid-decode (hex):

00 ff ff ff ff ff ff 00 0d 0f 80 23 01 00 00 00
06 21 01 03 80 34 1d 78 ea d7 a5 a2 59 4a 96 24
14 50 54 21 08 00 81 40 a9 c0 b3 00 81 c0 81 80
95 00 d1 c0 61 40 02 3a 80 18 71 38 2d 40 58 2c
45 00 0f 28 21 00 00 1e 2a 44 80 a0 70 38 27 40
30 2c 45 00 0f 28 21 00 00 1a 00 00 00 fd 00 30
64 29 64 16 00 0a 20 20 20 20 20 20 00 00 00 fc
00 4d 4e 54 0a 20 20 20 20 20 20 20 20 20 01 b9

02 03 24 f1 48 10 1f 04 13 03 12 11 01 23 09 07
07 83 01 00 00 65 03 0c 00 10 00 68 1a 00 00 01
01 30 64 ed 01 1d 00 72 51 d0 1e 20 6e 28 55 00
0f 28 21 00 00 1e 01 1d 00 bc 52 d0 1e 20 b8 28
55 40 0f 28 21 00 00 1e 66 21 56 aa 51 00 1e 30
46 8f 33 00 0f 28 21 00 00 1e 68 5b 80 a0 70 38
2d 40 30 28 55 00 0f 28 21 00 00 1e 00 00 00 00
00 00 00 00 00 00 00 00 00 00 00 00 00 00 00 b6

00 ff ff ff ff ff ff 00 0d 0f 80 23 01 00 00 00
06 21 01 03 80 34 1d 78 ea d7 a5 a2 59 4a 96 24
14 50 54 21 08 00 81 40 a9 c0 b3 00 81 c0 81 80
95 00 d1 c0 61 40 02 3a 80 18 71 38 2d 40 58 2c
45 00 0f 28 21 00 00 1e 2a 44 80 a0 70 38 27 40
30 2c 45 00 0f 28 21 00 00 1a 00 00 00 fd 00 30
64 29 64 16 00 0a 20 20 20 20 20 20 00 00 00 fc
00 4d 4e 54 0a 20 20 20 20 20 20 20 20 20 01 b9

02 03 24 f1 48 10 1f 04 13 03 12 11 01 23 09 07
07 83 01 00 00 65 03 0c 00 10 00 68 1a 00 00 01
01 30 64 ed 01 1d 00 72 51 d0 1e 20 6e 28 55 00
0f 28 21 00 00 1e 01 1d 00 bc 52 d0 1e 20 b8 28
55 40 0f 28 21 00 00 1e 66 21 56 aa 51 00 1e 30
46 8f 33 00 0f 28 21 00 00 1e 68 5b 80 a0 70 38
2d 40 30 28 55 00 0f 28 21 00 00 1e 00 00 00 00
00 00 00 00 00 00 00 00 00 00 00 00 00 00 00 b6

----------------

Block 0, Base EDID:
  EDID Structure Version & Revision: 1.3
  Vendor & Product Identification:
    Manufacturer: CHO
    Model: 9088
    Serial Number: ...
    Made in: week 6 of 2023
  Basic Display Parameters & Features:
    Digital display
    Maximum image size: 52 cm x 29 cm
    Gamma: 2.20
    DPMS levels: Standby Suspend Off
    RGB color display
    First detailed timing is the preferred timing
  Color Characteristics:
    Red  : 0.6357, 0.3486
    Green: 0.2900, 0.5888
    Blue : 0.1425, 0.0800
    White: 0.3134, 0.3291
  Established Timings I & II:
    DMT 0x04:   640x480    59.940476 Hz   4:3     31.469 kHz     25.175000 MHz
    DMT 0x09:   800x600    60.316541 Hz   4:3     37.879 kHz     40.000000 MHz
    DMT 0x10:  1024x768    60.003840 Hz   4:3     48.363 kHz     65.000000 MHz
  Standard Timings:
    DMT 0x20:  1280x960    60.000000 Hz   4:3     60.000 kHz    108.000000 MHz
    DMT 0x53:  1600x900    60.000000 Hz  16:9     60.000 kHz    108.000000 MHz (RB)
    DMT 0x3a:  1680x1050   59.954250 Hz  16:10    65.290 kHz    146.250000 MHz
    DMT 0x55:  1280x720    60.000000 Hz  16:9     45.000 kHz     74.250000 MHz
    DMT 0x23:  1280x1024   60.019740 Hz   5:4     63.981 kHz    108.000000 MHz
    DMT 0x2f:  1440x900    59.887445 Hz  16:10    55.935 kHz    106.500000 MHz
    DMT 0x52:  1920x1080   60.000000 Hz  16:9     67.500 kHz    148.500000 MHz
    DMT 0x10:  1024x768    60.003840 Hz   4:3     48.363 kHz     65.000000 MHz
  Detailed Timing Descriptors:
    DTD 1:  1920x1080   60.000000 Hz  16:9     67.500 kHz    148.500000 MHz (527 mm x 296 mm)
                 Hfront   88 Hsync  44 Hback  148 Hpol P
                 Vfront    4 Vsync   5 Vback   36 Vpol P
    DTD 2:  1920x1080   74.972503 Hz  16:9     83.894 kHz    174.500000 MHz (527 mm x 296 mm)
                 Hfront   48 Hsync  44 Hback   68 Hpol P
                 Vfront    4 Vsync   5 Vback   30 Vpol N
    Display Range Limits:
      Monitor ranges (GTF): 48-100 Hz V, 41-100 kHz H, max dotclock 220 MHz
    Display Product Name: 'MNT'
  Extension blocks: 1
Checksum: 0xb9

----------------

Block 1, CTA-861 Extension Block:
  Revision: 3
  Underscans IT Video Formats by default
  Basic audio support
  Supports YCbCr 4:4:4
  Supports YCbCr 4:2:2
  Native DTDs: 1
  Video Data Block:
    VIC  16:  1920x1080   60.000000 Hz  16:9     67.500 kHz    148.500000 MHz
    VIC  31:  1920x1080   50.000000 Hz  16:9     56.250 kHz    148.500000 MHz
    VIC   4:  1280x720    60.000000 Hz  16:9     45.000 kHz     74.250000 MHz
    VIC  19:  1280x720    50.000000 Hz  16:9     37.500 kHz     74.250000 MHz
    VIC   3:   720x480    59.940060 Hz  16:9     31.469 kHz     27.000000 MHz
    VIC  18:   720x576    50.000000 Hz  16:9     31.250 kHz     27.000000 MHz
    VIC  17:   720x576    50.000000 Hz   4:3     31.250 kHz     27.000000 MHz
    VIC   1:   640x480    59.940476 Hz   4:3     31.469 kHz     25.175000 MHz
  Audio Data Block:
    Linear PCM:
      Max channels: 2
      Supported sample rates (kHz): 48 44.1 32
      Supported sample sizes (bits): 24 20 16
  Speaker Allocation Data Block:
    FL/FR - Front Left/Right
  Vendor-Specific Data Block (HDMI), OUI 00-0C-03:
    Source physical address: 1.0.0.0
  Vendor-Specific Data Block (AMD), OUI 00-00-1A:
    Version: 1
    Flags 1: 0x01
      FreeSync Supported
    Minimum Refresh Rate: 48 Hz
    Maximum Refresh Rate: 100 Hz
    MCCS VCP Code: 0xed
  Detailed Timing Descriptors:
    DTD 3:  1280x720    60.000000 Hz  16:9     45.000 kHz     74.250000 MHz (527 mm x 296 mm)
                 Hfront  110 Hsync  40 Hback  220 Hpol P
                 Vfront    5 Vsync   5 Vback   20 Vpol P
    DTD 4:  1280x720    50.000000 Hz  16:9     37.500 kHz     74.250000 MHz (527 mm x 296 mm)
                 Hfront  440 Hsync  40 Hback  220 Hpol P
                 Vfront    5 Vsync   5 Vback   20 Vpol P
    DTD 5:  1366x768    59.789541 Hz 683:384   47.712 kHz     85.500000 MHz (527 mm x 296 mm)
                 Hfront   70 Hsync 143 Hback  213 Hpol P
                 Vfront    3 Vsync   3 Vback   24 Vpol P
    DTD 6:  1920x1080  100.000000 Hz  16:9    112.500 kHz    234.000000 MHz (527 mm x 296 mm)
                 Hfront   48 Hsync  40 Hback   72 Hpol P
                 Vfront    5 Vsync   5 Vback   35 Vpol P
Checksum: 0xb6  Unused space in Extension Block: 19 bytes

----------------

Warnings:

Block 0, Base EDID:
  Vendor & Product Identification: The serial number is one of the known dummy values, it should probably be set to 0.
Block 1, CTA-861 Extension Block:
  Add a Colorimetry Data Block with the sRGB colorimetry bit set to avoid interop issues.
EDID:
  Base EDID: Some timings are out of range of the Monitor Ranges:
    Horizontal Freq: 31.250 - 112.500 kHz (Monitor: 41.000 - 100.000 kHz)
    Maximum Clock: 234.000 MHz (Monitor: 220.000 MHz)

Failures:

Block 1, CTA-861 Extension Block:
  Missing VCDB, needed for Set Selectable RGB Quantization to avoid interop issues.
EDID:
  Extension Block 2 started with EDID header, ignoring Extension Blocks >= 2.

EDID conformity: FAIL
