edid-decode (hex):

00 ff ff ff ff ff ff 00 06 10 08 9d 01 01 01 01
07 0c 01 03 10 00 00 96 30 67 a9 a0 56 47 99 26
11 48 4c 00 00 61 01 01 01 01 01 01 01 01 01 01
01 01 01 01 01 01 01 01 01 01 01 01 01 01 01 01
01 01 01 01 01 01 01 01 01 01 01 01 01 01 01 01
01 01 01 01 01 01 01 01 01 01 01 01 01 01 01 01
01 01 01 01 01 01 01 01 01 01 01 01 00 00 00 fc
00 4e 54 53 43 2f 50 41 4c 0a 20 20 20 20 00 38

----------------

Block 0, Base EDID:
  EDID Structure Version & Revision: 1.3
  Vendor & Product Identification:
    Manufacturer: APP
    Model: 40200
    Serial Number: ...
    Made in: week 7 of 2002
  Basic Display Parameters & Features:
    Analog display
    Signal Level Standard: 0.700 : 0.300 : 1.000 V p-p
    Blank-to-black setup/pedestal
    Image size is variable
    Gamma: 2.50
    DPMS levels: Off
    Non-RGB color display
  Color Characteristics:
    Red  : 0.6259, 0.3378
    Green: 0.2783, 0.6005
    Blue : 0.1503, 0.0683
    White: 0.2832, 0.2978
  Established Timings I & II:
  Standard Timings: none
  Detailed Timing Descriptors:
    Detailed mode: 01 01 01 01 01 01 01 01 01 01 01 01 01 01 01 01 01 01 '..................'
    Detailed mode: 01 01 01 01 01 01 01 01 01 01 01 01 01 01 01 01 01 01 '..................'
    Detailed mode: 01 01 01 01 01 01 01 01 01 01 01 01 01 01 01 01 01 01 '..................'
    Display Product Name: 'NTSC/PAL'
Checksum: 0x38

----------------

Warnings:

Block 0, Base EDID:
  Vendor & Product Identification: The serial number is one of the known dummy values, it should probably be set to 0.

Failures:

Block 0, Base EDID:
  Basic Display Parameters & Features: EDID 1.3 requires that the first detailed timing is the preferred timing.
  Detailed Timing Descriptor #1: Pixelclock < 10 MHz, assuming invalid data 0x01 0x01.
  Detailed Timing Descriptor #2: Pixelclock < 10 MHz, assuming invalid data 0x01 0x01.
  Detailed Timing Descriptor #3: Pixelclock < 10 MHz, assuming invalid data 0x01 0x01.
  Missing Display Range Limits Descriptor.

EDID conformity: FAIL
