edid-decode (hex):

00 ff ff ff ff ff ff 00 09 e5 53 0a 00 00 00 00
00 1f 01 04 a5 1d 12 78 03 33 35 97 58 57 8d 29
1f 50 54 00 00 00 01 01 01 01 01 01 01 01 01 01
01 01 01 01 01 01 b4 41 80 54 71 b0 28 40 30 20
a5 00 1e b3 10 00 00 1a 00 00 00 fd 00 28 3c 4b
4b 11 01 0a 20 20 20 20 20 20 00 00 00 fe 00 42
4f 45 20 48 46 0a 20 20 20 20 20 20 00 00 00 fe
00 4e 56 31 33 33 57 55 4d 2d 4e 34 32 0a 00 93

00 ff ff ff ff ff ff 00 09 e5 53 0a 00 00 00 00
00 1f 01 04 a5 1d 12 78 03 33 35 97 58 57 8d 29
1f 50 54 00 00 00 01 01 01 01 01 01 01 01 01 01
01 01 01 01 01 01 b4 41 80 54 71 b0 28 40 30 20
a5 00 1e b3 10 00 00 1a 00 00 00 fd 00 28 3c 4b
4b 11 01 0a 20 20 20 20 20 20 00 00 00 fe 00 42
4f 45 20 48 46 0a 20 20 20 20 20 20 00 00 00 fe
00 4e 56 31 33 33 57 55 4d 2d 4e 34 32 0a 00 93

----------------

Block 0, Base EDID:
  EDID Structure Version & Revision: 1.4
  Vendor & Product Identification:
    Manufacturer: BOE
    Model: 2643
    Made in: 2021
  Basic Display Parameters & Features:
    Digital display
    Bits per primary color channel: 8
    DisplayPort interface
    Maximum image size: 29 cm x 18 cm
    Gamma: 2.20
    Supported color formats: RGB 4:4:4
    First detailed timing includes the native pixel format and preferred refresh rate
    Display supports continuous frequencies
  Color Characteristics:
    Red  : 0.5898, 0.3466
    Green: 0.3398, 0.5537
    Blue : 0.1601, 0.1240
    White: 0.3134, 0.3291
  Established Timings I & II: none
  Standard Timings: none
  Detailed Timing Descriptors:
    DTD 1:  1920x1200   60.019983 Hz  16:10    74.425 kHz    168.200000 MHz (286 mm x 179 mm)
                 Hfront   48 Hsync  32 Hback  260 Hpol P
                 Vfront   10 Vsync   5 Vback   25 Vpol N
    Display Range Limits:
      Monitor ranges (Range Limits Only): 40-60 Hz V, 75-75 kHz H, max dotclock 170 MHz
    Alphanumeric Data String: 'BOE HF'
    Alphanumeric Data String: 'NV133WUM-N42'
Checksum: 0x93

----------------

Block 1, Unknown EDID Extension Block 0x00:
  00 ff ff ff ff ff ff 00 09 e5 53 0a 00 00 00 00 '..........S.....'
  00 1f 01 04 a5 1d 12 78 03 33 35 97 58 57 8d 29 '.......x.35.XW.)'
  1f 50 54 00 00 00 01 01 01 01 01 01 01 01 01 01 '.PT.............'
  01 01 01 01 01 01 b4 41 80 54 71 b0 28 40 30 20 '.......A.Tq.(@0 '
  a5 00 1e b3 10 00 00 1a 00 00 00 fd 00 28 3c 4b '.............(<K'
  4b 11 01 0a 20 20 20 20 20 20 00 00 00 fe 00 42 'K...      .....B'
  4f 45 20 48 46 0a 20 20 20 20 20 20 00 00 00 fe 'OE HF.      ....'
  00 4e 56 31 33 33 57 55 4d 2d 4e 34 32 0a 00 93 '.NV133WUM-N42...'
Checksum: 0x93

----------------

Warnings:

Block 0, Base EDID:
  Missing Display Product Name.
EDID:
  Base EDID: Some timings are out of range of the Monitor Ranges:
    Horizontal Freq: 74.424 - 74.424 kHz (Monitor: 75.000 - 75.000 kHz)
    Could be due to a Monitor Range off-by-one rounding issue

Failures:

Block 1, Base EDID:
  Unknown Extension Block.
EDID:
  Base EDID: EDID specified 0 extension block(s), but found 1 extension block(s).

EDID conformity: FAIL
