edid-decode (hex):

00 ff ff ff ff ff ff 00 30 ae a0 41 00 00 00 00
00 1e 01 04 a5 1d 12 78 e2 f7 95 a6 53 4a a0 26
0d 50 54 00 00 00 01 01 01 01 01 01 01 01 01 01
01 01 01 01 01 01 fa 3c 80 b8 70 b0 24 40 10 10
3e 00 1e b2 10 00 00 18 fa 3c 80 b8 70 b0 24 40
10 10 3e 00 1e b2 10 00 00 18 00 00 00 0f 00 d1
0a 3c d1 0a 3c 1e 0a 00 06 af 93 66 00 00 00 fe
00 42 31 33 33 55 41 4e 30 31 2e 32 20 0a 00 57

00 ff ff ff ff ff ff 00 30 ae a0 41 00 00 00 00
00 1e 01 04 a5 1d 12 78 e2 f7 95 a6 53 4a a0 26
0d 50 54 00 00 00 01 01 01 01 01 01 01 01 01 01
01 01 01 01 01 01 fa 3c 80 b8 70 b0 24 40 10 10
3e 00 1e b2 10 00 00 18 fa 3c 80 b8 70 b0 24 40
10 10 3e 00 1e b2 10 00 00 18 00 00 00 0f 00 d1
0a 3c d1 0a 3c 1e 0a 00 06 af 93 66 00 00 00 fe
00 42 31 33 33 55 41 4e 30 31 2e 32 20 0a 00 57

----------------

Block 0, Base EDID:
  EDID Structure Version & Revision: 1.4
  Vendor & Product Identification:
    Manufacturer: LEN
    Model: 16800
    Made in: 2020
  Basic Display Parameters & Features:
    Digital display
    Bits per primary color channel: 8
    DisplayPort interface
    Maximum image size: 29 cm x 18 cm
    Gamma: 2.20
    DPMS levels: Standby Suspend Off
    Supported color formats: RGB 4:4:4
    First detailed timing includes the native pixel format and preferred refresh rate
  Color Characteristics:
    Red  : 0.6513, 0.3271
    Green: 0.2900, 0.6279
    Blue : 0.1503, 0.0517
    White: 0.3134, 0.3291
  Established Timings I & II: none
  Standard Timings: none
  Detailed Timing Descriptors:
    DTD 1:  1920x1200   60.025902 Hz  16:10    74.192 kHz    156.100000 MHz (286 mm x 178 mm)
                 Hfront   16 Hsync  16 Hback  152 Hpol N
                 Vfront    3 Vsync  14 Vback   19 Vpol N
    DTD 2:  1920x1200   60.025902 Hz  16:10    74.192 kHz    156.100000 MHz (286 mm x 178 mm)
                 Hfront   16 Hsync  16 Hback  152 Hpol N
                 Vfront    3 Vsync  14 Vback   19 Vpol N
    Manufacturer-Specified Display Descriptor (0x0f): 00 0f 00 d1 0a 3c d1 0a 3c 1e 0a 00 06 af 93 66 '.....<..<......f'
    Alphanumeric Data String: 'B133UAN01.2 '
Checksum: 0x57

----------------

Warnings:

Block 0, Base EDID:
  Missing Display Product Name.

Failures:

Block 0, Base EDID:
  Alphanumeric Data String: One or more trailing spaces before newline.
EDID:
  Extension Block 1 started with EDID header, ignoring Extension Blocks >= 1.

EDID conformity: FAIL
