edid-decode (hex):

00 ff ff ff ff ff ff 00 30 ae a0 41 00 00 00 00
1e 1e 01 04 a5 1d 12 78 e2 5c 70 a6 51 4c 9c 26
0e 50 54 00 00 00 01 01 01 01 01 01 01 01 01 01
01 01 01 01 01 01 74 3c 80 a0 70 b0 28 40 30 20
36 00 1e b3 10 00 00 1a 74 3c 80 a0 70 b0 28 40
30 20 36 00 1e b3 10 00 00 1a 00 00 00 0f 00 d1
0a 3c d1 0a 3c 1e 0a 00 09 e5 80 09 00 00 00 fe
00 4e 56 31 33 33 57 55 4d 2d 54 30 30 0a 00 9a

00 ff ff ff ff ff ff 00 30 ae a0 41 00 00 00 00
1e 1e 01 04 a5 1d 12 78 e2 5c 70 a6 51 4c 9c 26
0e 50 54 00 00 00 01 01 01 01 01 01 01 01 01 01
01 01 01 01 01 01 74 3c 80 a0 70 b0 28 40 30 20
36 00 1e b3 10 00 00 1a 74 3c 80 a0 70 b0 28 40
30 20 36 00 1e b3 10 00 00 1a 00 00 00 0f 00 d1
0a 3c d1 0a 3c 1e 0a 00 09 e5 80 09 00 00 00 fe
00 4e 56 31 33 33 57 55 4d 2d 54 30 30 0a 00 9a

----------------

Block 0, Base EDID:
  EDID Structure Version & Revision: 1.4
  Vendor & Product Identification:
    Manufacturer: LEN
    Model: 16800
    Made in: week 30 of 2020
  Basic Display Parameters & Features:
    Digital display
    Bits per primary color channel: 8
    DisplayPort interface
    Maximum image size: 29 cm x 18 cm
    Gamma: 2.20
    DPMS levels: Standby Suspend Off
    Supported color formats: RGB 4:4:4
    First detailed timing includes the native pixel format and preferred refresh rate
  Color Characteristics:
    Red  : 0.6494, 0.3173
    Green: 0.2998, 0.6093
    Blue : 0.1494, 0.0576
    White: 0.3125, 0.3281
  Established Timings I & II: none
  Standard Timings: none
  Detailed Timing Descriptors:
    DTD 1:  1920x1200   60.003102 Hz  16:10    74.404 kHz    154.760000 MHz (286 mm x 179 mm)
                 Hfront   48 Hsync  32 Hback   80 Hpol P
                 Vfront    3 Vsync   6 Vback   31 Vpol N
    DTD 2:  1920x1200   60.003102 Hz  16:10    74.404 kHz    154.760000 MHz (286 mm x 179 mm)
                 Hfront   48 Hsync  32 Hback   80 Hpol P
                 Vfront    3 Vsync   6 Vback   31 Vpol N
    Manufacturer-Specified Display Descriptor (0x0f): 00 0f 00 d1 0a 3c d1 0a 3c 1e 0a 00 09 e5 80 09 '.....<..<.......'
    Alphanumeric Data String: 'NV133WUM-T00'
Checksum: 0x9a

----------------

Warnings:

Block 0, Base EDID:
  Missing Display Product Name.

Failures:

EDID:
  Extension Block 1 started with EDID header, ignoring Extension Blocks >= 1.

EDID conformity: FAIL
