edid-decode (hex):

00 ff ff ff ff ff ff 00 6a 4e ec 02 01 01 01 01
01 14 01 03 08 58 31 78 8a ee 9d a3 54 4c 99 26
0f 4f 54 2d ca 00 01 01 31 59 45 59 61 59 01 01
01 01 81 40 81 c0 52 35 80 80 70 38 1f 40 20 20
13 00 70 ea 31 00 00 1e 66 21 50 b0 51 00 1b 30
40 70 36 00 70 ea 31 00 00 1e 00 00 00 fd 00 37
41 1e 50 0f 00 0a 20 20 20 20 20 20 00 00 00 fc
00 5a 4f 52 41 4e 20 54 56 0a 20 20 20 20 00 be

00 ff ff ff ff ff ff 00 6a 4e ec 02 01 01 01 01
01 14 01 03 08 58 31 78 8a ee 9d a3 54 4c 99 26
0f 4f 54 2d ca 00 01 01 31 59 45 59 61 59 01 01
01 01 81 40 81 c0 52 35 80 80 70 38 1f 40 20 20
13 00 70 ea 31 00 00 1e 66 21 50 b0 51 00 1b 30
40 70 36 00 70 ea 31 00 00 1e 00 00 00 fd 00 37
41 1e 50 0f 00 0a 20 20 20 20 20 20 00 00 00 fc
00 5a 4f 52 41 4e 20 54 56 0a 20 20 20 20 00 be

----------------

Block 0, Base EDID:
  EDID Structure Version & Revision: 1.3
  Vendor & Product Identification:
    Manufacturer: ZRN
    Model: 748
    Serial Number: ...
    Made in: week 1 of 2010
  Basic Display Parameters & Features:
    Analog display
    Signal Level Standard: 0.700 : 0.300 : 1.000 V p-p
    Blank level equals black level
    Sync: Separate
    Maximum image size: 88 cm x 49 cm
    Gamma: 2.20
    DPMS levels: Standby
    RGB color display
    First detailed timing is the preferred timing
  Color Characteristics:
    Red  : 0.6396, 0.3300
    Green: 0.2998, 0.5996
    Blue : 0.1503, 0.0595
    White: 0.3115, 0.3291
  Established Timings I & II:
    DMT 0x04:   640x480    59.940476 Hz   4:3     31.469 kHz     25.175000 MHz
    DMT 0x05:   640x480    72.808802 Hz   4:3     37.861 kHz     31.500000 MHz
    DMT 0x06:   640x480    75.000000 Hz   4:3     37.500 kHz     31.500000 MHz
    DMT 0x09:   800x600    60.316541 Hz   4:3     37.879 kHz     40.000000 MHz
    DMT 0x0a:   800x600    72.187572 Hz   4:3     48.077 kHz     50.000000 MHz
    DMT 0x0b:   800x600    75.000000 Hz   4:3     46.875 kHz     49.500000 MHz
    DMT 0x10:  1024x768    60.003840 Hz   4:3     48.363 kHz     65.000000 MHz
    DMT 0x12:  1024x768    75.028582 Hz   4:3     60.023 kHz     78.750000 MHz
  Standard Timings:
    DMT 0x07:   640x480    85.008312 Hz   4:3     43.269 kHz     36.000000 MHz
    DMT 0x0c:   800x600    85.061274 Hz   4:3     53.674 kHz     56.250000 MHz
    DMT 0x13:  1024x768    84.996690 Hz   4:3     68.677 kHz     94.500000 MHz
    DMT 0x20:  1280x960    60.000000 Hz   4:3     60.000 kHz    108.000000 MHz
    DMT 0x55:  1280x720    60.000000 Hz  16:9     45.000 kHz     74.250000 MHz
  Detailed Timing Descriptors:
    DTD 1:  1920x1080   59.991351 Hz  16:9     66.650 kHz    136.500000 MHz (880 mm x 490 mm)
                 Hfront   32 Hsync  32 Hback   64 Hpol P
                 Vfront    1 Vsync   3 Vback   27 Vpol P
    DTD 2:  1360x768    60.015162 Hz  85:48    47.712 kHz     85.500000 MHz (880 mm x 490 mm)
                 Hfront   64 Hsync 112 Hback  256 Hpol P
                 Vfront    3 Vsync   6 Vback   18 Vpol P
    Display Range Limits:
      Monitor ranges (GTF): 55-65 Hz V, 30-80 kHz H, max dotclock 150 MHz
    Display Product Name: 'ZORAN TV'
Checksum: 0xbe

----------------

Warnings:

Block 0, Base EDID:
  Vendor & Product Identification: The serial number is one of the known dummy values, it should probably be set to 0.
EDID:
  Base EDID: Some timings are out of range of the Monitor Ranges:
    Vertical Freq: 59.940 - 85.061 Hz (Monitor: 55.000 - 65.000 Hz)

Failures:

EDID:
  Extension Block 1 started with EDID header, ignoring Extension Blocks >= 1.

EDID conformity: FAIL
