edid-decode (hex):

00 ff ff ff ff ff ff 00 4c 23 63 27 00 00 00 00
09 23 01 04 b5 3c 21 78 2f 87 e5 a4 56 50 9e 26
0d 50 54 21 08 00 d1 c0 01 01 81 c0 a9 c0 01 01
01 01 01 01 01 01 4d d0 00 a0 f0 70 3e 80 30 20
35 00 58 4a 21 00 00 1a 00 00 00 fc 00 47 37 75
0a 20 20 20 20 20 20 20 20 20 00 00 00 fd 0c 30
90 91 91 90 01 0a 20 20 20 20 20 20 00 00 00 ff
00 0a 20 20 20 20 20 20 20 20 20 20 20 20 02 63

02 03 38 f2 48 61 01 02 03 04 10 1f 3f e2 00 d5
23 09 7f 07 83 01 00 00 e3 05 c0 00 e6 06 05 01
62 62 00 74 1a 00 00 03 01 30 90 00 00 00 00 00
00 90 00 00 00 00 00 00 ab 5e 00 a0 a0 a0 2d 50
30 20 45 00 58 4a 21 00 00 18 6f c2 00 a0 a0 a0
55 50 30 20 45 00 58 4a 21 00 00 18 00 00 00 00
00 00 00 00 00 00 00 00 00 00 00 00 00 00 00 00
00 00 00 00 00 00 00 00 00 00 00 00 00 00 00 87

70 12 3f 00 00 03 00 3c 87 58 01 04 ff 0e 9f 00
2f 80 1f 00 6f 08 2c 00 02 00 04 00 6f 9d 01 04
ff 0e 9f 00 2f 80 1f 00 6f 08 2c 00 03 00 04 00
1f f0 01 04 ff 0e 9f 00 2f 80 1f 00 6f 08 2c 00
03 00 04 00 fc 00 00 00 00 00 00 00 00 00 00 00
00 00 00 00 00 00 00 00 00 00 00 00 00 00 00 00
00 00 00 00 00 00 00 00 00 00 00 00 00 00 00 00
00 00 00 00 00 00 00 00 00 00 00 00 00 00 00 90

00 ff ff ff ff ff ff 00 4c 23 63 27 00 00 00 00
09 23 01 04 b5 3c 21 78 2f 87 e5 a4 56 50 9e 26
0d 50 54 21 08 00 d1 c0 01 01 81 c0 a9 c0 01 01
01 01 01 01 01 01 4d d0 00 a0 f0 70 3e 80 30 20
35 00 58 4a 21 00 00 1a 00 00 00 fc 00 47 37 75
0a 20 20 20 20 20 20 20 20 20 00 00 00 fd 0c 30
90 91 91 90 01 0a 20 20 20 20 20 20 00 00 00 ff
00 0a 20 20 20 20 20 20 20 20 20 20 20 20 02 63

02 03 38 f2 48 61 01 02 03 04 10 1f 3f e2 00 d5
23 09 7f 07 83 01 00 00 e3 05 c0 00 e6 06 05 01
62 62 00 74 1a 00 00 03 01 30 90 00 00 00 00 00
00 90 00 00 00 00 00 00 ab 5e 00 a0 a0 a0 2d 50
30 20 45 00 58 4a 21 00 00 18 6f c2 00 a0 a0 a0
55 50 30 20 45 00 58 4a 21 00 00 18 00 00 00 00
00 00 00 00 00 00 00 00 00 00 00 00 00 00 00 00
00 00 00 00 00 00 00 00 00 00 00 00 00 00 00 87

70 12 3f 00 00 03 00 3c 87 58 01 04 ff 0e 9f 00
2f 80 1f 00 6f 08 2c 00 02 00 04 00 6f 9d 01 04
ff 0e 9f 00 2f 80 1f 00 6f 08 2c 00 03 00 04 00
1f f0 01 04 ff 0e 9f 00 2f 80 1f 00 6f 08 2c 00
03 00 04 00 fc 00 00 00 00 00 00 00 00 00 00 00
00 00 00 00 00 00 00 00 00 00 00 00 00 00 00 00
00 00 00 00 00 00 00 00 00 00 00 00 00 00 00 00
00 00 00 00 00 00 00 00 00 00 00 00 00 00 00 90

----------------

Block 0, Base EDID:
  EDID Structure Version & Revision: 1.4
  Vendor & Product Identification:
    Manufacturer: SAC
    Model: 10083
    Made in: week 9 of 2025
  Basic Display Parameters & Features:
    Digital display
    Bits per primary color channel: 10
    DisplayPort interface
    Maximum image size: 60 cm x 33 cm
    Gamma: 2.20
    DPMS levels: Off
    Supported color formats: RGB 4:4:4, YCrCb 4:4:4
    Default (sRGB) color space is primary color space
    First detailed timing includes the native pixel format and preferred refresh rate
    Display supports continuous frequencies
  Color Characteristics:
    Red  : 0.6425, 0.3359
    Green: 0.3134, 0.6201
    Blue : 0.1513, 0.0527
    White: 0.3134, 0.3291
  Established Timings I & II:
    DMT 0x04:   640x480    59.940476 Hz   4:3     31.469 kHz     25.175000 MHz
    DMT 0x09:   800x600    60.316541 Hz   4:3     37.879 kHz     40.000000 MHz
    DMT 0x10:  1024x768    60.003840 Hz   4:3     48.363 kHz     65.000000 MHz
  Standard Timings:
    DMT 0x52:  1920x1080   60.000000 Hz  16:9     67.500 kHz    148.500000 MHz
    DMT 0x55:  1280x720    60.000000 Hz  16:9     45.000 kHz     74.250000 MHz
    DMT 0x53:  1600x900    60.000000 Hz  16:9     60.000 kHz    108.000000 MHz (RB)
  Detailed Timing Descriptors:
    DTD 1:  3840x2160   59.996625 Hz  16:9    133.312 kHz    533.250000 MHz (600 mm x 330 mm)
                 Hfront   48 Hsync  32 Hback   80 Hpol P
                 Vfront    3 Vsync   5 Vback   54 Vpol N
    Display Product Name: 'G7u'
    Display Range Limits:
      Monitor ranges (Range Limits Only): 48-144 Hz V, 400-400 kHz H, max dotclock 1440 MHz
    Display Product Serial Number: ...
  Extension blocks: 2
Checksum: 0x63

----------------

Block 1, CTA-861 Extension Block:
  Revision: 3
  Underscans IT Video Formats by default
  Basic audio support
  Supports YCbCr 4:4:4
  Supports YCbCr 4:2:2
  Native DTDs: 2
  Video Data Block:
    VIC  97:  3840x2160   60.000000 Hz  16:9    135.000 kHz    594.000000 MHz
    VIC   1:   640x480    59.940476 Hz   4:3     31.469 kHz     25.175000 MHz
    VIC   2:   720x480    59.940060 Hz   4:3     31.469 kHz     27.000000 MHz
    VIC   3:   720x480    59.940060 Hz  16:9     31.469 kHz     27.000000 MHz
    VIC   4:  1280x720    60.000000 Hz  16:9     45.000 kHz     74.250000 MHz
    VIC  16:  1920x1080   60.000000 Hz  16:9     67.500 kHz    148.500000 MHz
    VIC  31:  1920x1080   50.000000 Hz  16:9     56.250 kHz    148.500000 MHz
    VIC  63:  1920x1080  120.000000 Hz  16:9    135.000 kHz    297.000000 MHz
  Video Capability Data Block:
    YCbCr quantization: Selectable (via AVI YQ)
    RGB quantization: Selectable (via AVI Q)
    PT scan behavior: Always Overscanned
    IT scan behavior: Always Overscanned
    CE scan behavior: Always Overscanned
  Audio Data Block:
    Linear PCM:
      Max channels: 2
      Supported sample rates (kHz): 192 176.4 96 88.2 48 44.1 32
      Supported sample sizes (bits): 24 20 16
  Speaker Allocation Data Block:
    FL/FR - Front Left/Right
  Colorimetry Data Block:
    BT2020YCC
    BT2020RGB
  HDR Static Metadata Data Block:
    Electro optical transfer functions:
      Traditional gamma - SDR luminance range
      SMPTE ST2084
    Supported static metadata descriptors:
      Static metadata type 1
    Desired content max luminance: 98 (417.710 cd/m^2)
    Desired content max frame-average luminance: 98 (417.710 cd/m^2)
    Desired content min luminance: 0 (0.000 cd/m^2)
  Vendor-Specific Data Block (AMD), OUI 00-00-1A:
    Version: 3
    Feature Caps: 0x01
    Minimum Refresh Rate: 48 Hz
    Maximum Refresh Rate: 144 Hz
    Flags 1.x: 0x00
    Flags 2.x: 0x00
  Detailed Timing Descriptors:
    DTD 2:  2560x1440   59.999505 Hz  16:9     89.099 kHz    242.350000 MHz (600 mm x 330 mm)
                 Hfront   48 Hsync  32 Hback   80 Hpol N
                 Vfront    4 Vsync   5 Vback   36 Vpol N
    DTD 3:  2560x1440  119.997589 Hz  16:9    182.996 kHz    497.750000 MHz (600 mm x 330 mm)
                 Hfront   48 Hsync  32 Hback   80 Hpol N
                 Vfront    4 Vsync   5 Vback   76 Vpol N
Checksum: 0x87  Unused space in Extension Block: 35 bytes

----------------

Block 2, DisplayID Extension Block:
  Version: 1.2
  Extension Count: 0
  Display Product Type: Extension Section
  Video Timing Modes Type 1 - Detailed Timings Data Block:
    DTD:  3840x2160  100.000000 Hz  16:9    220.500 kHz    882.000000 MHz (aspect 16:9, no 3D stereo)
               Hfront   48 Hsync  32 Hback   80 Hpol P
               Vfront    3 Vsync   5 Vback   37 Vpol N
    DTD:  3840x2160  120.000000 Hz  16:9    264.600 kHz   1058.400000 MHz (aspect 16:9, no 3D stereo)
               Hfront   48 Hsync  32 Hback   80 Hpol P
               Vfront    4 Vsync   5 Vback   36 Vpol N
    DTD:  3840x2160  144.000000 Hz  16:9    317.520 kHz   1270.080000 MHz (aspect 16:9, no 3D stereo)
               Hfront   48 Hsync  32 Hback   80 Hpol P
               Vfront    4 Vsync   5 Vback   36 Vpol N
  Checksum: 0xfc
Checksum: 0x90  Unused space in Extension Block: 58 bytes

----------------

Warnings:

Block 1, CTA-861 Extension Block:
  Video Data Block: VIC 97 and the first DTD are not identical. Is this intended?
  Video Capability Data Block: IT scan behavior is expected to support underscanned.
  Video Capability Data Block: S_PT is equal to S_IT and S_CE, so should be set to 0 instead.
EDID:
  Base EDID: Some timings are out of range of the Monitor Ranges:
    Horizontal Freq: 31.468 - 317.520 kHz (Monitor: 400.000 - 400.000 kHz)

Failures:

Block 0, Base EDID:
  Display Product Serial Number: ...
  Basic Display Parameters & Features: sRGB is signaled, but the chromaticities do not match.
Block 1, CTA-861 Extension Block:
  Video Capability Data Block: IT video formats are always overscanned, but bit 7 of Byte 3 of the CTA-861 Extension header is set to underscanned.
Block 2, DisplayID Extension Block:
  DisplayID Base Block has no product type.
EDID:
  Extension Block 3 started with EDID header, ignoring Extension Blocks >= 3.
  CTA-861: Native progressive timings are a mix of several resolutions.
  DisplayID: DisplayID expects at least one preferred timing.

EDID conformity: FAIL
