edid-decode (hex):

00 ff ff ff ff ff ff 00 10 ac 12 d0 53 56 32 30
11 11 01 03 68 3a 24 78 ee de 50 a3 54 4c 9b 26
0f 50 54 a5 4b 00 71 4f 81 80 a9 40 01 01 01 01
01 01 01 01 01 01 28 3c 80 a0 70 b0 23 40 30 20
36 00 46 6c 21 00 00 1a 00 00 00 ff 00 52 4a 34
39 30 37 34 51 30 32 56 53 0a 00 00 00 fd 00 38
4c 1e 51 15 00 0a 20 20 20 20 20 20 00 00 00 fc
00 44 45 4c 4c 20 32 37 30 37 57 46 50 0a 00 2c

00 ff ff ff ff ff ff 00 10 ac 12 d0 53 56 32 30
11 11 01 03 68 3a 24 78 ee de 50 a3 54 4c 9b 26
0f 50 54 a5 4b 00 71 4f 81 80 a9 40 01 01 01 01
01 01 01 01 01 01 28 3c 80 a0 70 b0 23 40 30 20
36 00 46 6c 21 00 00 1a 00 00 00 ff 00 52 4a 34
39 30 37 34 51 30 32 56 53 0a 00 00 00 fd 00 38
4c 1e 51 15 00 0a 20 20 20 20 20 20 00 00 00 fc
00 44 45 4c 4c 20 32 37 30 37 57 46 50 0a 00 2c

----------------

Block 0, Base EDID:
  EDID Structure Version & Revision: 1.3
  Vendor & Product Identification:
    Manufacturer: DEL
    Model: 53266
    Serial Number: ...
    Made in: week 17 of 2007
  Basic Display Parameters & Features:
    Analog display
    Signal Level Standard: 0.700 : 0.000 : 0.700 V p-p
    Blank level equals black level
    Sync: Separate
    Maximum image size: 58 cm x 36 cm
    Gamma: 2.20
    DPMS levels: Standby Suspend Off
    RGB color display
    Default (sRGB) color space is primary color space
    First detailed timing is the preferred timing
  Color Characteristics:
    Red  : 0.6396, 0.3291
    Green: 0.2998, 0.6074
    Blue : 0.1494, 0.0595
    White: 0.3125, 0.3281
  Established Timings I & II:
    IBM     :   720x400    70.081663 Hz   9:5     31.467 kHz     28.320000 MHz
    DMT 0x04:   640x480    59.940476 Hz   4:3     31.469 kHz     25.175000 MHz
    DMT 0x06:   640x480    75.000000 Hz   4:3     37.500 kHz     31.500000 MHz
    DMT 0x09:   800x600    60.316541 Hz   4:3     37.879 kHz     40.000000 MHz
    DMT 0x0b:   800x600    75.000000 Hz   4:3     46.875 kHz     49.500000 MHz
    DMT 0x10:  1024x768    60.003840 Hz   4:3     48.363 kHz     65.000000 MHz
    DMT 0x12:  1024x768    75.028582 Hz   4:3     60.023 kHz     78.750000 MHz
    DMT 0x24:  1280x1024   75.024675 Hz   5:4     79.976 kHz    135.000000 MHz
  Standard Timings:
    DMT 0x15:  1152x864    75.000000 Hz   4:3     67.500 kHz    108.000000 MHz
    DMT 0x23:  1280x1024   60.019740 Hz   5:4     63.981 kHz    108.000000 MHz
    DMT 0x33:  1600x1200   60.000000 Hz   4:3     75.000 kHz    162.000000 MHz
  Detailed Timing Descriptors:
    DTD 1:  1920x1200   59.950171 Hz  16:10    74.038 kHz    154.000000 MHz (582 mm x 364 mm)
                 Hfront   48 Hsync  32 Hback   80 Hpol P
                 Vfront    3 Vsync   6 Vback   26 Vpol N
    Display Product Serial Number: ...
    Display Range Limits:
      Monitor ranges (GTF): 56-76 Hz V, 30-81 kHz H, max dotclock 210 MHz
    Display Product Name: 'DELL 2707WFP'
Checksum: 0x2c

----------------

Failures:

Block 0, Base EDID:
  Basic Display Parameters & Features: sRGB is signaled, but the chromaticities do not match.
EDID:
  Extension Block 1 started with EDID header, ignoring Extension Blocks >= 1.

EDID conformity: FAIL
