edid-decode (hex):

00 ff ff ff ff ff ff 00 06 af 96 12 00 00 00 00
2e 1e 01 04 a5 22 16 78 03 e3 05 a7 54 49 9d 25
0e 50 54 00 00 00 01 01 01 01 01 01 01 01 01 01
01 01 01 01 01 01 0c 6c 00 a0 a0 40 5e 60 30 20
aa 00 58 d7 10 00 00 18 70 56 00 a0 a0 40 5e 60
30 20 aa 00 58 d7 10 00 00 18 00 00 00 fe 00 41
55 4f 0a 20 20 20 20 20 20 20 20 20 00 00 00 fe
00 42 31 36 30 51 41 4e 30 32 2e 4d 20 0a 00 29

----------------

Block 0, Base EDID:
  EDID Structure Version & Revision: 1.4
  Vendor & Product Identification:
    Manufacturer: AUO
    Model: 4758
    Made in: week 46 of 2020
  Basic Display Parameters & Features:
    Digital display
    Bits per primary color channel: 8
    DisplayPort interface
    Maximum image size: 34 cm x 22 cm
    Gamma: 2.20
    Supported color formats: RGB 4:4:4
    First detailed timing includes the native pixel format and preferred refresh rate
    Display supports continuous frequencies
  Color Characteristics:
    Red  : 0.6552, 0.3300
    Green: 0.2851, 0.6162
    Blue : 0.1445, 0.0546
    White: 0.3134, 0.3291
  Established Timings I & II: none
  Standard Timings: none
  Detailed Timing Descriptors:
    DTD 1:  2560x1600   60.030210 Hz  16:10   101.691 kHz    276.600000 MHz (344 mm x 215 mm)
                 Hfront   48 Hsync  32 Hback   80 Hpol N
                 Vfront   10 Vsync  10 Vback   74 Vpol N
    DTD 2:  2560x1600   48.024168 Hz  16:10    81.353 kHz    221.280000 MHz (344 mm x 215 mm)
                 Hfront   48 Hsync  32 Hback   80 Hpol N
                 Vfront   10 Vsync  10 Vback   74 Vpol N
    Alphanumeric Data String: 'AUO'
    Alphanumeric Data String: 'B160QAN02.M '
Checksum: 0x29

----------------

Warnings:

Block 0, Base EDID:
  Missing Display Product Name.

Failures:

Block 0, Base EDID:
  Alphanumeric Data String: One or more trailing spaces before newline.
  Missing Display Range Limits Descriptor.

EDID conformity: FAIL
