edid-decode (hex):

00 ff ff ff ff ff ff 00 4a 8b 23 20 03 00 00 00
02 21 01 03 b2 00 00 78 2a 8c 75 a9 54 45 98 22
1e 50 54 21 08 00 71 40 81 c0 81 80 a9 c0 a9 40
b3 00 d1 c0 d1 00 9c 68 00 a0 a0 40 29 60 30 20
35 00 58 d7 10 00 00 1a eb 9c 00 a0 a0 40 29 60
30 20 35 00 58 d7 10 00 00 1a 00 00 00 fd 00 30
78 30 b4 3e 00 0a 20 20 20 20 20 20 00 00 00 fc
00 41 53 4d 2d 31 36 30 51 43 0a 20 20 20 01 a4

02 03 41 f3 47 4c 10 04 04 2f 22 00 23 09 07 07
83 01 00 00 67 03 0c 00 10 00 38 82 67 d8 5d c4
01 82 80 01 68 1a 00 00 01 09 30 82 e6 e5 0f 00
00 06 00 63 05 c0 00 e2 00 d5 e6 06 05 01 59 59
49 38 d1 00 a0 a0 40 29 60 30 20 35 00 58 d7 10
00 00 1e d4 bc 00 a0 a0 a0 29 50 30 20 35 00 58
d7 10 00 00 1e 6a 5e 00 a0 a0 a0 29 50 30 20 35
00 58 d7 10 00 00 1e 00 00 00 00 00 00 00 00 bd

00 ff ff ff ff ff ff 00 4a 8b 23 20 03 00 00 00
02 21 01 03 b2 00 00 78 2a 8c 75 a9 54 45 98 22
1e 50 54 21 08 00 71 40 81 c0 81 80 a9 c0 a9 40
b3 00 d1 c0 d1 00 9c 68 00 a0 a0 40 29 60 30 20
35 00 58 d7 10 00 00 1a eb 9c 00 a0 a0 40 29 60
30 20 35 00 58 d7 10 00 00 1a 00 00 00 fd 00 30
78 30 b4 3e 00 0a 20 20 20 20 20 20 00 00 00 fc
00 41 53 4d 2d 31 36 30 51 43 0a 20 20 20 01 a4

02 03 41 f3 47 4c 10 04 04 2f 22 00 23 09 07 07
83 01 00 00 67 03 0c 00 10 00 38 82 67 d8 5d c4
01 82 80 01 68 1a 00 00 01 09 30 82 e6 e5 0f 00
00 06 00 63 05 c0 00 e2 00 d5 e6 06 05 01 59 59
49 38 d1 00 a0 a0 40 29 60 30 20 35 00 58 d7 10
00 00 1e d4 bc 00 a0 a0 a0 29 50 30 20 35 00 58
d7 10 00 00 1e 6a 5e 00 a0 a0 a0 29 50 30 20 35
00 58 d7 10 00 00 1e 00 00 00 00 00 00 00 00 bd

----------------

Block 0, Base EDID:
  EDID Structure Version & Revision: 1.3
  Vendor & Product Identification:
    Manufacturer: RTK
    Model: 8227
    Serial Number: ...
    Made in: week 2 of 2023
  Basic Display Parameters & Features:
    Digital display
    Image size is variable
    Gamma: 2.20
    DPMS levels: Off
    RGB color display
    First detailed timing is the preferred timing
  Color Characteristics:
    Red  : 0.6621, 0.3281
    Green: 0.2724, 0.5937
    Blue : 0.1337, 0.1201
    White: 0.3134, 0.3291
  Established Timings I & II:
    DMT 0x04:   640x480    59.940476 Hz   4:3     31.469 kHz     25.175000 MHz
    DMT 0x09:   800x600    60.316541 Hz   4:3     37.879 kHz     40.000000 MHz
    DMT 0x10:  1024x768    60.003840 Hz   4:3     48.363 kHz     65.000000 MHz
  Standard Timings:
    GTF     :  1152x864    60.000000 Hz   4:3     53.700 kHz     81.624000 MHz
    DMT 0x55:  1280x720    60.000000 Hz  16:9     45.000 kHz     74.250000 MHz
    DMT 0x23:  1280x1024   60.019740 Hz   5:4     63.981 kHz    108.000000 MHz
    DMT 0x53:  1600x900    60.000000 Hz  16:9     60.000 kHz    108.000000 MHz (RB)
    DMT 0x33:  1600x1200   60.000000 Hz   4:3     75.000 kHz    162.000000 MHz
    DMT 0x3a:  1680x1050   59.954250 Hz  16:10    65.290 kHz    146.250000 MHz
    DMT 0x52:  1920x1080   60.000000 Hz  16:9     67.500 kHz    148.500000 MHz
    DMT 0x45:  1920x1200   59.884600 Hz  16:10    74.556 kHz    193.250000 MHz
  Detailed Timing Descriptors:
    DTD 1:  2560x1600   59.997491 Hz  16:10    98.456 kHz    267.800000 MHz (344 mm x 215 mm)
                 Hfront   48 Hsync  32 Hback   80 Hpol P
                 Vfront    3 Vsync   5 Vback   33 Vpol N
    DTD 2:  2560x1600   89.998477 Hz  16:10   147.688 kHz    401.710000 MHz (344 mm x 215 mm)
                 Hfront   48 Hsync  32 Hback   80 Hpol P
                 Vfront    3 Vsync   5 Vback   33 Vpol N
    Display Range Limits:
      Monitor ranges (GTF): 48-120 Hz V, 48-180 kHz H, max dotclock 620 MHz
    Display Product Name: 'ASM-160QC'
  Extension blocks: 1
Checksum: 0xa4

----------------

Block 1, CTA-861 Extension Block:
  Revision: 3
  Underscans IT Video Formats by default
  Basic audio support
  Supports YCbCr 4:4:4
  Supports YCbCr 4:2:2
  Native DTDs: 3
  Video Data Block:
    VIC  76:  1920x1080   60.000000 Hz  64:27    67.500 kHz    148.500000 MHz
    VIC  16:  1920x1080   60.000000 Hz  16:9     67.500 kHz    148.500000 MHz
    VIC   4:  1280x720    60.000000 Hz  16:9     45.000 kHz     74.250000 MHz
    VIC   4:  1280x720    60.000000 Hz  16:9     45.000 kHz     74.250000 MHz
    VIC  47:  1280x720   120.000000 Hz  16:9     90.000 kHz    148.500000 MHz
    VIC  34:  1920x1080   30.000000 Hz  16:9     33.750 kHz     74.250000 MHz
  Audio Data Block:
    Linear PCM:
      Max channels: 2
      Supported sample rates (kHz): 48 44.1 32
      Supported sample sizes (bits): 24 20 16
  Speaker Allocation Data Block:
    FL/FR - Front Left/Right
  Vendor-Specific Data Block (HDMI), OUI 00-0C-03:
    Source physical address: 1.0.0.0
    DC_36bit
    DC_30bit
    DC_Y444
    Maximum TMDS clock: 650 MHz
  Vendor-Specific Data Block (HDMI Forum), OUI C4-5D-D8:
    Version: 1
    Maximum TMDS Character Rate: 650 MHz
    SCDC Present
    Supports 10-bits/component Deep Color 4:2:0 Pixel Encoding
  Vendor-Specific Data Block (AMD), OUI 00-00-1A:
    Version: 1
    Flags 1: 0x09
      FreeSync Supported
    Minimum Refresh Rate: 48 Hz
    Maximum Refresh Rate: 130 Hz
    MCCS VCP Code: 0xe6
  YCbCr 4:2:0 Capability Map Data Block:
    SVD Index 18 is out of range
    SVD Index 19 is out of range
  Vendor-Specific Data Block, OUI 00-C0-05:
  Video Capability Data Block:
    YCbCr quantization: Selectable (via AVI YQ)
    RGB quantization: Selectable (via AVI Q)
    PT scan behavior: Always Overscanned
    IT scan behavior: Always Overscanned
    CE scan behavior: Always Overscanned
  HDR Static Metadata Data Block:
    Electro optical transfer functions:
      Traditional gamma - SDR luminance range
      SMPTE ST2084
    Supported static metadata descriptors:
      Static metadata type 1
    Desired content max luminance: 89 (343.724 cd/m^2)
    Desired content max frame-average luminance: 89 (343.724 cd/m^2)
    Desired content min luminance: 73 (0.282 cd/m^2)
  Detailed Timing Descriptors:
    DTD 3:  2560x1600  119.994982 Hz  16:10   196.912 kHz    535.600000 MHz (344 mm x 215 mm)
                 Hfront   48 Hsync  32 Hback   80 Hpol P
                 Vfront    3 Vsync   5 Vback   33 Vpol P
    DTD 4:  2560x1440  120.000397 Hz  16:9    177.721 kHz    483.400000 MHz (344 mm x 215 mm)
                 Hfront   48 Hsync  32 Hback   80 Hpol P
                 Vfront    3 Vsync   5 Vback   33 Vpol P
    DTD 5:  2560x1440   60.000199 Hz  16:9     88.860 kHz    241.700000 MHz (344 mm x 215 mm)
                 Hfront   48 Hsync  32 Hback   80 Hpol P
                 Vfront    3 Vsync   5 Vback   33 Vpol P
Checksum: 0xbd  Unused space in Extension Block: 8 bytes

----------------

Warnings:

Block 1, CTA-861 Extension Block:
  Video Data Block: VIC 76 and the first DTD are not identical. Is this intended?
  Video Capability Data Block: IT scan behavior is expected to support underscanned.
  Video Capability Data Block: S_PT is equal to S_IT and S_CE, so should be set to 0 instead.
  Detailed Timing Descriptor #4: Image size is 344x215 mm, but based on the picture AR it should be 344x193 mm.
  Detailed Timing Descriptor #5: Image size is 344x215 mm, but based on the picture AR it should be 344x193 mm.
  Add a Colorimetry Data Block with the sRGB colorimetry bit set to avoid interop issues.
EDID:
  Base EDID: Some timings are out of range of the Monitor Ranges:
    Vertical Freq: 30.000 - 120.000 Hz (Monitor: 48.000 - 120.000 Hz)
    Horizontal Freq: 31.468 - 196.911 kHz (Monitor: 48.000 - 180.000 kHz)

Failures:

Block 0, Base EDID:
  Basic Display Parameters & Features: Digital Video Interface Standard set to reserved value 0x32.
Block 1, CTA-861 Extension Block:
  Video Data Block: Duplicate VIC 4.
  Vendor-Specific Data Block (HDMI), OUI 00-0C-03: HDMI VSDB Max TMDS rate is > 340.
  Vendor-Specific Data Block (HDMI Forum), OUI C4-5D-D8: Max TMDS rate is > 0 and <= 340 or > 600.
  YCbCr 4:2:0 Capability Map Data Block: Max index 19 > 7 (#SVDs).
  Video Capability Data Block: IT video formats are always overscanned, but bit 7 of Byte 3 of the CTA-861 Extension header is set to underscanned.
EDID:
  Extension Block 2 started with EDID header, ignoring Extension Blocks >= 2.
  Base EDID: The DTD max image size is 344x215mm, but the display size is not specified anywhere.

EDID conformity: FAIL
