edid-decode (hex):

00 ff ff ff ff ff ff 00 4d 10 48 15 00 00 00 00
34 1f 01 04 a5 1d 12 78 0f de 50 a3 54 4c 99 26
0f 50 54 00 00 00 01 01 01 01 01 01 01 01 01 01
01 01 01 01 01 01 28 3c 80 a0 70 b0 23 40 30 20
36 00 20 b4 10 00 00 18 00 00 00 fd 00 1e 3c 4a
4a 0f 01 0a 20 20 20 20 20 20 00 00 00 fe 00 4a
38 37 58 4a 81 4c 51 31 33 34 4e 31 00 00 00 00
00 02 41 03 32 00 02 00 00 0a 41 0a 20 20 00 bb

00 ff ff ff ff ff ff 00 4d 10 48 15 00 00 00 00
34 1f 01 04 a5 1d 12 78 0f de 50 a3 54 4c 99 26
0f 50 54 00 00 00 01 01 01 01 01 01 01 01 01 01
01 01 01 01 01 01 28 3c 80 a0 70 b0 23 40 30 20
36 00 20 b4 10 00 00 18 00 00 00 fd 00 1e 3c 4a
4a 0f 01 0a 20 20 20 20 20 20 00 00 00 fe 00 4a
38 37 58 4a 81 4c 51 31 33 34 4e 31 00 00 00 00
00 02 41 03 32 00 02 00 00 0a 41 0a 20 20 00 bb

----------------

Block 0, Base EDID:
  EDID Structure Version & Revision: 1.4
  Vendor & Product Identification:
    Manufacturer: SHP
    Model: 5448
    Made in: week 52 of 2021
  Basic Display Parameters & Features:
    Digital display
    Bits per primary color channel: 8
    DisplayPort interface
    Maximum image size: 29 cm x 18 cm
    Gamma: 2.20
    Supported color formats: RGB 4:4:4, YCrCb 4:4:4
    Default (sRGB) color space is primary color space
    First detailed timing includes the native pixel format and preferred refresh rate
    Display supports continuous frequencies
  Color Characteristics:
    Red  : 0.6396, 0.3291
    Green: 0.2998, 0.5996
    Blue : 0.1494, 0.0595
    White: 0.3125, 0.3281
  Established Timings I & II: none
  Standard Timings: none
  Detailed Timing Descriptors:
    DTD 1:  1920x1200   59.950171 Hz  16:10    74.038 kHz    154.000000 MHz (288 mm x 180 mm)
                 Hfront   48 Hsync  32 Hback   80 Hpol N
                 Vfront    3 Vsync   6 Vback   26 Vpol N
    Display Range Limits:
      Monitor ranges (Range Limits Only): 30-60 Hz V, 74-74 kHz H, max dotclock 150 MHz
    Alphanumeric Data String: 'J87XJ.LQ134N1'
    Manufacturer-Specified Display Descriptor (0x00): 00 00 00 02 41 03 32 00 02 00 00 0a 41 0a 20 20 '....A.2.....A.  '
Checksum: 0xbb

----------------

Block 1, Unknown EDID Extension Block 0x00:
  00 ff ff ff ff ff ff 00 4d 10 48 15 00 00 00 00 '........M.H.....'
  34 1f 01 04 a5 1d 12 78 0f de 50 a3 54 4c 99 26 '4......x..P.TL.&'
  0f 50 54 00 00 00 01 01 01 01 01 01 01 01 01 01 '.PT.............'
  01 01 01 01 01 01 28 3c 80 a0 70 b0 23 40 30 20 '......(<..p.#@0 '
  36 00 20 b4 10 00 00 18 00 00 00 fd 00 1e 3c 4a '6. ...........<J'
  4a 0f 01 0a 20 20 20 20 20 20 00 00 00 fe 00 4a 'J...      .....J'
  38 37 58 4a 81 4c 51 31 33 34 4e 31 00 00 00 00 '87XJ.LQ134N1....'
  00 02 41 03 32 00 02 00 00 0a 41 0a 20 20 00 bb '..A.2.....A.  ..'
Checksum: 0xbb

----------------

Warnings:

Block 0, Base EDID:
  Detailed Timing Descriptor #1: DTD is similar but not identical to DMT 0x44.
  Alphanumeric Data String: Non-ASCII character 0x81 at position 5, can cause problems.
  Missing Display Product Name.
EDID:
  Base EDID: Some timings are out of range of the Monitor Ranges:
    Maximum Clock: 154.000 MHz (Monitor: 150.000 MHz)
    Could be due to a Monitor Range off-by-one rounding issue

Failures:

Block 0, Base EDID:
  Basic Display Parameters & Features: sRGB is signaled, but the chromaticities do not match.
Block 1, Base EDID:
  Unknown Extension Block.
EDID:
  Base EDID: EDID specified 0 extension block(s), but found 1 extension block(s).

EDID conformity: FAIL
