edid-decode (hex):

00 ff ff ff ff ff ff 00 06 10 3a ae 73 b9 91 7a
07 20 01 04 c5 3c 21 78 00 0f 91 ae 52 43 b0 26
0f 50 54 00 00 00 01 01 01 01 01 01 01 01 01 01
01 01 01 01 01 01 b7 ce 00 50 f0 70 5a 80 08 20
c8 00 53 4f 21 00 00 1a d0 5c 00 50 a0 a0 3c 50
08 20 e8 08 53 4f 21 00 00 1a bc 34 80 50 70 38
2d 40 08 20 f8 04 53 4f 21 00 00 1a 00 00 00 fc
00 53 74 75 64 69 6f 44 69 73 70 6c 61 79 03 53

02 03 0f 80 e3 05 00 00 e6 06 01 01 73 73 00 70
bc 00 78 a0 40 78 b0 08 20 a8 08 00 00 00 00 00
1a 00 00 00 00 00 00 00 00 00 00 00 00 00 00 00
00 00 00 00 00 00 00 00 00 00 00 00 00 00 00 00
00 00 00 00 00 00 00 00 00 00 00 00 00 00 00 00
00 00 00 00 00 00 00 00 00 00 00 00 00 00 00 00
00 00 00 00 00 00 00 00 00 00 00 00 00 00 00 00
00 00 00 00 00 00 00 00 00 00 00 00 00 00 00 12

00 ff ff ff ff ff ff 00 06 10 3a ae 73 b9 91 7a
07 20 01 04 c5 3c 21 78 00 0f 91 ae 52 43 b0 26
0f 50 54 00 00 00 01 01 01 01 01 01 01 01 01 01
01 01 01 01 01 01 b7 ce 00 50 f0 70 5a 80 08 20
c8 00 53 4f 21 00 00 1a d0 5c 00 50 a0 a0 3c 50
08 20 e8 08 53 4f 21 00 00 1a bc 34 80 50 70 38
2d 40 08 20 f8 04 53 4f 21 00 00 1a 00 00 00 fc
00 53 74 75 64 69 6f 44 69 73 70 6c 61 79 03 53

02 03 0f 80 e3 05 00 00 e6 06 01 01 73 73 00 70
bc 00 78 a0 40 78 b0 08 20 a8 08 00 00 00 00 00
1a 00 00 00 00 00 00 00 00 00 00 00 00 00 00 00
00 00 00 00 00 00 00 00 00 00 00 00 00 00 00 00
00 00 00 00 00 00 00 00 00 00 00 00 00 00 00 00
00 00 00 00 00 00 00 00 00 00 00 00 00 00 00 00
00 00 00 00 00 00 00 00 00 00 00 00 00 00 00 00
00 00 00 00 00 00 00 00 00 00 00 00 00 00 00 12

00 ff ff ff ff ff ff 00 06 10 3a ae 73 b9 91 7a
07 20 01 04 c5 3c 21 78 00 0f 91 ae 52 43 b0 26
0f 50 54 00 00 00 01 01 01 01 01 01 01 01 01 01
01 01 01 01 01 01 b7 ce 00 50 f0 70 5a 80 08 20
c8 00 53 4f 21 00 00 1a d0 5c 00 50 a0 a0 3c 50
08 20 e8 08 53 4f 21 00 00 1a bc 34 80 50 70 38
2d 40 08 20 f8 04 53 4f 21 00 00 1a 00 00 00 fc
00 53 74 75 64 69 6f 44 69 73 70 6c 61 79 03 53

02 03 0f 80 e3 05 00 00 e6 06 01 01 73 73 00 70
bc 00 78 a0 40 78 b0 08 20 a8 08 00 00 00 00 00
1a 00 00 00 00 00 00 00 00 00 00 00 00 00 00 00
00 00 00 00 00 00 00 00 00 00 00 00 00 00 00 00
00 00 00 00 00 00 00 00 00 00 00 00 00 00 00 00
00 00 00 00 00 00 00 00 00 00 00 00 00 00 00 00
00 00 00 00 00 00 00 00 00 00 00 00 00 00 00 00
00 00 00 00 00 00 00 00 00 00 00 00 00 00 00 12

00 ff ff ff ff ff ff 00 06 10 3a ae 73 b9 91 7a
07 20 01 04 c5 3c 21 78 00 0f 91 ae 52 43 b0 26
0f 50 54 00 00 00 01 01 01 01 01 01 01 01 01 01
01 01 01 01 01 01 b7 ce 00 50 f0 70 5a 80 08 20
c8 00 53 4f 21 00 00 1a d0 5c 00 50 a0 a0 3c 50
08 20 e8 08 53 4f 21 00 00 1a bc 34 80 50 70 38
2d 40 08 20 f8 04 53 4f 21 00 00 1a 00 00 00 fc
00 53 74 75 64 69 6f 44 69 73 70 6c 61 79 03 53

02 03 0f 80 e3 05 00 00 e6 06 01 01 73 73 00 70
bc 00 78 a0 40 78 b0 08 20 a8 08 00 00 00 00 00
1a 00 00 00 00 00 00 00 00 00 00 00 00 00 00 00
00 00 00 00 00 00 00 00 00 00 00 00 00 00 00 00
00 00 00 00 00 00 00 00 00 00 00 00 00 00 00 00
00 00 00 00 00 00 00 00 00 00 00 00 00 00 00 00
00 00 00 00 00 00 00 00 00 00 00 00 00 00 00 00
00 00 00 00 00 00 00 00 00 00 00 00 00 00 00 12

----------------

Block 0, Base EDID:
  EDID Structure Version & Revision: 1.4
  Vendor & Product Identification:
    Manufacturer: APP
    Model: 44602
    Serial Number: ...
    Made in: week 7 of 2022
  Basic Display Parameters & Features:
    Digital display
    Bits per primary color channel: 12
    DisplayPort interface
    Maximum image size: 60 cm x 33 cm
    Gamma: 2.20
    Supported color formats: RGB 4:4:4
    First detailed timing does not include the native pixel format and preferred refresh rate
  Color Characteristics:
    Red  : 0.6796, 0.3203
    Green: 0.2646, 0.6904
    Blue : 0.1503, 0.0595
    White: 0.3125, 0.3291
  Established Timings I & II: none
  Standard Timings: none
  Detailed Timing Descriptors:
    DTD 1:  3840x2160   59.998866 Hz  16:9    134.997 kHz    529.190000 MHz (595 mm x 335 mm)
                 Hfront    8 Hsync  32 Hback   40 Hpol P
                 Vfront   12 Vsync   8 Vback   70 Vpol N
    DTD 2:  2560x1440   60.000000 Hz  16:9     90.000 kHz    237.600000 MHz (595 mm x 335 mm)
                 Hfront    8 Hsync  32 Hback   40 Hpol P
                 Vfront   46 Vsync   8 Vback    6 Vpol N
    DTD 3:  1920x1080   60.000000 Hz  16:9     67.500 kHz    135.000000 MHz (595 mm x 335 mm)
                 Hfront    8 Hsync  32 Hback   40 Hpol P
                 Vfront   31 Vsync   8 Vback    6 Vpol N
    Display Product Name: 'StudioDisplay'
  Extension blocks: 3
Checksum: 0x53

----------------

Block 1, CTA-861 Extension Block:
  Revision: 3
  Underscans IT Video Formats by default
  Native DTDs: 0
  Colorimetry Data Block:
  HDR Static Metadata Data Block:
    Electro optical transfer functions:
      Traditional gamma - SDR luminance range
    Supported static metadata descriptors:
      Static metadata type 1
    Desired content max luminance: 115 (603.666 cd/m^2)
    Desired content max frame-average luminance: 115 (603.666 cd/m^2)
    Desired content min luminance: 0 (0.000 cd/m^2)
  Detailed Timing Descriptors:
    DTD 4:  2560x2880   60.000000 Hz   8:9    180.000 kHz    482.400000 MHz
                 Hfront    8 Hsync  32 Hback   80 Hpol P
                 Vfront   42 Vsync   8 Vback   70 Vpol N
Checksum: 0x12  Unused space in Extension Block: 94 bytes

----------------

Warnings:

Block 1, CTA-861 Extension Block:
  Colorimetry Data Block: Set the sRGB colorimetry bit to avoid interop issues.
EDID:
  No Native Video Resolution was defined.
    Hint: set 'Native DTDs' to a non-0 value, or add a Native Video Resolution Data Block.

Failures:

Block 1, CTA-861 Extension Block:
  Detailed Timing Descriptor #4: Mismatch of image size vs display size: image size is not set, but display size is.
  Required 640x480p60 timings are missing in the established timings and the SVD list (VIC 1).
  Missing VCDB, needed for Set Selectable RGB Quantization to avoid interop issues.
EDID:
  Extension Block 2 started with EDID header, ignoring Extension Blocks >= 2.
  Base EDID: EDID specified 3 extension block(s), but found 1 extension block(s).

EDID conformity: FAIL
