edid-decode (hex):

00 ff ff ff ff ff ff 00 51 b8 00 16 00 00 00 00
1e 1f 01 04 b5 23 16 78 07 8a 21 a4 53 4c 99 25
10 50 54 00 00 00 01 01 01 01 01 01 01 01 01 01
01 01 01 01 01 01 03 6d 00 a0 a0 40 6e 60 30 20
36 00 59 d7 10 00 00 1a 00 00 00 fd 0c 30 a5 13
13 4b 01 0a 20 20 20 20 20 20 00 00 00 10 0c 30
f0 50 50 43 00 0a 20 20 20 20 20 20 00 00 00 fc
00 54 4c 31 36 30 41 44 4d 50 30 31 2d 30 02 12

02 03 1f 00 e3 05 80 00 e6 06 07 01 6a 6a 23 72
1a 00 00 03 0b 30 a5 00 04 6a 23 6a 23 a5 00 00
00 00 00 00 00 00 00 00 00 00 00 00 00 00 00 00
00 00 00 00 00 00 00 00 00 00 00 00 00 00 00 00
00 00 00 00 00 00 00 00 00 00 00 00 00 00 00 00
00 00 00 00 00 00 00 00 00 00 00 00 00 00 00 00
00 00 00 00 00 00 00 00 00 00 00 00 00 00 00 00
00 00 00 00 00 00 00 00 00 00 00 00 00 00 18 3f

70 13 79 00 00 03 01 14 c8 2b 01 84 ff 09 9f 00
2f 00 1f 00 3f 06 6d 00 02 00 05 00 00 00 00 00
00 00 00 00 00 00 00 00 00 00 00 00 00 00 00 00
00 00 00 00 00 00 00 00 00 00 00 00 00 00 00 00
00 00 00 00 00 00 00 00 00 00 00 00 00 00 00 00
00 00 00 00 00 00 00 00 00 00 00 00 00 00 00 00
00 00 00 00 00 00 00 00 00 00 00 00 00 00 00 00
00 00 00 00 00 00 00 00 00 00 00 00 00 00 36 90

00 ff ff ff ff ff ff 00 51 b8 00 16 00 00 00 00
1e 1f 01 04 b5 23 16 78 07 8a 21 a4 53 4c 99 25
10 50 54 00 00 00 01 01 01 01 01 01 01 01 01 01
01 01 01 01 01 01 03 6d 00 a0 a0 40 6e 60 30 20
36 00 59 d7 10 00 00 1a 00 00 00 fd 0c 30 a5 13
13 4b 01 0a 20 20 20 20 20 20 00 00 00 10 0c 30
f0 50 50 43 00 0a 20 20 20 20 20 20 00 00 00 fc
00 54 4c 31 36 30 41 44 4d 50 30 31 2d 30 02 12

02 03 1f 00 e3 05 80 00 e6 06 07 01 6a 6a 23 72
1a 00 00 03 0b 30 a5 00 04 6a 23 6a 23 a5 00 00
00 00 00 00 00 00 00 00 00 00 00 00 00 00 00 00
00 00 00 00 00 00 00 00 00 00 00 00 00 00 00 00
00 00 00 00 00 00 00 00 00 00 00 00 00 00 00 00
00 00 00 00 00 00 00 00 00 00 00 00 00 00 00 00
00 00 00 00 00 00 00 00 00 00 00 00 00 00 00 00
00 00 00 00 00 00 00 00 00 00 00 00 00 00 18 3f

70 13 79 00 00 03 01 14 c8 2b 01 84 ff 09 9f 00
2f 00 1f 00 3f 06 6d 00 02 00 05 00 00 00 00 00
00 00 00 00 00 00 00 00 00 00 00 00 00 00 00 00
00 00 00 00 00 00 00 00 00 00 00 00 00 00 00 00
00 00 00 00 00 00 00 00 00 00 00 00 00 00 00 00
00 00 00 00 00 00 00 00 00 00 00 00 00 00 00 00
00 00 00 00 00 00 00 00 00 00 00 00 00 00 00 00
00 00 00 00 00 00 00 00 00 00 00 00 00 00 36 90

----------------

Block 0, Base EDID:
  EDID Structure Version & Revision: 1.4
  Vendor & Product Identification:
    Manufacturer: TMX
    Model: 5632
    Made in: week 30 of 2021
  Basic Display Parameters & Features:
    Digital display
    Bits per primary color channel: 10
    DisplayPort interface
    Maximum image size: 35 cm x 22 cm
    Gamma: 2.20
    Supported color formats: RGB 4:4:4
    Default (sRGB) color space is primary color space
    First detailed timing includes the native pixel format and preferred refresh rate
    Display supports continuous frequencies
  Color Characteristics:
    Red  : 0.6425, 0.3242
    Green: 0.2988, 0.5996
    Blue : 0.1445, 0.0644
    White: 0.3125, 0.3291
  Established Timings I & II: none
  Standard Timings: none
  Detailed Timing Descriptors:
    DTD 1:  2560x1600   59.999570 Hz  16:10   102.599 kHz    279.070000 MHz (345 mm x 215 mm)
                 Hfront   48 Hsync  32 Hback   80 Hpol P
                 Vfront    3 Vsync   6 Vback  101 Vpol N
    Display Range Limits:
      Monitor ranges (Range Limits Only): 48-165 Hz V, 274-274 kHz H, max dotclock 750 MHz
    Dummy Descriptor:
    Display Product Name: 'TL160ADMP01-0'
  Extension blocks: 2
Checksum: 0x12

----------------

Block 1, CTA-861 Extension Block:
  Revision: 3
  Native DTDs: 0
  Colorimetry Data Block:
    BT2020RGB
  HDR Static Metadata Data Block:
    Electro optical transfer functions:
      Traditional gamma - SDR luminance range
      Traditional gamma - HDR luminance range
      SMPTE ST2084
    Supported static metadata descriptors:
      Static metadata type 1
    Desired content max luminance: 106 (496.743 cd/m^2)
    Desired content max frame-average luminance: 106 (496.743 cd/m^2)
    Desired content min luminance: 35 (0.094 cd/m^2)
  Vendor-Specific Data Block (AMD), OUI 00-00-1A:
    Version: 3
    Flags 1: 0x0b
      FreeSync Supported
      FreeSync 2 HDR Supported
      Local Dimming Supported
    Minimum Refresh Rate: 48 Hz
    Maximum Refresh Rate: 165 Hz
    Flags 5: 0x04
      Gamma 2.2 EOTF Supported
    Maximum luminance: 106 (496.743 cd/m^2)
    Minimum luminance: 35 (0.094 cd/m^2)
    Maximum luminance (without local dimming): 106 (496.743 cd/m^2)
    Minimum luminance (without local dimming): 35 (0.094 cd/m^2)
Checksum: 0x3f  Unused space in Extension Block: 96 bytes

----------------

Block 2, DisplayID Extension Block:
  Version: 1.3
  Extension Count: 0
  Display Product Type: Extension Section
  Video Timing Modes Type 1 - Detailed Timings Data Block:
    DTD:  2560x1600  165.000430 Hz  16:9    282.151 kHz    767.450000 MHz (aspect 16:9, no 3D stereo, preferred)
               Hfront   48 Hsync  32 Hback   80 Hpol N
               Vfront    3 Vsync   6 Vback  101 Vpol N
  Checksum: 0x36
Checksum: 0x90

----------------

Warnings:

Block 1, CTA-861 Extension Block:
  IT Video Formats are overscanned by default, but normally this should be underscanned.
EDID:
  Base EDID: Some timings are out of range of the Monitor Ranges:
    Horizontal Freq: 102.599 - 282.150 kHz (Monitor: 274.000 - 274.000 kHz)
    Maximum Clock: 767.450 MHz (Monitor: 750.000 MHz)

Failures:

Block 0, Base EDID:
  Basic Display Parameters & Features: sRGB is signaled, but the chromaticities do not match.
  Display Descriptor #3: Monitor descriptor block has byte 4 nonzero (0x0c).
  Dummy Descriptor: Dummy block filled with garbage.
Block 1, CTA-861 Extension Block:
  Offset is 31, but should be 34.
  Padding: Contains non-zero bytes.
  Required 640x480p60 timings are missing in the established timings and the SVD list (VIC 1).
  Missing VCDB, needed for Set Selectable RGB Quantization to avoid interop issues.
Block 2, DisplayID Extension Block:
  DisplayID Base Block has no product type.
EDID:
  Extension Block 3 started with EDID header, ignoring Extension Blocks >= 3.

EDID conformity: FAIL
