edid-decode (hex):

00 ff ff ff ff ff ff 00 4d d9 0a 05 01 01 01 01
2d 1b 01 03 80 5d 34 78 0a 8a 9d a4 55 52 9f 25
0e 47 4a 20 00 00 01 01 01 01 01 01 01 01 01 01
01 01 01 01 01 01 02 3a 80 18 71 38 2d 40 58 2c
45 00 ba 88 21 00 00 1e 01 1d 00 72 51 d0 1e 20
6e 28 55 00 ba 88 21 00 00 1e 00 00 00 fc 00 6f
6e 6e 2e 20 54 56 0a 20 20 20 20 20 00 00 00 fd
00 17 4c 0f 51 0f 00 0a 20 20 20 20 20 20 01 d7

02 03 35 73 49 90 22 20 05 04 3e 3c 02 01 38 0f
7f 07 15 07 50 3d 1f c0 57 06 03 67 7e 03 5f 7e
03 5f 7e 01 4d 02 00 83 5f 00 00 66 03 0c 00 32
00 80 e2 00 0f 01 1d 80 18 71 1c 16 20 58 2c 25
00 ba 88 21 00 00 9e 00 00 00 00 00 00 00 00 00
00 00 00 00 00 00 00 00 00 00 00 00 00 00 00 00
00 00 00 00 00 00 00 00 00 00 00 00 00 00 00 00
00 00 00 00 00 00 00 00 00 00 00 00 00 00 00 eb

00 ff ff ff ff ff ff 00 4d d9 0a 05 01 01 01 01
2d 1b 01 03 80 5d 34 78 0a 8a 9d a4 55 52 9f 25
0e 47 4a 20 00 00 01 01 01 01 01 01 01 01 01 01
01 01 01 01 01 01 02 3a 80 18 71 38 2d 40 58 2c
45 00 ba 88 21 00 00 1e 01 1d 00 72 51 d0 1e 20
6e 28 55 00 ba 88 21 00 00 1e 00 00 00 fc 00 6f
6e 6e 2e 20 54 56 0a 20 20 20 20 20 00 00 00 fd
00 17 4c 0f 51 0f 00 0a 20 20 20 20 20 20 01 d7

02 03 35 73 49 90 22 20 05 04 3e 3c 02 01 38 0f
7f 07 15 07 50 3d 1f c0 57 06 03 67 7e 03 5f 7e
03 5f 7e 01 4d 02 00 83 5f 00 00 66 03 0c 00 32
00 80 e2 00 0f 01 1d 80 18 71 1c 16 20 58 2c 25
00 ba 88 21 00 00 9e 00 00 00 00 00 00 00 00 00
00 00 00 00 00 00 00 00 00 00 00 00 00 00 00 00
00 00 00 00 00 00 00 00 00 00 00 00 00 00 00 00
00 00 00 00 00 00 00 00 00 00 00 00 00 00 00 eb

----------------

Block 0, Base EDID:
  EDID Structure Version & Revision: 1.3
  Vendor & Product Identification:
    Manufacturer: SNY
    Model: 1290
    Serial Number: ...
    Made in: week 45 of 2017
  Basic Display Parameters & Features:
    Digital display
    Maximum image size: 93 cm x 52 cm
    Gamma: 2.20
    RGB color display
    First detailed timing is the preferred timing
  Color Characteristics:
    Red  : 0.6425, 0.3320
    Green: 0.3222, 0.6230
    Blue : 0.1464, 0.0556
    White: 0.2802, 0.2900
  Established Timings I & II:
    DMT 0x04:   640x480    59.940476 Hz   4:3     31.469 kHz     25.175000 MHz
  Standard Timings: none
  Detailed Timing Descriptors:
    DTD 1:  1920x1080   60.000000 Hz  16:9     67.500 kHz    148.500000 MHz (698 mm x 392 mm)
                 Hfront   88 Hsync  44 Hback  148 Hpol P
                 Vfront    4 Vsync   5 Vback   36 Vpol P
    DTD 2:  1280x720    60.000000 Hz  16:9     45.000 kHz     74.250000 MHz (698 mm x 392 mm)
                 Hfront  110 Hsync  40 Hback  220 Hpol P
                 Vfront    5 Vsync   5 Vback   20 Vpol P
    Display Product Name: 'onn. TV'
    Display Range Limits:
      Monitor ranges (GTF): 23-76 Hz V, 15-81 kHz H, max dotclock 150 MHz
  Extension blocks: 1
Checksum: 0xd7

----------------

Block 1, CTA-861 Extension Block:
  Revision: 3
  Basic audio support
  Supports YCbCr 4:4:4
  Supports YCbCr 4:2:2
  Native DTDs: 3
  Video Data Block:
    VIC  16:  1920x1080   60.000000 Hz  16:9     67.500 kHz    148.500000 MHz (native)
    VIC  34:  1920x1080   30.000000 Hz  16:9     33.750 kHz     74.250000 MHz
    VIC  32:  1920x1080   24.000000 Hz  16:9     27.000 kHz     74.250000 MHz
    VIC   5:  1920x1080i  60.000000 Hz  16:9     33.750 kHz     74.250000 MHz
    VIC   4:  1280x720    60.000000 Hz  16:9     45.000 kHz     74.250000 MHz
    VIC  62:  1280x720    30.000000 Hz  16:9     22.500 kHz     74.250000 MHz
    VIC  60:  1280x720    24.000000 Hz  16:9     18.000 kHz     59.400000 MHz
    VIC   2:   720x480    59.940060 Hz   4:3     31.469 kHz     27.000000 MHz
    VIC   1:   640x480    59.940476 Hz   4:3     31.469 kHz     25.175000 MHz
  Audio Data Block:
    Linear PCM:
      Max channels: 8
      Supported sample rates (kHz): 192 176.4 96 88.2 48 44.1 32
      Supported sample sizes (bits): 24 20 16
    AC-3:
      Max channels: 6
      Supported sample rates (kHz): 48 44.1 32
      Maximum bit rate: 640 kb/s
    DTS:
      Max channels: 6
      Supported sample rates (kHz): 96 88.2 48 44.1 32
      Maximum bit rate: 1536 kb/s
    Enhanced AC-3 (DD+):
      Max channels: 8
      Supported sample rates (kHz): 48 44.1
      Supports Joint Object Coding
      Supports Joint Object Coding with ACMOD28
    MAT (MLP):
      Max channels: 8
      Supported sample rates (kHz): 192 176.4 96 88.2 48 44.1
      Supports Dolby TrueHD, object audio PCM and channel-based PCM
      Hash calculation not required for object audio PCM or channel-based PCM
    DTS-HD:
      Max channels: 8
      Supported sample rates (kHz): 192 176.4 96 88.2 48 44.1
      Supports DTS:X
      Audio Format Code dependent value: 0x03
    DTS-HD:
      Max channels: 8
      Supported sample rates (kHz): 192 176.4 96 88.2 48 44.1
      Audio Format Code dependent value: 0x01
    One Bit Audio:
      Max channels: 6
      Supported sample rates (kHz): 44.1
      Audio Format Code dependent value: 0x00
  Speaker Allocation Data Block:
    FL/FR - Front Left/Right
    LFE1 - Low Frequency Effects 1
    FC - Front Center
    LS/RS - Left/Right Surround
    BC - Back Center
    BL/BR - Back Left/Right
  Vendor-Specific Data Block (HDMI), OUI 00-0C-03:
    Source physical address: 3.2.0.0
    Supports_AI
  Video Capability Data Block:
    YCbCr quantization: No Data
    RGB quantization: No Data
    PT scan behavior: No Data
    IT scan behavior: Supports both over- and underscan
    CE scan behavior: Supports both over- and underscan
  Detailed Timing Descriptors:
    DTD 3:  1920x1080i  60.000000 Hz  16:9     33.750 kHz     74.250000 MHz (698 mm x 392 mm)
                 Hfront   88 Hsync  44 Hback  148 Hpol P
                 Vfront    2 Vsync   5 Vback   15 Vpol P Vfront +0.5 Odd Field
                 Vfront    2 Vsync   5 Vback   15 Vpol P Vback  +0.5 Even Field
Checksum: 0xeb  Unused space in Extension Block: 56 bytes

----------------

Warnings:

Block 0, Base EDID:
  Vendor & Product Identification: The serial number is one of the known dummy values, it should probably be set to 0.
Block 1, CTA-861 Extension Block:
  IT Video Formats are overscanned by default, but normally this should be underscanned.
  Video Capability Data Block: Set Selectable YCbCr Quantization to avoid interop issues.
  Add a Colorimetry Data Block with the sRGB colorimetry bit set to avoid interop issues.

Failures:

Block 0, Base EDID:
  Detailed Timing Descriptor #1: Mismatch of image size 698x392 mm vs display size 930x520 mm.
  Detailed Timing Descriptor #2: Mismatch of image size 698x392 mm vs display size 930x520 mm.
Block 1, CTA-861 Extension Block:
  Video Capability Data Block: Set Selectable RGB Quantization to avoid interop issues.
  Detailed Timing Descriptor #3: Mismatch of image size 698x392 mm vs display size 930x520 mm.
EDID:
  Extension Block 2 started with EDID header, ignoring Extension Blocks >= 2.
  CTA-861: Native progressive timings are a mix of several resolutions.

EDID conformity: FAIL
