edid-decode (hex):

00 ff ff ff ff ff ff 00 63 18 00 20 00 00 00 00
11 20 01 04 a5 2c 19 78 22 c9 05 a3 57 4b 9c 25
12 50 54 ad ce 00 81 ca 81 00 95 00 a9 c0 01 01
01 01 01 01 01 01 42 26 40 a0 60 84 1a 30 50 20
25 04 bb f9 10 00 00 1c 00 00 00 ff 00 30 30 30
30 30 30 0a 20 20 20 20 20 20 00 00 00 fd 00 38
4b 26 51 0e 00 0a 20 20 20 20 20 20 00 00 00 fc
00 56 47 41 0a 20 20 20 20 20 20 20 20 20 00 2f

00 ff ff ff ff ff ff 00 63 18 00 20 00 00 00 00
11 20 01 04 a5 2c 19 78 22 c9 05 a3 57 4b 9c 25
12 50 54 ad ce 00 81 ca 81 00 95 00 a9 c0 01 01
01 01 01 01 01 01 42 26 40 a0 60 84 1a 30 50 20
25 04 bb f9 10 00 00 1c 00 00 00 ff 00 30 30 30
30 30 30 0a 20 20 20 20 20 20 00 00 00 fd 00 38
4b 26 51 0e 00 0a 20 20 20 20 20 20 00 00 00 fc
00 56 47 41 0a 20 20 20 20 20 20 20 20 20 00 2f

----------------

Block 0, Base EDID:
  EDID Structure Version & Revision: 1.4
  Vendor & Product Identification:
    Manufacturer: XXX
    Model: 8192
    Made in: week 17 of 2022
  Basic Display Parameters & Features:
    Digital display
    Bits per primary color channel: 8
    DisplayPort interface
    Maximum image size: 44 cm x 25 cm
    Gamma: 2.20
    DPMS levels: Off
    Supported color formats: RGB 4:4:4
    First detailed timing includes the native pixel format and preferred refresh rate
  Color Characteristics:
    Red  : 0.6396, 0.3398
    Green: 0.2949, 0.6103
    Blue : 0.1445, 0.0703
    White: 0.3134, 0.3291
  Established Timings I & II:
    IBM     :   720x400    70.081663 Hz   9:5     31.467 kHz     28.320000 MHz
    DMT 0x04:   640x480    59.940476 Hz   4:3     31.469 kHz     25.175000 MHz
    DMT 0x05:   640x480    72.808802 Hz   4:3     37.861 kHz     31.500000 MHz
    DMT 0x06:   640x480    75.000000 Hz   4:3     37.500 kHz     31.500000 MHz
    DMT 0x09:   800x600    60.316541 Hz   4:3     37.879 kHz     40.000000 MHz
    DMT 0x0a:   800x600    72.187572 Hz   4:3     48.077 kHz     50.000000 MHz
    DMT 0x0b:   800x600    75.000000 Hz   4:3     46.875 kHz     49.500000 MHz
    DMT 0x10:  1024x768    60.003840 Hz   4:3     48.363 kHz     65.000000 MHz
    DMT 0x11:  1024x768    70.069359 Hz   4:3     56.476 kHz     75.000000 MHz
    DMT 0x12:  1024x768    75.028582 Hz   4:3     60.023 kHz     78.750000 MHz
  Standard Timings:
    GTF     :  1280x720    70.000000 Hz  16:9     52.500 kHz     89.040000 MHz
    DMT 0x1c:  1280x800    59.810326 Hz  16:10    49.702 kHz     83.500000 MHz
    DMT 0x2f:  1440x900    59.887445 Hz  16:10    55.935 kHz    106.500000 MHz
    DMT 0x53:  1600x900    60.000000 Hz  16:9     60.000 kHz    108.000000 MHz (RB)
  Detailed Timing Descriptors:
    DTD 1:  1600x900    60.094738 Hz  16:9     55.648 kHz     97.940000 MHz (443 mm x 249 mm)
                 Hfront   80 Hsync  32 Hback   48 Hpol N
                 Vfront   18 Vsync   5 Vback    3 Vpol P
    Display Product Serial Number: ...
    Display Range Limits:
      Monitor ranges (GTF): 56-75 Hz V, 38-81 kHz H, max dotclock 140 MHz
    Display Product Name: 'VGA'
Checksum: 0x2f

----------------

Warnings:

Block 0, Base EDID:
  Display Product Serial Number: ...
  Display Range Limits: GTF support is deprecated in EDID 1.4.
EDID:
  Base EDID: Some timings are out of range of the Monitor Ranges:
    Horizontal Freq: 31.466 - 60.022 kHz (Monitor: 38.000 - 81.000 kHz)

Failures:

Block 0, Base EDID:
  Display Range Limits: GTF is supported, but the display does not support continuous frequencies.
EDID:
  Extension Block 1 started with EDID header, ignoring Extension Blocks >= 1.

EDID conformity: FAIL
