edid-decode (hex):

00 ff ff ff ff ff ff 00 21 2b 57 29 01 00 00 00
15 1b 01 03 80 59 31 6b 2a 6c 55 a2 5a 4e 9b 23
16 4f 54 af 08 00 b3 00 95 00 81 c0 71 40 01 01
01 01 01 01 01 01 02 3a 80 18 71 38 2d 40 58 2c
45 02 78 2d 11 00 00 1e 00 21 50 b0 51 00 1b 30
40 70 36 30 6e e5 31 0a 0a 1e 00 00 00 fc 00 4c
45 44 20 54 56 0a 6e e5 31 20 20 20 00 00 00 0f
00 0a 20 20 20 20 0a 0a 0a 0a 0a 0a 0a 0a 01 66

02 03 30 71 4f 06 07 02 03 15 96 11 12 13 04 14
05 1f 90 20 23 09 07 07 83 01 00 00 73 03 0c 00
30 00 38 2d 20 c0 09 01 40 7f cc 80 90 a0 b0 e0
8c 0a d0 90 20 40 31 20 0c 40 55 00 b9 88 21 00
00 18 01 1d 80 18 71 1c 16 20 58 2c 25 00 b9 88
21 00 00 9e 01 1d 80 d0 72 1c 16 20 10 2c 25 80
b9 88 21 00 00 9e 01 1d 00 bc 52 d0 1e 20 b8 28
55 40 b9 88 21 00 00 1e 00 00 00 00 00 00 00 7c

----------------

Block 0, Base EDID:
  EDID Structure Version & Revision: 1.3
  Vendor & Product Identification:
    Manufacturer: HIK
    Model: 10583
    Serial Number: ...
    Made in: week 21 of 2017
  Basic Display Parameters & Features:
    Digital display
    Maximum image size: 89 cm x 49 cm
    Gamma: 2.07
    DPMS levels: Off
    RGB color display
    First detailed timing is the preferred timing
  Color Characteristics:
    Red  : 0.6337, 0.3535
    Green: 0.3076, 0.6054
    Blue : 0.1376, 0.0869
    White: 0.3095, 0.3291
  Established Timings I & II:
    IBM     :   720x400    70.081663 Hz   9:5     31.467 kHz     28.320000 MHz
    DMT 0x04:   640x480    59.940476 Hz   4:3     31.469 kHz     25.175000 MHz
    DMT 0x05:   640x480    72.808802 Hz   4:3     37.861 kHz     31.500000 MHz
    DMT 0x06:   640x480    75.000000 Hz   4:3     37.500 kHz     31.500000 MHz
    DMT 0x08:   800x600    56.250000 Hz   4:3     35.156 kHz     36.000000 MHz
    DMT 0x09:   800x600    60.316541 Hz   4:3     37.879 kHz     40.000000 MHz
    DMT 0x10:  1024x768    60.003840 Hz   4:3     48.363 kHz     65.000000 MHz
  Standard Timings:
    DMT 0x3a:  1680x1050   59.954250 Hz  16:10    65.290 kHz    146.250000 MHz
    DMT 0x2f:  1440x900    59.887445 Hz  16:10    55.935 kHz    106.500000 MHz
    DMT 0x55:  1280x720    60.000000 Hz  16:9     45.000 kHz     74.250000 MHz
    GTF     :  1152x864    60.000000 Hz   4:3     53.700 kHz     81.624000 MHz
  Detailed Timing Descriptors:
    DTD 1:  1920x1080   60.000000 Hz  16:9     67.500 kHz    148.500000 MHz (376 mm x 301 mm)
                 Hfront   88 Hsync  44 Hback  148 Hpol P
                 Vfront    4 Vsync  37 Vback    4 Vpol P
    DTD 2:  1360x768    59.299191 Hz  85:48    47.143 kHz     84.480000 MHz (878 mm x 485 mm)
                 Hfront   64 Hsync 880 Hback -532 Hpol P Hborder 10
                 Vfront    3 Vsync   6 Vback   -2 Vpol P Vborder 10
    Display Product Name: 'LED TV'
    Manufacturer-Specified Display Descriptor (0x0f): 00 0f 00 0a 20 20 20 20 0a 0a 0a 0a 0a 0a 0a 0a '....    ........'
  Extension blocks: 1
Checksum: 0x66

----------------

Block 1, CTA-861 Extension Block:
  Revision: 3
  Basic audio support
  Supports YCbCr 4:4:4
  Supports YCbCr 4:2:2
  Native DTDs: 1
  Video Data Block:
    VIC   6:  1440x480i   59.940060 Hz   4:3     15.734 kHz     27.000000 MHz
    VIC   7:  1440x480i   59.940060 Hz  16:9     15.734 kHz     27.000000 MHz
    VIC   2:   720x480    59.940060 Hz   4:3     31.469 kHz     27.000000 MHz
    VIC   3:   720x480    59.940060 Hz  16:9     31.469 kHz     27.000000 MHz
    VIC  21:  1440x576i   50.000000 Hz   4:3     15.625 kHz     27.000000 MHz
    VIC  22:  1440x576i   50.000000 Hz  16:9     15.625 kHz     27.000000 MHz (native)
    VIC  17:   720x576    50.000000 Hz   4:3     31.250 kHz     27.000000 MHz
    VIC  18:   720x576    50.000000 Hz  16:9     31.250 kHz     27.000000 MHz
    VIC  19:  1280x720    50.000000 Hz  16:9     37.500 kHz     74.250000 MHz
    VIC   4:  1280x720    60.000000 Hz  16:9     45.000 kHz     74.250000 MHz
    VIC  20:  1920x1080i  50.000000 Hz  16:9     28.125 kHz     74.250000 MHz
    VIC   5:  1920x1080i  60.000000 Hz  16:9     33.750 kHz     74.250000 MHz
    VIC  31:  1920x1080   50.000000 Hz  16:9     56.250 kHz    148.500000 MHz
    VIC  16:  1920x1080   60.000000 Hz  16:9     67.500 kHz    148.500000 MHz (native)
    VIC  32:  1920x1080   24.000000 Hz  16:9     27.000 kHz     74.250000 MHz
  Audio Data Block:
    Linear PCM:
      Max channels: 2
      Supported sample rates (kHz): 48 44.1 32
      Supported sample sizes (bits): 24 20 16
  Speaker Allocation Data Block:
    FL/FR - Front Left/Right
  Vendor-Specific Data Block (HDMI), OUI 00-0C-03:
    Source physical address: 3.0.0.0
    DC_36bit
    DC_30bit
    DC_Y444
    Maximum TMDS clock: 225 MHz
    Extended HDMI video details:
      3D present
      3D-capable-VIC mask present
      3D: Side-by-side (half, horizontal)
      3D: Top-and-bottom
      3D VIC indices that support these capabilities:
        VIC   2:   720x480    59.940060 Hz   4:3     31.469 kHz     27.000000 MHz
        VIC   3:   720x480    59.940060 Hz  16:9     31.469 kHz     27.000000 MHz
        VIC  17:   720x576    50.000000 Hz   4:3     31.250 kHz     27.000000 MHz
        VIC  18:   720x576    50.000000 Hz  16:9     31.250 kHz     27.000000 MHz
        VIC  19:  1280x720    50.000000 Hz  16:9     37.500 kHz     74.250000 MHz
        VIC   4:  1280x720    60.000000 Hz  16:9     45.000 kHz     74.250000 MHz
        VIC  20:  1920x1080i  50.000000 Hz  16:9     28.125 kHz     74.250000 MHz
        VIC   5:  1920x1080i  60.000000 Hz  16:9     33.750 kHz     74.250000 MHz
        VIC  31:  1920x1080   50.000000 Hz  16:9     56.250 kHz    148.500000 MHz
        VIC  16:  1920x1080   60.000000 Hz  16:9     67.500 kHz    148.500000 MHz
        VIC  32:  1920x1080   24.000000 Hz  16:9     27.000 kHz     74.250000 MHz
      3D VIC indices with specific capabilities:
        VIC  19:  1280x720    50.000000 Hz  16:9     37.500 kHz     74.250000 MHz (frame packing)
        VIC   4:  1280x720    60.000000 Hz  16:9     45.000 kHz     74.250000 MHz (frame packing)
        VIC  20:  1920x1080i  50.000000 Hz  16:9     28.125 kHz     74.250000 MHz (frame packing)
        VIC   5:  1920x1080i  60.000000 Hz  16:9     33.750 kHz     74.250000 MHz (frame packing)
        VIC  32:  1920x1080   24.000000 Hz  16:9     27.000 kHz     74.250000 MHz (frame packing)
  Detailed Timing Descriptors:
    DTD 3:   720x576    50.000000 Hz   5:4     31.250 kHz     27.000000 MHz (697 mm x 392 mm)
                 Hfront   12 Hsync  64 Hback   68 Hpol N
                 Vfront    5 Vsync   5 Vback   39 Vpol N
    DTD 4:  1920x1080i  60.000000 Hz  16:9     33.750 kHz     74.250000 MHz (697 mm x 392 mm)
                 Hfront   88 Hsync  44 Hback  148 Hpol P
                 Vfront    2 Vsync   5 Vback   15 Vpol P Vfront +0.5 Odd Field
                 Vfront    2 Vsync   5 Vback   15 Vpol P Vback  +0.5 Even Field
    DTD 5:  1920x1080i  50.000000 Hz  16:9     28.125 kHz     74.250000 MHz (697 mm x 392 mm)
                 Hfront  528 Hsync  44 Hback  148 Hpol P
                 Vfront    2 Vsync   5 Vback   15 Vpol P Vfront +0.5 Odd Field
                 Vfront    2 Vsync   5 Vback   15 Vpol P Vback  +0.5 Even Field
    DTD 6:  1280x720    50.000000 Hz  16:9     37.500 kHz     74.250000 MHz (697 mm x 392 mm)
                 Hfront  440 Hsync  40 Hback  220 Hpol P
                 Vfront    5 Vsync   5 Vback   20 Vpol P
Checksum: 0x7c  Unused space in Extension Block: 7 bytes

----------------

Warnings:

Block 0, Base EDID:
  Vendor & Product Identification: The serial number is one of the known dummy values, it should probably be set to 0.
  Detailed Timing Descriptor #1: DTD is similar but not identical to VIC 16.
  Detailed Timing Descriptor #1: Image size is 376x301 mm, but based on the picture AR it should be 376x211 mm.
  Detailed Timing Descriptor #2: The use of non-zero borders in a DTD is not recommended.
Block 1, CTA-861 Extension Block:
  IT Video Formats are overscanned by default, but normally this should be underscanned.
  Video Data Block: VIC 6 and the first DTD are not identical. Is this intended?
  Detailed Timing Descriptor #3: Image size is 697x392 mm, but based on the picture AR it should be 490x392 mm.
  Add a Colorimetry Data Block with the sRGB colorimetry bit set to avoid interop issues.

Failures:

Block 0, Base EDID:
  Detailed Timing Descriptor #1: Mismatch of image size 376x301 mm vs display size 890x490 mm.
  Detailed Timing Descriptor #2: 0 or negative horizontal back porch.
  Detailed Timing Descriptor #2: 0 or negative vertical back porch.
  Display Product Name: Non-space after newline.
  Missing Display Range Limits Descriptor.
Block 1, CTA-861 Extension Block:
  Detailed Timing Descriptor #3: Mismatch of image size 697x392 mm vs display size 890x490 mm.
  Detailed Timing Descriptor #4: Mismatch of image size 697x392 mm vs display size 890x490 mm.
  Detailed Timing Descriptor #5: Mismatch of image size 697x392 mm vs display size 890x490 mm.
  Detailed Timing Descriptor #6: Mismatch of image size 697x392 mm vs display size 890x490 mm.
  Missing VCDB, needed for Set Selectable RGB Quantization to avoid interop issues.

EDID conformity: FAIL
