edid-decode (hex):

00 ff ff ff ff ff ff 00 04 72 55 20 01 01 01 01
00 13 01 04 68 28 1e 78 2a 8e 60 a5 55 44 99 24
12 49 4b bf ee 00 71 4f 81 c0 81 00 01 01 01 01
01 01 01 01 01 01 31 2e 40 00 62 84 22 30 58 a8
1b 00 90 2c 11 00 00 1e 00 00 00 ff 00 0a 20 20
20 20 20 20 20 20 20 20 20 20 00 00 00 fd 00 38
4c 0f 44 0f 00 0a 20 20 20 20 20 20 00 00 00 fc
00 41 54 32 30 35 35 0a 20 20 20 20 20 20 00 ad

00 ff ff ff ff ff ff 00 04 72 55 20 01 01 01 01
00 13 01 04 68 28 1e 78 2a 8e 60 a5 55 44 99 24
12 49 4b bf ee 00 71 4f 81 c0 81 00 01 01 01 01
01 01 01 01 01 01 31 2e 40 00 62 84 22 30 58 a8
1b 00 90 2c 11 00 00 1e 00 00 00 ff 00 0a 20 20
20 20 20 20 20 20 20 20 20 20 00 00 00 fd 00 38
4c 0f 44 0f 00 0a 20 20 20 20 20 20 00 00 00 fc
00 41 54 32 30 35 35 0a 20 20 20 20 20 20 00 ad

----------------

Block 0, Base EDID:
  EDID Structure Version & Revision: 1.4
  Vendor & Product Identification:
    Manufacturer: ACR
    Model: 8277
    Serial Number: ...
    Made in: 2009
  Basic Display Parameters & Features:
    Analog display
    Signal Level Standard: 0.700 : 0.000 : 0.700 V p-p
    Blank level equals black level
    Sync: Separate
    Maximum image size: 40 cm x 30 cm
    Gamma: 2.20
    DPMS levels: Off
    RGB color display
    First detailed timing includes the native pixel format and preferred refresh rate
  Color Characteristics:
    Red  : 0.6464, 0.3320
    Green: 0.2685, 0.5996
    Blue : 0.1416, 0.0722
    White: 0.2851, 0.2929
  Established Timings I & II:
    IBM     :   720x400    70.081663 Hz   9:5     31.467 kHz     28.320000 MHz
    DMT 0x04:   640x480    59.940476 Hz   4:3     31.469 kHz     25.175000 MHz
    Apple   :   640x480    66.666667 Hz   4:3     35.000 kHz     30.240000 MHz
    DMT 0x05:   640x480    72.808802 Hz   4:3     37.861 kHz     31.500000 MHz
    DMT 0x06:   640x480    75.000000 Hz   4:3     37.500 kHz     31.500000 MHz
    DMT 0x08:   800x600    56.250000 Hz   4:3     35.156 kHz     36.000000 MHz
    DMT 0x09:   800x600    60.316541 Hz   4:3     37.879 kHz     40.000000 MHz
    DMT 0x0a:   800x600    72.187572 Hz   4:3     48.077 kHz     50.000000 MHz
    DMT 0x0b:   800x600    75.000000 Hz   4:3     46.875 kHz     49.500000 MHz
    Apple   :   832x624    74.551266 Hz   4:3     49.726 kHz     57.284000 MHz
    DMT 0x10:  1024x768    60.003840 Hz   4:3     48.363 kHz     65.000000 MHz
    DMT 0x11:  1024x768    70.069359 Hz   4:3     56.476 kHz     75.000000 MHz
    DMT 0x12:  1024x768    75.028582 Hz   4:3     60.023 kHz     78.750000 MHz
  Standard Timings:
    DMT 0x15:  1152x864    75.000000 Hz   4:3     67.500 kHz    108.000000 MHz
    DMT 0x55:  1280x720    60.000000 Hz  16:9     45.000 kHz     74.250000 MHz
    DMT 0x1c:  1280x800    59.810326 Hz  16:10    49.702 kHz     83.500000 MHz
  Detailed Timing Descriptors:
    DTD 1:  1600x900    59.946021 Hz  16:9     55.990 kHz    118.250000 MHz (400 mm x 300 mm)
                 Hfront   88 Hsync 168 Hback  256 Hpol P
                 Vfront    1 Vsync  11 Vback   22 Vpol P
    Display Product Serial Number: ...
    Display Range Limits:
      Monitor ranges (GTF): 56-76 Hz V, 15-68 kHz H, max dotclock 150 MHz
    Display Product Name: 'AT2055'
Checksum: 0xad

----------------

Warnings:

Block 0, Base EDID:
  Vendor & Product Identification: The serial number is one of the known dummy values, it should probably be set to 0.
  Detailed Timing Descriptor #1: Image size is 400x300 mm, but based on the picture AR it should be 400x225 mm.
  Display Range Limits: GTF support is deprecated in EDID 1.4.

Failures:

Block 0, Base EDID:
  Display Product Serial Number: ...
  Display Range Limits: GTF is supported, but the display does not support continuous frequencies.
EDID:
  Extension Block 1 started with EDID header, ignoring Extension Blocks >= 1.

EDID conformity: FAIL
