edid-decode (hex):

00 ff ff ff ff ff ff 00 36 09 01 70 01 01 01 01
22 15 01 03 80 29 1a 78 ee e5 b5 a3 55 49 99 27
13 50 54 ac 00 00 01 01 01 01 01 01 01 01 01 01
01 01 01 01 01 01 8d 0b 20 c0 30 e0 11 10 10 50
13 00 ff ff 00 00 00 1c 00 00 00 fc 00 4d 50 49
37 30 30 31 0a 20 20 20 20 20 00 00 00 fd 00 32
4c 1e 51 0e 00 0a 20 20 20 20 20 20 00 00 00 ff
00 42 33 34 33 32 38 34 35 0a 20 20 20 20 01 5b

02 03 14 71 41 00 23 09 87 07 83 01 00 00 65 03
0c 00 10 00 00 00 00 10 00 10 0a 20 20 20 20 20
20 20 20 20 20 20 00 00 00 10 00 10 0a 20 20 20
20 20 20 20 20 20 20 20 00 00 00 10 00 01 01 20
20 20 20 20 20 20 20 20 20 20 00 00 00 10 00 10
0a 20 20 20 20 20 20 20 20 20 20 20 00 00 00 10
00 10 0a 20 20 20 20 20 20 20 20 20 20 20 00 00
00 00 00 00 00 00 00 00 00 00 00 00 00 00 00 d9

00 ff ff ff ff ff ff 00 36 09 01 70 01 01 01 01
22 15 01 03 80 29 1a 78 ee e5 b5 a3 55 49 99 27
13 50 54 ac 00 00 01 01 01 01 01 01 01 01 01 01
01 01 01 01 01 01 8d 0b 20 c0 30 e0 11 10 10 50
13 00 ff ff 00 00 00 1c 00 00 00 fc 00 4d 50 49
37 30 30 31 0a 20 20 20 20 20 00 00 00 fd 00 32
4c 1e 51 0e 00 0a 20 20 20 20 20 20 00 00 00 ff
00 42 33 34 33 32 38 34 35 0a 20 20 20 20 01 5b

02 03 14 71 41 00 23 09 87 07 83 01 00 00 65 03
0c 00 10 00 00 00 00 10 00 10 0a 20 20 20 20 20
20 20 20 20 20 20 00 00 00 10 00 10 0a 20 20 20
20 20 20 20 20 20 20 20 00 00 00 10 00 01 01 20
20 20 20 20 20 20 20 20 20 20 00 00 00 10 00 10
0a 20 20 20 20 20 20 20 20 20 20 20 00 00 00 10
00 10 0a 20 20 20 20 20 20 20 20 20 20 20 00 00
00 00 00 00 00 00 00 00 00 00 00 00 00 00 00 d9

----------------

Block 0, Base EDID:
  EDID Structure Version & Revision: 1.3
  Vendor & Product Identification:
    Manufacturer: MPI
    Model: 28673
    Serial Number: ...
    Made in: week 34 of 2011
  Basic Display Parameters & Features:
    Digital display
    Maximum image size: 41 cm x 26 cm
    Gamma: 2.20
    DPMS levels: Standby Suspend Off
    RGB color display
    Default (sRGB) color space is primary color space
    First detailed timing is the preferred timing
  Color Characteristics:
    Red  : 0.6396, 0.3339
    Green: 0.2861, 0.5986
    Blue : 0.1542, 0.0771
    White: 0.3134, 0.3291
  Established Timings I & II:
    IBM     :   720x400    70.081663 Hz   9:5     31.467 kHz     28.320000 MHz
    DMT 0x04:   640x480    59.940476 Hz   4:3     31.469 kHz     25.175000 MHz
    DMT 0x05:   640x480    72.808802 Hz   4:3     37.861 kHz     31.500000 MHz
    DMT 0x06:   640x480    75.000000 Hz   4:3     37.500 kHz     31.500000 MHz
  Standard Timings: none
  Detailed Timing Descriptors:
    DTD 1:   800x480    59.976796 Hz   5:3     29.808 kHz     29.570000 MHz (255 mm x 255 mm)
                 Hfront   16 Hsync  80 Hback   96 Hpol N
                 Vfront    1 Vsync   3 Vback   13 Vpol P
    Display Product Name: 'MPI7001'
    Display Range Limits:
      Monitor ranges (GTF): 50-76 Hz V, 30-81 kHz H, max dotclock 140 MHz
    Display Product Serial Number: ...
  Extension blocks: 1
Checksum: 0x5b

----------------

Block 1, CTA-861 Extension Block:
  Revision: 3
  Basic audio support
  Supports YCbCr 4:4:4
  Supports YCbCr 4:2:2
  Native DTDs: 1
  Video Data Block:
  Audio Data Block:
    Linear PCM:
      Max channels: 2
      Supported sample rates (kHz): 48 44.1 32
      Supported sample sizes (bits): 24 20 16
  Speaker Allocation Data Block:
    FL/FR - Front Left/Right
  Vendor-Specific Data Block (HDMI), OUI 00-0C-03:
    Source physical address: 1.0.0.0
  Detailed Timing Descriptors:
    Dummy Descriptor:
    Dummy Descriptor:
    Dummy Descriptor:
    Dummy Descriptor:
    Dummy Descriptor:
Checksum: 0xd9  Unused space in Extension Block: 17 bytes

----------------

Warnings:

Block 0, Base EDID:
  Vendor & Product Identification: The serial number is one of the known dummy values, it should probably be set to 0.
  Detailed Timing Descriptor #1: Image size is 255x255 mm, but based on the picture AR it should be 255x153 mm.
Block 1, CTA-861 Extension Block:
  IT Video Formats are overscanned by default, but normally this should be underscanned.
  Display Product Serial Number is set, so the Serial Number in the Base EDID should be 0.

Failures:

Block 0, Base EDID:
  Basic Display Parameters & Features: sRGB is signaled, but the chromaticities do not match.
Block 1, CTA-861 Extension Block:
  Audio Data Block: Bit F27 must be 0.
  Dummy Descriptor: Dummy block filled with garbage.
  Dummy Descriptor: Dummy block filled with garbage.
  Dummy Descriptor: Dummy block filled with garbage.
  Dummy Descriptor: Dummy block filled with garbage.
  Dummy Descriptor: Dummy block filled with garbage.
  Missing VCDB, needed for Set Selectable RGB Quantization to avoid interop issues.
EDID:
  Extension Block 2 started with EDID header, ignoring Extension Blocks >= 2.

EDID conformity: FAIL
