edid-decode (hex):

00 ff ff ff ff ff ff 00 30 e4 5e 06 00 00 00 00
00 1d 01 04 b5 25 17 78 07 ee 95 a3 54 4c 99 26
0f 50 54 00 00 00 01 01 01 01 01 01 01 01 01 01
01 01 01 01 01 01 f0 68 00 a0 a0 40 2e 60 30 20
36 00 6e e5 10 00 00 1a f3 53 00 a0 a0 40 2e 60
30 20 36 00 6e e5 10 00 00 1a 00 00 00 fe 00 36
4d 57 50 47 80 31 37 30 57 51 31 0a 00 00 00 00
00 03 41 31 9e 01 11 00 00 0b 01 0a 20 20 00 0f

----------------

Block 0, Base EDID:
  EDID Structure Version & Revision: 1.4
  Vendor & Product Identification:
    Manufacturer: LGD
    Model: 1630
    Made in: 2019
  Basic Display Parameters & Features:
    Digital display
    Bits per primary color channel: 10
    DisplayPort interface
    Maximum image size: 37 cm x 23 cm
    Gamma: 2.20
    Supported color formats: RGB 4:4:4
    Default (sRGB) color space is primary color space
    First detailed timing includes the native pixel format and preferred refresh rate
    Display supports continuous frequencies
  Color Characteristics:
    Red  : 0.6396, 0.3300
    Green: 0.2998, 0.5996
    Blue : 0.1503, 0.0595
    White: 0.3134, 0.3291
  Established Timings I & II: none
  Standard Timings: none
  Detailed Timing Descriptors:
    DTD 1:  2560x1600   60.002859 Hz  16:10    98.765 kHz    268.640000 MHz (366 mm x 229 mm)
                 Hfront   48 Hsync  32 Hback   80 Hpol P
                 Vfront    3 Vsync   6 Vback   37 Vpol N
    DTD 2:  2560x1600   48.001840 Hz  16:10    79.011 kHz    214.910000 MHz (366 mm x 229 mm)
                 Hfront   48 Hsync  32 Hback   80 Hpol P
                 Vfront    3 Vsync   6 Vback   37 Vpol N
    Alphanumeric Data String: '6MWPG.170WQ1'
    Manufacturer-Specified Display Descriptor (0x00): 00 00 00 03 41 31 9e 01 11 00 00 0b 01 0a 20 20 '....A1........  '
Checksum: 0x0f

----------------

Warnings:

Block 0, Base EDID:
  Alphanumeric Data String: Non-ASCII character 0x80 at position 5, can cause problems.
  Missing Display Product Name.

Failures:

Block 0, Base EDID:
  Basic Display Parameters & Features: sRGB is signaled, but the chromaticities do not match.
  Missing Display Range Limits Descriptor.

EDID conformity: FAIL
