edid-decode (hex):

00 ff ff ff ff ff ff 00 34 a9 a2 96 00 11 a1 05
ff 1a 01 04 a5 1d 13 78 03 ee 91 a3 54 4c 99 26
0f 50 54 00 00 00 01 01 01 01 01 01 01 01 01 01
01 01 01 01 01 01 80 a2 b8 68 b1 d0 40 70 08 08
88 00 1d be 10 00 00 1e 00 00 00 fd 00 2e 3c 5e
7c 2a 01 0a 20 20 20 20 20 20 00 00 00 fc 00 54
44 4d 31 33 4f 35 36 20 20 20 20 0a 00 00 00 10
00 00 00 00 00 00 00 00 00 00 00 00 00 00 00 a5

----------------

Block 0, Base EDID:
  EDID Structure Version & Revision: 1.4
  Vendor & Product Identification:
    Manufacturer: MEI
    Model: 38562
    Serial Number: ...
    Model year: 2016
  Basic Display Parameters & Features:
    Digital display
    Bits per primary color channel: 8
    DisplayPort interface
    Maximum image size: 29 cm x 19 cm
    Gamma: 2.20
    Supported color formats: RGB 4:4:4
    First detailed timing includes the native pixel format and preferred refresh rate
    Display supports continuous frequencies
  Color Characteristics:
    Red  : 0.6396, 0.3300
    Green: 0.2998, 0.5996
    Blue : 0.1503, 0.0595
    White: 0.3125, 0.3291
  Established Timings I & II: none
  Standard Timings: none
  Detailed Timing Descriptors:
    DTD 1:  3000x2000   59.985234 Hz   3:2    123.810 kHz    416.000000 MHz (285 mm x 190 mm)
                 Hfront    8 Hsync   8 Hback  344 Hpol P
                 Vfront    8 Vsync   8 Vback   48 Vpol P
    Display Range Limits:
      Monitor ranges (Range Limits Only): 46-60 Hz V, 94-124 kHz H, max dotclock 420 MHz
    Display Product Name: 'TDM13O56    '
    Dummy Descriptor:
Checksum: 0xa5

----------------

Failures:

Block 0, Base EDID:
  Basic Display Parameters & Features: The chromaticities match sRGB, but sRGB is not signaled.
  Display Product Name: One or more trailing spaces before newline.

EDID conformity: FAIL
