edid-decode (hex):

00 ff ff ff ff ff ff 00 34 a9 a2 96 00 08 21 31
ff 19 01 04 a5 1d 13 78 03 ee 91 a3 54 4c 99 26
0f 50 54 00 00 00 01 01 01 01 01 01 01 01 01 01
01 01 01 01 01 01 80 a2 b8 68 b1 d0 40 70 08 08
88 00 1d be 10 00 00 1e 00 00 00 fd 00 2e 3c 5e
7c 2a 01 0a 20 20 20 20 20 20 00 00 00 fc 00 56
56 58 31 34 50 30 34 38 4d 30 30 0a 00 00 00 10
00 00 00 00 00 00 00 00 00 00 00 00 00 00 00 84

00 ff ff ff ff ff ff 00 34 a9 a2 96 00 08 21 31
ff 19 01 04 a5 1d 13 78 03 ee 91 a3 54 4c 99 26
0f 50 54 00 00 00 01 01 01 01 01 01 01 01 01 01
01 01 01 01 01 01 80 a2 b8 68 b1 d0 40 70 08 08
88 00 1d be 10 00 00 1e 00 00 00 fd 00 2e 3c 5e
7c 2a 01 0a 20 20 20 20 20 20 00 00 00 fc 00 56
56 58 31 34 50 30 34 38 4d 30 30 0a 00 00 00 10
00 00 00 00 00 00 00 00 00 00 00 00 00 00 00 84

----------------

Block 0, Base EDID:
  EDID Structure Version & Revision: 1.4
  Vendor & Product Identification:
    Manufacturer: MEI
    Model: 38562
    Serial Number: ...
    Model year: 2015
  Basic Display Parameters & Features:
    Digital display
    Bits per primary color channel: 8
    DisplayPort interface
    Maximum image size: 29 cm x 19 cm
    Gamma: 2.20
    Supported color formats: RGB 4:4:4
    First detailed timing includes the native pixel format and preferred refresh rate
    Display supports continuous frequencies
  Color Characteristics:
    Red  : 0.6396, 0.3300
    Green: 0.2998, 0.5996
    Blue : 0.1503, 0.0595
    White: 0.3125, 0.3291
  Established Timings I & II: none
  Standard Timings: none
  Detailed Timing Descriptors:
    DTD 1:  3000x2000   59.985234 Hz   3:2    123.810 kHz    416.000000 MHz (285 mm x 190 mm)
                 Hfront    8 Hsync   8 Hback  344 Hpol P
                 Vfront    8 Vsync   8 Vback   48 Vpol P
    Display Range Limits:
      Monitor ranges (Range Limits Only): 46-60 Hz V, 94-124 kHz H, max dotclock 420 MHz
    Display Product Name: 'VVX14P048M00'
    Dummy Descriptor:
Checksum: 0x84

----------------

Block 1, Unknown EDID Extension Block 0x00:
  00 ff ff ff ff ff ff 00 34 a9 a2 96 00 08 21 31 '........4.....!1'
  ff 19 01 04 a5 1d 13 78 03 ee 91 a3 54 4c 99 26 '.......x....TL.&'
  0f 50 54 00 00 00 01 01 01 01 01 01 01 01 01 01 '.PT.............'
  01 01 01 01 01 01 80 a2 b8 68 b1 d0 40 70 08 08 '.........h..@p..'
  88 00 1d be 10 00 00 1e 00 00 00 fd 00 2e 3c 5e '..............<^'
  7c 2a 01 0a 20 20 20 20 20 20 00 00 00 fc 00 56 '|*..      .....V'
  56 58 31 34 50 30 34 38 4d 30 30 0a 00 00 00 10 'VX14P048M00.....'
  00 00 00 00 00 00 00 00 00 00 00 00 00 00 00 84 '................'
Checksum: 0x84

----------------

Failures:

Block 0, Base EDID:
  Basic Display Parameters & Features: The chromaticities match sRGB, but sRGB is not signaled.
Block 1, Base EDID:
  Unknown Extension Block.
EDID:
  Base EDID: EDID specified 0 extension block(s), but found 1 extension block(s).

EDID conformity: FAIL
