edid-decode (hex):

00 ff ff ff ff ff ff 00 0d ae 78 17 00 00 00 00
1e 1f 01 04 a5 26 15 78 03 ee 95 a3 54 4c 99 26
0f 50 54 00 00 00 01 01 01 01 01 01 01 01 01 01
01 01 01 01 01 01 b0 6d 80 a0 70 38 2d 40 30 20
a6 00 7d d6 10 00 00 1a 00 00 00 10 00 00 00 00
00 00 00 00 00 00 00 00 00 00 00 00 00 fe 00 33
48 52 4d 31 80 31 37 33 48 4d 45 0a 00 00 00 00
00 02 41 0f a8 00 00 00 00 0f 41 0a 20 20 01 25

70 20 79 02 00 22 00 28 80 23 11 84 7f 07 9f 00
2f 00 1f 00 37 04 2c 00 09 00 05 00 80 23 11 04
7f 07 9f 00 2f 00 1f 00 37 04 91 04 09 00 05 00
25 01 09 80 23 11 80 23 11 78 e0 81 81 00 13 72
1a 00 00 03 01 78 f0 00 00 00 00 00 00 e0 01 00
00 00 00 00 00 00 00 00 00 00 00 00 00 00 00 00
00 00 00 00 00 00 00 00 00 00 00 00 00 00 00 00
00 00 00 00 00 00 00 00 00 00 00 00 00 00 15 90

00 ff ff ff ff ff ff 00 0d ae 78 17 00 00 00 00
1e 1f 01 04 a5 26 15 78 03 ee 95 a3 54 4c 99 26
0f 50 54 00 00 00 01 01 01 01 01 01 01 01 01 01
01 01 01 01 01 01 b0 6d 80 a0 70 38 2d 40 30 20
a6 00 7d d6 10 00 00 1a 00 00 00 10 00 00 00 00
00 00 00 00 00 00 00 00 00 00 00 00 00 fe 00 33
48 52 4d 31 80 31 37 33 48 4d 45 0a 00 00 00 00
00 02 41 0f a8 00 00 00 00 0f 41 0a 20 20 01 25

70 20 79 02 00 22 00 28 80 23 11 84 7f 07 9f 00
2f 00 1f 00 37 04 2c 00 09 00 05 00 80 23 11 04
7f 07 9f 00 2f 00 1f 00 37 04 91 04 09 00 05 00
25 01 09 80 23 11 80 23 11 78 e0 81 81 00 13 72
1a 00 00 03 01 78 f0 00 00 00 00 00 00 e0 01 00
00 00 00 00 00 00 00 00 00 00 00 00 00 00 00 00
00 00 00 00 00 00 00 00 00 00 00 00 00 00 00 00
00 00 00 00 00 00 00 00 00 00 00 00 00 00 15 90

----------------

Block 0, Base EDID:
  EDID Structure Version & Revision: 1.4
  Vendor & Product Identification:
    Manufacturer: CMN
    Model: 6008
    Made in: week 30 of 2021
  Basic Display Parameters & Features:
    Digital display
    Bits per primary color channel: 8
    DisplayPort interface
    Maximum image size: 38 cm x 21 cm
    Gamma: 2.20
    Supported color formats: RGB 4:4:4
    First detailed timing includes the native pixel format and preferred refresh rate
    Display supports continuous frequencies
  Color Characteristics:
    Red  : 0.6396, 0.3300
    Green: 0.2998, 0.5996
    Blue : 0.1503, 0.0595
    White: 0.3134, 0.3291
  Established Timings I & II: none
  Standard Timings: none
  Detailed Timing Descriptors:
    DTD 1:  1920x1080  120.000000 Hz  16:9    135.000 kHz    280.800000 MHz (381 mm x 214 mm)
                 Hfront   48 Hsync  32 Hback   80 Hpol P
                 Vfront   10 Vsync   6 Vback   29 Vpol N
    Dummy Descriptor:
    Alphanumeric Data String: '3HRM1.173HME'
    Manufacturer-Specified Display Descriptor (0x00): 00 00 00 02 41 0f a8 00 00 00 00 0f 41 0a 20 20 '....A.......A.  '
  Extension blocks: 1
Checksum: 0x25

----------------

Block 1, DisplayID Extension Block:
  Version: 2.0
  Extension Count: 0
  Display Product Primary Use Case: None of the listed primary use cases; generic display
  Video Timing Modes Type 7 - Detailed Timings Data Block:
    DTD:  1920x1080  480.000427 Hz  16:9    540.000 kHz   1123.201000 MHz (aspect 16:9, no 3D stereo, preferred)
               Hfront   48 Hsync  32 Hback   80 Hpol N
               Vfront   10 Vsync   6 Vback   29 Vpol N
    DTD:  1920x1080  240.000214 Hz  16:9    540.000 kHz   1123.201000 MHz (aspect 16:9, no 3D stereo)
               Hfront   48 Hsync  32 Hback   80 Hpol N
               Vfront   10 Vsync   6 Vback 1154 Vpol N
  Dynamic Video Timing Range Limits Data Block:
    Minimum Pixel Clock: 1123201 kHz
    Maximum Pixel Clock: 1123201 kHz
    Minimum Vertical Refresh Rate: 120 Hz
    Maximum Vertical Refresh Rate: 480 Hz
    Seamless Dynamic Video Timing Support: Yes
  CTA-861 DisplayID Data Block:
  Vendor-Specific Data Block (AMD), OUI 00-00-1A:
    Version: 3
    Feature Caps: 0x01
    Minimum Refresh Rate: 120 Hz
    Maximum Refresh Rate: 480 Hz
    Flags 1.x: 0x00
    Flags 2.x: 0x00
  Checksum: 0x15
Checksum: 0x90

----------------

Warnings:

Block 0, Base EDID:
  Alphanumeric Data String: Non-ASCII character 0x80 at position 5, can cause problems.
  Missing Display Product Name.

Failures:

Block 0, Base EDID:
  Missing Display Range Limits Descriptor.
EDID:
  Extension Block 2 started with EDID header, ignoring Extension Blocks >= 2.
  DisplayID: Missing DisplayID Display Parameters Data Block.

EDID conformity: FAIL
