edid-decode (hex):

00 ff ff ff ff ff ff 00 4c 2d bb 03 00 00 00 00
2f 13 01 03 08 58 32 78 0b ee 91 a3 54 4c 99 26
0f 50 54 a9 08 00 81 c0 01 01 01 01 01 01 01 01
01 01 01 01 01 01 a9 1a 00 a0 50 00 16 30 30 20
37 00 13 8e 21 00 00 1a 66 21 50 b0 51 00 1b 30
40 70 36 00 75 f2 31 00 00 1e 00 00 00 fd 00 32
47 1e 51 0d 00 0a 20 20 20 20 20 20 00 00 00 fc
00 48 69 6b 65 65 6e 0a 20 20 20 20 20 20 00 4f

00 ff ff ff ff ff ff 00 4c 2d bb 03 00 00 00 00
2f 13 01 03 08 58 32 78 0b ee 91 a3 54 4c 99 26
0f 50 54 a9 08 00 81 c0 01 01 01 01 01 01 01 01
01 01 01 01 01 01 a9 1a 00 a0 50 00 16 30 30 20
37 00 13 8e 21 00 00 1a 66 21 50 b0 51 00 1b 30
40 70 36 00 75 f2 31 00 00 1e 00 00 00 fd 00 32
47 1e 51 0d 00 0a 20 20 20 20 20 20 00 00 00 fc
00 48 69 6b 65 65 6e 0a 20 20 20 20 20 20 00 4f

----------------

Block 0, Base EDID:
  EDID Structure Version & Revision: 1.3
  Vendor & Product Identification:
    Manufacturer: SAM
    Model: 955
    Made in: week 47 of 2009
  Basic Display Parameters & Features:
    Analog display
    Signal Level Standard: 0.700 : 0.300 : 1.000 V p-p
    Blank level equals black level
    Sync: Separate
    Maximum image size: 88 cm x 50 cm
    Gamma: 2.20
    RGB color display
    First detailed timing is the preferred timing
    Supports GTF timings within operating range
  Color Characteristics:
    Red  : 0.6396, 0.3300
    Green: 0.2998, 0.5996
    Blue : 0.1503, 0.0595
    White: 0.3125, 0.3291
  Established Timings I & II:
    IBM     :   720x400    70.081663 Hz   9:5     31.467 kHz     28.320000 MHz
    DMT 0x04:   640x480    59.940476 Hz   4:3     31.469 kHz     25.175000 MHz
    DMT 0x05:   640x480    72.808802 Hz   4:3     37.861 kHz     31.500000 MHz
    DMT 0x09:   800x600    60.316541 Hz   4:3     37.879 kHz     40.000000 MHz
    DMT 0x10:  1024x768    60.003840 Hz   4:3     48.363 kHz     65.000000 MHz
  Standard Timings:
    DMT 0x55:  1280x720    60.000000 Hz  16:9     45.000 kHz     74.250000 MHz
  Detailed Timing Descriptors:
    DTD 1:  1280x768    59.994726 Hz   5:3     47.396 kHz     68.250000 MHz (531 mm x 398 mm)
                 Hfront   48 Hsync  32 Hback   80 Hpol P
                 Vfront    3 Vsync   7 Vback   12 Vpol N
    DTD 2:  1360x768    60.015162 Hz  85:48    47.712 kHz     85.500000 MHz (885 mm x 498 mm)
                 Hfront   64 Hsync 112 Hback  256 Hpol P
                 Vfront    3 Vsync   6 Vback   18 Vpol P
    Display Range Limits:
      Monitor ranges (GTF): 50-71 Hz V, 30-81 kHz H, max dotclock 130 MHz
    Display Product Name: 'Hikeen'
Checksum: 0x4f

----------------

Block 1, Unknown EDID Extension Block 0x00:
  00 ff ff ff ff ff ff 00 4c 2d bb 03 00 00 00 00 '........L-......'
  2f 13 01 03 08 58 32 78 0b ee 91 a3 54 4c 99 26 '/....X2x....TL.&'
  0f 50 54 a9 08 00 81 c0 01 01 01 01 01 01 01 01 '.PT.............'
  01 01 01 01 01 01 a9 1a 00 a0 50 00 16 30 30 20 '..........P..00 '
  37 00 13 8e 21 00 00 1a 66 21 50 b0 51 00 1b 30 '7...!...f!P.Q..0'
  40 70 36 00 75 f2 31 00 00 1e 00 00 00 fd 00 32 '@p6.u.1........2'
  47 1e 51 0d 00 0a 20 20 20 20 20 20 00 00 00 fc 'G.Q...      ....'
  00 48 69 6b 65 65 6e 0a 20 20 20 20 20 20 00 4f '.Hikeen.      .O'
Checksum: 0x4f

----------------

Warnings:

Block 0, Base EDID:
  Detailed Timing Descriptor #1: Image size is 531x398 mm, but based on the picture AR it should be 531x318 mm.
EDID:
  Base EDID: Some timings are out of range of the Monitor Ranges:
    Vertical Freq: 59.940 - 72.809 Hz (Monitor: 50.000 - 71.000 Hz)

Failures:

Block 0, Base EDID:
  Basic Display Parameters & Features: The chromaticities match sRGB, but sRGB is not signaled.
  Detailed Timing Descriptor #1: Mismatch of image size 531x398 mm vs display size 880x500 mm.
Block 1, Base EDID:
  Unknown Extension Block.
EDID:
  Base EDID: EDID specified 0 extension block(s), but found 1 extension block(s).

EDID conformity: FAIL
