edid-decode (hex):

00 ff ff ff ff ff ff 00 06 af 14 91 00 00 00 00
01 12 01 03 80 1a 10 78 0a 87 b5 94 57 53 90 26
1e 50 54 00 00 00 01 01 01 01 01 01 01 01 01 01
01 01 01 01 01 01 12 1b 00 62 50 20 0a 30 18 0e
24 00 05 a3 10 00 00 18 00 00 00 0f 00 00 00 00
00 00 00 00 00 00 00 00 00 20 00 00 00 fe 00 41
55 4f 0a 20 20 20 20 20 20 20 20 20 00 00 00 fe
00 42 31 32 31 45 57 30 39 20 56 31 20 0a 00 2e

00 ff ff ff ff ff ff 00 06 af 14 91 00 00 00 00
01 12 01 03 80 1a 10 78 0a 87 b5 94 57 53 90 26
1e 50 54 00 00 00 01 01 01 01 01 01 01 01 01 01
01 01 01 01 01 01 12 1b 00 62 50 20 0a 30 18 0e
24 00 05 a3 10 00 00 18 00 00 00 0f 00 00 00 00
00 00 00 00 00 00 00 00 00 20 00 00 00 fe 00 41
55 4f 0a 20 20 20 20 20 20 20 20 20 00 00 00 fe
00 42 31 32 31 45 57 30 39 20 56 31 20 0a 00 2e

----------------

Block 0, Base EDID:
  EDID Structure Version & Revision: 1.3
  Vendor & Product Identification:
    Manufacturer: AUO
    Model: 37140
    Made in: week 1 of 2008
  Basic Display Parameters & Features:
    Digital display
    Maximum image size: 26 cm x 16 cm
    Gamma: 2.20
    RGB color display
    First detailed timing is the preferred timing
  Color Characteristics:
    Red  : 0.5800, 0.3398
    Green: 0.3251, 0.5654
    Blue : 0.1503, 0.1201
    White: 0.3134, 0.3291
  Established Timings I & II: none
  Standard Timings: none
  Detailed Timing Descriptors:
    DTD 1:  1280x800    62.086760 Hz  16:10    50.290 kHz     69.300000 MHz (261 mm x 163 mm)
                 Hfront   24 Hsync  14 Hback   60 Hpol N
                 Vfront    2 Vsync   4 Vback    4 Vpol N
    Manufacturer-Specified Display Descriptor (0x0f): 00 0f 00 00 00 00 00 00 00 00 00 00 00 00 00 20 '............... '
    Alphanumeric Data String: 'AUO'
    Alphanumeric Data String: 'B121EW09 V1 '
Checksum: 0x2e

----------------

Block 1, Unknown EDID Extension Block 0x00:
  00 ff ff ff ff ff ff 00 06 af 14 91 00 00 00 00 '................'
  01 12 01 03 80 1a 10 78 0a 87 b5 94 57 53 90 26 '.......x....WS.&'
  1e 50 54 00 00 00 01 01 01 01 01 01 01 01 01 01 '.PT.............'
  01 01 01 01 01 01 12 1b 00 62 50 20 0a 30 18 0e '.........bP .0..'
  24 00 05 a3 10 00 00 18 00 00 00 0f 00 00 00 00 '$...............'
  00 00 00 00 00 00 00 00 00 20 00 00 00 fe 00 41 '......... .....A'
  55 4f 0a 20 20 20 20 20 20 20 20 20 00 00 00 fe 'UO.         ....'
  00 42 31 32 31 45 57 30 39 20 56 31 20 0a 00 2e '.B121EW09 V1 ...'
Checksum: 0x2e

----------------

Failures:

Block 0, Base EDID:
  Alphanumeric Data String: One or more trailing spaces before newline.
  Missing Display Product Name.
  Missing Display Range Limits Descriptor.
Block 1, Base EDID:
  Unknown Extension Block.
EDID:
  Base EDID: EDID specified 0 extension block(s), but found 1 extension block(s).

EDID conformity: FAIL
