edid-decode (hex):

00 ff ff ff ff ff ff 00 09 e5 24 09 00 00 00 00
0b 1e 01 04 95 1d 11 78 02 c4 75 97 5e 59 95 29
20 50 54 00 00 00 01 01 01 01 01 01 01 01 01 01
01 01 01 01 01 01 c0 39 80 18 71 38 28 40 30 20
36 00 26 a5 10 00 00 1a 34 2e 80 18 71 38 28 40
30 20 36 00 26 a5 10 00 00 1a 00 00 00 fe 00 32
37 48 50 35 80 4e 56 31 33 4e 34 41 00 00 00 00
00 00 41 20 99 00 10 00 00 0a 01 0a 20 20 00 e6

----------------

Block 0, Base EDID:
  EDID Structure Version & Revision: 1.4
  Vendor & Product Identification:
    Manufacturer: BOE
    Model: 2340
    Made in: week 11 of 2020
  Basic Display Parameters & Features:
    Digital display
    Bits per primary color channel: 6
    DisplayPort interface
    Maximum image size: 29 cm x 17 cm
    Gamma: 2.20
    Supported color formats: RGB 4:4:4
    First detailed timing includes the native pixel format and preferred refresh rate
  Color Characteristics:
    Red  : 0.5927, 0.3671
    Green: 0.3486, 0.5820
    Blue : 0.1611, 0.1279
    White: 0.3134, 0.3291
  Established Timings I & II: none
  Standard Timings: none
  Detailed Timing Descriptors:
    DTD 1:  1920x1080   60.000000 Hz  16:9     67.200 kHz    147.840000 MHz (294 mm x 165 mm)
                 Hfront   48 Hsync  32 Hback  200 Hpol P
                 Vfront    3 Vsync   6 Vback   31 Vpol N
    DTD 2:  1920x1080   48.003247 Hz  16:9     53.764 kHz    118.280000 MHz (294 mm x 165 mm)
                 Hfront   48 Hsync  32 Hback  200 Hpol P
                 Vfront    3 Vsync   6 Vback   31 Vpol N
    Alphanumeric Data String: '27HP5.NV13N4A'
    Manufacturer-Specified Display Descriptor (0x00): 00 00 00 00 41 20 99 00 10 00 00 0a 01 0a 20 20 '....A ........  '
Checksum: 0xe6

----------------

Warnings:

Block 0, Base EDID:
  Alphanumeric Data String: Non-ASCII character 0x80 at position 5, can cause problems.
  Missing Display Product Name.

EDID conformity: PASS
