edid-decode (hex):

00 ff ff ff ff ff ff 00 30 ae 98 e2 01 00 00 00
27 1d 01 04 a0 30 1a 78 e6 e8 60 a5 57 51 9e 27
0f 50 54 00 00 00 01 01 01 01 01 01 01 01 01 01
01 01 01 01 01 01 02 3a 80 18 71 38 2d 40 58 2c
45 00 dc 0c 11 00 00 1e 00 00 00 fc 00 4c 45 4e
2d 56 33 56 35 2d 43 2d 41 0a 00 00 00 fd 00 39
3e 53 53 10 00 0a 20 20 20 20 20 20 00 00 00 fe
00 4d 56 32 31 35 46 48 4d 2d 4e 34 30 0a 00 40

----------------

Block 0, Base EDID:
  EDID Structure Version & Revision: 1.4
  Vendor & Product Identification:
    Manufacturer: LEN
    Model: 58008
    Serial Number: ...
    Made in: week 39 of 2019
  Basic Display Parameters & Features:
    Digital display
    Bits per primary color channel: 8
    Digital interface is not defined
    Maximum image size: 48 cm x 26 cm
    Gamma: 2.20
    DPMS levels: Standby Suspend Off
    Supported color formats: RGB 4:4:4
    Default (sRGB) color space is primary color space
    First detailed timing includes the native pixel format and preferred refresh rate
  Color Characteristics:
    Red  : 0.6474, 0.3417
    Green: 0.3183, 0.6171
    Blue : 0.1533, 0.0605
    White: 0.3125, 0.3281
  Established Timings I & II: none
  Standard Timings: none
  Detailed Timing Descriptors:
    DTD 1:  1920x1080   60.000000 Hz  16:9     67.500 kHz    148.500000 MHz (476 mm x 268 mm)
                 Hfront   88 Hsync  44 Hback  148 Hpol P
                 Vfront    4 Vsync   5 Vback   36 Vpol P
    Display Product Name: 'LEN-V3V5-C-A'
    Display Range Limits:
      Monitor ranges (GTF): 57-62 Hz V, 83-83 kHz H, max dotclock 160 MHz
    Alphanumeric Data String: 'MV215FHM-N40'
Checksum: 0x40

----------------

Warnings:

Block 0, Base EDID:
  Vendor & Product Identification: The serial number is one of the known dummy values, it should probably be set to 0.
  Display Range Limits: GTF support is deprecated in EDID 1.4.
EDID:
  Base EDID: Some timings are out of range of the Monitor Ranges:
    Horizontal Freq: 67.500 - 67.500 kHz (Monitor: 83.000 - 83.000 kHz)

Failures:

Block 0, Base EDID:
  Basic Display Parameters & Features: sRGB is signaled, but the chromaticities do not match.
  Display Range Limits: GTF is supported, but the display does not support continuous frequencies.

EDID conformity: FAIL
