edid-decode (hex):

00 ff ff ff ff ff ff 00 11 ee 27 00 01 01 01 01
00 15 01 03 80 46 27 78 0a e6 92 a3 54 4a 99 26
0f 4a 4c 21 08 00 8b c0 81 80 a9 40 01 01 01 01
01 01 01 01 01 01 02 3a 80 18 71 38 2d 40 58 2c
45 00 00 d0 52 00 00 1e 02 3a 80 d0 72 38 2d 40
10 2c 45 80 00 d0 52 00 00 1e 00 00 00 fc 00 44
45 4e 4f 4e 2d 41 56 41 4d 50 0a 20 00 00 00 fd
00 30 3e 0f 46 11 00 0a 20 20 20 20 20 20 01 20

02 03 4b f1 5a 90 1f 20 22 21 05 14 04 13 12 03
11 02 16 07 15 06 01 0e 23 0f 24 1d 25 1e 26 32
0f 7f 07 3d 1e c0 15 07 50 5f 7e 01 57 06 00 67
7e 00 83 5f 00 00 e3 05 03 01 70 03 0c 00 11 00
b8 2d a0 2e 2e d0 04 01 40 01 ff 01 1d 80 3e 73
38 2d 40 7e 2c 45 80 00 d0 52 00 00 1e 01 1d 80
d0 72 1c 16 20 10 2c 25 80 00 d0 52 00 00 9e 00
00 00 00 00 00 00 00 00 00 00 00 00 00 00 00 a0

----------------

Block 0, Base EDID:
  EDID Structure Version & Revision: 1.3
  Vendor & Product Identification:
    Manufacturer: DON
    Model: 39
    Serial Number: ...
    Made in: 2011
  Basic Display Parameters & Features:
    Digital display
    Maximum image size: 70 cm x 39 cm
    Gamma: 2.20
    RGB color display
    First detailed timing is the preferred timing
  Color Characteristics:
    Red  : 0.6396, 0.3300
    Green: 0.2900, 0.5996
    Blue : 0.1503, 0.0595
    White: 0.2890, 0.2988
  Established Timings I & II:
    DMT 0x04:   640x480    59.940476 Hz   4:3     31.469 kHz     25.175000 MHz
    DMT 0x09:   800x600    60.316541 Hz   4:3     37.879 kHz     40.000000 MHz
    DMT 0x10:  1024x768    60.003840 Hz   4:3     48.363 kHz     65.000000 MHz
  Standard Timings:
    GTF     :  1360x765    60.000341 Hz  16:9     47.520 kHz     84.396000 MHz
    DMT 0x23:  1280x1024   60.019740 Hz   5:4     63.981 kHz    108.000000 MHz
    DMT 0x33:  1600x1200   60.000000 Hz   4:3     75.000 kHz    162.000000 MHz
  Detailed Timing Descriptors:
    DTD 1:  1920x1080   60.000000 Hz  16:9     67.500 kHz    148.500000 MHz (1280 mm x 720 mm)
                 Hfront   88 Hsync  44 Hback  148 Hpol P
                 Vfront    4 Vsync   5 Vback   36 Vpol P
    DTD 2:  1920x1080   50.000000 Hz  16:9     56.250 kHz    148.500000 MHz (1280 mm x 720 mm)
                 Hfront  528 Hsync  44 Hback  148 Hpol P
                 Vfront    4 Vsync   5 Vback   36 Vpol P
    Display Product Name: 'DENON-AVAMP'
    Display Range Limits:
      Monitor ranges (GTF): 48-62 Hz V, 15-70 kHz H, max dotclock 170 MHz
  Extension blocks: 1
Checksum: 0x20

----------------

Block 1, CTA-861 Extension Block:
  Revision: 3
  Underscans IT Video Formats by default
  Basic audio support
  Supports YCbCr 4:4:4
  Supports YCbCr 4:2:2
  Native DTDs: 1
  Video Data Block:
    VIC  16:  1920x1080   60.000000 Hz  16:9     67.500 kHz    148.500000 MHz (native)
    VIC  31:  1920x1080   50.000000 Hz  16:9     56.250 kHz    148.500000 MHz
    VIC  32:  1920x1080   24.000000 Hz  16:9     27.000 kHz     74.250000 MHz
    VIC  34:  1920x1080   30.000000 Hz  16:9     33.750 kHz     74.250000 MHz
    VIC  33:  1920x1080   25.000000 Hz  16:9     28.125 kHz     74.250000 MHz
    VIC   5:  1920x1080i  60.000000 Hz  16:9     33.750 kHz     74.250000 MHz
    VIC  20:  1920x1080i  50.000000 Hz  16:9     28.125 kHz     74.250000 MHz
    VIC   4:  1280x720    60.000000 Hz  16:9     45.000 kHz     74.250000 MHz
    VIC  19:  1280x720    50.000000 Hz  16:9     37.500 kHz     74.250000 MHz
    VIC  18:   720x576    50.000000 Hz  16:9     31.250 kHz     27.000000 MHz
    VIC   3:   720x480    59.940060 Hz  16:9     31.469 kHz     27.000000 MHz
    VIC  17:   720x576    50.000000 Hz   4:3     31.250 kHz     27.000000 MHz
    VIC   2:   720x480    59.940060 Hz   4:3     31.469 kHz     27.000000 MHz
    VIC  22:  1440x576i   50.000000 Hz  16:9     15.625 kHz     27.000000 MHz
    VIC   7:  1440x480i   59.940060 Hz  16:9     15.734 kHz     27.000000 MHz
    VIC  21:  1440x576i   50.000000 Hz   4:3     15.625 kHz     27.000000 MHz
    VIC   6:  1440x480i   59.940060 Hz   4:3     15.734 kHz     27.000000 MHz
    VIC   1:   640x480    59.940476 Hz   4:3     31.469 kHz     25.175000 MHz
    VIC  14:  1440x480    59.940060 Hz   4:3     31.469 kHz     54.000000 MHz
    VIC  35:  2880x480    59.940060 Hz   4:3     31.469 kHz    108.000000 MHz
    VIC  15:  1440x480    59.940060 Hz  16:9     31.469 kHz     54.000000 MHz
    VIC  36:  2880x480    59.940060 Hz  16:9     31.469 kHz    108.000000 MHz
    VIC  29:  1440x576    50.000000 Hz   4:3     31.250 kHz     54.000000 MHz
    VIC  37:  2880x576    50.000000 Hz   4:3     31.250 kHz    108.000000 MHz
    VIC  30:  1440x576    50.000000 Hz  16:9     31.250 kHz     54.000000 MHz
    VIC  38:  2880x576    50.000000 Hz  16:9     31.250 kHz    108.000000 MHz
  Audio Data Block:
    Linear PCM:
      Max channels: 8
      Supported sample rates (kHz): 192 176.4 96 88.2 48 44.1 32
      Supported sample sizes (bits): 24 20 16
    DTS:
      Max channels: 6
      Supported sample rates (kHz): 96 88.2 48 44.1
      Maximum bit rate: 1536 kb/s
    AC-3:
      Max channels: 6
      Supported sample rates (kHz): 48 44.1 32
      Maximum bit rate: 640 kb/s
    DTS-HD:
      Max channels: 8
      Supported sample rates (kHz): 192 176.4 96 88.2 48 44.1
      Audio Format Code dependent value: 0x01
    Enhanced AC-3 (DD+):
      Max channels: 8
      Supported sample rates (kHz): 48 44.1
    MAT (MLP):
      Max channels: 8
      Supported sample rates (kHz): 192 176.4 96 88.2 48 44.1
      Supports only Dolby TrueHD
  Speaker Allocation Data Block:
    FL/FR - Front Left/Right
    LFE1 - Low Frequency Effects 1
    FC - Front Center
    LS/RS - Left/Right Surround
    BC - Back Center
    BL/BR - Back Left/Right
  Colorimetry Data Block:
    xvYCC601
    xvYCC709
    Gamut Boundary Description Metadata Profile P0
  Vendor-Specific Data Block (HDMI), OUI 00-0C-03:
    Source physical address: 1.1.0.0
    Supports_AI
    DC_36bit
    DC_30bit
    DC_Y444
    Maximum TMDS clock: 225 MHz
    Video latency: 90 ms
    Audio latency: 90 ms
    Extended HDMI video details:
      3D present
      3D-capable-VIC mask present
      Base EDID image size is in units of 1 cm
      3D: Side-by-side (half, horizontal)
      3D: Top-and-bottom
      3D VIC indices that support these capabilities:
        VIC  16:  1920x1080   60.000000 Hz  16:9     67.500 kHz    148.500000 MHz
        VIC  31:  1920x1080   50.000000 Hz  16:9     56.250 kHz    148.500000 MHz
        VIC  32:  1920x1080   24.000000 Hz  16:9     27.000 kHz     74.250000 MHz
        VIC  34:  1920x1080   30.000000 Hz  16:9     33.750 kHz     74.250000 MHz
        VIC  33:  1920x1080   25.000000 Hz  16:9     28.125 kHz     74.250000 MHz
        VIC   5:  1920x1080i  60.000000 Hz  16:9     33.750 kHz     74.250000 MHz
        VIC  20:  1920x1080i  50.000000 Hz  16:9     28.125 kHz     74.250000 MHz
        VIC   4:  1280x720    60.000000 Hz  16:9     45.000 kHz     74.250000 MHz
        VIC  19:  1280x720    50.000000 Hz  16:9     37.500 kHz     74.250000 MHz
  Detailed Timing Descriptors:
    DTD 3:  1920x1080   24.000000 Hz  16:9     27.000 kHz     74.250000 MHz (1280 mm x 720 mm)
                 Hfront  638 Hsync  44 Hback  148 Hpol P
                 Vfront    4 Vsync   5 Vback   36 Vpol P
    DTD 4:  1920x1080i  50.000000 Hz  16:9     28.125 kHz     74.250000 MHz (1280 mm x 720 mm)
                 Hfront  528 Hsync  44 Hback  148 Hpol P
                 Vfront    2 Vsync   5 Vback   15 Vpol P Vfront +0.5 Odd Field
                 Vfront    2 Vsync   5 Vback   15 Vpol P Vback  +0.5 Even Field
Checksum: 0xa0  Unused space in Extension Block: 16 bytes

----------------

Warnings:

Block 0, Base EDID:
  Vendor & Product Identification: The serial number is one of the known dummy values, it should probably be set to 0.
  Standard Timings: Standard Timing 1360x765 has a dubious odd vertical resolution.
Block 1, CTA-861 Extension Block:
  Colorimetry Data Block: Set the sRGB colorimetry bit to avoid interop issues.
EDID:
  Base EDID: Some timings are out of range of the Monitor Ranges:
    Vertical Freq: 24.000 - 60.317 Hz (Monitor: 48.000 - 62.000 Hz)
    Horizontal Freq: 15.625 - 75.000 kHz (Monitor: 15.000 - 70.000 kHz)

Failures:

Block 0, Base EDID:
  Detailed Timing Descriptor #1: Mismatch of image size 1280x720 mm vs display size 700x390 mm.
  Detailed Timing Descriptor #2: Mismatch of image size 1280x720 mm vs display size 700x390 mm.
Block 1, CTA-861 Extension Block:
  Detailed Timing Descriptor #3: Mismatch of image size 1280x720 mm vs display size 700x390 mm.
  Detailed Timing Descriptor #4: Mismatch of image size 1280x720 mm vs display size 700x390 mm.
  Missing VCDB, needed for Set Selectable RGB Quantization to avoid interop issues.
EDID:
  Base EDID: The DTD max image size is 1280x720mm, which is larger than the display size 700.0x390.0mm.

EDID conformity: FAIL
