edid-decode (hex):

00 ff ff ff ff ff ff 00 30 ae cc 60 01 01 01 01
1f 1a 01 03 6c 2f 1e 78 ee c5 45 a3 57 52 9f 27
0d 50 54 bd cf 00 71 4f 81 80 81 8c 95 00 95 0f
81 00 b3 0f 01 01 21 39 90 30 62 1a 27 40 68 b0
36 00 da 28 11 00 00 1c 00 00 00 fd 00 32 4b 1e
51 15 00 0a 20 20 20 20 20 20 00 00 00 fc 00 4c
45 4e 20 54 32 32 35 34 70 43 0a 20 00 00 00 ff
00 56 4e 2d 41 31 37 33 4c 35 0a 20 20 20 01 24

02 01 04 00 66 21 56 aa 51 00 1e 30 46 8f 33 00
da 28 11 00 00 1e 30 2a 40 c8 60 84 64 30 18 50
13 00 da 28 11 00 00 1e a9 1a 00 a0 50 00 16 30
30 20 37 00 da 28 11 00 00 1a 9a 29 a0 d0 51 84
22 30 50 98 36 00 da 28 11 00 00 1c 66 21 50 b0
51 00 1b 30 40 70 36 00 da 28 11 00 00 1e 00 00
00 00 00 00 00 00 00 00 00 00 00 00 00 00 00 00
00 00 00 00 00 00 00 00 00 00 00 00 00 00 00 86

00 ff ff ff ff ff ff 00 30 ae cc 60 01 01 01 01
1f 1a 01 03 6c 2f 1e 78 ee c5 45 a3 57 52 9f 27
0d 50 54 bd cf 00 71 4f 81 80 81 8c 95 00 95 0f
81 00 b3 0f 01 01 21 39 90 30 62 1a 27 40 68 b0
36 00 da 28 11 00 00 1c 00 00 00 fd 00 32 4b 1e
51 15 00 0a 20 20 20 20 20 20 00 00 00 fc 00 4c
45 4e 20 54 32 32 35 34 70 43 0a 20 00 00 00 ff
00 56 4e 2d 41 31 37 33 4c 35 0a 20 20 20 01 24

02 01 04 00 66 21 56 aa 51 00 1e 30 46 8f 33 00
da 28 11 00 00 1e 30 2a 40 c8 60 84 64 30 18 50
13 00 da 28 11 00 00 1e a9 1a 00 a0 50 00 16 30
30 20 37 00 da 28 11 00 00 1a 9a 29 a0 d0 51 84
22 30 50 98 36 00 da 28 11 00 00 1c 66 21 50 b0
51 00 1b 30 40 70 36 00 da 28 11 00 00 1e 00 00
00 00 00 00 00 00 00 00 00 00 00 00 00 00 00 00
00 00 00 00 00 00 00 00 00 00 00 00 00 00 00 86

----------------

Block 0, Base EDID:
  EDID Structure Version & Revision: 1.3
  Vendor & Product Identification:
    Manufacturer: LEN
    Model: 24780
    Serial Number: ...
    Made in: week 31 of 2016
  Basic Display Parameters & Features:
    Analog display
    Signal Level Standard: 0.700 : 0.000 : 0.700 V p-p
    Blank level equals black level
    Sync: Separate Composite
    Maximum image size: 47 cm x 30 cm
    Gamma: 2.20
    DPMS levels: Standby Suspend Off
    RGB color display
    Default (sRGB) color space is primary color space
    First detailed timing is the preferred timing
  Color Characteristics:
    Red  : 0.6396, 0.3398
    Green: 0.3212, 0.6220
    Blue : 0.1533, 0.0507
    White: 0.3134, 0.3291
  Established Timings I & II:
    IBM     :   720x400    70.081663 Hz   9:5     31.467 kHz     28.320000 MHz
    DMT 0x04:   640x480    59.940476 Hz   4:3     31.469 kHz     25.175000 MHz
    Apple   :   640x480    66.666667 Hz   4:3     35.000 kHz     30.240000 MHz
    DMT 0x05:   640x480    72.808802 Hz   4:3     37.861 kHz     31.500000 MHz
    DMT 0x06:   640x480    75.000000 Hz   4:3     37.500 kHz     31.500000 MHz
    DMT 0x09:   800x600    60.316541 Hz   4:3     37.879 kHz     40.000000 MHz
    DMT 0x0a:   800x600    72.187572 Hz   4:3     48.077 kHz     50.000000 MHz
    DMT 0x0b:   800x600    75.000000 Hz   4:3     46.875 kHz     49.500000 MHz
    DMT 0x10:  1024x768    60.003840 Hz   4:3     48.363 kHz     65.000000 MHz
    DMT 0x11:  1024x768    70.069359 Hz   4:3     56.476 kHz     75.000000 MHz
    DMT 0x12:  1024x768    75.028582 Hz   4:3     60.023 kHz     78.750000 MHz
    DMT 0x24:  1280x1024   75.024675 Hz   5:4     79.976 kHz    135.000000 MHz
  Standard Timings:
    DMT 0x15:  1152x864    75.000000 Hz   4:3     67.500 kHz    108.000000 MHz
    DMT 0x23:  1280x1024   60.019740 Hz   5:4     63.981 kHz    108.000000 MHz
    GTF     :  1280x1024   72.000069 Hz   5:4     76.824 kHz    132.752000 MHz
    DMT 0x2f:  1440x900    59.887445 Hz  16:10    55.935 kHz    106.500000 MHz
    DMT 0x30:  1440x900    74.984427 Hz  16:10    70.635 kHz    136.750000 MHz
    DMT 0x1c:  1280x800    59.810326 Hz  16:10    49.702 kHz     83.500000 MHz
    DMT 0x3b:  1680x1050   74.892027 Hz  16:10    82.306 kHz    187.000000 MHz
  Detailed Timing Descriptors:
    DTD  1:  1680x1050   59.954250 Hz  16:10    65.290 kHz    146.250000 MHz (474 mm x 296 mm)
                  Hfront  104 Hsync 176 Hback  280 Hpol N
                  Vfront    3 Vsync   6 Vback   30 Vpol P
    Display Range Limits:
      Monitor ranges (GTF): 50-75 Hz V, 30-81 kHz H, max dotclock 210 MHz
    Display Product Name: 'LEN T2254pC'
    Display Product Serial Number: ...
  Extension blocks: 1
Checksum: 0x24

----------------

Block 1, CTA-861 Extension Block:
  Revision: 1
  Detailed Timing Descriptors:
    DTD  2:  1366x768    59.789541 Hz 683:384   47.712 kHz     85.500000 MHz (474 mm x 296 mm)
                  Hfront   70 Hsync 143 Hback  213 Hpol P
                  Vfront    3 Vsync   3 Vback   24 Vpol P
    DTD  3:  1600x900    60.000000 Hz  16:9     60.000 kHz    108.000000 MHz (474 mm x 296 mm)
                  Hfront   24 Hsync  80 Hback   96 Hpol P
                  Vfront    1 Vsync   3 Vback   96 Vpol P
    DTD  4:  1280x768    59.994726 Hz   5:3     47.396 kHz     68.250000 MHz (474 mm x 296 mm)
                  Hfront   48 Hsync  32 Hback   80 Hpol P
                  Vfront    3 Vsync   7 Vback   12 Vpol N
    DTD  5:  1440x900    59.887445 Hz  16:10    55.935 kHz    106.500000 MHz (474 mm x 296 mm)
                  Hfront   80 Hsync 152 Hback  232 Hpol N
                  Vfront    3 Vsync   6 Vback   25 Vpol P
    DTD  6:  1360x768    60.015162 Hz  85:48    47.712 kHz     85.500000 MHz (474 mm x 296 mm)
                  Hfront   64 Hsync 112 Hback  256 Hpol P
                  Vfront    3 Vsync   6 Vback   18 Vpol P
Checksum: 0x86  Unused space in Extension Block: 33 bytes

----------------

Block 2, Unknown EDID Extension Block 0x00:
  00 ff ff ff ff ff ff 00 30 ae cc 60 01 01 01 01 '........0..`....'
  1f 1a 01 03 6c 2f 1e 78 ee c5 45 a3 57 52 9f 27 '....l/.x..E.WR.''
  0d 50 54 bd cf 00 71 4f 81 80 81 8c 95 00 95 0f '.PT...qO........'
  81 00 b3 0f 01 01 21 39 90 30 62 1a 27 40 68 b0 '......!9.0b.'@h.'
  36 00 da 28 11 00 00 1c 00 00 00 fd 00 32 4b 1e '6..(.........2K.'
  51 15 00 0a 20 20 20 20 20 20 00 00 00 fc 00 4c 'Q...      .....L'
  45 4e 20 54 32 32 35 34 70 43 0a 20 00 00 00 ff 'EN T2254pC. ....'
  00 56 4e 2d 41 31 37 33 4c 35 0a 20 20 20 01 24 '.VN-A173L5.   .$'
Checksum: 0x24

----------------

Block 3, CTA-861 Extension Block:
  Revision: 1
  Detailed Timing Descriptors:
    DTD  7:  1366x768    59.789541 Hz 683:384   47.712 kHz     85.500000 MHz (474 mm x 296 mm)
                  Hfront   70 Hsync 143 Hback  213 Hpol P
                  Vfront    3 Vsync   3 Vback   24 Vpol P
    DTD  8:  1600x900    60.000000 Hz  16:9     60.000 kHz    108.000000 MHz (474 mm x 296 mm)
                  Hfront   24 Hsync  80 Hback   96 Hpol P
                  Vfront    1 Vsync   3 Vback   96 Vpol P
    DTD  9:  1280x768    59.994726 Hz   5:3     47.396 kHz     68.250000 MHz (474 mm x 296 mm)
                  Hfront   48 Hsync  32 Hback   80 Hpol P
                  Vfront    3 Vsync   7 Vback   12 Vpol N
    DTD 10:  1440x900    59.887445 Hz  16:10    55.935 kHz    106.500000 MHz (474 mm x 296 mm)
                  Hfront   80 Hsync 152 Hback  232 Hpol N
                  Vfront    3 Vsync   6 Vback   25 Vpol P
    DTD 11:  1360x768    60.015162 Hz  85:48    47.712 kHz     85.500000 MHz (474 mm x 296 mm)
                  Hfront   64 Hsync 112 Hback  256 Hpol P
                  Vfront    3 Vsync   6 Vback   18 Vpol P
Checksum: 0x86  Unused space in Extension Block: 33 bytes

----------------

Warnings:

Block 0, Base EDID:
  Vendor & Product Identification: The serial number is one of the known dummy values, it should probably be set to 0.
Block 1, CTA-861 Extension Block:
  Detailed Timing Descriptor #2: Image size is 474x296 mm, but based on the picture AR it should be 474x266 mm.
  Detailed Timing Descriptor #3: Image size is 474x296 mm, but based on the picture AR it should be 474x266 mm.
  Detailed Timing Descriptor #4: Image size is 474x296 mm, but based on the picture AR it should be 474x284 mm.
  Detailed Timing Descriptor #6: Image size is 474x296 mm, but based on the picture AR it should be 474x267 mm.
  Display Product Serial Number is set, so the Serial Number in the Base EDID should be 0.
Block 3, CTA-861 Extension Block:
  Detailed Timing Descriptor #7: Image size is 474x296 mm, but based on the picture AR it should be 474x266 mm.
  Detailed Timing Descriptor #8: Image size is 474x296 mm, but based on the picture AR it should be 474x266 mm.
  Detailed Timing Descriptor #9: Image size is 474x296 mm, but based on the picture AR it should be 474x284 mm.
  Detailed Timing Descriptor #11: Image size is 474x296 mm, but based on the picture AR it should be 474x267 mm.
EDID:
  Base EDID: Some timings are out of range of the Monitor Ranges:
    Horizontal Freq: 31.466 - 82.306 kHz (Monitor: 30.000 - 81.000 kHz)

Failures:

Block 0, Base EDID:
  Basic Display Parameters & Features: sRGB is signaled, but the chromaticities do not match.
Block 1, CTA-861 Extension Block:
  Missing VCDB, needed for Set Selectable RGB Quantization to avoid interop issues.
Block 2, Base EDID:
  Unknown Extension Block.
EDID:
  Base EDID: EDID specified 1 extension block(s), but found 3 extension block(s).
  Base EDID: EDID 1.3 requires a Block Map Extension in Block 1 if there are more than 2 blocks in the EDID.

EDID conformity: FAIL
