edid-decode (hex):

00 ff ff ff ff ff ff 00 10 ac 37 40 4c 37 37 33
23 13 01 03 80 41 29 78 ea 8f 95 ad 4f 32 b2 25
0f 50 54 a5 4b 00 81 80 a9 40 71 4f 81 00 b3 00
01 01 01 01 01 01 28 3c 80 a0 70 b0 23 40 30 20
36 00 81 91 21 00 00 1a 00 00 00 ff 00 47 35 30
31 48 39 38 50 33 37 37 4c 0a 00 00 00 fc 00 44
45 4c 4c 20 33 30 30 38 57 46 50 0a 00 00 00 fd
00 31 56 1d 5e 11 00 0a 20 20 20 20 20 20 01 20

02 03 22 f5 4f 01 02 03 04 05 06 07 10 11 12 13
14 15 16 1f 23 0d 07 07 83 0f 00 00 65 03 0c 00
10 00 01 1d 00 72 51 d0 1e 20 6e 28 55 00 ba 88
21 00 00 1e 01 1d 80 18 71 1c 16 20 58 2c 25 00
ba 88 21 00 00 9e 8c 0a d0 8a 20 e0 2d 10 10 3e
96 00 ba 88 21 00 00 18 8c 0a a0 14 51 f0 16 00
26 7c 43 00 ba 88 21 00 00 98 02 3a 80 18 71 38
2d 40 58 2c 45 00 ba 88 21 00 00 1e 00 00 00 c2

----------------

Block 0, Base EDID:
  EDID Structure Version & Revision: 1.3
  Vendor & Product Identification:
    Manufacturer: DEL
    Model: 16439
    Serial Number: ...
    Made in: week 35 of 2009
  Basic Display Parameters & Features:
    Digital display
    Maximum image size: 65 cm x 41 cm
    Gamma: 2.20
    DPMS levels: Standby Suspend Off
    RGB color display
    First detailed timing is the preferred timing
  Color Characteristics:
    Red  : 0.6777, 0.3085
    Green: 0.1982, 0.6982
    Blue : 0.1464, 0.0595
    White: 0.3134, 0.3291
  Established Timings I & II:
    IBM     :   720x400    70.081663 Hz   9:5     31.467 kHz     28.320000 MHz
    DMT 0x04:   640x480    59.940476 Hz   4:3     31.469 kHz     25.175000 MHz
    DMT 0x06:   640x480    75.000000 Hz   4:3     37.500 kHz     31.500000 MHz
    DMT 0x09:   800x600    60.316541 Hz   4:3     37.879 kHz     40.000000 MHz
    DMT 0x0b:   800x600    75.000000 Hz   4:3     46.875 kHz     49.500000 MHz
    DMT 0x10:  1024x768    60.003840 Hz   4:3     48.363 kHz     65.000000 MHz
    DMT 0x12:  1024x768    75.028582 Hz   4:3     60.023 kHz     78.750000 MHz
    DMT 0x24:  1280x1024   75.024675 Hz   5:4     79.976 kHz    135.000000 MHz
  Standard Timings:
    DMT 0x23:  1280x1024   60.019740 Hz   5:4     63.981 kHz    108.000000 MHz
    DMT 0x33:  1600x1200   60.000000 Hz   4:3     75.000 kHz    162.000000 MHz
    DMT 0x15:  1152x864    75.000000 Hz   4:3     67.500 kHz    108.000000 MHz
    DMT 0x1c:  1280x800    59.810326 Hz  16:10    49.702 kHz     83.500000 MHz
    DMT 0x3a:  1680x1050   59.954250 Hz  16:10    65.290 kHz    146.250000 MHz
  Detailed Timing Descriptors:
    DTD 1:  1920x1200   59.950171 Hz  16:10    74.038 kHz    154.000000 MHz (641 mm x 401 mm)
                 Hfront   48 Hsync  32 Hback   80 Hpol P
                 Vfront    3 Vsync   6 Vback   26 Vpol N
    Display Product Serial Number: ...
    Display Product Name: 'DELL 3008WFP'
    Display Range Limits:
      Monitor ranges (GTF): 49-86 Hz V, 29-94 kHz H, max dotclock 170 MHz
  Extension blocks: 1
Checksum: 0x20

----------------

Block 1, CTA-861 Extension Block:
  Revision: 3
  Underscans IT Video Formats by default
  Basic audio support
  Supports YCbCr 4:4:4
  Supports YCbCr 4:2:2
  Native detailed modes: 5
  Video Data Block:
    VIC   1:   640x480    59.940476 Hz   4:3     31.469 kHz     25.175000 MHz
    VIC   2:   720x480    59.940060 Hz   4:3     31.469 kHz     27.000000 MHz
    VIC   3:   720x480    59.940060 Hz  16:9     31.469 kHz     27.000000 MHz
    VIC   4:  1280x720    60.000000 Hz  16:9     45.000 kHz     74.250000 MHz
    VIC   5:  1920x1080i  60.000000 Hz  16:9     33.750 kHz     74.250000 MHz
    VIC   6:  1440x480i   59.940060 Hz   4:3     15.734 kHz     27.000000 MHz
    VIC   7:  1440x480i   59.940060 Hz  16:9     15.734 kHz     27.000000 MHz
    VIC  16:  1920x1080   60.000000 Hz  16:9     67.500 kHz    148.500000 MHz
    VIC  17:   720x576    50.000000 Hz   4:3     31.250 kHz     27.000000 MHz
    VIC  18:   720x576    50.000000 Hz  16:9     31.250 kHz     27.000000 MHz
    VIC  19:  1280x720    50.000000 Hz  16:9     37.500 kHz     74.250000 MHz
    VIC  20:  1920x1080i  50.000000 Hz  16:9     28.125 kHz     74.250000 MHz
    VIC  21:  1440x576i   50.000000 Hz   4:3     15.625 kHz     27.000000 MHz
    VIC  22:  1440x576i   50.000000 Hz  16:9     15.625 kHz     27.000000 MHz
    VIC  31:  1920x1080   50.000000 Hz  16:9     56.250 kHz    148.500000 MHz
  Audio Data Block:
    Linear PCM:
      Max channels: 6
      Supported sample rates (kHz): 48 44.1 32
      Supported sample sizes (bits): 24 20 16
  Speaker Allocation Data Block:
    FL/FR - Front Left/Right
    LFE1 - Low Frequency Effects 1
    FC - Front Center
    LS/RS - Left/Right Surround
  Vendor-Specific Data Block (HDMI), OUI 00-0C-03:
    Source physical address: 1.0.0.0
  Detailed Timing Descriptors:
    DTD 2:  1280x720    60.000000 Hz  16:9     45.000 kHz     74.250000 MHz (698 mm x 392 mm)
                 Hfront  110 Hsync  40 Hback  220 Hpol P
                 Vfront    5 Vsync   5 Vback   20 Vpol P
    DTD 3:  1920x1080i  60.000000 Hz  16:9     33.750 kHz     74.250000 MHz (698 mm x 392 mm)
                 Hfront   88 Hsync  44 Hback  148 Hpol P
                 Vfront    2 Vsync   5 Vback   15 Vpol P Vfront +0.5 Odd Field
                 Vfront    2 Vsync   5 Vback   15 Vpol P Vback  +0.5 Even Field
    DTD 4:   720x480    59.940060 Hz   3:2     31.469 kHz     27.000000 MHz (698 mm x 392 mm)
                 Hfront   16 Hsync  62 Hback   60 Hpol N
                 Vfront    9 Vsync   6 Vback   30 Vpol N
    DTD 5:  1440x480i   59.940060 Hz   3:1     15.734 kHz     27.000000 MHz (698 mm x 392 mm)
                 Hfront   38 Hsync 124 Hback  114 Hpol N
                 Vfront    4 Vsync   3 Vback   15 Vpol N Vfront +0.5 Odd Field
                 Vfront    4 Vsync   3 Vback   15 Vpol N Vback  +0.5 Even Field
    DTD 6:  1920x1080   60.000000 Hz  16:9     67.500 kHz    148.500000 MHz (698 mm x 392 mm)
                 Hfront   88 Hsync  44 Hback  148 Hpol P
                 Vfront    4 Vsync   5 Vback   36 Vpol P
Checksum: 0xc2  Unused space in Extension Block: 3 bytes

----------------

Warnings:

Block 1, CTA-861 Extension Block:
  Video Data Block: VIC 1 and the first DTD are not identical. Is this intended?
  Video Data Block: All VICs are in ascending order, and the first (preferred) VIC <= 4, is that intended?
  Detailed Timing Descriptor #4: Image size is 698x392 mm, but based on the picture AR it should be 698x465 mm.
  Detailed Timing Descriptor #5: Image size is 698x392 mm, but based on the picture AR it should be 698x232 mm.
  Display Product Serial Number is set, so the Serial Number in the Base EDID should be 0.
  Add a Colorimetry Data Block with the sRGB colorimetry bit set to avoid interop issues.
EDID:
  Base EDID: Some timings are out of range of the Monitor Ranges:
    Horizontal Freq: 15.625 - 79.976 kHz (Monitor: 29.000 - 94.000 kHz)

Failures:

Block 1, CTA-861 Extension Block:
  Detailed Timing Descriptor #2: Mismatch of image size 698x392 mm vs display size 650x410 mm.
  Detailed Timing Descriptor #3: Mismatch of image size 698x392 mm vs display size 650x410 mm.
  Detailed Timing Descriptor #4: Mismatch of image size 698x392 mm vs display size 650x410 mm.
  Detailed Timing Descriptor #5: Mismatch of image size 698x392 mm vs display size 650x410 mm.
  Detailed Timing Descriptor #6: Mismatch of image size 698x392 mm vs display size 650x410 mm.
  Missing VCDB, needed for Set Selectable RGB Quantization to avoid interop issues.
EDID:
  Base EDID: The DTD max image size is 698x401mm, which is larger than the display size 650.0x410.0mm.
  CTA-861: Native progressive timings are a mix of several resolutions.
  CTA-861: Native interlaced timings are a mix of several resolutions.

EDID conformity: FAIL
