edid-decode (hex):

00 ff ff ff ff ff ff 00 2c 83 08 05 00 00 00 00
0f 1c 01 04 a5 1d 13 78 0a ee 95 a3 54 4c 99 26
0f 4f 54 00 00 00 01 01 01 01 01 01 01 01 01 01
01 01 01 01 01 01 54 56 d0 a0 80 e0 14 50 30 20
55 00 1d be 10 00 00 18 00 00 00 00 00 00 00 00
00 00 00 00 00 00 00 00 00 00 00 00 00 fe 00 4b
44 43 20 32 4b 0a 20 20 20 20 20 20 00 00 00 fe
00 4b 44 31 33 35 4e 30 32 41 30 30 32 0a 00 0c

00 ff ff ff ff ff ff 00 2c 83 08 05 00 00 00 00
0f 1c 01 04 a5 1d 13 78 0a ee 95 a3 54 4c 99 26
0f 4f 54 00 00 00 01 01 01 01 01 01 01 01 01 01
01 01 01 01 01 01 54 56 d0 a0 80 e0 14 50 30 20
55 00 1d be 10 00 00 18 00 00 00 00 00 00 00 00
00 00 00 00 00 00 00 00 00 00 00 00 00 fe 00 4b
44 43 20 32 4b 0a 20 20 20 20 20 20 00 00 00 fe
00 4b 44 31 33 35 4e 30 32 41 30 30 32 0a 00 0c

----------------

Block 0, Base EDID:
  EDID Structure Version & Revision: 1.4
  Vendor & Product Identification:
    Manufacturer: KDC
    Model: 1288
    Made in: week 15 of 2018
  Basic Display Parameters & Features:
    Digital display
    Bits per primary color channel: 8
    DisplayPort interface
    Maximum image size: 29 cm x 19 cm
    Gamma: 2.20
    Supported color formats: RGB 4:4:4, YCrCb 4:4:4
    First detailed timing includes the native pixel format and preferred refresh rate
  Color Characteristics:
    Red  : 0.6396, 0.3300
    Green: 0.2998, 0.5996
    Blue : 0.1503, 0.0595
    White: 0.3095, 0.3291
  Established Timings I & II: none
  Standard Timings: none
  Detailed Timing Descriptors:
    DTD 1:  2256x1504   60.021988 Hz   3:2     91.474 kHz    221.000000 MHz (285 mm x 190 mm)
                 Hfront   48 Hsync  32 Hback   80 Hpol N
                 Vfront    5 Vsync   5 Vback   10 Vpol N
    Empty Descriptor
    Alphanumeric Data String: 'KDC 2K'
    Alphanumeric Data String: 'KD135N02A002'
Checksum: 0x0c

----------------

Warnings:

Block 0, Base EDID:
  Missing Display Product Name.

Failures:

Block 0, Base EDID:
  Empty Descriptor: Use Dummy Descriptor instead of all zeroes.
EDID:
  Extension Block 1 started with EDID header, ignoring Extension Blocks >= 1.

EDID conformity: FAIL
