edid-decode (hex):

00 ff ff ff ff ff ff 00 1e 6d 7b 9e 61 51 00 00
09 1f 01 04 b5 78 22 78 9e 09 c1 ae 50 44 af 26
0e 50 54 21 08 00 71 40 81 80 81 c0 a9 c0 d1 c0
81 00 01 01 01 01 a6 78 00 30 f2 38 5a 40 b0 58
8a 00 ae 51 41 00 00 1e 02 3a 80 18 71 38 2d 40
58 2c 45 00 ae 51 41 00 00 1e 00 00 00 fd 00 30
3d 1e 87 3c 00 0a 20 20 20 20 20 20 00 00 00 fc
00 4c 47 20 48 44 52 20 44 51 48 44 0a 20 02 ce

02 03 19 71 44 01 03 04 90 23 09 07 07 83 01 00
00 e3 05 c0 00 e3 06 05 01 4d d0 00 a0 f0 70 3e
80 30 20 65 0c 20 4a 31 00 00 1a 28 68 00 a0 f0
70 3e 80 08 90 65 0c 20 4a 31 00 00 1a 00 00 00
00 00 00 00 00 00 00 00 00 00 00 00 00 00 00 00
00 00 00 00 00 00 00 00 00 00 00 00 00 00 00 00
00 00 00 00 00 00 00 00 00 00 00 00 00 00 00 00
00 00 00 00 00 00 00 00 00 00 00 00 00 00 00 e3

70 12 79 03 00 03 00 28 45 b7 00 88 ff 13 9f 00
2f 80 1f 00 9f 05 28 00 02 00 09 00 65 5a 00 88
ff 13 9f 00 2f 80 14 00 9f 05 14 00 02 00 09 00
00 00 00 00 00 00 00 00 00 00 00 00 00 00 00 00
00 00 00 00 00 00 00 00 00 00 00 00 00 00 00 00
00 00 00 00 00 00 00 00 00 00 00 00 00 00 00 00
00 00 00 00 00 00 00 00 00 00 00 00 00 00 00 00
00 00 00 00 00 00 00 00 00 00 00 00 00 00 ef 90

00 ff ff ff ff ff ff 00 1e 6d 7b 9e 61 51 00 00
09 1f 01 04 b5 78 22 78 9e 09 c1 ae 50 44 af 26
0e 50 54 21 08 00 71 40 81 80 81 c0 a9 c0 d1 c0
81 00 01 01 01 01 a6 78 00 30 f2 38 5a 40 b0 58
8a 00 ae 51 41 00 00 1e 02 3a 80 18 71 38 2d 40
58 2c 45 00 ae 51 41 00 00 1e 00 00 00 fd 00 30
3d 1e 87 3c 00 0a 20 20 20 20 20 20 00 00 00 fc
00 4c 47 20 48 44 52 20 44 51 48 44 0a 20 02 ce

02 03 19 71 44 01 03 04 90 23 09 07 07 83 01 00
00 e3 05 c0 00 e3 06 05 01 4d d0 00 a0 f0 70 3e
80 30 20 65 0c 20 4a 31 00 00 1a 28 68 00 a0 f0
70 3e 80 08 90 65 0c 20 4a 31 00 00 1a 00 00 00
00 00 00 00 00 00 00 00 00 00 00 00 00 00 00 00
00 00 00 00 00 00 00 00 00 00 00 00 00 00 00 00
00 00 00 00 00 00 00 00 00 00 00 00 00 00 00 00
00 00 00 00 00 00 00 00 00 00 00 00 00 00 00 e3

70 12 79 03 00 03 00 28 45 b7 00 88 ff 13 9f 00
2f 80 1f 00 9f 05 28 00 02 00 09 00 65 5a 00 88
ff 13 9f 00 2f 80 14 00 9f 05 14 00 02 00 09 00
00 00 00 00 00 00 00 00 00 00 00 00 00 00 00 00
00 00 00 00 00 00 00 00 00 00 00 00 00 00 00 00
00 00 00 00 00 00 00 00 00 00 00 00 00 00 00 00
00 00 00 00 00 00 00 00 00 00 00 00 00 00 00 00
00 00 00 00 00 00 00 00 00 00 00 00 00 00 ef 90

----------------

Block 0, Base EDID:
  EDID Structure Version & Revision: 1.4
  Vendor & Product Identification:
    Manufacturer: GSM
    Model: 40571
    Serial Number: ...
    Made in: week 9 of 2021
  Basic Display Parameters & Features:
    Digital display
    Bits per primary color channel: 10
    DisplayPort interface
    Maximum image size: 120 cm x 34 cm
    Gamma: 2.20
    DPMS levels: Standby
    Supported color formats: RGB 4:4:4, YCrCb 4:4:4, YCrCb 4:2:2
    Default (sRGB) color space is primary color space
    First detailed timing includes the native pixel format and preferred refresh rate
  Color Characteristics:
    Red  : 0.6796, 0.3125
    Green: 0.2675, 0.6845
    Blue : 0.1513, 0.0546
    White: 0.3125, 0.3291
  Established Timings I & II:
    DMT 0x04:   640x480    59.940476 Hz   4:3     31.469 kHz     25.175000 MHz
    DMT 0x09:   800x600    60.316541 Hz   4:3     37.879 kHz     40.000000 MHz
    DMT 0x10:  1024x768    60.003840 Hz   4:3     48.363 kHz     65.000000 MHz
  Standard Timings:
    GTF     :  1152x864    60.000000 Hz   4:3     53.700 kHz     81.624000 MHz
    DMT 0x23:  1280x1024   60.019740 Hz   5:4     63.981 kHz    108.000000 MHz
    DMT 0x55:  1280x720    60.000000 Hz  16:9     45.000 kHz     74.250000 MHz
    DMT 0x53:  1600x900    60.000000 Hz  16:9     60.000 kHz    108.000000 MHz (RB)
    DMT 0x52:  1920x1080   60.000000 Hz  16:9     67.500 kHz    148.500000 MHz
    DMT 0x1c:  1280x800    59.810326 Hz  16:10    49.702 kHz     83.500000 MHz
  Detailed Timing Descriptors:
    DTD 1:  3840x1080   59.996115 Hz  32:9     70.195 kHz    308.860000 MHz (1198 mm x 337 mm)
                 Hfront  176 Hsync  88 Hback  296 Hpol P
                 Vfront    8 Vsync  10 Vback   72 Vpol P
    DTD 2:  1920x1080   60.000000 Hz  16:9     67.500 kHz    148.500000 MHz (1198 mm x 337 mm)
                 Hfront   88 Hsync  44 Hback  148 Hpol P
                 Vfront    4 Vsync   5 Vback   36 Vpol P
    Display Range Limits:
      Monitor ranges (GTF): 48-61 Hz V, 30-135 kHz H, max dotclock 600 MHz
    Display Product Name: 'LG HDR DQHD'
  Extension blocks: 2
Checksum: 0xce

----------------

Block 1, CTA-861 Extension Block:
  Revision: 3
  Basic audio support
  Supports YCbCr 4:4:4
  Supports YCbCr 4:2:2
  Native DTDs: 1
  Video Data Block:
    VIC   1:   640x480    59.940476 Hz   4:3     31.469 kHz     25.175000 MHz
    VIC   3:   720x480    59.940060 Hz  16:9     31.469 kHz     27.000000 MHz
    VIC   4:  1280x720    60.000000 Hz  16:9     45.000 kHz     74.250000 MHz
    VIC  16:  1920x1080   60.000000 Hz  16:9     67.500 kHz    148.500000 MHz (native)
  Audio Data Block:
    Linear PCM:
      Max channels: 2
      Supported sample rates (kHz): 48 44.1 32
      Supported sample sizes (bits): 24 20 16
  Speaker Allocation Data Block:
    FL/FR - Front Left/Right
  Colorimetry Data Block:
    BT2020YCC
    BT2020RGB
  HDR Static Metadata Data Block:
    Electro optical transfer functions:
      Traditional gamma - SDR luminance range
      SMPTE ST2084
    Supported static metadata descriptors:
      Static metadata type 1
  Detailed Timing Descriptors:
    DTD 3:  3840x2160   59.996625 Hz  16:9    133.312 kHz    533.250000 MHz (800 mm x 330 mm)
                 Hfront   48 Hsync  32 Hback   80 Hpol P
                 Vfront   54 Vsync   5 Vback    3 Vpol N
    DTD 4:  3840x2160   30.000000 Hz  16:9     66.660 kHz    266.640000 MHz (800 mm x 330 mm)
                 Hfront    8 Hsync 144 Hback    8 Hpol P
                 Vfront   54 Vsync   5 Vback    3 Vpol N
Checksum: 0xe3  Unused space in Extension Block: 66 bytes

----------------

Block 2, DisplayID Extension Block:
  Version: 1.2
  Extension Count: 0
  Display Product Type: Standalone display device
  Video Timing Modes Type 1 - Detailed Timings Data Block:
    DTD:  5120x1440   59.999898 Hz   0:0     88.860 kHz    469.180000 MHz (aspect undefined, no 3D stereo, preferred)
               Hfront   48 Hsync  32 Hback   80 Hpol P
               Vfront    3 Vsync  10 Vback   28 Vpol N
    DTD:  5120x1440   29.999689 Hz   0:0     43.830 kHz    231.420000 MHz (aspect undefined, no 3D stereo, preferred)
               Hfront   48 Hsync  21 Hback   91 Hpol P
               Vfront    3 Vsync  10 Vback    8 Vpol N
  Checksum: 0xef
Checksum: 0x90

----------------

Warnings:

Block 0, Base EDID:
  Detailed Timing Descriptor #2: Image size is 1198x337 mm, but based on the picture AR it should be 599x337 mm.
  Display Range Limits: GTF support is deprecated in EDID 1.4.
Block 1, CTA-861 Extension Block:
  IT Video Formats are overscanned by default, but normally this should be underscanned.
  Video Data Block: VIC 1 and the first DTD are not identical. Is this intended?
  Video Data Block: All VICs are in ascending order, and the first (preferred) VIC <= 4, is that intended?
  Detailed Timing Descriptor #3: Image size is 800x330 mm, but based on the picture AR it should be 586x330 mm.
  Detailed Timing Descriptor #4: Image size is 800x330 mm, but based on the picture AR it should be 586x330 mm.
EDID:
  Base EDID: Some timings are out of range of the Monitor Ranges:
    Vertical Freq: 30.000 - 60.317 Hz (Monitor: 48.000 - 61.000 Hz)

Failures:

Block 0, Base EDID:
  Basic Display Parameters & Features: sRGB is signaled, but the chromaticities do not match.
  Display Range Limits: GTF is supported, but the display does not support continuous frequencies.
Block 1, CTA-861 Extension Block:
  Detailed Timing Descriptor #3: Mismatch of image size 800x330 mm vs display size 1200x340 mm.
  Detailed Timing Descriptor #4: Mismatch of image size 800x330 mm vs display size 1200x340 mm.
  Missing VCDB, needed for Set Selectable RGB Quantization to avoid interop issues.
EDID:
  Extension Block 3 started with EDID header, ignoring Extension Blocks >= 3.
  CTA-861: Native progressive timings are a mix of several resolutions.
  DisplayID: Missing DisplayID Display Parameters Data Block.

EDID conformity: FAIL
