edid-decode (hex):

00 ff ff ff ff ff ff 00 09 e5 34 0b 00 00 00 00
0d 20 01 04 a5 1a 10 78 03 d6 f5 98 5d 5a 9a 29
1d 50 54 00 00 00 01 01 01 01 01 01 01 01 01 01
01 01 01 01 01 01 99 3e 80 dc 70 b0 30 40 30 20
36 00 07 a4 10 00 00 1a 00 00 00 fd 00 28 3c 4b
4b 10 01 0a 20 20 20 20 20 20 00 00 00 fe 00 42
4f 45 20 43 51 0a 20 20 20 20 20 20 00 00 00 fe
00 4e 56 31 32 32 57 55 4d 2d 4e 34 31 0a 01 52

02 03 0d 00 68 1a 00 00 01 01 28 3c 00 00 00 00
00 00 00 00 00 00 00 00 00 00 00 00 00 00 00 00
00 00 00 00 00 00 00 00 00 00 00 00 00 00 00 00
00 00 00 00 00 00 00 00 00 00 00 00 00 00 00 00
00 00 00 00 00 00 00 00 00 00 00 00 00 00 00 00
00 00 00 00 00 00 00 00 00 00 00 00 00 00 00 00
00 00 00 00 00 00 00 00 00 00 00 00 00 00 00 00
00 00 00 00 00 00 00 00 00 00 00 00 00 00 00 06

00 ff ff ff ff ff ff 00 09 e5 34 0b 00 00 00 00
0d 20 01 04 a5 1a 10 78 03 d6 f5 98 5d 5a 9a 29
1d 50 54 00 00 00 01 01 01 01 01 01 01 01 01 01
01 01 01 01 01 01 99 3e 80 dc 70 b0 30 40 30 20
36 00 07 a4 10 00 00 1a 00 00 00 fd 00 28 3c 4b
4b 10 01 0a 20 20 20 20 20 20 00 00 00 fe 00 42
4f 45 20 43 51 0a 20 20 20 20 20 20 00 00 00 fe
00 4e 56 31 32 32 57 55 4d 2d 4e 34 31 0a 01 52

02 03 0d 00 68 1a 00 00 01 01 28 3c 00 00 00 00
00 00 00 00 00 00 00 00 00 00 00 00 00 00 00 00
00 00 00 00 00 00 00 00 00 00 00 00 00 00 00 00
00 00 00 00 00 00 00 00 00 00 00 00 00 00 00 00
00 00 00 00 00 00 00 00 00 00 00 00 00 00 00 00
00 00 00 00 00 00 00 00 00 00 00 00 00 00 00 00
00 00 00 00 00 00 00 00 00 00 00 00 00 00 00 00
00 00 00 00 00 00 00 00 00 00 00 00 00 00 00 06

----------------

Block 0, Base EDID:
  EDID Structure Version & Revision: 1.4
  Vendor & Product Identification:
    Manufacturer: BOE
    Model: 2868
    Made in: week 13 of 2022
  Basic Display Parameters & Features:
    Digital display
    Bits per primary color channel: 8
    DisplayPort interface
    Maximum image size: 26 cm x 16 cm
    Gamma: 2.20
    Supported color formats: RGB 4:4:4
    First detailed timing includes the native pixel format and preferred refresh rate
    Display supports continuous frequencies
  Color Characteristics:
    Red  : 0.5966, 0.3642
    Green: 0.3525, 0.6035
    Blue : 0.1630, 0.1162
    White: 0.3134, 0.3291
  Established Timings I & II: none
  Standard Timings: none
  Detailed Timing Descriptors:
    DTD 1:  1920x1200   60.002546 Hz  16:10    74.883 kHz    160.250000 MHz (263 mm x 164 mm)
                 Hfront   48 Hsync  32 Hback  140 Hpol P
                 Vfront    3 Vsync   6 Vback   39 Vpol N
    Display Range Limits:
      Monitor ranges (Range Limits Only): 40-60 Hz V, 75-75 kHz H, max dotclock 160 MHz
    Alphanumeric Data String: 'BOE CQ'
    Alphanumeric Data String: 'NV122WUM-N41'
  Extension blocks: 1
Checksum: 0x52

----------------

Block 1, CTA-861 Extension Block:
  Revision: 3
  Native DTDs: 0
  Vendor-Specific Data Block (AMD), OUI 00-00-1A:
    Version: 1
    Feature Caps: 0x01
    Minimum Refresh Rate: 40 Hz
    Maximum Refresh Rate: 60 Hz
    Flags 1.x: 0x00
Checksum: 0x06  Unused space in Extension Block: 114 bytes

----------------

Warnings:

Block 0, Base EDID:
  Missing Display Product Name.
Block 1, CTA-861 Extension Block:
  IT Video Formats are overscanned by default, but normally this should be underscanned.
  Add a Colorimetry Data Block with the sRGB colorimetry bit set to avoid interop issues.
EDID:
  Base EDID: Some timings are out of range of the Monitor Ranges:
    Maximum Clock: 160.250 MHz (Monitor: 160.000 MHz)
    Could be due to a Monitor Range off-by-one rounding issue

Failures:

Block 1, CTA-861 Extension Block:
  Required 640x480p60 timings are missing in the established timings and the SVD list (VIC 1).
  Missing VCDB, needed for Set Selectable RGB Quantization to avoid interop issues.
EDID:
  Extension Block 2 started with EDID header, ignoring Extension Blocks >= 2.

EDID conformity: FAIL
