edid-decode (hex):

00 ff ff ff ff ff ff 00 0d ae 2f 16 00 00 00 00
23 20 01 04 a5 22 16 78 03 0f 95 ae 52 43 b0 26
0f 50 54 00 00 00 01 01 01 01 01 01 01 01 01 01
01 01 01 01 01 01 6b 6e 00 a0 a0 40 84 60 30 20
6a 00 58 d7 10 00 00 18 00 00 00 fd 0c 3c f0 a1
a1 72 01 0a 20 20 20 20 20 20 00 00 00 fe 00 43
4d 4e 0a 20 20 20 20 20 20 20 20 20 00 00 00 fe
00 4e 31 36 30 47 4d 45 2d 47 54 42 0a 20 01 ed

70 20 79 02 00 22 00 14 9a 40 11 85 ff 09 9f 00
2f 00 1f 00 3f 06 83 00 05 00 09 00 25 01 09 9a
40 11 9a 40 11 3c f0 80 81 00 13 72 1a 00 00 03
01 3c f0 00 00 00 00 00 00 f0 00 00 00 00 00 00
00 00 00 00 00 00 00 00 00 00 00 00 00 00 00 00
00 00 00 00 00 00 00 00 00 00 00 00 00 00 00 00
00 00 00 00 00 00 00 00 00 00 00 00 00 00 00 00
00 00 00 00 00 00 00 00 00 00 00 00 00 00 03 90

00 ff ff ff ff ff ff 00 0d ae 2f 16 00 00 00 00
23 20 01 04 a5 22 16 78 03 0f 95 ae 52 43 b0 26
0f 50 54 00 00 00 01 01 01 01 01 01 01 01 01 01
01 01 01 01 01 01 6b 6e 00 a0 a0 40 84 60 30 20
6a 00 58 d7 10 00 00 18 00 00 00 fd 0c 3c f0 a1
a1 72 01 0a 20 20 20 20 20 20 00 00 00 fe 00 43
4d 4e 0a 20 20 20 20 20 20 20 20 20 00 00 00 fe
00 4e 31 36 30 47 4d 45 2d 47 54 42 0a 20 01 ed

70 20 79 02 00 22 00 14 9a 40 11 85 ff 09 9f 00
2f 00 1f 00 3f 06 83 00 05 00 09 00 25 01 09 9a
40 11 9a 40 11 3c f0 80 81 00 13 72 1a 00 00 03
01 3c f0 00 00 00 00 00 00 f0 00 00 00 00 00 00
00 00 00 00 00 00 00 00 00 00 00 00 00 00 00 00
00 00 00 00 00 00 00 00 00 00 00 00 00 00 00 00
00 00 00 00 00 00 00 00 00 00 00 00 00 00 00 00
00 00 00 00 00 00 00 00 00 00 00 00 00 00 03 90

----------------

Block 0, Base EDID:
  EDID Structure Version & Revision: 1.4
  Vendor & Product Identification:
    Manufacturer: CMN
    Model: 5679
    Made in: week 35 of 2022
  Basic Display Parameters & Features:
    Digital display
    Bits per primary color channel: 8
    DisplayPort interface
    Maximum image size: 34 cm x 22 cm
    Gamma: 2.20
    Supported color formats: RGB 4:4:4
    First detailed timing includes the native pixel format and preferred refresh rate
    Display supports continuous frequencies
  Color Characteristics:
    Red  : 0.6796, 0.3203
    Green: 0.2646, 0.6904
    Blue : 0.1503, 0.0595
    White: 0.3134, 0.3291
  Established Timings I & II: none
  Standard Timings: none
  Detailed Timing Descriptors:
    DTD 1:  2560x1600   60.001613 Hz  16:10   103.923 kHz    282.670000 MHz (344 mm x 215 mm)
                 Hfront   48 Hsync  32 Hback   80 Hpol N
                 Vfront    6 Vsync  10 Vback  116 Vpol N
    Display Range Limits:
      Monitor ranges (Range Limits Only): 60-240 Hz V, 416-416 kHz H, max dotclock 1140 MHz
    Alphanumeric Data String: 'CMN'
    Alphanumeric Data String: 'N160GME-GTB'
  Extension blocks: 1
Checksum: 0xed

----------------

Block 1, DisplayID Extension Block:
  Version: 2.0
  Extension Count: 0
  Display Product Primary Use Case: None of the listed primary use cases; generic display
  Video Timing Modes Type 7 - Detailed Timings Data Block:
    DTD:  2560x1600  240.000297 Hz  16:10   415.681 kHz   1130.651000 MHz (aspect 16:10, no 3D stereo, preferred)
               Hfront   48 Hsync  32 Hback   80 Hpol N
               Vfront    6 Vsync  10 Vback  116 Vpol N
  Dynamic Video Timing Range Limits Data Block:
    Minimum Pixel Clock: 1130651 kHz
    Maximum Pixel Clock: 1130651 kHz
    Minimum Vertical Refresh Rate: 60 Hz
    Maximum Vertical Refresh Rate: 240 Hz
    Seamless Dynamic Video Timing Support: Yes
  CTA-861 DisplayID Data Block:
  Vendor-Specific Data Block (AMD), OUI 00-00-1A:
    Version: 3
    Feature Caps: 0x01
    Minimum Refresh Rate: 60 Hz
    Maximum Refresh Rate: 240 Hz
    Flags 1.x: 0x00
    Flags 2.x: 0x00
  Checksum: 0x03
Checksum: 0x90

----------------

Block 2, Unknown EDID Extension Block 0x00:
  00 ff ff ff ff ff ff 00 0d ae 2f 16 00 00 00 00 '........../.....'
  23 20 01 04 a5 22 16 78 03 0f 95 ae 52 43 b0 26 '# ...".x....RC.&'
  0f 50 54 00 00 00 01 01 01 01 01 01 01 01 01 01 '.PT.............'
  01 01 01 01 01 01 6b 6e 00 a0 a0 40 84 60 30 20 '......kn...@.`0 '
  6a 00 58 d7 10 00 00 18 00 00 00 fd 0c 3c f0 a1 'j.X..........<..'
  a1 72 01 0a 20 20 20 20 20 20 00 00 00 fe 00 43 '.r..      .....C'
  4d 4e 0a 20 20 20 20 20 20 20 20 20 00 00 00 fe 'MN.         ....'
  00 4e 31 36 30 47 4d 45 2d 47 54 42 0a 20 01 ed '.N160GME-GTB. ..'
Checksum: 0xed

----------------

Block 3, DisplayID Extension Block:
  Version: 2.0
  Extension Count: 0
  Video Timing Modes Type 7 - Detailed Timings Data Block:
    DTD:  2560x1600  240.000297 Hz  16:10   415.681 kHz   1130.651000 MHz (aspect 16:10, no 3D stereo, preferred)
               Hfront   48 Hsync  32 Hback   80 Hpol N
               Vfront    6 Vsync  10 Vback  116 Vpol N
  Dynamic Video Timing Range Limits Data Block:
    Minimum Pixel Clock: 1130651 kHz
    Maximum Pixel Clock: 1130651 kHz
    Minimum Vertical Refresh Rate: 60 Hz
    Maximum Vertical Refresh Rate: 240 Hz
    Seamless Dynamic Video Timing Support: Yes
  CTA-861 DisplayID Data Block:
  Vendor-Specific Data Block (AMD), OUI 00-00-1A:
    Version: 3
    Feature Caps: 0x01
    Minimum Refresh Rate: 60 Hz
    Maximum Refresh Rate: 240 Hz
    Flags 1.x: 0x00
    Flags 2.x: 0x00
  Checksum: 0x03
Checksum: 0x90

----------------

Warnings:

Block 0, Base EDID:
  Missing Display Product Name.
EDID:
  Base EDID: Some timings are out of range of the Monitor Ranges:
    Horizontal Freq: 103.922 - 415.680 kHz (Monitor: 416.000 - 416.000 kHz)

Failures:

Block 1, DisplayID Extension Block:
  Expected 0 DisplayID Extension Block, but got 1.
Block 2, Base EDID:
  Unknown Extension Block.
Block 3, DisplayID Extension Block:
  Product Type should be 0 in extension block.
EDID:
  Base EDID: EDID specified 1 extension block(s), but found 3 extension block(s).
  DisplayID: Missing DisplayID Display Parameters Data Block.

EDID conformity: FAIL
