edid-decode (hex):

00 ff ff ff ff ff ff 00 09 d1 0a 78 45 54 00 00
19 12 01 03 80 34 20 78 2e c5 c4 a3 57 4a 9c 23
12 4f 52 a5 6b 80 71 00 81 00 95 00 81 80 b3 00
a9 40 d1 00 01 01 28 3c 80 a0 70 b0 23 40 30 20
36 00 07 44 21 00 00 1a 00 00 00 ff 00 4b 36 38
30 31 31 38 35 5a 4c 30 0a 20 00 00 00 fd 00 32
55 1f 5e 11 00 0a 20 20 20 20 20 20 00 00 00 fc
00 42 65 6e 51 20 47 32 34 30 30 57 0a 20 00 ec

00 ff ff ff ff ff ff 00 09 d1 0a 78 45 54 00 00
19 12 01 03 80 34 20 78 2e c5 c4 a3 57 4a 9c 23
12 4f 52 a5 6b 80 71 00 81 00 95 00 81 80 b3 00
a9 40 d1 00 01 01 28 3c 80 a0 70 b0 23 40 30 20
36 00 07 44 21 00 00 1a 00 00 00 ff 00 4b 36 38
30 31 31 38 35 5a 4c 30 0a 20 00 00 00 fd 00 32
55 1f 5e 11 00 0a 20 20 20 20 20 20 00 00 00 fc
00 42 65 6e 51 20 47 32 34 30 30 57 0a 20 00 ec

----------------

Block 0, Base EDID:
  EDID Structure Version & Revision: 1.3
  Vendor & Product Identification:
    Manufacturer: BNQ
    Model: 30730
    Serial Number: ...
    Made in: week 25 of 2008
  Basic Display Parameters & Features:
    Digital display
    Maximum image size: 52 cm x 32 cm
    Gamma: 2.20
    DPMS levels: Off
    RGB color display
    Default (sRGB) color space is primary color space
    First detailed timing is the preferred timing
  Color Characteristics:
    Red  : 0.6396, 0.3398
    Green: 0.2900, 0.6103
    Blue : 0.1396, 0.0703
    White: 0.3095, 0.3203
  Established Timings I & II:
    IBM     :   720x400    70.081663 Hz   9:5     31.467 kHz     28.320000 MHz
    DMT 0x04:   640x480    59.940476 Hz   4:3     31.469 kHz     25.175000 MHz
    DMT 0x06:   640x480    75.000000 Hz   4:3     37.500 kHz     31.500000 MHz
    DMT 0x09:   800x600    60.316541 Hz   4:3     37.879 kHz     40.000000 MHz
    DMT 0x0b:   800x600    75.000000 Hz   4:3     46.875 kHz     49.500000 MHz
    Apple   :   832x624    74.551266 Hz   4:3     49.726 kHz     57.284000 MHz
    DMT 0x10:  1024x768    60.003840 Hz   4:3     48.363 kHz     65.000000 MHz
    DMT 0x12:  1024x768    75.028582 Hz   4:3     60.023 kHz     78.750000 MHz
    DMT 0x24:  1280x1024   75.024675 Hz   5:4     79.976 kHz    135.000000 MHz
    Apple   :  1152x870    75.061550 Hz 192:145   68.681 kHz    100.000000 MHz
  Standard Timings:
    GTF     :  1152x720    59.999964 Hz  16:10    44.760 kHz     67.319000 MHz
    DMT 0x1c:  1280x800    59.810326 Hz  16:10    49.702 kHz     83.500000 MHz
    DMT 0x2f:  1440x900    59.887445 Hz  16:10    55.935 kHz    106.500000 MHz
    DMT 0x23:  1280x1024   60.019740 Hz   5:4     63.981 kHz    108.000000 MHz
    DMT 0x3a:  1680x1050   59.954250 Hz  16:10    65.290 kHz    146.250000 MHz
    DMT 0x33:  1600x1200   60.000000 Hz   4:3     75.000 kHz    162.000000 MHz
    DMT 0x45:  1920x1200   59.884600 Hz  16:10    74.556 kHz    193.250000 MHz
  Detailed Timing Descriptors:
    DTD 1:  1920x1200   59.950171 Hz  16:10    74.038 kHz    154.000000 MHz (519 mm x 324 mm)
                 Hfront   48 Hsync  32 Hback   80 Hpol P
                 Vfront    3 Vsync   6 Vback   26 Vpol N
    Display Product Serial Number: ...
    Display Range Limits:
      Monitor ranges (GTF): 50-85 Hz V, 31-94 kHz H, max dotclock 170 MHz
    Display Product Name: 'BenQ G2400W'
Checksum: 0xec

----------------

Block 1, Unknown EDID Extension Block 0x00:
  00 ff ff ff ff ff ff 00 09 d1 0a 78 45 54 00 00 '...........xET..'
  19 12 01 03 80 34 20 78 2e c5 c4 a3 57 4a 9c 23 '.....4 x....WJ.#'
  12 4f 52 a5 6b 80 71 00 81 00 95 00 81 80 b3 00 '.OR.k.q.........'
  a9 40 d1 00 01 01 28 3c 80 a0 70 b0 23 40 30 20 '.@....(<..p.#@0 '
  36 00 07 44 21 00 00 1a 00 00 00 ff 00 4b 36 38 '6..D!........K68'
  30 31 31 38 35 5a 4c 30 0a 20 00 00 00 fd 00 32 '01185ZL0. .....2'
  55 1f 5e 11 00 0a 20 20 20 20 20 20 00 00 00 fc 'U.^...      ....'
  00 42 65 6e 51 20 47 32 34 30 30 57 0a 20 00 ec '.BenQ G2400W. ..'
Checksum: 0xec

----------------

Warnings:

Block 0, Base EDID:
  Vendor & Product Identification: The serial number is one of the known dummy values, it should probably be set to 0.
EDID:
  Base EDID: Some timings are out of range of the Monitor Ranges:
    Maximum Clock: 193.250 MHz (Monitor: 170.000 MHz)

Failures:

Block 0, Base EDID:
  Basic Display Parameters & Features: sRGB is signaled, but the chromaticities do not match.
Block 1, Base EDID:
  Unknown Extension Block.
EDID:
  Base EDID: EDID specified 0 extension block(s), but found 1 extension block(s).

EDID conformity: FAIL
