edid-decode (hex):

00 ff ff ff ff ff ff 00 09 d1 5e 76 46 02 00 00
26 0e 01 03 08 1e 17 78 ee b4 60 a1 58 4e 97 26
16 50 54 bd ee 00 61 4c 01 01 01 01 01 01 01 01
01 01 01 01 01 01 64 19 00 40 41 00 26 30 18 88
36 00 30 e4 10 00 00 18 d5 09 80 a0 20 5e 63 10
10 60 52 08 30 e4 10 00 00 1a 00 00 00 fd 00 38
4b 1f 3f 08 0a 20 20 20 20 20 20 20 00 00 00 fc
00 42 45 4e 51 20 46 50 35 33 31 0a 20 20 00 15

00 ff ff ff ff ff ff 00 09 d1 5e 76 46 02 00 00
26 0e 01 03 08 1e 17 78 ee b4 60 a1 58 4e 97 26
16 50 54 bd ee 00 61 4c 01 01 01 01 01 01 01 01
01 01 01 01 01 01 64 19 00 40 41 00 26 30 18 88
36 00 30 e4 10 00 00 18 d5 09 80 a0 20 5e 63 10
10 60 52 08 30 e4 10 00 00 1a 00 00 00 fd 00 38
4b 1f 3f 08 0a 20 20 20 20 20 20 20 00 00 00 fc
00 42 45 4e 51 20 46 50 35 33 31 0a 20 20 00 15

----------------

Block 0, Base EDID:
  EDID Structure Version & Revision: 1.3
  Vendor & Product Identification:
    Manufacturer: BNQ
    Model: 30302
    Serial Number: ...
    Made in: week 38 of 2004
  Basic Display Parameters & Features:
    Analog display
    Signal Level Standard: 0.700 : 0.300 : 1.000 V p-p
    Blank level equals black level
    Sync: Separate
    Maximum image size: 30 cm x 23 cm
    Gamma: 2.20
    DPMS levels: Standby Suspend Off
    RGB color display
    Default (sRGB) color space is primary color space
    First detailed timing is the preferred timing
  Color Characteristics:
    Red  : 0.6308, 0.3466
    Green: 0.3056, 0.5898
    Blue : 0.1494, 0.0878
    White: 0.3125, 0.3281
  Established Timings I & II:
    IBM     :   720x400    70.081663 Hz   9:5     31.467 kHz     28.320000 MHz
    DMT 0x04:   640x480    59.940476 Hz   4:3     31.469 kHz     25.175000 MHz
    Apple   :   640x480    66.666667 Hz   4:3     35.000 kHz     30.240000 MHz
    DMT 0x05:   640x480    72.808802 Hz   4:3     37.861 kHz     31.500000 MHz
    DMT 0x06:   640x480    75.000000 Hz   4:3     37.500 kHz     31.500000 MHz
    DMT 0x09:   800x600    60.316541 Hz   4:3     37.879 kHz     40.000000 MHz
    DMT 0x0a:   800x600    72.187572 Hz   4:3     48.077 kHz     50.000000 MHz
    DMT 0x0b:   800x600    75.000000 Hz   4:3     46.875 kHz     49.500000 MHz
    Apple   :   832x624    74.551266 Hz   4:3     49.726 kHz     57.284000 MHz
    DMT 0x10:  1024x768    60.003840 Hz   4:3     48.363 kHz     65.000000 MHz
    DMT 0x11:  1024x768    70.069359 Hz   4:3     56.476 kHz     75.000000 MHz
    DMT 0x12:  1024x768    75.028582 Hz   4:3     60.023 kHz     78.750000 MHz
  Standard Timings:
    GTF     :  1024x768    72.000073 Hz   4:3     57.672 kHz     78.434000 MHz
  Detailed Timing Descriptors:
    DTD 1:  1024x768    60.003840 Hz   4:3     48.363 kHz     65.000000 MHz (304 mm x 228 mm)
                 Hfront   24 Hsync 136 Hback  160 Hpol N
                 Vfront    3 Vsync   6 Vback   29 Vpol N
    DTD 2:   640x350    70.072383 Hz  64:35    31.462 kHz     25.170000 MHz (304 mm x 228 mm)
                 Hfront   16 Hsync  96 Hback   48 Hpol P
                 Vfront   37 Vsync   2 Vback   60 Vpol N
    Display Range Limits:
      Monitor ranges (Unknown (0x0a)): 56-75 Hz V, 31-63 kHz H, max dotclock 80 MHz
    Display Product Name: 'BENQ FP531'
Checksum: 0x15

----------------

Warnings:

Block 0, Base EDID:
  Detailed Timing Descriptor #2: Image size is 304x228 mm, but based on the picture AR it should be 304x166 mm.

Failures:

Block 0, Base EDID:
  Basic Display Parameters & Features: sRGB is signaled, but the chromaticities do not match.
  Display Range Limits: Unknown range class (0x0a).
  Display Range Limits: Byte 11 is 0x20 instead of 0x0a.
EDID:
  Extension Block 1 started with EDID header, ignoring Extension Blocks >= 1.

EDID conformity: FAIL
