edid-decode (hex):

00 ff ff ff ff ff ff 00 4d 77 02 12 01 01 01 01
0a 21 01 03 e1 59 32 78 0a ee 9f a3 54 4c 99 26
0f 47 4c 21 08 00 31 40 45 40 61 40 01 01 01 01
d1 c0 01 01 01 01 64 21 56 aa 51 00 1b 30 40 70
36 00 75 f2 31 00 00 1e 02 3a 80 18 71 38 2d 40
58 2c 45 00 20 c2 31 00 00 1e 00 00 00 fc 00 54
56 20 50 48 49 4c 43 4f 0a 20 20 20 00 00 00 fd
00 31 50 0f 50 12 00 0a 20 20 20 20 20 20 01 39

02 03 31 70 4d 02 03 04 05 90 11 12 13 14 1f 20
21 22 29 09 1f 07 11 17 50 57 07 00 83 01 00 00
6c 03 0c 00 20 00 b8 2d c0 0c 0c 0c 0c e3 06 0f
01 01 1d 00 bc 52 d0 1e 20 b8 28 55 40 75 f2 31
00 00 1e 02 3a 80 18 71 38 2d 40 58 2c 45 00 20
c2 31 00 00 1e 8c 0a d0 8a 20 e0 2d 10 10 3e 96
00 75 f2 31 00 00 1e 00 00 00 00 00 00 00 00 00
00 00 00 00 00 00 00 00 00 00 00 00 00 00 00 78

00 ff ff ff ff ff ff 00 4d 77 02 12 01 01 01 01
0a 21 01 03 e1 59 32 78 0a ee 9f a3 54 4c 99 26
0f 47 4c 21 08 00 31 40 45 40 61 40 01 01 01 01
d1 c0 01 01 01 01 64 21 56 aa 51 00 1b 30 40 70
36 00 75 f2 31 00 00 1e 02 3a 80 18 71 38 2d 40
58 2c 45 00 20 c2 31 00 00 1e 00 00 00 fc 00 54
56 20 50 48 49 4c 43 4f 0a 20 20 20 00 00 00 fd
00 31 50 0f 50 12 00 0a 20 20 20 20 20 20 01 39

02 03 31 70 4d 02 03 04 05 90 11 12 13 14 1f 20
21 22 29 09 1f 07 11 17 50 57 07 00 83 01 00 00
6c 03 0c 00 20 00 b8 2d c0 0c 0c 0c 0c e3 06 0f
01 01 1d 00 bc 52 d0 1e 20 b8 28 55 40 75 f2 31
00 00 1e 02 3a 80 18 71 38 2d 40 58 2c 45 00 20
c2 31 00 00 1e 8c 0a d0 8a 20 e0 2d 10 10 3e 96
00 75 f2 31 00 00 1e 00 00 00 00 00 00 00 00 00
00 00 00 00 00 00 00 00 00 00 00 00 00 00 00 78

----------------

Block 0, Base EDID:
  EDID Structure Version & Revision: 1.3
  Vendor & Product Identification:
    Manufacturer: SKW
    Model: 4610
    Serial Number: ...
    Made in: week 10 of 2023
  Basic Display Parameters & Features:
    Digital display
    DFP 1.x compatible TMDS
    Maximum image size: 89 cm x 50 cm
    Gamma: 2.20
    RGB color display
    First detailed timing is the preferred timing
  Color Characteristics:
    Red  : 0.6396, 0.3300
    Green: 0.2998, 0.5996
    Blue : 0.1503, 0.0595
    White: 0.2802, 0.2998
  Established Timings I & II:
    DMT 0x04:   640x480    59.940476 Hz   4:3     31.469 kHz     25.175000 MHz
    DMT 0x09:   800x600    60.316541 Hz   4:3     37.879 kHz     40.000000 MHz
    DMT 0x10:  1024x768    60.003840 Hz   4:3     48.363 kHz     65.000000 MHz
  Standard Timings:
    DMT 0x04:   640x480    59.940476 Hz   4:3     31.469 kHz     25.175000 MHz
    DMT 0x09:   800x600    60.316541 Hz   4:3     37.879 kHz     40.000000 MHz
    DMT 0x10:  1024x768    60.003840 Hz   4:3     48.363 kHz     65.000000 MHz
    DMT 0x52:  1920x1080   60.000000 Hz  16:9     67.500 kHz    148.500000 MHz
  Detailed Timing Descriptors:
    DTD 1:  1366x768    60.001123 Hz 683:384   47.701 kHz     85.480000 MHz (885 mm x 498 mm)
                 Hfront   64 Hsync 112 Hback  250 Hpol P
                 Vfront    3 Vsync   6 Vback   18 Vpol P
    DTD 2:  1920x1080   60.000000 Hz  16:9     67.500 kHz    148.500000 MHz (800 mm x 450 mm)
                 Hfront   88 Hsync  44 Hback  148 Hpol P
                 Vfront    4 Vsync   5 Vback   36 Vpol P
    Display Product Name: 'TV PHILCO'
    Display Range Limits:
      Monitor ranges (GTF): 49-80 Hz V, 15-80 kHz H, max dotclock 180 MHz
  Extension blocks: 1
Checksum: 0x39

----------------

Block 1, CTA-861 Extension Block:
  Revision: 3
  Basic audio support
  Supports YCbCr 4:4:4
  Supports YCbCr 4:2:2
  Native DTDs: 0
  Video Data Block:
    VIC   2:   720x480    59.940060 Hz   4:3     31.469 kHz     27.000000 MHz
    VIC   3:   720x480    59.940060 Hz  16:9     31.469 kHz     27.000000 MHz
    VIC   4:  1280x720    60.000000 Hz  16:9     45.000 kHz     74.250000 MHz
    VIC   5:  1920x1080i  60.000000 Hz  16:9     33.750 kHz     74.250000 MHz
    VIC  16:  1920x1080   60.000000 Hz  16:9     67.500 kHz    148.500000 MHz (native)
    VIC  17:   720x576    50.000000 Hz   4:3     31.250 kHz     27.000000 MHz
    VIC  18:   720x576    50.000000 Hz  16:9     31.250 kHz     27.000000 MHz
    VIC  19:  1280x720    50.000000 Hz  16:9     37.500 kHz     74.250000 MHz
    VIC  20:  1920x1080i  50.000000 Hz  16:9     28.125 kHz     74.250000 MHz
    VIC  31:  1920x1080   50.000000 Hz  16:9     56.250 kHz    148.500000 MHz
    VIC  32:  1920x1080   24.000000 Hz  16:9     27.000 kHz     74.250000 MHz
    VIC  33:  1920x1080   25.000000 Hz  16:9     28.125 kHz     74.250000 MHz
    VIC  34:  1920x1080   30.000000 Hz  16:9     33.750 kHz     74.250000 MHz
  Audio Data Block:
    Linear PCM:
      Max channels: 2
      Supported sample rates (kHz): 96 88.2 48 44.1 32
      Supported sample sizes (bits): 24 20 16
    AC-3:
      Max channels: 2
      Supported sample rates (kHz): 96 48 44.1 32
      Maximum bit rate: 640 kb/s
    Enhanced AC-3 (DD+):
      Max channels: 8
      Supported sample rates (kHz): 48 44.1 32
  Speaker Allocation Data Block:
    FL/FR - Front Left/Right
  Vendor-Specific Data Block (HDMI), OUI 00-0C-03:
    Source physical address: 2.0.0.0
    Supports_AI
    DC_36bit
    DC_30bit
    DC_Y444
    Maximum TMDS clock: 225 MHz
    Video latency: 22 ms
    Audio latency: 22 ms
    Interlaced video latency: 22 ms
    Interlaced audio latency: 22 ms
  HDR Static Metadata Data Block:
    Electro optical transfer functions:
      Traditional gamma - SDR luminance range
      Traditional gamma - HDR luminance range
      SMPTE ST2084
      Hybrid Log-Gamma
    Supported static metadata descriptors:
      Static metadata type 1
  Detailed Timing Descriptors:
    DTD 3:  1280x720    50.000000 Hz  16:9     37.500 kHz     74.250000 MHz (885 mm x 498 mm)
                 Hfront  440 Hsync  40 Hback  220 Hpol P
                 Vfront    5 Vsync   5 Vback   20 Vpol P
    DTD 4:  1920x1080   60.000000 Hz  16:9     67.500 kHz    148.500000 MHz (800 mm x 450 mm)
                 Hfront   88 Hsync  44 Hback  148 Hpol P
                 Vfront    4 Vsync   5 Vback   36 Vpol P
    DTD 5:   720x480    59.940060 Hz   3:2     31.469 kHz     27.000000 MHz (885 mm x 498 mm)
                 Hfront   16 Hsync  62 Hback   60 Hpol P
                 Vfront    9 Vsync   6 Vback   30 Vpol P
Checksum: 0x78  Unused space in Extension Block: 24 bytes

----------------

Warnings:

Block 0, Base EDID:
  Vendor & Product Identification: The serial number is one of the known dummy values, it should probably be set to 0.
Block 1, CTA-861 Extension Block:
  IT Video Formats are overscanned by default, but normally this should be underscanned.
  Video Data Block: VIC 2 and the first DTD are not identical. Is this intended?
  Video Data Block: All VICs are in ascending order, and the first (preferred) VIC <= 4, is that intended?
  Vendor-Specific Data Block (HDMI), OUI 00-0C-03: Progressive and Interlaced latency values are identical, no need for both.
  Detailed Timing Descriptor #5: DTD is similar but not identical to VIC 2.
  Detailed Timing Descriptor #5: Image size is 885x498 mm, but based on the picture AR it should be 747x498 mm.
  Add a Colorimetry Data Block with the sRGB colorimetry bit set to avoid interop issues.
EDID:
  Base EDID: Some timings are out of range of the Monitor Ranges:
    Vertical Freq: 24.000 - 60.317 Hz (Monitor: 49.000 - 80.000 Hz)

Failures:

Block 0, Base EDID:
  Basic Display Parameters & Features: Digital Video Interface Standard set to reserved value 0x60.
  Detailed Timing Descriptor #2: Mismatch of image size 800x450 mm vs display size 890x500 mm.
Block 1, CTA-861 Extension Block:
  Detailed Timing Descriptor #4: Mismatch of image size 800x450 mm vs display size 890x500 mm.
  Missing VCDB, needed for Set Selectable RGB Quantization to avoid interop issues.
EDID:
  Extension Block 2 started with EDID header, ignoring Extension Blocks >= 2.

EDID conformity: FAIL
