edid-decode (hex):

00 ff ff ff ff ff ff 00 30 e4 4a 07 00 00 00 00
00 20 01 04 a5 27 18 78 03 0f 95 ae 52 43 b0 26
0f 50 54 00 00 00 01 01 01 01 01 01 01 01 01 01
01 01 01 01 01 01 6e 6e 00 a0 a0 40 84 60 30 20
36 00 84 f2 10 00 00 1a 00 00 00 00 00 00 00 00
00 00 00 00 00 00 00 00 00 00 00 00 00 fe 00 50
30 32 31 56 80 31 38 30 57 51 47 0a 00 00 00 00
00 02 41 1f 9e 00 03 00 00 0f 01 0a 20 20 01 90

70 20 79 02 00 22 00 14 71 dc 0b 85 ff 09 9f 00
2f 80 1f 00 3f 06 83 00 02 00 05 00 25 01 09 71
dc 0b 71 dc 0b 3c a5 80 81 00 13 72 1a 00 00 03
01 3c a5 00 00 53 51 53 51 a5 00 00 00 00 00 00
00 00 00 00 00 00 00 00 00 00 00 00 00 00 00 00
00 00 00 00 00 00 00 00 00 00 00 00 00 00 00 00
00 00 00 00 00 00 00 00 00 00 00 00 00 00 00 00
00 00 00 00 00 00 00 00 00 00 00 00 00 00 dc 90

00 ff ff ff ff ff ff 00 30 e4 4a 07 00 00 00 00
00 20 01 04 a5 27 18 78 03 0f 95 ae 52 43 b0 26
0f 50 54 00 00 00 01 01 01 01 01 01 01 01 01 01
01 01 01 01 01 01 6e 6e 00 a0 a0 40 84 60 30 20
36 00 84 f2 10 00 00 1a 00 00 00 00 00 00 00 00
00 00 00 00 00 00 00 00 00 00 00 00 00 fe 00 50
30 32 31 56 80 31 38 30 57 51 47 0a 00 00 00 00
00 02 41 1f 9e 00 03 00 00 0f 01 0a 20 20 01 90

70 20 79 02 00 22 00 14 71 dc 0b 85 ff 09 9f 00
2f 80 1f 00 3f 06 83 00 02 00 05 00 25 01 09 71
dc 0b 71 dc 0b 3c a5 80 81 00 13 72 1a 00 00 03
01 3c a5 00 00 53 51 53 51 a5 00 00 00 00 00 00
00 00 00 00 00 00 00 00 00 00 00 00 00 00 00 00
00 00 00 00 00 00 00 00 00 00 00 00 00 00 00 00
00 00 00 00 00 00 00 00 00 00 00 00 00 00 00 00
00 00 00 00 00 00 00 00 00 00 00 00 00 00 dc 90

----------------

Block 0, Base EDID:
  EDID Structure Version & Revision: 1.4
  Vendor & Product Identification:
    Manufacturer: LGD
    Model: 1866
    Made in: 2022
  Basic Display Parameters & Features:
    Digital display
    Bits per primary color channel: 8
    DisplayPort interface
    Maximum image size: 39 cm x 24 cm
    Gamma: 2.20
    Supported color formats: RGB 4:4:4
    First detailed timing includes the native pixel format and preferred refresh rate
    Display supports continuous frequencies
  Color Characteristics:
    Red  : 0.6796, 0.3203
    Green: 0.2646, 0.6904
    Blue : 0.1503, 0.0595
    White: 0.3134, 0.3291
  Established Timings I & II: none
  Standard Timings: none
  Detailed Timing Descriptors:
    DTD 1:  2560x1600   60.007981 Hz  16:10   103.934 kHz    282.700000 MHz (388 mm x 242 mm)
                 Hfront   48 Hsync  32 Hback   80 Hpol P
                 Vfront    3 Vsync   6 Vback  123 Vpol N
    Empty Descriptor
    Alphanumeric Data String: 'P021V.180WQG'
    Manufacturer-Specified Display Descriptor (0x00): 00 00 00 02 41 1f 9e 00 03 00 00 0f 01 0a 20 20 '....A.........  '
  Extension blocks: 1
Checksum: 0x90

----------------

Block 1, DisplayID Extension Block:
  Version: 2.0
  Extension Count: 0
  Display Product Primary Use Case: None of the listed primary use cases; generic display
  Video Timing Modes Type 7 - Detailed Timings Data Block:
    DTD:  2560x1600  165.001783 Hz  16:10   285.783 kHz    777.330000 MHz (aspect 16:10, no 3D stereo, preferred)
               Hfront   48 Hsync  32 Hback   80 Hpol P
               Vfront    3 Vsync   6 Vback  123 Vpol N
  Dynamic Video Timing Range Limits Data Block:
    Minimum Pixel Clock: 777330 kHz
    Maximum Pixel Clock: 777330 kHz
    Minimum Vertical Refresh Rate: 60 Hz
    Maximum Vertical Refresh Rate: 165 Hz
    Seamless Dynamic Video Timing Support: Yes
  CTA-861 DisplayID Data Block:
  Vendor-Specific Data Block (AMD), OUI 00-00-1A:
    Version: 3
    Flags 1: 0x01
      FreeSync Supported
    Minimum Refresh Rate: 60 Hz
    Maximum Refresh Rate: 165 Hz
    Flags 5: 0x00
  Checksum: 0xdc
Checksum: 0x90

----------------

Warnings:

Block 0, Base EDID:
  Alphanumeric Data String: Non-ASCII character 0x80 at position 5, can cause problems.
  Missing Display Product Name.

Failures:

Block 0, Base EDID:
  Empty Descriptor: Use Dummy Descriptor instead of all zeroes.
  Missing Display Range Limits Descriptor.
EDID:
  Extension Block 2 started with EDID header, ignoring Extension Blocks >= 2.
  DisplayID: Missing DisplayID Display Parameters Data Block.

EDID conformity: FAIL
