edid-decode (hex):

00 ff ff ff ff ff ff 00 4d 10 5a 14 4d 0f aa cd
31 19 01 04 a5 26 15 78 0e df 50 a3 54 35 b5 26
0f 50 54 00 00 00 01 01 01 01 01 01 01 01 01 01
01 01 01 01 01 01 4d d0 00 a0 f0 70 3e 80 30 20
a5 00 7e d7 10 00 00 1a 4d d0 00 a0 f0 70 ec 88
30 20 f5 08 7e d7 10 00 00 1a 00 00 00 fc 00 43
52 58 31 32 30 30 20 20 20 20 20 20 00 00 00 ff
00 4c 51 31 37 33 44 31 4a 57 33 33 0a 20 00 c5

----------------

Block 0, Base EDID:
  EDID Structure Version & Revision: 1.4
  Vendor & Product Identification:
    Manufacturer: SHP
    Model: 5210
    Serial Number: ...
    Made in: week 49 of 2015
  Basic Display Parameters & Features:
    Digital display
    Bits per primary color channel: 8
    DisplayPort interface
    Maximum image size: 38 cm x 21 cm
    Gamma: 2.20
    Supported color formats: RGB 4:4:4, YCrCb 4:4:4
    Default (sRGB) color space is primary color space
    First detailed timing includes the native pixel format and preferred refresh rate
  Color Characteristics:
    Red  : 0.6396, 0.3291
    Green: 0.2099, 0.7099
    Blue : 0.1494, 0.0595
    White: 0.3125, 0.3281
  Established Timings I & II: none
  Standard Timings: none
  Detailed Timing Descriptors:
    DTD 1:  3840x2160   59.996625 Hz  16:9    133.312 kHz    533.250000 MHz (382 mm x 215 mm)
                 Hfront   48 Hsync  32 Hback   80 Hpol P
                 Vfront   10 Vsync   5 Vback   47 Vpol N
    DTD 2:  3840x2160   29.998312 Hz  16:9    133.312 kHz    533.250000 MHz (382 mm x 215 mm)
                 Hfront   48 Hsync  32 Hback   80 Hpol P
                 Vfront   47 Vsync   5 Vback 2232 Vpol N
    Display Product Name: 'CRX1200      '
    Display Product Serial Number: ...
Checksum: 0xc5

----------------

Failures:

Block 0, Base EDID:
  Basic Display Parameters & Features: sRGB is signaled, but the chromaticities do not match.
  Display Product Name: No newline, but one or more trailing spaces.

EDID conformity: FAIL
