edid-decode (hex):

00 ff ff ff ff ff ff 00 41 0c 17 c2 e7 03 00 00
0d 1e 01 03 80 3c 22 78 2a 67 a5 a5 55 4d a2 27
0e 50 54 bf ef 00 d1 c0 b3 00 95 00 81 80 81 40
81 c0 01 01 01 01 04 74 00 30 f2 70 5a 80 b0 58
8a 00 72 10 53 00 00 1e 02 3a 80 18 71 38 2d 40
58 2c 45 00 72 10 53 00 00 1e 00 00 00 fc 00 50
48 4c 20 32 37 38 45 31 0a 20 20 20 00 00 00 fd
00 17 4b 1e a0 22 00 0a 20 20 20 20 20 20 01 51

02 03 27 f4 4a 90 04 03 1f 13 01 12 5d 5e 5f 23
09 07 07 83 01 00 00 67 03 0c 00 10 00 18 3c 67
d8 5d c4 01 44 80 21 6c 84 00 ee fa 70 3e 80 30
20 35 00 72 10 53 00 00 1a 56 5e 00 a0 a0 a0 29
50 30 20 35 00 72 10 53 00 00 1e 01 1d 00 72 51
d0 1e 20 6e 28 55 00 72 10 53 00 00 1e 4d 6c 80
a0 70 70 3e 80 30 20 3a 00 72 10 53 00 00 1a 00
00 00 00 00 00 00 00 00 00 00 00 00 00 00 00 06

00 ff ff ff ff ff ff 00 41 0c 17 c2 e7 03 00 00
0d 1e 01 03 80 3c 22 78 2a 67 a5 a5 55 4d a2 27
0e 50 54 bf ef 00 d1 c0 b3 00 95 00 81 80 81 40
81 c0 01 01 01 01 04 74 00 30 f2 70 5a 80 b0 58
8a 00 72 10 53 00 00 1e 02 3a 80 18 71 38 2d 40
58 2c 45 00 72 10 53 00 00 1e 00 00 00 fc 00 50
48 4c 20 32 37 38 45 31 0a 20 20 20 00 00 00 fd
00 17 4b 1e a0 22 00 0a 20 20 20 20 20 20 01 51

02 03 27 f4 4a 90 04 03 1f 13 01 12 5d 5e 5f 23
09 07 07 83 01 00 00 67 03 0c 00 10 00 18 3c 67
d8 5d c4 01 44 80 21 6c 84 00 ee fa 70 3e 80 30
20 35 00 72 10 53 00 00 1a 56 5e 00 a0 a0 a0 29
50 30 20 35 00 72 10 53 00 00 1e 01 1d 00 72 51
d0 1e 20 6e 28 55 00 72 10 53 00 00 1e 4d 6c 80
a0 70 70 3e 80 30 20 3a 00 72 10 53 00 00 1a 00
00 00 00 00 00 00 00 00 00 00 00 00 00 00 00 06

----------------

Block 0, Base EDID:
  EDID Structure Version & Revision: 1.3
  Vendor & Product Identification:
    Manufacturer: PHL
    Model: 49687
    Serial Number: ...
    Made in: week 13 of 2020
  Basic Display Parameters & Features:
    Digital display
    Maximum image size: 60 cm x 34 cm
    Gamma: 2.20
    DPMS levels: Off
    RGB color display
    First detailed timing is the preferred timing
  Color Characteristics:
    Red  : 0.6455, 0.3339
    Green: 0.3017, 0.6357
    Blue : 0.1542, 0.0566
    White: 0.3134, 0.3291
  Established Timings I & II:
    IBM     :   720x400    70.081663 Hz   9:5     31.467 kHz     28.320000 MHz
    DMT 0x04:   640x480    59.940476 Hz   4:3     31.469 kHz     25.175000 MHz
    Apple   :   640x480    66.666667 Hz   4:3     35.000 kHz     30.240000 MHz
    DMT 0x05:   640x480    72.808802 Hz   4:3     37.861 kHz     31.500000 MHz
    DMT 0x06:   640x480    75.000000 Hz   4:3     37.500 kHz     31.500000 MHz
    DMT 0x08:   800x600    56.250000 Hz   4:3     35.156 kHz     36.000000 MHz
    DMT 0x09:   800x600    60.316541 Hz   4:3     37.879 kHz     40.000000 MHz
    DMT 0x0a:   800x600    72.187572 Hz   4:3     48.077 kHz     50.000000 MHz
    DMT 0x0b:   800x600    75.000000 Hz   4:3     46.875 kHz     49.500000 MHz
    Apple   :   832x624    74.551266 Hz   4:3     49.726 kHz     57.284000 MHz
    DMT 0x10:  1024x768    60.003840 Hz   4:3     48.363 kHz     65.000000 MHz
    DMT 0x11:  1024x768    70.069359 Hz   4:3     56.476 kHz     75.000000 MHz
    DMT 0x12:  1024x768    75.028582 Hz   4:3     60.023 kHz     78.750000 MHz
    DMT 0x24:  1280x1024   75.024675 Hz   5:4     79.976 kHz    135.000000 MHz
  Standard Timings:
    DMT 0x52:  1920x1080   60.000000 Hz  16:9     67.500 kHz    148.500000 MHz
    DMT 0x3a:  1680x1050   59.954250 Hz  16:10    65.290 kHz    146.250000 MHz
    DMT 0x2f:  1440x900    59.887445 Hz  16:10    55.935 kHz    106.500000 MHz
    DMT 0x23:  1280x1024   60.019740 Hz   5:4     63.981 kHz    108.000000 MHz
    DMT 0x20:  1280x960    60.000000 Hz   4:3     60.000 kHz    108.000000 MHz
    DMT 0x55:  1280x720    60.000000 Hz  16:9     45.000 kHz     74.250000 MHz
  Detailed Timing Descriptors:
    DTD  1:  3840x2160   30.000000 Hz  16:9     67.500 kHz    297.000000 MHz (1394 mm x 784 mm)
                  Hfront  176 Hsync  88 Hback  296 Hpol P
                  Vfront    8 Vsync  10 Vback   72 Vpol P
    DTD  2:  1920x1080   60.000000 Hz  16:9     67.500 kHz    148.500000 MHz (1394 mm x 784 mm)
                  Hfront   88 Hsync  44 Hback  148 Hpol P
                  Vfront    4 Vsync   5 Vback   36 Vpol P
    Display Product Name: 'PHL 278E1'
    Display Range Limits:
      Monitor ranges (GTF): 23-75 Hz V, 30-160 kHz H, max dotclock 340 MHz
  Extension blocks: 1
Checksum: 0x51

----------------

Block 1, CTA-861 Extension Block:
  Revision: 3
  Underscans IT Video Formats by default
  Basic audio support
  Supports YCbCr 4:4:4
  Supports YCbCr 4:2:2
  Native detailed modes: 4
  Video Data Block:
    VIC  16:  1920x1080   60.000000 Hz  16:9     67.500 kHz    148.500000 MHz (native)
    VIC   4:  1280x720    60.000000 Hz  16:9     45.000 kHz     74.250000 MHz
    VIC   3:   720x480    59.940060 Hz  16:9     31.469 kHz     27.000000 MHz
    VIC  31:  1920x1080   50.000000 Hz  16:9     56.250 kHz    148.500000 MHz
    VIC  19:  1280x720    50.000000 Hz  16:9     37.500 kHz     74.250000 MHz
    VIC   1:   640x480    59.940476 Hz   4:3     31.469 kHz     25.175000 MHz
    VIC  18:   720x576    50.000000 Hz  16:9     31.250 kHz     27.000000 MHz
    VIC  93:  3840x2160   24.000000 Hz  16:9     54.000 kHz    297.000000 MHz
    VIC  94:  3840x2160   25.000000 Hz  16:9     56.250 kHz    297.000000 MHz
    VIC  95:  3840x2160   30.000000 Hz  16:9     67.500 kHz    297.000000 MHz
  Audio Data Block:
    Linear PCM:
      Max channels: 2
      Supported sample rates (kHz): 48 44.1 32
      Supported sample sizes (bits): 24 20 16
  Speaker Allocation Data Block:
    FL/FR - Front Left/Right
  Vendor-Specific Data Block (HDMI), OUI 00-0C-03:
    Source physical address: 1.0.0.0
    DC_30bit
    DC_Y444
    Maximum TMDS clock: 300 MHz
  Vendor-Specific Data Block (HDMI Forum), OUI C4-5D-D8:
    Version: 1
    Maximum TMDS Character Rate: 340 MHz
    SCDC Present
    Max Fixed Rate Link: 3 and 6 Gbps per lane on 3 lanes
    Supports 10-bits/component Deep Color 4:2:0 Pixel Encoding
  Detailed Timing Descriptors:
    DTD  3:  3840x2160   22.983618 Hz  16:9     51.070 kHz    339.000000 MHz (1394 mm x 784 mm)
                  Hfront   48 Hsync  32 Hback 2718 Hpol P
                  Vfront    3 Vsync   5 Vback   54 Vpol N
    DTD  4:  2560x1440   59.950550 Hz  16:9     88.787 kHz    241.500000 MHz (1394 mm x 784 mm)
                  Hfront   48 Hsync  32 Hback   80 Hpol P
                  Vfront    3 Vsync   5 Vback   33 Vpol P
    DTD  5:  1280x720    60.000000 Hz  16:9     45.000 kHz     74.250000 MHz (1394 mm x 784 mm)
                  Hfront  110 Hsync  40 Hback  220 Hpol P
                  Vfront    5 Vsync   5 Vback   20 Vpol P
    DTD  6:  1920x2160   59.987970 Hz   8:9    133.293 kHz    277.250000 MHz (1394 mm x 784 mm)
                  Hfront   48 Hsync  32 Hback   80 Hpol P
                  Vfront    3 Vsync  10 Vback   49 Vpol N
Checksum: 0x06  Unused space in Extension Block: 16 bytes

----------------

Block 2, Unknown EDID Extension Block 0x00:
  00 ff ff ff ff ff ff 00 41 0c 17 c2 e7 03 00 00 '........A.......'
  0d 1e 01 03 80 3c 22 78 2a 67 a5 a5 55 4d a2 27 '.....<"x*g..UM.''
  0e 50 54 bf ef 00 d1 c0 b3 00 95 00 81 80 81 40 '.PT............@'
  81 c0 01 01 01 01 04 74 00 30 f2 70 5a 80 b0 58 '.......t.0.pZ..X'
  8a 00 72 10 53 00 00 1e 02 3a 80 18 71 38 2d 40 '..r.S....:..q8-@'
  58 2c 45 00 72 10 53 00 00 1e 00 00 00 fc 00 50 'X,E.r.S........P'
  48 4c 20 32 37 38 45 31 0a 20 20 20 00 00 00 fd 'HL 278E1.   ....'
  00 17 4b 1e a0 22 00 0a 20 20 20 20 20 20 01 51 '..K.."..      .Q'
Checksum: 0x51

----------------

Block 3, CTA-861 Extension Block:
  Revision: 3
  Underscans IT Video Formats by default
  Basic audio support
  Supports YCbCr 4:4:4
  Supports YCbCr 4:2:2
  Native detailed modes: 4
  Video Data Block:
    VIC  16:  1920x1080   60.000000 Hz  16:9     67.500 kHz    148.500000 MHz (native)
    VIC   4:  1280x720    60.000000 Hz  16:9     45.000 kHz     74.250000 MHz
    VIC   3:   720x480    59.940060 Hz  16:9     31.469 kHz     27.000000 MHz
    VIC  31:  1920x1080   50.000000 Hz  16:9     56.250 kHz    148.500000 MHz
    VIC  19:  1280x720    50.000000 Hz  16:9     37.500 kHz     74.250000 MHz
    VIC   1:   640x480    59.940476 Hz   4:3     31.469 kHz     25.175000 MHz
    VIC  18:   720x576    50.000000 Hz  16:9     31.250 kHz     27.000000 MHz
    VIC  93:  3840x2160   24.000000 Hz  16:9     54.000 kHz    297.000000 MHz
    VIC  94:  3840x2160   25.000000 Hz  16:9     56.250 kHz    297.000000 MHz
    VIC  95:  3840x2160   30.000000 Hz  16:9     67.500 kHz    297.000000 MHz
  Audio Data Block:
    Linear PCM:
      Max channels: 2
      Supported sample rates (kHz): 48 44.1 32
      Supported sample sizes (bits): 24 20 16
  Speaker Allocation Data Block:
    FL/FR - Front Left/Right
  Vendor-Specific Data Block (HDMI), OUI 00-0C-03:
    Source physical address: 1.0.0.0
    DC_30bit
    DC_Y444
    Maximum TMDS clock: 300 MHz
  Vendor-Specific Data Block (HDMI Forum), OUI C4-5D-D8:
    Version: 1
    Maximum TMDS Character Rate: 340 MHz
    SCDC Present
    Max Fixed Rate Link: 3 and 6 Gbps per lane on 3 lanes
    Supports 10-bits/component Deep Color 4:2:0 Pixel Encoding
  Detailed Timing Descriptors:
    DTD  7:  3840x2160   22.983618 Hz  16:9     51.070 kHz    339.000000 MHz (1394 mm x 784 mm)
                  Hfront   48 Hsync  32 Hback 2718 Hpol P
                  Vfront    3 Vsync   5 Vback   54 Vpol N
    DTD  8:  2560x1440   59.950550 Hz  16:9     88.787 kHz    241.500000 MHz (1394 mm x 784 mm)
                  Hfront   48 Hsync  32 Hback   80 Hpol P
                  Vfront    3 Vsync   5 Vback   33 Vpol P
    DTD  9:  1280x720    60.000000 Hz  16:9     45.000 kHz     74.250000 MHz (1394 mm x 784 mm)
                  Hfront  110 Hsync  40 Hback  220 Hpol P
                  Vfront    5 Vsync   5 Vback   20 Vpol P
    DTD 10:  1920x2160   59.987970 Hz   8:9    133.293 kHz    277.250000 MHz (1394 mm x 784 mm)
                  Hfront   48 Hsync  32 Hback   80 Hpol P
                  Vfront    3 Vsync  10 Vback   49 Vpol N
Checksum: 0x06  Unused space in Extension Block: 16 bytes

----------------

Warnings:

Block 1, CTA-861 Extension Block:
  Video Data Block: VIC 16 and the first DTD are not identical. Is this intended?
  Detailed Timing Descriptor #6: Image size is 1394x784 mm, but based on the picture AR it should be 1394x1568 mm.
  Add a Colorimetry Data Block with the sRGB colorimetry bit set to avoid interop issues.
Block 3, CTA-861 Extension Block:
  Detailed Timing Descriptor #10: Image size is 1394x784 mm, but based on the picture AR it should be 1394x1568 mm.

Failures:

Block 0, Base EDID:
  Detailed Timing Descriptor #1: Mismatch of image size 1394x784 mm vs display size 600x340 mm.
  Detailed Timing Descriptor #2: Mismatch of image size 1394x784 mm vs display size 600x340 mm.
Block 1, CTA-861 Extension Block:
  Vendor-Specific Data Block (HDMI Forum), OUI C4-5D-D8: Max TMDS rate is > 0 and <= 340 or > 600.
  Vendor-Specific Data Block (HDMI Forum), OUI C4-5D-D8: Max Fixed Rate Link is >= 2, but Max TMDS rate < 600.
  Detailed Timing Descriptor #3: Mismatch of image size 1394x784 mm vs display size 600x340 mm.
  Detailed Timing Descriptor #4: Mismatch of image size 1394x784 mm vs display size 600x340 mm.
  Detailed Timing Descriptor #5: Mismatch of image size 1394x784 mm vs display size 600x340 mm.
  Detailed Timing Descriptor #6: Mismatch of image size 1394x784 mm vs display size 600x340 mm.
  Missing VCDB, needed for Set Selectable RGB Quantization to avoid interop issues.
Block 2, Base EDID:
  Unknown Extension Block.
Block 3, CTA-861 Extension Block:
  Video Data Block: Duplicate VIC 16.
  Video Data Block: Duplicate VIC 4.
  Video Data Block: Duplicate VIC 3.
  Video Data Block: Duplicate VIC 31.
  Video Data Block: Duplicate VIC 19.
  Video Data Block: Duplicate VIC 1.
  Video Data Block: Duplicate VIC 18.
  Video Data Block: Duplicate VIC 93.
  Video Data Block: Duplicate VIC 94.
  Video Data Block: Duplicate VIC 95.
  Speaker Allocation Data Block: Only one instance of this Data Block is allowed.
  Vendor-Specific Data Block (HDMI Forum), OUI C4-5D-D8: Duplicate HDMI Forum VSDB/SCDB.
  Vendor-Specific Data Block (HDMI Forum), OUI C4-5D-D8: Max TMDS rate is > 0 and <= 340 or > 600.
  Vendor-Specific Data Block (HDMI Forum), OUI C4-5D-D8: Max Fixed Rate Link is >= 2, but Max TMDS rate < 600.
  Detailed Timing Descriptor #7: Mismatch of image size 1394x784 mm vs display size 600x340 mm.
  Detailed Timing Descriptor #8: Mismatch of image size 1394x784 mm vs display size 600x340 mm.
  Detailed Timing Descriptor #9: Mismatch of image size 1394x784 mm vs display size 600x340 mm.
  Detailed Timing Descriptor #10: Mismatch of image size 1394x784 mm vs display size 600x340 mm.
EDID:
  Base EDID: The DTD max image size is 1394x784mm, which is larger than the display size 600.0x340.0mm.
  Base EDID: EDID specified 1 extension block(s), but found 3 extension block(s).
  Base EDID: EDID 1.3 requires a Block Map Extension in Block 1 if there are more than 2 blocks in the EDID.
  CTA-861: Native progressive timings are a mix of several resolutions.

EDID conformity: FAIL
