edid-decode (hex):

00 ff ff ff ff ff ff 00 06 10 21 92 e6 c7 01 02
27 12 01 03 80 40 28 78 28 fe 85 a3 57 4a 9c 25
13 50 54 00 00 00 01 01 01 01 01 01 01 01 01 01
01 01 01 01 01 01 bc 1b 00 a0 50 20 17 30 30 20
36 00 81 91 21 00 00 1a b0 68 00 a0 a0 40 2e 60
30 20 36 00 81 91 21 00 00 1a 00 00 00 ff 00 43
59 38 33 39 30 32 42 58 4d 50 0a 00 00 00 00 fc
00 43 69 6e 65 6d 61 20 48 44 0a 00 00 00 01 9d

40 01 03 00 00 00 00 c8 48 01 a5 00 a5 00 01 02
03 19 19 a8 00 00 00 00 00 00 40 00 00 00 00 00
00 00 00 00 00 00 00 00 00 00 00 00 00 00 00 00
00 00 00 00 00 00 00 00 00 00 00 00 00 00 00 00
00 00 00 00 00 00 00 00 00 00 00 00 00 00 00 00
00 00 00 00 00 00 00 00 00 00 00 00 00 00 00 00
00 00 00 00 00 00 00 00 00 00 00 00 00 00 00 00
00 00 00 00 00 00 00 00 00 00 00 00 00 00 00 41

00 ff ff ff ff ff ff 00 06 10 21 92 e6 c7 01 02
27 12 01 03 80 40 28 78 28 fe 85 a3 57 4a 9c 25
13 50 54 00 00 00 01 01 01 01 01 01 01 01 01 01
01 01 01 01 01 01 bc 1b 00 a0 50 20 17 30 30 20
36 00 81 91 21 00 00 1a b0 68 00 a0 a0 40 2e 60
30 20 36 00 81 91 21 00 00 1a 00 00 00 ff 00 43
59 38 33 39 30 32 42 58 4d 50 0a 00 00 00 00 fc
00 43 69 6e 65 6d 61 20 48 44 0a 00 00 00 01 9d

40 01 03 00 00 00 00 c8 48 01 a5 00 a5 00 01 02
03 19 19 a8 00 00 00 00 00 00 40 00 00 00 00 00
00 00 00 00 00 00 00 00 00 00 00 00 00 00 00 00
00 00 00 00 00 00 00 00 00 00 00 00 00 00 00 00
00 00 00 00 00 00 00 00 00 00 00 00 00 00 00 00
00 00 00 00 00 00 00 00 00 00 00 00 00 00 00 00
00 00 00 00 00 00 00 00 00 00 00 00 00 00 00 00
00 00 00 00 00 00 00 00 00 00 00 00 00 00 00 41

----------------

Block 0, Base EDID:
  EDID Structure Version & Revision: 1.3
  Vendor & Product Identification:
    Manufacturer: APP
    Model: 37409
    Serial Number: ...
    Made in: week 39 of 2008
  Basic Display Parameters & Features:
    Digital display
    Maximum image size: 64 cm x 40 cm
    Gamma: 2.20
    DPMS levels: Off
    RGB color display
  Color Characteristics:
    Red  : 0.6396, 0.3427
    Green: 0.2919, 0.6113
    Blue : 0.1464, 0.0742
    White: 0.3134, 0.3291
  Established Timings I & II: none
  Standard Timings: none
  Detailed Timing Descriptors:
    DTD 1:  1280x800    59.909545 Hz  16:10    49.306 kHz     71.000000 MHz (641 mm x 401 mm)
                 Hfront   48 Hsync  32 Hback   80 Hpol P
                 Vfront    3 Vsync   6 Vback   14 Vpol N
    DTD 2:  2560x1600   59.859910 Hz  16:10    98.529 kHz    268.000000 MHz (641 mm x 401 mm)
                 Hfront   48 Hsync  32 Hback   80 Hpol P
                 Vfront    3 Vsync   6 Vback   37 Vpol N
    Display Product Serial Number: ...
    Display Product Name: 'Cinema HD'
  Extension blocks: 1
Checksum: 0x9d

----------------

Block 1, Display Information Extension Block:
  Version: 1
  Digital Interface:
    Supported Digital Interface: DVI Dual Link - High Resolution
    Data Enable Signal Usage Available
    Data Enable Signal High
    Edge of Shift Clock: Not specified
    HDCP is supported
    Digital Receivers do not support Double Clocking of Input Data
    Packetized Digital Video is not supported
    Data Formats: 48-Bit MSB-Aligned RGB (Dual Link - High Resolution)
    Minimum Pixel Clock Frequency Per Link: 1 MHz
    Maximum Pixel Clock Frequency Per Link: 165 MHz
    Crossover Frequency: 165 MHz
  Display Device:
    Sub-Pixel Layout: RGB
    Sub-Pixel Configuration: Stripe
    Sub-Pixel Shape: Rectangular
    Horizontal Dot/Pixel Pitch: 0.25 mm
    Vertical Dot/Pixel Pitch: 0.25 mm
    Display Device has a Fixed Pixel Format
    View Direction: Direct
    Display Device uses non-transparent background
    Physical Implementation: Desktop or personal display
    Monitor/display does not support DDC/CI
  Display Capabities & Feature Support Set:
    Legacy Modes: Not all VGA/DOS Legacy Timing Modes are supported
    Stereo Video: No direct stereo
    Scaler On Board: No
    Image Centering: No
    Conditional Update: No
    Interlaced Video: No
    Frame Lock: No
    Frame Rate Conversion: Not supported
    Vertical Frequency: Not available
    Horizontal Frequency: Not available
    Display/Scan Orientation Definition Type: Fixed Orientation
    Screen Orientation: Landscape
    Zero Pixel Location: Upper Left
    Scan Direction: Not defined
    Standalone Projector: No
    Default Color/Luminance Decoding: Not defined
    Preferred Color/Luminance Decoder: Uses Default Decoding
    Color/Luminance Decoding Capabilities: None
    Dithering: No
    Supported Color Bit-Depth of Sub-Channel 0 (Blue): No Information
    Supported Color Bit-Depth of Sub-Channel 1 (Green): No Information
    Supported Color Bit-Depth of Sub-Channel 2 (Red): No Information
    Supported Color Bit-Depth of Sub-Channel 0 (Cb/Pb): No Information
    Supported Color Bit-Depth of Sub-Channel 1 (Y): No Information
    Supported Color Bit-Depth of Sub-Channel 2 (Cr/Pr): No Information
    Aspect Ratio Conversion Modes: None
  Display Transfer Characteristics - Gamma:
    No Display Transfer Characteristics
Checksum: 0x41

----------------

Block 2, Unknown EDID Extension Block 0x00:
  00 ff ff ff ff ff ff 00 06 10 21 92 e6 c7 01 02 '..........!.....'
  27 12 01 03 80 40 28 78 28 fe 85 a3 57 4a 9c 25 ''....@(x(...WJ.%'
  13 50 54 00 00 00 01 01 01 01 01 01 01 01 01 01 '.PT.............'
  01 01 01 01 01 01 bc 1b 00 a0 50 20 17 30 30 20 '..........P .00 '
  36 00 81 91 21 00 00 1a b0 68 00 a0 a0 40 2e 60 '6...!....h...@.`'
  30 20 36 00 81 91 21 00 00 1a 00 00 00 ff 00 43 '0 6...!........C'
  59 38 33 39 30 32 42 58 4d 50 0a 00 00 00 00 fc 'Y83902BXMP......'
  00 43 69 6e 65 6d 61 20 48 44 0a 00 00 00 01 9d '.Cinema HD......'
Checksum: 0x9d

----------------

Block 3, Display Information Extension Block:
  Version: 1
  Digital Interface:
    Supported Digital Interface: DVI Dual Link - High Resolution
    Data Enable Signal Usage Available
    Data Enable Signal High
    Edge of Shift Clock: Not specified
    HDCP is supported
    Digital Receivers do not support Double Clocking of Input Data
    Packetized Digital Video is not supported
    Data Formats: 48-Bit MSB-Aligned RGB (Dual Link - High Resolution)
    Minimum Pixel Clock Frequency Per Link: 1 MHz
    Maximum Pixel Clock Frequency Per Link: 165 MHz
    Crossover Frequency: 165 MHz
  Display Device:
    Sub-Pixel Layout: RGB
    Sub-Pixel Configuration: Stripe
    Sub-Pixel Shape: Rectangular
    Horizontal Dot/Pixel Pitch: 0.25 mm
    Vertical Dot/Pixel Pitch: 0.25 mm
    Display Device has a Fixed Pixel Format
    View Direction: Direct
    Display Device uses non-transparent background
    Physical Implementation: Desktop or personal display
    Monitor/display does not support DDC/CI
  Display Capabities & Feature Support Set:
    Legacy Modes: Not all VGA/DOS Legacy Timing Modes are supported
    Stereo Video: No direct stereo
    Scaler On Board: No
    Image Centering: No
    Conditional Update: No
    Interlaced Video: No
    Frame Lock: No
    Frame Rate Conversion: Not supported
    Vertical Frequency: Not available
    Horizontal Frequency: Not available
    Display/Scan Orientation Definition Type: Fixed Orientation
    Screen Orientation: Landscape
    Zero Pixel Location: Upper Left
    Scan Direction: Not defined
    Standalone Projector: No
    Default Color/Luminance Decoding: Not defined
    Preferred Color/Luminance Decoder: Uses Default Decoding
    Color/Luminance Decoding Capabilities: None
    Dithering: No
    Supported Color Bit-Depth of Sub-Channel 0 (Blue): No Information
    Supported Color Bit-Depth of Sub-Channel 1 (Green): No Information
    Supported Color Bit-Depth of Sub-Channel 2 (Red): No Information
    Supported Color Bit-Depth of Sub-Channel 0 (Cb/Pb): No Information
    Supported Color Bit-Depth of Sub-Channel 1 (Y): No Information
    Supported Color Bit-Depth of Sub-Channel 2 (Cr/Pr): No Information
    Aspect Ratio Conversion Modes: None
  Display Transfer Characteristics - Gamma:
    No Display Transfer Characteristics
Checksum: 0x41

----------------

Warnings:

EDID:
  No Native Video Resolution was defined.

Failures:

Block 0, Base EDID:
  Display Product Serial Number: ...
  Basic Display Parameters & Features: EDID 1.3 requires that the first detailed timing is the preferred timing.
  Display Product Name: Non-space after newline.
  Missing Display Range Limits Descriptor.
Block 2, Base EDID:
  Unknown Extension Block.
EDID:
  Base EDID: EDID specified 1 extension block(s), but found 3 extension block(s).
  Base EDID: EDID 1.3 requires a Block Map Extension in Block 1 if there are more than 2 blocks in the EDID.

EDID conformity: FAIL
