edid-decode (hex):

00 ff ff ff ff ff ff 00 3a c4 00 08 00 00 00 00
2d 0c 01 03 80 20 14 00 ea a8 e0 99 57 4b 92 25
1c 50 54 00 00 00 01 01 01 01 01 01 01 01 01 01
01 01 01 01 01 01 ee 1a 00 80 50 20 10 30 10 30
13 00 42 c9 10 00 00 18 00 00 00 fc 00 4e 76 69
64 69 61 20 44 65 66 61 75 6c 00 00 00 fc 00 74
20 46 6c 61 74 20 50 61 6e 65 6c 00 00 00 00 fd
00 00 3d 1d 31 07 00 00 20 20 20 20 20 00 00 ff

----------------

Block 0, Base EDID:
  EDID Structure Version & Revision: 1.3
  Vendor & Product Identification:
    Manufacturer: NVD
    Model: 2048
    Made in: week 45 of 2002
  Basic Display Parameters & Features:
    Digital display
    Maximum image size: 32 cm x 20 cm
    Gamma: 1.00
    DPMS levels: Standby Suspend Off
    RGB color display
    First detailed timing is the preferred timing
  Color Characteristics:
    Red  : 0.5996, 0.3417
    Green: 0.2949, 0.5703
    Blue : 0.1474, 0.1113
    White: 0.3125, 0.3281
  Established Timings I & II: none
  Standard Timings: none
  Detailed Timing Descriptors:
    DTD 1:  1280x800    60.003760 Hz  16:10    48.963 kHz     68.940000 MHz (322 mm x 201 mm)
                 Hfront   16 Hsync  48 Hback   64 Hpol N
                 Vfront    1 Vsync   3 Vback   12 Vpol N
    Display Product Name: 'Nvidia Defaul'
    Display Product Name: 't Flat Panel'
    Display Range Limits:
      Monitor ranges (GTF): 0-61 Hz V, 29-49 kHz H, max dotclock 70 MHz
Checksum: 0xff

----------------

Failures:

Block 0, Base EDID:
  Display Product Name: NUL byte at position 12.
  Display Range Limits: Byte 11 is 0x00 instead of 0x0a.
  Display Range Limits: Bytes 12-17 must be 0x20.

EDID conformity: FAIL
