edid-decode (hex):

00 ff ff ff ff ff ff 00 3a c4 00 08 00 00 00 00
2d 0c 01 03 80 20 13 00 ea a8 e0 99 57 4b 92 25
1c 50 54 00 00 00 01 01 01 01 01 01 01 01 01 01
01 01 01 01 01 01 a4 1f 00 98 51 00 22 30 30 70
36 00 42 c1 10 00 00 1a 00 00 00 fc 00 4e 76 69
64 69 61 20 44 65 66 61 75 6c 00 00 00 fc 00 74
20 46 6c 61 74 20 50 61 6e 65 6c 00 00 00 00 fd
00 00 3c 1d 31 09 00 00 20 20 20 20 20 00 00 bc

----------------

Block 0, Base EDID:
  EDID Structure Version & Revision: 1.3
  Vendor & Product Identification:
    Manufacturer: NVD
    Model: 2048
    Made in: week 45 of 2002
  Basic Display Parameters & Features:
    Digital display
    Maximum image size: 32 cm x 19 cm
    Gamma: 1.00
    DPMS levels: Standby Suspend Off
    RGB color display
    First detailed timing is the preferred timing
  Color Characteristics:
    Red  : 0.5996, 0.3417
    Green: 0.2949, 0.5703
    Blue : 0.1474, 0.1113
    White: 0.3125, 0.3281
  Established Timings I & II: none
  Standard Timings: none
  Detailed Timing Descriptors:
    DTD 1:  1280x768    59.832646 Hz   5:3     47.986 kHz     81.000000 MHz (322 mm x 193 mm)
                 Hfront   48 Hsync 112 Hback  248 Hpol P
                 Vfront    3 Vsync   6 Vback   25 Vpol N
    Display Product Name: 'Nvidia Defaul'
    Display Product Name: 't Flat Panel'
    Display Range Limits:
      Monitor ranges (GTF): 0-60 Hz V, 29-49 kHz H, max dotclock 90 MHz
Checksum: 0xbc

----------------

Failures:

Block 0, Base EDID:
  Display Product Name: NUL byte at position 12.
  Display Range Limits: Byte 11 is 0x00 instead of 0x0a.
  Display Range Limits: Bytes 12-17 must be 0x20.

EDID conformity: FAIL
