edid-decode (hex):

00 ff ff ff ff ff ff 00 1e 6d 55 5c c7 d9 00 00
0c 21 01 04 c5 3c 22 78 f9 89 f5 ae 51 45 a3 23
0d 50 54 21 09 00 d1 c0 61 40 45 40 31 40 01 01
01 01 01 01 01 01 56 5e 00 a0 a0 a0 29 50 30 20
35 00 58 54 21 00 00 1a 00 00 00 fd 0c 30 f0 87
87 6a 01 0a 20 20 20 20 20 20 00 00 00 fc 00 4c
47 20 55 4c 54 52 41 47 45 41 52 0a 00 00 00 ff
00 33 31 32 4e 54 56 53 31 4d 37 35 31 0a 02 85

02 03 2d 73 23 0f 07 07 83 47 40 00 44 10 04 03
01 e2 00 6a e3 05 c0 00 e6 06 05 01 66 66 54 6d
1a 00 00 02 05 30 f0 00 04 68 3a 68 3a 09 ec 00
a0 a0 a0 67 50 30 20 35 00 58 54 21 00 00 1a 6f
c2 00 a0 a0 a0 55 50 30 20 35 00 58 54 21 00 00
1a 00 00 00 00 00 00 00 00 00 00 00 00 00 00 00
00 00 00 00 00 00 00 00 00 00 00 00 00 00 00 00
00 00 00 00 00 00 00 00 00 00 00 00 00 00 00 9f

00 ff ff ff ff ff ff 00 1e 6d 55 5c c7 d9 00 00
0c 21 01 04 c5 3c 22 78 f9 89 f5 ae 51 45 a3 23
0d 50 54 21 09 00 d1 c0 61 40 45 40 31 40 01 01
01 01 01 01 01 01 56 5e 00 a0 a0 a0 29 50 30 20
35 00 58 54 21 00 00 1a 00 00 00 fd 0c 30 f0 87
87 6a 01 0a 20 20 20 20 20 20 00 00 00 fc 00 4c
47 20 55 4c 54 52 41 47 45 41 52 0a 00 00 00 ff
00 33 31 32 4e 54 56 53 31 4d 37 35 31 0a 02 85

00 ff ff ff ff ff ff 00 1e 6d 55 5c c7 d9 00 00
0c 21 01 04 c5 3c 22 78 f9 89 f5 ae 51 45 a3 23
0d 50 54 21 09 00 d1 c0 61 40 45 40 31 40 01 01
01 01 01 01 01 01 56 5e 00 a0 a0 a0 29 50 30 20
35 00 58 54 21 00 00 1a 00 00 00 fd 0c 30 f0 87
87 6a 01 0a 20 20 20 20 20 20 00 00 00 fc 00 4c
47 20 55 4c 54 52 41 47 45 41 52 0a 00 00 00 ff
00 33 31 32 4e 54 56 53 31 4d 37 35 31 0a 02 85

02 03 2d 73 23 0f 07 07 83 47 40 00 44 10 04 03
01 e2 00 6a e3 05 c0 00 e6 06 05 01 66 66 54 6d
1a 00 00 02 05 30 f0 00 04 68 3a 68 3a 09 ec 00
a0 a0 a0 67 50 30 20 35 00 58 54 21 00 00 1a 6f
c2 00 a0 a0 a0 55 50 30 20 35 00 58 54 21 00 00
1a 00 00 00 00 00 00 00 00 00 00 00 00 00 00 00
00 00 00 00 00 00 00 00 00 00 00 00 00 00 00 00
00 00 00 00 00 00 00 00 00 00 00 00 00 00 00 9f

00 ff ff ff ff ff ff 00 1e 6d 55 5c c7 d9 00 00
0c 21 01 04 c5 3c 22 78 f9 89 f5 ae 51 45 a3 23
0d 50 54 21 09 00 d1 c0 61 40 45 40 31 40 01 01
01 01 01 01 01 01 56 5e 00 a0 a0 a0 29 50 30 20
35 00 58 54 21 00 00 1a 00 00 00 fd 0c 30 f0 87
87 6a 01 0a 20 20 20 20 20 20 00 00 00 fc 00 4c
47 20 55 4c 54 52 41 47 45 41 52 0a 00 00 00 ff
00 33 31 32 4e 54 56 53 31 4d 37 35 31 0a 02 85

----------------

Block 0, Base EDID:
  EDID Structure Version & Revision: 1.4
  Vendor & Product Identification:
    Manufacturer: GSM
    Model: 23637
    Serial Number: ...
    Made in: week 12 of 2023
  Basic Display Parameters & Features:
    Digital display
    Bits per primary color channel: 12
    DisplayPort interface
    Maximum image size: 60 cm x 34 cm
    Gamma: 2.20
    DPMS levels: Standby Suspend Off
    Supported color formats: RGB 4:4:4, YCrCb 4:4:4, YCrCb 4:2:2
    First detailed timing does not include the native pixel format and preferred refresh rate
    Display supports continuous frequencies
  Color Characteristics:
    Red  : 0.6816, 0.3164
    Green: 0.2714, 0.6376
    Blue : 0.1396, 0.0537
    White: 0.3134, 0.3291
  Established Timings I & II:
    DMT 0x04:   640x480    59.940476 Hz   4:3     31.469 kHz     25.175000 MHz
    DMT 0x09:   800x600    60.316541 Hz   4:3     37.879 kHz     40.000000 MHz
    DMT 0x10:  1024x768    60.003840 Hz   4:3     48.363 kHz     65.000000 MHz
    DMT 0x24:  1280x1024   75.024675 Hz   5:4     79.976 kHz    135.000000 MHz
  Standard Timings:
    DMT 0x52:  1920x1080   60.000000 Hz  16:9     67.500 kHz    148.500000 MHz
    DMT 0x10:  1024x768    60.003840 Hz   4:3     48.363 kHz     65.000000 MHz
    DMT 0x09:   800x600    60.316541 Hz   4:3     37.879 kHz     40.000000 MHz
    DMT 0x04:   640x480    59.940476 Hz   4:3     31.469 kHz     25.175000 MHz
  Detailed Timing Descriptors:
    DTD 1:  2560x1440   59.950550 Hz  16:9     88.787 kHz    241.500000 MHz (600 mm x 340 mm)
                 Hfront   48 Hsync  32 Hback   80 Hpol P
                 Vfront    3 Vsync   5 Vback   33 Vpol N
    Display Range Limits:
      Monitor ranges (Range Limits Only): 48-240 Hz V, 390-390 kHz H, max dotclock 1060 MHz
    Display Product Name: 'LG ULTRAGEAR'
    Display Product Serial Number: ...
  Extension blocks: 2
Checksum: 0x85

----------------

Block 1, CTA-861 Extension Block:
  Revision: 3
  Basic audio support
  Supports YCbCr 4:4:4
  Supports YCbCr 4:2:2
  Native detailed modes: 3
  Audio Data Block:
    Linear PCM:
      Max channels: 8
      Supported sample rates (kHz): 48 44.1 32
      Supported sample sizes (bits): 24 20 16
  Speaker Allocation Data Block:
    FL/FR - Front Left/Right
    LFE1 - Low Frequency Effects 1
    FC - Front Center
    BL/BR - Back Left/Right
    SiL/SiR - Side Left/Right (Deprecated, use the RCDB)
  Video Data Block:
    VIC  16:  1920x1080   60.000000 Hz  16:9     67.500 kHz    148.500000 MHz
    VIC   4:  1280x720    60.000000 Hz  16:9     45.000 kHz     74.250000 MHz
    VIC   3:   720x480    59.940060 Hz  16:9     31.469 kHz     27.000000 MHz
    VIC   1:   640x480    59.940476 Hz   4:3     31.469 kHz     25.175000 MHz
  Video Capability Data Block:
    YCbCr quantization: No Data
    RGB quantization: Selectable (via AVI Q)
    PT scan behavior: Always Underscanned
    IT scan behavior: Always Underscanned
    CE scan behavior: Always Underscanned
  Colorimetry Data Block:
    BT2020YCC
    BT2020RGB
  HDR Static Metadata Data Block:
    Electro optical transfer functions:
      Traditional gamma - SDR luminance range
      SMPTE ST2084
    Supported static metadata descriptors:
      Static metadata type 1
    Desired content max luminance: 102 (455.515 cd/m^2)
    Desired content max frame-average luminance: 102 (455.515 cd/m^2)
    Desired content min luminance: 84 (0.494 cd/m^2)
  Vendor-Specific Data Block (AMD), OUI 00-00-1A:
    Version: 2
    Feature Caps: 0x05
    Minimum Refresh Rate: 48 Hz
    Maximum Refresh Rate: 240 Hz
    Flags 1.x: 0x00
    Flags 2.x: 0x04
    Maximum luminance: 104 (475.683 cd/m^2)
    Minimum luminance: 58 (0.246 cd/m^2)
    Maximum luminance (without local dimming): 104 (475.683 cd/m^2)
    Minimum luminance (without local dimming): 58 (0.246 cd/m^2)
  Detailed Timing Descriptors:
    DTD 2:  2560x1440  143.973257 Hz  16:9    222.151 kHz    604.250000 MHz (600 mm x 340 mm)
                 Hfront   48 Hsync  32 Hback   80 Hpol P
                 Vfront    3 Vsync   5 Vback   95 Vpol N
    DTD 3:  2560x1440  119.997589 Hz  16:9    182.996 kHz    497.750000 MHz (600 mm x 340 mm)
                 Hfront   48 Hsync  32 Hback   80 Hpol P
                 Vfront    3 Vsync   5 Vback   77 Vpol N
Checksum: 0x9f  Unused space in Extension Block: 46 bytes

----------------

Block 2, Unknown EDID Extension Block 0x00:
  00 ff ff ff ff ff ff 00 1e 6d 55 5c c7 d9 00 00 '.........mU\....'
  0c 21 01 04 c5 3c 22 78 f9 89 f5 ae 51 45 a3 23 '.!...<"x....QE.#'
  0d 50 54 21 09 00 d1 c0 61 40 45 40 31 40 01 01 '.PT!....a@E@1@..'
  01 01 01 01 01 01 56 5e 00 a0 a0 a0 29 50 30 20 '......V^....)P0 '
  35 00 58 54 21 00 00 1a 00 00 00 fd 0c 30 f0 87 '5.XT!........0..'
  87 6a 01 0a 20 20 20 20 20 20 00 00 00 fc 00 4c '.j..      .....L'
  47 20 55 4c 54 52 41 47 45 41 52 0a 00 00 00 ff 'G ULTRAGEAR.....'
  00 33 31 32 4e 54 56 53 31 4d 37 35 31 0a 02 85 '.312NTVS1M751...'
Checksum: 0x85

----------------

Block 3, Unknown EDID Extension Block 0x00:
  00 ff ff ff ff ff ff 00 1e 6d 55 5c c7 d9 00 00 '.........mU\....'
  0c 21 01 04 c5 3c 22 78 f9 89 f5 ae 51 45 a3 23 '.!...<"x....QE.#'
  0d 50 54 21 09 00 d1 c0 61 40 45 40 31 40 01 01 '.PT!....a@E@1@..'
  01 01 01 01 01 01 56 5e 00 a0 a0 a0 29 50 30 20 '......V^....)P0 '
  35 00 58 54 21 00 00 1a 00 00 00 fd 0c 30 f0 87 '5.XT!........0..'
  87 6a 01 0a 20 20 20 20 20 20 00 00 00 fc 00 4c '.j..      .....L'
  47 20 55 4c 54 52 41 47 45 41 52 0a 00 00 00 ff 'G ULTRAGEAR.....'
  00 33 31 32 4e 54 56 53 31 4d 37 35 31 0a 02 85 '.312NTVS1M751...'
Checksum: 0x85

----------------

Block 4, CTA-861 Extension Block:
  Revision: 3
  Basic audio support
  Supports YCbCr 4:4:4
  Supports YCbCr 4:2:2
  Native detailed modes: 3
  Audio Data Block:
    Linear PCM:
      Max channels: 8
      Supported sample rates (kHz): 48 44.1 32
      Supported sample sizes (bits): 24 20 16
  Speaker Allocation Data Block:
    FL/FR - Front Left/Right
    LFE1 - Low Frequency Effects 1
    FC - Front Center
    BL/BR - Back Left/Right
    SiL/SiR - Side Left/Right (Deprecated, use the RCDB)
  Video Data Block:
    VIC  16:  1920x1080   60.000000 Hz  16:9     67.500 kHz    148.500000 MHz
    VIC   4:  1280x720    60.000000 Hz  16:9     45.000 kHz     74.250000 MHz
    VIC   3:   720x480    59.940060 Hz  16:9     31.469 kHz     27.000000 MHz
    VIC   1:   640x480    59.940476 Hz   4:3     31.469 kHz     25.175000 MHz
  Video Capability Data Block:
    YCbCr quantization: No Data
    RGB quantization: Selectable (via AVI Q)
    PT scan behavior: Always Underscanned
    IT scan behavior: Always Underscanned
    CE scan behavior: Always Underscanned
  Colorimetry Data Block:
    BT2020YCC
    BT2020RGB
  HDR Static Metadata Data Block:
    Electro optical transfer functions:
      Traditional gamma - SDR luminance range
      SMPTE ST2084
    Supported static metadata descriptors:
      Static metadata type 1
    Desired content max luminance: 102 (455.515 cd/m^2)
    Desired content max frame-average luminance: 102 (455.515 cd/m^2)
    Desired content min luminance: 84 (0.494 cd/m^2)
  Vendor-Specific Data Block (AMD), OUI 00-00-1A:
    Version: 2
    Feature Caps: 0x05
    Minimum Refresh Rate: 48 Hz
    Maximum Refresh Rate: 240 Hz
    Flags 1.x: 0x00
    Flags 2.x: 0x04
    Maximum luminance: 104 (475.683 cd/m^2)
    Minimum luminance: 58 (0.246 cd/m^2)
    Maximum luminance (without local dimming): 104 (475.683 cd/m^2)
    Minimum luminance (without local dimming): 58 (0.246 cd/m^2)
  Detailed Timing Descriptors:
    DTD 4:  2560x1440  143.973257 Hz  16:9    222.151 kHz    604.250000 MHz (600 mm x 340 mm)
                 Hfront   48 Hsync  32 Hback   80 Hpol P
                 Vfront    3 Vsync   5 Vback   95 Vpol N
    DTD 5:  2560x1440  119.997589 Hz  16:9    182.996 kHz    497.750000 MHz (600 mm x 340 mm)
                 Hfront   48 Hsync  32 Hback   80 Hpol P
                 Vfront    3 Vsync   5 Vback   77 Vpol N
Checksum: 0x9f  Unused space in Extension Block: 46 bytes

----------------

Block 5, Unknown EDID Extension Block 0x00:
  00 ff ff ff ff ff ff 00 1e 6d 55 5c c7 d9 00 00 '.........mU\....'
  0c 21 01 04 c5 3c 22 78 f9 89 f5 ae 51 45 a3 23 '.!...<"x....QE.#'
  0d 50 54 21 09 00 d1 c0 61 40 45 40 31 40 01 01 '.PT!....a@E@1@..'
  01 01 01 01 01 01 56 5e 00 a0 a0 a0 29 50 30 20 '......V^....)P0 '
  35 00 58 54 21 00 00 1a 00 00 00 fd 0c 30 f0 87 '5.XT!........0..'
  87 6a 01 0a 20 20 20 20 20 20 00 00 00 fc 00 4c '.j..      .....L'
  47 20 55 4c 54 52 41 47 45 41 52 0a 00 00 00 ff 'G ULTRAGEAR.....'
  00 33 31 32 4e 54 56 53 31 4d 37 35 31 0a 02 85 '.312NTVS1M751...'
Checksum: 0x85

----------------

Warnings:

Block 1, CTA-861 Extension Block:
  IT Video Formats are overscanned by default, but normally this should be underscanned.
  Speaker Allocation Data Block: Specifies deprecated speakers.
  Video Data Block: VIC 16 and the first DTD are not identical. Is this intended?
  Video Capability Data Block: Set Selectable YCbCr Quantization to avoid interop issues.
  Video Capability Data Block: S_PT is equal to S_IT and S_CE, so should be set to 0 instead.
  Colorimetry Data Block: Set the sRGB colorimetry bit to avoid interop issues.
  Display Product Serial Number is set, so the Serial Number in the Base EDID should be 0.
Block 4, CTA-861 Extension Block:
  IT Video Formats are overscanned by default, but normally this should be underscanned.
  Speaker Allocation Data Block: Specifies deprecated speakers.
  Video Capability Data Block: Set Selectable YCbCr Quantization to avoid interop issues.
  Video Capability Data Block: S_PT is equal to S_IT and S_CE, so should be set to 0 instead.
  Colorimetry Data Block: Set the sRGB colorimetry bit to avoid interop issues.
EDID:
  Base EDID: Some timings are out of range of the Monitor Ranges:
    Horizontal Freq: 31.468 - 222.150 kHz (Monitor: 390.000 - 390.000 kHz)
  CTA-861: Multiple native progressive timings are defined.

Failures:

Block 1, CTA-861 Extension Block:
  Video Capability Data Block: IT video formats are always underscanned, but bit 7 of Byte 3 of the CTA-861 Extension header is set to overscanned.
Block 2, Base EDID:
  Unknown Extension Block.
Block 3, Base EDID:
  Unknown Extension Block.
Block 4, CTA-861 Extension Block:
  Speaker Allocation Data Block: Only one instance of this Data Block is allowed.
  Video Data Block: Duplicate VIC 16.
  Video Data Block: Duplicate VIC 4.
  Video Data Block: Duplicate VIC 3.
  Video Data Block: Duplicate VIC 1.
  Video Capability Data Block: Only one instance of this Data Block is allowed.
  Video Capability Data Block: IT video formats are always underscanned, but bit 7 of Byte 3 of the CTA-861 Extension header is set to overscanned.
  Colorimetry Data Block: Only one instance of this Data Block is allowed.
  HDR Static Metadata Data Block: Only one instance of this Data Block is allowed.
Block 5, Base EDID:
  Unknown Extension Block.
EDID:
  Base EDID: EDID specified 2 extension block(s), but found 5 extension block(s).

EDID conformity: FAIL
