edid-decode (hex):

00 ff ff ff ff ff ff 00 62 a5 00 16 03 01 01 01
2e 20 01 04 b5 24 13 78 2f 57 a1 b3 33 33 cc 14
14 50 54 21 08 00 d1 00 b3 00 95 00 81 00 01 01
01 01 01 01 01 01 80 3c 80 a0 70 b0 29 40 30 20
35 00 68 be 10 00 00 1e 9d 68 00 a0 a0 40 29 60
30 20 35 00 68 be 10 00 00 1e 00 00 00 fc 00 54
79 70 65 2d 43 0a 20 20 20 20 20 20 00 00 00 fd
00 30 a5 64 ff 46 01 0a 20 20 20 20 20 20 01 45

02 03 2e f2 45 90 01 02 03 04 e2 00 d5 23 09 7f
07 83 01 00 00 e3 05 c0 00 e6 06 05 01 62 62 00
6d d8 5d c4 01 82 00 00 00 00 00 00 00 00 ec 9c
00 a0 a0 40 29 60 30 20 35 00 68 be 10 00 00 1e
3b d1 00 a0 a0 40 29 60 30 20 35 00 68 be 10 00
00 1e 12 fb 00 a0 a0 40 29 60 30 20 35 00 68 be
10 00 00 1e 00 00 00 00 00 00 00 00 00 00 00 00
00 00 00 00 00 00 00 00 00 00 00 00 00 00 00 81

00 ff ff ff ff ff ff 00 62 a5 00 16 03 01 01 01
2e 20 01 04 b5 24 13 78 2f 57 a1 b3 33 33 cc 14
14 50 54 21 08 00 d1 00 b3 00 95 00 81 00 01 01
01 01 01 01 01 01 80 3c 80 a0 70 b0 29 40 30 20
35 00 68 be 10 00 00 1e 9d 68 00 a0 a0 40 29 60
30 20 35 00 68 be 10 00 00 1e 00 00 00 fc 00 54
79 70 65 2d 43 0a 20 20 20 20 20 20 00 00 00 fd
00 30 a5 64 ff 46 01 0a 20 20 20 20 20 20 01 45

02 03 2e f2 45 90 01 02 03 04 e2 00 d5 23 09 7f
07 83 01 00 00 e3 05 c0 00 e6 06 05 01 62 62 00
6d d8 5d c4 01 82 00 00 00 00 00 00 00 00 ec 9c
00 a0 a0 40 29 60 30 20 35 00 68 be 10 00 00 1e
3b d1 00 a0 a0 40 29 60 30 20 35 00 68 be 10 00
00 1e 12 fb 00 a0 a0 40 29 60 30 20 35 00 68 be
10 00 00 1e 00 00 00 00 00 00 00 00 00 00 00 00
00 00 00 00 00 00 00 00 00 00 00 00 00 00 00 81

----------------

Block 0, Base EDID:
  EDID Structure Version & Revision: 1.4
  Vendor & Product Identification:
    Manufacturer: XUE
    Model: 5632
    Serial Number: ...
    Made in: week 46 of 2022
  Basic Display Parameters & Features:
    Digital display
    Bits per primary color channel: 10
    DisplayPort interface
    Maximum image size: 36 cm x 19 cm
    Gamma: 2.20
    DPMS levels: Off
    Supported color formats: RGB 4:4:4, YCrCb 4:4:4
    Default (sRGB) color space is primary color space
    First detailed timing includes the native pixel format and preferred refresh rate
    Display supports continuous frequencies
  Color Characteristics:
    Red  : 0.7001, 0.2001
    Green: 0.2001, 0.7998
    Blue : 0.0800, 0.0800
    White: 0.3125, 0.3291
  Established Timings I & II:
    DMT 0x04:   640x480    59.940476 Hz   4:3     31.469 kHz     25.175000 MHz
    DMT 0x09:   800x600    60.316541 Hz   4:3     37.879 kHz     40.000000 MHz
    DMT 0x10:  1024x768    60.003840 Hz   4:3     48.363 kHz     65.000000 MHz
  Standard Timings:
    DMT 0x45:  1920x1200   59.884600 Hz  16:10    74.556 kHz    193.250000 MHz
    DMT 0x3a:  1680x1050   59.954250 Hz  16:10    65.290 kHz    146.250000 MHz
    DMT 0x2f:  1440x900    59.887445 Hz  16:10    55.935 kHz    106.500000 MHz
    DMT 0x1c:  1280x800    59.810326 Hz  16:10    49.702 kHz     83.500000 MHz
  Detailed Timing Descriptors:
    DTD 1:  1920x1200   60.001240 Hz  16:10    74.462 kHz    154.880000 MHz (360 mm x 190 mm)
                 Hfront   48 Hsync  32 Hback   80 Hpol P
                 Vfront    3 Vsync   5 Vback   33 Vpol P
    DTD 2:  2560x1600   59.999731 Hz  16:10    98.460 kHz    267.810000 MHz (360 mm x 190 mm)
                 Hfront   48 Hsync  32 Hback   80 Hpol P
                 Vfront    3 Vsync   5 Vback   33 Vpol P
    Display Product Name: 'Type-C'
    Display Range Limits:
      Monitor ranges (Range Limits Only): 48-165 Hz V, 100-255 kHz H, max dotclock 700 MHz
  Extension blocks: 1
Checksum: 0x45

----------------

Block 1, CTA-861 Extension Block:
  Revision: 3
  Underscans IT Video Formats by default
  Basic audio support
  Supports YCbCr 4:4:4
  Supports YCbCr 4:2:2
  Native detailed modes: 2
  Video Data Block:
    VIC  16:  1920x1080   60.000000 Hz  16:9     67.500 kHz    148.500000 MHz (native)
    VIC   1:   640x480    59.940476 Hz   4:3     31.469 kHz     25.175000 MHz
    VIC   2:   720x480    59.940060 Hz   4:3     31.469 kHz     27.000000 MHz
    VIC   3:   720x480    59.940060 Hz  16:9     31.469 kHz     27.000000 MHz
    VIC   4:  1280x720    60.000000 Hz  16:9     45.000 kHz     74.250000 MHz
  Video Capability Data Block:
    YCbCr quantization: Selectable (via AVI YQ)
    RGB quantization: Selectable (via AVI Q)
    PT scan behavior: Always Overscanned
    IT scan behavior: Always Overscanned
    CE scan behavior: Always Overscanned
  Audio Data Block:
    Linear PCM:
      Max channels: 2
      Supported sample rates (kHz): 192 176.4 96 88.2 48 44.1 32
      Supported sample sizes (bits): 24 20 16
  Speaker Allocation Data Block:
    FL/FR - Front Left/Right
  Colorimetry Data Block:
    BT2020YCC
    BT2020RGB
  HDR Static Metadata Data Block:
    Electro optical transfer functions:
      Traditional gamma - SDR luminance range
      SMPTE ST2084
    Supported static metadata descriptors:
      Static metadata type 1
    Desired content max luminance: 98 (417.710 cd/m^2)
    Desired content max frame-average luminance: 98 (417.710 cd/m^2)
    Desired content min luminance: 0 (0.000 cd/m^2)
  Vendor-Specific Data Block (HDMI Forum), OUI C4-5D-D8:
    Version: 1
    Maximum TMDS Character Rate: 650 MHz
  Detailed Timing Descriptors:
    DTD 3:  2560x1600   90.000717 Hz  16:10   147.691 kHz    401.720000 MHz (360 mm x 190 mm)
                 Hfront   48 Hsync  32 Hback   80 Hpol P
                 Vfront    3 Vsync   5 Vback   33 Vpol P
    DTD 4:  2560x1600  120.001703 Hz  16:10   196.923 kHz    535.630000 MHz (360 mm x 190 mm)
                 Hfront   48 Hsync  32 Hback   80 Hpol P
                 Vfront    3 Vsync   5 Vback   33 Vpol P
    DTD 5:  2560x1600  143.998459 Hz  16:10   236.301 kHz    642.740000 MHz (360 mm x 190 mm)
                 Hfront   48 Hsync  32 Hback   80 Hpol P
                 Vfront    3 Vsync   5 Vback   33 Vpol P
Checksum: 0x81  Unused space in Extension Block: 27 bytes

----------------

Block 2, Unknown EDID Extension Block 0x00:
  00 ff ff ff ff ff ff 00 62 a5 00 16 03 01 01 01 '........b.......'
  2e 20 01 04 b5 24 13 78 2f 57 a1 b3 33 33 cc 14 '. ...$.x/W..33..'
  14 50 54 21 08 00 d1 00 b3 00 95 00 81 00 01 01 '.PT!............'
  01 01 01 01 01 01 80 3c 80 a0 70 b0 29 40 30 20 '.......<..p.)@0 '
  35 00 68 be 10 00 00 1e 9d 68 00 a0 a0 40 29 60 '5.h......h...@)`'
  30 20 35 00 68 be 10 00 00 1e 00 00 00 fc 00 54 '0 5.h..........T'
  79 70 65 2d 43 0a 20 20 20 20 20 20 00 00 00 fd 'ype-C.      ....'
  00 30 a5 64 ff 46 01 0a 20 20 20 20 20 20 01 45 '.0.d.F..      .E'
Checksum: 0x45

----------------

Block 3, CTA-861 Extension Block:
  Revision: 3
  Underscans IT Video Formats by default
  Basic audio support
  Supports YCbCr 4:4:4
  Supports YCbCr 4:2:2
  Native detailed modes: 2
  Video Data Block:
    VIC  16:  1920x1080   60.000000 Hz  16:9     67.500 kHz    148.500000 MHz (native)
    VIC   1:   640x480    59.940476 Hz   4:3     31.469 kHz     25.175000 MHz
    VIC   2:   720x480    59.940060 Hz   4:3     31.469 kHz     27.000000 MHz
    VIC   3:   720x480    59.940060 Hz  16:9     31.469 kHz     27.000000 MHz
    VIC   4:  1280x720    60.000000 Hz  16:9     45.000 kHz     74.250000 MHz
  Video Capability Data Block:
    YCbCr quantization: Selectable (via AVI YQ)
    RGB quantization: Selectable (via AVI Q)
    PT scan behavior: Always Overscanned
    IT scan behavior: Always Overscanned
    CE scan behavior: Always Overscanned
  Audio Data Block:
    Linear PCM:
      Max channels: 2
      Supported sample rates (kHz): 192 176.4 96 88.2 48 44.1 32
      Supported sample sizes (bits): 24 20 16
  Speaker Allocation Data Block:
    FL/FR - Front Left/Right
  Colorimetry Data Block:
    BT2020YCC
    BT2020RGB
  HDR Static Metadata Data Block:
    Electro optical transfer functions:
      Traditional gamma - SDR luminance range
      SMPTE ST2084
    Supported static metadata descriptors:
      Static metadata type 1
    Desired content max luminance: 98 (417.710 cd/m^2)
    Desired content max frame-average luminance: 98 (417.710 cd/m^2)
    Desired content min luminance: 0 (0.000 cd/m^2)
  Vendor-Specific Data Block (HDMI Forum), OUI C4-5D-D8:
    Version: 1
    Maximum TMDS Character Rate: 650 MHz
  Detailed Timing Descriptors:
    DTD 6:  2560x1600   90.000717 Hz  16:10   147.691 kHz    401.720000 MHz (360 mm x 190 mm)
                 Hfront   48 Hsync  32 Hback   80 Hpol P
                 Vfront    3 Vsync   5 Vback   33 Vpol P
    DTD 7:  2560x1600  120.001703 Hz  16:10   196.923 kHz    535.630000 MHz (360 mm x 190 mm)
                 Hfront   48 Hsync  32 Hback   80 Hpol P
                 Vfront    3 Vsync   5 Vback   33 Vpol P
    DTD 8:  2560x1600  143.998459 Hz  16:10   236.301 kHz    642.740000 MHz (360 mm x 190 mm)
                 Hfront   48 Hsync  32 Hback   80 Hpol P
                 Vfront    3 Vsync   5 Vback   33 Vpol P
Checksum: 0x81  Unused space in Extension Block: 27 bytes

----------------

Warnings:

Block 0, Base EDID:
  Detailed Timing Descriptor #1: Image size is 360x190 mm, but based on the picture AR it should be 360x225 mm.
  Detailed Timing Descriptor #2: Image size is 360x190 mm, but based on the picture AR it should be 360x225 mm.
Block 1, CTA-861 Extension Block:
  Video Data Block: VIC 16 and the first DTD are not identical. Is this intended?
  Video Capability Data Block: IT scan behavior is expected to support underscanned.
  Video Capability Data Block: S_PT is equal to S_IT and S_CE, so should be set to 0 instead.
  Detailed Timing Descriptor #3: Image size is 360x190 mm, but based on the picture AR it should be 360x225 mm.
  Detailed Timing Descriptor #4: Image size is 360x190 mm, but based on the picture AR it should be 360x225 mm.
  Detailed Timing Descriptor #5: Image size is 360x190 mm, but based on the picture AR it should be 360x225 mm.
Block 3, CTA-861 Extension Block:
  Video Capability Data Block: IT scan behavior is expected to support underscanned.
  Video Capability Data Block: S_PT is equal to S_IT and S_CE, so should be set to 0 instead.
  Detailed Timing Descriptor #6: Image size is 360x190 mm, but based on the picture AR it should be 360x225 mm.
  Detailed Timing Descriptor #7: Image size is 360x190 mm, but based on the picture AR it should be 360x225 mm.
  Detailed Timing Descriptor #8: Image size is 360x190 mm, but based on the picture AR it should be 360x225 mm.
EDID:
  Base EDID: Some timings are out of range of the Monitor Ranges:
    Horizontal Freq: 31.468 - 236.301 kHz (Monitor: 100.000 - 255.000 kHz)

Failures:

Block 0, Base EDID:
  Basic Display Parameters & Features: sRGB is signaled, but the chromaticities do not match.
Block 1, CTA-861 Extension Block:
  Video Capability Data Block: IT video formats are always overscanned, but bit 7 of Byte 3 of the CTA-861 Extension header is set to underscanned.
  Vendor-Specific Data Block (HDMI Forum), OUI C4-5D-D8: HDMI Forum VSDB did not immediately follow the HDMI VSDB.
  Vendor-Specific Data Block (HDMI Forum), OUI C4-5D-D8: Max TMDS rate is > 0 and <= 340 or > 600.
Block 2, Base EDID:
  Unknown Extension Block.
Block 3, CTA-861 Extension Block:
  Video Data Block: Duplicate VIC 16.
  Video Data Block: Duplicate VIC 1.
  Video Data Block: Duplicate VIC 2.
  Video Data Block: Duplicate VIC 3.
  Video Data Block: Duplicate VIC 4.
  Video Capability Data Block: Only one instance of this Data Block is allowed.
  Video Capability Data Block: IT video formats are always overscanned, but bit 7 of Byte 3 of the CTA-861 Extension header is set to underscanned.
  Speaker Allocation Data Block: Only one instance of this Data Block is allowed.
  Colorimetry Data Block: Only one instance of this Data Block is allowed.
  HDR Static Metadata Data Block: Only one instance of this Data Block is allowed.
  Vendor-Specific Data Block (HDMI Forum), OUI C4-5D-D8: HDMI Forum VSDB did not immediately follow the HDMI VSDB.
  Vendor-Specific Data Block (HDMI Forum), OUI C4-5D-D8: Duplicate HDMI Forum VSDB/SCDB.
  Vendor-Specific Data Block (HDMI Forum), OUI C4-5D-D8: Max TMDS rate is > 0 and <= 340 or > 600.
EDID:
  Base EDID: EDID specified 1 extension block(s), but found 3 extension block(s).
  CTA-861: Native progressive timings are a mix of several resolutions.

EDID conformity: FAIL
