edid-decode (hex):

00 ff ff ff ff ff ff 00 04 72 d9 09 f8 03 70 30
07 21 01 03 80 47 28 78 2a 47 81 af 4f 31 bb 27
0c 50 54 af ef 80 d1 c0 b3 00 95 00 81 80 71 4f
81 c0 81 40 a9 c0 90 d8 00 68 f1 70 28 80 b0 58
8a 00 c4 8e 21 00 00 1a 00 00 00 ff 00 31 33 30
37 30 30 33 46 38 33 47 30 30 00 00 00 fc 00 58
33 32 20 46 50 0a 20 20 20 20 20 20 00 00 00 fd
08 30 a0 b4 5f 96 00 0a 20 20 20 20 20 20 02 7a

02 03 4d f1 4c 01 02 03 04 10 11 12 13 1f 3f 61
76 23 09 07 07 83 01 00 00 68 03 0c 00 40 00 38
3c 00 6d d8 5d c4 01 78 80 63 02 30 a0 8b 65 1e
e3 05 e3 01 e6 06 07 01 94 94 00 6d 1a 00 00 02
0b 30 a0 e6 06 96 06 95 05 e3 0f 00 0c 98 e2 00
a0 a0 a0 29 50 10 40 35 00 c4 8e 21 00 00 1e 6f
c2 00 a0 a0 a0 55 50 30 20 35 00 c4 8e 21 00 00
1e 00 00 00 00 00 00 00 00 00 00 00 00 00 00 40

70 12 79 00 00 03 01 50 f4 a3 01 04 ff 0e bf 00
2f 80 3f 00 6f 08 3d 00 02 00 04 00 f1 f7 01 04
ff 0e bf 00 2f 80 3f 00 6f 08 3d 00 02 00 04 00
23 29 02 04 ff 0e bf 00 2f 80 3f 00 6f 08 22 00
02 80 04 00 69 5e 00 04 ff 09 9f 00 0f 80 3f 00
9f 05 28 00 02 00 04 00 00 00 00 00 00 00 00 00
00 00 00 00 00 00 00 00 00 00 00 00 00 00 00 00
00 00 00 00 00 00 00 00 00 00 00 00 00 00 73 90

00 ff ff ff ff ff ff 00 04 72 d9 09 f8 03 70 30
07 21 01 03 80 47 28 78 2a 47 81 af 4f 31 bb 27
0c 50 54 af ef 80 d1 c0 b3 00 95 00 81 80 71 4f
81 c0 81 40 a9 c0 90 d8 00 68 f1 70 28 80 b0 58
8a 00 c4 8e 21 00 00 1a 00 00 00 ff 00 31 33 30
37 30 30 33 46 38 33 47 30 30 00 00 00 fc 00 58
33 32 20 46 50 0a 20 20 20 20 20 20 00 00 00 fd
08 30 a0 b4 5f 96 00 0a 20 20 20 20 20 20 02 7a

02 03 4d f1 4c 01 02 03 04 10 11 12 13 1f 3f 61
76 23 09 07 07 83 01 00 00 68 03 0c 00 40 00 38
3c 00 6d d8 5d c4 01 78 80 63 02 30 a0 8b 65 1e
e3 05 e3 01 e6 06 07 01 94 94 00 6d 1a 00 00 02
0b 30 a0 e6 06 96 06 95 05 e3 0f 00 0c 98 e2 00
a0 a0 a0 29 50 10 40 35 00 c4 8e 21 00 00 1e 6f
c2 00 a0 a0 a0 55 50 30 20 35 00 c4 8e 21 00 00
1e 00 00 00 00 00 00 00 00 00 00 00 00 00 00 40

70 12 79 00 00 03 01 50 f4 a3 01 04 ff 0e bf 00
2f 80 3f 00 6f 08 3d 00 02 00 04 00 f1 f7 01 04
ff 0e bf 00 2f 80 3f 00 6f 08 3d 00 02 00 04 00
23 29 02 04 ff 0e bf 00 2f 80 3f 00 6f 08 22 00
02 80 04 00 69 5e 00 04 ff 09 9f 00 0f 80 3f 00
9f 05 28 00 02 00 04 00 00 00 00 00 00 00 00 00
00 00 00 00 00 00 00 00 00 00 00 00 00 00 00 00
00 00 00 00 00 00 00 00 00 00 00 00 00 00 73 90

----------------

Block 0, Base EDID:
  EDID Structure Version & Revision: 1.3
  Vendor & Product Identification:
    Manufacturer: ACR
    Model: 2521
    Serial Number: ...
    Made in: week 7 of 2023
  Basic Display Parameters & Features:
    Digital display
    Maximum image size: 71 cm x 40 cm
    Gamma: 2.20
    DPMS levels: Off
    RGB color display
    First detailed timing is the preferred timing
  Color Characteristics:
    Red  : 0.6845, 0.3085
    Green: 0.1923, 0.7333
    Blue : 0.1542, 0.0468
    White: 0.3125, 0.3291
  Established Timings I & II:
    IBM     :   720x400    70.081663 Hz   9:5     31.467 kHz     28.320000 MHz
    DMT 0x04:   640x480    59.940476 Hz   4:3     31.469 kHz     25.175000 MHz
    DMT 0x05:   640x480    72.808802 Hz   4:3     37.861 kHz     31.500000 MHz
    DMT 0x06:   640x480    75.000000 Hz   4:3     37.500 kHz     31.500000 MHz
    DMT 0x08:   800x600    56.250000 Hz   4:3     35.156 kHz     36.000000 MHz
    DMT 0x09:   800x600    60.316541 Hz   4:3     37.879 kHz     40.000000 MHz
    DMT 0x0a:   800x600    72.187572 Hz   4:3     48.077 kHz     50.000000 MHz
    DMT 0x0b:   800x600    75.000000 Hz   4:3     46.875 kHz     49.500000 MHz
    Apple   :   832x624    74.551266 Hz   4:3     49.726 kHz     57.284000 MHz
    DMT 0x10:  1024x768    60.003840 Hz   4:3     48.363 kHz     65.000000 MHz
    DMT 0x11:  1024x768    70.069359 Hz   4:3     56.476 kHz     75.000000 MHz
    DMT 0x12:  1024x768    75.028582 Hz   4:3     60.023 kHz     78.750000 MHz
    DMT 0x24:  1280x1024   75.024675 Hz   5:4     79.976 kHz    135.000000 MHz
    Apple   :  1152x870    75.061550 Hz 192:145   68.681 kHz    100.000000 MHz
  Standard Timings:
    DMT 0x52:  1920x1080   60.000000 Hz  16:9     67.500 kHz    148.500000 MHz
    DMT 0x3a:  1680x1050   59.954250 Hz  16:10    65.290 kHz    146.250000 MHz
    DMT 0x2f:  1440x900    59.887445 Hz  16:10    55.935 kHz    106.500000 MHz
    DMT 0x23:  1280x1024   60.019740 Hz   5:4     63.981 kHz    108.000000 MHz
    DMT 0x15:  1152x864    75.000000 Hz   4:3     67.500 kHz    108.000000 MHz
    DMT 0x55:  1280x720    60.000000 Hz  16:9     45.000 kHz     74.250000 MHz
    DMT 0x20:  1280x960    60.000000 Hz   4:3     60.000 kHz    108.000000 MHz
    DMT 0x53:  1600x900    60.000000 Hz  16:9     60.000 kHz    108.000000 MHz (RB)
  Detailed Timing Descriptors:
    DTD 1:  3840x2160   60.000000 Hz  16:9    132.000 kHz    554.400000 MHz (708 mm x 398 mm)
                 Hfront  176 Hsync  88 Hback   96 Hpol P
                 Vfront    8 Vsync  10 Vback   22 Vpol N
    Display Product Serial Number: ...
    Display Product Name: 'X32 FP'
    Display Range Limits:
      Monitor ranges (GTF): 48-160 Hz V, 180-95 kHz H, max dotclock 1500 MHz
  Extension blocks: 2
Checksum: 0x7a

----------------

Block 1, CTA-861 Extension Block:
  Revision: 3
  Underscans IT Video Formats by default
  Basic audio support
  Supports YCbCr 4:4:4
  Supports YCbCr 4:2:2
  Native DTDs: 1
  Video Data Block:
    VIC   1:   640x480    59.940476 Hz   4:3     31.469 kHz     25.175000 MHz
    VIC   2:   720x480    59.940060 Hz   4:3     31.469 kHz     27.000000 MHz
    VIC   3:   720x480    59.940060 Hz  16:9     31.469 kHz     27.000000 MHz
    VIC   4:  1280x720    60.000000 Hz  16:9     45.000 kHz     74.250000 MHz
    VIC  16:  1920x1080   60.000000 Hz  16:9     67.500 kHz    148.500000 MHz
    VIC  17:   720x576    50.000000 Hz   4:3     31.250 kHz     27.000000 MHz
    VIC  18:   720x576    50.000000 Hz  16:9     31.250 kHz     27.000000 MHz
    VIC  19:  1280x720    50.000000 Hz  16:9     37.500 kHz     74.250000 MHz
    VIC  31:  1920x1080   50.000000 Hz  16:9     56.250 kHz    148.500000 MHz
    VIC  63:  1920x1080  120.000000 Hz  16:9    135.000 kHz    297.000000 MHz
    VIC  97:  3840x2160   60.000000 Hz  16:9    135.000 kHz    594.000000 MHz
    VIC 118:  3840x2160  120.000000 Hz  16:9    270.000 kHz   1188.000000 MHz
  Audio Data Block:
    Linear PCM:
      Max channels: 2
      Supported sample rates (kHz): 48 44.1 32
      Supported sample sizes (bits): 24 20 16
  Speaker Allocation Data Block:
    FL/FR - Front Left/Right
  Vendor-Specific Data Block (HDMI), OUI 00-0C-03:
    Source physical address: 4.0.0.0
    DC_36bit
    DC_30bit
    DC_Y444
    Maximum TMDS clock: 300 MHz
  Vendor-Specific Data Block (HDMI Forum), OUI C4-5D-D8:
    Version: 1
    Maximum TMDS Character Rate: 600 MHz
    SCDC Present
    Max Fixed Rate Link: 3 and 6 Gbps per lane on 3 lanes, 6, 8, 10 and 12 Gbps on 4 lanes
    Supports 12-bits/component Deep Color 4:2:0 Pixel Encoding
    Supports 10-bits/component Deep Color 4:2:0 Pixel Encoding
    Supports Auto Low-Latency Mode
    VRRmin: 48 Hz
    VRRmax: 160 Hz
    Supports VESA DSC 1.2a compression
    Supports Compressed Video Transport at any valid 1/16th bit bpp
    Supports 12 bpc Compressed Video Transport
    Supports 10 bpc Compressed Video Transport
    DSC Max Slices: up to 8 slices and up to (400 MHz/Ksliceadjust) pixel clock per slice
    DSC Max Fixed Rate Link: 3 and 6 Gbps per lane on 3 lanes, 6, 8, 10 and 12 Gbps on 4 lanes
    Maximum number of bytes in a line of chunks: 31744
  Colorimetry Data Block:
    xvYCC601
    xvYCC709
    BT2020cYCC
    BT2020YCC
    BT2020RGB
    Gamut Boundary Description Metadata Profile P0
  HDR Static Metadata Data Block:
    Electro optical transfer functions:
      Traditional gamma - SDR luminance range
      Traditional gamma - HDR luminance range
      SMPTE ST2084
    Supported static metadata descriptors:
      Static metadata type 1
    Desired content max luminance: 148 (1233.769 cd/m^2)
    Desired content max frame-average luminance: 148 (1233.769 cd/m^2)
    Desired content min luminance: 0 (0.000 cd/m^2)
  Vendor-Specific Data Block (AMD), OUI 00-00-1A:
    Version: 2
    Feature Caps: 0x0b
      Local Dimming Supported
    Minimum Refresh Rate: 48 Hz
    Maximum Refresh Rate: 160 Hz
    Flags 1.x: 0xe6 (MCCS)
    Flags 2.x: 0x06
      ST 2084 (PQ) EOTF Supported
      Linear EOTF (Windows scRGB, 0.0 - 125.0) Supported
      Gamma 2.2 EOTF Supported
      BT.2020 Gamut Supported
    Maximum luminance: 150 (1288.392 cd/m^2)
    Minimum luminance: 6 (0.007 cd/m^2)
    Maximum luminance (without local dimming): 149 (1260.785 cd/m^2)
    Minimum luminance (without local dimming): 5 (0.005 cd/m^2)
  YCbCr 4:2:0 Capability Map Data Block:
    VIC  97:  3840x2160   60.000000 Hz  16:9    135.000 kHz    594.000000 MHz
    VIC 118:  3840x2160  120.000000 Hz  16:9    270.000 kHz   1188.000000 MHz
  Detailed Timing Descriptors:
    DTD 2:  2560x1440  144.000477 Hz  16:9    213.265 kHz    580.080000 MHz (708 mm x 398 mm)
                 Hfront   16 Hsync  64 Hback   80 Hpol P
                 Vfront    3 Vsync   5 Vback   33 Vpol P
    DTD 3:  2560x1440  119.997589 Hz  16:9    182.996 kHz    497.750000 MHz (708 mm x 398 mm)
                 Hfront   48 Hsync  32 Hback   80 Hpol P
                 Vfront    3 Vsync   5 Vback   77 Vpol P
Checksum: 0x40  Unused space in Extension Block: 14 bytes

----------------

Block 2, DisplayID Extension Block:
  Version: 1.2
  Extension Count: 0
  Display Product Type: Extension Section
  Video Timing Modes Type 1 - Detailed Timings Data Block:
    DTD:  3840x2160  119.999723 Hz  16:9    266.639 kHz   1075.090000 MHz (aspect 16:9, no 3D stereo)
               Hfront   48 Hsync  64 Hback   80 Hpol P
               Vfront    3 Vsync   5 Vback   54 Vpol N
    DTD:  3840x2160  143.998775 Hz  16:9    319.965 kHz   1290.100000 MHz (aspect 16:9, no 3D stereo)
               Hfront   48 Hsync  64 Hback   80 Hpol P
               Vfront    3 Vsync   5 Vback   54 Vpol N
    DTD:  3840x2160  160.000181 Hz  16:9    351.200 kHz   1416.040000 MHz (aspect 16:9, no 3D stereo)
               Hfront   48 Hsync  64 Hback   80 Hpol P
               Vfront    3 Vsync   5 Vback   27 Vpol P
    DTD:  2560x1440   60.000199 Hz  16:9     88.860 kHz    241.700000 MHz (aspect 16:9, no 3D stereo)
               Hfront   16 Hsync  64 Hback   80 Hpol P
               Vfront    3 Vsync   5 Vback   33 Vpol N
  Checksum: 0x73
Checksum: 0x90

----------------

Warnings:

Block 1, CTA-861 Extension Block:
  Video Data Block: VIC 1 and the first DTD are not identical. Is this intended?
  Video Data Block: All VICs are in ascending order, and the first (preferred) VIC <= 4, is that intended?
  Colorimetry Data Block: Set the sRGB colorimetry bit to avoid interop issues.
  Display Product Serial Number is set, so the Serial Number in the Base EDID should be 0.
EDID:
  Base EDID: Some timings are out of range of the Monitor Ranges:
    Horizontal Freq: 31.250 - 351.200 kHz (Monitor: 180.000 - 95.000 kHz)

Failures:

Block 0, Base EDID:
  Display Descriptor #4: Monitor descriptor block has byte 4 nonzero (0x08).
  Display Range Limits: Min horizontal freq > max horizontal freq.
Block 1, CTA-861 Extension Block:
  Missing VCDB, needed for Set Selectable RGB Quantization to avoid interop issues.
Block 2, DisplayID Extension Block:
  DisplayID Base Block has no product type.
EDID:
  Extension Block 3 started with EDID header, ignoring Extension Blocks >= 3.
  Base EDID: EDID 1.3 requires a Block Map Extension in Block 1 if there are more than 2 blocks in the EDID.
  DisplayID: DisplayID expects at least one preferred timing.

EDID conformity: FAIL
