edid-decode (hex):

00 ff ff ff ff ff ff 00 04 72 d9 09 70 06 60 24
2e 20 01 04 c5 47 28 78 3b 47 81 af 4f 31 bb 27
0c 50 54 af ef 80 d1 c0 b3 00 95 00 81 80 71 4f
81 c0 81 40 a9 c0 90 d8 00 68 f1 70 28 80 30 20
35 00 c4 8e 21 00 00 1a 00 00 00 fd 0c 30 a0 87
87 9b 01 0a 20 20 20 20 20 20 00 00 00 ff 00 31
32 34 36 30 30 36 37 30 33 47 30 30 00 00 00 fc
00 58 33 32 20 46 50 0a 20 20 20 20 20 20 02 b8

02 03 30 f1 4a 01 03 04 10 12 13 1f 3f 61 76 23
09 07 07 83 01 00 00 6d 1a 00 00 02 0b 30 a0 00
07 96 06 95 05 e3 05 e3 01 e6 06 07 01 94 94 01
98 e2 00 a0 a0 a0 29 50 10 40 35 00 c5 8e 21 00
00 1e 6f c2 00 a0 a0 a0 55 50 30 20 35 00 c4 8e
21 00 00 1a 6a 5e 00 a0 a0 a0 29 50 10 40 35 00
c4 8e 21 00 00 1a 00 00 00 00 00 00 00 00 00 00
00 00 00 00 00 00 00 00 00 00 00 00 00 00 00 f1

00 ff ff ff ff ff ff 00 04 72 d9 09 70 06 60 24
2e 20 01 04 c5 47 28 78 3b 47 81 af 4f 31 bb 27
0c 50 54 af ef 80 d1 c0 b3 00 95 00 81 80 71 4f
81 c0 81 40 a9 c0 90 d8 00 68 f1 70 28 80 30 20
35 00 c4 8e 21 00 00 1a 00 00 00 fd 0c 30 a0 87
87 9b 01 0a 20 20 20 20 20 20 00 00 00 ff 00 31
32 34 36 30 30 36 37 30 33 47 30 30 00 00 00 fc
00 58 33 32 20 46 50 0a 20 20 20 20 20 20 02 b8

00 ff ff ff ff ff ff 00 04 72 d9 09 70 06 60 24
2e 20 01 04 c5 47 28 78 3b 47 81 af 4f 31 bb 27
0c 50 54 af ef 80 d1 c0 b3 00 95 00 81 80 71 4f
81 c0 81 40 a9 c0 90 d8 00 68 f1 70 28 80 30 20
35 00 c4 8e 21 00 00 1a 00 00 00 fd 0c 30 a0 87
87 9b 01 0a 20 20 20 20 20 20 00 00 00 ff 00 31
32 34 36 30 30 36 37 30 33 47 30 30 00 00 00 fc
00 58 33 32 20 46 50 0a 20 20 20 20 20 20 02 b8

02 03 30 f1 4a 01 03 04 10 12 13 1f 3f 61 76 23
09 07 07 83 01 00 00 6d 1a 00 00 02 0b 30 a0 00
07 96 06 95 05 e3 05 e3 01 e6 06 07 01 94 94 01
98 e2 00 a0 a0 a0 29 50 10 40 35 00 c5 8e 21 00
00 1e 6f c2 00 a0 a0 a0 55 50 30 20 35 00 c4 8e
21 00 00 1a 6a 5e 00 a0 a0 a0 29 50 10 40 35 00
c4 8e 21 00 00 1a 00 00 00 00 00 00 00 00 00 00
00 00 00 00 00 00 00 00 00 00 00 00 00 00 00 f1

00 ff ff ff ff ff ff 00 04 72 d9 09 70 06 60 24
2e 20 01 04 c5 47 28 78 3b 47 81 af 4f 31 bb 27
0c 50 54 af ef 80 d1 c0 b3 00 95 00 81 80 71 4f
81 c0 81 40 a9 c0 90 d8 00 68 f1 70 28 80 30 20
35 00 c4 8e 21 00 00 1a 00 00 00 fd 0c 30 a0 87
87 9b 01 0a 20 20 20 20 20 20 00 00 00 ff 00 31
32 34 36 30 30 36 37 30 33 47 30 30 00 00 00 fc
00 58 33 32 20 46 50 0a 20 20 20 20 20 20 02 b8

----------------

Block 0, Base EDID:
  EDID Structure Version & Revision: 1.4
  Vendor & Product Identification:
    Manufacturer: ACR
    Model: 2521
    Serial Number: ...
    Made in: week 46 of 2022
  Basic Display Parameters & Features:
    Digital display
    Bits per primary color channel: 12
    DisplayPort interface
    Maximum image size: 71 cm x 40 cm
    Gamma: 2.20
    DPMS levels: Off
    Supported color formats: RGB 4:4:4, YCrCb 4:4:4, YCrCb 4:2:2
    First detailed timing includes the native pixel format and preferred refresh rate
    Display supports continuous frequencies
  Color Characteristics:
    Red  : 0.6845, 0.3085
    Green: 0.1923, 0.7333
    Blue : 0.1542, 0.0468
    White: 0.3125, 0.3291
  Established Timings I & II:
    IBM     :   720x400    70.081663 Hz   9:5     31.467 kHz     28.320000 MHz
    DMT 0x04:   640x480    59.940476 Hz   4:3     31.469 kHz     25.175000 MHz
    DMT 0x05:   640x480    72.808802 Hz   4:3     37.861 kHz     31.500000 MHz
    DMT 0x06:   640x480    75.000000 Hz   4:3     37.500 kHz     31.500000 MHz
    DMT 0x08:   800x600    56.250000 Hz   4:3     35.156 kHz     36.000000 MHz
    DMT 0x09:   800x600    60.316541 Hz   4:3     37.879 kHz     40.000000 MHz
    DMT 0x0a:   800x600    72.187572 Hz   4:3     48.077 kHz     50.000000 MHz
    DMT 0x0b:   800x600    75.000000 Hz   4:3     46.875 kHz     49.500000 MHz
    Apple   :   832x624    74.551266 Hz   4:3     49.726 kHz     57.284000 MHz
    DMT 0x10:  1024x768    60.003840 Hz   4:3     48.363 kHz     65.000000 MHz
    DMT 0x11:  1024x768    70.069359 Hz   4:3     56.476 kHz     75.000000 MHz
    DMT 0x12:  1024x768    75.028582 Hz   4:3     60.023 kHz     78.750000 MHz
    DMT 0x24:  1280x1024   75.024675 Hz   5:4     79.976 kHz    135.000000 MHz
    Apple   :  1152x870    75.061550 Hz 192:145   68.681 kHz    100.000000 MHz
  Standard Timings:
    DMT 0x52:  1920x1080   60.000000 Hz  16:9     67.500 kHz    148.500000 MHz
    DMT 0x3a:  1680x1050   59.954250 Hz  16:10    65.290 kHz    146.250000 MHz
    DMT 0x2f:  1440x900    59.887445 Hz  16:10    55.935 kHz    106.500000 MHz
    DMT 0x23:  1280x1024   60.019740 Hz   5:4     63.981 kHz    108.000000 MHz
    DMT 0x15:  1152x864    75.000000 Hz   4:3     67.500 kHz    108.000000 MHz
    DMT 0x55:  1280x720    60.000000 Hz  16:9     45.000 kHz     74.250000 MHz
    DMT 0x20:  1280x960    60.000000 Hz   4:3     60.000 kHz    108.000000 MHz
    DMT 0x53:  1600x900    60.000000 Hz  16:9     60.000 kHz    108.000000 MHz (RB)
  Detailed Timing Descriptors:
    DTD 1:  3840x2160   60.000000 Hz  16:9    132.000 kHz    554.400000 MHz (708 mm x 398 mm)
                 Hfront   48 Hsync  32 Hback  280 Hpol P
                 Vfront    3 Vsync   5 Vback   32 Vpol N
    Display Range Limits:
      Monitor ranges (Range Limits Only): 48-160 Hz V, 390-390 kHz H, max dotclock 1550 MHz
    Display Product Serial Number: ...
    Display Product Name: 'X32 FP'
  Extension blocks: 2
Checksum: 0xb8

----------------

Block 1, CTA-861 Extension Block:
  Revision: 3
  Underscans IT Video Formats by default
  Basic audio support
  Supports YCbCr 4:4:4
  Supports YCbCr 4:2:2
  Native DTDs: 1
  Video Data Block:
    VIC   1:   640x480    59.940476 Hz   4:3     31.469 kHz     25.175000 MHz
    VIC   3:   720x480    59.940060 Hz  16:9     31.469 kHz     27.000000 MHz
    VIC   4:  1280x720    60.000000 Hz  16:9     45.000 kHz     74.250000 MHz
    VIC  16:  1920x1080   60.000000 Hz  16:9     67.500 kHz    148.500000 MHz
    VIC  18:   720x576    50.000000 Hz  16:9     31.250 kHz     27.000000 MHz
    VIC  19:  1280x720    50.000000 Hz  16:9     37.500 kHz     74.250000 MHz
    VIC  31:  1920x1080   50.000000 Hz  16:9     56.250 kHz    148.500000 MHz
    VIC  63:  1920x1080  120.000000 Hz  16:9    135.000 kHz    297.000000 MHz
    VIC  97:  3840x2160   60.000000 Hz  16:9    135.000 kHz    594.000000 MHz
    VIC 118:  3840x2160  120.000000 Hz  16:9    270.000 kHz   1188.000000 MHz
  Audio Data Block:
    Linear PCM:
      Max channels: 2
      Supported sample rates (kHz): 48 44.1 32
      Supported sample sizes (bits): 24 20 16
  Speaker Allocation Data Block:
    FL/FR - Front Left/Right
  Vendor-Specific Data Block (AMD), OUI 00-00-1A:
    Version: 2
    Flags 1: 0x0b
      FreeSync Supported
      FreeSync 2 HDR Supported
      Local Dimming Supported
    Minimum Refresh Rate: 48 Hz
    Maximum Refresh Rate: 160 Hz
    Flags 5: 0x07
      sRGB EOTF Supported
      BT.709 EOTF Supported
      Gamma 2.2 EOTF Supported
    Maximum luminance: 150 (1288.392 cd/m^2)
    Minimum luminance: 6 (0.007 cd/m^2)
    Maximum luminance (without local dimming): 149 (1260.785 cd/m^2)
    Minimum luminance (without local dimming): 5 (0.005 cd/m^2)
  Colorimetry Data Block:
    xvYCC601
    xvYCC709
    BT2020cYCC
    BT2020YCC
    BT2020RGB
    Gamut Boundary Description Metadata Profile P0
  HDR Static Metadata Data Block:
    Electro optical transfer functions:
      Traditional gamma - SDR luminance range
      Traditional gamma - HDR luminance range
      SMPTE ST2084
    Supported static metadata descriptors:
      Static metadata type 1
    Desired content max luminance: 148 (1233.769 cd/m^2)
    Desired content max frame-average luminance: 148 (1233.769 cd/m^2)
    Desired content min luminance: 1 (0.000 cd/m^2)
  Detailed Timing Descriptors:
    DTD 2:  2560x1440  144.000477 Hz  16:9    213.265 kHz    580.080000 MHz (709 mm x 398 mm)
                 Hfront   16 Hsync  64 Hback   80 Hpol P
                 Vfront    3 Vsync   5 Vback   33 Vpol P
    DTD 3:  2560x1440  119.997589 Hz  16:9    182.996 kHz    497.750000 MHz (708 mm x 398 mm)
                 Hfront   48 Hsync  32 Hback   80 Hpol P
                 Vfront    3 Vsync   5 Vback   77 Vpol N
    DTD 4:  2560x1440   60.000199 Hz  16:9     88.860 kHz    241.700000 MHz (708 mm x 398 mm)
                 Hfront   16 Hsync  64 Hback   80 Hpol P
                 Vfront    3 Vsync   5 Vback   33 Vpol N
Checksum: 0xf1  Unused space in Extension Block: 25 bytes

----------------

Warnings:

Block 1, CTA-861 Extension Block:
  Video Data Block: VIC 1 and the first DTD are not identical. Is this intended?
  Video Data Block: All VICs are in ascending order, and the first (preferred) VIC <= 4, is that intended?
  Colorimetry Data Block: Set the sRGB colorimetry bit to avoid interop issues.
  Display Product Serial Number is set, so the Serial Number in the Base EDID should be 0.
EDID:
  Base EDID: Some timings are out of range of the Monitor Ranges:
    Horizontal Freq: 31.250 - 270.000 kHz (Monitor: 390.000 - 390.000 kHz)

Failures:

Block 1, CTA-861 Extension Block:
  Missing VCDB, needed for Set Selectable RGB Quantization to avoid interop issues.
EDID:
  Extension Block 2 started with EDID header, ignoring Extension Blocks >= 2.
  Base EDID: EDID specified 2 extension block(s), but found 1 extension block(s).

EDID conformity: FAIL
