edid-decode (hex):

00 ff ff ff ff ff ff 00 22 f0 27 28 01 01 01 01
13 13 01 03 68 2c 19 78 ee b8 15 a6 55 4b 9b 25
13 50 54 a1 08 00 81 80 95 00 01 01 01 01 01 01
01 01 01 01 01 01 30 2a 40 c8 60 84 64 30 18 50
13 00 ba f9 10 00 00 1e 00 00 00 fd 00 30 4c 18
55 11 00 0a 20 20 20 20 20 20 00 00 00 fc 00 48
50 20 32 30 30 39 0a 20 20 20 20 20 00 00 00 ff
00 43 4e 43 39 31 39 32 30 33 4a 0a 20 20 00 d0

00 ff ff ff ff ff ff 00 22 f0 27 28 01 01 01 01
13 13 01 03 68 2c 19 78 ee b8 15 a6 55 4b 9b 25
13 50 54 a1 08 00 81 80 95 00 01 01 01 01 01 01
01 01 01 01 01 01 30 2a 40 c8 60 84 64 30 18 50
13 00 ba f9 10 00 00 1e 00 00 00 fd 00 30 4c 18
55 11 00 0a 20 20 20 20 20 20 00 00 00 fc 00 48
50 20 32 30 30 39 0a 20 20 20 20 20 00 00 00 ff
00 43 4e 43 39 31 39 32 30 33 4a 0a 20 20 00 d0

----------------

Block 0, Base EDID:
  EDID Structure Version & Revision: 1.3
  Vendor & Product Identification:
    Manufacturer: HWP
    Model: 10279
    Serial Number: ...
    Made in: week 19 of 2009
  Basic Display Parameters & Features:
    Analog display
    Signal Level Standard: 0.700 : 0.000 : 0.700 V p-p
    Blank level equals black level
    Sync: Separate
    Maximum image size: 44 cm x 25 cm
    Gamma: 2.20
    DPMS levels: Standby Suspend Off
    RGB color display
    Default (sRGB) color space is primary color space
    First detailed timing is the preferred timing
  Color Characteristics:
    Red  : 0.6503, 0.3349
    Green: 0.2949, 0.6054
    Blue : 0.1445, 0.0751
    White: 0.3134, 0.3291
  Established Timings I & II:
    IBM     :   720x400    70.081663 Hz   9:5     31.467 kHz     28.320000 MHz
    DMT 0x04:   640x480    59.940476 Hz   4:3     31.469 kHz     25.175000 MHz
    DMT 0x09:   800x600    60.316541 Hz   4:3     37.879 kHz     40.000000 MHz
    DMT 0x10:  1024x768    60.003840 Hz   4:3     48.363 kHz     65.000000 MHz
  Standard Timings:
    DMT 0x23:  1280x1024   60.019740 Hz   5:4     63.981 kHz    108.000000 MHz
    DMT 0x2f:  1440x900    59.887445 Hz  16:10    55.935 kHz    106.500000 MHz
  Detailed Timing Descriptors:
    DTD 1:  1600x900    60.000000 Hz  16:9     60.000 kHz    108.000000 MHz (442 mm x 249 mm)
                 Hfront   24 Hsync  80 Hback   96 Hpol P
                 Vfront    1 Vsync   3 Vback   96 Vpol P
    Display Range Limits:
      Monitor ranges (GTF): 48-76 Hz V, 24-85 kHz H, max dotclock 170 MHz
    Display Product Name: 'HP 2009'
    Display Product Serial Number: ...
Checksum: 0xd0

----------------

Block 1, Unknown EDID Extension Block 0x00:
  00 ff ff ff ff ff ff 00 22 f0 27 28 01 01 01 01 '........".'(....'
  13 13 01 03 68 2c 19 78 ee b8 15 a6 55 4b 9b 25 '....h,.x....UK.%'
  13 50 54 a1 08 00 81 80 95 00 01 01 01 01 01 01 '.PT.............'
  01 01 01 01 01 01 30 2a 40 c8 60 84 64 30 18 50 '......0*@.`.d0.P'
  13 00 ba f9 10 00 00 1e 00 00 00 fd 00 30 4c 18 '.............0L.'
  55 11 00 0a 20 20 20 20 20 20 00 00 00 fc 00 48 'U...      .....H'
  50 20 32 30 30 39 0a 20 20 20 20 20 00 00 00 ff 'P 2009.     ....'
  00 43 4e 43 39 31 39 32 30 33 4a 0a 20 20 00 d0 '.CNC919203J.  ..'
Checksum: 0xd0

----------------

Warnings:

Block 0, Base EDID:
  Vendor & Product Identification: The serial number is one of the known dummy values, it should probably be set to 0.

Failures:

Block 0, Base EDID:
  Basic Display Parameters & Features: sRGB is signaled, but the chromaticities do not match.
Block 1, Base EDID:
  Unknown Extension Block.
EDID:
  Base EDID: EDID specified 0 extension block(s), but found 1 extension block(s).

EDID conformity: FAIL
