edid-decode (hex):

00 ff ff ff ff ff ff 00 30 e4 7c 06 00 00 00 00
00 1e 01 04 a5 1f 11 78 07 50 35 a6 54 4b 9d 25
0e 50 54 00 00 00 01 01 01 01 01 01 01 01 01 01
01 01 01 01 01 01 50 d0 00 a0 f0 70 3e 80 30 20
35 00 35 ae 10 00 00 1a a6 a6 00 a0 f0 70 3e 80
30 20 35 00 35 ae 10 00 00 1a 00 00 00 fe 00 4e
35 48 4b 32 80 31 34 30 55 44 32 0a 00 00 00 00
00 02 41 31 a8 00 11 00 00 0b 01 0a 20 20 00 ec

----------------

Block 0, Base EDID:
  EDID Structure Version & Revision: 1.4
  Vendor & Product Identification:
    Manufacturer: LGD
    Model: 1660
    Made in: 2020
  Basic Display Parameters & Features:
    Digital display
    Bits per primary color channel: 8
    DisplayPort interface
    Maximum image size: 31 cm x 17 cm
    Gamma: 2.20
    Supported color formats: RGB 4:4:4
    Default (sRGB) color space is primary color space
    First detailed timing includes the native pixel format and preferred refresh rate
    Display supports continuous frequencies
  Color Characteristics:
    Red  : 0.6494, 0.3291
    Green: 0.2929, 0.6132
    Blue : 0.1445, 0.0576
    White: 0.3134, 0.3291
  Established Timings I & II: none
  Standard Timings: none
  Detailed Timing Descriptors:
    DTD 1:  3840x2160   60.000000 Hz  16:9    133.320 kHz    533.280000 MHz (309 mm x 174 mm)
                 Hfront   48 Hsync  32 Hback   80 Hpol P
                 Vfront    3 Vsync   5 Vback   54 Vpol N
    DTD 2:  3840x2160   47.999550 Hz  16:9    106.655 kHz    426.620000 MHz (309 mm x 174 mm)
                 Hfront   48 Hsync  32 Hback   80 Hpol P
                 Vfront    3 Vsync   5 Vback   54 Vpol N
    Alphanumeric Data String: 'N5HK2.140UD2'
    Manufacturer-Specified Display Descriptor (0x00): 00 00 00 02 41 31 a8 00 11 00 00 0b 01 0a 20 20 '....A1........  '
Checksum: 0xec

----------------

Warnings:

Block 0, Base EDID:
  Alphanumeric Data String: Non-ASCII character 0x80 at position 5, can cause problems.
  Missing Display Product Name.

Failures:

Block 0, Base EDID:
  Basic Display Parameters & Features: sRGB is signaled, but the chromaticities do not match.
  Missing Display Range Limits Descriptor.

EDID conformity: FAIL
