edid-decode (hex):

00 ff ff ff ff ff ff 00 26 cf f4 03 00 00 00 00
32 19 01 04 a5 1a 10 78 0a 06 d5 a0 5d 4b a5 23
0f 4f 56 00 00 00 01 01 01 01 01 01 01 01 01 01
01 01 01 01 01 01 28 3c 80 40 70 b0 23 40 10 10
f2 00 07 a4 10 00 00 19 00 00 00 0f 00 00 00 00
00 00 00 00 00 00 00 00 00 01 00 00 00 fe 00 53
54 41 52 52 59 0a 20 20 20 20 20 20 00 00 00 fe
00 4b 52 31 32 32 45 41 32 54 52 41 20 0a 00 87

----------------

Block 0, Base EDID:
  EDID Structure Version & Revision: 1.4
  Vendor & Product Identification:
    Manufacturer: IVO
    Model: 1012
    Made in: week 50 of 2015
  Basic Display Parameters & Features:
    Digital display
    Bits per primary color channel: 8
    DisplayPort interface
    Maximum image size: 26 cm x 16 cm
    Gamma: 2.20
    Supported color formats: RGB 4:4:4, YCrCb 4:4:4
    First detailed timing includes the native pixel format and preferred refresh rate
  Color Characteristics:
    Red  : 0.6250, 0.3632
    Green: 0.2939, 0.6464
    Blue : 0.1396, 0.0595
    White: 0.3095, 0.3369
  Established Timings I & II: none
  Standard Timings: none
  Detailed Timing Descriptors:
    DTD 1:  1920x1200   62.850986 Hz  16:10    77.621 kHz    154.000000 MHz (263 mm x 164 mm)
                 Hfront   16 Hsync  16 Hback   32 Hpol N
                 Vfront   15 Vsync   2 Vback   18 Vpol N
    Manufacturer-Specified Display Descriptor (0x0f): 00 0f 00 00 00 00 00 00 00 00 00 00 00 00 00 01 '................'
    Alphanumeric Data String: 'STARRY'
    Alphanumeric Data String: 'KR122EA2TRA '
Checksum: 0x87

----------------

Warnings:

Block 0, Base EDID:
  Missing Display Product Name.

Failures:

Block 0, Base EDID:
  Alphanumeric Data String: One or more trailing spaces before newline.

EDID conformity: FAIL
