edid-decode (hex):

00 ff ff ff ff ff ff 00 26 cf f4 03 00 00 00 00
0f 15 01 03 80 16 0d 78 0a bb d0 94 57 55 91 27
21 50 54 00 00 00 01 01 01 01 01 01 01 01 01 01
01 01 01 01 01 01 65 13 00 2c 41 58 19 20 30 20
3a 00 df 7d 10 00 00 18 00 00 00 00 00 00 00 00
00 00 00 00 00 00 00 00 00 00 00 00 00 fe 00 49
6e 66 6f 56 69 73 69 6f 6e 0a 20 20 00 00 00 fe
00 4d 31 30 31 4e 57 54 32 20 52 33 20 2a 00 ae

----------------

Block 0, Base EDID:
  EDID Structure Version & Revision: 1.3
  Vendor & Product Identification:
    Manufacturer: IVO
    Model: 1012
    Made in: week 15 of 2011
  Basic Display Parameters & Features:
    Digital display
    Maximum image size: 22 cm x 13 cm
    Gamma: 2.20
    RGB color display
    First detailed timing is the preferred timing
  Color Characteristics:
    Red  : 0.5800, 0.3427
    Green: 0.3339, 0.5693
    Blue : 0.1552, 0.1298
    White: 0.3125, 0.3281
  Established Timings I & II: none
  Standard Timings: none
  Detailed Timing Descriptors:
    DTD 1:  1024x600    60.000000 Hz 128:75    37.500 kHz     49.650000 MHz (479 mm x 125 mm)
                 Hfront   48 Hsync  32 Hback  220 Hpol N
                 Vfront    3 Vsync  10 Vback   12 Vpol N
    Empty Descriptor
    Alphanumeric Data String: 'InfoVision'
    Alphanumeric Data String: 'M101NWT2 R3 *'
Checksum: 0xae

----------------

Warnings:

Block 0, Base EDID:
  Detailed Timing Descriptor #1: Image size is 479x125 mm, but based on the picture AR it should be 213x125 mm.

Failures:

Block 0, Base EDID:
  Detailed Timing Descriptor #1: Mismatch of image size 479x125 mm vs display size 220x130 mm.
  Empty Descriptor: Use Dummy Descriptor instead of all zeroes.
  Missing Display Product Name.
  Missing Display Range Limits Descriptor.
EDID:
  Base EDID: The DTD max image size is 479x125mm, which is larger than the display size 220.0x130.0mm.

EDID conformity: FAIL
