edid-decode (hex):

00 ff ff ff ff ff ff 00 1e 6d 5e 4e b9 ff 00 00
0a 11 01 03 08 2c 19 78 0a d2 58 a3 54 4a 99 26
0f 4b 4e a1 08 00 31 40 01 01 01 01 45 40 01 01
61 40 01 01 01 01 1b 21 50 a0 51 00 1e 30 48 48
35 00 d6 18 11 00 00 1c 4e 1f 00 80 51 00 1e 30
40 80 37 00 d6 18 11 00 00 18 00 00 00 fd 00 3a
3f 1f 32 09 00 0a 20 20 20 20 20 20 00 00 00 fc
00 32 30 4c 53 33 52 2d 5a 41 0a 20 20 20 00 7a

00 ff ff ff ff ff ff 00 1e 6d 5e 4e b9 ff 00 00
0a 11 01 03 08 2c 19 78 0a d2 58 a3 54 4a 99 26
0f 4b 4e a1 08 00 31 40 01 01 01 01 45 40 01 01
61 40 01 01 01 01 1b 21 50 a0 51 00 1e 30 48 48
35 00 d6 18 11 00 00 1c 4e 1f 00 80 51 00 1e 30
40 80 37 00 d6 18 11 00 00 18 00 00 00 fd 00 3a
3f 1f 32 09 00 0a 20 20 20 20 20 20 00 00 00 fc
00 32 30 4c 53 33 52 2d 5a 41 0a 20 20 20 00 7a

----------------

Block 0, Base EDID:
  EDID Structure Version & Revision: 1.3
  Vendor & Product Identification:
    Manufacturer: GSM
    Model: 20062
    Serial Number: ...
    Made in: week 10 of 2007
  Basic Display Parameters & Features:
    Analog display
    Signal Level Standard: 0.700 : 0.300 : 1.000 V p-p
    Blank level equals black level
    Sync: Separate
    Maximum image size: 44 cm x 25 cm
    Gamma: 2.20
    RGB color display
    First detailed timing is the preferred timing
  Color Characteristics:
    Red  : 0.6396, 0.3291
    Green: 0.2890, 0.5996
    Blue : 0.1494, 0.0595
    White: 0.2949, 0.3046
  Established Timings I & II:
    IBM     :   720x400    70.081663 Hz   9:5     31.467 kHz     28.320000 MHz
    DMT 0x04:   640x480    59.940476 Hz   4:3     31.469 kHz     25.175000 MHz
    DMT 0x09:   800x600    60.316541 Hz   4:3     37.879 kHz     40.000000 MHz
    DMT 0x10:  1024x768    60.003840 Hz   4:3     48.363 kHz     65.000000 MHz
  Standard Timings:
    DMT 0x04:   640x480    59.940476 Hz   4:3     31.469 kHz     25.175000 MHz
    DMT 0x09:   800x600    60.316541 Hz   4:3     37.879 kHz     40.000000 MHz
    DMT 0x10:  1024x768    60.003840 Hz   4:3     48.363 kHz     65.000000 MHz
  Detailed Timing Descriptors:
    DTD 1:  1360x768    59.798991 Hz  85:48    47.720 kHz     84.750000 MHz (470 mm x 280 mm)
                 Hfront   72 Hsync  72 Hback  272 Hpol N
                 Vfront    3 Vsync   5 Vback   22 Vpol P
    DTD 2:  1280x768    60.352203 Hz   5:3     48.161 kHz     80.140000 MHz (470 mm x 280 mm)
                 Hfront   64 Hsync 128 Hback  192 Hpol N
                 Vfront    3 Vsync   7 Vback   20 Vpol N
    Display Range Limits:
      Monitor ranges (GTF): 58-63 Hz V, 31-50 kHz H, max dotclock 90 MHz
    Display Product Name: '20LS3R-ZA'
Checksum: 0x7a

----------------

Warnings:

Block 0, Base EDID:
  Detailed Timing Descriptor #1: Image size is 470x280 mm, but based on the picture AR it should be 470x265 mm.
EDID:
  Base EDID: Some timings are out of range of the Monitor Ranges:
    Vertical Freq: 59.799 - 70.082 Hz (Monitor: 58.000 - 63.000 Hz)

Failures:

Block 0, Base EDID:
  Detailed Timing Descriptor #1: Mismatch of image size 470x280 mm vs display size 440x250 mm.
  Detailed Timing Descriptor #2: Mismatch of image size 470x280 mm vs display size 440x250 mm.
EDID:
  Extension Block 1 started with EDID header, ignoring Extension Blocks >= 1.
  Base EDID: The DTD max image size is 470x280mm, which is larger than the display size 440.0x250.0mm.

EDID conformity: FAIL
