edid-decode (hex):

00 ff ff ff ff ff ff 00 30 64 80 24 34 00 00 00
28 11 01 03 80 34 20 78 2a de 50 a3 54 4c 99 26
0f 50 54 bf ef 80 81 c0 81 40 81 80 95 00 a9 40
b3 00 01 01 01 01 28 3c 80 a0 70 b0 23 40 30 20
36 00 08 4a 21 00 00 1a 7c 2e 90 a0 60 1a 1e 40
30 20 36 00 b1 0f 11 00 00 1a 00 00 00 fd 00 32
4b 18 50 11 00 0a 20 20 20 20 20 20 00 00 00 fc
00 4c 43 44 2d 4d 4f 4e 49 54 4f 52 0a 20 01 55

02 01 04 00 8c 0a d0 8a 20 e0 2d 10 10 3e 96 00
06 44 21 00 00 18 01 1d 80 18 71 1c 16 20 58 2c
25 00 06 44 21 00 00 9e 01 1d 00 72 51 d0 1e 20
6e 28 55 00 06 44 21 00 00 1e 02 3a 80 18 71 38
2d 40 58 2c 45 00 06 44 21 00 00 1e d6 09 80 a0
20 e0 2d 10 10 60 a2 00 06 44 21 00 00 18 00 00
00 00 00 00 00 00 00 00 00 00 00 00 00 00 00 00
00 00 00 00 00 00 00 00 00 00 00 00 00 00 00 ca

00 ff ff ff ff ff ff 00 30 64 80 24 34 00 00 00
28 11 01 03 80 34 20 78 2a de 50 a3 54 4c 99 26
0f 50 54 bf ef 80 81 c0 81 40 81 80 95 00 a9 40
b3 00 01 01 01 01 28 3c 80 a0 70 b0 23 40 30 20
36 00 08 4a 21 00 00 1a 7c 2e 90 a0 60 1a 1e 40
30 20 36 00 b1 0f 11 00 00 1a 00 00 00 fd 00 32
4b 18 50 11 00 0a 20 20 20 20 20 20 00 00 00 fc
00 4c 43 44 2d 4d 4f 4e 49 54 4f 52 0a 20 01 55

02 01 04 00 8c 0a d0 8a 20 e0 2d 10 10 3e 96 00
06 44 21 00 00 18 01 1d 80 18 71 1c 16 20 58 2c
25 00 06 44 21 00 00 9e 01 1d 00 72 51 d0 1e 20
6e 28 55 00 06 44 21 00 00 1e 02 3a 80 18 71 38
2d 40 58 2c 45 00 06 44 21 00 00 1e d6 09 80 a0
20 e0 2d 10 10 60 a2 00 06 44 21 00 00 18 00 00
00 00 00 00 00 00 00 00 00 00 00 00 00 00 00 00
00 00 00 00 00 00 00 00 00 00 00 00 00 00 00 ca

----------------

Block 0, Base EDID:
  EDID Structure Version & Revision: 1.3
  Vendor & Product Identification:
    Manufacturer: LCD
    Model: 9344
    Serial Number: ...
    Made in: week 40 of 2007
  Basic Display Parameters & Features:
    Digital display
    Maximum image size: 52 cm x 32 cm
    Gamma: 2.20
    DPMS levels: Off
    RGB color display
    First detailed timing is the preferred timing
  Color Characteristics:
    Red  : 0.6396, 0.3291
    Green: 0.2998, 0.5996
    Blue : 0.1494, 0.0595
    White: 0.3125, 0.3281
  Established Timings I & II:
    IBM     :   720x400    70.081663 Hz   9:5     31.467 kHz     28.320000 MHz
    DMT 0x04:   640x480    59.940476 Hz   4:3     31.469 kHz     25.175000 MHz
    Apple   :   640x480    66.666667 Hz   4:3     35.000 kHz     30.240000 MHz
    DMT 0x05:   640x480    72.808802 Hz   4:3     37.861 kHz     31.500000 MHz
    DMT 0x06:   640x480    75.000000 Hz   4:3     37.500 kHz     31.500000 MHz
    DMT 0x08:   800x600    56.250000 Hz   4:3     35.156 kHz     36.000000 MHz
    DMT 0x09:   800x600    60.316541 Hz   4:3     37.879 kHz     40.000000 MHz
    DMT 0x0a:   800x600    72.187572 Hz   4:3     48.077 kHz     50.000000 MHz
    DMT 0x0b:   800x600    75.000000 Hz   4:3     46.875 kHz     49.500000 MHz
    Apple   :   832x624    74.551266 Hz   4:3     49.726 kHz     57.284000 MHz
    DMT 0x10:  1024x768    60.003840 Hz   4:3     48.363 kHz     65.000000 MHz
    DMT 0x11:  1024x768    70.069359 Hz   4:3     56.476 kHz     75.000000 MHz
    DMT 0x12:  1024x768    75.028582 Hz   4:3     60.023 kHz     78.750000 MHz
    DMT 0x24:  1280x1024   75.024675 Hz   5:4     79.976 kHz    135.000000 MHz
    Apple   :  1152x870    75.061550 Hz 192:145   68.681 kHz    100.000000 MHz
  Standard Timings:
    DMT 0x55:  1280x720    60.000000 Hz  16:9     45.000 kHz     74.250000 MHz
    DMT 0x20:  1280x960    60.000000 Hz   4:3     60.000 kHz    108.000000 MHz
    DMT 0x23:  1280x1024   60.019740 Hz   5:4     63.981 kHz    108.000000 MHz
    DMT 0x2f:  1440x900    59.887445 Hz  16:10    55.935 kHz    106.500000 MHz
    DMT 0x33:  1600x1200   60.000000 Hz   4:3     75.000 kHz    162.000000 MHz
    DMT 0x3a:  1680x1050   59.954250 Hz  16:10    65.290 kHz    146.250000 MHz
  Detailed Timing Descriptors:
    DTD 1:  1920x1200   59.950171 Hz  16:10    74.038 kHz    154.000000 MHz (520 mm x 330 mm)
                 Hfront   48 Hsync  32 Hback   80 Hpol P
                 Vfront    3 Vsync   6 Vback   26 Vpol N
    DTD 2:  1680x1050   59.883253 Hz  16:10    64.674 kHz    119.000000 MHz (433 mm x 271 mm)
                 Hfront   48 Hsync  32 Hback   80 Hpol P
                 Vfront    3 Vsync   6 Vback   21 Vpol N
    Display Range Limits:
      Monitor ranges (GTF): 50-75 Hz V, 24-80 kHz H, max dotclock 170 MHz
    Display Product Name: 'LCD-MONITOR'
  Extension blocks: 1
Checksum: 0x55

----------------

Block 1, CTA-861 Extension Block:
  Revision: 1
  Detailed Timing Descriptors:
    DTD 3:   720x480    59.940060 Hz   3:2     31.469 kHz     27.000000 MHz (518 mm x 324 mm)
                 Hfront   16 Hsync  62 Hback   60 Hpol N
                 Vfront    9 Vsync   6 Vback   30 Vpol N
    DTD 4:  1920x1080i  60.000000 Hz  16:9     33.750 kHz     74.250000 MHz (518 mm x 324 mm)
                 Hfront   88 Hsync  44 Hback  148 Hpol P
                 Vfront    2 Vsync   5 Vback   15 Vpol P Vfront +0.5 Odd Field
                 Vfront    2 Vsync   5 Vback   15 Vpol P Vback  +0.5 Even Field
    DTD 5:  1280x720    60.000000 Hz  16:9     45.000 kHz     74.250000 MHz (518 mm x 324 mm)
                 Hfront  110 Hsync  40 Hback  220 Hpol P
                 Vfront    5 Vsync   5 Vback   20 Vpol P
    DTD 6:  1920x1080   60.000000 Hz  16:9     67.500 kHz    148.500000 MHz (518 mm x 324 mm)
                 Hfront   88 Hsync  44 Hback  148 Hpol P
                 Vfront    4 Vsync   5 Vback   36 Vpol P
    DTD 7:   640x480    59.952381 Hz   4:3     31.475 kHz     25.180000 MHz (518 mm x 324 mm)
                 Hfront   16 Hsync  96 Hback   48 Hpol N
                 Vfront   10 Vsync   2 Vback   33 Vpol N
Checksum: 0xca  Unused space in Extension Block: 33 bytes

----------------

Warnings:

Block 1, CTA-861 Extension Block:
  Detailed Timing Descriptor #3: Image size is 518x324 mm, but based on the picture AR it should be 486x324 mm.
  Detailed Timing Descriptor #4: DTD is identical to VIC 5, which is not present in the CTA Ext Block.
  Detailed Timing Descriptor #4: Image size is 518x324 mm, but based on the picture AR it should be 518x291 mm.
  Detailed Timing Descriptor #5: DTD is identical to VIC 4, which is not present in the CTA Ext Block.
  Detailed Timing Descriptor #5: Image size is 518x324 mm, but based on the picture AR it should be 518x291 mm.
  Detailed Timing Descriptor #6: DTD is identical to VIC 16, which is not present in the CTA Ext Block.
  Detailed Timing Descriptor #6: Image size is 518x324 mm, but based on the picture AR it should be 518x291 mm.
  Detailed Timing Descriptor #7: Image size is 518x324 mm, but based on the picture AR it should be 432x324 mm.
  Add a Colorimetry Data Block with the sRGB colorimetry bit set to avoid interop issues.

Failures:

Block 0, Base EDID:
  Detailed Timing Descriptor #1: Mismatch of image size 520x330 mm vs display size 520x320 mm.
  Detailed Timing Descriptor #2: Mismatch of image size 433x271 mm vs display size 520x320 mm.
Block 1, CTA-861 Extension Block:
  Missing VCDB, needed for Set Selectable RGB Quantization to avoid interop issues.
EDID:
  Extension Block 2 started with EDID header, ignoring Extension Blocks >= 2.
  Base EDID: The DTD max image size is 520x330mm, which is larger than the display size 520.0x320.0mm.

EDID conformity: FAIL
