edid-decode (hex):

00 ff ff ff ff ff ff 00 0d ae 38 17 00 00 00 00
26 1c 01 04 a5 26 15 78 02 a1 55 a5 56 51 9d 28
0b 50 54 00 00 00 01 01 01 01 01 01 01 01 01 01
01 01 01 01 01 01 b4 3b 80 4a 71 38 34 40 30 20
35 00 7d d6 10 00 00 1a c3 2f 80 4a 71 38 34 40
30 20 35 00 7d d6 10 00 00 1a 00 00 00 fe 00 59
34 50 47 37 00 31 37 33 48 43 45 0a 00 00 00 00
00 01 41 31 9e 00 10 00 00 0a 01 0a 20 20 00 9e

----------------

Block 0, Base EDID:
  EDID Structure Version & Revision: 1.4
  Vendor & Product Identification:
    Manufacturer: CMN
    Model: 5944
    Made in: week 38 of 2018
  Basic Display Parameters & Features:
    Digital display
    Bits per primary color channel: 8
    DisplayPort interface
    Maximum image size: 38 cm x 21 cm
    Gamma: 2.20
    Supported color formats: RGB 4:4:4
    First detailed timing includes the native pixel format and preferred refresh rate
  Color Characteristics:
    Red  : 0.6464, 0.3378
    Green: 0.3164, 0.6142
    Blue : 0.1572, 0.0439
    White: 0.3134, 0.3291
  Established Timings I & II: none
  Standard Timings: none
  Detailed Timing Descriptors:
    DTD 1:  1920x1080   60.007852 Hz  16:9     67.929 kHz    152.840000 MHz (381 mm x 214 mm)
                 Hfront   48 Hsync  32 Hback  250 Hpol P
                 Vfront    3 Vsync   5 Vback   44 Vpol N
    DTD 2:  1920x1080   48.005497 Hz  16:9     54.342 kHz    122.270000 MHz (381 mm x 214 mm)
                 Hfront   48 Hsync  32 Hback  250 Hpol P
                 Vfront    3 Vsync   5 Vback   44 Vpol N
    Alphanumeric Data String: 'Y4PG7'
    Manufacturer-Specified Display Descriptor (0x00): 00 00 00 01 41 31 9e 00 10 00 00 0a 01 0a 20 20 '....A1........  '
Checksum: 0x9e

----------------

Warnings:

Block 0, Base EDID:
  Missing Display Product Name.

Failures:

Block 0, Base EDID:
  Alphanumeric Data String: NUL byte at position 5.

EDID conformity: FAIL
