edid-decode (hex):

00 ff ff ff ff ff ff 00 20 34 60 15 01 01 01 01
11 1e 01 03 80 22 13 78 ea b9 e5 a5 58 52 a1 27
0f 50 54 23 08 00 d1 c0 b3 00 a9 40 a9 c0 90 40
81 80 81 40 81 40 1a 36 80 a0 70 38 1f 40 30 20
25 00 59 c3 10 00 00 1a 66 21 56 aa 51 00 1e 30
46 8f 33 00 59 c3 10 00 00 1a 00 00 00 fd 00 30
4b 1e 53 12 00 0a 20 20 20 20 20 20 00 00 00 fc
00 4b 61 6d 76 61 73 20 31 36 0a 20 20 20 01 b7

02 03 00 b1 40 20 67 03 0c 00 10 00 38 2d 80 e3
05 03 01 02 3a 80 18 71 38 2d 40 58 2c 45 00 06
44 21 00 00 1e 01 1d 00 72 51 d0 1e 20 6e 28 55
00 06 44 21 00 00 1e 8c 0a d0 8a 20 e0 2d 10 10
3e 96 00 06 44 21 00 00 18 00 00 00 00 00 00 00
00 00 00 00 00 00 00 00 00 00 00 00 00 00 00 00
00 00 00 00 00 00 00 00 00 00 00 00 00 00 00 00
00 00 00 00 00 00 00 00 00 00 00 00 00 00 00 60

----------------

Block 0, Base EDID:
  EDID Structure Version & Revision: 1.3
  Vendor & Product Identification:
    Manufacturer: HAT
    Model: 5472
    Serial Number: ...
    Made in: week 17 of 2020
  Basic Display Parameters & Features:
    Digital display
    Maximum image size: 34 cm x 19 cm
    Gamma: 2.20
    DPMS levels: Standby Suspend Off
    RGB color display
    First detailed timing is the preferred timing
  Color Characteristics:
    Red  : 0.6464, 0.3466
    Green: 0.3222, 0.6298
    Blue : 0.1552, 0.0605
    White: 0.3134, 0.3291
  Established Timings I & II:
    DMT 0x04:   640x480    59.940476 Hz   4:3     31.469 kHz     25.175000 MHz
    DMT 0x08:   800x600    56.250000 Hz   4:3     35.156 kHz     36.000000 MHz
    DMT 0x09:   800x600    60.316541 Hz   4:3     37.879 kHz     40.000000 MHz
    DMT 0x10:  1024x768    60.003840 Hz   4:3     48.363 kHz     65.000000 MHz
  Standard Timings:
    DMT 0x52:  1920x1080   60.000000 Hz  16:9     67.500 kHz    148.500000 MHz
    DMT 0x3a:  1680x1050   59.954250 Hz  16:10    65.290 kHz    146.250000 MHz
    DMT 0x33:  1600x1200   60.000000 Hz   4:3     75.000 kHz    162.000000 MHz
    DMT 0x53:  1600x900    60.000000 Hz  16:9     60.000 kHz    108.000000 MHz (RB)
    DMT 0x2a:  1400x1050   59.978442 Hz   4:3     65.317 kHz    121.750000 MHz
    DMT 0x23:  1280x1024   60.019740 Hz   5:4     63.981 kHz    108.000000 MHz
    DMT 0x20:  1280x960    60.000000 Hz   4:3     60.000 kHz    108.000000 MHz
    DMT 0x20:  1280x960    60.000000 Hz   4:3     60.000 kHz    108.000000 MHz
  Detailed Timing Descriptors:
    DTD 1:  1920x1080   59.933878 Hz  16:9     66.587 kHz    138.500000 MHz (345 mm x 195 mm)
                 Hfront   48 Hsync  32 Hback   80 Hpol P
                 Vfront    2 Vsync   5 Vback   24 Vpol N
    DTD 2:  1366x768    59.789541 Hz 683:384   47.712 kHz     85.500000 MHz (345 mm x 195 mm)
                 Hfront   70 Hsync 143 Hback  213 Hpol P
                 Vfront    3 Vsync   3 Vback   24 Vpol N
    Display Range Limits:
      Monitor ranges (GTF): 48-75 Hz V, 30-83 kHz H, max dotclock 180 MHz
    Display Product Name: 'Kamvas 16'
  Extension blocks: 1
Checksum: 0xb7

----------------

Block 1, CTA-861 Extension Block:
  Revision: 3
  Underscans IT Video Formats by default
  Supports YCbCr 4:4:4
  Supports YCbCr 4:2:2
  Native DTDs: 1
Checksum: 0x60

----------------

Warnings:

Block 0, Base EDID:
  Vendor & Product Identification: The serial number is one of the known dummy values, it should probably be set to 0.
  Detailed Timing Descriptor #2: DTD is similar but not identical to DMT 0x51.
Block 1, CTA-861 Extension Block:
  Add a Colorimetry Data Block with the sRGB colorimetry bit set to avoid interop issues.

Failures:

Block 1, CTA-861 Extension Block:
  Padding: Contains non-zero bytes.
  Missing VCDB, needed for Set Selectable RGB Quantization to avoid interop issues.

EDID conformity: FAIL
