edid-decode (hex):

00 ff ff ff ff ff ff 00 30 e4 a8 07 00 00 00 00
00 22 01 04 a5 22 16 78 02 60 c5 98 5d 5b 8e 27
1b 50 54 00 00 00 01 01 01 01 01 01 01 01 01 01
01 01 01 01 01 01 35 3c 80 a0 70 b0 23 40 30 20
36 00 59 d7 10 00 00 1a 2a 30 80 a0 70 b0 23 40
30 20 36 00 59 d7 10 00 00 1a 00 00 00 fe 00 56
4e 4a 52 52 80 31 36 30 57 55 33 0a 00 00 00 00
00 01 41 31 99 00 10 00 00 0a 01 0a 20 20 00 fa

00 ff ff ff ff ff ff 00 30 e4 a8 07 00 00 00 00
00 22 01 04 a5 22 16 78 02 60 c5 98 5d 5b 8e 27
1b 50 54 00 00 00 01 01 01 01 01 01 01 01 01 01
01 01 01 01 01 01 35 3c 80 a0 70 b0 23 40 30 20
36 00 59 d7 10 00 00 1a 2a 30 80 a0 70 b0 23 40
30 20 36 00 59 d7 10 00 00 1a 00 00 00 fe 00 56
4e 4a 52 52 80 31 36 30 57 55 33 0a 00 00 00 00
00 01 41 31 99 00 10 00 00 0a 01 0a 20 20 00 fa

----------------

Block 0, Base EDID:
  EDID Structure Version & Revision: 1.4
  Vendor & Product Identification:
    Manufacturer: LGD
    Model: 1960
    Made in: 2024
  Basic Display Parameters & Features:
    Digital display
    Bits per primary color channel: 8
    DisplayPort interface
    Maximum image size: 34 cm x 22 cm
    Gamma: 2.20
    Supported color formats: RGB 4:4:4
    First detailed timing includes the native pixel format and preferred refresh rate
  Color Characteristics:
    Red  : 0.5947, 0.3652
    Green: 0.3554, 0.5546
    Blue : 0.1552, 0.1054
    White: 0.3134, 0.3291
  Established Timings I & II: none
  Standard Timings: none
  Detailed Timing Descriptors:
    DTD 1:  1920x1200   60.000779 Hz  16:10    74.101 kHz    154.130000 MHz (345 mm x 215 mm)
                 Hfront   48 Hsync  32 Hback   80 Hpol P
                 Vfront    3 Vsync   6 Vback   26 Vpol N
    DTD 2:  1920x1200   47.999066 Hz  16:10    59.279 kHz    123.300000 MHz (345 mm x 215 mm)
                 Hfront   48 Hsync  32 Hback   80 Hpol P
                 Vfront    3 Vsync   6 Vback   26 Vpol N
    Alphanumeric Data String: 'VNJRR.160WU3'
    Manufacturer-Specified Display Descriptor (0x00): 00 00 00 01 41 31 99 00 10 00 00 0a 01 0a 20 20 '....A1........  '
Checksum: 0xfa

----------------

Warnings:

Block 0, Base EDID:
  Alphanumeric Data String: Non-ASCII character 0x80 at position 5, can cause problems.
  Missing Display Product Name.

Failures:

EDID:
  Extension Block 1 started with EDID header, ignoring Extension Blocks >= 1.

EDID conformity: FAIL
