edid-decode (hex):

00 ff ff ff ff ff ff 00 4c f8 00 11 01 01 01 01
13 0c 01 03 0e 30 1f 96 e9 0c c9 a0 57 47 9b 27
12 48 4c ff ff 80 e1 19 e1 4f d1 19 d1 d9 a9 59
a9 19 81 99 81 4f f2 95 00 70 93 a0 43 50 b0 00
13 10 da 28 11 00 00 18 00 00 00 fd 00 30 a0 1e
79 28 00 0a 20 20 20 20 20 20 00 00 00 fc 00 47
44 4d 2d 46 57 39 30 31 31 0a 20 20 00 00 00 ff
00 32 37 31 36 38 34 39 0a 20 20 20 20 20 00 67

00 ff ff ff ff ff ff 00 4c f8 00 11 01 01 01 01
13 0c 01 03 0e 30 1f 96 e9 0c c9 a0 57 47 9b 27
12 48 4c ff ff 80 e1 19 e1 4f d1 19 d1 d9 a9 59
a9 19 81 99 81 4f f2 95 00 70 93 a0 43 50 b0 00
13 10 da 28 11 00 00 18 00 00 00 fd 00 30 a0 1e
79 28 00 0a 20 20 20 20 20 20 00 00 00 fc 00 47
44 4d 2d 46 57 39 30 31 31 0a 20 20 00 00 00 ff
00 32 37 31 36 38 34 39 0a 20 20 20 20 20 00 67

----------------

Block 0, Base EDID:
  EDID Structure Version & Revision: 1.3
  Vendor & Product Identification:
    Manufacturer: SGX
    Model: 4352
    Serial Number: ...
    Made in: week 19 of 2002
  Basic Display Parameters & Features:
    Analog display
    Signal Level Standard: 0.700 : 0.300 : 1.000 V p-p
    Blank level equals black level
    Sync: Separate Composite SyncOnGreen
    Maximum image size: 48 cm x 31 cm
    Gamma: 2.50
    DPMS levels: Standby Suspend Off
    RGB color display
    Supports GTF timings within operating range
  Color Characteristics:
    Red  : 0.6250, 0.3398
    Green: 0.2802, 0.6054
    Blue : 0.1552, 0.0703
    White: 0.2832, 0.2978
  Established Timings I & II:
    IBM     :   720x400    70.081663 Hz   9:5     31.467 kHz     28.320000 MHz
    IBM     :   720x400    87.849542 Hz   9:5     39.444 kHz     35.500000 MHz
    DMT 0x04:   640x480    59.940476 Hz   4:3     31.469 kHz     25.175000 MHz
    Apple   :   640x480    66.666667 Hz   4:3     35.000 kHz     30.240000 MHz
    DMT 0x05:   640x480    72.808802 Hz   4:3     37.861 kHz     31.500000 MHz
    DMT 0x06:   640x480    75.000000 Hz   4:3     37.500 kHz     31.500000 MHz
    DMT 0x08:   800x600    56.250000 Hz   4:3     35.156 kHz     36.000000 MHz
    DMT 0x09:   800x600    60.316541 Hz   4:3     37.879 kHz     40.000000 MHz
    DMT 0x0a:   800x600    72.187572 Hz   4:3     48.077 kHz     50.000000 MHz
    DMT 0x0b:   800x600    75.000000 Hz   4:3     46.875 kHz     49.500000 MHz
    Apple   :   832x624    74.551266 Hz   4:3     49.726 kHz     57.284000 MHz
    DMT 0x0f:  1024x768i   86.957532 Hz   4:3     35.522 kHz     44.900000 MHz
    DMT 0x10:  1024x768    60.003840 Hz   4:3     48.363 kHz     65.000000 MHz
    DMT 0x11:  1024x768    70.069359 Hz   4:3     56.476 kHz     75.000000 MHz
    DMT 0x12:  1024x768    75.028582 Hz   4:3     60.023 kHz     78.750000 MHz
    DMT 0x24:  1280x1024   75.024675 Hz   5:4     79.976 kHz    135.000000 MHz
    Apple   :  1152x870    75.061550 Hz 192:145   68.681 kHz    100.000000 MHz
  Standard Timings:
    GTF     :  2048x1280   85.000042 Hz  16:10   114.240 kHz    321.700000 MHz
    GTF     :  2048x1536   74.999956 Hz   4:3    120.225 kHz    340.477000 MHz
    DMT 0x47:  1920x1200   84.931608 Hz  16:10   107.184 kHz    281.250000 MHz
    GTF     :  1920x1080   84.999879 Hz  16:9     96.390 kHz    252.927000 MHz
    DMT 0x37:  1600x1200   85.000000 Hz   4:3    106.250 kHz    229.500000 MHz
    GTF     :  1600x1000   85.000000 Hz  16:10    89.250 kHz    194.208000 MHz
    DMT 0x25:  1280x1024   85.024098 Hz   5:4     91.146 kHz    157.500000 MHz
    GTF     :  1280x960    74.999884 Hz   4:3     75.150 kHz    129.859000 MHz
  Detailed Timing Descriptors:
    DTD 1:  2304x1440   79.999366 Hz  16:10   120.559 kHz    383.860000 MHz (474 mm x 296 mm)
                 Hfront  176 Hsync 256 Hback  448 Hpol N
                 Vfront    1 Vsync   3 Vback   63 Vpol N
    Display Range Limits:
      Monitor ranges (GTF): 48-160 Hz V, 30-121 kHz H, max dotclock 400 MHz
    Display Product Name: 'GDM-FW9011'
    Display Product Serial Number: ...
Checksum: 0x67

----------------

Warnings:

Block 0, Base EDID:
  Vendor & Product Identification: The serial number is one of the known dummy values, it should probably be set to 0.

Failures:

Block 0, Base EDID:
  Basic Display Parameters & Features: EDID 1.3 requires that the first detailed timing is the preferred timing.
EDID:
  Extension Block 1 started with EDID header, ignoring Extension Blocks >= 1.

EDID conformity: FAIL
