edid-decode (hex):

00 ff ff ff ff ff ff 00 06 af ed 70 02 78 b3 ab
10 1b 01 04 a5 22 13 78 02 6a 7e a4 56 52 9c 27
0b 4e 54 00 00 00 01 01 01 01 01 01 01 01 01 01
01 01 01 01 01 01 ce 8f 80 ac 70 38 8e 40 30 20
a5 00 58 c1 10 00 00 00 ce 8f 80 ac 70 38 3a 47
30 20 a5 00 58 c1 10 00 00 00 00 00 00 fe 00 41
55 4f 0a 20 20 20 20 20 20 20 20 20 00 00 00 fe
00 42 31 35 36 48 41 4e 30 37 2e 30 20 0a 00 48

----------------

Block 0, Base EDID:
  EDID Structure Version & Revision: 1.4
  Vendor & Product Identification:
    Manufacturer: AUO
    Model: 28909
    Serial Number: ...
    Made in: week 16 of 2017
  Basic Display Parameters & Features:
    Digital display
    Bits per primary color channel: 8
    DisplayPort interface
    Maximum image size: 34 cm x 19 cm
    Gamma: 2.20
    Supported color formats: RGB 4:4:4
    First detailed timing includes the native pixel format and preferred refresh rate
  Color Characteristics:
    Red  : 0.6416, 0.3378
    Green: 0.3222, 0.6113
    Blue : 0.1533, 0.0458
    White: 0.3076, 0.3300
  Established Timings I & II: none
  Standard Timings: none
  Detailed Timing Descriptors:
    DTD 1:  1920x1080  144.005846 Hz  16:9    175.975 kHz    368.140000 MHz (analog composite, sync-on-green, 344 mm x 193 mm)
                 Hfront   48 Hsync  32 Hback   92 Hpol N
                 Vfront   10 Vsync   5 Vback  127 Vpol N
    DTD 2:  1920x1080   60.059776 Hz  16:9    175.975 kHz    368.140000 MHz (analog composite, sync-on-green, 344 mm x 193 mm)
                 Hfront   48 Hsync  32 Hback   92 Hpol N
                 Vfront   10 Vsync   5 Vback 1835 Vpol N
    Alphanumeric Data String: 'AUO'
    Alphanumeric Data String: 'B156HAN07.0 '
Checksum: 0x48

----------------

Warnings:

Block 0, Base EDID:
  Missing Display Product Name.

Failures:

Block 0, Base EDID:
  Alphanumeric Data String: One or more trailing spaces before newline.

EDID conformity: FAIL
