edid-decode (hex):

00 ff ff ff ff ff ff 00 4d 6d 22 93 01 04 00 00
35 1a 01 04 a5 34 1f 78 02 80 42 ac 51 30 b4 25
10 50 53 00 00 00 01 01 01 01 01 01 01 01 01 01
01 01 01 01 01 01 28 36 80 a0 70 38 1f 40 30 20
35 00 0f 28 21 00 00 1a 22 2d 80 a0 70 38 1f 40
30 20 35 00 0f 28 21 00 00 0a 00 00 00 fe 00 0a
20 20 20 20 20 20 20 20 20 20 20 20 00 00 00 fe
00 54 32 34 20 41 69 72 0a 20 20 20 20 20 00 42

00 ff ff ff ff ff ff 00 4d 6d 22 93 01 04 00 00
35 1a 01 04 a5 34 1f 78 02 80 42 ac 51 30 b4 25
10 50 53 00 00 00 01 01 01 01 01 01 01 01 01 01
01 01 01 01 01 01 28 36 80 a0 70 38 1f 40 30 20
35 00 0f 28 21 00 00 1a 22 2d 80 a0 70 38 1f 40
30 20 35 00 0f 28 21 00 00 0a 00 00 00 fe 00 0a
20 20 20 20 20 20 20 20 20 20 20 20 00 00 00 fe
00 54 32 34 20 41 69 72 0a 20 20 20 20 20 00 42

----------------

Block 0, Base EDID:
  EDID Structure Version & Revision: 1.4
  Vendor & Product Identification:
    Manufacturer: SKM
    Model: 37666
    Serial Number: ...
    Made in: week 53 of 2016
  Basic Display Parameters & Features:
    Digital display
    Bits per primary color channel: 8
    DisplayPort interface
    Maximum image size: 52 cm x 31 cm
    Gamma: 2.20
    Supported color formats: RGB 4:4:4
    First detailed timing includes the native pixel format and preferred refresh rate
  Color Characteristics:
    Red  : 0.6738, 0.3164
    Green: 0.1875, 0.7031
    Blue : 0.1455, 0.0625
    White: 0.3125, 0.3261
  Established Timings I & II: none
  Standard Timings: none
  Detailed Timing Descriptors:
    DTD 1:  1920x1080   59.994461 Hz  16:9     66.654 kHz    138.640000 MHz (527 mm x 296 mm)
                 Hfront   48 Hsync  32 Hback   80 Hpol P
                 Vfront    3 Vsync   5 Vback   23 Vpol N
    DTD 2:  1920x1080   49.998269 Hz  16:9     55.548 kHz    115.540000 MHz (bipolar analog composite, 527 mm x 296 mm)
                 Hfront   48 Hsync  32 Hback   80 Hpol N
                 Vfront    3 Vsync   5 Vback   23 Vpol N
    Alphanumeric Data String: ''
    Alphanumeric Data String: 'T24 Air'
Checksum: 0x42

----------------

Warnings:

Block 0, Base EDID:
  Missing Display Product Name.

Failures:

Block 0, Base EDID:
  Alphanumeric Data String: Empty string.
EDID:
  Extension Block 1 started with EDID header, ignoring Extension Blocks >= 1.

EDID conformity: FAIL
