edid-decode (hex):

00 ff ff ff ff ff ff 00 4d 6d 22 93 01 04 00 00
35 1a 01 04 a5 00 00 78 02 80 42 ac 51 30 b4 25
10 50 53 00 00 00 01 01 01 01 01 01 01 01 01 01
01 01 01 01 01 01 d7 36 80 a0 70 38 2d 40 30 20
35 00 07 44 21 00 00 18 b4 2d 80 a0 70 38 2d 40
30 20 35 00 07 44 21 00 00 08 00 00 00 fe 00 0a
20 20 20 20 20 20 20 20 20 20 20 20 00 00 00 fe
00 54 32 34 20 41 69 72 0a 20 20 20 20 20 00 14

----------------

Block 0, Base EDID:
  EDID Structure Version & Revision: 1.4
  Vendor & Product Identification:
    Manufacturer: SKM
    Model: 37666
    Serial Number: ...
    Made in: week 53 of 2016
  Basic Display Parameters & Features:
    Digital display
    Bits per primary color channel: 8
    DisplayPort interface
    Image size is variable
    Gamma: 2.20
    Supported color formats: RGB 4:4:4
    First detailed timing includes the native pixel format and preferred refresh rate
  Color Characteristics:
    Red  : 0.6738, 0.3164
    Green: 0.1875, 0.7031
    Blue : 0.1455, 0.0625
    White: 0.3125, 0.3261
  Established Timings I & II: none
  Standard Timings: none
  Detailed Timing Descriptors:
    DTD 1:  1920x1080   59.995726 Hz  16:9     67.495 kHz    140.390000 MHz (519 mm x 324 mm)
                 Hfront   48 Hsync  32 Hback   80 Hpol N
                 Vfront    3 Vsync   5 Vback   37 Vpol N
    DTD 2:  1920x1080   50.000000 Hz  16:9     56.250 kHz    117.000000 MHz (bipolar analog composite, sync-on-green, 519 mm x 324 mm)
                 Hfront   48 Hsync  32 Hback   80 Hpol N
                 Vfront    3 Vsync   5 Vback   37 Vpol N
    Alphanumeric Data String: ''
    Alphanumeric Data String: 'T24 Air'
Checksum: 0x14

----------------

Warnings:

Block 0, Base EDID:
  Detailed Timing Descriptor #1: Image size is 519x324 mm, but based on the picture AR it should be 519x291 mm.
  Detailed Timing Descriptor #2: Image size is 519x324 mm, but based on the picture AR it should be 519x291 mm.
  Missing Display Product Name.

Failures:

Block 0, Base EDID:
  Alphanumeric Data String: Empty string.
EDID:
  Base EDID: The DTD max image size is 519x324mm, but the display size is not specified anywhere.

EDID conformity: FAIL
