edid-decode (hex):

00 ff ff ff ff ff ff 00 22 64 3c 00 00 00 00 00
0d 22 01 02 80 1f 11 78 0e df 8a a2 57 47 98 25
0e 39 3b 00 00 00 01 01 01 01 01 01 01 01 01 01
01 01 01 01 01 01 ce 1d 56 e2 50 00 1e 30 30 20
36 00 35 ae 10 00 00 19 00 00 00 fe 00 48 61 6e
6e 53 74 61 72 0a 20 20 20 20 00 00 00 fe 00 31
34 31 30 30 35 41 2d 56 31 0a 20 20 00 00 00 fe
00 31 34 31 30 30 35 41 2d 56 31 0a 20 20 00 1a

00 ff ff ff ff ff ff 00 22 64 3c 00 00 00 00 00
0d 22 01 02 80 1f 11 78 0e df 8a a2 57 47 98 25
0e 39 3b 00 00 00 01 01 01 01 01 01 01 01 01 01
01 01 01 01 01 01 ce 1d 56 e2 50 00 1e 30 30 20
36 00 35 ae 10 00 00 19 00 00 00 fe 00 48 61 6e
6e 53 74 61 72 0a 20 20 20 20 00 00 00 fe 00 31
34 31 30 30 35 41 2d 56 31 0a 20 20 00 00 00 fe
00 31 34 31 30 30 35 41 2d 56 31 0a 20 20 00 1a

----------------

Block 0, Base EDID:
  EDID Structure Version & Revision: 1.2
  Vendor & Product Identification:
    Manufacturer: HSD
    Model: 60
    Made in: week 13 of 2024
  Basic Display Parameters & Features:
    Digital display
    Maximum image size: 31 cm x 17 cm
    Gamma: 2.20
    RGB color display
    Default (sRGB) color space is primary color space
    First detailed timing is the preferred timing
  Color Characteristics:
    Red  : 0.6357, 0.3408
    Green: 0.2802, 0.5966
    Blue : 0.1464, 0.0546
    White: 0.2246, 0.2324
  Established Timings I & II: none
  Standard Timings: none
  Detailed Timing Descriptors:
    DTD 1:  1366x768    60.059067 Hz 683:384   47.927 kHz     76.300000 MHz (309 mm x 174 mm)
                 Hfront   48 Hsync  32 Hback  146 Hpol N
                 Vfront    3 Vsync   6 Vback   21 Vpol N
    Alphanumeric Data String: 'HannStar'
    Alphanumeric Data String: '141005A-V1'
    Alphanumeric Data String: '141005A-V1'
Checksum: 0x1a

----------------

Warnings:

Block 0, Base EDID:
  EDID Structure Version & Revision: EDID 1.2 is deprecated, do not use.

Failures:

Block 0, Base EDID:
  Basic Display Parameters & Features: sRGB is signaled, but the chromaticities do not match.
EDID:
  Extension Block 1 started with EDID header, ignoring Extension Blocks >= 1.

EDID conformity: FAIL
