edid-decode (hex):

00 ff ff ff ff ff ff 00 22 0e 96 38 00 00 00 00
16 21 01 04 a5 6d 1f 78 3b f2 f5 aa 4f 4a a7 25
0d 50 54 a5 6b 00 d1 c0 81 80 31 68 31 7c 45 68
45 7c 61 68 61 7c 0e 69 00 b4 f0 38 23 40 30 20
3a 00 3f 32 41 00 00 1a 00 00 00 fd 00 30 a5 fa
fa 8c 01 0a 20 20 20 20 20 20 00 00 00 fc 00 48
50 20 45 34 35 63 20 47 35 0a 20 20 00 00 00 ff
00 43 4e 43 33 32 32 32 5a 52 4b 0a 20 20 02 92

02 03 22 b1 4c 3f 40 10 1f 29 04 13 03 02 12 11
01 6d 1a 00 00 02 01 30 a5 00 00 00 00 00 00 e2
00 ea 1c d2 00 b4 f0 38 23 40 30 20 3a 00 3f 32
41 00 00 1a 6f c2 00 a0 a0 a0 55 50 30 20 35 00
3f 32 41 00 00 1a 56 5e 00 a0 a0 a0 29 50 30 20
35 00 3f 32 41 00 00 1a 00 00 00 00 00 00 00 00
00 00 00 00 00 00 00 00 00 00 00 00 00 00 00 00
00 00 00 00 00 00 00 00 00 00 00 00 00 00 00 b2

70 12 79 03 00 03 01 64 46 07 02 88 ff 13 3f 01
2f 80 1f 00 9f 05 28 00 02 00 09 00 a7 79 01 08
ff 13 3f 01 2f 80 1f 00 9f 05 28 00 02 00 09 00
17 e5 00 08 ff 13 9f 00 2f 80 1f 00 9f 05 28 00
02 00 09 00 be d6 00 08 ff 13 9f 00 2f 80 1f 00
9f 05 28 00 02 00 09 00 33 b7 00 08 ff 13 9f 00
2f 80 1f 00 9f 05 28 00 02 00 09 00 00 00 00 00
00 00 00 00 00 00 00 00 00 00 00 00 00 00 88 90

00 ff ff ff ff ff ff 00 22 0e 96 38 00 00 00 00
16 21 01 04 a5 6d 1f 78 3b f2 f5 aa 4f 4a a7 25
0d 50 54 a5 6b 00 d1 c0 81 80 31 68 31 7c 45 68
45 7c 61 68 61 7c 0e 69 00 b4 f0 38 23 40 30 20
3a 00 3f 32 41 00 00 1a 00 00 00 fd 00 30 a5 fa
fa 8c 01 0a 20 20 20 20 20 20 00 00 00 fc 00 48
50 20 45 34 35 63 20 47 35 0a 20 20 00 00 00 ff
00 43 4e 43 33 32 32 32 5a 52 4b 0a 20 20 02 92

02 03 22 b1 4c 3f 40 10 1f 29 04 13 03 02 12 11
01 6d 1a 00 00 02 01 30 a5 00 00 00 00 00 00 e2
00 ea 1c d2 00 b4 f0 38 23 40 30 20 3a 00 3f 32
41 00 00 1a 6f c2 00 a0 a0 a0 55 50 30 20 35 00
3f 32 41 00 00 1a 56 5e 00 a0 a0 a0 29 50 30 20
35 00 3f 32 41 00 00 1a 00 00 00 00 00 00 00 00
00 00 00 00 00 00 00 00 00 00 00 00 00 00 00 00
00 00 00 00 00 00 00 00 00 00 00 00 00 00 00 b2

70 12 79 03 00 03 01 64 46 07 02 88 ff 13 3f 01
2f 80 1f 00 9f 05 28 00 02 00 09 00 a7 79 01 08
ff 13 3f 01 2f 80 1f 00 9f 05 28 00 02 00 09 00
17 e5 00 08 ff 13 9f 00 2f 80 1f 00 9f 05 28 00
02 00 09 00 be d6 00 08 ff 13 9f 00 2f 80 1f 00
9f 05 28 00 02 00 09 00 33 b7 00 08 ff 13 9f 00
2f 80 1f 00 9f 05 28 00 02 00 09 00 00 00 00 00
00 00 00 00 00 00 00 00 00 00 00 00 00 00 88 90

----------------

Block 0, Base EDID:
  EDID Structure Version & Revision: 1.4
  Vendor & Product Identification:
    Manufacturer: HPN
    Model: 14486
    Made in: week 22 of 2023
  Basic Display Parameters & Features:
    Digital display
    Bits per primary color channel: 8
    DisplayPort interface
    Maximum image size: 109 cm x 31 cm
    Gamma: 2.20
    DPMS levels: Off
    Supported color formats: RGB 4:4:4, YCrCb 4:4:4, YCrCb 4:2:2
    First detailed timing includes the native pixel format and preferred refresh rate
    Display supports continuous frequencies
  Color Characteristics:
    Red  : 0.6669, 0.3115
    Green: 0.2890, 0.6542
    Blue : 0.1474, 0.0537
    White: 0.3134, 0.3291
  Established Timings I & II:
    IBM     :   720x400    70.081663 Hz   9:5     31.467 kHz     28.320000 MHz
    DMT 0x04:   640x480    59.940476 Hz   4:3     31.469 kHz     25.175000 MHz
    DMT 0x06:   640x480    75.000000 Hz   4:3     37.500 kHz     31.500000 MHz
    DMT 0x09:   800x600    60.316541 Hz   4:3     37.879 kHz     40.000000 MHz
    DMT 0x0b:   800x600    75.000000 Hz   4:3     46.875 kHz     49.500000 MHz
    Apple   :   832x624    74.551266 Hz   4:3     49.726 kHz     57.284000 MHz
    DMT 0x10:  1024x768    60.003840 Hz   4:3     48.363 kHz     65.000000 MHz
    DMT 0x12:  1024x768    75.028582 Hz   4:3     60.023 kHz     78.750000 MHz
    DMT 0x24:  1280x1024   75.024675 Hz   5:4     79.976 kHz    135.000000 MHz
  Standard Timings:
    DMT 0x52:  1920x1080   60.000000 Hz  16:9     67.500 kHz    148.500000 MHz
    DMT 0x23:  1280x1024   60.019740 Hz   5:4     63.981 kHz    108.000000 MHz
    GTF     :   640x480    99.999537 Hz   4:3     50.900 kHz     43.163000 MHz
    GTF     :   640x480   119.999084 Hz   4:3     61.800 kHz     52.406000 MHz
    GTF     :   800x600    99.999707 Hz   4:3     63.600 kHz     68.179000 MHz
    GTF     :   800x600   119.999886 Hz   4:3     77.160 kHz     83.950000 MHz
    GTF     :  1024x768   100.000177 Hz   4:3     81.400 kHz    113.309000 MHz
    GTF     :  1024x768   119.999931 Hz   4:3     98.760 kHz    139.054000 MHz
  Detailed Timing Descriptors:
    DTD 1:  3840x1080   60.000446 Hz  32:9     66.900 kHz    268.940000 MHz (1087 mm x 306 mm)
                 Hfront   48 Hsync  32 Hback  100 Hpol P
                 Vfront    3 Vsync  10 Vback   22 Vpol N
    Display Range Limits:
      Monitor ranges (Range Limits Only): 48-165 Hz V, 250-250 kHz H, max dotclock 1400 MHz
    Display Product Name: 'HP E45c G5'
    Display Product Serial Number: ...
  Extension blocks: 2
Checksum: 0x92

----------------

Block 1, CTA-861 Extension Block:
  Revision: 3
  Underscans IT Video Formats by default
  Supports YCbCr 4:4:4
  Supports YCbCr 4:2:2
  Native DTDs: 1
  Video Data Block:
    VIC  63:  1920x1080  120.000000 Hz  16:9    135.000 kHz    297.000000 MHz
    VIC  64:  1920x1080  100.000000 Hz  16:9    112.500 kHz    297.000000 MHz
    VIC  16:  1920x1080   60.000000 Hz  16:9     67.500 kHz    148.500000 MHz
    VIC  31:  1920x1080   50.000000 Hz  16:9     56.250 kHz    148.500000 MHz
    VIC  41:  1280x720   100.000000 Hz  16:9     75.000 kHz    148.500000 MHz
    VIC   4:  1280x720    60.000000 Hz  16:9     45.000 kHz     74.250000 MHz
    VIC  19:  1280x720    50.000000 Hz  16:9     37.500 kHz     74.250000 MHz
    VIC   3:   720x480    59.940060 Hz  16:9     31.469 kHz     27.000000 MHz
    VIC   2:   720x480    59.940060 Hz   4:3     31.469 kHz     27.000000 MHz
    VIC  18:   720x576    50.000000 Hz  16:9     31.250 kHz     27.000000 MHz
    VIC  17:   720x576    50.000000 Hz   4:3     31.250 kHz     27.000000 MHz
    VIC   1:   640x480    59.940476 Hz   4:3     31.469 kHz     25.175000 MHz
  Vendor-Specific Data Block (AMD), OUI 00-00-1A:
    Version: 2
    Feature Caps: 0x01
    Minimum Refresh Rate: 48 Hz
    Maximum Refresh Rate: 165 Hz
    Flags 1.x: 0x00
    Flags 2.x: 0x00
  Video Capability Data Block:
    YCbCr quantization: Selectable (via AVI YQ)
    RGB quantization: Selectable (via AVI Q)
    PT scan behavior: Always Underscanned
    IT scan behavior: Always Underscanned
    CE scan behavior: Always Underscanned
  Detailed Timing Descriptors:
    DTD 2:  3840x1080  120.000892 Hz  32:9    133.801 kHz    537.880000 MHz (1087 mm x 306 mm)
                 Hfront   48 Hsync  32 Hback  100 Hpol P
                 Vfront    3 Vsync  10 Vback   22 Vpol N
    DTD 3:  2560x1440  119.997589 Hz  16:9    182.996 kHz    497.750000 MHz (1087 mm x 306 mm)
                 Hfront   48 Hsync  32 Hback   80 Hpol P
                 Vfront    3 Vsync   5 Vback   77 Vpol N
    DTD 4:  2560x1440   59.950550 Hz  16:9     88.787 kHz    241.500000 MHz (1087 mm x 306 mm)
                 Hfront   48 Hsync  32 Hback   80 Hpol P
                 Vfront    3 Vsync   5 Vback   33 Vpol N
Checksum: 0xb2  Unused space in Extension Block: 39 bytes

----------------

Block 2, DisplayID Extension Block:
  Version: 1.2
  Extension Count: 0
  Display Product Type: Standalone display device
  Video Timing Modes Type 1 - Detailed Timings Data Block:
    DTD:  5120x1440  165.000546 Hz   0:0    244.366 kHz   1329.350000 MHz (aspect undefined, no 3D stereo, preferred)
               Hfront   48 Hsync  32 Hback  240 Hpol P
               Vfront    3 Vsync  10 Vback   28 Vpol N
    DTD:  5120x1440  120.000397 Hz   0:0    177.721 kHz    966.800000 MHz (aspect undefined, no 3D stereo)
               Hfront   48 Hsync  32 Hback  240 Hpol P
               Vfront    3 Vsync  10 Vback   28 Vpol N
    DTD:  5120x1440   75.000512 Hz   0:0    111.076 kHz    586.480000 MHz (aspect undefined, no 3D stereo)
               Hfront   48 Hsync  32 Hback   80 Hpol P
               Vfront    3 Vsync  10 Vback   28 Vpol N
    DTD:  5120x1440   70.303388 Hz   0:0    104.119 kHz    549.750000 MHz (aspect undefined, no 3D stereo)
               Hfront   48 Hsync  32 Hback   80 Hpol P
               Vfront    3 Vsync  10 Vback   28 Vpol N
    DTD:  5120x1440   59.976879 Hz   0:0     88.826 kHz    469.000000 MHz (aspect undefined, no 3D stereo)
               Hfront   48 Hsync  32 Hback   80 Hpol P
               Vfront    3 Vsync  10 Vback   28 Vpol N
  Checksum: 0x88
Checksum: 0x90

----------------

Warnings:

Block 1, CTA-861 Extension Block:
  Video Data Block: VIC 63 and the first DTD are not identical. Is this intended?
  Video Capability Data Block: S_PT is equal to S_IT and S_CE, so should be set to 0 instead.
  Detailed Timing Descriptor #3: Image size is 1087x306 mm, but based on the picture AR it should be 544x306 mm.
  Detailed Timing Descriptor #4: Image size is 1087x306 mm, but based on the picture AR it should be 544x306 mm.
  Add a Colorimetry Data Block with the sRGB colorimetry bit set to avoid interop issues.
EDID:
  Base EDID: Some timings are out of range of the Monitor Ranges:
    Horizontal Freq: 31.250 - 244.365 kHz (Monitor: 250.000 - 250.000 kHz)

Failures:

EDID:
  Extension Block 3 started with EDID header, ignoring Extension Blocks >= 3.
  DisplayID: Missing DisplayID Display Parameters Data Block.

EDID conformity: FAIL
