edid-decode (hex):

00 ff ff ff ff ff ff 00 06 af a6 31 00 00 00 00
31 20 01 04 a5 22 16 78 03 29 d5 ad 52 43 b0 24
0f 50 54 00 00 00 01 01 01 01 01 01 01 01 01 01
01 01 01 01 01 01 86 3d 80 c8 70 b0 26 40 6c 30
aa 00 58 d7 10 00 00 1a 38 31 80 c8 70 b0 26 40
6c 30 aa 00 58 d7 10 00 00 1a 00 00 00 fe 00 38
47 30 4a 56 80 42 31 36 30 55 41 4e 00 00 00 00
00 02 41 22 b2 00 03 00 00 0a 41 0a 20 20 00 b6

00 ff ff ff ff ff ff 00 06 af a6 31 00 00 00 00
31 20 01 04 a5 22 16 78 03 29 d5 ad 52 43 b0 24
0f 50 54 00 00 00 01 01 01 01 01 01 01 01 01 01
01 01 01 01 01 01 86 3d 80 c8 70 b0 26 40 6c 30
aa 00 58 d7 10 00 00 1a 38 31 80 c8 70 b0 26 40
6c 30 aa 00 58 d7 10 00 00 1a 00 00 00 fe 00 38
47 30 4a 56 80 42 31 36 30 55 41 4e 00 00 00 00
00 02 41 22 b2 00 03 00 00 0a 41 0a 20 20 00 b6

----------------

Block 0, Base EDID:
  EDID Structure Version & Revision: 1.4
  Vendor & Product Identification:
    Manufacturer: AUO
    Model: 12710
    Made in: week 49 of 2022
  Basic Display Parameters & Features:
    Digital display
    Bits per primary color channel: 8
    DisplayPort interface
    Maximum image size: 34 cm x 22 cm
    Gamma: 2.20
    Supported color formats: RGB 4:4:4
    First detailed timing includes the native pixel format and preferred refresh rate
    Display supports continuous frequencies
  Color Characteristics:
    Red  : 0.6757, 0.3222
    Green: 0.2636, 0.6884
    Blue : 0.1435, 0.0595
    White: 0.3134, 0.3291
  Established Timings I & II: none
  Standard Timings: none
  Detailed Timing Descriptors:
    DTD 1:  1920x1200   60.010059 Hz  16:10    74.292 kHz    157.500000 MHz (344 mm x 215 mm)
                 Hfront  108 Hsync  48 Hback   44 Hpol P
                 Vfront   10 Vsync  10 Vback   18 Vpol N
    DTD 2:  1920x1200   48.008047 Hz  16:10    59.434 kHz    126.000000 MHz (344 mm x 215 mm)
                 Hfront  108 Hsync  48 Hback   44 Hpol P
                 Vfront   10 Vsync  10 Vback   18 Vpol N
    Alphanumeric Data String: '8G0JV.B160UAN'
    Manufacturer-Specified Display Descriptor (0x00): 00 00 00 02 41 22 b2 00 03 00 00 0a 41 0a 20 20 '....A"......A.  '
Checksum: 0xb6

----------------

Warnings:

Block 0, Base EDID:
  Alphanumeric Data String: Non-ASCII character 0x80 at position 5, can cause problems.
  Missing Display Product Name.

Failures:

Block 0, Base EDID:
  Missing Display Range Limits Descriptor.
EDID:
  Extension Block 1 started with EDID header, ignoring Extension Blocks >= 1.

EDID conformity: FAIL
