edid-decode (hex):

00 ff ff ff ff ff ff 00 4c 23 00 24 01 00 00 00
2c 1f 01 04 a5 35 1e 78 3b 8b e5 a6 54 45 9f 26
0d 50 54 af cf 00 81 80 b3 00 95 00 81 80 95 00
61 40 45 40 b3 00 02 3a 80 18 71 38 2d 40 58 2c
45 00 12 2c 21 00 00 1e 00 00 00 ff 00 30 30 30
30 30 30 30 31 30 30 30 30 0a 00 00 00 fd 00 30
a5 a3 a3 28 01 0a 20 20 20 20 20 20 00 00 00 fc
00 44 50 0a 20 20 20 20 20 20 20 20 20 20 01 bc

02 03 2f f1 50 90 00 04 03 02 07 00 01 1f 12 13
00 00 00 11 00 23 09 07 07 83 01 00 00 e3 05 03
01 6d 1a 00 00 02 01 30 a5 00 00 00 00 00 00 7d
84 80 c8 70 38 1f 40 58 2c 45 00 12 2c 21 00 00
1e 01 1d 80 18 71 1c 16 20 58 2c 25 00 12 2c 21
00 00 9e 68 6e 80 c8 70 38 1f 40 58 2c 45 00 12
2c 21 00 00 1e cf 97 80 c8 70 38 1f 40 58 2c 45
00 12 2c 21 00 00 1e 00 00 00 00 00 00 00 00 71

00 ff ff ff ff ff ff 00 4c 23 00 24 01 00 00 00
2c 1f 01 04 a5 35 1e 78 3b 8b e5 a6 54 45 9f 26
0d 50 54 af cf 00 81 80 b3 00 95 00 81 80 95 00
61 40 45 40 b3 00 02 3a 80 18 71 38 2d 40 58 2c
45 00 12 2c 21 00 00 1e 00 00 00 ff 00 30 30 30
30 30 30 30 31 30 30 30 30 0a 00 00 00 fd 00 30
a5 a3 a3 28 01 0a 20 20 20 20 20 20 00 00 00 fc
00 44 50 0a 20 20 20 20 20 20 20 20 20 20 01 bc

02 03 2f f1 50 90 00 04 03 02 07 00 01 1f 12 13
00 00 00 11 00 23 09 07 07 83 01 00 00 e3 05 03
01 6d 1a 00 00 02 01 30 a5 00 00 00 00 00 00 7d
84 80 c8 70 38 1f 40 58 2c 45 00 12 2c 21 00 00
1e 01 1d 80 18 71 1c 16 20 58 2c 25 00 12 2c 21
00 00 9e 68 6e 80 c8 70 38 1f 40 58 2c 45 00 12
2c 21 00 00 1e cf 97 80 c8 70 38 1f 40 58 2c 45
00 12 2c 21 00 00 1e 00 00 00 00 00 00 00 00 71

----------------

Block 0, Base EDID:
  EDID Structure Version & Revision: 1.4
  Vendor & Product Identification:
    Manufacturer: SAC
    Model: 9216
    Serial Number: ...
    Made in: week 44 of 2021
  Basic Display Parameters & Features:
    Digital display
    Bits per primary color channel: 8
    DisplayPort interface
    Maximum image size: 53 cm x 30 cm
    Gamma: 2.20
    DPMS levels: Off
    Supported color formats: RGB 4:4:4, YCrCb 4:4:4, YCrCb 4:2:2
    First detailed timing includes the native pixel format and preferred refresh rate
    Display supports continuous frequencies
  Color Characteristics:
    Red  : 0.6503, 0.3281
    Green: 0.2714, 0.6240
    Blue : 0.1513, 0.0527
    White: 0.3134, 0.3291
  Established Timings I & II:
    IBM     :   720x400    70.081663 Hz   9:5     31.467 kHz     28.320000 MHz
    DMT 0x04:   640x480    59.940476 Hz   4:3     31.469 kHz     25.175000 MHz
    DMT 0x05:   640x480    72.808802 Hz   4:3     37.861 kHz     31.500000 MHz
    DMT 0x06:   640x480    75.000000 Hz   4:3     37.500 kHz     31.500000 MHz
    DMT 0x08:   800x600    56.250000 Hz   4:3     35.156 kHz     36.000000 MHz
    DMT 0x09:   800x600    60.316541 Hz   4:3     37.879 kHz     40.000000 MHz
    DMT 0x0a:   800x600    72.187572 Hz   4:3     48.077 kHz     50.000000 MHz
    DMT 0x0b:   800x600    75.000000 Hz   4:3     46.875 kHz     49.500000 MHz
    DMT 0x10:  1024x768    60.003840 Hz   4:3     48.363 kHz     65.000000 MHz
    DMT 0x11:  1024x768    70.069359 Hz   4:3     56.476 kHz     75.000000 MHz
    DMT 0x12:  1024x768    75.028582 Hz   4:3     60.023 kHz     78.750000 MHz
    DMT 0x24:  1280x1024   75.024675 Hz   5:4     79.976 kHz    135.000000 MHz
  Standard Timings:
    DMT 0x23:  1280x1024   60.019740 Hz   5:4     63.981 kHz    108.000000 MHz
    DMT 0x3a:  1680x1050   59.954250 Hz  16:10    65.290 kHz    146.250000 MHz
    DMT 0x2f:  1440x900    59.887445 Hz  16:10    55.935 kHz    106.500000 MHz
    DMT 0x23:  1280x1024   60.019740 Hz   5:4     63.981 kHz    108.000000 MHz
    DMT 0x2f:  1440x900    59.887445 Hz  16:10    55.935 kHz    106.500000 MHz
    DMT 0x10:  1024x768    60.003840 Hz   4:3     48.363 kHz     65.000000 MHz
    DMT 0x09:   800x600    60.316541 Hz   4:3     37.879 kHz     40.000000 MHz
    DMT 0x3a:  1680x1050   59.954250 Hz  16:10    65.290 kHz    146.250000 MHz
  Detailed Timing Descriptors:
    DTD 1:  1920x1080   60.000000 Hz  16:9     67.500 kHz    148.500000 MHz (530 mm x 300 mm)
                 Hfront   88 Hsync  44 Hback  148 Hpol P
                 Vfront    4 Vsync   5 Vback   36 Vpol P
    Display Product Serial Number: ...
    Display Range Limits:
      Monitor ranges (Range Limits Only): 48-165 Hz V, 163-163 kHz H, max dotclock 400 MHz
    Display Product Name: 'DP'
  Extension blocks: 1
Checksum: 0xbc

----------------

Block 1, CTA-861 Extension Block:
  Revision: 3
  Underscans IT Video Formats by default
  Basic audio support
  Supports YCbCr 4:4:4
  Supports YCbCr 4:2:2
  Native detailed modes: 1
  Video Data Block:
    VIC  16:  1920x1080   60.000000 Hz  16:9     67.500 kHz    148.500000 MHz (native)
    VIC   4:  1280x720    60.000000 Hz  16:9     45.000 kHz     74.250000 MHz
    VIC   3:   720x480    59.940060 Hz  16:9     31.469 kHz     27.000000 MHz
    VIC   2:   720x480    59.940060 Hz   4:3     31.469 kHz     27.000000 MHz
    VIC   7:  1440x480i   59.940060 Hz  16:9     15.734 kHz     27.000000 MHz
    VIC   1:   640x480    59.940476 Hz   4:3     31.469 kHz     25.175000 MHz
    VIC  31:  1920x1080   50.000000 Hz  16:9     56.250 kHz    148.500000 MHz
    VIC  18:   720x576    50.000000 Hz  16:9     31.250 kHz     27.000000 MHz
    VIC  19:  1280x720    50.000000 Hz  16:9     37.500 kHz     74.250000 MHz
    VIC  17:   720x576    50.000000 Hz   4:3     31.250 kHz     27.000000 MHz
  Audio Data Block:
    Linear PCM:
      Max channels: 2
      Supported sample rates (kHz): 48 44.1 32
      Supported sample sizes (bits): 24 20 16
  Speaker Allocation Data Block:
    FL/FR - Front Left/Right
  Colorimetry Data Block:
    xvYCC601
    xvYCC709
    Gamut Boundary Description Metadata Profile P0
  Vendor-Specific Data Block (AMD), OUI 00-00-1A:
    Version: 2
    Feature Caps: 0x01
    Minimum Refresh Rate: 48 Hz
    Maximum Refresh Rate: 165 Hz
    Flags 1.x: 0x00
    Flags 2.x: 0x00
  Detailed Timing Descriptors:
    DTD 2:  1920x1080  144.001664 Hz  16:9    159.986 kHz    339.170000 MHz (530 mm x 300 mm)
                 Hfront   88 Hsync  44 Hback   68 Hpol P
                 Vfront    4 Vsync   5 Vback   22 Vpol P
    DTD 3:  1920x1080i  60.000000 Hz  16:9     33.750 kHz     74.250000 MHz (530 mm x 300 mm)
                 Hfront   88 Hsync  44 Hback  148 Hpol P
                 Vfront    2 Vsync   5 Vback   15 Vpol P Vfront +0.5 Odd Field
                 Vfront    2 Vsync   5 Vback   15 Vpol P Vback  +0.5 Even Field
    DTD 4:  1920x1080  120.000679 Hz  16:9    133.321 kHz    282.640000 MHz (530 mm x 300 mm)
                 Hfront   88 Hsync  44 Hback   68 Hpol P
                 Vfront    4 Vsync   5 Vback   22 Vpol P
    DTD 5:  1920x1080  165.000934 Hz  16:9    183.316 kHz    388.630000 MHz (530 mm x 300 mm)
                 Hfront   88 Hsync  44 Hback   68 Hpol P
                 Vfront    4 Vsync   5 Vback   22 Vpol P
Checksum: 0x71  Unused space in Extension Block: 8 bytes

----------------

Block 2, Unknown EDID Extension Block 0x00:
  00 ff ff ff ff ff ff 00 4c 23 00 24 01 00 00 00 '........L#.$....'
  2c 1f 01 04 a5 35 1e 78 3b 8b e5 a6 54 45 9f 26 ',....5.x;...TE.&'
  0d 50 54 af cf 00 81 80 b3 00 95 00 81 80 95 00 '.PT.............'
  61 40 45 40 b3 00 02 3a 80 18 71 38 2d 40 58 2c 'a@E@...:..q8-@X,'
  45 00 12 2c 21 00 00 1e 00 00 00 ff 00 30 30 30 'E..,!........000'
  30 30 30 30 31 30 30 30 30 0a 00 00 00 fd 00 30 '000010000......0'
  a5 a3 a3 28 01 0a 20 20 20 20 20 20 00 00 00 fc '...(..      ....'
  00 44 50 0a 20 20 20 20 20 20 20 20 20 20 01 bc '.DP.          ..'
Checksum: 0xbc

----------------

Block 3, CTA-861 Extension Block:
  Revision: 3
  Underscans IT Video Formats by default
  Basic audio support
  Supports YCbCr 4:4:4
  Supports YCbCr 4:2:2
  Native detailed modes: 1
  Video Data Block:
    VIC  16:  1920x1080   60.000000 Hz  16:9     67.500 kHz    148.500000 MHz (native)
    VIC   4:  1280x720    60.000000 Hz  16:9     45.000 kHz     74.250000 MHz
    VIC   3:   720x480    59.940060 Hz  16:9     31.469 kHz     27.000000 MHz
    VIC   2:   720x480    59.940060 Hz   4:3     31.469 kHz     27.000000 MHz
    VIC   7:  1440x480i   59.940060 Hz  16:9     15.734 kHz     27.000000 MHz
    VIC   1:   640x480    59.940476 Hz   4:3     31.469 kHz     25.175000 MHz
    VIC  31:  1920x1080   50.000000 Hz  16:9     56.250 kHz    148.500000 MHz
    VIC  18:   720x576    50.000000 Hz  16:9     31.250 kHz     27.000000 MHz
    VIC  19:  1280x720    50.000000 Hz  16:9     37.500 kHz     74.250000 MHz
    VIC  17:   720x576    50.000000 Hz   4:3     31.250 kHz     27.000000 MHz
  Audio Data Block:
    Linear PCM:
      Max channels: 2
      Supported sample rates (kHz): 48 44.1 32
      Supported sample sizes (bits): 24 20 16
  Speaker Allocation Data Block:
    FL/FR - Front Left/Right
  Colorimetry Data Block:
    xvYCC601
    xvYCC709
    Gamut Boundary Description Metadata Profile P0
  Vendor-Specific Data Block (AMD), OUI 00-00-1A:
    Version: 2
    Feature Caps: 0x01
    Minimum Refresh Rate: 48 Hz
    Maximum Refresh Rate: 165 Hz
    Flags 1.x: 0x00
    Flags 2.x: 0x00
  Detailed Timing Descriptors:
    DTD 6:  1920x1080  144.001664 Hz  16:9    159.986 kHz    339.170000 MHz (530 mm x 300 mm)
                 Hfront   88 Hsync  44 Hback   68 Hpol P
                 Vfront    4 Vsync   5 Vback   22 Vpol P
    DTD 7:  1920x1080i  60.000000 Hz  16:9     33.750 kHz     74.250000 MHz (530 mm x 300 mm)
                 Hfront   88 Hsync  44 Hback  148 Hpol P
                 Vfront    2 Vsync   5 Vback   15 Vpol P Vfront +0.5 Odd Field
                 Vfront    2 Vsync   5 Vback   15 Vpol P Vback  +0.5 Even Field
    DTD 8:  1920x1080  120.000679 Hz  16:9    133.321 kHz    282.640000 MHz (530 mm x 300 mm)
                 Hfront   88 Hsync  44 Hback   68 Hpol P
                 Vfront    4 Vsync   5 Vback   22 Vpol P
    DTD 9:  1920x1080  165.000934 Hz  16:9    183.316 kHz    388.630000 MHz (530 mm x 300 mm)
                 Hfront   88 Hsync  44 Hback   68 Hpol P
                 Vfront    4 Vsync   5 Vback   22 Vpol P
Checksum: 0x71  Unused space in Extension Block: 8 bytes

----------------

Warnings:

Block 0, Base EDID:
  Vendor & Product Identification: The serial number is one of the known dummy values, it should probably be set to 0.
  Display Product Serial Number: ...
Block 1, CTA-861 Extension Block:
  Colorimetry Data Block: Set the sRGB colorimetry bit to avoid interop issues.
  Detailed Timing Descriptor #3: DTD is identical to VIC 5, which is not present in the CTA Ext Block.
  Display Product Serial Number is set, so the Serial Number in the Base EDID should be 0.
Block 3, CTA-861 Extension Block:
  Colorimetry Data Block: Set the sRGB colorimetry bit to avoid interop issues.
  Detailed Timing Descriptor #7: DTD is identical to VIC 5, which is not present in the CTA Ext Block.
EDID:
  Base EDID: Some timings are out of range of the Monitor Ranges:
    Horizontal Freq: 15.734 - 183.316 kHz (Monitor: 163.000 - 163.000 kHz)
  CTA-861: Multiple native progressive timings are defined.

Failures:

Block 1, CTA-861 Extension Block:
  Missing VCDB, needed for Set Selectable RGB Quantization to avoid interop issues.
Block 2, Base EDID:
  Unknown Extension Block.
Block 3, CTA-861 Extension Block:
  Video Data Block: Duplicate VIC 16.
  Video Data Block: Duplicate VIC 4.
  Video Data Block: Duplicate VIC 3.
  Video Data Block: Duplicate VIC 2.
  Video Data Block: Duplicate VIC 7.
  Video Data Block: Duplicate VIC 1.
  Video Data Block: Duplicate VIC 31.
  Video Data Block: Duplicate VIC 18.
  Video Data Block: Duplicate VIC 19.
  Video Data Block: Duplicate VIC 17.
  Speaker Allocation Data Block: Only one instance of this Data Block is allowed.
  Colorimetry Data Block: Only one instance of this Data Block is allowed.
EDID:
  Base EDID: EDID specified 1 extension block(s), but found 3 extension block(s).

EDID conformity: FAIL
