edid-decode (hex):

00 ff ff ff ff ff ff 00 4a 8b 00 00 01 01 01 01
1e 0c 01 01 0e 24 1b 78 e8 8a 01 9a 58 52 8b 28
1e 50 54 01 08 00 61 40 61 40 61 40 61 40 a9 c0
a9 c0 61 40 a9 c0 0e 1f 00 80 51 00 1e 30 40 80
37 00 20 20 63 00 00 06 f4 1f 80 70 41 60 21 30
40 78 34 00 20 20 63 00 00 06 0e 1f 00 80 51 00
1e 30 40 80 37 00 20 20 63 00 00 06 0e 1f 00 80
51 00 1e 30 40 80 37 00 20 20 63 00 00 06 00 59

----------------

Block 0, Base EDID:
  EDID Structure Version & Revision: 1.1
  Vendor & Product Identification:
    Manufacturer: RTK
    Model: 0
    Serial Number: ...
    Made in: week 30 of 2002
  Basic Display Parameters & Features:
    Analog display
    Signal Level Standard: 0.700 : 0.300 : 1.000 V p-p
    Blank level equals black level
    Sync: Separate Composite SyncOnGreen
    Maximum image size: 36 cm x 27 cm
    Gamma: 2.20
    DPMS levels: Standby Suspend Off
    RGB color display
  Color Characteristics:
    Red  : 0.6035, 0.3437
    Green: 0.3222, 0.5449
    Blue : 0.1562, 0.1171
    White: 0.3125, 0.3291
  Established Timings I & II:
    DMT 0x09:   800x600    60.316541 Hz   4:3     37.879 kHz     40.000000 MHz
    DMT 0x10:  1024x768    60.003840 Hz   4:3     48.363 kHz     65.000000 MHz
  Standard Timings:
    DMT 0x10:  1024x768    60.003840 Hz   4:3     48.363 kHz     65.000000 MHz
    DMT 0x10:  1024x768    60.003840 Hz   4:3     48.363 kHz     65.000000 MHz
    DMT 0x10:  1024x768    60.003840 Hz   4:3     48.363 kHz     65.000000 MHz
    DMT 0x10:  1024x768    60.003840 Hz   4:3     48.363 kHz     65.000000 MHz
    DMT 0x53:  1600x900    60.000000 Hz  16:9     60.000 kHz    108.000000 MHz (RB)
    DMT 0x53:  1600x900    60.000000 Hz  16:9     60.000 kHz    108.000000 MHz (RB)
    DMT 0x10:  1024x768    60.003840 Hz   4:3     48.363 kHz     65.000000 MHz
    DMT 0x53:  1600x900    60.000000 Hz  16:9     60.000 kHz    108.000000 MHz (RB)
  Detailed Timing Descriptors:
    DTD 1:  1280x768    59.870228 Hz   5:3     47.776 kHz     79.500000 MHz (analog composite, serrate, 1568 mm x 800 mm)
                 Hfront   64 Hsync 128 Hback  192 Hpol N
                 Vfront    3 Vsync   7 Vback   20 Vpol N
    DTD 2:  1152x864    59.995306 Hz   4:3     53.816 kHz     81.800000 MHz (analog composite, serrate, 1568 mm x 800 mm)
                 Hfront   64 Hsync 120 Hback  184 Hpol N
                 Vfront    3 Vsync   4 Vback   26 Vpol N
    DTD 3:  1280x768    59.870228 Hz   5:3     47.776 kHz     79.500000 MHz (analog composite, serrate, 1568 mm x 800 mm)
                 Hfront   64 Hsync 128 Hback  192 Hpol N
                 Vfront    3 Vsync   7 Vback   20 Vpol N
    DTD 4:  1280x768    59.870228 Hz   5:3     47.776 kHz     79.500000 MHz (analog composite, serrate, 1568 mm x 800 mm)
                 Hfront   64 Hsync 128 Hback  192 Hpol N
                 Vfront    3 Vsync   7 Vback   20 Vpol N
Checksum: 0x59

----------------

Warnings:

Block 0, Base EDID:
  EDID Structure Version & Revision: EDID 1.1 is deprecated, do not use.
  Vendor & Product Identification: The serial number is one of the known dummy values, it should probably be set to 0.
  Detailed Timing Descriptor #1: DTD is similar but not identical to DMT 0x17.
  Detailed Timing Descriptor #1: Image size is 1568x800 mm, but based on the picture AR it should be 1333x800 mm.
  Detailed Timing Descriptor #2: Image size is 1568x800 mm, but based on the picture AR it should be 1066x800 mm.
  Detailed Timing Descriptor #3: DTD is similar but not identical to DMT 0x17.
  Detailed Timing Descriptor #3: Image size is 1568x800 mm, but based on the picture AR it should be 1333x800 mm.
  Detailed Timing Descriptor #4: DTD is similar but not identical to DMT 0x17.
  Detailed Timing Descriptor #4: Image size is 1568x800 mm, but based on the picture AR it should be 1333x800 mm.

Failures:

Block 0, Base EDID:
  Detailed Timing Descriptor #1: Mismatch of image size 1568x800 mm vs display size 360x270 mm.
  Detailed Timing Descriptor #2: Mismatch of image size 1568x800 mm vs display size 360x270 mm.
  Detailed Timing Descriptor #3: Mismatch of image size 1568x800 mm vs display size 360x270 mm.
  Detailed Timing Descriptor #4: Mismatch of image size 1568x800 mm vs display size 360x270 mm.
EDID:
  Base EDID: The DTD max image size is 1568x800mm, which is larger than the display size 360.0x270.0mm.

EDID conformity: FAIL
