edid-decode (hex):

00 ff ff ff ff ff ff 00 30 e4 b9 01 00 00 00 00
00 12 01 03 80 16 0d 78 0a bf b5 96 58 54 8b 27
20 50 54 00 00 00 01 01 01 01 01 01 01 01 01 01
01 01 01 01 01 01 d8 13 00 40 41 58 1e 20 30 20
36 00 e0 7e 00 00 00 19 00 00 00 00 00 00 00 00
00 00 00 00 00 00 00 00 00 00 00 00 00 fe 00 4c
47 20 44 69 73 70 6c 61 79 0a 20 20 00 00 00 fc
00 4c 50 31 30 31 57 53 31 2d 54 4c 41 31 00 ad

00 ff ff ff ff ff ff 00 30 e4 b9 01 00 00 00 00
00 12 01 03 80 16 0d 78 0a bf b5 96 58 54 8b 27
20 50 54 00 00 00 01 01 01 01 01 01 01 01 01 01
01 01 01 01 01 01 d8 13 00 40 41 58 1e 20 30 20
36 00 e0 7e 00 00 00 19 00 00 00 00 00 00 00 00
00 00 00 00 00 00 00 00 00 00 00 00 00 fe 00 4c
47 20 44 69 73 70 6c 61 79 0a 20 20 00 00 00 fc
00 4c 50 31 30 31 57 53 31 2d 54 4c 41 31 00 ad

----------------

Block 0, Base EDID:
  EDID Structure Version & Revision: 1.3
  Vendor & Product Identification:
    Manufacturer: LGD
    Model: 441
    Made in: 2008
  Basic Display Parameters & Features:
    Digital display
    Maximum image size: 22 cm x 13 cm
    Gamma: 2.20
    RGB color display
    First detailed timing is the preferred timing
  Color Characteristics:
    Red  : 0.5878, 0.3466
    Green: 0.3310, 0.5458
    Blue : 0.1542, 0.1279
    White: 0.3134, 0.3291
  Established Timings I & II: none
  Standard Timings: none
  Detailed Timing Descriptors:
    DTD 1:  1024x600    59.996221 Hz 128:75    37.798 kHz     50.800000 MHz (224 mm x 126 mm)
                 Hfront   48 Hsync  32 Hback  240 Hpol N
                 Vfront    3 Vsync   6 Vback   21 Vpol N
    Empty Descriptor
    Alphanumeric Data String: 'LG Display'
    Display Product Name: 'LP101WS1-TLA1'
Checksum: 0xad

----------------

Failures:

Block 0, Base EDID:
  Empty Descriptor: Use Dummy Descriptor instead of all zeroes.
  Missing Display Range Limits Descriptor.
EDID:
  Extension Block 1 started with EDID header, ignoring Extension Blocks >= 1.

EDID conformity: FAIL
