edid-decode (hex):

00 ff ff ff ff ff ff 00 4e 14 05 0a 00 00 00 00
29 1d 01 04 a5 38 1e 78 03 1d f5 ae 4f 35 b3 25
0d 50 54 ad cf 00 d1 c0 b3 00 d1 c0 71 4f d1 c0
81 80 d1 c0 01 01 4e 96 80 c8 70 38 14 40 18 20
35 00 55 50 21 00 00 1a 02 3a 80 18 71 38 2d 40
58 2c 45 00 ba 89 21 00 00 1e 00 00 00 fc 00 53
63 65 70 74 72 65 20 4d 32 35 0a 20 00 00 00 fd
00 30 a5 b6 b6 27 01 0a 20 20 20 20 20 20 01 26

02 03 1e f1 50 90 05 04 03 02 07 16 01 06 11 12
15 13 14 1f 20 23 09 1f 07 83 01 00 00 03 92 6d
80 c8 70 38 14 40 18 20 32 00 55 89 21 00 00 1e
00 00 00 ff 00 10 0a 20 20 20 20 20 20 20 20 20
20 20 00 00 00 ff 00 10 30 30 0a 20 20 20 20 20
20 20 20 20 00 00 00 ff 00 30 30 0a 20 20 20 20
20 20 20 20 20 20 00 00 00 00 00 00 00 00 00 00
00 00 00 00 00 00 00 00 00 00 00 00 00 00 00 de

00 ff ff ff ff ff ff 00 4e 14 05 0a 00 00 00 00
29 1d 01 04 a5 38 1e 78 03 1d f5 ae 4f 35 b3 25
0d 50 54 ad cf 00 d1 c0 b3 00 d1 c0 71 4f d1 c0
81 80 d1 c0 01 01 4e 96 80 c8 70 38 14 40 18 20
35 00 55 50 21 00 00 1a 02 3a 80 18 71 38 2d 40
58 2c 45 00 ba 89 21 00 00 1e 00 00 00 fc 00 53
63 65 70 74 72 65 20 4d 32 35 0a 20 00 00 00 fd
00 30 a5 b6 b6 27 01 0a 20 20 20 20 20 20 01 26

02 03 1e f1 50 90 05 04 03 02 07 16 01 06 11 12
15 13 14 1f 20 23 09 1f 07 83 01 00 00 03 92 6d
80 c8 70 38 14 40 18 20 32 00 55 89 21 00 00 1e
00 00 00 ff 00 10 0a 20 20 20 20 20 20 20 20 20
20 20 00 00 00 ff 00 10 30 30 0a 20 20 20 20 20
20 20 20 20 00 00 00 ff 00 30 30 0a 20 20 20 20
20 20 20 20 20 20 00 00 00 00 00 00 00 00 00 00
00 00 00 00 00 00 00 00 00 00 00 00 00 00 00 de

----------------

Block 0, Base EDID:
  EDID Structure Version & Revision: 1.4
  Vendor & Product Identification:
    Manufacturer: SPT
    Model: 2565
    Made in: week 41 of 2019
  Basic Display Parameters & Features:
    Digital display
    Bits per primary color channel: 8
    DisplayPort interface
    Maximum image size: 56 cm x 30 cm
    Gamma: 2.20
    Supported color formats: RGB 4:4:4
    First detailed timing includes the native pixel format and preferred refresh rate
    Display supports continuous frequencies
  Color Characteristics:
    Red  : 0.6796, 0.3095
    Green: 0.2099, 0.7001
    Blue : 0.1474, 0.0537
    White: 0.3134, 0.3291
  Established Timings I & II:
    IBM     :   720x400    70.081663 Hz   9:5     31.467 kHz     28.320000 MHz
    DMT 0x04:   640x480    59.940476 Hz   4:3     31.469 kHz     25.175000 MHz
    DMT 0x05:   640x480    72.808802 Hz   4:3     37.861 kHz     31.500000 MHz
    DMT 0x06:   640x480    75.000000 Hz   4:3     37.500 kHz     31.500000 MHz
    DMT 0x09:   800x600    60.316541 Hz   4:3     37.879 kHz     40.000000 MHz
    DMT 0x0a:   800x600    72.187572 Hz   4:3     48.077 kHz     50.000000 MHz
    DMT 0x0b:   800x600    75.000000 Hz   4:3     46.875 kHz     49.500000 MHz
    DMT 0x10:  1024x768    60.003840 Hz   4:3     48.363 kHz     65.000000 MHz
    DMT 0x11:  1024x768    70.069359 Hz   4:3     56.476 kHz     75.000000 MHz
    DMT 0x12:  1024x768    75.028582 Hz   4:3     60.023 kHz     78.750000 MHz
    DMT 0x24:  1280x1024   75.024675 Hz   5:4     79.976 kHz    135.000000 MHz
  Standard Timings:
    DMT 0x52:  1920x1080   60.000000 Hz  16:9     67.500 kHz    148.500000 MHz
    DMT 0x3a:  1680x1050   59.954250 Hz  16:10    65.290 kHz    146.250000 MHz
    DMT 0x52:  1920x1080   60.000000 Hz  16:9     67.500 kHz    148.500000 MHz
    DMT 0x15:  1152x864    75.000000 Hz   4:3     67.500 kHz    108.000000 MHz
    DMT 0x52:  1920x1080   60.000000 Hz  16:9     67.500 kHz    148.500000 MHz
    DMT 0x23:  1280x1024   60.019740 Hz   5:4     63.981 kHz    108.000000 MHz
    DMT 0x52:  1920x1080   60.000000 Hz  16:9     67.500 kHz    148.500000 MHz
  Detailed Timing Descriptors:
    DTD 1:  1920x1080  165.000000 Hz  16:9    181.500 kHz    384.780000 MHz (597 mm x 336 mm)
                 Hfront   24 Hsync  32 Hback  144 Hpol P
                 Vfront    3 Vsync   5 Vback   12 Vpol N
    DTD 2:  1920x1080   60.000000 Hz  16:9     67.500 kHz    148.500000 MHz (698 mm x 393 mm)
                 Hfront   88 Hsync  44 Hback  148 Hpol P
                 Vfront    4 Vsync   5 Vback   36 Vpol P
    Display Product Name: 'Sceptre M25'
    Display Range Limits:
      Monitor ranges (Range Limits Only): 48-165 Hz V, 182-182 kHz H, max dotclock 390 MHz
  Extension blocks: 1
Checksum: 0x26

----------------

Block 1, CTA-861 Extension Block:
  Revision: 3
  Underscans IT Video Formats by default
  Basic audio support
  Supports YCbCr 4:4:4
  Supports YCbCr 4:2:2
  Native detailed modes: 1
  Video Data Block:
    VIC  16:  1920x1080   60.000000 Hz  16:9     67.500 kHz    148.500000 MHz (native)
    VIC   5:  1920x1080i  60.000000 Hz  16:9     33.750 kHz     74.250000 MHz
    VIC   4:  1280x720    60.000000 Hz  16:9     45.000 kHz     74.250000 MHz
    VIC   3:   720x480    59.940060 Hz  16:9     31.469 kHz     27.000000 MHz
    VIC   2:   720x480    59.940060 Hz   4:3     31.469 kHz     27.000000 MHz
    VIC   7:  1440x480i   59.940060 Hz  16:9     15.734 kHz     27.000000 MHz
    VIC  22:  1440x576i   50.000000 Hz  16:9     15.625 kHz     27.000000 MHz
    VIC   1:   640x480    59.940476 Hz   4:3     31.469 kHz     25.175000 MHz
    VIC   6:  1440x480i   59.940060 Hz   4:3     15.734 kHz     27.000000 MHz
    VIC  17:   720x576    50.000000 Hz   4:3     31.250 kHz     27.000000 MHz
    VIC  18:   720x576    50.000000 Hz  16:9     31.250 kHz     27.000000 MHz
    VIC  21:  1440x576i   50.000000 Hz   4:3     15.625 kHz     27.000000 MHz
    VIC  19:  1280x720    50.000000 Hz  16:9     37.500 kHz     74.250000 MHz
    VIC  20:  1920x1080i  50.000000 Hz  16:9     28.125 kHz     74.250000 MHz
    VIC  31:  1920x1080   50.000000 Hz  16:9     56.250 kHz    148.500000 MHz
    VIC  32:  1920x1080   24.000000 Hz  16:9     27.000 kHz     74.250000 MHz
  Audio Data Block:
    Linear PCM:
      Max channels: 2
      Supported sample rates (kHz): 96 88.2 48 44.1 32
      Supported sample sizes (bits): 24 20 16
  Speaker Allocation Data Block:
    FL/FR - Front Left/Right
  Unknown CTA-861 Data Block (tag 0x00, length 3):
    92 6d 80                                        '.m.'
  Detailed Timing Descriptors:
    DTD 3:  1920x1080  120.283019 Hz  16:9    132.311 kHz    280.500000 MHz (597 mm x 393 mm)
                 Hfront   24 Hsync  32 Hback  144 Hpol P
                 Vfront    3 Vsync   2 Vback   15 Vpol P
    Display Product Serial Number: ...
    Display Product Serial Number: ...
    Display Product Serial Number: ...
Checksum: 0xde  Unused space in Extension Block: 25 bytes

----------------

Block 2, Unknown EDID Extension Block 0x00:
  00 ff ff ff ff ff ff 00 4e 14 05 0a 00 00 00 00 '........N.......'
  29 1d 01 04 a5 38 1e 78 03 1d f5 ae 4f 35 b3 25 ')....8.x....O5.%'
  0d 50 54 ad cf 00 d1 c0 b3 00 d1 c0 71 4f d1 c0 '.PT.........qO..'
  81 80 d1 c0 01 01 4e 96 80 c8 70 38 14 40 18 20 '......N...p8.@. '
  35 00 55 50 21 00 00 1a 02 3a 80 18 71 38 2d 40 '5.UP!....:..q8-@'
  58 2c 45 00 ba 89 21 00 00 1e 00 00 00 fc 00 53 'X,E...!........S'
  63 65 70 74 72 65 20 4d 32 35 0a 20 00 00 00 fd 'ceptre M25. ....'
  00 30 a5 b6 b6 27 01 0a 20 20 20 20 20 20 01 26 '.0...'..      .&'
Checksum: 0x26

----------------

Block 3, CTA-861 Extension Block:
  Revision: 3
  Underscans IT Video Formats by default
  Basic audio support
  Supports YCbCr 4:4:4
  Supports YCbCr 4:2:2
  Native detailed modes: 1
  Video Data Block:
    VIC  16:  1920x1080   60.000000 Hz  16:9     67.500 kHz    148.500000 MHz (native)
    VIC   5:  1920x1080i  60.000000 Hz  16:9     33.750 kHz     74.250000 MHz
    VIC   4:  1280x720    60.000000 Hz  16:9     45.000 kHz     74.250000 MHz
    VIC   3:   720x480    59.940060 Hz  16:9     31.469 kHz     27.000000 MHz
    VIC   2:   720x480    59.940060 Hz   4:3     31.469 kHz     27.000000 MHz
    VIC   7:  1440x480i   59.940060 Hz  16:9     15.734 kHz     27.000000 MHz
    VIC  22:  1440x576i   50.000000 Hz  16:9     15.625 kHz     27.000000 MHz
    VIC   1:   640x480    59.940476 Hz   4:3     31.469 kHz     25.175000 MHz
    VIC   6:  1440x480i   59.940060 Hz   4:3     15.734 kHz     27.000000 MHz
    VIC  17:   720x576    50.000000 Hz   4:3     31.250 kHz     27.000000 MHz
    VIC  18:   720x576    50.000000 Hz  16:9     31.250 kHz     27.000000 MHz
    VIC  21:  1440x576i   50.000000 Hz   4:3     15.625 kHz     27.000000 MHz
    VIC  19:  1280x720    50.000000 Hz  16:9     37.500 kHz     74.250000 MHz
    VIC  20:  1920x1080i  50.000000 Hz  16:9     28.125 kHz     74.250000 MHz
    VIC  31:  1920x1080   50.000000 Hz  16:9     56.250 kHz    148.500000 MHz
    VIC  32:  1920x1080   24.000000 Hz  16:9     27.000 kHz     74.250000 MHz
  Audio Data Block:
    Linear PCM:
      Max channels: 2
      Supported sample rates (kHz): 96 88.2 48 44.1 32
      Supported sample sizes (bits): 24 20 16
  Speaker Allocation Data Block:
    FL/FR - Front Left/Right
  Unknown CTA-861 Data Block (tag 0x00, length 3):
    92 6d 80                                        '.m.'
  Detailed Timing Descriptors:
    DTD 4:  1920x1080  120.283019 Hz  16:9    132.311 kHz    280.500000 MHz (597 mm x 393 mm)
                 Hfront   24 Hsync  32 Hback  144 Hpol P
                 Vfront    3 Vsync   2 Vback   15 Vpol P
    Display Product Serial Number: ...
    Display Product Serial Number: ...
    Display Product Serial Number: ...
Checksum: 0xde  Unused space in Extension Block: 25 bytes

----------------

Warnings:

Block 0, Base EDID:
  Display Product Serial Number: ...
  Display Product Serial Number: ...
  Display Product Serial Number: ...
  Display Product Serial Number: ...
Block 1, CTA-861 Extension Block:
  Video Data Block: VIC 16 and the first DTD are not identical. Is this intended?
  Unknown CTA-861 Data Block (tag 0x00, length 3).
  Detailed Timing Descriptor #3: Image size is 597x393 mm, but based on the picture AR it should be 597x335 mm.
  Display Product Serial Number: ...
  Add a Colorimetry Data Block with the sRGB colorimetry bit set to avoid interop issues.
Block 3, CTA-861 Extension Block:
  Unknown CTA-861 Data Block (tag 0x00, length 3).
  Detailed Timing Descriptor #4: Image size is 597x393 mm, but based on the picture AR it should be 597x335 mm.
  Display Product Serial Number: ...
EDID:
  Base EDID: Some timings are out of range of the Monitor Ranges:
    Vertical Freq: 24.000 - 165.000 Hz (Monitor: 48.000 - 165.000 Hz)
    Horizontal Freq: 15.625 - 181.500 kHz (Monitor: 182.000 - 182.000 kHz)
  Base EDID: Multiple Display Product Serial Numbers are specified, is that intended?
  CTA-861: Multiple native progressive timings are defined.

Failures:

Block 0, Base EDID:
  Detailed Timing Descriptor #1: Mismatch of image size 597x336 mm vs display size 560x300 mm.
  Detailed Timing Descriptor #2: Mismatch of image size 698x393 mm vs display size 560x300 mm.
Block 1, CTA-861 Extension Block:
  Offset is 30, but should be 33.
  Detailed Timing Descriptor #3: Mismatch of image size 597x393 mm vs display size 560x300 mm.
  Missing VCDB, needed for Set Selectable RGB Quantization to avoid interop issues.
Block 2, Base EDID:
  Unknown Extension Block.
Block 3, CTA-861 Extension Block:
  Video Data Block: Duplicate VIC 16.
  Video Data Block: Duplicate VIC 5.
  Video Data Block: Duplicate VIC 4.
  Video Data Block: Duplicate VIC 3.
  Video Data Block: Duplicate VIC 2.
  Video Data Block: Duplicate VIC 7.
  Video Data Block: Duplicate VIC 22.
  Video Data Block: Duplicate VIC 1.
  Video Data Block: Duplicate VIC 6.
  Video Data Block: Duplicate VIC 17.
  Video Data Block: Duplicate VIC 18.
  Video Data Block: Duplicate VIC 21.
  Video Data Block: Duplicate VIC 19.
  Video Data Block: Duplicate VIC 20.
  Video Data Block: Duplicate VIC 31.
  Video Data Block: Duplicate VIC 32.
  Speaker Allocation Data Block: Only one instance of this Data Block is allowed.
  Offset is 30, but should be 33.
  Detailed Timing Descriptor #4: Mismatch of image size 597x393 mm vs display size 560x300 mm.
EDID:
  Base EDID: The DTD max image size is 698x393mm, which is larger than the display size 560.0x300.0mm.
  Base EDID: EDID specified 1 extension block(s), but found 3 extension block(s).

EDID conformity: FAIL
