edid-decode (hex):

00 ff ff ff ff ff ff 00 10 ac 7e a0 4d 57 32 43
32 16 01 03 0e 30 1b 78 ee ee 95 a3 54 4c 99 26
0f 50 54 a5 4b 00 71 4f 81 80 d1 c0 01 01 01 01
01 01 01 01 01 01 02 3a 80 18 71 38 2d 40 58 2c
45 00 dd 0c 11 00 00 1e 00 00 00 ff 00 31 37 34
52 37 32 43 43 43 32 57 4d 0a 00 00 00 fc 00 44
45 4c 4c 20 50 32 32 31 32 48 0a 20 00 00 00 fd
00 38 4c 1e 53 11 00 0a 20 20 20 20 20 20 00 27

00 ff ff ff ff ff ff 00 10 ac 7e a0 4d 57 32 43
32 16 01 03 0e 30 1b 78 ee ee 95 a3 54 4c 99 26
0f 50 54 a5 4b 00 71 4f 81 80 d1 c0 01 01 01 01
01 01 01 01 01 01 02 3a 80 18 71 38 2d 40 58 2c
45 00 dd 0c 11 00 00 1e 00 00 00 ff 00 31 37 34
52 37 32 43 43 43 32 57 4d 0a 00 00 00 fc 00 44
45 4c 4c 20 50 32 32 31 32 48 0a 20 00 00 00 fd
00 38 4c 1e 53 11 00 0a 20 20 20 20 20 20 00 27

----------------

Block 0, Base EDID:
  EDID Structure Version & Revision: 1.3
  Vendor & Product Identification:
    Manufacturer: DEL
    Model: 41086
    Serial Number: ...
    Made in: week 50 of 2012
  Basic Display Parameters & Features:
    Analog display
    Signal Level Standard: 0.700 : 0.300 : 1.000 V p-p
    Blank level equals black level
    Sync: Separate Composite SyncOnGreen
    Maximum image size: 48 cm x 27 cm
    Gamma: 2.20
    DPMS levels: Standby Suspend Off
    RGB color display
    Default (sRGB) color space is primary color space
    First detailed timing is the preferred timing
  Color Characteristics:
    Red  : 0.6396, 0.3300
    Green: 0.2998, 0.5996
    Blue : 0.1503, 0.0595
    White: 0.3134, 0.3291
  Established Timings I & II:
    IBM     :   720x400    70.081663 Hz   9:5     31.467 kHz     28.320000 MHz
    DMT 0x04:   640x480    59.940476 Hz   4:3     31.469 kHz     25.175000 MHz
    DMT 0x06:   640x480    75.000000 Hz   4:3     37.500 kHz     31.500000 MHz
    DMT 0x09:   800x600    60.316541 Hz   4:3     37.879 kHz     40.000000 MHz
    DMT 0x0b:   800x600    75.000000 Hz   4:3     46.875 kHz     49.500000 MHz
    DMT 0x10:  1024x768    60.003840 Hz   4:3     48.363 kHz     65.000000 MHz
    DMT 0x12:  1024x768    75.028582 Hz   4:3     60.023 kHz     78.750000 MHz
    DMT 0x24:  1280x1024   75.024675 Hz   5:4     79.976 kHz    135.000000 MHz
  Standard Timings:
    DMT 0x15:  1152x864    75.000000 Hz   4:3     67.500 kHz    108.000000 MHz
    DMT 0x23:  1280x1024   60.019740 Hz   5:4     63.981 kHz    108.000000 MHz
    DMT 0x52:  1920x1080   60.000000 Hz  16:9     67.500 kHz    148.500000 MHz
  Detailed Timing Descriptors:
    DTD 1:  1920x1080   60.000000 Hz  16:9     67.500 kHz    148.500000 MHz (477 mm x 268 mm)
                 Hfront   88 Hsync  44 Hback  148 Hpol P
                 Vfront    4 Vsync   5 Vback   36 Vpol P
    Display Product Serial Number: ...
    Display Product Name: 'DELL P2212H'
    Display Range Limits:
      Monitor ranges (GTF): 56-76 Hz V, 30-83 kHz H, max dotclock 170 MHz
Checksum: 0x27

----------------

Failures:

Block 0, Base EDID:
  Basic Display Parameters & Features: sRGB is signaled, but the chromaticities do not match.
EDID:
  Extension Block 1 started with EDID header, ignoring Extension Blocks >= 1.

EDID conformity: FAIL
