edid-decode (hex):

00 ff ff ff ff ff ff 00 06 af 9d 47 00 00 00 00
18 1d 01 04 a5 26 16 78 03 70 75 93 58 5a 94 29
20 50 54 00 00 00 01 01 01 01 01 01 01 01 01 01
01 01 01 01 01 01 d1 77 80 b6 70 38 88 40 30 20
a5 00 7e d7 10 00 00 18 ee 2f 80 b6 70 38 88 40
30 20 a5 00 7e d7 10 00 00 18 00 00 00 fd 00 30
78 92 92 1f 01 0a 20 20 20 20 20 20 00 00 00 fe
00 42 31 37 33 48 41 4e 30 34 2e 37 20 0a 00 2f

----------------

Block 0, Base EDID:
  EDID Structure Version & Revision: 1.4
  Vendor & Product Identification:
    Manufacturer: AUO
    Model: 18333
    Made in: week 24 of 2019
  Basic Display Parameters & Features:
    Digital display
    Bits per primary color channel: 8
    DisplayPort interface
    Maximum image size: 38 cm x 22 cm
    Gamma: 2.20
    Supported color formats: RGB 4:4:4
    First detailed timing includes the native pixel format and preferred refresh rate
    Display supports continuous frequencies
  Color Characteristics:
    Red  : 0.5751, 0.3466
    Green: 0.3515, 0.5781
    Blue : 0.1611, 0.1279
    White: 0.3134, 0.3291
  Established Timings I & II: none
  Standard Timings: none
  Detailed Timing Descriptors:
    DTD 1:  1920x1080  120.002410 Hz  16:9    145.923 kHz    306.730000 MHz (382 mm x 215 mm)
                 Hfront   48 Hsync  32 Hback  102 Hpol N
                 Vfront   10 Vsync   5 Vback  121 Vpol N
    DTD 2:  1920x1080   48.004094 Hz  16:9     58.373 kHz    122.700000 MHz (382 mm x 215 mm)
                 Hfront   48 Hsync  32 Hback  102 Hpol N
                 Vfront   10 Vsync   5 Vback  121 Vpol N
    Display Range Limits:
      Monitor ranges (Range Limits Only): 48-120 Hz V, 146-146 kHz H, max dotclock 310 MHz
    Alphanumeric Data String: 'B173HAN04.7 '
Checksum: 0x2f

----------------

Warnings:

Block 0, Base EDID:
  Missing Display Product Name.
EDID:
  Base EDID: Some timings are out of range of the Monitor Ranges:
    Horizontal Freq: 58.372 - 145.922 kHz (Monitor: 146.000 - 146.000 kHz)

Failures:

Block 0, Base EDID:
  Alphanumeric Data String: One or more trailing spaces before newline.

EDID conformity: FAIL
