edid-decode (hex):

00 ff ff ff ff ff ff 00 12 e9 02 2c 71 57 9c 00
01 1d 01 03 80 59 32 78 0a 0d c9 a0 57 47 98 27
12 48 4c 20 00 00 01 01 01 01 01 01 01 01 01 01
01 01 01 01 01 01 00 14 00 40 41 58 23 20 a8 20
f6 00 20 c2 31 00 00 18 00 14 00 40 41 58 23 20
a8 20 f6 00 20 c2 31 00 00 18 00 00 00 fc 00 48
44 4d 49 20 50 61 6e 65 6c 20 58 0a 00 00 00 fd
00 3a 3e 0e 46 06 00 0a 20 20 20 20 20 20 01 a5

02 03 16 c0 41 01 23 09 07 07 83 01 00 00 67 03
0c 00 10 00 00 0c 00 00 00 00 00 00 00 00 00 00
00 00 00 00 00 00 00 00 00 00 00 00 00 00 00 00
00 00 00 00 00 00 00 00 00 00 00 00 00 00 00 00
00 00 00 00 00 00 00 00 00 00 00 00 00 00 00 00
00 00 00 00 00 00 00 00 00 00 00 00 00 00 00 00
00 00 00 00 00 00 00 00 00 00 00 00 00 00 00 00
00 00 00 00 00 00 00 00 00 00 00 00 00 00 00 93

00 ff ff ff ff ff ff 00 12 e9 02 2c 71 57 9c 00
01 1d 01 03 80 59 32 78 0a 0d c9 a0 57 47 98 27
12 48 4c 20 00 00 01 01 01 01 01 01 01 01 01 01
01 01 01 01 01 01 00 14 00 40 41 58 23 20 a8 20
f6 00 20 c2 31 00 00 18 00 14 00 40 41 58 23 20
a8 20 f6 00 20 c2 31 00 00 18 00 00 00 fc 00 48
44 4d 49 20 50 61 6e 65 6c 20 58 0a 00 00 00 fd
00 3a 3e 0e 46 06 00 0a 20 20 20 20 20 20 01 a5

02 03 16 c0 41 01 23 09 07 07 83 01 00 00 67 03
0c 00 10 00 00 0c 00 00 00 00 00 00 00 00 00 00
00 00 00 00 00 00 00 00 00 00 00 00 00 00 00 00
00 00 00 00 00 00 00 00 00 00 00 00 00 00 00 00
00 00 00 00 00 00 00 00 00 00 00 00 00 00 00 00
00 00 00 00 00 00 00 00 00 00 00 00 00 00 00 00
00 00 00 00 00 00 00 00 00 00 00 00 00 00 00 00
00 00 00 00 00 00 00 00 00 00 00 00 00 00 00 93

----------------

Block 0, Base EDID:
  EDID Structure Version & Revision: 1.3
  Vendor & Product Identification:
    Manufacturer: DWI
    Model: 11266
    Serial Number: ...
    Made in: week 1 of 2019
  Basic Display Parameters & Features:
    Digital display
    Maximum image size: 89 cm x 50 cm
    Gamma: 2.20
    RGB color display
    First detailed timing is the preferred timing
  Color Characteristics:
    Red  : 0.6250, 0.3398
    Green: 0.2802, 0.5947
    Blue : 0.1552, 0.0703
    White: 0.2832, 0.2978
  Established Timings I & II:
    DMT 0x04:   640x480    59.940476 Hz   4:3     31.469 kHz     25.175000 MHz
  Standard Timings: none
  Detailed Timing Descriptors:
    DTD 1:  1024x600    59.992501 Hz 128:75    38.095 kHz     51.200000 MHz (800 mm x 450 mm)
                 Hfront  168 Hsync  32 Hback  120 Hpol N
                 Vfront   15 Vsync   6 Vback   14 Vpol N
    DTD 2:  1024x600    59.992501 Hz 128:75    38.095 kHz     51.200000 MHz (800 mm x 450 mm)
                 Hfront  168 Hsync  32 Hback  120 Hpol N
                 Vfront   15 Vsync   6 Vback   14 Vpol N
    Display Product Name: 'HDMI Panel X'
    Display Range Limits:
      Monitor ranges (GTF): 58-62 Hz V, 14-70 kHz H, max dotclock 60 MHz
  Extension blocks: 1
Checksum: 0xa5

----------------

Block 1, CTA-861 Extension Block:
  Revision: 3
  Underscans IT Video Formats by default
  Basic audio support
  Native DTDs: 0
  Video Data Block:
    VIC   1:   640x480    59.940476 Hz   4:3     31.469 kHz     25.175000 MHz
  Audio Data Block:
    Linear PCM:
      Max channels: 2
      Supported sample rates (kHz): 48 44.1 32
      Supported sample sizes (bits): 24 20 16
  Speaker Allocation Data Block:
    FL/FR - Front Left/Right
  Vendor-Specific Data Block (HDMI), OUI 00-0C-03:
    Source physical address: 1.0.0.0
    Maximum TMDS clock: 60 MHz
Checksum: 0x93  Unused space in Extension Block: 105 bytes

----------------

Warnings:

Block 0, Base EDID:
  Detailed Timing Descriptor #1: Image size is 800x450 mm, but based on the picture AR it should be 768x450 mm.
  Detailed Timing Descriptor #2: Image size is 800x450 mm, but based on the picture AR it should be 768x450 mm.
Block 1, CTA-861 Extension Block:
  Video Data Block: VIC 1 and the first DTD are not identical. Is this intended?
  Add a Colorimetry Data Block with the sRGB colorimetry bit set to avoid interop issues.

Failures:

Block 0, Base EDID:
  Detailed Timing Descriptor #1: Mismatch of image size 800x450 mm vs display size 890x500 mm.
  Detailed Timing Descriptor #2: Mismatch of image size 800x450 mm vs display size 890x500 mm.
Block 1, CTA-861 Extension Block:
  Missing VCDB, needed for Set Selectable RGB Quantization to avoid interop issues.
EDID:
  Extension Block 2 started with EDID header, ignoring Extension Blocks >= 2.

EDID conformity: FAIL
