edid-decode (hex):

00 ff ff ff ff ff ff 00 06 af 9d 45 00 00 00 00
16 20 01 04 a5 22 16 78 03 f7 25 91 57 58 95 2a
1f 50 54 00 00 00 01 01 01 01 01 01 01 01 01 01
01 01 01 01 01 01 96 41 80 54 71 b0 26 40 6c 30
aa 00 58 d7 10 00 00 18 78 34 80 54 71 b0 26 40
6c 30 aa 00 58 d7 10 00 00 18 00 00 00 fd 00 28
3c 4b 4b 11 01 0a 20 20 20 20 20 20 00 00 00 fe
00 42 31 36 30 55 41 4e 30 33 2e 33 20 0a 01 fe

02 03 0d 00 68 1a 00 00 01 01 28 3c 00 00 00 00
00 00 00 00 00 00 00 00 00 00 00 00 00 00 00 00
00 00 00 00 00 00 00 00 00 00 00 00 00 00 00 00
00 00 00 00 00 00 00 00 00 00 00 00 00 00 00 00
00 00 00 00 00 00 00 00 00 00 00 00 00 00 00 00
00 00 00 00 00 00 00 00 00 00 00 00 00 00 00 00
00 00 00 00 00 00 00 00 00 00 00 00 00 00 00 00
00 00 00 00 00 00 00 00 00 00 00 00 00 00 00 06

00 ff ff ff ff ff ff 00 06 af 9d 45 00 00 00 00
16 20 01 04 a5 22 16 78 03 f7 25 91 57 58 95 2a
1f 50 54 00 00 00 01 01 01 01 01 01 01 01 01 01
01 01 01 01 01 01 96 41 80 54 71 b0 26 40 6c 30
aa 00 58 d7 10 00 00 18 78 34 80 54 71 b0 26 40
6c 30 aa 00 58 d7 10 00 00 18 00 00 00 fd 00 28
3c 4b 4b 11 01 0a 20 20 20 20 20 20 00 00 00 fe
00 42 31 36 30 55 41 4e 30 33 2e 33 20 0a 01 fe

02 03 0d 00 68 1a 00 00 01 01 28 3c 00 00 00 00
00 00 00 00 00 00 00 00 00 00 00 00 00 00 00 00
00 00 00 00 00 00 00 00 00 00 00 00 00 00 00 00
00 00 00 00 00 00 00 00 00 00 00 00 00 00 00 00
00 00 00 00 00 00 00 00 00 00 00 00 00 00 00 00
00 00 00 00 00 00 00 00 00 00 00 00 00 00 00 00
00 00 00 00 00 00 00 00 00 00 00 00 00 00 00 00
00 00 00 00 00 00 00 00 00 00 00 00 00 00 00 06

----------------

Block 0, Base EDID:
  EDID Structure Version & Revision: 1.4
  Vendor & Product Identification:
    Manufacturer: AUO
    Model: 17821
    Made in: week 22 of 2022
  Basic Display Parameters & Features:
    Digital display
    Bits per primary color channel: 8
    DisplayPort interface
    Maximum image size: 34 cm x 22 cm
    Gamma: 2.20
    Supported color formats: RGB 4:4:4
    First detailed timing includes the native pixel format and preferred refresh rate
    Display supports continuous frequencies
  Color Characteristics:
    Red  : 0.5693, 0.3427
    Green: 0.3447, 0.5849
    Blue : 0.1640, 0.1230
    White: 0.3134, 0.3291
  Established Timings I & II: none
  Standard Timings: none
  Detailed Timing Descriptors:
    DTD 1:  1920x1200   60.009722 Hz  16:10    74.292 kHz    167.900000 MHz (344 mm x 215 mm)
                 Hfront  108 Hsync  48 Hback  184 Hpol N
                 Vfront   10 Vsync  10 Vback   18 Vpol N
    DTD 2:  1920x1200   48.007777 Hz  16:10    59.434 kHz    134.320000 MHz (344 mm x 215 mm)
                 Hfront  108 Hsync  48 Hback  184 Hpol N
                 Vfront   10 Vsync  10 Vback   18 Vpol N
    Display Range Limits:
      Monitor ranges (Range Limits Only): 40-60 Hz V, 75-75 kHz H, max dotclock 170 MHz
    Alphanumeric Data String: 'B160UAN03.3 '
  Extension blocks: 1
Checksum: 0xfe

----------------

Block 1, CTA-861 Extension Block:
  Revision: 3
  Native detailed modes: 0
  Vendor-Specific Data Block (AMD), OUI 00-00-1A:
    Version: 1
    Feature Caps: 0x01
    Minimum Refresh Rate: 40 Hz
    Maximum Refresh Rate: 60 Hz
    Flags 1.x: 0x00
Checksum: 0x06  Unused space in Extension Block: 114 bytes

----------------

Block 2, Unknown EDID Extension Block 0x00:
  00 ff ff ff ff ff ff 00 06 af 9d 45 00 00 00 00 '...........E....'
  16 20 01 04 a5 22 16 78 03 f7 25 91 57 58 95 2a '. ...".x..%.WX.*'
  1f 50 54 00 00 00 01 01 01 01 01 01 01 01 01 01 '.PT.............'
  01 01 01 01 01 01 96 41 80 54 71 b0 26 40 6c 30 '.......A.Tq.&@l0'
  aa 00 58 d7 10 00 00 18 78 34 80 54 71 b0 26 40 '..X.....x4.Tq.&@'
  6c 30 aa 00 58 d7 10 00 00 18 00 00 00 fd 00 28 'l0..X..........('
  3c 4b 4b 11 01 0a 20 20 20 20 20 20 00 00 00 fe '<KK...      ....'
  00 42 31 36 30 55 41 4e 30 33 2e 33 20 0a 01 fe '.B160UAN03.3 ...'
Checksum: 0xfe

----------------

Block 3, CTA-861 Extension Block:
  Revision: 3
  Native detailed modes: 0
  Vendor-Specific Data Block (AMD), OUI 00-00-1A:
    Version: 1
    Feature Caps: 0x01
    Minimum Refresh Rate: 40 Hz
    Maximum Refresh Rate: 60 Hz
    Flags 1.x: 0x00
Checksum: 0x06  Unused space in Extension Block: 114 bytes

----------------

Warnings:

Block 0, Base EDID:
  Missing Display Product Name.
Block 1, CTA-861 Extension Block:
  IT Video Formats are overscanned by default, but normally this should be underscanned.
  Add a Colorimetry Data Block with the sRGB colorimetry bit set to avoid interop issues.
Block 3, CTA-861 Extension Block:
  IT Video Formats are overscanned by default, but normally this should be underscanned.
EDID:
  Base EDID: Some timings are out of range of the Monitor Ranges:
    Horizontal Freq: 59.433 - 74.292 kHz (Monitor: 75.000 - 75.000 kHz)

Failures:

Block 0, Base EDID:
  Alphanumeric Data String: One or more trailing spaces before newline.
Block 1, CTA-861 Extension Block:
  Required 640x480p60 timings are missing in the established timings and the SVD list (VIC 1).
  Missing VCDB, needed for Set Selectable RGB Quantization to avoid interop issues.
Block 2, Base EDID:
  Unknown Extension Block.
EDID:
  Base EDID: EDID specified 1 extension block(s), but found 3 extension block(s).

EDID conformity: FAIL
