edid-decode (hex):

00 ff ff ff ff ff ff 00 22 0e 10 3a 00 00 00 00
0d 22 01 04 b5 59 27 78 3a d4 95 af 4f 43 a9 24
0f 50 54 a1 08 00 d1 c0 a9 c0 81 c0 d1 00 b3 00
95 00 a9 40 81 80 4c 9a 00 a0 f0 40 2e 60 30 20
3a 00 7a 84 31 00 00 1a 00 00 00 fd 00 1e 3c 1e
8c 36 01 0a 20 20 20 20 20 20 00 00 00 fc 00 48
50 20 37 33 38 70 75 0a 20 20 20 20 00 00 00 ff
00 43 4e 34 34 31 33 30 56 48 4d 0a 20 20 01 c0

02 03 1e b1 48 10 1f 04 13 12 11 03 02 e3 05 ff
01 e6 06 07 01 66 60 25 e2 0f 01 e2 00 ea e2 68
00 a0 a0 40 2e 60 30 20 36 00 7a 84 31 00 00 1a
56 5e 00 a0 a0 a0 29 50 30 20 35 00 7a 84 31 00
00 1a 28 3c 80 a0 70 b0 23 40 30 20 36 00 7a 84
31 00 00 1a 02 3a 80 18 71 38 2d 40 58 2c 45 00
7a 84 31 00 00 1e 13 4c 00 a0 f0 40 17 60 30 20
3a 00 7a 84 31 00 00 1a 00 00 00 00 00 00 00 a0

00 ff ff ff ff ff ff 00 22 0e 10 3a 00 00 00 00
0d 22 01 04 b5 59 27 78 3a d4 95 af 4f 43 a9 24
0f 50 54 a1 08 00 d1 c0 a9 c0 81 c0 d1 00 b3 00
95 00 a9 40 81 80 4c 9a 00 a0 f0 40 2e 60 30 20
3a 00 7a 84 31 00 00 1a 00 00 00 fd 00 1e 3c 1e
8c 36 01 0a 20 20 20 20 20 20 00 00 00 fc 00 48
50 20 37 33 38 70 75 0a 20 20 20 20 00 00 00 ff
00 43 4e 34 34 31 33 30 56 48 4d 0a 20 20 01 c0

02 03 1e b1 48 10 1f 04 13 12 11 03 02 e3 05 ff
01 e6 06 07 01 66 60 25 e2 0f 01 e2 00 ea e2 68
00 a0 a0 40 2e 60 30 20 36 00 7a 84 31 00 00 1a
56 5e 00 a0 a0 a0 29 50 30 20 35 00 7a 84 31 00
00 1a 28 3c 80 a0 70 b0 23 40 30 20 36 00 7a 84
31 00 00 1a 02 3a 80 18 71 38 2d 40 58 2c 45 00
7a 84 31 00 00 1e 13 4c 00 a0 f0 40 17 60 30 20
3a 00 7a 84 31 00 00 1a 00 00 00 00 00 00 00 a0

----------------

Block 0, Base EDID:
  EDID Structure Version & Revision: 1.4
  Vendor & Product Identification:
    Manufacturer: HPN
    Model: 14864
    Made in: week 13 of 2024
  Basic Display Parameters & Features:
    Digital display
    Bits per primary color channel: 10
    DisplayPort interface
    Maximum image size: 89 cm x 39 cm
    Gamma: 2.20
    DPMS levels: Off
    Supported color formats: RGB 4:4:4, YCrCb 4:4:4, YCrCb 4:2:2
    First detailed timing includes the native pixel format and preferred refresh rate
  Color Characteristics:
    Red  : 0.6865, 0.3095
    Green: 0.2626, 0.6601
    Blue : 0.1425, 0.0595
    White: 0.3134, 0.3291
  Established Timings I & II:
    IBM     :   720x400    70.081663 Hz   9:5     31.467 kHz     28.320000 MHz
    DMT 0x04:   640x480    59.940476 Hz   4:3     31.469 kHz     25.175000 MHz
    DMT 0x09:   800x600    60.316541 Hz   4:3     37.879 kHz     40.000000 MHz
    DMT 0x10:  1024x768    60.003840 Hz   4:3     48.363 kHz     65.000000 MHz
  Standard Timings:
    DMT 0x52:  1920x1080   60.000000 Hz  16:9     67.500 kHz    148.500000 MHz
    DMT 0x53:  1600x900    60.000000 Hz  16:9     60.000 kHz    108.000000 MHz (RB)
    DMT 0x55:  1280x720    60.000000 Hz  16:9     45.000 kHz     74.250000 MHz
    DMT 0x45:  1920x1200   59.884600 Hz  16:10    74.556 kHz    193.250000 MHz
    DMT 0x3a:  1680x1050   59.954250 Hz  16:10    65.290 kHz    146.250000 MHz
    DMT 0x2f:  1440x900    59.887445 Hz  16:10    55.935 kHz    106.500000 MHz
    DMT 0x33:  1600x1200   60.000000 Hz   4:3     75.000 kHz    162.000000 MHz
    DMT 0x23:  1280x1024   60.019740 Hz   5:4     63.981 kHz    108.000000 MHz
  Detailed Timing Descriptors:
    DTD 1:  3840x1600   59.993925 Hz  12:5     98.750 kHz    395.000000 MHz (890 mm x 388 mm)
                 Hfront   48 Hsync  32 Hback   80 Hpol P
                 Vfront    3 Vsync  10 Vback   33 Vpol N
    Display Range Limits:
      Monitor ranges (Range Limits Only): 30-60 Hz V, 30-140 kHz H, max dotclock 540 MHz
    Display Product Name: 'HP 738pu'
    Display Product Serial Number: ...
  Extension blocks: 1
Checksum: 0xc0

----------------

Block 1, CTA-861 Extension Block:
  Revision: 3
  Underscans IT Video Formats by default
  Supports YCbCr 4:4:4
  Supports YCbCr 4:2:2
  Native DTDs: 1
  Video Data Block:
    VIC  16:  1920x1080   60.000000 Hz  16:9     67.500 kHz    148.500000 MHz
    VIC  31:  1920x1080   50.000000 Hz  16:9     56.250 kHz    148.500000 MHz
    VIC   4:  1280x720    60.000000 Hz  16:9     45.000 kHz     74.250000 MHz
    VIC  19:  1280x720    50.000000 Hz  16:9     37.500 kHz     74.250000 MHz
    VIC  18:   720x576    50.000000 Hz  16:9     31.250 kHz     27.000000 MHz
    VIC  17:   720x576    50.000000 Hz   4:3     31.250 kHz     27.000000 MHz
    VIC   3:   720x480    59.940060 Hz  16:9     31.469 kHz     27.000000 MHz
    VIC   2:   720x480    59.940060 Hz   4:3     31.469 kHz     27.000000 MHz
  Colorimetry Data Block:
    xvYCC601
    xvYCC709
    sYCC601
    opYCC601
    opRGB
    BT2020cYCC
    BT2020YCC
    BT2020RGB
    Gamut Boundary Description Metadata Profile P0
  HDR Static Metadata Data Block:
    Electro optical transfer functions:
      Traditional gamma - SDR luminance range
      Traditional gamma - HDR luminance range
      SMPTE ST2084
    Supported static metadata descriptors:
      Static metadata type 1
    Desired content max luminance: 102 (455.515 cd/m^2)
    Desired content max frame-average luminance: 96 (400.000 cd/m^2)
    Desired content min luminance: 37 (0.096 cd/m^2)
  YCbCr 4:2:0 Capability Map Data Block:
    VIC  16:  1920x1080   60.000000 Hz  16:9     67.500 kHz    148.500000 MHz
  Video Capability Data Block:
    YCbCr quantization: Selectable (via AVI YQ)
    RGB quantization: Selectable (via AVI Q)
    PT scan behavior: Always Underscanned
    IT scan behavior: Always Underscanned
    CE scan behavior: Always Underscanned
  Detailed Timing Descriptors:
    DTD 2:  2560x1600   59.971589 Hz  16:10    98.713 kHz    268.500000 MHz (890 mm x 388 mm)
                 Hfront   48 Hsync  32 Hback   80 Hpol P
                 Vfront    3 Vsync   6 Vback   37 Vpol N
    DTD 3:  2560x1440   59.950550 Hz  16:9     88.787 kHz    241.500000 MHz (890 mm x 388 mm)
                 Hfront   48 Hsync  32 Hback   80 Hpol P
                 Vfront    3 Vsync   5 Vback   33 Vpol N
    DTD 4:  1920x1200   59.950171 Hz  16:10    74.038 kHz    154.000000 MHz (890 mm x 388 mm)
                 Hfront   48 Hsync  32 Hback   80 Hpol P
                 Vfront    3 Vsync   6 Vback   26 Vpol N
    DTD 5:  1920x1080   60.000000 Hz  16:9     67.500 kHz    148.500000 MHz (890 mm x 388 mm)
                 Hfront   88 Hsync  44 Hback  148 Hpol P
                 Vfront    4 Vsync   5 Vback   36 Vpol P
    DTD 6:  3840x1600   29.998460 Hz  12:5     48.688 kHz    194.750000 MHz (890 mm x 388 mm)
                 Hfront   48 Hsync  32 Hback   80 Hpol P
                 Vfront    3 Vsync  10 Vback   10 Vpol N
Checksum: 0xa0  Unused space in Extension Block: 7 bytes

----------------

Warnings:

Block 0, Base EDID:
  Detailed Timing Descriptor #1: Image size is 890x388 mm, but based on the picture AR it should be 890x370 mm.
Block 1, CTA-861 Extension Block:
  Video Data Block: VIC 16 and the first DTD are not identical. Is this intended?
  Colorimetry Data Block: Set the sRGB colorimetry bit to avoid interop issues.
  YCbCr 4:2:0 Capability Map Data Block: Some YCbCr 4:2:0 timings are invalid for HDMI 2.1 (which requires an RGB timings pixel rate >= 590 MHz).
  Video Capability Data Block: S_PT is equal to S_IT and S_CE, so should be set to 0 instead.
  Detailed Timing Descriptor #2: Image size is 890x388 mm, but based on the picture AR it should be 620x388 mm.
  Detailed Timing Descriptor #3: Image size is 890x388 mm, but based on the picture AR it should be 689x388 mm.
  Detailed Timing Descriptor #4: Image size is 890x388 mm, but based on the picture AR it should be 620x388 mm.
  Detailed Timing Descriptor #5: Image size is 890x388 mm, but based on the picture AR it should be 689x388 mm.
  Detailed Timing Descriptor #6: Image size is 890x388 mm, but based on the picture AR it should be 890x370 mm.
EDID:
  Base EDID: Some timings are out of range of the Monitor Ranges:
    Vertical Freq: 29.998 - 70.082 Hz (Monitor: 30.000 - 60.000 Hz)

Failures:

EDID:
  Extension Block 2 started with EDID header, ignoring Extension Blocks >= 2.

EDID conformity: FAIL
