edid-decode (hex):

00 ff ff ff ff ff ff 00 06 d8 34 00 00 00 00 00
20 1b 01 03 80 50 2d 78 1a 0d c9 a0 57 47 98 27
12 48 4c 20 00 00 01 00 01 00 01 00 01 00 01 01
01 01 01 01 01 01 02 3a 80 18 71 38 2d 40 58 2c
45 00 c4 8e 21 00 00 1e 00 00 00 10 00 00 00 00
00 00 00 00 00 00 00 00 00 00 00 00 00 fc 00 41
56 54 20 47 43 35 31 33 0a 20 20 20 00 00 00 fd
00 18 3d 0f 44 11 02 00 20 20 20 20 20 20 01 20

02 03 25 71 51 90 05 1f 22 21 14 04 93 11 12 15
16 02 03 06 07 01 23 09 07 07 83 01 00 00 66 03
0c 00 10 00 00 02 3a 80 18 71 38 2d 40 58 2c 45
00 c4 8e 21 00 00 1e 01 1d 00 72 51 d0 1e 20 6e
28 55 00 c4 8e 21 00 00 1e 00 00 00 00 00 00 00
00 00 00 00 00 00 00 00 00 00 00 00 00 00 00 00
00 00 00 00 00 00 00 00 00 00 00 00 00 00 00 00
00 00 00 00 00 00 00 00 00 00 00 00 00 00 00 1f

00 ff ff ff ff ff ff 00 06 d8 34 00 00 00 00 00
20 1b 01 03 80 50 2d 78 1a 0d c9 a0 57 47 98 27
12 48 4c 20 00 00 01 00 01 00 01 00 01 00 01 01
01 01 01 01 01 01 02 3a 80 18 71 38 2d 40 58 2c
45 00 c4 8e 21 00 00 1e 00 00 00 10 00 00 00 00
00 00 00 00 00 00 00 00 00 00 00 00 00 fc 00 41
56 54 20 47 43 35 31 33 0a 20 20 20 00 00 00 fd
00 18 3d 0f 44 11 02 00 20 20 20 20 20 20 01 20

02 03 25 71 51 90 05 1f 22 21 14 04 93 11 12 15
16 02 03 06 07 01 23 09 07 07 83 01 00 00 66 03
0c 00 10 00 00 02 3a 80 18 71 38 2d 40 58 2c 45
00 c4 8e 21 00 00 1e 01 1d 00 72 51 d0 1e 20 6e
28 55 00 c4 8e 21 00 00 1e 00 00 00 00 00 00 00
00 00 00 00 00 00 00 00 00 00 00 00 00 00 00 00
00 00 00 00 00 00 00 00 00 00 00 00 00 00 00 00
00 00 00 00 00 00 00 00 00 00 00 00 00 00 00 1f

----------------

Block 0, Base EDID:
  EDID Structure Version & Revision: 1.3
  Vendor & Product Identification:
    Manufacturer: AVX
    Model: 52
    Made in: week 32 of 2017
  Basic Display Parameters & Features:
    Digital display
    Maximum image size: 80 cm x 45 cm
    Gamma: 2.20
    Undefined display color type
    First detailed timing is the preferred timing
  Color Characteristics:
    Red  : 0.6250, 0.3398
    Green: 0.2802, 0.5947
    Blue : 0.1552, 0.0703
    White: 0.2832, 0.2978
  Established Timings I & II:
    DMT 0x04:   640x480    59.940476 Hz   4:3     31.469 kHz     25.175000 MHz
  Standard Timings:
  Detailed Timing Descriptors:
    DTD 1:  1920x1080   60.000000 Hz  16:9     67.500 kHz    148.500000 MHz (708 mm x 398 mm)
                 Hfront   88 Hsync  44 Hback  148 Hpol P
                 Vfront    4 Vsync   5 Vback   36 Vpol P
    Dummy Descriptor:
    Display Product Name: 'AVT GC513'
    Display Range Limits:
      Monitor ranges (Secondary GTF): 24-61 Hz V, 15-68 kHz H, max dotclock 170 MHz
      GTF Secondary Curve Block:
        Start frequency: 64 kHz
        C: 16.0%
        M: 8224%/kHz
        K: 32
        J: 16.0%
  Extension blocks: 1
Checksum: 0x20

----------------

Block 1, CTA-861 Extension Block:
  Revision: 3
  Basic audio support
  Supports YCbCr 4:4:4
  Supports YCbCr 4:2:2
  Native DTDs: 1
  Video Data Block:
    VIC  16:  1920x1080   60.000000 Hz  16:9     67.500 kHz    148.500000 MHz (native)
    VIC   5:  1920x1080i  60.000000 Hz  16:9     33.750 kHz     74.250000 MHz
    VIC  31:  1920x1080   50.000000 Hz  16:9     56.250 kHz    148.500000 MHz
    VIC  34:  1920x1080   30.000000 Hz  16:9     33.750 kHz     74.250000 MHz
    VIC  33:  1920x1080   25.000000 Hz  16:9     28.125 kHz     74.250000 MHz
    VIC  20:  1920x1080i  50.000000 Hz  16:9     28.125 kHz     74.250000 MHz
    VIC   4:  1280x720    60.000000 Hz  16:9     45.000 kHz     74.250000 MHz
    VIC  19:  1280x720    50.000000 Hz  16:9     37.500 kHz     74.250000 MHz (native)
    VIC  17:   720x576    50.000000 Hz   4:3     31.250 kHz     27.000000 MHz
    VIC  18:   720x576    50.000000 Hz  16:9     31.250 kHz     27.000000 MHz
    VIC  21:  1440x576i   50.000000 Hz   4:3     15.625 kHz     27.000000 MHz
    VIC  22:  1440x576i   50.000000 Hz  16:9     15.625 kHz     27.000000 MHz
    VIC   2:   720x480    59.940060 Hz   4:3     31.469 kHz     27.000000 MHz
    VIC   3:   720x480    59.940060 Hz  16:9     31.469 kHz     27.000000 MHz
    VIC   6:  1440x480i   59.940060 Hz   4:3     15.734 kHz     27.000000 MHz
    VIC   7:  1440x480i   59.940060 Hz  16:9     15.734 kHz     27.000000 MHz
    VIC   1:   640x480    59.940476 Hz   4:3     31.469 kHz     25.175000 MHz
  Audio Data Block:
    Linear PCM:
      Max channels: 2
      Supported sample rates (kHz): 48 44.1 32
      Supported sample sizes (bits): 24 20 16
  Speaker Allocation Data Block:
    FL/FR - Front Left/Right
  Vendor-Specific Data Block (HDMI), OUI 00-0C-03:
    Source physical address: 1.0.0.0
  Detailed Timing Descriptors:
    DTD 2:  1920x1080   60.000000 Hz  16:9     67.500 kHz    148.500000 MHz (708 mm x 398 mm)
                 Hfront   88 Hsync  44 Hback  148 Hpol P
                 Vfront    4 Vsync   5 Vback   36 Vpol P
    DTD 3:  1280x720    60.000000 Hz  16:9     45.000 kHz     74.250000 MHz (708 mm x 398 mm)
                 Hfront  110 Hsync  40 Hback  220 Hpol P
                 Vfront    5 Vsync   5 Vback   20 Vpol P
Checksum: 0x1f  Unused space in Extension Block: 54 bytes

----------------

Warnings:

Block 1, CTA-861 Extension Block:
  IT Video Formats are overscanned by default, but normally this should be underscanned.
  Add a Colorimetry Data Block with the sRGB colorimetry bit set to avoid interop issues.

Failures:

Block 0, Base EDID:
  Standard Timings: Use 0x0101 as the invalid Standard Timings code, not 0x0100.
  Standard Timings: Use 0x0101 as the invalid Standard Timings code, not 0x0100.
  Standard Timings: Use 0x0101 as the invalid Standard Timings code, not 0x0100.
  Standard Timings: Use 0x0101 as the invalid Standard Timings code, not 0x0100.
  Detailed Timing Descriptor #1: Mismatch of image size 708x398 mm vs display size 800x450 mm.
Block 1, CTA-861 Extension Block:
  Detailed Timing Descriptor #2: Mismatch of image size 708x398 mm vs display size 800x450 mm.
  Detailed Timing Descriptor #3: Mismatch of image size 708x398 mm vs display size 800x450 mm.
  Missing VCDB, needed for Set Selectable RGB Quantization to avoid interop issues.
EDID:
  Extension Block 2 started with EDID header, ignoring Extension Blocks >= 2.
  CTA-861: Native progressive timings are a mix of several resolutions.

EDID conformity: FAIL
