edid-decode (hex):

00 ff ff ff ff ff ff 00 06 d8 34 00 00 00 00 00
20 1b 01 03 80 79 44 78 2a a5 dd a4 55 50 9f 27
0d 47 4a 20 00 00 01 01 01 01 01 01 01 01 01 01
01 01 01 01 01 01 e1 00 00 30 f2 70 5a 80 b0 58
8a 00 55 50 21 00 00 1e 00 00 00 00 00 00 00 00
00 00 00 00 00 00 00 00 00 00 00 00 00 fc 00 41
56 54 20 47 43 35 31 33 0a 20 20 20 00 00 00 fd
00 3a 79 1e 88 3c 00 0a 20 20 20 20 20 20 01 c3

02 03 29 41 50 10 22 1f 21 05 04 13 07 06 03 02
11 12 15 16 01 23 09 07 07 83 01 00 00 6b 03 0c
00 40 00 00 3c a0 00 20 03 04 74 00 30 f2 70 5a
80 b0 58 8a 00 55 50 21 00 00 1e 00 00 00 00 00
00 00 00 00 00 00 00 00 00 00 00 00 00 00 00 00
00 00 00 00 00 00 00 00 00 00 00 00 00 00 00 00
00 00 00 00 00 00 00 00 00 00 00 00 00 00 00 00
00 00 00 00 00 00 00 00 00 00 00 00 00 00 00 81

00 ff ff ff ff ff ff 00 06 d8 34 00 00 00 00 00
20 1b 01 03 80 79 44 78 2a a5 dd a4 55 50 9f 27
0d 47 4a 20 00 00 01 01 01 01 01 01 01 01 01 01
01 01 01 01 01 01 e1 00 00 30 f2 70 5a 80 b0 58
8a 00 55 50 21 00 00 1e 00 00 00 00 00 00 00 00
00 00 00 00 00 00 00 00 00 00 00 00 00 fc 00 41
56 54 20 47 43 35 31 33 0a 20 20 20 00 00 00 fd
00 3a 79 1e 88 3c 00 0a 20 20 20 20 20 20 01 c3

02 03 29 41 50 10 22 1f 21 05 04 13 07 06 03 02
11 12 15 16 01 23 09 07 07 83 01 00 00 6b 03 0c
00 40 00 00 3c a0 00 20 03 04 74 00 30 f2 70 5a
80 b0 58 8a 00 55 50 21 00 00 1e 00 00 00 00 00
00 00 00 00 00 00 00 00 00 00 00 00 00 00 00 00
00 00 00 00 00 00 00 00 00 00 00 00 00 00 00 00
00 00 00 00 00 00 00 00 00 00 00 00 00 00 00 00
00 00 00 00 00 00 00 00 00 00 00 00 00 00 00 81

----------------

Block 0, Base EDID:
  EDID Structure Version & Revision: 1.3
  Vendor & Product Identification:
    Manufacturer: AVX
    Model: 52
    Made in: week 32 of 2017
  Basic Display Parameters & Features:
    Digital display
    Maximum image size: 121 cm x 68 cm
    Gamma: 2.20
    DPMS levels: Off
    RGB color display
    First detailed timing is the preferred timing
  Color Characteristics:
    Red  : 0.6425, 0.3339
    Green: 0.3134, 0.6220
    Blue : 0.1552, 0.0517
    White: 0.2802, 0.2900
  Established Timings I & II:
    DMT 0x04:   640x480    59.940476 Hz   4:3     31.469 kHz     25.175000 MHz
  Standard Timings: none
  Detailed Timing Descriptors:
    Detailed mode: e1 00 00 30 f2 70 5a 80 b0 58 8a 00 55 50 21 00 00 1e '...0.pZ..X..UP!...'
    Empty Descriptor
    Display Product Name: 'AVT GC513'
    Display Range Limits:
      Monitor ranges (GTF): 58-121 Hz V, 30-136 kHz H, max dotclock 600 MHz
  Extension blocks: 1
Checksum: 0xc3

----------------

Block 1, CTA-861 Extension Block:
  Revision: 3
  Basic audio support
  Native DTDs: 1
  Video Data Block:
    VIC  16:  1920x1080   60.000000 Hz  16:9     67.500 kHz    148.500000 MHz
    VIC  34:  1920x1080   30.000000 Hz  16:9     33.750 kHz     74.250000 MHz
    VIC  31:  1920x1080   50.000000 Hz  16:9     56.250 kHz    148.500000 MHz
    VIC  33:  1920x1080   25.000000 Hz  16:9     28.125 kHz     74.250000 MHz
    VIC   5:  1920x1080i  60.000000 Hz  16:9     33.750 kHz     74.250000 MHz
    VIC   4:  1280x720    60.000000 Hz  16:9     45.000 kHz     74.250000 MHz
    VIC  19:  1280x720    50.000000 Hz  16:9     37.500 kHz     74.250000 MHz
    VIC   7:  1440x480i   59.940060 Hz  16:9     15.734 kHz     27.000000 MHz
    VIC   6:  1440x480i   59.940060 Hz   4:3     15.734 kHz     27.000000 MHz
    VIC   3:   720x480    59.940060 Hz  16:9     31.469 kHz     27.000000 MHz
    VIC   2:   720x480    59.940060 Hz   4:3     31.469 kHz     27.000000 MHz
    VIC  17:   720x576    50.000000 Hz   4:3     31.250 kHz     27.000000 MHz
    VIC  18:   720x576    50.000000 Hz  16:9     31.250 kHz     27.000000 MHz
    VIC  21:  1440x576i   50.000000 Hz   4:3     15.625 kHz     27.000000 MHz
    VIC  22:  1440x576i   50.000000 Hz  16:9     15.625 kHz     27.000000 MHz
    VIC   1:   640x480    59.940476 Hz   4:3     31.469 kHz     25.175000 MHz
  Audio Data Block:
    Linear PCM:
      Max channels: 2
      Supported sample rates (kHz): 48 44.1 32
      Supported sample sizes (bits): 24 20 16
  Speaker Allocation Data Block:
    FL/FR - Front Left/Right
  Vendor-Specific Data Block (HDMI), OUI 00-0C-03:
    Source physical address: 4.0.0.0
    Maximum TMDS clock: 300 MHz
    Video latency: Unknown
    Audio latency: 62 ms
    Extended HDMI video details:
      3D VIC indices with specific capabilities:
        VIC   7:  1440x480i   59.940060 Hz  16:9     15.734 kHz     27.000000 MHz (L + depth)
        VIC  16:  1920x1080   60.000000 Hz  16:9     67.500 kHz    148.500000 MHz (frame packing)
        VIC  33:  1920x1080   25.000000 Hz  16:9     28.125 kHz     74.250000 MHz (frame packing)
        VIC   1:   640x480    59.940476 Hz   4:3     31.469 kHz     25.175000 MHz (line alternative)
  Detailed Timing Descriptors:
    DTD 2:  3840x2160   30.000000 Hz  16:9     67.500 kHz    297.000000 MHz (597 mm x 336 mm)
                 Hfront  176 Hsync  88 Hback  296 Hpol P
                 Vfront    8 Vsync  10 Vback   72 Vpol P
Checksum: 0x81  Unused space in Extension Block: 68 bytes

----------------

Warnings:

Block 1, CTA-861 Extension Block:
  IT Video Formats are overscanned by default, but normally this should be underscanned.
  Detailed Timing Descriptor #2: DTD is identical to VIC 95, which is not present in the CTA Ext Block.
  Add a Colorimetry Data Block with the sRGB colorimetry bit set to avoid interop issues.
EDID:
  Base EDID: Some timings are out of range of the Monitor Ranges:
    Vertical Freq: 25.000 - 60.000 Hz (Monitor: 58.000 - 121.000 Hz)
    Horizontal Freq: 15.625 - 67.500 kHz (Monitor: 30.000 - 136.000 kHz)

Failures:

Block 0, Base EDID:
  Detailed Timing Descriptor #1: Pixelclock < 10 MHz, assuming invalid data 0xe1 0x00.
  Empty Descriptor: Use Dummy Descriptor instead of all zeroes.
Block 1, CTA-861 Extension Block:
  Detailed Timing Descriptor #2: Mismatch of image size 597x336 mm vs display size 1210x680 mm.
  Missing VCDB, needed for Set Selectable RGB Quantization to avoid interop issues.
EDID:
  Extension Block 2 started with EDID header, ignoring Extension Blocks >= 2.

EDID conformity: FAIL
