edid-decode (hex):

00 ff ff ff ff ff ff 00 06 af ab 6f 00 00 00 00
00 21 01 04 b5 1e 13 78 03 d4 05 a7 54 48 9e 25
0e 50 54 00 00 00 01 01 01 01 01 01 01 01 01 01
01 01 01 01 01 01 24 c9 40 a0 b0 08 52 70 30 20
35 00 2d bc 10 00 00 1a 47 6b 40 a0 b0 08 52 70
30 20 35 00 2d bc 10 00 00 1a 00 00 00 fe 00 4d
4b 35 34 43 80 42 31 34 30 51 41 4e 00 00 00 00
00 03 01 2a 9e 00 11 00 00 0b 41 0a 20 20 00 a0

00 ff ff ff ff ff ff 00 06 af ab 6f 00 00 00 00
00 21 01 04 b5 1e 13 78 03 d4 05 a7 54 48 9e 25
0e 50 54 00 00 00 01 01 01 01 01 01 01 01 01 01
01 01 01 01 01 01 24 c9 40 a0 b0 08 52 70 30 20
35 00 2d bc 10 00 00 1a 47 6b 40 a0 b0 08 52 70
30 20 35 00 2d bc 10 00 00 1a 00 00 00 fe 00 4d
4b 35 34 43 80 42 31 34 30 51 41 4e 00 00 00 00
00 03 01 2a 9e 00 11 00 00 0b 41 0a 20 20 00 a0

----------------

Block 0, Base EDID:
  EDID Structure Version & Revision: 1.4
  Vendor & Product Identification:
    Manufacturer: AUO
    Model: 28587
    Made in: 2023
  Basic Display Parameters & Features:
    Digital display
    Bits per primary color channel: 10
    DisplayPort interface
    Maximum image size: 30 cm x 19 cm
    Gamma: 2.20
    Supported color formats: RGB 4:4:4
    First detailed timing includes the native pixel format and preferred refresh rate
    Display supports continuous frequencies
  Color Characteristics:
    Red  : 0.6552, 0.3291
    Green: 0.2822, 0.6171
    Blue : 0.1445, 0.0546
    White: 0.3134, 0.3291
  Established Timings I & II: none
  Standard Timings: none
  Detailed Timing Descriptors:
    DTD 1:  2880x1800   90.000839 Hz  16:10   169.382 kHz    514.920000 MHz (301 mm x 188 mm)
                 Hfront   48 Hsync  32 Hback   80 Hpol P
                 Vfront    3 Vsync   5 Vback   74 Vpol N
    DTD 2:  2880x1800   48.001496 Hz  16:10    90.339 kHz    274.630000 MHz (301 mm x 188 mm)
                 Hfront   48 Hsync  32 Hback   80 Hpol P
                 Vfront    3 Vsync   5 Vback   74 Vpol N
    Alphanumeric Data String: 'MK54C.B140QAN'
    Manufacturer-Specified Display Descriptor (0x00): 00 00 00 03 01 2a 9e 00 11 00 00 0b 41 0a 20 20 '.....*......A.  '
Checksum: 0xa0

----------------

Warnings:

Block 0, Base EDID:
  Alphanumeric Data String: Non-ASCII character 0x80 at position 5, can cause problems.
  Missing Display Product Name.

Failures:

Block 0, Base EDID:
  Missing Display Range Limits Descriptor.
EDID:
  Extension Block 1 started with EDID header, ignoring Extension Blocks >= 1.

EDID conformity: FAIL
