edid-decode (hex):

00 ff ff ff ff ff ff 00 4c ab 62 28 01 3f ab 01
1e 19 01 03 80 58 31 78 ea 08 60 a2 57 4f a2 28
0f 50 54 bf ef 80 d1 c0 d1 00 a9 80 a9 40 b3 00
81 80 81 c0 01 01 22 cc 00 50 f0 70 3e 80 18 10
35 00 c4 8e 21 00 00 1a e6 73 00 30 f2 70 5a 80
b0 58 8a 00 c4 8e 21 00 00 1e 00 00 00 fd 00 17
4c 1e 88 0d 00 0a 20 20 20 20 20 20 00 00 00 fc
00 53 4d 32 38 55 54 52 0a 20 20 20 20 20 01 76

02 03 2e f3 53 10 05 04 03 02 07 06 1f 14 13 12
11 16 15 20 01 dd de df 23 09 7f 07 83 01 00 00
6d 03 0c 00 10 00 b8 3c 20 00 60 01 02 03 e6 73
00 30 f2 70 5a 80 b0 58 8a 00 6e e5 31 00 00 1e
02 3a 80 18 71 38 2d 40 58 2c 45 00 6e e5 31 00
00 1f 01 1d 80 18 71 1c 16 20 58 2c 25 00 6e e5
31 00 00 9e 01 1d 00 72 51 d0 1e 20 6e 28 55 00
6e e5 31 00 00 1e 00 00 00 00 00 00 00 00 00 c2

00 ff ff ff ff ff ff 00 4c ab 62 28 01 3f ab 01
1e 19 01 03 80 58 31 78 ea 08 60 a2 57 4f a2 28
0f 50 54 bf ef 80 d1 c0 d1 00 a9 80 a9 40 b3 00
81 80 81 c0 01 01 22 cc 00 50 f0 70 3e 80 18 10
35 00 c4 8e 21 00 00 1a e6 73 00 30 f2 70 5a 80
b0 58 8a 00 c4 8e 21 00 00 1e 00 00 00 fd 00 17
4c 1e 88 0d 00 0a 20 20 20 20 20 20 00 00 00 fc
00 53 4d 32 38 55 54 52 0a 20 20 20 20 20 01 76

02 03 2e f3 53 10 05 04 03 02 07 06 1f 14 13 12
11 16 15 20 01 dd de df 23 09 7f 07 83 01 00 00
6d 03 0c 00 10 00 b8 3c 20 00 60 01 02 03 e6 73
00 30 f2 70 5a 80 b0 58 8a 00 6e e5 31 00 00 1e
02 3a 80 18 71 38 2d 40 58 2c 45 00 6e e5 31 00
00 1f 01 1d 80 18 71 1c 16 20 58 2c 25 00 6e e5
31 00 00 9e 01 1d 00 72 51 d0 1e 20 6e 28 55 00
6e e5 31 00 00 1e 00 00 00 00 00 00 00 00 00 c2

----------------

Block 0, Base EDID:
  EDID Structure Version & Revision: 1.3
  Vendor & Product Identification:
    Manufacturer: SEK
    Model: 10338
    Serial Number: ...
    Made in: week 30 of 2015
  Basic Display Parameters & Features:
    Digital display
    Maximum image size: 88 cm x 49 cm
    Gamma: 2.20
    DPMS levels: Standby Suspend Off
    RGB color display
    First detailed timing is the preferred timing
  Color Characteristics:
    Red  : 0.6328, 0.3398
    Green: 0.3105, 0.6328
    Blue : 0.1572, 0.0605
    White: 0.3125, 0.3281
  Established Timings I & II:
    IBM     :   720x400    70.081663 Hz   9:5     31.467 kHz     28.320000 MHz
    DMT 0x04:   640x480    59.940476 Hz   4:3     31.469 kHz     25.175000 MHz
    Apple   :   640x480    66.666667 Hz   4:3     35.000 kHz     30.240000 MHz
    DMT 0x05:   640x480    72.808802 Hz   4:3     37.861 kHz     31.500000 MHz
    DMT 0x06:   640x480    75.000000 Hz   4:3     37.500 kHz     31.500000 MHz
    DMT 0x08:   800x600    56.250000 Hz   4:3     35.156 kHz     36.000000 MHz
    DMT 0x09:   800x600    60.316541 Hz   4:3     37.879 kHz     40.000000 MHz
    DMT 0x0a:   800x600    72.187572 Hz   4:3     48.077 kHz     50.000000 MHz
    DMT 0x0b:   800x600    75.000000 Hz   4:3     46.875 kHz     49.500000 MHz
    Apple   :   832x624    74.551266 Hz   4:3     49.726 kHz     57.284000 MHz
    DMT 0x10:  1024x768    60.003840 Hz   4:3     48.363 kHz     65.000000 MHz
    DMT 0x11:  1024x768    70.069359 Hz   4:3     56.476 kHz     75.000000 MHz
    DMT 0x12:  1024x768    75.028582 Hz   4:3     60.023 kHz     78.750000 MHz
    DMT 0x24:  1280x1024   75.024675 Hz   5:4     79.976 kHz    135.000000 MHz
    Apple   :  1152x870    75.061550 Hz 192:145   68.681 kHz    100.000000 MHz
  Standard Timings:
    DMT 0x52:  1920x1080   60.000000 Hz  16:9     67.500 kHz    148.500000 MHz
    DMT 0x45:  1920x1200   59.884600 Hz  16:10    74.556 kHz    193.250000 MHz
    GTF     :  1600x1280   60.000000 Hz   5:4     79.500 kHz    172.992000 MHz
    DMT 0x33:  1600x1200   60.000000 Hz   4:3     75.000 kHz    162.000000 MHz
    DMT 0x3a:  1680x1050   59.954250 Hz  16:10    65.290 kHz    146.250000 MHz
    DMT 0x23:  1280x1024   60.019740 Hz   5:4     63.981 kHz    108.000000 MHz
    DMT 0x55:  1280x720    60.000000 Hz  16:9     45.000 kHz     74.250000 MHz
  Detailed Timing Descriptors:
    DTD  1:  3840x2160   59.996051 Hz  16:9    133.311 kHz    522.580000 MHz (708 mm x 398 mm)
                  Hfront   24 Hsync  16 Hback   40 Hpol P
                  Vfront    3 Vsync   5 Vback   54 Vpol N
    DTD  2:  3840x2160   29.969697 Hz  16:9     67.432 kHz    296.700000 MHz (708 mm x 398 mm)
                  Hfront  176 Hsync  88 Hback  296 Hpol P
                  Vfront    8 Vsync  10 Vback   72 Vpol P
    Display Range Limits:
      Monitor ranges (GTF): 23-76 Hz V, 30-136 kHz H, max dotclock 130 MHz
    Display Product Name: 'SM28UTR'
  Extension blocks: 1
Checksum: 0x76

----------------

Block 1, CTA-861 Extension Block:
  Revision: 3
  Underscans IT Video Formats by default
  Basic audio support
  Supports YCbCr 4:4:4
  Supports YCbCr 4:2:2
  Native detailed modes: 3
  Video Data Block:
    VIC  16:  1920x1080   60.000000 Hz  16:9     67.500 kHz    148.500000 MHz
    VIC   5:  1920x1080i  60.000000 Hz  16:9     33.750 kHz     74.250000 MHz
    VIC   4:  1280x720    60.000000 Hz  16:9     45.000 kHz     74.250000 MHz
    VIC   3:   720x480    59.940060 Hz  16:9     31.469 kHz     27.000000 MHz
    VIC   2:   720x480    59.940060 Hz   4:3     31.469 kHz     27.000000 MHz
    VIC   7:  1440x480i   59.940060 Hz  16:9     15.734 kHz     27.000000 MHz
    VIC   6:  1440x480i   59.940060 Hz   4:3     15.734 kHz     27.000000 MHz
    VIC  31:  1920x1080   50.000000 Hz  16:9     56.250 kHz    148.500000 MHz
    VIC  20:  1920x1080i  50.000000 Hz  16:9     28.125 kHz     74.250000 MHz
    VIC  19:  1280x720    50.000000 Hz  16:9     37.500 kHz     74.250000 MHz
    VIC  18:   720x576    50.000000 Hz  16:9     31.250 kHz     27.000000 MHz
    VIC  17:   720x576    50.000000 Hz   4:3     31.250 kHz     27.000000 MHz
    VIC  22:  1440x576i   50.000000 Hz  16:9     15.625 kHz     27.000000 MHz
    VIC  21:  1440x576i   50.000000 Hz   4:3     15.625 kHz     27.000000 MHz
    VIC  32:  1920x1080   24.000000 Hz  16:9     27.000 kHz     74.250000 MHz
    VIC   1:   640x480    59.940476 Hz   4:3     31.469 kHz     25.175000 MHz
    Unknown (VIC 221)
    Unknown (VIC 222)
    Unknown (VIC 223)
  Audio Data Block:
    Linear PCM:
      Max channels: 2
      Supported sample rates (kHz): 192 176.4 96 88.2 48 44.1 32
      Supported sample sizes (bits): 24 20 16
  Speaker Allocation Data Block:
    FL/FR - Front Left/Right
  Vendor-Specific Data Block (HDMI), OUI 00-0C-03:
    Source physical address: 1.0.0.0
    Supports_AI
    DC_36bit
    DC_30bit
    DC_Y444
    Maximum TMDS clock: 300 MHz
    Extended HDMI video details:
      HDMI VICs:
        HDMI VIC 1:  3840x2160   30.000000 Hz  16:9     67.500 kHz    297.000000 MHz
        HDMI VIC 2:  3840x2160   25.000000 Hz  16:9     56.250 kHz    297.000000 MHz
        HDMI VIC 3:  3840x2160   24.000000 Hz  16:9     54.000 kHz    297.000000 MHz
  Detailed Timing Descriptors:
    DTD  3:  3840x2160   29.969697 Hz  16:9     67.432 kHz    296.700000 MHz (878 mm x 485 mm)
                  Hfront  176 Hsync  88 Hback  296 Hpol P
                  Vfront    8 Vsync  10 Vback   72 Vpol P
    DTD  4:  1920x1080   60.000000 Hz  16:9     67.500 kHz    148.500000 MHz (878 mm x 485 mm)
                  Hfront   88 Hsync  44 Hback  148 Hpol P
                  Vfront    4 Vsync   5 Vback   36 Vpol P
    DTD  5:  1920x1080i  60.000000 Hz  16:9     33.750 kHz     74.250000 MHz (878 mm x 485 mm)
                  Hfront   88 Hsync  44 Hback  148 Hpol P
                  Vfront    2 Vsync   5 Vback   15 Vpol P Vfront +0.5 Odd Field
                  Vfront    2 Vsync   5 Vback   15 Vpol P Vback  +0.5 Even Field
    DTD  6:  1280x720    60.000000 Hz  16:9     45.000 kHz     74.250000 MHz (878 mm x 485 mm)
                  Hfront  110 Hsync  40 Hback  220 Hpol P
                  Vfront    5 Vsync   5 Vback   20 Vpol P
Checksum: 0xc2  Unused space in Extension Block: 9 bytes

----------------

Block 2, Unknown EDID Extension Block 0x00:
  00 ff ff ff ff ff ff 00 4c ab 62 28 01 3f ab 01 '........L.b(.?..'
  1e 19 01 03 80 58 31 78 ea 08 60 a2 57 4f a2 28 '.....X1x..`.WO.('
  0f 50 54 bf ef 80 d1 c0 d1 00 a9 80 a9 40 b3 00 '.PT..........@..'
  81 80 81 c0 01 01 22 cc 00 50 f0 70 3e 80 18 10 '......"..P.p>...'
  35 00 c4 8e 21 00 00 1a e6 73 00 30 f2 70 5a 80 '5...!....s.0.pZ.'
  b0 58 8a 00 c4 8e 21 00 00 1e 00 00 00 fd 00 17 '.X....!.........'
  4c 1e 88 0d 00 0a 20 20 20 20 20 20 00 00 00 fc 'L.....      ....'
  00 53 4d 32 38 55 54 52 0a 20 20 20 20 20 01 76 '.SM28UTR.     .v'
Checksum: 0x76

----------------

Block 3, CTA-861 Extension Block:
  Revision: 3
  Underscans IT Video Formats by default
  Basic audio support
  Supports YCbCr 4:4:4
  Supports YCbCr 4:2:2
  Native detailed modes: 3
  Video Data Block:
    VIC  16:  1920x1080   60.000000 Hz  16:9     67.500 kHz    148.500000 MHz
    VIC   5:  1920x1080i  60.000000 Hz  16:9     33.750 kHz     74.250000 MHz
    VIC   4:  1280x720    60.000000 Hz  16:9     45.000 kHz     74.250000 MHz
    VIC   3:   720x480    59.940060 Hz  16:9     31.469 kHz     27.000000 MHz
    VIC   2:   720x480    59.940060 Hz   4:3     31.469 kHz     27.000000 MHz
    VIC   7:  1440x480i   59.940060 Hz  16:9     15.734 kHz     27.000000 MHz
    VIC   6:  1440x480i   59.940060 Hz   4:3     15.734 kHz     27.000000 MHz
    VIC  31:  1920x1080   50.000000 Hz  16:9     56.250 kHz    148.500000 MHz
    VIC  20:  1920x1080i  50.000000 Hz  16:9     28.125 kHz     74.250000 MHz
    VIC  19:  1280x720    50.000000 Hz  16:9     37.500 kHz     74.250000 MHz
    VIC  18:   720x576    50.000000 Hz  16:9     31.250 kHz     27.000000 MHz
    VIC  17:   720x576    50.000000 Hz   4:3     31.250 kHz     27.000000 MHz
    VIC  22:  1440x576i   50.000000 Hz  16:9     15.625 kHz     27.000000 MHz
    VIC  21:  1440x576i   50.000000 Hz   4:3     15.625 kHz     27.000000 MHz
    VIC  32:  1920x1080   24.000000 Hz  16:9     27.000 kHz     74.250000 MHz
    VIC   1:   640x480    59.940476 Hz   4:3     31.469 kHz     25.175000 MHz
    Unknown (VIC 221)
    Unknown (VIC 222)
    Unknown (VIC 223)
  Audio Data Block:
    Linear PCM:
      Max channels: 2
      Supported sample rates (kHz): 192 176.4 96 88.2 48 44.1 32
      Supported sample sizes (bits): 24 20 16
  Speaker Allocation Data Block:
    FL/FR - Front Left/Right
  Vendor-Specific Data Block (HDMI), OUI 00-0C-03:
    Source physical address: 1.0.0.0
    Supports_AI
    DC_36bit
    DC_30bit
    DC_Y444
    Maximum TMDS clock: 300 MHz
    Extended HDMI video details:
      HDMI VICs:
        HDMI VIC 1:  3840x2160   30.000000 Hz  16:9     67.500 kHz    297.000000 MHz
        HDMI VIC 2:  3840x2160   25.000000 Hz  16:9     56.250 kHz    297.000000 MHz
        HDMI VIC 3:  3840x2160   24.000000 Hz  16:9     54.000 kHz    297.000000 MHz
  Detailed Timing Descriptors:
    DTD  7:  3840x2160   29.969697 Hz  16:9     67.432 kHz    296.700000 MHz (878 mm x 485 mm)
                  Hfront  176 Hsync  88 Hback  296 Hpol P
                  Vfront    8 Vsync  10 Vback   72 Vpol P
    DTD  8:  1920x1080   60.000000 Hz  16:9     67.500 kHz    148.500000 MHz (878 mm x 485 mm)
                  Hfront   88 Hsync  44 Hback  148 Hpol P
                  Vfront    4 Vsync   5 Vback   36 Vpol P
    DTD  9:  1920x1080i  60.000000 Hz  16:9     33.750 kHz     74.250000 MHz (878 mm x 485 mm)
                  Hfront   88 Hsync  44 Hback  148 Hpol P
                  Vfront    2 Vsync   5 Vback   15 Vpol P Vfront +0.5 Odd Field
                  Vfront    2 Vsync   5 Vback   15 Vpol P Vback  +0.5 Even Field
    DTD 10:  1280x720    60.000000 Hz  16:9     45.000 kHz     74.250000 MHz (878 mm x 485 mm)
                  Hfront  110 Hsync  40 Hback  220 Hpol P
                  Vfront    5 Vsync   5 Vback   20 Vpol P
Checksum: 0xc2  Unused space in Extension Block: 9 bytes

----------------

Warnings:

Block 1, CTA-861 Extension Block:
  Video Data Block: VIC 16 and the first DTD are not identical. Is this intended?
  Add a Colorimetry Data Block with the sRGB colorimetry bit set to avoid interop issues.
EDID:
  Base EDID: Some timings are out of range of the Monitor Ranges:
    Horizontal Freq: 15.625 - 133.311 kHz (Monitor: 30.000 - 136.000 kHz)
    Maximum Clock: 522.580 MHz (Monitor: 130.000 MHz)
  CTA-861: Multiple native progressive timings are defined.

Failures:

Block 0, Base EDID:
  Detailed Timing Descriptor #1: Mismatch of image size 708x398 mm vs display size 880x490 mm.
  Detailed Timing Descriptor #2: Mismatch of image size 708x398 mm vs display size 880x490 mm.
Block 1, CTA-861 Extension Block:
  Video Data Block: Unknown VIC 221.
  Video Data Block: Unknown VIC 222.
  Video Data Block: Unknown VIC 223.
  Vendor-Specific Data Block (HDMI), OUI 00-0C-03: HDMI VIC Codes must have their CTA-861 VIC equivalents in the VSB.
  Missing VCDB, needed for Set Selectable RGB Quantization to avoid interop issues.
Block 2, Base EDID:
  Unknown Extension Block.
Block 3, CTA-861 Extension Block:
  Video Data Block: Duplicate VIC 16.
  Video Data Block: Duplicate VIC 5.
  Video Data Block: Duplicate VIC 4.
  Video Data Block: Duplicate VIC 3.
  Video Data Block: Duplicate VIC 2.
  Video Data Block: Duplicate VIC 7.
  Video Data Block: Duplicate VIC 6.
  Video Data Block: Duplicate VIC 31.
  Video Data Block: Duplicate VIC 20.
  Video Data Block: Duplicate VIC 19.
  Video Data Block: Duplicate VIC 18.
  Video Data Block: Duplicate VIC 17.
  Video Data Block: Duplicate VIC 22.
  Video Data Block: Duplicate VIC 21.
  Video Data Block: Duplicate VIC 32.
  Video Data Block: Duplicate VIC 1.
  Video Data Block: Unknown VIC 221.
  Video Data Block: Duplicate VIC 221.
  Video Data Block: Unknown VIC 222.
  Video Data Block: Duplicate VIC 222.
  Video Data Block: Unknown VIC 223.
  Video Data Block: Duplicate VIC 223.
  Speaker Allocation Data Block: Only one instance of this Data Block is allowed.
  Vendor-Specific Data Block (HDMI), OUI 00-0C-03: HDMI VIC Codes must have their CTA-861 VIC equivalents in the VSB.
EDID:
  Base EDID: EDID specified 1 extension block(s), but found 3 extension block(s).
  Base EDID: EDID 1.3 requires a Block Map Extension in Block 1 if there are more than 2 blocks in the EDID.
  CTA-861: The maximum HDMI TMDS clock is 300000 kHz, but one or more video timings go up to 522580 kHz.

EDID conformity: FAIL
