edid-decode (hex):

00 ff ff ff ff ff ff 00 4c 2d 54 42 34 32 43 50
20 0d 01 03 0f 33 20 a2 ea 56 4e 9c 5b 50 95 26
23 50 59 bf ef 80 a9 4a a9 45 a9 40 81 80 61 59
45 59 31 59 31 40 73 4b 80 a0 72 b0 2a 40 80 d0
13 00 06 44 21 00 00 1c 00 00 00 fd 00 38 55 1e
5d 14 00 0a 20 20 20 20 20 20 00 00 00 fc 00 32
34 30 54 2f 32 34 30 4d 50 0a 20 20 00 00 00 ff
00 48 34 4b 57 38 30 30 31 39 35 0a 20 20 00 ba

00 ff ff ff ff ff ff 00 4c 2d 54 42 34 32 43 50
20 0d 01 03 0f 33 20 a2 ea 56 4e 9c 5b 50 95 26
23 50 59 bf ef 80 a9 4a a9 45 a9 40 81 80 61 59
45 59 31 59 31 40 73 4b 80 a0 72 b0 2a 40 80 d0
13 00 06 44 21 00 00 1c 00 00 00 fd 00 38 55 1e
5d 14 00 0a 20 20 20 20 20 20 00 00 00 fc 00 32
34 30 54 2f 32 34 30 4d 50 0a 20 20 00 00 00 ff
00 48 34 4b 57 38 30 30 31 39 35 0a 20 20 00 ba

----------------

Block 0, Base EDID:
  EDID Structure Version & Revision: 1.3
  Vendor & Product Identification:
    Manufacturer: SAM
    Model: 16980
    Serial Number: ...
    Made in: week 32 of 2003
  Basic Display Parameters & Features:
    Analog display
    Signal Level Standard: 0.700 : 0.300 : 1.000 V p-p
    Blank level equals black level
    Sync: Separate Composite SyncOnGreen Serration
    Maximum image size: 51 cm x 32 cm
    Gamma: 2.62
    DPMS levels: Standby Suspend Off
    RGB color display
    First detailed timing is the preferred timing
  Color Characteristics:
    Red  : 0.6103, 0.3564
    Green: 0.3134, 0.5839
    Blue : 0.1494, 0.1367
    White: 0.3154, 0.3496
  Established Timings I & II:
    IBM     :   720x400    70.081663 Hz   9:5     31.467 kHz     28.320000 MHz
    DMT 0x04:   640x480    59.940476 Hz   4:3     31.469 kHz     25.175000 MHz
    Apple   :   640x480    66.666667 Hz   4:3     35.000 kHz     30.240000 MHz
    DMT 0x05:   640x480    72.808802 Hz   4:3     37.861 kHz     31.500000 MHz
    DMT 0x06:   640x480    75.000000 Hz   4:3     37.500 kHz     31.500000 MHz
    DMT 0x08:   800x600    56.250000 Hz   4:3     35.156 kHz     36.000000 MHz
    DMT 0x09:   800x600    60.316541 Hz   4:3     37.879 kHz     40.000000 MHz
    DMT 0x0a:   800x600    72.187572 Hz   4:3     48.077 kHz     50.000000 MHz
    DMT 0x0b:   800x600    75.000000 Hz   4:3     46.875 kHz     49.500000 MHz
    Apple   :   832x624    74.551266 Hz   4:3     49.726 kHz     57.284000 MHz
    DMT 0x10:  1024x768    60.003840 Hz   4:3     48.363 kHz     65.000000 MHz
    DMT 0x11:  1024x768    70.069359 Hz   4:3     56.476 kHz     75.000000 MHz
    DMT 0x12:  1024x768    75.028582 Hz   4:3     60.023 kHz     78.750000 MHz
    DMT 0x24:  1280x1024   75.024675 Hz   5:4     79.976 kHz    135.000000 MHz
    Apple   :  1152x870    75.061550 Hz 192:145   68.681 kHz    100.000000 MHz
  Standard Timings:
    DMT 0x35:  1600x1200   70.000000 Hz   4:3     87.500 kHz    189.000000 MHz
    DMT 0x34:  1600x1200   65.000000 Hz   4:3     81.250 kHz    175.500000 MHz
    DMT 0x33:  1600x1200   60.000000 Hz   4:3     75.000 kHz    162.000000 MHz
    DMT 0x23:  1280x1024   60.019740 Hz   5:4     63.981 kHz    108.000000 MHz
    DMT 0x13:  1024x768    84.996690 Hz   4:3     68.677 kHz     94.500000 MHz
    DMT 0x0c:   800x600    85.061274 Hz   4:3     53.674 kHz     56.250000 MHz
    DMT 0x07:   640x480    85.008312 Hz   4:3     43.269 kHz     36.000000 MHz
    DMT 0x04:   640x480    59.940476 Hz   4:3     31.469 kHz     25.175000 MHz
  Detailed Timing Descriptors:
    DTD 1:  1920x1200   59.998186 Hz  16:10    74.518 kHz    193.150000 MHz (518 mm x 324 mm)
                 Hfront  128 Hsync 208 Hback  336 Hpol N
                 Vfront    1 Vsync   3 Vback   38 Vpol P
    Display Range Limits:
      Monitor ranges (GTF): 56-85 Hz V, 30-93 kHz H, max dotclock 200 MHz
    Display Product Name: '240T/240MP'
    Display Product Serial Number: ...
Checksum: 0xba

----------------

Failures:

EDID:
  Extension Block 1 started with EDID header, ignoring Extension Blocks >= 1.

EDID conformity: FAIL
