edid-decode (hex):

00 ff ff ff ff ff ff 00 22 0e 32 34 01 01 01 01
22 1e 01 03 a0 35 1e 78 2a a1 35 a3 5b 4f a3 27
11 50 54 a1 08 00 01 01 81 c0 01 01 01 01 95 00
81 00 81 80 01 01 02 3a 80 18 71 38 2d 40 58 2c
45 00 0f 28 21 00 00 1e 00 00 00 fd 00 32 3c 1e
50 11 00 0a 20 20 20 20 20 20 00 00 00 fc 00 48
50 20 32 34 77 0a 20 20 20 20 20 20 00 00 00 ff
00 43 4e 43 30 33 34 31 5a 4e 4a 0a 20 20 01 d8

02 03 23 f1 4b 10 1f 84 13 00 00 02 03 00 00 00
23 09 07 07 83 01 00 00 e2 00 0f 67 03 0c 00 20
00 80 2d 01 1d 00 72 51 d0 1e 20 6e 28 55 00 10
09 00 00 00 1e 00 00 00 00 00 00 00 00 00 00 00
00 00 00 00 00 00 00 00 00 00 00 00 00 00 00 00
00 00 00 00 00 00 00 00 00 00 00 00 00 00 00 00
00 00 00 00 00 00 00 00 00 00 00 00 00 00 00 00
00 00 00 00 00 00 00 00 00 00 00 00 00 00 00 ce

----------------

Block 0, Base EDID:
  EDID Structure Version & Revision: 1.3
  Vendor & Product Identification:
    Manufacturer: HPN
    Model: 13362
    Serial Number: ...
    Made in: week 34 of 2020
  Basic Display Parameters & Features:
    Digital display
    Maximum image size: 53 cm x 30 cm
    Gamma: 2.20
    DPMS levels: Off
    RGB color display
    First detailed timing is the preferred timing
  Color Characteristics:
    Red  : 0.6386, 0.3574
    Green: 0.3085, 0.6376
    Blue : 0.1523, 0.0693
    White: 0.3134, 0.3291
  Established Timings I & II:
    IBM     :   720x400    70.081663 Hz   9:5     31.467 kHz     28.320000 MHz
    DMT 0x04:   640x480    59.940476 Hz   4:3     31.469 kHz     25.175000 MHz
    DMT 0x09:   800x600    60.316541 Hz   4:3     37.879 kHz     40.000000 MHz
    DMT 0x10:  1024x768    60.003840 Hz   4:3     48.363 kHz     65.000000 MHz
  Standard Timings:
    DMT 0x55:  1280x720    60.000000 Hz  16:9     45.000 kHz     74.250000 MHz
    DMT 0x2f:  1440x900    59.887445 Hz  16:10    55.935 kHz    106.500000 MHz
    DMT 0x1c:  1280x800    59.810326 Hz  16:10    49.702 kHz     83.500000 MHz
    DMT 0x23:  1280x1024   60.019740 Hz   5:4     63.981 kHz    108.000000 MHz
  Detailed Timing Descriptors:
    DTD 1:  1920x1080   60.000000 Hz  16:9     67.500 kHz    148.500000 MHz (527 mm x 296 mm)
                 Hfront   88 Hsync  44 Hback  148 Hpol P
                 Vfront    4 Vsync   5 Vback   36 Vpol P
    Display Range Limits:
      Monitor ranges (GTF): 50-60 Hz V, 30-80 kHz H, max dotclock 170 MHz
    Display Product Name: 'HP 24w'
    Display Product Serial Number: ...
  Extension blocks: 1
Checksum: 0xd8

----------------

Block 1, CTA-861 Extension Block:
  Revision: 3
  Underscans IT Video Formats by default
  Basic audio support
  Supports YCbCr 4:4:4
  Supports YCbCr 4:2:2
  Native DTDs: 1
  Video Data Block:
    VIC  16:  1920x1080   60.000000 Hz  16:9     67.500 kHz    148.500000 MHz
    VIC  31:  1920x1080   50.000000 Hz  16:9     56.250 kHz    148.500000 MHz
    VIC   4:  1280x720    60.000000 Hz  16:9     45.000 kHz     74.250000 MHz (native)
    VIC  19:  1280x720    50.000000 Hz  16:9     37.500 kHz     74.250000 MHz
    VIC   2:   720x480    59.940060 Hz   4:3     31.469 kHz     27.000000 MHz
    VIC   3:   720x480    59.940060 Hz  16:9     31.469 kHz     27.000000 MHz
  Audio Data Block:
    Linear PCM:
      Max channels: 2
      Supported sample rates (kHz): 48 44.1 32
      Supported sample sizes (bits): 24 20 16
  Speaker Allocation Data Block:
    FL/FR - Front Left/Right
  Video Capability Data Block:
    YCbCr quantization: No Data
    RGB quantization: No Data
    PT scan behavior: No Data
    IT scan behavior: Supports both over- and underscan
    CE scan behavior: Supports both over- and underscan
  Vendor-Specific Data Block (HDMI), OUI 00-0C-03:
    Source physical address: 2.0.0.0
    Supports_AI
    Maximum TMDS clock: 225 MHz
  Detailed Timing Descriptors:
    DTD 2:  1280x720    60.000000 Hz  16:9     45.000 kHz     74.250000 MHz (16 mm x 9 mm)
                 Hfront  110 Hsync  40 Hback  220 Hpol P
                 Vfront    5 Vsync   5 Vback   20 Vpol P
Checksum: 0xce  Unused space in Extension Block: 74 bytes

----------------

Warnings:

Block 0, Base EDID:
  Vendor & Product Identification: The serial number is one of the known dummy values, it should probably be set to 0.
Block 1, CTA-861 Extension Block:
  Video Capability Data Block: Set Selectable YCbCr Quantization to avoid interop issues.
  Detailed Timing Descriptor #2: Dubious image size (16x9 mm is smaller than 100x100 mm).
  Display Product Serial Number is set, so the Serial Number in the Base EDID should be 0.
  Add a Colorimetry Data Block with the sRGB colorimetry bit set to avoid interop issues.
EDID:
  Base EDID: Some timings are out of range of the Monitor Ranges:
    Vertical Freq: 50.000 - 70.082 Hz (Monitor: 50.000 - 60.000 Hz)

Failures:

Block 0, Base EDID:
  Basic Display Parameters & Features: Digital Video Interface Standard set to reserved value 0x20.
Block 1, CTA-861 Extension Block:
  Video Capability Data Block: Set Selectable RGB Quantization to avoid interop issues.
  Detailed Timing Descriptor #2: Mismatch of image size 16x9 mm vs display size 530x300 mm.
EDID:
  CTA-861: Native progressive timings are a mix of several resolutions.

EDID conformity: FAIL
