edid-decode (hex):

00 ff ff ff ff ff ff 00 20 2e 00 24 4c 50 33 41
24 1d 01 03 80 35 1e 78 2a 55 c5 af 4f 33 b8 25
0b 50 54 a5 4b 00 71 4f a9 40 81 80 d1 c0 01 01
01 01 01 01 01 01 56 5e 00 a0 a0 a0 29 50 30 20
35 00 13 2a 21 00 00 1a 00 00 00 ff 00 30 30 30
30 30 30 30 30 30 30 30 30 31 00 00 00 fc 00 4d
32 33 38 45 34 4b 0a 20 20 20 20 20 00 00 00 fd
00 30 3c 1e 58 19 00 0a 20 20 20 20 20 20 01 2f

02 03 2d f1 4f 90 05 04 03 02 07 16 01 06 11 12
15 13 14 1f 23 09 1f 07 83 01 00 00 67 03 0c 00
20 00 38 3e 68 1a 00 00 01 01 30 3c ed 02 3a 80
18 71 38 2d 40 58 2c 45 00 29 37 21 00 00 1e 7e
39 00 a0 80 38 1f 40 30 20 3a 00 29 37 21 00 00
1a 01 1d 00 72 51 d0 1e 20 6e 28 55 00 29 37 21
00 00 1e bf 16 00 a0 80 38 13 40 30 20 3a 00 29
37 21 00 00 1a 00 00 00 00 00 00 00 00 00 00 8c

00 ff ff ff ff ff ff 00 20 2e 00 24 4c 50 33 41
24 1d 01 03 80 35 1e 78 2a 55 c5 af 4f 33 b8 25
0b 50 54 a5 4b 00 71 4f a9 40 81 80 d1 c0 01 01
01 01 01 01 01 01 56 5e 00 a0 a0 a0 29 50 30 20
35 00 13 2a 21 00 00 1a 00 00 00 ff 00 30 30 30
30 30 30 30 30 30 30 30 30 31 00 00 00 fc 00 4d
32 33 38 45 34 4b 0a 20 20 20 20 20 00 00 00 fd
00 30 3c 1e 58 19 00 0a 20 20 20 20 20 20 01 2f

02 03 2d f1 4f 90 05 04 03 02 07 16 01 06 11 12
15 13 14 1f 23 09 1f 07 83 01 00 00 67 03 0c 00
20 00 38 3e 68 1a 00 00 01 01 30 3c ed 02 3a 80
18 71 38 2d 40 58 2c 45 00 29 37 21 00 00 1e 7e
39 00 a0 80 38 1f 40 30 20 3a 00 29 37 21 00 00
1a 01 1d 00 72 51 d0 1e 20 6e 28 55 00 29 37 21
00 00 1e bf 16 00 a0 80 38 13 40 30 20 3a 00 29
37 21 00 00 1a 00 00 00 00 00 00 00 00 00 00 8c

----------------

Block 0, Base EDID:
  EDID Structure Version & Revision: 1.3
  Vendor & Product Identification:
    Manufacturer: HAN
    Model: 9216
    Serial Number: ...
    Made in: week 36 of 2019
  Basic Display Parameters & Features:
    Digital display
    Maximum image size: 53 cm x 30 cm
    Gamma: 2.20
    DPMS levels: Off
    RGB color display
    First detailed timing is the preferred timing
  Color Characteristics:
    Red  : 0.6845, 0.3095
    Green: 0.2001, 0.7197
    Blue : 0.1474, 0.0429
    White: 0.3134, 0.3291
  Established Timings I & II:
    IBM     :   720x400    70.081663 Hz   9:5     31.467 kHz     28.320000 MHz
    DMT 0x04:   640x480    59.940476 Hz   4:3     31.469 kHz     25.175000 MHz
    DMT 0x06:   640x480    75.000000 Hz   4:3     37.500 kHz     31.500000 MHz
    DMT 0x09:   800x600    60.316541 Hz   4:3     37.879 kHz     40.000000 MHz
    DMT 0x0b:   800x600    75.000000 Hz   4:3     46.875 kHz     49.500000 MHz
    DMT 0x10:  1024x768    60.003840 Hz   4:3     48.363 kHz     65.000000 MHz
    DMT 0x12:  1024x768    75.028582 Hz   4:3     60.023 kHz     78.750000 MHz
    DMT 0x24:  1280x1024   75.024675 Hz   5:4     79.976 kHz    135.000000 MHz
  Standard Timings:
    DMT 0x15:  1152x864    75.000000 Hz   4:3     67.500 kHz    108.000000 MHz
    DMT 0x33:  1600x1200   60.000000 Hz   4:3     75.000 kHz    162.000000 MHz
    DMT 0x23:  1280x1024   60.019740 Hz   5:4     63.981 kHz    108.000000 MHz
    DMT 0x52:  1920x1080   60.000000 Hz  16:9     67.500 kHz    148.500000 MHz
  Detailed Timing Descriptors:
    DTD 1:  2560x1440   59.950550 Hz  16:9     88.787 kHz    241.500000 MHz (531 mm x 298 mm)
                 Hfront   48 Hsync  32 Hback   80 Hpol P
                 Vfront    3 Vsync   5 Vback   33 Vpol N
    Display Product Serial Number: ...
    Display Product Name: 'M238E4K'
    Display Range Limits:
      Monitor ranges (GTF): 48-60 Hz V, 30-88 kHz H, max dotclock 250 MHz
  Extension blocks: 1
Checksum: 0x2f

----------------

Block 1, CTA-861 Extension Block:
  Revision: 3
  Underscans IT Video Formats by default
  Basic audio support
  Supports YCbCr 4:4:4
  Supports YCbCr 4:2:2
  Native DTDs: 1
  Video Data Block:
    VIC  16:  1920x1080   60.000000 Hz  16:9     67.500 kHz    148.500000 MHz (native)
    VIC   5:  1920x1080i  60.000000 Hz  16:9     33.750 kHz     74.250000 MHz
    VIC   4:  1280x720    60.000000 Hz  16:9     45.000 kHz     74.250000 MHz
    VIC   3:   720x480    59.940060 Hz  16:9     31.469 kHz     27.000000 MHz
    VIC   2:   720x480    59.940060 Hz   4:3     31.469 kHz     27.000000 MHz
    VIC   7:  1440x480i   59.940060 Hz  16:9     15.734 kHz     27.000000 MHz
    VIC  22:  1440x576i   50.000000 Hz  16:9     15.625 kHz     27.000000 MHz
    VIC   1:   640x480    59.940476 Hz   4:3     31.469 kHz     25.175000 MHz
    VIC   6:  1440x480i   59.940060 Hz   4:3     15.734 kHz     27.000000 MHz
    VIC  17:   720x576    50.000000 Hz   4:3     31.250 kHz     27.000000 MHz
    VIC  18:   720x576    50.000000 Hz  16:9     31.250 kHz     27.000000 MHz
    VIC  21:  1440x576i   50.000000 Hz   4:3     15.625 kHz     27.000000 MHz
    VIC  19:  1280x720    50.000000 Hz  16:9     37.500 kHz     74.250000 MHz
    VIC  20:  1920x1080i  50.000000 Hz  16:9     28.125 kHz     74.250000 MHz
    VIC  31:  1920x1080   50.000000 Hz  16:9     56.250 kHz    148.500000 MHz
  Audio Data Block:
    Linear PCM:
      Max channels: 2
      Supported sample rates (kHz): 96 88.2 48 44.1 32
      Supported sample sizes (bits): 24 20 16
  Speaker Allocation Data Block:
    FL/FR - Front Left/Right
  Vendor-Specific Data Block (HDMI), OUI 00-0C-03:
    Source physical address: 2.0.0.0
    DC_36bit
    DC_30bit
    DC_Y444
    Maximum TMDS clock: 310 MHz
  Vendor-Specific Data Block (AMD), OUI 00-00-1A:
    Version: 1
    Feature Caps: 0x01
    Minimum Refresh Rate: 48 Hz
    Maximum Refresh Rate: 60 Hz
    Flags 1.x: 0xed (MCCS)
  Detailed Timing Descriptors:
    DTD 2:  1920x1080   60.000000 Hz  16:9     67.500 kHz    148.500000 MHz (553 mm x 311 mm)
                 Hfront   88 Hsync  44 Hback  148 Hpol P
                 Vfront    4 Vsync   5 Vback   36 Vpol P
    DTD 3:  2048x1080   59.997848 Hz 256:135   66.658 kHz    147.180000 MHz (553 mm x 311 mm)
                 Hfront   48 Hsync  32 Hback   80 Hpol P
                 Vfront    3 Vsync  10 Vback   18 Vpol N
    DTD 4:  1280x720    60.000000 Hz  16:9     45.000 kHz     74.250000 MHz (553 mm x 311 mm)
                 Hfront  110 Hsync  40 Hback  220 Hpol P
                 Vfront    5 Vsync   5 Vback   20 Vpol P
    DTD 5:  2048x1080   23.996617 Hz 256:135   26.372 kHz     58.230000 MHz (553 mm x 311 mm)
                 Hfront   48 Hsync  32 Hback   80 Hpol P
                 Vfront    3 Vsync  10 Vback    6 Vpol N
Checksum: 0x8c  Unused space in Extension Block: 10 bytes

----------------

Warnings:

Block 0, Base EDID:
  Display Product Serial Number: ...
Block 1, CTA-861 Extension Block:
  Video Data Block: VIC 16 and the first DTD are not identical. Is this intended?
  Detailed Timing Descriptor #3: Image size is 553x311 mm, but based on the picture AR it should be 553x291 mm.
  Detailed Timing Descriptor #5: Image size is 553x311 mm, but based on the picture AR it should be 553x291 mm.
  Display Product Serial Number is set, so the Serial Number in the Base EDID should be 0.
  Add a Colorimetry Data Block with the sRGB colorimetry bit set to avoid interop issues.
EDID:
  Base EDID: Some timings are out of range of the Monitor Ranges:
    Vertical Freq: 23.997 - 75.029 Hz (Monitor: 48.000 - 60.000 Hz)
    Horizontal Freq: 15.625 - 88.786 kHz (Monitor: 30.000 - 88.000 kHz)

Failures:

Block 1, CTA-861 Extension Block:
  Detailed Timing Descriptor #2: Mismatch of image size 553x311 mm vs display size 530x300 mm.
  Detailed Timing Descriptor #3: Mismatch of image size 553x311 mm vs display size 530x300 mm.
  Detailed Timing Descriptor #4: Mismatch of image size 553x311 mm vs display size 530x300 mm.
  Detailed Timing Descriptor #5: Mismatch of image size 553x311 mm vs display size 530x300 mm.
  Missing VCDB, needed for Set Selectable RGB Quantization to avoid interop issues.
EDID:
  Extension Block 2 started with EDID header, ignoring Extension Blocks >= 2.
  Base EDID: The DTD max image size is 553x311mm, which is larger than the display size 530.0x300.0mm.
  CTA-861: Native progressive timings are a mix of several resolutions.

EDID conformity: FAIL
