edid-decode (hex):

00 ff ff ff ff ff ff 00 43 47 50 18 01 00 00 00
1e 1b 01 03 68 29 17 78 ea b1 a5 a1 58 4f 95 26
16 50 54 ad ce 00 81 80 81 00 81 40 81 c0 01 01
01 01 01 01 01 01 66 21 56 aa 51 00 1e 30 46 8f
33 00 c4 fe 10 00 00 1e 66 21 50 b0 51 00 1b 30
40 70 36 00 c4 fe 10 00 00 1e 0e 1f 00 80 51 00
1e 30 30 20 37 00 70 cf 10 00 00 1c 00 00 00 fc
00 56 47 41 0a 20 20 20 20 20 20 20 20 20 00 59

00 ff ff ff ff ff ff 00 43 47 50 18 01 00 00 00
1e 1b 01 03 68 29 17 78 ea b1 a5 a1 58 4f 95 26
16 50 54 ad ce 00 81 80 81 00 81 40 81 c0 01 01
01 01 01 01 01 01 66 21 56 aa 51 00 1e 30 46 8f
33 00 c4 fe 10 00 00 1e 66 21 50 b0 51 00 1b 30
40 70 36 00 c4 fe 10 00 00 1e 0e 1f 00 80 51 00
1e 30 30 20 37 00 70 cf 10 00 00 1c 00 00 00 fc
00 56 47 41 0a 20 20 20 20 20 20 20 20 20 00 59

----------------

Block 0, Base EDID:
  EDID Structure Version & Revision: 1.3
  Vendor & Product Identification:
    Manufacturer: PZG
    Model: 6224
    Serial Number: ...
    Made in: week 30 of 2017
  Basic Display Parameters & Features:
    Analog display
    Signal Level Standard: 0.700 : 0.000 : 0.700 V p-p
    Blank level equals black level
    Sync: Separate
    Maximum image size: 41 cm x 23 cm
    Gamma: 2.20
    DPMS levels: Standby Suspend Off
    RGB color display
    First detailed timing is the preferred timing
  Color Characteristics:
    Red  : 0.6308, 0.3466
    Green: 0.3085, 0.5830
    Blue : 0.1503, 0.0878
    White: 0.3134, 0.3291
  Established Timings I & II:
    IBM     :   720x400    70.081663 Hz   9:5     31.467 kHz     28.320000 MHz
    DMT 0x04:   640x480    59.940476 Hz   4:3     31.469 kHz     25.175000 MHz
    DMT 0x05:   640x480    72.808802 Hz   4:3     37.861 kHz     31.500000 MHz
    DMT 0x06:   640x480    75.000000 Hz   4:3     37.500 kHz     31.500000 MHz
    DMT 0x09:   800x600    60.316541 Hz   4:3     37.879 kHz     40.000000 MHz
    DMT 0x0a:   800x600    72.187572 Hz   4:3     48.077 kHz     50.000000 MHz
    DMT 0x0b:   800x600    75.000000 Hz   4:3     46.875 kHz     49.500000 MHz
    DMT 0x10:  1024x768    60.003840 Hz   4:3     48.363 kHz     65.000000 MHz
    DMT 0x11:  1024x768    70.069359 Hz   4:3     56.476 kHz     75.000000 MHz
    DMT 0x12:  1024x768    75.028582 Hz   4:3     60.023 kHz     78.750000 MHz
  Standard Timings:
    DMT 0x23:  1280x1024   60.019740 Hz   5:4     63.981 kHz    108.000000 MHz
    DMT 0x1c:  1280x800    59.810326 Hz  16:10    49.702 kHz     83.500000 MHz
    DMT 0x20:  1280x960    60.000000 Hz   4:3     60.000 kHz    108.000000 MHz
    DMT 0x55:  1280x720    60.000000 Hz  16:9     45.000 kHz     74.250000 MHz
  Detailed Timing Descriptors:
    DTD 1:  1366x768    59.789541 Hz 683:384   47.712 kHz     85.500000 MHz (452 mm x 254 mm)
                 Hfront   70 Hsync 143 Hback  213 Hpol P
                 Vfront    3 Vsync   3 Vback   24 Vpol P
    DTD 2:  1360x768    60.015162 Hz  85:48    47.712 kHz     85.500000 MHz (452 mm x 254 mm)
                 Hfront   64 Hsync 112 Hback  256 Hpol P
                 Vfront    3 Vsync   6 Vback   18 Vpol P
    DTD 3:  1280x768    59.870228 Hz   5:3     47.776 kHz     79.500000 MHz (368 mm x 207 mm)
                 Hfront   48 Hsync  32 Hback  304 Hpol N
                 Vfront    3 Vsync   7 Vback   20 Vpol P
    Display Product Name: 'VGA'
Checksum: 0x59

----------------

Block 1, Unknown EDID Extension Block 0x00:
  00 ff ff ff ff ff ff 00 43 47 50 18 01 00 00 00 '........CGP.....'
  1e 1b 01 03 68 29 17 78 ea b1 a5 a1 58 4f 95 26 '....h).x....XO.&'
  16 50 54 ad ce 00 81 80 81 00 81 40 81 c0 01 01 '.PT........@....'
  01 01 01 01 01 01 66 21 56 aa 51 00 1e 30 46 8f '......f!V.Q..0F.'
  33 00 c4 fe 10 00 00 1e 66 21 50 b0 51 00 1b 30 '3.......f!P.Q..0'
  40 70 36 00 c4 fe 10 00 00 1e 0e 1f 00 80 51 00 '@p6...........Q.'
  1e 30 30 20 37 00 70 cf 10 00 00 1c 00 00 00 fc '.00 7.p.........'
  00 56 47 41 0a 20 20 20 20 20 20 20 20 20 00 59 '.VGA.         .Y'
Checksum: 0x59

----------------

Warnings:

Block 0, Base EDID:
  Vendor & Product Identification: The serial number is one of the known dummy values, it should probably be set to 0.
  Detailed Timing Descriptor #3: DTD is similar but not identical to DMT 0x17.
  Detailed Timing Descriptor #3: Image size is 368x207 mm, but based on the picture AR it should be 368x220 mm.

Failures:

Block 0, Base EDID:
  Detailed Timing Descriptor #1: Mismatch of image size 452x254 mm vs display size 410x230 mm.
  Detailed Timing Descriptor #2: Mismatch of image size 452x254 mm vs display size 410x230 mm.
  Detailed Timing Descriptor #3: Mismatch of image size 368x207 mm vs display size 410x230 mm.
  Missing Display Range Limits Descriptor.
Block 1, Base EDID:
  Unknown Extension Block.
EDID:
  Base EDID: The DTD max image size is 452x254mm, which is larger than the display size 410.0x230.0mm.
  Base EDID: EDID specified 0 extension block(s), but found 1 extension block(s).

EDID conformity: FAIL
