edid-decode (hex):

00 ff ff ff ff ff ff 00 30 e4 00 11 01 00 00 00
20 22 01 04 a0 3c 21 78 e6 bd 00 a6 55 51 9c 27
0f 50 54 00 00 00 d1 c0 01 01 01 01 01 01 01 01
01 01 01 01 01 01 2a 44 80 a0 70 38 27 40 30 20
35 00 55 50 21 00 00 1a 00 00 00 fc 00 4d 33 37
30 32 57 46 41 0a 20 20 20 20 00 00 00 fd 00 39
4e 53 53 12 00 0a 20 20 20 20 20 20 00 00 00 fe
00 4c 4d 32 37 30 57 46 37 2d 53 53 44 33 00 4d

00 ff ff ff ff ff ff 00 30 e4 00 11 01 00 00 00
20 22 01 04 a0 3c 21 78 e6 bd 00 a6 55 51 9c 27
0f 50 54 00 00 00 d1 c0 01 01 01 01 01 01 01 01
01 01 01 01 01 01 2a 44 80 a0 70 38 27 40 30 20
35 00 55 50 21 00 00 1a 00 00 00 fc 00 4d 33 37
30 32 57 46 41 0a 20 20 20 20 00 00 00 fd 00 39
4e 53 53 12 00 0a 20 20 20 20 20 20 00 00 00 fe
00 4c 4d 32 37 30 57 46 37 2d 53 53 44 33 00 4d

----------------

Block 0, Base EDID:
  EDID Structure Version & Revision: 1.4
  Vendor & Product Identification:
    Manufacturer: LGD
    Model: 4352
    Serial Number: ...
    Made in: week 32 of 2024
  Basic Display Parameters & Features:
    Digital display
    Bits per primary color channel: 8
    Digital interface is not defined
    Maximum image size: 60 cm x 33 cm
    Gamma: 2.20
    DPMS levels: Standby Suspend Off
    Supported color formats: RGB 4:4:4
    Default (sRGB) color space is primary color space
    First detailed timing includes the native pixel format and preferred refresh rate
  Color Characteristics:
    Red  : 0.6503, 0.3349
    Green: 0.3193, 0.6103
    Blue : 0.1523, 0.0585
    White: 0.3125, 0.3281
  Established Timings I & II: none
  Standard Timings:
    DMT 0x52:  1920x1080   60.000000 Hz  16:9     67.500 kHz    148.500000 MHz
  Detailed Timing Descriptors:
    DTD 1:  1920x1080   74.972503 Hz  16:9     83.894 kHz    174.500000 MHz (597 mm x 336 mm)
                 Hfront   48 Hsync  32 Hback   80 Hpol P
                 Vfront    3 Vsync   5 Vback   31 Vpol N
    Display Product Name: 'M3702WFA'
    Display Range Limits:
      Monitor ranges (GTF): 57-78 Hz V, 83-83 kHz H, max dotclock 180 MHz
    Alphanumeric Data String: 'LM270WF7-SSD3'
Checksum: 0x4d

----------------

Warnings:

Block 0, Base EDID:
  Vendor & Product Identification: The serial number is one of the known dummy values, it should probably be set to 0.
  Display Range Limits: GTF support is deprecated in EDID 1.4.
EDID:
  Base EDID: Some timings are out of range of the Monitor Ranges:
    Horizontal Freq: 67.500 - 83.894 kHz (Monitor: 83.000 - 83.000 kHz)

Failures:

Block 0, Base EDID:
  Basic Display Parameters & Features: sRGB is signaled, but the chromaticities do not match.
  Display Range Limits: GTF is supported, but the display does not support continuous frequencies.
EDID:
  Extension Block 1 started with EDID header, ignoring Extension Blocks >= 1.

EDID conformity: FAIL
