edid-decode (hex):

00 ff ff ff ff ff ff 00 4a 8b 20 19 01 01 01 01
00 20 01 03 81 00 00 78 ec ee 91 a3 54 4c 99 26
0f 50 54 23 08 00 d1 c0 b3 00 95 00 81 00 61 40
45 40 81 40 81 c0 02 3a 80 18 71 38 2d 40 58 2c
25 00 58 c3 10 00 00 1e 00 00 00 fc 00 00 0a 20
20 20 20 20 20 20 20 20 20 20 00 00 00 ff 00 64
65 6d 6f 73 65 74 2d 31 0a 20 30 20 00 00 00 fd
00 38 3f 54 54 13 00 0a 20 20 20 20 20 20 01 06

02 03 32 f2 4f 61 04 10 13 13 1f 61 61 61 61 61
61 61 4b 4c e2 00 d5 e3 05 c0 00 23 09 07 07 83
01 00 00 67 03 0c 00 10 00 10 3c e6 06 05 01 69
69 4f 02 3a 80 18 71 38 2d 40 58 2c 25 00 58 c3
10 00 00 1e 02 3a 80 18 71 38 2d 40 58 2c 45 00
58 c3 10 00 00 1e 00 00 00 00 00 00 00 00 00 00
00 00 00 00 00 00 00 00 00 00 00 00 00 00 00 00
00 00 00 00 00 00 00 00 00 00 00 00 00 00 00 b6

00 ff ff ff ff ff ff 00 4a 8b 20 19 01 01 01 01
00 20 01 03 81 00 00 78 ec ee 91 a3 54 4c 99 26
0f 50 54 23 08 00 d1 c0 b3 00 95 00 81 00 61 40
45 40 81 40 81 c0 02 3a 80 18 71 38 2d 40 58 2c
25 00 58 c3 10 00 00 1e 00 00 00 fc 00 00 0a 20
20 20 20 20 20 20 20 20 20 20 00 00 00 ff 00 64
65 6d 6f 73 65 74 2d 31 0a 20 30 20 00 00 00 fd
00 38 3f 54 54 13 00 0a 20 20 20 20 20 20 01 06

02 03 32 f2 4f 61 04 10 13 13 1f 61 61 61 61 61
61 61 4b 4c e2 00 d5 e3 05 c0 00 23 09 07 07 83
01 00 00 67 03 0c 00 10 00 10 3c e6 06 05 01 69
69 4f 02 3a 80 18 71 38 2d 40 58 2c 25 00 58 c3
10 00 00 1e 02 3a 80 18 71 38 2d 40 58 2c 45 00
58 c3 10 00 00 1e 00 00 00 00 00 00 00 00 00 00
00 00 00 00 00 00 00 00 00 00 00 00 00 00 00 00
00 00 00 00 00 00 00 00 00 00 00 00 00 00 00 b6

----------------

Block 0, Base EDID:
  EDID Structure Version & Revision: 1.3
  Vendor & Product Identification:
    Manufacturer: RTK
    Model: 6432
    Serial Number: ...
    Made in: 2022
  Basic Display Parameters & Features:
    Digital display
    DFP 1.x compatible TMDS
    Image size is variable
    Gamma: 2.20
    DPMS levels: Standby Suspend Off
    RGB color display
    Default (sRGB) color space is primary color space
  Color Characteristics:
    Red  : 0.6396, 0.3300
    Green: 0.2998, 0.5996
    Blue : 0.1503, 0.0595
    White: 0.3125, 0.3291
  Established Timings I & II:
    DMT 0x04:   640x480    59.940476 Hz   4:3     31.469 kHz     25.175000 MHz
    DMT 0x08:   800x600    56.250000 Hz   4:3     35.156 kHz     36.000000 MHz
    DMT 0x09:   800x600    60.316541 Hz   4:3     37.879 kHz     40.000000 MHz
    DMT 0x10:  1024x768    60.003840 Hz   4:3     48.363 kHz     65.000000 MHz
  Standard Timings:
    DMT 0x52:  1920x1080   60.000000 Hz  16:9     67.500 kHz    148.500000 MHz
    DMT 0x3a:  1680x1050   59.954250 Hz  16:10    65.290 kHz    146.250000 MHz
    DMT 0x2f:  1440x900    59.887445 Hz  16:10    55.935 kHz    106.500000 MHz
    DMT 0x1c:  1280x800    59.810326 Hz  16:10    49.702 kHz     83.500000 MHz
    DMT 0x10:  1024x768    60.003840 Hz   4:3     48.363 kHz     65.000000 MHz
    DMT 0x09:   800x600    60.316541 Hz   4:3     37.879 kHz     40.000000 MHz
    DMT 0x20:  1280x960    60.000000 Hz   4:3     60.000 kHz    108.000000 MHz
    DMT 0x55:  1280x720    60.000000 Hz  16:9     45.000 kHz     74.250000 MHz
  Detailed Timing Descriptors:
    DTD 1:  1920x1080   60.000000 Hz  16:9     67.500 kHz    148.500000 MHz (344 mm x 195 mm)
                 Hfront   88 Hsync  44 Hback  148 Hpol P
                 Vfront    2 Vsync   5 Vback   38 Vpol P
    Display Product Name: ''
    Display Product Serial Number: ...
    Display Range Limits:
      Monitor ranges (GTF): 56-63 Hz V, 84-84 kHz H, max dotclock 190 MHz
  Extension blocks: 1
Checksum: 0x06

----------------

Block 1, CTA-861 Extension Block:
  Revision: 3
  Underscans IT Video Formats by default
  Basic audio support
  Supports YCbCr 4:4:4
  Supports YCbCr 4:2:2
  Native DTDs: 2
  Video Data Block:
    VIC  97:  3840x2160   60.000000 Hz  16:9    135.000 kHz    594.000000 MHz
    VIC   4:  1280x720    60.000000 Hz  16:9     45.000 kHz     74.250000 MHz
    VIC  16:  1920x1080   60.000000 Hz  16:9     67.500 kHz    148.500000 MHz
    VIC  19:  1280x720    50.000000 Hz  16:9     37.500 kHz     74.250000 MHz
    VIC  19:  1280x720    50.000000 Hz  16:9     37.500 kHz     74.250000 MHz
    VIC  31:  1920x1080   50.000000 Hz  16:9     56.250 kHz    148.500000 MHz
    VIC  97:  3840x2160   60.000000 Hz  16:9    135.000 kHz    594.000000 MHz
    VIC  97:  3840x2160   60.000000 Hz  16:9    135.000 kHz    594.000000 MHz
    VIC  97:  3840x2160   60.000000 Hz  16:9    135.000 kHz    594.000000 MHz
    VIC  97:  3840x2160   60.000000 Hz  16:9    135.000 kHz    594.000000 MHz
    VIC  97:  3840x2160   60.000000 Hz  16:9    135.000 kHz    594.000000 MHz
    VIC  97:  3840x2160   60.000000 Hz  16:9    135.000 kHz    594.000000 MHz
    VIC  97:  3840x2160   60.000000 Hz  16:9    135.000 kHz    594.000000 MHz
    VIC  75:  1920x1080   50.000000 Hz  64:27    56.250 kHz    148.500000 MHz
    VIC  76:  1920x1080   60.000000 Hz  64:27    67.500 kHz    148.500000 MHz
  Video Capability Data Block:
    YCbCr quantization: Selectable (via AVI YQ)
    RGB quantization: Selectable (via AVI Q)
    PT scan behavior: Always Overscanned
    IT scan behavior: Always Overscanned
    CE scan behavior: Always Overscanned
  Colorimetry Data Block:
    BT2020YCC
    BT2020RGB
  Audio Data Block:
    Linear PCM:
      Max channels: 2
      Supported sample rates (kHz): 48 44.1 32
      Supported sample sizes (bits): 24 20 16
  Speaker Allocation Data Block:
    FL/FR - Front Left/Right
  Vendor-Specific Data Block (HDMI), OUI 00-0C-03:
    Source physical address: 1.0.0.0
    DC_30bit
    Maximum TMDS clock: 300 MHz
  HDR Static Metadata Data Block:
    Electro optical transfer functions:
      Traditional gamma - SDR luminance range
      SMPTE ST2084
    Supported static metadata descriptors:
      Static metadata type 1
    Desired content max luminance: 105 (486.099 cd/m^2)
    Desired content max frame-average luminance: 105 (486.099 cd/m^2)
    Desired content min luminance: 79 (0.467 cd/m^2)
  Detailed Timing Descriptors:
    DTD 2:  1920x1080   60.000000 Hz  16:9     67.500 kHz    148.500000 MHz (344 mm x 195 mm)
                 Hfront   88 Hsync  44 Hback  148 Hpol P
                 Vfront    2 Vsync   5 Vback   38 Vpol P
    DTD 3:  1920x1080   60.000000 Hz  16:9     67.500 kHz    148.500000 MHz (344 mm x 195 mm)
                 Hfront   88 Hsync  44 Hback  148 Hpol P
                 Vfront    4 Vsync   5 Vback   36 Vpol P
Checksum: 0xb6  Unused space in Extension Block: 41 bytes

----------------

Warnings:

Block 0, Base EDID:
  Vendor & Product Identification: The serial number is one of the known dummy values, it should probably be set to 0.
  Detailed Timing Descriptor #1: DTD is similar but not identical to VIC 16.
  Display Product Serial Number: ...
Block 1, CTA-861 Extension Block:
  Video Data Block: VIC 97 and the first DTD are not identical. Is this intended?
  Video Capability Data Block: IT scan behavior is expected to support underscanned.
  Video Capability Data Block: S_PT is equal to S_IT and S_CE, so should be set to 0 instead.
  Detailed Timing Descriptor #2: DTD is similar but not identical to VIC 16.
  Display Product Serial Number is set, so the Serial Number in the Base EDID should be 0.
EDID:
  Base EDID: Some timings are out of range of the Monitor Ranges:
    Vertical Freq: 50.000 - 60.317 Hz (Monitor: 56.000 - 63.000 Hz)
    Horizontal Freq: 31.468 - 135.000 kHz (Monitor: 84.000 - 84.000 kHz)
    Maximum Clock: 594.000 MHz (Monitor: 190.000 MHz)
  CTA-861: Native progressive resolution of 1920x1080 is smaller than the max preferred progressive resolution 3840x2160.

Failures:

Block 0, Base EDID:
  Display Product Serial Number: ...
  Basic Display Parameters & Features: EDID 1.3 requires that the first detailed timing is the preferred timing.
  Display Product Name: NUL byte at position 0.
Block 1, CTA-861 Extension Block:
  Video Data Block: Duplicate VIC 19.
  Video Data Block: Duplicate VIC 97.
  Video Capability Data Block: IT video formats are always overscanned, but bit 7 of Byte 3 of the CTA-861 Extension header is set to underscanned.
EDID:
  Extension Block 2 started with EDID header, ignoring Extension Blocks >= 2.
  Base EDID: The DTD max image size is 344x195mm, but the display size is not specified anywhere.
  CTA-861: The maximum HDMI TMDS clock is 300000 kHz, but one or more video timings go up to 594000 kHz.

EDID conformity: FAIL
