edid-decode (hex):

00 ff ff ff ff ff ff 00 4a 8b 20 19 15 05 20 19
00 1e 01 03 80 00 00 78 3e ee 91 a3 54 4c 99 26
0f 50 54 20 00 00 01 01 01 01 01 01 01 01 01 01
01 01 01 01 01 01 b0 1b 80 18 71 03 16 20 58 2c
25 00 55 50 21 00 00 1e 00 00 00 fc 00 00 0a 20
20 20 20 20 20 20 20 20 20 20 00 00 00 ff 00 00
0a 20 20 20 20 20 20 20 20 20 20 20 00 00 00 fd
00 32 4b 54 54 13 01 0a 20 20 20 20 20 20 01 7f

02 03 32 f2 4f 04 13 00 00 00 00 00 00 00 00 00
00 00 00 00 e3 05 c0 00 23 09 7f 07 83 01 00 00
67 03 0c 00 10 00 38 3c e6 06 05 01 69 69 4f e2
00 d5 b0 1b 80 18 71 03 16 20 58 2c 25 00 55 50
21 00 00 1e 00 00 00 00 00 00 00 00 00 00 00 00
00 00 00 00 00 00 00 00 00 00 00 00 00 00 00 00
00 00 00 00 00 00 00 00 00 00 00 00 00 00 00 00
00 00 00 00 00 00 00 00 00 00 00 00 00 00 00 35

00 ff ff ff ff ff ff 00 4a 8b 20 19 15 05 20 19
00 1e 01 03 80 00 00 78 3e ee 91 a3 54 4c 99 26
0f 50 54 20 00 00 01 01 01 01 01 01 01 01 01 01
01 01 01 01 01 01 b0 1b 80 18 71 03 16 20 58 2c
25 00 55 50 21 00 00 1e 00 00 00 fc 00 00 0a 20
20 20 20 20 20 20 20 20 20 20 00 00 00 ff 00 00
0a 20 20 20 20 20 20 20 20 20 20 20 00 00 00 fd
00 32 4b 54 54 13 01 0a 20 20 20 20 20 20 01 7f

02 03 32 f2 4f 04 13 00 00 00 00 00 00 00 00 00
00 00 00 00 e3 05 c0 00 23 09 7f 07 83 01 00 00
67 03 0c 00 10 00 38 3c e6 06 05 01 69 69 4f e2
00 d5 b0 1b 80 18 71 03 16 20 58 2c 25 00 55 50
21 00 00 1e 00 00 00 00 00 00 00 00 00 00 00 00
00 00 00 00 00 00 00 00 00 00 00 00 00 00 00 00
00 00 00 00 00 00 00 00 00 00 00 00 00 00 00 00
00 00 00 00 00 00 00 00 00 00 00 00 00 00 00 35

----------------

Block 0, Base EDID:
  EDID Structure Version & Revision: 1.3
  Vendor & Product Identification:
    Manufacturer: RTK
    Model: 6432
    Serial Number: ...
    Made in: 2020
  Basic Display Parameters & Features:
    Digital display
    Image size is variable
    Gamma: 2.20
    DPMS levels: Off
    Undefined display color type
    Default (sRGB) color space is primary color space
    First detailed timing is the preferred timing
  Color Characteristics:
    Red  : 0.6396, 0.3300
    Green: 0.2998, 0.5996
    Blue : 0.1503, 0.0595
    White: 0.3125, 0.3291
  Established Timings I & II:
    DMT 0x04:   640x480    59.940476 Hz   4:3     31.469 kHz     25.175000 MHz
  Standard Timings: none
  Detailed Timing Descriptors:
    DTD 1:  1920x515    59.996614 Hz 384:103   32.218 kHz     70.880000 MHz (597 mm x 336 mm)
                 Hfront   88 Hsync  44 Hback  148 Hpol P
                 Vfront    2 Vsync   5 Vback   15 Vpol P
    Display Product Name: ''
    Display Product Serial Number: ...
    Display Range Limits:
      Monitor ranges (Range Limits Only): 50-75 Hz V, 84-84 kHz H, max dotclock 190 MHz
  Extension blocks: 1
Checksum: 0x7f

----------------

Block 1, CTA-861 Extension Block:
  Revision: 3
  Underscans IT Video Formats by default
  Basic audio support
  Supports YCbCr 4:4:4
  Supports YCbCr 4:2:2
  Native DTDs: 2
  Video Data Block:
    VIC   4:  1280x720    60.000000 Hz  16:9     45.000 kHz     74.250000 MHz
    VIC  19:  1280x720    50.000000 Hz  16:9     37.500 kHz     74.250000 MHz
  Colorimetry Data Block:
    BT2020YCC
    BT2020RGB
  Audio Data Block:
    Linear PCM:
      Max channels: 2
      Supported sample rates (kHz): 192 176.4 96 88.2 48 44.1 32
      Supported sample sizes (bits): 24 20 16
  Speaker Allocation Data Block:
    FL/FR - Front Left/Right
  Vendor-Specific Data Block (HDMI), OUI 00-0C-03:
    Source physical address: 1.0.0.0
    DC_36bit
    DC_30bit
    DC_Y444
    Maximum TMDS clock: 300 MHz
  HDR Static Metadata Data Block:
    Electro optical transfer functions:
      Traditional gamma - SDR luminance range
      SMPTE ST2084
    Supported static metadata descriptors:
      Static metadata type 1
    Desired content max luminance: 105 (486.099 cd/m^2)
    Desired content max frame-average luminance: 105 (486.099 cd/m^2)
    Desired content min luminance: 79 (0.467 cd/m^2)
  Video Capability Data Block:
    YCbCr quantization: Selectable (via AVI YQ)
    RGB quantization: Selectable (via AVI Q)
    PT scan behavior: Always Overscanned
    IT scan behavior: Always Overscanned
    CE scan behavior: Always Overscanned
  Detailed Timing Descriptors:
    DTD 2:  1920x515    59.996614 Hz 384:103   32.218 kHz     70.880000 MHz (597 mm x 336 mm)
                 Hfront   88 Hsync  44 Hback  148 Hpol P
                 Vfront    2 Vsync   5 Vback   15 Vpol P
Checksum: 0x35  Unused space in Extension Block: 59 bytes

----------------

Warnings:

Block 0, Base EDID:
  Detailed Timing Descriptor #1: Image size is 597x336 mm, but based on the picture AR it should be 597x160 mm.
Block 1, CTA-861 Extension Block:
  Video Data Block: VIC 4 and the first DTD are not identical. Is this intended?
  Video Data Block: All VICs are in ascending order, and the first (preferred) VIC <= 4, is that intended?
  Video Capability Data Block: IT scan behavior is expected to support underscanned.
  Video Capability Data Block: S_PT is equal to S_IT and S_CE, so should be set to 0 instead.
  Detailed Timing Descriptor #2: Image size is 597x336 mm, but based on the picture AR it should be 597x160 mm.
  Display Product Serial Number is set, so the Serial Number in the Base EDID should be 0.
EDID:
  Base EDID: Some timings are out of range of the Monitor Ranges:
    Horizontal Freq: 31.468 - 45.000 kHz (Monitor: 84.000 - 84.000 kHz)
  CTA-861: Native progressive resolution of 1920x515 is smaller than the max preferred progressive resolution 1280x720.

Failures:

Block 0, Base EDID:
  Display Product Serial Number: ...
  Display Product Name: NUL byte at position 0.
  Display Range Limits: 'Range Limits Only' is not allowed for EDID < 1.4.
Block 1, CTA-861 Extension Block:
  Video Capability Data Block: IT video formats are always overscanned, but bit 7 of Byte 3 of the CTA-861 Extension header is set to underscanned.
EDID:
  Extension Block 2 started with EDID header, ignoring Extension Blocks >= 2.
  Base EDID: The DTD max image size is 597x336mm, but the display size is not specified anywhere.

EDID conformity: FAIL
