edid-decode (hex):

00 ff ff ff ff ff ff 00 22 f0 9e 29 01 01 01 01
0e 17 01 03 68 2c 19 78 2e ff 95 a2 56 51 9e 27
0c 50 54 a1 08 00 a9 c0 81 80 95 00 81 c0 01 01
01 01 01 01 01 01 30 2a 40 c8 60 84 64 30 18 50
13 00 bb f9 10 00 00 1e 00 00 00 fd 00 32 4c 18
53 11 00 0a 20 20 20 20 20 20 00 00 00 fc 00 48
50 20 57 32 30 37 31 64 0a 20 20 20 00 00 00 ff
00 36 43 4d 33 31 34 30 38 37 51 0a 20 20 00 38

00 ff ff ff ff ff ff 00 22 f0 9e 29 01 01 01 01
0e 17 01 03 68 2c 19 78 2e ff 95 a2 56 51 9e 27
0c 50 54 a1 08 00 a9 c0 81 80 95 00 81 c0 01 01
01 01 01 01 01 01 30 2a 40 c8 60 84 64 30 18 50
13 00 bb f9 10 00 00 1e 00 00 00 fd 00 32 4c 18
53 11 00 0a 20 20 20 20 20 20 00 00 00 fc 00 48
50 20 57 32 30 37 31 64 0a 20 20 20 00 00 00 ff
00 36 43 4d 33 31 34 30 38 37 51 0a 20 20 00 38

----------------

Block 0, Base EDID:
  EDID Structure Version & Revision: 1.3
  Vendor & Product Identification:
    Manufacturer: HWP
    Model: 10654
    Serial Number: ...
    Made in: week 14 of 2013
  Basic Display Parameters & Features:
    Analog display
    Signal Level Standard: 0.700 : 0.000 : 0.700 V p-p
    Blank level equals black level
    Sync: Separate
    Maximum image size: 44 cm x 25 cm
    Gamma: 2.20
    DPMS levels: Off
    RGB color display
    Default (sRGB) color space is primary color space
    First detailed timing is the preferred timing
  Color Characteristics:
    Red  : 0.6357, 0.3388
    Green: 0.3193, 0.6201
    Blue : 0.1542, 0.0478
    White: 0.3134, 0.3291
  Established Timings I & II:
    IBM     :   720x400    70.081663 Hz   9:5     31.467 kHz     28.320000 MHz
    DMT 0x04:   640x480    59.940476 Hz   4:3     31.469 kHz     25.175000 MHz
    DMT 0x09:   800x600    60.316541 Hz   4:3     37.879 kHz     40.000000 MHz
    DMT 0x10:  1024x768    60.003840 Hz   4:3     48.363 kHz     65.000000 MHz
  Standard Timings:
    DMT 0x53:  1600x900    60.000000 Hz  16:9     60.000 kHz    108.000000 MHz (RB)
    DMT 0x23:  1280x1024   60.019740 Hz   5:4     63.981 kHz    108.000000 MHz
    DMT 0x2f:  1440x900    59.887445 Hz  16:10    55.935 kHz    106.500000 MHz
    DMT 0x55:  1280x720    60.000000 Hz  16:9     45.000 kHz     74.250000 MHz
  Detailed Timing Descriptors:
    DTD 1:  1600x900    60.000000 Hz  16:9     60.000 kHz    108.000000 MHz (443 mm x 249 mm)
                 Hfront   24 Hsync  80 Hback   96 Hpol P
                 Vfront    1 Vsync   3 Vback   96 Vpol P
    Display Range Limits:
      Monitor ranges (GTF): 50-76 Hz V, 24-83 kHz H, max dotclock 170 MHz
    Display Product Name: 'HP W2071d'
    Display Product Serial Number: ...
Checksum: 0x38

----------------

Block 1, Unknown EDID Extension Block 0x00:
  00 ff ff ff ff ff ff 00 22 f0 9e 29 01 01 01 01 '........"..)....'
  0e 17 01 03 68 2c 19 78 2e ff 95 a2 56 51 9e 27 '....h,.x....VQ.''
  0c 50 54 a1 08 00 a9 c0 81 80 95 00 81 c0 01 01 '.PT.............'
  01 01 01 01 01 01 30 2a 40 c8 60 84 64 30 18 50 '......0*@.`.d0.P'
  13 00 bb f9 10 00 00 1e 00 00 00 fd 00 32 4c 18 '.............2L.'
  53 11 00 0a 20 20 20 20 20 20 00 00 00 fc 00 48 'S...      .....H'
  50 20 57 32 30 37 31 64 0a 20 20 20 00 00 00 ff 'P W2071d.   ....'
  00 36 43 4d 33 31 34 30 38 37 51 0a 20 20 00 38 '.6CM314087Q.  .8'
Checksum: 0x38

----------------

Warnings:

Block 0, Base EDID:
  Vendor & Product Identification: The serial number is one of the known dummy values, it should probably be set to 0.

Failures:

Block 0, Base EDID:
  Basic Display Parameters & Features: sRGB is signaled, but the chromaticities do not match.
Block 1, Base EDID:
  Unknown Extension Block.
EDID:
  Base EDID: EDID specified 0 extension block(s), but found 1 extension block(s).

EDID conformity: FAIL
