edid-decode (hex):

00 ff ff ff ff ff ff 00 30 e4 56 03 00 00 00 00
00 16 01 03 80 23 13 78 0a 07 35 96 59 57 8e 28
1e 50 54 00 00 00 01 01 01 01 01 01 01 01 01 01
01 01 01 01 01 01 12 1b 56 68 50 00 12 30 20 20
53 00 59 c2 10 00 00 19 00 00 00 00 00 00 00 00
00 00 00 00 00 00 00 00 00 00 00 00 00 fe 00 4c
47 20 44 69 73 70 6c 61 79 0a 20 20 00 00 00 fe
00 4c 50 31 35 36 57 48 33 2d 54 4c 44 31 00 ce

00 ff ff ff ff ff ff 00 30 e4 56 03 00 00 00 00
00 16 01 03 80 23 13 78 0a 07 35 96 59 57 8e 28
1e 50 54 00 00 00 01 01 01 01 01 01 01 01 01 01
01 01 01 01 01 01 12 1b 56 68 50 00 12 30 20 20
53 00 59 c2 10 00 00 19 00 00 00 00 00 00 00 00
00 00 00 00 00 00 00 00 00 00 00 00 00 fe 00 4c
47 20 44 69 73 70 6c 61 79 0a 20 20 00 00 00 fe
00 4c 50 31 35 36 57 48 33 2d 54 4c 44 31 00 ce

----------------

Block 0, Base EDID:
  EDID Structure Version & Revision: 1.3
  Vendor & Product Identification:
    Manufacturer: LGD
    Model: 854
    Made in: 2012
  Basic Display Parameters & Features:
    Digital display
    Maximum image size: 35 cm x 19 cm
    Gamma: 2.20
    RGB color display
    First detailed timing is the preferred timing
  Color Characteristics:
    Red  : 0.5859, 0.3476
    Green: 0.3408, 0.5576
    Blue : 0.1562, 0.1201
    White: 0.3134, 0.3291
  Established Timings I & II: none
  Standard Timings: none
  Detailed Timing Descriptors:
    DTD 1:  1366x768    59.978190 Hz 683:384   47.143 kHz     69.300000 MHz (345 mm x 194 mm)
                 Hfront   32 Hsync  32 Hback   40 Hpol N
                 Vfront    5 Vsync   3 Vback   10 Vpol N
    Empty Descriptor
    Alphanumeric Data String: 'LG Display'
    Alphanumeric Data String: 'LP156WH3-TLD1'
Checksum: 0xce

----------------

Failures:

Block 0, Base EDID:
  Empty Descriptor: Use Dummy Descriptor instead of all zeroes.
  Missing Display Product Name.
  Missing Display Range Limits Descriptor.
EDID:
  Extension Block 1 started with EDID header, ignoring Extension Blocks >= 1.

EDID conformity: FAIL
