edid-decode (hex):

00 ff ff ff ff ff ff 00 51 b8 22 14 30 34 48 44
0d 21 01 04 b5 1e 14 78 07 0f 95 ae 52 43 b0 26
0f 50 54 00 00 00 01 01 01 01 01 01 01 01 01 01
01 01 01 01 01 01 f4 f5 30 b4 c0 20 28 80 30 20
86 04 2c c8 10 00 00 18 00 00 00 fd 00 30 5a bf
bf 3f 01 0a 20 20 20 20 20 20 00 00 00 10 00 0a
20 20 20 20 20 20 20 20 20 20 20 20 00 00 00 10
00 0a 20 20 20 20 20 20 20 20 20 20 20 20 02 2e

02 03 0f 00 e3 05 80 00 e6 06 05 01 6f 6f 22 00
00 00 00 00 00 00 00 00 00 00 00 00 00 00 00 00
00 00 00 00 00 00 00 00 00 00 00 00 00 00 00 00
00 00 00 00 00 00 00 00 00 00 00 00 00 00 00 00
00 00 00 00 00 00 00 00 00 00 00 00 00 00 00 00
00 00 00 00 00 00 00 00 00 00 00 00 00 00 00 00
00 00 00 00 00 00 00 00 00 00 00 00 00 00 00 00
00 00 00 00 00 00 00 00 00 00 00 00 00 00 00 92

70 13 79 00 00 03 01 28 f3 f5 00 04 2f 0c b3 00
2f 00 1f 00 1f 08 4b 04 17 00 05 00 f3 f5 00 04
2f 0c b3 00 2f 00 1f 00 1f 08 66 07 17 00 05 00
00 00 00 00 00 00 00 00 00 00 00 00 00 00 00 00
00 00 00 00 00 00 00 00 00 00 00 00 00 00 00 00
00 00 00 00 00 00 00 00 00 00 00 00 00 00 00 00
00 00 00 00 00 00 00 00 00 00 00 00 00 00 00 00
00 00 00 00 00 00 00 00 00 00 00 00 00 00 b6 90

00 ff ff ff ff ff ff 00 51 b8 22 14 30 34 48 44
0d 21 01 04 b5 1e 14 78 07 0f 95 ae 52 43 b0 26
0f 50 54 00 00 00 01 01 01 01 01 01 01 01 01 01
01 01 01 01 01 01 f4 f5 30 b4 c0 20 28 80 30 20
86 04 2c c8 10 00 00 18 00 00 00 fd 00 30 5a bf
bf 3f 01 0a 20 20 20 20 20 20 00 00 00 10 00 0a
20 20 20 20 20 20 20 20 20 20 20 20 00 00 00 10
00 0a 20 20 20 20 20 20 20 20 20 20 20 20 02 2e

02 03 0f 00 e3 05 80 00 e6 06 05 01 6f 6f 22 00
00 00 00 00 00 00 00 00 00 00 00 00 00 00 00 00
00 00 00 00 00 00 00 00 00 00 00 00 00 00 00 00
00 00 00 00 00 00 00 00 00 00 00 00 00 00 00 00
00 00 00 00 00 00 00 00 00 00 00 00 00 00 00 00
00 00 00 00 00 00 00 00 00 00 00 00 00 00 00 00
00 00 00 00 00 00 00 00 00 00 00 00 00 00 00 00
00 00 00 00 00 00 00 00 00 00 00 00 00 00 00 92

70 13 79 00 00 03 01 28 f3 f5 00 04 2f 0c b3 00
2f 00 1f 00 1f 08 4b 04 17 00 05 00 f3 f5 00 04
2f 0c b3 00 2f 00 1f 00 1f 08 66 07 17 00 05 00
00 00 00 00 00 00 00 00 00 00 00 00 00 00 00 00
00 00 00 00 00 00 00 00 00 00 00 00 00 00 00 00
00 00 00 00 00 00 00 00 00 00 00 00 00 00 00 00
00 00 00 00 00 00 00 00 00 00 00 00 00 00 00 00
00 00 00 00 00 00 00 00 00 00 00 00 00 00 b6 90

----------------

Block 0, Base EDID:
  EDID Structure Version & Revision: 1.4
  Vendor & Product Identification:
    Manufacturer: TMX
    Model: 5154
    Serial Number: ...
    Made in: week 13 of 2023
  Basic Display Parameters & Features:
    Digital display
    Bits per primary color channel: 10
    DisplayPort interface
    Maximum image size: 30 cm x 20 cm
    Gamma: 2.20
    Supported color formats: RGB 4:4:4
    Default (sRGB) color space is primary color space
    First detailed timing includes the native pixel format and preferred refresh rate
    Display supports continuous frequencies
  Color Characteristics:
    Red  : 0.6796, 0.3203
    Green: 0.2646, 0.6904
    Blue : 0.1503, 0.0595
    White: 0.3134, 0.3291
  Established Timings I & II: none
  Standard Timings: none
  Detailed Timing Descriptors:
    DTD 1:  3120x2080   90.000000 Hz   3:2    190.800 kHz    629.640000 MHz (300 mm x 200 mm)
                 Hfront   48 Hsync  32 Hback  100 Hpol N
                 Vfront   24 Vsync   6 Vback   10 Vpol N
    Display Range Limits:
      Monitor ranges (Range Limits Only): 48-90 Hz V, 191-191 kHz H, max dotclock 630 MHz
    Dummy Descriptor:
    Dummy Descriptor:
  Extension blocks: 2
Checksum: 0x2e

----------------

Block 1, CTA-861 Extension Block:
  Revision: 3
  Native detailed modes: 0
  Colorimetry Data Block:
    BT2020RGB
  HDR Static Metadata Data Block:
    Electro optical transfer functions:
      Traditional gamma - SDR luminance range
      SMPTE ST2084
    Supported static metadata descriptors:
      Static metadata type 1
    Desired content max luminance: 111 (553.564 cd/m^2)
    Desired content max frame-average luminance: 111 (553.564 cd/m^2)
    Desired content min luminance: 34 (0.098 cd/m^2)
Checksum: 0x92  Unused space in Extension Block: 112 bytes

----------------

Block 2, DisplayID Extension Block:
  Version: 1.3
  Extension Count: 0
  Display Product Type: Extension Section
  Video Timing Modes Type 1 - Detailed Timings Data Block:
    DTD:  3120x2080   60.000000 Hz  16:9    190.800 kHz    629.640000 MHz (aspect 16:9, no 3D stereo)
               Hfront   48 Hsync  32 Hback  100 Hpol N
               Vfront   24 Vsync   6 Vback 1070 Vpol N
    DTD:  3120x2080   48.000000 Hz  16:9    190.800 kHz    629.640000 MHz (aspect 16:9, no 3D stereo)
               Hfront   48 Hsync  32 Hback  100 Hpol N
               Vfront   24 Vsync   6 Vback 1865 Vpol N
  Checksum: 0xb6
Checksum: 0x90

----------------

Block 3, Unknown EDID Extension Block 0x00:
  00 ff ff ff ff ff ff 00 51 b8 22 14 30 34 48 44 '........Q.".04HD'
  0d 21 01 04 b5 1e 14 78 07 0f 95 ae 52 43 b0 26 '.!.....x....RC.&'
  0f 50 54 00 00 00 01 01 01 01 01 01 01 01 01 01 '.PT.............'
  01 01 01 01 01 01 f4 f5 30 b4 c0 20 28 80 30 20 '........0.. (.0 '
  86 04 2c c8 10 00 00 18 00 00 00 fd 00 30 5a bf '..,..........0Z.'
  bf 3f 01 0a 20 20 20 20 20 20 00 00 00 10 00 0a '.?..      ......'
  20 20 20 20 20 20 20 20 20 20 20 20 00 00 00 10 '            ....'
  00 0a 20 20 20 20 20 20 20 20 20 20 20 20 02 2e '..            ..'
Checksum: 0x2e

----------------

Block 4, CTA-861 Extension Block:
  Revision: 3
  Native detailed modes: 0
  Colorimetry Data Block:
    BT2020RGB
  HDR Static Metadata Data Block:
    Electro optical transfer functions:
      Traditional gamma - SDR luminance range
      SMPTE ST2084
    Supported static metadata descriptors:
      Static metadata type 1
    Desired content max luminance: 111 (553.564 cd/m^2)
    Desired content max frame-average luminance: 111 (553.564 cd/m^2)
    Desired content min luminance: 34 (0.098 cd/m^2)
Checksum: 0x92  Unused space in Extension Block: 112 bytes

----------------

Block 5, DisplayID Extension Block:
  Version: 1.3
  Extension Count: 0
  Video Timing Modes Type 1 - Detailed Timings Data Block:
    DTD:  3120x2080   60.000000 Hz  16:9    190.800 kHz    629.640000 MHz (aspect 16:9, no 3D stereo)
               Hfront   48 Hsync  32 Hback  100 Hpol N
               Vfront   24 Vsync   6 Vback 1070 Vpol N
    DTD:  3120x2080   48.000000 Hz  16:9    190.800 kHz    629.640000 MHz (aspect 16:9, no 3D stereo)
               Hfront   48 Hsync  32 Hback  100 Hpol N
               Vfront   24 Vsync   6 Vback 1865 Vpol N
  Checksum: 0xb6
Checksum: 0x90

----------------

Warnings:

Block 0, Base EDID:
  Missing Display Product Name.
Block 1, CTA-861 Extension Block:
  IT Video Formats are overscanned by default, but normally this should be underscanned.
Block 4, CTA-861 Extension Block:
  IT Video Formats are overscanned by default, but normally this should be underscanned.

Failures:

Block 0, Base EDID:
  Basic Display Parameters & Features: sRGB is signaled, but the chromaticities do not match.
  Dummy Descriptor: Dummy block filled with garbage.
  Dummy Descriptor: Dummy block filled with garbage.
Block 1, CTA-861 Extension Block:
  Required 640x480p60 timings are missing in the established timings and the SVD list (VIC 1).
  Missing VCDB, needed for Set Selectable RGB Quantization to avoid interop issues.
Block 2, DisplayID Extension Block:
  DisplayID Base Block has no product type.
  Expected 0 DisplayID Extension Block, but got 1.
Block 3, Base EDID:
  Unknown Extension Block.
Block 4, CTA-861 Extension Block:
  Colorimetry Data Block: Only one instance of this Data Block is allowed.
  HDR Static Metadata Data Block: Only one instance of this Data Block is allowed.
EDID:
  Base EDID: EDID specified 2 extension block(s), but found 5 extension block(s).
  DisplayID: DisplayID expects at least one preferred timing.

EDID conformity: FAIL
