edid-decode (hex):

00 ff ff ff ff ff ff 00 09 e5 2f 09 30 30 32 57
0c 20 01 04 b5 22 17 78 02 ee 95 a3 54 4c 99 26
0f 50 54 00 00 00 01 01 01 01 01 01 01 01 01 01
01 01 01 01 01 01 0a 6c d8 a0 90 90 28 60 30 20
36 00 52 e2 10 00 00 1a 00 00 00 00 00 00 00 00
00 00 00 00 00 00 00 00 00 00 00 00 00 fe 00 42
4f 45 20 58 53 0a 20 20 20 20 20 20 00 00 00 fe
00 54 56 31 36 30 44 4b 54 2d 4e 48 30 0a 01 13

70 13 79 00 00 03 01 14 0a 6c 00 04 d7 09 9f 00
2f 00 1f 00 8f 06 27 00 02 00 05 00 00 00 00 00
00 00 00 00 00 00 00 00 00 00 00 00 00 00 00 00
00 00 00 00 00 00 00 00 00 00 00 00 00 00 00 00
00 00 00 00 00 00 00 00 00 00 00 00 00 00 00 00
00 00 00 00 00 00 00 00 00 00 00 00 00 00 00 00
00 00 00 00 00 00 00 00 00 00 00 00 00 00 00 00
00 00 00 00 00 00 00 00 00 00 00 00 00 00 52 90

00 ff ff ff ff ff ff 00 09 e5 2f 09 30 30 32 57
0c 20 01 04 b5 22 17 78 02 ee 95 a3 54 4c 99 26
0f 50 54 00 00 00 01 01 01 01 01 01 01 01 01 01
01 01 01 01 01 01 0a 6c d8 a0 90 90 28 60 30 20
36 00 52 e2 10 00 00 1a 00 00 00 00 00 00 00 00
00 00 00 00 00 00 00 00 00 00 00 00 00 fe 00 42
4f 45 20 58 53 0a 20 20 20 20 20 20 00 00 00 fe
00 54 56 31 36 30 44 4b 54 2d 4e 48 30 0a 01 13

70 13 79 00 00 03 01 14 0a 6c 00 04 d7 09 9f 00
2f 00 1f 00 8f 06 27 00 02 00 05 00 00 00 00 00
00 00 00 00 00 00 00 00 00 00 00 00 00 00 00 00
00 00 00 00 00 00 00 00 00 00 00 00 00 00 00 00
00 00 00 00 00 00 00 00 00 00 00 00 00 00 00 00
00 00 00 00 00 00 00 00 00 00 00 00 00 00 00 00
00 00 00 00 00 00 00 00 00 00 00 00 00 00 00 00
00 00 00 00 00 00 00 00 00 00 00 00 00 00 52 90

----------------

Block 0, Base EDID:
  EDID Structure Version & Revision: 1.4
  Vendor & Product Identification:
    Manufacturer: BOE
    Model: 2351
    Serial Number: ...
    Made in: week 12 of 2022
  Basic Display Parameters & Features:
    Digital display
    Bits per primary color channel: 10
    DisplayPort interface
    Maximum image size: 34 cm x 23 cm
    Gamma: 2.20
    Supported color formats: RGB 4:4:4
    First detailed timing includes the native pixel format and preferred refresh rate
  Color Characteristics:
    Red  : 0.6396, 0.3300
    Green: 0.2998, 0.5996
    Blue : 0.1503, 0.0595
    White: 0.3134, 0.3291
  Established Timings I & II: none
  Standard Timings: none
  Detailed Timing Descriptors:
    DTD 1:  2520x1680   60.000868 Hz   3:2    103.201 kHz    276.580000 MHz (338 mm x 226 mm)
                 Hfront   48 Hsync  32 Hback   80 Hpol P
                 Vfront    3 Vsync   6 Vback   31 Vpol N
    Empty Descriptor
    Alphanumeric Data String: 'BOE XS'
    Alphanumeric Data String: 'TV160DKT-NH0'
  Extension blocks: 1
Checksum: 0x13

----------------

Block 1, DisplayID Extension Block:
  Version: 1.3
  Extension Count: 0
  Display Product Type: Extension Section
  Video Timing Modes Type 1 - Detailed Timings Data Block:
    DTD:  2520x1680   60.003037 Hz  16:9    103.205 kHz    276.590000 MHz (aspect 16:9, no 3D stereo)
               Hfront   48 Hsync  32 Hback   80 Hpol N
               Vfront    3 Vsync   6 Vback   31 Vpol N
  Checksum: 0x52
Checksum: 0x90

----------------

Block 2, Unknown EDID Extension Block 0x00:
  00 ff ff ff ff ff ff 00 09 e5 2f 09 30 30 32 57 '........../.002W'
  0c 20 01 04 b5 22 17 78 02 ee 95 a3 54 4c 99 26 '. ...".x....TL.&'
  0f 50 54 00 00 00 01 01 01 01 01 01 01 01 01 01 '.PT.............'
  01 01 01 01 01 01 0a 6c d8 a0 90 90 28 60 30 20 '.......l....(`0 '
  36 00 52 e2 10 00 00 1a 00 00 00 00 00 00 00 00 '6.R.............'
  00 00 00 00 00 00 00 00 00 00 00 00 00 fe 00 42 '...............B'
  4f 45 20 58 53 0a 20 20 20 20 20 20 00 00 00 fe 'OE XS.      ....'
  00 54 56 31 36 30 44 4b 54 2d 4e 48 30 0a 01 13 '.TV160DKT-NH0...'
Checksum: 0x13

----------------

Block 3, DisplayID Extension Block:
  Version: 1.3
  Extension Count: 0
  Video Timing Modes Type 1 - Detailed Timings Data Block:
    DTD:  2520x1680   60.003037 Hz  16:9    103.205 kHz    276.590000 MHz (aspect 16:9, no 3D stereo)
               Hfront   48 Hsync  32 Hback   80 Hpol N
               Vfront    3 Vsync   6 Vback   31 Vpol N
  Checksum: 0x52
Checksum: 0x90

----------------

Warnings:

Block 0, Base EDID:
  Missing Display Product Name.

Failures:

Block 0, Base EDID:
  Empty Descriptor: Use Dummy Descriptor instead of all zeroes.
Block 1, DisplayID Extension Block:
  DisplayID Base Block has no product type.
  Expected 0 DisplayID Extension Block, but got 1.
Block 2, Base EDID:
  Unknown Extension Block.
EDID:
  Base EDID: EDID specified 1 extension block(s), but found 3 extension block(s).
  DisplayID: DisplayID expects at least one preferred timing.

EDID conformity: FAIL
