edid-decode (hex):

00 ff ff ff ff ff ff 00 4c 2d 6f e0 00 00 00 00
0e 22 01 04 b5 3c 22 78 3b 32 b5 ad 50 45 a1 25
0e 50 54 21 88 00 81 c0 81 00 81 80 95 00 a9 c0
b3 00 01 01 01 01 1a cb 00 3c f0 70 3e 80 08 20
35 00 ba 88 21 00 00 1a 00 00 00 fd 0c 30 90 45
45 8f 01 0a 20 20 20 20 20 20 00 00 00 fc 00 4f
64 79 73 73 65 79 20 47 37 30 44 0a 00 00 00 ff
00 48 31 41 4b 35 30 30 30 30 30 0a 20 20 01 3f

02 03 3a f0 47 10 10 3f 04 03 5f 76 23 09 07 07
83 01 00 00 e3 05 c3 01 74 1a 00 00 03 0f 30 90
00 00 60 08 5b 36 90 00 00 00 00 00 00 e6 06 05
01 60 5b 00 e5 01 8b 84 90 3d 56 5e 00 a0 a0 a0
29 50 30 20 35 00 ba 88 21 00 00 1a 6f c2 00 a0
a0 a0 55 50 30 20 35 00 ba 88 21 00 00 1a 04 74
80 18 71 38 2d 40 58 2c 45 00 ba 88 21 00 00 1e
00 00 00 00 00 00 00 00 00 00 00 00 00 00 00 56

00 ff ff ff ff ff ff 00 4c 2d 6f e0 00 00 00 00
0e 22 01 04 b5 3c 22 78 3b 32 b5 ad 50 45 a1 25
0e 50 54 21 88 00 81 c0 81 00 81 80 95 00 a9 c0
b3 00 01 01 01 01 1a cb 00 3c f0 70 3e 80 08 20
35 00 ba 88 21 00 00 1a 00 00 00 fd 0c 30 90 45
45 8f 01 0a 20 20 20 20 20 20 00 00 00 fc 00 4f
64 79 73 73 65 79 20 47 37 30 44 0a 00 00 00 ff
00 48 31 41 4b 35 30 30 30 30 30 0a 20 20 01 3f

02 03 3a f0 47 10 10 3f 04 03 5f 76 23 09 07 07
83 01 00 00 e3 05 c3 01 74 1a 00 00 03 0f 30 90
00 00 60 08 5b 36 90 00 00 00 00 00 00 e6 06 05
01 60 5b 00 e5 01 8b 84 90 3d 56 5e 00 a0 a0 a0
29 50 30 20 35 00 ba 88 21 00 00 1a 6f c2 00 a0
a0 a0 55 50 30 20 35 00 ba 88 21 00 00 1a 04 74
80 18 71 38 2d 40 58 2c 45 00 ba 88 21 00 00 1e
00 00 00 00 00 00 00 00 00 00 00 00 00 00 00 56

----------------

Block 0, Base EDID:
  EDID Structure Version & Revision: 1.4
  Vendor & Product Identification:
    Manufacturer: SAM
    Model: 57455
    Made in: week 14 of 2024
  Basic Display Parameters & Features:
    Digital display
    Bits per primary color channel: 10
    DisplayPort interface
    Maximum image size: 60 cm x 34 cm
    Gamma: 2.20
    DPMS levels: Off
    Supported color formats: RGB 4:4:4, YCrCb 4:4:4, YCrCb 4:2:2
    First detailed timing includes the native pixel format and preferred refresh rate
    Display supports continuous frequencies
  Color Characteristics:
    Red  : 0.6757, 0.3154
    Green: 0.2695, 0.6308
    Blue : 0.1464, 0.0576
    White: 0.3134, 0.3291
  Established Timings I & II:
    DMT 0x04:   640x480    59.940476 Hz   4:3     31.469 kHz     25.175000 MHz
    DMT 0x09:   800x600    60.316541 Hz   4:3     37.879 kHz     40.000000 MHz
    DMT 0x0a:   800x600    72.187572 Hz   4:3     48.077 kHz     50.000000 MHz
    DMT 0x10:  1024x768    60.003840 Hz   4:3     48.363 kHz     65.000000 MHz
  Standard Timings:
    DMT 0x55:  1280x720    60.000000 Hz  16:9     45.000 kHz     74.250000 MHz
    DMT 0x1c:  1280x800    59.810326 Hz  16:10    49.702 kHz     83.500000 MHz
    DMT 0x23:  1280x1024   60.019740 Hz   5:4     63.981 kHz    108.000000 MHz
    DMT 0x2f:  1440x900    59.887445 Hz  16:10    55.935 kHz    106.500000 MHz
    DMT 0x53:  1600x900    60.000000 Hz  16:9     60.000 kHz    108.000000 MHz (RB)
    DMT 0x3a:  1680x1050   59.954250 Hz  16:10    65.290 kHz    146.250000 MHz
  Detailed Timing Descriptors:
    DTD 1:  3840x2160   59.999077 Hz  16:9    133.318 kHz    519.940000 MHz (698 mm x 392 mm)
                 Hfront    8 Hsync  32 Hback   20 Hpol P
                 Vfront    3 Vsync   5 Vback   54 Vpol N
    Display Range Limits:
      Monitor ranges (Range Limits Only): 48-144 Hz V, 324-324 kHz H, max dotclock 1430 MHz
    Display Product Name: 'Odyssey G70D'
    Display Product Serial Number: ...
  Extension blocks: 1
Checksum: 0x3f

----------------

Block 1, CTA-861 Extension Block:
  Revision: 3
  Underscans IT Video Formats by default
  Basic audio support
  Supports YCbCr 4:4:4
  Supports YCbCr 4:2:2
  Native DTDs: 0
  Video Data Block:
    VIC  16:  1920x1080   60.000000 Hz  16:9     67.500 kHz    148.500000 MHz
    VIC  16:  1920x1080   60.000000 Hz  16:9     67.500 kHz    148.500000 MHz
    VIC  63:  1920x1080  120.000000 Hz  16:9    135.000 kHz    297.000000 MHz
    VIC   4:  1280x720    60.000000 Hz  16:9     45.000 kHz     74.250000 MHz
    VIC   3:   720x480    59.940060 Hz  16:9     31.469 kHz     27.000000 MHz
    VIC  95:  3840x2160   30.000000 Hz  16:9     67.500 kHz    297.000000 MHz
    VIC 118:  3840x2160  120.000000 Hz  16:9    270.000 kHz   1188.000000 MHz
  Audio Data Block:
    Linear PCM:
      Max channels: 2
      Supported sample rates (kHz): 48 44.1 32
      Supported sample sizes (bits): 24 20 16
  Speaker Allocation Data Block:
    FL/FR - Front Left/Right
  Colorimetry Data Block:
    xvYCC601
    xvYCC709
    BT2020YCC
    BT2020RGB
    Gamut Boundary Description Metadata Profile P0
  Vendor-Specific Data Block (AMD), OUI 00-00-1A:
    Version: 3
    Flags 1: 0x0f
      FreeSync Supported
      FreeSync 2 HDR Supported
      Local Dimming Supported
    Minimum Refresh Rate: 48 Hz
    Maximum Refresh Rate: 144 Hz
    Flags 5: 0x00
    Maximum luminance: 96 (400.000 cd/m^2)
    Minimum luminance: 8 (0.004 cd/m^2)
    Maximum luminance (without local dimming): 91 (358.942 cd/m^2)
    Minimum luminance (without local dimming): 54 (0.161 cd/m^2)
  HDR Static Metadata Data Block:
    Electro optical transfer functions:
      Traditional gamma - SDR luminance range
      SMPTE ST2084
    Supported static metadata descriptors:
      Static metadata type 1
    Desired content max luminance: 96 (400.000 cd/m^2)
    Desired content max frame-average luminance: 91 (358.942 cd/m^2)
    Desired content min luminance: 0 (0.000 cd/m^2)
  Vendor-Specific Video Data Block (HDR10+), OUI 90-84-8B:
    Application Version: 1
    Full Frame Peak Luminance Index: 3
    Peak Luminance Index: 3
  Detailed Timing Descriptors:
    DTD 2:  2560x1440   59.950550 Hz  16:9     88.787 kHz    241.500000 MHz (698 mm x 392 mm)
                 Hfront   48 Hsync  32 Hback   80 Hpol P
                 Vfront    3 Vsync   5 Vback   33 Vpol N
    DTD 3:  2560x1440  119.997589 Hz  16:9    182.996 kHz    497.750000 MHz (698 mm x 392 mm)
                 Hfront   48 Hsync  32 Hback   80 Hpol P
                 Vfront    3 Vsync   5 Vback   77 Vpol N
    DTD 4:  1920x1080  120.000000 Hz  16:9    135.000 kHz    297.000000 MHz (698 mm x 392 mm)
                 Hfront   88 Hsync  44 Hback  148 Hpol P
                 Vfront    4 Vsync   5 Vback   36 Vpol P
Checksum: 0x56  Unused space in Extension Block: 15 bytes

----------------

Warnings:

Block 0, Base EDID:
  Display Product Serial Number: ...
Block 1, CTA-861 Extension Block:
  Video Data Block: VIC 16 and the first DTD are not identical. Is this intended?
  Colorimetry Data Block: Set the sRGB colorimetry bit to avoid interop issues.
EDID:
  Base EDID: Some timings are out of range of the Monitor Ranges:
    Vertical Freq: 30.000 - 120.000 Hz (Monitor: 48.000 - 144.000 Hz)
    Horizontal Freq: 31.468 - 270.000 kHz (Monitor: 324.000 - 324.000 kHz)

Failures:

Block 0, Base EDID:
  Detailed Timing Descriptor #1: Mismatch of image size 698x392 mm vs display size 600x340 mm.
Block 1, CTA-861 Extension Block:
  Video Data Block: Duplicate VIC 16.
  Detailed Timing Descriptor #2: Mismatch of image size 698x392 mm vs display size 600x340 mm.
  Detailed Timing Descriptor #3: Mismatch of image size 698x392 mm vs display size 600x340 mm.
  Detailed Timing Descriptor #4: Mismatch of image size 698x392 mm vs display size 600x340 mm.
  Missing VCDB, needed for Set Selectable RGB Quantization to avoid interop issues.
EDID:
  Extension Block 2 started with EDID header, ignoring Extension Blocks >= 2.
  Base EDID: The DTD max image size is 698x392mm, which is larger than the display size 600.0x340.0mm.

EDID conformity: FAIL
