edid-decode (hex):

00 ff ff ff ff ff ff 00 48 a7 27 05 01 00 00 00
1e 1d 01 03 81 1b 0f 78 0e 5d 45 96 58 52 98 27
26 50 54 00 00 00 01 01 01 01 01 01 01 01 01 01
01 01 01 01 01 01 36 36 80 a0 70 38 20 40 2e 1e
24 00 14 9b 10 00 00 1a 00 00 00 fd 00 0f f0 0f
7f 11 00 0a 20 20 20 20 20 20 00 00 00 ff 00 4e
31 32 35 48 43 45 2d 47 4e 31 0a 0a 00 00 00 fc
00 44 75 65 78 20 50 72 6f 0a 20 20 20 20 00 94

----------------

Block 0, Base EDID:
  EDID Structure Version & Revision: 1.3
  Vendor & Product Identification:
    Manufacturer: REG
    Model: 1319
    Serial Number: ...
    Made in: week 30 of 2019
  Basic Display Parameters & Features:
    Digital display
    DFP 1.x compatible TMDS
    Maximum image size: 27 cm x 15 cm
    Gamma: 2.20
    RGB color display
    Default (sRGB) color space is primary color space
    First detailed timing is the preferred timing
  Color Characteristics:
    Red  : 0.5869, 0.3447
    Green: 0.3232, 0.5947
    Blue : 0.1533, 0.1484
    White: 0.3134, 0.3291
  Established Timings I & II: none
  Standard Timings: none
  Detailed Timing Descriptors:
    DTD 1:  1920x1080   60.001038 Hz  16:9     66.721 kHz    138.780000 MHz (276 mm x 155 mm)
                 Hfront   46 Hsync  30 Hback   84 Hpol P
                 Vfront    2 Vsync   4 Vback   26 Vpol N
    Display Range Limits:
      Monitor ranges (GTF): 15-240 Hz V, 15-127 kHz H, max dotclock 170 MHz
    Display Product Serial Number: ...
    Display Product Name: 'Duex Pro'
Checksum: 0x94

----------------

Warnings:

Block 0, Base EDID:
  Vendor & Product Identification: The serial number is one of the known dummy values, it should probably be set to 0.

Failures:

Block 0, Base EDID:
  Display Product Serial Number: ...
  Basic Display Parameters & Features: sRGB is signaled, but the chromaticities do not match.

EDID conformity: FAIL
