edid-decode (hex):

00 ff ff ff ff ff ff 00 06 af 51 23 00 00 00 00
01 0e 01 03 80 1e 17 78 0a 87 f5 94 57 4f 8c 27
27 50 54 00 00 00 01 01 01 01 01 01 01 01 01 01
01 01 01 01 01 01 64 19 00 40 41 00 26 30 18 88
36 00 30 e4 10 00 00 18 00 00 00 00 00 00 00 00
00 00 00 00 00 00 00 00 00 00 00 00 00 fe 00 4a
46 33 38 33 00 42 31 35 30 58 47 32 00 00 00 fe
00 e7 d4 c4 bc 98 70 4c 00 01 01 0a 20 20 00 3b

----------------

Block 0, Base EDID:
  EDID Structure Version & Revision: 1.3
  Vendor & Product Identification:
    Manufacturer: AUO
    Model: 9041
    Made in: week 1 of 2004
  Basic Display Parameters & Features:
    Digital display
    Maximum image size: 30 cm x 23 cm
    Gamma: 2.20
    RGB color display
    First detailed timing is the preferred timing
  Color Characteristics:
    Red  : 0.5800, 0.3398
    Green: 0.3095, 0.5498
    Blue : 0.1552, 0.1552
    White: 0.3134, 0.3291
  Established Timings I & II: none
  Standard Timings: none
  Detailed Timing Descriptors:
    DTD 1:  1024x768    60.003840 Hz   4:3     48.363 kHz     65.000000 MHz (304 mm x 228 mm)
                 Hfront   24 Hsync 136 Hback  160 Hpol N
                 Vfront    3 Vsync   6 Vback   29 Vpol N
    Empty Descriptor
    Alphanumeric Data String: 'JF383'
    Alphanumeric Data String: '.....pL'
Checksum: 0x3b

----------------

Warnings:

Block 0, Base EDID:
  Alphanumeric Data String: Non-ASCII character 0xe7 at position 0, can cause problems.
  Alphanumeric Data String: Non-ASCII character 0xd4 at position 1, can cause problems.
  Alphanumeric Data String: Non-ASCII character 0xc4 at position 2, can cause problems.
  Alphanumeric Data String: Non-ASCII character 0xbc at position 3, can cause problems.
  Alphanumeric Data String: Non-ASCII character 0x98 at position 4, can cause problems.

Failures:

Block 0, Base EDID:
  Empty Descriptor: Use Dummy Descriptor instead of all zeroes.
  Alphanumeric Data String: NUL byte at position 5.
  Alphanumeric Data String: NUL byte at position 7.
  Missing Display Product Name.
  Missing Display Range Limits Descriptor.

EDID conformity: FAIL
