edid-decode (hex):

00 ff ff ff ff ff ff 00 19 04 00 55 01 00 00 00
20 16 01 03 81 30 1e 78 ae 93 45 a3 55 4a 98 27
15 50 54 bf ce 00 01 01 01 01 01 01 01 01 01 01
01 01 01 01 01 01 02 3a 80 18 71 38 2d 40 2c 58
54 00 81 91 21 00 00 1a 00 00 00 fa 00 32 4c 1e
50 12 00 0a 20 20 20 20 20 20 00 00 00 10 00 b0
23 40 30 20 26 00 9a 00 11 00 00 1a 00 00 00 fc
00 46 48 44 20 44 49 53 50 4c 41 59 0a 0a 01 ed

02 03 1e 71 4a 85 04 03 93 14 07 12 16 10 1f 23
09 07 07 83 01 00 00 66 03 0c 00 10 00 00 8c 0a
d0 30 00 e0 2d 10 10 3e 96 00 c4 8e 21 00 00 18
01 1d 00 bc 52 d0 1e 20 b8 28 55 40 c4 8e 21 00
00 1e 01 1d 80 d0 72 1c 16 20 10 2c 25 80 c4 8e
21 00 00 9e 8c 0a d0 90 20 40 31 20 0c 40 55 00
c4 8e 21 00 00 18 01 1d 80 18 71 1c 16 20 58 2c
25 00 c4 8e 21 00 00 9e 00 00 00 00 00 00 00 c2

00 ff ff ff ff ff ff 00 19 04 00 55 01 00 00 00
20 16 01 03 81 30 1e 78 ae 93 45 a3 55 4a 98 27
15 50 54 bf ce 00 01 01 01 01 01 01 01 01 01 01
01 01 01 01 01 01 02 3a 80 18 71 38 2d 40 2c 58
54 00 81 91 21 00 00 1a 00 00 00 fa 00 32 4c 1e
50 12 00 0a 20 20 20 20 20 20 00 00 00 10 00 b0
23 40 30 20 26 00 9a 00 11 00 00 1a 00 00 00 fc
00 46 48 44 20 44 49 53 50 4c 41 59 0a 0a 01 ed

02 03 1e 71 4a 85 04 03 93 14 07 12 16 10 1f 23
09 07 07 83 01 00 00 66 03 0c 00 10 00 00 8c 0a
d0 30 00 e0 2d 10 10 3e 96 00 c4 8e 21 00 00 18
01 1d 00 bc 52 d0 1e 20 b8 28 55 40 c4 8e 21 00
00 1e 01 1d 80 d0 72 1c 16 20 10 2c 25 80 c4 8e
21 00 00 9e 8c 0a d0 90 20 40 31 20 0c 40 55 00
c4 8e 21 00 00 18 01 1d 80 18 71 1c 16 20 58 2c
25 00 c4 8e 21 00 00 9e 00 00 00 00 00 00 00 c2

----------------

Block 0, Base EDID:
  EDID Structure Version & Revision: 1.3
  Vendor & Product Identification:
    Manufacturer: FHD
    Model: 21760
    Serial Number: ...
    Made in: week 32 of 2012
  Basic Display Parameters & Features:
    Digital display
    DFP 1.x compatible TMDS
    Maximum image size: 48 cm x 30 cm
    Gamma: 2.20
    DPMS levels: Standby Off
    RGB color display
    Default (sRGB) color space is primary color space
    First detailed timing is the preferred timing
  Color Characteristics:
    Red  : 0.6386, 0.3330
    Green: 0.2890, 0.5966
    Blue : 0.1533, 0.0820
    White: 0.3134, 0.3291
  Established Timings I & II:
    IBM     :   720x400    70.081663 Hz   9:5     31.467 kHz     28.320000 MHz
    DMT 0x04:   640x480    59.940476 Hz   4:3     31.469 kHz     25.175000 MHz
    Apple   :   640x480    66.666667 Hz   4:3     35.000 kHz     30.240000 MHz
    DMT 0x05:   640x480    72.808802 Hz   4:3     37.861 kHz     31.500000 MHz
    DMT 0x06:   640x480    75.000000 Hz   4:3     37.500 kHz     31.500000 MHz
    DMT 0x08:   800x600    56.250000 Hz   4:3     35.156 kHz     36.000000 MHz
    DMT 0x09:   800x600    60.316541 Hz   4:3     37.879 kHz     40.000000 MHz
    DMT 0x0a:   800x600    72.187572 Hz   4:3     48.077 kHz     50.000000 MHz
    DMT 0x0b:   800x600    75.000000 Hz   4:3     46.875 kHz     49.500000 MHz
    DMT 0x10:  1024x768    60.003840 Hz   4:3     48.363 kHz     65.000000 MHz
    DMT 0x11:  1024x768    70.069359 Hz   4:3     56.476 kHz     75.000000 MHz
    DMT 0x12:  1024x768    75.028582 Hz   4:3     60.023 kHz     78.750000 MHz
  Standard Timings: none
  Detailed Timing Descriptors:
    DTD  1:  1920x1080   60.000000 Hz  16:9     67.500 kHz    148.500000 MHz (641 mm x 401 mm)
                  Hfront   44 Hsync  88 Hback  148 Hpol P
                  Vfront    5 Vsync   4 Vback   36 Vpol N
    Standard Timing Identifications:
      GTF     :   648x486    71.999291 Hz   4:3     36.504 kHz     30.079000 MHz
      GTF     :   488x366    76.000870 Hz   4:3     29.108 kHz     17.465000 MHz
      GTF     :   392x245    60.003579 Hz  16:10    15.241 kHz      6.706000 MHz
      GTF     :   328x205    92.001317 Hz  16:10    19.964 kHz      7.826000 MHz
      GTF     :   504x315    92.000228 Hz  16:10    30.636 kHz     19.362000 MHz
      GTF     :   504x315    92.000228 Hz  16:10    30.636 kHz     19.362000 MHz
    Dummy Descriptor:
    Display Product Name: 'FHD DISPLAY'
  Extension blocks: 1
Checksum: 0xed

----------------

Block 1, CTA-861 Extension Block:
  Revision: 3
  Basic audio support
  Supports YCbCr 4:4:4
  Supports YCbCr 4:2:2
  Native detailed modes: 1
  Video Data Block:
    VIC   5:  1920x1080i  60.000000 Hz  16:9     33.750 kHz     74.250000 MHz (native)
    VIC   4:  1280x720    60.000000 Hz  16:9     45.000 kHz     74.250000 MHz
    VIC   3:   720x480    59.940060 Hz  16:9     31.469 kHz     27.000000 MHz
    VIC  19:  1280x720    50.000000 Hz  16:9     37.500 kHz     74.250000 MHz (native)
    VIC  20:  1920x1080i  50.000000 Hz  16:9     28.125 kHz     74.250000 MHz
    VIC   7:  1440x480i   59.940060 Hz  16:9     15.734 kHz     27.000000 MHz
    VIC  18:   720x576    50.000000 Hz  16:9     31.250 kHz     27.000000 MHz
    VIC  22:  1440x576i   50.000000 Hz  16:9     15.625 kHz     27.000000 MHz
    VIC  16:  1920x1080   60.000000 Hz  16:9     67.500 kHz    148.500000 MHz
    VIC  31:  1920x1080   50.000000 Hz  16:9     56.250 kHz    148.500000 MHz
  Audio Data Block:
    Linear PCM:
      Max channels: 2
      Supported sample rates (kHz): 48 44.1 32
      Supported sample sizes (bits): 24 20 16
  Speaker Allocation Data Block:
    FL/FR - Front Left/Right
  Vendor-Specific Data Block (HDMI), OUI 00-0C-03:
    Source physical address: 1.0.0.0
  Detailed Timing Descriptors:
    DTD  2:   208x480   200.892857 Hz  13:30   105.469 kHz     27.000000 MHz (708 mm x 398 mm)
                  Hfront   16 Hsync  62 Hback  -30 Hpol N
                  Vfront    9 Vsync   6 Vback   30 Vpol N
    DTD  3:  1280x720    50.000000 Hz  16:9     37.500 kHz     74.250000 MHz (708 mm x 398 mm)
                  Hfront  440 Hsync  40 Hback  220 Hpol P
                  Vfront    5 Vsync   5 Vback   20 Vpol P
    DTD  4:  1920x1080i  50.000000 Hz  16:9     28.125 kHz     74.250000 MHz (708 mm x 398 mm)
                  Hfront  528 Hsync  44 Hback  148 Hpol P
                  Vfront    2 Vsync   5 Vback   15 Vpol P Vfront +0.5 Odd Field
                  Vfront    2 Vsync   5 Vback   15 Vpol P Vback  +0.5 Even Field
    DTD  5:   720x576    50.000000 Hz   5:4     31.250 kHz     27.000000 MHz (708 mm x 398 mm)
                  Hfront   12 Hsync  64 Hback   68 Hpol N
                  Vfront    5 Vsync   5 Vback   39 Vpol N
    DTD  6:  1920x1080i  60.000000 Hz  16:9     33.750 kHz     74.250000 MHz (708 mm x 398 mm)
                  Hfront   88 Hsync  44 Hback  148 Hpol P
                  Vfront    2 Vsync   5 Vback   15 Vpol P Vfront +0.5 Odd Field
                  Vfront    2 Vsync   5 Vback   15 Vpol P Vback  +0.5 Even Field
Checksum: 0xc2  Unused space in Extension Block: 7 bytes

----------------

Block 2, Unknown EDID Extension Block 0x00:
  00 ff ff ff ff ff ff 00 19 04 00 55 01 00 00 00 '...........U....'
  20 16 01 03 81 30 1e 78 ae 93 45 a3 55 4a 98 27 ' ....0.x..E.UJ.''
  15 50 54 bf ce 00 01 01 01 01 01 01 01 01 01 01 '.PT.............'
  01 01 01 01 01 01 02 3a 80 18 71 38 2d 40 2c 58 '.......:..q8-@,X'
  54 00 81 91 21 00 00 1a 00 00 00 fa 00 32 4c 1e 'T...!........2L.'
  50 12 00 0a 20 20 20 20 20 20 00 00 00 10 00 b0 'P...      ......'
  23 40 30 20 26 00 9a 00 11 00 00 1a 00 00 00 fc '#@0 &...........'
  00 46 48 44 20 44 49 53 50 4c 41 59 0a 0a 01 ed '.FHD DISPLAY....'
Checksum: 0xed

----------------

Block 3, CTA-861 Extension Block:
  Revision: 3
  Basic audio support
  Supports YCbCr 4:4:4
  Supports YCbCr 4:2:2
  Native detailed modes: 1
  Video Data Block:
    VIC   5:  1920x1080i  60.000000 Hz  16:9     33.750 kHz     74.250000 MHz (native)
    VIC   4:  1280x720    60.000000 Hz  16:9     45.000 kHz     74.250000 MHz
    VIC   3:   720x480    59.940060 Hz  16:9     31.469 kHz     27.000000 MHz
    VIC  19:  1280x720    50.000000 Hz  16:9     37.500 kHz     74.250000 MHz (native)
    VIC  20:  1920x1080i  50.000000 Hz  16:9     28.125 kHz     74.250000 MHz
    VIC   7:  1440x480i   59.940060 Hz  16:9     15.734 kHz     27.000000 MHz
    VIC  18:   720x576    50.000000 Hz  16:9     31.250 kHz     27.000000 MHz
    VIC  22:  1440x576i   50.000000 Hz  16:9     15.625 kHz     27.000000 MHz
    VIC  16:  1920x1080   60.000000 Hz  16:9     67.500 kHz    148.500000 MHz
    VIC  31:  1920x1080   50.000000 Hz  16:9     56.250 kHz    148.500000 MHz
  Audio Data Block:
    Linear PCM:
      Max channels: 2
      Supported sample rates (kHz): 48 44.1 32
      Supported sample sizes (bits): 24 20 16
  Speaker Allocation Data Block:
    FL/FR - Front Left/Right
  Vendor-Specific Data Block (HDMI), OUI 00-0C-03:
    Source physical address: 1.0.0.0
  Detailed Timing Descriptors:
    DTD  7:   208x480   200.892857 Hz  13:30   105.469 kHz     27.000000 MHz (708 mm x 398 mm)
                  Hfront   16 Hsync  62 Hback  -30 Hpol N
                  Vfront    9 Vsync   6 Vback   30 Vpol N
    DTD  8:  1280x720    50.000000 Hz  16:9     37.500 kHz     74.250000 MHz (708 mm x 398 mm)
                  Hfront  440 Hsync  40 Hback  220 Hpol P
                  Vfront    5 Vsync   5 Vback   20 Vpol P
    DTD  9:  1920x1080i  50.000000 Hz  16:9     28.125 kHz     74.250000 MHz (708 mm x 398 mm)
                  Hfront  528 Hsync  44 Hback  148 Hpol P
                  Vfront    2 Vsync   5 Vback   15 Vpol P Vfront +0.5 Odd Field
                  Vfront    2 Vsync   5 Vback   15 Vpol P Vback  +0.5 Even Field
    DTD 10:   720x576    50.000000 Hz   5:4     31.250 kHz     27.000000 MHz (708 mm x 398 mm)
                  Hfront   12 Hsync  64 Hback   68 Hpol N
                  Vfront    5 Vsync   5 Vback   39 Vpol N
    DTD 11:  1920x1080i  60.000000 Hz  16:9     33.750 kHz     74.250000 MHz (708 mm x 398 mm)
                  Hfront   88 Hsync  44 Hback  148 Hpol P
                  Vfront    2 Vsync   5 Vback   15 Vpol P Vfront +0.5 Odd Field
                  Vfront    2 Vsync   5 Vback   15 Vpol P Vback  +0.5 Even Field
Checksum: 0xc2  Unused space in Extension Block: 7 bytes

----------------

Warnings:

Block 0, Base EDID:
  Vendor & Product Identification: The serial number is one of the known dummy values, it should probably be set to 0.
  Detailed Timing Descriptor #1: DTD is similar but not identical to VIC 16.
  Detailed Timing Descriptor #1: Image size is 641x401 mm, but based on the picture AR it should be 641x360 mm.
  Standard Timing Identifications: Standard Timing 392x245 has a dubious odd vertical resolution.
  Standard Timing Identifications: Standard Timing 328x205 has a dubious odd vertical resolution.
  Standard Timing Identifications: Standard Timing 504x315 has a dubious odd vertical resolution.
  Standard Timing Identifications: Standard Timing 504x315 has a dubious odd vertical resolution.
Block 1, CTA-861 Extension Block:
  IT Video Formats are overscanned by default, but normally this should be underscanned.
  Video Data Block: VIC 5 and the first DTD are not identical. Is this intended?
  Detailed Timing Descriptor #2: Image size is 708x398 mm, but based on the picture AR it should be 708x1633 mm.
  Detailed Timing Descriptor #5: Image size is 708x398 mm, but based on the picture AR it should be 708x566 mm.
Block 3, CTA-861 Extension Block:
  IT Video Formats are overscanned by default, but normally this should be underscanned.
  Detailed Timing Descriptor #7: Image size is 708x398 mm, but based on the picture AR it should be 708x1633 mm.
  Detailed Timing Descriptor #10: Image size is 708x398 mm, but based on the picture AR it should be 708x566 mm.
EDID:
  CTA-861: Multiple native interlaced timings are defined.

Failures:

Block 0, Base EDID:
  Basic Display Parameters & Features: sRGB is signaled, but the chromaticities do not match.
  Detailed Timing Descriptor #1: Mismatch of image size 641x401 mm vs display size 480x300 mm.
  Standard Timing Identifications: 0 or negative horizontal front porch.
  Standard Timing Identifications: 0 values in the video timing:
    Horizontal Active/Blanking 328/64
    Horizontal Frontporch/Sync Width 0/32
    Vertical Active/Blanking 205/12
    Vertical Frontporch/Sync Width 1/3
  Standard Timing Identifications: 0 or negative horizontal front porch.
  Dummy Descriptor: Dummy block filled with garbage.
  Display Product Name: Non-space after newline.
  Missing Display Range Limits Descriptor.
Block 1, CTA-861 Extension Block:
  Detailed Timing Descriptor #2: 0 or negative horizontal back porch.
  Detailed Timing Descriptor #2: Mismatch of image size 708x398 mm vs display size 480x300 mm.
  Detailed Timing Descriptor #3: Mismatch of image size 708x398 mm vs display size 480x300 mm.
  Detailed Timing Descriptor #4: Mismatch of image size 708x398 mm vs display size 480x300 mm.
  Detailed Timing Descriptor #5: Mismatch of image size 708x398 mm vs display size 480x300 mm.
  Detailed Timing Descriptor #6: Mismatch of image size 708x398 mm vs display size 480x300 mm.
  Missing VCDB, needed for Set Selectable RGB Quantization to avoid interop issues.
Block 2, Base EDID:
  Unknown Extension Block.
Block 3, CTA-861 Extension Block:
  Video Data Block: Duplicate VIC 5.
  Video Data Block: Duplicate VIC 4.
  Video Data Block: Duplicate VIC 3.
  Video Data Block: Duplicate VIC 19.
  Video Data Block: Duplicate VIC 20.
  Video Data Block: Duplicate VIC 7.
  Video Data Block: Duplicate VIC 18.
  Video Data Block: Duplicate VIC 22.
  Video Data Block: Duplicate VIC 16.
  Video Data Block: Duplicate VIC 31.
  Speaker Allocation Data Block: Only one instance of this Data Block is allowed.
  Detailed Timing Descriptor #7: 0 or negative horizontal back porch.
  Detailed Timing Descriptor #7: Mismatch of image size 708x398 mm vs display size 480x300 mm.
  Detailed Timing Descriptor #8: Mismatch of image size 708x398 mm vs display size 480x300 mm.
  Detailed Timing Descriptor #9: Mismatch of image size 708x398 mm vs display size 480x300 mm.
  Detailed Timing Descriptor #10: Mismatch of image size 708x398 mm vs display size 480x300 mm.
  Detailed Timing Descriptor #11: Mismatch of image size 708x398 mm vs display size 480x300 mm.
EDID:
  Base EDID: The DTD max image size is 708x401mm, which is larger than the display size 480.0x300.0mm.
  Base EDID: EDID specified 1 extension block(s), but found 3 extension block(s).
  Base EDID: EDID 1.3 requires a Block Map Extension in Block 1 if there are more than 2 blocks in the EDID.
  CTA-861: Native progressive timings are a mix of several resolutions.

EDID conformity: FAIL
