edid-decode (hex):

00 ff ff ff ff ff ff 00 5c 73 32 a0 01 01 01 01
14 22 01 04 b5 22 16 78 3f ee 91 a3 54 4c 99 26
0f 50 54 21 08 00 d1 3c d1 28 d1 00 d1 fc d1 e8
d1 c0 81 fc 81 e8 63 ff 00 c8 a0 40 2d 60 30 20
36 00 59 d7 10 00 00 1a 00 00 00 fc 00 41 51 31
36 54 48 0a 20 20 20 20 20 20 d4 dc 00 a0 a0 40
84 60 30 20 36 00 59 d7 10 00 00 1a 00 00 00 fd
00 3c 90 90 90 44 01 0a 20 20 20 20 20 20 02 91

02 03 1e f2 43 04 40 1c e2 00 c0 23 09 7f 07 83
01 00 00 e3 05 c0 00 e6 06 05 01 69 69 4f 06 b8
00 a0 a0 40 84 60 30 20 36 00 59 d7 10 00 00 1a
6a 6e 00 a0 a0 40 84 60 30 20 36 00 59 d7 10 00
00 1a 6a 5e 00 a0 a0 a0 29 50 30 20 35 00 59 d7
10 00 00 1a 38 61 00 a0 a0 a0 55 50 30 20 35 00
59 d7 10 00 00 1a 38 8b 80 18 71 38 2d 40 30 20
45 00 59 d7 10 00 00 1a 00 00 00 00 00 00 00 3a

02 03 16 f2 64 00 00 00 00 00 00 00 00 00 00 00
00 00 00 00 00 ff 04 74 80 18 71 38 2d 40 30 20
45 00 59 d7 10 00 00 1a 5b 9d 00 a0 a0 a0 29 50
30 20 35 00 59 d7 10 00 00 1a d4 bc 00 a0 a0 a0
29 50 30 20 35 00 59 d7 10 00 00 1a 98 e2 00 a0
a0 a0 29 50 30 20 35 00 59 d7 10 00 00 1a 5b 99
80 c8 70 b0 56 40 30 20 36 00 59 d7 10 00 00 1a
00 00 00 00 00 00 00 00 00 00 00 00 00 00 00 ff

00 ff ff ff ff ff ff 00 5c 73 32 a0 01 01 01 01
14 22 01 04 b5 22 16 78 3f ee 91 a3 54 4c 99 26
0f 50 54 21 08 00 d1 3c d1 28 d1 00 d1 fc d1 e8
d1 c0 81 fc 81 e8 63 ff 00 c8 a0 40 2d 60 30 20
36 00 59 d7 10 00 00 1a 00 00 00 fc 00 41 51 31
36 54 48 0a 20 20 20 20 20 20 d4 dc 00 a0 a0 40
84 60 30 20 36 00 59 d7 10 00 00 1a 00 00 00 fd
00 3c 90 90 90 44 01 0a 20 20 20 20 20 20 02 91

02 03 1e f2 43 04 40 1c e2 00 c0 23 09 7f 07 83
01 00 00 e3 05 c0 00 e6 06 05 01 69 69 4f 06 b8
00 a0 a0 40 84 60 30 20 36 00 59 d7 10 00 00 1a
6a 6e 00 a0 a0 40 84 60 30 20 36 00 59 d7 10 00
00 1a 6a 5e 00 a0 a0 a0 29 50 30 20 35 00 59 d7
10 00 00 1a 38 61 00 a0 a0 a0 55 50 30 20 35 00
59 d7 10 00 00 1a 38 8b 80 18 71 38 2d 40 30 20
45 00 59 d7 10 00 00 1a 00 00 00 00 00 00 00 3a

02 03 16 f2 64 00 00 00 00 00 00 00 00 00 00 00
00 00 00 00 00 ff 04 74 80 18 71 38 2d 40 30 20
45 00 59 d7 10 00 00 1a 5b 9d 00 a0 a0 a0 29 50
30 20 35 00 59 d7 10 00 00 1a d4 bc 00 a0 a0 a0
29 50 30 20 35 00 59 d7 10 00 00 1a 98 e2 00 a0
a0 a0 29 50 30 20 35 00 59 d7 10 00 00 1a 5b 99
80 c8 70 b0 56 40 30 20 36 00 59 d7 10 00 00 1a
00 00 00 00 00 00 00 00 00 00 00 00 00 00 00 ff

----------------

Block 0, Base EDID:
  EDID Structure Version & Revision: 1.4
  Vendor & Product Identification:
    Manufacturer: WCS
    Model: 41010
    Serial Number: ...
    Made in: week 20 of 2024
  Basic Display Parameters & Features:
    Digital display
    Bits per primary color channel: 10
    DisplayPort interface
    Maximum image size: 34 cm x 22 cm
    Gamma: 2.20
    DPMS levels: Off
    Supported color formats: RGB 4:4:4, YCrCb 4:4:4, YCrCb 4:2:2
    Default (sRGB) color space is primary color space
    First detailed timing includes the native pixel format and preferred refresh rate
    Display supports continuous frequencies
  Color Characteristics:
    Red  : 0.6396, 0.3300
    Green: 0.2998, 0.5996
    Blue : 0.1503, 0.0595
    White: 0.3125, 0.3291
  Established Timings I & II:
    DMT 0x04:   640x480    59.940476 Hz   4:3     31.469 kHz     25.175000 MHz
    DMT 0x09:   800x600    60.316541 Hz   4:3     37.879 kHz     40.000000 MHz
    DMT 0x10:  1024x768    60.003840 Hz   4:3     48.363 kHz     65.000000 MHz
  Standard Timings:
    GTF     :  1920x1200  119.999988 Hz  16:10   154.320 kHz    412.343000 MHz
    GTF     :  1920x1200  100.000118 Hz  16:10   127.100 kHz    337.578000 MHz
    DMT 0x45:  1920x1200   59.884600 Hz  16:10    74.556 kHz    193.250000 MHz
    GTF     :  1920x1080  119.999987 Hz  16:9    138.840 kHz    368.759000 MHz
    GTF     :  1920x1080  100.000000 Hz  16:9    114.400 kHz    302.016000 MHz
    DMT 0x52:  1920x1080   60.000000 Hz  16:9     67.500 kHz    148.500000 MHz
    GTF     :  1280x720   119.999881 Hz  16:9     92.640 kHz    161.564000 MHz
    GTF     :  1280x720    99.999697 Hz  16:9     76.300 kHz    131.846000 MHz
  Detailed Timing Descriptors:
    DTD  1:  2560x1600  144.000264 Hz  16:10   236.880 kHz    653.790000 MHz (345 mm x 215 mm)
                  Hfront   48 Hsync  32 Hback  120 Hpol P
                  Vfront    3 Vsync   6 Vback   36 Vpol N
    Display Product Name: 'AQ16TH'
    DTD  2:  2560x1600  119.998981 Hz  16:10   207.838 kHz    565.320000 MHz (345 mm x 215 mm)
                  Hfront   48 Hsync  32 Hback   80 Hpol P
                  Vfront    3 Vsync   6 Vback  123 Vpol N
    Display Range Limits:
      Monitor ranges (Range Limits Only): 60-144 Hz V, 144-144 kHz H, max dotclock 680 MHz
  Extension blocks: 2
Checksum: 0x91

----------------

Block 1, CTA-861 Extension Block:
  Revision: 3
  Underscans IT Video Formats by default
  Basic audio support
  Supports YCbCr 4:4:4
  Supports YCbCr 4:2:2
  Native DTDs: 2
  Video Data Block:
    VIC   4:  1280x720    60.000000 Hz  16:9     45.000 kHz     74.250000 MHz
    VIC  64:  1920x1080  100.000000 Hz  16:9    112.500 kHz    297.000000 MHz
    VIC  28:  2880x288    50.080128 Hz  16:9     15.625 kHz     54.000000 MHz
  Video Capability Data Block:
    YCbCr quantization: Selectable (via AVI YQ)
    RGB quantization: Selectable (via AVI Q)
    PT scan behavior: No Data
    IT scan behavior: IT video formats not supported
    CE scan behavior: CE video formats not supported
  Audio Data Block:
    Linear PCM:
      Max channels: 2
      Supported sample rates (kHz): 192 176.4 96 88.2 48 44.1 32
      Supported sample sizes (bits): 24 20 16
  Speaker Allocation Data Block:
    FL/FR - Front Left/Right
  Colorimetry Data Block:
    BT2020YCC
    BT2020RGB
  HDR Static Metadata Data Block:
    Electro optical transfer functions:
      Traditional gamma - SDR luminance range
      SMPTE ST2084
    Supported static metadata descriptors:
      Static metadata type 1
    Desired content max luminance: 105 (486.099 cd/m^2)
    Desired content max frame-average luminance: 105 (486.099 cd/m^2)
    Desired content min luminance: 79 (0.467 cd/m^2)
  Detailed Timing Descriptors:
    DTD  3:  2560x1600   99.999151 Hz  16:10   173.199 kHz    471.100000 MHz (345 mm x 215 mm)
                  Hfront   48 Hsync  32 Hback   80 Hpol P
                  Vfront    3 Vsync   6 Vback  123 Vpol N
    DTD  4:  2560x1600   59.999491 Hz  16:10   103.919 kHz    282.660000 MHz (345 mm x 215 mm)
                  Hfront   48 Hsync  32 Hback   80 Hpol P
                  Vfront    3 Vsync   6 Vback  123 Vpol N
    DTD  5:  2560x1440   60.000199 Hz  16:9     88.860 kHz    241.700000 MHz (345 mm x 215 mm)
                  Hfront   48 Hsync  32 Hback   80 Hpol P
                  Vfront    3 Vsync   5 Vback   33 Vpol N
    DTD  6:  2560x1440   60.000000 Hz  16:9     91.500 kHz    248.880000 MHz (345 mm x 215 mm)
                  Hfront   48 Hsync  32 Hback   80 Hpol P
                  Vfront    3 Vsync   5 Vback   77 Vpol N
    DTD  7:  1920x1080  144.000000 Hz  16:9    162.000 kHz    356.400000 MHz (345 mm x 215 mm)
                  Hfront   48 Hsync  32 Hback  200 Hpol P
                  Vfront    4 Vsync   5 Vback   36 Vpol N
Checksum: 0x3a  Unused space in Extension Block: 7 bytes

----------------

Block 2, CTA-861 Extension Block:
  Revision: 3
  Underscans IT Video Formats by default
  Basic audio support
  Supports YCbCr 4:4:4
  Supports YCbCr 4:2:2
  Native DTDs: 2
  Vendor-Specific Data Block, OUI 00-00-00:
    00                                              '.'
  Unknown CTA-861 Data Block (tag 0x00, length 0):
  Unknown CTA-861 Data Block (tag 0x00, length 0):
  Unknown CTA-861 Data Block (tag 0x00, length 0):
  Unknown CTA-861 Data Block (tag 0x00, length 0):
  Unknown CTA-861 Data Block (tag 0x00, length 0):
  Unknown CTA-861 Data Block (tag 0x00, length 0):
  Unknown CTA-861 Data Block (tag 0x00, length 0):
  Unknown CTA-861 Data Block (tag 0x00, length 0):
  Unknown CTA-861 Data Block (tag 0x00, length 0):
  Unknown CTA-861 Data Block (tag 0x00, length 0):
  Unknown CTA-861 Data Block (tag 0x00, length 0):
  Unknown CTA-861 Data Block (tag 0x00, length 0):
  Reserved for HDMI Video Data Block:
    74 80 18 71 38 2d 40 30 20 45 00 59 d7 10 00 00 't..q8-@0 E.Y....'
    1a 5b 9d 00 a0 a0 a0 29 50 30 20 35 00 59       '.[.....)P0 5.Y'
  Detailed Timing Descriptors:
    DTD  8:  1920x1080  120.000000 Hz  16:9    135.000 kHz    297.000000 MHz (345 mm x 215 mm)
                  Hfront   48 Hsync  32 Hback  200 Hpol P
                  Vfront    4 Vsync   5 Vback   36 Vpol N
    DTD  9:  2560x1440   99.999504 Hz  16:9    148.099 kHz    402.830000 MHz (345 mm x 215 mm)
                  Hfront   48 Hsync  32 Hback   80 Hpol P
                  Vfront    3 Vsync   5 Vback   33 Vpol N
    DTD 10:  2560x1440  120.000397 Hz  16:9    177.721 kHz    483.400000 MHz (345 mm x 215 mm)
                  Hfront   48 Hsync  32 Hback   80 Hpol P
                  Vfront    3 Vsync   5 Vback   33 Vpol N
    DTD 11:  2560x1440  144.000477 Hz  16:9    213.265 kHz    580.080000 MHz (345 mm x 215 mm)
                  Hfront   48 Hsync  32 Hback   80 Hpol P
                  Vfront    3 Vsync   5 Vback   33 Vpol N
    DTD 12:  1920x1200  143.999971 Hz  16:10   185.184 kHz    392.590000 MHz (345 mm x 215 mm)
                  Hfront   48 Hsync  32 Hback  120 Hpol P
                  Vfront    3 Vsync   6 Vback   77 Vpol N
Checksum: 0xff  Unused space in Extension Block: 15 bytes

----------------

Warnings:

Block 0, Base EDID:
  Vendor & Product Identification: The serial number is one of the known dummy values, it should probably be set to 0.
Block 1, CTA-861 Extension Block:
  Video Data Block: VIC 4 and the first DTD are not identical. Is this intended?
  Video Capability Data Block: IT scan behavior is expected to support underscanned.
  Video Capability Data Block: 'CE video formats not supported' makes no sense.
  Detailed Timing Descriptor #5: Image size is 345x215 mm, but based on the picture AR it should be 345x194 mm.
  Detailed Timing Descriptor #6: Image size is 345x215 mm, but based on the picture AR it should be 345x194 mm.
  Detailed Timing Descriptor #7: Image size is 345x215 mm, but based on the picture AR it should be 345x194 mm.
Block 2, CTA-861 Extension Block:
  Vendor-Specific Data Block, OUI 00-00-00: All zeroes OUI.
  Unknown CTA-861 Data Block (tag 0x00, length 0).
  Unknown CTA-861 Data Block (tag 0x00, length 0).
  Unknown CTA-861 Data Block (tag 0x00, length 0).
  Unknown CTA-861 Data Block (tag 0x00, length 0).
  Unknown CTA-861 Data Block (tag 0x00, length 0).
  Unknown CTA-861 Data Block (tag 0x00, length 0).
  Unknown CTA-861 Data Block (tag 0x00, length 0).
  Unknown CTA-861 Data Block (tag 0x00, length 0).
  Unknown CTA-861 Data Block (tag 0x00, length 0).
  Unknown CTA-861 Data Block (tag 0x00, length 0).
  Unknown CTA-861 Data Block (tag 0x00, length 0).
  Unknown CTA-861 Data Block (tag 0x00, length 0).
  Detailed Timing Descriptor #8: DTD is similar but not identical to VIC 63.
  Detailed Timing Descriptor #8: Image size is 345x215 mm, but based on the picture AR it should be 345x194 mm.
  Detailed Timing Descriptor #9: Image size is 345x215 mm, but based on the picture AR it should be 345x194 mm.
  Detailed Timing Descriptor #10: Image size is 345x215 mm, but based on the picture AR it should be 345x194 mm.
  Detailed Timing Descriptor #11: Image size is 345x215 mm, but based on the picture AR it should be 345x194 mm.
EDID:
  Base EDID: Some timings are out of range of the Monitor Ranges:
    Vertical Freq: 50.080 - 144.000 Hz (Monitor: 60.000 - 144.000 Hz)
    Horizontal Freq: 15.625 - 236.880 kHz (Monitor: 144.000 - 144.000 kHz)

Failures:

Block 0, Base EDID:
  Detailed Timing Descriptor #2: Invalid detailed timing descriptor ordering.
Block 2, CTA-861 Extension Block:
  Offset is 22, but should be 53.
EDID:
  Extension Block 3 started with EDID header, ignoring Extension Blocks >= 3.

EDID conformity: FAIL
