edid-decode (hex):

00 ff ff ff ff ff ff 00 28 9a ed 10 00 00 00 00
0a 22 01 04 a5 23 14 78 0b 1b bb a6 58 55 9d 26
0e 4f 55 00 00 00 01 01 01 01 01 01 01 01 01 01
01 01 01 01 01 01 96 3b 80 36 71 38 3c 40 30 20
36 00 59 c3 10 00 00 1a 00 00 00 00 00 00 00 00
00 00 00 00 58 c2 10 00 00 1a 00 00 00 fe 00 47
31 35 36 45 44 30 32 0a 20 20 20 20 00 00 00 fe
00 47 31 35 36 45 44 30 32 0a 20 20 20 20 00 a1

00 ff ff ff ff ff ff 00 28 9a ed 10 00 00 00 00
0a 22 01 04 a5 23 14 78 0b 1b bb a6 58 55 9d 26
0e 4f 55 00 00 00 01 01 01 01 01 01 01 01 01 01
01 01 01 01 01 01 96 3b 80 36 71 38 3c 40 30 20
36 00 59 c3 10 00 00 1a 00 00 00 00 00 00 00 00
00 00 00 00 58 c2 10 00 00 1a 00 00 00 fe 00 47
31 35 36 45 44 30 32 0a 20 20 20 20 00 00 00 fe
00 47 31 35 36 45 44 30 32 0a 20 20 20 20 00 a1

----------------

Block 0, Base EDID:
  EDID Structure Version & Revision: 1.4
  Vendor & Product Identification:
    Manufacturer: JDZ
    Model: 4333
    Made in: week 10 of 2024
  Basic Display Parameters & Features:
    Digital display
    Bits per primary color channel: 8
    DisplayPort interface
    Maximum image size: 35 cm x 20 cm
    Gamma: 2.20
    Supported color formats: RGB 4:4:4, YCrCb 4:4:4
    First detailed timing includes the native pixel format and preferred refresh rate
    Display supports continuous frequencies
  Color Characteristics:
    Red  : 0.6484, 0.3447
    Green: 0.3339, 0.6162
    Blue : 0.1503, 0.0576
    White: 0.3105, 0.3349
  Established Timings I & II: none
  Standard Timings: none
  Detailed Timing Descriptors:
    DTD 1:  1920x1080   60.003147 Hz  16:9     68.404 kHz    152.540000 MHz (345 mm x 195 mm)
                 Hfront   48 Hsync  32 Hback  230 Hpol P
                 Vfront    3 Vsync   6 Vback   51 Vpol N
    Manufacturer-Specified Display Descriptor (0x00): 00 00 00 00 00 00 00 00 00 00 58 c2 10 00 00 1a '..........X.....'
    Alphanumeric Data String: 'G156ED02'
    Alphanumeric Data String: 'G156ED02'
Checksum: 0xa1

----------------

Warnings:

Block 0, Base EDID:
  Missing Display Product Name.

Failures:

Block 0, Base EDID:
  Missing Display Range Limits Descriptor.
EDID:
  Extension Block 1 started with EDID header, ignoring Extension Blocks >= 1.

EDID conformity: FAIL
