edid-decode (hex):

00 ff ff ff ff ff ff 00 06 10 8a 9c 00 00 00 00
1c 12 01 03 80 1d 12 78 0a 50 c5 98 58 52 8e 27
25 50 54 00 00 00 01 01 01 01 01 01 01 01 01 01
01 01 01 01 01 01 52 1c 00 8f 50 20 2e 30 30 20
36 00 1e b3 10 00 00 19 00 00 00 01 00 06 10 20
00 00 00 00 00 00 00 00 0a 20 00 00 00 fe 00 4c
54 4e 31 33 33 41 54 30 39 00 0a 20 00 00 00 fc
00 43 6f 6c 6f 72 20 4c 43 44 0a 20 20 20 00 d3

----------------

Block 0, Base EDID:
  EDID Structure Version & Revision: 1.3
  Vendor & Product Identification:
    Manufacturer: APP
    Model: 40074
    Made in: week 28 of 2008
  Basic Display Parameters & Features:
    Digital display
    Maximum image size: 29 cm x 18 cm
    Gamma: 2.20
    RGB color display
    First detailed timing is the preferred timing
  Color Characteristics:
    Red  : 0.5947, 0.3447
    Green: 0.3203, 0.5546
    Blue : 0.1552, 0.1445
    White: 0.3134, 0.3291
  Established Timings I & II: none
  Standard Timings: none
  Detailed Timing Descriptors:
    DTD 1:  1280x800    60.223050 Hz  16:10    50.949 kHz     72.500000 MHz (286 mm x 179 mm)
                 Hfront   48 Hsync  32 Hback   63 Hpol N
                 Vfront    3 Vsync   6 Vback   37 Vpol N
    Manufacturer-Specified Display Descriptor (0x01): 00 01 00 06 10 20 00 00 00 00 00 00 00 00 0a 20 '..... ......... '
    Alphanumeric Data String: 'LTN133AT09'
    Display Product Name: 'Color LCD'
Checksum: 0xd3

----------------

Failures:

Block 0, Base EDID:
  Alphanumeric Data String: NUL byte at position 10.
  Missing Display Range Limits Descriptor.

EDID conformity: FAIL
