edid-decode (hex):

00 ff ff ff ff ff ff 00 4d d9 01 42 01 00 00 00
01 12 01 03 18 47 28 78 ee 3c 48 a0 56 47 98 2a
12 48 4c a5 4e 00 31 40 45 40 61 40 01 01 01 01
01 01 01 01 01 01 66 21 50 b0 51 00 1b 30 3c 70
36 00 47 28 00 00 00 1e 0e 1f 00 80 51 00 1e 30
46 80 37 00 47 28 00 10 0d 1c 00 00 00 fd 00 32
55 0f 39 0a 00 0a 20 20 20 20 20 20 00 00 00 fc
00 53 4f 4e 59 20 54 56 0a 20 20 20 20 20 00 ff

----------------

Block 0, Base EDID:
  EDID Structure Version & Revision: 1.3
  Vendor & Product Identification:
    Manufacturer: SNY
    Model: 16897
    Serial Number: ...
    Made in: week 1 of 2008
  Basic Display Parameters & Features:
    Analog display
    Signal Level Standard: 0.700 : 0.300 : 1.000 V p-p
    Blank-to-black setup/pedestal
    Sync: Separate
    Maximum image size: 71 cm x 40 cm
    Gamma: 2.20
    DPMS levels: Standby Suspend Off
    RGB color display
    Default (sRGB) color space is primary color space
    First detailed timing is the preferred timing
  Color Characteristics:
    Red  : 0.6250, 0.3388
    Green: 0.2802, 0.5937
    Blue : 0.1650, 0.0703
    White: 0.2832, 0.2968
  Established Timings I & II:
    IBM     :   720x400    70.081663 Hz   9:5     31.467 kHz     28.320000 MHz
    DMT 0x04:   640x480    59.940476 Hz   4:3     31.469 kHz     25.175000 MHz
    DMT 0x06:   640x480    75.000000 Hz   4:3     37.500 kHz     31.500000 MHz
    DMT 0x09:   800x600    60.316541 Hz   4:3     37.879 kHz     40.000000 MHz
    DMT 0x0b:   800x600    75.000000 Hz   4:3     46.875 kHz     49.500000 MHz
    DMT 0x10:  1024x768    60.003840 Hz   4:3     48.363 kHz     65.000000 MHz
    DMT 0x11:  1024x768    70.069359 Hz   4:3     56.476 kHz     75.000000 MHz
    DMT 0x12:  1024x768    75.028582 Hz   4:3     60.023 kHz     78.750000 MHz
  Standard Timings:
    DMT 0x04:   640x480    59.940476 Hz   4:3     31.469 kHz     25.175000 MHz
    DMT 0x09:   800x600    60.316541 Hz   4:3     37.879 kHz     40.000000 MHz
    DMT 0x10:  1024x768    60.003840 Hz   4:3     48.363 kHz     65.000000 MHz
  Detailed Timing Descriptors:
    DTD 1:  1360x768    60.015162 Hz  85:48    47.712 kHz     85.500000 MHz (71 mm x 40 mm)
                 Hfront   60 Hsync 112 Hback  260 Hpol P
                 Vfront    3 Vsync   6 Vback   18 Vpol P
    DTD 2:  1280x768    59.870228 Hz   5:3     47.776 kHz     79.500000 MHz (71 mm x 40 mm)
                 Hfront   70 Hsync 128 Hback  154 Hpol N Hborder 16
                 Vfront    3 Vsync   7 Vback   -6 Vpol P Vborder 13
    Display Range Limits:
      Monitor ranges (GTF): 50-85 Hz V, 15-57 kHz H, max dotclock 100 MHz
    Display Product Name: 'SONY TV'
Checksum: 0xff

----------------

Warnings:

Block 0, Base EDID:
  Vendor & Product Identification: The serial number is one of the known dummy values, it should probably be set to 0.
  Detailed Timing Descriptor #1: DTD is similar but not identical to DMT 0x27.
  Detailed Timing Descriptor #1: Dubious image size (71x40 mm is smaller than 100x100 mm).
  Detailed Timing Descriptor #2: Dubious image size (71x40 mm is smaller than 100x100 mm).
  Detailed Timing Descriptor #2: The use of non-zero borders in a DTD is not recommended.
EDID:
  Base EDID: Some timings are out of range of the Monitor Ranges:
    Horizontal Freq: 31.466 - 60.022 kHz (Monitor: 15.000 - 57.000 kHz)

Failures:

Block 0, Base EDID:
  Basic Display Parameters & Features: sRGB is signaled, but the chromaticities do not match.
  Detailed Timing Descriptor #1: Mismatch of image size 71x40 mm vs display size 710x400 mm.
  Detailed Timing Descriptor #2: 0 or negative vertical back porch.
  Detailed Timing Descriptor #2: Mismatch of image size 71x40 mm vs display size 710x400 mm.

EDID conformity: FAIL
