edid-decode (hex):

00 ff ff ff ff ff ff 00 0d b4 00 24 00 00 00 00
01 21 01 03 80 35 1e 78 2e 33 d5 a8 55 4c 9b 25
0f 50 54 25 4b 00 71 40 81 c0 81 80 95 00 a9 c0
01 01 01 01 d1 fc 02 3a 80 18 71 38 2d 40 58 2c
35 00 12 2c 21 00 00 1a 00 00 00 fd 00 30 90 50
de 28 00 0a 20 20 20 20 20 20 00 00 00 ff 00 30
30 30 33 38 00 00 00 00 00 00 00 00 00 00 00 fc
00 47 4d 32 33 38 2d 46 46 53 0a 20 20 20 01 f5

02 03 42 f1 49 81 02 04 0e 10 1f 3f 40 00 23 09
07 07 83 01 00 00 67 03 0c 00 20 00 78 50 67 d8
5d c4 01 50 80 03 6d 1a 00 00 02 01 30 90 e6 00
00 00 00 00 e3 05 e3 01 e6 06 05 01 50 50 58 e2
00 ff 7d 7f 80 78 70 38 1f 40 30 20 35 00 12 2c
21 00 00 1a b0 6d 80 a0 70 38 2d 40 30 20 35 00
12 2c 21 00 00 1e 68 5b 80 a0 70 38 2d 40 30 20
35 00 12 2c 21 00 00 1e 00 00 00 00 00 00 00 de

00 ff ff ff ff ff ff 00 0d b4 00 24 00 00 00 00
01 21 01 03 80 35 1e 78 2e 33 d5 a8 55 4c 9b 25
0f 50 54 25 4b 00 71 40 81 c0 81 80 95 00 a9 c0
01 01 01 01 d1 fc 02 3a 80 18 71 38 2d 40 58 2c
35 00 12 2c 21 00 00 1a 00 00 00 fd 00 30 90 50
de 28 00 0a 20 20 20 20 20 20 00 00 00 ff 00 30
30 30 33 38 00 00 00 00 00 00 00 00 00 00 00 fc
00 47 4d 32 33 38 2d 46 46 53 0a 20 20 20 01 f5

02 03 42 f1 49 81 02 04 0e 10 1f 3f 40 00 23 09
07 07 83 01 00 00 67 03 0c 00 20 00 78 50 67 d8
5d c4 01 50 80 03 6d 1a 00 00 02 01 30 90 e6 00
00 00 00 00 e3 05 e3 01 e6 06 05 01 50 50 58 e2
00 ff 7d 7f 80 78 70 38 1f 40 30 20 35 00 12 2c
21 00 00 1a b0 6d 80 a0 70 38 2d 40 30 20 35 00
12 2c 21 00 00 1e 68 5b 80 a0 70 38 2d 40 30 20
35 00 12 2c 21 00 00 1e 00 00 00 00 00 00 00 de

----------------

Block 0, Base EDID:
  EDID Structure Version & Revision: 1.3
  Vendor & Product Identification:
    Manufacturer: CMT
    Model: 9216
    Made in: week 1 of 2023
  Basic Display Parameters & Features:
    Digital display
    Maximum image size: 53 cm x 30 cm
    Gamma: 2.20
    DPMS levels: Off
    RGB color display
    Default (sRGB) color space is primary color space
    First detailed timing is the preferred timing
  Color Characteristics:
    Red  : 0.6562, 0.3349
    Green: 0.2968, 0.6083
    Blue : 0.1474, 0.0595
    White: 0.3134, 0.3291
  Established Timings I & II:
    DMT 0x04:   640x480    59.940476 Hz   4:3     31.469 kHz     25.175000 MHz
    DMT 0x06:   640x480    75.000000 Hz   4:3     37.500 kHz     31.500000 MHz
    DMT 0x09:   800x600    60.316541 Hz   4:3     37.879 kHz     40.000000 MHz
    DMT 0x0b:   800x600    75.000000 Hz   4:3     46.875 kHz     49.500000 MHz
    DMT 0x10:  1024x768    60.003840 Hz   4:3     48.363 kHz     65.000000 MHz
    DMT 0x12:  1024x768    75.028582 Hz   4:3     60.023 kHz     78.750000 MHz
    DMT 0x24:  1280x1024   75.024675 Hz   5:4     79.976 kHz    135.000000 MHz
  Standard Timings:
    GTF     :  1152x864    60.000000 Hz   4:3     53.700 kHz     81.624000 MHz
    DMT 0x55:  1280x720    60.000000 Hz  16:9     45.000 kHz     74.250000 MHz
    DMT 0x23:  1280x1024   60.019740 Hz   5:4     63.981 kHz    108.000000 MHz
    DMT 0x2f:  1440x900    59.887445 Hz  16:10    55.935 kHz    106.500000 MHz
    DMT 0x53:  1600x900    60.000000 Hz  16:9     60.000 kHz    108.000000 MHz (RB)
    GTF     :  1920x1080  119.999987 Hz  16:9    138.840 kHz    368.759000 MHz
  Detailed Timing Descriptors:
    DTD 1:  1920x1080   60.000000 Hz  16:9     67.500 kHz    148.500000 MHz (530 mm x 300 mm)
                 Hfront   88 Hsync  44 Hback  148 Hpol P
                 Vfront    3 Vsync   5 Vback   37 Vpol N
    Display Range Limits:
      Monitor ranges (GTF): 48-144 Hz V, 80-222 kHz H, max dotclock 400 MHz
    Display Product Serial Number: ...
    Display Product Name: 'GM238-FFS'
  Extension blocks: 1
Checksum: 0xf5

----------------

Block 1, CTA-861 Extension Block:
  Revision: 3
  Underscans IT Video Formats by default
  Basic audio support
  Supports YCbCr 4:4:4
  Supports YCbCr 4:2:2
  Native DTDs: 1
  Video Data Block:
    VIC   1:   640x480    59.940476 Hz   4:3     31.469 kHz     25.175000 MHz (native)
    VIC   2:   720x480    59.940060 Hz   4:3     31.469 kHz     27.000000 MHz
    VIC   4:  1280x720    60.000000 Hz  16:9     45.000 kHz     74.250000 MHz
    VIC  14:  1440x480    59.940060 Hz   4:3     31.469 kHz     54.000000 MHz
    VIC  16:  1920x1080   60.000000 Hz  16:9     67.500 kHz    148.500000 MHz
    VIC  31:  1920x1080   50.000000 Hz  16:9     56.250 kHz    148.500000 MHz
    VIC  63:  1920x1080  120.000000 Hz  16:9    135.000 kHz    297.000000 MHz
    VIC  64:  1920x1080  100.000000 Hz  16:9    112.500 kHz    297.000000 MHz
  Audio Data Block:
    Linear PCM:
      Max channels: 2
      Supported sample rates (kHz): 48 44.1 32
      Supported sample sizes (bits): 24 20 16
  Speaker Allocation Data Block:
    FL/FR - Front Left/Right
  Vendor-Specific Data Block (HDMI), OUI 00-0C-03:
    Source physical address: 2.0.0.0
    DC_48bit
    DC_36bit
    DC_30bit
    DC_Y444
    Maximum TMDS clock: 400 MHz
  Vendor-Specific Data Block (HDMI Forum), OUI C4-5D-D8:
    Version: 1
    Maximum TMDS Character Rate: 400 MHz
    SCDC Present
    Supports 12-bits/component Deep Color 4:2:0 Pixel Encoding
    Supports 10-bits/component Deep Color 4:2:0 Pixel Encoding
  Vendor-Specific Data Block (AMD), OUI 00-00-1A:
    Version: 2
    Feature Caps: 0x01
    Minimum Refresh Rate: 48 Hz
    Maximum Refresh Rate: 144 Hz
    Flags 1.x: 0xe6 (MCCS)
    Flags 2.x: 0x00
  Colorimetry Data Block:
    xvYCC601
    xvYCC709
    BT2020cYCC
    BT2020YCC
    BT2020RGB
    Gamut Boundary Description Metadata Profile P0
  HDR Static Metadata Data Block:
    Electro optical transfer functions:
      Traditional gamma - SDR luminance range
      SMPTE ST2084
    Supported static metadata descriptors:
      Static metadata type 1
    Desired content max luminance: 80 (282.843 cd/m^2)
    Desired content max frame-average luminance: 80 (282.843 cd/m^2)
    Desired content min luminance: 88 (0.337 cd/m^2)
  Video Capability Data Block:
    YCbCr quantization: Selectable (via AVI YQ)
    RGB quantization: Selectable (via AVI Q)
    PT scan behavior: Supports both over- and underscan
    IT scan behavior: Supports both over- and underscan
    CE scan behavior: Supports both over- and underscan
  Detailed Timing Descriptors:
    DTD 2:  1920x1080  144.001165 Hz  16:9    159.985 kHz    326.370000 MHz (530 mm x 300 mm)
                 Hfront   48 Hsync  32 Hback   40 Hpol P
                 Vfront    3 Vsync   5 Vback   23 Vpol N
    DTD 3:  1920x1080  120.000000 Hz  16:9    135.000 kHz    280.800000 MHz (530 mm x 300 mm)
                 Hfront   48 Hsync  32 Hback   80 Hpol P
                 Vfront    3 Vsync   5 Vback   37 Vpol P
    DTD 4:  1920x1080  100.000000 Hz  16:9    112.500 kHz    234.000000 MHz (530 mm x 300 mm)
                 Hfront   48 Hsync  32 Hback   80 Hpol P
                 Vfront    3 Vsync   5 Vback   37 Vpol P
Checksum: 0xde  Unused space in Extension Block: 7 bytes

----------------

Warnings:

Block 0, Base EDID:
  Detailed Timing Descriptor #1: DTD is similar but not identical to VIC 16.
Block 1, CTA-861 Extension Block:
  Video Data Block: VIC 1 and the first DTD are not identical. Is this intended?
  Video Data Block: All VICs are in ascending order, and the first (preferred) VIC <= 4, is that intended?
  Video Capability Data Block: S_PT is equal to S_IT and S_CE, so should be set to 0 instead.
EDID:
  Base EDID: Some timings are out of range of the Monitor Ranges:
    Horizontal Freq: 31.468 - 159.985 kHz (Monitor: 80.000 - 222.000 kHz)

Failures:

Block 0, Base EDID:
  Display Product Serial Number: ...
  Basic Display Parameters & Features: sRGB is signaled, but the chromaticities do not match.
Block 1, CTA-861 Extension Block:
  Vendor-Specific Data Block (HDMI), OUI 00-0C-03: HDMI VSDB Max TMDS rate is > 340.
EDID:
  Extension Block 2 started with EDID header, ignoring Extension Blocks >= 2.
  CTA-861: Native progressive timings are a mix of several resolutions.

EDID conformity: FAIL
