edid-decode (hex):

00 ff ff ff ff ff ff 00 0d ae 3b 14 00 00 00 00
0d 1f 01 04 a5 1e 13 78 02 28 65 97 59 54 8e 27
1e 50 54 00 00 00 01 01 01 01 01 01 01 01 01 01
01 01 01 01 01 01 42 3c 80 a0 70 b0 24 40 30 20
a6 00 2d bc 10 00 00 1a 35 30 80 a0 70 b0 24 40
30 20 a6 00 2d bc 10 00 00 1a 00 00 00 fe 00 36
46 4d 46 54 80 31 34 30 4a 43 41 0a 00 00 00 00
00 01 41 31 99 00 10 00 00 0a 01 0a 20 20 00 27

00 ff ff ff ff ff ff 00 0d ae 3b 14 00 00 00 00
0d 1f 01 04 a5 1e 13 78 02 28 65 97 59 54 8e 27
1e 50 54 00 00 00 01 01 01 01 01 01 01 01 01 01
01 01 01 01 01 01 42 3c 80 a0 70 b0 24 40 30 20
a6 00 2d bc 10 00 00 1a 35 30 80 a0 70 b0 24 40
30 20 a6 00 2d bc 10 00 00 1a 00 00 00 fe 00 36
46 4d 46 54 80 31 34 30 4a 43 41 0a 00 00 00 00
00 01 41 31 99 00 10 00 00 0a 01 0a 20 20 00 27

----------------

Block 0, Base EDID:
  EDID Structure Version & Revision: 1.4
  Vendor & Product Identification:
    Manufacturer: CMN
    Model: 5179
    Made in: week 13 of 2021
  Basic Display Parameters & Features:
    Digital display
    Bits per primary color channel: 8
    DisplayPort interface
    Maximum image size: 30 cm x 19 cm
    Gamma: 2.20
    Supported color formats: RGB 4:4:4
    First detailed timing includes the native pixel format and preferred refresh rate
  Color Characteristics:
    Red  : 0.5898, 0.3496
    Green: 0.3300, 0.5546
    Blue : 0.1533, 0.1191
    White: 0.3134, 0.3291
  Established Timings I & II: none
  Standard Timings: none
  Detailed Timing Descriptors:
    DTD 1:  1920x1200   60.002801 Hz  16:10    74.163 kHz    154.260000 MHz (301 mm x 188 mm)
                 Hfront   48 Hsync  32 Hback   80 Hpol P
                 Vfront   10 Vsync   6 Vback   20 Vpol N
    DTD 2:  1920x1200   48.003018 Hz  16:10    59.332 kHz    123.410000 MHz (301 mm x 188 mm)
                 Hfront   48 Hsync  32 Hback   80 Hpol P
                 Vfront   10 Vsync   6 Vback   20 Vpol N
    Alphanumeric Data String: '6FMFT.140JCA'
    Manufacturer-Specified Display Descriptor (0x00): 00 00 00 01 41 31 99 00 10 00 00 0a 01 0a 20 20 '....A1........  '
Checksum: 0x27

----------------

Warnings:

Block 0, Base EDID:
  Alphanumeric Data String: Non-ASCII character 0x80 at position 5, can cause problems.
  Missing Display Product Name.

Failures:

EDID:
  Extension Block 1 started with EDID header, ignoring Extension Blocks >= 1.

EDID conformity: FAIL
