edid-decode (hex):

00 ff ff ff ff ff ff 00 59 3a 30 00 01 01 01 01
15 11 01 03 3f 5d 34 78 ea 85 6b a2 58 49 9d 25
0f 47 4a a5 4a 00 01 01 01 01 01 01 01 01 01 01
01 01 01 01 01 01 66 21 56 b0 51 00 1b 30 80 82
26 00 a2 0b 32 00 00 1a 00 00 00 fd 00 32 55 1f
46 0b 02 00 bc 90 21 00 00 1a 00 00 00 ff 00 53
50 41 4d 41 48 32 31 32 35 34 35 34 00 00 00 fc
00 56 58 34 32 4c 20 48 44 54 56 31 30 41 00 14

00 ff ff ff ff ff ff 00 59 3a 30 00 01 01 01 01
15 11 01 03 3f 5d 34 78 ea 85 6b a2 58 49 9d 25
0f 47 4a a5 4a 00 01 01 01 01 01 01 01 01 01 01
01 01 01 01 01 01 66 21 56 b0 51 00 1b 30 80 82
26 00 a2 0b 32 00 00 1a 00 00 00 fd 00 32 55 1f
46 0b 02 00 bc 90 21 00 00 1a 00 00 00 ff 00 53
50 41 4d 41 48 32 31 32 35 34 35 34 00 00 00 fc
00 56 58 34 32 4c 20 48 44 54 56 31 30 41 00 14

----------------

Block 0, Base EDID:
  EDID Structure Version & Revision: 1.3
  Vendor & Product Identification:
    Manufacturer: VIZ
    Model: 48
    Serial Number: ...
    Made in: week 21 of 2007
  Basic Display Parameters & Features:
    Analog display
    Signal Level Standard: 0.714 : 0.286 : 1.000 V p-p
    Blank-to-black setup/pedestal
    Sync: Separate Composite SyncOnGreen Serration
    Maximum image size: 93 cm x 52 cm
    Gamma: 2.20
    DPMS levels: Standby Suspend Off
    RGB color display
    First detailed timing is the preferred timing
  Color Characteristics:
    Red  : 0.6347, 0.3437
    Green: 0.2861, 0.6142
    Blue : 0.1455, 0.0605
    White: 0.2792, 0.2919
  Established Timings I & II:
    IBM     :   720x400    70.081663 Hz   9:5     31.467 kHz     28.320000 MHz
    DMT 0x04:   640x480    59.940476 Hz   4:3     31.469 kHz     25.175000 MHz
    DMT 0x06:   640x480    75.000000 Hz   4:3     37.500 kHz     31.500000 MHz
    DMT 0x09:   800x600    60.316541 Hz   4:3     37.879 kHz     40.000000 MHz
    DMT 0x0b:   800x600    75.000000 Hz   4:3     46.875 kHz     49.500000 MHz
    DMT 0x10:  1024x768    60.003840 Hz   4:3     48.363 kHz     65.000000 MHz
    DMT 0x12:  1024x768    75.028582 Hz   4:3     60.023 kHz     78.750000 MHz
  Standard Timings: none
  Detailed Timing Descriptors:
    DTD 1:  1366x768    59.814889 Hz 683:384   47.553 kHz     85.500000 MHz (930 mm x 523 mm)
                 Hfront  128 Hsync 130 Hback  174 Hpol P
                 Vfront    2 Vsync   6 Vback   19 Vpol N
    Display Range Limits:
      Monitor ranges (Secondary GTF): 50-85 Hz V, 31-70 kHz H, max dotclock 110 MHz
      GTF Secondary Curve Block:
        Start frequency: 376 kHz
        C: 72.0%
        M: 33%/kHz
        K: 0
        J: 13.0%
    Display Product Serial Number: ...
    Display Product Name: 'VX42L HDTV10A'
Checksum: 0x14

----------------

Warnings:

Block 0, Base EDID:
  Vendor & Product Identification: The serial number is one of the known dummy values, it should probably be set to 0.

Failures:

EDID:
  Extension Block 1 started with EDID header, ignoring Extension Blocks >= 1.

EDID conformity: FAIL
