edid-decode (hex):

00 ff ff ff ff ff ff 00 0e 77 4a 16 00 00 00 00
04 22 01 04 a5 22 16 78 02 2c c5 94 5c 59 95 29
1e 50 54 00 00 00 01 01 01 01 01 01 01 01 01 01
01 01 01 01 01 01 35 3c 80 a0 70 b0 23 40 30 20
36 00 58 d7 10 00 00 1a 2a 30 80 a0 70 b0 23 40
30 20 36 00 58 d7 10 00 00 1a 00 00 00 fe 00 46
32 44 4b 59 80 43 53 4f 54 20 54 39 00 00 00 00
00 02 41 01 9e 00 00 00 00 0a 01 0a 20 20 00 0b

00 ff ff ff ff ff ff 00 0e 77 4a 16 00 00 00 00
04 22 01 04 a5 22 16 78 02 2c c5 94 5c 59 95 29
1e 50 54 00 00 00 01 01 01 01 01 01 01 01 01 01
01 01 01 01 01 01 35 3c 80 a0 70 b0 23 40 30 20
36 00 58 d7 10 00 00 1a 2a 30 80 a0 70 b0 23 40
30 20 36 00 58 d7 10 00 00 1a 00 00 00 fe 00 46
32 44 4b 59 80 43 53 4f 54 20 54 39 00 00 00 00
00 02 41 01 9e 00 00 00 00 0a 01 0a 20 20 00 0b

----------------

Block 0, Base EDID:
  EDID Structure Version & Revision: 1.4
  Vendor & Product Identification:
    Manufacturer: CSW
    Model: 5706
    Made in: week 4 of 2024
  Basic Display Parameters & Features:
    Digital display
    Bits per primary color channel: 8
    DisplayPort interface
    Maximum image size: 34 cm x 22 cm
    Gamma: 2.20
    Supported color formats: RGB 4:4:4
    First detailed timing includes the native pixel format and preferred refresh rate
  Color Characteristics:
    Red  : 0.5781, 0.3613
    Green: 0.3505, 0.5820
    Blue : 0.1630, 0.1171
    White: 0.3134, 0.3291
  Established Timings I & II: none
  Standard Timings: none
  Detailed Timing Descriptors:
    DTD 1:  1920x1200   60.000779 Hz  16:10    74.101 kHz    154.130000 MHz (344 mm x 215 mm)
                 Hfront   48 Hsync  32 Hback   80 Hpol P
                 Vfront    3 Vsync   6 Vback   26 Vpol N
    DTD 2:  1920x1200   47.999066 Hz  16:10    59.279 kHz    123.300000 MHz (344 mm x 215 mm)
                 Hfront   48 Hsync  32 Hback   80 Hpol P
                 Vfront    3 Vsync   6 Vback   26 Vpol N
    Alphanumeric Data String: 'F2DKY.CSOT T9'
    Manufacturer-Specified Display Descriptor (0x00): 00 00 00 02 41 01 9e 00 00 00 00 0a 01 0a 20 20 '....A.........  '
Checksum: 0x0b

----------------

Warnings:

Block 0, Base EDID:
  Alphanumeric Data String: Non-ASCII character 0x80 at position 5, can cause problems.
  Missing Display Product Name.

Failures:

EDID:
  Extension Block 1 started with EDID header, ignoring Extension Blocks >= 1.

EDID conformity: FAIL
