edid-decode (hex):

00 ff ff ff ff ff ff 00 14 ec 52 21 01 00 00 00
12 16 01 03 68 30 1b 78 ea f0 65 98 57 51 91 27
21 50 54 a1 08 00 81 c0 81 40 81 80 a9 c0 d1 c0
01 01 01 01 01 01 94 43 80 90 72 38 28 40 80 c8
35 00 dc 0c 11 00 00 1c 66 21 50 b0 51 00 1b 30
40 70 36 00 dc 0c 11 00 00 1e 00 00 00 fd 00 38
3f 1f 44 0f 00 0a 20 20 20 20 20 20 00 00 00 fc
00 4c 48 32 32 30 30 42 0a 20 20 20 20 20 00 f8

00 ff ff ff ff ff ff 00 14 ec 52 21 01 00 00 00
12 16 01 03 68 30 1b 78 ea f0 65 98 57 51 91 27
21 50 54 a1 08 00 81 c0 81 40 81 80 a9 c0 d1 c0
01 01 01 01 01 01 94 43 80 90 72 38 28 40 80 c8
35 00 dc 0c 11 00 00 1c 66 21 50 b0 51 00 1b 30
40 70 36 00 dc 0c 11 00 00 1e 00 00 00 fd 00 38
3f 1f 44 0f 00 0a 20 20 20 20 20 20 00 00 00 fc
00 4c 48 32 32 30 30 42 0a 20 20 20 20 20 00 f8

----------------

Block 0, Base EDID:
  EDID Structure Version & Revision: 1.3
  Vendor & Product Identification:
    Manufacturer: EGL
    Model: 8530
    Serial Number: ...
    Made in: week 18 of 2012
  Basic Display Parameters & Features:
    Analog display
    Signal Level Standard: 0.700 : 0.000 : 0.700 V p-p
    Blank level equals black level
    Sync: Separate
    Maximum image size: 48 cm x 27 cm
    Gamma: 2.20
    DPMS levels: Standby Suspend Off
    RGB color display
    First detailed timing is the preferred timing
  Color Characteristics:
    Red  : 0.5966, 0.3427
    Green: 0.3164, 0.5664
    Blue : 0.1533, 0.1308
    White: 0.3134, 0.3291
  Established Timings I & II:
    IBM     :   720x400    70.081663 Hz   9:5     31.467 kHz     28.320000 MHz
    DMT 0x04:   640x480    59.940476 Hz   4:3     31.469 kHz     25.175000 MHz
    DMT 0x09:   800x600    60.316541 Hz   4:3     37.879 kHz     40.000000 MHz
    DMT 0x10:  1024x768    60.003840 Hz   4:3     48.363 kHz     65.000000 MHz
  Standard Timings:
    DMT 0x55:  1280x720    60.000000 Hz  16:9     45.000 kHz     74.250000 MHz
    DMT 0x20:  1280x960    60.000000 Hz   4:3     60.000 kHz    108.000000 MHz
    DMT 0x23:  1280x1024   60.019740 Hz   5:4     63.981 kHz    108.000000 MHz
    DMT 0x53:  1600x900    60.000000 Hz  16:9     60.000 kHz    108.000000 MHz (RB)
    DMT 0x52:  1920x1080   60.000000 Hz  16:9     67.500 kHz    148.500000 MHz
  Detailed Timing Descriptors:
    DTD 1:  1920x1080   59.962844 Hz  16:9     67.158 kHz    173.000000 MHz (476 mm x 268 mm)
                 Hfront  128 Hsync 200 Hback  328 Hpol N
                 Vfront    3 Vsync   5 Vback   32 Vpol P
    DTD 2:  1360x768    60.015162 Hz  85:48    47.712 kHz     85.500000 MHz (476 mm x 268 mm)
                 Hfront   64 Hsync 112 Hback  256 Hpol P
                 Vfront    3 Vsync   6 Vback   18 Vpol P
    Display Range Limits:
      Monitor ranges (GTF): 56-63 Hz V, 31-68 kHz H, max dotclock 150 MHz
    Display Product Name: 'LH2200B'
Checksum: 0xf8

----------------

Warnings:

Block 0, Base EDID:
  Vendor & Product Identification: The serial number is one of the known dummy values, it should probably be set to 0.
EDID:
  Base EDID: Some timings are out of range of the Monitor Ranges:
    Vertical Freq: 59.940 - 70.082 Hz (Monitor: 56.000 - 63.000 Hz)
    Maximum Clock: 173.000 MHz (Monitor: 150.000 MHz)

Failures:

EDID:
  Extension Block 1 started with EDID header, ignoring Extension Blocks >= 1.

EDID conformity: FAIL
