edid-decode (hex):

00 ff ff ff ff ff ff 00 5a 63 34 c2 00 00 00 00
0e 1f 01 03 80 22 13 78 ea fb 00 95 58 55 90 2a
1e 50 54 bf ef 80 81 00 81 c0 61 4c 81 80 01 01
01 01 01 01 01 01 66 21 56 aa 51 00 1e 30 46 8f
33 00 58 c1 10 00 00 1e 00 00 00 ff 00 56 48 59
32 31 31 34 41 30 30 36 31 0a 00 00 00 fd 00 38
4b 1e 3d 0b 00 0a 20 20 20 20 20 20 00 00 00 fc
00 54 44 31 36 33 30 2d 33 0a 20 20 20 20 01 6e

ff 03 1f f2 47 13 12 16 01 84 07 03 23 09 07 07
83 01 00 00 67 03 0c 00 10 00 38 2d e2 00 4f 8c
0a d0 8a 20 e0 2d 10 10 3e 96 00 58 c1 10 00 00
19 01 1d 00 72 51 d0 1e 20 6e 28 55 00 58 c1 10
00 00 1f 00 00 00 00 00 00 00 00 00 00 00 00 00
00 00 00 00 00 00 00 00 00 00 00 00 00 00 00 00
00 00 00 00 00 00 00 00 00 00 00 00 00 00 00 00
00 00 00 00 00 00 00 00 00 00 00 00 00 00 00 8a

00 ff ff ff ff ff ff 00 5a 63 34 c2 00 00 00 00
0e 1f 01 03 80 22 13 78 ea fb 00 95 58 55 90 2a
1e 50 54 bf ef 80 81 00 81 c0 61 4c 81 80 01 01
01 01 01 01 01 01 66 21 56 aa 51 00 1e 30 46 8f
33 00 58 c1 10 00 00 1e 00 00 00 ff 00 56 48 59
32 31 31 34 41 30 30 36 31 0a 00 00 00 fd 00 38
4b 1e 3d 0b 00 0a 20 20 20 20 20 20 00 00 00 fc
00 54 44 31 36 33 30 2d 33 0a 20 20 20 20 01 6e

ff 03 1f f2 47 13 12 16 01 84 07 03 23 09 07 07
83 01 00 00 67 03 0c 00 10 00 38 2d e2 00 4f 8c
0a d0 8a 20 e0 2d 10 10 3e 96 00 58 c1 10 00 00
19 01 1d 00 72 51 d0 1e 20 6e 28 55 00 58 c1 10
00 00 1f 00 00 00 00 00 00 00 00 00 00 00 00 00
00 00 00 00 00 00 00 00 00 00 00 00 00 00 00 00
00 00 00 00 00 00 00 00 00 00 00 00 00 00 00 00
00 00 00 00 00 00 00 00 00 00 00 00 00 00 00 8a

----------------

Block 0, Base EDID:
  EDID Structure Version & Revision: 1.3
  Vendor & Product Identification:
    Manufacturer: VSC
    Model: 49716
    Made in: week 14 of 2021
  Basic Display Parameters & Features:
    Digital display
    Maximum image size: 34 cm x 19 cm
    Gamma: 2.20
    DPMS levels: Standby Suspend Off
    RGB color display
    First detailed timing is the preferred timing
  Color Characteristics:
    Red  : 0.5849, 0.3466
    Green: 0.3339, 0.5654
    Blue : 0.1640, 0.1171
    White: 0.3125, 0.3281
  Established Timings I & II:
    IBM     :   720x400    70.081663 Hz   9:5     31.467 kHz     28.320000 MHz
    DMT 0x04:   640x480    59.940476 Hz   4:3     31.469 kHz     25.175000 MHz
    Apple   :   640x480    66.666667 Hz   4:3     35.000 kHz     30.240000 MHz
    DMT 0x05:   640x480    72.808802 Hz   4:3     37.861 kHz     31.500000 MHz
    DMT 0x06:   640x480    75.000000 Hz   4:3     37.500 kHz     31.500000 MHz
    DMT 0x08:   800x600    56.250000 Hz   4:3     35.156 kHz     36.000000 MHz
    DMT 0x09:   800x600    60.316541 Hz   4:3     37.879 kHz     40.000000 MHz
    DMT 0x0a:   800x600    72.187572 Hz   4:3     48.077 kHz     50.000000 MHz
    DMT 0x0b:   800x600    75.000000 Hz   4:3     46.875 kHz     49.500000 MHz
    Apple   :   832x624    74.551266 Hz   4:3     49.726 kHz     57.284000 MHz
    DMT 0x10:  1024x768    60.003840 Hz   4:3     48.363 kHz     65.000000 MHz
    DMT 0x11:  1024x768    70.069359 Hz   4:3     56.476 kHz     75.000000 MHz
    DMT 0x12:  1024x768    75.028582 Hz   4:3     60.023 kHz     78.750000 MHz
    DMT 0x24:  1280x1024   75.024675 Hz   5:4     79.976 kHz    135.000000 MHz
    Apple   :  1152x870    75.061550 Hz 192:145   68.681 kHz    100.000000 MHz
  Standard Timings:
    DMT 0x1c:  1280x800    59.810326 Hz  16:10    49.702 kHz     83.500000 MHz
    DMT 0x55:  1280x720    60.000000 Hz  16:9     45.000 kHz     74.250000 MHz
    GTF     :  1024x768    72.000073 Hz   4:3     57.672 kHz     78.434000 MHz
    DMT 0x23:  1280x1024   60.019740 Hz   5:4     63.981 kHz    108.000000 MHz
  Detailed Timing Descriptors:
    DTD 1:  1366x768    59.789541 Hz 683:384   47.712 kHz     85.500000 MHz (344 mm x 193 mm)
                 Hfront   70 Hsync 143 Hback  213 Hpol P
                 Vfront    3 Vsync   3 Vback   24 Vpol P
    Display Product Serial Number: ...
    Display Range Limits:
      Monitor ranges (GTF): 56-75 Hz V, 30-61 kHz H, max dotclock 110 MHz
    Display Product Name: 'TD1630-3'
  Extension blocks: 1
Checksum: 0x6e

----------------

Block 1, Manufacturer-Specific Extension Block:
  ff 03 1f f2 47 13 12 16 01 84 07 03 23 09 07 07 '....G.......#...'
  83 01 00 00 67 03 0c 00 10 00 38 2d e2 00 4f 8c '....g.....8-..O.'
  0a d0 8a 20 e0 2d 10 10 3e 96 00 58 c1 10 00 00 '... .-..>..X....'
  19 01 1d 00 72 51 d0 1e 20 6e 28 55 00 58 c1 10 '....rQ.. n(U.X..'
  00 00 1f 00 00 00 00 00 00 00 00 00 00 00 00 00 '................'
  00 00 00 00 00 00 00 00 00 00 00 00 00 00 00 00 '................'
  00 00 00 00 00 00 00 00 00 00 00 00 00 00 00 00 '................'
  00 00 00 00 00 00 00 00 00 00 00 00 00 00 00 8a '................'
Checksum: 0x8a (should be 0x8d)

----------------

Warnings:

EDID:
  Base EDID: Some timings are out of range of the Monitor Ranges:
    Horizontal Freq: 31.466 - 79.976 kHz (Monitor: 30.000 - 61.000 kHz)
    Maximum Clock: 135.000 MHz (Monitor: 110.000 MHz)

Failures:

Block 1, Manufacturer-Specific Extension Block:
  Unknown Extension Block.
  Invalid checksum 0x8a (should be 0x8d).
EDID:
  Extension Block 2 started with EDID header, ignoring Extension Blocks >= 2.

EDID conformity: FAIL
