edid-decode (hex):

00 ff ff ff ff ff ff 00 1e 6d 71 4b 50 48 00 00
0a 11 01 03 80 2f 1e 78 0a ae c5 a2 57 4a 9c 25
12 50 54 a5 6e 00 81 80 95 00 d1 c0 b3 01 01 01
01 01 01 01 01 01 9a 29 a0 d0 51 84 22 30 50 98
36 00 99 e6 10 00 00 1c 1a 36 80 a0 70 38 1f 40
30 20 35 00 9a e7 10 00 00 1c 00 00 00 fd 00 39
4b 1f 54 12 00 0a 20 20 20 20 20 20 00 00 00 fc
00 31 39 4c 53 34 44 2d 5a 42 0a 20 20 20 00 4a

00 ff ff ff ff ff ff 00 1e 6d 71 4b 50 48 00 00
0a 11 01 03 80 2f 1e 78 0a ae c5 a2 57 4a 9c 25
12 50 54 a5 6e 00 81 80 95 00 d1 c0 b3 01 01 01
01 01 01 01 01 01 9a 29 a0 d0 51 84 22 30 50 98
36 00 99 e6 10 00 00 1c 1a 36 80 a0 70 38 1f 40
30 20 35 00 9a e7 10 00 00 1c 00 00 00 fd 00 39
4b 1f 54 12 00 0a 20 20 20 20 20 20 00 00 00 fc
00 31 39 4c 53 34 44 2d 5a 42 0a 20 20 20 00 4a

----------------

Block 0, Base EDID:
  EDID Structure Version & Revision: 1.3
  Vendor & Product Identification:
    Manufacturer: GSM
    Model: 19313
    Serial Number: ...
    Made in: week 10 of 2007
  Basic Display Parameters & Features:
    Digital display
    Maximum image size: 47 cm x 30 cm
    Gamma: 2.20
    RGB color display
    First detailed timing is the preferred timing
  Color Characteristics:
    Red  : 0.6347, 0.3417
    Green: 0.2919, 0.6113
    Blue : 0.1474, 0.0703
    White: 0.3134, 0.3291
  Established Timings I & II:
    IBM     :   720x400    70.081663 Hz   9:5     31.467 kHz     28.320000 MHz
    DMT 0x04:   640x480    59.940476 Hz   4:3     31.469 kHz     25.175000 MHz
    DMT 0x06:   640x480    75.000000 Hz   4:3     37.500 kHz     31.500000 MHz
    DMT 0x09:   800x600    60.316541 Hz   4:3     37.879 kHz     40.000000 MHz
    DMT 0x0b:   800x600    75.000000 Hz   4:3     46.875 kHz     49.500000 MHz
    Apple   :   832x624    74.551266 Hz   4:3     49.726 kHz     57.284000 MHz
    DMT 0x10:  1024x768    60.003840 Hz   4:3     48.363 kHz     65.000000 MHz
    DMT 0x11:  1024x768    70.069359 Hz   4:3     56.476 kHz     75.000000 MHz
    DMT 0x12:  1024x768    75.028582 Hz   4:3     60.023 kHz     78.750000 MHz
  Standard Timings:
    DMT 0x23:  1280x1024   60.019740 Hz   5:4     63.981 kHz    108.000000 MHz
    DMT 0x2f:  1440x900    59.887445 Hz  16:10    55.935 kHz    106.500000 MHz
    DMT 0x52:  1920x1080   60.000000 Hz  16:9     67.500 kHz    148.500000 MHz
    GTF     :  1680x1050   61.000166 Hz  16:10    66.307 kHz    149.589000 MHz
  Detailed Timing Descriptors:
    DTD 1:  1440x900    59.887445 Hz  16:10    55.935 kHz    106.500000 MHz (409 mm x 230 mm)
                 Hfront   80 Hsync 152 Hback  232 Hpol N
                 Vfront    3 Vsync   6 Vback   25 Vpol P
    DTD 2:  1920x1080   59.933878 Hz  16:9     66.587 kHz    138.500000 MHz (410 mm x 231 mm)
                 Hfront   48 Hsync  32 Hback   80 Hpol N
                 Vfront    3 Vsync   5 Vback   23 Vpol P
    Display Range Limits:
      Monitor ranges (GTF): 57-75 Hz V, 31-84 kHz H, max dotclock 180 MHz
    Display Product Name: '19LS4D-ZB'
Checksum: 0x4a

----------------

Warnings:

Block 0, Base EDID:
  Detailed Timing Descriptor #1: Image size is 409x230 mm, but based on the picture AR it should be 368x230 mm.

Failures:

Block 0, Base EDID:
  Detailed Timing Descriptor #1: Mismatch of image size 409x230 mm vs display size 470x300 mm.
  Detailed Timing Descriptor #2: Mismatch of image size 410x231 mm vs display size 470x300 mm.
EDID:
  Extension Block 1 started with EDID header, ignoring Extension Blocks >= 1.

EDID conformity: FAIL
