edid-decode (hex):

00 ff ff ff ff ff ff 00 30 ae a7 67 01 01 01 01
24 22 01 04 b5 3c 22 78 39 43 d5 aa 54 42 ac 24
0f 50 54 2d cb 80 d1 c0 d1 00 b3 00 a9 c0 95 00
81 80 81 c0 81 00 80 e5 00 a0 a0 a0 3c 50 08 20
98 04 55 50 21 00 00 1e 00 00 00 ff 00 55 35 56
31 43 34 4e 38 0a 20 20 20 20 00 00 00 fd 0c 30
fa 78 78 66 01 0a 20 20 20 20 20 20 00 00 00 fc
00 59 32 37 71 66 2d 33 30 0a 20 20 20 20 02 c9

02 03 36 f1 4d 3f 90 1f 05 14 0f 04 13 16 12 07
03 01 23 09 07 07 83 01 00 00 6d 1a 00 00 02 01
30 fa 00 00 00 00 00 00 e6 06 07 01 64 64 01 e3
05 e0 00 e2 00 ca 70 c2 00 a0 a0 a0 55 50 30 20
35 00 55 50 21 00 00 1a 70 a0 00 a0 a0 a0 46 50
30 20 35 00 55 50 21 00 00 1f a0 5f 00 a0 a0 a0
3c 50 30 20 35 00 55 50 21 00 00 1a 00 00 00 00
00 00 00 00 00 00 00 00 00 00 00 00 00 00 00 a8

70 12 79 06 00 03 01 3c 4c 7e 01 04 ff 09 9f 00
2f 80 1f 00 9f 05 3b 00 07 00 05 00 3d 8e 01 84
ff 09 9f 00 2f 00 1f 00 9f 05 3b 00 07 00 05 00
f7 06 01 04 ff 09 9f 00 2f 80 1f 00 9f 05 3b 00
03 00 04 00 00 00 00 00 00 00 00 00 00 00 00 00
00 00 00 00 00 00 00 00 00 00 00 00 00 00 00 00
00 00 00 00 00 00 00 00 00 00 00 00 00 00 00 00
00 00 00 00 00 00 00 00 00 00 00 00 00 00 73 90

00 ff ff ff ff ff ff 00 30 ae a7 67 01 01 01 01
24 22 01 04 b5 3c 22 78 39 43 d5 aa 54 42 ac 24
0f 50 54 2d cb 80 d1 c0 d1 00 b3 00 a9 c0 95 00
81 80 81 c0 81 00 80 e5 00 a0 a0 a0 3c 50 08 20
98 04 55 50 21 00 00 1e 00 00 00 ff 00 55 35 56
31 43 34 4e 38 0a 20 20 20 20 00 00 00 fd 0c 30
fa 78 78 66 01 0a 20 20 20 20 20 20 00 00 00 fc
00 59 32 37 71 66 2d 33 30 0a 20 20 20 20 02 c9

02 03 36 f1 4d 3f 90 1f 05 14 0f 04 13 16 12 07
03 01 23 09 07 07 83 01 00 00 6d 1a 00 00 02 01
30 fa 00 00 00 00 00 00 e6 06 07 01 64 64 01 e3
05 e0 00 e2 00 ca 70 c2 00 a0 a0 a0 55 50 30 20
35 00 55 50 21 00 00 1a 70 a0 00 a0 a0 a0 46 50
30 20 35 00 55 50 21 00 00 1f a0 5f 00 a0 a0 a0
3c 50 30 20 35 00 55 50 21 00 00 1a 00 00 00 00
00 00 00 00 00 00 00 00 00 00 00 00 00 00 00 a8

70 12 79 06 00 03 01 3c 4c 7e 01 04 ff 09 9f 00
2f 80 1f 00 9f 05 3b 00 07 00 05 00 3d 8e 01 84
ff 09 9f 00 2f 00 1f 00 9f 05 3b 00 07 00 05 00
f7 06 01 04 ff 09 9f 00 2f 80 1f 00 9f 05 3b 00
03 00 04 00 00 00 00 00 00 00 00 00 00 00 00 00
00 00 00 00 00 00 00 00 00 00 00 00 00 00 00 00
00 00 00 00 00 00 00 00 00 00 00 00 00 00 00 00
00 00 00 00 00 00 00 00 00 00 00 00 00 00 73 90

----------------

Block 0, Base EDID:
  EDID Structure Version & Revision: 1.4
  Vendor & Product Identification:
    Manufacturer: LEN
    Model: 26535
    Serial Number: ...
    Made in: week 36 of 2024
  Basic Display Parameters & Features:
    Digital display
    Bits per primary color channel: 10
    DisplayPort interface
    Maximum image size: 60 cm x 34 cm
    Gamma: 2.20
    DPMS levels: Off
    Supported color formats: RGB 4:4:4, YCrCb 4:4:4, YCrCb 4:2:2
    First detailed timing does not include the native pixel format and preferred refresh rate
    Display supports continuous frequencies
  Color Characteristics:
    Red  : 0.6650, 0.3281
    Green: 0.2578, 0.6748
    Blue : 0.1435, 0.0595
    White: 0.3134, 0.3291
  Established Timings I & II:
    DMT 0x04:   640x480    59.940476 Hz   4:3     31.469 kHz     25.175000 MHz
    DMT 0x05:   640x480    72.808802 Hz   4:3     37.861 kHz     31.500000 MHz
    DMT 0x06:   640x480    75.000000 Hz   4:3     37.500 kHz     31.500000 MHz
    DMT 0x09:   800x600    60.316541 Hz   4:3     37.879 kHz     40.000000 MHz
    DMT 0x0a:   800x600    72.187572 Hz   4:3     48.077 kHz     50.000000 MHz
    DMT 0x0b:   800x600    75.000000 Hz   4:3     46.875 kHz     49.500000 MHz
    DMT 0x10:  1024x768    60.003840 Hz   4:3     48.363 kHz     65.000000 MHz
    DMT 0x12:  1024x768    75.028582 Hz   4:3     60.023 kHz     78.750000 MHz
    DMT 0x24:  1280x1024   75.024675 Hz   5:4     79.976 kHz    135.000000 MHz
    Apple   :  1152x870    75.061550 Hz 192:145   68.681 kHz    100.000000 MHz
  Standard Timings:
    DMT 0x52:  1920x1080   60.000000 Hz  16:9     67.500 kHz    148.500000 MHz
    DMT 0x45:  1920x1200   59.884600 Hz  16:10    74.556 kHz    193.250000 MHz
    DMT 0x3a:  1680x1050   59.954250 Hz  16:10    65.290 kHz    146.250000 MHz
    DMT 0x53:  1600x900    60.000000 Hz  16:9     60.000 kHz    108.000000 MHz (RB)
    DMT 0x2f:  1440x900    59.887445 Hz  16:10    55.935 kHz    106.500000 MHz
    DMT 0x23:  1280x1024   60.019740 Hz   5:4     63.981 kHz    108.000000 MHz
    DMT 0x55:  1280x720    60.000000 Hz  16:9     45.000 kHz     74.250000 MHz
    DMT 0x1c:  1280x800    59.810326 Hz  16:10    49.702 kHz     83.500000 MHz
  Detailed Timing Descriptors:
    DTD 1:  2560x1440  144.000000 Hz  16:9    216.000 kHz    587.520000 MHz (597 mm x 336 mm)
                 Hfront    8 Hsync  32 Hback  120 Hpol P
                 Vfront   25 Vsync   8 Vback   27 Vpol P
    Display Product Serial Number: ...
    Display Range Limits:
      Monitor ranges (Range Limits Only): 48-250 Hz V, 375-375 kHz H, max dotclock 1020 MHz
    Display Product Name: 'Y27qf-30'
  Extension blocks: 2
Checksum: 0xc9

----------------

Block 1, CTA-861 Extension Block:
  Revision: 3
  Underscans IT Video Formats by default
  Basic audio support
  Supports YCbCr 4:4:4
  Supports YCbCr 4:2:2
  Native DTDs: 1
  Video Data Block:
    VIC  63:  1920x1080  120.000000 Hz  16:9    135.000 kHz    297.000000 MHz
    VIC  16:  1920x1080   60.000000 Hz  16:9     67.500 kHz    148.500000 MHz (native)
    VIC  31:  1920x1080   50.000000 Hz  16:9     56.250 kHz    148.500000 MHz
    VIC   5:  1920x1080i  60.000000 Hz  16:9     33.750 kHz     74.250000 MHz
    VIC  20:  1920x1080i  50.000000 Hz  16:9     28.125 kHz     74.250000 MHz
    VIC  15:  1440x480    59.940060 Hz  16:9     31.469 kHz     54.000000 MHz
    VIC   4:  1280x720    60.000000 Hz  16:9     45.000 kHz     74.250000 MHz
    VIC  19:  1280x720    50.000000 Hz  16:9     37.500 kHz     74.250000 MHz
    VIC  22:  1440x576i   50.000000 Hz  16:9     15.625 kHz     27.000000 MHz
    VIC  18:   720x576    50.000000 Hz  16:9     31.250 kHz     27.000000 MHz
    VIC   7:  1440x480i   59.940060 Hz  16:9     15.734 kHz     27.000000 MHz
    VIC   3:   720x480    59.940060 Hz  16:9     31.469 kHz     27.000000 MHz
    VIC   1:   640x480    59.940476 Hz   4:3     31.469 kHz     25.175000 MHz
  Audio Data Block:
    Linear PCM:
      Max channels: 2
      Supported sample rates (kHz): 48 44.1 32
      Supported sample sizes (bits): 24 20 16
  Speaker Allocation Data Block:
    FL/FR - Front Left/Right
  Vendor-Specific Data Block (AMD), OUI 00-00-1A:
    Version: 2
    Feature Caps: 0x01
    Minimum Refresh Rate: 48 Hz
    Maximum Refresh Rate: 250 Hz
    Flags 1.x: 0x00
    Flags 2.x: 0x00
  HDR Static Metadata Data Block:
    Electro optical transfer functions:
      Traditional gamma - SDR luminance range
      Traditional gamma - HDR luminance range
      SMPTE ST2084
    Supported static metadata descriptors:
      Static metadata type 1
    Desired content max luminance: 100 (436.203 cd/m^2)
    Desired content max frame-average luminance: 100 (436.203 cd/m^2)
    Desired content min luminance: 1 (0.000 cd/m^2)
  Colorimetry Data Block:
    BT2020cYCC
    BT2020YCC
    BT2020RGB
  Video Capability Data Block:
    YCbCr quantization: Selectable (via AVI YQ)
    RGB quantization: Selectable (via AVI Q)
    PT scan behavior: No Data
    IT scan behavior: Always Underscanned
    CE scan behavior: Always Underscanned
  Detailed Timing Descriptors:
    DTD 2:  2560x1440  120.000000 Hz  16:9    183.000 kHz    497.760000 MHz (597 mm x 336 mm)
                 Hfront   48 Hsync  32 Hback   80 Hpol P
                 Vfront    3 Vsync   5 Vback   77 Vpol N
    DTD 3:  2560x1440  100.000000 Hz  16:9    151.000 kHz    410.720000 MHz (597 mm x 336 mm)
                 Hfront   48 Hsync  32 Hback   80 Hpol P
                 Vfront    3 Vsync   5 Vback   62 Vpol P
    DTD 4:  2560x1440   60.000000 Hz  16:9     90.000 kHz    244.800000 MHz (597 mm x 336 mm)
                 Hfront   48 Hsync  32 Hback   80 Hpol P
                 Vfront    3 Vsync   5 Vback   52 Vpol N
Checksum: 0xa8  Unused space in Extension Block: 19 bytes

----------------

Block 2, DisplayID Extension Block:
  Version: 1.2
  Extension Count: 0
  Display Product Type: DIRECT DRIVE monitor
  Video Timing Modes Type 1 - Detailed Timings Data Block:
    DTD:  2560x1440  239.875000 Hz  16:9    359.812 kHz    978.690000 MHz (aspect 16:9, no 3D stereo)
               Hfront   48 Hsync  32 Hback   80 Hpol P
               Vfront    8 Vsync   6 Vback   46 Vpol N
    DTD:  2560x1440  249.877451 Hz  16:9    374.816 kHz   1019.500000 MHz (aspect 16:9, no 3D stereo, preferred)
               Hfront   48 Hsync  32 Hback   80 Hpol N
               Vfront    8 Vsync   6 Vback   46 Vpol N
    DTD:  2560x1440  165.000000 Hz  16:9    247.500 kHz    673.200000 MHz (aspect 16:9, no 3D stereo)
               Hfront   48 Hsync  32 Hback   80 Hpol P
               Vfront    4 Vsync   5 Vback   51 Vpol N
  Checksum: 0x73
Checksum: 0x90

----------------

Warnings:

Block 0, Base EDID:
  Vendor & Product Identification: The serial number is one of the known dummy values, it should probably be set to 0.
Block 1, CTA-861 Extension Block:
  Video Data Block: VIC 63 and the first DTD are not identical. Is this intended?
  Colorimetry Data Block: Set the sRGB colorimetry bit to avoid interop issues.
  Display Product Serial Number is set, so the Serial Number in the Base EDID should be 0.
EDID:
  Base EDID: Some timings are out of range of the Monitor Ranges:
    Horizontal Freq: 15.625 - 374.816 kHz (Monitor: 375.000 - 375.000 kHz)

Failures:

EDID:
  Extension Block 3 started with EDID header, ignoring Extension Blocks >= 3.
  CTA-861: Native progressive timings are a mix of several resolutions.
  DisplayID: Missing DisplayID Display Parameters Data Block.

EDID conformity: FAIL
