edid-decode (hex):

00 ff ff ff ff ff ff 00 0d 80 5e 0c 00 00 00 00
10 1a 01 03 68 79 44 96 2a ee 91 a3 54 4c 99 26
0f 50 54 00 08 00 81 c0 01 01 01 01 01 01 01 01
01 01 01 01 01 01 64 19 00 40 41 00 26 30 18 88
36 00 be ab 42 00 00 1e 02 3a 80 18 71 38 2d 40
58 2c 45 00 be ab 42 00 00 1e 66 21 50 b0 51 00
1b 30 40 70 36 00 be ab 42 00 00 1e 00 00 00 fc
00 43 4d 20 33 33 31 36 0a 20 20 20 20 20 00 0d

00 ff ff ff ff ff ff 00 0d 80 5e 0c 00 00 00 00
10 1a 01 03 68 79 44 96 2a ee 91 a3 54 4c 99 26
0f 50 54 00 08 00 81 c0 01 01 01 01 01 01 01 01
01 01 01 01 01 01 64 19 00 40 41 00 26 30 18 88
36 00 be ab 42 00 00 1e 02 3a 80 18 71 38 2d 40
58 2c 45 00 be ab 42 00 00 1e 66 21 50 b0 51 00
1b 30 40 70 36 00 be ab 42 00 00 1e 00 00 00 fc
00 43 4d 20 33 33 31 36 0a 20 20 20 20 20 00 0d

----------------

Block 0, Base EDID:
  EDID Structure Version & Revision: 1.3
  Vendor & Product Identification:
    Manufacturer: CL@
    Model: 3166
    Made in: week 16 of 2016
  Basic Display Parameters & Features:
    Analog display
    Signal Level Standard: 0.700 : 0.000 : 0.700 V p-p
    Blank level equals black level
    Sync: Separate
    Maximum image size: 121 cm x 68 cm
    Gamma: 2.50
    DPMS levels: Off
    RGB color display
    First detailed timing is the preferred timing
  Color Characteristics:
    Red  : 0.6396, 0.3300
    Green: 0.2998, 0.5996
    Blue : 0.1503, 0.0595
    White: 0.3125, 0.3291
  Established Timings I & II:
    DMT 0x10:  1024x768    60.003840 Hz   4:3     48.363 kHz     65.000000 MHz
  Standard Timings:
    DMT 0x55:  1280x720    60.000000 Hz  16:9     45.000 kHz     74.250000 MHz
  Detailed Timing Descriptors:
    DTD 1:  1024x768    60.003840 Hz   4:3     48.363 kHz     65.000000 MHz (1214 mm x 683 mm)
                 Hfront   24 Hsync 136 Hback  160 Hpol P
                 Vfront    3 Vsync   6 Vback   29 Vpol P
    DTD 2:  1920x1080   60.000000 Hz  16:9     67.500 kHz    148.500000 MHz (1214 mm x 683 mm)
                 Hfront   88 Hsync  44 Hback  148 Hpol P
                 Vfront    4 Vsync   5 Vback   36 Vpol P
    DTD 3:  1360x768    60.015162 Hz  85:48    47.712 kHz     85.500000 MHz (1214 mm x 683 mm)
                 Hfront   64 Hsync 112 Hback  256 Hpol P
                 Vfront    3 Vsync   6 Vback   18 Vpol P
    Display Product Name: 'CM 3316'
Checksum: 0x0d

----------------

Warnings:

Block 0, Base EDID:
  Detailed Timing Descriptor #1: DTD is similar but not identical to DMT 0x10.
  Detailed Timing Descriptor #1: Image size is 1214x683 mm, but based on the picture AR it should be 910x683 mm.

Failures:

Block 0, Base EDID:
  Vendor & Product Identification: Manufacturer name field contains garbage.
  Basic Display Parameters & Features: The chromaticities match sRGB, but sRGB is not signaled.
  Missing Display Range Limits Descriptor.
EDID:
  Extension Block 1 started with EDID header, ignoring Extension Blocks >= 1.

EDID conformity: FAIL
