edid-decode (hex):

00 ff ff ff ff ff ff 00 06 af ad 56 00 00 00 00
18 21 01 04 a5 26 16 78 03 52 b5 ac 50 44 a2 24
12 50 54 00 00 00 01 01 01 01 01 01 01 01 01 01
01 01 01 01 01 01 4e 8f 80 b6 70 38 84 40 30 20
a5 00 7e d7 10 00 00 18 b6 3b 80 b6 70 38 84 40
30 20 a5 00 7e d7 10 00 00 18 00 00 00 00 00 00
00 00 00 00 00 00 00 00 00 00 00 00 00 00 00 02
00 10 3c ff 0f 3c 96 d2 1e 4b 96 20 20 20 01 8b

70 20 79 02 00 22 00 14 0b 99 05 84 7f 07 b5 00
2f 80 1f 00 37 04 83 00 09 00 04 00 25 01 09 0b
99 05 0b 99 05 3c 90 80 81 00 10 6f 1a 00 00 03
01 3c 90 00 00 53 53 53 53 90 00 00 00 00 00 00
00 00 00 00 00 00 00 00 00 00 00 00 00 00 00 00
00 00 00 00 00 00 00 00 00 00 00 00 00 00 00 00
00 00 00 00 00 00 00 00 00 00 00 00 00 00 00 00
00 00 00 00 00 00 00 00 00 00 00 00 00 00 9b 90

00 ff ff ff ff ff ff 00 06 af ad 56 00 00 00 00
18 21 01 04 a5 26 16 78 03 52 b5 ac 50 44 a2 24
12 50 54 00 00 00 01 01 01 01 01 01 01 01 01 01
01 01 01 01 01 01 4e 8f 80 b6 70 38 84 40 30 20
a5 00 7e d7 10 00 00 18 b6 3b 80 b6 70 38 84 40
30 20 a5 00 7e d7 10 00 00 18 00 00 00 00 00 00
00 00 00 00 00 00 00 00 00 00 00 00 00 00 00 02
00 10 3c ff 0f 3c 96 d2 1e 4b 96 20 20 20 01 8b

70 20 79 02 00 22 00 14 0b 99 05 84 7f 07 b5 00
2f 80 1f 00 37 04 83 00 09 00 04 00 25 01 09 0b
99 05 0b 99 05 3c 90 80 81 00 10 6f 1a 00 00 03
01 3c 90 00 00 53 53 53 53 90 00 00 00 00 00 00
00 00 00 00 00 00 00 00 00 00 00 00 00 00 00 00
00 00 00 00 00 00 00 00 00 00 00 00 00 00 00 00
00 00 00 00 00 00 00 00 00 00 00 00 00 00 00 00
00 00 00 00 00 00 00 00 00 00 00 00 00 00 9b 90

----------------

Block 0, Base EDID:
  EDID Structure Version & Revision: 1.4
  Vendor & Product Identification:
    Manufacturer: AUO
    Model: 22189
    Made in: week 24 of 2023
  Basic Display Parameters & Features:
    Digital display
    Bits per primary color channel: 8
    DisplayPort interface
    Maximum image size: 38 cm x 22 cm
    Gamma: 2.20
    Supported color formats: RGB 4:4:4
    First detailed timing includes the native pixel format and preferred refresh rate
    Display supports continuous frequencies
  Color Characteristics:
    Red  : 0.6728, 0.3134
    Green: 0.2656, 0.6347
    Blue : 0.1425, 0.0732
    White: 0.3134, 0.3291
  Established Timings I & II: none
  Standard Timings: none
  Detailed Timing Descriptors:
    DTD 1:  1920x1080  144.000842 Hz  16:9    174.529 kHz    366.860000 MHz (382 mm x 215 mm)
                 Hfront   48 Hsync  32 Hback  102 Hpol N
                 Vfront   10 Vsync   5 Vback  117 Vpol N
    DTD 2:  1920x1080   60.001005 Hz  16:9     72.721 kHz    152.860000 MHz (382 mm x 215 mm)
                 Hfront   48 Hsync  32 Hback  102 Hpol N
                 Vfront   10 Vsync   5 Vback  117 Vpol N
    Empty Descriptor
    Manufacturer-Specified Display Descriptor (0x02): 00 02 00 10 3c ff 0f 3c 96 d2 1e 4b 96 20 20 20 '....<..<...K.   '
  Extension blocks: 1
Checksum: 0x8b

----------------

Block 1, DisplayID Extension Block:
  Version: 2.0
  Extension Count: 0
  Display Product Primary Use Case: None of the listed primary use cases; generic display
  Video Timing Modes Type 7 - Detailed Timings Data Block:
    DTD:  1920x1080  144.000842 Hz  16:9    174.529 kHz    366.860000 MHz (aspect 16:9, no 3D stereo, preferred)
               Hfront   48 Hsync  32 Hback  102 Hpol P
               Vfront   10 Vsync   5 Vback  117 Vpol N
  Dynamic Video Timing Range Limits Data Block:
    Minimum Pixel Clock: 366860 kHz
    Maximum Pixel Clock: 366860 kHz
    Minimum Vertical Refresh Rate: 60 Hz
    Maximum Vertical Refresh Rate: 144 Hz
    Seamless Dynamic Video Timing Support: Yes
  CTA-861 DisplayID Data Block:
  Vendor-Specific Data Block (AMD), OUI 00-00-1A:
    Version: 3
    Feature Caps: 0x01
    Minimum Refresh Rate: 60 Hz
    Maximum Refresh Rate: 144 Hz
    Flags 1.x: 0x00
    Flags 2.x: 0x00
  Checksum: 0x9b
Checksum: 0x90

----------------

Warnings:

Block 0, Base EDID:
  Missing Display Product Name.

Failures:

Block 0, Base EDID:
  Empty Descriptor: Use Dummy Descriptor instead of all zeroes.
  Missing Display Range Limits Descriptor.
EDID:
  Extension Block 2 started with EDID header, ignoring Extension Blocks >= 2.
  DisplayID: Missing DisplayID Display Parameters Data Block.

EDID conformity: FAIL
