edid-decode (hex):

00 ff ff ff ff ff ff 00 09 e5 90 08 00 00 00 00
01 1d 01 04 a5 1f 11 78 02 7e 90 97 59 58 93 29
23 50 54 00 00 00 01 01 01 01 01 01 01 01 01 01
01 01 01 01 01 01 07 35 80 64 70 38 28 40 30 20
35 00 35 ad 10 00 00 1a 6c 2a 80 64 70 38 28 40
30 20 35 00 35 ad 10 00 00 1a 00 00 00 fe 00 57
44 36 4b 38 80 4e 56 31 34 30 46 48 00 00 00 00
00 02 41 33 96 02 10 00 00 0a 01 0a 20 20 00 3d

00 ff ff ff ff ff ff 00 09 e5 90 08 00 00 00 00
01 1d 01 04 a5 1f 11 78 02 7e 90 97 59 58 93 29
23 50 54 00 00 00 01 01 01 01 01 01 01 01 01 01
01 01 01 01 01 01 07 35 80 64 70 38 28 40 30 20
35 00 35 ad 10 00 00 1a 6c 2a 80 64 70 38 28 40
30 20 35 00 35 ad 10 00 00 1a 00 00 00 fe 00 57
44 36 4b 38 80 4e 56 31 34 30 46 48 00 00 00 00
00 02 41 33 96 02 10 00 00 0a 01 0a 20 20 00 3d

----------------

Block 0, Base EDID:
  EDID Structure Version & Revision: 1.4
  Vendor & Product Identification:
    Manufacturer: BOE
    Model: 2192
    Made in: week 1 of 2019
  Basic Display Parameters & Features:
    Digital display
    Bits per primary color channel: 8
    DisplayPort interface
    Maximum image size: 31 cm x 17 cm
    Gamma: 2.20
    Supported color formats: RGB 4:4:4
    First detailed timing includes the native pixel format and preferred refresh rate
  Color Characteristics:
    Red  : 0.5908, 0.3505
    Green: 0.3466, 0.5761
    Blue : 0.1621, 0.1376
    White: 0.3125, 0.3281
  Established Timings I & II: none
  Standard Timings: none
  Detailed Timing Descriptors:
    DTD 1:  1920x1080   60.002652 Hz  16:9     67.203 kHz    135.750000 MHz (309 mm x 173 mm)
                 Hfront   48 Hsync  32 Hback   20 Hpol P
                 Vfront    3 Vsync   5 Vback   32 Vpol N
    DTD 2:  1920x1080   48.002122 Hz  16:9     53.762 kHz    108.600000 MHz (309 mm x 173 mm)
                 Hfront   48 Hsync  32 Hback   20 Hpol P
                 Vfront    3 Vsync   5 Vback   32 Vpol N
    Alphanumeric Data String: 'WD6K8.NV140FH'
    Manufacturer-Specified Display Descriptor (0x00): 00 00 00 02 41 33 96 02 10 00 00 0a 01 0a 20 20 '....A3........  '
Checksum: 0x3d

----------------

Warnings:

Block 0, Base EDID:
  Alphanumeric Data String: Non-ASCII character 0x80 at position 5, can cause problems.
  Missing Display Product Name.

Failures:

EDID:
  Extension Block 1 started with EDID header, ignoring Extension Blocks >= 1.

EDID conformity: FAIL
