edid-decode (hex):

00 ff ff ff ff ff ff 00 06 af ed 11 00 00 00 00
01 13 01 03 90 22 13 78 0a c8 95 9e 57 54 92 26
0f 50 54 00 00 00 01 01 01 01 01 01 01 01 01 01
01 01 01 01 01 01 4c 36 80 5e 70 38 46 40 1e 14
aa 00 58 c1 10 00 00 1a 4c 36 80 5e 70 38 46 40
1e 14 aa 00 58 c1 10 00 00 1a 00 00 00 fe 00 4b
30 32 36 54 80 42 31 35 36 48 57 31 00 00 00 00
00 00 00 00 00 00 00 00 00 02 01 0a 20 20 00 c9

----------------

Block 0, Base EDID:
  EDID Structure Version & Revision: 1.3
  Vendor & Product Identification:
    Manufacturer: AUO
    Model: 4589
    Made in: week 1 of 2009
  Basic Display Parameters & Features:
    Digital display
    Maximum image size: 34 cm x 19 cm
    Gamma: 2.20
    RGB color display
    First detailed timing is the preferred timing
  Color Characteristics:
    Red  : 0.6201, 0.3398
    Green: 0.3300, 0.5703
    Blue : 0.1503, 0.0595
    White: 0.3134, 0.3291
  Established Timings I & II: none
  Standard Timings: none
  Detailed Timing Descriptors:
    DTD 1:  1920x1080   60.014680 Hz  16:9     69.017 kHz    139.000000 MHz (344 mm x 193 mm)
                 Hfront   30 Hsync  20 Hback   44 Hpol P
                 Vfront   10 Vsync  10 Vback   50 Vpol N
    DTD 2:  1920x1080   60.014680 Hz  16:9     69.017 kHz    139.000000 MHz (344 mm x 193 mm)
                 Hfront   30 Hsync  20 Hback   44 Hpol P
                 Vfront   10 Vsync  10 Vback   50 Vpol N
    Alphanumeric Data String: 'K026T.B156HW1'
    Manufacturer-Specified Display Descriptor (0x00): 00 00 00 00 00 00 00 00 00 00 00 02 01 0a 20 20 '..............  '
Checksum: 0xc9

----------------

Warnings:

Block 0, Base EDID:
  Alphanumeric Data String: Non-ASCII character 0x80 at position 5, can cause problems.

Failures:

Block 0, Base EDID:
  Basic Display Parameters & Features: Digital Video Interface Standard set to reserved value 0x10.
  Missing Display Product Name.
  Missing Display Range Limits Descriptor.

EDID conformity: FAIL
