edid-decode (hex):

00 ff ff ff ff ff ff 00 10 ac 09 94 01 01 01 01
2e 1f 01 03 80 33 1d 78 2a 48 15 a7 56 52 9c 27
0f 50 54 21 08 00 d1 c0 81 c0 81 80 95 00 b3 00
81 00 a9 c0 01 01 02 3a 80 18 71 38 2d 40 58 2c
45 00 55 50 21 00 00 1e 00 00 00 fd 00 30 4d 36
5a 0f 00 0a 20 20 20 20 20 20 00 00 00 fc 00 44
65 6c 6c 20 41 49 4f 0a 20 20 20 20 00 00 00 ff
00 0a 20 20 20 20 20 20 20 20 21 20 20 20 01 8f

02 03 27 f1 49 90 1f 04 13 03 12 02 11 01 e2 00
eb 67 03 0c 00 10 00 00 24 6d 1a 00 00 02 01 30
4b ed 00 00 00 00 00 02 3a 80 d0 72 38 2d 40 10
2c 45 80 55 50 21 00 00 1e 01 1d 00 72 51 d0 1e
20 6e 28 55 00 55 50 21 00 00 1e 01 1d 00 bc 52
d0 1e 20 b8 28 55 40 55 50 21 00 00 1e 00 00 00
00 00 00 00 00 00 00 00 00 00 00 00 00 00 00 00
00 00 00 00 00 00 00 00 00 00 00 00 00 00 00 69

00 ff ff ff ff ff ff 00 10 ac 09 94 01 01 01 01
2e 1f 01 03 80 33 1d 78 2a 48 15 a7 56 52 9c 27
0f 50 54 21 08 00 d1 c0 81 c0 81 80 95 00 b3 00
81 00 a9 c0 01 01 02 3a 80 18 71 38 2d 40 58 2c
45 00 55 50 21 00 00 1e 00 00 00 fd 00 30 4d 36
5a 0f 00 0a 20 20 20 20 20 20 00 00 00 fc 00 44
65 6c 6c 20 41 49 4f 0a 20 20 20 20 00 00 00 ff
00 0a 20 20 20 20 20 20 20 20 21 20 20 20 01 8f

02 03 27 f1 49 90 1f 04 13 03 12 02 11 01 e2 00
eb 67 03 0c 00 10 00 00 24 6d 1a 00 00 02 01 30
4b ed 00 00 00 00 00 02 3a 80 d0 72 38 2d 40 10
2c 45 80 55 50 21 00 00 1e 01 1d 00 72 51 d0 1e
20 6e 28 55 00 55 50 21 00 00 1e 01 1d 00 bc 52
d0 1e 20 b8 28 55 40 55 50 21 00 00 1e 00 00 00
00 00 00 00 00 00 00 00 00 00 00 00 00 00 00 00
00 00 00 00 00 00 00 00 00 00 00 00 00 00 00 69

----------------

Block 0, Base EDID:
  EDID Structure Version & Revision: 1.3
  Vendor & Product Identification:
    Manufacturer: DEL
    Model: 37897
    Serial Number: ...
    Made in: week 46 of 2021
  Basic Display Parameters & Features:
    Digital display
    Maximum image size: 51 cm x 29 cm
    Gamma: 2.20
    DPMS levels: Off
    RGB color display
    First detailed timing is the preferred timing
  Color Characteristics:
    Red  : 0.6533, 0.3359
    Green: 0.3222, 0.6093
    Blue : 0.1523, 0.0595
    White: 0.3134, 0.3291
  Established Timings I & II:
    DMT 0x04:   640x480    59.940476 Hz   4:3     31.469 kHz     25.175000 MHz
    DMT 0x09:   800x600    60.316541 Hz   4:3     37.879 kHz     40.000000 MHz
    DMT 0x10:  1024x768    60.003840 Hz   4:3     48.363 kHz     65.000000 MHz
  Standard Timings:
    DMT 0x52:  1920x1080   60.000000 Hz  16:9     67.500 kHz    148.500000 MHz
    DMT 0x55:  1280x720    60.000000 Hz  16:9     45.000 kHz     74.250000 MHz
    DMT 0x23:  1280x1024   60.019740 Hz   5:4     63.981 kHz    108.000000 MHz
    DMT 0x2f:  1440x900    59.887445 Hz  16:10    55.935 kHz    106.500000 MHz
    DMT 0x3a:  1680x1050   59.954250 Hz  16:10    65.290 kHz    146.250000 MHz
    DMT 0x1c:  1280x800    59.810326 Hz  16:10    49.702 kHz     83.500000 MHz
    DMT 0x53:  1600x900    60.000000 Hz  16:9     60.000 kHz    108.000000 MHz (RB)
  Detailed Timing Descriptors:
    DTD 1:  1920x1080   60.000000 Hz  16:9     67.500 kHz    148.500000 MHz (597 mm x 336 mm)
                 Hfront   88 Hsync  44 Hback  148 Hpol P
                 Vfront    4 Vsync   5 Vback   36 Vpol P
    Display Range Limits:
      Monitor ranges (GTF): 48-77 Hz V, 54-90 kHz H, max dotclock 150 MHz
    Display Product Name: 'Dell AIO'
    Display Product Serial Number: ...
  Extension blocks: 1
Checksum: 0x8f

----------------

Block 1, CTA-861 Extension Block:
  Revision: 3
  Underscans IT Video Formats by default
  Basic audio support
  Supports YCbCr 4:4:4
  Supports YCbCr 4:2:2
  Native DTDs: 1
  Video Data Block:
    VIC  16:  1920x1080   60.000000 Hz  16:9     67.500 kHz    148.500000 MHz (native)
    VIC  31:  1920x1080   50.000000 Hz  16:9     56.250 kHz    148.500000 MHz
    VIC   4:  1280x720    60.000000 Hz  16:9     45.000 kHz     74.250000 MHz
    VIC  19:  1280x720    50.000000 Hz  16:9     37.500 kHz     74.250000 MHz
    VIC   3:   720x480    59.940060 Hz  16:9     31.469 kHz     27.000000 MHz
    VIC  18:   720x576    50.000000 Hz  16:9     31.250 kHz     27.000000 MHz
    VIC   2:   720x480    59.940060 Hz   4:3     31.469 kHz     27.000000 MHz
    VIC  17:   720x576    50.000000 Hz   4:3     31.250 kHz     27.000000 MHz
    VIC   1:   640x480    59.940476 Hz   4:3     31.469 kHz     25.175000 MHz
  Video Capability Data Block:
    YCbCr quantization: Selectable (via AVI YQ)
    RGB quantization: Selectable (via AVI Q)
    PT scan behavior: Always Underscanned
    IT scan behavior: Always Underscanned
    CE scan behavior: Supports both over- and underscan
  Vendor-Specific Data Block (HDMI), OUI 00-0C-03:
    Source physical address: 1.0.0.0
    Maximum TMDS clock: 180 MHz
  Vendor-Specific Data Block (AMD), OUI 00-00-1A:
    Version: 2
    Flags 1: 0x01
      FreeSync Supported
    Minimum Refresh Rate: 48 Hz
    Maximum Refresh Rate: 75 Hz
    MCCS VCP Code: 0xed
    Flags 5: 0x00
  Detailed Timing Descriptors:
    DTD 2:  1920x1080   50.000000 Hz  16:9     56.250 kHz    148.500000 MHz (597 mm x 336 mm)
                 Hfront  528 Hsync  44 Hback  148 Hpol P
                 Vfront    4 Vsync   5 Vback   36 Vpol P
    DTD 3:  1280x720    60.000000 Hz  16:9     45.000 kHz     74.250000 MHz (597 mm x 336 mm)
                 Hfront  110 Hsync  40 Hback  220 Hpol P
                 Vfront    5 Vsync   5 Vback   20 Vpol P
    DTD 4:  1280x720    50.000000 Hz  16:9     37.500 kHz     74.250000 MHz (597 mm x 336 mm)
                 Hfront  440 Hsync  40 Hback  220 Hpol P
                 Vfront    5 Vsync   5 Vback   20 Vpol P
Checksum: 0x69  Unused space in Extension Block: 34 bytes

----------------

Warnings:

Block 0, Base EDID:
  Vendor & Product Identification: The serial number is one of the known dummy values, it should probably be set to 0.
Block 1, CTA-861 Extension Block:
  Display Product Serial Number is set, so the Serial Number in the Base EDID should be 0.
  Add a Colorimetry Data Block with the sRGB colorimetry bit set to avoid interop issues.
EDID:
  Base EDID: Some timings are out of range of the Monitor Ranges:
    Horizontal Freq: 31.250 - 67.500 kHz (Monitor: 54.000 - 90.000 kHz)

Failures:

Block 0, Base EDID:
  Display Product Serial Number: ...
  Display Product Serial Number: ...
  Detailed Timing Descriptor #1: Mismatch of image size 597x336 mm vs display size 510x290 mm.
Block 1, CTA-861 Extension Block:
  Detailed Timing Descriptor #2: Mismatch of image size 597x336 mm vs display size 510x290 mm.
  Detailed Timing Descriptor #3: Mismatch of image size 597x336 mm vs display size 510x290 mm.
  Detailed Timing Descriptor #4: Mismatch of image size 597x336 mm vs display size 510x290 mm.
EDID:
  Extension Block 2 started with EDID header, ignoring Extension Blocks >= 2.
  Base EDID: The DTD max image size is 597x336mm, which is larger than the display size 510.0x290.0mm.

EDID conformity: FAIL
