edid-decode (hex):

00 ff ff ff ff ff ff 00 0e 77 54 14 00 00 00 00
25 22 01 04 a5 1f 11 78 02 2c c5 94 5c 59 95 29
1e 50 54 00 00 00 01 01 01 01 01 01 01 01 01 01
01 01 01 01 01 01 9a 36 80 a0 70 38 28 40 30 20
63 00 35 ae 10 00 00 1a 00 00 00 10 00 00 00 00
00 00 00 00 00 00 00 00 00 00 00 00 00 10 00 00
00 00 00 00 00 00 00 00 00 00 00 00 00 00 00 fc
00 4d 4e 45 30 30 31 42 53 31 2d 35 0a 20 00 15

00 ff ff ff ff ff ff 00 0e 77 54 14 00 00 00 00
25 22 01 04 a5 1f 11 78 02 2c c5 94 5c 59 95 29
1e 50 54 00 00 00 01 01 01 01 01 01 01 01 01 01
01 01 01 01 01 01 9a 36 80 a0 70 38 28 40 30 20
63 00 35 ae 10 00 00 1a 00 00 00 10 00 00 00 00
00 00 00 00 00 00 00 00 00 00 00 00 00 10 00 00
00 00 00 00 00 00 00 00 00 00 00 00 00 00 00 fc
00 4d 4e 45 30 30 31 42 53 31 2d 35 0a 20 00 15

----------------

Block 0, Base EDID:
  EDID Structure Version & Revision: 1.4
  Vendor & Product Identification:
    Manufacturer: CSW
    Model: 5204
    Made in: week 37 of 2024
  Basic Display Parameters & Features:
    Digital display
    Bits per primary color channel: 8
    DisplayPort interface
    Maximum image size: 31 cm x 17 cm
    Gamma: 2.20
    Supported color formats: RGB 4:4:4
    First detailed timing includes the native pixel format and preferred refresh rate
  Color Characteristics:
    Red  : 0.5781, 0.3613
    Green: 0.3505, 0.5820
    Blue : 0.1630, 0.1171
    White: 0.3134, 0.3291
  Established Timings I & II: none
  Standard Timings: none
  Detailed Timing Descriptors:
    DTD 1:  1920x1080   60.001717 Hz  16:9     67.202 kHz    139.780000 MHz (309 mm x 174 mm)
                 Hfront   48 Hsync  32 Hback   80 Hpol P
                 Vfront    6 Vsync   3 Vback   31 Vpol N
    Dummy Descriptor:
    Dummy Descriptor:
    Display Product Name: 'MNE001BS1-5'
Checksum: 0x15

----------------

Failures:

EDID:
  Extension Block 1 started with EDID header, ignoring Extension Blocks >= 1.

EDID conformity: FAIL
