edid-decode (hex):

00 ff ff ff ff ff ff 00 4d 10 f9 14 00 00 00 00
15 1e 01 04 a5 1d 12 78 0e de 50 a3 54 4c 99 26
0f 50 54 00 00 00 01 01 01 01 01 01 01 01 01 01
01 01 01 01 01 01 28 3c 80 a0 70 b0 23 40 30 20
36 00 20 b4 10 00 00 18 20 30 80 a0 70 b0 23 40
30 20 36 00 20 b4 10 00 00 18 00 00 00 fe 00 56
56 4b 38 59 82 4c 51 31 33 34 4e 31 00 00 00 00
00 02 41 03 32 00 12 00 00 0a 01 0a 20 20 00 7e

00 ff ff ff ff ff ff 00 4d 10 f9 14 00 00 00 00
15 1e 01 04 a5 1d 12 78 0e de 50 a3 54 4c 99 26
0f 50 54 00 00 00 01 01 01 01 01 01 01 01 01 01
01 01 01 01 01 01 28 3c 80 a0 70 b0 23 40 30 20
36 00 20 b4 10 00 00 18 20 30 80 a0 70 b0 23 40
30 20 36 00 20 b4 10 00 00 18 00 00 00 fe 00 56
56 4b 38 59 82 4c 51 31 33 34 4e 31 00 00 00 00
00 02 41 03 32 00 12 00 00 0a 01 0a 20 20 00 7e

----------------

Block 0, Base EDID:
  EDID Structure Version & Revision: 1.4
  Vendor & Product Identification:
    Manufacturer: SHP
    Model: 5369
    Made in: week 21 of 2020
  Basic Display Parameters & Features:
    Digital display
    Bits per primary color channel: 8
    DisplayPort interface
    Maximum image size: 29 cm x 18 cm
    Gamma: 2.20
    Supported color formats: RGB 4:4:4, YCrCb 4:4:4
    Default (sRGB) color space is primary color space
    First detailed timing includes the native pixel format and preferred refresh rate
  Color Characteristics:
    Red  : 0.6396, 0.3291
    Green: 0.2998, 0.5996
    Blue : 0.1494, 0.0595
    White: 0.3125, 0.3281
  Established Timings I & II: none
  Standard Timings: none
  Detailed Timing Descriptors:
    DTD 1:  1920x1200   59.950171 Hz  16:10    74.038 kHz    154.000000 MHz (288 mm x 180 mm)
                 Hfront   48 Hsync  32 Hback   80 Hpol N
                 Vfront    3 Vsync   6 Vback   26 Vpol N
    DTD 2:  1920x1200   47.960137 Hz  16:10    59.231 kHz    123.200000 MHz (288 mm x 180 mm)
                 Hfront   48 Hsync  32 Hback   80 Hpol N
                 Vfront    3 Vsync   6 Vback   26 Vpol N
    Alphanumeric Data String: 'VVK8Y.LQ134N1'
    Manufacturer-Specified Display Descriptor (0x00): 00 00 00 02 41 03 32 00 12 00 00 0a 01 0a 20 20 '....A.2.......  '
Checksum: 0x7e

----------------

Warnings:

Block 0, Base EDID:
  Detailed Timing Descriptor #1: DTD is similar but not identical to DMT 0x44.
  Alphanumeric Data String: Non-ASCII character 0x82 at position 5, can cause problems.
  Missing Display Product Name.

Failures:

Block 0, Base EDID:
  Basic Display Parameters & Features: sRGB is signaled, but the chromaticities do not match.
EDID:
  Extension Block 1 started with EDID header, ignoring Extension Blocks >= 1.

EDID conformity: FAIL
