edid-decode (hex):

00 ff ff ff ff ff ff 00 49 54 a8 00 72 00 0d 00
14 1e 01 03 08 60 36 78 0a e2 69 a3 53 49 9b 26
0e 47 4a af cf 00 81 80 81 00 95 00 81 c0 b3 00
a9 c0 a9 40 d1 c0 02 3a 80 18 71 38 2d 40 58 2c
45 00 00 d0 52 00 00 1e 66 21 56 aa 51 00 1e 30
46 8f 33 00 00 d0 52 00 00 1e 00 00 00 fd 00 31
4c 0f 50 11 00 0a 20 20 20 20 20 20 00 00 00 fc
00 52 4a 54 2d 46 56 0a 20 20 20 20 20 20 00 02

00 ff ff ff ff ff ff 00 49 54 a8 00 72 00 0d 00
14 1e 01 03 08 60 36 78 0a e2 69 a3 53 49 9b 26
0e 47 4a af cf 00 81 80 81 00 95 00 81 c0 b3 00
a9 c0 a9 40 d1 c0 02 3a 80 18 71 38 2d 40 58 2c
45 00 00 d0 52 00 00 1e 66 21 56 aa 51 00 1e 30
46 8f 33 00 00 d0 52 00 00 1e 00 00 00 fd 00 31
4c 0f 50 11 00 0a 20 20 20 20 20 20 00 00 00 fc
00 52 4a 54 2d 46 56 0a 20 20 20 20 20 20 00 02

----------------

Block 0, Base EDID:
  EDID Structure Version & Revision: 1.3
  Vendor & Product Identification:
    Manufacturer: RJT
    Model: 168
    Serial Number: ...
    Made in: week 20 of 2020
  Basic Display Parameters & Features:
    Analog display
    Signal Level Standard: 0.700 : 0.300 : 1.000 V p-p
    Blank level equals black level
    Sync: Separate
    Maximum image size: 96 cm x 54 cm
    Gamma: 2.20
    RGB color display
    First detailed timing is the preferred timing
  Color Characteristics:
    Red  : 0.6396, 0.3261
    Green: 0.2851, 0.6074
    Blue : 0.1494, 0.0566
    White: 0.2792, 0.2900
  Established Timings I & II:
    IBM     :   720x400    70.081663 Hz   9:5     31.467 kHz     28.320000 MHz
    DMT 0x04:   640x480    59.940476 Hz   4:3     31.469 kHz     25.175000 MHz
    DMT 0x05:   640x480    72.808802 Hz   4:3     37.861 kHz     31.500000 MHz
    DMT 0x06:   640x480    75.000000 Hz   4:3     37.500 kHz     31.500000 MHz
    DMT 0x08:   800x600    56.250000 Hz   4:3     35.156 kHz     36.000000 MHz
    DMT 0x09:   800x600    60.316541 Hz   4:3     37.879 kHz     40.000000 MHz
    DMT 0x0a:   800x600    72.187572 Hz   4:3     48.077 kHz     50.000000 MHz
    DMT 0x0b:   800x600    75.000000 Hz   4:3     46.875 kHz     49.500000 MHz
    DMT 0x10:  1024x768    60.003840 Hz   4:3     48.363 kHz     65.000000 MHz
    DMT 0x11:  1024x768    70.069359 Hz   4:3     56.476 kHz     75.000000 MHz
    DMT 0x12:  1024x768    75.028582 Hz   4:3     60.023 kHz     78.750000 MHz
    DMT 0x24:  1280x1024   75.024675 Hz   5:4     79.976 kHz    135.000000 MHz
  Standard Timings:
    DMT 0x23:  1280x1024   60.019740 Hz   5:4     63.981 kHz    108.000000 MHz
    DMT 0x1c:  1280x800    59.810326 Hz  16:10    49.702 kHz     83.500000 MHz
    DMT 0x2f:  1440x900    59.887445 Hz  16:10    55.935 kHz    106.500000 MHz
    DMT 0x55:  1280x720    60.000000 Hz  16:9     45.000 kHz     74.250000 MHz
    DMT 0x3a:  1680x1050   59.954250 Hz  16:10    65.290 kHz    146.250000 MHz
    DMT 0x53:  1600x900    60.000000 Hz  16:9     60.000 kHz    108.000000 MHz (RB)
    DMT 0x33:  1600x1200   60.000000 Hz   4:3     75.000 kHz    162.000000 MHz
    DMT 0x52:  1920x1080   60.000000 Hz  16:9     67.500 kHz    148.500000 MHz
  Detailed Timing Descriptors:
    DTD 1:  1920x1080   60.000000 Hz  16:9     67.500 kHz    148.500000 MHz (1280 mm x 720 mm)
                 Hfront   88 Hsync  44 Hback  148 Hpol P
                 Vfront    4 Vsync   5 Vback   36 Vpol P
    DTD 2:  1366x768    59.789541 Hz 683:384   47.712 kHz     85.500000 MHz (1280 mm x 720 mm)
                 Hfront   70 Hsync 143 Hback  213 Hpol P
                 Vfront    3 Vsync   3 Vback   24 Vpol P
    Display Range Limits:
      Monitor ranges (GTF): 49-76 Hz V, 15-80 kHz H, max dotclock 170 MHz
    Display Product Name: 'RJT-FV'
Checksum: 0x02

----------------

Failures:

Block 0, Base EDID:
  Detailed Timing Descriptor #1: Mismatch of image size 1280x720 mm vs display size 960x540 mm.
  Detailed Timing Descriptor #2: Mismatch of image size 1280x720 mm vs display size 960x540 mm.
EDID:
  Extension Block 1 started with EDID header, ignoring Extension Blocks >= 1.
  Base EDID: The DTD max image size is 1280x720mm, which is larger than the display size 960.0x540.0mm.

EDID conformity: FAIL
