edid-decode (hex):

00 ff ff ff ff ff ff 00 09 e5 6b 0a 00 00 00 00
19 1f 01 04 a5 1f 11 78 03 9b a5 94 5c 5a 94 2a
1d 50 54 00 00 00 01 01 01 01 01 01 01 01 01 01
01 01 01 01 01 01 4b 1c 56 a2 50 00 16 30 30 20
36 00 35 ae 10 00 00 1a 00 00 00 fd 00 28 3c 30
30 07 01 0a 20 20 20 20 20 20 00 00 00 fe 00 42
4f 45 20 43 51 0a 20 20 20 20 20 20 00 00 00 fe
00 4e 54 31 34 30 57 48 4d 2d 4e 34 43 0a 00 73

00 ff ff ff ff ff ff 00 09 e5 6b 0a 00 00 00 00
19 1f 01 04 a5 1f 11 78 03 9b a5 94 5c 5a 94 2a
1d 50 54 00 00 00 01 01 01 01 01 01 01 01 01 01
01 01 01 01 01 01 4b 1c 56 a2 50 00 16 30 30 20
36 00 35 ae 10 00 00 1a 00 00 00 fd 00 28 3c 30
30 07 01 0a 20 20 20 20 20 20 00 00 00 fe 00 42
4f 45 20 43 51 0a 20 20 20 20 20 20 00 00 00 fe
00 4e 54 31 34 30 57 48 4d 2d 4e 34 43 0a 00 73

----------------

Block 0, Base EDID:
  EDID Structure Version & Revision: 1.4
  Vendor & Product Identification:
    Manufacturer: BOE
    Model: 2667
    Made in: week 25 of 2021
  Basic Display Parameters & Features:
    Digital display
    Bits per primary color channel: 8
    DisplayPort interface
    Maximum image size: 31 cm x 17 cm
    Gamma: 2.20
    Supported color formats: RGB 4:4:4
    First detailed timing includes the native pixel format and preferred refresh rate
    Display supports continuous frequencies
  Color Characteristics:
    Red  : 0.5800, 0.3603
    Green: 0.3535, 0.5810
    Blue : 0.1660, 0.1152
    White: 0.3134, 0.3291
  Established Timings I & II: none
  Standard Timings: none
  Detailed Timing Descriptors:
    DTD 1:  1366x768    60.002320 Hz 683:384   47.402 kHz     72.430000 MHz (309 mm x 174 mm)
                 Hfront   48 Hsync  32 Hback   82 Hpol P
                 Vfront    3 Vsync   6 Vback   13 Vpol N
    Display Range Limits:
      Monitor ranges (Range Limits Only): 40-60 Hz V, 48-48 kHz H, max dotclock 70 MHz
    Alphanumeric Data String: 'BOE CQ'
    Alphanumeric Data String: 'NT140WHM-N4C'
Checksum: 0x73

----------------

Block 1, Unknown EDID Extension Block 0x00:
  00 ff ff ff ff ff ff 00 09 e5 6b 0a 00 00 00 00 '..........k.....'
  19 1f 01 04 a5 1f 11 78 03 9b a5 94 5c 5a 94 2a '.......x....\Z.*'
  1d 50 54 00 00 00 01 01 01 01 01 01 01 01 01 01 '.PT.............'
  01 01 01 01 01 01 4b 1c 56 a2 50 00 16 30 30 20 '......K.V.P..00 '
  36 00 35 ae 10 00 00 1a 00 00 00 fd 00 28 3c 30 '6.5..........(<0'
  30 07 01 0a 20 20 20 20 20 20 00 00 00 fe 00 42 '0...      .....B'
  4f 45 20 43 51 0a 20 20 20 20 20 20 00 00 00 fe 'OE CQ.      ....'
  00 4e 54 31 34 30 57 48 4d 2d 4e 34 43 0a 00 73 '.NT140WHM-N4C..s'
Checksum: 0x73

----------------

Warnings:

Block 0, Base EDID:
  Missing Display Product Name.
EDID:
  Base EDID: Some timings are out of range of the Monitor Ranges:
    Horizontal Freq: 47.401 - 47.401 kHz (Monitor: 48.000 - 48.000 kHz)
    Maximum Clock: 72.430 MHz (Monitor: 70.000 MHz)
    Could be due to a Monitor Range off-by-one rounding issue

Failures:

Block 1, Base EDID:
  Unknown Extension Block.
EDID:
  Base EDID: EDID specified 0 extension block(s), but found 1 extension block(s).

EDID conformity: FAIL
