edid-decode (hex):

00 ff ff ff ff ff ff 00 06 b3 0a 27 01 01 01 01
0a 1e 01 04 1e 3c 22 78 ea f9 15 a1 56 51 a1 26
0d 50 54 bf ef 00 71 4f 81 80 81 40 81 c0 95 00
b3 00 d1 c0 a9 40 02 3a 80 18 71 38 2d 40 58 2c
45 00 56 50 21 00 00 1e 00 00 00 fd 00 30 4b 1e
55 11 00 0a 20 20 20 20 20 20 00 00 00 fc 00 56
41 32 37 44 0a 20 20 20 20 20 20 20 00 00 00 ff
00 37 31 4c 42 30 36 36 30 30 30 30 30 0a 00 f9

00 ff ff ff ff ff ff 00 06 b3 0a 27 01 01 01 01
0a 1e 01 04 1e 3c 22 78 ea f9 15 a1 56 51 a1 26
0d 50 54 bf ef 00 71 4f 81 80 81 40 81 c0 95 00
b3 00 d1 c0 a9 40 02 3a 80 18 71 38 2d 40 58 2c
45 00 56 50 21 00 00 1e 00 00 00 fd 00 30 4b 1e
55 11 00 0a 20 20 20 20 20 20 00 00 00 fc 00 56
41 32 37 44 0a 20 20 20 20 20 20 20 00 00 00 ff
00 37 31 4c 42 30 36 36 30 30 30 30 30 0a 00 f9

----------------

Block 0, Base EDID:
  EDID Structure Version & Revision: 1.4
  Vendor & Product Identification:
    Manufacturer: AUS
    Model: 9994
    Serial Number: ...
    Made in: week 10 of 2020
  Basic Display Parameters & Features:
    Analog display
    Signal Level Standard: 0.700 : 0.300 : 1.000 V p-p
    Blank-to-black setup/pedestal
    Sync: Separate Composite SyncOnGreen
    Maximum image size: 60 cm x 34 cm
    Gamma: 2.20
    DPMS levels: Standby Suspend Off
    RGB color display
    First detailed timing includes the native pixel format and preferred refresh rate
  Color Characteristics:
    Red  : 0.6318, 0.3388
    Green: 0.3183, 0.6298
    Blue : 0.1484, 0.0517
    White: 0.3134, 0.3291
  Established Timings I & II:
    IBM     :   720x400    70.081663 Hz   9:5     31.467 kHz     28.320000 MHz
    DMT 0x04:   640x480    59.940476 Hz   4:3     31.469 kHz     25.175000 MHz
    Apple   :   640x480    66.666667 Hz   4:3     35.000 kHz     30.240000 MHz
    DMT 0x05:   640x480    72.808802 Hz   4:3     37.861 kHz     31.500000 MHz
    DMT 0x06:   640x480    75.000000 Hz   4:3     37.500 kHz     31.500000 MHz
    DMT 0x08:   800x600    56.250000 Hz   4:3     35.156 kHz     36.000000 MHz
    DMT 0x09:   800x600    60.316541 Hz   4:3     37.879 kHz     40.000000 MHz
    DMT 0x0a:   800x600    72.187572 Hz   4:3     48.077 kHz     50.000000 MHz
    DMT 0x0b:   800x600    75.000000 Hz   4:3     46.875 kHz     49.500000 MHz
    Apple   :   832x624    74.551266 Hz   4:3     49.726 kHz     57.284000 MHz
    DMT 0x10:  1024x768    60.003840 Hz   4:3     48.363 kHz     65.000000 MHz
    DMT 0x11:  1024x768    70.069359 Hz   4:3     56.476 kHz     75.000000 MHz
    DMT 0x12:  1024x768    75.028582 Hz   4:3     60.023 kHz     78.750000 MHz
    DMT 0x24:  1280x1024   75.024675 Hz   5:4     79.976 kHz    135.000000 MHz
  Standard Timings:
    DMT 0x15:  1152x864    75.000000 Hz   4:3     67.500 kHz    108.000000 MHz
    DMT 0x23:  1280x1024   60.019740 Hz   5:4     63.981 kHz    108.000000 MHz
    DMT 0x20:  1280x960    60.000000 Hz   4:3     60.000 kHz    108.000000 MHz
    DMT 0x55:  1280x720    60.000000 Hz  16:9     45.000 kHz     74.250000 MHz
    DMT 0x2f:  1440x900    59.887445 Hz  16:10    55.935 kHz    106.500000 MHz
    DMT 0x3a:  1680x1050   59.954250 Hz  16:10    65.290 kHz    146.250000 MHz
    DMT 0x52:  1920x1080   60.000000 Hz  16:9     67.500 kHz    148.500000 MHz
    DMT 0x33:  1600x1200   60.000000 Hz   4:3     75.000 kHz    162.000000 MHz
  Detailed Timing Descriptors:
    DTD 1:  1920x1080   60.000000 Hz  16:9     67.500 kHz    148.500000 MHz (598 mm x 336 mm)
                 Hfront   88 Hsync  44 Hback  148 Hpol P
                 Vfront    4 Vsync   5 Vback   36 Vpol P
    Display Range Limits:
      Monitor ranges (GTF): 48-75 Hz V, 30-85 kHz H, max dotclock 170 MHz
    Display Product Name: 'VA27D'
    Display Product Serial Number: ...
Checksum: 0xf9

----------------

Block 1, Unknown EDID Extension Block 0x00:
  00 ff ff ff ff ff ff 00 06 b3 0a 27 01 01 01 01 '...........'....'
  0a 1e 01 04 1e 3c 22 78 ea f9 15 a1 56 51 a1 26 '.....<"x....VQ.&'
  0d 50 54 bf ef 00 71 4f 81 80 81 40 81 c0 95 00 '.PT...qO...@....'
  b3 00 d1 c0 a9 40 02 3a 80 18 71 38 2d 40 58 2c '.....@.:..q8-@X,'
  45 00 56 50 21 00 00 1e 00 00 00 fd 00 30 4b 1e 'E.VP!........0K.'
  55 11 00 0a 20 20 20 20 20 20 00 00 00 fc 00 56 'U...      .....V'
  41 32 37 44 0a 20 20 20 20 20 20 20 00 00 00 ff 'A27D.       ....'
  00 37 31 4c 42 30 36 36 30 30 30 30 30 0a 00 f9 '.71LB06600000...'
Checksum: 0xf9

----------------

Warnings:

Block 0, Base EDID:
  Vendor & Product Identification: The serial number is one of the known dummy values, it should probably be set to 0.
  Display Range Limits: GTF support is deprecated in EDID 1.4.

Failures:

Block 0, Base EDID:
  Display Range Limits: GTF is supported, but the display does not support continuous frequencies.
Block 1, Base EDID:
  Unknown Extension Block.
EDID:
  Base EDID: EDID specified 0 extension block(s), but found 1 extension block(s).

EDID conformity: FAIL
