edid-decode (hex):

00 ff ff ff ff ff ff 00 3c 58 11 00 10 64 00 00
0c 1f 01 03 80 38 20 78 ea 44 55 a9 55 4d 9d 26
0f 50 54 00 00 00 b3 c0 d1 00 71 4f a9 40 81 80
77 80 01 01 01 01 92 4a 80 a0 c0 08 5e 70 30 20
36 00 30 3b 21 00 00 1e 00 00 00 10 00 00 00 00
00 00 00 00 00 00 00 00 00 00 00 00 00 fc 00 4d
49 52 41 32 35 33 0a 20 20 20 20 20 00 00 00 ff
00 42 4f 4f 58 20 4d 49 52 41 32 35 33 0a 01 e1

02 03 22 c1 4f 10 05 04 03 02 07 16 01 14 1f 12
13 20 21 22 23 09 07 07 83 01 00 00 65 03 0c 00
10 00 cb 61 00 a0 a0 a0 5e 50 30 20 36 00 30 3b
21 00 00 1e 02 3a 80 18 71 38 2d 40 58 2c 45 00
30 3b 21 00 00 1e 4f 27 40 a0 60 84 35 30 30 20
36 00 30 3b 21 00 00 1e a6 19 00 a0 50 d0 28 20
30 20 36 00 30 3b 21 00 00 1e 00 00 00 00 00 00
00 00 00 00 00 00 00 00 00 00 00 00 00 00 00 83

00 ff ff ff ff ff ff 00 3c 58 11 00 10 64 00 00
0c 1f 01 03 80 38 20 78 ea 44 55 a9 55 4d 9d 26
0f 50 54 00 00 00 b3 c0 d1 00 71 4f a9 40 81 80
77 80 01 01 01 01 92 4a 80 a0 c0 08 5e 70 30 20
36 00 30 3b 21 00 00 1e 00 00 00 10 00 00 00 00
00 00 00 00 00 00 00 00 00 00 00 00 00 fc 00 4d
49 52 41 32 35 33 0a 20 20 20 20 20 00 00 00 ff
00 42 4f 4f 58 20 4d 49 52 41 32 35 33 0a 01 e1

02 03 22 c1 4f 10 05 04 03 02 07 16 01 14 1f 12
13 20 21 22 23 09 07 07 83 01 00 00 65 03 0c 00
10 00 cb 61 00 a0 a0 a0 5e 50 30 20 36 00 30 3b
21 00 00 1e 02 3a 80 18 71 38 2d 40 58 2c 45 00
30 3b 21 00 00 1e 4f 27 40 a0 60 84 35 30 30 20
36 00 30 3b 21 00 00 1e a6 19 00 a0 50 d0 28 20
30 20 36 00 30 3b 21 00 00 1e 00 00 00 00 00 00
00 00 00 00 00 00 00 00 00 00 00 00 00 00 00 83

----------------

Block 0, Base EDID:
  EDID Structure Version & Revision: 1.3
  Vendor & Product Identification:
    Manufacturer: OBX
    Model: 17
    Serial Number: ...
    Made in: week 12 of 2021
  Basic Display Parameters & Features:
    Digital display
    Maximum image size: 56 cm x 32 cm
    Gamma: 2.20
    DPMS levels: Standby Suspend Off
    RGB color display
    First detailed timing is the preferred timing
  Color Characteristics:
    Red  : 0.6611, 0.3320
    Green: 0.3017, 0.6132
    Blue : 0.1494, 0.0595
    White: 0.3134, 0.3291
  Established Timings I & II: none
  Standard Timings:
    GTF     :  1680x945    59.999909 Hz  16:9     58.680 kHz    131.443000 MHz
    DMT 0x45:  1920x1200   59.884600 Hz  16:10    74.556 kHz    193.250000 MHz
    DMT 0x15:  1152x864    75.000000 Hz   4:3     67.500 kHz    108.000000 MHz
    DMT 0x33:  1600x1200   60.000000 Hz   4:3     75.000 kHz    162.000000 MHz
    DMT 0x23:  1280x1024   60.019740 Hz   5:4     63.981 kHz    108.000000 MHz
    GTF     :  1200x960    60.000000 Hz   5:4     59.640 kHz     95.424000 MHz
  Detailed Timing Descriptors:
    DTD 1:  3200x1800   29.997612 Hz  16:9     56.815 kHz    190.900000 MHz (560 mm x 315 mm)
                 Hfront   48 Hsync  32 Hback   80 Hpol P
                 Vfront    3 Vsync   6 Vback   85 Vpol P
    Dummy Descriptor:
    Display Product Name: 'MIRA253'
    Display Product Serial Number: ...
  Extension blocks: 1
Checksum: 0xe1

----------------

Block 1, CTA-861 Extension Block:
  Revision: 3
  Underscans IT Video Formats by default
  Basic audio support
  Native DTDs: 1
  Video Data Block:
    VIC  16:  1920x1080   60.000000 Hz  16:9     67.500 kHz    148.500000 MHz
    VIC   5:  1920x1080i  60.000000 Hz  16:9     33.750 kHz     74.250000 MHz
    VIC   4:  1280x720    60.000000 Hz  16:9     45.000 kHz     74.250000 MHz
    VIC   3:   720x480    59.940060 Hz  16:9     31.469 kHz     27.000000 MHz
    VIC   2:   720x480    59.940060 Hz   4:3     31.469 kHz     27.000000 MHz
    VIC   7:  1440x480i   59.940060 Hz  16:9     15.734 kHz     27.000000 MHz
    VIC  22:  1440x576i   50.000000 Hz  16:9     15.625 kHz     27.000000 MHz
    VIC   1:   640x480    59.940476 Hz   4:3     31.469 kHz     25.175000 MHz
    VIC  20:  1920x1080i  50.000000 Hz  16:9     28.125 kHz     74.250000 MHz
    VIC  31:  1920x1080   50.000000 Hz  16:9     56.250 kHz    148.500000 MHz
    VIC  18:   720x576    50.000000 Hz  16:9     31.250 kHz     27.000000 MHz
    VIC  19:  1280x720    50.000000 Hz  16:9     37.500 kHz     74.250000 MHz
    VIC  32:  1920x1080   24.000000 Hz  16:9     27.000 kHz     74.250000 MHz
    VIC  33:  1920x1080   25.000000 Hz  16:9     28.125 kHz     74.250000 MHz
    VIC  34:  1920x1080   30.000000 Hz  16:9     33.750 kHz     74.250000 MHz
  Audio Data Block:
    Linear PCM:
      Max channels: 2
      Supported sample rates (kHz): 48 44.1 32
      Supported sample sizes (bits): 24 20 16
  Speaker Allocation Data Block:
    FL/FR - Front Left/Right
  Vendor-Specific Data Block (HDMI), OUI 00-0C-03:
    Source physical address: 1.0.0.0
  Detailed Timing Descriptors:
    DTD 2:  2560x1440   60.000288 Hz  16:9     92.040 kHz    250.350000 MHz (560 mm x 315 mm)
                 Hfront   48 Hsync  32 Hback   80 Hpol P
                 Vfront    3 Vsync   6 Vback   85 Vpol P
    DTD 3:  1920x1080   60.000000 Hz  16:9     67.500 kHz    148.500000 MHz (560 mm x 315 mm)
                 Hfront   88 Hsync  44 Hback  148 Hpol P
                 Vfront    4 Vsync   5 Vback   36 Vpol P
    DTD 4:  1600x900    59.995946 Hz  16:9     57.176 kHz    100.630000 MHz (560 mm x 315 mm)
                 Hfront   48 Hsync  32 Hback   80 Hpol P
                 Vfront    3 Vsync   6 Vback   44 Vpol P
    DTD 5:  1280x720    59.996345 Hz  16:9     45.597 kHz     65.660000 MHz (560 mm x 315 mm)
                 Hfront   48 Hsync  32 Hback   80 Hpol P
                 Vfront    3 Vsync   6 Vback   31 Vpol P
Checksum: 0x83  Unused space in Extension Block: 21 bytes

----------------

Warnings:

Block 0, Base EDID:
  Standard Timings: Standard Timing 1680x945 has a dubious odd vertical resolution.
Block 1, CTA-861 Extension Block:
  Video Data Block: VIC 16 and the first DTD are not identical. Is this intended?
  Display Product Serial Number is set, so the Serial Number in the Base EDID should be 0.
  Add a Colorimetry Data Block with the sRGB colorimetry bit set to avoid interop issues.

Failures:

Block 0, Base EDID:
  Missing Display Range Limits Descriptor.
Block 1, CTA-861 Extension Block:
  Missing VCDB, needed for Set Selectable RGB Quantization to avoid interop issues.
EDID:
  Extension Block 2 started with EDID header, ignoring Extension Blocks >= 2.

EDID conformity: FAIL
