edid-decode (hex):

00 ff ff ff ff ff ff 00 4c 83 30 30 00 00 00 00
00 18 01 04 a5 1b 10 78 0a ce 85 9e 5b 4c 94 26
17 50 54 00 00 00 01 01 01 01 01 01 01 01 01 01
01 01 01 01 01 01 14 6a 00 a0 a0 40 40 60 30 20
25 00 06 a4 10 00 00 19 00 00 00 0f 00 00 00 00
00 00 00 00 00 1e 82 10 52 00 00 00 00 fe 00 53
41 4d 53 55 4e 47 0a 20 20 20 20 20 00 00 00 fe
00 31 32 32 44 4c 30 31 2d 43 30 31 0a 20 00 0f

00 ff ff ff ff ff ff 00 4c 83 30 30 00 00 00 00
00 18 01 04 a5 1b 10 78 0a ce 85 9e 5b 4c 94 26
17 50 54 00 00 00 01 01 01 01 01 01 01 01 01 01
01 01 01 01 01 01 14 6a 00 a0 a0 40 40 60 30 20
25 00 06 a4 10 00 00 19 00 00 00 0f 00 00 00 00
00 00 00 00 00 1e 82 10 52 00 00 00 00 fe 00 53
41 4d 53 55 4e 47 0a 20 20 20 20 20 00 00 00 fe
00 31 32 32 44 4c 30 31 2d 43 30 31 0a 20 00 0f

----------------

Block 0, Base EDID:
  EDID Structure Version & Revision: 1.4
  Vendor & Product Identification:
    Manufacturer: SDC
    Model: 12336
    Made in: 2014
  Basic Display Parameters & Features:
    Digital display
    Bits per primary color channel: 8
    DisplayPort interface
    Maximum image size: 27 cm x 16 cm
    Gamma: 2.20
    Supported color formats: RGB 4:4:4, YCrCb 4:4:4
    First detailed timing includes the native pixel format and preferred refresh rate
  Color Characteristics:
    Red  : 0.6201, 0.3554
    Green: 0.2998, 0.5800
    Blue : 0.1503, 0.0898
    White: 0.3134, 0.3291
  Established Timings I & II: none
  Standard Timings: none
  Detailed Timing Descriptors:
    DTD 1:  2560x1600   59.998939 Hz  16:10    99.838 kHz    271.560000 MHz (262 mm x 164 mm)
                 Hfront   48 Hsync  32 Hback   80 Hpol N
                 Vfront    2 Vsync   5 Vback   57 Vpol N
    Manufacturer-Specified Display Descriptor (0x0f): 00 0f 00 00 00 00 00 00 00 00 00 1e 82 10 52 00 '..............R.'
    Alphanumeric Data String: 'SAMSUNG'
    Alphanumeric Data String: '122DL01-C01'
Checksum: 0x0f

----------------

Warnings:

Block 0, Base EDID:
  Missing Display Product Name.

Failures:

EDID:
  Extension Block 1 started with EDID header, ignoring Extension Blocks >= 1.

EDID conformity: FAIL
