edid-decode (hex):

00 ff ff ff ff ff ff 00 09 e5 5f 0c 00 00 00 00
1a 21 01 04 a5 23 16 78 03 27 15 95 5b 5a 93 29
20 50 54 00 00 00 01 01 01 01 01 01 01 01 01 01
01 01 01 01 01 01 af 41 80 54 71 b0 28 40 30 20
36 00 59 d7 10 00 00 1a 00 00 00 10 20 20 20 20
20 20 20 20 20 20 20 20 20 20 00 00 00 fe 00 42
4f 45 20 43 51 0a 20 20 20 20 20 20 00 00 00 fe
00 4e 56 31 36 30 57 55 4d 2d 4e 48 34 0a 00 7c

00 ff ff ff ff ff ff 00 09 e5 5f 0c 00 00 00 00
1a 21 01 04 a5 23 16 78 03 27 15 95 5b 5a 93 29
20 50 54 00 00 00 01 01 01 01 01 01 01 01 01 01
01 01 01 01 01 01 af 41 80 54 71 b0 28 40 30 20
36 00 59 d7 10 00 00 1a 00 00 00 10 20 20 20 20
20 20 20 20 20 20 20 20 20 20 00 00 00 fe 00 42
4f 45 20 43 51 0a 20 20 20 20 20 20 00 00 00 fe
00 4e 56 31 36 30 57 55 4d 2d 4e 48 34 0a 00 7c

----------------

Block 0, Base EDID:
  EDID Structure Version & Revision: 1.4
  Vendor & Product Identification:
    Manufacturer: BOE
    Model: 3167
    Made in: week 26 of 2023
  Basic Display Parameters & Features:
    Digital display
    Bits per primary color channel: 8
    DisplayPort interface
    Maximum image size: 35 cm x 22 cm
    Gamma: 2.20
    Supported color formats: RGB 4:4:4
    First detailed timing includes the native pixel format and preferred refresh rate
    Display supports continuous frequencies
  Color Characteristics:
    Red  : 0.5820, 0.3574
    Green: 0.3525, 0.5771
    Blue : 0.1601, 0.1259
    White: 0.3134, 0.3291
  Established Timings I & II: none
  Standard Timings: none
  Detailed Timing Descriptors:
    DTD 1:  1920x1200   60.002141 Hz  16:10    74.403 kHz    168.150000 MHz (345 mm x 215 mm)
                 Hfront   48 Hsync  32 Hback  260 Hpol P
                 Vfront    3 Vsync   6 Vback   31 Vpol N
    Dummy Descriptor:
    Alphanumeric Data String: 'BOE CQ'
    Alphanumeric Data String: 'NV160WUM-NH4'
Checksum: 0x7c

----------------

Warnings:

Block 0, Base EDID:
  Missing Display Product Name.

Failures:

Block 0, Base EDID:
  Display Descriptor #2: Monitor descriptor block has byte 4 nonzero (0x20).
  Dummy Descriptor: Dummy block filled with garbage.
  Missing Display Range Limits Descriptor.
EDID:
  Extension Block 1 started with EDID header, ignoring Extension Blocks >= 1.

EDID conformity: FAIL
