edid-decode (hex):

00 ff ff ff ff ff ff 00 0d ae 53 11 00 00 00 00
09 1f 01 04 95 1a 0e 78 02 14 35 92 55 53 95 29
24 50 54 00 00 00 d1 c0 01 01 01 01 01 01 01 01
01 01 01 01 01 01 da 1d 56 e2 50 00 20 30 88 1e
8c 00 55 c0 10 00 00 1a e0 2e 56 95 50 00 18 30
30 20 33 00 55 c0 10 00 00 1a e0 2e 56 95 50 00
07 30 30 20 33 00 55 c0 10 00 00 1a 07 2b 56 a0
50 00 22 30 30 20 35 00 55 c0 10 00 00 1a 01 77

02 03 0b 00 e6 06 01 01 4a 4a 1a 00 00 00 00 00
00 00 00 00 00 00 00 00 00 00 00 00 00 00 00 00
00 00 00 00 00 00 00 00 00 00 00 00 00 00 00 00
00 00 00 00 00 00 00 00 00 00 00 00 00 00 00 00
00 00 00 00 00 00 00 00 00 00 00 00 00 00 00 00
00 00 00 00 00 00 00 00 00 00 00 00 00 00 00 00
00 00 00 00 00 00 00 00 00 00 00 00 00 00 00 00
00 00 00 00 00 00 00 00 00 00 00 00 00 00 00 54

00 ff ff ff ff ff ff 00 0d ae 53 11 00 00 00 00
09 1f 01 04 95 1a 0e 78 02 14 35 92 55 53 95 29
24 50 54 00 00 00 d1 c0 01 01 01 01 01 01 01 01
01 01 01 01 01 01 da 1d 56 e2 50 00 20 30 88 1e
8c 00 55 c0 10 00 00 1a e0 2e 56 95 50 00 18 30
30 20 33 00 55 c0 10 00 00 1a e0 2e 56 95 50 00
07 30 30 20 33 00 55 c0 10 00 00 1a 07 2b 56 a0
50 00 22 30 30 20 35 00 55 c0 10 00 00 1a 01 77

02 03 0b 00 e6 06 01 01 4a 4a 1a 00 00 00 00 00
00 00 00 00 00 00 00 00 00 00 00 00 00 00 00 00
00 00 00 00 00 00 00 00 00 00 00 00 00 00 00 00
00 00 00 00 00 00 00 00 00 00 00 00 00 00 00 00
00 00 00 00 00 00 00 00 00 00 00 00 00 00 00 00
00 00 00 00 00 00 00 00 00 00 00 00 00 00 00 00
00 00 00 00 00 00 00 00 00 00 00 00 00 00 00 00
00 00 00 00 00 00 00 00 00 00 00 00 00 00 00 54

----------------

Block 0, Base EDID:
  EDID Structure Version & Revision: 1.4
  Vendor & Product Identification:
    Manufacturer: CMN
    Model: 4435
    Made in: week 9 of 2021
  Basic Display Parameters & Features:
    Digital display
    Bits per primary color channel: 6
    DisplayPort interface
    Maximum image size: 26 cm x 14 cm
    Gamma: 2.20
    Supported color formats: RGB 4:4:4
    First detailed timing includes the native pixel format and preferred refresh rate
  Color Characteristics:
    Red  : 0.5703, 0.3330
    Green: 0.3251, 0.5820
    Blue : 0.1601, 0.1435
    White: 0.3134, 0.3291
  Established Timings I & II: none
  Standard Timings:
    DMT 0x52:  1920x1080   60.000000 Hz  16:9     67.500 kHz    148.500000 MHz
  Detailed Timing Descriptors:
    DTD 1:  1366x768    60.003141 Hz 683:384   48.003 kHz     76.420000 MHz (341 mm x 192 mm)
                 Hfront  136 Hsync  30 Hback   60 Hpol P
                 Vfront    8 Vsync  12 Vback   12 Vpol N
    DTD 2:  1366x768   100.010001 Hz 683:384   79.208 kHz    120.000000 MHz (341 mm x 192 mm)
                 Hfront   48 Hsync  32 Hback   69 Hpol P
                 Vfront    3 Vsync   3 Vback   18 Vpol N
    DTD 3:  1366x768   102.203769 Hz 683:384   79.208 kHz    120.000000 MHz (341 mm x 192 mm)
                 Hfront   48 Hsync  32 Hback   69 Hpol P
                 Vfront    3 Vsync   3 Vback    1 Vpol N
    DTD 4:  1366x768    90.002713 Hz 683:384   72.182 kHz    110.150000 MHz (341 mm x 192 mm)
                 Hfront   48 Hsync  32 Hback   80 Hpol P
                 Vfront    3 Vsync   5 Vback   26 Vpol N
  Extension blocks: 1
Checksum: 0x77

----------------

Block 1, CTA-861 Extension Block:
  Revision: 3
  Native DTDs: 0
  HDR Static Metadata Data Block:
    Electro optical transfer functions:
      Traditional gamma - SDR luminance range
    Supported static metadata descriptors:
      Static metadata type 1
    Desired content max luminance: 74 (248.372 cd/m^2)
    Desired content max frame-average luminance: 74 (248.372 cd/m^2)
    Desired content min luminance: 26 (0.026 cd/m^2)
Checksum: 0x54  Unused space in Extension Block: 116 bytes

----------------

Warnings:

Block 0, Base EDID:
  Missing Display Product Name.
Block 1, CTA-861 Extension Block:
  IT Video Formats are overscanned by default, but normally this should be underscanned.
  Add a Colorimetry Data Block with the sRGB colorimetry bit set to avoid interop issues.

Failures:

Block 0, Base EDID:
  Detailed Timing Descriptor #1: Mismatch of image size 341x192 mm vs display size 260x140 mm.
  Detailed Timing Descriptor #2: Mismatch of image size 341x192 mm vs display size 260x140 mm.
  Detailed Timing Descriptor #3: Mismatch of image size 341x192 mm vs display size 260x140 mm.
  Detailed Timing Descriptor #4: Mismatch of image size 341x192 mm vs display size 260x140 mm.
Block 1, CTA-861 Extension Block:
  Required 640x480p60 timings are missing in the established timings and the SVD list (VIC 1).
  Missing VCDB, needed for Set Selectable RGB Quantization to avoid interop issues.
EDID:
  Extension Block 2 started with EDID header, ignoring Extension Blocks >= 2.
  Base EDID: The DTD max image size is 341x192mm, which is larger than the display size 260.0x140.0mm.

EDID conformity: FAIL
