edid-decode (hex):

00 ff ff ff ff ff ff 00 30 ae a9 40 00 00 00 00
00 1e 01 04 a5 1f 11 78 e2 5f f5 96 5d 55 92 29
1d 50 54 00 00 00 01 01 01 01 01 01 01 01 01 01
01 01 01 01 01 01 85 40 80 2c 71 38 a0 40 30 20
36 00 35 ad 10 00 00 1a 85 40 80 2c 71 38 a0 40
30 20 36 00 35 ad 10 00 00 1a 00 00 00 0f 00 d1
09 3c d1 09 3c 1e 0a 00 09 e5 de 09 00 00 00 fe
00 4e 56 31 34 30 46 48 4d 2d 4e 34 56 0a 00 54

00 ff ff ff ff ff ff 00 30 ae a9 40 00 00 00 00
00 1e 01 04 a5 1f 11 78 e2 5f f5 96 5d 55 92 29
1d 50 54 00 00 00 01 01 01 01 01 01 01 01 01 01
01 01 01 01 01 01 85 40 80 2c 71 38 a0 40 30 20
36 00 35 ad 10 00 00 1a 85 40 80 2c 71 38 a0 40
30 20 36 00 35 ad 10 00 00 1a 00 00 00 0f 00 d1
09 3c d1 09 3c 1e 0a 00 09 e5 de 09 00 00 00 fe
00 4e 56 31 34 30 46 48 4d 2d 4e 34 56 0a 00 54

----------------

Block 0, Base EDID:
  EDID Structure Version & Revision: 1.4
  Vendor & Product Identification:
    Manufacturer: LEN
    Model: 16553
    Made in: 2020
  Basic Display Parameters & Features:
    Digital display
    Bits per primary color channel: 8
    DisplayPort interface
    Maximum image size: 31 cm x 17 cm
    Gamma: 2.20
    DPMS levels: Standby Suspend Off
    Supported color formats: RGB 4:4:4
    First detailed timing includes the native pixel format and preferred refresh rate
  Color Characteristics:
    Red  : 0.5869, 0.3642
    Green: 0.3349, 0.5732
    Blue : 0.1630, 0.1162
    White: 0.3134, 0.3291
  Established Timings I & II: none
  Standard Timings: none
  Detailed Timing Descriptors:
    DTD 1:  1920x1080   60.000727 Hz  16:9     74.401 kHz    165.170000 MHz (309 mm x 173 mm)
                 Hfront   48 Hsync  32 Hback  220 Hpol P
                 Vfront    3 Vsync   6 Vback  151 Vpol N
    DTD 2:  1920x1080   60.000727 Hz  16:9     74.401 kHz    165.170000 MHz (309 mm x 173 mm)
                 Hfront   48 Hsync  32 Hback  220 Hpol P
                 Vfront    3 Vsync   6 Vback  151 Vpol N
    Manufacturer-Specified Display Descriptor (0x0f): 00 0f 00 d1 09 3c d1 09 3c 1e 0a 00 09 e5 de 09 '.....<..<.......'
    Alphanumeric Data String: 'NV140FHM-N4V'
Checksum: 0x54

----------------

Warnings:

Block 0, Base EDID:
  Missing Display Product Name.

Failures:

EDID:
  Extension Block 1 started with EDID header, ignoring Extension Blocks >= 1.

EDID conformity: FAIL
