edid-decode (hex):

00 ff ff ff ff ff ff 00 30 ae a9 40 00 00 00 00
00 1e 01 04 95 1f 11 78 e2 f5 65 8f 55 5a 93 2a
1f 50 54 00 00 00 01 01 01 01 01 01 01 01 01 01
01 01 01 01 01 01 77 3f 80 3c 71 38 82 40 10 10
3e 00 35 ae 10 00 00 18 77 3f 80 3c 71 38 82 40
10 10 3e 00 35 ae 10 00 00 18 00 00 00 0f 00 d1
09 3c d1 09 3c 1e 0a 00 06 af 3d 32 00 00 00 fe
00 42 31 34 30 48 41 4b 30 33 2e 32 20 0a 00 2c

00 ff ff ff ff ff ff 00 30 ae a9 40 00 00 00 00
00 1e 01 04 95 1f 11 78 e2 f5 65 8f 55 5a 93 2a
1f 50 54 00 00 00 01 01 01 01 01 01 01 01 01 01
01 01 01 01 01 01 77 3f 80 3c 71 38 82 40 10 10
3e 00 35 ae 10 00 00 18 77 3f 80 3c 71 38 82 40
10 10 3e 00 35 ae 10 00 00 18 00 00 00 0f 00 d1
09 3c d1 09 3c 1e 0a 00 06 af 3d 32 00 00 00 fe
00 42 31 34 30 48 41 4b 30 33 2e 32 20 0a 00 2c

----------------

Block 0, Base EDID:
  EDID Structure Version & Revision: 1.4
  Vendor & Product Identification:
    Manufacturer: LEN
    Model: 16553
    Made in: 2020
  Basic Display Parameters & Features:
    Digital display
    Bits per primary color channel: 6
    DisplayPort interface
    Maximum image size: 31 cm x 17 cm
    Gamma: 2.20
    DPMS levels: Standby Suspend Off
    Supported color formats: RGB 4:4:4
    First detailed timing includes the native pixel format and preferred refresh rate
  Color Characteristics:
    Red  : 0.5615, 0.3349
    Green: 0.3525, 0.5751
    Blue : 0.1650, 0.1230
    White: 0.3134, 0.3291
  Established Timings I & II: none
  Standard Timings: none
  Detailed Timing Descriptors:
    DTD 1:  1920x1080   60.050415 Hz  16:9     72.661 kHz    162.470000 MHz (309 mm x 174 mm)
                 Hfront   16 Hsync  16 Hback  284 Hpol N
                 Vfront    3 Vsync  14 Vback  113 Vpol N
    DTD 2:  1920x1080   60.050415 Hz  16:9     72.661 kHz    162.470000 MHz (309 mm x 174 mm)
                 Hfront   16 Hsync  16 Hback  284 Hpol N
                 Vfront    3 Vsync  14 Vback  113 Vpol N
    Manufacturer-Specified Display Descriptor (0x0f): 00 0f 00 d1 09 3c d1 09 3c 1e 0a 00 06 af 3d 32 '.....<..<.....=2'
    Alphanumeric Data String: 'B140HAK03.2 '
Checksum: 0x2c

----------------

Warnings:

Block 0, Base EDID:
  Missing Display Product Name.

Failures:

Block 0, Base EDID:
  Alphanumeric Data String: One or more trailing spaces before newline.
EDID:
  Extension Block 1 started with EDID header, ignoring Extension Blocks >= 1.

EDID conformity: FAIL
