edid-decode (hex):

00 ff ff ff ff ff ff 00 30 ae a9 40 00 00 00 00
01 1f 01 04 a5 1f 11 78 e3 4a 55 97 5e 59 92 29
21 50 54 00 00 00 01 01 01 01 01 01 01 01 01 01
01 01 01 01 01 01 c8 3a 80 18 71 38 3c 40 30 20
36 00 35 ae 10 00 00 18 00 00 00 fd 00 28 3c 44
44 0f 01 0a 20 20 20 20 20 20 00 00 00 0f 00 d1
09 3c d1 09 28 1e 0a 00 09 e5 63 0a 00 00 00 fe
00 4e 56 31 34 30 46 48 4d 2d 54 30 43 0a 00 a0

00 ff ff ff ff ff ff 00 30 ae a9 40 00 00 00 00
01 1f 01 04 a5 1f 11 78 e3 4a 55 97 5e 59 92 29
21 50 54 00 00 00 01 01 01 01 01 01 01 01 01 01
01 01 01 01 01 01 c8 3a 80 18 71 38 3c 40 30 20
36 00 35 ae 10 00 00 18 00 00 00 fd 00 28 3c 44
44 0f 01 0a 20 20 20 20 20 20 00 00 00 0f 00 d1
09 3c d1 09 28 1e 0a 00 09 e5 63 0a 00 00 00 fe
00 4e 56 31 34 30 46 48 4d 2d 54 30 43 0a 00 a0

----------------

Block 0, Base EDID:
  EDID Structure Version & Revision: 1.4
  Vendor & Product Identification:
    Manufacturer: LEN
    Model: 16553
    Made in: week 1 of 2021
  Basic Display Parameters & Features:
    Digital display
    Bits per primary color channel: 8
    DisplayPort interface
    Maximum image size: 31 cm x 17 cm
    Gamma: 2.20
    DPMS levels: Standby Suspend Off
    Supported color formats: RGB 4:4:4
    First detailed timing includes the native pixel format and preferred refresh rate
    Display supports continuous frequencies
  Color Characteristics:
    Red  : 0.5908, 0.3671
    Green: 0.3496, 0.5722
    Blue : 0.1611, 0.1298
    White: 0.3134, 0.3291
  Established Timings I & II: none
  Standard Timings: none
  Detailed Timing Descriptors:
    DTD 1:  1920x1080   60.000000 Hz  16:9     68.400 kHz    150.480000 MHz (309 mm x 174 mm)
                 Hfront   48 Hsync  32 Hback  200 Hpol N
                 Vfront    3 Vsync   6 Vback   51 Vpol N
    Display Range Limits:
      Monitor ranges (Range Limits Only): 40-60 Hz V, 68-68 kHz H, max dotclock 150 MHz
    Manufacturer-Specified Display Descriptor (0x0f): 00 0f 00 d1 09 3c d1 09 28 1e 0a 00 09 e5 63 0a '.....<..(.....c.'
    Alphanumeric Data String: 'NV140FHM-T0C'
Checksum: 0xa0

----------------

Warnings:

Block 0, Base EDID:
  Missing Display Product Name.
EDID:
  Base EDID: Some timings are out of range of the Monitor Ranges:
    Maximum Clock: 150.480 MHz (Monitor: 150.000 MHz)
    Could be due to a Monitor Range off-by-one rounding issue

Failures:

EDID:
  Extension Block 1 started with EDID header, ignoring Extension Blocks >= 1.

EDID conformity: FAIL
