edid-decode (hex):

00 ff ff ff ff ff ff 00 30 ae a9 40 00 00 00 00
00 1c 01 04 95 1f 11 78 e2 76 90 94 55 54 90 27
21 50 54 00 00 00 01 01 01 01 01 01 01 01 01 01
01 01 01 01 01 01 38 36 80 a0 70 38 20 40 18 30
3c 00 35 ae 10 00 00 19 5c 2b 80 a0 70 38 20 40
18 30 3c 00 35 ae 10 00 00 19 00 00 00 0f 00 d1
09 3c d1 09 30 1e 0a 00 26 cf 7d 05 00 00 00 fe
00 52 31 34 30 4e 57 46 35 20 52 41 20 0a 00 1b

00 ff ff ff ff ff ff 00 30 ae a9 40 00 00 00 00
00 1c 01 04 95 1f 11 78 e2 76 90 94 55 54 90 27
21 50 54 00 00 00 01 01 01 01 01 01 01 01 01 01
01 01 01 01 01 01 38 36 80 a0 70 38 20 40 18 30
3c 00 35 ae 10 00 00 19 5c 2b 80 a0 70 38 20 40
18 30 3c 00 35 ae 10 00 00 19 00 00 00 0f 00 d1
09 3c d1 09 30 1e 0a 00 26 cf 7d 05 00 00 00 fe
00 52 31 34 30 4e 57 46 35 20 52 41 20 0a 00 1b

----------------

Block 0, Base EDID:
  EDID Structure Version & Revision: 1.4
  Vendor & Product Identification:
    Manufacturer: LEN
    Model: 16553
    Made in: 2018
  Basic Display Parameters & Features:
    Digital display
    Bits per primary color channel: 6
    DisplayPort interface
    Maximum image size: 31 cm x 17 cm
    Gamma: 2.20
    DPMS levels: Standby Suspend Off
    Supported color formats: RGB 4:4:4
    First detailed timing includes the native pixel format and preferred refresh rate
  Color Characteristics:
    Red  : 0.5791, 0.3349
    Green: 0.3291, 0.5644
    Blue : 0.1542, 0.1298
    White: 0.3125, 0.3281
  Established Timings I & II: none
  Standard Timings: none
  Detailed Timing Descriptors:
    DTD 1:  1920x1080   60.009685 Hz  16:9     66.731 kHz    138.800000 MHz (309 mm x 174 mm)
                 Hfront   24 Hsync  48 Hback   88 Hpol N
                 Vfront    3 Vsync  12 Vback   17 Vpol N
    DTD 2:  1920x1080   47.990454 Hz  16:9     53.365 kHz    111.000000 MHz (309 mm x 174 mm)
                 Hfront   24 Hsync  48 Hback   88 Hpol N
                 Vfront    3 Vsync  12 Vback   17 Vpol N
    Manufacturer-Specified Display Descriptor (0x0f): 00 0f 00 d1 09 3c d1 09 30 1e 0a 00 26 cf 7d 05 '.....<..0...&.}.'
    Alphanumeric Data String: 'R140NWF5 RA '
Checksum: 0x1b

----------------

Warnings:

Block 0, Base EDID:
  Missing Display Product Name.

Failures:

Block 0, Base EDID:
  Alphanumeric Data String: One or more trailing spaces before newline.
EDID:
  Extension Block 1 started with EDID header, ignoring Extension Blocks >= 1.

EDID conformity: FAIL
