edid-decode (hex):

00 ff ff ff ff ff ff 00 30 ae a9 40 00 00 00 00
10 1e 01 04 a5 1f 11 78 e2 9b 85 92 56 59 90 29
20 50 54 00 00 00 01 01 01 01 01 01 01 01 01 01
01 01 01 01 01 01 4b 3f 80 36 71 38 82 40 10 10
3e 00 35 ae 10 00 00 18 a2 32 80 36 71 38 82 40
10 10 3e 00 35 ae 10 00 00 18 00 00 00 0f 00 d1
09 3c d1 09 30 19 0a 00 06 af 3d 40 00 00 00 fe
00 42 31 34 30 48 41 4e 30 34 2e 30 20 0a 00 61

00 ff ff ff ff ff ff 00 30 ae a9 40 00 00 00 00
10 1e 01 04 a5 1f 11 78 e2 9b 85 92 56 59 90 29
20 50 54 00 00 00 01 01 01 01 01 01 01 01 01 01
01 01 01 01 01 01 4b 3f 80 36 71 38 82 40 10 10
3e 00 35 ae 10 00 00 18 a2 32 80 36 71 38 82 40
10 10 3e 00 35 ae 10 00 00 18 00 00 00 0f 00 d1
09 3c d1 09 30 19 0a 00 06 af 3d 40 00 00 00 fe
00 42 31 34 30 48 41 4e 30 34 2e 30 20 0a 00 61

----------------

Block 0, Base EDID:
  EDID Structure Version & Revision: 1.4
  Vendor & Product Identification:
    Manufacturer: LEN
    Model: 16553
    Made in: week 16 of 2020
  Basic Display Parameters & Features:
    Digital display
    Bits per primary color channel: 8
    DisplayPort interface
    Maximum image size: 31 cm x 17 cm
    Gamma: 2.20
    DPMS levels: Standby Suspend Off
    Supported color formats: RGB 4:4:4
    First detailed timing includes the native pixel format and preferred refresh rate
  Color Characteristics:
    Red  : 0.5722, 0.3369
    Green: 0.3496, 0.5654
    Blue : 0.1621, 0.1250
    White: 0.3134, 0.3291
  Established Timings I & II: none
  Standard Timings: none
  Detailed Timing Descriptors:
    DTD 1:  1920x1080   60.048920 Hz  16:9     72.659 kHz    162.030000 MHz (309 mm x 174 mm)
                 Hfront   16 Hsync  16 Hback  278 Hpol N
                 Vfront    3 Vsync  14 Vback  113 Vpol N
    DTD 2:  1920x1080   48.037653 Hz  16:9     58.126 kHz    129.620000 MHz (309 mm x 174 mm)
                 Hfront   16 Hsync  16 Hback  278 Hpol N
                 Vfront    3 Vsync  14 Vback  113 Vpol N
    Manufacturer-Specified Display Descriptor (0x0f): 00 0f 00 d1 09 3c d1 09 30 19 0a 00 06 af 3d 40 '.....<..0.....=@'
    Alphanumeric Data String: 'B140HAN04.0 '
Checksum: 0x61

----------------

Warnings:

Block 0, Base EDID:
  Missing Display Product Name.

Failures:

Block 0, Base EDID:
  Alphanumeric Data String: One or more trailing spaces before newline.
EDID:
  Extension Block 1 started with EDID header, ignoring Extension Blocks >= 1.

EDID conformity: FAIL
