edid-decode (hex):

00 ff ff ff ff ff ff 00 04 21 23 20 00 00 00 00
1f 1f 01 04 a5 22 13 78 0a 32 37 98 55 4b 84 24
26 4f 54 00 00 00 01 01 01 01 01 01 01 01 01 01
01 01 01 01 01 01 c7 3a 80 18 71 38 3c 40 30 20
36 00 58 c2 10 00 00 1a 00 00 00 00 00 00 00 00
00 00 00 00 00 00 00 00 00 00 00 00 00 fe 00 57
49 53 54 52 4f 4e 20 54 5a 0a 20 20 00 00 00 fe
00 46 44 31 35 36 48 0a 20 20 20 20 20 20 00 d3

00 ff ff ff ff ff ff 00 04 21 23 20 00 00 00 00
1f 1f 01 04 a5 22 13 78 0a 32 37 98 55 4b 84 24
26 4f 54 00 00 00 01 01 01 01 01 01 01 01 01 01
01 01 01 01 01 01 c7 3a 80 18 71 38 3c 40 30 20
36 00 58 c2 10 00 00 1a 00 00 00 00 00 00 00 00
00 00 00 00 00 00 00 00 00 00 00 00 00 fe 00 57
49 53 54 52 4f 4e 20 54 5a 0a 20 20 00 00 00 fe
00 46 44 31 35 36 48 0a 20 20 20 20 20 20 00 d3

----------------

Block 0, Base EDID:
  EDID Structure Version & Revision: 1.4
  Vendor & Product Identification:
    Manufacturer: AAA
    Model: 8227
    Made in: week 31 of 2021
  Basic Display Parameters & Features:
    Digital display
    Bits per primary color channel: 8
    DisplayPort interface
    Maximum image size: 34 cm x 19 cm
    Gamma: 2.20
    Supported color formats: RGB 4:4:4, YCrCb 4:4:4
    First detailed timing includes the native pixel format and preferred refresh rate
  Color Characteristics:
    Red  : 0.5937, 0.3349
    Green: 0.2929, 0.5175
    Blue : 0.1406, 0.1513
    White: 0.3095, 0.3310
  Established Timings I & II: none
  Standard Timings: none
  Detailed Timing Descriptors:
    DTD 1:  1920x1080   59.996013 Hz  16:9     68.395 kHz    150.470000 MHz (344 mm x 194 mm)
                 Hfront   48 Hsync  32 Hback  200 Hpol P
                 Vfront    3 Vsync   6 Vback   51 Vpol N
    Empty Descriptor
    Alphanumeric Data String: 'WISTRON TZ'
    Alphanumeric Data String: 'FD156H'
Checksum: 0xd3

----------------

Warnings:

Block 0, Base EDID:
  Missing Display Product Name.

Failures:

Block 0, Base EDID:
  Empty Descriptor: Use Dummy Descriptor instead of all zeroes.
EDID:
  Extension Block 1 started with EDID header, ignoring Extension Blocks >= 1.

EDID conformity: FAIL
