edid-decode (hex):

00 ff ff ff ff ff ff 00 06 af ed 30 00 00 00 00
00 1a 01 04 95 22 13 78 02 b0 e5 94 58 5a 92 28
21 50 54 00 00 00 01 01 01 01 01 01 01 01 01 01
01 01 01 01 01 01 78 37 80 b4 70 38 2e 40 6c 30
aa 00 58 c1 10 00 00 1a 60 2c 80 b4 70 38 2e 40
6c 30 aa 00 58 c1 10 00 00 1a 00 00 00 fe 00 35
4a 58 4d 46 80 42 31 35 36 48 41 4b 00 00 00 00
00 00 41 02 96 01 10 00 00 0a 01 0a 20 20 00 ad

00 ff ff ff ff ff ff 00 06 af ed 30 00 00 00 00
00 1a 01 04 95 22 13 78 02 b0 e5 94 58 5a 92 28
21 50 54 00 00 00 01 01 01 01 01 01 01 01 01 01
01 01 01 01 01 01 78 37 80 b4 70 38 2e 40 6c 30
aa 00 58 c1 10 00 00 1a 60 2c 80 b4 70 38 2e 40
6c 30 aa 00 58 c1 10 00 00 1a 00 00 00 fe 00 35
4a 58 4d 46 80 42 31 35 36 48 41 4b 00 00 00 00
00 00 41 02 96 01 10 00 00 0a 01 0a 20 20 00 ad

----------------

Block 0, Base EDID:
  EDID Structure Version & Revision: 1.4
  Vendor & Product Identification:
    Manufacturer: AUO
    Model: 12525
    Made in: 2016
  Basic Display Parameters & Features:
    Digital display
    Bits per primary color channel: 6
    DisplayPort interface
    Maximum image size: 34 cm x 19 cm
    Gamma: 2.20
    Supported color formats: RGB 4:4:4
    First detailed timing includes the native pixel format and preferred refresh rate
  Color Characteristics:
    Red  : 0.5800, 0.3466
    Green: 0.3515, 0.5703
    Blue : 0.1591, 0.1308
    White: 0.3134, 0.3291
  Established Timings I & II: none
  Standard Timings: none
  Detailed Timing Descriptors:
    DTD 1:  1920x1080   60.052440 Hz  16:9     67.619 kHz    142.000000 MHz (344 mm x 193 mm)
                 Hfront  108 Hsync  48 Hback   24 Hpol P
                 Vfront   10 Vsync  10 Vback   26 Vpol N
    DTD 2:  1920x1080   48.041952 Hz  16:9     54.095 kHz    113.600000 MHz (344 mm x 193 mm)
                 Hfront  108 Hsync  48 Hback   24 Hpol P
                 Vfront   10 Vsync  10 Vback   26 Vpol N
    Alphanumeric Data String: '5JXMF.B156HAK'
    Manufacturer-Specified Display Descriptor (0x00): 00 00 00 00 41 02 96 01 10 00 00 0a 01 0a 20 20 '....A.........  '
Checksum: 0xad

----------------

Block 1, Unknown EDID Extension Block 0x00:
  00 ff ff ff ff ff ff 00 06 af ed 30 00 00 00 00 '...........0....'
  00 1a 01 04 95 22 13 78 02 b0 e5 94 58 5a 92 28 '.....".x....XZ.('
  21 50 54 00 00 00 01 01 01 01 01 01 01 01 01 01 '!PT.............'
  01 01 01 01 01 01 78 37 80 b4 70 38 2e 40 6c 30 '......x7..p8.@l0'
  aa 00 58 c1 10 00 00 1a 60 2c 80 b4 70 38 2e 40 '..X.....`,..p8.@'
  6c 30 aa 00 58 c1 10 00 00 1a 00 00 00 fe 00 35 'l0..X..........5'
  4a 58 4d 46 80 42 31 35 36 48 41 4b 00 00 00 00 'JXMF.B156HAK....'
  00 00 41 02 96 01 10 00 00 0a 01 0a 20 20 00 ad '..A.........  ..'
Checksum: 0xad

----------------

Warnings:

Block 0, Base EDID:
  Alphanumeric Data String: Non-ASCII character 0x80 at position 5, can cause problems.
  Missing Display Product Name.

Failures:

Block 1, Base EDID:
  Unknown Extension Block.
EDID:
  Base EDID: EDID specified 0 extension block(s), but found 1 extension block(s).

EDID conformity: FAIL
