edid-decode (hex):

00 ff ff ff ff ff ff 00 06 af 9e c9 00 00 00 00
00 1e 01 04 b5 22 16 78 02 91 15 a7 54 49 9d 25
0e 50 54 00 00 00 01 01 01 01 01 01 01 01 01 01
01 01 01 01 01 01 58 98 00 c8 c0 80 3e 70 6c 30
aa 00 58 d7 10 00 00 1a e0 79 00 c8 c0 80 3e 70
6c 30 aa 00 58 d7 10 00 00 1a 00 00 00 fe 00 4e
54 30 39 50 80 42 31 36 30 51 41 4e 00 00 00 00
00 03 41 22 9e 00 11 00 00 0b 01 0a 20 20 00 02

----------------

Block 0, Base EDID:
  EDID Structure Version & Revision: 1.4
  Vendor & Product Identification:
    Manufacturer: AUO
    Model: 51614
    Made in: 2020
  Basic Display Parameters & Features:
    Digital display
    Bits per primary color channel: 10
    DisplayPort interface
    Maximum image size: 34 cm x 22 cm
    Gamma: 2.20
    Supported color formats: RGB 4:4:4
    First detailed timing includes the native pixel format and preferred refresh rate
  Color Characteristics:
    Red  : 0.6542, 0.3291
    Green: 0.2851, 0.6142
    Blue : 0.1445, 0.0556
    White: 0.3134, 0.3291
  Established Timings I & II: none
  Standard Timings: none
  Detailed Timing Descriptors:
    DTD 1:  3072x1920   60.137817 Hz  16:10   119.193 kHz    390.000000 MHz (344 mm x 215 mm)
                 Hfront  108 Hsync  48 Hback   44 Hpol P
                 Vfront   10 Vsync  10 Vback   42 Vpol N
    DTD 2:  3072x1920   48.110254 Hz  16:10    95.355 kHz    312.000000 MHz (344 mm x 215 mm)
                 Hfront  108 Hsync  48 Hback   44 Hpol P
                 Vfront   10 Vsync  10 Vback   42 Vpol N
    Alphanumeric Data String: 'NT09P.B160QAN'
    Manufacturer-Specified Display Descriptor (0x00): 00 00 00 03 41 22 9e 00 11 00 00 0b 01 0a 20 20 '....A"........  '
Checksum: 0x02

----------------

Warnings:

Block 0, Base EDID:
  Alphanumeric Data String: Non-ASCII character 0x80 at position 5, can cause problems.
  Missing Display Product Name.

EDID conformity: PASS
