edid-decode (hex):

00 ff ff ff ff ff ff 00 36 69 c8 4c 00 00 00 00
18 21 01 03 80 3e 22 78 2a ad a5 ad 50 45 9f 25
0e 50 54 23 08 00 81 c0 81 40 81 80 95 00 b3 00
d1 c0 01 01 01 01 60 db 00 40 f1 70 5a 80 40 40
8a 00 6d 55 21 00 00 1a 00 00 00 ff 00 43 43 38
51 32 33 33 36 30 31 32 37 30 00 00 00 fd 00 28
3c 1f 87 3c 00 0a 20 20 20 20 20 20 00 00 00 fc
00 4d 53 49 20 47 32 38 31 55 56 0a 20 20 01 02

02 03 3d 71 45 61 01 04 10 4c 23 09 07 07 83 01
00 00 e2 00 6a 67 03 0c 00 10 00 18 44 67 d8 5d
c4 01 78 80 01 68 1a 00 00 01 01 28 3c e6 e3 05
c0 00 e3 0f 01 00 e6 06 05 01 65 65 00 68 5e 00
a0 a0 a0 29 50 30 20 b8 04 6d 55 21 00 00 1a 02
3a 80 18 71 38 2d 40 58 2c 45 00 6d 55 21 00 00
1a 00 00 00 00 00 00 00 00 00 00 00 00 00 00 00
00 00 00 00 00 00 00 00 00 00 00 00 00 00 00 03

00 ff ff ff ff ff ff 00 36 69 c8 4c 00 00 00 00
18 21 01 03 80 3e 22 78 2a ad a5 ad 50 45 9f 25
0e 50 54 23 08 00 81 c0 81 40 81 80 95 00 b3 00
d1 c0 01 01 01 01 60 db 00 40 f1 70 5a 80 40 40
8a 00 6d 55 21 00 00 1a 00 00 00 ff 00 43 43 38
51 32 33 33 36 30 31 32 37 30 00 00 00 fd 00 28
3c 1f 87 3c 00 0a 20 20 20 20 20 20 00 00 00 fc
00 4d 53 49 20 47 32 38 31 55 56 0a 20 20 01 02

02 03 3d 71 45 61 01 04 10 4c 23 09 07 07 83 01
00 00 e2 00 6a 67 03 0c 00 10 00 18 44 67 d8 5d
c4 01 78 80 01 68 1a 00 00 01 01 28 3c e6 e3 05
c0 00 e3 0f 01 00 e6 06 05 01 65 65 00 68 5e 00
a0 a0 a0 29 50 30 20 b8 04 6d 55 21 00 00 1a 02
3a 80 18 71 38 2d 40 58 2c 45 00 6d 55 21 00 00
1a 00 00 00 00 00 00 00 00 00 00 00 00 00 00 00
00 00 00 00 00 00 00 00 00 00 00 00 00 00 00 03

----------------

Block 0, Base EDID:
  EDID Structure Version & Revision: 1.3
  Vendor & Product Identification:
    Manufacturer: MSI
    Model: 19656
    Made in: week 24 of 2023
  Basic Display Parameters & Features:
    Digital display
    Maximum image size: 62 cm x 34 cm
    Gamma: 2.20
    DPMS levels: Off
    RGB color display
    First detailed timing is the preferred timing
  Color Characteristics:
    Red  : 0.6777, 0.3144
    Green: 0.2724, 0.6220
    Blue : 0.1464, 0.0566
    White: 0.3134, 0.3291
  Established Timings I & II:
    DMT 0x04:   640x480    59.940476 Hz   4:3     31.469 kHz     25.175000 MHz
    DMT 0x08:   800x600    56.250000 Hz   4:3     35.156 kHz     36.000000 MHz
    DMT 0x09:   800x600    60.316541 Hz   4:3     37.879 kHz     40.000000 MHz
    DMT 0x10:  1024x768    60.003840 Hz   4:3     48.363 kHz     65.000000 MHz
  Standard Timings:
    DMT 0x55:  1280x720    60.000000 Hz  16:9     45.000 kHz     74.250000 MHz
    DMT 0x20:  1280x960    60.000000 Hz   4:3     60.000 kHz    108.000000 MHz
    DMT 0x23:  1280x1024   60.019740 Hz   5:4     63.981 kHz    108.000000 MHz
    DMT 0x2f:  1440x900    59.887445 Hz  16:10    55.935 kHz    106.500000 MHz
    DMT 0x3a:  1680x1050   59.954250 Hz  16:10    65.290 kHz    146.250000 MHz
    DMT 0x52:  1920x1080   60.000000 Hz  16:9     67.500 kHz    148.500000 MHz
  Detailed Timing Descriptors:
    DTD 1:  3840x2160   60.000000 Hz  16:9    135.000 kHz    561.600000 MHz (621 mm x 341 mm)
                 Hfront   64 Hsync  64 Hback  192 Hpol P
                 Vfront    8 Vsync  10 Vback   72 Vpol N
    Display Product Serial Number: ...
    Display Range Limits:
      Monitor ranges (GTF): 40-60 Hz V, 31-135 kHz H, max dotclock 600 MHz
    Display Product Name: 'MSI G281UV'
  Extension blocks: 1
Checksum: 0x02

----------------

Block 1, CTA-861 Extension Block:
  Revision: 3
  Basic audio support
  Supports YCbCr 4:4:4
  Supports YCbCr 4:2:2
  Native DTDs: 1
  Video Data Block:
    VIC  97:  3840x2160   60.000000 Hz  16:9    135.000 kHz    594.000000 MHz
    VIC   1:   640x480    59.940476 Hz   4:3     31.469 kHz     25.175000 MHz
    VIC   4:  1280x720    60.000000 Hz  16:9     45.000 kHz     74.250000 MHz
    VIC  16:  1920x1080   60.000000 Hz  16:9     67.500 kHz    148.500000 MHz
    VIC  76:  1920x1080   60.000000 Hz  64:27    67.500 kHz    148.500000 MHz
  Audio Data Block:
    Linear PCM:
      Max channels: 2
      Supported sample rates (kHz): 48 44.1 32
      Supported sample sizes (bits): 24 20 16
  Speaker Allocation Data Block:
    FL/FR - Front Left/Right
  Video Capability Data Block:
    YCbCr quantization: No Data
    RGB quantization: Selectable (via AVI Q)
    PT scan behavior: Always Underscanned
    IT scan behavior: Always Underscanned
    CE scan behavior: Always Underscanned
  Vendor-Specific Data Block (HDMI), OUI 00-0C-03:
    Source physical address: 1.0.0.0
    DC_30bit
    DC_Y444
    Maximum TMDS clock: 340 MHz
  Vendor-Specific Data Block (HDMI Forum), OUI C4-5D-D8:
    Version: 1
    Maximum TMDS Character Rate: 600 MHz
    SCDC Present
    Supports 10-bits/component Deep Color 4:2:0 Pixel Encoding
  Vendor-Specific Data Block (AMD), OUI 00-00-1A:
    Version: 1
    Flags 1: 0x01
      FreeSync Supported
    Minimum Refresh Rate: 40 Hz
    Maximum Refresh Rate: 60 Hz
    MCCS VCP Code: 0xe6
  Colorimetry Data Block:
    BT2020YCC
    BT2020RGB
  YCbCr 4:2:0 Capability Map Data Block:
    VIC  97:  3840x2160   60.000000 Hz  16:9    135.000 kHz    594.000000 MHz
  HDR Static Metadata Data Block:
    Electro optical transfer functions:
      Traditional gamma - SDR luminance range
      SMPTE ST2084
    Supported static metadata descriptors:
      Static metadata type 1
    Desired content max luminance: 101 (445.755 cd/m^2)
    Desired content max frame-average luminance: 101 (445.755 cd/m^2)
    Desired content min luminance: 0 (0.000 cd/m^2)
  Detailed Timing Descriptors:
    DTD 2:  2560x1440   59.995234 Hz  16:9     88.853 kHz    241.680000 MHz (621 mm x 341 mm)
                 Hfront   48 Hsync  32 Hback   80 Hpol P
                 Vfront   27 Vsync   8 Vback    6 Vpol N
    DTD 3:  1920x1080   60.000000 Hz  16:9     67.500 kHz    148.500000 MHz (621 mm x 341 mm)
                 Hfront   88 Hsync  44 Hback  148 Hpol P
                 Vfront    4 Vsync   5 Vback   36 Vpol N
Checksum: 0x03  Unused space in Extension Block: 30 bytes

----------------

Warnings:

Block 1, CTA-861 Extension Block:
  IT Video Formats are overscanned by default, but normally this should be underscanned.
  Video Data Block: VIC 97 and the first DTD are not identical. Is this intended?
  Video Capability Data Block: Set Selectable YCbCr Quantization to avoid interop issues.
  Video Capability Data Block: S_PT is equal to S_IT and S_CE, so should be set to 0 instead.
  Colorimetry Data Block: Set the sRGB colorimetry bit to avoid interop issues.
  Detailed Timing Descriptor #3: DTD is similar but not identical to VIC 16.

Failures:

Block 1, CTA-861 Extension Block:
  Video Capability Data Block: IT video formats are always underscanned, but bit 7 of Byte 3 of the CTA-861 Extension header is set to overscanned.
EDID:
  Extension Block 2 started with EDID header, ignoring Extension Blocks >= 2.

EDID conformity: FAIL
