edid-decode (hex):

00 ff ff ff ff ff ff 00 10 ac 21 d0 4d 46 50 31
0f 13 01 03 68 22 13 78 ee 55 41 a3 55 4a 97 27
15 50 54 a5 4a 00 01 01 01 01 01 01 01 01 01 01
01 01 01 01 01 01 66 21 56 aa 51 00 1e 30 46 8f
33 00 58 c2 10 00 00 1e 00 00 00 ff 00 52 52 30
37 35 39 34 39 31 50 46 4d 0a 00 00 00 fd 00 38
4b 1e 53 09 00 0a 20 20 20 20 20 20 00 00 00 fc
00 44 45 4c 4c 20 45 31 36 30 39 57 0a 20 00 be

00 ff ff ff ff ff ff 00 10 ac 21 d0 4d 46 50 31
0f 13 01 03 68 22 13 78 ee 55 41 a3 55 4a 97 27
15 50 54 a5 4a 00 01 01 01 01 01 01 01 01 01 01
01 01 01 01 01 01 66 21 56 aa 51 00 1e 30 46 8f
33 00 58 c2 10 00 00 1e 00 00 00 ff 00 52 52 30
37 35 39 34 39 31 50 46 4d 0a 00 00 00 fd 00 38
4b 1e 53 09 00 0a 20 20 20 20 20 20 00 00 00 fc
00 44 45 4c 4c 20 45 31 36 30 39 57 0a 20 00 be

----------------

Block 0, Base EDID:
  EDID Structure Version & Revision: 1.3
  Vendor & Product Identification:
    Manufacturer: DEL
    Model: 53281
    Serial Number: ...
    Made in: week 15 of 2009
  Basic Display Parameters & Features:
    Analog display
    Signal Level Standard: 0.700 : 0.000 : 0.700 V p-p
    Blank level equals black level
    Sync: Separate
    Maximum image size: 34 cm x 19 cm
    Gamma: 2.20
    DPMS levels: Standby Suspend Off
    RGB color display
    Default (sRGB) color space is primary color space
    First detailed timing is the preferred timing
  Color Characteristics:
    Red  : 0.6376, 0.3330
    Green: 0.2900, 0.5908
    Blue : 0.1533, 0.0820
    White: 0.3125, 0.3291
  Established Timings I & II:
    IBM     :   720x400    70.081663 Hz   9:5     31.467 kHz     28.320000 MHz
    DMT 0x04:   640x480    59.940476 Hz   4:3     31.469 kHz     25.175000 MHz
    DMT 0x06:   640x480    75.000000 Hz   4:3     37.500 kHz     31.500000 MHz
    DMT 0x09:   800x600    60.316541 Hz   4:3     37.879 kHz     40.000000 MHz
    DMT 0x0b:   800x600    75.000000 Hz   4:3     46.875 kHz     49.500000 MHz
    DMT 0x10:  1024x768    60.003840 Hz   4:3     48.363 kHz     65.000000 MHz
    DMT 0x12:  1024x768    75.028582 Hz   4:3     60.023 kHz     78.750000 MHz
  Standard Timings: none
  Detailed Timing Descriptors:
    DTD 1:  1366x768    59.789541 Hz 683:384   47.712 kHz     85.500000 MHz (344 mm x 194 mm)
                 Hfront   70 Hsync 143 Hback  213 Hpol P
                 Vfront    3 Vsync   3 Vback   24 Vpol P
    Display Product Serial Number: ...
    Display Range Limits:
      Monitor ranges (GTF): 56-75 Hz V, 30-83 kHz H, max dotclock 90 MHz
    Display Product Name: 'DELL E1609W'
Checksum: 0xbe

----------------

Failures:

Block 0, Base EDID:
  Basic Display Parameters & Features: sRGB is signaled, but the chromaticities do not match.
EDID:
  Extension Block 1 started with EDID header, ignoring Extension Blocks >= 1.

EDID conformity: FAIL
