edid-decode (hex):

00 ff ff ff ff ff ff 00 56 96 30 00 01 00 00 00
1e 21 01 03 80 6f 3f 78 0a cf 74 a3 57 4c b0 23
09 48 4c 21 08 00 81 c0 81 40 81 80 01 01 01 01
01 01 01 01 01 01 08 e8 00 30 f2 70 5a 80 b0 58
8a 00 68 47 42 00 00 1e 02 3a 80 18 71 38 2d 40
58 2c 45 00 68 47 42 00 00 1e 00 00 00 fc 00 4a
56 43 0a 20 20 20 20 20 20 20 20 20 00 00 00 fd
00 18 4b 0f 88 3c 00 0a 20 20 20 20 20 20 01 01

02 03 5a 70 5a 61 5e 5f 60 5d 6a 6b 01 02 04 05
10 11 13 14 1f 20 21 22 12 03 65 66 62 63 64 2f
09 07 03 15 07 50 57 04 00 3d 07 c0 5f 7e 01 83
01 00 00 e2 00 f9 e3 05 ff 01 6e 03 0c 00 20 00
38 3c 20 00 80 01 02 03 04 67 d8 5d c4 01 78 80
07 e3 06 0d 01 e4 0f 69 00 60 00 00 00 00 00 00
00 00 00 00 00 00 00 00 00 00 00 00 00 00 00 00
00 00 00 00 00 00 00 00 00 00 00 00 00 00 00 48

00 ff ff ff ff ff ff 00 56 96 30 00 01 00 00 00
1e 21 01 03 80 6f 3f 78 0a cf 74 a3 57 4c b0 23
09 48 4c 21 08 00 81 c0 81 40 81 80 01 01 01 01
01 01 01 01 01 01 08 e8 00 30 f2 70 5a 80 b0 58
8a 00 68 47 42 00 00 1e 02 3a 80 18 71 38 2d 40
58 2c 45 00 68 47 42 00 00 1e 00 00 00 fc 00 4a
56 43 0a 20 20 20 20 20 20 20 20 20 00 00 00 fd
00 18 4b 0f 88 3c 00 0a 20 20 20 20 20 20 01 01

02 03 5a 70 5a 61 5e 5f 60 5d 6a 6b 01 02 04 05
10 11 13 14 1f 20 21 22 12 03 65 66 62 63 64 2f
09 07 03 15 07 50 57 04 00 3d 07 c0 5f 7e 01 83
01 00 00 e2 00 f9 e3 05 ff 01 6e 03 0c 00 20 00
38 3c 20 00 80 01 02 03 04 67 d8 5d c4 01 78 80
07 e3 06 0d 01 e4 0f 69 00 60 00 00 00 00 00 00
00 00 00 00 00 00 00 00 00 00 00 00 00 00 00 00
00 00 00 00 00 00 00 00 00 00 00 00 00 00 00 48

----------------

Block 0, Base EDID:
  EDID Structure Version & Revision: 1.3
  Vendor & Product Identification:
    Manufacturer: UTV
    Model: 48
    Serial Number: ...
    Made in: week 30 of 2023
  Basic Display Parameters & Features:
    Digital display
    Maximum image size: 111 cm x 63 cm
    Gamma: 2.20
    RGB color display
    First detailed timing is the preferred timing
  Color Characteristics:
    Red  : 0.6396, 0.3398
    Green: 0.2998, 0.6904
    Blue : 0.1376, 0.0380
    White: 0.2822, 0.2968
  Established Timings I & II:
    DMT 0x04:   640x480    59.940476 Hz   4:3     31.469 kHz     25.175000 MHz
    DMT 0x09:   800x600    60.316541 Hz   4:3     37.879 kHz     40.000000 MHz
    DMT 0x10:  1024x768    60.003840 Hz   4:3     48.363 kHz     65.000000 MHz
  Standard Timings:
    DMT 0x55:  1280x720    60.000000 Hz  16:9     45.000 kHz     74.250000 MHz
    DMT 0x20:  1280x960    60.000000 Hz   4:3     60.000 kHz    108.000000 MHz
    DMT 0x23:  1280x1024   60.019740 Hz   5:4     63.981 kHz    108.000000 MHz
  Detailed Timing Descriptors:
    DTD 1:  3840x2160   60.000000 Hz  16:9    135.000 kHz    594.000000 MHz (1128 mm x 583 mm)
                 Hfront  176 Hsync  88 Hback  296 Hpol P
                 Vfront    8 Vsync  10 Vback   72 Vpol P
    DTD 2:  1920x1080   60.000000 Hz  16:9     67.500 kHz    148.500000 MHz (1128 mm x 583 mm)
                 Hfront   88 Hsync  44 Hback  148 Hpol P
                 Vfront    4 Vsync   5 Vback   36 Vpol P
    Display Product Name: 'JVC'
    Display Range Limits:
      Monitor ranges (GTF): 24-75 Hz V, 15-136 kHz H, max dotclock 600 MHz
  Extension blocks: 1
Checksum: 0x01

----------------

Block 1, CTA-861 Extension Block:
  Revision: 3
  Basic audio support
  Supports YCbCr 4:4:4
  Supports YCbCr 4:2:2
  Native DTDs: 0
  Video Data Block:
    VIC  97:  3840x2160   60.000000 Hz  16:9    135.000 kHz    594.000000 MHz
    VIC  94:  3840x2160   25.000000 Hz  16:9     56.250 kHz    297.000000 MHz
    VIC  95:  3840x2160   30.000000 Hz  16:9     67.500 kHz    297.000000 MHz
    VIC  96:  3840x2160   50.000000 Hz  16:9    112.500 kHz    594.000000 MHz
    VIC  93:  3840x2160   24.000000 Hz  16:9     54.000 kHz    297.000000 MHz
    VIC 106:  3840x2160   50.000000 Hz  64:27   112.500 kHz    594.000000 MHz
    VIC 107:  3840x2160   60.000000 Hz  64:27   135.000 kHz    594.000000 MHz
    VIC   1:   640x480    59.940476 Hz   4:3     31.469 kHz     25.175000 MHz
    VIC   2:   720x480    59.940060 Hz   4:3     31.469 kHz     27.000000 MHz
    VIC   4:  1280x720    60.000000 Hz  16:9     45.000 kHz     74.250000 MHz
    VIC   5:  1920x1080i  60.000000 Hz  16:9     33.750 kHz     74.250000 MHz
    VIC  16:  1920x1080   60.000000 Hz  16:9     67.500 kHz    148.500000 MHz
    VIC  17:   720x576    50.000000 Hz   4:3     31.250 kHz     27.000000 MHz
    VIC  19:  1280x720    50.000000 Hz  16:9     37.500 kHz     74.250000 MHz
    VIC  20:  1920x1080i  50.000000 Hz  16:9     28.125 kHz     74.250000 MHz
    VIC  31:  1920x1080   50.000000 Hz  16:9     56.250 kHz    148.500000 MHz
    VIC  32:  1920x1080   24.000000 Hz  16:9     27.000 kHz     74.250000 MHz
    VIC  33:  1920x1080   25.000000 Hz  16:9     28.125 kHz     74.250000 MHz
    VIC  34:  1920x1080   30.000000 Hz  16:9     33.750 kHz     74.250000 MHz
    VIC  18:   720x576    50.000000 Hz  16:9     31.250 kHz     27.000000 MHz
    VIC   3:   720x480    59.940060 Hz  16:9     31.469 kHz     27.000000 MHz
    VIC 101:  4096x2160   50.000000 Hz 256:135  112.500 kHz    594.000000 MHz
    VIC 102:  4096x2160   60.000000 Hz 256:135  135.000 kHz    594.000000 MHz
    VIC  98:  4096x2160   24.000000 Hz 256:135   54.000 kHz    297.000000 MHz
    VIC  99:  4096x2160   25.000000 Hz 256:135   56.250 kHz    297.000000 MHz
    VIC 100:  4096x2160   30.000000 Hz 256:135   67.500 kHz    297.000000 MHz
  Audio Data Block:
    Linear PCM:
      Max channels: 2
      Supported sample rates (kHz): 48 44.1 32
      Supported sample sizes (bits): 20 16
    AC-3:
      Max channels: 6
      Supported sample rates (kHz): 48 44.1 32
      Maximum bit rate: 640 kb/s
    Enhanced AC-3 (DD+):
      Max channels: 8
      Supported sample rates (kHz): 48
    DTS:
      Max channels: 6
      Supported sample rates (kHz): 48 44.1 32
      Maximum bit rate: 1536 kb/s
    DTS-HD:
      Max channels: 8
      Supported sample rates (kHz): 192 176.4 96 88.2 48 44.1
      Audio Format Code dependent value: 0x01
  Speaker Allocation Data Block:
    FL/FR - Front Left/Right
  Video Capability Data Block:
    YCbCr quantization: Selectable (via AVI YQ)
    RGB quantization: Selectable (via AVI Q)
    PT scan behavior: Supports both over- and underscan
    IT scan behavior: Always Underscanned
    CE scan behavior: Always Overscanned
  Colorimetry Data Block:
    xvYCC601
    xvYCC709
    sYCC601
    opYCC601
    opRGB
    BT2020cYCC
    BT2020YCC
    BT2020RGB
    Gamut Boundary Description Metadata Profile P0
  Vendor-Specific Data Block (HDMI), OUI 00-0C-03:
    Source physical address: 2.0.0.0
    DC_36bit
    DC_30bit
    DC_Y444
    Maximum TMDS clock: 300 MHz
    Extended HDMI video details:
      HDMI VICs:
        HDMI VIC 1:  3840x2160   30.000000 Hz  16:9     67.500 kHz    297.000000 MHz
        HDMI VIC 2:  3840x2160   25.000000 Hz  16:9     56.250 kHz    297.000000 MHz
        HDMI VIC 3:  3840x2160   24.000000 Hz  16:9     54.000 kHz    297.000000 MHz
        HDMI VIC 4:  4096x2160   24.000000 Hz 256:135   54.000 kHz    297.000000 MHz
  Vendor-Specific Data Block (HDMI Forum), OUI C4-5D-D8:
    Version: 1
    Maximum TMDS Character Rate: 600 MHz
    SCDC Present
    Supports 16-bits/component Deep Color 4:2:0 Pixel Encoding
    Supports 12-bits/component Deep Color 4:2:0 Pixel Encoding
    Supports 10-bits/component Deep Color 4:2:0 Pixel Encoding
  HDR Static Metadata Data Block:
    Electro optical transfer functions:
      Traditional gamma - SDR luminance range
      SMPTE ST2084
      Hybrid Log-Gamma
    Supported static metadata descriptors:
      Static metadata type 1
  YCbCr 4:2:0 Capability Map Data Block:
    VIC  97:  3840x2160   60.000000 Hz  16:9    135.000 kHz    594.000000 MHz
    VIC  96:  3840x2160   50.000000 Hz  16:9    112.500 kHz    594.000000 MHz
    VIC 106:  3840x2160   50.000000 Hz  64:27   112.500 kHz    594.000000 MHz
    VIC 107:  3840x2160   60.000000 Hz  64:27   135.000 kHz    594.000000 MHz
    VIC 101:  4096x2160   50.000000 Hz 256:135  112.500 kHz    594.000000 MHz
    VIC 102:  4096x2160   60.000000 Hz 256:135  135.000 kHz    594.000000 MHz
Checksum: 0x48  Unused space in Extension Block: 37 bytes

----------------

Warnings:

Block 0, Base EDID:
  Vendor & Product Identification: The serial number is one of the known dummy values, it should probably be set to 0.
  Detailed Timing Descriptor #1: Image size is 1128x583 mm, but based on the picture AR it should be 1036x583 mm.
  Detailed Timing Descriptor #2: Image size is 1128x583 mm, but based on the picture AR it should be 1036x583 mm.
Block 1, CTA-861 Extension Block:
  IT Video Formats are overscanned by default, but normally this should be underscanned.
  Video Data Block: For improved preferred timing interoperability, set 'Native DTDs' to 1.
  Colorimetry Data Block: Set the sRGB colorimetry bit to avoid interop issues.

Failures:

Block 0, Base EDID:
  Detailed Timing Descriptor #1: Mismatch of image size 1128x583 mm vs display size 1110x630 mm.
  Detailed Timing Descriptor #2: Mismatch of image size 1128x583 mm vs display size 1110x630 mm.
Block 1, CTA-861 Extension Block:
  Video Capability Data Block: IT video formats are always underscanned, but bit 7 of Byte 3 of the CTA-861 Extension header is set to overscanned.
  Vendor-Specific Data Block (HDMI Forum), OUI C4-5D-D8: HDMI VIC and related CTA VIC codes are present, but the UHD VIC bit is 0.
EDID:
  Extension Block 2 started with EDID header, ignoring Extension Blocks >= 2.
  Base EDID: The DTD max image size is 1128x583mm, which is larger than the display size 1110.0x630.0mm.

EDID conformity: FAIL
