edid-decode (hex):

00 ff ff ff ff ff ff 00 09 e5 32 00 00 00 00 00
01 1b 01 03 80 1e 12 78 2a ca 75 a9 54 45 98 22
1f 50 54 21 08 00 d1 00 d1 c0 b3 00 95 00 81 80
71 40 81 00 61 40 52 67 c0 20 83 78 33 50 a0 f0
36 00 2e bc 10 00 00 1e 00 00 00 fd 00 46 5a 30
3e 1c 00 0a 20 20 20 20 20 20 00 00 00 fc 00 4e
56 31 34 30 44 52 4d 4e 36 33 0a 20 00 00 00 ff
00 0a 20 20 20 20 20 20 20 20 20 20 20 20 01 66

02 03 19 f1 46 90 05 04 03 02 01 23 09 07 07 83
01 00 00 65 03 0c 00 10 00 52 67 c0 20 83 78 33
50 a0 f0 36 00 2e bc 10 00 00 1a 00 00 00 00 00
00 00 00 00 00 00 00 00 00 00 00 00 00 00 00 00
00 00 00 00 00 00 00 00 00 00 00 00 00 00 00 00
00 00 00 00 00 00 00 00 00 00 00 00 00 00 00 00
00 00 00 00 00 00 00 00 00 00 00 00 00 00 00 00
00 00 00 00 00 00 00 00 00 00 00 00 00 00 00 d9

00 ff ff ff ff ff ff 00 09 e5 32 00 00 00 00 00
01 1b 01 03 80 1e 12 78 2a ca 75 a9 54 45 98 22
1f 50 54 21 08 00 d1 00 d1 c0 b3 00 95 00 81 80
71 40 81 00 61 40 52 67 c0 20 83 78 33 50 a0 f0
36 00 2e bc 10 00 00 1e 00 00 00 fd 00 46 5a 30
3e 1c 00 0a 20 20 20 20 20 20 00 00 00 fc 00 4e
56 31 34 30 44 52 4d 4e 36 33 0a 20 00 00 00 ff
00 0a 20 20 20 20 20 20 20 20 20 20 20 20 01 66

02 03 19 f1 46 90 05 04 03 02 01 23 09 07 07 83
01 00 00 65 03 0c 00 10 00 52 67 c0 20 83 78 33
50 a0 f0 36 00 2e bc 10 00 00 1a 00 00 00 00 00
00 00 00 00 00 00 00 00 00 00 00 00 00 00 00 00
00 00 00 00 00 00 00 00 00 00 00 00 00 00 00 00
00 00 00 00 00 00 00 00 00 00 00 00 00 00 00 00
00 00 00 00 00 00 00 00 00 00 00 00 00 00 00 00
00 00 00 00 00 00 00 00 00 00 00 00 00 00 00 d9

----------------

Block 0, Base EDID:
  EDID Structure Version & Revision: 1.3
  Vendor & Product Identification:
    Manufacturer: BOE
    Model: 50
    Made in: week 1 of 2017
  Basic Display Parameters & Features:
    Digital display
    Maximum image size: 30 cm x 18 cm
    Gamma: 2.20
    DPMS levels: Off
    RGB color display
    First detailed timing is the preferred timing
  Color Characteristics:
    Red  : 0.6630, 0.3281
    Green: 0.2714, 0.5957
    Blue : 0.1337, 0.1240
    White: 0.3134, 0.3291
  Established Timings I & II:
    DMT 0x04:   640x480    59.940476 Hz   4:3     31.469 kHz     25.175000 MHz
    DMT 0x09:   800x600    60.316541 Hz   4:3     37.879 kHz     40.000000 MHz
    DMT 0x10:  1024x768    60.003840 Hz   4:3     48.363 kHz     65.000000 MHz
  Standard Timings:
    DMT 0x45:  1920x1200   59.884600 Hz  16:10    74.556 kHz    193.250000 MHz
    DMT 0x52:  1920x1080   60.000000 Hz  16:9     67.500 kHz    148.500000 MHz
    DMT 0x3a:  1680x1050   59.954250 Hz  16:10    65.290 kHz    146.250000 MHz
    DMT 0x2f:  1440x900    59.887445 Hz  16:10    55.935 kHz    106.500000 MHz
    DMT 0x23:  1280x1024   60.019740 Hz   5:4     63.981 kHz    108.000000 MHz
    GTF     :  1152x864    60.000000 Hz   4:3     53.700 kHz     81.624000 MHz
    DMT 0x1c:  1280x800    59.810326 Hz  16:10    49.702 kHz     83.500000 MHz
    DMT 0x10:  1024x768    60.003840 Hz   4:3     48.363 kHz     65.000000 MHz
  Detailed Timing Descriptors:
    DTD 1:  2240x1400   59.963183 Hz  16:10    87.007 kHz    264.500000 MHz (302 mm x 188 mm)
                 Hfront  160 Hsync 240 Hback  400 Hpol P
                 Vfront    3 Vsync   6 Vback   42 Vpol P
    Display Range Limits:
      Monitor ranges (GTF): 70-90 Hz V, 48-62 kHz H, max dotclock 280 MHz
    Display Product Name: 'NV140DRMN63'
    Display Product Serial Number: ...
  Extension blocks: 1
Checksum: 0x66

----------------

Block 1, CTA-861 Extension Block:
  Revision: 3
  Underscans IT Video Formats by default
  Basic audio support
  Supports YCbCr 4:4:4
  Supports YCbCr 4:2:2
  Native DTDs: 1
  Video Data Block:
    VIC  16:  1920x1080   60.000000 Hz  16:9     67.500 kHz    148.500000 MHz (native)
    VIC   5:  1920x1080i  60.000000 Hz  16:9     33.750 kHz     74.250000 MHz
    VIC   4:  1280x720    60.000000 Hz  16:9     45.000 kHz     74.250000 MHz
    VIC   3:   720x480    59.940060 Hz  16:9     31.469 kHz     27.000000 MHz
    VIC   2:   720x480    59.940060 Hz   4:3     31.469 kHz     27.000000 MHz
    VIC   1:   640x480    59.940476 Hz   4:3     31.469 kHz     25.175000 MHz
  Audio Data Block:
    Linear PCM:
      Max channels: 2
      Supported sample rates (kHz): 48 44.1 32
      Supported sample sizes (bits): 24 20 16
  Speaker Allocation Data Block:
    FL/FR - Front Left/Right
  Vendor-Specific Data Block (HDMI), OUI 00-0C-03:
    Source physical address: 1.0.0.0
  Detailed Timing Descriptors:
    DTD 2:  2240x1400   59.963183 Hz  16:10    87.007 kHz    264.500000 MHz (302 mm x 188 mm)
                 Hfront  160 Hsync 240 Hback  400 Hpol P
                 Vfront    3 Vsync   6 Vback   42 Vpol N
Checksum: 0xd9  Unused space in Extension Block: 84 bytes

----------------

Warnings:

Block 1, CTA-861 Extension Block:
  Video Data Block: VIC 16 and the first DTD are not identical. Is this intended?
  Add a Colorimetry Data Block with the sRGB colorimetry bit set to avoid interop issues.
EDID:
  Base EDID: Some timings are out of range of the Monitor Ranges:
    Vertical Freq: 59.810 - 60.317 Hz (Monitor: 70.000 - 90.000 Hz)
    Horizontal Freq: 31.468 - 87.006 kHz (Monitor: 48.000 - 62.000 kHz)

Failures:

Block 0, Base EDID:
  Display Product Serial Number: ...
Block 1, CTA-861 Extension Block:
  Missing VCDB, needed for Set Selectable RGB Quantization to avoid interop issues.
EDID:
  Extension Block 2 started with EDID header, ignoring Extension Blocks >= 2.
  CTA-861: Native progressive timings are a mix of several resolutions.

EDID conformity: FAIL
