edid-decode (hex):

00 ff ff ff ff ff ff 00 4c f4 00 22 0a 1a 00 00
30 1e 01 04 08 2f 1e 78 2e 7d 9e a5 56 4a 9a 24
11 4f 53 21 88 00 81 00 81 80 81 40 81 c0 95 00
a9 c0 61 40 45 5c 26 39 90 30 62 1a 27 40 68 b0
36 00 d7 2b 11 00 00 1e 00 00 00 fc 00 0a 20 20
20 20 20 20 20 20 20 20 20 20 66 21 56 aa 51 00
1e 30 46 8f 33 00 9a 04 11 00 00 1e 34 21 50 b0
51 00 1b 30 40 70 36 00 9a 04 11 00 00 1e 00 4e

00 ff ff ff ff ff ff 00 4c f4 00 22 0a 1a 00 00
30 1e 01 04 08 2f 1e 78 2e 7d 9e a5 56 4a 9a 24
11 4f 53 21 88 00 81 00 81 80 81 40 81 c0 95 00
a9 c0 61 40 45 5c 26 39 90 30 62 1a 27 40 68 b0
36 00 d7 2b 11 00 00 1e 00 00 00 fc 00 0a 20 20
20 20 20 20 20 20 20 20 20 20 66 21 56 aa 51 00
1e 30 46 8f 33 00 9a 04 11 00 00 1e 34 21 50 b0
51 00 1b 30 40 70 36 00 9a 04 11 00 00 1e 00 4e

----------------

Block 0, Base EDID:
  EDID Structure Version & Revision: 1.4
  Vendor & Product Identification:
    Manufacturer: SGT
    Model: 8704
    Serial Number: ...
    Made in: week 48 of 2020
  Basic Display Parameters & Features:
    Analog display
    Signal Level Standard: 0.700 : 0.300 : 1.000 V p-p
    Blank level equals black level
    Sync: Separate
    Maximum image size: 47 cm x 30 cm
    Gamma: 2.20
    DPMS levels: Off
    RGB color display
    Default (sRGB) color space is primary color space
    First detailed timing includes the native pixel format and preferred refresh rate
  Color Characteristics:
    Red  : 0.6455, 0.3388
    Green: 0.2919, 0.6025
    Blue : 0.1425, 0.0673
    White: 0.3115, 0.3261
  Established Timings I & II:
    DMT 0x04:   640x480    59.940476 Hz   4:3     31.469 kHz     25.175000 MHz
    DMT 0x09:   800x600    60.316541 Hz   4:3     37.879 kHz     40.000000 MHz
    DMT 0x0a:   800x600    72.187572 Hz   4:3     48.077 kHz     50.000000 MHz
    DMT 0x10:  1024x768    60.003840 Hz   4:3     48.363 kHz     65.000000 MHz
  Standard Timings:
    DMT 0x1c:  1280x800    59.810326 Hz  16:10    49.702 kHz     83.500000 MHz
    DMT 0x23:  1280x1024   60.019740 Hz   5:4     63.981 kHz    108.000000 MHz
    DMT 0x20:  1280x960    60.000000 Hz   4:3     60.000 kHz    108.000000 MHz
    DMT 0x55:  1280x720    60.000000 Hz  16:9     45.000 kHz     74.250000 MHz
    DMT 0x2f:  1440x900    59.887445 Hz  16:10    55.935 kHz    106.500000 MHz
    DMT 0x53:  1600x900    60.000000 Hz  16:9     60.000 kHz    108.000000 MHz (RB)
    DMT 0x10:  1024x768    60.003840 Hz   4:3     48.363 kHz     65.000000 MHz
    GTF     :   800x600    87.999257 Hz   4:3     55.616 kHz     58.730000 MHz
  Detailed Timing Descriptors:
    DTD 1:  1680x1050   59.974747 Hz  16:10    65.312 kHz    146.300000 MHz (471 mm x 299 mm)
                 Hfront  104 Hsync 176 Hback  280 Hpol P
                 Vfront    3 Vsync   6 Vback   30 Vpol P
    Display Product Name: ''
    DTD 2:  1366x768    59.789541 Hz 683:384   47.712 kHz     85.500000 MHz (410 mm x 260 mm)
                 Hfront   70 Hsync 143 Hback  213 Hpol P
                 Vfront    3 Vsync   3 Vback   24 Vpol P
    DTD 3:  1360x768    59.664196 Hz  85:48    47.433 kHz     85.000000 MHz (410 mm x 260 mm)
                 Hfront   64 Hsync 112 Hback  256 Hpol P
                 Vfront    3 Vsync   6 Vback   18 Vpol P
Checksum: 0x4e

----------------

Warnings:

Block 0, Base EDID:
  Vendor & Product Identification: The serial number is one of the known dummy values, it should probably be set to 0.
  Detailed Timing Descriptor #2: Image size is 410x260 mm, but based on the picture AR it should be 410x230 mm.
  Detailed Timing Descriptor #3: Image size is 410x260 mm, but based on the picture AR it should be 410x231 mm.

Failures:

Block 0, Base EDID:
  Basic Display Parameters & Features: sRGB is signaled, but the chromaticities do not match.
  Display Product Name: Empty string.
  Detailed Timing Descriptor #2: Mismatch of image size 410x260 mm vs display size 470x300 mm.
  Detailed Timing Descriptor #2: Invalid detailed timing descriptor ordering.
  Detailed Timing Descriptor #3: Mismatch of image size 410x260 mm vs display size 470x300 mm.
  Detailed Timing Descriptor #3: Invalid detailed timing descriptor ordering.
EDID:
  Extension Block 1 started with EDID header, ignoring Extension Blocks >= 1.

EDID conformity: FAIL
