edid-decode (hex):

00 ff ff ff ff ff ff 00 52 62 01 88 00 88 88 88
1c 15 01 03 80 00 00 78 0a 0d c9 a0 57 47 98 27
12 48 4c 00 00 00 01 01 01 01 01 01 01 01 01 01
01 01 01 01 01 01 02 3a 80 18 71 38 2d 40 58 2c
45 00 c4 8e 21 00 00 1e 01 1d 00 72 51 d0 1e 20
6e 28 55 00 c4 8e 21 00 00 1e 00 00 00 fc 00 54
37 34 39 2d 66 48 44 37 32 30 0a 20 00 00 00 fd
00 14 78 01 ff 1d 00 0a 20 20 20 20 20 20 01 7b

02 03 1a 71 47 90 04 02 01 11 22 05 23 09 07 01
83 01 00 00 65 03 0c 00 10 00 8c 0a d0 8a 20 e0
2d 10 10 3e 96 00 13 8e 21 00 00 1e d8 09 80 a0
20 e0 2d 10 10 60 a2 00 c4 8e 21 00 00 18 8c 0a
d0 90 20 40 31 20 0c 40 55 00 48 39 00 00 00 18
01 1d 80 18 71 38 2d 40 58 2c 45 00 c0 6c 00 00
00 18 01 1d 80 18 71 1c 16 20 58 2c 25 00 c0 6c
00 00 00 18 00 00 00 00 00 00 00 00 00 00 00 32

00 ff ff ff ff ff ff 00 52 62 01 88 00 88 88 88
1c 15 01 03 80 00 00 78 0a 0d c9 a0 57 47 98 27
12 48 4c 00 00 00 01 01 01 01 01 01 01 01 01 01
01 01 01 01 01 01 02 3a 80 18 71 38 2d 40 58 2c
45 00 c4 8e 21 00 00 1e 01 1d 00 72 51 d0 1e 20
6e 28 55 00 c4 8e 21 00 00 1e 00 00 00 fc 00 54
37 34 39 2d 66 48 44 37 32 30 0a 20 00 00 00 fd
00 14 78 01 ff 1d 00 0a 20 20 20 20 20 20 01 7b

02 03 1a 71 47 90 04 02 01 11 22 05 23 09 07 01
83 01 00 00 65 03 0c 00 10 00 8c 0a d0 8a 20 e0
2d 10 10 3e 96 00 13 8e 21 00 00 1e d8 09 80 a0
20 e0 2d 10 10 60 a2 00 c4 8e 21 00 00 18 8c 0a
d0 90 20 40 31 20 0c 40 55 00 48 39 00 00 00 18
01 1d 80 18 71 38 2d 40 58 2c 45 00 c0 6c 00 00
00 18 01 1d 80 18 71 1c 16 20 58 2c 25 00 c0 6c
00 00 00 18 00 00 00 00 00 00 00 00 00 00 00 32

----------------

Block 0, Base EDID:
  EDID Structure Version & Revision: 1.3
  Vendor & Product Identification:
    Manufacturer: TSB
    Model: 34817
    Serial Number: ...
    Made in: week 28 of 2011
  Basic Display Parameters & Features:
    Digital display
    Image size is variable
    Gamma: 2.20
    RGB color display
    First detailed timing is the preferred timing
  Color Characteristics:
    Red  : 0.6250, 0.3398
    Green: 0.2802, 0.5947
    Blue : 0.1552, 0.0703
    White: 0.2832, 0.2978
  Established Timings I & II: none
  Standard Timings: none
  Detailed Timing Descriptors:
    DTD 1:  1920x1080   60.000000 Hz  16:9     67.500 kHz    148.500000 MHz (708 mm x 398 mm)
                 Hfront   88 Hsync  44 Hback  148 Hpol P
                 Vfront    4 Vsync   5 Vback   36 Vpol P
    DTD 2:  1280x720    60.000000 Hz  16:9     45.000 kHz     74.250000 MHz (708 mm x 398 mm)
                 Hfront  110 Hsync  40 Hback  220 Hpol P
                 Vfront    5 Vsync   5 Vback   20 Vpol P
    Display Product Name: 'T749-fHD720'
    Display Range Limits:
      Monitor ranges (GTF): 20-120 Hz V, 1-255 kHz H, max dotclock 290 MHz
  Extension blocks: 1
Checksum: 0x7b

----------------

Block 1, CTA-861 Extension Block:
  Revision: 3
  Basic audio support
  Supports YCbCr 4:4:4
  Supports YCbCr 4:2:2
  Native DTDs: 1
  Video Data Block:
    VIC  16:  1920x1080   60.000000 Hz  16:9     67.500 kHz    148.500000 MHz (native)
    VIC   4:  1280x720    60.000000 Hz  16:9     45.000 kHz     74.250000 MHz
    VIC   2:   720x480    59.940060 Hz   4:3     31.469 kHz     27.000000 MHz
    VIC   1:   640x480    59.940476 Hz   4:3     31.469 kHz     25.175000 MHz
    VIC  17:   720x576    50.000000 Hz   4:3     31.250 kHz     27.000000 MHz
    VIC  34:  1920x1080   30.000000 Hz  16:9     33.750 kHz     74.250000 MHz
    VIC   5:  1920x1080i  60.000000 Hz  16:9     33.750 kHz     74.250000 MHz
  Audio Data Block:
    Linear PCM:
      Max channels: 2
      Supported sample rates (kHz): 48 44.1 32
      Supported sample sizes (bits): 16
  Speaker Allocation Data Block:
    FL/FR - Front Left/Right
  Vendor-Specific Data Block (HDMI), OUI 00-0C-03:
    Source physical address: 1.0.0.0
  Detailed Timing Descriptors:
    DTD 3:   720x480    59.940060 Hz   3:2     31.469 kHz     27.000000 MHz (531 mm x 398 mm)
                 Hfront   16 Hsync  62 Hback   60 Hpol P
                 Vfront    9 Vsync   6 Vback   30 Vpol P
    DTD 4:   640x480    60.000000 Hz   4:3     31.500 kHz     25.200000 MHz (708 mm x 398 mm)
                 Hfront   16 Hsync  96 Hback   48 Hpol N
                 Vfront   10 Vsync   2 Vback   33 Vpol N
    DTD 5:   720x576    50.000000 Hz   5:4     31.250 kHz     27.000000 MHz (72 mm x 57 mm)
                 Hfront   12 Hsync  64 Hback   68 Hpol N
                 Vfront    5 Vsync   5 Vback   39 Vpol N
    DTD 6:  1920x1080   30.000000 Hz  16:9     33.750 kHz     74.250000 MHz (192 mm x 108 mm)
                 Hfront   88 Hsync  44 Hback  148 Hpol N
                 Vfront    4 Vsync   5 Vback   36 Vpol N
    DTD 7:  1920x540    60.053381 Hz  32:9     33.750 kHz     74.250000 MHz (192 mm x 108 mm)
                 Hfront   88 Hsync  44 Hback  148 Hpol N
                 Vfront    2 Vsync   5 Vback   15 Vpol N
Checksum: 0x32  Unused space in Extension Block: 11 bytes

----------------

Warnings:

Block 1, CTA-861 Extension Block:
  IT Video Formats are overscanned by default, but normally this should be underscanned.
  Detailed Timing Descriptor #3: DTD is similar but not identical to VIC 2.
  Detailed Timing Descriptor #3: Image size is 531x398 mm, but based on the picture AR it should be 531x354 mm.
  Detailed Timing Descriptor #4: Image size is 708x398 mm, but based on the picture AR it should be 530x398 mm.
  Detailed Timing Descriptor #5: Dubious image size (72x57 mm is smaller than 100x100 mm).
  Detailed Timing Descriptor #6: DTD is similar but not identical to VIC 34.
  Detailed Timing Descriptor #7: Image size is 192x108 mm, but based on the picture AR it should be 192x54 mm.
  Add a Colorimetry Data Block with the sRGB colorimetry bit set to avoid interop issues.

Failures:

Block 1, CTA-861 Extension Block:
  Missing VCDB, needed for Set Selectable RGB Quantization to avoid interop issues.
EDID:
  Extension Block 2 started with EDID header, ignoring Extension Blocks >= 2.
  Base EDID: The DTD max image size is 708x398mm, but the display size is not specified anywhere.

EDID conformity: FAIL
