edid-decode (hex):

00 ff ff ff ff ff ff 00 59 96 04 30 01 00 00 00
ff 20 01 04 a5 0a 10 78 17 6c 71 af 50 3e b7 23
0c 50 54 00 00 00 01 01 01 01 01 01 01 01 01 01
01 01 01 01 01 01 d8 27 20 3a 30 00 28 50 12 04
82 00 64 a0 00 00 00 1e 00 00 00 fc 00 41 4e 58
37 35 33 30 20 55 0a 20 20 20 00 00 00 fd 00 2d
5a 76 77 0e 00 0a 20 20 20 20 20 20 00 00 00 10
00 00 00 00 00 00 00 00 00 00 00 00 00 00 01 16

02 03 0b 00 e6 06 01 01 6a 6a 03 00 00 00 00 00
00 00 00 00 00 00 00 00 00 00 00 00 00 00 00 00
00 00 00 00 00 00 00 00 00 00 00 00 00 00 00 00
00 00 00 00 00 00 00 00 00 00 00 00 00 00 00 00
00 00 00 00 00 00 00 00 00 00 00 00 00 00 00 00
00 00 00 00 00 00 00 00 00 00 00 00 00 00 00 00
00 00 00 00 00 00 00 00 00 00 00 00 00 00 00 00
00 00 00 00 00 00 00 00 00 00 00 00 00 00 00 2b

00 ff ff ff ff ff ff 00 59 96 04 30 01 00 00 00
ff 20 01 04 a5 0a 10 78 17 6c 71 af 50 3e b7 23
0c 50 54 00 00 00 01 01 01 01 01 01 01 01 01 01
01 01 01 01 01 01 d8 27 20 3a 30 00 28 50 12 04
82 00 64 a0 00 00 00 1e 00 00 00 fc 00 41 4e 58
37 35 33 30 20 55 0a 20 20 20 00 00 00 fd 00 2d
5a 76 77 0e 00 0a 20 20 20 20 20 20 00 00 00 10
00 00 00 00 00 00 00 00 00 00 00 00 00 00 01 16

02 03 0b 00 e6 06 01 01 6a 6a 03 00 00 00 00 00
00 00 00 00 00 00 00 00 00 00 00 00 00 00 00 00
00 00 00 00 00 00 00 00 00 00 00 00 00 00 00 00
00 00 00 00 00 00 00 00 00 00 00 00 00 00 00 00
00 00 00 00 00 00 00 00 00 00 00 00 00 00 00 00
00 00 00 00 00 00 00 00 00 00 00 00 00 00 00 00
00 00 00 00 00 00 00 00 00 00 00 00 00 00 00 00
00 00 00 00 00 00 00 00 00 00 00 00 00 00 00 2b

----------------

Block 0, Base EDID:
  EDID Structure Version & Revision: 1.4
  Vendor & Product Identification:
    Manufacturer: VLV
    Model: 12292
    Serial Number: ...
    Model year: 2022
  Basic Display Parameters & Features:
    Digital display
    Bits per primary color channel: 8
    DisplayPort interface
    Maximum image size: 10 cm x 16 cm
    Gamma: 2.20
    Supported color formats: RGB 4:4:4, YCrCb 4:2:2
    Default (sRGB) color space is primary color space
    First detailed timing includes the native pixel format and preferred refresh rate
    Display supports continuous frequencies
  Color Characteristics:
    Red  : 0.6845, 0.3144
    Green: 0.2451, 0.7148
    Blue : 0.1376, 0.0498
    White: 0.3125, 0.3291
  Established Timings I & II: none
  Standard Timings: none
  Detailed Timing Descriptors:
    DTD 1:   800x1280   90.061454 Hz   5:8    118.881 kHz    102.000000 MHz (100 mm x 160 mm)
                 Hfront   18 Hsync   4 Hback   36 Hpol P
                 Vfront    8 Vsync   2 Vback   30 Vpol P
    Display Product Name: 'ANX7530 U'
    Display Range Limits:
      Monitor ranges (GTF): 45-90 Hz V, 118-119 kHz H, max dotclock 140 MHz
    Dummy Descriptor:
  Extension blocks: 1
Checksum: 0x16

----------------

Block 1, CTA-861 Extension Block:
  Revision: 3
  Native detailed modes: 0
  HDR Static Metadata Data Block:
    Electro optical transfer functions:
      Traditional gamma - SDR luminance range
    Supported static metadata descriptors:
      Static metadata type 1
    Desired content max luminance: 106 (496.743 cd/m^2)
    Desired content max frame-average luminance: 106 (496.743 cd/m^2)
    Desired content min luminance: 3 (0.001 cd/m^2)
Checksum: 0x2b  Unused space in Extension Block: 116 bytes

----------------

Block 2, Unknown EDID Extension Block 0x00:
  00 ff ff ff ff ff ff 00 59 96 04 30 01 00 00 00 '........Y..0....'
  ff 20 01 04 a5 0a 10 78 17 6c 71 af 50 3e b7 23 '. .....x.lq.P>.#'
  0c 50 54 00 00 00 01 01 01 01 01 01 01 01 01 01 '.PT.............'
  01 01 01 01 01 01 d8 27 20 3a 30 00 28 50 12 04 '.......' :0.(P..'
  82 00 64 a0 00 00 00 1e 00 00 00 fc 00 41 4e 58 '..d..........ANX'
  37 35 33 30 20 55 0a 20 20 20 00 00 00 fd 00 2d '7530 U.   .....-'
  5a 76 77 0e 00 0a 20 20 20 20 20 20 00 00 00 10 'Zvw...      ....'
  00 00 00 00 00 00 00 00 00 00 00 00 00 00 01 16 '................'
Checksum: 0x16

----------------

Block 3, CTA-861 Extension Block:
  Revision: 3
  Native detailed modes: 0
  HDR Static Metadata Data Block:
    Electro optical transfer functions:
      Traditional gamma - SDR luminance range
    Supported static metadata descriptors:
      Static metadata type 1
    Desired content max luminance: 106 (496.743 cd/m^2)
    Desired content max frame-average luminance: 106 (496.743 cd/m^2)
    Desired content min luminance: 3 (0.001 cd/m^2)
Checksum: 0x2b  Unused space in Extension Block: 116 bytes

----------------

Warnings:

Block 0, Base EDID:
  Vendor & Product Identification: The serial number is one of the known dummy values, it should probably be set to 0.
  Display Range Limits: GTF support is deprecated in EDID 1.4.
Block 1, CTA-861 Extension Block:
  IT Video Formats are overscanned by default, but normally this should be underscanned.
Block 3, CTA-861 Extension Block:
  IT Video Formats are overscanned by default, but normally this should be underscanned.

Failures:

Block 0, Base EDID:
  Basic Display Parameters & Features: sRGB is signaled, but the chromaticities do not match.
Block 1, CTA-861 Extension Block:
  Required 640x480p60 timings are missing in the established timings and the SVD list (VIC 1).
  Missing VCDB, needed for Set Selectable RGB Quantization to avoid interop issues.
Block 2, Base EDID:
  Unknown Extension Block.
Block 3, CTA-861 Extension Block:
  HDR Static Metadata Data Block: Only one instance of this Data Block is allowed.
EDID:
  Base EDID: EDID specified 1 extension block(s), but found 3 extension block(s).

EDID conformity: FAIL
