edid-decode (hex):

00 ff ff ff ff ff ff 00 34 38 df 05 b9 03 00 00
2f 0d 01 03 68 1e 17 78 6e b1 c6 9f 55 4b 99 24
1d 4f 54 af ce 00 31 4c 31 4f 45 40 45 4c 45 4f
61 40 61 4a 61 4f d6 09 80 a0 20 5e 63 10 30 60
c2 0c 30 e4 10 00 00 1a 00 00 00 fd 00 38 4b 1f
3e 08 0a 20 20 20 20 20 20 20 00 00 00 fc 00 42
31 30 31 35 35 35 0a 20 20 20 20 20 00 00 00 fe
00 4d 41 58 44 41 54 41 0a 20 20 20 20 20 00 c8

00 ff ff ff ff ff ff 00 34 38 df 05 b9 03 00 00
2f 0d 01 03 68 1e 17 78 6e b1 c6 9f 55 4b 99 24
1d 4f 54 af ce 00 31 4c 31 4f 45 40 45 4c 45 4f
61 40 61 4a 61 4f d6 09 80 a0 20 5e 63 10 30 60
c2 0c 30 e4 10 00 00 1a 00 00 00 fd 00 38 4b 1f
3e 08 0a 20 20 20 20 20 20 20 00 00 00 fc 00 42
31 30 31 35 35 35 0a 20 20 20 20 20 00 00 00 fe
00 4d 41 58 44 41 54 41 0a 20 20 20 20 20 00 c8

----------------

Block 0, Base EDID:
  EDID Structure Version & Revision: 1.3
  Vendor & Product Identification:
    Manufacturer: MAX
    Model: 1503
    Serial Number: ...
    Made in: week 47 of 2003
  Basic Display Parameters & Features:
    Analog display
    Signal Level Standard: 0.700 : 0.000 : 0.700 V p-p
    Blank level equals black level
    Sync: Separate
    Maximum image size: 30 cm x 23 cm
    Gamma: 2.20
    DPMS levels: Suspend Off
    RGB color display
    Default (sRGB) color space is primary color space
    First detailed timing is the preferred timing
  Color Characteristics:
    Red  : 0.6230, 0.3349
    Green: 0.2929, 0.5986
    Blue : 0.1435, 0.1132
    White: 0.3095, 0.3300
  Established Timings I & II:
    IBM     :   720x400    70.081663 Hz   9:5     31.467 kHz     28.320000 MHz
    DMT 0x04:   640x480    59.940476 Hz   4:3     31.469 kHz     25.175000 MHz
    DMT 0x05:   640x480    72.808802 Hz   4:3     37.861 kHz     31.500000 MHz
    DMT 0x06:   640x480    75.000000 Hz   4:3     37.500 kHz     31.500000 MHz
    DMT 0x08:   800x600    56.250000 Hz   4:3     35.156 kHz     36.000000 MHz
    DMT 0x09:   800x600    60.316541 Hz   4:3     37.879 kHz     40.000000 MHz
    DMT 0x0a:   800x600    72.187572 Hz   4:3     48.077 kHz     50.000000 MHz
    DMT 0x0b:   800x600    75.000000 Hz   4:3     46.875 kHz     49.500000 MHz
    DMT 0x10:  1024x768    60.003840 Hz   4:3     48.363 kHz     65.000000 MHz
    DMT 0x11:  1024x768    70.069359 Hz   4:3     56.476 kHz     75.000000 MHz
    DMT 0x12:  1024x768    75.028582 Hz   4:3     60.023 kHz     78.750000 MHz
  Standard Timings:
    DMT 0x05:   640x480    72.808802 Hz   4:3     37.861 kHz     31.500000 MHz
    DMT 0x06:   640x480    75.000000 Hz   4:3     37.500 kHz     31.500000 MHz
    DMT 0x09:   800x600    60.316541 Hz   4:3     37.879 kHz     40.000000 MHz
    DMT 0x0a:   800x600    72.187572 Hz   4:3     48.077 kHz     50.000000 MHz
    DMT 0x0b:   800x600    75.000000 Hz   4:3     46.875 kHz     49.500000 MHz
    DMT 0x10:  1024x768    60.003840 Hz   4:3     48.363 kHz     65.000000 MHz
    GTF     :  1024x768    70.000000 Hz   4:3     56.000 kHz     76.160000 MHz
    DMT 0x12:  1024x768    75.028582 Hz   4:3     60.023 kHz     78.750000 MHz
  Detailed Timing Descriptors:
    DTD 1:   640x350    70.100223 Hz  64:35    31.475 kHz     25.180000 MHz (304 mm x 228 mm)
                 Hfront   48 Hsync  96 Hback   16 Hpol P
                 Vfront   60 Vsync   2 Vback   37 Vpol N
    Display Range Limits:
      Monitor ranges (Unknown (0x0a)): 56-75 Hz V, 31-62 kHz H, max dotclock 80 MHz
    Display Product Name: 'B101555'
    Alphanumeric Data String: 'MAXDATA'
Checksum: 0xc8

----------------

Block 1, Unknown EDID Extension Block 0x00:
  00 ff ff ff ff ff ff 00 34 38 df 05 b9 03 00 00 '........48......'
  2f 0d 01 03 68 1e 17 78 6e b1 c6 9f 55 4b 99 24 '/...h..xn...UK.$'
  1d 4f 54 af ce 00 31 4c 31 4f 45 40 45 4c 45 4f '.OT...1L1OE@ELEO'
  61 40 61 4a 61 4f d6 09 80 a0 20 5e 63 10 30 60 'a@aJaO.... ^c.0`'
  c2 0c 30 e4 10 00 00 1a 00 00 00 fd 00 38 4b 1f '..0..........8K.'
  3e 08 0a 20 20 20 20 20 20 20 00 00 00 fc 00 42 '>..       .....B'
  31 30 31 35 35 35 0a 20 20 20 20 20 00 00 00 fe '101555.     ....'
  00 4d 41 58 44 41 54 41 0a 20 20 20 20 20 00 c8 '.MAXDATA.     ..'
Checksum: 0xc8

----------------

Warnings:

Block 0, Base EDID:
  Detailed Timing Descriptor #1: Image size is 304x228 mm, but based on the picture AR it should be 304x166 mm.

Failures:

Block 0, Base EDID:
  Basic Display Parameters & Features: sRGB is signaled, but the chromaticities do not match.
  Display Range Limits: Unknown range class (0x0a).
  Display Range Limits: Byte 11 is 0x20 instead of 0x0a.
Block 1, Base EDID:
  Unknown Extension Block.
EDID:
  Base EDID: EDID specified 0 extension block(s), but found 1 extension block(s).

EDID conformity: FAIL
