edid-decode (hex):

00 ff ff ff ff ff ff 00 26 cf c6 04 00 00 00 00
00 20 01 04 a5 1a 10 78 02 dd c0 96 59 59 9a 28
1f 50 54 00 00 00 01 01 01 01 01 01 01 01 01 01
01 01 01 01 01 01 0f 3c 80 a0 70 b0 20 40 18 30
3c 00 07 a4 10 00 00 19 0a 28 80 a0 70 b0 20 40
18 30 3c 00 07 a4 10 00 00 19 00 00 00 fe 00 49
6e 66 6f 56 69 73 69 6f 6e 0a 20 20 00 00 00 fe
00 4d 31 32 32 4e 57 34 32 20 52 30 20 0a 00 ef

00 ff ff ff ff ff ff 00 26 cf c6 04 00 00 00 00
00 20 01 04 a5 1a 10 78 02 dd c0 96 59 59 9a 28
1f 50 54 00 00 00 01 01 01 01 01 01 01 01 01 01
01 01 01 01 01 01 0f 3c 80 a0 70 b0 20 40 18 30
3c 00 07 a4 10 00 00 19 0a 28 80 a0 70 b0 20 40
18 30 3c 00 07 a4 10 00 00 19 00 00 00 fe 00 49
6e 66 6f 56 69 73 69 6f 6e 0a 20 20 00 00 00 fe
00 4d 31 32 32 4e 57 34 32 20 52 30 20 0a 00 ef

----------------

Block 0, Base EDID:
  EDID Structure Version & Revision: 1.4
  Vendor & Product Identification:
    Manufacturer: IVO
    Model: 1222
    Made in: 2022
  Basic Display Parameters & Features:
    Digital display
    Bits per primary color channel: 8
    DisplayPort interface
    Maximum image size: 26 cm x 16 cm
    Gamma: 2.20
    Supported color formats: RGB 4:4:4
    First detailed timing includes the native pixel format and preferred refresh rate
  Color Characteristics:
    Red  : 0.5888, 0.3486
    Green: 0.3505, 0.6025
    Blue : 0.1591, 0.1210
    White: 0.3125, 0.3281
  Established Timings I & II: none
  Standard Timings: none
  Detailed Timing Descriptors:
    DTD 1:  1920x1200   59.998595 Hz  16:10    73.918 kHz    153.750000 MHz (263 mm x 164 mm)
                 Hfront   24 Hsync  48 Hback   88 Hpol N
                 Vfront    3 Vsync  12 Vback   17 Vpol N
    DTD 2:  1920x1200   39.999063 Hz  16:10    49.279 kHz    102.500000 MHz (263 mm x 164 mm)
                 Hfront   24 Hsync  48 Hback   88 Hpol N
                 Vfront    3 Vsync  12 Vback   17 Vpol N
    Alphanumeric Data String: 'InfoVision'
    Alphanumeric Data String: 'M122NW42 R0 '
Checksum: 0xef

----------------

Warnings:

Block 0, Base EDID:
  Missing Display Product Name.

Failures:

Block 0, Base EDID:
  Alphanumeric Data String: One or more trailing spaces before newline.
EDID:
  Extension Block 1 started with EDID header, ignoring Extension Blocks >= 1.

EDID conformity: FAIL
