edid-decode (hex):

00 ff ff ff ff ff ff 00 09 e5 5a 0d 00 00 00 00
2b 22 01 04 b5 23 16 78 03 69 05 af 4f 41 b5 26
0c 50 54 00 00 00 01 01 01 01 01 01 01 01 01 01
01 01 01 01 01 01 1a 6b 00 a0 a0 40 50 60 30 20
66 00 59 d7 10 00 00 1a 00 00 00 fd 0e 3c f0 f9
f9 6e 01 0a 20 20 20 20 20 20 00 00 00 fe 00 42
4f 45 20 43 51 0a 20 20 20 20 20 20 00 00 00 fc
00 4e 45 31 36 30 51 44 4d 2d 4e 4d 39 0a 02 20

02 03 0f 00 e3 05 80 80 e6 06 05 01 95 73 10 00
00 00 00 00 00 00 00 00 00 00 00 00 00 00 00 00
00 00 00 00 00 00 00 00 00 00 00 00 00 00 00 00
00 00 00 00 00 00 00 00 00 00 00 00 00 00 00 00
00 00 00 00 00 00 00 00 00 00 00 00 00 00 00 00
00 00 00 00 00 00 00 00 00 00 00 00 00 00 00 00
00 00 00 00 00 00 00 00 00 00 00 00 00 00 00 00
00 00 00 00 00 00 00 00 00 00 00 00 00 00 00 fa

70 20 79 02 00 22 00 28 ff bb 10 85 ff 09 9f 00
2f 00 1f 00 3f 06 4f 00 05 00 05 00 00 00 00 00
00 00 00 00 00 00 00 00 00 00 00 00 00 00 00 00
2b 00 12 27 00 30 ef 00 00 27 00 3c ef 00 00 27
00 30 3b 00 00 81 00 15 74 1a 00 00 03 59 30 f0
00 40 95 10 73 10 00 00 00 00 00 00 00 21 00 1d
7a 0d 66 08 00 0a 40 06 80 f5 9a 4f 18 34 b5 5e
02 0c 02 35 54 b0 60 ec 64 66 2a 13 78 00 76 90

00 ff ff ff ff ff ff 00 09 e5 5a 0d 00 00 00 00
2b 22 01 04 b5 23 16 78 03 69 05 af 4f 41 b5 26
0c 50 54 00 00 00 01 01 01 01 01 01 01 01 01 01
01 01 01 01 01 01 1a 6b 00 a0 a0 40 50 60 30 20
66 00 59 d7 10 00 00 1a 00 00 00 fd 0e 3c f0 f9
f9 6e 01 0a 20 20 20 20 20 20 00 00 00 fe 00 42
4f 45 20 43 51 0a 20 20 20 20 20 20 00 00 00 fc
00 4e 45 31 36 30 51 44 4d 2d 4e 4d 39 0a 02 20

02 03 0f 00 e3 05 80 80 e6 06 05 01 95 73 10 00
00 00 00 00 00 00 00 00 00 00 00 00 00 00 00 00
00 00 00 00 00 00 00 00 00 00 00 00 00 00 00 00
00 00 00 00 00 00 00 00 00 00 00 00 00 00 00 00
00 00 00 00 00 00 00 00 00 00 00 00 00 00 00 00
00 00 00 00 00 00 00 00 00 00 00 00 00 00 00 00
00 00 00 00 00 00 00 00 00 00 00 00 00 00 00 00
00 00 00 00 00 00 00 00 00 00 00 00 00 00 00 fa

70 20 79 02 00 22 00 28 ff bb 10 85 ff 09 9f 00
2f 00 1f 00 3f 06 4f 00 05 00 05 00 00 00 00 00
00 00 00 00 00 00 00 00 00 00 00 00 00 00 00 00
2b 00 12 27 00 30 ef 00 00 27 00 3c ef 00 00 27
00 30 3b 00 00 81 00 15 74 1a 00 00 03 59 30 f0
00 40 95 10 73 10 00 00 00 00 00 00 00 21 00 1d
7a 0d 66 08 00 0a 40 06 80 f5 9a 4f 18 34 b5 5e
02 0c 02 35 54 b0 60 ec 64 66 2a 13 78 00 76 90

----------------

Block 0, Base EDID:
  EDID Structure Version & Revision: 1.4
  Vendor & Product Identification:
    Manufacturer: BOE
    Model: 3418
    Made in: week 43 of 2024
  Basic Display Parameters & Features:
    Digital display
    Bits per primary color channel: 10
    DisplayPort interface
    Maximum image size: 35 cm x 22 cm
    Gamma: 2.20
    Supported color formats: RGB 4:4:4
    First detailed timing includes the native pixel format and preferred refresh rate
    Display supports continuous frequencies
  Color Characteristics:
    Red  : 0.6845, 0.3105
    Green: 0.2558, 0.7080
    Blue : 0.1484, 0.0468
    White: 0.3134, 0.3291
  Established Timings I & II: none
  Standard Timings: none
  Detailed Timing Descriptors:
    DTD 1:  2560x1600   60.000875 Hz  16:10   100.801 kHz    274.180000 MHz (345 mm x 215 mm)
                 Hfront   48 Hsync  32 Hback   80 Hpol P
                 Vfront    6 Vsync   6 Vback   68 Vpol N
    Display Range Limits:
      Monitor ranges (Range Limits Only): 60-495 Hz V, 504-504 kHz H, max dotclock 1100 MHz
    Alphanumeric Data String: 'BOE CQ'
    Display Product Name: 'NE160QDM-NM9'
  Extension blocks: 2
Checksum: 0x20

----------------

Block 1, CTA-861 Extension Block:
  Revision: 3
  Native DTDs: 0
  Colorimetry Data Block:
    BT2020RGB
    ST2113RGB
  HDR Static Metadata Data Block:
    Electro optical transfer functions:
      Traditional gamma - SDR luminance range
      SMPTE ST2084
    Supported static metadata descriptors:
      Static metadata type 1
    Desired content max luminance: 149 (1260.785 cd/m^2)
    Desired content max frame-average luminance: 115 (603.666 cd/m^2)
    Desired content min luminance: 16 (0.050 cd/m^2)
Checksum: 0xfa  Unused space in Extension Block: 112 bytes

----------------

Block 2, DisplayID Extension Block:
  Version: 2.0
  Extension Count: 0
  Display Product Primary Use Case: None of the listed primary use cases; generic display
  Video Timing Modes Type 7 - Detailed Timings Data Block:
    DTD:  2560x1600  240.000000 Hz  16:10   403.200 kHz   1096.704000 MHz (aspect 16:10, no 3D stereo, preferred)
               Hfront   48 Hsync  32 Hback   80 Hpol N
               Vfront    6 Vsync   6 Vback   68 Vpol N
    DTD:     1x1     250.000000 Hz   1:1      0.500 kHz      0.001000 MHz (aspect 1:1, no 3D stereo)
               Hfront    1 Hsync   1 Hback   -1 Hpol N
               Vfront    1 Vsync   1 Vback   -1 Vpol N
  Adaptive Sync Data Block:
    Descriptor #1:
      Native Panel Range
      Fixed Average V-Total and Adaptive V-Total
      Supports Seamless Transition
      'Max Single Frame Duration Increase' field value without jitter impact
      'Max Single Frame Duration Decrease' field value without jitter impact
      Max Duration Increase: 0.00 ms
      Max Duration Decrease: 0.00 ms
      Min Refresh Rate: 48 Hz
      Max Refresh Rate: 240 Hz
    Descriptor #2:
      Native Panel Range
      Fixed Average V-Total and Adaptive V-Total
      Supports Seamless Transition
      'Max Single Frame Duration Increase' field value without jitter impact
      'Max Single Frame Duration Decrease' field value without jitter impact
      Max Duration Increase: 0.00 ms
      Max Duration Decrease: 0.00 ms
      Min Refresh Rate: 60 Hz
      Max Refresh Rate: 240 Hz
    Descriptor #3:
      Native Panel Range
      Fixed Average V-Total and Adaptive V-Total
      Supports Seamless Transition
      'Max Single Frame Duration Increase' field value without jitter impact
      'Max Single Frame Duration Decrease' field value without jitter impact
      Max Duration Increase: 0.00 ms
      Max Duration Decrease: 0.00 ms
      Min Refresh Rate: 48 Hz
      Max Refresh Rate: 60 Hz
  CTA-861 DisplayID Data Block:
  Vendor-Specific Data Block (AMD), OUI 00-00-1A:
    Version: 3
    Flags 1: 0x59
      FreeSync Supported
      Local Dimming Supported
      Panel Replay/PSR Switch Supported
      Panel Replay Supported
    Minimum Refresh Rate: 48 Hz
    Maximum Refresh Rate: 0 Hz
    Flags 5: 0x40
      Display is Mini LED
  Display Parameters Data Block (0x21):
    Image size: 345.0 mm x 215.0 mm
    Display native pixel format: 2560x1600
    Scan Orientation: Left to Right, Top to Bottom
    Luminance Information: Minimum guaranteed value
    Color Information: CIE 1931
    Audio Speaker Information: not integrated
    Native Color Chromaticity:
      Primary #1:  (0.684814, 0.310791)
      Primary #2:  (0.255859, 0.707764)
      Primary #3:  (0.147949, 0.046875)
      White Point: (0.312988, 0.328857)
    Native Maximum Luminance (Full Coverage): 600.000000 cd/m^2
    Native Maximum Luminance (10% Rectangular Coverage): 1260.000000 cd/m^2
    Native Minimum Luminance: 0.049988 cd/m^2
    Native Color Depth: 10 bpc
    Display Device Technology: Active Matrix LCD
    Native Gamma EOTF: 2.20
  Checksum: 0x76
Checksum: 0x90

----------------

Warnings:

Block 1, CTA-861 Extension Block:
  IT Video Formats are overscanned by default, but normally this should be underscanned.
  Colorimetry Data Block: Set the sRGB colorimetry bit to avoid interop issues.
EDID:
  Base EDID: Some timings are out of range of the Monitor Ranges:
    Horizontal Freq: 0.500 - 403.200 kHz (Monitor: 504.000 - 504.000 kHz)

Failures:

Block 1, CTA-861 Extension Block:
  Required 640x480p60 timings are missing in the established timings and the SVD list (VIC 1).
  Missing VCDB, needed for Set Selectable RGB Quantization to avoid interop issues.
Block 2, DisplayID Extension Block:
  Video Timing Modes Type 7 - Detailed Timings Data Block: 0 or negative horizontal back porch.
  Video Timing Modes Type 7 - Detailed Timings Data Block: 0 or negative vertical back porch.
EDID:
  Extension Block 3 started with EDID header, ignoring Extension Blocks >= 3.

EDID conformity: FAIL
