edid-decode (hex):

00 ff ff ff ff ff ff 00 09 e5 86 0a 00 00 00 00
19 1f 01 04 95 22 13 78 02 c9 a0 95 5d 59 91 29
1f 50 54 00 00 00 01 01 01 01 01 01 01 01 01 01
01 01 01 01 01 01 ae 41 80 8c 71 38 82 40 30 20
36 00 58 c2 10 00 00 1a 8b 34 80 8c 71 38 82 40
30 20 36 00 58 c2 10 00 00 1a 00 00 00 fe 00 31
44 57 31 4d 80 4e 56 31 35 4e 34 56 00 00 00 00
00 00 41 21 96 00 10 00 00 0a 01 0a 20 20 00 8f

----------------

Block 0, Base EDID:
  EDID Structure Version & Revision: 1.4
  Vendor & Product Identification:
    Manufacturer: BOE
    Model: 2694
    Made in: week 25 of 2021
  Basic Display Parameters & Features:
    Digital display
    Bits per primary color channel: 6
    DisplayPort interface
    Maximum image size: 34 cm x 19 cm
    Gamma: 2.20
    Supported color formats: RGB 4:4:4
    First detailed timing includes the native pixel format and preferred refresh rate
  Color Characteristics:
    Red  : 0.5849, 0.3632
    Green: 0.3496, 0.5673
    Blue : 0.1621, 0.1230
    White: 0.3125, 0.3281
  Established Timings I & II: none
  Standard Timings: none
  Detailed Timing Descriptors:
    DTD 1:  1920x1080   59.999429 Hz  16:9     72.599 kHz    168.140000 MHz (344 mm x 194 mm)
                 Hfront   48 Hsync  32 Hback  316 Hpol P
                 Vfront    3 Vsync   6 Vback  121 Vpol N
    DTD 2:  1920x1080   47.998830 Hz  16:9     58.079 kHz    134.510000 MHz (344 mm x 194 mm)
                 Hfront   48 Hsync  32 Hback  316 Hpol P
                 Vfront    3 Vsync   6 Vback  121 Vpol N
    Alphanumeric Data String: '1DW1M.NV15N4V'
    Manufacturer-Specified Display Descriptor (0x00): 00 00 00 00 41 21 96 00 10 00 00 0a 01 0a 20 20 '....A!........  '
Checksum: 0x8f

----------------

Warnings:

Block 0, Base EDID:
  Alphanumeric Data String: Non-ASCII character 0x80 at position 5, can cause problems.
  Missing Display Product Name.

EDID conformity: PASS
