edid-decode (hex):

00 ff ff ff ff ff ff 00 06 af 3c 11 00 00 00 00
00 16 01 04 95 1f 11 78 02 bb f5 94 55 54 90 27
23 50 54 00 00 00 01 01 01 01 01 01 01 01 01 01
01 01 01 01 01 01 ce 1d 56 d2 50 00 26 30 10 10
3e 00 35 ad 10 00 00 18 00 00 00 0f 00 00 00 00
00 00 00 00 00 00 00 00 00 20 00 00 00 fe 00 41
55 4f 0a 20 20 20 20 20 20 20 20 20 00 00 00 fe
00 42 31 34 30 58 54 54 30 31 2e 31 20 0a 00 13

00 ff ff ff ff ff ff 00 06 af 3c 11 00 00 00 00
00 16 01 04 95 1f 11 78 02 bb f5 94 55 54 90 27
23 50 54 00 00 00 01 01 01 01 01 01 01 01 01 01
01 01 01 01 01 01 ce 1d 56 d2 50 00 26 30 10 10
3e 00 35 ad 10 00 00 18 00 00 00 0f 00 00 00 00
00 00 00 00 00 00 00 00 00 20 00 00 00 fe 00 41
55 4f 0a 20 20 20 20 20 20 20 20 20 00 00 00 fe
00 42 31 34 30 58 54 54 30 31 2e 31 20 0a 00 13

----------------

Block 0, Base EDID:
  EDID Structure Version & Revision: 1.4
  Vendor & Product Identification:
    Manufacturer: AUO
    Model: 4412
    Made in: 2012
  Basic Display Parameters & Features:
    Digital display
    Bits per primary color channel: 6
    DisplayPort interface
    Maximum image size: 31 cm x 17 cm
    Gamma: 2.20
    Supported color formats: RGB 4:4:4
    First detailed timing includes the native pixel format and preferred refresh rate
  Color Characteristics:
    Red  : 0.5800, 0.3349
    Green: 0.3300, 0.5654
    Blue : 0.1552, 0.1396
    White: 0.3134, 0.3291
  Established Timings I & II: none
  Standard Timings: none
  Detailed Timing Descriptors:
    DTD 1:  1366x768    60.066632 Hz 683:384   48.414 kHz     76.300000 MHz (309 mm x 173 mm)
                 Hfront   16 Hsync  16 Hback  178 Hpol N
                 Vfront    3 Vsync  14 Vback   21 Vpol N
    Manufacturer-Specified Display Descriptor (0x0f): 00 0f 00 00 00 00 00 00 00 00 00 00 00 00 00 20 '............... '
    Alphanumeric Data String: 'AUO'
    Alphanumeric Data String: 'B140XTT01.1 '
Checksum: 0x13

----------------

Warnings:

Block 0, Base EDID:
  Missing Display Product Name.

Failures:

Block 0, Base EDID:
  Alphanumeric Data String: One or more trailing spaces before newline.
EDID:
  Extension Block 1 started with EDID header, ignoring Extension Blocks >= 1.

EDID conformity: FAIL
