edid-decode (hex):

00 ff ff ff ff ff ff 00 0d af 69 14 00 00 00 00
16 16 01 04 90 1f 11 78 02 d1 45 9b 59 57 8e 2b
23 50 54 00 00 00 01 01 01 01 01 01 01 01 01 01
01 01 01 01 01 01 12 1b 56 72 50 00 0c 30 10 22
26 00 35 ae 10 00 00 1a 0c 12 56 72 50 00 0c 30
10 22 26 00 35 ae 10 00 00 1a 00 00 00 fe 00 37
4a 52 54 39 80 31 34 30 42 47 45 0a 00 00 00 00
00 00 41 31 94 00 00 00 00 01 01 0a 20 20 00 17

----------------

Block 0, Base EDID:
  EDID Structure Version & Revision: 1.4
  Vendor & Product Identification:
    Manufacturer: CMO
    Model: 5225
    Made in: week 22 of 2012
  Basic Display Parameters & Features:
    Digital display
    Bits per primary color channel: 6
    Digital interface is not defined
    Maximum image size: 31 cm x 17 cm
    Gamma: 2.20
    Supported color formats: RGB 4:4:4
    First detailed timing includes the native pixel format and preferred refresh rate
  Color Characteristics:
    Red  : 0.6083, 0.3486
    Green: 0.3398, 0.5556
    Blue : 0.1689, 0.1367
    White: 0.3134, 0.3291
  Established Timings I & II: none
  Standard Timings: none
  Detailed Timing Descriptors:
    DTD 1:  1366x768    60.031185 Hz 683:384   46.824 kHz     69.300000 MHz (309 mm x 174 mm)
                 Hfront   16 Hsync  34 Hback   64 Hpol P
                 Vfront    2 Vsync   6 Vback    4 Vpol N
    DTD 2:  1366x768    40.020790 Hz 683:384   31.216 kHz     46.200000 MHz (309 mm x 174 mm)
                 Hfront   16 Hsync  34 Hback   64 Hpol P
                 Vfront    2 Vsync   6 Vback    4 Vpol N
    Alphanumeric Data String: '7JRT9.140BGE'
    Manufacturer-Specified Display Descriptor (0x00): 00 00 00 00 41 31 94 00 00 00 00 01 01 0a 20 20 '....A1........  '
Checksum: 0x17

----------------

Warnings:

Block 0, Base EDID:
  Alphanumeric Data String: Non-ASCII character 0x80 at position 5, can cause problems.
  Missing Display Product Name.

EDID conformity: PASS
