edid-decode (hex):

00 ff ff ff ff ff ff 00 09 e5 5f 09 00 00 00 00
17 1d 01 03 80 1c 13 78 02 de 50 a3 54 4c 99 26
0f 50 54 00 00 00 01 01 01 01 01 01 01 01 01 01
01 01 01 01 01 01 11 5c d0 18 81 e0 2d 50 30 20
36 00 1d be 10 00 00 1a a7 49 d0 18 81 e0 2d 50
30 20 36 00 1d be 10 00 00 1a 00 00 00 fe 00 42
4f 45 20 43 51 0a 20 20 20 20 20 20 00 00 00 fe
00 4e 45 31 33 35 46 42 4d 2d 4e 34 31 0a 01 21

02 03 19 c1 44 83 10 02 01 23 09 07 07 83 01 00
00 67 03 0c 00 10 00 00 44 11 5c d0 18 81 e0 2d
50 30 20 36 00 1d be 10 00 00 1a 00 00 00 00 00
00 00 00 00 00 00 00 00 00 00 00 00 00 00 00 00
00 00 00 00 00 00 00 00 00 00 00 00 00 00 00 00
00 00 00 00 00 00 00 00 00 00 00 00 00 00 00 00
00 00 00 00 00 00 00 00 00 00 00 00 00 00 00 00
00 00 00 00 00 00 00 00 00 00 00 00 00 00 00 01

00 ff ff ff ff ff ff 00 09 e5 5f 09 00 00 00 00
17 1d 01 03 80 1c 13 78 02 de 50 a3 54 4c 99 26
0f 50 54 00 00 00 01 01 01 01 01 01 01 01 01 01
01 01 01 01 01 01 11 5c d0 18 81 e0 2d 50 30 20
36 00 1d be 10 00 00 1a a7 49 d0 18 81 e0 2d 50
30 20 36 00 1d be 10 00 00 1a 00 00 00 fe 00 42
4f 45 20 43 51 0a 20 20 20 20 20 20 00 00 00 fe
00 4e 45 31 33 35 46 42 4d 2d 4e 34 31 0a 01 21

02 03 19 c1 44 83 10 02 01 23 09 07 07 83 01 00
00 67 03 0c 00 10 00 00 44 11 5c d0 18 81 e0 2d
50 30 20 36 00 1d be 10 00 00 1a 00 00 00 00 00
00 00 00 00 00 00 00 00 00 00 00 00 00 00 00 00
00 00 00 00 00 00 00 00 00 00 00 00 00 00 00 00
00 00 00 00 00 00 00 00 00 00 00 00 00 00 00 00
00 00 00 00 00 00 00 00 00 00 00 00 00 00 00 00
00 00 00 00 00 00 00 00 00 00 00 00 00 00 00 01

----------------

Block 0, Base EDID:
  EDID Structure Version & Revision: 1.3
  Vendor & Product Identification:
    Manufacturer: BOE
    Model: 2399
    Made in: week 23 of 2019
  Basic Display Parameters & Features:
    Digital display
    Maximum image size: 28 cm x 19 cm
    Gamma: 2.20
    Monochrome or grayscale display
    First detailed timing is the preferred timing
  Color Characteristics:
    Red  : 0.6396, 0.3291
    Green: 0.2998, 0.5996
    Blue : 0.1494, 0.0595
    White: 0.3125, 0.3281
  Established Timings I & II: none
  Standard Timings: none
  Detailed Timing Descriptors:
    DTD 1:  2256x1504   59.998513 Hz   3:2     92.938 kHz    235.690000 MHz (285 mm x 190 mm)
                 Hfront   48 Hsync  32 Hback  200 Hpol P
                 Vfront    3 Vsync   6 Vback   36 Vpol N
    DTD 2:  2256x1504   47.998302 Hz   3:2     74.349 kHz    188.550000 MHz (285 mm x 190 mm)
                 Hfront   48 Hsync  32 Hback  200 Hpol P
                 Vfront    3 Vsync   6 Vback   36 Vpol N
    Alphanumeric Data String: 'BOE CQ'
    Alphanumeric Data String: 'NE135FBM-N41'
  Extension blocks: 1
Checksum: 0x21

----------------

Block 1, CTA-861 Extension Block:
  Revision: 3
  Underscans IT Video Formats by default
  Basic audio support
  Native DTDs: 1
  Video Data Block:
    VIC   3:   720x480    59.940060 Hz  16:9     31.469 kHz     27.000000 MHz (native)
    VIC  16:  1920x1080   60.000000 Hz  16:9     67.500 kHz    148.500000 MHz
    VIC   2:   720x480    59.940060 Hz   4:3     31.469 kHz     27.000000 MHz
    VIC   1:   640x480    59.940476 Hz   4:3     31.469 kHz     25.175000 MHz
  Audio Data Block:
    Linear PCM:
      Max channels: 2
      Supported sample rates (kHz): 48 44.1 32
      Supported sample sizes (bits): 24 20 16
  Speaker Allocation Data Block:
    FL/FR - Front Left/Right
  Vendor-Specific Data Block (HDMI), OUI 00-0C-03:
    Source physical address: 1.0.0.0
    Maximum TMDS clock: 340 MHz
  Detailed Timing Descriptors:
    DTD 3:  2256x1504   59.998513 Hz   3:2     92.938 kHz    235.690000 MHz (285 mm x 190 mm)
                 Hfront   48 Hsync  32 Hback  200 Hpol P
                 Vfront    3 Vsync   6 Vback   36 Vpol N
Checksum: 0x01  Unused space in Extension Block: 84 bytes

----------------

Warnings:

Block 1, CTA-861 Extension Block:
  Video Data Block: VIC 3 and the first DTD are not identical. Is this intended?
  Add a Colorimetry Data Block with the sRGB colorimetry bit set to avoid interop issues.

Failures:

Block 0, Base EDID:
  Missing Display Product Name.
  Missing Display Range Limits Descriptor.
Block 1, CTA-861 Extension Block:
  Missing VCDB, needed for Set Selectable RGB Quantization to avoid interop issues.
EDID:
  Extension Block 2 started with EDID header, ignoring Extension Blocks >= 2.
  CTA-861: Native progressive timings are a mix of several resolutions.

EDID conformity: FAIL
