edid-decode (hex):

00 ff ff ff ff ff ff 00 0c 65 00 00 f0 da 14 00
16 11 01 03 0c 22 1b 78 ca f0 65 98 57 51 91 27
21 50 54 ad cf 00 81 c0 81 ca 81 cf 01 01 01 01
01 01 01 01 01 01 66 21 56 aa 51 00 1e 30 46 8f
33 00 52 0e 11 00 00 1e 00 00 00 ff 00 52 54 44
54 56 5f 56 47 41 0a 0a 0a 0a 00 00 00 fd 00 37
4c 1e 52 0e 00 0a 20 20 20 20 20 20 00 00 00 10
00 0a 20 20 20 20 20 20 20 20 20 20 20 20 00 76

00 ff ff ff ff ff ff 00 0c 65 00 00 f0 da 14 00
16 11 01 03 0c 22 1b 78 ca f0 65 98 57 51 91 27
21 50 54 ad cf 00 81 c0 81 ca 81 cf 01 01 01 01
01 01 01 01 01 01 66 21 56 aa 51 00 1e 30 46 8f
33 00 52 0e 11 00 00 1e 00 00 00 ff 00 52 54 44
54 56 5f 56 47 41 0a 0a 0a 0a 00 00 00 fd 00 37
4c 1e 52 0e 00 0a 20 20 20 20 20 20 00 00 00 10
00 0a 20 20 20 20 20 20 20 20 20 20 20 20 00 76

----------------

Block 0, Base EDID:
  EDID Structure Version & Revision: 1.3
  Vendor & Product Identification:
    Manufacturer: CCE
    Model: 0
    Serial Number: ...
    Made in: week 22 of 2007
  Basic Display Parameters & Features:
    Analog display
    Signal Level Standard: 0.700 : 0.300 : 1.000 V p-p
    Blank level equals black level
    Sync: Separate Composite
    Maximum image size: 34 cm x 27 cm
    Gamma: 2.20
    DPMS levels: Standby Suspend
    RGB color display
    First detailed timing is the preferred timing
  Color Characteristics:
    Red  : 0.5966, 0.3427
    Green: 0.3164, 0.5664
    Blue : 0.1533, 0.1308
    White: 0.3134, 0.3291
  Established Timings I & II:
    IBM     :   720x400    70.081663 Hz   9:5     31.467 kHz     28.320000 MHz
    DMT 0x04:   640x480    59.940476 Hz   4:3     31.469 kHz     25.175000 MHz
    DMT 0x05:   640x480    72.808802 Hz   4:3     37.861 kHz     31.500000 MHz
    DMT 0x06:   640x480    75.000000 Hz   4:3     37.500 kHz     31.500000 MHz
    DMT 0x09:   800x600    60.316541 Hz   4:3     37.879 kHz     40.000000 MHz
    DMT 0x0a:   800x600    72.187572 Hz   4:3     48.077 kHz     50.000000 MHz
    DMT 0x0b:   800x600    75.000000 Hz   4:3     46.875 kHz     49.500000 MHz
    DMT 0x10:  1024x768    60.003840 Hz   4:3     48.363 kHz     65.000000 MHz
    DMT 0x11:  1024x768    70.069359 Hz   4:3     56.476 kHz     75.000000 MHz
    DMT 0x12:  1024x768    75.028582 Hz   4:3     60.023 kHz     78.750000 MHz
    DMT 0x24:  1280x1024   75.024675 Hz   5:4     79.976 kHz    135.000000 MHz
  Standard Timings:
    DMT 0x55:  1280x720    60.000000 Hz  16:9     45.000 kHz     74.250000 MHz
    GTF     :  1280x720    70.000000 Hz  16:9     52.500 kHz     89.040000 MHz
    GTF     :  1280x720    74.999686 Hz  16:9     56.400 kHz     95.654000 MHz
  Detailed Timing Descriptors:
    DTD 1:  1366x768    59.789541 Hz 683:384   47.712 kHz     85.500000 MHz (338 mm x 270 mm)
                 Hfront   70 Hsync 143 Hback  213 Hpol P
                 Vfront    3 Vsync   3 Vback   24 Vpol P
    Display Product Serial Number: ...
    Display Range Limits:
      Monitor ranges (GTF): 55-76 Hz V, 30-82 kHz H, max dotclock 140 MHz
    Dummy Descriptor:
Checksum: 0x76

----------------

Block 1, Unknown EDID Extension Block 0x00:
  00 ff ff ff ff ff ff 00 0c 65 00 00 f0 da 14 00 '.........e......'
  16 11 01 03 0c 22 1b 78 ca f0 65 98 57 51 91 27 '.....".x..e.WQ.''
  21 50 54 ad cf 00 81 c0 81 ca 81 cf 01 01 01 01 '!PT.............'
  01 01 01 01 01 01 66 21 56 aa 51 00 1e 30 46 8f '......f!V.Q..0F.'
  33 00 52 0e 11 00 00 1e 00 00 00 ff 00 52 54 44 '3.R..........RTD'
  54 56 5f 56 47 41 0a 0a 0a 0a 00 00 00 fd 00 37 'TV_VGA.........7'
  4c 1e 52 0e 00 0a 20 20 20 20 20 20 00 00 00 10 'L.R...      ....'
  00 0a 20 20 20 20 20 20 20 20 20 20 20 20 00 76 '..            .v'
Checksum: 0x76

----------------

Warnings:

Block 0, Base EDID:
  Detailed Timing Descriptor #1: Image size is 338x270 mm, but based on the picture AR it should be 338x190 mm.

Failures:

Block 0, Base EDID:
  Display Product Serial Number: ...
  Dummy Descriptor: Dummy block filled with garbage.
  Missing Display Product Name.
Block 1, Base EDID:
  Unknown Extension Block.
EDID:
  Base EDID: EDID specified 0 extension block(s), but found 1 extension block(s).

EDID conformity: FAIL
