edid-decode (hex):

00 ff ff ff ff ff ff 00 04 72 c5 00 c3 0e 20 92
16 13 01 03 6c 2c 19 78 ea ee 95 a3 54 4c 99 26
0f 50 54 bf ef 80 71 4f 81 c0 81 00 81 40 81 80
8b c0 a9 c0 a9 cf 2f 26 40 a0 60 84 1a 30 30 20
35 00 bb f9 10 00 00 1a 00 00 00 fd 00 38 4b 1f
53 0f 00 0a 20 20 20 20 20 20 00 00 00 fc 00 41
63 65 72 20 50 32 30 35 48 0a 20 20 00 00 00 ff
00 4c 47 4c 30 57 30 31 35 34 33 33 30 0a 00 c2

00 ff ff ff ff ff ff 00 04 72 c5 00 c3 0e 20 92
16 13 01 03 6c 2c 19 78 ea ee 95 a3 54 4c 99 26
0f 50 54 bf ef 80 71 4f 81 c0 81 00 81 40 81 80
8b c0 a9 c0 a9 cf 2f 26 40 a0 60 84 1a 30 30 20
35 00 bb f9 10 00 00 1a 00 00 00 fd 00 38 4b 1f
53 0f 00 0a 20 20 20 20 20 20 00 00 00 fc 00 41
63 65 72 20 50 32 30 35 48 0a 20 20 00 00 00 ff
00 4c 47 4c 30 57 30 31 35 34 33 33 30 0a 00 c2

----------------

Block 0, Base EDID:
  EDID Structure Version & Revision: 1.3
  Vendor & Product Identification:
    Manufacturer: ACR
    Model: 197
    Serial Number: ...
    Made in: week 22 of 2009
  Basic Display Parameters & Features:
    Analog display
    Signal Level Standard: 0.700 : 0.000 : 0.700 V p-p
    Blank level equals black level
    Sync: Separate Composite
    Maximum image size: 44 cm x 25 cm
    Gamma: 2.20
    DPMS levels: Standby Suspend Off
    RGB color display
    First detailed timing is the preferred timing
  Color Characteristics:
    Red  : 0.6396, 0.3300
    Green: 0.2998, 0.5996
    Blue : 0.1503, 0.0595
    White: 0.3134, 0.3291
  Established Timings I & II:
    IBM     :   720x400    70.081663 Hz   9:5     31.467 kHz     28.320000 MHz
    DMT 0x04:   640x480    59.940476 Hz   4:3     31.469 kHz     25.175000 MHz
    Apple   :   640x480    66.666667 Hz   4:3     35.000 kHz     30.240000 MHz
    DMT 0x05:   640x480    72.808802 Hz   4:3     37.861 kHz     31.500000 MHz
    DMT 0x06:   640x480    75.000000 Hz   4:3     37.500 kHz     31.500000 MHz
    DMT 0x08:   800x600    56.250000 Hz   4:3     35.156 kHz     36.000000 MHz
    DMT 0x09:   800x600    60.316541 Hz   4:3     37.879 kHz     40.000000 MHz
    DMT 0x0a:   800x600    72.187572 Hz   4:3     48.077 kHz     50.000000 MHz
    DMT 0x0b:   800x600    75.000000 Hz   4:3     46.875 kHz     49.500000 MHz
    Apple   :   832x624    74.551266 Hz   4:3     49.726 kHz     57.284000 MHz
    DMT 0x10:  1024x768    60.003840 Hz   4:3     48.363 kHz     65.000000 MHz
    DMT 0x11:  1024x768    70.069359 Hz   4:3     56.476 kHz     75.000000 MHz
    DMT 0x12:  1024x768    75.028582 Hz   4:3     60.023 kHz     78.750000 MHz
    DMT 0x24:  1280x1024   75.024675 Hz   5:4     79.976 kHz    135.000000 MHz
    Apple   :  1152x870    75.061550 Hz 192:145   68.681 kHz    100.000000 MHz
  Standard Timings:
    DMT 0x15:  1152x864    75.000000 Hz   4:3     67.500 kHz    108.000000 MHz
    DMT 0x55:  1280x720    60.000000 Hz  16:9     45.000 kHz     74.250000 MHz
    DMT 0x1c:  1280x800    59.810326 Hz  16:10    49.702 kHz     83.500000 MHz
    DMT 0x20:  1280x960    60.000000 Hz   4:3     60.000 kHz    108.000000 MHz
    DMT 0x23:  1280x1024   60.019740 Hz   5:4     63.981 kHz    108.000000 MHz
    GTF     :  1360x765    60.000341 Hz  16:9     47.520 kHz     84.396000 MHz
    DMT 0x53:  1600x900    60.000000 Hz  16:9     60.000 kHz    108.000000 MHz (RB)
    GTF     :  1600x900    75.000000 Hz  16:9     70.500 kHz    152.280000 MHz
  Detailed Timing Descriptors:
    DTD 1:  1600x900    59.978156 Hz  16:9     55.540 kHz     97.750000 MHz (443 mm x 249 mm)
                 Hfront   48 Hsync  32 Hback   80 Hpol P
                 Vfront    3 Vsync   5 Vback   18 Vpol N
    Display Range Limits:
      Monitor ranges (GTF): 56-75 Hz V, 31-83 kHz H, max dotclock 150 MHz
    Display Product Name: 'Acer P205H'
    Display Product Serial Number: ...
Checksum: 0xc2

----------------

Warnings:

Block 0, Base EDID:
  Standard Timings: Standard Timing 1360x765 has a dubious odd vertical resolution.
EDID:
  Base EDID: Some timings are out of range of the Monitor Ranges:
    Maximum Clock: 152.280 MHz (Monitor: 150.000 MHz)
    Could be due to a Monitor Range off-by-one rounding issue

Failures:

EDID:
  Extension Block 1 started with EDID header, ignoring Extension Blocks >= 1.

EDID conformity: FAIL
