edid-decode (hex):

00 ff ff ff ff ff ff 00 06 af 5c 40 00 00 00 00
00 17 01 04 90 1a 0e 78 02 99 85 95 55 56 92 28
22 50 54 00 00 00 01 01 01 01 01 01 01 01 01 01
01 01 01 01 01 01 70 1c 56 a2 50 00 19 30 30 20
36 00 00 90 10 00 00 1a 20 17 56 bc 50 00 19 30
30 20 36 00 00 90 10 00 00 1a 00 00 00 fe 00 30
4d 4d 57 4e 80 42 31 31 36 58 54 4e 00 00 00 00
00 00 41 02 97 00 10 00 00 01 01 0a 20 20 00 03

00 ff ff ff ff ff ff 00 06 af 5c 40 00 00 00 00
00 17 01 04 90 1a 0e 78 02 99 85 95 55 56 92 28
22 50 54 00 00 00 01 01 01 01 01 01 01 01 01 01
01 01 01 01 01 01 70 1c 56 a2 50 00 19 30 30 20
36 00 00 90 10 00 00 1a 20 17 56 bc 50 00 19 30
30 20 36 00 00 90 10 00 00 1a 00 00 00 fe 00 30
4d 4d 57 4e 80 42 31 31 36 58 54 4e 00 00 00 00
00 00 41 02 97 00 10 00 00 01 01 0a 20 20 00 03

----------------

Block 0, Base EDID:
  EDID Structure Version & Revision: 1.4
  Vendor & Product Identification:
    Manufacturer: AUO
    Model: 16476
    Made in: 2013
  Basic Display Parameters & Features:
    Digital display
    Bits per primary color channel: 6
    Digital interface is not defined
    Maximum image size: 26 cm x 14 cm
    Gamma: 2.20
    Supported color formats: RGB 4:4:4
    First detailed timing includes the native pixel format and preferred refresh rate
  Color Characteristics:
    Red  : 0.5839, 0.3330
    Green: 0.3378, 0.5712
    Blue : 0.1582, 0.1328
    White: 0.3134, 0.3291
  Established Timings I & II: none
  Standard Timings: none
  Detailed Timing Descriptors:
    DTD 1:  1366x768    60.080680 Hz 683:384   47.644 kHz     72.800000 MHz (256 mm x 144 mm)
                 Hfront   48 Hsync  32 Hback   82 Hpol P
                 Vfront    3 Vsync   6 Vback   16 Vpol N
    DTD 2:  1366x768    48.039392 Hz 683:384   38.095 kHz     59.200000 MHz (256 mm x 144 mm)
                 Hfront   48 Hsync  32 Hback  108 Hpol P
                 Vfront    3 Vsync   6 Vback   16 Vpol N
    Alphanumeric Data String: '0MMWN.B116XTN'
    Manufacturer-Specified Display Descriptor (0x00): 00 00 00 00 41 02 97 00 10 00 00 01 01 0a 20 20 '....A.........  '
Checksum: 0x03

----------------

Block 1, Unknown EDID Extension Block 0x00:
  00 ff ff ff ff ff ff 00 06 af 5c 40 00 00 00 00 '..........\@....'
  00 17 01 04 90 1a 0e 78 02 99 85 95 55 56 92 28 '.......x....UV.('
  22 50 54 00 00 00 01 01 01 01 01 01 01 01 01 01 '"PT.............'
  01 01 01 01 01 01 70 1c 56 a2 50 00 19 30 30 20 '......p.V.P..00 '
  36 00 00 90 10 00 00 1a 20 17 56 bc 50 00 19 30 '6....... .V.P..0'
  30 20 36 00 00 90 10 00 00 1a 00 00 00 fe 00 30 '0 6............0'
  4d 4d 57 4e 80 42 31 31 36 58 54 4e 00 00 00 00 'MMWN.B116XTN....'
  00 00 41 02 97 00 10 00 00 01 01 0a 20 20 00 03 '..A.........  ..'
Checksum: 0x03

----------------

Warnings:

Block 0, Base EDID:
  Alphanumeric Data String: Non-ASCII character 0x80 at position 5, can cause problems.
  Missing Display Product Name.

Failures:

Block 1, Base EDID:
  Unknown Extension Block.
EDID:
  Base EDID: EDID specified 0 extension block(s), but found 1 extension block(s).

EDID conformity: FAIL
