edid-decode (hex):

00 ff ff ff ff ff ff 00 25 e4 c3 1b 01 01 01 01
1b 17 01 03 18 3c 22 78 2e b2 05 a3 56 4f 9e 28
0f 50 54 33 08 00 81 80 81 40 b3 00 95 00 81 c0
01 01 01 01 01 01 1a 36 80 a0 70 38 1f 40 30 20
35 00 56 51 21 00 00 1a 00 00 00 fd 00 37 43 18
53 0f 00 0a 20 20 20 20 20 20 00 00 00 ff 00 47
35 47 47 30 30 30 35 35 38 31 4c 0a 00 00 00 fc
00 4c 43 44 2d 4d 46 32 37 34 58 0a 20 20 00 9c

00 ff ff ff ff ff ff 00 25 e4 c3 1b 01 01 01 01
1b 17 01 03 18 3c 22 78 2e b2 05 a3 56 4f 9e 28
0f 50 54 33 08 00 81 80 81 40 b3 00 95 00 81 c0
01 01 01 01 01 01 1a 36 80 a0 70 38 1f 40 30 20
35 00 56 51 21 00 00 1a 00 00 00 fd 00 37 43 18
53 0f 00 0a 20 20 20 20 20 20 00 00 00 ff 00 47
35 47 47 30 30 30 35 35 38 31 4c 0a 00 00 00 fc
00 4c 43 44 2d 4d 46 32 37 34 58 0a 20 20 00 9c

----------------

Block 0, Base EDID:
  EDID Structure Version & Revision: 1.3
  Vendor & Product Identification:
    Manufacturer: IOD
    Model: 7107
    Serial Number: ...
    Made in: week 27 of 2013
  Basic Display Parameters & Features:
    Analog display
    Signal Level Standard: 0.700 : 0.300 : 1.000 V p-p
    Blank-to-black setup/pedestal
    Sync: Separate
    Maximum image size: 60 cm x 34 cm
    Gamma: 2.20
    DPMS levels: Off
    RGB color display
    Default (sRGB) color space is primary color space
    First detailed timing is the preferred timing
  Color Characteristics:
    Red  : 0.6386, 0.3388
    Green: 0.3085, 0.6191
    Blue : 0.1562, 0.0585
    White: 0.3134, 0.3291
  Established Timings I & II:
    DMT 0x04:   640x480    59.940476 Hz   4:3     31.469 kHz     25.175000 MHz
    Apple   :   640x480    66.666667 Hz   4:3     35.000 kHz     30.240000 MHz
    DMT 0x08:   800x600    56.250000 Hz   4:3     35.156 kHz     36.000000 MHz
    DMT 0x09:   800x600    60.316541 Hz   4:3     37.879 kHz     40.000000 MHz
    DMT 0x10:  1024x768    60.003840 Hz   4:3     48.363 kHz     65.000000 MHz
  Standard Timings:
    DMT 0x23:  1280x1024   60.019740 Hz   5:4     63.981 kHz    108.000000 MHz
    DMT 0x20:  1280x960    60.000000 Hz   4:3     60.000 kHz    108.000000 MHz
    DMT 0x3a:  1680x1050   59.954250 Hz  16:10    65.290 kHz    146.250000 MHz
    DMT 0x2f:  1440x900    59.887445 Hz  16:10    55.935 kHz    106.500000 MHz
    DMT 0x55:  1280x720    60.000000 Hz  16:9     45.000 kHz     74.250000 MHz
  Detailed Timing Descriptors:
    DTD 1:  1920x1080   59.933878 Hz  16:9     66.587 kHz    138.500000 MHz (598 mm x 337 mm)
                 Hfront   48 Hsync  32 Hback   80 Hpol P
                 Vfront    3 Vsync   5 Vback   23 Vpol N
    Display Range Limits:
      Monitor ranges (GTF): 55-67 Hz V, 24-83 kHz H, max dotclock 150 MHz
    Display Product Serial Number: ...
    Display Product Name: 'LCD-MF274X'
Checksum: 0x9c

----------------

Warnings:

Block 0, Base EDID:
  Vendor & Product Identification: The serial number is one of the known dummy values, it should probably be set to 0.

Failures:

Block 0, Base EDID:
  Basic Display Parameters & Features: sRGB is signaled, but the chromaticities do not match.
EDID:
  Extension Block 1 started with EDID header, ignoring Extension Blocks >= 1.

EDID conformity: FAIL
