edid-decode (hex):

00 ff ff ff ff ff ff 00 10 ac 3b 40 4d 39 32 33
29 12 01 04 a5 2f 1e 78 e2 a6 e5 aa 51 32 ac 26
14 50 54 a5 4b 00 71 4f 81 80 b3 00 01 01 01 01
01 01 01 01 01 01 21 39 90 30 62 1a 27 40 68 b0
36 00 d9 28 11 00 00 1c 00 00 00 ff 00 47 34 35
36 48 38 41 41 33 32 39 4d 0a 00 00 00 fc 00 44
45 4c 4c 20 32 32 30 38 57 46 50 0a 00 00 00 fd
00 38 4c 1e 53 10 00 0a 20 20 20 20 20 20 00 87

00 ff ff ff ff ff ff 00 10 ac 3b 40 4d 39 32 33
29 12 01 04 a5 2f 1e 78 e2 a6 e5 aa 51 32 ac 26
14 50 54 a5 4b 00 71 4f 81 80 b3 00 01 01 01 01
01 01 01 01 01 01 21 39 90 30 62 1a 27 40 68 b0
36 00 d9 28 11 00 00 1c 00 00 00 ff 00 47 34 35
36 48 38 41 41 33 32 39 4d 0a 00 00 00 fc 00 44
45 4c 4c 20 32 32 30 38 57 46 50 0a 00 00 00 fd
00 38 4c 1e 53 10 00 0a 20 20 20 20 20 20 00 87

----------------

Block 0, Base EDID:
  EDID Structure Version & Revision: 1.4
  Vendor & Product Identification:
    Manufacturer: DEL
    Model: 16443
    Serial Number: ...
    Made in: week 41 of 2008
  Basic Display Parameters & Features:
    Digital display
    Bits per primary color channel: 8
    DisplayPort interface
    Maximum image size: 47 cm x 30 cm
    Gamma: 2.20
    DPMS levels: Standby Suspend Off
    Supported color formats: RGB 4:4:4
    First detailed timing includes the native pixel format and preferred refresh rate
  Color Characteristics:
    Red  : 0.6660, 0.3183
    Green: 0.1962, 0.6738
    Blue : 0.1513, 0.0800
    White: 0.3134, 0.3291
  Established Timings I & II:
    IBM     :   720x400    70.081663 Hz   9:5     31.467 kHz     28.320000 MHz
    DMT 0x04:   640x480    59.940476 Hz   4:3     31.469 kHz     25.175000 MHz
    DMT 0x06:   640x480    75.000000 Hz   4:3     37.500 kHz     31.500000 MHz
    DMT 0x09:   800x600    60.316541 Hz   4:3     37.879 kHz     40.000000 MHz
    DMT 0x0b:   800x600    75.000000 Hz   4:3     46.875 kHz     49.500000 MHz
    DMT 0x10:  1024x768    60.003840 Hz   4:3     48.363 kHz     65.000000 MHz
    DMT 0x12:  1024x768    75.028582 Hz   4:3     60.023 kHz     78.750000 MHz
    DMT 0x24:  1280x1024   75.024675 Hz   5:4     79.976 kHz    135.000000 MHz
  Standard Timings:
    DMT 0x15:  1152x864    75.000000 Hz   4:3     67.500 kHz    108.000000 MHz
    DMT 0x23:  1280x1024   60.019740 Hz   5:4     63.981 kHz    108.000000 MHz
    DMT 0x3a:  1680x1050   59.954250 Hz  16:10    65.290 kHz    146.250000 MHz
  Detailed Timing Descriptors:
    DTD 1:  1680x1050   59.954250 Hz  16:10    65.290 kHz    146.250000 MHz (473 mm x 296 mm)
                 Hfront  104 Hsync 176 Hback  280 Hpol N
                 Vfront    3 Vsync   6 Vback   30 Vpol P
    Display Product Serial Number: ...
    Display Product Name: 'DELL 2208WFP'
    Display Range Limits:
      Monitor ranges (GTF): 56-76 Hz V, 30-83 kHz H, max dotclock 160 MHz
Checksum: 0x87

----------------

Block 1, Unknown EDID Extension Block 0x00:
  00 ff ff ff ff ff ff 00 10 ac 3b 40 4d 39 32 33 '..........;@M923'
  29 12 01 04 a5 2f 1e 78 e2 a6 e5 aa 51 32 ac 26 ')..../.x....Q2.&'
  14 50 54 a5 4b 00 71 4f 81 80 b3 00 01 01 01 01 '.PT.K.qO........'
  01 01 01 01 01 01 21 39 90 30 62 1a 27 40 68 b0 '......!9.0b.'@h.'
  36 00 d9 28 11 00 00 1c 00 00 00 ff 00 47 34 35 '6..(.........G45'
  36 48 38 41 41 33 32 39 4d 0a 00 00 00 fc 00 44 '6H8AA329M......D'
  45 4c 4c 20 32 32 30 38 57 46 50 0a 00 00 00 fd 'ELL 2208WFP.....'
  00 38 4c 1e 53 10 00 0a 20 20 20 20 20 20 00 87 '.8L.S...      ..'
Checksum: 0x87

----------------

Warnings:

Block 0, Base EDID:
  Display Range Limits: GTF support is deprecated in EDID 1.4.

Failures:

Block 0, Base EDID:
  Display Range Limits: GTF is supported, but the display does not support continuous frequencies.
Block 1, Base EDID:
  Unknown Extension Block.
EDID:
  Base EDID: EDID specified 0 extension block(s), but found 1 extension block(s).

EDID conformity: FAIL
