edid-decode (hex):

00 ff ff ff ff ff ff 00 26 cf 1f 06 00 00 00 00
00 1d 01 04 a5 22 13 78 0a de 50 a3 54 4c 99 26
0f 50 54 00 00 00 01 01 01 01 01 01 01 01 01 01
01 01 01 01 01 01 38 36 80 a0 70 38 20 40 18 30
3c 00 58 c2 10 00 00 19 5c 2b 80 a0 70 38 20 40
18 30 3c 00 58 c2 10 00 00 19 00 00 00 fe 00 50
57 58 31 38 80 31 35 36 4e 57 46 37 00 00 00 00
00 02 41 31 1e 00 10 00 00 0a 01 0a 20 20 00 0d

----------------

Block 0, Base EDID:
  EDID Structure Version & Revision: 1.4
  Vendor & Product Identification:
    Manufacturer: IVO
    Model: 1567
    Made in: 2019
  Basic Display Parameters & Features:
    Digital display
    Bits per primary color channel: 8
    DisplayPort interface
    Maximum image size: 34 cm x 19 cm
    Gamma: 2.20
    Supported color formats: RGB 4:4:4, YCrCb 4:4:4
    First detailed timing includes the native pixel format and preferred refresh rate
  Color Characteristics:
    Red  : 0.6396, 0.3291
    Green: 0.2998, 0.5996
    Blue : 0.1494, 0.0595
    White: 0.3125, 0.3281
  Established Timings I & II: none
  Standard Timings: none
  Detailed Timing Descriptors:
    DTD 1:  1920x1080   60.009685 Hz  16:9     66.731 kHz    138.800000 MHz (344 mm x 194 mm)
                 Hfront   24 Hsync  48 Hback   88 Hpol N
                 Vfront    3 Vsync  12 Vback   17 Vpol N
    DTD 2:  1920x1080   47.990454 Hz  16:9     53.365 kHz    111.000000 MHz (344 mm x 194 mm)
                 Hfront   24 Hsync  48 Hback   88 Hpol N
                 Vfront    3 Vsync  12 Vback   17 Vpol N
    Alphanumeric Data String: 'PWX18.156NWF7'
    Manufacturer-Specified Display Descriptor (0x00): 00 00 00 02 41 31 1e 00 10 00 00 0a 01 0a 20 20 '....A1........  '
Checksum: 0x0d

----------------

Warnings:

Block 0, Base EDID:
  Alphanumeric Data String: Non-ASCII character 0x80 at position 5, can cause problems.
  Missing Display Product Name.

EDID conformity: PASS
