edid-decode (hex):

00 ff ff ff ff ff ff 00 3e 4e 00 00 00 00 00 00
29 19 01 03 80 5d 34 00 0a d7 a5 a2 59 4a 96 24
14 50 54 a3 08 00 d1 c0 b3 00 81 00 81 80 81 40
81 c0 01 01 01 01 04 74 00 30 f2 70 5a 80 b0 58
8a 00 44 17 74 00 00 1e 7f 21 56 aa 51 00 1e 30
46 8f 33 00 3f 43 21 00 00 1e 00 00 00 fd 00 32
4c 1e 50 10 00 0a 20 20 20 20 20 20 00 00 00 fc
00 43 4c 42 34 32 42 34 30 30 30 53 0a 20 01 8a

02 03 35 74 50 90 05 04 03 07 02 06 01 1f 14 13
12 16 11 15 20 29 09 07 03 15 07 50 57 07 00 83
01 00 00 6d 03 0c 00 40 00 00 3c 20 00 60 01 02
03 e3 0e 60 61 01 1d 00 bc 52 d0 1e 20 b8 28 55
40 c4 8e 21 00 00 1e 01 1d 80 d0 72 1c 16 20 10
2c 25 80 c4 8e 21 00 00 9e 8c 0a d0 8a 20 e0 2d
10 10 3e 96 00 13 8e 21 00 00 18 8c 0a d0 90 20
40 31 20 0c 40 55 00 13 8e 21 00 00 18 00 00 77

00 ff ff ff ff ff ff 00 3e 4e 00 00 00 00 00 00
29 19 01 03 80 5d 34 00 0a d7 a5 a2 59 4a 96 24
14 50 54 a3 08 00 d1 c0 b3 00 81 00 81 80 81 40
81 c0 01 01 01 01 04 74 00 30 f2 70 5a 80 b0 58
8a 00 44 17 74 00 00 1e 7f 21 56 aa 51 00 1e 30
46 8f 33 00 3f 43 21 00 00 1e 00 00 00 fd 00 32
4c 1e 50 10 00 0a 20 20 20 20 20 20 00 00 00 fc
00 43 4c 42 34 32 42 34 30 30 30 53 0a 20 01 8a

02 03 35 74 50 90 05 04 03 07 02 06 01 1f 14 13
12 16 11 15 20 29 09 07 03 15 07 50 57 07 00 83
01 00 00 6d 03 0c 00 40 00 00 3c 20 00 60 01 02
03 e3 0e 60 61 01 1d 00 bc 52 d0 1e 20 b8 28 55
40 c4 8e 21 00 00 1e 01 1d 80 d0 72 1c 16 20 10
2c 25 80 c4 8e 21 00 00 9e 8c 0a d0 8a 20 e0 2d
10 10 3e 96 00 13 8e 21 00 00 18 8c 0a d0 90 20
40 31 20 0c 40 55 00 13 8e 21 00 00 18 00 00 77

----------------

Block 0, Base EDID:
  EDID Structure Version & Revision: 1.3
  Vendor & Product Identification:
    Manufacturer: ORN
    Model: 0
    Made in: week 41 of 2015
  Basic Display Parameters & Features:
    Digital display
    Maximum image size: 93 cm x 52 cm
    Gamma: 1.00
    RGB color display
    First detailed timing is the preferred timing
  Color Characteristics:
    Red  : 0.6357, 0.3486
    Green: 0.2900, 0.5888
    Blue : 0.1425, 0.0800
    White: 0.3134, 0.3291
  Established Timings I & II:
    IBM     :   720x400    70.081663 Hz   9:5     31.467 kHz     28.320000 MHz
    DMT 0x04:   640x480    59.940476 Hz   4:3     31.469 kHz     25.175000 MHz
    DMT 0x08:   800x600    56.250000 Hz   4:3     35.156 kHz     36.000000 MHz
    DMT 0x09:   800x600    60.316541 Hz   4:3     37.879 kHz     40.000000 MHz
    DMT 0x10:  1024x768    60.003840 Hz   4:3     48.363 kHz     65.000000 MHz
  Standard Timings:
    DMT 0x52:  1920x1080   60.000000 Hz  16:9     67.500 kHz    148.500000 MHz
    DMT 0x3a:  1680x1050   59.954250 Hz  16:10    65.290 kHz    146.250000 MHz
    DMT 0x1c:  1280x800    59.810326 Hz  16:10    49.702 kHz     83.500000 MHz
    DMT 0x23:  1280x1024   60.019740 Hz   5:4     63.981 kHz    108.000000 MHz
    DMT 0x20:  1280x960    60.000000 Hz   4:3     60.000 kHz    108.000000 MHz
    DMT 0x55:  1280x720    60.000000 Hz  16:9     45.000 kHz     74.250000 MHz
  Detailed Timing Descriptors:
    DTD 1:  3840x2160   30.000000 Hz  16:9     67.500 kHz    297.000000 MHz (1860 mm x 1047 mm)
                 Hfront  176 Hsync  88 Hback  296 Hpol P
                 Vfront    8 Vsync  10 Vback   72 Vpol P
    DTD 2:  1366x768    59.964364 Hz 683:384   47.852 kHz     85.750000 MHz (575 mm x 323 mm)
                 Hfront   70 Hsync 143 Hback  213 Hpol P
                 Vfront    3 Vsync   3 Vback   24 Vpol P
    Display Range Limits:
      Monitor ranges (GTF): 50-76 Hz V, 30-80 kHz H, max dotclock 160 MHz
    Display Product Name: 'CLB42B4000S'
  Extension blocks: 1
Checksum: 0x8a

----------------

Block 1, CTA-861 Extension Block:
  Revision: 3
  Basic audio support
  Supports YCbCr 4:4:4
  Supports YCbCr 4:2:2
  Native DTDs: 4
  Video Data Block:
    VIC  16:  1920x1080   60.000000 Hz  16:9     67.500 kHz    148.500000 MHz (native)
    VIC   5:  1920x1080i  60.000000 Hz  16:9     33.750 kHz     74.250000 MHz
    VIC   4:  1280x720    60.000000 Hz  16:9     45.000 kHz     74.250000 MHz
    VIC   3:   720x480    59.940060 Hz  16:9     31.469 kHz     27.000000 MHz
    VIC   7:  1440x480i   59.940060 Hz  16:9     15.734 kHz     27.000000 MHz
    VIC   2:   720x480    59.940060 Hz   4:3     31.469 kHz     27.000000 MHz
    VIC   6:  1440x480i   59.940060 Hz   4:3     15.734 kHz     27.000000 MHz
    VIC   1:   640x480    59.940476 Hz   4:3     31.469 kHz     25.175000 MHz
    VIC  31:  1920x1080   50.000000 Hz  16:9     56.250 kHz    148.500000 MHz
    VIC  20:  1920x1080i  50.000000 Hz  16:9     28.125 kHz     74.250000 MHz
    VIC  19:  1280x720    50.000000 Hz  16:9     37.500 kHz     74.250000 MHz
    VIC  18:   720x576    50.000000 Hz  16:9     31.250 kHz     27.000000 MHz
    VIC  22:  1440x576i   50.000000 Hz  16:9     15.625 kHz     27.000000 MHz
    VIC  17:   720x576    50.000000 Hz   4:3     31.250 kHz     27.000000 MHz
    VIC  21:  1440x576i   50.000000 Hz   4:3     15.625 kHz     27.000000 MHz
    VIC  32:  1920x1080   24.000000 Hz  16:9     27.000 kHz     74.250000 MHz
  Audio Data Block:
    Linear PCM:
      Max channels: 2
      Supported sample rates (kHz): 48 44.1 32
      Supported sample sizes (bits): 20 16
    AC-3:
      Max channels: 6
      Supported sample rates (kHz): 48 44.1 32
      Maximum bit rate: 640 kb/s
    Enhanced AC-3 (DD+):
      Max channels: 8
      Supported sample rates (kHz): 48 44.1 32
  Speaker Allocation Data Block:
    FL/FR - Front Left/Right
  Vendor-Specific Data Block (HDMI), OUI 00-0C-03:
    Source physical address: 4.0.0.0
    Maximum TMDS clock: 300 MHz
    Extended HDMI video details:
      HDMI VICs:
        HDMI VIC 1:  3840x2160   30.000000 Hz  16:9     67.500 kHz    297.000000 MHz
        HDMI VIC 2:  3840x2160   25.000000 Hz  16:9     56.250 kHz    297.000000 MHz
        HDMI VIC 3:  3840x2160   24.000000 Hz  16:9     54.000 kHz    297.000000 MHz
  YCbCr 4:2:0 Video Data Block:
    VIC  96:  3840x2160   50.000000 Hz  16:9    112.500 kHz    594.000000 MHz
    VIC  97:  3840x2160   60.000000 Hz  16:9    135.000 kHz    594.000000 MHz
  Detailed Timing Descriptors:
    DTD 3:  1280x720    50.000000 Hz  16:9     37.500 kHz     74.250000 MHz (708 mm x 398 mm)
                 Hfront  440 Hsync  40 Hback  220 Hpol P
                 Vfront    5 Vsync   5 Vback   20 Vpol P
    DTD 4:  1920x1080i  50.000000 Hz  16:9     28.125 kHz     74.250000 MHz (708 mm x 398 mm)
                 Hfront  528 Hsync  44 Hback  148 Hpol P
                 Vfront    2 Vsync   5 Vback   15 Vpol P Vfront +0.5 Odd Field
                 Vfront    2 Vsync   5 Vback   15 Vpol P Vback  +0.5 Even Field
    DTD 5:   720x480    59.940060 Hz   3:2     31.469 kHz     27.000000 MHz (531 mm x 398 mm)
                 Hfront   16 Hsync  62 Hback   60 Hpol N
                 Vfront    9 Vsync   6 Vback   30 Vpol N
    DTD 6:   720x576    50.000000 Hz   5:4     31.250 kHz     27.000000 MHz (531 mm x 398 mm)
                 Hfront   12 Hsync  64 Hback   68 Hpol N
                 Vfront    5 Vsync   5 Vback   39 Vpol N
Checksum: 0x77  Unused space in Extension Block: 2 bytes

----------------

Warnings:

Block 0, Base EDID:
  Detailed Timing Descriptor #1: DTD is identical to VIC 95, which is not present in the CTA Ext Block.
Block 1, CTA-861 Extension Block:
  IT Video Formats are overscanned by default, but normally this should be underscanned.
  Video Data Block: VIC 16 and the first DTD are not identical. Is this intended?
  Detailed Timing Descriptor #5: Image size is 531x398 mm, but based on the picture AR it should be 531x354 mm.
  Detailed Timing Descriptor #6: Image size is 531x398 mm, but based on the picture AR it should be 497x398 mm.
  Add a Colorimetry Data Block with the sRGB colorimetry bit set to avoid interop issues.
EDID:
  Base EDID: Some timings are out of range of the Monitor Ranges:
    Vertical Freq: 24.000 - 70.082 Hz (Monitor: 50.000 - 76.000 Hz)
    Horizontal Freq: 15.625 - 67.500 kHz (Monitor: 30.000 - 80.000 kHz)
    Maximum Clock: 297.000 MHz (Monitor: 160.000 MHz)

Failures:

Block 0, Base EDID:
  Detailed Timing Descriptor #1: Mismatch of image size 1860x1047 mm vs display size 930x520 mm.
  Detailed Timing Descriptor #2: Mismatch of image size 575x323 mm vs display size 930x520 mm.
Block 1, CTA-861 Extension Block:
  Vendor-Specific Data Block (HDMI), OUI 00-0C-03: HDMI VIC Codes must have their CTA-861 VIC equivalents in the VSB.
  Detailed Timing Descriptor #3: Mismatch of image size 708x398 mm vs display size 930x520 mm.
  Detailed Timing Descriptor #4: Mismatch of image size 708x398 mm vs display size 930x520 mm.
  Detailed Timing Descriptor #5: Mismatch of image size 531x398 mm vs display size 930x520 mm.
  Detailed Timing Descriptor #6: Mismatch of image size 531x398 mm vs display size 930x520 mm.
  Missing VCDB, needed for Set Selectable RGB Quantization to avoid interop issues.
EDID:
  Extension Block 2 started with EDID header, ignoring Extension Blocks >= 2.
  Base EDID: The DTD max image size is 1860x1047mm, which is larger than the display size 930.0x520.0mm.
  CTA-861: Native progressive timings are a mix of several resolutions.

EDID conformity: FAIL
