edid-decode (hex):

00 ff ff ff ff ff ff 00 4c 83 9c 41 00 00 00 00
00 21 01 04 b5 1e 13 78 03 cf d1 ae 51 3e b6 23
0b 50 54 00 00 00 01 01 01 01 01 01 01 01 01 01
01 01 01 01 01 01 cb fe 40 64 b0 08 38 77 20 08
88 00 2e bd 10 00 00 1b 00 00 00 fd 00 30 78 da
da 42 01 00 00 00 00 00 00 00 00 00 00 fe 00 53
44 43 0a 20 20 20 20 20 20 20 20 20 00 00 00 fc
00 41 54 4e 41 34 30 43 55 30 35 2d 30 20 01 27

70 20 79 02 00 20 00 0c 4c 83 00 9c 41 00 00 00
00 00 21 00 26 00 09 04 00 00 00 00 00 50 00 00
22 00 14 e7 f3 09 85 3f 0b 63 00 1f 00 07 00 07
07 17 00 07 00 07 00 2b 00 0c 27 00 30 77 00 00
27 00 30 3b 00 00 81 00 1f 73 1a 00 00 03 03 30
78 00 a0 74 02 60 02 78 00 00 00 00 8d e3 05 80
00 e6 06 05 01 74 60 02 2e 00 06 18 10 40 5e d0
60 00 00 00 00 00 00 00 00 00 00 00 00 00 fc 90

00 ff ff ff ff ff ff 00 4c 83 9c 41 00 00 00 00
00 21 01 04 b5 1e 13 78 03 cf d1 ae 51 3e b6 23
0b 50 54 00 00 00 01 01 01 01 01 01 01 01 01 01
01 01 01 01 01 01 cb fe 40 64 b0 08 38 77 20 08
88 00 2e bd 10 00 00 1b 00 00 00 fd 00 30 78 da
da 42 01 00 00 00 00 00 00 00 00 00 00 fe 00 53
44 43 0a 20 20 20 20 20 20 20 20 20 00 00 00 fc
00 41 54 4e 41 34 30 43 55 30 35 2d 30 20 01 27

70 20 79 02 00 20 00 0c 4c 83 00 9c 41 00 00 00
00 00 21 00 26 00 09 04 00 00 00 00 00 50 00 00
22 00 14 e7 f3 09 85 3f 0b 63 00 1f 00 07 00 07
07 17 00 07 00 07 00 2b 00 0c 27 00 30 77 00 00
27 00 30 3b 00 00 81 00 1f 73 1a 00 00 03 03 30
78 00 a0 74 02 60 02 78 00 00 00 00 8d e3 05 80
00 e6 06 05 01 74 60 02 2e 00 06 18 10 40 5e d0
60 00 00 00 00 00 00 00 00 00 00 00 00 00 fc 90

----------------

Block 0, Base EDID:
  EDID Structure Version & Revision: 1.4
  Vendor & Product Identification:
    Manufacturer: SDC
    Model: 16796
    Made in: 2023
  Basic Display Parameters & Features:
    Digital display
    Bits per primary color channel: 10
    DisplayPort interface
    Maximum image size: 30 cm x 19 cm
    Gamma: 2.20
    Supported color formats: RGB 4:4:4
    First detailed timing includes the native pixel format and preferred refresh rate
    Display supports continuous frequencies
  Color Characteristics:
    Red  : 0.6826, 0.3164
    Green: 0.2451, 0.7138
    Blue : 0.1396, 0.0439
    White: 0.3125, 0.3291
  Established Timings I & II: none
  Standard Timings: none
  Detailed Timing Descriptors:
    DTD 1:  2880x1800   60.000699 Hz  16:10   218.883 kHz    652.270000 MHz (302 mm x 189 mm)
                 Hfront   32 Hsync   8 Hback   60 Hpol P
                 Vfront    8 Vsync   8 Vback 1832 Vpol N
    Display Range Limits:
      Monitor ranges (Range Limits Only): 48-120 Hz V, 218-218 kHz H, max dotclock 660 MHz
    Alphanumeric Data String: 'SDC'
    Display Product Name: 'ATNA40CU05-0 '
  Extension blocks: 1
Checksum: 0x27

----------------

Block 1, DisplayID Extension Block:
  Version: 2.0
  Extension Count: 0
  Display Product Primary Use Case: None of the listed primary use cases; generic display
  Product Identification Data Block (0x20), OUI 4C-83-00:
    Product Code: 16796
    Year of Manufacture: 2033
  Display Interface Features Data Block:
    Supported bpc for RGB encoding: 10
    Supported color space and EOTF standard combination 1: DCI-P3, BT.2020/SMPTE ST 2084
  Video Timing Modes Type 7 - Detailed Timings Data Block:
    DTD:  2880x1800  120.000294 Hz  16:10   218.881 kHz    652.264000 MHz (aspect 16:10, no 3D stereo, preferred)
               Hfront   32 Hsync   8 Hback   60 Hpol N
               Vfront    8 Vsync   8 Vback    8 Vpol N
  Adaptive Sync Data Block:
    Descriptor #1:
      Native Panel Range
      Fixed Average V-Total and Adaptive V-Total
      Supports Seamless Transition
      'Max Single Frame Duration Increase' field value without jitter impact
      'Max Single Frame Duration Decrease' field value without jitter impact
      Max Duration Increase: 0.00 ms
      Max Duration Decrease: 0.00 ms
      Min Refresh Rate: 48 Hz
      Max Refresh Rate: 120 Hz
    Descriptor #2:
      Native Panel Range
      Fixed Average V-Total and Adaptive V-Total
      Supports Seamless Transition
      'Max Single Frame Duration Increase' field value without jitter impact
      'Max Single Frame Duration Decrease' field value without jitter impact
      Max Duration Increase: 0.00 ms
      Max Duration Decrease: 0.00 ms
      Min Refresh Rate: 48 Hz
      Max Refresh Rate: 60 Hz
  CTA-861 DisplayID Data Block:
  Vendor-Specific Data Block (AMD), OUI 00-00-1A:
    Version: 3
    Feature Caps: 0x03
    Minimum Refresh Rate: 48 Hz
    Maximum Refresh Rate: 120 Hz
    Flags 1.x: 0x00
    Flags 2.x: 0xa0
    Maximum luminance: 116 (616.884 cd/m^2)
    Minimum luminance: 2 (0.000 cd/m^2)
    Unknown: 0x60 0x02
  Colorimetry Data Block:
    BT2020RGB
  HDR Static Metadata Data Block:
    Electro optical transfer functions:
      Traditional gamma - SDR luminance range
      SMPTE ST2084
    Supported static metadata descriptors:
      Static metadata type 1
    Desired content max luminance: 116 (616.884 cd/m^2)
    Desired content max frame-average luminance: 96 (400.000 cd/m^2)
    Desired content min luminance: 2 (0.000 cd/m^2)
  Brightness Luminance Range Data Block:
    Minimum SDR Luminance (Full Coverage): 0.000500 cd/m^2
    Maximum Suggested SDR Luminance (Full Coverage): 400.000000 cd/m^2
    Maximum Boost SDR Luminance: 400.000000 cd/m^2
  Checksum: 0xfc
Checksum: 0x90

----------------

Block 2, Unknown EDID Extension Block 0x00:
  00 ff ff ff ff ff ff 00 4c 83 9c 41 00 00 00 00 '........L..A....'
  00 21 01 04 b5 1e 13 78 03 cf d1 ae 51 3e b6 23 '.!.....x....Q>.#'
  0b 50 54 00 00 00 01 01 01 01 01 01 01 01 01 01 '.PT.............'
  01 01 01 01 01 01 cb fe 40 64 b0 08 38 77 20 08 '........@d..8w .'
  88 00 2e bd 10 00 00 1b 00 00 00 fd 00 30 78 da '.............0x.'
  da 42 01 00 00 00 00 00 00 00 00 00 00 fe 00 53 '.B.............S'
  44 43 0a 20 20 20 20 20 20 20 20 20 00 00 00 fc 'DC.         ....'
  00 41 54 4e 41 34 30 43 55 30 35 2d 30 20 01 27 '.ATNA40CU05-0 .''
Checksum: 0x27

----------------

Block 3, DisplayID Extension Block:
  Version: 2.0
  Extension Count: 0
  Product Identification Data Block (0x20), OUI 4C-83-00:
    Product Code: 16796
    Year of Manufacture: 2033
  Display Interface Features Data Block:
    Supported bpc for RGB encoding: 10
    Supported color space and EOTF standard combination 1: DCI-P3, BT.2020/SMPTE ST 2084
  Video Timing Modes Type 7 - Detailed Timings Data Block:
    DTD:  2880x1800  120.000294 Hz  16:10   218.881 kHz    652.264000 MHz (aspect 16:10, no 3D stereo, preferred)
               Hfront   32 Hsync   8 Hback   60 Hpol N
               Vfront    8 Vsync   8 Vback    8 Vpol N
  Adaptive Sync Data Block:
    Descriptor #1:
      Native Panel Range
      Fixed Average V-Total and Adaptive V-Total
      Supports Seamless Transition
      'Max Single Frame Duration Increase' field value without jitter impact
      'Max Single Frame Duration Decrease' field value without jitter impact
      Max Duration Increase: 0.00 ms
      Max Duration Decrease: 0.00 ms
      Min Refresh Rate: 48 Hz
      Max Refresh Rate: 120 Hz
    Descriptor #2:
      Native Panel Range
      Fixed Average V-Total and Adaptive V-Total
      Supports Seamless Transition
      'Max Single Frame Duration Increase' field value without jitter impact
      'Max Single Frame Duration Decrease' field value without jitter impact
      Max Duration Increase: 0.00 ms
      Max Duration Decrease: 0.00 ms
      Min Refresh Rate: 48 Hz
      Max Refresh Rate: 60 Hz
  CTA-861 DisplayID Data Block:
  Vendor-Specific Data Block (AMD), OUI 00-00-1A:
    Version: 3
    Feature Caps: 0x03
    Minimum Refresh Rate: 48 Hz
    Maximum Refresh Rate: 120 Hz
    Flags 1.x: 0x00
    Flags 2.x: 0xa0
    Maximum luminance: 116 (616.884 cd/m^2)
    Minimum luminance: 2 (0.000 cd/m^2)
    Unknown: 0x60 0x02
  Colorimetry Data Block:
    BT2020RGB
  HDR Static Metadata Data Block:
    Electro optical transfer functions:
      Traditional gamma - SDR luminance range
      SMPTE ST2084
    Supported static metadata descriptors:
      Static metadata type 1
    Desired content max luminance: 116 (616.884 cd/m^2)
    Desired content max frame-average luminance: 96 (400.000 cd/m^2)
    Desired content min luminance: 2 (0.000 cd/m^2)
  Brightness Luminance Range Data Block:
    Minimum SDR Luminance (Full Coverage): 0.000500 cd/m^2
    Maximum Suggested SDR Luminance (Full Coverage): 400.000000 cd/m^2
    Maximum Boost SDR Luminance: 400.000000 cd/m^2
  Checksum: 0xfc
Checksum: 0x90

----------------

Warnings:

Block 1, DisplayID Extension Block:
  Product Identification Data Block (0x20), OUI 4C-83-00: Unknown OUI 4C-83-00.
  Colorimetry Data Block: Set the sRGB colorimetry bit to avoid interop issues.
Block 3, DisplayID Extension Block:
  Product Identification Data Block (0x20), OUI 4C-83-00: Unknown OUI 4C-83-00.
  Colorimetry Data Block: Set the sRGB colorimetry bit to avoid interop issues.
EDID:
  Base EDID: Some timings are out of range of the Monitor Ranges:
    Horizontal Freq: 218.880 - 218.882 kHz (Monitor: 218.000 - 218.000 kHz)
    Could be due to a Monitor Range off-by-one rounding issue

Failures:

Block 0, Base EDID:
  Display Range Limits: Byte 11 is 0x00 instead of 0x0a.
  Display Range Limits: Bytes 12-17 must be 0x20.
  Display Product Name: No newline, but one or more trailing spaces.
Block 1, DisplayID Extension Block:
  Expected 0 DisplayID Extension Block, but got 1.
Block 2, Base EDID:
  Unknown Extension Block.
Block 3, DisplayID Extension Block:
  Product Type should be 0 in extension block.
  Product Identification Data Block (0x20), OUI 4C-83-00: Product Identification Data Block (0x20), OUI 4C-83-00 is required to be the first DisplayID Data Block.
  Colorimetry Data Block: Only one instance of this Data Block is allowed.
  HDR Static Metadata Data Block: Only one instance of this Data Block is allowed.
EDID:
  Base EDID: EDID specified 1 extension block(s), but found 3 extension block(s).
  DisplayID: Missing DisplayID Display Parameters Data Block.

EDID conformity: FAIL
