edid-decode (hex):

00 ff ff ff ff ff ff 00 1e 6d 16 77 96 1e 03 00
03 1e 01 03 80 58 25 78 ea a1 95 a9 54 4d 9c 26
0f 50 54 25 6b 80 01 01 01 01 01 01 01 01 01 01
01 01 01 01 d1 cf 31 dd 00 30 f2 40 74 60 b0 58
7a 00 6f 6e 31 00 00 1a 40 51 00 20 f1 40 50 60
30 20 7a 00 6f 6e 31 00 00 1a 00 00 00 fd 00 34
4b 82 82 39 00 0a 20 20 20 20 20 20 00 00 00 fc
00 4c 47 20 48 44 52 20 57 51 48 44 0a 20 01 ff

02 03 43 f1 23 09 07 07 4b 10 04 03 1f 13 12 5d
5e 5f 60 61 83 01 00 00 6d 03 0c 00 20 00 b8 3c
20 00 60 01 02 03 67 d8 5d c4 01 78 80 03 e3 0f
00 30 68 1a 00 00 01 01 34 4b 00 e3 05 c0 00 e3
06 05 01 e4 a7 70 b8 d1 a0 24 50 90 60 84 00 6f
6e 31 00 00 1a 00 00 00 00 00 00 00 00 00 00 00
00 00 00 00 00 00 00 00 00 00 00 00 00 00 00 00
00 00 00 00 00 00 00 00 00 00 00 00 00 00 00 26

00 ff ff ff ff ff ff 00 1e 6d 16 77 96 1e 03 00
03 1e 01 03 80 58 25 78 ea a1 95 a9 54 4d 9c 26
0f 50 54 25 6b 80 01 01 01 01 01 01 01 01 01 01
01 01 01 01 d1 cf 31 dd 00 30 f2 40 74 60 b0 58
7a 00 6f 6e 31 00 00 1a 40 51 00 20 f1 40 50 60
30 20 7a 00 6f 6e 31 00 00 1a 00 00 00 fd 00 34
4b 82 82 39 00 0a 20 20 20 20 20 20 00 00 00 fc
00 4c 47 20 48 44 52 20 57 51 48 44 0a 20 01 ff

02 03 43 f1 23 09 07 07 4b 10 04 03 1f 13 12 5d
5e 5f 60 61 83 01 00 00 6d 03 0c 00 20 00 b8 3c
20 00 60 01 02 03 67 d8 5d c4 01 78 80 03 e3 0f
00 30 68 1a 00 00 01 01 34 4b 00 e3 05 c0 00 e3
06 05 01 e4 a7 70 b8 d1 a0 24 50 90 60 84 00 6f
6e 31 00 00 1a 00 00 00 00 00 00 00 00 00 00 00
00 00 00 00 00 00 00 00 00 00 00 00 00 00 00 00
00 00 00 00 00 00 00 00 00 00 00 00 00 00 00 26

----------------

Block 0, Base EDID:
  EDID Structure Version & Revision: 1.3
  Vendor & Product Identification:
    Manufacturer: GSM
    Model: 30486
    Serial Number: ...
    Made in: week 3 of 2020
  Basic Display Parameters & Features:
    Digital display
    Maximum image size: 88 cm x 37 cm
    Gamma: 2.20
    DPMS levels: Standby Suspend Off
    RGB color display
    First detailed timing is the preferred timing
  Color Characteristics:
    Red  : 0.6621, 0.3300
    Green: 0.3007, 0.6103
    Blue : 0.1503, 0.0595
    White: 0.3134, 0.3291
  Established Timings I & II:
    DMT 0x04:   640x480    59.940476 Hz   4:3     31.469 kHz     25.175000 MHz
    DMT 0x06:   640x480    75.000000 Hz   4:3     37.500 kHz     31.500000 MHz
    DMT 0x09:   800x600    60.316541 Hz   4:3     37.879 kHz     40.000000 MHz
    DMT 0x0b:   800x600    75.000000 Hz   4:3     46.875 kHz     49.500000 MHz
    Apple   :   832x624    74.551266 Hz   4:3     49.726 kHz     57.284000 MHz
    DMT 0x10:  1024x768    60.003840 Hz   4:3     48.363 kHz     65.000000 MHz
    DMT 0x12:  1024x768    75.028582 Hz   4:3     60.023 kHz     78.750000 MHz
    DMT 0x24:  1280x1024   75.024675 Hz   5:4     79.976 kHz    135.000000 MHz
    Apple   :  1152x870    75.061550 Hz 192:145   68.681 kHz    100.000000 MHz
  Standard Timings:
    GTF     :  1920x1080   75.000068 Hz  16:9     84.600 kHz    220.637000 MHz
  Detailed Timing Descriptors:
    DTD 1:  3840x1600   74.996027 Hz  12:5    128.693 kHz    566.250000 MHz (879 mm x 366 mm)
                 Hfront  176 Hsync  88 Hback  296 Hpol P
                 Vfront    7 Vsync  10 Vback   99 Vpol N
    DTD 2:  3840x1600   29.992617 Hz  12:5     50.388 kHz    208.000000 MHz (879 mm x 366 mm)
                 Hfront   48 Hsync  32 Hback  208 Hpol P
                 Vfront    7 Vsync  10 Vback   63 Vpol N
    Display Range Limits:
      Monitor ranges (GTF): 52-75 Hz V, 130-130 kHz H, max dotclock 570 MHz
    Display Product Name: 'LG HDR WQHD'
  Extension blocks: 1
Checksum: 0xff

----------------

Block 1, CTA-861 Extension Block:
  Revision: 3
  Underscans IT Video Formats by default
  Basic audio support
  Supports YCbCr 4:4:4
  Supports YCbCr 4:2:2
  Native DTDs: 1
  Audio Data Block:
    Linear PCM:
      Max channels: 2
      Supported sample rates (kHz): 48 44.1 32
      Supported sample sizes (bits): 24 20 16
  Video Data Block:
    VIC  16:  1920x1080   60.000000 Hz  16:9     67.500 kHz    148.500000 MHz
    VIC   4:  1280x720    60.000000 Hz  16:9     45.000 kHz     74.250000 MHz
    VIC   3:   720x480    59.940060 Hz  16:9     31.469 kHz     27.000000 MHz
    VIC  31:  1920x1080   50.000000 Hz  16:9     56.250 kHz    148.500000 MHz
    VIC  19:  1280x720    50.000000 Hz  16:9     37.500 kHz     74.250000 MHz
    VIC  18:   720x576    50.000000 Hz  16:9     31.250 kHz     27.000000 MHz
    VIC  93:  3840x2160   24.000000 Hz  16:9     54.000 kHz    297.000000 MHz
    VIC  94:  3840x2160   25.000000 Hz  16:9     56.250 kHz    297.000000 MHz
    VIC  95:  3840x2160   30.000000 Hz  16:9     67.500 kHz    297.000000 MHz
    VIC  96:  3840x2160   50.000000 Hz  16:9    112.500 kHz    594.000000 MHz
    VIC  97:  3840x2160   60.000000 Hz  16:9    135.000 kHz    594.000000 MHz
  Speaker Allocation Data Block:
    FL/FR - Front Left/Right
  Vendor-Specific Data Block (HDMI), OUI 00-0C-03:
    Source physical address: 2.0.0.0
    Supports_AI
    DC_36bit
    DC_30bit
    DC_Y444
    Maximum TMDS clock: 300 MHz
    Extended HDMI video details:
      HDMI VICs:
        HDMI VIC 1:  3840x2160   30.000000 Hz  16:9     67.500 kHz    297.000000 MHz
        HDMI VIC 2:  3840x2160   25.000000 Hz  16:9     56.250 kHz    297.000000 MHz
        HDMI VIC 3:  3840x2160   24.000000 Hz  16:9     54.000 kHz    297.000000 MHz
  Vendor-Specific Data Block (HDMI Forum), OUI C4-5D-D8:
    Version: 1
    Maximum TMDS Character Rate: 600 MHz
    SCDC Present
    Supports 12-bits/component Deep Color 4:2:0 Pixel Encoding
    Supports 10-bits/component Deep Color 4:2:0 Pixel Encoding
  YCbCr 4:2:0 Capability Map Data Block:
    SVD Index 13 is out of range
    SVD Index 14 is out of range
  Vendor-Specific Data Block (AMD), OUI 00-00-1A:
    Version: 1
    Feature Caps: 0x01
    Minimum Refresh Rate: 52 Hz
    Maximum Refresh Rate: 75 Hz
    Flags 1.x: 0x00
  Colorimetry Data Block:
    BT2020YCC
    BT2020RGB
  HDR Static Metadata Data Block:
    Electro optical transfer functions:
      Traditional gamma - SDR luminance range
      SMPTE ST2084
    Supported static metadata descriptors:
      Static metadata type 1
  Detailed Timing Descriptors:
    DTD 3:  3440x1440   75.049591 Hz  43:18   110.773 kHz    429.800000 MHz (879 mm x 366 mm)
                 Hfront  144 Hsync  96 Hback  200 Hpol P
                 Vfront    8 Vsync   4 Vback   24 Vpol N
Checksum: 0x26  Unused space in Extension Block: 42 bytes

----------------

Warnings:

Block 1, CTA-861 Extension Block:
  Video Data Block: VIC 16 and the first DTD are not identical. Is this intended?
  Colorimetry Data Block: Set the sRGB colorimetry bit to avoid interop issues.
EDID:
  Base EDID: Some timings are out of range of the Monitor Ranges:
    Vertical Freq: 24.000 - 75.062 Hz (Monitor: 52.000 - 75.000 Hz)
    Horizontal Freq: 31.250 - 135.000 kHz (Monitor: 130.000 - 130.000 kHz)
    Maximum Clock: 594.000 MHz (Monitor: 570.000 MHz)

Failures:

Block 1, CTA-861 Extension Block:
  Vendor-Specific Data Block (HDMI Forum), OUI C4-5D-D8: HDMI VIC and related CTA VIC codes are present, but the UHD VIC bit is 0.
  YCbCr 4:2:0 Capability Map Data Block: Max index 14 > 11 (#SVDs).
  Missing VCDB, needed for Set Selectable RGB Quantization to avoid interop issues.
EDID:
  Extension Block 2 started with EDID header, ignoring Extension Blocks >= 2.

EDID conformity: FAIL
