edid-decode (hex):

00 ff ff ff ff ff ff 00 10 ac 0e 30 41 50 4a 42
24 0d 01 04 a5 23 1a 7e ee bb b9 a3 52 46 98 24
0f 48 4c a0 01 00 31 59 45 59 61 59 81 99 a9 4f
01 01 01 01 01 01 bc 34 00 98 51 00 2a 40 10 90
13 00 60 08 11 00 00 1e 00 00 00 ff 00 34 4e 37
33 36 33 39 34 42 4a 50 41 0a 00 00 00 fc 00 44
45 4c 4c 20 4d 39 39 32 0a 20 20 20 00 00 00 fd
00 32 a0 1e 60 15 00 0a 20 20 20 20 20 20 00 89

00 ff ff ff ff ff ff 00 10 ac 0e 30 41 50 4a 42
24 0d 01 04 a5 23 1a 7e ee bb b9 a3 52 46 98 24
0f 48 4c a0 01 00 31 59 45 59 61 59 81 99 a9 4f
01 01 01 01 01 01 bc 34 00 98 51 00 2a 40 10 90
13 00 60 08 11 00 00 1e 00 00 00 ff 00 34 4e 37
33 36 33 39 34 42 4a 50 41 0a 00 00 00 fc 00 44
45 4c 4c 20 4d 39 39 32 0a 20 20 20 00 00 00 fd
00 32 a0 1e 60 15 00 0a 20 20 20 20 20 20 00 89

----------------

Block 0, Base EDID:
  EDID Structure Version & Revision: 1.4
  Vendor & Product Identification:
    Manufacturer: DEL
    Model: 12302
    Serial Number: ...
    Made in: week 36 of 2003
  Basic Display Parameters & Features:
    Digital display
    Bits per primary color channel: 8
    DisplayPort interface
    Maximum image size: 35 cm x 26 cm
    Gamma: 2.26
    DPMS levels: Standby Suspend Off
    Supported color formats: RGB 4:4:4, YCrCb 4:4:4
    Default (sRGB) color space is primary color space
    First detailed timing includes the native pixel format and preferred refresh rate
  Color Characteristics:
    Red  : 0.6386, 0.3232
    Green: 0.2753, 0.5966
    Blue : 0.1425, 0.0615
    White: 0.2832, 0.2978
  Established Timings I & II:
    IBM     :   720x400    70.081663 Hz   9:5     31.467 kHz     28.320000 MHz
    DMT 0x04:   640x480    59.940476 Hz   4:3     31.469 kHz     25.175000 MHz
    DMT 0x24:  1280x1024   75.024675 Hz   5:4     79.976 kHz    135.000000 MHz
  Standard Timings:
    DMT 0x07:   640x480    85.008312 Hz   4:3     43.269 kHz     36.000000 MHz
    DMT 0x0c:   800x600    85.061274 Hz   4:3     53.674 kHz     56.250000 MHz
    DMT 0x13:  1024x768    84.996690 Hz   4:3     68.677 kHz     94.500000 MHz
    DMT 0x25:  1280x1024   85.024098 Hz   5:4     91.146 kHz    157.500000 MHz
    DMT 0x36:  1600x1200   75.000000 Hz   4:3     93.750 kHz    202.500000 MHz
  Detailed Timing Descriptors:
    DTD 1:  1280x1024   75.024675 Hz   5:4     79.976 kHz    135.000000 MHz (352 mm x 264 mm)
                 Hfront   16 Hsync 144 Hback  248 Hpol P
                 Vfront    1 Vsync   3 Vback   38 Vpol P
    Display Product Serial Number: ...
    Display Product Name: 'DELL M992'
    Display Range Limits:
      Monitor ranges (GTF): 50-160 Hz V, 30-96 kHz H, max dotclock 210 MHz
Checksum: 0x89

----------------

Warnings:

Block 0, Base EDID:
  Basic Display Parameters & Features: sRGB is signaled, but the gamma != 2.2.
  Detailed Timing Descriptor #1: Image size is 352x264 mm, but based on the picture AR it should be 330x264 mm.
  Display Range Limits: GTF support is deprecated in EDID 1.4.

Failures:

Block 0, Base EDID:
  Basic Display Parameters & Features: sRGB is signaled, but the chromaticities do not match.
  Display Range Limits: GTF is supported, but the display does not support continuous frequencies.
EDID:
  Extension Block 1 started with EDID header, ignoring Extension Blocks >= 1.

EDID conformity: FAIL
