edid-decode (hex):

00 ff ff ff ff ff ff 00 09 e5 d1 0a 00 00 00 00
2a 1f 01 04 a5 22 13 78 03 0f 95 ae 52 43 b0 26
0f 50 54 00 00 00 01 01 01 01 01 01 01 01 01 01
01 01 01 01 01 01 47 67 00 a0 a0 a0 b4 50 30 20
36 00 58 c2 10 00 00 1a 00 00 00 fd 0c 3c f0 86
86 6a 01 0a 20 20 20 20 20 20 00 00 00 fe 00 42
4f 45 20 43 51 0a 20 20 20 20 20 20 00 00 00 fe
00 4e 45 31 35 36 51 48 4d 2d 4e 5a 33 0a 01 d0

70 13 79 00 00 03 01 14 1a 9d 01 84 ff 09 9f 00
2f 00 1f 00 9f 05 b3 00 02 00 05 00 00 00 00 00
00 00 00 00 00 00 00 00 00 00 00 00 00 00 00 00
00 00 00 00 00 00 00 00 00 00 00 00 00 00 00 00
00 00 00 00 00 00 00 00 00 00 00 00 00 00 00 00
00 00 00 00 00 00 00 00 00 00 00 00 00 00 00 00
00 00 00 00 00 00 00 00 00 00 00 00 00 00 00 00
00 00 00 00 00 00 00 00 00 00 00 00 00 00 cd 90

00 ff ff ff ff ff ff 00 09 e5 d1 0a 00 00 00 00
2a 1f 01 04 a5 22 13 78 03 0f 95 ae 52 43 b0 26
0f 50 54 00 00 00 01 01 01 01 01 01 01 01 01 01
01 01 01 01 01 01 47 67 00 a0 a0 a0 b4 50 30 20
36 00 58 c2 10 00 00 1a 00 00 00 fd 0c 3c f0 86
86 6a 01 0a 20 20 20 20 20 20 00 00 00 fe 00 42
4f 45 20 43 51 0a 20 20 20 20 20 20 00 00 00 fe
00 4e 45 31 35 36 51 48 4d 2d 4e 5a 33 0a 01 d0

70 13 79 00 00 03 01 14 1a 9d 01 84 ff 09 9f 00
2f 00 1f 00 9f 05 b3 00 02 00 05 00 00 00 00 00
00 00 00 00 00 00 00 00 00 00 00 00 00 00 00 00
00 00 00 00 00 00 00 00 00 00 00 00 00 00 00 00
00 00 00 00 00 00 00 00 00 00 00 00 00 00 00 00
00 00 00 00 00 00 00 00 00 00 00 00 00 00 00 00
00 00 00 00 00 00 00 00 00 00 00 00 00 00 00 00
00 00 00 00 00 00 00 00 00 00 00 00 00 00 cd 90

----------------

Block 0, Base EDID:
  EDID Structure Version & Revision: 1.4
  Vendor & Product Identification:
    Manufacturer: BOE
    Model: 2769
    Made in: week 42 of 2021
  Basic Display Parameters & Features:
    Digital display
    Bits per primary color channel: 8
    DisplayPort interface
    Maximum image size: 34 cm x 19 cm
    Gamma: 2.20
    Supported color formats: RGB 4:4:4
    First detailed timing includes the native pixel format and preferred refresh rate
    Display supports continuous frequencies
  Color Characteristics:
    Red  : 0.6796, 0.3203
    Green: 0.2646, 0.6904
    Blue : 0.1503, 0.0595
    White: 0.3134, 0.3291
  Established Timings I & II: none
  Standard Timings: none
  Detailed Timing Descriptors:
    DTD 1:  2560x1440   60.001362 Hz  16:9     97.202 kHz    264.390000 MHz (344 mm x 194 mm)
                 Hfront   48 Hsync  32 Hback   80 Hpol P
                 Vfront    3 Vsync   6 Vback  171 Vpol N
    Display Range Limits:
      Monitor ranges (Range Limits Only): 60-240 Hz V, 389-389 kHz H, max dotclock 1060 MHz
    Alphanumeric Data String: 'BOE CQ'
    Alphanumeric Data String: 'NE156QHM-NZ3'
  Extension blocks: 1
Checksum: 0xd0

----------------

Block 1, DisplayID Extension Block:
  Version: 1.3
  Extension Count: 0
  Display Product Type: Extension Section
  Video Timing Modes Type 1 - Detailed Timings Data Block:
    DTD:  2560x1440  240.003177 Hz  16:9    388.805 kHz   1057.550000 MHz (aspect 16:9, no 3D stereo, preferred)
               Hfront   48 Hsync  32 Hback   80 Hpol N
               Vfront    3 Vsync   6 Vback  171 Vpol N
  Checksum: 0xcd
Checksum: 0x90

----------------

Block 2, Unknown EDID Extension Block 0x00:
  00 ff ff ff ff ff ff 00 09 e5 d1 0a 00 00 00 00 '................'
  2a 1f 01 04 a5 22 13 78 03 0f 95 ae 52 43 b0 26 '*....".x....RC.&'
  0f 50 54 00 00 00 01 01 01 01 01 01 01 01 01 01 '.PT.............'
  01 01 01 01 01 01 47 67 00 a0 a0 a0 b4 50 30 20 '......Gg.....P0 '
  36 00 58 c2 10 00 00 1a 00 00 00 fd 0c 3c f0 86 '6.X..........<..'
  86 6a 01 0a 20 20 20 20 20 20 00 00 00 fe 00 42 '.j..      .....B'
  4f 45 20 43 51 0a 20 20 20 20 20 20 00 00 00 fe 'OE CQ.      ....'
  00 4e 45 31 35 36 51 48 4d 2d 4e 5a 33 0a 01 d0 '.NE156QHM-NZ3...'
Checksum: 0xd0

----------------

Block 3, DisplayID Extension Block:
  Version: 1.3
  Extension Count: 0
  Video Timing Modes Type 1 - Detailed Timings Data Block:
    DTD:  2560x1440  240.003177 Hz  16:9    388.805 kHz   1057.550000 MHz (aspect 16:9, no 3D stereo, preferred)
               Hfront   48 Hsync  32 Hback   80 Hpol N
               Vfront    3 Vsync   6 Vback  171 Vpol N
  Checksum: 0xcd
Checksum: 0x90

----------------

Warnings:

Block 0, Base EDID:
  Missing Display Product Name.
EDID:
  Base EDID: Some timings are out of range of the Monitor Ranges:
    Horizontal Freq: 97.202 - 388.805 kHz (Monitor: 389.000 - 389.000 kHz)

Failures:

Block 1, DisplayID Extension Block:
  DisplayID Base Block has no product type.
  Expected 0 DisplayID Extension Block, but got 1.
Block 2, Base EDID:
  Unknown Extension Block.
EDID:
  Base EDID: EDID specified 1 extension block(s), but found 3 extension block(s).

EDID conformity: FAIL
