edid-decode (hex):

00 ff ff ff ff ff ff 00 30 e4 a3 06 00 00 00 00
00 1e 01 04 95 1f 11 78 03 aa 95 95 5e 59 8e 27
1b 50 54 00 00 00 01 01 01 01 01 01 01 01 01 01
01 01 01 01 01 01 29 36 80 a0 70 38 1f 40 30 20
35 00 35 ae 10 00 00 1a 00 00 00 00 00 00 00 00
00 00 00 00 00 00 00 00 00 00 00 00 00 fe 00 4c
47 20 44 69 73 70 6c 61 79 0a 20 20 00 00 00 fe
00 4c 50 31 34 30 57 46 42 2d 53 50 54 31 00 8b

00 ff ff ff ff ff ff 00 30 e4 a3 06 00 00 00 00
00 1e 01 04 95 1f 11 78 03 aa 95 95 5e 59 8e 27
1b 50 54 00 00 00 01 01 01 01 01 01 01 01 01 01
01 01 01 01 01 01 29 36 80 a0 70 38 1f 40 30 20
35 00 35 ae 10 00 00 1a 00 00 00 00 00 00 00 00
00 00 00 00 00 00 00 00 00 00 00 00 00 fe 00 4c
47 20 44 69 73 70 6c 61 79 0a 20 20 00 00 00 fe
00 4c 50 31 34 30 57 46 42 2d 53 50 54 31 00 8b

----------------

Block 0, Base EDID:
  EDID Structure Version & Revision: 1.4
  Vendor & Product Identification:
    Manufacturer: LGD
    Model: 1699
    Made in: 2020
  Basic Display Parameters & Features:
    Digital display
    Bits per primary color channel: 6
    DisplayPort interface
    Maximum image size: 31 cm x 17 cm
    Gamma: 2.20
    Supported color formats: RGB 4:4:4
    First detailed timing includes the native pixel format and preferred refresh rate
    Display supports continuous frequencies
  Color Characteristics:
    Red  : 0.5839, 0.3691
    Green: 0.3496, 0.5566
    Blue : 0.1542, 0.1064
    White: 0.3134, 0.3291
  Established Timings I & II: none
  Standard Timings: none
  Detailed Timing Descriptors:
    DTD 1:  1920x1080   59.998788 Hz  16:9     66.659 kHz    138.650000 MHz (309 mm x 174 mm)
                 Hfront   48 Hsync  32 Hback   80 Hpol P
                 Vfront    3 Vsync   5 Vback   23 Vpol N
    Empty Descriptor
    Alphanumeric Data String: 'LG Display'
    Alphanumeric Data String: 'LP140WFB-SPT1'
Checksum: 0x8b

----------------

Warnings:

Block 0, Base EDID:
  Missing Display Product Name.

Failures:

Block 0, Base EDID:
  Empty Descriptor: Use Dummy Descriptor instead of all zeroes.
  Missing Display Range Limits Descriptor.
EDID:
  Extension Block 1 started with EDID header, ignoring Extension Blocks >= 1.

EDID conformity: FAIL
