edid-decode (hex):

00 ff ff ff ff ff ff 00 06 b3 00 24 01 01 01 01
0e 21 01 04 a5 34 20 78 3b 6d b5 a7 56 4e a0 25
0d 50 54 bf 6f 00 71 4f 81 80 81 40 81 c0 a9 40
95 00 b3 00 d1 c0 28 3c 80 a0 70 b0 23 40 30 20
36 00 06 44 21 00 00 1a 00 00 00 fd 00 31 4b 5f
5f 19 01 0a 20 20 20 20 20 20 00 00 00 fc 00 50
41 32 34 38 51 56 0a 20 20 20 20 20 00 00 00 ff
00 52 34 4c 4d 51 53 30 31 33 38 38 38 0a 01 fd

02 03 1b f1 4b 90 05 04 03 02 01 11 12 13 14 1f
23 09 07 07 83 01 00 00 e2 00 6a 02 3a 80 18 71
38 2d 40 58 2c 45 00 06 44 21 00 00 1e cd 5f 80
b0 72 b0 37 40 88 d0 36 00 06 44 21 00 00 1c 01
1d 00 72 51 d0 1e 20 6e 28 55 00 06 44 21 00 00
1e 8c 0a d0 8a 20 e0 2d 10 10 3e 96 00 06 44 21
00 00 18 01 1d 80 18 71 1c 16 20 58 2c 25 00 06
44 21 00 00 9e 00 00 00 00 00 00 00 00 00 00 2a

00 ff ff ff ff ff ff 00 06 b3 00 24 01 01 01 01
0e 21 01 04 a5 34 20 78 3b 6d b5 a7 56 4e a0 25
0d 50 54 bf 6f 00 71 4f 81 80 81 40 81 c0 a9 40
95 00 b3 00 d1 c0 28 3c 80 a0 70 b0 23 40 30 20
36 00 06 44 21 00 00 1a 00 00 00 fd 00 31 4b 5f
5f 19 01 0a 20 20 20 20 20 20 00 00 00 fc 00 50
41 32 34 38 51 56 0a 20 20 20 20 20 00 00 00 ff
00 52 34 4c 4d 51 53 30 31 33 38 38 38 0a 01 fd

02 03 1b f1 4b 90 05 04 03 02 01 11 12 13 14 1f
23 09 07 07 83 01 00 00 e2 00 6a 02 3a 80 18 71
38 2d 40 58 2c 45 00 06 44 21 00 00 1e cd 5f 80
b0 72 b0 37 40 88 d0 36 00 06 44 21 00 00 1c 01
1d 00 72 51 d0 1e 20 6e 28 55 00 06 44 21 00 00
1e 8c 0a d0 8a 20 e0 2d 10 10 3e 96 00 06 44 21
00 00 18 01 1d 80 18 71 1c 16 20 58 2c 25 00 06
44 21 00 00 9e 00 00 00 00 00 00 00 00 00 00 2a

----------------

Block 0, Base EDID:
  EDID Structure Version & Revision: 1.4
  Vendor & Product Identification:
    Manufacturer: AUS
    Model: 9216
    Serial Number: ...
    Made in: week 14 of 2023
  Basic Display Parameters & Features:
    Digital display
    Bits per primary color channel: 8
    DisplayPort interface
    Maximum image size: 52 cm x 32 cm
    Gamma: 2.20
    DPMS levels: Off
    Supported color formats: RGB 4:4:4, YCrCb 4:4:4, YCrCb 4:2:2
    First detailed timing includes the native pixel format and preferred refresh rate
    Display supports continuous frequencies
  Color Characteristics:
    Red  : 0.6533, 0.3378
    Green: 0.3076, 0.6259
    Blue : 0.1464, 0.0537
    White: 0.3134, 0.3291
  Established Timings I & II:
    IBM     :   720x400    70.081663 Hz   9:5     31.467 kHz     28.320000 MHz
    DMT 0x04:   640x480    59.940476 Hz   4:3     31.469 kHz     25.175000 MHz
    Apple   :   640x480    66.666667 Hz   4:3     35.000 kHz     30.240000 MHz
    DMT 0x05:   640x480    72.808802 Hz   4:3     37.861 kHz     31.500000 MHz
    DMT 0x06:   640x480    75.000000 Hz   4:3     37.500 kHz     31.500000 MHz
    DMT 0x08:   800x600    56.250000 Hz   4:3     35.156 kHz     36.000000 MHz
    DMT 0x09:   800x600    60.316541 Hz   4:3     37.879 kHz     40.000000 MHz
    DMT 0x0b:   800x600    75.000000 Hz   4:3     46.875 kHz     49.500000 MHz
    Apple   :   832x624    74.551266 Hz   4:3     49.726 kHz     57.284000 MHz
    DMT 0x10:  1024x768    60.003840 Hz   4:3     48.363 kHz     65.000000 MHz
    DMT 0x11:  1024x768    70.069359 Hz   4:3     56.476 kHz     75.000000 MHz
    DMT 0x12:  1024x768    75.028582 Hz   4:3     60.023 kHz     78.750000 MHz
    DMT 0x24:  1280x1024   75.024675 Hz   5:4     79.976 kHz    135.000000 MHz
  Standard Timings:
    DMT 0x15:  1152x864    75.000000 Hz   4:3     67.500 kHz    108.000000 MHz
    DMT 0x23:  1280x1024   60.019740 Hz   5:4     63.981 kHz    108.000000 MHz
    DMT 0x20:  1280x960    60.000000 Hz   4:3     60.000 kHz    108.000000 MHz
    DMT 0x55:  1280x720    60.000000 Hz  16:9     45.000 kHz     74.250000 MHz
    DMT 0x33:  1600x1200   60.000000 Hz   4:3     75.000 kHz    162.000000 MHz
    DMT 0x2f:  1440x900    59.887445 Hz  16:10    55.935 kHz    106.500000 MHz
    DMT 0x3a:  1680x1050   59.954250 Hz  16:10    65.290 kHz    146.250000 MHz
    DMT 0x52:  1920x1080   60.000000 Hz  16:9     67.500 kHz    148.500000 MHz
  Detailed Timing Descriptors:
    DTD  1:  1920x1200   59.950171 Hz  16:10    74.038 kHz    154.000000 MHz (518 mm x 324 mm)
                  Hfront   48 Hsync  32 Hback   80 Hpol P
                  Vfront    3 Vsync   6 Vback   26 Vpol N
    Display Range Limits:
      Monitor ranges (Range Limits Only): 49-75 Hz V, 95-95 kHz H, max dotclock 250 MHz
    Display Product Name: 'PA248QV'
    Display Product Serial Number: ...
  Extension blocks: 1
Checksum: 0xfd

----------------

Block 1, CTA-861 Extension Block:
  Revision: 3
  Underscans IT Video Formats by default
  Basic audio support
  Supports YCbCr 4:4:4
  Supports YCbCr 4:2:2
  Native detailed modes: 1
  Video Data Block:
    VIC  16:  1920x1080   60.000000 Hz  16:9     67.500 kHz    148.500000 MHz (native)
    VIC   5:  1920x1080i  60.000000 Hz  16:9     33.750 kHz     74.250000 MHz
    VIC   4:  1280x720    60.000000 Hz  16:9     45.000 kHz     74.250000 MHz
    VIC   3:   720x480    59.940060 Hz  16:9     31.469 kHz     27.000000 MHz
    VIC   2:   720x480    59.940060 Hz   4:3     31.469 kHz     27.000000 MHz
    VIC   1:   640x480    59.940476 Hz   4:3     31.469 kHz     25.175000 MHz
    VIC  17:   720x576    50.000000 Hz   4:3     31.250 kHz     27.000000 MHz
    VIC  18:   720x576    50.000000 Hz  16:9     31.250 kHz     27.000000 MHz
    VIC  19:  1280x720    50.000000 Hz  16:9     37.500 kHz     74.250000 MHz
    VIC  20:  1920x1080i  50.000000 Hz  16:9     28.125 kHz     74.250000 MHz
    VIC  31:  1920x1080   50.000000 Hz  16:9     56.250 kHz    148.500000 MHz
  Audio Data Block:
    Linear PCM:
      Max channels: 2
      Supported sample rates (kHz): 48 44.1 32
      Supported sample sizes (bits): 24 20 16
  Speaker Allocation Data Block:
    FL/FR - Front Left/Right
  Video Capability Data Block:
    YCbCr quantization: No Data
    RGB quantization: Selectable (via AVI Q)
    PT scan behavior: Always Underscanned
    IT scan behavior: Always Underscanned
    CE scan behavior: Always Underscanned
  Detailed Timing Descriptors:
    DTD  2:  1920x1080   60.000000 Hz  16:9     67.500 kHz    148.500000 MHz (518 mm x 324 mm)
                  Hfront   88 Hsync  44 Hback  148 Hpol P
                  Vfront    4 Vsync   5 Vback   36 Vpol P
    DTD  3:  1920x1200   74.930340 Hz  16:10    94.038 kHz    245.250000 MHz (518 mm x 324 mm)
                  Hfront  136 Hsync 208 Hback  344 Hpol N
                  Vfront    3 Vsync   6 Vback   46 Vpol P
    DTD  4:  1280x720    60.000000 Hz  16:9     45.000 kHz     74.250000 MHz (518 mm x 324 mm)
                  Hfront  110 Hsync  40 Hback  220 Hpol P
                  Vfront    5 Vsync   5 Vback   20 Vpol P
    DTD  5:   720x480    59.940060 Hz   3:2     31.469 kHz     27.000000 MHz (518 mm x 324 mm)
                  Hfront   16 Hsync  62 Hback   60 Hpol N
                  Vfront    9 Vsync   6 Vback   30 Vpol N
    DTD  6:  1920x1080i  60.000000 Hz  16:9     33.750 kHz     74.250000 MHz (518 mm x 324 mm)
                  Hfront   88 Hsync  44 Hback  148 Hpol P
                  Vfront    2 Vsync   5 Vback   15 Vpol P Vfront +0.5 Odd Field
                  Vfront    2 Vsync   5 Vback   15 Vpol P Vback  +0.5 Even Field
Checksum: 0x2a  Unused space in Extension Block: 10 bytes

----------------

Block 2, Unknown EDID Extension Block 0x00:
  00 ff ff ff ff ff ff 00 06 b3 00 24 01 01 01 01 '...........$....'
  0e 21 01 04 a5 34 20 78 3b 6d b5 a7 56 4e a0 25 '.!...4 x;m..VN.%'
  0d 50 54 bf 6f 00 71 4f 81 80 81 40 81 c0 a9 40 '.PT.o.qO...@...@'
  95 00 b3 00 d1 c0 28 3c 80 a0 70 b0 23 40 30 20 '......(<..p.#@0 '
  36 00 06 44 21 00 00 1a 00 00 00 fd 00 31 4b 5f '6..D!........1K_'
  5f 19 01 0a 20 20 20 20 20 20 00 00 00 fc 00 50 '_...      .....P'
  41 32 34 38 51 56 0a 20 20 20 20 20 00 00 00 ff 'A248QV.     ....'
  00 52 34 4c 4d 51 53 30 31 33 38 38 38 0a 01 fd '.R4LMQS013888...'
Checksum: 0xfd

----------------

Block 3, CTA-861 Extension Block:
  Revision: 3
  Underscans IT Video Formats by default
  Basic audio support
  Supports YCbCr 4:4:4
  Supports YCbCr 4:2:2
  Native detailed modes: 1
  Video Data Block:
    VIC  16:  1920x1080   60.000000 Hz  16:9     67.500 kHz    148.500000 MHz (native)
    VIC   5:  1920x1080i  60.000000 Hz  16:9     33.750 kHz     74.250000 MHz
    VIC   4:  1280x720    60.000000 Hz  16:9     45.000 kHz     74.250000 MHz
    VIC   3:   720x480    59.940060 Hz  16:9     31.469 kHz     27.000000 MHz
    VIC   2:   720x480    59.940060 Hz   4:3     31.469 kHz     27.000000 MHz
    VIC   1:   640x480    59.940476 Hz   4:3     31.469 kHz     25.175000 MHz
    VIC  17:   720x576    50.000000 Hz   4:3     31.250 kHz     27.000000 MHz
    VIC  18:   720x576    50.000000 Hz  16:9     31.250 kHz     27.000000 MHz
    VIC  19:  1280x720    50.000000 Hz  16:9     37.500 kHz     74.250000 MHz
    VIC  20:  1920x1080i  50.000000 Hz  16:9     28.125 kHz     74.250000 MHz
    VIC  31:  1920x1080   50.000000 Hz  16:9     56.250 kHz    148.500000 MHz
  Audio Data Block:
    Linear PCM:
      Max channels: 2
      Supported sample rates (kHz): 48 44.1 32
      Supported sample sizes (bits): 24 20 16
  Speaker Allocation Data Block:
    FL/FR - Front Left/Right
  Video Capability Data Block:
    YCbCr quantization: No Data
    RGB quantization: Selectable (via AVI Q)
    PT scan behavior: Always Underscanned
    IT scan behavior: Always Underscanned
    CE scan behavior: Always Underscanned
  Detailed Timing Descriptors:
    DTD  7:  1920x1080   60.000000 Hz  16:9     67.500 kHz    148.500000 MHz (518 mm x 324 mm)
                  Hfront   88 Hsync  44 Hback  148 Hpol P
                  Vfront    4 Vsync   5 Vback   36 Vpol P
    DTD  8:  1920x1200   74.930340 Hz  16:10    94.038 kHz    245.250000 MHz (518 mm x 324 mm)
                  Hfront  136 Hsync 208 Hback  344 Hpol N
                  Vfront    3 Vsync   6 Vback   46 Vpol P
    DTD  9:  1280x720    60.000000 Hz  16:9     45.000 kHz     74.250000 MHz (518 mm x 324 mm)
                  Hfront  110 Hsync  40 Hback  220 Hpol P
                  Vfront    5 Vsync   5 Vback   20 Vpol P
    DTD 10:   720x480    59.940060 Hz   3:2     31.469 kHz     27.000000 MHz (518 mm x 324 mm)
                  Hfront   16 Hsync  62 Hback   60 Hpol N
                  Vfront    9 Vsync   6 Vback   30 Vpol N
    DTD 11:  1920x1080i  60.000000 Hz  16:9     33.750 kHz     74.250000 MHz (518 mm x 324 mm)
                  Hfront   88 Hsync  44 Hback  148 Hpol P
                  Vfront    2 Vsync   5 Vback   15 Vpol P Vfront +0.5 Odd Field
                  Vfront    2 Vsync   5 Vback   15 Vpol P Vback  +0.5 Even Field
Checksum: 0x2a  Unused space in Extension Block: 10 bytes

----------------

Warnings:

Block 0, Base EDID:
  Vendor & Product Identification: The serial number is one of the known dummy values, it should probably be set to 0.
Block 1, CTA-861 Extension Block:
  Video Data Block: VIC 16 and the first DTD are not identical. Is this intended?
  Video Capability Data Block: Set Selectable YCbCr Quantization to avoid interop issues.
  Video Capability Data Block: S_PT is equal to S_IT and S_CE, so should be set to 0 instead.
  Detailed Timing Descriptor #2: Image size is 518x324 mm, but based on the picture AR it should be 518x291 mm.
  Detailed Timing Descriptor #4: Image size is 518x324 mm, but based on the picture AR it should be 518x291 mm.
  Detailed Timing Descriptor #5: Image size is 518x324 mm, but based on the picture AR it should be 518x345 mm.
  Detailed Timing Descriptor #6: Image size is 518x324 mm, but based on the picture AR it should be 518x291 mm.
  Display Product Serial Number is set, so the Serial Number in the Base EDID should be 0.
  Add a Colorimetry Data Block with the sRGB colorimetry bit set to avoid interop issues.
Block 3, CTA-861 Extension Block:
  Video Capability Data Block: Set Selectable YCbCr Quantization to avoid interop issues.
  Video Capability Data Block: S_PT is equal to S_IT and S_CE, so should be set to 0 instead.
  Detailed Timing Descriptor #7: Image size is 518x324 mm, but based on the picture AR it should be 518x291 mm.
  Detailed Timing Descriptor #9: Image size is 518x324 mm, but based on the picture AR it should be 518x291 mm.
  Detailed Timing Descriptor #10: Image size is 518x324 mm, but based on the picture AR it should be 518x345 mm.
  Detailed Timing Descriptor #11: Image size is 518x324 mm, but based on the picture AR it should be 518x291 mm.
EDID:
  Base EDID: Some timings are out of range of the Monitor Ranges:
    Horizontal Freq: 28.125 - 94.037 kHz (Monitor: 95.000 - 95.000 kHz)

Failures:

Block 2, Base EDID:
  Unknown Extension Block.
Block 3, CTA-861 Extension Block:
  Video Data Block: Duplicate VIC 16.
  Video Data Block: Duplicate VIC 5.
  Video Data Block: Duplicate VIC 4.
  Video Data Block: Duplicate VIC 3.
  Video Data Block: Duplicate VIC 2.
  Video Data Block: Duplicate VIC 1.
  Video Data Block: Duplicate VIC 17.
  Video Data Block: Duplicate VIC 18.
  Video Data Block: Duplicate VIC 19.
  Video Data Block: Duplicate VIC 20.
  Video Data Block: Duplicate VIC 31.
  Speaker Allocation Data Block: Only one instance of this Data Block is allowed.
  Video Capability Data Block: Only one instance of this Data Block is allowed.
EDID:
  Base EDID: EDID specified 1 extension block(s), but found 3 extension block(s).
  CTA-861: Native progressive timings are a mix of several resolutions.

EDID conformity: FAIL
