edid-decode (hex):

00 ff ff ff ff ff ff 00 15 84 83 66 01 00 00 00
0a 1d 01 03 80 58 31 78 0a ee 95 a3 54 4c 99 26
0f 50 54 ad cf 00 71 4f 81 40 81 80 81 c0 81 00
95 00 01 01 01 01 66 21 56 aa 51 00 1e 30 46 8f
33 00 56 00 53 00 00 1e 0e 1f 00 80 51 00 1e 30
40 80 37 00 55 00 53 00 00 1c 00 00 00 fc 00 4c
45 2d 33 32 50 32 38 53 4c 38 33 0a 00 00 00 fd
00 17 4b 1e 50 17 00 0a 20 20 20 20 20 20 01 a4

----------------

Block 0, Base EDID:
  EDID Structure Version & Revision: 1.3
  Vendor & Product Identification:
    Manufacturer: ELD
    Model: 26243
    Serial Number: ...
    Made in: week 10 of 2019
  Basic Display Parameters & Features:
    Digital display
    Maximum image size: 88 cm x 49 cm
    Gamma: 2.20
    RGB color display
    First detailed timing is the preferred timing
  Color Characteristics:
    Red  : 0.6396, 0.3300
    Green: 0.2998, 0.5996
    Blue : 0.1503, 0.0595
    White: 0.3134, 0.3291
  Established Timings I & II:
    IBM     :   720x400    70.081663 Hz   9:5     31.467 kHz     28.320000 MHz
    DMT 0x04:   640x480    59.940476 Hz   4:3     31.469 kHz     25.175000 MHz
    DMT 0x05:   640x480    72.808802 Hz   4:3     37.861 kHz     31.500000 MHz
    DMT 0x06:   640x480    75.000000 Hz   4:3     37.500 kHz     31.500000 MHz
    DMT 0x09:   800x600    60.316541 Hz   4:3     37.879 kHz     40.000000 MHz
    DMT 0x0a:   800x600    72.187572 Hz   4:3     48.077 kHz     50.000000 MHz
    DMT 0x0b:   800x600    75.000000 Hz   4:3     46.875 kHz     49.500000 MHz
    DMT 0x10:  1024x768    60.003840 Hz   4:3     48.363 kHz     65.000000 MHz
    DMT 0x11:  1024x768    70.069359 Hz   4:3     56.476 kHz     75.000000 MHz
    DMT 0x12:  1024x768    75.028582 Hz   4:3     60.023 kHz     78.750000 MHz
    DMT 0x24:  1280x1024   75.024675 Hz   5:4     79.976 kHz    135.000000 MHz
  Standard Timings:
    DMT 0x15:  1152x864    75.000000 Hz   4:3     67.500 kHz    108.000000 MHz
    DMT 0x20:  1280x960    60.000000 Hz   4:3     60.000 kHz    108.000000 MHz
    DMT 0x23:  1280x1024   60.019740 Hz   5:4     63.981 kHz    108.000000 MHz
    DMT 0x55:  1280x720    60.000000 Hz  16:9     45.000 kHz     74.250000 MHz
    DMT 0x1c:  1280x800    59.810326 Hz  16:10    49.702 kHz     83.500000 MHz
    DMT 0x2f:  1440x900    59.887445 Hz  16:10    55.935 kHz    106.500000 MHz
  Detailed Timing Descriptors:
    DTD 1:  1366x768    59.789541 Hz 683:384   47.712 kHz     85.500000 MHz (1366 mm x 768 mm)
                 Hfront   70 Hsync 143 Hback  213 Hpol P
                 Vfront    3 Vsync   3 Vback   24 Vpol P
    DTD 2:  1280x768    59.870228 Hz   5:3     47.776 kHz     79.500000 MHz (1365 mm x 768 mm)
                 Hfront   64 Hsync 128 Hback  192 Hpol N
                 Vfront    3 Vsync   7 Vback   20 Vpol P
    Display Product Name: 'LE-32P28SL83'
    Display Range Limits:
      Monitor ranges (GTF): 23-75 Hz V, 30-80 kHz H, max dotclock 230 MHz
  Extension blocks: 1
Checksum: 0xa4

----------------

Warnings:

Block 0, Base EDID:
  Vendor & Product Identification: The serial number is one of the known dummy values, it should probably be set to 0.
  Detailed Timing Descriptor #2: Image size is 1365x768 mm, but based on the picture AR it should be 1365x819 mm.

Failures:

Block 0, Base EDID:
  Detailed Timing Descriptor #1: Mismatch of image size 1366x768 mm vs display size 880x490 mm.
  Detailed Timing Descriptor #2: Mismatch of image size 1365x768 mm vs display size 880x490 mm.
EDID:
  Base EDID: The DTD max image size is 1366x768mm, which is larger than the display size 880.0x490.0mm.
  Base EDID: EDID specified 1 extension block(s), but found 0 extension block(s).

EDID conformity: FAIL
