edid-decode (hex):

00 ff ff ff ff ff ff 00 09 d1 28 80 45 54 00 00
2e 1d 01 03 80 3c 22 78 2e 66 65 a9 54 4c 9d 26
10 50 54 a5 6b 80 d1 c0 b3 00 a9 c0 81 80 81 00
81 c0 01 01 01 01 56 5e 00 a0 a0 a0 29 50 2f 20
35 00 55 50 21 00 00 1a 00 00 00 ff 00 47 42 4b
30 30 30 39 35 30 31 51 0a 20 00 00 00 fd 00 32
4c 1e 5a 1b 00 0a 20 20 20 20 20 20 00 00 00 fc
00 42 65 6e 51 20 50 44 32 37 31 30 51 43 01 1e

02 03 23 f1 50 90 1f 22 21 20 05 14 04 13 12 11
03 02 01 07 06 23 09 07 07 83 01 00 00 65 03 0c
00 10 00 01 1d 00 72 51 d0 1e 20 6e 28 55 00 55
50 21 00 00 1e 8c 0a d0 8a 20 e0 2d 10 10 3e 96
00 55 50 21 00 00 18 8c 0a d0 90 20 40 31 20 0c
40 55 00 55 50 21 00 00 18 8c 0a d0 90 20 40 31
20 0c 40 55 00 55 50 21 00 00 18 00 00 00 00 00
00 00 00 00 00 00 00 00 00 00 00 00 00 00 00 e4

00 ff ff ff ff ff ff 00 09 d1 28 80 45 54 00 00
2e 1d 01 03 80 3c 22 78 2e 66 65 a9 54 4c 9d 26
10 50 54 a5 6b 80 d1 c0 b3 00 a9 c0 81 80 81 00
81 c0 01 01 01 01 56 5e 00 a0 a0 a0 29 50 2f 20
35 00 55 50 21 00 00 1a 00 00 00 ff 00 47 42 4b
30 30 30 39 35 30 31 51 0a 20 00 00 00 fd 00 32
4c 1e 5a 1b 00 0a 20 20 20 20 20 20 00 00 00 fc
00 42 65 6e 51 20 50 44 32 37 31 30 51 43 01 1e

02 03 23 f1 50 90 1f 22 21 20 05 14 04 13 12 11
03 02 01 07 06 23 09 07 07 83 01 00 00 65 03 0c
00 10 00 01 1d 00 72 51 d0 1e 20 6e 28 55 00 55
50 21 00 00 1e 8c 0a d0 8a 20 e0 2d 10 10 3e 96
00 55 50 21 00 00 18 8c 0a d0 90 20 40 31 20 0c
40 55 00 55 50 21 00 00 18 8c 0a d0 90 20 40 31
20 0c 40 55 00 55 50 21 00 00 18 00 00 00 00 00
00 00 00 00 00 00 00 00 00 00 00 00 00 00 00 e4

----------------

Block 0, Base EDID:
  EDID Structure Version & Revision: 1.3
  Vendor & Product Identification:
    Manufacturer: BNQ
    Model: 32808
    Serial Number: ...
    Made in: week 46 of 2019
  Basic Display Parameters & Features:
    Digital display
    Maximum image size: 60 cm x 34 cm
    Gamma: 2.20
    DPMS levels: Off
    RGB color display
    Default (sRGB) color space is primary color space
    First detailed timing is the preferred timing
  Color Characteristics:
    Red  : 0.6611, 0.3300
    Green: 0.2978, 0.6152
    Blue : 0.1494, 0.0644
    White: 0.3134, 0.3291
  Established Timings I & II:
    IBM     :   720x400    70.081663 Hz   9:5     31.467 kHz     28.320000 MHz
    DMT 0x04:   640x480    59.940476 Hz   4:3     31.469 kHz     25.175000 MHz
    DMT 0x06:   640x480    75.000000 Hz   4:3     37.500 kHz     31.500000 MHz
    DMT 0x09:   800x600    60.316541 Hz   4:3     37.879 kHz     40.000000 MHz
    DMT 0x0b:   800x600    75.000000 Hz   4:3     46.875 kHz     49.500000 MHz
    Apple   :   832x624    74.551266 Hz   4:3     49.726 kHz     57.284000 MHz
    DMT 0x10:  1024x768    60.003840 Hz   4:3     48.363 kHz     65.000000 MHz
    DMT 0x12:  1024x768    75.028582 Hz   4:3     60.023 kHz     78.750000 MHz
    DMT 0x24:  1280x1024   75.024675 Hz   5:4     79.976 kHz    135.000000 MHz
    Apple   :  1152x870    75.061550 Hz 192:145   68.681 kHz    100.000000 MHz
  Standard Timings:
    DMT 0x52:  1920x1080   60.000000 Hz  16:9     67.500 kHz    148.500000 MHz
    DMT 0x3a:  1680x1050   59.954250 Hz  16:10    65.290 kHz    146.250000 MHz
    DMT 0x53:  1600x900    60.000000 Hz  16:9     60.000 kHz    108.000000 MHz (RB)
    DMT 0x23:  1280x1024   60.019740 Hz   5:4     63.981 kHz    108.000000 MHz
    DMT 0x1c:  1280x800    59.810326 Hz  16:10    49.702 kHz     83.500000 MHz
    DMT 0x55:  1280x720    60.000000 Hz  16:9     45.000 kHz     74.250000 MHz
  Detailed Timing Descriptors:
    DTD 1:  2560x1440   59.950550 Hz  16:9     88.787 kHz    241.500000 MHz (597 mm x 336 mm)
                 Hfront   47 Hsync  32 Hback   81 Hpol P
                 Vfront    3 Vsync   5 Vback   33 Vpol N
    Display Product Serial Number: ...
    Display Range Limits:
      Monitor ranges (GTF): 50-76 Hz V, 30-90 kHz H, max dotclock 270 MHz
    Display Product Name: 'BenQ PD2710QC'
  Extension blocks: 1
Checksum: 0x1e

----------------

Block 1, CTA-861 Extension Block:
  Revision: 3
  Underscans IT Video Formats by default
  Basic audio support
  Supports YCbCr 4:4:4
  Supports YCbCr 4:2:2
  Native DTDs: 1
  Video Data Block:
    VIC  16:  1920x1080   60.000000 Hz  16:9     67.500 kHz    148.500000 MHz (native)
    VIC  31:  1920x1080   50.000000 Hz  16:9     56.250 kHz    148.500000 MHz
    VIC  34:  1920x1080   30.000000 Hz  16:9     33.750 kHz     74.250000 MHz
    VIC  33:  1920x1080   25.000000 Hz  16:9     28.125 kHz     74.250000 MHz
    VIC  32:  1920x1080   24.000000 Hz  16:9     27.000 kHz     74.250000 MHz
    VIC   5:  1920x1080i  60.000000 Hz  16:9     33.750 kHz     74.250000 MHz
    VIC  20:  1920x1080i  50.000000 Hz  16:9     28.125 kHz     74.250000 MHz
    VIC   4:  1280x720    60.000000 Hz  16:9     45.000 kHz     74.250000 MHz
    VIC  19:  1280x720    50.000000 Hz  16:9     37.500 kHz     74.250000 MHz
    VIC  18:   720x576    50.000000 Hz  16:9     31.250 kHz     27.000000 MHz
    VIC  17:   720x576    50.000000 Hz   4:3     31.250 kHz     27.000000 MHz
    VIC   3:   720x480    59.940060 Hz  16:9     31.469 kHz     27.000000 MHz
    VIC   2:   720x480    59.940060 Hz   4:3     31.469 kHz     27.000000 MHz
    VIC   1:   640x480    59.940476 Hz   4:3     31.469 kHz     25.175000 MHz
    VIC   7:  1440x480i   59.940060 Hz  16:9     15.734 kHz     27.000000 MHz
    VIC   6:  1440x480i   59.940060 Hz   4:3     15.734 kHz     27.000000 MHz
  Audio Data Block:
    Linear PCM:
      Max channels: 2
      Supported sample rates (kHz): 48 44.1 32
      Supported sample sizes (bits): 24 20 16
  Speaker Allocation Data Block:
    FL/FR - Front Left/Right
  Vendor-Specific Data Block (HDMI), OUI 00-0C-03:
    Source physical address: 1.0.0.0
  Detailed Timing Descriptors:
    DTD 2:  1280x720    60.000000 Hz  16:9     45.000 kHz     74.250000 MHz (597 mm x 336 mm)
                 Hfront  110 Hsync  40 Hback  220 Hpol P
                 Vfront    5 Vsync   5 Vback   20 Vpol P
    DTD 3:   720x480    59.940060 Hz   3:2     31.469 kHz     27.000000 MHz (597 mm x 336 mm)
                 Hfront   16 Hsync  62 Hback   60 Hpol N
                 Vfront    9 Vsync   6 Vback   30 Vpol N
    DTD 4:   720x576    50.000000 Hz   5:4     31.250 kHz     27.000000 MHz (597 mm x 336 mm)
                 Hfront   12 Hsync  64 Hback   68 Hpol N
                 Vfront    5 Vsync   5 Vback   39 Vpol N
    DTD 5:   720x576    50.000000 Hz   5:4     31.250 kHz     27.000000 MHz (597 mm x 336 mm)
                 Hfront   12 Hsync  64 Hback   68 Hpol N
                 Vfront    5 Vsync   5 Vback   39 Vpol N
Checksum: 0xe4  Unused space in Extension Block: 20 bytes

----------------

Warnings:

Block 0, Base EDID:
  Vendor & Product Identification: The serial number is one of the known dummy values, it should probably be set to 0.
Block 1, CTA-861 Extension Block:
  Video Data Block: VIC 16 and the first DTD are not identical. Is this intended?
  Detailed Timing Descriptor #3: Image size is 597x336 mm, but based on the picture AR it should be 504x336 mm.
  Detailed Timing Descriptor #4: Image size is 597x336 mm, but based on the picture AR it should be 420x336 mm.
  Detailed Timing Descriptor #5: Image size is 597x336 mm, but based on the picture AR it should be 420x336 mm.
  Display Product Serial Number is set, so the Serial Number in the Base EDID should be 0.
EDID:
  Base EDID: Some timings are out of range of the Monitor Ranges:
    Vertical Freq: 24.000 - 75.062 Hz (Monitor: 50.000 - 76.000 Hz)
    Horizontal Freq: 15.734 - 88.786 kHz (Monitor: 30.000 - 90.000 kHz)

Failures:

Block 0, Base EDID:
  Basic Display Parameters & Features: sRGB is signaled, but the chromaticities do not match.
Block 1, CTA-861 Extension Block:
  Missing VCDB, needed for Set Selectable RGB Quantization to avoid interop issues.
EDID:
  Extension Block 2 started with EDID header, ignoring Extension Blocks >= 2.
  CTA-861: Native progressive timings are a mix of several resolutions.

EDID conformity: FAIL
