edid-decode (hex):

00 ff ff ff ff ff ff 00 30 e4 93 7b 00 00 00 00
00 13 01 04 90 25 17 78 e0 34 65 97 59 57 92 29
20 50 54 00 00 00 01 01 01 01 01 01 01 01 01 01
01 01 01 01 01 01 c6 2a a0 0c 52 84 1d 30 50 50
33 00 6f e6 10 00 00 1a 84 1c a0 0c 52 84 1d 30
50 50 33 00 6f e6 10 00 00 1a 00 00 00 fe 00 47
31 32 31 52 80 31 37 31 57 50 39 0a 00 00 00 00
00 00 41 31 1a 00 00 00 00 02 01 0a 20 20 00 60

----------------

Block 0, Base EDID:
  EDID Structure Version & Revision: 1.4
  Vendor & Product Identification:
    Manufacturer: LGD
    Model: 31635
    Made in: 2009
  Basic Display Parameters & Features:
    Digital display
    Bits per primary color channel: 6
    Digital interface is not defined
    Maximum image size: 37 cm x 23 cm
    Gamma: 2.20
    DPMS levels: Standby Suspend Off
    Supported color formats: RGB 4:4:4
    First detailed timing does not include the native pixel format and preferred refresh rate
  Color Characteristics:
    Red  : 0.5898, 0.3505
    Green: 0.3408, 0.5703
    Blue : 0.1611, 0.1269
    White: 0.3134, 0.3291
  Established Timings I & II: none
  Standard Timings: none
  Detailed Timing Descriptors:
    DTD 1:  1440x900    60.014601 Hz  16:10    55.754 kHz    109.500000 MHz (367 mm x 230 mm)
                 Hfront   80 Hsync  80 Hback  364 Hpol P
                 Vfront    3 Vsync   3 Vback   23 Vpol N
    DTD 2:  1440x900    40.009734 Hz  16:10    37.169 kHz     73.000000 MHz (367 mm x 230 mm)
                 Hfront   80 Hsync  80 Hback  364 Hpol P
                 Vfront    3 Vsync   3 Vback   23 Vpol N
    Alphanumeric Data String: 'G121R.171WP9'
    Manufacturer-Specified Display Descriptor (0x00): 00 00 00 00 41 31 1a 00 00 00 00 02 01 0a 20 20 '....A1........  '
Checksum: 0x60

----------------

Warnings:

Block 0, Base EDID:
  Alphanumeric Data String: Non-ASCII character 0x80 at position 5, can cause problems.
  Missing Display Product Name.
EDID:
  No Native Video Resolution was defined.

EDID conformity: PASS
