edid-decode (hex):

00 ff ff ff ff ff ff 00 06 b3 6a 34 01 00 00 00
01 1e 01 04 b5 50 23 78 3b 78 a1 ae 4f 42 ac 23
0d 50 54 bf cf 80 71 4f 81 40 81 80 81 c0 95 00
b3 00 d1 c0 01 01 f5 7c 70 a0 d0 a0 29 50 30 20
3a 00 20 4f 31 00 00 1a 00 00 00 fd 0c 30 b4 10
10 60 01 0a 20 20 20 20 20 20 00 00 00 fc 00 58
47 33 34 39 43 0a 20 20 20 20 20 20 00 00 00 ff
00 0a 20 20 20 20 20 20 20 20 20 20 20 20 02 72

02 03 3d f1 54 01 02 03 04 05 0e 0f 10 13 1d 1e
1f 59 5a 5b 5c 5d 5e 5f 61 23 09 07 07 83 01 00
00 e3 05 c3 01 e6 06 05 01 70 62 23 e2 00 d5 6d
1a 00 00 02 0b 30 b4 00 04 6d 20 6d 28 4e d4 70
a0 d0 a0 46 50 30 20 88 0c 20 4f 31 00 00 1a 1a
b3 70 a0 d0 a0 3b 50 30 20 d8 08 20 4f 31 00 00
1a 59 e7 00 6a a0 a0 67 50 08 20 68 00 20 4f 31
00 00 1a 00 00 00 00 00 00 00 00 00 00 00 00 c2

70 12 79 00 00 03 01 14 34 31 01 86 6f 0d 4f 00
07 80 1f 00 9f 05 66 00 58 00 07 00 03 01 14 7e
73 01 86 6f 0d 4f 00 07 80 1f 00 9f 05 3c 00 02
00 09 00 00 00 00 00 00 00 00 00 00 00 00 00 00
00 00 00 00 00 00 00 00 00 00 00 00 00 00 00 00
00 00 00 00 00 00 00 00 00 00 00 00 00 00 00 00
00 00 00 00 00 00 00 00 00 00 00 00 00 00 00 00
00 00 00 00 00 00 00 00 00 00 00 00 00 00 ab 90

00 ff ff ff ff ff ff 00 06 b3 6a 34 01 00 00 00
01 1e 01 04 b5 50 23 78 3b 78 a1 ae 4f 42 ac 23
0d 50 54 bf cf 80 71 4f 81 40 81 80 81 c0 95 00
b3 00 d1 c0 01 01 f5 7c 70 a0 d0 a0 29 50 30 20
3a 00 20 4f 31 00 00 1a 00 00 00 fd 0c 30 b4 10
10 60 01 0a 20 20 20 20 20 20 00 00 00 fc 00 58
47 33 34 39 43 0a 20 20 20 20 20 20 00 00 00 ff
00 0a 20 20 20 20 20 20 20 20 20 20 20 20 02 72

02 03 3d f1 54 01 02 03 04 05 0e 0f 10 13 1d 1e
1f 59 5a 5b 5c 5d 5e 5f 61 23 09 07 07 83 01 00
00 e3 05 c3 01 e6 06 05 01 70 62 23 e2 00 d5 6d
1a 00 00 02 0b 30 b4 00 04 6d 20 6d 28 4e d4 70
a0 d0 a0 46 50 30 20 88 0c 20 4f 31 00 00 1a 1a
b3 70 a0 d0 a0 3b 50 30 20 d8 08 20 4f 31 00 00
1a 59 e7 00 6a a0 a0 67 50 08 20 68 00 20 4f 31
00 00 1a 00 00 00 00 00 00 00 00 00 00 00 00 c2

70 12 79 00 00 03 01 14 34 31 01 86 6f 0d 4f 00
07 80 1f 00 9f 05 66 00 58 00 07 00 03 01 14 7e
73 01 86 6f 0d 4f 00 07 80 1f 00 9f 05 3c 00 02
00 09 00 00 00 00 00 00 00 00 00 00 00 00 00 00
00 00 00 00 00 00 00 00 00 00 00 00 00 00 00 00
00 00 00 00 00 00 00 00 00 00 00 00 00 00 00 00
00 00 00 00 00 00 00 00 00 00 00 00 00 00 00 00
00 00 00 00 00 00 00 00 00 00 00 00 00 00 ab 90

----------------

Block 0, Base EDID:
  EDID Structure Version & Revision: 1.4
  Vendor & Product Identification:
    Manufacturer: AUS
    Model: 13418
    Serial Number: ...
    Made in: week 1 of 2020
  Basic Display Parameters & Features:
    Digital display
    Bits per primary color channel: 10
    DisplayPort interface
    Maximum image size: 80 cm x 35 cm
    Gamma: 2.20
    DPMS levels: Off
    Supported color formats: RGB 4:4:4, YCrCb 4:4:4, YCrCb 4:2:2
    First detailed timing includes the native pixel format and preferred refresh rate
    Display supports continuous frequencies
  Color Characteristics:
    Red  : 0.6806, 0.3115
    Green: 0.2597, 0.6718
    Blue : 0.1386, 0.0527
    White: 0.3125, 0.3291
  Established Timings I & II:
    IBM     :   720x400    70.081663 Hz   9:5     31.467 kHz     28.320000 MHz
    DMT 0x04:   640x480    59.940476 Hz   4:3     31.469 kHz     25.175000 MHz
    Apple   :   640x480    66.666667 Hz   4:3     35.000 kHz     30.240000 MHz
    DMT 0x05:   640x480    72.808802 Hz   4:3     37.861 kHz     31.500000 MHz
    DMT 0x06:   640x480    75.000000 Hz   4:3     37.500 kHz     31.500000 MHz
    DMT 0x08:   800x600    56.250000 Hz   4:3     35.156 kHz     36.000000 MHz
    DMT 0x09:   800x600    60.316541 Hz   4:3     37.879 kHz     40.000000 MHz
    DMT 0x0a:   800x600    72.187572 Hz   4:3     48.077 kHz     50.000000 MHz
    DMT 0x0b:   800x600    75.000000 Hz   4:3     46.875 kHz     49.500000 MHz
    DMT 0x10:  1024x768    60.003840 Hz   4:3     48.363 kHz     65.000000 MHz
    DMT 0x11:  1024x768    70.069359 Hz   4:3     56.476 kHz     75.000000 MHz
    DMT 0x12:  1024x768    75.028582 Hz   4:3     60.023 kHz     78.750000 MHz
    DMT 0x24:  1280x1024   75.024675 Hz   5:4     79.976 kHz    135.000000 MHz
    Apple   :  1152x870    75.061550 Hz 192:145   68.681 kHz    100.000000 MHz
  Standard Timings:
    DMT 0x15:  1152x864    75.000000 Hz   4:3     67.500 kHz    108.000000 MHz
    DMT 0x20:  1280x960    60.000000 Hz   4:3     60.000 kHz    108.000000 MHz
    DMT 0x23:  1280x1024   60.019740 Hz   5:4     63.981 kHz    108.000000 MHz
    DMT 0x55:  1280x720    60.000000 Hz  16:9     45.000 kHz     74.250000 MHz
    DMT 0x2f:  1440x900    59.887445 Hz  16:10    55.935 kHz    106.500000 MHz
    DMT 0x3a:  1680x1050   59.954250 Hz  16:10    65.290 kHz    146.250000 MHz
    DMT 0x52:  1920x1080   60.000000 Hz  16:9     67.500 kHz    148.500000 MHz
  Detailed Timing Descriptors:
    DTD 1:  3440x1440   59.998875 Hz  43:18    88.858 kHz    319.890000 MHz (800 mm x 335 mm)
                 Hfront   48 Hsync  32 Hback   80 Hpol P
                 Vfront    3 Vsync  10 Vback   28 Vpol N
    Display Range Limits:
      Monitor ranges (Range Limits Only): 48-180 Hz V, 271-271 kHz H, max dotclock 960 MHz
    Display Product Name: 'XG349C'
    Display Product Serial Number: ...
  Extension blocks: 2
Checksum: 0x72

----------------

Block 1, CTA-861 Extension Block:
  Revision: 3
  Underscans IT Video Formats by default
  Basic audio support
  Supports YCbCr 4:4:4
  Supports YCbCr 4:2:2
  Native DTDs: 1
  Video Data Block:
    VIC   1:   640x480    59.940476 Hz   4:3     31.469 kHz     25.175000 MHz
    VIC   2:   720x480    59.940060 Hz   4:3     31.469 kHz     27.000000 MHz
    VIC   3:   720x480    59.940060 Hz  16:9     31.469 kHz     27.000000 MHz
    VIC   4:  1280x720    60.000000 Hz  16:9     45.000 kHz     74.250000 MHz
    VIC   5:  1920x1080i  60.000000 Hz  16:9     33.750 kHz     74.250000 MHz
    VIC  14:  1440x480    59.940060 Hz   4:3     31.469 kHz     54.000000 MHz
    VIC  15:  1440x480    59.940060 Hz  16:9     31.469 kHz     54.000000 MHz
    VIC  16:  1920x1080   60.000000 Hz  16:9     67.500 kHz    148.500000 MHz
    VIC  19:  1280x720    50.000000 Hz  16:9     37.500 kHz     74.250000 MHz
    VIC  29:  1440x576    50.000000 Hz   4:3     31.250 kHz     54.000000 MHz
    VIC  30:  1440x576    50.000000 Hz  16:9     31.250 kHz     54.000000 MHz
    VIC  31:  1920x1080   50.000000 Hz  16:9     56.250 kHz    148.500000 MHz
    VIC  89:  2560x1080   50.000000 Hz  64:27    56.250 kHz    185.625000 MHz
    VIC  90:  2560x1080   60.000000 Hz  64:27    66.000 kHz    198.000000 MHz
    VIC  91:  2560x1080  100.000000 Hz  64:27   125.000 kHz    371.250000 MHz
    VIC  92:  2560x1080  120.000000 Hz  64:27   150.000 kHz    495.000000 MHz
    VIC  93:  3840x2160   24.000000 Hz  16:9     54.000 kHz    297.000000 MHz
    VIC  94:  3840x2160   25.000000 Hz  16:9     56.250 kHz    297.000000 MHz
    VIC  95:  3840x2160   30.000000 Hz  16:9     67.500 kHz    297.000000 MHz
    VIC  97:  3840x2160   60.000000 Hz  16:9    135.000 kHz    594.000000 MHz
  Audio Data Block:
    Linear PCM:
      Max channels: 2
      Supported sample rates (kHz): 48 44.1 32
      Supported sample sizes (bits): 24 20 16
  Speaker Allocation Data Block:
    FL/FR - Front Left/Right
  Colorimetry Data Block:
    xvYCC601
    xvYCC709
    BT2020YCC
    BT2020RGB
    Gamut Boundary Description Metadata Profile P0
  HDR Static Metadata Data Block:
    Electro optical transfer functions:
      Traditional gamma - SDR luminance range
      SMPTE ST2084
    Supported static metadata descriptors:
      Static metadata type 1
    Desired content max luminance: 112 (565.685 cd/m^2)
    Desired content max frame-average luminance: 98 (417.710 cd/m^2)
    Desired content min luminance: 35 (0.107 cd/m^2)
  Video Capability Data Block:
    YCbCr quantization: Selectable (via AVI YQ)
    RGB quantization: Selectable (via AVI Q)
    PT scan behavior: Always Overscanned
    IT scan behavior: Always Overscanned
    CE scan behavior: Always Overscanned
  Vendor-Specific Data Block (AMD), OUI 00-00-1A:
    Version: 2
    Flags 1: 0x0b
      FreeSync Supported
      FreeSync 2 HDR Supported
      Local Dimming Supported
    Minimum Refresh Rate: 48 Hz
    Maximum Refresh Rate: 180 Hz
    Flags 5: 0x04
      Gamma 2.2 EOTF Supported
    Maximum luminance: 109 (530.095 cd/m^2)
    Minimum luminance: 32 (0.083 cd/m^2)
    Maximum luminance (without local dimming): 109 (530.095 cd/m^2)
    Minimum luminance (without local dimming): 40 (0.130 cd/m^2)
  Detailed Timing Descriptors:
    DTD 2:  3440x1440   99.981604 Hz  43:18   150.972 kHz    543.500000 MHz (800 mm x 335 mm)
                 Hfront   48 Hsync  32 Hback   80 Hpol P
                 Vfront   56 Vsync   8 Vback    6 Vpol N
    DTD 3:  3440x1440   84.964050 Hz  43:18   127.361 kHz    458.500000 MHz (800 mm x 335 mm)
                 Hfront   48 Hsync  32 Hback   80 Hpol P
                 Vfront   45 Vsync   8 Vback    6 Vpol N
    DTD 4:  2560x1440  143.972318 Hz  16:9    222.149 kHz    592.250000 MHz (800 mm x 335 mm)
                 Hfront    8 Hsync  32 Hback   66 Hpol P
                 Vfront    6 Vsync   8 Vback   89 Vpol N
Checksum: 0xc2  Unused space in Extension Block: 12 bytes

----------------

Block 2, DisplayID Extension Block:
  Version: 1.2
  Extension Count: 0
  Display Product Type: Extension Section
  Video Timing Modes Type 1 - Detailed Timings Data Block:
    DTD:  3440x1440  143.855314 Hz  64:27   221.969 kHz    781.330000 MHz (aspect 64:27, no 3D stereo, preferred)
               Hfront    8 Hsync  32 Hback   40 Hpol P
               Vfront   89 Vsync   8 Vback    6 Vpol N
  Video Timing Modes Type 1 - Detailed Timings Data Block:
    DTD:  3440x1440  179.999319 Hz  64:27   270.179 kHz    951.030000 MHz (aspect 64:27, no 3D stereo, preferred)
               Hfront    8 Hsync  32 Hback   40 Hpol P
               Vfront    3 Vsync  10 Vback   48 Vpol N
  Checksum: 0xab
Checksum: 0x90

----------------

Warnings:

Block 0, Base EDID:
  Vendor & Product Identification: The serial number is one of the known dummy values, it should probably be set to 0.
Block 1, CTA-861 Extension Block:
  Video Data Block: VIC 1 and the first DTD are not identical. Is this intended?
  Video Data Block: All VICs are in ascending order, and the first (preferred) VIC <= 4, is that intended?
  Colorimetry Data Block: Set the sRGB colorimetry bit to avoid interop issues.
  Video Capability Data Block: IT scan behavior is expected to support underscanned.
  Video Capability Data Block: S_PT is equal to S_IT and S_CE, so should be set to 0 instead.
  Detailed Timing Descriptor #4: Image size is 800x335 mm, but based on the picture AR it should be 595x335 mm.
  Display Product Serial Number is set, so the Serial Number in the Base EDID should be 0.
EDID:
  Base EDID: Some timings are out of range of the Monitor Ranges:
    Vertical Freq: 24.000 - 179.999 Hz (Monitor: 48.000 - 180.000 Hz)
    Horizontal Freq: 31.250 - 270.178 kHz (Monitor: 271.000 - 271.000 kHz)

Failures:

Block 0, Base EDID:
  Display Product Serial Number: ...
Block 1, CTA-861 Extension Block:
  Video Capability Data Block: IT video formats are always overscanned, but bit 7 of Byte 3 of the CTA-861 Extension header is set to underscanned.
Block 2, DisplayID Extension Block:
  DisplayID Base Block has no product type.
EDID:
  Extension Block 3 started with EDID header, ignoring Extension Blocks >= 3.

EDID conformity: FAIL
