edid-decode (hex):

00 ff ff ff ff ff ff 00 10 ac 43 40 55 32 37 32
2b 12 01 03 68 2b 1b 78 ee ee 95 a3 54 4c 99 26
0f 50 54 a5 4b 80 71 4f 81 80 b3 00 95 00 81 c0
81 00 01 01 01 01 21 39 90 30 62 1a 27 40 68 b0
36 00 b1 0f 11 00 00 1c 00 00 00 ff 00 54 34 30
39 44 38 41 4c 32 37 32 55 0a 00 00 00 fc 00 44
45 4c 4c 20 45 32 30 30 39 57 0a 20 00 00 00 fd
00 38 4b 1e 53 10 00 0a 20 20 20 20 20 20 00 47

00 ff ff ff ff ff ff 00 10 ac 43 40 55 32 37 32
2b 12 01 03 68 2b 1b 78 ee ee 95 a3 54 4c 99 26
0f 50 54 a5 4b 80 71 4f 81 80 b3 00 95 00 81 c0
81 00 01 01 01 01 21 39 90 30 62 1a 27 40 68 b0
36 00 b1 0f 11 00 00 1c 00 00 00 ff 00 54 34 30
39 44 38 41 4c 32 37 32 55 0a 00 00 00 fc 00 44
45 4c 4c 20 45 32 30 30 39 57 0a 20 00 00 00 fd
00 38 4b 1e 53 10 00 0a 20 20 20 20 20 20 00 47

----------------

Block 0, Base EDID:
  EDID Structure Version & Revision: 1.3
  Vendor & Product Identification:
    Manufacturer: DEL
    Model: 16451
    Serial Number: ...
    Made in: week 43 of 2008
  Basic Display Parameters & Features:
    Analog display
    Signal Level Standard: 0.700 : 0.000 : 0.700 V p-p
    Blank level equals black level
    Sync: Separate
    Maximum image size: 43 cm x 27 cm
    Gamma: 2.20
    DPMS levels: Standby Suspend Off
    RGB color display
    Default (sRGB) color space is primary color space
    First detailed timing is the preferred timing
  Color Characteristics:
    Red  : 0.6396, 0.3300
    Green: 0.2998, 0.5996
    Blue : 0.1503, 0.0595
    White: 0.3134, 0.3291
  Established Timings I & II:
    IBM     :   720x400    70.081663 Hz   9:5     31.467 kHz     28.320000 MHz
    DMT 0x04:   640x480    59.940476 Hz   4:3     31.469 kHz     25.175000 MHz
    DMT 0x06:   640x480    75.000000 Hz   4:3     37.500 kHz     31.500000 MHz
    DMT 0x09:   800x600    60.316541 Hz   4:3     37.879 kHz     40.000000 MHz
    DMT 0x0b:   800x600    75.000000 Hz   4:3     46.875 kHz     49.500000 MHz
    DMT 0x10:  1024x768    60.003840 Hz   4:3     48.363 kHz     65.000000 MHz
    DMT 0x12:  1024x768    75.028582 Hz   4:3     60.023 kHz     78.750000 MHz
    DMT 0x24:  1280x1024   75.024675 Hz   5:4     79.976 kHz    135.000000 MHz
    Apple   :  1152x870    75.061550 Hz 192:145   68.681 kHz    100.000000 MHz
  Standard Timings:
    DMT 0x15:  1152x864    75.000000 Hz   4:3     67.500 kHz    108.000000 MHz
    DMT 0x23:  1280x1024   60.019740 Hz   5:4     63.981 kHz    108.000000 MHz
    DMT 0x3a:  1680x1050   59.954250 Hz  16:10    65.290 kHz    146.250000 MHz
    DMT 0x2f:  1440x900    59.887445 Hz  16:10    55.935 kHz    106.500000 MHz
    DMT 0x55:  1280x720    60.000000 Hz  16:9     45.000 kHz     74.250000 MHz
    DMT 0x1c:  1280x800    59.810326 Hz  16:10    49.702 kHz     83.500000 MHz
  Detailed Timing Descriptors:
    DTD 1:  1680x1050   59.954250 Hz  16:10    65.290 kHz    146.250000 MHz (433 mm x 271 mm)
                 Hfront  104 Hsync 176 Hback  280 Hpol N
                 Vfront    3 Vsync   6 Vback   30 Vpol P
    Display Product Serial Number: ...
    Display Product Name: 'DELL E2009W'
    Display Range Limits:
      Monitor ranges (GTF): 56-75 Hz V, 30-83 kHz H, max dotclock 160 MHz
Checksum: 0x47

----------------

Failures:

Block 0, Base EDID:
  Basic Display Parameters & Features: sRGB is signaled, but the chromaticities do not match.
EDID:
  Extension Block 1 started with EDID header, ignoring Extension Blocks >= 1.

EDID conformity: FAIL
