edid-decode (hex):

00 ff ff ff ff ff ff 00 1c 54 05 27 01 01 01 01
21 1d 01 04 b5 3c 22 78 fb c7 41 ae 4f 47 a5 26
11 50 54 bf cf 00 d1 c0 71 4f 81 c0 81 40 81 80
95 00 b3 00 01 01 56 5e 00 a0 a0 a0 29 50 30 20
35 00 54 4f 21 00 00 1e 00 00 00 fd 00 30 a5 f1
f1 41 01 0a 20 20 20 20 20 20 00 00 00 fc 00 41
4f 52 55 53 20 43 56 32 37 51 0a 20 00 00 00 ff
00 31 39 33 33 30 42 30 30 31 32 33 34 0a 02 d7

02 03 47 71 4c 02 03 11 12 1f 04 13 10 29 2f 40
3f 23 09 17 07 83 01 00 00 67 03 0c 00 10 00 38
3c 67 d8 5d c4 01 78 80 00 6d 1a 00 00 02 03 30
a5 00 0f 62 2f 62 2f e3 05 c0 00 e4 0f 00 00 00
e6 06 05 01 62 62 2f 06 fc 00 64 a0 a0 1e 50 18
10 25 00 54 4f 21 00 00 1a 84 90 80 64 70 38 1e
40 18 10 25 00 54 4f 21 00 00 1a 04 c0 00 64 a0
a0 64 50 18 10 25 00 54 4f 21 00 00 1a 00 00 d0

70 12 17 00 00 03 01 14 6b e6 00 08 ff 09 63 00
17 00 0f 00 9f 05 63 00 01 00 04 00 c9 00 00 00
00 00 00 00 00 00 00 00 00 00 00 00 00 00 00 00
00 00 00 00 00 00 00 00 00 00 00 00 00 00 00 00
00 00 00 00 00 00 00 00 00 00 00 00 00 00 00 00
00 00 00 00 00 00 00 00 00 00 00 00 00 00 00 00
00 00 00 00 00 00 00 00 00 00 00 00 00 00 00 00
00 00 00 00 00 00 00 00 00 00 00 00 00 00 00 90

00 ff ff ff ff ff ff 00 1c 54 05 27 01 01 01 01
21 1d 01 04 b5 3c 22 78 fb c7 41 ae 4f 47 a5 26
11 50 54 bf cf 00 d1 c0 71 4f 81 c0 81 40 81 80
95 00 b3 00 01 01 56 5e 00 a0 a0 a0 29 50 30 20
35 00 54 4f 21 00 00 1e 00 00 00 fd 00 30 a5 f1
f1 41 01 0a 20 20 20 20 20 20 00 00 00 fc 00 41
4f 52 55 53 20 43 56 32 37 51 0a 20 00 00 00 ff
00 31 39 33 33 30 42 30 30 31 32 33 34 0a 02 d7

02 03 47 71 4c 02 03 11 12 1f 04 13 10 29 2f 40
3f 23 09 17 07 83 01 00 00 67 03 0c 00 10 00 38
3c 67 d8 5d c4 01 78 80 00 6d 1a 00 00 02 03 30
a5 00 0f 62 2f 62 2f e3 05 c0 00 e4 0f 00 00 00
e6 06 05 01 62 62 2f 06 fc 00 64 a0 a0 1e 50 18
10 25 00 54 4f 21 00 00 1a 84 90 80 64 70 38 1e
40 18 10 25 00 54 4f 21 00 00 1a 04 c0 00 64 a0
a0 64 50 18 10 25 00 54 4f 21 00 00 1a 00 00 d0

70 12 17 00 00 03 01 14 6b e6 00 08 ff 09 63 00
17 00 0f 00 9f 05 63 00 01 00 04 00 c9 00 00 00
00 00 00 00 00 00 00 00 00 00 00 00 00 00 00 00
00 00 00 00 00 00 00 00 00 00 00 00 00 00 00 00
00 00 00 00 00 00 00 00 00 00 00 00 00 00 00 00
00 00 00 00 00 00 00 00 00 00 00 00 00 00 00 00
00 00 00 00 00 00 00 00 00 00 00 00 00 00 00 00
00 00 00 00 00 00 00 00 00 00 00 00 00 00 00 90

----------------

Block 0, Base EDID:
  EDID Structure Version & Revision: 1.4
  Vendor & Product Identification:
    Manufacturer: GBT
    Model: 9989
    Serial Number: ...
    Made in: week 33 of 2019
  Basic Display Parameters & Features:
    Digital display
    Bits per primary color channel: 10
    DisplayPort interface
    Maximum image size: 60 cm x 34 cm
    Gamma: 2.20
    DPMS levels: Standby Suspend Off
    Supported color formats: RGB 4:4:4, YCrCb 4:4:4, YCrCb 4:2:2
    First detailed timing includes the native pixel format and preferred refresh rate
    Display supports continuous frequencies
  Color Characteristics:
    Red  : 0.6826, 0.3085
    Green: 0.2783, 0.6474
    Blue : 0.1494, 0.0664
    White: 0.3125, 0.3291
  Established Timings I & II:
    IBM     :   720x400    70.081663 Hz   9:5     31.467 kHz     28.320000 MHz
    DMT 0x04:   640x480    59.940476 Hz   4:3     31.469 kHz     25.175000 MHz
    Apple   :   640x480    66.666667 Hz   4:3     35.000 kHz     30.240000 MHz
    DMT 0x05:   640x480    72.808802 Hz   4:3     37.861 kHz     31.500000 MHz
    DMT 0x06:   640x480    75.000000 Hz   4:3     37.500 kHz     31.500000 MHz
    DMT 0x08:   800x600    56.250000 Hz   4:3     35.156 kHz     36.000000 MHz
    DMT 0x09:   800x600    60.316541 Hz   4:3     37.879 kHz     40.000000 MHz
    DMT 0x0a:   800x600    72.187572 Hz   4:3     48.077 kHz     50.000000 MHz
    DMT 0x0b:   800x600    75.000000 Hz   4:3     46.875 kHz     49.500000 MHz
    DMT 0x10:  1024x768    60.003840 Hz   4:3     48.363 kHz     65.000000 MHz
    DMT 0x11:  1024x768    70.069359 Hz   4:3     56.476 kHz     75.000000 MHz
    DMT 0x12:  1024x768    75.028582 Hz   4:3     60.023 kHz     78.750000 MHz
    DMT 0x24:  1280x1024   75.024675 Hz   5:4     79.976 kHz    135.000000 MHz
  Standard Timings:
    DMT 0x52:  1920x1080   60.000000 Hz  16:9     67.500 kHz    148.500000 MHz
    DMT 0x15:  1152x864    75.000000 Hz   4:3     67.500 kHz    108.000000 MHz
    DMT 0x55:  1280x720    60.000000 Hz  16:9     45.000 kHz     74.250000 MHz
    DMT 0x20:  1280x960    60.000000 Hz   4:3     60.000 kHz    108.000000 MHz
    DMT 0x23:  1280x1024   60.019740 Hz   5:4     63.981 kHz    108.000000 MHz
    DMT 0x2f:  1440x900    59.887445 Hz  16:10    55.935 kHz    106.500000 MHz
    DMT 0x3a:  1680x1050   59.954250 Hz  16:10    65.290 kHz    146.250000 MHz
  Detailed Timing Descriptors:
    DTD 1:  2560x1440   59.950550 Hz  16:9     88.787 kHz    241.500000 MHz (596 mm x 335 mm)
                 Hfront   48 Hsync  32 Hback   80 Hpol P
                 Vfront    3 Vsync   5 Vback   33 Vpol P
    Display Range Limits:
      Monitor ranges (Range Limits Only): 48-165 Hz V, 241-241 kHz H, max dotclock 650 MHz
    Display Product Name: 'AORUS CV27Q'
    Display Product Serial Number: ...
  Extension blocks: 2
Checksum: 0xd7

----------------

Block 1, CTA-861 Extension Block:
  Revision: 3
  Basic audio support
  Supports YCbCr 4:4:4
  Supports YCbCr 4:2:2
  Native detailed modes: 1
  Video Data Block:
    VIC   2:   720x480    59.940060 Hz   4:3     31.469 kHz     27.000000 MHz
    VIC   3:   720x480    59.940060 Hz  16:9     31.469 kHz     27.000000 MHz
    VIC  17:   720x576    50.000000 Hz   4:3     31.250 kHz     27.000000 MHz
    VIC  18:   720x576    50.000000 Hz  16:9     31.250 kHz     27.000000 MHz
    VIC  31:  1920x1080   50.000000 Hz  16:9     56.250 kHz    148.500000 MHz
    VIC   4:  1280x720    60.000000 Hz  16:9     45.000 kHz     74.250000 MHz
    VIC  19:  1280x720    50.000000 Hz  16:9     37.500 kHz     74.250000 MHz
    VIC  16:  1920x1080   60.000000 Hz  16:9     67.500 kHz    148.500000 MHz
    VIC  41:  1280x720   100.000000 Hz  16:9     75.000 kHz    148.500000 MHz
    VIC  47:  1280x720   120.000000 Hz  16:9     90.000 kHz    148.500000 MHz
    VIC  64:  1920x1080  100.000000 Hz  16:9    112.500 kHz    297.000000 MHz
    VIC  63:  1920x1080  120.000000 Hz  16:9    135.000 kHz    297.000000 MHz
  Audio Data Block:
    Linear PCM:
      Max channels: 2
      Supported sample rates (kHz): 96 48 44.1 32
      Supported sample sizes (bits): 24 20 16
  Speaker Allocation Data Block:
    FL/FR - Front Left/Right
  Vendor-Specific Data Block (HDMI), OUI 00-0C-03:
    Source physical address: 1.0.0.0
    DC_36bit
    DC_30bit
    DC_Y444
    Maximum TMDS clock: 300 MHz
  Vendor-Specific Data Block (HDMI Forum), OUI C4-5D-D8:
    Version: 1
    Maximum TMDS Character Rate: 600 MHz
    SCDC Present
  Vendor-Specific Data Block (AMD), OUI 00-00-1A:
    Version: 2
    Feature Caps: 0x03
    Minimum Refresh Rate: 48 Hz
    Maximum Refresh Rate: 165 Hz
    Flags 1.x: 0x00
    Flags 2.x: 0x0f
      ST 2084 (PQ) EOTF Supported
      Linear EOTF (Windows scRGB, 0.0 - 125.0) Supported
      Gamma 2.2 EOTF Supported
      BT.2020 Gamut Supported
    Maximum luminance: 98 (417.710 cd/m^2)
    Minimum luminance: 47 (0.142 cd/m^2)
  Colorimetry Data Block:
    BT2020YCC
    BT2020RGB
  YCbCr 4:2:0 Capability Map Data Block:
    Empty Capability Map
  HDR Static Metadata Data Block:
    Electro optical transfer functions:
      Traditional gamma - SDR luminance range
      SMPTE ST2084
    Supported static metadata descriptors:
      Static metadata type 1
    Desired content max luminance: 98 (417.710 cd/m^2)
    Desired content max frame-average luminance: 98 (417.710 cd/m^2)
    Desired content min luminance: 47 (0.142 cd/m^2)
  Detailed Timing Descriptors:
    DTD 2:  2560x1440  164.999233 Hz  16:9    242.549 kHz    645.180000 MHz (596 mm x 335 mm)
                 Hfront   24 Hsync  16 Hback   60 Hpol P
                 Vfront    2 Vsync   5 Vback   23 Vpol N
    DTD 3:  1920x1080  164.998662 Hz  16:9    183.149 kHz    369.960000 MHz (596 mm x 335 mm)
                 Hfront   24 Hsync  16 Hback   60 Hpol P
                 Vfront    2 Vsync   5 Vback   23 Vpol N
    DTD 4:  2560x1440  119.998047 Hz  16:9    184.797 kHz    491.560000 MHz (596 mm x 335 mm)
                 Hfront   24 Hsync  16 Hback   60 Hpol P
                 Vfront    2 Vsync   5 Vback   93 Vpol N
Checksum: 0xd0  Unused space in Extension Block: 2 bytes

----------------

Block 2, DisplayID Extension Block:
  Version: 1.2
  Extension Count: 0
  Display Product Type: Extension Section
  Video Timing Modes Type 1 - Detailed Timings Data Block:
    DTD:  2560x1440  143.999609 Hz   0:0    221.759 kHz    589.880000 MHz (aspect undefined, no 3D stereo)
               Hfront   24 Hsync  16 Hback   60 Hpol N
               Vfront    2 Vsync   5 Vback   93 Vpol N
  Checksum: 0xc9
Checksum: 0x90  Unused space in Extension Block: 98 bytes

----------------

Block 3, Unknown EDID Extension Block 0x00:
  00 ff ff ff ff ff ff 00 1c 54 05 27 01 01 01 01 '.........T.'....'
  21 1d 01 04 b5 3c 22 78 fb c7 41 ae 4f 47 a5 26 '!....<"x..A.OG.&'
  11 50 54 bf cf 00 d1 c0 71 4f 81 c0 81 40 81 80 '.PT.....qO...@..'
  95 00 b3 00 01 01 56 5e 00 a0 a0 a0 29 50 30 20 '......V^....)P0 '
  35 00 54 4f 21 00 00 1e 00 00 00 fd 00 30 a5 f1 '5.TO!........0..'
  f1 41 01 0a 20 20 20 20 20 20 00 00 00 fc 00 41 '.A..      .....A'
  4f 52 55 53 20 43 56 32 37 51 0a 20 00 00 00 ff 'ORUS CV27Q. ....'
  00 31 39 33 33 30 42 30 30 31 32 33 34 0a 02 d7 '.19330B001234...'
Checksum: 0xd7

----------------

Block 4, CTA-861 Extension Block:
  Revision: 3
  Basic audio support
  Supports YCbCr 4:4:4
  Supports YCbCr 4:2:2
  Native detailed modes: 1
  Video Data Block:
    VIC   2:   720x480    59.940060 Hz   4:3     31.469 kHz     27.000000 MHz
    VIC   3:   720x480    59.940060 Hz  16:9     31.469 kHz     27.000000 MHz
    VIC  17:   720x576    50.000000 Hz   4:3     31.250 kHz     27.000000 MHz
    VIC  18:   720x576    50.000000 Hz  16:9     31.250 kHz     27.000000 MHz
    VIC  31:  1920x1080   50.000000 Hz  16:9     56.250 kHz    148.500000 MHz
    VIC   4:  1280x720    60.000000 Hz  16:9     45.000 kHz     74.250000 MHz
    VIC  19:  1280x720    50.000000 Hz  16:9     37.500 kHz     74.250000 MHz
    VIC  16:  1920x1080   60.000000 Hz  16:9     67.500 kHz    148.500000 MHz
    VIC  41:  1280x720   100.000000 Hz  16:9     75.000 kHz    148.500000 MHz
    VIC  47:  1280x720   120.000000 Hz  16:9     90.000 kHz    148.500000 MHz
    VIC  64:  1920x1080  100.000000 Hz  16:9    112.500 kHz    297.000000 MHz
    VIC  63:  1920x1080  120.000000 Hz  16:9    135.000 kHz    297.000000 MHz
  Audio Data Block:
    Linear PCM:
      Max channels: 2
      Supported sample rates (kHz): 96 48 44.1 32
      Supported sample sizes (bits): 24 20 16
  Speaker Allocation Data Block:
    FL/FR - Front Left/Right
  Vendor-Specific Data Block (HDMI), OUI 00-0C-03:
    Source physical address: 1.0.0.0
    DC_36bit
    DC_30bit
    DC_Y444
    Maximum TMDS clock: 300 MHz
  Vendor-Specific Data Block (HDMI Forum), OUI C4-5D-D8:
    Version: 1
    Maximum TMDS Character Rate: 600 MHz
    SCDC Present
  Vendor-Specific Data Block (AMD), OUI 00-00-1A:
    Version: 2
    Feature Caps: 0x03
    Minimum Refresh Rate: 48 Hz
    Maximum Refresh Rate: 165 Hz
    Flags 1.x: 0x00
    Flags 2.x: 0x0f
      ST 2084 (PQ) EOTF Supported
      Linear EOTF (Windows scRGB, 0.0 - 125.0) Supported
      Gamma 2.2 EOTF Supported
      BT.2020 Gamut Supported
    Maximum luminance: 98 (417.710 cd/m^2)
    Minimum luminance: 47 (0.142 cd/m^2)
  Colorimetry Data Block:
    BT2020YCC
    BT2020RGB
  YCbCr 4:2:0 Capability Map Data Block:
    Empty Capability Map
  HDR Static Metadata Data Block:
    Electro optical transfer functions:
      Traditional gamma - SDR luminance range
      SMPTE ST2084
    Supported static metadata descriptors:
      Static metadata type 1
    Desired content max luminance: 98 (417.710 cd/m^2)
    Desired content max frame-average luminance: 98 (417.710 cd/m^2)
    Desired content min luminance: 47 (0.142 cd/m^2)
  Detailed Timing Descriptors:
    DTD 5:  2560x1440  164.999233 Hz  16:9    242.549 kHz    645.180000 MHz (596 mm x 335 mm)
                 Hfront   24 Hsync  16 Hback   60 Hpol P
                 Vfront    2 Vsync   5 Vback   23 Vpol N
    DTD 6:  1920x1080  164.998662 Hz  16:9    183.149 kHz    369.960000 MHz (596 mm x 335 mm)
                 Hfront   24 Hsync  16 Hback   60 Hpol P
                 Vfront    2 Vsync   5 Vback   23 Vpol N
    DTD 7:  2560x1440  119.998047 Hz  16:9    184.797 kHz    491.560000 MHz (596 mm x 335 mm)
                 Hfront   24 Hsync  16 Hback   60 Hpol P
                 Vfront    2 Vsync   5 Vback   93 Vpol N
Checksum: 0xd0  Unused space in Extension Block: 2 bytes

----------------

Block 5, DisplayID Extension Block:
  Version: 1.2
  Extension Count: 0
  Video Timing Modes Type 1 - Detailed Timings Data Block:
    DTD:  2560x1440  143.999609 Hz   0:0    221.759 kHz    589.880000 MHz (aspect undefined, no 3D stereo)
               Hfront   24 Hsync  16 Hback   60 Hpol N
               Vfront    2 Vsync   5 Vback   93 Vpol N
  Checksum: 0xc9
Checksum: 0x90  Unused space in Extension Block: 98 bytes

----------------

Warnings:

Block 0, Base EDID:
  Vendor & Product Identification: The serial number is one of the known dummy values, it should probably be set to 0.
Block 1, CTA-861 Extension Block:
  IT Video Formats are overscanned by default, but normally this should be underscanned.
  Video Data Block: VIC 2 and the first DTD are not identical. Is this intended?
  Colorimetry Data Block: Set the sRGB colorimetry bit to avoid interop issues.
  Display Product Serial Number is set, so the Serial Number in the Base EDID should be 0.
Block 4, CTA-861 Extension Block:
  IT Video Formats are overscanned by default, but normally this should be underscanned.
  Colorimetry Data Block: Set the sRGB colorimetry bit to avoid interop issues.
EDID:
  Base EDID: Some timings are out of range of the Monitor Ranges:
    Horizontal Freq: 31.250 - 242.548 kHz (Monitor: 241.000 - 241.000 kHz)

Failures:

Block 1, CTA-861 Extension Block:
  Vendor-Specific Data Block (HDMI), OUI 00-0C-03: The HDMI Specification requires EDID 1.3 instead of 1.4.
  YCbCr 4:2:0 Capability Map Data Block: Empty Capability Map.
  Missing VCDB, needed for Set Selectable RGB Quantization to avoid interop issues.
Block 2, DisplayID Extension Block:
  DisplayID Base Block has no product type.
  Expected 0 DisplayID Extension Block, but got 1.
Block 3, Base EDID:
  Unknown Extension Block.
Block 4, CTA-861 Extension Block:
  Video Data Block: Duplicate VIC 2.
  Video Data Block: Duplicate VIC 3.
  Video Data Block: Duplicate VIC 17.
  Video Data Block: Duplicate VIC 18.
  Video Data Block: Duplicate VIC 31.
  Video Data Block: Duplicate VIC 4.
  Video Data Block: Duplicate VIC 19.
  Video Data Block: Duplicate VIC 16.
  Video Data Block: Duplicate VIC 41.
  Video Data Block: Duplicate VIC 47.
  Video Data Block: Duplicate VIC 64.
  Video Data Block: Duplicate VIC 63.
  Speaker Allocation Data Block: Only one instance of this Data Block is allowed.
  Vendor-Specific Data Block (HDMI), OUI 00-0C-03: The HDMI Specification requires EDID 1.3 instead of 1.4.
  Vendor-Specific Data Block (HDMI Forum), OUI C4-5D-D8: Duplicate HDMI Forum VSDB/SCDB.
  Colorimetry Data Block: Only one instance of this Data Block is allowed.
  YCbCr 4:2:0 Capability Map Data Block: Only one instance of this Data Block is allowed.
  YCbCr 4:2:0 Capability Map Data Block: Empty Capability Map.
  HDR Static Metadata Data Block: Only one instance of this Data Block is allowed.
EDID:
  Base EDID: EDID specified 2 extension block(s), but found 5 extension block(s).
  CTA-861: The maximum HDMI TMDS clock is 600000 kHz, but one or more video timings go up to 645180 kHz.
  DisplayID: DisplayID expects at least one preferred timing.

EDID conformity: FAIL
