edid-decode (hex):

00 ff ff ff ff ff ff 00 0d ae 32 13 00 00 00 00
0c 17 01 04 90 1d 10 78 02 53 d5 98 58 52 90 27
21 50 54 00 00 00 01 01 01 01 01 01 01 01 01 01
01 01 01 01 01 01 73 1b 56 82 50 00 0e 30 25 19
24 00 25 a5 10 00 00 1a fe 14 56 0e 51 00 35 30
51 36 59 00 25 a5 10 00 00 1a 00 00 00 fe 00 35
36 54 37 35 80 31 33 33 42 47 45 0a 00 00 00 00
00 00 41 31 96 00 10 00 00 01 01 0a 20 20 00 eb

----------------

Block 0, Base EDID:
  EDID Structure Version & Revision: 1.4
  Vendor & Product Identification:
    Manufacturer: CMN
    Model: 4914
    Made in: week 12 of 2013
  Basic Display Parameters & Features:
    Digital display
    Bits per primary color channel: 6
    Digital interface is not defined
    Maximum image size: 29 cm x 16 cm
    Gamma: 2.20
    Supported color formats: RGB 4:4:4
    First detailed timing includes the native pixel format and preferred refresh rate
  Color Characteristics:
    Red  : 0.5947, 0.3447
    Green: 0.3203, 0.5654
    Blue : 0.1552, 0.1298
    White: 0.3134, 0.3291
  Established Timings I & II: none
  Standard Timings: none
  Detailed Timing Descriptors:
    DTD 1:  1366x768    60.066400 Hz 683:384   46.972 kHz     70.270000 MHz (293 mm x 165 mm)
                 Hfront   37 Hsync  25 Hback   68 Hpol P
                 Vfront    2 Vsync   4 Vback    8 Vpol N
    DTD 2:  1366x768    40.010245 Hz 683:384   32.848 kHz     53.740000 MHz (293 mm x 165 mm)
                 Hfront   81 Hsync  54 Hback  135 Hpol P
                 Vfront    5 Vsync   9 Vback   39 Vpol N
    Alphanumeric Data String: '56T75.133BGE'
    Manufacturer-Specified Display Descriptor (0x00): 00 00 00 00 41 31 96 00 10 00 00 01 01 0a 20 20 '....A1........  '
Checksum: 0xeb

----------------

Warnings:

Block 0, Base EDID:
  Alphanumeric Data String: Non-ASCII character 0x80 at position 5, can cause problems.
  Missing Display Product Name.

EDID conformity: PASS
