edid-decode (hex):

00 ff ff ff ff ff ff 00 22 0e c1 36 f6 d2 8c 47
31 1f 01 04 a5 0b 05 78 0e cb a0 a3 55 4d 99 27
0e 50 54 00 00 00 01 01 01 01 01 01 01 01 01 01
01 01 01 01 01 01 6a a7 40 64 b0 a0 9e 50 32 04
22 04 6e 32 00 00 00 1e 00 00 00 10 00 00 00 00
00 00 00 00 00 00 00 00 00 00 00 00 00 10 00 00
00 00 00 00 00 00 00 00 00 00 00 00 00 00 00 10
00 00 00 00 00 00 00 00 00 00 00 00 00 00 02 43

02 03 1a 00 75 5c 12 ca 01 07 02 e6 f9 ad e9 61
54 61 88 78 4e be c1 27 7d ab 00 00 00 00 00 00
00 00 00 00 00 00 00 00 00 00 00 00 00 00 00 00
00 00 00 00 00 00 00 00 00 00 00 00 00 00 00 00
00 00 00 00 00 00 00 00 00 00 00 00 00 00 00 00
00 00 00 00 00 00 00 00 00 00 00 00 00 00 00 00
00 00 00 00 00 00 00 00 00 00 00 00 00 00 00 00
00 00 00 00 00 00 00 00 00 00 00 00 00 00 00 83

70 12 79 00 00 03 00 28 ab 61 01 08 df 10 63 00
31 80 03 00 6f 08 73 00 0f 80 01 00 02 15 01 88
df 10 63 00 31 80 03 00 6f 08 01 02 0d 80 01 00
00 00 00 00 00 00 00 00 00 00 00 00 00 00 00 00
00 00 00 00 00 00 00 00 00 00 00 00 00 00 00 00
00 00 00 00 00 00 00 00 00 00 00 00 00 00 00 00
00 00 00 00 00 00 00 00 00 00 00 00 00 00 00 00
00 00 00 00 00 00 00 00 00 00 00 00 00 00 07 90

----------------

Block 0, Base EDID:
  EDID Structure Version & Revision: 1.4
  Vendor & Product Identification:
    Manufacturer: HPN
    Model: 14017
    Serial Number: ...
    Made in: week 49 of 2021
  Basic Display Parameters & Features:
    Digital display
    Bits per primary color channel: 8
    DisplayPort interface
    Maximum image size: 11 cm x 5 cm
    Gamma: 2.20
    Supported color formats: RGB 4:4:4, YCrCb 4:4:4
    Default (sRGB) color space is primary color space
    First detailed timing includes the native pixel format and preferred refresh rate
  Color Characteristics:
    Red  : 0.6396, 0.3320
    Green: 0.3027, 0.6005
    Blue : 0.1542, 0.0566
    White: 0.3125, 0.3281
  Established Timings I & II: none
  Standard Timings: none
  Detailed Timing Descriptors:
    DTD 1:  2880x1440   89.999244 Hz   2:1    143.819 kHz    428.580000 MHz (110 mm x 50 mm)
                 Hfront   50 Hsync   4 Hback   46 Hpol P
                 Vfront   18 Vsync   2 Vback  138 Vpol P
    Dummy Descriptor:
    Dummy Descriptor:
    Dummy Descriptor:
  Extension blocks: 2
Checksum: 0x43

----------------

Block 1, CTA-861 Extension Block:
  Revision: 3
  Native DTDs: 0
  Vendor-Specific Data Block (Microsoft), OUI CA-12-5C:
    Version: 1
    Display Product Primary Use Case: Virtual reality headset
    Container ID: 02e6f9ad-e961-5461-8878-4ebec1277dab
Checksum: 0x83  Unused space in Extension Block: 101 bytes

----------------

Block 2, DisplayID Extension Block:
  Version: 1.2
  Extension Count: 0
  Display Product Type: Extension Section
  Video Timing Modes Type 1 - Detailed Timings Data Block:
    DTD:  4320x2160   90.000716 Hz   0:0    204.842 kHz    905.400000 MHz (aspect undefined, no 3D stereo)
               Hfront   50 Hsync   4 Hback   46 Hpol P
               Vfront   16 Vsync   2 Vback   98 Vpol P
    DTD:  4320x2160   60.000440 Hz   0:0    160.441 kHz    709.150000 MHz (aspect undefined, no 3D stereo, preferred)
               Hfront   50 Hsync   4 Hback   46 Hpol P
               Vfront   14 Vsync   2 Vback  498 Vpol P
  Checksum: 0x07
Checksum: 0x90

----------------

Warnings:

Block 0, Base EDID:
  Basic Display Parameters & Features: Dubious maximum image size (11x5 is smaller than 10x10 cm).
  Detailed Timing Descriptor #1: Dubious image size (110x50 mm is smaller than 100x100 mm).
  Missing Display Product Name.
Block 1, CTA-861 Extension Block:
  IT Video Formats are overscanned by default, but normally this should be underscanned.

Failures:

Block 0, Base EDID:
  Basic Display Parameters & Features: sRGB is signaled, but the chromaticities do not match.
Block 1, CTA-861 Extension Block:
  Required 640x480p60 timings are missing in the established timings and the SVD list (VIC 1).
  Missing VCDB, needed for Set Selectable RGB Quantization to avoid interop issues.
Block 2, DisplayID Extension Block:
  DisplayID Base Block has no product type.

EDID conformity: FAIL
