edid-decode (hex):

00 ff ff ff ff ff ff 00 51 b8 00 14 00 00 00 00
03 1f 01 04 a5 1f 11 78 03 0f 91 ae 52 43 b0 26
0f 50 54 00 00 00 01 01 01 01 01 01 01 01 01 01
01 01 01 01 01 01 09 64 00 b0 a0 a0 78 50 30 20
36 00 36 ae 10 00 00 1e 00 00 00 fd 0c 30 a5 05
05 47 01 0a 20 20 20 20 20 20 00 00 00 10 00 30
a5 f7 f7 41 00 0a 20 20 20 20 20 20 00 00 00 fc
00 54 4c 31 34 30 42 44 58 50 30 32 2d 30 01 42

70 13 79 00 00 03 01 14 19 13 01 85 ff 09 af 00
2f 00 1f 00 9f 05 77 00 02 00 05 00 00 00 00 00
00 00 00 00 00 00 00 00 00 00 00 00 00 00 00 00
00 00 00 00 00 00 00 00 00 00 00 00 00 00 00 00
00 00 00 00 00 00 00 00 00 00 00 00 00 00 00 00
00 00 00 00 00 00 00 00 00 00 00 00 00 00 00 00
00 00 00 00 00 00 00 00 00 00 00 00 00 00 00 00
00 00 00 00 00 00 00 00 00 00 00 00 00 00 83 90

----------------

Block 0, Base EDID:
  EDID Structure Version & Revision: 1.4
  Vendor & Product Identification:
    Manufacturer: TMX
    Model: 5120
    Made in: week 3 of 2021
  Basic Display Parameters & Features:
    Digital display
    Bits per primary color channel: 8
    DisplayPort interface
    Maximum image size: 31 cm x 17 cm
    Gamma: 2.20
    Supported color formats: RGB 4:4:4
    First detailed timing includes the native pixel format and preferred refresh rate
    Display supports continuous frequencies
  Color Characteristics:
    Red  : 0.6796, 0.3203
    Green: 0.2646, 0.6904
    Blue : 0.1503, 0.0595
    White: 0.3125, 0.3291
  Established Timings I & II: none
  Standard Timings: none
  Detailed Timing Descriptors:
    DTD 1:  2560x1440   60.000094 Hz  16:9     93.600 kHz    256.090000 MHz (310 mm x 174 mm)
                 Hfront   48 Hsync  32 Hback   96 Hpol P
                 Vfront    3 Vsync   6 Vback  111 Vpol P
    Display Range Limits:
      Monitor ranges (Range Limits Only): 48-165 Hz V, 260-260 kHz H, max dotclock 710 MHz
    Dummy Descriptor:
    Display Product Name: 'TL140BDXP02-0'
  Extension blocks: 1
Checksum: 0x42

----------------

Block 1, DisplayID Extension Block:
  Version: 1.3
  Extension Count: 0
  Display Product Type: Extension Section
  Video Timing Modes Type 1 - Detailed Timings Data Block:
    DTD:  2560x1440  165.003186 Hz  16:10   257.405 kHz    704.260000 MHz (aspect 16:10, no 3D stereo, preferred)
               Hfront   48 Hsync  32 Hback   96 Hpol N
               Vfront    3 Vsync   6 Vback  111 Vpol N
  Checksum: 0x83
Checksum: 0x90

----------------

Warnings:

EDID:
  Base EDID: Some timings are out of range of the Monitor Ranges:
    Horizontal Freq: 93.600 - 257.404 kHz (Monitor: 260.000 - 260.000 kHz)

Failures:

Block 0, Base EDID:
  Dummy Descriptor: Dummy block filled with garbage.
Block 1, DisplayID Extension Block:
  DisplayID Base Block has no product type.

EDID conformity: FAIL
