edid-decode (hex):

00 ff ff ff ff ff ff 00 51 b8 00 14 00 00 00 00
1e 1e 01 04 a5 1f 11 78 07 0f 91 ae 52 43 b0 26
0f 50 54 00 00 00 01 01 01 01 01 01 01 01 01 01
01 01 01 01 01 01 cd c1 00 a0 a0 a0 50 50 30 20
75 04 36 ae 10 00 00 1e e7 60 00 a0 a0 a0 50 50
30 20 75 04 36 ae 10 00 00 1e 00 00 00 fd 00 30
78 b8 b8 32 01 0a 20 20 20 20 20 20 00 00 00 fc
00 54 4c 31 34 30 42 44 58 50 30 31 2d 30 00 1e

----------------

Block 0, Base EDID:
  EDID Structure Version & Revision: 1.4
  Vendor & Product Identification:
    Manufacturer: TMX
    Model: 5120
    Made in: week 30 of 2020
  Basic Display Parameters & Features:
    Digital display
    Bits per primary color channel: 8
    DisplayPort interface
    Maximum image size: 31 cm x 17 cm
    Gamma: 2.20
    Supported color formats: RGB 4:4:4
    Default (sRGB) color space is primary color space
    First detailed timing includes the native pixel format and preferred refresh rate
    Display supports continuous frequencies
  Color Characteristics:
    Red  : 0.6796, 0.3203
    Green: 0.2646, 0.6904
    Blue : 0.1503, 0.0595
    White: 0.3125, 0.3291
  Established Timings I & II: none
  Standard Timings: none
  Detailed Timing Descriptors:
    DTD 1:  2560x1440  120.000484 Hz  16:9    182.401 kHz    496.130000 MHz (310 mm x 174 mm)
                 Hfront   48 Hsync  32 Hback   80 Hpol P
                 Vfront   23 Vsync   5 Vback   52 Vpol P
    DTD 2:  2560x1440   60.001451 Hz  16:9     91.202 kHz    248.070000 MHz (310 mm x 174 mm)
                 Hfront   48 Hsync  32 Hback   80 Hpol P
                 Vfront   23 Vsync   5 Vback   52 Vpol P
    Display Range Limits:
      Monitor ranges (Range Limits Only): 48-120 Hz V, 184-184 kHz H, max dotclock 500 MHz
    Display Product Name: 'TL140BDXP01-0'
Checksum: 0x1e

----------------

Warnings:

EDID:
  Base EDID: Some timings are out of range of the Monitor Ranges:
    Horizontal Freq: 91.202 - 182.400 kHz (Monitor: 184.000 - 184.000 kHz)

Failures:

Block 0, Base EDID:
  Basic Display Parameters & Features: sRGB is signaled, but the chromaticities do not match.

EDID conformity: FAIL
