edid-decode (hex):

00 ff ff ff ff ff ff 00 25 d8 00 12 00 00 00 00
01 21 01 03 80 22 16 78 2a 21 21 97 59 57 8f 29
22 50 54 00 00 00 d1 00 d1 c0 01 01 01 01 01 01
01 01 01 01 01 01 60 3f 80 a0 70 b0 64 40 30 20
a5 00 58 d7 10 00 00 1a 00 00 00 fc 00 44 69 73
70 6c 61 79 0a 20 20 20 20 20 00 00 00 ff 00 0a
20 20 20 20 20 20 20 20 20 20 20 20 00 00 00 fd
00 30 a5 1e 96 32 00 0a 20 20 20 20 20 20 01 a9

02 03 36 f2 42 90 3f e2 00 d5 e3 05 c0 00 23 09
7f 07 83 01 00 00 67 03 0c 00 10 00 18 64 e6 06
05 01 73 73 00 68 1a 00 00 01 01 30 a5 e6 67 d8
5d c4 01 64 80 01 48 ae 80 a0 70 b0 64 40 30 20
45 00 58 d7 10 00 00 1a 1a 98 80 a0 70 b0 64 40
30 20 45 00 58 d7 10 00 00 1a 9f 69 80 a0 70 b0
64 40 30 20 45 00 58 d7 10 00 00 1a 00 00 00 00
00 00 00 00 00 00 00 00 00 00 00 00 00 00 00 a8

00 ff ff ff ff ff ff 00 25 d8 00 12 00 00 00 00
01 21 01 03 80 22 16 78 2a 21 21 97 59 57 8f 29
22 50 54 00 00 00 d1 00 d1 c0 01 01 01 01 01 01
01 01 01 01 01 01 60 3f 80 a0 70 b0 64 40 30 20
a5 00 58 d7 10 00 00 1a 00 00 00 fc 00 44 69 73
70 6c 61 79 0a 20 20 20 20 20 00 00 00 ff 00 0a
20 20 20 20 20 20 20 20 20 20 20 20 00 00 00 fd
00 30 a5 1e 96 32 00 0a 20 20 20 20 20 20 01 a9

02 03 36 f2 42 90 3f e2 00 d5 e3 05 c0 00 23 09
7f 07 83 01 00 00 67 03 0c 00 10 00 18 64 e6 06
05 01 73 73 00 68 1a 00 00 01 01 30 a5 e6 67 d8
5d c4 01 64 80 01 48 ae 80 a0 70 b0 64 40 30 20
45 00 58 d7 10 00 00 1a 1a 98 80 a0 70 b0 64 40
30 20 45 00 58 d7 10 00 00 1a 9f 69 80 a0 70 b0
64 40 30 20 45 00 58 d7 10 00 00 1a 00 00 00 00
00 00 00 00 00 00 00 00 00 00 00 00 00 00 00 a8

----------------

Block 0, Base EDID:
  EDID Structure Version & Revision: 1.3
  Vendor & Product Identification:
    Manufacturer: INX
    Model: 4608
    Made in: week 1 of 2023
  Basic Display Parameters & Features:
    Digital display
    Maximum image size: 34 cm x 22 cm
    Gamma: 2.20
    DPMS levels: Off
    RGB color display
    First detailed timing is the preferred timing
  Color Characteristics:
    Red  : 0.5898, 0.3496
    Green: 0.3398, 0.5595
    Blue : 0.1601, 0.1347
    White: 0.3125, 0.3291
  Established Timings I & II: none
  Standard Timings:
    DMT 0x45:  1920x1200   59.884600 Hz  16:10    74.556 kHz    193.250000 MHz
    DMT 0x52:  1920x1080   60.000000 Hz  16:9     67.500 kHz    148.500000 MHz
  Detailed Timing Descriptors:
    DTD 1:  1920x1200   60.000000 Hz  16:10    78.000 kHz    162.240000 MHz (344 mm x 215 mm)
                 Hfront   48 Hsync  32 Hback   80 Hpol P
                 Vfront   10 Vsync   5 Vback   85 Vpol N
    Display Product Name: 'Display'
    Display Product Serial Number: ...
    Display Range Limits:
      Monitor ranges (GTF): 48-165 Hz V, 30-150 kHz H, max dotclock 500 MHz
  Extension blocks: 1
Checksum: 0xa9

----------------

Block 1, CTA-861 Extension Block:
  Revision: 3
  Underscans IT Video Formats by default
  Basic audio support
  Supports YCbCr 4:4:4
  Supports YCbCr 4:2:2
  Native DTDs: 2
  Video Data Block:
    VIC  16:  1920x1080   60.000000 Hz  16:9     67.500 kHz    148.500000 MHz (native)
    VIC  63:  1920x1080  120.000000 Hz  16:9    135.000 kHz    297.000000 MHz
  Video Capability Data Block:
    YCbCr quantization: Selectable (via AVI YQ)
    RGB quantization: Selectable (via AVI Q)
    PT scan behavior: Always Overscanned
    IT scan behavior: Always Overscanned
    CE scan behavior: Always Overscanned
  Colorimetry Data Block:
    BT2020YCC
    BT2020RGB
  Audio Data Block:
    Linear PCM:
      Max channels: 2
      Supported sample rates (kHz): 192 176.4 96 88.2 48 44.1 32
      Supported sample sizes (bits): 24 20 16
  Speaker Allocation Data Block:
    FL/FR - Front Left/Right
  Vendor-Specific Data Block (HDMI), OUI 00-0C-03:
    Source physical address: 1.0.0.0
    DC_30bit
    DC_Y444
    Maximum TMDS clock: 500 MHz
  HDR Static Metadata Data Block:
    Electro optical transfer functions:
      Traditional gamma - SDR luminance range
      SMPTE ST2084
    Supported static metadata descriptors:
      Static metadata type 1
    Desired content max luminance: 115 (603.666 cd/m^2)
    Desired content max frame-average luminance: 115 (603.666 cd/m^2)
    Desired content min luminance: 0 (0.000 cd/m^2)
  Vendor-Specific Data Block (AMD), OUI 00-00-1A:
    Version: 1
    Feature Caps: 0x01
    Minimum Refresh Rate: 48 Hz
    Maximum Refresh Rate: 165 Hz
    Flags 1.x: 0xe6 (MCCS)
  Vendor-Specific Data Block (HDMI Forum), OUI C4-5D-D8:
    Version: 1
    Maximum TMDS Character Rate: 500 MHz
    SCDC Present
    Supports 10-bits/component Deep Color 4:2:0 Pixel Encoding
  Detailed Timing Descriptors:
    DTD 2:  1920x1200  165.000000 Hz  16:10   214.500 kHz    446.160000 MHz (344 mm x 215 mm)
                 Hfront   48 Hsync  32 Hback   80 Hpol P
                 Vfront    4 Vsync   5 Vback   91 Vpol N
    DTD 3:  1920x1200  144.001479 Hz  16:10   187.202 kHz    389.380000 MHz (344 mm x 215 mm)
                 Hfront   48 Hsync  32 Hback   80 Hpol P
                 Vfront    4 Vsync   5 Vback   91 Vpol N
    DTD 4:  1920x1200   99.996302 Hz  16:10   129.995 kHz    270.390000 MHz (344 mm x 215 mm)
                 Hfront   48 Hsync  32 Hback   80 Hpol P
                 Vfront    4 Vsync   5 Vback   91 Vpol N
Checksum: 0xa8  Unused space in Extension Block: 19 bytes

----------------

Warnings:

Block 1, CTA-861 Extension Block:
  Video Data Block: VIC 16 and the first DTD are not identical. Is this intended?
  Video Capability Data Block: IT scan behavior is expected to support underscanned.
  Video Capability Data Block: S_PT is equal to S_IT and S_CE, so should be set to 0 instead.
  Colorimetry Data Block: Set the sRGB colorimetry bit to avoid interop issues.
EDID:
  Base EDID: Some timings are out of range of the Monitor Ranges:
    Horizontal Freq: 67.500 - 214.500 kHz (Monitor: 30.000 - 150.000 kHz)

Failures:

Block 0, Base EDID:
  Display Product Serial Number: ...
Block 1, CTA-861 Extension Block:
  Video Capability Data Block: IT video formats are always overscanned, but bit 7 of Byte 3 of the CTA-861 Extension header is set to underscanned.
  Vendor-Specific Data Block (HDMI), OUI 00-0C-03: HDMI VSDB Max TMDS rate is > 340.
  Vendor-Specific Data Block (HDMI Forum), OUI C4-5D-D8: HDMI Forum VSDB did not immediately follow the HDMI VSDB.
  Required 640x480p60 timings are missing in the established timings and the SVD list (VIC 1).
EDID:
  Extension Block 2 started with EDID header, ignoring Extension Blocks >= 2.
  CTA-861: Native progressive timings are a mix of several resolutions.

EDID conformity: FAIL
