edid-decode (hex):

00 ff ff ff ff ff ff 00 09 e5 a0 05 00 00 00 00
01 14 01 04 80 1f 11 78 0a d2 40 95 5a 53 8c 26
1c 50 54 00 00 00 01 01 01 01 01 01 01 01 01 01
01 01 01 01 01 01 e4 1b 56 7a 50 00 20 30 30 20
36 00 35 ad 10 00 00 1a 30 16 56 00 51 00 6c 30
30 20 36 00 35 ad 10 00 00 1a 00 00 00 fe 00 4d
4e 4e 4a 57 80 48 54 31 34 36 30 31 00 00 00 00
00 00 41 01 94 00 00 00 00 01 01 0a 20 20 00 73

----------------

Block 0, Base EDID:
  EDID Structure Version & Revision: 1.4
  Vendor & Product Identification:
    Manufacturer: BOE
    Model: 1440
    Made in: week 1 of 2010
  Basic Display Parameters & Features:
    Digital display
    Color depth is undefined
    Digital interface is not defined
    Maximum image size: 31 cm x 17 cm
    Gamma: 2.20
    Supported color formats: RGB 4:4:4, YCrCb 4:4:4
    First detailed timing includes the native pixel format and preferred refresh rate
  Color Characteristics:
    Red  : 0.5849, 0.3525
    Green: 0.3242, 0.5488
    Blue : 0.1494, 0.1093
    White: 0.3125, 0.3281
  Established Timings I & II: none
  Standard Timings: none
  Detailed Timing Descriptors:
    DTD 1:  1366x768    59.979839 Hz 683:384   47.984 kHz     71.400000 MHz (309 mm x 173 mm)
                 Hfront   48 Hsync  32 Hback   42 Hpol P
                 Vfront    3 Vsync   6 Vback   23 Vpol N
    DTD 2:  1366x768    39.975452 Hz 683:384   35.018 kHz     56.800000 MHz (309 mm x 173 mm)
                 Hfront   48 Hsync  32 Hback  176 Hpol P
                 Vfront    3 Vsync   6 Vback   99 Vpol N
    Alphanumeric Data String: 'MNNJW.HT14601'
    Manufacturer-Specified Display Descriptor (0x00): 00 00 00 00 41 01 94 00 00 00 00 01 01 0a 20 20 '....A.........  '
Checksum: 0x73

----------------

Warnings:

Block 0, Base EDID:
  Alphanumeric Data String: Non-ASCII character 0x80 at position 5, can cause problems.
  Missing Display Product Name.

EDID conformity: PASS
