edid-decode (hex):

00 ff ff ff ff ff ff 00 06 af 9e ad 00 00 00 00
23 1f 01 04 a5 26 16 78 03 26 f5 a9 54 47 a0 24
0f 50 54 00 00 00 01 01 01 01 01 01 01 01 01 01
01 01 01 01 01 01 86 d8 80 a0 70 38 20 4d 30 20
a5 00 7e d7 10 00 00 1a 00 00 00 fd 0e 3c 69 95
95 54 01 0a 20 20 20 20 20 20 00 00 00 fe 00 39
32 48 47 56 80 42 31 37 33 48 41 4e 00 00 00 00
00 02 41 0f 9e 00 01 00 00 0f 01 0a 20 20 01 af

70 13 79 00 00 03 01 14 9e 47 01 84 7f 07 9f 00
2f 00 1f 00 37 04 27 00 09 00 04 00 00 00 00 00
00 00 00 00 00 00 00 00 00 00 00 00 00 00 00 00
00 00 00 00 00 00 00 00 00 00 00 00 00 00 00 00
00 00 00 00 00 00 00 00 00 00 00 00 00 00 00 00
00 00 00 00 00 00 00 00 00 00 00 00 00 00 00 00
00 00 00 00 00 00 00 00 00 00 00 00 00 00 00 00
00 00 00 00 00 00 00 00 00 00 00 00 00 00 10 90

00 ff ff ff ff ff ff 00 06 af 9e ad 00 00 00 00
23 1f 01 04 a5 26 16 78 03 26 f5 a9 54 47 a0 24
0f 50 54 00 00 00 01 01 01 01 01 01 01 01 01 01
01 01 01 01 01 01 86 d8 80 a0 70 38 20 4d 30 20
a5 00 7e d7 10 00 00 1a 00 00 00 fd 0e 3c 69 95
95 54 01 0a 20 20 20 20 20 20 00 00 00 fe 00 39
32 48 47 56 80 42 31 37 33 48 41 4e 00 00 00 00
00 02 41 0f 9e 00 01 00 00 0f 01 0a 20 20 01 af

70 13 79 00 00 03 01 14 9e 47 01 84 7f 07 9f 00
2f 00 1f 00 37 04 27 00 09 00 04 00 00 00 00 00
00 00 00 00 00 00 00 00 00 00 00 00 00 00 00 00
00 00 00 00 00 00 00 00 00 00 00 00 00 00 00 00
00 00 00 00 00 00 00 00 00 00 00 00 00 00 00 00
00 00 00 00 00 00 00 00 00 00 00 00 00 00 00 00
00 00 00 00 00 00 00 00 00 00 00 00 00 00 00 00
00 00 00 00 00 00 00 00 00 00 00 00 00 00 10 90

----------------

Block 0, Base EDID:
  EDID Structure Version & Revision: 1.4
  Vendor & Product Identification:
    Manufacturer: AUO
    Model: 44446
    Made in: week 35 of 2021
  Basic Display Parameters & Features:
    Digital display
    Bits per primary color channel: 8
    DisplayPort interface
    Maximum image size: 38 cm x 22 cm
    Gamma: 2.20
    Supported color formats: RGB 4:4:4
    First detailed timing includes the native pixel format and preferred refresh rate
    Display supports continuous frequencies
  Color Characteristics:
    Red  : 0.6601, 0.3300
    Green: 0.2783, 0.6269
    Blue : 0.1435, 0.0615
    White: 0.3134, 0.3291
  Established Timings I & II: none
  Standard Timings: none
  Detailed Timing Descriptors:
    DTD 1:  1920x1080   60.020357 Hz  16:9    266.490 kHz    554.300000 MHz (382 mm x 215 mm)
                 Hfront   48 Hsync  32 Hback   80 Hpol P
                 Vfront   10 Vsync   5 Vback 3345 Vpol N
    Display Range Limits:
      Monitor ranges (Range Limits Only): 60-360 Hz V, 404-404 kHz H, max dotclock 840 MHz
    Alphanumeric Data String: '92HGV.B173HAN'
    Manufacturer-Specified Display Descriptor (0x00): 00 00 00 02 41 0f 9e 00 01 00 00 0f 01 0a 20 20 '....A.........  '
  Extension blocks: 1
Checksum: 0xaf

----------------

Block 1, DisplayID Extension Block:
  Version: 1.3
  Extension Count: 0
  Display Product Type: Extension Section
  Video Timing Modes Type 1 - Detailed Timings Data Block:
    DTD:  1920x1080  360.023180 Hz  16:9    403.226 kHz    838.710000 MHz (aspect 16:9, no 3D stereo, preferred)
               Hfront   48 Hsync  32 Hback   80 Hpol N
               Vfront   10 Vsync   5 Vback   25 Vpol N
  Checksum: 0x10
Checksum: 0x90

----------------

Block 2, Unknown EDID Extension Block 0x00:
  00 ff ff ff ff ff ff 00 06 af 9e ad 00 00 00 00 '................'
  23 1f 01 04 a5 26 16 78 03 26 f5 a9 54 47 a0 24 '#....&.x.&..TG.$'
  0f 50 54 00 00 00 01 01 01 01 01 01 01 01 01 01 '.PT.............'
  01 01 01 01 01 01 86 d8 80 a0 70 38 20 4d 30 20 '..........p8 M0 '
  a5 00 7e d7 10 00 00 1a 00 00 00 fd 0e 3c 69 95 '..~..........<i.'
  95 54 01 0a 20 20 20 20 20 20 00 00 00 fe 00 39 '.T..      .....9'
  32 48 47 56 80 42 31 37 33 48 41 4e 00 00 00 00 '2HGV.B173HAN....'
  00 02 41 0f 9e 00 01 00 00 0f 01 0a 20 20 01 af '..A.........  ..'
Checksum: 0xaf

----------------

Block 3, DisplayID Extension Block:
  Version: 1.3
  Extension Count: 0
  Video Timing Modes Type 1 - Detailed Timings Data Block:
    DTD:  1920x1080  360.023180 Hz  16:9    403.226 kHz    838.710000 MHz (aspect 16:9, no 3D stereo, preferred)
               Hfront   48 Hsync  32 Hback   80 Hpol N
               Vfront   10 Vsync   5 Vback   25 Vpol N
  Checksum: 0x10
Checksum: 0x90

----------------

Warnings:

Block 0, Base EDID:
  Alphanumeric Data String: Non-ASCII character 0x80 at position 5, can cause problems.
  Missing Display Product Name.
EDID:
  Base EDID: Some timings are out of range of the Monitor Ranges:
    Horizontal Freq: 266.490 - 403.225 kHz (Monitor: 404.000 - 404.000 kHz)

Failures:

Block 1, DisplayID Extension Block:
  DisplayID Base Block has no product type.
  Expected 0 DisplayID Extension Block, but got 1.
Block 2, Base EDID:
  Unknown Extension Block.
EDID:
  Base EDID: EDID specified 1 extension block(s), but found 3 extension block(s).

EDID conformity: FAIL
