edid-decode (hex):

00 ff ff ff ff ff ff 00 30 ae 4c 11 01 01 01 01
1d 11 01 03 68 22 1b 78 2a af c0 a7 53 45 9d 24
14 50 54 ad cf 00 81 80 81 8a 01 01 01 01 01 01
01 01 01 01 01 01 30 2a 00 98 51 00 2a 40 30 70
13 00 52 0e 11 00 00 1e 00 00 00 fd 00 37 4b 1e
53 0e 00 0a 20 20 20 20 20 20 00 00 00 ff 00 56
41 31 32 32 34 34 0a 20 20 20 20 20 00 00 00 fc
00 4c 45 4e 20 4c 31 37 32 0a 20 20 20 20 00 34

00 ff ff ff ff ff ff 00 30 ae 4c 11 01 01 01 01
1d 11 01 03 68 22 1b 78 2a af c0 a7 53 45 9d 24
14 50 54 ad cf 00 81 80 81 8a 01 01 01 01 01 01
01 01 01 01 01 01 30 2a 00 98 51 00 2a 40 30 70
13 00 52 0e 11 00 00 1e 00 00 00 fd 00 37 4b 1e
53 0e 00 0a 20 20 20 20 20 20 00 00 00 ff 00 56
41 31 32 32 34 34 0a 20 20 20 20 20 00 00 00 fc
00 4c 45 4e 20 4c 31 37 32 0a 20 20 20 20 00 34

----------------

Block 0, Base EDID:
  EDID Structure Version & Revision: 1.3
  Vendor & Product Identification:
    Manufacturer: LEN
    Model: 4428
    Serial Number: ...
    Made in: week 29 of 2007
  Basic Display Parameters & Features:
    Analog display
    Signal Level Standard: 0.700 : 0.000 : 0.700 V p-p
    Blank level equals black level
    Sync: Separate
    Maximum image size: 34 cm x 27 cm
    Gamma: 2.20
    DPMS levels: Off
    RGB color display
    First detailed timing is the preferred timing
  Color Characteristics:
    Red  : 0.6542, 0.3261
    Green: 0.2724, 0.6162
    Blue : 0.1435, 0.0781
    White: 0.3125, 0.3281
  Established Timings I & II:
    IBM     :   720x400    70.081663 Hz   9:5     31.467 kHz     28.320000 MHz
    DMT 0x04:   640x480    59.940476 Hz   4:3     31.469 kHz     25.175000 MHz
    DMT 0x05:   640x480    72.808802 Hz   4:3     37.861 kHz     31.500000 MHz
    DMT 0x06:   640x480    75.000000 Hz   4:3     37.500 kHz     31.500000 MHz
    DMT 0x09:   800x600    60.316541 Hz   4:3     37.879 kHz     40.000000 MHz
    DMT 0x0a:   800x600    72.187572 Hz   4:3     48.077 kHz     50.000000 MHz
    DMT 0x0b:   800x600    75.000000 Hz   4:3     46.875 kHz     49.500000 MHz
    DMT 0x10:  1024x768    60.003840 Hz   4:3     48.363 kHz     65.000000 MHz
    DMT 0x11:  1024x768    70.069359 Hz   4:3     56.476 kHz     75.000000 MHz
    DMT 0x12:  1024x768    75.028582 Hz   4:3     60.023 kHz     78.750000 MHz
    DMT 0x24:  1280x1024   75.024675 Hz   5:4     79.976 kHz    135.000000 MHz
  Standard Timings:
    DMT 0x23:  1280x1024   60.019740 Hz   5:4     63.981 kHz    108.000000 MHz
    GTF     :  1280x1024   69.999805 Hz   5:4     74.620 kHz    128.943000 MHz
  Detailed Timing Descriptors:
    DTD 1:  1280x1024   60.019740 Hz   5:4     63.981 kHz    108.000000 MHz (338 mm x 270 mm)
                 Hfront   48 Hsync 112 Hback  248 Hpol P
                 Vfront    1 Vsync   3 Vback   38 Vpol P
    Display Range Limits:
      Monitor ranges (GTF): 55-75 Hz V, 30-83 kHz H, max dotclock 140 MHz
    Display Product Serial Number: ...
    Display Product Name: 'LEN L172'
Checksum: 0x34

----------------

Warnings:

Block 0, Base EDID:
  Vendor & Product Identification: The serial number is one of the known dummy values, it should probably be set to 0.

Failures:

EDID:
  Extension Block 1 started with EDID header, ignoring Extension Blocks >= 1.

EDID conformity: FAIL
