edid-decode (hex):

00 ff ff ff ff ff ff 00 0e 14 0a 14 00 00 00 00
27 11 01 03 80 21 15 78 0a 09 2d 9d 56 4f 90 27
21 50 54 00 00 00 01 01 01 01 01 01 01 01 01 01
01 01 01 01 01 01 ea 1a 00 80 50 20 10 30 15 20
13 00 4b cf 10 00 00 19 00 00 00 0f 00 00 00 00
00 00 00 00 00 20 6e 05 0f 00 00 00 00 fe 00 46
44 31 36 33 30 31 35 34 57 42 34 20 00 00 00 fe
00 35 49 58 62 87 b1 d1 ff 01 01 20 20 20 00 65

00 ff ff ff ff ff ff 00 0e 14 0a 14 00 00 00 00
27 11 01 03 80 21 15 78 0a 09 2d 9d 56 4f 90 27
21 50 54 00 00 00 01 01 01 01 01 01 01 01 01 01
01 01 01 01 01 01 ea 1a 00 80 50 20 10 30 15 20
13 00 4b cf 10 00 00 19 00 00 00 0f 00 00 00 00
00 00 00 00 00 20 6e 05 0f 00 00 00 00 fe 00 46
44 31 36 33 30 31 35 34 57 42 34 20 00 00 00 fe
00 35 49 58 62 87 b1 d1 ff 01 01 20 20 20 00 65

----------------

Block 0, Base EDID:
  EDID Structure Version & Revision: 1.3
  Vendor & Product Identification:
    Manufacturer: CPT
    Model: 5130
    Made in: week 39 of 2007
  Basic Display Parameters & Features:
    Digital display
    Maximum image size: 33 cm x 21 cm
    Gamma: 2.20
    RGB color display
    First detailed timing is the preferred timing
  Color Characteristics:
    Red  : 0.6132, 0.3359
    Green: 0.3105, 0.5634
    Blue : 0.1523, 0.1308
    White: 0.3154, 0.3291
  Established Timings I & II: none
  Standard Timings: none
  Detailed Timing Descriptors:
    DTD 1:  1280x800    59.968945 Hz  16:10    48.935 kHz     68.900000 MHz (331 mm x 207 mm)
                 Hfront   21 Hsync  32 Hback   75 Hpol N
                 Vfront    1 Vsync   3 Vback   12 Vpol N
    Manufacturer-Specified Display Descriptor (0x0f): 00 0f 00 00 00 00 00 00 00 00 00 20 6e 05 0f 00 '........... n...'
    Alphanumeric Data String: 'FD1630154WB4 '
    Alphanumeric Data String: '5IXb...'
Checksum: 0x65

----------------

Warnings:

Block 0, Base EDID:
  Alphanumeric Data String: Non-ASCII character 0x87 at position 4, can cause problems.
  Alphanumeric Data String: Non-ASCII character 0xb1 at position 5, can cause problems.
  Alphanumeric Data String: Non-ASCII character 0xd1 at position 6, can cause problems.

Failures:

Block 0, Base EDID:
  Alphanumeric Data String: No newline, but one or more trailing spaces.
  Alphanumeric Data String: 0xff byte at position 7.
  Missing Display Product Name.
  Missing Display Range Limits Descriptor.
EDID:
  Extension Block 1 started with EDID header, ignoring Extension Blocks >= 1.

EDID conformity: FAIL
