edid-decode (hex):

00 ff ff ff ff ff ff 00 15 a1 b1 06 ce 07 00 00
32 11 01 04 08 25 17 78 2a cb d5 a6 55 51 91 25
17 50 54 bf ef 00 31 ca 81 80 95 0f 01 01 01 01
01 01 01 01 01 01 9a 29 a0 d0 51 84 22 30 50 98
36 00 6f e6 10 00 00 1c 00 00 00 fd 00 38 4c 1e
51 0e 00 0a 20 20 20 20 20 20 00 00 00 fc 00 45
31 37 54 36 57 0a 20 20 20 20 20 20 00 00 00 ff
00 4d 31 44 37 43 37 30 48 30 31 39 39 38 00 d7

00 ff ff ff ff ff ff 00 15 a1 b1 06 ce 07 00 00
32 11 01 04 08 25 17 78 2a cb d5 a6 55 51 91 25
17 50 54 bf ef 00 31 ca 81 80 95 0f 01 01 01 01
01 01 01 01 01 01 9a 29 a0 d0 51 84 22 30 50 98
36 00 6f e6 10 00 00 1c 00 00 00 fd 00 38 4c 1e
51 0e 00 0a 20 20 20 20 20 20 00 00 00 fc 00 45
31 37 54 36 57 0a 20 20 20 20 20 20 00 00 00 ff
00 4d 31 44 37 43 37 30 48 30 31 39 39 38 00 d7

----------------

Block 0, Base EDID:
  EDID Structure Version & Revision: 1.4
  Vendor & Product Identification:
    Manufacturer: EMA
    Model: 1713
    Serial Number: ...
    Made in: week 50 of 2007
  Basic Display Parameters & Features:
    Analog display
    Signal Level Standard: 0.700 : 0.300 : 1.000 V p-p
    Blank level equals black level
    Sync: Separate
    Maximum image size: 37 cm x 23 cm
    Gamma: 2.20
    DPMS levels: Off
    RGB color display
    First detailed timing includes the native pixel format and preferred refresh rate
  Color Characteristics:
    Red  : 0.6513, 0.3320
    Green: 0.3183, 0.5693
    Blue : 0.1474, 0.0908
    White: 0.3134, 0.3291
  Established Timings I & II:
    IBM     :   720x400    70.081663 Hz   9:5     31.467 kHz     28.320000 MHz
    DMT 0x04:   640x480    59.940476 Hz   4:3     31.469 kHz     25.175000 MHz
    Apple   :   640x480    66.666667 Hz   4:3     35.000 kHz     30.240000 MHz
    DMT 0x05:   640x480    72.808802 Hz   4:3     37.861 kHz     31.500000 MHz
    DMT 0x06:   640x480    75.000000 Hz   4:3     37.500 kHz     31.500000 MHz
    DMT 0x08:   800x600    56.250000 Hz   4:3     35.156 kHz     36.000000 MHz
    DMT 0x09:   800x600    60.316541 Hz   4:3     37.879 kHz     40.000000 MHz
    DMT 0x0a:   800x600    72.187572 Hz   4:3     48.077 kHz     50.000000 MHz
    DMT 0x0b:   800x600    75.000000 Hz   4:3     46.875 kHz     49.500000 MHz
    Apple   :   832x624    74.551266 Hz   4:3     49.726 kHz     57.284000 MHz
    DMT 0x10:  1024x768    60.003840 Hz   4:3     48.363 kHz     65.000000 MHz
    DMT 0x11:  1024x768    70.069359 Hz   4:3     56.476 kHz     75.000000 MHz
    DMT 0x12:  1024x768    75.028582 Hz   4:3     60.023 kHz     78.750000 MHz
    DMT 0x24:  1280x1024   75.024675 Hz   5:4     79.976 kHz    135.000000 MHz
  Standard Timings:
    GTF     :   640x360    70.000000 Hz  16:9     26.250 kHz     20.580000 MHz
    DMT 0x23:  1280x1024   60.019740 Hz   5:4     63.981 kHz    108.000000 MHz
    DMT 0x30:  1440x900    74.984427 Hz  16:10    70.635 kHz    136.750000 MHz
  Detailed Timing Descriptors:
    DTD 1:  1440x900    59.887445 Hz  16:10    55.935 kHz    106.500000 MHz (367 mm x 230 mm)
                 Hfront   80 Hsync 152 Hback  232 Hpol N
                 Vfront    3 Vsync   6 Vback   25 Vpol P
    Display Range Limits:
      Monitor ranges (GTF): 56-76 Hz V, 30-81 kHz H, max dotclock 140 MHz
    Display Product Name: 'E17T6W'
    Display Product Serial Number: ...
Checksum: 0xd7

----------------

Warnings:

Block 0, Base EDID:
  Display Range Limits: GTF support is deprecated in EDID 1.4.
EDID:
  Base EDID: Some timings are out of range of the Monitor Ranges:
    Horizontal Freq: 26.250 - 79.976 kHz (Monitor: 30.000 - 81.000 kHz)

Failures:

Block 0, Base EDID:
  Display Range Limits: GTF is supported, but the display does not support continuous frequencies.
EDID:
  Extension Block 1 started with EDID header, ignoring Extension Blocks >= 1.

EDID conformity: FAIL
