edid-decode (hex):

00 ff ff ff ff ff ff 00 26 cf 8f 04 00 00 00 00
1c 19 01 04 95 1a 0e 78 0a 16 30 91 56 53 92 28
1e 50 54 00 00 00 01 01 01 01 01 01 01 01 01 01
01 01 01 01 01 01 d5 1c 56 a6 50 00 23 30 28 20
3c 00 00 90 10 00 00 19 00 00 00 00 00 00 00 00
00 00 00 00 00 00 00 00 00 00 00 00 00 fe 00 49
6e 66 6f 56 69 73 69 6f 6e 0a 20 20 00 00 00 fe
00 4d 31 31 36 4e 57 52 37 20 52 31 20 0a 00 02

----------------

Block 0, Base EDID:
  EDID Structure Version & Revision: 1.4
  Vendor & Product Identification:
    Manufacturer: IVO
    Model: 1167
    Made in: week 28 of 2015
  Basic Display Parameters & Features:
    Digital display
    Bits per primary color channel: 6
    DisplayPort interface
    Maximum image size: 26 cm x 14 cm
    Gamma: 2.20
    Supported color formats: RGB 4:4:4, YCrCb 4:4:4
    First detailed timing includes the native pixel format and preferred refresh rate
  Color Characteristics:
    Red  : 0.5664, 0.3369
    Green: 0.3251, 0.5722
    Blue : 0.1562, 0.1201
    White: 0.3125, 0.3281
  Established Timings I & II: none
  Standard Timings: none
  Detailed Timing Descriptors:
    DTD 1:  1366x768    59.998569 Hz 683:384   48.179 kHz     73.810000 MHz (256 mm x 144 mm)
                 Hfront   40 Hsync  32 Hback   94 Hpol N
                 Vfront    3 Vsync  12 Vback   20 Vpol N
    Empty Descriptor
    Alphanumeric Data String: 'InfoVision'
    Alphanumeric Data String: 'M116NWR7 R1 '
Checksum: 0x02

----------------

Warnings:

Block 0, Base EDID:
  Missing Display Product Name.

Failures:

Block 0, Base EDID:
  Empty Descriptor: Use Dummy Descriptor instead of all zeroes.
  Alphanumeric Data String: One or more trailing spaces before newline.

EDID conformity: FAIL
