edid-decode (hex):

00 ff ff ff ff ff ff 00 06 af 9f 34 00 00 00 00
2b 1f 01 04 a5 26 15 78 03 0f 15 ae 52 43 b0 25
0f 50 54 00 00 00 01 01 01 01 01 01 01 01 01 01
01 01 01 01 01 01 66 d0 00 a0 f0 70 3e 80 30 20
35 00 7d d6 10 00 00 18 ef 8a 00 a0 f0 70 3e 80
30 20 35 00 7d d6 10 00 00 18 00 00 00 00 00 00
00 00 00 00 00 00 00 00 00 00 00 00 00 00 00 02
00 0c 2d ff 10 3c c8 d7 1b 58 c8 20 20 20 01 e9

70 20 79 02 00 22 00 14 fb 23 08 84 ff 0e 9f 00
2f 80 1f 00 6f 08 3d 00 02 00 04 00 25 00 09 fb
23 08 fb 23 08 28 3c 80 81 00 10 72 1a 00 00 03
01 28 3c 00 00 60 50 60 50 3c 00 00 00 00 00 00
00 00 00 00 00 00 00 00 00 00 00 00 00 00 00 00
00 00 00 00 00 00 00 00 00 00 00 00 00 00 00 00
00 00 00 00 00 00 00 00 00 00 00 00 00 00 00 00
00 00 00 00 00 00 00 00 00 00 00 00 00 00 d2 90

----------------

Block 0, Base EDID:
  EDID Structure Version & Revision: 1.4
  Vendor & Product Identification:
    Manufacturer: AUO
    Model: 13471
    Made in: week 43 of 2021
  Basic Display Parameters & Features:
    Digital display
    Bits per primary color channel: 8
    DisplayPort interface
    Maximum image size: 38 cm x 21 cm
    Gamma: 2.20
    Supported color formats: RGB 4:4:4
    First detailed timing includes the native pixel format and preferred refresh rate
    Display supports continuous frequencies
  Color Characteristics:
    Red  : 0.6796, 0.3203
    Green: 0.2646, 0.6904
    Blue : 0.1445, 0.0595
    White: 0.3134, 0.3291
  Established Timings I & II: none
  Standard Timings: none
  Detailed Timing Descriptors:
    DTD 1:  3840x2160   60.024752 Hz  16:9    133.375 kHz    533.500000 MHz (381 mm x 214 mm)
                 Hfront   48 Hsync  32 Hback   80 Hpol N
                 Vfront    3 Vsync   5 Vback   54 Vpol N
    DTD 2:  3840x2160   40.016877 Hz  16:9     88.918 kHz    355.670000 MHz (381 mm x 214 mm)
                 Hfront   48 Hsync  32 Hback   80 Hpol N
                 Vfront    3 Vsync   5 Vback   54 Vpol N
    Empty Descriptor
    Manufacturer-Specified Display Descriptor (0x02): 00 02 00 0c 2d ff 10 3c c8 d7 1b 58 c8 20 20 20 '....-..<...X.   '
  Extension blocks: 1
Checksum: 0xe9

----------------

Block 1, DisplayID Extension Block:
  Version: 2.0
  Extension Count: 0
  Display Product Primary Use Case: None of the listed primary use cases; generic display
  Video Timing Modes Type 7 - Detailed Timings Data Block:
    DTD:  3840x2160   60.024752 Hz  16:9    133.375 kHz    533.500000 MHz (aspect 16:9, no 3D stereo, preferred)
               Hfront   48 Hsync  32 Hback   80 Hpol P
               Vfront    3 Vsync   5 Vback   54 Vpol N
  Dynamic Video Timing Range Limits Data Block:
    Minimum Pixel Clock: 533500 kHz
    Maximum Pixel Clock: 533500 kHz
    Minimum Vertical Refresh Rate: 40 Hz
    Maximum Vertical Refresh Rate: 60 Hz
    Seamless Dynamic Video Timing Support: Yes
  CTA-861 DisplayID Data Block:
  Vendor-Specific Data Block (AMD), OUI 00-00-1A:
    Version: 3
    Feature Caps: 0x01
    Minimum Refresh Rate: 40 Hz
    Maximum Refresh Rate: 60 Hz
    Flags 1.x: 0x00
    Flags 2.x: 0x00
    Maximum luminance: 96 (400.000 cd/m^2)
    Minimum luminance: 80 (0.394 cd/m^2)
    Unknown: 0x60 0x50
  Checksum: 0xd2
Checksum: 0x90

----------------

Warnings:

Block 0, Base EDID:
  Missing Display Product Name.

Failures:

Block 0, Base EDID:
  Empty Descriptor: Use Dummy Descriptor instead of all zeroes.
  Missing Display Range Limits Descriptor.
Block 1, DisplayID Extension Block:
  Vendor-Specific Data Block (AMD), OUI 00-00-1A: Length is 16 instead of 19.
EDID:
  DisplayID: Missing DisplayID Display Parameters Data Block.

EDID conformity: FAIL
