edid-decode (hex):

00 ff ff ff ff ff ff 00 06 af ae 8f a1 ff 00 00
0e 22 01 04 a5 22 16 78 03 ee 95 a3 54 4c 99 26
0f 50 54 00 00 00 01 01 01 01 01 01 01 01 01 01
01 01 01 01 01 01 bf de 00 a0 a0 40 66 67 30 20
f6 0c 58 d7 10 00 00 18 00 00 00 0f 00 00 00 00
00 00 00 00 00 00 00 00 00 20 00 00 00 00 00 00
00 00 00 00 00 00 00 00 00 00 00 00 00 00 00 03
00 0d 24 ff 15 3c fa 35 10 42 fa 00 00 20 01 bd

70 20 79 02 00 21 01 1d 77 0d 6a 08 00 0a 40 06
88 3d 7a 54 cc 94 99 66 52 0f 02 35 54 d0 5f d0
5f 14 36 12 78 22 00 14 ff ed 11 85 ff 09 9f 00
2f 80 1f 00 3f 06 c7 00 3e 00 05 00 25 01 09 ff
ed 11 ff ed 11 3c f0 80 2b 00 0c 27 00 3c ef 00
00 27 00 30 3b 00 00 2e 00 06 40 4e d0 5f d0 5f
81 00 15 74 1a 00 00 03 01 3c f0 00 00 6b 50 6b
50 f0 00 00 00 00 00 00 00 00 00 00 00 00 8a 90

00 ff ff ff ff ff ff 00 06 af ae 8f a1 ff 00 00
0e 22 01 04 a5 22 16 78 03 ee 95 a3 54 4c 99 26
0f 50 54 00 00 00 01 01 01 01 01 01 01 01 01 01
01 01 01 01 01 01 bf de 00 a0 a0 40 66 67 30 20
f6 0c 58 d7 10 00 00 18 00 00 00 0f 00 00 00 00
00 00 00 00 00 00 00 00 00 20 00 00 00 00 00 00
00 00 00 00 00 00 00 00 00 00 00 00 00 00 00 03
00 0d 24 ff 15 3c fa 35 10 42 fa 00 00 20 01 bd

70 20 79 02 00 21 01 1d 77 0d 6a 08 00 0a 40 06
88 3d 7a 54 cc 94 99 66 52 0f 02 35 54 d0 5f d0
5f 14 36 12 78 22 00 14 ff ed 11 85 ff 09 9f 00
2f 80 1f 00 3f 06 c7 00 3e 00 05 00 25 01 09 ff
ed 11 ff ed 11 3c f0 80 2b 00 0c 27 00 3c ef 00
00 27 00 30 3b 00 00 2e 00 06 40 4e d0 5f d0 5f
81 00 15 74 1a 00 00 03 01 3c f0 00 00 6b 50 6b
50 f0 00 00 00 00 00 00 00 00 00 00 00 00 8a 90

----------------

Block 0, Base EDID:
  EDID Structure Version & Revision: 1.4
  Vendor & Product Identification:
    Manufacturer: AUO
    Model: 36782
    Serial Number: ...
    Made in: week 14 of 2024
  Basic Display Parameters & Features:
    Digital display
    Bits per primary color channel: 8
    DisplayPort interface
    Maximum image size: 34 cm x 22 cm
    Gamma: 2.20
    Supported color formats: RGB 4:4:4
    First detailed timing includes the native pixel format and preferred refresh rate
    Display supports continuous frequencies
  Color Characteristics:
    Red  : 0.6396, 0.3300
    Green: 0.2998, 0.5996
    Blue : 0.1503, 0.0595
    White: 0.3134, 0.3291
  Established Timings I & II: none
  Standard Timings: none
  Detailed Timing Descriptors:
    DTD 1:  2560x1600   60.000968 Hz  16:10   209.643 kHz    570.230000 MHz (344 mm x 215 mm)
                 Hfront   48 Hsync  32 Hback   80 Hpol N
                 Vfront   63 Vsync   6 Vback 1825 Vpol N
    Manufacturer-Specified Display Descriptor (0x0f): 00 0f 00 00 00 00 00 00 00 00 00 00 00 00 00 20 '............... '
    Empty Descriptor
    Manufacturer-Specified Display Descriptor (0x03): 00 03 00 0d 24 ff 15 3c fa 35 10 42 fa 00 00 20 '....$..<.5.B... '
  Extension blocks: 1
Checksum: 0xbd

----------------

Block 1, DisplayID Extension Block:
  Version: 2.0
  Extension Count: 0
  Display Product Primary Use Case: None of the listed primary use cases; generic display
  Display Parameters Data Block (0x21):
    Image size: 344.7 mm x 215.4 mm
    Display native pixel format: 2560x1600
    Scan Orientation: Left to Right, Top to Bottom
    Luminance Information: Guidance for the Source device
    Color Information: CIE 1931
    Audio Speaker Information: not integrated
    Native Color Chromaticity:
      Primary #1:  (0.639893, 0.329834)
      Primary #2:  (0.299805, 0.599854)
      Primary #3:  (0.149902, 0.059814)
      White Point: (0.312988, 0.328857)
    Native Maximum Luminance (Full Coverage): 500.000000 cd/m^2
    Native Maximum Luminance (10% Rectangular Coverage): 500.000000 cd/m^2
    Native Minimum Luminance: 0.379883 cd/m^2
    Native Color Depth: 8 bpc
    Display Device Technology: Active Matrix LCD
    Display Device Theme Preference: No Preference
    Native Gamma EOTF: 2.20
  Video Timing Modes Type 7 - Detailed Timings Data Block:
    DTD:  2560x1600  240.000000 Hz  16:10   432.000 kHz   1175.040000 MHz (aspect 16:10, no 3D stereo, preferred)
               Hfront   48 Hsync  32 Hback   80 Hpol P
               Vfront   63 Vsync   6 Vback  131 Vpol N
  Dynamic Video Timing Range Limits Data Block:
    Minimum Pixel Clock: 1175040 kHz
    Maximum Pixel Clock: 1175040 kHz
    Minimum Vertical Refresh Rate: 60 Hz
    Maximum Vertical Refresh Rate: 240 Hz
    Seamless Dynamic Video Timing Support: Yes
  Adaptive Sync Data Block:
    Descriptor #1:
      Native Panel Range
      Fixed Average V-Total and Adaptive V-Total
      Supports Seamless Transition
      'Max Single Frame Duration Increase' field value without jitter impact
      'Max Single Frame Duration Decrease' field value without jitter impact
      Max Duration Increase: 0.00 ms
      Max Duration Decrease: 0.00 ms
      Min Refresh Rate: 60 Hz
      Max Refresh Rate: 240 Hz
    Descriptor #2:
      Native Panel Range
      Fixed Average V-Total and Adaptive V-Total
      Supports Seamless Transition
      'Max Single Frame Duration Increase' field value without jitter impact
      'Max Single Frame Duration Decrease' field value without jitter impact
      Max Duration Increase: 0.00 ms
      Max Duration Decrease: 0.00 ms
      Min Refresh Rate: 48 Hz
      Max Refresh Rate: 60 Hz
  Brightness Luminance Range Data Block:
    Minimum SDR Luminance (Full Coverage): 25.000000 cd/m^2
    Maximum Suggested SDR Luminance (Full Coverage): 500.000000 cd/m^2
    Maximum Boost SDR Luminance: 500.000000 cd/m^2
  CTA-861 DisplayID Data Block:
  Vendor-Specific Data Block (AMD), OUI 00-00-1A:
    Version: 3
    Flags 1: 0x01
      FreeSync Supported
    Minimum Refresh Rate: 60 Hz
    Maximum Refresh Rate: 240 Hz
    Flags 5: 0x00
  Checksum: 0x8a
Checksum: 0x90

----------------

Warnings:

Block 0, Base EDID:
  Missing Display Product Name.

Failures:

Block 0, Base EDID:
  Empty Descriptor: Use Dummy Descriptor instead of all zeroes.
  Missing Display Range Limits Descriptor.
EDID:
  Extension Block 2 started with EDID header, ignoring Extension Blocks >= 2.

EDID conformity: FAIL
