edid-decode (hex):

00 ff ff ff ff ff ff 00 4c 2d 53 70 53 38 58 43
34 1e 01 04 b5 77 22 78 3b c7 25 b1 4b 46 a8 26
0e 50 54 bf ef 80 71 4f 81 00 81 c0 81 80 a9 c0
b3 00 95 00 d1 c0 74 d6 00 a0 f0 38 40 40 30 20
3a 00 a9 50 41 00 00 1a 00 00 00 fd 0c 3c f0 66
66 c2 01 0a 20 20 20 20 20 20 00 00 00 fc 00 4c
43 34 39 47 39 35 54 0a 20 20 20 20 00 00 00 ff
00 48 34 5a 4e 43 30 36 35 30 38 0a 20 20 02 6d

02 03 2d f0 44 10 5a 3f 5c 23 09 07 07 83 01 00
00 e3 05 c0 00 6d 1a 00 00 02 0f 3c f0 00 04 8b
12 73 17 e3 06 05 01 e5 01 8b 84 90 01 56 5e 00
a0 a0 a0 29 50 30 20 35 00 a9 50 41 00 00 1a 58
4d 00 b8 a1 38 14 40 f8 2c 45 00 a9 50 41 00 00
1e 1a 68 00 a0 f0 38 1f 40 30 20 3a 00 a9 50 41
00 00 1a 6f c2 00 a0 a0 a0 55 50 30 20 35 00 a9
50 41 00 00 1a 00 00 00 00 00 00 00 00 00 00 84

70 12 79 00 00 03 01 64 9c f5 02 88 ff 13 3f 01
7f 80 1f 00 9f 05 2e 00 20 00 07 00 2f 79 01 08
ff 13 9f 00 2f 80 1f 00 9f 05 53 00 02 00 09 00
33 b7 00 08 ff 13 9f 00 2f 80 1f 00 9f 05 28 00
02 00 09 00 e3 6e 01 08 ff 09 4f 00 07 80 1f 00
9f 05 2a 00 20 00 07 00 90 c7 01 08 ff 0e 9f 00
2f 80 1f 00 37 04 86 00 02 00 09 00 00 00 00 00
00 00 00 00 00 00 00 00 00 00 00 00 00 00 1d 90

00 ff ff ff ff ff ff 00 4c 2d 53 70 53 38 58 43
34 1e 01 04 b5 77 22 78 3b c7 25 b1 4b 46 a8 26
0e 50 54 bf ef 80 71 4f 81 00 81 c0 81 80 a9 c0
b3 00 95 00 d1 c0 74 d6 00 a0 f0 38 40 40 30 20
3a 00 a9 50 41 00 00 1a 00 00 00 fd 0c 3c f0 66
66 c2 01 0a 20 20 20 20 20 20 00 00 00 fc 00 4c
43 34 39 47 39 35 54 0a 20 20 20 20 00 00 00 ff
00 48 34 5a 4e 43 30 36 35 30 38 0a 20 20 02 6d

02 03 2d f0 44 10 5a 3f 5c 23 09 07 07 83 01 00
00 e3 05 c0 00 6d 1a 00 00 02 0f 3c f0 00 04 8b
12 73 17 e3 06 05 01 e5 01 8b 84 90 01 56 5e 00
a0 a0 a0 29 50 30 20 35 00 a9 50 41 00 00 1a 58
4d 00 b8 a1 38 14 40 f8 2c 45 00 a9 50 41 00 00
1e 1a 68 00 a0 f0 38 1f 40 30 20 3a 00 a9 50 41
00 00 1a 6f c2 00 a0 a0 a0 55 50 30 20 35 00 a9
50 41 00 00 1a 00 00 00 00 00 00 00 00 00 00 84

70 12 79 00 00 03 01 64 9c f5 02 88 ff 13 3f 01
7f 80 1f 00 9f 05 2e 00 20 00 07 00 2f 79 01 08
ff 13 9f 00 2f 80 1f 00 9f 05 53 00 02 00 09 00
33 b7 00 08 ff 13 9f 00 2f 80 1f 00 9f 05 28 00
02 00 09 00 e3 6e 01 08 ff 09 4f 00 07 80 1f 00
9f 05 2a 00 20 00 07 00 90 c7 01 08 ff 0e 9f 00
2f 80 1f 00 37 04 86 00 02 00 09 00 00 00 00 00
00 00 00 00 00 00 00 00 00 00 00 00 00 00 1d 90

----------------

Block 0, Base EDID:
  EDID Structure Version & Revision: 1.4
  Vendor & Product Identification:
    Manufacturer: SAM
    Model: 28755
    Serial Number: ...
    Made in: week 52 of 2020
  Basic Display Parameters & Features:
    Digital display
    Bits per primary color channel: 10
    DisplayPort interface
    Maximum image size: 119 cm x 34 cm
    Gamma: 2.20
    DPMS levels: Off
    Supported color formats: RGB 4:4:4, YCrCb 4:4:4, YCrCb 4:2:2
    First detailed timing includes the native pixel format and preferred refresh rate
    Display supports continuous frequencies
  Color Characteristics:
    Red  : 0.6943, 0.2929
    Green: 0.2744, 0.6591
    Blue : 0.1484, 0.0566
    White: 0.3134, 0.3291
  Established Timings I & II:
    IBM     :   720x400    70.081663 Hz   9:5     31.467 kHz     28.320000 MHz
    DMT 0x04:   640x480    59.940476 Hz   4:3     31.469 kHz     25.175000 MHz
    Apple   :   640x480    66.666667 Hz   4:3     35.000 kHz     30.240000 MHz
    DMT 0x05:   640x480    72.808802 Hz   4:3     37.861 kHz     31.500000 MHz
    DMT 0x06:   640x480    75.000000 Hz   4:3     37.500 kHz     31.500000 MHz
    DMT 0x08:   800x600    56.250000 Hz   4:3     35.156 kHz     36.000000 MHz
    DMT 0x09:   800x600    60.316541 Hz   4:3     37.879 kHz     40.000000 MHz
    DMT 0x0a:   800x600    72.187572 Hz   4:3     48.077 kHz     50.000000 MHz
    DMT 0x0b:   800x600    75.000000 Hz   4:3     46.875 kHz     49.500000 MHz
    Apple   :   832x624    74.551266 Hz   4:3     49.726 kHz     57.284000 MHz
    DMT 0x10:  1024x768    60.003840 Hz   4:3     48.363 kHz     65.000000 MHz
    DMT 0x11:  1024x768    70.069359 Hz   4:3     56.476 kHz     75.000000 MHz
    DMT 0x12:  1024x768    75.028582 Hz   4:3     60.023 kHz     78.750000 MHz
    DMT 0x24:  1280x1024   75.024675 Hz   5:4     79.976 kHz    135.000000 MHz
    Apple   :  1152x870    75.061550 Hz 192:145   68.681 kHz    100.000000 MHz
  Standard Timings:
    DMT 0x15:  1152x864    75.000000 Hz   4:3     67.500 kHz    108.000000 MHz
    DMT 0x1c:  1280x800    59.810326 Hz  16:10    49.702 kHz     83.500000 MHz
    DMT 0x55:  1280x720    60.000000 Hz  16:9     45.000 kHz     74.250000 MHz
    DMT 0x23:  1280x1024   60.019740 Hz   5:4     63.981 kHz    108.000000 MHz
    DMT 0x53:  1600x900    60.000000 Hz  16:9     60.000 kHz    108.000000 MHz (RB)
    DMT 0x3a:  1680x1050   59.954250 Hz  16:10    65.290 kHz    146.250000 MHz
    DMT 0x2f:  1440x900    59.887445 Hz  16:10    55.935 kHz    106.500000 MHz
    DMT 0x52:  1920x1080   60.000000 Hz  16:9     67.500 kHz    148.500000 MHz
  Detailed Timing Descriptors:
    DTD 1:  3840x1080  119.973776 Hz  32:9    137.250 kHz    549.000000 MHz (1193 mm x 336 mm)
                 Hfront   48 Hsync  32 Hback   80 Hpol P
                 Vfront    3 Vsync  10 Vback   51 Vpol N
    Display Range Limits:
      Monitor ranges (Range Limits Only): 60-240 Hz V, 357-357 kHz H, max dotclock 1940 MHz
    Display Product Name: 'LC49G95T'
    Display Product Serial Number: ...
  Extension blocks: 2
Checksum: 0x6d

----------------

Block 1, CTA-861 Extension Block:
  Revision: 3
  Underscans IT Video Formats by default
  Basic audio support
  Supports YCbCr 4:4:4
  Supports YCbCr 4:2:2
  Native detailed modes: 0
  Video Data Block:
    VIC  16:  1920x1080   60.000000 Hz  16:9     67.500 kHz    148.500000 MHz
    VIC  90:  2560x1080   60.000000 Hz  64:27    66.000 kHz    198.000000 MHz
    VIC  63:  1920x1080  120.000000 Hz  16:9    135.000 kHz    297.000000 MHz
    VIC  92:  2560x1080  120.000000 Hz  64:27   150.000 kHz    495.000000 MHz
  Audio Data Block:
    Linear PCM:
      Max channels: 2
      Supported sample rates (kHz): 48 44.1 32
      Supported sample sizes (bits): 24 20 16
  Speaker Allocation Data Block:
    FL/FR - Front Left/Right
  Colorimetry Data Block:
    BT2020YCC
    BT2020RGB
  Vendor-Specific Data Block (AMD), OUI 00-00-1A:
    Version: 2
    Feature Caps: 0x0f
    Minimum Refresh Rate: 60 Hz
    Maximum Refresh Rate: 240 Hz
    Flags 1.x: 0x00
    Flags 2.x: 0x04
    Maximum luminance: 139 (1015.241 cd/m^2)
    Minimum luminance: 18 (0.051 cd/m^2)
    Maximum luminance (without local dimming): 115 (603.666 cd/m^2)
    Minimum luminance (without local dimming): 23 (0.049 cd/m^2)
  HDR Static Metadata Data Block:
    Electro optical transfer functions:
      Traditional gamma - SDR luminance range
      SMPTE ST2084
    Supported static metadata descriptors:
      Static metadata type 1
  Vendor-Specific Video Data Block (HDR10+), OUI 90-84-8B:
    Application Version: 1
    Full Frame Peak Luminance Index: 0
    Peak Luminance Index: 0
  Detailed Timing Descriptors:
    DTD 2:  2560x1440   59.950550 Hz  16:9     88.787 kHz    241.500000 MHz (1193 mm x 336 mm)
                 Hfront   48 Hsync  32 Hback   80 Hpol P
                 Vfront    3 Vsync   5 Vback   33 Vpol N
    DTD 3:  2560x1080   60.000000 Hz  64:27    66.000 kHz    198.000000 MHz (1193 mm x 336 mm)
                 Hfront  248 Hsync  44 Hback  148 Hpol P
                 Vfront    4 Vsync   5 Vback   11 Vpol P
    DTD 4:  3840x1080   59.968497 Hz  32:9     66.625 kHz    266.500000 MHz (1193 mm x 336 mm)
                 Hfront   48 Hsync  32 Hback   80 Hpol P
                 Vfront    3 Vsync  10 Vback   18 Vpol N
    DTD 5:  2560x1440  119.997589 Hz  16:9    182.996 kHz    497.750000 MHz (1193 mm x 336 mm)
                 Hfront   48 Hsync  32 Hback   80 Hpol P
                 Vfront    3 Vsync   5 Vback   77 Vpol N
Checksum: 0x84  Unused space in Extension Block: 10 bytes

----------------

Block 2, DisplayID Extension Block:
  Version: 1.2
  Extension Count: 0
  Display Product Type: Extension Section
  Video Timing Modes Type 1 - Detailed Timings Data Block:
    DTD:  5120x1440  239.760523 Hz   0:0    356.524 kHz   1939.490000 MHz (aspect undefined, no 3D stereo, preferred)
               Hfront  128 Hsync  32 Hback  160 Hpol P
               Vfront   33 Vsync   8 Vback    6 Vpol N
    DTD:  5120x1440  119.999205 Hz   0:0    182.879 kHz    965.600000 MHz (aspect undefined, no 3D stereo)
               Hfront   48 Hsync  32 Hback   80 Hpol P
               Vfront    3 Vsync  10 Vback   71 Vpol N
    DTD:  5120x1440   59.976879 Hz   0:0     88.826 kHz    469.000000 MHz (aspect undefined, no 3D stereo)
               Hfront   48 Hsync  32 Hback   80 Hpol P
               Vfront    3 Vsync  10 Vback   28 Vpol N
    DTD:  2560x1440  239.900693 Hz   0:0    355.773 kHz    939.240000 MHz (aspect undefined, no 3D stereo)
               Hfront    8 Hsync  32 Hback   40 Hpol P
               Vfront   33 Vsync   8 Vback    2 Vpol N
    DTD:  3840x1080  239.969136 Hz   0:0    291.562 kHz   1166.250000 MHz (aspect undefined, no 3D stereo)
               Hfront   48 Hsync  32 Hback   80 Hpol P
               Vfront    3 Vsync  10 Vback  122 Vpol N
  Checksum: 0x1d
Checksum: 0x90

----------------

Block 3, Unknown EDID Extension Block 0x00:
  00 ff ff ff ff ff ff 00 4c 2d 53 70 53 38 58 43 '........L-SpS8XC'
  34 1e 01 04 b5 77 22 78 3b c7 25 b1 4b 46 a8 26 '4....w"x;.%.KF.&'
  0e 50 54 bf ef 80 71 4f 81 00 81 c0 81 80 a9 c0 '.PT...qO........'
  b3 00 95 00 d1 c0 74 d6 00 a0 f0 38 40 40 30 20 '......t....8@@0 '
  3a 00 a9 50 41 00 00 1a 00 00 00 fd 0c 3c f0 66 ':..PA........<.f'
  66 c2 01 0a 20 20 20 20 20 20 00 00 00 fc 00 4c 'f...      .....L'
  43 34 39 47 39 35 54 0a 20 20 20 20 00 00 00 ff 'C49G95T.    ....'
  00 48 34 5a 4e 43 30 36 35 30 38 0a 20 20 02 6d '.H4ZNC06508.  .m'
Checksum: 0x6d

----------------

Block 4, CTA-861 Extension Block:
  Revision: 3
  Underscans IT Video Formats by default
  Basic audio support
  Supports YCbCr 4:4:4
  Supports YCbCr 4:2:2
  Native detailed modes: 0
  Video Data Block:
    VIC  16:  1920x1080   60.000000 Hz  16:9     67.500 kHz    148.500000 MHz
    VIC  90:  2560x1080   60.000000 Hz  64:27    66.000 kHz    198.000000 MHz
    VIC  63:  1920x1080  120.000000 Hz  16:9    135.000 kHz    297.000000 MHz
    VIC  92:  2560x1080  120.000000 Hz  64:27   150.000 kHz    495.000000 MHz
  Audio Data Block:
    Linear PCM:
      Max channels: 2
      Supported sample rates (kHz): 48 44.1 32
      Supported sample sizes (bits): 24 20 16
  Speaker Allocation Data Block:
    FL/FR - Front Left/Right
  Colorimetry Data Block:
    BT2020YCC
    BT2020RGB
  Vendor-Specific Data Block (AMD), OUI 00-00-1A:
    Version: 2
    Feature Caps: 0x0f
    Minimum Refresh Rate: 60 Hz
    Maximum Refresh Rate: 240 Hz
    Flags 1.x: 0x00
    Flags 2.x: 0x04
    Maximum luminance: 139 (1015.241 cd/m^2)
    Minimum luminance: 18 (0.051 cd/m^2)
    Maximum luminance (without local dimming): 115 (603.666 cd/m^2)
    Minimum luminance (without local dimming): 23 (0.049 cd/m^2)
  HDR Static Metadata Data Block:
    Electro optical transfer functions:
      Traditional gamma - SDR luminance range
      SMPTE ST2084
    Supported static metadata descriptors:
      Static metadata type 1
  Vendor-Specific Video Data Block (HDR10+), OUI 90-84-8B:
    Application Version: 1
    Full Frame Peak Luminance Index: 0
    Peak Luminance Index: 0
  Detailed Timing Descriptors:
    DTD 6:  2560x1440   59.950550 Hz  16:9     88.787 kHz    241.500000 MHz (1193 mm x 336 mm)
                 Hfront   48 Hsync  32 Hback   80 Hpol P
                 Vfront    3 Vsync   5 Vback   33 Vpol N
    DTD 7:  2560x1080   60.000000 Hz  64:27    66.000 kHz    198.000000 MHz (1193 mm x 336 mm)
                 Hfront  248 Hsync  44 Hback  148 Hpol P
                 Vfront    4 Vsync   5 Vback   11 Vpol P
    DTD 8:  3840x1080   59.968497 Hz  32:9     66.625 kHz    266.500000 MHz (1193 mm x 336 mm)
                 Hfront   48 Hsync  32 Hback   80 Hpol P
                 Vfront    3 Vsync  10 Vback   18 Vpol N
    DTD 9:  2560x1440  119.997589 Hz  16:9    182.996 kHz    497.750000 MHz (1193 mm x 336 mm)
                 Hfront   48 Hsync  32 Hback   80 Hpol P
                 Vfront    3 Vsync   5 Vback   77 Vpol N
Checksum: 0x84  Unused space in Extension Block: 10 bytes

----------------

Block 5, DisplayID Extension Block:
  Version: 1.2
  Extension Count: 0
  Video Timing Modes Type 1 - Detailed Timings Data Block:
    DTD:  5120x1440  239.760523 Hz   0:0    356.524 kHz   1939.490000 MHz (aspect undefined, no 3D stereo, preferred)
               Hfront  128 Hsync  32 Hback  160 Hpol P
               Vfront   33 Vsync   8 Vback    6 Vpol N
    DTD:  5120x1440  119.999205 Hz   0:0    182.879 kHz    965.600000 MHz (aspect undefined, no 3D stereo)
               Hfront   48 Hsync  32 Hback   80 Hpol P
               Vfront    3 Vsync  10 Vback   71 Vpol N
    DTD:  5120x1440   59.976879 Hz   0:0     88.826 kHz    469.000000 MHz (aspect undefined, no 3D stereo)
               Hfront   48 Hsync  32 Hback   80 Hpol P
               Vfront    3 Vsync  10 Vback   28 Vpol N
    DTD:  2560x1440  239.900693 Hz   0:0    355.773 kHz    939.240000 MHz (aspect undefined, no 3D stereo)
               Hfront    8 Hsync  32 Hback   40 Hpol P
               Vfront   33 Vsync   8 Vback    2 Vpol N
    DTD:  3840x1080  239.969136 Hz   0:0    291.562 kHz   1166.250000 MHz (aspect undefined, no 3D stereo)
               Hfront   48 Hsync  32 Hback   80 Hpol P
               Vfront    3 Vsync  10 Vback  122 Vpol N
  Checksum: 0x1d
Checksum: 0x90

----------------

Warnings:

Block 1, CTA-861 Extension Block:
  Video Data Block: VIC 16 and the first DTD are not identical. Is this intended?
  Colorimetry Data Block: Set the sRGB colorimetry bit to avoid interop issues.
  Detailed Timing Descriptor #2: Image size is 1193x336 mm, but based on the picture AR it should be 1193x671 mm.
  Detailed Timing Descriptor #3: Image size is 1193x336 mm, but based on the picture AR it should be 1193x503 mm.
  Detailed Timing Descriptor #5: Image size is 1193x336 mm, but based on the picture AR it should be 1193x671 mm.
  Display Product Serial Number is set, so the Serial Number in the Base EDID should be 0.
Block 4, CTA-861 Extension Block:
  Colorimetry Data Block: Set the sRGB colorimetry bit to avoid interop issues.
  Detailed Timing Descriptor #6: Image size is 1193x336 mm, but based on the picture AR it should be 1193x671 mm.
  Detailed Timing Descriptor #7: Image size is 1193x336 mm, but based on the picture AR it should be 1193x503 mm.
  Detailed Timing Descriptor #9: Image size is 1193x336 mm, but based on the picture AR it should be 1193x671 mm.
EDID:
  Base EDID: Some timings are out of range of the Monitor Ranges:
    Vertical Freq: 56.250 - 239.969 Hz (Monitor: 60.000 - 240.000 Hz)
    Horizontal Freq: 31.466 - 356.523 kHz (Monitor: 357.000 - 357.000 kHz)

Failures:

Block 1, CTA-861 Extension Block:
  Missing VCDB, needed for Set Selectable RGB Quantization to avoid interop issues.
Block 2, DisplayID Extension Block:
  DisplayID Base Block has no product type.
  Expected 0 DisplayID Extension Block, but got 1.
Block 3, Base EDID:
  Unknown Extension Block.
Block 4, CTA-861 Extension Block:
  Video Data Block: Duplicate VIC 16.
  Video Data Block: Duplicate VIC 90.
  Video Data Block: Duplicate VIC 63.
  Video Data Block: Duplicate VIC 92.
  Speaker Allocation Data Block: Only one instance of this Data Block is allowed.
  Colorimetry Data Block: Only one instance of this Data Block is allowed.
  HDR Static Metadata Data Block: Only one instance of this Data Block is allowed.
EDID:
  Base EDID: EDID specified 2 extension block(s), but found 5 extension block(s).

EDID conformity: FAIL
