edid-decode (hex):

00 ff ff ff ff ff ff 00 5a 63 3a eb 00 00 00 00
11 22 01 03 80 46 27 78 2a 2c 91 a6 54 51 9e 26
12 50 54 bf ef 80 81 c0 b3 00 a9 40 a9 c0 95 00
90 40 81 80 81 40 02 3a 80 18 71 38 2d 40 58 2c
45 00 ba 89 21 00 00 1e 00 00 00 fd 00 30 b4 1e
d7 2b 00 0a 20 20 20 20 20 20 00 00 00 fc 00 56
58 33 32 31 38 2d 50 43 2d 4d 48 44 00 00 00 ff
00 57 43 33 32 34 31 37 36 31 32 37 32 0a 01 5c

02 03 48 f1 4c 90 9f 05 14 04 13 03 12 02 11 01
3f 23 09 07 07 83 01 00 00 67 03 0c 00 10 00 38
44 6d 1a 00 00 02 01 30 b4 e6 00 00 00 00 00 e6
06 07 01 4f 4f 92 e3 05 e7 01 6d d8 5d c4 01 56
80 00 00 00 00 00 00 00 86 6f 80 a0 70 38 40 40
30 20 35 00 ba 89 21 00 00 1e fb 81 80 a0 70 38
1f 40 20 40 45 00 ba 89 21 00 00 1e 56 a2 80 a0
70 38 1e 40 30 20 35 00 ba 89 21 00 00 1e 00 37

00 ff ff ff ff ff ff 00 5a 63 3a eb 00 00 00 00
11 22 01 03 80 46 27 78 2a 2c 91 a6 54 51 9e 26
12 50 54 bf ef 80 81 c0 b3 00 a9 40 a9 c0 95 00
90 40 81 80 81 40 02 3a 80 18 71 38 2d 40 58 2c
45 00 ba 89 21 00 00 1e 00 00 00 fd 00 30 b4 1e
d7 2b 00 0a 20 20 20 20 20 20 00 00 00 fc 00 56
58 33 32 31 38 2d 50 43 2d 4d 48 44 00 00 00 ff
00 57 43 33 32 34 31 37 36 31 32 37 32 0a 01 5c

02 03 48 f1 4c 90 9f 05 14 04 13 03 12 02 11 01
3f 23 09 07 07 83 01 00 00 67 03 0c 00 10 00 38
44 6d 1a 00 00 02 01 30 b4 e6 00 00 00 00 00 e6
06 07 01 4f 4f 92 e3 05 e7 01 6d d8 5d c4 01 56
80 00 00 00 00 00 00 00 86 6f 80 a0 70 38 40 40
30 20 35 00 ba 89 21 00 00 1e fb 81 80 a0 70 38
1f 40 20 40 45 00 ba 89 21 00 00 1e 56 a2 80 a0
70 38 1e 40 30 20 35 00 ba 89 21 00 00 1e 00 37

----------------

Block 0, Base EDID:
  EDID Structure Version & Revision: 1.3
  Vendor & Product Identification:
    Manufacturer: VSC
    Model: 60218
    Made in: week 17 of 2024
  Basic Display Parameters & Features:
    Digital display
    Maximum image size: 70 cm x 39 cm
    Gamma: 2.20
    DPMS levels: Off
    RGB color display
    First detailed timing is the preferred timing
  Color Characteristics:
    Red  : 0.6484, 0.3300
    Green: 0.3193, 0.6171
    Blue : 0.1503, 0.0712
    White: 0.3125, 0.3291
  Established Timings I & II:
    IBM     :   720x400    70.081663 Hz   9:5     31.467 kHz     28.320000 MHz
    DMT 0x04:   640x480    59.940476 Hz   4:3     31.469 kHz     25.175000 MHz
    Apple   :   640x480    66.666667 Hz   4:3     35.000 kHz     30.240000 MHz
    DMT 0x05:   640x480    72.808802 Hz   4:3     37.861 kHz     31.500000 MHz
    DMT 0x06:   640x480    75.000000 Hz   4:3     37.500 kHz     31.500000 MHz
    DMT 0x08:   800x600    56.250000 Hz   4:3     35.156 kHz     36.000000 MHz
    DMT 0x09:   800x600    60.316541 Hz   4:3     37.879 kHz     40.000000 MHz
    DMT 0x0a:   800x600    72.187572 Hz   4:3     48.077 kHz     50.000000 MHz
    DMT 0x0b:   800x600    75.000000 Hz   4:3     46.875 kHz     49.500000 MHz
    Apple   :   832x624    74.551266 Hz   4:3     49.726 kHz     57.284000 MHz
    DMT 0x10:  1024x768    60.003840 Hz   4:3     48.363 kHz     65.000000 MHz
    DMT 0x11:  1024x768    70.069359 Hz   4:3     56.476 kHz     75.000000 MHz
    DMT 0x12:  1024x768    75.028582 Hz   4:3     60.023 kHz     78.750000 MHz
    DMT 0x24:  1280x1024   75.024675 Hz   5:4     79.976 kHz    135.000000 MHz
    Apple   :  1152x870    75.061550 Hz 192:145   68.681 kHz    100.000000 MHz
  Standard Timings:
    DMT 0x55:  1280x720    60.000000 Hz  16:9     45.000 kHz     74.250000 MHz
    DMT 0x3a:  1680x1050   59.954250 Hz  16:10    65.290 kHz    146.250000 MHz
    DMT 0x33:  1600x1200   60.000000 Hz   4:3     75.000 kHz    162.000000 MHz
    DMT 0x53:  1600x900    60.000000 Hz  16:9     60.000 kHz    108.000000 MHz (RB)
    DMT 0x2f:  1440x900    59.887445 Hz  16:10    55.935 kHz    106.500000 MHz
    DMT 0x2a:  1400x1050   59.978442 Hz   4:3     65.317 kHz    121.750000 MHz
    DMT 0x23:  1280x1024   60.019740 Hz   5:4     63.981 kHz    108.000000 MHz
    DMT 0x20:  1280x960    60.000000 Hz   4:3     60.000 kHz    108.000000 MHz
  Detailed Timing Descriptors:
    DTD 1:  1920x1080   60.000000 Hz  16:9     67.500 kHz    148.500000 MHz (698 mm x 393 mm)
                 Hfront   88 Hsync  44 Hback  148 Hpol P
                 Vfront    4 Vsync   5 Vback   36 Vpol P
    Display Range Limits:
      Monitor ranges (GTF): 48-180 Hz V, 30-215 kHz H, max dotclock 430 MHz
    Display Product Name: 'VX3218-PC-MHD'
    Display Product Serial Number: ...
  Extension blocks: 1
Checksum: 0x5c

----------------

Block 1, CTA-861 Extension Block:
  Revision: 3
  Underscans IT Video Formats by default
  Basic audio support
  Supports YCbCr 4:4:4
  Supports YCbCr 4:2:2
  Native DTDs: 1
  Video Data Block:
    VIC  16:  1920x1080   60.000000 Hz  16:9     67.500 kHz    148.500000 MHz (native)
    VIC  31:  1920x1080   50.000000 Hz  16:9     56.250 kHz    148.500000 MHz (native)
    VIC   5:  1920x1080i  60.000000 Hz  16:9     33.750 kHz     74.250000 MHz
    VIC  20:  1920x1080i  50.000000 Hz  16:9     28.125 kHz     74.250000 MHz
    VIC   4:  1280x720    60.000000 Hz  16:9     45.000 kHz     74.250000 MHz
    VIC  19:  1280x720    50.000000 Hz  16:9     37.500 kHz     74.250000 MHz
    VIC   3:   720x480    59.940060 Hz  16:9     31.469 kHz     27.000000 MHz
    VIC  18:   720x576    50.000000 Hz  16:9     31.250 kHz     27.000000 MHz
    VIC   2:   720x480    59.940060 Hz   4:3     31.469 kHz     27.000000 MHz
    VIC  17:   720x576    50.000000 Hz   4:3     31.250 kHz     27.000000 MHz
    VIC   1:   640x480    59.940476 Hz   4:3     31.469 kHz     25.175000 MHz
    VIC  63:  1920x1080  120.000000 Hz  16:9    135.000 kHz    297.000000 MHz
  Audio Data Block:
    Linear PCM:
      Max channels: 2
      Supported sample rates (kHz): 48 44.1 32
      Supported sample sizes (bits): 24 20 16
  Speaker Allocation Data Block:
    FL/FR - Front Left/Right
  Vendor-Specific Data Block (HDMI), OUI 00-0C-03:
    Source physical address: 1.0.0.0
    DC_36bit
    DC_30bit
    DC_Y444
    Maximum TMDS clock: 340 MHz
  Vendor-Specific Data Block (AMD), OUI 00-00-1A:
    Version: 2
    Flags 1: 0x01
      FreeSync Supported
    Minimum Refresh Rate: 48 Hz
    Maximum Refresh Rate: 180 Hz
    MCCS VCP Code: 0xe6
    Flags 5: 0x00
  HDR Static Metadata Data Block:
    Electro optical transfer functions:
      Traditional gamma - SDR luminance range
      Traditional gamma - HDR luminance range
      SMPTE ST2084
    Supported static metadata descriptors:
      Static metadata type 1
    Desired content max luminance: 79 (276.782 cd/m^2)
    Desired content max frame-average luminance: 79 (276.782 cd/m^2)
    Desired content min luminance: 146 (0.907 cd/m^2)
  Colorimetry Data Block:
    xvYCC601
    xvYCC709
    sYCC601
    BT2020cYCC
    BT2020YCC
    BT2020RGB
    Gamut Boundary Description Metadata Profile P0
  Vendor-Specific Data Block (HDMI Forum), OUI C4-5D-D8:
    Version: 1
    Maximum TMDS Character Rate: 430 MHz
    SCDC Present
    VRRmin: 0 Hz
    VRRmax: 0 Hz
  Detailed Timing Descriptors:
    DTD 2:  1920x1080  119.982181 Hz  16:9    137.260 kHz    285.500000 MHz (698 mm x 393 mm)
                 Hfront   48 Hsync  32 Hback   80 Hpol P
                 Vfront    3 Vsync   5 Vback   56 Vpol P
    DTD 3:  1920x1080  143.992765 Hz  16:9    159.976 kHz    332.750000 MHz (698 mm x 393 mm)
                 Hfront   32 Hsync  64 Hback   64 Hpol P
                 Vfront    4 Vsync   5 Vback   22 Vpol P
    DTD 4:  1920x1080  179.998267 Hz  16:9    199.798 kHz    415.580000 MHz (698 mm x 393 mm)
                 Hfront   48 Hsync  32 Hback   80 Hpol P
                 Vfront    3 Vsync   5 Vback   22 Vpol P
Checksum: 0x37  Unused space in Extension Block: 1 byte

----------------

Warnings:

Block 1, CTA-861 Extension Block:
  Colorimetry Data Block: Set the sRGB colorimetry bit to avoid interop issues.
EDID:
  Base EDID: Some timings are out of range of the Monitor Ranges:
    Horizontal Freq: 28.125 - 199.798 kHz (Monitor: 30.000 - 215.000 kHz)

Failures:

Block 1, CTA-861 Extension Block:
  Vendor-Specific Data Block (HDMI Forum), OUI C4-5D-D8: HDMI Forum VSDB did not immediately follow the HDMI VSDB.
  Missing VCDB, needed for Set Selectable RGB Quantization to avoid interop issues.
EDID:
  Extension Block 2 started with EDID header, ignoring Extension Blocks >= 2.

EDID conformity: FAIL
