edid-decode (hex):

00 ff ff ff ff ff ff 00 4d 10 ab 14 00 00 00 00
10 1d 01 04 a5 1d 11 78 0e de 50 a3 54 4c 99 26
0f 50 54 00 00 00 01 01 01 01 01 01 01 01 01 01
01 01 01 01 01 01 4c 36 80 a0 70 38 22 40 30 20
35 00 26 a5 10 00 00 18 4c 36 80 a0 70 38 37 41
30 20 35 00 26 a5 10 00 00 18 00 00 00 fe 00 35
52 47 34 47 80 4c 51 31 33 33 4d 31 00 00 00 00
00 02 41 03 1e 00 12 00 00 0a 01 0a 20 20 00 ca

----------------

Block 0, Base EDID:
  EDID Structure Version & Revision: 1.4
  Vendor & Product Identification:
    Manufacturer: SHP
    Model: 5291
    Made in: week 16 of 2019
  Basic Display Parameters & Features:
    Digital display
    Bits per primary color channel: 8
    DisplayPort interface
    Maximum image size: 29 cm x 17 cm
    Gamma: 2.20
    Supported color formats: RGB 4:4:4, YCrCb 4:4:4
    Default (sRGB) color space is primary color space
    First detailed timing includes the native pixel format and preferred refresh rate
  Color Characteristics:
    Red  : 0.6396, 0.3291
    Green: 0.2998, 0.5996
    Blue : 0.1494, 0.0595
    White: 0.3125, 0.3281
  Established Timings I & II: none
  Standard Timings: none
  Detailed Timing Descriptors:
    DTD 1:  1920x1080   59.988261 Hz  16:9     66.827 kHz    139.000000 MHz (294 mm x 165 mm)
                 Hfront   48 Hsync  32 Hback   80 Hpol N
                 Vfront    3 Vsync   5 Vback   26 Vpol N
    DTD 2:  1920x1080   48.042360 Hz  16:9     66.827 kHz    139.000000 MHz (294 mm x 165 mm)
                 Hfront   48 Hsync  32 Hback   80 Hpol N
                 Vfront    3 Vsync   5 Vback  303 Vpol N
    Alphanumeric Data String: '5RG4G.LQ133M1'
    Manufacturer-Specified Display Descriptor (0x00): 00 00 00 02 41 03 1e 00 12 00 00 0a 01 0a 20 20 '....A.........  '
Checksum: 0xca

----------------

Warnings:

Block 0, Base EDID:
  Alphanumeric Data String: Non-ASCII character 0x80 at position 5, can cause problems.
  Missing Display Product Name.

Failures:

Block 0, Base EDID:
  Basic Display Parameters & Features: sRGB is signaled, but the chromaticities do not match.

EDID conformity: FAIL
