edid-decode (hex):

00 ff ff ff ff ff ff 00 6a 4e 02 03 02 00 00 00
25 11 01 03 80 32 1e 00 0a 92 03 a2 56 48 99 25
14 4a 4d 21 08 00 01 01 01 01 01 01 01 01 01 01
01 01 01 01 01 01 9a 29 a0 d0 51 84 22 30 50 98
36 00 9a 00 11 00 00 1c 8c 0a d0 8a 20 e0 2d 10
10 3e 96 00 f4 19 11 00 00 18 00 00 00 fc 00 5a
4f 52 41 4e 20 4d 41 54 52 49 58 0a 00 00 00 fd
00 3b 3d 0f 2e 0f 00 0a 20 20 20 20 20 20 01 25

02 03 1a 71 47 05 84 03 02 01 07 06 26 09 07 07
15 07 50 66 03 0c 00 10 00 80 01 1d 00 72 51 d0
1e 20 6e 28 55 00 f4 19 11 00 00 1e 8c 0a d0 8a
20 e0 2d 10 10 3e 96 00 90 2d 11 00 00 18 01 1d
80 18 71 1c 16 20 58 2c 25 00 f4 19 11 00 00 9e
8c 0a a0 14 51 f0 16 00 26 7c 43 00 f4 19 11 00
00 98 8c 0a a0 14 51 f0 16 00 26 7c 43 00 90 2d
11 00 00 98 00 00 00 00 00 00 00 00 00 00 00 cc

00 ff ff ff ff ff ff 00 6a 4e 02 03 02 00 00 00
25 11 01 03 80 32 1e 00 0a 92 03 a2 56 48 99 25
14 4a 4d 21 08 00 01 01 01 01 01 01 01 01 01 01
01 01 01 01 01 01 9a 29 a0 d0 51 84 22 30 50 98
36 00 9a 00 11 00 00 1c 8c 0a d0 8a 20 e0 2d 10
10 3e 96 00 f4 19 11 00 00 18 00 00 00 fc 00 5a
4f 52 41 4e 20 4d 41 54 52 49 58 0a 00 00 00 fd
00 3b 3d 0f 2e 0f 00 0a 20 20 20 20 20 20 01 25

02 03 1a 71 47 05 84 03 02 01 07 06 26 09 07 07
15 07 50 66 03 0c 00 10 00 80 01 1d 00 72 51 d0
1e 20 6e 28 55 00 f4 19 11 00 00 1e 8c 0a d0 8a
20 e0 2d 10 10 3e 96 00 90 2d 11 00 00 18 01 1d
80 18 71 1c 16 20 58 2c 25 00 f4 19 11 00 00 9e
8c 0a a0 14 51 f0 16 00 26 7c 43 00 f4 19 11 00
00 98 8c 0a a0 14 51 f0 16 00 26 7c 43 00 90 2d
11 00 00 98 00 00 00 00 00 00 00 00 00 00 00 cc

----------------

Block 0, Base EDID:
  EDID Structure Version & Revision: 1.3
  Vendor & Product Identification:
    Manufacturer: ZRN
    Model: 770
    Serial Number: ...
    Made in: week 37 of 2007
  Basic Display Parameters & Features:
    Digital display
    Maximum image size: 50 cm x 30 cm
    Gamma: 1.00
    RGB color display
    First detailed timing is the preferred timing
  Color Characteristics:
    Red  : 0.6347, 0.3369
    Green: 0.2812, 0.5996
    Blue : 0.1445, 0.0781
    White: 0.2890, 0.3037
  Established Timings I & II:
    DMT 0x04:   640x480    59.940476 Hz   4:3     31.469 kHz     25.175000 MHz
    DMT 0x09:   800x600    60.316541 Hz   4:3     37.879 kHz     40.000000 MHz
    DMT 0x10:  1024x768    60.003840 Hz   4:3     48.363 kHz     65.000000 MHz
  Standard Timings: none
  Detailed Timing Descriptors:
    DTD 1:  1440x900    59.887445 Hz  16:10    55.935 kHz    106.500000 MHz (410 mm x 256 mm)
                 Hfront   80 Hsync 152 Hback  232 Hpol N
                 Vfront    3 Vsync   6 Vback   25 Vpol P
    DTD 2:   720x480    59.940060 Hz   3:2     31.469 kHz     27.000000 MHz (500 mm x 281 mm)
                 Hfront   16 Hsync  62 Hback   60 Hpol N
                 Vfront    9 Vsync   6 Vback   30 Vpol N
    Display Product Name: 'ZORAN MATRIX'
    Display Range Limits:
      Monitor ranges (GTF): 59-61 Hz V, 15-46 kHz H, max dotclock 150 MHz
  Extension blocks: 1
Checksum: 0x25

----------------

Block 1, CTA-861 Extension Block:
  Revision: 3
  Basic audio support
  Supports YCbCr 4:4:4
  Supports YCbCr 4:2:2
  Native DTDs: 1
  Video Data Block:
    VIC   5:  1920x1080i  60.000000 Hz  16:9     33.750 kHz     74.250000 MHz
    VIC   4:  1280x720    60.000000 Hz  16:9     45.000 kHz     74.250000 MHz (native)
    VIC   3:   720x480    59.940060 Hz  16:9     31.469 kHz     27.000000 MHz
    VIC   2:   720x480    59.940060 Hz   4:3     31.469 kHz     27.000000 MHz
    VIC   1:   640x480    59.940476 Hz   4:3     31.469 kHz     25.175000 MHz
    VIC   7:  1440x480i   59.940060 Hz  16:9     15.734 kHz     27.000000 MHz
    VIC   6:  1440x480i   59.940060 Hz   4:3     15.734 kHz     27.000000 MHz
  Audio Data Block:
    Linear PCM:
      Max channels: 2
      Supported sample rates (kHz): 48 44.1 32
      Supported sample sizes (bits): 24 20 16
    AC-3:
      Max channels: 6
      Supported sample rates (kHz): 48 44.1 32
      Maximum bit rate: 640 kb/s
  Vendor-Specific Data Block (HDMI), OUI 00-0C-03:
    Source physical address: 1.0.0.0
    Supports_AI
  Detailed Timing Descriptors:
    DTD 3:  1280x720    60.000000 Hz  16:9     45.000 kHz     74.250000 MHz (500 mm x 281 mm)
                 Hfront  110 Hsync  40 Hback  220 Hpol P
                 Vfront    5 Vsync   5 Vback   20 Vpol P
    DTD 4:   720x480    59.940060 Hz   3:2     31.469 kHz     27.000000 MHz (400 mm x 301 mm)
                 Hfront   16 Hsync  62 Hback   60 Hpol N
                 Vfront    9 Vsync   6 Vback   30 Vpol N
    DTD 5:  1920x1080i  60.000000 Hz  16:9     33.750 kHz     74.250000 MHz (500 mm x 281 mm)
                 Hfront   88 Hsync  44 Hback  148 Hpol P
                 Vfront    2 Vsync   5 Vback   15 Vpol P Vfront +0.5 Odd Field
                 Vfront    2 Vsync   5 Vback   15 Vpol P Vback  +0.5 Even Field
    DTD 6:  1440x480i   59.940060 Hz   3:1     15.734 kHz     27.000000 MHz (500 mm x 281 mm)
                 Hfront   38 Hsync 124 Hback  114 Hpol N
                 Vfront    4 Vsync   3 Vback   15 Vpol N Vfront +0.5 Odd Field
                 Vfront    4 Vsync   3 Vback   15 Vpol N Vback  +0.5 Even Field
    DTD 7:  1440x480i   59.940060 Hz   3:1     15.734 kHz     27.000000 MHz (400 mm x 301 mm)
                 Hfront   38 Hsync 124 Hback  114 Hpol N
                 Vfront    4 Vsync   3 Vback   15 Vpol N Vfront +0.5 Odd Field
                 Vfront    4 Vsync   3 Vback   15 Vpol N Vback  +0.5 Even Field
Checksum: 0xcc  Unused space in Extension Block: 11 bytes

----------------

Warnings:

Block 0, Base EDID:
  Detailed Timing Descriptor #2: Image size is 500x281 mm, but based on the picture AR it should be 421x281 mm.
Block 1, CTA-861 Extension Block:
  IT Video Formats are overscanned by default, but normally this should be underscanned.
  Video Data Block: VIC 5 and the first DTD are not identical. Is this intended?
  Detailed Timing Descriptor #4: Image size is 400x301 mm, but based on the picture AR it should be 400x266 mm.
  Detailed Timing Descriptor #6: Image size is 500x281 mm, but based on the picture AR it should be 500x166 mm.
  Detailed Timing Descriptor #7: Image size is 400x301 mm, but based on the picture AR it should be 400x133 mm.
  Add a Colorimetry Data Block with the sRGB colorimetry bit set to avoid interop issues.
EDID:
  Base EDID: Some timings are out of range of the Monitor Ranges:
    Horizontal Freq: 15.734 - 55.934 kHz (Monitor: 15.000 - 46.000 kHz)

Failures:

Block 0, Base EDID:
  Detailed Timing Descriptor #1: Mismatch of image size 410x256 mm vs display size 500x300 mm.
Block 1, CTA-861 Extension Block:
  Missing VCDB, needed for Set Selectable RGB Quantization to avoid interop issues.
EDID:
  Extension Block 2 started with EDID header, ignoring Extension Blocks >= 2.
  CTA-861: Native progressive timings are a mix of several resolutions.

EDID conformity: FAIL
