edid-decode (hex):

00 ff ff ff ff ff ff 00 36 69 f1 3c 01 01 01 01
02 23 01 04 b5 3b 21 78 3b b9 f5 af 4d 3d b6 24
0e 50 54 bf cf 00 71 4f 81 c0 81 40 81 80 95 00
b3 00 d1 c0 01 01 56 5e 00 a0 a0 a0 29 50 30 20
35 00 4e 4e 21 00 00 1a 6f c2 00 a0 a0 a0 55 50
30 20 35 00 4e 4e 21 00 00 1a 00 00 00 fd 0e 30
19 cd cd 87 01 0a 20 20 20 20 20 20 00 00 00 fc
00 4d 41 47 20 32 37 31 51 50 20 58 32 38 02 de

02 03 39 f1 49 01 04 90 13 3f 03 02 12 11 23 09
07 07 83 01 00 00 e2 00 2a 74 1a 00 00 03 03 30
f0 00 a0 8c 02 4f 03 18 01 00 00 00 00 00 e3 05
e2 01 e6 06 07 01 8b 4b 00 25 ff 80 40 71 38 87
40 60 20 35 00 4e 4e 21 00 00 1a 00 00 00 00 00
00 00 00 00 00 00 00 00 00 00 00 00 00 00 00 00
00 00 00 00 00 00 00 00 00 00 00 00 00 00 00 00
00 00 00 00 00 00 00 00 00 00 00 00 00 00 00 ed

70 12 79 03 00 03 01 28 08 b4 01 04 ff 09 3f 01
2f 80 1f 00 9f 05 ae 00 02 00 04 00 b9 fc 01 04
ff 09 3f 01 7f 80 1f 00 9f 05 ae 00 02 00 04 00
00 00 00 00 00 00 00 00 00 00 00 00 00 00 00 00
00 00 00 00 00 00 00 00 00 00 00 00 00 00 00 00
00 00 00 00 00 00 00 00 00 00 00 00 00 00 00 00
00 00 00 00 00 00 00 00 00 00 00 00 00 00 00 00
00 00 00 00 00 00 00 00 00 00 00 00 00 00 9f 90

00 ff ff ff ff ff ff 00 36 69 f1 3c 01 01 01 01
02 23 01 04 b5 3b 21 78 3b b9 f5 af 4d 3d b6 24
0e 50 54 bf cf 00 71 4f 81 c0 81 40 81 80 95 00
b3 00 d1 c0 01 01 56 5e 00 a0 a0 a0 29 50 30 20
35 00 4e 4e 21 00 00 1a 6f c2 00 a0 a0 a0 55 50
30 20 35 00 4e 4e 21 00 00 1a 00 00 00 fd 0e 30
19 cd cd 87 01 0a 20 20 20 20 20 20 00 00 00 fc
00 4d 41 47 20 32 37 31 51 50 20 58 32 38 02 de

02 03 39 f1 49 01 04 90 13 3f 03 02 12 11 23 09
07 07 83 01 00 00 e2 00 2a 74 1a 00 00 03 03 30
f0 00 a0 8c 02 4f 03 18 01 00 00 00 00 00 e3 05
e2 01 e6 06 07 01 8b 4b 00 25 ff 80 40 71 38 87
40 60 20 35 00 4e 4e 21 00 00 1a 00 00 00 00 00
00 00 00 00 00 00 00 00 00 00 00 00 00 00 00 00
00 00 00 00 00 00 00 00 00 00 00 00 00 00 00 00
00 00 00 00 00 00 00 00 00 00 00 00 00 00 00 ed

70 12 79 03 00 03 01 28 08 b4 01 04 ff 09 3f 01
2f 80 1f 00 9f 05 ae 00 02 00 04 00 b9 fc 01 04
ff 09 3f 01 7f 80 1f 00 9f 05 ae 00 02 00 04 00
00 00 00 00 00 00 00 00 00 00 00 00 00 00 00 00
00 00 00 00 00 00 00 00 00 00 00 00 00 00 00 00
00 00 00 00 00 00 00 00 00 00 00 00 00 00 00 00
00 00 00 00 00 00 00 00 00 00 00 00 00 00 00 00
00 00 00 00 00 00 00 00 00 00 00 00 00 00 9f 90

----------------

Block 0, Base EDID:
  EDID Structure Version & Revision: 1.4
  Vendor & Product Identification:
    Manufacturer: MSI
    Model: 15601
    Serial Number: ...
    Made in: week 2 of 2025
  Basic Display Parameters & Features:
    Digital display
    Bits per primary color channel: 10
    DisplayPort interface
    Maximum image size: 59 cm x 33 cm
    Gamma: 2.20
    DPMS levels: Off
    Supported color formats: RGB 4:4:4, YCrCb 4:4:4, YCrCb 4:2:2
    First detailed timing includes the native pixel format and preferred refresh rate
    Display supports continuous frequencies
  Color Characteristics:
    Red  : 0.6855, 0.3037
    Green: 0.2402, 0.7119
    Blue : 0.1435, 0.0576
    White: 0.3134, 0.3291
  Established Timings I & II:
    IBM     :   720x400    70.081663 Hz   9:5     31.467 kHz     28.320000 MHz
    DMT 0x04:   640x480    59.940476 Hz   4:3     31.469 kHz     25.175000 MHz
    Apple   :   640x480    66.666667 Hz   4:3     35.000 kHz     30.240000 MHz
    DMT 0x05:   640x480    72.808802 Hz   4:3     37.861 kHz     31.500000 MHz
    DMT 0x06:   640x480    75.000000 Hz   4:3     37.500 kHz     31.500000 MHz
    DMT 0x08:   800x600    56.250000 Hz   4:3     35.156 kHz     36.000000 MHz
    DMT 0x09:   800x600    60.316541 Hz   4:3     37.879 kHz     40.000000 MHz
    DMT 0x0a:   800x600    72.187572 Hz   4:3     48.077 kHz     50.000000 MHz
    DMT 0x0b:   800x600    75.000000 Hz   4:3     46.875 kHz     49.500000 MHz
    DMT 0x10:  1024x768    60.003840 Hz   4:3     48.363 kHz     65.000000 MHz
    DMT 0x11:  1024x768    70.069359 Hz   4:3     56.476 kHz     75.000000 MHz
    DMT 0x12:  1024x768    75.028582 Hz   4:3     60.023 kHz     78.750000 MHz
    DMT 0x24:  1280x1024   75.024675 Hz   5:4     79.976 kHz    135.000000 MHz
  Standard Timings:
    DMT 0x15:  1152x864    75.000000 Hz   4:3     67.500 kHz    108.000000 MHz
    DMT 0x55:  1280x720    60.000000 Hz  16:9     45.000 kHz     74.250000 MHz
    DMT 0x20:  1280x960    60.000000 Hz   4:3     60.000 kHz    108.000000 MHz
    DMT 0x23:  1280x1024   60.019740 Hz   5:4     63.981 kHz    108.000000 MHz
    DMT 0x2f:  1440x900    59.887445 Hz  16:10    55.935 kHz    106.500000 MHz
    DMT 0x3a:  1680x1050   59.954250 Hz  16:10    65.290 kHz    146.250000 MHz
    DMT 0x52:  1920x1080   60.000000 Hz  16:9     67.500 kHz    148.500000 MHz
  Detailed Timing Descriptors:
    DTD 1:  2560x1440   59.950550 Hz  16:9     88.787 kHz    241.500000 MHz (590 mm x 334 mm)
                 Hfront   48 Hsync  32 Hback   80 Hpol P
                 Vfront    3 Vsync   5 Vback   33 Vpol N
    DTD 2:  2560x1440  119.997589 Hz  16:9    182.996 kHz    497.750000 MHz (590 mm x 334 mm)
                 Hfront   48 Hsync  32 Hback   80 Hpol P
                 Vfront    3 Vsync   5 Vback   77 Vpol N
    Display Range Limits:
      Monitor ranges (Range Limits Only): 48-280 Hz V, 460-460 kHz H, max dotclock 1350 MHz
    Display Product Name: 'MAG 271QP X28'
  Extension blocks: 2
Checksum: 0xde

----------------

Block 1, CTA-861 Extension Block:
  Revision: 3
  Underscans IT Video Formats by default
  Basic audio support
  Supports YCbCr 4:4:4
  Supports YCbCr 4:2:2
  Native DTDs: 1
  Video Data Block:
    VIC   1:   640x480    59.940476 Hz   4:3     31.469 kHz     25.175000 MHz
    VIC   4:  1280x720    60.000000 Hz  16:9     45.000 kHz     74.250000 MHz
    VIC  16:  1920x1080   60.000000 Hz  16:9     67.500 kHz    148.500000 MHz (native)
    VIC  19:  1280x720    50.000000 Hz  16:9     37.500 kHz     74.250000 MHz
    VIC  63:  1920x1080  120.000000 Hz  16:9    135.000 kHz    297.000000 MHz
    VIC   3:   720x480    59.940060 Hz  16:9     31.469 kHz     27.000000 MHz
    VIC   2:   720x480    59.940060 Hz   4:3     31.469 kHz     27.000000 MHz
    VIC  18:   720x576    50.000000 Hz  16:9     31.250 kHz     27.000000 MHz
    VIC  17:   720x576    50.000000 Hz   4:3     31.250 kHz     27.000000 MHz
  Audio Data Block:
    Linear PCM:
      Max channels: 2
      Supported sample rates (kHz): 48 44.1 32
      Supported sample sizes (bits): 24 20 16
  Speaker Allocation Data Block:
    FL/FR - Front Left/Right
  Video Capability Data Block:
    YCbCr quantization: No Data
    RGB quantization: No Data
    PT scan behavior: Always Underscanned
    IT scan behavior: Always Underscanned
    CE scan behavior: Always Underscanned
  Vendor-Specific Data Block (AMD), OUI 00-00-1A:
    Version: 3
    Feature Caps: 0x03
    Minimum Refresh Rate: 48 Hz
    Maximum Refresh Rate: 280 Hz
    Flags 1.x: 0x00
    Flags 2.x: 0xa0
      ST 2084 (PQ) EOTF Supported
      Linear EOTF (Windows scRGB, 0.0 - 125.0) Supported
      BT.2020 Gamut Supported
    Maximum luminance: 140 (1037.472 cd/m^2)
    Minimum luminance: 2 (0.001 cd/m^2)
  Colorimetry Data Block:
    xvYCC709
    BT2020cYCC
    BT2020YCC
    BT2020RGB
    Gamut Boundary Description Metadata Profile P0
  HDR Static Metadata Data Block:
    Electro optical transfer functions:
      Traditional gamma - SDR luminance range
      Traditional gamma - HDR luminance range
      SMPTE ST2084
    Supported static metadata descriptors:
      Static metadata type 1
    Desired content max luminance: 139 (1015.241 cd/m^2)
    Desired content max frame-average luminance: 75 (253.810 cd/m^2)
    Desired content min luminance: 0 (0.000 cd/m^2)
  Detailed Timing Descriptors:
    DTD 3:  1920x1080  239.994856 Hz  16:9    291.594 kHz    653.170000 MHz (590 mm x 334 mm)
                 Hfront   96 Hsync  32 Hback  192 Hpol P
                 Vfront    3 Vsync   5 Vback  127 Vpol N
Checksum: 0xed  Unused space in Extension Block: 52 bytes

----------------

Block 2, DisplayID Extension Block:
  Version: 1.2
  Extension Count: 0
  Display Product Type: Standalone display device
  Video Timing Modes Type 1 - Detailed Timings Data Block:
    DTD:  2560x1440  239.991830 Hz  16:9    387.587 kHz   1116.250000 MHz (aspect 16:9, no 3D stereo)
               Hfront   48 Hsync  32 Hback  240 Hpol P
               Vfront    3 Vsync   5 Vback  167 Vpol N
    DTD:  2560x1440  280.000860 Hz  16:9    452.201 kHz   1302.340000 MHz (aspect 16:9, no 3D stereo)
               Hfront  128 Hsync  32 Hback  160 Hpol P
               Vfront    3 Vsync   5 Vback  167 Vpol N
  Checksum: 0x9f
Checksum: 0x90

----------------

Warnings:

Block 0, Base EDID:
  Vendor & Product Identification: The serial number is one of the known dummy values, it should probably be set to 0.
Block 1, CTA-861 Extension Block:
  Video Data Block: VIC 1 and the first DTD are not identical. Is this intended?
  Video Capability Data Block: Set Selectable YCbCr Quantization to avoid interop issues.
  Video Capability Data Block: S_PT is equal to S_IT and S_CE, so should be set to 0 instead.
  Colorimetry Data Block: Set the sRGB colorimetry bit to avoid interop issues.
EDID:
  Base EDID: Some timings are out of range of the Monitor Ranges:
    Horizontal Freq: 31.250 - 452.201 kHz (Monitor: 460.000 - 460.000 kHz)

Failures:

Block 1, CTA-861 Extension Block:
  Video Capability Data Block: Set Selectable RGB Quantization to avoid interop issues.
EDID:
  Extension Block 3 started with EDID header, ignoring Extension Blocks >= 3.
  CTA-861: Native progressive timings are a mix of several resolutions.
  DisplayID: Missing DisplayID Display Parameters Data Block.
  DisplayID: DisplayID expects at least one preferred timing.

EDID conformity: FAIL
