edid-decode (hex):

00 ff ff ff ff ff ff 00 22 f0 17 31 00 00 00 00
27 1c 01 04 a5 26 1e 78 26 c9 75 a6 57 51 9d 27
0e 50 54 a1 08 00 81 80 81 00 01 01 01 01 01 01
01 01 01 01 01 01 30 2a 00 98 51 00 2a 40 30 70
13 00 76 2b 11 00 00 1e 00 00 00 fd 00 32 4c 18
53 11 00 0a 20 20 20 20 20 20 00 00 00 fc 00 48
50 20 45 31 39 30 69 0a 20 20 20 20 00 00 00 ff
00 43 4e 34 38 33 39 30 36 50 48 0a 20 20 00 7d

00 ff ff ff ff ff ff 00 22 f0 17 31 00 00 00 00
27 1c 01 04 a5 26 1e 78 26 c9 75 a6 57 51 9d 27
0e 50 54 a1 08 00 81 80 81 00 01 01 01 01 01 01
01 01 01 01 01 01 30 2a 00 98 51 00 2a 40 30 70
13 00 76 2b 11 00 00 1e 00 00 00 fd 00 32 4c 18
53 11 00 0a 20 20 20 20 20 20 00 00 00 fc 00 48
50 20 45 31 39 30 69 0a 20 20 20 20 00 00 00 ff
00 43 4e 34 38 33 39 30 36 50 48 0a 20 20 00 7d

----------------

Block 0, Base EDID:
  EDID Structure Version & Revision: 1.4
  Vendor & Product Identification:
    Manufacturer: HWP
    Model: 12567
    Made in: week 39 of 2018
  Basic Display Parameters & Features:
    Digital display
    Bits per primary color channel: 8
    DisplayPort interface
    Maximum image size: 38 cm x 30 cm
    Gamma: 2.20
    DPMS levels: Off
    Supported color formats: RGB 4:4:4
    Default (sRGB) color space is primary color space
    First detailed timing includes the native pixel format and preferred refresh rate
  Color Characteristics:
    Red  : 0.6513, 0.3398
    Green: 0.3183, 0.6142
    Blue : 0.1533, 0.0576
    White: 0.3134, 0.3291
  Established Timings I & II:
    IBM     :   720x400    70.081663 Hz   9:5     31.467 kHz     28.320000 MHz
    DMT 0x04:   640x480    59.940476 Hz   4:3     31.469 kHz     25.175000 MHz
    DMT 0x09:   800x600    60.316541 Hz   4:3     37.879 kHz     40.000000 MHz
    DMT 0x10:  1024x768    60.003840 Hz   4:3     48.363 kHz     65.000000 MHz
  Standard Timings:
    DMT 0x23:  1280x1024   60.019740 Hz   5:4     63.981 kHz    108.000000 MHz
    DMT 0x1c:  1280x800    59.810326 Hz  16:10    49.702 kHz     83.500000 MHz
  Detailed Timing Descriptors:
    DTD 1:  1280x1024   60.019740 Hz   5:4     63.981 kHz    108.000000 MHz (374 mm x 299 mm)
                 Hfront   48 Hsync 112 Hback  248 Hpol P
                 Vfront    1 Vsync   3 Vback   38 Vpol P
    Display Range Limits:
      Monitor ranges (GTF): 50-76 Hz V, 24-83 kHz H, max dotclock 170 MHz
    Display Product Name: 'HP E190i'
    Display Product Serial Number: ...
Checksum: 0x7d

----------------

Block 1, Unknown EDID Extension Block 0x00:
  00 ff ff ff ff ff ff 00 22 f0 17 31 00 00 00 00 '........"..1....'
  27 1c 01 04 a5 26 1e 78 26 c9 75 a6 57 51 9d 27 ''....&.x&.u.WQ.''
  0e 50 54 a1 08 00 81 80 81 00 01 01 01 01 01 01 '.PT.............'
  01 01 01 01 01 01 30 2a 00 98 51 00 2a 40 30 70 '......0*..Q.*@0p'
  13 00 76 2b 11 00 00 1e 00 00 00 fd 00 32 4c 18 '..v+.........2L.'
  53 11 00 0a 20 20 20 20 20 20 00 00 00 fc 00 48 'S...      .....H'
  50 20 45 31 39 30 69 0a 20 20 20 20 00 00 00 ff 'P E190i.    ....'
  00 43 4e 34 38 33 39 30 36 50 48 0a 20 20 00 7d '.CN483906PH.  .}'
Checksum: 0x7d

----------------

Warnings:

Block 0, Base EDID:
  Display Range Limits: GTF support is deprecated in EDID 1.4.

Failures:

Block 0, Base EDID:
  Basic Display Parameters & Features: sRGB is signaled, but the chromaticities do not match.
  Display Range Limits: GTF is supported, but the display does not support continuous frequencies.
Block 1, Base EDID:
  Unknown Extension Block.
EDID:
  Base EDID: EDID specified 0 extension block(s), but found 1 extension block(s).

EDID conformity: FAIL
