edid-decode (hex):

00 ff ff ff ff ff ff 00 22 64 e8 03 58 27 00 00
1b 13 01 03 80 16 0d 78 0a b5 65 9c 5d 5c 93 27
1e 50 54 00 00 00 01 01 01 01 01 01 01 01 01 01
01 01 01 01 01 01 2c 15 00 30 41 40 68 20 5d 23
95 08 de 7d 00 00 00 19 00 00 00 fe 00 00 00 00
00 00 00 00 00 00 00 00 00 00 00 00 00 fc 00 48
53 44 31 30 31 50 46 57 31 0a 20 20 00 00 00 10
00 0a 20 20 20 20 20 20 20 20 20 20 20 20 00 4c

----------------

Block 0, Base EDID:
  EDID Structure Version & Revision: 1.3
  Vendor & Product Identification:
    Manufacturer: HSD
    Model: 1000
    Serial Number: ...
    Made in: week 27 of 2009
  Basic Display Parameters & Features:
    Digital display
    Maximum image size: 22 cm x 13 cm
    Gamma: 2.20
    RGB color display
    First detailed timing is the preferred timing
  Color Characteristics:
    Red  : 0.6113, 0.3662
    Green: 0.3603, 0.5751
    Blue : 0.1533, 0.1191
    White: 0.3134, 0.3291
  Established Timings I & II: none
  Standard Timings: none
  Detailed Timing Descriptors:
    DTD 1:  1024x576    60.019490 Hz  16:9     40.813 kHz     54.200000 MHz (222 mm x 125 mm)
                 Hfront   93 Hsync  35 Hback  176 Hpol N
                 Vfront   41 Vsync   5 Vback   58 Vpol N
    Alphanumeric Data String: ''
    Display Product Name: 'HSD101PFW1'
    Dummy Descriptor:
Checksum: 0x4c

----------------

Failures:

Block 0, Base EDID:
  Alphanumeric Data String: NUL byte at position 0.
  Dummy Descriptor: Dummy block filled with garbage.
  Missing Display Range Limits Descriptor.

EDID conformity: FAIL
