edid-decode (hex):

00 ff ff ff ff ff ff 00 3d cb 71 10 00 00 00 00
00 1a 01 03 80 a0 5a 78 0a ee 91 a3 54 4c 99 26
0f 50 54 21 08 00 31 40 45 40 61 40 01 01 81 80
01 01 01 01 01 01 02 3a 80 18 71 38 2d 40 58 2c
45 00 40 84 63 00 00 1e 66 21 50 b0 51 00 1b 30
40 70 36 00 40 84 63 00 00 1e 00 00 00 fc 00 41
56 20 52 65 63 65 69 76 65 72 0a 20 00 00 00 fd
00 3a 79 1e 88 1e 00 0a 20 20 20 20 20 20 01 cf

02 03 62 f0 55 10 1f 04 13 05 14 03 02 12 20 21
22 01 5d 5e 5f 62 63 64 3f 40 3b 09 7f 07 0f 7f
07 15 07 50 3f 06 c0 4d 02 00 57 06 01 5f 7e 03
5f 7e 01 67 7e 01 83 4f 00 00 6e 03 0c 00 26 00
b8 3c 20 00 80 01 02 03 04 e2 00 cf e5 0e 61 60
66 65 e3 06 05 01 eb 01 46 d0 00 24 1c 09 45 8a
5e a3 00 00 00 00 00 00 00 00 00 00 00 00 00 00
00 00 00 00 00 00 00 00 00 00 00 00 00 00 00 4a

00 ff ff ff ff ff ff 00 3d cb 71 10 00 00 00 00
00 1a 01 03 80 a0 5a 78 0a ee 91 a3 54 4c 99 26
0f 50 54 21 08 00 31 40 45 40 61 40 01 01 81 80
01 01 01 01 01 01 02 3a 80 18 71 38 2d 40 58 2c
45 00 40 84 63 00 00 1e 66 21 50 b0 51 00 1b 30
40 70 36 00 40 84 63 00 00 1e 00 00 00 fc 00 41
56 20 52 65 63 65 69 76 65 72 0a 20 00 00 00 fd
00 3a 79 1e 88 1e 00 0a 20 20 20 20 20 20 01 cf

02 03 62 f0 55 10 1f 04 13 05 14 03 02 12 20 21
22 01 5d 5e 5f 62 63 64 3f 40 3b 09 7f 07 0f 7f
07 15 07 50 3f 06 c0 4d 02 00 57 06 01 5f 7e 03
5f 7e 01 67 7e 01 83 4f 00 00 6e 03 0c 00 26 00
b8 3c 20 00 80 01 02 03 04 e2 00 cf e5 0e 61 60
66 65 e3 06 05 01 eb 01 46 d0 00 24 1c 09 45 8a
5e a3 00 00 00 00 00 00 00 00 00 00 00 00 00 00
00 00 00 00 00 00 00 00 00 00 00 00 00 00 00 4a

----------------

Block 0, Base EDID:
  EDID Structure Version & Revision: 1.3
  Vendor & Product Identification:
    Manufacturer: ONK
    Model: 4209
    Made in: 2016
  Basic Display Parameters & Features:
    Digital display
    Maximum image size: 160 cm x 90 cm
    Gamma: 2.20
    RGB color display
    First detailed timing is the preferred timing
  Color Characteristics:
    Red  : 0.6396, 0.3300
    Green: 0.2998, 0.5996
    Blue : 0.1503, 0.0595
    White: 0.3125, 0.3291
  Established Timings I & II:
    DMT 0x04:   640x480    59.940476 Hz   4:3     31.469 kHz     25.175000 MHz
    DMT 0x09:   800x600    60.316541 Hz   4:3     37.879 kHz     40.000000 MHz
    DMT 0x10:  1024x768    60.003840 Hz   4:3     48.363 kHz     65.000000 MHz
  Standard Timings:
    DMT 0x04:   640x480    59.940476 Hz   4:3     31.469 kHz     25.175000 MHz
    DMT 0x09:   800x600    60.316541 Hz   4:3     37.879 kHz     40.000000 MHz
    DMT 0x10:  1024x768    60.003840 Hz   4:3     48.363 kHz     65.000000 MHz
    DMT 0x23:  1280x1024   60.019740 Hz   5:4     63.981 kHz    108.000000 MHz
  Detailed Timing Descriptors:
    DTD 1:  1920x1080   60.000000 Hz  16:9     67.500 kHz    148.500000 MHz (1600 mm x 900 mm)
                 Hfront   88 Hsync  44 Hback  148 Hpol P
                 Vfront    4 Vsync   5 Vback   36 Vpol P
    DTD 2:  1360x768    60.015162 Hz  85:48    47.712 kHz     85.500000 MHz (1600 mm x 900 mm)
                 Hfront   64 Hsync 112 Hback  256 Hpol P
                 Vfront    3 Vsync   6 Vback   18 Vpol P
    Display Product Name: 'AV Receiver'
    Display Range Limits:
      Monitor ranges (GTF): 58-121 Hz V, 30-136 kHz H, max dotclock 300 MHz
  Extension blocks: 1
Checksum: 0xcf

----------------

Block 1, CTA-861 Extension Block:
  Revision: 3
  Underscans IT Video Formats by default
  Basic audio support
  Supports YCbCr 4:4:4
  Supports YCbCr 4:2:2
  Native DTDs: 0
  Video Data Block:
    VIC  16:  1920x1080   60.000000 Hz  16:9     67.500 kHz    148.500000 MHz
    VIC  31:  1920x1080   50.000000 Hz  16:9     56.250 kHz    148.500000 MHz
    VIC   4:  1280x720    60.000000 Hz  16:9     45.000 kHz     74.250000 MHz
    VIC  19:  1280x720    50.000000 Hz  16:9     37.500 kHz     74.250000 MHz
    VIC   5:  1920x1080i  60.000000 Hz  16:9     33.750 kHz     74.250000 MHz
    VIC  20:  1920x1080i  50.000000 Hz  16:9     28.125 kHz     74.250000 MHz
    VIC   3:   720x480    59.940060 Hz  16:9     31.469 kHz     27.000000 MHz
    VIC   2:   720x480    59.940060 Hz   4:3     31.469 kHz     27.000000 MHz
    VIC  18:   720x576    50.000000 Hz  16:9     31.250 kHz     27.000000 MHz
    VIC  32:  1920x1080   24.000000 Hz  16:9     27.000 kHz     74.250000 MHz
    VIC  33:  1920x1080   25.000000 Hz  16:9     28.125 kHz     74.250000 MHz
    VIC  34:  1920x1080   30.000000 Hz  16:9     33.750 kHz     74.250000 MHz
    VIC   1:   640x480    59.940476 Hz   4:3     31.469 kHz     25.175000 MHz
    VIC  93:  3840x2160   24.000000 Hz  16:9     54.000 kHz    297.000000 MHz
    VIC  94:  3840x2160   25.000000 Hz  16:9     56.250 kHz    297.000000 MHz
    VIC  95:  3840x2160   30.000000 Hz  16:9     67.500 kHz    297.000000 MHz
    VIC  98:  4096x2160   24.000000 Hz 256:135   54.000 kHz    297.000000 MHz
    VIC  99:  4096x2160   25.000000 Hz 256:135   56.250 kHz    297.000000 MHz
    VIC 100:  4096x2160   30.000000 Hz 256:135   67.500 kHz    297.000000 MHz
    VIC  63:  1920x1080  120.000000 Hz  16:9    135.000 kHz    297.000000 MHz
    VIC  64:  1920x1080  100.000000 Hz  16:9    112.500 kHz    297.000000 MHz
  Audio Data Block:
    Linear PCM:
      Max channels: 2
      Supported sample rates (kHz): 192 176.4 96 88.2 48 44.1 32
      Supported sample sizes (bits): 24 20 16
    Linear PCM:
      Max channels: 8
      Supported sample rates (kHz): 192 176.4 96 88.2 48 44.1 32
      Supported sample sizes (bits): 24 20 16
    AC-3:
      Max channels: 6
      Supported sample rates (kHz): 48 44.1 32
      Maximum bit rate: 640 kb/s
    DTS:
      Max channels: 8
      Supported sample rates (kHz): 48 44.1
      Maximum bit rate: 1536 kb/s
    One Bit Audio:
      Max channels: 6
      Supported sample rates (kHz): 44.1
      Audio Format Code dependent value: 0x00
    Enhanced AC-3 (DD+):
      Max channels: 8
      Supported sample rates (kHz): 48 44.1
      Supports Joint Object Coding
    DTS-HD:
      Max channels: 8
      Supported sample rates (kHz): 192 176.4 96 88.2 48 44.1
      Supports DTS:X
      Audio Format Code dependent value: 0x03
    DTS-HD:
      Max channels: 8
      Supported sample rates (kHz): 192 176.4 96 88.2 48 44.1
      Audio Format Code dependent value: 0x01
    MAT (MLP):
      Max channels: 8
      Supported sample rates (kHz): 192 176.4 96 88.2 48 44.1
      Supports Dolby TrueHD, object audio PCM and channel-based PCM
      Hash calculation required for object audio PCM or channel-based PCM
  Speaker Allocation Data Block:
    FL/FR - Front Left/Right
    LFE1 - Low Frequency Effects 1
    FC - Front Center
    LS/RS - Left/Right Surround
    BL/BR - Back Left/Right
  Vendor-Specific Data Block (HDMI), OUI 00-0C-03:
    Source physical address: 2.6.0.0
    Supports_AI
    DC_36bit
    DC_30bit
    DC_Y444
    Maximum TMDS clock: 300 MHz
    Extended HDMI video details:
      HDMI VICs:
        HDMI VIC 1:  3840x2160   30.000000 Hz  16:9     67.500 kHz    297.000000 MHz
        HDMI VIC 2:  3840x2160   25.000000 Hz  16:9     56.250 kHz    297.000000 MHz
        HDMI VIC 3:  3840x2160   24.000000 Hz  16:9     54.000 kHz    297.000000 MHz
        HDMI VIC 4:  4096x2160   24.000000 Hz 256:135   54.000 kHz    297.000000 MHz
  Video Capability Data Block:
    YCbCr quantization: Selectable (via AVI YQ)
    RGB quantization: Selectable (via AVI Q)
    PT scan behavior: No Data
    IT scan behavior: Supports both over- and underscan
    CE scan behavior: Supports both over- and underscan
  YCbCr 4:2:0 Video Data Block:
    VIC  97:  3840x2160   60.000000 Hz  16:9    135.000 kHz    594.000000 MHz
    VIC  96:  3840x2160   50.000000 Hz  16:9    112.500 kHz    594.000000 MHz
    VIC 102:  4096x2160   60.000000 Hz 256:135  135.000 kHz    594.000000 MHz
    VIC 101:  4096x2160   50.000000 Hz 256:135  112.500 kHz    594.000000 MHz
  HDR Static Metadata Data Block:
    Electro optical transfer functions:
      Traditional gamma - SDR luminance range
      SMPTE ST2084
    Supported static metadata descriptors:
      Static metadata type 1
  Vendor-Specific Video Data Block (Dolby), OUI 00-D0-46:
    Version: 1 (12 bytes)
    DM Version: 3.x
    Colorimetry: P3-D65
    Low Latency: Standard + Low Latency
    Target Min Luminance: 0.00099200 cd/m^2
    Target Max Luminance: 800 cd/m^2
    Unique Rx, Ry: 0.70312500, 0.29687500
    Unique Gx, Gy: 0.26953125, 0.68359375
    Unique Bx, By: 0.13281250, 0.03515625
Checksum: 0x4a  Unused space in Extension Block: 29 bytes

----------------

Warnings:

Block 1, CTA-861 Extension Block:
  Video Data Block: For improved preferred timing interoperability, set 'Native DTDs' to 1.
EDID:
  Base EDID: Some timings are out of range of the Monitor Ranges:
    Vertical Freq: 24.000 - 120.000 Hz (Monitor: 58.000 - 121.000 Hz)
    Horizontal Freq: 27.000 - 135.000 kHz (Monitor: 30.000 - 136.000 kHz)

Failures:

Block 0, Base EDID:
  Basic Display Parameters & Features: The chromaticities match sRGB, but sRGB is not signaled.
EDID:
  Extension Block 2 started with EDID header, ignoring Extension Blocks >= 2.

EDID conformity: FAIL
