edid-decode (hex):

00 ff ff ff ff ff ff 00 64 83 00 32 00 00 00 00
11 23 01 03 80 47 28 78 3a fc 96 ad 4f 40 9f 25
11 4d 52 21 08 00 d1 c0 01 01 01 01 95 00 90 40
81 80 b3 00 a9 c0 40 d0 00 a0 f0 70 3e 80 30 20
35 00 c4 8e 21 00 00 1a 00 00 00 fd 00 30 3c 0f
de 3c 00 0a 20 20 20 20 20 20 00 00 00 fc 00 47
57 33 32 46 34 4b 36 30 0a 20 20 20 00 00 00 10
00 00 00 00 00 00 00 00 00 00 00 00 00 00 01 b1

02 03 2c f1 42 10 61 e2 00 eb e3 05 c0 20 23 09
7f 07 83 01 00 00 66 03 0c 00 10 00 38 67 d8 5d
c4 01 78 88 01 e6 06 07 01 59 59 3e 56 5e 00 a0
a0 a0 29 50 30 20 35 00 c4 8e 21 00 00 1a 00 00
00 00 00 00 00 00 00 00 00 00 00 00 00 00 00 00
00 00 00 00 00 00 00 00 00 00 00 00 00 00 00 00
00 00 00 00 00 00 00 00 00 00 00 00 00 00 00 00
00 00 00 00 00 00 00 00 00 00 00 00 00 00 00 3e

00 ff ff ff ff ff ff 00 64 83 00 32 00 00 00 00
11 23 01 03 80 47 28 78 3a fc 96 ad 4f 40 9f 25
11 4d 52 21 08 00 d1 c0 01 01 01 01 95 00 90 40
81 80 b3 00 a9 c0 40 d0 00 a0 f0 70 3e 80 30 20
35 00 c4 8e 21 00 00 1a 00 00 00 fd 00 30 3c 0f
de 3c 00 0a 20 20 20 20 20 20 00 00 00 fc 00 47
57 33 32 46 34 4b 36 30 0a 20 20 20 00 00 00 10
00 00 00 00 00 00 00 00 00 00 00 00 00 00 01 b1

02 03 2c f1 42 10 61 e2 00 eb e3 05 c0 20 23 09
7f 07 83 01 00 00 66 03 0c 00 10 00 38 67 d8 5d
c4 01 78 88 01 e6 06 07 01 59 59 3e 56 5e 00 a0
a0 a0 29 50 30 20 35 00 c4 8e 21 00 00 1a 00 00
00 00 00 00 00 00 00 00 00 00 00 00 00 00 00 00
00 00 00 00 00 00 00 00 00 00 00 00 00 00 00 00
00 00 00 00 00 00 00 00 00 00 00 00 00 00 00 00
00 00 00 00 00 00 00 00 00 00 00 00 00 00 00 3e

----------------

Block 0, Base EDID:
  EDID Structure Version & Revision: 1.3
  Vendor & Product Identification:
    Manufacturer: YDC
    Model: 12800
    Made in: week 17 of 2025
  Basic Display Parameters & Features:
    Digital display
    Maximum image size: 71 cm x 40 cm
    Gamma: 2.20
    DPMS levels: Off
    Undefined display color type
    First detailed timing is the preferred timing
  Color Characteristics:
    Red  : 0.6787, 0.3115
    Green: 0.2529, 0.6210
    Blue : 0.1464, 0.0673
    White: 0.3017, 0.3222
  Established Timings I & II:
    DMT 0x04:   640x480    59.940476 Hz   4:3     31.469 kHz     25.175000 MHz
    DMT 0x09:   800x600    60.316541 Hz   4:3     37.879 kHz     40.000000 MHz
    DMT 0x10:  1024x768    60.003840 Hz   4:3     48.363 kHz     65.000000 MHz
  Standard Timings:
    DMT 0x52:  1920x1080   60.000000 Hz  16:9     67.500 kHz    148.500000 MHz
    DMT 0x2f:  1440x900    59.887445 Hz  16:10    55.935 kHz    106.500000 MHz
    DMT 0x2a:  1400x1050   59.978442 Hz   4:3     65.317 kHz    121.750000 MHz
    DMT 0x23:  1280x1024   60.019740 Hz   5:4     63.981 kHz    108.000000 MHz
    DMT 0x3a:  1680x1050   59.954250 Hz  16:10    65.290 kHz    146.250000 MHz
    DMT 0x53:  1600x900    60.000000 Hz  16:9     60.000 kHz    108.000000 MHz (RB)
  Detailed Timing Descriptors:
    DTD 1:  3840x2160   59.981998 Hz  16:9    133.280 kHz    533.120000 MHz (708 mm x 398 mm)
                 Hfront   48 Hsync  32 Hback   80 Hpol P
                 Vfront    3 Vsync   5 Vback   54 Vpol N
    Display Range Limits:
      Monitor ranges (GTF): 48-60 Hz V, 15-222 kHz H, max dotclock 600 MHz
    Display Product Name: 'GW32F4K60'
    Dummy Descriptor:
  Extension blocks: 1
Checksum: 0xb1

----------------

Block 1, CTA-861 Extension Block:
  Revision: 3
  Underscans IT Video Formats by default
  Basic audio support
  Supports YCbCr 4:4:4
  Supports YCbCr 4:2:2
  Native DTDs: 1
  Video Data Block:
    VIC  16:  1920x1080   60.000000 Hz  16:9     67.500 kHz    148.500000 MHz
    VIC  97:  3840x2160   60.000000 Hz  16:9    135.000 kHz    594.000000 MHz
  Video Capability Data Block:
    YCbCr quantization: Selectable (via AVI YQ)
    RGB quantization: Selectable (via AVI Q)
    PT scan behavior: Always Underscanned
    IT scan behavior: Always Underscanned
    CE scan behavior: Supports both over- and underscan
  Colorimetry Data Block:
    BT2020YCC
    BT2020RGB
    sRGB
  Audio Data Block:
    Linear PCM:
      Max channels: 2
      Supported sample rates (kHz): 192 176.4 96 88.2 48 44.1 32
      Supported sample sizes (bits): 24 20 16
  Speaker Allocation Data Block:
    FL/FR - Front Left/Right
  Vendor-Specific Data Block (HDMI), OUI 00-0C-03:
    Source physical address: 1.0.0.0
    DC_36bit
    DC_30bit
    DC_Y444
  Vendor-Specific Data Block (HDMI Forum), OUI C4-5D-D8:
    Version: 1
    Maximum TMDS Character Rate: 600 MHz
    SCDC Present
    Supports scrambling for <= 340 Mcsc
    Supports 10-bits/component Deep Color 4:2:0 Pixel Encoding
  HDR Static Metadata Data Block:
    Electro optical transfer functions:
      Traditional gamma - SDR luminance range
      Traditional gamma - HDR luminance range
      SMPTE ST2084
    Supported static metadata descriptors:
      Static metadata type 1
    Desired content max luminance: 89 (343.724 cd/m^2)
    Desired content max frame-average luminance: 89 (343.724 cd/m^2)
    Desired content min luminance: 62 (0.203 cd/m^2)
  Detailed Timing Descriptors:
    DTD 2:  2560x1440   59.950550 Hz  16:9     88.787 kHz    241.500000 MHz (708 mm x 398 mm)
                 Hfront   48 Hsync  32 Hback   80 Hpol P
                 Vfront    3 Vsync   5 Vback   33 Vpol N
Checksum: 0x3e  Unused space in Extension Block: 65 bytes

----------------

Warnings:

Block 1, CTA-861 Extension Block:
  Video Data Block: VIC 16 and the first DTD are not identical. Is this intended?

Failures:

EDID:
  Extension Block 2 started with EDID header, ignoring Extension Blocks >= 2.

EDID conformity: FAIL
