edid-decode (hex):

00 ff ff ff ff ff ff 00 30 64 0a 09 01 01 01 01
0f 14 01 03 80 1d 11 78 0a 85 95 99 57 4f 8f 26
21 50 54 00 08 00 01 01 01 01 01 01 01 01 01 01
01 01 01 01 01 01 d2 1b 56 98 50 00 0e 30 1e 3e
24 00 27 a6 10 00 00 18 00 00 00 fd 00 3a 3e 2e
30 07 00 0a 20 20 20 20 20 20 00 00 00 fc 00 4c
54 31 33 33 45 45 30 39 35 30 30 0a 00 00 00 ff
00 41 48 34 52 30 44 30 30 30 36 30 36 0a 00 1a

00 ff ff ff ff ff ff 00 30 64 0a 09 01 01 01 01
0f 14 01 03 80 1d 11 78 0a 85 95 99 57 4f 8f 26
21 50 54 00 08 00 01 01 01 01 01 01 01 01 01 01
01 01 01 01 01 01 d2 1b 56 98 50 00 0e 30 1e 3e
24 00 27 a6 10 00 00 18 00 00 00 fd 00 3a 3e 2e
30 07 00 0a 20 20 20 20 20 20 00 00 00 fc 00 4c
54 31 33 33 45 45 30 39 35 30 30 0a 00 00 00 ff
00 41 48 34 52 30 44 30 30 30 36 30 36 0a 00 1a

----------------

Block 0, Base EDID:
  EDID Structure Version & Revision: 1.3
  Vendor & Product Identification:
    Manufacturer: LCD
    Model: 2314
    Serial Number: ...
    Made in: week 15 of 2010
  Basic Display Parameters & Features:
    Digital display
    Maximum image size: 29 cm x 17 cm
    Gamma: 2.20
    RGB color display
    First detailed timing is the preferred timing
  Color Characteristics:
    Red  : 0.5996, 0.3398
    Green: 0.3095, 0.5595
    Blue : 0.1503, 0.1298
    White: 0.3134, 0.3291
  Established Timings I & II:
    DMT 0x10:  1024x768    60.003840 Hz   4:3     48.363 kHz     65.000000 MHz
  Standard Timings: none
  Detailed Timing Descriptors:
    DTD 1:  1366x768    59.996159 Hz 683:384   46.917 kHz     71.220000 MHz (295 mm x 166 mm)
                 Hfront   30 Hsync  62 Hback   60 Hpol N
                 Vfront    2 Vsync   4 Vback    8 Vpol N
    Display Range Limits:
      Monitor ranges (GTF): 58-62 Hz V, 46-48 kHz H, max dotclock 70 MHz
    Display Product Name: 'LT133EE09500'
    Display Product Serial Number: ...
Checksum: 0x1a

----------------

Warnings:

Block 0, Base EDID:
  Vendor & Product Identification: The serial number is one of the known dummy values, it should probably be set to 0.
EDID:
  Base EDID: Some timings are out of range of the Monitor Ranges:
    Maximum Clock: 71.220 MHz (Monitor: 70.000 MHz)
    Could be due to a Monitor Range off-by-one rounding issue

Failures:

EDID:
  Extension Block 1 started with EDID header, ignoring Extension Blocks >= 1.

EDID conformity: FAIL
