edid-decode (hex):

00 ff ff ff ff ff ff 00 1e d4 02 17 f6 ed cf 01
04 0d 01 02 80 22 1b 78 22 0b 32 9c 5a 4d 8c 26
20 4e 57 bf ee 00 81 40 81 80 71 4f 01 01 01 01
01 01 01 01 01 01 30 2a 00 98 51 00 70 40 00 70
03 00 80 32 11 00 00 1e 00 00 00 fc 00 4c 37 45
48 0a 20 20 20 20 20 20 20 20 00 00 00 fe 00 54
4f 50 52 4f 5f 36 37 34 30 0a 20 20 00 00 00 fe
00 47 56 69 73 69 6f 6e 0a 20 20 20 20 20 01 dc

02 03 1c 71 47 02 11 13 84 1f 10 03 23 09 07 07
83 01 00 00 67 03 0c 00 10 00 00 28 66 21 50 b0
51 00 1b 30 40 70 36 00 0f 48 42 00 00 1e 66 21
56 aa 51 00 1e 30 46 8f 33 00 0f 48 42 00 00 1e
8c 0a d0 8a 20 e0 2d 10 10 3e 96 00 10 09 00 00
00 18 00 00 00 00 00 00 00 00 00 00 00 00 00 00
00 00 00 00 00 00 00 00 00 00 00 00 00 00 00 00
00 00 00 00 00 00 00 00 00 00 00 00 00 00 00 f8

00 ff ff ff ff ff ff 00 1e d4 02 17 f6 ed cf 01
04 0d 01 02 80 22 1b 78 22 0b 32 9c 5a 4d 8c 26
20 4e 57 bf ee 00 81 40 81 80 71 4f 01 01 01 01
01 01 01 01 01 01 30 2a 00 98 51 00 70 40 00 70
03 00 80 32 11 00 00 1e 00 00 00 fc 00 4c 37 45
48 0a 20 20 20 20 20 20 20 20 00 00 00 fe 00 54
4f 50 52 4f 5f 36 37 34 30 0a 20 20 00 00 00 fe
00 47 56 69 73 69 6f 6e 0a 20 20 20 20 20 01 dc

02 03 1c 71 47 02 11 13 84 1f 10 03 23 09 07 07
83 01 00 00 67 03 0c 00 10 00 00 28 66 21 50 b0
51 00 1b 30 40 70 36 00 0f 48 42 00 00 1e 66 21
56 aa 51 00 1e 30 46 8f 33 00 0f 48 42 00 00 1e
8c 0a d0 8a 20 e0 2d 10 10 3e 96 00 10 09 00 00
00 18 00 00 00 00 00 00 00 00 00 00 00 00 00 00
00 00 00 00 00 00 00 00 00 00 00 00 00 00 00 00
00 00 00 00 00 00 00 00 00 00 00 00 00 00 00 f8

----------------

Block 0, Base EDID:
  EDID Structure Version & Revision: 1.2
  Vendor & Product Identification:
    Manufacturer: GVT
    Model: 5890
    Serial Number: ...
    Made in: week 4 of 2003
  Basic Display Parameters & Features:
    Digital display
    Maximum image size: 34 cm x 27 cm
    Gamma: 2.20
    DPMS levels: Off
    Monochrome or grayscale display
    First detailed timing is the preferred timing
  Color Characteristics:
    Red  : 0.6093, 0.3515
    Green: 0.3027, 0.5498
    Blue : 0.1484, 0.1279
    White: 0.3046, 0.3417
  Established Timings I & II:
    IBM     :   720x400    70.081663 Hz   9:5     31.467 kHz     28.320000 MHz
    DMT 0x04:   640x480    59.940476 Hz   4:3     31.469 kHz     25.175000 MHz
    Apple   :   640x480    66.666667 Hz   4:3     35.000 kHz     30.240000 MHz
    DMT 0x05:   640x480    72.808802 Hz   4:3     37.861 kHz     31.500000 MHz
    DMT 0x06:   640x480    75.000000 Hz   4:3     37.500 kHz     31.500000 MHz
    DMT 0x08:   800x600    56.250000 Hz   4:3     35.156 kHz     36.000000 MHz
    DMT 0x09:   800x600    60.316541 Hz   4:3     37.879 kHz     40.000000 MHz
    DMT 0x0a:   800x600    72.187572 Hz   4:3     48.077 kHz     50.000000 MHz
    DMT 0x0b:   800x600    75.000000 Hz   4:3     46.875 kHz     49.500000 MHz
    Apple   :   832x624    74.551266 Hz   4:3     49.726 kHz     57.284000 MHz
    DMT 0x10:  1024x768    60.003840 Hz   4:3     48.363 kHz     65.000000 MHz
    DMT 0x11:  1024x768    70.069359 Hz   4:3     56.476 kHz     75.000000 MHz
    DMT 0x12:  1024x768    75.028582 Hz   4:3     60.023 kHz     78.750000 MHz
  Standard Timings:
    DMT 0x20:  1280x960    60.000000 Hz   4:3     60.000 kHz    108.000000 MHz
    DMT 0x23:  1280x1024   60.019740 Hz   5:4     63.981 kHz    108.000000 MHz
    DMT 0x15:  1152x864    75.000000 Hz   4:3     67.500 kHz    108.000000 MHz
  Detailed Timing Descriptors:
    DTD 1:  1280x1024   56.321340 Hz   5:4     63.981 kHz    108.000000 MHz (384 mm x 306 mm)
                 Hfront    0 Hsync 112 Hback  296 Hpol P
                 Vfront    0 Vsync   3 Vback  109 Vpol P
                   30 2a 00 98 51 00 70 40 00 70 03 00 80 32 11 00 00 1e '0*..Q.p@.p...2....'
    Display Product Name: 'L7EH'
    Alphanumeric Data String: 'TOPRO_6740'
    Alphanumeric Data String: 'GVision'
  Extension blocks: 1
Checksum: 0xdc

----------------

Block 1, CTA-861 Extension Block:
  Revision: 3
  Basic audio support
  Supports YCbCr 4:4:4
  Supports YCbCr 4:2:2
  Native DTDs: 1
  Video Data Block:
    VIC   2:   720x480    59.940060 Hz   4:3     31.469 kHz     27.000000 MHz
    VIC  17:   720x576    50.000000 Hz   4:3     31.250 kHz     27.000000 MHz
    VIC  19:  1280x720    50.000000 Hz  16:9     37.500 kHz     74.250000 MHz
    VIC   4:  1280x720    60.000000 Hz  16:9     45.000 kHz     74.250000 MHz (native)
    VIC  31:  1920x1080   50.000000 Hz  16:9     56.250 kHz    148.500000 MHz
    VIC  16:  1920x1080   60.000000 Hz  16:9     67.500 kHz    148.500000 MHz
    VIC   3:   720x480    59.940060 Hz  16:9     31.469 kHz     27.000000 MHz
  Audio Data Block:
    Linear PCM:
      Max channels: 2
      Supported sample rates (kHz): 48 44.1 32
      Supported sample sizes (bits): 24 20 16
  Speaker Allocation Data Block:
    FL/FR - Front Left/Right
  Vendor-Specific Data Block (HDMI), OUI 00-0C-03:
    Source physical address: 1.0.0.0
    Maximum TMDS clock: 200 MHz
  Detailed Timing Descriptors:
    DTD 2:  1360x768    60.015162 Hz  85:48    47.712 kHz     85.500000 MHz (1039 mm x 584 mm)
                 Hfront   64 Hsync 112 Hback  256 Hpol P
                 Vfront    3 Vsync   6 Vback   18 Vpol P
    DTD 3:  1366x768    59.789541 Hz 683:384   47.712 kHz     85.500000 MHz (1039 mm x 584 mm)
                 Hfront   70 Hsync 143 Hback  213 Hpol P
                 Vfront    3 Vsync   3 Vback   24 Vpol P
    DTD 4:   720x480    59.940060 Hz   3:2     31.469 kHz     27.000000 MHz (16 mm x 9 mm)
                 Hfront   16 Hsync  62 Hback   60 Hpol N
                 Vfront    9 Vsync   6 Vback   30 Vpol N
Checksum: 0xf8  Unused space in Extension Block: 45 bytes

----------------

Warnings:

Block 0, Base EDID:
  EDID Structure Version & Revision: EDID 1.2 is deprecated, do not use.
Block 1, CTA-861 Extension Block:
  IT Video Formats are overscanned by default, but normally this should be underscanned.
  Video Data Block: VIC 2 and the first DTD are not identical. Is this intended?
  Detailed Timing Descriptor #4: Dubious image size (16x9 mm is smaller than 100x100 mm).
  Add a Colorimetry Data Block with the sRGB colorimetry bit set to avoid interop issues.

Failures:

Block 0, Base EDID:
  Detailed Timing Descriptor #1: 0 values in the video timing:
    Horizontal Active/Blanking 1280/408
    Horizontal Frontporch/Sync Width 0/112
    Vertical Active/Blanking 1024/112
    Vertical Frontporch/Sync Width 0/3
  Detailed Timing Descriptor #1: 0 or negative horizontal front porch.
  Detailed Timing Descriptor #1: Mismatch of image size 384x306 mm vs display size 340x270 mm.
Block 1, CTA-861 Extension Block:
  Vendor-Specific Data Block (HDMI), OUI 00-0C-03: The HDMI Specification requires EDID 1.3 instead of 1.2.
  Detailed Timing Descriptor #2: Mismatch of image size 1039x584 mm vs display size 340x270 mm.
  Detailed Timing Descriptor #3: Mismatch of image size 1039x584 mm vs display size 340x270 mm.
  Detailed Timing Descriptor #4: Mismatch of image size 16x9 mm vs display size 340x270 mm.
  Missing VCDB, needed for Set Selectable RGB Quantization to avoid interop issues.
EDID:
  Extension Block 2 started with EDID header, ignoring Extension Blocks >= 2.
  Base EDID: The DTD max image size is 1039x584mm, which is larger than the display size 340.0x270.0mm.
  CTA-861: Native progressive timings are a mix of several resolutions.

EDID conformity: FAIL
