edid-decode (hex):

00 ff ff ff ff ff ff 00 2e 83 02 20 3f 00 00 00
0f 14 01 03 68 2c 19 78 ea f0 65 98 57 51 91 27
21 50 54 a1 08 00 a9 c0 81 c0 01 01 01 01 01 01
01 01 01 01 01 01 31 2e 40 00 62 84 22 30 58 a8
35 00 bb f9 10 00 00 1c 00 00 00 fd 00 38 3f 1f
3c 0c 00 0a 20 20 20 20 20 20 00 00 00 fc 00 32
30 54 35 32 2d 48 2d 45 53 0a 20 20 00 00 00 fe
00 0a 20 20 20 20 20 20 20 20 20 20 20 20 00 97

00 ff ff ff ff ff ff 00 2e 83 02 20 3f 00 00 00
0f 14 01 03 68 2c 19 78 ea f0 65 98 57 51 91 27
21 50 54 a1 08 00 a9 c0 81 c0 01 01 01 01 01 01
01 01 01 01 01 01 31 2e 40 00 62 84 22 30 58 a8
35 00 bb f9 10 00 00 1c 00 00 00 fd 00 38 3f 1f
3c 0c 00 0a 20 20 20 20 20 20 00 00 00 fc 00 32
30 54 35 32 2d 48 2d 45 53 0a 20 20 00 00 00 fe
00 0a 20 20 20 20 20 20 20 20 20 20 20 20 00 97

----------------

Block 0, Base EDID:
  EDID Structure Version & Revision: 1.3
  Vendor & Product Identification:
    Manufacturer: KTC
    Model: 8194
    Serial Number: ...
    Made in: week 15 of 2010
  Basic Display Parameters & Features:
    Analog display
    Signal Level Standard: 0.700 : 0.000 : 0.700 V p-p
    Blank level equals black level
    Sync: Separate
    Maximum image size: 44 cm x 25 cm
    Gamma: 2.20
    DPMS levels: Standby Suspend Off
    RGB color display
    First detailed timing is the preferred timing
  Color Characteristics:
    Red  : 0.5966, 0.3427
    Green: 0.3164, 0.5664
    Blue : 0.1533, 0.1308
    White: 0.3134, 0.3291
  Established Timings I & II:
    IBM     :   720x400    70.081663 Hz   9:5     31.467 kHz     28.320000 MHz
    DMT 0x04:   640x480    59.940476 Hz   4:3     31.469 kHz     25.175000 MHz
    DMT 0x09:   800x600    60.316541 Hz   4:3     37.879 kHz     40.000000 MHz
    DMT 0x10:  1024x768    60.003840 Hz   4:3     48.363 kHz     65.000000 MHz
  Standard Timings:
    DMT 0x53:  1600x900    60.000000 Hz  16:9     60.000 kHz    108.000000 MHz (RB)
    DMT 0x55:  1280x720    60.000000 Hz  16:9     45.000 kHz     74.250000 MHz
  Detailed Timing Descriptors:
    DTD 1:  1600x900    59.946021 Hz  16:9     55.990 kHz    118.250000 MHz (443 mm x 249 mm)
                 Hfront   88 Hsync 168 Hback  256 Hpol N
                 Vfront    3 Vsync   5 Vback   26 Vpol P
    Display Range Limits:
      Monitor ranges (GTF): 56-63 Hz V, 31-60 kHz H, max dotclock 120 MHz
    Display Product Name: '20T52-H-ES'
    Alphanumeric Data String: ''
Checksum: 0x97

----------------

Warnings:

EDID:
  Base EDID: Some timings are out of range of the Monitor Ranges:
    Vertical Freq: 59.940 - 70.082 Hz (Monitor: 56.000 - 63.000 Hz)

Failures:

Block 0, Base EDID:
  Alphanumeric Data String: Empty string.
EDID:
  Extension Block 1 started with EDID header, ignoring Extension Blocks >= 1.

EDID conformity: FAIL
