edid-decode (hex):

00 ff ff ff ff ff ff 00 22 83 3c 01 00 00 00 00
01 1c 01 03 68 10 09 78 0a dc 51 a8 53 47 97 23
1a 4f 58 a1 09 00 81 80 01 01 01 01 01 00 01 01
01 01 01 01 01 01 02 3a 80 18 71 38 2d 40 58 2c
45 00 7e 8a 42 00 00 1e 0e 1f 00 80 51 00 1e 30
40 80 37 00 7e 8a 42 00 00 1c 00 00 00 f0 00 3b
4c 1f 50 0f 00 0a 20 20 20 20 20 20 00 00 00 fc
00 34 30 43 33 31 31 0a 20 20 20 20 20 20 00 d9

00 ff ff ff ff ff ff 00 22 83 3c 01 00 00 00 00
01 1c 01 03 68 10 09 78 0a dc 51 a8 53 47 97 23
1a 4f 58 a1 09 00 81 80 01 01 01 01 01 00 01 01
01 01 01 01 01 01 02 3a 80 18 71 38 2d 40 58 2c
45 00 7e 8a 42 00 00 1e 0e 1f 00 80 51 00 1e 30
40 80 37 00 7e 8a 42 00 00 1c 00 00 00 f0 00 3b
4c 1f 50 0f 00 0a 20 20 20 20 20 20 00 00 00 fc
00 34 30 43 33 31 31 0a 20 20 20 20 20 20 00 d9

----------------

Block 0, Base EDID:
  EDID Structure Version & Revision: 1.3
  Vendor & Product Identification:
    Manufacturer: HTC
    Model: 316
    Made in: week 1 of 2018
  Basic Display Parameters & Features:
    Analog display
    Signal Level Standard: 0.700 : 0.000 : 0.700 V p-p
    Blank level equals black level
    Sync: Separate
    Maximum image size: 16 cm x 9 cm
    Gamma: 2.20
    RGB color display
    First detailed timing is the preferred timing
  Color Characteristics:
    Red  : 0.6591, 0.3251
    Green: 0.2802, 0.5898
    Blue : 0.1376, 0.1025
    White: 0.3085, 0.3447
  Established Timings I & II:
    IBM     :   720x400    70.081663 Hz   9:5     31.467 kHz     28.320000 MHz
    DMT 0x04:   640x480    59.940476 Hz   4:3     31.469 kHz     25.175000 MHz
    DMT 0x09:   800x600    60.316541 Hz   4:3     37.879 kHz     40.000000 MHz
    DMT 0x10:  1024x768    60.003840 Hz   4:3     48.363 kHz     65.000000 MHz
    DMT 0x24:  1280x1024   75.024675 Hz   5:4     79.976 kHz    135.000000 MHz
  Standard Timings:
    DMT 0x23:  1280x1024   60.019740 Hz   5:4     63.981 kHz    108.000000 MHz
  Detailed Timing Descriptors:
    DTD 1:  1920x1080   60.000000 Hz  16:9     67.500 kHz    148.500000 MHz (1150 mm x 650 mm)
                 Hfront   88 Hsync  44 Hback  148 Hpol P
                 Vfront    4 Vsync   5 Vback   36 Vpol P
    DTD 2:  1280x768    59.870228 Hz   5:3     47.776 kHz     79.500000 MHz (1150 mm x 650 mm)
                 Hfront   64 Hsync 128 Hback  192 Hpol N
                 Vfront    3 Vsync   7 Vback   20 Vpol P
    Unknown Display Descriptor (0xf0): 00 f0 00 3b 4c 1f 50 0f 00 0a 20 20 20 20 20 20 '...;L.P...      '
    Display Product Name: '40C311'
Checksum: 0xd9

----------------

Warnings:

Block 0, Base EDID:
  Basic Display Parameters & Features: Dubious maximum image size (16x9 is smaller than 10x10 cm).
  Detailed Timing Descriptor #2: Image size is 1150x650 mm, but based on the picture AR it should be 1083x650 mm.

Failures:

Block 0, Base EDID:
  Standard Timings: Use 0x0101 as the invalid Standard Timings code, not 0x0100.
  Detailed Timing Descriptor #1: Mismatch of image size 1150x650 mm vs display size 160x90 mm.
  Detailed Timing Descriptor #2: Mismatch of image size 1150x650 mm vs display size 160x90 mm.
  Display Descriptor #3: Unknown Type 0xf0.
  Missing Display Range Limits Descriptor.
EDID:
  Extension Block 1 started with EDID header, ignoring Extension Blocks >= 1.
  Base EDID: The DTD max image size is 1150x650mm, which is larger than the display size 160.0x90.0mm.

EDID conformity: FAIL
