edid-decode (hex):

00 ff ff ff ff ff ff 00 2b 03 4c 09 59 01 00 00
2d 20 01 03 80 35 1d 78 0a f2 51 a3 57 53 a1 27
0d 50 54 b7 ef 80 81 40 81 80 81 00 a9 c0 95 00
a9 40 b3 00 81 cf 02 3a 80 18 71 38 2d 40 58 2c
45 00 0f 29 21 00 00 1e 66 21 50 b0 51 00 1b 30
40 70 36 00 0f 29 21 00 00 26 00 00 00 fd 00 32
4b 1c 58 13 00 0a 20 20 20 20 20 20 00 00 00 fc
00 4c 45 44 20 4d 4f 4e 49 54 4f 52 0a 20 01 67

02 03 1e f1 4a 90 1f 05 14 04 13 12 03 16 07 23
09 07 07 83 01 00 00 66 03 0c 00 10 00 80 2a 44
80 a0 70 38 27 40 30 20 35 00 0f 28 21 00 00 1e
01 1d 80 d0 72 1c 16 20 10 2c 25 80 dc 0c 11 00
00 9e 01 1d 00 bc 52 d0 1e 20 b8 28 55 40 dc 0c
11 00 00 1e 8c 0a d0 90 20 40 31 20 0c c0 55 00
dc 0c 11 00 00 18 8c 0a d0 8a 20 e0 2d 10 10 3e
96 00 dc 0c 11 00 00 18 00 00 00 00 00 00 00 cb

00 ff ff ff ff ff ff 00 2b 03 4c 09 59 01 00 00
2d 20 01 03 80 35 1d 78 0a f2 51 a3 57 53 a1 27
0d 50 54 b7 ef 80 81 40 81 80 81 00 a9 c0 95 00
a9 40 b3 00 81 cf 02 3a 80 18 71 38 2d 40 58 2c
45 00 0f 29 21 00 00 1e 66 21 50 b0 51 00 1b 30
40 70 36 00 0f 29 21 00 00 26 00 00 00 fd 00 32
4b 1c 58 13 00 0a 20 20 20 20 20 20 00 00 00 fc
00 4c 45 44 20 4d 4f 4e 49 54 4f 52 0a 20 01 67

02 03 1e f1 4a 90 1f 05 14 04 13 12 03 16 07 23
09 07 07 83 01 00 00 66 03 0c 00 10 00 80 2a 44
80 a0 70 38 27 40 30 20 35 00 0f 28 21 00 00 1e
01 1d 80 d0 72 1c 16 20 10 2c 25 80 dc 0c 11 00
00 9e 01 1d 00 bc 52 d0 1e 20 b8 28 55 40 dc 0c
11 00 00 1e 8c 0a d0 90 20 40 31 20 0c c0 55 00
dc 0c 11 00 00 18 8c 0a d0 8a 20 e0 2d 10 10 3e
96 00 dc 0c 11 00 00 18 00 00 00 00 00 00 00 cb

----------------

Block 0, Base EDID:
  EDID Structure Version & Revision: 1.3
  Vendor & Product Identification:
    Manufacturer: JXC
    Model: 2380
    Serial Number: ...
    Made in: week 45 of 2022
  Basic Display Parameters & Features:
    Digital display
    Maximum image size: 53 cm x 29 cm
    Gamma: 2.20
    RGB color display
    First detailed timing is the preferred timing
  Color Characteristics:
    Red  : 0.6396, 0.3427
    Green: 0.3242, 0.6308
    Blue : 0.1533, 0.0517
    White: 0.3125, 0.3291
  Established Timings I & II:
    IBM     :   720x400    70.081663 Hz   9:5     31.467 kHz     28.320000 MHz
    DMT 0x04:   640x480    59.940476 Hz   4:3     31.469 kHz     25.175000 MHz
    Apple   :   640x480    66.666667 Hz   4:3     35.000 kHz     30.240000 MHz
    DMT 0x06:   640x480    75.000000 Hz   4:3     37.500 kHz     31.500000 MHz
    DMT 0x08:   800x600    56.250000 Hz   4:3     35.156 kHz     36.000000 MHz
    DMT 0x09:   800x600    60.316541 Hz   4:3     37.879 kHz     40.000000 MHz
    DMT 0x0a:   800x600    72.187572 Hz   4:3     48.077 kHz     50.000000 MHz
    DMT 0x0b:   800x600    75.000000 Hz   4:3     46.875 kHz     49.500000 MHz
    Apple   :   832x624    74.551266 Hz   4:3     49.726 kHz     57.284000 MHz
    DMT 0x10:  1024x768    60.003840 Hz   4:3     48.363 kHz     65.000000 MHz
    DMT 0x11:  1024x768    70.069359 Hz   4:3     56.476 kHz     75.000000 MHz
    DMT 0x12:  1024x768    75.028582 Hz   4:3     60.023 kHz     78.750000 MHz
    DMT 0x24:  1280x1024   75.024675 Hz   5:4     79.976 kHz    135.000000 MHz
    Apple   :  1152x870    75.061550 Hz 192:145   68.681 kHz    100.000000 MHz
  Standard Timings:
    DMT 0x20:  1280x960    60.000000 Hz   4:3     60.000 kHz    108.000000 MHz
    DMT 0x23:  1280x1024   60.019740 Hz   5:4     63.981 kHz    108.000000 MHz
    DMT 0x1c:  1280x800    59.810326 Hz  16:10    49.702 kHz     83.500000 MHz
    DMT 0x53:  1600x900    60.000000 Hz  16:9     60.000 kHz    108.000000 MHz (RB)
    DMT 0x2f:  1440x900    59.887445 Hz  16:10    55.935 kHz    106.500000 MHz
    DMT 0x33:  1600x1200   60.000000 Hz   4:3     75.000 kHz    162.000000 MHz
    DMT 0x3a:  1680x1050   59.954250 Hz  16:10    65.290 kHz    146.250000 MHz
    GTF     :  1280x720    74.999686 Hz  16:9     56.400 kHz     95.654000 MHz
  Detailed Timing Descriptors:
    DTD 1:  1920x1080   60.000000 Hz  16:9     67.500 kHz    148.500000 MHz (527 mm x 297 mm)
                 Hfront   88 Hsync  44 Hback  148 Hpol P
                 Vfront    4 Vsync   5 Vback   36 Vpol P
    DTD 2:  1360x768    60.015162 Hz  85:48    47.712 kHz     85.500000 MHz (analog composite, serrate, field sequential L/R, 527 mm x 297 mm)
                 Hfront   64 Hsync 112 Hback  256 Hpol N
                 Vfront    3 Vsync   6 Vback   18 Vpol N
    Display Range Limits:
      Monitor ranges (GTF): 50-75 Hz V, 28-88 kHz H, max dotclock 190 MHz
    Display Product Name: 'LED MONITOR'
  Extension blocks: 1
Checksum: 0x67

----------------

Block 1, CTA-861 Extension Block:
  Revision: 3
  Underscans IT Video Formats by default
  Basic audio support
  Supports YCbCr 4:4:4
  Supports YCbCr 4:2:2
  Native DTDs: 1
  Video Data Block:
    VIC  16:  1920x1080   60.000000 Hz  16:9     67.500 kHz    148.500000 MHz (native)
    VIC  31:  1920x1080   50.000000 Hz  16:9     56.250 kHz    148.500000 MHz
    VIC   5:  1920x1080i  60.000000 Hz  16:9     33.750 kHz     74.250000 MHz
    VIC  20:  1920x1080i  50.000000 Hz  16:9     28.125 kHz     74.250000 MHz
    VIC   4:  1280x720    60.000000 Hz  16:9     45.000 kHz     74.250000 MHz
    VIC  19:  1280x720    50.000000 Hz  16:9     37.500 kHz     74.250000 MHz
    VIC  18:   720x576    50.000000 Hz  16:9     31.250 kHz     27.000000 MHz
    VIC   3:   720x480    59.940060 Hz  16:9     31.469 kHz     27.000000 MHz
    VIC  22:  1440x576i   50.000000 Hz  16:9     15.625 kHz     27.000000 MHz
    VIC   7:  1440x480i   59.940060 Hz  16:9     15.734 kHz     27.000000 MHz
  Audio Data Block:
    Linear PCM:
      Max channels: 2
      Supported sample rates (kHz): 48 44.1 32
      Supported sample sizes (bits): 24 20 16
  Speaker Allocation Data Block:
    FL/FR - Front Left/Right
  Vendor-Specific Data Block (HDMI), OUI 00-0C-03:
    Source physical address: 1.0.0.0
    Supports_AI
  Detailed Timing Descriptors:
    DTD 3:  1920x1080   74.972503 Hz  16:9     83.894 kHz    174.500000 MHz (527 mm x 296 mm)
                 Hfront   48 Hsync  32 Hback   80 Hpol P
                 Vfront    3 Vsync   5 Vback   31 Vpol P
    DTD 4:  1920x1080i  50.000000 Hz  16:9     28.125 kHz     74.250000 MHz (476 mm x 268 mm)
                 Hfront  528 Hsync  44 Hback  148 Hpol P
                 Vfront    2 Vsync   5 Vback   15 Vpol P Vfront +0.5 Odd Field
                 Vfront    2 Vsync   5 Vback   15 Vpol P Vback  +0.5 Even Field
    DTD 5:  1280x720    50.000000 Hz  16:9     37.500 kHz     74.250000 MHz (476 mm x 268 mm)
                 Hfront  440 Hsync  40 Hback  220 Hpol P
                 Vfront    5 Vsync   5 Vback   20 Vpol P
    DTD 6:   720x576    50.000000 Hz   5:4     31.250 kHz     27.000000 MHz (476 mm x 268 mm)
                 Hfront   12 Hsync 192 Hback  -60 Hpol N
                 Vfront    5 Vsync   5 Vback   39 Vpol N
    DTD 7:   720x480    59.940060 Hz   3:2     31.469 kHz     27.000000 MHz (476 mm x 268 mm)
                 Hfront   16 Hsync  62 Hback   60 Hpol N
                 Vfront    9 Vsync   6 Vback   30 Vpol N
Checksum: 0xcb  Unused space in Extension Block: 7 bytes

----------------

Warnings:

Block 0, Base EDID:
  Detailed Timing Descriptor #2: DTD is similar but not identical to DMT 0x27.
Block 1, CTA-861 Extension Block:
  Detailed Timing Descriptor #6: DTD is similar but not identical to VIC 17.
  Detailed Timing Descriptor #6: Image size is 476x268 mm, but based on the picture AR it should be 335x268 mm.
  Detailed Timing Descriptor #7: Image size is 476x268 mm, but based on the picture AR it should be 402x268 mm.
  Add a Colorimetry Data Block with the sRGB colorimetry bit set to avoid interop issues.
EDID:
  Base EDID: Some timings are out of range of the Monitor Ranges:
    Horizontal Freq: 15.625 - 83.894 kHz (Monitor: 28.000 - 88.000 kHz)

Failures:

Block 1, CTA-861 Extension Block:
  Detailed Timing Descriptor #4: Mismatch of image size 476x268 mm vs display size 530x290 mm.
  Detailed Timing Descriptor #5: Mismatch of image size 476x268 mm vs display size 530x290 mm.
  Detailed Timing Descriptor #6: 0 or negative horizontal back porch.
  Detailed Timing Descriptor #6: Mismatch of image size 476x268 mm vs display size 530x290 mm.
  Detailed Timing Descriptor #7: Mismatch of image size 476x268 mm vs display size 530x290 mm.
  Missing VCDB, needed for Set Selectable RGB Quantization to avoid interop issues.
EDID:
  Extension Block 2 started with EDID header, ignoring Extension Blocks >= 2.

EDID conformity: FAIL
