edid-decode (hex):

00 ff ff ff ff ff ff 00 09 e5 ff 09 00 00 00 00
0a 1f 01 04 a5 1d 11 78 02 66 a5 a7 53 4c a0 26
0f 50 54 00 00 00 01 01 01 01 01 01 01 01 01 01
01 01 01 01 01 01 2a 36 80 a0 70 38 1f 40 30 20
35 00 26 a5 10 00 00 1a 52 2b 80 a0 70 38 1f 40
30 20 35 00 26 a5 10 00 00 1a 00 00 00 fe 00 44
56 35 36 54 80 4e 45 31 33 33 46 48 00 00 00 00
00 02 41 21 9e 00 11 00 00 0a 01 0a 20 20 00 a5

00 ff ff ff ff ff ff 00 09 e5 ff 09 00 00 00 00
0a 1f 01 04 a5 1d 11 78 02 66 a5 a7 53 4c a0 26
0f 50 54 00 00 00 01 01 01 01 01 01 01 01 01 01
01 01 01 01 01 01 2a 36 80 a0 70 38 1f 40 30 20
35 00 26 a5 10 00 00 1a 52 2b 80 a0 70 38 1f 40
30 20 35 00 26 a5 10 00 00 1a 00 00 00 fe 00 44
56 35 36 54 80 4e 45 31 33 33 46 48 00 00 00 00
00 02 41 21 9e 00 11 00 00 0a 01 0a 20 20 00 a5

----------------

Block 0, Base EDID:
  EDID Structure Version & Revision: 1.4
  Vendor & Product Identification:
    Manufacturer: BOE
    Model: 2559
    Made in: week 10 of 2021
  Basic Display Parameters & Features:
    Digital display
    Bits per primary color channel: 8
    DisplayPort interface
    Maximum image size: 29 cm x 17 cm
    Gamma: 2.20
    Supported color formats: RGB 4:4:4
    First detailed timing includes the native pixel format and preferred refresh rate
  Color Characteristics:
    Red  : 0.6533, 0.3261
    Green: 0.2978, 0.6269
    Blue : 0.1503, 0.0605
    White: 0.3134, 0.3291
  Established Timings I & II: none
  Standard Timings: none
  Detailed Timing Descriptors:
    DTD 1:  1920x1080   60.003116 Hz  16:9     66.663 kHz    138.660000 MHz (294 mm x 165 mm)
                 Hfront   48 Hsync  32 Hback   80 Hpol P
                 Vfront    3 Vsync   5 Vback   23 Vpol N
    DTD 2:  1920x1080   47.990376 Hz  16:9     53.317 kHz    110.900000 MHz (294 mm x 165 mm)
                 Hfront   48 Hsync  32 Hback   80 Hpol P
                 Vfront    3 Vsync   5 Vback   23 Vpol N
    Alphanumeric Data String: 'DV56T.NE133FH'
    Manufacturer-Specified Display Descriptor (0x00): 00 00 00 02 41 21 9e 00 11 00 00 0a 01 0a 20 20 '....A!........  '
Checksum: 0xa5

----------------

Warnings:

Block 0, Base EDID:
  Alphanumeric Data String: Non-ASCII character 0x80 at position 5, can cause problems.
  Missing Display Product Name.

Failures:

EDID:
  Extension Block 1 started with EDID header, ignoring Extension Blocks >= 1.

EDID conformity: FAIL
