edid-decode (hex):

00 ff ff ff ff ff ff 00 06 af ed 80 00 00 00 00
0f 1c 01 04 a5 22 13 78 02 6a 75 a4 56 52 9c 27
0b 50 54 00 00 00 01 01 01 01 01 01 01 01 01 01
01 01 01 01 01 01 ce 8f 80 b6 70 38 88 40 30 20
a5 00 58 c2 10 00 00 1a 00 00 00 00 00 00 00 00
00 00 00 00 00 00 00 00 00 00 00 00 00 fe 00 4b
30 35 35 47 80 42 31 35 36 48 41 4e 00 00 00 00
00 02 41 0f 9e 00 11 00 00 0b 01 0a 20 20 00 c1

----------------

Block 0, Base EDID:
  EDID Structure Version & Revision: 1.4
  Vendor & Product Identification:
    Manufacturer: AUO
    Model: 33005
    Made in: week 15 of 2018
  Basic Display Parameters & Features:
    Digital display
    Bits per primary color channel: 8
    DisplayPort interface
    Maximum image size: 34 cm x 19 cm
    Gamma: 2.20
    Supported color formats: RGB 4:4:4
    First detailed timing includes the native pixel format and preferred refresh rate
  Color Characteristics:
    Red  : 0.6416, 0.3378
    Green: 0.3222, 0.6113
    Blue : 0.1533, 0.0458
    White: 0.3134, 0.3291
  Established Timings I & II: none
  Standard Timings: none
  Detailed Timing Descriptors:
    DTD 1:  1920x1080  144.027931 Hz  16:9    175.138 kHz    368.140000 MHz (344 mm x 194 mm)
                 Hfront   48 Hsync  32 Hback  102 Hpol P
                 Vfront   10 Vsync   5 Vback  121 Vpol N
    Empty Descriptor
    Alphanumeric Data String: 'K055G.B156HAN'
    Manufacturer-Specified Display Descriptor (0x00): 00 00 00 02 41 0f 9e 00 11 00 00 0b 01 0a 20 20 '....A.........  '
Checksum: 0xc1

----------------

Warnings:

Block 0, Base EDID:
  Alphanumeric Data String: Non-ASCII character 0x80 at position 5, can cause problems.
  Missing Display Product Name.

Failures:

Block 0, Base EDID:
  Empty Descriptor: Use Dummy Descriptor instead of all zeroes.

EDID conformity: FAIL
