edid-decode (hex):

00 ff ff ff ff ff ff 00 06 af ed 80 00 00 00 00
0f 1c 01 04 a5 22 13 78 03 6a 75 a4 56 52 9c 27
0b 50 54 00 00 00 01 01 01 01 01 01 01 01 01 01
01 01 01 01 01 01 ce 8f 80 b6 70 38 88 40 30 20
a5 00 e0 0e 11 00 00 1a 00 00 00 fd 00 3c 90 af
af 25 01 0a 20 20 20 20 20 20 00 00 00 10 00 00
00 00 00 00 00 00 00 00 00 00 00 00 00 00 00 10
00 00 00 00 00 00 00 00 00 00 00 00 00 00 01 69

02 03 0d 00 68 1a 00 00 01 01 3c 90 00 00 00 00
00 00 00 00 00 00 00 00 00 00 00 00 00 00 00 00
00 00 00 00 00 00 00 00 00 00 00 00 00 00 00 00
00 00 00 00 00 00 00 00 00 00 00 00 00 00 00 00
00 00 00 00 00 00 00 00 00 00 00 00 00 00 00 00
00 00 00 00 00 00 00 00 00 00 00 00 00 00 00 00
00 00 00 00 00 00 00 00 00 00 00 00 00 00 00 00
00 00 00 00 00 00 00 00 00 00 00 00 00 00 00 9e

00 ff ff ff ff ff ff 00 06 af ed 80 00 00 00 00
0f 1c 01 04 a5 22 13 78 03 6a 75 a4 56 52 9c 27
0b 50 54 00 00 00 01 01 01 01 01 01 01 01 01 01
01 01 01 01 01 01 ce 8f 80 b6 70 38 88 40 30 20
a5 00 e0 0e 11 00 00 1a 00 00 00 fd 00 3c 90 af
af 25 01 0a 20 20 20 20 20 20 00 00 00 10 00 00
00 00 00 00 00 00 00 00 00 00 00 00 00 00 00 10
00 00 00 00 00 00 00 00 00 00 00 00 00 00 01 69

02 03 0d 00 68 1a 00 00 01 01 3c 90 00 00 00 00
00 00 00 00 00 00 00 00 00 00 00 00 00 00 00 00
00 00 00 00 00 00 00 00 00 00 00 00 00 00 00 00
00 00 00 00 00 00 00 00 00 00 00 00 00 00 00 00
00 00 00 00 00 00 00 00 00 00 00 00 00 00 00 00
00 00 00 00 00 00 00 00 00 00 00 00 00 00 00 00
00 00 00 00 00 00 00 00 00 00 00 00 00 00 00 00
00 00 00 00 00 00 00 00 00 00 00 00 00 00 00 9e

----------------

Block 0, Base EDID:
  EDID Structure Version & Revision: 1.4
  Vendor & Product Identification:
    Manufacturer: AUO
    Model: 33005
    Made in: week 15 of 2018
  Basic Display Parameters & Features:
    Digital display
    Bits per primary color channel: 8
    DisplayPort interface
    Maximum image size: 34 cm x 19 cm
    Gamma: 2.20
    Supported color formats: RGB 4:4:4
    First detailed timing includes the native pixel format and preferred refresh rate
    Display supports continuous frequencies
  Color Characteristics:
    Red  : 0.6416, 0.3378
    Green: 0.3222, 0.6113
    Blue : 0.1533, 0.0458
    White: 0.3134, 0.3291
  Established Timings I & II: none
  Standard Timings: none
  Detailed Timing Descriptors:
    DTD 1:  1920x1080  144.027931 Hz  16:9    175.138 kHz    368.140000 MHz (480 mm x 270 mm)
                 Hfront   48 Hsync  32 Hback  102 Hpol P
                 Vfront   10 Vsync   5 Vback  121 Vpol N
    Display Range Limits:
      Monitor ranges (Range Limits Only): 60-144 Hz V, 175-175 kHz H, max dotclock 370 MHz
    Dummy Descriptor:
    Dummy Descriptor:
  Extension blocks: 1
Checksum: 0x69

----------------

Block 1, CTA-861 Extension Block:
  Revision: 3
  Native DTDs: 0
  Vendor-Specific Data Block (AMD), OUI 00-00-1A:
    Version: 1
    Feature Caps: 0x01
    Minimum Refresh Rate: 60 Hz
    Maximum Refresh Rate: 144 Hz
    Flags 1.x: 0x00
Checksum: 0x9e  Unused space in Extension Block: 114 bytes

----------------

Warnings:

Block 0, Base EDID:
  Missing Display Product Name.
Block 1, CTA-861 Extension Block:
  IT Video Formats are overscanned by default, but normally this should be underscanned.
  Add a Colorimetry Data Block with the sRGB colorimetry bit set to avoid interop issues.

Failures:

Block 0, Base EDID:
  Detailed Timing Descriptor #1: Mismatch of image size 480x270 mm vs display size 340x190 mm.
Block 1, CTA-861 Extension Block:
  Required 640x480p60 timings are missing in the established timings and the SVD list (VIC 1).
  Missing VCDB, needed for Set Selectable RGB Quantization to avoid interop issues.
EDID:
  Extension Block 2 started with EDID header, ignoring Extension Blocks >= 2.
  Base EDID: The DTD max image size is 480x270mm, which is larger than the display size 340.0x190.0mm.

EDID conformity: FAIL
