edid-decode (hex):

00 ff ff ff ff ff ff 00 48 61 22 05 00 00 00 00
0c 12 01 03 64 28 1e 78 0a d2 55 a3 54 45 99 26
0f 48 4c 21 08 00 01 01 01 01 01 01 01 01 01 01
01 01 01 01 01 01 64 19 00 40 41 00 26 30 18 88
36 00 90 2c 11 00 00 18 01 1d 00 72 51 d0 1e 20
6e 28 55 00 7f 88 42 00 00 9a 01 1d 80 18 71 1c
16 20 58 2c 25 00 7f 88 42 00 00 9e 00 00 00 fc
00 52 43 41 0a 20 20 20 20 20 20 20 20 20 00 19

00 ff ff ff ff ff ff 00 48 61 22 05 00 00 00 00
0c 12 01 03 64 28 1e 78 0a d2 55 a3 54 45 99 26
0f 48 4c 21 08 00 01 01 01 01 01 01 01 01 01 01
01 01 01 01 01 01 64 19 00 40 41 00 26 30 18 88
36 00 90 2c 11 00 00 18 01 1d 00 72 51 d0 1e 20
6e 28 55 00 7f 88 42 00 00 9a 01 1d 80 18 71 1c
16 20 58 2c 25 00 7f 88 42 00 00 9e 00 00 00 fc
00 52 43 41 0a 20 20 20 20 20 20 20 20 20 00 19

----------------

Block 0, Base EDID:
  EDID Structure Version & Revision: 1.3
  Vendor & Product Identification:
    Manufacturer: RCA
    Model: 1314
    Made in: week 12 of 2008
  Basic Display Parameters & Features:
    Analog display
    Signal Level Standard: 0.700 : 0.000 : 0.700 V p-p
    Blank level equals black level
    Sync: Composite
    Maximum image size: 40 cm x 30 cm
    Gamma: 2.20
    RGB color display
    First detailed timing is the preferred timing
  Color Characteristics:
    Red  : 0.6396, 0.3291
    Green: 0.2695, 0.5996
    Blue : 0.1494, 0.0595
    White: 0.2822, 0.2978
  Established Timings I & II:
    DMT 0x04:   640x480    59.940476 Hz   4:3     31.469 kHz     25.175000 MHz
    DMT 0x09:   800x600    60.316541 Hz   4:3     37.879 kHz     40.000000 MHz
    DMT 0x10:  1024x768    60.003840 Hz   4:3     48.363 kHz     65.000000 MHz
  Standard Timings: none
  Detailed Timing Descriptors:
    DTD 1:  1024x768    60.003840 Hz   4:3     48.363 kHz     65.000000 MHz (400 mm x 300 mm)
                 Hfront   24 Hsync 136 Hback  160 Hpol N
                 Vfront    3 Vsync   6 Vback   29 Vpol N
    DTD 2:  1280x1440i  59.960027 Hz   8:9     45.000 kHz     74.250000 MHz (1151 mm x 648 mm)
                 Hfront  110 Hsync  40 Hback  220 Hpol P
                 Vfront    5 Vsync   5 Vback   20 Vpol N Vfront +0.5 Odd Field
                 Vfront    5 Vsync   5 Vback   20 Vpol N Vback  +0.5 Even Field
    DTD 3:  1920x1080i  60.000000 Hz  16:9     33.750 kHz     74.250000 MHz (1151 mm x 648 mm)
                 Hfront   88 Hsync  44 Hback  148 Hpol P
                 Vfront    2 Vsync   5 Vback   15 Vpol P Vfront +0.5 Odd Field
                 Vfront    2 Vsync   5 Vback   15 Vpol P Vback  +0.5 Even Field
    Display Product Name: 'RCA'
Checksum: 0x19

----------------

Warnings:

Block 0, Base EDID:
  Detailed Timing Descriptor #2: Image size is 1151x648 mm, but based on the picture AR it should be 576x648 mm.

Failures:

Block 0, Base EDID:
  Detailed Timing Descriptor #2: Mismatch of image size 1151x648 mm vs display size 400x300 mm.
  Detailed Timing Descriptor #3: Mismatch of image size 1151x648 mm vs display size 400x300 mm.
  Missing Display Range Limits Descriptor.
EDID:
  Extension Block 1 started with EDID header, ignoring Extension Blocks >= 1.
  Base EDID: The DTD max image size is 1151x648mm, which is larger than the display size 400.0x300.0mm.

EDID conformity: FAIL
