edid-decode (hex):

00 ff ff ff ff ff ff 00 04 62 9b 04 00 00 00 00
14 15 01 03 80 3c 22 78 2a 2e 2d a7 55 4d 9e 26
0c 4e 53 00 00 00 00 44 00 04 00 44 00 84 00 04
00 04 00 c4 00 c4 56 5e 00 a0 a0 a0 29 50 30 20
35 00 55 50 21 00 00 1a 00 00 00 fd 00 38 3d 1e
5b 19 00 0a 20 20 20 20 20 20 00 00 00 fc 00 51
48 44 32 37 30 0a 20 20 20 20 20 20 00 00 00 ff
00 0a 20 20 20 20 20 20 20 20 20 20 20 20 00 9a

00 ff ff ff ff ff ff 00 04 62 9b 04 00 00 00 00
14 15 01 03 80 3c 22 78 2a 2e 2d a7 55 4d 9e 26
0c 4e 53 00 00 00 00 44 00 04 00 44 00 84 00 04
00 04 00 c4 00 c4 56 5e 00 a0 a0 a0 29 50 30 20
35 00 55 50 21 00 00 1a 00 00 00 fd 00 38 3d 1e
5b 19 00 0a 20 20 20 20 20 20 00 00 00 fc 00 51
48 44 32 37 30 0a 20 20 20 20 20 20 00 00 00 ff
00 0a 20 20 20 20 20 20 20 20 20 20 20 20 00 9a

----------------

Block 0, Base EDID:
  EDID Structure Version & Revision: 1.3
  Vendor & Product Identification:
    Manufacturer: ACB
    Model: 1179
    Made in: week 20 of 2011
  Basic Display Parameters & Features:
    Digital display
    Maximum image size: 60 cm x 34 cm
    Gamma: 2.20
    DPMS levels: Off
    RGB color display
    First detailed timing is the preferred timing
  Color Characteristics:
    Red  : 0.6523, 0.3339
    Green: 0.3037, 0.6191
    Blue : 0.1484, 0.0488
    White: 0.3076, 0.3251
  Established Timings I & II: none
  Standard Timings:
  Detailed Timing Descriptors:
    DTD 1:  2560x1440   59.950550 Hz  16:9     88.787 kHz    241.500000 MHz (597 mm x 336 mm)
                 Hfront   48 Hsync  32 Hback   80 Hpol P
                 Vfront    3 Vsync   5 Vback   33 Vpol N
    Display Range Limits:
      Monitor ranges (GTF): 56-61 Hz V, 30-91 kHz H, max dotclock 250 MHz
    Display Product Name: 'QHD270'
    Display Product Serial Number: ...
Checksum: 0x9a

----------------

Failures:

Block 0, Base EDID:
  Display Product Serial Number: ...
  Standard Timings: Use 0x0101 as the invalid Standard Timings code, not 0x0044.
  Standard Timings: Use 0x0101 as the invalid Standard Timings code, not 0x0004.
  Standard Timings: Use 0x0101 as the invalid Standard Timings code, not 0x0044.
  Standard Timings: Use 0x0101 as the invalid Standard Timings code, not 0x0084.
  Standard Timings: Use 0x0101 as the invalid Standard Timings code, not 0x0004.
  Standard Timings: Use 0x0101 as the invalid Standard Timings code, not 0x0004.
  Standard Timings: Use 0x0101 as the invalid Standard Timings code, not 0x00c4.
  Standard Timings: Use 0x0101 as the invalid Standard Timings code, not 0x00c4.
EDID:
  Extension Block 1 started with EDID header, ignoring Extension Blocks >= 1.

EDID conformity: FAIL
