edid-decode (hex):

00 ff ff ff ff ff ff 00 04 62 9b 04 00 00 00 00
28 15 01 03 a5 3c 22 78 22 6f b1 a7 55 4c 9e 25
0c 50 54 00 00 00 01 01 01 01 01 01 01 01 01 01
01 01 01 01 01 01 56 5e 00 a0 a0 a0 29 50 30 20
35 00 55 50 21 00 00 1a 00 00 00 fc 00 44 69 67
69 74 61 6c 0a 20 20 20 20 20 00 00 00 fc 00 0a
20 20 20 20 20 20 20 20 20 20 20 20 00 00 00 fc
00 0a 20 20 20 20 20 20 20 20 20 20 20 20 01 55

ff ff ff ff ff ff ff ff ff ff ff ff ff ff ff ff
ff ff ff ff ff ff ff ff ff ff ff ff ff ff ff ff
ff ff ff ff ff ff ff ff ff ff ff ff ff ff ff ff
ff ff ff ff ff ff ff ff ff ff ff ff ff ff ff ff
ff ff ff ff ff ff ff ff ff ff ff ff ff ff ff ff
ff ff ff ff ff ff ff ff ff ff ff ff ff ff ff ff
ff ff ff ff ff ff ff ff ff ff ff ff ff ff ff ff
ff ff ff ff ff ff ff ff ff ff ff ff ff ff ff ff

00 ff ff ff ff ff ff 00 04 62 9b 04 00 00 00 00
28 15 01 03 a5 3c 22 78 22 6f b1 a7 55 4c 9e 25
0c 50 54 00 00 00 01 01 01 01 01 01 01 01 01 01
01 01 01 01 01 01 56 5e 00 a0 a0 a0 29 50 30 20
35 00 55 50 21 00 00 1a 00 00 00 fc 00 44 69 67
69 74 61 6c 0a 20 20 20 20 20 00 00 00 fc 00 0a
20 20 20 20 20 20 20 20 20 20 20 20 00 00 00 fc
00 0a 20 20 20 20 20 20 20 20 20 20 20 20 01 55

ff ff ff ff ff ff ff ff ff ff ff ff ff ff ff ff
ff ff ff ff ff ff ff ff ff ff ff ff ff ff ff ff
ff ff ff ff ff ff ff ff ff ff ff ff ff ff ff ff
ff ff ff ff ff ff ff ff ff ff ff ff ff ff ff ff
ff ff ff ff ff ff ff ff ff ff ff ff ff ff ff ff
ff ff ff ff ff ff ff ff ff ff ff ff ff ff ff ff
ff ff ff ff ff ff ff ff ff ff ff ff ff ff ff ff
ff ff ff ff ff ff ff ff ff ff ff ff ff ff ff ff

----------------

Block 0, Base EDID:
  EDID Structure Version & Revision: 1.3
  Vendor & Product Identification:
    Manufacturer: ACB
    Model: 1179
    Made in: week 40 of 2011
  Basic Display Parameters & Features:
    Digital display
    DFP 1.x compatible TMDS
    Maximum image size: 60 cm x 34 cm
    Gamma: 2.20
    DPMS levels: Off
    Monochrome or grayscale display
    First detailed timing is the preferred timing
  Color Characteristics:
    Red  : 0.6533, 0.3339
    Green: 0.2998, 0.6201
    Blue : 0.1464, 0.0498
    White: 0.3125, 0.3291
  Established Timings I & II: none
  Standard Timings: none
  Detailed Timing Descriptors:
    DTD 1:  2560x1440   59.950550 Hz  16:9     88.787 kHz    241.500000 MHz (597 mm x 336 mm)
                 Hfront   48 Hsync  32 Hback   80 Hpol P
                 Vfront    3 Vsync   5 Vback   33 Vpol N
    Display Product Name: 'Digital'
    Display Product Name: ''
    Display Product Name: ''
  Extension blocks: 1
Checksum: 0x55

----------------

Block 1, Manufacturer-Specific Extension Block:
  ff ff ff ff ff ff ff ff ff ff ff ff ff ff ff ff '................'
  ff ff ff ff ff ff ff ff ff ff ff ff ff ff ff ff '................'
  ff ff ff ff ff ff ff ff ff ff ff ff ff ff ff ff '................'
  ff ff ff ff ff ff ff ff ff ff ff ff ff ff ff ff '................'
  ff ff ff ff ff ff ff ff ff ff ff ff ff ff ff ff '................'
  ff ff ff ff ff ff ff ff ff ff ff ff ff ff ff ff '................'
  ff ff ff ff ff ff ff ff ff ff ff ff ff ff ff ff '................'
  ff ff ff ff ff ff ff ff ff ff ff ff ff ff ff ff '................'
Checksum: 0xff (should be 0x7f)

----------------

Failures:

Block 0, Base EDID:
  Basic Display Parameters & Features: Digital Video Interface Standard set to reserved value 0x24.
  Display Product Name: Empty string.
  Display Product Name: Empty string.
  Missing Display Range Limits Descriptor.
Block 1, Manufacturer-Specific Extension Block:
  Unknown Extension Block.
  Invalid checksum 0xff (should be 0x7f).
EDID:
  Extension Block 2 started with EDID header, ignoring Extension Blocks >= 2.

EDID conformity: FAIL
