edid-decode (hex):

00 ff ff ff ff ff ff 00 0d f2 2c 34 00 00 00 00
1c 15 01 03 80 1d 10 78 0a 83 d5 94 57 52 8c 27
1c 50 54 00 00 00 01 01 01 01 01 01 01 01 01 01
01 01 01 01 01 01 12 1b 56 5a 50 00 19 30 30 20
36 00 25 a4 10 00 00 18 12 1b 56 5a 50 00 19 30
30 20 36 00 25 a4 10 00 00 18 00 00 00 fe 00 41
55 4f 0a 20 20 20 20 20 20 20 20 20 00 00 00 fe
00 42 31 33 33 58 57 30 33 20 56 34 20 0a 00 87

----------------

Block 0, Base EDID:
  EDID Structure Version & Revision: 1.3
  Vendor & Product Identification:
    Manufacturer: COR
    Model: 13356
    Made in: week 28 of 2011
  Basic Display Parameters & Features:
    Digital display
    Maximum image size: 29 cm x 16 cm
    Gamma: 2.20
    RGB color display
    First detailed timing is the preferred timing
  Color Characteristics:
    Red  : 0.5800, 0.3398
    Green: 0.3203, 0.5498
    Blue : 0.1552, 0.1103
    White: 0.3134, 0.3291
  Established Timings I & II: none
  Standard Timings: none
  Detailed Timing Descriptors:
    DTD 1:  1366x768    60.020371 Hz 683:384   47.596 kHz     69.300000 MHz (293 mm x 164 mm)
                 Hfront   48 Hsync  32 Hback   10 Hpol N
                 Vfront    3 Vsync   6 Vback   16 Vpol N
    DTD 2:  1366x768    60.020371 Hz 683:384   47.596 kHz     69.300000 MHz (293 mm x 164 mm)
                 Hfront   48 Hsync  32 Hback   10 Hpol N
                 Vfront    3 Vsync   6 Vback   16 Vpol N
    Alphanumeric Data String: 'AUO'
    Alphanumeric Data String: 'B133XW03 V4 '
Checksum: 0x87

----------------

Failures:

Block 0, Base EDID:
  Alphanumeric Data String: One or more trailing spaces before newline.
  Missing Display Product Name.
  Missing Display Range Limits Descriptor.

EDID conformity: FAIL
