edid-decode (hex):

00 ff ff ff ff ff ff 00 21 63 31 24 00 00 00 00
21 20 01 04 a5 35 1d 78 3b b6 e0 a3 56 50 a0 27
0e 50 54 af cf 00 81 80 81 bc 95 00 95 3c b3 00
b3 3c d1 c0 01 01 02 3a 80 18 71 38 2d 40 58 2c
45 00 0f 28 21 00 00 1e 00 00 00 ff 00 30 30 30
30 30 30 30 30 30 30 30 30 31 00 00 00 fd 00 30
a5 a0 a0 3c 01 0a 20 20 20 20 20 20 00 00 00 fc
00 32 34 45 33 0a 20 20 20 20 20 20 20 20 01 f7

02 03 28 f1 4a 01 03 12 13 04 90 1f 31 2f 3f 23
09 07 07 83 01 00 00 6d 1a 00 00 02 01 30 a5 00
00 00 00 00 00 e2 00 ff 86 6f 80 a0 70 38 40 40
30 20 35 00 0f 28 21 00 00 1e ac 80 80 78 70 38
29 40 18 20 35 00 0f 28 21 00 00 1e 85 91 80 72
70 38 1e 40 18 20 35 00 0f 28 21 00 00 1e 02 3a
80 18 71 38 2d 40 58 2c 45 00 0f 28 21 00 00 1e
00 00 00 00 00 00 00 00 00 00 00 00 00 00 00 b5

00 ff ff ff ff ff ff 00 21 63 31 24 00 00 00 00
21 20 01 04 a5 35 1d 78 3b b6 e0 a3 56 50 a0 27
0e 50 54 af cf 00 81 80 81 bc 95 00 95 3c b3 00
b3 3c d1 c0 01 01 02 3a 80 18 71 38 2d 40 58 2c
45 00 0f 28 21 00 00 1e 00 00 00 ff 00 30 30 30
30 30 30 30 30 30 30 30 30 31 00 00 00 fd 00 30
a5 a0 a0 3c 01 0a 20 20 20 20 20 20 00 00 00 fc
00 32 34 45 33 0a 20 20 20 20 20 20 20 20 01 f7

02 03 28 f1 4a 01 03 12 13 04 90 1f 31 2f 3f 23
09 07 07 83 01 00 00 6d 1a 00 00 02 01 30 a5 00
00 00 00 00 00 e2 00 ff 86 6f 80 a0 70 38 40 40
30 20 35 00 0f 28 21 00 00 1e ac 80 80 78 70 38
29 40 18 20 35 00 0f 28 21 00 00 1e 85 91 80 72
70 38 1e 40 18 20 35 00 0f 28 21 00 00 1e 02 3a
80 18 71 38 2d 40 58 2c 45 00 0f 28 21 00 00 1e
00 00 00 00 00 00 00 00 00 00 00 00 00 00 00 b5

----------------

Block 0, Base EDID:
  EDID Structure Version & Revision: 1.4
  Vendor & Product Identification:
    Manufacturer: HKC
    Model: 9265
    Made in: week 33 of 2022
  Basic Display Parameters & Features:
    Digital display
    Bits per primary color channel: 8
    DisplayPort interface
    Maximum image size: 53 cm x 29 cm
    Gamma: 2.20
    DPMS levels: Off
    Supported color formats: RGB 4:4:4, YCrCb 4:4:4, YCrCb 4:2:2
    First detailed timing includes the native pixel format and preferred refresh rate
    Display supports continuous frequencies
  Color Characteristics:
    Red  : 0.6386, 0.3388
    Green: 0.3134, 0.6269
    Blue : 0.1552, 0.0566
    White: 0.3125, 0.3281
  Established Timings I & II:
    IBM     :   720x400    70.081663 Hz   9:5     31.467 kHz     28.320000 MHz
    DMT 0x04:   640x480    59.940476 Hz   4:3     31.469 kHz     25.175000 MHz
    DMT 0x05:   640x480    72.808802 Hz   4:3     37.861 kHz     31.500000 MHz
    DMT 0x06:   640x480    75.000000 Hz   4:3     37.500 kHz     31.500000 MHz
    DMT 0x08:   800x600    56.250000 Hz   4:3     35.156 kHz     36.000000 MHz
    DMT 0x09:   800x600    60.316541 Hz   4:3     37.879 kHz     40.000000 MHz
    DMT 0x0a:   800x600    72.187572 Hz   4:3     48.077 kHz     50.000000 MHz
    DMT 0x0b:   800x600    75.000000 Hz   4:3     46.875 kHz     49.500000 MHz
    DMT 0x10:  1024x768    60.003840 Hz   4:3     48.363 kHz     65.000000 MHz
    DMT 0x11:  1024x768    70.069359 Hz   4:3     56.476 kHz     75.000000 MHz
    DMT 0x12:  1024x768    75.028582 Hz   4:3     60.023 kHz     78.750000 MHz
    DMT 0x24:  1280x1024   75.024675 Hz   5:4     79.976 kHz    135.000000 MHz
  Standard Timings:
    DMT 0x23:  1280x1024   60.019740 Hz   5:4     63.981 kHz    108.000000 MHz
    GTF     :  1280x1024  120.000185 Hz   5:4    131.640 kHz    233.793000 MHz
    DMT 0x2f:  1440x900    59.887445 Hz  16:10    55.935 kHz    106.500000 MHz
    GTF     :  1440x900   119.999896 Hz  16:10   115.800 kHz    229.747000 MHz
    DMT 0x3a:  1680x1050   59.954250 Hz  16:10    65.290 kHz    146.250000 MHz
    GTF     :  1680x1050  120.000000 Hz  16:10   135.000 kHz    313.200000 MHz
    DMT 0x52:  1920x1080   60.000000 Hz  16:9     67.500 kHz    148.500000 MHz
  Detailed Timing Descriptors:
    DTD 1:  1920x1080   60.000000 Hz  16:9     67.500 kHz    148.500000 MHz (527 mm x 296 mm)
                 Hfront   88 Hsync  44 Hback  148 Hpol P
                 Vfront    4 Vsync   5 Vback   36 Vpol P
    Display Product Serial Number: ...
    Display Range Limits:
      Monitor ranges (Range Limits Only): 48-165 Hz V, 160-160 kHz H, max dotclock 600 MHz
    Display Product Name: '24E3'
  Extension blocks: 1
Checksum: 0xf7

----------------

Block 1, CTA-861 Extension Block:
  Revision: 3
  Underscans IT Video Formats by default
  Basic audio support
  Supports YCbCr 4:4:4
  Supports YCbCr 4:2:2
  Native DTDs: 1
  Video Data Block:
    VIC   1:   640x480    59.940476 Hz   4:3     31.469 kHz     25.175000 MHz
    VIC   3:   720x480    59.940060 Hz  16:9     31.469 kHz     27.000000 MHz
    VIC  18:   720x576    50.000000 Hz  16:9     31.250 kHz     27.000000 MHz
    VIC  19:  1280x720    50.000000 Hz  16:9     37.500 kHz     74.250000 MHz
    VIC   4:  1280x720    60.000000 Hz  16:9     45.000 kHz     74.250000 MHz
    VIC  16:  1920x1080   60.000000 Hz  16:9     67.500 kHz    148.500000 MHz (native)
    VIC  31:  1920x1080   50.000000 Hz  16:9     56.250 kHz    148.500000 MHz
    VIC  49:   720x480   119.880120 Hz  16:9     62.937 kHz     54.000000 MHz
    VIC  47:  1280x720   120.000000 Hz  16:9     90.000 kHz    148.500000 MHz
    VIC  63:  1920x1080  120.000000 Hz  16:9    135.000 kHz    297.000000 MHz
  Audio Data Block:
    Linear PCM:
      Max channels: 2
      Supported sample rates (kHz): 48 44.1 32
      Supported sample sizes (bits): 24 20 16
  Speaker Allocation Data Block:
    FL/FR - Front Left/Right
  Vendor-Specific Data Block (AMD), OUI 00-00-1A:
    Version: 2
    Flags 1: 0x01
      FreeSync Supported
    Minimum Refresh Rate: 48 Hz
    Maximum Refresh Rate: 165 Hz
    Flags 5: 0x00
  Video Capability Data Block:
    YCbCr quantization: Selectable (via AVI YQ)
    RGB quantization: Selectable (via AVI Q)
    PT scan behavior: Supports both over- and underscan
    IT scan behavior: Supports both over- and underscan
    CE scan behavior: Supports both over- and underscan
  Detailed Timing Descriptors:
    DTD 2:  1920x1080  119.982181 Hz  16:9    137.260 kHz    285.500000 MHz (527 mm x 296 mm)
                 Hfront   48 Hsync  32 Hback   80 Hpol P
                 Vfront    3 Vsync   5 Vback   56 Vpol P
    DTD 3:  1920x1080  144.041560 Hz  16:9    161.471 kHz    329.400000 MHz (527 mm x 296 mm)
                 Hfront   24 Hsync  32 Hback   64 Hpol P
                 Vfront    3 Vsync   5 Vback   33 Vpol P
    DTD 4:  1920x1080  165.001284 Hz  16:9    183.151 kHz    372.530000 MHz (527 mm x 296 mm)
                 Hfront   24 Hsync  32 Hback   58 Hpol P
                 Vfront    3 Vsync   5 Vback   22 Vpol P
    DTD 5:  1920x1080   60.000000 Hz  16:9     67.500 kHz    148.500000 MHz (527 mm x 296 mm)
                 Hfront   88 Hsync  44 Hback  148 Hpol P
                 Vfront    4 Vsync   5 Vback   36 Vpol P
Checksum: 0xb5  Unused space in Extension Block: 15 bytes

----------------

Warnings:

Block 0, Base EDID:
  Display Product Serial Number: ...
Block 1, CTA-861 Extension Block:
  Video Data Block: VIC 1 and the first DTD are not identical. Is this intended?
  Video Capability Data Block: S_PT is equal to S_IT and S_CE, so should be set to 0 instead.
  Add a Colorimetry Data Block with the sRGB colorimetry bit set to avoid interop issues.
EDID:
  Base EDID: Some timings are out of range of the Monitor Ranges:
    Horizontal Freq: 31.250 - 183.151 kHz (Monitor: 160.000 - 160.000 kHz)

Failures:

EDID:
  Extension Block 2 started with EDID header, ignoring Extension Blocks >= 2.

EDID conformity: FAIL
