edid-decode (hex):

00 ff ff ff ff ff ff 00 08 59 12 55 01 01 01 01
00 15 01 03 80 79 44 78 0a 63 9d a1 54 52 9e 26
0a 47 4a af 4f 00 81 80 01 01 01 01 01 01 01 01
01 01 01 01 01 01 02 3a 80 18 71 38 2d 40 58 2c
45 00 b9 a8 42 00 00 1e a9 1a 00 a0 50 00 16 30
30 20 37 00 b9 a8 42 00 00 1a 00 00 00 fc 00 4e
53 2d 35 35 45 37 39 30 41 31 32 0a 00 00 00 fd
00 17 4c 0f 51 0f 00 0a 20 20 20 20 20 20 01 9d

02 03 1f 71 49 01 02 03 04 05 06 07 20 90 26 09
07 07 15 07 50 66 03 0c 00 30 00 80 e2 00 0f 02
3a 80 18 71 38 2d 40 58 2c 45 00 b9 a8 42 00 00
1e 01 1d 80 18 71 1c 16 20 58 2c 25 00 b9 a8 42
00 00 9e 01 1d 00 72 51 d0 1e 20 6e 28 55 00 b9
a8 42 00 00 1e 8c 0a d0 8a 20 e0 2d 10 10 3e 96
00 b9 a8 42 00 00 18 8c 0a a0 14 51 f0 16 00 26
7c 43 00 b9 a8 42 00 00 98 00 00 00 00 00 00 98

00 ff ff ff ff ff ff 00 08 59 12 55 01 01 01 01
00 15 01 03 80 79 44 78 0a 63 9d a1 54 52 9e 26
0a 47 4a af 4f 00 81 80 01 01 01 01 01 01 01 01
01 01 01 01 01 01 02 3a 80 18 71 38 2d 40 58 2c
45 00 b9 a8 42 00 00 1e a9 1a 00 a0 50 00 16 30
30 20 37 00 b9 a8 42 00 00 1a 00 00 00 fc 00 4e
53 2d 35 35 45 37 39 30 41 31 32 0a 00 00 00 fd
00 17 4c 0f 51 0f 00 0a 20 20 20 20 20 20 01 9d

02 03 1f 71 49 01 02 03 04 05 06 07 20 90 26 09
07 07 15 07 50 66 03 0c 00 30 00 80 e2 00 0f 02
3a 80 18 71 38 2d 40 58 2c 45 00 b9 a8 42 00 00
1e 01 1d 80 18 71 1c 16 20 58 2c 25 00 b9 a8 42
00 00 9e 01 1d 00 72 51 d0 1e 20 6e 28 55 00 b9
a8 42 00 00 1e 8c 0a d0 8a 20 e0 2d 10 10 3e 96
00 b9 a8 42 00 00 18 8c 0a a0 14 51 f0 16 00 26
7c 43 00 b9 a8 42 00 00 98 00 00 00 00 00 00 98

----------------

Block 0, Base EDID:
  EDID Structure Version & Revision: 1.3
  Vendor & Product Identification:
    Manufacturer: BBY
    Model: 21778
    Serial Number: ...
    Made in: 2011
  Basic Display Parameters & Features:
    Digital display
    Maximum image size: 121 cm x 68 cm
    Gamma: 2.20
    RGB color display
    First detailed timing is the preferred timing
  Color Characteristics:
    Red  : 0.6298, 0.3300
    Green: 0.3203, 0.6201
    Blue : 0.1503, 0.0400
    White: 0.2802, 0.2900
  Established Timings I & II:
    IBM     :   720x400    70.081663 Hz   9:5     31.467 kHz     28.320000 MHz
    DMT 0x04:   640x480    59.940476 Hz   4:3     31.469 kHz     25.175000 MHz
    DMT 0x05:   640x480    72.808802 Hz   4:3     37.861 kHz     31.500000 MHz
    DMT 0x06:   640x480    75.000000 Hz   4:3     37.500 kHz     31.500000 MHz
    DMT 0x08:   800x600    56.250000 Hz   4:3     35.156 kHz     36.000000 MHz
    DMT 0x09:   800x600    60.316541 Hz   4:3     37.879 kHz     40.000000 MHz
    DMT 0x0b:   800x600    75.000000 Hz   4:3     46.875 kHz     49.500000 MHz
    DMT 0x10:  1024x768    60.003840 Hz   4:3     48.363 kHz     65.000000 MHz
    DMT 0x11:  1024x768    70.069359 Hz   4:3     56.476 kHz     75.000000 MHz
    DMT 0x12:  1024x768    75.028582 Hz   4:3     60.023 kHz     78.750000 MHz
    DMT 0x24:  1280x1024   75.024675 Hz   5:4     79.976 kHz    135.000000 MHz
  Standard Timings:
    DMT 0x23:  1280x1024   60.019740 Hz   5:4     63.981 kHz    108.000000 MHz
  Detailed Timing Descriptors:
    DTD 1:  1920x1080   60.000000 Hz  16:9     67.500 kHz    148.500000 MHz (1209 mm x 680 mm)
                 Hfront   88 Hsync  44 Hback  148 Hpol P
                 Vfront    4 Vsync   5 Vback   36 Vpol P
    DTD 2:  1280x768    59.994726 Hz   5:3     47.396 kHz     68.250000 MHz (1209 mm x 680 mm)
                 Hfront   48 Hsync  32 Hback   80 Hpol P
                 Vfront    3 Vsync   7 Vback   12 Vpol N
    Display Product Name: 'NS-55E790A12'
    Display Range Limits:
      Monitor ranges (GTF): 23-76 Hz V, 15-81 kHz H, max dotclock 150 MHz
  Extension blocks: 1
Checksum: 0x9d

----------------

Block 1, CTA-861 Extension Block:
  Revision: 3
  Basic audio support
  Supports YCbCr 4:4:4
  Supports YCbCr 4:2:2
  Native DTDs: 1
  Video Data Block:
    VIC   1:   640x480    59.940476 Hz   4:3     31.469 kHz     25.175000 MHz
    VIC   2:   720x480    59.940060 Hz   4:3     31.469 kHz     27.000000 MHz
    VIC   3:   720x480    59.940060 Hz  16:9     31.469 kHz     27.000000 MHz
    VIC   4:  1280x720    60.000000 Hz  16:9     45.000 kHz     74.250000 MHz
    VIC   5:  1920x1080i  60.000000 Hz  16:9     33.750 kHz     74.250000 MHz
    VIC   6:  1440x480i   59.940060 Hz   4:3     15.734 kHz     27.000000 MHz
    VIC   7:  1440x480i   59.940060 Hz  16:9     15.734 kHz     27.000000 MHz
    VIC  32:  1920x1080   24.000000 Hz  16:9     27.000 kHz     74.250000 MHz
    VIC  16:  1920x1080   60.000000 Hz  16:9     67.500 kHz    148.500000 MHz (native)
  Audio Data Block:
    Linear PCM:
      Max channels: 2
      Supported sample rates (kHz): 48 44.1 32
      Supported sample sizes (bits): 24 20 16
    AC-3:
      Max channels: 6
      Supported sample rates (kHz): 48 44.1 32
      Maximum bit rate: 640 kb/s
  Vendor-Specific Data Block (HDMI), OUI 00-0C-03:
    Source physical address: 3.0.0.0
    Supports_AI
  Video Capability Data Block:
    YCbCr quantization: No Data
    RGB quantization: No Data
    PT scan behavior: No Data
    IT scan behavior: Supports both over- and underscan
    CE scan behavior: Supports both over- and underscan
  Detailed Timing Descriptors:
    DTD 3:  1920x1080   60.000000 Hz  16:9     67.500 kHz    148.500000 MHz (1209 mm x 680 mm)
                 Hfront   88 Hsync  44 Hback  148 Hpol P
                 Vfront    4 Vsync   5 Vback   36 Vpol P
    DTD 4:  1920x1080i  60.000000 Hz  16:9     33.750 kHz     74.250000 MHz (1209 mm x 680 mm)
                 Hfront   88 Hsync  44 Hback  148 Hpol P
                 Vfront    2 Vsync   5 Vback   15 Vpol P Vfront +0.5 Odd Field
                 Vfront    2 Vsync   5 Vback   15 Vpol P Vback  +0.5 Even Field
    DTD 5:  1280x720    60.000000 Hz  16:9     45.000 kHz     74.250000 MHz (1209 mm x 680 mm)
                 Hfront  110 Hsync  40 Hback  220 Hpol P
                 Vfront    5 Vsync   5 Vback   20 Vpol P
    DTD 6:   720x480    59.940060 Hz   3:2     31.469 kHz     27.000000 MHz (1209 mm x 680 mm)
                 Hfront   16 Hsync  62 Hback   60 Hpol N
                 Vfront    9 Vsync   6 Vback   30 Vpol N
    DTD 7:  1440x480i   59.940060 Hz   3:1     15.734 kHz     27.000000 MHz (1209 mm x 680 mm)
                 Hfront   38 Hsync 124 Hback  114 Hpol N
                 Vfront    4 Vsync   3 Vback   15 Vpol N Vfront +0.5 Odd Field
                 Vfront    4 Vsync   3 Vback   15 Vpol N Vback  +0.5 Even Field
Checksum: 0x98  Unused space in Extension Block: 6 bytes

----------------

Warnings:

Block 0, Base EDID:
  Vendor & Product Identification: The serial number is one of the known dummy values, it should probably be set to 0.
  Detailed Timing Descriptor #2: Image size is 1209x680 mm, but based on the picture AR it should be 1133x680 mm.
Block 1, CTA-861 Extension Block:
  IT Video Formats are overscanned by default, but normally this should be underscanned.
  Video Data Block: VIC 1 and the first DTD are not identical. Is this intended?
  Video Capability Data Block: Set Selectable YCbCr Quantization to avoid interop issues.
  Detailed Timing Descriptor #6: Image size is 1209x680 mm, but based on the picture AR it should be 1020x680 mm.
  Detailed Timing Descriptor #7: Image size is 1209x680 mm, but based on the picture AR it should be 1209x403 mm.
  Add a Colorimetry Data Block with the sRGB colorimetry bit set to avoid interop issues.

Failures:

Block 1, CTA-861 Extension Block:
  Video Capability Data Block: Set Selectable RGB Quantization to avoid interop issues.
EDID:
  Extension Block 2 started with EDID header, ignoring Extension Blocks >= 2.

EDID conformity: FAIL
