edid-decode (hex):

00 ff ff ff ff ff ff 00 06 af 9f 6a 00 00 00 00
1f 1f 01 04 a5 22 16 78 03 1d f2 a8 55 48 9e 22
0e 53 5a 00 00 00 01 01 01 01 01 01 01 01 01 01
01 01 01 01 01 01 0c 6c 00 a0 a0 40 5e 60 30 20
aa 00 58 d7 10 00 00 18 70 56 00 a0 a0 40 5e 60
30 20 aa 00 58 d7 10 00 00 18 00 00 00 fe 00 41
55 4f 0a 20 20 20 20 20 20 20 20 20 00 00 00 fe
00 42 31 36 30 51 41 4e 30 32 2e 57 20 0a 00 9d

00 ff ff ff ff ff ff 00 06 af 9f 6a 00 00 00 00
1f 1f 01 04 a5 22 16 78 03 1d f2 a8 55 48 9e 22
0e 53 5a 00 00 00 01 01 01 01 01 01 01 01 01 01
01 01 01 01 01 01 0c 6c 00 a0 a0 40 5e 60 30 20
aa 00 58 d7 10 00 00 18 70 56 00 a0 a0 40 5e 60
30 20 aa 00 58 d7 10 00 00 18 00 00 00 fe 00 41
55 4f 0a 20 20 20 20 20 20 20 20 20 00 00 00 fe
00 42 31 36 30 51 41 4e 30 32 2e 57 20 0a 00 9d

----------------

Block 0, Base EDID:
  EDID Structure Version & Revision: 1.4
  Vendor & Product Identification:
    Manufacturer: AUO
    Model: 27295
    Made in: week 31 of 2021
  Basic Display Parameters & Features:
    Digital display
    Bits per primary color channel: 8
    DisplayPort interface
    Maximum image size: 34 cm x 22 cm
    Gamma: 2.20
    Supported color formats: RGB 4:4:4
    First detailed timing includes the native pixel format and preferred refresh rate
    Display supports continuous frequencies
  Color Characteristics:
    Red  : 0.6562, 0.3330
    Green: 0.2841, 0.6181
    Blue : 0.1357, 0.0576
    White: 0.3242, 0.3535
  Established Timings I & II: none
  Standard Timings: none
  Detailed Timing Descriptors:
    DTD 1:  2560x1600   60.030210 Hz  16:10   101.691 kHz    276.600000 MHz (344 mm x 215 mm)
                 Hfront   48 Hsync  32 Hback   80 Hpol N
                 Vfront   10 Vsync  10 Vback   74 Vpol N
    DTD 2:  2560x1600   48.024168 Hz  16:10    81.353 kHz    221.280000 MHz (344 mm x 215 mm)
                 Hfront   48 Hsync  32 Hback   80 Hpol N
                 Vfront   10 Vsync  10 Vback   74 Vpol N
    Alphanumeric Data String: 'AUO'
    Alphanumeric Data String: 'B160QAN02.W '
Checksum: 0x9d

----------------

Block 1, Unknown EDID Extension Block 0x00:
  00 ff ff ff ff ff ff 00 06 af 9f 6a 00 00 00 00 '...........j....'
  1f 1f 01 04 a5 22 16 78 03 1d f2 a8 55 48 9e 22 '.....".x....UH."'
  0e 53 5a 00 00 00 01 01 01 01 01 01 01 01 01 01 '.SZ.............'
  01 01 01 01 01 01 0c 6c 00 a0 a0 40 5e 60 30 20 '.......l...@^`0 '
  aa 00 58 d7 10 00 00 18 70 56 00 a0 a0 40 5e 60 '..X.....pV...@^`'
  30 20 aa 00 58 d7 10 00 00 18 00 00 00 fe 00 41 '0 ..X..........A'
  55 4f 0a 20 20 20 20 20 20 20 20 20 00 00 00 fe 'UO.         ....'
  00 42 31 36 30 51 41 4e 30 32 2e 57 20 0a 00 9d '.B160QAN02.W ...'
Checksum: 0x9d

----------------

Warnings:

Block 0, Base EDID:
  Missing Display Product Name.

Failures:

Block 0, Base EDID:
  Alphanumeric Data String: One or more trailing spaces before newline.
  Missing Display Range Limits Descriptor.
Block 1, Base EDID:
  Unknown Extension Block.
EDID:
  Base EDID: EDID specified 0 extension block(s), but found 1 extension block(s).

EDID conformity: FAIL
