edid-decode (hex):

00 ff ff ff ff ff ff 00 22 6e ff ff 00 00 00 00
0f 23 01 04 b5 47 28 78 3b e6 45 ae 4e 37 bc 27
0b 50 54 a5 4b 00 d1 c0 61 40 01 01 01 01 01 01
01 01 01 01 01 01 08 e8 00 30 f2 70 5a 80 b0 58
4a 00 c5 8f 21 00 00 1a 00 00 00 fd 0c 30 a0 ff
ff 95 01 0a 20 20 20 20 20 20 00 00 00 fc 00 54
46 47 33 32 55 31 36 50 0a 20 20 20 00 00 00 ff
00 30 30 30 30 30 30 30 30 30 30 30 30 30 02 af

02 03 3e 71 23 09 07 07 83 01 00 00 4e 01 02 03
04 90 11 12 13 1f 3f 60 61 76 5f e2 00 ff e3 05
c3 01 e6 06 07 01 8f 89 19 74 1a 00 00 03 01 30
a0 00 60 00 00 00 00 a0 00 00 00 00 00 00 70 c2
00 a0 a0 a0 55 50 30 20 35 00 c5 8f 21 00 00 1a
6a 5e 00 a0 a0 a0 29 50 30 20 35 00 c5 8f 21 00
00 1a 00 00 00 00 00 00 00 00 00 00 00 00 00 00
00 00 00 00 00 00 00 00 00 00 00 00 00 00 00 68

70 12 79 03 00 03 01 28 9d f4 01 04 ff 0e 9f 00
2f 80 1f 00 6f 08 40 00 07 00 09 00 3f 22 02 04
ff 0e 9f 00 2f 80 1f 00 6f 08 18 00 02 00 04 00
00 00 00 00 00 00 00 00 00 00 00 00 00 00 00 00
00 00 00 00 00 00 00 00 00 00 00 00 00 00 00 00
00 00 00 00 00 00 00 00 00 00 00 00 00 00 00 00
00 00 00 00 00 00 00 00 00 00 00 00 00 00 00 00
00 00 00 00 00 00 00 00 00 00 00 00 00 00 f9 90

00 ff ff ff ff ff ff 00 22 6e ff ff 00 00 00 00
0f 23 01 04 b5 47 28 78 3b e6 45 ae 4e 37 bc 27
0b 50 54 a5 4b 00 d1 c0 61 40 01 01 01 01 01 01
01 01 01 01 01 01 08 e8 00 30 f2 70 5a 80 b0 58
4a 00 c5 8f 21 00 00 1a 00 00 00 fd 0c 30 a0 ff
ff 95 01 0a 20 20 20 20 20 20 00 00 00 fc 00 54
46 47 33 32 55 31 36 50 0a 20 20 20 00 00 00 ff
00 30 30 30 30 30 30 30 30 30 30 30 30 30 02 af

02 03 3e 71 23 09 07 07 83 01 00 00 4e 01 02 03
04 90 11 12 13 1f 3f 60 61 76 5f e2 00 ff e3 05
c3 01 e6 06 07 01 8f 89 19 74 1a 00 00 03 01 30
a0 00 60 00 00 00 00 a0 00 00 00 00 00 00 70 c2
00 a0 a0 a0 55 50 30 20 35 00 c5 8f 21 00 00 1a
6a 5e 00 a0 a0 a0 29 50 30 20 35 00 c5 8f 21 00
00 1a 00 00 00 00 00 00 00 00 00 00 00 00 00 00
00 00 00 00 00 00 00 00 00 00 00 00 00 00 00 68

70 12 79 03 00 03 01 28 9d f4 01 04 ff 0e 9f 00
2f 80 1f 00 6f 08 40 00 07 00 09 00 3f 22 02 04
ff 0e 9f 00 2f 80 1f 00 6f 08 18 00 02 00 04 00
00 00 00 00 00 00 00 00 00 00 00 00 00 00 00 00
00 00 00 00 00 00 00 00 00 00 00 00 00 00 00 00
00 00 00 00 00 00 00 00 00 00 00 00 00 00 00 00
00 00 00 00 00 00 00 00 00 00 00 00 00 00 00 00
00 00 00 00 00 00 00 00 00 00 00 00 00 00 f9 90

----------------

Block 0, Base EDID:
  EDID Structure Version & Revision: 1.4
  Vendor & Product Identification:
    Manufacturer: HSN
    Model: 65535
    Made in: week 15 of 2025
  Basic Display Parameters & Features:
    Digital display
    Bits per primary color channel: 10
    DisplayPort interface
    Maximum image size: 71 cm x 40 cm
    Gamma: 2.20
    DPMS levels: Off
    Supported color formats: RGB 4:4:4, YCrCb 4:4:4, YCrCb 4:2:2
    First detailed timing includes the native pixel format and preferred refresh rate
    Display supports continuous frequencies
  Color Characteristics:
    Red  : 0.6826, 0.3066
    Green: 0.2158, 0.7363
    Blue : 0.1533, 0.0429
    White: 0.3134, 0.3291
  Established Timings I & II:
    IBM     :   720x400    70.081663 Hz   9:5     31.467 kHz     28.320000 MHz
    DMT 0x04:   640x480    59.940476 Hz   4:3     31.469 kHz     25.175000 MHz
    DMT 0x06:   640x480    75.000000 Hz   4:3     37.500 kHz     31.500000 MHz
    DMT 0x09:   800x600    60.316541 Hz   4:3     37.879 kHz     40.000000 MHz
    DMT 0x0b:   800x600    75.000000 Hz   4:3     46.875 kHz     49.500000 MHz
    DMT 0x10:  1024x768    60.003840 Hz   4:3     48.363 kHz     65.000000 MHz
    DMT 0x12:  1024x768    75.028582 Hz   4:3     60.023 kHz     78.750000 MHz
    DMT 0x24:  1280x1024   75.024675 Hz   5:4     79.976 kHz    135.000000 MHz
  Standard Timings:
    DMT 0x52:  1920x1080   60.000000 Hz  16:9     67.500 kHz    148.500000 MHz
    DMT 0x10:  1024x768    60.003840 Hz   4:3     48.363 kHz     65.000000 MHz
  Detailed Timing Descriptors:
    DTD 1:  3840x2160   60.000000 Hz  16:9    135.000 kHz    594.000000 MHz (709 mm x 399 mm)
                 Hfront  176 Hsync  88 Hback  296 Hpol P
                 Vfront    4 Vsync  10 Vback   76 Vpol N
    Display Range Limits:
      Monitor ranges (Range Limits Only): 48-160 Hz V, 510-510 kHz H, max dotclock 1490 MHz
    Display Product Name: 'TFG32U16P'
    Display Product Serial Number: ...
  Extension blocks: 2
Checksum: 0xaf

----------------

Block 1, CTA-861 Extension Block:
  Revision: 3
  Basic audio support
  Supports YCbCr 4:4:4
  Supports YCbCr 4:2:2
  Native DTDs: 1
  Audio Data Block:
    Linear PCM:
      Max channels: 2
      Supported sample rates (kHz): 48 44.1 32
      Supported sample sizes (bits): 24 20 16
  Speaker Allocation Data Block:
    FL/FR - Front Left/Right
  Video Data Block:
    VIC   1:   640x480    59.940476 Hz   4:3     31.469 kHz     25.175000 MHz
    VIC   2:   720x480    59.940060 Hz   4:3     31.469 kHz     27.000000 MHz
    VIC   3:   720x480    59.940060 Hz  16:9     31.469 kHz     27.000000 MHz
    VIC   4:  1280x720    60.000000 Hz  16:9     45.000 kHz     74.250000 MHz
    VIC  16:  1920x1080   60.000000 Hz  16:9     67.500 kHz    148.500000 MHz (native)
    VIC  17:   720x576    50.000000 Hz   4:3     31.250 kHz     27.000000 MHz
    VIC  18:   720x576    50.000000 Hz  16:9     31.250 kHz     27.000000 MHz
    VIC  19:  1280x720    50.000000 Hz  16:9     37.500 kHz     74.250000 MHz
    VIC  31:  1920x1080   50.000000 Hz  16:9     56.250 kHz    148.500000 MHz
    VIC  63:  1920x1080  120.000000 Hz  16:9    135.000 kHz    297.000000 MHz
    VIC  96:  3840x2160   50.000000 Hz  16:9    112.500 kHz    594.000000 MHz
    VIC  97:  3840x2160   60.000000 Hz  16:9    135.000 kHz    594.000000 MHz
    VIC 118:  3840x2160  120.000000 Hz  16:9    270.000 kHz   1188.000000 MHz
    VIC  95:  3840x2160   30.000000 Hz  16:9     67.500 kHz    297.000000 MHz
  Video Capability Data Block:
    YCbCr quantization: Selectable (via AVI YQ)
    RGB quantization: Selectable (via AVI Q)
    PT scan behavior: Supports both over- and underscan
    IT scan behavior: Supports both over- and underscan
    CE scan behavior: Supports both over- and underscan
  Colorimetry Data Block:
    xvYCC601
    xvYCC709
    BT2020YCC
    BT2020RGB
    Gamut Boundary Description Metadata Profile P0
  HDR Static Metadata Data Block:
    Electro optical transfer functions:
      Traditional gamma - SDR luminance range
      Traditional gamma - HDR luminance range
      SMPTE ST2084
    Supported static metadata descriptors:
      Static metadata type 1
    Desired content max luminance: 143 (1107.128 cd/m^2)
    Desired content max frame-average luminance: 137 (972.198 cd/m^2)
    Desired content min luminance: 25 (0.106 cd/m^2)
  Vendor-Specific Data Block (AMD), OUI 00-00-1A:
    Version: 3
    Feature Caps: 0x01
    Minimum Refresh Rate: 48 Hz
    Maximum Refresh Rate: 160 Hz
    Flags 1.x: 0x00
    Flags 2.x: 0x60
  Detailed Timing Descriptors:
    DTD 2:  2560x1440  120.000000 Hz  16:9    183.000 kHz    497.760000 MHz (709 mm x 399 mm)
                 Hfront   48 Hsync  32 Hback   80 Hpol P
                 Vfront    3 Vsync   5 Vback   77 Vpol N
    DTD 3:  2560x1440   60.000199 Hz  16:9     88.860 kHz    241.700000 MHz (709 mm x 399 mm)
                 Hfront   48 Hsync  32 Hback   80 Hpol P
                 Vfront    3 Vsync   5 Vback   33 Vpol N
Checksum: 0x68  Unused space in Extension Block: 29 bytes

----------------

Block 2, DisplayID Extension Block:
  Version: 1.2
  Extension Count: 0
  Display Product Type: Standalone display device
  Video Timing Modes Type 1 - Detailed Timings Data Block:
    DTD:  3840x2160  143.997753 Hz  16:9    320.395 kHz   1281.580000 MHz (aspect 16:9, no 3D stereo)
               Hfront   48 Hsync  32 Hback   80 Hpol P
               Vfront    8 Vsync  10 Vback   47 Vpol N
    DTD:  3840x2160  160.000000 Hz  16:9    349.600 kHz   1398.400000 MHz (aspect 16:9, no 3D stereo)
               Hfront   48 Hsync  32 Hback   80 Hpol P
               Vfront    3 Vsync   5 Vback   17 Vpol N
  Checksum: 0xf9
Checksum: 0x90

----------------

Warnings:

Block 0, Base EDID:
  Detailed Timing Descriptor #1: DTD is similar but not identical to VIC 97.
  Display Product Serial Number: ...
Block 1, CTA-861 Extension Block:
  IT Video Formats are overscanned by default, but normally this should be underscanned.
  Video Data Block: VIC 1 and the first DTD are not identical. Is this intended?
  Video Capability Data Block: S_PT is equal to S_IT and S_CE, so should be set to 0 instead.
  Colorimetry Data Block: Set the sRGB colorimetry bit to avoid interop issues.
EDID:
  Base EDID: Some timings are out of range of the Monitor Ranges:
    Vertical Freq: 30.000 - 160.000 Hz (Monitor: 48.000 - 160.000 Hz)
    Horizontal Freq: 31.250 - 349.600 kHz (Monitor: 510.000 - 510.000 kHz)

Failures:

EDID:
  Extension Block 3 started with EDID header, ignoring Extension Blocks >= 3.
  CTA-861: Native progressive timings are a mix of several resolutions.
  DisplayID: Missing DisplayID Display Parameters Data Block.
  DisplayID: DisplayID expects at least one preferred timing.

EDID conformity: FAIL
