edid-decode (hex):

00 ff ff ff ff ff ff 00 38 a3 d2 68 00 00 00 00
20 18 01 04 a5 43 1c 78 e2 ca 95 a6 55 4e a1 26
0f 50 54 bf ef 80 81 00 81 40 81 80 81 c0 95 00
90 40 b3 00 d1 c0 cd 46 00 a0 a0 38 1f 40 30 20
3a 00 a1 1c 21 00 00 1a 00 00 00 fd 00 38 4c 1f
53 13 00 0a 20 20 20 20 20 20 00 00 00 fc 00 45
41 32 39 34 57 4d 69 0a 20 20 20 20 00 00 00 ff
00 34 38 31 30 34 31 33 36 4e 42 0a 20 20 01 70

02 03 13 c1 46 90 04 03 1f 13 12 23 09 07 07 83
01 00 00 01 1d 00 72 51 d0 1e 20 6e 28 55 00 a1
1c 21 00 00 1e 8c 0a d0 8a 20 e0 2d 10 10 3e 96
00 a1 1c 21 00 00 18 8c 0a d0 90 20 40 31 20 0c
40 55 00 a1 1c 21 00 00 18 02 3a 80 d0 72 38 2d
40 10 2c 45 80 a1 1c 21 00 00 1e ec 2c 00 b0 51
38 28 40 50 88 3a 00 a1 1c 21 00 00 1a 00 00 00
00 00 00 00 00 00 00 00 00 00 00 00 00 00 00 ca

00 ff ff ff ff ff ff 00 38 a3 d2 68 00 00 00 00
20 18 01 04 a5 43 1c 78 e2 ca 95 a6 55 4e a1 26
0f 50 54 bf ef 80 81 00 81 40 81 80 81 c0 95 00
90 40 b3 00 d1 c0 cd 46 00 a0 a0 38 1f 40 30 20
3a 00 a1 1c 21 00 00 1a 00 00 00 fd 00 38 4c 1f
53 13 00 0a 20 20 20 20 20 20 00 00 00 fc 00 45
41 32 39 34 57 4d 69 0a 20 20 20 20 00 00 00 ff
00 34 38 31 30 34 31 33 36 4e 42 0a 20 20 01 70

02 03 13 c1 46 90 04 03 1f 13 12 23 09 07 07 83
01 00 00 01 1d 00 72 51 d0 1e 20 6e 28 55 00 a1
1c 21 00 00 1e 8c 0a d0 8a 20 e0 2d 10 10 3e 96
00 a1 1c 21 00 00 18 8c 0a d0 90 20 40 31 20 0c
40 55 00 a1 1c 21 00 00 18 02 3a 80 d0 72 38 2d
40 10 2c 45 80 a1 1c 21 00 00 1e ec 2c 00 b0 51
38 28 40 50 88 3a 00 a1 1c 21 00 00 1a 00 00 00
00 00 00 00 00 00 00 00 00 00 00 00 00 00 00 ca

----------------

Block 0, Base EDID:
  EDID Structure Version & Revision: 1.4
  Vendor & Product Identification:
    Manufacturer: NEC
    Model: 26834
    Made in: week 32 of 2014
  Basic Display Parameters & Features:
    Digital display
    Bits per primary color channel: 8
    DisplayPort interface
    Maximum image size: 67 cm x 28 cm
    Gamma: 2.20
    DPMS levels: Standby Suspend Off
    Supported color formats: RGB 4:4:4
    First detailed timing includes the native pixel format and preferred refresh rate
  Color Characteristics:
    Red  : 0.6513, 0.3320
    Green: 0.3066, 0.6308
    Blue : 0.1503, 0.0595
    White: 0.3134, 0.3291
  Established Timings I & II:
    IBM     :   720x400    70.081663 Hz   9:5     31.467 kHz     28.320000 MHz
    DMT 0x04:   640x480    59.940476 Hz   4:3     31.469 kHz     25.175000 MHz
    Apple   :   640x480    66.666667 Hz   4:3     35.000 kHz     30.240000 MHz
    DMT 0x05:   640x480    72.808802 Hz   4:3     37.861 kHz     31.500000 MHz
    DMT 0x06:   640x480    75.000000 Hz   4:3     37.500 kHz     31.500000 MHz
    DMT 0x08:   800x600    56.250000 Hz   4:3     35.156 kHz     36.000000 MHz
    DMT 0x09:   800x600    60.316541 Hz   4:3     37.879 kHz     40.000000 MHz
    DMT 0x0a:   800x600    72.187572 Hz   4:3     48.077 kHz     50.000000 MHz
    DMT 0x0b:   800x600    75.000000 Hz   4:3     46.875 kHz     49.500000 MHz
    Apple   :   832x624    74.551266 Hz   4:3     49.726 kHz     57.284000 MHz
    DMT 0x10:  1024x768    60.003840 Hz   4:3     48.363 kHz     65.000000 MHz
    DMT 0x11:  1024x768    70.069359 Hz   4:3     56.476 kHz     75.000000 MHz
    DMT 0x12:  1024x768    75.028582 Hz   4:3     60.023 kHz     78.750000 MHz
    DMT 0x24:  1280x1024   75.024675 Hz   5:4     79.976 kHz    135.000000 MHz
    Apple   :  1152x870    75.061550 Hz 192:145   68.681 kHz    100.000000 MHz
  Standard Timings:
    DMT 0x1c:  1280x800    59.810326 Hz  16:10    49.702 kHz     83.500000 MHz
    DMT 0x20:  1280x960    60.000000 Hz   4:3     60.000 kHz    108.000000 MHz
    DMT 0x23:  1280x1024   60.019740 Hz   5:4     63.981 kHz    108.000000 MHz
    DMT 0x55:  1280x720    60.000000 Hz  16:9     45.000 kHz     74.250000 MHz
    DMT 0x2f:  1440x900    59.887445 Hz  16:10    55.935 kHz    106.500000 MHz
    DMT 0x2a:  1400x1050   59.978442 Hz   4:3     65.317 kHz    121.750000 MHz
    DMT 0x3a:  1680x1050   59.954250 Hz  16:10    65.290 kHz    146.250000 MHz
    DMT 0x52:  1920x1080   60.000000 Hz  16:9     67.500 kHz    148.500000 MHz
  Detailed Timing Descriptors:
    DTD  1:  2560x1080   59.978424 Hz  64:27    66.636 kHz    181.250000 MHz (673 mm x 284 mm)
                  Hfront   48 Hsync  32 Hback   80 Hpol P
                  Vfront    3 Vsync  10 Vback   18 Vpol N
    Display Range Limits:
      Monitor ranges (GTF): 56-76 Hz V, 31-83 kHz H, max dotclock 190 MHz
    Display Product Name: 'EA294WMi'
    Display Product Serial Number: ...
  Extension blocks: 1
Checksum: 0x70

----------------

Block 1, CTA-861 Extension Block:
  Revision: 3
  Underscans IT Video Formats by default
  Basic audio support
  Native detailed modes: 1
  Video Data Block:
    VIC  16:  1920x1080   60.000000 Hz  16:9     67.500 kHz    148.500000 MHz (native)
    VIC   4:  1280x720    60.000000 Hz  16:9     45.000 kHz     74.250000 MHz
    VIC   3:   720x480    59.940060 Hz  16:9     31.469 kHz     27.000000 MHz
    VIC  31:  1920x1080   50.000000 Hz  16:9     56.250 kHz    148.500000 MHz
    VIC  19:  1280x720    50.000000 Hz  16:9     37.500 kHz     74.250000 MHz
    VIC  18:   720x576    50.000000 Hz  16:9     31.250 kHz     27.000000 MHz
  Audio Data Block:
    Linear PCM:
      Max channels: 2
      Supported sample rates (kHz): 48 44.1 32
      Supported sample sizes (bits): 24 20 16
  Speaker Allocation Data Block:
    FL/FR - Front Left/Right
  Detailed Timing Descriptors:
    DTD  2:  1280x720    60.000000 Hz  16:9     45.000 kHz     74.250000 MHz (673 mm x 284 mm)
                  Hfront  110 Hsync  40 Hback  220 Hpol P
                  Vfront    5 Vsync   5 Vback   20 Vpol P
    DTD  3:   720x480    59.940060 Hz   3:2     31.469 kHz     27.000000 MHz (673 mm x 284 mm)
                  Hfront   16 Hsync  62 Hback   60 Hpol N
                  Vfront    9 Vsync   6 Vback   30 Vpol N
    DTD  4:   720x576    50.000000 Hz   5:4     31.250 kHz     27.000000 MHz (673 mm x 284 mm)
                  Hfront   12 Hsync  64 Hback   68 Hpol N
                  Vfront    5 Vsync   5 Vback   39 Vpol N
    DTD  5:  1920x1080   50.000000 Hz  16:9     56.250 kHz    148.500000 MHz (673 mm x 284 mm)
                  Hfront  528 Hsync  44 Hback  148 Hpol P
                  Vfront    4 Vsync   5 Vback   36 Vpol P
    DTD  6:  1280x1080   59.975801 Hz  32:27    67.173 kHz    115.000000 MHz (673 mm x 284 mm)
                  Hfront   80 Hsync 136 Hback  216 Hpol P
                  Vfront    3 Vsync  10 Vback   27 Vpol N
Checksum: 0xca  Unused space in Extension Block: 18 bytes

----------------

Block 2, Unknown EDID Extension Block 0x00:
  00 ff ff ff ff ff ff 00 38 a3 d2 68 00 00 00 00 '........8..h....'
  20 18 01 04 a5 43 1c 78 e2 ca 95 a6 55 4e a1 26 ' ....C.x....UN.&'
  0f 50 54 bf ef 80 81 00 81 40 81 80 81 c0 95 00 '.PT......@......'
  90 40 b3 00 d1 c0 cd 46 00 a0 a0 38 1f 40 30 20 '.@.....F...8.@0 '
  3a 00 a1 1c 21 00 00 1a 00 00 00 fd 00 38 4c 1f ':...!........8L.'
  53 13 00 0a 20 20 20 20 20 20 00 00 00 fc 00 45 'S...      .....E'
  41 32 39 34 57 4d 69 0a 20 20 20 20 00 00 00 ff 'A294WMi.    ....'
  00 34 38 31 30 34 31 33 36 4e 42 0a 20 20 01 70 '.48104136NB.  .p'
Checksum: 0x70

----------------

Block 3, CTA-861 Extension Block:
  Revision: 3
  Underscans IT Video Formats by default
  Basic audio support
  Native detailed modes: 1
  Video Data Block:
    VIC  16:  1920x1080   60.000000 Hz  16:9     67.500 kHz    148.500000 MHz (native)
    VIC   4:  1280x720    60.000000 Hz  16:9     45.000 kHz     74.250000 MHz
    VIC   3:   720x480    59.940060 Hz  16:9     31.469 kHz     27.000000 MHz
    VIC  31:  1920x1080   50.000000 Hz  16:9     56.250 kHz    148.500000 MHz
    VIC  19:  1280x720    50.000000 Hz  16:9     37.500 kHz     74.250000 MHz
    VIC  18:   720x576    50.000000 Hz  16:9     31.250 kHz     27.000000 MHz
  Audio Data Block:
    Linear PCM:
      Max channels: 2
      Supported sample rates (kHz): 48 44.1 32
      Supported sample sizes (bits): 24 20 16
  Speaker Allocation Data Block:
    FL/FR - Front Left/Right
  Detailed Timing Descriptors:
    DTD  7:  1280x720    60.000000 Hz  16:9     45.000 kHz     74.250000 MHz (673 mm x 284 mm)
                  Hfront  110 Hsync  40 Hback  220 Hpol P
                  Vfront    5 Vsync   5 Vback   20 Vpol P
    DTD  8:   720x480    59.940060 Hz   3:2     31.469 kHz     27.000000 MHz (673 mm x 284 mm)
                  Hfront   16 Hsync  62 Hback   60 Hpol N
                  Vfront    9 Vsync   6 Vback   30 Vpol N
    DTD  9:   720x576    50.000000 Hz   5:4     31.250 kHz     27.000000 MHz (673 mm x 284 mm)
                  Hfront   12 Hsync  64 Hback   68 Hpol N
                  Vfront    5 Vsync   5 Vback   39 Vpol N
    DTD 10:  1920x1080   50.000000 Hz  16:9     56.250 kHz    148.500000 MHz (673 mm x 284 mm)
                  Hfront  528 Hsync  44 Hback  148 Hpol P
                  Vfront    4 Vsync   5 Vback   36 Vpol P
    DTD 11:  1280x1080   59.975801 Hz  32:27    67.173 kHz    115.000000 MHz (673 mm x 284 mm)
                  Hfront   80 Hsync 136 Hback  216 Hpol P
                  Vfront    3 Vsync  10 Vback   27 Vpol N
Checksum: 0xca  Unused space in Extension Block: 18 bytes

----------------

Warnings:

Block 0, Base EDID:
  Display Range Limits: GTF support is deprecated in EDID 1.4.
Block 1, CTA-861 Extension Block:
  Video Data Block: VIC 16 and the first DTD are not identical. Is this intended?
  Detailed Timing Descriptor #2: Image size is 673x284 mm, but based on the picture AR it should be 673x378 mm.
  Detailed Timing Descriptor #3: Image size is 673x284 mm, but based on the picture AR it should be 673x448 mm.
  Detailed Timing Descriptor #4: Image size is 673x284 mm, but based on the picture AR it should be 673x538 mm.
  Detailed Timing Descriptor #5: Image size is 673x284 mm, but based on the picture AR it should be 673x378 mm.
  Detailed Timing Descriptor #6: Image size is 673x284 mm, but based on the picture AR it should be 673x567 mm.
  Add a Colorimetry Data Block with the sRGB colorimetry bit set to avoid interop issues.
Block 3, CTA-861 Extension Block:
  Detailed Timing Descriptor #7: Image size is 673x284 mm, but based on the picture AR it should be 673x378 mm.
  Detailed Timing Descriptor #8: Image size is 673x284 mm, but based on the picture AR it should be 673x448 mm.
  Detailed Timing Descriptor #9: Image size is 673x284 mm, but based on the picture AR it should be 673x538 mm.
  Detailed Timing Descriptor #10: Image size is 673x284 mm, but based on the picture AR it should be 673x378 mm.
  Detailed Timing Descriptor #11: Image size is 673x284 mm, but based on the picture AR it should be 673x567 mm.
EDID:
  Base EDID: Some timings are out of range of the Monitor Ranges:
    Vertical Freq: 50.000 - 75.062 Hz (Monitor: 56.000 - 76.000 Hz)

Failures:

Block 0, Base EDID:
  Display Range Limits: GTF is supported, but the display does not support continuous frequencies.
Block 1, CTA-861 Extension Block:
  Missing VCDB, needed for Set Selectable RGB Quantization to avoid interop issues.
Block 2, Base EDID:
  Unknown Extension Block.
Block 3, CTA-861 Extension Block:
  Video Data Block: Duplicate VIC 16.
  Video Data Block: Duplicate VIC 4.
  Video Data Block: Duplicate VIC 3.
  Video Data Block: Duplicate VIC 31.
  Video Data Block: Duplicate VIC 19.
  Video Data Block: Duplicate VIC 18.
  Speaker Allocation Data Block: Only one instance of this Data Block is allowed.
EDID:
  Base EDID: EDID specified 1 extension block(s), but found 3 extension block(s).
  CTA-861: Native progressive timings are a mix of several resolutions.

EDID conformity: FAIL
