edid-decode (hex):

00 ff ff ff ff ff ff 00 1e 6d 1a 5c 20 40 10 00
07 21 01 04 b5 35 1e 78 9f 07 e5 a8 56 4c 9b 25
0f 50 54 25 4b 00 d1 c0 61 40 31 7c 45 7c 61 7c
45 40 01 01 01 01 5a 87 80 a0 70 38 4d 40 30 20
3a 00 0f 28 21 00 00 1a 00 00 00 fd 00 3c 90 c8
c8 2a 01 0a 20 20 20 20 20 20 00 00 00 fc 00 4c
47 20 55 4c 54 52 41 47 45 41 52 0a 00 00 00 ff
00 33 30 37 4d 41 41 4b 39 37 37 39 32 0a 01 7a

02 03 29 71 23 09 07 07 43 03 04 10 83 01 00 00
e3 05 c0 00 e6 06 05 01 53 53 50 6d 1a 00 00 02
05 3c 90 00 04 53 99 53 99 02 3a 80 18 71 38 2d
40 58 2c 45 00 0f 28 21 00 00 1e 80 48 80 18 71
38 2d 40 58 2c 45 00 0f 28 21 00 00 1e 86 6f 80
a0 70 38 40 40 30 20 35 00 0f 28 21 00 00 1e d9
76 00 a0 a0 a0 34 50 30 20 3a 00 0f 28 21 00 00
1a 00 00 00 00 00 00 00 00 00 00 00 00 00 00 be

00 ff ff ff ff ff ff 00 1e 6d 1a 5c 20 40 10 00
07 21 01 04 b5 35 1e 78 9f 07 e5 a8 56 4c 9b 25
0f 50 54 25 4b 00 d1 c0 61 40 31 7c 45 7c 61 7c
45 40 01 01 01 01 5a 87 80 a0 70 38 4d 40 30 20
3a 00 0f 28 21 00 00 1a 00 00 00 fd 00 3c 90 c8
c8 2a 01 0a 20 20 20 20 20 20 00 00 00 fc 00 4c
47 20 55 4c 54 52 41 47 45 41 52 0a 00 00 00 ff
00 33 30 37 4d 41 41 4b 39 37 37 39 32 0a 01 7a

02 03 29 71 23 09 07 07 43 03 04 10 83 01 00 00
e3 05 c0 00 e6 06 05 01 53 53 50 6d 1a 00 00 02
05 3c 90 00 04 53 99 53 99 02 3a 80 18 71 38 2d
40 58 2c 45 00 0f 28 21 00 00 1e 80 48 80 18 71
38 2d 40 58 2c 45 00 0f 28 21 00 00 1e 86 6f 80
a0 70 38 40 40 30 20 35 00 0f 28 21 00 00 1e d9
76 00 a0 a0 a0 34 50 30 20 3a 00 0f 28 21 00 00
1a 00 00 00 00 00 00 00 00 00 00 00 00 00 00 be

----------------

Block 0, Base EDID:
  EDID Structure Version & Revision: 1.4
  Vendor & Product Identification:
    Manufacturer: GSM
    Model: 23578
    Serial Number: ...
    Made in: week 7 of 2023
  Basic Display Parameters & Features:
    Digital display
    Bits per primary color channel: 10
    DisplayPort interface
    Maximum image size: 53 cm x 30 cm
    Gamma: 2.20
    DPMS levels: Standby
    Supported color formats: RGB 4:4:4, YCrCb 4:4:4, YCrCb 4:2:2
    Default (sRGB) color space is primary color space
    First detailed timing includes the native pixel format and preferred refresh rate
    Display supports continuous frequencies
  Color Characteristics:
    Red  : 0.6562, 0.3359
    Green: 0.2978, 0.6083
    Blue : 0.1474, 0.0605
    White: 0.3134, 0.3291
  Established Timings I & II:
    DMT 0x04:   640x480    59.940476 Hz   4:3     31.469 kHz     25.175000 MHz
    DMT 0x06:   640x480    75.000000 Hz   4:3     37.500 kHz     31.500000 MHz
    DMT 0x09:   800x600    60.316541 Hz   4:3     37.879 kHz     40.000000 MHz
    DMT 0x0b:   800x600    75.000000 Hz   4:3     46.875 kHz     49.500000 MHz
    DMT 0x10:  1024x768    60.003840 Hz   4:3     48.363 kHz     65.000000 MHz
    DMT 0x12:  1024x768    75.028582 Hz   4:3     60.023 kHz     78.750000 MHz
    DMT 0x24:  1280x1024   75.024675 Hz   5:4     79.976 kHz    135.000000 MHz
  Standard Timings:
    DMT 0x52:  1920x1080   60.000000 Hz  16:9     67.500 kHz    148.500000 MHz
    DMT 0x10:  1024x768    60.003840 Hz   4:3     48.363 kHz     65.000000 MHz
    GTF     :   640x480   119.999084 Hz   4:3     61.800 kHz     52.406000 MHz
    GTF     :   800x600   119.999886 Hz   4:3     77.160 kHz     83.950000 MHz
    GTF     :  1024x768   119.999931 Hz   4:3     98.760 kHz    139.054000 MHz
    DMT 0x09:   800x600    60.316541 Hz   4:3     37.879 kHz     40.000000 MHz
  Detailed Timing Descriptors:
    DTD 1:  1920x1080  143.981451 Hz  16:9    166.587 kHz    346.500000 MHz (527 mm x 296 mm)
                 Hfront   48 Hsync  32 Hback   80 Hpol P
                 Vfront    3 Vsync  10 Vback   64 Vpol N
    Display Range Limits:
      Monitor ranges (Range Limits Only): 60-144 Hz V, 200-200 kHz H, max dotclock 420 MHz
    Display Product Name: 'LG ULTRAGEAR'
    Display Product Serial Number: ...
  Extension blocks: 1
Checksum: 0x7a

----------------

Block 1, CTA-861 Extension Block:
  Revision: 3
  Basic audio support
  Supports YCbCr 4:4:4
  Supports YCbCr 4:2:2
  Native detailed modes: 1
  Audio Data Block:
    Linear PCM:
      Max channels: 2
      Supported sample rates (kHz): 48 44.1 32
      Supported sample sizes (bits): 24 20 16
  Video Data Block:
    VIC   3:   720x480    59.940060 Hz  16:9     31.469 kHz     27.000000 MHz
    VIC   4:  1280x720    60.000000 Hz  16:9     45.000 kHz     74.250000 MHz
    VIC  16:  1920x1080   60.000000 Hz  16:9     67.500 kHz    148.500000 MHz
  Speaker Allocation Data Block:
    FL/FR - Front Left/Right
  Colorimetry Data Block:
    BT2020YCC
    BT2020RGB
  HDR Static Metadata Data Block:
    Electro optical transfer functions:
      Traditional gamma - SDR luminance range
      SMPTE ST2084
    Supported static metadata descriptors:
      Static metadata type 1
    Desired content max luminance: 83 (301.833 cd/m^2)
    Desired content max frame-average luminance: 83 (301.833 cd/m^2)
    Desired content min luminance: 80 (0.297 cd/m^2)
  Vendor-Specific Data Block (AMD), OUI 00-00-1A:
    Version: 2
    Feature Caps: 0x05
    Minimum Refresh Rate: 60 Hz
    Maximum Refresh Rate: 144 Hz
    Flags 1.x: 0x00
    Flags 2.x: 0x04
    Maximum luminance: 83 (301.833 cd/m^2)
    Minimum luminance: 153 (1.087 cd/m^2)
    Maximum luminance (without local dimming): 83 (301.833 cd/m^2)
    Minimum luminance (without local dimming): 153 (1.087 cd/m^2)
  Detailed Timing Descriptors:
    DTD 2:  1920x1080   60.000000 Hz  16:9     67.500 kHz    148.500000 MHz (527 mm x 296 mm)
                 Hfront   88 Hsync  44 Hback  148 Hpol P
                 Vfront    4 Vsync   5 Vback   36 Vpol P
    DTD 3:  1920x1080   74.989899 Hz  16:9     84.364 kHz    185.600000 MHz (527 mm x 296 mm)
                 Hfront   88 Hsync  44 Hback  148 Hpol P
                 Vfront    4 Vsync   5 Vback   36 Vpol P
    DTD 4:  1920x1080  119.982181 Hz  16:9    137.260 kHz    285.500000 MHz (527 mm x 296 mm)
                 Hfront   48 Hsync  32 Hback   80 Hpol P
                 Vfront    3 Vsync   5 Vback   56 Vpol P
    DTD 5:  2560x1440   74.970923 Hz  16:9    111.857 kHz    304.250000 MHz (527 mm x 296 mm)
                 Hfront   48 Hsync  32 Hback   80 Hpol P
                 Vfront    3 Vsync  10 Vback   39 Vpol N
Checksum: 0xbe  Unused space in Extension Block: 14 bytes

----------------

Block 2, Unknown EDID Extension Block 0x00:
  00 ff ff ff ff ff ff 00 1e 6d 1a 5c 20 40 10 00 '.........m.\ @..'
  07 21 01 04 b5 35 1e 78 9f 07 e5 a8 56 4c 9b 25 '.!...5.x....VL.%'
  0f 50 54 25 4b 00 d1 c0 61 40 31 7c 45 7c 61 7c '.PT%K...a@1|E|a|'
  45 40 01 01 01 01 5a 87 80 a0 70 38 4d 40 30 20 'E@....Z...p8M@0 '
  3a 00 0f 28 21 00 00 1a 00 00 00 fd 00 3c 90 c8 ':..(!........<..'
  c8 2a 01 0a 20 20 20 20 20 20 00 00 00 fc 00 4c '.*..      .....L'
  47 20 55 4c 54 52 41 47 45 41 52 0a 00 00 00 ff 'G ULTRAGEAR.....'
  00 33 30 37 4d 41 41 4b 39 37 37 39 32 0a 01 7a '.307MAAK97792..z'
Checksum: 0x7a

----------------

Block 3, CTA-861 Extension Block:
  Revision: 3
  Basic audio support
  Supports YCbCr 4:4:4
  Supports YCbCr 4:2:2
  Native detailed modes: 1
  Audio Data Block:
    Linear PCM:
      Max channels: 2
      Supported sample rates (kHz): 48 44.1 32
      Supported sample sizes (bits): 24 20 16
  Video Data Block:
    VIC   3:   720x480    59.940060 Hz  16:9     31.469 kHz     27.000000 MHz
    VIC   4:  1280x720    60.000000 Hz  16:9     45.000 kHz     74.250000 MHz
    VIC  16:  1920x1080   60.000000 Hz  16:9     67.500 kHz    148.500000 MHz
  Speaker Allocation Data Block:
    FL/FR - Front Left/Right
  Colorimetry Data Block:
    BT2020YCC
    BT2020RGB
  HDR Static Metadata Data Block:
    Electro optical transfer functions:
      Traditional gamma - SDR luminance range
      SMPTE ST2084
    Supported static metadata descriptors:
      Static metadata type 1
    Desired content max luminance: 83 (301.833 cd/m^2)
    Desired content max frame-average luminance: 83 (301.833 cd/m^2)
    Desired content min luminance: 80 (0.297 cd/m^2)
  Vendor-Specific Data Block (AMD), OUI 00-00-1A:
    Version: 2
    Feature Caps: 0x05
    Minimum Refresh Rate: 60 Hz
    Maximum Refresh Rate: 144 Hz
    Flags 1.x: 0x00
    Flags 2.x: 0x04
    Maximum luminance: 83 (301.833 cd/m^2)
    Minimum luminance: 153 (1.087 cd/m^2)
    Maximum luminance (without local dimming): 83 (301.833 cd/m^2)
    Minimum luminance (without local dimming): 153 (1.087 cd/m^2)
  Detailed Timing Descriptors:
    DTD 6:  1920x1080   60.000000 Hz  16:9     67.500 kHz    148.500000 MHz (527 mm x 296 mm)
                 Hfront   88 Hsync  44 Hback  148 Hpol P
                 Vfront    4 Vsync   5 Vback   36 Vpol P
    DTD 7:  1920x1080   74.989899 Hz  16:9     84.364 kHz    185.600000 MHz (527 mm x 296 mm)
                 Hfront   88 Hsync  44 Hback  148 Hpol P
                 Vfront    4 Vsync   5 Vback   36 Vpol P
    DTD 8:  1920x1080  119.982181 Hz  16:9    137.260 kHz    285.500000 MHz (527 mm x 296 mm)
                 Hfront   48 Hsync  32 Hback   80 Hpol P
                 Vfront    3 Vsync   5 Vback   56 Vpol P
    DTD 9:  2560x1440   74.970923 Hz  16:9    111.857 kHz    304.250000 MHz (527 mm x 296 mm)
                 Hfront   48 Hsync  32 Hback   80 Hpol P
                 Vfront    3 Vsync  10 Vback   39 Vpol N
Checksum: 0xbe  Unused space in Extension Block: 14 bytes

----------------

Warnings:

Block 1, CTA-861 Extension Block:
  IT Video Formats are overscanned by default, but normally this should be underscanned.
  Video Data Block: VIC 3 and the first DTD are not identical. Is this intended?
  Video Data Block: All VICs are in ascending order, and the first (preferred) VIC <= 4, is that intended?
  Display Product Serial Number is set, so the Serial Number in the Base EDID should be 0.
Block 3, CTA-861 Extension Block:
  IT Video Formats are overscanned by default, but normally this should be underscanned.
  Video Data Block: All VICs are in ascending order, and the first (preferred) VIC <= 4, is that intended?
EDID:
  Base EDID: Some timings are out of range of the Monitor Ranges:
    Horizontal Freq: 31.468 - 166.586 kHz (Monitor: 200.000 - 200.000 kHz)

Failures:

Block 0, Base EDID:
  Basic Display Parameters & Features: sRGB is signaled, but the chromaticities do not match.
Block 1, CTA-861 Extension Block:
  Missing VCDB, needed for Set Selectable RGB Quantization to avoid interop issues.
Block 2, Base EDID:
  Unknown Extension Block.
Block 3, CTA-861 Extension Block:
  Video Data Block: Duplicate VIC 3.
  Video Data Block: Duplicate VIC 4.
  Video Data Block: Duplicate VIC 16.
  Speaker Allocation Data Block: Only one instance of this Data Block is allowed.
  Colorimetry Data Block: Only one instance of this Data Block is allowed.
  HDR Static Metadata Data Block: Only one instance of this Data Block is allowed.
EDID:
  Base EDID: EDID specified 1 extension block(s), but found 3 extension block(s).

EDID conformity: FAIL
