edid-decode (hex):

00 ff ff ff ff ff ff 00 04 72 64 0b 0a 64 40 33
22 21 01 03 61 30 1a 78 09 ee 91 a3 54 4c 99 26
0f 50 54 bf ef 80 71 4f 81 80 81 40 81 00 81 c0
95 00 b3 00 d1 c0 2a 44 80 a0 70 38 27 40 30 20
35 00 de 04 11 00 00 1e 00 00 00 fd 00 30 4b 1e
55 15 00 0a 20 20 20 20 20 20 00 00 00 fc 00 4b
41 32 32 32 51 20 48 0a 20 20 20 20 00 00 00 ff
00 33 33 33 34 30 36 34 30 41 33 57 30 31 00 2e

00 ff ff ff ff ff ff 00 04 72 64 0b 0a 64 40 33
22 21 01 03 61 30 1a 78 09 ee 91 a3 54 4c 99 26
0f 50 54 bf ef 80 71 4f 81 80 81 40 81 00 81 c0
95 00 b3 00 d1 c0 2a 44 80 a0 70 38 27 40 30 20
35 00 de 04 11 00 00 1e 00 00 00 fd 00 30 4b 1e
55 15 00 0a 20 20 20 20 20 20 00 00 00 fc 00 4b
41 32 32 32 51 20 48 0a 20 20 20 20 00 00 00 ff
00 33 33 33 34 30 36 34 30 41 33 57 30 31 00 2e

----------------

Block 0, Base EDID:
  EDID Structure Version & Revision: 1.3
  Vendor & Product Identification:
    Manufacturer: ACR
    Model: 2916
    Serial Number: ...
    Made in: week 34 of 2023
  Basic Display Parameters & Features:
    Analog display
    Signal Level Standard: 0.700 : 0.000 : 0.700 V p-p
    Blank level equals black level
    Sync: Serration
    Maximum image size: 48 cm x 26 cm
    Gamma: 2.20
    RGB color display
    Supports GTF timings within operating range
  Color Characteristics:
    Red  : 0.6396, 0.3300
    Green: 0.2998, 0.5996
    Blue : 0.1503, 0.0595
    White: 0.3125, 0.3291
  Established Timings I & II:
    IBM     :   720x400    70.081663 Hz   9:5     31.467 kHz     28.320000 MHz
    DMT 0x04:   640x480    59.940476 Hz   4:3     31.469 kHz     25.175000 MHz
    Apple   :   640x480    66.666667 Hz   4:3     35.000 kHz     30.240000 MHz
    DMT 0x05:   640x480    72.808802 Hz   4:3     37.861 kHz     31.500000 MHz
    DMT 0x06:   640x480    75.000000 Hz   4:3     37.500 kHz     31.500000 MHz
    DMT 0x08:   800x600    56.250000 Hz   4:3     35.156 kHz     36.000000 MHz
    DMT 0x09:   800x600    60.316541 Hz   4:3     37.879 kHz     40.000000 MHz
    DMT 0x0a:   800x600    72.187572 Hz   4:3     48.077 kHz     50.000000 MHz
    DMT 0x0b:   800x600    75.000000 Hz   4:3     46.875 kHz     49.500000 MHz
    Apple   :   832x624    74.551266 Hz   4:3     49.726 kHz     57.284000 MHz
    DMT 0x10:  1024x768    60.003840 Hz   4:3     48.363 kHz     65.000000 MHz
    DMT 0x11:  1024x768    70.069359 Hz   4:3     56.476 kHz     75.000000 MHz
    DMT 0x12:  1024x768    75.028582 Hz   4:3     60.023 kHz     78.750000 MHz
    DMT 0x24:  1280x1024   75.024675 Hz   5:4     79.976 kHz    135.000000 MHz
    Apple   :  1152x870    75.061550 Hz 192:145   68.681 kHz    100.000000 MHz
  Standard Timings:
    DMT 0x15:  1152x864    75.000000 Hz   4:3     67.500 kHz    108.000000 MHz
    DMT 0x23:  1280x1024   60.019740 Hz   5:4     63.981 kHz    108.000000 MHz
    DMT 0x20:  1280x960    60.000000 Hz   4:3     60.000 kHz    108.000000 MHz
    DMT 0x1c:  1280x800    59.810326 Hz  16:10    49.702 kHz     83.500000 MHz
    DMT 0x55:  1280x720    60.000000 Hz  16:9     45.000 kHz     74.250000 MHz
    DMT 0x2f:  1440x900    59.887445 Hz  16:10    55.935 kHz    106.500000 MHz
    DMT 0x3a:  1680x1050   59.954250 Hz  16:10    65.290 kHz    146.250000 MHz
    DMT 0x52:  1920x1080   60.000000 Hz  16:9     67.500 kHz    148.500000 MHz
  Detailed Timing Descriptors:
    DTD 1:  1920x1080   74.972503 Hz  16:9     83.894 kHz    174.500000 MHz (478 mm x 260 mm)
                 Hfront   48 Hsync  32 Hback   80 Hpol P
                 Vfront    3 Vsync   5 Vback   31 Vpol P
    Display Range Limits:
      Monitor ranges (GTF): 48-75 Hz V, 30-85 kHz H, max dotclock 210 MHz
    Display Product Name: 'KA222Q H'
    Display Product Serial Number: ...
Checksum: 0x2e

----------------

Failures:

Block 0, Base EDID:
  Basic Display Parameters & Features: The chromaticities match sRGB, but sRGB is not signaled.
  Basic Display Parameters & Features: EDID 1.3 requires that the first detailed timing is the preferred timing.
EDID:
  Extension Block 1 started with EDID header, ignoring Extension Blocks >= 1.

EDID conformity: FAIL
