edid-decode (hex):

00 ff ff ff ff ff ff 00 09 e5 e3 0c 00 00 00 00
0c 22 01 04 a5 1e 13 78 03 a8 65 96 5d 58 95 29
1d 50 54 00 00 00 01 01 01 01 01 01 01 01 01 01
01 01 01 01 01 01 33 3f 80 dc 70 b0 3c 40 30 20
36 00 2e bc 10 00 00 1a 00 00 00 fd 00 28 3c 4c
4c 10 01 0a 20 20 20 20 20 20 00 00 00 fe 00 42
4f 45 20 43 51 0a 20 20 20 20 20 20 00 00 00 fc
00 4e 56 31 34 30 57 55 4d 2d 4e 34 48 0a 01 64

70 20 79 02 00 81 00 15 74 1a 00 00 03 01 28 3c
00 00 53 51 53 51 3c 00 00 00 00 80 00 00 00 00
00 00 00 00 00 00 00 00 00 00 00 00 00 00 00 00
00 00 00 00 00 00 00 00 00 00 00 00 00 00 00 00
00 00 00 00 00 00 00 00 00 00 00 00 00 00 00 00
00 00 00 00 00 00 00 00 00 00 00 00 00 00 00 00
00 00 00 00 00 00 00 00 00 00 00 00 00 00 00 00
00 00 00 00 00 00 00 00 00 00 00 00 00 00 d5 90

00 ff ff ff ff ff ff 00 09 e5 e3 0c 00 00 00 00
0c 22 01 04 a5 1e 13 78 03 a8 65 96 5d 58 95 29
1d 50 54 00 00 00 01 01 01 01 01 01 01 01 01 01
01 01 01 01 01 01 33 3f 80 dc 70 b0 3c 40 30 20
36 00 2e bc 10 00 00 1a 00 00 00 fd 00 28 3c 4c
4c 10 01 0a 20 20 20 20 20 20 00 00 00 fe 00 42
4f 45 20 43 51 0a 20 20 20 20 20 20 00 00 00 fc
00 4e 56 31 34 30 57 55 4d 2d 4e 34 48 0a 01 64

70 20 79 02 00 81 00 15 74 1a 00 00 03 01 28 3c
00 00 53 51 53 51 3c 00 00 00 00 80 00 00 00 00
00 00 00 00 00 00 00 00 00 00 00 00 00 00 00 00
00 00 00 00 00 00 00 00 00 00 00 00 00 00 00 00
00 00 00 00 00 00 00 00 00 00 00 00 00 00 00 00
00 00 00 00 00 00 00 00 00 00 00 00 00 00 00 00
00 00 00 00 00 00 00 00 00 00 00 00 00 00 00 00
00 00 00 00 00 00 00 00 00 00 00 00 00 00 d5 90

----------------

Block 0, Base EDID:
  EDID Structure Version & Revision: 1.4
  Vendor & Product Identification:
    Manufacturer: BOE
    Model: 3299
    Made in: week 12 of 2024
  Basic Display Parameters & Features:
    Digital display
    Bits per primary color channel: 8
    DisplayPort interface
    Maximum image size: 30 cm x 19 cm
    Gamma: 2.20
    Supported color formats: RGB 4:4:4
    First detailed timing includes the native pixel format and preferred refresh rate
    Display supports continuous frequencies
  Color Characteristics:
    Red  : 0.5878, 0.3652
    Green: 0.3457, 0.5820
    Blue : 0.1611, 0.1152
    White: 0.3134, 0.3291
  Established Timings I & II: none
  Standard Timings: none
  Detailed Timing Descriptors:
    DTD 1:  1920x1200   60.002225 Hz  16:10    75.603 kHz    161.790000 MHz (302 mm x 188 mm)
                 Hfront   48 Hsync  32 Hback  140 Hpol P
                 Vfront    3 Vsync   6 Vback   51 Vpol N
    Display Range Limits:
      Monitor ranges (Range Limits Only): 40-60 Hz V, 76-76 kHz H, max dotclock 160 MHz
    Alphanumeric Data String: 'BOE CQ'
    Display Product Name: 'NV140WUM-N4H'
  Extension blocks: 1
Checksum: 0x64

----------------

Block 1, DisplayID Extension Block:
  Version: 2.0
  Extension Count: 0
  Display Product Primary Use Case: None of the listed primary use cases; generic display
  CTA-861 DisplayID Data Block:
  Vendor-Specific Data Block (AMD), OUI 00-00-1A:
    Version: 3
    Flags 1: 0x01
      FreeSync Supported
    Minimum Refresh Rate: 40 Hz
    Maximum Refresh Rate: 60 Hz
    Flags 5: 0x00
    Additional Sink Information Address: 0x403
  Checksum: 0xd5
Checksum: 0x90

----------------

Warnings:

EDID:
  Base EDID: Some timings are out of range of the Monitor Ranges:
    Maximum Clock: 161.790 MHz (Monitor: 160.000 MHz)
    Could be due to a Monitor Range off-by-one rounding issue

Failures:

EDID:
  Extension Block 2 started with EDID header, ignoring Extension Blocks >= 2.
  DisplayID: Missing DisplayID Display Parameters Data Block.
  DisplayID: Missing DisplayID Type VII Detailed Timing Data Block.
  DisplayID: DisplayID expects at least one preferred timing.

EDID conformity: FAIL
