edid-decode (hex):

00 ff ff ff ff ff ff 00 06 d8 56 00 00 00 00 00
1e 21 01 03 80 3c 22 78 2a a0 95 ab 50 48 a6 27
12 50 54 20 00 00 01 01 01 01 01 01 01 01 01 01
01 01 01 01 01 01 56 5e 00 a0 a0 a0 29 50 30 20
35 00 55 50 21 00 00 1a f8 e3 00 a0 a0 a0 32 50
08 20 98 04 55 50 21 00 00 1e 00 00 00 fc 00 41
56 54 20 47 43 35 35 33 47 32 0a 20 00 00 00 fd
00 30 90 1e f0 3c 00 0a 20 20 20 20 20 20 01 ea

02 03 3b f1 47 90 61 60 5f 3f 04 03 23 09 17 07
6b 03 0c 00 20 00 38 3c 20 00 20 01 67 d8 5d c4
01 78 80 03 68 1a 00 00 01 01 30 90 00 e3 05 c0
00 e2 0f 06 e6 06 07 01 65 65 00 6f c2 00 a0 a0
a0 55 50 30 20 35 00 55 50 21 00 00 1a 02 3a 80
18 71 38 2d 40 58 2c 45 00 55 50 21 00 00 1e 00
00 00 00 00 00 00 00 00 00 00 00 00 00 00 00 00
00 00 00 00 00 00 00 00 00 00 00 00 00 00 00 4a

00 ff ff ff ff ff ff 00 06 d8 56 00 00 00 00 00
1e 21 01 03 80 3c 22 78 2a a0 95 ab 50 48 a6 27
12 50 54 20 00 00 01 01 01 01 01 01 01 01 01 01
01 01 01 01 01 01 56 5e 00 a0 a0 a0 29 50 30 20
35 00 55 50 21 00 00 1a f8 e3 00 a0 a0 a0 32 50
08 20 98 04 55 50 21 00 00 1e 00 00 00 fc 00 41
56 54 20 47 43 35 35 33 47 32 0a 20 00 00 00 fd
00 30 90 1e f0 3c 00 0a 20 20 20 20 20 20 01 ea

02 03 3b f1 47 90 61 60 5f 3f 04 03 23 09 17 07
6b 03 0c 00 20 00 38 3c 20 00 20 01 67 d8 5d c4
01 78 80 03 68 1a 00 00 01 01 30 90 00 e3 05 c0
00 e2 0f 06 e6 06 07 01 65 65 00 6f c2 00 a0 a0
a0 55 50 30 20 35 00 55 50 21 00 00 1a 02 3a 80
18 71 38 2d 40 58 2c 45 00 55 50 21 00 00 1e 00
00 00 00 00 00 00 00 00 00 00 00 00 00 00 00 00
00 00 00 00 00 00 00 00 00 00 00 00 00 00 00 4a

----------------

Block 0, Base EDID:
  EDID Structure Version & Revision: 1.3
  Vendor & Product Identification:
    Manufacturer: AVX
    Model: 86
    Made in: week 30 of 2023
  Basic Display Parameters & Features:
    Digital display
    Maximum image size: 60 cm x 34 cm
    Gamma: 2.20
    DPMS levels: Off
    RGB color display
    First detailed timing is the preferred timing
  Color Characteristics:
    Red  : 0.6699, 0.3144
    Green: 0.2812, 0.6484
    Blue : 0.1542, 0.0712
    White: 0.3134, 0.3291
  Established Timings I & II:
    DMT 0x04:   640x480    59.940476 Hz   4:3     31.469 kHz     25.175000 MHz
  Standard Timings: none
  Detailed Timing Descriptors:
    DTD 1:  2560x1440   59.950550 Hz  16:9     88.787 kHz    241.500000 MHz (597 mm x 336 mm)
                 Hfront   48 Hsync  32 Hback   80 Hpol P
                 Vfront    3 Vsync   5 Vback   33 Vpol N
    DTD 2:  2560x1440  143.999210 Hz  16:9    214.559 kHz    583.600000 MHz (597 mm x 336 mm)
                 Hfront    8 Hsync  32 Hback  120 Hpol P
                 Vfront   25 Vsync   8 Vback   17 Vpol P
    Display Product Name: 'AVT GC553G2'
    Display Range Limits:
      Monitor ranges (GTF): 48-144 Hz V, 30-240 kHz H, max dotclock 600 MHz
  Extension blocks: 1
Checksum: 0xea

----------------

Block 1, CTA-861 Extension Block:
  Revision: 3
  Underscans IT Video Formats by default
  Basic audio support
  Supports YCbCr 4:4:4
  Supports YCbCr 4:2:2
  Native DTDs: 1
  Video Data Block:
    VIC  16:  1920x1080   60.000000 Hz  16:9     67.500 kHz    148.500000 MHz (native)
    VIC  97:  3840x2160   60.000000 Hz  16:9    135.000 kHz    594.000000 MHz
    VIC  96:  3840x2160   50.000000 Hz  16:9    112.500 kHz    594.000000 MHz
    VIC  95:  3840x2160   30.000000 Hz  16:9     67.500 kHz    297.000000 MHz
    VIC  63:  1920x1080  120.000000 Hz  16:9    135.000 kHz    297.000000 MHz
    VIC   4:  1280x720    60.000000 Hz  16:9     45.000 kHz     74.250000 MHz
    VIC   3:   720x480    59.940060 Hz  16:9     31.469 kHz     27.000000 MHz
  Audio Data Block:
    Linear PCM:
      Max channels: 2
      Supported sample rates (kHz): 96 48 44.1 32
      Supported sample sizes (bits): 24 20 16
  Vendor-Specific Data Block (HDMI), OUI 00-0C-03:
    Source physical address: 2.0.0.0
    DC_36bit
    DC_30bit
    DC_Y444
    Maximum TMDS clock: 300 MHz
    Extended HDMI video details:
      HDMI VICs:
        HDMI VIC 1:  3840x2160   30.000000 Hz  16:9     67.500 kHz    297.000000 MHz
  Vendor-Specific Data Block (HDMI Forum), OUI C4-5D-D8:
    Version: 1
    Maximum TMDS Character Rate: 600 MHz
    SCDC Present
    Supports 12-bits/component Deep Color 4:2:0 Pixel Encoding
    Supports 10-bits/component Deep Color 4:2:0 Pixel Encoding
  Vendor-Specific Data Block (AMD), OUI 00-00-1A:
    Version: 1
    Feature Caps: 0x01
    Minimum Refresh Rate: 48 Hz
    Maximum Refresh Rate: 144 Hz
    Flags 1.x: 0x00
  Colorimetry Data Block:
    BT2020YCC
    BT2020RGB
  YCbCr 4:2:0 Capability Map Data Block:
    VIC  97:  3840x2160   60.000000 Hz  16:9    135.000 kHz    594.000000 MHz
    VIC  96:  3840x2160   50.000000 Hz  16:9    112.500 kHz    594.000000 MHz
  HDR Static Metadata Data Block:
    Electro optical transfer functions:
      Traditional gamma - SDR luminance range
      Traditional gamma - HDR luminance range
      SMPTE ST2084
    Supported static metadata descriptors:
      Static metadata type 1
    Desired content max luminance: 101 (445.755 cd/m^2)
    Desired content max frame-average luminance: 101 (445.755 cd/m^2)
    Desired content min luminance: 0 (0.000 cd/m^2)
  Detailed Timing Descriptors:
    DTD 3:  2560x1440  119.997589 Hz  16:9    182.996 kHz    497.750000 MHz (597 mm x 336 mm)
                 Hfront   48 Hsync  32 Hback   80 Hpol P
                 Vfront    3 Vsync   5 Vback   77 Vpol N
    DTD 4:  1920x1080   60.000000 Hz  16:9     67.500 kHz    148.500000 MHz (597 mm x 336 mm)
                 Hfront   88 Hsync  44 Hback  148 Hpol P
                 Vfront    4 Vsync   5 Vback   36 Vpol P
Checksum: 0x4a  Unused space in Extension Block: 32 bytes

----------------

Warnings:

Block 1, CTA-861 Extension Block:
  Video Data Block: VIC 16 and the first DTD are not identical. Is this intended?
  Colorimetry Data Block: Set the sRGB colorimetry bit to avoid interop issues.
EDID:
  Base EDID: Some timings are out of range of the Monitor Ranges:
    Vertical Freq: 30.000 - 143.999 Hz (Monitor: 48.000 - 144.000 Hz)

Failures:

Block 1, CTA-861 Extension Block:
  Vendor-Specific Data Block (HDMI Forum), OUI C4-5D-D8: HDMI VIC and related CTA VIC codes are present, but the UHD VIC bit is 0.
  Missing VCDB, needed for Set Selectable RGB Quantization to avoid interop issues.
EDID:
  Extension Block 2 started with EDID header, ignoring Extension Blocks >= 2.
  CTA-861: Native progressive timings are a mix of several resolutions.

EDID conformity: FAIL
