edid-decode (hex):

00 ff ff ff ff ff ff 00 30 e4 54 07 00 00 00 00
00 21 01 04 a5 1e 13 78 06 be 95 a5 54 4c 99 24
0e 50 54 00 00 00 01 01 01 01 01 01 01 01 01 01
01 01 01 01 01 01 ec 68 00 a0 a0 40 2e 60 30 20
36 00 2e bc 10 00 00 1a f0 53 00 a0 a0 40 2e 60
30 20 36 00 2e bc 10 00 00 1a 00 00 00 fe 00 46
58 50 34 38 82 31 34 30 57 51 41 0a 00 00 00 00
00 02 41 31 a8 00 11 00 00 0a 81 0a 20 20 00 bb

00 ff ff ff ff ff ff 00 30 e4 54 07 00 00 00 00
00 21 01 04 a5 1e 13 78 06 be 95 a5 54 4c 99 24
0e 50 54 00 00 00 01 01 01 01 01 01 01 01 01 01
01 01 01 01 01 01 ec 68 00 a0 a0 40 2e 60 30 20
36 00 2e bc 10 00 00 1a f0 53 00 a0 a0 40 2e 60
30 20 36 00 2e bc 10 00 00 1a 00 00 00 fe 00 46
58 50 34 38 82 31 34 30 57 51 41 0a 00 00 00 00
00 02 41 31 a8 00 11 00 00 0a 81 0a 20 20 00 bb

----------------

Block 0, Base EDID:
  EDID Structure Version & Revision: 1.4
  Vendor & Product Identification:
    Manufacturer: LGD
    Model: 1876
    Made in: 2023
  Basic Display Parameters & Features:
    Digital display
    Bits per primary color channel: 8
    DisplayPort interface
    Maximum image size: 30 cm x 19 cm
    Gamma: 2.20
    Supported color formats: RGB 4:4:4
    Default (sRGB) color space is primary color space
    First detailed timing includes the native pixel format and preferred refresh rate
  Color Characteristics:
    Red  : 0.6464, 0.3310
    Green: 0.2998, 0.5996
    Blue : 0.1425, 0.0556
    White: 0.3134, 0.3291
  Established Timings I & II: none
  Standard Timings: none
  Detailed Timing Descriptors:
    DTD 1:  2560x1600   59.993925 Hz  16:10    98.750 kHz    268.600000 MHz (302 mm x 188 mm)
                 Hfront   48 Hsync  32 Hback   80 Hpol P
                 Vfront    3 Vsync   6 Vback   37 Vpol N
    DTD 2:  2560x1600   47.995140 Hz  16:10    79.000 kHz    214.880000 MHz (302 mm x 188 mm)
                 Hfront   48 Hsync  32 Hback   80 Hpol P
                 Vfront    3 Vsync   6 Vback   37 Vpol N
    Alphanumeric Data String: 'FXP48.140WQA'
    Manufacturer-Specified Display Descriptor (0x00): 00 00 00 02 41 31 a8 00 11 00 00 0a 81 0a 20 20 '....A1........  '
Checksum: 0xbb

----------------

Block 1, Unknown EDID Extension Block 0x00:
  00 ff ff ff ff ff ff 00 30 e4 54 07 00 00 00 00 '........0.T.....'
  00 21 01 04 a5 1e 13 78 06 be 95 a5 54 4c 99 24 '.!.....x....TL.$'
  0e 50 54 00 00 00 01 01 01 01 01 01 01 01 01 01 '.PT.............'
  01 01 01 01 01 01 ec 68 00 a0 a0 40 2e 60 30 20 '.......h...@.`0 '
  36 00 2e bc 10 00 00 1a f0 53 00 a0 a0 40 2e 60 '6........S...@.`'
  30 20 36 00 2e bc 10 00 00 1a 00 00 00 fe 00 46 '0 6............F'
  58 50 34 38 82 31 34 30 57 51 41 0a 00 00 00 00 'XP48.140WQA.....'
  00 02 41 31 a8 00 11 00 00 0a 81 0a 20 20 00 bb '..A1........  ..'
Checksum: 0xbb

----------------

Warnings:

Block 0, Base EDID:
  Alphanumeric Data String: Non-ASCII character 0x82 at position 5, can cause problems.
  Missing Display Product Name.

Failures:

Block 0, Base EDID:
  Basic Display Parameters & Features: sRGB is signaled, but the chromaticities do not match.
Block 1, Base EDID:
  Unknown Extension Block.
EDID:
  Base EDID: EDID specified 0 extension block(s), but found 1 extension block(s).

EDID conformity: FAIL
