edid-decode (hex):

00 ff ff ff ff ff ff 00 28 9a 2d 10 00 00 00 00
31 21 01 04 a5 1d 11 78 0b fe d7 a0 57 4e 89 23
18 50 56 00 00 00 01 01 01 01 01 01 01 01 01 01
01 01 01 01 01 01 96 3b 80 36 71 38 3c 40 30 20
36 00 26 a5 10 00 00 1a 00 00 00 00 00 00 00 00
00 00 00 00 58 c2 10 00 00 1a 00 00 00 fe 00 47
31 33 33 45 42 30 35 0a 20 20 20 20 00 00 00 fe
00 47 31 33 33 45 42 30 35 0a 20 20 20 20 00 b7

00 ff ff ff ff ff ff 00 28 9a 2d 10 00 00 00 00
31 21 01 04 a5 1d 11 78 0b fe d7 a0 57 4e 89 23
18 50 56 00 00 00 01 01 01 01 01 01 01 01 01 01
01 01 01 01 01 01 96 3b 80 36 71 38 3c 40 30 20
36 00 26 a5 10 00 00 1a 00 00 00 00 00 00 00 00
00 00 00 00 58 c2 10 00 00 1a 00 00 00 fe 00 47
31 33 33 45 42 30 35 0a 20 20 20 20 00 00 00 fe
00 47 31 33 33 45 42 30 35 0a 20 20 20 20 00 b7

----------------

Block 0, Base EDID:
  EDID Structure Version & Revision: 1.4
  Vendor & Product Identification:
    Manufacturer: JDZ
    Model: 4141
    Made in: week 49 of 2023
  Basic Display Parameters & Features:
    Digital display
    Bits per primary color channel: 8
    DisplayPort interface
    Maximum image size: 29 cm x 17 cm
    Gamma: 2.20
    Supported color formats: RGB 4:4:4, YCrCb 4:4:4
    First detailed timing includes the native pixel format and preferred refresh rate
    Display supports continuous frequencies
  Color Characteristics:
    Red  : 0.6279, 0.3427
    Green: 0.3076, 0.5371
    Blue : 0.1396, 0.0947
    White: 0.3134, 0.3388
  Established Timings I & II: none
  Standard Timings: none
  Detailed Timing Descriptors:
    DTD 1:  1920x1080   60.003147 Hz  16:9     68.404 kHz    152.540000 MHz (294 mm x 165 mm)
                 Hfront   48 Hsync  32 Hback  230 Hpol P
                 Vfront    3 Vsync   6 Vback   51 Vpol N
    Manufacturer-Specified Display Descriptor (0x00): 00 00 00 00 00 00 00 00 00 00 58 c2 10 00 00 1a '..........X.....'
    Alphanumeric Data String: 'G133EB05'
    Alphanumeric Data String: 'G133EB05'
Checksum: 0xb7

----------------

Warnings:

Block 0, Base EDID:
  Missing Display Product Name.

Failures:

Block 0, Base EDID:
  Missing Display Range Limits Descriptor.
EDID:
  Extension Block 1 started with EDID header, ignoring Extension Blocks >= 1.

EDID conformity: FAIL
