edid-decode (hex):

00 ff ff ff ff ff ff 00 09 e5 4d 0b 00 00 00 00
12 20 01 04 a5 1e 13 78 03 fb f5 96 5d 5a 91 29
1e 50 54 00 00 00 01 01 01 01 01 01 01 01 01 01
01 01 01 01 01 01 61 40 80 04 71 b0 3c 40 30 20
36 00 2d bc 10 00 00 1a 81 33 80 04 71 b0 3c 40
30 20 36 00 2d bc 10 00 00 1a 00 00 00 fd 00 28
3c 4c 4c 10 01 0a 20 20 20 20 20 20 00 00 00 fe
00 4e 56 31 34 30 57 55 4d 2d 4e 34 34 0a 01 b4

02 03 0d 00 68 1a 00 00 01 01 28 3c 00 00 00 00
00 00 00 00 00 00 00 00 00 00 00 00 00 00 00 00
00 00 00 00 00 00 00 00 00 00 00 00 00 00 00 00
00 00 00 00 00 00 00 00 00 00 00 00 00 00 00 00
00 00 00 00 00 00 00 00 00 00 00 00 00 00 00 00
00 00 00 00 00 00 00 00 00 00 00 00 00 00 00 00
00 00 00 00 00 00 00 00 00 00 00 00 00 00 00 00
00 00 00 00 00 00 00 00 00 00 00 00 00 00 00 06

00 ff ff ff ff ff ff 00 09 e5 4d 0b 00 00 00 00
12 20 01 04 a5 1e 13 78 03 fb f5 96 5d 5a 91 29
1e 50 54 00 00 00 01 01 01 01 01 01 01 01 01 01
01 01 01 01 01 01 61 40 80 04 71 b0 3c 40 30 20
36 00 2d bc 10 00 00 1a 81 33 80 04 71 b0 3c 40
30 20 36 00 2d bc 10 00 00 1a 00 00 00 fd 00 28
3c 4c 4c 10 01 0a 20 20 20 20 20 20 00 00 00 fe
00 4e 56 31 34 30 57 55 4d 2d 4e 34 34 0a 01 b4

02 03 0d 00 68 1a 00 00 01 01 28 3c 00 00 00 00
00 00 00 00 00 00 00 00 00 00 00 00 00 00 00 00
00 00 00 00 00 00 00 00 00 00 00 00 00 00 00 00
00 00 00 00 00 00 00 00 00 00 00 00 00 00 00 00
00 00 00 00 00 00 00 00 00 00 00 00 00 00 00 00
00 00 00 00 00 00 00 00 00 00 00 00 00 00 00 00
00 00 00 00 00 00 00 00 00 00 00 00 00 00 00 00
00 00 00 00 00 00 00 00 00 00 00 00 00 00 00 06

----------------

Block 0, Base EDID:
  EDID Structure Version & Revision: 1.4
  Vendor & Product Identification:
    Manufacturer: BOE
    Model: 2893
    Made in: week 18 of 2022
  Basic Display Parameters & Features:
    Digital display
    Bits per primary color channel: 8
    DisplayPort interface
    Maximum image size: 30 cm x 19 cm
    Gamma: 2.20
    Supported color formats: RGB 4:4:4
    First detailed timing includes the native pixel format and preferred refresh rate
    Display supports continuous frequencies
  Color Characteristics:
    Red  : 0.5888, 0.3662
    Green: 0.3535, 0.5693
    Blue : 0.1630, 0.1201
    White: 0.3134, 0.3291
  Established Timings I & II: none
  Standard Timings: none
  Detailed Timing Descriptors:
    DTD 1:  1920x1200   60.000728 Hz  16:10    75.601 kHz    164.810000 MHz (301 mm x 188 mm)
                 Hfront   48 Hsync  32 Hback  180 Hpol P
                 Vfront    3 Vsync   6 Vback   51 Vpol N
    DTD 2:  1920x1200   48.001311 Hz  16:10    60.482 kHz    131.850000 MHz (301 mm x 188 mm)
                 Hfront   48 Hsync  32 Hback  180 Hpol P
                 Vfront    3 Vsync   6 Vback   51 Vpol N
    Display Range Limits:
      Monitor ranges (Range Limits Only): 40-60 Hz V, 76-76 kHz H, max dotclock 160 MHz
    Alphanumeric Data String: 'NV140WUM-N44'
  Extension blocks: 1
Checksum: 0xb4

----------------

Block 1, CTA-861 Extension Block:
  Revision: 3
  Native DTDs: 0
  Vendor-Specific Data Block (AMD), OUI 00-00-1A:
    Version: 1
    Feature Caps: 0x01
    Minimum Refresh Rate: 40 Hz
    Maximum Refresh Rate: 60 Hz
    Flags 1.x: 0x00
Checksum: 0x06  Unused space in Extension Block: 114 bytes

----------------

Warnings:

Block 0, Base EDID:
  Missing Display Product Name.
Block 1, CTA-861 Extension Block:
  IT Video Formats are overscanned by default, but normally this should be underscanned.
  Add a Colorimetry Data Block with the sRGB colorimetry bit set to avoid interop issues.
EDID:
  Base EDID: Some timings are out of range of the Monitor Ranges:
    Horizontal Freq: 60.481 - 75.600 kHz (Monitor: 76.000 - 76.000 kHz)
    Maximum Clock: 164.810 MHz (Monitor: 160.000 MHz)

Failures:

Block 1, CTA-861 Extension Block:
  Required 640x480p60 timings are missing in the established timings and the SVD list (VIC 1).
  Missing VCDB, needed for Set Selectable RGB Quantization to avoid interop issues.
EDID:
  Extension Block 2 started with EDID header, ignoring Extension Blocks >= 2.

EDID conformity: FAIL
