edid-decode (hex):

00 ff ff ff ff ff ff 00 41 2f 34 00 01 01 01 01
00 0f 01 03 80 6e 3e 78 6a 0b 32 a0 56 3b b3 29
13 48 49 bf ee 80 31 59 45 59 61 59 71 40 81 40
81 80 90 40 01 01 64 19 00 40 41 00 26 30 18 88
36 00 3b 6c 32 00 00 18 0e 1f 00 80 51 00 1e 30
40 80 37 00 4e 6c 42 00 00 1c 00 00 00 fd 00 37
3d 18 41 0c 00 0a 20 20 20 20 20 20 00 00 00 fc
00 50 44 50 2d 35 30 34 43 4d 58 0a 20 20 00 0d

00 ff ff ff ff ff ff 00 41 2f 34 00 01 01 01 01
00 0f 01 03 80 6e 3e 78 6a 0b 32 a0 56 3b b3 29
13 48 49 bf ee 80 31 59 45 59 61 59 71 40 81 40
81 80 90 40 01 01 64 19 00 40 41 00 26 30 18 88
36 00 3b 6c 32 00 00 18 0e 1f 00 80 51 00 1e 30
40 80 37 00 4e 6c 42 00 00 1c 00 00 00 fd 00 37
3d 18 41 0c 00 0a 20 20 20 20 20 20 00 00 00 fc
00 50 44 50 2d 35 30 34 43 4d 58 0a 20 20 00 0d

----------------

Block 0, Base EDID:
  EDID Structure Version & Revision: 1.3
  Vendor & Product Identification:
    Manufacturer: PIO
    Model: 52
    Serial Number: ...
    Made in: 2005
  Basic Display Parameters & Features:
    Digital display
    Maximum image size: 110 cm x 62 cm
    Gamma: 2.20
    DPMS levels: Suspend Off
    RGB color display
    First detailed timing is the preferred timing
  Color Characteristics:
    Red  : 0.6250, 0.3359
    Green: 0.2324, 0.7021
    Blue : 0.1601, 0.0771
    White: 0.2812, 0.2871
  Established Timings I & II:
    IBM     :   720x400    70.081663 Hz   9:5     31.467 kHz     28.320000 MHz
    DMT 0x04:   640x480    59.940476 Hz   4:3     31.469 kHz     25.175000 MHz
    Apple   :   640x480    66.666667 Hz   4:3     35.000 kHz     30.240000 MHz
    DMT 0x05:   640x480    72.808802 Hz   4:3     37.861 kHz     31.500000 MHz
    DMT 0x06:   640x480    75.000000 Hz   4:3     37.500 kHz     31.500000 MHz
    DMT 0x08:   800x600    56.250000 Hz   4:3     35.156 kHz     36.000000 MHz
    DMT 0x09:   800x600    60.316541 Hz   4:3     37.879 kHz     40.000000 MHz
    DMT 0x0a:   800x600    72.187572 Hz   4:3     48.077 kHz     50.000000 MHz
    DMT 0x0b:   800x600    75.000000 Hz   4:3     46.875 kHz     49.500000 MHz
    Apple   :   832x624    74.551266 Hz   4:3     49.726 kHz     57.284000 MHz
    DMT 0x10:  1024x768    60.003840 Hz   4:3     48.363 kHz     65.000000 MHz
    DMT 0x11:  1024x768    70.069359 Hz   4:3     56.476 kHz     75.000000 MHz
    DMT 0x12:  1024x768    75.028582 Hz   4:3     60.023 kHz     78.750000 MHz
    Apple   :  1152x870    75.061550 Hz 192:145   68.681 kHz    100.000000 MHz
  Standard Timings:
    DMT 0x07:   640x480    85.008312 Hz   4:3     43.269 kHz     36.000000 MHz
    DMT 0x0c:   800x600    85.061274 Hz   4:3     53.674 kHz     56.250000 MHz
    DMT 0x13:  1024x768    84.996690 Hz   4:3     68.677 kHz     94.500000 MHz
    GTF     :  1152x864    60.000000 Hz   4:3     53.700 kHz     81.624000 MHz
    DMT 0x20:  1280x960    60.000000 Hz   4:3     60.000 kHz    108.000000 MHz
    DMT 0x23:  1280x1024   60.019740 Hz   5:4     63.981 kHz    108.000000 MHz
    DMT 0x2a:  1400x1050   59.978442 Hz   4:3     65.317 kHz    121.750000 MHz
  Detailed Timing Descriptors:
    DTD 1:  1024x768    60.003840 Hz   4:3     48.363 kHz     65.000000 MHz (827 mm x 620 mm)
                 Hfront   24 Hsync 136 Hback  160 Hpol N
                 Vfront    3 Vsync   6 Vback   29 Vpol N
    DTD 2:  1280x768    59.870228 Hz   5:3     47.776 kHz     79.500000 MHz (1102 mm x 620 mm)
                 Hfront   64 Hsync 128 Hback  192 Hpol N
                 Vfront    3 Vsync   7 Vback   20 Vpol P
    Display Range Limits:
      Monitor ranges (GTF): 55-61 Hz V, 24-65 kHz H, max dotclock 120 MHz
    Display Product Name: 'PDP-504CMX'
Checksum: 0x0d

----------------

Block 1, Unknown EDID Extension Block 0x00:
  00 ff ff ff ff ff ff 00 41 2f 34 00 01 01 01 01 '........A/4.....'
  00 0f 01 03 80 6e 3e 78 6a 0b 32 a0 56 3b b3 29 '.....n>xj.2.V;.)'
  13 48 49 bf ee 80 31 59 45 59 61 59 71 40 81 40 '.HI...1YEYaYq@.@'
  81 80 90 40 01 01 64 19 00 40 41 00 26 30 18 88 '...@..d..@A.&0..'
  36 00 3b 6c 32 00 00 18 0e 1f 00 80 51 00 1e 30 '6.;l2.......Q..0'
  40 80 37 00 4e 6c 42 00 00 1c 00 00 00 fd 00 37 '@.7.NlB........7'
  3d 18 41 0c 00 0a 20 20 20 20 20 20 00 00 00 fc '=.A...      ....'
  00 50 44 50 2d 35 30 34 43 4d 58 0a 20 20 00 0d '.PDP-504CMX.  ..'
Checksum: 0x0d

----------------

Warnings:

Block 0, Base EDID:
  Vendor & Product Identification: The serial number is one of the known dummy values, it should probably be set to 0.
  Detailed Timing Descriptor #2: Image size is 1102x620 mm, but based on the picture AR it should be 1102x661 mm.
EDID:
  Base EDID: Some timings are out of range of the Monitor Ranges:
    Vertical Freq: 56.250 - 85.061 Hz (Monitor: 55.000 - 61.000 Hz)
    Horizontal Freq: 31.466 - 68.681 kHz (Monitor: 24.000 - 65.000 kHz)
    Maximum Clock: 121.750 MHz (Monitor: 120.000 MHz)

Failures:

Block 1, Base EDID:
  Unknown Extension Block.
EDID:
  Base EDID: EDID specified 0 extension block(s), but found 1 extension block(s).

EDID conformity: FAIL
