edid-decode (hex):

00 ff ff ff ff ff ff 00 5a 63 3f 7a 00 00 00 00
13 21 01 03 80 35 1e 78 2e 1d f5 ae 4f 35 b3 25
0d 50 54 ff ff 80 81 c0 81 40 81 80 90 40 95 00
01 01 01 01 01 01 02 3a 80 18 71 38 2d 40 30 20
35 00 12 2c 21 00 00 1e 00 00 00 fc 00 56 58 32
34 36 32 20 73 65 72 69 65 73 00 00 00 fd 00 30
a5 3c de 27 00 0a 20 20 20 20 20 20 00 00 00 ff
00 58 42 56 32 33 31 39 30 30 30 39 38 0a 01 70

02 03 3c f1 4c 01 07 03 16 12 13 04 14 1f 05 90
3f 23 09 7f 07 83 01 00 00 67 03 0c 00 10 00 38
78 67 d8 5d c4 01 78 80 00 68 1a 00 00 01 01 30
a5 e6 e3 05 e3 03 e6 06 05 01 60 60 aa 86 80 b4
70 38 3c 40 30 20 35 00 58 4a 21 00 00 1e 9d 95
80 a0 70 38 24 40 30 20 35 00 58 4a 21 00 00 1e
00 00 00 00 00 00 00 00 00 00 00 00 00 00 00 00
00 00 00 00 00 00 00 00 00 00 00 00 00 00 00 fb

00 ff ff ff ff ff ff 00 5a 63 3f 7a 00 00 00 00
13 21 01 03 80 35 1e 78 2e 1d f5 ae 4f 35 b3 25
0d 50 54 ff ff 80 81 c0 81 40 81 80 90 40 95 00
01 01 01 01 01 01 02 3a 80 18 71 38 2d 40 30 20
35 00 12 2c 21 00 00 1e 00 00 00 fc 00 56 58 32
34 36 32 20 73 65 72 69 65 73 00 00 00 fd 00 30
a5 3c de 27 00 0a 20 20 20 20 20 20 00 00 00 ff
00 58 42 56 32 33 31 39 30 30 30 39 38 0a 01 70

02 03 3c f1 4c 01 07 03 16 12 13 04 14 1f 05 90
3f 23 09 7f 07 83 01 00 00 67 03 0c 00 10 00 38
78 67 d8 5d c4 01 78 80 00 68 1a 00 00 01 01 30
a5 e6 e3 05 e3 03 e6 06 05 01 60 60 aa 86 80 b4
70 38 3c 40 30 20 35 00 58 4a 21 00 00 1e 9d 95
80 a0 70 38 24 40 30 20 35 00 58 4a 21 00 00 1e
00 00 00 00 00 00 00 00 00 00 00 00 00 00 00 00
00 00 00 00 00 00 00 00 00 00 00 00 00 00 00 fb

----------------

Block 0, Base EDID:
  EDID Structure Version & Revision: 1.3
  Vendor & Product Identification:
    Manufacturer: VSC
    Model: 31295
    Made in: week 19 of 2023
  Basic Display Parameters & Features:
    Digital display
    Maximum image size: 53 cm x 30 cm
    Gamma: 2.20
    DPMS levels: Off
    RGB color display
    Default (sRGB) color space is primary color space
    First detailed timing is the preferred timing
  Color Characteristics:
    Red  : 0.6796, 0.3095
    Green: 0.2099, 0.7001
    Blue : 0.1474, 0.0537
    White: 0.3134, 0.3291
  Established Timings I & II:
    IBM     :   720x400    70.081663 Hz   9:5     31.467 kHz     28.320000 MHz
    IBM     :   720x400    87.849542 Hz   9:5     39.444 kHz     35.500000 MHz
    DMT 0x04:   640x480    59.940476 Hz   4:3     31.469 kHz     25.175000 MHz
    Apple   :   640x480    66.666667 Hz   4:3     35.000 kHz     30.240000 MHz
    DMT 0x05:   640x480    72.808802 Hz   4:3     37.861 kHz     31.500000 MHz
    DMT 0x06:   640x480    75.000000 Hz   4:3     37.500 kHz     31.500000 MHz
    DMT 0x08:   800x600    56.250000 Hz   4:3     35.156 kHz     36.000000 MHz
    DMT 0x09:   800x600    60.316541 Hz   4:3     37.879 kHz     40.000000 MHz
    DMT 0x0a:   800x600    72.187572 Hz   4:3     48.077 kHz     50.000000 MHz
    DMT 0x0b:   800x600    75.000000 Hz   4:3     46.875 kHz     49.500000 MHz
    Apple   :   832x624    74.551266 Hz   4:3     49.726 kHz     57.284000 MHz
    DMT 0x0f:  1024x768i   86.957532 Hz   4:3     35.522 kHz     44.900000 MHz
    DMT 0x10:  1024x768    60.003840 Hz   4:3     48.363 kHz     65.000000 MHz
    DMT 0x11:  1024x768    70.069359 Hz   4:3     56.476 kHz     75.000000 MHz
    DMT 0x12:  1024x768    75.028582 Hz   4:3     60.023 kHz     78.750000 MHz
    DMT 0x24:  1280x1024   75.024675 Hz   5:4     79.976 kHz    135.000000 MHz
    Apple   :  1152x870    75.061550 Hz 192:145   68.681 kHz    100.000000 MHz
  Standard Timings:
    DMT 0x55:  1280x720    60.000000 Hz  16:9     45.000 kHz     74.250000 MHz
    DMT 0x20:  1280x960    60.000000 Hz   4:3     60.000 kHz    108.000000 MHz
    DMT 0x23:  1280x1024   60.019740 Hz   5:4     63.981 kHz    108.000000 MHz
    DMT 0x2a:  1400x1050   59.978442 Hz   4:3     65.317 kHz    121.750000 MHz
    DMT 0x2f:  1440x900    59.887445 Hz  16:10    55.935 kHz    106.500000 MHz
  Detailed Timing Descriptors:
    DTD 1:  1920x1080   60.000000 Hz  16:9     67.500 kHz    148.500000 MHz (530 mm x 300 mm)
                 Hfront   48 Hsync  32 Hback  200 Hpol P
                 Vfront    3 Vsync   5 Vback   37 Vpol P
    Display Product Name: 'VX2462 series'
    Display Range Limits:
      Monitor ranges (GTF): 48-165 Hz V, 60-222 kHz H, max dotclock 390 MHz
    Display Product Serial Number: ...
  Extension blocks: 1
Checksum: 0x70

----------------

Block 1, CTA-861 Extension Block:
  Revision: 3
  Underscans IT Video Formats by default
  Basic audio support
  Supports YCbCr 4:4:4
  Supports YCbCr 4:2:2
  Native DTDs: 1
  Video Data Block:
    VIC   1:   640x480    59.940476 Hz   4:3     31.469 kHz     25.175000 MHz
    VIC   7:  1440x480i   59.940060 Hz  16:9     15.734 kHz     27.000000 MHz
    VIC   3:   720x480    59.940060 Hz  16:9     31.469 kHz     27.000000 MHz
    VIC  22:  1440x576i   50.000000 Hz  16:9     15.625 kHz     27.000000 MHz
    VIC  18:   720x576    50.000000 Hz  16:9     31.250 kHz     27.000000 MHz
    VIC  19:  1280x720    50.000000 Hz  16:9     37.500 kHz     74.250000 MHz
    VIC   4:  1280x720    60.000000 Hz  16:9     45.000 kHz     74.250000 MHz
    VIC  20:  1920x1080i  50.000000 Hz  16:9     28.125 kHz     74.250000 MHz
    VIC  31:  1920x1080   50.000000 Hz  16:9     56.250 kHz    148.500000 MHz
    VIC   5:  1920x1080i  60.000000 Hz  16:9     33.750 kHz     74.250000 MHz
    VIC  16:  1920x1080   60.000000 Hz  16:9     67.500 kHz    148.500000 MHz (native)
    VIC  63:  1920x1080  120.000000 Hz  16:9    135.000 kHz    297.000000 MHz
  Audio Data Block:
    Linear PCM:
      Max channels: 2
      Supported sample rates (kHz): 192 176.4 96 88.2 48 44.1 32
      Supported sample sizes (bits): 24 20 16
  Speaker Allocation Data Block:
    FL/FR - Front Left/Right
  Vendor-Specific Data Block (HDMI), OUI 00-0C-03:
    Source physical address: 1.0.0.0
    DC_36bit
    DC_30bit
    DC_Y444
    Maximum TMDS clock: 600 MHz
  Vendor-Specific Data Block (HDMI Forum), OUI C4-5D-D8:
    Version: 1
    Maximum TMDS Character Rate: 600 MHz
    SCDC Present
  Vendor-Specific Data Block (AMD), OUI 00-00-1A:
    Version: 1
    Feature Caps: 0x01
    Minimum Refresh Rate: 48 Hz
    Maximum Refresh Rate: 165 Hz
    Flags 1.x: 0xe6 (MCCS)
  Colorimetry Data Block:
    xvYCC601
    xvYCC709
    BT2020cYCC
    BT2020YCC
    BT2020RGB
    Gamut Boundary Description Metadata Profile P0
    Reserved F41
  HDR Static Metadata Data Block:
    Electro optical transfer functions:
      Traditional gamma - SDR luminance range
      SMPTE ST2084
    Supported static metadata descriptors:
      Static metadata type 1
    Desired content max luminance: 96 (400.000 cd/m^2)
    Desired content max frame-average luminance: 96 (400.000 cd/m^2)
    Desired content min luminance: 170 (1.778 cd/m^2)
  Detailed Timing Descriptors:
    DTD 2:  1920x1080  144.001671 Hz  16:9    164.162 kHz    344.740000 MHz (600 mm x 330 mm)
                 Hfront   48 Hsync  32 Hback  100 Hpol P
                 Vfront    3 Vsync   5 Vback   52 Vpol P
    DTD 3:  1920x1080  164.999483 Hz  16:9    184.139 kHz    383.010000 MHz (600 mm x 330 mm)
                 Hfront   48 Hsync  32 Hback   80 Hpol P
                 Vfront    3 Vsync   5 Vback   28 Vpol P
Checksum: 0xfb  Unused space in Extension Block: 31 bytes

----------------

Warnings:

Block 0, Base EDID:
  Detailed Timing Descriptor #1: DTD is similar but not identical to VIC 16.
Block 1, CTA-861 Extension Block:
  Video Data Block: VIC 1 and the first DTD are not identical. Is this intended?
EDID:
  Base EDID: Some timings are out of range of the Monitor Ranges:
    Horizontal Freq: 15.625 - 184.139 kHz (Monitor: 60.000 - 222.000 kHz)

Failures:

Block 0, Base EDID:
  Basic Display Parameters & Features: sRGB is signaled, but the chromaticities do not match.
Block 1, CTA-861 Extension Block:
  Vendor-Specific Data Block (HDMI), OUI 00-0C-03: HDMI VSDB Max TMDS rate is > 340.
  Colorimetry Data Block: Reserved bits F41-F43 must be 0.
  Offset is 60, but should be 61.
  Detailed Timing Descriptor #2: Mismatch of image size 600x330 mm vs display size 530x300 mm.
  Detailed Timing Descriptor #3: Mismatch of image size 600x330 mm vs display size 530x300 mm.
  Missing VCDB, needed for Set Selectable RGB Quantization to avoid interop issues.
EDID:
  Extension Block 2 started with EDID header, ignoring Extension Blocks >= 2.
  Base EDID: The DTD max image size is 600x330mm, which is larger than the display size 530.0x300.0mm.

EDID conformity: FAIL
