edid-decode (hex):

00 ff ff ff ff ff ff 00 69 93 50 19 4f 46 36 13
22 19 01 03 68 ae f0 78 2a 26 4d a3 54 48 98 27
15 4f 53 bf ef 00 81 00 81 40 95 00 81 c0 01 01
01 01 01 01 01 01 2f 26 40 a0 60 84 1a 30 30 20
35 00 ae f0 10 00 00 1a 66 21 50 b0 51 00 1b 30
40 70 34 00 c4 fe 10 00 00 1e 00 00 00 fc 00 56
4d 44 2d 31 39 35 31 0a 20 20 20 20 30 2a 00 08
52 c0 28 30 60 70 36 00 20 56 00 00 00 18 00 75

----------------

Block 0, Base EDID:
  EDID Structure Version & Revision: 1.3
  Vendor & Product Identification:
    Manufacturer: ZLS
    Model: 6480
    Serial Number: ...
    Made in: week 34 of 2015
  Basic Display Parameters & Features:
    Analog display
    Signal Level Standard: 0.700 : 0.000 : 0.700 V p-p
    Blank level equals black level
    Sync: Separate
    Maximum image size: 174 cm x 240 cm
    Gamma: 2.20
    DPMS levels: Off
    RGB color display
    First detailed timing is the preferred timing
  Color Characteristics:
    Red  : 0.6367, 0.3300
    Green: 0.2822, 0.5957
    Blue : 0.1533, 0.0820
    White: 0.3115, 0.3251
  Established Timings I & II:
    IBM     :   720x400    70.081663 Hz   9:5     31.467 kHz     28.320000 MHz
    DMT 0x04:   640x480    59.940476 Hz   4:3     31.469 kHz     25.175000 MHz
    Apple   :   640x480    66.666667 Hz   4:3     35.000 kHz     30.240000 MHz
    DMT 0x05:   640x480    72.808802 Hz   4:3     37.861 kHz     31.500000 MHz
    DMT 0x06:   640x480    75.000000 Hz   4:3     37.500 kHz     31.500000 MHz
    DMT 0x08:   800x600    56.250000 Hz   4:3     35.156 kHz     36.000000 MHz
    DMT 0x09:   800x600    60.316541 Hz   4:3     37.879 kHz     40.000000 MHz
    DMT 0x0a:   800x600    72.187572 Hz   4:3     48.077 kHz     50.000000 MHz
    DMT 0x0b:   800x600    75.000000 Hz   4:3     46.875 kHz     49.500000 MHz
    Apple   :   832x624    74.551266 Hz   4:3     49.726 kHz     57.284000 MHz
    DMT 0x10:  1024x768    60.003840 Hz   4:3     48.363 kHz     65.000000 MHz
    DMT 0x11:  1024x768    70.069359 Hz   4:3     56.476 kHz     75.000000 MHz
    DMT 0x12:  1024x768    75.028582 Hz   4:3     60.023 kHz     78.750000 MHz
    DMT 0x24:  1280x1024   75.024675 Hz   5:4     79.976 kHz    135.000000 MHz
  Standard Timings:
    DMT 0x1c:  1280x800    59.810326 Hz  16:10    49.702 kHz     83.500000 MHz
    DMT 0x20:  1280x960    60.000000 Hz   4:3     60.000 kHz    108.000000 MHz
    DMT 0x2f:  1440x900    59.887445 Hz  16:10    55.935 kHz    106.500000 MHz
    DMT 0x55:  1280x720    60.000000 Hz  16:9     45.000 kHz     74.250000 MHz
  Detailed Timing Descriptors:
    DTD 1:  1600x900    59.978156 Hz  16:9     55.540 kHz     97.750000 MHz (430 mm x 240 mm)
                 Hfront   48 Hsync  32 Hback   80 Hpol P
                 Vfront    3 Vsync   5 Vback   18 Vpol N
    DTD 2:  1360x768    60.015162 Hz  85:48    47.712 kHz     85.500000 MHz (452 mm x 254 mm)
                 Hfront   64 Hsync 112 Hback  256 Hpol P
                 Vfront    3 Vsync   4 Vback   20 Vpol P
    Display Product Name: 'VMD-1951'
    DTD 3:  1280x960    60.000000 Hz   4:3     60.000 kHz    108.000000 MHz (32 mm x 86 mm)
                 Hfront   96 Hsync 112 Hback  312 Hpol N
                 Vfront    3 Vsync   6 Vback   31 Vpol N
Checksum: 0x75

----------------

Warnings:

Block 0, Base EDID:
  Detailed Timing Descriptor #2: DTD is similar but not identical to DMT 0x27.
  Detailed Timing Descriptor #3: DTD is similar but not identical to DMT 0x20.
  Detailed Timing Descriptor #3: Dubious image size (32x86 mm is smaller than 100x100 mm).

Failures:

Block 0, Base EDID:
  Detailed Timing Descriptor #1: Mismatch of image size 430x240 mm vs display size 1740x2400 mm.
  Detailed Timing Descriptor #2: Mismatch of image size 452x254 mm vs display size 1740x2400 mm.
  Detailed Timing Descriptor #3: Mismatch of image size 32x86 mm vs display size 1740x2400 mm.
  Detailed Timing Descriptor #3: Invalid detailed timing descriptor ordering.
  Missing Display Range Limits Descriptor.

EDID conformity: FAIL
