edid-decode (hex):

00 ff ff ff ff ff ff 00 22 f0 46 29 01 01 01 01
11 17 01 04 a5 30 1b 78 3e 95 25 a1 59 57 9f 27
0d 50 54 a1 08 00 81 c0 81 80 95 00 b3 00 d1 c0
01 01 01 01 01 01 02 3a 80 18 71 38 2d 40 58 2c
45 00 dc 0c 11 00 00 1e 00 00 00 fd 00 32 4c 18
5e 11 00 0a 20 20 20 20 20 20 00 00 00 fc 00 48
50 20 4c 41 32 32 30 36 0a 20 20 20 00 00 00 ff
00 33 43 51 33 31 37 30 48 46 34 0a 20 20 01 b9

02 03 16 f1 23 09 07 07 49 04 02 03 01 11 12 90
1f 13 83 01 00 00 8c 0a d0 8a 20 e0 2d 10 10 3e
96 00 58 54 21 00 00 18 8c 0a d0 90 20 40 31 20
0c 40 55 00 58 54 21 00 00 18 01 1d 00 72 51 d0
1e 20 6e 28 55 00 58 54 21 00 00 1f 01 1d 00 bc
52 d0 1e 20 b8 28 55 40 58 54 21 00 00 1e 00 00
00 00 00 00 00 00 00 00 00 00 00 00 00 00 00 00
00 00 00 00 00 00 00 00 00 00 00 00 00 00 00 7b

00 ff ff ff ff ff ff 00 22 f0 46 29 01 01 01 01
11 17 01 04 a5 30 1b 78 3e 95 25 a1 59 57 9f 27
0d 50 54 a1 08 00 81 c0 81 80 95 00 b3 00 d1 c0
01 01 01 01 01 01 02 3a 80 18 71 38 2d 40 58 2c
45 00 dc 0c 11 00 00 1e 00 00 00 fd 00 32 4c 18
5e 11 00 0a 20 20 20 20 20 20 00 00 00 fc 00 48
50 20 4c 41 32 32 30 36 0a 20 20 20 00 00 00 ff
00 33 43 51 33 31 37 30 48 46 34 0a 20 20 01 b9

02 03 16 f1 23 09 07 07 49 04 02 03 01 11 12 90
1f 13 83 01 00 00 8c 0a d0 8a 20 e0 2d 10 10 3e
96 00 58 54 21 00 00 18 8c 0a d0 90 20 40 31 20
0c 40 55 00 58 54 21 00 00 18 01 1d 00 72 51 d0
1e 20 6e 28 55 00 58 54 21 00 00 1f 01 1d 00 bc
52 d0 1e 20 b8 28 55 40 58 54 21 00 00 1e 00 00
00 00 00 00 00 00 00 00 00 00 00 00 00 00 00 00
00 00 00 00 00 00 00 00 00 00 00 00 00 00 00 7b

----------------

Block 0, Base EDID:
  EDID Structure Version & Revision: 1.4
  Vendor & Product Identification:
    Manufacturer: HWP
    Model: 10566
    Serial Number: ...
    Made in: week 17 of 2013
  Basic Display Parameters & Features:
    Digital display
    Bits per primary color channel: 8
    DisplayPort interface
    Maximum image size: 48 cm x 27 cm
    Gamma: 2.20
    DPMS levels: Off
    Supported color formats: RGB 4:4:4, YCrCb 4:4:4, YCrCb 4:2:2
    Default (sRGB) color space is primary color space
    First detailed timing includes the native pixel format and preferred refresh rate
  Color Characteristics:
    Red  : 0.6308, 0.3486
    Green: 0.3408, 0.6220
    Blue : 0.1523, 0.0527
    White: 0.3134, 0.3291
  Established Timings I & II:
    IBM     :   720x400    70.081663 Hz   9:5     31.467 kHz     28.320000 MHz
    DMT 0x04:   640x480    59.940476 Hz   4:3     31.469 kHz     25.175000 MHz
    DMT 0x09:   800x600    60.316541 Hz   4:3     37.879 kHz     40.000000 MHz
    DMT 0x10:  1024x768    60.003840 Hz   4:3     48.363 kHz     65.000000 MHz
  Standard Timings:
    DMT 0x55:  1280x720    60.000000 Hz  16:9     45.000 kHz     74.250000 MHz
    DMT 0x23:  1280x1024   60.019740 Hz   5:4     63.981 kHz    108.000000 MHz
    DMT 0x2f:  1440x900    59.887445 Hz  16:10    55.935 kHz    106.500000 MHz
    DMT 0x3a:  1680x1050   59.954250 Hz  16:10    65.290 kHz    146.250000 MHz
    DMT 0x52:  1920x1080   60.000000 Hz  16:9     67.500 kHz    148.500000 MHz
  Detailed Timing Descriptors:
    DTD 1:  1920x1080   60.000000 Hz  16:9     67.500 kHz    148.500000 MHz (476 mm x 268 mm)
                 Hfront   88 Hsync  44 Hback  148 Hpol P
                 Vfront    4 Vsync   5 Vback   36 Vpol P
    Display Range Limits:
      Monitor ranges (GTF): 50-76 Hz V, 24-94 kHz H, max dotclock 170 MHz
    Display Product Name: 'HP LA2206'
    Display Product Serial Number: ...
  Extension blocks: 1
Checksum: 0xb9

----------------

Block 1, CTA-861 Extension Block:
  Revision: 3
  Underscans IT Video Formats by default
  Basic audio support
  Supports YCbCr 4:4:4
  Supports YCbCr 4:2:2
  Native detailed modes: 1
  Audio Data Block:
    Linear PCM:
      Max channels: 2
      Supported sample rates (kHz): 48 44.1 32
      Supported sample sizes (bits): 24 20 16
  Video Data Block:
    VIC   4:  1280x720    60.000000 Hz  16:9     45.000 kHz     74.250000 MHz
    VIC   2:   720x480    59.940060 Hz   4:3     31.469 kHz     27.000000 MHz
    VIC   3:   720x480    59.940060 Hz  16:9     31.469 kHz     27.000000 MHz
    VIC   1:   640x480    59.940476 Hz   4:3     31.469 kHz     25.175000 MHz
    VIC  17:   720x576    50.000000 Hz   4:3     31.250 kHz     27.000000 MHz
    VIC  18:   720x576    50.000000 Hz  16:9     31.250 kHz     27.000000 MHz
    VIC  16:  1920x1080   60.000000 Hz  16:9     67.500 kHz    148.500000 MHz (native)
    VIC  31:  1920x1080   50.000000 Hz  16:9     56.250 kHz    148.500000 MHz
    VIC  19:  1280x720    50.000000 Hz  16:9     37.500 kHz     74.250000 MHz
  Speaker Allocation Data Block:
    FL/FR - Front Left/Right
  Detailed Timing Descriptors:
    DTD 2:   720x480    59.940060 Hz   3:2     31.469 kHz     27.000000 MHz (600 mm x 340 mm)
                 Hfront   16 Hsync  62 Hback   60 Hpol N
                 Vfront    9 Vsync   6 Vback   30 Vpol N
    DTD 3:   720x576    50.000000 Hz   5:4     31.250 kHz     27.000000 MHz (600 mm x 340 mm)
                 Hfront   12 Hsync  64 Hback   68 Hpol N
                 Vfront    5 Vsync   5 Vback   39 Vpol N
    DTD 4:  1280x720    60.000000 Hz  16:9     45.000 kHz     74.250000 MHz (600 mm x 340 mm)
                 Hfront  110 Hsync  40 Hback  220 Hpol P
                 Vfront    5 Vsync   5 Vback   20 Vpol P
    DTD 5:  1280x720    50.000000 Hz  16:9     37.500 kHz     74.250000 MHz (600 mm x 340 mm)
                 Hfront  440 Hsync  40 Hback  220 Hpol P
                 Vfront    5 Vsync   5 Vback   20 Vpol P
Checksum: 0x7b  Unused space in Extension Block: 33 bytes

----------------

Block 2, Unknown EDID Extension Block 0x00:
  00 ff ff ff ff ff ff 00 22 f0 46 29 01 01 01 01 '........".F)....'
  11 17 01 04 a5 30 1b 78 3e 95 25 a1 59 57 9f 27 '.....0.x>.%.YW.''
  0d 50 54 a1 08 00 81 c0 81 80 95 00 b3 00 d1 c0 '.PT.............'
  01 01 01 01 01 01 02 3a 80 18 71 38 2d 40 58 2c '.......:..q8-@X,'
  45 00 dc 0c 11 00 00 1e 00 00 00 fd 00 32 4c 18 'E............2L.'
  5e 11 00 0a 20 20 20 20 20 20 00 00 00 fc 00 48 '^...      .....H'
  50 20 4c 41 32 32 30 36 0a 20 20 20 00 00 00 ff 'P LA2206.   ....'
  00 33 43 51 33 31 37 30 48 46 34 0a 20 20 01 b9 '.3CQ3170HF4.  ..'
Checksum: 0xb9

----------------

Block 3, CTA-861 Extension Block:
  Revision: 3
  Underscans IT Video Formats by default
  Basic audio support
  Supports YCbCr 4:4:4
  Supports YCbCr 4:2:2
  Native detailed modes: 1
  Audio Data Block:
    Linear PCM:
      Max channels: 2
      Supported sample rates (kHz): 48 44.1 32
      Supported sample sizes (bits): 24 20 16
  Video Data Block:
    VIC   4:  1280x720    60.000000 Hz  16:9     45.000 kHz     74.250000 MHz
    VIC   2:   720x480    59.940060 Hz   4:3     31.469 kHz     27.000000 MHz
    VIC   3:   720x480    59.940060 Hz  16:9     31.469 kHz     27.000000 MHz
    VIC   1:   640x480    59.940476 Hz   4:3     31.469 kHz     25.175000 MHz
    VIC  17:   720x576    50.000000 Hz   4:3     31.250 kHz     27.000000 MHz
    VIC  18:   720x576    50.000000 Hz  16:9     31.250 kHz     27.000000 MHz
    VIC  16:  1920x1080   60.000000 Hz  16:9     67.500 kHz    148.500000 MHz (native)
    VIC  31:  1920x1080   50.000000 Hz  16:9     56.250 kHz    148.500000 MHz
    VIC  19:  1280x720    50.000000 Hz  16:9     37.500 kHz     74.250000 MHz
  Speaker Allocation Data Block:
    FL/FR - Front Left/Right
  Detailed Timing Descriptors:
    DTD 6:   720x480    59.940060 Hz   3:2     31.469 kHz     27.000000 MHz (600 mm x 340 mm)
                 Hfront   16 Hsync  62 Hback   60 Hpol N
                 Vfront    9 Vsync   6 Vback   30 Vpol N
    DTD 7:   720x576    50.000000 Hz   5:4     31.250 kHz     27.000000 MHz (600 mm x 340 mm)
                 Hfront   12 Hsync  64 Hback   68 Hpol N
                 Vfront    5 Vsync   5 Vback   39 Vpol N
    DTD 8:  1280x720    60.000000 Hz  16:9     45.000 kHz     74.250000 MHz (600 mm x 340 mm)
                 Hfront  110 Hsync  40 Hback  220 Hpol P
                 Vfront    5 Vsync   5 Vback   20 Vpol P
    DTD 9:  1280x720    50.000000 Hz  16:9     37.500 kHz     74.250000 MHz (600 mm x 340 mm)
                 Hfront  440 Hsync  40 Hback  220 Hpol P
                 Vfront    5 Vsync   5 Vback   20 Vpol P
Checksum: 0x7b  Unused space in Extension Block: 33 bytes

----------------

Warnings:

Block 0, Base EDID:
  Vendor & Product Identification: The serial number is one of the known dummy values, it should probably be set to 0.
  Display Range Limits: GTF support is deprecated in EDID 1.4.
Block 1, CTA-861 Extension Block:
  Video Data Block: VIC 4 and the first DTD are not identical. Is this intended?
  Detailed Timing Descriptor #2: Image size is 600x340 mm, but based on the picture AR it should be 600x400 mm.
  Detailed Timing Descriptor #3: Image size is 600x340 mm, but based on the picture AR it should be 600x480 mm.
  Display Product Serial Number is set, so the Serial Number in the Base EDID should be 0.
Block 3, CTA-861 Extension Block:
  Detailed Timing Descriptor #6: Image size is 600x340 mm, but based on the picture AR it should be 600x400 mm.
  Detailed Timing Descriptor #7: Image size is 600x340 mm, but based on the picture AR it should be 600x480 mm.
EDID:
  CTA-861: Multiple native progressive timings are defined.

Failures:

Block 0, Base EDID:
  Basic Display Parameters & Features: sRGB is signaled, but the chromaticities do not match.
  Display Range Limits: GTF is supported, but the display does not support continuous frequencies.
Block 1, CTA-861 Extension Block:
  Detailed Timing Descriptor #2: Mismatch of image size 600x340 mm vs display size 480x270 mm.
  Detailed Timing Descriptor #3: Mismatch of image size 600x340 mm vs display size 480x270 mm.
  Detailed Timing Descriptor #4: Mismatch of image size 600x340 mm vs display size 480x270 mm.
  Detailed Timing Descriptor #5: Mismatch of image size 600x340 mm vs display size 480x270 mm.
  Missing VCDB, needed for Set Selectable RGB Quantization to avoid interop issues.
Block 2, Base EDID:
  Unknown Extension Block.
Block 3, CTA-861 Extension Block:
  Video Data Block: Duplicate VIC 4.
  Video Data Block: Duplicate VIC 2.
  Video Data Block: Duplicate VIC 3.
  Video Data Block: Duplicate VIC 1.
  Video Data Block: Duplicate VIC 17.
  Video Data Block: Duplicate VIC 18.
  Video Data Block: Duplicate VIC 16.
  Video Data Block: Duplicate VIC 31.
  Video Data Block: Duplicate VIC 19.
  Speaker Allocation Data Block: Only one instance of this Data Block is allowed.
  Detailed Timing Descriptor #6: Mismatch of image size 600x340 mm vs display size 480x270 mm.
  Detailed Timing Descriptor #7: Mismatch of image size 600x340 mm vs display size 480x270 mm.
  Detailed Timing Descriptor #8: Mismatch of image size 600x340 mm vs display size 480x270 mm.
  Detailed Timing Descriptor #9: Mismatch of image size 600x340 mm vs display size 480x270 mm.
EDID:
  Base EDID: The DTD max image size is 600x340mm, which is larger than the display size 480.0x270.0mm.
  Base EDID: EDID specified 1 extension block(s), but found 3 extension block(s).

EDID conformity: FAIL
