edid-decode (hex):

00 ff ff ff ff ff ff 00 06 10 56 9c 00 00 00 00
04 10 01 03 80 22 16 78 0a 87 f5 94 57 4f 8c 27
27 50 54 00 00 00 01 01 01 01 01 01 01 01 01 01
01 01 01 01 01 01 9f 25 a0 40 51 84 0c 30 40 20
33 00 4b cf 10 00 00 19 00 00 00 01 00 06 10 30
00 00 00 00 00 00 00 00 0a 20 00 00 00 fe 00 4c
54 4e 31 35 34 58 37 00 00 00 0a 20 00 00 00 fc
00 43 6f 6c 6f 72 20 4c 43 44 0a 20 20 20 00 d5

----------------

Block 0, Base EDID:
  EDID Structure Version & Revision: 1.3
  Vendor & Product Identification:
    Manufacturer: APP
    Model: 40022
    Made in: week 4 of 2006
  Basic Display Parameters & Features:
    Digital display
    Maximum image size: 34 cm x 22 cm
    Gamma: 2.20
    RGB color display
    First detailed timing is the preferred timing
  Color Characteristics:
    Red  : 0.5800, 0.3398
    Green: 0.3095, 0.5498
    Blue : 0.1552, 0.1552
    White: 0.3134, 0.3291
  Established Timings I & II: none
  Standard Timings: none
  Detailed Timing Descriptors:
    DTD 1:  1440x900    60.001744 Hz  16:10    54.722 kHz     96.310000 MHz (331 mm x 207 mm)
                 Hfront   64 Hsync  32 Hback  224 Hpol N
                 Vfront    3 Vsync   3 Vback    6 Vpol N
    Manufacturer-Specified Display Descriptor (0x01): 00 01 00 06 10 30 00 00 00 00 00 00 00 00 0a 20 '.....0......... '
    Alphanumeric Data String: 'LTN154X7'
    Display Product Name: 'Color LCD'
Checksum: 0xd5

----------------

Failures:

Block 0, Base EDID:
  Alphanumeric Data String: NUL byte at position 8.
  Missing Display Range Limits Descriptor.

EDID conformity: FAIL
