edid-decode (hex):

00 ff ff ff ff ff ff 00 4c 2d 27 04 00 00 00 00
06 13 01 03 80 10 09 78 0a 9f c1 a6 56 4b 9a 25
13 50 54 bf ef 80 71 4f 81 40 81 80 a9 40 01 01
01 01 01 01 01 01 28 3c 80 a0 70 b0 23 40 30 20
36 00 a0 5a 00 00 00 1a 01 1d 00 bc 52 d0 1e 20
b8 28 55 40 a0 5a 00 00 00 1e 00 00 00 fd 00 18
4b 1a 51 17 00 0a 20 20 20 20 20 20 00 00 00 fc
00 53 79 6e 63 4d 61 73 74 65 72 0a 20 20 01 08

02 03 23 f1 4b 93 04 05 14 03 12 10 1f 20 21 22
23 09 07 07 83 01 00 00 e2 00 0f 67 03 0c 00 10
00 b8 2d 01 1d 80 d0 72 1c 16 20 10 2c 25 80 a0
5a 00 00 00 9e 01 1d 80 18 71 1c 16 20 58 2c 25
00 a0 5a 00 00 00 9e 01 1d 00 72 51 d0 1e 20 6e
28 55 00 a0 5a 00 00 00 1e 8c 0a d0 90 20 40 31
20 0c 40 55 00 a0 5a 00 00 00 18 00 00 00 00 00
00 00 00 00 00 00 00 00 00 00 00 00 00 00 00 7a

00 ff ff ff ff ff ff 00 4c 2d 27 04 00 00 00 00
06 13 01 03 80 10 09 78 0a 9f c1 a6 56 4b 9a 25
13 50 54 bf ef 80 71 4f 81 40 81 80 a9 40 01 01
01 01 01 01 01 01 28 3c 80 a0 70 b0 23 40 30 20
36 00 a0 5a 00 00 00 1a 01 1d 00 bc 52 d0 1e 20
b8 28 55 40 a0 5a 00 00 00 1e 00 00 00 fd 00 18
4b 1a 51 17 00 0a 20 20 20 20 20 20 00 00 00 fc
00 53 79 6e 63 4d 61 73 74 65 72 0a 20 20 01 08

02 03 23 f1 4b 93 04 05 14 03 12 10 1f 20 21 22
23 09 07 07 83 01 00 00 e2 00 0f 67 03 0c 00 10
00 b8 2d 01 1d 80 d0 72 1c 16 20 10 2c 25 80 a0
5a 00 00 00 9e 01 1d 80 18 71 1c 16 20 58 2c 25
00 a0 5a 00 00 00 9e 01 1d 00 72 51 d0 1e 20 6e
28 55 00 a0 5a 00 00 00 1e 8c 0a d0 90 20 40 31
20 0c 40 55 00 a0 5a 00 00 00 18 00 00 00 00 00
00 00 00 00 00 00 00 00 00 00 00 00 00 00 00 7a

----------------

Block 0, Base EDID:
  EDID Structure Version & Revision: 1.3
  Vendor & Product Identification:
    Manufacturer: SAM
    Model: 1063
    Made in: week 6 of 2009
  Basic Display Parameters & Features:
    Digital display
    Maximum image size: 16 cm x 9 cm
    Gamma: 2.20
    RGB color display
    First detailed timing is the preferred timing
  Color Characteristics:
    Red  : 0.6503, 0.3369
    Green: 0.2958, 0.6044
    Blue : 0.1474, 0.0742
    White: 0.3125, 0.3291
  Established Timings I & II:
    IBM     :   720x400    70.081663 Hz   9:5     31.467 kHz     28.320000 MHz
    DMT 0x04:   640x480    59.940476 Hz   4:3     31.469 kHz     25.175000 MHz
    Apple   :   640x480    66.666667 Hz   4:3     35.000 kHz     30.240000 MHz
    DMT 0x05:   640x480    72.808802 Hz   4:3     37.861 kHz     31.500000 MHz
    DMT 0x06:   640x480    75.000000 Hz   4:3     37.500 kHz     31.500000 MHz
    DMT 0x08:   800x600    56.250000 Hz   4:3     35.156 kHz     36.000000 MHz
    DMT 0x09:   800x600    60.316541 Hz   4:3     37.879 kHz     40.000000 MHz
    DMT 0x0a:   800x600    72.187572 Hz   4:3     48.077 kHz     50.000000 MHz
    DMT 0x0b:   800x600    75.000000 Hz   4:3     46.875 kHz     49.500000 MHz
    Apple   :   832x624    74.551266 Hz   4:3     49.726 kHz     57.284000 MHz
    DMT 0x10:  1024x768    60.003840 Hz   4:3     48.363 kHz     65.000000 MHz
    DMT 0x11:  1024x768    70.069359 Hz   4:3     56.476 kHz     75.000000 MHz
    DMT 0x12:  1024x768    75.028582 Hz   4:3     60.023 kHz     78.750000 MHz
    DMT 0x24:  1280x1024   75.024675 Hz   5:4     79.976 kHz    135.000000 MHz
    Apple   :  1152x870    75.061550 Hz 192:145   68.681 kHz    100.000000 MHz
  Standard Timings:
    DMT 0x15:  1152x864    75.000000 Hz   4:3     67.500 kHz    108.000000 MHz
    DMT 0x20:  1280x960    60.000000 Hz   4:3     60.000 kHz    108.000000 MHz
    DMT 0x23:  1280x1024   60.019740 Hz   5:4     63.981 kHz    108.000000 MHz
    DMT 0x33:  1600x1200   60.000000 Hz   4:3     75.000 kHz    162.000000 MHz
  Detailed Timing Descriptors:
    DTD 1:  1920x1200   59.950171 Hz  16:10    74.038 kHz    154.000000 MHz (160 mm x 90 mm)
                 Hfront   48 Hsync  32 Hback   80 Hpol P
                 Vfront    3 Vsync   6 Vback   26 Vpol N
    DTD 2:  1280x720    50.000000 Hz  16:9     37.500 kHz     74.250000 MHz (160 mm x 90 mm)
                 Hfront  440 Hsync  40 Hback  220 Hpol P
                 Vfront    5 Vsync   5 Vback   20 Vpol P
    Display Range Limits:
      Monitor ranges (GTF): 24-75 Hz V, 26-81 kHz H, max dotclock 230 MHz
    Display Product Name: 'SyncMaster'
  Extension blocks: 1
Checksum: 0x08

----------------

Block 1, CTA-861 Extension Block:
  Revision: 3
  Underscans IT Video Formats by default
  Basic audio support
  Supports YCbCr 4:4:4
  Supports YCbCr 4:2:2
  Native DTDs: 1
  Video Data Block:
    VIC  19:  1280x720    50.000000 Hz  16:9     37.500 kHz     74.250000 MHz (native)
    VIC   4:  1280x720    60.000000 Hz  16:9     45.000 kHz     74.250000 MHz
    VIC   5:  1920x1080i  60.000000 Hz  16:9     33.750 kHz     74.250000 MHz
    VIC  20:  1920x1080i  50.000000 Hz  16:9     28.125 kHz     74.250000 MHz
    VIC   3:   720x480    59.940060 Hz  16:9     31.469 kHz     27.000000 MHz
    VIC  18:   720x576    50.000000 Hz  16:9     31.250 kHz     27.000000 MHz
    VIC  16:  1920x1080   60.000000 Hz  16:9     67.500 kHz    148.500000 MHz
    VIC  31:  1920x1080   50.000000 Hz  16:9     56.250 kHz    148.500000 MHz
    VIC  32:  1920x1080   24.000000 Hz  16:9     27.000 kHz     74.250000 MHz
    VIC  33:  1920x1080   25.000000 Hz  16:9     28.125 kHz     74.250000 MHz
    VIC  34:  1920x1080   30.000000 Hz  16:9     33.750 kHz     74.250000 MHz
  Audio Data Block:
    Linear PCM:
      Max channels: 2
      Supported sample rates (kHz): 48 44.1 32
      Supported sample sizes (bits): 24 20 16
  Speaker Allocation Data Block:
    FL/FR - Front Left/Right
  Video Capability Data Block:
    YCbCr quantization: No Data
    RGB quantization: No Data
    PT scan behavior: No Data
    IT scan behavior: Supports both over- and underscan
    CE scan behavior: Supports both over- and underscan
  Vendor-Specific Data Block (HDMI), OUI 00-0C-03:
    Source physical address: 1.0.0.0
    Supports_AI
    DC_36bit
    DC_30bit
    DC_Y444
    Maximum TMDS clock: 225 MHz
  Detailed Timing Descriptors:
    DTD 3:  1920x1080i  50.000000 Hz  16:9     28.125 kHz     74.250000 MHz (160 mm x 90 mm)
                 Hfront  528 Hsync  44 Hback  148 Hpol P
                 Vfront    2 Vsync   5 Vback   15 Vpol P Vfront +0.5 Odd Field
                 Vfront    2 Vsync   5 Vback   15 Vpol P Vback  +0.5 Even Field
    DTD 4:  1920x1080i  60.000000 Hz  16:9     33.750 kHz     74.250000 MHz (160 mm x 90 mm)
                 Hfront   88 Hsync  44 Hback  148 Hpol P
                 Vfront    2 Vsync   5 Vback   15 Vpol P Vfront +0.5 Odd Field
                 Vfront    2 Vsync   5 Vback   15 Vpol P Vback  +0.5 Even Field
    DTD 5:  1280x720    60.000000 Hz  16:9     45.000 kHz     74.250000 MHz (160 mm x 90 mm)
                 Hfront  110 Hsync  40 Hback  220 Hpol P
                 Vfront    5 Vsync   5 Vback   20 Vpol P
    DTD 6:   720x576    50.000000 Hz   5:4     31.250 kHz     27.000000 MHz (160 mm x 90 mm)
                 Hfront   12 Hsync  64 Hback   68 Hpol N
                 Vfront    5 Vsync   5 Vback   39 Vpol N
Checksum: 0x7a  Unused space in Extension Block: 20 bytes

----------------

Warnings:

Block 0, Base EDID:
  Basic Display Parameters & Features: Dubious maximum image size (16x9 is smaller than 10x10 cm).
  Detailed Timing Descriptor #1: Dubious image size (160x90 mm is smaller than 100x100 mm).
  Detailed Timing Descriptor #2: Dubious image size (160x90 mm is smaller than 100x100 mm).
Block 1, CTA-861 Extension Block:
  Video Data Block: VIC 19 and the first DTD are not identical. Is this intended?
  Video Capability Data Block: Set Selectable YCbCr Quantization to avoid interop issues.
  Detailed Timing Descriptor #3: Dubious image size (160x90 mm is smaller than 100x100 mm).
  Detailed Timing Descriptor #4: Dubious image size (160x90 mm is smaller than 100x100 mm).
  Detailed Timing Descriptor #5: Dubious image size (160x90 mm is smaller than 100x100 mm).
  Detailed Timing Descriptor #6: Dubious image size (160x90 mm is smaller than 100x100 mm).
  Add a Colorimetry Data Block with the sRGB colorimetry bit set to avoid interop issues.

Failures:

Block 1, CTA-861 Extension Block:
  Video Capability Data Block: Set Selectable RGB Quantization to avoid interop issues.
EDID:
  Extension Block 2 started with EDID header, ignoring Extension Blocks >= 2.
  CTA-861: Native progressive timings are a mix of several resolutions.

EDID conformity: FAIL
