edid-decode (hex):

00 ff ff ff ff ff ff 00 10 ac a7 42 4c 46 39 43
29 21 01 04 a5 3d 22 78 3b c7 95 ac 52 4d a2 25
0e 50 54 a5 4b 00 d1 c0 b3 00 81 80 81 00 71 4f
01 01 01 01 01 01 02 3a 80 18 71 38 2d 40 58 2c
45 00 60 4f 21 00 00 1e 00 00 00 ff 00 37 5a 58
34 39 50 33 0a 20 20 20 20 20 00 00 00 fc 00 44
45 4c 4c 20 47 32 37 32 33 48 0a 20 00 00 00 fd
0c 30 f0 18 18 3b 01 0a 20 20 20 20 20 20 01 6a

02 03 25 f1 4a 90 3f 1f 04 13 12 11 03 02 01 23
09 07 07 83 01 00 00 6d 1a 00 00 02 01 30 f0 00
00 00 00 00 00 60 e4 80 b4 70 38 50 40 40 40 53
00 60 4f 21 00 00 1a 7d 97 80 a0 70 38 32 40 30
20 3a 00 60 4f 21 00 00 1a d6 83 80 a0 70 38 30
40 30 20 35 00 60 4f 21 00 00 1a 86 6f 80 a0 70
38 40 40 30 20 35 00 60 4f 21 00 00 1a 00 00 00
00 00 00 00 00 00 00 00 00 00 00 00 00 00 00 2a

00 ff ff ff ff ff ff 00 10 ac a7 42 4c 46 39 43
29 21 01 04 a5 3d 22 78 3b c7 95 ac 52 4d a2 25
0e 50 54 a5 4b 00 d1 c0 b3 00 81 80 81 00 71 4f
01 01 01 01 01 01 02 3a 80 18 71 38 2d 40 58 2c
45 00 60 4f 21 00 00 1e 00 00 00 ff 00 37 5a 58
34 39 50 33 0a 20 20 20 20 20 00 00 00 fc 00 44
45 4c 4c 20 47 32 37 32 33 48 0a 20 00 00 00 fd
0c 30 f0 18 18 3b 01 0a 20 20 20 20 20 20 01 6a

02 03 25 f1 4a 90 3f 1f 04 13 12 11 03 02 01 23
09 07 07 83 01 00 00 6d 1a 00 00 02 01 30 f0 00
00 00 00 00 00 60 e4 80 b4 70 38 50 40 40 40 53
00 60 4f 21 00 00 1a 7d 97 80 a0 70 38 32 40 30
20 3a 00 60 4f 21 00 00 1a d6 83 80 a0 70 38 30
40 30 20 35 00 60 4f 21 00 00 1a 86 6f 80 a0 70
38 40 40 30 20 35 00 60 4f 21 00 00 1a 00 00 00
00 00 00 00 00 00 00 00 00 00 00 00 00 00 00 2a

----------------

Block 0, Base EDID:
  EDID Structure Version & Revision: 1.4
  Vendor & Product Identification:
    Manufacturer: DEL
    Model: 17063
    Serial Number: ...
    Made in: week 41 of 2023
  Basic Display Parameters & Features:
    Digital display
    Bits per primary color channel: 8
    DisplayPort interface
    Maximum image size: 61 cm x 34 cm
    Gamma: 2.20
    DPMS levels: Off
    Supported color formats: RGB 4:4:4, YCrCb 4:4:4, YCrCb 4:2:2
    First detailed timing includes the native pixel format and preferred refresh rate
    Display supports continuous frequencies
  Color Characteristics:
    Red  : 0.6748, 0.3203
    Green: 0.3017, 0.6357
    Blue : 0.1464, 0.0556
    White: 0.3134, 0.3291
  Established Timings I & II:
    IBM     :   720x400    70.081663 Hz   9:5     31.467 kHz     28.320000 MHz
    DMT 0x04:   640x480    59.940476 Hz   4:3     31.469 kHz     25.175000 MHz
    DMT 0x06:   640x480    75.000000 Hz   4:3     37.500 kHz     31.500000 MHz
    DMT 0x09:   800x600    60.316541 Hz   4:3     37.879 kHz     40.000000 MHz
    DMT 0x0b:   800x600    75.000000 Hz   4:3     46.875 kHz     49.500000 MHz
    DMT 0x10:  1024x768    60.003840 Hz   4:3     48.363 kHz     65.000000 MHz
    DMT 0x12:  1024x768    75.028582 Hz   4:3     60.023 kHz     78.750000 MHz
    DMT 0x24:  1280x1024   75.024675 Hz   5:4     79.976 kHz    135.000000 MHz
  Standard Timings:
    DMT 0x52:  1920x1080   60.000000 Hz  16:9     67.500 kHz    148.500000 MHz
    DMT 0x3a:  1680x1050   59.954250 Hz  16:10    65.290 kHz    146.250000 MHz
    DMT 0x23:  1280x1024   60.019740 Hz   5:4     63.981 kHz    108.000000 MHz
    DMT 0x1c:  1280x800    59.810326 Hz  16:10    49.702 kHz     83.500000 MHz
    DMT 0x15:  1152x864    75.000000 Hz   4:3     67.500 kHz    108.000000 MHz
  Detailed Timing Descriptors:
    DTD 1:  1920x1080   60.000000 Hz  16:9     67.500 kHz    148.500000 MHz (608 mm x 335 mm)
                 Hfront   88 Hsync  44 Hback  148 Hpol P
                 Vfront    4 Vsync   5 Vback   36 Vpol P
    Display Product Serial Number: ...
    Display Product Name: 'DELL G2723H'
    Display Range Limits:
      Monitor ranges (Range Limits Only): 48-240 Hz V, 279-279 kHz H, max dotclock 590 MHz
  Extension blocks: 1
Checksum: 0x6a

----------------

Block 1, CTA-861 Extension Block:
  Revision: 3
  Underscans IT Video Formats by default
  Basic audio support
  Supports YCbCr 4:4:4
  Supports YCbCr 4:2:2
  Native DTDs: 1
  Video Data Block:
    VIC  16:  1920x1080   60.000000 Hz  16:9     67.500 kHz    148.500000 MHz (native)
    VIC  63:  1920x1080  120.000000 Hz  16:9    135.000 kHz    297.000000 MHz
    VIC  31:  1920x1080   50.000000 Hz  16:9     56.250 kHz    148.500000 MHz
    VIC   4:  1280x720    60.000000 Hz  16:9     45.000 kHz     74.250000 MHz
    VIC  19:  1280x720    50.000000 Hz  16:9     37.500 kHz     74.250000 MHz
    VIC  18:   720x576    50.000000 Hz  16:9     31.250 kHz     27.000000 MHz
    VIC  17:   720x576    50.000000 Hz   4:3     31.250 kHz     27.000000 MHz
    VIC   3:   720x480    59.940060 Hz  16:9     31.469 kHz     27.000000 MHz
    VIC   2:   720x480    59.940060 Hz   4:3     31.469 kHz     27.000000 MHz
    VIC   1:   640x480    59.940476 Hz   4:3     31.469 kHz     25.175000 MHz
  Audio Data Block:
    Linear PCM:
      Max channels: 2
      Supported sample rates (kHz): 48 44.1 32
      Supported sample sizes (bits): 24 20 16
  Speaker Allocation Data Block:
    FL/FR - Front Left/Right
  Vendor-Specific Data Block (AMD), OUI 00-00-1A:
    Version: 2
    Feature Caps: 0x01
    Minimum Refresh Rate: 48 Hz
    Maximum Refresh Rate: 240 Hz
    Flags 1.x: 0x00
    Flags 2.x: 0x00
  Detailed Timing Descriptors:
    DTD 2:  1920x1080  240.000000 Hz  16:9    278.400 kHz    584.640000 MHz (608 mm x 335 mm)
                 Hfront   64 Hsync  64 Hback   52 Hpol P
                 Vfront    5 Vsync   3 Vback   72 Vpol N
    DTD 3:  1920x1080  164.997447 Hz  16:9    186.447 kHz    387.810000 MHz (608 mm x 335 mm)
                 Hfront   48 Hsync  32 Hback   80 Hpol P
                 Vfront    3 Vsync  10 Vback   37 Vpol N
    DTD 4:  1920x1080  143.847177 Hz  16:9    162.260 kHz    337.500000 MHz (608 mm x 335 mm)
                 Hfront   48 Hsync  32 Hback   80 Hpol P
                 Vfront    3 Vsync   5 Vback   40 Vpol N
    DTD 5:  1920x1080  119.982181 Hz  16:9    137.260 kHz    285.500000 MHz (608 mm x 335 mm)
                 Hfront   48 Hsync  32 Hback   80 Hpol P
                 Vfront    3 Vsync   5 Vback   56 Vpol N
Checksum: 0x2a  Unused space in Extension Block: 18 bytes

----------------

Warnings:

Block 1, CTA-861 Extension Block:
  Display Product Serial Number is set, so the Serial Number in the Base EDID should be 0.
  Add a Colorimetry Data Block with the sRGB colorimetry bit set to avoid interop issues.
EDID:
  Base EDID: Some timings are out of range of the Monitor Ranges:
    Horizontal Freq: 31.250 - 278.400 kHz (Monitor: 279.000 - 279.000 kHz)

Failures:

Block 1, CTA-861 Extension Block:
  Missing VCDB, needed for Set Selectable RGB Quantization to avoid interop issues.
EDID:
  Extension Block 2 started with EDID header, ignoring Extension Blocks >= 2.

EDID conformity: FAIL
