edid-decode (hex):

00 ff ff ff ff ff ff 00 4e 73 37 10 00 00 00 00
26 17 01 04 90 16 0e 78 0a 86 b5 97 57 4f 93 26
20 50 54 00 00 00 01 01 01 01 01 01 01 01 01 01
01 01 01 01 01 01 1c 0c 20 d0 30 e0 25 10 10 50
37 00 00 00 00 00 00 18 00 00 00 fe 00 37 30 57
56 57 33 41 0a 20 20 20 20 20 00 00 00 fe 00 48
4c 38 30 30 78 34 38 30 0a 20 20 20 00 00 00 10
00 4e 31 30 31 49 43 47 2d 4c 32 31 0a 20 00 7d

00 ff ff ff ff ff ff 00 4e 73 37 10 00 00 00 00
26 17 01 04 90 16 0e 78 0a 86 b5 97 57 4f 93 26
20 50 54 00 00 00 01 01 01 01 01 01 01 01 01 01
01 01 01 01 01 01 1c 0c 20 d0 30 e0 25 10 10 50
37 00 00 00 00 00 00 18 00 00 00 fe 00 37 30 57
56 57 33 41 0a 20 20 20 20 20 00 00 00 fe 00 48
4c 38 30 30 78 34 38 30 0a 20 20 20 00 00 00 10
00 4e 31 30 31 49 43 47 2d 4c 32 31 0a 20 00 7d

----------------

Block 0, Base EDID:
  EDID Structure Version & Revision: 1.4
  Vendor & Product Identification:
    Manufacturer: SSS
    Model: 4151
    Made in: week 38 of 2013
  Basic Display Parameters & Features:
    Digital display
    Bits per primary color channel: 6
    Digital interface is not defined
    Maximum image size: 22 cm x 14 cm
    Gamma: 2.20
    Supported color formats: RGB 4:4:4, YCrCb 4:4:4
    First detailed timing includes the native pixel format and preferred refresh rate
  Color Characteristics:
    Red  : 0.5917, 0.3398
    Green: 0.3095, 0.5761
    Blue : 0.1503, 0.1279
    White: 0.3134, 0.3291
  Established Timings I & II: none
  Standard Timings: none
  Detailed Timing Descriptors:
    DTD 1:   800x480    59.485432 Hz   5:3     30.754 kHz     31.000000 MHz
                 Hfront   16 Hsync  80 Hback  112 Hpol N
                 Vfront    3 Vsync   7 Vback   27 Vpol N
    Alphanumeric Data String: '70WVW3A'
    Alphanumeric Data String: 'HL800x480'
    Dummy Descriptor:
Checksum: 0x7d

----------------

Warnings:

Block 0, Base EDID:
  Missing Display Product Name.

Failures:

Block 0, Base EDID:
  Detailed Timing Descriptor #1: Mismatch of image size vs display size: image size is not set, but display size is.
  Dummy Descriptor: Dummy block filled with garbage.
EDID:
  Extension Block 1 started with EDID header, ignoring Extension Blocks >= 1.

EDID conformity: FAIL
