edid-decode (hex):

00 ff ff ff ff ff ff 00 0d af 18 17 00 00 00 00
17 14 01 03 90 26 16 78 0a 06 35 9e 56 52 98 29
14 50 54 00 00 00 01 01 01 01 01 01 01 01 01 01
01 01 01 01 01 01 2c 2a 40 2c 61 84 2f 30 57 3a
59 00 7e d7 10 00 00 1a 2c 2a 40 2c 61 84 2f 30
57 3a 59 00 7e d7 10 00 00 1a 00 00 00 fe 00 4b
50 4d 52 54 80 4e 31 37 33 4f 36 0a 00 00 00 00
00 00 00 00 00 00 00 00 00 02 01 0a 20 20 00 e5

----------------

Block 0, Base EDID:
  EDID Structure Version & Revision: 1.3
  Vendor & Product Identification:
    Manufacturer: CMO
    Model: 5912
    Made in: week 23 of 2010
  Basic Display Parameters & Features:
    Digital display
    Maximum image size: 38 cm x 22 cm
    Gamma: 2.20
    RGB color display
    First detailed timing is the preferred timing
  Color Characteristics:
    Red  : 0.6171, 0.3359
    Green: 0.3212, 0.5957
    Blue : 0.1601, 0.0810
    White: 0.3134, 0.3291
  Established Timings I & II: none
  Standard Timings: none
  Detailed Timing Descriptors:
    DTD 1:  1600x900    60.001112 Hz  16:9     56.821 kHz    107.960000 MHz (382 mm x 215 mm)
                 Hfront   87 Hsync  58 Hback  155 Hpol P
                 Vfront    5 Vsync   9 Vback   33 Vpol N
    DTD 2:  1600x900    60.001112 Hz  16:9     56.821 kHz    107.960000 MHz (382 mm x 215 mm)
                 Hfront   87 Hsync  58 Hback  155 Hpol P
                 Vfront    5 Vsync   9 Vback   33 Vpol N
    Alphanumeric Data String: 'KPMRT.N173O6'
    Manufacturer-Specified Display Descriptor (0x00): 00 00 00 00 00 00 00 00 00 00 00 02 01 0a 20 20 '..............  '
Checksum: 0xe5

----------------

Warnings:

Block 0, Base EDID:
  Alphanumeric Data String: Non-ASCII character 0x80 at position 5, can cause problems.

Failures:

Block 0, Base EDID:
  Basic Display Parameters & Features: Digital Video Interface Standard set to reserved value 0x10.
  Missing Display Product Name.
  Missing Display Range Limits Descriptor.

EDID conformity: FAIL
