edid-decode (hex):

00 ff ff ff ff ff ff 00 22 f0 4f 42 00 00 00 00
2d 18 01 01 80 30 1b 78 ee 16 40 a3 54 4f 9e 27
11 50 54 00 00 00 01 01 01 01 01 01 01 01 01 01
01 01 01 01 01 01 19 38 80 00 71 38 14 40 58 2c
45 00 dc 0c 11 00 00 00 00 00 00 fc 00 48 50 20
41 6c 6c 2d 69 6e 2d 4f 6e 65 00 00 00 fc 00 0a
20 20 20 20 20 20 20 20 20 20 20 20 00 00 00 fc
00 0a 20 20 20 20 20 20 20 20 20 20 20 20 00 09

00 ff ff ff ff ff ff 00 22 f0 4f 42 00 00 00 00
2d 18 01 01 80 30 1b 78 ee 16 40 a3 54 4f 9e 27
11 50 54 00 00 00 01 01 01 01 01 01 01 01 01 01
01 01 01 01 01 01 19 38 80 00 71 38 14 40 58 2c
45 00 dc 0c 11 00 00 00 00 00 00 fc 00 48 50 20
41 6c 6c 2d 69 6e 2d 4f 6e 65 00 00 00 fc 00 0a
20 20 20 20 20 20 20 20 20 20 20 20 00 00 00 fc
00 0a 20 20 20 20 20 20 20 20 20 20 20 20 00 09

----------------

Block 0, Base EDID:
  EDID Structure Version & Revision: 1.1
  Vendor & Product Identification:
    Manufacturer: HWP
    Model: 16975
    Made in: week 45 of 2014
  Basic Display Parameters & Features:
    Digital display
    Maximum image size: 48 cm x 27 cm
    Gamma: 2.20
    DPMS levels: Standby Suspend Off
    RGB color display
    Default (sRGB) color space is primary color space
    First detailed timing is the preferred timing
  Color Characteristics:
    Red  : 0.6367, 0.3291
    Green: 0.3095, 0.6191
    Blue : 0.1533, 0.0664
    White: 0.3125, 0.3281
  Established Timings I & II: none
  Standard Timings: none
  Detailed Timing Descriptors:
    DTD 1:  1920x1080   59.997493 Hz  16:9     65.997 kHz    143.610000 MHz (analog composite, sync-on-green, 476 mm x 268 mm)
                 Hfront   88 Hsync  44 Hback  124 Hpol N
                 Vfront    4 Vsync   5 Vback   11 Vpol N
    Display Product Name: 'HP All-in-One'
    Display Product Name: ''
    Display Product Name: ''
Checksum: 0x09

----------------

Warnings:

Block 0, Base EDID:
  EDID Structure Version & Revision: EDID 1.1 is deprecated, do not use.

Failures:

Block 0, Base EDID:
  Basic Display Parameters & Features: sRGB is signaled, but the chromaticities do not match.
  Display Product Name: Empty string.
  Display Product Name: Empty string.
EDID:
  Extension Block 1 started with EDID header, ignoring Extension Blocks >= 1.

EDID conformity: FAIL
