edid-decode (hex):

00 ff ff ff ff ff ff 00 52 62 88 88 00 88 88 88
1c 15 01 03 80 a0 5a 78 0a 0d c9 a0 57 47 98 27
12 48 4c 00 00 00 01 01 01 01 01 01 01 01 01 01
01 01 01 01 01 01 01 1d 00 72 51 d0 1e 20 6e 28
55 00 80 38 74 00 00 1e 01 1d 80 18 71 38 2d 40
58 2c 45 00 80 38 74 00 00 1e 00 00 00 fc 00 44
43 44 5a 2d 48 32 43 20 4d 4f 44 0a 00 00 00 fd
00 14 78 01 ff 10 00 0a 20 20 20 20 20 20 01 74

02 03 1a 71 47 84 22 22 22 22 22 22 23 09 07 01
83 01 00 00 65 03 0c 00 10 00 01 1d 80 18 71 38
2d 40 58 2c 45 00 80 38 74 00 00 1e 01 1d 80 18
71 38 2d 40 58 2c 45 00 80 38 74 00 00 1e 01 1d
80 18 71 38 2d 40 58 2c 45 00 80 38 74 00 00 1e
01 1d 80 18 71 38 2d 40 58 2c 45 00 80 38 74 00
00 1e 00 00 00 00 00 00 00 00 00 00 00 00 00 00
00 00 00 00 00 00 00 00 00 00 00 00 00 00 00 21

00 ff ff ff ff ff ff 00 52 62 88 88 00 88 88 88
1c 15 01 03 80 a0 5a 78 0a 0d c9 a0 57 47 98 27
12 48 4c 00 00 00 01 01 01 01 01 01 01 01 01 01
01 01 01 01 01 01 01 1d 00 72 51 d0 1e 20 6e 28
55 00 80 38 74 00 00 1e 01 1d 80 18 71 38 2d 40
58 2c 45 00 80 38 74 00 00 1e 00 00 00 fc 00 44
43 44 5a 2d 48 32 43 20 4d 4f 44 0a 00 00 00 fd
00 14 78 01 ff 10 00 0a 20 20 20 20 20 20 01 74

02 03 1a 71 47 84 22 22 22 22 22 22 23 09 07 01
83 01 00 00 65 03 0c 00 10 00 01 1d 80 18 71 38
2d 40 58 2c 45 00 80 38 74 00 00 1e 01 1d 80 18
71 38 2d 40 58 2c 45 00 80 38 74 00 00 1e 01 1d
80 18 71 38 2d 40 58 2c 45 00 80 38 74 00 00 1e
01 1d 80 18 71 38 2d 40 58 2c 45 00 80 38 74 00
00 1e 00 00 00 00 00 00 00 00 00 00 00 00 00 00
00 00 00 00 00 00 00 00 00 00 00 00 00 00 00 21

----------------

Block 0, Base EDID:
  EDID Structure Version & Revision: 1.3
  Vendor & Product Identification:
    Manufacturer: TSB
    Model: 34952
    Serial Number: ...
    Made in: week 28 of 2011
  Basic Display Parameters & Features:
    Digital display
    Maximum image size: 160 cm x 90 cm
    Gamma: 2.20
    RGB color display
    First detailed timing is the preferred timing
  Color Characteristics:
    Red  : 0.6250, 0.3398
    Green: 0.2802, 0.5947
    Blue : 0.1552, 0.0703
    White: 0.2832, 0.2978
  Established Timings I & II: none
  Standard Timings: none
  Detailed Timing Descriptors:
    DTD 1:  1280x720    60.000000 Hz  16:9     45.000 kHz     74.250000 MHz (1920 mm x 1080 mm)
                 Hfront  110 Hsync  40 Hback  220 Hpol P
                 Vfront    5 Vsync   5 Vback   20 Vpol P
    DTD 2:  1920x1080   30.000000 Hz  16:9     33.750 kHz     74.250000 MHz (1920 mm x 1080 mm)
                 Hfront   88 Hsync  44 Hback  148 Hpol P
                 Vfront    4 Vsync   5 Vback   36 Vpol P
    Display Product Name: 'DCDZ-H2C MOD'
    Display Range Limits:
      Monitor ranges (GTF): 20-120 Hz V, 1-255 kHz H, max dotclock 160 MHz
  Extension blocks: 1
Checksum: 0x74

----------------

Block 1, CTA-861 Extension Block:
  Revision: 3
  Basic audio support
  Supports YCbCr 4:4:4
  Supports YCbCr 4:2:2
  Native DTDs: 1
  Video Data Block:
    VIC   4:  1280x720    60.000000 Hz  16:9     45.000 kHz     74.250000 MHz (native)
    VIC  34:  1920x1080   30.000000 Hz  16:9     33.750 kHz     74.250000 MHz
    VIC  34:  1920x1080   30.000000 Hz  16:9     33.750 kHz     74.250000 MHz
    VIC  34:  1920x1080   30.000000 Hz  16:9     33.750 kHz     74.250000 MHz
    VIC  34:  1920x1080   30.000000 Hz  16:9     33.750 kHz     74.250000 MHz
    VIC  34:  1920x1080   30.000000 Hz  16:9     33.750 kHz     74.250000 MHz
    VIC  34:  1920x1080   30.000000 Hz  16:9     33.750 kHz     74.250000 MHz
  Audio Data Block:
    Linear PCM:
      Max channels: 2
      Supported sample rates (kHz): 48 44.1 32
      Supported sample sizes (bits): 16
  Speaker Allocation Data Block:
    FL/FR - Front Left/Right
  Vendor-Specific Data Block (HDMI), OUI 00-0C-03:
    Source physical address: 1.0.0.0
  Detailed Timing Descriptors:
    DTD 3:  1920x1080   30.000000 Hz  16:9     33.750 kHz     74.250000 MHz (1920 mm x 1080 mm)
                 Hfront   88 Hsync  44 Hback  148 Hpol P
                 Vfront    4 Vsync   5 Vback   36 Vpol P
    DTD 4:  1920x1080   30.000000 Hz  16:9     33.750 kHz     74.250000 MHz (1920 mm x 1080 mm)
                 Hfront   88 Hsync  44 Hback  148 Hpol P
                 Vfront    4 Vsync   5 Vback   36 Vpol P
    DTD 5:  1920x1080   30.000000 Hz  16:9     33.750 kHz     74.250000 MHz (1920 mm x 1080 mm)
                 Hfront   88 Hsync  44 Hback  148 Hpol P
                 Vfront    4 Vsync   5 Vback   36 Vpol P
    DTD 6:  1920x1080   30.000000 Hz  16:9     33.750 kHz     74.250000 MHz (1920 mm x 1080 mm)
                 Hfront   88 Hsync  44 Hback  148 Hpol P
                 Vfront    4 Vsync   5 Vback   36 Vpol P
Checksum: 0x21  Unused space in Extension Block: 29 bytes

----------------

Warnings:

Block 1, CTA-861 Extension Block:
  IT Video Formats are overscanned by default, but normally this should be underscanned.
  Video Data Block: All VICs are in ascending order, and the first (preferred) VIC <= 4, is that intended?
  Add a Colorimetry Data Block with the sRGB colorimetry bit set to avoid interop issues.

Failures:

Block 0, Base EDID:
  Detailed Timing Descriptor #1: Mismatch of image size 1920x1080 mm vs display size 1600x900 mm.
  Detailed Timing Descriptor #2: Mismatch of image size 1920x1080 mm vs display size 1600x900 mm.
Block 1, CTA-861 Extension Block:
  Video Data Block: Duplicate VIC 34.
  Detailed Timing Descriptor #3: Mismatch of image size 1920x1080 mm vs display size 1600x900 mm.
  Detailed Timing Descriptor #4: Mismatch of image size 1920x1080 mm vs display size 1600x900 mm.
  Detailed Timing Descriptor #5: Mismatch of image size 1920x1080 mm vs display size 1600x900 mm.
  Detailed Timing Descriptor #6: Mismatch of image size 1920x1080 mm vs display size 1600x900 mm.
  Required 640x480p60 timings are missing in the established timings and the SVD list (VIC 1).
  Missing VCDB, needed for Set Selectable RGB Quantization to avoid interop issues.
EDID:
  Extension Block 2 started with EDID header, ignoring Extension Blocks >= 2.
  Base EDID: The DTD max image size is 1920x1080mm, which is larger than the display size 1600.0x900.0mm.

EDID conformity: FAIL
