edid-decode (hex):

00 ff ff ff ff ff ff 00 52 62 88 88 00 88 88 88
1c 15 01 03 80 06 0d 78 0a 0d c9 a0 57 47 98 27
12 48 4c 00 00 00 01 01 01 01 01 01 01 01 01 01
01 01 01 01 01 01 a0 32 38 6a 40 70 18 80 22 20
e2 00 42 86 00 00 00 18 35 0c f8 6a 10 e8 18 30
22 20 e2 00 3f 7d 00 00 00 18 00 00 00 fc 00 53
63 72 65 65 6e 58 70 65 72 74 2d 0a 00 00 00 fd
00 14 78 01 ff 1d 00 0a 20 20 20 20 20 20 00 26

----------------

Block 0, Base EDID:
  EDID Structure Version & Revision: 1.3
  Vendor & Product Identification:
    Manufacturer: TSB
    Model: 34952
    Serial Number: ...
    Made in: week 28 of 2011
  Basic Display Parameters & Features:
    Digital display
    Maximum image size: 6 cm x 13 cm
    Gamma: 2.20
    RGB color display
    First detailed timing is the preferred timing
  Color Characteristics:
    Red  : 0.6250, 0.3398
    Green: 0.2802, 0.5947
    Blue : 0.1552, 0.0703
    White: 0.2832, 0.2978
  Established Timings I & II: none
  Standard Timings: none
  Detailed Timing Descriptors:
    DTD 1:  1080x2160   50.034283 Hz   1:2    109.275 kHz    129.600000 MHz (66 mm x 134 mm)
                 Hfront   34 Hsync  32 Hback   40 Hpol N
                 Vfront   14 Vsync   2 Vback    8 Vpol N
    DTD 2:   504x1000   50.028817 Hz  63:125   51.230 kHz     31.250000 MHz (63 mm x 125 mm)
                 Hfront   34 Hsync  32 Hback   40 Hpol N
                 Vfront   14 Vsync   2 Vback    8 Vpol N
    Display Product Name: 'ScreenXpert-'
    Display Range Limits:
      Monitor ranges (GTF): 20-120 Hz V, 1-255 kHz H, max dotclock 290 MHz
Checksum: 0x26

----------------

Warnings:

Block 0, Base EDID:
  Basic Display Parameters & Features: Dubious maximum image size (6x13 is smaller than 10x10 cm).
  Detailed Timing Descriptor #1: Dubious image size (66x134 mm is smaller than 100x100 mm).
  Detailed Timing Descriptor #2: Dubious image size (63x125 mm is smaller than 100x100 mm).

EDID conformity: PASS
