edid-decode (hex):

00 ff ff ff ff ff ff 00 30 ae af 41 00 00 00 00
1e 22 01 04 a5 1d 13 78 e3 b4 03 a5 52 4e 9c 25
0e 51 55 00 00 00 01 01 01 01 01 01 01 01 01 01
01 01 01 01 01 01 03 3e 80 a0 70 b0 48 40 30 20
66 0c 1e b3 10 00 00 1e 00 00 00 fd 00 28 3c 4d
4d 10 01 0a 20 20 20 20 20 20 00 00 00 0f 00 d1
0a 3c d1 0a 28 28 0e 04 51 a1 58 20 00 00 00 fc
00 54 4c 31 33 33 56 44 4d 53 30 31 0a 20 01 dc

70 20 79 02 00 2b 00 06 27 00 28 3b 00 00 81 00
14 73 1a 00 00 03 01 28 3c 00 00 00 00 00 00 3c
00 00 00 00 8d 00 00 00 00 00 00 00 00 00 00 00
00 00 00 00 00 00 00 00 00 00 00 00 00 00 00 00
00 00 00 00 00 00 00 00 00 00 00 00 00 00 00 00
00 00 00 00 00 00 00 00 00 00 00 00 00 00 00 00
00 00 00 00 00 00 00 00 00 00 00 00 00 00 00 00
00 00 00 00 00 00 00 00 00 00 00 00 00 00 57 90

00 ff ff ff ff ff ff 00 30 ae af 41 00 00 00 00
1e 22 01 04 a5 1d 13 78 e3 b4 03 a5 52 4e 9c 25
0e 51 55 00 00 00 01 01 01 01 01 01 01 01 01 01
01 01 01 01 01 01 03 3e 80 a0 70 b0 48 40 30 20
66 0c 1e b3 10 00 00 1e 00 00 00 fd 00 28 3c 4d
4d 10 01 0a 20 20 20 20 20 20 00 00 00 0f 00 d1
0a 3c d1 0a 28 28 0e 04 51 a1 58 20 00 00 00 fc
00 54 4c 31 33 33 56 44 4d 53 30 31 0a 20 01 dc

70 20 79 02 00 2b 00 06 27 00 28 3b 00 00 81 00
14 73 1a 00 00 03 01 28 3c 00 00 00 00 00 00 3c
00 00 00 00 8d 00 00 00 00 00 00 00 00 00 00 00
00 00 00 00 00 00 00 00 00 00 00 00 00 00 00 00
00 00 00 00 00 00 00 00 00 00 00 00 00 00 00 00
00 00 00 00 00 00 00 00 00 00 00 00 00 00 00 00
00 00 00 00 00 00 00 00 00 00 00 00 00 00 00 00
00 00 00 00 00 00 00 00 00 00 00 00 00 00 57 90

----------------

Block 0, Base EDID:
  EDID Structure Version & Revision: 1.4
  Vendor & Product Identification:
    Manufacturer: LEN
    Model: 16815
    Made in: week 30 of 2024
  Basic Display Parameters & Features:
    Digital display
    Bits per primary color channel: 8
    DisplayPort interface
    Maximum image size: 29 cm x 19 cm
    Gamma: 2.20
    DPMS levels: Standby Suspend Off
    Supported color formats: RGB 4:4:4
    First detailed timing includes the native pixel format and preferred refresh rate
    Display supports continuous frequencies
  Color Characteristics:
    Red  : 0.6464, 0.3232
    Green: 0.3056, 0.6093
    Blue : 0.1445, 0.0546
    White: 0.3164, 0.3349
  Established Timings I & II: none
  Standard Timings: none
  Detailed Timing Descriptors:
    DTD 1:  1920x1200   60.001663 Hz  16:10    76.322 kHz    158.750000 MHz (286 mm x 179 mm)
                 Hfront   48 Hsync  32 Hback   80 Hpol P
                 Vfront   54 Vsync   6 Vback   12 Vpol P
    Display Range Limits:
      Monitor ranges (Range Limits Only): 40-60 Hz V, 77-77 kHz H, max dotclock 160 MHz
    Manufacturer-Specified Display Descriptor (0x0f): 00 0f 00 d1 0a 3c d1 0a 28 28 0e 04 51 a1 58 20 '.....<..((..Q.X '
    Display Product Name: 'TL133VDMS01'
  Extension blocks: 1
Checksum: 0xdc

----------------

Block 1, DisplayID Extension Block:
  Version: 2.0
  Extension Count: 0
  Display Product Primary Use Case: None of the listed primary use cases; generic display
  Adaptive Sync Data Block:
    Descriptor #1:
      Native Panel Range
      Fixed Average V-Total and Adaptive V-Total
      Supports Seamless Transition
      'Max Single Frame Duration Increase' field value without jitter impact
      'Max Single Frame Duration Decrease' field value without jitter impact
      Max Duration Increase: 0.00 ms
      Max Duration Decrease: 0.00 ms
      Min Refresh Rate: 40 Hz
      Max Refresh Rate: 60 Hz
  CTA-861 DisplayID Data Block:
  Vendor-Specific Data Block (AMD), OUI 00-00-1A:
    Version: 3
    Flags 1: 0x01
      FreeSync Supported
    Minimum Refresh Rate: 40 Hz
    Maximum Refresh Rate: 60 Hz
    Flags 5: 0x00
    Additional Sink Information Address: 0x410
  Checksum: 0x57
Checksum: 0x90

----------------

Warnings:

EDID:
  Base EDID: Some timings are out of range of the Monitor Ranges:
    Horizontal Freq: 76.322 - 76.322 kHz (Monitor: 77.000 - 77.000 kHz)
    Could be due to a Monitor Range off-by-one rounding issue

Failures:

EDID:
  Extension Block 2 started with EDID header, ignoring Extension Blocks >= 2.
  DisplayID: Missing DisplayID Display Parameters Data Block.
  DisplayID: Missing DisplayID Type VII Detailed Timing Data Block.
  DisplayID: DisplayID expects at least one preferred timing.

EDID conformity: FAIL
