edid-decode (hex):

00 ff ff ff ff ff ff 00 30 ae af 41 00 00 00 00
00 22 01 04 a5 1d 12 78 e3 4d 24 a5 55 4b 9c 23
0e 4e 55 00 00 00 01 01 01 01 01 01 01 01 01 01
01 01 01 01 01 01 ea 3d 80 c8 70 b0 2e 40 30 20
36 00 1e b3 10 00 00 1a 00 00 00 fd 00 28 3c 4b
4b 10 01 0a 20 20 20 20 20 20 00 00 00 0f 00 d1
0a 3c d1 0a 28 28 0e 04 0e 77 1d 13 00 00 00 fc
00 4d 4e 44 33 30 37 51 53 33 2d 31 0a 20 01 6f

70 20 79 02 00 20 00 0c f6 8b 40 1d 13 00 00 00
00 00 18 00 21 00 1d 2c 0b fe 06 80 07 b0 04 00
3d 7a 54 cc 94 99 66 52 0f 02 35 54 00 80 00 80
00 80 12 78 26 00 09 02 00 00 00 00 00 01 00 00
22 00 14 24 6b 02 05 7f 07 c7 00 2f 80 1f 00 af
04 2d 00 02 00 05 00 81 00 14 73 1a 00 00 03 01
28 3c 00 00 00 00 00 00 3c 00 00 00 00 80 00 00
00 00 00 00 00 00 00 00 00 00 00 00 00 00 d6 90

00 ff ff ff ff ff ff 00 30 ae af 41 00 00 00 00
00 22 01 04 a5 1d 12 78 e3 4d 24 a5 55 4b 9c 23
0e 4e 55 00 00 00 01 01 01 01 01 01 01 01 01 01
01 01 01 01 01 01 ea 3d 80 c8 70 b0 2e 40 30 20
36 00 1e b3 10 00 00 1a 00 00 00 fd 00 28 3c 4b
4b 10 01 0a 20 20 20 20 20 20 00 00 00 0f 00 d1
0a 3c d1 0a 28 28 0e 04 0e 77 1d 13 00 00 00 fc
00 4d 4e 44 33 30 37 51 53 33 2d 31 0a 20 01 6f

70 20 79 02 00 20 00 0c f6 8b 40 1d 13 00 00 00
00 00 18 00 21 00 1d 2c 0b fe 06 80 07 b0 04 00
3d 7a 54 cc 94 99 66 52 0f 02 35 54 00 80 00 80
00 80 12 78 26 00 09 02 00 00 00 00 00 01 00 00
22 00 14 24 6b 02 05 7f 07 c7 00 2f 80 1f 00 af
04 2d 00 02 00 05 00 81 00 14 73 1a 00 00 03 01
28 3c 00 00 00 00 00 00 3c 00 00 00 00 80 00 00
00 00 00 00 00 00 00 00 00 00 00 00 00 00 d6 90

----------------

Block 0, Base EDID:
  EDID Structure Version & Revision: 1.4
  Vendor & Product Identification:
    Manufacturer: LEN
    Model: 16815
    Made in: 2024
  Basic Display Parameters & Features:
    Digital display
    Bits per primary color channel: 8
    DisplayPort interface
    Maximum image size: 29 cm x 18 cm
    Gamma: 2.20
    DPMS levels: Standby Suspend Off
    Supported color formats: RGB 4:4:4
    First detailed timing includes the native pixel format and preferred refresh rate
    Display supports continuous frequencies
  Color Characteristics:
    Red  : 0.6455, 0.3320
    Green: 0.2958, 0.6103
    Blue : 0.1367, 0.0566
    White: 0.3056, 0.3320
  Established Timings I & II: none
  Standard Timings: none
  Detailed Timing Descriptors:
    DTD 1:  1920x1200   60.003331 Hz  16:10    74.764 kHz    158.500000 MHz (286 mm x 179 mm)
                 Hfront   48 Hsync  32 Hback  120 Hpol P
                 Vfront    3 Vsync   6 Vback   37 Vpol N
    Display Range Limits:
      Monitor ranges (Range Limits Only): 40-60 Hz V, 75-75 kHz H, max dotclock 160 MHz
    Manufacturer-Specified Display Descriptor (0x0f): 00 0f 00 d1 0a 3c d1 0a 28 28 0e 04 0e 77 1d 13 '.....<..((...w..'
    Display Product Name: 'MND307QS3-1'
  Extension blocks: 1
Checksum: 0x6f

----------------

Block 1, DisplayID Extension Block:
  Version: 2.0
  Extension Count: 0
  Display Product Primary Use Case: None of the listed primary use cases; generic display
  Product Identification Data Block (0x20), OUI F6-8B-40:
    Product Code: 4893
    Year of Manufacture: 2024
  Display Parameters Data Block (0x21):
    Image size: 286.0 mm x 179.0 mm
    Display native pixel format: 1920x1200
    Scan Orientation: Left to Right, Top to Bottom
    Luminance Information: Minimum guaranteed value
    Color Information: CIE 1931
    Audio Speaker Information: integrated
    Native Color Chromaticity:
      Primary #1:  (0.639893, 0.329834)
      Primary #2:  (0.299805, 0.599854)
      Primary #3:  (0.149902, 0.059814)
      White Point: (0.312988, 0.328857)
    Native Maximum Luminance (Full Coverage): do not use
    Native Maximum Luminance (10% Rectangular Coverage): do not use
    Native Minimum Luminance: do not use
    Native Color Depth: 8 bpc
    Display Device Technology: Active Matrix LCD
    Native Gamma EOTF: 2.20
  Display Interface Features Data Block:
    Supported bpc for RGB encoding: 8
    Supported color space and EOTF standard combination 1: sRGB
  Video Timing Modes Type 7 - Detailed Timings Data Block:
    DTD:  1920x1200   60.003710 Hz  16:10    74.765 kHz    158.501000 MHz (aspect 16:10, no 3D stereo)
               Hfront   48 Hsync  32 Hback  120 Hpol P
               Vfront    3 Vsync   6 Vback   37 Vpol N
  CTA-861 DisplayID Data Block:
  Vendor-Specific Data Block (AMD), OUI 00-00-1A:
    Version: 3
    Flags 1: 0x01
      FreeSync Supported
    Minimum Refresh Rate: 40 Hz
    Maximum Refresh Rate: 60 Hz
    Flags 5: 0x00
    Additional Sink Information Address: 0x403
  Checksum: 0xd6
Checksum: 0x90

----------------

Failures:

EDID:
  Extension Block 2 started with EDID header, ignoring Extension Blocks >= 2.
  DisplayID: DisplayID expects at least one preferred timing.

EDID conformity: FAIL
