edid-decode (hex):

00 ff ff ff ff ff ff 00 30 ae af 41 00 00 00 00
06 22 01 04 a5 1d 12 78 e3 83 d6 a7 52 4b 9a 25
0f 50 55 00 00 00 01 01 01 01 01 01 01 01 01 01
01 01 01 01 01 01 74 3c 80 a0 70 b0 28 40 30 20
36 00 1e b3 10 00 00 1a 00 00 00 fd 00 28 3c 4a
4a 0f 01 0a 20 20 20 20 20 20 00 00 00 0f 00 d1
0a 3c d1 0a 28 28 0e 04 09 e5 87 0d 00 00 00 fc
00 4e 56 31 33 33 57 55 4d 2d 4e 36 44 0a 01 ff

70 20 79 02 00 20 00 0c e4 0e 00 87 0d 00 00 00
00 00 18 00 21 00 1d 2c 0b fe 06 80 07 b0 04 00
3d 7a 54 cc 94 99 66 52 0f 02 35 54 00 80 00 80
00 80 12 78 26 00 09 02 00 00 00 00 00 01 00 00
22 00 14 88 5c 02 05 7f 07 9f 00 2f 80 1f 00 af
04 27 00 02 00 05 00 81 00 15 74 1a 00 00 03 01
28 3c 00 00 00 00 00 00 3c 00 00 00 00 ad 00 00
00 00 00 00 00 00 00 00 00 00 00 00 00 00 eb 90

00 ff ff ff ff ff ff 00 30 ae af 41 00 00 00 00
06 22 01 04 a5 1d 12 78 e3 83 d6 a7 52 4b 9a 25
0f 50 55 00 00 00 01 01 01 01 01 01 01 01 01 01
01 01 01 01 01 01 74 3c 80 a0 70 b0 28 40 30 20
36 00 1e b3 10 00 00 1a 00 00 00 fd 00 28 3c 4a
4a 0f 01 0a 20 20 20 20 20 20 00 00 00 0f 00 d1
0a 3c d1 0a 28 28 0e 04 09 e5 87 0d 00 00 00 fc
00 4e 56 31 33 33 57 55 4d 2d 4e 36 44 0a 01 ff

70 20 79 02 00 20 00 0c e4 0e 00 87 0d 00 00 00
00 00 18 00 21 00 1d 2c 0b fe 06 80 07 b0 04 00
3d 7a 54 cc 94 99 66 52 0f 02 35 54 00 80 00 80
00 80 12 78 26 00 09 02 00 00 00 00 00 01 00 00
22 00 14 88 5c 02 05 7f 07 9f 00 2f 80 1f 00 af
04 27 00 02 00 05 00 81 00 15 74 1a 00 00 03 01
28 3c 00 00 00 00 00 00 3c 00 00 00 00 ad 00 00
00 00 00 00 00 00 00 00 00 00 00 00 00 00 eb 90

----------------

Block 0, Base EDID:
  EDID Structure Version & Revision: 1.4
  Vendor & Product Identification:
    Manufacturer: LEN
    Model: 16815
    Made in: week 6 of 2024
  Basic Display Parameters & Features:
    Digital display
    Bits per primary color channel: 8
    DisplayPort interface
    Maximum image size: 29 cm x 18 cm
    Gamma: 2.20
    DPMS levels: Standby Suspend Off
    Supported color formats: RGB 4:4:4
    First detailed timing includes the native pixel format and preferred refresh rate
    Display supports continuous frequencies
  Color Characteristics:
    Red  : 0.6542, 0.3203
    Green: 0.2929, 0.6044
    Blue : 0.1474, 0.0595
    White: 0.3134, 0.3339
  Established Timings I & II: none
  Standard Timings: none
  Detailed Timing Descriptors:
    DTD 1:  1920x1200   60.003102 Hz  16:10    74.404 kHz    154.760000 MHz (286 mm x 179 mm)
                 Hfront   48 Hsync  32 Hback   80 Hpol P
                 Vfront    3 Vsync   6 Vback   31 Vpol N
    Display Range Limits:
      Monitor ranges (Range Limits Only): 40-60 Hz V, 74-74 kHz H, max dotclock 150 MHz
    Manufacturer-Specified Display Descriptor (0x0f): 00 0f 00 d1 0a 3c d1 0a 28 28 0e 04 09 e5 87 0d '.....<..((......'
    Display Product Name: 'NV133WUM-N6D'
  Extension blocks: 1
Checksum: 0xff

----------------

Block 1, DisplayID Extension Block:
  Version: 2.0
  Extension Count: 0
  Display Product Primary Use Case: None of the listed primary use cases; generic display
  Product Identification Data Block (0x20), OUI E4-0E-00:
    Product Code: 3463
    Year of Manufacture: 2024
  Display Parameters Data Block (0x21):
    Image size: 286.0 mm x 179.0 mm
    Display native pixel format: 1920x1200
    Scan Orientation: Left to Right, Top to Bottom
    Luminance Information: Minimum guaranteed value
    Color Information: CIE 1931
    Audio Speaker Information: integrated
    Native Color Chromaticity:
      Primary #1:  (0.639893, 0.329834)
      Primary #2:  (0.299805, 0.599854)
      Primary #3:  (0.149902, 0.059814)
      White Point: (0.312988, 0.328857)
    Native Maximum Luminance (Full Coverage): do not use
    Native Maximum Luminance (10% Rectangular Coverage): do not use
    Native Minimum Luminance: do not use
    Native Color Depth: 8 bpc
    Display Device Technology: Active Matrix LCD
    Native Gamma EOTF: 2.20
  Display Interface Features Data Block:
    Supported bpc for RGB encoding: 8
    Supported color space and EOTF standard combination 1: sRGB
  Video Timing Modes Type 7 - Detailed Timings Data Block:
    DTD:  1920x1200   60.003489 Hz  16:10    74.404 kHz    154.761000 MHz (aspect 16:10, no 3D stereo)
               Hfront   48 Hsync  32 Hback   80 Hpol P
               Vfront    3 Vsync   6 Vback   31 Vpol N
  CTA-861 DisplayID Data Block:
  Vendor-Specific Data Block (AMD), OUI 00-00-1A:
    Version: 3
    Flags 1: 0x01
      FreeSync Supported
    Minimum Refresh Rate: 40 Hz
    Maximum Refresh Rate: 60 Hz
    Flags 5: 0x00
    Additional Sink Information Address: 0x430
  Checksum: 0xeb
Checksum: 0x90

----------------

Warnings:

EDID:
  Base EDID: Some timings are out of range of the Monitor Ranges:
    Maximum Clock: 154.761 MHz (Monitor: 150.000 MHz)
    Could be due to a Monitor Range off-by-one rounding issue

Failures:

EDID:
  Extension Block 2 started with EDID header, ignoring Extension Blocks >= 2.
  DisplayID: DisplayID expects at least one preferred timing.

EDID conformity: FAIL
