edid-decode (hex):

00 ff ff ff ff ff ff 00 15 8d 02 19 01 00 00 00
03 0e 01 04 a5 23 19 6b e2 0d 99 a0 57 47 98 26
10 48 4c af cf 00 31 59 45 59 61 59 81 8f 01 01
01 01 01 01 01 01 30 2a 00 98 51 00 2a 40 30 70
13 00 4a 40 11 00 00 1e 64 19 00 40 41 00 26 30
18 88 36 00 4a 40 11 00 00 18 a0 0f 20 00 31 58
1c 20 28 80 14 00 4a 40 11 00 00 1e 00 00 00 fd
00 38 55 1e 55 0d 00 0a 20 20 20 20 20 20 00 73

00 ff ff ff ff ff ff 00 15 8d 02 19 01 00 00 00
03 0e 01 04 a5 23 19 6b e2 0d 99 a0 57 47 98 26
10 48 4c af cf 00 31 59 45 59 61 59 81 8f 01 01
01 01 01 01 01 01 30 2a 00 98 51 00 2a 40 30 70
13 00 4a 40 11 00 00 1e 64 19 00 40 41 00 26 30
18 88 36 00 4a 40 11 00 00 18 a0 0f 20 00 31 58
1c 20 28 80 14 00 4a 40 11 00 00 1e 00 00 00 fd
00 38 55 1e 55 0d 00 0a 20 20 20 20 20 20 00 73

----------------

Block 0, Base EDID:
  EDID Structure Version & Revision: 1.4
  Vendor & Product Identification:
    Manufacturer: ELM
    Model: 6402
    Serial Number: ...
    Made in: week 3 of 2004
  Basic Display Parameters & Features:
    Digital display
    Bits per primary color channel: 8
    DisplayPort interface
    Maximum image size: 35 cm x 25 cm
    Gamma: 2.07
    DPMS levels: Standby Suspend Off
    Supported color formats: RGB 4:4:4
    First detailed timing includes the native pixel format and preferred refresh rate
  Color Characteristics:
    Red  : 0.6250, 0.3398
    Green: 0.2802, 0.5947
    Blue : 0.1503, 0.0634
    White: 0.2832, 0.2978
  Established Timings I & II:
    IBM     :   720x400    70.081663 Hz   9:5     31.467 kHz     28.320000 MHz
    DMT 0x04:   640x480    59.940476 Hz   4:3     31.469 kHz     25.175000 MHz
    DMT 0x05:   640x480    72.808802 Hz   4:3     37.861 kHz     31.500000 MHz
    DMT 0x06:   640x480    75.000000 Hz   4:3     37.500 kHz     31.500000 MHz
    DMT 0x08:   800x600    56.250000 Hz   4:3     35.156 kHz     36.000000 MHz
    DMT 0x09:   800x600    60.316541 Hz   4:3     37.879 kHz     40.000000 MHz
    DMT 0x0a:   800x600    72.187572 Hz   4:3     48.077 kHz     50.000000 MHz
    DMT 0x0b:   800x600    75.000000 Hz   4:3     46.875 kHz     49.500000 MHz
    DMT 0x10:  1024x768    60.003840 Hz   4:3     48.363 kHz     65.000000 MHz
    DMT 0x11:  1024x768    70.069359 Hz   4:3     56.476 kHz     75.000000 MHz
    DMT 0x12:  1024x768    75.028582 Hz   4:3     60.023 kHz     78.750000 MHz
    DMT 0x24:  1280x1024   75.024675 Hz   5:4     79.976 kHz    135.000000 MHz
  Standard Timings:
    DMT 0x07:   640x480    85.008312 Hz   4:3     43.269 kHz     36.000000 MHz
    DMT 0x0c:   800x600    85.061274 Hz   4:3     53.674 kHz     56.250000 MHz
    DMT 0x13:  1024x768    84.996690 Hz   4:3     68.677 kHz     94.500000 MHz
    DMT 0x24:  1280x1024   75.024675 Hz   5:4     79.976 kHz    135.000000 MHz
  Detailed Timing Descriptors:
    DTD 1:  1280x1024   60.019740 Hz   5:4     63.981 kHz    108.000000 MHz (330 mm x 320 mm)
                 Hfront   48 Hsync 112 Hback  248 Hpol P
                 Vfront    1 Vsync   3 Vback   38 Vpol P
    DTD 2:  1024x768    60.003840 Hz   4:3     48.363 kHz     65.000000 MHz (330 mm x 320 mm)
                 Hfront   24 Hsync 136 Hback  160 Hpol N
                 Vfront    3 Vsync   6 Vback   29 Vpol N
    DTD 3:   800x600    60.316541 Hz   4:3     37.879 kHz     40.000000 MHz (330 mm x 320 mm)
                 Hfront   40 Hsync 128 Hback   88 Hpol P
                 Vfront    1 Vsync   4 Vback   23 Vpol P
    Display Range Limits:
      Monitor ranges (GTF): 56-85 Hz V, 30-85 kHz H, max dotclock 130 MHz
Checksum: 0x73

----------------

Block 1, Unknown EDID Extension Block 0x00:
  00 ff ff ff ff ff ff 00 15 8d 02 19 01 00 00 00 '................'
  03 0e 01 04 a5 23 19 6b e2 0d 99 a0 57 47 98 26 '.....#.k....WG.&'
  10 48 4c af cf 00 31 59 45 59 61 59 81 8f 01 01 '.HL...1YEYaY....'
  01 01 01 01 01 01 30 2a 00 98 51 00 2a 40 30 70 '......0*..Q.*@0p'
  13 00 4a 40 11 00 00 1e 64 19 00 40 41 00 26 30 '..J@....d..@A.&0'
  18 88 36 00 4a 40 11 00 00 18 a0 0f 20 00 31 58 '..6.J@...... .1X'
  1c 20 28 80 14 00 4a 40 11 00 00 1e 00 00 00 fd '. (...J@........'
  00 38 55 1e 55 0d 00 0a 20 20 20 20 20 20 00 73 '.8U.U...      .s'
Checksum: 0x73

----------------

Warnings:

Block 0, Base EDID:
  Vendor & Product Identification: The serial number is one of the known dummy values, it should probably be set to 0.
  Detailed Timing Descriptor #1: Image size is 330x320 mm, but based on the picture AR it should be 330x264 mm.
  Detailed Timing Descriptor #2: Image size is 330x320 mm, but based on the picture AR it should be 330x247 mm.
  Detailed Timing Descriptor #3: Image size is 330x320 mm, but based on the picture AR it should be 330x247 mm.
  Display Range Limits: GTF support is deprecated in EDID 1.4.
  Missing Display Product Name.
EDID:
  Base EDID: Some timings are out of range of the Monitor Ranges:
    Maximum Clock: 135.000 MHz (Monitor: 130.000 MHz)
    Could be due to a Monitor Range off-by-one rounding issue

Failures:

Block 0, Base EDID:
  Detailed Timing Descriptor #1: Mismatch of image size 330x320 mm vs display size 350x250 mm.
  Detailed Timing Descriptor #2: Mismatch of image size 330x320 mm vs display size 350x250 mm.
  Detailed Timing Descriptor #3: Mismatch of image size 330x320 mm vs display size 350x250 mm.
  Display Range Limits: GTF is supported, but the display does not support continuous frequencies.
Block 1, Base EDID:
  Unknown Extension Block.
EDID:
  Base EDID: The DTD max image size is 330x320mm, which is larger than the display size 350.0x250.0mm.
  Base EDID: EDID specified 0 extension block(s), but found 1 extension block(s).

EDID conformity: FAIL
