edid-decode (hex):

00 ff ff ff ff ff ff 00 30 64 10 00 01 00 00 00
1a 12 01 03 81 2b 1b 78 2a e6 9d a3 54 4a 99 26
0f 47 4a ad ce 00 61 59 71 4a 71 4f 81 c0 81 40
81 80 b3 00 a9 40 cc 2d 90 a0 60 1a 1e 40 30 20
26 00 b1 0f 11 00 00 1a 00 00 00 fc 00 44 69 67
69 74 61 6c 20 20 20 20 20 20 00 00 00 fc 00 4c
43 44 20 31 36 38 30 58 31 30 35 30 00 00 00 fd
00 16 50 0e 5b 10 00 0a 20 20 20 20 20 20 01 f7

02 03 1d f2 4a 01 02 03 04 05 10 12 13 14 1f 23
09 07 07 83 01 00 00 65 03 0c 00 10 00 8c 0a d0
8a 20 e0 2d 10 10 3e 96 00 13 8e 21 00 00 18 01
1d 00 bc 52 d0 1e 20 b8 28 55 40 c4 8e 21 00 00
1e 01 1d 80 d0 72 1c 16 20 10 2c 25 80 c4 8e 21
00 00 9e 8c 0a d0 8a 20 e0 2d 10 10 3e 96 00 c4
8e 21 00 00 18 8c 0a d0 90 20 40 31 20 0c 40 55
00 c4 8e 21 00 00 18 00 00 00 00 00 00 00 00 2b

00 ff ff ff ff ff ff 00 30 64 10 00 01 00 00 00
1a 12 01 03 81 2b 1b 78 2a e6 9d a3 54 4a 99 26
0f 47 4a ad ce 00 61 59 71 4a 71 4f 81 c0 81 40
81 80 b3 00 a9 40 cc 2d 90 a0 60 1a 1e 40 30 20
26 00 b1 0f 11 00 00 1a 00 00 00 fc 00 44 69 67
69 74 61 6c 20 20 20 20 20 20 00 00 00 fc 00 4c
43 44 20 31 36 38 30 58 31 30 35 30 00 00 00 fd
00 16 50 0e 5b 10 00 0a 20 20 20 20 20 20 01 f7

02 03 1d f2 4a 01 02 03 04 05 10 12 13 14 1f 23
09 07 07 83 01 00 00 65 03 0c 00 10 00 8c 0a d0
8a 20 e0 2d 10 10 3e 96 00 13 8e 21 00 00 18 01
1d 00 bc 52 d0 1e 20 b8 28 55 40 c4 8e 21 00 00
1e 01 1d 80 d0 72 1c 16 20 10 2c 25 80 c4 8e 21
00 00 9e 8c 0a d0 8a 20 e0 2d 10 10 3e 96 00 c4
8e 21 00 00 18 8c 0a d0 90 20 40 31 20 0c 40 55
00 c4 8e 21 00 00 18 00 00 00 00 00 00 00 00 2b

----------------

Block 0, Base EDID:
  EDID Structure Version & Revision: 1.3
  Vendor & Product Identification:
    Manufacturer: LCD
    Model: 16
    Serial Number: ...
    Made in: week 26 of 2008
  Basic Display Parameters & Features:
    Digital display
    DFP 1.x compatible TMDS
    Maximum image size: 43 cm x 27 cm
    Gamma: 2.20
    DPMS levels: Off
    RGB color display
    First detailed timing is the preferred timing
  Color Characteristics:
    Red  : 0.6396, 0.3300
    Green: 0.2900, 0.5996
    Blue : 0.1503, 0.0595
    White: 0.2802, 0.2900
  Established Timings I & II:
    IBM     :   720x400    70.081663 Hz   9:5     31.467 kHz     28.320000 MHz
    DMT 0x04:   640x480    59.940476 Hz   4:3     31.469 kHz     25.175000 MHz
    DMT 0x05:   640x480    72.808802 Hz   4:3     37.861 kHz     31.500000 MHz
    DMT 0x06:   640x480    75.000000 Hz   4:3     37.500 kHz     31.500000 MHz
    DMT 0x09:   800x600    60.316541 Hz   4:3     37.879 kHz     40.000000 MHz
    DMT 0x0a:   800x600    72.187572 Hz   4:3     48.077 kHz     50.000000 MHz
    DMT 0x0b:   800x600    75.000000 Hz   4:3     46.875 kHz     49.500000 MHz
    DMT 0x10:  1024x768    60.003840 Hz   4:3     48.363 kHz     65.000000 MHz
    DMT 0x11:  1024x768    70.069359 Hz   4:3     56.476 kHz     75.000000 MHz
    DMT 0x12:  1024x768    75.028582 Hz   4:3     60.023 kHz     78.750000 MHz
  Standard Timings:
    DMT 0x13:  1024x768    84.996690 Hz   4:3     68.677 kHz     94.500000 MHz
    GTF     :  1152x864    70.000000 Hz   4:3     63.000 kHz     96.768000 MHz
    DMT 0x15:  1152x864    75.000000 Hz   4:3     67.500 kHz    108.000000 MHz
    DMT 0x55:  1280x720    60.000000 Hz  16:9     45.000 kHz     74.250000 MHz
    DMT 0x20:  1280x960    60.000000 Hz   4:3     60.000 kHz    108.000000 MHz
    DMT 0x23:  1280x1024   60.019740 Hz   5:4     63.981 kHz    108.000000 MHz
    DMT 0x3a:  1680x1050   59.954250 Hz  16:10    65.290 kHz    146.250000 MHz
    DMT 0x33:  1600x1200   60.000000 Hz   4:3     75.000 kHz    162.000000 MHz
  Detailed Timing Descriptors:
    DTD 1:  1680x1050   58.997585 Hz  16:10    63.717 kHz    117.240000 MHz (433 mm x 271 mm)
                 Hfront   48 Hsync  32 Hback   80 Hpol P
                 Vfront    2 Vsync   6 Vback   22 Vpol N
    Display Product Name: 'Digital      '
    Display Product Name: 'LCD 1680X1050'
    Display Range Limits:
      Monitor ranges (GTF): 22-80 Hz V, 14-91 kHz H, max dotclock 160 MHz
  Extension blocks: 1
Checksum: 0xf7

----------------

Block 1, CTA-861 Extension Block:
  Revision: 3
  Underscans IT Video Formats by default
  Basic audio support
  Supports YCbCr 4:4:4
  Supports YCbCr 4:2:2
  Native DTDs: 2
  Video Data Block:
    VIC   1:   640x480    59.940476 Hz   4:3     31.469 kHz     25.175000 MHz
    VIC   2:   720x480    59.940060 Hz   4:3     31.469 kHz     27.000000 MHz
    VIC   3:   720x480    59.940060 Hz  16:9     31.469 kHz     27.000000 MHz
    VIC   4:  1280x720    60.000000 Hz  16:9     45.000 kHz     74.250000 MHz
    VIC   5:  1920x1080i  60.000000 Hz  16:9     33.750 kHz     74.250000 MHz
    VIC  16:  1920x1080   60.000000 Hz  16:9     67.500 kHz    148.500000 MHz
    VIC  18:   720x576    50.000000 Hz  16:9     31.250 kHz     27.000000 MHz
    VIC  19:  1280x720    50.000000 Hz  16:9     37.500 kHz     74.250000 MHz
    VIC  20:  1920x1080i  50.000000 Hz  16:9     28.125 kHz     74.250000 MHz
    VIC  31:  1920x1080   50.000000 Hz  16:9     56.250 kHz    148.500000 MHz
  Audio Data Block:
    Linear PCM:
      Max channels: 2
      Supported sample rates (kHz): 48 44.1 32
      Supported sample sizes (bits): 24 20 16
  Speaker Allocation Data Block:
    FL/FR - Front Left/Right
  Vendor-Specific Data Block (HDMI), OUI 00-0C-03:
    Source physical address: 1.0.0.0
  Detailed Timing Descriptors:
    DTD 2:   720x480    59.940060 Hz   3:2     31.469 kHz     27.000000 MHz (531 mm x 398 mm)
                 Hfront   16 Hsync  62 Hback   60 Hpol N
                 Vfront    9 Vsync   6 Vback   30 Vpol N
    DTD 3:  1280x720    50.000000 Hz  16:9     37.500 kHz     74.250000 MHz (708 mm x 398 mm)
                 Hfront  440 Hsync  40 Hback  220 Hpol P
                 Vfront    5 Vsync   5 Vback   20 Vpol P
    DTD 4:  1920x1080i  50.000000 Hz  16:9     28.125 kHz     74.250000 MHz (708 mm x 398 mm)
                 Hfront  528 Hsync  44 Hback  148 Hpol P
                 Vfront    2 Vsync   5 Vback   15 Vpol P Vfront +0.5 Odd Field
                 Vfront    2 Vsync   5 Vback   15 Vpol P Vback  +0.5 Even Field
    DTD 5:   720x480    59.940060 Hz   3:2     31.469 kHz     27.000000 MHz (708 mm x 398 mm)
                 Hfront   16 Hsync  62 Hback   60 Hpol N
                 Vfront    9 Vsync   6 Vback   30 Vpol N
    DTD 6:   720x576    50.000000 Hz   5:4     31.250 kHz     27.000000 MHz (708 mm x 398 mm)
                 Hfront   12 Hsync  64 Hback   68 Hpol N
                 Vfront    5 Vsync   5 Vback   39 Vpol N
Checksum: 0x2b  Unused space in Extension Block: 8 bytes

----------------

Warnings:

Block 0, Base EDID:
  Vendor & Product Identification: The serial number is one of the known dummy values, it should probably be set to 0.
Block 1, CTA-861 Extension Block:
  Video Data Block: VIC 1 and the first DTD are not identical. Is this intended?
  Video Data Block: All VICs are in ascending order, and the first (preferred) VIC <= 4, is that intended?
  Detailed Timing Descriptor #2: Image size is 531x398 mm, but based on the picture AR it should be 531x354 mm.
  Detailed Timing Descriptor #5: Image size is 708x398 mm, but based on the picture AR it should be 597x398 mm.
  Detailed Timing Descriptor #6: Image size is 708x398 mm, but based on the picture AR it should be 497x398 mm.
  Add a Colorimetry Data Block with the sRGB colorimetry bit set to avoid interop issues.
EDID:
  Base EDID: Some timings are out of range of the Monitor Ranges:
    Vertical Freq: 50.000 - 84.997 Hz (Monitor: 22.000 - 80.000 Hz)
    Maximum Clock: 162.000 MHz (Monitor: 160.000 MHz)

Failures:

Block 0, Base EDID:
  Display Product Name: No newline, but one or more trailing spaces.
Block 1, CTA-861 Extension Block:
  Detailed Timing Descriptor #2: Mismatch of image size 531x398 mm vs display size 430x270 mm.
  Detailed Timing Descriptor #3: Mismatch of image size 708x398 mm vs display size 430x270 mm.
  Detailed Timing Descriptor #4: Mismatch of image size 708x398 mm vs display size 430x270 mm.
  Detailed Timing Descriptor #5: Mismatch of image size 708x398 mm vs display size 430x270 mm.
  Detailed Timing Descriptor #6: Mismatch of image size 708x398 mm vs display size 430x270 mm.
  Missing VCDB, needed for Set Selectable RGB Quantization to avoid interop issues.
EDID:
  Extension Block 2 started with EDID header, ignoring Extension Blocks >= 2.
  Base EDID: The DTD max image size is 708x398mm, which is larger than the display size 430.0x270.0mm.
  CTA-861: Native progressive timings are a mix of several resolutions.

EDID conformity: FAIL
