edid-decode (hex):

00 ff ff ff ff ff ff 00 51 b8 04 20 00 00 00 00
28 20 01 04 a5 1e 13 78 07 66 e5 a3 53 4c 98 24
10 50 54 00 00 00 01 01 01 01 01 01 01 01 01 01
01 01 01 01 01 01 97 86 40 a0 b0 08 59 70 30 20
36 00 2c be 10 00 00 18 00 00 00 fd 00 3c 78 fc
fc 55 00 0a 20 20 20 20 20 20 00 00 00 10 00 0a
20 20 20 20 20 20 20 20 20 20 20 20 00 00 00 fc
00 54 4c 31 34 30 41 44 58 50 32 34 2d 30 01 90

70 12 79 00 00 03 01 14 2e 0d 01 85 3f 0b 9f 00
2f 00 1f 00 07 07 58 00 02 00 05 00 2b 00 06 27
00 3c 78 00 00 81 00 1e e3 05 80 00 e6 06 07 01
60 60 23 72 1a 00 00 03 03 3c 78 00 04 60 23 60
23 78 00 00 00 00 00 00 00 00 00 00 00 00 00 00
00 00 00 00 00 00 00 00 00 00 00 00 00 00 00 00
00 00 00 00 00 00 00 00 00 00 00 00 00 00 00 00
00 00 00 00 00 00 00 00 00 00 00 00 00 00 46 90

00 ff ff ff ff ff ff 00 51 b8 04 20 00 00 00 00
28 20 01 04 a5 1e 13 78 07 66 e5 a3 53 4c 98 24
10 50 54 00 00 00 01 01 01 01 01 01 01 01 01 01
01 01 01 01 01 01 97 86 40 a0 b0 08 59 70 30 20
36 00 2c be 10 00 00 18 00 00 00 fd 00 3c 78 fc
fc 55 00 0a 20 20 20 20 20 20 00 00 00 10 00 0a
20 20 20 20 20 20 20 20 20 20 20 20 00 00 00 fc
00 54 4c 31 34 30 41 44 58 50 32 34 2d 30 01 90

70 12 79 00 00 03 01 14 2e 0d 01 85 3f 0b 9f 00
2f 00 1f 00 07 07 58 00 02 00 05 00 2b 00 06 27
00 3c 78 00 00 81 00 1e e3 05 80 00 e6 06 07 01
60 60 23 72 1a 00 00 03 03 3c 78 00 04 60 23 60
23 78 00 00 00 00 00 00 00 00 00 00 00 00 00 00
00 00 00 00 00 00 00 00 00 00 00 00 00 00 00 00
00 00 00 00 00 00 00 00 00 00 00 00 00 00 00 00
00 00 00 00 00 00 00 00 00 00 00 00 00 00 46 90

----------------

Block 0, Base EDID:
  EDID Structure Version & Revision: 1.4
  Vendor & Product Identification:
    Manufacturer: TMX
    Model: 8196
    Made in: week 40 of 2022
  Basic Display Parameters & Features:
    Digital display
    Bits per primary color channel: 8
    DisplayPort interface
    Maximum image size: 30 cm x 19 cm
    Gamma: 2.20
    Supported color formats: RGB 4:4:4
    Default (sRGB) color space is primary color space
    First detailed timing includes the native pixel format and preferred refresh rate
    Display supports continuous frequencies
  Color Characteristics:
    Red  : 0.6376, 0.3261
    Green: 0.2978, 0.5957
    Blue : 0.1435, 0.0644
    White: 0.3134, 0.3291
  Established Timings I & II: none
  Standard Timings: none
  Detailed Timing Descriptors:
    DTD 1:  2880x1800   59.999373 Hz  16:10   113.339 kHz    344.550000 MHz (300 mm x 190 mm)
                 Hfront   48 Hsync  32 Hback   80 Hpol N
                 Vfront    3 Vsync   6 Vback   80 Vpol N
    Display Range Limits:
      Monitor ranges (GTF): 60-120 Hz V, 252-252 kHz H, max dotclock 850 MHz
    Dummy Descriptor:
    Display Product Name: 'TL140ADXP24-0'
  Extension blocks: 1
Checksum: 0x90

----------------

Block 1, DisplayID Extension Block:
  Version: 1.2
  Extension Count: 0
  Display Product Type: Extension Section
  Video Timing Modes Type 1 - Detailed Timings Data Block:
    DTD:  2880x1800  120.000488 Hz  16:10   226.681 kHz    689.110000 MHz (aspect 16:10, no 3D stereo, preferred)
               Hfront   48 Hsync  32 Hback   80 Hpol N
               Vfront    3 Vsync   6 Vback   80 Vpol N
  Adaptive Sync Data Block:
    Descriptor #1:
      Native Panel Range
      Fixed Average V-Total and Adaptive V-Total
      Supports Seamless Transition
      'Max Single Frame Duration Increase' field value without jitter impact
      'Max Single Frame Duration Decrease' field value without jitter impact
      Max Duration Increase: 0.00 ms
      Max Duration Decrease: 0.00 ms
      Min Refresh Rate: 60 Hz
      Max Refresh Rate: 121 Hz
  CTA-861 DisplayID Data Block:
  Colorimetry Data Block:
    BT2020RGB
  HDR Static Metadata Data Block:
    Electro optical transfer functions:
      Traditional gamma - SDR luminance range
      Traditional gamma - HDR luminance range
      SMPTE ST2084
    Supported static metadata descriptors:
      Static metadata type 1
    Desired content max luminance: 96 (400.000 cd/m^2)
    Desired content max frame-average luminance: 96 (400.000 cd/m^2)
    Desired content min luminance: 35 (0.075 cd/m^2)
  Vendor-Specific Data Block (AMD), OUI 00-00-1A:
    Version: 3
    Feature Caps: 0x03
    Minimum Refresh Rate: 60 Hz
    Maximum Refresh Rate: 120 Hz
    Flags 1.x: 0x00
    Flags 2.x: 0x04
      ST 2084 (PQ) EOTF Supported
      Linear EOTF (Windows scRGB, 0.0 - 125.0) Supported
      Gamma 2.2 EOTF Supported
      BT.2020 Gamut Supported
    Maximum luminance: 96 (400.000 cd/m^2)
    Minimum luminance: 35 (0.075 cd/m^2)
  Checksum: 0x46
Checksum: 0x90

----------------

Warnings:

Block 0, Base EDID:
  Display Range Limits: GTF support is deprecated in EDID 1.4.
EDID:
  Base EDID: Some timings are out of range of the Monitor Ranges:
    Horizontal Freq: 113.338 - 226.680 kHz (Monitor: 252.000 - 252.000 kHz)

Failures:

Block 0, Base EDID:
  Basic Display Parameters & Features: sRGB is signaled, but the chromaticities do not match.
  Dummy Descriptor: Dummy block filled with garbage.
Block 1, DisplayID Extension Block:
  DisplayID Base Block has no product type.
  Adaptive Sync Data Block: Use of DisplayID v2.0 tag for DisplayID v1.2.
EDID:
  Extension Block 2 started with EDID header, ignoring Extension Blocks >= 2.

EDID conformity: FAIL
