edid-decode (hex):

00 ff ff ff ff ff ff 00 4f 4d 08 03 00 00 00 00
14 1d 01 03 80 46 27 78 0a 19 90 a7 55 46 98 24
10 49 4b 01 08 00 01 01 01 01 01 01 01 01 01 01
01 01 01 01 01 01 66 21 56 72 51 00 1e 30 6e 28
55 00 c4 8e 21 00 00 1e 02 3a 00 18 51 a0 2c 40
58 2c 25 00 c4 8e 21 00 00 1e 00 00 00 fc 00 44
53 47 69 20 54 56 0a 20 20 20 20 20 00 00 00 fd
00 16 3d 0e 44 0f 00 0a 20 20 20 20 20 20 01 cf

02 03 28 c3 4d 03 84 04 04 10 10 93 13 13 1f 20
21 22 29 09 07 07 09 07 07 09 07 07 83 01 00 00
67 03 0c 00 20 00 80 1e 01 1d 00 72 51 d0 1e 20
6e 28 55 00 c4 8e 21 00 00 18 01 1d 00 bc 52 d0
1e 20 b8 28 55 40 c4 8e 21 00 00 1e 01 1d 00 72
51 d0 1e 20 6e 28 55 00 c4 8e 21 00 00 1e 01 1d
00 72 51 d0 1e 20 6e 28 55 00 c4 8e 21 00 00 18
00 00 00 00 00 00 00 00 00 00 00 00 00 00 00 3e

00 ff ff ff ff ff ff 00 4f 4d 08 03 00 00 00 00
14 1d 01 03 80 46 27 78 0a 19 90 a7 55 46 98 24
10 49 4b 01 08 00 01 01 01 01 01 01 01 01 01 01
01 01 01 01 01 01 66 21 56 72 51 00 1e 30 6e 28
55 00 c4 8e 21 00 00 1e 02 3a 00 18 51 a0 2c 40
58 2c 25 00 c4 8e 21 00 00 1e 00 00 00 fc 00 44
53 47 69 20 54 56 0a 20 20 20 20 20 00 00 00 fd
00 16 3d 0e 44 0f 00 0a 20 20 20 20 20 20 01 cf

02 03 28 c3 4d 03 84 04 04 10 10 93 13 13 1f 20
21 22 29 09 07 07 09 07 07 09 07 07 83 01 00 00
67 03 0c 00 20 00 80 1e 01 1d 00 72 51 d0 1e 20
6e 28 55 00 c4 8e 21 00 00 18 01 1d 00 bc 52 d0
1e 20 b8 28 55 40 c4 8e 21 00 00 1e 01 1d 00 72
51 d0 1e 20 6e 28 55 00 c4 8e 21 00 00 1e 01 1d
00 72 51 d0 1e 20 6e 28 55 00 c4 8e 21 00 00 18
00 00 00 00 00 00 00 00 00 00 00 00 00 00 00 3e

----------------

Block 0, Base EDID:
  EDID Structure Version & Revision: 1.3
  Vendor & Product Identification:
    Manufacturer: SZM
    Model: 776
    Made in: week 20 of 2019
  Basic Display Parameters & Features:
    Digital display
    Maximum image size: 70 cm x 39 cm
    Gamma: 2.20
    RGB color display
    First detailed timing is the preferred timing
  Color Characteristics:
    Red  : 0.6523, 0.3330
    Green: 0.2753, 0.5947
    Blue : 0.1425, 0.0634
    White: 0.2851, 0.2929
  Established Timings I & II:
    DMT 0x09:   800x600    60.316541 Hz   4:3     37.879 kHz     40.000000 MHz
    DMT 0x10:  1024x768    60.003840 Hz   4:3     48.363 kHz     65.000000 MHz
  Standard Timings: none
  Detailed Timing Descriptors:
    DTD 1:  1366x768    61.718236 Hz 683:384   49.251 kHz     85.500000 MHz (708 mm x 398 mm)
                 Hfront  110 Hsync  40 Hback  220 Hpol P
                 Vfront    5 Vsync   5 Vback   20 Vpol P
    DTD 2:  1280x1184   77.518166 Hz  40:37    95.192 kHz    148.500000 MHz (708 mm x 398 mm)
                 Hfront   88 Hsync  44 Hback  148 Hpol P
                 Vfront    2 Vsync   5 Vback   37 Vpol P
    Display Product Name: 'DSGi TV'
    Display Range Limits:
      Monitor ranges (GTF): 22-61 Hz V, 14-68 kHz H, max dotclock 150 MHz
  Extension blocks: 1
Checksum: 0xcf

----------------

Block 1, CTA-861 Extension Block:
  Revision: 3
  Underscans IT Video Formats by default
  Basic audio support
  Native DTDs: 3
  Video Data Block:
    VIC   3:   720x480    59.940060 Hz  16:9     31.469 kHz     27.000000 MHz
    VIC   4:  1280x720    60.000000 Hz  16:9     45.000 kHz     74.250000 MHz (native)
    VIC   4:  1280x720    60.000000 Hz  16:9     45.000 kHz     74.250000 MHz
    VIC   4:  1280x720    60.000000 Hz  16:9     45.000 kHz     74.250000 MHz
    VIC  16:  1920x1080   60.000000 Hz  16:9     67.500 kHz    148.500000 MHz
    VIC  16:  1920x1080   60.000000 Hz  16:9     67.500 kHz    148.500000 MHz
    VIC  19:  1280x720    50.000000 Hz  16:9     37.500 kHz     74.250000 MHz (native)
    VIC  19:  1280x720    50.000000 Hz  16:9     37.500 kHz     74.250000 MHz
    VIC  19:  1280x720    50.000000 Hz  16:9     37.500 kHz     74.250000 MHz
    VIC  31:  1920x1080   50.000000 Hz  16:9     56.250 kHz    148.500000 MHz
    VIC  32:  1920x1080   24.000000 Hz  16:9     27.000 kHz     74.250000 MHz
    VIC  33:  1920x1080   25.000000 Hz  16:9     28.125 kHz     74.250000 MHz
    VIC  34:  1920x1080   30.000000 Hz  16:9     33.750 kHz     74.250000 MHz
  Audio Data Block:
    Linear PCM:
      Max channels: 2
      Supported sample rates (kHz): 48 44.1 32
      Supported sample sizes (bits): 24 20 16
    Linear PCM:
      Max channels: 2
      Supported sample rates (kHz): 48 44.1 32
      Supported sample sizes (bits): 24 20 16
    Linear PCM:
      Max channels: 2
      Supported sample rates (kHz): 48 44.1 32
      Supported sample sizes (bits): 24 20 16
  Speaker Allocation Data Block:
    FL/FR - Front Left/Right
  Vendor-Specific Data Block (HDMI), OUI 00-0C-03:
    Source physical address: 2.0.0.0
    Supports_AI
    Maximum TMDS clock: 150 MHz
  Detailed Timing Descriptors:
    DTD 3:  1280x720    60.000000 Hz  16:9     45.000 kHz     74.250000 MHz (708 mm x 398 mm)
                 Hfront  110 Hsync  40 Hback  220 Hpol N
                 Vfront    5 Vsync   5 Vback   20 Vpol N
    DTD 4:  1280x720    50.000000 Hz  16:9     37.500 kHz     74.250000 MHz (708 mm x 398 mm)
                 Hfront  440 Hsync  40 Hback  220 Hpol P
                 Vfront    5 Vsync   5 Vback   20 Vpol P
    DTD 5:  1280x720    60.000000 Hz  16:9     45.000 kHz     74.250000 MHz (708 mm x 398 mm)
                 Hfront  110 Hsync  40 Hback  220 Hpol P
                 Vfront    5 Vsync   5 Vback   20 Vpol P
    DTD 6:  1280x720    60.000000 Hz  16:9     45.000 kHz     74.250000 MHz (708 mm x 398 mm)
                 Hfront  110 Hsync  40 Hback  220 Hpol N
                 Vfront    5 Vsync   5 Vback   20 Vpol N
Checksum: 0x3e  Unused space in Extension Block: 15 bytes

----------------

Warnings:

Block 0, Base EDID:
  Detailed Timing Descriptor #2: Image size is 708x398 mm, but based on the picture AR it should be 430x398 mm.
Block 1, CTA-861 Extension Block:
  Video Data Block: VIC 3 and the first DTD are not identical. Is this intended?
  Video Data Block: All VICs are in ascending order, and the first (preferred) VIC <= 4, is that intended?
  Detailed Timing Descriptor #3: DTD is similar but not identical to VIC 4.
  Detailed Timing Descriptor #6: DTD is similar but not identical to VIC 4.
  Add a Colorimetry Data Block with the sRGB colorimetry bit set to avoid interop issues.
EDID:
  Base EDID: Some timings are out of range of the Monitor Ranges:
    Vertical Freq: 24.000 - 77.518 Hz (Monitor: 22.000 - 61.000 Hz)
    Horizontal Freq: 27.000 - 95.192 kHz (Monitor: 14.000 - 68.000 kHz)

Failures:

Block 1, CTA-861 Extension Block:
  Video Data Block: Duplicate VIC 4.
  Video Data Block: Duplicate VIC 16.
  Video Data Block: Duplicate VIC 19.
  Required 640x480p60 timings are missing in the established timings and the SVD list (VIC 1).
  Missing VCDB, needed for Set Selectable RGB Quantization to avoid interop issues.
EDID:
  Extension Block 2 started with EDID header, ignoring Extension Blocks >= 2.
  CTA-861: Native progressive timings are a mix of several resolutions.

EDID conformity: FAIL
