edid-decode (hex):

00 ff ff ff ff ff ff 00 1e 6d 8e 5b 08 bf 00 00
0c 1f 01 04 b5 3d 24 78 9f 43 95 aa 54 4e 9e 26
0f 50 54 25 4b 00 31 7c 45 7c 61 7c 81 80 81 bc
d1 fc 01 01 01 01 f6 db 80 a0 70 38 30 40 30 20
3a 00 58 2f 21 00 00 1a 02 3a 80 18 71 38 2d 40
58 2c 45 00 13 2a 21 00 00 1e 00 00 00 fd 00 30
f0 ff ff 3c 01 0a 20 20 20 20 20 20 00 00 00 fc
00 4c 47 20 55 4c 54 52 41 47 45 41 52 0a 01 02

02 03 1a 71 23 09 06 07 e3 05 c0 00 e6 06 05 01
60 59 28 46 10 04 03 01 1f 13 e6 5f 00 a0 40 00
60 30 30 20 34 00 55 50 21 00 00 1e b4 91 00 a0
50 c0 78 30 30 20 34 00 55 50 21 00 00 18 78 9b
00 a0 50 00 80 40 30 20 37 00 55 50 21 00 00 1e
df 88 80 a0 70 38 5a 40 30 20 35 00 55 50 21 00
00 1e 00 00 00 ff 00 31 31 32 4e 54 50 43 31 45
39 30 34 0a 00 00 00 00 00 00 00 00 00 00 00 cb

00 ff ff ff ff ff ff 00 1e 6d 8e 5b 08 bf 00 00
0c 1f 01 04 b5 3d 24 78 9f 43 95 aa 54 4e 9e 26
0f 50 54 25 4b 00 31 7c 45 7c 61 7c 81 80 81 bc
d1 fc 01 01 01 01 f6 db 80 a0 70 38 30 40 30 20
3a 00 58 2f 21 00 00 1a 02 3a 80 18 71 38 2d 40
58 2c 45 00 13 2a 21 00 00 1e 00 00 00 fd 00 30
f0 ff ff 3c 01 0a 20 20 20 20 20 20 00 00 00 fc
00 4c 47 20 55 4c 54 52 41 47 45 41 52 0a 01 02

02 03 1a 71 23 09 06 07 e3 05 c0 00 e6 06 05 01
60 59 28 46 10 04 03 01 1f 13 e6 5f 00 a0 40 00
60 30 30 20 34 00 55 50 21 00 00 1e b4 91 00 a0
50 c0 78 30 30 20 34 00 55 50 21 00 00 18 78 9b
00 a0 50 00 80 40 30 20 37 00 55 50 21 00 00 1e
df 88 80 a0 70 38 5a 40 30 20 35 00 55 50 21 00
00 1e 00 00 00 ff 00 31 31 32 4e 54 50 43 31 45
39 30 34 0a 00 00 00 00 00 00 00 00 00 00 00 cb

----------------

Block 0, Base EDID:
  EDID Structure Version & Revision: 1.4
  Vendor & Product Identification:
    Manufacturer: GSM
    Model: 23438
    Serial Number: ...
    Made in: week 12 of 2021
  Basic Display Parameters & Features:
    Digital display
    Bits per primary color channel: 10
    DisplayPort interface
    Maximum image size: 61 cm x 36 cm
    Gamma: 2.20
    DPMS levels: Standby
    Supported color formats: RGB 4:4:4, YCrCb 4:4:4, YCrCb 4:2:2
    Default (sRGB) color space is primary color space
    First detailed timing includes the native pixel format and preferred refresh rate
    Display supports continuous frequencies
  Color Characteristics:
    Red  : 0.6650, 0.3281
    Green: 0.3046, 0.6201
    Blue : 0.1503, 0.0595
    White: 0.3134, 0.3291
  Established Timings I & II:
    DMT 0x04:   640x480    59.940476 Hz   4:3     31.469 kHz     25.175000 MHz
    DMT 0x06:   640x480    75.000000 Hz   4:3     37.500 kHz     31.500000 MHz
    DMT 0x09:   800x600    60.316541 Hz   4:3     37.879 kHz     40.000000 MHz
    DMT 0x0b:   800x600    75.000000 Hz   4:3     46.875 kHz     49.500000 MHz
    DMT 0x10:  1024x768    60.003840 Hz   4:3     48.363 kHz     65.000000 MHz
    DMT 0x12:  1024x768    75.028582 Hz   4:3     60.023 kHz     78.750000 MHz
    DMT 0x24:  1280x1024   75.024675 Hz   5:4     79.976 kHz    135.000000 MHz
  Standard Timings:
    GTF     :   640x480   119.999084 Hz   4:3     61.800 kHz     52.406000 MHz
    GTF     :   800x600   119.999886 Hz   4:3     77.160 kHz     83.950000 MHz
    GTF     :  1024x768   119.999931 Hz   4:3     98.760 kHz    139.054000 MHz
    DMT 0x23:  1280x1024   60.019740 Hz   5:4     63.981 kHz    108.000000 MHz
    GTF     :  1280x1024  120.000185 Hz   5:4    131.640 kHz    233.793000 MHz
    GTF     :  1920x1080  119.999987 Hz  16:9    138.840 kHz    368.759000 MHz
  Detailed Timing Descriptors:
    DTD  1:  1920x1080  240.001023 Hz  16:9    270.721 kHz    563.100000 MHz (600 mm x 303 mm)
                  Hfront   48 Hsync  32 Hback   80 Hpol P
                  Vfront    3 Vsync  10 Vback   35 Vpol N
    DTD  2:  1920x1080   60.000000 Hz  16:9     67.500 kHz    148.500000 MHz (531 mm x 298 mm)
                  Hfront   88 Hsync  44 Hback  148 Hpol P
                  Vfront    4 Vsync   5 Vback   36 Vpol P
    Display Range Limits:
      Monitor ranges (Range Limits Only): 48-240 Hz V, 255-255 kHz H, max dotclock 600 MHz
    Display Product Name: 'LG ULTRAGEAR'
  Extension blocks: 1
Checksum: 0x02

----------------

Block 1, CTA-861 Extension Block:
  Revision: 3
  Basic audio support
  Supports YCbCr 4:4:4
  Supports YCbCr 4:2:2
  Native detailed modes: 1
  Audio Data Block:
    Linear PCM:
      Max channels: 2
      Supported sample rates (kHz): 48 44.1
      Supported sample sizes (bits): 24 20 16
  Colorimetry Data Block:
    BT2020YCC
    BT2020RGB
  HDR Static Metadata Data Block:
    Electro optical transfer functions:
      Traditional gamma - SDR luminance range
      SMPTE ST2084
    Supported static metadata descriptors:
      Static metadata type 1
    Desired content max luminance: 96 (400.000 cd/m^2)
    Desired content max frame-average luminance: 89 (343.724 cd/m^2)
    Desired content min luminance: 40 (0.098 cd/m^2)
  Video Data Block:
    VIC  16:  1920x1080   60.000000 Hz  16:9     67.500 kHz    148.500000 MHz
    VIC   4:  1280x720    60.000000 Hz  16:9     45.000 kHz     74.250000 MHz
    VIC   3:   720x480    59.940060 Hz  16:9     31.469 kHz     27.000000 MHz
    VIC   1:   640x480    59.940476 Hz   4:3     31.469 kHz     25.175000 MHz
    VIC  31:  1920x1080   50.000000 Hz  16:9     56.250 kHz    148.500000 MHz
    VIC  19:  1280x720    50.000000 Hz  16:9     37.500 kHz     74.250000 MHz
  Detailed Timing Descriptors:
    DTD  3:  1024x768   239.986080 Hz   4:3    207.348 kHz    245.500000 MHz (597 mm x 336 mm)
                  Hfront   48 Hsync  32 Hback   80 Hpol P
                  Vfront    3 Vsync   4 Vback   89 Vpol P
    DTD  4:  1280x960   239.840535 Hz   4:3    259.028 kHz    373.000000 MHz (597 mm x 336 mm)
                  Hfront   48 Hsync  32 Hback   80 Hpol N
                  Vfront    3 Vsync   4 Vback  113 Vpol N
    DTD  5:  1280x1024  239.920910 Hz   5:4    276.389 kHz    398.000000 MHz (597 mm x 336 mm)
                  Hfront   48 Hsync  32 Hback   80 Hpol P
                  Vfront    3 Vsync   7 Vback  118 Vpol P
    DTD  6:  1920x1080  143.980112 Hz  16:9    168.457 kHz    350.390000 MHz (597 mm x 336 mm)
                  Hfront   48 Hsync  32 Hback   80 Hpol P
                  Vfront    3 Vsync   5 Vback   82 Vpol P
    Display Product Serial Number: ...
Checksum: 0xcb  Unused space in Extension Block: 11 bytes

----------------

Block 2, Unknown EDID Extension Block 0x00:
  00 ff ff ff ff ff ff 00 1e 6d 8e 5b 08 bf 00 00 '.........m.[....'
  0c 1f 01 04 b5 3d 24 78 9f 43 95 aa 54 4e 9e 26 '.....=$x.C..TN.&'
  0f 50 54 25 4b 00 31 7c 45 7c 61 7c 81 80 81 bc '.PT%K.1|E|a|....'
  d1 fc 01 01 01 01 f6 db 80 a0 70 38 30 40 30 20 '..........p80@0 '
  3a 00 58 2f 21 00 00 1a 02 3a 80 18 71 38 2d 40 ':.X/!....:..q8-@'
  58 2c 45 00 13 2a 21 00 00 1e 00 00 00 fd 00 30 'X,E..*!........0'
  f0 ff ff 3c 01 0a 20 20 20 20 20 20 00 00 00 fc '...<..      ....'
  00 4c 47 20 55 4c 54 52 41 47 45 41 52 0a 01 02 '.LG ULTRAGEAR...'
Checksum: 0x02

----------------

Block 3, CTA-861 Extension Block:
  Revision: 3
  Basic audio support
  Supports YCbCr 4:4:4
  Supports YCbCr 4:2:2
  Native detailed modes: 1
  Audio Data Block:
    Linear PCM:
      Max channels: 2
      Supported sample rates (kHz): 48 44.1
      Supported sample sizes (bits): 24 20 16
  Colorimetry Data Block:
    BT2020YCC
    BT2020RGB
  HDR Static Metadata Data Block:
    Electro optical transfer functions:
      Traditional gamma - SDR luminance range
      SMPTE ST2084
    Supported static metadata descriptors:
      Static metadata type 1
    Desired content max luminance: 96 (400.000 cd/m^2)
    Desired content max frame-average luminance: 89 (343.724 cd/m^2)
    Desired content min luminance: 40 (0.098 cd/m^2)
  Video Data Block:
    VIC  16:  1920x1080   60.000000 Hz  16:9     67.500 kHz    148.500000 MHz
    VIC   4:  1280x720    60.000000 Hz  16:9     45.000 kHz     74.250000 MHz
    VIC   3:   720x480    59.940060 Hz  16:9     31.469 kHz     27.000000 MHz
    VIC   1:   640x480    59.940476 Hz   4:3     31.469 kHz     25.175000 MHz
    VIC  31:  1920x1080   50.000000 Hz  16:9     56.250 kHz    148.500000 MHz
    VIC  19:  1280x720    50.000000 Hz  16:9     37.500 kHz     74.250000 MHz
  Detailed Timing Descriptors:
    DTD  7:  1024x768   239.986080 Hz   4:3    207.348 kHz    245.500000 MHz (597 mm x 336 mm)
                  Hfront   48 Hsync  32 Hback   80 Hpol P
                  Vfront    3 Vsync   4 Vback   89 Vpol P
    DTD  8:  1280x960   239.840535 Hz   4:3    259.028 kHz    373.000000 MHz (597 mm x 336 mm)
                  Hfront   48 Hsync  32 Hback   80 Hpol N
                  Vfront    3 Vsync   4 Vback  113 Vpol N
    DTD  9:  1280x1024  239.920910 Hz   5:4    276.389 kHz    398.000000 MHz (597 mm x 336 mm)
                  Hfront   48 Hsync  32 Hback   80 Hpol P
                  Vfront    3 Vsync   7 Vback  118 Vpol P
    DTD 10:  1920x1080  143.980112 Hz  16:9    168.457 kHz    350.390000 MHz (597 mm x 336 mm)
                  Hfront   48 Hsync  32 Hback   80 Hpol P
                  Vfront    3 Vsync   5 Vback   82 Vpol P
    Display Product Serial Number: ...
Checksum: 0xcb  Unused space in Extension Block: 11 bytes

----------------

Warnings:

Block 0, Base EDID:
  Detailed Timing Descriptor #1: Image size is 600x303 mm, but based on the picture AR it should be 600x337 mm.
Block 1, CTA-861 Extension Block:
  IT Video Formats are overscanned by default, but normally this should be underscanned.
  Video Data Block: VIC 16 and the first DTD are not identical. Is this intended?
  Detailed Timing Descriptor #3: Image size is 597x336 mm, but based on the picture AR it should be 597x447 mm.
  Detailed Timing Descriptor #4: Image size is 597x336 mm, but based on the picture AR it should be 597x447 mm.
  Detailed Timing Descriptor #5: Image size is 597x336 mm, but based on the picture AR it should be 597x477 mm.
  Display Product Serial Number is set, so the Serial Number in the Base EDID should be 0.
Block 3, CTA-861 Extension Block:
  IT Video Formats are overscanned by default, but normally this should be underscanned.
  Detailed Timing Descriptor #7: Image size is 597x336 mm, but based on the picture AR it should be 597x447 mm.
  Detailed Timing Descriptor #8: Image size is 597x336 mm, but based on the picture AR it should be 597x447 mm.
  Detailed Timing Descriptor #9: Image size is 597x336 mm, but based on the picture AR it should be 597x477 mm.
EDID:
  Base EDID: Some timings are out of range of the Monitor Ranges:
    Horizontal Freq: 31.468 - 276.388 kHz (Monitor: 255.000 - 255.000 kHz)
  Base EDID: Multiple Display Product Serial Numbers are specified, is that intended?

Failures:

Block 0, Base EDID:
  Basic Display Parameters & Features: sRGB is signaled, but the chromaticities do not match.
  Detailed Timing Descriptor #1: Mismatch of image size 600x303 mm vs display size 610x360 mm.
  Detailed Timing Descriptor #2: Mismatch of image size 531x298 mm vs display size 610x360 mm.
Block 1, CTA-861 Extension Block:
  Detailed Timing Descriptor #3: Mismatch of image size 597x336 mm vs display size 610x360 mm.
  Detailed Timing Descriptor #4: Mismatch of image size 597x336 mm vs display size 610x360 mm.
  Detailed Timing Descriptor #5: Mismatch of image size 597x336 mm vs display size 610x360 mm.
  Detailed Timing Descriptor #6: Mismatch of image size 597x336 mm vs display size 610x360 mm.
  Missing VCDB, needed for Set Selectable RGB Quantization to avoid interop issues.
Block 2, Base EDID:
  Unknown Extension Block.
Block 3, CTA-861 Extension Block:
  Colorimetry Data Block: Only one instance of this Data Block is allowed.
  HDR Static Metadata Data Block: Only one instance of this Data Block is allowed.
  Video Data Block: Duplicate VIC 16.
  Video Data Block: Duplicate VIC 4.
  Video Data Block: Duplicate VIC 3.
  Video Data Block: Duplicate VIC 1.
  Video Data Block: Duplicate VIC 31.
  Video Data Block: Duplicate VIC 19.
  Detailed Timing Descriptor #7: Mismatch of image size 597x336 mm vs display size 610x360 mm.
  Detailed Timing Descriptor #8: Mismatch of image size 597x336 mm vs display size 610x360 mm.
  Detailed Timing Descriptor #9: Mismatch of image size 597x336 mm vs display size 610x360 mm.
  Detailed Timing Descriptor #10: Mismatch of image size 597x336 mm vs display size 610x360 mm.
EDID:
  Base EDID: EDID specified 1 extension block(s), but found 3 extension block(s).

EDID conformity: FAIL
