edid-decode (hex):

00 ff ff ff ff ff ff 00 4a 8b 32 bc 01 01 01 01
09 1a 01 03 80 22 13 78 3e ee 91 a3 54 4c 99 26
0f 50 54 01 08 00 01 01 01 01 01 01 01 01 01 01
01 01 01 01 01 01 02 3a 80 18 71 38 2d 40 58 2c
25 00 58 c1 10 00 00 1e 00 00 00 fc 00 52 54 4b
20 0a 20 20 20 20 20 20 20 20 00 00 00 ff 00 64
65 6d 6f 73 65 74 2d 31 0a 20 30 20 00 00 00 fd
00 32 4b 54 54 1e 01 0a 20 20 20 20 20 20 01 9b

02 03 23 f2 40 e2 00 d5 e3 05 c0 00 23 09 7f 07
83 01 00 00 67 03 0c 00 10 00 38 3c e6 06 05 01
62 62 00 02 3a 80 18 71 38 2d 40 58 2c 25 00 55
50 21 00 00 1e 01 1d 80 18 71 1c 16 20 58 2c 25
00 55 50 21 00 00 9e 00 00 00 00 00 00 00 00 00
00 00 00 00 00 00 00 00 00 00 00 00 00 00 00 00
00 00 00 00 00 00 00 00 00 00 00 00 00 00 00 00
00 00 00 00 00 00 00 00 00 00 00 00 00 00 00 64

----------------

Block 0, Base EDID:
  EDID Structure Version & Revision: 1.3
  Vendor & Product Identification:
    Manufacturer: RTK
    Model: 48178
    Serial Number: ...
    Made in: week 9 of 2016
  Basic Display Parameters & Features:
    Digital display
    Maximum image size: 34 cm x 19 cm
    Gamma: 2.20
    DPMS levels: Off
    Undefined display color type
    Default (sRGB) color space is primary color space
    First detailed timing is the preferred timing
  Color Characteristics:
    Red  : 0.6396, 0.3300
    Green: 0.2998, 0.5996
    Blue : 0.1503, 0.0595
    White: 0.3125, 0.3291
  Established Timings I & II:
    DMT 0x09:   800x600    60.316541 Hz   4:3     37.879 kHz     40.000000 MHz
    DMT 0x10:  1024x768    60.003840 Hz   4:3     48.363 kHz     65.000000 MHz
  Standard Timings: none
  Detailed Timing Descriptors:
    DTD 1:  1920x1080   60.000000 Hz  16:9     67.500 kHz    148.500000 MHz (344 mm x 193 mm)
                 Hfront   88 Hsync  44 Hback  148 Hpol P
                 Vfront    2 Vsync   5 Vback   38 Vpol P
    Display Product Name: 'RTK '
    Display Product Serial Number: ...
    Display Range Limits:
      Monitor ranges (Range Limits Only): 50-75 Hz V, 84-84 kHz H, max dotclock 300 MHz
  Extension blocks: 1
Checksum: 0x9b

----------------

Block 1, CTA-861 Extension Block:
  Revision: 3
  Underscans IT Video Formats by default
  Basic audio support
  Supports YCbCr 4:4:4
  Supports YCbCr 4:2:2
  Native detailed modes: 2
  Video Data Block:
  Video Capability Data Block:
    YCbCr quantization: Selectable (via AVI YQ)
    RGB quantization: Selectable (via AVI Q)
    PT scan behavior: Always Overscanned
    IT scan behavior: Always Overscanned
    CE scan behavior: Always Overscanned
  Colorimetry Data Block:
    BT2020YCC
    BT2020RGB
  Audio Data Block:
    Linear PCM:
      Max channels: 2
      Supported sample rates (kHz): 192 176.4 96 88.2 48 44.1 32
      Supported sample sizes (bits): 24 20 16
  Speaker Allocation Data Block:
    FL/FR - Front Left/Right
  Vendor-Specific Data Block (HDMI), OUI 00-0C-03:
    Source physical address: 1.0.0.0
    DC_36bit
    DC_30bit
    DC_Y444
    Maximum TMDS clock: 300 MHz
  HDR Static Metadata Data Block:
    Electro optical transfer functions:
      Traditional gamma - SDR luminance range
      SMPTE ST2084
    Supported static metadata descriptors:
      Static metadata type 1
    Desired content max luminance: 98 (417.710 cd/m^2)
    Desired content max frame-average luminance: 98 (417.710 cd/m^2)
    Desired content min luminance: 0 (0.000 cd/m^2)
  Detailed Timing Descriptors:
    DTD 2:  1920x1080   60.000000 Hz  16:9     67.500 kHz    148.500000 MHz (597 mm x 336 mm)
                 Hfront   88 Hsync  44 Hback  148 Hpol P
                 Vfront    2 Vsync   5 Vback   38 Vpol P
    DTD 3:  1920x1080i  60.000000 Hz  16:9     33.750 kHz     74.250000 MHz (597 mm x 336 mm)
                 Hfront   88 Hsync  44 Hback  148 Hpol P
                 Vfront    2 Vsync   5 Vback   15 Vpol P Vfront +0.5 Odd Field
                 Vfront    2 Vsync   5 Vback   15 Vpol P Vback  +0.5 Even Field
Checksum: 0x64  Unused space in Extension Block: 56 bytes

----------------

Warnings:

Block 0, Base EDID:
  Vendor & Product Identification: The serial number is one of the known dummy values, it should probably be set to 0.
  Detailed Timing Descriptor #1: DTD is similar but not identical to VIC 16.
  Display Product Serial Number: ...
Block 1, CTA-861 Extension Block:
  Video Capability Data Block: IT scan behavior is expected to support underscanned.
  Video Capability Data Block: S_PT is equal to S_IT and S_CE, so should be set to 0 instead.
  Detailed Timing Descriptor #2: DTD is similar but not identical to VIC 16.
  Detailed Timing Descriptor #3: DTD is identical to VIC 5, which is not present in the CTA Ext Block.
  Display Product Serial Number is set, so the Serial Number in the Base EDID should be 0.
EDID:
  Base EDID: Some timings are out of range of the Monitor Ranges:
    Horizontal Freq: 33.750 - 67.500 kHz (Monitor: 84.000 - 84.000 kHz)
  CTA-861: Multiple native progressive timings are defined.

Failures:

Block 0, Base EDID:
  Display Product Serial Number: ...
  Display Product Name: One or more trailing spaces before newline.
  Display Range Limits: 'Range Limits Only' is not allowed for EDID < 1.4.
Block 1, CTA-861 Extension Block:
  Video Data Block: This Data Block is empty.
  Video Capability Data Block: IT video formats are always overscanned, but bit 7 of Byte 3 of the CTA-861 Extension header is set to underscanned.
  Detailed Timing Descriptor #2: Mismatch of image size 597x336 mm vs display size 340x190 mm.
  Detailed Timing Descriptor #3: Mismatch of image size 597x336 mm vs display size 340x190 mm.
  Required 640x480p60 timings are missing in the established timings and the SVD list (VIC 1).
EDID:
  Base EDID: The DTD max image size is 597x336mm, which is larger than the display size 340.0x190.0mm.

EDID conformity: FAIL
