edid-decode (hex):

00 ff ff ff ff ff ff 00 31 03 35 00 00 00 00 00
0d 1d 01 03 80 52 23 78 aa ee d5 a3 54 4c 99 23
0f 50 54 a5 4b 00 71 4f 81 c0 81 40 81 80 95 00
a9 c0 b3 00 d1 c0 f5 7c 70 a0 d0 a0 29 50 30 20
35 00 33 5a 31 00 00 1a 00 00 00 fd 00 30 3c 3c
96 21 00 0a 20 20 20 20 20 20 00 00 00 fc 00 56
33 4c 36 57 0a 20 20 20 20 20 20 20 00 00 00 ff
00 30 30 30 30 30 30 30 30 30 30 30 30 30 01 49

02 03 2d f1 4c 01 02 03 04 05 90 11 12 13 14 1f
5a 23 09 07 07 83 01 00 00 6a 03 0c 00 32 00 38
42 20 00 00 68 1a 00 00 01 00 00 00 ed a3 48 b8
68 61 a0 32 50 30 40 35 00 33 5a 31 00 00 1e 21
68 70 a0 d0 a0 29 50 30 20 35 00 33 5a 31 00 00
1a 00 00 00 00 00 00 00 00 00 00 00 00 00 00 00
00 00 00 00 00 00 00 00 00 00 00 00 00 00 00 00
00 00 00 00 00 00 00 00 00 00 00 00 00 00 00 ce

00 ff ff ff ff ff ff 00 31 03 35 00 00 00 00 00
0d 1d 01 03 80 52 23 78 aa ee d5 a3 54 4c 99 23
0f 50 54 a5 4b 00 71 4f 81 c0 81 40 81 80 95 00
a9 c0 b3 00 d1 c0 f5 7c 70 a0 d0 a0 29 50 30 20
35 00 33 5a 31 00 00 1a 00 00 00 fd 00 30 3c 3c
96 21 00 0a 20 20 20 20 20 20 00 00 00 fc 00 56
33 4c 36 57 0a 20 20 20 20 20 20 20 00 00 00 ff
00 30 30 30 30 30 30 30 30 30 30 30 30 30 01 49

02 03 2d f1 4c 01 02 03 04 05 90 11 12 13 14 1f
5a 23 09 07 07 83 01 00 00 6a 03 0c 00 32 00 38
42 20 00 00 68 1a 00 00 01 00 00 00 ed a3 48 b8
68 61 a0 32 50 30 40 35 00 33 5a 31 00 00 1e 21
68 70 a0 d0 a0 29 50 30 20 35 00 33 5a 31 00 00
1a 00 00 00 00 00 00 00 00 00 00 00 00 00 00 00
00 00 00 00 00 00 00 00 00 00 00 00 00 00 00 00
00 00 00 00 00 00 00 00 00 00 00 00 00 00 00 ce

----------------

Block 0, Base EDID:
  EDID Structure Version & Revision: 1.3
  Vendor & Product Identification:
    Manufacturer: LHC
    Model: 53
    Made in: week 13 of 2019
  Basic Display Parameters & Features:
    Digital display
    Maximum image size: 82 cm x 35 cm
    Gamma: 2.20
    DPMS levels: Standby Off
    RGB color display
    First detailed timing is the preferred timing
  Color Characteristics:
    Red  : 0.6396, 0.3300
    Green: 0.2998, 0.5996
    Blue : 0.1396, 0.0595
    White: 0.3134, 0.3291
  Established Timings I & II:
    IBM     :   720x400    70.081663 Hz   9:5     31.467 kHz     28.320000 MHz
    DMT 0x04:   640x480    59.940476 Hz   4:3     31.469 kHz     25.175000 MHz
    DMT 0x06:   640x480    75.000000 Hz   4:3     37.500 kHz     31.500000 MHz
    DMT 0x09:   800x600    60.316541 Hz   4:3     37.879 kHz     40.000000 MHz
    DMT 0x0b:   800x600    75.000000 Hz   4:3     46.875 kHz     49.500000 MHz
    DMT 0x10:  1024x768    60.003840 Hz   4:3     48.363 kHz     65.000000 MHz
    DMT 0x12:  1024x768    75.028582 Hz   4:3     60.023 kHz     78.750000 MHz
    DMT 0x24:  1280x1024   75.024675 Hz   5:4     79.976 kHz    135.000000 MHz
  Standard Timings:
    DMT 0x15:  1152x864    75.000000 Hz   4:3     67.500 kHz    108.000000 MHz
    DMT 0x55:  1280x720    60.000000 Hz  16:9     45.000 kHz     74.250000 MHz
    DMT 0x20:  1280x960    60.000000 Hz   4:3     60.000 kHz    108.000000 MHz
    DMT 0x23:  1280x1024   60.019740 Hz   5:4     63.981 kHz    108.000000 MHz
    DMT 0x2f:  1440x900    59.887445 Hz  16:10    55.935 kHz    106.500000 MHz
    DMT 0x53:  1600x900    60.000000 Hz  16:9     60.000 kHz    108.000000 MHz (RB)
    DMT 0x3a:  1680x1050   59.954250 Hz  16:10    65.290 kHz    146.250000 MHz
    DMT 0x52:  1920x1080   60.000000 Hz  16:9     67.500 kHz    148.500000 MHz
  Detailed Timing Descriptors:
    DTD 1:  3440x1440   59.998875 Hz  43:18    88.858 kHz    319.890000 MHz (819 mm x 346 mm)
                 Hfront   48 Hsync  32 Hback   80 Hpol P
                 Vfront    3 Vsync   5 Vback   33 Vpol N
    Display Range Limits:
      Monitor ranges (GTF): 48-60 Hz V, 60-150 kHz H, max dotclock 330 MHz
    Display Product Name: 'V3L6W'
    Display Product Serial Number: ...
  Extension blocks: 1
Checksum: 0x49

----------------

Block 1, CTA-861 Extension Block:
  Revision: 3
  Underscans IT Video Formats by default
  Basic audio support
  Supports YCbCr 4:4:4
  Supports YCbCr 4:2:2
  Native DTDs: 1
  Video Data Block:
    VIC   1:   640x480    59.940476 Hz   4:3     31.469 kHz     25.175000 MHz
    VIC   2:   720x480    59.940060 Hz   4:3     31.469 kHz     27.000000 MHz
    VIC   3:   720x480    59.940060 Hz  16:9     31.469 kHz     27.000000 MHz
    VIC   4:  1280x720    60.000000 Hz  16:9     45.000 kHz     74.250000 MHz
    VIC   5:  1920x1080i  60.000000 Hz  16:9     33.750 kHz     74.250000 MHz
    VIC  16:  1920x1080   60.000000 Hz  16:9     67.500 kHz    148.500000 MHz (native)
    VIC  17:   720x576    50.000000 Hz   4:3     31.250 kHz     27.000000 MHz
    VIC  18:   720x576    50.000000 Hz  16:9     31.250 kHz     27.000000 MHz
    VIC  19:  1280x720    50.000000 Hz  16:9     37.500 kHz     74.250000 MHz
    VIC  20:  1920x1080i  50.000000 Hz  16:9     28.125 kHz     74.250000 MHz
    VIC  31:  1920x1080   50.000000 Hz  16:9     56.250 kHz    148.500000 MHz
    VIC  90:  2560x1080   60.000000 Hz  64:27    66.000 kHz    198.000000 MHz
  Audio Data Block:
    Linear PCM:
      Max channels: 2
      Supported sample rates (kHz): 48 44.1 32
      Supported sample sizes (bits): 24 20 16
  Speaker Allocation Data Block:
    FL/FR - Front Left/Right
  Vendor-Specific Data Block (HDMI), OUI 00-0C-03:
    Source physical address: 3.2.0.0
    DC_36bit
    DC_30bit
    DC_Y444
    Maximum TMDS clock: 330 MHz
    Extended HDMI video details:
  Vendor-Specific Data Block (AMD), OUI 00-00-1A:
    Version: 1
    Feature Caps: 0x00
    Minimum Refresh Rate: 0 Hz
    Maximum Refresh Rate: 0 Hz
    Flags 1.x: 0xed (MCCS)
  Detailed Timing Descriptors:
    DTD 2:  1720x1440   59.999355 Hz  43:36    89.399 kHz    185.950000 MHz (819 mm x 346 mm)
                 Hfront   48 Hsync  64 Hback  248 Hpol P
                 Vfront    3 Vsync   5 Vback   42 Vpol P
    DTD 3:  3440x1440   49.998124 Hz  43:18    74.047 kHz    266.570000 MHz (819 mm x 346 mm)
                 Hfront   48 Hsync  32 Hback   80 Hpol P
                 Vfront    3 Vsync   5 Vback   33 Vpol N
Checksum: 0xce  Unused space in Extension Block: 46 bytes

----------------

Warnings:

Block 0, Base EDID:
  Display Product Serial Number: ...
Block 1, CTA-861 Extension Block:
  Video Data Block: VIC 1 and the first DTD are not identical. Is this intended?
  Video Data Block: All VICs are in ascending order, and the first (preferred) VIC <= 4, is that intended?
  Detailed Timing Descriptor #2: Image size is 819x346 mm, but based on the picture AR it should be 413x346 mm.
  Add a Colorimetry Data Block with the sRGB colorimetry bit set to avoid interop issues.
EDID:
  Base EDID: Some timings are out of range of the Monitor Ranges:
    Vertical Freq: 49.998 - 75.029 Hz (Monitor: 48.000 - 60.000 Hz)
    Horizontal Freq: 28.125 - 89.399 kHz (Monitor: 60.000 - 150.000 kHz)

Failures:

Block 1, CTA-861 Extension Block:
  Missing VCDB, needed for Set Selectable RGB Quantization to avoid interop issues.
EDID:
  Extension Block 2 started with EDID header, ignoring Extension Blocks >= 2.
  CTA-861: Native progressive timings are a mix of several resolutions.

EDID conformity: FAIL
