edid-decode (hex):

00 ff ff ff ff ff ff 00 10 ac 0c 70 34 56 31 30
19 0e 01 03 6e 29 1f ac ef 7a 68 9f 56 47 99 26
12 48 4c a4 4b 00 31 59 45 59 61 59 81 99 a9 4f
a9 59 d1 4f d1 59 1a 4f 40 30 62 b0 32 40 40 c0
13 00 88 26 11 00 00 1e 00 00 00 ff 00 55 33 32
34 30 34 36 46 30 31 56 34 0a 00 00 00 fc 00 44
45 4c 4c 20 20 50 31 32 33 30 20 20 00 00 00 fd
00 32 a0 1e 82 25 00 0a 20 20 20 20 20 20 00 95

----------------

Block 0, Base EDID:
  EDID Structure Version & Revision: 1.3
  Vendor & Product Identification:
    Manufacturer: DEL
    Model: 28684
    Serial Number: ...
    Made in: week 25 of 2004
  Basic Display Parameters & Features:
    Analog display
    Signal Level Standard: 0.700 : 0.000 : 0.700 V p-p
    Blank level equals black level
    Sync: Separate Composite SyncOnGreen
    Maximum image size: 41 cm x 31 cm
    Gamma: 2.72
    DPMS levels: Standby Suspend Off
    RGB color display
    Default (sRGB) color space is primary color space
    First detailed timing is the preferred timing
    Supports GTF timings within operating range
  Color Characteristics:
    Red  : 0.6220, 0.3388
    Green: 0.2792, 0.5996
    Blue : 0.1494, 0.0722
    White: 0.2832, 0.2968
  Established Timings I & II:
    IBM     :   720x400    70.081663 Hz   9:5     31.467 kHz     28.320000 MHz
    DMT 0x04:   640x480    59.940476 Hz   4:3     31.469 kHz     25.175000 MHz
    DMT 0x06:   640x480    75.000000 Hz   4:3     37.500 kHz     31.500000 MHz
    DMT 0x0b:   800x600    75.000000 Hz   4:3     46.875 kHz     49.500000 MHz
    DMT 0x10:  1024x768    60.003840 Hz   4:3     48.363 kHz     65.000000 MHz
    DMT 0x12:  1024x768    75.028582 Hz   4:3     60.023 kHz     78.750000 MHz
    DMT 0x24:  1280x1024   75.024675 Hz   5:4     79.976 kHz    135.000000 MHz
  Standard Timings:
    DMT 0x07:   640x480    85.008312 Hz   4:3     43.269 kHz     36.000000 MHz
    DMT 0x0c:   800x600    85.061274 Hz   4:3     53.674 kHz     56.250000 MHz
    DMT 0x13:  1024x768    84.996690 Hz   4:3     68.677 kHz     94.500000 MHz
    DMT 0x25:  1280x1024   85.024098 Hz   5:4     91.146 kHz    157.500000 MHz
    DMT 0x36:  1600x1200   75.000000 Hz   4:3     93.750 kHz    202.500000 MHz
    DMT 0x37:  1600x1200   85.000000 Hz   4:3    106.250 kHz    229.500000 MHz
    DMT 0x4a:  1920x1440   75.000000 Hz   4:3    112.500 kHz    297.000000 MHz
    GTF     :  1920x1440   84.999970 Hz   4:3    128.520 kHz    341.349000 MHz
  Detailed Timing Descriptors:
    DTD 1:  1600x1200   75.000000 Hz   4:3     93.750 kHz    202.500000 MHz (392 mm x 294 mm)
                 Hfront   64 Hsync 192 Hback  304 Hpol P
                 Vfront    1 Vsync   3 Vback   46 Vpol P
    Display Product Serial Number: ...
    Display Product Name: 'DELL  P1230  '
    Display Range Limits:
      Monitor ranges (GTF): 50-160 Hz V, 30-130 kHz H, max dotclock 370 MHz
Checksum: 0x95

----------------

Warnings:

Block 0, Base EDID:
  Basic Display Parameters & Features: sRGB is signaled, but the gamma != 2.2.

Failures:

Block 0, Base EDID:
  Basic Display Parameters & Features: sRGB is signaled, but the chromaticities do not match.
  Detailed Timing Descriptor #1: Mismatch of image size 392x294 mm vs display size 410x310 mm.
  Display Product Name: No newline, but one or more trailing spaces.

EDID conformity: FAIL
