edid-decode (hex):

00 ff ff ff ff ff ff 00 15 c3 60 23 44 b9 44 01
28 16 01 04 b5 34 21 78 fa 33 05 ae 4e 35 ae 26
0d 50 54 a1 08 00 a9 40 81 80 81 40 b3 00 01 01
01 01 01 01 01 01 28 3c 80 a0 70 b0 23 40 30 20
36 00 07 44 21 00 00 1a 1a 36 80 a0 70 38 1f 40
30 20 35 00 07 44 21 00 00 1a 00 00 00 fd 00 3b
3d 1a 4e 11 00 0a 20 20 20 20 20 20 00 00 00 fc
00 43 47 32 34 36 0a 20 20 20 20 20 20 20 00 54

00 ff ff ff ff ff ff 00 15 c3 60 23 44 b9 44 01
28 16 01 04 b5 34 21 78 fa 33 05 ae 4e 35 ae 26
0d 50 54 a1 08 00 a9 40 81 80 81 40 b3 00 01 01
01 01 01 01 01 01 28 3c 80 a0 70 b0 23 40 30 20
36 00 07 44 21 00 00 1a 1a 36 80 a0 70 38 1f 40
30 20 35 00 07 44 21 00 00 1a 00 00 00 fd 00 3b
3d 1a 4e 11 00 0a 20 20 20 20 20 20 00 00 00 fc
00 43 47 32 34 36 0a 20 20 20 20 20 20 20 00 54

----------------

Block 0, Base EDID:
  EDID Structure Version & Revision: 1.4
  Vendor & Product Identification:
    Manufacturer: ENC
    Model: 9056
    Serial Number: ...
    Made in: week 40 of 2012
  Basic Display Parameters & Features:
    Digital display
    Bits per primary color channel: 10
    DisplayPort interface
    Maximum image size: 52 cm x 33 cm
    Gamma: 2.20
    DPMS levels: Standby Suspend Off
    Supported color formats: RGB 4:4:4, YCrCb 4:4:4, YCrCb 4:2:2
    First detailed timing includes the native pixel format and preferred refresh rate
  Color Characteristics:
    Red  : 0.6796, 0.3076
    Green: 0.2070, 0.6826
    Blue : 0.1484, 0.0507
    White: 0.3134, 0.3291
  Established Timings I & II:
    IBM     :   720x400    70.081663 Hz   9:5     31.467 kHz     28.320000 MHz
    DMT 0x04:   640x480    59.940476 Hz   4:3     31.469 kHz     25.175000 MHz
    DMT 0x09:   800x600    60.316541 Hz   4:3     37.879 kHz     40.000000 MHz
    DMT 0x10:  1024x768    60.003840 Hz   4:3     48.363 kHz     65.000000 MHz
  Standard Timings:
    DMT 0x33:  1600x1200   60.000000 Hz   4:3     75.000 kHz    162.000000 MHz
    DMT 0x23:  1280x1024   60.019740 Hz   5:4     63.981 kHz    108.000000 MHz
    DMT 0x20:  1280x960    60.000000 Hz   4:3     60.000 kHz    108.000000 MHz
    DMT 0x3a:  1680x1050   59.954250 Hz  16:10    65.290 kHz    146.250000 MHz
  Detailed Timing Descriptors:
    DTD 1:  1920x1200   59.950171 Hz  16:10    74.038 kHz    154.000000 MHz (519 mm x 324 mm)
                 Hfront   48 Hsync  32 Hback   80 Hpol P
                 Vfront    3 Vsync   6 Vback   26 Vpol N
    DTD 2:  1920x1080   59.933878 Hz  16:9     66.587 kHz    138.500000 MHz (519 mm x 324 mm)
                 Hfront   48 Hsync  32 Hback   80 Hpol P
                 Vfront    3 Vsync   5 Vback   23 Vpol N
    Display Range Limits:
      Monitor ranges (GTF): 59-61 Hz V, 26-78 kHz H, max dotclock 170 MHz
    Display Product Name: 'CG246'
Checksum: 0x54

----------------

Warnings:

Block 0, Base EDID:
  Detailed Timing Descriptor #2: Image size is 519x324 mm, but based on the picture AR it should be 519x291 mm.
  Display Range Limits: GTF support is deprecated in EDID 1.4.
EDID:
  Base EDID: Some timings are out of range of the Monitor Ranges:
    Vertical Freq: 59.934 - 70.082 Hz (Monitor: 59.000 - 61.000 Hz)

Failures:

Block 0, Base EDID:
  Display Range Limits: GTF is supported, but the display does not support continuous frequencies.
EDID:
  Extension Block 1 started with EDID header, ignoring Extension Blocks >= 1.

EDID conformity: FAIL
