edid-decode (hex):

00 ff ff ff ff ff ff 00 1e 6d cf 9d 01 01 01 01
00 12 01 04 01 46 27 78 0a cf 74 a3 57 4c b0 23
09 48 4c af cf 00 31 4f 45 4f 61 4f 81 8f 01 01
01 01 01 01 01 01 66 21 50 b0 51 00 1b 30 40 70
36 00 c4 8e 21 00 00 1e 00 00 00 00 00 00 00 00
00 00 00 00 00 00 00 00 00 00 00 00 00 fc 00 4c
47 20 54 56 0a 20 20 20 20 20 20 20 00 00 00 fd
00 37 4d 18 53 0f 00 0a 20 20 20 20 20 20 00 0f

----------------

Block 0, Base EDID:
  EDID Structure Version & Revision: 1.4
  Vendor & Product Identification:
    Manufacturer: GSM
    Model: 40399
    Serial Number: ...
    Made in: 2008
  Basic Display Parameters & Features:
    Analog display
    Signal Level Standard: 0.700 : 0.300 : 1.000 V p-p
    Blank level equals black level
    Sync: Serration
    Maximum image size: 70 cm x 39 cm
    Gamma: 2.20
    RGB color display
    First detailed timing includes the native pixel format and preferred refresh rate
  Color Characteristics:
    Red  : 0.6396, 0.3398
    Green: 0.2998, 0.6904
    Blue : 0.1376, 0.0380
    White: 0.2822, 0.2968
  Established Timings I & II:
    IBM     :   720x400    70.081663 Hz   9:5     31.467 kHz     28.320000 MHz
    DMT 0x04:   640x480    59.940476 Hz   4:3     31.469 kHz     25.175000 MHz
    DMT 0x05:   640x480    72.808802 Hz   4:3     37.861 kHz     31.500000 MHz
    DMT 0x06:   640x480    75.000000 Hz   4:3     37.500 kHz     31.500000 MHz
    DMT 0x08:   800x600    56.250000 Hz   4:3     35.156 kHz     36.000000 MHz
    DMT 0x09:   800x600    60.316541 Hz   4:3     37.879 kHz     40.000000 MHz
    DMT 0x0a:   800x600    72.187572 Hz   4:3     48.077 kHz     50.000000 MHz
    DMT 0x0b:   800x600    75.000000 Hz   4:3     46.875 kHz     49.500000 MHz
    DMT 0x10:  1024x768    60.003840 Hz   4:3     48.363 kHz     65.000000 MHz
    DMT 0x11:  1024x768    70.069359 Hz   4:3     56.476 kHz     75.000000 MHz
    DMT 0x12:  1024x768    75.028582 Hz   4:3     60.023 kHz     78.750000 MHz
    DMT 0x24:  1280x1024   75.024675 Hz   5:4     79.976 kHz    135.000000 MHz
  Standard Timings:
    DMT 0x06:   640x480    75.000000 Hz   4:3     37.500 kHz     31.500000 MHz
    DMT 0x0b:   800x600    75.000000 Hz   4:3     46.875 kHz     49.500000 MHz
    DMT 0x12:  1024x768    75.028582 Hz   4:3     60.023 kHz     78.750000 MHz
    DMT 0x24:  1280x1024   75.024675 Hz   5:4     79.976 kHz    135.000000 MHz
  Detailed Timing Descriptors:
    DTD 1:  1360x768    60.015162 Hz  85:48    47.712 kHz     85.500000 MHz (708 mm x 398 mm)
                 Hfront   64 Hsync 112 Hback  256 Hpol P
                 Vfront    3 Vsync   6 Vback   18 Vpol P
    Empty Descriptor
    Display Product Name: 'LG TV'
    Display Range Limits:
      Monitor ranges (GTF): 55-77 Hz V, 24-83 kHz H, max dotclock 150 MHz
Checksum: 0x0f

----------------

Warnings:

Block 0, Base EDID:
  Vendor & Product Identification: The serial number is one of the known dummy values, it should probably be set to 0.
  Display Range Limits: GTF support is deprecated in EDID 1.4.

Failures:

Block 0, Base EDID:
  Empty Descriptor: Use Dummy Descriptor instead of all zeroes.
  Display Range Limits: GTF is supported, but the display does not support continuous frequencies.

EDID conformity: FAIL
