edid-decode (hex):

00 ff ff ff ff ff ff 00 1e 6d 8c 57 0d f7 05 00
05 14 01 04 a5 30 1b 78 e2 95 35 a1 59 57 9f 27
0e 50 54 a5 4b 00 b3 00 81 80 81 8f 71 4f 01 01
01 01 01 01 01 01 02 3a 80 18 71 38 2d 40 58 2c
45 00 dd 0c 11 00 00 1a 00 00 00 fd 00 38 4b 1e
53 0f 00 0a 20 20 20 20 20 20 00 00 00 fc 00 45
32 32 35 30 0a 20 20 20 20 20 20 20 00 00 00 ff
00 30 30 35 4e 44 42 50 42 47 39 32 35 0a 00 a8

00 ff ff ff ff ff ff 00 1e 6d 8c 57 0d f7 05 00
05 14 01 04 a5 30 1b 78 e2 95 35 a1 59 57 9f 27
0e 50 54 a5 4b 00 b3 00 81 80 81 8f 71 4f 01 01
01 01 01 01 01 01 02 3a 80 18 71 38 2d 40 58 2c
45 00 dd 0c 11 00 00 1a 00 00 00 fd 00 38 4b 1e
53 0f 00 0a 20 20 20 20 20 20 00 00 00 fc 00 45
32 32 35 30 0a 20 20 20 20 20 20 20 00 00 00 ff
00 30 30 35 4e 44 42 50 42 47 39 32 35 0a 00 a8

----------------

Block 0, Base EDID:
  EDID Structure Version & Revision: 1.4
  Vendor & Product Identification:
    Manufacturer: GSM
    Model: 22412
    Serial Number: ...
    Made in: week 5 of 2010
  Basic Display Parameters & Features:
    Digital display
    Bits per primary color channel: 8
    DisplayPort interface
    Maximum image size: 48 cm x 27 cm
    Gamma: 2.20
    DPMS levels: Standby Suspend Off
    Supported color formats: RGB 4:4:4
    First detailed timing includes the native pixel format and preferred refresh rate
  Color Characteristics:
    Red  : 0.6308, 0.3486
    Green: 0.3408, 0.6220
    Blue : 0.1523, 0.0576
    White: 0.3134, 0.3291
  Established Timings I & II:
    IBM     :   720x400    70.081663 Hz   9:5     31.467 kHz     28.320000 MHz
    DMT 0x04:   640x480    59.940476 Hz   4:3     31.469 kHz     25.175000 MHz
    DMT 0x06:   640x480    75.000000 Hz   4:3     37.500 kHz     31.500000 MHz
    DMT 0x09:   800x600    60.316541 Hz   4:3     37.879 kHz     40.000000 MHz
    DMT 0x0b:   800x600    75.000000 Hz   4:3     46.875 kHz     49.500000 MHz
    DMT 0x10:  1024x768    60.003840 Hz   4:3     48.363 kHz     65.000000 MHz
    DMT 0x12:  1024x768    75.028582 Hz   4:3     60.023 kHz     78.750000 MHz
    DMT 0x24:  1280x1024   75.024675 Hz   5:4     79.976 kHz    135.000000 MHz
  Standard Timings:
    DMT 0x3a:  1680x1050   59.954250 Hz  16:10    65.290 kHz    146.250000 MHz
    DMT 0x23:  1280x1024   60.019740 Hz   5:4     63.981 kHz    108.000000 MHz
    DMT 0x24:  1280x1024   75.024675 Hz   5:4     79.976 kHz    135.000000 MHz
    DMT 0x15:  1152x864    75.000000 Hz   4:3     67.500 kHz    108.000000 MHz
  Detailed Timing Descriptors:
    DTD 1:  1920x1080   60.000000 Hz  16:9     67.500 kHz    148.500000 MHz (477 mm x 268 mm)
                 Hfront   88 Hsync  44 Hback  148 Hpol P
                 Vfront    4 Vsync   5 Vback   36 Vpol N
    Display Range Limits:
      Monitor ranges (GTF): 56-75 Hz V, 30-83 kHz H, max dotclock 150 MHz
    Display Product Name: 'E2250'
    Display Product Serial Number: ...
Checksum: 0xa8

----------------

Block 1, Unknown EDID Extension Block 0x00:
  00 ff ff ff ff ff ff 00 1e 6d 8c 57 0d f7 05 00 '.........m.W....'
  05 14 01 04 a5 30 1b 78 e2 95 35 a1 59 57 9f 27 '.....0.x..5.YW.''
  0e 50 54 a5 4b 00 b3 00 81 80 81 8f 71 4f 01 01 '.PT.K.......qO..'
  01 01 01 01 01 01 02 3a 80 18 71 38 2d 40 58 2c '.......:..q8-@X,'
  45 00 dd 0c 11 00 00 1a 00 00 00 fd 00 38 4b 1e 'E............8K.'
  53 0f 00 0a 20 20 20 20 20 20 00 00 00 fc 00 45 'S...      .....E'
  32 32 35 30 0a 20 20 20 20 20 20 20 00 00 00 ff '2250.       ....'
  00 30 30 35 4e 44 42 50 42 47 39 32 35 0a 00 a8 '.005NDBPBG925...'
Checksum: 0xa8

----------------

Warnings:

Block 0, Base EDID:
  Detailed Timing Descriptor #1: DTD is similar but not identical to VIC 16.
  Display Range Limits: GTF support is deprecated in EDID 1.4.

Failures:

Block 0, Base EDID:
  Display Range Limits: GTF is supported, but the display does not support continuous frequencies.
Block 1, Base EDID:
  Unknown Extension Block.
EDID:
  Base EDID: EDID specified 0 extension block(s), but found 1 extension block(s).

EDID conformity: FAIL
