edid-decode (hex):

00 ff ff ff ff ff ff 00 41 0c 4b b1 52 42 03 00
33 09 01 01 68 1b 14 b0 e8 d2 f2 9e 58 4e 99 27
10 48 4f a4 48 00 45 59 01 01 01 01 01 01 01 01
01 01 01 01 01 01 64 19 00 40 41 00 26 30 18 88
36 00 fa bc 00 00 00 18 56 13 20 00 31 58 19 20
10 50 13 00 fa bc 00 00 00 1e f9 15 20 f8 30 58
1f 20 20 40 13 00 fa bc 00 00 00 1e d5 09 80 a0
20 90 31 10 10 60 c2 00 fa bc 00 00 00 1c 00 01

----------------

Block 0, Base EDID:
  EDID Structure Version & Revision: 1.1
  Vendor & Product Identification:
    Manufacturer: PHL
    Model: 45387
    Serial Number: ...
    Made in: week 51 of 1999
  Basic Display Parameters & Features:
    Analog display
    Signal Level Standard: 0.700 : 0.000 : 0.700 V p-p
    Blank level equals black level
    Sync: Separate
    Maximum image size: 27 cm x 20 cm
    Gamma: 2.76
    DPMS levels: Standby Suspend Off
    RGB color display
  Color Characteristics:
    Red  : 0.6201, 0.3447
    Green: 0.3046, 0.5996
    Blue : 0.1552, 0.0654
    White: 0.2812, 0.3105
  Established Timings I & II:
    IBM     :   720x400    70.081663 Hz   9:5     31.467 kHz     28.320000 MHz
    DMT 0x04:   640x480    59.940476 Hz   4:3     31.469 kHz     25.175000 MHz
    DMT 0x06:   640x480    75.000000 Hz   4:3     37.500 kHz     31.500000 MHz
    DMT 0x0b:   800x600    75.000000 Hz   4:3     46.875 kHz     49.500000 MHz
    DMT 0x10:  1024x768    60.003840 Hz   4:3     48.363 kHz     65.000000 MHz
  Standard Timings:
    DMT 0x0c:   800x600    85.061274 Hz   4:3     53.674 kHz     56.250000 MHz
  Detailed Timing Descriptors:
    DTD 1:  1024x768    60.003840 Hz   4:3     48.363 kHz     65.000000 MHz (250 mm x 188 mm)
                 Hfront   24 Hsync 136 Hback  160 Hpol N
                 Vfront    3 Vsync   6 Vback   29 Vpol N
    DTD 2:   800x600    75.000000 Hz   4:3     46.875 kHz     49.500000 MHz (250 mm x 188 mm)
                 Hfront   16 Hsync  80 Hback  160 Hpol P
                 Vfront    1 Vsync   3 Vback   21 Vpol P
    DTD 3:   800x600    85.061274 Hz   4:3     53.674 kHz     56.250000 MHz (250 mm x 188 mm)
                 Hfront   32 Hsync  64 Hback  152 Hpol P
                 Vfront    1 Vsync   3 Vback   27 Vpol P
    DTD 4:   640x400    70.072383 Hz  16:10    31.462 kHz     25.170000 MHz (250 mm x 188 mm)
                 Hfront   16 Hsync  96 Hback   48 Hpol N
                 Vfront   12 Vsync   2 Vback   35 Vpol P
Checksum: 0x01

----------------

Warnings:

Block 0, Base EDID:
  EDID Structure Version & Revision: EDID 1.1 is deprecated, do not use.
  Detailed Timing Descriptor #4: Image size is 250x188 mm, but based on the picture AR it should be 250x156 mm.

Failures:

Block 0, Base EDID:
  Detailed Timing Descriptor #1: Mismatch of image size 250x188 mm vs display size 270x200 mm.
  Detailed Timing Descriptor #2: Mismatch of image size 250x188 mm vs display size 270x200 mm.
  Detailed Timing Descriptor #3: Mismatch of image size 250x188 mm vs display size 270x200 mm.
  Detailed Timing Descriptor #4: Mismatch of image size 250x188 mm vs display size 270x200 mm.

EDID conformity: FAIL
