edid-decode (hex):

00 ff ff ff ff ff ff 00 09 e5 00 00 01 01 01 01
0a 19 01 03 08 00 00 78 0a d7 a5 a2 59 4a 96 24
14 50 54 ad ce 00 01 01 01 01 01 01 01 01 01 01
01 01 01 01 01 01 66 21 56 aa 51 00 1e 30 46 8f
33 00 f8 c2 21 00 00 1e 66 21 50 b0 51 00 1b 30
40 70 36 00 f8 c2 21 00 00 1e 00 00 00 fc 00 54
52 4c 44 45 44 33 32 35 38 41 2d 48 00 00 00 fd
00 32 4c 1e 41 0b 00 0a 20 20 20 20 20 20 00 8a

----------------

Block 0, Base EDID:
  EDID Structure Version & Revision: 1.3
  Vendor & Product Identification:
    Manufacturer: BOE
    Model: 0
    Serial Number: ...
    Made in: week 10 of 2015
  Basic Display Parameters & Features:
    Analog display
    Signal Level Standard: 0.700 : 0.300 : 1.000 V p-p
    Blank level equals black level
    Sync: Separate
    Image size is variable
    Gamma: 2.20
    RGB color display
    First detailed timing is the preferred timing
  Color Characteristics:
    Red  : 0.6357, 0.3486
    Green: 0.2900, 0.5888
    Blue : 0.1425, 0.0800
    White: 0.3134, 0.3291
  Established Timings I & II:
    IBM     :   720x400    70.081663 Hz   9:5     31.467 kHz     28.320000 MHz
    DMT 0x04:   640x480    59.940476 Hz   4:3     31.469 kHz     25.175000 MHz
    DMT 0x05:   640x480    72.808802 Hz   4:3     37.861 kHz     31.500000 MHz
    DMT 0x06:   640x480    75.000000 Hz   4:3     37.500 kHz     31.500000 MHz
    DMT 0x09:   800x600    60.316541 Hz   4:3     37.879 kHz     40.000000 MHz
    DMT 0x0a:   800x600    72.187572 Hz   4:3     48.077 kHz     50.000000 MHz
    DMT 0x0b:   800x600    75.000000 Hz   4:3     46.875 kHz     49.500000 MHz
    DMT 0x10:  1024x768    60.003840 Hz   4:3     48.363 kHz     65.000000 MHz
    DMT 0x11:  1024x768    70.069359 Hz   4:3     56.476 kHz     75.000000 MHz
    DMT 0x12:  1024x768    75.028582 Hz   4:3     60.023 kHz     78.750000 MHz
  Standard Timings: none
  Detailed Timing Descriptors:
    DTD 1:  1366x768    59.789541 Hz 683:384   47.712 kHz     85.500000 MHz (760 mm x 450 mm)
                 Hfront   70 Hsync 143 Hback  213 Hpol P
                 Vfront    3 Vsync   3 Vback   24 Vpol P
    DTD 2:  1360x768    60.015162 Hz  85:48    47.712 kHz     85.500000 MHz (760 mm x 450 mm)
                 Hfront   64 Hsync 112 Hback  256 Hpol P
                 Vfront    3 Vsync   6 Vback   18 Vpol P
    Display Product Name: 'TRLDED3258A-H'
    Display Range Limits:
      Monitor ranges (GTF): 50-76 Hz V, 30-65 kHz H, max dotclock 110 MHz
Checksum: 0x8a

----------------

Warnings:

Block 0, Base EDID:
  Vendor & Product Identification: The serial number is one of the known dummy values, it should probably be set to 0.
  Detailed Timing Descriptor #1: Image size is 760x450 mm, but based on the picture AR it should be 760x427 mm.
  Detailed Timing Descriptor #2: Image size is 760x450 mm, but based on the picture AR it should be 760x429 mm.

Failures:

EDID:
  Base EDID: The DTD max image size is 760x450mm, but the display size is not specified anywhere.

EDID conformity: FAIL
