edid-decode (hex):

00 ff ff ff ff ff ff 00 51 a4 60 15 00 00 00 00
17 21 01 03 a3 1e 1a 78 3e ee 91 a3 54 4c 99 26
0f 50 54 21 08 00 d1 c0 a9 c0 8b c0 81 c0 61 c0
59 c0 4b c0 3b c0 02 3a 80 18 71 38 2d 40 58 2c
45 00 59 c2 10 00 00 1e 00 00 00 fc 00 54 4d 44
54 4d 50 31 35 36 4c 31 0a 20 00 00 00 ff 00 0a
20 20 20 20 20 20 20 20 20 20 20 20 00 00 00 fd
00 38 4b 1e 54 11 00 0a 20 20 20 20 20 20 01 44

02 03 25 f2 42 10 03 e2 00 d5 e3 05 c0 00 23 09
7f 07 83 01 00 00 67 03 0c 00 10 00 18 2d e6 06
05 01 69 69 4f 30 2a 40 c8 60 84 64 30 18 50 13
00 58 c3 10 00 00 1e 66 21 56 aa 51 00 1e 30 46
8f 33 00 58 c3 10 00 00 1e 01 1d 00 72 51 d0 1e
20 6e 28 55 00 58 c3 10 00 00 1e 00 00 00 00 00
00 00 00 00 00 00 00 00 00 00 00 00 00 00 00 00
00 00 00 00 00 00 00 00 00 00 00 00 00 00 00 e4

00 ff ff ff ff ff ff 00 51 a4 60 15 00 00 00 00
17 21 01 03 a3 1e 1a 78 3e ee 91 a3 54 4c 99 26
0f 50 54 21 08 00 d1 c0 a9 c0 8b c0 81 c0 61 c0
59 c0 4b c0 3b c0 02 3a 80 18 71 38 2d 40 58 2c
45 00 59 c2 10 00 00 1e 00 00 00 fc 00 54 4d 44
54 4d 50 31 35 36 4c 31 0a 20 00 00 00 ff 00 0a
20 20 20 20 20 20 20 20 20 20 20 20 00 00 00 fd
00 38 4b 1e 54 11 00 0a 20 20 20 20 20 20 01 44

02 03 25 f2 42 10 03 e2 00 d5 e3 05 c0 00 23 09
7f 07 83 01 00 00 67 03 0c 00 10 00 18 2d e6 06
05 01 69 69 4f 30 2a 40 c8 60 84 64 30 18 50 13
00 58 c3 10 00 00 1e 66 21 56 aa 51 00 1e 30 46
8f 33 00 58 c3 10 00 00 1e 01 1d 00 72 51 d0 1e
20 6e 28 55 00 58 c3 10 00 00 1e 00 00 00 00 00
00 00 00 00 00 00 00 00 00 00 00 00 00 00 00 00
00 00 00 00 00 00 00 00 00 00 00 00 00 00 00 e4

----------------

Block 0, Base EDID:
  EDID Structure Version & Revision: 1.3
  Vendor & Product Identification:
    Manufacturer: TMD
    Model: 5472
    Made in: week 23 of 2023
  Basic Display Parameters & Features:
    Digital display
    DFP 1.x compatible TMDS
    Maximum image size: 30 cm x 26 cm
    Gamma: 2.20
    DPMS levels: Off
    Undefined display color type
    Default (sRGB) color space is primary color space
    First detailed timing is the preferred timing
  Color Characteristics:
    Red  : 0.6396, 0.3300
    Green: 0.2998, 0.5996
    Blue : 0.1503, 0.0595
    White: 0.3125, 0.3291
  Established Timings I & II:
    DMT 0x04:   640x480    59.940476 Hz   4:3     31.469 kHz     25.175000 MHz
    DMT 0x09:   800x600    60.316541 Hz   4:3     37.879 kHz     40.000000 MHz
    DMT 0x10:  1024x768    60.003840 Hz   4:3     48.363 kHz     65.000000 MHz
  Standard Timings:
    DMT 0x52:  1920x1080   60.000000 Hz  16:9     67.500 kHz    148.500000 MHz
    DMT 0x53:  1600x900    60.000000 Hz  16:9     60.000 kHz    108.000000 MHz (RB)
    GTF     :  1360x765    60.000341 Hz  16:9     47.520 kHz     84.396000 MHz
    DMT 0x55:  1280x720    60.000000 Hz  16:9     45.000 kHz     74.250000 MHz
    GTF     :  1024x576    60.000204 Hz  16:9     35.820 kHz     46.996000 MHz
    GTF     :   960x540    60.000530 Hz  16:9     33.540 kHz     40.785000 MHz
    GTF     :   848x477    60.000307 Hz  16:9     29.640 kHz     31.300000 MHz
    GTF     :   720x405    60.000000 Hz  16:9     25.200 kHz     22.176000 MHz
  Detailed Timing Descriptors:
    DTD 1:  1920x1080   60.000000 Hz  16:9     67.500 kHz    148.500000 MHz (345 mm x 194 mm)
                 Hfront   88 Hsync  44 Hback  148 Hpol P
                 Vfront    4 Vsync   5 Vback   36 Vpol P
    Display Product Name: 'TMDTMP156L1'
    Display Product Serial Number: ...
    Display Range Limits:
      Monitor ranges (GTF): 56-75 Hz V, 30-84 kHz H, max dotclock 170 MHz
  Extension blocks: 1
Checksum: 0x44

----------------

Block 1, CTA-861 Extension Block:
  Revision: 3
  Underscans IT Video Formats by default
  Basic audio support
  Supports YCbCr 4:4:4
  Supports YCbCr 4:2:2
  Native DTDs: 2
  Video Data Block:
    VIC  16:  1920x1080   60.000000 Hz  16:9     67.500 kHz    148.500000 MHz
    VIC   3:   720x480    59.940060 Hz  16:9     31.469 kHz     27.000000 MHz
  Video Capability Data Block:
    YCbCr quantization: Selectable (via AVI YQ)
    RGB quantization: Selectable (via AVI Q)
    PT scan behavior: Always Overscanned
    IT scan behavior: Always Overscanned
    CE scan behavior: Always Overscanned
  Colorimetry Data Block:
    BT2020YCC
    BT2020RGB
  Audio Data Block:
    Linear PCM:
      Max channels: 2
      Supported sample rates (kHz): 192 176.4 96 88.2 48 44.1 32
      Supported sample sizes (bits): 24 20 16
  Speaker Allocation Data Block:
    FL/FR - Front Left/Right
  Vendor-Specific Data Block (HDMI), OUI 00-0C-03:
    Source physical address: 1.0.0.0
    DC_30bit
    DC_Y444
    Maximum TMDS clock: 225 MHz
  HDR Static Metadata Data Block:
    Electro optical transfer functions:
      Traditional gamma - SDR luminance range
      SMPTE ST2084
    Supported static metadata descriptors:
      Static metadata type 1
    Desired content max luminance: 105 (486.099 cd/m^2)
    Desired content max frame-average luminance: 105 (486.099 cd/m^2)
    Desired content min luminance: 79 (0.467 cd/m^2)
  Detailed Timing Descriptors:
    DTD 2:  1600x900    60.000000 Hz  16:9     60.000 kHz    108.000000 MHz (344 mm x 195 mm)
                 Hfront   24 Hsync  80 Hback   96 Hpol P
                 Vfront    1 Vsync   3 Vback   96 Vpol P
    DTD 3:  1366x768    59.789541 Hz 683:384   47.712 kHz     85.500000 MHz (344 mm x 195 mm)
                 Hfront   70 Hsync 143 Hback  213 Hpol P
                 Vfront    3 Vsync   3 Vback   24 Vpol P
    DTD 4:  1280x720    60.000000 Hz  16:9     45.000 kHz     74.250000 MHz (344 mm x 195 mm)
                 Hfront  110 Hsync  40 Hback  220 Hpol P
                 Vfront    5 Vsync   5 Vback   20 Vpol P
Checksum: 0xe4  Unused space in Extension Block: 36 bytes

----------------

Warnings:

Block 0, Base EDID:
  Standard Timings: Standard Timing 1360x765 has a dubious odd vertical resolution.
  Standard Timings: Standard Timing 848x477 has a dubious odd vertical resolution.
  Standard Timings: Standard Timing 720x405 has a dubious odd vertical resolution.
Block 1, CTA-861 Extension Block:
  Video Capability Data Block: IT scan behavior is expected to support underscanned.
  Video Capability Data Block: S_PT is equal to S_IT and S_CE, so should be set to 0 instead.
  Detailed Timing Descriptor #4: DTD is identical to VIC 4, which is not present in the CTA Ext Block.
EDID:
  Base EDID: Some timings are out of range of the Monitor Ranges:
    Horizontal Freq: 25.200 - 67.500 kHz (Monitor: 30.000 - 84.000 kHz)

Failures:

Block 0, Base EDID:
  Display Product Serial Number: ...
  Basic Display Parameters & Features: Digital Video Interface Standard set to reserved value 0x22.
  Detailed Timing Descriptor #1: Mismatch of image size 345x194 mm vs display size 300x260 mm.
Block 1, CTA-861 Extension Block:
  Video Capability Data Block: IT video formats are always overscanned, but bit 7 of Byte 3 of the CTA-861 Extension header is set to underscanned.
  Detailed Timing Descriptor #2: Mismatch of image size 344x195 mm vs display size 300x260 mm.
  Detailed Timing Descriptor #3: Mismatch of image size 344x195 mm vs display size 300x260 mm.
  Detailed Timing Descriptor #4: Mismatch of image size 344x195 mm vs display size 300x260 mm.
EDID:
  Extension Block 2 started with EDID header, ignoring Extension Blocks >= 2.
  Base EDID: The DTD max image size is 345x195mm, which is larger than the display size 300.0x260.0mm.
  CTA-861: Native progressive timings are a mix of several resolutions.

EDID conformity: FAIL
