edid-decode (hex):

00 ff ff ff ff ff ff 00 52 8b 41 85 00 00 00 00
03 10 01 01 ae 29 1f 78 ea a5 d4 a6 54 4a 9c 23
14 4b 4f a1 08 00 81 80 a9 40 01 01 01 01 01 01
01 01 01 01 01 01 bc 34 40 c8 60 b0 32 40 20 40
22 00 98 32 11 00 00 1a 30 2a 00 98 51 00 2a 40
30 70 13 00 98 32 11 00 00 1e 00 00 00 fd 00 32
50 1e 73 11 00 0a 20 20 20 20 20 20 00 00 00 fc
00 43 43 4c 32 35 30 69 0a 20 20 20 20 20 00 80

00 ff ff ff ff ff ff 00 52 8b 41 85 00 00 00 00
03 10 01 01 ae 29 1f 78 ea a5 d4 a6 54 4a 9c 23
14 4b 4f a1 08 00 81 80 a9 40 01 01 01 01 01 01
01 01 01 01 01 01 bc 34 40 c8 60 b0 32 40 20 40
22 00 98 32 11 00 00 1a 30 2a 00 98 51 00 2a 40
30 70 13 00 98 32 11 00 00 1e 00 00 00 fd 00 32
50 1e 73 11 00 0a 20 20 20 20 20 20 00 00 00 fc
00 43 43 4c 32 35 30 69 0a 20 20 20 20 20 00 80

----------------

Block 0, Base EDID:
  EDID Structure Version & Revision: 1.1
  Vendor & Product Identification:
    Manufacturer: TTK
    Model: 34113
    Made in: week 3 of 2006
  Basic Display Parameters & Features:
    Digital display
    Maximum image size: 41 cm x 31 cm
    Gamma: 2.20
    DPMS levels: Standby Suspend Off
    RGB color display
    First detailed timing is the preferred timing
  Color Characteristics:
    Red  : 0.6503, 0.3300
    Green: 0.2900, 0.6103
    Blue : 0.1396, 0.0791
    White: 0.2939, 0.3085
  Established Timings I & II:
    IBM     :   720x400    70.081663 Hz   9:5     31.467 kHz     28.320000 MHz
    DMT 0x04:   640x480    59.940476 Hz   4:3     31.469 kHz     25.175000 MHz
    DMT 0x09:   800x600    60.316541 Hz   4:3     37.879 kHz     40.000000 MHz
    DMT 0x10:  1024x768    60.003840 Hz   4:3     48.363 kHz     65.000000 MHz
  Standard Timings:
    DMT 0x23:  1280x1024   60.019740 Hz   5:4     63.981 kHz    108.000000 MHz
    DMT 0x33:  1600x1200   60.000000 Hz   4:3     75.000 kHz    162.000000 MHz
  Detailed Timing Descriptors:
    DTD 1:  1600x1200   60.000000 Hz   4:3     75.000 kHz    135.000000 MHz (408 mm x 306 mm)
                 Hfront   32 Hsync  64 Hback  104 Hpol P
                 Vfront    2 Vsync   2 Vback   46 Vpol N
    DTD 2:  1280x1024   60.019740 Hz   5:4     63.981 kHz    108.000000 MHz (408 mm x 306 mm)
                 Hfront   48 Hsync 112 Hback  248 Hpol P
                 Vfront    1 Vsync   3 Vback   38 Vpol P
    Display Range Limits:
      Monitor ranges (GTF): 50-80 Hz V, 30-115 kHz H, max dotclock 170 MHz
    Display Product Name: 'CCL250i'
Checksum: 0x80

----------------

Warnings:

Block 0, Base EDID:
  EDID Structure Version & Revision: EDID 1.1 is deprecated, do not use.
  Detailed Timing Descriptor #2: Image size is 408x306 mm, but based on the picture AR it should be 382x306 mm.

Failures:

Block 0, Base EDID:
  Basic Display Parameters & Features: Digital Video Interface Standard set to reserved value 0x2e.
EDID:
  Extension Block 1 started with EDID header, ignoring Extension Blocks >= 1.

EDID conformity: FAIL
