edid-decode (hex):

00 ff ff ff ff ff ff 00 2d e1 30 00 02 00 00 00
01 17 01 03 80 73 41 78 0a cf 74 a7 55 46 98 24
10 49 4b 21 08 00 81 80 95 00 90 40 a9 c0 a9 40
b3 00 61 40 71 40 02 3a 80 18 71 38 2d 40 58 2c
45 00 c4 8e 21 00 00 1e 66 21 50 b0 51 00 1b 30
40 70 36 00 f6 1a 11 00 00 1e 00 00 00 fc 00 54
56 5f 4d 4f 4e 49 54 4f 52 0a 20 20 00 00 00 fd
00 32 4b 0e 5b 12 00 0a 20 20 20 20 20 20 01 66

02 03 2e f2 4d 01 03 84 05 07 10 12 93 14 16 1f
20 22 26 09 07 07 11 17 50 83 01 00 00 70 03 0c
00 10 00 b8 2d 20 a0 06 01 41 00 00 00 00 8c 0a
d0 8a 20 e0 2d 10 10 3e 96 00 c4 8e 21 00 00 18
02 3a 80 18 71 38 2d 40 58 2c 45 00 c4 8e 21 00
00 1e 01 1d 00 bc 52 d0 1e 20 b8 28 55 40 c4 8e
21 00 00 1e 01 1d 80 d0 72 1c 16 20 10 2c 25 80
c4 8e 21 00 00 9e 00 00 00 00 00 00 00 00 00 c1

00 ff ff ff ff ff ff 00 2d e1 30 00 02 00 00 00
01 17 01 03 80 73 41 78 0a cf 74 a7 55 46 98 24
10 49 4b 21 08 00 81 80 95 00 90 40 a9 c0 a9 40
b3 00 61 40 71 40 02 3a 80 18 71 38 2d 40 58 2c
45 00 c4 8e 21 00 00 1e 66 21 50 b0 51 00 1b 30
40 70 36 00 f6 1a 11 00 00 1e 00 00 00 fc 00 54
56 5f 4d 4f 4e 49 54 4f 52 0a 20 20 00 00 00 fd
00 32 4b 0e 5b 12 00 0a 20 20 20 20 20 20 01 66

02 03 2e f2 4d 01 03 84 05 07 10 12 93 14 16 1f
20 22 26 09 07 07 11 17 50 83 01 00 00 70 03 0c
00 10 00 b8 2d 20 a0 06 01 41 00 00 00 00 8c 0a
d0 8a 20 e0 2d 10 10 3e 96 00 c4 8e 21 00 00 18
02 3a 80 18 71 38 2d 40 58 2c 45 00 c4 8e 21 00
00 1e 01 1d 00 bc 52 d0 1e 20 b8 28 55 40 c4 8e
21 00 00 1e 01 1d 80 d0 72 1c 16 20 10 2c 25 80
c4 8e 21 00 00 9e 00 00 00 00 00 00 00 00 00 c1

----------------

Block 0, Base EDID:
  EDID Structure Version & Revision: 1.3
  Vendor & Product Identification:
    Manufacturer: KOA
    Model: 48
    Serial Number: ...
    Made in: week 1 of 2013
  Basic Display Parameters & Features:
    Digital display
    Maximum image size: 115 cm x 65 cm
    Gamma: 2.20
    RGB color display
    First detailed timing is the preferred timing
  Color Characteristics:
    Red  : 0.6552, 0.3320
    Green: 0.2763, 0.5966
    Blue : 0.1416, 0.0654
    White: 0.2861, 0.2929
  Established Timings I & II:
    DMT 0x04:   640x480    59.940476 Hz   4:3     31.469 kHz     25.175000 MHz
    DMT 0x09:   800x600    60.316541 Hz   4:3     37.879 kHz     40.000000 MHz
    DMT 0x10:  1024x768    60.003840 Hz   4:3     48.363 kHz     65.000000 MHz
  Standard Timings:
    DMT 0x23:  1280x1024   60.019740 Hz   5:4     63.981 kHz    108.000000 MHz
    DMT 0x2f:  1440x900    59.887445 Hz  16:10    55.935 kHz    106.500000 MHz
    DMT 0x2a:  1400x1050   59.978442 Hz   4:3     65.317 kHz    121.750000 MHz
    DMT 0x53:  1600x900    60.000000 Hz  16:9     60.000 kHz    108.000000 MHz (RB)
    DMT 0x33:  1600x1200   60.000000 Hz   4:3     75.000 kHz    162.000000 MHz
    DMT 0x3a:  1680x1050   59.954250 Hz  16:10    65.290 kHz    146.250000 MHz
    DMT 0x10:  1024x768    60.003840 Hz   4:3     48.363 kHz     65.000000 MHz
    GTF     :  1152x864    60.000000 Hz   4:3     53.700 kHz     81.624000 MHz
  Detailed Timing Descriptors:
    DTD 1:  1920x1080   60.000000 Hz  16:9     67.500 kHz    148.500000 MHz (708 mm x 398 mm)
                 Hfront   88 Hsync  44 Hback  148 Hpol P
                 Vfront    4 Vsync   5 Vback   36 Vpol P
    DTD 2:  1360x768    60.015162 Hz  85:48    47.712 kHz     85.500000 MHz (502 mm x 282 mm)
                 Hfront   64 Hsync 112 Hback  256 Hpol P
                 Vfront    3 Vsync   6 Vback   18 Vpol P
    Display Product Name: 'TV_MONITOR'
    Display Range Limits:
      Monitor ranges (GTF): 50-75 Hz V, 14-91 kHz H, max dotclock 180 MHz
  Extension blocks: 1
Checksum: 0x66

----------------

Block 1, CTA-861 Extension Block:
  Revision: 3
  Underscans IT Video Formats by default
  Basic audio support
  Supports YCbCr 4:4:4
  Supports YCbCr 4:2:2
  Native DTDs: 2
  Video Data Block:
    VIC   1:   640x480    59.940476 Hz   4:3     31.469 kHz     25.175000 MHz
    VIC   3:   720x480    59.940060 Hz  16:9     31.469 kHz     27.000000 MHz
    VIC   4:  1280x720    60.000000 Hz  16:9     45.000 kHz     74.250000 MHz (native)
    VIC   5:  1920x1080i  60.000000 Hz  16:9     33.750 kHz     74.250000 MHz
    VIC   7:  1440x480i   59.940060 Hz  16:9     15.734 kHz     27.000000 MHz
    VIC  16:  1920x1080   60.000000 Hz  16:9     67.500 kHz    148.500000 MHz
    VIC  18:   720x576    50.000000 Hz  16:9     31.250 kHz     27.000000 MHz
    VIC  19:  1280x720    50.000000 Hz  16:9     37.500 kHz     74.250000 MHz (native)
    VIC  20:  1920x1080i  50.000000 Hz  16:9     28.125 kHz     74.250000 MHz
    VIC  22:  1440x576i   50.000000 Hz  16:9     15.625 kHz     27.000000 MHz
    VIC  31:  1920x1080   50.000000 Hz  16:9     56.250 kHz    148.500000 MHz
    VIC  32:  1920x1080   24.000000 Hz  16:9     27.000 kHz     74.250000 MHz
    VIC  34:  1920x1080   30.000000 Hz  16:9     33.750 kHz     74.250000 MHz
  Audio Data Block:
    Linear PCM:
      Max channels: 2
      Supported sample rates (kHz): 48 44.1 32
      Supported sample sizes (bits): 24 20 16
    AC-3:
      Max channels: 2
      Supported sample rates (kHz): 96 48 44.1 32
      Maximum bit rate: 640 kb/s
  Speaker Allocation Data Block:
    FL/FR - Front Left/Right
  Vendor-Specific Data Block (HDMI), OUI 00-0C-03:
    Source physical address: 1.0.0.0
    Supports_AI
    DC_36bit
    DC_30bit
    DC_Y444
    Maximum TMDS clock: 225 MHz
    Extended HDMI video details:
      3D present
      All advertised VICs are 3D-capable
      3D: Side-by-side (half, horizontal)
      3D: Top-and-bottom
      3D: Frame-packing
      3D VIC indices with specific capabilities:
        VIC   1:   640x480    59.940476 Hz   4:3     31.469 kHz     25.175000 MHz (frame packing)
        VIC   1:   640x480    59.940476 Hz   4:3     31.469 kHz     25.175000 MHz (frame packing)
        VIC   1:   640x480    59.940476 Hz   4:3     31.469 kHz     25.175000 MHz (frame packing)
        VIC   1:   640x480    59.940476 Hz   4:3     31.469 kHz     25.175000 MHz (frame packing)
  Detailed Timing Descriptors:
    DTD 3:   720x480    59.940060 Hz   3:2     31.469 kHz     27.000000 MHz (708 mm x 398 mm)
                 Hfront   16 Hsync  62 Hback   60 Hpol N
                 Vfront    9 Vsync   6 Vback   30 Vpol N
    DTD 4:  1920x1080   60.000000 Hz  16:9     67.500 kHz    148.500000 MHz (708 mm x 398 mm)
                 Hfront   88 Hsync  44 Hback  148 Hpol P
                 Vfront    4 Vsync   5 Vback   36 Vpol P
    DTD 5:  1280x720    50.000000 Hz  16:9     37.500 kHz     74.250000 MHz (708 mm x 398 mm)
                 Hfront  440 Hsync  40 Hback  220 Hpol P
                 Vfront    5 Vsync   5 Vback   20 Vpol P
    DTD 6:  1920x1080i  50.000000 Hz  16:9     28.125 kHz     74.250000 MHz (708 mm x 398 mm)
                 Hfront  528 Hsync  44 Hback  148 Hpol P
                 Vfront    2 Vsync   5 Vback   15 Vpol P Vfront +0.5 Odd Field
                 Vfront    2 Vsync   5 Vback   15 Vpol P Vback  +0.5 Even Field
Checksum: 0xc1  Unused space in Extension Block: 9 bytes

----------------

Warnings:

Block 1, CTA-861 Extension Block:
  Video Data Block: VIC 1 and the first DTD are not identical. Is this intended?
  Video Data Block: All VICs are in ascending order, and the first (preferred) VIC <= 4, is that intended?
  Detailed Timing Descriptor #3: Image size is 708x398 mm, but based on the picture AR it should be 597x398 mm.
  Add a Colorimetry Data Block with the sRGB colorimetry bit set to avoid interop issues.
EDID:
  Base EDID: Some timings are out of range of the Monitor Ranges:
    Vertical Freq: 24.000 - 60.317 Hz (Monitor: 50.000 - 75.000 Hz)

Failures:

Block 0, Base EDID:
  Detailed Timing Descriptor #1: Mismatch of image size 708x398 mm vs display size 1150x650 mm.
  Detailed Timing Descriptor #2: Mismatch of image size 502x282 mm vs display size 1150x650 mm.
Block 1, CTA-861 Extension Block:
  Detailed Timing Descriptor #3: Mismatch of image size 708x398 mm vs display size 1150x650 mm.
  Detailed Timing Descriptor #4: Mismatch of image size 708x398 mm vs display size 1150x650 mm.
  Detailed Timing Descriptor #5: Mismatch of image size 708x398 mm vs display size 1150x650 mm.
  Detailed Timing Descriptor #6: Mismatch of image size 708x398 mm vs display size 1150x650 mm.
  Missing VCDB, needed for Set Selectable RGB Quantization to avoid interop issues.
EDID:
  Extension Block 2 started with EDID header, ignoring Extension Blocks >= 2.
  CTA-861: Native progressive timings are a mix of several resolutions.

EDID conformity: FAIL
