edid-decode (hex):

00 ff ff ff ff ff ff 00 06 af 9d 50 00 00 00 00
11 1d 01 04 a5 26 16 78 03 a3 35 a6 53 4a 9c 27
10 50 54 00 00 00 01 01 01 01 01 01 01 01 01 01
01 01 01 01 01 01 50 d0 80 50 70 38 1f 40 30 20
a5 00 7e d7 10 00 00 18 50 d0 80 50 70 38 20 4d
30 20 a5 00 7e d7 10 00 00 18 00 00 00 fe 00 41
55 4f 0a 20 20 20 20 20 20 20 20 20 00 00 00 fe
00 42 31 37 33 48 41 4e 30 35 2e 30 20 0a 00 a7

----------------

Block 0, Base EDID:
  EDID Structure Version & Revision: 1.4
  Vendor & Product Identification:
    Manufacturer: AUO
    Model: 20637
    Made in: week 17 of 2019
  Basic Display Parameters & Features:
    Digital display
    Bits per primary color channel: 8
    DisplayPort interface
    Maximum image size: 38 cm x 22 cm
    Gamma: 2.20
    Supported color formats: RGB 4:4:4
    First detailed timing includes the native pixel format and preferred refresh rate
    Display supports continuous frequencies
  Color Characteristics:
    Red  : 0.6503, 0.3261
    Green: 0.2890, 0.6123
    Blue : 0.1523, 0.0654
    White: 0.3134, 0.3291
  Established Timings I & II: none
  Standard Timings: none
  Detailed Timing Descriptors:
    DTD 1:  1920x1080  240.000000 Hz  16:9    266.640 kHz    533.280000 MHz (382 mm x 215 mm)
                 Hfront   48 Hsync  32 Hback    0 Hpol N
                 Vfront   10 Vsync   5 Vback   16 Vpol N
    DTD 2:  1920x1080   60.054054 Hz  16:9    266.640 kHz    533.280000 MHz (382 mm x 215 mm)
                 Hfront   48 Hsync  32 Hback    0 Hpol N
                 Vfront   10 Vsync   5 Vback 3345 Vpol N
    Alphanumeric Data String: 'AUO'
    Alphanumeric Data String: 'B173HAN05.0 '
Checksum: 0xa7

----------------

Warnings:

Block 0, Base EDID:
  Missing Display Product Name.

Failures:

Block 0, Base EDID:
  Detailed Timing Descriptor #1: 0 or negative horizontal back porch.
  Detailed Timing Descriptor #2: 0 or negative horizontal back porch.
  Alphanumeric Data String: One or more trailing spaces before newline.
  Missing Display Range Limits Descriptor.

EDID conformity: FAIL
