edid-decode (hex):

00 ff ff ff ff ff ff 00 04 ef 01 00 31 30 4e 43
2d 17 01 03 a0 1e 17 61 ea e4 de 9e 54 4a 97 23
1c 4c 54 00 08 00 81 80 81 40 81 00 01 01 95 00
01 01 01 01 01 01 64 19 00 40 41 00 26 30 18 88
36 00 00 c0 10 00 00 18 02 3a 80 18 71 38 2d 40
58 2c 45 00 dd 0c 11 00 00 1e 66 21 50 b0 51 00
1b 30 40 70 36 00 32 31 34 00 00 1e 00 00 00 fa
00 81 99 81 c0 81 fc 01 01 01 01 95 0f 0a 01 3c

----------------

Block 0, Base EDID:
  EDID Structure Version & Revision: 1.3
  Vendor & Product Identification:
    Manufacturer: AGO
    Model: 1
    Serial Number: ...
    Made in: week 45 of 2013
  Basic Display Parameters & Features:
    Digital display
    Maximum image size: 30 cm x 23 cm
    Gamma: 1.97
    DPMS levels: Standby Suspend Off
    RGB color display
    First detailed timing is the preferred timing
  Color Characteristics:
    Red  : 0.6201, 0.3300
    Green: 0.2900, 0.5898
    Blue : 0.1396, 0.1103
    White: 0.2998, 0.3300
  Established Timings I & II:
    DMT 0x10:  1024x768    60.003840 Hz   4:3     48.363 kHz     65.000000 MHz
  Standard Timings:
    DMT 0x23:  1280x1024   60.019740 Hz   5:4     63.981 kHz    108.000000 MHz
    DMT 0x20:  1280x960    60.000000 Hz   4:3     60.000 kHz    108.000000 MHz
    DMT 0x1c:  1280x800    59.810326 Hz  16:10    49.702 kHz     83.500000 MHz
    DMT 0x2f:  1440x900    59.887445 Hz  16:10    55.935 kHz    106.500000 MHz
  Detailed Timing Descriptors:
    DTD 1:  1024x768    60.003840 Hz   4:3     48.363 kHz     65.000000 MHz (256 mm x 192 mm)
                 Hfront   24 Hsync 136 Hback  160 Hpol N
                 Vfront    3 Vsync   6 Vback   29 Vpol N
    DTD 2:  1920x1080   60.000000 Hz  16:9     67.500 kHz    148.500000 MHz (477 mm x 268 mm)
                 Hfront   88 Hsync  44 Hback  148 Hpol P
                 Vfront    4 Vsync   5 Vback   36 Vpol P
    DTD 3:  1360x768    60.015162 Hz  85:48    47.712 kHz     85.500000 MHz (818 mm x 1073 mm)
                 Hfront   64 Hsync 112 Hback  256 Hpol P
                 Vfront    3 Vsync   6 Vback   18 Vpol P
    Standard Timing Identifications:
      DMT 0x25:  1280x1024   85.024098 Hz   5:4     91.146 kHz    157.500000 MHz
      DMT 0x55:  1280x720    60.000000 Hz  16:9     45.000 kHz     74.250000 MHz
      GTF     :  1280x720   119.999881 Hz  16:9     92.640 kHz    161.564000 MHz
      DMT 0x30:  1440x900    74.984427 Hz  16:10    70.635 kHz    136.750000 MHz
  Extension blocks: 1
Checksum: 0x3c

----------------

Warnings:

Block 0, Base EDID:
  Detailed Timing Descriptor #3: Image size is 818x1073 mm, but based on the picture AR it should be 818x461 mm.

Failures:

Block 0, Base EDID:
  Basic Display Parameters & Features: Digital Video Interface Standard set to reserved value 0x20.
  Detailed Timing Descriptor #1: Mismatch of image size 256x192 mm vs display size 300x230 mm.
  Detailed Timing Descriptor #2: Mismatch of image size 477x268 mm vs display size 300x230 mm.
  Detailed Timing Descriptor #3: Mismatch of image size 818x1073 mm vs display size 300x230 mm.
  Missing Display Product Name.
  Missing Display Range Limits Descriptor.
EDID:
  Base EDID: The DTD max image size is 818x1073mm, which is larger than the display size 300.0x230.0mm.
  Base EDID: EDID specified 1 extension block(s), but found 0 extension block(s).

EDID conformity: FAIL
