edid-decode (hex):

00 ff ff ff ff ff ff 00 11 ee 7a 00 01 01 01 01
00 21 01 03 80 50 2d 78 0a 0d c9 a0 57 47 98 27
12 48 4c 20 00 00 01 01 01 01 01 01 01 01 01 01
01 01 01 01 01 01 01 1d 80 18 71 1c 16 20 58 2c
25 00 c4 8e 21 00 00 9e 01 1d 80 d0 72 1c 16 20
10 2c 25 80 c4 8e 21 00 00 9e 00 00 00 fc 00 44
45 4e 4f 4e 2d 41 56 52 0a 20 20 20 00 00 00 fd
00 31 3d 0f 44 0f 00 0a 20 20 20 20 20 20 01 5d

02 03 2d 71 58 85 14 04 13 02 03 11 12 10 1f 20
06 07 15 16 01 0e 23 0f 24 1d 25 1e 26 23 09 07
01 83 5f 00 00 67 03 0c 00 15 00 38 2d 01 1d 00
72 51 d0 1e 20 6e 28 55 00 c4 8e 21 00 00 1e 01
1d 00 bc 52 d0 1e 20 b8 28 55 40 c4 8e 21 00 00
1e 8c 0a d0 8a 20 e0 2d 10 10 3e 96 00 c4 8e 21
00 00 18 8c 0a d0 90 20 40 31 20 0c 40 55 00 c4
8e 21 00 00 18 00 00 00 00 00 00 00 00 00 00 9b

00 ff ff ff ff ff ff 00 11 ee 7a 00 01 01 01 01
00 21 01 03 80 50 2d 78 0a 0d c9 a0 57 47 98 27
12 48 4c 20 00 00 01 01 01 01 01 01 01 01 01 01
01 01 01 01 01 01 01 1d 80 18 71 1c 16 20 58 2c
25 00 c4 8e 21 00 00 9e 01 1d 80 d0 72 1c 16 20
10 2c 25 80 c4 8e 21 00 00 9e 00 00 00 fc 00 44
45 4e 4f 4e 2d 41 56 52 0a 20 20 20 00 00 00 fd
00 31 3d 0f 44 0f 00 0a 20 20 20 20 20 20 01 5d

02 03 2d 71 58 85 14 04 13 02 03 11 12 10 1f 20
06 07 15 16 01 0e 23 0f 24 1d 25 1e 26 23 09 07
01 83 5f 00 00 67 03 0c 00 15 00 38 2d 01 1d 00
72 51 d0 1e 20 6e 28 55 00 c4 8e 21 00 00 1e 01
1d 00 bc 52 d0 1e 20 b8 28 55 40 c4 8e 21 00 00
1e 8c 0a d0 8a 20 e0 2d 10 10 3e 96 00 c4 8e 21
00 00 18 8c 0a d0 90 20 40 31 20 0c 40 55 00 c4
8e 21 00 00 18 00 00 00 00 00 00 00 00 00 00 9b

----------------

Block 0, Base EDID:
  EDID Structure Version & Revision: 1.3
  Vendor & Product Identification:
    Manufacturer: DON
    Model: 122
    Serial Number: ...
    Made in: 2023
  Basic Display Parameters & Features:
    Digital display
    Maximum image size: 80 cm x 45 cm
    Gamma: 2.20
    RGB color display
    First detailed timing is the preferred timing
  Color Characteristics:
    Red  : 0.6250, 0.3398
    Green: 0.2802, 0.5947
    Blue : 0.1552, 0.0703
    White: 0.2832, 0.2978
  Established Timings I & II:
    DMT 0x04:   640x480    59.940476 Hz   4:3     31.469 kHz     25.175000 MHz
  Standard Timings: none
  Detailed Timing Descriptors:
    DTD 1:  1920x1080i  60.000000 Hz  16:9     33.750 kHz     74.250000 MHz (708 mm x 398 mm)
                 Hfront   88 Hsync  44 Hback  148 Hpol P
                 Vfront    2 Vsync   5 Vback   15 Vpol P Vfront +0.5 Odd Field
                 Vfront    2 Vsync   5 Vback   15 Vpol P Vback  +0.5 Even Field
    DTD 2:  1920x1080i  50.000000 Hz  16:9     28.125 kHz     74.250000 MHz (708 mm x 398 mm)
                 Hfront  528 Hsync  44 Hback  148 Hpol P
                 Vfront    2 Vsync   5 Vback   15 Vpol P Vfront +0.5 Odd Field
                 Vfront    2 Vsync   5 Vback   15 Vpol P Vback  +0.5 Even Field
    Display Product Name: 'DENON-AVR'
    Display Range Limits:
      Monitor ranges (GTF): 49-61 Hz V, 15-68 kHz H, max dotclock 150 MHz
  Extension blocks: 1
Checksum: 0x5d

----------------

Block 1, CTA-861 Extension Block:
  Revision: 3
  Basic audio support
  Supports YCbCr 4:4:4
  Supports YCbCr 4:2:2
  Native DTDs: 1
  Video Data Block:
    VIC   5:  1920x1080i  60.000000 Hz  16:9     33.750 kHz     74.250000 MHz (native)
    VIC  20:  1920x1080i  50.000000 Hz  16:9     28.125 kHz     74.250000 MHz
    VIC   4:  1280x720    60.000000 Hz  16:9     45.000 kHz     74.250000 MHz
    VIC  19:  1280x720    50.000000 Hz  16:9     37.500 kHz     74.250000 MHz
    VIC   2:   720x480    59.940060 Hz   4:3     31.469 kHz     27.000000 MHz
    VIC   3:   720x480    59.940060 Hz  16:9     31.469 kHz     27.000000 MHz
    VIC  17:   720x576    50.000000 Hz   4:3     31.250 kHz     27.000000 MHz
    VIC  18:   720x576    50.000000 Hz  16:9     31.250 kHz     27.000000 MHz
    VIC  16:  1920x1080   60.000000 Hz  16:9     67.500 kHz    148.500000 MHz
    VIC  31:  1920x1080   50.000000 Hz  16:9     56.250 kHz    148.500000 MHz
    VIC  32:  1920x1080   24.000000 Hz  16:9     27.000 kHz     74.250000 MHz
    VIC   6:  1440x480i   59.940060 Hz   4:3     15.734 kHz     27.000000 MHz
    VIC   7:  1440x480i   59.940060 Hz  16:9     15.734 kHz     27.000000 MHz
    VIC  21:  1440x576i   50.000000 Hz   4:3     15.625 kHz     27.000000 MHz
    VIC  22:  1440x576i   50.000000 Hz  16:9     15.625 kHz     27.000000 MHz
    VIC   1:   640x480    59.940476 Hz   4:3     31.469 kHz     25.175000 MHz
    VIC  14:  1440x480    59.940060 Hz   4:3     31.469 kHz     54.000000 MHz
    VIC  35:  2880x480    59.940060 Hz   4:3     31.469 kHz    108.000000 MHz
    VIC  15:  1440x480    59.940060 Hz  16:9     31.469 kHz     54.000000 MHz
    VIC  36:  2880x480    59.940060 Hz  16:9     31.469 kHz    108.000000 MHz
    VIC  29:  1440x576    50.000000 Hz   4:3     31.250 kHz     54.000000 MHz
    VIC  37:  2880x576    50.000000 Hz   4:3     31.250 kHz    108.000000 MHz
    VIC  30:  1440x576    50.000000 Hz  16:9     31.250 kHz     54.000000 MHz
    VIC  38:  2880x576    50.000000 Hz  16:9     31.250 kHz    108.000000 MHz
  Audio Data Block:
    Linear PCM:
      Max channels: 2
      Supported sample rates (kHz): 48 44.1 32
      Supported sample sizes (bits): 16
  Speaker Allocation Data Block:
    FL/FR - Front Left/Right
    LFE1 - Low Frequency Effects 1
    FC - Front Center
    LS/RS - Left/Right Surround
    BC - Back Center
    BL/BR - Back Left/Right
  Vendor-Specific Data Block (HDMI), OUI 00-0C-03:
    Source physical address: 1.5.0.0
    DC_36bit
    DC_30bit
    DC_Y444
    Maximum TMDS clock: 225 MHz
  Detailed Timing Descriptors:
    DTD 3:  1280x720    60.000000 Hz  16:9     45.000 kHz     74.250000 MHz (708 mm x 398 mm)
                 Hfront  110 Hsync  40 Hback  220 Hpol P
                 Vfront    5 Vsync   5 Vback   20 Vpol P
    DTD 4:  1280x720    50.000000 Hz  16:9     37.500 kHz     74.250000 MHz (708 mm x 398 mm)
                 Hfront  440 Hsync  40 Hback  220 Hpol P
                 Vfront    5 Vsync   5 Vback   20 Vpol P
    DTD 5:   720x480    59.940060 Hz   3:2     31.469 kHz     27.000000 MHz (708 mm x 398 mm)
                 Hfront   16 Hsync  62 Hback   60 Hpol N
                 Vfront    9 Vsync   6 Vback   30 Vpol N
    DTD 6:   720x576    50.000000 Hz   5:4     31.250 kHz     27.000000 MHz (708 mm x 398 mm)
                 Hfront   12 Hsync  64 Hback   68 Hpol N
                 Vfront    5 Vsync   5 Vback   39 Vpol N
Checksum: 0x9b  Unused space in Extension Block: 10 bytes

----------------

Warnings:

Block 0, Base EDID:
  Vendor & Product Identification: The serial number is one of the known dummy values, it should probably be set to 0.
Block 1, CTA-861 Extension Block:
  IT Video Formats are overscanned by default, but normally this should be underscanned.
  Detailed Timing Descriptor #5: Image size is 708x398 mm, but based on the picture AR it should be 597x398 mm.
  Detailed Timing Descriptor #6: Image size is 708x398 mm, but based on the picture AR it should be 497x398 mm.
  Add a Colorimetry Data Block with the sRGB colorimetry bit set to avoid interop issues.
EDID:
  Base EDID: Some timings are out of range of the Monitor Ranges:
    Vertical Freq: 24.000 - 60.000 Hz (Monitor: 49.000 - 61.000 Hz)

Failures:

Block 0, Base EDID:
  Detailed Timing Descriptor #1: Mismatch of image size 708x398 mm vs display size 800x450 mm.
  Detailed Timing Descriptor #2: Mismatch of image size 708x398 mm vs display size 800x450 mm.
Block 1, CTA-861 Extension Block:
  Detailed Timing Descriptor #3: Mismatch of image size 708x398 mm vs display size 800x450 mm.
  Detailed Timing Descriptor #4: Mismatch of image size 708x398 mm vs display size 800x450 mm.
  Detailed Timing Descriptor #5: Mismatch of image size 708x398 mm vs display size 800x450 mm.
  Detailed Timing Descriptor #6: Mismatch of image size 708x398 mm vs display size 800x450 mm.
  Missing VCDB, needed for Set Selectable RGB Quantization to avoid interop issues.
EDID:
  Extension Block 2 started with EDID header, ignoring Extension Blocks >= 2.
  CTA-861: A native interlaced timing is present, but not a native progressive timing.

EDID conformity: FAIL
