edid-decode (hex):

00 ff ff ff ff ff ff 00 11 ee 7a 00 01 01 01 01
00 21 01 03 80 00 00 78 2e 42 1e a3 5b 4e 9d 2a
04 50 6b 3f cf 80 31 7c 45 7c 61 7c 81 c0 81 00
81 80 95 00 d1 c0 08 e8 00 30 f2 70 5a 80 b0 58
8a 00 00 00 00 00 00 1e 02 3a 80 18 71 38 2d 40
58 2c 45 00 c4 8e 21 00 00 1e 00 00 00 fc 00 44
45 4e 4f 4e 2d 41 56 52 0a 20 20 20 00 00 00 fd
00 17 f0 0f 87 3c 00 0a 20 20 20 20 20 20 01 69

02 03 78 f2 57 01 02 03 04 05 06 10 11 12 13 14
15 16 1f 20 21 22 3f 5d 5e 5f 60 61 35 0f 7f 07
3d 1e c0 15 07 50 5f 7e 03 57 06 03 67 7e 07 5f
7e 01 83 5f 00 00 7f 03 0c 00 12 00 b8 3c 20 c0
72 01 02 03 01 41 e6 58 06 08 00 16 18 00 26 28
00 56 58 00 76 86 67 d8 5d c4 01 78 80 0b e4 0f
00 00 60 e6 06 0f 01 8b 60 12 e3 05 c3 01 e2 00
ff e6 11 46 d0 00 70 00 00 00 00 00 00 00 00 6d

00 ff ff ff ff ff ff 00 11 ee 7a 00 01 01 01 01
00 21 01 03 80 00 00 78 2e 42 1e a3 5b 4e 9d 2a
04 50 6b 3f cf 80 31 7c 45 7c 61 7c 81 c0 81 00
81 80 95 00 d1 c0 08 e8 00 30 f2 70 5a 80 b0 58
8a 00 00 00 00 00 00 1e 02 3a 80 18 71 38 2d 40
58 2c 45 00 c4 8e 21 00 00 1e 00 00 00 fc 00 44
45 4e 4f 4e 2d 41 56 52 0a 20 20 20 00 00 00 fd
00 17 f0 0f 87 3c 00 0a 20 20 20 20 20 20 01 69

02 03 78 f2 57 01 02 03 04 05 06 10 11 12 13 14
15 16 1f 20 21 22 3f 5d 5e 5f 60 61 35 0f 7f 07
3d 1e c0 15 07 50 5f 7e 03 57 06 03 67 7e 07 5f
7e 01 83 5f 00 00 7f 03 0c 00 12 00 b8 3c 20 c0
72 01 02 03 01 41 e6 58 06 08 00 16 18 00 26 28
00 56 58 00 76 86 67 d8 5d c4 01 78 80 0b e4 0f
00 00 60 e6 06 0f 01 8b 60 12 e3 05 c3 01 e2 00
ff e6 11 46 d0 00 70 00 00 00 00 00 00 00 00 6d

----------------

Block 0, Base EDID:
  EDID Structure Version & Revision: 1.3
  Vendor & Product Identification:
    Manufacturer: DON
    Model: 122
    Serial Number: ...
    Made in: 2023
  Basic Display Parameters & Features:
    Digital display
    Image size is variable
    Gamma: 2.20
    DPMS levels: Off
    RGB color display
    Default (sRGB) color space is primary color space
    First detailed timing is the preferred timing
  Color Characteristics:
    Red  : 0.6376, 0.3554
    Green: 0.3046, 0.6152
    Blue : 0.1640, 0.0166
    White: 0.3154, 0.4199
  Established Timings I & II:
    DMT 0x04:   640x480    59.940476 Hz   4:3     31.469 kHz     25.175000 MHz
    Apple   :   640x480    66.666667 Hz   4:3     35.000 kHz     30.240000 MHz
    DMT 0x05:   640x480    72.808802 Hz   4:3     37.861 kHz     31.500000 MHz
    DMT 0x06:   640x480    75.000000 Hz   4:3     37.500 kHz     31.500000 MHz
    DMT 0x08:   800x600    56.250000 Hz   4:3     35.156 kHz     36.000000 MHz
    DMT 0x09:   800x600    60.316541 Hz   4:3     37.879 kHz     40.000000 MHz
    DMT 0x0a:   800x600    72.187572 Hz   4:3     48.077 kHz     50.000000 MHz
    DMT 0x0b:   800x600    75.000000 Hz   4:3     46.875 kHz     49.500000 MHz
    DMT 0x10:  1024x768    60.003840 Hz   4:3     48.363 kHz     65.000000 MHz
    DMT 0x11:  1024x768    70.069359 Hz   4:3     56.476 kHz     75.000000 MHz
    DMT 0x12:  1024x768    75.028582 Hz   4:3     60.023 kHz     78.750000 MHz
    DMT 0x24:  1280x1024   75.024675 Hz   5:4     79.976 kHz    135.000000 MHz
    Apple   :  1152x870    75.061550 Hz 192:145   68.681 kHz    100.000000 MHz
  Standard Timings:
    GTF     :   640x480   119.999084 Hz   4:3     61.800 kHz     52.406000 MHz
    GTF     :   800x600   119.999886 Hz   4:3     77.160 kHz     83.950000 MHz
    GTF     :  1024x768   119.999931 Hz   4:3     98.760 kHz    139.054000 MHz
    DMT 0x55:  1280x720    60.000000 Hz  16:9     45.000 kHz     74.250000 MHz
    DMT 0x1c:  1280x800    59.810326 Hz  16:10    49.702 kHz     83.500000 MHz
    DMT 0x23:  1280x1024   60.019740 Hz   5:4     63.981 kHz    108.000000 MHz
    DMT 0x2f:  1440x900    59.887445 Hz  16:10    55.935 kHz    106.500000 MHz
    DMT 0x52:  1920x1080   60.000000 Hz  16:9     67.500 kHz    148.500000 MHz
  Detailed Timing Descriptors:
    DTD 1:  3840x2160   60.000000 Hz  16:9    135.000 kHz    594.000000 MHz
                 Hfront  176 Hsync  88 Hback  296 Hpol P
                 Vfront    8 Vsync  10 Vback   72 Vpol P
    DTD 2:  1920x1080   60.000000 Hz  16:9     67.500 kHz    148.500000 MHz (708 mm x 398 mm)
                 Hfront   88 Hsync  44 Hback  148 Hpol P
                 Vfront    4 Vsync   5 Vback   36 Vpol P
    Display Product Name: 'DENON-AVR'
    Display Range Limits:
      Monitor ranges (GTF): 23-240 Hz V, 15-135 kHz H, max dotclock 600 MHz
  Extension blocks: 1
Checksum: 0x69

----------------

Block 1, CTA-861 Extension Block:
  Revision: 3
  Underscans IT Video Formats by default
  Basic audio support
  Supports YCbCr 4:4:4
  Supports YCbCr 4:2:2
  Native DTDs: 2
  Video Data Block:
    VIC   1:   640x480    59.940476 Hz   4:3     31.469 kHz     25.175000 MHz
    VIC   2:   720x480    59.940060 Hz   4:3     31.469 kHz     27.000000 MHz
    VIC   3:   720x480    59.940060 Hz  16:9     31.469 kHz     27.000000 MHz
    VIC   4:  1280x720    60.000000 Hz  16:9     45.000 kHz     74.250000 MHz
    VIC   5:  1920x1080i  60.000000 Hz  16:9     33.750 kHz     74.250000 MHz
    VIC   6:  1440x480i   59.940060 Hz   4:3     15.734 kHz     27.000000 MHz
    VIC  16:  1920x1080   60.000000 Hz  16:9     67.500 kHz    148.500000 MHz
    VIC  17:   720x576    50.000000 Hz   4:3     31.250 kHz     27.000000 MHz
    VIC  18:   720x576    50.000000 Hz  16:9     31.250 kHz     27.000000 MHz
    VIC  19:  1280x720    50.000000 Hz  16:9     37.500 kHz     74.250000 MHz
    VIC  20:  1920x1080i  50.000000 Hz  16:9     28.125 kHz     74.250000 MHz
    VIC  21:  1440x576i   50.000000 Hz   4:3     15.625 kHz     27.000000 MHz
    VIC  22:  1440x576i   50.000000 Hz  16:9     15.625 kHz     27.000000 MHz
    VIC  31:  1920x1080   50.000000 Hz  16:9     56.250 kHz    148.500000 MHz
    VIC  32:  1920x1080   24.000000 Hz  16:9     27.000 kHz     74.250000 MHz
    VIC  33:  1920x1080   25.000000 Hz  16:9     28.125 kHz     74.250000 MHz
    VIC  34:  1920x1080   30.000000 Hz  16:9     33.750 kHz     74.250000 MHz
    VIC  63:  1920x1080  120.000000 Hz  16:9    135.000 kHz    297.000000 MHz
    VIC  93:  3840x2160   24.000000 Hz  16:9     54.000 kHz    297.000000 MHz
    VIC  94:  3840x2160   25.000000 Hz  16:9     56.250 kHz    297.000000 MHz
    VIC  95:  3840x2160   30.000000 Hz  16:9     67.500 kHz    297.000000 MHz
    VIC  96:  3840x2160   50.000000 Hz  16:9    112.500 kHz    594.000000 MHz
    VIC  97:  3840x2160   60.000000 Hz  16:9    135.000 kHz    594.000000 MHz
  Audio Data Block:
    Linear PCM:
      Max channels: 8
      Supported sample rates (kHz): 192 176.4 96 88.2 48 44.1 32
      Supported sample sizes (bits): 24 20 16
    DTS:
      Max channels: 6
      Supported sample rates (kHz): 96 88.2 48 44.1
      Maximum bit rate: 1536 kb/s
    AC-3:
      Max channels: 6
      Supported sample rates (kHz): 48 44.1 32
      Maximum bit rate: 640 kb/s
    DTS-HD:
      Max channels: 8
      Supported sample rates (kHz): 192 176.4 96 88.2 48 44.1
      Supports DTS:X
      Audio Format Code dependent value: 0x03
    Enhanced AC-3 (DD+):
      Max channels: 8
      Supported sample rates (kHz): 48 44.1
      Supports Joint Object Coding
      Supports Joint Object Coding with ACMOD28
    MAT (MLP):
      Max channels: 8
      Supported sample rates (kHz): 192 176.4 96 88.2 48 44.1
      Supports Dolby TrueHD, object audio PCM and channel-based PCM
      Hash calculation not required for object audio PCM or channel-based PCM
    DTS-HD:
      Max channels: 8
      Supported sample rates (kHz): 192 176.4 96 88.2 48 44.1
      Audio Format Code dependent value: 0x01
  Speaker Allocation Data Block:
    FL/FR - Front Left/Right
    LFE1 - Low Frequency Effects 1
    FC - Front Center
    LS/RS - Left/Right Surround
    BC - Back Center
    BL/BR - Back Left/Right
  Vendor-Specific Data Block (HDMI), OUI 00-0C-03:
    Source physical address: 1.2.0.0
    Supports_AI
    DC_36bit
    DC_30bit
    DC_Y444
    Maximum TMDS clock: 300 MHz
    Extended HDMI video details:
      3D present
      3D-capable-VIC mask present
      HDMI VICs:
        HDMI VIC 1:  3840x2160   30.000000 Hz  16:9     67.500 kHz    297.000000 MHz
        HDMI VIC 2:  3840x2160   25.000000 Hz  16:9     56.250 kHz    297.000000 MHz
        HDMI VIC 3:  3840x2160   24.000000 Hz  16:9     54.000 kHz    297.000000 MHz
      3D: Side-by-side (half, horizontal)
      3D: Top-and-bottom
      3D: Frame-packing
      3D VIC indices that support these capabilities:
        VIC   4:  1280x720    60.000000 Hz  16:9     45.000 kHz     74.250000 MHz
        VIC   5:  1920x1080i  60.000000 Hz  16:9     33.750 kHz     74.250000 MHz
        VIC  16:  1920x1080   60.000000 Hz  16:9     67.500 kHz    148.500000 MHz
        VIC  19:  1280x720    50.000000 Hz  16:9     37.500 kHz     74.250000 MHz
        VIC  20:  1920x1080i  50.000000 Hz  16:9     28.125 kHz     74.250000 MHz
        VIC  31:  1920x1080   50.000000 Hz  16:9     56.250 kHz    148.500000 MHz
        VIC  32:  1920x1080   24.000000 Hz  16:9     27.000 kHz     74.250000 MHz
        VIC  33:  1920x1080   25.000000 Hz  16:9     28.125 kHz     74.250000 MHz
      3D VIC indices with specific capabilities:
        VIC   1:   640x480    59.940476 Hz   4:3     31.469 kHz     25.175000 MHz (top-and-bottom)
        VIC   1:   640x480    59.940476 Hz   4:3     31.469 kHz     25.175000 MHz (side-by-side, any subsampling)
        VIC   2:   720x480    59.940060 Hz   4:3     31.469 kHz     27.000000 MHz (top-and-bottom)
        VIC   2:   720x480    59.940060 Hz   4:3     31.469 kHz     27.000000 MHz (side-by-side, any subsampling)
        VIC   3:   720x480    59.940060 Hz  16:9     31.469 kHz     27.000000 MHz (top-and-bottom)
        VIC   3:   720x480    59.940060 Hz  16:9     31.469 kHz     27.000000 MHz (side-by-side, any subsampling)
        VIC   6:  1440x480i   59.940060 Hz   4:3     15.734 kHz     27.000000 MHz (top-and-bottom)
        VIC   6:  1440x480i   59.940060 Hz   4:3     15.734 kHz     27.000000 MHz (side-by-side, any subsampling)
        VIC  17:   720x576    50.000000 Hz   4:3     31.250 kHz     27.000000 MHz (top-and-bottom)
        VIC  18:   720x576    50.000000 Hz  16:9     31.250 kHz     27.000000 MHz (top-and-bottom)
  Vendor-Specific Data Block (HDMI Forum), OUI C4-5D-D8:
    Version: 1
    Maximum TMDS Character Rate: 600 MHz
    SCDC Present
    Supports UHD VIC
    Supports 12-bits/component Deep Color 4:2:0 Pixel Encoding
    Supports 10-bits/component Deep Color 4:2:0 Pixel Encoding
  YCbCr 4:2:0 Capability Map Data Block:
    VIC  96:  3840x2160   50.000000 Hz  16:9    112.500 kHz    594.000000 MHz
    VIC  97:  3840x2160   60.000000 Hz  16:9    135.000 kHz    594.000000 MHz
  HDR Static Metadata Data Block:
    Electro optical transfer functions:
      Traditional gamma - SDR luminance range
      Traditional gamma - HDR luminance range
      SMPTE ST2084
      Hybrid Log-Gamma
    Supported static metadata descriptors:
      Static metadata type 1
    Desired content max luminance: 139 (1015.241 cd/m^2)
    Desired content max frame-average luminance: 96 (400.000 cd/m^2)
    Desired content min luminance: 18 (0.051 cd/m^2)
  Colorimetry Data Block:
    xvYCC601
    xvYCC709
    BT2020YCC
    BT2020RGB
    Gamut Boundary Description Metadata Profile P0
  Video Capability Data Block:
    YCbCr quantization: Selectable (via AVI YQ)
    RGB quantization: Selectable (via AVI Q)
    PT scan behavior: Supports both over- and underscan
    IT scan behavior: Supports both over- and underscan
    CE scan behavior: Supports both over- and underscan
  Vendor-Specific Audio Data Block (Dolby), OUI 00-D0-46:
    Version: 1 (7 bytes)
    Height speaker zone present
    Surround speaker zone present
    Center speaker zone present
Checksum: 0x6d  Unused space in Extension Block: 7 bytes

----------------

Warnings:

Block 0, Base EDID:
  Vendor & Product Identification: The serial number is one of the known dummy values, it should probably be set to 0.
Block 1, CTA-861 Extension Block:
  Video Data Block: VIC 1 and the first DTD are not identical. Is this intended?
  Video Data Block: All VICs are in ascending order, and the first (preferred) VIC <= 4, is that intended?
  Video Capability Data Block: S_PT is equal to S_IT and S_CE, so should be set to 0 instead.

Failures:

Block 0, Base EDID:
  Basic Display Parameters & Features: sRGB is signaled, but the chromaticities do not match.
EDID:
  Extension Block 2 started with EDID header, ignoring Extension Blocks >= 2.
  Base EDID: The DTD max image size is 708x398mm, but the display size is not specified anywhere.
  CTA-861: Native progressive timings are a mix of several resolutions.

EDID conformity: FAIL
