edid-decode (hex):

00 ff ff ff ff ff ff 00 5a 63 20 eb 01 01 01 01
13 13 01 03 80 37 22 78 2e 70 25 ab 51 36 b3 24
10 50 54 bf ef 80 31 0a b3 00 a9 40 90 40 81 80
81 40 71 4f 31 59 28 3c 80 a0 70 b0 23 40 30 20
36 00 26 58 21 00 00 1a 00 00 00 ff 00 51 56 30
30 39 31 39 30 30 31 37 33 0a 00 00 00 fd 00 32
55 1f 5c 11 00 0a 20 20 20 20 20 20 00 00 00 fc
00 56 50 32 36 35 30 77 62 0a 20 20 20 20 00 be

00 ff ff ff ff ff ff 00 5a 63 20 eb 01 01 01 01
13 13 01 03 80 37 22 78 2e 70 25 ab 51 36 b3 24
10 50 54 bf ef 80 31 0a b3 00 a9 40 90 40 81 80
81 40 71 4f 31 59 28 3c 80 a0 70 b0 23 40 30 20
36 00 26 58 21 00 00 1a 00 00 00 ff 00 51 56 30
30 39 31 39 30 30 31 37 33 0a 00 00 00 fd 00 32
55 1f 5c 11 00 0a 20 20 20 20 20 20 00 00 00 fc
00 56 50 32 36 35 30 77 62 0a 20 20 20 20 00 be

----------------

Block 0, Base EDID:
  EDID Structure Version & Revision: 1.3
  Vendor & Product Identification:
    Manufacturer: VSC
    Model: 60192
    Serial Number: ...
    Made in: week 19 of 2009
  Basic Display Parameters & Features:
    Digital display
    Maximum image size: 55 cm x 34 cm
    Gamma: 2.20
    DPMS levels: Off
    RGB color display
    Default (sRGB) color space is primary color space
    First detailed timing is the preferred timing
  Color Characteristics:
    Red  : 0.6689, 0.3193
    Green: 0.2109, 0.6992
    Blue : 0.1406, 0.0644
    White: 0.3134, 0.3291
  Established Timings I & II:
    IBM     :   720x400    70.081663 Hz   9:5     31.467 kHz     28.320000 MHz
    DMT 0x04:   640x480    59.940476 Hz   4:3     31.469 kHz     25.175000 MHz
    Apple   :   640x480    66.666667 Hz   4:3     35.000 kHz     30.240000 MHz
    DMT 0x05:   640x480    72.808802 Hz   4:3     37.861 kHz     31.500000 MHz
    DMT 0x06:   640x480    75.000000 Hz   4:3     37.500 kHz     31.500000 MHz
    DMT 0x08:   800x600    56.250000 Hz   4:3     35.156 kHz     36.000000 MHz
    DMT 0x09:   800x600    60.316541 Hz   4:3     37.879 kHz     40.000000 MHz
    DMT 0x0a:   800x600    72.187572 Hz   4:3     48.077 kHz     50.000000 MHz
    DMT 0x0b:   800x600    75.000000 Hz   4:3     46.875 kHz     49.500000 MHz
    Apple   :   832x624    74.551266 Hz   4:3     49.726 kHz     57.284000 MHz
    DMT 0x10:  1024x768    60.003840 Hz   4:3     48.363 kHz     65.000000 MHz
    DMT 0x11:  1024x768    70.069359 Hz   4:3     56.476 kHz     75.000000 MHz
    DMT 0x12:  1024x768    75.028582 Hz   4:3     60.023 kHz     78.750000 MHz
    DMT 0x24:  1280x1024   75.024675 Hz   5:4     79.976 kHz    135.000000 MHz
    Apple   :  1152x870    75.061550 Hz 192:145   68.681 kHz    100.000000 MHz
  Standard Timings:
    GTF     :   640x400    70.000000 Hz  16:10    29.190 kHz     23.352000 MHz
    DMT 0x3a:  1680x1050   59.954250 Hz  16:10    65.290 kHz    146.250000 MHz
    DMT 0x33:  1600x1200   60.000000 Hz   4:3     75.000 kHz    162.000000 MHz
    DMT 0x2a:  1400x1050   59.978442 Hz   4:3     65.317 kHz    121.750000 MHz
    DMT 0x23:  1280x1024   60.019740 Hz   5:4     63.981 kHz    108.000000 MHz
    DMT 0x20:  1280x960    60.000000 Hz   4:3     60.000 kHz    108.000000 MHz
    DMT 0x15:  1152x864    75.000000 Hz   4:3     67.500 kHz    108.000000 MHz
    DMT 0x07:   640x480    85.008312 Hz   4:3     43.269 kHz     36.000000 MHz
  Detailed Timing Descriptors:
    DTD 1:  1920x1200   59.950171 Hz  16:10    74.038 kHz    154.000000 MHz (550 mm x 344 mm)
                 Hfront   48 Hsync  32 Hback   80 Hpol P
                 Vfront    3 Vsync   6 Vback   26 Vpol N
    Display Product Serial Number: ...
    Display Range Limits:
      Monitor ranges (GTF): 50-85 Hz V, 31-92 kHz H, max dotclock 170 MHz
    Display Product Name: 'VP2650wb'
Checksum: 0xbe

----------------

Warnings:

Block 0, Base EDID:
  Vendor & Product Identification: The serial number is one of the known dummy values, it should probably be set to 0.
EDID:
  Base EDID: Some timings are out of range of the Monitor Ranges:
    Horizontal Freq: 29.190 - 79.976 kHz (Monitor: 31.000 - 92.000 kHz)

Failures:

Block 0, Base EDID:
  Basic Display Parameters & Features: sRGB is signaled, but the chromaticities do not match.
EDID:
  Extension Block 1 started with EDID header, ignoring Extension Blocks >= 1.

EDID conformity: FAIL
