edid-decode (hex):

00 ff ff ff ff ff ff 00 30 af 72 02 01 00 00 00
04 16 01 03 81 3c 22 78 eb b2 90 a4 56 54 9f 27
0c 50 54 00 00 00 01 01 01 01 01 01 01 01 01 01
01 01 01 01 01 01 02 3a 80 18 71 38 2d 40 58 2c
45 00 13 2b 21 00 00 1e 00 00 00 10 00 1a 27 40
68 b0 36 00 13 2b 21 00 00 1c 00 00 00 10 00 00
1e 30 40 80 37 00 13 2b 21 00 00 1c 00 00 00 fc
00 4c 65 6e 6f 76 6f 20 41 49 4f 0a 20 20 00 30

----------------

Block 0, Base EDID:
  EDID Structure Version & Revision: 1.3
  Vendor & Product Identification:
    Manufacturer: LEO
    Model: 626
    Serial Number: ...
    Made in: week 4 of 2012
  Basic Display Parameters & Features:
    Digital display
    DFP 1.x compatible TMDS
    Maximum image size: 60 cm x 34 cm
    Gamma: 2.20
    DPMS levels: Standby Suspend Off
    RGB color display
    First detailed timing is the preferred timing
    Supports GTF timings within operating range
  Color Characteristics:
    Red  : 0.6425, 0.3388
    Green: 0.3281, 0.6230
    Blue : 0.1542, 0.0478
    White: 0.3125, 0.3281
  Established Timings I & II: none
  Standard Timings: none
  Detailed Timing Descriptors:
    DTD 1:  1920x1080   60.000000 Hz  16:9     67.500 kHz    148.500000 MHz (531 mm x 299 mm)
                 Hfront   88 Hsync  44 Hback  148 Hpol P
                 Vfront    4 Vsync   5 Vback   36 Vpol P
    Dummy Descriptor:
    Dummy Descriptor:
    Display Product Name: 'Lenovo AIO'
Checksum: 0x30

----------------

Warnings:

Block 0, Base EDID:
  Vendor & Product Identification: The serial number is one of the known dummy values, it should probably be set to 0.

Failures:

Block 0, Base EDID:
  Detailed Timing Descriptor #1: Mismatch of image size 531x299 mm vs display size 600x340 mm.
  Dummy Descriptor: Dummy block filled with garbage.
  Dummy Descriptor: Dummy block filled with garbage.
  Missing Display Range Limits Descriptor.

EDID conformity: FAIL
