edid-decode (hex):

00 ff ff ff ff ff ff 00 09 e5 5f 0a 00 00 00 00
01 1f 01 04 a5 22 16 78 03 c0 95 95 5d 5a 95 2a
1f 50 54 00 00 00 01 01 01 01 01 01 01 01 01 01
01 01 01 01 01 01 f8 40 80 18 71 b0 3c 40 30 20
36 00 59 d7 10 00 00 18 00 00 00 fd 00 28 3c 4c
4c 11 01 0a 20 20 20 20 20 20 00 00 00 fe 00 42
4f 45 20 43 51 0a 20 20 20 20 20 20 00 00 00 fe
00 4e 56 31 36 30 57 55 4d 2d 4b 30 30 0a 00 79

00 ff ff ff ff ff ff 00 09 e5 5f 0a 00 00 00 00
01 1f 01 04 a5 22 16 78 03 c0 95 95 5d 5a 95 2a
1f 50 54 00 00 00 01 01 01 01 01 01 01 01 01 01
01 01 01 01 01 01 f8 40 80 18 71 b0 3c 40 30 20
36 00 59 d7 10 00 00 18 00 00 00 fd 00 28 3c 4c
4c 11 01 0a 20 20 20 20 20 20 00 00 00 fe 00 42
4f 45 20 43 51 0a 20 20 20 20 20 20 00 00 00 fe
00 4e 56 31 36 30 57 55 4d 2d 4b 30 30 0a 00 79

----------------

Block 0, Base EDID:
  EDID Structure Version & Revision: 1.4
  Vendor & Product Identification:
    Manufacturer: BOE
    Model: 2655
    Made in: week 1 of 2021
  Basic Display Parameters & Features:
    Digital display
    Bits per primary color channel: 8
    DisplayPort interface
    Maximum image size: 34 cm x 22 cm
    Gamma: 2.20
    Supported color formats: RGB 4:4:4
    First detailed timing includes the native pixel format and preferred refresh rate
    Display supports continuous frequencies
  Color Characteristics:
    Red  : 0.5849, 0.3632
    Green: 0.3515, 0.5820
    Blue : 0.1660, 0.1220
    White: 0.3134, 0.3291
  Established Timings I & II: none
  Standard Timings: none
  Detailed Timing Descriptors:
    DTD 1:  1920x1200   60.000000 Hz  16:10    75.600 kHz    166.320000 MHz (345 mm x 215 mm)
                 Hfront   48 Hsync  32 Hback  200 Hpol N
                 Vfront    3 Vsync   6 Vback   51 Vpol N
    Display Range Limits:
      Monitor ranges (Range Limits Only): 40-60 Hz V, 76-76 kHz H, max dotclock 170 MHz
    Alphanumeric Data String: 'BOE CQ'
    Alphanumeric Data String: 'NV160WUM-K00'
Checksum: 0x79

----------------

Block 1, Unknown EDID Extension Block 0x00:
  00 ff ff ff ff ff ff 00 09 e5 5f 0a 00 00 00 00 '.........._.....'
  01 1f 01 04 a5 22 16 78 03 c0 95 95 5d 5a 95 2a '.....".x....]Z.*'
  1f 50 54 00 00 00 01 01 01 01 01 01 01 01 01 01 '.PT.............'
  01 01 01 01 01 01 f8 40 80 18 71 b0 3c 40 30 20 '.......@..q.<@0 '
  36 00 59 d7 10 00 00 18 00 00 00 fd 00 28 3c 4c '6.Y..........(<L'
  4c 11 01 0a 20 20 20 20 20 20 00 00 00 fe 00 42 'L...      .....B'
  4f 45 20 43 51 0a 20 20 20 20 20 20 00 00 00 fe 'OE CQ.      ....'
  00 4e 56 31 36 30 57 55 4d 2d 4b 30 30 0a 00 79 '.NV160WUM-K00..y'
Checksum: 0x79

----------------

Warnings:

Block 0, Base EDID:
  Missing Display Product Name.

Failures:

Block 1, Base EDID:
  Unknown Extension Block.
EDID:
  Base EDID: EDID specified 0 extension block(s), but found 1 extension block(s).

EDID conformity: FAIL
