edid-decode (hex):

00 ff ff ff ff ff ff 00 2c 82 18 08 00 00 00 00
21 21 01 04 a5 1e 13 78 02 56 45 93 5e 5b 93 25
18 50 54 00 00 00 01 01 01 01 01 01 01 01 01 01
01 01 01 01 01 01 0f 3c 80 a0 70 b0 20 40 18 30
3c 00 2e bd 10 00 00 18 0c 30 80 a0 70 b0 20 40
18 30 3c 00 2e bd 10 00 00 18 00 00 00 00 00 00
00 00 00 00 00 00 00 00 00 00 00 00 00 00 00 fe
00 4b 44 31 34 30 4e 32 35 33 30 41 30 34 00 62

00 ff ff ff ff ff ff 00 2c 82 18 08 00 00 00 00
21 21 01 04 a5 1e 13 78 02 56 45 93 5e 5b 93 25
18 50 54 00 00 00 01 01 01 01 01 01 01 01 01 01
01 01 01 01 01 01 0f 3c 80 a0 70 b0 20 40 18 30
3c 00 2e bd 10 00 00 18 0c 30 80 a0 70 b0 20 40
18 30 3c 00 2e bd 10 00 00 18 00 00 00 00 00 00
00 00 00 00 00 00 00 00 00 00 00 00 00 00 00 fe
00 4b 44 31 34 30 4e 32 35 33 30 41 30 34 00 62

----------------

Block 0, Base EDID:
  EDID Structure Version & Revision: 1.4
  Vendor & Product Identification:
    Manufacturer: KDB
    Model: 2072
    Made in: week 33 of 2023
  Basic Display Parameters & Features:
    Digital display
    Bits per primary color channel: 8
    DisplayPort interface
    Maximum image size: 30 cm x 19 cm
    Gamma: 2.20
    Supported color formats: RGB 4:4:4
    First detailed timing includes the native pixel format and preferred refresh rate
  Color Characteristics:
    Red  : 0.5751, 0.3681
    Green: 0.3564, 0.5761
    Blue : 0.1455, 0.0937
    White: 0.3134, 0.3291
  Established Timings I & II: none
  Standard Timings: none
  Detailed Timing Descriptors:
    DTD 1:  1920x1200   59.998595 Hz  16:10    73.918 kHz    153.750000 MHz (302 mm x 189 mm)
                 Hfront   24 Hsync  48 Hback   88 Hpol N
                 Vfront    3 Vsync  12 Vback   17 Vpol N
    DTD 2:  1920x1200   47.998876 Hz  16:10    59.135 kHz    123.000000 MHz (302 mm x 189 mm)
                 Hfront   24 Hsync  48 Hback   88 Hpol N
                 Vfront    3 Vsync  12 Vback   17 Vpol N
    Empty Descriptor
    Alphanumeric Data String: 'KD140N2530A04'
Checksum: 0x62

----------------

Warnings:

Block 0, Base EDID:
  Missing Display Product Name.

Failures:

Block 0, Base EDID:
  Empty Descriptor: Use Dummy Descriptor instead of all zeroes.
EDID:
  Extension Block 1 started with EDID header, ignoring Extension Blocks >= 1.

EDID conformity: FAIL
