edid-decode (hex):

00 ff ff ff ff ff ff 00 59 3a 00 13 01 01 01 01
0b 10 01 03 3f 52 2e 78 ea d9 70 a3 57 49 9c 25
11 49 4b 0f ca 00 01 01 01 01 01 01 01 01 01 01
01 01 01 01 01 01 00 00 00 fd 00 32 55 1f 46 0b
01 00 bc 90 21 00 00 1a 66 21 56 b0 51 00 1b 30
80 82 26 00 34 cc 31 00 00 1a 00 00 00 ff 00 48
4c 47 41 42 41 47 31 31 30 30 32 34 00 00 00 fc
00 56 49 5a 49 4f 20 4c 33 37 20 48 44 0a 00 03

----------------

Block 0, Base EDID:
  EDID Structure Version & Revision: 1.3
  Vendor & Product Identification:
    Manufacturer: VIZ
    Model: 4864
    Serial Number: ...
    Made in: week 11 of 2006
  Basic Display Parameters & Features:
    Analog display
    Signal Level Standard: 0.714 : 0.286 : 1.000 V p-p
    Blank-to-black setup/pedestal
    Sync: Separate Composite SyncOnGreen Serration
    Maximum image size: 82 cm x 46 cm
    Gamma: 2.20
    DPMS levels: Standby Suspend Off
    RGB color display
    First detailed timing is the preferred timing
  Color Characteristics:
    Red  : 0.6396, 0.3408
    Green: 0.2871, 0.6103
    Blue : 0.1455, 0.0693
    White: 0.2851, 0.2929
  Established Timings I & II:
    DMT 0x05:   640x480    72.808802 Hz   4:3     37.861 kHz     31.500000 MHz
    DMT 0x06:   640x480    75.000000 Hz   4:3     37.500 kHz     31.500000 MHz
    DMT 0x08:   800x600    56.250000 Hz   4:3     35.156 kHz     36.000000 MHz
    DMT 0x09:   800x600    60.316541 Hz   4:3     37.879 kHz     40.000000 MHz
    DMT 0x0a:   800x600    72.187572 Hz   4:3     48.077 kHz     50.000000 MHz
    DMT 0x0b:   800x600    75.000000 Hz   4:3     46.875 kHz     49.500000 MHz
    DMT 0x10:  1024x768    60.003840 Hz   4:3     48.363 kHz     65.000000 MHz
    DMT 0x12:  1024x768    75.028582 Hz   4:3     60.023 kHz     78.750000 MHz
  Standard Timings: none
  Detailed Timing Descriptors:
    Display Range Limits:
      Monitor ranges (Range Limits Only): 50-85 Hz V, 31-70 kHz H, max dotclock 110 MHz
    DTD 1:  1366x768    59.814889 Hz 683:384   47.553 kHz     85.500000 MHz (820 mm x 460 mm)
                 Hfront  128 Hsync 130 Hback  174 Hpol P
                 Vfront    2 Vsync   6 Vback   19 Vpol N
    Display Product Serial Number: ...
    Display Product Name: 'VIZIO L37 HD'
Checksum: 0x03

----------------

Warnings:

Block 0, Base EDID:
  Vendor & Product Identification: The serial number is one of the known dummy values, it should probably be set to 0.

Failures:

Block 0, Base EDID:
  Standard Timings: Missing preferred timing.
  Display Range Limits: 'Range Limits Only' is not allowed for EDID < 1.4.
  Display Range Limits: Byte 11 is 0x00 instead of 0x0a.
  Display Range Limits: Bytes 12-17 must be 0x20.
  Detailed Timing Descriptor #1: Invalid detailed timing descriptor ordering.

EDID conformity: FAIL
