edid-decode (hex):

00 ff ff ff ff ff ff 00 4c 2d 13 0f 00 0e 00 01
01 1c 01 03 80 6f 3e 78 0a 23 ad a4 54 4d 99 26
0f 47 4a bd cf 00 71 4f 81 c0 81 00 81 80 95 00
a9 c0 b3 00 01 01 02 3a 80 18 71 38 2d 40 58 2c
45 00 0f 28 21 00 00 1e 3a 7f 80 88 70 38 14 40
18 20 35 00 0f 28 21 00 00 1e 00 00 00 fc 00 41
53 55 53 20 56 47 32 34 39 0a 20 20 00 00 00 fd
00 30 90 1e b4 22 00 0a 20 20 20 20 20 20 01 33

02 03 1b f1 46 90 1f 04 13 03 12 23 09 07 07 83
01 00 00 67 03 0c 00 10 00 00 3c 02 3a 80 18 71
38 2d 40 58 2c 45 00 10 09 00 00 00 1e 02 3a 80
d0 72 38 2d 40 10 2c 45 80 10 09 00 00 00 1e 01
1d 00 72 51 d0 1e 20 6e 28 55 00 10 09 00 00 00
1e 01 1d 00 bc 52 d0 1e 20 b8 28 55 40 10 09 00
00 00 1e 8c 0a d0 8a 20 e0 2d 10 10 3e 96 00 10
09 00 00 00 18 00 00 00 00 00 00 00 00 00 00 50

00 ff ff ff ff ff ff 00 4c 2d 13 0f 00 0e 00 01
01 1c 01 03 80 6f 3e 78 0a 23 ad a4 54 4d 99 26
0f 47 4a bd cf 00 71 4f 81 c0 81 00 81 80 95 00
a9 c0 b3 00 01 01 02 3a 80 18 71 38 2d 40 58 2c
45 00 0f 28 21 00 00 1e 3a 7f 80 88 70 38 14 40
18 20 35 00 0f 28 21 00 00 1e 00 00 00 fc 00 41
53 55 53 20 56 47 32 34 39 0a 20 20 00 00 00 fd
00 30 90 1e b4 22 00 0a 20 20 20 20 20 20 01 33

02 03 1b f1 46 90 1f 04 13 03 12 23 09 07 07 83
01 00 00 67 03 0c 00 10 00 00 3c 02 3a 80 18 71
38 2d 40 58 2c 45 00 10 09 00 00 00 1e 02 3a 80
d0 72 38 2d 40 10 2c 45 80 10 09 00 00 00 1e 01
1d 00 72 51 d0 1e 20 6e 28 55 00 10 09 00 00 00
1e 01 1d 00 bc 52 d0 1e 20 b8 28 55 40 10 09 00
00 00 1e 8c 0a d0 8a 20 e0 2d 10 10 3e 96 00 10
09 00 00 00 18 00 00 00 00 00 00 00 00 00 00 50

----------------

Block 0, Base EDID:
  EDID Structure Version & Revision: 1.3
  Vendor & Product Identification:
    Manufacturer: SAM
    Model: 3859
    Serial Number: ...
    Made in: week 1 of 2018
  Basic Display Parameters & Features:
    Digital display
    Maximum image size: 111 cm x 62 cm
    Gamma: 2.20
    RGB color display
    First detailed timing is the preferred timing
  Color Characteristics:
    Red  : 0.6406, 0.3300
    Green: 0.3007, 0.6005
    Blue : 0.1503, 0.0605
    White: 0.2802, 0.2900
  Established Timings I & II:
    IBM     :   720x400    70.081663 Hz   9:5     31.467 kHz     28.320000 MHz
    DMT 0x04:   640x480    59.940476 Hz   4:3     31.469 kHz     25.175000 MHz
    Apple   :   640x480    66.666667 Hz   4:3     35.000 kHz     30.240000 MHz
    DMT 0x05:   640x480    72.808802 Hz   4:3     37.861 kHz     31.500000 MHz
    DMT 0x06:   640x480    75.000000 Hz   4:3     37.500 kHz     31.500000 MHz
    DMT 0x09:   800x600    60.316541 Hz   4:3     37.879 kHz     40.000000 MHz
    DMT 0x0a:   800x600    72.187572 Hz   4:3     48.077 kHz     50.000000 MHz
    DMT 0x0b:   800x600    75.000000 Hz   4:3     46.875 kHz     49.500000 MHz
    DMT 0x10:  1024x768    60.003840 Hz   4:3     48.363 kHz     65.000000 MHz
    DMT 0x11:  1024x768    70.069359 Hz   4:3     56.476 kHz     75.000000 MHz
    DMT 0x12:  1024x768    75.028582 Hz   4:3     60.023 kHz     78.750000 MHz
    DMT 0x24:  1280x1024   75.024675 Hz   5:4     79.976 kHz    135.000000 MHz
  Standard Timings:
    DMT 0x15:  1152x864    75.000000 Hz   4:3     67.500 kHz    108.000000 MHz
    DMT 0x55:  1280x720    60.000000 Hz  16:9     45.000 kHz     74.250000 MHz
    DMT 0x1c:  1280x800    59.810326 Hz  16:10    49.702 kHz     83.500000 MHz
    DMT 0x23:  1280x1024   60.019740 Hz   5:4     63.981 kHz    108.000000 MHz
    DMT 0x2f:  1440x900    59.887445 Hz  16:10    55.935 kHz    106.500000 MHz
    DMT 0x53:  1600x900    60.000000 Hz  16:9     60.000 kHz    108.000000 MHz (RB)
    DMT 0x3a:  1680x1050   59.954250 Hz  16:10    65.290 kHz    146.250000 MHz
  Detailed Timing Descriptors:
    DTD  1:  1920x1080   60.000000 Hz  16:9     67.500 kHz    148.500000 MHz (527 mm x 296 mm)
                  Hfront   88 Hsync  44 Hback  148 Hpol P
                  Vfront    4 Vsync   5 Vback   36 Vpol P
    DTD  2:  1920x1080  144.013088 Hz  16:9    158.414 kHz    325.700000 MHz (527 mm x 296 mm)
                  Hfront   24 Hsync  32 Hback   80 Hpol P
                  Vfront    3 Vsync   5 Vback   12 Vpol P
    Display Product Name: 'ASUS VG249'
    Display Range Limits:
      Monitor ranges (GTF): 48-144 Hz V, 30-180 kHz H, max dotclock 340 MHz
  Extension blocks: 1
Checksum: 0x33

----------------

Block 1, CTA-861 Extension Block:
  Revision: 3
  Underscans IT Video Formats by default
  Basic audio support
  Supports YCbCr 4:4:4
  Supports YCbCr 4:2:2
  Native detailed modes: 1
  Video Data Block:
    VIC  16:  1920x1080   60.000000 Hz  16:9     67.500 kHz    148.500000 MHz (native)
    VIC  31:  1920x1080   50.000000 Hz  16:9     56.250 kHz    148.500000 MHz
    VIC   4:  1280x720    60.000000 Hz  16:9     45.000 kHz     74.250000 MHz
    VIC  19:  1280x720    50.000000 Hz  16:9     37.500 kHz     74.250000 MHz
    VIC   3:   720x480    59.940060 Hz  16:9     31.469 kHz     27.000000 MHz
    VIC  18:   720x576    50.000000 Hz  16:9     31.250 kHz     27.000000 MHz
  Audio Data Block:
    Linear PCM:
      Max channels: 2
      Supported sample rates (kHz): 48 44.1 32
      Supported sample sizes (bits): 24 20 16
  Speaker Allocation Data Block:
    FL/FR - Front Left/Right
  Vendor-Specific Data Block (HDMI), OUI 00-0C-03:
    Source physical address: 1.0.0.0
    Maximum TMDS clock: 300 MHz
  Detailed Timing Descriptors:
    DTD  3:  1920x1080   60.000000 Hz  16:9     67.500 kHz    148.500000 MHz (16 mm x 9 mm)
                  Hfront   88 Hsync  44 Hback  148 Hpol P
                  Vfront    4 Vsync   5 Vback   36 Vpol P
    DTD  4:  1920x1080   50.000000 Hz  16:9     56.250 kHz    148.500000 MHz (16 mm x 9 mm)
                  Hfront  528 Hsync  44 Hback  148 Hpol P
                  Vfront    4 Vsync   5 Vback   36 Vpol P
    DTD  5:  1280x720    60.000000 Hz  16:9     45.000 kHz     74.250000 MHz (16 mm x 9 mm)
                  Hfront  110 Hsync  40 Hback  220 Hpol P
                  Vfront    5 Vsync   5 Vback   20 Vpol P
    DTD  6:  1280x720    50.000000 Hz  16:9     37.500 kHz     74.250000 MHz (16 mm x 9 mm)
                  Hfront  440 Hsync  40 Hback  220 Hpol P
                  Vfront    5 Vsync   5 Vback   20 Vpol P
    DTD  7:   720x480    59.940060 Hz   3:2     31.469 kHz     27.000000 MHz (16 mm x 9 mm)
                  Hfront   16 Hsync  62 Hback   60 Hpol N
                  Vfront    9 Vsync   6 Vback   30 Vpol N
Checksum: 0x50  Unused space in Extension Block: 10 bytes

----------------

Block 2, Unknown EDID Extension Block 0x00:
  00 ff ff ff ff ff ff 00 4c 2d 13 0f 00 0e 00 01 '........L-......'
  01 1c 01 03 80 6f 3e 78 0a 23 ad a4 54 4d 99 26 '.....o>x.#..TM.&'
  0f 47 4a bd cf 00 71 4f 81 c0 81 00 81 80 95 00 '.GJ...qO........'
  a9 c0 b3 00 01 01 02 3a 80 18 71 38 2d 40 58 2c '.......:..q8-@X,'
  45 00 0f 28 21 00 00 1e 3a 7f 80 88 70 38 14 40 'E..(!...:...p8.@'
  18 20 35 00 0f 28 21 00 00 1e 00 00 00 fc 00 41 '. 5..(!........A'
  53 55 53 20 56 47 32 34 39 0a 20 20 00 00 00 fd 'SUS VG249.  ....'
  00 30 90 1e b4 22 00 0a 20 20 20 20 20 20 01 33 '.0..."..      .3'
Checksum: 0x33

----------------

Block 3, CTA-861 Extension Block:
  Revision: 3
  Underscans IT Video Formats by default
  Basic audio support
  Supports YCbCr 4:4:4
  Supports YCbCr 4:2:2
  Native detailed modes: 1
  Video Data Block:
    VIC  16:  1920x1080   60.000000 Hz  16:9     67.500 kHz    148.500000 MHz (native)
    VIC  31:  1920x1080   50.000000 Hz  16:9     56.250 kHz    148.500000 MHz
    VIC   4:  1280x720    60.000000 Hz  16:9     45.000 kHz     74.250000 MHz
    VIC  19:  1280x720    50.000000 Hz  16:9     37.500 kHz     74.250000 MHz
    VIC   3:   720x480    59.940060 Hz  16:9     31.469 kHz     27.000000 MHz
    VIC  18:   720x576    50.000000 Hz  16:9     31.250 kHz     27.000000 MHz
  Audio Data Block:
    Linear PCM:
      Max channels: 2
      Supported sample rates (kHz): 48 44.1 32
      Supported sample sizes (bits): 24 20 16
  Speaker Allocation Data Block:
    FL/FR - Front Left/Right
  Vendor-Specific Data Block (HDMI), OUI 00-0C-03:
    Source physical address: 1.0.0.0
    Maximum TMDS clock: 300 MHz
  Detailed Timing Descriptors:
    DTD  8:  1920x1080   60.000000 Hz  16:9     67.500 kHz    148.500000 MHz (16 mm x 9 mm)
                  Hfront   88 Hsync  44 Hback  148 Hpol P
                  Vfront    4 Vsync   5 Vback   36 Vpol P
    DTD  9:  1920x1080   50.000000 Hz  16:9     56.250 kHz    148.500000 MHz (16 mm x 9 mm)
                  Hfront  528 Hsync  44 Hback  148 Hpol P
                  Vfront    4 Vsync   5 Vback   36 Vpol P
    DTD 10:  1280x720    60.000000 Hz  16:9     45.000 kHz     74.250000 MHz (16 mm x 9 mm)
                  Hfront  110 Hsync  40 Hback  220 Hpol P
                  Vfront    5 Vsync   5 Vback   20 Vpol P
    DTD 11:  1280x720    50.000000 Hz  16:9     37.500 kHz     74.250000 MHz (16 mm x 9 mm)
                  Hfront  440 Hsync  40 Hback  220 Hpol P
                  Vfront    5 Vsync   5 Vback   20 Vpol P
    DTD 12:   720x480    59.940060 Hz   3:2     31.469 kHz     27.000000 MHz (16 mm x 9 mm)
                  Hfront   16 Hsync  62 Hback   60 Hpol N
                  Vfront    9 Vsync   6 Vback   30 Vpol N
Checksum: 0x50  Unused space in Extension Block: 10 bytes

----------------

Warnings:

Block 1, CTA-861 Extension Block:
  Detailed Timing Descriptor #3: Dubious image size (16x9 mm is smaller than 100x100 mm).
  Detailed Timing Descriptor #4: Dubious image size (16x9 mm is smaller than 100x100 mm).
  Detailed Timing Descriptor #5: Dubious image size (16x9 mm is smaller than 100x100 mm).
  Detailed Timing Descriptor #6: Dubious image size (16x9 mm is smaller than 100x100 mm).
  Detailed Timing Descriptor #7: Dubious image size (16x9 mm is smaller than 100x100 mm).
  Add a Colorimetry Data Block with the sRGB colorimetry bit set to avoid interop issues.
Block 3, CTA-861 Extension Block:
  Detailed Timing Descriptor #8: Dubious image size (16x9 mm is smaller than 100x100 mm).
  Detailed Timing Descriptor #9: Dubious image size (16x9 mm is smaller than 100x100 mm).
  Detailed Timing Descriptor #10: Dubious image size (16x9 mm is smaller than 100x100 mm).
  Detailed Timing Descriptor #11: Dubious image size (16x9 mm is smaller than 100x100 mm).
  Detailed Timing Descriptor #12: Dubious image size (16x9 mm is smaller than 100x100 mm).
EDID:
  CTA-861: Multiple native progressive timings are defined.

Failures:

Block 0, Base EDID:
  Detailed Timing Descriptor #1: Mismatch of image size 527x296 mm vs display size 1110x620 mm.
  Detailed Timing Descriptor #2: Mismatch of image size 527x296 mm vs display size 1110x620 mm.
Block 1, CTA-861 Extension Block:
  Detailed Timing Descriptor #3: Mismatch of image size 16x9 mm vs display size 1110x620 mm.
  Detailed Timing Descriptor #4: Mismatch of image size 16x9 mm vs display size 1110x620 mm.
  Detailed Timing Descriptor #5: Mismatch of image size 16x9 mm vs display size 1110x620 mm.
  Detailed Timing Descriptor #6: Mismatch of image size 16x9 mm vs display size 1110x620 mm.
  Detailed Timing Descriptor #7: Mismatch of image size 16x9 mm vs display size 1110x620 mm.
  Missing VCDB, needed for Set Selectable RGB Quantization to avoid interop issues.
Block 2, Base EDID:
  Unknown Extension Block.
Block 3, CTA-861 Extension Block:
  Video Data Block: Duplicate VIC 16.
  Video Data Block: Duplicate VIC 31.
  Video Data Block: Duplicate VIC 4.
  Video Data Block: Duplicate VIC 19.
  Video Data Block: Duplicate VIC 3.
  Video Data Block: Duplicate VIC 18.
  Speaker Allocation Data Block: Only one instance of this Data Block is allowed.
  Detailed Timing Descriptor #8: Mismatch of image size 16x9 mm vs display size 1110x620 mm.
  Detailed Timing Descriptor #9: Mismatch of image size 16x9 mm vs display size 1110x620 mm.
  Detailed Timing Descriptor #10: Mismatch of image size 16x9 mm vs display size 1110x620 mm.
  Detailed Timing Descriptor #11: Mismatch of image size 16x9 mm vs display size 1110x620 mm.
  Detailed Timing Descriptor #12: Mismatch of image size 16x9 mm vs display size 1110x620 mm.
EDID:
  Base EDID: EDID specified 1 extension block(s), but found 3 extension block(s).
  Base EDID: EDID 1.3 requires a Block Map Extension in Block 1 if there are more than 2 blocks in the EDID.
  CTA-861: The maximum HDMI TMDS clock is 300000 kHz, but one or more video timings go up to 325700 kHz.

EDID conformity: FAIL
