edid-decode (hex):

00 ff ff ff ff ff ff 00 1e 6d 5e 76 01 01 01 01
04 13 01 03 80 46 27 78 ea d9 b0 a3 57 49 9c 25
11 49 4b a1 08 00 31 40 45 40 61 40 81 80 90 40
d1 c0 01 01 01 01 1a 36 80 a0 70 38 1f 40 30 20
35 00 e8 26 32 00 00 1a 1b 21 50 a0 51 00 1e 30
48 88 35 00 bc 86 21 00 00 1c 00 00 00 fd 00 39
4b 1f 54 12 00 0a 20 20 20 20 20 20 00 00 00 fc
00 33 32 4c 47 37 30 30 30 0a 20 20 20 20 01 a6

02 03 21 f1 4e 81 02 03 15 12 13 04 14 05 20 21
22 1f 10 23 09 57 07 83 01 00 00 67 03 0c 00 40
00 b8 2d 01 1d 00 80 51 d0 1c 20 40 80 35 00 bc
88 21 00 00 1e 8c 0a d0 8a 20 e0 2d 10 10 3e 96
00 13 8e 21 00 00 18 02 3a 80 18 71 38 2d 40 58
2c 45 00 06 44 21 00 00 1e 01 1d 80 18 71 1c 16
20 58 2c 25 00 c4 8e 21 00 00 9e 4e 1f 00 80 51
00 1e 30 40 80 37 00 bc 88 21 00 00 18 00 00 b6

00 ff ff ff ff ff ff 00 1e 6d 5e 76 01 01 01 01
04 13 01 03 80 46 27 78 ea d9 b0 a3 57 49 9c 25
11 49 4b a1 08 00 31 40 45 40 61 40 81 80 90 40
d1 c0 01 01 01 01 1a 36 80 a0 70 38 1f 40 30 20
35 00 e8 26 32 00 00 1a 1b 21 50 a0 51 00 1e 30
48 88 35 00 bc 86 21 00 00 1c 00 00 00 fd 00 39
4b 1f 54 12 00 0a 20 20 20 20 20 20 00 00 00 fc
00 33 32 4c 47 37 30 30 30 0a 20 20 20 20 01 a6

02 03 21 f1 4e 81 02 03 15 12 13 04 14 05 20 21
22 1f 10 23 09 57 07 83 01 00 00 67 03 0c 00 40
00 b8 2d 01 1d 00 80 51 d0 1c 20 40 80 35 00 bc
88 21 00 00 1e 8c 0a d0 8a 20 e0 2d 10 10 3e 96
00 13 8e 21 00 00 18 02 3a 80 18 71 38 2d 40 58
2c 45 00 06 44 21 00 00 1e 01 1d 80 18 71 1c 16
20 58 2c 25 00 c4 8e 21 00 00 9e 4e 1f 00 80 51
00 1e 30 40 80 37 00 bc 88 21 00 00 18 00 00 b6

----------------

Block 0, Base EDID:
  EDID Structure Version & Revision: 1.3
  Vendor & Product Identification:
    Manufacturer: GSM
    Model: 30302
    Serial Number: ...
    Made in: week 4 of 2009
  Basic Display Parameters & Features:
    Digital display
    Maximum image size: 70 cm x 39 cm
    Gamma: 2.20
    DPMS levels: Standby Suspend Off
    RGB color display
    First detailed timing is the preferred timing
  Color Characteristics:
    Red  : 0.6396, 0.3408
    Green: 0.2871, 0.6103
    Blue : 0.1464, 0.0693
    White: 0.2851, 0.2929
  Established Timings I & II:
    IBM     :   720x400    70.081663 Hz   9:5     31.467 kHz     28.320000 MHz
    DMT 0x04:   640x480    59.940476 Hz   4:3     31.469 kHz     25.175000 MHz
    DMT 0x09:   800x600    60.316541 Hz   4:3     37.879 kHz     40.000000 MHz
    DMT 0x10:  1024x768    60.003840 Hz   4:3     48.363 kHz     65.000000 MHz
  Standard Timings:
    DMT 0x04:   640x480    59.940476 Hz   4:3     31.469 kHz     25.175000 MHz
    DMT 0x09:   800x600    60.316541 Hz   4:3     37.879 kHz     40.000000 MHz
    DMT 0x10:  1024x768    60.003840 Hz   4:3     48.363 kHz     65.000000 MHz
    DMT 0x23:  1280x1024   60.019740 Hz   5:4     63.981 kHz    108.000000 MHz
    DMT 0x2a:  1400x1050   59.978442 Hz   4:3     65.317 kHz    121.750000 MHz
    DMT 0x52:  1920x1080   60.000000 Hz  16:9     67.500 kHz    148.500000 MHz
  Detailed Timing Descriptors:
    DTD  1:  1920x1080   59.933878 Hz  16:9     66.587 kHz    138.500000 MHz (1000 mm x 550 mm)
                  Hfront   48 Hsync  32 Hback   80 Hpol P
                  Vfront    3 Vsync   5 Vback   23 Vpol N
    DTD  2:  1360x768    59.798991 Hz  85:48    47.720 kHz     84.750000 MHz (700 mm x 390 mm)
                  Hfront   72 Hsync 136 Hback  208 Hpol N
                  Vfront    3 Vsync   5 Vback   22 Vpol P
    Display Range Limits:
      Monitor ranges (GTF): 57-75 Hz V, 31-84 kHz H, max dotclock 180 MHz
    Display Product Name: '32LG7000'
  Extension blocks: 1
Checksum: 0xa6

----------------

Block 1, CTA-861 Extension Block:
  Revision: 3
  Underscans IT Video Formats by default
  Basic audio support
  Supports YCbCr 4:4:4
  Supports YCbCr 4:2:2
  Native detailed modes: 1
  Video Data Block:
    VIC   1:   640x480    59.940476 Hz   4:3     31.469 kHz     25.175000 MHz (native)
    VIC   2:   720x480    59.940060 Hz   4:3     31.469 kHz     27.000000 MHz
    VIC   3:   720x480    59.940060 Hz  16:9     31.469 kHz     27.000000 MHz
    VIC  21:  1440x576i   50.000000 Hz   4:3     15.625 kHz     27.000000 MHz
    VIC  18:   720x576    50.000000 Hz  16:9     31.250 kHz     27.000000 MHz
    VIC  19:  1280x720    50.000000 Hz  16:9     37.500 kHz     74.250000 MHz
    VIC   4:  1280x720    60.000000 Hz  16:9     45.000 kHz     74.250000 MHz
    VIC  20:  1920x1080i  50.000000 Hz  16:9     28.125 kHz     74.250000 MHz
    VIC   5:  1920x1080i  60.000000 Hz  16:9     33.750 kHz     74.250000 MHz
    VIC  32:  1920x1080   24.000000 Hz  16:9     27.000 kHz     74.250000 MHz
    VIC  33:  1920x1080   25.000000 Hz  16:9     28.125 kHz     74.250000 MHz
    VIC  34:  1920x1080   30.000000 Hz  16:9     33.750 kHz     74.250000 MHz
    VIC  31:  1920x1080   50.000000 Hz  16:9     56.250 kHz    148.500000 MHz
    VIC  16:  1920x1080   60.000000 Hz  16:9     67.500 kHz    148.500000 MHz
  Audio Data Block:
    Linear PCM:
      Max channels: 2
      Supported sample rates (kHz): 192 96 48 44.1 32
      Supported sample sizes (bits): 24 20 16
  Speaker Allocation Data Block:
    FL/FR - Front Left/Right
  Vendor-Specific Data Block (HDMI), OUI 00-0C-03:
    Source physical address: 4.0.0.0
    Supports_AI
    DC_36bit
    DC_30bit
    DC_Y444
    Maximum TMDS clock: 225 MHz
  Detailed Timing Descriptors:
    DTD  3:     1x3456  1103.006314 Hz   1:3456 3901.333 kHz    117.040000 MHz (analog composite, sync-on-green, 2869 mm x 3072 mm)
                  Hfront  540 Hsync  32 Hback -815 Hpol N Hborder 136
                  Vfront    4 Vsync   0 Vback   11 Vpol N Vborder 33
                   b8 2d 01 1d 00 80 51 d0 1c 20 40 80 35 00 bc 88 21 00 '.-....Q.. @.5...!.'
    DTD  4:  3468x3722    5.882167 Hz 1734:1861   22.082 kHz     76.800000 MHz (analog composite, sync-on-green, 406 mm x 768 mm)
                  Hfront   45 Hsync 784 Hback -1103 Hpol N Hborder 142
                  Vfront   49 Vsync  32 Vback -115 Vpol N Vborder 33
    DTD  5:  2050x792     9.870000 Hz 1025:396   29.146 kHz     61.440000 MHz (analog composite, sync-on-green, 69 mm x 1536 mm)
                  Hfront   45 Hsync 576 Hback -699 Hpol N Hborder 68
                  Vfront   53 Vsync   8 Vback 2034 Vpol N Vborder 33
    DTD  6:  2049x280    10.666267 Hz 2049:280   36.959 kHz     76.800000 MHz (analog composite, sync-on-green, 3109 mm x 1024 mm)
                  Hfront   22 Hsync 544 Hback -821 Hpol N Hborder 142
                  Vfront   53 Vsync   8 Vback 3058 Vpol N Vborder 33
    DTD  7:    78x128   17755.146833 Hz  39:64  3710.826 kHz    404.480000 MHz (analog composite, sync-on-green, 2871 mm x 3072 mm)
                  Hfront  542 Hsync  48 Hback -831 Hpol N Hborder 136
                  Vfront    4 Vsync   0 Vback   11 Vpol N Vborder 33
                   00 9e 4e 1f 00 80 51 00 1e 30 40 80 37 00 bc 88 21 00 '..N...Q..0@.7...!.'
Checksum: 0xb6  Unused space in Extension Block: 4 bytes

----------------

Block 2, Unknown EDID Extension Block 0x00:
  00 ff ff ff ff ff ff 00 1e 6d 5e 76 01 01 01 01 '.........m^v....'
  04 13 01 03 80 46 27 78 ea d9 b0 a3 57 49 9c 25 '.....F'x....WI.%'
  11 49 4b a1 08 00 31 40 45 40 61 40 81 80 90 40 '.IK...1@E@a@...@'
  d1 c0 01 01 01 01 1a 36 80 a0 70 38 1f 40 30 20 '.......6..p8.@0 '
  35 00 e8 26 32 00 00 1a 1b 21 50 a0 51 00 1e 30 '5..&2....!P.Q..0'
  48 88 35 00 bc 86 21 00 00 1c 00 00 00 fd 00 39 'H.5...!........9'
  4b 1f 54 12 00 0a 20 20 20 20 20 20 00 00 00 fc 'K.T...      ....'
  00 33 32 4c 47 37 30 30 30 0a 20 20 20 20 01 a6 '.32LG7000.    ..'
Checksum: 0xa6

----------------

Block 3, CTA-861 Extension Block:
  Revision: 3
  Underscans IT Video Formats by default
  Basic audio support
  Supports YCbCr 4:4:4
  Supports YCbCr 4:2:2
  Native detailed modes: 1
  Video Data Block:
    VIC   1:   640x480    59.940476 Hz   4:3     31.469 kHz     25.175000 MHz (native)
    VIC   2:   720x480    59.940060 Hz   4:3     31.469 kHz     27.000000 MHz
    VIC   3:   720x480    59.940060 Hz  16:9     31.469 kHz     27.000000 MHz
    VIC  21:  1440x576i   50.000000 Hz   4:3     15.625 kHz     27.000000 MHz
    VIC  18:   720x576    50.000000 Hz  16:9     31.250 kHz     27.000000 MHz
    VIC  19:  1280x720    50.000000 Hz  16:9     37.500 kHz     74.250000 MHz
    VIC   4:  1280x720    60.000000 Hz  16:9     45.000 kHz     74.250000 MHz
    VIC  20:  1920x1080i  50.000000 Hz  16:9     28.125 kHz     74.250000 MHz
    VIC   5:  1920x1080i  60.000000 Hz  16:9     33.750 kHz     74.250000 MHz
    VIC  32:  1920x1080   24.000000 Hz  16:9     27.000 kHz     74.250000 MHz
    VIC  33:  1920x1080   25.000000 Hz  16:9     28.125 kHz     74.250000 MHz
    VIC  34:  1920x1080   30.000000 Hz  16:9     33.750 kHz     74.250000 MHz
    VIC  31:  1920x1080   50.000000 Hz  16:9     56.250 kHz    148.500000 MHz
    VIC  16:  1920x1080   60.000000 Hz  16:9     67.500 kHz    148.500000 MHz
  Audio Data Block:
    Linear PCM:
      Max channels: 2
      Supported sample rates (kHz): 192 96 48 44.1 32
      Supported sample sizes (bits): 24 20 16
  Speaker Allocation Data Block:
    FL/FR - Front Left/Right
  Vendor-Specific Data Block (HDMI), OUI 00-0C-03:
    Source physical address: 4.0.0.0
    Supports_AI
    DC_36bit
    DC_30bit
    DC_Y444
    Maximum TMDS clock: 225 MHz
  Detailed Timing Descriptors:
    DTD  8:     1x3456  1103.006314 Hz   1:3456 3901.333 kHz    117.040000 MHz (analog composite, sync-on-green, 2869 mm x 3072 mm)
                  Hfront  540 Hsync  32 Hback -815 Hpol N Hborder 136
                  Vfront    4 Vsync   0 Vback   11 Vpol N Vborder 33
                   b8 2d 01 1d 00 80 51 d0 1c 20 40 80 35 00 bc 88 21 00 '.-....Q.. @.5...!.'
    DTD  9:  3468x3722    5.882167 Hz 1734:1861   22.082 kHz     76.800000 MHz (analog composite, sync-on-green, 406 mm x 768 mm)
                  Hfront   45 Hsync 784 Hback -1103 Hpol N Hborder 142
                  Vfront   49 Vsync  32 Vback -115 Vpol N Vborder 33
    DTD 10:  2050x792     9.870000 Hz 1025:396   29.146 kHz     61.440000 MHz (analog composite, sync-on-green, 69 mm x 1536 mm)
                  Hfront   45 Hsync 576 Hback -699 Hpol N Hborder 68
                  Vfront   53 Vsync   8 Vback 2034 Vpol N Vborder 33
    DTD 11:  2049x280    10.666267 Hz 2049:280   36.959 kHz     76.800000 MHz (analog composite, sync-on-green, 3109 mm x 1024 mm)
                  Hfront   22 Hsync 544 Hback -821 Hpol N Hborder 142
                  Vfront   53 Vsync   8 Vback 3058 Vpol N Vborder 33
    DTD 12:    78x128   17755.146833 Hz  39:64  3710.826 kHz    404.480000 MHz (analog composite, sync-on-green, 2871 mm x 3072 mm)
                  Hfront  542 Hsync  48 Hback -831 Hpol N Hborder 136
                  Vfront    4 Vsync   0 Vback   11 Vpol N Vborder 33
                   00 9e 4e 1f 00 80 51 00 1e 30 40 80 37 00 bc 88 21 00 '..N...Q..0@.7...!.'
Checksum: 0xb6  Unused space in Extension Block: 4 bytes

----------------

Warnings:

Block 0, Base EDID:
  Vendor & Product Identification: The serial number is one of the known dummy values, it should probably be set to 0.
  Detailed Timing Descriptor #1: Image size is 1000x550 mm, but based on the picture AR it should be 1000x562 mm.
Block 1, CTA-861 Extension Block:
  Video Data Block: VIC 1 and the first DTD are not identical. Is this intended?
  Detailed Timing Descriptor #3: Image size is 2869x3072 mm, but based on the picture AR it should be 2869x9915264 mm.
  Detailed Timing Descriptor #3: The use of non-zero borders in a DTD is not recommended.
  Detailed Timing Descriptor #4: Image size is 406x768 mm, but based on the picture AR it should be 406x435 mm.
  Detailed Timing Descriptor #4: The use of non-zero borders in a DTD is not recommended.
  Detailed Timing Descriptor #5: Dubious image size (69x1536 mm is smaller than 100x100 mm).
  Detailed Timing Descriptor #5: The use of non-zero borders in a DTD is not recommended.
  Detailed Timing Descriptor #6: Image size is 3109x1024 mm, but based on the picture AR it should be 3109x424 mm.
  Detailed Timing Descriptor #6: The use of non-zero borders in a DTD is not recommended.
  Detailed Timing Descriptor #7: Image size is 2871x3072 mm, but based on the picture AR it should be 2871x4711 mm.
  Detailed Timing Descriptor #7: The use of non-zero borders in a DTD is not recommended.
  Add a Colorimetry Data Block with the sRGB colorimetry bit set to avoid interop issues.
Block 3, CTA-861 Extension Block:
  Detailed Timing Descriptor #8: Image size is 2869x3072 mm, but based on the picture AR it should be 2869x9915264 mm.
  Detailed Timing Descriptor #8: The use of non-zero borders in a DTD is not recommended.
  Detailed Timing Descriptor #9: Image size is 406x768 mm, but based on the picture AR it should be 406x435 mm.
  Detailed Timing Descriptor #9: The use of non-zero borders in a DTD is not recommended.
  Detailed Timing Descriptor #10: Dubious image size (69x1536 mm is smaller than 100x100 mm).
  Detailed Timing Descriptor #10: The use of non-zero borders in a DTD is not recommended.
  Detailed Timing Descriptor #11: Image size is 3109x1024 mm, but based on the picture AR it should be 3109x424 mm.
  Detailed Timing Descriptor #11: The use of non-zero borders in a DTD is not recommended.
  Detailed Timing Descriptor #12: Image size is 2871x3072 mm, but based on the picture AR it should be 2871x4711 mm.
  Detailed Timing Descriptor #12: The use of non-zero borders in a DTD is not recommended.
EDID:
  Base EDID: Some timings are out of range of the Monitor Ranges:
    Vertical Freq: 5.882 - 17755.147 Hz (Monitor: 57.000 - 75.000 Hz)
    Horizontal Freq: 15.625 - 3901.333 kHz (Monitor: 31.000 - 84.000 kHz)
    Maximum Clock: 404.480 MHz (Monitor: 180.000 MHz)

Failures:

Block 0, Base EDID:
  Detailed Timing Descriptor #1: Mismatch of image size 1000x550 mm vs display size 700x390 mm.
Block 1, CTA-861 Extension Block:
  Offset is 33, but should be 35.
  Detailed Timing Descriptor #3: 0 values in the video timing:
    Horizontal Active/Blanking 1/29
    Horizontal Frontporch/Sync Width 540/32
    Vertical Active/Blanking 3456/81
    Vertical Frontporch/Sync Width 4/0
  Detailed Timing Descriptor #3: 0 or negative horizontal back porch.
  Detailed Timing Descriptor #3: Mismatch of image size 2869x3072 mm vs display size 700x390 mm.
  Detailed Timing Descriptor #4: 0 or negative horizontal back porch.
  Detailed Timing Descriptor #4: 0 or negative vertical back porch.
  Detailed Timing Descriptor #4: Mismatch of image size 406x768 mm vs display size 700x390 mm.
  Detailed Timing Descriptor #5: 0 or negative horizontal back porch.
  Detailed Timing Descriptor #5: Mismatch of image size 69x1536 mm vs display size 700x390 mm.
  Detailed Timing Descriptor #6: 0 or negative horizontal back porch.
  Detailed Timing Descriptor #6: Mismatch of image size 3109x1024 mm vs display size 700x390 mm.
  Detailed Timing Descriptor #7: 0 values in the video timing:
    Horizontal Active/Blanking 78/31
    Horizontal Frontporch/Sync Width 542/48
    Vertical Active/Blanking 128/81
    Vertical Frontporch/Sync Width 4/0
  Detailed Timing Descriptor #7: 0 or negative horizontal back porch.
  Detailed Timing Descriptor #7: Mismatch of image size 2871x3072 mm vs display size 700x390 mm.
  Padding: Contains non-zero bytes.
  Missing VCDB, needed for Set Selectable RGB Quantization to avoid interop issues.
Block 2, Base EDID:
  Unknown Extension Block.
Block 3, CTA-861 Extension Block:
  Video Data Block: Duplicate VIC 1.
  Video Data Block: Duplicate VIC 2.
  Video Data Block: Duplicate VIC 3.
  Video Data Block: Duplicate VIC 21.
  Video Data Block: Duplicate VIC 18.
  Video Data Block: Duplicate VIC 19.
  Video Data Block: Duplicate VIC 4.
  Video Data Block: Duplicate VIC 20.
  Video Data Block: Duplicate VIC 5.
  Video Data Block: Duplicate VIC 32.
  Video Data Block: Duplicate VIC 33.
  Video Data Block: Duplicate VIC 34.
  Video Data Block: Duplicate VIC 31.
  Video Data Block: Duplicate VIC 16.
  Speaker Allocation Data Block: Only one instance of this Data Block is allowed.
  Offset is 33, but should be 35.
  Detailed Timing Descriptor #8: 0 values in the video timing:
    Horizontal Active/Blanking 1/29
    Horizontal Frontporch/Sync Width 540/32
    Vertical Active/Blanking 3456/81
    Vertical Frontporch/Sync Width 4/0
  Detailed Timing Descriptor #8: 0 or negative horizontal back porch.
  Detailed Timing Descriptor #8: Mismatch of image size 2869x3072 mm vs display size 700x390 mm.
  Detailed Timing Descriptor #9: 0 or negative horizontal back porch.
  Detailed Timing Descriptor #9: 0 or negative vertical back porch.
  Detailed Timing Descriptor #9: Mismatch of image size 406x768 mm vs display size 700x390 mm.
  Detailed Timing Descriptor #10: 0 or negative horizontal back porch.
  Detailed Timing Descriptor #10: Mismatch of image size 69x1536 mm vs display size 700x390 mm.
  Detailed Timing Descriptor #11: 0 or negative horizontal back porch.
  Detailed Timing Descriptor #11: Mismatch of image size 3109x1024 mm vs display size 700x390 mm.
  Detailed Timing Descriptor #12: 0 values in the video timing:
    Horizontal Active/Blanking 78/31
    Horizontal Frontporch/Sync Width 542/48
    Vertical Active/Blanking 128/81
    Vertical Frontporch/Sync Width 4/0
  Detailed Timing Descriptor #12: 0 or negative horizontal back porch.
  Detailed Timing Descriptor #12: Mismatch of image size 2871x3072 mm vs display size 700x390 mm.
  Padding: Contains non-zero bytes.
EDID:
  Base EDID: The DTD max image size is 3109x3072mm, which is larger than the display size 700.0x390.0mm.
  Base EDID: EDID specified 1 extension block(s), but found 3 extension block(s).
  Base EDID: EDID 1.3 requires a Block Map Extension in Block 1 if there are more than 2 blocks in the EDID.
  CTA-861: The maximum HDMI TMDS clock is 225000 kHz, but one or more video timings go up to 404480 kHz.
  CTA-861: Native progressive timings are a mix of several resolutions.

EDID conformity: FAIL
