edid-decode (hex):

00 ff ff ff ff ff ff 00 4e 14 04 22 2a 02 00 00
32 12 01 04 a5 2f 1e 78 23 82 d2 a3 5a 49 a0 24
13 50 53 bf ef 00 71 4f 81 c0 81 40 81 80 95 00
01 01 01 01 01 01 21 39 90 30 62 1a 27 40 68 b0
36 00 da 28 11 00 00 1c 94 43 80 90 72 38 28 40
80 48 35 10 da 28 11 00 00 1e 1b 21 50 a0 51 00
1e 30 88 d0 35 00 da 28 11 00 00 1c 00 00 00 fc
00 53 63 65 70 74 72 65 20 58 32 32 48 47 00 e7

00 ff ff ff ff ff ff 00 4e 14 04 22 2a 02 00 00
32 12 01 04 a5 2f 1e 78 23 82 d2 a3 5a 49 a0 24
13 50 53 bf ef 00 71 4f 81 c0 81 40 81 80 95 00
01 01 01 01 01 01 21 39 90 30 62 1a 27 40 68 b0
36 00 da 28 11 00 00 1c 94 43 80 90 72 38 28 40
80 48 35 10 da 28 11 00 00 1e 1b 21 50 a0 51 00
1e 30 88 d0 35 00 da 28 11 00 00 1c 00 00 00 fc
00 53 63 65 70 74 72 65 20 58 32 32 48 47 00 e7

----------------

Block 0, Base EDID:
  EDID Structure Version & Revision: 1.4
  Vendor & Product Identification:
    Manufacturer: SPT
    Model: 8708
    Serial Number: ...
    Made in: week 50 of 2008
  Basic Display Parameters & Features:
    Digital display
    Bits per primary color channel: 8
    DisplayPort interface
    Maximum image size: 47 cm x 30 cm
    Gamma: 2.20
    DPMS levels: Off
    Supported color formats: RGB 4:4:4
    First detailed timing includes the native pixel format and preferred refresh rate
    Display supports continuous frequencies
  Color Characteristics:
    Red  : 0.6386, 0.3515
    Green: 0.2851, 0.6269
    Blue : 0.1435, 0.0751
    White: 0.3125, 0.3261
  Established Timings I & II:
    IBM     :   720x400    70.081663 Hz   9:5     31.467 kHz     28.320000 MHz
    DMT 0x04:   640x480    59.940476 Hz   4:3     31.469 kHz     25.175000 MHz
    Apple   :   640x480    66.666667 Hz   4:3     35.000 kHz     30.240000 MHz
    DMT 0x05:   640x480    72.808802 Hz   4:3     37.861 kHz     31.500000 MHz
    DMT 0x06:   640x480    75.000000 Hz   4:3     37.500 kHz     31.500000 MHz
    DMT 0x08:   800x600    56.250000 Hz   4:3     35.156 kHz     36.000000 MHz
    DMT 0x09:   800x600    60.316541 Hz   4:3     37.879 kHz     40.000000 MHz
    DMT 0x0a:   800x600    72.187572 Hz   4:3     48.077 kHz     50.000000 MHz
    DMT 0x0b:   800x600    75.000000 Hz   4:3     46.875 kHz     49.500000 MHz
    Apple   :   832x624    74.551266 Hz   4:3     49.726 kHz     57.284000 MHz
    DMT 0x10:  1024x768    60.003840 Hz   4:3     48.363 kHz     65.000000 MHz
    DMT 0x11:  1024x768    70.069359 Hz   4:3     56.476 kHz     75.000000 MHz
    DMT 0x12:  1024x768    75.028582 Hz   4:3     60.023 kHz     78.750000 MHz
    DMT 0x24:  1280x1024   75.024675 Hz   5:4     79.976 kHz    135.000000 MHz
  Standard Timings:
    DMT 0x15:  1152x864    75.000000 Hz   4:3     67.500 kHz    108.000000 MHz
    DMT 0x55:  1280x720    60.000000 Hz  16:9     45.000 kHz     74.250000 MHz
    DMT 0x20:  1280x960    60.000000 Hz   4:3     60.000 kHz    108.000000 MHz
    DMT 0x23:  1280x1024   60.019740 Hz   5:4     63.981 kHz    108.000000 MHz
    DMT 0x2f:  1440x900    59.887445 Hz  16:10    55.935 kHz    106.500000 MHz
  Detailed Timing Descriptors:
    DTD 1:  1680x1050   59.954250 Hz  16:10    65.290 kHz    146.250000 MHz (474 mm x 296 mm)
                 Hfront  104 Hsync 176 Hback  280 Hpol N
                 Vfront    3 Vsync   6 Vback   30 Vpol P
    DTD 2:  1920x1080   59.962844 Hz  16:9     67.158 kHz    173.000000 MHz (474 mm x 296 mm)
                 Hfront  128 Hsync 328 Hback  200 Hpol P
                 Vfront    3 Vsync   5 Vback   32 Vpol P
    DTD 3:  1360x768    59.798991 Hz  85:48    47.720 kHz     84.750000 MHz (474 mm x 296 mm)
                 Hfront  136 Hsync 208 Hback   72 Hpol N
                 Vfront    3 Vsync   5 Vback   22 Vpol P
    Display Product Name: 'Sceptre X22HG'
Checksum: 0xe7

----------------

Warnings:

Block 0, Base EDID:
  Detailed Timing Descriptor #2: Image size is 474x296 mm, but based on the picture AR it should be 474x266 mm.
  Detailed Timing Descriptor #3: Image size is 474x296 mm, but based on the picture AR it should be 474x267 mm.

Failures:

Block 0, Base EDID:
  Missing Display Range Limits Descriptor.
EDID:
  Extension Block 1 started with EDID header, ignoring Extension Blocks >= 1.

EDID conformity: FAIL
