edid-decode (hex):

00 ff ff ff ff ff ff 00 22 f0 19 32 01 01 01 01
2d 1b 01 03 80 3c 22 78 2a 44 55 a9 55 4d 9d 26
0f 50 54 21 08 00 d1 c0 a9 c0 81 c0 d1 00 b3 00
95 00 a9 40 81 80 56 5e 00 a0 a0 a0 29 50 30 20
35 00 55 50 21 00 00 1a 00 00 00 fd 00 32 3c 1e
5a 19 00 0a 20 20 20 20 20 20 00 00 00 fc 00 48
50 20 5a 32 37 6e 0a 20 20 20 20 20 00 00 00 ff
00 43 4e 4b 37 34 35 30 33 34 46 0a 20 20 01 ae

02 03 1f f1 4b 10 1f 04 13 03 12 02 11 01 05 14
23 09 07 07 67 03 0c 00 10 00 00 36 e2 00 2b 02
3a 80 18 71 38 2d 40 58 2c 45 00 55 50 21 00 00
1f f3 39 80 d0 72 38 2d 40 10 2c 45 00 55 50 21
00 00 1f 01 1d 00 72 51 d0 1e 20 6e 28 55 00 55
50 21 00 00 1e 8c 0a d0 8a 20 e0 2d 10 10 3e 96
00 55 50 21 00 00 19 d5 09 80 a0 20 e0 2d 10 10
60 a2 00 55 50 21 00 00 18 00 00 00 00 00 00 ab

00 ff ff ff ff ff ff 00 22 f0 19 32 01 01 01 01
2d 1b 01 03 80 3c 22 78 2a 44 55 a9 55 4d 9d 26
0f 50 54 21 08 00 d1 c0 a9 c0 81 c0 d1 00 b3 00
95 00 a9 40 81 80 56 5e 00 a0 a0 a0 29 50 30 20
35 00 55 50 21 00 00 1a 00 00 00 fd 00 32 3c 1e
5a 19 00 0a 20 20 20 20 20 20 00 00 00 fc 00 48
50 20 5a 32 37 6e 0a 20 20 20 20 20 00 00 00 ff
00 43 4e 4b 37 34 35 30 33 34 46 0a 20 20 01 ae

02 03 1f f1 4b 10 1f 04 13 03 12 02 11 01 05 14
23 09 07 07 67 03 0c 00 10 00 00 36 e2 00 2b 02
3a 80 18 71 38 2d 40 58 2c 45 00 55 50 21 00 00
1f f3 39 80 d0 72 38 2d 40 10 2c 45 00 55 50 21
00 00 1f 01 1d 00 72 51 d0 1e 20 6e 28 55 00 55
50 21 00 00 1e 8c 0a d0 8a 20 e0 2d 10 10 3e 96
00 55 50 21 00 00 19 d5 09 80 a0 20 e0 2d 10 10
60 a2 00 55 50 21 00 00 18 00 00 00 00 00 00 ab

----------------

Block 0, Base EDID:
  EDID Structure Version & Revision: 1.3
  Vendor & Product Identification:
    Manufacturer: HWP
    Model: 12825
    Serial Number: ...
    Made in: week 45 of 2017
  Basic Display Parameters & Features:
    Digital display
    Maximum image size: 60 cm x 34 cm
    Gamma: 2.20
    DPMS levels: Off
    RGB color display
    First detailed timing is the preferred timing
  Color Characteristics:
    Red  : 0.6611, 0.3320
    Green: 0.3017, 0.6132
    Blue : 0.1494, 0.0595
    White: 0.3134, 0.3291
  Established Timings I & II:
    DMT 0x04:   640x480    59.940476 Hz   4:3     31.469 kHz     25.175000 MHz
    DMT 0x09:   800x600    60.316541 Hz   4:3     37.879 kHz     40.000000 MHz
    DMT 0x10:  1024x768    60.003840 Hz   4:3     48.363 kHz     65.000000 MHz
  Standard Timings:
    DMT 0x52:  1920x1080   60.000000 Hz  16:9     67.500 kHz    148.500000 MHz
    DMT 0x53:  1600x900    60.000000 Hz  16:9     60.000 kHz    108.000000 MHz (RB)
    DMT 0x55:  1280x720    60.000000 Hz  16:9     45.000 kHz     74.250000 MHz
    DMT 0x45:  1920x1200   59.884600 Hz  16:10    74.556 kHz    193.250000 MHz
    DMT 0x3a:  1680x1050   59.954250 Hz  16:10    65.290 kHz    146.250000 MHz
    DMT 0x2f:  1440x900    59.887445 Hz  16:10    55.935 kHz    106.500000 MHz
    DMT 0x33:  1600x1200   60.000000 Hz   4:3     75.000 kHz    162.000000 MHz
    DMT 0x23:  1280x1024   60.019740 Hz   5:4     63.981 kHz    108.000000 MHz
  Detailed Timing Descriptors:
    DTD  1:  2560x1440   59.950550 Hz  16:9     88.787 kHz    241.500000 MHz (597 mm x 336 mm)
                  Hfront   48 Hsync  32 Hback   80 Hpol P
                  Vfront    3 Vsync   5 Vback   33 Vpol N
    Display Range Limits:
      Monitor ranges (GTF): 50-60 Hz V, 30-90 kHz H, max dotclock 250 MHz
    Display Product Name: 'HP Z27n'
    Display Product Serial Number: ...
  Extension blocks: 1
Checksum: 0xae

----------------

Block 1, CTA-861 Extension Block:
  Revision: 3
  Underscans IT Video Formats by default
  Basic audio support
  Supports YCbCr 4:4:4
  Supports YCbCr 4:2:2
  Native detailed modes: 1
  Video Data Block:
    VIC  16:  1920x1080   60.000000 Hz  16:9     67.500 kHz    148.500000 MHz
    VIC  31:  1920x1080   50.000000 Hz  16:9     56.250 kHz    148.500000 MHz
    VIC   4:  1280x720    60.000000 Hz  16:9     45.000 kHz     74.250000 MHz
    VIC  19:  1280x720    50.000000 Hz  16:9     37.500 kHz     74.250000 MHz
    VIC   3:   720x480    59.940060 Hz  16:9     31.469 kHz     27.000000 MHz
    VIC  18:   720x576    50.000000 Hz  16:9     31.250 kHz     27.000000 MHz
    VIC   2:   720x480    59.940060 Hz   4:3     31.469 kHz     27.000000 MHz
    VIC  17:   720x576    50.000000 Hz   4:3     31.250 kHz     27.000000 MHz
    VIC   1:   640x480    59.940476 Hz   4:3     31.469 kHz     25.175000 MHz
    VIC   5:  1920x1080i  60.000000 Hz  16:9     33.750 kHz     74.250000 MHz
    VIC  20:  1920x1080i  50.000000 Hz  16:9     28.125 kHz     74.250000 MHz
  Audio Data Block:
    Linear PCM:
      Max channels: 2
      Supported sample rates (kHz): 48 44.1 32
      Supported sample sizes (bits): 24 20 16
  Vendor-Specific Data Block (HDMI), OUI 00-0C-03:
    Source physical address: 1.0.0.0
    Maximum TMDS clock: 270 MHz
  Video Capability Data Block:
    YCbCr quantization: No Data
    RGB quantization: No Data
    PT scan behavior: Always Underscanned
    IT scan behavior: Always Underscanned
    CE scan behavior: Supports both over- and underscan
  Detailed Timing Descriptors:
    DTD  2:  1920x1080   60.000000 Hz  16:9     67.500 kHz    148.500000 MHz (597 mm x 336 mm)
                  Hfront   88 Hsync  44 Hback  148 Hpol P
                  Vfront    4 Vsync   5 Vback   36 Vpol P
    DTD  3:  1920x1080   49.949495 Hz  16:9     56.193 kHz    148.350000 MHz (597 mm x 336 mm)
                  Hfront   16 Hsync  44 Hback  660 Hpol P
                  Vfront    4 Vsync   5 Vback   36 Vpol P
    DTD  4:  1280x720    60.000000 Hz  16:9     45.000 kHz     74.250000 MHz (597 mm x 336 mm)
                  Hfront  110 Hsync  40 Hback  220 Hpol P
                  Vfront    5 Vsync   5 Vback   20 Vpol P
    DTD  5:   720x480    59.940060 Hz   3:2     31.469 kHz     27.000000 MHz (597 mm x 336 mm)
                  Hfront   16 Hsync  62 Hback   60 Hpol N
                  Vfront    9 Vsync   6 Vback   30 Vpol N
    DTD  6:   640x480    59.928571 Hz   4:3     31.462 kHz     25.170000 MHz (597 mm x 336 mm)
                  Hfront   16 Hsync  96 Hback   48 Hpol N
                  Vfront   10 Vsync   2 Vback   33 Vpol N
Checksum: 0xab  Unused space in Extension Block: 6 bytes

----------------

Block 2, Unknown EDID Extension Block 0x00:
  00 ff ff ff ff ff ff 00 22 f0 19 32 01 01 01 01 '........"..2....'
  2d 1b 01 03 80 3c 22 78 2a 44 55 a9 55 4d 9d 26 '-....<"x*DU.UM.&'
  0f 50 54 21 08 00 d1 c0 a9 c0 81 c0 d1 00 b3 00 '.PT!............'
  95 00 a9 40 81 80 56 5e 00 a0 a0 a0 29 50 30 20 '...@..V^....)P0 '
  35 00 55 50 21 00 00 1a 00 00 00 fd 00 32 3c 1e '5.UP!........2<.'
  5a 19 00 0a 20 20 20 20 20 20 00 00 00 fc 00 48 'Z...      .....H'
  50 20 5a 32 37 6e 0a 20 20 20 20 20 00 00 00 ff 'P Z27n.     ....'
  00 43 4e 4b 37 34 35 30 33 34 46 0a 20 20 01 ae '.CNK745034F.  ..'
Checksum: 0xae

----------------

Block 3, CTA-861 Extension Block:
  Revision: 3
  Underscans IT Video Formats by default
  Basic audio support
  Supports YCbCr 4:4:4
  Supports YCbCr 4:2:2
  Native detailed modes: 1
  Video Data Block:
    VIC  16:  1920x1080   60.000000 Hz  16:9     67.500 kHz    148.500000 MHz
    VIC  31:  1920x1080   50.000000 Hz  16:9     56.250 kHz    148.500000 MHz
    VIC   4:  1280x720    60.000000 Hz  16:9     45.000 kHz     74.250000 MHz
    VIC  19:  1280x720    50.000000 Hz  16:9     37.500 kHz     74.250000 MHz
    VIC   3:   720x480    59.940060 Hz  16:9     31.469 kHz     27.000000 MHz
    VIC  18:   720x576    50.000000 Hz  16:9     31.250 kHz     27.000000 MHz
    VIC   2:   720x480    59.940060 Hz   4:3     31.469 kHz     27.000000 MHz
    VIC  17:   720x576    50.000000 Hz   4:3     31.250 kHz     27.000000 MHz
    VIC   1:   640x480    59.940476 Hz   4:3     31.469 kHz     25.175000 MHz
    VIC   5:  1920x1080i  60.000000 Hz  16:9     33.750 kHz     74.250000 MHz
    VIC  20:  1920x1080i  50.000000 Hz  16:9     28.125 kHz     74.250000 MHz
  Audio Data Block:
    Linear PCM:
      Max channels: 2
      Supported sample rates (kHz): 48 44.1 32
      Supported sample sizes (bits): 24 20 16
  Vendor-Specific Data Block (HDMI), OUI 00-0C-03:
    Source physical address: 1.0.0.0
    Maximum TMDS clock: 270 MHz
  Video Capability Data Block:
    YCbCr quantization: No Data
    RGB quantization: No Data
    PT scan behavior: Always Underscanned
    IT scan behavior: Always Underscanned
    CE scan behavior: Supports both over- and underscan
  Detailed Timing Descriptors:
    DTD  7:  1920x1080   60.000000 Hz  16:9     67.500 kHz    148.500000 MHz (597 mm x 336 mm)
                  Hfront   88 Hsync  44 Hback  148 Hpol P
                  Vfront    4 Vsync   5 Vback   36 Vpol P
    DTD  8:  1920x1080   49.949495 Hz  16:9     56.193 kHz    148.350000 MHz (597 mm x 336 mm)
                  Hfront   16 Hsync  44 Hback  660 Hpol P
                  Vfront    4 Vsync   5 Vback   36 Vpol P
    DTD  9:  1280x720    60.000000 Hz  16:9     45.000 kHz     74.250000 MHz (597 mm x 336 mm)
                  Hfront  110 Hsync  40 Hback  220 Hpol P
                  Vfront    5 Vsync   5 Vback   20 Vpol P
    DTD 10:   720x480    59.940060 Hz   3:2     31.469 kHz     27.000000 MHz (597 mm x 336 mm)
                  Hfront   16 Hsync  62 Hback   60 Hpol N
                  Vfront    9 Vsync   6 Vback   30 Vpol N
    DTD 11:   640x480    59.928571 Hz   4:3     31.462 kHz     25.170000 MHz (597 mm x 336 mm)
                  Hfront   16 Hsync  96 Hback   48 Hpol N
                  Vfront   10 Vsync   2 Vback   33 Vpol N
Checksum: 0xab  Unused space in Extension Block: 6 bytes

----------------

Warnings:

Block 0, Base EDID:
  Vendor & Product Identification: The serial number is one of the known dummy values, it should probably be set to 0.
Block 1, CTA-861 Extension Block:
  Video Data Block: VIC 16 and the first DTD are not identical. Is this intended?
  Video Capability Data Block: Set Selectable YCbCr Quantization to avoid interop issues.
  Detailed Timing Descriptor #5: Image size is 597x336 mm, but based on the picture AR it should be 597x398 mm.
  Detailed Timing Descriptor #6: Image size is 597x336 mm, but based on the picture AR it should be 597x447 mm.
  Display Product Serial Number is set, so the Serial Number in the Base EDID should be 0.
  Add a Colorimetry Data Block with the sRGB colorimetry bit set to avoid interop issues.
Block 3, CTA-861 Extension Block:
  Video Capability Data Block: Set Selectable YCbCr Quantization to avoid interop issues.
  Detailed Timing Descriptor #10: Image size is 597x336 mm, but based on the picture AR it should be 597x398 mm.
  Detailed Timing Descriptor #11: Image size is 597x336 mm, but based on the picture AR it should be 597x447 mm.
EDID:
  Base EDID: Some timings are out of range of the Monitor Ranges:
    Horizontal Freq: 28.125 - 88.786 kHz (Monitor: 30.000 - 90.000 kHz)

Failures:

Block 1, CTA-861 Extension Block:
  Video Capability Data Block: Set Selectable RGB Quantization to avoid interop issues.
Block 2, Base EDID:
  Unknown Extension Block.
Block 3, CTA-861 Extension Block:
  Video Data Block: Duplicate VIC 16.
  Video Data Block: Duplicate VIC 31.
  Video Data Block: Duplicate VIC 4.
  Video Data Block: Duplicate VIC 19.
  Video Data Block: Duplicate VIC 3.
  Video Data Block: Duplicate VIC 18.
  Video Data Block: Duplicate VIC 2.
  Video Data Block: Duplicate VIC 17.
  Video Data Block: Duplicate VIC 1.
  Video Data Block: Duplicate VIC 5.
  Video Data Block: Duplicate VIC 20.
  Video Capability Data Block: Only one instance of this Data Block is allowed.
  Video Capability Data Block: Set Selectable RGB Quantization to avoid interop issues.
EDID:
  Base EDID: EDID specified 1 extension block(s), but found 3 extension block(s).
  Base EDID: EDID 1.3 requires a Block Map Extension in Block 1 if there are more than 2 blocks in the EDID.

EDID conformity: FAIL
