edid-decode (hex):

00 ff ff ff ff ff ff 00 50 6c d4 03 11 00 00 00
01 1e 01 03 80 0c 07 78 0e ee 95 a3 54 4c 99 26
0f 4f 4f 00 00 00 01 01 01 01 01 01 01 01 01 01
01 01 01 01 01 01 02 3a 80 18 71 38 2d 40 58 2c
45 00 80 38 74 00 00 1e 02 3a 80 18 71 38 2d 40
58 2c 45 00 80 38 74 00 00 1e 00 00 00 fd 00 37
41 32 46 10 00 0a 20 20 20 20 20 20 00 00 00 fc
00 53 6d 61 72 74 47 6c 61 73 73 65 73 0a 01 43

02 03 17 f1 41 90 23 09 04 01 83 01 00 00 65 03
0c 00 00 00 e2 00 0f 02 3a 80 18 71 38 2d 40 58
2c 45 00 80 38 74 00 00 1e 00 00 00 00 00 00 00
00 00 00 00 00 00 00 00 00 00 00 00 00 00 00 00
00 00 00 00 00 00 00 00 00 00 00 00 00 00 00 00
00 00 00 00 00 00 00 00 00 00 00 00 00 00 00 00
00 00 00 00 00 00 00 00 00 00 00 00 00 00 00 00
00 00 00 00 00 00 00 00 00 00 00 00 00 00 00 0b

00 ff ff ff ff ff ff 00 50 6c d4 03 11 00 00 00
01 1e 01 03 80 0c 07 78 0e ee 95 a3 54 4c 99 26
0f 4f 4f 00 00 00 01 01 01 01 01 01 01 01 01 01
01 01 01 01 01 01 02 3a 80 18 71 38 2d 40 58 2c
45 00 80 38 74 00 00 1e 02 3a 80 18 71 38 2d 40
58 2c 45 00 80 38 74 00 00 1e 00 00 00 fd 00 37
41 32 46 10 00 0a 20 20 20 20 20 20 00 00 00 fc
00 53 6d 61 72 74 47 6c 61 73 73 65 73 0a 01 43

02 03 17 f1 41 90 23 09 04 01 83 01 00 00 65 03
0c 00 00 00 e2 00 0f 02 3a 80 18 71 38 2d 40 58
2c 45 00 80 38 74 00 00 1e 00 00 00 00 00 00 00
00 00 00 00 00 00 00 00 00 00 00 00 00 00 00 00
00 00 00 00 00 00 00 00 00 00 00 00 00 00 00 00
00 00 00 00 00 00 00 00 00 00 00 00 00 00 00 00
00 00 00 00 00 00 00 00 00 00 00 00 00 00 00 00
00 00 00 00 00 00 00 00 00 00 00 00 00 00 00 0b

----------------

Block 0, Base EDID:
  EDID Structure Version & Revision: 1.3
  Vendor & Product Identification:
    Manufacturer: TCL
    Model: 980
    Serial Number: ...
    Made in: week 1 of 2020
  Basic Display Parameters & Features:
    Digital display
    Maximum image size: 12 cm x 7 cm
    Gamma: 2.20
    RGB color display
    Default (sRGB) color space is primary color space
    First detailed timing is the preferred timing
  Color Characteristics:
    Red  : 0.6396, 0.3300
    Green: 0.2998, 0.5996
    Blue : 0.1503, 0.0595
    White: 0.3095, 0.3095
  Established Timings I & II: none
  Standard Timings: none
  Detailed Timing Descriptors:
    DTD 1:  1920x1080   60.000000 Hz  16:9     67.500 kHz    148.500000 MHz (1920 mm x 1080 mm)
                 Hfront   88 Hsync  44 Hback  148 Hpol P
                 Vfront    4 Vsync   5 Vback   36 Vpol P
    DTD 2:  1920x1080   60.000000 Hz  16:9     67.500 kHz    148.500000 MHz (1920 mm x 1080 mm)
                 Hfront   88 Hsync  44 Hback  148 Hpol P
                 Vfront    4 Vsync   5 Vback   36 Vpol P
    Display Range Limits:
      Monitor ranges (GTF): 55-65 Hz V, 50-70 kHz H, max dotclock 160 MHz
    Display Product Name: 'SmartGlasses'
  Extension blocks: 1
Checksum: 0x43

----------------

Block 1, CTA-861 Extension Block:
  Revision: 3
  Underscans IT Video Formats by default
  Basic audio support
  Supports YCbCr 4:4:4
  Supports YCbCr 4:2:2
  Native DTDs: 1
  Video Data Block:
    VIC  16:  1920x1080   60.000000 Hz  16:9     67.500 kHz    148.500000 MHz (native)
  Audio Data Block:
    Linear PCM:
      Max channels: 2
      Supported sample rates (kHz): 48
      Supported sample sizes (bits): 16
  Speaker Allocation Data Block:
    FL/FR - Front Left/Right
  Vendor-Specific Data Block (HDMI), OUI 00-0C-03:
    Source physical address: 0.0.0.0
  Video Capability Data Block:
    YCbCr quantization: No Data
    RGB quantization: No Data
    PT scan behavior: No Data
    IT scan behavior: Supports both over- and underscan
    CE scan behavior: Supports both over- and underscan
  Detailed Timing Descriptors:
    DTD 3:  1920x1080   60.000000 Hz  16:9     67.500 kHz    148.500000 MHz (1920 mm x 1080 mm)
                 Hfront   88 Hsync  44 Hback  148 Hpol P
                 Vfront    4 Vsync   5 Vback   36 Vpol P
Checksum: 0x0b  Unused space in Extension Block: 86 bytes

----------------

Warnings:

Block 0, Base EDID:
  Basic Display Parameters & Features: Dubious maximum image size (12x7 is smaller than 10x10 cm).
Block 1, CTA-861 Extension Block:
  Video Capability Data Block: Set Selectable YCbCr Quantization to avoid interop issues.

Failures:

Block 0, Base EDID:
  Basic Display Parameters & Features: sRGB is signaled, but the chromaticities do not match.
  Detailed Timing Descriptor #1: Mismatch of image size 1920x1080 mm vs display size 120x70 mm.
  Detailed Timing Descriptor #2: Mismatch of image size 1920x1080 mm vs display size 120x70 mm.
Block 1, CTA-861 Extension Block:
  Video Capability Data Block: Set Selectable RGB Quantization to avoid interop issues.
  Detailed Timing Descriptor #3: Mismatch of image size 1920x1080 mm vs display size 120x70 mm.
  Required 640x480p60 timings are missing in the established timings and the SVD list (VIC 1).
EDID:
  Extension Block 2 started with EDID header, ignoring Extension Blocks >= 2.
  Base EDID: The DTD max image size is 1920x1080mm, which is larger than the display size 120.0x70.0mm.

EDID conformity: FAIL
