edid-decode (hex):

00 ff ff ff ff ff ff 00 30 e4 64 04 00 00 00 00
00 18 01 04 95 1d 10 78 0a 84 75 94 59 57 92 28
1f 50 54 00 00 00 01 01 01 01 01 01 01 01 01 01
01 01 01 01 01 01 ce 1d 56 f2 50 00 16 30 30 20
35 00 25 a5 10 00 00 19 d8 17 56 f2 50 00 16 30
30 20 35 00 25 a5 10 00 00 19 00 00 00 fe 00 57
36 54 4e 30 81 31 33 33 57 48 32 0a 00 00 00 00
00 00 41 31 99 04 10 00 00 09 01 0a 20 20 00 16

00 ff ff ff ff ff ff 00 30 e4 64 04 00 00 00 00
00 18 01 04 95 1d 10 78 0a 84 75 94 59 57 92 28
1f 50 54 00 00 00 01 01 01 01 01 01 01 01 01 01
01 01 01 01 01 01 ce 1d 56 f2 50 00 16 30 30 20
35 00 25 a5 10 00 00 19 d8 17 56 f2 50 00 16 30
30 20 35 00 25 a5 10 00 00 19 00 00 00 fe 00 57
36 54 4e 30 81 31 33 33 57 48 32 0a 00 00 00 00
00 00 41 31 99 04 10 00 00 09 01 0a 20 20 00 16

----------------

Block 0, Base EDID:
  EDID Structure Version & Revision: 1.4
  Vendor & Product Identification:
    Manufacturer: LGD
    Model: 1124
    Made in: 2014
  Basic Display Parameters & Features:
    Digital display
    Bits per primary color channel: 6
    DisplayPort interface
    Maximum image size: 29 cm x 16 cm
    Gamma: 2.20
    Supported color formats: RGB 4:4:4, YCrCb 4:4:4
    First detailed timing includes the native pixel format and preferred refresh rate
  Color Characteristics:
    Red  : 0.5800, 0.3476
    Green: 0.3408, 0.5703
    Blue : 0.1572, 0.1240
    White: 0.3134, 0.3291
  Established Timings I & II: none
  Standard Timings: none
  Detailed Timing Descriptors:
    DTD 1:  1366x768    60.063606 Hz 683:384   47.450 kHz     76.300000 MHz (293 mm x 165 mm)
                 Hfront   48 Hsync  32 Hback  162 Hpol N
                 Vfront    3 Vsync   5 Vback   14 Vpol N
    DTD 2:  1366x768    48.050885 Hz 683:384   37.960 kHz     61.040000 MHz (293 mm x 165 mm)
                 Hfront   48 Hsync  32 Hback  162 Hpol N
                 Vfront    3 Vsync   5 Vback   14 Vpol N
    Alphanumeric Data String: 'W6TN0.133WH2'
    Manufacturer-Specified Display Descriptor (0x00): 00 00 00 00 41 31 99 04 10 00 00 09 01 0a 20 20 '....A1........  '
Checksum: 0x16

----------------

Block 1, Unknown EDID Extension Block 0x00:
  00 ff ff ff ff ff ff 00 30 e4 64 04 00 00 00 00 '........0.d.....'
  00 18 01 04 95 1d 10 78 0a 84 75 94 59 57 92 28 '.......x..u.YW.('
  1f 50 54 00 00 00 01 01 01 01 01 01 01 01 01 01 '.PT.............'
  01 01 01 01 01 01 ce 1d 56 f2 50 00 16 30 30 20 '........V.P..00 '
  35 00 25 a5 10 00 00 19 d8 17 56 f2 50 00 16 30 '5.%.......V.P..0'
  30 20 35 00 25 a5 10 00 00 19 00 00 00 fe 00 57 '0 5.%..........W'
  36 54 4e 30 81 31 33 33 57 48 32 0a 00 00 00 00 '6TN0.133WH2.....'
  00 00 41 31 99 04 10 00 00 09 01 0a 20 20 00 16 '..A1........  ..'
Checksum: 0x16

----------------

Warnings:

Block 0, Base EDID:
  Alphanumeric Data String: Non-ASCII character 0x81 at position 5, can cause problems.
  Missing Display Product Name.

Failures:

Block 1, Base EDID:
  Unknown Extension Block.
EDID:
  Base EDID: EDID specified 0 extension block(s), but found 1 extension block(s).

EDID conformity: FAIL
