edid-decode (hex):

00 ff ff ff ff ff ff 00 41 d0 ff 09 00 00 00 00
00 00 01 03 08 00 00 78 ea ee 95 a3 54 4c 99 26
0f 50 54 00 00 00 31 40 01 01 01 01 01 01 01 01
01 01 01 01 01 01 42 40 80 50 70 38 19 40 28 20
84 00 e0 0e 11 00 00 1a 00 00 00 fd 00 31 4b 1e
5e 11 00 0a 20 20 20 20 20 20 00 00 00 10 00 00
00 00 00 00 00 00 00 00 00 00 00 00 00 00 00 10
00 00 00 00 00 00 00 00 00 00 00 00 00 00 01 9f

02 03 0d 00 68 1a 00 00 01 01 1e 4b 00 42 40 80
50 70 38 19 40 28 20 84 00 e0 0e 11 00 00 1a 70
0e c0 a0 30 1c 0a 20 30 20 35 00 f0 87 00 00 00
1e 00 00 00 00 00 00 00 00 00 00 00 00 00 00 00
00 00 00 00 00 00 00 00 00 00 00 00 00 00 00 00
00 00 00 00 00 00 00 00 00 00 00 00 00 00 00 00
00 00 00 00 00 00 00 00 00 00 00 00 00 00 00 00
00 00 00 00 00 00 00 00 00 00 00 00 00 00 00 5b

----------------

Block 0, Base EDID:
  EDID Structure Version & Revision: 1.3
  Vendor & Product Identification:
    Manufacturer: PNP
    Model: 2559
    Made in: 1990
  Basic Display Parameters & Features:
    Analog display
    Signal Level Standard: 0.700 : 0.300 : 1.000 V p-p
    Blank level equals black level
    Sync: Separate
    Image size is variable
    Gamma: 2.20
    DPMS levels: Standby Suspend Off
    RGB color display
    First detailed timing is the preferred timing
  Color Characteristics:
    Red  : 0.6396, 0.3300
    Green: 0.2998, 0.5996
    Blue : 0.1503, 0.0595
    White: 0.3134, 0.3291
  Established Timings I & II: none
  Standard Timings:
    DMT 0x04:   640x480    59.940476 Hz   4:3     31.469 kHz     25.175000 MHz
  Detailed Timing Descriptors:
    DTD 1:  1920x1080   74.434389 Hz  16:9     82.250 kHz    164.500000 MHz (480 mm x 270 mm)
                 Hfront   40 Hsync  32 Hback    8 Hpol P
                 Vfront    8 Vsync   4 Vback   13 Vpol N
    Display Range Limits:
      Monitor ranges (GTF): 49-75 Hz V, 30-94 kHz H, max dotclock 170 MHz
    Dummy Descriptor:
    Dummy Descriptor:
  Extension blocks: 1
Checksum: 0x9f

----------------

Block 1, CTA-861 Extension Block:
  Revision: 3
  Native DTDs: 0
  Vendor-Specific Data Block (AMD), OUI 00-00-1A:
    Version: 1
    Flags 1: 0x01
      FreeSync Supported
    Minimum Refresh Rate: 30 Hz
    Maximum Refresh Rate: 75 Hz
  Detailed Timing Descriptors:
    DTD 2:  1920x1080   74.434389 Hz  16:9     82.250 kHz    164.500000 MHz (480 mm x 270 mm)
                 Hfront   40 Hsync  32 Hback    8 Hpol P
                 Vfront    8 Vsync   4 Vback   13 Vpol N
    DTD 3:   960x540    60.000000 Hz  16:9     33.000 kHz     36.960000 MHz (240 mm x 135 mm)
                 Hfront   48 Hsync  32 Hback   80 Hpol P
                 Vfront    3 Vsync   5 Vback    2 Vpol P
Checksum: 0x5b  Unused space in Extension Block: 78 bytes

----------------

Warnings:

Block 1, CTA-861 Extension Block:
  IT Video Formats are overscanned by default, but normally this should be underscanned.
  Add a Colorimetry Data Block with the sRGB colorimetry bit set to avoid interop issues.

Failures:

Block 0, Base EDID:
  Missing Display Product Name.
Block 1, CTA-861 Extension Block:
  Required 640x480p60 timings are missing in the established timings and the SVD list (VIC 1).
  Missing VCDB, needed for Set Selectable RGB Quantization to avoid interop issues.
EDID:
  Base EDID: The DTD max image size is 480x270mm, but the display size is not specified anywhere.

EDID conformity: FAIL
