edid-decode (hex):

00 ff ff ff ff ff ff 00 21 63 fc 3c 00 00 00 00
00 1f 01 04 95 22 13 78 0a 7b 60 94 5a 59 90 29
1f 50 54 00 00 00 01 01 01 01 01 01 01 01 01 01
01 01 01 01 01 01 a0 1d 56 d6 50 00 20 30 28 20
ac 00 58 c2 10 00 00 18 b3 17 56 d6 50 00 20 30
28 20 ac 00 58 c2 10 00 00 18 00 00 00 fe 00 56
35 37 38 37 80 31 35 36 41 4e 30 31 00 00 00 00
00 00 41 21 16 00 10 00 00 09 01 0a 20 20 00 8a

00 ff ff ff ff ff ff 00 21 63 fc 3c 00 00 00 00
00 1f 01 04 95 22 13 78 0a 7b 60 94 5a 59 90 29
1f 50 54 00 00 00 01 01 01 01 01 01 01 01 01 01
01 01 01 01 01 01 a0 1d 56 d6 50 00 20 30 28 20
ac 00 58 c2 10 00 00 18 b3 17 56 d6 50 00 20 30
28 20 ac 00 58 c2 10 00 00 18 00 00 00 fe 00 56
35 37 38 37 80 31 35 36 41 4e 30 31 00 00 00 00
00 00 41 21 16 00 10 00 00 09 01 0a 20 20 00 8a

----------------

Block 0, Base EDID:
  EDID Structure Version & Revision: 1.4
  Vendor & Product Identification:
    Manufacturer: HKC
    Model: 15612
    Made in: 2021
  Basic Display Parameters & Features:
    Digital display
    Bits per primary color channel: 6
    DisplayPort interface
    Maximum image size: 34 cm x 19 cm
    Gamma: 2.20
    Supported color formats: RGB 4:4:4, YCrCb 4:4:4
    First detailed timing includes the native pixel format and preferred refresh rate
  Color Characteristics:
    Red  : 0.5791, 0.3544
    Green: 0.3496, 0.5654
    Blue : 0.1611, 0.1230
    White: 0.3125, 0.3281
  Established Timings I & II: none
  Standard Timings: none
  Detailed Timing Descriptors:
    DTD 1:  1366x768    60.000000 Hz 683:384   48.000 kHz     75.840000 MHz (344 mm x 194 mm)
                 Hfront   40 Hsync  32 Hback  142 Hpol N
                 Vfront   10 Vsync  12 Vback   10 Vpol N
    DTD 2:  1366x768    47.998418 Hz 683:384   38.399 kHz     60.670000 MHz (344 mm x 194 mm)
                 Hfront   40 Hsync  32 Hback  142 Hpol N
                 Vfront   10 Vsync  12 Vback   10 Vpol N
    Alphanumeric Data String: 'V5787.156AN01'
    Manufacturer-Specified Display Descriptor (0x00): 00 00 00 00 41 21 16 00 10 00 00 09 01 0a 20 20 '....A!........  '
Checksum: 0x8a

----------------

Warnings:

Block 0, Base EDID:
  Alphanumeric Data String: Non-ASCII character 0x80 at position 5, can cause problems.
  Missing Display Product Name.

Failures:

EDID:
  Extension Block 1 started with EDID header, ignoring Extension Blocks >= 1.

EDID conformity: FAIL
