edid-decode (hex):

00 ff ff ff ff ff ff 00 21 63 fc 3c 00 00 00 00
00 1f 01 04 a5 22 13 78 e3 56 60 97 5b 5a 93 29
1f 50 54 00 00 00 01 01 01 01 01 01 01 01 01 01
01 01 01 01 01 01 98 3b 80 10 71 38 50 40 30 20
36 00 58 c2 10 00 00 19 00 00 00 fd 00 28 3c 46
46 0f 01 0a 20 20 20 20 20 20 00 00 00 fe 00 48
4b 43 20 4d 59 20 20 20 20 0a 20 20 00 00 00 fe
00 4d 42 31 35 36 43 4e 30 31 27 32 20 20 00 1c

00 ff ff ff ff ff ff 00 21 63 fc 3c 00 00 00 00
00 1f 01 04 a5 22 13 78 e3 56 60 97 5b 5a 93 29
1f 50 54 00 00 00 01 01 01 01 01 01 01 01 01 01
01 01 01 01 01 01 98 3b 80 10 71 38 50 40 30 20
36 00 58 c2 10 00 00 19 00 00 00 fd 00 28 3c 46
46 0f 01 0a 20 20 20 20 20 20 00 00 00 fe 00 48
4b 43 20 4d 59 20 20 20 20 0a 20 20 00 00 00 fe
00 4d 42 31 35 36 43 4e 30 31 27 32 20 20 00 1c

----------------

Block 0, Base EDID:
  EDID Structure Version & Revision: 1.4
  Vendor & Product Identification:
    Manufacturer: HKC
    Model: 15612
    Made in: 2021
  Basic Display Parameters & Features:
    Digital display
    Bits per primary color channel: 8
    DisplayPort interface
    Maximum image size: 34 cm x 19 cm
    Gamma: 2.20
    DPMS levels: Standby Suspend Off
    Supported color formats: RGB 4:4:4
    First detailed timing includes the native pixel format and preferred refresh rate
    Display supports continuous frequencies
  Color Characteristics:
    Red  : 0.5908, 0.3564
    Green: 0.3525, 0.5761
    Blue : 0.1611, 0.1230
    White: 0.3125, 0.3281
  Established Timings I & II: none
  Standard Timings: none
  Detailed Timing Descriptors:
    DTD 1:  1920x1080   59.998742 Hz  16:9     69.599 kHz    152.560000 MHz (344 mm x 194 mm)
                 Hfront   48 Hsync  32 Hback  192 Hpol N
                 Vfront    3 Vsync   6 Vback   71 Vpol N
    Display Range Limits:
      Monitor ranges (Range Limits Only): 40-60 Hz V, 70-70 kHz H, max dotclock 150 MHz
    Alphanumeric Data String: 'HKC MY    '
    Alphanumeric Data String: 'MB156CN01'2  '
Checksum: 0x1c

----------------

Warnings:

Block 0, Base EDID:
  Missing Display Product Name.
EDID:
  Base EDID: Some timings are out of range of the Monitor Ranges:
    Maximum Clock: 152.560 MHz (Monitor: 150.000 MHz)
    Could be due to a Monitor Range off-by-one rounding issue

Failures:

Block 0, Base EDID:
  Alphanumeric Data String: One or more trailing spaces before newline.
  Alphanumeric Data String: No newline, but one or more trailing spaces.
EDID:
  Extension Block 1 started with EDID header, ignoring Extension Blocks >= 1.

EDID conformity: FAIL
