edid-decode (hex):

00 ff ff ff ff ff ff 00 26 cd 34 76 00 00 00 00
16 22 01 04 b5 50 21 78 3b b9 25 af 4d 40 a7 26
10 50 54 bf ef 80 81 c0 81 80 a9 c0 b3 00 d1 c0
01 01 01 01 01 01 f5 7c 70 a0 d0 a0 29 50 30 20
35 00 1d 4e 31 00 00 1a 00 00 00 fd 00 30 b4 ff
ff 60 01 0a 20 20 20 20 20 20 00 00 00 fc 00 50
4c 33 34 38 30 57 51 0a 20 20 20 20 00 00 00 ff
00 31 32 32 32 35 34 32 32 30 31 31 33 33 02 c0

02 03 37 f1 51 5a 5b 5c 4c 4b 45 44 4e 1f 03 12
01 02 11 05 14 10 23 09 07 07 83 01 00 00 6d 1a
00 00 02 17 30 b4 00 04 64 2b 64 2b e3 05 e3 01
e6 06 07 01 62 62 2f 4c 6d 80 a0 70 38 29 40 30
20 35 00 1d 4e 31 00 00 18 d3 bc 00 a0 a0 a0 29
50 30 20 35 00 1d 4e 31 00 00 1e ab 22 a0 a0 50
84 1a 30 30 20 36 00 1d 4e 31 00 00 1e 41 41 b8
a0 60 a0 29 50 30 20 35 00 1d 4e 31 00 00 1e 34

70 12 79 03 00 03 01 50 cf 34 01 04 6f 0d 9f 00
2f 00 1f 00 9f 05 54 00 02 80 04 00 41 d0 00 04
6f 0d 9f 00 2f 80 1f 00 9f 05 28 00 02 80 04 00
d4 5e 01 86 6f 0d 9f 00 2d 00 1f 00 9f 05 47 00
02 00 04 00 e0 76 01 06 6f 0d 9f 00 2d 00 1f 00
9f 05 28 00 02 00 04 00 07 00 0a 08 81 00 08 04
00 04 02 10 00 00 00 00 00 00 00 00 00 00 00 00
00 00 00 00 00 00 00 00 00 00 00 00 00 00 7c 90

00 ff ff ff ff ff ff 00 26 cd 34 76 00 00 00 00
16 22 01 04 b5 50 21 78 3b b9 25 af 4d 40 a7 26
10 50 54 bf ef 80 81 c0 81 80 a9 c0 b3 00 d1 c0
01 01 01 01 01 01 f5 7c 70 a0 d0 a0 29 50 30 20
35 00 1d 4e 31 00 00 1a 00 00 00 fd 00 30 b4 ff
ff 60 01 0a 20 20 20 20 20 20 00 00 00 fc 00 50
4c 33 34 38 30 57 51 0a 20 20 20 20 00 00 00 ff
00 31 32 32 32 35 34 32 32 30 31 31 33 33 02 c0

02 03 37 f1 51 5a 5b 5c 4c 4b 45 44 4e 1f 03 12
01 02 11 05 14 10 23 09 07 07 83 01 00 00 6d 1a
00 00 02 17 30 b4 00 04 64 2b 64 2b e3 05 e3 01
e6 06 07 01 62 62 2f 4c 6d 80 a0 70 38 29 40 30
20 35 00 1d 4e 31 00 00 18 d3 bc 00 a0 a0 a0 29
50 30 20 35 00 1d 4e 31 00 00 1e ab 22 a0 a0 50
84 1a 30 30 20 36 00 1d 4e 31 00 00 1e 41 41 b8
a0 60 a0 29 50 30 20 35 00 1d 4e 31 00 00 1e 34

70 12 79 03 00 03 01 50 cf 34 01 04 6f 0d 9f 00
2f 00 1f 00 9f 05 54 00 02 80 04 00 41 d0 00 04
6f 0d 9f 00 2f 80 1f 00 9f 05 28 00 02 80 04 00
d4 5e 01 86 6f 0d 9f 00 2d 00 1f 00 9f 05 47 00
02 00 04 00 e0 76 01 06 6f 0d 9f 00 2d 00 1f 00
9f 05 28 00 02 00 04 00 07 00 0a 08 81 00 08 04
00 04 02 10 00 00 00 00 00 00 00 00 00 00 00 00
00 00 00 00 00 00 00 00 00 00 00 00 00 00 7c 90

----------------

Block 0, Base EDID:
  EDID Structure Version & Revision: 1.4
  Vendor & Product Identification:
    Manufacturer: IVM
    Model: 30260
    Made in: week 22 of 2024
  Basic Display Parameters & Features:
    Digital display
    Bits per primary color channel: 10
    DisplayPort interface
    Maximum image size: 80 cm x 33 cm
    Gamma: 2.20
    DPMS levels: Off
    Supported color formats: RGB 4:4:4, YCrCb 4:4:4, YCrCb 4:2:2
    First detailed timing includes the native pixel format and preferred refresh rate
    Display supports continuous frequencies
  Color Characteristics:
    Red  : 0.6855, 0.3037
    Green: 0.2519, 0.6533
    Blue : 0.1484, 0.0644
    White: 0.3134, 0.3291
  Established Timings I & II:
    IBM     :   720x400    70.081663 Hz   9:5     31.467 kHz     28.320000 MHz
    DMT 0x04:   640x480    59.940476 Hz   4:3     31.469 kHz     25.175000 MHz
    Apple   :   640x480    66.666667 Hz   4:3     35.000 kHz     30.240000 MHz
    DMT 0x05:   640x480    72.808802 Hz   4:3     37.861 kHz     31.500000 MHz
    DMT 0x06:   640x480    75.000000 Hz   4:3     37.500 kHz     31.500000 MHz
    DMT 0x08:   800x600    56.250000 Hz   4:3     35.156 kHz     36.000000 MHz
    DMT 0x09:   800x600    60.316541 Hz   4:3     37.879 kHz     40.000000 MHz
    DMT 0x0a:   800x600    72.187572 Hz   4:3     48.077 kHz     50.000000 MHz
    DMT 0x0b:   800x600    75.000000 Hz   4:3     46.875 kHz     49.500000 MHz
    Apple   :   832x624    74.551266 Hz   4:3     49.726 kHz     57.284000 MHz
    DMT 0x10:  1024x768    60.003840 Hz   4:3     48.363 kHz     65.000000 MHz
    DMT 0x11:  1024x768    70.069359 Hz   4:3     56.476 kHz     75.000000 MHz
    DMT 0x12:  1024x768    75.028582 Hz   4:3     60.023 kHz     78.750000 MHz
    DMT 0x24:  1280x1024   75.024675 Hz   5:4     79.976 kHz    135.000000 MHz
    Apple   :  1152x870    75.061550 Hz 192:145   68.681 kHz    100.000000 MHz
  Standard Timings:
    DMT 0x55:  1280x720    60.000000 Hz  16:9     45.000 kHz     74.250000 MHz
    DMT 0x23:  1280x1024   60.019740 Hz   5:4     63.981 kHz    108.000000 MHz
    DMT 0x53:  1600x900    60.000000 Hz  16:9     60.000 kHz    108.000000 MHz (RB)
    DMT 0x3a:  1680x1050   59.954250 Hz  16:10    65.290 kHz    146.250000 MHz
    DMT 0x52:  1920x1080   60.000000 Hz  16:9     67.500 kHz    148.500000 MHz
  Detailed Timing Descriptors:
    DTD 1:  3440x1440   59.998875 Hz  43:18    88.858 kHz    319.890000 MHz (797 mm x 334 mm)
                 Hfront   48 Hsync  32 Hback   80 Hpol P
                 Vfront    3 Vsync   5 Vback   33 Vpol N
    Display Range Limits:
      Monitor ranges (Range Limits Only): 48-180 Hz V, 255-255 kHz H, max dotclock 960 MHz
    Display Product Name: 'PL3480WQ'
    Display Product Serial Number: ...
  Extension blocks: 2
Checksum: 0xc0

----------------

Block 1, CTA-861 Extension Block:
  Revision: 3
  Underscans IT Video Formats by default
  Basic audio support
  Supports YCbCr 4:4:4
  Supports YCbCr 4:2:2
  Native DTDs: 1
  Video Data Block:
    VIC  90:  2560x1080   60.000000 Hz  64:27    66.000 kHz    198.000000 MHz
    VIC  91:  2560x1080  100.000000 Hz  64:27   125.000 kHz    371.250000 MHz
    VIC  92:  2560x1080  120.000000 Hz  64:27   150.000 kHz    495.000000 MHz
    VIC  76:  1920x1080   60.000000 Hz  64:27    67.500 kHz    148.500000 MHz
    VIC  75:  1920x1080   50.000000 Hz  64:27    56.250 kHz    148.500000 MHz
    VIC  69:  1280x720    60.000000 Hz  64:27    45.000 kHz     74.250000 MHz
    VIC  68:  1280x720    50.000000 Hz  64:27    37.500 kHz     74.250000 MHz
    VIC  78:  1920x1080  120.000000 Hz  64:27   135.000 kHz    297.000000 MHz
    VIC  31:  1920x1080   50.000000 Hz  16:9     56.250 kHz    148.500000 MHz
    VIC   3:   720x480    59.940060 Hz  16:9     31.469 kHz     27.000000 MHz
    VIC  18:   720x576    50.000000 Hz  16:9     31.250 kHz     27.000000 MHz
    VIC   1:   640x480    59.940476 Hz   4:3     31.469 kHz     25.175000 MHz
    VIC   2:   720x480    59.940060 Hz   4:3     31.469 kHz     27.000000 MHz
    VIC  17:   720x576    50.000000 Hz   4:3     31.250 kHz     27.000000 MHz
    VIC   5:  1920x1080i  60.000000 Hz  16:9     33.750 kHz     74.250000 MHz
    VIC  20:  1920x1080i  50.000000 Hz  16:9     28.125 kHz     74.250000 MHz
    VIC  16:  1920x1080   60.000000 Hz  16:9     67.500 kHz    148.500000 MHz
  Audio Data Block:
    Linear PCM:
      Max channels: 2
      Supported sample rates (kHz): 48 44.1 32
      Supported sample sizes (bits): 24 20 16
  Speaker Allocation Data Block:
    FL/FR - Front Left/Right
  Vendor-Specific Data Block (AMD), OUI 00-00-1A:
    Version: 2
    Feature Caps: 0x17
      Global Backlight Control Supported
    Minimum Refresh Rate: 48 Hz
    Maximum Refresh Rate: 180 Hz
    Flags 1.x: 0x00
    Flags 2.x: 0x04
      ST 2084 (PQ) EOTF Supported
      Linear EOTF (Windows scRGB, 0.0 - 125.0) Supported
      Gamma 2.2 EOTF Supported
      BT.2020 Gamut Supported
    Maximum luminance: 100 (436.203 cd/m^2)
    Minimum luminance: 43 (0.124 cd/m^2)
    Maximum luminance (minimum backlight): 100 (436.203 cd/m^2)
    Minimum luminance (minimum backlight): 43 (0.124 cd/m^2)
  Colorimetry Data Block:
    xvYCC601
    xvYCC709
    BT2020cYCC
    BT2020YCC
    BT2020RGB
    Gamut Boundary Description Metadata Profile P0
  HDR Static Metadata Data Block:
    Electro optical transfer functions:
      Traditional gamma - SDR luminance range
      Traditional gamma - HDR luminance range
      SMPTE ST2084
    Supported static metadata descriptors:
      Static metadata type 1
    Desired content max luminance: 98 (417.710 cd/m^2)
    Desired content max frame-average luminance: 98 (417.710 cd/m^2)
    Desired content min luminance: 47 (0.142 cd/m^2)
  Detailed Timing Descriptors:
    DTD 2:  1920x1080  119.999314 Hz  16:9    134.519 kHz    279.800000 MHz (797 mm x 334 mm)
                 Hfront   48 Hsync  32 Hback   80 Hpol N
                 Vfront    3 Vsync   5 Vback   33 Vpol N
    DTD 3:  2560x1440  119.997915 Hz  16:9    177.717 kHz    483.390000 MHz (797 mm x 334 mm)
                 Hfront   48 Hsync  32 Hback   80 Hpol P
                 Vfront    3 Vsync   5 Vback   33 Vpol P
    DTD 4:  1440x900    59.901458 Hz  16:10    55.469 kHz     88.750000 MHz (797 mm x 334 mm)
                 Hfront   48 Hsync  32 Hback   80 Hpol P
                 Vfront    3 Vsync   6 Vback   17 Vpol P
    DTD 5:  1720x1440   59.997558 Hz  43:36    88.856 kHz    167.050000 MHz (797 mm x 334 mm)
                 Hfront   48 Hsync  32 Hback   80 Hpol P
                 Vfront    3 Vsync   5 Vback   33 Vpol P
Checksum: 0x34

----------------

Block 2, DisplayID Extension Block:
  Version: 1.2
  Extension Count: 0
  Display Product Type: Standalone display device
  Video Timing Modes Type 1 - Detailed Timings Data Block:
    DTD:  3440x1440  144.000000 Hz  16:9    219.600 kHz    790.560000 MHz (aspect 16:9, no 3D stereo)
               Hfront   48 Hsync  32 Hback   80 Hpol N
               Vfront    3 Vsync   5 Vback   77 Vpol P
    DTD:  3440x1440   99.996249 Hz  16:9    148.094 kHz    533.140000 MHz (aspect 16:9, no 3D stereo)
               Hfront   48 Hsync  32 Hback   80 Hpol P
               Vfront    3 Vsync   5 Vback   33 Vpol P
    DTD:  3440x1440  165.000367 Hz  64:27   249.481 kHz    898.130000 MHz (aspect 64:27, no 3D stereo, preferred)
               Hfront   46 Hsync  32 Hback   82 Hpol N
               Vfront    3 Vsync   5 Vback   64 Vpol N
    DTD:  3440x1440  180.000375 Hz  64:27   266.581 kHz    959.690000 MHz (aspect 64:27, no 3D stereo)
               Hfront   46 Hsync  32 Hback   82 Hpol N
               Vfront    3 Vsync   5 Vback   33 Vpol N
  Supported Timing Modes Type 1 - VESA DMT Timings Data Block:
    DMT 0x04:   640x480    59.940476 Hz   4:3     31.469 kHz     25.175000 MHz
    DMT 0x09:   800x600    60.316541 Hz   4:3     37.879 kHz     40.000000 MHz
    DMT 0x10:  1024x768    60.003840 Hz   4:3     48.363 kHz     65.000000 MHz
    DMT 0x1c:  1280x800    59.810326 Hz  16:10    49.702 kHz     83.500000 MHz
    DMT 0x23:  1280x1024   60.019740 Hz   5:4     63.981 kHz    108.000000 MHz
    DMT 0x33:  1600x1200   60.000000 Hz   4:3     75.000 kHz    162.000000 MHz
    DMT 0x3a:  1680x1050   59.954250 Hz  16:10    65.290 kHz    146.250000 MHz
    DMT 0x45:  1920x1200   59.884600 Hz  16:10    74.556 kHz    193.250000 MHz
  Checksum: 0x7c
Checksum: 0x90

----------------

Warnings:

Block 1, CTA-861 Extension Block:
  Video Data Block: VIC 90 and the first DTD are not identical. Is this intended?
  Colorimetry Data Block: Set the sRGB colorimetry bit to avoid interop issues.
  Detailed Timing Descriptor #2: Image size is 797x334 mm, but based on the picture AR it should be 593x334 mm.
  Detailed Timing Descriptor #3: Image size is 797x334 mm, but based on the picture AR it should be 593x334 mm.
  Detailed Timing Descriptor #4: DTD is similar but not identical to DMT 0x2e.
  Detailed Timing Descriptor #4: Image size is 797x334 mm, but based on the picture AR it should be 534x334 mm.
  Detailed Timing Descriptor #5: Image size is 797x334 mm, but based on the picture AR it should be 398x334 mm.
EDID:
  Base EDID: Some timings are out of range of the Monitor Ranges:
    Horizontal Freq: 28.125 - 266.580 kHz (Monitor: 255.000 - 255.000 kHz)

Failures:

Block 1, CTA-861 Extension Block:
  Missing VCDB, needed for Set Selectable RGB Quantization to avoid interop issues.
EDID:
  Extension Block 3 started with EDID header, ignoring Extension Blocks >= 3.
  DisplayID: Missing DisplayID Display Parameters Data Block.

EDID conformity: FAIL
