edid-decode (hex):

00 ff ff ff ff ff ff 00 26 cd 4b 76 00 00 00 00
0b 23 01 04 b5 50 21 78 3b 9d 05 ae 50 42 a4 25
12 50 54 bf cf 00 71 4f 81 40 81 80 81 c0 95 00
b3 00 d1 c0 01 01 f5 7c 70 a0 d0 a0 29 50 20 30
53 00 1d 4e 31 00 00 1a 00 00 00 ff 00 31 32 35
31 36 35 31 31 30 30 34 31 37 00 00 00 fd 0c 30
b4 0b 0b 60 01 0a 20 20 20 20 20 20 00 00 00 fc
00 50 4c 33 34 38 34 57 51 0a 20 20 20 20 02 98

02 03 35 f1 4c 4e 4c 4b 44 3f 90 1f 04 13 12 03
01 23 09 07 07 83 01 00 00 6d 1a 00 00 02 01 30
b4 00 00 00 00 00 00 e3 05 e3 01 e2 00 ff e6 06
07 01 63 60 00 56 5e 00 a0 a0 a0 29 50 30 20 35
00 1d 4e 31 00 00 1a c8 dd 70 40 d1 a0 46 50 30
20 35 00 1d 4e 31 00 00 1a 6f c2 00 a0 a0 a0 55
50 30 20 35 00 1d 4e 31 00 00 1a 00 00 00 00 00
00 00 00 00 00 00 00 00 00 00 00 00 00 00 00 e5

70 12 79 03 00 03 00 50 3f 3d 01 04 6f 0d 3f 01
2f 80 1f 00 9f 05 3b 00 02 00 04 00 c7 63 01 04
6f 0d ef 00 2f 80 1f 00 9f 05 3b 00 02 00 09 00
5f 08 01 04 6f 0d 3f 01 2f 80 1f 00 9f 05 3b 00
02 00 04 00 75 70 01 04 6f 0d 77 00 2f 80 1f 00
9f 05 1f 00 04 00 02 00 00 00 00 00 00 00 00 00
00 00 00 00 00 00 00 00 00 00 00 00 00 00 00 00
00 00 00 00 00 00 00 00 00 00 00 00 00 00 8e 90

00 ff ff ff ff ff ff 00 26 cd 4b 76 00 00 00 00
0b 23 01 04 b5 50 21 78 3b 9d 05 ae 50 42 a4 25
12 50 54 bf cf 00 71 4f 81 40 81 80 81 c0 95 00
b3 00 d1 c0 01 01 f5 7c 70 a0 d0 a0 29 50 20 30
53 00 1d 4e 31 00 00 1a 00 00 00 ff 00 31 32 35
31 36 35 31 31 30 30 34 31 37 00 00 00 fd 0c 30
b4 0b 0b 60 01 0a 20 20 20 20 20 20 00 00 00 fc
00 50 4c 33 34 38 34 57 51 0a 20 20 20 20 02 98

02 03 35 f1 4c 4e 4c 4b 44 3f 90 1f 04 13 12 03
01 23 09 07 07 83 01 00 00 6d 1a 00 00 02 01 30
b4 00 00 00 00 00 00 e3 05 e3 01 e2 00 ff e6 06
07 01 63 60 00 56 5e 00 a0 a0 a0 29 50 30 20 35
00 1d 4e 31 00 00 1a c8 dd 70 40 d1 a0 46 50 30
20 35 00 1d 4e 31 00 00 1a 6f c2 00 a0 a0 a0 55
50 30 20 35 00 1d 4e 31 00 00 1a 00 00 00 00 00
00 00 00 00 00 00 00 00 00 00 00 00 00 00 00 e5

70 12 79 03 00 03 00 50 3f 3d 01 04 6f 0d 3f 01
2f 80 1f 00 9f 05 3b 00 02 00 04 00 c7 63 01 04
6f 0d ef 00 2f 80 1f 00 9f 05 3b 00 02 00 09 00
5f 08 01 04 6f 0d 3f 01 2f 80 1f 00 9f 05 3b 00
02 00 04 00 75 70 01 04 6f 0d 77 00 2f 80 1f 00
9f 05 1f 00 04 00 02 00 00 00 00 00 00 00 00 00
00 00 00 00 00 00 00 00 00 00 00 00 00 00 00 00
00 00 00 00 00 00 00 00 00 00 00 00 00 00 8e 90

----------------

Block 0, Base EDID:
  EDID Structure Version & Revision: 1.4
  Vendor & Product Identification:
    Manufacturer: IVM
    Model: 30283
    Made in: week 11 of 2025
  Basic Display Parameters & Features:
    Digital display
    Bits per primary color channel: 10
    DisplayPort interface
    Maximum image size: 80 cm x 33 cm
    Gamma: 2.20
    DPMS levels: Off
    Supported color formats: RGB 4:4:4, YCrCb 4:4:4, YCrCb 4:2:2
    First detailed timing includes the native pixel format and preferred refresh rate
    Display supports continuous frequencies
  Color Characteristics:
    Red  : 0.6816, 0.3134
    Green: 0.2607, 0.6416
    Blue : 0.1445, 0.0703
    White: 0.3134, 0.3291
  Established Timings I & II:
    IBM     :   720x400    70.081663 Hz   9:5     31.467 kHz     28.320000 MHz
    DMT 0x04:   640x480    59.940476 Hz   4:3     31.469 kHz     25.175000 MHz
    Apple   :   640x480    66.666667 Hz   4:3     35.000 kHz     30.240000 MHz
    DMT 0x05:   640x480    72.808802 Hz   4:3     37.861 kHz     31.500000 MHz
    DMT 0x06:   640x480    75.000000 Hz   4:3     37.500 kHz     31.500000 MHz
    DMT 0x08:   800x600    56.250000 Hz   4:3     35.156 kHz     36.000000 MHz
    DMT 0x09:   800x600    60.316541 Hz   4:3     37.879 kHz     40.000000 MHz
    DMT 0x0a:   800x600    72.187572 Hz   4:3     48.077 kHz     50.000000 MHz
    DMT 0x0b:   800x600    75.000000 Hz   4:3     46.875 kHz     49.500000 MHz
    DMT 0x10:  1024x768    60.003840 Hz   4:3     48.363 kHz     65.000000 MHz
    DMT 0x11:  1024x768    70.069359 Hz   4:3     56.476 kHz     75.000000 MHz
    DMT 0x12:  1024x768    75.028582 Hz   4:3     60.023 kHz     78.750000 MHz
    DMT 0x24:  1280x1024   75.024675 Hz   5:4     79.976 kHz    135.000000 MHz
  Standard Timings:
    DMT 0x15:  1152x864    75.000000 Hz   4:3     67.500 kHz    108.000000 MHz
    DMT 0x20:  1280x960    60.000000 Hz   4:3     60.000 kHz    108.000000 MHz
    DMT 0x23:  1280x1024   60.019740 Hz   5:4     63.981 kHz    108.000000 MHz
    DMT 0x55:  1280x720    60.000000 Hz  16:9     45.000 kHz     74.250000 MHz
    DMT 0x2f:  1440x900    59.887445 Hz  16:10    55.935 kHz    106.500000 MHz
    DMT 0x3a:  1680x1050   59.954250 Hz  16:10    65.290 kHz    146.250000 MHz
    DMT 0x52:  1920x1080   60.000000 Hz  16:9     67.500 kHz    148.500000 MHz
  Detailed Timing Descriptors:
    DTD 1:  3440x1440   59.998875 Hz  43:18    88.858 kHz    319.890000 MHz (797 mm x 334 mm)
                 Hfront   32 Hsync  48 Hback   80 Hpol P
                 Vfront    5 Vsync   3 Vback   33 Vpol N
    Display Product Serial Number: ...
    Display Range Limits:
      Monitor ranges (Range Limits Only): 48-180 Hz V, 266-266 kHz H, max dotclock 960 MHz
    Display Product Name: 'PL3484WQ'
  Extension blocks: 2
Checksum: 0x98

----------------

Block 1, CTA-861 Extension Block:
  Revision: 3
  Underscans IT Video Formats by default
  Basic audio support
  Supports YCbCr 4:4:4
  Supports YCbCr 4:2:2
  Native DTDs: 1
  Video Data Block:
    VIC  78:  1920x1080  120.000000 Hz  64:27   135.000 kHz    297.000000 MHz
    VIC  76:  1920x1080   60.000000 Hz  64:27    67.500 kHz    148.500000 MHz
    VIC  75:  1920x1080   50.000000 Hz  64:27    56.250 kHz    148.500000 MHz
    VIC  68:  1280x720    50.000000 Hz  64:27    37.500 kHz     74.250000 MHz
    VIC  63:  1920x1080  120.000000 Hz  16:9    135.000 kHz    297.000000 MHz
    VIC  16:  1920x1080   60.000000 Hz  16:9     67.500 kHz    148.500000 MHz (native)
    VIC  31:  1920x1080   50.000000 Hz  16:9     56.250 kHz    148.500000 MHz
    VIC   4:  1280x720    60.000000 Hz  16:9     45.000 kHz     74.250000 MHz
    VIC  19:  1280x720    50.000000 Hz  16:9     37.500 kHz     74.250000 MHz
    VIC  18:   720x576    50.000000 Hz  16:9     31.250 kHz     27.000000 MHz
    VIC   3:   720x480    59.940060 Hz  16:9     31.469 kHz     27.000000 MHz
    VIC   1:   640x480    59.940476 Hz   4:3     31.469 kHz     25.175000 MHz
  Audio Data Block:
    Linear PCM:
      Max channels: 2
      Supported sample rates (kHz): 48 44.1 32
      Supported sample sizes (bits): 24 20 16
  Speaker Allocation Data Block:
    FL/FR - Front Left/Right
  Vendor-Specific Data Block (AMD), OUI 00-00-1A:
    Version: 2
    Feature Caps: 0x01
    Minimum Refresh Rate: 48 Hz
    Maximum Refresh Rate: 180 Hz
    Flags 1.x: 0x00
    Flags 2.x: 0x00
  Colorimetry Data Block:
    xvYCC601
    xvYCC709
    BT2020cYCC
    BT2020YCC
    BT2020RGB
    Gamut Boundary Description Metadata Profile P0
  Video Capability Data Block:
    YCbCr quantization: Selectable (via AVI YQ)
    RGB quantization: Selectable (via AVI Q)
    PT scan behavior: Supports both over- and underscan
    IT scan behavior: Supports both over- and underscan
    CE scan behavior: Supports both over- and underscan
  HDR Static Metadata Data Block:
    Electro optical transfer functions:
      Traditional gamma - SDR luminance range
      Traditional gamma - HDR luminance range
      SMPTE ST2084
    Supported static metadata descriptors:
      Static metadata type 1
    Desired content max luminance: 99 (426.856 cd/m^2)
    Desired content max frame-average luminance: 96 (400.000 cd/m^2)
    Desired content min luminance: 0 (0.000 cd/m^2)
  Detailed Timing Descriptors:
    DTD 2:  2560x1440   59.950550 Hz  16:9     88.787 kHz    241.500000 MHz (797 mm x 334 mm)
                 Hfront   48 Hsync  32 Hback   80 Hpol P
                 Vfront    3 Vsync   5 Vback   33 Vpol N
    DTD 3:  3440x1440  100.000000 Hz  43:18   151.000 kHz    567.760000 MHz (797 mm x 334 mm)
                 Hfront   48 Hsync  32 Hback  240 Hpol P
                 Vfront    3 Vsync   5 Vback   62 Vpol N
    DTD 4:  2560x1440  119.997589 Hz  16:9    182.996 kHz    497.750000 MHz (797 mm x 334 mm)
                 Hfront   48 Hsync  32 Hback   80 Hpol P
                 Vfront    3 Vsync   5 Vback   77 Vpol N
Checksum: 0xe5  Unused space in Extension Block: 20 bytes

----------------

Block 2, DisplayID Extension Block:
  Version: 1.2
  Extension Count: 0
  Display Product Type: Standalone display device
  Video Timing Modes Type 1 - Detailed Timings Data Block:
    DTD:  3440x1440  144.000000 Hz  16:9    216.000 kHz    812.160000 MHz (aspect 16:9, no 3D stereo)
               Hfront   48 Hsync  32 Hback  240 Hpol P
               Vfront    3 Vsync   5 Vback   52 Vpol N
    DTD:  3440x1440  165.000000 Hz  16:9    247.500 kHz    910.800000 MHz (aspect 16:9, no 3D stereo)
               Hfront   48 Hsync  32 Hback  160 Hpol P
               Vfront    3 Vsync  10 Vback   47 Vpol N
    DTD:  3440x1440  120.000000 Hz  16:9    180.000 kHz    676.800000 MHz (aspect 16:9, no 3D stereo)
               Hfront   48 Hsync  32 Hback  240 Hpol P
               Vfront    3 Vsync   5 Vback   52 Vpol N
    DTD:  3440x1440  180.000458 Hz  16:9    264.961 kHz    943.260000 MHz (aspect 16:9, no 3D stereo)
               Hfront   48 Hsync  32 Hback   40 Hpol P
               Vfront    5 Vsync   3 Vback   24 Vpol N
  Checksum: 0x8e
Checksum: 0x90

----------------

Warnings:

Block 1, CTA-861 Extension Block:
  Video Data Block: VIC 78 and the first DTD are not identical. Is this intended?
  Colorimetry Data Block: Set the sRGB colorimetry bit to avoid interop issues.
  Video Capability Data Block: S_PT is equal to S_IT and S_CE, so should be set to 0 instead.
  Detailed Timing Descriptor #2: Image size is 797x334 mm, but based on the picture AR it should be 593x334 mm.
  Detailed Timing Descriptor #4: Image size is 797x334 mm, but based on the picture AR it should be 593x334 mm.
EDID:
  Base EDID: Some timings are out of range of the Monitor Ranges:
    Horizontal Freq: 31.250 - 264.960 kHz (Monitor: 266.000 - 266.000 kHz)

Failures:

EDID:
  Extension Block 3 started with EDID header, ignoring Extension Blocks >= 3.
  CTA-861: Native progressive timings are a mix of several resolutions.
  DisplayID: Missing DisplayID Display Parameters Data Block.
  DisplayID: DisplayID expects at least one preferred timing.

EDID conformity: FAIL
