edid-decode (hex):

00 ff ff ff ff ff ff 00 36 68 99 09 00 00 00 00
10 1e 01 04 b5 6a 47 78 26 ee 91 a3 54 4c 99 26
0f 50 54 00 00 00 01 01 01 01 01 01 01 01 01 01
01 01 01 01 01 01 e5 fe 00 90 f1 00 05 a0 50 50
12 00 29 c6 42 00 00 18 00 00 00 fe 00 44 56 0a
20 20 20 20 20 20 20 20 20 20 00 00 00 fc 00 53
75 72 66 61 63 65 20 48 75 62 20 32 00 00 00 fd
00 3b 3c 1e 9a 42 00 0a 20 20 20 20 20 20 00 d7

00 ff ff ff ff ff ff 00 36 68 99 09 00 00 00 00
10 1e 01 04 b5 6a 47 78 26 ee 91 a3 54 4c 99 26
0f 50 54 00 00 00 01 01 01 01 01 01 01 01 01 01
01 01 01 01 01 01 e5 fe 00 90 f1 00 05 a0 50 50
12 00 29 c6 42 00 00 18 00 00 00 fe 00 44 56 0a
20 20 20 20 20 20 20 20 20 20 00 00 00 fc 00 53
75 72 66 61 63 65 20 48 75 62 20 32 00 00 00 fd
00 3b 3c 1e 9a 42 00 0a 20 20 20 20 20 20 00 d7

----------------

Block 0, Base EDID:
  EDID Structure Version & Revision: 1.4
  Vendor & Product Identification:
    Manufacturer: MSH
    Model: 2457
    Made in: week 16 of 2020
  Basic Display Parameters & Features:
    Digital display
    Bits per primary color channel: 10
    DisplayPort interface
    Maximum image size: 106 cm x 71 cm
    Gamma: 2.20
    DPMS levels: Off
    Supported color formats: RGB 4:4:4
    Default (sRGB) color space is primary color space
    First detailed timing includes the native pixel format and preferred refresh rate
  Color Characteristics:
    Red  : 0.6396, 0.3300
    Green: 0.2998, 0.5996
    Blue : 0.1503, 0.0595
    White: 0.3125, 0.3291
  Established Timings I & II: none
  Standard Timings: none
  Detailed Timing Descriptors:
    DTD 1:  3840x2560   59.999448 Hz   3:2    153.899 kHz    652.530000 MHz (1065 mm x 710 mm)
                 Hfront   80 Hsync  80 Hback  240 Hpol N
                 Vfront    1 Vsync   2 Vback    2 Vpol N
    Alphanumeric Data String: 'DV'
    Display Product Name: 'Surface Hub 2'
    Display Range Limits:
      Monitor ranges (GTF): 59-60 Hz V, 30-154 kHz H, max dotclock 660 MHz
Checksum: 0xd7

----------------

Warnings:

Block 0, Base EDID:
  Display Range Limits: GTF support is deprecated in EDID 1.4.

Failures:

Block 0, Base EDID:
  Display Range Limits: GTF is supported, but the display does not support continuous frequencies.
EDID:
  Extension Block 1 started with EDID header, ignoring Extension Blocks >= 1.

EDID conformity: FAIL
