edid-decode (hex):

00 ff ff ff ff ff ff 00 1e 6d db 5c 71 7e 0a 00
0a 23 01 04 b5 3b 21 78 f9 02 15 b2 4e 3e b5 26
0d 50 54 21 09 00 d1 c0 61 40 45 40 31 40 01 01
01 01 01 01 01 01 56 5e 00 a0 a0 a0 29 50 30 20
35 00 4e 4d 21 00 00 1a 00 00 00 fd 0e 30 19 d7
d7 82 01 0a 20 20 20 20 20 20 00 00 00 fc 00 4c
47 20 55 4c 54 52 41 47 45 41 52 2b 00 00 00 ff
00 35 31 30 52 4d 48 52 4c 37 37 32 39 0a 02 25

02 03 34 73 23 0f 07 07 83 4f 00 00 41 61 e2 00
6a e2 0f 01 e3 05 c0 00 e6 06 05 01 73 57 01 74
1a 00 00 03 03 30 f0 00 a0 73 01 57 02 18 01 00
00 00 00 00 ef e7 00 a0 a0 a0 4c 50 30 20 35 00
4e 4d 21 00 00 1a 00 00 00 00 00 00 00 00 00 00
00 00 00 00 00 00 00 00 00 00 00 00 00 00 00 00
00 00 00 00 00 00 00 00 00 00 00 00 00 00 00 00
00 00 00 00 00 00 00 00 00 00 00 00 00 00 00 16

70 12 79 03 00 01 00 0c 10 17 09 0d 00 0a a0 05
90 78 4e 99 0f 00 0a a4 14 0e 0e 07 01 23 00 00
00 03 01 3c 21 d4 01 84 ff 09 9f 00 07 80 1f 00
9f 05 84 00 3a 00 07 00 fc 9c 01 04 ff 09 9f 00
07 80 1f 00 9f 05 b2 00 51 00 07 00 01 ed 00 04
7f 07 9f 00 07 80 1f 00 37 04 86 00 3b 00 07 00
00 00 00 00 00 00 00 00 00 00 00 00 00 00 00 00
00 00 00 00 00 00 00 00 00 00 00 00 00 00 aa 90

00 ff ff ff ff ff ff 00 1e 6d db 5c 71 7e 0a 00
0a 23 01 04 b5 3b 21 78 f9 02 15 b2 4e 3e b5 26
0d 50 54 21 09 00 d1 c0 61 40 45 40 31 40 01 01
01 01 01 01 01 01 56 5e 00 a0 a0 a0 29 50 30 20
35 00 4e 4d 21 00 00 1a 00 00 00 fd 0e 30 19 d7
d7 82 01 0a 20 20 20 20 20 20 00 00 00 fc 00 4c
47 20 55 4c 54 52 41 47 45 41 52 2b 00 00 00 ff
00 35 31 30 52 4d 48 52 4c 37 37 32 39 0a 02 25

02 03 34 73 23 0f 07 07 83 4f 00 00 41 61 e2 00
6a e2 0f 01 e3 05 c0 00 e6 06 05 01 73 57 01 74
1a 00 00 03 03 30 f0 00 a0 73 01 57 02 18 01 00
00 00 00 00 ef e7 00 a0 a0 a0 4c 50 30 20 35 00
4e 4d 21 00 00 1a 00 00 00 00 00 00 00 00 00 00
00 00 00 00 00 00 00 00 00 00 00 00 00 00 00 00
00 00 00 00 00 00 00 00 00 00 00 00 00 00 00 00
00 00 00 00 00 00 00 00 00 00 00 00 00 00 00 16

70 12 79 03 00 01 00 0c 10 17 09 0d 00 0a a0 05
90 78 4e 99 0f 00 0a a4 14 0e 0e 07 01 23 00 00
00 03 01 3c 21 d4 01 84 ff 09 9f 00 07 80 1f 00
9f 05 84 00 3a 00 07 00 fc 9c 01 04 ff 09 9f 00
07 80 1f 00 9f 05 b2 00 51 00 07 00 01 ed 00 04
7f 07 9f 00 07 80 1f 00 37 04 86 00 3b 00 07 00
00 00 00 00 00 00 00 00 00 00 00 00 00 00 00 00
00 00 00 00 00 00 00 00 00 00 00 00 00 00 aa 90

----------------

Block 0, Base EDID:
  EDID Structure Version & Revision: 1.4
  Vendor & Product Identification:
    Manufacturer: GSM
    Model: 23771
    Serial Number: ...
    Made in: week 10 of 2025
  Basic Display Parameters & Features:
    Digital display
    Bits per primary color channel: 10
    DisplayPort interface
    Maximum image size: 59 cm x 33 cm
    Gamma: 2.20
    DPMS levels: Standby Suspend Off
    Supported color formats: RGB 4:4:4, YCrCb 4:4:4, YCrCb 4:2:2
    First detailed timing does not include the native pixel format and preferred refresh rate
    Display supports continuous frequencies
  Color Characteristics:
    Red  : 0.6953, 0.3046
    Green: 0.2421, 0.7089
    Blue : 0.1484, 0.0517
    White: 0.3134, 0.3291
  Established Timings I & II:
    DMT 0x04:   640x480    59.940476 Hz   4:3     31.469 kHz     25.175000 MHz
    DMT 0x09:   800x600    60.316541 Hz   4:3     37.879 kHz     40.000000 MHz
    DMT 0x10:  1024x768    60.003840 Hz   4:3     48.363 kHz     65.000000 MHz
    DMT 0x24:  1280x1024   75.024675 Hz   5:4     79.976 kHz    135.000000 MHz
  Standard Timings:
    DMT 0x52:  1920x1080   60.000000 Hz  16:9     67.500 kHz    148.500000 MHz
    DMT 0x10:  1024x768    60.003840 Hz   4:3     48.363 kHz     65.000000 MHz
    DMT 0x09:   800x600    60.316541 Hz   4:3     37.879 kHz     40.000000 MHz
    DMT 0x04:   640x480    59.940476 Hz   4:3     31.469 kHz     25.175000 MHz
  Detailed Timing Descriptors:
    DTD 1:  2560x1440   59.950550 Hz  16:9     88.787 kHz    241.500000 MHz (590 mm x 333 mm)
                 Hfront   48 Hsync  32 Hback   80 Hpol P
                 Vfront    3 Vsync   5 Vback   33 Vpol N
    Display Range Limits:
      Monitor ranges (Range Limits Only): 48-280 Hz V, 470-470 kHz H, max dotclock 1300 MHz
    Display Product Name: 'LG ULTRAGEAR+'
    Display Product Serial Number: ...
  Extension blocks: 2
Checksum: 0x25

----------------

Block 1, CTA-861 Extension Block:
  Revision: 3
  Basic audio support
  Supports YCbCr 4:4:4
  Supports YCbCr 4:2:2
  Native DTDs: 3
  Audio Data Block:
    Linear PCM:
      Max channels: 8
      Supported sample rates (kHz): 48 44.1 32
      Supported sample sizes (bits): 24 20 16
  Speaker Allocation Data Block:
    FL/FR - Front Left/Right
    LFE1 - Low Frequency Effects 1
    FC - Front Center
    LS/RS - Left/Right Surround
    BL/BR - Back Left/Right
  Video Data Block:
    VIC  97:  3840x2160   60.000000 Hz  16:9    135.000 kHz    594.000000 MHz
  Video Capability Data Block:
    YCbCr quantization: No Data
    RGB quantization: Selectable (via AVI Q)
    PT scan behavior: Always Underscanned
    IT scan behavior: Always Underscanned
    CE scan behavior: Always Underscanned
  YCbCr 4:2:0 Capability Map Data Block:
    VIC  97:  3840x2160   60.000000 Hz  16:9    135.000 kHz    594.000000 MHz
  Colorimetry Data Block:
    BT2020YCC
    BT2020RGB
  HDR Static Metadata Data Block:
    Electro optical transfer functions:
      Traditional gamma - SDR luminance range
      SMPTE ST2084
    Supported static metadata descriptors:
      Static metadata type 1
    Desired content max luminance: 115 (603.666 cd/m^2)
    Desired content max frame-average luminance: 87 (329.151 cd/m^2)
    Desired content min luminance: 1 (0.000 cd/m^2)
  Vendor-Specific Data Block (AMD), OUI 00-00-1A:
    Version: 3
    Feature Caps: 0x03
    Minimum Refresh Rate: 48 Hz
    Maximum Refresh Rate: 280 Hz
    Flags 1.x: 0x00
    Flags 2.x: 0xa0
      ST 2084 (PQ) EOTF Supported
      Linear EOTF (Windows scRGB, 0.0 - 125.0) Supported
      BT.2020 Gamut Supported
    Maximum luminance: 115 (603.666 cd/m^2)
    Minimum luminance: 1 (0.000 cd/m^2)
  Detailed Timing Descriptors:
    DTD 2:  2560x1440  143.991056 Hz  16:9    218.290 kHz    593.750000 MHz (590 mm x 333 mm)
                 Hfront   48 Hsync  32 Hback   80 Hpol P
                 Vfront    3 Vsync   5 Vback   68 Vpol N
Checksum: 0x16  Unused space in Extension Block: 57 bytes

----------------

Block 2, DisplayID Extension Block:
  Version: 1.2
  Extension Count: 0
  Display Product Type: Standalone display device
  Display Parameters Data Block (0x01):
    Image size: 590.4 mm x 333.7 mm
    Display native pixel format: 2560x1440
    Feature support flags:
      Power management (DPM)
      Audio support on video interface
    Gamma: 2.20
    Aspect ratio: 1.78
    Dynamic bpc native: 10
    Dynamic bpc overall: 10
  Display Interface Data Block:
    Interface Type: DisplayPort
    Number of Links: 4
    Interface Standard Version: 1.4
    Supported bpc for RGB encoding: 8, 10, 12
    Supported bpc for YCbCr 4:4:4 encoding: 8, 10, 12
    Supported bpc for YCbCr 4:2:2 encoding: 8, 10, 12
    Supported Content Protection: HDCP 2.3
    Spread Spectrum: None
  Video Timing Modes Type 1 - Detailed Timings Data Block:
    DTD:  2560x1440  280.098912 Hz  16:9    440.596 kHz   1198.420000 MHz (aspect 16:9, no 3D stereo, preferred)
               Hfront    8 Hsync  32 Hback  120 Hpol P
               Vfront   59 Vsync   8 Vback   66 Vpol N
    DTD:  2560x1440  240.083294 Hz  16:9    388.695 kHz   1057.250000 MHz (aspect 16:9, no 3D stereo)
               Hfront    8 Hsync  32 Hback  120 Hpol P
               Vfront   82 Vsync   8 Vback   89 Vpol N
    DTD:  1920x1080  240.083887 Hz  16:9    291.702 kHz    606.740000 MHz (aspect 16:9, no 3D stereo)
               Hfront    8 Hsync  32 Hback  120 Hpol P
               Vfront   60 Vsync   8 Vback   67 Vpol N
  Checksum: 0xaa
Checksum: 0x90

----------------

Warnings:

Block 1, CTA-861 Extension Block:
  IT Video Formats are overscanned by default, but normally this should be underscanned.
  Video Data Block: VIC 97 and the first DTD are not identical. Is this intended?
  Video Capability Data Block: Set Selectable YCbCr Quantization to avoid interop issues.
  Video Capability Data Block: S_PT is equal to S_IT and S_CE, so should be set to 0 instead.
  Colorimetry Data Block: Set the sRGB colorimetry bit to avoid interop issues.
  Display Product Serial Number is set, so the Serial Number in the Base EDID should be 0.
EDID:
  Base EDID: Some timings are out of range of the Monitor Ranges:
    Horizontal Freq: 31.468 - 440.595 kHz (Monitor: 470.000 - 470.000 kHz)
  CTA-861: Native progressive resolution of 2560x1440 is smaller than the max preferred progressive resolution 3840x2160.

Failures:

Block 1, CTA-861 Extension Block:
  There are more Native DTDs (3) than DTDs (2).
  Video Capability Data Block: IT video formats are always underscanned, but bit 7 of Byte 3 of the CTA-861 Extension header is set to overscanned.
EDID:
  Extension Block 3 started with EDID header, ignoring Extension Blocks >= 3.

EDID conformity: FAIL
