edid-decode (hex):

00 ff ff ff ff ff ff 00 20 2e 00 19 01 00 00 00
10 1f 01 03 80 28 1b 78 2a 80 c5 a6 57 49 9b 23
12 50 54 bf ef 80 81 00 81 c0 81 80 81 40 71 40
71 4f 01 01 01 01 9a 29 a0 d0 51 84 22 30 50 98
36 00 99 00 11 00 00 1c 0e 1f 00 80 51 00 20 30
40 80 37 00 20 56 00 00 00 1c 99 21 56 aa 51 00
20 30 46 8f 33 00 20 56 00 00 00 1c 00 00 00 fc
00 4d 43 54 2d 31 39 48 44 4d 49 0a 20 20 00 f3

00 ff ff ff ff ff ff 00 20 2e 00 19 01 00 00 00
10 1f 01 03 80 28 1b 78 2a 80 c5 a6 57 49 9b 23
12 50 54 bf ef 80 81 00 81 c0 81 80 81 40 71 40
71 4f 01 01 01 01 9a 29 a0 d0 51 84 22 30 50 98
36 00 99 00 11 00 00 1c 0e 1f 00 80 51 00 20 30
40 80 37 00 20 56 00 00 00 1c 99 21 56 aa 51 00
20 30 46 8f 33 00 20 56 00 00 00 1c 00 00 00 fc
00 4d 43 54 2d 31 39 48 44 4d 49 0a 20 20 00 f3

----------------

Block 0, Base EDID:
  EDID Structure Version & Revision: 1.3
  Vendor & Product Identification:
    Manufacturer: HAN
    Model: 6400
    Serial Number: ...
    Made in: week 16 of 2021
  Basic Display Parameters & Features:
    Digital display
    Maximum image size: 40 cm x 27 cm
    Gamma: 2.20
    DPMS levels: Off
    RGB color display
    First detailed timing is the preferred timing
  Color Characteristics:
    Red  : 0.6503, 0.3398
    Green: 0.2851, 0.6054
    Blue : 0.1396, 0.0703
    White: 0.3134, 0.3291
  Established Timings I & II:
    IBM     :   720x400    70.081663 Hz   9:5     31.467 kHz     28.320000 MHz
    DMT 0x04:   640x480    59.940476 Hz   4:3     31.469 kHz     25.175000 MHz
    Apple   :   640x480    66.666667 Hz   4:3     35.000 kHz     30.240000 MHz
    DMT 0x05:   640x480    72.808802 Hz   4:3     37.861 kHz     31.500000 MHz
    DMT 0x06:   640x480    75.000000 Hz   4:3     37.500 kHz     31.500000 MHz
    DMT 0x08:   800x600    56.250000 Hz   4:3     35.156 kHz     36.000000 MHz
    DMT 0x09:   800x600    60.316541 Hz   4:3     37.879 kHz     40.000000 MHz
    DMT 0x0a:   800x600    72.187572 Hz   4:3     48.077 kHz     50.000000 MHz
    DMT 0x0b:   800x600    75.000000 Hz   4:3     46.875 kHz     49.500000 MHz
    Apple   :   832x624    74.551266 Hz   4:3     49.726 kHz     57.284000 MHz
    DMT 0x10:  1024x768    60.003840 Hz   4:3     48.363 kHz     65.000000 MHz
    DMT 0x11:  1024x768    70.069359 Hz   4:3     56.476 kHz     75.000000 MHz
    DMT 0x12:  1024x768    75.028582 Hz   4:3     60.023 kHz     78.750000 MHz
    DMT 0x24:  1280x1024   75.024675 Hz   5:4     79.976 kHz    135.000000 MHz
    Apple   :  1152x870    75.061550 Hz 192:145   68.681 kHz    100.000000 MHz
  Standard Timings:
    DMT 0x1c:  1280x800    59.810326 Hz  16:10    49.702 kHz     83.500000 MHz
    DMT 0x55:  1280x720    60.000000 Hz  16:9     45.000 kHz     74.250000 MHz
    DMT 0x23:  1280x1024   60.019740 Hz   5:4     63.981 kHz    108.000000 MHz
    DMT 0x20:  1280x960    60.000000 Hz   4:3     60.000 kHz    108.000000 MHz
    GTF     :  1152x864    60.000000 Hz   4:3     53.700 kHz     81.624000 MHz
    DMT 0x15:  1152x864    75.000000 Hz   4:3     67.500 kHz    108.000000 MHz
  Detailed Timing Descriptors:
    DTD 1:  1440x900    59.887445 Hz  16:10    55.935 kHz    106.500000 MHz (409 mm x 256 mm)
                 Hfront   80 Hsync 152 Hback  232 Hpol N
                 Vfront    3 Vsync   6 Vback   25 Vpol P
    DTD 2:  1280x768    59.720553 Hz   5:3     47.776 kHz     79.500000 MHz (32 mm x 86 mm)
                 Hfront   64 Hsync 128 Hback  192 Hpol N
                 Vfront    3 Vsync   7 Vback   22 Vpol P
    DTD 3:  1366x768    59.995815 Hz 683:384   47.997 kHz     86.010000 MHz (32 mm x 86 mm)
                 Hfront   70 Hsync 143 Hback  213 Hpol N
                 Vfront    3 Vsync   3 Vback   26 Vpol P
    Display Product Name: 'MCT-19HDMI'
Checksum: 0xf3

----------------

Warnings:

Block 0, Base EDID:
  Vendor & Product Identification: The serial number is one of the known dummy values, it should probably be set to 0.
  Detailed Timing Descriptor #2: Dubious image size (32x86 mm is smaller than 100x100 mm).
  Detailed Timing Descriptor #3: Dubious image size (32x86 mm is smaller than 100x100 mm).

Failures:

Block 0, Base EDID:
  Detailed Timing Descriptor #2: Mismatch of image size 32x86 mm vs display size 400x270 mm.
  Detailed Timing Descriptor #3: Mismatch of image size 32x86 mm vs display size 400x270 mm.
  Missing Display Range Limits Descriptor.
EDID:
  Extension Block 1 started with EDID header, ignoring Extension Blocks >= 1.

EDID conformity: FAIL
