edid-decode (hex):

00 ff ff ff ff ff ff 00 20 2e 00 19 01 00 00 00
1c 1e 01 04 a5 28 1b 78 c2 d7 a5 a2 59 4a 96 24
14 50 54 ad cf 00 95 00 81 00 81 40 81 80 81 c0
71 40 90 40 01 01 9a 29 a0 d0 51 84 22 30 50 98
36 00 99 00 11 00 00 06 1f 1f 00 80 51 00 1e 30
30 20 37 00 70 cf 10 00 00 1e 66 21 56 aa 51 00
1e 30 46 8f 33 00 9a e6 10 00 00 06 00 00 00 fc
00 4d 43 54 2d 31 39 48 44 4d 49 0a 20 20 00 d2

00 ff ff ff ff ff ff 00 20 2e 00 19 01 00 00 00
1c 1e 01 04 a5 28 1b 78 c2 d7 a5 a2 59 4a 96 24
14 50 54 ad cf 00 95 00 81 00 81 40 81 80 81 c0
71 40 90 40 01 01 9a 29 a0 d0 51 84 22 30 50 98
36 00 99 00 11 00 00 06 1f 1f 00 80 51 00 1e 30
30 20 37 00 70 cf 10 00 00 1e 66 21 56 aa 51 00
1e 30 46 8f 33 00 9a e6 10 00 00 06 00 00 00 fc
00 4d 43 54 2d 31 39 48 44 4d 49 0a 20 20 00 d2

----------------

Block 0, Base EDID:
  EDID Structure Version & Revision: 1.4
  Vendor & Product Identification:
    Manufacturer: HAN
    Model: 6400
    Serial Number: ...
    Made in: week 28 of 2020
  Basic Display Parameters & Features:
    Digital display
    Bits per primary color channel: 8
    DisplayPort interface
    Maximum image size: 40 cm x 27 cm
    Gamma: 2.20
    DPMS levels: Standby Suspend
    Supported color formats: RGB 4:4:4
    First detailed timing includes the native pixel format and preferred refresh rate
  Color Characteristics:
    Red  : 0.6357, 0.3486
    Green: 0.2900, 0.5888
    Blue : 0.1425, 0.0800
    White: 0.3134, 0.3291
  Established Timings I & II:
    IBM     :   720x400    70.081663 Hz   9:5     31.467 kHz     28.320000 MHz
    DMT 0x04:   640x480    59.940476 Hz   4:3     31.469 kHz     25.175000 MHz
    DMT 0x05:   640x480    72.808802 Hz   4:3     37.861 kHz     31.500000 MHz
    DMT 0x06:   640x480    75.000000 Hz   4:3     37.500 kHz     31.500000 MHz
    DMT 0x09:   800x600    60.316541 Hz   4:3     37.879 kHz     40.000000 MHz
    DMT 0x0a:   800x600    72.187572 Hz   4:3     48.077 kHz     50.000000 MHz
    DMT 0x0b:   800x600    75.000000 Hz   4:3     46.875 kHz     49.500000 MHz
    DMT 0x10:  1024x768    60.003840 Hz   4:3     48.363 kHz     65.000000 MHz
    DMT 0x11:  1024x768    70.069359 Hz   4:3     56.476 kHz     75.000000 MHz
    DMT 0x12:  1024x768    75.028582 Hz   4:3     60.023 kHz     78.750000 MHz
    DMT 0x24:  1280x1024   75.024675 Hz   5:4     79.976 kHz    135.000000 MHz
  Standard Timings:
    DMT 0x2f:  1440x900    59.887445 Hz  16:10    55.935 kHz    106.500000 MHz
    DMT 0x1c:  1280x800    59.810326 Hz  16:10    49.702 kHz     83.500000 MHz
    DMT 0x20:  1280x960    60.000000 Hz   4:3     60.000 kHz    108.000000 MHz
    DMT 0x23:  1280x1024   60.019740 Hz   5:4     63.981 kHz    108.000000 MHz
    DMT 0x55:  1280x720    60.000000 Hz  16:9     45.000 kHz     74.250000 MHz
    GTF     :  1152x864    60.000000 Hz   4:3     53.700 kHz     81.624000 MHz
    DMT 0x2a:  1400x1050   59.978442 Hz   4:3     65.317 kHz    121.750000 MHz
  Detailed Timing Descriptors:
    DTD 1:  1440x900    59.887445 Hz  16:10    55.935 kHz    106.500000 MHz (analog composite, serrate, 409 mm x 256 mm)
                 Hfront   80 Hsync 152 Hback  232 Hpol N
                 Vfront    3 Vsync   6 Vback   25 Vpol N
    DTD 2:  1280x768    59.998253 Hz   5:3     47.879 kHz     79.670000 MHz (368 mm x 207 mm)
                 Hfront   48 Hsync  32 Hback  304 Hpol P
                 Vfront    3 Vsync   7 Vback   20 Vpol P
    DTD 3:  1366x768    59.789541 Hz 683:384   47.712 kHz     85.500000 MHz (analog composite, serrate, 410 mm x 230 mm)
                 Hfront   70 Hsync 143 Hback  213 Hpol N
                 Vfront    3 Vsync   3 Vback   24 Vpol N
    Display Product Name: 'MCT-19HDMI'
Checksum: 0xd2

----------------

Warnings:

Block 0, Base EDID:
  Vendor & Product Identification: The serial number is one of the known dummy values, it should probably be set to 0.
  Detailed Timing Descriptor #1: DTD is similar but not identical to DMT 0x2f.
  Detailed Timing Descriptor #2: Image size is 368x207 mm, but based on the picture AR it should be 345x207 mm.
  Detailed Timing Descriptor #3: DTD is similar but not identical to DMT 0x51.

Failures:

Block 0, Base EDID:
  Detailed Timing Descriptor #2: Mismatch of image size 368x207 mm vs display size 400x270 mm.
  Detailed Timing Descriptor #3: Mismatch of image size 410x230 mm vs display size 400x270 mm.
EDID:
  Extension Block 1 started with EDID header, ignoring Extension Blocks >= 1.
  Base EDID: The DTD max image size is 410x256mm, which is larger than the display size 400.0x270.0mm.

EDID conformity: FAIL
