edid-decode (hex):

00 ff ff ff ff ff ff 00 41 d3 77 02 00 00 00 00
18 1e 01 04 b5 3c 21 78 3b 1d f5 ae 4f 35 b3 25
0d 50 54 a5 4b 00 71 40 81 c0 81 80 95 00 a9 c0
b3 00 d1 00 d1 c0 6a 5e 00 a0 a0 a0 29 50 30 20
35 00 b9 88 21 00 00 1a 74 fc 00 84 a0 a0 0f 50
30 20 35 00 6c 72 21 00 00 1a 00 00 00 fd 00 30
a6 f0 f0 44 01 0a 20 20 20 20 20 20 00 00 00 fc
00 50 69 78 69 6f 20 50 58 32 37 37 50 0a 01 d9

02 03 29 f1 4e 10 05 1f 14 04 03 07 13 15 12 01
29 2f 40 23 09 07 07 83 01 00 00 65 03 0c 00 10
00 67 d8 5d c4 01 76 c0 00 98 e2 00 a0 a0 a0 29
50 30 20 35 00 6c 72 21 00 00 1a ae 4e 00 a0 a0
a0 29 50 30 20 35 00 6c 72 21 00 00 1a f8 7e 80
88 70 38 12 40 18 20 45 00 6c 72 21 00 00 1a 34
21 50 b0 51 00 1b 30 40 70 36 00 6c 72 21 00 00
00 00 00 00 00 00 00 00 00 00 00 00 00 00 00 49

00 ff ff ff ff ff ff 00 41 d3 77 02 00 00 00 00
18 1e 01 04 b5 3c 21 78 3b 1d f5 ae 4f 35 b3 25
0d 50 54 a5 4b 00 71 40 81 c0 81 80 95 00 a9 c0
b3 00 d1 00 d1 c0 6a 5e 00 a0 a0 a0 29 50 30 20
35 00 b9 88 21 00 00 1a 74 fc 00 84 a0 a0 0f 50
30 20 35 00 6c 72 21 00 00 1a 00 00 00 fd 00 30
a6 f0 f0 44 01 0a 20 20 20 20 20 20 00 00 00 fc
00 50 69 78 69 6f 20 50 58 32 37 37 50 0a 01 d9

02 03 29 f1 4e 10 05 1f 14 04 03 07 13 15 12 01
29 2f 40 23 09 07 07 83 01 00 00 65 03 0c 00 10
00 67 d8 5d c4 01 76 c0 00 98 e2 00 a0 a0 a0 29
50 30 20 35 00 6c 72 21 00 00 1a ae 4e 00 a0 a0
a0 29 50 30 20 35 00 6c 72 21 00 00 1a f8 7e 80
88 70 38 12 40 18 20 45 00 6c 72 21 00 00 1a 34
21 50 b0 51 00 1b 30 40 70 36 00 6c 72 21 00 00
00 00 00 00 00 00 00 00 00 00 00 00 00 00 00 49

----------------

Block 0, Base EDID:
  EDID Structure Version & Revision: 1.4
  Vendor & Product Identification:
    Manufacturer: PNS
    Model: 631
    Made in: week 24 of 2020
  Basic Display Parameters & Features:
    Digital display
    Bits per primary color channel: 10
    DisplayPort interface
    Maximum image size: 60 cm x 33 cm
    Gamma: 2.20
    DPMS levels: Off
    Supported color formats: RGB 4:4:4, YCrCb 4:4:4, YCrCb 4:2:2
    First detailed timing includes the native pixel format and preferred refresh rate
    Display supports continuous frequencies
  Color Characteristics:
    Red  : 0.6796, 0.3095
    Green: 0.2099, 0.7001
    Blue : 0.1474, 0.0537
    White: 0.3134, 0.3291
  Established Timings I & II:
    IBM     :   720x400    70.081663 Hz   9:5     31.467 kHz     28.320000 MHz
    DMT 0x04:   640x480    59.940476 Hz   4:3     31.469 kHz     25.175000 MHz
    DMT 0x06:   640x480    75.000000 Hz   4:3     37.500 kHz     31.500000 MHz
    DMT 0x09:   800x600    60.316541 Hz   4:3     37.879 kHz     40.000000 MHz
    DMT 0x0b:   800x600    75.000000 Hz   4:3     46.875 kHz     49.500000 MHz
    DMT 0x10:  1024x768    60.003840 Hz   4:3     48.363 kHz     65.000000 MHz
    DMT 0x12:  1024x768    75.028582 Hz   4:3     60.023 kHz     78.750000 MHz
    DMT 0x24:  1280x1024   75.024675 Hz   5:4     79.976 kHz    135.000000 MHz
  Standard Timings:
    GTF     :  1152x864    60.000000 Hz   4:3     53.700 kHz     81.624000 MHz
    DMT 0x55:  1280x720    60.000000 Hz  16:9     45.000 kHz     74.250000 MHz
    DMT 0x23:  1280x1024   60.019740 Hz   5:4     63.981 kHz    108.000000 MHz
    DMT 0x2f:  1440x900    59.887445 Hz  16:10    55.935 kHz    106.500000 MHz
    DMT 0x53:  1600x900    60.000000 Hz  16:9     60.000 kHz    108.000000 MHz (RB)
    DMT 0x3a:  1680x1050   59.954250 Hz  16:10    65.290 kHz    146.250000 MHz
    DMT 0x45:  1920x1200   59.884600 Hz  16:10    74.556 kHz    193.250000 MHz
    DMT 0x52:  1920x1080   60.000000 Hz  16:9     67.500 kHz    148.500000 MHz
  Detailed Timing Descriptors:
    DTD 1:  2560x1440   60.000199 Hz  16:9     88.860 kHz    241.700000 MHz (697 mm x 392 mm)
                 Hfront   48 Hsync  32 Hback   80 Hpol P
                 Vfront    3 Vsync   5 Vback   33 Vpol N
    DTD 2:  2560x1440  164.999515 Hz  16:9    240.074 kHz    646.280000 MHz (620 mm x 370 mm)
                 Hfront   48 Hsync  32 Hback   52 Hpol P
                 Vfront    3 Vsync   5 Vback    7 Vpol N
    Display Range Limits:
      Monitor ranges (Range Limits Only): 48-166 Hz V, 240-240 kHz H, max dotclock 680 MHz
    Display Product Name: 'Pixio PX277P'
  Extension blocks: 1
Checksum: 0xd9

----------------

Block 1, CTA-861 Extension Block:
  Revision: 3
  Underscans IT Video Formats by default
  Basic audio support
  Supports YCbCr 4:4:4
  Supports YCbCr 4:2:2
  Native DTDs: 1
  Video Data Block:
    VIC  16:  1920x1080   60.000000 Hz  16:9     67.500 kHz    148.500000 MHz
    VIC   5:  1920x1080i  60.000000 Hz  16:9     33.750 kHz     74.250000 MHz
    VIC  31:  1920x1080   50.000000 Hz  16:9     56.250 kHz    148.500000 MHz
    VIC  20:  1920x1080i  50.000000 Hz  16:9     28.125 kHz     74.250000 MHz
    VIC   4:  1280x720    60.000000 Hz  16:9     45.000 kHz     74.250000 MHz
    VIC   3:   720x480    59.940060 Hz  16:9     31.469 kHz     27.000000 MHz
    VIC   7:  1440x480i   59.940060 Hz  16:9     15.734 kHz     27.000000 MHz
    VIC  19:  1280x720    50.000000 Hz  16:9     37.500 kHz     74.250000 MHz
    VIC  21:  1440x576i   50.000000 Hz   4:3     15.625 kHz     27.000000 MHz
    VIC  18:   720x576    50.000000 Hz  16:9     31.250 kHz     27.000000 MHz
    VIC   1:   640x480    59.940476 Hz   4:3     31.469 kHz     25.175000 MHz
    VIC  41:  1280x720   100.000000 Hz  16:9     75.000 kHz    148.500000 MHz
    VIC  47:  1280x720   120.000000 Hz  16:9     90.000 kHz    148.500000 MHz
    VIC  64:  1920x1080  100.000000 Hz  16:9    112.500 kHz    297.000000 MHz
  Audio Data Block:
    Linear PCM:
      Max channels: 2
      Supported sample rates (kHz): 48 44.1 32
      Supported sample sizes (bits): 24 20 16
  Speaker Allocation Data Block:
    FL/FR - Front Left/Right
  Vendor-Specific Data Block (HDMI), OUI 00-0C-03:
    Source physical address: 1.0.0.0
  Vendor-Specific Data Block (HDMI Forum), OUI C4-5D-D8:
    Version: 1
    Maximum TMDS Character Rate: 590 MHz
    SCDC Present
    SCDC Read Request Capable
  Detailed Timing Descriptors:
    DTD 3:  2560x1440  144.000477 Hz  16:9    213.265 kHz    580.080000 MHz (620 mm x 370 mm)
                 Hfront   48 Hsync  32 Hback   80 Hpol P
                 Vfront    3 Vsync   5 Vback   33 Vpol N
    DTD 4:  2560x1440   50.000993 Hz  16:9     74.051 kHz    201.420000 MHz (620 mm x 370 mm)
                 Hfront   48 Hsync  32 Hback   80 Hpol P
                 Vfront    3 Vsync   5 Vback   33 Vpol N
    DTD 5:  1920x1080  143.983047 Hz  16:9    158.093 kHz    325.040000 MHz (620 mm x 370 mm)
                 Hfront   24 Hsync  32 Hback   80 Hpol P
                 Vfront    4 Vsync   5 Vback    9 Vpol N
    DTD 6:  1360x768    59.664196 Hz  85:48    47.433 kHz     85.000000 MHz (analog composite, sync-on-green, 620 mm x 370 mm)
                 Hfront   64 Hsync 112 Hback  256 Hpol N
                 Vfront    3 Vsync   6 Vback   18 Vpol N
Checksum: 0x49  Unused space in Extension Block: 14 bytes

----------------

Warnings:

Block 0, Base EDID:
  Detailed Timing Descriptor #2: Image size is 620x370 mm, but based on the picture AR it should be 620x348 mm.
Block 1, CTA-861 Extension Block:
  Video Data Block: VIC 16 and the first DTD are not identical. Is this intended?
  Detailed Timing Descriptor #3: Image size is 620x370 mm, but based on the picture AR it should be 620x348 mm.
  Detailed Timing Descriptor #4: Image size is 620x370 mm, but based on the picture AR it should be 620x348 mm.
  Detailed Timing Descriptor #5: Image size is 620x370 mm, but based on the picture AR it should be 620x348 mm.
  Detailed Timing Descriptor #6: Image size is 620x370 mm, but based on the picture AR it should be 620x350 mm.
  Add a Colorimetry Data Block with the sRGB colorimetry bit set to avoid interop issues.
EDID:
  Base EDID: Some timings are out of range of the Monitor Ranges:
    Horizontal Freq: 15.625 - 240.074 kHz (Monitor: 240.000 - 240.000 kHz)

Failures:

Block 0, Base EDID:
  Detailed Timing Descriptor #1: Mismatch of image size 697x392 mm vs display size 600x330 mm.
  Detailed Timing Descriptor #2: Mismatch of image size 620x370 mm vs display size 600x330 mm.
Block 1, CTA-861 Extension Block:
  Vendor-Specific Data Block (HDMI), OUI 00-0C-03: The HDMI Specification requires EDID 1.3 instead of 1.4.
  Detailed Timing Descriptor #3: Mismatch of image size 620x370 mm vs display size 600x330 mm.
  Detailed Timing Descriptor #4: Mismatch of image size 620x370 mm vs display size 600x330 mm.
  Detailed Timing Descriptor #5: Mismatch of image size 620x370 mm vs display size 600x330 mm.
  Detailed Timing Descriptor #6: Mismatch of image size 620x370 mm vs display size 600x330 mm.
  Missing VCDB, needed for Set Selectable RGB Quantization to avoid interop issues.
EDID:
  Extension Block 2 started with EDID header, ignoring Extension Blocks >= 2.
  Base EDID: The DTD max image size is 697x392mm, which is larger than the display size 600.0x330.0mm.
  CTA-861: The maximum HDMI TMDS clock is 590000 kHz, but one or more video timings go up to 646280 kHz.

EDID conformity: FAIL
