edid-decode (hex):

00 ff ff ff ff ff ff 00 05 e3 49 16 01 00 00 00
13 19 01 03 81 22 13 78 2a b8 65 92 57 58 8d 28
1f 50 54 00 00 00 01 01 01 01 01 01 01 01 01 01
01 01 01 01 01 01 20 1c 56 a0 50 00 10 30 0e 38
13 00 58 c1 10 00 00 1e 00 00 00 ff 00 31 32 33
34 35 36 37 38 0a 0a 0a 0a 0a 00 00 00 fd 00 32
4b 26 3a 09 00 0a 20 20 20 20 20 20 00 00 00 ff
00 44 5a 52 46 35 48 41 30 35 34 36 35 34 00 41

00 ff ff ff ff ff ff 00 05 e3 49 16 01 00 00 00
13 19 01 03 81 22 13 78 2a b8 65 92 57 58 8d 28
1f 50 54 00 00 00 01 01 01 01 01 01 01 01 01 01
01 01 01 01 01 01 20 1c 56 a0 50 00 10 30 0e 38
13 00 58 c1 10 00 00 1e 00 00 00 ff 00 31 32 33
34 35 36 37 38 0a 0a 0a 0a 0a 00 00 00 fd 00 32
4b 26 3a 09 00 0a 20 20 20 20 20 20 00 00 00 ff
00 44 5a 52 46 35 48 41 30 35 34 36 35 34 00 41

----------------

Block 0, Base EDID:
  EDID Structure Version & Revision: 1.3
  Vendor & Product Identification:
    Manufacturer: AOC
    Model: 5705
    Serial Number: ...
    Made in: week 19 of 2015
  Basic Display Parameters & Features:
    Digital display
    DFP 1.x compatible TMDS
    Maximum image size: 34 cm x 19 cm
    Gamma: 2.20
    DPMS levels: Off
    RGB color display
    First detailed timing is the preferred timing
  Color Characteristics:
    Red  : 0.5722, 0.3427
    Green: 0.3457, 0.5507
    Blue : 0.1572, 0.1230
    White: 0.3134, 0.3291
  Established Timings I & II: none
  Standard Timings: none
  Detailed Timing Descriptors:
    DTD 1:  1366x768    60.181346 Hz 683:384   47.182 kHz     72.000000 MHz (344 mm x 193 mm)
                 Hfront   14 Hsync  56 Hback   90 Hpol P
                 Vfront    1 Vsync   3 Vback   12 Vpol P
    Display Product Serial Number: ...
    Display Range Limits:
      Monitor ranges (GTF): 50-75 Hz V, 38-58 kHz H, max dotclock 90 MHz
    Display Product Serial Number: ...
Checksum: 0x41

----------------

Warnings:

Block 0, Base EDID:
  Vendor & Product Identification: The serial number is one of the known dummy values, it should probably be set to 0.
EDID:
  Base EDID: Multiple Display Product Serial Numbers are specified, is that intended?

Failures:

Block 0, Base EDID:
  Display Product Serial Number: ...
  Missing Display Product Name.
EDID:
  Extension Block 1 started with EDID header, ignoring Extension Blocks >= 1.

EDID conformity: FAIL
