edid-decode (hex):

00 ff ff ff ff ff ff 00 34 94 41 1f 00 00 00 00
2b 20 01 04 a5 22 13 78 03 5e 7e a9 52 3c 93 23
1b 47 50 00 00 00 01 01 01 01 01 01 01 01 01 01
01 01 01 01 01 01 98 3c 80 54 71 38 40 40 30 20
36 00 58 c2 10 00 00 1a 00 00 00 fc 00 0a 20 20
20 20 20 20 20 20 20 20 20 20 00 00 00 fc 00 49
6e 74 65 72 6e 61 6c 20 20 0a 20 20 00 00 00 fc
00 44 69 73 70 6c 61 79 0a 20 20 20 20 20 00 4e

00 ff ff ff ff ff ff 00 34 94 41 1f 00 00 00 00
2b 20 01 04 a5 22 13 78 03 5e 7e a9 52 3c 93 23
1b 47 50 00 00 00 01 01 01 01 01 01 01 01 01 01
01 01 01 01 01 01 98 3c 80 54 71 38 40 40 30 20
36 00 58 c2 10 00 00 1a 00 00 00 fc 00 0a 20 20
20 20 20 20 20 20 20 20 20 20 00 00 00 fc 00 49
6e 74 65 72 6e 61 6c 20 20 0a 20 20 00 00 00 fc
00 44 69 73 70 6c 61 79 0a 20 20 20 20 20 00 4e

----------------

Block 0, Base EDID:
  EDID Structure Version & Revision: 1.4
  Vendor & Product Identification:
    Manufacturer: MDT
    Model: 8001
    Made in: week 43 of 2022
  Basic Display Parameters & Features:
    Digital display
    Bits per primary color channel: 8
    DisplayPort interface
    Maximum image size: 34 cm x 19 cm
    Gamma: 2.20
    Supported color formats: RGB 4:4:4
    First detailed timing includes the native pixel format and preferred refresh rate
    Display supports continuous frequencies
  Color Characteristics:
    Red  : 0.6611, 0.3212
    Green: 0.2373, 0.5761
    Blue : 0.1376, 0.1083
    White: 0.2802, 0.3144
  Established Timings I & II: none
  Standard Timings: none
  Detailed Timing Descriptors:
    DTD 1:  1920x1080   59.997525 Hz  16:9     68.637 kHz    155.120000 MHz (344 mm x 194 mm)
                 Hfront   48 Hsync  32 Hback  260 Hpol P
                 Vfront    3 Vsync   6 Vback   55 Vpol N
    Display Product Name: ''
    Display Product Name: 'Internal  '
    Display Product Name: 'Display'
Checksum: 0x4e

----------------

Failures:

Block 0, Base EDID:
  Display Product Name: Empty string.
  Display Product Name: One or more trailing spaces before newline.
  Missing Display Range Limits Descriptor.
EDID:
  Extension Block 1 started with EDID header, ignoring Extension Blocks >= 1.

EDID conformity: FAIL
