edid-decode (hex):

00 ff ff ff ff ff ff 00 15 c3 43 30 9e a3 f8 01
0c 1e 01 04 b5 3c 22 78 fa 54 e5 af 50 37 b9 26
0b 50 54 a1 08 00 a9 40 81 80 81 40 d1 c0 01 01
01 01 01 01 01 01 56 5e 00 a0 a0 a0 29 50 30 20
35 00 55 50 21 00 00 1a 28 3c 80 a0 70 b0 23 40
30 20 36 00 55 50 21 00 00 1a 00 00 00 fd 00 17
3d 1a 59 19 01 0a 20 20 20 20 20 20 00 00 00 fc
00 43 47 32 37 39 58 0a 20 20 20 20 20 20 00 12

----------------

Block 0, Base EDID:
  EDID Structure Version & Revision: 1.4
  Vendor & Product Identification:
    Manufacturer: ENC
    Model: 12355
    Serial Number: ...
    Made in: week 12 of 2020
  Basic Display Parameters & Features:
    Digital display
    Bits per primary color channel: 10
    DisplayPort interface
    Maximum image size: 60 cm x 34 cm
    Gamma: 2.20
    DPMS levels: Standby Suspend Off
    Supported color formats: RGB 4:4:4, YCrCb 4:4:4, YCrCb 4:2:2
    First detailed timing includes the native pixel format and preferred refresh rate
  Color Characteristics:
    Red  : 0.6845, 0.3134
    Green: 0.2158, 0.7226
    Blue : 0.1513, 0.0449
    White: 0.3134, 0.3291
  Established Timings I & II:
    IBM     :   720x400    70.081663 Hz   9:5     31.467 kHz     28.320000 MHz
    DMT 0x04:   640x480    59.940476 Hz   4:3     31.469 kHz     25.175000 MHz
    DMT 0x09:   800x600    60.316541 Hz   4:3     37.879 kHz     40.000000 MHz
    DMT 0x10:  1024x768    60.003840 Hz   4:3     48.363 kHz     65.000000 MHz
  Standard Timings:
    DMT 0x33:  1600x1200   60.000000 Hz   4:3     75.000 kHz    162.000000 MHz
    DMT 0x23:  1280x1024   60.019740 Hz   5:4     63.981 kHz    108.000000 MHz
    DMT 0x20:  1280x960    60.000000 Hz   4:3     60.000 kHz    108.000000 MHz
    DMT 0x52:  1920x1080   60.000000 Hz  16:9     67.500 kHz    148.500000 MHz
  Detailed Timing Descriptors:
    DTD 1:  2560x1440   59.950550 Hz  16:9     88.787 kHz    241.500000 MHz (597 mm x 336 mm)
                 Hfront   48 Hsync  32 Hback   80 Hpol P
                 Vfront    3 Vsync   5 Vback   33 Vpol N
    DTD 2:  1920x1200   59.950171 Hz  16:10    74.038 kHz    154.000000 MHz (597 mm x 336 mm)
                 Hfront   48 Hsync  32 Hback   80 Hpol P
                 Vfront    3 Vsync   6 Vback   26 Vpol N
    Display Range Limits:
      Monitor ranges (Range Limits Only): 23-61 Hz V, 26-89 kHz H, max dotclock 250 MHz
    Display Product Name: 'CG279X'
Checksum: 0x12

----------------

Warnings:

Block 0, Base EDID:
  Detailed Timing Descriptor #2: Image size is 597x336 mm, but based on the picture AR it should be 597x373 mm.
EDID:
  Base EDID: Some timings are out of range of the Monitor Ranges:
    Vertical Freq: 59.940 - 70.082 Hz (Monitor: 23.000 - 61.000 Hz)

EDID conformity: PASS
