edid-decode (hex):

00 ff ff ff ff ff ff 00 1c 54 06 27 01 01 01 01
1f 1e 01 04 b5 3d 23 78 eb 13 e5 ae 50 44 a9 25
0d 50 54 bf cf 00 d1 c0 71 4f 81 c0 81 40 81 80
95 00 b3 00 01 01 56 5e 00 a0 a0 a0 29 50 30 20
35 00 54 4f 21 00 00 1e 00 00 00 fd 00 30 a5 de
de 41 01 0a 20 20 20 20 20 20 00 00 00 fc 00 41
4f 52 55 53 20 46 49 32 37 51 0a 20 00 00 00 ff
00 32 30 33 31 30 42 30 30 30 33 35 34 0a 02 30

02 03 47 71 51 02 03 11 12 13 04 29 2f 0e 0f 1d
1e 90 1f 3f 05 14 23 09 17 07 83 01 00 00 67 03
0c 00 10 00 38 3c 67 d8 5d c4 01 78 80 03 68 1a
00 00 01 01 30 a5 00 e3 05 e3 01 e4 0f 00 00 06
e6 06 07 01 62 62 00 21 fa 00 50 a0 a0 1e 50 0a
3c 35 00 54 4f 21 00 00 1a 6f c2 00 a0 a0 a0 55
50 30 20 35 00 54 4f 21 00 00 1a 6c 94 80 64 70
38 3c 40 1c 20 78 04 54 4f 21 00 00 1a 00 00 d9

45 0c 02 00 00 00 5a 50 5a 5a 32 46 28 50 50 5a
4b 32 3c 4b 32 32 32 32 32 32 3c 0a 0a 0a 0a 0b
0a 0a 0a 0a 0a 0a 00 00 00 00 00 00 0a 00 00 00
05 0f 32 32 01 32 01 03 00 01 01 03 01 04 01 01
02 64 64 64 32 32 32 00 02 01 02 02 01 00 00 01
01 01 00 02 0b 00 04 04 ff 0c 07 05 08 07 08 04
05 05 05 05 08 00 00 0b 0a 0c 0b 0a 0a 0a 0a 0a
0a 0c 00 01 01 07 04 03 00 0b 6c 62 ff 23 01 00

----------------

Block 0, Base EDID:
  EDID Structure Version & Revision: 1.4
  Vendor & Product Identification:
    Manufacturer: GBT
    Model: 9990
    Serial Number: ...
    Made in: week 31 of 2020
  Basic Display Parameters & Features:
    Digital display
    Bits per primary color channel: 10
    DisplayPort interface
    Maximum image size: 61 cm x 35 cm
    Gamma: 2.20
    DPMS levels: Standby Suspend Off
    Supported color formats: RGB 4:4:4, YCrCb 4:4:4
    First detailed timing includes the native pixel format and preferred refresh rate
    Display supports continuous frequencies
  Color Characteristics:
    Red  : 0.6796, 0.3134
    Green: 0.2656, 0.6630
    Blue : 0.1474, 0.0527
    White: 0.3134, 0.3291
  Established Timings I & II:
    IBM     :   720x400    70.081663 Hz   9:5     31.467 kHz     28.320000 MHz
    DMT 0x04:   640x480    59.940476 Hz   4:3     31.469 kHz     25.175000 MHz
    Apple   :   640x480    66.666667 Hz   4:3     35.000 kHz     30.240000 MHz
    DMT 0x05:   640x480    72.808802 Hz   4:3     37.861 kHz     31.500000 MHz
    DMT 0x06:   640x480    75.000000 Hz   4:3     37.500 kHz     31.500000 MHz
    DMT 0x08:   800x600    56.250000 Hz   4:3     35.156 kHz     36.000000 MHz
    DMT 0x09:   800x600    60.316541 Hz   4:3     37.879 kHz     40.000000 MHz
    DMT 0x0a:   800x600    72.187572 Hz   4:3     48.077 kHz     50.000000 MHz
    DMT 0x0b:   800x600    75.000000 Hz   4:3     46.875 kHz     49.500000 MHz
    DMT 0x10:  1024x768    60.003840 Hz   4:3     48.363 kHz     65.000000 MHz
    DMT 0x11:  1024x768    70.069359 Hz   4:3     56.476 kHz     75.000000 MHz
    DMT 0x12:  1024x768    75.028582 Hz   4:3     60.023 kHz     78.750000 MHz
    DMT 0x24:  1280x1024   75.024675 Hz   5:4     79.976 kHz    135.000000 MHz
  Standard Timings:
    DMT 0x52:  1920x1080   60.000000 Hz  16:9     67.500 kHz    148.500000 MHz
    DMT 0x15:  1152x864    75.000000 Hz   4:3     67.500 kHz    108.000000 MHz
    DMT 0x55:  1280x720    60.000000 Hz  16:9     45.000 kHz     74.250000 MHz
    DMT 0x20:  1280x960    60.000000 Hz   4:3     60.000 kHz    108.000000 MHz
    DMT 0x23:  1280x1024   60.019740 Hz   5:4     63.981 kHz    108.000000 MHz
    DMT 0x2f:  1440x900    59.887445 Hz  16:10    55.935 kHz    106.500000 MHz
    DMT 0x3a:  1680x1050   59.954250 Hz  16:10    65.290 kHz    146.250000 MHz
  Detailed Timing Descriptors:
    DTD 1:  2560x1440   59.950550 Hz  16:9     88.787 kHz    241.500000 MHz (596 mm x 335 mm)
                 Hfront   48 Hsync  32 Hback   80 Hpol P
                 Vfront    3 Vsync   5 Vback   33 Vpol P
    Display Range Limits:
      Monitor ranges (Range Limits Only): 48-165 Hz V, 222-222 kHz H, max dotclock 650 MHz
    Display Product Name: 'AORUS FI27Q'
    Display Product Serial Number: ...
  Extension blocks: 2
Checksum: 0x30

----------------

Block 1, CTA-861 Extension Block:
  Revision: 3
  Basic audio support
  Supports YCbCr 4:4:4
  Supports YCbCr 4:2:2
  Native DTDs: 1
  Video Data Block:
    VIC   2:   720x480    59.940060 Hz   4:3     31.469 kHz     27.000000 MHz
    VIC   3:   720x480    59.940060 Hz  16:9     31.469 kHz     27.000000 MHz
    VIC  17:   720x576    50.000000 Hz   4:3     31.250 kHz     27.000000 MHz
    VIC  18:   720x576    50.000000 Hz  16:9     31.250 kHz     27.000000 MHz
    VIC  19:  1280x720    50.000000 Hz  16:9     37.500 kHz     74.250000 MHz
    VIC   4:  1280x720    60.000000 Hz  16:9     45.000 kHz     74.250000 MHz
    VIC  41:  1280x720   100.000000 Hz  16:9     75.000 kHz    148.500000 MHz
    VIC  47:  1280x720   120.000000 Hz  16:9     90.000 kHz    148.500000 MHz
    VIC  14:  1440x480    59.940060 Hz   4:3     31.469 kHz     54.000000 MHz
    VIC  15:  1440x480    59.940060 Hz  16:9     31.469 kHz     54.000000 MHz
    VIC  29:  1440x576    50.000000 Hz   4:3     31.250 kHz     54.000000 MHz
    VIC  30:  1440x576    50.000000 Hz  16:9     31.250 kHz     54.000000 MHz
    VIC  16:  1920x1080   60.000000 Hz  16:9     67.500 kHz    148.500000 MHz (native)
    VIC  31:  1920x1080   50.000000 Hz  16:9     56.250 kHz    148.500000 MHz
    VIC  63:  1920x1080  120.000000 Hz  16:9    135.000 kHz    297.000000 MHz
    VIC   5:  1920x1080i  60.000000 Hz  16:9     33.750 kHz     74.250000 MHz
    VIC  20:  1920x1080i  50.000000 Hz  16:9     28.125 kHz     74.250000 MHz
  Audio Data Block:
    Linear PCM:
      Max channels: 2
      Supported sample rates (kHz): 96 48 44.1 32
      Supported sample sizes (bits): 24 20 16
  Speaker Allocation Data Block:
    FL/FR - Front Left/Right
  Vendor-Specific Data Block (HDMI), OUI 00-0C-03:
    Source physical address: 1.0.0.0
    DC_36bit
    DC_30bit
    DC_Y444
    Maximum TMDS clock: 300 MHz
  Vendor-Specific Data Block (HDMI Forum), OUI C4-5D-D8:
    Version: 1
    Maximum TMDS Character Rate: 600 MHz
    SCDC Present
    Supports 12-bits/component Deep Color 4:2:0 Pixel Encoding
    Supports 10-bits/component Deep Color 4:2:0 Pixel Encoding
  Vendor-Specific Data Block (AMD), OUI 00-00-1A:
    Version: 1
    Flags 1: 0x01
      FreeSync Supported
    Minimum Refresh Rate: 48 Hz
    Maximum Refresh Rate: 165 Hz
  Colorimetry Data Block:
    xvYCC601
    xvYCC709
    BT2020cYCC
    BT2020YCC
    BT2020RGB
    Gamut Boundary Description Metadata Profile P0
  YCbCr 4:2:0 Capability Map Data Block:
    SVD Index 18 is out of range
    SVD Index 19 is out of range
  HDR Static Metadata Data Block:
    Electro optical transfer functions:
      Traditional gamma - SDR luminance range
      Traditional gamma - HDR luminance range
      SMPTE ST2084
    Supported static metadata descriptors:
      Static metadata type 1
    Desired content max luminance: 98 (417.710 cd/m^2)
    Desired content max frame-average luminance: 98 (417.710 cd/m^2)
    Desired content min luminance: 0 (0.000 cd/m^2)
  Detailed Timing Descriptors:
    DTD 2:  2560x1440  164.999485 Hz  16:9    242.549 kHz    640.330000 MHz (596 mm x 335 mm)
                 Hfront   10 Hsync  60 Hback   10 Hpol P
                 Vfront    3 Vsync   5 Vback   22 Vpol N
    DTD 3:  2560x1440  119.997589 Hz  16:9    182.996 kHz    497.750000 MHz (596 mm x 335 mm)
                 Hfront   48 Hsync  32 Hback   80 Hpol P
                 Vfront    3 Vsync   5 Vback   77 Vpol N
    DTD 4:  1920x1080  164.999131 Hz  16:9    188.099 kHz    379.960000 MHz (596 mm x 335 mm)
                 Hfront   28 Hsync  32 Hback   40 Hpol P
                 Vfront   23 Vsync   8 Vback   29 Vpol N
Checksum: 0xd9  Unused space in Extension Block: 2 bytes

----------------

Block 2, Unknown EDID Extension Block 0x45:
  45 0c 02 00 00 00 5a 50 5a 5a 32 46 28 50 50 5a 'E.....ZPZZ2F(PPZ'
  4b 32 3c 4b 32 32 32 32 32 32 3c 0a 0a 0a 0a 0b 'K2<K222222<.....'
  0a 0a 0a 0a 0a 0a 00 00 00 00 00 00 0a 00 00 00 '................'
  05 0f 32 32 01 32 01 03 00 01 01 03 01 04 01 01 '..22.2..........'
  02 64 64 64 32 32 32 00 02 01 02 02 01 00 00 01 '.ddd222.........'
  01 01 00 02 0b 00 04 04 ff 0c 07 05 08 07 08 04 '................'
  05 05 05 05 08 00 00 0b 0a 0c 0b 0a 0a 0a 0a 0a '................'
  0a 0c 00 01 01 07 04 03 00 0b 6c 62 ff 23 01 00 '..........lb.#..'
Checksum: 0x00 (should be 0x63)

----------------

Warnings:

Block 0, Base EDID:
  Vendor & Product Identification: The serial number is one of the known dummy values, it should probably be set to 0.
Block 1, CTA-861 Extension Block:
  IT Video Formats are overscanned by default, but normally this should be underscanned.
  Video Data Block: VIC 2 and the first DTD are not identical. Is this intended?
  Colorimetry Data Block: Set the sRGB colorimetry bit to avoid interop issues.
  Display Product Serial Number is set, so the Serial Number in the Base EDID should be 0.
EDID:
  Base EDID: Some timings are out of range of the Monitor Ranges:
    Horizontal Freq: 28.125 - 242.549 kHz (Monitor: 222.000 - 222.000 kHz)

Failures:

Block 0, Base EDID:
  Detailed Timing Descriptor #1: Mismatch of image size 596x335 mm vs display size 610x350 mm.
Block 1, CTA-861 Extension Block:
  Vendor-Specific Data Block (HDMI), OUI 00-0C-03: The HDMI Specification requires EDID 1.3 instead of 1.4.
  YCbCr 4:2:0 Capability Map Data Block: Max index 19 > 17 (#SVDs).
  Detailed Timing Descriptor #2: Mismatch of image size 596x335 mm vs display size 610x350 mm.
  Detailed Timing Descriptor #3: Mismatch of image size 596x335 mm vs display size 610x350 mm.
  Detailed Timing Descriptor #4: Mismatch of image size 596x335 mm vs display size 610x350 mm.
  Missing VCDB, needed for Set Selectable RGB Quantization to avoid interop issues.
Block 2, Unknown EDID Extension Block 0x45:
  Unknown Extension Block.
  Invalid checksum 0x00 (should be 0x63).
EDID:
  CTA-861: The maximum HDMI TMDS clock is 600000 kHz, but one or more video timings go up to 640330 kHz.
  CTA-861: Native progressive timings are a mix of several resolutions.

EDID conformity: FAIL
