edid-decode (hex):

00 ff ff ff ff ff ff 00 50 6c 00 00 01 01 01 01
09 13 01 03 08 4c 2d 78 0a 0d c9 a0 57 47 98 27
12 48 4c 21 08 00 01 01 01 01 01 01 01 01 01 01
01 01 01 01 01 01 66 21 50 b0 51 00 1b 30 40 70
36 00 44 40 21 00 00 18 01 1d 00 72 51 d0 1e 20
6e 28 55 00 44 40 21 00 00 1e 00 00 00 fc 00 20
20 20 20 20 44 54 56 20 20 20 20 20 00 00 00 fd
00 30 3e 0e 46 10 00 0a 20 20 20 20 20 20 00 4b

00 ff ff ff ff ff ff 00 50 6c 00 00 01 01 01 01
09 13 01 03 08 4c 2d 78 0a 0d c9 a0 57 47 98 27
12 48 4c 21 08 00 01 01 01 01 01 01 01 01 01 01
01 01 01 01 01 01 66 21 50 b0 51 00 1b 30 40 70
36 00 44 40 21 00 00 18 01 1d 00 72 51 d0 1e 20
6e 28 55 00 44 40 21 00 00 1e 00 00 00 fc 00 20
20 20 20 20 44 54 56 20 20 20 20 20 00 00 00 fd
00 30 3e 0e 46 10 00 0a 20 20 20 20 20 20 00 4b

----------------

Block 0, Base EDID:
  EDID Structure Version & Revision: 1.3
  Vendor & Product Identification:
    Manufacturer: TCL
    Model: 0
    Serial Number: ...
    Made in: week 9 of 2009
  Basic Display Parameters & Features:
    Analog display
    Signal Level Standard: 0.700 : 0.300 : 1.000 V p-p
    Blank level equals black level
    Sync: Separate
    Maximum image size: 76 cm x 45 cm
    Gamma: 2.20
    RGB color display
    First detailed timing is the preferred timing
  Color Characteristics:
    Red  : 0.6250, 0.3398
    Green: 0.2802, 0.5947
    Blue : 0.1552, 0.0703
    White: 0.2832, 0.2978
  Established Timings I & II:
    DMT 0x04:   640x480    59.940476 Hz   4:3     31.469 kHz     25.175000 MHz
    DMT 0x09:   800x600    60.316541 Hz   4:3     37.879 kHz     40.000000 MHz
    DMT 0x10:  1024x768    60.003840 Hz   4:3     48.363 kHz     65.000000 MHz
  Standard Timings: none
  Detailed Timing Descriptors:
    DTD 1:  1360x768    60.015162 Hz  85:48    47.712 kHz     85.500000 MHz (580 mm x 320 mm)
                 Hfront   64 Hsync 112 Hback  256 Hpol N
                 Vfront    3 Vsync   6 Vback   18 Vpol N
    DTD 2:  1280x720    60.000000 Hz  16:9     45.000 kHz     74.250000 MHz (580 mm x 320 mm)
                 Hfront  110 Hsync  40 Hback  220 Hpol P
                 Vfront    5 Vsync   5 Vback   20 Vpol P
    Display Product Name: '     DTV     '
    Display Range Limits:
      Monitor ranges (GTF): 48-62 Hz V, 14-70 kHz H, max dotclock 160 MHz
Checksum: 0x4b

----------------

Warnings:

Block 0, Base EDID:
  Vendor & Product Identification: The serial number is one of the known dummy values, it should probably be set to 0.
  Detailed Timing Descriptor #1: DTD is similar but not identical to DMT 0x27.

Failures:

Block 0, Base EDID:
  Detailed Timing Descriptor #1: Mismatch of image size 580x320 mm vs display size 760x450 mm.
  Detailed Timing Descriptor #2: Mismatch of image size 580x320 mm vs display size 760x450 mm.
  Display Product Name: No newline, but one or more trailing spaces.
EDID:
  Extension Block 1 started with EDID header, ignoring Extension Blocks >= 1.

EDID conformity: FAIL
