edid-decode (hex):

00 ff ff ff ff ff ff 00 59 3a 22 00 01 01 01 01
25 12 01 03 80 30 1b 78 0a 35 85 a6 56 48 9a 24
12 50 54 23 08 00 01 01 01 01 01 01 01 01 01 01
01 01 01 01 01 01 01 1d 00 72 51 d0 1e 20 6e 28
55 00 80 68 21 00 00 1e 01 1d 80 18 71 1c 16 20
58 2c 25 00 80 68 21 00 00 9e 00 00 00 fc 00 56
41 32 32 4c 46 48 44 54 56 31 30 54 00 00 00 fd
00 38 3e 1e 44 0f 00 0a 20 20 20 20 20 20 01 2b

02 03 1f 72 49 01 02 03 04 05 06 07 90 a2 26 09
57 03 15 07 50 83 01 00 00 65 03 0c 00 10 00 01
1d 80 18 71 1c 16 20 58 2c 25 00 80 68 21 00 00
9e 01 1d 00 72 51 d0 1e 20 6e 28 55 00 80 68 21
00 00 1e 8c 0a d0 8a 20 e0 2d 10 10 3e 96 00 80
68 21 00 00 18 8c 0a a0 14 51 f0 16 00 26 7c 43
00 80 68 21 00 00 98 8c 0a d0 8a 20 e0 2d 10 10
3e 96 00 90 2c 11 00 00 18 00 00 00 00 00 00 bd

00 ff ff ff ff ff ff 00 59 3a 22 00 01 01 01 01
25 12 01 03 80 30 1b 78 0a 35 85 a6 56 48 9a 24
12 50 54 23 08 00 01 01 01 01 01 01 01 01 01 01
01 01 01 01 01 01 01 1d 00 72 51 d0 1e 20 6e 28
55 00 80 68 21 00 00 1e 01 1d 80 18 71 1c 16 20
58 2c 25 00 80 68 21 00 00 9e 00 00 00 fc 00 56
41 32 32 4c 46 48 44 54 56 31 30 54 00 00 00 fd
00 38 3e 1e 44 0f 00 0a 20 20 20 20 20 20 01 2b

02 03 1f 72 49 01 02 03 04 05 06 07 90 a2 26 09
57 03 15 07 50 83 01 00 00 65 03 0c 00 10 00 01
1d 80 18 71 1c 16 20 58 2c 25 00 80 68 21 00 00
9e 01 1d 00 72 51 d0 1e 20 6e 28 55 00 80 68 21
00 00 1e 8c 0a d0 8a 20 e0 2d 10 10 3e 96 00 80
68 21 00 00 18 8c 0a a0 14 51 f0 16 00 26 7c 43
00 80 68 21 00 00 98 8c 0a d0 8a 20 e0 2d 10 10
3e 96 00 90 2c 11 00 00 18 00 00 00 00 00 00 bd

----------------

Block 0, Base EDID:
  EDID Structure Version & Revision: 1.3
  Vendor & Product Identification:
    Manufacturer: VIZ
    Model: 34
    Serial Number: ...
    Made in: week 37 of 2008
  Basic Display Parameters & Features:
    Digital display
    Maximum image size: 48 cm x 27 cm
    Gamma: 2.20
    RGB color display
    First detailed timing is the preferred timing
  Color Characteristics:
    Red  : 0.6484, 0.3388
    Green: 0.2822, 0.6025
    Blue : 0.1425, 0.0703
    White: 0.3134, 0.3291
  Established Timings I & II:
    DMT 0x04:   640x480    59.940476 Hz   4:3     31.469 kHz     25.175000 MHz
    DMT 0x08:   800x600    56.250000 Hz   4:3     35.156 kHz     36.000000 MHz
    DMT 0x09:   800x600    60.316541 Hz   4:3     37.879 kHz     40.000000 MHz
    DMT 0x10:  1024x768    60.003840 Hz   4:3     48.363 kHz     65.000000 MHz
  Standard Timings: none
  Detailed Timing Descriptors:
    DTD  1:  1280x720    60.000000 Hz  16:9     45.000 kHz     74.250000 MHz (640 mm x 360 mm)
                  Hfront  110 Hsync  40 Hback  220 Hpol P
                  Vfront    5 Vsync   5 Vback   20 Vpol P
    DTD  2:  1920x1080i  60.000000 Hz  16:9     33.750 kHz     74.250000 MHz (640 mm x 360 mm)
                  Hfront   88 Hsync  44 Hback  148 Hpol P
                  Vfront    2 Vsync   5 Vback   15 Vpol P Vfront +0.5 Odd Field
                  Vfront    2 Vsync   5 Vback   15 Vpol P Vback  +0.5 Even Field
    Display Product Name: 'VA22LFHDTV10T'
    Display Range Limits:
      Monitor ranges (GTF): 56-62 Hz V, 30-68 kHz H, max dotclock 150 MHz
  Extension blocks: 1
Checksum: 0x2b

----------------

Block 1, CTA-861 Extension Block:
  Revision: 3
  Basic audio support
  Supports YCbCr 4:4:4
  Supports YCbCr 4:2:2
  Native detailed modes: 2
  Video Data Block:
    VIC   1:   640x480    59.940476 Hz   4:3     31.469 kHz     25.175000 MHz
    VIC   2:   720x480    59.940060 Hz   4:3     31.469 kHz     27.000000 MHz
    VIC   3:   720x480    59.940060 Hz  16:9     31.469 kHz     27.000000 MHz
    VIC   4:  1280x720    60.000000 Hz  16:9     45.000 kHz     74.250000 MHz
    VIC   5:  1920x1080i  60.000000 Hz  16:9     33.750 kHz     74.250000 MHz
    VIC   6:  1440x480i   59.940060 Hz   4:3     15.734 kHz     27.000000 MHz
    VIC   7:  1440x480i   59.940060 Hz  16:9     15.734 kHz     27.000000 MHz
    VIC  16:  1920x1080   60.000000 Hz  16:9     67.500 kHz    148.500000 MHz (native)
    VIC  34:  1920x1080   30.000000 Hz  16:9     33.750 kHz     74.250000 MHz (native)
  Audio Data Block:
    Linear PCM:
      Max channels: 2
      Supported sample rates (kHz): 192 96 48 44.1 32
      Supported sample sizes (bits): 20 16
    AC-3:
      Max channels: 6
      Supported sample rates (kHz): 48 44.1 32
      Maximum bit rate: 640 kb/s
  Speaker Allocation Data Block:
    FL/FR - Front Left/Right
  Vendor-Specific Data Block (HDMI), OUI 00-0C-03:
    Source physical address: 1.0.0.0
  Detailed Timing Descriptors:
    DTD  3:  1920x1080i  60.000000 Hz  16:9     33.750 kHz     74.250000 MHz (640 mm x 360 mm)
                  Hfront   88 Hsync  44 Hback  148 Hpol P
                  Vfront    2 Vsync   5 Vback   15 Vpol P Vfront +0.5 Odd Field
                  Vfront    2 Vsync   5 Vback   15 Vpol P Vback  +0.5 Even Field
    DTD  4:  1280x720    60.000000 Hz  16:9     45.000 kHz     74.250000 MHz (640 mm x 360 mm)
                  Hfront  110 Hsync  40 Hback  220 Hpol P
                  Vfront    5 Vsync   5 Vback   20 Vpol P
    DTD  5:   720x480    59.940060 Hz   3:2     31.469 kHz     27.000000 MHz (640 mm x 360 mm)
                  Hfront   16 Hsync  62 Hback   60 Hpol N
                  Vfront    9 Vsync   6 Vback   30 Vpol N
    DTD  6:  1440x480i   59.940060 Hz   3:1     15.734 kHz     27.000000 MHz (640 mm x 360 mm)
                  Hfront   38 Hsync 124 Hback  114 Hpol N
                  Vfront    4 Vsync   3 Vback   15 Vpol N Vfront +0.5 Odd Field
                  Vfront    4 Vsync   3 Vback   15 Vpol N Vback  +0.5 Even Field
    DTD  7:   720x480    59.940060 Hz   3:2     31.469 kHz     27.000000 MHz (400 mm x 300 mm)
                  Hfront   16 Hsync  62 Hback   60 Hpol N
                  Vfront    9 Vsync   6 Vback   30 Vpol N
Checksum: 0xbd  Unused space in Extension Block: 6 bytes

----------------

Block 2, Unknown EDID Extension Block 0x00:
  00 ff ff ff ff ff ff 00 59 3a 22 00 01 01 01 01 '........Y:".....'
  25 12 01 03 80 30 1b 78 0a 35 85 a6 56 48 9a 24 '%....0.x.5..VH.$'
  12 50 54 23 08 00 01 01 01 01 01 01 01 01 01 01 '.PT#............'
  01 01 01 01 01 01 01 1d 00 72 51 d0 1e 20 6e 28 '.........rQ.. n('
  55 00 80 68 21 00 00 1e 01 1d 80 18 71 1c 16 20 'U..h!.......q.. '
  58 2c 25 00 80 68 21 00 00 9e 00 00 00 fc 00 56 'X,%..h!........V'
  41 32 32 4c 46 48 44 54 56 31 30 54 00 00 00 fd 'A22LFHDTV10T....'
  00 38 3e 1e 44 0f 00 0a 20 20 20 20 20 20 01 2b '.8>.D...      .+'
Checksum: 0x2b

----------------

Block 3, CTA-861 Extension Block:
  Revision: 3
  Basic audio support
  Supports YCbCr 4:4:4
  Supports YCbCr 4:2:2
  Native detailed modes: 2
  Video Data Block:
    VIC   1:   640x480    59.940476 Hz   4:3     31.469 kHz     25.175000 MHz
    VIC   2:   720x480    59.940060 Hz   4:3     31.469 kHz     27.000000 MHz
    VIC   3:   720x480    59.940060 Hz  16:9     31.469 kHz     27.000000 MHz
    VIC   4:  1280x720    60.000000 Hz  16:9     45.000 kHz     74.250000 MHz
    VIC   5:  1920x1080i  60.000000 Hz  16:9     33.750 kHz     74.250000 MHz
    VIC   6:  1440x480i   59.940060 Hz   4:3     15.734 kHz     27.000000 MHz
    VIC   7:  1440x480i   59.940060 Hz  16:9     15.734 kHz     27.000000 MHz
    VIC  16:  1920x1080   60.000000 Hz  16:9     67.500 kHz    148.500000 MHz (native)
    VIC  34:  1920x1080   30.000000 Hz  16:9     33.750 kHz     74.250000 MHz (native)
  Audio Data Block:
    Linear PCM:
      Max channels: 2
      Supported sample rates (kHz): 192 96 48 44.1 32
      Supported sample sizes (bits): 20 16
    AC-3:
      Max channels: 6
      Supported sample rates (kHz): 48 44.1 32
      Maximum bit rate: 640 kb/s
  Speaker Allocation Data Block:
    FL/FR - Front Left/Right
  Vendor-Specific Data Block (HDMI), OUI 00-0C-03:
    Source physical address: 1.0.0.0
  Detailed Timing Descriptors:
    DTD  8:  1920x1080i  60.000000 Hz  16:9     33.750 kHz     74.250000 MHz (640 mm x 360 mm)
                  Hfront   88 Hsync  44 Hback  148 Hpol P
                  Vfront    2 Vsync   5 Vback   15 Vpol P Vfront +0.5 Odd Field
                  Vfront    2 Vsync   5 Vback   15 Vpol P Vback  +0.5 Even Field
    DTD  9:  1280x720    60.000000 Hz  16:9     45.000 kHz     74.250000 MHz (640 mm x 360 mm)
                  Hfront  110 Hsync  40 Hback  220 Hpol P
                  Vfront    5 Vsync   5 Vback   20 Vpol P
    DTD 10:   720x480    59.940060 Hz   3:2     31.469 kHz     27.000000 MHz (640 mm x 360 mm)
                  Hfront   16 Hsync  62 Hback   60 Hpol N
                  Vfront    9 Vsync   6 Vback   30 Vpol N
    DTD 11:  1440x480i   59.940060 Hz   3:1     15.734 kHz     27.000000 MHz (640 mm x 360 mm)
                  Hfront   38 Hsync 124 Hback  114 Hpol N
                  Vfront    4 Vsync   3 Vback   15 Vpol N Vfront +0.5 Odd Field
                  Vfront    4 Vsync   3 Vback   15 Vpol N Vback  +0.5 Even Field
    DTD 12:   720x480    59.940060 Hz   3:2     31.469 kHz     27.000000 MHz (400 mm x 300 mm)
                  Hfront   16 Hsync  62 Hback   60 Hpol N
                  Vfront    9 Vsync   6 Vback   30 Vpol N
Checksum: 0xbd  Unused space in Extension Block: 6 bytes

----------------

Warnings:

Block 0, Base EDID:
  Vendor & Product Identification: The serial number is one of the known dummy values, it should probably be set to 0.
Block 1, CTA-861 Extension Block:
  IT Video Formats are overscanned by default, but normally this should be underscanned.
  Video Data Block: VIC 1 and the first DTD are not identical. Is this intended?
  Video Data Block: All VICs are in ascending order, and the first (preferred) VIC <= 4, is that intended?
  Detailed Timing Descriptor #5: Image size is 640x360 mm, but based on the picture AR it should be 640x426 mm.
  Detailed Timing Descriptor #6: Image size is 640x360 mm, but based on the picture AR it should be 640x213 mm.
  Detailed Timing Descriptor #7: Image size is 400x300 mm, but based on the picture AR it should be 400x266 mm.
  Add a Colorimetry Data Block with the sRGB colorimetry bit set to avoid interop issues.
Block 3, CTA-861 Extension Block:
  IT Video Formats are overscanned by default, but normally this should be underscanned.
  Video Data Block: All VICs are in ascending order, and the first (preferred) VIC <= 4, is that intended?
  Detailed Timing Descriptor #10: Image size is 640x360 mm, but based on the picture AR it should be 640x426 mm.
  Detailed Timing Descriptor #11: Image size is 640x360 mm, but based on the picture AR it should be 640x213 mm.
  Detailed Timing Descriptor #12: Image size is 400x300 mm, but based on the picture AR it should be 400x266 mm.
EDID:
  Base EDID: Some timings are out of range of the Monitor Ranges:
    Vertical Freq: 30.000 - 60.317 Hz (Monitor: 56.000 - 62.000 Hz)
    Horizontal Freq: 15.734 - 67.500 kHz (Monitor: 30.000 - 68.000 kHz)

Failures:

Block 0, Base EDID:
  Detailed Timing Descriptor #1: Mismatch of image size 640x360 mm vs display size 480x270 mm.
  Detailed Timing Descriptor #2: Mismatch of image size 640x360 mm vs display size 480x270 mm.
Block 1, CTA-861 Extension Block:
  Detailed Timing Descriptor #3: Mismatch of image size 640x360 mm vs display size 480x270 mm.
  Detailed Timing Descriptor #4: Mismatch of image size 640x360 mm vs display size 480x270 mm.
  Detailed Timing Descriptor #5: Mismatch of image size 640x360 mm vs display size 480x270 mm.
  Detailed Timing Descriptor #6: Mismatch of image size 640x360 mm vs display size 480x270 mm.
  Detailed Timing Descriptor #7: Mismatch of image size 400x300 mm vs display size 480x270 mm.
  Missing VCDB, needed for Set Selectable RGB Quantization to avoid interop issues.
Block 2, Base EDID:
  Unknown Extension Block.
Block 3, CTA-861 Extension Block:
  Video Data Block: Duplicate VIC 1.
  Video Data Block: Duplicate VIC 2.
  Video Data Block: Duplicate VIC 3.
  Video Data Block: Duplicate VIC 4.
  Video Data Block: Duplicate VIC 5.
  Video Data Block: Duplicate VIC 6.
  Video Data Block: Duplicate VIC 7.
  Video Data Block: Duplicate VIC 16.
  Video Data Block: Duplicate VIC 34.
  Speaker Allocation Data Block: Only one instance of this Data Block is allowed.
  Detailed Timing Descriptor #8: Mismatch of image size 640x360 mm vs display size 480x270 mm.
  Detailed Timing Descriptor #9: Mismatch of image size 640x360 mm vs display size 480x270 mm.
  Detailed Timing Descriptor #10: Mismatch of image size 640x360 mm vs display size 480x270 mm.
  Detailed Timing Descriptor #11: Mismatch of image size 640x360 mm vs display size 480x270 mm.
  Detailed Timing Descriptor #12: Mismatch of image size 400x300 mm vs display size 480x270 mm.
EDID:
  Base EDID: The DTD max image size is 640x360mm, which is larger than the display size 480.0x270.0mm.
  Base EDID: EDID specified 1 extension block(s), but found 3 extension block(s).
  Base EDID: EDID 1.3 requires a Block Map Extension in Block 1 if there are more than 2 blocks in the EDID.
  CTA-861: Native progressive timings are a mix of several resolutions.

EDID conformity: FAIL
