edid-decode (hex):

00 ff ff ff ff ff ff 00 25 d6 18 24 01 00 00 00
1c 1d 01 03 80 34 1e 78 2a cc 17 a3 54 4c 99 26
0f 47 48 af cf 80 81 80 a9 c0 81 80 95 00 81 00
b3 00 81 40 d1 fc 02 3a 80 18 71 38 2d 40 58 2c
45 00 09 25 21 00 00 1e fe 7e 80 72 70 38 1e 40
18 20 35 00 09 25 21 00 00 1e 00 00 00 fd 00 30
90 a2 a2 23 00 0a 20 20 20 20 20 20 00 00 00 fc
00 47 54 32 34 52 31 38 0a 20 20 20 20 20 01 1b

02 03 35 f1 4c 90 1f 05 14 04 13 03 12 02 11 01
4c 23 09 07 07 83 01 00 00 67 03 0c 00 10 00 38
44 68 1a 00 00 01 01 30 7a 00 e3 05 e3 01 e6 06
07 01 60 50 00 86 6f 80 a0 70 38 40 40 30 20 35
00 20 2f 21 00 00 1e 00 00 00 00 00 00 00 00 00
00 00 00 00 00 00 00 00 00 00 00 00 00 00 00 00
00 00 00 00 00 00 00 00 00 00 00 00 00 00 00 00
00 00 00 00 00 00 00 00 00 00 00 00 00 00 00 87

00 ff ff ff ff ff ff 00 25 d6 18 24 01 00 00 00
1c 1d 01 03 80 34 1e 78 2a cc 17 a3 54 4c 99 26
0f 47 48 af cf 80 81 80 a9 c0 81 80 95 00 81 00
b3 00 81 40 d1 fc 02 3a 80 18 71 38 2d 40 58 2c
45 00 09 25 21 00 00 1e fe 7e 80 72 70 38 1e 40
18 20 35 00 09 25 21 00 00 1e 00 00 00 fd 00 30
90 a2 a2 23 00 0a 20 20 20 20 20 20 00 00 00 fc
00 47 54 32 34 52 31 38 0a 20 20 20 20 20 01 1b

02 03 35 f1 4c 90 1f 05 14 04 13 03 12 02 11 01
4c 23 09 07 07 83 01 00 00 67 03 0c 00 10 00 38
44 68 1a 00 00 01 01 30 7a 00 e3 05 e3 01 e6 06
07 01 60 50 00 86 6f 80 a0 70 38 40 40 30 20 35
00 20 2f 21 00 00 1e 00 00 00 00 00 00 00 00 00
00 00 00 00 00 00 00 00 00 00 00 00 00 00 00 00
00 00 00 00 00 00 00 00 00 00 00 00 00 00 00 00
00 00 00 00 00 00 00 00 00 00 00 00 00 00 00 87

----------------

Block 0, Base EDID:
  EDID Structure Version & Revision: 1.3
  Vendor & Product Identification:
    Manufacturer: INV
    Model: 9240
    Serial Number: ...
    Made in: week 28 of 2019
  Basic Display Parameters & Features:
    Digital display
    Maximum image size: 52 cm x 30 cm
    Gamma: 2.20
    DPMS levels: Off
    RGB color display
    First detailed timing is the preferred timing
  Color Characteristics:
    Red  : 0.6396, 0.3281
    Green: 0.2998, 0.5976
    Blue : 0.1484, 0.0595
    White: 0.2783, 0.2841
  Established Timings I & II:
    IBM     :   720x400    70.081663 Hz   9:5     31.467 kHz     28.320000 MHz
    DMT 0x04:   640x480    59.940476 Hz   4:3     31.469 kHz     25.175000 MHz
    DMT 0x05:   640x480    72.808802 Hz   4:3     37.861 kHz     31.500000 MHz
    DMT 0x06:   640x480    75.000000 Hz   4:3     37.500 kHz     31.500000 MHz
    DMT 0x08:   800x600    56.250000 Hz   4:3     35.156 kHz     36.000000 MHz
    DMT 0x09:   800x600    60.316541 Hz   4:3     37.879 kHz     40.000000 MHz
    DMT 0x0a:   800x600    72.187572 Hz   4:3     48.077 kHz     50.000000 MHz
    DMT 0x0b:   800x600    75.000000 Hz   4:3     46.875 kHz     49.500000 MHz
    DMT 0x10:  1024x768    60.003840 Hz   4:3     48.363 kHz     65.000000 MHz
    DMT 0x11:  1024x768    70.069359 Hz   4:3     56.476 kHz     75.000000 MHz
    DMT 0x12:  1024x768    75.028582 Hz   4:3     60.023 kHz     78.750000 MHz
    DMT 0x24:  1280x1024   75.024675 Hz   5:4     79.976 kHz    135.000000 MHz
    Apple   :  1152x870    75.061550 Hz 192:145   68.681 kHz    100.000000 MHz
  Standard Timings:
    DMT 0x23:  1280x1024   60.019740 Hz   5:4     63.981 kHz    108.000000 MHz
    DMT 0x53:  1600x900    60.000000 Hz  16:9     60.000 kHz    108.000000 MHz (RB)
    DMT 0x23:  1280x1024   60.019740 Hz   5:4     63.981 kHz    108.000000 MHz
    DMT 0x2f:  1440x900    59.887445 Hz  16:10    55.935 kHz    106.500000 MHz
    DMT 0x1c:  1280x800    59.810326 Hz  16:10    49.702 kHz     83.500000 MHz
    DMT 0x3a:  1680x1050   59.954250 Hz  16:10    65.290 kHz    146.250000 MHz
    DMT 0x20:  1280x960    60.000000 Hz   4:3     60.000 kHz    108.000000 MHz
    GTF     :  1920x1080  119.999987 Hz  16:9    138.840 kHz    368.759000 MHz
  Detailed Timing Descriptors:
    DTD 1:  1920x1080   60.000000 Hz  16:9     67.500 kHz    148.500000 MHz (521 mm x 293 mm)
                 Hfront   88 Hsync  44 Hback  148 Hpol P
                 Vfront    4 Vsync   5 Vback   36 Vpol P
    DTD 2:  1920x1080  143.993551 Hz  16:9    159.833 kHz    325.100000 MHz (521 mm x 293 mm)
                 Hfront   24 Hsync  32 Hback   58 Hpol P
                 Vfront    3 Vsync   5 Vback   22 Vpol P
    Display Range Limits:
      Monitor ranges (GTF): 48-144 Hz V, 162-162 kHz H, max dotclock 350 MHz
    Display Product Name: 'GT24R18'
  Extension blocks: 1
Checksum: 0x1b

----------------

Block 1, CTA-861 Extension Block:
  Revision: 3
  Underscans IT Video Formats by default
  Basic audio support
  Supports YCbCr 4:4:4
  Supports YCbCr 4:2:2
  Native DTDs: 1
  Video Data Block:
    VIC  16:  1920x1080   60.000000 Hz  16:9     67.500 kHz    148.500000 MHz (native)
    VIC  31:  1920x1080   50.000000 Hz  16:9     56.250 kHz    148.500000 MHz
    VIC   5:  1920x1080i  60.000000 Hz  16:9     33.750 kHz     74.250000 MHz
    VIC  20:  1920x1080i  50.000000 Hz  16:9     28.125 kHz     74.250000 MHz
    VIC   4:  1280x720    60.000000 Hz  16:9     45.000 kHz     74.250000 MHz
    VIC  19:  1280x720    50.000000 Hz  16:9     37.500 kHz     74.250000 MHz
    VIC   3:   720x480    59.940060 Hz  16:9     31.469 kHz     27.000000 MHz
    VIC  18:   720x576    50.000000 Hz  16:9     31.250 kHz     27.000000 MHz
    VIC   2:   720x480    59.940060 Hz   4:3     31.469 kHz     27.000000 MHz
    VIC  17:   720x576    50.000000 Hz   4:3     31.250 kHz     27.000000 MHz
    VIC   1:   640x480    59.940476 Hz   4:3     31.469 kHz     25.175000 MHz
    VIC  76:  1920x1080   60.000000 Hz  64:27    67.500 kHz    148.500000 MHz
  Audio Data Block:
    Linear PCM:
      Max channels: 2
      Supported sample rates (kHz): 48 44.1 32
      Supported sample sizes (bits): 24 20 16
  Speaker Allocation Data Block:
    FL/FR - Front Left/Right
  Vendor-Specific Data Block (HDMI), OUI 00-0C-03:
    Source physical address: 1.0.0.0
    DC_36bit
    DC_30bit
    DC_Y444
    Maximum TMDS clock: 340 MHz
  Vendor-Specific Data Block (AMD), OUI 00-00-1A:
    Version: 1
    Flags 1: 0x01
      FreeSync Supported
    Minimum Refresh Rate: 48 Hz
    Maximum Refresh Rate: 122 Hz
  Colorimetry Data Block:
    xvYCC601
    xvYCC709
    BT2020cYCC
    BT2020YCC
    BT2020RGB
    Gamut Boundary Description Metadata Profile P0
  HDR Static Metadata Data Block:
    Electro optical transfer functions:
      Traditional gamma - SDR luminance range
      Traditional gamma - HDR luminance range
      SMPTE ST2084
    Supported static metadata descriptors:
      Static metadata type 1
    Desired content max luminance: 96 (400.000 cd/m^2)
    Desired content max frame-average luminance: 80 (282.843 cd/m^2)
    Desired content min luminance: 0 (0.000 cd/m^2)
  Detailed Timing Descriptors:
    DTD 3:  1920x1080  119.982181 Hz  16:9    137.260 kHz    285.500000 MHz (544 mm x 303 mm)
                 Hfront   48 Hsync  32 Hback   80 Hpol P
                 Vfront    3 Vsync   5 Vback   56 Vpol P
Checksum: 0x87  Unused space in Extension Block: 56 bytes

----------------

Warnings:

Block 0, Base EDID:
  Vendor & Product Identification: The serial number is one of the known dummy values, it should probably be set to 0.
Block 1, CTA-861 Extension Block:
  Colorimetry Data Block: Set the sRGB colorimetry bit to avoid interop issues.
EDID:
  Base EDID: Some timings are out of range of the Monitor Ranges:
    Horizontal Freq: 28.125 - 159.832 kHz (Monitor: 162.000 - 162.000 kHz)
    Maximum Clock: 368.759 MHz (Monitor: 350.000 MHz)

Failures:

Block 1, CTA-861 Extension Block:
  Detailed Timing Descriptor #3: Mismatch of image size 544x303 mm vs display size 520x300 mm.
  Missing VCDB, needed for Set Selectable RGB Quantization to avoid interop issues.
EDID:
  Extension Block 2 started with EDID header, ignoring Extension Blocks >= 2.
  Base EDID: The DTD max image size is 544x303mm, which is larger than the display size 520.0x300.0mm.
  CTA-861: The maximum HDMI TMDS clock is 340000 kHz, but one or more video timings go up to 368759 kHz.

EDID conformity: FAIL
