edid-decode (hex):

00 ff ff ff ff ff ff 00 09 e5 e7 0c 6c 00 00 00
11 22 01 04 a5 21 15 78 07 5b 31 a6 52 4d 98 25
0e 50 54 00 00 00 01 01 01 01 01 01 01 01 01 01
01 01 01 01 01 01 60 3f 80 a0 70 b0 64 40 30 20
66 00 49 ce 10 00 00 1a 00 00 00 fd 00 30 a5 d7
d7 2d 01 0a 20 20 20 20 20 20 00 00 00 fe 00 42
4f 45 20 4e 4a 0a 20 20 20 20 20 20 00 00 00 fc
00 4e 45 31 35 33 57 55 4d 2d 4e 59 31 0a 01 5e

70 20 79 02 00 21 01 1d da 0c 0c 08 80 07 b0 04
88 62 2a 52 d9 d4 98 51 d2 0e 00 35 54 b0 5c b0
5c cd 34 12 78 22 00 14 cf ce 06 85 7f 07 9f 00
2f 00 1f 00 af 04 63 00 05 00 05 00 2b 00 0c 27
00 3c a4 00 00 27 00 30 3b 00 00 2e 00 06 00 42
b0 5c b0 5c 81 00 15 74 1a 00 00 03 51 30 a5 00
00 53 51 53 51 a5 00 00 00 00 00 00 00 00 00 00
00 00 00 00 00 00 00 00 00 00 00 00 00 00 60 90

00 ff ff ff ff ff ff 00 09 e5 e7 0c 6c 00 00 00
11 22 01 04 a5 21 15 78 07 5b 31 a6 52 4d 98 25
0e 50 54 00 00 00 01 01 01 01 01 01 01 01 01 01
01 01 01 01 01 01 60 3f 80 a0 70 b0 64 40 30 20
66 00 49 ce 10 00 00 1a 00 00 00 fd 00 30 a5 d7
d7 2d 01 0a 20 20 20 20 20 20 00 00 00 fe 00 42
4f 45 20 4e 4a 0a 20 20 20 20 20 20 00 00 00 fc
00 4e 45 31 35 33 57 55 4d 2d 4e 59 31 0a 01 5e

70 20 79 02 00 21 01 1d da 0c 0c 08 80 07 b0 04
88 62 2a 52 d9 d4 98 51 d2 0e 00 35 54 b0 5c b0
5c cd 34 12 78 22 00 14 cf ce 06 85 7f 07 9f 00
2f 00 1f 00 af 04 63 00 05 00 05 00 2b 00 0c 27
00 3c a4 00 00 27 00 30 3b 00 00 2e 00 06 00 42
b0 5c b0 5c 81 00 15 74 1a 00 00 03 51 30 a5 00
00 53 51 53 51 a5 00 00 00 00 00 00 00 00 00 00
00 00 00 00 00 00 00 00 00 00 00 00 00 00 60 90

----------------

Block 0, Base EDID:
  EDID Structure Version & Revision: 1.4
  Vendor & Product Identification:
    Manufacturer: BOE
    Model: 3303
    Serial Number: ...
    Made in: week 17 of 2024
  Basic Display Parameters & Features:
    Digital display
    Bits per primary color channel: 8
    DisplayPort interface
    Maximum image size: 33 cm x 21 cm
    Gamma: 2.20
    Supported color formats: RGB 4:4:4
    Default (sRGB) color space is primary color space
    First detailed timing includes the native pixel format and preferred refresh rate
    Display supports continuous frequencies
  Color Characteristics:
    Red  : 0.6494, 0.3212
    Green: 0.3027, 0.5966
    Blue : 0.1445, 0.0576
    White: 0.3125, 0.3291
  Established Timings I & II: none
  Standard Timings: none
  Detailed Timing Descriptors:
    DTD 1:  1920x1200   60.000000 Hz  16:10    78.000 kHz    162.240000 MHz (329 mm x 206 mm)
                 Hfront   48 Hsync  32 Hback   80 Hpol P
                 Vfront    6 Vsync   6 Vback   88 Vpol N
    Display Range Limits:
      Monitor ranges (Range Limits Only): 48-165 Hz V, 215-215 kHz H, max dotclock 450 MHz
    Alphanumeric Data String: 'BOE NJ'
    Display Product Name: 'NE153WUM-NY1'
  Extension blocks: 1
Checksum: 0x5e

----------------

Block 1, DisplayID Extension Block:
  Version: 2.0
  Extension Count: 0
  Display Product Primary Use Case: None of the listed primary use cases; generic display
  Display Parameters Data Block (0x21):
    Image size: 329.0 mm x 206.0 mm
    Display native pixel format: 1920x1200
    Scan Orientation: Left to Right, Top to Bottom
    Luminance Information: Guidance for the Source device
    Color Information: CIE 1931
    Audio Speaker Information: not integrated
    Native Color Chromaticity:
      Primary #1:  (0.648926, 0.320801)
      Primary #2:  (0.302979, 0.596924)
      Primary #3:  (0.144775, 0.057861)
      White Point: (0.312500, 0.328857)
    Native Maximum Luminance (Full Coverage): 300.000000 cd/m^2
    Native Maximum Luminance (10% Rectangular Coverage): 300.000000 cd/m^2
    Native Minimum Luminance: 0.300049 cd/m^2
    Native Color Depth: 8 bpc
    Display Device Technology: Active Matrix LCD
    Display Device Theme Preference: No Preference
    Native Gamma EOTF: 2.20
  Video Timing Modes Type 7 - Detailed Timings Data Block:
    DTD:  1920x1200  165.000000 Hz  16:10   214.500 kHz    446.160000 MHz (aspect 16:10, no 3D stereo, preferred)
               Hfront   48 Hsync  32 Hback   80 Hpol N
               Vfront    6 Vsync   6 Vback   88 Vpol N
  Adaptive Sync Data Block:
    Descriptor #1:
      Native Panel Range
      Fixed Average V-Total and Adaptive V-Total
      Supports Seamless Transition
      'Max Single Frame Duration Increase' field value without jitter impact
      'Max Single Frame Duration Decrease' field value without jitter impact
      Max Duration Increase: 0.00 ms
      Max Duration Decrease: 0.00 ms
      Min Refresh Rate: 60 Hz
      Max Refresh Rate: 165 Hz
    Descriptor #2:
      Native Panel Range
      Fixed Average V-Total and Adaptive V-Total
      Supports Seamless Transition
      'Max Single Frame Duration Increase' field value without jitter impact
      'Max Single Frame Duration Decrease' field value without jitter impact
      Max Duration Increase: 0.00 ms
      Max Duration Decrease: 0.00 ms
      Min Refresh Rate: 48 Hz
      Max Refresh Rate: 60 Hz
  Brightness Luminance Range Data Block:
    Minimum SDR Luminance (Full Coverage): 3.000000 cd/m^2
    Maximum Suggested SDR Luminance (Full Coverage): 300.000000 cd/m^2
    Maximum Boost SDR Luminance: 300.000000 cd/m^2
  CTA-861 DisplayID Data Block:
  Vendor-Specific Data Block (AMD), OUI 00-00-1A:
    Version: 3
    Feature Caps: 0x51
      FreeSync Panel Replay Supported
    Minimum Refresh Rate: 48 Hz
    Maximum Refresh Rate: 165 Hz
    Flags 1.x: 0x00
    Flags 2.x: 0x00
  Checksum: 0x60
Checksum: 0x90

----------------

Warnings:

EDID:
  Base EDID: Some timings are out of range of the Monitor Ranges:
    Horizontal Freq: 78.000 - 214.500 kHz (Monitor: 215.000 - 215.000 kHz)

Failures:

Block 0, Base EDID:
  Basic Display Parameters & Features: sRGB is signaled, but the chromaticities do not match.
EDID:
  Extension Block 2 started with EDID header, ignoring Extension Blocks >= 2.

EDID conformity: FAIL
