edid-decode (hex):

00 ff ff ff ff ff ff 00 4d 10 72 15 a1 11 00 24
24 20 01 04 b5 1d 13 78 03 7d 77 ad 50 46 ad 26
0f 50 53 00 00 00 01 01 01 01 01 01 01 01 01 01
01 01 01 01 01 01 60 b6 00 a0 90 00 2b 60 30 20
3a 00 23 c2 10 00 00 18 60 b6 00 a0 90 00 56 66
30 20 3a 00 23 c2 10 00 00 18 00 00 00 fd 00 18
78 be be 2f 01 00 00 00 00 00 00 00 00 00 00 fc
00 4c 51 31 33 38 50 31 4a 58 36 31 0a 20 01 b3

02 03 0f 00 e3 05 80 00 e6 06 05 01 73 6a 0b 00
00 00 00 00 00 00 00 00 00 00 00 00 00 00 00 00
00 00 00 00 00 00 00 00 00 00 00 00 00 00 00 00
00 00 00 00 00 00 00 00 00 00 00 00 00 00 00 00
00 00 00 00 00 00 00 00 00 00 00 00 00 00 00 00
00 00 00 00 00 00 00 00 00 00 00 00 00 00 00 00
00 00 00 00 00 00 00 00 00 00 00 00 00 00 00 00
00 00 00 00 00 00 00 00 00 00 00 00 00 00 00 aa

00 ff ff ff ff ff ff 00 4d 10 72 15 a1 11 00 24
24 20 01 04 b5 1d 13 78 03 7d 77 ad 50 46 ad 26
0f 50 53 00 00 00 01 01 01 01 01 01 01 01 01 01
01 01 01 01 01 01 60 b6 00 a0 90 00 2b 60 30 20
3a 00 23 c2 10 00 00 18 60 b6 00 a0 90 00 56 66
30 20 3a 00 23 c2 10 00 00 18 00 00 00 fd 00 18
78 be be 2f 01 00 00 00 00 00 00 00 00 00 00 fc
00 4c 51 31 33 38 50 31 4a 58 36 31 0a 20 01 b3

02 03 0f 00 e3 05 80 00 e6 06 05 01 73 6a 0b 00
00 00 00 00 00 00 00 00 00 00 00 00 00 00 00 00
00 00 00 00 00 00 00 00 00 00 00 00 00 00 00 00
00 00 00 00 00 00 00 00 00 00 00 00 00 00 00 00
00 00 00 00 00 00 00 00 00 00 00 00 00 00 00 00
00 00 00 00 00 00 00 00 00 00 00 00 00 00 00 00
00 00 00 00 00 00 00 00 00 00 00 00 00 00 00 00
00 00 00 00 00 00 00 00 00 00 00 00 00 00 00 aa

----------------

Block 0, Base EDID:
  EDID Structure Version & Revision: 1.4
  Vendor & Product Identification:
    Manufacturer: SHP
    Model: 5490
    Serial Number: ...
    Made in: week 36 of 2022
  Basic Display Parameters & Features:
    Digital display
    Bits per primary color channel: 10
    DisplayPort interface
    Maximum image size: 29 cm x 19 cm
    Gamma: 2.20
    Supported color formats: RGB 4:4:4
    First detailed timing includes the native pixel format and preferred refresh rate
    Display supports continuous frequencies
  Color Characteristics:
    Red  : 0.6767, 0.3154
    Green: 0.2763, 0.6767
    Blue : 0.1494, 0.0615
    White: 0.3134, 0.3271
  Established Timings I & II: none
  Standard Timings: none
  Detailed Timing Descriptors:
    DTD 1:  2304x1536  120.000329 Hz   3:2    189.481 kHz    466.880000 MHz (291 mm x 194 mm)
                 Hfront   48 Hsync  32 Hback   80 Hpol N
                 Vfront    3 Vsync  10 Vback   30 Vpol N
    DTD 2:  2304x1536   60.000164 Hz   3:2    189.481 kHz    466.880000 MHz (291 mm x 194 mm)
                 Hfront   48 Hsync  32 Hback   80 Hpol N
                 Vfront    3 Vsync  10 Vback 1609 Vpol N
    Display Range Limits:
      Monitor ranges (Range Limits Only): 24-120 Hz V, 190-190 kHz H, max dotclock 470 MHz
    Display Product Name: 'LQ138P1JX61'
  Extension blocks: 1
Checksum: 0xb3

----------------

Block 1, CTA-861 Extension Block:
  Revision: 3
  Native DTDs: 0
  Colorimetry Data Block:
    BT2020RGB
  HDR Static Metadata Data Block:
    Electro optical transfer functions:
      Traditional gamma - SDR luminance range
      SMPTE ST2084
    Supported static metadata descriptors:
      Static metadata type 1
    Desired content max luminance: 115 (603.666 cd/m^2)
    Desired content max frame-average luminance: 106 (496.743 cd/m^2)
    Desired content min luminance: 11 (0.011 cd/m^2)
Checksum: 0xaa  Unused space in Extension Block: 112 bytes

----------------

Warnings:

Block 1, CTA-861 Extension Block:
  IT Video Formats are overscanned by default, but normally this should be underscanned.
  Colorimetry Data Block: Set the sRGB colorimetry bit to avoid interop issues.
EDID:
  Base EDID: Some timings are out of range of the Monitor Ranges:
    Horizontal Freq: 189.480 - 189.480 kHz (Monitor: 190.000 - 190.000 kHz)
    Could be due to a Monitor Range off-by-one rounding issue

Failures:

Block 0, Base EDID:
  Display Range Limits: Byte 11 is 0x00 instead of 0x0a.
  Display Range Limits: Bytes 12-17 must be 0x20.
Block 1, CTA-861 Extension Block:
  Required 640x480p60 timings are missing in the established timings and the SVD list (VIC 1).
  Missing VCDB, needed for Set Selectable RGB Quantization to avoid interop issues.
EDID:
  Extension Block 2 started with EDID header, ignoring Extension Blocks >= 2.

EDID conformity: FAIL
