edid-decode (hex):

00 ff ff ff ff ff ff 00 26 cf 36 05 00 00 00 00
00 1c 01 04 95 1d 11 78 0a de 50 a3 54 4c 99 26
0f 50 54 00 00 00 01 01 01 01 01 01 01 01 01 01
01 01 01 01 01 01 38 36 80 a0 70 38 20 40 18 30
3c 00 26 a5 10 00 00 18 5c 2b 80 a0 70 38 20 40
18 30 3c 00 26 a5 10 00 00 18 00 00 00 fe 00 37
52 4b 38 46 80 31 33 33 4e 57 46 34 00 00 00 00
00 00 41 21 16 01 10 00 00 0a 01 0a 20 20 00 e6

00 ff ff ff ff ff ff 00 26 cf 36 05 00 00 00 00
00 1c 01 04 95 1d 11 78 0a de 50 a3 54 4c 99 26
0f 50 54 00 00 00 01 01 01 01 01 01 01 01 01 01
01 01 01 01 01 01 38 36 80 a0 70 38 20 40 18 30
3c 00 26 a5 10 00 00 18 5c 2b 80 a0 70 38 20 40
18 30 3c 00 26 a5 10 00 00 18 00 00 00 fe 00 37
52 4b 38 46 80 31 33 33 4e 57 46 34 00 00 00 00
00 00 41 21 16 01 10 00 00 0a 01 0a 20 20 00 e6

----------------

Block 0, Base EDID:
  EDID Structure Version & Revision: 1.4
  Vendor & Product Identification:
    Manufacturer: IVO
    Model: 1334
    Made in: 2018
  Basic Display Parameters & Features:
    Digital display
    Bits per primary color channel: 6
    DisplayPort interface
    Maximum image size: 29 cm x 17 cm
    Gamma: 2.20
    Supported color formats: RGB 4:4:4, YCrCb 4:4:4
    First detailed timing includes the native pixel format and preferred refresh rate
  Color Characteristics:
    Red  : 0.6396, 0.3291
    Green: 0.2998, 0.5996
    Blue : 0.1494, 0.0595
    White: 0.3125, 0.3281
  Established Timings I & II: none
  Standard Timings: none
  Detailed Timing Descriptors:
    DTD 1:  1920x1080   60.009685 Hz  16:9     66.731 kHz    138.800000 MHz (294 mm x 165 mm)
                 Hfront   24 Hsync  48 Hback   88 Hpol N
                 Vfront    3 Vsync  12 Vback   17 Vpol N
    DTD 2:  1920x1080   47.990454 Hz  16:9     53.365 kHz    111.000000 MHz (294 mm x 165 mm)
                 Hfront   24 Hsync  48 Hback   88 Hpol N
                 Vfront    3 Vsync  12 Vback   17 Vpol N
    Alphanumeric Data String: '7RK8F.133NWF4'
    Manufacturer-Specified Display Descriptor (0x00): 00 00 00 00 41 21 16 01 10 00 00 0a 01 0a 20 20 '....A!........  '
Checksum: 0xe6

----------------

Block 1, Unknown EDID Extension Block 0x00:
  00 ff ff ff ff ff ff 00 26 cf 36 05 00 00 00 00 '........&.6.....'
  00 1c 01 04 95 1d 11 78 0a de 50 a3 54 4c 99 26 '.......x..P.TL.&'
  0f 50 54 00 00 00 01 01 01 01 01 01 01 01 01 01 '.PT.............'
  01 01 01 01 01 01 38 36 80 a0 70 38 20 40 18 30 '......86..p8 @.0'
  3c 00 26 a5 10 00 00 18 5c 2b 80 a0 70 38 20 40 '<.&.....\+..p8 @'
  18 30 3c 00 26 a5 10 00 00 18 00 00 00 fe 00 37 '.0<.&..........7'
  52 4b 38 46 80 31 33 33 4e 57 46 34 00 00 00 00 'RK8F.133NWF4....'
  00 00 41 21 16 01 10 00 00 0a 01 0a 20 20 00 e6 '..A!........  ..'
Checksum: 0xe6

----------------

Warnings:

Block 0, Base EDID:
  Alphanumeric Data String: Non-ASCII character 0x80 at position 5, can cause problems.
  Missing Display Product Name.

Failures:

Block 1, Base EDID:
  Unknown Extension Block.
EDID:
  Base EDID: EDID specified 0 extension block(s), but found 1 extension block(s).

EDID conformity: FAIL
