edid-decode (hex):

00 ff ff ff ff ff ff 00 05 e3 00 00 01 01 01 01
00 1a 01 03 68 34 1d 78 2a ea fd 9e 53 56 a0 26
0d 47 4a 21 08 00 81 c0 01 01 01 01 01 01 01 01
01 01 01 01 01 01 1b 21 50 a0 51 00 1e 30 48 88
35 00 09 25 21 00 00 18 0e 1f 00 80 51 00 1e 30
40 80 37 00 09 25 21 00 00 1c 00 00 00 fc 00 41
4f 43 20 4c 43 44 0a 20 20 20 20 20 00 00 00 fd
00 38 4c 1e 53 11 00 0a 20 20 20 20 20 20 00 79

00 ff ff ff ff ff ff 00 05 e3 00 00 01 01 01 01
00 1a 01 03 68 34 1d 78 2a ea fd 9e 53 56 a0 26
0d 47 4a 21 08 00 81 c0 01 01 01 01 01 01 01 01
01 01 01 01 01 01 1b 21 50 a0 51 00 1e 30 48 88
35 00 09 25 21 00 00 18 0e 1f 00 80 51 00 1e 30
40 80 37 00 09 25 21 00 00 1c 00 00 00 fc 00 41
4f 43 20 4c 43 44 0a 20 20 20 20 20 00 00 00 fd
00 38 4c 1e 53 11 00 0a 20 20 20 20 20 20 00 79

----------------

Block 0, Base EDID:
  EDID Structure Version & Revision: 1.3
  Vendor & Product Identification:
    Manufacturer: AOC
    Model: 0
    Serial Number: ...
    Made in: 2016
  Basic Display Parameters & Features:
    Analog display
    Signal Level Standard: 0.700 : 0.000 : 0.700 V p-p
    Blank level equals black level
    Sync: Separate
    Maximum image size: 52 cm x 29 cm
    Gamma: 2.20
    DPMS levels: Off
    RGB color display
    First detailed timing is the preferred timing
  Color Characteristics:
    Red  : 0.6201, 0.3261
    Green: 0.3378, 0.6269
    Blue : 0.1513, 0.0537
    White: 0.2802, 0.2900
  Established Timings I & II:
    DMT 0x04:   640x480    59.940476 Hz   4:3     31.469 kHz     25.175000 MHz
    DMT 0x09:   800x600    60.316541 Hz   4:3     37.879 kHz     40.000000 MHz
    DMT 0x10:  1024x768    60.003840 Hz   4:3     48.363 kHz     65.000000 MHz
  Standard Timings:
    DMT 0x55:  1280x720    60.000000 Hz  16:9     45.000 kHz     74.250000 MHz
  Detailed Timing Descriptors:
    DTD 1:  1360x768    59.798991 Hz  85:48    47.720 kHz     84.750000 MHz (521 mm x 293 mm)
                 Hfront   72 Hsync 136 Hback  208 Hpol N
                 Vfront    3 Vsync   5 Vback   22 Vpol N
    DTD 2:  1280x768    59.870228 Hz   5:3     47.776 kHz     79.500000 MHz (521 mm x 293 mm)
                 Hfront   64 Hsync 128 Hback  192 Hpol N
                 Vfront    3 Vsync   7 Vback   20 Vpol P
    Display Product Name: 'AOC LCD'
    Display Range Limits:
      Monitor ranges (GTF): 56-76 Hz V, 30-83 kHz H, max dotclock 170 MHz
Checksum: 0x79

----------------

Block 1, Unknown EDID Extension Block 0x00:
  00 ff ff ff ff ff ff 00 05 e3 00 00 01 01 01 01 '................'
  00 1a 01 03 68 34 1d 78 2a ea fd 9e 53 56 a0 26 '....h4.x*...SV.&'
  0d 47 4a 21 08 00 81 c0 01 01 01 01 01 01 01 01 '.GJ!............'
  01 01 01 01 01 01 1b 21 50 a0 51 00 1e 30 48 88 '.......!P.Q..0H.'
  35 00 09 25 21 00 00 18 0e 1f 00 80 51 00 1e 30 '5..%!.......Q..0'
  40 80 37 00 09 25 21 00 00 1c 00 00 00 fc 00 41 '@.7..%!........A'
  4f 43 20 4c 43 44 0a 20 20 20 20 20 00 00 00 fd 'OC LCD.     ....'
  00 38 4c 1e 53 11 00 0a 20 20 20 20 20 20 00 79 '.8L.S...      .y'
Checksum: 0x79

----------------

Warnings:

Block 0, Base EDID:
  Vendor & Product Identification: The serial number is one of the known dummy values, it should probably be set to 0.
  Detailed Timing Descriptor #2: Image size is 521x293 mm, but based on the picture AR it should be 521x312 mm.

Failures:

Block 1, Base EDID:
  Unknown Extension Block.
EDID:
  Base EDID: EDID specified 0 extension block(s), but found 1 extension block(s).

EDID conformity: FAIL
