edid-decode (hex):

00 ff ff ff ff ff ff 00 22 0e 4c 40 01 00 00 00
01 1d 01 03 81 3c 22 78 ea 64 b5 ab 52 38 ab 25
13 50 54 00 00 00 01 01 01 01 01 01 01 01 01 01
01 01 01 01 01 01 9e 37 80 b4 70 38 32 40 2c 2c
45 00 56 50 21 00 00 1c 00 00 00 10 00 00 00 00
00 00 00 00 00 00 00 00 00 00 00 00 00 fc 00 48
50 20 41 4c 4c 2d 69 6e 2d 4f 6e 65 00 00 00 ff
00 4d 32 37 30 48 41 4e 30 31 2e 31 0a 20 00 c8

00 ff ff ff ff ff ff 00 22 0e 4c 40 01 00 00 00
01 1d 01 03 81 3c 22 78 ea 64 b5 ab 52 38 ab 25
13 50 54 00 00 00 01 01 01 01 01 01 01 01 01 01
01 01 01 01 01 01 9e 37 80 b4 70 38 32 40 2c 2c
45 00 56 50 21 00 00 1c 00 00 00 10 00 00 00 00
00 00 00 00 00 00 00 00 00 00 00 00 00 fc 00 48
50 20 41 4c 4c 2d 69 6e 2d 4f 6e 65 00 00 00 ff
00 4d 32 37 30 48 41 4e 30 31 2e 31 0a 20 00 c8

----------------

Block 0, Base EDID:
  EDID Structure Version & Revision: 1.3
  Vendor & Product Identification:
    Manufacturer: HPN
    Model: 16460
    Serial Number: ...
    Made in: week 1 of 2019
  Basic Display Parameters & Features:
    Digital display
    DFP 1.x compatible TMDS
    Maximum image size: 60 cm x 34 cm
    Gamma: 2.20
    DPMS levels: Standby Suspend Off
    RGB color display
    First detailed timing is the preferred timing
  Color Characteristics:
    Red  : 0.6689, 0.3222
    Green: 0.2197, 0.6679
    Blue : 0.1464, 0.0771
    White: 0.3134, 0.3291
  Established Timings I & II: none
  Standard Timings: none
  Detailed Timing Descriptors:
    DTD 1:  1920x1080   60.000000 Hz  16:9     67.800 kHz    142.380000 MHz (598 mm x 336 mm)
                 Hfront   44 Hsync  44 Hback   92 Hpol N
                 Vfront    4 Vsync   5 Vback   41 Vpol P
    Dummy Descriptor:
    Display Product Name: 'HP ALL-in-One'
    Display Product Serial Number: ...
Checksum: 0xc8

----------------

Block 1, Unknown EDID Extension Block 0x00:
  00 ff ff ff ff ff ff 00 22 0e 4c 40 01 00 00 00 '........".L@....'
  01 1d 01 03 81 3c 22 78 ea 64 b5 ab 52 38 ab 25 '.....<"x.d..R8.%'
  13 50 54 00 00 00 01 01 01 01 01 01 01 01 01 01 '.PT.............'
  01 01 01 01 01 01 9e 37 80 b4 70 38 32 40 2c 2c '.......7..p82@,,'
  45 00 56 50 21 00 00 1c 00 00 00 10 00 00 00 00 'E.VP!...........'
  00 00 00 00 00 00 00 00 00 00 00 00 00 fc 00 48 '...............H'
  50 20 41 4c 4c 2d 69 6e 2d 4f 6e 65 00 00 00 ff 'P ALL-in-One....'
  00 4d 32 37 30 48 41 4e 30 31 2e 31 0a 20 00 c8 '.M270HAN01.1. ..'
Checksum: 0xc8

----------------

Warnings:

Block 0, Base EDID:
  Vendor & Product Identification: The serial number is one of the known dummy values, it should probably be set to 0.

Failures:

Block 0, Base EDID:
  Missing Display Range Limits Descriptor.
Block 1, Base EDID:
  Unknown Extension Block.
EDID:
  Base EDID: EDID specified 0 extension block(s), but found 1 extension block(s).

EDID conformity: FAIL
