edid-decode (hex):

00 ff ff ff ff ff ff 00 22 0e 4c 40 00 00 00 00
01 1d 01 03 80 3b 24 78 2a 05 a5 a6 55 4e 9c 25
11 50 54 a1 08 00 d1 c0 81 c0 a9 c0 b3 00 95 00
81 00 81 80 01 01 02 3a 80 18 71 38 2d 40 58 2c
45 00 55 6e 21 00 00 1e 00 00 00 ff 00 30 30 30
30 30 30 30 30 30 30 30 30 30 00 00 00 fd 00 31
4d 1e 50 11 00 0a 20 20 20 20 20 20 00 00 00 fc
00 48 50 20 43 6f 6e 74 69 6e 6f 0a 20 20 01 cd

02 03 1e f1 45 90 01 02 03 04 23 09 07 07 67 03
0c 00 10 00 00 22 83 01 00 00 e3 05 03 01 02 3a
80 18 71 38 2d 40 58 2c 45 00 0f 28 21 00 00 1e
00 00 00 00 00 00 00 00 00 00 00 00 00 00 00 00
00 00 00 00 00 00 00 00 00 00 00 00 00 00 00 00
00 00 00 00 00 00 00 00 00 00 00 00 00 00 00 00
00 00 00 00 00 00 00 00 00 00 00 00 00 00 00 00
00 00 00 00 00 00 00 00 00 00 00 00 00 00 00 92

00 ff ff ff ff ff ff 00 22 0e 4c 40 00 00 00 00
01 1d 01 03 80 3b 24 78 2a 05 a5 a6 55 4e 9c 25
11 50 54 a1 08 00 d1 c0 81 c0 a9 c0 b3 00 95 00
81 00 81 80 01 01 02 3a 80 18 71 38 2d 40 58 2c
45 00 55 6e 21 00 00 1e 00 00 00 ff 00 30 30 30
30 30 30 30 30 30 30 30 30 30 00 00 00 fd 00 31
4d 1e 50 11 00 0a 20 20 20 20 20 20 00 00 00 fc
00 48 50 20 43 6f 6e 74 69 6e 6f 0a 20 20 01 cd

02 03 1e f1 45 90 01 02 03 04 23 09 07 07 67 03
0c 00 10 00 00 22 83 01 00 00 e3 05 03 01 02 3a
80 18 71 38 2d 40 58 2c 45 00 0f 28 21 00 00 1e
00 00 00 00 00 00 00 00 00 00 00 00 00 00 00 00
00 00 00 00 00 00 00 00 00 00 00 00 00 00 00 00
00 00 00 00 00 00 00 00 00 00 00 00 00 00 00 00
00 00 00 00 00 00 00 00 00 00 00 00 00 00 00 00
00 00 00 00 00 00 00 00 00 00 00 00 00 00 00 92

----------------

Block 0, Base EDID:
  EDID Structure Version & Revision: 1.3
  Vendor & Product Identification:
    Manufacturer: HPN
    Model: 16460
    Made in: week 1 of 2019
  Basic Display Parameters & Features:
    Digital display
    Maximum image size: 59 cm x 36 cm
    Gamma: 2.20
    DPMS levels: Off
    RGB color display
    First detailed timing is the preferred timing
  Color Characteristics:
    Red  : 0.6484, 0.3320
    Green: 0.3056, 0.6103
    Blue : 0.1464, 0.0683
    White: 0.3134, 0.3291
  Established Timings I & II:
    IBM     :   720x400    70.081663 Hz   9:5     31.467 kHz     28.320000 MHz
    DMT 0x04:   640x480    59.940476 Hz   4:3     31.469 kHz     25.175000 MHz
    DMT 0x09:   800x600    60.316541 Hz   4:3     37.879 kHz     40.000000 MHz
    DMT 0x10:  1024x768    60.003840 Hz   4:3     48.363 kHz     65.000000 MHz
  Standard Timings:
    DMT 0x52:  1920x1080   60.000000 Hz  16:9     67.500 kHz    148.500000 MHz
    DMT 0x55:  1280x720    60.000000 Hz  16:9     45.000 kHz     74.250000 MHz
    DMT 0x53:  1600x900    60.000000 Hz  16:9     60.000 kHz    108.000000 MHz (RB)
    DMT 0x3a:  1680x1050   59.954250 Hz  16:10    65.290 kHz    146.250000 MHz
    DMT 0x2f:  1440x900    59.887445 Hz  16:10    55.935 kHz    106.500000 MHz
    DMT 0x1c:  1280x800    59.810326 Hz  16:10    49.702 kHz     83.500000 MHz
    DMT 0x23:  1280x1024   60.019740 Hz   5:4     63.981 kHz    108.000000 MHz
  Detailed Timing Descriptors:
    DTD 1:  1920x1080   60.000000 Hz  16:9     67.500 kHz    148.500000 MHz (597 mm x 366 mm)
                 Hfront   88 Hsync  44 Hback  148 Hpol P
                 Vfront    4 Vsync   5 Vback   36 Vpol P
    Display Product Serial Number: ...
    Display Range Limits:
      Monitor ranges (GTF): 49-77 Hz V, 30-80 kHz H, max dotclock 170 MHz
    Display Product Name: 'HP Contino'
  Extension blocks: 1
Checksum: 0xcd

----------------

Block 1, CTA-861 Extension Block:
  Revision: 3
  Underscans IT Video Formats by default
  Basic audio support
  Supports YCbCr 4:4:4
  Supports YCbCr 4:2:2
  Native DTDs: 1
  Video Data Block:
    VIC  16:  1920x1080   60.000000 Hz  16:9     67.500 kHz    148.500000 MHz (native)
    VIC   1:   640x480    59.940476 Hz   4:3     31.469 kHz     25.175000 MHz
    VIC   2:   720x480    59.940060 Hz   4:3     31.469 kHz     27.000000 MHz
    VIC   3:   720x480    59.940060 Hz  16:9     31.469 kHz     27.000000 MHz
    VIC   4:  1280x720    60.000000 Hz  16:9     45.000 kHz     74.250000 MHz
  Audio Data Block:
    Linear PCM:
      Max channels: 2
      Supported sample rates (kHz): 48 44.1 32
      Supported sample sizes (bits): 24 20 16
  Vendor-Specific Data Block (HDMI), OUI 00-0C-03:
    Source physical address: 1.0.0.0
    Maximum TMDS clock: 170 MHz
  Speaker Allocation Data Block:
    FL/FR - Front Left/Right
  Colorimetry Data Block:
    xvYCC601
    xvYCC709
    Gamut Boundary Description Metadata Profile P0
  Detailed Timing Descriptors:
    DTD 2:  1920x1080   60.000000 Hz  16:9     67.500 kHz    148.500000 MHz (527 mm x 296 mm)
                 Hfront   88 Hsync  44 Hback  148 Hpol P
                 Vfront    4 Vsync   5 Vback   36 Vpol P
Checksum: 0x92  Unused space in Extension Block: 79 bytes

----------------

Warnings:

Block 0, Base EDID:
  Detailed Timing Descriptor #1: Image size is 597x366 mm, but based on the picture AR it should be 597x335 mm.
  Display Product Serial Number: ...
Block 1, CTA-861 Extension Block:
  Colorimetry Data Block: Set the sRGB colorimetry bit to avoid interop issues.

Failures:

Block 1, CTA-861 Extension Block:
  Detailed Timing Descriptor #2: Mismatch of image size 527x296 mm vs display size 590x360 mm.
  Missing VCDB, needed for Set Selectable RGB Quantization to avoid interop issues.
EDID:
  Extension Block 2 started with EDID header, ignoring Extension Blocks >= 2.

EDID conformity: FAIL
