edid-decode (hex):

00 ff ff ff ff ff ff 00 06 af b3 69 00 00 00 00
0c 22 01 04 a5 1e 13 78 03 cb 55 91 57 5a 91 29
1c 50 54 00 00 00 01 01 01 01 01 01 01 01 01 01
01 01 01 01 01 01 26 3d 80 b8 70 b0 28 40 10 10
3e 00 2d bc 10 00 00 18 00 00 00 fd 00 28 3c 4b
4b 10 01 0a 20 20 20 20 20 20 00 00 00 fe 00 41
55 4f 0a 20 20 20 20 20 20 20 20 20 00 00 00 fc
00 42 31 34 30 55 41 4e 30 38 2e 30 20 0a 01 ac

70 20 79 02 00 22 00 14 7b 63 02 85 7f 07 b7 00
0f 80 0f 00 af 04 27 00 02 00 0d 00 25 01 09 7b
63 02 7b 63 02 28 3c 80 2b 00 0c 27 00 28 3b 00
00 27 00 28 3b 00 00 81 00 15 74 1a 00 00 03 01
28 3c 00 00 53 50 53 50 3c 00 00 00 00 8d 00 00
00 00 00 00 00 00 00 00 00 00 00 00 00 00 00 00
00 00 00 00 00 00 00 00 00 00 00 00 00 00 00 00
00 00 00 00 00 00 00 00 00 00 00 00 00 00 4d 90

00 ff ff ff ff ff ff 00 06 af b3 69 00 00 00 00
0c 22 01 04 a5 1e 13 78 03 cb 55 91 57 5a 91 29
1c 50 54 00 00 00 01 01 01 01 01 01 01 01 01 01
01 01 01 01 01 01 26 3d 80 b8 70 b0 28 40 10 10
3e 00 2d bc 10 00 00 18 00 00 00 fd 00 28 3c 4b
4b 10 01 0a 20 20 20 20 20 20 00 00 00 fe 00 41
55 4f 0a 20 20 20 20 20 20 20 20 20 00 00 00 fc
00 42 31 34 30 55 41 4e 30 38 2e 30 20 0a 01 ac

70 20 79 02 00 22 00 14 7b 63 02 85 7f 07 b7 00
0f 80 0f 00 af 04 27 00 02 00 0d 00 25 01 09 7b
63 02 7b 63 02 28 3c 80 2b 00 0c 27 00 28 3b 00
00 27 00 28 3b 00 00 81 00 15 74 1a 00 00 03 01
28 3c 00 00 53 50 53 50 3c 00 00 00 00 8d 00 00
00 00 00 00 00 00 00 00 00 00 00 00 00 00 00 00
00 00 00 00 00 00 00 00 00 00 00 00 00 00 00 00
00 00 00 00 00 00 00 00 00 00 00 00 00 00 4d 90

----------------

Block 0, Base EDID:
  EDID Structure Version & Revision: 1.4
  Vendor & Product Identification:
    Manufacturer: AUO
    Model: 27059
    Made in: week 12 of 2024
  Basic Display Parameters & Features:
    Digital display
    Bits per primary color channel: 8
    DisplayPort interface
    Maximum image size: 30 cm x 19 cm
    Gamma: 2.20
    Supported color formats: RGB 4:4:4
    First detailed timing includes the native pixel format and preferred refresh rate
    Display supports continuous frequencies
  Color Characteristics:
    Red  : 0.5693, 0.3398
    Green: 0.3535, 0.5693
    Blue : 0.1611, 0.1103
    White: 0.3134, 0.3291
  Established Timings I & II: none
  Standard Timings: none
  Detailed Timing Descriptors:
    DTD 1:  1920x1200   60.000920 Hz  16:10    74.401 kHz    156.540000 MHz (301 mm x 188 mm)
                 Hfront   16 Hsync  16 Hback  152 Hpol N
                 Vfront    3 Vsync  14 Vback   23 Vpol N
    Display Range Limits:
      Monitor ranges (Range Limits Only): 40-60 Hz V, 75-75 kHz H, max dotclock 160 MHz
    Alphanumeric Data String: 'AUO'
    Display Product Name: 'B140UAN08.0 '
  Extension blocks: 1
Checksum: 0xac

----------------

Block 1, DisplayID Extension Block:
  Version: 2.0
  Extension Count: 0
  Display Product Primary Use Case: None of the listed primary use cases; generic display
  Video Timing Modes Type 7 - Detailed Timings Data Block:
    DTD:  1920x1200   60.000920 Hz  16:10    74.401 kHz    156.540000 MHz (aspect 16:10, no 3D stereo, preferred)
               Hfront   16 Hsync  16 Hback  152 Hpol P
               Vfront    3 Vsync  14 Vback   23 Vpol N
  Dynamic Video Timing Range Limits Data Block:
    Minimum Pixel Clock: 156540 kHz
    Maximum Pixel Clock: 156540 kHz
    Minimum Vertical Refresh Rate: 40 Hz
    Maximum Vertical Refresh Rate: 60 Hz
    Seamless Dynamic Video Timing Support: Yes
  Adaptive Sync Data Block:
    Descriptor #1:
      Native Panel Range
      Fixed Average V-Total and Adaptive V-Total
      Supports Seamless Transition
      'Max Single Frame Duration Increase' field value without jitter impact
      'Max Single Frame Duration Decrease' field value without jitter impact
      Max Duration Increase: 0.00 ms
      Max Duration Decrease: 0.00 ms
      Min Refresh Rate: 40 Hz
      Max Refresh Rate: 60 Hz
    Descriptor #2:
      Native Panel Range
      Fixed Average V-Total and Adaptive V-Total
      Supports Seamless Transition
      'Max Single Frame Duration Increase' field value without jitter impact
      'Max Single Frame Duration Decrease' field value without jitter impact
      Max Duration Increase: 0.00 ms
      Max Duration Decrease: 0.00 ms
      Min Refresh Rate: 40 Hz
      Max Refresh Rate: 60 Hz
  CTA-861 DisplayID Data Block:
  Vendor-Specific Data Block (AMD), OUI 00-00-1A:
    Version: 3
    Feature Caps: 0x01
    Minimum Refresh Rate: 40 Hz
    Maximum Refresh Rate: 60 Hz
    Flags 1.x: 0x00
    Flags 2.x: 0x00
  Checksum: 0x4d
Checksum: 0x90

----------------

Warnings:

EDID:
  Base EDID: Some timings are out of range of the Monitor Ranges:
    Horizontal Freq: 74.401 - 74.401 kHz (Monitor: 75.000 - 75.000 kHz)
    Could be due to a Monitor Range off-by-one rounding issue

Failures:

Block 0, Base EDID:
  Display Product Name: One or more trailing spaces before newline.
EDID:
  Extension Block 2 started with EDID header, ignoring Extension Blocks >= 2.
  DisplayID: Missing DisplayID Display Parameters Data Block.

EDID conformity: FAIL
