edid-decode (hex):

00 ff ff ff ff ff ff 00 4d 10 29 32 01 01 01 01
0f 15 01 03 68 46 28 78 2a 24 9d a5 54 47 99 24
11 47 4a af ce 00 01 01 01 01 01 01 01 01 01 01
01 01 01 01 01 01 7f 21 56 aa 51 00 1e 30 46 8f
33 00 ba 89 21 00 00 1e 00 00 00 fc 00 4c 43 2d
33 32 53 56 32 39 55 0a 20 20 00 00 00 fd 00 38
4c 1e 4b 11 00 0a 20 20 20 20 20 20 00 00 00 10
00 30 30 30 30 30 30 30 30 30 30 30 30 30 00 df

00 ff ff ff ff ff ff 00 4d 10 29 32 01 01 01 01
0f 15 01 03 68 46 28 78 2a 24 9d a5 54 47 99 24
11 47 4a af ce 00 01 01 01 01 01 01 01 01 01 01
01 01 01 01 01 01 7f 21 56 aa 51 00 1e 30 46 8f
33 00 ba 89 21 00 00 1e 00 00 00 fc 00 4c 43 2d
33 32 53 56 32 39 55 0a 20 20 00 00 00 fd 00 38
4c 1e 4b 11 00 0a 20 20 20 20 20 20 00 00 00 10
00 30 30 30 30 30 30 30 30 30 30 30 30 30 00 df

----------------

Block 0, Base EDID:
  EDID Structure Version & Revision: 1.3
  Vendor & Product Identification:
    Manufacturer: SHP
    Model: 12841
    Serial Number: ...
    Made in: week 15 of 2011
  Basic Display Parameters & Features:
    Analog display
    Signal Level Standard: 0.700 : 0.000 : 0.700 V p-p
    Blank level equals black level
    Sync: Separate
    Maximum image size: 70 cm x 40 cm
    Gamma: 2.20
    DPMS levels: Off
    RGB color display
    First detailed timing is the preferred timing
  Color Characteristics:
    Red  : 0.6445, 0.3300
    Green: 0.2783, 0.5976
    Blue : 0.1425, 0.0673
    White: 0.2802, 0.2900
  Established Timings I & II:
    IBM     :   720x400    70.081663 Hz   9:5     31.467 kHz     28.320000 MHz
    DMT 0x04:   640x480    59.940476 Hz   4:3     31.469 kHz     25.175000 MHz
    DMT 0x05:   640x480    72.808802 Hz   4:3     37.861 kHz     31.500000 MHz
    DMT 0x06:   640x480    75.000000 Hz   4:3     37.500 kHz     31.500000 MHz
    DMT 0x08:   800x600    56.250000 Hz   4:3     35.156 kHz     36.000000 MHz
    DMT 0x09:   800x600    60.316541 Hz   4:3     37.879 kHz     40.000000 MHz
    DMT 0x0a:   800x600    72.187572 Hz   4:3     48.077 kHz     50.000000 MHz
    DMT 0x0b:   800x600    75.000000 Hz   4:3     46.875 kHz     49.500000 MHz
    DMT 0x10:  1024x768    60.003840 Hz   4:3     48.363 kHz     65.000000 MHz
    DMT 0x11:  1024x768    70.069359 Hz   4:3     56.476 kHz     75.000000 MHz
    DMT 0x12:  1024x768    75.028582 Hz   4:3     60.023 kHz     78.750000 MHz
  Standard Timings: none
  Detailed Timing Descriptors:
    DTD 1:  1366x768    59.964364 Hz 683:384   47.852 kHz     85.750000 MHz (698 mm x 393 mm)
                 Hfront   70 Hsync 143 Hback  213 Hpol P
                 Vfront    3 Vsync   3 Vback   24 Vpol P
    Display Product Name: 'LC-32SV29U'
    Display Range Limits:
      Monitor ranges (GTF): 56-76 Hz V, 30-75 kHz H, max dotclock 170 MHz
    Dummy Descriptor:
Checksum: 0xdf

----------------

Warnings:

Block 0, Base EDID:
  Vendor & Product Identification: The serial number is one of the known dummy values, it should probably be set to 0.

Failures:

Block 0, Base EDID:
  Dummy Descriptor: Dummy block filled with garbage.
EDID:
  Extension Block 1 started with EDID header, ignoring Extension Blocks >= 1.

EDID conformity: FAIL
