edid-decode (hex):

00 ff ff ff ff ff ff 00 05 e3 31 17 90 35 00 00
27 12 01 03 68 25 14 78 e8 0e 80 a7 53 4c 98 24
14 50 54 bf ee 00 81 c0 81 40 01 01 01 01 01 01
01 01 01 01 01 01 1a 1d 00 80 51 d0 1c 20 40 80
35 00 74 d1 10 00 00 1c 00 00 00 ff 00 44 33 32
38 39 49 41 30 31 33 37 31 32 00 00 00 fd 00 32
4b 1f 3a 08 00 0a 20 20 20 20 20 20 00 00 00 fc
00 37 33 31 57 0a 20 20 20 20 20 20 20 20 00 e8

00 ff ff ff ff ff ff 00 05 e3 31 17 90 35 00 00
27 12 01 03 68 25 14 78 e8 0e 80 a7 53 4c 98 24
14 50 54 bf ee 00 81 c0 81 40 01 01 01 01 01 01
01 01 01 01 01 01 1a 1d 00 80 51 d0 1c 20 40 80
35 00 74 d1 10 00 00 1c 00 00 00 ff 00 44 33 32
38 39 49 41 30 31 33 37 31 32 00 00 00 fd 00 32
4b 1f 3a 08 00 0a 20 20 20 20 20 20 00 00 00 fc
00 37 33 31 57 0a 20 20 20 20 20 20 20 20 00 e8

----------------

Block 0, Base EDID:
  EDID Structure Version & Revision: 1.3
  Vendor & Product Identification:
    Manufacturer: AOC
    Model: 5937
    Serial Number: ...
    Made in: week 39 of 2008
  Basic Display Parameters & Features:
    Analog display
    Signal Level Standard: 0.700 : 0.000 : 0.700 V p-p
    Blank level equals black level
    Sync: Separate
    Maximum image size: 37 cm x 20 cm
    Gamma: 2.20
    DPMS levels: Standby Suspend Off
    RGB color display
  Color Characteristics:
    Red  : 0.6523, 0.3242
    Green: 0.2998, 0.5957
    Blue : 0.1425, 0.0781
    White: 0.3125, 0.3281
  Established Timings I & II:
    IBM     :   720x400    70.081663 Hz   9:5     31.467 kHz     28.320000 MHz
    DMT 0x04:   640x480    59.940476 Hz   4:3     31.469 kHz     25.175000 MHz
    Apple   :   640x480    66.666667 Hz   4:3     35.000 kHz     30.240000 MHz
    DMT 0x05:   640x480    72.808802 Hz   4:3     37.861 kHz     31.500000 MHz
    DMT 0x06:   640x480    75.000000 Hz   4:3     37.500 kHz     31.500000 MHz
    DMT 0x08:   800x600    56.250000 Hz   4:3     35.156 kHz     36.000000 MHz
    DMT 0x09:   800x600    60.316541 Hz   4:3     37.879 kHz     40.000000 MHz
    DMT 0x0a:   800x600    72.187572 Hz   4:3     48.077 kHz     50.000000 MHz
    DMT 0x0b:   800x600    75.000000 Hz   4:3     46.875 kHz     49.500000 MHz
    Apple   :   832x624    74.551266 Hz   4:3     49.726 kHz     57.284000 MHz
    DMT 0x10:  1024x768    60.003840 Hz   4:3     48.363 kHz     65.000000 MHz
    DMT 0x11:  1024x768    70.069359 Hz   4:3     56.476 kHz     75.000000 MHz
    DMT 0x12:  1024x768    75.028582 Hz   4:3     60.023 kHz     78.750000 MHz
  Standard Timings:
    DMT 0x55:  1280x720    60.000000 Hz  16:9     45.000 kHz     74.250000 MHz
    DMT 0x20:  1280x960    60.000000 Hz   4:3     60.000 kHz    108.000000 MHz
  Detailed Timing Descriptors:
    DTD 1:  1280x720    59.855126 Hz  16:9     44.772 kHz     74.500000 MHz (372 mm x 209 mm)
                 Hfront   64 Hsync 128 Hback  192 Hpol N
                 Vfront    3 Vsync   5 Vback   20 Vpol P
    Display Product Serial Number: ...
    Display Range Limits:
      Monitor ranges (GTF): 50-75 Hz V, 31-58 kHz H, max dotclock 80 MHz
    Display Product Name: '731W'
Checksum: 0xe8

----------------

Block 1, Unknown EDID Extension Block 0x00:
  00 ff ff ff ff ff ff 00 05 e3 31 17 90 35 00 00 '..........1..5..'
  27 12 01 03 68 25 14 78 e8 0e 80 a7 53 4c 98 24 ''...h%.x....SL.$'
  14 50 54 bf ee 00 81 c0 81 40 01 01 01 01 01 01 '.PT......@......'
  01 01 01 01 01 01 1a 1d 00 80 51 d0 1c 20 40 80 '..........Q.. @.'
  35 00 74 d1 10 00 00 1c 00 00 00 ff 00 44 33 32 '5.t..........D32'
  38 39 49 41 30 31 33 37 31 32 00 00 00 fd 00 32 '89IA013712.....2'
  4b 1f 3a 08 00 0a 20 20 20 20 20 20 00 00 00 fc 'K.:...      ....'
  00 37 33 31 57 0a 20 20 20 20 20 20 20 20 00 e8 '.731W.        ..'
Checksum: 0xe8

----------------

Warnings:

EDID:
  Base EDID: Some timings are out of range of the Monitor Ranges:
    Horizontal Freq: 31.466 - 60.022 kHz (Monitor: 31.000 - 58.000 kHz)
    Maximum Clock: 108.000 MHz (Monitor: 80.000 MHz)

Failures:

Block 0, Base EDID:
  Basic Display Parameters & Features: EDID 1.3 requires that the first detailed timing is the preferred timing.
Block 1, Base EDID:
  Unknown Extension Block.
EDID:
  Base EDID: EDID specified 0 extension block(s), but found 1 extension block(s).

EDID conformity: FAIL
