edid-decode (hex):

00 ff ff ff ff ff ff 00 06 af b2 82 00 00 00 00
00 22 01 04 a5 1e 13 78 02 cb 55 91 57 5a 91 29
1c 50 54 00 00 00 01 01 01 01 01 01 01 01 01 01
01 01 01 01 01 01 26 3d 80 b8 70 b0 28 40 10 10
3e 00 2d bc 10 00 00 1a eb 30 80 b8 70 b0 28 40
10 10 3e 00 2d bc 10 00 00 1a 00 00 00 fe 00 34
52 4a 43 50 80 42 31 34 30 55 41 4e 00 00 00 00
00 01 41 22 9e 00 00 00 00 0a 01 0a 20 20 00 e7

00 ff ff ff ff ff ff 00 06 af b2 82 00 00 00 00
00 22 01 04 a5 1e 13 78 02 cb 55 91 57 5a 91 29
1c 50 54 00 00 00 01 01 01 01 01 01 01 01 01 01
01 01 01 01 01 01 26 3d 80 b8 70 b0 28 40 10 10
3e 00 2d bc 10 00 00 1a eb 30 80 b8 70 b0 28 40
10 10 3e 00 2d bc 10 00 00 1a 00 00 00 fe 00 34
52 4a 43 50 80 42 31 34 30 55 41 4e 00 00 00 00
00 01 41 22 9e 00 00 00 00 0a 01 0a 20 20 00 e7

----------------

Block 0, Base EDID:
  EDID Structure Version & Revision: 1.4
  Vendor & Product Identification:
    Manufacturer: AUO
    Model: 33458
    Made in: 2024
  Basic Display Parameters & Features:
    Digital display
    Bits per primary color channel: 8
    DisplayPort interface
    Maximum image size: 30 cm x 19 cm
    Gamma: 2.20
    Supported color formats: RGB 4:4:4
    First detailed timing includes the native pixel format and preferred refresh rate
  Color Characteristics:
    Red  : 0.5693, 0.3398
    Green: 0.3535, 0.5693
    Blue : 0.1611, 0.1103
    White: 0.3134, 0.3291
  Established Timings I & II: none
  Standard Timings: none
  Detailed Timing Descriptors:
    DTD 1:  1920x1200   60.000920 Hz  16:10    74.401 kHz    156.540000 MHz (301 mm x 188 mm)
                 Hfront   16 Hsync  16 Hback  152 Hpol P
                 Vfront    3 Vsync  14 Vback   23 Vpol N
    DTD 2:  1920x1200   47.999969 Hz  16:10    59.520 kHz    125.230000 MHz (301 mm x 188 mm)
                 Hfront   16 Hsync  16 Hback  152 Hpol P
                 Vfront    3 Vsync  14 Vback   23 Vpol N
    Alphanumeric Data String: '4RJCP.B140UAN'
    Manufacturer-Specified Display Descriptor (0x00): 00 00 00 01 41 22 9e 00 00 00 00 0a 01 0a 20 20 '....A"........  '
Checksum: 0xe7

----------------

Warnings:

Block 0, Base EDID:
  Alphanumeric Data String: Non-ASCII character 0x80 at position 5, can cause problems.
  Missing Display Product Name.

Failures:

EDID:
  Extension Block 1 started with EDID header, ignoring Extension Blocks >= 1.

EDID conformity: FAIL
