edid-decode (hex):

00 ff ff ff ff ff ff 00 30 e4 37 06 00 00 00 00
00 1d 01 04 a5 22 13 78 02 6e 65 a1 53 4c 9d 27
0b 50 54 00 00 00 01 01 01 01 01 01 01 01 01 01
01 01 01 01 01 01 2e 36 80 a0 70 38 1f 40 30 20
35 00 58 c2 10 00 00 1a 58 2b 80 a0 70 38 1f 40
30 20 35 00 58 c2 10 00 00 1a 00 00 00 fe 00 36
56 44 4b 58 80 31 35 36 57 46 46 0a 00 00 00 00
00 02 41 31 9e 00 10 00 00 0a 01 0a 20 20 00 f1

----------------

Block 0, Base EDID:
  EDID Structure Version & Revision: 1.4
  Vendor & Product Identification:
    Manufacturer: LGD
    Model: 1591
    Made in: 2019
  Basic Display Parameters & Features:
    Digital display
    Bits per primary color channel: 8
    DisplayPort interface
    Maximum image size: 34 cm x 19 cm
    Gamma: 2.20
    Supported color formats: RGB 4:4:4
    First detailed timing includes the native pixel format and preferred refresh rate
  Color Characteristics:
    Red  : 0.6298, 0.3261
    Green: 0.2998, 0.6152
    Blue : 0.1533, 0.0449
    White: 0.3134, 0.3291
  Established Timings I & II: none
  Standard Timings: none
  Detailed Timing Descriptors:
    DTD 1:  1920x1080   60.020425 Hz  16:9     66.683 kHz    138.700000 MHz (344 mm x 194 mm)
                 Hfront   48 Hsync  32 Hback   80 Hpol P
                 Vfront    3 Vsync   5 Vback   23 Vpol N
    DTD 2:  1920x1080   48.016340 Hz  16:9     53.346 kHz    110.960000 MHz (344 mm x 194 mm)
                 Hfront   48 Hsync  32 Hback   80 Hpol P
                 Vfront    3 Vsync   5 Vback   23 Vpol N
    Alphanumeric Data String: '6VDKX.156WFF'
    Manufacturer-Specified Display Descriptor (0x00): 00 00 00 02 41 31 9e 00 10 00 00 0a 01 0a 20 20 '....A1........  '
Checksum: 0xf1

----------------

Warnings:

Block 0, Base EDID:
  Alphanumeric Data String: Non-ASCII character 0x80 at position 5, can cause problems.
  Missing Display Product Name.

EDID conformity: PASS
