edid-decode (hex):

00 ff ff ff ff ff ff 00 30 e4 32 00 00 00 00 00
00 11 01 03 90 25 17 78 0a 3f 05 9a 59 52 90 27
20 50 54 00 00 00 01 01 01 01 01 01 01 01 01 01
01 01 01 01 01 01 60 3b 80 90 70 b0 1c 40 30 20
36 00 6f e6 10 00 00 19 60 3b 80 90 70 b0 1c 40
30 20 36 00 6f e6 10 00 00 19 00 00 00 fe 00 52
37 38 39 47 80 31 37 31 57 55 31 0a 00 00 00 fe
00 1e 32 41 49 6c 93 b9 ff 02 01 0a 20 20 00 d8

00 ff ff ff ff ff ff 00 30 e4 32 00 00 00 00 00
00 11 01 03 90 25 17 78 0a 3f 05 9a 59 52 90 27
20 50 54 00 00 00 01 01 01 01 01 01 01 01 01 01
01 01 01 01 01 01 60 3b 80 90 70 b0 1c 40 30 20
36 00 6f e6 10 00 00 19 60 3b 80 90 70 b0 1c 40
30 20 36 00 6f e6 10 00 00 19 00 00 00 fe 00 52
37 38 39 47 80 31 37 31 57 55 31 0a 00 00 00 fe
00 1e 32 41 49 6c 93 b9 ff 02 01 0a 20 20 00 d8

----------------

Block 0, Base EDID:
  EDID Structure Version & Revision: 1.3
  Vendor & Product Identification:
    Manufacturer: LGD
    Model: 50
    Made in: 2007
  Basic Display Parameters & Features:
    Digital display
    Maximum image size: 37 cm x 23 cm
    Gamma: 2.20
    RGB color display
    First detailed timing is the preferred timing
  Color Characteristics:
    Red  : 0.6015, 0.3505
    Green: 0.3232, 0.5654
    Blue : 0.1523, 0.1250
    White: 0.3134, 0.3291
  Established Timings I & II: none
  Standard Timings: none
  Detailed Timing Descriptors:
    DTD 1:  1920x1200   59.970204 Hz  16:10    73.643 kHz    152.000000 MHz (DE timing only, 367 mm x 230 mm)
                 Hfront   48 Hsync  32 Hback   64 Hpol N
                 Vfront    3 Vsync   6 Vback   19 Vpol N
    DTD 2:  1920x1200   59.970204 Hz  16:10    73.643 kHz    152.000000 MHz (DE timing only, 367 mm x 230 mm)
                 Hfront   48 Hsync  32 Hback   64 Hpol N
                 Vfront    3 Vsync   6 Vback   19 Vpol N
    SPWG Module Revision: 25
    SPWG Descriptor #3:
      SPWG PC Maker P/N: 'R789G'
      SPWG LCD Supplier EEDID Revision: 128
      SPWG Manufacturer P/N: '171WU1'
    SPWG Descriptor #4:
      SMBUS Values: 0x1e 0x32 0x41 0x49 0x6c 0x93 0xb9 0xff
      LVDS Channels: 2
      Panel Self Test Present
Checksum: 0xd8

----------------

Failures:

Block 0, Base EDID:
  Basic Display Parameters & Features: Digital Video Interface Standard set to reserved value 0x10.
  Missing Display Product Name.
  Missing Display Range Limits Descriptor.
EDID:
  Extension Block 1 started with EDID header, ignoring Extension Blocks >= 1.

EDID conformity: FAIL
