edid-decode (hex):

00 ff ff ff ff ff ff 00 41 0c fa 08 71 07 00 00
0e 1a 01 03 80 5f 36 78 2a 58 3d a5 55 53 9c 25
0c 47 4a bd 4b 00 d1 c0 81 80 81 40 95 0f 95 00
b3 00 81 c0 01 01 4d d0 00 a0 f0 70 3e 80 30 20
35 00 b9 1f 32 00 00 1a a3 66 00 a0 f0 70 1f 80
30 20 35 00 b9 1f 32 00 00 1a 00 00 00 fc 00 50
48 4c 20 42 44 4d 34 33 35 30 0a 20 00 00 00 fd
00 17 50 1e 63 3c 00 0a 20 20 20 20 20 20 01 08

02 03 33 f1 4c 90 04 03 1f 13 01 12 5d 5e 5f 60
61 23 09 07 07 83 01 00 00 6d 03 0c 00 10 00 39
78 20 00 60 01 02 03 67 d8 5d c4 01 78 80 03 e3
0f 00 0c 66 21 56 aa 51 00 1e 30 46 8f 33 00 b9
1f 32 00 00 1e 9a 29 a0 d0 51 84 22 30 50 98 36
00 b9 1f 32 00 00 1c 02 3a 80 18 71 38 2d 40 58
2c 45 00 b9 1f 32 00 00 1e e2 68 00 a0 a0 40 2e
60 30 20 36 00 b9 1f 32 00 00 1a 00 00 00 00 28

----------------

Block 0, Base EDID:
  EDID Structure Version & Revision: 1.3
  Vendor & Product Identification:
    Manufacturer: PHL
    Model: 2298
    Serial Number: ...
    Made in: week 14 of 2016
  Basic Display Parameters & Features:
    Digital display
    Maximum image size: 95 cm x 54 cm
    Gamma: 2.20
    DPMS levels: Off
    RGB color display
    First detailed timing is the preferred timing
  Color Characteristics:
    Red  : 0.6455, 0.3330
    Green: 0.3261, 0.6093
    Blue : 0.1445, 0.0498
    White: 0.2802, 0.2900
  Established Timings I & II:
    IBM     :   720x400    70.081663 Hz   9:5     31.467 kHz     28.320000 MHz
    DMT 0x04:   640x480    59.940476 Hz   4:3     31.469 kHz     25.175000 MHz
    Apple   :   640x480    66.666667 Hz   4:3     35.000 kHz     30.240000 MHz
    DMT 0x05:   640x480    72.808802 Hz   4:3     37.861 kHz     31.500000 MHz
    DMT 0x06:   640x480    75.000000 Hz   4:3     37.500 kHz     31.500000 MHz
    DMT 0x09:   800x600    60.316541 Hz   4:3     37.879 kHz     40.000000 MHz
    DMT 0x0b:   800x600    75.000000 Hz   4:3     46.875 kHz     49.500000 MHz
    DMT 0x10:  1024x768    60.003840 Hz   4:3     48.363 kHz     65.000000 MHz
    DMT 0x12:  1024x768    75.028582 Hz   4:3     60.023 kHz     78.750000 MHz
    DMT 0x24:  1280x1024   75.024675 Hz   5:4     79.976 kHz    135.000000 MHz
  Standard Timings:
    DMT 0x52:  1920x1080   60.000000 Hz  16:9     67.500 kHz    148.500000 MHz
    DMT 0x23:  1280x1024   60.019740 Hz   5:4     63.981 kHz    108.000000 MHz
    DMT 0x20:  1280x960    60.000000 Hz   4:3     60.000 kHz    108.000000 MHz
    DMT 0x30:  1440x900    74.984427 Hz  16:10    70.635 kHz    136.750000 MHz
    DMT 0x2f:  1440x900    59.887445 Hz  16:10    55.935 kHz    106.500000 MHz
    DMT 0x3a:  1680x1050   59.954250 Hz  16:10    65.290 kHz    146.250000 MHz
    DMT 0x55:  1280x720    60.000000 Hz  16:9     45.000 kHz     74.250000 MHz
  Detailed Timing Descriptors:
    DTD 1:  3840x2160   59.996625 Hz  16:9    133.312 kHz    533.250000 MHz (953 mm x 543 mm)
                 Hfront   48 Hsync  32 Hback   80 Hpol P
                 Vfront    3 Vsync   5 Vback   54 Vpol N
    DTD 2:  3840x2160   29.980602 Hz  16:9     65.688 kHz    262.750000 MHz (953 mm x 543 mm)
                 Hfront   48 Hsync  32 Hback   80 Hpol P
                 Vfront    3 Vsync   5 Vback   23 Vpol N
    Display Product Name: 'PHL BDM4350'
    Display Range Limits:
      Monitor ranges (GTF): 23-80 Hz V, 30-99 kHz H, max dotclock 600 MHz
  Extension blocks: 1
Checksum: 0x08

----------------

Block 1, CTA-861 Extension Block:
  Revision: 3
  Underscans IT Video Formats by default
  Basic audio support
  Supports YCbCr 4:4:4
  Supports YCbCr 4:2:2
  Native DTDs: 1
  Video Data Block:
    VIC  16:  1920x1080   60.000000 Hz  16:9     67.500 kHz    148.500000 MHz (native)
    VIC   4:  1280x720    60.000000 Hz  16:9     45.000 kHz     74.250000 MHz
    VIC   3:   720x480    59.940060 Hz  16:9     31.469 kHz     27.000000 MHz
    VIC  31:  1920x1080   50.000000 Hz  16:9     56.250 kHz    148.500000 MHz
    VIC  19:  1280x720    50.000000 Hz  16:9     37.500 kHz     74.250000 MHz
    VIC   1:   640x480    59.940476 Hz   4:3     31.469 kHz     25.175000 MHz
    VIC  18:   720x576    50.000000 Hz  16:9     31.250 kHz     27.000000 MHz
    VIC  93:  3840x2160   24.000000 Hz  16:9     54.000 kHz    297.000000 MHz
    VIC  94:  3840x2160   25.000000 Hz  16:9     56.250 kHz    297.000000 MHz
    VIC  95:  3840x2160   30.000000 Hz  16:9     67.500 kHz    297.000000 MHz
    VIC  96:  3840x2160   50.000000 Hz  16:9    112.500 kHz    594.000000 MHz
    VIC  97:  3840x2160   60.000000 Hz  16:9    135.000 kHz    594.000000 MHz
  Audio Data Block:
    Linear PCM:
      Max channels: 2
      Supported sample rates (kHz): 48 44.1 32
      Supported sample sizes (bits): 24 20 16
  Speaker Allocation Data Block:
    FL/FR - Front Left/Right
  Vendor-Specific Data Block (HDMI), OUI 00-0C-03:
    Source physical address: 1.0.0.0
    DC_36bit
    DC_30bit
    DC_Y444
    DVI_Dual
    Maximum TMDS clock: 600 MHz
    Extended HDMI video details:
      HDMI VICs:
        HDMI VIC 1:  3840x2160   30.000000 Hz  16:9     67.500 kHz    297.000000 MHz
        HDMI VIC 2:  3840x2160   25.000000 Hz  16:9     56.250 kHz    297.000000 MHz
        HDMI VIC 3:  3840x2160   24.000000 Hz  16:9     54.000 kHz    297.000000 MHz
  Vendor-Specific Data Block (HDMI Forum), OUI C4-5D-D8:
    Version: 1
    Maximum TMDS Character Rate: 600 MHz
    SCDC Present
    Supports 12-bits/component Deep Color 4:2:0 Pixel Encoding
    Supports 10-bits/component Deep Color 4:2:0 Pixel Encoding
  YCbCr 4:2:0 Capability Map Data Block:
    VIC  96:  3840x2160   50.000000 Hz  16:9    112.500 kHz    594.000000 MHz
    VIC  97:  3840x2160   60.000000 Hz  16:9    135.000 kHz    594.000000 MHz
  Detailed Timing Descriptors:
    DTD 3:  1366x768    59.789541 Hz 683:384   47.712 kHz     85.500000 MHz (953 mm x 543 mm)
                 Hfront   70 Hsync 143 Hback  213 Hpol P
                 Vfront    3 Vsync   3 Vback   24 Vpol P
    DTD 4:  1440x900    59.887445 Hz  16:10    55.935 kHz    106.500000 MHz (953 mm x 543 mm)
                 Hfront   80 Hsync 152 Hback  232 Hpol N
                 Vfront    3 Vsync   6 Vback   25 Vpol P
    DTD 5:  1920x1080   60.000000 Hz  16:9     67.500 kHz    148.500000 MHz (953 mm x 543 mm)
                 Hfront   88 Hsync  44 Hback  148 Hpol P
                 Vfront    4 Vsync   5 Vback   36 Vpol P
    DTD 6:  2560x1600   59.971589 Hz  16:10    98.713 kHz    268.500000 MHz (953 mm x 543 mm)
                 Hfront   48 Hsync  32 Hback   80 Hpol P
                 Vfront    3 Vsync   6 Vback   37 Vpol N
Checksum: 0x28  Unused space in Extension Block: 4 bytes

----------------

Warnings:

Block 1, CTA-861 Extension Block:
  Video Data Block: VIC 16 and the first DTD are not identical. Is this intended?
  Detailed Timing Descriptor #4: Image size is 953x543 mm, but based on the picture AR it should be 868x543 mm.
  Detailed Timing Descriptor #6: Image size is 953x543 mm, but based on the picture AR it should be 868x543 mm.
  Add a Colorimetry Data Block with the sRGB colorimetry bit set to avoid interop issues.
EDID:
  Base EDID: Some timings are out of range of the Monitor Ranges:
    Horizontal Freq: 31.250 - 135.000 kHz (Monitor: 30.000 - 99.000 kHz)

Failures:

Block 1, CTA-861 Extension Block:
  Vendor-Specific Data Block (HDMI), OUI 00-0C-03: HDMI VSDB Max TMDS rate is > 340.
  Vendor-Specific Data Block (HDMI Forum), OUI C4-5D-D8: HDMI VIC and related CTA VIC codes are present, but the UHD VIC bit is 0.
  Missing VCDB, needed for Set Selectable RGB Quantization to avoid interop issues.
EDID:
  CTA-861: Native progressive timings are a mix of several resolutions.

EDID conformity: FAIL
