edid-decode (hex):

00 ff ff ff ff ff ff 00 4a 8b bf 01 01 00 50 63
0c 14 01 04 b5 22 00 78 3a 35 85 a6 56 48 9a 24
12 50 54 bf df 00 31 40 81 00 81 80 95 00 d1 c0
01 01 01 01 01 01 d5 09 80 90 20 e0 1d 10 08 60
22 00 90 2c 11 08 08 1e 00 00 00 fd 00 38 4b 1e
53 11 00 0a 20 20 20 20 20 20 00 00 00 fc 00 52
54 4b 20 46 48 44 0a 20 20 20 20 20 00 00 00 ff
00 4c 35 36 30 35 31 37 39 34 33 30 32 0a 00 5c

00 ff ff ff ff ff ff 00 4a 8b bf 01 01 00 50 63
0c 14 01 04 b5 22 00 78 3a 35 85 a6 56 48 9a 24
12 50 54 bf df 00 31 40 81 00 81 80 95 00 d1 c0
01 01 01 01 01 01 d5 09 80 90 20 e0 1d 10 08 60
22 00 90 2c 11 08 08 1e 00 00 00 fd 00 38 4b 1e
53 11 00 0a 20 20 20 20 20 20 00 00 00 fc 00 52
54 4b 20 46 48 44 0a 20 20 20 20 20 00 00 00 ff
00 4c 35 36 30 35 31 37 39 34 33 30 32 0a 00 5c

----------------

Block 0, Base EDID:
  EDID Structure Version & Revision: 1.4
  Vendor & Product Identification:
    Manufacturer: RTK
    Model: 447
    Serial Number: ...
    Made in: week 12 of 2010
  Basic Display Parameters & Features:
    Digital display
    Bits per primary color channel: 10
    DisplayPort interface
    Aspect ratio: 1.33 (landscape)
    Gamma: 2.20
    DPMS levels: Off
    Supported color formats: RGB 4:4:4, YCrCb 4:4:4, YCrCb 4:2:2
    First detailed timing includes the native pixel format and preferred refresh rate
  Color Characteristics:
    Red  : 0.6484, 0.3388
    Green: 0.2822, 0.6025
    Blue : 0.1425, 0.0703
    White: 0.3134, 0.3291
  Established Timings I & II:
    IBM     :   720x400    70.081663 Hz   9:5     31.467 kHz     28.320000 MHz
    DMT 0x04:   640x480    59.940476 Hz   4:3     31.469 kHz     25.175000 MHz
    Apple   :   640x480    66.666667 Hz   4:3     35.000 kHz     30.240000 MHz
    DMT 0x05:   640x480    72.808802 Hz   4:3     37.861 kHz     31.500000 MHz
    DMT 0x06:   640x480    75.000000 Hz   4:3     37.500 kHz     31.500000 MHz
    DMT 0x08:   800x600    56.250000 Hz   4:3     35.156 kHz     36.000000 MHz
    DMT 0x09:   800x600    60.316541 Hz   4:3     37.879 kHz     40.000000 MHz
    DMT 0x0a:   800x600    72.187572 Hz   4:3     48.077 kHz     50.000000 MHz
    DMT 0x0b:   800x600    75.000000 Hz   4:3     46.875 kHz     49.500000 MHz
    DMT 0x0f:  1024x768i   86.957532 Hz   4:3     35.522 kHz     44.900000 MHz
    DMT 0x10:  1024x768    60.003840 Hz   4:3     48.363 kHz     65.000000 MHz
    DMT 0x11:  1024x768    70.069359 Hz   4:3     56.476 kHz     75.000000 MHz
    DMT 0x12:  1024x768    75.028582 Hz   4:3     60.023 kHz     78.750000 MHz
    DMT 0x24:  1280x1024   75.024675 Hz   5:4     79.976 kHz    135.000000 MHz
  Standard Timings:
    DMT 0x04:   640x480    59.940476 Hz   4:3     31.469 kHz     25.175000 MHz
    DMT 0x1c:  1280x800    59.810326 Hz  16:10    49.702 kHz     83.500000 MHz
    DMT 0x23:  1280x1024   60.019740 Hz   5:4     63.981 kHz    108.000000 MHz
    DMT 0x2f:  1440x900    59.887445 Hz  16:10    55.935 kHz    106.500000 MHz
    DMT 0x52:  1920x1080   60.000000 Hz  16:9     67.500 kHz    148.500000 MHz
  Detailed Timing Descriptors:
    DTD 1:   640x480    63.073854 Hz   4:3     32.105 kHz     25.170000 MHz (400 mm x 300 mm)
                 Hfront    8 Hsync  96 Hback   24 Hpol P Hborder 8
                 Vfront    2 Vsync   2 Vback    9 Vpol P Vborder 8
    Display Range Limits:
      Monitor ranges (GTF): 56-75 Hz V, 30-83 kHz H, max dotclock 170 MHz
    Display Product Name: 'RTK FHD'
    Display Product Serial Number: ...
Checksum: 0x5c

----------------

Warnings:

Block 0, Base EDID:
  Detailed Timing Descriptor #1: The use of non-zero borders in a DTD is not recommended.
  Display Range Limits: GTF support is deprecated in EDID 1.4.
EDID:
  Base EDID: Some timings are out of range of the Monitor Ranges:
    Vertical Freq: 56.250 - 86.958 Hz (Monitor: 56.000 - 75.000 Hz)

Failures:

Block 0, Base EDID:
  Display Range Limits: GTF is supported, but the display does not support continuous frequencies.
EDID:
  Extension Block 1 started with EDID header, ignoring Extension Blocks >= 1.
  Base EDID: The DTD max image size is 400x300mm, but the display size is not specified anywhere.

EDID conformity: FAIL
