edid-decode (hex):

00 ff ff ff ff ff ff 00 4a 8b bf 01 01 00 50 63
0c 14 01 03 80 19 11 78 02 35 85 a6 56 48 9a 24
12 50 54 b3 0c 00 71 40 81 00 81 80 95 00 d1 c0
01 01 01 01 01 01 7a 50 70 a0 80 a0 28 50 30 20
3a 00 fe a9 00 00 00 18 00 00 00 fd 00 38 4b 1e
8b 15 00 0a 20 20 20 20 20 20 00 00 00 fc 00 e3
00 00 00 00 00 00 0a 20 20 20 20 20 00 00 00 ff
00 4c 35 36 30 35 31 37 39 34 33 30 32 0a 01 09

02 03 22 42 4f 01 02 03 04 05 90 11 12 13 14 9f
06 07 15 16 23 09 07 07 83 01 00 00 65 03 0c 00
10 00 02 3a 80 18 71 38 2d 40 58 2c 45 00 dd 0c
11 00 00 1e 01 1d 80 18 71 1c 16 20 58 2c 25 00
dd 0c 11 00 00 9e 02 3a 80 d0 72 38 2d 40 10 2c
45 80 dd 0c 11 00 00 1e 01 1d 80 d0 72 1c 16 20
10 2c 25 80 dd 0c 11 00 00 9e 00 00 00 00 00 00
00 00 00 00 00 00 00 00 00 00 00 00 00 00 00 5a

00 ff ff ff ff ff ff 00 4a 8b bf 01 01 00 50 63
0c 14 01 03 80 19 11 78 02 35 85 a6 56 48 9a 24
12 50 54 b3 0c 00 71 40 81 00 81 80 95 00 d1 c0
01 01 01 01 01 01 7a 50 70 a0 80 a0 28 50 30 20
3a 00 fe a9 00 00 00 18 00 00 00 fd 00 38 4b 1e
8b 15 00 0a 20 20 20 20 20 20 00 00 00 fc 00 e3
00 00 00 00 00 00 0a 20 20 20 20 20 00 00 00 ff
00 4c 35 36 30 35 31 37 39 34 33 30 32 0a 01 09

02 03 22 42 4f 01 02 03 04 05 90 11 12 13 14 9f
06 07 15 16 23 09 07 07 83 01 00 00 65 03 0c 00
10 00 02 3a 80 18 71 38 2d 40 58 2c 45 00 dd 0c
11 00 00 1e 01 1d 80 18 71 1c 16 20 58 2c 25 00
dd 0c 11 00 00 9e 02 3a 80 d0 72 38 2d 40 10 2c
45 80 dd 0c 11 00 00 1e 01 1d 80 d0 72 1c 16 20
10 2c 25 80 dd 0c 11 00 00 9e 00 00 00 00 00 00
00 00 00 00 00 00 00 00 00 00 00 00 00 00 00 5a

----------------

Block 0, Base EDID:
  EDID Structure Version & Revision: 1.3
  Vendor & Product Identification:
    Manufacturer: RTK
    Model: 447
    Serial Number: ...
    Made in: week 12 of 2010
  Basic Display Parameters & Features:
    Digital display
    Maximum image size: 25 cm x 17 cm
    Gamma: 2.20
    Monochrome or grayscale display
    First detailed timing is the preferred timing
  Color Characteristics:
    Red  : 0.6484, 0.3388
    Green: 0.2822, 0.6025
    Blue : 0.1425, 0.0703
    White: 0.3134, 0.3291
  Established Timings I & II:
    IBM     :   720x400    70.081663 Hz   9:5     31.467 kHz     28.320000 MHz
    DMT 0x04:   640x480    59.940476 Hz   4:3     31.469 kHz     25.175000 MHz
    Apple   :   640x480    66.666667 Hz   4:3     35.000 kHz     30.240000 MHz
    DMT 0x08:   800x600    56.250000 Hz   4:3     35.156 kHz     36.000000 MHz
    DMT 0x09:   800x600    60.316541 Hz   4:3     37.879 kHz     40.000000 MHz
    DMT 0x10:  1024x768    60.003840 Hz   4:3     48.363 kHz     65.000000 MHz
    DMT 0x11:  1024x768    70.069359 Hz   4:3     56.476 kHz     75.000000 MHz
  Standard Timings:
    GTF     :  1152x864    60.000000 Hz   4:3     53.700 kHz     81.624000 MHz
    DMT 0x1c:  1280x800    59.810326 Hz  16:10    49.702 kHz     83.500000 MHz
    DMT 0x23:  1280x1024   60.019740 Hz   5:4     63.981 kHz    108.000000 MHz
    DMT 0x2f:  1440x900    59.887445 Hz  16:10    55.935 kHz    106.500000 MHz
    DMT 0x52:  1920x1080   60.000000 Hz  16:9     67.500 kHz    148.500000 MHz
  Detailed Timing Descriptors:
    DTD 1:  2160x1440   60.001165 Hz   3:2     88.802 kHz    206.020000 MHz (254 mm x 169 mm)
                 Hfront   48 Hsync  32 Hback   80 Hpol N
                 Vfront    3 Vsync  10 Vback   27 Vpol N
    Display Range Limits:
      Monitor ranges (GTF): 56-75 Hz V, 30-139 kHz H, max dotclock 210 MHz
    Display Product Name: '.'
    Display Product Serial Number: ...
  Extension blocks: 1
Checksum: 0x09

----------------

Block 1, CTA-861 Extension Block:
  Revision: 3
  Basic audio support
  Native DTDs: 2
  Video Data Block:
    VIC   1:   640x480    59.940476 Hz   4:3     31.469 kHz     25.175000 MHz
    VIC   2:   720x480    59.940060 Hz   4:3     31.469 kHz     27.000000 MHz
    VIC   3:   720x480    59.940060 Hz  16:9     31.469 kHz     27.000000 MHz
    VIC   4:  1280x720    60.000000 Hz  16:9     45.000 kHz     74.250000 MHz
    VIC   5:  1920x1080i  60.000000 Hz  16:9     33.750 kHz     74.250000 MHz
    VIC  16:  1920x1080   60.000000 Hz  16:9     67.500 kHz    148.500000 MHz (native)
    VIC  17:   720x576    50.000000 Hz   4:3     31.250 kHz     27.000000 MHz
    VIC  18:   720x576    50.000000 Hz  16:9     31.250 kHz     27.000000 MHz
    VIC  19:  1280x720    50.000000 Hz  16:9     37.500 kHz     74.250000 MHz
    VIC  20:  1920x1080i  50.000000 Hz  16:9     28.125 kHz     74.250000 MHz
    VIC  31:  1920x1080   50.000000 Hz  16:9     56.250 kHz    148.500000 MHz (native)
    VIC   6:  1440x480i   59.940060 Hz   4:3     15.734 kHz     27.000000 MHz
    VIC   7:  1440x480i   59.940060 Hz  16:9     15.734 kHz     27.000000 MHz
    VIC  21:  1440x576i   50.000000 Hz   4:3     15.625 kHz     27.000000 MHz
    VIC  22:  1440x576i   50.000000 Hz  16:9     15.625 kHz     27.000000 MHz
  Audio Data Block:
    Linear PCM:
      Max channels: 2
      Supported sample rates (kHz): 48 44.1 32
      Supported sample sizes (bits): 24 20 16
  Speaker Allocation Data Block:
    FL/FR - Front Left/Right
  Vendor-Specific Data Block (HDMI), OUI 00-0C-03:
    Source physical address: 1.0.0.0
  Detailed Timing Descriptors:
    DTD 2:  1920x1080   60.000000 Hz  16:9     67.500 kHz    148.500000 MHz (477 mm x 268 mm)
                 Hfront   88 Hsync  44 Hback  148 Hpol P
                 Vfront    4 Vsync   5 Vback   36 Vpol P
    DTD 3:  1920x1080i  60.000000 Hz  16:9     33.750 kHz     74.250000 MHz (477 mm x 268 mm)
                 Hfront   88 Hsync  44 Hback  148 Hpol P
                 Vfront    2 Vsync   5 Vback   15 Vpol P Vfront +0.5 Odd Field
                 Vfront    2 Vsync   5 Vback   15 Vpol P Vback  +0.5 Even Field
    DTD 4:  1920x1080   50.000000 Hz  16:9     56.250 kHz    148.500000 MHz (477 mm x 268 mm)
                 Hfront  528 Hsync  44 Hback  148 Hpol P
                 Vfront    4 Vsync   5 Vback   36 Vpol P
    DTD 5:  1920x1080i  50.000000 Hz  16:9     28.125 kHz     74.250000 MHz (477 mm x 268 mm)
                 Hfront  528 Hsync  44 Hback  148 Hpol P
                 Vfront    2 Vsync   5 Vback   15 Vpol P Vfront +0.5 Odd Field
                 Vfront    2 Vsync   5 Vback   15 Vpol P Vback  +0.5 Even Field
Checksum: 0x5a  Unused space in Extension Block: 21 bytes

----------------

Warnings:

Block 0, Base EDID:
  Display Product Name: Non-ASCII character 0xe3 at position 0, can cause problems.
Block 1, CTA-861 Extension Block:
  IT Video Formats are overscanned by default, but normally this should be underscanned.
  Video Data Block: VIC 1 and the first DTD are not identical. Is this intended?
  Display Product Serial Number is set, so the Serial Number in the Base EDID should be 0.
  Add a Colorimetry Data Block with the sRGB colorimetry bit set to avoid interop issues.
EDID:
  Base EDID: Some timings are out of range of the Monitor Ranges:
    Vertical Freq: 50.000 - 70.082 Hz (Monitor: 56.000 - 75.000 Hz)
    Horizontal Freq: 15.625 - 88.801 kHz (Monitor: 30.000 - 139.000 kHz)

Failures:

Block 0, Base EDID:
  Display Product Name: NUL byte at position 1.
Block 1, CTA-861 Extension Block:
  Detailed Timing Descriptor #2: Mismatch of image size 477x268 mm vs display size 250x170 mm.
  Detailed Timing Descriptor #3: Mismatch of image size 477x268 mm vs display size 250x170 mm.
  Detailed Timing Descriptor #4: Mismatch of image size 477x268 mm vs display size 250x170 mm.
  Detailed Timing Descriptor #5: Mismatch of image size 477x268 mm vs display size 250x170 mm.
  Missing VCDB, needed for Set Selectable RGB Quantization to avoid interop issues.
EDID:
  Extension Block 2 started with EDID header, ignoring Extension Blocks >= 2.
  Base EDID: The DTD max image size is 477x268mm, which is larger than the display size 250.0x170.0mm.
  CTA-861: Native progressive timings are a mix of several resolutions.

EDID conformity: FAIL
