edid-decode (hex):

00 ff ff ff ff ff ff 00 4a 8b bf 01 01 00 50 63
0c 14 01 04 b5 30 1b 78 3a 35 85 a6 56 48 9a 24
12 50 54 b3 0c 00 d1 c0 81 00 a9 c0 95 40 81 80
8b c0 81 c0 01 01 28 3c 80 a0 70 b0 1c 40 30 20
36 00 dd 0c 11 00 00 1a 00 00 00 fd 00 38 4b 1e
53 11 00 0a 20 20 20 20 20 20 00 00 00 fc 00 42
65 65 74 72 6f 6e 69 63 73 20 44 0a 00 00 00 ff
00 4c 35 36 30 35 31 37 39 34 33 30 32 0a 01 68

02 03 22 72 4f 01 02 03 04 00 90 11 12 13 00 9f
00 00 00 00 23 09 7f 07 83 01 00 00 65 03 0c 00
10 00 28 3c 80 a0 70 b0 23 40 30 20 36 00 dd 0c
11 00 00 1a 01 1d 00 72 51 d0 1e 20 6e 28 55 00
dd 0c 11 00 00 9e 00 00 00 00 00 00 00 00 00 00
00 00 00 00 00 00 00 00 00 00 00 00 00 00 00 00
00 00 00 00 00 00 00 00 00 00 00 00 00 00 00 00
00 00 00 00 00 00 00 00 00 00 00 00 00 00 00 dc

00 ff ff ff ff ff ff 00 4a 8b bf 01 01 00 50 63
0c 14 01 04 b5 30 1b 78 3a 35 85 a6 56 48 9a 24
12 50 54 b3 0c 00 d1 c0 81 00 a9 c0 95 40 81 80
8b c0 81 c0 01 01 28 3c 80 a0 70 b0 1c 40 30 20
36 00 dd 0c 11 00 00 1a 00 00 00 fd 00 38 4b 1e
53 11 00 0a 20 20 20 20 20 20 00 00 00 fc 00 42
65 65 74 72 6f 6e 69 63 73 20 44 0a 00 00 00 ff
00 4c 35 36 30 35 31 37 39 34 33 30 32 0a 01 68

02 03 22 72 4f 01 02 03 04 00 90 11 12 13 00 9f
00 00 00 00 23 09 7f 07 83 01 00 00 65 03 0c 00
10 00 28 3c 80 a0 70 b0 23 40 30 20 36 00 dd 0c
11 00 00 1a 01 1d 00 72 51 d0 1e 20 6e 28 55 00
dd 0c 11 00 00 9e 00 00 00 00 00 00 00 00 00 00
00 00 00 00 00 00 00 00 00 00 00 00 00 00 00 00
00 00 00 00 00 00 00 00 00 00 00 00 00 00 00 00
00 00 00 00 00 00 00 00 00 00 00 00 00 00 00 dc

----------------

Block 0, Base EDID:
  EDID Structure Version & Revision: 1.4
  Vendor & Product Identification:
    Manufacturer: RTK
    Model: 447
    Serial Number: ...
    Made in: week 12 of 2010
  Basic Display Parameters & Features:
    Digital display
    Bits per primary color channel: 10
    DisplayPort interface
    Maximum image size: 48 cm x 27 cm
    Gamma: 2.20
    DPMS levels: Off
    Supported color formats: RGB 4:4:4, YCrCb 4:4:4, YCrCb 4:2:2
    First detailed timing includes the native pixel format and preferred refresh rate
  Color Characteristics:
    Red  : 0.6484, 0.3388
    Green: 0.2822, 0.6025
    Blue : 0.1425, 0.0703
    White: 0.3134, 0.3291
  Established Timings I & II:
    IBM     :   720x400    70.081663 Hz   9:5     31.467 kHz     28.320000 MHz
    DMT 0x04:   640x480    59.940476 Hz   4:3     31.469 kHz     25.175000 MHz
    Apple   :   640x480    66.666667 Hz   4:3     35.000 kHz     30.240000 MHz
    DMT 0x08:   800x600    56.250000 Hz   4:3     35.156 kHz     36.000000 MHz
    DMT 0x09:   800x600    60.316541 Hz   4:3     37.879 kHz     40.000000 MHz
    DMT 0x10:  1024x768    60.003840 Hz   4:3     48.363 kHz     65.000000 MHz
    DMT 0x11:  1024x768    70.069359 Hz   4:3     56.476 kHz     75.000000 MHz
  Standard Timings:
    DMT 0x52:  1920x1080   60.000000 Hz  16:9     67.500 kHz    148.500000 MHz
    DMT 0x1c:  1280x800    59.810326 Hz  16:10    49.702 kHz     83.500000 MHz
    DMT 0x53:  1600x900    60.000000 Hz  16:9     60.000 kHz    108.000000 MHz (RB)
    GTF     :  1440x1080   60.000055 Hz   4:3     67.080 kHz    129.867000 MHz
    DMT 0x23:  1280x1024   60.019740 Hz   5:4     63.981 kHz    108.000000 MHz
    GTF     :  1360x765    60.000341 Hz  16:9     47.520 kHz     84.396000 MHz
    DMT 0x55:  1280x720    60.000000 Hz  16:9     45.000 kHz     74.250000 MHz
  Detailed Timing Descriptors:
    DTD 1:  1920x1200   60.291907 Hz  16:10    74.038 kHz    154.000000 MHz (477 mm x 268 mm)
                 Hfront   48 Hsync  32 Hback   80 Hpol P
                 Vfront    3 Vsync   6 Vback   19 Vpol N
    Display Range Limits:
      Monitor ranges (GTF): 56-75 Hz V, 30-83 kHz H, max dotclock 170 MHz
    Display Product Name: 'Beetronics D'
    Display Product Serial Number: ...
  Extension blocks: 1
Checksum: 0x68

----------------

Block 1, CTA-861 Extension Block:
  Revision: 3
  Basic audio support
  Supports YCbCr 4:4:4
  Supports YCbCr 4:2:2
  Native DTDs: 2
  Video Data Block:
    VIC   1:   640x480    59.940476 Hz   4:3     31.469 kHz     25.175000 MHz
    VIC   2:   720x480    59.940060 Hz   4:3     31.469 kHz     27.000000 MHz
    VIC   3:   720x480    59.940060 Hz  16:9     31.469 kHz     27.000000 MHz
    VIC   4:  1280x720    60.000000 Hz  16:9     45.000 kHz     74.250000 MHz
    VIC  16:  1920x1080   60.000000 Hz  16:9     67.500 kHz    148.500000 MHz (native)
    VIC  17:   720x576    50.000000 Hz   4:3     31.250 kHz     27.000000 MHz
    VIC  18:   720x576    50.000000 Hz  16:9     31.250 kHz     27.000000 MHz
    VIC  19:  1280x720    50.000000 Hz  16:9     37.500 kHz     74.250000 MHz
    VIC  31:  1920x1080   50.000000 Hz  16:9     56.250 kHz    148.500000 MHz (native)
  Audio Data Block:
    Linear PCM:
      Max channels: 2
      Supported sample rates (kHz): 192 176.4 96 88.2 48 44.1 32
      Supported sample sizes (bits): 24 20 16
  Speaker Allocation Data Block:
    FL/FR - Front Left/Right
  Vendor-Specific Data Block (HDMI), OUI 00-0C-03:
    Source physical address: 1.0.0.0
  Detailed Timing Descriptors:
    DTD 2:  1920x1200   59.950171 Hz  16:10    74.038 kHz    154.000000 MHz (477 mm x 268 mm)
                 Hfront   48 Hsync  32 Hback   80 Hpol P
                 Vfront    3 Vsync   6 Vback   26 Vpol N
    DTD 3:  1280x1440i  59.960027 Hz   8:9     45.000 kHz     74.250000 MHz (477 mm x 268 mm)
                 Hfront  110 Hsync  40 Hback  220 Hpol P
                 Vfront    5 Vsync   5 Vback   20 Vpol P Vfront +0.5 Odd Field
                 Vfront    5 Vsync   5 Vback   20 Vpol P Vback  +0.5 Even Field
Checksum: 0xdc  Unused space in Extension Block: 57 bytes

----------------

Warnings:

Block 0, Base EDID:
  Standard Timings: Standard Timing 1360x765 has a dubious odd vertical resolution.
  Detailed Timing Descriptor #1: Image size is 477x268 mm, but based on the picture AR it should be 428x268 mm.
  Display Range Limits: GTF support is deprecated in EDID 1.4.
Block 1, CTA-861 Extension Block:
  IT Video Formats are overscanned by default, but normally this should be underscanned.
  Video Data Block: VIC 1 and the first DTD are not identical. Is this intended?
  Video Data Block: All VICs are in ascending order, and the first (preferred) VIC <= 4, is that intended?
  Detailed Timing Descriptor #2: Image size is 477x268 mm, but based on the picture AR it should be 428x268 mm.
  Detailed Timing Descriptor #3: Image size is 477x268 mm, but based on the picture AR it should be 238x268 mm.
  Display Product Serial Number is set, so the Serial Number in the Base EDID should be 0.
  Add a Colorimetry Data Block with the sRGB colorimetry bit set to avoid interop issues.
EDID:
  Base EDID: Some timings are out of range of the Monitor Ranges:
    Vertical Freq: 50.000 - 70.082 Hz (Monitor: 56.000 - 75.000 Hz)

Failures:

Block 0, Base EDID:
  Display Range Limits: GTF is supported, but the display does not support continuous frequencies.
Block 1, CTA-861 Extension Block:
  Vendor-Specific Data Block (HDMI), OUI 00-0C-03: The HDMI Specification requires EDID 1.3 instead of 1.4.
  Missing VCDB, needed for Set Selectable RGB Quantization to avoid interop issues.
EDID:
  Extension Block 2 started with EDID header, ignoring Extension Blocks >= 2.
  CTA-861: Native progressive timings are a mix of several resolutions.

EDID conformity: FAIL
