edid-decode (hex):

00 ff ff ff ff ff ff 00 4d 10 b9 14 00 00 00 00
16 1d 01 04 a5 22 13 78 0e 6c c4 b2 4d 35 c7 19
05 55 56 00 00 00 01 01 01 01 01 01 01 01 01 01
01 01 01 01 01 01 4d d0 00 a0 f0 70 3e 80 30 20
35 00 58 c2 10 00 00 18 00 00 00 00 00 00 00 00
00 00 00 00 00 00 00 00 00 00 00 00 00 fe 00 4e
35 56 38 43 80 4c 51 31 35 36 44 31 00 00 00 00
00 02 41 03 32 01 12 00 00 0b 01 0a 20 20 00 3d

00 ff ff ff ff ff ff 00 4d 10 b9 14 00 00 00 00
16 1d 01 04 a5 22 13 78 0e 6c c4 b2 4d 35 c7 19
05 55 56 00 00 00 01 01 01 01 01 01 01 01 01 01
01 01 01 01 01 01 4d d0 00 a0 f0 70 3e 80 30 20
35 00 58 c2 10 00 00 18 00 00 00 00 00 00 00 00
00 00 00 00 00 00 00 00 00 00 00 00 00 fe 00 4e
35 56 38 43 80 4c 51 31 35 36 44 31 00 00 00 00
00 02 41 03 32 01 12 00 00 0b 01 0a 20 20 00 3d

----------------

Block 0, Base EDID:
  EDID Structure Version & Revision: 1.4
  Vendor & Product Identification:
    Manufacturer: SHP
    Model: 5305
    Made in: week 22 of 2019
  Basic Display Parameters & Features:
    Digital display
    Bits per primary color channel: 8
    DisplayPort interface
    Maximum image size: 34 cm x 19 cm
    Gamma: 2.20
    Supported color formats: RGB 4:4:4, YCrCb 4:4:4
    Default (sRGB) color space is primary color space
    First detailed timing includes the native pixel format and preferred refresh rate
  Color Characteristics:
    Red  : 0.6962, 0.3027
    Green: 0.2099, 0.7773
    Blue : 0.1005, 0.0195
    White: 0.3330, 0.3359
  Established Timings I & II: none
  Standard Timings: none
  Detailed Timing Descriptors:
    DTD 1:  3840x2160   59.996625 Hz  16:9    133.312 kHz    533.250000 MHz (344 mm x 194 mm)
                 Hfront   48 Hsync  32 Hback   80 Hpol N
                 Vfront    3 Vsync   5 Vback   54 Vpol N
    Empty Descriptor
    Alphanumeric Data String: 'N5V8C.LQ156D1'
    Manufacturer-Specified Display Descriptor (0x00): 00 00 00 02 41 03 32 01 12 00 00 0b 01 0a 20 20 '....A.2.......  '
Checksum: 0x3d

----------------

Block 1, Unknown EDID Extension Block 0x00:
  00 ff ff ff ff ff ff 00 4d 10 b9 14 00 00 00 00 '........M.......'
  16 1d 01 04 a5 22 13 78 0e 6c c4 b2 4d 35 c7 19 '.....".x.l..M5..'
  05 55 56 00 00 00 01 01 01 01 01 01 01 01 01 01 '.UV.............'
  01 01 01 01 01 01 4d d0 00 a0 f0 70 3e 80 30 20 '......M....p>.0 '
  35 00 58 c2 10 00 00 18 00 00 00 00 00 00 00 00 '5.X.............'
  00 00 00 00 00 00 00 00 00 00 00 00 00 fe 00 4e '...............N'
  35 56 38 43 80 4c 51 31 35 36 44 31 00 00 00 00 '5V8C.LQ156D1....'
  00 02 41 03 32 01 12 00 00 0b 01 0a 20 20 00 3d '..A.2.......  .='
Checksum: 0x3d

----------------

Warnings:

Block 0, Base EDID:
  Alphanumeric Data String: Non-ASCII character 0x80 at position 5, can cause problems.
  Missing Display Product Name.

Failures:

Block 0, Base EDID:
  Basic Display Parameters & Features: sRGB is signaled, but the chromaticities do not match.
  Empty Descriptor: Use Dummy Descriptor instead of all zeroes.
Block 1, Base EDID:
  Unknown Extension Block.
EDID:
  Base EDID: EDID specified 0 extension block(s), but found 1 extension block(s).

EDID conformity: FAIL
