edid-decode (hex):

00 ff ff ff ff ff ff 00 04 72 cb 00 81 07 61 92
1a 13 01 04 a5 34 1d 78 e2 de 95 a3 54 4c 99 26
0f 50 54 bb 8c 10 b3 00 71 4f 81 00 95 00 81 80
81 c0 d1 c0 01 01 1a 36 80 a0 70 38 1f 40 30 20
25 00 09 25 21 00 00 1f 00 00 00 fd 00 38 4b 1f
54 12 00 0a 20 20 20 20 20 20 00 00 00 ff 00 4c
47 55 30 43 30 31 39 34 30 35 30 0a 00 00 00 fc
00 50 32 33 35 48 0a 20 20 20 20 20 20 20 00 e3

00 ff ff ff ff ff ff 00 04 72 cb 00 81 07 61 92
1a 13 01 04 a5 34 1d 78 e2 de 95 a3 54 4c 99 26
0f 50 54 bb 8c 10 b3 00 71 4f 81 00 95 00 81 80
81 c0 d1 c0 01 01 1a 36 80 a0 70 38 1f 40 30 20
25 00 09 25 21 00 00 1f 00 00 00 fd 00 38 4b 1f
54 12 00 0a 20 20 20 20 20 20 00 00 00 ff 00 4c
47 55 30 43 30 31 39 34 30 35 30 0a 00 00 00 fc
00 50 32 33 35 48 0a 20 20 20 20 20 20 20 00 e3

----------------

Block 0, Base EDID:
  EDID Structure Version & Revision: 1.4
  Vendor & Product Identification:
    Manufacturer: ACR
    Model: 203
    Serial Number: ...
    Made in: week 26 of 2009
  Basic Display Parameters & Features:
    Digital display
    Bits per primary color channel: 8
    DisplayPort interface
    Maximum image size: 52 cm x 29 cm
    Gamma: 2.20
    DPMS levels: Standby Suspend Off
    Supported color formats: RGB 4:4:4
    First detailed timing includes the native pixel format and preferred refresh rate
  Color Characteristics:
    Red  : 0.6396, 0.3291
    Green: 0.2998, 0.5996
    Blue : 0.1503, 0.0595
    White: 0.3134, 0.3291
  Established Timings I & II:
    IBM     :   720x400    70.081663 Hz   9:5     31.467 kHz     28.320000 MHz
    DMT 0x04:   640x480    59.940476 Hz   4:3     31.469 kHz     25.175000 MHz
    Apple   :   640x480    66.666667 Hz   4:3     35.000 kHz     30.240000 MHz
    DMT 0x05:   640x480    72.808802 Hz   4:3     37.861 kHz     31.500000 MHz
    DMT 0x08:   800x600    56.250000 Hz   4:3     35.156 kHz     36.000000 MHz
    DMT 0x09:   800x600    60.316541 Hz   4:3     37.879 kHz     40.000000 MHz
    DMT 0x0a:   800x600    72.187572 Hz   4:3     48.077 kHz     50.000000 MHz
    DMT 0x10:  1024x768    60.003840 Hz   4:3     48.363 kHz     65.000000 MHz
    DMT 0x11:  1024x768    70.069359 Hz   4:3     56.476 kHz     75.000000 MHz
  Standard Timings:
    DMT 0x3a:  1680x1050   59.954250 Hz  16:10    65.290 kHz    146.250000 MHz
    DMT 0x15:  1152x864    75.000000 Hz   4:3     67.500 kHz    108.000000 MHz
    DMT 0x1c:  1280x800    59.810326 Hz  16:10    49.702 kHz     83.500000 MHz
    DMT 0x2f:  1440x900    59.887445 Hz  16:10    55.935 kHz    106.500000 MHz
    DMT 0x23:  1280x1024   60.019740 Hz   5:4     63.981 kHz    108.000000 MHz
    DMT 0x55:  1280x720    60.000000 Hz  16:9     45.000 kHz     74.250000 MHz
    DMT 0x52:  1920x1080   60.000000 Hz  16:9     67.500 kHz    148.500000 MHz
  Detailed Timing Descriptors:
    DTD 1:  1920x1080   59.933878 Hz  16:9     66.587 kHz    138.500000 MHz (521 mm x 293 mm)
                 Hfront   48 Hsync  32 Hback   80 Hpol P
                 Vfront    2 Vsync   5 Vback   24 Vpol P
    Display Range Limits:
      Monitor ranges (GTF): 56-75 Hz V, 31-84 kHz H, max dotclock 180 MHz
    Display Product Serial Number: ...
    Display Product Name: 'P235H'
Checksum: 0xe3

----------------

Warnings:

Block 0, Base EDID:
  Display Range Limits: GTF support is deprecated in EDID 1.4.

Failures:

Block 0, Base EDID:
  Display Range Limits: GTF is supported, but the display does not support continuous frequencies.
EDID:
  Extension Block 1 started with EDID header, ignoring Extension Blocks >= 1.

EDID conformity: FAIL
