edid-decode (hex):

00 ff ff ff ff ff ff 00 11 ee 76 00 01 01 01 01
00 20 01 03 80 9a 57 78 2a 1b be a2 55 34 b3 26
14 4a 52 af ce 00 a9 40 90 40 81 80 01 01 01 01
01 01 01 01 01 01 02 3a 80 d0 72 38 2d 40 10 2c
45 80 03 62 63 00 00 1e 02 3a 80 18 71 38 2d 40
58 2c 45 00 c4 8e 21 00 00 1e 00 00 00 fc 00 44
45 4e 4f 4e 2d 41 56 52 0a 20 20 20 00 00 00 fd
00 17 4c 0f 4b 11 00 0a 20 20 20 20 20 20 01 34

02 03 4c 72 50 1f 90 20 14 05 13 04 12 03 11 02
16 07 15 06 01 3b 0f 7f 07 3d 1e c0 15 07 50 5f
7e 03 57 06 03 67 7e 03 4d 02 00 7b 04 5b 5f 7e
01 83 5f 00 00 6f 03 0c 00 20 00 b8 2d 20 a0 05
01 40 20 50 60 e6 11 46 d0 00 70 00 01 1d 80 18
71 1c 16 20 58 2c 25 00 c4 8e 21 00 00 9e 01 1d
80 d0 72 1c 16 20 10 2c 25 80 03 62 63 00 00 9e
00 00 00 00 00 00 00 00 00 00 00 00 00 00 00 a3

00 ff ff ff ff ff ff 00 11 ee 76 00 01 01 01 01
00 20 01 03 80 9a 57 78 2a 1b be a2 55 34 b3 26
14 4a 52 af ce 00 a9 40 90 40 81 80 01 01 01 01
01 01 01 01 01 01 02 3a 80 d0 72 38 2d 40 10 2c
45 80 03 62 63 00 00 1e 02 3a 80 18 71 38 2d 40
58 2c 45 00 c4 8e 21 00 00 1e 00 00 00 fc 00 44
45 4e 4f 4e 2d 41 56 52 0a 20 20 20 00 00 00 fd
00 17 4c 0f 4b 11 00 0a 20 20 20 20 20 20 01 34

02 03 4c 72 50 1f 90 20 14 05 13 04 12 03 11 02
16 07 15 06 01 3b 0f 7f 07 3d 1e c0 15 07 50 5f
7e 03 57 06 03 67 7e 03 4d 02 00 7b 04 5b 5f 7e
01 83 5f 00 00 6f 03 0c 00 20 00 b8 2d 20 a0 05
01 40 20 50 60 e6 11 46 d0 00 70 00 01 1d 80 18
71 1c 16 20 58 2c 25 00 c4 8e 21 00 00 9e 01 1d
80 d0 72 1c 16 20 10 2c 25 80 03 62 63 00 00 9e
00 00 00 00 00 00 00 00 00 00 00 00 00 00 00 a3

----------------

Block 0, Base EDID:
  EDID Structure Version & Revision: 1.3
  Vendor & Product Identification:
    Manufacturer: DON
    Model: 118
    Serial Number: ...
    Made in: 2022
  Basic Display Parameters & Features:
    Digital display
    Maximum image size: 154 cm x 87 cm
    Gamma: 2.20
    DPMS levels: Off
    RGB color display
    First detailed timing is the preferred timing
  Color Characteristics:
    Red  : 0.6328, 0.3330
    Green: 0.2050, 0.7021
    Blue : 0.1503, 0.0810
    White: 0.2919, 0.3222
  Established Timings I & II:
    IBM     :   720x400    70.081663 Hz   9:5     31.467 kHz     28.320000 MHz
    DMT 0x04:   640x480    59.940476 Hz   4:3     31.469 kHz     25.175000 MHz
    DMT 0x05:   640x480    72.808802 Hz   4:3     37.861 kHz     31.500000 MHz
    DMT 0x06:   640x480    75.000000 Hz   4:3     37.500 kHz     31.500000 MHz
    DMT 0x08:   800x600    56.250000 Hz   4:3     35.156 kHz     36.000000 MHz
    DMT 0x09:   800x600    60.316541 Hz   4:3     37.879 kHz     40.000000 MHz
    DMT 0x0a:   800x600    72.187572 Hz   4:3     48.077 kHz     50.000000 MHz
    DMT 0x0b:   800x600    75.000000 Hz   4:3     46.875 kHz     49.500000 MHz
    DMT 0x10:  1024x768    60.003840 Hz   4:3     48.363 kHz     65.000000 MHz
    DMT 0x11:  1024x768    70.069359 Hz   4:3     56.476 kHz     75.000000 MHz
    DMT 0x12:  1024x768    75.028582 Hz   4:3     60.023 kHz     78.750000 MHz
  Standard Timings:
    DMT 0x33:  1600x1200   60.000000 Hz   4:3     75.000 kHz    162.000000 MHz
    DMT 0x2a:  1400x1050   59.978442 Hz   4:3     65.317 kHz    121.750000 MHz
    DMT 0x23:  1280x1024   60.019740 Hz   5:4     63.981 kHz    108.000000 MHz
  Detailed Timing Descriptors:
    DTD 1:  1920x1080   50.000000 Hz  16:9     56.250 kHz    148.500000 MHz (1539 mm x 866 mm)
                 Hfront  528 Hsync  44 Hback  148 Hpol P
                 Vfront    4 Vsync   5 Vback   36 Vpol P
    DTD 2:  1920x1080   60.000000 Hz  16:9     67.500 kHz    148.500000 MHz (708 mm x 398 mm)
                 Hfront   88 Hsync  44 Hback  148 Hpol P
                 Vfront    4 Vsync   5 Vback   36 Vpol P
    Display Product Name: 'DENON-AVR'
    Display Range Limits:
      Monitor ranges (GTF): 23-76 Hz V, 15-75 kHz H, max dotclock 170 MHz
  Extension blocks: 1
Checksum: 0x34

----------------

Block 1, CTA-861 Extension Block:
  Revision: 3
  Basic audio support
  Supports YCbCr 4:4:4
  Supports YCbCr 4:2:2
  Native DTDs: 2
  Video Data Block:
    VIC  31:  1920x1080   50.000000 Hz  16:9     56.250 kHz    148.500000 MHz
    VIC  16:  1920x1080   60.000000 Hz  16:9     67.500 kHz    148.500000 MHz (native)
    VIC  32:  1920x1080   24.000000 Hz  16:9     27.000 kHz     74.250000 MHz
    VIC  20:  1920x1080i  50.000000 Hz  16:9     28.125 kHz     74.250000 MHz
    VIC   5:  1920x1080i  60.000000 Hz  16:9     33.750 kHz     74.250000 MHz
    VIC  19:  1280x720    50.000000 Hz  16:9     37.500 kHz     74.250000 MHz
    VIC   4:  1280x720    60.000000 Hz  16:9     45.000 kHz     74.250000 MHz
    VIC  18:   720x576    50.000000 Hz  16:9     31.250 kHz     27.000000 MHz
    VIC   3:   720x480    59.940060 Hz  16:9     31.469 kHz     27.000000 MHz
    VIC  17:   720x576    50.000000 Hz   4:3     31.250 kHz     27.000000 MHz
    VIC   2:   720x480    59.940060 Hz   4:3     31.469 kHz     27.000000 MHz
    VIC  22:  1440x576i   50.000000 Hz  16:9     15.625 kHz     27.000000 MHz
    VIC   7:  1440x480i   59.940060 Hz  16:9     15.734 kHz     27.000000 MHz
    VIC  21:  1440x576i   50.000000 Hz   4:3     15.625 kHz     27.000000 MHz
    VIC   6:  1440x480i   59.940060 Hz   4:3     15.734 kHz     27.000000 MHz
    VIC   1:   640x480    59.940476 Hz   4:3     31.469 kHz     25.175000 MHz
  Audio Data Block:
    Linear PCM:
      Max channels: 8
      Supported sample rates (kHz): 192 176.4 96 88.2 48 44.1 32
      Supported sample sizes (bits): 24 20 16
    DTS:
      Max channels: 6
      Supported sample rates (kHz): 96 88.2 48 44.1
      Maximum bit rate: 1536 kb/s
    AC-3:
      Max channels: 6
      Supported sample rates (kHz): 48 44.1 32
      Maximum bit rate: 640 kb/s
    DTS-HD:
      Max channels: 8
      Supported sample rates (kHz): 192 176.4 96 88.2 48 44.1
      Supports DTS:X
      Audio Format Code dependent value: 0x03
    Enhanced AC-3 (DD+):
      Max channels: 8
      Supported sample rates (kHz): 48 44.1
      Supports Joint Object Coding
      Supports Joint Object Coding with ACMOD28
    MAT (MLP):
      Max channels: 8
      Supported sample rates (kHz): 192 176.4 96 88.2 48 44.1
      Supports Dolby TrueHD, object audio PCM and channel-based PCM
      Hash calculation not required for object audio PCM or channel-based PCM
    One Bit Audio:
      Max channels: 6
      Supported sample rates (kHz): 44.1
      Audio Format Code dependent value: 0x00
    MPEG-H 3D Audio:
      MPEG-H 3D Audio Level: Level 3
      Supported sample rates (kHz): 48
      Supports MPEG-H 3D Audio Low Complexity Profile
    DTS-HD:
      Max channels: 8
      Supported sample rates (kHz): 192 176.4 96 88.2 48 44.1
      Audio Format Code dependent value: 0x01
  Speaker Allocation Data Block:
    FL/FR - Front Left/Right
    LFE1 - Low Frequency Effects 1
    FC - Front Center
    LS/RS - Left/Right Surround
    BC - Back Center
    BL/BR - Back Left/Right
  Vendor-Specific Data Block (HDMI), OUI 00-0C-03:
    Source physical address: 2.0.0.0
    Supports_AI
    DC_36bit
    DC_30bit
    DC_Y444
    Maximum TMDS clock: 225 MHz
    Extended HDMI video details:
      3D present
      All advertised VICs are 3D-capable
      3D: Side-by-side (half, horizontal)
      3D: Top-and-bottom
      3D VIC indices with specific capabilities:
        VIC  32:  1920x1080   24.000000 Hz  16:9     27.000 kHz     74.250000 MHz (frame packing)
        VIC  19:  1280x720    50.000000 Hz  16:9     37.500 kHz     74.250000 MHz (frame packing)
        VIC   4:  1280x720    60.000000 Hz  16:9     45.000 kHz     74.250000 MHz (frame packing)
  Vendor-Specific Audio Data Block (Dolby), OUI 00-D0-46:
    Version: 1 (7 bytes)
    Height speaker zone present
    Surround speaker zone present
    Center speaker zone present
  Detailed Timing Descriptors:
    DTD 3:  1920x1080i  60.000000 Hz  16:9     33.750 kHz     74.250000 MHz (708 mm x 398 mm)
                 Hfront   88 Hsync  44 Hback  148 Hpol P
                 Vfront    2 Vsync   5 Vback   15 Vpol P Vfront +0.5 Odd Field
                 Vfront    2 Vsync   5 Vback   15 Vpol P Vback  +0.5 Even Field
    DTD 4:  1920x1080i  50.000000 Hz  16:9     28.125 kHz     74.250000 MHz (1539 mm x 866 mm)
                 Hfront  528 Hsync  44 Hback  148 Hpol P
                 Vfront    2 Vsync   5 Vback   15 Vpol P Vfront +0.5 Odd Field
                 Vfront    2 Vsync   5 Vback   15 Vpol P Vback  +0.5 Even Field
Checksum: 0xa3  Unused space in Extension Block: 15 bytes

----------------

Warnings:

Block 0, Base EDID:
  Vendor & Product Identification: The serial number is one of the known dummy values, it should probably be set to 0.
Block 1, CTA-861 Extension Block:
  IT Video Formats are overscanned by default, but normally this should be underscanned.
  Add a Colorimetry Data Block with the sRGB colorimetry bit set to avoid interop issues.

Failures:

Block 0, Base EDID:
  Detailed Timing Descriptor #2: Mismatch of image size 708x398 mm vs display size 1540x870 mm.
Block 1, CTA-861 Extension Block:
  Detailed Timing Descriptor #3: Mismatch of image size 708x398 mm vs display size 1540x870 mm.
  Missing VCDB, needed for Set Selectable RGB Quantization to avoid interop issues.
EDID:
  Extension Block 2 started with EDID header, ignoring Extension Blocks >= 2.

EDID conformity: FAIL
