edid-decode (hex):

00 ff ff ff ff ff ff 00 4d d9 02 29 01 01 01 01
05 15 01 03 80 00 00 78 0a 0f 50 a5 55 46 99 24
13 49 4b 20 00 00 01 01 01 01 01 01 01 01 01 01
01 01 01 01 01 01 01 1d 80 d0 72 1c 16 20 10 2c
25 80 c4 8e 21 00 00 9e 01 1d 80 18 71 1c 16 20
58 2c 25 00 c4 8e 21 00 00 9e 00 00 00 fd 00 38
55 1f 50 0e 00 0a 20 20 20 20 20 20 00 00 00 fc
00 53 4f 4e 59 20 41 56 41 4d 50 0a 20 20 01 11

02 03 25 70 4b 01 03 04 05 07 10 12 13 14 16 1f
29 09 1f 07 15 07 50 3d 07 c0 83 01 00 00 66 03
0c 00 11 00 80 01 1d 00 72 51 d0 1e 20 6e 28 55
00 c4 8e 21 00 00 1e 01 1d 00 bc 52 d0 1e 20 b8
28 55 40 c4 8e 21 00 00 1e 8c 0a d0 90 20 40 31
20 0c 40 55 00 c4 8e 21 00 00 18 8c 0a d0 8a 20
e0 2d 10 10 3e 96 00 c4 8e 21 00 00 18 00 00 00
00 00 00 00 00 00 00 00 00 00 00 00 00 00 00 1d

00 ff ff ff ff ff ff 00 4d d9 02 29 01 01 01 01
05 15 01 03 80 00 00 78 0a 0f 50 a5 55 46 99 24
13 49 4b 20 00 00 01 01 01 01 01 01 01 01 01 01
01 01 01 01 01 01 01 1d 80 d0 72 1c 16 20 10 2c
25 80 c4 8e 21 00 00 9e 01 1d 80 18 71 1c 16 20
58 2c 25 00 c4 8e 21 00 00 9e 00 00 00 fd 00 38
55 1f 50 0e 00 0a 20 20 20 20 20 20 00 00 00 fc
00 53 4f 4e 59 20 41 56 41 4d 50 0a 20 20 01 11

02 03 25 70 4b 01 03 04 05 07 10 12 13 14 16 1f
29 09 1f 07 15 07 50 3d 07 c0 83 01 00 00 66 03
0c 00 11 00 80 01 1d 00 72 51 d0 1e 20 6e 28 55
00 c4 8e 21 00 00 1e 01 1d 00 bc 52 d0 1e 20 b8
28 55 40 c4 8e 21 00 00 1e 8c 0a d0 90 20 40 31
20 0c 40 55 00 c4 8e 21 00 00 18 8c 0a d0 8a 20
e0 2d 10 10 3e 96 00 c4 8e 21 00 00 18 00 00 00
00 00 00 00 00 00 00 00 00 00 00 00 00 00 00 1d

----------------

Block 0, Base EDID:
  EDID Structure Version & Revision: 1.3
  Vendor & Product Identification:
    Manufacturer: SNY
    Model: 10498
    Serial Number: ...
    Made in: week 5 of 2011
  Basic Display Parameters & Features:
    Digital display
    Image size is variable
    Gamma: 2.20
    RGB color display
    First detailed timing is the preferred timing
  Color Characteristics:
    Red  : 0.6445, 0.3320
    Green: 0.2763, 0.6005
    Blue : 0.1416, 0.0751
    White: 0.2851, 0.2929
  Established Timings I & II:
    DMT 0x04:   640x480    59.940476 Hz   4:3     31.469 kHz     25.175000 MHz
  Standard Timings: none
  Detailed Timing Descriptors:
    DTD 1:  1920x1080i  50.000000 Hz  16:9     28.125 kHz     74.250000 MHz (708 mm x 398 mm)
                 Hfront  528 Hsync  44 Hback  148 Hpol P
                 Vfront    2 Vsync   5 Vback   15 Vpol P Vfront +0.5 Odd Field
                 Vfront    2 Vsync   5 Vback   15 Vpol P Vback  +0.5 Even Field
    DTD 2:  1920x1080i  60.000000 Hz  16:9     33.750 kHz     74.250000 MHz (708 mm x 398 mm)
                 Hfront   88 Hsync  44 Hback  148 Hpol P
                 Vfront    2 Vsync   5 Vback   15 Vpol P Vfront +0.5 Odd Field
                 Vfront    2 Vsync   5 Vback   15 Vpol P Vback  +0.5 Even Field
    Display Range Limits:
      Monitor ranges (GTF): 56-85 Hz V, 31-80 kHz H, max dotclock 140 MHz
    Display Product Name: 'SONY AVAMP'
  Extension blocks: 1
Checksum: 0x11

----------------

Block 1, CTA-861 Extension Block:
  Revision: 3
  Basic audio support
  Supports YCbCr 4:4:4
  Supports YCbCr 4:2:2
  Native DTDs: 0
  Video Data Block:
    VIC   1:   640x480    59.940476 Hz   4:3     31.469 kHz     25.175000 MHz
    VIC   3:   720x480    59.940060 Hz  16:9     31.469 kHz     27.000000 MHz
    VIC   4:  1280x720    60.000000 Hz  16:9     45.000 kHz     74.250000 MHz
    VIC   5:  1920x1080i  60.000000 Hz  16:9     33.750 kHz     74.250000 MHz
    VIC   7:  1440x480i   59.940060 Hz  16:9     15.734 kHz     27.000000 MHz
    VIC  16:  1920x1080   60.000000 Hz  16:9     67.500 kHz    148.500000 MHz
    VIC  18:   720x576    50.000000 Hz  16:9     31.250 kHz     27.000000 MHz
    VIC  19:  1280x720    50.000000 Hz  16:9     37.500 kHz     74.250000 MHz
    VIC  20:  1920x1080i  50.000000 Hz  16:9     28.125 kHz     74.250000 MHz
    VIC  22:  1440x576i   50.000000 Hz  16:9     15.625 kHz     27.000000 MHz
    VIC  31:  1920x1080   50.000000 Hz  16:9     56.250 kHz    148.500000 MHz
  Audio Data Block:
    Linear PCM:
      Max channels: 2
      Supported sample rates (kHz): 96 88.2 48 44.1 32
      Supported sample sizes (bits): 24 20 16
    AC-3:
      Max channels: 6
      Supported sample rates (kHz): 48 44.1 32
      Maximum bit rate: 640 kb/s
    DTS:
      Max channels: 6
      Supported sample rates (kHz): 48 44.1 32
      Maximum bit rate: 1536 kb/s
  Speaker Allocation Data Block:
    FL/FR - Front Left/Right
  Vendor-Specific Data Block (HDMI), OUI 00-0C-03:
    Source physical address: 1.1.0.0
    Supports_AI
  Detailed Timing Descriptors:
    DTD 3:  1280x720    60.000000 Hz  16:9     45.000 kHz     74.250000 MHz (708 mm x 398 mm)
                 Hfront  110 Hsync  40 Hback  220 Hpol P
                 Vfront    5 Vsync   5 Vback   20 Vpol P
    DTD 4:  1280x720    50.000000 Hz  16:9     37.500 kHz     74.250000 MHz (708 mm x 398 mm)
                 Hfront  440 Hsync  40 Hback  220 Hpol P
                 Vfront    5 Vsync   5 Vback   20 Vpol P
    DTD 5:   720x576    50.000000 Hz   5:4     31.250 kHz     27.000000 MHz (708 mm x 398 mm)
                 Hfront   12 Hsync  64 Hback   68 Hpol N
                 Vfront    5 Vsync   5 Vback   39 Vpol N
    DTD 6:   720x480    59.940060 Hz   3:2     31.469 kHz     27.000000 MHz (708 mm x 398 mm)
                 Hfront   16 Hsync  62 Hback   60 Hpol N
                 Vfront    9 Vsync   6 Vback   30 Vpol N
Checksum: 0x1d  Unused space in Extension Block: 18 bytes

----------------

Warnings:

Block 0, Base EDID:
  Vendor & Product Identification: The serial number is one of the known dummy values, it should probably be set to 0.
Block 1, CTA-861 Extension Block:
  IT Video Formats are overscanned by default, but normally this should be underscanned.
  Video Data Block: VIC 1 and the first DTD are not identical. Is this intended?
  Video Data Block: All VICs are in ascending order, and the first (preferred) VIC <= 4, is that intended?
  Detailed Timing Descriptor #5: Image size is 708x398 mm, but based on the picture AR it should be 497x398 mm.
  Detailed Timing Descriptor #6: Image size is 708x398 mm, but based on the picture AR it should be 597x398 mm.
  Add a Colorimetry Data Block with the sRGB colorimetry bit set to avoid interop issues.
EDID:
  Base EDID: Some timings are out of range of the Monitor Ranges:
    Vertical Freq: 50.000 - 60.000 Hz (Monitor: 56.000 - 85.000 Hz)
    Horizontal Freq: 15.625 - 67.500 kHz (Monitor: 31.000 - 80.000 kHz)
    Maximum Clock: 148.500 MHz (Monitor: 140.000 MHz)

Failures:

Block 1, CTA-861 Extension Block:
  Missing VCDB, needed for Set Selectable RGB Quantization to avoid interop issues.
EDID:
  Extension Block 2 started with EDID header, ignoring Extension Blocks >= 2.
  Base EDID: The DTD max image size is 708x398mm, but the display size is not specified anywhere.

EDID conformity: FAIL
