edid-decode (hex):

00 ff ff ff ff ff ff 00 09 e5 54 0b 00 00 00 00
13 20 01 04 a5 1e 13 78 03 2a 15 95 5b 57 91 29
20 50 54 00 00 00 01 01 01 01 01 01 01 01 01 01
01 01 01 01 01 01 61 40 80 04 71 b0 3c 40 30 20
36 00 2e bc 10 00 00 1a 00 00 00 00 00 00 00 00
00 00 00 00 00 00 00 00 00 00 00 00 00 fe 00 42
4f 45 20 43 51 0a 20 20 20 20 20 20 00 00 00 fe
00 4e 56 31 34 30 57 55 4d 2d 4e 34 42 0a 00 43

00 ff ff ff ff ff ff 00 09 e5 54 0b 00 00 00 00
13 20 01 04 a5 1e 13 78 03 2a 15 95 5b 57 91 29
20 50 54 00 00 00 01 01 01 01 01 01 01 01 01 01
01 01 01 01 01 01 61 40 80 04 71 b0 3c 40 30 20
36 00 2e bc 10 00 00 1a 00 00 00 00 00 00 00 00
00 00 00 00 00 00 00 00 00 00 00 00 00 fe 00 42
4f 45 20 43 51 0a 20 20 20 20 20 20 00 00 00 fe
00 4e 56 31 34 30 57 55 4d 2d 4e 34 42 0a 00 43

----------------

Block 0, Base EDID:
  EDID Structure Version & Revision: 1.4
  Vendor & Product Identification:
    Manufacturer: BOE
    Model: 2900
    Made in: week 19 of 2022
  Basic Display Parameters & Features:
    Digital display
    Bits per primary color channel: 8
    DisplayPort interface
    Maximum image size: 30 cm x 19 cm
    Gamma: 2.20
    Supported color formats: RGB 4:4:4
    First detailed timing includes the native pixel format and preferred refresh rate
    Display supports continuous frequencies
  Color Characteristics:
    Red  : 0.5820, 0.3574
    Green: 0.3417, 0.5683
    Blue : 0.1601, 0.1259
    White: 0.3134, 0.3291
  Established Timings I & II: none
  Standard Timings: none
  Detailed Timing Descriptors:
    DTD 1:  1920x1200   60.000728 Hz  16:10    75.601 kHz    164.810000 MHz (302 mm x 188 mm)
                 Hfront   48 Hsync  32 Hback  180 Hpol P
                 Vfront    3 Vsync   6 Vback   51 Vpol N
    Empty Descriptor
    Alphanumeric Data String: 'BOE CQ'
    Alphanumeric Data String: 'NV140WUM-N4B'
Checksum: 0x43

----------------

Warnings:

Block 0, Base EDID:
  Missing Display Product Name.

Failures:

Block 0, Base EDID:
  Empty Descriptor: Use Dummy Descriptor instead of all zeroes.
  Missing Display Range Limits Descriptor.
EDID:
  Extension Block 1 started with EDID header, ignoring Extension Blocks >= 1.

EDID conformity: FAIL
