edid-decode (hex):

00 ff ff ff ff ff ff 00 04 72 f2 06 b7 25 00 00
0d 1e 01 03 80 50 23 78 2a 81 95 a3 55 53 9f 25
0a 50 54 bf ef 80 d1 c0 b3 00 95 00 81 80 81 40
81 00 d1 cf 71 4f 4e ab 70 b8 d1 a0 42 50 90 60
64 08 20 59 31 00 00 1a e7 7c 70 a0 d0 a0 29 50
30 20 3a 00 20 59 31 00 00 1a 00 00 00 fd 00 30
4c 0f 88 3c 00 0a 20 20 20 20 20 20 00 00 00 fc
00 43 42 33 34 32 43 4b 0a 20 20 20 20 20 01 24

02 03 48 f0 50 10 1f 04 13 03 12 02 11 05 14 07
16 01 5a 60 61 23 09 07 07 83 01 00 00 67 03 0c
00 10 00 38 3c 68 1a 00 00 01 01 30 4b ed 67 d8
5d c4 01 78 80 01 e2 00 ea e3 05 e0 00 e3 0f 00
e0 e6 06 07 01 8b 60 11 ef 51 70 e0 d4 a0 35 50
00 70 3a 50 20 59 31 00 00 1c 56 5e 00 a0 a0 a0
29 50 30 20 35 00 20 59 31 00 00 1a 98 55 b8 dc
60 a0 42 50 48 30 64 08 20 59 31 00 00 1a 00 05

00 ff ff ff ff ff ff 00 04 72 f2 06 b7 25 00 00
0d 1e 01 03 80 50 23 78 2a 81 95 a3 55 53 9f 25
0a 50 54 bf ef 80 d1 c0 b3 00 95 00 81 80 81 40
81 00 d1 cf 71 4f 4e ab 70 b8 d1 a0 42 50 90 60
64 08 20 59 31 00 00 1a e7 7c 70 a0 d0 a0 29 50
30 20 3a 00 20 59 31 00 00 1a 00 00 00 fd 00 30
4c 0f 88 3c 00 0a 20 20 20 20 20 20 00 00 00 fc
00 43 42 33 34 32 43 4b 0a 20 20 20 20 20 01 24

02 03 48 f0 50 10 1f 04 13 03 12 02 11 05 14 07
16 01 5a 60 61 23 09 07 07 83 01 00 00 67 03 0c
00 10 00 38 3c 68 1a 00 00 01 01 30 4b ed 67 d8
5d c4 01 78 80 01 e2 00 ea e3 05 e0 00 e3 0f 00
e0 e6 06 07 01 8b 60 11 ef 51 70 e0 d4 a0 35 50
00 70 3a 50 20 59 31 00 00 1c 56 5e 00 a0 a0 a0
29 50 30 20 35 00 20 59 31 00 00 1a 98 55 b8 dc
60 a0 42 50 48 30 64 08 20 59 31 00 00 1a 00 05

----------------

Block 0, Base EDID:
  EDID Structure Version & Revision: 1.3
  Vendor & Product Identification:
    Manufacturer: ACR
    Model: 1778
    Serial Number: ...
    Made in: week 13 of 2020
  Basic Display Parameters & Features:
    Digital display
    Maximum image size: 80 cm x 35 cm
    Gamma: 2.20
    DPMS levels: Off
    RGB color display
    First detailed timing is the preferred timing
  Color Characteristics:
    Red  : 0.6386, 0.3320
    Green: 0.3242, 0.6220
    Blue : 0.1464, 0.0400
    White: 0.3134, 0.3291
  Established Timings I & II:
    IBM     :   720x400    70.081663 Hz   9:5     31.467 kHz     28.320000 MHz
    DMT 0x04:   640x480    59.940476 Hz   4:3     31.469 kHz     25.175000 MHz
    Apple   :   640x480    66.666667 Hz   4:3     35.000 kHz     30.240000 MHz
    DMT 0x05:   640x480    72.808802 Hz   4:3     37.861 kHz     31.500000 MHz
    DMT 0x06:   640x480    75.000000 Hz   4:3     37.500 kHz     31.500000 MHz
    DMT 0x08:   800x600    56.250000 Hz   4:3     35.156 kHz     36.000000 MHz
    DMT 0x09:   800x600    60.316541 Hz   4:3     37.879 kHz     40.000000 MHz
    DMT 0x0a:   800x600    72.187572 Hz   4:3     48.077 kHz     50.000000 MHz
    DMT 0x0b:   800x600    75.000000 Hz   4:3     46.875 kHz     49.500000 MHz
    Apple   :   832x624    74.551266 Hz   4:3     49.726 kHz     57.284000 MHz
    DMT 0x10:  1024x768    60.003840 Hz   4:3     48.363 kHz     65.000000 MHz
    DMT 0x11:  1024x768    70.069359 Hz   4:3     56.476 kHz     75.000000 MHz
    DMT 0x12:  1024x768    75.028582 Hz   4:3     60.023 kHz     78.750000 MHz
    DMT 0x24:  1280x1024   75.024675 Hz   5:4     79.976 kHz    135.000000 MHz
    Apple   :  1152x870    75.061550 Hz 192:145   68.681 kHz    100.000000 MHz
  Standard Timings:
    DMT 0x52:  1920x1080   60.000000 Hz  16:9     67.500 kHz    148.500000 MHz
    DMT 0x3a:  1680x1050   59.954250 Hz  16:10    65.290 kHz    146.250000 MHz
    DMT 0x2f:  1440x900    59.887445 Hz  16:10    55.935 kHz    106.500000 MHz
    DMT 0x23:  1280x1024   60.019740 Hz   5:4     63.981 kHz    108.000000 MHz
    DMT 0x20:  1280x960    60.000000 Hz   4:3     60.000 kHz    108.000000 MHz
    DMT 0x1c:  1280x800    59.810326 Hz  16:10    49.702 kHz     83.500000 MHz
    GTF     :  1920x1080   75.000068 Hz  16:9     84.600 kHz    220.637000 MHz
    DMT 0x15:  1152x864    75.000000 Hz   4:3     67.500 kHz    108.000000 MHz
  Detailed Timing Descriptors:
    DTD 1:  3440x1440   75.050314 Hz  43:18   113.026 kHz    438.540000 MHz (800 mm x 345 mm)
                 Hfront  144 Hsync  96 Hback  200 Hpol P
                 Vfront   38 Vsync   4 Vback   24 Vpol N
    DTD 2:  3440x1440   59.972616 Hz  43:18    88.819 kHz    319.750000 MHz (800 mm x 345 mm)
                 Hfront   48 Hsync  32 Hback   80 Hpol P
                 Vfront    3 Vsync  10 Vback   28 Vpol N
    Display Range Limits:
      Monitor ranges (GTF): 48-76 Hz V, 15-136 kHz H, max dotclock 600 MHz
    Display Product Name: 'CB342CK'
  Extension blocks: 1
Checksum: 0x24

----------------

Block 1, CTA-861 Extension Block:
  Revision: 3
  Underscans IT Video Formats by default
  Basic audio support
  Supports YCbCr 4:4:4
  Supports YCbCr 4:2:2
  Native DTDs: 0
  Video Data Block:
    VIC  16:  1920x1080   60.000000 Hz  16:9     67.500 kHz    148.500000 MHz
    VIC  31:  1920x1080   50.000000 Hz  16:9     56.250 kHz    148.500000 MHz
    VIC   4:  1280x720    60.000000 Hz  16:9     45.000 kHz     74.250000 MHz
    VIC  19:  1280x720    50.000000 Hz  16:9     37.500 kHz     74.250000 MHz
    VIC   3:   720x480    59.940060 Hz  16:9     31.469 kHz     27.000000 MHz
    VIC  18:   720x576    50.000000 Hz  16:9     31.250 kHz     27.000000 MHz
    VIC   2:   720x480    59.940060 Hz   4:3     31.469 kHz     27.000000 MHz
    VIC  17:   720x576    50.000000 Hz   4:3     31.250 kHz     27.000000 MHz
    VIC   5:  1920x1080i  60.000000 Hz  16:9     33.750 kHz     74.250000 MHz
    VIC  20:  1920x1080i  50.000000 Hz  16:9     28.125 kHz     74.250000 MHz
    VIC   7:  1440x480i   59.940060 Hz  16:9     15.734 kHz     27.000000 MHz
    VIC  22:  1440x576i   50.000000 Hz  16:9     15.625 kHz     27.000000 MHz
    VIC   1:   640x480    59.940476 Hz   4:3     31.469 kHz     25.175000 MHz
    VIC  90:  2560x1080   60.000000 Hz  64:27    66.000 kHz    198.000000 MHz
    VIC  96:  3840x2160   50.000000 Hz  16:9    112.500 kHz    594.000000 MHz
    VIC  97:  3840x2160   60.000000 Hz  16:9    135.000 kHz    594.000000 MHz
  Audio Data Block:
    Linear PCM:
      Max channels: 2
      Supported sample rates (kHz): 48 44.1 32
      Supported sample sizes (bits): 24 20 16
  Speaker Allocation Data Block:
    FL/FR - Front Left/Right
  Vendor-Specific Data Block (HDMI), OUI 00-0C-03:
    Source physical address: 1.0.0.0
    DC_36bit
    DC_30bit
    DC_Y444
    Maximum TMDS clock: 300 MHz
  Vendor-Specific Data Block (AMD), OUI 00-00-1A:
    Version: 1
    Feature Caps: 0x01
    Minimum Refresh Rate: 48 Hz
    Maximum Refresh Rate: 75 Hz
    Flags 1.x: 0xed (MCCS)
  Vendor-Specific Data Block (HDMI Forum), OUI C4-5D-D8:
    Version: 1
    Maximum TMDS Character Rate: 600 MHz
    SCDC Present
    Supports 10-bits/component Deep Color 4:2:0 Pixel Encoding
  Video Capability Data Block:
    YCbCr quantization: Selectable (via AVI YQ)
    RGB quantization: Selectable (via AVI Q)
    PT scan behavior: Always Underscanned
    IT scan behavior: Always Underscanned
    CE scan behavior: Always Underscanned
  Colorimetry Data Block:
    BT2020cYCC
    BT2020YCC
    BT2020RGB
  YCbCr 4:2:0 Capability Map Data Block:
    VIC  90:  2560x1080   60.000000 Hz  64:27    66.000 kHz    198.000000 MHz
    VIC  96:  3840x2160   50.000000 Hz  16:9    112.500 kHz    594.000000 MHz
    VIC  97:  3840x2160   60.000000 Hz  16:9    135.000 kHz    594.000000 MHz
  HDR Static Metadata Data Block:
    Electro optical transfer functions:
      Traditional gamma - SDR luminance range
      Traditional gamma - HDR luminance range
      SMPTE ST2084
    Supported static metadata descriptors:
      Static metadata type 1
    Desired content max luminance: 139 (1015.241 cd/m^2)
    Desired content max frame-average luminance: 96 (400.000 cd/m^2)
    Desired content min luminance: 17 (0.045 cd/m^2)
  Detailed Timing Descriptors:
    DTD 3:  3440x1440   29.967779 Hz  43:18    44.742 kHz    209.750000 MHz (800 mm x 345 mm)
                 Hfront  256 Hsync 368 Hback  624 Hpol N
                 Vfront    3 Vsync  10 Vback   40 Vpol P
    DTD 4:  2560x1440   59.950550 Hz  16:9     88.787 kHz    241.500000 MHz (800 mm x 345 mm)
                 Hfront   48 Hsync  32 Hback   80 Hpol P
                 Vfront    3 Vsync   5 Vback   33 Vpol N
    DTD 5:  1720x1440   74.998973 Hz  43:36   112.948 kHz    219.120000 MHz (800 mm x 345 mm)
                 Hfront   72 Hsync  48 Hback  100 Hpol P
                 Vfront   38 Vsync   4 Vback   24 Vpol N
Checksum: 0x05  Unused space in Extension Block: 1 byte

----------------

Warnings:

Block 0, Base EDID:
  Detailed Timing Descriptor #1: Image size is 800x345 mm, but based on the picture AR it should be 800x334 mm.
  Detailed Timing Descriptor #2: Image size is 800x345 mm, but based on the picture AR it should be 800x334 mm.
Block 1, CTA-861 Extension Block:
  Video Data Block: VIC 16 and the first DTD are not identical. Is this intended?
  Video Capability Data Block: S_PT is equal to S_IT and S_CE, so should be set to 0 instead.
  Colorimetry Data Block: Set the sRGB colorimetry bit to avoid interop issues.
  YCbCr 4:2:0 Capability Map Data Block: Some YCbCr 4:2:0 timings are invalid for HDMI 2.1 (which requires an RGB timings pixel rate >= 590 MHz).
  Detailed Timing Descriptor #3: Image size is 800x345 mm, but based on the picture AR it should be 800x334 mm.
  Detailed Timing Descriptor #4: Image size is 800x345 mm, but based on the picture AR it should be 613x345 mm.
  Detailed Timing Descriptor #5: Image size is 800x345 mm, but based on the picture AR it should be 412x345 mm.
EDID:
  Base EDID: Some timings are out of range of the Monitor Ranges:
    Vertical Freq: 29.968 - 75.062 Hz (Monitor: 48.000 - 76.000 Hz)

Failures:

Block 1, CTA-861 Extension Block:
  Vendor-Specific Data Block (HDMI Forum), OUI C4-5D-D8: HDMI Forum VSDB did not immediately follow the HDMI VSDB.
EDID:
  Extension Block 2 started with EDID header, ignoring Extension Blocks >= 2.

EDID conformity: FAIL
