edid-decode (hex):

00 ff ff ff ff ff ff 00 06 af 01 0c 01 01 01 01
01 0f 01 03 80 1b 11 78 0a a5 50 93 56 4f 8b 28
21 50 54 00 00 00 01 01 01 01 01 01 01 01 01 01
01 01 01 01 01 01 ea 1a 00 80 50 20 10 30 15 20
44 00 05 a3 10 00 00 18 00 00 00 01 00 06 10 20
00 00 00 00 00 00 00 00 0a 20 00 00 00 fe 00 42
31 32 31 45 57 30 31 00 56 31 0a 20 00 00 00 fc
00 43 6f 6c 6f 72 20 4c 43 44 0a 20 20 20 00 91

----------------

Block 0, Base EDID:
  EDID Structure Version & Revision: 1.3
  Vendor & Product Identification:
    Manufacturer: AUO
    Model: 3073
    Serial Number: ...
    Made in: week 1 of 2005
  Basic Display Parameters & Features:
    Digital display
    Maximum image size: 27 cm x 17 cm
    Gamma: 2.20
    RGB color display
    First detailed timing is the preferred timing
  Color Characteristics:
    Red  : 0.5761, 0.3378
    Green: 0.3095, 0.5439
    Blue : 0.1572, 0.1298
    White: 0.3125, 0.3281
  Established Timings I & II: none
  Standard Timings: none
  Detailed Timing Descriptors:
    DTD 1:  1280x800    59.968945 Hz  16:10    48.935 kHz     68.900000 MHz (261 mm x 163 mm)
                 Hfront   21 Hsync  32 Hback   75 Hpol N
                 Vfront    4 Vsync   4 Vback    8 Vpol N
    Manufacturer-Specified Display Descriptor (0x01): 00 01 00 06 10 20 00 00 00 00 00 00 00 00 0a 20 '..... ......... '
    Alphanumeric Data String: 'B121EW01'
    Display Product Name: 'Color LCD'
Checksum: 0x91

----------------

Warnings:

Block 0, Base EDID:
  Vendor & Product Identification: The serial number is one of the known dummy values, it should probably be set to 0.

Failures:

Block 0, Base EDID:
  Alphanumeric Data String: NUL byte at position 8.
  Missing Display Range Limits Descriptor.

EDID conformity: FAIL
