edid-decode (hex):

00 ff ff ff ff ff ff 00 06 b3 51 27 01 01 01 01
15 21 01 04 b5 3c 22 78 3b 3c 25 ac 52 4b a2 24
0c 50 54 b7 ef 00 71 4f 81 80 81 40 81 c0 81 00
95 00 b3 00 d1 d9 02 3a 80 18 71 38 2d 40 58 2c
45 00 54 4f 21 00 00 1e 00 00 00 fd 0e 30 19 3c
3c 44 01 0a 20 20 20 20 20 20 00 00 00 fc 00 56
47 32 37 39 51 4d 31 41 0a 20 20 20 00 00 00 ff
00 52 35 4c 4d 51 53 31 32 35 36 38 34 0a 02 a6

02 03 3b f1 4d 40 90 1f 1e 0f 0e 04 13 12 03 02
01 3f 23 09 07 07 83 01 00 00 e2 00 6a e3 05 e0
01 e6 06 07 01 52 52 00 72 1a 00 00 03 01 30 f0
00 00 00 00 00 00 18 01 00 00 00 60 e4 80 b4 70
38 50 40 40 40 35 00 54 4f 21 00 00 1a 0b 83 80
a0 70 38 28 40 30 20 35 00 54 4f 21 00 00 1a 8b
6f 80 a0 70 38 40 40 30 20 35 00 54 4f 21 00 00
1a 00 00 00 00 00 00 00 00 00 00 00 00 00 00 ad

70 12 17 06 00 03 01 14 42 04 01 84 7f 07 9f 00
2f 80 3f 00 37 04 3f 00 02 00 04 00 5b 00 00 00
00 00 00 00 00 00 00 00 00 00 00 00 00 00 00 00
00 00 00 00 00 00 00 00 00 00 00 00 00 00 00 00
00 00 00 00 00 00 00 00 00 00 00 00 00 00 00 00
00 00 00 00 00 00 00 00 00 00 00 00 00 00 00 00
00 00 00 00 00 00 00 00 00 00 00 00 00 00 00 00
00 00 00 00 00 00 00 00 00 00 00 00 00 00 00 90

00 ff ff ff ff ff ff 00 06 b3 51 27 01 01 01 01
15 21 01 04 b5 3c 22 78 3b 3c 25 ac 52 4b a2 24
0c 50 54 b7 ef 00 71 4f 81 80 81 40 81 c0 81 00
95 00 b3 00 d1 d9 02 3a 80 18 71 38 2d 40 58 2c
45 00 54 4f 21 00 00 1e 00 00 00 fd 0e 30 19 3c
3c 44 01 0a 20 20 20 20 20 20 00 00 00 fc 00 56
47 32 37 39 51 4d 31 41 0a 20 20 20 00 00 00 ff
00 52 35 4c 4d 51 53 31 32 35 36 38 34 0a 02 a6

02 03 3b f1 4d 40 90 1f 1e 0f 0e 04 13 12 03 02
01 3f 23 09 07 07 83 01 00 00 e2 00 6a e3 05 e0
01 e6 06 07 01 52 52 00 72 1a 00 00 03 01 30 f0
00 00 00 00 00 00 18 01 00 00 00 60 e4 80 b4 70
38 50 40 40 40 35 00 54 4f 21 00 00 1a 0b 83 80
a0 70 38 28 40 30 20 35 00 54 4f 21 00 00 1a 8b
6f 80 a0 70 38 40 40 30 20 35 00 54 4f 21 00 00
1a 00 00 00 00 00 00 00 00 00 00 00 00 00 00 ad

70 12 17 06 00 03 01 14 42 04 01 84 7f 07 9f 00
2f 80 3f 00 37 04 3f 00 02 00 04 00 5b 00 00 00
00 00 00 00 00 00 00 00 00 00 00 00 00 00 00 00
00 00 00 00 00 00 00 00 00 00 00 00 00 00 00 00
00 00 00 00 00 00 00 00 00 00 00 00 00 00 00 00
00 00 00 00 00 00 00 00 00 00 00 00 00 00 00 00
00 00 00 00 00 00 00 00 00 00 00 00 00 00 00 00
00 00 00 00 00 00 00 00 00 00 00 00 00 00 00 90

----------------

Block 0, Base EDID:
  EDID Structure Version & Revision: 1.4
  Vendor & Product Identification:
    Manufacturer: AUS
    Model: 10065
    Serial Number: ...
    Made in: week 21 of 2023
  Basic Display Parameters & Features:
    Digital display
    Bits per primary color channel: 10
    DisplayPort interface
    Maximum image size: 60 cm x 34 cm
    Gamma: 2.20
    DPMS levels: Off
    Supported color formats: RGB 4:4:4, YCrCb 4:4:4, YCrCb 4:2:2
    First detailed timing includes the native pixel format and preferred refresh rate
    Display supports continuous frequencies
  Color Characteristics:
    Red  : 0.6718, 0.3232
    Green: 0.2958, 0.6328
    Blue : 0.1406, 0.0488
    White: 0.3134, 0.3291
  Established Timings I & II:
    IBM     :   720x400    70.081663 Hz   9:5     31.467 kHz     28.320000 MHz
    DMT 0x04:   640x480    59.940476 Hz   4:3     31.469 kHz     25.175000 MHz
    Apple   :   640x480    66.666667 Hz   4:3     35.000 kHz     30.240000 MHz
    DMT 0x06:   640x480    75.000000 Hz   4:3     37.500 kHz     31.500000 MHz
    DMT 0x08:   800x600    56.250000 Hz   4:3     35.156 kHz     36.000000 MHz
    DMT 0x09:   800x600    60.316541 Hz   4:3     37.879 kHz     40.000000 MHz
    DMT 0x0a:   800x600    72.187572 Hz   4:3     48.077 kHz     50.000000 MHz
    DMT 0x0b:   800x600    75.000000 Hz   4:3     46.875 kHz     49.500000 MHz
    Apple   :   832x624    74.551266 Hz   4:3     49.726 kHz     57.284000 MHz
    DMT 0x10:  1024x768    60.003840 Hz   4:3     48.363 kHz     65.000000 MHz
    DMT 0x11:  1024x768    70.069359 Hz   4:3     56.476 kHz     75.000000 MHz
    DMT 0x12:  1024x768    75.028582 Hz   4:3     60.023 kHz     78.750000 MHz
    DMT 0x24:  1280x1024   75.024675 Hz   5:4     79.976 kHz    135.000000 MHz
  Standard Timings:
    DMT 0x15:  1152x864    75.000000 Hz   4:3     67.500 kHz    108.000000 MHz
    DMT 0x23:  1280x1024   60.019740 Hz   5:4     63.981 kHz    108.000000 MHz
    DMT 0x20:  1280x960    60.000000 Hz   4:3     60.000 kHz    108.000000 MHz
    DMT 0x55:  1280x720    60.000000 Hz  16:9     45.000 kHz     74.250000 MHz
    DMT 0x1c:  1280x800    59.810326 Hz  16:10    49.702 kHz     83.500000 MHz
    DMT 0x2f:  1440x900    59.887445 Hz  16:10    55.935 kHz    106.500000 MHz
    DMT 0x3a:  1680x1050   59.954250 Hz  16:10    65.290 kHz    146.250000 MHz
    GTF     :  1920x1080   84.999879 Hz  16:9     96.390 kHz    252.927000 MHz
  Detailed Timing Descriptors:
    DTD 1:  1920x1080   60.000000 Hz  16:9     67.500 kHz    148.500000 MHz (596 mm x 335 mm)
                 Hfront   88 Hsync  44 Hback  148 Hpol P
                 Vfront    4 Vsync   5 Vback   36 Vpol P
    Display Range Limits:
      Monitor ranges (Range Limits Only): 48-280 Hz V, 315-315 kHz H, max dotclock 680 MHz
    Display Product Name: 'VG279QM1A'
    Display Product Serial Number: ...
  Extension blocks: 2
Checksum: 0xa6

----------------

Block 1, CTA-861 Extension Block:
  Revision: 3
  Underscans IT Video Formats by default
  Basic audio support
  Supports YCbCr 4:4:4
  Supports YCbCr 4:2:2
  Native DTDs: 1
  Video Data Block:
    VIC  64:  1920x1080  100.000000 Hz  16:9    112.500 kHz    297.000000 MHz
    VIC  16:  1920x1080   60.000000 Hz  16:9     67.500 kHz    148.500000 MHz (native)
    VIC  31:  1920x1080   50.000000 Hz  16:9     56.250 kHz    148.500000 MHz
    VIC  30:  1440x576    50.000000 Hz  16:9     31.250 kHz     54.000000 MHz
    VIC  15:  1440x480    59.940060 Hz  16:9     31.469 kHz     54.000000 MHz
    VIC  14:  1440x480    59.940060 Hz   4:3     31.469 kHz     54.000000 MHz
    VIC   4:  1280x720    60.000000 Hz  16:9     45.000 kHz     74.250000 MHz
    VIC  19:  1280x720    50.000000 Hz  16:9     37.500 kHz     74.250000 MHz
    VIC  18:   720x576    50.000000 Hz  16:9     31.250 kHz     27.000000 MHz
    VIC   3:   720x480    59.940060 Hz  16:9     31.469 kHz     27.000000 MHz
    VIC   2:   720x480    59.940060 Hz   4:3     31.469 kHz     27.000000 MHz
    VIC   1:   640x480    59.940476 Hz   4:3     31.469 kHz     25.175000 MHz
    VIC  63:  1920x1080  120.000000 Hz  16:9    135.000 kHz    297.000000 MHz
  Audio Data Block:
    Linear PCM:
      Max channels: 2
      Supported sample rates (kHz): 48 44.1 32
      Supported sample sizes (bits): 24 20 16
  Speaker Allocation Data Block:
    FL/FR - Front Left/Right
  Video Capability Data Block:
    YCbCr quantization: No Data
    RGB quantization: Selectable (via AVI Q)
    PT scan behavior: Always Underscanned
    IT scan behavior: Always Underscanned
    CE scan behavior: Always Underscanned
  Colorimetry Data Block:
    BT2020cYCC
    BT2020YCC
    BT2020RGB
    Gamut Boundary Description Metadata Profile P0
  HDR Static Metadata Data Block:
    Electro optical transfer functions:
      Traditional gamma - SDR luminance range
      Traditional gamma - HDR luminance range
      SMPTE ST2084
    Supported static metadata descriptors:
      Static metadata type 1
    Desired content max luminance: 82 (295.365 cd/m^2)
    Desired content max frame-average luminance: 82 (295.365 cd/m^2)
    Desired content min luminance: 0 (0.000 cd/m^2)
  Vendor-Specific Data Block (AMD), OUI 00-00-1A:
    Version: 3
    Flags 1: 0x01
      FreeSync Supported
    Minimum Refresh Rate: 48 Hz
    Maximum Refresh Rate: 280 Hz
    Flags 5: 0x00
  Detailed Timing Descriptors:
    DTD 2:  1920x1080  240.000000 Hz  16:9    278.400 kHz    584.640000 MHz (596 mm x 335 mm)
                 Hfront   64 Hsync  64 Hback   52 Hpol P
                 Vfront    3 Vsync   5 Vback   72 Vpol N
    DTD 3:  1920x1080  144.003262 Hz  16:9    161.284 kHz    335.470000 MHz (596 mm x 335 mm)
                 Hfront   48 Hsync  32 Hback   80 Hpol P
                 Vfront    3 Vsync   5 Vback   32 Vpol N
    DTD 4:  1920x1080  120.003194 Hz  16:9    137.284 kHz    285.550000 MHz (596 mm x 335 mm)
                 Hfront   48 Hsync  32 Hback   80 Hpol P
                 Vfront    3 Vsync   5 Vback   56 Vpol N
Checksum: 0xad  Unused space in Extension Block: 14 bytes

----------------

Block 2, DisplayID Extension Block:
  Version: 1.2
  Extension Count: 0
  Display Product Type: DIRECT DRIVE monitor
  Video Timing Modes Type 1 - Detailed Timings Data Block:
    DTD:  1920x1080  280.001849 Hz  16:9    320.322 kHz    666.270000 MHz (aspect 16:9, no 3D stereo, preferred)
               Hfront   48 Hsync  64 Hback   48 Hpol P
               Vfront    3 Vsync   5 Vback   56 Vpol N
  Checksum: 0x5b
Checksum: 0x90  Unused space in Extension Block: 98 bytes

----------------

Warnings:

Block 0, Base EDID:
  Vendor & Product Identification: The serial number is one of the known dummy values, it should probably be set to 0.
Block 1, CTA-861 Extension Block:
  Video Data Block: VIC 64 and the first DTD are not identical. Is this intended?
  Video Capability Data Block: Set Selectable YCbCr Quantization to avoid interop issues.
  Video Capability Data Block: S_PT is equal to S_IT and S_CE, so should be set to 0 instead.
  Colorimetry Data Block: Set the sRGB colorimetry bit to avoid interop issues.
  Display Product Serial Number is set, so the Serial Number in the Base EDID should be 0.
EDID:
  Base EDID: Some timings are out of range of the Monitor Ranges:
    Horizontal Freq: 31.250 - 320.322 kHz (Monitor: 315.000 - 315.000 kHz)

Failures:

EDID:
  Extension Block 3 started with EDID header, ignoring Extension Blocks >= 3.
  DisplayID: Missing DisplayID Display Parameters Data Block.

EDID conformity: FAIL
