edid-decode (hex):

00 ff ff ff ff ff ff 00 10 ac 05 a0 55 45 53 31
0e 0d 01 04 a5 1f 17 78 e6 ca f6 a3 57 47 9e 23
11 4f 54 a5 4a 00 01 01 01 01 01 01 01 01 01 01
01 01 01 01 01 01 64 19 00 40 41 00 26 30 18 88
36 00 30 e4 10 00 00 18 00 00 00 ff 00 38 57 32
33 34 33 34 34 31 53 45 55 20 00 00 00 fc 00 44
45 4c 4c 20 45 31 35 31 46 50 62 0a 00 00 00 fd
00 38 4c 1f 3c 08 00 0a 20 20 20 20 20 20 00 8a

00 ff ff ff ff ff ff 00 10 ac 05 a0 55 45 53 31
0e 0d 01 04 a5 1f 17 78 e6 ca f6 a3 57 47 9e 23
11 4f 54 a5 4a 00 01 01 01 01 01 01 01 01 01 01
01 01 01 01 01 01 64 19 00 40 41 00 26 30 18 88
36 00 30 e4 10 00 00 18 00 00 00 ff 00 38 57 32
33 34 33 34 34 31 53 45 55 20 00 00 00 fc 00 44
45 4c 4c 20 45 31 35 31 46 50 62 0a 00 00 00 fd
00 38 4c 1f 3c 08 00 0a 20 20 20 20 20 20 00 8a

----------------

Block 0, Base EDID:
  EDID Structure Version & Revision: 1.4
  Vendor & Product Identification:
    Manufacturer: DEL
    Model: 40965
    Serial Number: ...
    Made in: week 14 of 2003
  Basic Display Parameters & Features:
    Digital display
    Bits per primary color channel: 8
    DisplayPort interface
    Maximum image size: 31 cm x 23 cm
    Gamma: 2.20
    DPMS levels: Standby Suspend Off
    Supported color formats: RGB 4:4:4
    Default (sRGB) color space is primary color space
    First detailed timing includes the native pixel format and preferred refresh rate
  Color Characteristics:
    Red  : 0.6396, 0.3398
    Green: 0.2792, 0.6191
    Blue : 0.1396, 0.0693
    White: 0.3095, 0.3300
  Established Timings I & II:
    IBM     :   720x400    70.081663 Hz   9:5     31.467 kHz     28.320000 MHz
    DMT 0x04:   640x480    59.940476 Hz   4:3     31.469 kHz     25.175000 MHz
    DMT 0x06:   640x480    75.000000 Hz   4:3     37.500 kHz     31.500000 MHz
    DMT 0x09:   800x600    60.316541 Hz   4:3     37.879 kHz     40.000000 MHz
    DMT 0x0b:   800x600    75.000000 Hz   4:3     46.875 kHz     49.500000 MHz
    DMT 0x10:  1024x768    60.003840 Hz   4:3     48.363 kHz     65.000000 MHz
    DMT 0x12:  1024x768    75.028582 Hz   4:3     60.023 kHz     78.750000 MHz
  Standard Timings: none
  Detailed Timing Descriptors:
    DTD 1:  1024x768    60.003840 Hz   4:3     48.363 kHz     65.000000 MHz (304 mm x 228 mm)
                 Hfront   24 Hsync 136 Hback  160 Hpol N
                 Vfront    3 Vsync   6 Vback   29 Vpol N
    Display Product Serial Number: ...
    Display Product Name: 'DELL E151FPb'
    Display Range Limits:
      Monitor ranges (GTF): 56-76 Hz V, 31-60 kHz H, max dotclock 80 MHz
Checksum: 0x8a

----------------

Warnings:

Block 0, Base EDID:
  Display Range Limits: GTF support is deprecated in EDID 1.4.

Failures:

Block 0, Base EDID:
  Display Product Serial Number: ...
  Basic Display Parameters & Features: sRGB is signaled, but the chromaticities do not match.
  Display Range Limits: GTF is supported, but the display does not support continuous frequencies.
EDID:
  Extension Block 1 started with EDID header, ignoring Extension Blocks >= 1.

EDID conformity: FAIL
