edid-decode (hex):

00 ff ff ff ff ff ff 00 05 e3 16 17 ac 65 00 00
10 12 01 03 80 22 1b 78 e8 0e 80 a7 53 4c 98 24
14 50 54 bf e0 00 81 c0 01 01 01 01 01 01 01 01
01 01 01 01 01 01 1a 1d 00 80 51 d0 1c 20 40 80
35 00 54 0e 11 00 00 1c 00 00 00 ff 00 44 33 32
38 34 49 41 30 32 36 30 32 38 00 00 00 fd 00 32
4b 1f 3a 08 00 0a 20 20 20 20 20 20 00 00 00 fc
00 37 31 36 53 77 0a 20 20 20 20 20 20 20 01 0b

02 03 1b 61 43 90 84 02 23 09 07 07 83 01 00 00
67 03 0c 00 20 00 80 28 e2 00 0f 8c 0a d0 8a 20
e0 2d 10 10 3e 96 00 a0 5a 00 00 00 00 00 00 00
00 00 00 00 00 00 00 00 00 00 00 00 00 00 00 00
00 00 00 00 00 00 00 00 00 00 00 00 00 00 00 00
00 00 00 00 00 00 00 00 00 00 00 00 00 00 00 00
00 00 00 00 00 00 00 00 00 00 00 00 00 00 00 00
00 00 00 00 00 00 00 00 00 00 00 00 00 00 00 2e

----------------

Block 0, Base EDID:
  EDID Structure Version & Revision: 1.3
  Vendor & Product Identification:
    Manufacturer: AOC
    Model: 5910
    Serial Number: ...
    Made in: week 16 of 2008
  Basic Display Parameters & Features:
    Digital display
    Maximum image size: 34 cm x 27 cm
    Gamma: 2.20
    DPMS levels: Standby Suspend Off
    RGB color display
  Color Characteristics:
    Red  : 0.6523, 0.3242
    Green: 0.2998, 0.5957
    Blue : 0.1425, 0.0781
    White: 0.3125, 0.3281
  Established Timings I & II:
    IBM     :   720x400    70.081663 Hz   9:5     31.467 kHz     28.320000 MHz
    DMT 0x04:   640x480    59.940476 Hz   4:3     31.469 kHz     25.175000 MHz
    Apple   :   640x480    66.666667 Hz   4:3     35.000 kHz     30.240000 MHz
    DMT 0x05:   640x480    72.808802 Hz   4:3     37.861 kHz     31.500000 MHz
    DMT 0x06:   640x480    75.000000 Hz   4:3     37.500 kHz     31.500000 MHz
    DMT 0x08:   800x600    56.250000 Hz   4:3     35.156 kHz     36.000000 MHz
    DMT 0x09:   800x600    60.316541 Hz   4:3     37.879 kHz     40.000000 MHz
    DMT 0x0a:   800x600    72.187572 Hz   4:3     48.077 kHz     50.000000 MHz
    DMT 0x0b:   800x600    75.000000 Hz   4:3     46.875 kHz     49.500000 MHz
    Apple   :   832x624    74.551266 Hz   4:3     49.726 kHz     57.284000 MHz
  Standard Timings:
    DMT 0x55:  1280x720    60.000000 Hz  16:9     45.000 kHz     74.250000 MHz
  Detailed Timing Descriptors:
    DTD 1:  1280x720    59.855126 Hz  16:9     44.772 kHz     74.500000 MHz (340 mm x 270 mm)
                 Hfront   64 Hsync 128 Hback  192 Hpol N
                 Vfront    3 Vsync   5 Vback   20 Vpol P
    Display Product Serial Number: ...
    Display Range Limits:
      Monitor ranges (GTF): 50-75 Hz V, 31-58 kHz H, max dotclock 80 MHz
    Display Product Name: '716Sw'
  Extension blocks: 1
Checksum: 0x0b

----------------

Block 1, CTA-861 Extension Block:
  Revision: 3
  Basic audio support
  Supports YCbCr 4:4:4
  Native DTDs: 1
  Video Data Block:
    VIC  16:  1920x1080   60.000000 Hz  16:9     67.500 kHz    148.500000 MHz (native)
    VIC   4:  1280x720    60.000000 Hz  16:9     45.000 kHz     74.250000 MHz (native)
    VIC   2:   720x480    59.940060 Hz   4:3     31.469 kHz     27.000000 MHz
  Audio Data Block:
    Linear PCM:
      Max channels: 2
      Supported sample rates (kHz): 48 44.1 32
      Supported sample sizes (bits): 24 20 16
  Speaker Allocation Data Block:
    FL/FR - Front Left/Right
  Vendor-Specific Data Block (HDMI), OUI 00-0C-03:
    Source physical address: 2.0.0.0
    Supports_AI
    Maximum TMDS clock: 200 MHz
  Video Capability Data Block:
    YCbCr quantization: No Data
    RGB quantization: No Data
    PT scan behavior: No Data
    IT scan behavior: Supports both over- and underscan
    CE scan behavior: Supports both over- and underscan
  Detailed Timing Descriptors:
    DTD 2:   720x480    59.940060 Hz   3:2     31.469 kHz     27.000000 MHz (analog composite, sync-on-green, 160 mm x 90 mm)
                 Hfront   16 Hsync  62 Hback   60 Hpol N
                 Vfront    9 Vsync   6 Vback   30 Vpol N
Checksum: 0x2e  Unused space in Extension Block: 82 bytes

----------------

Warnings:

Block 0, Base EDID:
  Detailed Timing Descriptor #1: Image size is 340x270 mm, but based on the picture AR it should be 340x191 mm.
Block 1, CTA-861 Extension Block:
  IT Video Formats are overscanned by default, but normally this should be underscanned.
  Video Data Block: VIC 16 and the first DTD are not identical. Is this intended?
  Video Capability Data Block: Set Selectable YCbCr Quantization to avoid interop issues.
  Detailed Timing Descriptor #2: Dubious image size (160x90 mm is smaller than 100x100 mm).
  Display Product Serial Number is set, so the Serial Number in the Base EDID should be 0.
  Add a Colorimetry Data Block with the sRGB colorimetry bit set to avoid interop issues.
EDID:
  Base EDID: Some timings are out of range of the Monitor Ranges:
    Horizontal Freq: 31.466 - 67.500 kHz (Monitor: 31.000 - 58.000 kHz)
    Maximum Clock: 148.500 MHz (Monitor: 80.000 MHz)

Failures:

Block 0, Base EDID:
  Basic Display Parameters & Features: EDID 1.3 requires that the first detailed timing is the preferred timing.
Block 1, CTA-861 Extension Block:
  Video Capability Data Block: Set Selectable RGB Quantization to avoid interop issues.
  Detailed Timing Descriptor #2: Mismatch of image size 160x90 mm vs display size 340x270 mm.
EDID:
  CTA-861: Native progressive timings are a mix of several resolutions.

EDID conformity: FAIL
