edid-decode (hex):

00 ff ff ff ff ff ff 00 10 ac 8d a1 4c 55 41 30
2a 1e 01 03 80 50 21 78 ea 5d 15 ae 4f 44 ab 27
0e 50 54 a5 4b 00 71 4f 81 00 81 80 a9 40 d1 c0
01 01 01 01 01 01 e7 7c 70 a0 d0 a0 29 50 30 20
3a 00 20 4f 31 00 00 1a 00 00 00 ff 00 34 34 47
4c 36 35 33 0a 20 20 20 20 20 00 00 00 fc 00 44
45 4c 4c 20 55 33 34 32 31 57 45 0a 00 00 00 fd
00 30 55 1e 59 20 00 0a 20 20 20 20 20 20 01 ba

02 03 2d f1 50 90 05 04 03 02 07 16 01 14 1f 12
13 45 4b 4c 5a 23 09 07 07 83 01 00 00 67 03 0c
00 10 00 38 44 67 d8 5d c4 01 78 80 01 9f 3d 70
a0 d0 a0 15 50 50 20 8a 00 20 4f 31 00 00 1a 56
5e 00 a0 a0 a0 29 50 30 20 35 00 20 4f 31 00 00
1e 58 4d 00 b8 a1 38 14 40 94 2c b5 00 20 4f 31
00 00 1e 02 3a 80 18 71 38 2d 40 58 2c 45 00 20
4f 31 00 00 1e 00 00 00 00 00 00 00 00 00 00 36

00 ff ff ff ff ff ff 00 10 ac 8d a1 4c 55 41 30
2a 1e 01 03 80 50 21 78 ea 5d 15 ae 4f 44 ab 27
0e 50 54 a5 4b 00 71 4f 81 00 81 80 a9 40 d1 c0
01 01 01 01 01 01 e7 7c 70 a0 d0 a0 29 50 30 20
3a 00 20 4f 31 00 00 1a 00 00 00 ff 00 34 34 47
4c 36 35 33 0a 20 20 20 20 20 00 00 00 fc 00 44
45 4c 4c 20 55 33 34 32 31 57 45 0a 00 00 00 fd
00 30 55 1e 59 20 00 0a 20 20 20 20 20 20 01 ba

02 03 2d f1 50 90 05 04 03 02 07 16 01 14 1f 12
13 45 4b 4c 5a 23 09 07 07 83 01 00 00 67 03 0c
00 10 00 38 44 67 d8 5d c4 01 78 80 01 9f 3d 70
a0 d0 a0 15 50 50 20 8a 00 20 4f 31 00 00 1a 56
5e 00 a0 a0 a0 29 50 30 20 35 00 20 4f 31 00 00
1e 58 4d 00 b8 a1 38 14 40 94 2c b5 00 20 4f 31
00 00 1e 02 3a 80 18 71 38 2d 40 58 2c 45 00 20
4f 31 00 00 1e 00 00 00 00 00 00 00 00 00 00 36

----------------

Block 0, Base EDID:
  EDID Structure Version & Revision: 1.3
  Vendor & Product Identification:
    Manufacturer: DEL
    Model: 41357
    Serial Number: ...
    Made in: week 42 of 2020
  Basic Display Parameters & Features:
    Digital display
    Maximum image size: 80 cm x 33 cm
    Gamma: 2.20
    DPMS levels: Standby Suspend Off
    RGB color display
    First detailed timing is the preferred timing
  Color Characteristics:
    Red  : 0.6806, 0.3095
    Green: 0.2685, 0.6689
    Blue : 0.1523, 0.0556
    White: 0.3134, 0.3291
  Established Timings I & II:
    IBM     :   720x400    70.081663 Hz   9:5     31.467 kHz     28.320000 MHz
    DMT 0x04:   640x480    59.940476 Hz   4:3     31.469 kHz     25.175000 MHz
    DMT 0x06:   640x480    75.000000 Hz   4:3     37.500 kHz     31.500000 MHz
    DMT 0x09:   800x600    60.316541 Hz   4:3     37.879 kHz     40.000000 MHz
    DMT 0x0b:   800x600    75.000000 Hz   4:3     46.875 kHz     49.500000 MHz
    DMT 0x10:  1024x768    60.003840 Hz   4:3     48.363 kHz     65.000000 MHz
    DMT 0x12:  1024x768    75.028582 Hz   4:3     60.023 kHz     78.750000 MHz
    DMT 0x24:  1280x1024   75.024675 Hz   5:4     79.976 kHz    135.000000 MHz
  Standard Timings:
    DMT 0x15:  1152x864    75.000000 Hz   4:3     67.500 kHz    108.000000 MHz
    DMT 0x1c:  1280x800    59.810326 Hz  16:10    49.702 kHz     83.500000 MHz
    DMT 0x23:  1280x1024   60.019740 Hz   5:4     63.981 kHz    108.000000 MHz
    DMT 0x33:  1600x1200   60.000000 Hz   4:3     75.000 kHz    162.000000 MHz
    DMT 0x52:  1920x1080   60.000000 Hz  16:9     67.500 kHz    148.500000 MHz
  Detailed Timing Descriptors:
    DTD 1:  3440x1440   59.972616 Hz  43:18    88.819 kHz    319.750000 MHz (800 mm x 335 mm)
                 Hfront   48 Hsync  32 Hback   80 Hpol P
                 Vfront    3 Vsync  10 Vback   28 Vpol N
    Display Product Serial Number: ...
    Display Product Name: 'DELL U3421WE'
    Display Range Limits:
      Monitor ranges (GTF): 48-85 Hz V, 30-89 kHz H, max dotclock 320 MHz
  Extension blocks: 1
Checksum: 0xba

----------------

Block 1, CTA-861 Extension Block:
  Revision: 3
  Underscans IT Video Formats by default
  Basic audio support
  Supports YCbCr 4:4:4
  Supports YCbCr 4:2:2
  Native detailed modes: 1
  Video Data Block:
    VIC  16:  1920x1080   60.000000 Hz  16:9     67.500 kHz    148.500000 MHz (native)
    VIC   5:  1920x1080i  60.000000 Hz  16:9     33.750 kHz     74.250000 MHz
    VIC   4:  1280x720    60.000000 Hz  16:9     45.000 kHz     74.250000 MHz
    VIC   3:   720x480    59.940060 Hz  16:9     31.469 kHz     27.000000 MHz
    VIC   2:   720x480    59.940060 Hz   4:3     31.469 kHz     27.000000 MHz
    VIC   7:  1440x480i   59.940060 Hz  16:9     15.734 kHz     27.000000 MHz
    VIC  22:  1440x576i   50.000000 Hz  16:9     15.625 kHz     27.000000 MHz
    VIC   1:   640x480    59.940476 Hz   4:3     31.469 kHz     25.175000 MHz
    VIC  20:  1920x1080i  50.000000 Hz  16:9     28.125 kHz     74.250000 MHz
    VIC  31:  1920x1080   50.000000 Hz  16:9     56.250 kHz    148.500000 MHz
    VIC  18:   720x576    50.000000 Hz  16:9     31.250 kHz     27.000000 MHz
    VIC  19:  1280x720    50.000000 Hz  16:9     37.500 kHz     74.250000 MHz
    VIC  69:  1280x720    60.000000 Hz  64:27    45.000 kHz     74.250000 MHz
    VIC  75:  1920x1080   50.000000 Hz  64:27    56.250 kHz    148.500000 MHz
    VIC  76:  1920x1080   60.000000 Hz  64:27    67.500 kHz    148.500000 MHz
    VIC  90:  2560x1080   60.000000 Hz  64:27    66.000 kHz    198.000000 MHz
  Audio Data Block:
    Linear PCM:
      Max channels: 2
      Supported sample rates (kHz): 48 44.1 32
      Supported sample sizes (bits): 24 20 16
  Speaker Allocation Data Block:
    FL/FR - Front Left/Right
  Vendor-Specific Data Block (HDMI), OUI 00-0C-03:
    Source physical address: 1.0.0.0
    DC_36bit
    DC_30bit
    DC_Y444
    Maximum TMDS clock: 340 MHz
  Vendor-Specific Data Block (HDMI Forum), OUI C4-5D-D8:
    Version: 1
    Maximum TMDS Character Rate: 600 MHz
    SCDC Present
    Supports 10-bits/component Deep Color 4:2:0 Pixel Encoding
  Detailed Timing Descriptors:
    DTD 2:  3440x1440   29.992775 Hz  43:18    43.819 kHz    157.750000 MHz (800 mm x 335 mm)
                 Hfront   80 Hsync  32 Hback   48 Hpol P
                 Vfront    8 Vsync  10 Vback    3 Vpol N
    DTD 3:  2560x1440   59.950550 Hz  16:9     88.787 kHz    241.500000 MHz (800 mm x 335 mm)
                 Hfront   48 Hsync  32 Hback   80 Hpol P
                 Vfront    3 Vsync   5 Vback   33 Vpol P
    DTD 4:  2560x1080   60.000000 Hz  64:27    66.000 kHz    198.000000 MHz (800 mm x 335 mm)
                 Hfront  148 Hsync  44 Hback  248 Hpol P
                 Vfront   11 Vsync   5 Vback    4 Vpol P
    DTD 5:  1920x1080   60.000000 Hz  16:9     67.500 kHz    148.500000 MHz (800 mm x 335 mm)
                 Hfront   88 Hsync  44 Hback  148 Hpol P
                 Vfront    4 Vsync   5 Vback   36 Vpol P
Checksum: 0x36  Unused space in Extension Block: 10 bytes

----------------

Block 2, Unknown EDID Extension Block 0x00:
  00 ff ff ff ff ff ff 00 10 ac 8d a1 4c 55 41 30 '............LUA0'
  2a 1e 01 03 80 50 21 78 ea 5d 15 ae 4f 44 ab 27 '*....P!x.]..OD.''
  0e 50 54 a5 4b 00 71 4f 81 00 81 80 a9 40 d1 c0 '.PT.K.qO.....@..'
  01 01 01 01 01 01 e7 7c 70 a0 d0 a0 29 50 30 20 '.......|p...)P0 '
  3a 00 20 4f 31 00 00 1a 00 00 00 ff 00 34 34 47 ':. O1........44G'
  4c 36 35 33 0a 20 20 20 20 20 00 00 00 fc 00 44 'L653.     .....D'
  45 4c 4c 20 55 33 34 32 31 57 45 0a 00 00 00 fd 'ELL U3421WE.....'
  00 30 55 1e 59 20 00 0a 20 20 20 20 20 20 01 ba '.0U.Y ..      ..'
Checksum: 0xba

----------------

Block 3, CTA-861 Extension Block:
  Revision: 3
  Underscans IT Video Formats by default
  Basic audio support
  Supports YCbCr 4:4:4
  Supports YCbCr 4:2:2
  Native detailed modes: 1
  Video Data Block:
    VIC  16:  1920x1080   60.000000 Hz  16:9     67.500 kHz    148.500000 MHz (native)
    VIC   5:  1920x1080i  60.000000 Hz  16:9     33.750 kHz     74.250000 MHz
    VIC   4:  1280x720    60.000000 Hz  16:9     45.000 kHz     74.250000 MHz
    VIC   3:   720x480    59.940060 Hz  16:9     31.469 kHz     27.000000 MHz
    VIC   2:   720x480    59.940060 Hz   4:3     31.469 kHz     27.000000 MHz
    VIC   7:  1440x480i   59.940060 Hz  16:9     15.734 kHz     27.000000 MHz
    VIC  22:  1440x576i   50.000000 Hz  16:9     15.625 kHz     27.000000 MHz
    VIC   1:   640x480    59.940476 Hz   4:3     31.469 kHz     25.175000 MHz
    VIC  20:  1920x1080i  50.000000 Hz  16:9     28.125 kHz     74.250000 MHz
    VIC  31:  1920x1080   50.000000 Hz  16:9     56.250 kHz    148.500000 MHz
    VIC  18:   720x576    50.000000 Hz  16:9     31.250 kHz     27.000000 MHz
    VIC  19:  1280x720    50.000000 Hz  16:9     37.500 kHz     74.250000 MHz
    VIC  69:  1280x720    60.000000 Hz  64:27    45.000 kHz     74.250000 MHz
    VIC  75:  1920x1080   50.000000 Hz  64:27    56.250 kHz    148.500000 MHz
    VIC  76:  1920x1080   60.000000 Hz  64:27    67.500 kHz    148.500000 MHz
    VIC  90:  2560x1080   60.000000 Hz  64:27    66.000 kHz    198.000000 MHz
  Audio Data Block:
    Linear PCM:
      Max channels: 2
      Supported sample rates (kHz): 48 44.1 32
      Supported sample sizes (bits): 24 20 16
  Speaker Allocation Data Block:
    FL/FR - Front Left/Right
  Vendor-Specific Data Block (HDMI), OUI 00-0C-03:
    Source physical address: 1.0.0.0
    DC_36bit
    DC_30bit
    DC_Y444
    Maximum TMDS clock: 340 MHz
  Vendor-Specific Data Block (HDMI Forum), OUI C4-5D-D8:
    Version: 1
    Maximum TMDS Character Rate: 600 MHz
    SCDC Present
    Supports 10-bits/component Deep Color 4:2:0 Pixel Encoding
  Detailed Timing Descriptors:
    DTD 6:  3440x1440   29.992775 Hz  43:18    43.819 kHz    157.750000 MHz (800 mm x 335 mm)
                 Hfront   80 Hsync  32 Hback   48 Hpol P
                 Vfront    8 Vsync  10 Vback    3 Vpol N
    DTD 7:  2560x1440   59.950550 Hz  16:9     88.787 kHz    241.500000 MHz (800 mm x 335 mm)
                 Hfront   48 Hsync  32 Hback   80 Hpol P
                 Vfront    3 Vsync   5 Vback   33 Vpol P
    DTD 8:  2560x1080   60.000000 Hz  64:27    66.000 kHz    198.000000 MHz (800 mm x 335 mm)
                 Hfront  148 Hsync  44 Hback  248 Hpol P
                 Vfront   11 Vsync   5 Vback    4 Vpol P
    DTD 9:  1920x1080   60.000000 Hz  16:9     67.500 kHz    148.500000 MHz (800 mm x 335 mm)
                 Hfront   88 Hsync  44 Hback  148 Hpol P
                 Vfront    4 Vsync   5 Vback   36 Vpol P
Checksum: 0x36  Unused space in Extension Block: 10 bytes

----------------

Warnings:

Block 1, CTA-861 Extension Block:
  Video Data Block: VIC 16 and the first DTD are not identical. Is this intended?
  Detailed Timing Descriptor #3: Image size is 800x335 mm, but based on the picture AR it should be 800x450 mm.
  Detailed Timing Descriptor #4: DTD is similar but not identical to VIC 90.
  Detailed Timing Descriptor #5: Image size is 800x335 mm, but based on the picture AR it should be 800x450 mm.
  Display Product Serial Number is set, so the Serial Number in the Base EDID should be 0.
  Add a Colorimetry Data Block with the sRGB colorimetry bit set to avoid interop issues.
Block 3, CTA-861 Extension Block:
  Detailed Timing Descriptor #7: Image size is 800x335 mm, but based on the picture AR it should be 800x450 mm.
  Detailed Timing Descriptor #8: DTD is similar but not identical to VIC 90.
  Detailed Timing Descriptor #9: Image size is 800x335 mm, but based on the picture AR it should be 800x450 mm.
EDID:
  Base EDID: Some timings are out of range of the Monitor Ranges:
    Vertical Freq: 29.993 - 75.029 Hz (Monitor: 48.000 - 85.000 Hz)
    Horizontal Freq: 15.625 - 88.819 kHz (Monitor: 30.000 - 89.000 kHz)

Failures:

Block 1, CTA-861 Extension Block:
  Missing VCDB, needed for Set Selectable RGB Quantization to avoid interop issues.
Block 2, Base EDID:
  Unknown Extension Block.
Block 3, CTA-861 Extension Block:
  Video Data Block: Duplicate VIC 16.
  Video Data Block: Duplicate VIC 5.
  Video Data Block: Duplicate VIC 4.
  Video Data Block: Duplicate VIC 3.
  Video Data Block: Duplicate VIC 2.
  Video Data Block: Duplicate VIC 7.
  Video Data Block: Duplicate VIC 22.
  Video Data Block: Duplicate VIC 1.
  Video Data Block: Duplicate VIC 20.
  Video Data Block: Duplicate VIC 31.
  Video Data Block: Duplicate VIC 18.
  Video Data Block: Duplicate VIC 19.
  Video Data Block: Duplicate VIC 69.
  Video Data Block: Duplicate VIC 75.
  Video Data Block: Duplicate VIC 76.
  Video Data Block: Duplicate VIC 90.
  Speaker Allocation Data Block: Only one instance of this Data Block is allowed.
  Vendor-Specific Data Block (HDMI Forum), OUI C4-5D-D8: Duplicate HDMI Forum VSDB/SCDB.
EDID:
  Base EDID: EDID specified 1 extension block(s), but found 3 extension block(s).
  Base EDID: EDID 1.3 requires a Block Map Extension in Block 1 if there are more than 2 blocks in the EDID.
  CTA-861: Native progressive timings are a mix of several resolutions.

EDID conformity: FAIL
