edid-decode (hex):

00 ff ff ff ff ff ff 00 09 e5 85 0d 00 00 00 00
04 23 01 04 b5 22 16 78 07 7c d5 a7 53 4c 9c 24
0f 50 54 00 00 00 01 01 01 01 01 01 01 01 01 01
01 01 01 01 01 01 34 70 00 a0 a0 40 a0 60 30 20
66 00 59 d7 10 00 00 1a 00 00 00 fd 0c 30 b4 3e
3e 56 01 0a 20 20 20 20 20 20 00 00 00 fe 00 42
4f 45 20 43 59 0a 20 20 20 20 20 20 00 00 00 fc
00 4c 65 63 6f 6f 00 00 00 00 00 00 32 0a 02 90

02 03 0f 00 e3 05 80 00 e6 06 05 01 6a 6a 48 00
00 00 00 00 00 00 00 00 00 00 00 00 00 00 00 00
00 00 00 00 00 00 00 00 00 00 00 00 00 00 00 00
00 00 00 00 00 00 00 00 00 00 00 00 00 00 00 00
00 00 00 00 00 00 00 00 00 00 00 00 00 00 00 00
00 00 00 00 00 00 00 00 00 00 00 00 00 00 00 00
00 00 00 00 00 00 00 00 00 00 00 00 00 00 00 00
00 00 00 00 00 00 00 00 00 00 00 00 00 00 00 76

70 20 79 02 00 22 00 14 ff 25 0d 85 ff 09 9f 00
2f 00 1f 00 3f 06 9f 00 05 00 05 00 81 00 15 74
1a 00 00 03 53 30 b4 00 20 6b 49 6b 49 b4 00 00
00 00 ad 00 00 00 00 00 00 00 00 00 00 00 00 00
00 00 00 00 00 00 00 00 00 00 00 00 00 00 00 00
00 00 00 00 00 00 00 00 00 00 00 00 00 00 00 00
00 00 00 00 00 00 00 00 00 00 00 00 00 00 00 00
00 00 00 00 00 00 00 00 00 00 00 00 00 00 4f 90

00 ff ff ff ff ff ff 00 09 e5 85 0d 00 00 00 00
04 23 01 04 b5 22 16 78 07 7c d5 a7 53 4c 9c 24
0f 50 54 00 00 00 01 01 01 01 01 01 01 01 01 01
01 01 01 01 01 01 34 70 00 a0 a0 40 a0 60 30 20
66 00 59 d7 10 00 00 1a 00 00 00 fd 0c 30 b4 3e
3e 56 01 0a 20 20 20 20 20 20 00 00 00 fe 00 42
4f 45 20 43 59 0a 20 20 20 20 20 20 00 00 00 fc
00 4c 65 63 6f 6f 00 00 00 00 00 00 32 0a 02 90

02 03 0f 00 e3 05 80 00 e6 06 05 01 6a 6a 48 00
00 00 00 00 00 00 00 00 00 00 00 00 00 00 00 00
00 00 00 00 00 00 00 00 00 00 00 00 00 00 00 00
00 00 00 00 00 00 00 00 00 00 00 00 00 00 00 00
00 00 00 00 00 00 00 00 00 00 00 00 00 00 00 00
00 00 00 00 00 00 00 00 00 00 00 00 00 00 00 00
00 00 00 00 00 00 00 00 00 00 00 00 00 00 00 00
00 00 00 00 00 00 00 00 00 00 00 00 00 00 00 76

70 20 79 02 00 22 00 14 ff 25 0d 85 ff 09 9f 00
2f 00 1f 00 3f 06 9f 00 05 00 05 00 81 00 15 74
1a 00 00 03 53 30 b4 00 20 6b 49 6b 49 b4 00 00
00 00 ad 00 00 00 00 00 00 00 00 00 00 00 00 00
00 00 00 00 00 00 00 00 00 00 00 00 00 00 00 00
00 00 00 00 00 00 00 00 00 00 00 00 00 00 00 00
00 00 00 00 00 00 00 00 00 00 00 00 00 00 00 00
00 00 00 00 00 00 00 00 00 00 00 00 00 00 4f 90

----------------

Block 0, Base EDID:
  EDID Structure Version & Revision: 1.4
  Vendor & Product Identification:
    Manufacturer: BOE
    Model: 3461
    Made in: week 4 of 2025
  Basic Display Parameters & Features:
    Digital display
    Bits per primary color channel: 10
    DisplayPort interface
    Maximum image size: 34 cm x 22 cm
    Gamma: 2.20
    Supported color formats: RGB 4:4:4
    Default (sRGB) color space is primary color space
    First detailed timing includes the native pixel format and preferred refresh rate
    Display supports continuous frequencies
  Color Characteristics:
    Red  : 0.6533, 0.3271
    Green: 0.2998, 0.6093
    Blue : 0.1435, 0.0595
    White: 0.3134, 0.3291
  Established Timings I & II: none
  Standard Timings: none
  Detailed Timing Descriptors:
    DTD 1:  2560x1600   60.001671 Hz  16:10   105.603 kHz    287.240000 MHz (345 mm x 215 mm)
                 Hfront   48 Hsync  32 Hback   80 Hpol P
                 Vfront    6 Vsync   6 Vback  148 Vpol N
    Display Range Limits:
      Monitor ranges (Range Limits Only): 48-180 Hz V, 317-317 kHz H, max dotclock 860 MHz
    Alphanumeric Data String: 'BOE CY'
    Display Product Name: 'Lecoo'
  Extension blocks: 2
Checksum: 0x90

----------------

Block 1, CTA-861 Extension Block:
  Revision: 3
  Native DTDs: 0
  Colorimetry Data Block:
    BT2020RGB
  HDR Static Metadata Data Block:
    Electro optical transfer functions:
      Traditional gamma - SDR luminance range
      SMPTE ST2084
    Supported static metadata descriptors:
      Static metadata type 1
    Desired content max luminance: 106 (496.743 cd/m^2)
    Desired content max frame-average luminance: 106 (496.743 cd/m^2)
    Desired content min luminance: 72 (0.396 cd/m^2)
Checksum: 0x76  Unused space in Extension Block: 112 bytes

----------------

Block 2, DisplayID Extension Block:
  Version: 2.0
  Extension Count: 0
  Display Product Primary Use Case: None of the listed primary use cases; generic display
  Video Timing Modes Type 7 - Detailed Timings Data Block:
    DTD:  2560x1600  180.000000 Hz  16:10   316.800 kHz    861.696000 MHz (aspect 16:10, no 3D stereo, preferred)
               Hfront   48 Hsync  32 Hback   80 Hpol N
               Vfront    6 Vsync   6 Vback  148 Vpol N
  CTA-861 DisplayID Data Block:
  Vendor-Specific Data Block (AMD), OUI 00-00-1A:
    Version: 3
    Feature Caps: 0x53
      FreeSync Panel Replay Supported
    Minimum Refresh Rate: 48 Hz
    Maximum Refresh Rate: 180 Hz
    Flags 1.x: 0x00
    Flags 2.x: 0x20
      ST 2084 (PQ) EOTF Supported
      Linear EOTF (Windows scRGB, 0.0 - 125.0) Supported
      BT.2020 Gamut Supported
      Display is Mini LED
    Maximum luminance: 107 (507.620 cd/m^2)
    Minimum luminance: 73 (0.416 cd/m^2)
  Checksum: 0x4f
Checksum: 0x90

----------------

Warnings:

Block 1, CTA-861 Extension Block:
  IT Video Formats are overscanned by default, but normally this should be underscanned.
EDID:
  Base EDID: Some timings are out of range of the Monitor Ranges:
    Horizontal Freq: 105.602 - 316.800 kHz (Monitor: 317.000 - 317.000 kHz)
    Maximum Clock: 861.696 MHz (Monitor: 860.000 MHz)

Failures:

Block 0, Base EDID:
  Basic Display Parameters & Features: sRGB is signaled, but the chromaticities do not match.
  Display Product Name: NUL byte at position 5.
Block 1, CTA-861 Extension Block:
  Required 640x480p60 timings are missing in the established timings and the SVD list (VIC 1).
  Missing VCDB, needed for Set Selectable RGB Quantization to avoid interop issues.
EDID:
  Extension Block 3 started with EDID header, ignoring Extension Blocks >= 3.
  DisplayID: Missing DisplayID Display Parameters Data Block.

EDID conformity: FAIL
