edid-decode (hex):

00 ff ff ff ff ff ff 00 32 0c 40 01 00 00 00 00
00 12 01 03 90 1e 13 78 0a d7 85 93 59 54 8c 29
22 50 54 00 00 00 01 01 01 01 01 01 01 01 01 01
01 01 01 01 01 01 b0 27 a0 80 51 84 1a 30 30 20
36 00 30 be 10 00 00 1a b0 27 a0 80 51 84 e7 31
30 20 aa 00 30 be 10 00 00 1a 00 00 00 fe 00 43
54 30 30 38 80 31 34 31 57 50 32 0a 00 00 00 00
00 00 00 00 00 00 00 00 00 02 01 0a 20 20 00 ea

----------------

Block 0, Base EDID:
  EDID Structure Version & Revision: 1.3
  Vendor & Product Identification:
    Manufacturer: LPL
    Model: 320
    Made in: 2008
  Basic Display Parameters & Features:
    Digital display
    Maximum image size: 30 cm x 19 cm
    Gamma: 2.20
    RGB color display
    First detailed timing is the preferred timing
  Color Characteristics:
    Red  : 0.5771, 0.3486
    Green: 0.3291, 0.5498
    Blue : 0.1621, 0.1328
    White: 0.3134, 0.3291
  Established Timings I & II: none
  Standard Timings: none
  Detailed Timing Descriptors:
    DTD 1:  1440x900    60.153082 Hz  16:10    55.702 kHz    101.600000 MHz (304 mm x 190 mm)
                 Hfront   48 Hsync  32 Hback  304 Hpol P
                 Vfront    3 Vsync   6 Vback   17 Vpol N
    DTD 2:  1440x900    40.159881 Hz  16:10    55.702 kHz    101.600000 MHz (304 mm x 190 mm)
                 Hfront   48 Hsync  32 Hback  304 Hpol P
                 Vfront   10 Vsync  10 Vback  467 Vpol N
    Alphanumeric Data String: 'CT008.141WP2'
    Manufacturer-Specified Display Descriptor (0x00): 00 00 00 00 00 00 00 00 00 00 00 02 01 0a 20 20 '..............  '
Checksum: 0xea

----------------

Warnings:

Block 0, Base EDID:
  Alphanumeric Data String: Non-ASCII character 0x80 at position 5, can cause problems.

Failures:

Block 0, Base EDID:
  Basic Display Parameters & Features: Digital Video Interface Standard set to reserved value 0x10.
  Missing Display Product Name.
  Missing Display Range Limits Descriptor.

EDID conformity: FAIL
