edid-decode (hex):

00 ff ff ff ff ff ff 00 09 e5 c0 06 00 00 00 00
01 1a 01 04 95 1c 10 78 0a f6 a0 99 59 51 94 2d
1f 50 54 00 00 00 01 01 01 01 01 01 01 01 01 01
01 01 01 01 01 01 c9 36 80 cd 70 38 14 40 30 20
36 00 18 a5 10 00 00 1a d4 2b 80 cd 70 38 14 40
64 64 44 05 18 a5 10 00 00 1a 00 00 00 fe 00 31
38 36 47 43 80 4e 56 31 32 4e 35 31 00 00 00 00
00 00 41 11 9e 00 10 00 00 0a 01 0a 20 20 00 d6

----------------

Block 0, Base EDID:
  EDID Structure Version & Revision: 1.4
  Vendor & Product Identification:
    Manufacturer: BOE
    Model: 1728
    Made in: week 1 of 2016
  Basic Display Parameters & Features:
    Digital display
    Bits per primary color channel: 6
    DisplayPort interface
    Maximum image size: 28 cm x 16 cm
    Gamma: 2.20
    Supported color formats: RGB 4:4:4, YCrCb 4:4:4
    First detailed timing includes the native pixel format and preferred refresh rate
  Color Characteristics:
    Red  : 0.6005, 0.3505
    Green: 0.3173, 0.5800
    Blue : 0.1777, 0.1230
    White: 0.3125, 0.3281
  Established Timings I & II: none
  Standard Timings: none
  Detailed Timing Descriptors:
    DTD 1:  1920x1080   60.000000 Hz  16:9     66.000 kHz    140.250000 MHz (280 mm x 165 mm)
                 Hfront   48 Hsync  32 Hback  125 Hpol P
                 Vfront    3 Vsync   6 Vback   11 Vpol N
    DTD 2:  1920x1080   48.000000 Hz  16:9     52.800 kHz    112.200000 MHz (280 mm x 165 mm)
                 Hfront  100 Hsync 100 Hback    5 Hpol P
                 Vfront   20 Vsync  20 Vback  -20 Vpol N
    Alphanumeric Data String: '186GC.NV12N51'
    Manufacturer-Specified Display Descriptor (0x00): 00 00 00 00 41 11 9e 00 10 00 00 0a 01 0a 20 20 '....A.........  '
Checksum: 0xd6

----------------

Warnings:

Block 0, Base EDID:
  Alphanumeric Data String: Non-ASCII character 0x80 at position 5, can cause problems.
  Missing Display Product Name.

Failures:

Block 0, Base EDID:
  Detailed Timing Descriptor #2: 0 or negative vertical back porch.

EDID conformity: FAIL
