edid-decode (hex):

00 ff ff ff ff ff ff 00 30 e4 6e 05 00 00 00 00
00 1b 01 04 95 22 13 78 03 cd e5 95 5b 55 8f 27
1d 50 54 00 00 00 01 01 01 01 01 01 01 01 01 01
01 01 01 01 01 01 24 36 80 a0 70 38 1f 40 30 20
35 00 58 c2 10 00 00 19 00 00 00 fd 00 28 3c 43
43 0e 01 0a 20 20 20 20 20 20 00 00 00 00 00 00
00 00 00 00 00 00 00 00 00 00 00 00 00 00 00 02
00 0c 44 ff 0a 3c 6e 12 15 24 6e 00 00 00 00 d5

----------------

Block 0, Base EDID:
  EDID Structure Version & Revision: 1.4
  Vendor & Product Identification:
    Manufacturer: LGD
    Model: 1390
    Made in: 2017
  Basic Display Parameters & Features:
    Digital display
    Bits per primary color channel: 6
    DisplayPort interface
    Maximum image size: 34 cm x 19 cm
    Gamma: 2.20
    Supported color formats: RGB 4:4:4
    First detailed timing includes the native pixel format and preferred refresh rate
    Display supports continuous frequencies
  Color Characteristics:
    Red  : 0.5849, 0.3554
    Green: 0.3349, 0.5595
    Blue : 0.1552, 0.1152
    White: 0.3134, 0.3291
  Established Timings I & II: none
  Standard Timings: none
  Detailed Timing Descriptors:
    DTD 1:  1920x1080   59.977152 Hz  16:9     66.635 kHz    138.600000 MHz (344 mm x 194 mm)
                 Hfront   48 Hsync  32 Hback   80 Hpol N
                 Vfront    3 Vsync   5 Vback   23 Vpol N
    Display Range Limits:
      Monitor ranges (Range Limits Only): 40-60 Hz V, 67-67 kHz H, max dotclock 140 MHz
    Empty Descriptor
    Manufacturer-Specified Display Descriptor (0x02): 00 02 00 0c 44 ff 0a 3c 6e 12 15 24 6e 00 00 00 '....D..<n..$n...'
Checksum: 0xd5

----------------

Warnings:

Block 0, Base EDID:
  Missing Display Product Name.

Failures:

Block 0, Base EDID:
  Empty Descriptor: Use Dummy Descriptor instead of all zeroes.

EDID conformity: FAIL
