edid-decode (hex):

00 ff ff ff ff ff ff 00 06 af 9d 16 00 00 00 00
00 1b 01 04 a5 26 15 78 02 59 d5 a3 56 52 9c 26
0c 50 54 00 00 00 01 01 01 01 01 01 01 01 01 01
01 01 01 01 01 01 7c 6f 80 a0 70 38 3e 40 30 20
35 00 7d d6 10 00 00 18 7c 6f 80 a0 70 38 b2 44
30 20 35 00 7d d6 10 00 00 18 00 00 00 fe 00 41
55 4f 0a 20 20 20 20 20 20 20 20 20 00 00 00 fe
00 42 31 37 33 48 41 4e 30 31 2e 36 20 0a 00 a1

00 ff ff ff ff ff ff 00 06 af 9d 16 00 00 00 00
00 1b 01 04 a5 26 15 78 02 59 d5 a3 56 52 9c 26
0c 50 54 00 00 00 01 01 01 01 01 01 01 01 01 01
01 01 01 01 01 01 7c 6f 80 a0 70 38 3e 40 30 20
35 00 7d d6 10 00 00 18 7c 6f 80 a0 70 38 b2 44
30 20 35 00 7d d6 10 00 00 18 00 00 00 fe 00 41
55 4f 0a 20 20 20 20 20 20 20 20 20 00 00 00 fe
00 42 31 37 33 48 41 4e 30 31 2e 36 20 0a 00 a1

----------------

Block 0, Base EDID:
  EDID Structure Version & Revision: 1.4
  Vendor & Product Identification:
    Manufacturer: AUO
    Model: 5789
    Made in: 2017
  Basic Display Parameters & Features:
    Digital display
    Bits per primary color channel: 8
    DisplayPort interface
    Maximum image size: 38 cm x 21 cm
    Gamma: 2.20
    Supported color formats: RGB 4:4:4
    First detailed timing includes the native pixel format and preferred refresh rate
  Color Characteristics:
    Red  : 0.6376, 0.3369
    Green: 0.3222, 0.6103
    Blue : 0.1513, 0.0478
    White: 0.3134, 0.3291
  Established Timings I & II: none
  Standard Timings: none
  Detailed Timing Descriptors:
    DTD 1:  1920x1080  120.150209 Hz  16:9    137.212 kHz    285.400000 MHz (381 mm x 214 mm)
                 Hfront   48 Hsync  32 Hback   80 Hpol N
                 Vfront    3 Vsync   5 Vback   54 Vpol N
    DTD 2:  1920x1080   60.127756 Hz  16:9    137.212 kHz    285.400000 MHz (381 mm x 214 mm)
                 Hfront   48 Hsync  32 Hback   80 Hpol N
                 Vfront    3 Vsync   5 Vback 1194 Vpol N
    Alphanumeric Data String: 'AUO'
    Alphanumeric Data String: 'B173HAN01.6 '
Checksum: 0xa1

----------------

Warnings:

Block 0, Base EDID:
  Missing Display Product Name.

Failures:

Block 0, Base EDID:
  Alphanumeric Data String: One or more trailing spaces before newline.
EDID:
  Extension Block 1 started with EDID header, ignoring Extension Blocks >= 1.

EDID conformity: FAIL
