edid-decode (hex):

00 ff ff ff ff ff ff 00 5a 63 38 a7 98 56 00 00
14 1f 01 04 b5 3c 22 78 3f 9f 00 ad 4f 44 ac 27
0d 50 54 bf ef 80 d1 c0 81 40 81 80 90 40 95 00
a9 40 b3 00 a9 c0 9e e0 00 78 a0 a0 32 50 10 40
35 00 56 50 21 00 00 1e 00 00 00 fd 00 30 92 f0
f0 3c 01 0a 20 20 20 20 20 20 00 00 00 fc 00 56
58 32 37 35 38 2d 53 45 52 49 45 53 00 00 00 ff
00 56 56 46 32 31 32 30 32 32 31 36 38 0a 01 28

02 03 24 f1 51 01 03 04 05 07 90 12 13 14 16 1f
20 21 22 3f 40 61 23 09 07 07 83 01 00 00 65 03
0c 00 10 00 f5 bd 00 a0 a0 a0 32 50 20 40 45 00
56 50 21 00 00 1e 02 3a 80 18 71 38 2d 40 30 20
36 00 56 50 21 00 00 1e fa 7e 80 88 70 38 12 40
18 20 35 00 56 50 21 00 00 1e 56 5e 00 a0 a0 a0
29 50 30 20 35 00 56 50 21 00 00 1e 00 00 00 00
00 00 00 00 00 00 00 00 00 00 00 00 00 00 00 c8

00 ff ff ff ff ff ff 00 5a 63 38 a7 98 56 00 00
14 1f 01 04 b5 3c 22 78 3f 9f 00 ad 4f 44 ac 27
0d 50 54 bf ef 80 d1 c0 81 40 81 80 90 40 95 00
a9 40 b3 00 a9 c0 9e e0 00 78 a0 a0 32 50 10 40
35 00 56 50 21 00 00 1e 00 00 00 fd 00 30 92 f0
f0 3c 01 0a 20 20 20 20 20 20 00 00 00 fc 00 56
58 32 37 35 38 2d 53 45 52 49 45 53 00 00 00 ff
00 56 56 46 32 31 32 30 32 32 31 36 38 0a 01 28

02 03 24 f1 51 01 03 04 05 07 90 12 13 14 16 1f
20 21 22 3f 40 61 23 09 07 07 83 01 00 00 65 03
0c 00 10 00 f5 bd 00 a0 a0 a0 32 50 20 40 45 00
56 50 21 00 00 1e 02 3a 80 18 71 38 2d 40 30 20
36 00 56 50 21 00 00 1e fa 7e 80 88 70 38 12 40
18 20 35 00 56 50 21 00 00 1e 56 5e 00 a0 a0 a0
29 50 30 20 35 00 56 50 21 00 00 1e 00 00 00 00
00 00 00 00 00 00 00 00 00 00 00 00 00 00 00 c8

----------------

Block 0, Base EDID:
  EDID Structure Version & Revision: 1.4
  Vendor & Product Identification:
    Manufacturer: VSC
    Model: 42808
    Serial Number: ...
    Made in: week 20 of 2021
  Basic Display Parameters & Features:
    Digital display
    Bits per primary color channel: 10
    DisplayPort interface
    Maximum image size: 60 cm x 34 cm
    Gamma: 2.20
    DPMS levels: Off
    Supported color formats: RGB 4:4:4, YCrCb 4:4:4, YCrCb 4:2:2
    Default (sRGB) color space is primary color space
    First detailed timing includes the native pixel format and preferred refresh rate
    Display supports continuous frequencies
  Color Characteristics:
    Red  : 0.6777, 0.3095
    Green: 0.2685, 0.6748
    Blue : 0.1523, 0.0507
    White: 0.3125, 0.3281
  Established Timings I & II:
    IBM     :   720x400    70.081663 Hz   9:5     31.467 kHz     28.320000 MHz
    DMT 0x04:   640x480    59.940476 Hz   4:3     31.469 kHz     25.175000 MHz
    Apple   :   640x480    66.666667 Hz   4:3     35.000 kHz     30.240000 MHz
    DMT 0x05:   640x480    72.808802 Hz   4:3     37.861 kHz     31.500000 MHz
    DMT 0x06:   640x480    75.000000 Hz   4:3     37.500 kHz     31.500000 MHz
    DMT 0x08:   800x600    56.250000 Hz   4:3     35.156 kHz     36.000000 MHz
    DMT 0x09:   800x600    60.316541 Hz   4:3     37.879 kHz     40.000000 MHz
    DMT 0x0a:   800x600    72.187572 Hz   4:3     48.077 kHz     50.000000 MHz
    DMT 0x0b:   800x600    75.000000 Hz   4:3     46.875 kHz     49.500000 MHz
    Apple   :   832x624    74.551266 Hz   4:3     49.726 kHz     57.284000 MHz
    DMT 0x10:  1024x768    60.003840 Hz   4:3     48.363 kHz     65.000000 MHz
    DMT 0x11:  1024x768    70.069359 Hz   4:3     56.476 kHz     75.000000 MHz
    DMT 0x12:  1024x768    75.028582 Hz   4:3     60.023 kHz     78.750000 MHz
    DMT 0x24:  1280x1024   75.024675 Hz   5:4     79.976 kHz    135.000000 MHz
    Apple   :  1152x870    75.061550 Hz 192:145   68.681 kHz    100.000000 MHz
  Standard Timings:
    DMT 0x52:  1920x1080   60.000000 Hz  16:9     67.500 kHz    148.500000 MHz
    DMT 0x20:  1280x960    60.000000 Hz   4:3     60.000 kHz    108.000000 MHz
    DMT 0x23:  1280x1024   60.019740 Hz   5:4     63.981 kHz    108.000000 MHz
    DMT 0x2a:  1400x1050   59.978442 Hz   4:3     65.317 kHz    121.750000 MHz
    DMT 0x2f:  1440x900    59.887445 Hz  16:10    55.935 kHz    106.500000 MHz
    DMT 0x33:  1600x1200   60.000000 Hz   4:3     75.000 kHz    162.000000 MHz
    DMT 0x3a:  1680x1050   59.954250 Hz  16:10    65.290 kHz    146.250000 MHz
    DMT 0x53:  1600x900    60.000000 Hz  16:9     60.000 kHz    108.000000 MHz (RB)
  Detailed Timing Descriptors:
    DTD 1:  2560x1440  143.999800 Hz  16:9    214.560 kHz    575.020000 MHz (598 mm x 336 mm)
                 Hfront   16 Hsync  64 Hback   40 Hpol P
                 Vfront    3 Vsync   5 Vback   42 Vpol P
    Display Range Limits:
      Monitor ranges (Range Limits Only): 48-146 Hz V, 240-240 kHz H, max dotclock 600 MHz
    Display Product Name: 'VX2758-SERIES'
    Display Product Serial Number: ...
  Extension blocks: 1
Checksum: 0x28

----------------

Block 1, CTA-861 Extension Block:
  Revision: 3
  Underscans IT Video Formats by default
  Basic audio support
  Supports YCbCr 4:4:4
  Supports YCbCr 4:2:2
  Native DTDs: 1
  Video Data Block:
    VIC   1:   640x480    59.940476 Hz   4:3     31.469 kHz     25.175000 MHz
    VIC   3:   720x480    59.940060 Hz  16:9     31.469 kHz     27.000000 MHz
    VIC   4:  1280x720    60.000000 Hz  16:9     45.000 kHz     74.250000 MHz
    VIC   5:  1920x1080i  60.000000 Hz  16:9     33.750 kHz     74.250000 MHz
    VIC   7:  1440x480i   59.940060 Hz  16:9     15.734 kHz     27.000000 MHz
    VIC  16:  1920x1080   60.000000 Hz  16:9     67.500 kHz    148.500000 MHz (native)
    VIC  18:   720x576    50.000000 Hz  16:9     31.250 kHz     27.000000 MHz
    VIC  19:  1280x720    50.000000 Hz  16:9     37.500 kHz     74.250000 MHz
    VIC  20:  1920x1080i  50.000000 Hz  16:9     28.125 kHz     74.250000 MHz
    VIC  22:  1440x576i   50.000000 Hz  16:9     15.625 kHz     27.000000 MHz
    VIC  31:  1920x1080   50.000000 Hz  16:9     56.250 kHz    148.500000 MHz
    VIC  32:  1920x1080   24.000000 Hz  16:9     27.000 kHz     74.250000 MHz
    VIC  33:  1920x1080   25.000000 Hz  16:9     28.125 kHz     74.250000 MHz
    VIC  34:  1920x1080   30.000000 Hz  16:9     33.750 kHz     74.250000 MHz
    VIC  63:  1920x1080  120.000000 Hz  16:9    135.000 kHz    297.000000 MHz
    VIC  64:  1920x1080  100.000000 Hz  16:9    112.500 kHz    297.000000 MHz
    VIC  97:  3840x2160   60.000000 Hz  16:9    135.000 kHz    594.000000 MHz
  Audio Data Block:
    Linear PCM:
      Max channels: 2
      Supported sample rates (kHz): 48 44.1 32
      Supported sample sizes (bits): 24 20 16
  Speaker Allocation Data Block:
    FL/FR - Front Left/Right
  Vendor-Specific Data Block (HDMI), OUI 00-0C-03:
    Source physical address: 1.0.0.0
  Detailed Timing Descriptors:
    DTD 2:  2560x1440  119.988650 Hz  16:9    178.783 kHz    486.290000 MHz (598 mm x 336 mm)
                 Hfront   32 Hsync  64 Hback   64 Hpol P
                 Vfront    4 Vsync   5 Vback   41 Vpol P
    DTD 3:  1920x1080   60.000000 Hz  16:9     67.500 kHz    148.500000 MHz (598 mm x 336 mm)
                 Hfront   48 Hsync  32 Hback  200 Hpol P
                 Vfront    3 Vsync   6 Vback   36 Vpol P
    DTD 4:  1920x1080  143.991906 Hz  16:9    158.103 kHz    325.060000 MHz (598 mm x 336 mm)
                 Hfront   24 Hsync  32 Hback   80 Hpol P
                 Vfront    3 Vsync   5 Vback   10 Vpol P
    DTD 5:  2560x1440   59.950550 Hz  16:9     88.787 kHz    241.500000 MHz (598 mm x 336 mm)
                 Hfront   48 Hsync  32 Hback   80 Hpol P
                 Vfront    3 Vsync   5 Vback   33 Vpol P
Checksum: 0xc8  Unused space in Extension Block: 19 bytes

----------------

Warnings:

Block 1, CTA-861 Extension Block:
  Video Data Block: VIC 1 and the first DTD are not identical. Is this intended?
  Video Data Block: All VICs are in ascending order, and the first (preferred) VIC <= 4, is that intended?
  Detailed Timing Descriptor #3: DTD is similar but not identical to VIC 16.
  Display Product Serial Number is set, so the Serial Number in the Base EDID should be 0.
EDID:
  Base EDID: Some timings are out of range of the Monitor Ranges:
    Vertical Freq: 24.000 - 144.000 Hz (Monitor: 48.000 - 146.000 Hz)
    Horizontal Freq: 15.625 - 214.559 kHz (Monitor: 240.000 - 240.000 kHz)

Failures:

Block 0, Base EDID:
  Basic Display Parameters & Features: sRGB is signaled, but the chromaticities do not match.
Block 1, CTA-861 Extension Block:
  Vendor-Specific Data Block (HDMI), OUI 00-0C-03: The HDMI Specification requires EDID 1.3 instead of 1.4.
  Missing VCDB, needed for Set Selectable RGB Quantization to avoid interop issues.
EDID:
  Extension Block 2 started with EDID header, ignoring Extension Blocks >= 2.
  CTA-861: Native progressive timings are a mix of several resolutions.

EDID conformity: FAIL
