edid-decode (hex):

00 ff ff ff ff ff ff 00 5c 2d 00 27 01 00 00 00
2d 1c 01 03 80 34 1f 78 2a 94 61 a9 53 46 97 23
1d 50 54 a1 08 00 d1 c0 81 c0 a9 c0 d1 00 81 80
a9 40 01 01 01 01 08 e8 00 30 f2 70 5a 80 b0 58
8a 00 08 36 21 00 00 1e 02 3a 80 18 71 38 2d 40
58 2c 45 00 08 36 21 00 00 1e 00 00 00 fc 00 50
44 4d 32 34 30 55 48 44 0a 20 20 20 00 00 00 fd
00 2f 3f 2f 8c 3c 00 0a 20 20 20 20 20 20 01 b8

02 03 3d f1 43 10 1f 04 23 09 07 07 83 01 00 00
67 03 0c 00 10 00 38 78 67 d8 5d c4 01 78 80 01
68 1a 00 00 01 09 2f 3f e6 e5 0f 00 00 06 00 e3
05 c0 00 e2 00 ff e6 06 05 01 59 59 49 04 74 00
30 f2 70 5a 80 b0 58 8a 00 58 4a 21 00 00 ff 00
00 00 00 00 00 00 00 00 00 00 00 00 00 00 00 00
00 00 00 00 00 00 00 00 00 00 00 00 00 00 00 00
00 00 00 00 00 00 00 00 00 00 00 00 00 00 00 81

----------------

Block 0, Base EDID:
  EDID Structure Version & Revision: 1.3
  Vendor & Product Identification:
    Manufacturer: WAM
    Model: 9984
    Serial Number: ...
    Made in: week 45 of 2018
  Basic Display Parameters & Features:
    Digital display
    Maximum image size: 52 cm x 31 cm
    Gamma: 2.20
    DPMS levels: Off
    RGB color display
    First detailed timing is the preferred timing
  Color Characteristics:
    Red  : 0.6621, 0.3251
    Green: 0.2744, 0.5898
    Blue : 0.1376, 0.1152
    White: 0.3125, 0.3291
  Established Timings I & II:
    IBM     :   720x400    70.081663 Hz   9:5     31.467 kHz     28.320000 MHz
    DMT 0x04:   640x480    59.940476 Hz   4:3     31.469 kHz     25.175000 MHz
    DMT 0x09:   800x600    60.316541 Hz   4:3     37.879 kHz     40.000000 MHz
    DMT 0x10:  1024x768    60.003840 Hz   4:3     48.363 kHz     65.000000 MHz
  Standard Timings:
    DMT 0x52:  1920x1080   60.000000 Hz  16:9     67.500 kHz    148.500000 MHz
    DMT 0x55:  1280x720    60.000000 Hz  16:9     45.000 kHz     74.250000 MHz
    DMT 0x53:  1600x900    60.000000 Hz  16:9     60.000 kHz    108.000000 MHz (RB)
    DMT 0x45:  1920x1200   59.884600 Hz  16:10    74.556 kHz    193.250000 MHz
    DMT 0x23:  1280x1024   60.019740 Hz   5:4     63.981 kHz    108.000000 MHz
    DMT 0x33:  1600x1200   60.000000 Hz   4:3     75.000 kHz    162.000000 MHz
  Detailed Timing Descriptors:
    DTD 1:  3840x2160   60.000000 Hz  16:9    135.000 kHz    594.000000 MHz (520 mm x 310 mm)
                 Hfront  176 Hsync  88 Hback  296 Hpol P
                 Vfront    8 Vsync  10 Vback   72 Vpol P
    DTD 2:  1920x1080   60.000000 Hz  16:9     67.500 kHz    148.500000 MHz (520 mm x 310 mm)
                 Hfront   88 Hsync  44 Hback  148 Hpol P
                 Vfront    4 Vsync   5 Vback   36 Vpol P
    Display Product Name: 'PDM240UHD'
    Display Range Limits:
      Monitor ranges (GTF): 47-63 Hz V, 47-140 kHz H, max dotclock 600 MHz
  Extension blocks: 1
Checksum: 0xb8

----------------

Block 1, CTA-861 Extension Block:
  Revision: 3
  Underscans IT Video Formats by default
  Basic audio support
  Supports YCbCr 4:4:4
  Supports YCbCr 4:2:2
  Native DTDs: 1
  Video Data Block:
    VIC  16:  1920x1080   60.000000 Hz  16:9     67.500 kHz    148.500000 MHz
    VIC  31:  1920x1080   50.000000 Hz  16:9     56.250 kHz    148.500000 MHz
    VIC   4:  1280x720    60.000000 Hz  16:9     45.000 kHz     74.250000 MHz
  Audio Data Block:
    Linear PCM:
      Max channels: 2
      Supported sample rates (kHz): 48 44.1 32
      Supported sample sizes (bits): 24 20 16
  Speaker Allocation Data Block:
    FL/FR - Front Left/Right
  Vendor-Specific Data Block (HDMI), OUI 00-0C-03:
    Source physical address: 1.0.0.0
    DC_36bit
    DC_30bit
    DC_Y444
    Maximum TMDS clock: 600 MHz
  Vendor-Specific Data Block (HDMI Forum), OUI C4-5D-D8:
    Version: 1
    Maximum TMDS Character Rate: 600 MHz
    SCDC Present
    Supports 10-bits/component Deep Color 4:2:0 Pixel Encoding
  Vendor-Specific Data Block (AMD), OUI 00-00-1A:
    Version: 1
    Flags 1: 0x09
      FreeSync Supported
    Minimum Refresh Rate: 47 Hz
    Maximum Refresh Rate: 63 Hz
    MCCS VCP Code: 0xe6
  YCbCr 4:2:0 Capability Map Data Block:
    SVD Index 18 is out of range
    SVD Index 19 is out of range
  Colorimetry Data Block:
    BT2020YCC
    BT2020RGB
  Video Capability Data Block:
    YCbCr quantization: Selectable (via AVI YQ)
    RGB quantization: Selectable (via AVI Q)
    PT scan behavior: Supports both over- and underscan
    IT scan behavior: Supports both over- and underscan
    CE scan behavior: Supports both over- and underscan
  HDR Static Metadata Data Block:
    Electro optical transfer functions:
      Traditional gamma - SDR luminance range
      SMPTE ST2084
    Supported static metadata descriptors:
      Static metadata type 1
    Desired content max luminance: 89 (343.724 cd/m^2)
    Desired content max frame-average luminance: 89 (343.724 cd/m^2)
    Desired content min luminance: 73 (0.282 cd/m^2)
  Detailed Timing Descriptors:
    DTD 3:  3840x4320i  29.993335 Hz   8:9     67.500 kHz    297.000000 MHz (side by side interleaved, 600 mm x 330 mm)
                 Hfront  176 Hsync  88 Hback  296 Hpol P
                 Vfront    8 Vsync  10 Vback   72 Vpol P Vfront +0.5 Odd Field
                 Vfront    8 Vsync  10 Vback   72 Vpol P Vback  +0.5 Even Field
Checksum: 0x81  Unused space in Extension Block: 48 bytes

----------------

Warnings:

Block 0, Base EDID:
  Vendor & Product Identification: The serial number is one of the known dummy values, it should probably be set to 0.
  Detailed Timing Descriptor #1: DTD is identical to VIC 97, which is not present in the CTA Ext Block.
  Detailed Timing Descriptor #1: Image size is 520x310 mm, but based on the picture AR it should be 520x292 mm.
  Detailed Timing Descriptor #2: Image size is 520x310 mm, but based on the picture AR it should be 520x292 mm.
Block 1, CTA-861 Extension Block:
  Video Data Block: VIC 16 and the first DTD are not identical. Is this intended?
  Colorimetry Data Block: Set the sRGB colorimetry bit to avoid interop issues.
  Video Capability Data Block: S_PT is equal to S_IT and S_CE, so should be set to 0 instead.
  Detailed Timing Descriptor #3: Image size is 600x330 mm, but based on the picture AR it should be 293x330 mm.
EDID:
  Base EDID: Some timings are out of range of the Monitor Ranges:
    Vertical Freq: 29.993 - 70.082 Hz (Monitor: 47.000 - 63.000 Hz)
    Horizontal Freq: 31.466 - 135.000 kHz (Monitor: 47.000 - 140.000 kHz)
  CTA-861: DTD pixelclock indicates HDMI 2.x support, VICs indicate HDMI 1.x.

Failures:

Block 1, CTA-861 Extension Block:
  Vendor-Specific Data Block (HDMI), OUI 00-0C-03: HDMI VSDB Max TMDS rate is > 340.
  YCbCr 4:2:0 Capability Map Data Block: Max index 19 > 3 (#SVDs).
  Detailed Timing Descriptor #3: Mismatch of image size 600x330 mm vs display size 520x310 mm.
EDID:
  Base EDID: The DTD max image size is 600x330mm, which is larger than the display size 520.0x310.0mm.

EDID conformity: FAIL
