edid-decode (hex):

00 ff ff ff ff ff ff 00 5c 2d 00 27 00 00 00 00
19 1e 01 04 b5 3c 21 78 3f 8e 05 ad 4f 33 b0 26
0d 50 54 a5 4f 00 b3 00 a9 c0 95 00 81 00 81 40
81 80 90 40 71 40 56 5e 00 a0 a0 a0 29 50 30 20
35 00 55 50 21 00 00 1a 02 3a 80 18 71 38 2d 40
58 2c 45 00 55 50 21 00 00 1e 00 00 00 fd 00 30
90 df df 3c 01 0a 20 20 20 20 20 20 00 00 00 fc
00 4f 5a 44 53 50 32 37 49 50 53 0a 20 20 01 e8

02 03 38 f1 4c 01 03 05 14 04 13 1f 12 02 11 90
3f 23 09 07 07 83 01 00 00 65 03 0c 00 10 00 e3
05 e3 01 e6 06 07 01 63 63 2f 6d 1a 00 00 02 03
30 90 00 0f 63 31 00 31 86 bc 00 50 a0 a0 55 50
08 20 78 00 55 50 21 00 00 1a f8 e3 00 a0 a0 a0
32 50 30 20 35 00 55 50 21 00 00 1a 7b 7f 80 78
70 38 1f 40 30 20 45 00 0a 0a 00 00 00 1e 00 00
00 00 00 00 00 00 00 00 00 00 00 00 00 00 00 cf

00 ff ff ff ff ff ff 00 5c 2d 00 27 00 00 00 00
19 1e 01 04 b5 3c 21 78 3f 8e 05 ad 4f 33 b0 26
0d 50 54 a5 4f 00 b3 00 a9 c0 95 00 81 00 81 40
81 80 90 40 71 40 56 5e 00 a0 a0 a0 29 50 30 20
35 00 55 50 21 00 00 1a 02 3a 80 18 71 38 2d 40
58 2c 45 00 55 50 21 00 00 1e 00 00 00 fd 00 30
90 df df 3c 01 0a 20 20 20 20 20 20 00 00 00 fc
00 4f 5a 44 53 50 32 37 49 50 53 0a 20 20 01 e8

02 03 38 f1 4c 01 03 05 14 04 13 1f 12 02 11 90
3f 23 09 07 07 83 01 00 00 65 03 0c 00 10 00 e3
05 e3 01 e6 06 07 01 63 63 2f 6d 1a 00 00 02 03
30 90 00 0f 63 31 00 31 86 bc 00 50 a0 a0 55 50
08 20 78 00 55 50 21 00 00 1a f8 e3 00 a0 a0 a0
32 50 30 20 35 00 55 50 21 00 00 1a 7b 7f 80 78
70 38 1f 40 30 20 45 00 0a 0a 00 00 00 1e 00 00
00 00 00 00 00 00 00 00 00 00 00 00 00 00 00 cf

----------------

Block 0, Base EDID:
  EDID Structure Version & Revision: 1.4
  Vendor & Product Identification:
    Manufacturer: WAM
    Model: 9984
    Made in: week 25 of 2020
  Basic Display Parameters & Features:
    Digital display
    Bits per primary color channel: 10
    DisplayPort interface
    Maximum image size: 60 cm x 33 cm
    Gamma: 2.20
    DPMS levels: Off
    Supported color formats: RGB 4:4:4, YCrCb 4:4:4, YCrCb 4:2:2
    Default (sRGB) color space is primary color space
    First detailed timing includes the native pixel format and preferred refresh rate
    Display supports continuous frequencies
  Color Characteristics:
    Red  : 0.6777, 0.3085
    Green: 0.2021, 0.6894
    Blue : 0.1484, 0.0507
    White: 0.3134, 0.3291
  Established Timings I & II:
    IBM     :   720x400    70.081663 Hz   9:5     31.467 kHz     28.320000 MHz
    DMT 0x04:   640x480    59.940476 Hz   4:3     31.469 kHz     25.175000 MHz
    DMT 0x06:   640x480    75.000000 Hz   4:3     37.500 kHz     31.500000 MHz
    DMT 0x09:   800x600    60.316541 Hz   4:3     37.879 kHz     40.000000 MHz
    DMT 0x0b:   800x600    75.000000 Hz   4:3     46.875 kHz     49.500000 MHz
    DMT 0x10:  1024x768    60.003840 Hz   4:3     48.363 kHz     65.000000 MHz
    DMT 0x11:  1024x768    70.069359 Hz   4:3     56.476 kHz     75.000000 MHz
    DMT 0x12:  1024x768    75.028582 Hz   4:3     60.023 kHz     78.750000 MHz
    DMT 0x24:  1280x1024   75.024675 Hz   5:4     79.976 kHz    135.000000 MHz
  Standard Timings:
    DMT 0x3a:  1680x1050   59.954250 Hz  16:10    65.290 kHz    146.250000 MHz
    DMT 0x53:  1600x900    60.000000 Hz  16:9     60.000 kHz    108.000000 MHz (RB)
    DMT 0x2f:  1440x900    59.887445 Hz  16:10    55.935 kHz    106.500000 MHz
    DMT 0x1c:  1280x800    59.810326 Hz  16:10    49.702 kHz     83.500000 MHz
    DMT 0x20:  1280x960    60.000000 Hz   4:3     60.000 kHz    108.000000 MHz
    DMT 0x23:  1280x1024   60.019740 Hz   5:4     63.981 kHz    108.000000 MHz
    DMT 0x2a:  1400x1050   59.978442 Hz   4:3     65.317 kHz    121.750000 MHz
    GTF     :  1152x864    60.000000 Hz   4:3     53.700 kHz     81.624000 MHz
  Detailed Timing Descriptors:
    DTD 1:  2560x1440   59.950550 Hz  16:9     88.787 kHz    241.500000 MHz (597 mm x 336 mm)
                 Hfront   48 Hsync  32 Hback   80 Hpol P
                 Vfront    3 Vsync   5 Vback   33 Vpol N
    DTD 2:  1920x1080   60.000000 Hz  16:9     67.500 kHz    148.500000 MHz (597 mm x 336 mm)
                 Hfront   88 Hsync  44 Hback  148 Hpol P
                 Vfront    4 Vsync   5 Vback   36 Vpol P
    Display Range Limits:
      Monitor ranges (Range Limits Only): 48-144 Hz V, 223-223 kHz H, max dotclock 600 MHz
    Display Product Name: 'OZDSP27IPS'
  Extension blocks: 1
Checksum: 0xe8

----------------

Block 1, CTA-861 Extension Block:
  Revision: 3
  Underscans IT Video Formats by default
  Basic audio support
  Supports YCbCr 4:4:4
  Supports YCbCr 4:2:2
  Native DTDs: 1
  Video Data Block:
    VIC   1:   640x480    59.940476 Hz   4:3     31.469 kHz     25.175000 MHz
    VIC   3:   720x480    59.940060 Hz  16:9     31.469 kHz     27.000000 MHz
    VIC   5:  1920x1080i  60.000000 Hz  16:9     33.750 kHz     74.250000 MHz
    VIC  20:  1920x1080i  50.000000 Hz  16:9     28.125 kHz     74.250000 MHz
    VIC   4:  1280x720    60.000000 Hz  16:9     45.000 kHz     74.250000 MHz
    VIC  19:  1280x720    50.000000 Hz  16:9     37.500 kHz     74.250000 MHz
    VIC  31:  1920x1080   50.000000 Hz  16:9     56.250 kHz    148.500000 MHz
    VIC  18:   720x576    50.000000 Hz  16:9     31.250 kHz     27.000000 MHz
    VIC   2:   720x480    59.940060 Hz   4:3     31.469 kHz     27.000000 MHz
    VIC  17:   720x576    50.000000 Hz   4:3     31.250 kHz     27.000000 MHz
    VIC  16:  1920x1080   60.000000 Hz  16:9     67.500 kHz    148.500000 MHz (native)
    VIC  63:  1920x1080  120.000000 Hz  16:9    135.000 kHz    297.000000 MHz
  Audio Data Block:
    Linear PCM:
      Max channels: 2
      Supported sample rates (kHz): 48 44.1 32
      Supported sample sizes (bits): 24 20 16
  Speaker Allocation Data Block:
    FL/FR - Front Left/Right
  Vendor-Specific Data Block (HDMI), OUI 00-0C-03:
    Source physical address: 1.0.0.0
  Colorimetry Data Block:
    xvYCC601
    xvYCC709
    BT2020cYCC
    BT2020YCC
    BT2020RGB
    Gamut Boundary Description Metadata Profile P0
  HDR Static Metadata Data Block:
    Electro optical transfer functions:
      Traditional gamma - SDR luminance range
      Traditional gamma - HDR luminance range
      SMPTE ST2084
    Supported static metadata descriptors:
      Static metadata type 1
    Desired content max luminance: 99 (426.856 cd/m^2)
    Desired content max frame-average luminance: 99 (426.856 cd/m^2)
    Desired content min luminance: 47 (0.145 cd/m^2)
  Vendor-Specific Data Block (AMD), OUI 00-00-1A:
    Version: 2
    Feature Caps: 0x03
    Minimum Refresh Rate: 48 Hz
    Maximum Refresh Rate: 144 Hz
    Flags 1.x: 0x00
    Flags 2.x: 0x0f
      ST 2084 (PQ) EOTF Supported
      Linear EOTF (Windows scRGB, 0.0 - 125.0) Supported
      Gamma 2.2 EOTF Supported
      BT.2020 Gamut Supported
    Maximum luminance: 99 (426.856 cd/m^2)
    Minimum luminance: 49 (0.158 cd/m^2)
  Detailed Timing Descriptors:
    DTD 3:  2560x1440  119.875807 Hz  16:9    182.811 kHz    482.620000 MHz (597 mm x 336 mm)
                 Hfront    8 Hsync  32 Hback   40 Hpol P
                 Vfront    7 Vsync   8 Vback   70 Vpol N
    DTD 4:  2560x1440  143.999210 Hz  16:9    214.559 kHz    583.600000 MHz (597 mm x 336 mm)
                 Hfront   48 Hsync  32 Hback   80 Hpol P
                 Vfront    3 Vsync   5 Vback   42 Vpol N
    DTD 5:  1920x1080  143.992340 Hz  16:9    159.975 kHz    326.350000 MHz (10 mm x 10 mm)
                 Hfront   48 Hsync  32 Hback   40 Hpol P
                 Vfront    4 Vsync   5 Vback   22 Vpol P
Checksum: 0xcf  Unused space in Extension Block: 17 bytes

----------------

Warnings:

Block 1, CTA-861 Extension Block:
  Video Data Block: VIC 1 and the first DTD are not identical. Is this intended?
  Detailed Timing Descriptor #5: Dubious image size (10x10 mm is smaller than 100x100 mm).
EDID:
  Base EDID: Some timings are out of range of the Monitor Ranges:
    Horizontal Freq: 28.125 - 214.558 kHz (Monitor: 223.000 - 223.000 kHz)

Failures:

Block 0, Base EDID:
  Basic Display Parameters & Features: sRGB is signaled, but the chromaticities do not match.
Block 1, CTA-861 Extension Block:
  Vendor-Specific Data Block (HDMI), OUI 00-0C-03: The HDMI Specification requires EDID 1.3 instead of 1.4.
  Detailed Timing Descriptor #5: Mismatch of image size 10x10 mm vs display size 600x330 mm.
  Missing VCDB, needed for Set Selectable RGB Quantization to avoid interop issues.
EDID:
  Extension Block 2 started with EDID header, ignoring Extension Blocks >= 2.
  CTA-861: Native progressive timings are a mix of several resolutions.

EDID conformity: FAIL
