edid-decode (hex):

00 ff ff ff ff ff ff 00 22 f0 52 28 00 00 00 80
02 14 01 03 68 30 1e 78 ee dc 55 a3 59 48 9e 24
11 50 54 a5 6b 80 81 40 81 80 95 00 a9 00 b3 00
a9 40 01 01 01 01 21 39 90 30 62 1a 27 40 68 b0
36 00 d9 28 11 00 00 1c 00 00 00 fd 00 30 4c 18
53 11 00 0a 20 20 20 20 20 20 00 00 00 fc 00 48
50 20 32 32 32 39 68 0a 20 20 20 20 00 00 00 ff
00 33 43 51 30 30 32 32 32 31 42 0a 20 20 00 82

00 ff ff ff ff ff ff 00 22 f0 52 28 00 00 00 80
02 14 01 03 68 30 1e 78 ee dc 55 a3 59 48 9e 24
11 50 54 a5 6b 80 81 40 81 80 95 00 a9 00 b3 00
a9 40 01 01 01 01 21 39 90 30 62 1a 27 40 68 b0
36 00 d9 28 11 00 00 1c 00 00 00 fd 00 30 4c 18
53 11 00 0a 20 20 20 20 20 20 00 00 00 fc 00 48
50 20 32 32 32 39 68 0a 20 20 20 20 00 00 00 ff
00 33 43 51 30 30 32 32 32 31 42 0a 20 20 00 82

----------------

Block 0, Base EDID:
  EDID Structure Version & Revision: 1.3
  Vendor & Product Identification:
    Manufacturer: HWP
    Model: 10322
    Serial Number: ...
    Made in: week 2 of 2010
  Basic Display Parameters & Features:
    Analog display
    Signal Level Standard: 0.700 : 0.000 : 0.700 V p-p
    Blank level equals black level
    Sync: Separate
    Maximum image size: 48 cm x 30 cm
    Gamma: 2.20
    DPMS levels: Standby Suspend Off
    RGB color display
    Default (sRGB) color space is primary color space
    First detailed timing is the preferred timing
  Color Characteristics:
    Red  : 0.6396, 0.3486
    Green: 0.2841, 0.6171
    Blue : 0.1416, 0.0673
    White: 0.3134, 0.3291
  Established Timings I & II:
    IBM     :   720x400    70.081663 Hz   9:5     31.467 kHz     28.320000 MHz
    DMT 0x04:   640x480    59.940476 Hz   4:3     31.469 kHz     25.175000 MHz
    DMT 0x06:   640x480    75.000000 Hz   4:3     37.500 kHz     31.500000 MHz
    DMT 0x09:   800x600    60.316541 Hz   4:3     37.879 kHz     40.000000 MHz
    DMT 0x0b:   800x600    75.000000 Hz   4:3     46.875 kHz     49.500000 MHz
    Apple   :   832x624    74.551266 Hz   4:3     49.726 kHz     57.284000 MHz
    DMT 0x10:  1024x768    60.003840 Hz   4:3     48.363 kHz     65.000000 MHz
    DMT 0x12:  1024x768    75.028582 Hz   4:3     60.023 kHz     78.750000 MHz
    DMT 0x24:  1280x1024   75.024675 Hz   5:4     79.976 kHz    135.000000 MHz
    Apple   :  1152x870    75.061550 Hz 192:145   68.681 kHz    100.000000 MHz
  Standard Timings:
    DMT 0x20:  1280x960    60.000000 Hz   4:3     60.000 kHz    108.000000 MHz
    DMT 0x23:  1280x1024   60.019740 Hz   5:4     63.981 kHz    108.000000 MHz
    DMT 0x2f:  1440x900    59.887445 Hz  16:10    55.935 kHz    106.500000 MHz
    GTF     :  1600x1000   59.999820 Hz  16:10    62.100 kHz    133.142000 MHz
    DMT 0x3a:  1680x1050   59.954250 Hz  16:10    65.290 kHz    146.250000 MHz
    DMT 0x33:  1600x1200   60.000000 Hz   4:3     75.000 kHz    162.000000 MHz
  Detailed Timing Descriptors:
    DTD 1:  1680x1050   59.954250 Hz  16:10    65.290 kHz    146.250000 MHz (473 mm x 296 mm)
                 Hfront  104 Hsync 176 Hback  280 Hpol N
                 Vfront    3 Vsync   6 Vback   30 Vpol P
    Display Range Limits:
      Monitor ranges (GTF): 48-76 Hz V, 24-83 kHz H, max dotclock 170 MHz
    Display Product Name: 'HP 2229h'
    Display Product Serial Number: ...
Checksum: 0x82

----------------

Block 1, Unknown EDID Extension Block 0x00:
  00 ff ff ff ff ff ff 00 22 f0 52 28 00 00 00 80 '........".R(....'
  02 14 01 03 68 30 1e 78 ee dc 55 a3 59 48 9e 24 '....h0.x..U.YH.$'
  11 50 54 a5 6b 80 81 40 81 80 95 00 a9 00 b3 00 '.PT.k..@........'
  a9 40 01 01 01 01 21 39 90 30 62 1a 27 40 68 b0 '.@....!9.0b.'@h.'
  36 00 d9 28 11 00 00 1c 00 00 00 fd 00 30 4c 18 '6..(.........0L.'
  53 11 00 0a 20 20 20 20 20 20 00 00 00 fc 00 48 'S...      .....H'
  50 20 32 32 32 39 68 0a 20 20 20 20 00 00 00 ff 'P 2229h.    ....'
  00 33 43 51 30 30 32 32 32 31 42 0a 20 20 00 82 '.3CQ002221B.  ..'
Checksum: 0x82

----------------

Warnings:

Block 0, Base EDID:
  Vendor & Product Identification: The serial number is one of the known dummy values, it should probably be set to 0.

Failures:

Block 0, Base EDID:
  Basic Display Parameters & Features: sRGB is signaled, but the chromaticities do not match.
Block 1, Base EDID:
  Unknown Extension Block.
EDID:
  Base EDID: EDID specified 0 extension block(s), but found 1 extension block(s).

EDID conformity: FAIL
