edid-decode (hex):

00 ff ff ff ff ff ff 00 30 e4 ff 05 00 00 00 00
00 1c 01 04 95 22 13 78 ea a9 c5 94 5d 59 8f 27
1b 50 54 00 00 00 01 01 01 01 01 01 01 01 01 01
01 01 01 01 01 01 29 36 80 a0 70 38 1f 40 30 20
35 00 58 c2 10 00 00 1a 57 2b 80 a0 70 38 1f 40
30 20 35 00 58 c2 10 00 00 1a 00 00 00 fe 00 4e
4d 32 32 56 14 31 35 36 57 46 44 0a 00 00 00 00
00 00 41 31 96 00 10 00 00 0a 01 0a 20 20 00 48

00 ff ff ff ff ff ff 00 30 e4 ff 05 00 00 00 00
00 1c 01 04 95 22 13 78 ea a9 c5 94 5d 59 8f 27
1b 50 54 00 00 00 01 01 01 01 01 01 01 01 01 01
01 01 01 01 01 01 29 36 80 a0 70 38 1f 40 30 20
35 00 58 c2 10 00 00 1a 57 2b 80 a0 70 38 1f 40
30 20 35 00 58 c2 10 00 00 1a 00 00 00 fe 00 4e
4d 32 32 56 14 31 35 36 57 46 44 0a 00 00 00 00
00 00 41 31 96 00 10 00 00 0a 01 0a 20 20 00 48

----------------

Block 0, Base EDID:
  EDID Structure Version & Revision: 1.4
  Vendor & Product Identification:
    Manufacturer: LGD
    Model: 1535
    Made in: 2018
  Basic Display Parameters & Features:
    Digital display
    Bits per primary color channel: 6
    DisplayPort interface
    Maximum image size: 34 cm x 19 cm
    Gamma: 2.20
    DPMS levels: Standby Suspend Off
    Supported color formats: RGB 4:4:4, YCrCb 4:4:4
    First detailed timing includes the native pixel format and preferred refresh rate
  Color Characteristics:
    Red  : 0.5800, 0.3652
    Green: 0.3496, 0.5595
    Blue : 0.1552, 0.1054
    White: 0.3134, 0.3291
  Established Timings I & II: none
  Standard Timings: none
  Detailed Timing Descriptors:
    DTD 1:  1920x1080   59.998788 Hz  16:9     66.659 kHz    138.650000 MHz (344 mm x 194 mm)
                 Hfront   48 Hsync  32 Hback   80 Hpol P
                 Vfront    3 Vsync   5 Vback   23 Vpol N
    DTD 2:  1920x1080   48.012013 Hz  16:9     53.341 kHz    110.950000 MHz (344 mm x 194 mm)
                 Hfront   48 Hsync  32 Hback   80 Hpol P
                 Vfront    3 Vsync   5 Vback   23 Vpol N
    Alphanumeric Data String: 'NM22V.156WFD'
    Manufacturer-Specified Display Descriptor (0x00): 00 00 00 00 41 31 96 00 10 00 00 0a 01 0a 20 20 '....A1........  '
Checksum: 0x48

----------------

Block 1, Unknown EDID Extension Block 0x00:
  00 ff ff ff ff ff ff 00 30 e4 ff 05 00 00 00 00 '........0.......'
  00 1c 01 04 95 22 13 78 ea a9 c5 94 5d 59 8f 27 '.....".x....]Y.''
  1b 50 54 00 00 00 01 01 01 01 01 01 01 01 01 01 '.PT.............'
  01 01 01 01 01 01 29 36 80 a0 70 38 1f 40 30 20 '......)6..p8.@0 '
  35 00 58 c2 10 00 00 1a 57 2b 80 a0 70 38 1f 40 '5.X.....W+..p8.@'
  30 20 35 00 58 c2 10 00 00 1a 00 00 00 fe 00 4e '0 5.X..........N'
  4d 32 32 56 14 31 35 36 57 46 44 0a 00 00 00 00 'M22V.156WFD.....'
  00 00 41 31 96 00 10 00 00 0a 01 0a 20 20 00 48 '..A1........  .H'
Checksum: 0x48

----------------

Warnings:

Block 0, Base EDID:
  Alphanumeric Data String: Non-ASCII character 0x14 at position 5, can cause problems.
  Missing Display Product Name.

Failures:

Block 1, Base EDID:
  Unknown Extension Block.
EDID:
  Base EDID: EDID specified 0 extension block(s), but found 1 extension block(s).

EDID conformity: FAIL
