edid-decode (hex):

00 ff ff ff ff ff ff 00 22 f0 f3 26 01 01 01 01
1b 12 01 03 80 34 20 78 ea f8 a1 b0 4c 34 b7 26
0b 50 54 a5 08 00 81 40 81 80 a9 00 a9 40 b3 00
d1 c0 d1 00 01 01 28 3c 80 a0 70 b0 23 40 30 20
36 00 06 44 21 00 00 1a 00 00 00 fd 00 2f 3d 18
50 11 00 0a 20 20 20 20 20 20 00 00 00 fc 00 48
50 20 4c 50 32 34 38 30 7a 78 0a 20 00 00 00 ff
00 33 43 4d 38 32 37 30 30 42 50 0a 20 20 00 6c

00 ff ff ff ff ff ff 00 22 f0 f3 26 01 01 01 01
1b 12 01 03 80 34 20 78 ea f8 a1 b0 4c 34 b7 26
0b 50 54 a5 08 00 81 40 81 80 a9 00 a9 40 b3 00
d1 c0 d1 00 01 01 28 3c 80 a0 70 b0 23 40 30 20
36 00 06 44 21 00 00 1a 00 00 00 fd 00 2f 3d 18
50 11 00 0a 20 20 20 20 20 20 00 00 00 fc 00 48
50 20 4c 50 32 34 38 30 7a 78 0a 20 00 00 00 ff
00 33 43 4d 38 32 37 30 30 42 50 0a 20 20 00 6c

----------------

Block 0, Base EDID:
  EDID Structure Version & Revision: 1.3
  Vendor & Product Identification:
    Manufacturer: HWP
    Model: 9971
    Serial Number: ...
    Made in: week 27 of 2008
  Basic Display Parameters & Features:
    Digital display
    Maximum image size: 52 cm x 32 cm
    Gamma: 2.20
    DPMS levels: Standby Suspend Off
    RGB color display
    First detailed timing is the preferred timing
  Color Characteristics:
    Red  : 0.6904, 0.2998
    Green: 0.2050, 0.7148
    Blue : 0.1503, 0.0449
    White: 0.3125, 0.3291
  Established Timings I & II:
    IBM     :   720x400    70.081663 Hz   9:5     31.467 kHz     28.320000 MHz
    DMT 0x04:   640x480    59.940476 Hz   4:3     31.469 kHz     25.175000 MHz
    DMT 0x06:   640x480    75.000000 Hz   4:3     37.500 kHz     31.500000 MHz
    DMT 0x09:   800x600    60.316541 Hz   4:3     37.879 kHz     40.000000 MHz
    DMT 0x10:  1024x768    60.003840 Hz   4:3     48.363 kHz     65.000000 MHz
  Standard Timings:
    DMT 0x20:  1280x960    60.000000 Hz   4:3     60.000 kHz    108.000000 MHz
    DMT 0x23:  1280x1024   60.019740 Hz   5:4     63.981 kHz    108.000000 MHz
    GTF     :  1600x1000   59.999820 Hz  16:10    62.100 kHz    133.142000 MHz
    DMT 0x33:  1600x1200   60.000000 Hz   4:3     75.000 kHz    162.000000 MHz
    DMT 0x3a:  1680x1050   59.954250 Hz  16:10    65.290 kHz    146.250000 MHz
    DMT 0x52:  1920x1080   60.000000 Hz  16:9     67.500 kHz    148.500000 MHz
    DMT 0x45:  1920x1200   59.884600 Hz  16:10    74.556 kHz    193.250000 MHz
  Detailed Timing Descriptors:
    DTD 1:  1920x1200   59.950171 Hz  16:10    74.038 kHz    154.000000 MHz (518 mm x 324 mm)
                 Hfront   48 Hsync  32 Hback   80 Hpol P
                 Vfront    3 Vsync   6 Vback   26 Vpol N
    Display Range Limits:
      Monitor ranges (GTF): 47-61 Hz V, 24-80 kHz H, max dotclock 170 MHz
    Display Product Name: 'HP LP2480zx'
    Display Product Serial Number: ...
Checksum: 0x6c

----------------

Warnings:

Block 0, Base EDID:
  Vendor & Product Identification: The serial number is one of the known dummy values, it should probably be set to 0.
EDID:
  Base EDID: Some timings are out of range of the Monitor Ranges:
    Vertical Freq: 59.885 - 75.000 Hz (Monitor: 47.000 - 61.000 Hz)
    Maximum Clock: 193.250 MHz (Monitor: 170.000 MHz)

Failures:

EDID:
  Extension Block 1 started with EDID header, ignoring Extension Blocks >= 1.

EDID conformity: FAIL
