edid-decode (hex):

00 ff ff ff ff ff ff 00 34 a4 c4 89 01 01 01 01
08 11 01 03 08 29 1a 78 ea de 95 a3 54 4c 99 26
0f 50 54 a5 4b 00 81 80 95 00 95 0f 01 01 01 01
01 01 01 01 01 01 9a 29 a0 d0 51 84 22 30 50 98
36 00 98 ff 10 00 00 1c 00 00 00 fc 00 4d 44 33
30 39 39 39 50 44 0a 20 20 20 00 00 00 fd 00 32
4b 1f 53 0e 00 0a 20 20 20 20 20 20 00 00 00 ff
00 37 30 32 30 34 33 34 36 32 0a 20 20 20 00 ea

00 ff ff ff ff ff ff 00 34 a4 c4 89 01 01 01 01
08 11 01 03 08 29 1a 78 ea de 95 a3 54 4c 99 26
0f 50 54 a5 4b 00 81 80 95 00 95 0f 01 01 01 01
01 01 01 01 01 01 9a 29 a0 d0 51 84 22 30 50 98
36 00 98 ff 10 00 00 1c 00 00 00 fc 00 4d 44 33
30 39 39 39 50 44 0a 20 20 20 00 00 00 fd 00 32
4b 1f 53 0e 00 0a 20 20 20 20 20 20 00 00 00 ff
00 37 30 32 30 34 33 34 36 32 0a 20 20 20 00 ea

----------------

Block 0, Base EDID:
  EDID Structure Version & Revision: 1.3
  Vendor & Product Identification:
    Manufacturer: MED
    Model: 35268
    Serial Number: ...
    Made in: week 8 of 2007
  Basic Display Parameters & Features:
    Analog display
    Signal Level Standard: 0.700 : 0.300 : 1.000 V p-p
    Blank level equals black level
    Sync: Separate
    Maximum image size: 41 cm x 26 cm
    Gamma: 2.20
    DPMS levels: Standby Suspend Off
    RGB color display
    First detailed timing is the preferred timing
  Color Characteristics:
    Red  : 0.6396, 0.3291
    Green: 0.2998, 0.5996
    Blue : 0.1503, 0.0595
    White: 0.3134, 0.3291
  Established Timings I & II:
    IBM     :   720x400    70.081663 Hz   9:5     31.467 kHz     28.320000 MHz
    DMT 0x04:   640x480    59.940476 Hz   4:3     31.469 kHz     25.175000 MHz
    DMT 0x06:   640x480    75.000000 Hz   4:3     37.500 kHz     31.500000 MHz
    DMT 0x09:   800x600    60.316541 Hz   4:3     37.879 kHz     40.000000 MHz
    DMT 0x0b:   800x600    75.000000 Hz   4:3     46.875 kHz     49.500000 MHz
    DMT 0x10:  1024x768    60.003840 Hz   4:3     48.363 kHz     65.000000 MHz
    DMT 0x12:  1024x768    75.028582 Hz   4:3     60.023 kHz     78.750000 MHz
    DMT 0x24:  1280x1024   75.024675 Hz   5:4     79.976 kHz    135.000000 MHz
  Standard Timings:
    DMT 0x23:  1280x1024   60.019740 Hz   5:4     63.981 kHz    108.000000 MHz
    DMT 0x2f:  1440x900    59.887445 Hz  16:10    55.935 kHz    106.500000 MHz
    DMT 0x30:  1440x900    74.984427 Hz  16:10    70.635 kHz    136.750000 MHz
  Detailed Timing Descriptors:
    DTD 1:  1440x900    59.887445 Hz  16:10    55.935 kHz    106.500000 MHz (408 mm x 255 mm)
                 Hfront   80 Hsync 152 Hback  232 Hpol N
                 Vfront    3 Vsync   6 Vback   25 Vpol P
    Display Product Name: 'MD30999PD'
    Display Range Limits:
      Monitor ranges (GTF): 50-75 Hz V, 31-83 kHz H, max dotclock 140 MHz
    Display Product Serial Number: ...
Checksum: 0xea

----------------

Block 1, Unknown EDID Extension Block 0x00:
  00 ff ff ff ff ff ff 00 34 a4 c4 89 01 01 01 01 '........4.......'
  08 11 01 03 08 29 1a 78 ea de 95 a3 54 4c 99 26 '.....).x....TL.&'
  0f 50 54 a5 4b 00 81 80 95 00 95 0f 01 01 01 01 '.PT.K...........'
  01 01 01 01 01 01 9a 29 a0 d0 51 84 22 30 50 98 '.......)..Q."0P.'
  36 00 98 ff 10 00 00 1c 00 00 00 fc 00 4d 44 33 '6............MD3'
  30 39 39 39 50 44 0a 20 20 20 00 00 00 fd 00 32 '0999PD.   .....2'
  4b 1f 53 0e 00 0a 20 20 20 20 20 20 00 00 00 ff 'K.S...      ....'
  00 37 30 32 30 34 33 34 36 32 0a 20 20 20 00 ea '.702043462.   ..'
Checksum: 0xea

----------------

Warnings:

Block 0, Base EDID:
  Vendor & Product Identification: The serial number is one of the known dummy values, it should probably be set to 0.

Failures:

Block 1, Base EDID:
  Unknown Extension Block.
EDID:
  Base EDID: EDID specified 0 extension block(s), but found 1 extension block(s).

EDID conformity: FAIL
