edid-decode (hex):

00 ff ff ff ff ff ff 00 2c ee 70 02 01 01 01 01
0c 1d 01 04 b5 46 27 78 3b 8e 05 ad 4f 33 b0 26
0d 50 54 23 08 00 e1 c0 d1 40 d1 00 d1 c0 b3 00
95 00 81 80 81 c0 56 5e 00 a0 a0 a0 29 50 30 20
35 00 55 50 21 00 00 1a eb 75 00 a0 a0 a0 29 50
30 20 35 00 b9 88 21 00 00 00 00 00 00 fd 00 30
4b a0 a0 1f 01 0a 20 20 20 20 20 20 00 00 00 fc
00 4b 41 4d 4e 32 37 51 46 37 54 41 0a 20 01 93

02 03 18 74 4b 90 9f 85 94 04 13 03 12 01 02 11
23 09 07 07 83 01 00 00 2a 44 80 a0 70 38 27 40
30 20 35 00 55 00 11 00 00 18 02 3a 80 18 71 38
2d 40 58 2c 96 00 56 50 21 00 00 18 01 1d 00 bc
52 d0 1e 20 b8 28 55 40 56 50 21 00 00 1e 01 1d
00 bc 52 d0 1e 20 b8 28 55 40 56 50 21 00 00 1e
8c 0a d0 90 20 40 31 20 0c 40 55 00 56 50 21 00
00 18 00 00 00 00 00 00 00 00 00 00 00 00 00 0c

00 ff ff ff ff ff ff 00 2c ee 70 02 01 01 01 01
0c 1d 01 04 b5 46 27 78 3b 8e 05 ad 4f 33 b0 26
0d 50 54 23 08 00 e1 c0 d1 40 d1 00 d1 c0 b3 00
95 00 81 80 81 c0 56 5e 00 a0 a0 a0 29 50 30 20
35 00 55 50 21 00 00 1a eb 75 00 a0 a0 a0 29 50
30 20 35 00 b9 88 21 00 00 00 00 00 00 fd 00 30
4b a0 a0 1f 01 0a 20 20 20 20 20 20 00 00 00 fc
00 4b 41 4d 4e 32 37 51 46 37 54 41 0a 20 01 93

02 03 18 74 4b 90 9f 85 94 04 13 03 12 01 02 11
23 09 07 07 83 01 00 00 2a 44 80 a0 70 38 27 40
30 20 35 00 55 00 11 00 00 18 02 3a 80 18 71 38
2d 40 58 2c 96 00 56 50 21 00 00 18 01 1d 00 bc
52 d0 1e 20 b8 28 55 40 56 50 21 00 00 1e 01 1d
00 bc 52 d0 1e 20 b8 28 55 40 56 50 21 00 00 1e
8c 0a d0 90 20 40 31 20 0c 40 55 00 56 50 21 00
00 18 00 00 00 00 00 00 00 00 00 00 00 00 00 0c

----------------

Block 0, Base EDID:
  EDID Structure Version & Revision: 1.4
  Vendor & Product Identification:
    Manufacturer: KGN
    Model: 624
    Serial Number: ...
    Made in: week 12 of 2019
  Basic Display Parameters & Features:
    Digital display
    Bits per primary color channel: 10
    DisplayPort interface
    Maximum image size: 70 cm x 39 cm
    Gamma: 2.20
    DPMS levels: Off
    Supported color formats: RGB 4:4:4, YCrCb 4:4:4, YCrCb 4:2:2
    First detailed timing includes the native pixel format and preferred refresh rate
    Display supports continuous frequencies
  Color Characteristics:
    Red  : 0.6777, 0.3085
    Green: 0.2021, 0.6894
    Blue : 0.1484, 0.0507
    White: 0.3134, 0.3291
  Established Timings I & II:
    DMT 0x04:   640x480    59.940476 Hz   4:3     31.469 kHz     25.175000 MHz
    DMT 0x08:   800x600    56.250000 Hz   4:3     35.156 kHz     36.000000 MHz
    DMT 0x09:   800x600    60.316541 Hz   4:3     37.879 kHz     40.000000 MHz
    DMT 0x10:  1024x768    60.003840 Hz   4:3     48.363 kHz     65.000000 MHz
  Standard Timings:
    DMT 0x54:  2048x1152   60.000000 Hz  16:9     72.000 kHz    162.000000 MHz (RB)
    DMT 0x49:  1920x1440   60.000000 Hz   4:3     90.000 kHz    234.000000 MHz
    DMT 0x45:  1920x1200   59.884600 Hz  16:10    74.556 kHz    193.250000 MHz
    DMT 0x52:  1920x1080   60.000000 Hz  16:9     67.500 kHz    148.500000 MHz
    DMT 0x3a:  1680x1050   59.954250 Hz  16:10    65.290 kHz    146.250000 MHz
    DMT 0x2f:  1440x900    59.887445 Hz  16:10    55.935 kHz    106.500000 MHz
    DMT 0x23:  1280x1024   60.019740 Hz   5:4     63.981 kHz    108.000000 MHz
    DMT 0x55:  1280x720    60.000000 Hz  16:9     45.000 kHz     74.250000 MHz
  Detailed Timing Descriptors:
    DTD 1:  2560x1440   59.950550 Hz  16:9     88.787 kHz    241.500000 MHz (597 mm x 336 mm)
                 Hfront   48 Hsync  32 Hback   80 Hpol P
                 Vfront    3 Vsync   5 Vback   33 Vpol N
    DTD 2:  2560x1440   74.936946 Hz  16:9    110.982 kHz    301.870000 MHz (analog composite, sync-on-green, 697 mm x 392 mm)
                 Hfront   48 Hsync  32 Hback   80 Hpol N
                 Vfront    3 Vsync   5 Vback   33 Vpol N
    Display Range Limits:
      Monitor ranges (Range Limits Only): 48-75 Hz V, 160-160 kHz H, max dotclock 310 MHz
    Display Product Name: 'KAMN27QF7TA'
  Extension blocks: 1
Checksum: 0x93

----------------

Block 1, CTA-861 Extension Block:
  Revision: 3
  Basic audio support
  Supports YCbCr 4:4:4
  Supports YCbCr 4:2:2
  Native DTDs: 4
  Video Data Block:
    VIC  16:  1920x1080   60.000000 Hz  16:9     67.500 kHz    148.500000 MHz (native)
    VIC  31:  1920x1080   50.000000 Hz  16:9     56.250 kHz    148.500000 MHz (native)
    VIC   5:  1920x1080i  60.000000 Hz  16:9     33.750 kHz     74.250000 MHz (native)
    VIC  20:  1920x1080i  50.000000 Hz  16:9     28.125 kHz     74.250000 MHz (native)
    VIC   4:  1280x720    60.000000 Hz  16:9     45.000 kHz     74.250000 MHz
    VIC  19:  1280x720    50.000000 Hz  16:9     37.500 kHz     74.250000 MHz
    VIC   3:   720x480    59.940060 Hz  16:9     31.469 kHz     27.000000 MHz
    VIC  18:   720x576    50.000000 Hz  16:9     31.250 kHz     27.000000 MHz
    VIC   1:   640x480    59.940476 Hz   4:3     31.469 kHz     25.175000 MHz
    VIC   2:   720x480    59.940060 Hz   4:3     31.469 kHz     27.000000 MHz
    VIC  17:   720x576    50.000000 Hz   4:3     31.250 kHz     27.000000 MHz
  Audio Data Block:
    Linear PCM:
      Max channels: 2
      Supported sample rates (kHz): 48 44.1 32
      Supported sample sizes (bits): 24 20 16
  Speaker Allocation Data Block:
    FL/FR - Front Left/Right
  Detailed Timing Descriptors:
    DTD 3:  1920x1080   74.972503 Hz  16:9     83.894 kHz    174.500000 MHz (341 mm x 256 mm)
                 Hfront   48 Hsync  32 Hback   80 Hpol N
                 Vfront    3 Vsync   5 Vback   31 Vpol N
    DTD 4:  1920x1080   60.000000 Hz  16:9     67.500 kHz    148.500000 MHz (598 mm x 336 mm)
                 Hfront   88 Hsync  44 Hback  148 Hpol N
                 Vfront    9 Vsync   6 Vback   30 Vpol N
    DTD 5:  1280x720    50.000000 Hz  16:9     37.500 kHz     74.250000 MHz (598 mm x 336 mm)
                 Hfront  440 Hsync  40 Hback  220 Hpol P
                 Vfront    5 Vsync   5 Vback   20 Vpol P
    DTD 6:  1280x720    50.000000 Hz  16:9     37.500 kHz     74.250000 MHz (598 mm x 336 mm)
                 Hfront  440 Hsync  40 Hback  220 Hpol P
                 Vfront    5 Vsync   5 Vback   20 Vpol P
    DTD 7:   720x576    50.000000 Hz   5:4     31.250 kHz     27.000000 MHz (598 mm x 336 mm)
                 Hfront   12 Hsync  64 Hback   68 Hpol N
                 Vfront    5 Vsync   5 Vback   39 Vpol N
Checksum: 0x0c  Unused space in Extension Block: 13 bytes

----------------

Warnings:

Block 0, Base EDID:
  Vendor & Product Identification: The serial number is one of the known dummy values, it should probably be set to 0.
Block 1, CTA-861 Extension Block:
  IT Video Formats are overscanned by default, but normally this should be underscanned.
  Video Data Block: VIC 16 and the first DTD are not identical. Is this intended?
  Detailed Timing Descriptor #3: Image size is 341x256 mm, but based on the picture AR it should be 341x191 mm.
  Detailed Timing Descriptor #4: DTD is similar but not identical to VIC 16.
  Detailed Timing Descriptor #7: Image size is 598x336 mm, but based on the picture AR it should be 420x336 mm.
  Add a Colorimetry Data Block with the sRGB colorimetry bit set to avoid interop issues.
EDID:
  Base EDID: Some timings are out of range of the Monitor Ranges:
    Horizontal Freq: 28.125 - 110.981 kHz (Monitor: 160.000 - 160.000 kHz)

Failures:

Block 0, Base EDID:
  Detailed Timing Descriptor #1: Mismatch of image size 597x336 mm vs display size 700x390 mm.
Block 1, CTA-861 Extension Block:
  Detailed Timing Descriptor #3: Mismatch of image size 341x256 mm vs display size 700x390 mm.
  Detailed Timing Descriptor #4: Mismatch of image size 598x336 mm vs display size 700x390 mm.
  Detailed Timing Descriptor #5: Mismatch of image size 598x336 mm vs display size 700x390 mm.
  Detailed Timing Descriptor #6: Mismatch of image size 598x336 mm vs display size 700x390 mm.
  Detailed Timing Descriptor #7: Mismatch of image size 598x336 mm vs display size 700x390 mm.
  Missing VCDB, needed for Set Selectable RGB Quantization to avoid interop issues.
EDID:
  Extension Block 2 started with EDID header, ignoring Extension Blocks >= 2.
  CTA-861: Native progressive timings are a mix of several resolutions.

EDID conformity: FAIL
