edid-decode (hex):

00 ff ff ff ff ff ff 00 09 e5 52 06 00 00 00 00
01 19 01 04 95 1f 11 78 02 32 40 a3 56 55 9e 26
0a 50 54 00 00 00 01 01 01 01 01 01 01 01 01 01
01 01 01 01 01 01 99 36 80 a0 70 38 28 40 30 20
36 00 35 ad 10 00 00 1a ae 2b 80 a0 70 38 28 40
30 20 36 00 35 ad 10 00 00 1a 00 00 00 fe 00 39
30 35 56 48 80 4e 56 31 34 41 32 30 00 00 00 00
00 00 41 01 9e 00 10 00 00 0a 01 0a 20 20 00 49

----------------

Block 0, Base EDID:
  EDID Structure Version & Revision: 1.4
  Vendor & Product Identification:
    Manufacturer: BOE
    Model: 1618
    Made in: week 1 of 2015
  Basic Display Parameters & Features:
    Digital display
    Bits per primary color channel: 6
    DisplayPort interface
    Maximum image size: 31 cm x 17 cm
    Gamma: 2.20
    Supported color formats: RGB 4:4:4
    First detailed timing includes the native pixel format and preferred refresh rate
  Color Characteristics:
    Red  : 0.6367, 0.3388
    Green: 0.3320, 0.6191
    Blue : 0.1494, 0.0390
    White: 0.3125, 0.3281
  Established Timings I & II: none
  Standard Timings: none
  Detailed Timing Descriptors:
    DTD 1:  1920x1080   59.997424 Hz  16:9     67.197 kHz    139.770000 MHz (309 mm x 173 mm)
                 Hfront   48 Hsync  32 Hback   80 Hpol P
                 Vfront    3 Vsync   6 Vback   31 Vpol N
    DTD 2:  1920x1080   47.999657 Hz  16:9     53.760 kHz    111.820000 MHz (309 mm x 173 mm)
                 Hfront   48 Hsync  32 Hback   80 Hpol P
                 Vfront    3 Vsync   6 Vback   31 Vpol N
    Alphanumeric Data String: '905VH.NV14A20'
    Manufacturer-Specified Display Descriptor (0x00): 00 00 00 00 41 01 9e 00 10 00 00 0a 01 0a 20 20 '....A.........  '
Checksum: 0x49

----------------

Warnings:

Block 0, Base EDID:
  Alphanumeric Data String: Non-ASCII character 0x80 at position 5, can cause problems.
  Missing Display Product Name.

EDID conformity: PASS
