edid-decode (hex):

00 ff ff ff ff ff ff 00 05 e3 56 d3 7b aa 00 00
12 0a 01 01 28 1b 14 a0 e8 06 99 a0 57 4f 98 26
10 48 4c a4 48 00 31 59 45 59 01 01 01 01 01 01
01 01 01 01 01 01 00 00 00 fd 00 32 78 1e 36 ff
20 20 20 20 20 20 20 20 00 00 00 fc 00 41 4f 43
20 44 33 35 36 0a 20 20 20 20 10 0e 80 c0 20 e0
1d 10 20 30 13 00 0e c8 10 00 00 18 10 0e 80 c0
20 e0 1d 10 20 30 13 00 0e c8 10 00 00 18 00 3f

00 ff ff ff ff ff ff 00 05 e3 56 d3 7b aa 00 00
12 0a 01 01 28 1b 14 a0 e8 06 99 a0 57 4f 98 26
10 48 4c a4 48 00 31 59 45 59 01 01 01 01 01 01
01 01 01 01 01 01 00 00 00 fd 00 32 78 1e 36 ff
20 20 20 20 20 20 20 20 00 00 00 fc 00 41 4f 43
20 44 33 35 36 0a 20 20 20 20 10 0e 80 c0 20 e0
1d 10 20 30 13 00 0e c8 10 00 00 18 10 0e 80 c0
20 e0 1d 10 20 30 13 00 0e c8 10 00 00 18 00 3f

----------------

Block 0, Base EDID:
  EDID Structure Version & Revision: 1.1
  Vendor & Product Identification:
    Manufacturer: AOC
    Model: 54102
    Serial Number: ...
    Made in: week 18 of 2000
  Basic Display Parameters & Features:
    Analog display
    Signal Level Standard: 0.714 : 0.286 : 1.000 V p-p
    Blank level equals black level
    Sync: Separate
    Maximum image size: 27 cm x 20 cm
    Gamma: 2.60
    DPMS levels: Standby Suspend Off
    RGB color display
  Color Characteristics:
    Red  : 0.6250, 0.3398
    Green: 0.3095, 0.5957
    Blue : 0.1503, 0.0634
    White: 0.2832, 0.2978
  Established Timings I & II:
    IBM     :   720x400    70.081663 Hz   9:5     31.467 kHz     28.320000 MHz
    DMT 0x04:   640x480    59.940476 Hz   4:3     31.469 kHz     25.175000 MHz
    DMT 0x06:   640x480    75.000000 Hz   4:3     37.500 kHz     31.500000 MHz
    DMT 0x0b:   800x600    75.000000 Hz   4:3     46.875 kHz     49.500000 MHz
    DMT 0x10:  1024x768    60.003840 Hz   4:3     48.363 kHz     65.000000 MHz
  Standard Timings:
    DMT 0x07:   640x480    85.008312 Hz   4:3     43.269 kHz     36.000000 MHz
    DMT 0x0c:   800x600    85.061274 Hz   4:3     53.674 kHz     56.250000 MHz
  Detailed Timing Descriptors:
    Display Range Limits:
      Monitor ranges (Unknown (0x20)): 50-120 Hz V, 30-54 kHz H, max dotclock 2550 MHz
    Display Product Name: 'AOC D356'
    DTD 1:   640x480    85.008312 Hz   4:3     43.269 kHz     36.000000 MHz (270 mm x 200 mm)
                 Hfront   32 Hsync  48 Hback  112 Hpol N
                 Vfront    1 Vsync   3 Vback   25 Vpol N
    DTD 2:   640x480    85.008312 Hz   4:3     43.269 kHz     36.000000 MHz (270 mm x 200 mm)
                 Hfront   32 Hsync  48 Hback  112 Hpol N
                 Vfront    1 Vsync   3 Vback   25 Vpol N
Checksum: 0x3f

----------------

Warnings:

Block 0, Base EDID:
  EDID Structure Version & Revision: EDID 1.1 is deprecated, do not use.
  Detailed Timing Descriptor #1: DTD is similar but not identical to DMT 0x07.
  Detailed Timing Descriptor #2: DTD is similar but not identical to DMT 0x07.

Failures:

Block 0, Base EDID:
  Display Range Limits: Unknown range class (0x20).
  Display Range Limits: Byte 11 is 0x20 instead of 0x0a.
  Detailed Timing Descriptor #1: Invalid detailed timing descriptor ordering.
  Detailed Timing Descriptor #2: Invalid detailed timing descriptor ordering.
EDID:
  Extension Block 1 started with EDID header, ignoring Extension Blocks >= 1.

EDID conformity: FAIL
