edid-decode (hex):

00 ff ff ff ff ff ff 00 30 ae 20 09 01 00 00 00
1e 1b 01 04 a5 35 1d 78 22 ec 40 a6 56 51 9c 26
10 50 54 01 08 00 01 01 01 01 01 01 01 01 01 01
01 01 01 01 01 01 02 3a 80 18 71 38 2d 40 58 2c
45 00 0f 28 21 00 00 1e 00 00 00 fd 00 32 4c 1e
50 11 00 0a 20 20 20 20 20 20 00 00 00 ff 00 4c
4d 32 33 38 57 46 32 0a 20 20 20 20 00 00 00 fc
00 4c 45 4e 2d 4d 39 32 30 7a 2d 42 0a 20 00 a9

00 ff ff ff ff ff ff 00 30 ae 20 09 01 00 00 00
1e 1b 01 04 a5 35 1d 78 22 ec 40 a6 56 51 9c 26
10 50 54 01 08 00 01 01 01 01 01 01 01 01 01 01
01 01 01 01 01 01 02 3a 80 18 71 38 2d 40 58 2c
45 00 0f 28 21 00 00 1e 00 00 00 fd 00 32 4c 1e
50 11 00 0a 20 20 20 20 20 20 00 00 00 ff 00 4c
4d 32 33 38 57 46 32 0a 20 20 20 20 00 00 00 fc
00 4c 45 4e 2d 4d 39 32 30 7a 2d 42 0a 20 00 a9

----------------

Block 0, Base EDID:
  EDID Structure Version & Revision: 1.4
  Vendor & Product Identification:
    Manufacturer: LEN
    Model: 2336
    Serial Number: ...
    Made in: week 30 of 2017
  Basic Display Parameters & Features:
    Digital display
    Bits per primary color channel: 8
    DisplayPort interface
    Maximum image size: 53 cm x 29 cm
    Gamma: 2.20
    DPMS levels: Off
    Supported color formats: RGB 4:4:4
    First detailed timing includes the native pixel format and preferred refresh rate
  Color Characteristics:
    Red  : 0.6513, 0.3378
    Green: 0.3193, 0.6093
    Blue : 0.1494, 0.0625
    White: 0.3125, 0.3281
  Established Timings I & II:
    DMT 0x09:   800x600    60.316541 Hz   4:3     37.879 kHz     40.000000 MHz
    DMT 0x10:  1024x768    60.003840 Hz   4:3     48.363 kHz     65.000000 MHz
  Standard Timings: none
  Detailed Timing Descriptors:
    DTD 1:  1920x1080   60.000000 Hz  16:9     67.500 kHz    148.500000 MHz (527 mm x 296 mm)
                 Hfront   88 Hsync  44 Hback  148 Hpol P
                 Vfront    4 Vsync   5 Vback   36 Vpol P
    Display Range Limits:
      Monitor ranges (GTF): 50-76 Hz V, 30-80 kHz H, max dotclock 170 MHz
    Display Product Serial Number: ...
    Display Product Name: 'LEN-M920z-B'
Checksum: 0xa9

----------------

Warnings:

Block 0, Base EDID:
  Vendor & Product Identification: The serial number is one of the known dummy values, it should probably be set to 0.
  Display Range Limits: GTF support is deprecated in EDID 1.4.

Failures:

Block 0, Base EDID:
  Display Range Limits: GTF is supported, but the display does not support continuous frequencies.
EDID:
  Extension Block 1 started with EDID header, ignoring Extension Blocks >= 1.

EDID conformity: FAIL
