edid-decode (hex):

00 ff ff ff ff ff ff 00 4c 83 59 39 00 00 00 00
00 17 01 04 95 1d 11 78 0a cd b5 a3 57 4c 9c 26
0c 50 54 00 00 00 01 01 01 01 01 01 01 01 01 01
01 01 01 01 01 01 d2 37 80 a2 70 38 40 40 30 20
25 00 25 a5 10 00 00 19 37 25 80 a2 70 38 40 40
30 20 25 00 25 a5 10 00 00 19 00 00 00 00 00 00
00 00 00 00 00 00 00 00 00 00 00 00 00 00 00 02
00 0c 26 ff 14 3c c8 20 0f 32 c8 00 00 00 00 bd

00 ff ff ff ff ff ff 00 4c 83 59 39 00 00 00 00
00 17 01 04 95 1d 11 78 0a cd b5 a3 57 4c 9c 26
0c 50 54 00 00 00 01 01 01 01 01 01 01 01 01 01
01 01 01 01 01 01 d2 37 80 a2 70 38 40 40 30 20
25 00 25 a5 10 00 00 19 37 25 80 a2 70 38 40 40
30 20 25 00 25 a5 10 00 00 19 00 00 00 00 00 00
00 00 00 00 00 00 00 00 00 00 00 00 00 00 00 02
00 0c 26 ff 14 3c c8 20 0f 32 c8 00 00 00 00 bd

----------------

Block 0, Base EDID:
  EDID Structure Version & Revision: 1.4
  Vendor & Product Identification:
    Manufacturer: SDC
    Model: 14681
    Made in: 2013
  Basic Display Parameters & Features:
    Digital display
    Bits per primary color channel: 6
    DisplayPort interface
    Maximum image size: 29 cm x 17 cm
    Gamma: 2.20
    Supported color formats: RGB 4:4:4, YCrCb 4:4:4
    First detailed timing includes the native pixel format and preferred refresh rate
  Color Characteristics:
    Red  : 0.6396, 0.3398
    Green: 0.2998, 0.6103
    Blue : 0.1503, 0.0498
    White: 0.3134, 0.3291
  Established Timings I & II: none
  Standard Timings: none
  Detailed Timing Descriptors:
    DTD 1:  1920x1080   59.996440 Hz  16:9     68.636 kHz    142.900000 MHz (293 mm x 165 mm)
                 Hfront   48 Hsync  32 Hback   82 Hpol N
                 Vfront    2 Vsync   5 Vback   57 Vpol N
    DTD 2:  1920x1080   39.999026 Hz  16:9     45.759 kHz     95.270000 MHz (293 mm x 165 mm)
                 Hfront   48 Hsync  32 Hback   82 Hpol N
                 Vfront    2 Vsync   5 Vback   57 Vpol N
    Empty Descriptor
    Manufacturer-Specified Display Descriptor (0x02): 00 02 00 0c 26 ff 14 3c c8 20 0f 32 c8 00 00 00 '....&..<. .2....'
Checksum: 0xbd

----------------

Warnings:

Block 0, Base EDID:
  Missing Display Product Name.

Failures:

Block 0, Base EDID:
  Empty Descriptor: Use Dummy Descriptor instead of all zeroes.
EDID:
  Extension Block 1 started with EDID header, ignoring Extension Blocks >= 1.

EDID conformity: FAIL
