edid-decode (hex):

00 ff ff ff ff ff ff 00 24 4d cb 24 01 01 01 01
2a 0f 01 03 80 26 1e 78 ea ee 95 a3 54 4c 99 26
0f 50 54 bf ef 80 81 80 81 8c 71 4f 01 01 01 01
01 01 01 01 01 01 30 2a 00 98 51 00 2a 40 30 70
13 00 78 2d 11 00 00 1e 00 00 00 fd 00 37 4c 1e
51 0e 00 0a 20 20 20 20 20 20 00 00 00 ff 00 56
52 57 4b 44 35 36 0a 20 20 20 20 20 00 00 00 fc
00 49 42 4d 20 4c 31 39 31 70 0a 20 20 20 00 af

00 ff ff ff ff ff ff 00 24 4d cb 24 01 01 01 01
2a 0f 01 03 80 26 1e 78 ea ee 95 a3 54 4c 99 26
0f 50 54 bf ef 80 81 80 81 8c 71 4f 01 01 01 01
01 01 01 01 01 01 30 2a 00 98 51 00 2a 40 30 70
13 00 78 2d 11 00 00 1e 00 00 00 fd 00 37 4c 1e
51 0e 00 0a 20 20 20 20 20 20 00 00 00 ff 00 56
52 57 4b 44 35 36 0a 20 20 20 20 20 00 00 00 fc
00 49 42 4d 20 4c 31 39 31 70 0a 20 20 20 00 af

----------------

Block 0, Base EDID:
  EDID Structure Version & Revision: 1.3
  Vendor & Product Identification:
    Manufacturer: IBM
    Model: 9419
    Serial Number: ...
    Made in: week 42 of 2005
  Basic Display Parameters & Features:
    Digital display
    Maximum image size: 38 cm x 30 cm
    Gamma: 2.20
    DPMS levels: Standby Suspend Off
    RGB color display
    First detailed timing is the preferred timing
  Color Characteristics:
    Red  : 0.6396, 0.3300
    Green: 0.2998, 0.5996
    Blue : 0.1503, 0.0595
    White: 0.3134, 0.3291
  Established Timings I & II:
    IBM     :   720x400    70.081663 Hz   9:5     31.467 kHz     28.320000 MHz
    DMT 0x04:   640x480    59.940476 Hz   4:3     31.469 kHz     25.175000 MHz
    Apple   :   640x480    66.666667 Hz   4:3     35.000 kHz     30.240000 MHz
    DMT 0x05:   640x480    72.808802 Hz   4:3     37.861 kHz     31.500000 MHz
    DMT 0x06:   640x480    75.000000 Hz   4:3     37.500 kHz     31.500000 MHz
    DMT 0x08:   800x600    56.250000 Hz   4:3     35.156 kHz     36.000000 MHz
    DMT 0x09:   800x600    60.316541 Hz   4:3     37.879 kHz     40.000000 MHz
    DMT 0x0a:   800x600    72.187572 Hz   4:3     48.077 kHz     50.000000 MHz
    DMT 0x0b:   800x600    75.000000 Hz   4:3     46.875 kHz     49.500000 MHz
    Apple   :   832x624    74.551266 Hz   4:3     49.726 kHz     57.284000 MHz
    DMT 0x10:  1024x768    60.003840 Hz   4:3     48.363 kHz     65.000000 MHz
    DMT 0x11:  1024x768    70.069359 Hz   4:3     56.476 kHz     75.000000 MHz
    DMT 0x12:  1024x768    75.028582 Hz   4:3     60.023 kHz     78.750000 MHz
    DMT 0x24:  1280x1024   75.024675 Hz   5:4     79.976 kHz    135.000000 MHz
    Apple   :  1152x870    75.061550 Hz 192:145   68.681 kHz    100.000000 MHz
  Standard Timings:
    DMT 0x23:  1280x1024   60.019740 Hz   5:4     63.981 kHz    108.000000 MHz
    GTF     :  1280x1024   72.000069 Hz   5:4     76.824 kHz    132.752000 MHz
    DMT 0x15:  1152x864    75.000000 Hz   4:3     67.500 kHz    108.000000 MHz
  Detailed Timing Descriptors:
    DTD 1:  1280x1024   60.019740 Hz   5:4     63.981 kHz    108.000000 MHz (376 mm x 301 mm)
                 Hfront   48 Hsync 112 Hback  248 Hpol P
                 Vfront    1 Vsync   3 Vback   38 Vpol P
    Display Range Limits:
      Monitor ranges (GTF): 55-76 Hz V, 30-81 kHz H, max dotclock 140 MHz
    Display Product Serial Number: ...
    Display Product Name: 'IBM L191p'
Checksum: 0xaf

----------------

Block 1, Unknown EDID Extension Block 0x00:
  00 ff ff ff ff ff ff 00 24 4d cb 24 01 01 01 01 '........$M.$....'
  2a 0f 01 03 80 26 1e 78 ea ee 95 a3 54 4c 99 26 '*....&.x....TL.&'
  0f 50 54 bf ef 80 81 80 81 8c 71 4f 01 01 01 01 '.PT.......qO....'
  01 01 01 01 01 01 30 2a 00 98 51 00 2a 40 30 70 '......0*..Q.*@0p'
  13 00 78 2d 11 00 00 1e 00 00 00 fd 00 37 4c 1e '..x-.........7L.'
  51 0e 00 0a 20 20 20 20 20 20 00 00 00 ff 00 56 'Q...      .....V'
  52 57 4b 44 35 36 0a 20 20 20 20 20 00 00 00 fc 'RWKD56.     ....'
  00 49 42 4d 20 4c 31 39 31 70 0a 20 20 20 00 af '.IBM L191p.   ..'
Checksum: 0xaf

----------------

Warnings:

Block 0, Base EDID:
  Vendor & Product Identification: The serial number is one of the known dummy values, it should probably be set to 0.

Failures:

Block 1, Base EDID:
  Unknown Extension Block.
EDID:
  Base EDID: EDID specified 0 extension block(s), but found 1 extension block(s).

EDID conformity: FAIL
