edid-decode (hex):

00 ff ff ff ff ff ff 00 36 7f 05 90 0f 00 00 00
00 0c 01 04 a5 00 00 ff 2f 00 00 a0 57 49 9b 26
10 48 4f 00 00 00 01 01 01 01 01 01 01 01 01 01
01 01 01 01 01 01 02 3a 80 18 71 38 2d 40 58 2d
36 00 00 00 00 00 00 18 00 00 00 fd 00 3c 3c ac
ac 0f 00 00 00 00 00 00 00 00 00 00 00 00 00 00
00 00 00 00 00 00 00 00 00 00 00 00 00 00 00 00
00 00 00 00 00 00 00 00 00 00 00 00 00 00 00 78

00 ff ff ff ff ff ff 00 36 7f 05 90 0f 00 00 00
00 0c 01 04 a5 00 00 ff 2f 00 00 a0 57 49 9b 26
10 48 4f 00 00 00 01 01 01 01 01 01 01 01 01 01
01 01 01 01 01 01 02 3a 80 18 71 38 2d 40 58 2d
36 00 00 00 00 00 00 18 00 00 00 fd 00 3c 3c ac
ac 0f 00 00 00 00 00 00 00 00 00 00 00 00 00 00
00 00 00 00 00 00 00 00 00 00 00 00 00 00 00 00
00 00 00 00 00 00 00 00 00 00 00 00 00 00 00 78

----------------

Block 0, Base EDID:
  EDID Structure Version & Revision: 1.4
  Vendor & Product Identification:
    Manufacturer: MS_
    Model: 36869
    Serial Number: ...
    Made in: 2002
  Basic Display Parameters & Features:
    Digital display
    Bits per primary color channel: 8
    DisplayPort interface
    Image size is variable
    Gamma is defined in an extension block
    DPMS levels: Off
    Supported color formats: RGB 4:4:4, YCrCb 4:4:4
    Default (sRGB) color space is primary color space
    First detailed timing includes the native pixel format and preferred refresh rate
    Display supports continuous frequencies
  Color Characteristics:
    Red  : 0.6250, 0.3398
    Green: 0.2851, 0.6054
    Blue : 0.1484, 0.0625
    White: 0.2812, 0.3085
  Established Timings I & II: none
  Standard Timings: none
  Detailed Timing Descriptors:
    DTD 1:  1920x1080   60.000000 Hz  16:9     67.500 kHz    148.500000 MHz
                 Hfront   88 Hsync  45 Hback  147 Hpol N
                 Vfront    3 Vsync   6 Vback   36 Vpol N
    Display Range Limits:
      Monitor ranges (GTF): 60-60 Hz V, 172-172 kHz H, max dotclock 150 MHz
    Empty Descriptor
    Empty Descriptor
Checksum: 0x78

----------------

Warnings:

Block 0, Base EDID:
  Basic Display Parameters & Features: sRGB is signaled, but the gamma != 2.2.
  Detailed Timing Descriptor #1: DTD is similar but not identical to VIC 16.
  Display Range Limits: GTF support is deprecated in EDID 1.4.
  Missing Display Product Name.
EDID:
  Base EDID: Some timings are out of range of the Monitor Ranges:
    Horizontal Freq: 67.500 - 67.500 kHz (Monitor: 172.000 - 172.000 kHz)

Failures:

Block 0, Base EDID:
  Vendor & Product Identification: Manufacturer name field contains garbage.
  Basic Display Parameters & Features: sRGB is signaled, but the chromaticities do not match.
  Display Range Limits: Byte 11 is 0x00 instead of 0x0a.
  Display Range Limits: Bytes 12-17 must be 0x20.
  Empty Descriptor: Use Dummy Descriptor instead of all zeroes.
  Empty Descriptor: Use Dummy Descriptor instead of all zeroes.
EDID:
  Extension Block 1 started with EDID header, ignoring Extension Blocks >= 1.

EDID conformity: FAIL
