edid-decode (hex):

00 ff ff ff ff ff ff 00 10 8c 00 00 61 01 00 00
16 12 01 03 08 30 1e 78 2a e5 25 a6 54 44 a1 25
14 50 54 bf ef 00 81 80 81 40 71 4f 95 00 95 0f
b3 00 01 01 01 01 21 39 90 30 62 1a 27 40 50 18
3e 11 de 2c 11 00 00 1c 00 00 00 fd 00 38 4c 1e
55 13 00 0a 20 20 20 20 20 20 00 00 00 fc 00 50
33 32 32 32 57 0a 20 20 20 20 20 20 00 00 00 ff
00 30 30 30 33 35 33 0a 20 20 20 20 20 20 00 18

00 ff ff ff ff ff ff 00 10 8c 00 00 61 01 00 00
16 12 01 03 08 30 1e 78 2a e5 25 a6 54 44 a1 25
14 50 54 bf ef 00 81 80 81 40 71 4f 95 00 95 0f
b3 00 01 01 01 01 21 39 90 30 62 1a 27 40 50 18
3e 11 de 2c 11 00 00 1c 00 00 00 fd 00 38 4c 1e
55 13 00 0a 20 20 20 20 20 20 00 00 00 fc 00 50
33 32 32 32 57 0a 20 20 20 20 20 20 00 00 00 ff
00 30 30 30 33 35 33 0a 20 20 20 20 20 20 00 18

----------------

Block 0, Base EDID:
  EDID Structure Version & Revision: 1.3
  Vendor & Product Identification:
    Manufacturer: DDL
    Model: 0
    Serial Number: ...
    Made in: week 22 of 2008
  Basic Display Parameters & Features:
    Analog display
    Signal Level Standard: 0.700 : 0.300 : 1.000 V p-p
    Blank level equals black level
    Sync: Separate
    Maximum image size: 48 cm x 30 cm
    Gamma: 2.20
    DPMS levels: Off
    RGB color display
    First detailed timing is the preferred timing
  Color Characteristics:
    Red  : 0.6513, 0.3300
    Green: 0.2666, 0.6298
    Blue : 0.1445, 0.0800
    White: 0.3134, 0.3291
  Established Timings I & II:
    IBM     :   720x400    70.081663 Hz   9:5     31.467 kHz     28.320000 MHz
    DMT 0x04:   640x480    59.940476 Hz   4:3     31.469 kHz     25.175000 MHz
    Apple   :   640x480    66.666667 Hz   4:3     35.000 kHz     30.240000 MHz
    DMT 0x05:   640x480    72.808802 Hz   4:3     37.861 kHz     31.500000 MHz
    DMT 0x06:   640x480    75.000000 Hz   4:3     37.500 kHz     31.500000 MHz
    DMT 0x08:   800x600    56.250000 Hz   4:3     35.156 kHz     36.000000 MHz
    DMT 0x09:   800x600    60.316541 Hz   4:3     37.879 kHz     40.000000 MHz
    DMT 0x0a:   800x600    72.187572 Hz   4:3     48.077 kHz     50.000000 MHz
    DMT 0x0b:   800x600    75.000000 Hz   4:3     46.875 kHz     49.500000 MHz
    Apple   :   832x624    74.551266 Hz   4:3     49.726 kHz     57.284000 MHz
    DMT 0x10:  1024x768    60.003840 Hz   4:3     48.363 kHz     65.000000 MHz
    DMT 0x11:  1024x768    70.069359 Hz   4:3     56.476 kHz     75.000000 MHz
    DMT 0x12:  1024x768    75.028582 Hz   4:3     60.023 kHz     78.750000 MHz
    DMT 0x24:  1280x1024   75.024675 Hz   5:4     79.976 kHz    135.000000 MHz
  Standard Timings:
    DMT 0x23:  1280x1024   60.019740 Hz   5:4     63.981 kHz    108.000000 MHz
    DMT 0x20:  1280x960    60.000000 Hz   4:3     60.000 kHz    108.000000 MHz
    DMT 0x15:  1152x864    75.000000 Hz   4:3     67.500 kHz    108.000000 MHz
    DMT 0x2f:  1440x900    59.887445 Hz  16:10    55.935 kHz    106.500000 MHz
    DMT 0x30:  1440x900    74.984427 Hz  16:10    70.635 kHz    136.750000 MHz
    DMT 0x3a:  1680x1050   59.954250 Hz  16:10    65.290 kHz    146.250000 MHz
  Detailed Timing Descriptors:
    DTD 1:  1680x1050   59.954250 Hz  16:10    65.290 kHz    146.250000 MHz (478 mm x 300 mm)
                 Hfront   80 Hsync 280 Hback  200 Hpol N
                 Vfront    3 Vsync  30 Vback    6 Vpol P
    Display Range Limits:
      Monitor ranges (GTF): 56-76 Hz V, 30-85 kHz H, max dotclock 190 MHz
    Display Product Name: 'P3222W'
    Display Product Serial Number: ...
Checksum: 0x18

----------------

Warnings:

Block 0, Base EDID:
  Detailed Timing Descriptor #1: DTD is similar but not identical to DMT 0x3a.

Failures:

EDID:
  Extension Block 1 started with EDID header, ignoring Extension Blocks >= 1.

EDID conformity: FAIL
