edid-decode (hex):

00 ff ff ff ff ff ff 00 3a c4 00 00 00 00 00 00
02 1a 01 04 b5 46 28 64 06 92 b0 a3 54 4c 99 26
0f 50 54 00 00 00 00 00 00 00 00 00 00 00 00 00
00 00 00 00 00 00 b0 68 00 a0 a0 40 2e 60 30 20
36 00 81 90 21 00 00 1e 00 01 01 01 01 01 01 01
01 01 01 01 01 01 01 01 01 00 00 00 00 fd 00 1e
46 1e 8c 3c 01 0a 20 20 20 20 20 20 00 00 00 fc
00 4e 56 49 44 49 41 20 56 47 58 20 0a 20 01 2e

70 12 5c 03 00 03 00 14 07 e8 00 04 ff 0e 2f 02
af 80 57 00 6f 08 59 00 07 80 09 00 03 00 14 d1
d7 00 00 ff 0f 7f 00 1f 80 1f 00 6f 08 12 00 02
80 02 00 03 00 14 80 6e 01 04 ff 13 9f 00 2f 80
1f 00 3f 0b 51 00 02 00 04 00 03 00 14 42 27 03
04 ff 1d 4f 00 07 80 1f 00 df 10 7a 00 6c 00 07
00 ac 00 00 00 00 00 00 00 00 00 00 00 00 00 00
00 00 00 00 00 00 00 00 00 00 00 00 00 00 00 90

00 ff ff ff ff ff ff 00 3a c4 00 00 00 00 00 00
02 1a 01 04 b5 46 28 64 06 92 b0 a3 54 4c 99 26
0f 50 54 00 00 00 00 00 00 00 00 00 00 00 00 00
00 00 00 00 00 00 b0 68 00 a0 a0 40 2e 60 30 20
36 00 81 90 21 00 00 1e 00 01 01 01 01 01 01 01
01 01 01 01 01 01 01 01 01 00 00 00 00 fd 00 1e
46 1e 8c 3c 01 0a 20 20 20 20 20 20 00 00 00 fc
00 4e 56 49 44 49 41 20 56 47 58 20 0a 20 01 2e

70 12 5c 03 00 03 00 14 07 e8 00 04 ff 0e 2f 02
af 80 57 00 6f 08 59 00 07 80 09 00 03 00 14 d1
d7 00 00 ff 0f 7f 00 1f 80 1f 00 6f 08 12 00 02
80 02 00 03 00 14 80 6e 01 04 ff 13 9f 00 2f 80
1f 00 3f 0b 51 00 02 00 04 00 03 00 14 42 27 03
04 ff 1d 4f 00 07 80 1f 00 df 10 7a 00 6c 00 07
00 ac 00 00 00 00 00 00 00 00 00 00 00 00 00 00
00 00 00 00 00 00 00 00 00 00 00 00 00 00 00 90

----------------

Block 0, Base EDID:
  EDID Structure Version & Revision: 1.4
  Vendor & Product Identification:
    Manufacturer: NVD
    Model: 0
    Made in: week 2 of 2016
  Basic Display Parameters & Features:
    Digital display
    Bits per primary color channel: 10
    DisplayPort interface
    Maximum image size: 70 cm x 40 cm
    Gamma: 2.00
    Supported color formats: RGB 4:4:4
    Default (sRGB) color space is primary color space
    First detailed timing includes the native pixel format and preferred refresh rate
  Color Characteristics:
    Red  : 0.6386, 0.3291
    Green: 0.2968, 0.5996
    Blue : 0.1503, 0.0615
    White: 0.3125, 0.3281
  Established Timings I & II: none
  Standard Timings:
  Detailed Timing Descriptors:
    DTD 1:  2560x1600   59.859910 Hz  16:10    98.529 kHz    268.000000 MHz (641 mm x 400 mm)
                 Hfront   48 Hsync  32 Hback   80 Hpol P
                 Vfront    3 Vsync   6 Vback   37 Vpol P
    Detailed mode: 00 01 01 01 01 01 01 01 01 01 01 01 01 01 01 01 01 00 '..................'
    Display Range Limits:
      Monitor ranges (Range Limits Only): 30-70 Hz V, 30-140 kHz H, max dotclock 600 MHz
    Display Product Name: 'NVIDIA VGX '
  Extension blocks: 1
Checksum: 0x2e

----------------

Block 1, DisplayID Extension Block:
  Version: 1.2
  Extension Count: 0
  Display Product Type: Standalone display device
  Video Timing Modes Type 1 - Detailed Timings Data Block:
    DTD:  3840x2160   60.000000 Hz  16:9    135.000 kHz    594.000000 MHz (aspect 16:9, no 3D stereo)
               Hfront  176 Hsync  88 Hback  296 Hpol P
               Vfront    8 Vsync  10 Vback   72 Vpol P
  Video Timing Modes Type 1 - Detailed Timings Data Block:
    DTD:  4096x2160   60.027622 Hz   1:1    130.800 kHz    552.500000 MHz (aspect 1:1, no 3D stereo)
               Hfront   32 Hsync  32 Hback   64 Hpol P
               Vfront    3 Vsync   3 Vback   13 Vpol P
  Video Timing Modes Type 1 - Detailed Timings Data Block:
    DTD:  5120x2880   59.992864 Hz  16:9    177.699 kHz    938.250000 MHz (aspect 16:9, no 3D stereo)
               Hfront   48 Hsync  32 Hback   80 Hpol P
               Vfront    3 Vsync   5 Vback   74 Vpol N
  Video Timing Modes Type 1 - Detailed Timings Data Block:
    DTD:  7680x4320   59.939938 Hz  16:9    266.313 kHz   2066.590000 MHz (aspect 16:9, no 3D stereo)
               Hfront    8 Hsync  32 Hback   40 Hpol P
               Vfront  109 Vsync   8 Vback    6 Vpol N
  Checksum: 0xac
Checksum: 0x90  Unused space in Extension Block: 29 bytes

----------------

Warnings:

Block 0, Base EDID:
  Basic Display Parameters & Features: sRGB is signaled, but the gamma != 2.2.
EDID:
  Base EDID: Some timings are out of range of the Monitor Ranges:
    Horizontal Freq: 98.529 - 266.313 kHz (Monitor: 30.000 - 140.000 kHz)
    Maximum Clock: 2066.590 MHz (Monitor: 600.000 MHz)

Failures:

Block 0, Base EDID:
  Basic Display Parameters & Features: sRGB is signaled, but the chromaticities do not match.
  Standard Timings: Use 0x0101 as the invalid Standard Timings code, not 0x0000.
  Standard Timings: Use 0x0101 as the invalid Standard Timings code, not 0x0000.
  Standard Timings: Use 0x0101 as the invalid Standard Timings code, not 0x0000.
  Standard Timings: Use 0x0101 as the invalid Standard Timings code, not 0x0000.
  Standard Timings: Use 0x0101 as the invalid Standard Timings code, not 0x0000.
  Standard Timings: Use 0x0101 as the invalid Standard Timings code, not 0x0000.
  Standard Timings: Use 0x0101 as the invalid Standard Timings code, not 0x0000.
  Standard Timings: Use 0x0101 as the invalid Standard Timings code, not 0x0000.
  Detailed Timing Descriptor #2: Pixelclock < 10 MHz, assuming invalid data 0x00 0x01.
  Display Product Name: One or more trailing spaces before newline.
EDID:
  Extension Block 2 started with EDID header, ignoring Extension Blocks >= 2.
  DisplayID: Missing DisplayID Display Parameters Data Block.
  DisplayID: DisplayID expects at least one preferred timing.

EDID conformity: FAIL
