edid-decode (hex):

00 ff ff ff ff ff ff 00 12 42 41 41 f9 42 00 00
30 0a 01 00 08 20 18 64 e8 e0 58 a1 54 46 9b 24
10 48 4c a1 08 00 31 40 45 40 61 40 81 80 01 01
01 01 01 01 01 01 f0 0a 80 a0 20 e0 1a 10 10 40
13 00 40 f0 10 00 00 18 f0 0a 80 e0 20 e0 32 10
20 60 86 00 40 f0 10 00 00 00 00 00 00 fc 00 43
52 54 74 6f 4c 43 44 2d 31 0a 20 20 00 00 00 fd
00 3c 3c 1e 32 ff 00 0a 20 20 20 20 20 20 00 5d

00 ff ff ff ff ff ff 00 12 42 41 41 f9 42 00 00
30 0a 01 00 08 20 18 64 e8 e0 58 a1 54 46 9b 24
10 48 4c a1 08 00 31 40 45 40 61 40 81 80 01 01
01 01 01 01 01 01 f0 0a 80 a0 20 e0 1a 10 10 40
13 00 40 f0 10 00 00 18 f0 0a 80 e0 20 e0 32 10
20 60 86 00 40 f0 10 00 00 00 00 00 00 fc 00 43
52 54 74 6f 4c 43 44 2d 31 0a 20 20 00 00 00 fd
00 3c 3c 1e 32 ff 00 0a 20 20 20 20 20 20 00 5d

----------------

Block 0, Base EDID:
  EDID Structure Version & Revision: 1.0
  Vendor & Product Identification:
    Manufacturer: DRB
    Model: 16705
    Serial Number: ...
    Made in: week 48 of 2000
  Basic Display Parameters & Features:
    Analog display
    Signal Level Standard: 0.700 : 0.300 : 1.000 V p-p
    Blank level equals black level
    Sync: Separate
    Maximum image size: 32 cm x 24 cm
    Gamma: 2.00
    DPMS levels: Standby Suspend Off
    RGB color display
  Color Characteristics:
    Red  : 0.6318, 0.3300
    Green: 0.2734, 0.6054
    Blue : 0.1416, 0.0634
    White: 0.2832, 0.2968
  Established Timings I & II:
    IBM     :   720x400    70.081663 Hz   9:5     31.467 kHz     28.320000 MHz
    DMT 0x04:   640x480    59.940476 Hz   4:3     31.469 kHz     25.175000 MHz
    DMT 0x09:   800x600    60.316541 Hz   4:3     37.879 kHz     40.000000 MHz
    DMT 0x10:  1024x768    60.003840 Hz   4:3     48.363 kHz     65.000000 MHz
  Standard Timings:
    DMT 0x04:   640x480    59.940476 Hz   4:3     31.469 kHz     25.175000 MHz
    DMT 0x09:   800x600    60.316541 Hz   4:3     37.879 kHz     40.000000 MHz
    DMT 0x10:  1024x768    60.003840 Hz   4:3     48.363 kHz     65.000000 MHz
    DMT 0x23:  1280x1024   60.019740 Hz   5:4     63.981 kHz    108.000000 MHz
  Detailed Timing Descriptors:
    DTD 1:   640x480    69.169960 Hz   4:3     35.000 kHz     28.000000 MHz (320 mm x 240 mm)
                 Hfront   16 Hsync  64 Hback   80 Hpol N
                 Vfront    1 Vsync   3 Vback   22 Vpol N
    DTD 2:   640x480    61.146052 Hz   4:3     32.407 kHz     28.000000 MHz (analog composite, sync-on-green, 320 mm x 240 mm)
                 Hfront   32 Hsync  96 Hback   96 Hpol N
                 Vfront    8 Vsync   6 Vback   36 Vpol N
    Display Product Name: 'CRTtoLCD-1'
    Display Range Limits:
      Monitor ranges (GTF): 60-60 Hz V, 30-50 kHz H, max dotclock 2550 MHz
Checksum: 0x5d

----------------

Warnings:

Block 0, Base EDID:
  EDID Structure Version & Revision: EDID 1.0 is deprecated, do not use.
EDID:
  Base EDID: Some timings are out of range of the Monitor Ranges:
    Vertical Freq: 59.940 - 70.082 Hz (Monitor: 60.000 - 60.000 Hz)
    Horizontal Freq: 31.466 - 63.981 kHz (Monitor: 30.000 - 50.000 kHz)

Failures:

Block 0, Base EDID:
  Display Descriptor #3: Has descriptor blocks other than detailed timings.
  Display Descriptor #4: Has descriptor blocks other than detailed timings.
EDID:
  Extension Block 1 started with EDID header, ignoring Extension Blocks >= 1.

EDID conformity: FAIL
