edid-decode (hex):

00 ff ff ff ff ff ff 00 30 64 e3 58 33 34 36 39
25 10 01 03 80 1a 10 78 0a 87 ae 99 57 4f 8c 26
22 50 54 00 00 00 01 01 01 01 01 01 01 01 01 01
01 01 01 01 01 01 90 1a 00 80 50 20 05 30 10 30
12 00 05 a3 10 00 00 18 00 00 00 00 00 00 00 00
00 00 00 00 00 00 00 00 00 00 00 00 00 fe 00 54
4d 33 31 35 a0 31 32 31 45 58 50 44 00 00 00 fe
00 29 39 44 4d 6d 8f b0 f1 01 01 0a 20 20 00 98

00 ff ff ff ff ff ff 00 30 64 e3 58 33 34 36 39
25 10 01 03 80 1a 10 78 0a 87 ae 99 57 4f 8c 26
22 50 54 00 00 00 01 01 01 01 01 01 01 01 01 01
01 01 01 01 01 01 90 1a 00 80 50 20 05 30 10 30
12 00 05 a3 10 00 00 18 00 00 00 00 00 00 00 00
00 00 00 00 00 00 00 00 00 00 00 00 00 fe 00 54
4d 33 31 35 a0 31 32 31 45 58 50 44 00 00 00 fe
00 29 39 44 4d 6d 8f b0 f1 01 01 0a 20 20 00 98

----------------

Block 0, Base EDID:
  EDID Structure Version & Revision: 1.3
  Vendor & Product Identification:
    Manufacturer: LCD
    Model: 22755
    Serial Number: ...
    Made in: week 37 of 2006
  Basic Display Parameters & Features:
    Digital display
    Maximum image size: 26 cm x 16 cm
    Gamma: 2.20
    RGB color display
    First detailed timing is the preferred timing
  Color Characteristics:
    Red  : 0.5996, 0.3398
    Green: 0.3095, 0.5498
    Blue : 0.1503, 0.1347
    White: 0.3154, 0.3300
  Established Timings I & II: none
  Standard Timings: none
  Detailed Timing Descriptors:
    DTD 1:  1280x800    59.994353 Hz  16:10    48.295 kHz     68.000000 MHz (261 mm x 163 mm)
                 Hfront   16 Hsync  48 Hback   64 Hpol N
                 Vfront    1 Vsync   2 Vback    2 Vpol N
    Empty Descriptor
    Alphanumeric Data String: 'TM315.121EXPD'
    Alphanumeric Data String: ')9DMm.....'
Checksum: 0x98

----------------

Block 1, Unknown EDID Extension Block 0x00:
  00 ff ff ff ff ff ff 00 30 64 e3 58 33 34 36 39 '........0d.X3469'
  25 10 01 03 80 1a 10 78 0a 87 ae 99 57 4f 8c 26 '%......x....WO.&'
  22 50 54 00 00 00 01 01 01 01 01 01 01 01 01 01 '"PT.............'
  01 01 01 01 01 01 90 1a 00 80 50 20 05 30 10 30 '..........P .0.0'
  12 00 05 a3 10 00 00 18 00 00 00 00 00 00 00 00 '................'
  00 00 00 00 00 00 00 00 00 00 00 00 00 fe 00 54 '...............T'
  4d 33 31 35 a0 31 32 31 45 58 50 44 00 00 00 fe 'M315.121EXPD....'
  00 29 39 44 4d 6d 8f b0 f1 01 01 0a 20 20 00 98 '.)9DMm......  ..'
Checksum: 0x98

----------------

Warnings:

Block 0, Base EDID:
  Alphanumeric Data String: Non-ASCII character 0xa0 at position 5, can cause problems.
  Alphanumeric Data String: Non-ASCII character 0x8f at position 5, can cause problems.
  Alphanumeric Data String: Non-ASCII character 0xb0 at position 6, can cause problems.
  Alphanumeric Data String: Non-ASCII character 0xf1 at position 7, can cause problems.
  Alphanumeric Data String: Non-ASCII character 0x01 at position 8, can cause problems.
  Alphanumeric Data String: Non-ASCII character 0x01 at position 9, can cause problems.

Failures:

Block 0, Base EDID:
  Empty Descriptor: Use Dummy Descriptor instead of all zeroes.
  Missing Display Product Name.
  Missing Display Range Limits Descriptor.
Block 1, Base EDID:
  Unknown Extension Block.
EDID:
  Base EDID: EDID specified 0 extension block(s), but found 1 extension block(s).

EDID conformity: FAIL
