edid-decode (hex):

00 ff ff ff ff ff ff 00 21 63 05 3d 00 00 00 00
00 20 01 04 a5 22 13 78 e3 83 03 a2 53 46 8e 22
20 4e 59 00 00 00 01 01 01 01 01 01 01 01 01 01
01 01 01 01 01 01 98 3b 80 10 71 38 50 40 30 20
36 00 58 c2 10 00 00 19 00 00 00 00 00 00 00 00
00 00 00 00 00 00 00 00 00 00 00 00 00 fe 00 48
4b 43 20 4d 59 20 20 20 20 0a 20 20 00 00 00 fe
00 50 42 31 35 36 43 53 30 32 27 31 20 20 00 19

00 ff ff ff ff ff ff 00 21 63 05 3d 00 00 00 00
00 20 01 04 a5 22 13 78 e3 83 03 a2 53 46 8e 22
20 4e 59 00 00 00 01 01 01 01 01 01 01 01 01 01
01 01 01 01 01 01 98 3b 80 10 71 38 50 40 30 20
36 00 58 c2 10 00 00 19 00 00 00 00 00 00 00 00
00 00 00 00 00 00 00 00 00 00 00 00 00 fe 00 48
4b 43 20 4d 59 20 20 20 20 0a 20 20 00 00 00 fe
00 50 42 31 35 36 43 53 30 32 27 31 20 20 00 19

----------------

Block 0, Base EDID:
  EDID Structure Version & Revision: 1.4
  Vendor & Product Identification:
    Manufacturer: HKC
    Model: 15621
    Made in: 2022
  Basic Display Parameters & Features:
    Digital display
    Bits per primary color channel: 8
    DisplayPort interface
    Maximum image size: 34 cm x 19 cm
    Gamma: 2.20
    DPMS levels: Standby Suspend Off
    Supported color formats: RGB 4:4:4
    First detailed timing includes the native pixel format and preferred refresh rate
    Display supports continuous frequencies
  Color Characteristics:
    Red  : 0.6347, 0.3242
    Green: 0.2734, 0.5576
    Blue : 0.1328, 0.1250
    White: 0.3046, 0.3505
  Established Timings I & II: none
  Standard Timings: none
  Detailed Timing Descriptors:
    DTD 1:  1920x1080   59.998742 Hz  16:9     69.599 kHz    152.560000 MHz (344 mm x 194 mm)
                 Hfront   48 Hsync  32 Hback  192 Hpol N
                 Vfront    3 Vsync   6 Vback   71 Vpol N
    Empty Descriptor
    Alphanumeric Data String: 'HKC MY    '
    Alphanumeric Data String: 'PB156CS02'1  '
Checksum: 0x19

----------------

Block 1, Unknown EDID Extension Block 0x00:
  00 ff ff ff ff ff ff 00 21 63 05 3d 00 00 00 00 '........!c.=....'
  00 20 01 04 a5 22 13 78 e3 83 03 a2 53 46 8e 22 '. ...".x....SF."'
  20 4e 59 00 00 00 01 01 01 01 01 01 01 01 01 01 ' NY.............'
  01 01 01 01 01 01 98 3b 80 10 71 38 50 40 30 20 '.......;..q8P@0 '
  36 00 58 c2 10 00 00 19 00 00 00 00 00 00 00 00 '6.X.............'
  00 00 00 00 00 00 00 00 00 00 00 00 00 fe 00 48 '...............H'
  4b 43 20 4d 59 20 20 20 20 0a 20 20 00 00 00 fe 'KC MY    .  ....'
  00 50 42 31 35 36 43 53 30 32 27 31 20 20 00 19 '.PB156CS02'1  ..'
Checksum: 0x19

----------------

Warnings:

Block 0, Base EDID:
  Missing Display Product Name.

Failures:

Block 0, Base EDID:
  Empty Descriptor: Use Dummy Descriptor instead of all zeroes.
  Alphanumeric Data String: One or more trailing spaces before newline.
  Alphanumeric Data String: No newline, but one or more trailing spaces.
  Missing Display Range Limits Descriptor.
Block 1, Base EDID:
  Unknown Extension Block.
EDID:
  Base EDID: EDID specified 0 extension block(s), but found 1 extension block(s).

EDID conformity: FAIL
