edid-decode (hex):

00 ff ff ff ff ff ff 00 21 63 60 21 01 00 00 00
30 15 01 03 80 30 1b 78 ea b1 a5 a1 58 4f 95 26
16 50 54 af cf 00 81 80 81 8a b3 00 95 00 81 00
81 0f 81 c0 01 01 bc 34 00 98 51 00 2a 40 10 90
13 00 68 0e 11 00 00 1e 02 3a 80 18 71 38 2d 40
58 2c 45 00 dd 0c 11 00 00 1a 00 00 00 fd 00 38
4b 1e 53 12 00 0a 20 20 20 20 20 20 00 00 00 fc
00 0a 20 20 20 20 20 20 20 20 20 20 20 20 00 9c

00 ff ff ff ff ff ff 00 21 63 60 21 01 00 00 00
30 15 01 03 80 30 1b 78 ea b1 a5 a1 58 4f 95 26
16 50 54 af cf 00 81 80 81 8a b3 00 95 00 81 00
81 0f 81 c0 01 01 bc 34 00 98 51 00 2a 40 10 90
13 00 68 0e 11 00 00 1e 02 3a 80 18 71 38 2d 40
58 2c 45 00 dd 0c 11 00 00 1a 00 00 00 fd 00 38
4b 1e 53 12 00 0a 20 20 20 20 20 20 00 00 00 fc
00 0a 20 20 20 20 20 20 20 20 20 20 20 20 00 9c

----------------

Block 0, Base EDID:
  EDID Structure Version & Revision: 1.3
  Vendor & Product Identification:
    Manufacturer: HKC
    Model: 8544
    Serial Number: ...
    Made in: week 48 of 2011
  Basic Display Parameters & Features:
    Digital display
    Maximum image size: 48 cm x 27 cm
    Gamma: 2.20
    DPMS levels: Standby Suspend Off
    RGB color display
    First detailed timing is the preferred timing
  Color Characteristics:
    Red  : 0.6308, 0.3466
    Green: 0.3085, 0.5830
    Blue : 0.1503, 0.0878
    White: 0.3134, 0.3291
  Established Timings I & II:
    IBM     :   720x400    70.081663 Hz   9:5     31.467 kHz     28.320000 MHz
    DMT 0x04:   640x480    59.940476 Hz   4:3     31.469 kHz     25.175000 MHz
    DMT 0x05:   640x480    72.808802 Hz   4:3     37.861 kHz     31.500000 MHz
    DMT 0x06:   640x480    75.000000 Hz   4:3     37.500 kHz     31.500000 MHz
    DMT 0x08:   800x600    56.250000 Hz   4:3     35.156 kHz     36.000000 MHz
    DMT 0x09:   800x600    60.316541 Hz   4:3     37.879 kHz     40.000000 MHz
    DMT 0x0a:   800x600    72.187572 Hz   4:3     48.077 kHz     50.000000 MHz
    DMT 0x0b:   800x600    75.000000 Hz   4:3     46.875 kHz     49.500000 MHz
    DMT 0x10:  1024x768    60.003840 Hz   4:3     48.363 kHz     65.000000 MHz
    DMT 0x11:  1024x768    70.069359 Hz   4:3     56.476 kHz     75.000000 MHz
    DMT 0x12:  1024x768    75.028582 Hz   4:3     60.023 kHz     78.750000 MHz
    DMT 0x24:  1280x1024   75.024675 Hz   5:4     79.976 kHz    135.000000 MHz
  Standard Timings:
    DMT 0x23:  1280x1024   60.019740 Hz   5:4     63.981 kHz    108.000000 MHz
    GTF     :  1280x1024   69.999805 Hz   5:4     74.620 kHz    128.943000 MHz
    DMT 0x3a:  1680x1050   59.954250 Hz  16:10    65.290 kHz    146.250000 MHz
    DMT 0x2f:  1440x900    59.887445 Hz  16:10    55.935 kHz    106.500000 MHz
    DMT 0x1c:  1280x800    59.810326 Hz  16:10    49.702 kHz     83.500000 MHz
    DMT 0x1d:  1280x800    74.934142 Hz  16:10    62.795 kHz    106.500000 MHz
    DMT 0x55:  1280x720    60.000000 Hz  16:9     45.000 kHz     74.250000 MHz
  Detailed Timing Descriptors:
    DTD 1:  1280x1024   75.024675 Hz   5:4     79.976 kHz    135.000000 MHz (360 mm x 270 mm)
                 Hfront   16 Hsync 144 Hback  248 Hpol P
                 Vfront    1 Vsync   3 Vback   38 Vpol P
    DTD 2:  1920x1080   60.000000 Hz  16:9     67.500 kHz    148.500000 MHz (477 mm x 268 mm)
                 Hfront   88 Hsync  44 Hback  148 Hpol P
                 Vfront    4 Vsync   5 Vback   36 Vpol N
    Display Range Limits:
      Monitor ranges (GTF): 56-75 Hz V, 30-83 kHz H, max dotclock 180 MHz
    Display Product Name: ''
Checksum: 0x9c

----------------

Block 1, Unknown EDID Extension Block 0x00:
  00 ff ff ff ff ff ff 00 21 63 60 21 01 00 00 00 '........!c`!....'
  30 15 01 03 80 30 1b 78 ea b1 a5 a1 58 4f 95 26 '0....0.x....XO.&'
  16 50 54 af cf 00 81 80 81 8a b3 00 95 00 81 00 '.PT.............'
  81 0f 81 c0 01 01 bc 34 00 98 51 00 2a 40 10 90 '.......4..Q.*@..'
  13 00 68 0e 11 00 00 1e 02 3a 80 18 71 38 2d 40 '..h......:..q8-@'
  58 2c 45 00 dd 0c 11 00 00 1a 00 00 00 fd 00 38 'X,E............8'
  4b 1e 53 12 00 0a 20 20 20 20 20 20 00 00 00 fc 'K.S...      ....'
  00 0a 20 20 20 20 20 20 20 20 20 20 20 20 00 9c '..            ..'
Checksum: 0x9c

----------------

Warnings:

Block 0, Base EDID:
  Vendor & Product Identification: The serial number is one of the known dummy values, it should probably be set to 0.
  Detailed Timing Descriptor #1: Image size is 360x270 mm, but based on the picture AR it should be 360x288 mm.
  Detailed Timing Descriptor #2: DTD is similar but not identical to VIC 16.

Failures:

Block 0, Base EDID:
  Display Product Name: Empty string.
Block 1, Base EDID:
  Unknown Extension Block.
EDID:
  Base EDID: EDID specified 0 extension block(s), but found 1 extension block(s).

EDID conformity: FAIL
