edid-decode (hex):

00 ff ff ff ff ff ff 00 3a d4 3a 62 00 00 00 00
1c 0e 01 04 a5 26 1e 78 e0 2c 9d a6 58 4a 9a 26
21 52 56 bf ef 80 81 80 81 8a 81 8c 71 4f 45 4a
01 01 01 01 01 01 bc 34 00 98 51 00 2a 40 30 70
13 00 7c 2c 11 00 00 06 d6 09 80 a0 20 5e 63 10
10 60 52 08 7c 2c 11 00 00 02 00 00 00 fd 00 32
4b 1e 50 0e 00 0a 20 20 20 20 20 20 00 00 00 fc
00 4e 6f 76 61 74 65 6b 20 20 36 32 33 41 00 dc

00 ff ff ff ff ff ff 00 3a d4 3a 62 00 00 00 00
1c 0e 01 04 a5 26 1e 78 e0 2c 9d a6 58 4a 9a 26
21 52 56 bf ef 80 81 80 81 8a 81 8c 71 4f 45 4a
01 01 01 01 01 01 bc 34 00 98 51 00 2a 40 30 70
13 00 7c 2c 11 00 00 06 d6 09 80 a0 20 5e 63 10
10 60 52 08 7c 2c 11 00 00 02 00 00 00 fd 00 32
4b 1e 50 0e 00 0a 20 20 20 20 20 20 00 00 00 fc
00 4e 6f 76 61 74 65 6b 20 20 36 32 33 41 00 dc

----------------

Block 0, Base EDID:
  EDID Structure Version & Revision: 1.4
  Vendor & Product Identification:
    Manufacturer: NVT
    Model: 25146
    Made in: week 28 of 2004
  Basic Display Parameters & Features:
    Digital display
    Bits per primary color channel: 8
    DisplayPort interface
    Maximum image size: 38 cm x 30 cm
    Gamma: 2.20
    DPMS levels: Standby Suspend Off
    Supported color formats: RGB 4:4:4
    First detailed timing does not include the native pixel format and preferred refresh rate
  Color Characteristics:
    Red  : 0.6484, 0.3457
    Green: 0.2919, 0.6015
    Blue : 0.1503, 0.1298
    White: 0.3232, 0.3369
  Established Timings I & II:
    IBM     :   720x400    70.081663 Hz   9:5     31.467 kHz     28.320000 MHz
    DMT 0x04:   640x480    59.940476 Hz   4:3     31.469 kHz     25.175000 MHz
    Apple   :   640x480    66.666667 Hz   4:3     35.000 kHz     30.240000 MHz
    DMT 0x05:   640x480    72.808802 Hz   4:3     37.861 kHz     31.500000 MHz
    DMT 0x06:   640x480    75.000000 Hz   4:3     37.500 kHz     31.500000 MHz
    DMT 0x08:   800x600    56.250000 Hz   4:3     35.156 kHz     36.000000 MHz
    DMT 0x09:   800x600    60.316541 Hz   4:3     37.879 kHz     40.000000 MHz
    DMT 0x0a:   800x600    72.187572 Hz   4:3     48.077 kHz     50.000000 MHz
    DMT 0x0b:   800x600    75.000000 Hz   4:3     46.875 kHz     49.500000 MHz
    Apple   :   832x624    74.551266 Hz   4:3     49.726 kHz     57.284000 MHz
    DMT 0x10:  1024x768    60.003840 Hz   4:3     48.363 kHz     65.000000 MHz
    DMT 0x11:  1024x768    70.069359 Hz   4:3     56.476 kHz     75.000000 MHz
    DMT 0x12:  1024x768    75.028582 Hz   4:3     60.023 kHz     78.750000 MHz
    DMT 0x24:  1280x1024   75.024675 Hz   5:4     79.976 kHz    135.000000 MHz
    Apple   :  1152x870    75.061550 Hz 192:145   68.681 kHz    100.000000 MHz
  Standard Timings:
    DMT 0x23:  1280x1024   60.019740 Hz   5:4     63.981 kHz    108.000000 MHz
    GTF     :  1280x1024   69.999805 Hz   5:4     74.620 kHz    128.943000 MHz
    GTF     :  1280x1024   72.000069 Hz   5:4     76.824 kHz    132.752000 MHz
    DMT 0x15:  1152x864    75.000000 Hz   4:3     67.500 kHz    108.000000 MHz
    GTF     :   800x600    70.000000 Hz   4:3     43.750 kHz     45.500000 MHz
  Detailed Timing Descriptors:
    DTD 1:  1280x1024   75.024675 Hz   5:4     79.976 kHz    135.000000 MHz (analog composite, serrate, 380 mm x 300 mm)
                 Hfront   48 Hsync 112 Hback  248 Hpol N
                 Vfront    1 Vsync   3 Vback   38 Vpol N
    DTD 2:   640x350    70.100223 Hz  64:35    31.475 kHz     25.180000 MHz (analog composite, 380 mm x 300 mm)
                 Hfront   16 Hsync  96 Hback   48 Hpol N
                 Vfront   37 Vsync   2 Vback   60 Vpol N
    Display Range Limits:
      Monitor ranges (GTF): 50-75 Hz V, 30-80 kHz H, max dotclock 140 MHz
    Display Product Name: 'Novatek  623A'
Checksum: 0xdc

----------------

Block 1, Unknown EDID Extension Block 0x00:
  00 ff ff ff ff ff ff 00 3a d4 3a 62 00 00 00 00 '........:.:b....'
  1c 0e 01 04 a5 26 1e 78 e0 2c 9d a6 58 4a 9a 26 '.....&.x.,..XJ.&'
  21 52 56 bf ef 80 81 80 81 8a 81 8c 71 4f 45 4a '!RV.........qOEJ'
  01 01 01 01 01 01 bc 34 00 98 51 00 2a 40 30 70 '.......4..Q.*@0p'
  13 00 7c 2c 11 00 00 06 d6 09 80 a0 20 5e 63 10 '..|,........ ^c.'
  10 60 52 08 7c 2c 11 00 00 02 00 00 00 fd 00 32 '.`R.|,.........2'
  4b 1e 50 0e 00 0a 20 20 20 20 20 20 00 00 00 fc 'K.P...      ....'
  00 4e 6f 76 61 74 65 6b 20 20 36 32 33 41 00 dc '.Novatek  623A..'
Checksum: 0xdc

----------------

Warnings:

Block 0, Base EDID:
  Detailed Timing Descriptor #1: DTD is similar but not identical to DMT 0x24.
  Detailed Timing Descriptor #2: Image size is 380x300 mm, but based on the picture AR it should be 380x207 mm.
  Display Range Limits: GTF support is deprecated in EDID 1.4.
EDID:
  No Native Video Resolution was defined.

Failures:

Block 0, Base EDID:
  Display Range Limits: GTF is supported, but the display does not support continuous frequencies.
Block 1, Base EDID:
  Unknown Extension Block.
EDID:
  Base EDID: EDID specified 0 extension block(s), but found 1 extension block(s).

EDID conformity: FAIL
