edid-decode (hex):

00 ff ff ff ff ff ff 00 48 24 00 00 00 00 00 00
0a 1b 01 03 08 5e 35 00 0a d7 a5 a2 59 4a 96 24
14 50 54 a3 08 00 a9 c0 01 01 01 01 01 01 01 01
01 01 01 01 01 01 02 3a 80 18 71 38 2d 40 58 2c
45 00 3f 43 21 00 00 1a 66 21 56 aa 51 00 1e 30
46 8f 33 00 13 29 21 00 00 1e 00 00 00 fc 00 4c
45 44 54 56 0a 20 20 20 20 20 20 20 00 00 00 00
62 84 22 30 58 a8 35 00 f8 c2 21 00 00 00 00 b1

00 ff ff ff ff ff ff 00 48 24 00 00 00 00 00 00
0a 1b 01 03 08 5e 35 00 0a d7 a5 a2 59 4a 96 24
14 50 54 a3 08 00 a9 c0 01 01 01 01 01 01 01 01
01 01 01 01 01 01 02 3a 80 18 71 38 2d 40 58 2c
45 00 3f 43 21 00 00 1a 66 21 56 aa 51 00 1e 30
46 8f 33 00 13 29 21 00 00 1e 00 00 00 fc 00 4c
45 44 54 56 0a 20 20 20 20 20 20 20 00 00 00 00
62 84 22 30 58 a8 35 00 f8 c2 21 00 00 00 00 b1

----------------

Block 0, Base EDID:
  EDID Structure Version & Revision: 1.3
  Vendor & Product Identification:
    Manufacturer: RAD
    Model: 0
    Made in: week 10 of 2017
  Basic Display Parameters & Features:
    Analog display
    Signal Level Standard: 0.700 : 0.300 : 1.000 V p-p
    Blank level equals black level
    Sync: Separate
    Maximum image size: 94 cm x 53 cm
    Gamma: 1.00
    RGB color display
    First detailed timing is the preferred timing
  Color Characteristics:
    Red  : 0.6357, 0.3486
    Green: 0.2900, 0.5888
    Blue : 0.1425, 0.0800
    White: 0.3134, 0.3291
  Established Timings I & II:
    IBM     :   720x400    70.081663 Hz   9:5     31.467 kHz     28.320000 MHz
    DMT 0x04:   640x480    59.940476 Hz   4:3     31.469 kHz     25.175000 MHz
    DMT 0x08:   800x600    56.250000 Hz   4:3     35.156 kHz     36.000000 MHz
    DMT 0x09:   800x600    60.316541 Hz   4:3     37.879 kHz     40.000000 MHz
    DMT 0x10:  1024x768    60.003840 Hz   4:3     48.363 kHz     65.000000 MHz
  Standard Timings:
    DMT 0x53:  1600x900    60.000000 Hz  16:9     60.000 kHz    108.000000 MHz (RB)
  Detailed Timing Descriptors:
    DTD 1:  1920x1080   60.000000 Hz  16:9     67.500 kHz    148.500000 MHz (575 mm x 323 mm)
                 Hfront   88 Hsync  44 Hback  148 Hpol P
                 Vfront    4 Vsync   5 Vback   36 Vpol N
    DTD 2:  1366x768    59.789541 Hz 683:384   47.712 kHz     85.500000 MHz (531 mm x 297 mm)
                 Hfront   70 Hsync 143 Hback  213 Hpol P
                 Vfront    3 Vsync   3 Vback   24 Vpol P
    Display Product Name: 'LEDTV'
    Manufacturer-Specified Display Descriptor (0x00): 00 00 62 84 22 30 58 a8 35 00 f8 c2 21 00 00 00 '..b."0X.5...!...'
Checksum: 0xb1

----------------

Warnings:

Block 0, Base EDID:
  Detailed Timing Descriptor #1: DTD is similar but not identical to VIC 16.

Failures:

Block 0, Base EDID:
  Detailed Timing Descriptor #1: Mismatch of image size 575x323 mm vs display size 940x530 mm.
  Detailed Timing Descriptor #2: Mismatch of image size 531x297 mm vs display size 940x530 mm.
  Display Descriptor #4: Monitor descriptor block has byte 4 nonzero (0x62).
  Missing Display Range Limits Descriptor.
EDID:
  Extension Block 1 started with EDID header, ignoring Extension Blocks >= 1.

EDID conformity: FAIL
