edid-decode (hex):

00 ff ff ff ff ff ff 00 3c 88 51 19 06 00 00 00
0e 20 01 04 a5 2c 17 78 26 d7 a5 a2 59 4a 96 24
14 50 54 af ce 00 95 00 81 c0 81 80 95 c0 01 01
01 01 01 01 01 01 2f 26 40 a0 60 84 1a 30 30 20
35 00 b0 f0 10 00 00 1a 66 21 56 aa 51 00 1e 30
46 8f 33 00 9a e6 10 00 00 1c 00 00 00 ff 00 0a
20 20 20 20 20 20 20 20 20 20 20 20 00 00 00 fc
00 44 48 49 2d 4c 4d 31 39 2d 41 32 30 30 00 1f

00 ff ff ff ff ff ff 00 3c 88 51 19 06 00 00 00
0e 20 01 04 a5 2c 17 78 26 d7 a5 a2 59 4a 96 24
14 50 54 af ce 00 95 00 81 c0 81 80 95 c0 01 01
01 01 01 01 01 01 2f 26 40 a0 60 84 1a 30 30 20
35 00 b0 f0 10 00 00 1a 66 21 56 aa 51 00 1e 30
46 8f 33 00 9a e6 10 00 00 1c 00 00 00 ff 00 0a
20 20 20 20 20 20 20 20 20 20 20 20 00 00 00 fc
00 44 48 49 2d 4c 4d 31 39 2d 41 32 30 30 00 1f

----------------

Block 0, Base EDID:
  EDID Structure Version & Revision: 1.4
  Vendor & Product Identification:
    Manufacturer: ODH
    Model: 6481
    Serial Number: ...
    Made in: week 14 of 2022
  Basic Display Parameters & Features:
    Digital display
    Bits per primary color channel: 8
    DisplayPort interface
    Maximum image size: 44 cm x 23 cm
    Gamma: 2.20
    DPMS levels: Off
    Supported color formats: RGB 4:4:4
    Default (sRGB) color space is primary color space
    First detailed timing includes the native pixel format and preferred refresh rate
  Color Characteristics:
    Red  : 0.6357, 0.3486
    Green: 0.2900, 0.5888
    Blue : 0.1425, 0.0800
    White: 0.3134, 0.3291
  Established Timings I & II:
    IBM     :   720x400    70.081663 Hz   9:5     31.467 kHz     28.320000 MHz
    DMT 0x04:   640x480    59.940476 Hz   4:3     31.469 kHz     25.175000 MHz
    DMT 0x05:   640x480    72.808802 Hz   4:3     37.861 kHz     31.500000 MHz
    DMT 0x06:   640x480    75.000000 Hz   4:3     37.500 kHz     31.500000 MHz
    DMT 0x08:   800x600    56.250000 Hz   4:3     35.156 kHz     36.000000 MHz
    DMT 0x09:   800x600    60.316541 Hz   4:3     37.879 kHz     40.000000 MHz
    DMT 0x0a:   800x600    72.187572 Hz   4:3     48.077 kHz     50.000000 MHz
    DMT 0x0b:   800x600    75.000000 Hz   4:3     46.875 kHz     49.500000 MHz
    DMT 0x10:  1024x768    60.003840 Hz   4:3     48.363 kHz     65.000000 MHz
    DMT 0x11:  1024x768    70.069359 Hz   4:3     56.476 kHz     75.000000 MHz
    DMT 0x12:  1024x768    75.028582 Hz   4:3     60.023 kHz     78.750000 MHz
  Standard Timings:
    DMT 0x2f:  1440x900    59.887445 Hz  16:10    55.935 kHz    106.500000 MHz
    DMT 0x55:  1280x720    60.000000 Hz  16:9     45.000 kHz     74.250000 MHz
    DMT 0x23:  1280x1024   60.019740 Hz   5:4     63.981 kHz    108.000000 MHz
    GTF     :  1440x810    60.000051 Hz  16:9     50.340 kHz     95.042000 MHz
  Detailed Timing Descriptors:
    DTD 1:  1600x900    59.978156 Hz  16:9     55.540 kHz     97.750000 MHz (432 mm x 240 mm)
                 Hfront   48 Hsync  32 Hback   80 Hpol P
                 Vfront    3 Vsync   5 Vback   18 Vpol N
    DTD 2:  1366x768    59.789541 Hz 683:384   47.712 kHz     85.500000 MHz (410 mm x 230 mm)
                 Hfront   70 Hsync 143 Hback  213 Hpol N
                 Vfront    3 Vsync   3 Vback   24 Vpol P
    Display Product Serial Number: ...
    Display Product Name: 'DHI-LM19-A200'
Checksum: 0x1f

----------------

Warnings:

Block 0, Base EDID:
  Detailed Timing Descriptor #2: DTD is similar but not identical to DMT 0x51.

Failures:

Block 0, Base EDID:
  Display Product Serial Number: ...
  Basic Display Parameters & Features: sRGB is signaled, but the chromaticities do not match.
  Detailed Timing Descriptor #1: Mismatch of image size 432x240 mm vs display size 440x230 mm.
EDID:
  Extension Block 1 started with EDID header, ignoring Extension Blocks >= 1.
  Base EDID: The DTD max image size is 432x240mm, which is larger than the display size 440.0x230.0mm.

EDID conformity: FAIL
