edid-decode (hex):

00 ff ff ff ff ff ff 00 09 e5 84 09 00 00 00 00
1f 1e 01 04 95 22 13 78 02 44 65 a7 57 51 a1 27
10 50 54 00 00 00 01 01 01 01 01 01 01 01 01 01
01 01 01 01 01 01 5c 37 80 cc 70 38 20 40 30 20
36 00 58 c2 10 00 00 1a 4a 2c 80 cc 70 38 20 40
30 20 36 00 58 c2 10 00 00 1a 00 00 00 fe 00 33
33 32 4a 4b 80 00 00 00 00 00 00 00 00 00 00 00
00 01 01 21 9e 00 10 00 00 0a 01 0a 20 20 00 6b

----------------

Block 0, Base EDID:
  EDID Structure Version & Revision: 1.4
  Vendor & Product Identification:
    Manufacturer: BOE
    Model: 2436
    Made in: week 31 of 2020
  Basic Display Parameters & Features:
    Digital display
    Bits per primary color channel: 6
    DisplayPort interface
    Maximum image size: 34 cm x 19 cm
    Gamma: 2.20
    Supported color formats: RGB 4:4:4
    First detailed timing includes the native pixel format and preferred refresh rate
  Color Characteristics:
    Red  : 0.6533, 0.3398
    Green: 0.3173, 0.6289
    Blue : 0.1533, 0.0644
    White: 0.3134, 0.3291
  Established Timings I & II: none
  Standard Timings: none
  Detailed Timing Descriptors:
    DTD 1:  1920x1080   60.002845 Hz  16:9     66.723 kHz    141.720000 MHz (344 mm x 194 mm)
                 Hfront   48 Hsync  32 Hback  124 Hpol P
                 Vfront    3 Vsync   6 Vback   23 Vpol N
    DTD 2:  1920x1080   48.003970 Hz  16:9     53.380 kHz    113.380000 MHz (344 mm x 194 mm)
                 Hfront   48 Hsync  32 Hback  124 Hpol P
                 Vfront    3 Vsync   6 Vback   23 Vpol N
    Alphanumeric Data String: '332JK.'
    Manufacturer-Specified Display Descriptor (0x00): 00 00 00 01 01 21 9e 00 10 00 00 0a 01 0a 20 20 '.....!........  '
Checksum: 0x6b

----------------

Warnings:

Block 0, Base EDID:
  Alphanumeric Data String: Non-ASCII character 0x80 at position 5, can cause problems.
  Missing Display Product Name.

Failures:

Block 0, Base EDID:
  Alphanumeric Data String: NUL byte at position 6.

EDID conformity: FAIL
