edid-decode (hex):

00 ff ff ff ff ff ff 00 0d ae 1d 16 00 00 00 00
09 20 01 04 a5 22 16 78 03 ee 95 a3 54 4c 99 26
0f 50 54 00 00 00 01 01 01 01 01 01 01 01 01 01
01 01 01 01 01 01 6b 6e 00 a0 a0 40 84 60 30 20
a6 00 58 d7 10 00 00 1a 00 00 00 10 00 00 00 00
00 00 00 00 00 00 00 00 00 00 00 00 00 fe 00 34
4e 34 35 52 80 31 36 30 47 4d 45 0a 00 00 00 00
00 02 41 0f 9e 00 00 00 00 0f 41 0a 20 20 01 ee

70 20 79 02 00 22 00 14 69 dc 0b 85 ff 09 9f 00
2f 00 1f 00 3f 06 83 00 09 00 05 00 25 01 09 69
dc 0b 69 dc 0b 3c a5 80 81 00 13 72 1a 00 00 03
01 3c a5 00 00 53 51 53 51 a5 00 00 00 00 00 00
00 00 00 00 00 00 00 00 00 00 00 00 00 00 00 00
00 00 00 00 00 00 00 00 00 00 00 00 00 00 00 00
00 00 00 00 00 00 00 00 00 00 00 00 00 00 00 00
00 00 00 00 00 00 00 00 00 00 00 00 00 00 6d 90

00 ff ff ff ff ff ff 00 0d ae 1d 16 00 00 00 00
09 20 01 04 a5 22 16 78 03 ee 95 a3 54 4c 99 26
0f 50 54 00 00 00 01 01 01 01 01 01 01 01 01 01
01 01 01 01 01 01 6b 6e 00 a0 a0 40 84 60 30 20
a6 00 58 d7 10 00 00 1a 00 00 00 10 00 00 00 00
00 00 00 00 00 00 00 00 00 00 00 00 00 fe 00 34
4e 34 35 52 80 31 36 30 47 4d 45 0a 00 00 00 00
00 02 41 0f 9e 00 00 00 00 0f 41 0a 20 20 01 ee

70 20 79 02 00 22 00 14 69 dc 0b 85 ff 09 9f 00
2f 00 1f 00 3f 06 83 00 09 00 05 00 25 01 09 69
dc 0b 69 dc 0b 3c a5 80 81 00 13 72 1a 00 00 03
01 3c a5 00 00 53 51 53 51 a5 00 00 00 00 00 00
00 00 00 00 00 00 00 00 00 00 00 00 00 00 00 00
00 00 00 00 00 00 00 00 00 00 00 00 00 00 00 00
00 00 00 00 00 00 00 00 00 00 00 00 00 00 00 00
00 00 00 00 00 00 00 00 00 00 00 00 00 00 6d 90

----------------

Block 0, Base EDID:
  EDID Structure Version & Revision: 1.4
  Vendor & Product Identification:
    Manufacturer: CMN
    Model: 5661
    Made in: week 9 of 2022
  Basic Display Parameters & Features:
    Digital display
    Bits per primary color channel: 8
    DisplayPort interface
    Maximum image size: 34 cm x 22 cm
    Gamma: 2.20
    Supported color formats: RGB 4:4:4
    First detailed timing includes the native pixel format and preferred refresh rate
    Display supports continuous frequencies
  Color Characteristics:
    Red  : 0.6396, 0.3300
    Green: 0.2998, 0.5996
    Blue : 0.1503, 0.0595
    White: 0.3134, 0.3291
  Established Timings I & II: none
  Standard Timings: none
  Detailed Timing Descriptors:
    DTD 1:  2560x1600   60.001613 Hz  16:10   103.923 kHz    282.670000 MHz (344 mm x 215 mm)
                 Hfront   48 Hsync  32 Hback   80 Hpol P
                 Vfront   10 Vsync   6 Vback  116 Vpol N
    Dummy Descriptor:
    Alphanumeric Data String: '4N45R.160GME'
    Manufacturer-Specified Display Descriptor (0x00): 00 00 00 02 41 0f 9e 00 00 00 00 0f 41 0a 20 20 '....A.......A.  '
  Extension blocks: 1
Checksum: 0xee

----------------

Block 1, DisplayID Extension Block:
  Version: 2.0
  Extension Count: 0
  Display Product Primary Use Case: None of the listed primary use cases; generic display
  Video Timing Modes Type 7 - Detailed Timings Data Block:
    DTD:  2560x1600  165.000085 Hz  16:10   285.780 kHz    777.322000 MHz (aspect 16:10, no 3D stereo, preferred)
               Hfront   48 Hsync  32 Hback   80 Hpol N
               Vfront   10 Vsync   6 Vback  116 Vpol N
  Dynamic Video Timing Range Limits Data Block:
    Minimum Pixel Clock: 777322 kHz
    Maximum Pixel Clock: 777322 kHz
    Minimum Vertical Refresh Rate: 60 Hz
    Maximum Vertical Refresh Rate: 165 Hz
    Seamless Dynamic Video Timing Support: Yes
  CTA-861 DisplayID Data Block:
  Vendor-Specific Data Block (AMD), OUI 00-00-1A:
    Version: 3
    Feature Caps: 0x01
    Minimum Refresh Rate: 60 Hz
    Maximum Refresh Rate: 165 Hz
    Flags 1.x: 0x00
    Flags 2.x: 0x00
  Checksum: 0x6d
Checksum: 0x90

----------------

Block 2, Unknown EDID Extension Block 0x00:
  00 ff ff ff ff ff ff 00 0d ae 1d 16 00 00 00 00 '................'
  09 20 01 04 a5 22 16 78 03 ee 95 a3 54 4c 99 26 '. ...".x....TL.&'
  0f 50 54 00 00 00 01 01 01 01 01 01 01 01 01 01 '.PT.............'
  01 01 01 01 01 01 6b 6e 00 a0 a0 40 84 60 30 20 '......kn...@.`0 '
  a6 00 58 d7 10 00 00 1a 00 00 00 10 00 00 00 00 '..X.............'
  00 00 00 00 00 00 00 00 00 00 00 00 00 fe 00 34 '...............4'
  4e 34 35 52 80 31 36 30 47 4d 45 0a 00 00 00 00 'N45R.160GME.....'
  00 02 41 0f 9e 00 00 00 00 0f 41 0a 20 20 01 ee '..A.......A.  ..'
Checksum: 0xee

----------------

Block 3, DisplayID Extension Block:
  Version: 2.0
  Extension Count: 0
  Video Timing Modes Type 7 - Detailed Timings Data Block:
    DTD:  2560x1600  165.000085 Hz  16:10   285.780 kHz    777.322000 MHz (aspect 16:10, no 3D stereo, preferred)
               Hfront   48 Hsync  32 Hback   80 Hpol N
               Vfront   10 Vsync   6 Vback  116 Vpol N
  Dynamic Video Timing Range Limits Data Block:
    Minimum Pixel Clock: 777322 kHz
    Maximum Pixel Clock: 777322 kHz
    Minimum Vertical Refresh Rate: 60 Hz
    Maximum Vertical Refresh Rate: 165 Hz
    Seamless Dynamic Video Timing Support: Yes
  CTA-861 DisplayID Data Block:
  Vendor-Specific Data Block (AMD), OUI 00-00-1A:
    Version: 3
    Feature Caps: 0x01
    Minimum Refresh Rate: 60 Hz
    Maximum Refresh Rate: 165 Hz
    Flags 1.x: 0x00
    Flags 2.x: 0x00
  Checksum: 0x6d
Checksum: 0x90

----------------

Warnings:

Block 0, Base EDID:
  Alphanumeric Data String: Non-ASCII character 0x80 at position 5, can cause problems.
  Missing Display Product Name.

Failures:

Block 0, Base EDID:
  Missing Display Range Limits Descriptor.
Block 1, DisplayID Extension Block:
  Expected 0 DisplayID Extension Block, but got 1.
Block 2, Base EDID:
  Unknown Extension Block.
Block 3, DisplayID Extension Block:
  Product Type should be 0 in extension block.
EDID:
  Base EDID: EDID specified 1 extension block(s), but found 3 extension block(s).
  DisplayID: Missing DisplayID Display Parameters Data Block.

EDID conformity: FAIL
