edid-decode (hex):

00 ff ff ff ff ff ff 00 21 63 00 02 00 00 00 00
00 21 01 04 a5 1e 13 78 e3 ba d2 a0 59 50 8e 24
19 59 5e 00 00 00 01 01 01 01 01 01 01 01 01 01
01 01 01 01 01 01 34 3c 80 a0 70 b0 23 40 30 20
36 00 2e bc 10 00 00 19 00 00 00 fd 00 2f 3c 44
44 0f 01 0a 20 20 20 20 20 20 00 00 00 fe 00 48
4b 43 20 4d 59 20 20 20 20 0a 20 20 00 00 00 fe
00 50 42 31 34 30 44 53 30 32 2d 31 20 20 00 2c

00 ff ff ff ff ff ff 00 21 63 00 02 00 00 00 00
00 21 01 04 a5 1e 13 78 e3 ba d2 a0 59 50 8e 24
19 59 5e 00 00 00 01 01 01 01 01 01 01 01 01 01
01 01 01 01 01 01 34 3c 80 a0 70 b0 23 40 30 20
36 00 2e bc 10 00 00 19 00 00 00 fd 00 2f 3c 44
44 0f 01 0a 20 20 20 20 20 20 00 00 00 fe 00 48
4b 43 20 4d 59 20 20 20 20 0a 20 20 00 00 00 fe
00 50 42 31 34 30 44 53 30 32 2d 31 20 20 00 2c

----------------

Block 0, Base EDID:
  EDID Structure Version & Revision: 1.4
  Vendor & Product Identification:
    Manufacturer: HKC
    Model: 512
    Made in: 2023
  Basic Display Parameters & Features:
    Digital display
    Bits per primary color channel: 8
    DisplayPort interface
    Maximum image size: 30 cm x 19 cm
    Gamma: 2.20
    DPMS levels: Standby Suspend Off
    Supported color formats: RGB 4:4:4
    First detailed timing includes the native pixel format and preferred refresh rate
    Display supports continuous frequencies
  Color Characteristics:
    Red  : 0.6269, 0.3505
    Green: 0.3144, 0.5566
    Blue : 0.1435, 0.0986
    White: 0.3476, 0.3691
  Established Timings I & II: none
  Standard Timings: none
  Detailed Timing Descriptors:
    DTD 1:  1920x1200   59.996886 Hz  16:10    74.096 kHz    154.120000 MHz (302 mm x 188 mm)
                 Hfront   48 Hsync  32 Hback   80 Hpol N
                 Vfront    3 Vsync   6 Vback   26 Vpol N
    Display Range Limits:
      Monitor ranges (Range Limits Only): 47-60 Hz V, 68-68 kHz H, max dotclock 150 MHz
    Alphanumeric Data String: 'HKC MY    '
    Alphanumeric Data String: 'PB140DS02-1  '
Checksum: 0x2c

----------------

Block 1, Unknown EDID Extension Block 0x00:
  00 ff ff ff ff ff ff 00 21 63 00 02 00 00 00 00 '........!c......'
  00 21 01 04 a5 1e 13 78 e3 ba d2 a0 59 50 8e 24 '.!.....x....YP.$'
  19 59 5e 00 00 00 01 01 01 01 01 01 01 01 01 01 '.Y^.............'
  01 01 01 01 01 01 34 3c 80 a0 70 b0 23 40 30 20 '......4<..p.#@0 '
  36 00 2e bc 10 00 00 19 00 00 00 fd 00 2f 3c 44 '6............/<D'
  44 0f 01 0a 20 20 20 20 20 20 00 00 00 fe 00 48 'D...      .....H'
  4b 43 20 4d 59 20 20 20 20 0a 20 20 00 00 00 fe 'KC MY    .  ....'
  00 50 42 31 34 30 44 53 30 32 2d 31 20 20 00 2c '.PB140DS02-1  .,'
Checksum: 0x2c

----------------

Warnings:

Block 0, Base EDID:
  Missing Display Product Name.
EDID:
  Base EDID: Some timings are out of range of the Monitor Ranges:
    Horizontal Freq: 74.096 - 74.096 kHz (Monitor: 68.000 - 68.000 kHz)
    Maximum Clock: 154.120 MHz (Monitor: 150.000 MHz)

Failures:

Block 0, Base EDID:
  Alphanumeric Data String: One or more trailing spaces before newline.
  Alphanumeric Data String: No newline, but one or more trailing spaces.
Block 1, Base EDID:
  Unknown Extension Block.
EDID:
  Base EDID: EDID specified 0 extension block(s), but found 1 extension block(s).

EDID conformity: FAIL
