edid-decode (hex):

00 ff ff ff ff ff ff 00 09 e5 40 09 00 00 00 00
12 1e 01 04 a5 22 13 78 02 84 35 a6 54 4a 9f 25
0e 50 54 00 00 00 01 01 01 01 01 01 01 01 01 01
01 01 01 01 01 01 50 d0 00 a0 f0 70 3e 80 30 20
36 00 58 c2 10 00 00 1a a7 a6 00 a0 f0 70 3e 80
30 20 36 00 58 c2 10 00 00 1a 00 00 00 fe 00 59
32 54 48 56 80 4e 45 31 35 4e 36 39 00 00 00 00
00 02 41 21 a8 00 11 00 00 0b 01 0a 20 20 00 22

----------------

Block 0, Base EDID:
  EDID Structure Version & Revision: 1.4
  Vendor & Product Identification:
    Manufacturer: BOE
    Model: 2368
    Made in: week 18 of 2020
  Basic Display Parameters & Features:
    Digital display
    Bits per primary color channel: 8
    DisplayPort interface
    Maximum image size: 34 cm x 19 cm
    Gamma: 2.20
    Supported color formats: RGB 4:4:4
    First detailed timing includes the native pixel format and preferred refresh rate
  Color Characteristics:
    Red  : 0.6503, 0.3281
    Green: 0.2900, 0.6210
    Blue : 0.1445, 0.0576
    White: 0.3134, 0.3291
  Established Timings I & II: none
  Standard Timings: none
  Detailed Timing Descriptors:
    DTD 1:  3840x2160   60.000000 Hz  16:9    133.320 kHz    533.280000 MHz (344 mm x 194 mm)
                 Hfront   48 Hsync  32 Hback   80 Hpol P
                 Vfront    3 Vsync   6 Vback   53 Vpol N
    DTD 2:  3840x2160   48.000675 Hz  16:9    106.657 kHz    426.630000 MHz (344 mm x 194 mm)
                 Hfront   48 Hsync  32 Hback   80 Hpol P
                 Vfront    3 Vsync   6 Vback   53 Vpol N
    Alphanumeric Data String: 'Y2THV.NE15N69'
    Manufacturer-Specified Display Descriptor (0x00): 00 00 00 02 41 21 a8 00 11 00 00 0b 01 0a 20 20 '....A!........  '
Checksum: 0x22

----------------

Warnings:

Block 0, Base EDID:
  Alphanumeric Data String: Non-ASCII character 0x80 at position 5, can cause problems.
  Missing Display Product Name.

EDID conformity: PASS
