edid-decode (hex):

00 ff ff ff ff ff ff 00 30 ae 05 51 01 00 00 00
01 19 01 04 a5 33 1d 78 1b 2c c5 a4 56 50 a1 28
0f 50 54 00 00 00 01 01 01 01 01 01 01 01 01 01
01 01 01 01 01 01 02 3a 80 18 71 38 2d 40 58 2c
45 00 dd 0c 11 00 00 1e 00 00 00 fc 00 4c 45 4e
2d 43 35 31 33 30 2d 42 0a 20 00 00 00 fd 00 39
3e 1e 5a 14 35 00 55 50 21 00 00 1a 00 00 00 ff
00 4c 54 4d 32 33 30 48 4c 30 38 0a 20 20 00 0f

00 ff ff ff ff ff ff 00 30 ae 05 51 01 00 00 00
01 19 01 04 a5 33 1d 78 1b 2c c5 a4 56 50 a1 28
0f 50 54 00 00 00 01 01 01 01 01 01 01 01 01 01
01 01 01 01 01 01 02 3a 80 18 71 38 2d 40 58 2c
45 00 dd 0c 11 00 00 1e 00 00 00 fc 00 4c 45 4e
2d 43 35 31 33 30 2d 42 0a 20 00 00 00 fd 00 39
3e 1e 5a 14 35 00 55 50 21 00 00 1a 00 00 00 ff
00 4c 54 4d 32 33 30 48 4c 30 38 0a 20 20 00 0f

----------------

Block 0, Base EDID:
  EDID Structure Version & Revision: 1.4
  Vendor & Product Identification:
    Manufacturer: LEN
    Model: 20741
    Serial Number: ...
    Made in: week 1 of 2015
  Basic Display Parameters & Features:
    Digital display
    Bits per primary color channel: 8
    DisplayPort interface
    Maximum image size: 51 cm x 29 cm
    Gamma: 2.20
    Supported color formats: RGB 4:4:4, YCrCb 4:4:4, YCrCb 4:2:2
    First detailed timing includes the native pixel format and preferred refresh rate
    Display supports continuous frequencies
  Color Characteristics:
    Red  : 0.6406, 0.3378
    Green: 0.3154, 0.6289
    Blue : 0.1591, 0.0585
    White: 0.3134, 0.3291
  Established Timings I & II: none
  Standard Timings: none
  Detailed Timing Descriptors:
    DTD 1:  1920x1080   60.000000 Hz  16:9     67.500 kHz    148.500000 MHz (477 mm x 268 mm)
                 Hfront   88 Hsync  44 Hback  148 Hpol P
                 Vfront    4 Vsync   5 Vback   36 Vpol P
    Display Product Name: 'LEN-C5130-B'
    Display Range Limits:
      Monitor ranges (Unknown (0x35)): 57-62 Hz V, 30-90 kHz H, max dotclock 200 MHz
    Display Product Serial Number: ...
Checksum: 0x0f

----------------

Warnings:

Block 0, Base EDID:
  Vendor & Product Identification: The serial number is one of the known dummy values, it should probably be set to 0.

Failures:

Block 0, Base EDID:
  Detailed Timing Descriptor #1: Mismatch of image size 477x268 mm vs display size 510x290 mm.
  Display Range Limits: Unknown range class (0x35).
  Display Range Limits: Byte 11 is 0x00 instead of 0x0a.
  Display Range Limits: Bytes 12-17 must be 0x20.
EDID:
  Extension Block 1 started with EDID header, ignoring Extension Blocks >= 1.

EDID conformity: FAIL
