edid-decode (hex):

00 ff ff ff ff ff ff 00 1c 54 03 24 01 01 01 01
2d 20 01 04 c5 34 1d 78 ff 76 c5 ab 4f 44 a7 24
0f 50 54 ff ff 80 71 4f 81 c0 81 00 81 40 81 80
95 00 a9 c0 b3 00 02 3a 80 18 71 38 2d 40 58 2c
45 00 0f 28 21 00 00 1a 00 00 00 fd 00 30 b4 de
de 3c 01 0a 20 20 20 20 20 20 00 00 00 fc 00 47
32 34 46 20 32 0a 20 20 20 20 20 20 00 00 00 ff
00 32 32 34 35 30 42 30 30 37 37 36 36 0a 01 cb

02 03 31 f1 4b 02 03 13 04 29 0e 1f 10 40 3f 61
23 09 17 07 83 01 00 00 6d 1a 00 00 02 01 30 b4
00 00 00 00 00 00 e3 05 e3 01 e6 06 05 01 5d 5d
45 87 82 80 b4 70 38 19 40 3a 20 b8 00 0f 28 21
00 00 1e e3 94 80 b4 70 38 14 40 3a 20 68 00 0f
28 21 00 00 1e 04 9f 80 88 70 38 14 40 3a 20 68
00 0f 28 21 00 00 1e 00 00 00 00 00 00 00 00 00
00 00 00 00 00 00 00 00 00 00 00 00 00 00 00 af

00 ff ff ff ff ff ff 00 1c 54 03 24 01 01 01 01
2d 20 01 04 c5 34 1d 78 ff 76 c5 ab 4f 44 a7 24
0f 50 54 ff ff 80 71 4f 81 c0 81 00 81 40 81 80
95 00 a9 c0 b3 00 02 3a 80 18 71 38 2d 40 58 2c
45 00 0f 28 21 00 00 1a 00 00 00 fd 00 30 b4 de
de 3c 01 0a 20 20 20 20 20 20 00 00 00 fc 00 47
32 34 46 20 32 0a 20 20 20 20 20 20 00 00 00 ff
00 32 32 34 35 30 42 30 30 37 37 36 36 0a 01 cb

02 03 31 f1 4b 02 03 13 04 29 0e 1f 10 40 3f 61
23 09 17 07 83 01 00 00 6d 1a 00 00 02 01 30 b4
00 00 00 00 00 00 e3 05 e3 01 e6 06 05 01 5d 5d
45 87 82 80 b4 70 38 19 40 3a 20 b8 00 0f 28 21
00 00 1e e3 94 80 b4 70 38 14 40 3a 20 68 00 0f
28 21 00 00 1e 04 9f 80 88 70 38 14 40 3a 20 68
00 0f 28 21 00 00 1e 00 00 00 00 00 00 00 00 00
00 00 00 00 00 00 00 00 00 00 00 00 00 00 00 af

----------------

Block 0, Base EDID:
  EDID Structure Version & Revision: 1.4
  Vendor & Product Identification:
    Manufacturer: GBT
    Model: 9219
    Serial Number: ...
    Made in: week 45 of 2022
  Basic Display Parameters & Features:
    Digital display
    Bits per primary color channel: 12
    DisplayPort interface
    Maximum image size: 52 cm x 29 cm
    Gamma: 2.20
    DPMS levels: Standby Suspend Off
    Supported color formats: RGB 4:4:4, YCrCb 4:4:4, YCrCb 4:2:2
    Default (sRGB) color space is primary color space
    First detailed timing includes the native pixel format and preferred refresh rate
    Display supports continuous frequencies
  Color Characteristics:
    Red  : 0.6689, 0.3115
    Green: 0.2666, 0.6542
    Blue : 0.1435, 0.0585
    White: 0.3134, 0.3291
  Established Timings I & II:
    IBM     :   720x400    70.081663 Hz   9:5     31.467 kHz     28.320000 MHz
    IBM     :   720x400    87.849542 Hz   9:5     39.444 kHz     35.500000 MHz
    DMT 0x04:   640x480    59.940476 Hz   4:3     31.469 kHz     25.175000 MHz
    Apple   :   640x480    66.666667 Hz   4:3     35.000 kHz     30.240000 MHz
    DMT 0x05:   640x480    72.808802 Hz   4:3     37.861 kHz     31.500000 MHz
    DMT 0x06:   640x480    75.000000 Hz   4:3     37.500 kHz     31.500000 MHz
    DMT 0x08:   800x600    56.250000 Hz   4:3     35.156 kHz     36.000000 MHz
    DMT 0x09:   800x600    60.316541 Hz   4:3     37.879 kHz     40.000000 MHz
    DMT 0x0a:   800x600    72.187572 Hz   4:3     48.077 kHz     50.000000 MHz
    DMT 0x0b:   800x600    75.000000 Hz   4:3     46.875 kHz     49.500000 MHz
    Apple   :   832x624    74.551266 Hz   4:3     49.726 kHz     57.284000 MHz
    DMT 0x0f:  1024x768i   86.957532 Hz   4:3     35.522 kHz     44.900000 MHz
    DMT 0x10:  1024x768    60.003840 Hz   4:3     48.363 kHz     65.000000 MHz
    DMT 0x11:  1024x768    70.069359 Hz   4:3     56.476 kHz     75.000000 MHz
    DMT 0x12:  1024x768    75.028582 Hz   4:3     60.023 kHz     78.750000 MHz
    DMT 0x24:  1280x1024   75.024675 Hz   5:4     79.976 kHz    135.000000 MHz
    Apple   :  1152x870    75.061550 Hz 192:145   68.681 kHz    100.000000 MHz
  Standard Timings:
    DMT 0x15:  1152x864    75.000000 Hz   4:3     67.500 kHz    108.000000 MHz
    DMT 0x55:  1280x720    60.000000 Hz  16:9     45.000 kHz     74.250000 MHz
    DMT 0x1c:  1280x800    59.810326 Hz  16:10    49.702 kHz     83.500000 MHz
    DMT 0x20:  1280x960    60.000000 Hz   4:3     60.000 kHz    108.000000 MHz
    DMT 0x23:  1280x1024   60.019740 Hz   5:4     63.981 kHz    108.000000 MHz
    DMT 0x2f:  1440x900    59.887445 Hz  16:10    55.935 kHz    106.500000 MHz
    DMT 0x53:  1600x900    60.000000 Hz  16:9     60.000 kHz    108.000000 MHz (RB)
    DMT 0x3a:  1680x1050   59.954250 Hz  16:10    65.290 kHz    146.250000 MHz
  Detailed Timing Descriptors:
    DTD 1:  1920x1080   60.000000 Hz  16:9     67.500 kHz    148.500000 MHz (527 mm x 296 mm)
                 Hfront   88 Hsync  44 Hback  148 Hpol P
                 Vfront    4 Vsync   5 Vback   36 Vpol N
    Display Range Limits:
      Monitor ranges (Range Limits Only): 48-180 Hz V, 222-222 kHz H, max dotclock 600 MHz
    Display Product Name: 'G24F 2'
    Display Product Serial Number: ...
  Extension blocks: 1
Checksum: 0xcb

----------------

Block 1, CTA-861 Extension Block:
  Revision: 3
  Underscans IT Video Formats by default
  Basic audio support
  Supports YCbCr 4:4:4
  Supports YCbCr 4:2:2
  Native detailed modes: 1
  Video Data Block:
    VIC   2:   720x480    59.940060 Hz   4:3     31.469 kHz     27.000000 MHz
    VIC   3:   720x480    59.940060 Hz  16:9     31.469 kHz     27.000000 MHz
    VIC  19:  1280x720    50.000000 Hz  16:9     37.500 kHz     74.250000 MHz
    VIC   4:  1280x720    60.000000 Hz  16:9     45.000 kHz     74.250000 MHz
    VIC  41:  1280x720   100.000000 Hz  16:9     75.000 kHz    148.500000 MHz
    VIC  14:  1440x480    59.940060 Hz   4:3     31.469 kHz     54.000000 MHz
    VIC  31:  1920x1080   50.000000 Hz  16:9     56.250 kHz    148.500000 MHz
    VIC  16:  1920x1080   60.000000 Hz  16:9     67.500 kHz    148.500000 MHz
    VIC  64:  1920x1080  100.000000 Hz  16:9    112.500 kHz    297.000000 MHz
    VIC  63:  1920x1080  120.000000 Hz  16:9    135.000 kHz    297.000000 MHz
    VIC  97:  3840x2160   60.000000 Hz  16:9    135.000 kHz    594.000000 MHz
  Audio Data Block:
    Linear PCM:
      Max channels: 2
      Supported sample rates (kHz): 96 48 44.1 32
      Supported sample sizes (bits): 24 20 16
  Speaker Allocation Data Block:
    FL/FR - Front Left/Right
  Vendor-Specific Data Block (AMD), OUI 00-00-1A:
    Version: 2
    Feature Caps: 0x01
    Minimum Refresh Rate: 48 Hz
    Maximum Refresh Rate: 180 Hz
    Flags 1.x: 0x00
    Flags 2.x: 0x00
    Maximum luminance: 0 (50.000 cd/m^2)
    Minimum luminance: 0 (0.000 cd/m^2)
    Unknown: 0x00 0x00
  Colorimetry Data Block:
    xvYCC601
    xvYCC709
    BT2020cYCC
    BT2020YCC
    BT2020RGB
    Gamut Boundary Description Metadata Profile P0
  HDR Static Metadata Data Block:
    Electro optical transfer functions:
      Traditional gamma - SDR luminance range
      SMPTE ST2084
    Supported static metadata descriptors:
      Static metadata type 1
    Desired content max luminance: 93 (374.834 cd/m^2)
    Desired content max frame-average luminance: 93 (374.834 cd/m^2)
    Desired content min luminance: 69 (0.274 cd/m^2)
  Detailed Timing Descriptors:
    DTD 2:  1920x1080  143.999138 Hz  16:9    159.119 kHz    334.150000 MHz (527 mm x 296 mm)
                 Hfront   58 Hsync  32 Hback   90 Hpol P
                 Vfront   11 Vsync   8 Vback    6 Vpol P
    DTD 3:  1920x1080  165.000000 Hz  16:9    181.500 kHz    381.150000 MHz (527 mm x 296 mm)
                 Hfront   58 Hsync  32 Hback   90 Hpol P
                 Vfront    6 Vsync   8 Vback    6 Vpol P
    DTD 4:  1920x1080  179.996463 Hz  16:9    197.996 kHz    407.080000 MHz (527 mm x 296 mm)
                 Hfront   58 Hsync  32 Hback   46 Hpol P
                 Vfront    6 Vsync   8 Vback    6 Vpol P
Checksum: 0xaf  Unused space in Extension Block: 24 bytes

----------------

Block 2, Unknown EDID Extension Block 0x00:
  00 ff ff ff ff ff ff 00 1c 54 03 24 01 01 01 01 '.........T.$....'
  2d 20 01 04 c5 34 1d 78 ff 76 c5 ab 4f 44 a7 24 '- ...4.x.v..OD.$'
  0f 50 54 ff ff 80 71 4f 81 c0 81 00 81 40 81 80 '.PT...qO.....@..'
  95 00 a9 c0 b3 00 02 3a 80 18 71 38 2d 40 58 2c '.......:..q8-@X,'
  45 00 0f 28 21 00 00 1a 00 00 00 fd 00 30 b4 de 'E..(!........0..'
  de 3c 01 0a 20 20 20 20 20 20 00 00 00 fc 00 47 '.<..      .....G'
  32 34 46 20 32 0a 20 20 20 20 20 20 00 00 00 ff '24F 2.      ....'
  00 32 32 34 35 30 42 30 30 37 37 36 36 0a 01 cb '.22450B007766...'
Checksum: 0xcb

----------------

Block 3, CTA-861 Extension Block:
  Revision: 3
  Underscans IT Video Formats by default
  Basic audio support
  Supports YCbCr 4:4:4
  Supports YCbCr 4:2:2
  Native detailed modes: 1
  Video Data Block:
    VIC   2:   720x480    59.940060 Hz   4:3     31.469 kHz     27.000000 MHz
    VIC   3:   720x480    59.940060 Hz  16:9     31.469 kHz     27.000000 MHz
    VIC  19:  1280x720    50.000000 Hz  16:9     37.500 kHz     74.250000 MHz
    VIC   4:  1280x720    60.000000 Hz  16:9     45.000 kHz     74.250000 MHz
    VIC  41:  1280x720   100.000000 Hz  16:9     75.000 kHz    148.500000 MHz
    VIC  14:  1440x480    59.940060 Hz   4:3     31.469 kHz     54.000000 MHz
    VIC  31:  1920x1080   50.000000 Hz  16:9     56.250 kHz    148.500000 MHz
    VIC  16:  1920x1080   60.000000 Hz  16:9     67.500 kHz    148.500000 MHz
    VIC  64:  1920x1080  100.000000 Hz  16:9    112.500 kHz    297.000000 MHz
    VIC  63:  1920x1080  120.000000 Hz  16:9    135.000 kHz    297.000000 MHz
    VIC  97:  3840x2160   60.000000 Hz  16:9    135.000 kHz    594.000000 MHz
  Audio Data Block:
    Linear PCM:
      Max channels: 2
      Supported sample rates (kHz): 96 48 44.1 32
      Supported sample sizes (bits): 24 20 16
  Speaker Allocation Data Block:
    FL/FR - Front Left/Right
  Vendor-Specific Data Block (AMD), OUI 00-00-1A:
    Version: 2
    Feature Caps: 0x01
    Minimum Refresh Rate: 48 Hz
    Maximum Refresh Rate: 180 Hz
    Flags 1.x: 0x00
    Flags 2.x: 0x00
    Maximum luminance: 0 (50.000 cd/m^2)
    Minimum luminance: 0 (0.000 cd/m^2)
    Unknown: 0x00 0x00
  Colorimetry Data Block:
    xvYCC601
    xvYCC709
    BT2020cYCC
    BT2020YCC
    BT2020RGB
    Gamut Boundary Description Metadata Profile P0
  HDR Static Metadata Data Block:
    Electro optical transfer functions:
      Traditional gamma - SDR luminance range
      SMPTE ST2084
    Supported static metadata descriptors:
      Static metadata type 1
    Desired content max luminance: 93 (374.834 cd/m^2)
    Desired content max frame-average luminance: 93 (374.834 cd/m^2)
    Desired content min luminance: 69 (0.274 cd/m^2)
  Detailed Timing Descriptors:
    DTD 5:  1920x1080  143.999138 Hz  16:9    159.119 kHz    334.150000 MHz (527 mm x 296 mm)
                 Hfront   58 Hsync  32 Hback   90 Hpol P
                 Vfront   11 Vsync   8 Vback    6 Vpol P
    DTD 6:  1920x1080  165.000000 Hz  16:9    181.500 kHz    381.150000 MHz (527 mm x 296 mm)
                 Hfront   58 Hsync  32 Hback   90 Hpol P
                 Vfront    6 Vsync   8 Vback    6 Vpol P
    DTD 7:  1920x1080  179.996463 Hz  16:9    197.996 kHz    407.080000 MHz (527 mm x 296 mm)
                 Hfront   58 Hsync  32 Hback   46 Hpol P
                 Vfront    6 Vsync   8 Vback    6 Vpol P
Checksum: 0xaf  Unused space in Extension Block: 24 bytes

----------------

Warnings:

Block 0, Base EDID:
  Vendor & Product Identification: The serial number is one of the known dummy values, it should probably be set to 0.
  Detailed Timing Descriptor #1: DTD is similar but not identical to VIC 16.
Block 1, CTA-861 Extension Block:
  Video Data Block: VIC 2 and the first DTD are not identical. Is this intended?
  Display Product Serial Number is set, so the Serial Number in the Base EDID should be 0.
EDID:
  Base EDID: Some timings are out of range of the Monitor Ranges:
    Horizontal Freq: 31.466 - 197.996 kHz (Monitor: 222.000 - 222.000 kHz)

Failures:

Block 0, Base EDID:
  Basic Display Parameters & Features: sRGB is signaled, but the chromaticities do not match.
Block 1, CTA-861 Extension Block:
  Missing VCDB, needed for Set Selectable RGB Quantization to avoid interop issues.
Block 2, Base EDID:
  Unknown Extension Block.
Block 3, CTA-861 Extension Block:
  Video Data Block: Duplicate VIC 2.
  Video Data Block: Duplicate VIC 3.
  Video Data Block: Duplicate VIC 19.
  Video Data Block: Duplicate VIC 4.
  Video Data Block: Duplicate VIC 41.
  Video Data Block: Duplicate VIC 14.
  Video Data Block: Duplicate VIC 31.
  Video Data Block: Duplicate VIC 16.
  Video Data Block: Duplicate VIC 64.
  Video Data Block: Duplicate VIC 63.
  Video Data Block: Duplicate VIC 97.
  Speaker Allocation Data Block: Only one instance of this Data Block is allowed.
  Colorimetry Data Block: Only one instance of this Data Block is allowed.
  HDR Static Metadata Data Block: Only one instance of this Data Block is allowed.
EDID:
  Base EDID: EDID specified 1 extension block(s), but found 3 extension block(s).

EDID conformity: FAIL
