edid-decode (hex):

00 ff ff ff ff ff ff 00 28 89 02 14 01 01 01 01
31 1a 01 04 a5 1c 10 78 02 16 c5 a4 54 4b 9b 26
0f 50 54 00 00 00 d1 c0 01 01 01 01 01 01 01 01
01 01 01 01 01 01 1a 36 80 a0 70 38 1f 40 30 20
35 00 15 9c 10 00 00 18 11 24 80 a0 70 38 1f 40
30 20 35 00 15 9c 10 00 00 18 00 00 00 fc 00 4c
41 4d 31 32 35 4d 30 30 37 44 0a 20 00 00 00 ff
00 4b 36 4d 30 33 36 38 38 32 35 0a 20 20 00 99

00 ff ff ff ff ff ff 00 28 89 02 14 01 01 01 01
31 1a 01 04 a5 1c 10 78 02 16 c5 a4 54 4b 9b 26
0f 50 54 00 00 00 d1 c0 01 01 01 01 01 01 01 01
01 01 01 01 01 01 1a 36 80 a0 70 38 1f 40 30 20
35 00 15 9c 10 00 00 18 11 24 80 a0 70 38 1f 40
30 20 35 00 15 9c 10 00 00 18 00 00 00 fc 00 4c
41 4d 31 32 35 4d 30 30 37 44 0a 20 00 00 00 ff
00 4b 36 4d 30 33 36 38 38 32 35 0a 20 20 00 99

----------------

Block 0, Base EDID:
  EDID Structure Version & Revision: 1.4
  Vendor & Product Identification:
    Manufacturer: JDI
    Model: 5122
    Serial Number: ...
    Made in: week 49 of 2016
  Basic Display Parameters & Features:
    Digital display
    Bits per primary color channel: 8
    DisplayPort interface
    Maximum image size: 28 cm x 16 cm
    Gamma: 2.20
    Supported color formats: RGB 4:4:4
    First detailed timing includes the native pixel format and preferred refresh rate
  Color Characteristics:
    Red  : 0.6406, 0.3291
    Green: 0.2939, 0.6074
    Blue : 0.1513, 0.0585
    White: 0.3134, 0.3291
  Established Timings I & II: none
  Standard Timings:
    DMT 0x52:  1920x1080   60.000000 Hz  16:9     67.500 kHz    148.500000 MHz
  Detailed Timing Descriptors:
    DTD 1:  1920x1080   59.933878 Hz  16:9     66.587 kHz    138.500000 MHz (277 mm x 156 mm)
                 Hfront   48 Hsync  32 Hback   80 Hpol N
                 Vfront    3 Vsync   5 Vback   23 Vpol N
    DTD 2:  1920x1080   39.954476 Hz  16:9     44.389 kHz     92.330000 MHz (277 mm x 156 mm)
                 Hfront   48 Hsync  32 Hback   80 Hpol N
                 Vfront    3 Vsync   5 Vback   23 Vpol N
    Display Product Name: 'LAM125M007D'
    Display Product Serial Number: ...
Checksum: 0x99

----------------

Warnings:

Block 0, Base EDID:
  Vendor & Product Identification: The serial number is one of the known dummy values, it should probably be set to 0.

Failures:

EDID:
  Extension Block 1 started with EDID header, ignoring Extension Blocks >= 1.

EDID conformity: FAIL
