edid-decode (hex):

00 ff ff ff ff ff ff 00 1e 6d 0f 78 af d9 02 00
09 22 01 04 c5 46 27 78 f9 5a 15 ad 52 3f af 25
0e 50 54 21 09 00 d1 c0 61 40 45 40 81 c0 01 01
01 01 01 01 01 01 4d d0 00 a0 f0 70 3e 80 30 20
35 00 b9 88 21 00 00 1a 00 00 00 fd 0c 30 f0 ff
ff eb 01 0a 20 20 20 20 20 20 00 00 00 fc 00 4c
47 20 55 4c 54 52 41 47 45 41 52 2b 00 00 00 ff
00 34 30 39 4e 54 56 53 35 47 37 39 39 0a 02 e8

02 03 35 71 23 0f 07 07 83 4f 00 00 45 3f 10 04
03 01 e2 00 6a e3 05 c0 00 e6 06 05 01 73 4f 01
74 1a 00 00 03 03 30 f0 00 a0 73 01 4f 02 f0 00
00 00 00 00 00 09 ec 00 a0 a0 a0 67 50 30 20 35
00 b9 88 21 00 00 1a 5a 87 80 a0 70 38 4d 40 30
20 35 00 b9 88 21 00 00 1a 00 00 00 00 00 00 00
00 00 00 00 00 00 00 00 00 00 00 00 00 00 00 00
00 00 00 00 00 00 00 00 00 00 00 00 00 00 00 31

00 ff ff ff ff ff ff 00 1e 6d 0f 78 af d9 02 00
09 22 01 04 c5 46 27 78 f9 5a 15 ad 52 3f af 25
0e 50 54 21 09 00 d1 c0 61 40 45 40 81 c0 01 01
01 01 01 01 01 01 4d d0 00 a0 f0 70 3e 80 30 20
35 00 b9 88 21 00 00 1a 00 00 00 fd 0c 30 f0 ff
ff eb 01 0a 20 20 20 20 20 20 00 00 00 fc 00 4c
47 20 55 4c 54 52 41 47 45 41 52 2b 00 00 00 ff
00 34 30 39 4e 54 56 53 35 47 37 39 39 0a 02 e8

00 ff ff ff ff ff ff 00 1e 6d 0f 78 af d9 02 00
09 22 01 04 c5 46 27 78 f9 5a 15 ad 52 3f af 25
0e 50 54 21 09 00 d1 c0 61 40 45 40 81 c0 01 01
01 01 01 01 01 01 4d d0 00 a0 f0 70 3e 80 30 20
35 00 b9 88 21 00 00 1a 00 00 00 fd 0c 30 f0 ff
ff eb 01 0a 20 20 20 20 20 20 00 00 00 fc 00 4c
47 20 55 4c 54 52 41 47 45 41 52 2b 00 00 00 ff
00 34 30 39 4e 54 56 53 35 47 37 39 39 0a 02 e8

02 03 35 71 23 0f 07 07 83 4f 00 00 45 3f 10 04
03 01 e2 00 6a e3 05 c0 00 e6 06 05 01 73 4f 01
74 1a 00 00 03 03 30 f0 00 a0 73 01 4f 02 f0 00
00 00 00 00 00 09 ec 00 a0 a0 a0 67 50 30 20 35
00 b9 88 21 00 00 1a 5a 87 80 a0 70 38 4d 40 30
20 35 00 b9 88 21 00 00 1a 00 00 00 00 00 00 00
00 00 00 00 00 00 00 00 00 00 00 00 00 00 00 00
00 00 00 00 00 00 00 00 00 00 00 00 00 00 00 31

00 ff ff ff ff ff ff 00 1e 6d 0f 78 af d9 02 00
09 22 01 04 c5 46 27 78 f9 5a 15 ad 52 3f af 25
0e 50 54 21 09 00 d1 c0 61 40 45 40 81 c0 01 01
01 01 01 01 01 01 4d d0 00 a0 f0 70 3e 80 30 20
35 00 b9 88 21 00 00 1a 00 00 00 fd 0c 30 f0 ff
ff eb 01 0a 20 20 20 20 20 20 00 00 00 fc 00 4c
47 20 55 4c 54 52 41 47 45 41 52 2b 00 00 00 ff
00 34 30 39 4e 54 56 53 35 47 37 39 39 0a 02 e8

----------------

Block 0, Base EDID:
  EDID Structure Version & Revision: 1.4
  Vendor & Product Identification:
    Manufacturer: GSM
    Model: 30735
    Serial Number: ...
    Made in: week 9 of 2024
  Basic Display Parameters & Features:
    Digital display
    Bits per primary color channel: 12
    DisplayPort interface
    Maximum image size: 70 cm x 39 cm
    Gamma: 2.20
    DPMS levels: Standby Suspend Off
    Supported color formats: RGB 4:4:4, YCrCb 4:4:4, YCrCb 4:2:2
    First detailed timing does not include the native pixel format and preferred refresh rate
    Display supports continuous frequencies
  Color Characteristics:
    Red  : 0.6767, 0.3212
    Green: 0.2480, 0.6855
    Blue : 0.1445, 0.0556
    White: 0.3134, 0.3291
  Established Timings I & II:
    DMT 0x04:   640x480    59.940476 Hz   4:3     31.469 kHz     25.175000 MHz
    DMT 0x09:   800x600    60.316541 Hz   4:3     37.879 kHz     40.000000 MHz
    DMT 0x10:  1024x768    60.003840 Hz   4:3     48.363 kHz     65.000000 MHz
    DMT 0x24:  1280x1024   75.024675 Hz   5:4     79.976 kHz    135.000000 MHz
  Standard Timings:
    DMT 0x52:  1920x1080   60.000000 Hz  16:9     67.500 kHz    148.500000 MHz
    DMT 0x10:  1024x768    60.003840 Hz   4:3     48.363 kHz     65.000000 MHz
    DMT 0x09:   800x600    60.316541 Hz   4:3     37.879 kHz     40.000000 MHz
    DMT 0x55:  1280x720    60.000000 Hz  16:9     45.000 kHz     74.250000 MHz
  Detailed Timing Descriptors:
    DTD 1:  3840x2160   59.996625 Hz  16:9    133.312 kHz    533.250000 MHz (697 mm x 392 mm)
                 Hfront   48 Hsync  32 Hback   80 Hpol P
                 Vfront    3 Vsync   5 Vback   54 Vpol N
    Display Range Limits:
      Monitor ranges (Range Limits Only): 48-240 Hz V, 510-510 kHz H, max dotclock 2350 MHz
    Display Product Name: 'LG ULTRAGEAR+'
    Display Product Serial Number: ...
  Extension blocks: 2
Checksum: 0xe8

----------------

Block 1, CTA-861 Extension Block:
  Revision: 3
  Basic audio support
  Supports YCbCr 4:4:4
  Supports YCbCr 4:2:2
  Native DTDs: 1
  Audio Data Block:
    Linear PCM:
      Max channels: 8
      Supported sample rates (kHz): 48 44.1 32
      Supported sample sizes (bits): 24 20 16
  Speaker Allocation Data Block:
    FL/FR - Front Left/Right
    LFE1 - Low Frequency Effects 1
    FC - Front Center
    LS/RS - Left/Right Surround
    BL/BR - Back Left/Right
  Video Data Block:
    VIC  63:  1920x1080  120.000000 Hz  16:9    135.000 kHz    297.000000 MHz
    VIC  16:  1920x1080   60.000000 Hz  16:9     67.500 kHz    148.500000 MHz
    VIC   4:  1280x720    60.000000 Hz  16:9     45.000 kHz     74.250000 MHz
    VIC   3:   720x480    59.940060 Hz  16:9     31.469 kHz     27.000000 MHz
    VIC   1:   640x480    59.940476 Hz   4:3     31.469 kHz     25.175000 MHz
  Video Capability Data Block:
    YCbCr quantization: No Data
    RGB quantization: Selectable (via AVI Q)
    PT scan behavior: Always Underscanned
    IT scan behavior: Always Underscanned
    CE scan behavior: Always Underscanned
  Colorimetry Data Block:
    BT2020YCC
    BT2020RGB
  HDR Static Metadata Data Block:
    Electro optical transfer functions:
      Traditional gamma - SDR luminance range
      SMPTE ST2084
    Supported static metadata descriptors:
      Static metadata type 1
    Desired content max luminance: 115 (603.666 cd/m^2)
    Desired content max frame-average luminance: 79 (276.782 cd/m^2)
    Desired content min luminance: 1 (0.000 cd/m^2)
  Vendor-Specific Data Block (AMD), OUI 00-00-1A:
    Version: 3
    Feature Caps: 0x03
    Minimum Refresh Rate: 48 Hz
    Maximum Refresh Rate: 240 Hz
    Flags 1.x: 0x00
    Flags 2.x: 0xa0
      ST 2084 (PQ) EOTF Supported
      Linear EOTF (Windows scRGB, 0.0 - 125.0) Supported
      BT.2020 Gamut Supported
    Maximum luminance: 115 (603.666 cd/m^2)
    Minimum luminance: 1 (0.000 cd/m^2)
  Detailed Timing Descriptors:
    DTD 2:  2560x1440  143.973257 Hz  16:9    222.151 kHz    604.250000 MHz (697 mm x 392 mm)
                 Hfront   48 Hsync  32 Hback   80 Hpol P
                 Vfront    3 Vsync   5 Vback   95 Vpol N
    DTD 3:  1920x1080  143.981451 Hz  16:9    166.587 kHz    346.500000 MHz (697 mm x 392 mm)
                 Hfront   48 Hsync  32 Hback   80 Hpol P
                 Vfront    3 Vsync   5 Vback   69 Vpol N
Checksum: 0x31  Unused space in Extension Block: 38 bytes

----------------

Warnings:

Block 1, CTA-861 Extension Block:
  IT Video Formats are overscanned by default, but normally this should be underscanned.
  Video Data Block: VIC 63 and the first DTD are not identical. Is this intended?
  Video Capability Data Block: Set Selectable YCbCr Quantization to avoid interop issues.
  Video Capability Data Block: S_PT is equal to S_IT and S_CE, so should be set to 0 instead.
  Colorimetry Data Block: Set the sRGB colorimetry bit to avoid interop issues.
  Display Product Serial Number is set, so the Serial Number in the Base EDID should be 0.
EDID:
  Base EDID: Some timings are out of range of the Monitor Ranges:
    Horizontal Freq: 31.468 - 222.150 kHz (Monitor: 510.000 - 510.000 kHz)

Failures:

Block 1, CTA-861 Extension Block:
  Video Capability Data Block: IT video formats are always underscanned, but bit 7 of Byte 3 of the CTA-861 Extension header is set to overscanned.
EDID:
  Extension Block 2 started with EDID header, ignoring Extension Blocks >= 2.
  Base EDID: EDID specified 2 extension block(s), but found 1 extension block(s).

EDID conformity: FAIL
