edid-decode (hex):

00 ff ff ff ff ff ff 00 15 c3 69 20 01 01 01 01
15 14 01 03 80 33 1d 78 ea ee 95 a3 54 4c 99 26
0f 50 54 a1 08 00 81 80 81 40 b3 00 81 c0 01 01
01 01 01 01 01 01 02 3a 80 18 71 38 2d 40 58 2c
45 00 fe 1f 11 00 00 1e 00 00 00 ff 00 33 34 33
33 34 30 35 30 0a 20 20 20 20 00 00 00 fd 00 3b
3d 1f 44 0f 00 0a 20 20 20 20 20 20 00 00 00 fc
00 45 56 32 33 33 33 57 0a 20 20 20 20 20 00 71

00 ff ff ff ff ff ff 00 15 c3 69 20 01 01 01 01
15 14 01 03 80 33 1d 78 ea ee 95 a3 54 4c 99 26
0f 50 54 a1 08 00 81 80 81 40 b3 00 81 c0 01 01
01 01 01 01 01 01 02 3a 80 18 71 38 2d 40 58 2c
45 00 fe 1f 11 00 00 1e 00 00 00 ff 00 33 34 33
33 34 30 35 30 0a 20 20 20 20 00 00 00 fd 00 3b
3d 1f 44 0f 00 0a 20 20 20 20 20 20 00 00 00 fc
00 45 56 32 33 33 33 57 0a 20 20 20 20 20 00 71

----------------

Block 0, Base EDID:
  EDID Structure Version & Revision: 1.3
  Vendor & Product Identification:
    Manufacturer: ENC
    Model: 8297
    Serial Number: ...
    Made in: week 21 of 2010
  Basic Display Parameters & Features:
    Digital display
    Maximum image size: 51 cm x 29 cm
    Gamma: 2.20
    DPMS levels: Standby Suspend Off
    RGB color display
    First detailed timing is the preferred timing
  Color Characteristics:
    Red  : 0.6396, 0.3300
    Green: 0.2998, 0.5996
    Blue : 0.1503, 0.0595
    White: 0.3134, 0.3291
  Established Timings I & II:
    IBM     :   720x400    70.081663 Hz   9:5     31.467 kHz     28.320000 MHz
    DMT 0x04:   640x480    59.940476 Hz   4:3     31.469 kHz     25.175000 MHz
    DMT 0x09:   800x600    60.316541 Hz   4:3     37.879 kHz     40.000000 MHz
    DMT 0x10:  1024x768    60.003840 Hz   4:3     48.363 kHz     65.000000 MHz
  Standard Timings:
    DMT 0x23:  1280x1024   60.019740 Hz   5:4     63.981 kHz    108.000000 MHz
    DMT 0x20:  1280x960    60.000000 Hz   4:3     60.000 kHz    108.000000 MHz
    DMT 0x3a:  1680x1050   59.954250 Hz  16:10    65.290 kHz    146.250000 MHz
    DMT 0x55:  1280x720    60.000000 Hz  16:9     45.000 kHz     74.250000 MHz
  Detailed Timing Descriptors:
    DTD 1:  1920x1080   60.000000 Hz  16:9     67.500 kHz    148.500000 MHz (510 mm x 287 mm)
                 Hfront   88 Hsync  44 Hback  148 Hpol P
                 Vfront    4 Vsync   5 Vback   36 Vpol P
    Display Product Serial Number: ...
    Display Range Limits:
      Monitor ranges (GTF): 59-61 Hz V, 31-68 kHz H, max dotclock 150 MHz
    Display Product Name: 'EV2333W'
Checksum: 0x71

----------------

Block 1, Unknown EDID Extension Block 0x00:
  00 ff ff ff ff ff ff 00 15 c3 69 20 01 01 01 01 '..........i ....'
  15 14 01 03 80 33 1d 78 ea ee 95 a3 54 4c 99 26 '.....3.x....TL.&'
  0f 50 54 a1 08 00 81 80 81 40 b3 00 81 c0 01 01 '.PT......@......'
  01 01 01 01 01 01 02 3a 80 18 71 38 2d 40 58 2c '.......:..q8-@X,'
  45 00 fe 1f 11 00 00 1e 00 00 00 ff 00 33 34 33 'E............343'
  33 34 30 35 30 0a 20 20 20 20 00 00 00 fd 00 3b '34050.    .....;'
  3d 1f 44 0f 00 0a 20 20 20 20 20 20 00 00 00 fc '=.D...      ....'
  00 45 56 32 33 33 33 57 0a 20 20 20 20 20 00 71 '.EV2333W.     .q'
Checksum: 0x71

----------------

Warnings:

Block 0, Base EDID:
  Vendor & Product Identification: The serial number is one of the known dummy values, it should probably be set to 0.
EDID:
  Base EDID: Some timings are out of range of the Monitor Ranges:
    Vertical Freq: 59.940 - 70.082 Hz (Monitor: 59.000 - 61.000 Hz)

Failures:

Block 1, Base EDID:
  Unknown Extension Block.
EDID:
  Base EDID: EDID specified 0 extension block(s), but found 1 extension block(s).

EDID conformity: FAIL
