edid-decode (hex):

00 ff ff ff ff ff ff 00 25 23 03 11 00 00 00 00
2f 14 01 03 68 34 1d 78 ea 2c c5 a4 56 50 a1 28
0f 50 54 a5 6b 40 a9 40 d1 c0 01 01 01 01 01 01
01 01 01 01 01 01 02 3a 80 18 71 38 2d 40 40 20
15 00 dd 0c 11 00 00 1e 00 00 00 fc 00 4b 4d 32
34 0a 0a 0a 0a 0a 0a 0a 0a 0a 00 00 00 fd 00 32
4b 1e 5e 13 00 0a 20 20 20 20 20 20 00 00 00 10
00 4e 54 2d 57 48 41 0a 20 20 20 20 20 20 00 94

00 ff ff ff ff ff ff 00 25 23 03 11 00 00 00 00
2f 14 01 03 68 34 1d 78 ea 2c c5 a4 56 50 a1 28
0f 50 54 a5 6b 40 a9 40 d1 c0 01 01 01 01 01 01
01 01 01 01 01 01 02 3a 80 18 71 38 2d 40 40 20
15 00 dd 0c 11 00 00 1e 00 00 00 fc 00 4b 4d 32
34 0a 0a 0a 0a 0a 0a 0a 0a 0a 00 00 00 fd 00 32
4b 1e 5e 13 00 0a 20 20 20 20 20 20 00 00 00 10
00 4e 54 2d 57 48 41 0a 20 20 20 20 20 20 00 94

----------------

Block 0, Base EDID:
  EDID Structure Version & Revision: 1.3
  Vendor & Product Identification:
    Manufacturer: IIC
    Model: 4355
    Made in: week 47 of 2010
  Basic Display Parameters & Features:
    Analog display
    Signal Level Standard: 0.700 : 0.000 : 0.700 V p-p
    Blank level equals black level
    Sync: Separate
    Maximum image size: 52 cm x 29 cm
    Gamma: 2.20
    DPMS levels: Standby Suspend Off
    RGB color display
    First detailed timing is the preferred timing
  Color Characteristics:
    Red  : 0.6406, 0.3378
    Green: 0.3154, 0.6289
    Blue : 0.1591, 0.0585
    White: 0.3134, 0.3291
  Established Timings I & II:
    IBM     :   720x400    70.081663 Hz   9:5     31.467 kHz     28.320000 MHz
    DMT 0x04:   640x480    59.940476 Hz   4:3     31.469 kHz     25.175000 MHz
    DMT 0x06:   640x480    75.000000 Hz   4:3     37.500 kHz     31.500000 MHz
    DMT 0x09:   800x600    60.316541 Hz   4:3     37.879 kHz     40.000000 MHz
    DMT 0x0b:   800x600    75.000000 Hz   4:3     46.875 kHz     49.500000 MHz
    Apple   :   832x624    74.551266 Hz   4:3     49.726 kHz     57.284000 MHz
    DMT 0x10:  1024x768    60.003840 Hz   4:3     48.363 kHz     65.000000 MHz
    DMT 0x12:  1024x768    75.028582 Hz   4:3     60.023 kHz     78.750000 MHz
    DMT 0x24:  1280x1024   75.024675 Hz   5:4     79.976 kHz    135.000000 MHz
  Standard Timings:
    DMT 0x33:  1600x1200   60.000000 Hz   4:3     75.000 kHz    162.000000 MHz
    DMT 0x52:  1920x1080   60.000000 Hz  16:9     67.500 kHz    148.500000 MHz
  Detailed Timing Descriptors:
    DTD 1:  1920x1080   60.000000 Hz  16:9     67.500 kHz    148.500000 MHz (477 mm x 268 mm)
                 Hfront   64 Hsync  32 Hback  184 Hpol P
                 Vfront    1 Vsync   5 Vback   39 Vpol P
    Display Product Name: 'KM24'
    Display Range Limits:
      Monitor ranges (GTF): 50-75 Hz V, 30-94 kHz H, max dotclock 190 MHz
    Dummy Descriptor:
Checksum: 0x94

----------------

Warnings:

Block 0, Base EDID:
  Detailed Timing Descriptor #1: DTD is similar but not identical to VIC 16.

Failures:

Block 0, Base EDID:
  Detailed Timing Descriptor #1: Mismatch of image size 477x268 mm vs display size 520x290 mm.
  Display Product Name: Non-space after newline.
  Dummy Descriptor: Dummy block filled with garbage.
EDID:
  Extension Block 1 started with EDID header, ignoring Extension Blocks >= 1.

EDID conformity: FAIL
