edid-decode (hex):

00 ff ff ff ff ff ff 00 1e 6d d7 3a 01 01 01 01
02 10 01 03 18 5d 34 96 0a f3 30 a7 54 42 aa 26
0f 48 4c bf ee 00 31 59 45 59 61 59 71 40 71 4a
01 01 01 01 01 01 64 19 00 40 41 00 26 30 18 88
36 00 a2 0b 32 00 00 18 d6 09 80 90 20 e0 1d 10
10 60 a2 00 a2 08 32 08 08 18 00 00 00 fc 00 34
32 50 43 31 52 52 2d 5a 4c 0a 20 20 00 00 00 fd
00 34 55 1f 45 0b 00 0a 20 20 20 20 20 20 00 3a

----------------

Block 0, Base EDID:
  EDID Structure Version & Revision: 1.3
  Vendor & Product Identification:
    Manufacturer: GSM
    Model: 15063
    Serial Number: ...
    Made in: week 2 of 2006
  Basic Display Parameters & Features:
    Analog display
    Signal Level Standard: 0.700 : 0.300 : 1.000 V p-p
    Blank-to-black setup/pedestal
    Sync: Separate
    Maximum image size: 93 cm x 52 cm
    Gamma: 2.50
    RGB color display
    First detailed timing is the preferred timing
  Color Characteristics:
    Red  : 0.6552, 0.3310
    Green: 0.2578, 0.6669
    Blue : 0.1484, 0.0615
    White: 0.2812, 0.2968
  Established Timings I & II:
    IBM     :   720x400    70.081663 Hz   9:5     31.467 kHz     28.320000 MHz
    DMT 0x04:   640x480    59.940476 Hz   4:3     31.469 kHz     25.175000 MHz
    Apple   :   640x480    66.666667 Hz   4:3     35.000 kHz     30.240000 MHz
    DMT 0x05:   640x480    72.808802 Hz   4:3     37.861 kHz     31.500000 MHz
    DMT 0x06:   640x480    75.000000 Hz   4:3     37.500 kHz     31.500000 MHz
    DMT 0x08:   800x600    56.250000 Hz   4:3     35.156 kHz     36.000000 MHz
    DMT 0x09:   800x600    60.316541 Hz   4:3     37.879 kHz     40.000000 MHz
    DMT 0x0a:   800x600    72.187572 Hz   4:3     48.077 kHz     50.000000 MHz
    DMT 0x0b:   800x600    75.000000 Hz   4:3     46.875 kHz     49.500000 MHz
    Apple   :   832x624    74.551266 Hz   4:3     49.726 kHz     57.284000 MHz
    DMT 0x10:  1024x768    60.003840 Hz   4:3     48.363 kHz     65.000000 MHz
    DMT 0x11:  1024x768    70.069359 Hz   4:3     56.476 kHz     75.000000 MHz
    DMT 0x12:  1024x768    75.028582 Hz   4:3     60.023 kHz     78.750000 MHz
  Standard Timings:
    DMT 0x07:   640x480    85.008312 Hz   4:3     43.269 kHz     36.000000 MHz
    DMT 0x0c:   800x600    85.061274 Hz   4:3     53.674 kHz     56.250000 MHz
    DMT 0x13:  1024x768    84.996690 Hz   4:3     68.677 kHz     94.500000 MHz
    GTF     :  1152x864    60.000000 Hz   4:3     53.700 kHz     81.624000 MHz
    GTF     :  1152x864    70.000000 Hz   4:3     63.000 kHz     96.768000 MHz
  Detailed Timing Descriptors:
    DTD 1:  1024x768    60.003840 Hz   4:3     48.363 kHz     65.000000 MHz (930 mm x 523 mm)
                 Hfront   24 Hsync 136 Hback  160 Hpol N
                 Vfront    3 Vsync   6 Vback   29 Vpol N
    DTD 2:   640x480    63.098913 Hz   4:3     32.117 kHz     25.180000 MHz (930 mm x 520 mm)
                 Hfront   16 Hsync  96 Hback   16 Hpol N Hborder 8
                 Vfront   10 Vsync   2 Vback    1 Vpol N Vborder 8
    Display Product Name: '42PC1RR-ZL'
    Display Range Limits:
      Monitor ranges (GTF): 52-85 Hz V, 31-69 kHz H, max dotclock 110 MHz
Checksum: 0x3a

----------------

Warnings:

Block 0, Base EDID:
  Vendor & Product Identification: The serial number is one of the known dummy values, it should probably be set to 0.
  Detailed Timing Descriptor #1: Image size is 930x523 mm, but based on the picture AR it should be 930x697 mm.
  Detailed Timing Descriptor #2: Image size is 930x520 mm, but based on the picture AR it should be 930x697 mm.
  Detailed Timing Descriptor #2: The use of non-zero borders in a DTD is not recommended.

EDID conformity: PASS
