edid-decode (hex):

00 ff ff ff ff ff ff 00 59 3a 44 10 00 00 00 00
01 1f 01 03 80 59 31 78 0a e6 9d a3 54 4a 99 26
0f 47 4a a1 08 00 81 80 45 40 61 40 95 00 01 01
01 01 01 01 01 01 02 3a 80 18 71 38 2d 40 58 2c
45 00 c4 8e 21 00 00 1e 66 21 56 aa 51 00 1e 30
46 8f 33 00 09 25 21 00 00 1e 00 00 00 fc 00 44
34 30 66 2d 4a 30 39 0a 20 20 20 20 00 00 00 fd
00 32 4b 1e 50 17 00 0a 20 20 20 20 20 20 01 c2

02 03 41 72 4f 02 03 04 05 07 90 06 13 14 01 9f
20 22 11 12 32 09 7f 07 15 07 50 3d 07 c0 57 04
00 67 56 03 5f 7e 01 83 01 00 00 6e 03 0c 00 10
00 38 2d c0 02 02 02 02 00 00 e2 00 ff e3 05 03
01 66 21 50 b0 51 00 1b 30 40 70 36 00 09 25 21
00 00 18 8c 0a d0 8a 20 e0 2d 10 10 3e 96 00 87
25 11 00 00 18 00 00 00 00 00 00 00 00 00 00 00
00 00 00 00 00 00 00 00 00 00 00 00 00 00 00 97

00 ff ff ff ff ff ff 00 59 3a 44 10 00 00 00 00
01 1f 01 03 80 59 31 78 0a e6 9d a3 54 4a 99 26
0f 47 4a a1 08 00 81 80 45 40 61 40 95 00 01 01
01 01 01 01 01 01 02 3a 80 18 71 38 2d 40 58 2c
45 00 c4 8e 21 00 00 1e 66 21 56 aa 51 00 1e 30
46 8f 33 00 09 25 21 00 00 1e 00 00 00 fc 00 44
34 30 66 2d 4a 30 39 0a 20 20 20 20 00 00 00 fd
00 32 4b 1e 50 17 00 0a 20 20 20 20 20 20 01 c2

02 03 41 72 4f 02 03 04 05 07 90 06 13 14 01 9f
20 22 11 12 32 09 7f 07 15 07 50 3d 07 c0 57 04
00 67 56 03 5f 7e 01 83 01 00 00 6e 03 0c 00 10
00 38 2d c0 02 02 02 02 00 00 e2 00 ff e3 05 03
01 66 21 50 b0 51 00 1b 30 40 70 36 00 09 25 21
00 00 18 8c 0a d0 8a 20 e0 2d 10 10 3e 96 00 87
25 11 00 00 18 00 00 00 00 00 00 00 00 00 00 00
00 00 00 00 00 00 00 00 00 00 00 00 00 00 00 97

----------------

Block 0, Base EDID:
  EDID Structure Version & Revision: 1.3
  Vendor & Product Identification:
    Manufacturer: VIZ
    Model: 4164
    Made in: week 1 of 2021
  Basic Display Parameters & Features:
    Digital display
    Maximum image size: 89 cm x 49 cm
    Gamma: 2.20
    RGB color display
    First detailed timing is the preferred timing
  Color Characteristics:
    Red  : 0.6396, 0.3300
    Green: 0.2900, 0.5996
    Blue : 0.1503, 0.0595
    White: 0.2802, 0.2900
  Established Timings I & II:
    IBM     :   720x400    70.081663 Hz   9:5     31.467 kHz     28.320000 MHz
    DMT 0x04:   640x480    59.940476 Hz   4:3     31.469 kHz     25.175000 MHz
    DMT 0x09:   800x600    60.316541 Hz   4:3     37.879 kHz     40.000000 MHz
    DMT 0x10:  1024x768    60.003840 Hz   4:3     48.363 kHz     65.000000 MHz
  Standard Timings:
    DMT 0x23:  1280x1024   60.019740 Hz   5:4     63.981 kHz    108.000000 MHz
    DMT 0x09:   800x600    60.316541 Hz   4:3     37.879 kHz     40.000000 MHz
    DMT 0x10:  1024x768    60.003840 Hz   4:3     48.363 kHz     65.000000 MHz
    DMT 0x2f:  1440x900    59.887445 Hz  16:10    55.935 kHz    106.500000 MHz
  Detailed Timing Descriptors:
    DTD 1:  1920x1080   60.000000 Hz  16:9     67.500 kHz    148.500000 MHz (708 mm x 398 mm)
                 Hfront   88 Hsync  44 Hback  148 Hpol P
                 Vfront    4 Vsync   5 Vback   36 Vpol P
    DTD 2:  1366x768    59.789541 Hz 683:384   47.712 kHz     85.500000 MHz (521 mm x 293 mm)
                 Hfront   70 Hsync 143 Hback  213 Hpol P
                 Vfront    3 Vsync   3 Vback   24 Vpol P
    Display Product Name: 'D40f-J09'
    Display Range Limits:
      Monitor ranges (GTF): 50-75 Hz V, 30-80 kHz H, max dotclock 230 MHz
  Extension blocks: 1
Checksum: 0xc2

----------------

Block 1, CTA-861 Extension Block:
  Revision: 3
  Basic audio support
  Supports YCbCr 4:4:4
  Supports YCbCr 4:2:2
  Native DTDs: 2
  Video Data Block:
    VIC   2:   720x480    59.940060 Hz   4:3     31.469 kHz     27.000000 MHz
    VIC   3:   720x480    59.940060 Hz  16:9     31.469 kHz     27.000000 MHz
    VIC   4:  1280x720    60.000000 Hz  16:9     45.000 kHz     74.250000 MHz
    VIC   5:  1920x1080i  60.000000 Hz  16:9     33.750 kHz     74.250000 MHz
    VIC   7:  1440x480i   59.940060 Hz  16:9     15.734 kHz     27.000000 MHz
    VIC  16:  1920x1080   60.000000 Hz  16:9     67.500 kHz    148.500000 MHz (native)
    VIC   6:  1440x480i   59.940060 Hz   4:3     15.734 kHz     27.000000 MHz
    VIC  19:  1280x720    50.000000 Hz  16:9     37.500 kHz     74.250000 MHz
    VIC  20:  1920x1080i  50.000000 Hz  16:9     28.125 kHz     74.250000 MHz
    VIC   1:   640x480    59.940476 Hz   4:3     31.469 kHz     25.175000 MHz
    VIC  31:  1920x1080   50.000000 Hz  16:9     56.250 kHz    148.500000 MHz (native)
    VIC  32:  1920x1080   24.000000 Hz  16:9     27.000 kHz     74.250000 MHz
    VIC  34:  1920x1080   30.000000 Hz  16:9     33.750 kHz     74.250000 MHz
    VIC  17:   720x576    50.000000 Hz   4:3     31.250 kHz     27.000000 MHz
    VIC  18:   720x576    50.000000 Hz  16:9     31.250 kHz     27.000000 MHz
  Audio Data Block:
    Linear PCM:
      Max channels: 2
      Supported sample rates (kHz): 192 176.4 96 88.2 48 44.1 32
      Supported sample sizes (bits): 24 20 16
    AC-3:
      Max channels: 6
      Supported sample rates (kHz): 48 44.1 32
      Maximum bit rate: 640 kb/s
    DTS:
      Max channels: 6
      Supported sample rates (kHz): 48 44.1 32
      Maximum bit rate: 1536 kb/s
    Enhanced AC-3 (DD+):
      Max channels: 8
      Supported sample rates (kHz): 48
    MAT (MLP):
      Max channels: 8
      Supported sample rates (kHz): 192 96 48 44.1
      Supports Dolby TrueHD, object audio PCM and channel-based PCM
      Hash calculation not required for object audio PCM or channel-based PCM
    DTS-HD:
      Max channels: 8
      Supported sample rates (kHz): 192 176.4 96 88.2 48 44.1
      Audio Format Code dependent value: 0x01
  Speaker Allocation Data Block:
    FL/FR - Front Left/Right
  Vendor-Specific Data Block (HDMI), OUI 00-0C-03:
    Source physical address: 1.0.0.0
    DC_36bit
    DC_30bit
    DC_Y444
    Maximum TMDS clock: 225 MHz
    Video latency: 2 ms
    Audio latency: 2 ms
    Interlaced video latency: 2 ms
    Interlaced audio latency: 2 ms
  Video Capability Data Block:
    YCbCr quantization: Selectable (via AVI YQ)
    RGB quantization: Selectable (via AVI Q)
    PT scan behavior: Supports both over- and underscan
    IT scan behavior: Supports both over- and underscan
    CE scan behavior: Supports both over- and underscan
  Colorimetry Data Block:
    xvYCC601
    xvYCC709
    Gamut Boundary Description Metadata Profile P0
  Detailed Timing Descriptors:
    DTD 3:  1360x768    60.015162 Hz  85:48    47.712 kHz     85.500000 MHz (521 mm x 293 mm)
                 Hfront   64 Hsync 112 Hback  256 Hpol N
                 Vfront    3 Vsync   6 Vback   18 Vpol N
    DTD 4:   720x480    59.940060 Hz   3:2     31.469 kHz     27.000000 MHz (391 mm x 293 mm)
                 Hfront   16 Hsync  62 Hback   60 Hpol N
                 Vfront    9 Vsync   6 Vback   30 Vpol N
Checksum: 0x97  Unused space in Extension Block: 26 bytes

----------------

Warnings:

Block 1, CTA-861 Extension Block:
  IT Video Formats are overscanned by default, but normally this should be underscanned.
  Video Data Block: VIC 2 and the first DTD are not identical. Is this intended?
  Vendor-Specific Data Block (HDMI), OUI 00-0C-03: Progressive and Interlaced latency values are identical, no need for both.
  Video Capability Data Block: S_PT is equal to S_IT and S_CE, so should be set to 0 instead.
  Colorimetry Data Block: Set the sRGB colorimetry bit to avoid interop issues.
  Detailed Timing Descriptor #3: DTD is similar but not identical to DMT 0x27.
  Detailed Timing Descriptor #4: Image size is 391x293 mm, but based on the picture AR it should be 391x260 mm.
EDID:
  Base EDID: Some timings are out of range of the Monitor Ranges:
    Vertical Freq: 24.000 - 70.082 Hz (Monitor: 50.000 - 75.000 Hz)
    Horizontal Freq: 15.734 - 67.500 kHz (Monitor: 30.000 - 80.000 kHz)

Failures:

Block 0, Base EDID:
  Detailed Timing Descriptor #1: Mismatch of image size 708x398 mm vs display size 890x490 mm.
  Detailed Timing Descriptor #2: Mismatch of image size 521x293 mm vs display size 890x490 mm.
Block 1, CTA-861 Extension Block:
  Detailed Timing Descriptor #3: Mismatch of image size 521x293 mm vs display size 890x490 mm.
  Detailed Timing Descriptor #4: Mismatch of image size 391x293 mm vs display size 890x490 mm.
EDID:
  Extension Block 2 started with EDID header, ignoring Extension Blocks >= 2.
  CTA-861: Native progressive timings are a mix of several resolutions.

EDID conformity: FAIL
