edid-decode (hex):

00 ff ff ff ff ff ff 00 59 3a 44 10 01 01 01 01
00 20 01 03 80 46 27 78 2a 93 6d a1 58 4d a4 27
0a 47 4a 25 0e 00 01 01 01 01 01 01 01 01 01 01
01 01 01 01 01 01 02 3a 80 18 71 38 2d 40 58 2c
45 00 ba 88 21 00 00 1e 64 19 00 40 41 00 26 30
18 88 36 00 ba 88 21 00 00 18 00 00 00 fc 00 44
33 32 66 4d 2d 4b 30 31 0a 20 20 20 00 00 00 fd
00 38 4c 1f 50 0f 00 0a 20 20 20 20 20 20 01 3b

02 03 2d 71 49 90 01 06 07 02 03 05 04 20 32 09
07 07 15 07 50 57 04 03 3d 07 c0 5f 7e 01 67 7e
03 83 01 00 00 67 03 0c 00 10 00 00 1e 02 3a 80
18 71 38 2d 40 58 2c 45 00 ba 88 21 00 00 1e 01
1d 00 72 51 d0 1e 20 6e 28 55 00 ba 88 21 00 00
1e 8c 0a a0 14 51 f0 16 00 26 7c 43 00 ba 88 21
00 00 98 00 00 00 00 00 00 00 00 00 00 00 00 00
00 00 00 00 00 00 00 00 00 00 00 00 00 00 00 33

00 ff ff ff ff ff ff 00 59 3a 44 10 01 01 01 01
00 20 01 03 80 46 27 78 2a 93 6d a1 58 4d a4 27
0a 47 4a 25 0e 00 01 01 01 01 01 01 01 01 01 01
01 01 01 01 01 01 02 3a 80 18 71 38 2d 40 58 2c
45 00 ba 88 21 00 00 1e 64 19 00 40 41 00 26 30
18 88 36 00 ba 88 21 00 00 18 00 00 00 fc 00 44
33 32 66 4d 2d 4b 30 31 0a 20 20 20 00 00 00 fd
00 38 4c 1f 50 0f 00 0a 20 20 20 20 20 20 01 3b

02 03 2d 71 49 90 01 06 07 02 03 05 04 20 32 09
07 07 15 07 50 57 04 03 3d 07 c0 5f 7e 01 67 7e
03 83 01 00 00 67 03 0c 00 10 00 00 1e 02 3a 80
18 71 38 2d 40 58 2c 45 00 ba 88 21 00 00 1e 01
1d 00 72 51 d0 1e 20 6e 28 55 00 ba 88 21 00 00
1e 8c 0a a0 14 51 f0 16 00 26 7c 43 00 ba 88 21
00 00 98 00 00 00 00 00 00 00 00 00 00 00 00 00
00 00 00 00 00 00 00 00 00 00 00 00 00 00 00 33

----------------

Block 0, Base EDID:
  EDID Structure Version & Revision: 1.3
  Vendor & Product Identification:
    Manufacturer: VIZ
    Model: 4164
    Serial Number: ...
    Made in: 2022
  Basic Display Parameters & Features:
    Digital display
    Maximum image size: 70 cm x 39 cm
    Gamma: 2.20
    DPMS levels: Off
    RGB color display
    First detailed timing is the preferred timing
  Color Characteristics:
    Red  : 0.6308, 0.3447
    Green: 0.3007, 0.6435
    Blue : 0.1533, 0.0410
    White: 0.2802, 0.2900
  Established Timings I & II:
    DMT 0x04:   640x480    59.940476 Hz   4:3     31.469 kHz     25.175000 MHz
    DMT 0x06:   640x480    75.000000 Hz   4:3     37.500 kHz     31.500000 MHz
    DMT 0x09:   800x600    60.316541 Hz   4:3     37.879 kHz     40.000000 MHz
    DMT 0x10:  1024x768    60.003840 Hz   4:3     48.363 kHz     65.000000 MHz
    DMT 0x11:  1024x768    70.069359 Hz   4:3     56.476 kHz     75.000000 MHz
    DMT 0x12:  1024x768    75.028582 Hz   4:3     60.023 kHz     78.750000 MHz
  Standard Timings: none
  Detailed Timing Descriptors:
    DTD 1:  1920x1080   60.000000 Hz  16:9     67.500 kHz    148.500000 MHz (698 mm x 392 mm)
                 Hfront   88 Hsync  44 Hback  148 Hpol P
                 Vfront    4 Vsync   5 Vback   36 Vpol P
    DTD 2:  1024x768    60.003840 Hz   4:3     48.363 kHz     65.000000 MHz (698 mm x 392 mm)
                 Hfront   24 Hsync 136 Hback  160 Hpol N
                 Vfront    3 Vsync   6 Vback   29 Vpol N
    Display Product Name: 'D32fM-K01'
    Display Range Limits:
      Monitor ranges (GTF): 56-76 Hz V, 31-80 kHz H, max dotclock 150 MHz
  Extension blocks: 1
Checksum: 0x3b

----------------

Block 1, CTA-861 Extension Block:
  Revision: 3
  Basic audio support
  Supports YCbCr 4:4:4
  Supports YCbCr 4:2:2
  Native detailed modes: 1
  Video Data Block:
    VIC  16:  1920x1080   60.000000 Hz  16:9     67.500 kHz    148.500000 MHz (native)
    VIC   1:   640x480    59.940476 Hz   4:3     31.469 kHz     25.175000 MHz
    VIC   6:  1440x480i   59.940060 Hz   4:3     15.734 kHz     27.000000 MHz
    VIC   7:  1440x480i   59.940060 Hz  16:9     15.734 kHz     27.000000 MHz
    VIC   2:   720x480    59.940060 Hz   4:3     31.469 kHz     27.000000 MHz
    VIC   3:   720x480    59.940060 Hz  16:9     31.469 kHz     27.000000 MHz
    VIC   5:  1920x1080i  60.000000 Hz  16:9     33.750 kHz     74.250000 MHz
    VIC   4:  1280x720    60.000000 Hz  16:9     45.000 kHz     74.250000 MHz
    VIC  32:  1920x1080   24.000000 Hz  16:9     27.000 kHz     74.250000 MHz
  Audio Data Block:
    Linear PCM:
      Max channels: 2
      Supported sample rates (kHz): 48 44.1 32
      Supported sample sizes (bits): 24 20 16
    AC-3:
      Max channels: 6
      Supported sample rates (kHz): 48 44.1 32
      Maximum bit rate: 640 kb/s
    Enhanced AC-3 (DD+):
      Max channels: 8
      Supported sample rates (kHz): 48
      Supports Joint Object Coding
      Supports Joint Object Coding with ACMOD28
    DTS:
      Max channels: 6
      Supported sample rates (kHz): 48 44.1 32
      Maximum bit rate: 1536 kb/s
    DTS-HD:
      Max channels: 8
      Supported sample rates (kHz): 192 176.4 96 88.2 48 44.1
      Audio Format Code dependent value: 0x01
    MAT (MLP):
      Max channels: 8
      Supported sample rates (kHz): 192 176.4 96 88.2 48 44.1
      Supports Dolby TrueHD, object audio PCM and channel-based PCM
      Hash calculation not required for object audio PCM or channel-based PCM
  Speaker Allocation Data Block:
    FL/FR - Front Left/Right
  Vendor-Specific Data Block (HDMI), OUI 00-0C-03:
    Source physical address: 1.0.0.0
    Maximum TMDS clock: 150 MHz
  Detailed Timing Descriptors:
    DTD 3:  1920x1080   60.000000 Hz  16:9     67.500 kHz    148.500000 MHz (698 mm x 392 mm)
                 Hfront   88 Hsync  44 Hback  148 Hpol P
                 Vfront    4 Vsync   5 Vback   36 Vpol P
    DTD 4:  1280x720    60.000000 Hz  16:9     45.000 kHz     74.250000 MHz (698 mm x 392 mm)
                 Hfront  110 Hsync  40 Hback  220 Hpol P
                 Vfront    5 Vsync   5 Vback   20 Vpol P
    DTD 5:  1440x480i   59.940060 Hz   3:1     15.734 kHz     27.000000 MHz (698 mm x 392 mm)
                 Hfront   38 Hsync 124 Hback  114 Hpol N
                 Vfront    4 Vsync   3 Vback   15 Vpol N Vfront +0.5 Odd Field
                 Vfront    4 Vsync   3 Vback   15 Vpol N Vback  +0.5 Even Field
Checksum: 0x33  Unused space in Extension Block: 28 bytes

----------------

Block 2, Unknown EDID Extension Block 0x00:
  00 ff ff ff ff ff ff 00 59 3a 44 10 01 01 01 01 '........Y:D.....'
  00 20 01 03 80 46 27 78 2a 93 6d a1 58 4d a4 27 '. ...F'x*.m.XM.''
  0a 47 4a 25 0e 00 01 01 01 01 01 01 01 01 01 01 '.GJ%............'
  01 01 01 01 01 01 02 3a 80 18 71 38 2d 40 58 2c '.......:..q8-@X,'
  45 00 ba 88 21 00 00 1e 64 19 00 40 41 00 26 30 'E...!...d..@A.&0'
  18 88 36 00 ba 88 21 00 00 18 00 00 00 fc 00 44 '..6...!........D'
  33 32 66 4d 2d 4b 30 31 0a 20 20 20 00 00 00 fd '32fM-K01.   ....'
  00 38 4c 1f 50 0f 00 0a 20 20 20 20 20 20 01 3b '.8L.P...      .;'
Checksum: 0x3b

----------------

Block 3, CTA-861 Extension Block:
  Revision: 3
  Basic audio support
  Supports YCbCr 4:4:4
  Supports YCbCr 4:2:2
  Native detailed modes: 1
  Video Data Block:
    VIC  16:  1920x1080   60.000000 Hz  16:9     67.500 kHz    148.500000 MHz (native)
    VIC   1:   640x480    59.940476 Hz   4:3     31.469 kHz     25.175000 MHz
    VIC   6:  1440x480i   59.940060 Hz   4:3     15.734 kHz     27.000000 MHz
    VIC   7:  1440x480i   59.940060 Hz  16:9     15.734 kHz     27.000000 MHz
    VIC   2:   720x480    59.940060 Hz   4:3     31.469 kHz     27.000000 MHz
    VIC   3:   720x480    59.940060 Hz  16:9     31.469 kHz     27.000000 MHz
    VIC   5:  1920x1080i  60.000000 Hz  16:9     33.750 kHz     74.250000 MHz
    VIC   4:  1280x720    60.000000 Hz  16:9     45.000 kHz     74.250000 MHz
    VIC  32:  1920x1080   24.000000 Hz  16:9     27.000 kHz     74.250000 MHz
  Audio Data Block:
    Linear PCM:
      Max channels: 2
      Supported sample rates (kHz): 48 44.1 32
      Supported sample sizes (bits): 24 20 16
    AC-3:
      Max channels: 6
      Supported sample rates (kHz): 48 44.1 32
      Maximum bit rate: 640 kb/s
    Enhanced AC-3 (DD+):
      Max channels: 8
      Supported sample rates (kHz): 48
      Supports Joint Object Coding
      Supports Joint Object Coding with ACMOD28
    DTS:
      Max channels: 6
      Supported sample rates (kHz): 48 44.1 32
      Maximum bit rate: 1536 kb/s
    DTS-HD:
      Max channels: 8
      Supported sample rates (kHz): 192 176.4 96 88.2 48 44.1
      Audio Format Code dependent value: 0x01
    MAT (MLP):
      Max channels: 8
      Supported sample rates (kHz): 192 176.4 96 88.2 48 44.1
      Supports Dolby TrueHD, object audio PCM and channel-based PCM
      Hash calculation not required for object audio PCM or channel-based PCM
  Speaker Allocation Data Block:
    FL/FR - Front Left/Right
  Vendor-Specific Data Block (HDMI), OUI 00-0C-03:
    Source physical address: 1.0.0.0
    Maximum TMDS clock: 150 MHz
  Detailed Timing Descriptors:
    DTD 6:  1920x1080   60.000000 Hz  16:9     67.500 kHz    148.500000 MHz (698 mm x 392 mm)
                 Hfront   88 Hsync  44 Hback  148 Hpol P
                 Vfront    4 Vsync   5 Vback   36 Vpol P
    DTD 7:  1280x720    60.000000 Hz  16:9     45.000 kHz     74.250000 MHz (698 mm x 392 mm)
                 Hfront  110 Hsync  40 Hback  220 Hpol P
                 Vfront    5 Vsync   5 Vback   20 Vpol P
    DTD 8:  1440x480i   59.940060 Hz   3:1     15.734 kHz     27.000000 MHz (698 mm x 392 mm)
                 Hfront   38 Hsync 124 Hback  114 Hpol N
                 Vfront    4 Vsync   3 Vback   15 Vpol N Vfront +0.5 Odd Field
                 Vfront    4 Vsync   3 Vback   15 Vpol N Vback  +0.5 Even Field
Checksum: 0x33  Unused space in Extension Block: 28 bytes

----------------

Warnings:

Block 0, Base EDID:
  Vendor & Product Identification: The serial number is one of the known dummy values, it should probably be set to 0.
  Detailed Timing Descriptor #2: Image size is 698x392 mm, but based on the picture AR it should be 698x523 mm.
Block 1, CTA-861 Extension Block:
  IT Video Formats are overscanned by default, but normally this should be underscanned.
  Detailed Timing Descriptor #5: Image size is 698x392 mm, but based on the picture AR it should be 698x232 mm.
  Add a Colorimetry Data Block with the sRGB colorimetry bit set to avoid interop issues.
Block 3, CTA-861 Extension Block:
  IT Video Formats are overscanned by default, but normally this should be underscanned.
  Detailed Timing Descriptor #8: Image size is 698x392 mm, but based on the picture AR it should be 698x232 mm.
EDID:
  Base EDID: Some timings are out of range of the Monitor Ranges:
    Vertical Freq: 24.000 - 75.029 Hz (Monitor: 56.000 - 76.000 Hz)
    Horizontal Freq: 15.734 - 67.500 kHz (Monitor: 31.000 - 80.000 kHz)
  CTA-861: Multiple native progressive timings are defined.

Failures:

Block 1, CTA-861 Extension Block:
  Missing VCDB, needed for Set Selectable RGB Quantization to avoid interop issues.
Block 2, Base EDID:
  Unknown Extension Block.
Block 3, CTA-861 Extension Block:
  Video Data Block: Duplicate VIC 16.
  Video Data Block: Duplicate VIC 1.
  Video Data Block: Duplicate VIC 6.
  Video Data Block: Duplicate VIC 7.
  Video Data Block: Duplicate VIC 2.
  Video Data Block: Duplicate VIC 3.
  Video Data Block: Duplicate VIC 5.
  Video Data Block: Duplicate VIC 4.
  Video Data Block: Duplicate VIC 32.
  Speaker Allocation Data Block: Only one instance of this Data Block is allowed.
EDID:
  Base EDID: EDID specified 1 extension block(s), but found 3 extension block(s).
  Base EDID: EDID 1.3 requires a Block Map Extension in Block 1 if there are more than 2 blocks in the EDID.

EDID conformity: FAIL
