edid-decode (hex):

00 ff ff ff ff ff ff 00 5c 23 31 10 30 36 30 30
30 16 01 03 81 30 1b 78 ea 7c a5 a3 54 4e a0 27
12 50 54 21 08 00 81 00 81 80 b3 00 01 01 01 01
01 01 01 01 01 01 02 3a 80 18 71 38 2d 40 58 2c
45 00 dc 0c 11 00 00 1e 00 00 00 fd 00 32 4b 1e
50 0f 00 0a 20 20 20 20 20 20 00 00 00 ff 00 32
4b 42 43 30 30 30 30 36 30 0a 20 20 00 00 00 fc
00 43 69 6e 74 69 71 20 32 32 48 44 0a 20 00 23

00 ff ff ff ff ff ff 00 5c 23 31 10 30 36 30 30
30 16 01 03 81 30 1b 78 ea 7c a5 a3 54 4e a0 27
12 50 54 21 08 00 81 00 81 80 b3 00 01 01 01 01
01 01 01 01 01 01 02 3a 80 18 71 38 2d 40 58 2c
45 00 dc 0c 11 00 00 1e 00 00 00 fd 00 32 4b 1e
50 0f 00 0a 20 20 20 20 20 20 00 00 00 ff 00 32
4b 42 43 30 30 30 30 36 30 0a 20 20 00 00 00 fc
00 43 69 6e 74 69 71 20 32 32 48 44 0a 20 00 23

----------------

Block 0, Base EDID:
  EDID Structure Version & Revision: 1.3
  Vendor & Product Identification:
    Manufacturer: WAC
    Model: 4145
    Serial Number: ...
    Made in: week 48 of 2012
  Basic Display Parameters & Features:
    Digital display
    DFP 1.x compatible TMDS
    Maximum image size: 48 cm x 27 cm
    Gamma: 2.20
    DPMS levels: Standby Suspend Off
    RGB color display
    First detailed timing is the preferred timing
  Color Characteristics:
    Red  : 0.6376, 0.3310
    Green: 0.3076, 0.6250
    Blue : 0.1542, 0.0722
    White: 0.3134, 0.3291
  Established Timings I & II:
    DMT 0x04:   640x480    59.940476 Hz   4:3     31.469 kHz     25.175000 MHz
    DMT 0x09:   800x600    60.316541 Hz   4:3     37.879 kHz     40.000000 MHz
    DMT 0x10:  1024x768    60.003840 Hz   4:3     48.363 kHz     65.000000 MHz
  Standard Timings:
    DMT 0x1c:  1280x800    59.810326 Hz  16:10    49.702 kHz     83.500000 MHz
    DMT 0x23:  1280x1024   60.019740 Hz   5:4     63.981 kHz    108.000000 MHz
    DMT 0x3a:  1680x1050   59.954250 Hz  16:10    65.290 kHz    146.250000 MHz
  Detailed Timing Descriptors:
    DTD 1:  1920x1080   60.000000 Hz  16:9     67.500 kHz    148.500000 MHz (476 mm x 268 mm)
                 Hfront   88 Hsync  44 Hback  148 Hpol P
                 Vfront    4 Vsync   5 Vback   36 Vpol P
    Display Range Limits:
      Monitor ranges (GTF): 50-75 Hz V, 30-80 kHz H, max dotclock 150 MHz
    Display Product Serial Number: ...
    Display Product Name: 'Cintiq 22HD'
Checksum: 0x23

----------------

Failures:

EDID:
  Extension Block 1 started with EDID header, ignoring Extension Blocks >= 1.

EDID conformity: FAIL
