edid-decode (hex):

00 ff ff ff ff ff ff 00 09 e5 34 0a 00 00 00 00
14 1f 01 04 a5 22 16 78 02 fd 25 94 5d 58 94 2a
21 50 54 00 00 00 01 01 01 01 01 01 01 01 01 01
01 01 01 01 01 01 af 41 80 54 71 b0 28 40 30 20
36 00 59 d7 10 00 00 1a 8c 34 80 54 71 b0 28 40
30 20 36 00 59 d7 10 00 00 1a 00 00 00 fe 00 4a
46 44 4b 4d 80 4e 56 31 36 57 55 4d 00 00 00 00
00 01 41 01 99 00 10 00 00 0a 01 0a 20 20 00 f4

----------------

Block 0, Base EDID:
  EDID Structure Version & Revision: 1.4
  Vendor & Product Identification:
    Manufacturer: BOE
    Model: 2612
    Made in: week 20 of 2021
  Basic Display Parameters & Features:
    Digital display
    Bits per primary color channel: 8
    DisplayPort interface
    Maximum image size: 34 cm x 22 cm
    Gamma: 2.20
    Supported color formats: RGB 4:4:4
    First detailed timing includes the native pixel format and preferred refresh rate
  Color Characteristics:
    Red  : 0.5810, 0.3662
    Green: 0.3466, 0.5791
    Blue : 0.1640, 0.1308
    White: 0.3134, 0.3291
  Established Timings I & II: none
  Standard Timings: none
  Detailed Timing Descriptors:
    DTD 1:  1920x1200   60.002141 Hz  16:10    74.403 kHz    168.150000 MHz (345 mm x 215 mm)
                 Hfront   48 Hsync  32 Hback  260 Hpol P
                 Vfront    3 Vsync   6 Vback   31 Vpol N
    DTD 2:  1920x1200   48.001713 Hz  16:10    59.522 kHz    134.520000 MHz (345 mm x 215 mm)
                 Hfront   48 Hsync  32 Hback  260 Hpol P
                 Vfront    3 Vsync   6 Vback   31 Vpol N
    Alphanumeric Data String: 'JFDKM.NV16WUM'
    Manufacturer-Specified Display Descriptor (0x00): 00 00 00 01 41 01 99 00 10 00 00 0a 01 0a 20 20 '....A.........  '
Checksum: 0xf4

----------------

Warnings:

Block 0, Base EDID:
  Alphanumeric Data String: Non-ASCII character 0x80 at position 5, can cause problems.
  Missing Display Product Name.

EDID conformity: PASS
