edid-decode (hex):

00 ff ff ff ff ff ff 00 10 ac 0c 30 50 42 30 41
2f 0d 01 03 68 1e 16 78 ee be 96 a1 5b 4c 94 24
18 4f 54 a5 4a 00 01 01 01 01 01 01 01 01 01 01
01 01 01 01 01 01 64 19 00 40 41 00 26 30 18 88
36 00 30 e4 10 00 00 18 00 00 00 ff 00 55 33 30
30 31 33 42 4a 41 30 42 50 0a 00 00 00 fc 00 44
45 4c 4c 20 31 35 30 34 46 50 0a 20 00 00 00 fd
00 38 4b 1e 3c 08 00 0a 20 20 20 20 20 20 00 fe

00 ff ff ff ff ff ff 00 10 ac 0c 30 50 42 30 41
2f 0d 01 03 68 1e 16 78 ee be 96 a1 5b 4c 94 24
18 4f 54 a5 4a 00 01 01 01 01 01 01 01 01 01 01
01 01 01 01 01 01 64 19 00 40 41 00 26 30 18 88
36 00 30 e4 10 00 00 18 00 00 00 ff 00 55 33 30
30 31 33 42 4a 41 30 42 50 0a 00 00 00 fc 00 44
45 4c 4c 20 31 35 30 34 46 50 0a 20 00 00 00 fd
00 38 4b 1e 3c 08 00 0a 20 20 20 20 20 20 00 fe

----------------

Block 0, Base EDID:
  EDID Structure Version & Revision: 1.3
  Vendor & Product Identification:
    Manufacturer: DEL
    Model: 12300
    Serial Number: ...
    Made in: week 47 of 2003
  Basic Display Parameters & Features:
    Analog display
    Signal Level Standard: 0.700 : 0.000 : 0.700 V p-p
    Blank level equals black level
    Sync: Separate
    Maximum image size: 30 cm x 22 cm
    Gamma: 2.20
    DPMS levels: Standby Suspend Off
    RGB color display
    Default (sRGB) color space is primary color space
    First detailed timing is the preferred timing
  Color Characteristics:
    Red  : 0.6308, 0.3583
    Green: 0.2998, 0.5800
    Blue : 0.1425, 0.0947
    White: 0.3095, 0.3300
  Established Timings I & II:
    IBM     :   720x400    70.081663 Hz   9:5     31.467 kHz     28.320000 MHz
    DMT 0x04:   640x480    59.940476 Hz   4:3     31.469 kHz     25.175000 MHz
    DMT 0x06:   640x480    75.000000 Hz   4:3     37.500 kHz     31.500000 MHz
    DMT 0x09:   800x600    60.316541 Hz   4:3     37.879 kHz     40.000000 MHz
    DMT 0x0b:   800x600    75.000000 Hz   4:3     46.875 kHz     49.500000 MHz
    DMT 0x10:  1024x768    60.003840 Hz   4:3     48.363 kHz     65.000000 MHz
    DMT 0x12:  1024x768    75.028582 Hz   4:3     60.023 kHz     78.750000 MHz
  Standard Timings: none
  Detailed Timing Descriptors:
    DTD 1:  1024x768    60.003840 Hz   4:3     48.363 kHz     65.000000 MHz (304 mm x 228 mm)
                 Hfront   24 Hsync 136 Hback  160 Hpol N
                 Vfront    3 Vsync   6 Vback   29 Vpol N
    Display Product Serial Number: ...
    Display Product Name: 'DELL 1504FP'
    Display Range Limits:
      Monitor ranges (GTF): 56-75 Hz V, 30-60 kHz H, max dotclock 80 MHz
Checksum: 0xfe

----------------

Failures:

Block 0, Base EDID:
  Basic Display Parameters & Features: sRGB is signaled, but the chromaticities do not match.
EDID:
  Extension Block 1 started with EDID header, ignoring Extension Blocks >= 1.

EDID conformity: FAIL
