edid-decode (hex):

00 ff ff ff ff ff ff 00 30 ae a4 60 01 01 01 01
0a 17 01 03 80 40 28 78 2e 1d f5 ae 4f 35 b3 25
0d 50 54 a1 08 00 81 00 81 80 95 00 a9 c0 b3 00
d1 c0 81 c0 d1 00 e2 68 00 a0 a0 40 2e 60 30 20
36 00 81 91 21 00 00 1a 00 00 00 ff 00 56 31 30
30 30 33 35 33 0a 20 20 20 20 00 00 00 fd 00 32
47 1e 64 1e 00 0a 20 20 20 20 20 20 00 00 00 fc
00 4c 45 4e 20 4c 54 33 30 35 33 70 77 41 01 4c

02 03 21 f1 4d 90 01 02 03 04 06 07 05 11 12 13
1f 14 23 09 07 07 83 01 00 00 66 03 0c 00 10 00
10 7f 21 80 e0 20 40 3a 60 30 40 3a 00 81 91 21
00 00 1a ad 43 00 d0 51 40 3a 60 60 88 3a 00 81
91 21 00 00 1c 66 21 50 b0 51 00 1b 30 40 70 36
00 81 91 21 00 00 1e db 65 80 c0 72 40 3a 60 90
d0 3a 00 81 91 21 00 00 1c 00 00 00 00 00 00 00
00 00 00 00 00 00 00 00 00 00 00 00 00 00 00 d8

00 ff ff ff ff ff ff 00 30 ae a4 60 01 01 01 01
0a 17 01 03 80 40 28 78 2e 1d f5 ae 4f 35 b3 25
0d 50 54 a1 08 00 81 00 81 80 95 00 a9 c0 b3 00
d1 c0 81 c0 d1 00 e2 68 00 a0 a0 40 2e 60 30 20
36 00 81 91 21 00 00 1a 00 00 00 ff 00 56 31 30
30 30 33 35 33 0a 20 20 20 20 00 00 00 fd 00 32
47 1e 64 1e 00 0a 20 20 20 20 20 20 00 00 00 fc
00 4c 45 4e 20 4c 54 33 30 35 33 70 77 41 01 4c

02 03 21 f1 4d 90 01 02 03 04 06 07 05 11 12 13
1f 14 23 09 07 07 83 01 00 00 66 03 0c 00 10 00
10 7f 21 80 e0 20 40 3a 60 30 40 3a 00 81 91 21
00 00 1a ad 43 00 d0 51 40 3a 60 60 88 3a 00 81
91 21 00 00 1c 66 21 50 b0 51 00 1b 30 40 70 36
00 81 91 21 00 00 1e db 65 80 c0 72 40 3a 60 90
d0 3a 00 81 91 21 00 00 1c 00 00 00 00 00 00 00
00 00 00 00 00 00 00 00 00 00 00 00 00 00 00 d8

----------------

Block 0, Base EDID:
  EDID Structure Version & Revision: 1.3
  Vendor & Product Identification:
    Manufacturer: LEN
    Model: 24740
    Serial Number: ...
    Made in: week 10 of 2013
  Basic Display Parameters & Features:
    Digital display
    Maximum image size: 64 cm x 40 cm
    Gamma: 2.20
    DPMS levels: Off
    RGB color display
    Default (sRGB) color space is primary color space
    First detailed timing is the preferred timing
  Color Characteristics:
    Red  : 0.6796, 0.3095
    Green: 0.2099, 0.7001
    Blue : 0.1474, 0.0537
    White: 0.3134, 0.3291
  Established Timings I & II:
    IBM     :   720x400    70.081663 Hz   9:5     31.467 kHz     28.320000 MHz
    DMT 0x04:   640x480    59.940476 Hz   4:3     31.469 kHz     25.175000 MHz
    DMT 0x09:   800x600    60.316541 Hz   4:3     37.879 kHz     40.000000 MHz
    DMT 0x10:  1024x768    60.003840 Hz   4:3     48.363 kHz     65.000000 MHz
  Standard Timings:
    DMT 0x1c:  1280x800    59.810326 Hz  16:10    49.702 kHz     83.500000 MHz
    DMT 0x23:  1280x1024   60.019740 Hz   5:4     63.981 kHz    108.000000 MHz
    DMT 0x2f:  1440x900    59.887445 Hz  16:10    55.935 kHz    106.500000 MHz
    DMT 0x53:  1600x900    60.000000 Hz  16:9     60.000 kHz    108.000000 MHz (RB)
    DMT 0x3a:  1680x1050   59.954250 Hz  16:10    65.290 kHz    146.250000 MHz
    DMT 0x52:  1920x1080   60.000000 Hz  16:9     67.500 kHz    148.500000 MHz
    DMT 0x55:  1280x720    60.000000 Hz  16:9     45.000 kHz     74.250000 MHz
    DMT 0x45:  1920x1200   59.884600 Hz  16:10    74.556 kHz    193.250000 MHz
  Detailed Timing Descriptors:
    DTD 1:  2560x1600   59.971589 Hz  16:10    98.713 kHz    268.500000 MHz (641 mm x 401 mm)
                 Hfront   48 Hsync  32 Hback   80 Hpol P
                 Vfront    3 Vsync   6 Vback   37 Vpol N
    Display Product Serial Number: ...
    Display Range Limits:
      Monitor ranges (GTF): 50-71 Hz V, 30-100 kHz H, max dotclock 300 MHz
    Display Product Name: 'LEN LT3053pwA'
  Extension blocks: 1
Checksum: 0x4c

----------------

Block 1, CTA-861 Extension Block:
  Revision: 3
  Underscans IT Video Formats by default
  Basic audio support
  Supports YCbCr 4:4:4
  Supports YCbCr 4:2:2
  Native DTDs: 1
  Video Data Block:
    VIC  16:  1920x1080   60.000000 Hz  16:9     67.500 kHz    148.500000 MHz (native)
    VIC   1:   640x480    59.940476 Hz   4:3     31.469 kHz     25.175000 MHz
    VIC   2:   720x480    59.940060 Hz   4:3     31.469 kHz     27.000000 MHz
    VIC   3:   720x480    59.940060 Hz  16:9     31.469 kHz     27.000000 MHz
    VIC   4:  1280x720    60.000000 Hz  16:9     45.000 kHz     74.250000 MHz
    VIC   6:  1440x480i   59.940060 Hz   4:3     15.734 kHz     27.000000 MHz
    VIC   7:  1440x480i   59.940060 Hz  16:9     15.734 kHz     27.000000 MHz
    VIC   5:  1920x1080i  60.000000 Hz  16:9     33.750 kHz     74.250000 MHz
    VIC  17:   720x576    50.000000 Hz   4:3     31.250 kHz     27.000000 MHz
    VIC  18:   720x576    50.000000 Hz  16:9     31.250 kHz     27.000000 MHz
    VIC  19:  1280x720    50.000000 Hz  16:9     37.500 kHz     74.250000 MHz
    VIC  31:  1920x1080   50.000000 Hz  16:9     56.250 kHz    148.500000 MHz
    VIC  20:  1920x1080i  50.000000 Hz  16:9     28.125 kHz     74.250000 MHz
  Audio Data Block:
    Linear PCM:
      Max channels: 2
      Supported sample rates (kHz): 48 44.1 32
      Supported sample sizes (bits): 24 20 16
  Speaker Allocation Data Block:
    FL/FR - Front Left/Right
  Vendor-Specific Data Block (HDMI), OUI 00-0C-03:
    Source physical address: 1.0.0.0
    DC_30bit
  Detailed Timing Descriptors:
    DTD 2:   640x1600   59.859883 Hz   2:5     99.248 kHz     85.750000 MHz (641 mm x 401 mm)
                 Hfront   48 Hsync  64 Hback  112 Hpol P
                 Vfront    3 Vsync  10 Vback   45 Vpol N
    DTD 3:  1280x1600   59.915921 Hz   4:5     99.341 kHz    173.250000 MHz (641 mm x 401 mm)
                 Hfront   96 Hsync 136 Hback  232 Hpol N
                 Vfront    3 Vsync  10 Vback   45 Vpol P
    DTD 4:  1360x768    60.015162 Hz  85:48    47.712 kHz     85.500000 MHz (641 mm x 401 mm)
                 Hfront   64 Hsync 112 Hback  256 Hpol P
                 Vfront    3 Vsync   6 Vback   18 Vpol P
    DTD 5:  1920x1600   59.934372 Hz   6:5     99.371 kHz    260.750000 MHz (641 mm x 401 mm)
                 Hfront  144 Hsync 208 Hback  352 Hpol N
                 Vfront    3 Vsync  10 Vback   45 Vpol P
Checksum: 0xd8  Unused space in Extension Block: 22 bytes

----------------

Warnings:

Block 0, Base EDID:
  Vendor & Product Identification: The serial number is one of the known dummy values, it should probably be set to 0.
Block 1, CTA-861 Extension Block:
  Video Data Block: VIC 16 and the first DTD are not identical. Is this intended?
  Detailed Timing Descriptor #2: Image size is 641x401 mm, but based on the picture AR it should be 160x401 mm.
  Detailed Timing Descriptor #3: Image size is 641x401 mm, but based on the picture AR it should be 320x401 mm.
  Detailed Timing Descriptor #4: Image size is 641x401 mm, but based on the picture AR it should be 641x361 mm.
  Detailed Timing Descriptor #5: Image size is 641x401 mm, but based on the picture AR it should be 481x401 mm.
  Display Product Serial Number is set, so the Serial Number in the Base EDID should be 0.
EDID:
  Base EDID: Some timings are out of range of the Monitor Ranges:
    Horizontal Freq: 15.734 - 99.371 kHz (Monitor: 30.000 - 100.000 kHz)

Failures:

Block 0, Base EDID:
  Basic Display Parameters & Features: sRGB is signaled, but the chromaticities do not match.
Block 1, CTA-861 Extension Block:
  Missing VCDB, needed for Set Selectable RGB Quantization to avoid interop issues.
EDID:
  Extension Block 2 started with EDID header, ignoring Extension Blocks >= 2.
  CTA-861: Native progressive timings are a mix of several resolutions.

EDID conformity: FAIL
