edid-decode (hex):

00 ff ff ff ff ff ff 00 3b 23 40 02 00 00 00 00
19 22 01 04 b5 01 01 78 3b b1 20 a6 55 53 9e 26
10 50 54 bf ef 80 71 4f 81 40 81 80 81 c0 95 00
b3 00 81 00 01 01 76 48 80 18 71 38 2d 40 58 2c
45 00 10 09 00 00 00 1e 00 00 00 fd 00 30 b4 d7
d7 2b 01 0a 20 20 20 20 20 20 00 00 00 fc 00 47
46 32 34 30 44 0a 20 20 20 20 20 20 0e 5c 80 f8
72 38 75 41 30 20 35 00 55 50 21 00 00 00 01 bd

02 03 2d f1 44 01 03 04 90 23 09 07 07 83 01 00
00 6d 1a 00 00 02 01 30 b4 00 00 00 00 00 00 e3
05 e3 01 e6 06 07 01 4f 4f 30 e2 00 d5 86 6f 80
a0 70 38 40 40 30 20 35 00 56 50 21 00 00 1e fb
81 80 a0 70 38 1f 40 20 40 45 00 56 50 21 00 00
1e 56 a2 80 a0 70 38 1e 40 30 20 35 00 56 50 21
00 00 1e 13 95 80 a0 70 38 20 40 30 20 35 00 55
50 21 00 00 1e 00 00 00 00 00 00 00 00 00 00 fb

00 ff ff ff ff ff ff 00 3b 23 40 02 00 00 00 00
19 22 01 04 b5 01 01 78 3b b1 20 a6 55 53 9e 26
10 50 54 bf ef 80 71 4f 81 40 81 80 81 c0 95 00
b3 00 81 00 01 01 76 48 80 18 71 38 2d 40 58 2c
45 00 10 09 00 00 00 1e 00 00 00 fd 00 30 b4 d7
d7 2b 01 0a 20 20 20 20 20 20 00 00 00 fc 00 47
46 32 34 30 44 0a 20 20 20 20 20 20 0e 5c 80 f8
72 38 75 41 30 20 35 00 55 50 21 00 00 00 01 bd

02 03 2d f1 44 01 03 04 90 23 09 07 07 83 01 00
00 6d 1a 00 00 02 01 30 b4 00 00 00 00 00 00 e3
05 e3 01 e6 06 07 01 4f 4f 30 e2 00 d5 86 6f 80
a0 70 38 40 40 30 20 35 00 56 50 21 00 00 1e fb
81 80 a0 70 38 1f 40 20 40 45 00 56 50 21 00 00
1e 56 a2 80 a0 70 38 1e 40 30 20 35 00 56 50 21
00 00 1e 13 95 80 a0 70 38 20 40 30 20 35 00 55
50 21 00 00 1e 00 00 00 00 00 00 00 00 00 00 fb

----------------

Block 0, Base EDID:
  EDID Structure Version & Revision: 1.4
  Vendor & Product Identification:
    Manufacturer: NYC
    Model: 576
    Made in: week 25 of 2024
  Basic Display Parameters & Features:
    Digital display
    Bits per primary color channel: 10
    DisplayPort interface
    Maximum image size: 1 cm x 1 cm
    Gamma: 2.20
    DPMS levels: Off
    Supported color formats: RGB 4:4:4, YCrCb 4:4:4, YCrCb 4:2:2
    First detailed timing includes the native pixel format and preferred refresh rate
    Display supports continuous frequencies
  Color Characteristics:
    Red  : 0.6503, 0.3349
    Green: 0.3242, 0.6181
    Blue : 0.1484, 0.0644
    White: 0.3125, 0.3281
  Established Timings I & II:
    IBM     :   720x400    70.081663 Hz   9:5     31.467 kHz     28.320000 MHz
    DMT 0x04:   640x480    59.940476 Hz   4:3     31.469 kHz     25.175000 MHz
    Apple   :   640x480    66.666667 Hz   4:3     35.000 kHz     30.240000 MHz
    DMT 0x05:   640x480    72.808802 Hz   4:3     37.861 kHz     31.500000 MHz
    DMT 0x06:   640x480    75.000000 Hz   4:3     37.500 kHz     31.500000 MHz
    DMT 0x08:   800x600    56.250000 Hz   4:3     35.156 kHz     36.000000 MHz
    DMT 0x09:   800x600    60.316541 Hz   4:3     37.879 kHz     40.000000 MHz
    DMT 0x0a:   800x600    72.187572 Hz   4:3     48.077 kHz     50.000000 MHz
    DMT 0x0b:   800x600    75.000000 Hz   4:3     46.875 kHz     49.500000 MHz
    Apple   :   832x624    74.551266 Hz   4:3     49.726 kHz     57.284000 MHz
    DMT 0x10:  1024x768    60.003840 Hz   4:3     48.363 kHz     65.000000 MHz
    DMT 0x11:  1024x768    70.069359 Hz   4:3     56.476 kHz     75.000000 MHz
    DMT 0x12:  1024x768    75.028582 Hz   4:3     60.023 kHz     78.750000 MHz
    DMT 0x24:  1280x1024   75.024675 Hz   5:4     79.976 kHz    135.000000 MHz
    Apple   :  1152x870    75.061550 Hz 192:145   68.681 kHz    100.000000 MHz
  Standard Timings:
    DMT 0x15:  1152x864    75.000000 Hz   4:3     67.500 kHz    108.000000 MHz
    DMT 0x20:  1280x960    60.000000 Hz   4:3     60.000 kHz    108.000000 MHz
    DMT 0x23:  1280x1024   60.019740 Hz   5:4     63.981 kHz    108.000000 MHz
    DMT 0x55:  1280x720    60.000000 Hz  16:9     45.000 kHz     74.250000 MHz
    DMT 0x2f:  1440x900    59.887445 Hz  16:10    55.935 kHz    106.500000 MHz
    DMT 0x3a:  1680x1050   59.954250 Hz  16:10    65.290 kHz    146.250000 MHz
    DMT 0x1c:  1280x800    59.810326 Hz  16:10    49.702 kHz     83.500000 MHz
  Detailed Timing Descriptors:
    DTD 1:  1920x1080   74.949495 Hz  16:9     84.318 kHz    185.500000 MHz (16 mm x 9 mm)
                 Hfront   88 Hsync  44 Hback  148 Hpol P
                 Vfront    4 Vsync   5 Vback   36 Vpol P
    Display Range Limits:
      Monitor ranges (Range Limits Only): 48-180 Hz V, 215-215 kHz H, max dotclock 430 MHz
    Display Product Name: 'GF240D'
    DTD 2:  1920x1080   60.518125 Hz  16:9     87.933 kHz    235.660000 MHz (analog composite, sync-on-green, 597 mm x 336 mm)
                 Hfront   48 Hsync  32 Hback  680 Hpol N
                 Vfront    3 Vsync   5 Vback  365 Vpol N
  Extension blocks: 1
Checksum: 0xbd

----------------

Block 1, CTA-861 Extension Block:
  Revision: 3
  Underscans IT Video Formats by default
  Basic audio support
  Supports YCbCr 4:4:4
  Supports YCbCr 4:2:2
  Native DTDs: 1
  Video Data Block:
    VIC   1:   640x480    59.940476 Hz   4:3     31.469 kHz     25.175000 MHz
    VIC   3:   720x480    59.940060 Hz  16:9     31.469 kHz     27.000000 MHz
    VIC   4:  1280x720    60.000000 Hz  16:9     45.000 kHz     74.250000 MHz
    VIC  16:  1920x1080   60.000000 Hz  16:9     67.500 kHz    148.500000 MHz (native)
  Audio Data Block:
    Linear PCM:
      Max channels: 2
      Supported sample rates (kHz): 48 44.1 32
      Supported sample sizes (bits): 24 20 16
  Speaker Allocation Data Block:
    FL/FR - Front Left/Right
  Vendor-Specific Data Block (AMD), OUI 00-00-1A:
    Version: 2
    Feature Caps: 0x01
    Minimum Refresh Rate: 48 Hz
    Maximum Refresh Rate: 180 Hz
    Flags 1.x: 0x00
    Flags 2.x: 0x00
  Colorimetry Data Block:
    xvYCC601
    xvYCC709
    BT2020cYCC
    BT2020YCC
    BT2020RGB
    Gamut Boundary Description Metadata Profile P0
  HDR Static Metadata Data Block:
    Electro optical transfer functions:
      Traditional gamma - SDR luminance range
      Traditional gamma - HDR luminance range
      SMPTE ST2084
    Supported static metadata descriptors:
      Static metadata type 1
    Desired content max luminance: 79 (276.782 cd/m^2)
    Desired content max frame-average luminance: 79 (276.782 cd/m^2)
    Desired content min luminance: 48 (0.098 cd/m^2)
  Video Capability Data Block:
    YCbCr quantization: Selectable (via AVI YQ)
    RGB quantization: Selectable (via AVI Q)
    PT scan behavior: Always Overscanned
    IT scan behavior: Always Overscanned
    CE scan behavior: Always Overscanned
  Detailed Timing Descriptors:
    DTD 3:  1920x1080  119.982181 Hz  16:9    137.260 kHz    285.500000 MHz (598 mm x 336 mm)
                 Hfront   48 Hsync  32 Hback   80 Hpol P
                 Vfront    3 Vsync   5 Vback   56 Vpol P
    DTD 4:  1920x1080  143.992765 Hz  16:9    159.976 kHz    332.750000 MHz (598 mm x 336 mm)
                 Hfront   32 Hsync  64 Hback   64 Hpol P
                 Vfront    4 Vsync   5 Vback   22 Vpol P
    DTD 5:  1920x1080  179.998267 Hz  16:9    199.798 kHz    415.580000 MHz (598 mm x 336 mm)
                 Hfront   48 Hsync  32 Hback   80 Hpol P
                 Vfront    3 Vsync   5 Vback   22 Vpol P
    DTD 6:  1920x1080  164.996368 Hz  16:9    183.476 kHz    381.630000 MHz (597 mm x 336 mm)
                 Hfront   48 Hsync  32 Hback   80 Hpol P
                 Vfront    3 Vsync   5 Vback   24 Vpol P
Checksum: 0xfb  Unused space in Extension Block: 10 bytes

----------------

Warnings:

Block 0, Base EDID:
  Basic Display Parameters & Features: Dubious maximum image size (1x1 is smaller than 10x10 cm).
  Detailed Timing Descriptor #1: Dubious image size (16x9 mm is smaller than 100x100 mm).
Block 1, CTA-861 Extension Block:
  Video Data Block: VIC 1 and the first DTD are not identical. Is this intended?
  Video Data Block: All VICs are in ascending order, and the first (preferred) VIC <= 4, is that intended?
  Colorimetry Data Block: Set the sRGB colorimetry bit to avoid interop issues.
  Video Capability Data Block: IT scan behavior is expected to support underscanned.
  Video Capability Data Block: S_PT is equal to S_IT and S_CE, so should be set to 0 instead.
EDID:
  Base EDID: Some timings are out of range of the Monitor Ranges:
    Horizontal Freq: 31.466 - 199.798 kHz (Monitor: 215.000 - 215.000 kHz)

Failures:

Block 0, Base EDID:
  Detailed Timing Descriptor #2: Mismatch of image size 597x336 mm vs display size 10x10 mm.
  Detailed Timing Descriptor #2: Invalid detailed timing descriptor ordering.
Block 1, CTA-861 Extension Block:
  Video Capability Data Block: IT video formats are always overscanned, but bit 7 of Byte 3 of the CTA-861 Extension header is set to underscanned.
  Detailed Timing Descriptor #3: Mismatch of image size 598x336 mm vs display size 10x10 mm.
  Detailed Timing Descriptor #4: Mismatch of image size 598x336 mm vs display size 10x10 mm.
  Detailed Timing Descriptor #5: Mismatch of image size 598x336 mm vs display size 10x10 mm.
  Detailed Timing Descriptor #6: Mismatch of image size 597x336 mm vs display size 10x10 mm.
EDID:
  Extension Block 2 started with EDID header, ignoring Extension Blocks >= 2.
  Base EDID: The DTD max image size is 598x336mm, which is larger than the display size 10.0x10.0mm.

EDID conformity: FAIL
