edid-decode (hex):

00 ff ff ff ff ff ff 00 3e 14 09 02 a8 00 00 00
0e 15 01 03 6e 00 00 00 2f 00 00 a4 50 4f 8c 23
12 48 4f af ef 80 31 59 45 59 61 59 71 4f 81 80
81 99 a9 40 90 40 64 19 00 40 41 00 26 30 18 88
36 00 00 00 00 00 00 18 00 00 00 ff 00 51 38 4a
50 31 31 34 41 30 31 36 38 0a 00 00 00 fd 00 38
78 1e 78 11 00 0a 20 20 20 20 20 20 00 00 00 fc
00 4f 70 74 6f 6d 61 20 58 47 41 0a 20 20 00 26

00 ff ff ff ff ff ff 00 3e 14 09 02 a8 00 00 00
0e 15 01 03 6e 00 00 00 2f 00 00 a4 50 4f 8c 23
12 48 4f af ef 80 31 59 45 59 61 59 71 4f 81 80
81 99 a9 40 90 40 64 19 00 40 41 00 26 30 18 88
36 00 00 00 00 00 00 18 00 00 00 ff 00 51 38 4a
50 31 31 34 41 30 31 36 38 0a 00 00 00 fd 00 38
78 1e 78 11 00 0a 20 20 20 20 20 20 00 00 00 fc
00 4f 70 74 6f 6d 61 20 58 47 41 0a 20 20 00 26

----------------

Block 0, Base EDID:
  EDID Structure Version & Revision: 1.3
  Vendor & Product Identification:
    Manufacturer: OPT
    Model: 521
    Serial Number: ...
    Made in: week 14 of 2011
  Basic Display Parameters & Features:
    Analog display
    Signal Level Standard: 0.700 : 0.000 : 0.700 V p-p
    Blank level equals black level
    Sync: Separate Composite SyncOnGreen
    Image size is variable
    Gamma: 1.00
    DPMS levels: Off
    RGB color display
    Default (sRGB) color space is primary color space
    First detailed timing is the preferred timing
    Supports GTF timings within operating range
  Color Characteristics:
    Red  : 0.6406, 0.3125
    Green: 0.3085, 0.5468
    Blue : 0.1367, 0.0703
    White: 0.2812, 0.3085
  Established Timings I & II:
    IBM     :   720x400    70.081663 Hz   9:5     31.467 kHz     28.320000 MHz
    DMT 0x04:   640x480    59.940476 Hz   4:3     31.469 kHz     25.175000 MHz
    DMT 0x05:   640x480    72.808802 Hz   4:3     37.861 kHz     31.500000 MHz
    DMT 0x06:   640x480    75.000000 Hz   4:3     37.500 kHz     31.500000 MHz
    DMT 0x08:   800x600    56.250000 Hz   4:3     35.156 kHz     36.000000 MHz
    DMT 0x09:   800x600    60.316541 Hz   4:3     37.879 kHz     40.000000 MHz
    DMT 0x0a:   800x600    72.187572 Hz   4:3     48.077 kHz     50.000000 MHz
    DMT 0x0b:   800x600    75.000000 Hz   4:3     46.875 kHz     49.500000 MHz
    Apple   :   832x624    74.551266 Hz   4:3     49.726 kHz     57.284000 MHz
    DMT 0x10:  1024x768    60.003840 Hz   4:3     48.363 kHz     65.000000 MHz
    DMT 0x11:  1024x768    70.069359 Hz   4:3     56.476 kHz     75.000000 MHz
    DMT 0x12:  1024x768    75.028582 Hz   4:3     60.023 kHz     78.750000 MHz
    DMT 0x24:  1280x1024   75.024675 Hz   5:4     79.976 kHz    135.000000 MHz
    Apple   :  1152x870    75.061550 Hz 192:145   68.681 kHz    100.000000 MHz
  Standard Timings:
    DMT 0x07:   640x480    85.008312 Hz   4:3     43.269 kHz     36.000000 MHz
    DMT 0x0c:   800x600    85.061274 Hz   4:3     53.674 kHz     56.250000 MHz
    DMT 0x13:  1024x768    84.996690 Hz   4:3     68.677 kHz     94.500000 MHz
    DMT 0x15:  1152x864    75.000000 Hz   4:3     67.500 kHz    108.000000 MHz
    DMT 0x23:  1280x1024   60.019740 Hz   5:4     63.981 kHz    108.000000 MHz
    DMT 0x25:  1280x1024   85.024098 Hz   5:4     91.146 kHz    157.500000 MHz
    DMT 0x33:  1600x1200   60.000000 Hz   4:3     75.000 kHz    162.000000 MHz
    DMT 0x2a:  1400x1050   59.978442 Hz   4:3     65.317 kHz    121.750000 MHz
  Detailed Timing Descriptors:
    DTD 1:  1024x768    60.003840 Hz   4:3     48.363 kHz     65.000000 MHz
                 Hfront   24 Hsync 136 Hback  160 Hpol N
                 Vfront    3 Vsync   6 Vback   29 Vpol N
    Display Product Serial Number: ...
    Display Range Limits:
      Monitor ranges (GTF): 56-120 Hz V, 30-120 kHz H, max dotclock 170 MHz
    Display Product Name: 'Optoma XGA'
Checksum: 0x26

----------------

Warnings:

Block 0, Base EDID:
  Basic Display Parameters & Features: sRGB is signaled, but the gamma != 2.2.

Failures:

Block 0, Base EDID:
  Basic Display Parameters & Features: sRGB is signaled, but the chromaticities do not match.
EDID:
  Extension Block 1 started with EDID header, ignoring Extension Blocks >= 1.

EDID conformity: FAIL
