edid-decode (hex):

00 ff ff ff ff ff ff 00 41 0c 7e c0 03 cc 00 00
19 16 01 03 6e 22 13 78 2a 55 4d a3 55 4a 97 27
15 4f 54 a1 08 00 01 01 01 01 01 01 01 01 01 01
01 01 01 01 01 01 66 21 56 aa 51 00 1e 30 46 8f
33 00 58 c2 10 00 00 1e 00 00 00 ff 00 41 46 32
31 32 32 35 30 35 32 32 32 37 00 00 00 fc 00 50
68 69 6c 69 70 73 20 31 36 36 56 4c 00 00 00 fd
00 38 3f 1e 3c 08 00 0a 20 20 20 20 20 20 00 23

----------------

Block 0, Base EDID:
  EDID Structure Version & Revision: 1.3
  Vendor & Product Identification:
    Manufacturer: PHL
    Model: 49278
    Serial Number: ...
    Made in: week 25 of 2012
  Basic Display Parameters & Features:
    Analog display
    Signal Level Standard: 0.700 : 0.000 : 0.700 V p-p
    Blank level equals black level
    Sync: Separate Composite SyncOnGreen
    Maximum image size: 34 cm x 19 cm
    Gamma: 2.20
    DPMS levels: Off
    RGB color display
    First detailed timing is the preferred timing
  Color Characteristics:
    Red  : 0.6376, 0.3330
    Green: 0.2900, 0.5908
    Blue : 0.1533, 0.0820
    White: 0.3115, 0.3291
  Established Timings I & II:
    IBM     :   720x400    70.081663 Hz   9:5     31.467 kHz     28.320000 MHz
    DMT 0x04:   640x480    59.940476 Hz   4:3     31.469 kHz     25.175000 MHz
    DMT 0x09:   800x600    60.316541 Hz   4:3     37.879 kHz     40.000000 MHz
    DMT 0x10:  1024x768    60.003840 Hz   4:3     48.363 kHz     65.000000 MHz
  Standard Timings: none
  Detailed Timing Descriptors:
    DTD 1:  1366x768    59.789541 Hz 683:384   47.712 kHz     85.500000 MHz (344 mm x 194 mm)
                 Hfront   70 Hsync 143 Hback  213 Hpol P
                 Vfront    3 Vsync   3 Vback   24 Vpol P
    Display Product Serial Number: ...
    Display Product Name: 'Philips 166VL'
    Display Range Limits:
      Monitor ranges (GTF): 56-63 Hz V, 30-60 kHz H, max dotclock 80 MHz
Checksum: 0x23

----------------

Warnings:

EDID:
  Base EDID: Some timings are out of range of the Monitor Ranges:
    Vertical Freq: 59.790 - 70.082 Hz (Monitor: 56.000 - 63.000 Hz)
    Maximum Clock: 85.500 MHz (Monitor: 80.000 MHz)

EDID conformity: PASS
