edid-decode (hex):

00 ff ff ff ff ff ff 00 36 83 27 95 01 00 00 00
24 15 01 04 a5 73 41 78 02 cf 74 a3 57 4c b0 23
09 48 4c a1 08 00 81 80 61 40 45 40 31 40 01 01
01 01 01 01 01 01 02 3a 80 18 71 38 2d 40 58 2c
45 00 7e 8a 42 00 00 1e 0e 1f 00 80 51 00 1e 30
40 80 37 00 7e 8a 42 00 00 1c 00 00 00 fd 00 3a
3e 1e 53 10 00 0a 20 20 20 20 20 20 00 00 00 fc
00 54 56 0a 20 20 20 20 20 20 20 20 20 20 00 c9

00 ff ff ff ff ff ff 00 36 83 27 95 01 00 00 00
24 15 01 04 a5 73 41 78 02 cf 74 a3 57 4c b0 23
09 48 4c a1 08 00 81 80 61 40 45 40 31 40 01 01
01 01 01 01 01 01 02 3a 80 18 71 38 2d 40 58 2c
45 00 7e 8a 42 00 00 1e 0e 1f 00 80 51 00 1e 30
40 80 37 00 7e 8a 42 00 00 1c 00 00 00 fd 00 3a
3e 1e 53 10 00 0a 20 20 20 20 20 20 00 00 00 fc
00 54 56 0a 20 20 20 20 20 20 20 20 20 20 00 c9

----------------

Block 0, Base EDID:
  EDID Structure Version & Revision: 1.4
  Vendor & Product Identification:
    Manufacturer: MTC
    Model: 38183
    Serial Number: ...
    Made in: week 36 of 2011
  Basic Display Parameters & Features:
    Digital display
    Bits per primary color channel: 8
    DisplayPort interface
    Maximum image size: 115 cm x 65 cm
    Gamma: 2.20
    Supported color formats: RGB 4:4:4
    First detailed timing includes the native pixel format and preferred refresh rate
  Color Characteristics:
    Red  : 0.6396, 0.3398
    Green: 0.2998, 0.6904
    Blue : 0.1376, 0.0380
    White: 0.2822, 0.2968
  Established Timings I & II:
    IBM     :   720x400    70.081663 Hz   9:5     31.467 kHz     28.320000 MHz
    DMT 0x04:   640x480    59.940476 Hz   4:3     31.469 kHz     25.175000 MHz
    DMT 0x09:   800x600    60.316541 Hz   4:3     37.879 kHz     40.000000 MHz
    DMT 0x10:  1024x768    60.003840 Hz   4:3     48.363 kHz     65.000000 MHz
  Standard Timings:
    DMT 0x23:  1280x1024   60.019740 Hz   5:4     63.981 kHz    108.000000 MHz
    DMT 0x10:  1024x768    60.003840 Hz   4:3     48.363 kHz     65.000000 MHz
    DMT 0x09:   800x600    60.316541 Hz   4:3     37.879 kHz     40.000000 MHz
    DMT 0x04:   640x480    59.940476 Hz   4:3     31.469 kHz     25.175000 MHz
  Detailed Timing Descriptors:
    DTD 1:  1920x1080   60.000000 Hz  16:9     67.500 kHz    148.500000 MHz (1150 mm x 650 mm)
                 Hfront   88 Hsync  44 Hback  148 Hpol P
                 Vfront    4 Vsync   5 Vback   36 Vpol P
    DTD 2:  1280x768    59.870228 Hz   5:3     47.776 kHz     79.500000 MHz (1150 mm x 650 mm)
                 Hfront   64 Hsync 128 Hback  192 Hpol N
                 Vfront    3 Vsync   7 Vback   20 Vpol P
    Display Range Limits:
      Monitor ranges (GTF): 58-62 Hz V, 30-83 kHz H, max dotclock 160 MHz
    Display Product Name: 'TV'
Checksum: 0xc9

----------------

Warnings:

Block 0, Base EDID:
  Vendor & Product Identification: The serial number is one of the known dummy values, it should probably be set to 0.
  Detailed Timing Descriptor #2: Image size is 1150x650 mm, but based on the picture AR it should be 1083x650 mm.
  Display Range Limits: GTF support is deprecated in EDID 1.4.
EDID:
  Base EDID: Some timings are out of range of the Monitor Ranges:
    Vertical Freq: 59.870 - 70.082 Hz (Monitor: 58.000 - 62.000 Hz)

Failures:

Block 0, Base EDID:
  Display Range Limits: GTF is supported, but the display does not support continuous frequencies.
EDID:
  Extension Block 1 started with EDID header, ignoring Extension Blocks >= 1.

EDID conformity: FAIL
