edid-decode (hex):

00 ff ff ff ff ff ff 00 0d ae e8 14 00 00 00 00
12 1c 01 04 a5 1f 11 78 02 ee 95 a3 54 4c 99 26
0f 50 54 00 00 00 01 01 01 01 01 01 01 01 01 01
01 01 01 01 01 01 b4 3b 80 4a 71 38 34 40 30 20
35 00 35 ad 10 00 00 1a b4 3b 80 4a 71 38 4f 41
30 20 35 00 35 ad 10 00 00 1a 00 00 00 fe 00 4a
54 50 46 34 80 31 34 30 48 43 4e 0a 00 00 00 00
00 01 41 01 9e 00 10 00 00 0a 01 0a 20 20 00 f7

----------------

Block 0, Base EDID:
  EDID Structure Version & Revision: 1.4
  Vendor & Product Identification:
    Manufacturer: CMN
    Model: 5352
    Made in: week 18 of 2018
  Basic Display Parameters & Features:
    Digital display
    Bits per primary color channel: 8
    DisplayPort interface
    Maximum image size: 31 cm x 17 cm
    Gamma: 2.20
    Supported color formats: RGB 4:4:4
    First detailed timing includes the native pixel format and preferred refresh rate
  Color Characteristics:
    Red  : 0.6396, 0.3300
    Green: 0.2998, 0.5996
    Blue : 0.1503, 0.0595
    White: 0.3134, 0.3291
  Established Timings I & II: none
  Standard Timings: none
  Detailed Timing Descriptors:
    DTD 1:  1920x1080   60.007852 Hz  16:9     67.929 kHz    152.840000 MHz (309 mm x 173 mm)
                 Hfront   48 Hsync  32 Hback  250 Hpol P
                 Vfront    3 Vsync   5 Vback   44 Vpol N
    DTD 2:  1920x1080   48.006282 Hz  16:9     67.929 kHz    152.840000 MHz (309 mm x 173 mm)
                 Hfront   48 Hsync  32 Hback  250 Hpol P
                 Vfront    3 Vsync   5 Vback  327 Vpol N
    Alphanumeric Data String: 'JTPF4.140HCN'
    Manufacturer-Specified Display Descriptor (0x00): 00 00 00 01 41 01 9e 00 10 00 00 0a 01 0a 20 20 '....A.........  '
Checksum: 0xf7

----------------

Warnings:

Block 0, Base EDID:
  Alphanumeric Data String: Non-ASCII character 0x80 at position 5, can cause problems.
  Missing Display Product Name.

EDID conformity: PASS
