edid-decode (hex):

00 ff ff ff ff ff ff 00 06 af 2c 16 00 00 00 00
00 1c 01 04 95 1d 10 78 02 52 45 90 57 58 90 29
20 50 54 00 00 00 01 01 01 01 01 01 01 01 01 01
01 01 01 01 01 01 ce 1d 56 e2 50 00 1e 30 26 16
36 00 25 a4 10 00 00 1a d8 17 56 e2 50 00 1e 30
26 16 36 00 25 a4 10 00 00 1a 00 00 00 fe 00 32
43 37 59 44 80 42 31 33 33 58 54 4e 00 00 00 00
00 00 41 01 96 00 11 00 00 09 01 0a 20 20 00 28

----------------

Block 0, Base EDID:
  EDID Structure Version & Revision: 1.4
  Vendor & Product Identification:
    Manufacturer: AUO
    Model: 5676
    Made in: 2018
  Basic Display Parameters & Features:
    Digital display
    Bits per primary color channel: 6
    DisplayPort interface
    Maximum image size: 29 cm x 16 cm
    Gamma: 2.20
    Supported color formats: RGB 4:4:4
    First detailed timing includes the native pixel format and preferred refresh rate
  Color Characteristics:
    Red  : 0.5634, 0.3408
    Green: 0.3437, 0.5644
    Blue : 0.1611, 0.1250
    White: 0.3134, 0.3291
  Established Timings I & II: none
  Standard Timings: none
  Detailed Timing Descriptors:
    DTD 1:  1366x768    60.059067 Hz 683:384   47.927 kHz     76.300000 MHz (293 mm x 164 mm)
                 Hfront   38 Hsync  22 Hback  166 Hpol P
                 Vfront    3 Vsync   6 Vback   21 Vpol N
    DTD 2:  1366x768    48.047254 Hz 683:384   38.342 kHz     61.040000 MHz (293 mm x 164 mm)
                 Hfront   38 Hsync  22 Hback  166 Hpol P
                 Vfront    3 Vsync   6 Vback   21 Vpol N
    Alphanumeric Data String: '2C7YD.B133XTN'
    Manufacturer-Specified Display Descriptor (0x00): 00 00 00 00 41 01 96 00 11 00 00 09 01 0a 20 20 '....A.........  '
Checksum: 0x28

----------------

Warnings:

Block 0, Base EDID:
  Alphanumeric Data String: Non-ASCII character 0x80 at position 5, can cause problems.
  Missing Display Product Name.

EDID conformity: PASS
