edid-decode (hex):

00 ff ff ff ff ff ff 00 06 b3 24 27 01 01 01 01
25 1f 01 04 b5 3d 23 78 fb 73 d1 ac 4f 48 a5 27
11 50 54 3f cf 00 d1 c0 81 80 95 00 b3 00 01 01
01 01 01 01 01 01 69 5e 00 a0 a0 a0 29 50 30 20
b8 04 55 50 21 00 00 1e 00 00 00 fd 00 30 a5 f3
f3 41 01 0a 20 20 20 20 20 20 00 00 00 fc 00 58
47 32 37 57 51 0a 20 20 20 20 20 20 00 00 00 ff
00 4d 39 4c 4d 41 53 30 30 30 30 38 34 0a 01 02

02 03 40 71 4a 02 03 11 12 13 04 90 1f 40 3f 23
09 17 07 83 01 00 00 67 03 0c 00 10 00 38 3c 67
d8 5d c4 01 78 80 03 6d 1a 00 00 02 03 30 a5 00
0f 64 2f 64 2f e3 05 c0 00 e6 06 05 01 64 64 2f
c6 fb 00 64 a0 a0 1e 50 12 20 08 04 55 50 21 00
00 1e a4 e6 00 64 a0 a0 67 50 12 20 f8 0c 55 50
21 00 00 1a 04 c0 00 64 a0 a0 64 50 18 10 25 00
55 50 21 00 00 1a 00 00 00 00 00 00 00 00 00 0f

00 ff ff ff ff ff ff 00 06 b3 24 27 01 01 01 01
25 1f 01 04 b5 3d 23 78 fb 73 d1 ac 4f 48 a5 27
11 50 54 3f cf 00 d1 c0 81 80 95 00 b3 00 01 01
01 01 01 01 01 01 69 5e 00 a0 a0 a0 29 50 30 20
b8 04 55 50 21 00 00 1e 00 00 00 fd 00 30 a5 f3
f3 41 01 0a 20 20 20 20 20 20 00 00 00 fc 00 58
47 32 37 57 51 0a 20 20 20 20 20 20 00 00 00 ff
00 4d 39 4c 4d 41 53 30 30 30 30 38 34 0a 01 02

02 03 40 71 4a 02 03 11 12 13 04 90 1f 40 3f 23
09 17 07 83 01 00 00 67 03 0c 00 10 00 38 3c 67
d8 5d c4 01 78 80 03 6d 1a 00 00 02 03 30 a5 00
0f 64 2f 64 2f e3 05 c0 00 e6 06 05 01 64 64 2f
c6 fb 00 64 a0 a0 1e 50 12 20 08 04 55 50 21 00
00 1e a4 e6 00 64 a0 a0 67 50 12 20 f8 0c 55 50
21 00 00 1a 04 c0 00 64 a0 a0 64 50 18 10 25 00
55 50 21 00 00 1a 00 00 00 00 00 00 00 00 00 0f

----------------

Block 0, Base EDID:
  EDID Structure Version & Revision: 1.4
  Vendor & Product Identification:
    Manufacturer: AUS
    Model: 10020
    Serial Number: ...
    Made in: week 37 of 2021
  Basic Display Parameters & Features:
    Digital display
    Bits per primary color channel: 10
    DisplayPort interface
    Maximum image size: 61 cm x 35 cm
    Gamma: 2.20
    DPMS levels: Standby Suspend Off
    Supported color formats: RGB 4:4:4, YCrCb 4:4:4, YCrCb 4:2:2
    First detailed timing includes the native pixel format and preferred refresh rate
    Display supports continuous frequencies
  Color Characteristics:
    Red  : 0.6728, 0.3115
    Green: 0.2812, 0.6474
    Blue : 0.1552, 0.0673
    White: 0.3125, 0.3291
  Established Timings I & II:
    DMT 0x04:   640x480    59.940476 Hz   4:3     31.469 kHz     25.175000 MHz
    Apple   :   640x480    66.666667 Hz   4:3     35.000 kHz     30.240000 MHz
    DMT 0x05:   640x480    72.808802 Hz   4:3     37.861 kHz     31.500000 MHz
    DMT 0x06:   640x480    75.000000 Hz   4:3     37.500 kHz     31.500000 MHz
    DMT 0x08:   800x600    56.250000 Hz   4:3     35.156 kHz     36.000000 MHz
    DMT 0x09:   800x600    60.316541 Hz   4:3     37.879 kHz     40.000000 MHz
    DMT 0x0a:   800x600    72.187572 Hz   4:3     48.077 kHz     50.000000 MHz
    DMT 0x0b:   800x600    75.000000 Hz   4:3     46.875 kHz     49.500000 MHz
    DMT 0x10:  1024x768    60.003840 Hz   4:3     48.363 kHz     65.000000 MHz
    DMT 0x11:  1024x768    70.069359 Hz   4:3     56.476 kHz     75.000000 MHz
    DMT 0x12:  1024x768    75.028582 Hz   4:3     60.023 kHz     78.750000 MHz
    DMT 0x24:  1280x1024   75.024675 Hz   5:4     79.976 kHz    135.000000 MHz
  Standard Timings:
    DMT 0x52:  1920x1080   60.000000 Hz  16:9     67.500 kHz    148.500000 MHz
    DMT 0x23:  1280x1024   60.019740 Hz   5:4     63.981 kHz    108.000000 MHz
    DMT 0x2f:  1440x900    59.887445 Hz  16:10    55.935 kHz    106.500000 MHz
    DMT 0x3a:  1680x1050   59.954250 Hz  16:10    65.290 kHz    146.250000 MHz
  Detailed Timing Descriptors:
    DTD 1:  2560x1440   59.997716 Hz  16:9     88.857 kHz    241.690000 MHz (597 mm x 336 mm)
                 Hfront   48 Hsync  32 Hback   80 Hpol P
                 Vfront   27 Vsync   8 Vback    6 Vpol P
    Display Range Limits:
      Monitor ranges (Range Limits Only): 48-165 Hz V, 243-243 kHz H, max dotclock 650 MHz
    Display Product Name: 'XG27WQ'
    Display Product Serial Number: ...
  Extension blocks: 1
Checksum: 0x02

----------------

Block 1, CTA-861 Extension Block:
  Revision: 3
  Basic audio support
  Supports YCbCr 4:4:4
  Supports YCbCr 4:2:2
  Native detailed modes: 1
  Video Data Block:
    VIC   2:   720x480    59.940060 Hz   4:3     31.469 kHz     27.000000 MHz
    VIC   3:   720x480    59.940060 Hz  16:9     31.469 kHz     27.000000 MHz
    VIC  17:   720x576    50.000000 Hz   4:3     31.250 kHz     27.000000 MHz
    VIC  18:   720x576    50.000000 Hz  16:9     31.250 kHz     27.000000 MHz
    VIC  19:  1280x720    50.000000 Hz  16:9     37.500 kHz     74.250000 MHz
    VIC   4:  1280x720    60.000000 Hz  16:9     45.000 kHz     74.250000 MHz
    VIC  16:  1920x1080   60.000000 Hz  16:9     67.500 kHz    148.500000 MHz (native)
    VIC  31:  1920x1080   50.000000 Hz  16:9     56.250 kHz    148.500000 MHz
    VIC  64:  1920x1080  100.000000 Hz  16:9    112.500 kHz    297.000000 MHz
    VIC  63:  1920x1080  120.000000 Hz  16:9    135.000 kHz    297.000000 MHz
  Audio Data Block:
    Linear PCM:
      Max channels: 2
      Supported sample rates (kHz): 96 48 44.1 32
      Supported sample sizes (bits): 24 20 16
  Speaker Allocation Data Block:
    FL/FR - Front Left/Right
  Vendor-Specific Data Block (HDMI), OUI 00-0C-03:
    Source physical address: 1.0.0.0
    DC_36bit
    DC_30bit
    DC_Y444
    Maximum TMDS clock: 300 MHz
  Vendor-Specific Data Block (HDMI Forum), OUI C4-5D-D8:
    Version: 1
    Maximum TMDS Character Rate: 600 MHz
    SCDC Present
    Supports 12-bits/component Deep Color 4:2:0 Pixel Encoding
    Supports 10-bits/component Deep Color 4:2:0 Pixel Encoding
  Vendor-Specific Data Block (AMD), OUI 00-00-1A:
    Version: 2
    Feature Caps: 0x03
    Minimum Refresh Rate: 48 Hz
    Maximum Refresh Rate: 165 Hz
    Flags 1.x: 0x00
    Flags 2.x: 0x0f
    Maximum luminance: 100 (436.203 cd/m^2)
    Minimum luminance: 47 (0.148 cd/m^2)
    Maximum luminance (without local dimming): 100 (436.203 cd/m^2)
    Minimum luminance (without local dimming): 47 (0.148 cd/m^2)
  Colorimetry Data Block:
    BT2020YCC
    BT2020RGB
  HDR Static Metadata Data Block:
    Electro optical transfer functions:
      Traditional gamma - SDR luminance range
      SMPTE ST2084
    Supported static metadata descriptors:
      Static metadata type 1
    Desired content max luminance: 100 (436.203 cd/m^2)
    Desired content max frame-average luminance: 100 (436.203 cd/m^2)
    Desired content min luminance: 47 (0.148 cd/m^2)
  Detailed Timing Descriptors:
    DTD 2:  2560x1440  164.835558 Hz  16:9    242.308 kHz    644.540000 MHz (597 mm x 336 mm)
                 Hfront   18 Hsync  32 Hback   50 Hpol P
                 Vfront   16 Vsync   8 Vback    6 Vpol P
    DTD 3:  2560x1440  143.856076 Hz  16:9    221.970 kHz    590.440000 MHz (597 mm x 336 mm)
                 Hfront   18 Hsync  32 Hback   50 Hpol P
                 Vfront   63 Vsync   8 Vback   32 Vpol N
    DTD 4:  2560x1440  119.998047 Hz  16:9    184.797 kHz    491.560000 MHz (597 mm x 336 mm)
                 Hfront   24 Hsync  16 Hback   60 Hpol P
                 Vfront    2 Vsync   5 Vback   93 Vpol N
Checksum: 0x0f  Unused space in Extension Block: 9 bytes

----------------

Block 2, Unknown EDID Extension Block 0x00:
  00 ff ff ff ff ff ff 00 06 b3 24 27 01 01 01 01 '..........$'....'
  25 1f 01 04 b5 3d 23 78 fb 73 d1 ac 4f 48 a5 27 '%....=#x.s..OH.''
  11 50 54 3f cf 00 d1 c0 81 80 95 00 b3 00 01 01 '.PT?............'
  01 01 01 01 01 01 69 5e 00 a0 a0 a0 29 50 30 20 '......i^....)P0 '
  b8 04 55 50 21 00 00 1e 00 00 00 fd 00 30 a5 f3 '..UP!........0..'
  f3 41 01 0a 20 20 20 20 20 20 00 00 00 fc 00 58 '.A..      .....X'
  47 32 37 57 51 0a 20 20 20 20 20 20 00 00 00 ff 'G27WQ.      ....'
  00 4d 39 4c 4d 41 53 30 30 30 30 38 34 0a 01 02 '.M9LMAS000084...'
Checksum: 0x02

----------------

Block 3, CTA-861 Extension Block:
  Revision: 3
  Basic audio support
  Supports YCbCr 4:4:4
  Supports YCbCr 4:2:2
  Native detailed modes: 1
  Video Data Block:
    VIC   2:   720x480    59.940060 Hz   4:3     31.469 kHz     27.000000 MHz
    VIC   3:   720x480    59.940060 Hz  16:9     31.469 kHz     27.000000 MHz
    VIC  17:   720x576    50.000000 Hz   4:3     31.250 kHz     27.000000 MHz
    VIC  18:   720x576    50.000000 Hz  16:9     31.250 kHz     27.000000 MHz
    VIC  19:  1280x720    50.000000 Hz  16:9     37.500 kHz     74.250000 MHz
    VIC   4:  1280x720    60.000000 Hz  16:9     45.000 kHz     74.250000 MHz
    VIC  16:  1920x1080   60.000000 Hz  16:9     67.500 kHz    148.500000 MHz (native)
    VIC  31:  1920x1080   50.000000 Hz  16:9     56.250 kHz    148.500000 MHz
    VIC  64:  1920x1080  100.000000 Hz  16:9    112.500 kHz    297.000000 MHz
    VIC  63:  1920x1080  120.000000 Hz  16:9    135.000 kHz    297.000000 MHz
  Audio Data Block:
    Linear PCM:
      Max channels: 2
      Supported sample rates (kHz): 96 48 44.1 32
      Supported sample sizes (bits): 24 20 16
  Speaker Allocation Data Block:
    FL/FR - Front Left/Right
  Vendor-Specific Data Block (HDMI), OUI 00-0C-03:
    Source physical address: 1.0.0.0
    DC_36bit
    DC_30bit
    DC_Y444
    Maximum TMDS clock: 300 MHz
  Vendor-Specific Data Block (HDMI Forum), OUI C4-5D-D8:
    Version: 1
    Maximum TMDS Character Rate: 600 MHz
    SCDC Present
    Supports 12-bits/component Deep Color 4:2:0 Pixel Encoding
    Supports 10-bits/component Deep Color 4:2:0 Pixel Encoding
  Vendor-Specific Data Block (AMD), OUI 00-00-1A:
    Version: 2
    Feature Caps: 0x03
    Minimum Refresh Rate: 48 Hz
    Maximum Refresh Rate: 165 Hz
    Flags 1.x: 0x00
    Flags 2.x: 0x0f
    Maximum luminance: 100 (436.203 cd/m^2)
    Minimum luminance: 47 (0.148 cd/m^2)
    Maximum luminance (without local dimming): 100 (436.203 cd/m^2)
    Minimum luminance (without local dimming): 47 (0.148 cd/m^2)
  Colorimetry Data Block:
    BT2020YCC
    BT2020RGB
  HDR Static Metadata Data Block:
    Electro optical transfer functions:
      Traditional gamma - SDR luminance range
      SMPTE ST2084
    Supported static metadata descriptors:
      Static metadata type 1
    Desired content max luminance: 100 (436.203 cd/m^2)
    Desired content max frame-average luminance: 100 (436.203 cd/m^2)
    Desired content min luminance: 47 (0.148 cd/m^2)
  Detailed Timing Descriptors:
    DTD 5:  2560x1440  164.835558 Hz  16:9    242.308 kHz    644.540000 MHz (597 mm x 336 mm)
                 Hfront   18 Hsync  32 Hback   50 Hpol P
                 Vfront   16 Vsync   8 Vback    6 Vpol P
    DTD 6:  2560x1440  143.856076 Hz  16:9    221.970 kHz    590.440000 MHz (597 mm x 336 mm)
                 Hfront   18 Hsync  32 Hback   50 Hpol P
                 Vfront   63 Vsync   8 Vback   32 Vpol N
    DTD 7:  2560x1440  119.998047 Hz  16:9    184.797 kHz    491.560000 MHz (597 mm x 336 mm)
                 Hfront   24 Hsync  16 Hback   60 Hpol P
                 Vfront    2 Vsync   5 Vback   93 Vpol N
Checksum: 0x0f  Unused space in Extension Block: 9 bytes

----------------

Warnings:

Block 0, Base EDID:
  Vendor & Product Identification: The serial number is one of the known dummy values, it should probably be set to 0.
Block 1, CTA-861 Extension Block:
  IT Video Formats are overscanned by default, but normally this should be underscanned.
  Video Data Block: VIC 2 and the first DTD are not identical. Is this intended?
  Colorimetry Data Block: Set the sRGB colorimetry bit to avoid interop issues.
  Display Product Serial Number is set, so the Serial Number in the Base EDID should be 0.
Block 3, CTA-861 Extension Block:
  IT Video Formats are overscanned by default, but normally this should be underscanned.
  Colorimetry Data Block: Set the sRGB colorimetry bit to avoid interop issues.
EDID:
  Base EDID: Some timings are out of range of the Monitor Ranges:
    Horizontal Freq: 31.250 - 242.308 kHz (Monitor: 243.000 - 243.000 kHz)

Failures:

Block 0, Base EDID:
  Detailed Timing Descriptor #1: Mismatch of image size 597x336 mm vs display size 610x350 mm.
Block 1, CTA-861 Extension Block:
  Vendor-Specific Data Block (HDMI), OUI 00-0C-03: The HDMI Specification requires EDID 1.3 instead of 1.4.
  Detailed Timing Descriptor #2: Mismatch of image size 597x336 mm vs display size 610x350 mm.
  Detailed Timing Descriptor #3: Mismatch of image size 597x336 mm vs display size 610x350 mm.
  Detailed Timing Descriptor #4: Mismatch of image size 597x336 mm vs display size 610x350 mm.
  Missing VCDB, needed for Set Selectable RGB Quantization to avoid interop issues.
Block 2, Base EDID:
  Unknown Extension Block.
Block 3, CTA-861 Extension Block:
  Video Data Block: Duplicate VIC 2.
  Video Data Block: Duplicate VIC 3.
  Video Data Block: Duplicate VIC 17.
  Video Data Block: Duplicate VIC 18.
  Video Data Block: Duplicate VIC 19.
  Video Data Block: Duplicate VIC 4.
  Video Data Block: Duplicate VIC 16.
  Video Data Block: Duplicate VIC 31.
  Video Data Block: Duplicate VIC 64.
  Video Data Block: Duplicate VIC 63.
  Speaker Allocation Data Block: Only one instance of this Data Block is allowed.
  Vendor-Specific Data Block (HDMI), OUI 00-0C-03: The HDMI Specification requires EDID 1.3 instead of 1.4.
  Vendor-Specific Data Block (HDMI Forum), OUI C4-5D-D8: Duplicate HDMI Forum VSDB/SCDB.
  Colorimetry Data Block: Only one instance of this Data Block is allowed.
  HDR Static Metadata Data Block: Only one instance of this Data Block is allowed.
  Detailed Timing Descriptor #5: Mismatch of image size 597x336 mm vs display size 610x350 mm.
  Detailed Timing Descriptor #6: Mismatch of image size 597x336 mm vs display size 610x350 mm.
  Detailed Timing Descriptor #7: Mismatch of image size 597x336 mm vs display size 610x350 mm.
EDID:
  Base EDID: EDID specified 1 extension block(s), but found 3 extension block(s).
  CTA-861: The maximum HDMI TMDS clock is 600000 kHz, but one or more video timings go up to 644540 kHz.
  CTA-861: Native progressive timings are a mix of several resolutions.

EDID conformity: FAIL
