edid-decode (hex):

00 ff ff ff ff ff ff 00 30 ae 18 f9 01 00 00 00
1e 1f 01 04 a0 35 1e 78 e6 e8 60 a5 57 51 9e 27
0f 50 54 00 00 00 01 01 01 01 01 01 01 01 01 01
01 01 01 01 01 01 02 3a 80 18 71 38 2d 40 58 2c
45 00 0f 28 21 00 00 1e 00 00 00 fc 00 4c 45 4e
2d 42 2d 41 0a 20 20 20 20 20 00 00 00 fd 00 39
3e 53 53 10 01 0a 20 20 20 20 20 20 00 00 00 fe
00 4d 56 32 33 38 46 48 4d 2d 4e 32 30 0a 00 e6

00 ff ff ff ff ff ff 00 30 ae 18 f9 01 00 00 00
1e 1f 01 04 a0 35 1e 78 e6 e8 60 a5 57 51 9e 27
0f 50 54 00 00 00 01 01 01 01 01 01 01 01 01 01
01 01 01 01 01 01 02 3a 80 18 71 38 2d 40 58 2c
45 00 0f 28 21 00 00 1e 00 00 00 fc 00 4c 45 4e
2d 42 2d 41 0a 20 20 20 20 20 00 00 00 fd 00 39
3e 53 53 10 01 0a 20 20 20 20 20 20 00 00 00 fe
00 4d 56 32 33 38 46 48 4d 2d 4e 32 30 0a 00 e6

----------------

Block 0, Base EDID:
  EDID Structure Version & Revision: 1.4
  Vendor & Product Identification:
    Manufacturer: LEN
    Model: 63768
    Serial Number: ...
    Made in: week 30 of 2021
  Basic Display Parameters & Features:
    Digital display
    Bits per primary color channel: 8
    Digital interface is not defined
    Maximum image size: 53 cm x 30 cm
    Gamma: 2.20
    DPMS levels: Standby Suspend Off
    Supported color formats: RGB 4:4:4
    Default (sRGB) color space is primary color space
    First detailed timing includes the native pixel format and preferred refresh rate
  Color Characteristics:
    Red  : 0.6474, 0.3417
    Green: 0.3183, 0.6171
    Blue : 0.1533, 0.0605
    White: 0.3125, 0.3281
  Established Timings I & II: none
  Standard Timings: none
  Detailed Timing Descriptors:
    DTD 1:  1920x1080   60.000000 Hz  16:9     67.500 kHz    148.500000 MHz (527 mm x 296 mm)
                 Hfront   88 Hsync  44 Hback  148 Hpol P
                 Vfront    4 Vsync   5 Vback   36 Vpol P
    Display Product Name: 'LEN-B-A'
    Display Range Limits:
      Monitor ranges (Range Limits Only): 57-62 Hz V, 83-83 kHz H, max dotclock 160 MHz
    Alphanumeric Data String: 'MV238FHM-N20'
Checksum: 0xe6

----------------

Warnings:

Block 0, Base EDID:
  Vendor & Product Identification: The serial number is one of the known dummy values, it should probably be set to 0.
EDID:
  Base EDID: Some timings are out of range of the Monitor Ranges:
    Horizontal Freq: 67.500 - 67.500 kHz (Monitor: 83.000 - 83.000 kHz)

Failures:

Block 0, Base EDID:
  Basic Display Parameters & Features: sRGB is signaled, but the chromaticities do not match.
EDID:
  Extension Block 1 started with EDID header, ignoring Extension Blocks >= 1.

EDID conformity: FAIL
