edid-decode (hex):

00 ff ff ff ff ff ff 00 1a b3 a3 07 01 00 00 00
29 12 01 03 68 2b 1a 78 2a c9 05 a3 57 4b 9c 25
12 50 54 a5 4a 00 81 c0 01 01 01 01 01 01 01 01
01 01 01 01 01 01 66 21 56 aa 51 00 1e 30 46 8f
33 00 ae ff 10 00 00 1e 00 00 00 fd 00 32 4b 1c
52 10 00 0a 20 20 20 20 20 20 00 00 00 fc 00 4c
4c 20 33 31 39 30 54 0a 20 20 20 20 00 00 00 ff
00 59 45 38 47 30 31 37 34 34 34 0a 20 20 00 74

00 ff ff ff ff ff ff 00 1a b3 a3 07 01 00 00 00
29 12 01 03 68 2b 1a 78 2a c9 05 a3 57 4b 9c 25
12 50 54 a5 4a 00 81 c0 01 01 01 01 01 01 01 01
01 01 01 01 01 01 66 21 56 aa 51 00 1e 30 46 8f
33 00 ae ff 10 00 00 1e 00 00 00 fd 00 32 4b 1c
52 10 00 0a 20 20 20 20 20 20 00 00 00 fc 00 4c
4c 20 33 31 39 30 54 0a 20 20 20 20 00 00 00 ff
00 59 45 38 47 30 31 37 34 34 34 0a 20 20 00 74

----------------

Block 0, Base EDID:
  EDID Structure Version & Revision: 1.3
  Vendor & Product Identification:
    Manufacturer: FUS
    Model: 1955
    Serial Number: ...
    Made in: week 41 of 2008
  Basic Display Parameters & Features:
    Analog display
    Signal Level Standard: 0.700 : 0.000 : 0.700 V p-p
    Blank level equals black level
    Sync: Separate
    Maximum image size: 43 cm x 26 cm
    Gamma: 2.20
    DPMS levels: Off
    RGB color display
    First detailed timing is the preferred timing
  Color Characteristics:
    Red  : 0.6396, 0.3398
    Green: 0.2949, 0.6103
    Blue : 0.1445, 0.0703
    White: 0.3134, 0.3291
  Established Timings I & II:
    IBM     :   720x400    70.081663 Hz   9:5     31.467 kHz     28.320000 MHz
    DMT 0x04:   640x480    59.940476 Hz   4:3     31.469 kHz     25.175000 MHz
    DMT 0x06:   640x480    75.000000 Hz   4:3     37.500 kHz     31.500000 MHz
    DMT 0x09:   800x600    60.316541 Hz   4:3     37.879 kHz     40.000000 MHz
    DMT 0x0b:   800x600    75.000000 Hz   4:3     46.875 kHz     49.500000 MHz
    DMT 0x10:  1024x768    60.003840 Hz   4:3     48.363 kHz     65.000000 MHz
    DMT 0x12:  1024x768    75.028582 Hz   4:3     60.023 kHz     78.750000 MHz
  Standard Timings:
    DMT 0x55:  1280x720    60.000000 Hz  16:9     45.000 kHz     74.250000 MHz
  Detailed Timing Descriptors:
    DTD 1:  1366x768    59.789541 Hz 683:384   47.712 kHz     85.500000 MHz (430 mm x 255 mm)
                 Hfront   70 Hsync 143 Hback  213 Hpol P
                 Vfront    3 Vsync   3 Vback   24 Vpol P
    Display Range Limits:
      Monitor ranges (GTF): 50-75 Hz V, 28-82 kHz H, max dotclock 160 MHz
    Display Product Name: 'LL 3190T'
    Display Product Serial Number: ...
Checksum: 0x74

----------------

Block 1, Unknown EDID Extension Block 0x00:
  00 ff ff ff ff ff ff 00 1a b3 a3 07 01 00 00 00 '................'
  29 12 01 03 68 2b 1a 78 2a c9 05 a3 57 4b 9c 25 ')...h+.x*...WK.%'
  12 50 54 a5 4a 00 81 c0 01 01 01 01 01 01 01 01 '.PT.J...........'
  01 01 01 01 01 01 66 21 56 aa 51 00 1e 30 46 8f '......f!V.Q..0F.'
  33 00 ae ff 10 00 00 1e 00 00 00 fd 00 32 4b 1c '3............2K.'
  52 10 00 0a 20 20 20 20 20 20 00 00 00 fc 00 4c 'R...      .....L'
  4c 20 33 31 39 30 54 0a 20 20 20 20 00 00 00 ff 'L 3190T.    ....'
  00 59 45 38 47 30 31 37 34 34 34 0a 20 20 00 74 '.YE8G017444.  .t'
Checksum: 0x74

----------------

Warnings:

Block 0, Base EDID:
  Vendor & Product Identification: The serial number is one of the known dummy values, it should probably be set to 0.
  Detailed Timing Descriptor #1: Image size is 430x255 mm, but based on the picture AR it should be 430x241 mm.

Failures:

Block 1, Base EDID:
  Unknown Extension Block.
EDID:
  Base EDID: EDID specified 0 extension block(s), but found 1 extension block(s).

EDID conformity: FAIL
