edid-decode (hex):

00 ff ff ff ff ff ff 00 22 f0 9b 30 01 01 01 01
13 18 01 03 80 40 28 78 2a 1d f5 ae 4f 35 b3 25
0d 50 54 a1 08 00 d1 00 b3 00 95 00 81 00 a9 40
81 80 d1 c0 81 c0 e2 68 00 a0 a0 40 2e 60 30 20
36 00 81 90 21 00 00 1a 00 00 00 fd 00 32 46 18
62 1b 00 0a 20 20 20 20 20 20 00 00 00 fc 00 48
50 20 5a 33 30 69 0a 20 20 20 20 20 00 00 00 ff
00 43 4e 34 34 31 39 30 36 34 4b 0a 20 20 01 8c

02 03 1e f1 49 90 04 03 02 1f 13 12 11 01 23 09
07 07 83 01 00 00 67 03 0c 00 10 00 00 36 02 3a
80 18 71 38 2d 40 58 2c 45 00 81 90 21 00 00 1e
02 3a 80 d0 72 38 2d 40 10 2c 45 80 81 90 21 00
00 1e 01 1d 00 72 51 d0 1e 20 6e 28 55 00 81 90
21 00 00 1e 01 1d 00 bc 52 d0 1e 20 b8 28 55 40
81 90 21 00 00 1e 8c 0a d0 8a 20 e0 2d 10 10 3e
96 00 81 90 21 00 00 18 00 00 00 00 00 00 00 bf

00 ff ff ff ff ff ff 00 22 f0 9b 30 01 01 01 01
13 18 01 03 80 40 28 78 2a 1d f5 ae 4f 35 b3 25
0d 50 54 a1 08 00 d1 00 b3 00 95 00 81 00 a9 40
81 80 d1 c0 81 c0 e2 68 00 a0 a0 40 2e 60 30 20
36 00 81 90 21 00 00 1a 00 00 00 fd 00 32 46 18
62 1b 00 0a 20 20 20 20 20 20 00 00 00 fc 00 48
50 20 5a 33 30 69 0a 20 20 20 20 20 00 00 00 ff
00 43 4e 34 34 31 39 30 36 34 4b 0a 20 20 01 8c

02 03 1e f1 49 90 04 03 02 1f 13 12 11 01 23 09
07 07 83 01 00 00 67 03 0c 00 10 00 00 36 02 3a
80 18 71 38 2d 40 58 2c 45 00 81 90 21 00 00 1e
02 3a 80 d0 72 38 2d 40 10 2c 45 80 81 90 21 00
00 1e 01 1d 00 72 51 d0 1e 20 6e 28 55 00 81 90
21 00 00 1e 01 1d 00 bc 52 d0 1e 20 b8 28 55 40
81 90 21 00 00 1e 8c 0a d0 8a 20 e0 2d 10 10 3e
96 00 81 90 21 00 00 18 00 00 00 00 00 00 00 bf

----------------

Block 0, Base EDID:
  EDID Structure Version & Revision: 1.3
  Vendor & Product Identification:
    Manufacturer: HWP
    Model: 12443
    Serial Number: ...
    Made in: week 19 of 2014
  Basic Display Parameters & Features:
    Digital display
    Maximum image size: 64 cm x 40 cm
    Gamma: 2.20
    DPMS levels: Off
    RGB color display
    First detailed timing is the preferred timing
  Color Characteristics:
    Red  : 0.6796, 0.3095
    Green: 0.2099, 0.7001
    Blue : 0.1474, 0.0537
    White: 0.3134, 0.3291
  Established Timings I & II:
    IBM     :   720x400    70.081663 Hz   9:5     31.467 kHz     28.320000 MHz
    DMT 0x04:   640x480    59.940476 Hz   4:3     31.469 kHz     25.175000 MHz
    DMT 0x09:   800x600    60.316541 Hz   4:3     37.879 kHz     40.000000 MHz
    DMT 0x10:  1024x768    60.003840 Hz   4:3     48.363 kHz     65.000000 MHz
  Standard Timings:
    DMT 0x45:  1920x1200   59.884600 Hz  16:10    74.556 kHz    193.250000 MHz
    DMT 0x3a:  1680x1050   59.954250 Hz  16:10    65.290 kHz    146.250000 MHz
    DMT 0x2f:  1440x900    59.887445 Hz  16:10    55.935 kHz    106.500000 MHz
    DMT 0x1c:  1280x800    59.810326 Hz  16:10    49.702 kHz     83.500000 MHz
    DMT 0x33:  1600x1200   60.000000 Hz   4:3     75.000 kHz    162.000000 MHz
    DMT 0x23:  1280x1024   60.019740 Hz   5:4     63.981 kHz    108.000000 MHz
    DMT 0x52:  1920x1080   60.000000 Hz  16:9     67.500 kHz    148.500000 MHz
    DMT 0x55:  1280x720    60.000000 Hz  16:9     45.000 kHz     74.250000 MHz
  Detailed Timing Descriptors:
    DTD 1:  2560x1600   59.971589 Hz  16:10    98.713 kHz    268.500000 MHz (641 mm x 400 mm)
                 Hfront   48 Hsync  32 Hback   80 Hpol P
                 Vfront    3 Vsync   6 Vback   37 Vpol N
    Display Range Limits:
      Monitor ranges (GTF): 50-70 Hz V, 24-98 kHz H, max dotclock 270 MHz
    Display Product Name: 'HP Z30i'
    Display Product Serial Number: ...
  Extension blocks: 1
Checksum: 0x8c

----------------

Block 1, CTA-861 Extension Block:
  Revision: 3
  Underscans IT Video Formats by default
  Basic audio support
  Supports YCbCr 4:4:4
  Supports YCbCr 4:2:2
  Native DTDs: 1
  Video Data Block:
    VIC  16:  1920x1080   60.000000 Hz  16:9     67.500 kHz    148.500000 MHz (native)
    VIC   4:  1280x720    60.000000 Hz  16:9     45.000 kHz     74.250000 MHz
    VIC   3:   720x480    59.940060 Hz  16:9     31.469 kHz     27.000000 MHz
    VIC   2:   720x480    59.940060 Hz   4:3     31.469 kHz     27.000000 MHz
    VIC  31:  1920x1080   50.000000 Hz  16:9     56.250 kHz    148.500000 MHz
    VIC  19:  1280x720    50.000000 Hz  16:9     37.500 kHz     74.250000 MHz
    VIC  18:   720x576    50.000000 Hz  16:9     31.250 kHz     27.000000 MHz
    VIC  17:   720x576    50.000000 Hz   4:3     31.250 kHz     27.000000 MHz
    VIC   1:   640x480    59.940476 Hz   4:3     31.469 kHz     25.175000 MHz
  Audio Data Block:
    Linear PCM:
      Max channels: 2
      Supported sample rates (kHz): 48 44.1 32
      Supported sample sizes (bits): 24 20 16
  Speaker Allocation Data Block:
    FL/FR - Front Left/Right
  Vendor-Specific Data Block (HDMI), OUI 00-0C-03:
    Source physical address: 1.0.0.0
    Maximum TMDS clock: 270 MHz
  Detailed Timing Descriptors:
    DTD 2:  1920x1080   60.000000 Hz  16:9     67.500 kHz    148.500000 MHz (641 mm x 400 mm)
                 Hfront   88 Hsync  44 Hback  148 Hpol P
                 Vfront    4 Vsync   5 Vback   36 Vpol P
    DTD 3:  1920x1080   50.000000 Hz  16:9     56.250 kHz    148.500000 MHz (641 mm x 400 mm)
                 Hfront  528 Hsync  44 Hback  148 Hpol P
                 Vfront    4 Vsync   5 Vback   36 Vpol P
    DTD 4:  1280x720    60.000000 Hz  16:9     45.000 kHz     74.250000 MHz (641 mm x 400 mm)
                 Hfront  110 Hsync  40 Hback  220 Hpol P
                 Vfront    5 Vsync   5 Vback   20 Vpol P
    DTD 5:  1280x720    50.000000 Hz  16:9     37.500 kHz     74.250000 MHz (641 mm x 400 mm)
                 Hfront  440 Hsync  40 Hback  220 Hpol P
                 Vfront    5 Vsync   5 Vback   20 Vpol P
    DTD 6:   720x480    59.940060 Hz   3:2     31.469 kHz     27.000000 MHz (641 mm x 400 mm)
                 Hfront   16 Hsync  62 Hback   60 Hpol N
                 Vfront    9 Vsync   6 Vback   30 Vpol N
Checksum: 0xbf  Unused space in Extension Block: 7 bytes

----------------

Warnings:

Block 0, Base EDID:
  Vendor & Product Identification: The serial number is one of the known dummy values, it should probably be set to 0.
Block 1, CTA-861 Extension Block:
  Video Data Block: VIC 16 and the first DTD are not identical. Is this intended?
  Detailed Timing Descriptor #2: Image size is 641x400 mm, but based on the picture AR it should be 641x360 mm.
  Detailed Timing Descriptor #3: Image size is 641x400 mm, but based on the picture AR it should be 641x360 mm.
  Detailed Timing Descriptor #4: Image size is 641x400 mm, but based on the picture AR it should be 641x360 mm.
  Detailed Timing Descriptor #5: Image size is 641x400 mm, but based on the picture AR it should be 641x360 mm.
  Detailed Timing Descriptor #6: Image size is 641x400 mm, but based on the picture AR it should be 600x400 mm.
  Display Product Serial Number is set, so the Serial Number in the Base EDID should be 0.
  Add a Colorimetry Data Block with the sRGB colorimetry bit set to avoid interop issues.
EDID:
  Base EDID: Some timings are out of range of the Monitor Ranges:
    Horizontal Freq: 31.250 - 98.713 kHz (Monitor: 24.000 - 98.000 kHz)
    Could be due to a Monitor Range off-by-one rounding issue

Failures:

Block 1, CTA-861 Extension Block:
  Missing VCDB, needed for Set Selectable RGB Quantization to avoid interop issues.
EDID:
  Extension Block 2 started with EDID header, ignoring Extension Blocks >= 2.
  CTA-861: Native progressive timings are a mix of several resolutions.

EDID conformity: FAIL
