edid-decode (hex):

00 ff ff ff ff ff ff 00 06 af ad fe 00 00 00 00
1a 21 01 04 95 22 13 78 03 6e 85 93 58 58 92 28
1e 50 54 00 00 00 01 01 01 01 01 01 01 01 01 01
01 01 01 01 01 01 20 37 80 b4 70 38 28 40 6c 30
aa 00 58 c2 10 00 00 18 c0 24 80 b4 70 38 28 40
6c 30 aa 00 58 c2 10 00 00 18 00 00 00 00 00 00
00 00 00 00 00 00 00 00 00 00 00 00 00 00 00 02
00 10 3c ff 0f 3c 96 0f 13 28 7d 20 20 20 01 36

70 20 79 02 00 22 00 14 3f 27 02 84 7f 07 b3 00
6b 80 2f 00 37 04 27 00 09 00 09 00 25 01 09 3f
27 02 3f 27 02 28 3c 80 81 00 10 6f 1a 00 00 03
01 28 3c 00 00 53 62 53 62 3c 00 00 00 00 00 00
00 00 00 00 00 00 00 00 00 00 00 00 00 00 00 00
00 00 00 00 00 00 00 00 00 00 00 00 00 00 00 00
00 00 00 00 00 00 00 00 00 00 00 00 00 00 00 00
00 00 00 00 00 00 00 00 00 00 00 00 00 00 71 90

00 ff ff ff ff ff ff 00 06 af ad fe 00 00 00 00
1a 21 01 04 95 22 13 78 03 6e 85 93 58 58 92 28
1e 50 54 00 00 00 01 01 01 01 01 01 01 01 01 01
01 01 01 01 01 01 20 37 80 b4 70 38 28 40 6c 30
aa 00 58 c2 10 00 00 18 c0 24 80 b4 70 38 28 40
6c 30 aa 00 58 c2 10 00 00 18 00 00 00 00 00 00
00 00 00 00 00 00 00 00 00 00 00 00 00 00 00 02
00 10 3c ff 0f 3c 96 0f 13 28 7d 20 20 20 01 36

70 20 79 02 00 22 00 14 3f 27 02 84 7f 07 b3 00
6b 80 2f 00 37 04 27 00 09 00 09 00 25 01 09 3f
27 02 3f 27 02 28 3c 80 81 00 10 6f 1a 00 00 03
01 28 3c 00 00 53 62 53 62 3c 00 00 00 00 00 00
00 00 00 00 00 00 00 00 00 00 00 00 00 00 00 00
00 00 00 00 00 00 00 00 00 00 00 00 00 00 00 00
00 00 00 00 00 00 00 00 00 00 00 00 00 00 00 00
00 00 00 00 00 00 00 00 00 00 00 00 00 00 71 90

----------------

Block 0, Base EDID:
  EDID Structure Version & Revision: 1.4
  Vendor & Product Identification:
    Manufacturer: AUO
    Model: 65197
    Made in: week 26 of 2023
  Basic Display Parameters & Features:
    Digital display
    Bits per primary color channel: 6
    DisplayPort interface
    Maximum image size: 34 cm x 19 cm
    Gamma: 2.20
    Supported color formats: RGB 4:4:4
    First detailed timing includes the native pixel format and preferred refresh rate
    Display supports continuous frequencies
  Color Characteristics:
    Red  : 0.5751, 0.3457
    Green: 0.3466, 0.5722
    Blue : 0.1582, 0.1171
    White: 0.3134, 0.3291
  Established Timings I & II: none
  Standard Timings: none
  Detailed Timing Descriptors:
    DTD 1:  1920x1080   60.000000 Hz  16:9     67.200 kHz    141.120000 MHz (344 mm x 194 mm)
                 Hfront  108 Hsync  48 Hback   24 Hpol N
                 Vfront   10 Vsync  10 Vback   20 Vpol N
    DTD 2:  1920x1080   40.000000 Hz  16:9     44.800 kHz     94.080000 MHz (344 mm x 194 mm)
                 Hfront  108 Hsync  48 Hback   24 Hpol N
                 Vfront   10 Vsync  10 Vback   20 Vpol N
    Empty Descriptor
    Manufacturer-Specified Display Descriptor (0x02): 00 02 00 10 3c ff 0f 3c 96 0f 13 28 7d 20 20 20 '....<..<...(}   '
  Extension blocks: 1
Checksum: 0x36

----------------

Block 1, DisplayID Extension Block:
  Version: 2.0
  Extension Count: 0
  Display Product Primary Use Case: None of the listed primary use cases; generic display
  Video Timing Modes Type 7 - Detailed Timings Data Block:
    DTD:  1920x1080   60.000000 Hz  16:9     67.200 kHz    141.120000 MHz (aspect 16:9, no 3D stereo, preferred)
               Hfront  108 Hsync  48 Hback   24 Hpol P
               Vfront   10 Vsync  10 Vback   20 Vpol N
  Dynamic Video Timing Range Limits Data Block:
    Minimum Pixel Clock: 141120 kHz
    Maximum Pixel Clock: 141120 kHz
    Minimum Vertical Refresh Rate: 40 Hz
    Maximum Vertical Refresh Rate: 60 Hz
    Seamless Dynamic Video Timing Support: Yes
  CTA-861 DisplayID Data Block:
  Vendor-Specific Data Block (AMD), OUI 00-00-1A:
    Version: 3
    Feature Caps: 0x01
    Minimum Refresh Rate: 40 Hz
    Maximum Refresh Rate: 60 Hz
    Flags 1.x: 0x00
    Flags 2.x: 0x00
  Checksum: 0x71
Checksum: 0x90

----------------

Warnings:

Block 0, Base EDID:
  Missing Display Product Name.

Failures:

Block 0, Base EDID:
  Empty Descriptor: Use Dummy Descriptor instead of all zeroes.
  Missing Display Range Limits Descriptor.
EDID:
  Extension Block 2 started with EDID header, ignoring Extension Blocks >= 2.
  DisplayID: Missing DisplayID Display Parameters Data Block.

EDID conformity: FAIL
