edid-decode (hex):

00 ff ff ff ff ff ff 00 1e 6d dd 36 01 01 01 01
01 16 01 04 a5 80 50 78 00 31 a8 a5 4d 37 b3 24
06 48 4c a1 08 00 31 40 45 40 61 7c 71 40 81 80
90 40 b3 00 01 01 9e 20 00 90 51 20 1f 30 48 80
36 00 00 20 53 00 00 1e 66 21 50 b0 51 00 1b 30
40 70 36 00 50 00 53 00 00 1e 00 00 00 fd 00 3a
7a 1e 69 10 00 0a 20 20 20 20 20 20 00 00 00 fc
00 4c 47 20 50 4a 54 52 0a 20 20 20 20 20 00 23

----------------

Block 0, Base EDID:
  EDID Structure Version & Revision: 1.4
  Vendor & Product Identification:
    Manufacturer: GSM
    Model: 14045
    Serial Number: ...
    Made in: week 1 of 2012
  Basic Display Parameters & Features:
    Digital display
    Bits per primary color channel: 8
    DisplayPort interface
    Maximum image size: 128 cm x 80 cm
    Gamma: 2.20
    Supported color formats: RGB 4:4:4
    First detailed timing does not include the native pixel format and preferred refresh rate
  Color Characteristics:
    Red  : 0.6445, 0.3037
    Green: 0.2148, 0.7001
    Blue : 0.1425, 0.0253
    White: 0.2832, 0.2968
  Established Timings I & II:
    IBM     :   720x400    70.081663 Hz   9:5     31.467 kHz     28.320000 MHz
    DMT 0x04:   640x480    59.940476 Hz   4:3     31.469 kHz     25.175000 MHz
    DMT 0x09:   800x600    60.316541 Hz   4:3     37.879 kHz     40.000000 MHz
    DMT 0x10:  1024x768    60.003840 Hz   4:3     48.363 kHz     65.000000 MHz
  Standard Timings:
    DMT 0x04:   640x480    59.940476 Hz   4:3     31.469 kHz     25.175000 MHz
    DMT 0x09:   800x600    60.316541 Hz   4:3     37.879 kHz     40.000000 MHz
    GTF     :  1024x768   119.999931 Hz   4:3     98.760 kHz    139.054000 MHz
    GTF     :  1152x864    60.000000 Hz   4:3     53.700 kHz     81.624000 MHz
    DMT 0x23:  1280x1024   60.019740 Hz   5:4     63.981 kHz    108.000000 MHz
    DMT 0x2a:  1400x1050   59.978442 Hz   4:3     65.317 kHz    121.750000 MHz
    DMT 0x3a:  1680x1050   59.954250 Hz  16:10    65.290 kHz    146.250000 MHz
  Detailed Timing Descriptors:
    DTD 1:  1280x800    59.810326 Hz  16:10    49.702 kHz     83.500000 MHz (1280 mm x 800 mm)
                 Hfront   72 Hsync 128 Hback  200 Hpol P
                 Vfront    3 Vsync   6 Vback   22 Vpol P
    DTD 2:  1360x768    60.015162 Hz  85:48    47.712 kHz     85.500000 MHz (1360 mm x 768 mm)
                 Hfront   64 Hsync 112 Hback  256 Hpol P
                 Vfront    3 Vsync   6 Vback   18 Vpol P
    Display Range Limits:
      Monitor ranges (GTF): 58-122 Hz V, 30-105 kHz H, max dotclock 160 MHz
    Display Product Name: 'LG PJTR'
Checksum: 0x23

----------------

Warnings:

Block 0, Base EDID:
  Vendor & Product Identification: The serial number is one of the known dummy values, it should probably be set to 0.
  Detailed Timing Descriptor #1: DTD is similar but not identical to DMT 0x1c.
  Display Range Limits: GTF support is deprecated in EDID 1.4.
EDID:
  No Native Video Resolution was defined.

Failures:

Block 0, Base EDID:
  Detailed Timing Descriptor #2: Mismatch of image size 1360x768 mm vs display size 1280x800 mm.
  Display Range Limits: GTF is supported, but the display does not support continuous frequencies.
EDID:
  Base EDID: The DTD max image size is 1360x800mm, which is larger than the display size 1280.0x800.0mm.

EDID conformity: FAIL
