edid-decode (hex):

00 ff ff ff ff ff ff 00 3d ce 01 01 01 01 01 01
0d 1d 01 03 80 2f 1d 78 2a a5 c5 a6 54 4f 9c 23
12 50 54 bf ef 00 d1 c0 b3 00 95 00 81 80 81 40
81 c0 31 40 b3 0f 02 3a 80 18 71 38 2d 40 58 2c
45 00 ba 89 21 00 00 1e 66 21 56 aa 51 00 1e 30
46 8f 33 00 ba 89 21 00 00 1e 00 00 00 fd 00 30
4c 1e 55 11 00 0a 20 20 20 20 20 20 00 00 00 fc
00 4f 4e 41 31 38 48 4f 30 31 35 43 0a 20 01 ea

02 03 20 b1 4b 90 1f 04 03 02 0e 1e 01 1f 12 13
67 03 0c 00 10 00 38 2d 83 01 00 00 e3 05 03 01
02 3a 80 18 71 38 2d 40 58 2c 45 00 ba 89 21 00
00 1e 01 1d 80 18 71 1c 16 20 58 2c 25 00 ba 89
21 00 00 9e 01 1d 00 72 51 d0 1e 20 6e 28 55 00
ba 89 21 00 00 1e 8c 0a d0 8a 20 e0 2d 10 10 3e
96 00 ba 89 21 00 00 18 00 00 00 00 00 00 00 00
00 00 00 00 00 00 00 00 00 00 00 00 00 00 00 19

----------------

Block 0, Base EDID:
  EDID Structure Version & Revision: 1.3
  Vendor & Product Identification:
    Manufacturer: ONN
    Model: 257
    Serial Number: ...
    Made in: week 13 of 2019
  Basic Display Parameters & Features:
    Digital display
    Maximum image size: 47 cm x 29 cm
    Gamma: 2.20
    DPMS levels: Off
    RGB color display
    First detailed timing is the preferred timing
  Color Characteristics:
    Red  : 0.6503, 0.3300
    Green: 0.3095, 0.6103
    Blue : 0.1396, 0.0703
    White: 0.3134, 0.3291
  Established Timings I & II:
    IBM     :   720x400    70.081663 Hz   9:5     31.467 kHz     28.320000 MHz
    DMT 0x04:   640x480    59.940476 Hz   4:3     31.469 kHz     25.175000 MHz
    Apple   :   640x480    66.666667 Hz   4:3     35.000 kHz     30.240000 MHz
    DMT 0x05:   640x480    72.808802 Hz   4:3     37.861 kHz     31.500000 MHz
    DMT 0x06:   640x480    75.000000 Hz   4:3     37.500 kHz     31.500000 MHz
    DMT 0x08:   800x600    56.250000 Hz   4:3     35.156 kHz     36.000000 MHz
    DMT 0x09:   800x600    60.316541 Hz   4:3     37.879 kHz     40.000000 MHz
    DMT 0x0a:   800x600    72.187572 Hz   4:3     48.077 kHz     50.000000 MHz
    DMT 0x0b:   800x600    75.000000 Hz   4:3     46.875 kHz     49.500000 MHz
    Apple   :   832x624    74.551266 Hz   4:3     49.726 kHz     57.284000 MHz
    DMT 0x10:  1024x768    60.003840 Hz   4:3     48.363 kHz     65.000000 MHz
    DMT 0x11:  1024x768    70.069359 Hz   4:3     56.476 kHz     75.000000 MHz
    DMT 0x12:  1024x768    75.028582 Hz   4:3     60.023 kHz     78.750000 MHz
    DMT 0x24:  1280x1024   75.024675 Hz   5:4     79.976 kHz    135.000000 MHz
  Standard Timings:
    DMT 0x52:  1920x1080   60.000000 Hz  16:9     67.500 kHz    148.500000 MHz
    DMT 0x3a:  1680x1050   59.954250 Hz  16:10    65.290 kHz    146.250000 MHz
    DMT 0x2f:  1440x900    59.887445 Hz  16:10    55.935 kHz    106.500000 MHz
    DMT 0x23:  1280x1024   60.019740 Hz   5:4     63.981 kHz    108.000000 MHz
    DMT 0x20:  1280x960    60.000000 Hz   4:3     60.000 kHz    108.000000 MHz
    DMT 0x55:  1280x720    60.000000 Hz  16:9     45.000 kHz     74.250000 MHz
    DMT 0x04:   640x480    59.940476 Hz   4:3     31.469 kHz     25.175000 MHz
    DMT 0x3b:  1680x1050   74.892027 Hz  16:10    82.306 kHz    187.000000 MHz
  Detailed Timing Descriptors:
    DTD 1:  1920x1080   60.000000 Hz  16:9     67.500 kHz    148.500000 MHz (698 mm x 393 mm)
                 Hfront   88 Hsync  44 Hback  148 Hpol P
                 Vfront    4 Vsync   5 Vback   36 Vpol P
    DTD 2:  1366x768    59.789541 Hz 683:384   47.712 kHz     85.500000 MHz (698 mm x 393 mm)
                 Hfront   70 Hsync 143 Hback  213 Hpol P
                 Vfront    3 Vsync   3 Vback   24 Vpol P
    Display Range Limits:
      Monitor ranges (GTF): 48-76 Hz V, 30-85 kHz H, max dotclock 170 MHz
    Display Product Name: 'ONA18HO015C'
  Extension blocks: 1
Checksum: 0xea

----------------

Block 1, CTA-861 Extension Block:
  Revision: 3
  Underscans IT Video Formats by default
  Supports YCbCr 4:4:4
  Supports YCbCr 4:2:2
  Native DTDs: 1
  Video Data Block:
    VIC  16:  1920x1080   60.000000 Hz  16:9     67.500 kHz    148.500000 MHz (native)
    VIC  31:  1920x1080   50.000000 Hz  16:9     56.250 kHz    148.500000 MHz
    VIC   4:  1280x720    60.000000 Hz  16:9     45.000 kHz     74.250000 MHz
    VIC   3:   720x480    59.940060 Hz  16:9     31.469 kHz     27.000000 MHz
    VIC   2:   720x480    59.940060 Hz   4:3     31.469 kHz     27.000000 MHz
    VIC  14:  1440x480    59.940060 Hz   4:3     31.469 kHz     54.000000 MHz
    VIC  30:  1440x576    50.000000 Hz  16:9     31.250 kHz     54.000000 MHz
    VIC   1:   640x480    59.940476 Hz   4:3     31.469 kHz     25.175000 MHz
    VIC  31:  1920x1080   50.000000 Hz  16:9     56.250 kHz    148.500000 MHz
    VIC  18:   720x576    50.000000 Hz  16:9     31.250 kHz     27.000000 MHz
    VIC  19:  1280x720    50.000000 Hz  16:9     37.500 kHz     74.250000 MHz
  Vendor-Specific Data Block (HDMI), OUI 00-0C-03:
    Source physical address: 1.0.0.0
    DC_36bit
    DC_30bit
    DC_Y444
    Maximum TMDS clock: 225 MHz
  Speaker Allocation Data Block:
    FL/FR - Front Left/Right
  Colorimetry Data Block:
    xvYCC601
    xvYCC709
    Gamut Boundary Description Metadata Profile P0
  Detailed Timing Descriptors:
    DTD 3:  1920x1080   60.000000 Hz  16:9     67.500 kHz    148.500000 MHz (698 mm x 393 mm)
                 Hfront   88 Hsync  44 Hback  148 Hpol P
                 Vfront    4 Vsync   5 Vback   36 Vpol P
    DTD 4:  1920x1080i  60.000000 Hz  16:9     33.750 kHz     74.250000 MHz (698 mm x 393 mm)
                 Hfront   88 Hsync  44 Hback  148 Hpol P
                 Vfront    2 Vsync   5 Vback   15 Vpol P Vfront +0.5 Odd Field
                 Vfront    2 Vsync   5 Vback   15 Vpol P Vback  +0.5 Even Field
    DTD 5:  1280x720    60.000000 Hz  16:9     45.000 kHz     74.250000 MHz (698 mm x 393 mm)
                 Hfront  110 Hsync  40 Hback  220 Hpol P
                 Vfront    5 Vsync   5 Vback   20 Vpol P
    DTD 6:   720x480    59.940060 Hz   3:2     31.469 kHz     27.000000 MHz (698 mm x 393 mm)
                 Hfront   16 Hsync  62 Hback   60 Hpol N
                 Vfront    9 Vsync   6 Vback   30 Vpol N
Checksum: 0x19  Unused space in Extension Block: 23 bytes

----------------

Warnings:

Block 0, Base EDID:
  Vendor & Product Identification: The serial number is one of the known dummy values, it should probably be set to 0.
Block 1, CTA-861 Extension Block:
  Colorimetry Data Block: Set the sRGB colorimetry bit to avoid interop issues.
  Detailed Timing Descriptor #4: DTD is identical to VIC 5, which is not present in the CTA Ext Block.
  Detailed Timing Descriptor #6: Image size is 698x393 mm, but based on the picture AR it should be 589x393 mm.
EDID:
  Base EDID: Some timings are out of range of the Monitor Ranges:
    Maximum Clock: 187.000 MHz (Monitor: 170.000 MHz)

Failures:

Block 0, Base EDID:
  Detailed Timing Descriptor #1: Mismatch of image size 698x393 mm vs display size 470x290 mm.
  Detailed Timing Descriptor #2: Mismatch of image size 698x393 mm vs display size 470x290 mm.
Block 1, CTA-861 Extension Block:
  Video Data Block: Duplicate VIC 31.
  Speaker Allocation Data Block: Audio information is present, but bit 6 of Byte 3 of the CTA-861 Extension header indicates no Basic Audio support.
  Detailed Timing Descriptor #3: Mismatch of image size 698x393 mm vs display size 470x290 mm.
  Detailed Timing Descriptor #4: Mismatch of image size 698x393 mm vs display size 470x290 mm.
  Detailed Timing Descriptor #5: Mismatch of image size 698x393 mm vs display size 470x290 mm.
  Detailed Timing Descriptor #6: Mismatch of image size 698x393 mm vs display size 470x290 mm.
  Missing VCDB, needed for Set Selectable RGB Quantization to avoid interop issues.
EDID:
  Base EDID: The DTD max image size is 698x393mm, which is larger than the display size 470.0x290.0mm.

EDID conformity: FAIL
