edid-decode (hex):

00 ff ff ff ff ff ff 00 30 ae ab 41 00 00 00 00
14 1f 01 04 a5 1d 12 78 e3 c6 a8 a6 54 4b 9b 23
0e 50 56 00 00 00 01 01 01 01 01 01 01 01 01 01
01 01 01 01 01 01 ef 68 00 a0 a0 40 2e 60 30 20
36 00 1e b3 10 00 00 18 00 00 00 fd 00 28 3c 63
63 1b 01 0a 20 20 20 20 20 20 00 00 00 0f 00 ff
0a 28 ff 0a 28 28 0a 00 0e 6f 13 13 00 00 00 fe
00 4d 4e 44 33 30 37 44 41 31 2d 43 0a 20 00 a2

00 ff ff ff ff ff ff 00 30 ae ab 41 00 00 00 00
14 1f 01 04 a5 1d 12 78 e3 c6 a8 a6 54 4b 9b 23
0e 50 56 00 00 00 01 01 01 01 01 01 01 01 01 01
01 01 01 01 01 01 ef 68 00 a0 a0 40 2e 60 30 20
36 00 1e b3 10 00 00 18 00 00 00 fd 00 28 3c 63
63 1b 01 0a 20 20 20 20 20 20 00 00 00 0f 00 ff
0a 28 ff 0a 28 28 0a 00 0e 6f 13 13 00 00 00 fe
00 4d 4e 44 33 30 37 44 41 31 2d 43 0a 20 00 a2

----------------

Block 0, Base EDID:
  EDID Structure Version & Revision: 1.4
  Vendor & Product Identification:
    Manufacturer: LEN
    Model: 16811
    Made in: week 20 of 2021
  Basic Display Parameters & Features:
    Digital display
    Bits per primary color channel: 8
    DisplayPort interface
    Maximum image size: 29 cm x 18 cm
    Gamma: 2.20
    DPMS levels: Standby Suspend Off
    Supported color formats: RGB 4:4:4
    First detailed timing includes the native pixel format and preferred refresh rate
    Display supports continuous frequencies
  Color Characteristics:
    Red  : 0.6513, 0.3281
    Green: 0.2939, 0.6074
    Blue : 0.1386, 0.0566
    White: 0.3144, 0.3359
  Established Timings I & II: none
  Standard Timings: none
  Detailed Timing Descriptors:
    DTD 1:  2560x1600   60.000625 Hz  16:10    98.761 kHz    268.630000 MHz (286 mm x 179 mm)
                 Hfront   48 Hsync  32 Hback   80 Hpol N
                 Vfront    3 Vsync   6 Vback   37 Vpol N
    Display Range Limits:
      Monitor ranges (Range Limits Only): 40-60 Hz V, 99-99 kHz H, max dotclock 270 MHz
    Manufacturer-Specified Display Descriptor (0x0f): 00 0f 00 ff 0a 28 ff 0a 28 28 0a 00 0e 6f 13 13 '.....(..((...o..'
    Alphanumeric Data String: 'MND307DA1-C'
Checksum: 0xa2

----------------

Warnings:

Block 0, Base EDID:
  Missing Display Product Name.

Failures:

EDID:
  Extension Block 1 started with EDID header, ignoring Extension Blocks >= 1.

EDID conformity: FAIL
