edid-decode (hex):

00 ff ff ff ff ff ff 00 06 10 31 ae 84 6f 6b a1
16 1d 01 04 b5 3c 22 78 20 07 11 ae 52 41 b2 26
0e 50 54 00 00 00 01 01 01 01 01 01 01 01 01 01
01 01 01 01 01 01 4d d0 00 a0 f0 70 3e 80 30 20
35 00 55 50 21 00 00 1a 56 5e 00 a0 a0 a0 29 50
30 20 35 00 55 50 21 00 00 1a 00 00 00 fc 00 69
4d 61 63 0a 20 20 20 20 20 20 20 20 00 00 00 ff
00 39 38 34 44 38 43 42 38 34 36 46 32 42 01 08

02 03 1f 80 70 fa 10 00 00 12 76 31 fc 78 fb ff
02 10 88 62 d3 69 fa 10 00 fa f8 f8 fe ff ff cd
91 80 a0 c0 08 34 70 30 20 35 00 55 50 21 00 00
1a 00 00 00 00 00 00 00 00 00 00 00 00 00 00 00
00 00 00 00 00 00 00 00 00 00 00 00 00 00 00 00
00 00 00 00 00 00 00 00 00 00 00 00 00 00 00 00
00 00 00 00 00 00 00 00 00 00 00 00 00 00 00 00
00 00 00 00 00 00 00 00 00 00 00 00 00 00 00 44

00 ff ff ff ff ff ff 00 06 10 31 ae 84 6f 6b a1
16 1d 01 04 b5 3c 22 78 20 07 11 ae 52 41 b2 26
0e 50 54 00 00 00 01 01 01 01 01 01 01 01 01 01
01 01 01 01 01 01 4d d0 00 a0 f0 70 3e 80 30 20
35 00 55 50 21 00 00 1a 56 5e 00 a0 a0 a0 29 50
30 20 35 00 55 50 21 00 00 1a 00 00 00 fc 00 69
4d 61 63 0a 20 20 20 20 20 20 20 20 00 00 00 ff
00 39 38 34 44 38 43 42 38 34 36 46 32 42 01 08

02 03 1f 80 70 fa 10 00 00 12 76 31 fc 78 fb ff
02 10 88 62 d3 69 fa 10 00 fa f8 f8 fe ff ff cd
91 80 a0 c0 08 34 70 30 20 35 00 55 50 21 00 00
1a 00 00 00 00 00 00 00 00 00 00 00 00 00 00 00
00 00 00 00 00 00 00 00 00 00 00 00 00 00 00 00
00 00 00 00 00 00 00 00 00 00 00 00 00 00 00 00
00 00 00 00 00 00 00 00 00 00 00 00 00 00 00 00
00 00 00 00 00 00 00 00 00 00 00 00 00 00 00 44

----------------

Block 0, Base EDID:
  EDID Structure Version & Revision: 1.4
  Vendor & Product Identification:
    Manufacturer: APP
    Model: 44593
    Serial Number: ...
    Made in: week 22 of 2019
  Basic Display Parameters & Features:
    Digital display
    Bits per primary color channel: 10
    DisplayPort interface
    Maximum image size: 60 cm x 34 cm
    Gamma: 2.20
    DPMS levels: Off
    Supported color formats: RGB 4:4:4
    First detailed timing does not include the native pixel format and preferred refresh rate
  Color Characteristics:
    Red  : 0.6796, 0.3203
    Green: 0.2548, 0.6982
    Blue : 0.1484, 0.0556
    White: 0.3125, 0.3291
  Established Timings I & II: none
  Standard Timings: none
  Detailed Timing Descriptors:
    DTD 1:  3840x2160   59.996625 Hz  16:9    133.312 kHz    533.250000 MHz (597 mm x 336 mm)
                 Hfront   48 Hsync  32 Hback   80 Hpol P
                 Vfront    3 Vsync   5 Vback   54 Vpol N
    DTD 2:  2560x1440   59.950550 Hz  16:9     88.787 kHz    241.500000 MHz (597 mm x 336 mm)
                 Hfront   48 Hsync  32 Hback   80 Hpol P
                 Vfront    3 Vsync   5 Vback   33 Vpol N
    Display Product Name: 'iMac'
    Display Product Serial Number: ...
  Extension blocks: 1
Checksum: 0x08

----------------

Block 1, CTA-861 Extension Block:
  Revision: 3
  Underscans IT Video Formats by default
  Native DTDs: 0
  Vendor-Specific Data Block (Apple), OUI 00-10-FA:
    00 12 76 31 fc 78 fb ff 02 10 88 62 d3          '..v1.x.....b.'
  Vendor-Specific Data Block (Apple), OUI 00-10-FA:
    fa f8 f8 fe ff ff                               '......'
  Detailed Timing Descriptors:
    DTD 3:  3200x1800   59.981809 Hz  16:9    111.086 kHz    373.250000 MHz (597 mm x 336 mm)
                 Hfront   48 Hsync  32 Hback   80 Hpol P
                 Vfront    3 Vsync   5 Vback   44 Vpol N
Checksum: 0x44  Unused space in Extension Block: 78 bytes

----------------

Warnings:

Block 1, CTA-861 Extension Block:
  Display Product Serial Number is set, so the Serial Number in the Base EDID should be 0.
  Add a Colorimetry Data Block with the sRGB colorimetry bit set to avoid interop issues.
EDID:
  No Native Video Resolution was defined.
    Hint: set 'Native DTDs' to a non-0 value, or add a Native Video Resolution Data Block.

Failures:

Block 1, CTA-861 Extension Block:
  Required 640x480p60 timings are missing in the established timings and the SVD list (VIC 1).
  Missing VCDB, needed for Set Selectable RGB Quantization to avoid interop issues.
EDID:
  Extension Block 2 started with EDID header, ignoring Extension Blocks >= 2.

EDID conformity: FAIL
