edid-decode (hex):

00 ff ff ff ff ff ff 00 1c 54 2a 27 01 01 01 01
16 22 01 03 80 3b 21 78 ee 77 50 ad 4f 46 aa 26
0c 50 54 ff ff 80 71 4f 81 c0 81 00 81 40 81 80
95 00 a9 c0 b3 00 4d d0 00 a0 f0 70 3e 80 30 20
35 00 55 50 21 00 00 1e 56 5e 00 a0 a0 a0 29 50
30 20 35 00 55 50 21 00 00 1e 00 00 00 fc 00 4d
32 37 55 41 0a 20 20 20 20 20 20 20 00 00 00 fd
00 30 a0 b4 ff 8c 00 0a 20 20 20 20 20 20 01 04

02 03 5d f2 e2 78 02 52 61 75 76 29 0f 20 1f 10
40 3f 5d 5e 5f 60 03 13 04 12 23 09 07 07 83 01
00 00 6d 03 0c 00 10 00 38 44 20 00 60 03 01 02
6d d8 5d c4 01 78 88 63 02 30 a0 c3 64 0c 6d 1a
00 00 02 03 30 a0 ec 0f 69 4a 69 4a e3 05 c3 01
e2 0f 01 e6 06 05 01 69 69 4a e2 00 ea 6f c2 00
a0 a0 a0 55 50 30 20 35 00 55 50 21 00 00 1e 00
00 00 00 00 00 00 00 00 00 00 00 00 00 00 00 97

00 ff ff ff ff ff ff 00 1c 54 2a 27 01 01 01 01
16 22 01 03 80 3b 21 78 ee 77 50 ad 4f 46 aa 26
0c 50 54 ff ff 80 71 4f 81 c0 81 00 81 40 81 80
95 00 a9 c0 b3 00 4d d0 00 a0 f0 70 3e 80 30 20
35 00 55 50 21 00 00 1e 56 5e 00 a0 a0 a0 29 50
30 20 35 00 55 50 21 00 00 1e 00 00 00 fc 00 4d
32 37 55 41 0a 20 20 20 20 20 20 20 00 00 00 fd
00 30 a0 b4 ff 8c 00 0a 20 20 20 20 20 20 01 04

02 03 5d f2 e2 78 02 52 61 75 76 29 0f 20 1f 10
40 3f 5d 5e 5f 60 03 13 04 12 23 09 07 07 83 01
00 00 6d 03 0c 00 10 00 38 44 20 00 60 03 01 02
6d d8 5d c4 01 78 88 63 02 30 a0 c3 64 0c 6d 1a
00 00 02 03 30 a0 ec 0f 69 4a 69 4a e3 05 c3 01
e2 0f 01 e6 06 05 01 69 69 4a e2 00 ea 6f c2 00
a0 a0 a0 55 50 30 20 35 00 55 50 21 00 00 1e 00
00 00 00 00 00 00 00 00 00 00 00 00 00 00 00 97

----------------

Block 0, Base EDID:
  EDID Structure Version & Revision: 1.3
  Vendor & Product Identification:
    Manufacturer: GBT
    Model: 10026
    Serial Number: ...
    Made in: week 22 of 2024
  Basic Display Parameters & Features:
    Digital display
    Maximum image size: 59 cm x 33 cm
    Gamma: 2.20
    DPMS levels: Standby Suspend Off
    RGB color display
    Default (sRGB) color space is primary color space
    First detailed timing is the preferred timing
  Color Characteristics:
    Red  : 0.6767, 0.3115
    Green: 0.2744, 0.6669
    Blue : 0.1494, 0.0478
    White: 0.3125, 0.3281
  Established Timings I & II:
    IBM     :   720x400    70.081663 Hz   9:5     31.467 kHz     28.320000 MHz
    IBM     :   720x400    87.849542 Hz   9:5     39.444 kHz     35.500000 MHz
    DMT 0x04:   640x480    59.940476 Hz   4:3     31.469 kHz     25.175000 MHz
    Apple   :   640x480    66.666667 Hz   4:3     35.000 kHz     30.240000 MHz
    DMT 0x05:   640x480    72.808802 Hz   4:3     37.861 kHz     31.500000 MHz
    DMT 0x06:   640x480    75.000000 Hz   4:3     37.500 kHz     31.500000 MHz
    DMT 0x08:   800x600    56.250000 Hz   4:3     35.156 kHz     36.000000 MHz
    DMT 0x09:   800x600    60.316541 Hz   4:3     37.879 kHz     40.000000 MHz
    DMT 0x0a:   800x600    72.187572 Hz   4:3     48.077 kHz     50.000000 MHz
    DMT 0x0b:   800x600    75.000000 Hz   4:3     46.875 kHz     49.500000 MHz
    Apple   :   832x624    74.551266 Hz   4:3     49.726 kHz     57.284000 MHz
    DMT 0x0f:  1024x768i   86.957532 Hz   4:3     35.522 kHz     44.900000 MHz
    DMT 0x10:  1024x768    60.003840 Hz   4:3     48.363 kHz     65.000000 MHz
    DMT 0x11:  1024x768    70.069359 Hz   4:3     56.476 kHz     75.000000 MHz
    DMT 0x12:  1024x768    75.028582 Hz   4:3     60.023 kHz     78.750000 MHz
    DMT 0x24:  1280x1024   75.024675 Hz   5:4     79.976 kHz    135.000000 MHz
    Apple   :  1152x870    75.061550 Hz 192:145   68.681 kHz    100.000000 MHz
  Standard Timings:
    DMT 0x15:  1152x864    75.000000 Hz   4:3     67.500 kHz    108.000000 MHz
    DMT 0x55:  1280x720    60.000000 Hz  16:9     45.000 kHz     74.250000 MHz
    DMT 0x1c:  1280x800    59.810326 Hz  16:10    49.702 kHz     83.500000 MHz
    DMT 0x20:  1280x960    60.000000 Hz   4:3     60.000 kHz    108.000000 MHz
    DMT 0x23:  1280x1024   60.019740 Hz   5:4     63.981 kHz    108.000000 MHz
    DMT 0x2f:  1440x900    59.887445 Hz  16:10    55.935 kHz    106.500000 MHz
    DMT 0x53:  1600x900    60.000000 Hz  16:9     60.000 kHz    108.000000 MHz (RB)
    DMT 0x3a:  1680x1050   59.954250 Hz  16:10    65.290 kHz    146.250000 MHz
  Detailed Timing Descriptors:
    DTD 1:  3840x2160   59.996625 Hz  16:9    133.312 kHz    533.250000 MHz (597 mm x 336 mm)
                 Hfront   48 Hsync  32 Hback   80 Hpol P
                 Vfront    3 Vsync   5 Vback   54 Vpol P
    DTD 2:  2560x1440   59.950550 Hz  16:9     88.787 kHz    241.500000 MHz (597 mm x 336 mm)
                 Hfront   48 Hsync  32 Hback   80 Hpol P
                 Vfront    3 Vsync   5 Vback   33 Vpol P
    Display Product Name: 'M27UA'
    Display Range Limits:
      Monitor ranges (GTF): 48-160 Hz V, 180-255 kHz H, max dotclock 1400 MHz
  Extension blocks: 1
Checksum: 0x04

----------------

Block 1, CTA-861 Extension Block:
  Revision: 3
  Underscans IT Video Formats by default
  Basic audio support
  Supports YCbCr 4:4:4
  Supports YCbCr 4:2:2
  Native DTDs: 2
  HDMI Forum EDID Extension Override Data Block:
    EDID Extension Block Count: 2
  Video Data Block:
    VIC  97:  3840x2160   60.000000 Hz  16:9    135.000 kHz    594.000000 MHz
    VIC 117:  3840x2160  100.000000 Hz  16:9    225.000 kHz   1188.000000 MHz
    VIC 118:  3840x2160  120.000000 Hz  16:9    270.000 kHz   1188.000000 MHz
    VIC  41:  1280x720   100.000000 Hz  16:9     75.000 kHz    148.500000 MHz
    VIC  15:  1440x480    59.940060 Hz  16:9     31.469 kHz     54.000000 MHz
    VIC  32:  1920x1080   24.000000 Hz  16:9     27.000 kHz     74.250000 MHz
    VIC  31:  1920x1080   50.000000 Hz  16:9     56.250 kHz    148.500000 MHz
    VIC  16:  1920x1080   60.000000 Hz  16:9     67.500 kHz    148.500000 MHz
    VIC  64:  1920x1080  100.000000 Hz  16:9    112.500 kHz    297.000000 MHz
    VIC  63:  1920x1080  120.000000 Hz  16:9    135.000 kHz    297.000000 MHz
    VIC  93:  3840x2160   24.000000 Hz  16:9     54.000 kHz    297.000000 MHz
    VIC  94:  3840x2160   25.000000 Hz  16:9     56.250 kHz    297.000000 MHz
    VIC  95:  3840x2160   30.000000 Hz  16:9     67.500 kHz    297.000000 MHz
    VIC  96:  3840x2160   50.000000 Hz  16:9    112.500 kHz    594.000000 MHz
    VIC   3:   720x480    59.940060 Hz  16:9     31.469 kHz     27.000000 MHz
    VIC  19:  1280x720    50.000000 Hz  16:9     37.500 kHz     74.250000 MHz
    VIC   4:  1280x720    60.000000 Hz  16:9     45.000 kHz     74.250000 MHz
    VIC  18:   720x576    50.000000 Hz  16:9     31.250 kHz     27.000000 MHz
  Audio Data Block:
    Linear PCM:
      Max channels: 2
      Supported sample rates (kHz): 48 44.1 32
      Supported sample sizes (bits): 24 20 16
  Speaker Allocation Data Block:
    FL/FR - Front Left/Right
  Vendor-Specific Data Block (HDMI), OUI 00-0C-03:
    Source physical address: 1.0.0.0
    DC_36bit
    DC_30bit
    DC_Y444
    Maximum TMDS clock: 340 MHz
    Extended HDMI video details:
      HDMI VICs:
        HDMI VIC 3:  3840x2160   24.000000 Hz  16:9     54.000 kHz    297.000000 MHz
        HDMI VIC 1:  3840x2160   30.000000 Hz  16:9     67.500 kHz    297.000000 MHz
        HDMI VIC 2:  3840x2160   25.000000 Hz  16:9     56.250 kHz    297.000000 MHz
  Vendor-Specific Data Block (HDMI Forum), OUI C4-5D-D8:
    Version: 1
    Maximum TMDS Character Rate: 600 MHz
    SCDC Present
    Supports scrambling for <= 340 Mcsc
    Max Fixed Rate Link: 3 and 6 Gbps per lane on 3 lanes, 6, 8, 10 and 12 Gbps on 4 lanes
    Supports 12-bits/component Deep Color 4:2:0 Pixel Encoding
    Supports 10-bits/component Deep Color 4:2:0 Pixel Encoding
    Supports Auto Low-Latency Mode
    VRRmin: 48 Hz
    VRRmax: 160 Hz
    Supports VESA DSC 1.2a compression
    Supports Compressed Video Transport for 4:2:0 Pixel Encoding
    Supports 12 bpc Compressed Video Transport
    Supports 10 bpc Compressed Video Transport
    DSC Max Slices: up to 8 slices and up to (340 MHz/Ksliceadjust) pixel clock per slice
    DSC Max Fixed Rate Link: 3 and 6 Gbps per lane on 3 lanes, 6, 8, 10 and 12 Gbps on 4 lanes
    Maximum number of bytes in a line of chunks: 13312
  Vendor-Specific Data Block (AMD), OUI 00-00-1A:
    Version: 2
    Feature Caps: 0x03
    Minimum Refresh Rate: 48 Hz
    Maximum Refresh Rate: 160 Hz
    Flags 1.x: 0xec (MCCS)
    Flags 2.x: 0x0f
      ST 2084 (PQ) EOTF Supported
      Linear EOTF (Windows scRGB, 0.0 - 125.0) Supported
      Gamma 2.2 EOTF Supported
      BT.2020 Gamut Supported
    Maximum luminance: 105 (486.099 cd/m^2)
    Minimum luminance: 74 (0.409 cd/m^2)
  Colorimetry Data Block:
    xvYCC601
    xvYCC709
    BT2020YCC
    BT2020RGB
    Gamut Boundary Description Metadata Profile P0
  YCbCr 4:2:0 Capability Map Data Block:
    VIC  97:  3840x2160   60.000000 Hz  16:9    135.000 kHz    594.000000 MHz
  HDR Static Metadata Data Block:
    Electro optical transfer functions:
      Traditional gamma - SDR luminance range
      SMPTE ST2084
    Supported static metadata descriptors:
      Static metadata type 1
    Desired content max luminance: 105 (486.099 cd/m^2)
    Desired content max frame-average luminance: 105 (486.099 cd/m^2)
    Desired content min luminance: 74 (0.409 cd/m^2)
  Video Capability Data Block:
    YCbCr quantization: Selectable (via AVI YQ)
    RGB quantization: Selectable (via AVI Q)
    PT scan behavior: Always Underscanned
    IT scan behavior: Always Underscanned
    CE scan behavior: Always Underscanned
  Detailed Timing Descriptors:
    DTD 3:  2560x1440  119.997589 Hz  16:9    182.996 kHz    497.750000 MHz (597 mm x 336 mm)
                 Hfront   48 Hsync  32 Hback   80 Hpol P
                 Vfront    3 Vsync   5 Vback   77 Vpol P
Checksum: 0x97  Unused space in Extension Block: 16 bytes

----------------

Warnings:

Block 0, Base EDID:
  Vendor & Product Identification: The serial number is one of the known dummy values, it should probably be set to 0.
Block 1, CTA-861 Extension Block:
  Video Data Block: VIC 97 and the first DTD are not identical. Is this intended?
  Video Capability Data Block: S_PT is equal to S_IT and S_CE, so should be set to 0 instead.
EDID:
  Base EDID: Some timings are out of range of the Monitor Ranges:
    Vertical Freq: 24.000 - 120.000 Hz (Monitor: 48.000 - 160.000 Hz)
    Horizontal Freq: 27.000 - 270.000 kHz (Monitor: 180.000 - 510.000 kHz)

Failures:

Block 0, Base EDID:
  Basic Display Parameters & Features: sRGB is signaled, but the chromaticities do not match.
Block 1, CTA-861 Extension Block:
  Vendor-Specific Data Block (HDMI Forum), OUI C4-5D-D8: HDMI VIC and related CTA VIC codes are present, but the UHD VIC bit is 0.
EDID:
  Extension Block 2 started with EDID header, ignoring Extension Blocks >= 2.
  Base EDID: HDMI Forum EDID Extension Override Data Block specified 2 extension block(s), but found 1 extension block(s).
  CTA-861: Native progressive timings are a mix of several resolutions.

EDID conformity: FAIL
