edid-decode (hex):

00 ff ff ff ff ff ff 00 30 e4 9e 02 00 00 00 00
00 13 01 04 95 22 13 78 02 1b e5 9e 59 50 98 26
0e 50 54 00 00 00 01 01 01 01 01 01 01 01 01 01
01 01 01 01 01 01 80 25 40 80 60 84 1a 30 30 20
35 00 58 c2 10 00 00 18 14 19 40 8c 60 84 16 30
30 20 35 00 58 c2 10 00 00 18 00 00 00 fe 00 50
37 32 37 52 80 31 35 36 57 44 31 0a 00 00 00 00
00 00 41 31 19 00 00 00 00 09 01 0a 20 20 00 da

----------------

Block 0, Base EDID:
  EDID Structure Version & Revision: 1.4
  Vendor & Product Identification:
    Manufacturer: LGD
    Model: 670
    Made in: 2009
  Basic Display Parameters & Features:
    Digital display
    Bits per primary color channel: 6
    DisplayPort interface
    Maximum image size: 34 cm x 19 cm
    Gamma: 2.20
    Supported color formats: RGB 4:4:4
    First detailed timing includes the native pixel format and preferred refresh rate
  Color Characteristics:
    Red  : 0.6171, 0.3486
    Green: 0.3144, 0.5966
    Blue : 0.1513, 0.0566
    White: 0.3134, 0.3291
  Established Timings I & II: none
  Standard Timings: none
  Detailed Timing Descriptors:
    DTD 1:  1600x900    59.995200 Hz  16:9     55.556 kHz     96.000000 MHz (344 mm x 194 mm)
                 Hfront   48 Hsync  32 Hback   48 Hpol N
                 Vfront    3 Vsync   5 Vback   18 Vpol N
    DTD 2:  1600x900    40.017952 Hz  16:9     36.897 kHz     64.200000 MHz (344 mm x 194 mm)
                 Hfront   48 Hsync  32 Hback   60 Hpol N
                 Vfront    3 Vsync   5 Vback   14 Vpol N
    Alphanumeric Data String: 'P727R.156WD1'
    Manufacturer-Specified Display Descriptor (0x00): 00 00 00 00 41 31 19 00 00 00 00 09 01 0a 20 20 '....A1........  '
Checksum: 0xda

----------------

Warnings:

Block 0, Base EDID:
  Alphanumeric Data String: Non-ASCII character 0x80 at position 5, can cause problems.
  Missing Display Product Name.

EDID conformity: PASS
