edid-decode (hex):

00 ff ff ff ff ff ff 00 09 e5 cc 0c 00 00 00 00
0e 22 01 04 a5 22 16 78 03 47 d5 95 5d 58 8e 27
1a 50 54 00 00 00 01 01 01 01 01 01 01 01 01 01
01 01 01 01 01 01 cb 3e 80 a0 70 b0 58 40 30 20
36 00 59 d7 10 00 00 1a 00 00 00 fd 00 30 90 b9
b9 27 01 0a 20 20 20 20 20 20 00 00 00 fe 00 3d
4c 32 33 20 20 20 20 20 20 20 20 ff 00 00 00 fc
00 4e 45 31 36 30 57 55 4d 2d 4e 58 38 0a 02 c7

02 03 0f 00 e3 05 04 00 e6 06 01 01 53 53 ff 00
00 00 00 00 00 00 00 00 00 00 00 00 00 00 00 00
00 00 00 00 00 00 00 00 00 00 00 00 00 00 00 00
00 00 00 00 00 00 00 00 00 00 00 00 00 00 00 00
00 00 00 00 00 00 00 00 00 00 00 00 00 00 00 00
00 00 00 00 00 00 00 00 00 00 00 00 00 00 00 00
00 00 00 00 00 00 00 00 00 00 00 00 00 00 00 00
00 00 00 00 00 00 00 00 00 00 00 00 00 00 00 6d

70 20 79 02 00 21 00 1d 77 0d 6a 08 80 07 b0 04
88 53 e9 5c 85 d5 8e 7a 52 1a 02 35 54 b0 5c b0
5c 00 42 12 78 22 00 14 f5 e2 05 85 7f 07 9f 00
2f 00 1f 00 af 04 57 00 02 00 05 00 2b 00 0c 27
00 30 8f 00 00 27 00 30 3b 00 00 81 00 13 72 1a
00 00 03 01 30 90 00 00 53 ff 53 ff 90 00 00 00
00 00 00 00 00 00 00 00 00 00 00 00 00 00 00 00
00 00 00 00 00 00 00 00 00 00 00 00 00 00 b7 90

00 ff ff ff ff ff ff 00 09 e5 cc 0c 00 00 00 00
0e 22 01 04 a5 22 16 78 03 47 d5 95 5d 58 8e 27
1a 50 54 00 00 00 01 01 01 01 01 01 01 01 01 01
01 01 01 01 01 01 cb 3e 80 a0 70 b0 58 40 30 20
36 00 59 d7 10 00 00 1a 00 00 00 fd 00 30 90 b9
b9 27 01 0a 20 20 20 20 20 20 00 00 00 fe 00 3d
4c 32 33 20 20 20 20 20 20 20 20 ff 00 00 00 fc
00 4e 45 31 36 30 57 55 4d 2d 4e 58 38 0a 02 c7

02 03 0f 00 e3 05 04 00 e6 06 01 01 53 53 ff 00
00 00 00 00 00 00 00 00 00 00 00 00 00 00 00 00
00 00 00 00 00 00 00 00 00 00 00 00 00 00 00 00
00 00 00 00 00 00 00 00 00 00 00 00 00 00 00 00
00 00 00 00 00 00 00 00 00 00 00 00 00 00 00 00
00 00 00 00 00 00 00 00 00 00 00 00 00 00 00 00
00 00 00 00 00 00 00 00 00 00 00 00 00 00 00 00
00 00 00 00 00 00 00 00 00 00 00 00 00 00 00 6d

70 20 79 02 00 21 00 1d 77 0d 6a 08 80 07 b0 04
88 53 e9 5c 85 d5 8e 7a 52 1a 02 35 54 b0 5c b0
5c 00 42 12 78 22 00 14 f5 e2 05 85 7f 07 9f 00
2f 00 1f 00 af 04 57 00 02 00 05 00 2b 00 0c 27
00 30 8f 00 00 27 00 30 3b 00 00 81 00 13 72 1a
00 00 03 01 30 90 00 00 53 ff 53 ff 90 00 00 00
00 00 00 00 00 00 00 00 00 00 00 00 00 00 00 00
00 00 00 00 00 00 00 00 00 00 00 00 00 00 b7 90

----------------

Block 0, Base EDID:
  EDID Structure Version & Revision: 1.4
  Vendor & Product Identification:
    Manufacturer: BOE
    Model: 3276
    Made in: week 14 of 2024
  Basic Display Parameters & Features:
    Digital display
    Bits per primary color channel: 8
    DisplayPort interface
    Maximum image size: 34 cm x 22 cm
    Gamma: 2.20
    Supported color formats: RGB 4:4:4
    First detailed timing includes the native pixel format and preferred refresh rate
    Display supports continuous frequencies
  Color Characteristics:
    Red  : 0.5830, 0.3632
    Green: 0.3447, 0.5576
    Blue : 0.1552, 0.1025
    White: 0.3134, 0.3291
  Established Timings I & II: none
  Standard Timings: none
  Detailed Timing Descriptors:
    DTD 1:  1920x1200   60.002837 Hz  16:10    77.284 kHz    160.750000 MHz (345 mm x 215 mm)
                 Hfront   48 Hsync  32 Hback   80 Hpol P
                 Vfront    3 Vsync   6 Vback   79 Vpol N
    Display Range Limits:
      Monitor ranges (Range Limits Only): 48-144 Hz V, 185-185 kHz H, max dotclock 390 MHz
    Alphanumeric Data String: '=L23        '
    Display Product Name: 'NE160WUM-NX8'
  Extension blocks: 2
Checksum: 0xc7

----------------

Block 1, CTA-861 Extension Block:
  Revision: 3
  Native DTDs: 0
  Colorimetry Data Block:
    sYCC601
  HDR Static Metadata Data Block:
    Electro optical transfer functions:
      Traditional gamma - SDR luminance range
    Supported static metadata descriptors:
      Static metadata type 1
    Desired content max luminance: 83 (301.833 cd/m^2)
    Desired content max frame-average luminance: 83 (301.833 cd/m^2)
    Desired content min luminance: 255 (3.018 cd/m^2)
Checksum: 0x6d  Unused space in Extension Block: 112 bytes

----------------

Block 2, DisplayID Extension Block:
  Version: 2.0
  Extension Count: 0
  Display Product Primary Use Case: None of the listed primary use cases; generic display
  Display Parameters Data Block (0x21):
    Image size: 344.7 mm x 215.4 mm
    Display native pixel format: 1920x1200
    Scan Orientation: Left to Right, Top to Bottom
    Luminance Information: Guidance for the Source device
    Color Information: CIE 1931
    Audio Speaker Information: not integrated
    Native Color Chromaticity:
      Primary #1:  (0.582764, 0.362793)
      Primary #2:  (0.344971, 0.557861)
      Primary #3:  (0.154785, 0.102783)
      White Point: (0.312988, 0.328857)
    Native Maximum Luminance (Full Coverage): 300.000000 cd/m^2
    Native Maximum Luminance (10% Rectangular Coverage): 300.000000 cd/m^2
    Native Minimum Luminance: 3.000000 cd/m^2
    Native Color Depth: 8 bpc
    Display Device Technology: Active Matrix LCD
    Native Gamma EOTF: 2.20
  Video Timing Modes Type 7 - Detailed Timings Data Block:
    DTD:  1920x1200  144.000090 Hz  16:10   185.472 kHz    385.782000 MHz (aspect 16:10, no 3D stereo, preferred)
               Hfront   48 Hsync  32 Hback   80 Hpol N
               Vfront    3 Vsync   6 Vback   79 Vpol N
  Adaptive Sync Data Block:
    Descriptor #1:
      Native Panel Range
      Fixed Average V-Total and Adaptive V-Total
      Supports Seamless Transition
      'Max Single Frame Duration Increase' field value without jitter impact
      'Max Single Frame Duration Decrease' field value without jitter impact
      Max Duration Increase: 0.00 ms
      Max Duration Decrease: 0.00 ms
      Min Refresh Rate: 48 Hz
      Max Refresh Rate: 144 Hz
    Descriptor #2:
      Native Panel Range
      Fixed Average V-Total and Adaptive V-Total
      Supports Seamless Transition
      'Max Single Frame Duration Increase' field value without jitter impact
      'Max Single Frame Duration Decrease' field value without jitter impact
      Max Duration Increase: 0.00 ms
      Max Duration Decrease: 0.00 ms
      Min Refresh Rate: 48 Hz
      Max Refresh Rate: 60 Hz
  CTA-861 DisplayID Data Block:
  Vendor-Specific Data Block (AMD), OUI 00-00-1A:
    Version: 3
    Feature Caps: 0x01
    Minimum Refresh Rate: 48 Hz
    Maximum Refresh Rate: 144 Hz
    Flags 1.x: 0x00
    Flags 2.x: 0x00
  Checksum: 0xb7
Checksum: 0x90

----------------

Warnings:

Block 1, CTA-861 Extension Block:
  IT Video Formats are overscanned by default, but normally this should be underscanned.
  Colorimetry Data Block: Set the sRGB colorimetry bit to avoid interop issues.
EDID:
  Base EDID: Some timings are out of range of the Monitor Ranges:
    Horizontal Freq: 77.283 - 185.472 kHz (Monitor: 185.000 - 185.000 kHz)

Failures:

Block 0, Base EDID:
  Alphanumeric Data String: 0xff byte at position 12.
Block 1, CTA-861 Extension Block:
  Required 640x480p60 timings are missing in the established timings and the SVD list (VIC 1).
  Missing VCDB, needed for Set Selectable RGB Quantization to avoid interop issues.
EDID:
  Extension Block 3 started with EDID header, ignoring Extension Blocks >= 3.

EDID conformity: FAIL
