edid-decode (hex):

00 ff ff ff ff ff ff 00 09 e5 b8 08 00 00 00 00
1e 1d 01 04 a5 26 15 78 02 9e 05 94 5c 59 95 2b
23 50 54 00 00 00 01 01 01 01 01 01 01 01 01 01
01 01 01 01 01 01 c0 39 80 18 71 38 28 40 30 20
36 00 7e d7 10 00 00 1a 00 00 00 00 00 00 00 00
00 00 00 00 00 00 00 00 00 00 00 00 00 fe 00 58
50 34 4d 32 80 4e 56 31 37 4e 34 45 00 00 00 00
00 02 41 21 96 00 10 00 00 0a 01 0a 20 20 00 89

00 ff ff ff ff ff ff 00 09 e5 b8 08 00 00 00 00
1e 1d 01 04 a5 26 15 78 02 9e 05 94 5c 59 95 2b
23 50 54 00 00 00 01 01 01 01 01 01 01 01 01 01
01 01 01 01 01 01 c0 39 80 18 71 38 28 40 30 20
36 00 7e d7 10 00 00 1a 00 00 00 00 00 00 00 00
00 00 00 00 00 00 00 00 00 00 00 00 00 fe 00 58
50 34 4d 32 80 4e 56 31 37 4e 34 45 00 00 00 00
00 02 41 21 96 00 10 00 00 0a 01 0a 20 20 00 89

----------------

Block 0, Base EDID:
  EDID Structure Version & Revision: 1.4
  Vendor & Product Identification:
    Manufacturer: BOE
    Model: 2232
    Made in: week 30 of 2019
  Basic Display Parameters & Features:
    Digital display
    Bits per primary color channel: 8
    DisplayPort interface
    Maximum image size: 38 cm x 21 cm
    Gamma: 2.20
    Supported color formats: RGB 4:4:4
    First detailed timing includes the native pixel format and preferred refresh rate
  Color Characteristics:
    Red  : 0.5800, 0.3603
    Green: 0.3505, 0.5839
    Blue : 0.1679, 0.1367
    White: 0.3134, 0.3291
  Established Timings I & II: none
  Standard Timings: none
  Detailed Timing Descriptors:
    DTD 1:  1920x1080   60.000000 Hz  16:9     67.200 kHz    147.840000 MHz (382 mm x 215 mm)
                 Hfront   48 Hsync  32 Hback  200 Hpol P
                 Vfront    3 Vsync   6 Vback   31 Vpol N
    Empty Descriptor
    Alphanumeric Data String: 'XP4M2.NV17N4E'
    Manufacturer-Specified Display Descriptor (0x00): 00 00 00 02 41 21 96 00 10 00 00 0a 01 0a 20 20 '....A!........  '
Checksum: 0x89

----------------

Warnings:

Block 0, Base EDID:
  Alphanumeric Data String: Non-ASCII character 0x80 at position 5, can cause problems.
  Missing Display Product Name.

Failures:

Block 0, Base EDID:
  Empty Descriptor: Use Dummy Descriptor instead of all zeroes.
EDID:
  Extension Block 1 started with EDID header, ignoring Extension Blocks >= 1.

EDID conformity: FAIL
