edid-decode (hex):

00 ff ff ff ff ff ff 00 15 c3 40 24 01 01 01 01
20 1c 01 03 80 30 1e 78 ea 3a d5 a4 55 54 a2 28
0a 50 54 21 08 00 81 80 81 40 81 c0 01 01 01 01
01 01 01 01 01 01 7c 2e 90 a0 60 1a 1e 40 30 20
36 00 da 29 11 00 00 1a 00 00 00 ff 00 36 36 33
37 33 30 38 38 0a 20 20 20 20 00 00 00 fd 00 3b
3d 1f 44 0c 00 0a 20 20 20 20 20 20 00 00 00 fc
00 45 56 32 32 31 36 57 0a 20 20 20 20 20 00 a3

00 ff ff ff ff ff ff 00 15 c3 40 24 01 01 01 01
20 1c 01 03 80 30 1e 78 ea 3a d5 a4 55 54 a2 28
0a 50 54 21 08 00 81 80 81 40 81 c0 01 01 01 01
01 01 01 01 01 01 7c 2e 90 a0 60 1a 1e 40 30 20
36 00 da 29 11 00 00 1a 00 00 00 ff 00 36 36 33
37 33 30 38 38 0a 20 20 20 20 00 00 00 fd 00 3b
3d 1f 44 0c 00 0a 20 20 20 20 20 20 00 00 00 fc
00 45 56 32 32 31 36 57 0a 20 20 20 20 20 00 a3

----------------

Block 0, Base EDID:
  EDID Structure Version & Revision: 1.3
  Vendor & Product Identification:
    Manufacturer: ENC
    Model: 9280
    Serial Number: ...
    Made in: week 32 of 2018
  Basic Display Parameters & Features:
    Digital display
    Maximum image size: 48 cm x 30 cm
    Gamma: 2.20
    DPMS levels: Standby Suspend Off
    RGB color display
    First detailed timing is the preferred timing
  Color Characteristics:
    Red  : 0.6406, 0.3349
    Green: 0.3300, 0.6347
    Blue : 0.1591, 0.0400
    White: 0.3134, 0.3291
  Established Timings I & II:
    DMT 0x04:   640x480    59.940476 Hz   4:3     31.469 kHz     25.175000 MHz
    DMT 0x09:   800x600    60.316541 Hz   4:3     37.879 kHz     40.000000 MHz
    DMT 0x10:  1024x768    60.003840 Hz   4:3     48.363 kHz     65.000000 MHz
  Standard Timings:
    DMT 0x23:  1280x1024   60.019740 Hz   5:4     63.981 kHz    108.000000 MHz
    DMT 0x20:  1280x960    60.000000 Hz   4:3     60.000 kHz    108.000000 MHz
    DMT 0x55:  1280x720    60.000000 Hz  16:9     45.000 kHz     74.250000 MHz
  Detailed Timing Descriptors:
    DTD 1:  1680x1050   59.883253 Hz  16:10    64.674 kHz    119.000000 MHz (474 mm x 297 mm)
                 Hfront   48 Hsync  32 Hback   80 Hpol P
                 Vfront    3 Vsync   6 Vback   21 Vpol N
    Display Product Serial Number: ...
    Display Range Limits:
      Monitor ranges (GTF): 59-61 Hz V, 31-68 kHz H, max dotclock 120 MHz
    Display Product Name: 'EV2216W'
Checksum: 0xa3

----------------

Warnings:

Block 0, Base EDID:
  Vendor & Product Identification: The serial number is one of the known dummy values, it should probably be set to 0.

Failures:

EDID:
  Extension Block 1 started with EDID header, ignoring Extension Blocks >= 1.

EDID conformity: FAIL
