edid-decode (hex):

00 ff ff ff ff ff ff 00 0e 6f 28 16 00 60 00 00
00 20 01 04 b5 22 16 78 03 29 f5 a5 54 4b 9d 24
0d 50 54 00 00 00 01 01 01 01 01 01 01 01 01 01
01 01 01 01 01 01 c0 72 00 a0 a0 40 c8 60 30 20
36 00 58 d7 10 00 00 18 00 00 00 fd 0c 3c f0 b1
b1 76 01 0a 20 20 20 20 20 20 00 00 00 fe 00 43
53 4f 54 20 54 33 0a 20 20 20 20 20 00 00 00 fe
00 4d 4e 47 30 30 37 44 41 32 2d 33 0a 20 02 a9

02 03 1d 00 e3 05 80 00 e6 06 05 01 6a 6a 24 6d
1a 00 00 02 03 3c f0 00 04 6a 24 6a 24 00 00 00
00 00 00 00 00 00 00 00 00 00 00 00 00 00 00 00
00 00 00 00 00 00 00 00 00 00 00 00 00 00 00 00
00 00 00 00 00 00 00 00 00 00 00 00 00 00 00 00
00 00 00 00 00 00 00 00 00 00 00 00 00 00 00 00
00 00 00 00 00 00 00 00 00 00 00 00 00 00 00 00
00 00 00 00 00 00 00 00 00 00 00 00 00 00 00 b4

00 ff ff ff ff ff ff 00 0e 6f 28 16 00 60 00 00
00 20 01 04 b5 22 16 78 03 29 f5 a5 54 4b 9d 24
0d 50 54 00 00 00 01 01 01 01 01 01 01 01 01 01
01 01 01 01 01 01 c0 72 00 a0 a0 40 c8 60 30 20
36 00 58 d7 10 00 00 18 00 00 00 fd 0c 3c f0 b1
b1 76 01 0a 20 20 20 20 20 20 00 00 00 fe 00 43
53 4f 54 20 54 33 0a 20 20 20 20 20 00 00 00 fe
00 4d 4e 47 30 30 37 44 41 32 2d 33 0a 20 02 a9

00 ff ff ff ff ff ff 00 0e 6f 28 16 00 60 00 00
00 20 01 04 b5 22 16 78 03 29 f5 a5 54 4b 9d 24
0d 50 54 00 00 00 01 01 01 01 01 01 01 01 01 01
01 01 01 01 01 01 c0 72 00 a0 a0 40 c8 60 30 20
36 00 58 d7 10 00 00 18 00 00 00 fd 0c 3c f0 b1
b1 76 01 0a 20 20 20 20 20 20 00 00 00 fe 00 43
53 4f 54 20 54 33 0a 20 20 20 20 20 00 00 00 fe
00 4d 4e 47 30 30 37 44 41 32 2d 33 0a 20 02 a9

02 03 1d 00 e3 05 80 00 e6 06 05 01 6a 6a 24 6d
1a 00 00 02 03 3c f0 00 04 6a 24 6a 24 00 00 00
00 00 00 00 00 00 00 00 00 00 00 00 00 00 00 00
00 00 00 00 00 00 00 00 00 00 00 00 00 00 00 00
00 00 00 00 00 00 00 00 00 00 00 00 00 00 00 00
00 00 00 00 00 00 00 00 00 00 00 00 00 00 00 00
00 00 00 00 00 00 00 00 00 00 00 00 00 00 00 00
00 00 00 00 00 00 00 00 00 00 00 00 00 00 00 b4

00 ff ff ff ff ff ff 00 0e 6f 28 16 00 60 00 00
00 20 01 04 b5 22 16 78 03 29 f5 a5 54 4b 9d 24
0d 50 54 00 00 00 01 01 01 01 01 01 01 01 01 01
01 01 01 01 01 01 c0 72 00 a0 a0 40 c8 60 30 20
36 00 58 d7 10 00 00 18 00 00 00 fd 0c 3c f0 b1
b1 76 01 0a 20 20 20 20 20 20 00 00 00 fe 00 43
53 4f 54 20 54 33 0a 20 20 20 20 20 00 00 00 fe
00 4d 4e 47 30 30 37 44 41 32 2d 33 0a 20 02 a9

----------------

Block 0, Base EDID:
  EDID Structure Version & Revision: 1.4
  Vendor & Product Identification:
    Manufacturer: CSO
    Model: 5672
    Serial Number: ...
    Made in: 2022
  Basic Display Parameters & Features:
    Digital display
    Bits per primary color channel: 10
    DisplayPort interface
    Maximum image size: 34 cm x 22 cm
    Gamma: 2.20
    Supported color formats: RGB 4:4:4
    First detailed timing includes the native pixel format and preferred refresh rate
    Display supports continuous frequencies
  Color Characteristics:
    Red  : 0.6445, 0.3300
    Green: 0.2949, 0.6142
    Blue : 0.1435, 0.0537
    White: 0.3134, 0.3291
  Established Timings I & II: none
  Standard Timings: none
  Detailed Timing Descriptors:
    DTD 1:  2560x1600   60.000000 Hz  16:10   108.000 kHz    293.760000 MHz (344 mm x 215 mm)
                 Hfront   48 Hsync  32 Hback   80 Hpol N
                 Vfront    3 Vsync   6 Vback  191 Vpol N
    Display Range Limits:
      Monitor ranges (Range Limits Only): 60-240 Hz V, 432-432 kHz H, max dotclock 1180 MHz
    Alphanumeric Data String: 'CSOT T3'
    Alphanumeric Data String: 'MNG007DA2-3'
  Extension blocks: 2
Checksum: 0xa9

----------------

Block 1, CTA-861 Extension Block:
  Revision: 3
  Native DTDs: 0
  Colorimetry Data Block:
    BT2020RGB
  HDR Static Metadata Data Block:
    Electro optical transfer functions:
      Traditional gamma - SDR luminance range
      SMPTE ST2084
    Supported static metadata descriptors:
      Static metadata type 1
    Desired content max luminance: 106 (496.743 cd/m^2)
    Desired content max frame-average luminance: 106 (496.743 cd/m^2)
    Desired content min luminance: 36 (0.099 cd/m^2)
  Vendor-Specific Data Block (AMD), OUI 00-00-1A:
    Version: 2
    Flags 1: 0x03
      FreeSync Supported
      FreeSync 2 HDR Supported
    Minimum Refresh Rate: 60 Hz
    Maximum Refresh Rate: 240 Hz
    Flags 5: 0x04
      Gamma 2.2 EOTF Supported
    Maximum luminance: 106 (496.743 cd/m^2)
    Minimum luminance: 36 (0.099 cd/m^2)
Checksum: 0xb4  Unused space in Extension Block: 98 bytes

----------------

Warnings:

Block 0, Base EDID:
  Missing Display Product Name.
Block 1, CTA-861 Extension Block:
  IT Video Formats are overscanned by default, but normally this should be underscanned.
  Colorimetry Data Block: Set the sRGB colorimetry bit to avoid interop issues.
EDID:
  Base EDID: Some timings are out of range of the Monitor Ranges:
    Horizontal Freq: 108.000 - 108.000 kHz (Monitor: 432.000 - 432.000 kHz)

Failures:

Block 1, CTA-861 Extension Block:
  Required 640x480p60 timings are missing in the established timings and the SVD list (VIC 1).
  Missing VCDB, needed for Set Selectable RGB Quantization to avoid interop issues.
EDID:
  Extension Block 2 started with EDID header, ignoring Extension Blocks >= 2.
  Base EDID: EDID specified 2 extension block(s), but found 1 extension block(s).

EDID conformity: FAIL
