edid-decode (hex):

00 ff ff ff ff ff ff 00 0d af 20 17 00 00 00 00
02 15 01 04 90 26 15 78 02 d8 95 a3 55 4d 9d 27
0f 50 54 00 00 00 01 01 01 01 01 01 01 01 01 01
01 01 01 01 01 01 e1 36 80 ae 70 38 26 40 34 23
36 00 7e d7 10 00 00 1a 1d 24 80 a0 70 38 1f 40
30 20 35 00 7e d7 10 00 00 1a 00 00 00 fe 00 57
30 44 38 43 80 31 37 33 48 47 45 0a 00 00 00 00
00 00 41 31 9e 00 00 00 00 02 01 0a 20 20 00 14

----------------

Block 0, Base EDID:
  EDID Structure Version & Revision: 1.4
  Vendor & Product Identification:
    Manufacturer: CMO
    Model: 5920
    Made in: week 2 of 2011
  Basic Display Parameters & Features:
    Digital display
    Bits per primary color channel: 6
    Digital interface is not defined
    Maximum image size: 38 cm x 21 cm
    Gamma: 2.20
    Supported color formats: RGB 4:4:4
    First detailed timing includes the native pixel format and preferred refresh rate
  Color Characteristics:
    Red  : 0.6396, 0.3330
    Green: 0.3027, 0.6132
    Blue : 0.1542, 0.0595
    White: 0.3134, 0.3291
  Established Timings I & II: none
  Standard Timings: none
  Detailed Timing Descriptors:
    DTD 1:  1920x1080   60.010457 Hz  16:9     67.092 kHz    140.490000 MHz (382 mm x 215 mm)
                 Hfront   52 Hsync  35 Hback   87 Hpol P
                 Vfront    3 Vsync   6 Vback   29 Vpol N
    DTD 2:  1920x1080   40.006404 Hz  16:9     44.447 kHz     92.450000 MHz (382 mm x 215 mm)
                 Hfront   48 Hsync  32 Hback   80 Hpol P
                 Vfront    3 Vsync   5 Vback   23 Vpol N
    Alphanumeric Data String: 'W0D8C.173HGE'
    Manufacturer-Specified Display Descriptor (0x00): 00 00 00 00 41 31 9e 00 00 00 00 02 01 0a 20 20 '....A1........  '
Checksum: 0x14

----------------

Warnings:

Block 0, Base EDID:
  Alphanumeric Data String: Non-ASCII character 0x80 at position 5, can cause problems.
  Missing Display Product Name.

EDID conformity: PASS
