edid-decode (hex):

00 ff ff ff ff ff ff 00 4c 2d 5c e0 00 00 00 00
14 22 01 04 b5 77 22 78 3b 34 95 af 4e 3a bb 25
0c 50 54 21 08 00 81 c0 81 00 81 80 95 00 a9 c0
b3 00 01 01 01 01 ef dc 00 18 f1 38 40 40 30 20
3a 00 a9 50 41 00 00 1a 00 00 00 fd 0c 30 f0 66
66 c3 01 0a 20 20 20 20 20 20 00 00 00 fc 00 4f
64 79 73 73 65 79 20 47 39 35 53 44 00 00 00 ff
00 48 31 41 4b 35 30 30 30 30 30 0a 20 20 02 2a

02 03 30 f1 44 90 3f 04 03 23 09 07 07 83 01 00
00 e3 05 c3 01 6d 1a 00 00 02 07 30 f0 00 04 60
02 4b 02 e6 06 05 01 60 4a 00 e5 01 8b 84 90 39
56 5e 00 a0 a0 a0 29 50 30 20 35 00 a9 50 41 00
00 1a 6f c2 00 a0 a0 a0 55 50 30 20 35 00 a9 50
41 00 00 1a 34 e9 80 18 71 38 33 40 6c 20 35 00
a9 50 41 00 00 1a 47 6b 00 18 f1 38 1f 40 30 20
3a 00 a9 50 41 00 00 1a 00 00 00 00 00 00 00 0e

70 12 79 03 00 03 01 64 5d f6 02 08 ff 13 3f 01
7f 80 1f 00 9f 05 2e 00 20 00 07 00 c2 81 01 88
ff 13 17 01 2f 80 1f 00 9f 05 53 00 02 00 09 00
6f bb 00 08 ff 13 17 01 2f 80 1f 00 9f 05 28 00
02 00 09 00 4a d5 01 08 ff 0e 17 01 2f 80 1f 00
37 04 86 00 02 00 09 00 af 94 01 04 ff 09 3f 01
7f 80 1f 00 9f 05 3a 00 02 00 04 00 00 00 00 00
00 00 00 00 00 00 00 00 00 00 00 00 00 00 04 90

00 ff ff ff ff ff ff 00 4c 2d 5c e0 00 00 00 00
14 22 01 04 b5 77 22 78 3b 34 95 af 4e 3a bb 25
0c 50 54 21 08 00 81 c0 81 00 81 80 95 00 a9 c0
b3 00 01 01 01 01 ef dc 00 18 f1 38 40 40 30 20
3a 00 a9 50 41 00 00 1a 00 00 00 fd 0c 30 f0 66
66 c3 01 0a 20 20 20 20 20 20 00 00 00 fc 00 4f
64 79 73 73 65 79 20 47 39 35 53 44 00 00 00 ff
00 48 31 41 4b 35 30 30 30 30 30 0a 20 20 02 2a

02 03 30 f1 44 90 3f 04 03 23 09 07 07 83 01 00
00 e3 05 c3 01 6d 1a 00 00 02 07 30 f0 00 04 60
02 4b 02 e6 06 05 01 60 4a 00 e5 01 8b 84 90 39
56 5e 00 a0 a0 a0 29 50 30 20 35 00 a9 50 41 00
00 1a 6f c2 00 a0 a0 a0 55 50 30 20 35 00 a9 50
41 00 00 1a 34 e9 80 18 71 38 33 40 6c 20 35 00
a9 50 41 00 00 1a 47 6b 00 18 f1 38 1f 40 30 20
3a 00 a9 50 41 00 00 1a 00 00 00 00 00 00 00 0e

70 12 79 03 00 03 01 64 5d f6 02 08 ff 13 3f 01
7f 80 1f 00 9f 05 2e 00 20 00 07 00 c2 81 01 88
ff 13 17 01 2f 80 1f 00 9f 05 53 00 02 00 09 00
6f bb 00 08 ff 13 17 01 2f 80 1f 00 9f 05 28 00
02 00 09 00 4a d5 01 08 ff 0e 17 01 2f 80 1f 00
37 04 86 00 02 00 09 00 af 94 01 04 ff 09 3f 01
7f 80 1f 00 9f 05 3a 00 02 00 04 00 00 00 00 00
00 00 00 00 00 00 00 00 00 00 00 00 00 00 04 90

----------------

Block 0, Base EDID:
  EDID Structure Version & Revision: 1.4
  Vendor & Product Identification:
    Manufacturer: SAM
    Model: 57436
    Made in: week 20 of 2024
  Basic Display Parameters & Features:
    Digital display
    Bits per primary color channel: 10
    DisplayPort interface
    Maximum image size: 119 cm x 34 cm
    Gamma: 2.20
    DPMS levels: Off
    Supported color formats: RGB 4:4:4, YCrCb 4:4:4, YCrCb 4:2:2
    First detailed timing includes the native pixel format and preferred refresh rate
    Display supports continuous frequencies
  Color Characteristics:
    Red  : 0.6835, 0.3076
    Green: 0.2275, 0.7304
    Blue : 0.1464, 0.0478
    White: 0.3134, 0.3291
  Established Timings I & II:
    DMT 0x04:   640x480    59.940476 Hz   4:3     31.469 kHz     25.175000 MHz
    DMT 0x09:   800x600    60.316541 Hz   4:3     37.879 kHz     40.000000 MHz
    DMT 0x10:  1024x768    60.003840 Hz   4:3     48.363 kHz     65.000000 MHz
  Standard Timings:
    DMT 0x55:  1280x720    60.000000 Hz  16:9     45.000 kHz     74.250000 MHz
    DMT 0x1c:  1280x800    59.810326 Hz  16:10    49.702 kHz     83.500000 MHz
    DMT 0x23:  1280x1024   60.019740 Hz   5:4     63.981 kHz    108.000000 MHz
    DMT 0x2f:  1440x900    59.887445 Hz  16:10    55.935 kHz    106.500000 MHz
    DMT 0x53:  1600x900    60.000000 Hz  16:9     60.000 kHz    108.000000 MHz (RB)
    DMT 0x3a:  1680x1050   59.954250 Hz  16:10    65.290 kHz    146.250000 MHz
  Detailed Timing Descriptors:
    DTD 1:  3840x1080  119.999236 Hz  32:9    137.279 kHz    565.590000 MHz (1193 mm x 336 mm)
                 Hfront   48 Hsync  32 Hback  200 Hpol P
                 Vfront    3 Vsync  10 Vback   51 Vpol N
    Display Range Limits:
      Monitor ranges (Range Limits Only): 48-240 Hz V, 357-357 kHz H, max dotclock 1950 MHz
    Display Product Name: 'Odyssey G95SD'
    Display Product Serial Number: ...
  Extension blocks: 2
Checksum: 0x2a

----------------

Block 1, CTA-861 Extension Block:
  Revision: 3
  Underscans IT Video Formats by default
  Basic audio support
  Supports YCbCr 4:4:4
  Supports YCbCr 4:2:2
  Native DTDs: 1
  Video Data Block:
    VIC  16:  1920x1080   60.000000 Hz  16:9     67.500 kHz    148.500000 MHz (native)
    VIC  63:  1920x1080  120.000000 Hz  16:9    135.000 kHz    297.000000 MHz
    VIC   4:  1280x720    60.000000 Hz  16:9     45.000 kHz     74.250000 MHz
    VIC   3:   720x480    59.940060 Hz  16:9     31.469 kHz     27.000000 MHz
  Audio Data Block:
    Linear PCM:
      Max channels: 2
      Supported sample rates (kHz): 48 44.1 32
      Supported sample sizes (bits): 24 20 16
  Speaker Allocation Data Block:
    FL/FR - Front Left/Right
  Colorimetry Data Block:
    xvYCC601
    xvYCC709
    BT2020YCC
    BT2020RGB
    Gamut Boundary Description Metadata Profile P0
  Vendor-Specific Data Block (AMD), OUI 00-00-1A:
    Version: 2
    Flags 1: 0x07
      FreeSync Supported
      FreeSync 2 HDR Supported
      Global Backlight Control Supported
    Minimum Refresh Rate: 48 Hz
    Maximum Refresh Rate: 240 Hz
    Flags 5: 0x04
      Gamma 2.2 EOTF Supported
    Maximum luminance: 96 (400.000 cd/m^2)
    Minimum luminance: 2 (0.000 cd/m^2)
    Maximum luminance (minimum backlight): 75 (253.810 cd/m^2)
    Minimum luminance (minimum backlight): 2 (0.000 cd/m^2)
  HDR Static Metadata Data Block:
    Electro optical transfer functions:
      Traditional gamma - SDR luminance range
      SMPTE ST2084
    Supported static metadata descriptors:
      Static metadata type 1
    Desired content max luminance: 96 (400.000 cd/m^2)
    Desired content max frame-average luminance: 74 (248.372 cd/m^2)
    Desired content min luminance: 0 (0.000 cd/m^2)
  Vendor-Specific Video Data Block (HDR10+), OUI 90-84-8B:
    Application Version: 1
    Full Frame Peak Luminance Index: 2
    Peak Luminance Index: 3
  Detailed Timing Descriptors:
    DTD 2:  2560x1440   59.950550 Hz  16:9     88.787 kHz    241.500000 MHz (1193 mm x 336 mm)
                 Hfront   48 Hsync  32 Hback   80 Hpol P
                 Vfront    3 Vsync   5 Vback   33 Vpol N
    DTD 3:  2560x1440  119.997589 Hz  16:9    182.996 kHz    497.750000 MHz (1193 mm x 336 mm)
                 Hfront   48 Hsync  32 Hback   80 Hpol P
                 Vfront    3 Vsync   5 Vback   77 Vpol N
    DTD 4:  1920x1080  239.932481 Hz  16:9    271.364 kHz    597.000000 MHz (1193 mm x 336 mm)
                 Hfront  108 Hsync  32 Hback  140 Hpol P
                 Vfront    3 Vsync   5 Vback   43 Vpol N
    DTD 5:  3840x1080   59.997990 Hz  32:9     66.658 kHz    274.630000 MHz (1193 mm x 336 mm)
                 Hfront   48 Hsync  32 Hback  200 Hpol P
                 Vfront    3 Vsync  10 Vback   18 Vpol N
Checksum: 0x0e  Unused space in Extension Block: 7 bytes

----------------

Block 2, DisplayID Extension Block:
  Version: 1.2
  Extension Count: 0
  Display Product Type: Standalone display device
  Video Timing Modes Type 1 - Detailed Timings Data Block:
    DTD:  5120x1440  239.999110 Hz   0:0    356.879 kHz   1941.420000 MHz (aspect undefined, no 3D stereo)
               Hfront  128 Hsync  32 Hback  160 Hpol P
               Vfront   33 Vsync   8 Vback    6 Vpol N
    DTD:  5120x1440  119.999757 Hz   0:0    182.880 kHz    987.550000 MHz (aspect undefined, no 3D stereo, preferred)
               Hfront   48 Hsync  32 Hback  200 Hpol P
               Vfront    3 Vsync  10 Vback   71 Vpol N
    DTD:  5120x1440   59.999500 Hz   0:0     88.859 kHz    479.840000 MHz (aspect undefined, no 3D stereo)
               Hfront   48 Hsync  32 Hback  200 Hpol P
               Vfront    3 Vsync  10 Vback   28 Vpol N
    DTD:  3840x1080  239.999600 Hz   0:0    291.600 kHz   1201.390000 MHz (aspect undefined, no 3D stereo)
               Hfront   48 Hsync  32 Hback  200 Hpol P
               Vfront    3 Vsync  10 Vback  122 Vpol N
    DTD:  2560x1440  239.974798 Hz  16:9    359.722 kHz   1036.000000 MHz (aspect 16:9, no 3D stereo)
               Hfront  128 Hsync  32 Hback  160 Hpol P
               Vfront    3 Vsync   5 Vback   51 Vpol N
  Checksum: 0x04
Checksum: 0x90

----------------

Warnings:

Block 0, Base EDID:
  Display Product Serial Number: ...
Block 1, CTA-861 Extension Block:
  Video Data Block: VIC 16 and the first DTD are not identical. Is this intended?
  Colorimetry Data Block: Set the sRGB colorimetry bit to avoid interop issues.
  Detailed Timing Descriptor #2: Image size is 1193x336 mm, but based on the picture AR it should be 597x336 mm.
  Detailed Timing Descriptor #3: Image size is 1193x336 mm, but based on the picture AR it should be 597x336 mm.
  Detailed Timing Descriptor #4: Image size is 1193x336 mm, but based on the picture AR it should be 597x336 mm.
EDID:
  Base EDID: Some timings are out of range of the Monitor Ranges:
    Horizontal Freq: 31.468 - 359.722 kHz (Monitor: 357.000 - 357.000 kHz)

Failures:

Block 1, CTA-861 Extension Block:
  Missing VCDB, needed for Set Selectable RGB Quantization to avoid interop issues.
EDID:
  Extension Block 3 started with EDID header, ignoring Extension Blocks >= 3.
  CTA-861: Native progressive timings are a mix of several resolutions.
  DisplayID: Missing DisplayID Display Parameters Data Block.

EDID conformity: FAIL
