edid-decode (hex):

00 ff ff ff ff ff ff 00 21 57 36 18 bd e9 02 00
25 1d 01 03 80 35 1d 78 62 ee 91 a3 54 4c 99 26
0f 50 54 21 0f 00 81 00 81 40 81 80 90 40 95 00
01 01 a9 40 b3 00 02 3a 80 18 71 38 2d 40 58 2c
55 00 e0 0e 11 00 00 5f 0e 1f 00 80 51 00 1e 30
40 80 37 00 0f 48 42 00 00 1c 00 00 00 fd 00 17
55 1e 64 1e 00 0a 20 20 20 20 20 20 00 00 00 fc
00 4d 41 43 52 4f 53 49 4c 49 43 4f 4e 0a 01 86

02 03 2e f1 52 02 11 13 84 1f 10 03 12 06 15 07
16 05 14 5e 5f 63 64 23 09 7f 07 83 7f 00 00 6e
03 0c 00 10 00 00 3c 20 00 80 01 02 03 04 66 21
50 b0 51 00 1b 30 40 70 36 00 0f 48 42 00 00 1e
66 21 56 aa 51 00 1e 30 46 8f 33 00 0f 48 42 00
00 1e 8c 0a d0 8a 20 e0 2d 10 10 3e 96 00 10 09
00 00 00 18 00 00 00 00 00 00 00 00 00 00 00 00
00 00 00 00 00 00 00 00 00 00 00 00 00 00 00 b9

00 ff ff ff ff ff ff 00 21 57 36 18 bd e9 02 00
25 1d 01 03 80 35 1d 78 62 ee 91 a3 54 4c 99 26
0f 50 54 21 0f 00 81 00 81 40 81 80 90 40 95 00
01 01 a9 40 b3 00 02 3a 80 18 71 38 2d 40 58 2c
55 00 e0 0e 11 00 00 5f 0e 1f 00 80 51 00 1e 30
40 80 37 00 0f 48 42 00 00 1c 00 00 00 fd 00 17
55 1e 64 1e 00 0a 20 20 20 20 20 20 00 00 00 fc
00 4d 41 43 52 4f 53 49 4c 49 43 4f 4e 0a 01 86

02 03 2e f1 52 02 11 13 84 1f 10 03 12 06 15 07
16 05 14 5e 5f 63 64 23 09 7f 07 83 7f 00 00 6e
03 0c 00 10 00 00 3c 20 00 80 01 02 03 04 66 21
50 b0 51 00 1b 30 40 70 36 00 0f 48 42 00 00 1e
66 21 56 aa 51 00 1e 30 46 8f 33 00 0f 48 42 00
00 1e 8c 0a d0 8a 20 e0 2d 10 10 3e 96 00 10 09
00 00 00 18 00 00 00 00 00 00 00 00 00 00 00 00
00 00 00 00 00 00 00 00 00 00 00 00 00 00 00 b9

----------------

Block 0, Base EDID:
  EDID Structure Version & Revision: 1.3
  Vendor & Product Identification:
    Manufacturer: HJW
    Model: 6198
    Serial Number: ...
    Made in: week 37 of 2019
  Basic Display Parameters & Features:
    Digital display
    Maximum image size: 53 cm x 29 cm
    Gamma: 2.20
    DPMS levels: Suspend Off
    Monochrome or grayscale display
    First detailed timing is the preferred timing
  Color Characteristics:
    Red  : 0.6396, 0.3300
    Green: 0.2998, 0.5996
    Blue : 0.1503, 0.0595
    White: 0.3125, 0.3291
  Established Timings I & II:
    DMT 0x04:   640x480    59.940476 Hz   4:3     31.469 kHz     25.175000 MHz
    DMT 0x09:   800x600    60.316541 Hz   4:3     37.879 kHz     40.000000 MHz
    DMT 0x10:  1024x768    60.003840 Hz   4:3     48.363 kHz     65.000000 MHz
    DMT 0x11:  1024x768    70.069359 Hz   4:3     56.476 kHz     75.000000 MHz
    DMT 0x12:  1024x768    75.028582 Hz   4:3     60.023 kHz     78.750000 MHz
    DMT 0x24:  1280x1024   75.024675 Hz   5:4     79.976 kHz    135.000000 MHz
  Standard Timings:
    DMT 0x1c:  1280x800    59.810326 Hz  16:10    49.702 kHz     83.500000 MHz
    DMT 0x20:  1280x960    60.000000 Hz   4:3     60.000 kHz    108.000000 MHz
    DMT 0x23:  1280x1024   60.019740 Hz   5:4     63.981 kHz    108.000000 MHz
    DMT 0x2a:  1400x1050   59.978442 Hz   4:3     65.317 kHz    121.750000 MHz
    DMT 0x2f:  1440x900    59.887445 Hz  16:10    55.935 kHz    106.500000 MHz
    DMT 0x33:  1600x1200   60.000000 Hz   4:3     75.000 kHz    162.000000 MHz
    DMT 0x3a:  1680x1050   59.954250 Hz  16:10    65.290 kHz    146.250000 MHz
  Detailed Timing Descriptors:
    DTD 1:  1920x1080   60.000000 Hz  16:9     67.500 kHz    148.500000 MHz (interleaved left even, 480 mm x 270 mm)
                 Hfront   88 Hsync  44 Hback  148 Hpol P
                 Vfront    5 Vsync   5 Vback   35 Vpol P
    DTD 2:  1280x768    59.870228 Hz   5:3     47.776 kHz     79.500000 MHz (1039 mm x 584 mm)
                 Hfront   64 Hsync 128 Hback  192 Hpol N
                 Vfront    3 Vsync   7 Vback   20 Vpol P
    Display Range Limits:
      Monitor ranges (GTF): 23-85 Hz V, 30-100 kHz H, max dotclock 300 MHz
    Display Product Name: 'MACROSILICON'
  Extension blocks: 1
Checksum: 0x86

----------------

Block 1, CTA-861 Extension Block:
  Revision: 3
  Underscans IT Video Formats by default
  Basic audio support
  Supports YCbCr 4:4:4
  Supports YCbCr 4:2:2
  Native detailed modes: 1
  Video Data Block:
    VIC   2:   720x480    59.940060 Hz   4:3     31.469 kHz     27.000000 MHz
    VIC  17:   720x576    50.000000 Hz   4:3     31.250 kHz     27.000000 MHz
    VIC  19:  1280x720    50.000000 Hz  16:9     37.500 kHz     74.250000 MHz
    VIC   4:  1280x720    60.000000 Hz  16:9     45.000 kHz     74.250000 MHz (native)
    VIC  31:  1920x1080   50.000000 Hz  16:9     56.250 kHz    148.500000 MHz
    VIC  16:  1920x1080   60.000000 Hz  16:9     67.500 kHz    148.500000 MHz
    VIC   3:   720x480    59.940060 Hz  16:9     31.469 kHz     27.000000 MHz
    VIC  18:   720x576    50.000000 Hz  16:9     31.250 kHz     27.000000 MHz
    VIC   6:  1440x480i   59.940060 Hz   4:3     15.734 kHz     27.000000 MHz
    VIC  21:  1440x576i   50.000000 Hz   4:3     15.625 kHz     27.000000 MHz
    VIC   7:  1440x480i   59.940060 Hz  16:9     15.734 kHz     27.000000 MHz
    VIC  22:  1440x576i   50.000000 Hz  16:9     15.625 kHz     27.000000 MHz
    VIC   5:  1920x1080i  60.000000 Hz  16:9     33.750 kHz     74.250000 MHz
    VIC  20:  1920x1080i  50.000000 Hz  16:9     28.125 kHz     74.250000 MHz
    VIC  94:  3840x2160   25.000000 Hz  16:9     56.250 kHz    297.000000 MHz
    VIC  95:  3840x2160   30.000000 Hz  16:9     67.500 kHz    297.000000 MHz
    VIC  99:  4096x2160   25.000000 Hz 256:135   56.250 kHz    297.000000 MHz
    VIC 100:  4096x2160   30.000000 Hz 256:135   67.500 kHz    297.000000 MHz
  Audio Data Block:
    Linear PCM:
      Max channels: 2
      Supported sample rates (kHz): 192 176.4 96 88.2 48 44.1 32
      Supported sample sizes (bits): 24 20 16
  Speaker Allocation Data Block:
    FL/FR - Front Left/Right
    LFE1 - Low Frequency Effects 1
    FC - Front Center
    LS/RS - Left/Right Surround
    BC - Back Center
    FLc/FRc - Front Left/Right of Center
    BL/BR - Back Left/Right
  Vendor-Specific Data Block (HDMI), OUI 00-0C-03:
    Source physical address: 1.0.0.0
    Maximum TMDS clock: 300 MHz
    Extended HDMI video details:
      HDMI VICs:
        HDMI VIC 1:  3840x2160   30.000000 Hz  16:9     67.500 kHz    297.000000 MHz
        HDMI VIC 2:  3840x2160   25.000000 Hz  16:9     56.250 kHz    297.000000 MHz
        HDMI VIC 3:  3840x2160   24.000000 Hz  16:9     54.000 kHz    297.000000 MHz
        HDMI VIC 4:  4096x2160   24.000000 Hz 256:135   54.000 kHz    297.000000 MHz
  Detailed Timing Descriptors:
    DTD 3:  1360x768    60.015162 Hz  85:48    47.712 kHz     85.500000 MHz (1039 mm x 584 mm)
                 Hfront   64 Hsync 112 Hback  256 Hpol P
                 Vfront    3 Vsync   6 Vback   18 Vpol P
    DTD 4:  1366x768    59.789541 Hz 683:384   47.712 kHz     85.500000 MHz (1039 mm x 584 mm)
                 Hfront   70 Hsync 143 Hback  213 Hpol P
                 Vfront    3 Vsync   3 Vback   24 Vpol P
    DTD 5:   720x480    59.940060 Hz   3:2     31.469 kHz     27.000000 MHz (16 mm x 9 mm)
                 Hfront   16 Hsync  62 Hback   60 Hpol N
                 Vfront    9 Vsync   6 Vback   30 Vpol N
Checksum: 0xb9  Unused space in Extension Block: 27 bytes

----------------

Block 2, Unknown EDID Extension Block 0x00:
  00 ff ff ff ff ff ff 00 21 57 36 18 bd e9 02 00 '........!W6.....'
  25 1d 01 03 80 35 1d 78 62 ee 91 a3 54 4c 99 26 '%....5.xb...TL.&'
  0f 50 54 21 0f 00 81 00 81 40 81 80 90 40 95 00 '.PT!.....@...@..'
  01 01 a9 40 b3 00 02 3a 80 18 71 38 2d 40 58 2c '...@...:..q8-@X,'
  55 00 e0 0e 11 00 00 5f 0e 1f 00 80 51 00 1e 30 'U......_....Q..0'
  40 80 37 00 0f 48 42 00 00 1c 00 00 00 fd 00 17 '@.7..HB.........'
  55 1e 64 1e 00 0a 20 20 20 20 20 20 00 00 00 fc 'U.d...      ....'
  00 4d 41 43 52 4f 53 49 4c 49 43 4f 4e 0a 01 86 '.MACROSILICON...'
Checksum: 0x86

----------------

Block 3, CTA-861 Extension Block:
  Revision: 3
  Underscans IT Video Formats by default
  Basic audio support
  Supports YCbCr 4:4:4
  Supports YCbCr 4:2:2
  Native detailed modes: 1
  Video Data Block:
    VIC   2:   720x480    59.940060 Hz   4:3     31.469 kHz     27.000000 MHz
    VIC  17:   720x576    50.000000 Hz   4:3     31.250 kHz     27.000000 MHz
    VIC  19:  1280x720    50.000000 Hz  16:9     37.500 kHz     74.250000 MHz
    VIC   4:  1280x720    60.000000 Hz  16:9     45.000 kHz     74.250000 MHz (native)
    VIC  31:  1920x1080   50.000000 Hz  16:9     56.250 kHz    148.500000 MHz
    VIC  16:  1920x1080   60.000000 Hz  16:9     67.500 kHz    148.500000 MHz
    VIC   3:   720x480    59.940060 Hz  16:9     31.469 kHz     27.000000 MHz
    VIC  18:   720x576    50.000000 Hz  16:9     31.250 kHz     27.000000 MHz
    VIC   6:  1440x480i   59.940060 Hz   4:3     15.734 kHz     27.000000 MHz
    VIC  21:  1440x576i   50.000000 Hz   4:3     15.625 kHz     27.000000 MHz
    VIC   7:  1440x480i   59.940060 Hz  16:9     15.734 kHz     27.000000 MHz
    VIC  22:  1440x576i   50.000000 Hz  16:9     15.625 kHz     27.000000 MHz
    VIC   5:  1920x1080i  60.000000 Hz  16:9     33.750 kHz     74.250000 MHz
    VIC  20:  1920x1080i  50.000000 Hz  16:9     28.125 kHz     74.250000 MHz
    VIC  94:  3840x2160   25.000000 Hz  16:9     56.250 kHz    297.000000 MHz
    VIC  95:  3840x2160   30.000000 Hz  16:9     67.500 kHz    297.000000 MHz
    VIC  99:  4096x2160   25.000000 Hz 256:135   56.250 kHz    297.000000 MHz
    VIC 100:  4096x2160   30.000000 Hz 256:135   67.500 kHz    297.000000 MHz
  Audio Data Block:
    Linear PCM:
      Max channels: 2
      Supported sample rates (kHz): 192 176.4 96 88.2 48 44.1 32
      Supported sample sizes (bits): 24 20 16
  Speaker Allocation Data Block:
    FL/FR - Front Left/Right
    LFE1 - Low Frequency Effects 1
    FC - Front Center
    LS/RS - Left/Right Surround
    BC - Back Center
    FLc/FRc - Front Left/Right of Center
    BL/BR - Back Left/Right
  Vendor-Specific Data Block (HDMI), OUI 00-0C-03:
    Source physical address: 1.0.0.0
    Maximum TMDS clock: 300 MHz
    Extended HDMI video details:
      HDMI VICs:
        HDMI VIC 1:  3840x2160   30.000000 Hz  16:9     67.500 kHz    297.000000 MHz
        HDMI VIC 2:  3840x2160   25.000000 Hz  16:9     56.250 kHz    297.000000 MHz
        HDMI VIC 3:  3840x2160   24.000000 Hz  16:9     54.000 kHz    297.000000 MHz
        HDMI VIC 4:  4096x2160   24.000000 Hz 256:135   54.000 kHz    297.000000 MHz
  Detailed Timing Descriptors:
    DTD 6:  1360x768    60.015162 Hz  85:48    47.712 kHz     85.500000 MHz (1039 mm x 584 mm)
                 Hfront   64 Hsync 112 Hback  256 Hpol P
                 Vfront    3 Vsync   6 Vback   18 Vpol P
    DTD 7:  1366x768    59.789541 Hz 683:384   47.712 kHz     85.500000 MHz (1039 mm x 584 mm)
                 Hfront   70 Hsync 143 Hback  213 Hpol P
                 Vfront    3 Vsync   3 Vback   24 Vpol P
    DTD 8:   720x480    59.940060 Hz   3:2     31.469 kHz     27.000000 MHz (16 mm x 9 mm)
                 Hfront   16 Hsync  62 Hback   60 Hpol N
                 Vfront    9 Vsync   6 Vback   30 Vpol N
Checksum: 0xb9  Unused space in Extension Block: 27 bytes

----------------

Warnings:

Block 0, Base EDID:
  Detailed Timing Descriptor #1: DTD is similar but not identical to VIC 16.
  Detailed Timing Descriptor #2: Image size is 1039x584 mm, but based on the picture AR it should be 1039x623 mm.
Block 1, CTA-861 Extension Block:
  Video Data Block: VIC 2 and the first DTD are not identical. Is this intended?
  Detailed Timing Descriptor #5: Dubious image size (16x9 mm is smaller than 100x100 mm).
Block 3, CTA-861 Extension Block:
  Detailed Timing Descriptor #8: Dubious image size (16x9 mm is smaller than 100x100 mm).
EDID:
  Base EDID: Some timings are out of range of the Monitor Ranges:
    Horizontal Freq: 15.625 - 79.976 kHz (Monitor: 30.000 - 100.000 kHz)

Failures:

Block 0, Base EDID:
  Basic Display Parameters & Features: The chromaticities match sRGB, but sRGB is not signaled.
  Detailed Timing Descriptor #1: Mismatch of image size 480x270 mm vs display size 530x290 mm.
  Detailed Timing Descriptor #2: Mismatch of image size 1039x584 mm vs display size 530x290 mm.
Block 1, CTA-861 Extension Block:
  Vendor-Specific Data Block (HDMI), OUI 00-0C-03: HDMI VIC Codes must have their CTA-861 VIC equivalents in the VSB.
  Detailed Timing Descriptor #3: Mismatch of image size 1039x584 mm vs display size 530x290 mm.
  Detailed Timing Descriptor #4: Mismatch of image size 1039x584 mm vs display size 530x290 mm.
  Detailed Timing Descriptor #5: Mismatch of image size 16x9 mm vs display size 530x290 mm.
  Missing VCDB, needed for Set Selectable RGB Quantization to avoid interop issues.
Block 2, Base EDID:
  Unknown Extension Block.
Block 3, CTA-861 Extension Block:
  Video Data Block: Duplicate VIC 2.
  Video Data Block: Duplicate VIC 17.
  Video Data Block: Duplicate VIC 19.
  Video Data Block: Duplicate VIC 4.
  Video Data Block: Duplicate VIC 31.
  Video Data Block: Duplicate VIC 16.
  Video Data Block: Duplicate VIC 3.
  Video Data Block: Duplicate VIC 18.
  Video Data Block: Duplicate VIC 6.
  Video Data Block: Duplicate VIC 21.
  Video Data Block: Duplicate VIC 7.
  Video Data Block: Duplicate VIC 22.
  Video Data Block: Duplicate VIC 5.
  Video Data Block: Duplicate VIC 20.
  Video Data Block: Duplicate VIC 94.
  Video Data Block: Duplicate VIC 95.
  Video Data Block: Duplicate VIC 99.
  Video Data Block: Duplicate VIC 100.
  Speaker Allocation Data Block: Only one instance of this Data Block is allowed.
  Vendor-Specific Data Block (HDMI), OUI 00-0C-03: HDMI VIC Codes must have their CTA-861 VIC equivalents in the VSB.
  Detailed Timing Descriptor #6: Mismatch of image size 1039x584 mm vs display size 530x290 mm.
  Detailed Timing Descriptor #7: Mismatch of image size 1039x584 mm vs display size 530x290 mm.
  Detailed Timing Descriptor #8: Mismatch of image size 16x9 mm vs display size 530x290 mm.
EDID:
  Base EDID: The DTD max image size is 1039x584mm, which is larger than the display size 530.0x290.0mm.
  Base EDID: EDID specified 1 extension block(s), but found 3 extension block(s).
  Base EDID: EDID 1.3 requires a Block Map Extension in Block 1 if there are more than 2 blocks in the EDID.
  CTA-861: Native progressive timings are a mix of several resolutions.

EDID conformity: FAIL
