edid-decode (hex):

00 ff ff ff ff ff ff 00 16 c5 01 10 00 00 00 00
01 1a 01 03 81 16 0e 00 e7 00 00 00 00 00 00 00
00 00 00 00 00 00 01 00 01 00 01 00 01 00 01 00
01 00 01 00 01 00 20 1c 00 a0 50 20 17 30 50 1e
a3 00 d9 88 00 00 00 1e 00 00 00 ff 00 56 47 47
31 32 38 30 5f 48 44 4d 49 0a 00 00 00 10 00 00
00 00 00 00 00 00 00 00 00 00 00 00 00 00 00 00
00 00 00 00 00 00 00 00 00 00 00 00 00 00 00 fb

00 ff ff ff ff ff ff 00 16 c5 01 10 00 00 00 00
01 1a 01 03 81 16 0e 00 e7 00 00 00 00 00 00 00
00 00 00 00 00 00 01 00 01 00 01 00 01 00 01 00
01 00 01 00 01 00 20 1c 00 a0 50 20 17 30 50 1e
a3 00 d9 88 00 00 00 1e 00 00 00 ff 00 56 47 47
31 32 38 30 5f 48 44 4d 49 0a 00 00 00 10 00 00
00 00 00 00 00 00 00 00 00 00 00 00 00 00 00 00
00 00 00 00 00 00 00 00 00 00 00 00 00 00 00 fb

----------------

Block 0, Base EDID:
  EDID Structure Version & Revision: 1.3
  Vendor & Product Identification:
    Manufacturer: EVE
    Model: 4097
    Made in: week 1 of 2016
  Basic Display Parameters & Features:
    Digital display
    DFP 1.x compatible TMDS
    Maximum image size: 22 cm x 14 cm
    Gamma: 1.00
    DPMS levels: Standby Suspend Off
    Monochrome or grayscale display
    Default (sRGB) color space is primary color space
    First detailed timing is the preferred timing
    Supports GTF timings within operating range
  Color Characteristics:
    Red  : 0.0000, 0.0000
    Green: 0.0000, 0.0000
    Blue : 0.0000, 0.0000
    White: 0.0000, 0.0000
  Established Timings I & II: none
  Standard Timings:
  Detailed Timing Descriptors:
    DTD 1:  1280x800    60.753341 Hz  16:10    50.000 kHz     72.000000 MHz (217 mm x 136 mm)
                 Hfront   80 Hsync  30 Hback   50 Hpol P
                 Vfront   10 Vsync   3 Vback   10 Vpol P
    Display Product Serial Number: ...
    Dummy Descriptor:
    Empty Descriptor
Checksum: 0xfb

----------------

Warnings:

Block 0, Base EDID:
  Basic Display Parameters & Features: sRGB is signaled, but the gamma != 2.2.

Failures:

Block 0, Base EDID:
  Basic Display Parameters & Features: sRGB is signaled, but the chromaticities do not match.
  Standard Timings: Use 0x0101 as the invalid Standard Timings code, not 0x0100.
  Standard Timings: Use 0x0101 as the invalid Standard Timings code, not 0x0100.
  Standard Timings: Use 0x0101 as the invalid Standard Timings code, not 0x0100.
  Standard Timings: Use 0x0101 as the invalid Standard Timings code, not 0x0100.
  Standard Timings: Use 0x0101 as the invalid Standard Timings code, not 0x0100.
  Standard Timings: Use 0x0101 as the invalid Standard Timings code, not 0x0100.
  Standard Timings: Use 0x0101 as the invalid Standard Timings code, not 0x0100.
  Standard Timings: Use 0x0101 as the invalid Standard Timings code, not 0x0100.
  Empty Descriptor: Use Dummy Descriptor instead of all zeroes.
  Missing Display Product Name.
  Missing Display Range Limits Descriptor.
EDID:
  Extension Block 1 started with EDID header, ignoring Extension Blocks >= 1.

EDID conformity: FAIL
