edid-decode (hex):

00 ff ff ff ff ff ff 00 21 63 36 27 00 00 00 00
34 20 01 04 b5 3c 21 78 3b af 95 ae 50 41 ad 26
0d 50 54 af cf 00 81 bc 81 80 95 00 b3 00 95 3c
d1 c0 b3 3c d1 fc 56 5e 00 a0 a0 a0 29 50 30 20
35 00 55 50 21 00 00 1c 00 00 00 ff 00 30 30 30
30 30 30 30 30 30 30 30 30 31 00 00 00 fd 0c 30
aa fa fa 46 01 0a 20 20 20 20 20 20 00 00 00 fc
00 32 37 45 33 51 0a 20 20 20 20 20 20 20 02 f8

02 03 32 f4 49 90 01 02 12 13 13 04 3f 30 23 09
07 07 83 01 00 00 e6 06 07 01 60 5b 00 e2 00 c0
e3 05 e3 01 6d 1a 00 00 02 01 30 aa 00 00 00 00
00 00 6f c2 00 a0 a0 a0 55 50 30 20 35 00 55 50
21 00 00 1e 40 e7 00 6a a0 a0 67 50 30 20 35 00
55 50 21 00 00 1a a6 fe 00 92 a0 a0 14 50 30 40
35 00 55 50 21 00 00 1e 00 00 00 00 00 00 00 00
00 00 00 00 00 00 00 00 00 00 00 00 00 00 00 a0

70 12 79 00 00 03 00 14 12 08 01 84 ff 09 9f 00
37 00 27 00 9f 05 15 00 02 00 09 00 00 00 00 00
00 00 00 00 00 00 00 00 00 00 00 00 00 00 00 00
00 00 00 00 00 00 00 00 00 00 00 00 00 00 00 00
00 00 00 00 00 00 00 00 00 00 00 00 00 00 00 00
00 00 00 00 00 00 00 00 00 00 00 00 00 00 00 00
00 00 00 00 00 00 00 00 00 00 00 00 00 00 00 00
00 00 00 00 00 00 00 00 00 00 00 00 00 00 f6 90

00 ff ff ff ff ff ff 00 21 63 36 27 00 00 00 00
34 20 01 04 b5 3c 21 78 3b af 95 ae 50 41 ad 26
0d 50 54 af cf 00 81 bc 81 80 95 00 b3 00 95 3c
d1 c0 b3 3c d1 fc 56 5e 00 a0 a0 a0 29 50 30 20
35 00 55 50 21 00 00 1c 00 00 00 ff 00 30 30 30
30 30 30 30 30 30 30 30 30 31 00 00 00 fd 0c 30
aa fa fa 46 01 0a 20 20 20 20 20 20 00 00 00 fc
00 32 37 45 33 51 0a 20 20 20 20 20 20 20 02 f8

02 03 32 f4 49 90 01 02 12 13 13 04 3f 30 23 09
07 07 83 01 00 00 e6 06 07 01 60 5b 00 e2 00 c0
e3 05 e3 01 6d 1a 00 00 02 01 30 aa 00 00 00 00
00 00 6f c2 00 a0 a0 a0 55 50 30 20 35 00 55 50
21 00 00 1e 40 e7 00 6a a0 a0 67 50 30 20 35 00
55 50 21 00 00 1a a6 fe 00 92 a0 a0 14 50 30 40
35 00 55 50 21 00 00 1e 00 00 00 00 00 00 00 00
00 00 00 00 00 00 00 00 00 00 00 00 00 00 00 a0

70 12 79 00 00 03 00 14 12 08 01 84 ff 09 9f 00
37 00 27 00 9f 05 15 00 02 00 09 00 00 00 00 00
00 00 00 00 00 00 00 00 00 00 00 00 00 00 00 00
00 00 00 00 00 00 00 00 00 00 00 00 00 00 00 00
00 00 00 00 00 00 00 00 00 00 00 00 00 00 00 00
00 00 00 00 00 00 00 00 00 00 00 00 00 00 00 00
00 00 00 00 00 00 00 00 00 00 00 00 00 00 00 00
00 00 00 00 00 00 00 00 00 00 00 00 00 00 f6 90

----------------

Block 0, Base EDID:
  EDID Structure Version & Revision: 1.4
  Vendor & Product Identification:
    Manufacturer: HKC
    Model: 10038
    Made in: week 52 of 2022
  Basic Display Parameters & Features:
    Digital display
    Bits per primary color channel: 10
    DisplayPort interface
    Maximum image size: 60 cm x 33 cm
    Gamma: 2.20
    DPMS levels: Off
    Supported color formats: RGB 4:4:4, YCrCb 4:4:4, YCrCb 4:2:2
    First detailed timing includes the native pixel format and preferred refresh rate
    Display supports continuous frequencies
  Color Characteristics:
    Red  : 0.6816, 0.3144
    Green: 0.2568, 0.6787
    Blue : 0.1503, 0.0517
    White: 0.3134, 0.3291
  Established Timings I & II:
    IBM     :   720x400    70.081663 Hz   9:5     31.467 kHz     28.320000 MHz
    DMT 0x04:   640x480    59.940476 Hz   4:3     31.469 kHz     25.175000 MHz
    DMT 0x05:   640x480    72.808802 Hz   4:3     37.861 kHz     31.500000 MHz
    DMT 0x06:   640x480    75.000000 Hz   4:3     37.500 kHz     31.500000 MHz
    DMT 0x08:   800x600    56.250000 Hz   4:3     35.156 kHz     36.000000 MHz
    DMT 0x09:   800x600    60.316541 Hz   4:3     37.879 kHz     40.000000 MHz
    DMT 0x0a:   800x600    72.187572 Hz   4:3     48.077 kHz     50.000000 MHz
    DMT 0x0b:   800x600    75.000000 Hz   4:3     46.875 kHz     49.500000 MHz
    DMT 0x10:  1024x768    60.003840 Hz   4:3     48.363 kHz     65.000000 MHz
    DMT 0x11:  1024x768    70.069359 Hz   4:3     56.476 kHz     75.000000 MHz
    DMT 0x12:  1024x768    75.028582 Hz   4:3     60.023 kHz     78.750000 MHz
    DMT 0x24:  1280x1024   75.024675 Hz   5:4     79.976 kHz    135.000000 MHz
  Standard Timings:
    GTF     :  1280x1024  120.000185 Hz   5:4    131.640 kHz    233.793000 MHz
    DMT 0x23:  1280x1024   60.019740 Hz   5:4     63.981 kHz    108.000000 MHz
    DMT 0x2f:  1440x900    59.887445 Hz  16:10    55.935 kHz    106.500000 MHz
    DMT 0x3a:  1680x1050   59.954250 Hz  16:10    65.290 kHz    146.250000 MHz
    GTF     :  1440x900   119.999896 Hz  16:10   115.800 kHz    229.747000 MHz
    DMT 0x52:  1920x1080   60.000000 Hz  16:9     67.500 kHz    148.500000 MHz
    GTF     :  1680x1050  120.000000 Hz  16:10   135.000 kHz    313.200000 MHz
    GTF     :  1920x1080  119.999987 Hz  16:9    138.840 kHz    368.759000 MHz
  Detailed Timing Descriptors:
    DTD 1:  2560x1440   59.950550 Hz  16:9     88.787 kHz    241.500000 MHz (597 mm x 336 mm)
                 Hfront   48 Hsync  32 Hback   80 Hpol N
                 Vfront    3 Vsync   5 Vback   33 Vpol P
    Display Product Serial Number: ...
    Display Range Limits:
      Monitor ranges (Range Limits Only): 48-170 Hz V, 505-505 kHz H, max dotclock 700 MHz
    Display Product Name: '27E3Q'
  Extension blocks: 2
Checksum: 0xf8

----------------

Block 1, CTA-861 Extension Block:
  Revision: 3
  Underscans IT Video Formats by default
  Basic audio support
  Supports YCbCr 4:4:4
  Supports YCbCr 4:2:2
  Native DTDs: 4
  Video Data Block:
    VIC  16:  1920x1080   60.000000 Hz  16:9     67.500 kHz    148.500000 MHz (native)
    VIC   1:   640x480    59.940476 Hz   4:3     31.469 kHz     25.175000 MHz
    VIC   2:   720x480    59.940060 Hz   4:3     31.469 kHz     27.000000 MHz
    VIC  18:   720x576    50.000000 Hz  16:9     31.250 kHz     27.000000 MHz
    VIC  19:  1280x720    50.000000 Hz  16:9     37.500 kHz     74.250000 MHz
    VIC  19:  1280x720    50.000000 Hz  16:9     37.500 kHz     74.250000 MHz
    VIC   4:  1280x720    60.000000 Hz  16:9     45.000 kHz     74.250000 MHz
    VIC  63:  1920x1080  120.000000 Hz  16:9    135.000 kHz    297.000000 MHz
    VIC  48:   720x480   119.880120 Hz   4:3     62.937 kHz     54.000000 MHz
  Audio Data Block:
    Linear PCM:
      Max channels: 2
      Supported sample rates (kHz): 48 44.1 32
      Supported sample sizes (bits): 24 20 16
  Speaker Allocation Data Block:
    FL/FR - Front Left/Right
  HDR Static Metadata Data Block:
    Electro optical transfer functions:
      Traditional gamma - SDR luminance range
      Traditional gamma - HDR luminance range
      SMPTE ST2084
    Supported static metadata descriptors:
      Static metadata type 1
    Desired content max luminance: 96 (400.000 cd/m^2)
    Desired content max frame-average luminance: 91 (358.942 cd/m^2)
    Desired content min luminance: 0 (0.000 cd/m^2)
  Video Capability Data Block:
    YCbCr quantization: Selectable (via AVI YQ)
    RGB quantization: Selectable (via AVI Q)
    PT scan behavior: No Data
    IT scan behavior: IT video formats not supported
    CE scan behavior: CE video formats not supported
  Colorimetry Data Block:
    xvYCC601
    xvYCC709
    BT2020cYCC
    BT2020YCC
    BT2020RGB
    Gamut Boundary Description Metadata Profile P0
  Vendor-Specific Data Block (AMD), OUI 00-00-1A:
    Version: 2
    Feature Caps: 0x01
    Minimum Refresh Rate: 48 Hz
    Maximum Refresh Rate: 170 Hz
    Flags 1.x: 0x00
    Flags 2.x: 0x00
  Detailed Timing Descriptors:
    DTD 2:  2560x1440  119.997589 Hz  16:9    182.996 kHz    497.750000 MHz (597 mm x 336 mm)
                 Hfront   48 Hsync  32 Hback   80 Hpol P
                 Vfront    3 Vsync   5 Vback   77 Vpol P
    DTD 3:  2560x1440  143.911545 Hz  16:9    222.056 kHz    592.000000 MHz (597 mm x 336 mm)
                 Hfront   48 Hsync  32 Hback   26 Hpol P
                 Vfront    3 Vsync   5 Vback   95 Vpol N
    DTD 4:  2560x1440  165.006227 Hz  16:9    240.909 kHz    651.900000 MHz (597 mm x 336 mm)
                 Hfront   48 Hsync  64 Hback   34 Hpol P
                 Vfront    3 Vsync   5 Vback   12 Vpol P
Checksum: 0xa0  Unused space in Extension Block: 23 bytes

----------------

Block 2, DisplayID Extension Block:
  Version: 1.2
  Extension Count: 0
  Display Product Type: Extension Section
  Video Timing Modes Type 1 - Detailed Timings Data Block:
    DTD:  2560x1440  170.000302 Hz  16:9    248.540 kHz    676.030000 MHz (aspect 16:9, no 3D stereo, preferred)
               Hfront   56 Hsync  40 Hback   64 Hpol N
               Vfront    3 Vsync  10 Vback    9 Vpol N
  Checksum: 0xf6
Checksum: 0x90

----------------

Warnings:

Block 0, Base EDID:
  Display Product Serial Number: ...
Block 1, CTA-861 Extension Block:
  Video Data Block: VIC 16 and the first DTD are not identical. Is this intended?
  Video Capability Data Block: IT scan behavior is expected to support underscanned.
  Video Capability Data Block: 'CE video formats not supported' makes no sense.
  Colorimetry Data Block: Set the sRGB colorimetry bit to avoid interop issues.
EDID:
  Base EDID: Some timings are out of range of the Monitor Ranges:
    Horizontal Freq: 31.250 - 248.540 kHz (Monitor: 505.000 - 505.000 kHz)

Failures:

Block 1, CTA-861 Extension Block:
  Video Data Block: Duplicate VIC 19.
Block 2, DisplayID Extension Block:
  DisplayID Base Block has no product type.
EDID:
  Extension Block 3 started with EDID header, ignoring Extension Blocks >= 3.
  CTA-861: Native progressive timings are a mix of several resolutions.

EDID conformity: FAIL
