edid-decode (hex):

00 ff ff ff ff ff ff 00 2c ee 8c 0a 00 00 00 00
02 1f 01 03 80 3c 22 78 2e 6b 35 a4 55 55 9f 27
0c 50 54 ad 4f 00 d1 c0 81 00 81 c0 81 80 a9 c0
b3 00 01 01 01 01 71 60 00 c8 a0 a0 33 50 30 20
25 00 54 4f 21 00 00 1e 00 00 00 ff 00 30 31 32
33 34 35 36 37 38 39 0a 20 20 00 00 00 fd 00 3b
4c 1e 5f 19 00 0a 20 20 20 20 20 20 00 00 00 fc
00 4b 41 4d 4e 32 37 51 46 53 41 0a 20 20 00 eb

00 ff ff ff ff ff ff 00 2c ee 8c 0a 00 00 00 00
02 1f 01 03 80 3c 22 78 2e 6b 35 a4 55 55 9f 27
0c 50 54 ad 4f 00 d1 c0 81 00 81 c0 81 80 a9 c0
b3 00 01 01 01 01 71 60 00 c8 a0 a0 33 50 30 20
25 00 54 4f 21 00 00 1e 00 00 00 ff 00 30 31 32
33 34 35 36 37 38 39 0a 20 20 00 00 00 fd 00 3b
4c 1e 5f 19 00 0a 20 20 20 20 20 20 00 00 00 fc
00 4b 41 4d 4e 32 37 51 46 53 41 0a 20 20 00 eb

----------------

Block 0, Base EDID:
  EDID Structure Version & Revision: 1.3
  Vendor & Product Identification:
    Manufacturer: KGN
    Model: 2700
    Made in: week 2 of 2021
  Basic Display Parameters & Features:
    Digital display
    Maximum image size: 60 cm x 34 cm
    Gamma: 2.20
    DPMS levels: Off
    RGB color display
    Default (sRGB) color space is primary color space
    First detailed timing is the preferred timing
  Color Characteristics:
    Red  : 0.6416, 0.3339
    Green: 0.3339, 0.6240
    Blue : 0.1523, 0.0498
    White: 0.3134, 0.3291
  Established Timings I & II:
    IBM     :   720x400    70.081663 Hz   9:5     31.467 kHz     28.320000 MHz
    DMT 0x04:   640x480    59.940476 Hz   4:3     31.469 kHz     25.175000 MHz
    DMT 0x05:   640x480    72.808802 Hz   4:3     37.861 kHz     31.500000 MHz
    DMT 0x06:   640x480    75.000000 Hz   4:3     37.500 kHz     31.500000 MHz
    DMT 0x09:   800x600    60.316541 Hz   4:3     37.879 kHz     40.000000 MHz
    DMT 0x0b:   800x600    75.000000 Hz   4:3     46.875 kHz     49.500000 MHz
    DMT 0x10:  1024x768    60.003840 Hz   4:3     48.363 kHz     65.000000 MHz
    DMT 0x11:  1024x768    70.069359 Hz   4:3     56.476 kHz     75.000000 MHz
    DMT 0x12:  1024x768    75.028582 Hz   4:3     60.023 kHz     78.750000 MHz
    DMT 0x24:  1280x1024   75.024675 Hz   5:4     79.976 kHz    135.000000 MHz
  Standard Timings:
    DMT 0x52:  1920x1080   60.000000 Hz  16:9     67.500 kHz    148.500000 MHz
    DMT 0x1c:  1280x800    59.810326 Hz  16:10    49.702 kHz     83.500000 MHz
    DMT 0x55:  1280x720    60.000000 Hz  16:9     45.000 kHz     74.250000 MHz
    DMT 0x23:  1280x1024   60.019740 Hz   5:4     63.981 kHz    108.000000 MHz
    DMT 0x53:  1600x900    60.000000 Hz  16:9     60.000 kHz    108.000000 MHz (RB)
    DMT 0x3a:  1680x1050   59.954250 Hz  16:10    65.290 kHz    146.250000 MHz
  Detailed Timing Descriptors:
    DTD 1:  2560x1440   59.995237 Hz  16:9     89.453 kHz    246.890000 MHz (596 mm x 335 mm)
                 Hfront   48 Hsync  32 Hback  120 Hpol P
                 Vfront    2 Vsync   5 Vback   44 Vpol P
    Display Product Serial Number: ...
    Display Range Limits:
      Monitor ranges (GTF): 59-76 Hz V, 30-95 kHz H, max dotclock 250 MHz
    Display Product Name: 'KAMN27QFSA'
Checksum: 0xeb

----------------

Failures:

Block 0, Base EDID:
  Basic Display Parameters & Features: sRGB is signaled, but the chromaticities do not match.
EDID:
  Extension Block 1 started with EDID header, ignoring Extension Blocks >= 1.

EDID conformity: FAIL
