edid-decode (hex):

00 ff ff ff ff ff ff 00 08 f4 10 09 00 00 00 00
1c 11 01 04 0e 30 1e 78 e8 2c 9d a6 58 4a 9a 26
21 52 56 bf ef 80 81 80 71 4f 95 0f 81 c0 01 01
01 01 01 01 01 01 a0 28 a0 98 51 84 2a 30 30 70
13 00 e0 2c 11 00 00 06 dc 1e 00 98 51 00 63 30
30 70 52 08 7c 2c 11 00 00 00 00 00 00 fd 00 32
4b 19 50 0e 00 0a 20 20 20 20 20 20 00 00 00 fc
00 41 6e 61 6c 6f 67 0a 20 20 20 20 20 20 00 8c

----------------

Block 0, Base EDID:
  EDID Structure Version & Revision: 1.4
  Vendor & Product Identification:
    Manufacturer: BGT
    Model: 2320
    Made in: week 28 of 2007
  Basic Display Parameters & Features:
    Analog display
    Signal Level Standard: 0.700 : 0.300 : 1.000 V p-p
    Blank level equals black level
    Sync: Separate Composite SyncOnGreen
    Maximum image size: 48 cm x 30 cm
    Gamma: 2.20
    DPMS levels: Standby Suspend Off
    RGB color display
    First detailed timing does not include the native pixel format and preferred refresh rate
  Color Characteristics:
    Red  : 0.6484, 0.3457
    Green: 0.2919, 0.6015
    Blue : 0.1503, 0.1298
    White: 0.3232, 0.3369
  Established Timings I & II:
    IBM     :   720x400    70.081663 Hz   9:5     31.467 kHz     28.320000 MHz
    DMT 0x04:   640x480    59.940476 Hz   4:3     31.469 kHz     25.175000 MHz
    Apple   :   640x480    66.666667 Hz   4:3     35.000 kHz     30.240000 MHz
    DMT 0x05:   640x480    72.808802 Hz   4:3     37.861 kHz     31.500000 MHz
    DMT 0x06:   640x480    75.000000 Hz   4:3     37.500 kHz     31.500000 MHz
    DMT 0x08:   800x600    56.250000 Hz   4:3     35.156 kHz     36.000000 MHz
    DMT 0x09:   800x600    60.316541 Hz   4:3     37.879 kHz     40.000000 MHz
    DMT 0x0a:   800x600    72.187572 Hz   4:3     48.077 kHz     50.000000 MHz
    DMT 0x0b:   800x600    75.000000 Hz   4:3     46.875 kHz     49.500000 MHz
    Apple   :   832x624    74.551266 Hz   4:3     49.726 kHz     57.284000 MHz
    DMT 0x10:  1024x768    60.003840 Hz   4:3     48.363 kHz     65.000000 MHz
    DMT 0x11:  1024x768    70.069359 Hz   4:3     56.476 kHz     75.000000 MHz
    DMT 0x12:  1024x768    75.028582 Hz   4:3     60.023 kHz     78.750000 MHz
    DMT 0x24:  1280x1024   75.024675 Hz   5:4     79.976 kHz    135.000000 MHz
    Apple   :  1152x870    75.061550 Hz 192:145   68.681 kHz    100.000000 MHz
  Standard Timings:
    DMT 0x23:  1280x1024   60.019740 Hz   5:4     63.981 kHz    108.000000 MHz
    DMT 0x15:  1152x864    75.000000 Hz   4:3     67.500 kHz    108.000000 MHz
    DMT 0x30:  1440x900    74.984427 Hz  16:10    70.635 kHz    136.750000 MHz
    DMT 0x55:  1280x720    60.000000 Hz  16:9     45.000 kHz     74.250000 MHz
  Detailed Timing Descriptors:
    DTD 1:  1440x900    59.742098 Hz  16:10    56.277 kHz    104.000000 MHz (analog composite, serrate, 480 mm x 300 mm)
                 Hfront   48 Hsync 112 Hback  248 Hpol N
                 Vfront    1 Vsync   3 Vback   38 Vpol N
    DTD 2:  1280x768    53.980332 Hz   5:3     46.801 kHz     79.000000 MHz (analog composite, sync-on-green, 380 mm x 300 mm)
                 Hfront   48 Hsync 112 Hback  248 Hpol N
                 Vfront   37 Vsync   2 Vback   60 Vpol N
    Display Range Limits:
      Monitor ranges (GTF): 50-75 Hz V, 25-80 kHz H, max dotclock 140 MHz
    Display Product Name: 'Analog'
Checksum: 0x8c

----------------

Warnings:

Block 0, Base EDID:
  Detailed Timing Descriptor #2: Image size is 380x300 mm, but based on the picture AR it should be 380x228 mm.
  Display Range Limits: GTF support is deprecated in EDID 1.4.

Failures:

Block 0, Base EDID:
  Display Range Limits: GTF is supported, but the display does not support continuous frequencies.

EDID conformity: FAIL
