edid-decode (hex):

00 ff ff ff ff ff ff 00 34 a4 1b 36 00 00 00 00
1b 19 01 03 a0 3b 21 78 2a 4e c0 a6 55 50 9c 26
11 50 54 af cf 00 81 00 81 80 81 40 81 c0 01 01
01 01 71 40 01 40 02 3a 80 18 71 38 2d 40 58 2c
45 00 55 50 21 00 00 1e 8c 0a d0 8a 20 e0 2d 10
10 3e 96 00 98 ff 10 00 00 1c 66 21 56 aa 51 00
1e 30 46 8f 33 00 9a 9a 11 00 00 1c 00 00 00 fc
00 4d 44 32 30 35 38 31 0a 20 20 20 20 20 00 0e

00 ff ff ff ff ff ff 00 34 a4 1b 36 00 00 00 00
1b 19 01 03 a0 3b 21 78 2a 4e c0 a6 55 50 9c 26
11 50 54 af cf 00 81 00 81 80 81 40 81 c0 01 01
01 01 71 40 01 40 02 3a 80 18 71 38 2d 40 58 2c
45 00 55 50 21 00 00 1e 8c 0a d0 8a 20 e0 2d 10
10 3e 96 00 98 ff 10 00 00 1c 66 21 56 aa 51 00
1e 30 46 8f 33 00 9a 9a 11 00 00 1c 00 00 00 fc
00 4d 44 32 30 35 38 31 0a 20 20 20 20 20 00 0e

----------------

Block 0, Base EDID:
  EDID Structure Version & Revision: 1.3
  Vendor & Product Identification:
    Manufacturer: MED
    Model: 13851
    Made in: week 27 of 2015
  Basic Display Parameters & Features:
    Digital display
    Maximum image size: 59 cm x 33 cm
    Gamma: 2.20
    DPMS levels: Off
    RGB color display
    First detailed timing is the preferred timing
  Color Characteristics:
    Red  : 0.6494, 0.3320
    Green: 0.3154, 0.6113
    Blue : 0.1513, 0.0664
    White: 0.3125, 0.3281
  Established Timings I & II:
    IBM     :   720x400    70.081663 Hz   9:5     31.467 kHz     28.320000 MHz
    DMT 0x04:   640x480    59.940476 Hz   4:3     31.469 kHz     25.175000 MHz
    DMT 0x05:   640x480    72.808802 Hz   4:3     37.861 kHz     31.500000 MHz
    DMT 0x06:   640x480    75.000000 Hz   4:3     37.500 kHz     31.500000 MHz
    DMT 0x08:   800x600    56.250000 Hz   4:3     35.156 kHz     36.000000 MHz
    DMT 0x09:   800x600    60.316541 Hz   4:3     37.879 kHz     40.000000 MHz
    DMT 0x0a:   800x600    72.187572 Hz   4:3     48.077 kHz     50.000000 MHz
    DMT 0x0b:   800x600    75.000000 Hz   4:3     46.875 kHz     49.500000 MHz
    DMT 0x10:  1024x768    60.003840 Hz   4:3     48.363 kHz     65.000000 MHz
    DMT 0x11:  1024x768    70.069359 Hz   4:3     56.476 kHz     75.000000 MHz
    DMT 0x12:  1024x768    75.028582 Hz   4:3     60.023 kHz     78.750000 MHz
    DMT 0x24:  1280x1024   75.024675 Hz   5:4     79.976 kHz    135.000000 MHz
  Standard Timings:
    DMT 0x1c:  1280x800    59.810326 Hz  16:10    49.702 kHz     83.500000 MHz
    DMT 0x23:  1280x1024   60.019740 Hz   5:4     63.981 kHz    108.000000 MHz
    DMT 0x20:  1280x960    60.000000 Hz   4:3     60.000 kHz    108.000000 MHz
    DMT 0x55:  1280x720    60.000000 Hz  16:9     45.000 kHz     74.250000 MHz
    GTF     :  1152x864    60.000000 Hz   4:3     53.700 kHz     81.624000 MHz
  Detailed Timing Descriptors:
    DTD 1:  1920x1080   60.000000 Hz  16:9     67.500 kHz    148.500000 MHz (597 mm x 336 mm)
                 Hfront   88 Hsync  44 Hback  148 Hpol P
                 Vfront    4 Vsync   5 Vback   36 Vpol P
    DTD 2:   720x480    59.940060 Hz   3:2     31.469 kHz     27.000000 MHz (408 mm x 255 mm)
                 Hfront   16 Hsync  62 Hback   60 Hpol N
                 Vfront    9 Vsync   6 Vback   30 Vpol P
    DTD 3:  1366x768    59.789541 Hz 683:384   47.712 kHz     85.500000 MHz (410 mm x 410 mm)
                 Hfront   70 Hsync 143 Hback  213 Hpol N
                 Vfront    3 Vsync   3 Vback   24 Vpol P
    Display Product Name: 'MD20581'
Checksum: 0x0e

----------------

Warnings:

Block 0, Base EDID:
  Detailed Timing Descriptor #2: DTD is similar but not identical to VIC 2.
  Detailed Timing Descriptor #2: Image size is 408x255 mm, but based on the picture AR it should be 382x255 mm.
  Detailed Timing Descriptor #3: DTD is similar but not identical to DMT 0x51.
  Detailed Timing Descriptor #3: Image size is 410x410 mm, but based on the picture AR it should be 410x230 mm.

Failures:

Block 0, Base EDID:
  Basic Display Parameters & Features: Digital Video Interface Standard set to reserved value 0x20.
  Standard Timings: Use 0x0101 as the invalid Standard Timings code, not 0x0140.
  Detailed Timing Descriptor #2: Mismatch of image size 408x255 mm vs display size 590x330 mm.
  Detailed Timing Descriptor #3: Mismatch of image size 410x410 mm vs display size 590x330 mm.
  Missing Display Range Limits Descriptor.
EDID:
  Extension Block 1 started with EDID header, ignoring Extension Blocks >= 1.
  Base EDID: The DTD max image size is 597x410mm, which is larger than the display size 590.0x330.0mm.

EDID conformity: FAIL
