edid-decode (hex):

00 ff ff ff ff ff ff 00 34 ac 2f 33 00 00 00 00
0d 1b 01 03 80 58 32 78 0a 8f 9c a4 56 4c 9d 26
0f 46 4c 21 08 00 a9 c0 81 c0 81 00 81 80 81 40
01 01 01 01 01 01 02 3a 80 18 71 38 2d 40 58 2c
45 00 70 ef 31 00 00 1e 66 21 50 b0 51 00 1b 30
40 70 36 00 70 ef 31 00 00 1e 00 00 00 fd 00 17
4c 0f 50 0f 00 0a 20 20 20 20 20 20 00 00 00 fc
00 4d 45 4c 2d 54 56 28 46 48 44 29 0a 20 01 6c

02 03 21 f1 48 90 05 04 03 07 01 20 22 23 09 07
07 83 01 00 00 68 03 0c 00 20 00 80 1e 00 e2 00
4b 30 2a 40 c8 60 84 64 30 18 50 13 00 70 ef 31
00 00 1e 0e 1f 00 80 51 00 1e 30 40 80 37 00 70
ef 31 00 00 1a 01 1d 00 72 51 d0 1e 20 6e 28 55
00 70 ef 31 00 00 1e 8c 0a d0 8a 20 e0 2d 10 10
3e 96 00 70 ef 31 00 00 18 8c 0a a0 14 51 f0 16
00 26 7c 40 00 70 ef 31 00 00 98 00 00 00 00 bf

00 ff ff ff ff ff ff 00 34 ac 2f 33 00 00 00 00
0d 1b 01 03 80 58 32 78 0a 8f 9c a4 56 4c 9d 26
0f 46 4c 21 08 00 a9 c0 81 c0 81 00 81 80 81 40
01 01 01 01 01 01 02 3a 80 18 71 38 2d 40 58 2c
45 00 70 ef 31 00 00 1e 66 21 50 b0 51 00 1b 30
40 70 36 00 70 ef 31 00 00 1e 00 00 00 fd 00 17
4c 0f 50 0f 00 0a 20 20 20 20 20 20 00 00 00 fc
00 4d 45 4c 2d 54 56 28 46 48 44 29 0a 20 01 6c

02 03 21 f1 48 90 05 04 03 07 01 20 22 23 09 07
07 83 01 00 00 68 03 0c 00 20 00 80 1e 00 e2 00
4b 30 2a 40 c8 60 84 64 30 18 50 13 00 70 ef 31
00 00 1e 0e 1f 00 80 51 00 1e 30 40 80 37 00 70
ef 31 00 00 1a 01 1d 00 72 51 d0 1e 20 6e 28 55
00 70 ef 31 00 00 1e 8c 0a d0 8a 20 e0 2d 10 10
3e 96 00 70 ef 31 00 00 18 8c 0a a0 14 51 f0 16
00 26 7c 40 00 70 ef 31 00 00 98 00 00 00 00 bf

----------------

Block 0, Base EDID:
  EDID Structure Version & Revision: 1.3
  Vendor & Product Identification:
    Manufacturer: MEL
    Model: 13103
    Made in: week 13 of 2017
  Basic Display Parameters & Features:
    Digital display
    Maximum image size: 88 cm x 50 cm
    Gamma: 2.20
    RGB color display
    First detailed timing is the preferred timing
  Color Characteristics:
    Red  : 0.6425, 0.3359
    Green: 0.2998, 0.6162
    Blue : 0.1503, 0.0595
    White: 0.2763, 0.2968
  Established Timings I & II:
    DMT 0x04:   640x480    59.940476 Hz   4:3     31.469 kHz     25.175000 MHz
    DMT 0x09:   800x600    60.316541 Hz   4:3     37.879 kHz     40.000000 MHz
    DMT 0x10:  1024x768    60.003840 Hz   4:3     48.363 kHz     65.000000 MHz
  Standard Timings:
    DMT 0x53:  1600x900    60.000000 Hz  16:9     60.000 kHz    108.000000 MHz (RB)
    DMT 0x55:  1280x720    60.000000 Hz  16:9     45.000 kHz     74.250000 MHz
    DMT 0x1c:  1280x800    59.810326 Hz  16:10    49.702 kHz     83.500000 MHz
    DMT 0x23:  1280x1024   60.019740 Hz   5:4     63.981 kHz    108.000000 MHz
    DMT 0x20:  1280x960    60.000000 Hz   4:3     60.000 kHz    108.000000 MHz
  Detailed Timing Descriptors:
    DTD  1:  1920x1080   60.000000 Hz  16:9     67.500 kHz    148.500000 MHz (880 mm x 495 mm)
                  Hfront   88 Hsync  44 Hback  148 Hpol P
                  Vfront    4 Vsync   5 Vback   36 Vpol P
    DTD  2:  1360x768    60.015162 Hz  85:48    47.712 kHz     85.500000 MHz (880 mm x 495 mm)
                  Hfront   64 Hsync 112 Hback  256 Hpol P
                  Vfront    3 Vsync   6 Vback   18 Vpol P
    Display Range Limits:
      Monitor ranges (GTF): 23-76 Hz V, 15-80 kHz H, max dotclock 150 MHz
    Display Product Name: 'MEL-TV(FHD)'
  Extension blocks: 1
Checksum: 0x6c

----------------

Block 1, CTA-861 Extension Block:
  Revision: 3
  Underscans IT Video Formats by default
  Basic audio support
  Supports YCbCr 4:4:4
  Supports YCbCr 4:2:2
  Native detailed modes: 1
  Video Data Block:
    VIC  16:  1920x1080   60.000000 Hz  16:9     67.500 kHz    148.500000 MHz (native)
    VIC   5:  1920x1080i  60.000000 Hz  16:9     33.750 kHz     74.250000 MHz
    VIC   4:  1280x720    60.000000 Hz  16:9     45.000 kHz     74.250000 MHz
    VIC   3:   720x480    59.940060 Hz  16:9     31.469 kHz     27.000000 MHz
    VIC   7:  1440x480i   59.940060 Hz  16:9     15.734 kHz     27.000000 MHz
    VIC   1:   640x480    59.940476 Hz   4:3     31.469 kHz     25.175000 MHz
    VIC  32:  1920x1080   24.000000 Hz  16:9     27.000 kHz     74.250000 MHz
    VIC  34:  1920x1080   30.000000 Hz  16:9     33.750 kHz     74.250000 MHz
  Audio Data Block:
    Linear PCM:
      Max channels: 2
      Supported sample rates (kHz): 48 44.1 32
      Supported sample sizes (bits): 24 20 16
  Speaker Allocation Data Block:
    FL/FR - Front Left/Right
  Vendor-Specific Data Block (HDMI), OUI 00-0C-03:
    Source physical address: 2.0.0.0
    Supports_AI
    Maximum TMDS clock: 150 MHz
  Video Capability Data Block:
    YCbCr quantization: No Data
    RGB quantization: Selectable (via AVI Q)
    PT scan behavior: No Data
    IT scan behavior: Always Underscanned
    CE scan behavior: Supports both over- and underscan
  Detailed Timing Descriptors:
    DTD  3:  1600x900    60.000000 Hz  16:9     60.000 kHz    108.000000 MHz (880 mm x 495 mm)
                  Hfront   24 Hsync  80 Hback   96 Hpol P
                  Vfront    1 Vsync   3 Vback   96 Vpol P
    DTD  4:  1280x768    59.870228 Hz   5:3     47.776 kHz     79.500000 MHz (880 mm x 495 mm)
                  Hfront   64 Hsync 128 Hback  192 Hpol P
                  Vfront    3 Vsync   7 Vback   20 Vpol N
    DTD  5:  1280x720    60.000000 Hz  16:9     45.000 kHz     74.250000 MHz (880 mm x 495 mm)
                  Hfront  110 Hsync  40 Hback  220 Hpol P
                  Vfront    5 Vsync   5 Vback   20 Vpol P
    DTD  6:   720x480    59.940060 Hz   3:2     31.469 kHz     27.000000 MHz (880 mm x 495 mm)
                  Hfront   16 Hsync  62 Hback   60 Hpol N
                  Vfront    9 Vsync   6 Vback   30 Vpol N
    DTD  7:  1440x480i   59.940060 Hz   3:1     15.734 kHz     27.000000 MHz (880 mm x 495 mm)
                  Hfront   38 Hsync 124 Hback  114 Hpol N
                  Vfront    4 Vsync   0 Vback   18 Vpol N Vfront +0.5 Odd Field
                  Vfront    4 Vsync   0 Vback   18 Vpol N Vback  +0.5 Even Field
                   8c 0a a0 14 51 f0 16 00 26 7c 40 00 70 ef 31 00 00 98 '....Q...&|@.p.1...'
Checksum: 0xbf  Unused space in Extension Block: 4 bytes

----------------

Block 2, Unknown EDID Extension Block 0x00:
  00 ff ff ff ff ff ff 00 34 ac 2f 33 00 00 00 00 '........4./3....'
  0d 1b 01 03 80 58 32 78 0a 8f 9c a4 56 4c 9d 26 '.....X2x....VL.&'
  0f 46 4c 21 08 00 a9 c0 81 c0 81 00 81 80 81 40 '.FL!...........@'
  01 01 01 01 01 01 02 3a 80 18 71 38 2d 40 58 2c '.......:..q8-@X,'
  45 00 70 ef 31 00 00 1e 66 21 50 b0 51 00 1b 30 'E.p.1...f!P.Q..0'
  40 70 36 00 70 ef 31 00 00 1e 00 00 00 fd 00 17 '@p6.p.1.........'
  4c 0f 50 0f 00 0a 20 20 20 20 20 20 00 00 00 fc 'L.P...      ....'
  00 4d 45 4c 2d 54 56 28 46 48 44 29 0a 20 01 6c '.MEL-TV(FHD). .l'
Checksum: 0x6c

----------------

Block 3, CTA-861 Extension Block:
  Revision: 3
  Underscans IT Video Formats by default
  Basic audio support
  Supports YCbCr 4:4:4
  Supports YCbCr 4:2:2
  Native detailed modes: 1
  Video Data Block:
    VIC  16:  1920x1080   60.000000 Hz  16:9     67.500 kHz    148.500000 MHz (native)
    VIC   5:  1920x1080i  60.000000 Hz  16:9     33.750 kHz     74.250000 MHz
    VIC   4:  1280x720    60.000000 Hz  16:9     45.000 kHz     74.250000 MHz
    VIC   3:   720x480    59.940060 Hz  16:9     31.469 kHz     27.000000 MHz
    VIC   7:  1440x480i   59.940060 Hz  16:9     15.734 kHz     27.000000 MHz
    VIC   1:   640x480    59.940476 Hz   4:3     31.469 kHz     25.175000 MHz
    VIC  32:  1920x1080   24.000000 Hz  16:9     27.000 kHz     74.250000 MHz
    VIC  34:  1920x1080   30.000000 Hz  16:9     33.750 kHz     74.250000 MHz
  Audio Data Block:
    Linear PCM:
      Max channels: 2
      Supported sample rates (kHz): 48 44.1 32
      Supported sample sizes (bits): 24 20 16
  Speaker Allocation Data Block:
    FL/FR - Front Left/Right
  Vendor-Specific Data Block (HDMI), OUI 00-0C-03:
    Source physical address: 2.0.0.0
    Supports_AI
    Maximum TMDS clock: 150 MHz
  Video Capability Data Block:
    YCbCr quantization: No Data
    RGB quantization: Selectable (via AVI Q)
    PT scan behavior: No Data
    IT scan behavior: Always Underscanned
    CE scan behavior: Supports both over- and underscan
  Detailed Timing Descriptors:
    DTD  8:  1600x900    60.000000 Hz  16:9     60.000 kHz    108.000000 MHz (880 mm x 495 mm)
                  Hfront   24 Hsync  80 Hback   96 Hpol P
                  Vfront    1 Vsync   3 Vback   96 Vpol P
    DTD  9:  1280x768    59.870228 Hz   5:3     47.776 kHz     79.500000 MHz (880 mm x 495 mm)
                  Hfront   64 Hsync 128 Hback  192 Hpol P
                  Vfront    3 Vsync   7 Vback   20 Vpol N
    DTD 10:  1280x720    60.000000 Hz  16:9     45.000 kHz     74.250000 MHz (880 mm x 495 mm)
                  Hfront  110 Hsync  40 Hback  220 Hpol P
                  Vfront    5 Vsync   5 Vback   20 Vpol P
    DTD 11:   720x480    59.940060 Hz   3:2     31.469 kHz     27.000000 MHz (880 mm x 495 mm)
                  Hfront   16 Hsync  62 Hback   60 Hpol N
                  Vfront    9 Vsync   6 Vback   30 Vpol N
    DTD 12:  1440x480i   59.940060 Hz   3:1     15.734 kHz     27.000000 MHz (880 mm x 495 mm)
                  Hfront   38 Hsync 124 Hback  114 Hpol N
                  Vfront    4 Vsync   0 Vback   18 Vpol N Vfront +0.5 Odd Field
                  Vfront    4 Vsync   0 Vback   18 Vpol N Vback  +0.5 Even Field
                   8c 0a a0 14 51 f0 16 00 26 7c 40 00 70 ef 31 00 00 98 '....Q...&|@.p.1...'
Checksum: 0xbf  Unused space in Extension Block: 4 bytes

----------------

Warnings:

Block 1, CTA-861 Extension Block:
  Video Capability Data Block: Set Selectable YCbCr Quantization to avoid interop issues.
  Detailed Timing Descriptor #4: DTD is similar but not identical to DMT 0x17.
  Detailed Timing Descriptor #4: Image size is 880x495 mm, but based on the picture AR it should be 880x528 mm.
  Detailed Timing Descriptor #6: Image size is 880x495 mm, but based on the picture AR it should be 880x586 mm.
  Detailed Timing Descriptor #7: DTD is similar but not identical to VIC 6.
  Detailed Timing Descriptor #7: Image size is 880x495 mm, but based on the picture AR it should be 880x293 mm.
  Add a Colorimetry Data Block with the sRGB colorimetry bit set to avoid interop issues.
Block 3, CTA-861 Extension Block:
  Video Capability Data Block: Set Selectable YCbCr Quantization to avoid interop issues.
  Detailed Timing Descriptor #9: DTD is similar but not identical to DMT 0x17.
  Detailed Timing Descriptor #9: Image size is 880x495 mm, but based on the picture AR it should be 880x528 mm.
  Detailed Timing Descriptor #11: Image size is 880x495 mm, but based on the picture AR it should be 880x586 mm.
  Detailed Timing Descriptor #12: DTD is similar but not identical to VIC 6.
  Detailed Timing Descriptor #12: Image size is 880x495 mm, but based on the picture AR it should be 880x293 mm.
EDID:
  CTA-861: Multiple native progressive timings are defined.

Failures:

Block 1, CTA-861 Extension Block:
  Detailed Timing Descriptor #7: 0 values in the video timing:
    Horizontal Active/Blanking 1440/276
    Horizontal Frontporch/Sync Width 38/124
    Vertical Active/Blanking 240/22
    Vertical Frontporch/Sync Width 4/0
Block 2, Base EDID:
  Unknown Extension Block.
Block 3, CTA-861 Extension Block:
  Video Data Block: Duplicate VIC 16.
  Video Data Block: Duplicate VIC 5.
  Video Data Block: Duplicate VIC 4.
  Video Data Block: Duplicate VIC 3.
  Video Data Block: Duplicate VIC 7.
  Video Data Block: Duplicate VIC 1.
  Video Data Block: Duplicate VIC 32.
  Video Data Block: Duplicate VIC 34.
  Speaker Allocation Data Block: Only one instance of this Data Block is allowed.
  Video Capability Data Block: Only one instance of this Data Block is allowed.
  Detailed Timing Descriptor #12: 0 values in the video timing:
    Horizontal Active/Blanking 1440/276
    Horizontal Frontporch/Sync Width 38/124
    Vertical Active/Blanking 240/22
    Vertical Frontporch/Sync Width 4/0
EDID:
  Base EDID: EDID specified 1 extension block(s), but found 3 extension block(s).
  Base EDID: EDID 1.3 requires a Block Map Extension in Block 1 if there are more than 2 blocks in the EDID.

EDID conformity: FAIL
