edid-decode (hex):

00 ff ff ff ff ff ff 00 34 ac 2f 33 00 00 00 00
00 14 01 03 80 00 00 78 0a 68 dd a2 54 49 9b 25
0f 47 4a 20 00 00 01 01 01 01 01 01 01 01 01 01
01 01 01 01 01 01 02 3a 80 18 71 38 2d 40 58 2c
45 00 33 cd 31 00 00 1e 01 1d 80 18 71 1c 16 20
58 2c 25 00 75 f2 31 00 00 9e 00 00 00 fd 00 18
3d 0f 44 0f 00 0a 20 20 20 20 20 20 00 00 00 fc
00 4d 45 4c 2d 54 56 28 46 48 44 29 0a 20 01 bf

02 03 1b 71 47 90 05 04 03 07 01 20 23 09 07 07
83 01 00 00 66 03 0c 00 20 00 80 01 1d 00 72 51
d0 1e 20 6e 28 55 00 75 f2 31 00 00 1e 8c 0a d0
8a 20 e0 2d 10 10 3e 96 00 75 f2 31 00 00 18 8c
0a a0 14 51 f0 16 00 26 7c 43 00 75 f2 31 00 00
98 f9 1c 80 3e 73 38 2d 40 7e 2c 45 80 75 f2 31
00 00 1a 00 00 00 00 00 00 00 00 00 00 00 00 00
00 00 00 00 00 00 00 00 00 00 00 00 00 00 00 7e

00 ff ff ff ff ff ff 00 34 ac 2f 33 00 00 00 00
00 14 01 03 80 00 00 78 0a 68 dd a2 54 49 9b 25
0f 47 4a 20 00 00 01 01 01 01 01 01 01 01 01 01
01 01 01 01 01 01 02 3a 80 18 71 38 2d 40 58 2c
45 00 33 cd 31 00 00 1e 01 1d 80 18 71 1c 16 20
58 2c 25 00 75 f2 31 00 00 9e 00 00 00 fd 00 18
3d 0f 44 0f 00 0a 20 20 20 20 20 20 00 00 00 fc
00 4d 45 4c 2d 54 56 28 46 48 44 29 0a 20 01 bf

02 03 1b 71 47 90 05 04 03 07 01 20 23 09 07 07
83 01 00 00 66 03 0c 00 20 00 80 01 1d 00 72 51
d0 1e 20 6e 28 55 00 75 f2 31 00 00 1e 8c 0a d0
8a 20 e0 2d 10 10 3e 96 00 75 f2 31 00 00 18 8c
0a a0 14 51 f0 16 00 26 7c 43 00 75 f2 31 00 00
98 f9 1c 80 3e 73 38 2d 40 7e 2c 45 80 75 f2 31
00 00 1a 00 00 00 00 00 00 00 00 00 00 00 00 00
00 00 00 00 00 00 00 00 00 00 00 00 00 00 00 7e

----------------

Block 0, Base EDID:
  EDID Structure Version & Revision: 1.3
  Vendor & Product Identification:
    Manufacturer: MEL
    Model: 13103
    Made in: 2010
  Basic Display Parameters & Features:
    Digital display
    Image size is variable
    Gamma: 2.20
    RGB color display
    First detailed timing is the preferred timing
  Color Characteristics:
    Red  : 0.6337, 0.3300
    Green: 0.2871, 0.6054
    Blue : 0.1474, 0.0595
    White: 0.2802, 0.2900
  Established Timings I & II:
    DMT 0x04:   640x480    59.940476 Hz   4:3     31.469 kHz     25.175000 MHz
  Standard Timings: none
  Detailed Timing Descriptors:
    DTD 1:  1920x1080   60.000000 Hz  16:9     67.500 kHz    148.500000 MHz (819 mm x 461 mm)
                 Hfront   88 Hsync  44 Hback  148 Hpol P
                 Vfront    4 Vsync   5 Vback   36 Vpol P
    DTD 2:  1920x1080i  60.000000 Hz  16:9     33.750 kHz     74.250000 MHz (885 mm x 498 mm)
                 Hfront   88 Hsync  44 Hback  148 Hpol P
                 Vfront    2 Vsync   5 Vback   15 Vpol P Vfront +0.5 Odd Field
                 Vfront    2 Vsync   5 Vback   15 Vpol P Vback  +0.5 Even Field
    Display Range Limits:
      Monitor ranges (GTF): 24-61 Hz V, 15-68 kHz H, max dotclock 150 MHz
    Display Product Name: 'MEL-TV(FHD)'
  Extension blocks: 1
Checksum: 0xbf

----------------

Block 1, CTA-861 Extension Block:
  Revision: 3
  Basic audio support
  Supports YCbCr 4:4:4
  Supports YCbCr 4:2:2
  Native DTDs: 1
  Video Data Block:
    VIC  16:  1920x1080   60.000000 Hz  16:9     67.500 kHz    148.500000 MHz (native)
    VIC   5:  1920x1080i  60.000000 Hz  16:9     33.750 kHz     74.250000 MHz
    VIC   4:  1280x720    60.000000 Hz  16:9     45.000 kHz     74.250000 MHz
    VIC   3:   720x480    59.940060 Hz  16:9     31.469 kHz     27.000000 MHz
    VIC   7:  1440x480i   59.940060 Hz  16:9     15.734 kHz     27.000000 MHz
    VIC   1:   640x480    59.940476 Hz   4:3     31.469 kHz     25.175000 MHz
    VIC  32:  1920x1080   24.000000 Hz  16:9     27.000 kHz     74.250000 MHz
  Audio Data Block:
    Linear PCM:
      Max channels: 2
      Supported sample rates (kHz): 48 44.1 32
      Supported sample sizes (bits): 24 20 16
  Speaker Allocation Data Block:
    FL/FR - Front Left/Right
  Vendor-Specific Data Block (HDMI), OUI 00-0C-03:
    Source physical address: 2.0.0.0
    Supports_AI
  Detailed Timing Descriptors:
    DTD 3:  1280x720    60.000000 Hz  16:9     45.000 kHz     74.250000 MHz (885 mm x 498 mm)
                 Hfront  110 Hsync  40 Hback  220 Hpol P
                 Vfront    5 Vsync   5 Vback   20 Vpol P
    DTD 4:   720x480    59.940060 Hz   3:2     31.469 kHz     27.000000 MHz (885 mm x 498 mm)
                 Hfront   16 Hsync  62 Hback   60 Hpol N
                 Vfront    9 Vsync   6 Vback   30 Vpol N
    DTD 5:  1440x480i   59.940060 Hz   3:1     15.734 kHz     27.000000 MHz (885 mm x 498 mm)
                 Hfront   38 Hsync 124 Hback  114 Hpol N
                 Vfront    4 Vsync   3 Vback   15 Vpol N Vfront +0.5 Odd Field
                 Vfront    4 Vsync   3 Vback   15 Vpol N Vback  +0.5 Even Field
    DTD 6:  1920x1080   23.974141 Hz  16:9     26.971 kHz     74.170000 MHz (885 mm x 498 mm)
                 Hfront  638 Hsync  44 Hback  148 Hpol P
                 Vfront    4 Vsync   5 Vback   36 Vpol N
Checksum: 0x7e  Unused space in Extension Block: 28 bytes

----------------

Warnings:

Block 1, CTA-861 Extension Block:
  IT Video Formats are overscanned by default, but normally this should be underscanned.
  Detailed Timing Descriptor #4: Image size is 885x498 mm, but based on the picture AR it should be 747x498 mm.
  Detailed Timing Descriptor #5: Image size is 885x498 mm, but based on the picture AR it should be 885x295 mm.
  Add a Colorimetry Data Block with the sRGB colorimetry bit set to avoid interop issues.

Failures:

Block 1, CTA-861 Extension Block:
  Missing VCDB, needed for Set Selectable RGB Quantization to avoid interop issues.
EDID:
  Extension Block 2 started with EDID header, ignoring Extension Blocks >= 2.
  Base EDID: The DTD max image size is 885x498mm, but the display size is not specified anywhere.

EDID conformity: FAIL
