edid-decode (hex):

00 ff ff ff ff ff ff 00 52 62 0b 01 01 01 01 01
ff 15 01 03 80 35 1e 78 0a 0d c9 a0 57 47 98 27
12 48 4c 01 08 00 81 80 01 01 01 01 01 01 01 01
01 01 01 01 01 01 02 3a 80 d0 72 38 2d 40 10 2c
45 80 13 2b 21 00 00 1e 66 21 50 b0 51 00 1b 30
40 70 36 00 11 2b 21 00 00 1e 00 00 00 fc 00 54
4f 53 48 49 42 41 2d 54 56 0a 20 20 00 00 00 fd
00 17 4c 0f 51 0f 00 0a 20 20 20 20 20 20 01 de

00 ff ff ff ff ff ff 00 52 62 0b 01 01 01 01 01
ff 15 01 03 80 35 1e 78 0a 0d c9 a0 57 47 98 27
12 48 4c 01 08 00 81 80 01 01 01 01 01 01 01 01
01 01 01 01 01 01 02 3a 80 d0 72 38 2d 40 10 2c
45 80 13 2b 21 00 00 1e 66 21 50 b0 51 00 1b 30
40 70 36 00 11 2b 21 00 00 1e 00 00 00 fc 00 54
4f 53 48 49 42 41 2d 54 56 0a 20 20 00 00 00 fd
00 17 4c 0f 51 0f 00 0a 20 20 20 20 20 20 01 de

----------------

Block 0, Base EDID:
  EDID Structure Version & Revision: 1.3
  Vendor & Product Identification:
    Manufacturer: TSB
    Model: 267
    Serial Number: ...
    Model year: 2011
  Basic Display Parameters & Features:
    Digital display
    Maximum image size: 53 cm x 30 cm
    Gamma: 2.20
    RGB color display
    First detailed timing is the preferred timing
  Color Characteristics:
    Red  : 0.6250, 0.3398
    Green: 0.2802, 0.5947
    Blue : 0.1552, 0.0703
    White: 0.2832, 0.2978
  Established Timings I & II:
    DMT 0x09:   800x600    60.316541 Hz   4:3     37.879 kHz     40.000000 MHz
    DMT 0x10:  1024x768    60.003840 Hz   4:3     48.363 kHz     65.000000 MHz
  Standard Timings:
    DMT 0x23:  1280x1024   60.019740 Hz   5:4     63.981 kHz    108.000000 MHz
  Detailed Timing Descriptors:
    DTD 1:  1920x1080   50.000000 Hz  16:9     56.250 kHz    148.500000 MHz (531 mm x 299 mm)
                 Hfront  528 Hsync  44 Hback  148 Hpol P
                 Vfront    4 Vsync   5 Vback   36 Vpol P
    DTD 2:  1360x768    60.015162 Hz  85:48    47.712 kHz     85.500000 MHz (529 mm x 299 mm)
                 Hfront   64 Hsync 112 Hback  256 Hpol P
                 Vfront    3 Vsync   6 Vback   18 Vpol P
    Display Product Name: 'TOSHIBA-TV'
    Display Range Limits:
      Monitor ranges (GTF): 23-76 Hz V, 15-81 kHz H, max dotclock 150 MHz
  Extension blocks: 1
Checksum: 0xde

----------------

Block 1, Unknown EDID Extension Block 0x00:
  00 ff ff ff ff ff ff 00 52 62 0b 01 01 01 01 01 '........Rb......'
  ff 15 01 03 80 35 1e 78 0a 0d c9 a0 57 47 98 27 '.....5.x....WG.''
  12 48 4c 01 08 00 81 80 01 01 01 01 01 01 01 01 '.HL.............'
  01 01 01 01 01 01 02 3a 80 d0 72 38 2d 40 10 2c '.......:..r8-@.,'
  45 80 13 2b 21 00 00 1e 66 21 50 b0 51 00 1b 30 'E..+!...f!P.Q..0'
  40 70 36 00 11 2b 21 00 00 1e 00 00 00 fc 00 54 '@p6..+!........T'
  4f 53 48 49 42 41 2d 54 56 0a 20 20 00 00 00 fd 'OSHIBA-TV.  ....'
  00 17 4c 0f 51 0f 00 0a 20 20 20 20 20 20 01 de '..L.Q...      ..'
Checksum: 0xde

----------------

Warnings:

Block 0, Base EDID:
  Vendor & Product Identification: The serial number is one of the known dummy values, it should probably be set to 0.

Failures:

Block 0, Base EDID:
  Vendor & Product Identification: EDID 1.3 does not support week 0xff.
Block 1, Base EDID:
  Unknown Extension Block.

EDID conformity: FAIL
