edid-decode (hex):

00 ff ff ff ff ff ff 00 4c 2d 89 01 00 00 00 00
02 0f 01 03 68 5d 35 78 0a ee 91 a3 54 4c 99 26
0f 50 54 af ce 00 01 01 01 01 01 01 01 01 01 01
01 01 01 01 01 01 2f 0d 50 f0 30 e0 25 10 10 70
68 00 a5 14 32 00 00 1e 64 19 00 40 41 00 26 30
18 88 36 00 a5 14 32 00 00 18 00 00 00 fd 00 38
4b 1e 3d 08 00 0a 20 20 20 20 20 20 00 00 00 fc
00 53 41 4d 53 55 4e 47 20 50 44 50 0a 20 00 dd

00 ff ff ff ff ff ff 00 4c 2d 89 01 00 00 00 00
02 0f 01 03 68 5d 35 78 0a ee 91 a3 54 4c 99 26
0f 50 54 af ce 00 01 01 01 01 01 01 01 01 01 01
01 01 01 01 01 01 2f 0d 50 f0 30 e0 25 10 10 70
68 00 a5 14 32 00 00 1e 64 19 00 40 41 00 26 30
18 88 36 00 a5 14 32 00 00 18 00 00 00 fd 00 38
4b 1e 3d 08 00 0a 20 20 20 20 20 20 00 00 00 fc
00 53 41 4d 53 55 4e 47 20 50 44 50 0a 20 00 dd

----------------

Block 0, Base EDID:
  EDID Structure Version & Revision: 1.3
  Vendor & Product Identification:
    Manufacturer: SAM
    Model: 393
    Made in: week 2 of 2005
  Basic Display Parameters & Features:
    Analog display
    Signal Level Standard: 0.700 : 0.000 : 0.700 V p-p
    Blank level equals black level
    Sync: Separate
    Maximum image size: 93 cm x 53 cm
    Gamma: 2.20
    RGB color display
    First detailed timing is the preferred timing
  Color Characteristics:
    Red  : 0.6396, 0.3300
    Green: 0.2998, 0.5996
    Blue : 0.1503, 0.0595
    White: 0.3125, 0.3291
  Established Timings I & II:
    IBM     :   720x400    70.081663 Hz   9:5     31.467 kHz     28.320000 MHz
    DMT 0x04:   640x480    59.940476 Hz   4:3     31.469 kHz     25.175000 MHz
    DMT 0x05:   640x480    72.808802 Hz   4:3     37.861 kHz     31.500000 MHz
    DMT 0x06:   640x480    75.000000 Hz   4:3     37.500 kHz     31.500000 MHz
    DMT 0x08:   800x600    56.250000 Hz   4:3     35.156 kHz     36.000000 MHz
    DMT 0x09:   800x600    60.316541 Hz   4:3     37.879 kHz     40.000000 MHz
    DMT 0x0a:   800x600    72.187572 Hz   4:3     48.077 kHz     50.000000 MHz
    DMT 0x0b:   800x600    75.000000 Hz   4:3     46.875 kHz     49.500000 MHz
    DMT 0x10:  1024x768    60.003840 Hz   4:3     48.363 kHz     65.000000 MHz
    DMT 0x11:  1024x768    70.069359 Hz   4:3     56.476 kHz     75.000000 MHz
    DMT 0x12:  1024x768    75.028582 Hz   4:3     60.023 kHz     78.750000 MHz
  Standard Timings: none
  Detailed Timing Descriptors:
    DTD 1:   848x480    60.000427 Hz  53:30    31.020 kHz     33.750000 MHz (933 mm x 532 mm)
                 Hfront   16 Hsync 112 Hback  112 Hpol P
                 Vfront    6 Vsync   8 Vback   23 Vpol P
    DTD 2:  1024x768    60.003840 Hz   4:3     48.363 kHz     65.000000 MHz (933 mm x 532 mm)
                 Hfront   24 Hsync 136 Hback  160 Hpol N
                 Vfront    3 Vsync   6 Vback   29 Vpol N
    Display Range Limits:
      Monitor ranges (GTF): 56-75 Hz V, 30-61 kHz H, max dotclock 80 MHz
    Display Product Name: 'SAMSUNG PDP'
Checksum: 0xdd

----------------

Warnings:

Block 0, Base EDID:
  Detailed Timing Descriptor #2: Image size is 933x532 mm, but based on the picture AR it should be 709x532 mm.

Failures:

Block 0, Base EDID:
  Basic Display Parameters & Features: The chromaticities match sRGB, but sRGB is not signaled.
EDID:
  Extension Block 1 started with EDID header, ignoring Extension Blocks >= 1.

EDID conformity: FAIL
