edid-decode (hex):

00 ff ff ff ff ff ff 00 4d 10 f1 14 00 00 00 00
0e 1e 01 04 a5 1f 11 78 07 de 50 a3 54 4c 99 26
0f 50 54 00 00 00 01 01 01 01 01 01 01 01 01 01
01 01 01 01 01 01 8b 6f 80 a0 70 38 40 40 30 20
35 00 35 ae 10 00 00 18 c6 37 80 a0 70 38 40 40
30 20 35 00 35 ae 10 00 00 18 00 00 00 fd 00 30
78 89 89 1d 01 0a 20 20 20 20 20 20 00 00 00 fc
00 4c 51 31 34 30 4d 31 4a 57 34 36 0a 20 00 05

----------------

Block 0, Base EDID:
  EDID Structure Version & Revision: 1.4
  Vendor & Product Identification:
    Manufacturer: SHP
    Model: 5361
    Made in: week 14 of 2020
  Basic Display Parameters & Features:
    Digital display
    Bits per primary color channel: 8
    DisplayPort interface
    Maximum image size: 31 cm x 17 cm
    Gamma: 2.20
    Supported color formats: RGB 4:4:4
    Default (sRGB) color space is primary color space
    First detailed timing includes the native pixel format and preferred refresh rate
    Display supports continuous frequencies
  Color Characteristics:
    Red  : 0.6396, 0.3291
    Green: 0.2998, 0.5996
    Blue : 0.1494, 0.0595
    White: 0.3125, 0.3281
  Established Timings I & II: none
  Standard Timings: none
  Detailed Timing Descriptors:
    DTD 1:  1920x1080  120.003194 Hz  16:9    137.284 kHz    285.550000 MHz (309 mm x 174 mm)
                 Hfront   48 Hsync  32 Hback   80 Hpol N
                 Vfront    3 Vsync   5 Vback   56 Vpol N
    DTD 2:  1920x1080   60.003698 Hz  16:9     68.644 kHz    142.780000 MHz (309 mm x 174 mm)
                 Hfront   48 Hsync  32 Hback   80 Hpol N
                 Vfront    3 Vsync   5 Vback   56 Vpol N
    Display Range Limits:
      Monitor ranges (Range Limits Only): 48-120 Hz V, 137-137 kHz H, max dotclock 290 MHz
    Display Product Name: 'LQ140M1JW46'
Checksum: 0x05

----------------

Warnings:

EDID:
  Base EDID: Some timings are out of range of the Monitor Ranges:
    Horizontal Freq: 68.644 - 137.283 kHz (Monitor: 137.000 - 137.000 kHz)

Failures:

Block 0, Base EDID:
  Basic Display Parameters & Features: sRGB is signaled, but the chromaticities do not match.

EDID conformity: FAIL
