edid-decode (hex):

00 ff ff ff ff ff ff 00 0c e3 50 19 00 10 00 ff
0c 1b 01 04 a5 29 1c 78 e2 80 42 ac 51 30 b4 25
10 50 53 00 00 00 01 00 01 00 01 00 01 00 01 00
01 00 01 00 01 00 31 2e 40 00 62 84 1a 30 58 a8
48 00 06 4d 21 00 00 1c 00 00 00 00 00 00 00 00
00 00 00 00 00 00 00 00 00 00 00 00 00 fd 00 38
4c 1e 53 11 00 0a 20 20 20 20 20 20 00 00 00 fc
00 54 32 30 30 31 0a 20 20 20 20 20 20 20 00 3b

00 ff ff ff ff ff ff 00 0c e3 50 19 00 10 00 ff
0c 1b 01 04 a5 29 1c 78 e2 80 42 ac 51 30 b4 25
10 50 53 00 00 00 01 00 01 00 01 00 01 00 01 00
01 00 01 00 01 00 31 2e 40 00 62 84 1a 30 58 a8
48 00 06 4d 21 00 00 1c 00 00 00 00 00 00 00 00
00 00 00 00 00 00 00 00 00 00 00 00 00 fd 00 38
4c 1e 53 11 00 0a 20 20 20 20 20 20 00 00 00 fc
00 54 32 30 30 31 0a 20 20 20 20 20 20 20 00 3b

----------------

Block 0, Base EDID:
  EDID Structure Version & Revision: 1.4
  Vendor & Product Identification:
    Manufacturer: CGC
    Model: 6480
    Serial Number: ...
    Made in: week 12 of 2017
  Basic Display Parameters & Features:
    Digital display
    Bits per primary color channel: 8
    DisplayPort interface
    Maximum image size: 41 cm x 28 cm
    Gamma: 2.20
    DPMS levels: Standby Suspend Off
    Supported color formats: RGB 4:4:4
    First detailed timing includes the native pixel format and preferred refresh rate
  Color Characteristics:
    Red  : 0.6738, 0.3164
    Green: 0.1875, 0.7031
    Blue : 0.1455, 0.0625
    White: 0.3125, 0.3261
  Established Timings I & II: none
  Standard Timings:
  Detailed Timing Descriptors:
    DTD 1:  1600x900    60.463913 Hz  16:9     55.990 kHz    118.250000 MHz (518 mm x 333 mm)
                 Hfront   88 Hsync 168 Hback  256 Hpol N
                 Vfront    4 Vsync   8 Vback   14 Vpol P
    Empty Descriptor
    Display Range Limits:
      Monitor ranges (GTF): 56-76 Hz V, 30-83 kHz H, max dotclock 170 MHz
    Display Product Name: 'T2001'
Checksum: 0x3b

----------------

Block 1, Unknown EDID Extension Block 0x00:
  00 ff ff ff ff ff ff 00 0c e3 50 19 00 10 00 ff '..........P.....'
  0c 1b 01 04 a5 29 1c 78 e2 80 42 ac 51 30 b4 25 '.....).x..B.Q0.%'
  10 50 53 00 00 00 01 00 01 00 01 00 01 00 01 00 '.PS.............'
  01 00 01 00 01 00 31 2e 40 00 62 84 1a 30 58 a8 '......1.@.b..0X.'
  48 00 06 4d 21 00 00 1c 00 00 00 00 00 00 00 00 'H..M!...........'
  00 00 00 00 00 00 00 00 00 00 00 00 00 fd 00 38 '...............8'
  4c 1e 53 11 00 0a 20 20 20 20 20 20 00 00 00 fc 'L.S...      ....'
  00 54 32 30 30 31 0a 20 20 20 20 20 20 20 00 3b '.T2001.       .;'
Checksum: 0x3b

----------------

Warnings:

Block 0, Base EDID:
  Detailed Timing Descriptor #1: Image size is 518x333 mm, but based on the picture AR it should be 518x291 mm.
  Display Range Limits: GTF support is deprecated in EDID 1.4.

Failures:

Block 0, Base EDID:
  Standard Timings: Use 0x0101 as the invalid Standard Timings code, not 0x0100.
  Standard Timings: Use 0x0101 as the invalid Standard Timings code, not 0x0100.
  Standard Timings: Use 0x0101 as the invalid Standard Timings code, not 0x0100.
  Standard Timings: Use 0x0101 as the invalid Standard Timings code, not 0x0100.
  Standard Timings: Use 0x0101 as the invalid Standard Timings code, not 0x0100.
  Standard Timings: Use 0x0101 as the invalid Standard Timings code, not 0x0100.
  Standard Timings: Use 0x0101 as the invalid Standard Timings code, not 0x0100.
  Standard Timings: Use 0x0101 as the invalid Standard Timings code, not 0x0100.
  Detailed Timing Descriptor #1: Mismatch of image size 518x333 mm vs display size 410x280 mm.
  Empty Descriptor: Use Dummy Descriptor instead of all zeroes.
  Display Range Limits: GTF is supported, but the display does not support continuous frequencies.
Block 1, Base EDID:
  Unknown Extension Block.
EDID:
  Base EDID: The DTD max image size is 518x333mm, which is larger than the display size 410.0x280.0mm.
  Base EDID: EDID specified 0 extension block(s), but found 1 extension block(s).

EDID conformity: FAIL
