edid-decode (hex):

00 ff ff ff ff ff ff 00 22 11 00 02 00 00 00 00
08 22 01 04 a5 2b 18 78 0a e3 95 a4 56 52 9d 26
0e 50 54 00 00 00 01 01 01 01 01 01 01 01 01 01
01 01 01 01 01 01 02 3a 80 18 71 38 2d 40 30 20
84 00 b2 ee 10 00 00 1e 00 00 00 ff 00 0a 20 20
20 20 20 20 20 20 20 20 20 20 00 00 00 fc 00 20
45 6e 67 61 67 65 20 4f 6e 65 20 0a 00 00 00 03
00 33 3f fe 32 3c 7d 25 34 82 7d 00 00 00 00 55

00 ff ff ff ff ff ff 00 22 11 00 02 00 00 00 00
08 22 01 04 a5 2b 18 78 0a e3 95 a4 56 52 9d 26
0e 50 54 00 00 00 01 01 01 01 01 01 01 01 01 01
01 01 01 01 01 01 02 3a 80 18 71 38 2d 40 30 20
84 00 b2 ee 10 00 00 1e 00 00 00 ff 00 0a 20 20
20 20 20 20 20 20 20 20 20 20 00 00 00 fc 00 20
45 6e 67 61 67 65 20 4f 6e 65 20 0a 00 00 00 03
00 33 3f fe 32 3c 7d 25 34 82 7d 00 00 00 00 55

----------------

Block 0, Base EDID:
  EDID Structure Version & Revision: 1.4
  Vendor & Product Identification:
    Manufacturer: HPQ
    Model: 512
    Made in: week 8 of 2024
  Basic Display Parameters & Features:
    Digital display
    Bits per primary color channel: 8
    DisplayPort interface
    Maximum image size: 43 cm x 24 cm
    Gamma: 2.20
    Supported color formats: RGB 4:4:4, YCrCb 4:4:4
    First detailed timing includes the native pixel format and preferred refresh rate
  Color Characteristics:
    Red  : 0.6435, 0.3378
    Green: 0.3203, 0.6162
    Blue : 0.1503, 0.0556
    White: 0.3134, 0.3291
  Established Timings I & II: none
  Standard Timings: none
  Detailed Timing Descriptors:
    DTD 1:  1920x1080   60.000000 Hz  16:9     67.500 kHz    148.500000 MHz (434 mm x 238 mm)
                 Hfront   48 Hsync  32 Hback  200 Hpol P
                 Vfront    8 Vsync   4 Vback   33 Vpol P
    Display Product Serial Number: ...
    Display Product Name: ' Engage One '
    Manufacturer-Specified Display Descriptor (0x03): 00 03 00 33 3f fe 32 3c 7d 25 34 82 7d 00 00 00 '...3?.2<}%4.}...'
Checksum: 0x55

----------------

Warnings:

Block 0, Base EDID:
  Detailed Timing Descriptor #1: DTD is similar but not identical to VIC 16.

Failures:

Block 0, Base EDID:
  Display Product Serial Number: ...
  Display Product Name: One or more trailing spaces before newline.
EDID:
  Extension Block 1 started with EDID header, ignoring Extension Blocks >= 1.

EDID conformity: FAIL
