edid-decode (hex):

00 ff ff ff ff ff ff 00 63 18 00 00 00 00 00 00
0a 14 01 04 0a 00 00 78 2a 99 aa a3 54 4d 95 24
19 51 54 23 08 00 a9 40 8b c0 81 80 81 40 61 40
45 40 31 40 01 01 34 21 50 b0 51 00 1b 30 40 70
63 00 00 00 00 00 00 18 00 00 00 ff 00 30 30 30
30 30 30 30 30 30 30 30 30 30 00 00 00 fd 00 32
3c 1f 41 0e 00 0a 20 20 20 20 20 20 00 00 00 fc
00 4c 43 44 4d 54 32 33 0a 20 20 20 20 20 00 57

00 ff ff ff ff ff ff 00 63 18 00 00 00 00 00 00
0a 14 01 04 0a 00 00 78 2a 99 aa a3 54 4d 95 24
19 51 54 23 08 00 a9 40 8b c0 81 80 81 40 61 40
45 40 31 40 01 01 34 21 50 b0 51 00 1b 30 40 70
63 00 00 00 00 00 00 18 00 00 00 ff 00 30 30 30
30 30 30 30 30 30 30 30 30 30 00 00 00 fd 00 32
3c 1f 41 0e 00 0a 20 20 20 20 20 20 00 00 00 fc
00 4c 43 44 4d 54 32 33 0a 20 20 20 20 20 00 57

----------------

Block 0, Base EDID:
  EDID Structure Version & Revision: 1.4
  Vendor & Product Identification:
    Manufacturer: XXX
    Model: 0
    Made in: week 10 of 2010
  Basic Display Parameters & Features:
    Analog display
    Signal Level Standard: 0.700 : 0.300 : 1.000 V p-p
    Blank level equals black level
    Sync: Separate SyncOnGreen
    Image size is variable
    Gamma: 2.20
    DPMS levels: Off
    RGB color display
    First detailed timing includes the native pixel format and preferred refresh rate
  Color Characteristics:
    Red  : 0.6386, 0.3291
    Green: 0.3027, 0.5830
    Blue : 0.1425, 0.0996
    White: 0.3183, 0.3300
  Established Timings I & II:
    DMT 0x04:   640x480    59.940476 Hz   4:3     31.469 kHz     25.175000 MHz
    DMT 0x08:   800x600    56.250000 Hz   4:3     35.156 kHz     36.000000 MHz
    DMT 0x09:   800x600    60.316541 Hz   4:3     37.879 kHz     40.000000 MHz
    DMT 0x10:  1024x768    60.003840 Hz   4:3     48.363 kHz     65.000000 MHz
  Standard Timings:
    DMT 0x33:  1600x1200   60.000000 Hz   4:3     75.000 kHz    162.000000 MHz
    GTF     :  1360x765    60.000341 Hz  16:9     47.520 kHz     84.396000 MHz
    DMT 0x23:  1280x1024   60.019740 Hz   5:4     63.981 kHz    108.000000 MHz
    DMT 0x20:  1280x960    60.000000 Hz   4:3     60.000 kHz    108.000000 MHz
    DMT 0x10:  1024x768    60.003840 Hz   4:3     48.363 kHz     65.000000 MHz
    DMT 0x09:   800x600    60.316541 Hz   4:3     37.879 kHz     40.000000 MHz
    DMT 0x04:   640x480    59.940476 Hz   4:3     31.469 kHz     25.175000 MHz
  Detailed Timing Descriptors:
    DTD 1:  1360x768    59.664196 Hz  85:48    47.433 kHz     85.000000 MHz
                 Hfront   64 Hsync 112 Hback  256 Hpol N
                 Vfront    6 Vsync   3 Vback   18 Vpol N
    Display Product Serial Number: ...
    Display Range Limits:
      Monitor ranges (GTF): 50-60 Hz V, 31-65 kHz H, max dotclock 140 MHz
    Display Product Name: 'LCDMT23'
Checksum: 0x57

----------------

Warnings:

Block 0, Base EDID:
  Standard Timings: Standard Timing 1360x765 has a dubious odd vertical resolution.
  Display Product Serial Number: ...
  Display Range Limits: GTF support is deprecated in EDID 1.4.
EDID:
  Base EDID: Some timings are out of range of the Monitor Ranges:
    Horizontal Freq: 31.468 - 75.000 kHz (Monitor: 31.000 - 65.000 kHz)
    Maximum Clock: 162.000 MHz (Monitor: 140.000 MHz)

Failures:

Block 0, Base EDID:
  Display Range Limits: GTF is supported, but the display does not support continuous frequencies.
EDID:
  Extension Block 1 started with EDID header, ignoring Extension Blocks >= 1.

EDID conformity: FAIL
