edid-decode (hex):

00 ff ff ff ff ff ff 00 30 e4 3d 05 00 00 00 00
00 1a 01 04 95 1f 11 78 ea 33 55 92 58 55 8e 28
1e 50 54 00 00 00 01 01 01 01 01 01 01 01 01 01
01 01 01 01 01 01 d0 1d 56 f4 50 00 16 30 30 20
35 00 35 ae 10 00 00 19 d0 1d 56 86 52 00 16 30
30 20 35 00 35 ae 10 00 00 19 00 00 00 fe 00 50
4e 35 38 58 80 31 34 30 57 48 55 0a 00 00 00 00
00 00 41 31 94 01 10 00 00 09 01 0a 20 20 00 ec

----------------

Block 0, Base EDID:
  EDID Structure Version & Revision: 1.4
  Vendor & Product Identification:
    Manufacturer: LGD
    Model: 1341
    Made in: 2016
  Basic Display Parameters & Features:
    Digital display
    Bits per primary color channel: 6
    DisplayPort interface
    Maximum image size: 31 cm x 17 cm
    Gamma: 2.20
    DPMS levels: Standby Suspend Off
    Supported color formats: RGB 4:4:4, YCrCb 4:4:4
    First detailed timing includes the native pixel format and preferred refresh rate
  Color Characteristics:
    Red  : 0.5703, 0.3466
    Green: 0.3320, 0.5576
    Blue : 0.1572, 0.1181
    White: 0.3134, 0.3291
  Established Timings I & II: none
  Standard Timings: none
  Detailed Timing Descriptors:
    DTD 1:  1366x768    60.004717 Hz 683:384   47.404 kHz     76.320000 MHz (309 mm x 174 mm)
                 Hfront   48 Hsync  32 Hback  164 Hpol N
                 Vfront    3 Vsync   5 Vback   14 Vpol N
    DTD 2:  1366x768    48.015703 Hz 683:384   37.932 kHz     76.320000 MHz (309 mm x 174 mm)
                 Hfront   48 Hsync  32 Hback  566 Hpol N
                 Vfront    3 Vsync   5 Vback   14 Vpol N
    Alphanumeric Data String: 'PN58X.140WHU'
    Manufacturer-Specified Display Descriptor (0x00): 00 00 00 00 41 31 94 01 10 00 00 09 01 0a 20 20 '....A1........  '
Checksum: 0xec

----------------

Warnings:

Block 0, Base EDID:
  Alphanumeric Data String: Non-ASCII character 0x80 at position 5, can cause problems.
  Missing Display Product Name.

EDID conformity: PASS
