edid-decode (hex):

00 ff ff ff ff ff ff 00 30 e4 62 07 00 00 00 00
00 20 01 04 a5 22 13 af eb e1 85 a3 54 4e 9c 26
0e 50 54 00 00 00 01 01 01 01 01 01 01 01 01 01
01 01 01 01 01 01 2e 36 80 a0 70 38 1f 40 30 20
35 00 58 c2 10 00 00 1a 1f 24 80 a0 70 38 1f 40
30 20 35 00 58 c2 10 00 00 1a ab 3a 80 60 70 38
20 40 06 0a 35 00 58 c2 10 00 00 1a 00 00 00 fd
00 28 43 4b 4b 10 01 0a 20 20 20 20 20 20 00 0b

00 ff ff ff ff ff ff 00 30 e4 62 07 00 00 00 00
00 20 01 04 a5 22 13 af eb e1 85 a3 54 4e 9c 26
0e 50 54 00 00 00 01 01 01 01 01 01 01 01 01 01
01 01 01 01 01 01 2e 36 80 a0 70 38 1f 40 30 20
35 00 58 c2 10 00 00 1a 1f 24 80 a0 70 38 1f 40
30 20 35 00 58 c2 10 00 00 1a ab 3a 80 60 70 38
20 40 06 0a 35 00 58 c2 10 00 00 1a 00 00 00 fd
00 28 43 4b 4b 10 01 0a 20 20 20 20 20 20 00 0b

----------------

Block 0, Base EDID:
  EDID Structure Version & Revision: 1.4
  Vendor & Product Identification:
    Manufacturer: LGD
    Model: 1890
    Made in: 2022
  Basic Display Parameters & Features:
    Digital display
    Bits per primary color channel: 8
    DisplayPort interface
    Maximum image size: 34 cm x 19 cm
    Gamma: 2.75
    DPMS levels: Standby Suspend Off
    Supported color formats: RGB 4:4:4, YCrCb 4:4:4
    First detailed timing includes the native pixel format and preferred refresh rate
    Display supports continuous frequencies
  Color Characteristics:
    Red  : 0.6396, 0.3300
    Green: 0.3046, 0.6103
    Blue : 0.1503, 0.0546
    White: 0.3134, 0.3291
  Established Timings I & II: none
  Standard Timings: none
  Detailed Timing Descriptors:
    DTD 1:  1920x1080   60.020425 Hz  16:9     66.683 kHz    138.700000 MHz (344 mm x 194 mm)
                 Hfront   48 Hsync  32 Hback   80 Hpol P
                 Vfront    3 Vsync   5 Vback   23 Vpol N
    DTD 2:  1920x1080   40.015059 Hz  16:9     44.457 kHz     92.470000 MHz (344 mm x 194 mm)
                 Hfront   48 Hsync  32 Hback   80 Hpol P
                 Vfront    3 Vsync   5 Vback   23 Vpol N
    DTD 3:  1920x1080   66.995511 Hz  16:9     74.499 kHz    150.190000 MHz (344 mm x 194 mm)
                 Hfront    6 Hsync  10 Hback   80 Hpol P
                 Vfront    3 Vsync   5 Vback   24 Vpol N
    Display Range Limits:
      Monitor ranges (Range Limits Only): 40-67 Hz V, 75-75 kHz H, max dotclock 160 MHz
Checksum: 0x0b

----------------

Warnings:

Block 0, Base EDID:
  Missing Display Product Name.
EDID:
  Base EDID: Some timings are out of range of the Monitor Ranges:
    Horizontal Freq: 44.456 - 74.499 kHz (Monitor: 75.000 - 75.000 kHz)

Failures:

EDID:
  Extension Block 1 started with EDID header, ignoring Extension Blocks >= 1.

EDID conformity: FAIL
