edid-decode (hex):

00 ff ff ff ff ff ff 00 06 af 3c 10 00 00 00 00
00 1a 01 04 95 1f 11 78 02 9f e5 96 58 53 8a 26
24 50 54 00 00 00 01 01 01 01 01 01 01 01 01 01
01 01 01 01 01 01 ce 1d 56 e2 50 00 1e 30 26 16
36 00 35 ad 10 00 00 18 d4 17 56 e2 50 00 1e 30
26 16 36 00 35 ad 10 00 00 18 00 00 00 fe 00 41
55 4f 0a 20 20 20 20 20 20 20 20 20 00 00 00 fe
00 42 31 34 30 58 54 4b 30 31 2e 30 20 0a 00 1e

00 ff ff ff ff ff ff 00 06 af 3c 10 00 00 00 00
00 1a 01 04 95 1f 11 78 02 9f e5 96 58 53 8a 26
24 50 54 00 00 00 01 01 01 01 01 01 01 01 01 01
01 01 01 01 01 01 ce 1d 56 e2 50 00 1e 30 26 16
36 00 35 ad 10 00 00 18 d4 17 56 e2 50 00 1e 30
26 16 36 00 35 ad 10 00 00 18 00 00 00 fe 00 41
55 4f 0a 20 20 20 20 20 20 20 20 20 00 00 00 fe
00 42 31 34 30 58 54 4b 30 31 2e 30 20 0a 00 1e

----------------

Block 0, Base EDID:
  EDID Structure Version & Revision: 1.4
  Vendor & Product Identification:
    Manufacturer: AUO
    Model: 4156
    Made in: 2016
  Basic Display Parameters & Features:
    Digital display
    Bits per primary color channel: 6
    DisplayPort interface
    Maximum image size: 31 cm x 17 cm
    Gamma: 2.20
    Supported color formats: RGB 4:4:4
    First detailed timing includes the native pixel format and preferred refresh rate
  Color Characteristics:
    Red  : 0.5878, 0.3447
    Green: 0.3271, 0.5419
    Blue : 0.1513, 0.1425
    White: 0.3134, 0.3291
  Established Timings I & II: none
  Standard Timings: none
  Detailed Timing Descriptors:
    DTD 1:  1366x768    60.059067 Hz 683:384   47.927 kHz     76.300000 MHz (309 mm x 173 mm)
                 Hfront   38 Hsync  22 Hback  166 Hpol N
                 Vfront    3 Vsync   6 Vback   21 Vpol N
    DTD 2:  1366x768    48.015768 Hz 683:384   38.317 kHz     61.000000 MHz (309 mm x 173 mm)
                 Hfront   38 Hsync  22 Hback  166 Hpol N
                 Vfront    3 Vsync   6 Vback   21 Vpol N
    Alphanumeric Data String: 'AUO'
    Alphanumeric Data String: 'B140XTK01.0 '
Checksum: 0x1e

----------------

Warnings:

Block 0, Base EDID:
  Missing Display Product Name.

Failures:

Block 0, Base EDID:
  Alphanumeric Data String: One or more trailing spaces before newline.
EDID:
  Extension Block 1 started with EDID header, ignoring Extension Blocks >= 1.

EDID conformity: FAIL
