edid-decode (hex):

00 ff ff ff ff ff ff 00 05 e3 31 19 30 0c 00 00
23 12 01 03 68 2c 21 78 2a a9 80 a5 55 48 9b 26
12 50 54 bd ef 00 71 4f 81 80 95 00 95 0f b3 00
61 4c 01 01 01 01 21 39 90 30 62 1a 27 40 68 b0
36 00 b8 45 11 00 00 1c 00 00 00 ff 00 4b 33 35
38 38 49 41 30 30 33 31 32 30 00 00 00 fd 00 3c
4b 1e 53 0e 00 0a 20 20 20 20 20 20 00 00 00 fc
00 39 33 31 57 78 0a 20 20 20 20 20 20 20 00 b6

00 ff ff ff ff ff ff 00 05 e3 31 19 30 0c 00 00
23 12 01 03 68 2c 21 78 2a a9 80 a5 55 48 9b 26
12 50 54 bd ef 00 71 4f 81 80 95 00 95 0f b3 00
61 4c 01 01 01 01 21 39 90 30 62 1a 27 40 68 b0
36 00 b8 45 11 00 00 1c 00 00 00 ff 00 4b 33 35
38 38 49 41 30 30 33 31 32 30 00 00 00 fd 00 3c
4b 1e 53 0e 00 0a 20 20 20 20 20 20 00 00 00 fc
00 39 33 31 57 78 0a 20 20 20 20 20 20 20 00 b6

----------------

Block 0, Base EDID:
  EDID Structure Version & Revision: 1.3
  Vendor & Product Identification:
    Manufacturer: AOC
    Model: 6449
    Serial Number: ...
    Made in: week 35 of 2008
  Basic Display Parameters & Features:
    Analog display
    Signal Level Standard: 0.700 : 0.000 : 0.700 V p-p
    Blank level equals black level
    Sync: Separate
    Maximum image size: 44 cm x 33 cm
    Gamma: 2.20
    DPMS levels: Off
    RGB color display
    First detailed timing is the preferred timing
  Color Characteristics:
    Red  : 0.6464, 0.3339
    Green: 0.2832, 0.6064
    Blue : 0.1503, 0.0703
    White: 0.3125, 0.3281
  Established Timings I & II:
    IBM     :   720x400    70.081663 Hz   9:5     31.467 kHz     28.320000 MHz
    DMT 0x04:   640x480    59.940476 Hz   4:3     31.469 kHz     25.175000 MHz
    Apple   :   640x480    66.666667 Hz   4:3     35.000 kHz     30.240000 MHz
    DMT 0x05:   640x480    72.808802 Hz   4:3     37.861 kHz     31.500000 MHz
    DMT 0x06:   640x480    75.000000 Hz   4:3     37.500 kHz     31.500000 MHz
    DMT 0x09:   800x600    60.316541 Hz   4:3     37.879 kHz     40.000000 MHz
    DMT 0x0a:   800x600    72.187572 Hz   4:3     48.077 kHz     50.000000 MHz
    DMT 0x0b:   800x600    75.000000 Hz   4:3     46.875 kHz     49.500000 MHz
    Apple   :   832x624    74.551266 Hz   4:3     49.726 kHz     57.284000 MHz
    DMT 0x10:  1024x768    60.003840 Hz   4:3     48.363 kHz     65.000000 MHz
    DMT 0x11:  1024x768    70.069359 Hz   4:3     56.476 kHz     75.000000 MHz
    DMT 0x12:  1024x768    75.028582 Hz   4:3     60.023 kHz     78.750000 MHz
    DMT 0x24:  1280x1024   75.024675 Hz   5:4     79.976 kHz    135.000000 MHz
  Standard Timings:
    DMT 0x15:  1152x864    75.000000 Hz   4:3     67.500 kHz    108.000000 MHz
    DMT 0x23:  1280x1024   60.019740 Hz   5:4     63.981 kHz    108.000000 MHz
    DMT 0x2f:  1440x900    59.887445 Hz  16:10    55.935 kHz    106.500000 MHz
    DMT 0x30:  1440x900    74.984427 Hz  16:10    70.635 kHz    136.750000 MHz
    DMT 0x3a:  1680x1050   59.954250 Hz  16:10    65.290 kHz    146.250000 MHz
    GTF     :  1024x768    72.000073 Hz   4:3     57.672 kHz     78.434000 MHz
  Detailed Timing Descriptors:
    DTD 1:  1680x1050   59.954250 Hz  16:10    65.290 kHz    146.250000 MHz (440 mm x 325 mm)
                 Hfront  104 Hsync 176 Hback  280 Hpol N
                 Vfront    3 Vsync   6 Vback   30 Vpol P
    Display Product Serial Number: ...
    Display Range Limits:
      Monitor ranges (GTF): 60-75 Hz V, 30-83 kHz H, max dotclock 140 MHz
    Display Product Name: '931Wx'
Checksum: 0xb6

----------------

Warnings:

Block 0, Base EDID:
  Detailed Timing Descriptor #1: Image size is 440x325 mm, but based on the picture AR it should be 440x275 mm.
EDID:
  Base EDID: Some timings are out of range of the Monitor Ranges:
    Maximum Clock: 146.250 MHz (Monitor: 140.000 MHz)
    Could be due to a Monitor Range off-by-one rounding issue

Failures:

EDID:
  Extension Block 1 started with EDID header, ignoring Extension Blocks >= 1.

EDID conformity: FAIL
