edid-decode (hex):

00 ff ff ff ff ff ff 00 22 0e 0a 36 00 00 00 00
17 1d 01 04 b5 47 28 78 3b f8 a5 a6 56 4e a1 25
0d 50 54 a1 08 00 d1 c0 a9 c0 81 c0 d1 00 b3 00
95 00 81 80 a9 40 56 5e 00 a0 a0 a0 29 50 30 20
35 00 c5 8f 21 00 00 1a 00 00 00 fd 00 26 4c 18
70 22 01 0a 20 20 20 20 20 20 00 00 00 fc 00 48
50 20 33 32 20 51 48 44 0a 20 20 20 00 00 00 ff
00 43 4e 4b 39 32 33 31 47 4b 43 0a 20 20 01 f2

02 03 16 f1 49 10 1f 04 13 03 12 02 11 01 23 09
07 07 83 01 00 00 02 3a 80 18 71 38 2d 40 58 2c
45 00 c5 8f 21 00 00 1e 02 3a 80 d0 72 38 2d 40
10 2c 45 80 c5 8f 21 00 00 1e d9 76 00 a0 a0 a0
34 50 30 20 35 00 c5 8f 21 00 00 1a 00 00 00 00
00 00 00 00 00 00 00 00 00 00 00 00 00 00 00 00
00 00 00 00 00 00 00 00 00 00 00 00 00 00 00 00
00 00 00 00 00 00 00 00 00 00 00 00 00 00 00 3a

00 ff ff ff ff ff ff 00 22 0e 0a 36 00 00 00 00
17 1d 01 04 b5 47 28 78 3b f8 a5 a6 56 4e a1 25
0d 50 54 a1 08 00 d1 c0 a9 c0 81 c0 d1 00 b3 00
95 00 81 80 a9 40 56 5e 00 a0 a0 a0 29 50 30 20
35 00 c5 8f 21 00 00 1a 00 00 00 fd 00 26 4c 18
70 22 01 0a 20 20 20 20 20 20 00 00 00 fc 00 48
50 20 33 32 20 51 48 44 0a 20 20 20 00 00 00 ff
00 43 4e 4b 39 32 33 31 47 4b 43 0a 20 20 01 f2

02 03 16 f1 49 10 1f 04 13 03 12 02 11 01 23 09
07 07 83 01 00 00 02 3a 80 18 71 38 2d 40 58 2c
45 00 c5 8f 21 00 00 1e 02 3a 80 d0 72 38 2d 40
10 2c 45 80 c5 8f 21 00 00 1e d9 76 00 a0 a0 a0
34 50 30 20 35 00 c5 8f 21 00 00 1a 00 00 00 00
00 00 00 00 00 00 00 00 00 00 00 00 00 00 00 00
00 00 00 00 00 00 00 00 00 00 00 00 00 00 00 00
00 00 00 00 00 00 00 00 00 00 00 00 00 00 00 3a

----------------

Block 0, Base EDID:
  EDID Structure Version & Revision: 1.4
  Vendor & Product Identification:
    Manufacturer: HPN
    Model: 13834
    Made in: week 23 of 2019
  Basic Display Parameters & Features:
    Digital display
    Bits per primary color channel: 10
    DisplayPort interface
    Maximum image size: 71 cm x 40 cm
    Gamma: 2.20
    DPMS levels: Off
    Supported color formats: RGB 4:4:4, YCrCb 4:4:4, YCrCb 4:2:2
    First detailed timing includes the native pixel format and preferred refresh rate
    Display supports continuous frequencies
  Color Characteristics:
    Red  : 0.6513, 0.3388
    Green: 0.3066, 0.6289
    Blue : 0.1464, 0.0527
    White: 0.3134, 0.3291
  Established Timings I & II:
    IBM     :   720x400    70.081663 Hz   9:5     31.467 kHz     28.320000 MHz
    DMT 0x04:   640x480    59.940476 Hz   4:3     31.469 kHz     25.175000 MHz
    DMT 0x09:   800x600    60.316541 Hz   4:3     37.879 kHz     40.000000 MHz
    DMT 0x10:  1024x768    60.003840 Hz   4:3     48.363 kHz     65.000000 MHz
  Standard Timings:
    DMT 0x52:  1920x1080   60.000000 Hz  16:9     67.500 kHz    148.500000 MHz
    DMT 0x53:  1600x900    60.000000 Hz  16:9     60.000 kHz    108.000000 MHz (RB)
    DMT 0x55:  1280x720    60.000000 Hz  16:9     45.000 kHz     74.250000 MHz
    DMT 0x45:  1920x1200   59.884600 Hz  16:10    74.556 kHz    193.250000 MHz
    DMT 0x3a:  1680x1050   59.954250 Hz  16:10    65.290 kHz    146.250000 MHz
    DMT 0x2f:  1440x900    59.887445 Hz  16:10    55.935 kHz    106.500000 MHz
    DMT 0x23:  1280x1024   60.019740 Hz   5:4     63.981 kHz    108.000000 MHz
    DMT 0x33:  1600x1200   60.000000 Hz   4:3     75.000 kHz    162.000000 MHz
  Detailed Timing Descriptors:
    DTD 1:  2560x1440   59.950550 Hz  16:9     88.787 kHz    241.500000 MHz (709 mm x 399 mm)
                 Hfront   48 Hsync  32 Hback   80 Hpol P
                 Vfront    3 Vsync   5 Vback   33 Vpol N
    Display Range Limits:
      Monitor ranges (Range Limits Only): 38-76 Hz V, 24-112 kHz H, max dotclock 340 MHz
    Display Product Name: 'HP 32 QHD'
    Display Product Serial Number: ...
  Extension blocks: 1
Checksum: 0xf2

----------------

Block 1, CTA-861 Extension Block:
  Revision: 3
  Underscans IT Video Formats by default
  Basic audio support
  Supports YCbCr 4:4:4
  Supports YCbCr 4:2:2
  Native DTDs: 1
  Video Data Block:
    VIC  16:  1920x1080   60.000000 Hz  16:9     67.500 kHz    148.500000 MHz
    VIC  31:  1920x1080   50.000000 Hz  16:9     56.250 kHz    148.500000 MHz
    VIC   4:  1280x720    60.000000 Hz  16:9     45.000 kHz     74.250000 MHz
    VIC  19:  1280x720    50.000000 Hz  16:9     37.500 kHz     74.250000 MHz
    VIC   3:   720x480    59.940060 Hz  16:9     31.469 kHz     27.000000 MHz
    VIC  18:   720x576    50.000000 Hz  16:9     31.250 kHz     27.000000 MHz
    VIC   2:   720x480    59.940060 Hz   4:3     31.469 kHz     27.000000 MHz
    VIC  17:   720x576    50.000000 Hz   4:3     31.250 kHz     27.000000 MHz
    VIC   1:   640x480    59.940476 Hz   4:3     31.469 kHz     25.175000 MHz
  Audio Data Block:
    Linear PCM:
      Max channels: 2
      Supported sample rates (kHz): 48 44.1 32
      Supported sample sizes (bits): 24 20 16
  Speaker Allocation Data Block:
    FL/FR - Front Left/Right
  Detailed Timing Descriptors:
    DTD 2:  1920x1080   60.000000 Hz  16:9     67.500 kHz    148.500000 MHz (709 mm x 399 mm)
                 Hfront   88 Hsync  44 Hback  148 Hpol P
                 Vfront    4 Vsync   5 Vback   36 Vpol P
    DTD 3:  1920x1080   50.000000 Hz  16:9     56.250 kHz    148.500000 MHz (709 mm x 399 mm)
                 Hfront  528 Hsync  44 Hback  148 Hpol P
                 Vfront    4 Vsync   5 Vback   36 Vpol P
    DTD 4:  2560x1440   74.970923 Hz  16:9    111.857 kHz    304.250000 MHz (709 mm x 399 mm)
                 Hfront   48 Hsync  32 Hback   80 Hpol P
                 Vfront    3 Vsync   5 Vback   44 Vpol N
Checksum: 0x3a  Unused space in Extension Block: 51 bytes

----------------

Warnings:

Block 1, CTA-861 Extension Block:
  Video Data Block: VIC 16 and the first DTD are not identical. Is this intended?
  Add a Colorimetry Data Block with the sRGB colorimetry bit set to avoid interop issues.

Failures:

Block 1, CTA-861 Extension Block:
  Missing VCDB, needed for Set Selectable RGB Quantization to avoid interop issues.
EDID:
  Extension Block 2 started with EDID header, ignoring Extension Blocks >= 2.

EDID conformity: FAIL
