edid-decode (hex):

00 ff ff ff ff ff ff 00 06 af a7 7a 00 00 00 00
25 20 01 04 b5 1f 14 78 03 ee 95 a3 54 4c 99 26
0f 50 54 00 00 00 01 01 01 01 01 01 01 01 01 01
01 01 01 01 01 01 d1 9f 00 a2 a0 40 46 60 30 20
35 00 38 c3 10 00 00 18 00 00 00 fd 00 28 5a 97
97 29 01 0a 20 20 20 20 20 20 00 00 00 fe 00 41
55 4f 0a 20 20 20 20 20 20 20 20 20 00 00 00 fe
00 42 31 34 35 51 41 4e 30 31 2e 48 20 0a 00 92

00 ff ff ff ff ff ff 00 06 af a7 7a 00 00 00 00
25 20 01 04 b5 1f 14 78 03 ee 95 a3 54 4c 99 26
0f 50 54 00 00 00 01 01 01 01 01 01 01 01 01 01
01 01 01 01 01 01 d1 9f 00 a2 a0 40 46 60 30 20
35 00 38 c3 10 00 00 18 00 00 00 fd 00 28 5a 97
97 29 01 0a 20 20 20 20 20 20 00 00 00 fe 00 41
55 4f 0a 20 20 20 20 20 20 20 20 20 00 00 00 fe
00 42 31 34 35 51 41 4e 30 31 2e 48 20 0a 00 92

----------------

Block 0, Base EDID:
  EDID Structure Version & Revision: 1.4
  Vendor & Product Identification:
    Manufacturer: AUO
    Model: 31399
    Made in: week 37 of 2022
  Basic Display Parameters & Features:
    Digital display
    Bits per primary color channel: 10
    DisplayPort interface
    Maximum image size: 31 cm x 20 cm
    Gamma: 2.20
    Supported color formats: RGB 4:4:4
    First detailed timing includes the native pixel format and preferred refresh rate
    Display supports continuous frequencies
  Color Characteristics:
    Red  : 0.6396, 0.3300
    Green: 0.2998, 0.5996
    Blue : 0.1503, 0.0595
    White: 0.3134, 0.3291
  Established Timings I & II: none
  Standard Timings: none
  Detailed Timing Descriptors:
    DTD 1:  2560x1600   90.002948 Hz  16:10   150.305 kHz    409.130000 MHz (312 mm x 195 mm)
                 Hfront   48 Hsync  32 Hback   82 Hpol N
                 Vfront    3 Vsync   5 Vback   62 Vpol N
    Display Range Limits:
      Monitor ranges (Range Limits Only): 40-90 Hz V, 151-151 kHz H, max dotclock 410 MHz
    Alphanumeric Data String: 'AUO'
    Alphanumeric Data String: 'B145QAN01.H '
Checksum: 0x92

----------------

Block 1, Unknown EDID Extension Block 0x00:
  00 ff ff ff ff ff ff 00 06 af a7 7a 00 00 00 00 '...........z....'
  25 20 01 04 b5 1f 14 78 03 ee 95 a3 54 4c 99 26 '% .....x....TL.&'
  0f 50 54 00 00 00 01 01 01 01 01 01 01 01 01 01 '.PT.............'
  01 01 01 01 01 01 d1 9f 00 a2 a0 40 46 60 30 20 '...........@F`0 '
  35 00 38 c3 10 00 00 18 00 00 00 fd 00 28 5a 97 '5.8..........(Z.'
  97 29 01 0a 20 20 20 20 20 20 00 00 00 fe 00 41 '.)..      .....A'
  55 4f 0a 20 20 20 20 20 20 20 20 20 00 00 00 fe 'UO.         ....'
  00 42 31 34 35 51 41 4e 30 31 2e 48 20 0a 00 92 '.B145QAN01.H ...'
Checksum: 0x92

----------------

Warnings:

Block 0, Base EDID:
  Missing Display Product Name.
EDID:
  Base EDID: Some timings are out of range of the Monitor Ranges:
    Horizontal Freq: 150.304 - 150.304 kHz (Monitor: 151.000 - 151.000 kHz)
    Could be due to a Monitor Range off-by-one rounding issue

Failures:

Block 0, Base EDID:
  Alphanumeric Data String: One or more trailing spaces before newline.
Block 1, Base EDID:
  Unknown Extension Block.
EDID:
  Base EDID: EDID specified 0 extension block(s), but found 1 extension block(s).

EDID conformity: FAIL
