edid-decode (hex):

00 ff ff ff ff ff ff 00 06 af 9c 63 00 00 00 00
00 1f 01 04 a5 1f 11 78 03 f5 65 8f 55 5a 93 2a
1f 50 54 00 00 00 01 01 01 01 01 01 01 01 01 01
01 01 01 01 01 01 bf 3e 80 04 71 38 94 40 10 10
3e 00 35 ae 10 00 00 18 00 00 00 0f 00 00 00 00
00 00 00 00 00 00 00 00 00 20 00 00 00 fe 00 41
55 4f 0a 20 20 20 20 20 20 20 20 20 00 00 00 fe
00 42 31 34 30 48 41 4b 30 33 2e 36 20 0a 00 79

00 ff ff ff ff ff ff 00 06 af 9c 63 00 00 00 00
00 1f 01 04 a5 1f 11 78 03 f5 65 8f 55 5a 93 2a
1f 50 54 00 00 00 01 01 01 01 01 01 01 01 01 01
01 01 01 01 01 01 bf 3e 80 04 71 38 94 40 10 10
3e 00 35 ae 10 00 00 18 00 00 00 0f 00 00 00 00
00 00 00 00 00 00 00 00 00 20 00 00 00 fe 00 41
55 4f 0a 20 20 20 20 20 20 20 20 20 00 00 00 fe
00 42 31 34 30 48 41 4b 30 33 2e 36 20 0a 00 79

----------------

Block 0, Base EDID:
  EDID Structure Version & Revision: 1.4
  Vendor & Product Identification:
    Manufacturer: AUO
    Model: 25500
    Made in: 2021
  Basic Display Parameters & Features:
    Digital display
    Bits per primary color channel: 8
    DisplayPort interface
    Maximum image size: 31 cm x 17 cm
    Gamma: 2.20
    Supported color formats: RGB 4:4:4
    First detailed timing includes the native pixel format and preferred refresh rate
    Display supports continuous frequencies
  Color Characteristics:
    Red  : 0.5615, 0.3349
    Green: 0.3525, 0.5751
    Blue : 0.1650, 0.1230
    White: 0.3134, 0.3291
  Established Timings I & II: none
  Standard Timings: none
  Detailed Timing Descriptors:
    DTD 1:  1920x1080   60.002839 Hz  16:9     73.683 kHz    160.630000 MHz (309 mm x 174 mm)
                 Hfront   16 Hsync  16 Hback  228 Hpol N
                 Vfront    3 Vsync  14 Vback  131 Vpol N
    Manufacturer-Specified Display Descriptor (0x0f): 00 0f 00 00 00 00 00 00 00 00 00 00 00 00 00 20 '............... '
    Alphanumeric Data String: 'AUO'
    Alphanumeric Data String: 'B140HAK03.6 '
Checksum: 0x79

----------------

Warnings:

Block 0, Base EDID:
  Missing Display Product Name.

Failures:

Block 0, Base EDID:
  Alphanumeric Data String: One or more trailing spaces before newline.
  Missing Display Range Limits Descriptor.
EDID:
  Extension Block 1 started with EDID header, ignoring Extension Blocks >= 1.

EDID conformity: FAIL
