edid-decode (hex):

00 ff ff ff ff ff ff 00 36 69 c2 5b ff ff ff ff
0e 23 01 03 80 36 1f 78 ee ee 91 a3 54 4c 99 26
0f 50 54 3f cf 00 81 80 95 00 b3 00 01 01 01 01
01 01 01 01 01 01 02 3a 80 18 71 38 2d 40 58 2c
45 00 1f 2e 21 00 00 1e 00 00 00 fd 00 30 c8 1e
e6 32 00 0a 20 20 20 20 20 20 00 00 00 fc 00 4d
41 47 20 32 35 35 46 20 45 32 30 0a 00 00 00 ff
00 42 43 32 4d 34 39 35 34 30 30 32 34 36 01 9b

02 03 46 f1 4a 90 01 02 03 04 11 12 13 1f 3f 23
09 07 07 83 01 00 00 e2 00 ca e3 05 e3 01 67 03
0c 00 10 00 38 42 6a d8 5d c4 01 78 80 03 08 30
c8 6d 1a 00 00 02 01 30 c8 e6 00 00 00 00 00 e6
06 07 01 5e 5e 25 f2 94 80 a0 70 38 1f 40 20 40
45 00 1f 2e 21 00 00 1e 56 a2 80 a0 70 38 1e 40
30 30 45 00 1f 2e 21 00 00 1e 60 b4 80 a0 70 38
1e 40 20 40 45 00 1f 2e 21 00 00 1e 00 00 00 e2

00 ff ff ff ff ff ff 00 36 69 c2 5b ff ff ff ff
0e 23 01 03 80 36 1f 78 ee ee 91 a3 54 4c 99 26
0f 50 54 3f cf 00 81 80 95 00 b3 00 01 01 01 01
01 01 01 01 01 01 02 3a 80 18 71 38 2d 40 58 2c
45 00 1f 2e 21 00 00 1e 00 00 00 fd 00 30 c8 1e
e6 32 00 0a 20 20 20 20 20 20 00 00 00 fc 00 4d
41 47 20 32 35 35 46 20 45 32 30 0a 00 00 00 ff
00 42 43 32 4d 34 39 35 34 30 30 32 34 36 01 9b

02 03 46 f1 4a 90 01 02 03 04 11 12 13 1f 3f 23
09 07 07 83 01 00 00 e2 00 ca e3 05 e3 01 67 03
0c 00 10 00 38 42 6a d8 5d c4 01 78 80 03 08 30
c8 6d 1a 00 00 02 01 30 c8 e6 00 00 00 00 00 e6
06 07 01 5e 5e 25 f2 94 80 a0 70 38 1f 40 20 40
45 00 1f 2e 21 00 00 1e 56 a2 80 a0 70 38 1e 40
30 30 45 00 1f 2e 21 00 00 1e 60 b4 80 a0 70 38
1e 40 20 40 45 00 1f 2e 21 00 00 1e 00 00 00 e2

----------------

Block 0, Base EDID:
  EDID Structure Version & Revision: 1.3
  Vendor & Product Identification:
    Manufacturer: MSI
    Model: 23490
    Serial Number: ...
    Made in: week 14 of 2025
  Basic Display Parameters & Features:
    Digital display
    Maximum image size: 54 cm x 31 cm
    Gamma: 2.20
    DPMS levels: Standby Suspend Off
    RGB color display
    Default (sRGB) color space is primary color space
    First detailed timing is the preferred timing
  Color Characteristics:
    Red  : 0.6396, 0.3300
    Green: 0.2998, 0.5996
    Blue : 0.1503, 0.0595
    White: 0.3125, 0.3291
  Established Timings I & II:
    DMT 0x04:   640x480    59.940476 Hz   4:3     31.469 kHz     25.175000 MHz
    Apple   :   640x480    66.666667 Hz   4:3     35.000 kHz     30.240000 MHz
    DMT 0x05:   640x480    72.808802 Hz   4:3     37.861 kHz     31.500000 MHz
    DMT 0x06:   640x480    75.000000 Hz   4:3     37.500 kHz     31.500000 MHz
    DMT 0x08:   800x600    56.250000 Hz   4:3     35.156 kHz     36.000000 MHz
    DMT 0x09:   800x600    60.316541 Hz   4:3     37.879 kHz     40.000000 MHz
    DMT 0x0a:   800x600    72.187572 Hz   4:3     48.077 kHz     50.000000 MHz
    DMT 0x0b:   800x600    75.000000 Hz   4:3     46.875 kHz     49.500000 MHz
    DMT 0x10:  1024x768    60.003840 Hz   4:3     48.363 kHz     65.000000 MHz
    DMT 0x11:  1024x768    70.069359 Hz   4:3     56.476 kHz     75.000000 MHz
    DMT 0x12:  1024x768    75.028582 Hz   4:3     60.023 kHz     78.750000 MHz
    DMT 0x24:  1280x1024   75.024675 Hz   5:4     79.976 kHz    135.000000 MHz
  Standard Timings:
    DMT 0x23:  1280x1024   60.019740 Hz   5:4     63.981 kHz    108.000000 MHz
    DMT 0x2f:  1440x900    59.887445 Hz  16:10    55.935 kHz    106.500000 MHz
    DMT 0x3a:  1680x1050   59.954250 Hz  16:10    65.290 kHz    146.250000 MHz
  Detailed Timing Descriptors:
    DTD 1:  1920x1080   60.000000 Hz  16:9     67.500 kHz    148.500000 MHz (543 mm x 302 mm)
                 Hfront   88 Hsync  44 Hback  148 Hpol P
                 Vfront    4 Vsync   5 Vback   36 Vpol P
    Display Range Limits:
      Monitor ranges (GTF): 48-200 Hz V, 30-230 kHz H, max dotclock 500 MHz
    Display Product Name: 'MAG 255F E20'
    Display Product Serial Number: ...
  Extension blocks: 1
Checksum: 0x9b

----------------

Block 1, CTA-861 Extension Block:
  Revision: 3
  Underscans IT Video Formats by default
  Basic audio support
  Supports YCbCr 4:4:4
  Supports YCbCr 4:2:2
  Native DTDs: 1
  Video Data Block:
    VIC  16:  1920x1080   60.000000 Hz  16:9     67.500 kHz    148.500000 MHz (native)
    VIC   1:   640x480    59.940476 Hz   4:3     31.469 kHz     25.175000 MHz
    VIC   2:   720x480    59.940060 Hz   4:3     31.469 kHz     27.000000 MHz
    VIC   3:   720x480    59.940060 Hz  16:9     31.469 kHz     27.000000 MHz
    VIC   4:  1280x720    60.000000 Hz  16:9     45.000 kHz     74.250000 MHz
    VIC  17:   720x576    50.000000 Hz   4:3     31.250 kHz     27.000000 MHz
    VIC  18:   720x576    50.000000 Hz  16:9     31.250 kHz     27.000000 MHz
    VIC  19:  1280x720    50.000000 Hz  16:9     37.500 kHz     74.250000 MHz
    VIC  31:  1920x1080   50.000000 Hz  16:9     56.250 kHz    148.500000 MHz
    VIC  63:  1920x1080  120.000000 Hz  16:9    135.000 kHz    297.000000 MHz
  Audio Data Block:
    Linear PCM:
      Max channels: 2
      Supported sample rates (kHz): 48 44.1 32
      Supported sample sizes (bits): 24 20 16
  Speaker Allocation Data Block:
    FL/FR - Front Left/Right
  Video Capability Data Block:
    YCbCr quantization: Selectable (via AVI YQ)
    RGB quantization: Selectable (via AVI Q)
    PT scan behavior: No Data
    IT scan behavior: Always Underscanned
    CE scan behavior: Always Underscanned
  Colorimetry Data Block:
    xvYCC601
    xvYCC709
    BT2020cYCC
    BT2020YCC
    BT2020RGB
    Gamut Boundary Description Metadata Profile P0
  Vendor-Specific Data Block (HDMI), OUI 00-0C-03:
    Source physical address: 1.0.0.0
    DC_36bit
    DC_30bit
    DC_Y444
    Maximum TMDS clock: 330 MHz
  Vendor-Specific Data Block (HDMI Forum), OUI C4-5D-D8:
    Version: 1
    Maximum TMDS Character Rate: 600 MHz
    SCDC Present
    Supports 12-bits/component Deep Color 4:2:0 Pixel Encoding
    Supports 10-bits/component Deep Color 4:2:0 Pixel Encoding
    Supports negative Mvrr values
    VRRmin: 48 Hz
    VRRmax: 200 Hz
  Vendor-Specific Data Block (AMD), OUI 00-00-1A:
    Version: 2
    Feature Caps: 0x01
    Minimum Refresh Rate: 48 Hz
    Maximum Refresh Rate: 200 Hz
    Flags 1.x: 0xe6 (MCCS)
    Flags 2.x: 0x00
  HDR Static Metadata Data Block:
    Electro optical transfer functions:
      Traditional gamma - SDR luminance range
      Traditional gamma - HDR luminance range
      SMPTE ST2084
    Supported static metadata descriptors:
      Static metadata type 1
    Desired content max luminance: 94 (383.041 cd/m^2)
    Desired content max frame-average luminance: 94 (383.041 cd/m^2)
    Desired content min luminance: 37 (0.081 cd/m^2)
  Detailed Timing Descriptors:
    DTD 2:  1920x1080  165.002077 Hz  16:9    183.317 kHz    381.300000 MHz (543 mm x 302 mm)
                 Hfront   32 Hsync  64 Hback   64 Hpol P
                 Vfront    4 Vsync   5 Vback   22 Vpol P
    DTD 3:  1920x1080  179.998267 Hz  16:9    199.798 kHz    415.580000 MHz (543 mm x 302 mm)
                 Hfront   48 Hsync  48 Hback   64 Hpol P
                 Vfront    4 Vsync   5 Vback   21 Vpol P
    DTD 4:  1920x1080  200.000000 Hz  16:9    222.000 kHz    461.760000 MHz (543 mm x 302 mm)
                 Hfront   32 Hsync  64 Hback   64 Hpol P
                 Vfront    4 Vsync   5 Vback   21 Vpol P
Checksum: 0xe2  Unused space in Extension Block: 3 bytes

----------------

Warnings:

Block 1, CTA-861 Extension Block:
  Display Product Serial Number is set, so the Serial Number in the Base EDID should be 0.

Failures:

EDID:
  Extension Block 2 started with EDID header, ignoring Extension Blocks >= 2.

EDID conformity: FAIL
