edid-decode (hex):

00 ff ff ff ff ff ff 00 06 af ad 83 00 00 00 00
1b 21 01 04 a5 1e 13 78 03 0f 85 ae 52 43 b0 26
0e 50 54 00 00 00 01 01 01 01 01 01 01 01 01 01
01 01 01 01 01 01 17 88 40 a0 b0 08 6e 70 30 20
35 00 2d bc 10 00 00 18 ba 5a 40 a0 b0 08 6e 70
30 20 35 00 2d bc 10 00 00 18 00 00 00 fd 00 28
3c 73 73 23 01 0a 20 20 20 20 20 20 00 00 00 fe
00 42 31 34 30 51 41 4e 30 34 2e 53 20 0a 00 5c

00 ff ff ff ff ff ff 00 06 af ad 83 00 00 00 00
1b 21 01 04 a5 1e 13 78 03 0f 85 ae 52 43 b0 26
0e 50 54 00 00 00 01 01 01 01 01 01 01 01 01 01
01 01 01 01 01 01 17 88 40 a0 b0 08 6e 70 30 20
35 00 2d bc 10 00 00 18 ba 5a 40 a0 b0 08 6e 70
30 20 35 00 2d bc 10 00 00 18 00 00 00 fd 00 28
3c 73 73 23 01 0a 20 20 20 20 20 20 00 00 00 fe
00 42 31 34 30 51 41 4e 30 34 2e 53 20 0a 00 5c

----------------

Block 0, Base EDID:
  EDID Structure Version & Revision: 1.4
  Vendor & Product Identification:
    Manufacturer: AUO
    Model: 33709
    Made in: week 27 of 2023
  Basic Display Parameters & Features:
    Digital display
    Bits per primary color channel: 8
    DisplayPort interface
    Maximum image size: 30 cm x 19 cm
    Gamma: 2.20
    Supported color formats: RGB 4:4:4
    First detailed timing includes the native pixel format and preferred refresh rate
    Display supports continuous frequencies
  Color Characteristics:
    Red  : 0.6796, 0.3203
    Green: 0.2646, 0.6904
    Blue : 0.1503, 0.0546
    White: 0.3134, 0.3291
  Established Timings I & II: none
  Standard Timings: none
  Detailed Timing Descriptors:
    DTD 1:  2880x1800   60.001033 Hz  16:10   114.602 kHz    348.390000 MHz (301 mm x 188 mm)
                 Hfront   48 Hsync  32 Hback   80 Hpol N
                 Vfront    3 Vsync   5 Vback  102 Vpol N
    DTD 2:  2880x1800   40.000689 Hz  16:10    76.401 kHz    232.260000 MHz (301 mm x 188 mm)
                 Hfront   48 Hsync  32 Hback   80 Hpol N
                 Vfront    3 Vsync   5 Vback  102 Vpol N
    Display Range Limits:
      Monitor ranges (Range Limits Only): 40-60 Hz V, 115-115 kHz H, max dotclock 350 MHz
    Alphanumeric Data String: 'B140QAN04.S '
Checksum: 0x5c

----------------

Warnings:

Block 0, Base EDID:
  Missing Display Product Name.
EDID:
  Base EDID: Some timings are out of range of the Monitor Ranges:
    Horizontal Freq: 76.401 - 114.601 kHz (Monitor: 115.000 - 115.000 kHz)

Failures:

Block 0, Base EDID:
  Alphanumeric Data String: One or more trailing spaces before newline.
EDID:
  Extension Block 1 started with EDID header, ignoring Extension Blocks >= 1.

EDID conformity: FAIL
