edid-decode (hex):

00 ff ff ff ff ff ff 00 4e 14 b9 0a 01 00 00 00
15 1e 01 04 b5 3c 21 78 3b 2a b5 a5 55 38 b9 25
0a 50 54 af cf 00 71 4f 81 c0 81 40 81 80 95 00
a9 c0 b3 00 d1 c0 6a 5e 00 a0 a0 a0 29 50 30 20
35 00 55 50 21 00 00 1a 00 00 00 fd 00 30 90 d6
d6 3c 01 0a 20 20 20 20 20 20 00 00 00 fc 00 53
63 65 70 74 72 65 20 59 32 37 0a 20 00 00 00 ff
00 4d 58 59 32 37 35 42 49 47 30 30 30 31 01 c0

02 03 3d f1 4d 01 02 03 04 05 11 12 13 14 1f 90
5a 3f 23 09 07 07 83 01 00 00 6d 1a 00 00 02 01
30 90 00 00 00 00 00 00 e3 05 e3 01 e6 06 07 01
65 59 1e e2 00 c0 e6 11 02 03 04 10 11 fa bd 00
a0 a0 a0 32 50 08 40 35 00 55 50 21 00 00 1a 61
38 00 18 51 a0 66 50 20 28 55 00 55 50 21 00 00
1a 9e e0 00 78 a0 a0 32 50 10 40 35 00 55 50 21
00 00 1a 00 00 00 00 00 00 00 00 00 00 00 00 10

00 ff ff ff ff ff ff 00 4e 14 b9 0a 01 00 00 00
15 1e 01 04 b5 3c 21 78 3b 2a b5 a5 55 38 b9 25
0a 50 54 af cf 00 71 4f 81 c0 81 40 81 80 95 00
a9 c0 b3 00 d1 c0 6a 5e 00 a0 a0 a0 29 50 30 20
35 00 55 50 21 00 00 1a 00 00 00 fd 00 30 90 d6
d6 3c 01 0a 20 20 20 20 20 20 00 00 00 fc 00 53
63 65 70 74 72 65 20 59 32 37 0a 20 00 00 00 ff
00 4d 58 59 32 37 35 42 49 47 30 30 30 31 01 c0

02 03 3d f1 4d 01 02 03 04 05 11 12 13 14 1f 90
5a 3f 23 09 07 07 83 01 00 00 6d 1a 00 00 02 01
30 90 00 00 00 00 00 00 e3 05 e3 01 e6 06 07 01
65 59 1e e2 00 c0 e6 11 02 03 04 10 11 fa bd 00
a0 a0 a0 32 50 08 40 35 00 55 50 21 00 00 1a 61
38 00 18 51 a0 66 50 20 28 55 00 55 50 21 00 00
1a 9e e0 00 78 a0 a0 32 50 10 40 35 00 55 50 21
00 00 1a 00 00 00 00 00 00 00 00 00 00 00 00 10

----------------

Block 0, Base EDID:
  EDID Structure Version & Revision: 1.4
  Vendor & Product Identification:
    Manufacturer: SPT
    Model: 2745
    Serial Number: ...
    Made in: week 21 of 2020
  Basic Display Parameters & Features:
    Digital display
    Bits per primary color channel: 10
    DisplayPort interface
    Maximum image size: 60 cm x 33 cm
    Gamma: 2.20
    DPMS levels: Off
    Supported color formats: RGB 4:4:4, YCrCb 4:4:4, YCrCb 4:2:2
    First detailed timing includes the native pixel format and preferred refresh rate
    Display supports continuous frequencies
  Color Characteristics:
    Red  : 0.6445, 0.3339
    Green: 0.2207, 0.7246
    Blue : 0.1464, 0.0419
    White: 0.3134, 0.3291
  Established Timings I & II:
    IBM     :   720x400    70.081663 Hz   9:5     31.467 kHz     28.320000 MHz
    DMT 0x04:   640x480    59.940476 Hz   4:3     31.469 kHz     25.175000 MHz
    DMT 0x05:   640x480    72.808802 Hz   4:3     37.861 kHz     31.500000 MHz
    DMT 0x06:   640x480    75.000000 Hz   4:3     37.500 kHz     31.500000 MHz
    DMT 0x08:   800x600    56.250000 Hz   4:3     35.156 kHz     36.000000 MHz
    DMT 0x09:   800x600    60.316541 Hz   4:3     37.879 kHz     40.000000 MHz
    DMT 0x0a:   800x600    72.187572 Hz   4:3     48.077 kHz     50.000000 MHz
    DMT 0x0b:   800x600    75.000000 Hz   4:3     46.875 kHz     49.500000 MHz
    DMT 0x10:  1024x768    60.003840 Hz   4:3     48.363 kHz     65.000000 MHz
    DMT 0x11:  1024x768    70.069359 Hz   4:3     56.476 kHz     75.000000 MHz
    DMT 0x12:  1024x768    75.028582 Hz   4:3     60.023 kHz     78.750000 MHz
    DMT 0x24:  1280x1024   75.024675 Hz   5:4     79.976 kHz    135.000000 MHz
  Standard Timings:
    DMT 0x15:  1152x864    75.000000 Hz   4:3     67.500 kHz    108.000000 MHz
    DMT 0x55:  1280x720    60.000000 Hz  16:9     45.000 kHz     74.250000 MHz
    DMT 0x20:  1280x960    60.000000 Hz   4:3     60.000 kHz    108.000000 MHz
    DMT 0x23:  1280x1024   60.019740 Hz   5:4     63.981 kHz    108.000000 MHz
    DMT 0x2f:  1440x900    59.887445 Hz  16:10    55.935 kHz    106.500000 MHz
    DMT 0x53:  1600x900    60.000000 Hz  16:9     60.000 kHz    108.000000 MHz (RB)
    DMT 0x3a:  1680x1050   59.954250 Hz  16:10    65.290 kHz    146.250000 MHz
    DMT 0x52:  1920x1080   60.000000 Hz  16:9     67.500 kHz    148.500000 MHz
  Detailed Timing Descriptors:
    DTD 1:  2560x1440   60.000199 Hz  16:9     88.860 kHz    241.700000 MHz (597 mm x 336 mm)
                 Hfront   48 Hsync  32 Hback   80 Hpol P
                 Vfront    3 Vsync   5 Vback   33 Vpol N
    Display Range Limits:
      Monitor ranges (Range Limits Only): 48-144 Hz V, 214-214 kHz H, max dotclock 600 MHz
    Display Product Name: 'Sceptre Y27'
    Display Product Serial Number: ...
  Extension blocks: 1
Checksum: 0xc0

----------------

Block 1, CTA-861 Extension Block:
  Revision: 3
  Underscans IT Video Formats by default
  Basic audio support
  Supports YCbCr 4:4:4
  Supports YCbCr 4:2:2
  Native DTDs: 1
  Video Data Block:
    VIC   1:   640x480    59.940476 Hz   4:3     31.469 kHz     25.175000 MHz
    VIC   2:   720x480    59.940060 Hz   4:3     31.469 kHz     27.000000 MHz
    VIC   3:   720x480    59.940060 Hz  16:9     31.469 kHz     27.000000 MHz
    VIC   4:  1280x720    60.000000 Hz  16:9     45.000 kHz     74.250000 MHz
    VIC   5:  1920x1080i  60.000000 Hz  16:9     33.750 kHz     74.250000 MHz
    VIC  17:   720x576    50.000000 Hz   4:3     31.250 kHz     27.000000 MHz
    VIC  18:   720x576    50.000000 Hz  16:9     31.250 kHz     27.000000 MHz
    VIC  19:  1280x720    50.000000 Hz  16:9     37.500 kHz     74.250000 MHz
    VIC  20:  1920x1080i  50.000000 Hz  16:9     28.125 kHz     74.250000 MHz
    VIC  31:  1920x1080   50.000000 Hz  16:9     56.250 kHz    148.500000 MHz
    VIC  16:  1920x1080   60.000000 Hz  16:9     67.500 kHz    148.500000 MHz (native)
    VIC  90:  2560x1080   60.000000 Hz  64:27    66.000 kHz    198.000000 MHz
    VIC  63:  1920x1080  120.000000 Hz  16:9    135.000 kHz    297.000000 MHz
  Audio Data Block:
    Linear PCM:
      Max channels: 2
      Supported sample rates (kHz): 48 44.1 32
      Supported sample sizes (bits): 24 20 16
  Speaker Allocation Data Block:
    FL/FR - Front Left/Right
  Vendor-Specific Data Block (AMD), OUI 00-00-1A:
    Version: 2
    Feature Caps: 0x01
    Minimum Refresh Rate: 48 Hz
    Maximum Refresh Rate: 144 Hz
    Flags 1.x: 0x00
    Flags 2.x: 0x00
  Colorimetry Data Block:
    xvYCC601
    xvYCC709
    BT2020cYCC
    BT2020YCC
    BT2020RGB
    Gamut Boundary Description Metadata Profile P0
  HDR Static Metadata Data Block:
    Electro optical transfer functions:
      Traditional gamma - SDR luminance range
      Traditional gamma - HDR luminance range
      SMPTE ST2084
    Supported static metadata descriptors:
      Static metadata type 1
    Desired content max luminance: 101 (445.755 cd/m^2)
    Desired content max frame-average luminance: 89 (343.724 cd/m^2)
    Desired content min luminance: 30 (0.062 cd/m^2)
  Video Capability Data Block:
    YCbCr quantization: Selectable (via AVI YQ)
    RGB quantization: Selectable (via AVI Q)
    PT scan behavior: No Data
    IT scan behavior: IT video formats not supported
    CE scan behavior: CE video formats not supported
  Vendor-Specific Audio Data Block, OUI 04-03-02:
    10 11                                           '..'
  Detailed Timing Descriptors:
    DTD 2:  2560x1440  120.000987 Hz  16:9    178.801 kHz    486.340000 MHz (597 mm x 336 mm)
                 Hfront    8 Hsync  64 Hback   88 Hpol P
                 Vfront    3 Vsync   5 Vback   42 Vpol N
    DTD 3:  1280x1440   59.999501 Hz   8:9     92.519 kHz    144.330000 MHz (597 mm x 336 mm)
                 Hfront   32 Hsync  40 Hback  208 Hpol P
                 Vfront    5 Vsync   5 Vback   92 Vpol N
    DTD 4:  2560x1440  143.999800 Hz  16:9    214.560 kHz    575.020000 MHz (597 mm x 336 mm)
                 Hfront   16 Hsync  64 Hback   40 Hpol P
                 Vfront    3 Vsync   5 Vback   42 Vpol N
Checksum: 0x10  Unused space in Extension Block: 12 bytes

----------------

Warnings:

Block 0, Base EDID:
  Vendor & Product Identification: The serial number is one of the known dummy values, it should probably be set to 0.
Block 1, CTA-861 Extension Block:
  Video Data Block: VIC 1 and the first DTD are not identical. Is this intended?
  Colorimetry Data Block: Set the sRGB colorimetry bit to avoid interop issues.
  Video Capability Data Block: IT scan behavior is expected to support underscanned.
  Video Capability Data Block: 'CE video formats not supported' makes no sense.
  Detailed Timing Descriptor #3: Image size is 597x336 mm, but based on the picture AR it should be 298x336 mm.
  Display Product Serial Number is set, so the Serial Number in the Base EDID should be 0.
EDID:
  Base EDID: Some timings are out of range of the Monitor Ranges:
    Horizontal Freq: 28.125 - 214.559 kHz (Monitor: 214.000 - 214.000 kHz)

Failures:

EDID:
  Extension Block 2 started with EDID header, ignoring Extension Blocks >= 2.
  CTA-861: Native progressive timings are a mix of several resolutions.

EDID conformity: FAIL
