edid-decode (hex):

00 ff ff ff ff ff ff 00 4e 14 b9 0a 01 00 00 00
15 1e 01 03 80 3c 21 78 ae 2a b5 a5 55 38 b9 25
0a 50 54 a5 4b 00 81 c0 81 80 95 00 a9 c0 b3 00
d1 c0 81 40 71 4f 6a 5e 00 a0 a0 a0 29 50 30 20
35 00 55 50 21 00 00 1a 00 00 00 fd 00 30 78 47
d6 1e 00 0a 20 20 20 20 20 20 00 00 00 fc 00 53
63 65 70 74 72 65 20 59 32 37 0a 20 00 00 00 ff
00 4d 58 58 32 37 35 42 49 47 30 30 30 31 01 d8

02 03 3c f1 4d 01 02 03 04 05 11 12 13 14 1f 90
5a 3f 23 09 07 07 83 01 00 00 68 03 0c 00 30 00
38 42 00 6d 1a 00 00 02 01 30 78 ed 00 00 00 00
00 e3 05 e3 01 e6 06 07 01 65 59 1f 80 48 80 18
71 38 2d 40 58 2c 45 00 b9 88 21 00 00 1a 61 38
00 18 51 a0 66 50 20 28 55 00 b9 88 21 00 00 1a
fe 74 00 78 a0 a0 32 50 30 20 35 00 b9 88 21 00
00 1a 00 00 00 00 00 00 00 00 00 00 00 00 00 6c

00 ff ff ff ff ff ff 00 4e 14 b9 0a 01 00 00 00
15 1e 01 03 80 3c 21 78 ae 2a b5 a5 55 38 b9 25
0a 50 54 a5 4b 00 81 c0 81 80 95 00 a9 c0 b3 00
d1 c0 81 40 71 4f 6a 5e 00 a0 a0 a0 29 50 30 20
35 00 55 50 21 00 00 1a 00 00 00 fd 00 30 78 47
d6 1e 00 0a 20 20 20 20 20 20 00 00 00 fc 00 53
63 65 70 74 72 65 20 59 32 37 0a 20 00 00 00 ff
00 4d 58 58 32 37 35 42 49 47 30 30 30 31 01 d8

02 03 3c f1 4d 01 02 03 04 05 11 12 13 14 1f 90
5a 3f 23 09 07 07 83 01 00 00 68 03 0c 00 30 00
38 42 00 6d 1a 00 00 02 01 30 78 ed 00 00 00 00
00 e3 05 e3 01 e6 06 07 01 65 59 1f 80 48 80 18
71 38 2d 40 58 2c 45 00 b9 88 21 00 00 1a 61 38
00 18 51 a0 66 50 20 28 55 00 b9 88 21 00 00 1a
fe 74 00 78 a0 a0 32 50 30 20 35 00 b9 88 21 00
00 1a 00 00 00 00 00 00 00 00 00 00 00 00 00 6c

----------------

Block 0, Base EDID:
  EDID Structure Version & Revision: 1.3
  Vendor & Product Identification:
    Manufacturer: SPT
    Model: 2745
    Serial Number: ...
    Made in: week 21 of 2020
  Basic Display Parameters & Features:
    Digital display
    Maximum image size: 60 cm x 33 cm
    Gamma: 2.20
    DPMS levels: Standby Off
    RGB color display
    Default (sRGB) color space is primary color space
    First detailed timing is the preferred timing
  Color Characteristics:
    Red  : 0.6445, 0.3339
    Green: 0.2207, 0.7246
    Blue : 0.1464, 0.0419
    White: 0.3134, 0.3291
  Established Timings I & II:
    IBM     :   720x400    70.081663 Hz   9:5     31.467 kHz     28.320000 MHz
    DMT 0x04:   640x480    59.940476 Hz   4:3     31.469 kHz     25.175000 MHz
    DMT 0x06:   640x480    75.000000 Hz   4:3     37.500 kHz     31.500000 MHz
    DMT 0x09:   800x600    60.316541 Hz   4:3     37.879 kHz     40.000000 MHz
    DMT 0x0b:   800x600    75.000000 Hz   4:3     46.875 kHz     49.500000 MHz
    DMT 0x10:  1024x768    60.003840 Hz   4:3     48.363 kHz     65.000000 MHz
    DMT 0x12:  1024x768    75.028582 Hz   4:3     60.023 kHz     78.750000 MHz
    DMT 0x24:  1280x1024   75.024675 Hz   5:4     79.976 kHz    135.000000 MHz
  Standard Timings:
    DMT 0x55:  1280x720    60.000000 Hz  16:9     45.000 kHz     74.250000 MHz
    DMT 0x23:  1280x1024   60.019740 Hz   5:4     63.981 kHz    108.000000 MHz
    DMT 0x2f:  1440x900    59.887445 Hz  16:10    55.935 kHz    106.500000 MHz
    DMT 0x53:  1600x900    60.000000 Hz  16:9     60.000 kHz    108.000000 MHz (RB)
    DMT 0x3a:  1680x1050   59.954250 Hz  16:10    65.290 kHz    146.250000 MHz
    DMT 0x52:  1920x1080   60.000000 Hz  16:9     67.500 kHz    148.500000 MHz
    DMT 0x20:  1280x960    60.000000 Hz   4:3     60.000 kHz    108.000000 MHz
    DMT 0x15:  1152x864    75.000000 Hz   4:3     67.500 kHz    108.000000 MHz
  Detailed Timing Descriptors:
    DTD 1:  2560x1440   60.000199 Hz  16:9     88.860 kHz    241.700000 MHz (597 mm x 336 mm)
                 Hfront   48 Hsync  32 Hback   80 Hpol P
                 Vfront    3 Vsync   5 Vback   33 Vpol N
    Display Range Limits:
      Monitor ranges (GTF): 48-120 Hz V, 71-214 kHz H, max dotclock 300 MHz
    Display Product Name: 'Sceptre Y27'
    Display Product Serial Number: ...
  Extension blocks: 1
Checksum: 0xd8

----------------

Block 1, CTA-861 Extension Block:
  Revision: 3
  Underscans IT Video Formats by default
  Basic audio support
  Supports YCbCr 4:4:4
  Supports YCbCr 4:2:2
  Native DTDs: 1
  Video Data Block:
    VIC   1:   640x480    59.940476 Hz   4:3     31.469 kHz     25.175000 MHz
    VIC   2:   720x480    59.940060 Hz   4:3     31.469 kHz     27.000000 MHz
    VIC   3:   720x480    59.940060 Hz  16:9     31.469 kHz     27.000000 MHz
    VIC   4:  1280x720    60.000000 Hz  16:9     45.000 kHz     74.250000 MHz
    VIC   5:  1920x1080i  60.000000 Hz  16:9     33.750 kHz     74.250000 MHz
    VIC  17:   720x576    50.000000 Hz   4:3     31.250 kHz     27.000000 MHz
    VIC  18:   720x576    50.000000 Hz  16:9     31.250 kHz     27.000000 MHz
    VIC  19:  1280x720    50.000000 Hz  16:9     37.500 kHz     74.250000 MHz
    VIC  20:  1920x1080i  50.000000 Hz  16:9     28.125 kHz     74.250000 MHz
    VIC  31:  1920x1080   50.000000 Hz  16:9     56.250 kHz    148.500000 MHz
    VIC  16:  1920x1080   60.000000 Hz  16:9     67.500 kHz    148.500000 MHz (native)
    VIC  90:  2560x1080   60.000000 Hz  64:27    66.000 kHz    198.000000 MHz
    VIC  63:  1920x1080  120.000000 Hz  16:9    135.000 kHz    297.000000 MHz
  Audio Data Block:
    Linear PCM:
      Max channels: 2
      Supported sample rates (kHz): 48 44.1 32
      Supported sample sizes (bits): 24 20 16
  Speaker Allocation Data Block:
    FL/FR - Front Left/Right
  Vendor-Specific Data Block (HDMI), OUI 00-0C-03:
    Source physical address: 3.0.0.0
    DC_36bit
    DC_30bit
    DC_Y444
    Maximum TMDS clock: 330 MHz
  Vendor-Specific Data Block (AMD), OUI 00-00-1A:
    Version: 2
    Flags 1: 0x01
      FreeSync Supported
    Minimum Refresh Rate: 48 Hz
    Maximum Refresh Rate: 120 Hz
    MCCS VCP Code: 0xed
    Flags 5: 0x00
  Colorimetry Data Block:
    xvYCC601
    xvYCC709
    BT2020cYCC
    BT2020YCC
    BT2020RGB
    Gamut Boundary Description Metadata Profile P0
  HDR Static Metadata Data Block:
    Electro optical transfer functions:
      Traditional gamma - SDR luminance range
      Traditional gamma - HDR luminance range
      SMPTE ST2084
    Supported static metadata descriptors:
      Static metadata type 1
    Desired content max luminance: 101 (445.755 cd/m^2)
    Desired content max frame-average luminance: 89 (343.724 cd/m^2)
    Desired content min luminance: 31 (0.066 cd/m^2)
  Detailed Timing Descriptors:
    DTD 2:  1920x1080   74.989899 Hz  16:9     84.364 kHz    185.600000 MHz (697 mm x 392 mm)
                 Hfront   88 Hsync  44 Hback  148 Hpol P
                 Vfront    4 Vsync   5 Vback   36 Vpol N
    DTD 3:  1280x1440   59.999501 Hz   8:9     92.519 kHz    144.330000 MHz (697 mm x 392 mm)
                 Hfront   32 Hsync  40 Hback  208 Hpol P
                 Vfront    5 Vsync   5 Vback   92 Vpol N
    DTD 4:  2560x1440   75.002504 Hz  16:9    111.754 kHz    299.500000 MHz (697 mm x 392 mm)
                 Hfront   48 Hsync  32 Hback   40 Hpol P
                 Vfront    3 Vsync   5 Vback   42 Vpol N
Checksum: 0x6c  Unused space in Extension Block: 13 bytes

----------------

Warnings:

Block 0, Base EDID:
  Vendor & Product Identification: The serial number is one of the known dummy values, it should probably be set to 0.
Block 1, CTA-861 Extension Block:
  Video Data Block: VIC 1 and the first DTD are not identical. Is this intended?
  Detailed Timing Descriptor #3: Image size is 697x392 mm, but based on the picture AR it should be 348x392 mm.
  Display Product Serial Number is set, so the Serial Number in the Base EDID should be 0.
EDID:
  Base EDID: Some timings are out of range of the Monitor Ranges:
    Horizontal Freq: 28.125 - 135.000 kHz (Monitor: 71.000 - 214.000 kHz)

Failures:

Block 0, Base EDID:
  Basic Display Parameters & Features: sRGB is signaled, but the chromaticities do not match.
Block 1, CTA-861 Extension Block:
  Detailed Timing Descriptor #2: Mismatch of image size 697x392 mm vs display size 600x330 mm.
  Detailed Timing Descriptor #3: Mismatch of image size 697x392 mm vs display size 600x330 mm.
  Detailed Timing Descriptor #4: Mismatch of image size 697x392 mm vs display size 600x330 mm.
  Missing VCDB, needed for Set Selectable RGB Quantization to avoid interop issues.
EDID:
  Extension Block 2 started with EDID header, ignoring Extension Blocks >= 2.
  Base EDID: The DTD max image size is 697x392mm, which is larger than the display size 600.0x330.0mm.
  CTA-861: Native progressive timings are a mix of several resolutions.

EDID conformity: FAIL
