edid-decode (hex):

00 ff ff ff ff ff ff 00 4c a3 58 32 00 00 00 00
00 11 01 03 80 25 17 78 0a 87 f5 94 57 4f 8c 27
27 50 54 00 00 00 01 01 01 01 01 01 01 01 01 01
01 01 01 01 01 01 b3 25 a0 40 51 84 0c 30 40 20
33 00 6f e6 10 00 00 19 00 00 00 0f 00 00 00 00
00 00 00 00 00 78 e6 02 23 00 00 00 00 fe 00 46
57 37 35 38 02 31 37 30 58 32 0a 20 00 00 00 fe
00 25 35 40 48 67 8d c5 ff 02 01 0a 20 20 00 18

----------------

Block 0, Base EDID:
  EDID Structure Version & Revision: 1.3
  Vendor & Product Identification:
    Manufacturer: SEC
    Model: 12888
    Made in: 2007
  Basic Display Parameters & Features:
    Digital display
    Maximum image size: 37 cm x 23 cm
    Gamma: 2.20
    RGB color display
    First detailed timing is the preferred timing
  Color Characteristics:
    Red  : 0.5800, 0.3398
    Green: 0.3095, 0.5498
    Blue : 0.1552, 0.1552
    White: 0.3134, 0.3291
  Established Timings I & II: none
  Standard Timings: none
  Detailed Timing Descriptors:
    DTD 1:  1440x900    60.126346 Hz  16:10    54.835 kHz     96.510000 MHz (367 mm x 230 mm)
                 Hfront   64 Hsync  32 Hback  224 Hpol N
                 Vfront    3 Vsync   3 Vback    6 Vpol N
    Manufacturer-Specified Display Descriptor (0x0f): 00 0f 00 00 00 00 00 00 00 00 00 78 e6 02 23 00 '...........x..#.'
    Alphanumeric Data String: 'FW758.170X2'
    Alphanumeric Data String: '%5@Hg..'
Checksum: 0x18

----------------

Warnings:

Block 0, Base EDID:
  Alphanumeric Data String: Non-ASCII character 0x02 at position 5, can cause problems.
  Alphanumeric Data String: Non-ASCII character 0x8d at position 5, can cause problems.
  Alphanumeric Data String: Non-ASCII character 0xc5 at position 6, can cause problems.

Failures:

Block 0, Base EDID:
  Alphanumeric Data String: 0xff byte at position 7.
  Missing Display Product Name.
  Missing Display Range Limits Descriptor.

EDID conformity: FAIL
