edid-decode (hex):

00 ff ff ff ff ff ff 00 30 e4 d9 04 00 00 00 00
00 19 01 04 a5 22 13 78 ea e0 35 a3 55 4f 9c 27
0d 50 54 00 00 00 01 01 01 01 01 01 01 01 01 01
01 01 01 01 01 01 5f d1 00 b4 f0 70 3e 80 3c 24
35 00 58 c2 10 00 00 1a 80 a7 00 b4 f0 70 3e 80
3c 24 35 00 58 c2 10 00 00 1a 00 00 00 fe 00 35
33 46 43 34 80 31 35 36 55 44 32 0a 00 00 00 00
00 02 41 31 9e 11 10 00 00 0b 01 0a 20 20 00 91

----------------

Block 0, Base EDID:
  EDID Structure Version & Revision: 1.4
  Vendor & Product Identification:
    Manufacturer: LGD
    Model: 1241
    Made in: 2015
  Basic Display Parameters & Features:
    Digital display
    Bits per primary color channel: 8
    DisplayPort interface
    Maximum image size: 34 cm x 19 cm
    Gamma: 2.20
    DPMS levels: Standby Suspend Off
    Supported color formats: RGB 4:4:4, YCrCb 4:4:4
    First detailed timing includes the native pixel format and preferred refresh rate
  Color Characteristics:
    Red  : 0.6396, 0.3339
    Green: 0.3085, 0.6093
    Blue : 0.1523, 0.0537
    White: 0.3134, 0.3291
  Established Timings I & II: none
  Standard Timings: none
  Detailed Timing Descriptors:
    DTD 1:  3840x2160   60.004881 Hz  16:9    133.331 kHz    535.990000 MHz (344 mm x 194 mm)
                 Hfront   60 Hsync  36 Hback   84 Hpol P
                 Vfront    3 Vsync   5 Vback   54 Vpol N
    DTD 2:  3840x2160   48.004800 Hz  16:9    106.667 kHz    428.800000 MHz (344 mm x 194 mm)
                 Hfront   60 Hsync  36 Hback   84 Hpol P
                 Vfront    3 Vsync   5 Vback   54 Vpol N
    Alphanumeric Data String: '53FC4.156UD2'
    Manufacturer-Specified Display Descriptor (0x00): 00 00 00 02 41 31 9e 11 10 00 00 0b 01 0a 20 20 '....A1........  '
Checksum: 0x91

----------------

Warnings:

Block 0, Base EDID:
  Alphanumeric Data String: Non-ASCII character 0x80 at position 5, can cause problems.
  Missing Display Product Name.

EDID conformity: PASS
