edid-decode (hex):

00 ff ff ff ff ff ff 00 26 cf 44 8c 00 00 00 00
00 1f 01 04 a5 1e 13 78 e3 76 90 94 55 54 90 27
21 50 54 00 00 00 01 01 01 01 01 01 01 01 01 01
01 01 01 01 01 01 35 3c 80 a0 70 b0 23 40 18 30
6c 00 2e bd 10 00 00 19 00 00 00 fd 00 28 3c 4a
4a 0f 01 0a 20 20 20 20 20 20 00 00 00 fe 00 49
6e 66 6f 56 69 73 69 6f 6e 0a 20 20 00 00 00 fe
00 52 31 34 30 4e 57 34 44 20 52 35 20 0a 00 53

00 ff ff ff ff ff ff 00 26 cf 44 8c 00 00 00 00
00 1f 01 04 a5 1e 13 78 e3 76 90 94 55 54 90 27
21 50 54 00 00 00 01 01 01 01 01 01 01 01 01 01
01 01 01 01 01 01 35 3c 80 a0 70 b0 23 40 18 30
6c 00 2e bd 10 00 00 19 00 00 00 fd 00 28 3c 4a
4a 0f 01 0a 20 20 20 20 20 20 00 00 00 fe 00 49
6e 66 6f 56 69 73 69 6f 6e 0a 20 20 00 00 00 fe
00 52 31 34 30 4e 57 34 44 20 52 35 20 0a 00 53

----------------

Block 0, Base EDID:
  EDID Structure Version & Revision: 1.4
  Vendor & Product Identification:
    Manufacturer: IVO
    Model: 35908
    Made in: 2021
  Basic Display Parameters & Features:
    Digital display
    Bits per primary color channel: 8
    DisplayPort interface
    Maximum image size: 30 cm x 19 cm
    Gamma: 2.20
    DPMS levels: Standby Suspend Off
    Supported color formats: RGB 4:4:4
    First detailed timing includes the native pixel format and preferred refresh rate
    Display supports continuous frequencies
  Color Characteristics:
    Red  : 0.5791, 0.3349
    Green: 0.3291, 0.5644
    Blue : 0.1542, 0.1298
    White: 0.3125, 0.3281
  Established Timings I & II: none
  Standard Timings: none
  Detailed Timing Descriptors:
    DTD 1:  1920x1200   60.000779 Hz  16:10    74.101 kHz    154.130000 MHz (302 mm x 189 mm)
                 Hfront   24 Hsync  48 Hback   88 Hpol N
                 Vfront    6 Vsync  12 Vback   17 Vpol N
    Display Range Limits:
      Monitor ranges (Range Limits Only): 40-60 Hz V, 74-74 kHz H, max dotclock 150 MHz
    Alphanumeric Data String: 'InfoVision'
    Alphanumeric Data String: 'R140NW4D R5 '
Checksum: 0x53

----------------

Block 1, Unknown EDID Extension Block 0x00:
  00 ff ff ff ff ff ff 00 26 cf 44 8c 00 00 00 00 '........&.D.....'
  00 1f 01 04 a5 1e 13 78 e3 76 90 94 55 54 90 27 '.......x.v..UT.''
  21 50 54 00 00 00 01 01 01 01 01 01 01 01 01 01 '!PT.............'
  01 01 01 01 01 01 35 3c 80 a0 70 b0 23 40 18 30 '......5<..p.#@.0'
  6c 00 2e bd 10 00 00 19 00 00 00 fd 00 28 3c 4a 'l............(<J'
  4a 0f 01 0a 20 20 20 20 20 20 00 00 00 fe 00 49 'J...      .....I'
  6e 66 6f 56 69 73 69 6f 6e 0a 20 20 00 00 00 fe 'nfoVision.  ....'
  00 52 31 34 30 4e 57 34 44 20 52 35 20 0a 00 53 '.R140NW4D R5 ..S'
Checksum: 0x53

----------------

Warnings:

Block 0, Base EDID:
  Missing Display Product Name.
EDID:
  Base EDID: Some timings are out of range of the Monitor Ranges:
    Maximum Clock: 154.130 MHz (Monitor: 150.000 MHz)
    Could be due to a Monitor Range off-by-one rounding issue

Failures:

Block 0, Base EDID:
  Alphanumeric Data String: One or more trailing spaces before newline.
Block 1, Base EDID:
  Unknown Extension Block.
EDID:
  Base EDID: EDID specified 0 extension block(s), but found 1 extension block(s).

EDID conformity: FAIL
