edid-decode (hex):

00 ff ff ff ff ff ff 00 21 2b 10 00 31 30 30 30
1f 18 01 04 08 4f 00 78 2a a2 20 a6 56 48 9a 24
12 50 54 21 08 00 81 c0 81 40 81 80 95 00 b3 00
a9 c0 81 00 01 01 02 3a 80 18 71 38 2d 40 58 2c
45 00 dd 0c 11 00 00 1e 66 21 56 aa 51 00 1e 30
46 8f 33 00 dd 0c 11 00 00 1f 00 00 00 fc 00 48
49 4b 56 49 53 49 4f 4e 20 20 20 20 00 00 00 ff
00 41 50 57 42 32 48 41 30 32 35 33 30 30 00 8a

00 ff ff ff ff ff ff 00 21 2b 10 00 31 30 30 30
1f 18 01 04 08 4f 00 78 2a a2 20 a6 56 48 9a 24
12 50 54 21 08 00 81 c0 81 40 81 80 95 00 b3 00
a9 c0 81 00 01 01 02 3a 80 18 71 38 2d 40 58 2c
45 00 dd 0c 11 00 00 1e 66 21 56 aa 51 00 1e 30
46 8f 33 00 dd 0c 11 00 00 1f 00 00 00 fc 00 48
49 4b 56 49 53 49 4f 4e 20 20 20 20 00 00 00 ff
00 41 50 57 42 32 48 41 30 32 35 33 30 30 00 8a

----------------

Block 0, Base EDID:
  EDID Structure Version & Revision: 1.4
  Vendor & Product Identification:
    Manufacturer: HIK
    Model: 16
    Serial Number: ...
    Made in: week 31 of 2014
  Basic Display Parameters & Features:
    Analog display
    Signal Level Standard: 0.700 : 0.300 : 1.000 V p-p
    Blank level equals black level
    Sync: Separate
    Aspect ratio: 1.78 (landscape)
    Gamma: 2.20
    DPMS levels: Off
    RGB color display
    First detailed timing includes the native pixel format and preferred refresh rate
  Color Characteristics:
    Red  : 0.6503, 0.3378
    Green: 0.2812, 0.6035
    Blue : 0.1406, 0.0722
    White: 0.3125, 0.3281
  Established Timings I & II:
    DMT 0x04:   640x480    59.940476 Hz   4:3     31.469 kHz     25.175000 MHz
    DMT 0x09:   800x600    60.316541 Hz   4:3     37.879 kHz     40.000000 MHz
    DMT 0x10:  1024x768    60.003840 Hz   4:3     48.363 kHz     65.000000 MHz
  Standard Timings:
    DMT 0x55:  1280x720    60.000000 Hz  16:9     45.000 kHz     74.250000 MHz
    DMT 0x20:  1280x960    60.000000 Hz   4:3     60.000 kHz    108.000000 MHz
    DMT 0x23:  1280x1024   60.019740 Hz   5:4     63.981 kHz    108.000000 MHz
    DMT 0x2f:  1440x900    59.887445 Hz  16:10    55.935 kHz    106.500000 MHz
    DMT 0x3a:  1680x1050   59.954250 Hz  16:10    65.290 kHz    146.250000 MHz
    DMT 0x53:  1600x900    60.000000 Hz  16:9     60.000 kHz    108.000000 MHz (RB)
    DMT 0x1c:  1280x800    59.810326 Hz  16:10    49.702 kHz     83.500000 MHz
  Detailed Timing Descriptors:
    DTD 1:  1920x1080   60.000000 Hz  16:9     67.500 kHz    148.500000 MHz (477 mm x 268 mm)
                 Hfront   88 Hsync  44 Hback  148 Hpol P
                 Vfront    4 Vsync   5 Vback   36 Vpol P
    DTD 2:  1366x768    59.789541 Hz 683:384   47.712 kHz     85.500000 MHz (477 mm x 268 mm)
                 Hfront   70 Hsync 143 Hback  213 Hpol P
                 Vfront    3 Vsync   3 Vback   24 Vpol P
    Display Product Name: 'HIKVISION    '
    Display Product Serial Number: ...
Checksum: 0x8a

----------------

Failures:

Block 0, Base EDID:
  Display Product Name: No newline, but one or more trailing spaces.
EDID:
  Extension Block 1 started with EDID header, ignoring Extension Blocks >= 1.
  Base EDID: The DTD max image size is 477x268mm, but the display size is not specified anywhere.

EDID conformity: FAIL
