edid-decode (hex):

00 ff ff ff ff ff ff 00 30 64 00 00 3d 01 01 01
1e 0c 01 03 8f 24 1b 78 e8 8a 01 9a 58 52 8b 28
1e 50 54 a1 08 00 81 c0 81 00 81 80 00 00 95 00
a9 40 b3 00 d1 c0 00 00 00 fc 00 57 55 58 47 41
20 54 46 54 20 4c 43 44 00 00 00 fd 00 3a 3e 14
4d 10 00 0a 20 20 20 20 20 20 0e 1f 00 80 51 00
1e 30 40 80 37 00 00 00 00 00 00 1e 28 3c 80 a0
70 b0 23 40 30 20 36 00 20 20 00 00 00 1e 00 df

00 ff ff ff ff ff ff 00 30 64 00 00 3d 01 01 01
1e 0c 01 03 8f 24 1b 78 e8 8a 01 9a 58 52 8b 28
1e 50 54 a1 08 00 81 c0 81 00 81 80 00 00 95 00
a9 40 b3 00 d1 c0 00 00 00 fc 00 57 55 58 47 41
20 54 46 54 20 4c 43 44 00 00 00 fd 00 3a 3e 14
4d 10 00 0a 20 20 20 20 20 20 0e 1f 00 80 51 00
1e 30 40 80 37 00 00 00 00 00 00 1e 28 3c 80 a0
70 b0 23 40 30 20 36 00 20 20 00 00 00 1e 00 df

----------------

Block 0, Base EDID:
  EDID Structure Version & Revision: 1.3
  Vendor & Product Identification:
    Manufacturer: LCD
    Model: 0
    Serial Number: ...
    Made in: week 30 of 2002
  Basic Display Parameters & Features:
    Digital display
    DFP 1.x compatible TMDS
    Maximum image size: 36 cm x 27 cm
    Gamma: 2.20
    DPMS levels: Standby Suspend Off
    RGB color display
  Color Characteristics:
    Red  : 0.6035, 0.3437
    Green: 0.3222, 0.5449
    Blue : 0.1562, 0.1171
    White: 0.3125, 0.3291
  Established Timings I & II:
    IBM     :   720x400    70.081663 Hz   9:5     31.467 kHz     28.320000 MHz
    DMT 0x04:   640x480    59.940476 Hz   4:3     31.469 kHz     25.175000 MHz
    DMT 0x09:   800x600    60.316541 Hz   4:3     37.879 kHz     40.000000 MHz
    DMT 0x10:  1024x768    60.003840 Hz   4:3     48.363 kHz     65.000000 MHz
  Standard Timings:
    DMT 0x55:  1280x720    60.000000 Hz  16:9     45.000 kHz     74.250000 MHz
    DMT 0x1c:  1280x800    59.810326 Hz  16:10    49.702 kHz     83.500000 MHz
    DMT 0x23:  1280x1024   60.019740 Hz   5:4     63.981 kHz    108.000000 MHz
    DMT 0x2f:  1440x900    59.887445 Hz  16:10    55.935 kHz    106.500000 MHz
    DMT 0x33:  1600x1200   60.000000 Hz   4:3     75.000 kHz    162.000000 MHz
    DMT 0x3a:  1680x1050   59.954250 Hz  16:10    65.290 kHz    146.250000 MHz
    DMT 0x52:  1920x1080   60.000000 Hz  16:9     67.500 kHz    148.500000 MHz
  Detailed Timing Descriptors:
    Display Product Name: 'WUXGA TFT LCD'
    Display Range Limits:
      Monitor ranges (GTF): 58-62 Hz V, 20-77 kHz H, max dotclock 160 MHz
    DTD 1:  1280x768    59.870228 Hz   5:3     47.776 kHz     79.500000 MHz
                 Hfront   64 Hsync 128 Hback  192 Hpol P
                 Vfront    3 Vsync   7 Vback   20 Vpol P
    DTD 2:  1920x1200   59.950171 Hz  16:10    74.038 kHz    154.000000 MHz (32 mm x 32 mm)
                 Hfront   48 Hsync  32 Hback   80 Hpol P
                 Vfront    3 Vsync   6 Vback   26 Vpol P
Checksum: 0xdf

----------------

Warnings:

Block 0, Base EDID:
  Detailed Timing Descriptor #1: DTD is similar but not identical to DMT 0x17.
  Detailed Timing Descriptor #2: DTD is similar but not identical to DMT 0x44.
  Detailed Timing Descriptor #2: Dubious image size (32x32 mm is smaller than 100x100 mm).
EDID:
  No Native Video Resolution was defined.
  Base EDID: Some timings are out of range of the Monitor Ranges:
    Vertical Freq: 59.810 - 70.082 Hz (Monitor: 58.000 - 62.000 Hz)
    Maximum Clock: 162.000 MHz (Monitor: 160.000 MHz)

Failures:

Block 0, Base EDID:
  Basic Display Parameters & Features: Digital Video Interface Standard set to reserved value 0x0e.
  Basic Display Parameters & Features: EDID 1.3 requires that the first detailed timing is the preferred timing.
  Standard Timings: Use 0x0101 as the invalid Standard Timings code, not 0x0000.
  Detailed Timing Descriptor #1: Mismatch of image size vs display size: image size is not set, but display size is.
  Detailed Timing Descriptor #1: Invalid detailed timing descriptor ordering.
  Detailed Timing Descriptor #2: Mismatch of image size 32x32 mm vs display size 360x270 mm.
  Detailed Timing Descriptor #2: Invalid detailed timing descriptor ordering.
EDID:
  Extension Block 1 started with EDID header, ignoring Extension Blocks >= 1.

EDID conformity: FAIL
