edid-decode (hex):

00 ff ff ff ff ff ff 00 04 72 1b 09 03 42 30 30
03 21 01 04 b5 50 21 78 3b 24 55 a8 4c 4c 9e 25
10 50 52 bf ef 80 71 4f 81 40 81 80 81 c0 81 00
95 00 b3 00 d1 c0 f5 7c 70 a0 d0 a0 29 50 30 20
35 00 1d 4e 31 00 00 1a 00 00 00 ff 00 31 33 30
33 30 34 32 30 33 33 57 30 31 00 00 00 fd 00 30
90 e6 e6 51 01 0a 20 20 20 20 20 20 00 00 00 fc
00 58 5a 33 34 32 43 55 20 50 0a 20 20 20 02 9d

02 03 35 f4 4c 01 02 03 04 05 90 11 12 13 14 1f
3f 23 09 07 07 83 01 00 00 6d 1a 00 00 02 01 30
90 00 00 00 00 00 00 e6 06 07 01 69 69 4f e3 05
c0 01 e2 00 ff 23 5a 00 70 a3 38 26 40 30 20 35
00 1d 4e 31 00 00 1e f0 d2 70 a0 d0 a0 3c 50 30
20 35 00 1d 4e 31 00 00 1e 5a 87 80 a0 70 38 4d
40 30 40 35 00 1d 4e 31 00 00 1e 20 fd 70 a0 d0
a0 3c 50 30 20 35 00 1d 4e 31 00 00 1e 00 00 21

00 ff ff ff ff ff ff 00 04 72 1b 09 03 42 30 30
03 21 01 04 b5 50 21 78 3b 24 55 a8 4c 4c 9e 25
10 50 52 bf ef 80 71 4f 81 40 81 80 81 c0 81 00
95 00 b3 00 d1 c0 f5 7c 70 a0 d0 a0 29 50 30 20
35 00 1d 4e 31 00 00 1a 00 00 00 ff 00 31 33 30
33 30 34 32 30 33 33 57 30 31 00 00 00 fd 00 30
90 e6 e6 51 01 0a 20 20 20 20 20 20 00 00 00 fc
00 58 5a 33 34 32 43 55 20 50 0a 20 20 20 02 9d

00 ff ff ff ff ff ff 00 04 72 1b 09 03 42 30 30
03 21 01 04 b5 50 21 78 3b 24 55 a8 4c 4c 9e 25
10 50 52 bf ef 80 71 4f 81 40 81 80 81 c0 81 00
95 00 b3 00 d1 c0 f5 7c 70 a0 d0 a0 29 50 30 20
35 00 1d 4e 31 00 00 1a 00 00 00 ff 00 31 33 30
33 30 34 32 30 33 33 57 30 31 00 00 00 fd 00 30
90 e6 e6 51 01 0a 20 20 20 20 20 20 00 00 00 fc
00 58 5a 33 34 32 43 55 20 50 0a 20 20 20 02 9d

02 03 35 f4 4c 01 02 03 04 05 90 11 12 13 14 1f
3f 23 09 07 07 83 01 00 00 6d 1a 00 00 02 01 30
90 00 00 00 00 00 00 e6 06 07 01 69 69 4f e3 05
c0 01 e2 00 ff 23 5a 00 70 a3 38 26 40 30 20 35
00 1d 4e 31 00 00 1e f0 d2 70 a0 d0 a0 3c 50 30
20 35 00 1d 4e 31 00 00 1e 5a 87 80 a0 70 38 4d
40 30 40 35 00 1d 4e 31 00 00 1e 20 fd 70 a0 d0
a0 3c 50 30 20 35 00 1d 4e 31 00 00 1e 00 00 21

00 ff ff ff ff ff ff 00 04 72 1b 09 03 42 30 30
03 21 01 04 b5 50 21 78 3b 24 55 a8 4c 4c 9e 25
10 50 52 bf ef 80 71 4f 81 40 81 80 81 c0 81 00
95 00 b3 00 d1 c0 f5 7c 70 a0 d0 a0 29 50 30 20
35 00 1d 4e 31 00 00 1a 00 00 00 ff 00 31 33 30
33 30 34 32 30 33 33 57 30 31 00 00 00 fd 00 30
90 e6 e6 51 01 0a 20 20 20 20 20 20 00 00 00 fc
00 58 5a 33 34 32 43 55 20 50 0a 20 20 20 02 9d

----------------

Block 0, Base EDID:
  EDID Structure Version & Revision: 1.4
  Vendor & Product Identification:
    Manufacturer: ACR
    Model: 2331
    Serial Number: ...
    Made in: week 3 of 2023
  Basic Display Parameters & Features:
    Digital display
    Bits per primary color channel: 10
    DisplayPort interface
    Maximum image size: 80 cm x 33 cm
    Gamma: 2.20
    DPMS levels: Off
    Supported color formats: RGB 4:4:4, YCrCb 4:4:4, YCrCb 4:2:2
    First detailed timing includes the native pixel format and preferred refresh rate
    Display supports continuous frequencies
  Color Characteristics:
    Red  : 0.6562, 0.2988
    Green: 0.2978, 0.6171
    Blue : 0.1455, 0.0634
    White: 0.3134, 0.3212
  Established Timings I & II:
    IBM     :   720x400    70.081663 Hz   9:5     31.467 kHz     28.320000 MHz
    DMT 0x04:   640x480    59.940476 Hz   4:3     31.469 kHz     25.175000 MHz
    Apple   :   640x480    66.666667 Hz   4:3     35.000 kHz     30.240000 MHz
    DMT 0x05:   640x480    72.808802 Hz   4:3     37.861 kHz     31.500000 MHz
    DMT 0x06:   640x480    75.000000 Hz   4:3     37.500 kHz     31.500000 MHz
    DMT 0x08:   800x600    56.250000 Hz   4:3     35.156 kHz     36.000000 MHz
    DMT 0x09:   800x600    60.316541 Hz   4:3     37.879 kHz     40.000000 MHz
    DMT 0x0a:   800x600    72.187572 Hz   4:3     48.077 kHz     50.000000 MHz
    DMT 0x0b:   800x600    75.000000 Hz   4:3     46.875 kHz     49.500000 MHz
    Apple   :   832x624    74.551266 Hz   4:3     49.726 kHz     57.284000 MHz
    DMT 0x10:  1024x768    60.003840 Hz   4:3     48.363 kHz     65.000000 MHz
    DMT 0x11:  1024x768    70.069359 Hz   4:3     56.476 kHz     75.000000 MHz
    DMT 0x12:  1024x768    75.028582 Hz   4:3     60.023 kHz     78.750000 MHz
    DMT 0x24:  1280x1024   75.024675 Hz   5:4     79.976 kHz    135.000000 MHz
    Apple   :  1152x870    75.061550 Hz 192:145   68.681 kHz    100.000000 MHz
  Standard Timings:
    DMT 0x15:  1152x864    75.000000 Hz   4:3     67.500 kHz    108.000000 MHz
    DMT 0x20:  1280x960    60.000000 Hz   4:3     60.000 kHz    108.000000 MHz
    DMT 0x23:  1280x1024   60.019740 Hz   5:4     63.981 kHz    108.000000 MHz
    DMT 0x55:  1280x720    60.000000 Hz  16:9     45.000 kHz     74.250000 MHz
    DMT 0x1c:  1280x800    59.810326 Hz  16:10    49.702 kHz     83.500000 MHz
    DMT 0x2f:  1440x900    59.887445 Hz  16:10    55.935 kHz    106.500000 MHz
    DMT 0x3a:  1680x1050   59.954250 Hz  16:10    65.290 kHz    146.250000 MHz
    DMT 0x52:  1920x1080   60.000000 Hz  16:9     67.500 kHz    148.500000 MHz
  Detailed Timing Descriptors:
    DTD 1:  3440x1440   59.998875 Hz  43:18    88.858 kHz    319.890000 MHz (797 mm x 334 mm)
                 Hfront   48 Hsync  32 Hback   80 Hpol P
                 Vfront    3 Vsync   5 Vback   33 Vpol N
    Display Product Serial Number: ...
    Display Range Limits:
      Monitor ranges (Range Limits Only): 48-144 Hz V, 230-230 kHz H, max dotclock 810 MHz
    Display Product Name: 'XZ342CU P'
  Extension blocks: 2
Checksum: 0x9d

----------------

Block 1, CTA-861 Extension Block:
  Revision: 3
  Underscans IT Video Formats by default
  Basic audio support
  Supports YCbCr 4:4:4
  Supports YCbCr 4:2:2
  Native DTDs: 4
  Video Data Block:
    VIC   1:   640x480    59.940476 Hz   4:3     31.469 kHz     25.175000 MHz
    VIC   2:   720x480    59.940060 Hz   4:3     31.469 kHz     27.000000 MHz
    VIC   3:   720x480    59.940060 Hz  16:9     31.469 kHz     27.000000 MHz
    VIC   4:  1280x720    60.000000 Hz  16:9     45.000 kHz     74.250000 MHz
    VIC   5:  1920x1080i  60.000000 Hz  16:9     33.750 kHz     74.250000 MHz
    VIC  16:  1920x1080   60.000000 Hz  16:9     67.500 kHz    148.500000 MHz (native)
    VIC  17:   720x576    50.000000 Hz   4:3     31.250 kHz     27.000000 MHz
    VIC  18:   720x576    50.000000 Hz  16:9     31.250 kHz     27.000000 MHz
    VIC  19:  1280x720    50.000000 Hz  16:9     37.500 kHz     74.250000 MHz
    VIC  20:  1920x1080i  50.000000 Hz  16:9     28.125 kHz     74.250000 MHz
    VIC  31:  1920x1080   50.000000 Hz  16:9     56.250 kHz    148.500000 MHz
    VIC  63:  1920x1080  120.000000 Hz  16:9    135.000 kHz    297.000000 MHz
  Audio Data Block:
    Linear PCM:
      Max channels: 2
      Supported sample rates (kHz): 48 44.1 32
      Supported sample sizes (bits): 24 20 16
  Speaker Allocation Data Block:
    FL/FR - Front Left/Right
  Vendor-Specific Data Block (AMD), OUI 00-00-1A:
    Version: 2
    Feature Caps: 0x01
    Minimum Refresh Rate: 48 Hz
    Maximum Refresh Rate: 144 Hz
    Flags 1.x: 0x00
    Flags 2.x: 0x00
  HDR Static Metadata Data Block:
    Electro optical transfer functions:
      Traditional gamma - SDR luminance range
      Traditional gamma - HDR luminance range
      SMPTE ST2084
    Supported static metadata descriptors:
      Static metadata type 1
    Desired content max luminance: 105 (486.099 cd/m^2)
    Desired content max frame-average luminance: 105 (486.099 cd/m^2)
    Desired content min luminance: 79 (0.467 cd/m^2)
  Colorimetry Data Block:
    BT2020YCC
    BT2020RGB
    Gamut Boundary Description Metadata Profile P0
  Video Capability Data Block:
    YCbCr quantization: Selectable (via AVI YQ)
    RGB quantization: Selectable (via AVI Q)
    PT scan behavior: Supports both over- and underscan
    IT scan behavior: Supports both over- and underscan
    CE scan behavior: Supports both over- and underscan
  Detailed Timing Descriptors:
    DTD 2:  2560x1080   59.998648 Hz  64:27    67.078 kHz    230.750000 MHz (797 mm x 334 mm)
                 Hfront   48 Hsync  32 Hback  800 Hpol P
                 Vfront    3 Vsync   5 Vback   30 Vpol P
    DTD 3:  3440x1440  100.000000 Hz  43:18   150.000 kHz    540.000000 MHz (797 mm x 334 mm)
                 Hfront   48 Hsync  32 Hback   80 Hpol P
                 Vfront    3 Vsync   5 Vback   52 Vpol P
    DTD 4:  1920x1080  143.981451 Hz  16:9    166.587 kHz    346.500000 MHz (797 mm x 334 mm)
                 Hfront   48 Hsync  64 Hback   48 Hpol P
                 Vfront    3 Vsync   5 Vback   69 Vpol P
    DTD 5:  3440x1440  120.000000 Hz  43:18   180.000 kHz    648.000000 MHz (797 mm x 334 mm)
                 Hfront   48 Hsync  32 Hback   80 Hpol P
                 Vfront    3 Vsync   5 Vback   52 Vpol P
Checksum: 0x21  Unused space in Extension Block: 2 bytes

----------------

Warnings:

Block 1, CTA-861 Extension Block:
  Video Data Block: VIC 1 and the first DTD are not identical. Is this intended?
  Video Data Block: All VICs are in ascending order, and the first (preferred) VIC <= 4, is that intended?
  Colorimetry Data Block: Set the sRGB colorimetry bit to avoid interop issues.
  Video Capability Data Block: S_PT is equal to S_IT and S_CE, so should be set to 0 instead.
  Detailed Timing Descriptor #4: Image size is 797x334 mm, but based on the picture AR it should be 593x334 mm.
  Display Product Serial Number is set, so the Serial Number in the Base EDID should be 0.
EDID:
  Base EDID: Some timings are out of range of the Monitor Ranges:
    Horizontal Freq: 28.125 - 180.000 kHz (Monitor: 230.000 - 230.000 kHz)

Failures:

EDID:
  Extension Block 2 started with EDID header, ignoring Extension Blocks >= 2.
  Base EDID: EDID specified 2 extension block(s), but found 1 extension block(s).
  CTA-861: Native progressive timings are a mix of several resolutions.

EDID conformity: FAIL
