edid-decode (hex):

00 ff ff ff ff ff ff 00 0e 77 14 15 00 00 00 00
01 23 01 04 95 22 13 78 03 2c c5 94 5c 59 95 29
1e 50 54 00 00 00 01 01 01 01 01 01 01 01 01 01
01 01 01 01 01 01 a0 56 80 18 71 38 28 40 30 20
36 00 58 c1 10 00 00 1a 00 00 00 fd 00 28 5a 54
54 13 00 0a 20 20 20 20 20 20 00 00 00 fe 00 43
53 4f 54 20 54 39 0a 20 20 20 20 20 00 00 00 fc
00 53 4e 46 36 30 31 42 53 31 2d 33 0a 20 00 5c

00 ff ff ff ff ff ff 00 0e 77 14 15 00 00 00 00
01 23 01 04 95 22 13 78 03 2c c5 94 5c 59 95 29
1e 50 54 00 00 00 01 01 01 01 01 01 01 01 01 01
01 01 01 01 01 01 a0 56 80 18 71 38 28 40 30 20
36 00 58 c1 10 00 00 1a 00 00 00 fd 00 28 5a 54
54 13 00 0a 20 20 20 20 20 20 00 00 00 fe 00 43
53 4f 54 20 54 39 0a 20 20 20 20 20 00 00 00 fc
00 53 4e 46 36 30 31 42 53 31 2d 33 0a 20 00 5c

----------------

Block 0, Base EDID:
  EDID Structure Version & Revision: 1.4
  Vendor & Product Identification:
    Manufacturer: CSW
    Model: 5396
    Made in: week 1 of 2025
  Basic Display Parameters & Features:
    Digital display
    Bits per primary color channel: 6
    DisplayPort interface
    Maximum image size: 34 cm x 19 cm
    Gamma: 2.20
    Supported color formats: RGB 4:4:4
    First detailed timing includes the native pixel format and preferred refresh rate
    Display supports continuous frequencies
  Color Characteristics:
    Red  : 0.5781, 0.3613
    Green: 0.3505, 0.5820
    Blue : 0.1630, 0.1171
    White: 0.3134, 0.3291
  Established Timings I & II: none
  Standard Timings: none
  Detailed Timing Descriptors:
    DTD 1:  1920x1080   90.000000 Hz  16:9    100.800 kHz    221.760000 MHz (344 mm x 193 mm)
                 Hfront   48 Hsync  32 Hback  200 Hpol P
                 Vfront    3 Vsync   6 Vback   31 Vpol N
    Display Range Limits:
      Monitor ranges (GTF): 40-90 Hz V, 84-84 kHz H, max dotclock 190 MHz
    Alphanumeric Data String: 'CSOT T9'
    Display Product Name: 'SNF601BS1-3'
Checksum: 0x5c

----------------

Warnings:

Block 0, Base EDID:
  Display Range Limits: GTF support is deprecated in EDID 1.4.
EDID:
  Base EDID: Some timings are out of range of the Monitor Ranges:
    Horizontal Freq: 100.800 - 100.800 kHz (Monitor: 84.000 - 84.000 kHz)
    Maximum Clock: 221.760 MHz (Monitor: 190.000 MHz)

Failures:

EDID:
  Extension Block 1 started with EDID header, ignoring Extension Blocks >= 1.

EDID conformity: FAIL
