edid-decode (hex):

00 ff ff ff ff ff ff 00 4a 8b 3b 2a 01 01 01 01
1e 13 01 03 0e 33 1d 78 ef ee 91 a3 54 4c 99 26
0f 50 54 ef ef 80 81 c0 a9 c0 d1 c0 95 00 81 40
81 80 90 40 a9 40 7d 4b 80 a0 72 b0 2d 40 50 c8
46 48 fe 22 11 00 00 1e 00 00 00 fd 00 32 55 0a
6e 15 00 0a 20 20 20 20 20 20 00 00 00 fc 00 52
54 4b 20 31 32 30 30 50 0a 20 20 20 00 00 00 ff
00 52 54 44 30 31 30 32 30 33 30 34 0a 20 00 83

00 ff ff ff ff ff ff 00 4a 8b 3b 2a 01 01 01 01
1e 13 01 03 0e 33 1d 78 ef ee 91 a3 54 4c 99 26
0f 50 54 ef ef 80 81 c0 a9 c0 d1 c0 95 00 81 40
81 80 90 40 a9 40 7d 4b 80 a0 72 b0 2d 40 50 c8
46 48 fe 22 11 00 00 1e 00 00 00 fd 00 32 55 0a
6e 15 00 0a 20 20 20 20 20 20 00 00 00 fc 00 52
54 4b 20 31 32 30 30 50 0a 20 20 20 00 00 00 ff
00 52 54 44 30 31 30 32 30 33 30 34 0a 20 00 83

----------------

Block 0, Base EDID:
  EDID Structure Version & Revision: 1.3
  Vendor & Product Identification:
    Manufacturer: RTK
    Model: 10811
    Serial Number: ...
    Made in: week 30 of 2009
  Basic Display Parameters & Features:
    Analog display
    Signal Level Standard: 0.700 : 0.300 : 1.000 V p-p
    Blank level equals black level
    Sync: Separate Composite SyncOnGreen
    Maximum image size: 51 cm x 29 cm
    Gamma: 2.20
    DPMS levels: Standby Suspend Off
    RGB color display
    Default (sRGB) color space is primary color space
    First detailed timing is the preferred timing
    Supports GTF timings within operating range
  Color Characteristics:
    Red  : 0.6396, 0.3300
    Green: 0.2998, 0.5996
    Blue : 0.1503, 0.0595
    White: 0.3125, 0.3291
  Established Timings I & II:
    IBM     :   720x400    70.081663 Hz   9:5     31.467 kHz     28.320000 MHz
    IBM     :   720x400    87.849542 Hz   9:5     39.444 kHz     35.500000 MHz
    DMT 0x04:   640x480    59.940476 Hz   4:3     31.469 kHz     25.175000 MHz
    DMT 0x05:   640x480    72.808802 Hz   4:3     37.861 kHz     31.500000 MHz
    DMT 0x06:   640x480    75.000000 Hz   4:3     37.500 kHz     31.500000 MHz
    DMT 0x08:   800x600    56.250000 Hz   4:3     35.156 kHz     36.000000 MHz
    DMT 0x09:   800x600    60.316541 Hz   4:3     37.879 kHz     40.000000 MHz
    DMT 0x0a:   800x600    72.187572 Hz   4:3     48.077 kHz     50.000000 MHz
    DMT 0x0b:   800x600    75.000000 Hz   4:3     46.875 kHz     49.500000 MHz
    Apple   :   832x624    74.551266 Hz   4:3     49.726 kHz     57.284000 MHz
    DMT 0x10:  1024x768    60.003840 Hz   4:3     48.363 kHz     65.000000 MHz
    DMT 0x11:  1024x768    70.069359 Hz   4:3     56.476 kHz     75.000000 MHz
    DMT 0x12:  1024x768    75.028582 Hz   4:3     60.023 kHz     78.750000 MHz
    DMT 0x24:  1280x1024   75.024675 Hz   5:4     79.976 kHz    135.000000 MHz
    Apple   :  1152x870    75.061550 Hz 192:145   68.681 kHz    100.000000 MHz
  Standard Timings:
    DMT 0x55:  1280x720    60.000000 Hz  16:9     45.000 kHz     74.250000 MHz
    DMT 0x53:  1600x900    60.000000 Hz  16:9     60.000 kHz    108.000000 MHz (RB)
    DMT 0x52:  1920x1080   60.000000 Hz  16:9     67.500 kHz    148.500000 MHz
    DMT 0x2f:  1440x900    59.887445 Hz  16:10    55.935 kHz    106.500000 MHz
    DMT 0x20:  1280x960    60.000000 Hz   4:3     60.000 kHz    108.000000 MHz
    DMT 0x23:  1280x1024   60.019740 Hz   5:4     63.981 kHz    108.000000 MHz
    DMT 0x2a:  1400x1050   59.978442 Hz   4:3     65.317 kHz    121.750000 MHz
    DMT 0x33:  1600x1200   60.000000 Hz   4:3     75.000 kHz    162.000000 MHz
  Detailed Timing Descriptors:
    DTD 1:  1920x1200   59.884600 Hz  16:10    74.556 kHz    193.250000 MHz (510 mm x 290 mm)
                 Hfront  336 Hsync 200 Hback  136 Hpol P
                 Vfront   36 Vsync   6 Vback    3 Vpol P
    Display Range Limits:
      Monitor ranges (GTF): 50-85 Hz V, 10-110 kHz H, max dotclock 210 MHz
    Display Product Name: 'RTK 1200P'
    Display Product Serial Number: ...
Checksum: 0x83

----------------

Warnings:

Block 0, Base EDID:
  Vendor & Product Identification: The serial number is one of the known dummy values, it should probably be set to 0.
  Detailed Timing Descriptor #1: DTD is similar but not identical to DMT 0x45.
  Detailed Timing Descriptor #1: Image size is 510x290 mm, but based on the picture AR it should be 464x290 mm.
EDID:
  Base EDID: Some timings are out of range of the Monitor Ranges:
    Vertical Freq: 56.250 - 87.850 Hz (Monitor: 50.000 - 85.000 Hz)

Failures:

EDID:
  Extension Block 1 started with EDID header, ignoring Extension Blocks >= 1.

EDID conformity: FAIL
