edid-decode (hex):

00 ff ff ff ff ff ff 00 4e 84 30 00 01 00 00 00
00 16 01 03 80 73 41 78 0a cf 74 a3 57 4c b0 23
09 48 4c a1 08 00 81 c0 81 80 81 40 01 01 01 01
01 01 01 01 01 01 84 21 56 b0 51 00 1b 30 70 00
62 11 c4 8e 21 00 00 1e 52 35 80 80 70 38 1f 40
20 2c 62 01 c4 8e 21 00 00 1e 9a 29 a0 d0 51 84
22 30 98 e8 69 01 c4 8e 21 00 00 1c 34 21 50 b0
51 00 1b 30 70 00 62 11 c4 8e 21 00 00 1e 01 c2

02 03 24 f2 4c 01 02 03 84 05 07 10 12 93 14 16
1f 26 09 17 07 11 17 50 83 01 00 00 67 03 0c 00
10 00 38 29 8c 0a d0 8a 20 e0 2d 10 10 3e 96 00
c4 8e 21 00 00 18 8c 0a d0 90 20 40 31 20 0c 40
55 00 c4 8e 21 00 00 18 01 1d 00 bc 52 d0 1e 20
b8 28 55 40 c4 8e 21 00 00 1e 01 1d 80 d0 72 1c
16 20 10 2c 25 80 c4 8e 21 00 00 9e 8c 0a d0 8a
20 e0 2d 10 10 3e 96 00 13 8e 21 00 00 18 00 17

----------------

Block 0, Base EDID:
  EDID Structure Version & Revision: 1.3
  Vendor & Product Identification:
    Manufacturer: STD
    Model: 48
    Serial Number: ...
    Made in: 2012
  Basic Display Parameters & Features:
    Digital display
    Maximum image size: 115 cm x 65 cm
    Gamma: 2.20
    RGB color display
    First detailed timing is the preferred timing
  Color Characteristics:
    Red  : 0.6396, 0.3398
    Green: 0.2998, 0.6904
    Blue : 0.1376, 0.0380
    White: 0.2822, 0.2968
  Established Timings I & II:
    IBM     :   720x400    70.081663 Hz   9:5     31.467 kHz     28.320000 MHz
    DMT 0x04:   640x480    59.940476 Hz   4:3     31.469 kHz     25.175000 MHz
    DMT 0x09:   800x600    60.316541 Hz   4:3     37.879 kHz     40.000000 MHz
    DMT 0x10:  1024x768    60.003840 Hz   4:3     48.363 kHz     65.000000 MHz
  Standard Timings:
    DMT 0x55:  1280x720    60.000000 Hz  16:9     45.000 kHz     74.250000 MHz
    DMT 0x23:  1280x1024   60.019740 Hz   5:4     63.981 kHz    108.000000 MHz
    DMT 0x20:  1280x960    60.000000 Hz   4:3     60.000 kHz    108.000000 MHz
  Detailed Timing Descriptors:
    DTD 1:  1366x768    60.024765 Hz 683:384   47.720 kHz     85.800000 MHz (708 mm x 398 mm)
                 Hfront  112 Hsync 256 Hback   64 Hpol P
                 Vfront    6 Vsync  18 Vback    3 Vpol P
    DTD 2:  1920x1080   59.991351 Hz  16:9     66.650 kHz    136.500000 MHz (708 mm x 398 mm)
                 Hfront   32 Hsync  44 Hback   52 Hpol P
                 Vfront    6 Vsync  18 Vback    7 Vpol P
    DTD 3:  1440x900    59.887445 Hz  16:10    55.935 kHz    106.500000 MHz (708 mm x 398 mm)
                 Hfront  152 Hsync 232 Hback   80 Hpol N
                 Vfront    6 Vsync  25 Vback    3 Vpol P
    DTD 4:  1360x768    59.664196 Hz  85:48    47.433 kHz     85.000000 MHz (708 mm x 398 mm)
                 Hfront  112 Hsync 256 Hback   64 Hpol P
                 Vfront    6 Vsync  18 Vback    3 Vpol P
  Extension blocks: 1
Checksum: 0xc2

----------------

Block 1, CTA-861 Extension Block:
  Revision: 3
  Underscans IT Video Formats by default
  Basic audio support
  Supports YCbCr 4:4:4
  Supports YCbCr 4:2:2
  Native detailed modes: 2
  Video Data Block:
    VIC   1:   640x480    59.940476 Hz   4:3     31.469 kHz     25.175000 MHz
    VIC   2:   720x480    59.940060 Hz   4:3     31.469 kHz     27.000000 MHz
    VIC   3:   720x480    59.940060 Hz  16:9     31.469 kHz     27.000000 MHz
    VIC   4:  1280x720    60.000000 Hz  16:9     45.000 kHz     74.250000 MHz (native)
    VIC   5:  1920x1080i  60.000000 Hz  16:9     33.750 kHz     74.250000 MHz
    VIC   7:  1440x480i   59.940060 Hz  16:9     15.734 kHz     27.000000 MHz
    VIC  16:  1920x1080   60.000000 Hz  16:9     67.500 kHz    148.500000 MHz
    VIC  18:   720x576    50.000000 Hz  16:9     31.250 kHz     27.000000 MHz
    VIC  19:  1280x720    50.000000 Hz  16:9     37.500 kHz     74.250000 MHz (native)
    VIC  20:  1920x1080i  50.000000 Hz  16:9     28.125 kHz     74.250000 MHz
    VIC  22:  1440x576i   50.000000 Hz  16:9     15.625 kHz     27.000000 MHz
    VIC  31:  1920x1080   50.000000 Hz  16:9     56.250 kHz    148.500000 MHz
  Audio Data Block:
    Linear PCM:
      Max channels: 2
      Supported sample rates (kHz): 96 48 44.1 32
      Supported sample sizes (bits): 24 20 16
    AC-3:
      Max channels: 2
      Supported sample rates (kHz): 96 48 44.1 32
      Maximum bit rate: 640 kb/s
  Speaker Allocation Data Block:
    FL/FR - Front Left/Right
  Vendor-Specific Data Block (HDMI), OUI 00-0C-03:
    Source physical address: 1.0.0.0
    DC_36bit
    DC_30bit
    DC_Y444
    Maximum TMDS clock: 205 MHz
  Detailed Timing Descriptors:
    DTD 5:   720x480    59.940060 Hz   3:2     31.469 kHz     27.000000 MHz (708 mm x 398 mm)
                 Hfront   16 Hsync  62 Hback   60 Hpol N
                 Vfront    9 Vsync   6 Vback   30 Vpol N
    DTD 6:   720x576    50.000000 Hz   5:4     31.250 kHz     27.000000 MHz (708 mm x 398 mm)
                 Hfront   12 Hsync  64 Hback   68 Hpol N
                 Vfront    5 Vsync   5 Vback   39 Vpol N
    DTD 7:  1280x720    50.000000 Hz  16:9     37.500 kHz     74.250000 MHz (708 mm x 398 mm)
                 Hfront  440 Hsync  40 Hback  220 Hpol P
                 Vfront    5 Vsync   5 Vback   20 Vpol P
    DTD 8:  1920x1080i  50.000000 Hz  16:9     28.125 kHz     74.250000 MHz (708 mm x 398 mm)
                 Hfront  528 Hsync  44 Hback  148 Hpol P
                 Vfront    2 Vsync   5 Vback   15 Vpol P Vfront +0.5 Odd Field
                 Vfront    2 Vsync   5 Vback   15 Vpol P Vback  +0.5 Even Field
    DTD 9:   720x480    59.940060 Hz   3:2     31.469 kHz     27.000000 MHz (531 mm x 398 mm)
                 Hfront   16 Hsync  62 Hback   60 Hpol N
                 Vfront    9 Vsync   6 Vback   30 Vpol N
Checksum: 0x17  Unused space in Extension Block: 1 byte

----------------

Warnings:

Block 0, Base EDID:
  Vendor & Product Identification: The serial number is one of the known dummy values, it should probably be set to 0.
  Detailed Timing Descriptor #3: DTD is similar but not identical to DMT 0x2f.
  Detailed Timing Descriptor #3: Image size is 708x398 mm, but based on the picture AR it should be 708x442 mm.
Block 1, CTA-861 Extension Block:
  Video Data Block: VIC 1 and the first DTD are not identical. Is this intended?
  Video Data Block: All VICs are in ascending order, and the first (preferred) VIC <= 4, is that intended?
  Detailed Timing Descriptor #5: Image size is 708x398 mm, but based on the picture AR it should be 708x472 mm.
  Detailed Timing Descriptor #6: Image size is 708x398 mm, but based on the picture AR it should be 708x566 mm.
  Detailed Timing Descriptor #9: Image size is 531x398 mm, but based on the picture AR it should be 531x354 mm.
  Add a Colorimetry Data Block with the sRGB colorimetry bit set to avoid interop issues.

Failures:

Block 0, Base EDID:
  Detailed Timing Descriptor #1: Mismatch of image size 708x398 mm vs display size 1150x650 mm.
  Detailed Timing Descriptor #2: Mismatch of image size 708x398 mm vs display size 1150x650 mm.
  Detailed Timing Descriptor #3: Mismatch of image size 708x398 mm vs display size 1150x650 mm.
  Detailed Timing Descriptor #4: Mismatch of image size 708x398 mm vs display size 1150x650 mm.
  Missing Display Product Name.
  Missing Display Range Limits Descriptor.
Block 1, CTA-861 Extension Block:
  Detailed Timing Descriptor #5: Mismatch of image size 708x398 mm vs display size 1150x650 mm.
  Detailed Timing Descriptor #6: Mismatch of image size 708x398 mm vs display size 1150x650 mm.
  Detailed Timing Descriptor #7: Mismatch of image size 708x398 mm vs display size 1150x650 mm.
  Detailed Timing Descriptor #8: Mismatch of image size 708x398 mm vs display size 1150x650 mm.
  Detailed Timing Descriptor #9: Mismatch of image size 531x398 mm vs display size 1150x650 mm.
  Missing VCDB, needed for Set Selectable RGB Quantization to avoid interop issues.
EDID:
  CTA-861: Native progressive timings are a mix of several resolutions.

EDID conformity: FAIL
