edid-decode (hex):

00 ff ff ff ff ff ff 00 0d ae 76 17 00 00 00 00
15 1f 01 04 a5 26 15 78 03 ee 95 a3 54 4c 99 26
0f 50 54 00 00 00 01 01 01 01 01 01 01 01 01 01
01 01 01 01 01 01 1a 99 80 a0 70 38 0c 48 30 20
36 00 7d d6 10 00 00 1a 00 00 00 fd 00 3c a5 bc
bc 27 01 0a 20 20 20 20 20 20 00 00 00 fe 00 43
58 58 32 34 80 31 37 33 48 4d 45 0a 00 00 00 00
00 02 41 0f 9e 00 00 00 00 0f 41 0a 20 20 01 e7

70 13 79 00 00 03 01 14 1a 99 00 84 7f 07 9f 00
2f 00 1f 00 37 04 3d 00 09 00 04 00 00 00 00 00
00 00 00 00 00 00 00 00 00 00 00 00 00 00 00 00
00 00 00 00 00 00 00 00 00 00 00 00 00 00 00 00
00 00 00 00 00 00 00 00 00 00 00 00 00 00 00 00
00 00 00 00 00 00 00 00 00 00 00 00 00 00 00 00
00 00 00 00 00 00 00 00 00 00 00 00 00 00 00 00
00 00 00 00 00 00 00 00 00 00 00 00 00 00 2d 90

----------------

Block 0, Base EDID:
  EDID Structure Version & Revision: 1.4
  Vendor & Product Identification:
    Manufacturer: CMN
    Model: 6006
    Made in: week 21 of 2021
  Basic Display Parameters & Features:
    Digital display
    Bits per primary color channel: 8
    DisplayPort interface
    Maximum image size: 38 cm x 21 cm
    Gamma: 2.20
    Supported color formats: RGB 4:4:4
    First detailed timing includes the native pixel format and preferred refresh rate
    Display supports continuous frequencies
  Color Characteristics:
    Red  : 0.6396, 0.3300
    Green: 0.2998, 0.5996
    Blue : 0.1503, 0.0595
    White: 0.3134, 0.3291
  Established Timings I & II: none
  Standard Timings: none
  Detailed Timing Descriptors:
    DTD 1:  1920x1080   60.010412 Hz  16:9    188.433 kHz    391.940000 MHz (381 mm x 214 mm)
                 Hfront   48 Hsync  32 Hback   80 Hpol P
                 Vfront    3 Vsync   6 Vback 2051 Vpol N
    Display Range Limits:
      Monitor ranges (Range Limits Only): 60-165 Hz V, 188-188 kHz H, max dotclock 390 MHz
    Alphanumeric Data String: 'CXX24.173HME'
    Manufacturer-Specified Display Descriptor (0x00): 00 00 00 02 41 0f 9e 00 00 00 00 0f 41 0a 20 20 '....A.......A.  '
  Extension blocks: 1
Checksum: 0xe7

----------------

Block 1, DisplayID Extension Block:
  Version: 1.3
  Extension Count: 0
  Display Product Type: Extension Section
  Video Timing Modes Type 1 - Detailed Timings Data Block:
    DTD:  1920x1080  165.006567 Hz  16:9    188.438 kHz    391.950000 MHz (aspect 16:9, no 3D stereo, preferred)
               Hfront   48 Hsync  32 Hback   80 Hpol N
               Vfront   10 Vsync   5 Vback   47 Vpol N
  Checksum: 0x2d
Checksum: 0x90

----------------

Warnings:

Block 0, Base EDID:
  Alphanumeric Data String: Non-ASCII character 0x80 at position 5, can cause problems.
  Missing Display Product Name.
EDID:
  Base EDID: Some timings are out of range of the Monitor Ranges:
    Maximum Clock: 391.950 MHz (Monitor: 390.000 MHz)
    Could be due to a Monitor Range off-by-one rounding issue

Failures:

Block 1, DisplayID Extension Block:
  DisplayID Base Block has no product type.

EDID conformity: FAIL
