edid-decode (hex):

00 ff ff ff ff ff ff 00 09 e5 f2 09 00 00 00 00
11 20 01 04 a5 24 14 78 03 ee 95 a3 54 4c 99 26
0f 50 54 00 00 00 01 01 01 01 01 01 01 01 01 01
01 01 01 01 01 01 8d 8f 80 18 71 38 50 40 6c 30
aa 00 63 c8 10 00 00 1a d8 3b 80 18 71 38 50 40
6c 30 aa 00 63 c8 10 00 00 1a 00 00 00 fd 00 3c
90 a7 a7 25 01 0a 20 20 20 20 20 20 00 00 00 03
00 0d 40 ff 0a 3c 7d 3e 16 2b 7d 00 00 00 01 2a

70 20 79 00 00 25 01 09 6f 56 02 7f 9b 05 3c 90
80 81 00 13 72 1a 00 00 03 01 3c 90 00 00 00 00
00 00 90 00 00 00 00 00 00 00 00 00 00 00 00 00
00 00 00 00 00 00 00 00 00 00 00 00 00 00 00 00
00 00 00 00 00 00 00 00 00 00 00 00 00 00 00 00
00 00 00 00 00 00 00 00 00 00 00 00 00 00 00 00
00 00 00 00 00 00 00 00 00 00 00 00 00 00 00 00
00 00 00 00 00 00 00 00 00 00 00 00 00 00 86 90

00 ff ff ff ff ff ff 00 09 e5 f2 09 00 00 00 00
11 20 01 04 a5 24 14 78 03 ee 95 a3 54 4c 99 26
0f 50 54 00 00 00 01 01 01 01 01 01 01 01 01 01
01 01 01 01 01 01 8d 8f 80 18 71 38 50 40 6c 30
aa 00 63 c8 10 00 00 1a d8 3b 80 18 71 38 50 40
6c 30 aa 00 63 c8 10 00 00 1a 00 00 00 fd 00 3c
90 a7 a7 25 01 0a 20 20 20 20 20 20 00 00 00 03
00 0d 40 ff 0a 3c 7d 3e 16 2b 7d 00 00 00 01 2a

70 20 79 00 00 25 01 09 6f 56 02 7f 9b 05 3c 90
80 81 00 13 72 1a 00 00 03 01 3c 90 00 00 00 00
00 00 90 00 00 00 00 00 00 00 00 00 00 00 00 00
00 00 00 00 00 00 00 00 00 00 00 00 00 00 00 00
00 00 00 00 00 00 00 00 00 00 00 00 00 00 00 00
00 00 00 00 00 00 00 00 00 00 00 00 00 00 00 00
00 00 00 00 00 00 00 00 00 00 00 00 00 00 00 00
00 00 00 00 00 00 00 00 00 00 00 00 00 00 86 90

----------------

Block 0, Base EDID:
  EDID Structure Version & Revision: 1.4
  Vendor & Product Identification:
    Manufacturer: BOE
    Model: 2546
    Made in: week 17 of 2022
  Basic Display Parameters & Features:
    Digital display
    Bits per primary color channel: 8
    DisplayPort interface
    Maximum image size: 36 cm x 20 cm
    Gamma: 2.20
    Supported color formats: RGB 4:4:4
    First detailed timing includes the native pixel format and preferred refresh rate
    Display supports continuous frequencies
  Color Characteristics:
    Red  : 0.6396, 0.3300
    Green: 0.2998, 0.5996
    Blue : 0.1503, 0.0595
    White: 0.3134, 0.3291
  Established Timings I & II: none
  Standard Timings: none
  Detailed Timing Descriptors:
    DTD 1:  1920x1080  144.000784 Hz  16:9    167.041 kHz    367.490000 MHz (355 mm x 200 mm)
                 Hfront  108 Hsync  48 Hback  124 Hpol P
                 Vfront   10 Vsync  10 Vback   60 Vpol N
    DTD 2:  1920x1080   60.031348 Hz  16:9     69.636 kHz    153.200000 MHz (355 mm x 200 mm)
                 Hfront  108 Hsync  48 Hback  124 Hpol P
                 Vfront   10 Vsync  10 Vback   60 Vpol N
    Display Range Limits:
      Monitor ranges (Range Limits Only): 60-144 Hz V, 167-167 kHz H, max dotclock 370 MHz
    Manufacturer-Specified Display Descriptor (0x03): 00 03 00 0d 40 ff 0a 3c 7d 3e 16 2b 7d 00 00 00 '....@..<}>.+}...'
  Extension blocks: 1
Checksum: 0x2a

----------------

Block 1, DisplayID Extension Block:
  Version: 2.0
  Extension Count: 0
  Display Product Primary Use Case: Same primary use case as the base section
  Dynamic Video Timing Range Limits Data Block:
    Minimum Pixel Clock: 153200 kHz
    Maximum Pixel Clock: 367488 kHz
    Minimum Vertical Refresh Rate: 60 Hz
    Maximum Vertical Refresh Rate: 144 Hz
    Seamless Dynamic Video Timing Support: Yes
  CTA-861 DisplayID Data Block:
  Vendor-Specific Data Block (AMD), OUI 00-00-1A:
    Version: 3
    Flags 1: 0x01
      FreeSync Supported
    Minimum Refresh Rate: 60 Hz
    Maximum Refresh Rate: 144 Hz
    Flags 5: 0x00
  Checksum: 0x86
Checksum: 0x90

----------------

Warnings:

Block 0, Base EDID:
  Missing Display Product Name.
EDID:
  Base EDID: Some timings are out of range of the Monitor Ranges:
    Horizontal Freq: 69.636 - 167.040 kHz (Monitor: 167.000 - 167.000 kHz)

Failures:

Block 1, DisplayID Extension Block:
  DisplayID Base Block has no product type.
EDID:
  Extension Block 2 started with EDID header, ignoring Extension Blocks >= 2.
  DisplayID: DisplayID expects at least one preferred timing.

EDID conformity: FAIL
