edid-decode (hex):

00 ff ff ff ff ff ff 00 10 ac 01 42 42 54 43 41
1e 1f 01 03 80 3c 22 78 0a b9 a5 a3 56 50 9f 26
0e 50 54 a5 4b 00 01 01 01 01 01 01 01 01 01 01
01 01 01 01 01 01 02 3a 80 18 71 38 2d 40 58 2c
45 00 56 50 21 00 00 1e 00 00 00 ff 00 35 52 5a
31 59 38 33 0a 20 20 20 20 20 00 00 00 fc 00 44
45 4c 4c 20 53 32 37 32 31 48 53 58 00 00 00 fd
00 30 4b 1e 53 12 00 0a 20 20 20 20 20 20 01 02

02 03 1a c1 45 84 13 03 02 01 23 09 07 07 83 01
00 00 67 03 0c 00 10 00 00 1e 01 1d 00 72 51 d0
1e 20 6e 28 55 00 76 f2 31 00 00 1e 00 00 00 00
00 00 00 00 00 00 00 00 00 00 00 00 00 00 00 00
00 00 00 00 00 00 00 00 00 00 00 00 00 00 00 00
00 00 00 00 00 00 00 00 00 00 00 00 00 00 00 00
00 00 00 00 00 00 00 00 00 00 00 00 00 00 00 00
00 00 00 00 00 00 00 00 00 00 00 00 00 00 00 4b

00 ff ff ff ff ff ff 00 10 ac 01 42 42 54 43 41
1e 1f 01 03 80 3c 22 78 0a b9 a5 a3 56 50 9f 26
0e 50 54 a5 4b 00 01 01 01 01 01 01 01 01 01 01
01 01 01 01 01 01 02 3a 80 18 71 38 2d 40 58 2c
45 00 56 50 21 00 00 1e 00 00 00 ff 00 35 52 5a
31 59 38 33 0a 20 20 20 20 20 00 00 00 fc 00 44
45 4c 4c 20 53 32 37 32 31 48 53 58 00 00 00 fd
00 30 4b 1e 53 12 00 0a 20 20 20 20 20 20 01 02

02 03 1a c1 45 84 13 03 02 01 23 09 07 07 83 01
00 00 67 03 0c 00 10 00 00 1e 01 1d 00 72 51 d0
1e 20 6e 28 55 00 76 f2 31 00 00 1e 00 00 00 00
00 00 00 00 00 00 00 00 00 00 00 00 00 00 00 00
00 00 00 00 00 00 00 00 00 00 00 00 00 00 00 00
00 00 00 00 00 00 00 00 00 00 00 00 00 00 00 00
00 00 00 00 00 00 00 00 00 00 00 00 00 00 00 00
00 00 00 00 00 00 00 00 00 00 00 00 00 00 00 4b

----------------

Block 0, Base EDID:
  EDID Structure Version & Revision: 1.3
  Vendor & Product Identification:
    Manufacturer: DEL
    Model: 16897
    Serial Number: ...
    Made in: week 30 of 2021
  Basic Display Parameters & Features:
    Digital display
    Maximum image size: 60 cm x 34 cm
    Gamma: 2.20
    RGB color display
    First detailed timing is the preferred timing
  Color Characteristics:
    Red  : 0.6386, 0.3388
    Green: 0.3144, 0.6220
    Blue : 0.1503, 0.0566
    White: 0.3134, 0.3291
  Established Timings I & II:
    IBM     :   720x400    70.081663 Hz   9:5     31.467 kHz     28.320000 MHz
    DMT 0x04:   640x480    59.940476 Hz   4:3     31.469 kHz     25.175000 MHz
    DMT 0x06:   640x480    75.000000 Hz   4:3     37.500 kHz     31.500000 MHz
    DMT 0x09:   800x600    60.316541 Hz   4:3     37.879 kHz     40.000000 MHz
    DMT 0x0b:   800x600    75.000000 Hz   4:3     46.875 kHz     49.500000 MHz
    DMT 0x10:  1024x768    60.003840 Hz   4:3     48.363 kHz     65.000000 MHz
    DMT 0x12:  1024x768    75.028582 Hz   4:3     60.023 kHz     78.750000 MHz
    DMT 0x24:  1280x1024   75.024675 Hz   5:4     79.976 kHz    135.000000 MHz
  Standard Timings: none
  Detailed Timing Descriptors:
    DTD 1:  1920x1080   60.000000 Hz  16:9     67.500 kHz    148.500000 MHz (598 mm x 336 mm)
                 Hfront   88 Hsync  44 Hback  148 Hpol P
                 Vfront    4 Vsync   5 Vback   36 Vpol P
    Display Product Serial Number: ...
    Display Product Name: 'DELL S2721HSX'
    Display Range Limits:
      Monitor ranges (GTF): 48-75 Hz V, 30-83 kHz H, max dotclock 180 MHz
  Extension blocks: 1
Checksum: 0x02

----------------

Block 1, CTA-861 Extension Block:
  Revision: 3
  Underscans IT Video Formats by default
  Basic audio support
  Native DTDs: 1
  Video Data Block:
    VIC   4:  1280x720    60.000000 Hz  16:9     45.000 kHz     74.250000 MHz (native)
    VIC  19:  1280x720    50.000000 Hz  16:9     37.500 kHz     74.250000 MHz
    VIC   3:   720x480    59.940060 Hz  16:9     31.469 kHz     27.000000 MHz
    VIC   2:   720x480    59.940060 Hz   4:3     31.469 kHz     27.000000 MHz
    VIC   1:   640x480    59.940476 Hz   4:3     31.469 kHz     25.175000 MHz
  Audio Data Block:
    Linear PCM:
      Max channels: 2
      Supported sample rates (kHz): 48 44.1 32
      Supported sample sizes (bits): 24 20 16
  Speaker Allocation Data Block:
    FL/FR - Front Left/Right
  Vendor-Specific Data Block (HDMI), OUI 00-0C-03:
    Source physical address: 1.0.0.0
    Maximum TMDS clock: 150 MHz
  Detailed Timing Descriptors:
    DTD 2:  1280x720    60.000000 Hz  16:9     45.000 kHz     74.250000 MHz (886 mm x 498 mm)
                 Hfront  110 Hsync  40 Hback  220 Hpol P
                 Vfront    5 Vsync   5 Vback   20 Vpol P
Checksum: 0x4b  Unused space in Extension Block: 83 bytes

----------------

Warnings:

Block 0, Base EDID:
  Detailed Timing Descriptor #1: DTD is identical to VIC 16, which is not present in the CTA Ext Block.
Block 1, CTA-861 Extension Block:
  Video Data Block: VIC 4 and the first DTD are not identical. Is this intended?
  Display Product Serial Number is set, so the Serial Number in the Base EDID should be 0.
  Add a Colorimetry Data Block with the sRGB colorimetry bit set to avoid interop issues.

Failures:

Block 1, CTA-861 Extension Block:
  Detailed Timing Descriptor #2: Mismatch of image size 886x498 mm vs display size 600x340 mm.
  Missing VCDB, needed for Set Selectable RGB Quantization to avoid interop issues.
EDID:
  Extension Block 2 started with EDID header, ignoring Extension Blocks >= 2.
  Base EDID: The DTD max image size is 886x498mm, which is larger than the display size 600.0x340.0mm.
  CTA-861: Native progressive timings are a mix of several resolutions.

EDID conformity: FAIL
