edid-decode (hex):

00 ff ff ff ff ff ff 00 30 e4 8c 07 00 00 00 00
00 21 01 04 b5 1d 12 78 03 6b 85 ae 51 43 b0 24
0f 50 54 00 00 00 01 01 01 01 01 01 01 01 01 01
01 01 01 01 01 01 ff d7 00 a0 a0 40 fc 66 30 20
36 00 20 b4 10 00 00 1a 00 00 00 fd 00 1e 78 cb
cb 38 01 0a 20 20 20 20 20 20 00 00 00 fe 00 43
37 46 43 39 80 31 33 34 57 51 41 0a 00 00 00 00
00 03 41 0c b2 02 01 00 00 0b 41 0a 20 20 01 c8

70 20 79 02 00 20 00 13 3c e6 24 8c 07 00 00 00
00 00 17 07 31 33 34 57 51 41 0a 21 00 1d 40 0b
08 07 00 0a 40 06 88 e5 7a 51 39 a4 b0 4a 22 0f
02 45 54 d0 5f d0 5f 00 34 13 78 26 00 09 06 00
00 00 00 00 41 00 00 22 00 14 f5 6f 08 85 ff 09
9f 00 2f 80 1f 00 3f 06 5d 00 02 00 05 00 25 01
09 f5 6f 08 f5 6f 08 1e 78 80 81 00 0b e3 05 80
00 e6 06 05 01 6a 6a 39 00 00 00 00 00 00 05 90

00 ff ff ff ff ff ff 00 30 e4 8c 07 00 00 00 00
00 21 01 04 b5 1d 12 78 03 6b 85 ae 51 43 b0 24
0f 50 54 00 00 00 01 01 01 01 01 01 01 01 01 01
01 01 01 01 01 01 ff d7 00 a0 a0 40 fc 66 30 20
36 00 20 b4 10 00 00 1a 00 00 00 fd 00 1e 78 cb
cb 38 01 0a 20 20 20 20 20 20 00 00 00 fe 00 43
37 46 43 39 80 31 33 34 57 51 41 0a 00 00 00 00
00 03 41 0c b2 02 01 00 00 0b 41 0a 20 20 01 c8

70 20 79 02 00 20 00 13 3c e6 24 8c 07 00 00 00
00 00 17 07 31 33 34 57 51 41 0a 21 00 1d 40 0b
08 07 00 0a 40 06 88 e5 7a 51 39 a4 b0 4a 22 0f
02 45 54 d0 5f d0 5f 00 34 13 78 26 00 09 06 00
00 00 00 00 41 00 00 22 00 14 f5 6f 08 85 ff 09
9f 00 2f 80 1f 00 3f 06 5d 00 02 00 05 00 25 01
09 f5 6f 08 f5 6f 08 1e 78 80 81 00 0b e3 05 80
00 e6 06 05 01 6a 6a 39 00 00 00 00 00 00 05 90

----------------

Block 0, Base EDID:
  EDID Structure Version & Revision: 1.4
  Vendor & Product Identification:
    Manufacturer: LGD
    Model: 1932
    Made in: 2023
  Basic Display Parameters & Features:
    Digital display
    Bits per primary color channel: 10
    DisplayPort interface
    Maximum image size: 29 cm x 18 cm
    Gamma: 2.20
    Supported color formats: RGB 4:4:4
    First detailed timing includes the native pixel format and preferred refresh rate
    Display supports continuous frequencies
  Color Characteristics:
    Red  : 0.6806, 0.3183
    Green: 0.2636, 0.6904
    Blue : 0.1425, 0.0585
    White: 0.3134, 0.3291
  Established Timings I & II: none
  Standard Timings: none
  Detailed Timing Descriptors:
    DTD 1:  2560x1600   60.003082 Hz  16:10   203.290 kHz    552.950000 MHz (288 mm x 180 mm)
                 Hfront   48 Hsync  32 Hback   80 Hpol P
                 Vfront    3 Vsync   6 Vback 1779 Vpol N
    Display Range Limits:
      Monitor ranges (Range Limits Only): 30-120 Hz V, 203-203 kHz H, max dotclock 560 MHz
    Alphanumeric Data String: 'C7FC9.134WQA'
    Manufacturer-Specified Display Descriptor (0x00): 00 00 00 03 41 0c b2 02 01 00 00 0b 41 0a 20 20 '....A.......A.  '
  Extension blocks: 1
Checksum: 0xc8

----------------

Block 1, DisplayID Extension Block:
  Version: 2.0
  Extension Count: 0
  Display Product Primary Use Case: None of the listed primary use cases; generic display
  Product Identification Data Block (0x20), OUI 3C-E6-24:
    Product Code: 1932
    Year of Manufacture: 2023
    Product ID: 134WQA

  Display Parameters Data Block (0x21):
    Image size: 288.0 mm x 180.0 mm
    Display native pixel format: 2560x1600
    Scan Orientation: Left to Right, Top to Bottom
    Luminance Information: Guidance for the Source device
    Color Information: CIE 1931
    Audio Speaker Information: not integrated
    Native Color Chromaticity:
      Primary #1:  (0.680908, 0.318115)
      Primary #2:  (0.263916, 0.689941)
      Primary #3:  (0.143066, 0.059082)
      White Point: (0.312988, 0.329102)
    Native Maximum Luminance (Full Coverage): 500.000000 cd/m^2
    Native Maximum Luminance (10% Rectangular Coverage): 500.000000 cd/m^2
    Native Minimum Luminance: 0.250000 cd/m^2
    Native Color Depth: 12 bpc
    Display Device Technology: Active Matrix LCD
    Native Gamma EOTF: 2.20
  Display Interface Features Data Block:
    Supported bpc for RGB encoding: 8, 10
    Supported color space and EOTF standard combination 1: sRGB, BT.2020/SMPTE ST 2084
  Video Timing Modes Type 7 - Detailed Timings Data Block:
    DTD:  2560x1600  120.006164 Hz  16:10   203.290 kHz    552.950000 MHz (aspect 16:10, no 3D stereo, preferred)
               Hfront   48 Hsync  32 Hback   80 Hpol P
               Vfront    3 Vsync   6 Vback   85 Vpol N
  Dynamic Video Timing Range Limits Data Block:
    Minimum Pixel Clock: 552950 kHz
    Maximum Pixel Clock: 552950 kHz
    Minimum Vertical Refresh Rate: 30 Hz
    Maximum Vertical Refresh Rate: 120 Hz
    Seamless Dynamic Video Timing Support: Yes
  CTA-861 DisplayID Data Block:
  Colorimetry Data Block:
    BT2020RGB
  HDR Static Metadata Data Block:
    Electro optical transfer functions:
      Traditional gamma - SDR luminance range
      SMPTE ST2084
    Supported static metadata descriptors:
      Static metadata type 1
    Desired content max luminance: 106 (496.743 cd/m^2)
    Desired content max frame-average luminance: 106 (496.743 cd/m^2)
    Desired content min luminance: 57 (0.248 cd/m^2)
  Checksum: 0x05
Checksum: 0x90

----------------

Block 2, Unknown EDID Extension Block 0x00:
  00 ff ff ff ff ff ff 00 30 e4 8c 07 00 00 00 00 '........0.......'
  00 21 01 04 b5 1d 12 78 03 6b 85 ae 51 43 b0 24 '.!.....x.k..QC.$'
  0f 50 54 00 00 00 01 01 01 01 01 01 01 01 01 01 '.PT.............'
  01 01 01 01 01 01 ff d7 00 a0 a0 40 fc 66 30 20 '...........@.f0 '
  36 00 20 b4 10 00 00 1a 00 00 00 fd 00 1e 78 cb '6. ...........x.'
  cb 38 01 0a 20 20 20 20 20 20 00 00 00 fe 00 43 '.8..      .....C'
  37 46 43 39 80 31 33 34 57 51 41 0a 00 00 00 00 '7FC9.134WQA.....'
  00 03 41 0c b2 02 01 00 00 0b 41 0a 20 20 01 c8 '..A.......A.  ..'
Checksum: 0xc8

----------------

Block 3, DisplayID Extension Block:
  Version: 2.0
  Extension Count: 0
  Product Identification Data Block (0x20), OUI 3C-E6-24:
    Product Code: 1932
    Year of Manufacture: 2023
    Product ID: 134WQA

  Display Parameters Data Block (0x21):
    Image size: 288.0 mm x 180.0 mm
    Display native pixel format: 2560x1600
    Scan Orientation: Left to Right, Top to Bottom
    Luminance Information: Guidance for the Source device
    Color Information: CIE 1931
    Audio Speaker Information: not integrated
    Native Color Chromaticity:
      Primary #1:  (0.680908, 0.318115)
      Primary #2:  (0.263916, 0.689941)
      Primary #3:  (0.143066, 0.059082)
      White Point: (0.312988, 0.329102)
    Native Maximum Luminance (Full Coverage): 500.000000 cd/m^2
    Native Maximum Luminance (10% Rectangular Coverage): 500.000000 cd/m^2
    Native Minimum Luminance: 0.250000 cd/m^2
    Native Color Depth: 12 bpc
    Display Device Technology: Active Matrix LCD
    Native Gamma EOTF: 2.20
  Display Interface Features Data Block:
    Supported bpc for RGB encoding: 8, 10
    Supported color space and EOTF standard combination 1: sRGB, BT.2020/SMPTE ST 2084
  Video Timing Modes Type 7 - Detailed Timings Data Block:
    DTD:  2560x1600  120.006164 Hz  16:10   203.290 kHz    552.950000 MHz (aspect 16:10, no 3D stereo, preferred)
               Hfront   48 Hsync  32 Hback   80 Hpol P
               Vfront    3 Vsync   6 Vback   85 Vpol N
  Dynamic Video Timing Range Limits Data Block:
    Minimum Pixel Clock: 552950 kHz
    Maximum Pixel Clock: 552950 kHz
    Minimum Vertical Refresh Rate: 30 Hz
    Maximum Vertical Refresh Rate: 120 Hz
    Seamless Dynamic Video Timing Support: Yes
  CTA-861 DisplayID Data Block:
  Colorimetry Data Block:
    BT2020RGB
  HDR Static Metadata Data Block:
    Electro optical transfer functions:
      Traditional gamma - SDR luminance range
      SMPTE ST2084
    Supported static metadata descriptors:
      Static metadata type 1
    Desired content max luminance: 106 (496.743 cd/m^2)
    Desired content max frame-average luminance: 106 (496.743 cd/m^2)
    Desired content min luminance: 57 (0.248 cd/m^2)
  Checksum: 0x05
Checksum: 0x90

----------------

Warnings:

Block 0, Base EDID:
  Alphanumeric Data String: Non-ASCII character 0x80 at position 5, can cause problems.
  Missing Display Product Name.
Block 1, DisplayID Extension Block:
  Product Identification Data Block (0x20), OUI 3C-E6-24: Unknown OUI 3C-E6-24.
  Colorimetry Data Block: Set the sRGB colorimetry bit to avoid interop issues.
Block 3, DisplayID Extension Block:
  Product Identification Data Block (0x20), OUI 3C-E6-24: Unknown OUI 3C-E6-24.
  Colorimetry Data Block: Set the sRGB colorimetry bit to avoid interop issues.

Failures:

Block 1, DisplayID Extension Block:
  Expected 0 DisplayID Extension Block, but got 1.
Block 2, Base EDID:
  Unknown Extension Block.
Block 3, DisplayID Extension Block:
  Product Type should be 0 in extension block.
  Product Identification Data Block (0x20), OUI 3C-E6-24: Product Identification Data Block (0x20), OUI 3C-E6-24 is required to be the first DisplayID Data Block.
  Display Parameters Data Block (0x21): Duplicate Display Parameters Data Block.
  Colorimetry Data Block: Only one instance of this Data Block is allowed.
  HDR Static Metadata Data Block: Only one instance of this Data Block is allowed.
EDID:
  Base EDID: EDID specified 1 extension block(s), but found 3 extension block(s).

EDID conformity: FAIL
