edid-decode (hex):

00 ff ff ff ff ff ff 00 5c a9 56 57 01 00 00 00
08 13 01 03 68 68 3b 78 2a ee 95 a3 54 4c 99 26
0f 50 54 b3 0c 00 81 c0 81 40 81 80 95 c0 81 40
b3 40 8b c0 d1 c0 1a 36 80 a0 70 38 1f 40 30 20
26 00 13 4a 42 00 00 1e 21 39 90 30 62 1a 27 40
68 b0 36 00 da 28 11 00 00 1e 21 39 90 30 62 1a
27 40 68 b0 36 00 da 28 11 00 00 1e 21 39 90 30
62 1a 27 40 68 b0 36 00 da 28 11 00 00 1e 00 8a

00 ff ff ff ff ff ff 00 5c a9 56 57 01 00 00 00
08 13 01 03 68 68 3b 78 2a ee 95 a3 54 4c 99 26
0f 50 54 b3 0c 00 81 c0 81 40 81 80 95 c0 81 40
b3 40 8b c0 d1 c0 1a 36 80 a0 70 38 1f 40 30 20
26 00 13 4a 42 00 00 1e 21 39 90 30 62 1a 27 40
68 b0 36 00 da 28 11 00 00 1e 21 39 90 30 62 1a
27 40 68 b0 36 00 da 28 11 00 00 1e 21 39 90 30
62 1a 27 40 68 b0 36 00 da 28 11 00 00 1e 00 8a

----------------

Block 0, Base EDID:
  EDID Structure Version & Revision: 1.3
  Vendor & Product Identification:
    Manufacturer: WEI
    Model: 22358
    Serial Number: ...
    Made in: week 8 of 2009
  Basic Display Parameters & Features:
    Analog display
    Signal Level Standard: 0.700 : 0.000 : 0.700 V p-p
    Blank level equals black level
    Sync: Separate
    Maximum image size: 104 cm x 59 cm
    Gamma: 2.20
    DPMS levels: Off
    RGB color display
    First detailed timing is the preferred timing
  Color Characteristics:
    Red  : 0.6396, 0.3300
    Green: 0.2998, 0.5996
    Blue : 0.1503, 0.0595
    White: 0.3134, 0.3291
  Established Timings I & II:
    IBM     :   720x400    70.081663 Hz   9:5     31.467 kHz     28.320000 MHz
    DMT 0x04:   640x480    59.940476 Hz   4:3     31.469 kHz     25.175000 MHz
    Apple   :   640x480    66.666667 Hz   4:3     35.000 kHz     30.240000 MHz
    DMT 0x08:   800x600    56.250000 Hz   4:3     35.156 kHz     36.000000 MHz
    DMT 0x09:   800x600    60.316541 Hz   4:3     37.879 kHz     40.000000 MHz
    DMT 0x10:  1024x768    60.003840 Hz   4:3     48.363 kHz     65.000000 MHz
    DMT 0x11:  1024x768    70.069359 Hz   4:3     56.476 kHz     75.000000 MHz
  Standard Timings:
    DMT 0x55:  1280x720    60.000000 Hz  16:9     45.000 kHz     74.250000 MHz
    DMT 0x20:  1280x960    60.000000 Hz   4:3     60.000 kHz    108.000000 MHz
    DMT 0x23:  1280x1024   60.019740 Hz   5:4     63.981 kHz    108.000000 MHz
    GTF     :  1440x810    60.000051 Hz  16:9     50.340 kHz     95.042000 MHz
    DMT 0x20:  1280x960    60.000000 Hz   4:3     60.000 kHz    108.000000 MHz
    GTF     :  1680x1260   59.999905 Hz   4:3     78.240 kHz    177.761000 MHz
    GTF     :  1360x765    60.000341 Hz  16:9     47.520 kHz     84.396000 MHz
    DMT 0x52:  1920x1080   60.000000 Hz  16:9     67.500 kHz    148.500000 MHz
  Detailed Timing Descriptors:
    DTD 1:  1920x1080   59.933878 Hz  16:9     66.587 kHz    138.500000 MHz (1043 mm x 586 mm)
                 Hfront   48 Hsync  32 Hback   80 Hpol P
                 Vfront    2 Vsync   6 Vback   23 Vpol P
    DTD 2:  1680x1050   59.954250 Hz  16:10    65.290 kHz    146.250000 MHz (474 mm x 296 mm)
                 Hfront  104 Hsync 176 Hback  280 Hpol P
                 Vfront    3 Vsync   6 Vback   30 Vpol P
    DTD 3:  1680x1050   59.954250 Hz  16:10    65.290 kHz    146.250000 MHz (474 mm x 296 mm)
                 Hfront  104 Hsync 176 Hback  280 Hpol P
                 Vfront    3 Vsync   6 Vback   30 Vpol P
    DTD 4:  1680x1050   59.954250 Hz  16:10    65.290 kHz    146.250000 MHz (474 mm x 296 mm)
                 Hfront  104 Hsync 176 Hback  280 Hpol P
                 Vfront    3 Vsync   6 Vback   30 Vpol P
Checksum: 0x8a

----------------

Warnings:

Block 0, Base EDID:
  Vendor & Product Identification: The serial number is one of the known dummy values, it should probably be set to 0.
  Standard Timings: Standard Timing 1360x765 has a dubious odd vertical resolution.
  Detailed Timing Descriptor #2: DTD is similar but not identical to DMT 0x3a.
  Detailed Timing Descriptor #3: DTD is similar but not identical to DMT 0x3a.
  Detailed Timing Descriptor #4: DTD is similar but not identical to DMT 0x3a.

Failures:

Block 0, Base EDID:
  Detailed Timing Descriptor #2: Mismatch of image size 474x296 mm vs display size 1040x590 mm.
  Detailed Timing Descriptor #3: Mismatch of image size 474x296 mm vs display size 1040x590 mm.
  Detailed Timing Descriptor #4: Mismatch of image size 474x296 mm vs display size 1040x590 mm.
  Missing Display Product Name.
  Missing Display Range Limits Descriptor.
EDID:
  Extension Block 1 started with EDID header, ignoring Extension Blocks >= 1.

EDID conformity: FAIL
