edid-decode (hex):

00 ff ff ff ff ff ff 00 1c 54 00 48 01 01 01 01
1e 1f 01 04 c5 46 27 78 fb 9f 75 ad 52 43 ac 24
0c 50 54 25 4a 00 d1 c0 81 80 95 00 b3 00 01 01
01 01 01 01 01 01 4d d0 00 a0 f0 70 3e 80 30 20
35 00 b9 88 21 00 00 1e 00 00 00 fd 0c 30 78 12
12 77 01 0a 20 20 20 20 20 20 00 00 00 fc 00 41
4f 52 55 53 20 46 4f 34 38 55 0a 20 00 00 00 ff
00 32 31 33 30 30 42 30 30 35 38 36 39 0a 02 a0

02 03 33 71 4d 02 03 11 12 13 04 29 2f 20 10 3f
61 5d 23 09 07 07 83 01 00 00 6d 1a 00 00 02 01
28 78 00 00 00 00 00 00 e3 05 e3 01 e6 06 0d 01
65 65 12 f6 5b 00 6e a0 a0 1f 50 17 20 18 04 b9
88 21 00 00 1e 3e c2 00 a0 a0 a0 55 50 30 20 35
00 b9 88 21 00 00 1e 00 00 00 00 00 00 00 00 00
00 00 00 00 00 00 00 00 00 00 00 00 00 00 00 00
00 00 00 00 00 00 00 00 00 00 00 00 00 00 00 f1

70 12 67 00 00 03 01 64 ba ce 01 04 ff 0e 0f 02
2f 80 1f 00 6f 08 63 00 04 80 07 00 ba 7e 00 06
6f 0d 9f 00 2f 80 1f 00 9f 05 3d 00 02 80 04 00
75 fd 00 06 6f 0d 9f 00 2f 80 1f 00 9f 05 3d 00
02 80 04 00 0f 6b 00 08 ff 0e 9f 00 2f 80 1f 00
37 04 3d 00 02 80 04 00 1f d6 00 08 ff 0e 9f 00
2f 80 1f 00 37 04 3d 00 02 80 04 00 7c 00 00 00
00 00 00 00 00 00 00 00 00 00 00 00 00 00 7c 14

00 ff ff ff ff ff ff 00 22 d2 01 aa 00 00 00 00
ff 1a 01 03 80 00 00 78 02 60 bc aa 55 40 b6 23
0c 4c 52 00 00 00 01 01 01 01 01 01 01 01 01 01
01 01 01 01 01 01 04 74 70 6a 80 b0 08 41 28 14
c2 04 7a 44 00 00 00 18 04 74 70 6a 80 b0 08 41
28 14 c2 04 7a 44 00 00 00 18 00 00 00 fc 00 48
54 43 2d 56 49 56 45 0a 20 20 20 20 00 00 00 fd
00 14 78 01 ff 1d 01 0a 20 20 20 20 20 20 01 de

02 03 15 40 42 01 02 23 09 07 01 83 01 00 00 65
03 0c 00 10 00 04 74 70 6a 80 b0 08 41 28 14 c2
04 c0 78 00 00 00 18 04 74 70 6a 80 b0 08 41 28
14 c2 04 c0 78 00 00 00 18 04 74 70 6a 80 b0 08
41 28 14 c2 04 c0 78 00 00 00 18 04 74 70 6a 80
b0 08 41 28 14 c2 04 c0 78 00 00 00 18 00 00 00
00 00 00 00 00 00 00 00 00 00 00 00 00 00 00 00
00 00 00 00 00 00 00 00 00 00 00 00 00 00 00 b1

00 ff ff ff ff ff ff 00 1c 54 00 48 01 01 01 01
1e 1f 01 04 c5 46 27 78 fb 9f 75 ad 52 43 ac 24
0c 50 54 25 4a 00 d1 c0 81 80 95 00 b3 00 01 01
01 01 01 01 01 01 4d d0 00 a0 f0 70 3e 80 30 20
35 00 b9 88 21 00 00 1e 00 00 00 fd 0c 30 78 12
12 77 01 0a 20 20 20 20 20 20 00 00 00 fc 00 41
4f 52 55 53 20 46 4f 34 38 55 0a 20 00 00 00 ff
00 32 31 33 30 30 42 30 30 35 38 36 39 0a 02 a0

02 03 33 71 4d 02 03 11 12 13 04 29 2f 20 10 3f
61 5d 23 09 07 07 83 01 00 00 6d 1a 00 00 02 01
28 78 00 00 00 00 00 00 e3 05 e3 01 e6 06 0d 01
65 65 12 f6 5b 00 6e a0 a0 1f 50 17 20 18 04 b9
88 21 00 00 1e 3e c2 00 a0 a0 a0 55 50 30 20 35
00 b9 88 21 00 00 1e 00 00 00 00 00 00 00 00 00
00 00 00 00 00 00 00 00 00 00 00 00 00 00 00 00
00 00 00 00 00 00 00 00 00 00 00 00 00 00 00 f1

70 12 67 00 00 03 01 64 ba ce 01 04 ff 0e 0f 02
2f 80 1f 00 6f 08 63 00 04 80 07 00 ba 7e 00 06
6f 0d 9f 00 2f 80 1f 00 9f 05 3d 00 02 80 04 00
75 fd 00 06 6f 0d 9f 00 2f 80 1f 00 9f 05 3d 00
02 80 04 00 0f 6b 00 08 ff 0e 9f 00 2f 80 1f 00
37 04 3d 00 02 80 04 00 1f d6 00 08 ff 0e 9f 00
2f 80 1f 00 37 04 3d 00 02 80 04 00 7c 00 00 00
00 00 00 00 00 00 00 00 00 00 00 00 00 00 7c 14

00 ff ff ff ff ff ff 00 22 d2 01 aa 00 00 00 00
ff 1a 01 03 80 00 00 78 02 60 bc aa 55 40 b6 23
0c 4c 52 00 00 00 01 01 01 01 01 01 01 01 01 01
01 01 01 01 01 01 04 74 70 6a 80 b0 08 41 28 14
c2 04 7a 44 00 00 00 18 04 74 70 6a 80 b0 08 41
28 14 c2 04 7a 44 00 00 00 18 00 00 00 fc 00 48
54 43 2d 56 49 56 45 0a 20 20 20 20 00 00 00 fd
00 14 78 01 ff 1d 01 0a 20 20 20 20 20 20 01 de

02 03 15 40 42 01 02 23 09 07 01 83 01 00 00 65
03 0c 00 10 00 04 74 70 6a 80 b0 08 41 28 14 c2
04 c0 78 00 00 00 18 04 74 70 6a 80 b0 08 41 28
14 c2 04 c0 78 00 00 00 18 04 74 70 6a 80 b0 08
41 28 14 c2 04 c0 78 00 00 00 18 04 74 70 6a 80
b0 08 41 28 14 c2 04 c0 78 00 00 00 18 00 00 00
00 00 00 00 00 00 00 00 00 00 00 00 00 00 00 00
00 00 00 00 00 00 00 00 00 00 00 00 00 00 00 b1

----------------

Block 0, Base EDID:
  EDID Structure Version & Revision: 1.4
  Vendor & Product Identification:
    Manufacturer: GBT
    Model: 18432
    Serial Number: ...
    Made in: week 30 of 2021
  Basic Display Parameters & Features:
    Digital display
    Bits per primary color channel: 12
    DisplayPort interface
    Maximum image size: 70 cm x 39 cm
    Gamma: 2.20
    DPMS levels: Standby Suspend Off
    Supported color formats: RGB 4:4:4, YCrCb 4:4:4, YCrCb 4:2:2
    First detailed timing includes the native pixel format and preferred refresh rate
    Display supports continuous frequencies
  Color Characteristics:
    Red  : 0.6777, 0.3212
    Green: 0.2646, 0.6748
    Blue : 0.1416, 0.0498
    White: 0.3134, 0.3291
  Established Timings I & II:
    DMT 0x04:   640x480    59.940476 Hz   4:3     31.469 kHz     25.175000 MHz
    DMT 0x06:   640x480    75.000000 Hz   4:3     37.500 kHz     31.500000 MHz
    DMT 0x09:   800x600    60.316541 Hz   4:3     37.879 kHz     40.000000 MHz
    DMT 0x0b:   800x600    75.000000 Hz   4:3     46.875 kHz     49.500000 MHz
    DMT 0x10:  1024x768    60.003840 Hz   4:3     48.363 kHz     65.000000 MHz
    DMT 0x12:  1024x768    75.028582 Hz   4:3     60.023 kHz     78.750000 MHz
  Standard Timings:
    DMT 0x52:  1920x1080   60.000000 Hz  16:9     67.500 kHz    148.500000 MHz
    DMT 0x23:  1280x1024   60.019740 Hz   5:4     63.981 kHz    108.000000 MHz
    DMT 0x2f:  1440x900    59.887445 Hz  16:10    55.935 kHz    106.500000 MHz
    DMT 0x3a:  1680x1050   59.954250 Hz  16:10    65.290 kHz    146.250000 MHz
  Detailed Timing Descriptors:
    DTD 1:  3840x2160   59.996625 Hz  16:9    133.312 kHz    533.250000 MHz (697 mm x 392 mm)
                 Hfront   48 Hsync  32 Hback   80 Hpol P
                 Vfront    3 Vsync   5 Vback   54 Vpol P
    Display Range Limits:
      Monitor ranges (Range Limits Only): 48-120 Hz V, 273-273 kHz H, max dotclock 1190 MHz
    Display Product Name: 'AORUS FO48U'
    Display Product Serial Number: ...
  Extension blocks: 2
Checksum: 0xa0

----------------

Block 1, CTA-861 Extension Block:
  Revision: 3
  Basic audio support
  Supports YCbCr 4:4:4
  Supports YCbCr 4:2:2
  Native DTDs: 1
  Video Data Block:
    VIC   2:   720x480    59.940060 Hz   4:3     31.469 kHz     27.000000 MHz
    VIC   3:   720x480    59.940060 Hz  16:9     31.469 kHz     27.000000 MHz
    VIC  17:   720x576    50.000000 Hz   4:3     31.250 kHz     27.000000 MHz
    VIC  18:   720x576    50.000000 Hz  16:9     31.250 kHz     27.000000 MHz
    VIC  19:  1280x720    50.000000 Hz  16:9     37.500 kHz     74.250000 MHz
    VIC   4:  1280x720    60.000000 Hz  16:9     45.000 kHz     74.250000 MHz
    VIC  41:  1280x720   100.000000 Hz  16:9     75.000 kHz    148.500000 MHz
    VIC  47:  1280x720   120.000000 Hz  16:9     90.000 kHz    148.500000 MHz
    VIC  32:  1920x1080   24.000000 Hz  16:9     27.000 kHz     74.250000 MHz
    VIC  16:  1920x1080   60.000000 Hz  16:9     67.500 kHz    148.500000 MHz
    VIC  63:  1920x1080  120.000000 Hz  16:9    135.000 kHz    297.000000 MHz
    VIC  97:  3840x2160   60.000000 Hz  16:9    135.000 kHz    594.000000 MHz
    VIC  93:  3840x2160   24.000000 Hz  16:9     54.000 kHz    297.000000 MHz
  Audio Data Block:
    Linear PCM:
      Max channels: 2
      Supported sample rates (kHz): 48 44.1 32
      Supported sample sizes (bits): 24 20 16
  Speaker Allocation Data Block:
    FL/FR - Front Left/Right
  Vendor-Specific Data Block (AMD), OUI 00-00-1A:
    Version: 2
    Flags 1: 0x01
      FreeSync Supported
    Minimum Refresh Rate: 40 Hz
    Maximum Refresh Rate: 120 Hz
    Flags 5: 0x00
  Colorimetry Data Block:
    xvYCC601
    xvYCC709
    BT2020cYCC
    BT2020YCC
    BT2020RGB
    Gamut Boundary Description Metadata Profile P0
  HDR Static Metadata Data Block:
    Electro optical transfer functions:
      Traditional gamma - SDR luminance range
      SMPTE ST2084
      Hybrid Log-Gamma
    Supported static metadata descriptors:
      Static metadata type 1
    Desired content max luminance: 101 (445.755 cd/m^2)
    Desired content max frame-average luminance: 101 (445.755 cd/m^2)
    Desired content min luminance: 18 (0.022 cd/m^2)
  Detailed Timing Descriptors:
    DTD 2:  2560x1440   59.940370 Hz  16:9     88.172 kHz    235.420000 MHz (697 mm x 392 mm)
                 Hfront   23 Hsync  32 Hback   55 Hpol P
                 Vfront   17 Vsync   8 Vback    6 Vpol P
    DTD 3:  2560x1440  119.879460 Hz  16:9    182.816 kHz    497.260000 MHz (697 mm x 392 mm)
                 Hfront   48 Hsync  32 Hback   80 Hpol P
                 Vfront    3 Vsync   5 Vback   77 Vpol P
Checksum: 0xf1  Unused space in Extension Block: 40 bytes

----------------

Block 2, DisplayID Extension Block:
  Version: 1.2
  Extension Count: 0
  Display Product Type: Extension Section
  Video Timing Modes Type 1 - Detailed Timings Data Block:
    DTD:  3840x2160  119.998825 Hz  16:9    271.197 kHz   1184.590000 MHz (aspect 16:9, no 3D stereo)
               Hfront   48 Hsync  32 Hback  448 Hpol P
               Vfront    5 Vsync   8 Vback   87 Vpol P
    DTD:  3440x1440   59.999630 Hz  64:27    90.119 kHz    324.430000 MHz (aspect 64:27, no 3D stereo)
               Hfront   48 Hsync  32 Hback   80 Hpol P
               Vfront    3 Vsync   5 Vback   54 Vpol P
    DTD:  3440x1440  119.999260 Hz  64:27   180.239 kHz    648.860000 MHz (aspect 64:27, no 3D stereo)
               Hfront   48 Hsync  32 Hback   80 Hpol P
               Vfront    3 Vsync   5 Vback   54 Vpol P
    DTD:  3840x1080   60.000000 Hz   0:0     68.520 kHz    274.080000 MHz (aspect undefined, no 3D stereo)
               Hfront   48 Hsync  32 Hback   80 Hpol P
               Vfront    3 Vsync   5 Vback   54 Vpol P
    DTD:  3840x1080  120.000000 Hz   0:0    137.040 kHz    548.160000 MHz (aspect undefined, no 3D stereo)
               Hfront   48 Hsync  32 Hback   80 Hpol P
               Vfront    3 Vsync   5 Vback   54 Vpol P
  Checksum: 0x7c
Checksum: 0x14  Unused space in Extension Block: 18 bytes

----------------

Warnings:

Block 0, Base EDID:
  Vendor & Product Identification: The serial number is one of the known dummy values, it should probably be set to 0.
Block 1, CTA-861 Extension Block:
  IT Video Formats are overscanned by default, but normally this should be underscanned.
  Video Data Block: VIC 2 and the first DTD are not identical. Is this intended?
  Colorimetry Data Block: Set the sRGB colorimetry bit to avoid interop issues.
  Display Product Serial Number is set, so the Serial Number in the Base EDID should be 0.
EDID:
  Base EDID: Some timings are out of range of the Monitor Ranges:
    Vertical Freq: 24.000 - 120.000 Hz (Monitor: 48.000 - 120.000 Hz)
    Horizontal Freq: 27.000 - 271.197 kHz (Monitor: 273.000 - 273.000 kHz)

Failures:

Block 1, CTA-861 Extension Block:
  Missing VCDB, needed for Set Selectable RGB Quantization to avoid interop issues.
Block 2, DisplayID Extension Block:
  DisplayID Base Block has no product type.
  Padding: Contains non-zero bytes.
EDID:
  Extension Block 3 started with EDID header, ignoring Extension Blocks >= 3.
  DisplayID: DisplayID expects at least one preferred timing.

EDID conformity: FAIL
