edid-decode (hex):

00 ff ff ff ff ff ff 00 10 ac 63 40 4c 34 39 38
2a 16 01 04 a5 40 28 78 2a 8d 85 ad 4f 35 b1 25
0e 50 54 a5 4b 00 71 4f 81 00 81 80 a9 40 d1 00
d1 40 01 01 01 01 e2 68 00 a0 a0 40 2e 60 30 20
36 00 81 91 21 00 00 1a 00 00 00 ff 00 50 48 35
4e 59 32 41 46 38 39 34 4c 0a 00 00 00 fc 00 44
45 4c 4c 20 55 33 30 31 31 0a 20 20 00 00 00 fd
00 31 56 1d 71 1c 00 0a 20 20 20 20 20 20 00 0b

00 ff ff ff ff ff ff 00 10 ac 63 40 4c 34 39 38
2a 16 01 04 a5 40 28 78 2a 8d 85 ad 4f 35 b1 25
0e 50 54 a5 4b 00 71 4f 81 00 81 80 a9 40 d1 00
d1 40 01 01 01 01 e2 68 00 a0 a0 40 2e 60 30 20
36 00 81 91 21 00 00 1a 00 00 00 ff 00 50 48 35
4e 59 32 41 46 38 39 34 4c 0a 00 00 00 fc 00 44
45 4c 4c 20 55 33 30 31 31 0a 20 20 00 00 00 fd
00 31 56 1d 71 1c 00 0a 20 20 20 20 20 20 00 0b

----------------

Block 0, Base EDID:
  EDID Structure Version & Revision: 1.4
  Vendor & Product Identification:
    Manufacturer: DEL
    Model: 16483
    Serial Number: ...
    Made in: week 42 of 2012
  Basic Display Parameters & Features:
    Digital display
    Bits per primary color channel: 8
    DisplayPort interface
    Maximum image size: 64 cm x 40 cm
    Gamma: 2.20
    DPMS levels: Off
    Supported color formats: RGB 4:4:4, YCrCb 4:4:4
    First detailed timing includes the native pixel format and preferred refresh rate
  Color Characteristics:
    Red  : 0.6777, 0.3085
    Green: 0.2099, 0.6923
    Blue : 0.1464, 0.0546
    White: 0.3134, 0.3291
  Established Timings I & II:
    IBM     :   720x400    70.081663 Hz   9:5     31.467 kHz     28.320000 MHz
    DMT 0x04:   640x480    59.940476 Hz   4:3     31.469 kHz     25.175000 MHz
    DMT 0x06:   640x480    75.000000 Hz   4:3     37.500 kHz     31.500000 MHz
    DMT 0x09:   800x600    60.316541 Hz   4:3     37.879 kHz     40.000000 MHz
    DMT 0x0b:   800x600    75.000000 Hz   4:3     46.875 kHz     49.500000 MHz
    DMT 0x10:  1024x768    60.003840 Hz   4:3     48.363 kHz     65.000000 MHz
    DMT 0x12:  1024x768    75.028582 Hz   4:3     60.023 kHz     78.750000 MHz
    DMT 0x24:  1280x1024   75.024675 Hz   5:4     79.976 kHz    135.000000 MHz
  Standard Timings:
    DMT 0x15:  1152x864    75.000000 Hz   4:3     67.500 kHz    108.000000 MHz
    DMT 0x1c:  1280x800    59.810326 Hz  16:10    49.702 kHz     83.500000 MHz
    DMT 0x23:  1280x1024   60.019740 Hz   5:4     63.981 kHz    108.000000 MHz
    DMT 0x33:  1600x1200   60.000000 Hz   4:3     75.000 kHz    162.000000 MHz
    DMT 0x45:  1920x1200   59.884600 Hz  16:10    74.556 kHz    193.250000 MHz
    DMT 0x49:  1920x1440   60.000000 Hz   4:3     90.000 kHz    234.000000 MHz
  Detailed Timing Descriptors:
    DTD 1:  2560x1600   59.971589 Hz  16:10    98.713 kHz    268.500000 MHz (641 mm x 401 mm)
                 Hfront   48 Hsync  32 Hback   80 Hpol P
                 Vfront    3 Vsync   6 Vback   37 Vpol N
    Display Product Serial Number: ...
    Display Product Name: 'DELL U3011'
    Display Range Limits:
      Monitor ranges (GTF): 49-86 Hz V, 29-113 kHz H, max dotclock 280 MHz
Checksum: 0x0b

----------------

Warnings:

Block 0, Base EDID:
  Display Range Limits: GTF support is deprecated in EDID 1.4.

Failures:

Block 0, Base EDID:
  Display Range Limits: GTF is supported, but the display does not support continuous frequencies.
EDID:
  Extension Block 1 started with EDID header, ignoring Extension Blocks >= 1.

EDID conformity: FAIL
