edid-decode (hex):

00 ff ff ff ff ff ff 00 09 e5 4c 0b 00 00 00 00
0c 20 01 04 a5 23 16 78 03 ee 95 a3 54 4c 99 26
0f 50 54 00 00 00 01 01 01 01 01 01 01 01 01 01
01 01 01 01 01 01 af 41 80 54 71 b0 28 40 30 20
36 00 59 d7 10 00 00 1a 8c 34 80 54 71 b0 28 40
30 20 36 00 59 d7 10 00 00 1a 00 00 00 fe 00 42
4f 45 20 43 51 0a 20 20 20 20 20 20 00 00 00 fe
00 4e 56 31 36 30 57 55 4d 2d 4e 48 33 0a 00 41

00 ff ff ff ff ff ff 00 09 e5 4c 0b 00 00 00 00
0c 20 01 04 a5 23 16 78 03 ee 95 a3 54 4c 99 26
0f 50 54 00 00 00 01 01 01 01 01 01 01 01 01 01
01 01 01 01 01 01 af 41 80 54 71 b0 28 40 30 20
36 00 59 d7 10 00 00 1a 8c 34 80 54 71 b0 28 40
30 20 36 00 59 d7 10 00 00 1a 00 00 00 fe 00 42
4f 45 20 43 51 0a 20 20 20 20 20 20 00 00 00 fe
00 4e 56 31 36 30 57 55 4d 2d 4e 48 33 0a 00 41

----------------

Block 0, Base EDID:
  EDID Structure Version & Revision: 1.4
  Vendor & Product Identification:
    Manufacturer: BOE
    Model: 2892
    Made in: week 12 of 2022
  Basic Display Parameters & Features:
    Digital display
    Bits per primary color channel: 8
    DisplayPort interface
    Maximum image size: 35 cm x 22 cm
    Gamma: 2.20
    Supported color formats: RGB 4:4:4
    First detailed timing includes the native pixel format and preferred refresh rate
    Display supports continuous frequencies
  Color Characteristics:
    Red  : 0.6396, 0.3300
    Green: 0.2998, 0.5996
    Blue : 0.1503, 0.0595
    White: 0.3134, 0.3291
  Established Timings I & II: none
  Standard Timings: none
  Detailed Timing Descriptors:
    DTD 1:  1920x1200   60.002141 Hz  16:10    74.403 kHz    168.150000 MHz (345 mm x 215 mm)
                 Hfront   48 Hsync  32 Hback  260 Hpol P
                 Vfront    3 Vsync   6 Vback   31 Vpol N
    DTD 2:  1920x1200   48.001713 Hz  16:10    59.522 kHz    134.520000 MHz (345 mm x 215 mm)
                 Hfront   48 Hsync  32 Hback  260 Hpol P
                 Vfront    3 Vsync   6 Vback   31 Vpol N
    Alphanumeric Data String: 'BOE CQ'
    Alphanumeric Data String: 'NV160WUM-NH3'
Checksum: 0x41

----------------

Warnings:

Block 0, Base EDID:
  Missing Display Product Name.

Failures:

Block 0, Base EDID:
  Missing Display Range Limits Descriptor.
EDID:
  Extension Block 1 started with EDID header, ignoring Extension Blocks >= 1.

EDID conformity: FAIL
