edid-decode (hex):

00 ff ff ff ff ff ff 00 06 af 2d 50 00 00 00 00
1a 1b 01 04 a5 1d 10 78 02 a4 15 9e 55 4e 9b 26
0f 50 54 00 00 00 01 01 01 01 01 01 01 01 01 01
01 01 01 01 01 01 b4 37 80 a0 70 38 3e 40 3a 2a
35 00 25 a2 10 00 00 1a b4 37 80 a0 70 38 5c 41
3a 2a 35 00 25 a2 10 00 00 1a 00 00 00 fe 00 52
4e 35 54 54 80 42 31 33 33 48 41 4e 00 00 00 00
00 02 41 02 a8 01 11 00 00 0a 01 0a 20 20 00 3c

----------------

Block 0, Base EDID:
  EDID Structure Version & Revision: 1.4
  Vendor & Product Identification:
    Manufacturer: AUO
    Model: 20525
    Made in: week 26 of 2017
  Basic Display Parameters & Features:
    Digital display
    Bits per primary color channel: 8
    DisplayPort interface
    Maximum image size: 29 cm x 16 cm
    Gamma: 2.20
    Supported color formats: RGB 4:4:4
    First detailed timing includes the native pixel format and preferred refresh rate
  Color Characteristics:
    Red  : 0.6191, 0.3339
    Green: 0.3056, 0.6054
    Blue : 0.1484, 0.0595
    White: 0.3134, 0.3291
  Established Timings I & II: none
  Standard Timings: none
  Detailed Timing Descriptors:
    DTD 1:  1920x1080   60.033006 Hz  16:9     68.558 kHz    142.600000 MHz (293 mm x 162 mm)
                 Hfront   58 Hsync  42 Hback   60 Hpol P
                 Vfront    3 Vsync   5 Vback   54 Vpol N
    DTD 2:  1920x1080   48.009588 Hz  16:9     68.558 kHz    142.600000 MHz (293 mm x 162 mm)
                 Hfront   58 Hsync  42 Hback   60 Hpol P
                 Vfront    3 Vsync   5 Vback  340 Vpol N
    Alphanumeric Data String: 'RN5TT.B133HAN'
    Manufacturer-Specified Display Descriptor (0x00): 00 00 00 02 41 02 a8 01 11 00 00 0a 01 0a 20 20 '....A.........  '
Checksum: 0x3c

----------------

Warnings:

Block 0, Base EDID:
  Alphanumeric Data String: Non-ASCII character 0x80 at position 5, can cause problems.
  Missing Display Product Name.

EDID conformity: PASS
