edid-decode (hex):

00 ff ff ff ff ff ff 00 06 10 59 9c 01 01 01 01
00 0f 01 03 80 2b 1b 78 0a cf 74 a3 57 4a 9d 25
11 50 54 00 00 10 01 01 01 01 01 01 01 01 01 01
01 01 01 01 01 01 7c 2e 90 a0 60 1a 1e 40 30 20
36 00 b1 0e 11 00 00 1c 00 00 00 01 00 06 10 30
11 00 00 00 00 00 00 00 0a 20 00 00 00 fe 00 4c
4d 32 30 31 57 30 31 2d 53 4c 41 33 00 00 00 fc
00 43 6f 6c 6f 72 20 4c 43 44 0a 20 20 20 00 5e

----------------

Block 0, Base EDID:
  EDID Structure Version & Revision: 1.3
  Vendor & Product Identification:
    Manufacturer: APP
    Model: 40025
    Serial Number: ...
    Made in: 2005
  Basic Display Parameters & Features:
    Digital display
    Maximum image size: 43 cm x 27 cm
    Gamma: 2.20
    RGB color display
    First detailed timing is the preferred timing
  Color Characteristics:
    Red  : 0.6396, 0.3398
    Green: 0.2919, 0.6162
    Blue : 0.1455, 0.0693
    White: 0.3134, 0.3281
  Established Timings I & II:
  Standard Timings: none
  Detailed Timing Descriptors:
    DTD 1:  1680x1050   59.883253 Hz  16:10    64.674 kHz    119.000000 MHz (433 mm x 270 mm)
                 Hfront   48 Hsync  32 Hback   80 Hpol N
                 Vfront    3 Vsync   6 Vback   21 Vpol P
    Manufacturer-Specified Display Descriptor (0x01): 00 01 00 06 10 30 11 00 00 00 00 00 00 00 0a 20 '.....0......... '
    Alphanumeric Data String: 'LM201W01-SLA3'
    Display Product Name: 'Color LCD'
Checksum: 0x5e

----------------

Warnings:

Block 0, Base EDID:
  Vendor & Product Identification: The serial number is one of the known dummy values, it should probably be set to 0.
  Detailed Timing Descriptor #1: DTD is similar but not identical to DMT 0x39.

Failures:

Block 0, Base EDID:
  Missing Display Range Limits Descriptor.

EDID conformity: FAIL
