edid-decode (hex):

00 ff ff ff ff ff ff 00 42 93 a5 06 14 58 00 00
05 0f 01 03 68 22 1b 96 2a 6e 06 a1 54 4c 99 26
19 4f 54 bf ef 00 01 01 01 01 01 01 01 01 81 80
00 00 00 00 00 00 30 2a 00 98 51 00 2a 40 30 70
13 00 51 0e 11 00 00 1e c3 1e 00 20 41 00 20 30
10 60 13 00 51 0e 11 00 00 00 00 00 00 fd 00 3c
4b 1e 50 0e 00 0a 20 20 20 20 20 20 00 00 00 ff
00 46 35 57 51 35 32 30 30 32 32 35 34 38 00 8b

00 ff ff ff ff ff ff 00 42 93 a5 06 14 58 00 00
05 0f 01 03 68 22 1b 96 2a 6e 06 a1 54 4c 99 26
19 4f 54 bf ef 00 01 01 01 01 01 01 01 01 81 80
00 00 00 00 00 00 30 2a 00 98 51 00 2a 40 30 70
13 00 51 0e 11 00 00 1e c3 1e 00 20 41 00 20 30
10 60 13 00 51 0e 11 00 00 00 00 00 00 fd 00 3c
4b 1e 50 0e 00 0a 20 20 20 20 20 20 00 00 00 ff
00 46 35 57 51 35 32 30 30 32 32 35 34 38 00 8b

----------------

Block 0, Base EDID:
  EDID Structure Version & Revision: 1.3
  Vendor & Product Identification:
    Manufacturer: PTS
    Model: 1701
    Serial Number: ...
    Made in: week 5 of 2005
  Basic Display Parameters & Features:
    Analog display
    Signal Level Standard: 0.700 : 0.000 : 0.700 V p-p
    Blank level equals black level
    Sync: Separate
    Maximum image size: 34 cm x 27 cm
    Gamma: 2.50
    DPMS levels: Off
    RGB color display
    First detailed timing is the preferred timing
  Color Characteristics:
    Red  : 0.6298, 0.3300
    Green: 0.2998, 0.5996
    Blue : 0.1484, 0.0976
    White: 0.3095, 0.3300
  Established Timings I & II:
    IBM     :   720x400    70.081663 Hz   9:5     31.467 kHz     28.320000 MHz
    DMT 0x04:   640x480    59.940476 Hz   4:3     31.469 kHz     25.175000 MHz
    Apple   :   640x480    66.666667 Hz   4:3     35.000 kHz     30.240000 MHz
    DMT 0x05:   640x480    72.808802 Hz   4:3     37.861 kHz     31.500000 MHz
    DMT 0x06:   640x480    75.000000 Hz   4:3     37.500 kHz     31.500000 MHz
    DMT 0x08:   800x600    56.250000 Hz   4:3     35.156 kHz     36.000000 MHz
    DMT 0x09:   800x600    60.316541 Hz   4:3     37.879 kHz     40.000000 MHz
    DMT 0x0a:   800x600    72.187572 Hz   4:3     48.077 kHz     50.000000 MHz
    DMT 0x0b:   800x600    75.000000 Hz   4:3     46.875 kHz     49.500000 MHz
    Apple   :   832x624    74.551266 Hz   4:3     49.726 kHz     57.284000 MHz
    DMT 0x10:  1024x768    60.003840 Hz   4:3     48.363 kHz     65.000000 MHz
    DMT 0x11:  1024x768    70.069359 Hz   4:3     56.476 kHz     75.000000 MHz
    DMT 0x12:  1024x768    75.028582 Hz   4:3     60.023 kHz     78.750000 MHz
    DMT 0x24:  1280x1024   75.024675 Hz   5:4     79.976 kHz    135.000000 MHz
  Standard Timings:
    DMT 0x23:  1280x1024   60.019740 Hz   5:4     63.981 kHz    108.000000 MHz
  Detailed Timing Descriptors:
    DTD 1:  1280x1024   60.019740 Hz   5:4     63.981 kHz    108.000000 MHz (337 mm x 270 mm)
                 Hfront   48 Hsync 112 Hback  248 Hpol P
                 Vfront    1 Vsync   3 Vback   38 Vpol P
    DTD 2:  1024x768    75.028582 Hz   4:3     60.023 kHz     78.750000 MHz (analog composite, sync-on-green, 337 mm x 270 mm)
                 Hfront   16 Hsync  96 Hback  176 Hpol N
                 Vfront    1 Vsync   3 Vback   28 Vpol N
    Display Range Limits:
      Monitor ranges (GTF): 60-75 Hz V, 30-80 kHz H, max dotclock 140 MHz
    Display Product Serial Number: ...
Checksum: 0x8b

----------------

Warnings:

Block 0, Base EDID:
  Detailed Timing Descriptor #2: DTD is similar but not identical to DMT 0x12.
  Detailed Timing Descriptor #2: Image size is 337x270 mm, but based on the picture AR it should be 337x252 mm.
EDID:
  Base EDID: Some timings are out of range of the Monitor Ranges:
    Vertical Freq: 56.250 - 75.029 Hz (Monitor: 60.000 - 75.000 Hz)

Failures:

Block 0, Base EDID:
  Standard Timings: Use 0x0101 as the invalid Standard Timings code, not 0x0000.
  Standard Timings: Use 0x0101 as the invalid Standard Timings code, not 0x0000.
  Standard Timings: Use 0x0101 as the invalid Standard Timings code, not 0x0000.
  Missing Display Product Name.
EDID:
  Extension Block 1 started with EDID header, ignoring Extension Blocks >= 1.

EDID conformity: FAIL
