edid-decode (hex):

00 ff ff ff ff ff ff 00 4c a3 55 32 00 00 00 00
00 11 01 03 80 21 15 78 0a 87 f5 94 57 4f 8c 27
27 50 54 00 00 00 01 01 01 01 01 01 01 01 01 01
01 01 01 01 01 01 8c 41 80 58 71 b0 23 40 64 20
26 00 4b cf 10 00 00 19 00 00 00 0f 00 00 00 00
00 00 00 00 00 46 d2 02 64 00 00 00 00 fe 00 52
50 37 38 34 02 31 35 34 55 32 0a 20 00 00 00 fe
00 17 27 2f 3f 5f 97 af ff 02 01 0a 20 20 00 31

----------------

Block 0, Base EDID:
  EDID Structure Version & Revision: 1.3
  Vendor & Product Identification:
    Manufacturer: SEC
    Model: 12885
    Made in: 2007
  Basic Display Parameters & Features:
    Digital display
    Maximum image size: 33 cm x 21 cm
    Gamma: 2.20
    RGB color display
    First detailed timing is the preferred timing
  Color Characteristics:
    Red  : 0.5800, 0.3398
    Green: 0.3095, 0.5498
    Blue : 0.1552, 0.1552
    White: 0.3134, 0.3291
  Established Timings I & II: none
  Standard Timings: none
  Detailed Timing Descriptors:
    DTD 1:  1920x1200   60.013448 Hz  16:10    74.117 kHz    167.800000 MHz (331 mm x 207 mm)
                 Hfront  100 Hsync  32 Hback  212 Hpol N
                 Vfront    2 Vsync   6 Vback   27 Vpol N
    Manufacturer-Specified Display Descriptor (0x0f): 00 0f 00 00 00 00 00 00 00 00 00 46 d2 02 64 00 '...........F..d.'
    Alphanumeric Data String: 'RP784.154U2'
    Alphanumeric Data String: '.'/?_..'
Checksum: 0x31

----------------

Warnings:

Block 0, Base EDID:
  Alphanumeric Data String: Non-ASCII character 0x02 at position 5, can cause problems.
  Alphanumeric Data String: Non-ASCII character 0x17 at position 0, can cause problems.
  Alphanumeric Data String: Non-ASCII character 0x97 at position 5, can cause problems.
  Alphanumeric Data String: Non-ASCII character 0xaf at position 6, can cause problems.

Failures:

Block 0, Base EDID:
  Alphanumeric Data String: 0xff byte at position 7.
  Missing Display Product Name.
  Missing Display Range Limits Descriptor.

EDID conformity: FAIL
