edid-decode (hex):

00 ff ff ff ff ff ff 00 4c a3 55 32 00 00 00 00
00 0c 01 03 80 1e 17 78 0a ad 71 96 57 52 89 27
23 50 54 00 00 00 01 01 01 01 01 01 01 01 01 01
01 01 01 01 01 01 48 3f 40 f0 61 b0 32 40 40 80
6e 11 30 e4 10 00 00 19 00 00 00 0f 00 00 00 00
00 00 00 00 00 19 af 02 32 00 00 00 00 fe 00 32
52 32 39 30 32 31 35 30 55 32 0a 20 00 00 00 fe
00 e2 b4 93 77 4e 2e 0f 00 02 0a 20 20 20 00 79

----------------

Block 0, Base EDID:
  EDID Structure Version & Revision: 1.3
  Vendor & Product Identification:
    Manufacturer: SEC
    Model: 12885
    Made in: 2002
  Basic Display Parameters & Features:
    Digital display
    Maximum image size: 30 cm x 23 cm
    Gamma: 2.20
    RGB color display
    First detailed timing is the preferred timing
  Color Characteristics:
    Red  : 0.5878, 0.3417
    Green: 0.3232, 0.5361
    Blue : 0.1533, 0.1396
    White: 0.3125, 0.3291
  Established Timings I & II: none
  Standard Timings: none
  Detailed Timing Descriptors:
    DTD 1:  1600x1200   61.832061 Hz   4:3     77.290 kHz    162.000000 MHz (304 mm x 228 mm)
                 Hfront   64 Hsync 384 Hback   48 Hpol N
                 Vfront    6 Vsync  30 Vback   14 Vpol N
    Manufacturer-Specified Display Descriptor (0x0f): 00 0f 00 00 00 00 00 00 00 00 00 19 af 02 32 00 '..............2.'
    Alphanumeric Data String: '2R2902150U2'
    Alphanumeric Data String: '...wN..'
Checksum: 0x79

----------------

Warnings:

Block 0, Base EDID:
  Alphanumeric Data String: Non-ASCII character 0xe2 at position 0, can cause problems.
  Alphanumeric Data String: Non-ASCII character 0xb4 at position 1, can cause problems.
  Alphanumeric Data String: Non-ASCII character 0x93 at position 2, can cause problems.
  Alphanumeric Data String: Non-ASCII character 0x0f at position 6, can cause problems.

Failures:

Block 0, Base EDID:
  Alphanumeric Data String: NUL byte at position 7.
  Missing Display Product Name.
  Missing Display Range Limits Descriptor.

EDID conformity: FAIL
