edid-decode (hex):

00 ff ff ff ff ff ff 00 09 e5 16 0d 00 00 00 00
0c 22 01 04 a5 22 16 78 07 a2 a5 a5 54 4d 9b 25
0f 50 54 00 00 00 01 01 01 01 01 01 01 01 01 01
01 01 01 01 01 01 6b 6e 00 a0 a0 40 84 60 30 20
66 00 58 d7 10 00 00 1a 00 00 00 fd 0c 30 a5 1f
1f 4e 01 0a 20 20 20 20 20 20 00 00 00 fe 00 3d
4c 33 30 31 30 20 20 20 20 20 20 ff 00 00 00 fc
00 4e 45 31 36 30 51 44 4d 2d 4e 59 4d 0a 01 97

70 20 79 02 00 21 00 1d 77 0d 6a 08 00 0a 40 06
80 56 7a 54 d0 64 9b 56 92 0f 02 35 54 40 5e 40
5e 00 44 12 78 22 00 14 69 dc 0b 85 ff 09 9f 00
2f 00 1f 00 3f 06 83 00 05 00 05 00 2b 00 0c 27
00 30 a4 00 00 27 00 30 3b 00 00 2e 00 06 00 44
40 5e 40 5e 81 00 1e 72 1a 00 00 03 71 30 a5 00
00 60 ff 60 ff a5 00 00 00 00 e3 05 04 00 e6 06
01 01 60 60 ff 00 00 00 00 00 00 00 00 00 28 90

00 ff ff ff ff ff ff 00 09 e5 16 0d 00 00 00 00
0c 22 01 04 a5 22 16 78 07 a2 a5 a5 54 4d 9b 25
0f 50 54 00 00 00 01 01 01 01 01 01 01 01 01 01
01 01 01 01 01 01 6b 6e 00 a0 a0 40 84 60 30 20
66 00 58 d7 10 00 00 1a 00 00 00 fd 0c 30 a5 1f
1f 4e 01 0a 20 20 20 20 20 20 00 00 00 fe 00 3d
4c 33 30 31 30 20 20 20 20 20 20 ff 00 00 00 fc
00 4e 45 31 36 30 51 44 4d 2d 4e 59 4d 0a 01 97

70 20 79 02 00 21 00 1d 77 0d 6a 08 00 0a 40 06
80 56 7a 54 d0 64 9b 56 92 0f 02 35 54 40 5e 40
5e 00 44 12 78 22 00 14 69 dc 0b 85 ff 09 9f 00
2f 00 1f 00 3f 06 83 00 05 00 05 00 2b 00 0c 27
00 30 a4 00 00 27 00 30 3b 00 00 2e 00 06 00 44
40 5e 40 5e 81 00 1e 72 1a 00 00 03 71 30 a5 00
00 60 ff 60 ff a5 00 00 00 00 e3 05 04 00 e6 06
01 01 60 60 ff 00 00 00 00 00 00 00 00 00 28 90

----------------

Block 0, Base EDID:
  EDID Structure Version & Revision: 1.4
  Vendor & Product Identification:
    Manufacturer: BOE
    Model: 3350
    Made in: week 12 of 2024
  Basic Display Parameters & Features:
    Digital display
    Bits per primary color channel: 8
    DisplayPort interface
    Maximum image size: 34 cm x 22 cm
    Gamma: 2.20
    Supported color formats: RGB 4:4:4
    Default (sRGB) color space is primary color space
    First detailed timing includes the native pixel format and preferred refresh rate
    Display supports continuous frequencies
  Color Characteristics:
    Red  : 0.6464, 0.3300
    Green: 0.3007, 0.6074
    Blue : 0.1464, 0.0605
    White: 0.3134, 0.3291
  Established Timings I & II: none
  Standard Timings: none
  Detailed Timing Descriptors:
    DTD 1:  2560x1600   60.001613 Hz  16:10   103.923 kHz    282.670000 MHz (344 mm x 215 mm)
                 Hfront   48 Hsync  32 Hback   80 Hpol P
                 Vfront    6 Vsync   6 Vback  120 Vpol N
    Display Range Limits:
      Monitor ranges (Range Limits Only): 48-165 Hz V, 286-286 kHz H, max dotclock 780 MHz
    Alphanumeric Data String: '=L3010      '
    Display Product Name: 'NE160QDM-NYM'
  Extension blocks: 1
Checksum: 0x97

----------------

Block 1, DisplayID Extension Block:
  Version: 2.0
  Extension Count: 0
  Display Product Primary Use Case: None of the listed primary use cases; generic display
  Display Parameters Data Block (0x21):
    Image size: 344.7 mm x 215.4 mm
    Display native pixel format: 2560x1600
    Scan Orientation: Left to Right, Top to Bottom
    Luminance Information: Minimum guaranteed value
    Color Information: CIE 1931
    Audio Speaker Information: not integrated
    Native Color Chromaticity:
      Primary #1:  (0.645996, 0.329834)
      Primary #2:  (0.300781, 0.606934)
      Primary #3:  (0.145996, 0.060791)
      White Point: (0.312988, 0.328857)
    Native Maximum Luminance (Full Coverage): 400.000000 cd/m^2
    Native Maximum Luminance (10% Rectangular Coverage): 400.000000 cd/m^2
    Native Minimum Luminance: 4.000000 cd/m^2
    Native Color Depth: 8 bpc
    Display Device Technology: Active Matrix LCD
    Native Gamma EOTF: 2.20
  Video Timing Modes Type 7 - Detailed Timings Data Block:
    DTD:  2560x1600  165.000085 Hz  16:10   285.780 kHz    777.322000 MHz (aspect 16:10, no 3D stereo, preferred)
               Hfront   48 Hsync  32 Hback   80 Hpol N
               Vfront    6 Vsync   6 Vback  120 Vpol N
  Adaptive Sync Data Block:
    Descriptor #1:
      Native Panel Range
      Fixed Average V-Total and Adaptive V-Total
      Supports Seamless Transition
      'Max Single Frame Duration Increase' field value without jitter impact
      'Max Single Frame Duration Decrease' field value without jitter impact
      Max Duration Increase: 0.00 ms
      Max Duration Decrease: 0.00 ms
      Min Refresh Rate: 48 Hz
      Max Refresh Rate: 165 Hz
    Descriptor #2:
      Native Panel Range
      Fixed Average V-Total and Adaptive V-Total
      Supports Seamless Transition
      'Max Single Frame Duration Increase' field value without jitter impact
      'Max Single Frame Duration Decrease' field value without jitter impact
      Max Duration Increase: 0.00 ms
      Max Duration Decrease: 0.00 ms
      Min Refresh Rate: 48 Hz
      Max Refresh Rate: 60 Hz
  Brightness Luminance Range Data Block:
    Minimum SDR Luminance (Full Coverage): 4.000000 cd/m^2
    Maximum Suggested SDR Luminance (Full Coverage): 400.000000 cd/m^2
    Maximum Boost SDR Luminance: 400.000000 cd/m^2
  CTA-861 DisplayID Data Block:
  Vendor-Specific Data Block (AMD), OUI 00-00-1A:
    Version: 3
    Flags 1: 0x71
      FreeSync Supported
      Panel Replay/PSR Switch Supported
      Dynamic Link Rate Control Supported
      Panel Replay Supported
    Minimum Refresh Rate: 48 Hz
    Maximum Refresh Rate: 165 Hz
    Flags 5: 0x00
  Colorimetry Data Block:
    sYCC601
  HDR Static Metadata Data Block:
    Electro optical transfer functions:
      Traditional gamma - SDR luminance range
    Supported static metadata descriptors:
      Static metadata type 1
    Desired content max luminance: 96 (400.000 cd/m^2)
    Desired content max frame-average luminance: 96 (400.000 cd/m^2)
    Desired content min luminance: 255 (4.000 cd/m^2)
  Checksum: 0x28
Checksum: 0x90

----------------

Warnings:

EDID:
  Base EDID: Some timings are out of range of the Monitor Ranges:
    Horizontal Freq: 103.922 - 285.780 kHz (Monitor: 286.000 - 286.000 kHz)

Failures:

Block 0, Base EDID:
  Basic Display Parameters & Features: sRGB is signaled, but the chromaticities do not match.
  Alphanumeric Data String: 0xff byte at position 12.
EDID:
  Extension Block 2 started with EDID header, ignoring Extension Blocks >= 2.

EDID conformity: FAIL
