edid-decode (hex):

00 ff ff ff ff ff ff 00 09 e5 d1 0c a1 ff 00 00
0e 22 01 04 a5 22 16 78 07 8a 05 a6 54 4c 98 25
0e 50 54 00 00 00 01 01 01 01 01 01 01 01 01 01
01 01 01 01 01 01 40 bf 00 a0 a0 40 78 65 30 20
36 00 59 d7 10 00 00 1a 00 00 00 fd 0c 3c f0 b1
b1 76 01 0a 20 20 20 20 20 20 00 00 00 00 00 00
00 00 00 00 00 00 00 00 00 00 00 00 00 00 00 03
00 0d 20 ff 0a 3c fa 32 13 4b fa 00 00 00 01 a8

70 20 79 02 00 22 00 14 ff ed 11 85 ff 09 9f 00
2f 00 1f 00 3f 06 c7 00 02 00 05 00 25 01 09 ff
ed 11 ff ed 11 3c f0 80 81 00 15 74 1a 00 00 03
01 3c f0 00 00 6a 47 6a 47 f0 00 00 00 00 00 00
2b 00 0c 27 00 3c ef 00 00 27 00 30 3b 00 00 21
01 1d 77 0d 6a 08 00 0a 40 06 88 66 fa 53 c8 94
98 51 12 0e 02 35 54 d0 5f d0 5f 3d 36 12 78 2e
00 06 40 4e d0 5f d0 5f 00 00 00 00 00 00 e4 90

00 ff ff ff ff ff ff 00 09 e5 d1 0c a1 ff 00 00
0e 22 01 04 a5 22 16 78 07 8a 05 a6 54 4c 98 25
0e 50 54 00 00 00 01 01 01 01 01 01 01 01 01 01
01 01 01 01 01 01 40 bf 00 a0 a0 40 78 65 30 20
36 00 59 d7 10 00 00 1a 00 00 00 fd 0c 3c f0 b1
b1 76 01 0a 20 20 20 20 20 20 00 00 00 00 00 00
00 00 00 00 00 00 00 00 00 00 00 00 00 00 00 03
00 0d 20 ff 0a 3c fa 32 13 4b fa 00 00 00 01 a8

70 20 79 02 00 22 00 14 ff ed 11 85 ff 09 9f 00
2f 00 1f 00 3f 06 c7 00 02 00 05 00 25 01 09 ff
ed 11 ff ed 11 3c f0 80 81 00 15 74 1a 00 00 03
01 3c f0 00 00 6a 47 6a 47 f0 00 00 00 00 00 00
2b 00 0c 27 00 3c ef 00 00 27 00 30 3b 00 00 21
01 1d 77 0d 6a 08 00 0a 40 06 88 66 fa 53 c8 94
98 51 12 0e 02 35 54 d0 5f d0 5f 3d 36 12 78 2e
00 06 40 4e d0 5f d0 5f 00 00 00 00 00 00 e4 90

----------------

Block 0, Base EDID:
  EDID Structure Version & Revision: 1.4
  Vendor & Product Identification:
    Manufacturer: BOE
    Model: 3281
    Serial Number: ...
    Made in: week 14 of 2024
  Basic Display Parameters & Features:
    Digital display
    Bits per primary color channel: 8
    DisplayPort interface
    Maximum image size: 34 cm x 22 cm
    Gamma: 2.20
    Supported color formats: RGB 4:4:4
    Default (sRGB) color space is primary color space
    First detailed timing includes the native pixel format and preferred refresh rate
    Display supports continuous frequencies
  Color Characteristics:
    Red  : 0.6503, 0.3281
    Green: 0.2988, 0.5957
    Blue : 0.1445, 0.0546
    White: 0.3134, 0.3291
  Established Timings I & II: none
  Standard Timings: none
  Detailed Timing Descriptors:
    DTD 1:  2560x1600   60.000000 Hz  16:10   180.000 kHz    489.600000 MHz (345 mm x 215 mm)
                 Hfront   48 Hsync  32 Hback   80 Hpol P
                 Vfront    3 Vsync   6 Vback 1391 Vpol N
    Display Range Limits:
      Monitor ranges (Range Limits Only): 60-240 Hz V, 432-432 kHz H, max dotclock 1180 MHz
    Empty Descriptor
    Manufacturer-Specified Display Descriptor (0x03): 00 03 00 0d 20 ff 0a 3c fa 32 13 4b fa 00 00 00 '.... ..<.2.K....'
  Extension blocks: 1
Checksum: 0xa8

----------------

Block 1, DisplayID Extension Block:
  Version: 2.0
  Extension Count: 0
  Display Product Primary Use Case: None of the listed primary use cases; generic display
  Video Timing Modes Type 7 - Detailed Timings Data Block:
    DTD:  2560x1600  240.000000 Hz  16:10   432.000 kHz   1175.040000 MHz (aspect 16:10, no 3D stereo, preferred)
               Hfront   48 Hsync  32 Hback   80 Hpol N
               Vfront    3 Vsync   6 Vback  191 Vpol N
  Dynamic Video Timing Range Limits Data Block:
    Minimum Pixel Clock: 1175040 kHz
    Maximum Pixel Clock: 1175040 kHz
    Minimum Vertical Refresh Rate: 60 Hz
    Maximum Vertical Refresh Rate: 240 Hz
    Seamless Dynamic Video Timing Support: Yes
  CTA-861 DisplayID Data Block:
  Vendor-Specific Data Block (AMD), OUI 00-00-1A:
    Version: 3
    Flags 1: 0x01
      FreeSync Supported
    Minimum Refresh Rate: 60 Hz
    Maximum Refresh Rate: 240 Hz
    Flags 5: 0x00
  Adaptive Sync Data Block:
    Descriptor #1:
      Native Panel Range
      Fixed Average V-Total and Adaptive V-Total
      Supports Seamless Transition
      'Max Single Frame Duration Increase' field value without jitter impact
      'Max Single Frame Duration Decrease' field value without jitter impact
      Max Duration Increase: 0.00 ms
      Max Duration Decrease: 0.00 ms
      Min Refresh Rate: 60 Hz
      Max Refresh Rate: 240 Hz
    Descriptor #2:
      Native Panel Range
      Fixed Average V-Total and Adaptive V-Total
      Supports Seamless Transition
      'Max Single Frame Duration Increase' field value without jitter impact
      'Max Single Frame Duration Decrease' field value without jitter impact
      Max Duration Increase: 0.00 ms
      Max Duration Decrease: 0.00 ms
      Min Refresh Rate: 48 Hz
      Max Refresh Rate: 60 Hz
  Display Parameters Data Block (0x21):
    Image size: 344.7 mm x 215.4 mm
    Display native pixel format: 2560x1600
    Scan Orientation: Left to Right, Top to Bottom
    Luminance Information: Guidance for the Source device
    Color Information: CIE 1931
    Audio Speaker Information: not integrated
    Native Color Chromaticity:
      Primary #1:  (0.649902, 0.327881)
      Primary #2:  (0.298828, 0.595947)
      Primary #3:  (0.144775, 0.054932)
      White Point: (0.312988, 0.328857)
    Native Maximum Luminance (Full Coverage): 500.000000 cd/m^2
    Native Maximum Luminance (10% Rectangular Coverage): 500.000000 cd/m^2
    Native Minimum Luminance: 0.389893 cd/m^2
    Native Color Depth: 8 bpc
    Display Device Technology: Active Matrix LCD
    Display Device Theme Preference: No Preference
    Native Gamma EOTF: 2.20
  Brightness Luminance Range Data Block:
    Minimum SDR Luminance (Full Coverage): 25.000000 cd/m^2
    Maximum Suggested SDR Luminance (Full Coverage): 500.000000 cd/m^2
    Maximum Boost SDR Luminance: 500.000000 cd/m^2
  Checksum: 0xe4
Checksum: 0x90

----------------

Warnings:

Block 0, Base EDID:
  Missing Display Product Name.
EDID:
  Base EDID: Some timings are out of range of the Monitor Ranges:
    Horizontal Freq: 180.000 - 432.000 kHz (Monitor: 432.000 - 432.000 kHz)

Failures:

Block 0, Base EDID:
  Basic Display Parameters & Features: sRGB is signaled, but the chromaticities do not match.
  Empty Descriptor: Use Dummy Descriptor instead of all zeroes.
EDID:
  Extension Block 2 started with EDID header, ignoring Extension Blocks >= 2.

EDID conformity: FAIL
