edid-decode (hex):

00 ff ff ff ff ff ff 00 61 a9 01 d0 15 d9 00 00
1f 21 01 03 80 35 1d 78 ae 28 d0 a6 55 4f 9b 26
0e 49 48 ad cf 00 71 4f 81 40 81 80 95 00 a9 c0
b3 00 d1 c0 81 c0 02 3a 80 18 71 38 2d 40 58 2c
45 00 0f 28 21 00 00 1e 00 00 00 ff 00 34 34 34
30 32 32 30 30 35 35 35 37 33 00 00 00 fd 00 30
a5 61 ba 3c 00 0a 20 20 20 20 20 20 00 00 00 fc
00 41 32 34 46 41 41 2d 52 47 0a 20 20 20 01 8e

02 03 47 f3 4e 01 02 11 13 04 14 05 1f 10 40 3f
03 12 4d 23 09 07 07 83 01 00 00 e2 00 ca 67 03
0c 00 10 00 18 43 67 d8 5d c4 01 78 80 01 6d 1a
00 00 02 01 30 a5 00 00 00 00 00 00 e3 05 e3 01
e6 06 07 01 60 50 3a cf 70 80 a0 70 38 4d 40 30
20 35 00 1f 2e 21 00 00 1e 4b 80 80 78 70 38 26
40 18 20 35 00 1f 2e 21 00 00 1e 4c 98 80 a0 70
38 38 40 30 2c 35 00 1f 2e 21 00 00 1e 00 00 c1

00 ff ff ff ff ff ff 00 61 a9 01 d0 15 d9 00 00
1f 21 01 03 80 35 1d 78 ae 28 d0 a6 55 4f 9b 26
0e 49 48 ad cf 00 71 4f 81 40 81 80 95 00 a9 c0
b3 00 d1 c0 81 c0 02 3a 80 18 71 38 2d 40 58 2c
45 00 0f 28 21 00 00 1e 00 00 00 ff 00 34 34 34
30 32 32 30 30 35 35 35 37 33 00 00 00 fd 00 30
a5 61 ba 3c 00 0a 20 20 20 20 20 20 00 00 00 fc
00 41 32 34 46 41 41 2d 52 47 0a 20 20 20 01 8e

02 03 47 f3 4e 01 02 11 13 04 14 05 1f 10 40 3f
03 12 4d 23 09 07 07 83 01 00 00 e2 00 ca 67 03
0c 00 10 00 18 43 67 d8 5d c4 01 78 80 01 6d 1a
00 00 02 01 30 a5 00 00 00 00 00 00 e3 05 e3 01
e6 06 07 01 60 50 3a cf 70 80 a0 70 38 4d 40 30
20 35 00 1f 2e 21 00 00 1e 4b 80 80 78 70 38 26
40 18 20 35 00 1f 2e 21 00 00 1e 4c 98 80 a0 70
38 38 40 30 2c 35 00 1f 2e 21 00 00 1e 00 00 c1

----------------

Block 0, Base EDID:
  EDID Structure Version & Revision: 1.3
  Vendor & Product Identification:
    Manufacturer: XMI
    Model: 53249
    Serial Number: ...
    Made in: week 31 of 2023
  Basic Display Parameters & Features:
    Digital display
    Maximum image size: 53 cm x 29 cm
    Gamma: 2.20
    DPMS levels: Standby Off
    RGB color display
    Default (sRGB) color space is primary color space
    First detailed timing is the preferred timing
  Color Characteristics:
    Red  : 0.6484, 0.3339
    Green: 0.3105, 0.6054
    Blue : 0.1513, 0.0556
    White: 0.2851, 0.2812
  Established Timings I & II:
    IBM     :   720x400    70.081663 Hz   9:5     31.467 kHz     28.320000 MHz
    DMT 0x04:   640x480    59.940476 Hz   4:3     31.469 kHz     25.175000 MHz
    DMT 0x05:   640x480    72.808802 Hz   4:3     37.861 kHz     31.500000 MHz
    DMT 0x06:   640x480    75.000000 Hz   4:3     37.500 kHz     31.500000 MHz
    DMT 0x09:   800x600    60.316541 Hz   4:3     37.879 kHz     40.000000 MHz
    DMT 0x0a:   800x600    72.187572 Hz   4:3     48.077 kHz     50.000000 MHz
    DMT 0x0b:   800x600    75.000000 Hz   4:3     46.875 kHz     49.500000 MHz
    DMT 0x10:  1024x768    60.003840 Hz   4:3     48.363 kHz     65.000000 MHz
    DMT 0x11:  1024x768    70.069359 Hz   4:3     56.476 kHz     75.000000 MHz
    DMT 0x12:  1024x768    75.028582 Hz   4:3     60.023 kHz     78.750000 MHz
    DMT 0x24:  1280x1024   75.024675 Hz   5:4     79.976 kHz    135.000000 MHz
  Standard Timings:
    DMT 0x15:  1152x864    75.000000 Hz   4:3     67.500 kHz    108.000000 MHz
    DMT 0x20:  1280x960    60.000000 Hz   4:3     60.000 kHz    108.000000 MHz
    DMT 0x23:  1280x1024   60.019740 Hz   5:4     63.981 kHz    108.000000 MHz
    DMT 0x2f:  1440x900    59.887445 Hz  16:10    55.935 kHz    106.500000 MHz
    DMT 0x53:  1600x900    60.000000 Hz  16:9     60.000 kHz    108.000000 MHz (RB)
    DMT 0x3a:  1680x1050   59.954250 Hz  16:10    65.290 kHz    146.250000 MHz
    DMT 0x52:  1920x1080   60.000000 Hz  16:9     67.500 kHz    148.500000 MHz
    DMT 0x55:  1280x720    60.000000 Hz  16:9     45.000 kHz     74.250000 MHz
  Detailed Timing Descriptors:
    DTD 1:  1920x1080   60.000000 Hz  16:9     67.500 kHz    148.500000 MHz (527 mm x 296 mm)
                 Hfront   88 Hsync  44 Hback  148 Hpol P
                 Vfront    4 Vsync   5 Vback   36 Vpol P
    Display Product Serial Number: ...
    Display Range Limits:
      Monitor ranges (GTF): 48-165 Hz V, 97-186 kHz H, max dotclock 600 MHz
    Display Product Name: 'A24FAA-RG'
  Extension blocks: 1
Checksum: 0x8e

----------------

Block 1, CTA-861 Extension Block:
  Revision: 3
  Underscans IT Video Formats by default
  Basic audio support
  Supports YCbCr 4:4:4
  Supports YCbCr 4:2:2
  Native DTDs: 3
  Video Data Block:
    VIC   1:   640x480    59.940476 Hz   4:3     31.469 kHz     25.175000 MHz
    VIC   2:   720x480    59.940060 Hz   4:3     31.469 kHz     27.000000 MHz
    VIC  17:   720x576    50.000000 Hz   4:3     31.250 kHz     27.000000 MHz
    VIC  19:  1280x720    50.000000 Hz  16:9     37.500 kHz     74.250000 MHz
    VIC   4:  1280x720    60.000000 Hz  16:9     45.000 kHz     74.250000 MHz
    VIC  20:  1920x1080i  50.000000 Hz  16:9     28.125 kHz     74.250000 MHz
    VIC   5:  1920x1080i  60.000000 Hz  16:9     33.750 kHz     74.250000 MHz
    VIC  31:  1920x1080   50.000000 Hz  16:9     56.250 kHz    148.500000 MHz
    VIC  16:  1920x1080   60.000000 Hz  16:9     67.500 kHz    148.500000 MHz
    VIC  64:  1920x1080  100.000000 Hz  16:9    112.500 kHz    297.000000 MHz
    VIC  63:  1920x1080  120.000000 Hz  16:9    135.000 kHz    297.000000 MHz
    VIC   3:   720x480    59.940060 Hz  16:9     31.469 kHz     27.000000 MHz
    VIC  18:   720x576    50.000000 Hz  16:9     31.250 kHz     27.000000 MHz
    VIC  77:  1920x1080  100.000000 Hz  64:27   112.500 kHz    297.000000 MHz
  Audio Data Block:
    Linear PCM:
      Max channels: 2
      Supported sample rates (kHz): 48 44.1 32
      Supported sample sizes (bits): 24 20 16
  Speaker Allocation Data Block:
    FL/FR - Front Left/Right
  Video Capability Data Block:
    YCbCr quantization: Selectable (via AVI YQ)
    RGB quantization: Selectable (via AVI Q)
    PT scan behavior: No Data
    IT scan behavior: Always Underscanned
    CE scan behavior: Always Underscanned
  Vendor-Specific Data Block (HDMI), OUI 00-0C-03:
    Source physical address: 1.0.0.0
    DC_30bit
    DC_Y444
    Maximum TMDS clock: 335 MHz
  Vendor-Specific Data Block (HDMI Forum), OUI C4-5D-D8:
    Version: 1
    Maximum TMDS Character Rate: 600 MHz
    SCDC Present
    Supports 10-bits/component Deep Color 4:2:0 Pixel Encoding
  Vendor-Specific Data Block (AMD), OUI 00-00-1A:
    Version: 2
    Flags 1: 0x01
      FreeSync Supported
    Minimum Refresh Rate: 48 Hz
    Maximum Refresh Rate: 165 Hz
    Flags 5: 0x00
  Colorimetry Data Block:
    xvYCC601
    xvYCC709
    BT2020cYCC
    BT2020YCC
    BT2020RGB
    Gamut Boundary Description Metadata Profile P0
  HDR Static Metadata Data Block:
    Electro optical transfer functions:
      Traditional gamma - SDR luminance range
      Traditional gamma - HDR luminance range
      SMPTE ST2084
    Supported static metadata descriptors:
      Static metadata type 1
    Desired content max luminance: 96 (400.000 cd/m^2)
    Desired content max frame-average luminance: 80 (282.843 cd/m^2)
    Desired content min luminance: 58 (0.207 cd/m^2)
  Detailed Timing Descriptors:
    DTD 2:  1920x1080  120.001163 Hz  16:9    138.841 kHz    288.790000 MHz (543 mm x 302 mm)
                 Hfront   48 Hsync  32 Hback   80 Hpol P
                 Vfront    3 Vsync   5 Vback   69 Vpol P
    DTD 3:  1920x1080  144.002771 Hz  16:9    160.995 kHz    328.430000 MHz (543 mm x 302 mm)
                 Hfront   24 Hsync  32 Hback   64 Hpol P
                 Vfront    3 Vsync   5 Vback   30 Vpol P
    DTD 4:  1920x1080  165.002031 Hz  16:9    187.442 kHz    389.880000 MHz (543 mm x 302 mm)
                 Hfront   48 Hsync  44 Hback   68 Hpol P
                 Vfront    3 Vsync   5 Vback   48 Vpol P
Checksum: 0xc1  Unused space in Extension Block: 2 bytes

----------------

Warnings:

Block 1, CTA-861 Extension Block:
  Video Data Block: VIC 1 and the first DTD are not identical. Is this intended?
  Display Product Serial Number is set, so the Serial Number in the Base EDID should be 0.
EDID:
  Base EDID: Some timings are out of range of the Monitor Ranges:
    Horizontal Freq: 28.125 - 187.442 kHz (Monitor: 97.000 - 186.000 kHz)

Failures:

Block 0, Base EDID:
  Basic Display Parameters & Features: sRGB is signaled, but the chromaticities do not match.
Block 1, CTA-861 Extension Block:
  Detailed Timing Descriptor #2: Mismatch of image size 543x302 mm vs display size 530x290 mm.
  Detailed Timing Descriptor #3: Mismatch of image size 543x302 mm vs display size 530x290 mm.
  Detailed Timing Descriptor #4: Mismatch of image size 543x302 mm vs display size 530x290 mm.
EDID:
  Extension Block 2 started with EDID header, ignoring Extension Blocks >= 2.
  Base EDID: The DTD max image size is 543x302mm, which is larger than the display size 530.0x290.0mm.

EDID conformity: FAIL
