edid-decode (hex):

00 ff ff ff ff ff ff 00 0d ae b5 13 00 00 00 00
1c 1e 01 04 a5 1d 11 78 02 ee 95 a3 54 4c 99 26
0f 50 54 00 00 00 01 01 01 01 01 01 01 01 01 01
01 01 01 01 01 01 36 36 80 a0 70 38 20 40 30 20
a5 00 25 a5 10 00 00 1a 36 36 80 a0 70 38 36 41
30 20 a5 00 25 a5 10 00 00 1a 00 00 00 fe 00 37
46 48 54 32 80 31 33 33 48 43 47 0a 00 00 00 00
00 02 41 01 a8 00 10 00 00 0a 01 0a 20 20 00 11

00 ff ff ff ff ff ff 00 0d ae b5 13 00 00 00 00
1c 1e 01 04 a5 1d 11 78 02 ee 95 a3 54 4c 99 26
0f 50 54 00 00 00 01 01 01 01 01 01 01 01 01 01
01 01 01 01 01 01 36 36 80 a0 70 38 20 40 30 20
a5 00 25 a5 10 00 00 1a 36 36 80 a0 70 38 36 41
30 20 a5 00 25 a5 10 00 00 1a 00 00 00 fe 00 37
46 48 54 32 80 31 33 33 48 43 47 0a 00 00 00 00
00 02 41 01 a8 00 10 00 00 0a 01 0a 20 20 00 11

----------------

Block 0, Base EDID:
  EDID Structure Version & Revision: 1.4
  Vendor & Product Identification:
    Manufacturer: CMN
    Model: 5045
    Made in: week 28 of 2020
  Basic Display Parameters & Features:
    Digital display
    Bits per primary color channel: 8
    DisplayPort interface
    Maximum image size: 29 cm x 17 cm
    Gamma: 2.20
    Supported color formats: RGB 4:4:4
    First detailed timing includes the native pixel format and preferred refresh rate
  Color Characteristics:
    Red  : 0.6396, 0.3300
    Green: 0.2998, 0.5996
    Blue : 0.1503, 0.0595
    White: 0.3134, 0.3291
  Established Timings I & II: none
  Standard Timings: none
  Detailed Timing Descriptors:
    DTD 1:  1920x1080   60.001038 Hz  16:9     66.721 kHz    138.780000 MHz (293 mm x 165 mm)
                 Hfront   48 Hsync  32 Hback   80 Hpol P
                 Vfront   10 Vsync   5 Vback   17 Vpol N
    DTD 2:  1920x1080   48.000830 Hz  16:9     66.721 kHz    138.780000 MHz (293 mm x 165 mm)
                 Hfront   48 Hsync  32 Hback   80 Hpol P
                 Vfront   10 Vsync   5 Vback  295 Vpol N
    Alphanumeric Data String: '7FHT2.133HCG'
    Manufacturer-Specified Display Descriptor (0x00): 00 00 00 02 41 01 a8 00 10 00 00 0a 01 0a 20 20 '....A.........  '
Checksum: 0x11

----------------

Block 1, Unknown EDID Extension Block 0x00:
  00 ff ff ff ff ff ff 00 0d ae b5 13 00 00 00 00 '................'
  1c 1e 01 04 a5 1d 11 78 02 ee 95 a3 54 4c 99 26 '.......x....TL.&'
  0f 50 54 00 00 00 01 01 01 01 01 01 01 01 01 01 '.PT.............'
  01 01 01 01 01 01 36 36 80 a0 70 38 20 40 30 20 '......66..p8 @0 '
  a5 00 25 a5 10 00 00 1a 36 36 80 a0 70 38 36 41 '..%.....66..p86A'
  30 20 a5 00 25 a5 10 00 00 1a 00 00 00 fe 00 37 '0 ..%..........7'
  46 48 54 32 80 31 33 33 48 43 47 0a 00 00 00 00 'FHT2.133HCG.....'
  00 02 41 01 a8 00 10 00 00 0a 01 0a 20 20 00 11 '..A.........  ..'
Checksum: 0x11

----------------

Warnings:

Block 0, Base EDID:
  Alphanumeric Data String: Non-ASCII character 0x80 at position 5, can cause problems.
  Missing Display Product Name.

Failures:

Block 1, Base EDID:
  Unknown Extension Block.
EDID:
  Base EDID: EDID specified 0 extension block(s), but found 1 extension block(s).

EDID conformity: FAIL
