edid-decode (hex):

00 ff ff ff ff ff ff 00 06 af b6 ce a1 ff 00 00
28 22 01 04 a5 1e 13 78 03 bb 45 91 55 58 92 2a
20 50 54 00 00 00 01 01 01 01 01 01 01 01 01 01
01 01 01 01 01 01 0e 3d 80 a4 70 b0 32 40 30 20
35 00 2d bc 10 00 00 18 b4 28 80 a4 70 b0 32 40
30 20 35 00 2d bc 10 00 00 18 00 00 00 00 00 00
00 00 00 00 00 00 00 00 00 00 00 00 00 00 00 02
00 10 3c ff 0f 3c 96 0d 0c 1e 96 00 00 20 01 e4

70 20 79 02 00 22 00 14 8b 62 02 85 7f 07 a3 00
2f 80 1f 00 af 04 31 00 02 00 04 00 25 01 09 8b
62 02 8b 62 02 28 3c 80 81 00 15 74 1a 00 00 03
01 28 3c 00 00 53 51 53 51 3c 00 00 00 00 00 00
00 00 00 00 00 00 00 00 00 00 00 00 00 00 00 00
00 00 00 00 00 00 00 00 00 00 00 00 00 00 00 00
00 00 00 00 00 00 00 00 00 00 00 00 00 00 00 00
00 00 00 00 00 00 00 00 00 00 00 00 00 00 d9 90

00 ff ff ff ff ff ff 00 06 af b6 ce a1 ff 00 00
28 22 01 04 a5 1e 13 78 03 bb 45 91 55 58 92 2a
20 50 54 00 00 00 01 01 01 01 01 01 01 01 01 01
01 01 01 01 01 01 0e 3d 80 a4 70 b0 32 40 30 20
35 00 2d bc 10 00 00 18 b4 28 80 a4 70 b0 32 40
30 20 35 00 2d bc 10 00 00 18 00 00 00 00 00 00
00 00 00 00 00 00 00 00 00 00 00 00 00 00 00 02
00 10 3c ff 0f 3c 96 0d 0c 1e 96 00 00 20 01 e4

70 20 79 02 00 22 00 14 8b 62 02 85 7f 07 a3 00
2f 80 1f 00 af 04 31 00 02 00 04 00 25 01 09 8b
62 02 8b 62 02 28 3c 80 81 00 15 74 1a 00 00 03
01 28 3c 00 00 53 51 53 51 3c 00 00 00 00 00 00
00 00 00 00 00 00 00 00 00 00 00 00 00 00 00 00
00 00 00 00 00 00 00 00 00 00 00 00 00 00 00 00
00 00 00 00 00 00 00 00 00 00 00 00 00 00 00 00
00 00 00 00 00 00 00 00 00 00 00 00 00 00 d9 90

----------------

Block 0, Base EDID:
  EDID Structure Version & Revision: 1.4
  Vendor & Product Identification:
    Manufacturer: AUO
    Model: 52918
    Serial Number: ...
    Made in: week 40 of 2024
  Basic Display Parameters & Features:
    Digital display
    Bits per primary color channel: 8
    DisplayPort interface
    Maximum image size: 30 cm x 19 cm
    Gamma: 2.20
    Supported color formats: RGB 4:4:4
    First detailed timing includes the native pixel format and preferred refresh rate
    Display supports continuous frequencies
  Color Characteristics:
    Red  : 0.5683, 0.3349
    Green: 0.3457, 0.5732
    Blue : 0.1650, 0.1250
    White: 0.3134, 0.3291
  Established Timings I & II: none
  Standard Timings: none
  Detailed Timing Descriptors:
    DTD 1:  1920x1200   60.000000 Hz  16:10    75.000 kHz    156.300000 MHz (301 mm x 188 mm)
                 Hfront   48 Hsync  32 Hback   84 Hpol N
                 Vfront    3 Vsync   5 Vback   42 Vpol N
    DTD 2:  1920x1200   40.000000 Hz  16:10    50.000 kHz    104.200000 MHz (301 mm x 188 mm)
                 Hfront   48 Hsync  32 Hback   84 Hpol N
                 Vfront    3 Vsync   5 Vback   42 Vpol N
    Empty Descriptor
    Manufacturer-Specified Display Descriptor (0x02): 00 02 00 10 3c ff 0f 3c 96 0d 0c 1e 96 00 00 20 '....<..<....... '
  Extension blocks: 1
Checksum: 0xe4

----------------

Block 1, DisplayID Extension Block:
  Version: 2.0
  Extension Count: 0
  Display Product Primary Use Case: None of the listed primary use cases; generic display
  Video Timing Modes Type 7 - Detailed Timings Data Block:
    DTD:  1920x1200   60.000000 Hz  16:10    75.000 kHz    156.300000 MHz (aspect 16:10, no 3D stereo, preferred)
               Hfront   48 Hsync  32 Hback   84 Hpol P
               Vfront    3 Vsync   5 Vback   42 Vpol N
  Dynamic Video Timing Range Limits Data Block:
    Minimum Pixel Clock: 156300 kHz
    Maximum Pixel Clock: 156300 kHz
    Minimum Vertical Refresh Rate: 40 Hz
    Maximum Vertical Refresh Rate: 60 Hz
    Seamless Dynamic Video Timing Support: Yes
  CTA-861 DisplayID Data Block:
  Vendor-Specific Data Block (AMD), OUI 00-00-1A:
    Version: 3
    Feature Caps: 0x01
    Minimum Refresh Rate: 40 Hz
    Maximum Refresh Rate: 60 Hz
    Flags 1.x: 0x00
    Flags 2.x: 0x00
  Checksum: 0xd9
Checksum: 0x90

----------------

Warnings:

Block 0, Base EDID:
  Missing Display Product Name.

Failures:

Block 0, Base EDID:
  Empty Descriptor: Use Dummy Descriptor instead of all zeroes.
  Missing Display Range Limits Descriptor.
EDID:
  Extension Block 2 started with EDID header, ignoring Extension Blocks >= 2.
  DisplayID: Missing DisplayID Display Parameters Data Block.

EDID conformity: FAIL
