edid-decode (hex):

00 ff ff ff ff ff ff 00 06 af 2d 46 00 00 00 00
31 1a 01 04 95 1d 11 78 02 c3 15 93 58 59 92 29
22 50 54 00 00 00 01 01 01 01 01 01 01 01 01 01
01 01 01 01 01 01 14 37 80 b8 70 38 24 40 10 10
3e 00 25 a5 10 00 00 1a 10 2c 80 b8 70 38 24 40
10 10 3e 00 25 a5 10 00 00 1a 00 00 00 fe 00 46
37 56 44 4a 80 42 31 33 33 48 41 4e 00 00 00 00
00 01 81 01 9e 01 11 00 00 0a 01 0a 20 20 00 da

----------------

Block 0, Base EDID:
  EDID Structure Version & Revision: 1.4
  Vendor & Product Identification:
    Manufacturer: AUO
    Model: 17965
    Made in: week 49 of 2016
  Basic Display Parameters & Features:
    Digital display
    Bits per primary color channel: 6
    DisplayPort interface
    Maximum image size: 29 cm x 17 cm
    Gamma: 2.20
    Supported color formats: RGB 4:4:4
    First detailed timing includes the native pixel format and preferred refresh rate
  Color Characteristics:
    Red  : 0.5771, 0.3437
    Green: 0.3476, 0.5732
    Blue : 0.1601, 0.1337
    White: 0.3134, 0.3291
  Established Timings I & II: none
  Standard Timings: none
  Detailed Timing Descriptors:
    DTD 1:  1920x1080   60.049471 Hz  16:9     67.015 kHz    141.000000 MHz (293 mm x 165 mm)
                 Hfront   16 Hsync  16 Hback  152 Hpol P
                 Vfront    3 Vsync  14 Vback   19 Vpol N
    DTD 2:  1920x1080   48.039576 Hz  16:9     53.612 kHz    112.800000 MHz (293 mm x 165 mm)
                 Hfront   16 Hsync  16 Hback  152 Hpol P
                 Vfront    3 Vsync  14 Vback   19 Vpol N
    Alphanumeric Data String: 'F7VDJ.B133HAN'
    Manufacturer-Specified Display Descriptor (0x00): 00 00 00 01 81 01 9e 01 11 00 00 0a 01 0a 20 20 '..............  '
Checksum: 0xda

----------------

Warnings:

Block 0, Base EDID:
  Alphanumeric Data String: Non-ASCII character 0x80 at position 5, can cause problems.
  Missing Display Product Name.

EDID conformity: PASS
