edid-decode (hex):

00 ff ff ff ff ff ff 00 09 d1 95 78 45 54 00 00
18 17 01 04 a5 22 13 78 26 b0 24 9f 59 56 93 26
0d 50 54 21 08 00 81 c0 01 01 01 01 01 01 01 01
01 01 01 01 01 01 66 21 56 aa 51 00 1e 30 46 8f
33 00 58 c1 10 00 00 1e 00 00 00 ff 00 48 36 44
30 30 30 38 35 30 38 36 0a 0a 00 00 00 fd 00 3b
3d 1e 3f 0b 00 0a 20 20 20 20 20 20 00 00 00 fc
00 42 65 6e 51 20 47 36 31 35 48 44 50 4c 00 bd

----------------

Block 0, Base EDID:
  EDID Structure Version & Revision: 1.4
  Vendor & Product Identification:
    Manufacturer: BNQ
    Model: 30869
    Serial Number: ...
    Made in: week 24 of 2013
  Basic Display Parameters & Features:
    Digital display
    Bits per primary color channel: 8
    DisplayPort interface
    Maximum image size: 34 cm x 19 cm
    Gamma: 2.20
    DPMS levels: Off
    Supported color formats: RGB 4:4:4
    Default (sRGB) color space is primary color space
    First detailed timing includes the native pixel format and preferred refresh rate
  Color Characteristics:
    Red  : 0.6230, 0.3505
    Green: 0.3359, 0.5742
    Blue : 0.1484, 0.0527
    White: 0.3134, 0.3281
  Established Timings I & II:
    DMT 0x04:   640x480    59.940476 Hz   4:3     31.469 kHz     25.175000 MHz
    DMT 0x09:   800x600    60.316541 Hz   4:3     37.879 kHz     40.000000 MHz
    DMT 0x10:  1024x768    60.003840 Hz   4:3     48.363 kHz     65.000000 MHz
  Standard Timings:
    DMT 0x55:  1280x720    60.000000 Hz  16:9     45.000 kHz     74.250000 MHz
  Detailed Timing Descriptors:
    DTD 1:  1366x768    59.789541 Hz 683:384   47.712 kHz     85.500000 MHz (344 mm x 193 mm)
                 Hfront   70 Hsync 143 Hback  213 Hpol P
                 Vfront    3 Vsync   3 Vback   24 Vpol P
    Display Product Serial Number: ...
    Display Range Limits:
      Monitor ranges (GTF): 59-61 Hz V, 30-63 kHz H, max dotclock 110 MHz
    Display Product Name: 'BenQ G615HDPL'
Checksum: 0xbd

----------------

Warnings:

Block 0, Base EDID:
  Vendor & Product Identification: The serial number is one of the known dummy values, it should probably be set to 0.
  Display Range Limits: GTF support is deprecated in EDID 1.4.

Failures:

Block 0, Base EDID:
  Display Product Serial Number: ...
  Basic Display Parameters & Features: sRGB is signaled, but the chromaticities do not match.
  Display Range Limits: GTF is supported, but the display does not support continuous frequencies.

EDID conformity: FAIL
