edid-decode (hex):

00 ff ff ff ff ff ff 00 08 59 00 22 01 01 01 01
03 13 01 03 81 46 27 78 0b cf 74 a3 57 4c b0 23
09 48 4c a1 08 00 81 40 01 01 01 01 01 01 01 01
01 01 01 01 01 01 d0 39 80 18 71 38 2d 40 58 2c
45 00 bc f9 10 00 00 1e 66 21 50 b0 51 00 1b 30
40 70 36 00 bc f9 10 00 00 1e 00 00 00 fc 00 42
42 59 5f 48 44 4d 49 0a 20 20 20 20 00 00 00 fd
00 37 4b 1e 5b 14 00 0a 20 20 20 20 20 20 01 79

02 03 1f f1 47 01 02 03 04 05 07 90 26 09 7f 07
15 07 50 83 01 00 00 67 03 0c 00 30 00 b8 23 8c
0a d0 8a 20 e0 2d 10 10 3e 96 00 c4 8e 21 00 00
18 01 1d 00 72 51 d0 1e 20 6e 28 55 00 c4 8e 21
00 00 1e 01 1d 80 18 71 1c 16 20 58 2c 25 00 c4
8e 21 00 00 9e 8c 0a d0 8a 20 e0 2d 10 10 3e 96
00 13 8e 21 00 00 18 00 00 00 00 00 00 00 00 00
00 00 00 00 00 00 00 00 00 00 00 00 00 00 00 b3

00 ff ff ff ff ff ff 00 08 59 00 22 01 01 01 01
03 13 01 03 81 46 27 78 0b cf 74 a3 57 4c b0 23
09 48 4c a1 08 00 81 40 01 01 01 01 01 01 01 01
01 01 01 01 01 01 d0 39 80 18 71 38 2d 40 58 2c
45 00 bc f9 10 00 00 1e 66 21 50 b0 51 00 1b 30
40 70 36 00 bc f9 10 00 00 1e 00 00 00 fc 00 42
42 59 5f 48 44 4d 49 0a 20 20 20 20 00 00 00 fd
00 37 4b 1e 5b 14 00 0a 20 20 20 20 20 20 01 79

02 03 1f f1 47 01 02 03 04 05 07 90 26 09 7f 07
15 07 50 83 01 00 00 67 03 0c 00 30 00 b8 23 8c
0a d0 8a 20 e0 2d 10 10 3e 96 00 c4 8e 21 00 00
18 01 1d 00 72 51 d0 1e 20 6e 28 55 00 c4 8e 21
00 00 1e 01 1d 80 18 71 1c 16 20 58 2c 25 00 c4
8e 21 00 00 9e 8c 0a d0 8a 20 e0 2d 10 10 3e 96
00 13 8e 21 00 00 18 00 00 00 00 00 00 00 00 00
00 00 00 00 00 00 00 00 00 00 00 00 00 00 00 b3

----------------

Block 0, Base EDID:
  EDID Structure Version & Revision: 1.3
  Vendor & Product Identification:
    Manufacturer: BBY
    Model: 8704
    Serial Number: ...
    Made in: week 3 of 2009
  Basic Display Parameters & Features:
    Digital display
    DFP 1.x compatible TMDS
    Maximum image size: 70 cm x 39 cm
    Gamma: 2.20
    RGB color display
    First detailed timing is the preferred timing
    Supports GTF timings within operating range
  Color Characteristics:
    Red  : 0.6396, 0.3398
    Green: 0.2998, 0.6904
    Blue : 0.1376, 0.0380
    White: 0.2822, 0.2968
  Established Timings I & II:
    IBM     :   720x400    70.081663 Hz   9:5     31.467 kHz     28.320000 MHz
    DMT 0x04:   640x480    59.940476 Hz   4:3     31.469 kHz     25.175000 MHz
    DMT 0x09:   800x600    60.316541 Hz   4:3     37.879 kHz     40.000000 MHz
    DMT 0x10:  1024x768    60.003840 Hz   4:3     48.363 kHz     65.000000 MHz
  Standard Timings:
    DMT 0x20:  1280x960    60.000000 Hz   4:3     60.000 kHz    108.000000 MHz
  Detailed Timing Descriptors:
    DTD 1:  1920x1080   59.797980 Hz  16:9     67.273 kHz    148.000000 MHz (444 mm x 249 mm)
                 Hfront   88 Hsync  44 Hback  148 Hpol P
                 Vfront    4 Vsync   5 Vback   36 Vpol P
    DTD 2:  1360x768    60.015162 Hz  85:48    47.712 kHz     85.500000 MHz (444 mm x 249 mm)
                 Hfront   64 Hsync 112 Hback  256 Hpol P
                 Vfront    3 Vsync   6 Vback   18 Vpol P
    Display Product Name: 'BBY_HDMI'
    Display Range Limits:
      Monitor ranges (GTF): 55-75 Hz V, 30-91 kHz H, max dotclock 200 MHz
  Extension blocks: 1
Checksum: 0x79

----------------

Block 1, CTA-861 Extension Block:
  Revision: 3
  Underscans IT Video Formats by default
  Basic audio support
  Supports YCbCr 4:4:4
  Supports YCbCr 4:2:2
  Native DTDs: 1
  Video Data Block:
    VIC   1:   640x480    59.940476 Hz   4:3     31.469 kHz     25.175000 MHz
    VIC   2:   720x480    59.940060 Hz   4:3     31.469 kHz     27.000000 MHz
    VIC   3:   720x480    59.940060 Hz  16:9     31.469 kHz     27.000000 MHz
    VIC   4:  1280x720    60.000000 Hz  16:9     45.000 kHz     74.250000 MHz
    VIC   5:  1920x1080i  60.000000 Hz  16:9     33.750 kHz     74.250000 MHz
    VIC   7:  1440x480i   59.940060 Hz  16:9     15.734 kHz     27.000000 MHz
    VIC  16:  1920x1080   60.000000 Hz  16:9     67.500 kHz    148.500000 MHz (native)
  Audio Data Block:
    Linear PCM:
      Max channels: 2
      Supported sample rates (kHz): 192 176.4 96 88.2 48 44.1 32
      Supported sample sizes (bits): 24 20 16
    AC-3:
      Max channels: 6
      Supported sample rates (kHz): 48 44.1 32
      Maximum bit rate: 640 kb/s
  Speaker Allocation Data Block:
    FL/FR - Front Left/Right
  Vendor-Specific Data Block (HDMI), OUI 00-0C-03:
    Source physical address: 3.0.0.0
    Supports_AI
    DC_36bit
    DC_30bit
    DC_Y444
    Maximum TMDS clock: 175 MHz
  Detailed Timing Descriptors:
    DTD 3:   720x480    59.940060 Hz   3:2     31.469 kHz     27.000000 MHz (708 mm x 398 mm)
                 Hfront   16 Hsync  62 Hback   60 Hpol N
                 Vfront    9 Vsync   6 Vback   30 Vpol N
    DTD 4:  1280x720    60.000000 Hz  16:9     45.000 kHz     74.250000 MHz (708 mm x 398 mm)
                 Hfront  110 Hsync  40 Hback  220 Hpol P
                 Vfront    5 Vsync   5 Vback   20 Vpol P
    DTD 5:  1920x1080i  60.000000 Hz  16:9     33.750 kHz     74.250000 MHz (708 mm x 398 mm)
                 Hfront   88 Hsync  44 Hback  148 Hpol P
                 Vfront    2 Vsync   5 Vback   15 Vpol P Vfront +0.5 Odd Field
                 Vfront    2 Vsync   5 Vback   15 Vpol P Vback  +0.5 Even Field
    DTD 6:   720x480    59.940060 Hz   3:2     31.469 kHz     27.000000 MHz (531 mm x 398 mm)
                 Hfront   16 Hsync  62 Hback   60 Hpol N
                 Vfront    9 Vsync   6 Vback   30 Vpol N
Checksum: 0xb3  Unused space in Extension Block: 24 bytes

----------------

Warnings:

Block 0, Base EDID:
  Vendor & Product Identification: The serial number is one of the known dummy values, it should probably be set to 0.
Block 1, CTA-861 Extension Block:
  Video Data Block: VIC 1 and the first DTD are not identical. Is this intended?
  Video Data Block: All VICs are in ascending order, and the first (preferred) VIC <= 4, is that intended?
  Detailed Timing Descriptor #3: Image size is 708x398 mm, but based on the picture AR it should be 597x398 mm.
  Detailed Timing Descriptor #6: Image size is 531x398 mm, but based on the picture AR it should be 531x354 mm.
  Add a Colorimetry Data Block with the sRGB colorimetry bit set to avoid interop issues.
EDID:
  Base EDID: Some timings are out of range of the Monitor Ranges:
    Horizontal Freq: 15.734 - 67.500 kHz (Monitor: 30.000 - 91.000 kHz)

Failures:

Block 0, Base EDID:
  Detailed Timing Descriptor #1: Mismatch of image size 444x249 mm vs display size 700x390 mm.
  Detailed Timing Descriptor #2: Mismatch of image size 444x249 mm vs display size 700x390 mm.
Block 1, CTA-861 Extension Block:
  Missing VCDB, needed for Set Selectable RGB Quantization to avoid interop issues.
EDID:
  Extension Block 2 started with EDID header, ignoring Extension Blocks >= 2.

EDID conformity: FAIL
