edid-decode (hex):

00 ff ff ff ff ff ff 00 06 af 9b 78 00 00 00 00
00 1f 01 04 b5 1d 12 78 03 ee 95 a3 54 4c 99 26
0f 50 54 00 00 00 01 01 01 01 01 01 01 01 01 01
01 01 01 01 01 01 fa 69 00 a0 a0 40 3e 60 30 20
35 00 1e b2 10 00 00 1a c8 54 00 a0 a0 40 3e 60
30 20 35 00 1e b2 10 00 00 1a 00 00 00 fe 00 52
48 44 52 43 80 42 31 33 33 51 41 4e 00 00 00 00
00 03 41 22 9e 00 11 00 00 0b 41 0a 20 20 02 63

00 00 00 00 00 00 00 00 00 00 00 00 00 00 00 00
00 00 00 00 00 00 00 00 00 00 00 00 00 00 00 00
00 00 00 00 00 00 00 00 00 00 00 00 00 00 00 00
00 00 00 00 00 00 00 00 00 00 00 00 00 00 00 00
00 00 00 00 00 00 00 00 00 00 00 00 00 00 00 00
00 00 00 00 00 00 00 00 00 00 00 00 00 00 00 00
00 00 00 00 00 00 00 00 00 00 00 00 00 00 00 00
00 00 00 00 00 00 00 00 00 00 00 00 00 00 00 00

00 00 00 00 00 00 00 00 00 00 00 00 00 00 00 00
00 00 00 00 00 00 00 00 00 00 00 00 00 00 00 00
00 00 00 00 00 00 00 00 00 00 00 00 00 00 00 00
00 00 00 00 00 00 00 00 00 00 00 00 00 00 00 00
00 00 00 00 00 00 00 00 00 00 00 00 00 00 00 00
00 00 00 00 00 00 00 00 00 00 00 00 00 00 00 00
00 00 00 00 00 00 00 00 00 00 00 00 00 00 00 00
00 00 00 00 00 00 00 00 00 00 00 00 00 00 00 00

00 ff ff ff ff ff ff 00 06 af 9b 78 00 00 00 00
00 1f 01 04 b5 1d 12 78 03 ee 95 a3 54 4c 99 26
0f 50 54 00 00 00 01 01 01 01 01 01 01 01 01 01
01 01 01 01 01 01 fa 69 00 a0 a0 40 3e 60 30 20
35 00 1e b2 10 00 00 1a c8 54 00 a0 a0 40 3e 60
30 20 35 00 1e b2 10 00 00 1a 00 00 00 fe 00 52
48 44 52 43 80 42 31 33 33 51 41 4e 00 00 00 00
00 03 41 22 9e 00 11 00 00 0b 41 0a 20 20 02 63

00 00 00 00 00 00 00 00 00 00 00 00 00 00 00 00
00 00 00 00 00 00 00 00 00 00 00 00 00 00 00 00
00 00 00 00 00 00 00 00 00 00 00 00 00 00 00 00
00 00 00 00 00 00 00 00 00 00 00 00 00 00 00 00
00 00 00 00 00 00 00 00 00 00 00 00 00 00 00 00
00 00 00 00 00 00 00 00 00 00 00 00 00 00 00 00
00 00 00 00 00 00 00 00 00 00 00 00 00 00 00 00
00 00 00 00 00 00 00 00 00 00 00 00 00 00 00 00

00 00 00 00 00 00 00 00 00 00 00 00 00 00 00 00
00 00 00 00 00 00 00 00 00 00 00 00 00 00 00 00
00 00 00 00 00 00 00 00 00 00 00 00 00 00 00 00
00 00 00 00 00 00 00 00 00 00 00 00 00 00 00 00
00 00 00 00 00 00 00 00 00 00 00 00 00 00 00 00
00 00 00 00 00 00 00 00 00 00 00 00 00 00 00 00
00 00 00 00 00 00 00 00 00 00 00 00 00 00 00 00
00 00 00 00 00 00 00 00 00 00 00 00 00 00 00 00

----------------

Block 0, Base EDID:
  EDID Structure Version & Revision: 1.4
  Vendor & Product Identification:
    Manufacturer: AUO
    Model: 30875
    Made in: 2021
  Basic Display Parameters & Features:
    Digital display
    Bits per primary color channel: 10
    DisplayPort interface
    Maximum image size: 29 cm x 18 cm
    Gamma: 2.20
    Supported color formats: RGB 4:4:4
    First detailed timing includes the native pixel format and preferred refresh rate
    Display supports continuous frequencies
  Color Characteristics:
    Red  : 0.6396, 0.3300
    Green: 0.2998, 0.5996
    Blue : 0.1503, 0.0595
    White: 0.3134, 0.3291
  Established Timings I & II: none
  Standard Timings: none
  Detailed Timing Descriptors:
    DTD 1:  2560x1600   60.013626 Hz  16:10    99.743 kHz    271.300000 MHz (286 mm x 178 mm)
                 Hfront   48 Hsync  32 Hback   80 Hpol P
                 Vfront    3 Vsync   5 Vback   54 Vpol N
    DTD 2:  2560x1600   48.010901 Hz  16:10    79.794 kHz    217.040000 MHz (286 mm x 178 mm)
                 Hfront   48 Hsync  32 Hback   80 Hpol P
                 Vfront    3 Vsync   5 Vback   54 Vpol N
    Alphanumeric Data String: 'RHDRC.B133QAN'
    Manufacturer-Specified Display Descriptor (0x00): 00 00 00 03 41 22 9e 00 11 00 00 0b 41 0a 20 20 '....A"......A.  '
  Extension blocks: 2
Checksum: 0x63

----------------

Block 1, Unknown EDID Extension Block 0x00:
  00 00 00 00 00 00 00 00 00 00 00 00 00 00 00 00 '................'
  00 00 00 00 00 00 00 00 00 00 00 00 00 00 00 00 '................'
  00 00 00 00 00 00 00 00 00 00 00 00 00 00 00 00 '................'
  00 00 00 00 00 00 00 00 00 00 00 00 00 00 00 00 '................'
  00 00 00 00 00 00 00 00 00 00 00 00 00 00 00 00 '................'
  00 00 00 00 00 00 00 00 00 00 00 00 00 00 00 00 '................'
  00 00 00 00 00 00 00 00 00 00 00 00 00 00 00 00 '................'
  00 00 00 00 00 00 00 00 00 00 00 00 00 00 00 00 '................'
Checksum: 0x00

----------------

Block 2, Unknown EDID Extension Block 0x00:
  00 00 00 00 00 00 00 00 00 00 00 00 00 00 00 00 '................'
  00 00 00 00 00 00 00 00 00 00 00 00 00 00 00 00 '................'
  00 00 00 00 00 00 00 00 00 00 00 00 00 00 00 00 '................'
  00 00 00 00 00 00 00 00 00 00 00 00 00 00 00 00 '................'
  00 00 00 00 00 00 00 00 00 00 00 00 00 00 00 00 '................'
  00 00 00 00 00 00 00 00 00 00 00 00 00 00 00 00 '................'
  00 00 00 00 00 00 00 00 00 00 00 00 00 00 00 00 '................'
  00 00 00 00 00 00 00 00 00 00 00 00 00 00 00 00 '................'
Checksum: 0x00

----------------

Warnings:

Block 0, Base EDID:
  Alphanumeric Data String: Non-ASCII character 0x80 at position 5, can cause problems.
  Missing Display Product Name.

Failures:

Block 0, Base EDID:
  Missing Display Range Limits Descriptor.
Block 1, Base EDID:
  Unknown Extension Block.
Block 2, Base EDID:
  Unknown Extension Block.
EDID:
  Extension Block 3 started with EDID header, ignoring Extension Blocks >= 3.

EDID conformity: FAIL
