edid-decode (hex):

00 ff ff ff ff ff ff 00 4c 2d f2 72 00 06 00 00
08 20 01 03 80 51 23 78 2a bc 55 b0 4d 3d b7 25
0f 50 54 21 08 00 81 00 81 c0 81 80 95 00 a9 c0
b3 00 01 01 01 01 6d 88 70 a0 d0 a0 b2 50 30 20
3a 00 29 62 31 00 00 1a 00 00 00 fd 00 30 af 1e
ff 69 00 0a 20 20 20 20 20 20 00 00 00 fc 00 4f
64 79 73 73 65 79 20 47 38 35 53 42 00 00 00 ff
00 48 31 41 4b 35 30 30 30 30 30 0a 20 20 03 18

02 03 56 f1 44 90 3f 04 03 2f 0d 57 07 15 07 50
57 07 00 67 54 00 09 07 07 83 0f 00 00 e2 00 4f
e3 05 c3 01 68 03 0c 00 10 00 b8 3c 08 6d d8 5d
c4 01 78 80 00 00 00 00 00 00 00 6d 1a 00 00 02
07 30 af 00 04 60 02 4b 02 e6 06 05 01 60 4a 00
e5 01 8b 84 90 39 56 5e 00 a0 a0 a0 29 50 30 20
35 00 29 62 31 00 00 1a 00 00 00 00 00 00 00 00
00 00 00 00 00 00 00 00 00 00 00 00 00 00 00 2f

02 03 04 f0 6f c2 00 a0 a0 a0 55 50 30 20 35 00
29 62 31 00 00 1a 02 3a 80 18 71 38 2d 40 58 2c
45 00 29 62 31 00 00 1e 04 74 80 18 71 38 2d 40
58 2c 45 00 29 62 31 00 00 1e fe a6 80 a0 70 38
5f 40 30 20 35 00 29 62 31 00 00 1a 00 00 00 00
00 00 00 00 00 00 00 00 00 00 00 00 00 00 00 00
00 00 00 00 00 00 00 00 00 00 00 00 00 00 00 00
00 00 00 00 00 00 00 00 00 00 00 00 00 00 00 3a

70 12 79 03 00 03 01 3c f2 10 01 88 6f 0d 9f 00
2f 80 1f 00 9f 05 b1 00 02 00 09 00 56 8e 01 08
6f 0d 9f 00 2f 80 1f 00 9f 05 b2 00 02 00 09 00
4e 23 01 08 ff 09 9f 00 2f 80 1f 00 9f 05 7e 00
02 00 04 00 00 00 00 00 00 00 00 00 00 00 00 00
00 00 00 00 00 00 00 00 00 00 00 00 00 00 00 00
00 00 00 00 00 00 00 00 00 00 00 00 00 00 00 00
00 00 00 00 00 00 00 00 00 00 00 00 00 00 10 90

00 ff ff ff ff ff ff 00 4c 2d f2 72 00 06 00 00
08 20 01 03 80 51 23 78 2a bc 55 b0 4d 3d b7 25
0f 50 54 21 08 00 81 00 81 c0 81 80 95 00 a9 c0
b3 00 01 01 01 01 6d 88 70 a0 d0 a0 b2 50 30 20
3a 00 29 62 31 00 00 1a 00 00 00 fd 00 30 af 1e
ff 69 00 0a 20 20 20 20 20 20 00 00 00 fc 00 4f
64 79 73 73 65 79 20 47 38 35 53 42 00 00 00 ff
00 48 31 41 4b 35 30 30 30 30 30 0a 20 20 03 18

02 03 56 f1 44 90 3f 04 03 2f 0d 57 07 15 07 50
57 07 00 67 54 00 09 07 07 83 0f 00 00 e2 00 4f
e3 05 c3 01 68 03 0c 00 10 00 b8 3c 08 6d d8 5d
c4 01 78 80 00 00 00 00 00 00 00 6d 1a 00 00 02
07 30 af 00 04 60 02 4b 02 e6 06 05 01 60 4a 00
e5 01 8b 84 90 39 56 5e 00 a0 a0 a0 29 50 30 20
35 00 29 62 31 00 00 1a 00 00 00 00 00 00 00 00
00 00 00 00 00 00 00 00 00 00 00 00 00 00 00 2f

02 03 04 f0 6f c2 00 a0 a0 a0 55 50 30 20 35 00
29 62 31 00 00 1a 02 3a 80 18 71 38 2d 40 58 2c
45 00 29 62 31 00 00 1e 04 74 80 18 71 38 2d 40
58 2c 45 00 29 62 31 00 00 1e fe a6 80 a0 70 38
5f 40 30 20 35 00 29 62 31 00 00 1a 00 00 00 00
00 00 00 00 00 00 00 00 00 00 00 00 00 00 00 00
00 00 00 00 00 00 00 00 00 00 00 00 00 00 00 00
00 00 00 00 00 00 00 00 00 00 00 00 00 00 00 3a

70 12 79 03 00 03 01 3c f2 10 01 88 6f 0d 9f 00
2f 80 1f 00 9f 05 b1 00 02 00 09 00 56 8e 01 08
6f 0d 9f 00 2f 80 1f 00 9f 05 b2 00 02 00 09 00
4e 23 01 08 ff 09 9f 00 2f 80 1f 00 9f 05 7e 00
02 00 04 00 00 00 00 00 00 00 00 00 00 00 00 00
00 00 00 00 00 00 00 00 00 00 00 00 00 00 00 00
00 00 00 00 00 00 00 00 00 00 00 00 00 00 00 00
00 00 00 00 00 00 00 00 00 00 00 00 00 00 10 90

----------------

Block 0, Base EDID:
  EDID Structure Version & Revision: 1.3
  Vendor & Product Identification:
    Manufacturer: SAM
    Model: 29426
    Serial Number: ...
    Made in: week 8 of 2022
  Basic Display Parameters & Features:
    Digital display
    Maximum image size: 81 cm x 35 cm
    Gamma: 2.20
    DPMS levels: Off
    RGB color display
    First detailed timing is the preferred timing
  Color Characteristics:
    Red  : 0.6894, 0.3037
    Green: 0.2412, 0.7148
    Blue : 0.1455, 0.0595
    White: 0.3134, 0.3291
  Established Timings I & II:
    DMT 0x04:   640x480    59.940476 Hz   4:3     31.469 kHz     25.175000 MHz
    DMT 0x09:   800x600    60.316541 Hz   4:3     37.879 kHz     40.000000 MHz
    DMT 0x10:  1024x768    60.003840 Hz   4:3     48.363 kHz     65.000000 MHz
  Standard Timings:
    DMT 0x1c:  1280x800    59.810326 Hz  16:10    49.702 kHz     83.500000 MHz
    DMT 0x55:  1280x720    60.000000 Hz  16:9     45.000 kHz     74.250000 MHz
    DMT 0x23:  1280x1024   60.019740 Hz   5:4     63.981 kHz    108.000000 MHz
    DMT 0x2f:  1440x900    59.887445 Hz  16:10    55.935 kHz    106.500000 MHz
    DMT 0x53:  1600x900    60.000000 Hz  16:9     60.000 kHz    108.000000 MHz (RB)
    DMT 0x3a:  1680x1050   59.954250 Hz  16:10    65.290 kHz    146.250000 MHz
  Detailed Timing Descriptors:
    DTD 1:  3440x1440   59.959140 Hz  43:18    97.014 kHz    349.250000 MHz (809 mm x 354 mm)
                 Hfront   48 Hsync  32 Hback   80 Hpol P
                 Vfront    3 Vsync  10 Vback  165 Vpol N
    Display Range Limits:
      Monitor ranges (GTF): 48-175 Hz V, 30-255 kHz H, max dotclock 1050 MHz
    Display Product Name: 'Odyssey G85SB'
    Display Product Serial Number: ...
  Extension blocks: 3
Checksum: 0x18

----------------

Block 1, CTA-861 Extension Block:
  Revision: 3
  Underscans IT Video Formats by default
  Basic audio support
  Supports YCbCr 4:4:4
  Supports YCbCr 4:2:2
  Native DTDs: 1
  Video Data Block:
    VIC  16:  1920x1080   60.000000 Hz  16:9     67.500 kHz    148.500000 MHz (native)
    VIC  63:  1920x1080  120.000000 Hz  16:9    135.000 kHz    297.000000 MHz
    VIC   4:  1280x720    60.000000 Hz  16:9     45.000 kHz     74.250000 MHz
    VIC   3:   720x480    59.940060 Hz  16:9     31.469 kHz     27.000000 MHz
  Audio Data Block:
    Linear PCM:
      Max channels: 6
      Supported sample rates (kHz): 192 96 48 44.1 32
      Supported sample sizes (bits): 24 20 16
    AC-3:
      Max channels: 6
      Supported sample rates (kHz): 48 44.1 32
      Maximum bit rate: 640 kb/s
    Enhanced AC-3 (DD+):
      Max channels: 8
      Supported sample rates (kHz): 48 44.1 32
    MAT (MLP):
      Max channels: 8
      Supported sample rates (kHz): 192 96 48
      Supports only Dolby TrueHD
    Linear PCM:
      Max channels: 2
      Supported sample rates (kHz): 48 44.1 32
      Supported sample sizes (bits): 24 20 16
  Speaker Allocation Data Block:
    FL/FR - Front Left/Right
    LFE1 - Low Frequency Effects 1
    FC - Front Center
    LS/RS - Left/Right Surround
  Video Capability Data Block:
    YCbCr quantization: No Data
    RGB quantization: Selectable (via AVI Q)
    PT scan behavior: No Data
    IT scan behavior: Supports both over- and underscan
    CE scan behavior: Supports both over- and underscan
  Colorimetry Data Block:
    xvYCC601
    xvYCC709
    BT2020YCC
    BT2020RGB
    Gamut Boundary Description Metadata Profile P0
  Vendor-Specific Data Block (HDMI), OUI 00-0C-03:
    Source physical address: 1.0.0.0
    Supports_AI
    DC_36bit
    DC_30bit
    DC_Y444
    Maximum TMDS clock: 300 MHz
    Supported Content Types:
      Game
  Vendor-Specific Data Block (HDMI Forum), OUI C4-5D-D8:
    Version: 1
    Maximum TMDS Character Rate: 600 MHz
    SCDC Present
    VRRmin: 0 Hz
    VRRmax: 0 Hz
  Vendor-Specific Data Block (AMD), OUI 00-00-1A:
    Version: 2
    Feature Caps: 0x07
      Global Backlight Control Supported
    Minimum Refresh Rate: 48 Hz
    Maximum Refresh Rate: 175 Hz
    Flags 1.x: 0x00
    Flags 2.x: 0x04
      ST 2084 (PQ) EOTF Supported
      Linear EOTF (Windows scRGB, 0.0 - 125.0) Supported
      Gamma 2.2 EOTF Supported
      BT.2020 Gamut Supported
    Maximum luminance: 96 (400.000 cd/m^2)
    Minimum luminance: 2 (0.000 cd/m^2)
    Maximum luminance (minimum backlight): 75 (253.810 cd/m^2)
    Minimum luminance (minimum backlight): 2 (0.000 cd/m^2)
  HDR Static Metadata Data Block:
    Electro optical transfer functions:
      Traditional gamma - SDR luminance range
      SMPTE ST2084
    Supported static metadata descriptors:
      Static metadata type 1
    Desired content max luminance: 96 (400.000 cd/m^2)
    Desired content max frame-average luminance: 74 (248.372 cd/m^2)
    Desired content min luminance: 0 (0.000 cd/m^2)
  Vendor-Specific Video Data Block (HDR10+), OUI 90-84-8B:
    Application Version: 1
    Full Frame Peak Luminance Index: 2
    Peak Luminance Index: 3
  Detailed Timing Descriptors:
    DTD 2:  2560x1440   59.950550 Hz  16:9     88.787 kHz    241.500000 MHz (809 mm x 354 mm)
                 Hfront   48 Hsync  32 Hback   80 Hpol P
                 Vfront    3 Vsync   5 Vback   33 Vpol N
Checksum: 0x2f  Unused space in Extension Block: 23 bytes

----------------

Block 2, CTA-861 Extension Block:
  Revision: 3
  Underscans IT Video Formats by default
  Basic audio support
  Supports YCbCr 4:4:4
  Supports YCbCr 4:2:2
  Native DTDs: 0
  Detailed Timing Descriptors:
    DTD 3:  2560x1440  119.997589 Hz  16:9    182.996 kHz    497.750000 MHz (809 mm x 354 mm)
                 Hfront   48 Hsync  32 Hback   80 Hpol P
                 Vfront    3 Vsync   5 Vback   77 Vpol N
    DTD 4:  1920x1080   60.000000 Hz  16:9     67.500 kHz    148.500000 MHz (809 mm x 354 mm)
                 Hfront   88 Hsync  44 Hback  148 Hpol P
                 Vfront    4 Vsync   5 Vback   36 Vpol P
    DTD 5:  1920x1080  120.000000 Hz  16:9    135.000 kHz    297.000000 MHz (809 mm x 354 mm)
                 Hfront   88 Hsync  44 Hback  148 Hpol P
                 Vfront    4 Vsync   5 Vback   36 Vpol P
    DTD 6:  1920x1080  174.918167 Hz  16:9    205.529 kHz    427.500000 MHz (809 mm x 354 mm)
                 Hfront   48 Hsync  32 Hback   80 Hpol P
                 Vfront    3 Vsync   5 Vback   87 Vpol N
Checksum: 0x3a  Unused space in Extension Block: 51 bytes

----------------

Block 3, DisplayID Extension Block:
  Version: 1.2
  Extension Count: 0
  Display Product Type: Standalone display device
  Video Timing Modes Type 1 - Detailed Timings Data Block:
    DTD:  3440x1440  119.961200 Hz   0:0    194.097 kHz    698.750000 MHz (aspect undefined, no 3D stereo, preferred)
               Hfront   48 Hsync  32 Hback   80 Hpol P
               Vfront    3 Vsync  10 Vback  165 Vpol N
    DTD:  3440x1440  174.962254 Hz   0:0    283.264 kHz   1019.750000 MHz (aspect undefined, no 3D stereo)
               Hfront   48 Hsync  32 Hback   80 Hpol P
               Vfront    3 Vsync  10 Vback  166 Vpol N
    DTD:  2560x1440  174.966684 Hz   0:0    274.173 kHz    745.750000 MHz (aspect undefined, no 3D stereo)
               Hfront   48 Hsync  32 Hback   80 Hpol P
               Vfront    3 Vsync   5 Vback  119 Vpol N
  Checksum: 0x10
Checksum: 0x90

----------------

Warnings:

Block 0, Base EDID:
  Detailed Timing Descriptor #1: Image size is 809x354 mm, but based on the picture AR it should be 809x338 mm.
  Display Product Serial Number: ...
Block 1, CTA-861 Extension Block:
  Video Data Block: VIC 16 and the first DTD are not identical. Is this intended?
  Video Capability Data Block: Set Selectable YCbCr Quantization to avoid interop issues.
  Colorimetry Data Block: Set the sRGB colorimetry bit to avoid interop issues.
  Detailed Timing Descriptor #2: Image size is 809x354 mm, but based on the picture AR it should be 629x354 mm.
  Display Product Serial Number is set, so the Serial Number in the Base EDID should be 0.
Block 2, CTA-861 Extension Block:
  Detailed Timing Descriptor #3: Image size is 809x354 mm, but based on the picture AR it should be 629x354 mm.
  Detailed Timing Descriptor #4: Image size is 809x354 mm, but based on the picture AR it should be 629x354 mm.
  Detailed Timing Descriptor #5: Image size is 809x354 mm, but based on the picture AR it should be 629x354 mm.
  Detailed Timing Descriptor #6: Image size is 809x354 mm, but based on the picture AR it should be 629x354 mm.

Failures:

Block 2, CTA-861 Extension Block:
  Byte 3 must be the same for all CTA-861 Extension Blocks.
EDID:
  Extension Block 4 started with EDID header, ignoring Extension Blocks >= 4.
  Base EDID: EDID 1.3 requires a Block Map Extension in Block 1 if there are more than 2 blocks in the EDID.
  CTA-861: The maximum HDMI TMDS clock is 600000 kHz, but one or more video timings go up to 1019750 kHz.
  CTA-861: Native progressive timings are a mix of several resolutions.
  DisplayID: Missing DisplayID Display Parameters Data Block.

EDID conformity: FAIL
