edid-decode (hex):

00 ff ff ff ff ff ff 00 06 af a6 8e 00 00 00 00
1c 20 01 04 b5 22 16 78 03 81 e4 b1 4e 3f b8 24
0c 54 5b 00 00 00 01 01 01 01 01 01 01 01 01 01
01 01 01 01 01 01 8c eb 00 a0 f0 60 70 90 30 20
35 00 58 d7 10 00 00 18 00 00 00 0f 00 00 00 00
00 00 00 00 00 00 00 00 00 20 00 00 00 fd 0c 30
78 2f 2f 79 01 0a 20 20 20 20 20 20 00 00 00 fe
00 42 31 36 30 5a 41 4e 30 31 2e 55 20 0a 02 95

02 03 0f 00 e3 05 80 00 e6 06 05 01 8d 8d 10 00
00 00 00 00 00 00 00 00 00 00 00 00 00 00 00 00
00 00 00 00 00 00 00 00 00 00 00 00 00 00 00 00
00 00 00 00 00 00 00 00 00 00 00 00 00 00 00 00
00 00 00 00 00 00 00 00 00 00 00 00 00 00 00 00
00 00 00 00 00 00 00 00 00 00 00 00 00 00 00 00
00 00 00 00 00 00 00 00 00 00 00 00 00 00 00 00
00 00 00 00 00 00 00 00 00 00 00 00 00 00 00 68

70 20 79 02 00 22 00 14 ef 66 12 84 ff 0e 9f 00
2f 80 1f 00 5f 09 6f 00 02 00 04 00 25 01 09 ef
66 12 ef 66 12 30 78 80 81 00 1b e3 05 80 00 e6
06 07 01 8d 8d 10 72 1a 00 00 03 03 30 78 00 44
8d 10 8d 10 78 00 00 00 00 00 00 00 00 00 00 00
00 00 00 00 00 00 00 00 00 00 00 00 00 00 00 00
00 00 00 00 00 00 00 00 00 00 00 00 00 00 00 00
00 00 00 00 00 00 00 00 00 00 00 00 00 00 76 90

00 ff ff ff ff ff ff 00 06 af a6 8e 00 00 00 00
1c 20 01 04 b5 22 16 78 03 81 e4 b1 4e 3f b8 24
0c 54 5b 00 00 00 01 01 01 01 01 01 01 01 01 01
01 01 01 01 01 01 8c eb 00 a0 f0 60 70 90 30 20
35 00 58 d7 10 00 00 18 00 00 00 0f 00 00 00 00
00 00 00 00 00 00 00 00 00 20 00 00 00 fd 0c 30
78 2f 2f 79 01 0a 20 20 20 20 20 20 00 00 00 fe
00 42 31 36 30 5a 41 4e 30 31 2e 55 20 0a 02 95

02 03 0f 00 e3 05 80 00 e6 06 05 01 8d 8d 10 00
00 00 00 00 00 00 00 00 00 00 00 00 00 00 00 00
00 00 00 00 00 00 00 00 00 00 00 00 00 00 00 00
00 00 00 00 00 00 00 00 00 00 00 00 00 00 00 00
00 00 00 00 00 00 00 00 00 00 00 00 00 00 00 00
00 00 00 00 00 00 00 00 00 00 00 00 00 00 00 00
00 00 00 00 00 00 00 00 00 00 00 00 00 00 00 00
00 00 00 00 00 00 00 00 00 00 00 00 00 00 00 68

70 20 79 02 00 22 00 14 ef 66 12 84 ff 0e 9f 00
2f 80 1f 00 5f 09 6f 00 02 00 04 00 25 01 09 ef
66 12 ef 66 12 30 78 80 81 00 1b e3 05 80 00 e6
06 07 01 8d 8d 10 72 1a 00 00 03 03 30 78 00 44
8d 10 8d 10 78 00 00 00 00 00 00 00 00 00 00 00
00 00 00 00 00 00 00 00 00 00 00 00 00 00 00 00
00 00 00 00 00 00 00 00 00 00 00 00 00 00 00 00
00 00 00 00 00 00 00 00 00 00 00 00 00 00 76 90

----------------

Block 0, Base EDID:
  EDID Structure Version & Revision: 1.4
  Vendor & Product Identification:
    Manufacturer: AUO
    Model: 36518
    Made in: week 28 of 2022
  Basic Display Parameters & Features:
    Digital display
    Bits per primary color channel: 10
    DisplayPort interface
    Maximum image size: 34 cm x 22 cm
    Gamma: 2.20
    Supported color formats: RGB 4:4:4
    First detailed timing includes the native pixel format and preferred refresh rate
    Display supports continuous frequencies
  Color Characteristics:
    Red  : 0.6933, 0.3046
    Green: 0.2460, 0.7197
    Blue : 0.1435, 0.0488
    White: 0.3291, 0.3554
  Established Timings I & II: none
  Standard Timings: none
  Detailed Timing Descriptors:
    DTD 1:  3840x2400   60.011943 Hz  16:10   150.750 kHz    603.000000 MHz (344 mm x 215 mm)
                 Hfront   48 Hsync  32 Hback   80 Hpol N
                 Vfront    3 Vsync   5 Vback  104 Vpol N
    Manufacturer-Specified Display Descriptor (0x0f): 00 0f 00 00 00 00 00 00 00 00 00 00 00 00 00 20 '............... '
    Display Range Limits:
      Monitor ranges (Range Limits Only): 48-120 Hz V, 302-302 kHz H, max dotclock 1210 MHz
    Alphanumeric Data String: 'B160ZAN01.U '
  Extension blocks: 2
Checksum: 0x95

----------------

Block 1, CTA-861 Extension Block:
  Revision: 3
  Native detailed modes: 0
  Colorimetry Data Block:
    BT2020RGB
  HDR Static Metadata Data Block:
    Electro optical transfer functions:
      Traditional gamma - SDR luminance range
      SMPTE ST2084
    Supported static metadata descriptors:
      Static metadata type 1
    Desired content max luminance: 141 (1060.189 cd/m^2)
    Desired content max frame-average luminance: 141 (1060.189 cd/m^2)
    Desired content min luminance: 16 (0.042 cd/m^2)
Checksum: 0x68  Unused space in Extension Block: 112 bytes

----------------

Block 2, DisplayID Extension Block:
  Version: 2.0
  Extension Count: 0
  Display Product Primary Use Case: None of the listed primary use cases; generic display
  Video Timing Modes Type 7 - Detailed Timings Data Block:
    DTD:  3840x2400  120.023885 Hz  16:9    301.500 kHz   1206.000000 MHz (aspect 16:9, no 3D stereo, preferred)
               Hfront   48 Hsync  32 Hback   80 Hpol P
               Vfront    3 Vsync   5 Vback  104 Vpol N
  Dynamic Video Timing Range Limits Data Block:
    Minimum Pixel Clock: 1206000 kHz
    Maximum Pixel Clock: 1206000 kHz
    Minimum Vertical Refresh Rate: 48 Hz
    Maximum Vertical Refresh Rate: 120 Hz
    Seamless Dynamic Video Timing Support: Yes
  CTA-861 DisplayID Data Block:
  Colorimetry Data Block:
    BT2020RGB
  HDR Static Metadata Data Block:
    Electro optical transfer functions:
      Traditional gamma - SDR luminance range
      Traditional gamma - HDR luminance range
      SMPTE ST2084
    Supported static metadata descriptors:
      Static metadata type 1
    Desired content max luminance: 141 (1060.189 cd/m^2)
    Desired content max frame-average luminance: 141 (1060.189 cd/m^2)
    Desired content min luminance: 16 (0.042 cd/m^2)
  Vendor-Specific Data Block (AMD), OUI 00-00-1A:
    Version: 3
    Feature Caps: 0x03
    Minimum Refresh Rate: 48 Hz
    Maximum Refresh Rate: 120 Hz
    Flags 1.x: 0x00
    Flags 2.x: 0x44
      ST 2084 (PQ) EOTF Supported
      Linear EOTF (Windows scRGB, 0.0 - 125.0) Supported
      Gamma 2.2 EOTF Supported
      BT.2020 Gamut Supported
      Display is OLED
    Maximum luminance: 141 (1060.189 cd/m^2)
    Minimum luminance: 16 (0.042 cd/m^2)
    Maximum luminance (without local dimming): 141 (1060.189 cd/m^2)
    Minimum luminance (without local dimming): 16 (0.042 cd/m^2)
  Checksum: 0x76
Checksum: 0x90

----------------

Block 3, Unknown EDID Extension Block 0x00:
  00 ff ff ff ff ff ff 00 06 af a6 8e 00 00 00 00 '................'
  1c 20 01 04 b5 22 16 78 03 81 e4 b1 4e 3f b8 24 '. ...".x....N?.$'
  0c 54 5b 00 00 00 01 01 01 01 01 01 01 01 01 01 '.T[.............'
  01 01 01 01 01 01 8c eb 00 a0 f0 60 70 90 30 20 '...........`p.0 '
  35 00 58 d7 10 00 00 18 00 00 00 0f 00 00 00 00 '5.X.............'
  00 00 00 00 00 00 00 00 00 20 00 00 00 fd 0c 30 '......... .....0'
  78 2f 2f 79 01 0a 20 20 20 20 20 20 00 00 00 fe 'x//y..      ....'
  00 42 31 36 30 5a 41 4e 30 31 2e 55 20 0a 02 95 '.B160ZAN01.U ...'
Checksum: 0x95

----------------

Block 4, CTA-861 Extension Block:
  Revision: 3
  Native detailed modes: 0
  Colorimetry Data Block:
    BT2020RGB
  HDR Static Metadata Data Block:
    Electro optical transfer functions:
      Traditional gamma - SDR luminance range
      SMPTE ST2084
    Supported static metadata descriptors:
      Static metadata type 1
    Desired content max luminance: 141 (1060.189 cd/m^2)
    Desired content max frame-average luminance: 141 (1060.189 cd/m^2)
    Desired content min luminance: 16 (0.042 cd/m^2)
Checksum: 0x68  Unused space in Extension Block: 112 bytes

----------------

Block 5, DisplayID Extension Block:
  Version: 2.0
  Extension Count: 0
  Video Timing Modes Type 7 - Detailed Timings Data Block:
    DTD:  3840x2400  120.023885 Hz  16:9    301.500 kHz   1206.000000 MHz (aspect 16:9, no 3D stereo, preferred)
               Hfront   48 Hsync  32 Hback   80 Hpol P
               Vfront    3 Vsync   5 Vback  104 Vpol N
  Dynamic Video Timing Range Limits Data Block:
    Minimum Pixel Clock: 1206000 kHz
    Maximum Pixel Clock: 1206000 kHz
    Minimum Vertical Refresh Rate: 48 Hz
    Maximum Vertical Refresh Rate: 120 Hz
    Seamless Dynamic Video Timing Support: Yes
  CTA-861 DisplayID Data Block:
  Colorimetry Data Block:
    BT2020RGB
  HDR Static Metadata Data Block:
    Electro optical transfer functions:
      Traditional gamma - SDR luminance range
      Traditional gamma - HDR luminance range
      SMPTE ST2084
    Supported static metadata descriptors:
      Static metadata type 1
    Desired content max luminance: 141 (1060.189 cd/m^2)
    Desired content max frame-average luminance: 141 (1060.189 cd/m^2)
    Desired content min luminance: 16 (0.042 cd/m^2)
  Vendor-Specific Data Block (AMD), OUI 00-00-1A:
    Version: 3
    Feature Caps: 0x03
    Minimum Refresh Rate: 48 Hz
    Maximum Refresh Rate: 120 Hz
    Flags 1.x: 0x00
    Flags 2.x: 0x44
      ST 2084 (PQ) EOTF Supported
      Linear EOTF (Windows scRGB, 0.0 - 125.0) Supported
      Gamma 2.2 EOTF Supported
      BT.2020 Gamut Supported
      Display is OLED
    Maximum luminance: 141 (1060.189 cd/m^2)
    Minimum luminance: 16 (0.042 cd/m^2)
    Maximum luminance (without local dimming): 141 (1060.189 cd/m^2)
    Minimum luminance (without local dimming): 16 (0.042 cd/m^2)
  Checksum: 0x76
Checksum: 0x90

----------------

Warnings:

Block 0, Base EDID:
  Missing Display Product Name.
Block 1, CTA-861 Extension Block:
  IT Video Formats are overscanned by default, but normally this should be underscanned.
  Colorimetry Data Block: Set the sRGB colorimetry bit to avoid interop issues.
Block 2, DisplayID Extension Block:
  Colorimetry Data Block: Set the sRGB colorimetry bit to avoid interop issues.
Block 4, CTA-861 Extension Block:
  IT Video Formats are overscanned by default, but normally this should be underscanned.
  Colorimetry Data Block: Set the sRGB colorimetry bit to avoid interop issues.
Block 5, DisplayID Extension Block:
  Colorimetry Data Block: Set the sRGB colorimetry bit to avoid interop issues.
EDID:
  Base EDID: Some timings are out of range of the Monitor Ranges:
    Horizontal Freq: 150.750 - 301.500 kHz (Monitor: 302.000 - 302.000 kHz)

Failures:

Block 0, Base EDID:
  Alphanumeric Data String: One or more trailing spaces before newline.
Block 1, CTA-861 Extension Block:
  Required 640x480p60 timings are missing in the established timings and the SVD list (VIC 1).
  Missing VCDB, needed for Set Selectable RGB Quantization to avoid interop issues.
Block 2, DisplayID Extension Block:
  Expected 0 DisplayID Extension Block, but got 1.
  Vendor-Specific Data Block (AMD), OUI 00-00-1A: Length is 27 instead of 30.
Block 3, Base EDID:
  Unknown Extension Block.
Block 4, CTA-861 Extension Block:
  Colorimetry Data Block: Only one instance of this Data Block is allowed.
  HDR Static Metadata Data Block: Only one instance of this Data Block is allowed.
Block 5, DisplayID Extension Block:
  Product Type should be 0 in extension block.
  Colorimetry Data Block: Only one instance of this Data Block is allowed.
  HDR Static Metadata Data Block: Only one instance of this Data Block is allowed.
  Vendor-Specific Data Block (AMD), OUI 00-00-1A: Length is 27 instead of 30.
EDID:
  Base EDID: EDID specified 2 extension block(s), but found 5 extension block(s).
  DisplayID: Missing DisplayID Display Parameters Data Block.

EDID conformity: FAIL
