edid-decode (hex):

00 ff ff ff ff ff ff 00 15 a1 e1 05 01 01 01 01
0c 11 01 03 08 21 14 89 2a b9 99 a2 54 48 97 23
0d 4d 50 ab 88 10 81 00 01 01 01 01 01 01 01 01
01 01 01 01 01 01 58 1b 00 78 50 20 21 30 0a 0a
2a 00 4c cf 10 00 00 1e 00 00 00 fc 00 45 31 35
54 34 57 0a 20 20 20 20 20 20 00 00 00 fd 00 38
48 1e 32 0b 00 0a 20 20 20 20 20 20 00 00 00 ff
00 50 37 33 20 35 30 43 20 31 34 32 32 37 00 c9

00 ff ff ff ff ff ff 00 15 a1 e1 05 01 01 01 01
0c 11 01 03 08 21 14 89 2a b9 99 a2 54 48 97 23
0d 4d 50 ab 88 10 81 00 01 01 01 01 01 01 01 01
01 01 01 01 01 01 58 1b 00 78 50 20 21 30 0a 0a
2a 00 4c cf 10 00 00 1e 00 00 00 fc 00 45 31 35
54 34 57 0a 20 20 20 20 20 20 00 00 00 fd 00 38
48 1e 32 0b 00 0a 20 20 20 20 20 20 00 00 00 ff
00 50 37 33 20 35 30 43 20 31 34 32 32 37 00 c9

----------------

Block 0, Base EDID:
  EDID Structure Version & Revision: 1.3
  Vendor & Product Identification:
    Manufacturer: EMA
    Model: 1505
    Serial Number: ...
    Made in: week 12 of 2007
  Basic Display Parameters & Features:
    Analog display
    Signal Level Standard: 0.700 : 0.300 : 1.000 V p-p
    Blank level equals black level
    Sync: Separate
    Maximum image size: 33 cm x 20 cm
    Gamma: 2.37
    DPMS levels: Off
    RGB color display
    First detailed timing is the preferred timing
  Color Characteristics:
    Red  : 0.6347, 0.3310
    Green: 0.2832, 0.5908
    Blue : 0.1386, 0.0517
    White: 0.3027, 0.3134
  Established Timings I & II:
    IBM     :   720x400    70.081663 Hz   9:5     31.467 kHz     28.320000 MHz
    DMT 0x04:   640x480    59.940476 Hz   4:3     31.469 kHz     25.175000 MHz
    DMT 0x05:   640x480    72.808802 Hz   4:3     37.861 kHz     31.500000 MHz
    DMT 0x08:   800x600    56.250000 Hz   4:3     35.156 kHz     36.000000 MHz
    DMT 0x09:   800x600    60.316541 Hz   4:3     37.879 kHz     40.000000 MHz
    DMT 0x0a:   800x600    72.187572 Hz   4:3     48.077 kHz     50.000000 MHz
    DMT 0x10:  1024x768    60.003840 Hz   4:3     48.363 kHz     65.000000 MHz
  Standard Timings:
    DMT 0x1c:  1280x800    59.810326 Hz  16:10    49.702 kHz     83.500000 MHz
  Detailed Timing Descriptors:
    DTD 1:  1280x800    60.024010 Hz  16:10    50.000 kHz     70.000000 MHz (332 mm x 207 mm)
                 Hfront   10 Hsync  10 Hback  100 Hpol P
                 Vfront    2 Vsync  10 Vback   21 Vpol P
    Display Product Name: 'E15T4W'
    Display Range Limits:
      Monitor ranges (GTF): 56-72 Hz V, 30-50 kHz H, max dotclock 110 MHz
    Display Product Serial Number: ...
Checksum: 0xc9

----------------

Warnings:

Block 0, Base EDID:
  Vendor & Product Identification: The serial number is one of the known dummy values, it should probably be set to 0.
EDID:
  Base EDID: Some timings are out of range of the Monitor Ranges:
    Vertical Freq: 56.250 - 72.809 Hz (Monitor: 56.000 - 72.000 Hz)
    Could be due to a Monitor Range off-by-one rounding issue

Failures:

EDID:
  Extension Block 1 started with EDID header, ignoring Extension Blocks >= 1.

EDID conformity: FAIL
