edid-decode (hex):

00 ff ff ff ff ff ff 00 30 ae e6 61 00 00 00 00
25 1e 01 03 80 3e 22 78 ea b4 a5 ad 4f 44 9e 25
0f 50 54 a1 08 00 d1 00 d1 c0 b3 00 81 c0 81 80
95 00 a9 c0 81 00 04 74 00 30 f2 70 5a 80 b0 58
8a 00 6d 55 21 00 00 1a 00 00 00 fd 00 17 4c 1e
a0 1e 00 0a 20 20 20 20 20 20 00 00 00 fc 00 4c
45 4e 20 53 32 38 75 2d 31 30 0a 20 00 00 00 ff
00 56 4e 41 35 31 30 36 47 0a 20 20 20 20 01 ea

02 03 35 f2 4d 01 03 04 05 07 90 12 13 14 16 9f
20 22 2c 11 07 50 3b 07 c0 57 07 00 09 07 07 83
01 00 00 71 03 0c 00 20 00 b8 3c 20 c0 64 01 02
03 01 41 00 00 04 74 00 30 f2 70 5a 80 b0 58 8a
00 6d 55 21 00 00 1a 8c 0a d0 90 20 40 31 20 0c
40 55 00 e3 b5 00 00 00 18 01 1d 00 bc 52 d0 1e
20 b8 28 55 40 93 e3 10 00 00 1e 01 1d 80 d0 72
1c 16 20 10 2c 25 80 5d 54 21 00 00 9e 00 00 c3

00 ff ff ff ff ff ff 00 30 ae e6 61 00 00 00 00
25 1e 01 03 80 3e 22 78 ea b4 a5 ad 4f 44 9e 25
0f 50 54 a1 08 00 d1 00 d1 c0 b3 00 81 c0 81 80
95 00 a9 c0 81 00 04 74 00 30 f2 70 5a 80 b0 58
8a 00 6d 55 21 00 00 1a 00 00 00 fd 00 17 4c 1e
a0 1e 00 0a 20 20 20 20 20 20 00 00 00 fc 00 4c
45 4e 20 53 32 38 75 2d 31 30 0a 20 00 00 00 ff
00 56 4e 41 35 31 30 36 47 0a 20 20 20 20 01 ea

02 03 35 f2 4d 01 03 04 05 07 90 12 13 14 16 9f
20 22 2c 11 07 50 3b 07 c0 57 07 00 09 07 07 83
01 00 00 71 03 0c 00 20 00 b8 3c 20 c0 64 01 02
03 01 41 00 00 04 74 00 30 f2 70 5a 80 b0 58 8a
00 6d 55 21 00 00 1a 8c 0a d0 90 20 40 31 20 0c
40 55 00 e3 b5 00 00 00 18 01 1d 00 bc 52 d0 1e
20 b8 28 55 40 93 e3 10 00 00 1e 01 1d 80 d0 72
1c 16 20 10 2c 25 80 5d 54 21 00 00 9e 00 00 c3

----------------

Block 0, Base EDID:
  EDID Structure Version & Revision: 1.3
  Vendor & Product Identification:
    Manufacturer: LEN
    Model: 25062
    Made in: week 37 of 2020
  Basic Display Parameters & Features:
    Digital display
    Maximum image size: 62 cm x 34 cm
    Gamma: 2.20
    DPMS levels: Standby Suspend Off
    RGB color display
    First detailed timing is the preferred timing
  Color Characteristics:
    Red  : 0.6777, 0.3115
    Green: 0.2666, 0.6171
    Blue : 0.1464, 0.0605
    White: 0.3134, 0.3291
  Established Timings I & II:
    IBM     :   720x400    70.081663 Hz   9:5     31.467 kHz     28.320000 MHz
    DMT 0x04:   640x480    59.940476 Hz   4:3     31.469 kHz     25.175000 MHz
    DMT 0x09:   800x600    60.316541 Hz   4:3     37.879 kHz     40.000000 MHz
    DMT 0x10:  1024x768    60.003840 Hz   4:3     48.363 kHz     65.000000 MHz
  Standard Timings:
    DMT 0x45:  1920x1200   59.884600 Hz  16:10    74.556 kHz    193.250000 MHz
    DMT 0x52:  1920x1080   60.000000 Hz  16:9     67.500 kHz    148.500000 MHz
    DMT 0x3a:  1680x1050   59.954250 Hz  16:10    65.290 kHz    146.250000 MHz
    DMT 0x55:  1280x720    60.000000 Hz  16:9     45.000 kHz     74.250000 MHz
    DMT 0x23:  1280x1024   60.019740 Hz   5:4     63.981 kHz    108.000000 MHz
    DMT 0x2f:  1440x900    59.887445 Hz  16:10    55.935 kHz    106.500000 MHz
    DMT 0x53:  1600x900    60.000000 Hz  16:9     60.000 kHz    108.000000 MHz (RB)
    DMT 0x1c:  1280x800    59.810326 Hz  16:10    49.702 kHz     83.500000 MHz
  Detailed Timing Descriptors:
    DTD 1:  3840x2160   30.000000 Hz  16:9     67.500 kHz    297.000000 MHz (621 mm x 341 mm)
                 Hfront  176 Hsync  88 Hback  296 Hpol P
                 Vfront    8 Vsync  10 Vback   72 Vpol N
    Display Range Limits:
      Monitor ranges (GTF): 23-76 Hz V, 30-160 kHz H, max dotclock 300 MHz
    Display Product Name: 'LEN S28u-10'
    Display Product Serial Number: ...
  Extension blocks: 1
Checksum: 0xea

----------------

Block 1, CTA-861 Extension Block:
  Revision: 3
  Underscans IT Video Formats by default
  Basic audio support
  Supports YCbCr 4:4:4
  Supports YCbCr 4:2:2
  Native DTDs: 2
  Video Data Block:
    VIC   1:   640x480    59.940476 Hz   4:3     31.469 kHz     25.175000 MHz
    VIC   3:   720x480    59.940060 Hz  16:9     31.469 kHz     27.000000 MHz
    VIC   4:  1280x720    60.000000 Hz  16:9     45.000 kHz     74.250000 MHz
    VIC   5:  1920x1080i  60.000000 Hz  16:9     33.750 kHz     74.250000 MHz
    VIC   7:  1440x480i   59.940060 Hz  16:9     15.734 kHz     27.000000 MHz
    VIC  16:  1920x1080   60.000000 Hz  16:9     67.500 kHz    148.500000 MHz (native)
    VIC  18:   720x576    50.000000 Hz  16:9     31.250 kHz     27.000000 MHz
    VIC  19:  1280x720    50.000000 Hz  16:9     37.500 kHz     74.250000 MHz
    VIC  20:  1920x1080i  50.000000 Hz  16:9     28.125 kHz     74.250000 MHz
    VIC  22:  1440x576i   50.000000 Hz  16:9     15.625 kHz     27.000000 MHz
    VIC  31:  1920x1080   50.000000 Hz  16:9     56.250 kHz    148.500000 MHz (native)
    VIC  32:  1920x1080   24.000000 Hz  16:9     27.000 kHz     74.250000 MHz
    VIC  34:  1920x1080   30.000000 Hz  16:9     33.750 kHz     74.250000 MHz
  Audio Data Block:
    AC-3:
      Max channels: 2
      Supported sample rates (kHz): 48 44.1 32
      Maximum bit rate: 640 kb/s
    DTS:
      Max channels: 4
      Supported sample rates (kHz): 48 44.1 32
      Maximum bit rate: 1536 kb/s
    Enhanced AC-3 (DD+):
      Max channels: 8
      Supported sample rates (kHz): 48 44.1 32
    Linear PCM:
      Max channels: 2
      Supported sample rates (kHz): 48 44.1 32
      Supported sample sizes (bits): 24 20 16
  Speaker Allocation Data Block:
    FL/FR - Front Left/Right
  Vendor-Specific Data Block (HDMI), OUI 00-0C-03:
    Source physical address: 2.0.0.0
    Supports_AI
    DC_36bit
    DC_30bit
    DC_Y444
    Maximum TMDS clock: 300 MHz
    Extended HDMI video details:
      3D present
      3D-capable-VIC mask present
      HDMI VICs:
        HDMI VIC 1:  3840x2160   30.000000 Hz  16:9     67.500 kHz    297.000000 MHz
        HDMI VIC 2:  3840x2160   25.000000 Hz  16:9     56.250 kHz    297.000000 MHz
        HDMI VIC 3:  3840x2160   24.000000 Hz  16:9     54.000 kHz    297.000000 MHz
      3D: Side-by-side (half, horizontal)
      3D: Top-and-bottom
      3D: Frame-packing
      3D VIC indices that support these capabilities:
  Detailed Timing Descriptors:
    DTD 2:  3840x2160   30.000000 Hz  16:9     67.500 kHz    297.000000 MHz (621 mm x 341 mm)
                 Hfront  176 Hsync  88 Hback  296 Hpol P
                 Vfront    8 Vsync  10 Vback   72 Vpol N
    DTD 3:   720x576    50.000000 Hz   5:4     31.250 kHz     27.000000 MHz (227 mm x 181 mm)
                 Hfront   12 Hsync  64 Hback   68 Hpol N
                 Vfront    5 Vsync   5 Vback   39 Vpol N
    DTD 4:  1280x720    50.000000 Hz  16:9     37.500 kHz     74.250000 MHz (403 mm x 227 mm)
                 Hfront  440 Hsync  40 Hback  220 Hpol P
                 Vfront    5 Vsync   5 Vback   20 Vpol P
    DTD 5:  1920x1080i  50.000000 Hz  16:9     28.125 kHz     74.250000 MHz (605 mm x 340 mm)
                 Hfront  528 Hsync  44 Hback  148 Hpol P
                 Vfront    2 Vsync   5 Vback   15 Vpol P Vfront +0.5 Odd Field
                 Vfront    2 Vsync   5 Vback   15 Vpol P Vback  +0.5 Even Field
Checksum: 0xc3  Unused space in Extension Block: 2 bytes

----------------

Warnings:

Block 0, Base EDID:
  Detailed Timing Descriptor #1: DTD is similar but not identical to VIC 95.
Block 1, CTA-861 Extension Block:
  Video Data Block: VIC 1 and the first DTD are not identical. Is this intended?
  Video Data Block: All VICs are in ascending order, and the first (preferred) VIC <= 4, is that intended?
  Detailed Timing Descriptor #2: DTD is similar but not identical to VIC 95.
  Add a Colorimetry Data Block with the sRGB colorimetry bit set to avoid interop issues.
EDID:
  Base EDID: Some timings are out of range of the Monitor Ranges:
    Horizontal Freq: 15.625 - 74.556 kHz (Monitor: 30.000 - 160.000 kHz)

Failures:

Block 1, CTA-861 Extension Block:
  Vendor-Specific Data Block (HDMI), OUI 00-0C-03: HDMI VIC Codes must have their CTA-861 VIC equivalents in the VSB.
  Detailed Timing Descriptor #3: Mismatch of image size 227x181 mm vs display size 620x340 mm.
  Detailed Timing Descriptor #4: Mismatch of image size 403x227 mm vs display size 620x340 mm.
  Missing VCDB, needed for Set Selectable RGB Quantization to avoid interop issues.
EDID:
  Extension Block 2 started with EDID header, ignoring Extension Blocks >= 2.
  CTA-861: Native progressive timings are a mix of several resolutions.

EDID conformity: FAIL
