edid-decode (hex):

00 ff ff ff ff ff ff 00 09 e5 fe 05 00 00 00 00
01 17 01 04 90 1f 11 78 0a bf 60 94 5c 55 94 27
19 50 54 00 00 00 01 01 01 01 01 01 01 01 01 01
01 01 01 01 01 01 9e 1b 56 7e 50 00 16 30 30 20
36 00 35 ad 10 00 00 1a 00 00 00 00 00 00 00 00
00 00 00 00 00 00 00 00 00 1a 00 00 00 fe 00 42
4f 45 20 44 54 0a 20 20 20 20 20 20 00 00 00 fe
00 48 42 31 34 30 57 58 31 2d 32 30 30 0b 00 de

----------------

Block 0, Base EDID:
  EDID Structure Version & Revision: 1.4
  Vendor & Product Identification:
    Manufacturer: BOE
    Model: 1534
    Made in: week 1 of 2013
  Basic Display Parameters & Features:
    Digital display
    Bits per primary color channel: 6
    Digital interface is not defined
    Maximum image size: 31 cm x 17 cm
    Gamma: 2.20
    Supported color formats: RGB 4:4:4, YCrCb 4:4:4
    First detailed timing includes the native pixel format and preferred refresh rate
  Color Characteristics:
    Red  : 0.5800, 0.3623
    Green: 0.3349, 0.5810
    Blue : 0.1533, 0.0996
    White: 0.3125, 0.3281
  Established Timings I & II: none
  Standard Timings: none
  Detailed Timing Descriptors:
    DTD 1:  1366x768    59.982353 Hz 683:384   47.386 kHz     70.700000 MHz (309 mm x 173 mm)
                 Hfront   48 Hsync  32 Hback   46 Hpol P
                 Vfront    3 Vsync   6 Vback   13 Vpol N
    Manufacturer-Specified Display Descriptor (0x00): 00 00 00 00 00 00 00 00 00 00 00 00 00 00 00 1a '................'
    Alphanumeric Data String: 'BOE DT'
    Alphanumeric Data String: 'HB140WX1-200.'
Checksum: 0xde

----------------

Warnings:

Block 0, Base EDID:
  Alphanumeric Data String: Non-ASCII character 0x0b at position 12, can cause problems.
  Missing Display Product Name.

EDID conformity: PASS
