edid-decode (hex):

00 ff ff ff ff ff ff 00 09 e5 36 0a 00 00 00 00
0e 1f 01 04 95 1a 0e 78 0a ae 95 94 5b 57 94 29
1c 50 54 00 00 00 01 01 01 01 01 01 01 01 01 01
01 01 01 01 01 01 89 1d 56 d5 50 00 1e 30 30 20
35 00 00 90 10 00 00 1a a1 17 56 d5 50 00 1e 30
30 20 35 00 00 90 10 00 00 1a 00 00 00 fe 00 31
52 34 46 36 80 4e 54 31 31 4e 32 31 00 00 00 00
00 00 41 21 96 00 00 00 00 09 01 0a 20 20 00 31

00 ff ff ff ff ff ff 00 09 e5 36 0a 00 00 00 00
0e 1f 01 04 95 1a 0e 78 0a ae 95 94 5b 57 94 29
1c 50 54 00 00 00 01 01 01 01 01 01 01 01 01 01
01 01 01 01 01 01 89 1d 56 d5 50 00 1e 30 30 20
35 00 00 90 10 00 00 1a a1 17 56 d5 50 00 1e 30
30 20 35 00 00 90 10 00 00 1a 00 00 00 fe 00 31
52 34 46 36 80 4e 54 31 31 4e 32 31 00 00 00 00
00 00 41 21 96 00 00 00 00 09 01 0a 20 20 00 31

----------------

Block 0, Base EDID:
  EDID Structure Version & Revision: 1.4
  Vendor & Product Identification:
    Manufacturer: BOE
    Model: 2614
    Made in: week 14 of 2021
  Basic Display Parameters & Features:
    Digital display
    Bits per primary color channel: 6
    DisplayPort interface
    Maximum image size: 26 cm x 14 cm
    Gamma: 2.20
    Supported color formats: RGB 4:4:4, YCrCb 4:4:4
    First detailed timing includes the native pixel format and preferred refresh rate
  Color Characteristics:
    Red  : 0.5800, 0.3574
    Green: 0.3427, 0.5800
    Blue : 0.1621, 0.1103
    White: 0.3134, 0.3291
  Established Timings I & II: none
  Standard Timings: none
  Detailed Timing Descriptors:
    DTD 1:  1366x768    60.005936 Hz 683:384   47.885 kHz     75.610000 MHz (256 mm x 144 mm)
                 Hfront   48 Hsync  32 Hback  133 Hpol P
                 Vfront    3 Vsync   5 Vback   22 Vpol N
    DTD 2:  1366x768    48.006336 Hz 683:384   38.309 kHz     60.490000 MHz (256 mm x 144 mm)
                 Hfront   48 Hsync  32 Hback  133 Hpol P
                 Vfront    3 Vsync   5 Vback   22 Vpol N
    Alphanumeric Data String: '1R4F6.NT11N21'
    Manufacturer-Specified Display Descriptor (0x00): 00 00 00 00 41 21 96 00 00 00 00 09 01 0a 20 20 '....A!........  '
Checksum: 0x31

----------------

Block 1, Unknown EDID Extension Block 0x00:
  00 ff ff ff ff ff ff 00 09 e5 36 0a 00 00 00 00 '..........6.....'
  0e 1f 01 04 95 1a 0e 78 0a ae 95 94 5b 57 94 29 '.......x....[W.)'
  1c 50 54 00 00 00 01 01 01 01 01 01 01 01 01 01 '.PT.............'
  01 01 01 01 01 01 89 1d 56 d5 50 00 1e 30 30 20 '........V.P..00 '
  35 00 00 90 10 00 00 1a a1 17 56 d5 50 00 1e 30 '5.........V.P..0'
  30 20 35 00 00 90 10 00 00 1a 00 00 00 fe 00 31 '0 5............1'
  52 34 46 36 80 4e 54 31 31 4e 32 31 00 00 00 00 'R4F6.NT11N21....'
  00 00 41 21 96 00 00 00 00 09 01 0a 20 20 00 31 '..A!........  .1'
Checksum: 0x31

----------------

Warnings:

Block 0, Base EDID:
  Alphanumeric Data String: Non-ASCII character 0x80 at position 5, can cause problems.
  Missing Display Product Name.

Failures:

Block 1, Base EDID:
  Unknown Extension Block.
EDID:
  Base EDID: EDID specified 0 extension block(s), but found 1 extension block(s).

EDID conformity: FAIL
