edid-decode (hex):

00 ff ff ff ff ff ff 00 61 a9 14 a0 00 00 00 00
13 20 01 03 80 45 1d 78 2a 9a b5 ab 4e 43 ad 26
0c 50 54 ad cf 00 71 4f 01 01 81 40 81 80 95 00
a9 c0 b3 00 d1 c0 0a 48 00 a0 a0 38 32 40 30 20
35 00 b2 23 21 00 00 1e 00 00 00 fd 00 30 b4 1e
e9 3c 00 0a 20 20 20 20 20 20 00 00 00 fc 00 4d
69 20 33 30 20 48 46 43 57 0a 20 20 00 00 00 ff
00 33 34 31 30 33 30 30 30 33 36 33 38 39 01 1b

00 ff ff ff ff ff ff 00 61 a9 14 a0 00 00 00 00
13 20 01 03 80 45 1d 78 2a 9a b5 ab 4e 43 ad 26
0c 50 54 ad cf 00 71 4f 01 01 81 40 81 80 95 00
a9 c0 b3 00 d1 c0 0a 48 00 a0 a0 38 32 40 30 20
35 00 b2 23 21 00 00 1e 00 00 00 fd 00 30 b4 1e
e9 3c 00 0a 20 20 20 20 20 20 00 00 00 fc 00 4d
69 20 33 30 20 48 46 43 57 0a 20 20 00 00 00 ff
00 33 34 31 30 33 30 30 30 33 36 33 38 39 01 1b

----------------

Block 0, Base EDID:
  EDID Structure Version & Revision: 1.3
  Vendor & Product Identification:
    Manufacturer: XMI
    Model: 40980
    Made in: week 19 of 2022
  Basic Display Parameters & Features:
    Digital display
    Maximum image size: 69 cm x 29 cm
    Gamma: 2.20
    DPMS levels: Off
    RGB color display
    First detailed timing is the preferred timing
  Color Characteristics:
    Red  : 0.6699, 0.3056
    Green: 0.2636, 0.6777
    Blue : 0.1503, 0.0498
    White: 0.3134, 0.3291
  Established Timings I & II:
    IBM     :   720x400    70.081663 Hz   9:5     31.467 kHz     28.320000 MHz
    DMT 0x04:   640x480    59.940476 Hz   4:3     31.469 kHz     25.175000 MHz
    DMT 0x05:   640x480    72.808802 Hz   4:3     37.861 kHz     31.500000 MHz
    DMT 0x06:   640x480    75.000000 Hz   4:3     37.500 kHz     31.500000 MHz
    DMT 0x09:   800x600    60.316541 Hz   4:3     37.879 kHz     40.000000 MHz
    DMT 0x0a:   800x600    72.187572 Hz   4:3     48.077 kHz     50.000000 MHz
    DMT 0x0b:   800x600    75.000000 Hz   4:3     46.875 kHz     49.500000 MHz
    DMT 0x10:  1024x768    60.003840 Hz   4:3     48.363 kHz     65.000000 MHz
    DMT 0x11:  1024x768    70.069359 Hz   4:3     56.476 kHz     75.000000 MHz
    DMT 0x12:  1024x768    75.028582 Hz   4:3     60.023 kHz     78.750000 MHz
    DMT 0x24:  1280x1024   75.024675 Hz   5:4     79.976 kHz    135.000000 MHz
  Standard Timings:
    DMT 0x15:  1152x864    75.000000 Hz   4:3     67.500 kHz    108.000000 MHz
    DMT 0x20:  1280x960    60.000000 Hz   4:3     60.000 kHz    108.000000 MHz
    DMT 0x23:  1280x1024   60.019740 Hz   5:4     63.981 kHz    108.000000 MHz
    DMT 0x2f:  1440x900    59.887445 Hz  16:10    55.935 kHz    106.500000 MHz
    DMT 0x53:  1600x900    60.000000 Hz  16:9     60.000 kHz    108.000000 MHz (RB)
    DMT 0x3a:  1680x1050   59.954250 Hz  16:10    65.290 kHz    146.250000 MHz
    DMT 0x52:  1920x1080   60.000000 Hz  16:9     67.500 kHz    148.500000 MHz
  Detailed Timing Descriptors:
    DTD 1:  2560x1080   60.001301 Hz  64:27    67.801 kHz    184.420000 MHz (690 mm x 291 mm)
                 Hfront   48 Hsync  32 Hback   80 Hpol P
                 Vfront    3 Vsync   5 Vback   42 Vpol P
    Display Range Limits:
      Monitor ranges (GTF): 48-180 Hz V, 30-233 kHz H, max dotclock 600 MHz
    Display Product Name: 'Mi 30 HFCW'
    Display Product Serial Number: ...
  Extension blocks: 1
Checksum: 0x1b

----------------

Failures:

EDID:
  Extension Block 1 started with EDID header, ignoring Extension Blocks >= 1.
  Base EDID: EDID specified 1 extension block(s), but found 0 extension block(s).

EDID conformity: FAIL
