edid-decode (hex):

00 ff ff ff ff ff ff 00 4c 2d 2d 77 31 36 57 30
24 22 01 04 b5 77 22 78 3b e0 95 ae 4e 3a bb 25
0c 50 54 21 08 00 81 c0 81 00 81 80 95 00 a9 c0
b3 00 01 01 01 01 91 e6 00 a0 f0 38 96 40 30 20
3a 00 a9 50 41 00 00 1a 00 00 00 fd 0c 30 f0 8b
8b dd 01 0a 20 20 20 20 20 20 00 00 00 fc 00 4f
64 79 73 73 65 79 20 47 39 33 53 44 00 00 00 ff
00 48 4e 54 58 39 30 30 30 36 37 0a 20 20 02 e0

02 03 32 f0 46 61 60 10 3f 04 03 23 09 07 07 83
01 00 00 e3 05 c3 01 6d 1a 00 00 02 07 30 f0 00
04 60 01 4a 02 e6 06 05 01 60 4a 04 e5 01 8b 84
90 39 56 5e 00 a0 a0 a0 29 50 30 20 35 00 a9 50
41 00 00 1a 15 d1 00 a0 a0 a0 c8 50 30 20 3a 00
a9 50 41 00 00 1a 3c 73 00 a0 f0 38 96 40 30 20
3a 00 a9 50 41 00 00 1a d8 ef 80 a0 70 38 96 40
30 20 3a 00 a9 50 41 00 00 1a 00 00 00 00 00 43

70 12 79 03 00 03 01 64 ff 5c 03 08 ff 13 df 01
cf 80 1f 00 9f 05 c7 00 02 00 09 00 7f ae 01 88
ff 13 df 01 cf 80 1f 00 9f 05 c7 00 02 00 09 00
3f d7 00 08 ff 13 df 01 cf 80 1f 00 9f 05 c7 00
02 00 09 00 8d d4 01 08 ff 0e df 00 4f 80 1f 00
37 04 95 00 02 00 09 00 29 a2 01 08 ff 09 9f 00
2f 80 1f 00 9f 05 c7 00 02 00 09 00 00 00 00 00
00 00 00 00 00 00 00 00 00 00 00 00 00 00 70 90

00 ff ff ff ff ff ff 00 4c 2d 2d 77 31 36 57 30
24 22 01 04 b5 77 22 78 3b e0 95 ae 4e 3a bb 25
0c 50 54 21 08 00 81 c0 81 00 81 80 95 00 a9 c0
b3 00 01 01 01 01 91 e6 00 a0 f0 38 96 40 30 20
3a 00 a9 50 41 00 00 1a 00 00 00 fd 0c 30 f0 8b
8b dd 01 0a 20 20 20 20 20 20 00 00 00 fc 00 4f
64 79 73 73 65 79 20 47 39 33 53 44 00 00 00 ff
00 48 4e 54 58 39 30 30 30 36 37 0a 20 20 02 e0

02 03 32 f0 46 61 60 10 3f 04 03 23 09 07 07 83
01 00 00 e3 05 c3 01 6d 1a 00 00 02 07 30 f0 00
04 60 01 4a 02 e6 06 05 01 60 4a 04 e5 01 8b 84
90 39 56 5e 00 a0 a0 a0 29 50 30 20 35 00 a9 50
41 00 00 1a 15 d1 00 a0 a0 a0 c8 50 30 20 3a 00
a9 50 41 00 00 1a 3c 73 00 a0 f0 38 96 40 30 20
3a 00 a9 50 41 00 00 1a d8 ef 80 a0 70 38 96 40
30 20 3a 00 a9 50 41 00 00 1a 00 00 00 00 00 43

70 12 79 03 00 03 01 64 ff 5c 03 08 ff 13 df 01
cf 80 1f 00 9f 05 c7 00 02 00 09 00 7f ae 01 88
ff 13 df 01 cf 80 1f 00 9f 05 c7 00 02 00 09 00
3f d7 00 08 ff 13 df 01 cf 80 1f 00 9f 05 c7 00
02 00 09 00 8d d4 01 08 ff 0e df 00 4f 80 1f 00
37 04 95 00 02 00 09 00 29 a2 01 08 ff 09 9f 00
2f 80 1f 00 9f 05 c7 00 02 00 09 00 00 00 00 00
00 00 00 00 00 00 00 00 00 00 00 00 00 00 70 90

----------------

Block 0, Base EDID:
  EDID Structure Version & Revision: 1.4
  Vendor & Product Identification:
    Manufacturer: SAM
    Model: 30509
    Serial Number: ...
    Made in: week 36 of 2024
  Basic Display Parameters & Features:
    Digital display
    Bits per primary color channel: 10
    DisplayPort interface
    Maximum image size: 119 cm x 34 cm
    Gamma: 2.20
    DPMS levels: Off
    Supported color formats: RGB 4:4:4, YCrCb 4:4:4, YCrCb 4:2:2
    First detailed timing includes the native pixel format and preferred refresh rate
    Display supports continuous frequencies
  Color Characteristics:
    Red  : 0.6826, 0.3066
    Green: 0.2265, 0.7304
    Blue : 0.1464, 0.0478
    White: 0.3134, 0.3291
  Established Timings I & II:
    DMT 0x04:   640x480    59.940476 Hz   4:3     31.469 kHz     25.175000 MHz
    DMT 0x09:   800x600    60.316541 Hz   4:3     37.879 kHz     40.000000 MHz
    DMT 0x10:  1024x768    60.003840 Hz   4:3     48.363 kHz     65.000000 MHz
  Standard Timings:
    DMT 0x55:  1280x720    60.000000 Hz  16:9     45.000 kHz     74.250000 MHz
    DMT 0x1c:  1280x800    59.810326 Hz  16:10    49.702 kHz     83.500000 MHz
    DMT 0x23:  1280x1024   60.019740 Hz   5:4     63.981 kHz    108.000000 MHz
    DMT 0x2f:  1440x900    59.887445 Hz  16:10    55.935 kHz    106.500000 MHz
    DMT 0x53:  1600x900    60.000000 Hz  16:9     60.000 kHz    108.000000 MHz (RB)
    DMT 0x3a:  1680x1050   59.954250 Hz  16:10    65.290 kHz    146.250000 MHz
  Detailed Timing Descriptors:
    DTD 1:  3840x1080  119.969512 Hz  32:9    147.562 kHz    590.250000 MHz (1193 mm x 336 mm)
                 Hfront   48 Hsync  32 Hback   80 Hpol P
                 Vfront    3 Vsync  10 Vback  137 Vpol N
    Display Range Limits:
      Monitor ranges (Range Limits Only): 48-240 Hz V, 394-394 kHz H, max dotclock 2210 MHz
    Display Product Name: 'Odyssey G93SD'
    Display Product Serial Number: ...
  Extension blocks: 2
Checksum: 0xe0

----------------

Block 1, CTA-861 Extension Block:
  Revision: 3
  Underscans IT Video Formats by default
  Basic audio support
  Supports YCbCr 4:4:4
  Supports YCbCr 4:2:2
  Native DTDs: 0
  Video Data Block:
    VIC  97:  3840x2160   60.000000 Hz  16:9    135.000 kHz    594.000000 MHz
    VIC  96:  3840x2160   50.000000 Hz  16:9    112.500 kHz    594.000000 MHz
    VIC  16:  1920x1080   60.000000 Hz  16:9     67.500 kHz    148.500000 MHz
    VIC  63:  1920x1080  120.000000 Hz  16:9    135.000 kHz    297.000000 MHz
    VIC   4:  1280x720    60.000000 Hz  16:9     45.000 kHz     74.250000 MHz
    VIC   3:   720x480    59.940060 Hz  16:9     31.469 kHz     27.000000 MHz
  Audio Data Block:
    Linear PCM:
      Max channels: 2
      Supported sample rates (kHz): 48 44.1 32
      Supported sample sizes (bits): 24 20 16
  Speaker Allocation Data Block:
    FL/FR - Front Left/Right
  Colorimetry Data Block:
    xvYCC601
    xvYCC709
    BT2020YCC
    BT2020RGB
    Gamut Boundary Description Metadata Profile P0
  Vendor-Specific Data Block (AMD), OUI 00-00-1A:
    Version: 2
    Feature Caps: 0x07
      Global Backlight Control Supported
    Minimum Refresh Rate: 48 Hz
    Maximum Refresh Rate: 240 Hz
    Flags 1.x: 0x00
    Flags 2.x: 0x04
      ST 2084 (PQ) EOTF Supported
      Linear EOTF (Windows scRGB, 0.0 - 125.0) Supported
      Gamma 2.2 EOTF Supported
      BT.2020 Gamut Supported
    Maximum luminance: 96 (400.000 cd/m^2)
    Minimum luminance: 1 (0.000 cd/m^2)
    Maximum luminance (minimum backlight): 74 (248.372 cd/m^2)
    Minimum luminance (minimum backlight): 2 (0.000 cd/m^2)
  HDR Static Metadata Data Block:
    Electro optical transfer functions:
      Traditional gamma - SDR luminance range
      SMPTE ST2084
    Supported static metadata descriptors:
      Static metadata type 1
    Desired content max luminance: 96 (400.000 cd/m^2)
    Desired content max frame-average luminance: 74 (248.372 cd/m^2)
    Desired content min luminance: 4 (0.001 cd/m^2)
  Vendor-Specific Video Data Block (HDR10+), OUI 90-84-8B:
    Application Version: 1
    Full Frame Peak Luminance Index: 2
    Peak Luminance Index: 3
  Detailed Timing Descriptors:
    DTD 2:  2560x1440   59.950550 Hz  16:9     88.787 kHz    241.500000 MHz (1193 mm x 336 mm)
                 Hfront   48 Hsync  32 Hback   80 Hpol P
                 Vfront    3 Vsync   5 Vback   33 Vpol N
    DTD 3:  2560x1440  119.989688 Hz  16:9    196.783 kHz    535.250000 MHz (1193 mm x 336 mm)
                 Hfront   48 Hsync  32 Hback   80 Hpol P
                 Vfront    3 Vsync  10 Vback  187 Vpol N
    DTD 4:  3840x1080   59.959350 Hz  32:9     73.750 kHz    295.000000 MHz (1193 mm x 336 mm)
                 Hfront   48 Hsync  32 Hback   80 Hpol P
                 Vfront    3 Vsync  10 Vback  137 Vpol N
    DTD 5:  1920x1080  239.993746 Hz  16:9    295.192 kHz    614.000000 MHz (1193 mm x 336 mm)
                 Hfront   48 Hsync  32 Hback   80 Hpol P
                 Vfront    3 Vsync  10 Vback  137 Vpol N
Checksum: 0x43  Unused space in Extension Block: 5 bytes

----------------

Block 2, DisplayID Extension Block:
  Version: 1.2
  Extension Count: 0
  Display Product Type: Standalone display device
  Video Timing Modes Type 1 - Detailed Timings Data Block:
    DTD:  5120x1440  240.000000 Hz   0:0    393.600 kHz   2204.160000 MHz (aspect undefined, no 3D stereo)
               Hfront  208 Hsync  32 Hback  240 Hpol P
               Vfront    3 Vsync  10 Vback  187 Vpol N
    DTD:  5120x1440  120.000000 Hz   0:0    196.800 kHz   1102.080000 MHz (aspect undefined, no 3D stereo, preferred)
               Hfront  208 Hsync  32 Hback  240 Hpol P
               Vfront    3 Vsync  10 Vback  187 Vpol N
    DTD:  5120x1440   60.000000 Hz   0:0     98.400 kHz    551.040000 MHz (aspect undefined, no 3D stereo)
               Hfront  208 Hsync  32 Hback  240 Hpol P
               Vfront    3 Vsync  10 Vback  187 Vpol N
    DTD:  3840x1080  239.961430 Hz   0:0    295.153 kHz   1199.500000 MHz (aspect undefined, no 3D stereo)
               Hfront   80 Hsync  32 Hback  112 Hpol P
               Vfront    3 Vsync  10 Vback  137 Vpol N
    DTD:  2560x1440  239.979376 Hz   0:0    393.566 kHz   1070.500000 MHz (aspect undefined, no 3D stereo)
               Hfront   48 Hsync  32 Hback   80 Hpol P
               Vfront    3 Vsync  10 Vback  187 Vpol N
  Checksum: 0x70
Checksum: 0x90

----------------

Warnings:

Block 1, CTA-861 Extension Block:
  Video Data Block: VIC 97 and the first DTD are not identical. Is this intended?
  Colorimetry Data Block: Set the sRGB colorimetry bit to avoid interop issues.
  Detailed Timing Descriptor #2: Image size is 1193x336 mm, but based on the picture AR it should be 597x336 mm.
  Detailed Timing Descriptor #3: Image size is 1193x336 mm, but based on the picture AR it should be 597x336 mm.
  Detailed Timing Descriptor #5: Image size is 1193x336 mm, but based on the picture AR it should be 597x336 mm.
  Display Product Serial Number is set, so the Serial Number in the Base EDID should be 0.
EDID:
  Base EDID: Some timings are out of range of the Monitor Ranges:
    Horizontal Freq: 31.468 - 393.600 kHz (Monitor: 394.000 - 394.000 kHz)

Failures:

Block 1, CTA-861 Extension Block:
  Missing VCDB, needed for Set Selectable RGB Quantization to avoid interop issues.
EDID:
  Extension Block 3 started with EDID header, ignoring Extension Blocks >= 3.
  DisplayID: Missing DisplayID Display Parameters Data Block.

EDID conformity: FAIL
