edid-decode (hex):

00 ff ff ff ff ff ff 00 09 e5 ee 06 00 00 00 00
01 1a 01 04 95 1f 11 78 0a 21 90 a6 58 54 9f 26
10 50 54 00 00 00 01 01 01 01 01 01 01 01 01 01
01 01 01 01 01 01 b0 36 80 c9 70 38 14 40 30 20
36 00 35 ad 10 00 00 1a 30 2c 80 de 70 38 14 40
30 20 36 00 35 ad 10 00 00 1a 00 00 00 fe 00 36
48 59 31 57 80 4e 56 31 34 4e 34 37 00 00 00 00
00 00 41 11 9e 00 00 00 00 0a 01 0a 20 20 00 48

----------------

Block 0, Base EDID:
  EDID Structure Version & Revision: 1.4
  Vendor & Product Identification:
    Manufacturer: BOE
    Model: 1774
    Made in: week 1 of 2016
  Basic Display Parameters & Features:
    Digital display
    Bits per primary color channel: 6
    DisplayPort interface
    Maximum image size: 31 cm x 17 cm
    Gamma: 2.20
    Supported color formats: RGB 4:4:4, YCrCb 4:4:4
    First detailed timing includes the native pixel format and preferred refresh rate
  Color Characteristics:
    Red  : 0.6484, 0.3457
    Green: 0.3281, 0.6220
    Blue : 0.1503, 0.0634
    White: 0.3125, 0.3281
  Established Timings I & II: none
  Standard Timings: none
  Detailed Timing Descriptors:
    DTD 1:  1920x1080   60.006001 Hz  16:9     66.007 kHz    140.000000 MHz (309 mm x 173 mm)
                 Hfront   48 Hsync  32 Hback  121 Hpol P
                 Vfront    3 Vsync   6 Vback   11 Vpol N
    DTD 2:  1920x1080   48.009507 Hz  16:9     52.810 kHz    113.120000 MHz (309 mm x 173 mm)
                 Hfront   48 Hsync  32 Hback  142 Hpol P
                 Vfront    3 Vsync   6 Vback   11 Vpol N
    Alphanumeric Data String: '6HY1W.NV14N47'
    Manufacturer-Specified Display Descriptor (0x00): 00 00 00 00 41 11 9e 00 00 00 00 0a 01 0a 20 20 '....A.........  '
Checksum: 0x48

----------------

Warnings:

Block 0, Base EDID:
  Alphanumeric Data String: Non-ASCII character 0x80 at position 5, can cause problems.
  Missing Display Product Name.

EDID conformity: PASS
