edid-decode (hex):

00 ff ff ff ff ff ff 00 04 72 5e 09 a2 00 30 12
01 1f 01 04 b5 51 23 78 3b 6f 41 af 4f 41 ac 26
0f 50 54 21 08 00 01 01 01 01 01 01 01 01 01 01
01 01 01 01 01 01 c8 7d 70 a0 d0 a0 33 50 30 20
35 00 29 62 31 00 00 1a 00 00 00 ff 00 23 48 4c
41 59 4d 78 67 77 41 42 62 58 00 00 00 fd 00 01
90 de de 50 01 0a 20 20 20 20 20 20 00 00 00 fc
00 58 33 34 20 53 0a 20 20 20 20 20 20 20 02 45

02 03 20 f1 23 09 07 01 83 01 00 00 65 4b 04 00
01 01 e3 05 c0 00 e2 00 6a e6 06 05 01 60 5a 28
4e d4 70 a0 d0 a0 46 50 30 20 35 00 29 62 31 00
00 1a 00 00 00 00 00 00 00 00 00 00 00 00 00 00
00 00 00 00 00 00 00 00 00 00 00 00 00 00 00 00
00 00 00 00 00 00 00 00 00 00 00 00 00 00 00 00
00 00 00 00 00 00 00 00 00 00 00 00 00 00 00 00
00 00 00 00 00 00 00 00 00 00 00 00 00 00 00 21

70 13 79 03 00 0f 00 0a a4 14 0e 0e 07 01 20 45
00 00 02 01 0d 31 f2 9a 4f 1c b4 ac 64 e2 0e 01
45 54 03 01 28 52 01 01 04 6f 0d 9f 00 2f 80 1f
00 9f 05 54 00 02 00 04 00 66 38 01 84 6f 0d 9f
00 2f 80 1f 00 9f 05 66 00 02 00 04 00 00 00 00
00 00 00 00 00 00 00 00 00 00 00 00 00 00 00 00
00 00 00 00 00 00 00 00 00 00 00 00 00 00 00 00
00 00 00 00 00 00 00 00 00 00 00 00 00 00 0a 90

00 ff ff ff ff ff ff 00 04 72 5e 09 a2 00 30 12
01 1f 01 04 b5 51 23 78 3b 6f 41 af 4f 41 ac 26
0f 50 54 21 08 00 01 01 01 01 01 01 01 01 01 01
01 01 01 01 01 01 c8 7d 70 a0 d0 a0 33 50 30 20
35 00 29 62 31 00 00 1a 00 00 00 ff 00 23 48 4c
41 59 4d 78 67 77 41 42 62 58 00 00 00 fd 00 01
90 de de 50 01 0a 20 20 20 20 20 20 00 00 00 fc
00 58 33 34 20 53 0a 20 20 20 20 20 20 20 02 45

02 03 20 f1 23 09 07 01 83 01 00 00 65 4b 04 00
01 01 e3 05 c0 00 e2 00 6a e6 06 05 01 60 5a 28
4e d4 70 a0 d0 a0 46 50 30 20 35 00 29 62 31 00
00 1a 00 00 00 00 00 00 00 00 00 00 00 00 00 00
00 00 00 00 00 00 00 00 00 00 00 00 00 00 00 00
00 00 00 00 00 00 00 00 00 00 00 00 00 00 00 00
00 00 00 00 00 00 00 00 00 00 00 00 00 00 00 00
00 00 00 00 00 00 00 00 00 00 00 00 00 00 00 21

70 13 79 03 00 0f 00 0a a4 14 0e 0e 07 01 20 45
00 00 02 01 0d 31 f2 9a 4f 1c b4 ac 64 e2 0e 01
45 54 03 01 28 52 01 01 04 6f 0d 9f 00 2f 80 1f
00 9f 05 54 00 02 00 04 00 66 38 01 84 6f 0d 9f
00 2f 80 1f 00 9f 05 66 00 02 00 04 00 00 00 00
00 00 00 00 00 00 00 00 00 00 00 00 00 00 00 00
00 00 00 00 00 00 00 00 00 00 00 00 00 00 00 00
00 00 00 00 00 00 00 00 00 00 00 00 00 00 0a 90

----------------

Block 0, Base EDID:
  EDID Structure Version & Revision: 1.4
  Vendor & Product Identification:
    Manufacturer: ACR
    Model: 2398
    Serial Number: ...
    Made in: week 1 of 2021
  Basic Display Parameters & Features:
    Digital display
    Bits per primary color channel: 10
    DisplayPort interface
    Maximum image size: 81 cm x 35 cm
    Gamma: 2.20
    DPMS levels: Off
    Supported color formats: RGB 4:4:4, YCrCb 4:4:4, YCrCb 4:2:2
    First detailed timing includes the native pixel format and preferred refresh rate
    Display supports continuous frequencies
  Color Characteristics:
    Red  : 0.6845, 0.3105
    Green: 0.2568, 0.6748
    Blue : 0.1494, 0.0585
    White: 0.3125, 0.3291
  Established Timings I & II:
    DMT 0x04:   640x480    59.940476 Hz   4:3     31.469 kHz     25.175000 MHz
    DMT 0x09:   800x600    60.316541 Hz   4:3     37.879 kHz     40.000000 MHz
    DMT 0x10:  1024x768    60.003840 Hz   4:3     48.363 kHz     65.000000 MHz
  Standard Timings: none
  Detailed Timing Descriptors:
    DTD 1:  3440x1440   59.989567 Hz  43:18    89.444 kHz    322.000000 MHz (809 mm x 354 mm)
                 Hfront   48 Hsync  32 Hback   80 Hpol P
                 Vfront    3 Vsync   5 Vback   43 Vpol N
    Display Product Serial Number: ...
    Display Range Limits:
      Monitor ranges (Range Limits Only): 1-144 Hz V, 222-222 kHz H, max dotclock 800 MHz
    Display Product Name: 'X34 S'
  Extension blocks: 2
Checksum: 0x45

----------------

Block 1, CTA-861 Extension Block:
  Revision: 3
  Underscans IT Video Formats by default
  Basic audio support
  Supports YCbCr 4:4:4
  Supports YCbCr 4:2:2
  Native DTDs: 1
  Audio Data Block:
    Linear PCM:
      Max channels: 2
      Supported sample rates (kHz): 48 44.1 32
      Supported sample sizes (bits): 16
  Speaker Allocation Data Block:
    FL/FR - Front Left/Right
  Vendor-Specific Data Block (NVIDIA), OUI 00-04-4B:
    01 01                                           '..'
  Colorimetry Data Block:
    BT2020YCC
    BT2020RGB
  Video Capability Data Block:
    YCbCr quantization: No Data
    RGB quantization: Selectable (via AVI Q)
    PT scan behavior: Always Underscanned
    IT scan behavior: Always Underscanned
    CE scan behavior: Always Underscanned
  HDR Static Metadata Data Block:
    Electro optical transfer functions:
      Traditional gamma - SDR luminance range
      SMPTE ST2084
    Supported static metadata descriptors:
      Static metadata type 1
    Desired content max luminance: 96 (400.000 cd/m^2)
    Desired content max frame-average luminance: 90 (351.250 cd/m^2)
    Desired content min luminance: 40 (0.098 cd/m^2)
  Detailed Timing Descriptors:
    DTD 2:  3440x1440   99.981604 Hz  43:18   150.972 kHz    543.500000 MHz (809 mm x 354 mm)
                 Hfront   48 Hsync  32 Hback   80 Hpol P
                 Vfront    3 Vsync   5 Vback   62 Vpol N
Checksum: 0x21  Unused space in Extension Block: 77 bytes

----------------

Block 2, DisplayID Extension Block:
  Version: 1.3
  Extension Count: 0
  Display Product Type: Standalone display device
  Display Interface Data Block:
    Interface Type: DisplayPort
    Number of Links: 4
    Interface Standard Version: 1.4
    Supported bpc for RGB encoding: 8, 10, 12
    Supported bpc for YCbCr 4:4:4 encoding: 8, 10, 12
    Supported bpc for YCbCr 4:2:2 encoding: 8, 10, 12
    Supported Content Protection: HDCP 2.0
    Spread Spectrum: Down Spread 0.5%
  Color Characteristics Data Block:
    Uses spatial color
    Uses 1931 CIE (x, y) coordinates
    Primary #0: (0.6841, 0.3108)
    Primary #1: (0.2568, 0.6746)
    Primary #2: (0.1494, 0.0581)
    White point #0: (0.3127, 0.3291)
  Video Timing Modes Type 1 - Detailed Timings Data Block:
    DTD:  3440x1440  119.990893 Hz  16:9    182.986 kHz    658.750000 MHz (aspect 16:9, no 3D stereo)
               Hfront   48 Hsync  32 Hback   80 Hpol P
               Vfront    3 Vsync   5 Vback   77 Vpol N
    DTD:  3440x1440  143.974581 Hz  16:9    222.153 kHz    799.750000 MHz (aspect 16:9, no 3D stereo, preferred)
               Hfront   48 Hsync  32 Hback   80 Hpol P
               Vfront    3 Vsync   5 Vback   95 Vpol N
  Checksum: 0x0a
Checksum: 0x90

----------------

Warnings:

Block 0, Base EDID:
  Detailed Timing Descriptor #1: Image size is 809x354 mm, but based on the picture AR it should be 809x338 mm.
Block 1, CTA-861 Extension Block:
  Colorimetry Data Block: Set the sRGB colorimetry bit to avoid interop issues.
  Video Capability Data Block: Set Selectable YCbCr Quantization to avoid interop issues.
  Video Capability Data Block: S_PT is equal to S_IT and S_CE, so should be set to 0 instead.
  Detailed Timing Descriptor #2: Image size is 809x354 mm, but based on the picture AR it should be 809x338 mm.
  Display Product Serial Number is set, so the Serial Number in the Base EDID should be 0.
EDID:
  Base EDID: Some timings are out of range of the Monitor Ranges:
    Horizontal Freq: 31.468 - 222.152 kHz (Monitor: 222.000 - 222.000 kHz)

Failures:

EDID:
  Extension Block 3 started with EDID header, ignoring Extension Blocks >= 3.
  DisplayID: Missing DisplayID Display Parameters Data Block.

EDID conformity: FAIL
