edid-decode (hex):

00 ff ff ff ff ff ff 00 4c b4 54 4c 01 00 00 00
01 1c 01 03 82 46 27 78 8a a5 8e a6 54 4a 9c 26
12 45 46 ad ce 00 81 c0 81 00 81 40 81 80 95 00
a9 c0 a9 40 71 c0 02 3a 80 18 71 38 2d 40 58 2c
45 00 b9 88 21 00 00 1e 66 21 56 aa 51 00 1e 30
46 8f 33 00 b9 88 21 00 00 1c 00 00 00 fd 00 32
4b 18 3c 0b 00 0a 20 20 20 20 20 20 00 00 00 fc
00 46 69 65 6c 64 20 4d 6f 6e 69 74 6f 72 01 fb

02 03 2e 41 4e 06 07 02 03 15 96 11 12 13 04 14
05 1f 90 23 09 07 07 83 01 00 00 72 03 0c 00 10
00 b8 44 20 c0 84 01 02 03 04 01 41 00 00 28 3c
80 a0 70 b0 23 40 30 20 36 00 b9 88 21 00 00 18
30 2a 00 98 51 00 2a 40 30 70 13 00 b9 88 21 00
00 9e 21 39 90 30 62 1a 27 40 68 b0 36 00 b9 88
21 00 00 1e 02 3a 80 d0 72 38 2d 40 10 2c 45 80
b9 88 21 00 00 1e 00 00 00 00 00 00 00 00 00 2e

00 ff ff ff ff ff ff 00 4c b4 54 4c 01 00 00 00
01 1c 01 03 82 46 27 78 8a a5 8e a6 54 4a 9c 26
12 45 46 ad ce 00 81 c0 81 00 81 40 81 80 95 00
a9 c0 a9 40 71 c0 02 3a 80 18 71 38 2d 40 58 2c
45 00 b9 88 21 00 00 1e 66 21 56 aa 51 00 1e 30
46 8f 33 00 b9 88 21 00 00 1c 00 00 00 fd 00 32
4b 18 3c 0b 00 0a 20 20 20 20 20 20 00 00 00 fc
00 46 69 65 6c 64 20 4d 6f 6e 69 74 6f 72 01 fb

02 03 2e 41 4e 06 07 02 03 15 96 11 12 13 04 14
05 1f 90 23 09 07 07 83 01 00 00 72 03 0c 00 10
00 b8 44 20 c0 84 01 02 03 04 01 41 00 00 28 3c
80 a0 70 b0 23 40 30 20 36 00 b9 88 21 00 00 18
30 2a 00 98 51 00 2a 40 30 70 13 00 b9 88 21 00
00 9e 21 39 90 30 62 1a 27 40 68 b0 36 00 b9 88
21 00 00 1e 02 3a 80 d0 72 38 2d 40 10 2c 45 80
b9 88 21 00 00 1e 00 00 00 00 00 00 00 00 00 2e

----------------

Block 0, Base EDID:
  EDID Structure Version & Revision: 1.3
  Vendor & Product Identification:
    Manufacturer: SET
    Model: 19540
    Serial Number: ...
    Made in: week 1 of 2018
  Basic Display Parameters & Features:
    Digital display
    Maximum image size: 70 cm x 39 cm
    Gamma: 2.20
    DPMS levels: Standby
    RGB color display
    First detailed timing is the preferred timing
  Color Characteristics:
    Red  : 0.6503, 0.3300
    Green: 0.2900, 0.6103
    Blue : 0.1503, 0.0703
    White: 0.2724, 0.2753
  Established Timings I & II:
    IBM     :   720x400    70.081663 Hz   9:5     31.467 kHz     28.320000 MHz
    DMT 0x04:   640x480    59.940476 Hz   4:3     31.469 kHz     25.175000 MHz
    DMT 0x05:   640x480    72.808802 Hz   4:3     37.861 kHz     31.500000 MHz
    DMT 0x06:   640x480    75.000000 Hz   4:3     37.500 kHz     31.500000 MHz
    DMT 0x09:   800x600    60.316541 Hz   4:3     37.879 kHz     40.000000 MHz
    DMT 0x0a:   800x600    72.187572 Hz   4:3     48.077 kHz     50.000000 MHz
    DMT 0x0b:   800x600    75.000000 Hz   4:3     46.875 kHz     49.500000 MHz
    DMT 0x10:  1024x768    60.003840 Hz   4:3     48.363 kHz     65.000000 MHz
    DMT 0x11:  1024x768    70.069359 Hz   4:3     56.476 kHz     75.000000 MHz
    DMT 0x12:  1024x768    75.028582 Hz   4:3     60.023 kHz     78.750000 MHz
  Standard Timings:
    DMT 0x55:  1280x720    60.000000 Hz  16:9     45.000 kHz     74.250000 MHz
    DMT 0x1c:  1280x800    59.810326 Hz  16:10    49.702 kHz     83.500000 MHz
    DMT 0x20:  1280x960    60.000000 Hz   4:3     60.000 kHz    108.000000 MHz
    DMT 0x23:  1280x1024   60.019740 Hz   5:4     63.981 kHz    108.000000 MHz
    DMT 0x2f:  1440x900    59.887445 Hz  16:10    55.935 kHz    106.500000 MHz
    DMT 0x53:  1600x900    60.000000 Hz  16:9     60.000 kHz    108.000000 MHz (RB)
    DMT 0x33:  1600x1200   60.000000 Hz   4:3     75.000 kHz    162.000000 MHz
    GTF     :  1152x648    60.000120 Hz  16:9     40.260 kHz     59.907000 MHz
  Detailed Timing Descriptors:
    DTD 1:  1920x1080   60.000000 Hz  16:9     67.500 kHz    148.500000 MHz (697 mm x 392 mm)
                 Hfront   88 Hsync  44 Hback  148 Hpol P
                 Vfront    4 Vsync   5 Vback   36 Vpol P
    DTD 2:  1366x768    59.789541 Hz 683:384   47.712 kHz     85.500000 MHz (697 mm x 392 mm)
                 Hfront   70 Hsync 143 Hback  213 Hpol N
                 Vfront    3 Vsync   3 Vback   24 Vpol P
    Display Range Limits:
      Monitor ranges (GTF): 50-75 Hz V, 24-60 kHz H, max dotclock 110 MHz
    Display Product Name: 'Field Monitor'
  Extension blocks: 1
Checksum: 0xfb

----------------

Block 1, CTA-861 Extension Block:
  Revision: 3
  Basic audio support
  Native DTDs: 1
  Video Data Block:
    VIC   6:  1440x480i   59.940060 Hz   4:3     15.734 kHz     27.000000 MHz
    VIC   7:  1440x480i   59.940060 Hz  16:9     15.734 kHz     27.000000 MHz
    VIC   2:   720x480    59.940060 Hz   4:3     31.469 kHz     27.000000 MHz
    VIC   3:   720x480    59.940060 Hz  16:9     31.469 kHz     27.000000 MHz
    VIC  21:  1440x576i   50.000000 Hz   4:3     15.625 kHz     27.000000 MHz
    VIC  22:  1440x576i   50.000000 Hz  16:9     15.625 kHz     27.000000 MHz (native)
    VIC  17:   720x576    50.000000 Hz   4:3     31.250 kHz     27.000000 MHz
    VIC  18:   720x576    50.000000 Hz  16:9     31.250 kHz     27.000000 MHz
    VIC  19:  1280x720    50.000000 Hz  16:9     37.500 kHz     74.250000 MHz
    VIC   4:  1280x720    60.000000 Hz  16:9     45.000 kHz     74.250000 MHz
    VIC  20:  1920x1080i  50.000000 Hz  16:9     28.125 kHz     74.250000 MHz
    VIC   5:  1920x1080i  60.000000 Hz  16:9     33.750 kHz     74.250000 MHz
    VIC  31:  1920x1080   50.000000 Hz  16:9     56.250 kHz    148.500000 MHz
    VIC  16:  1920x1080   60.000000 Hz  16:9     67.500 kHz    148.500000 MHz (native)
  Audio Data Block:
    Linear PCM:
      Max channels: 2
      Supported sample rates (kHz): 48 44.1 32
      Supported sample sizes (bits): 24 20 16
  Speaker Allocation Data Block:
    FL/FR - Front Left/Right
  Vendor-Specific Data Block (HDMI), OUI 00-0C-03:
    Source physical address: 1.0.0.0
    Supports_AI
    DC_36bit
    DC_30bit
    DC_Y444
    Maximum TMDS clock: 340 MHz
    Extended HDMI video details:
      3D present
      3D-capable-VIC mask present
      HDMI VICs:
        HDMI VIC 1:  3840x2160   30.000000 Hz  16:9     67.500 kHz    297.000000 MHz
        HDMI VIC 2:  3840x2160   25.000000 Hz  16:9     56.250 kHz    297.000000 MHz
        HDMI VIC 3:  3840x2160   24.000000 Hz  16:9     54.000 kHz    297.000000 MHz
        HDMI VIC 4:  4096x2160   24.000000 Hz 256:135   54.000 kHz    297.000000 MHz
      3D: Side-by-side (half, horizontal)
      3D: Top-and-bottom
      3D: Frame-packing
      3D VIC indices that support these capabilities:
  Detailed Timing Descriptors:
    DTD 3:  1920x1200   59.950171 Hz  16:10    74.038 kHz    154.000000 MHz (697 mm x 392 mm)
                 Hfront   48 Hsync  32 Hback   80 Hpol N
                 Vfront    3 Vsync   6 Vback   26 Vpol N
    DTD 4:  1280x2048i  59.991601 Hz   5:8     63.981 kHz    108.000000 MHz (697 mm x 392 mm)
                 Hfront   48 Hsync 112 Hback  248 Hpol P
                 Vfront    1 Vsync   3 Vback   38 Vpol P Vfront +0.5 Odd Field
                 Vfront    1 Vsync   3 Vback   38 Vpol P Vback  +0.5 Even Field
    DTD 5:  1680x1050   59.954250 Hz  16:10    65.290 kHz    146.250000 MHz (697 mm x 392 mm)
                 Hfront  104 Hsync 176 Hback  280 Hpol P
                 Vfront    3 Vsync   6 Vback   30 Vpol P
    DTD 6:  1920x1080   50.000000 Hz  16:9     56.250 kHz    148.500000 MHz (697 mm x 392 mm)
                 Hfront  528 Hsync  44 Hback  148 Hpol P
                 Vfront    4 Vsync   5 Vback   36 Vpol P
Checksum: 0x2e  Unused space in Extension Block: 9 bytes

----------------

Warnings:

Block 0, Base EDID:
  Vendor & Product Identification: The serial number is one of the known dummy values, it should probably be set to 0.
  Detailed Timing Descriptor #2: DTD is similar but not identical to DMT 0x51.
Block 1, CTA-861 Extension Block:
  IT Video Formats are overscanned by default, but normally this should be underscanned.
  Video Data Block: VIC 6 and the first DTD are not identical. Is this intended?
  Detailed Timing Descriptor #3: DTD is similar but not identical to DMT 0x44.
  Detailed Timing Descriptor #3: Image size is 697x392 mm, but based on the picture AR it should be 627x392 mm.
  Detailed Timing Descriptor #4: Image size is 697x392 mm, but based on the picture AR it should be 245x392 mm.
  Detailed Timing Descriptor #5: DTD is similar but not identical to DMT 0x3a.
  Detailed Timing Descriptor #5: Image size is 697x392 mm, but based on the picture AR it should be 627x392 mm.
  Add a Colorimetry Data Block with the sRGB colorimetry bit set to avoid interop issues.
EDID:
  Base EDID: Some timings are out of range of the Monitor Ranges:
    Vertical Freq: 24.000 - 75.029 Hz (Monitor: 50.000 - 75.000 Hz)
    Horizontal Freq: 15.625 - 75.000 kHz (Monitor: 24.000 - 60.000 kHz)
    Maximum Clock: 297.000 MHz (Monitor: 110.000 MHz)

Failures:

Block 0, Base EDID:
  Basic Display Parameters & Features: Digital Video Interface Standard set to reserved value 0x02.
Block 1, CTA-861 Extension Block:
  Vendor-Specific Data Block (HDMI), OUI 00-0C-03: HDMI VIC Codes must have their CTA-861 VIC equivalents in the VSB.
  Missing VCDB, needed for Set Selectable RGB Quantization to avoid interop issues.
EDID:
  Extension Block 2 started with EDID header, ignoring Extension Blocks >= 2.

EDID conformity: FAIL
