edid-decode (hex):

00 ff ff ff ff ff ff 00 4e 14 a8 09 01 00 00 00
2a 1f 01 03 b4 35 1d 78 28 ee 91 a3 54 4c 99 26
0f 50 54 21 09 00 31 40 45 40 61 40 81 c0 81 80
95 00 b3 00 45 4f 02 3a 80 18 71 38 2d 40 58 2c
45 00 12 22 21 00 00 1e 00 00 00 fd 00 30 4b 1e
55 14 00 0a 20 20 20 20 20 20 00 00 00 ff 00 30
30 30 30 30 30 30 30 30 30 30 30 31 00 00 00 fc
00 53 63 65 70 74 72 65 20 46 32 34 0a 20 01 c4

02 03 25 f1 47 90 1f 04 13 03 01 05 23 09 07 07
83 01 00 00 67 03 0c 00 10 00 18 28 68 1a 00 00
01 00 30 4b e6 50 44 80 a0 70 38 29 40 30 20 35
00 00 00 00 00 00 1e 7f 21 56 aa 51 00 1e 30 46
8f 33 00 00 00 00 00 00 1e d1 26 40 a0 60 84 29
30 30 20 35 00 00 00 00 00 00 1e 10 0e 20 e0 30
58 19 20 18 48 12 00 00 00 00 00 00 1e 78 13 20
18 31 58 29 20 30 20 35 00 00 00 00 00 00 1e 3c

00 ff ff ff ff ff ff 00 4e 14 a8 09 01 00 00 00
2a 1f 01 03 b4 35 1d 78 28 ee 91 a3 54 4c 99 26
0f 50 54 21 09 00 31 40 45 40 61 40 81 c0 81 80
95 00 b3 00 45 4f 02 3a 80 18 71 38 2d 40 58 2c
45 00 12 22 21 00 00 1e 00 00 00 fd 00 30 4b 1e
55 14 00 0a 20 20 20 20 20 20 00 00 00 ff 00 30
30 30 30 30 30 30 30 30 30 30 30 31 00 00 00 fc
00 53 63 65 70 74 72 65 20 46 32 34 0a 20 01 c4

02 03 25 f1 47 90 1f 04 13 03 01 05 23 09 07 07
83 01 00 00 67 03 0c 00 10 00 18 28 68 1a 00 00
01 00 30 4b e6 50 44 80 a0 70 38 29 40 30 20 35
00 00 00 00 00 00 1e 7f 21 56 aa 51 00 1e 30 46
8f 33 00 00 00 00 00 00 1e d1 26 40 a0 60 84 29
30 30 20 35 00 00 00 00 00 00 1e 10 0e 20 e0 30
58 19 20 18 48 12 00 00 00 00 00 00 1e 78 13 20
18 31 58 29 20 30 20 35 00 00 00 00 00 00 1e 3c

----------------

Block 0, Base EDID:
  EDID Structure Version & Revision: 1.3
  Vendor & Product Identification:
    Manufacturer: SPT
    Model: 2472
    Serial Number: ...
    Made in: week 42 of 2021
  Basic Display Parameters & Features:
    Digital display
    Maximum image size: 53 cm x 29 cm
    Gamma: 2.20
    DPMS levels: Off
    RGB color display
  Color Characteristics:
    Red  : 0.6396, 0.3300
    Green: 0.2998, 0.5996
    Blue : 0.1503, 0.0595
    White: 0.3125, 0.3291
  Established Timings I & II:
    DMT 0x04:   640x480    59.940476 Hz   4:3     31.469 kHz     25.175000 MHz
    DMT 0x09:   800x600    60.316541 Hz   4:3     37.879 kHz     40.000000 MHz
    DMT 0x10:  1024x768    60.003840 Hz   4:3     48.363 kHz     65.000000 MHz
    DMT 0x24:  1280x1024   75.024675 Hz   5:4     79.976 kHz    135.000000 MHz
  Standard Timings:
    DMT 0x04:   640x480    59.940476 Hz   4:3     31.469 kHz     25.175000 MHz
    DMT 0x09:   800x600    60.316541 Hz   4:3     37.879 kHz     40.000000 MHz
    DMT 0x10:  1024x768    60.003840 Hz   4:3     48.363 kHz     65.000000 MHz
    DMT 0x55:  1280x720    60.000000 Hz  16:9     45.000 kHz     74.250000 MHz
    DMT 0x23:  1280x1024   60.019740 Hz   5:4     63.981 kHz    108.000000 MHz
    DMT 0x2f:  1440x900    59.887445 Hz  16:10    55.935 kHz    106.500000 MHz
    DMT 0x3a:  1680x1050   59.954250 Hz  16:10    65.290 kHz    146.250000 MHz
    DMT 0x0b:   800x600    75.000000 Hz   4:3     46.875 kHz     49.500000 MHz
  Detailed Timing Descriptors:
    DTD  1:  1920x1080   60.000000 Hz  16:9     67.500 kHz    148.500000 MHz (530 mm x 290 mm)
                  Hfront   88 Hsync  44 Hback  148 Hpol P
                  Vfront    4 Vsync   5 Vback   36 Vpol P
    Display Range Limits:
      Monitor ranges (GTF): 48-75 Hz V, 30-85 kHz H, max dotclock 200 MHz
    Display Product Serial Number: ...
    Display Product Name: 'Sceptre F24'
  Extension blocks: 1
Checksum: 0xc4

----------------

Block 1, CTA-861 Extension Block:
  Revision: 3
  Underscans IT Video Formats by default
  Basic audio support
  Supports YCbCr 4:4:4
  Supports YCbCr 4:2:2
  Native detailed modes: 1
  Video Data Block:
    VIC  16:  1920x1080   60.000000 Hz  16:9     67.500 kHz    148.500000 MHz (native)
    VIC  31:  1920x1080   50.000000 Hz  16:9     56.250 kHz    148.500000 MHz
    VIC   4:  1280x720    60.000000 Hz  16:9     45.000 kHz     74.250000 MHz
    VIC  19:  1280x720    50.000000 Hz  16:9     37.500 kHz     74.250000 MHz
    VIC   3:   720x480    59.940060 Hz  16:9     31.469 kHz     27.000000 MHz
    VIC   1:   640x480    59.940476 Hz   4:3     31.469 kHz     25.175000 MHz
    VIC   5:  1920x1080i  60.000000 Hz  16:9     33.750 kHz     74.250000 MHz
  Audio Data Block:
    Linear PCM:
      Max channels: 2
      Supported sample rates (kHz): 48 44.1 32
      Supported sample sizes (bits): 24 20 16
  Speaker Allocation Data Block:
    FL/FR - Front Left/Right
  Vendor-Specific Data Block (HDMI), OUI 00-0C-03:
    Source physical address: 1.0.0.0
    DC_30bit
    DC_Y444
    Maximum TMDS clock: 200 MHz
  Vendor-Specific Data Block (AMD), OUI 00-00-1A:
    Version: 1
    Feature Caps: 0x00
    Minimum Refresh Rate: 48 Hz
    Maximum Refresh Rate: 75 Hz
    Flags 1.x: 0xe6 (MCCS)
  Detailed Timing Descriptors:
    DTD  2:  1920x1080   75.001716 Hz  16:9     84.077 kHz    174.880000 MHz
                  Hfront   48 Hsync  32 Hback   80 Hpol P
                  Vfront    3 Vsync   5 Vback   33 Vpol P
    DTD  3:  1366x768    59.964364 Hz 683:384   47.852 kHz     85.750000 MHz
                  Hfront   70 Hsync 143 Hback  213 Hpol P
                  Vfront    3 Vsync   3 Vback   24 Vpol P
    DTD  4:  1600x900    60.000242 Hz  16:9     56.460 kHz     99.370000 MHz
                  Hfront   48 Hsync  32 Hback   80 Hpol P
                  Vfront    3 Vsync   5 Vback   33 Vpol P
    DTD  5:   800x600    56.250000 Hz   4:3     35.156 kHz     36.000000 MHz
                  Hfront   24 Hsync  72 Hback  128 Hpol P
                  Vfront    1 Vsync   2 Vback   22 Vpol P
    DTD  6:   800x600    71.993991 Hz   4:3     46.148 kHz     49.840000 MHz
                  Hfront   48 Hsync  32 Hback  200 Hpol P
                  Vfront    3 Vsync   5 Vback   33 Vpol P
Checksum: 0x3c

----------------

Block 2, Unknown EDID Extension Block 0x00:
  00 ff ff ff ff ff ff 00 4e 14 a8 09 01 00 00 00 '........N.......'
  2a 1f 01 03 b4 35 1d 78 28 ee 91 a3 54 4c 99 26 '*....5.x(...TL.&'
  0f 50 54 21 09 00 31 40 45 40 61 40 81 c0 81 80 '.PT!..1@E@a@....'
  95 00 b3 00 45 4f 02 3a 80 18 71 38 2d 40 58 2c '....EO.:..q8-@X,'
  45 00 12 22 21 00 00 1e 00 00 00 fd 00 30 4b 1e 'E.."!........0K.'
  55 14 00 0a 20 20 20 20 20 20 00 00 00 ff 00 30 'U...      .....0'
  30 30 30 30 30 30 30 30 30 30 30 31 00 00 00 fc '000000000001....'
  00 53 63 65 70 74 72 65 20 46 32 34 0a 20 01 c4 '.Sceptre F24. ..'
Checksum: 0xc4

----------------

Block 3, CTA-861 Extension Block:
  Revision: 3
  Underscans IT Video Formats by default
  Basic audio support
  Supports YCbCr 4:4:4
  Supports YCbCr 4:2:2
  Native detailed modes: 1
  Video Data Block:
    VIC  16:  1920x1080   60.000000 Hz  16:9     67.500 kHz    148.500000 MHz (native)
    VIC  31:  1920x1080   50.000000 Hz  16:9     56.250 kHz    148.500000 MHz
    VIC   4:  1280x720    60.000000 Hz  16:9     45.000 kHz     74.250000 MHz
    VIC  19:  1280x720    50.000000 Hz  16:9     37.500 kHz     74.250000 MHz
    VIC   3:   720x480    59.940060 Hz  16:9     31.469 kHz     27.000000 MHz
    VIC   1:   640x480    59.940476 Hz   4:3     31.469 kHz     25.175000 MHz
    VIC   5:  1920x1080i  60.000000 Hz  16:9     33.750 kHz     74.250000 MHz
  Audio Data Block:
    Linear PCM:
      Max channels: 2
      Supported sample rates (kHz): 48 44.1 32
      Supported sample sizes (bits): 24 20 16
  Speaker Allocation Data Block:
    FL/FR - Front Left/Right
  Vendor-Specific Data Block (HDMI), OUI 00-0C-03:
    Source physical address: 1.0.0.0
    DC_30bit
    DC_Y444
    Maximum TMDS clock: 200 MHz
  Vendor-Specific Data Block (AMD), OUI 00-00-1A:
    Version: 1
    Feature Caps: 0x00
    Minimum Refresh Rate: 48 Hz
    Maximum Refresh Rate: 75 Hz
    Flags 1.x: 0xe6 (MCCS)
  Detailed Timing Descriptors:
    DTD  7:  1920x1080   75.001716 Hz  16:9     84.077 kHz    174.880000 MHz
                  Hfront   48 Hsync  32 Hback   80 Hpol P
                  Vfront    3 Vsync   5 Vback   33 Vpol P
    DTD  8:  1366x768    59.964364 Hz 683:384   47.852 kHz     85.750000 MHz
                  Hfront   70 Hsync 143 Hback  213 Hpol P
                  Vfront    3 Vsync   3 Vback   24 Vpol P
    DTD  9:  1600x900    60.000242 Hz  16:9     56.460 kHz     99.370000 MHz
                  Hfront   48 Hsync  32 Hback   80 Hpol P
                  Vfront    3 Vsync   5 Vback   33 Vpol P
    DTD 10:   800x600    56.250000 Hz   4:3     35.156 kHz     36.000000 MHz
                  Hfront   24 Hsync  72 Hback  128 Hpol P
                  Vfront    1 Vsync   2 Vback   22 Vpol P
    DTD 11:   800x600    71.993991 Hz   4:3     46.148 kHz     49.840000 MHz
                  Hfront   48 Hsync  32 Hback  200 Hpol P
                  Vfront    3 Vsync   5 Vback   33 Vpol P
Checksum: 0x3c

----------------

Warnings:

Block 0, Base EDID:
  Vendor & Product Identification: The serial number is one of the known dummy values, it should probably be set to 0.
  Display Product Serial Number: ...
Block 1, CTA-861 Extension Block:
  Display Product Serial Number is set, so the Serial Number in the Base EDID should be 0.
EDID:
  CTA-861: Multiple native progressive timings are defined.

Failures:

Block 0, Base EDID:
  Basic Display Parameters & Features: Digital Video Interface Standard set to reserved value 0x34.
  Basic Display Parameters & Features: The chromaticities match sRGB, but sRGB is not signaled.
  Basic Display Parameters & Features: EDID 1.3 requires that the first detailed timing is the preferred timing.
Block 1, CTA-861 Extension Block:
  Detailed Timing Descriptor #2: Mismatch of image size vs display size: image size is not set, but display size is.
  Detailed Timing Descriptor #3: Mismatch of image size vs display size: image size is not set, but display size is.
  Detailed Timing Descriptor #4: Mismatch of image size vs display size: image size is not set, but display size is.
  Detailed Timing Descriptor #5: Mismatch of image size vs display size: image size is not set, but display size is.
  Detailed Timing Descriptor #6: Mismatch of image size vs display size: image size is not set, but display size is.
  Missing VCDB, needed for Set Selectable RGB Quantization to avoid interop issues.
Block 2, Base EDID:
  Unknown Extension Block.
Block 3, CTA-861 Extension Block:
  Video Data Block: Duplicate VIC 16.
  Video Data Block: Duplicate VIC 31.
  Video Data Block: Duplicate VIC 4.
  Video Data Block: Duplicate VIC 19.
  Video Data Block: Duplicate VIC 3.
  Video Data Block: Duplicate VIC 1.
  Video Data Block: Duplicate VIC 5.
  Speaker Allocation Data Block: Only one instance of this Data Block is allowed.
  Detailed Timing Descriptor #7: Mismatch of image size vs display size: image size is not set, but display size is.
  Detailed Timing Descriptor #8: Mismatch of image size vs display size: image size is not set, but display size is.
  Detailed Timing Descriptor #9: Mismatch of image size vs display size: image size is not set, but display size is.
  Detailed Timing Descriptor #10: Mismatch of image size vs display size: image size is not set, but display size is.
  Detailed Timing Descriptor #11: Mismatch of image size vs display size: image size is not set, but display size is.
EDID:
  Base EDID: EDID specified 1 extension block(s), but found 3 extension block(s).
  Base EDID: EDID 1.3 requires a Block Map Extension in Block 1 if there are more than 2 blocks in the EDID.

EDID conformity: FAIL
