edid-decode (hex):

00 ff ff ff ff ff ff 00 50 6c 00 00 01 01 01 01
18 17 01 03 80 00 00 78 0a da ff a3 58 4a a2 29
17 49 4b a1 08 00 81 80 d1 c0 01 01 01 01 01 01
01 01 01 01 01 01 66 21 50 b0 51 00 1b 30 40 70
36 00 44 40 21 00 00 18 02 3a 00 72 51 be 1e 50
6e 28 55 00 ba a8 42 00 00 1e 00 00 00 fc 00 54
43 4c 20 4d 54 33 36 4b 0a 20 20 20 00 00 00 fd
00 16 48 0f 5a 14 00 0a 20 20 20 20 20 20 01 37

02 03 2c 72 51 1f 90 14 05 03 13 04 12 03 11 02
21 22 15 06 01 20 23 09 07 01 71 03 0c 00 20 00
b8 3c 2f c0 64 01 02 03 01 41 01 00 02 3a 00 72
51 be 1e 50 6e 28 55 00 ba a8 42 00 00 9e 02 3a
00 bc 52 be 1e 50 b8 28 55 40 ba a8 42 00 00 9e
02 3a 80 3e 73 9d 2d 80 7e 2c 45 80 ba a8 42 00
00 1e 01 1d 00 72 51 d0 1e 20 6e 28 55 00 c4 8e
21 00 00 1e 00 00 00 00 00 00 00 00 00 00 00 47

----------------

Block 0, Base EDID:
  EDID Structure Version & Revision: 1.3
  Vendor & Product Identification:
    Manufacturer: TCL
    Model: 0
    Serial Number: ...
    Made in: week 24 of 2013
  Basic Display Parameters & Features:
    Digital display
    Image size is variable
    Gamma: 2.20
    RGB color display
    First detailed timing is the preferred timing
  Color Characteristics:
    Red  : 0.6396, 0.3447
    Green: 0.2910, 0.6347
    Blue : 0.1630, 0.0927
    White: 0.2880, 0.2958
  Established Timings I & II:
    IBM     :   720x400    70.081663 Hz   9:5     31.467 kHz     28.320000 MHz
    DMT 0x04:   640x480    59.940476 Hz   4:3     31.469 kHz     25.175000 MHz
    DMT 0x09:   800x600    60.316541 Hz   4:3     37.879 kHz     40.000000 MHz
    DMT 0x10:  1024x768    60.003840 Hz   4:3     48.363 kHz     65.000000 MHz
  Standard Timings:
    DMT 0x23:  1280x1024   60.019740 Hz   5:4     63.981 kHz    108.000000 MHz
    DMT 0x52:  1920x1080   60.000000 Hz  16:9     67.500 kHz    148.500000 MHz
  Detailed Timing Descriptors:
    DTD 1:  1360x768    60.015162 Hz  85:48    47.712 kHz     85.500000 MHz (580 mm x 320 mm)
                 Hfront   64 Hsync 112 Hback  256 Hpol N
                 Vfront    3 Vsync   6 Vback   18 Vpol N
    DTD 2:  1280x1470   60.000000 Hz 128:147   90.000 kHz    148.500000 MHz (1210 mm x 680 mm)
                 Hfront  110 Hsync  40 Hback  220 Hpol P
                 Vfront    5 Vsync   5 Vback   20 Vpol P
    Display Product Name: 'TCL MT36K'
    Display Range Limits:
      Monitor ranges (GTF): 22-72 Hz V, 15-90 kHz H, max dotclock 200 MHz
  Extension blocks: 1
Checksum: 0x37

----------------

Block 1, CTA-861 Extension Block:
  Revision: 3
  Basic audio support
  Supports YCbCr 4:4:4
  Supports YCbCr 4:2:2
  Native detailed modes: 2
  Video Data Block:
    VIC  31:  1920x1080   50.000000 Hz  16:9     56.250 kHz    148.500000 MHz
    VIC  16:  1920x1080   60.000000 Hz  16:9     67.500 kHz    148.500000 MHz (native)
    VIC  20:  1920x1080i  50.000000 Hz  16:9     28.125 kHz     74.250000 MHz
    VIC   5:  1920x1080i  60.000000 Hz  16:9     33.750 kHz     74.250000 MHz
    VIC   3:   720x480    59.940060 Hz  16:9     31.469 kHz     27.000000 MHz
    VIC  19:  1280x720    50.000000 Hz  16:9     37.500 kHz     74.250000 MHz
    VIC   4:  1280x720    60.000000 Hz  16:9     45.000 kHz     74.250000 MHz
    VIC  18:   720x576    50.000000 Hz  16:9     31.250 kHz     27.000000 MHz
    VIC   3:   720x480    59.940060 Hz  16:9     31.469 kHz     27.000000 MHz
    VIC  17:   720x576    50.000000 Hz   4:3     31.250 kHz     27.000000 MHz
    VIC   2:   720x480    59.940060 Hz   4:3     31.469 kHz     27.000000 MHz
    VIC  33:  1920x1080   25.000000 Hz  16:9     28.125 kHz     74.250000 MHz
    VIC  34:  1920x1080   30.000000 Hz  16:9     33.750 kHz     74.250000 MHz
    VIC  21:  1440x576i   50.000000 Hz   4:3     15.625 kHz     27.000000 MHz
    VIC   6:  1440x480i   59.940060 Hz   4:3     15.734 kHz     27.000000 MHz
    VIC   1:   640x480    59.940476 Hz   4:3     31.469 kHz     25.175000 MHz
    VIC  32:  1920x1080   24.000000 Hz  16:9     27.000 kHz     74.250000 MHz
  Audio Data Block:
    Linear PCM:
      Max channels: 2
      Supported sample rates (kHz): 48 44.1 32
      Supported sample sizes (bits): 16
  Vendor-Specific Data Block (HDMI), OUI 00-0C-03:
    Source physical address: 2.0.0.0
    Supports_AI
    DC_36bit
    DC_30bit
    DC_Y444
    Maximum TMDS clock: 300 MHz
    Supported Content Types:
      Graphics
      Photo
      Cinema
      Game
    Extended HDMI video details:
      3D present
      3D-capable-VIC mask present
      HDMI VICs:
        HDMI VIC 1:  3840x2160   30.000000 Hz  16:9     67.500 kHz    297.000000 MHz
        HDMI VIC 2:  3840x2160   25.000000 Hz  16:9     56.250 kHz    297.000000 MHz
        HDMI VIC 3:  3840x2160   24.000000 Hz  16:9     54.000 kHz    297.000000 MHz
      3D: Side-by-side (half, horizontal)
      3D: Top-and-bottom
      3D: Frame-packing
      3D VIC indices that support these capabilities:
        VIC   3:   720x480    59.940060 Hz  16:9     31.469 kHz     27.000000 MHz
  Detailed Timing Descriptors:
    DTD 3:  1280x2940i  59.980007 Hz  64:147   90.000 kHz    148.500000 MHz (1210 mm x 680 mm)
                 Hfront  110 Hsync  40 Hback  220 Hpol P
                 Vfront    5 Vsync   5 Vback   20 Vpol P Vfront +0.5 Odd Field
                 Vfront    5 Vsync   5 Vback   20 Vpol P Vback  +0.5 Even Field
    DTD 4:  1280x2940i  49.983339 Hz  64:147   75.000 kHz    148.500000 MHz (1210 mm x 680 mm)
                 Hfront  440 Hsync  40 Hback  220 Hpol P
                 Vfront    5 Vsync   5 Vback   20 Vpol P Vfront +0.5 Odd Field
                 Vfront    5 Vsync   5 Vback   20 Vpol P Vback  +0.5 Even Field
    DTD 5:  1920x2205   24.000000 Hz 128:147   54.000 kHz    148.500000 MHz (1210 mm x 680 mm)
                 Hfront  638 Hsync  44 Hback  148 Hpol P
                 Vfront    4 Vsync   5 Vback   36 Vpol P
    DTD 6:  1280x720    60.000000 Hz  16:9     45.000 kHz     74.250000 MHz (708 mm x 398 mm)
                 Hfront  110 Hsync  40 Hback  220 Hpol P
                 Vfront    5 Vsync   5 Vback   20 Vpol P
Checksum: 0x47  Unused space in Extension Block: 11 bytes

----------------

Warnings:

Block 0, Base EDID:
  Vendor & Product Identification: The serial number is one of the known dummy values, it should probably be set to 0.
  Detailed Timing Descriptor #1: DTD is similar but not identical to DMT 0x27.
  Detailed Timing Descriptor #2: Image size is 1210x680 mm, but based on the picture AR it should be 1210x1389 mm.
Block 1, CTA-861 Extension Block:
  IT Video Formats are overscanned by default, but normally this should be underscanned.
  Video Data Block: VIC 31 and the first DTD are not identical. Is this intended?
  Detailed Timing Descriptor #3: Image size is 1210x680 mm, but based on the picture AR it should be 1210x2779 mm.
  Detailed Timing Descriptor #4: Image size is 1210x680 mm, but based on the picture AR it should be 1210x2779 mm.
  Detailed Timing Descriptor #5: Image size is 1210x680 mm, but based on the picture AR it should be 1210x1389 mm.
  Add a Colorimetry Data Block with the sRGB colorimetry bit set to avoid interop issues.
EDID:
  Base EDID: Some timings are out of range of the Monitor Ranges:
    Maximum Clock: 297.000 MHz (Monitor: 200.000 MHz)

Failures:

Block 1, CTA-861 Extension Block:
  Video Data Block: Duplicate VIC 3.
  Vendor-Specific Data Block (HDMI), OUI 00-0C-03: HDMI VIC Codes must have their CTA-861 VIC equivalents in the VSB.
  Missing VCDB, needed for Set Selectable RGB Quantization to avoid interop issues.
EDID:
  Base EDID: The DTD max image size is 1210x680mm, but the display size is not specified anywhere.
  CTA-861: Native progressive timings are a mix of several resolutions.

EDID conformity: FAIL
