edid-decode (hex):

00 ff ff ff ff ff ff 00 22 64 68 15 00 00 00 00
1e 20 01 04 a5 22 13 78 02 fc 11 95 57 5f 90 28
1a 50 54 00 00 00 01 01 01 01 01 01 01 01 01 01
01 01 01 01 01 01 4c 36 80 a0 70 38 20 40 2e 1e
24 00 58 c2 10 00 00 18 00 00 00 10 00 00 00 00
00 00 00 00 00 00 00 00 00 00 00 00 00 fe 00 48
61 6e 6e 53 74 61 72 0a 20 20 20 20 00 00 00 fe
00 48 43 57 69 6e 2d 48 30 38 41 2d 56 31 00 f2

00 ff ff ff ff ff ff 00 22 64 68 15 00 00 00 00
1e 20 01 04 a5 22 13 78 02 fc 11 95 57 5f 90 28
1a 50 54 00 00 00 01 01 01 01 01 01 01 01 01 01
01 01 01 01 01 01 4c 36 80 a0 70 38 20 40 2e 1e
24 00 58 c2 10 00 00 18 00 00 00 10 00 00 00 00
00 00 00 00 00 00 00 00 00 00 00 00 00 fe 00 48
61 6e 6e 53 74 61 72 0a 20 20 20 20 00 00 00 fe
00 48 43 57 69 6e 2d 48 30 38 41 2d 56 31 00 f2

----------------

Block 0, Base EDID:
  EDID Structure Version & Revision: 1.4
  Vendor & Product Identification:
    Manufacturer: HSD
    Model: 5480
    Made in: week 30 of 2022
  Basic Display Parameters & Features:
    Digital display
    Bits per primary color channel: 8
    DisplayPort interface
    Maximum image size: 34 cm x 19 cm
    Gamma: 2.20
    Supported color formats: RGB 4:4:4
    First detailed timing includes the native pixel format and preferred refresh rate
  Color Characteristics:
    Red  : 0.5849, 0.3427
    Green: 0.3740, 0.5625
    Blue : 0.1562, 0.1025
    White: 0.3125, 0.3291
  Established Timings I & II: none
  Standard Timings: none
  Detailed Timing Descriptors:
    DTD 1:  1920x1080   60.096154 Hz  16:9     66.827 kHz    139.000000 MHz (344 mm x 194 mm)
                 Hfront   46 Hsync  30 Hback   84 Hpol N
                 Vfront    2 Vsync   4 Vback   26 Vpol N
    Dummy Descriptor:
    Alphanumeric Data String: 'HannStar'
    Alphanumeric Data String: 'HCWin-H08A-V1'
Checksum: 0xf2

----------------

Warnings:

Block 0, Base EDID:
  Missing Display Product Name.

Failures:

EDID:
  Extension Block 1 started with EDID header, ignoring Extension Blocks >= 1.

EDID conformity: FAIL
