edid-decode (hex):

00 ff ff ff ff ff ff 00 52 d4 5e 00 e1 02 00 00
33 0e 01 03 80 26 1e 78 ea 11 45 a4 5a 4a a0 24
14 50 54 21 08 00 81 80 01 01 01 01 01 01 01 01
01 01 01 01 01 01 30 2a 00 98 51 00 2c 40 30 70
13 00 78 2d 11 00 00 1e 00 00 00 fd 00 32 4b 1e
50 0b 00 0a 20 20 20 20 20 20 00 00 00 fc 00 54
39 31 30 0a 20 20 20 20 20 20 20 20 00 00 00 fc
00 20 20 20 20 20 20 20 20 20 20 20 20 20 00 5f

----------------

Block 0, Base EDID:
  EDID Structure Version & Revision: 1.3
  Vendor & Product Identification:
    Manufacturer: TVT
    Model: 94
    Serial Number: ...
    Made in: week 51 of 2004
  Basic Display Parameters & Features:
    Digital display
    Maximum image size: 38 cm x 30 cm
    Gamma: 2.20
    DPMS levels: Standby Suspend Off
    RGB color display
    First detailed timing is the preferred timing
  Color Characteristics:
    Red  : 0.6406, 0.3525
    Green: 0.2890, 0.6259
    Blue : 0.1416, 0.0781
    White: 0.3134, 0.3291
  Established Timings I & II:
    DMT 0x04:   640x480    59.940476 Hz   4:3     31.469 kHz     25.175000 MHz
    DMT 0x09:   800x600    60.316541 Hz   4:3     37.879 kHz     40.000000 MHz
    DMT 0x10:  1024x768    60.003840 Hz   4:3     48.363 kHz     65.000000 MHz
  Standard Timings:
    DMT 0x23:  1280x1024   60.019740 Hz   5:4     63.981 kHz    108.000000 MHz
  Detailed Timing Descriptors:
    DTD 1:  1280x1024   59.907343 Hz   5:4     63.981 kHz    108.000000 MHz (376 mm x 301 mm)
                 Hfront   48 Hsync 112 Hback  248 Hpol P
                 Vfront    1 Vsync   3 Vback   40 Vpol P
    Display Range Limits:
      Monitor ranges (GTF): 50-75 Hz V, 30-80 kHz H, max dotclock 110 MHz
    Display Product Name: 'T910'
    Display Product Name: '             '
Checksum: 0x5f

----------------

Failures:

Block 0, Base EDID:
  Display Product Name: No newline, but one or more trailing spaces.

EDID conformity: FAIL
