edid-decode (hex):

00 ff ff ff ff ff ff 00 20 b2 30 00 01 00 00 00
01 1d 01 03 80 73 41 78 0a cf 74 a3 57 4c b0 23
09 48 4c 21 08 00 81 80 45 40 61 40 95 00 01 01
01 01 01 01 01 01 04 74 00 30 f2 70 5a 80 28 58
8a 40 c4 8e 21 00 00 1e 66 21 50 b0 51 00 1b 30
40 70 36 00 c4 8e 21 00 00 1e 00 00 00 fc 00 4c
45 44 20 20 20 54 56 0a 20 20 20 20 00 00 00 fd
00 32 4b 1e 50 17 00 0a 20 20 20 20 20 20 01 bd

02 03 37 f2 4d 01 03 04 05 07 90 12 13 14 16 9f
20 22 29 09 7f 07 15 07 50 57 06 00 83 01 00 00
e2 00 ff 6d 03 0c 00 30 00 b8 44 20 00 60 01 02
03 8c 0a d0 8a 20 e0 2d 10 10 3e 96 00 c4 8e 21
00 00 18 8c 0a d0 90 20 40 31 20 0c 40 55 00 c4
8e 21 00 00 18 01 1d 00 bc 52 d0 1e 20 b8 28 55
40 c4 8e 21 00 00 1e 01 1d 80 d0 72 1c 16 20 10
2c 25 80 c4 8e 21 00 00 9e 00 00 00 00 00 00 ca

00 ff ff ff ff ff ff 00 20 b2 30 00 01 00 00 00
01 1d 01 03 80 73 41 78 0a cf 74 a3 57 4c b0 23
09 48 4c 21 08 00 81 80 45 40 61 40 95 00 01 01
01 01 01 01 01 01 04 74 00 30 f2 70 5a 80 28 58
8a 40 c4 8e 21 00 00 1e 66 21 50 b0 51 00 1b 30
40 70 36 00 c4 8e 21 00 00 1e 00 00 00 fc 00 4c
45 44 20 20 20 54 56 0a 20 20 20 20 00 00 00 fd
00 32 4b 1e 50 17 00 0a 20 20 20 20 20 20 01 bd

02 03 37 f2 4d 01 03 04 05 07 90 12 13 14 16 9f
20 22 29 09 7f 07 15 07 50 57 06 00 83 01 00 00
e2 00 ff 6d 03 0c 00 30 00 b8 44 20 00 60 01 02
03 8c 0a d0 8a 20 e0 2d 10 10 3e 96 00 c4 8e 21
00 00 18 8c 0a d0 90 20 40 31 20 0c 40 55 00 c4
8e 21 00 00 18 01 1d 00 bc 52 d0 1e 20 b8 28 55
40 c4 8e 21 00 00 1e 01 1d 80 d0 72 1c 16 20 10
2c 25 80 c4 8e 21 00 00 9e 00 00 00 00 00 00 ca

----------------

Block 0, Base EDID:
  EDID Structure Version & Revision: 1.3
  Vendor & Product Identification:
    Manufacturer: HER
    Model: 48
    Serial Number: ...
    Made in: week 1 of 2019
  Basic Display Parameters & Features:
    Digital display
    Maximum image size: 115 cm x 65 cm
    Gamma: 2.20
    RGB color display
    First detailed timing is the preferred timing
  Color Characteristics:
    Red  : 0.6396, 0.3398
    Green: 0.2998, 0.6904
    Blue : 0.1376, 0.0380
    White: 0.2822, 0.2968
  Established Timings I & II:
    DMT 0x04:   640x480    59.940476 Hz   4:3     31.469 kHz     25.175000 MHz
    DMT 0x09:   800x600    60.316541 Hz   4:3     37.879 kHz     40.000000 MHz
    DMT 0x10:  1024x768    60.003840 Hz   4:3     48.363 kHz     65.000000 MHz
  Standard Timings:
    DMT 0x23:  1280x1024   60.019740 Hz   5:4     63.981 kHz    108.000000 MHz
    DMT 0x09:   800x600    60.316541 Hz   4:3     37.879 kHz     40.000000 MHz
    DMT 0x10:  1024x768    60.003840 Hz   4:3     48.363 kHz     65.000000 MHz
    DMT 0x2f:  1440x900    59.887445 Hz  16:10    55.935 kHz    106.500000 MHz
  Detailed Timing Descriptors:
    DTD 1:  3840x2160   30.000000 Hz  16:9     67.500 kHz    297.000000 MHz (708 mm x 398 mm)
                 Hfront  296 Hsync  88 Hback  176 Hpol P
                 Vfront    8 Vsync  10 Vback   72 Vpol P
    DTD 2:  1360x768    60.015162 Hz  85:48    47.712 kHz     85.500000 MHz (708 mm x 398 mm)
                 Hfront   64 Hsync 112 Hback  256 Hpol P
                 Vfront    3 Vsync   6 Vback   18 Vpol P
    Display Product Name: 'LED   TV'
    Display Range Limits:
      Monitor ranges (GTF): 50-75 Hz V, 30-80 kHz H, max dotclock 230 MHz
  Extension blocks: 1
Checksum: 0xbd

----------------

Block 1, CTA-861 Extension Block:
  Revision: 3
  Underscans IT Video Formats by default
  Basic audio support
  Supports YCbCr 4:4:4
  Supports YCbCr 4:2:2
  Native DTDs: 2
  Video Data Block:
    VIC   1:   640x480    59.940476 Hz   4:3     31.469 kHz     25.175000 MHz
    VIC   3:   720x480    59.940060 Hz  16:9     31.469 kHz     27.000000 MHz
    VIC   4:  1280x720    60.000000 Hz  16:9     45.000 kHz     74.250000 MHz
    VIC   5:  1920x1080i  60.000000 Hz  16:9     33.750 kHz     74.250000 MHz
    VIC   7:  1440x480i   59.940060 Hz  16:9     15.734 kHz     27.000000 MHz
    VIC  16:  1920x1080   60.000000 Hz  16:9     67.500 kHz    148.500000 MHz (native)
    VIC  18:   720x576    50.000000 Hz  16:9     31.250 kHz     27.000000 MHz
    VIC  19:  1280x720    50.000000 Hz  16:9     37.500 kHz     74.250000 MHz
    VIC  20:  1920x1080i  50.000000 Hz  16:9     28.125 kHz     74.250000 MHz
    VIC  22:  1440x576i   50.000000 Hz  16:9     15.625 kHz     27.000000 MHz
    VIC  31:  1920x1080   50.000000 Hz  16:9     56.250 kHz    148.500000 MHz (native)
    VIC  32:  1920x1080   24.000000 Hz  16:9     27.000 kHz     74.250000 MHz
    VIC  34:  1920x1080   30.000000 Hz  16:9     33.750 kHz     74.250000 MHz
  Audio Data Block:
    Linear PCM:
      Max channels: 2
      Supported sample rates (kHz): 192 176.4 96 88.2 48 44.1 32
      Supported sample sizes (bits): 24 20 16
    AC-3:
      Max channels: 6
      Supported sample rates (kHz): 48 44.1 32
      Maximum bit rate: 640 kb/s
    Enhanced AC-3 (DD+):
      Max channels: 8
      Supported sample rates (kHz): 48 44.1
  Speaker Allocation Data Block:
    FL/FR - Front Left/Right
  Video Capability Data Block:
    YCbCr quantization: Selectable (via AVI YQ)
    RGB quantization: Selectable (via AVI Q)
    PT scan behavior: Supports both over- and underscan
    IT scan behavior: Supports both over- and underscan
    CE scan behavior: Supports both over- and underscan
  Vendor-Specific Data Block (HDMI), OUI 00-0C-03:
    Source physical address: 3.0.0.0
    Supports_AI
    DC_36bit
    DC_30bit
    DC_Y444
    Maximum TMDS clock: 340 MHz
    Extended HDMI video details:
      HDMI VICs:
        HDMI VIC 1:  3840x2160   30.000000 Hz  16:9     67.500 kHz    297.000000 MHz
        HDMI VIC 2:  3840x2160   25.000000 Hz  16:9     56.250 kHz    297.000000 MHz
        HDMI VIC 3:  3840x2160   24.000000 Hz  16:9     54.000 kHz    297.000000 MHz
  Speaker Allocation Data Block:
    LFE1 - Low Frequency Effects 1
    LS/RS - Left/Right Surround
    LFE2 - Low Frequency Effects 2 (Deprecated, use the RCDB)
    SiL/SiR - Side Left/Right (Deprecated, use the RCDB)
    TpSiL/TpSiR - Top Side Left/Right (Deprecated, use the RCDB)
    BtFC - Bottom Front Center (Deprecated, use the RCDB)
    TpLS/TpRS - Top Left/Right Surround (Deprecated, use the RCDB)
  Detailed Timing Descriptors:
    DTD 3:  2320x2048    1.813515 Hz 145:128   10.569 kHz     41.410000 MHz (analog composite, sync-on-green, field sequential R/L, 3468 mm x 10 mm)
                 Hfront   33 Hsync 256 Hback 1021 Hpol N Hborder 144
                 Vfront   32 Vsync   0 Vback 3684 Vpol N Vborder 32
                   2d 10 10 3e 96 00 c4 8e 21 00 00 18 8c 0a d0 90 20 40 '-..>....!....... @'
    DTD 4:  1292x4096i   5.519159 Hz 323:1024   31.263 kHz     82.410000 MHz (digital composite, field sequential R/L, 1 mm x 29 mm)
                 Hfront   33 Hsync 256 Hback  679 Hpol N Hborder 188
                 Vfront   32 Vsync   0 Vback 3584 Vborder 82 Vfront +0.5 Odd Field
                 Vfront   32 Vsync   0 Vback 3584 Vborder 82 Vback  +0.5 Even Field
                   31 20 0c 40 55 00 c4 8e 21 00 00 18 01 1d 00 bc 52 d0 '1 .@U...!.......R.'
    DTD 5:  1464x2112    5.012397 Hz  61:88    29.533 kHz     82.220000 MHz (2049 mm x 29 mm)
                 Hfront   33 Hsync 256 Hback  615 Hpol N Hborder 208
                 Vfront   48 Vsync  32 Vback 3472 Vpol P Vborder 114
    DTD 6:   528x2176    7.446617 Hz  33:136   44.352 kHz     82.140000 MHz (analog composite, sync-on-green)
                 Hfront  545 Hsync 256 Hback  523 Hpol N
                 Vfront   48 Vsync  32 Vback 3700 Vpol N
Checksum: 0xca

----------------

Warnings:

Block 0, Base EDID:
  Vendor & Product Identification: The serial number is one of the known dummy values, it should probably be set to 0.
  Detailed Timing Descriptor #1: DTD is similar but not identical to VIC 95.
Block 1, CTA-861 Extension Block:
  Video Data Block: VIC 1 and the first DTD are not identical. Is this intended?
  Video Data Block: All VICs are in ascending order, and the first (preferred) VIC <= 4, is that intended?
  Video Capability Data Block: S_PT is equal to S_IT and S_CE, so should be set to 0 instead.
  Speaker Allocation Data Block: Specifies deprecated speakers.
  Detailed Timing Descriptor #3: Dubious image size (3468x10 mm is smaller than 100x100 mm).
  Detailed Timing Descriptor #3: The use of non-zero borders in a DTD is not recommended.
  Detailed Timing Descriptor #4: Dubious image size (1x29 mm is smaller than 100x100 mm).
  Detailed Timing Descriptor #4: The use of non-zero borders in a DTD is not recommended.
  Detailed Timing Descriptor #5: Dubious image size (2049x29 mm is smaller than 100x100 mm).
  Detailed Timing Descriptor #5: The use of non-zero borders in a DTD is not recommended.
  Add a Colorimetry Data Block with the sRGB colorimetry bit set to avoid interop issues.
EDID:
  Base EDID: Some timings are out of range of the Monitor Ranges:
    Vertical Freq: 1.814 - 60.317 Hz (Monitor: 50.000 - 75.000 Hz)
    Horizontal Freq: 10.569 - 67.500 kHz (Monitor: 30.000 - 80.000 kHz)
    Maximum Clock: 297.000 MHz (Monitor: 230.000 MHz)

Failures:

Block 0, Base EDID:
  Detailed Timing Descriptor #1: Mismatch of image size 708x398 mm vs display size 1150x650 mm.
  Detailed Timing Descriptor #2: Mismatch of image size 708x398 mm vs display size 1150x650 mm.
Block 1, CTA-861 Extension Block:
  Vendor-Specific Data Block (HDMI), OUI 00-0C-03: HDMI VIC Codes must have their CTA-861 VIC equivalents in the VSB.
  Speaker Allocation Data Block: Only one instance of this Data Block is allowed.
  Offset is 55, but should be 62.
  Detailed Timing Descriptor #3: 0 values in the video timing:
    Horizontal Active/Blanking 2320/1598
    Horizontal Frontporch/Sync Width 33/256
    Vertical Active/Blanking 2048/3780
    Vertical Frontporch/Sync Width 32/0
  Detailed Timing Descriptor #3: Mismatch of image size 3468x10 mm vs display size 1150x650 mm.
  Detailed Timing Descriptor #4: 0 values in the video timing:
    Horizontal Active/Blanking 1292/1344
    Horizontal Frontporch/Sync Width 33/256
    Vertical Active/Blanking 2048/3780
    Vertical Frontporch/Sync Width 32/0
  Detailed Timing Descriptor #4: Mismatch of image size 1x29 mm vs display size 1150x650 mm.
  Detailed Timing Descriptor #5: Mismatch of image size 2049x29 mm vs display size 1150x650 mm.
  Detailed Timing Descriptor #6: Mismatch of image size vs display size: image size is not set, but display size is.
EDID:
  Extension Block 2 started with EDID header, ignoring Extension Blocks >= 2.
  Base EDID: The DTD max image size is 3468x398mm, which is larger than the display size 1150.0x650.0mm.
  CTA-861: Native progressive timings are a mix of several resolutions.

EDID conformity: FAIL
