edid-decode (hex):

00 ff ff ff ff ff ff 00 4e 84 18 00 03 00 00 00
17 11 01 03 08 34 20 78 ea ee 91 a3 54 4c 99 26
0f 50 54 a5 cf 00 81 80 61 40 45 40 d1 c0 01 01
01 01 01 01 01 01 b0 36 80 a0 70 38 1f 40 30 20
25 00 00 00 00 00 00 1a f0 0a d0 b4 20 e0 2d 10
12 6c a2 00 98 32 11 00 00 1e 00 00 00 fc 00 53
69 6c 76 65 72 43 72 65 73 74 0a 20 00 00 00 ff
00 4c 43 44 20 4d 4f 4e 0a 20 20 20 20 20 00 35

00 ff ff ff ff ff ff 00 4e 84 18 00 03 00 00 00
17 11 01 03 08 34 20 78 ea ee 91 a3 54 4c 99 26
0f 50 54 a5 cf 00 81 80 61 40 45 40 d1 c0 01 01
01 01 01 01 01 01 b0 36 80 a0 70 38 1f 40 30 20
25 00 00 00 00 00 00 1a f0 0a d0 b4 20 e0 2d 10
12 6c a2 00 98 32 11 00 00 1e 00 00 00 fc 00 53
69 6c 76 65 72 43 72 65 73 74 0a 20 00 00 00 ff
00 4c 43 44 20 4d 4f 4e 0a 20 20 20 20 20 00 35

----------------

Block 0, Base EDID:
  EDID Structure Version & Revision: 1.3
  Vendor & Product Identification:
    Manufacturer: STD
    Model: 24
    Serial Number: ...
    Made in: week 23 of 2007
  Basic Display Parameters & Features:
    Analog display
    Signal Level Standard: 0.700 : 0.300 : 1.000 V p-p
    Blank level equals black level
    Sync: Separate
    Maximum image size: 52 cm x 32 cm
    Gamma: 2.20
    DPMS levels: Standby Suspend Off
    RGB color display
    First detailed timing is the preferred timing
  Color Characteristics:
    Red  : 0.6396, 0.3300
    Green: 0.2998, 0.5996
    Blue : 0.1503, 0.0595
    White: 0.3125, 0.3291
  Established Timings I & II:
    IBM     :   720x400    70.081663 Hz   9:5     31.467 kHz     28.320000 MHz
    DMT 0x04:   640x480    59.940476 Hz   4:3     31.469 kHz     25.175000 MHz
    DMT 0x06:   640x480    75.000000 Hz   4:3     37.500 kHz     31.500000 MHz
    DMT 0x09:   800x600    60.316541 Hz   4:3     37.879 kHz     40.000000 MHz
    DMT 0x0a:   800x600    72.187572 Hz   4:3     48.077 kHz     50.000000 MHz
    DMT 0x0b:   800x600    75.000000 Hz   4:3     46.875 kHz     49.500000 MHz
    DMT 0x10:  1024x768    60.003840 Hz   4:3     48.363 kHz     65.000000 MHz
    DMT 0x11:  1024x768    70.069359 Hz   4:3     56.476 kHz     75.000000 MHz
    DMT 0x12:  1024x768    75.028582 Hz   4:3     60.023 kHz     78.750000 MHz
    DMT 0x24:  1280x1024   75.024675 Hz   5:4     79.976 kHz    135.000000 MHz
  Standard Timings:
    DMT 0x23:  1280x1024   60.019740 Hz   5:4     63.981 kHz    108.000000 MHz
    DMT 0x10:  1024x768    60.003840 Hz   4:3     48.363 kHz     65.000000 MHz
    DMT 0x09:   800x600    60.316541 Hz   4:3     37.879 kHz     40.000000 MHz
    DMT 0x52:  1920x1080   60.000000 Hz  16:9     67.500 kHz    148.500000 MHz
  Detailed Timing Descriptors:
    DTD 1:  1920x1080   60.582981 Hz  16:9     67.308 kHz    140.000000 MHz
                 Hfront   48 Hsync  32 Hback   80 Hpol P
                 Vfront    2 Vsync   5 Vback   24 Vpol N
    DTD 2:   720x480    59.259259 Hz   3:2     31.111 kHz     28.000000 MHz (408 mm x 306 mm)
                 Hfront   18 Hsync 108 Hback   54 Hpol P
                 Vfront   10 Vsync   2 Vback   33 Vpol P
    Display Product Name: 'SilverCrest'
    Display Product Serial Number: ...
Checksum: 0x35

----------------

Warnings:

Block 0, Base EDID:
  Detailed Timing Descriptor #2: Image size is 408x306 mm, but based on the picture AR it should be 408x272 mm.

Failures:

Block 0, Base EDID:
  Basic Display Parameters & Features: The chromaticities match sRGB, but sRGB is not signaled.
  Detailed Timing Descriptor #1: Mismatch of image size vs display size: image size is not set, but display size is.
  Detailed Timing Descriptor #2: Mismatch of image size 408x306 mm vs display size 520x320 mm.
  Missing Display Range Limits Descriptor.
EDID:
  Extension Block 1 started with EDID header, ignoring Extension Blocks >= 1.

EDID conformity: FAIL
