edid-decode (hex):

00 ff ff ff ff ff ff 00 09 e5 63 09 00 00 00 00
16 1e 01 04 a5 1d 12 78 03 44 10 a6 51 4b 9c 25
10 50 54 00 00 00 01 01 01 01 01 01 01 01 01 01
01 01 01 01 01 01 b5 3a 80 64 70 b0 28 40 30 20
36 00 1e b3 10 00 00 1a f8 2e 80 64 70 b0 28 40
30 20 36 00 1e b3 10 00 00 1a 00 00 00 fe 00 33
46 4e 44 59 80 4e 56 31 33 33 57 55 00 00 00 00
00 02 41 33 9e 00 11 00 00 0a 01 0a 20 20 00 d7

----------------

Block 0, Base EDID:
  EDID Structure Version & Revision: 1.4
  Vendor & Product Identification:
    Manufacturer: BOE
    Model: 2403
    Made in: week 22 of 2020
  Basic Display Parameters & Features:
    Digital display
    Bits per primary color channel: 8
    DisplayPort interface
    Maximum image size: 29 cm x 18 cm
    Gamma: 2.20
    Supported color formats: RGB 4:4:4
    First detailed timing includes the native pixel format and preferred refresh rate
    Display supports continuous frequencies
  Color Characteristics:
    Red  : 0.6494, 0.3164
    Green: 0.2939, 0.6093
    Blue : 0.1445, 0.0634
    White: 0.3125, 0.3281
  Established Timings I & II: none
  Standard Timings: none
  Detailed Timing Descriptors:
    DTD 1:  1920x1200   60.000798 Hz  16:10    74.401 kHz    150.290000 MHz (286 mm x 179 mm)
                 Hfront   48 Hsync  32 Hback   20 Hpol P
                 Vfront    3 Vsync   6 Vback   31 Vpol N
    DTD 2:  1920x1200   48.003833 Hz  16:10    59.525 kHz    120.240000 MHz (286 mm x 179 mm)
                 Hfront   48 Hsync  32 Hback   20 Hpol P
                 Vfront    3 Vsync   6 Vback   31 Vpol N
    Alphanumeric Data String: '3FNDY.NV133WU'
    Manufacturer-Specified Display Descriptor (0x00): 00 00 00 02 41 33 9e 00 11 00 00 0a 01 0a 20 20 '....A3........  '
Checksum: 0xd7

----------------

Warnings:

Block 0, Base EDID:
  Alphanumeric Data String: Non-ASCII character 0x80 at position 5, can cause problems.
  Missing Display Product Name.

Failures:

Block 0, Base EDID:
  Missing Display Range Limits Descriptor.

EDID conformity: FAIL
