edid-decode (hex):

00 ff ff ff ff ff ff 00 06 af 9a ad 00 00 00 00
29 1f 01 04 a5 22 16 78 03 a7 f5 a7 55 49 a4 26
0c 50 54 00 00 00 01 01 01 01 01 01 01 01 01 01
01 01 01 01 01 01 94 c0 80 a0 70 b0 ec 40 30 20
a5 00 58 d7 10 00 00 18 94 c0 80 a0 70 b0 bc 4a
30 20 a5 00 58 d7 10 00 00 18 00 00 00 fd 00 30
a5 ed ed 31 01 0a 20 20 20 20 20 20 00 00 00 fe
00 42 31 36 30 55 41 4e 30 31 2e 4a 20 0a 00 a2

----------------

Block 0, Base EDID:
  EDID Structure Version & Revision: 1.4
  Vendor & Product Identification:
    Manufacturer: AUO
    Model: 44442
    Made in: week 41 of 2021
  Basic Display Parameters & Features:
    Digital display
    Bits per primary color channel: 8
    DisplayPort interface
    Maximum image size: 34 cm x 22 cm
    Gamma: 2.20
    Supported color formats: RGB 4:4:4
    First detailed timing includes the native pixel format and preferred refresh rate
    Display supports continuous frequencies
  Color Characteristics:
    Red  : 0.6542, 0.3339
    Green: 0.2861, 0.6435
    Blue : 0.1513, 0.0498
    White: 0.3134, 0.3291
  Established Timings I & II: none
  Standard Timings: none
  Detailed Timing Descriptors:
    DTD 1:  1920x1200  165.055175 Hz  16:10   237.019 kHz    493.000000 MHz (344 mm x 215 mm)
                 Hfront   48 Hsync  32 Hback   80 Hpol N
                 Vfront   10 Vsync   5 Vback  221 Vpol N
    DTD 2:  1920x1200   60.035266 Hz  16:10   237.019 kHz    493.000000 MHz (344 mm x 215 mm)
                 Hfront   48 Hsync  32 Hback   80 Hpol N
                 Vfront   10 Vsync   5 Vback 2733 Vpol N
    Display Range Limits:
      Monitor ranges (Range Limits Only): 48-165 Hz V, 237-237 kHz H, max dotclock 490 MHz
    Alphanumeric Data String: 'B160UAN01.J '
Checksum: 0xa2

----------------

Warnings:

Block 0, Base EDID:
  Missing Display Product Name.
EDID:
  Base EDID: Some timings are out of range of the Monitor Ranges:
    Maximum Clock: 493.000 MHz (Monitor: 490.000 MHz)
    Could be due to a Monitor Range off-by-one rounding issue

Failures:

Block 0, Base EDID:
  Alphanumeric Data String: One or more trailing spaces before newline.

EDID conformity: FAIL
