edid-decode (hex):

00 ff ff ff ff ff ff 00 06 b3 da 32 39 e9 00 00
1c 1d 01 03 80 46 27 78 2a 14 75 a7 56 53 9b 25
10 50 54 bf ef 80 d1 c0 81 40 81 80 95 00 71 4f
81 c0 b3 00 01 01 02 3a 80 18 71 38 2d 40 58 2c
45 00 ba 89 21 00 00 1e fc 7e 80 88 70 38 12 40
18 20 35 00 ba 89 21 00 00 1e 00 00 00 fd 00 30
90 18 b4 22 00 0a 20 20 20 20 20 20 00 00 00 fc
00 41 53 55 53 20 56 41 33 32 36 0a 20 20 01 50

02 03 2a 71 4e 01 03 04 00 12 13 1f 22 21 20 3f
40 14 05 23 09 17 07 83 01 00 00 65 03 0c 00 10
00 68 1a 00 00 01 01 30 90 e6 02 3a 80 18 71 38
2d 40 58 2c 45 00 ba 89 21 00 00 1e fa 7e 80 88
70 38 12 40 18 20 35 00 ba 89 21 00 00 1e 01 1d
00 72 51 d0 1e 20 6e 28 55 00 ba 89 21 00 00 1e
86 6f 80 a0 70 38 40 40 30 20 35 00 ba 89 21 00
00 1a 00 00 00 00 00 00 00 00 00 00 00 00 00 15

00 ff ff ff ff ff ff 00 06 b3 da 32 39 e9 00 00
1c 1d 01 03 80 46 27 78 2a 14 75 a7 56 53 9b 25
10 50 54 bf ef 80 d1 c0 81 40 81 80 95 00 71 4f
81 c0 b3 00 01 01 02 3a 80 18 71 38 2d 40 58 2c
45 00 ba 89 21 00 00 1e fc 7e 80 88 70 38 12 40
18 20 35 00 ba 89 21 00 00 1e 00 00 00 fd 00 30
90 18 b4 22 00 0a 20 20 20 20 20 20 00 00 00 fc
00 41 53 55 53 20 56 41 33 32 36 0a 20 20 01 50

02 03 2a 71 4e 01 03 04 00 12 13 1f 22 21 20 3f
40 14 05 23 09 17 07 83 01 00 00 65 03 0c 00 10
00 68 1a 00 00 01 01 30 90 e6 02 3a 80 18 71 38
2d 40 58 2c 45 00 ba 89 21 00 00 1e fa 7e 80 88
70 38 12 40 18 20 35 00 ba 89 21 00 00 1e 01 1d
00 72 51 d0 1e 20 6e 28 55 00 ba 89 21 00 00 1e
86 6f 80 a0 70 38 40 40 30 20 35 00 ba 89 21 00
00 1a 00 00 00 00 00 00 00 00 00 00 00 00 00 15

----------------

Block 0, Base EDID:
  EDID Structure Version & Revision: 1.3
  Vendor & Product Identification:
    Manufacturer: AUS
    Model: 13018
    Serial Number: ...
    Made in: week 28 of 2019
  Basic Display Parameters & Features:
    Digital display
    Maximum image size: 70 cm x 39 cm
    Gamma: 2.20
    DPMS levels: Off
    RGB color display
    First detailed timing is the preferred timing
  Color Characteristics:
    Red  : 0.6523, 0.3369
    Green: 0.3251, 0.6054
    Blue : 0.1455, 0.0654
    White: 0.3134, 0.3291
  Established Timings I & II:
    IBM     :   720x400    70.081663 Hz   9:5     31.467 kHz     28.320000 MHz
    DMT 0x04:   640x480    59.940476 Hz   4:3     31.469 kHz     25.175000 MHz
    Apple   :   640x480    66.666667 Hz   4:3     35.000 kHz     30.240000 MHz
    DMT 0x05:   640x480    72.808802 Hz   4:3     37.861 kHz     31.500000 MHz
    DMT 0x06:   640x480    75.000000 Hz   4:3     37.500 kHz     31.500000 MHz
    DMT 0x08:   800x600    56.250000 Hz   4:3     35.156 kHz     36.000000 MHz
    DMT 0x09:   800x600    60.316541 Hz   4:3     37.879 kHz     40.000000 MHz
    DMT 0x0a:   800x600    72.187572 Hz   4:3     48.077 kHz     50.000000 MHz
    DMT 0x0b:   800x600    75.000000 Hz   4:3     46.875 kHz     49.500000 MHz
    Apple   :   832x624    74.551266 Hz   4:3     49.726 kHz     57.284000 MHz
    DMT 0x10:  1024x768    60.003840 Hz   4:3     48.363 kHz     65.000000 MHz
    DMT 0x11:  1024x768    70.069359 Hz   4:3     56.476 kHz     75.000000 MHz
    DMT 0x12:  1024x768    75.028582 Hz   4:3     60.023 kHz     78.750000 MHz
    DMT 0x24:  1280x1024   75.024675 Hz   5:4     79.976 kHz    135.000000 MHz
    Apple   :  1152x870    75.061550 Hz 192:145   68.681 kHz    100.000000 MHz
  Standard Timings:
    DMT 0x52:  1920x1080   60.000000 Hz  16:9     67.500 kHz    148.500000 MHz
    DMT 0x20:  1280x960    60.000000 Hz   4:3     60.000 kHz    108.000000 MHz
    DMT 0x23:  1280x1024   60.019740 Hz   5:4     63.981 kHz    108.000000 MHz
    DMT 0x2f:  1440x900    59.887445 Hz  16:10    55.935 kHz    106.500000 MHz
    DMT 0x15:  1152x864    75.000000 Hz   4:3     67.500 kHz    108.000000 MHz
    DMT 0x55:  1280x720    60.000000 Hz  16:9     45.000 kHz     74.250000 MHz
    DMT 0x3a:  1680x1050   59.954250 Hz  16:10    65.290 kHz    146.250000 MHz
  Detailed Timing Descriptors:
    DTD 1:  1920x1080   60.000000 Hz  16:9     67.500 kHz    148.500000 MHz (698 mm x 393 mm)
                 Hfront   88 Hsync  44 Hback  148 Hpol P
                 Vfront    4 Vsync   5 Vback   36 Vpol P
    DTD 2:  1920x1080  144.000765 Hz  16:9    158.113 kHz    325.080000 MHz (698 mm x 393 mm)
                 Hfront   24 Hsync  32 Hback   80 Hpol P
                 Vfront    3 Vsync   5 Vback   10 Vpol P
    Display Range Limits:
      Monitor ranges (GTF): 48-144 Hz V, 24-180 kHz H, max dotclock 340 MHz
    Display Product Name: 'ASUS VA326'
  Extension blocks: 1
Checksum: 0x50

----------------

Block 1, CTA-861 Extension Block:
  Revision: 3
  Basic audio support
  Supports YCbCr 4:4:4
  Supports YCbCr 4:2:2
  Native DTDs: 1
  Video Data Block:
    VIC   1:   640x480    59.940476 Hz   4:3     31.469 kHz     25.175000 MHz
    VIC   3:   720x480    59.940060 Hz  16:9     31.469 kHz     27.000000 MHz
    VIC   4:  1280x720    60.000000 Hz  16:9     45.000 kHz     74.250000 MHz
    VIC  18:   720x576    50.000000 Hz  16:9     31.250 kHz     27.000000 MHz
    VIC  19:  1280x720    50.000000 Hz  16:9     37.500 kHz     74.250000 MHz
    VIC  31:  1920x1080   50.000000 Hz  16:9     56.250 kHz    148.500000 MHz
    VIC  34:  1920x1080   30.000000 Hz  16:9     33.750 kHz     74.250000 MHz
    VIC  33:  1920x1080   25.000000 Hz  16:9     28.125 kHz     74.250000 MHz
    VIC  32:  1920x1080   24.000000 Hz  16:9     27.000 kHz     74.250000 MHz
    VIC  63:  1920x1080  120.000000 Hz  16:9    135.000 kHz    297.000000 MHz
    VIC  64:  1920x1080  100.000000 Hz  16:9    112.500 kHz    297.000000 MHz
    VIC  20:  1920x1080i  50.000000 Hz  16:9     28.125 kHz     74.250000 MHz
    VIC   5:  1920x1080i  60.000000 Hz  16:9     33.750 kHz     74.250000 MHz
  Audio Data Block:
    Linear PCM:
      Max channels: 2
      Supported sample rates (kHz): 96 48 44.1 32
      Supported sample sizes (bits): 24 20 16
  Speaker Allocation Data Block:
    FL/FR - Front Left/Right
  Vendor-Specific Data Block (HDMI), OUI 00-0C-03:
    Source physical address: 1.0.0.0
  Vendor-Specific Data Block (AMD), OUI 00-00-1A:
    Version: 1
    Feature Caps: 0x01
    Minimum Refresh Rate: 48 Hz
    Maximum Refresh Rate: 144 Hz
    Flags 1.x: 0xe6 (MCCS)
  Detailed Timing Descriptors:
    DTD 3:  1920x1080   60.000000 Hz  16:9     67.500 kHz    148.500000 MHz (698 mm x 393 mm)
                 Hfront   88 Hsync  44 Hback  148 Hpol P
                 Vfront    4 Vsync   5 Vback   36 Vpol P
    DTD 4:  1920x1080  143.991906 Hz  16:9    158.103 kHz    325.060000 MHz (698 mm x 393 mm)
                 Hfront   24 Hsync  32 Hback   80 Hpol P
                 Vfront    3 Vsync   5 Vback   10 Vpol P
    DTD 5:  1280x720    60.000000 Hz  16:9     45.000 kHz     74.250000 MHz (698 mm x 393 mm)
                 Hfront  110 Hsync  40 Hback  220 Hpol P
                 Vfront    5 Vsync   5 Vback   20 Vpol P
    DTD 6:  1920x1080  119.982181 Hz  16:9    137.260 kHz    285.500000 MHz (698 mm x 393 mm)
                 Hfront   48 Hsync  32 Hback   80 Hpol P
                 Vfront    3 Vsync   5 Vback   56 Vpol N
Checksum: 0x15  Unused space in Extension Block: 13 bytes

----------------

Warnings:

Block 0, Base EDID:
  Detailed Timing Descriptor #1: DTD is identical to VIC 16, which is not present in the CTA Ext Block.
Block 1, CTA-861 Extension Block:
  IT Video Formats are overscanned by default, but normally this should be underscanned.
  Video Data Block: VIC 1 and the first DTD are not identical. Is this intended?
  Detailed Timing Descriptor #3: DTD is identical to VIC 16, which is not present in the CTA Ext Block.
  Add a Colorimetry Data Block with the sRGB colorimetry bit set to avoid interop issues.
EDID:
  Base EDID: Some timings are out of range of the Monitor Ranges:
    Vertical Freq: 24.000 - 144.001 Hz (Monitor: 48.000 - 144.000 Hz)

Failures:

Block 1, CTA-861 Extension Block:
  Missing VCDB, needed for Set Selectable RGB Quantization to avoid interop issues.
EDID:
  Extension Block 2 started with EDID header, ignoring Extension Blocks >= 2.

EDID conformity: FAIL
