edid-decode (hex):

00 ff ff ff ff ff ff 00 63 18 1a 00 01 00 00 00
12 17 01 03 80 21 15 78 0a 43 d5 98 57 52 8c 27
21 50 54 af ce 00 01 01 01 01 01 01 01 01 01 01
01 01 01 01 01 01 66 21 50 b0 51 00 1b 30 40 70
36 00 00 00 00 00 00 1e 00 00 00 10 00 00 00 00
00 00 00 00 00 00 00 00 00 1e 00 00 00 fd 00 37
4d 0f 46 0f 00 0a 20 20 20 20 20 20 00 00 00 fc
00 4d 53 38 32 50 0a 20 20 20 20 20 20 20 01 68

02 03 22 71 50 90 05 04 03 07 02 06 01 1f 14 13
12 16 11 15 20 23 09 07 07 68 03 0c 00 10 00 b8
2d c0 01 1d 00 72 51 d0 1e 20 6e 28 55 00 00 00
00 00 00 1e 8c 0a d0 8a 20 e0 2d 10 10 3e 96 00
00 00 00 00 00 18 01 1d 80 d0 72 1c 16 20 10 2c
25 80 00 00 00 00 00 9e 01 1d 00 bc 52 d0 1e 20
b8 28 55 40 c4 8e 21 00 00 1e 8c 0a d0 90 20 40
31 20 0c 40 55 00 00 00 00 00 00 18 00 00 00 e0

00 ff ff ff ff ff ff 00 63 18 1a 00 01 00 00 00
12 17 01 03 80 21 15 78 0a 43 d5 98 57 52 8c 27
21 50 54 af ce 00 01 01 01 01 01 01 01 01 01 01
01 01 01 01 01 01 66 21 50 b0 51 00 1b 30 40 70
36 00 00 00 00 00 00 1e 00 00 00 10 00 00 00 00
00 00 00 00 00 00 00 00 00 1e 00 00 00 fd 00 37
4d 0f 46 0f 00 0a 20 20 20 20 20 20 00 00 00 fc
00 4d 53 38 32 50 0a 20 20 20 20 20 20 20 01 68

02 03 22 71 50 90 05 04 03 07 02 06 01 1f 14 13
12 16 11 15 20 23 09 07 07 68 03 0c 00 10 00 b8
2d c0 01 1d 00 72 51 d0 1e 20 6e 28 55 00 00 00
00 00 00 1e 8c 0a d0 8a 20 e0 2d 10 10 3e 96 00
00 00 00 00 00 18 01 1d 80 d0 72 1c 16 20 10 2c
25 80 00 00 00 00 00 9e 01 1d 00 bc 52 d0 1e 20
b8 28 55 40 c4 8e 21 00 00 1e 8c 0a d0 90 20 40
31 20 0c 40 55 00 00 00 00 00 00 18 00 00 00 e0

----------------

Block 0, Base EDID:
  EDID Structure Version & Revision: 1.3
  Vendor & Product Identification:
    Manufacturer: XXX
    Model: 26
    Serial Number: ...
    Made in: week 18 of 2013
  Basic Display Parameters & Features:
    Digital display
    Maximum image size: 33 cm x 21 cm
    Gamma: 2.20
    RGB color display
    First detailed timing is the preferred timing
  Color Characteristics:
    Red  : 0.5947, 0.3398
    Green: 0.3203, 0.5498
    Blue : 0.1552, 0.1298
    White: 0.3134, 0.3291
  Established Timings I & II:
    IBM     :   720x400    70.081663 Hz   9:5     31.467 kHz     28.320000 MHz
    DMT 0x04:   640x480    59.940476 Hz   4:3     31.469 kHz     25.175000 MHz
    DMT 0x05:   640x480    72.808802 Hz   4:3     37.861 kHz     31.500000 MHz
    DMT 0x06:   640x480    75.000000 Hz   4:3     37.500 kHz     31.500000 MHz
    DMT 0x08:   800x600    56.250000 Hz   4:3     35.156 kHz     36.000000 MHz
    DMT 0x09:   800x600    60.316541 Hz   4:3     37.879 kHz     40.000000 MHz
    DMT 0x0a:   800x600    72.187572 Hz   4:3     48.077 kHz     50.000000 MHz
    DMT 0x0b:   800x600    75.000000 Hz   4:3     46.875 kHz     49.500000 MHz
    DMT 0x10:  1024x768    60.003840 Hz   4:3     48.363 kHz     65.000000 MHz
    DMT 0x11:  1024x768    70.069359 Hz   4:3     56.476 kHz     75.000000 MHz
    DMT 0x12:  1024x768    75.028582 Hz   4:3     60.023 kHz     78.750000 MHz
  Standard Timings: none
  Detailed Timing Descriptors:
    DTD 1:  1360x768    60.015162 Hz  85:48    47.712 kHz     85.500000 MHz
                 Hfront   64 Hsync 112 Hback  256 Hpol P
                 Vfront    3 Vsync   6 Vback   18 Vpol P
    Dummy Descriptor:
    Display Range Limits:
      Monitor ranges (GTF): 55-77 Hz V, 15-70 kHz H, max dotclock 150 MHz
    Display Product Name: 'MS82P'
  Extension blocks: 1
Checksum: 0x68

----------------

Block 1, CTA-861 Extension Block:
  Revision: 3
  Basic audio support
  Supports YCbCr 4:4:4
  Supports YCbCr 4:2:2
  Native DTDs: 1
  Video Data Block:
    VIC  16:  1920x1080   60.000000 Hz  16:9     67.500 kHz    148.500000 MHz (native)
    VIC   5:  1920x1080i  60.000000 Hz  16:9     33.750 kHz     74.250000 MHz
    VIC   4:  1280x720    60.000000 Hz  16:9     45.000 kHz     74.250000 MHz
    VIC   3:   720x480    59.940060 Hz  16:9     31.469 kHz     27.000000 MHz
    VIC   7:  1440x480i   59.940060 Hz  16:9     15.734 kHz     27.000000 MHz
    VIC   2:   720x480    59.940060 Hz   4:3     31.469 kHz     27.000000 MHz
    VIC   6:  1440x480i   59.940060 Hz   4:3     15.734 kHz     27.000000 MHz
    VIC   1:   640x480    59.940476 Hz   4:3     31.469 kHz     25.175000 MHz
    VIC  31:  1920x1080   50.000000 Hz  16:9     56.250 kHz    148.500000 MHz
    VIC  20:  1920x1080i  50.000000 Hz  16:9     28.125 kHz     74.250000 MHz
    VIC  19:  1280x720    50.000000 Hz  16:9     37.500 kHz     74.250000 MHz
    VIC  18:   720x576    50.000000 Hz  16:9     31.250 kHz     27.000000 MHz
    VIC  22:  1440x576i   50.000000 Hz  16:9     15.625 kHz     27.000000 MHz
    VIC  17:   720x576    50.000000 Hz   4:3     31.250 kHz     27.000000 MHz
    VIC  21:  1440x576i   50.000000 Hz   4:3     15.625 kHz     27.000000 MHz
    VIC  32:  1920x1080   24.000000 Hz  16:9     27.000 kHz     74.250000 MHz
  Audio Data Block:
    Linear PCM:
      Max channels: 2
      Supported sample rates (kHz): 48 44.1 32
      Supported sample sizes (bits): 24 20 16
  Vendor-Specific Data Block (HDMI), OUI 00-0C-03:
    Source physical address: 1.0.0.0
    Supports_AI
    DC_36bit
    DC_30bit
    DC_Y444
    Maximum TMDS clock: 225 MHz
    Video latency: 0 ms
    Audio latency: 56 ms
    Interlaced video latency: Unknown
    Interlaced audio latency: 226 ms
  Detailed Timing Descriptors:
    DTD 2:  1280x720    60.000000 Hz  16:9     45.000 kHz     74.250000 MHz
                 Hfront  110 Hsync  40 Hback  220 Hpol P
                 Vfront    5 Vsync   5 Vback   20 Vpol P
    DTD 3:   720x480    59.940060 Hz   3:2     31.469 kHz     27.000000 MHz
                 Hfront   16 Hsync  62 Hback   60 Hpol N
                 Vfront    9 Vsync   6 Vback   30 Vpol N
    DTD 4:  1920x1080i  50.000000 Hz  16:9     28.125 kHz     74.250000 MHz
                 Hfront  528 Hsync  44 Hback  148 Hpol P
                 Vfront    2 Vsync   5 Vback   15 Vpol P Vfront +0.5 Odd Field
                 Vfront    2 Vsync   5 Vback   15 Vpol P Vback  +0.5 Even Field
    DTD 5:  1280x720    50.000000 Hz  16:9     37.500 kHz     74.250000 MHz (708 mm x 398 mm)
                 Hfront  440 Hsync  40 Hback  220 Hpol P
                 Vfront    5 Vsync   5 Vback   20 Vpol P
    DTD 6:   720x576    50.000000 Hz   5:4     31.250 kHz     27.000000 MHz
                 Hfront   12 Hsync  64 Hback   68 Hpol N
                 Vfront    5 Vsync   5 Vback   39 Vpol N
Checksum: 0xe0  Unused space in Extension Block: 3 bytes

----------------

Warnings:

Block 0, Base EDID:
  Vendor & Product Identification: The serial number is one of the known dummy values, it should probably be set to 0.
Block 1, CTA-861 Extension Block:
  IT Video Formats are overscanned by default, but normally this should be underscanned.
  Video Data Block: VIC 16 and the first DTD are not identical. Is this intended?
  Vendor-Specific Data Block (HDMI), OUI 00-0C-03: Video latency + 20 < Audio latency (0 + 20 ms < 56 ms). This is forbidden for devices without HDMI output.
  Add a Colorimetry Data Block with the sRGB colorimetry bit set to avoid interop issues.
EDID:
  Base EDID: Some timings are out of range of the Monitor Ranges:
    Vertical Freq: 24.000 - 75.029 Hz (Monitor: 55.000 - 77.000 Hz)

Failures:

Block 0, Base EDID:
  Detailed Timing Descriptor #1: Mismatch of image size vs display size: image size is not set, but display size is.
  Dummy Descriptor: Dummy block filled with garbage.
Block 1, CTA-861 Extension Block:
  Detailed Timing Descriptor #2: Mismatch of image size vs display size: image size is not set, but display size is.
  Detailed Timing Descriptor #3: Mismatch of image size vs display size: image size is not set, but display size is.
  Detailed Timing Descriptor #4: Mismatch of image size vs display size: image size is not set, but display size is.
  Detailed Timing Descriptor #5: Mismatch of image size 708x398 mm vs display size 330x210 mm.
  Detailed Timing Descriptor #6: Mismatch of image size vs display size: image size is not set, but display size is.
  Missing VCDB, needed for Set Selectable RGB Quantization to avoid interop issues.
EDID:
  Extension Block 2 started with EDID header, ignoring Extension Blocks >= 2.
  Base EDID: The DTD max image size is 708x398mm, which is larger than the display size 330.0x210.0mm.
  CTA-861: Native progressive timings are a mix of several resolutions.

EDID conformity: FAIL
