edid-decode (hex):

00 ff ff ff ff ff ff 00 1e 6d 88 3e 01 01 01 01
03 14 01 03 6a 22 13 78 ea 23 35 a4 55 4d 9b 25
12 50 54 21 08 00 31 40 45 40 61 40 01 01 01 01
01 01 01 01 01 01 66 21 50 b0 51 00 1b 30 40 70
36 00 96 e5 10 00 00 1e 00 00 00 00 00 00 00 00
00 00 00 00 00 00 00 00 00 00 00 00 00 fd 00 39
3f 1e 32 09 00 0a 20 20 20 20 20 20 00 00 00 fc
00 57 31 36 34 33 0a 20 20 20 20 20 20 20 00 62

00 ff ff ff ff ff ff 00 1e 6d 88 3e 01 01 01 01
03 14 01 03 6a 22 13 78 ea 23 35 a4 55 4d 9b 25
12 50 54 21 08 00 31 40 45 40 61 40 01 01 01 01
01 01 01 01 01 01 66 21 50 b0 51 00 1b 30 40 70
36 00 96 e5 10 00 00 1e 00 00 00 00 00 00 00 00
00 00 00 00 00 00 00 00 00 00 00 00 00 fd 00 39
3f 1e 32 09 00 0a 20 20 20 20 20 20 00 00 00 fc
00 57 31 36 34 33 0a 20 20 20 20 20 20 20 00 62

----------------

Block 0, Base EDID:
  EDID Structure Version & Revision: 1.3
  Vendor & Product Identification:
    Manufacturer: GSM
    Model: 16008
    Serial Number: ...
    Made in: week 3 of 2010
  Basic Display Parameters & Features:
    Analog display
    Signal Level Standard: 0.700 : 0.000 : 0.700 V p-p
    Blank level equals black level
    Sync: Separate SyncOnGreen
    Maximum image size: 34 cm x 19 cm
    Gamma: 2.20
    DPMS levels: Standby Suspend Off
    RGB color display
    First detailed timing is the preferred timing
  Color Characteristics:
    Red  : 0.6406, 0.3339
    Green: 0.3007, 0.6083
    Blue : 0.1445, 0.0732
    White: 0.3134, 0.3291
  Established Timings I & II:
    DMT 0x04:   640x480    59.940476 Hz   4:3     31.469 kHz     25.175000 MHz
    DMT 0x09:   800x600    60.316541 Hz   4:3     37.879 kHz     40.000000 MHz
    DMT 0x10:  1024x768    60.003840 Hz   4:3     48.363 kHz     65.000000 MHz
  Standard Timings:
    DMT 0x04:   640x480    59.940476 Hz   4:3     31.469 kHz     25.175000 MHz
    DMT 0x09:   800x600    60.316541 Hz   4:3     37.879 kHz     40.000000 MHz
    DMT 0x10:  1024x768    60.003840 Hz   4:3     48.363 kHz     65.000000 MHz
  Detailed Timing Descriptors:
    DTD 1:  1360x768    60.015162 Hz  85:48    47.712 kHz     85.500000 MHz (406 mm x 229 mm)
                 Hfront   64 Hsync 112 Hback  256 Hpol P
                 Vfront    3 Vsync   6 Vback   18 Vpol P
    Empty Descriptor
    Display Range Limits:
      Monitor ranges (GTF): 57-63 Hz V, 30-50 kHz H, max dotclock 90 MHz
    Display Product Name: 'W1643'
Checksum: 0x62

----------------

Warnings:

Block 0, Base EDID:
  Vendor & Product Identification: The serial number is one of the known dummy values, it should probably be set to 0.

Failures:

Block 0, Base EDID:
  Detailed Timing Descriptor #1: Mismatch of image size 406x229 mm vs display size 340x190 mm.
  Empty Descriptor: Use Dummy Descriptor instead of all zeroes.
EDID:
  Extension Block 1 started with EDID header, ignoring Extension Blocks >= 1.
  Base EDID: The DTD max image size is 406x229mm, which is larger than the display size 340.0x190.0mm.

EDID conformity: FAIL
