edid-decode (hex):

00 ff ff ff ff ff ff 00 2d f3 17 24 00 00 00 00
2d 1c 01 03 80 35 1d 78 2e 59 95 af 4f 42 af 26
0f 50 54 a1 08 00 e1 c0 d1 00 d1 c0 b3 00 a9 c0
95 00 81 00 81 c0 08 e8 00 30 f2 70 5a 80 b0 58
4a 00 12 22 21 00 00 1a f6 5e 00 a0 a0 a0 32 50
30 40 35 00 12 22 21 00 00 1a 00 00 00 fd 00 32
3e 0f cc 08 00 0a 20 20 20 20 20 20 00 00 00 fc
00 4b 4f 49 4f 53 20 4b 32 34 31 37 55 0a 01 f6

02 03 38 f2 4d 61 60 5a 10 05 04 03 02 1f 13 12
01 5f 23 09 7f 07 83 01 00 00 6d 03 0c 00 30 00
38 78 20 00 60 01 02 03 67 d8 5d c4 01 78 c8 00
e3 05 00 00 e2 0f 7f 00 08 e8 00 39 f2 70 5a 80
b0 58 4a 00 55 50 21 00 00 1e f5 bd 00 a0 a0 a0
32 50 30 40 35 00 56 50 21 00 00 1e 00 00 00 00
00 00 00 00 00 00 00 00 00 00 00 00 00 00 00 00
00 00 00 00 00 00 00 00 00 00 00 00 00 00 00 5d

00 ff ff ff ff ff ff 00 2d f3 17 24 00 00 00 00
2d 1c 01 03 80 35 1d 78 2e 59 95 af 4f 42 af 26
0f 50 54 a1 08 00 e1 c0 d1 00 d1 c0 b3 00 a9 c0
95 00 81 00 81 c0 08 e8 00 30 f2 70 5a 80 b0 58
4a 00 12 22 21 00 00 1a f6 5e 00 a0 a0 a0 32 50
30 40 35 00 12 22 21 00 00 1a 00 00 00 fd 00 32
3e 0f cc 08 00 0a 20 20 20 20 20 20 00 00 00 fc
00 4b 4f 49 4f 53 20 4b 32 34 31 37 55 0a 01 f6

02 03 38 f2 4d 61 60 5a 10 05 04 03 02 1f 13 12
01 5f 23 09 7f 07 83 01 00 00 6d 03 0c 00 30 00
38 78 20 00 60 01 02 03 67 d8 5d c4 01 78 c8 00
e3 05 00 00 e2 0f 7f 00 08 e8 00 39 f2 70 5a 80
b0 58 4a 00 55 50 21 00 00 1e f5 bd 00 a0 a0 a0
32 50 30 40 35 00 56 50 21 00 00 1e 00 00 00 00
00 00 00 00 00 00 00 00 00 00 00 00 00 00 00 00
00 00 00 00 00 00 00 00 00 00 00 00 00 00 00 5d

----------------

Block 0, Base EDID:
  EDID Structure Version & Revision: 1.3
  Vendor & Product Identification:
    Manufacturer: KOS
    Model: 9239
    Made in: week 45 of 2018
  Basic Display Parameters & Features:
    Digital display
    Maximum image size: 53 cm x 29 cm
    Gamma: 2.20
    DPMS levels: Off
    RGB color display
    Default (sRGB) color space is primary color space
    First detailed timing is the preferred timing
  Color Characteristics:
    Red  : 0.6845, 0.3095
    Green: 0.2597, 0.6845
    Blue : 0.1503, 0.0595
    White: 0.3134, 0.3291
  Established Timings I & II:
    IBM     :   720x400    70.081663 Hz   9:5     31.467 kHz     28.320000 MHz
    DMT 0x04:   640x480    59.940476 Hz   4:3     31.469 kHz     25.175000 MHz
    DMT 0x09:   800x600    60.316541 Hz   4:3     37.879 kHz     40.000000 MHz
    DMT 0x10:  1024x768    60.003840 Hz   4:3     48.363 kHz     65.000000 MHz
  Standard Timings:
    DMT 0x54:  2048x1152   60.000000 Hz  16:9     72.000 kHz    162.000000 MHz (RB)
    DMT 0x45:  1920x1200   59.884600 Hz  16:10    74.556 kHz    193.250000 MHz
    DMT 0x52:  1920x1080   60.000000 Hz  16:9     67.500 kHz    148.500000 MHz
    DMT 0x3a:  1680x1050   59.954250 Hz  16:10    65.290 kHz    146.250000 MHz
    DMT 0x53:  1600x900    60.000000 Hz  16:9     60.000 kHz    108.000000 MHz (RB)
    DMT 0x2f:  1440x900    59.887445 Hz  16:10    55.935 kHz    106.500000 MHz
    DMT 0x1c:  1280x800    59.810326 Hz  16:10    49.702 kHz     83.500000 MHz
    DMT 0x55:  1280x720    60.000000 Hz  16:9     45.000 kHz     74.250000 MHz
  Detailed Timing Descriptors:
    DTD 1:  3840x2160   60.000000 Hz  16:9    135.000 kHz    594.000000 MHz (530 mm x 290 mm)
                 Hfront  176 Hsync  88 Hback  296 Hpol P
                 Vfront    4 Vsync  10 Vback   76 Vpol N
    DTD 2:  2560x1440   59.983221 Hz  16:9     89.375 kHz    243.100000 MHz (530 mm x 290 mm)
                 Hfront   48 Hsync  64 Hback   48 Hpol P
                 Vfront    3 Vsync   5 Vback   42 Vpol N
    Display Range Limits:
      Monitor ranges (GTF): 50-62 Hz V, 15-204 kHz H, max dotclock 80 MHz
    Display Product Name: 'KOIOS K2417U'
  Extension blocks: 1
Checksum: 0xf6

----------------

Block 1, CTA-861 Extension Block:
  Revision: 3
  Underscans IT Video Formats by default
  Basic audio support
  Supports YCbCr 4:4:4
  Supports YCbCr 4:2:2
  Native DTDs: 2
  Video Data Block:
    VIC  97:  3840x2160   60.000000 Hz  16:9    135.000 kHz    594.000000 MHz
    VIC  96:  3840x2160   50.000000 Hz  16:9    112.500 kHz    594.000000 MHz
    VIC  90:  2560x1080   60.000000 Hz  64:27    66.000 kHz    198.000000 MHz
    VIC  16:  1920x1080   60.000000 Hz  16:9     67.500 kHz    148.500000 MHz
    VIC   5:  1920x1080i  60.000000 Hz  16:9     33.750 kHz     74.250000 MHz
    VIC   4:  1280x720    60.000000 Hz  16:9     45.000 kHz     74.250000 MHz
    VIC   3:   720x480    59.940060 Hz  16:9     31.469 kHz     27.000000 MHz
    VIC   2:   720x480    59.940060 Hz   4:3     31.469 kHz     27.000000 MHz
    VIC  31:  1920x1080   50.000000 Hz  16:9     56.250 kHz    148.500000 MHz
    VIC  19:  1280x720    50.000000 Hz  16:9     37.500 kHz     74.250000 MHz
    VIC  18:   720x576    50.000000 Hz  16:9     31.250 kHz     27.000000 MHz
    VIC   1:   640x480    59.940476 Hz   4:3     31.469 kHz     25.175000 MHz
    VIC  95:  3840x2160   30.000000 Hz  16:9     67.500 kHz    297.000000 MHz
  Audio Data Block:
    Linear PCM:
      Max channels: 2
      Supported sample rates (kHz): 192 176.4 96 88.2 48 44.1 32
      Supported sample sizes (bits): 24 20 16
  Speaker Allocation Data Block:
    FL/FR - Front Left/Right
  Vendor-Specific Data Block (HDMI), OUI 00-0C-03:
    Source physical address: 3.0.0.0
    DC_36bit
    DC_30bit
    DC_Y444
    Maximum TMDS clock: 600 MHz
    Extended HDMI video details:
      HDMI VICs:
        HDMI VIC 1:  3840x2160   30.000000 Hz  16:9     67.500 kHz    297.000000 MHz
        HDMI VIC 2:  3840x2160   25.000000 Hz  16:9     56.250 kHz    297.000000 MHz
        HDMI VIC 3:  3840x2160   24.000000 Hz  16:9     54.000 kHz    297.000000 MHz
  Vendor-Specific Data Block (HDMI Forum), OUI C4-5D-D8:
    Version: 1
    Maximum TMDS Character Rate: 600 MHz
    SCDC Present
    SCDC Read Request Capable
    Supports scrambling for <= 340 Mcsc
  Colorimetry Data Block:
  YCbCr 4:2:0 Capability Map Data Block:
    VIC  97:  3840x2160   60.000000 Hz  16:9    135.000 kHz    594.000000 MHz
    VIC  96:  3840x2160   50.000000 Hz  16:9    112.500 kHz    594.000000 MHz
    VIC  90:  2560x1080   60.000000 Hz  64:27    66.000 kHz    198.000000 MHz
    VIC  16:  1920x1080   60.000000 Hz  16:9     67.500 kHz    148.500000 MHz
    VIC   5:  1920x1080i  60.000000 Hz  16:9     33.750 kHz     74.250000 MHz
    VIC   4:  1280x720    60.000000 Hz  16:9     45.000 kHz     74.250000 MHz
    VIC   3:   720x480    59.940060 Hz  16:9     31.469 kHz     27.000000 MHz
  Unknown CTA-861 Data Block (tag 0x00, length 0):
  Detailed Timing Descriptors:
    DTD 3:  3840x2160   59.877523 Hz  16:9    134.724 kHz    594.000000 MHz (597 mm x 336 mm)
                 Hfront  176 Hsync  88 Hback  305 Hpol P
                 Vfront    4 Vsync  10 Vback   76 Vpol P
    DTD 4:  2560x1440  119.988650 Hz  16:9    178.783 kHz    486.290000 MHz (598 mm x 336 mm)
                 Hfront   48 Hsync  64 Hback   48 Hpol P
                 Vfront    3 Vsync   5 Vback   42 Vpol P
Checksum: 0x5d  Unused space in Extension Block: 35 bytes

----------------

Warnings:

Block 0, Base EDID:
  Detailed Timing Descriptor #1: DTD is similar but not identical to VIC 97.
Block 1, CTA-861 Extension Block:
  Video Data Block: VIC 97 and the first DTD are not identical. Is this intended?
  YCbCr 4:2:0 Capability Map Data Block: Some YCbCr 4:2:0 timings are invalid for HDMI 2.1 (which requires an RGB timings pixel rate >= 590 MHz).
  Unknown CTA-861 Data Block (tag 0x00, length 0).
EDID:
  Base EDID: Some timings are out of range of the Monitor Ranges:
    Vertical Freq: 24.000 - 119.989 Hz (Monitor: 50.000 - 62.000 Hz)
    Maximum Clock: 594.000 MHz (Monitor: 80.000 MHz)

Failures:

Block 0, Base EDID:
  Basic Display Parameters & Features: sRGB is signaled, but the chromaticities do not match.
Block 1, CTA-861 Extension Block:
  Vendor-Specific Data Block (HDMI), OUI 00-0C-03: HDMI VSDB Max TMDS rate is > 340.
  Vendor-Specific Data Block (HDMI), OUI 00-0C-03: HDMI VIC Codes must have their CTA-861 VIC equivalents in the VSB.
  Vendor-Specific Data Block (HDMI Forum), OUI C4-5D-D8: HDMI VIC and related CTA VIC codes are present, but the UHD VIC bit is 0.
  Detailed Timing Descriptor #3: Mismatch of image size 597x336 mm vs display size 530x290 mm.
  Detailed Timing Descriptor #4: Mismatch of image size 598x336 mm vs display size 530x290 mm.
  Missing VCDB, needed for Set Selectable RGB Quantization to avoid interop issues.
EDID:
  Extension Block 2 started with EDID header, ignoring Extension Blocks >= 2.
  Base EDID: The DTD max image size is 598x336mm, which is larger than the display size 530.0x290.0mm.
  CTA-861: Native progressive timings are a mix of several resolutions.

EDID conformity: FAIL
