edid-decode (hex):

00 ff ff ff ff ff ff 00 41 0c 02 09 f4 00 00 00
34 1d 01 03 80 3c 22 78 2a 28 95 a7 55 4e a3 26
0f 50 54 bd 4b 00 d1 c0 81 80 81 40 95 0f 95 00
b3 00 81 c0 01 01 a3 66 00 a0 f0 70 1f 80 30 20
35 00 55 50 21 00 00 1a 56 5e 00 a0 a0 a0 29 50
30 20 35 00 55 50 21 00 00 1e 00 00 00 fc 00 50
48 4c 20 32 37 32 50 37 56 0a 20 20 00 00 00 fd
00 17 50 1e 63 1e 00 0a 20 20 20 20 20 20 01 c5

02 03 2a f1 4f 01 02 03 05 06 07 10 11 12 13 14
15 16 1f 04 23 09 07 07 83 01 00 00 6d 03 0c 00
10 00 39 3c 20 00 60 01 02 03 66 21 56 aa 51 00
1e 30 46 8f 33 00 55 50 21 00 00 1e 9a 29 a0 d0
51 84 22 30 50 98 36 00 55 50 21 00 00 1c 02 3a
80 18 71 38 2d 40 58 2c 45 00 55 50 21 00 00 1e
e2 68 00 a0 a0 40 2e 60 30 20 36 00 55 50 21 00
00 1a 00 00 00 00 00 00 00 00 00 00 00 00 00 cb

00 ff ff ff ff ff ff 00 41 0c 02 09 f4 00 00 00
34 1d 01 03 80 3c 22 78 2a 28 95 a7 55 4e a3 26
0f 50 54 bd 4b 00 d1 c0 81 80 81 40 95 0f 95 00
b3 00 81 c0 01 01 a3 66 00 a0 f0 70 1f 80 30 20
35 00 55 50 21 00 00 1a 56 5e 00 a0 a0 a0 29 50
30 20 35 00 55 50 21 00 00 1e 00 00 00 fc 00 50
48 4c 20 32 37 32 50 37 56 0a 20 20 00 00 00 fd
00 17 50 1e 63 1e 00 0a 20 20 20 20 20 20 01 c5

02 03 2a f1 4f 01 02 03 05 06 07 10 11 12 13 14
15 16 1f 04 23 09 07 07 83 01 00 00 6d 03 0c 00
10 00 39 3c 20 00 60 01 02 03 66 21 56 aa 51 00
1e 30 46 8f 33 00 55 50 21 00 00 1e 9a 29 a0 d0
51 84 22 30 50 98 36 00 55 50 21 00 00 1c 02 3a
80 18 71 38 2d 40 58 2c 45 00 55 50 21 00 00 1e
e2 68 00 a0 a0 40 2e 60 30 20 36 00 55 50 21 00
00 1a 00 00 00 00 00 00 00 00 00 00 00 00 00 cb

----------------

Block 0, Base EDID:
  EDID Structure Version & Revision: 1.3
  Vendor & Product Identification:
    Manufacturer: PHL
    Model: 2306
    Serial Number: ...
    Made in: week 52 of 2019
  Basic Display Parameters & Features:
    Digital display
    Maximum image size: 60 cm x 34 cm
    Gamma: 2.20
    DPMS levels: Off
    RGB color display
    First detailed timing is the preferred timing
  Color Characteristics:
    Red  : 0.6523, 0.3339
    Green: 0.3066, 0.6367
    Blue : 0.1503, 0.0595
    White: 0.3134, 0.3291
  Established Timings I & II:
    IBM     :   720x400    70.081663 Hz   9:5     31.467 kHz     28.320000 MHz
    DMT 0x04:   640x480    59.940476 Hz   4:3     31.469 kHz     25.175000 MHz
    Apple   :   640x480    66.666667 Hz   4:3     35.000 kHz     30.240000 MHz
    DMT 0x05:   640x480    72.808802 Hz   4:3     37.861 kHz     31.500000 MHz
    DMT 0x06:   640x480    75.000000 Hz   4:3     37.500 kHz     31.500000 MHz
    DMT 0x09:   800x600    60.316541 Hz   4:3     37.879 kHz     40.000000 MHz
    DMT 0x0b:   800x600    75.000000 Hz   4:3     46.875 kHz     49.500000 MHz
    DMT 0x10:  1024x768    60.003840 Hz   4:3     48.363 kHz     65.000000 MHz
    DMT 0x12:  1024x768    75.028582 Hz   4:3     60.023 kHz     78.750000 MHz
    DMT 0x24:  1280x1024   75.024675 Hz   5:4     79.976 kHz    135.000000 MHz
  Standard Timings:
    DMT 0x52:  1920x1080   60.000000 Hz  16:9     67.500 kHz    148.500000 MHz
    DMT 0x23:  1280x1024   60.019740 Hz   5:4     63.981 kHz    108.000000 MHz
    DMT 0x20:  1280x960    60.000000 Hz   4:3     60.000 kHz    108.000000 MHz
    DMT 0x30:  1440x900    74.984427 Hz  16:10    70.635 kHz    136.750000 MHz
    DMT 0x2f:  1440x900    59.887445 Hz  16:10    55.935 kHz    106.500000 MHz
    DMT 0x3a:  1680x1050   59.954250 Hz  16:10    65.290 kHz    146.250000 MHz
    DMT 0x55:  1280x720    60.000000 Hz  16:9     45.000 kHz     74.250000 MHz
  Detailed Timing Descriptors:
    DTD 1:  3840x2160   29.980602 Hz  16:9     65.688 kHz    262.750000 MHz (597 mm x 336 mm)
                 Hfront   48 Hsync  32 Hback   80 Hpol P
                 Vfront    3 Vsync   5 Vback   23 Vpol N
    DTD 2:  2560x1440   59.950550 Hz  16:9     88.787 kHz    241.500000 MHz (597 mm x 336 mm)
                 Hfront   48 Hsync  32 Hback   80 Hpol P
                 Vfront    3 Vsync   5 Vback   33 Vpol P
    Display Product Name: 'PHL 272P7V'
    Display Range Limits:
      Monitor ranges (GTF): 23-80 Hz V, 30-99 kHz H, max dotclock 300 MHz
  Extension blocks: 1
Checksum: 0xc5

----------------

Block 1, CTA-861 Extension Block:
  Revision: 3
  Underscans IT Video Formats by default
  Basic audio support
  Supports YCbCr 4:4:4
  Supports YCbCr 4:2:2
  Native DTDs: 1
  Video Data Block:
    VIC   1:   640x480    59.940476 Hz   4:3     31.469 kHz     25.175000 MHz
    VIC   2:   720x480    59.940060 Hz   4:3     31.469 kHz     27.000000 MHz
    VIC   3:   720x480    59.940060 Hz  16:9     31.469 kHz     27.000000 MHz
    VIC   5:  1920x1080i  60.000000 Hz  16:9     33.750 kHz     74.250000 MHz
    VIC   6:  1440x480i   59.940060 Hz   4:3     15.734 kHz     27.000000 MHz
    VIC   7:  1440x480i   59.940060 Hz  16:9     15.734 kHz     27.000000 MHz
    VIC  16:  1920x1080   60.000000 Hz  16:9     67.500 kHz    148.500000 MHz
    VIC  17:   720x576    50.000000 Hz   4:3     31.250 kHz     27.000000 MHz
    VIC  18:   720x576    50.000000 Hz  16:9     31.250 kHz     27.000000 MHz
    VIC  19:  1280x720    50.000000 Hz  16:9     37.500 kHz     74.250000 MHz
    VIC  20:  1920x1080i  50.000000 Hz  16:9     28.125 kHz     74.250000 MHz
    VIC  21:  1440x576i   50.000000 Hz   4:3     15.625 kHz     27.000000 MHz
    VIC  22:  1440x576i   50.000000 Hz  16:9     15.625 kHz     27.000000 MHz
    VIC  31:  1920x1080   50.000000 Hz  16:9     56.250 kHz    148.500000 MHz
    VIC   4:  1280x720    60.000000 Hz  16:9     45.000 kHz     74.250000 MHz
  Audio Data Block:
    Linear PCM:
      Max channels: 2
      Supported sample rates (kHz): 48 44.1 32
      Supported sample sizes (bits): 24 20 16
  Speaker Allocation Data Block:
    FL/FR - Front Left/Right
  Vendor-Specific Data Block (HDMI), OUI 00-0C-03:
    Source physical address: 1.0.0.0
    DC_36bit
    DC_30bit
    DC_Y444
    DVI_Dual
    Maximum TMDS clock: 300 MHz
    Extended HDMI video details:
      HDMI VICs:
        HDMI VIC 1:  3840x2160   30.000000 Hz  16:9     67.500 kHz    297.000000 MHz
        HDMI VIC 2:  3840x2160   25.000000 Hz  16:9     56.250 kHz    297.000000 MHz
        HDMI VIC 3:  3840x2160   24.000000 Hz  16:9     54.000 kHz    297.000000 MHz
  Detailed Timing Descriptors:
    DTD 3:  1366x768    59.789541 Hz 683:384   47.712 kHz     85.500000 MHz (597 mm x 336 mm)
                 Hfront   70 Hsync 143 Hback  213 Hpol P
                 Vfront    3 Vsync   3 Vback   24 Vpol P
    DTD 4:  1440x900    59.887445 Hz  16:10    55.935 kHz    106.500000 MHz (597 mm x 336 mm)
                 Hfront   80 Hsync 152 Hback  232 Hpol N
                 Vfront    3 Vsync   6 Vback   25 Vpol P
    DTD 5:  1920x1080   60.000000 Hz  16:9     67.500 kHz    148.500000 MHz (597 mm x 336 mm)
                 Hfront   88 Hsync  44 Hback  148 Hpol P
                 Vfront    4 Vsync   5 Vback   36 Vpol P
    DTD 6:  2560x1600   59.971589 Hz  16:10    98.713 kHz    268.500000 MHz (597 mm x 336 mm)
                 Hfront   48 Hsync  32 Hback   80 Hpol P
                 Vfront    3 Vsync   6 Vback   37 Vpol N
Checksum: 0xcb  Unused space in Extension Block: 13 bytes

----------------

Warnings:

Block 1, CTA-861 Extension Block:
  Video Data Block: VIC 1 and the first DTD are not identical. Is this intended?
  Detailed Timing Descriptor #4: Image size is 597x336 mm, but based on the picture AR it should be 537x336 mm.
  Detailed Timing Descriptor #6: Image size is 597x336 mm, but based on the picture AR it should be 537x336 mm.
  Add a Colorimetry Data Block with the sRGB colorimetry bit set to avoid interop issues.
EDID:
  Base EDID: Some timings are out of range of the Monitor Ranges:
    Horizontal Freq: 15.625 - 98.713 kHz (Monitor: 30.000 - 99.000 kHz)

Failures:

Block 1, CTA-861 Extension Block:
  Vendor-Specific Data Block (HDMI), OUI 00-0C-03: HDMI VIC Codes must have their CTA-861 VIC equivalents in the VSB.
  Missing VCDB, needed for Set Selectable RGB Quantization to avoid interop issues.
EDID:
  Extension Block 2 started with EDID header, ignoring Extension Blocks >= 2.

EDID conformity: FAIL
