edid-decode (hex):

00 ff ff ff ff ff ff 00 22 0e 58 39 01 01 01 01
14 21 01 03 80 50 21 78 2a f2 05 a6 55 4b a1 27
0e 50 54 a5 4b 00 d1 c0 b3 00 a9 c0 d1 00 95 00
81 80 81 00 81 c0 4f 7d 70 aa d0 a0 29 50 30 20
3a 00 1d 4e 31 00 00 1e 00 00 00 fd 00 30 64 1e
9b 37 00 0a 20 20 20 20 20 20 00 00 00 fc 00 4f
4d 45 4e 20 33 34 63 0a 20 20 20 20 00 00 00 ff
00 43 4e 43 33 32 30 32 33 37 51 0a 20 20 01 5b

02 03 3b f1 47 10 3f 40 04 03 02 01 23 09 07 07
83 01 00 00 67 03 0c 00 10 00 38 44 67 d8 5d c4
01 78 80 00 68 1a 00 00 01 00 30 64 ed e3 05 c0
00 e6 06 05 01 69 69 24 e2 00 ea cc 9d 70 aa d0
a0 34 50 30 20 3a 00 1d 4e 31 00 00 1e ef d4 70
aa d0 a0 46 50 30 20 3a 00 1d 4e 31 00 00 1a 56
5e 00 a0 a0 a0 29 50 30 20 35 00 1d 4e 31 00 00
1a 00 00 00 00 00 00 00 00 00 00 00 00 00 00 50

00 ff ff ff ff ff ff 00 22 0e 58 39 01 01 01 01
14 21 01 03 80 50 21 78 2a f2 05 a6 55 4b a1 27
0e 50 54 a5 4b 00 d1 c0 b3 00 a9 c0 d1 00 95 00
81 80 81 00 81 c0 4f 7d 70 aa d0 a0 29 50 30 20
3a 00 1d 4e 31 00 00 1e 00 00 00 fd 00 30 64 1e
9b 37 00 0a 20 20 20 20 20 20 00 00 00 fc 00 4f
4d 45 4e 20 33 34 63 0a 20 20 20 20 00 00 00 ff
00 43 4e 43 33 32 30 32 33 37 51 0a 20 20 01 5b

02 03 3b f1 47 10 3f 40 04 03 02 01 23 09 07 07
83 01 00 00 67 03 0c 00 10 00 38 44 67 d8 5d c4
01 78 80 00 68 1a 00 00 01 00 30 64 ed e3 05 c0
00 e6 06 05 01 69 69 24 e2 00 ea cc 9d 70 aa d0
a0 34 50 30 20 3a 00 1d 4e 31 00 00 1e ef d4 70
aa d0 a0 46 50 30 20 3a 00 1d 4e 31 00 00 1a 56
5e 00 a0 a0 a0 29 50 30 20 35 00 1d 4e 31 00 00
1a 00 00 00 00 00 00 00 00 00 00 00 00 00 00 50

----------------

Block 0, Base EDID:
  EDID Structure Version & Revision: 1.3
  Vendor & Product Identification:
    Manufacturer: HPN
    Model: 14680
    Serial Number: ...
    Made in: week 20 of 2023
  Basic Display Parameters & Features:
    Digital display
    Maximum image size: 80 cm x 33 cm
    Gamma: 2.20
    DPMS levels: Off
    RGB color display
    First detailed timing is the preferred timing
  Color Characteristics:
    Red  : 0.6513, 0.3349
    Green: 0.2929, 0.6308
    Blue : 0.1523, 0.0546
    White: 0.3134, 0.3291
  Established Timings I & II:
    IBM     :   720x400    70.081663 Hz   9:5     31.467 kHz     28.320000 MHz
    DMT 0x04:   640x480    59.940476 Hz   4:3     31.469 kHz     25.175000 MHz
    DMT 0x06:   640x480    75.000000 Hz   4:3     37.500 kHz     31.500000 MHz
    DMT 0x09:   800x600    60.316541 Hz   4:3     37.879 kHz     40.000000 MHz
    DMT 0x0b:   800x600    75.000000 Hz   4:3     46.875 kHz     49.500000 MHz
    DMT 0x10:  1024x768    60.003840 Hz   4:3     48.363 kHz     65.000000 MHz
    DMT 0x12:  1024x768    75.028582 Hz   4:3     60.023 kHz     78.750000 MHz
    DMT 0x24:  1280x1024   75.024675 Hz   5:4     79.976 kHz    135.000000 MHz
  Standard Timings:
    DMT 0x52:  1920x1080   60.000000 Hz  16:9     67.500 kHz    148.500000 MHz
    DMT 0x3a:  1680x1050   59.954250 Hz  16:10    65.290 kHz    146.250000 MHz
    DMT 0x53:  1600x900    60.000000 Hz  16:9     60.000 kHz    108.000000 MHz (RB)
    DMT 0x45:  1920x1200   59.884600 Hz  16:10    74.556 kHz    193.250000 MHz
    DMT 0x2f:  1440x900    59.887445 Hz  16:10    55.935 kHz    106.500000 MHz
    DMT 0x23:  1280x1024   60.019740 Hz   5:4     63.981 kHz    108.000000 MHz
    DMT 0x1c:  1280x800    59.810326 Hz  16:10    49.702 kHz     83.500000 MHz
    DMT 0x55:  1280x720    60.000000 Hz  16:9     45.000 kHz     74.250000 MHz
  Detailed Timing Descriptors:
    DTD 1:  3440x1440   60.001010 Hz  43:18    88.861 kHz    320.790000 MHz (797 mm x 334 mm)
                 Hfront   48 Hsync  32 Hback   90 Hpol P
                 Vfront    3 Vsync  10 Vback   28 Vpol P
    Display Range Limits:
      Monitor ranges (GTF): 48-100 Hz V, 30-155 kHz H, max dotclock 550 MHz
    Display Product Name: 'OMEN 34c'
    Display Product Serial Number: ...
  Extension blocks: 1
Checksum: 0x5b

----------------

Block 1, CTA-861 Extension Block:
  Revision: 3
  Underscans IT Video Formats by default
  Basic audio support
  Supports YCbCr 4:4:4
  Supports YCbCr 4:2:2
  Native DTDs: 1
  Video Data Block:
    VIC  16:  1920x1080   60.000000 Hz  16:9     67.500 kHz    148.500000 MHz
    VIC  63:  1920x1080  120.000000 Hz  16:9    135.000 kHz    297.000000 MHz
    VIC  64:  1920x1080  100.000000 Hz  16:9    112.500 kHz    297.000000 MHz
    VIC   4:  1280x720    60.000000 Hz  16:9     45.000 kHz     74.250000 MHz
    VIC   3:   720x480    59.940060 Hz  16:9     31.469 kHz     27.000000 MHz
    VIC   2:   720x480    59.940060 Hz   4:3     31.469 kHz     27.000000 MHz
    VIC   1:   640x480    59.940476 Hz   4:3     31.469 kHz     25.175000 MHz
  Audio Data Block:
    Linear PCM:
      Max channels: 2
      Supported sample rates (kHz): 48 44.1 32
      Supported sample sizes (bits): 24 20 16
  Speaker Allocation Data Block:
    FL/FR - Front Left/Right
  Vendor-Specific Data Block (HDMI), OUI 00-0C-03:
    Source physical address: 1.0.0.0
    DC_36bit
    DC_30bit
    DC_Y444
    Maximum TMDS clock: 340 MHz
  Vendor-Specific Data Block (HDMI Forum), OUI C4-5D-D8:
    Version: 1
    Maximum TMDS Character Rate: 600 MHz
    SCDC Present
  Vendor-Specific Data Block (AMD), OUI 00-00-1A:
    Version: 1
    Flags 1: 0x00
    Minimum Refresh Rate: 48 Hz
    Maximum Refresh Rate: 100 Hz
    MCCS VCP Code: 0xed
  Colorimetry Data Block:
    BT2020YCC
    BT2020RGB
  HDR Static Metadata Data Block:
    Electro optical transfer functions:
      Traditional gamma - SDR luminance range
      SMPTE ST2084
    Supported static metadata descriptors:
      Static metadata type 1
    Desired content max luminance: 105 (486.099 cd/m^2)
    Desired content max frame-average luminance: 105 (486.099 cd/m^2)
    Desired content min luminance: 36 (0.097 cd/m^2)
  Video Capability Data Block:
    YCbCr quantization: Selectable (via AVI YQ)
    RGB quantization: Selectable (via AVI Q)
    PT scan behavior: Always Underscanned
    IT scan behavior: Always Underscanned
    CE scan behavior: Always Underscanned
  Detailed Timing Descriptors:
    DTD 2:  3440x1440   75.000186 Hz  43:18   111.900 kHz    403.960000 MHz (797 mm x 334 mm)
                 Hfront   48 Hsync  32 Hback   90 Hpol P
                 Vfront    3 Vsync  10 Vback   39 Vpol P
    DTD 3:  3440x1440  100.000000 Hz  43:18   151.000 kHz    545.110000 MHz (797 mm x 334 mm)
                 Hfront   48 Hsync  32 Hback   90 Hpol P
                 Vfront    3 Vsync  10 Vback   57 Vpol N
    DTD 4:  2560x1440   59.950550 Hz  16:9     88.787 kHz    241.500000 MHz (797 mm x 334 mm)
                 Hfront   48 Hsync  32 Hback   80 Hpol P
                 Vfront    3 Vsync   5 Vback   33 Vpol N
Checksum: 0x50  Unused space in Extension Block: 14 bytes

----------------

Warnings:

Block 0, Base EDID:
  Vendor & Product Identification: The serial number is one of the known dummy values, it should probably be set to 0.
Block 1, CTA-861 Extension Block:
  Video Data Block: VIC 16 and the first DTD are not identical. Is this intended?
  Colorimetry Data Block: Set the sRGB colorimetry bit to avoid interop issues.
  Video Capability Data Block: S_PT is equal to S_IT and S_CE, so should be set to 0 instead.
  Detailed Timing Descriptor #4: Image size is 797x334 mm, but based on the picture AR it should be 593x334 mm.
  Display Product Serial Number is set, so the Serial Number in the Base EDID should be 0.
EDID:
  Base EDID: Some timings are out of range of the Monitor Ranges:
    Vertical Freq: 59.810 - 120.000 Hz (Monitor: 48.000 - 100.000 Hz)

Failures:

EDID:
  Extension Block 2 started with EDID header, ignoring Extension Blocks >= 2.

EDID conformity: FAIL
