edid-decode (hex):

00 ff ff ff ff ff ff 00 09 e5 04 0c 00 00 00 00
14 21 01 04 b5 1e 13 78 07 e5 a5 a7 54 4c 9b 24
0e 50 54 00 00 00 01 01 01 01 01 01 01 01 01 01
01 01 01 01 01 01 ed c8 40 a0 b0 08 50 70 30 20
36 00 2e bc 10 00 00 1a 29 6b 40 a0 b0 08 50 70
30 20 36 00 2e bc 10 00 00 1a 00 00 00 fe 00 48
44 39 4e 46 80 4e 45 31 34 4e 34 31 00 00 00 00
00 03 41 39 9e 00 01 00 00 0b 41 0a 20 20 00 b6

00 ff ff ff ff ff ff 00 09 e5 04 0c 00 00 00 00
14 21 01 04 b5 1e 13 78 07 e5 a5 a7 54 4c 9b 24
0e 50 54 00 00 00 01 01 01 01 01 01 01 01 01 01
01 01 01 01 01 01 ed c8 40 a0 b0 08 50 70 30 20
36 00 2e bc 10 00 00 1a 29 6b 40 a0 b0 08 50 70
30 20 36 00 2e bc 10 00 00 1a 00 00 00 fe 00 48
44 39 4e 46 80 4e 45 31 34 4e 34 31 00 00 00 00
00 03 41 39 9e 00 01 00 00 0b 41 0a 20 20 00 b6

----------------

Block 0, Base EDID:
  EDID Structure Version & Revision: 1.4
  Vendor & Product Identification:
    Manufacturer: BOE
    Model: 3076
    Made in: week 20 of 2023
  Basic Display Parameters & Features:
    Digital display
    Bits per primary color channel: 10
    DisplayPort interface
    Maximum image size: 30 cm x 19 cm
    Gamma: 2.20
    Supported color formats: RGB 4:4:4
    Default (sRGB) color space is primary color space
    First detailed timing includes the native pixel format and preferred refresh rate
    Display supports continuous frequencies
  Color Characteristics:
    Red  : 0.6552, 0.3300
    Green: 0.2978, 0.6064
    Blue : 0.1425, 0.0566
    White: 0.3134, 0.3291
  Established Timings I & II: none
  Standard Timings: none
  Detailed Timing Descriptors:
    DTD 1:  2880x1800   90.000350 Hz  16:10   169.201 kHz    514.370000 MHz (302 mm x 188 mm)
                 Hfront   48 Hsync  32 Hback   80 Hpol P
                 Vfront    3 Vsync   6 Vback   71 Vpol N
    DTD 2:  2880x1800   48.000070 Hz  16:10    90.240 kHz    274.330000 MHz (302 mm x 188 mm)
                 Hfront   48 Hsync  32 Hback   80 Hpol P
                 Vfront    3 Vsync   6 Vback   71 Vpol N
    Alphanumeric Data String: 'HD9NF.NE14N41'
    Manufacturer-Specified Display Descriptor (0x00): 00 00 00 03 41 39 9e 00 01 00 00 0b 41 0a 20 20 '....A9......A.  '
Checksum: 0xb6

----------------

Warnings:

Block 0, Base EDID:
  Alphanumeric Data String: Non-ASCII character 0x80 at position 5, can cause problems.
  Missing Display Product Name.

Failures:

Block 0, Base EDID:
  Basic Display Parameters & Features: sRGB is signaled, but the chromaticities do not match.
  Missing Display Range Limits Descriptor.
EDID:
  Extension Block 1 started with EDID header, ignoring Extension Blocks >= 1.

EDID conformity: FAIL
