edid-decode (hex):

00 ff ff ff ff ff ff 00 30 ae c6 62 37 33 38 5a
11 21 01 03 80 30 1b 78 2e 0b 95 a9 55 54 9c 26
0f 50 54 af ef 00 d1 c0 81 80 95 00 81 8a a9 c0
a9 cf b3 00 01 01 02 3a 80 18 71 38 2d 40 58 2c
45 00 dc 0c 11 00 00 1e 00 00 00 ff 00 56 35 4c
4d 5a 38 33 37 0a 20 20 20 20 00 00 00 fd 00 30
4b 36 5a 15 00 0a 20 20 20 20 20 20 00 00 00 fc
00 53 32 32 65 2d 32 30 0a 20 20 20 20 20 01 e4

02 03 27 f1 49 01 02 03 04 04 04 13 10 1f 23 09
07 07 83 01 00 00 67 03 0c 00 10 00 00 23 68 1a
00 00 01 01 00 4b e6 01 1d 00 72 51 d0 1e 20 6e
28 55 00 dc 0c 11 00 00 1e 01 1d 00 72 51 d0 1e
20 6e 28 55 00 dc 0c 11 00 00 18 01 1d 00 72 51
d0 1e 20 6e 28 55 00 dc 0c 11 00 00 18 82 48 80
18 71 38 2d 40 58 2c 45 00 dc 0c 11 00 00 1a 00
00 00 00 00 00 00 00 00 00 00 00 00 00 00 00 0f

00 ff ff ff ff ff ff 00 30 ae c6 62 37 33 38 5a
11 21 01 03 80 30 1b 78 2e 0b 95 a9 55 54 9c 26
0f 50 54 af ef 00 d1 c0 81 80 95 00 81 8a a9 c0
a9 cf b3 00 01 01 02 3a 80 18 71 38 2d 40 58 2c
45 00 dc 0c 11 00 00 1e 00 00 00 ff 00 56 35 4c
4d 5a 38 33 37 0a 20 20 20 20 00 00 00 fd 00 30
4b 36 5a 15 00 0a 20 20 20 20 20 20 00 00 00 fc
00 53 32 32 65 2d 32 30 0a 20 20 20 20 20 01 e4

02 03 27 f1 49 01 02 03 04 04 04 13 10 1f 23 09
07 07 83 01 00 00 67 03 0c 00 10 00 00 23 68 1a
00 00 01 01 00 4b e6 01 1d 00 72 51 d0 1e 20 6e
28 55 00 dc 0c 11 00 00 1e 01 1d 00 72 51 d0 1e
20 6e 28 55 00 dc 0c 11 00 00 18 01 1d 00 72 51
d0 1e 20 6e 28 55 00 dc 0c 11 00 00 18 82 48 80
18 71 38 2d 40 58 2c 45 00 dc 0c 11 00 00 1a 00
00 00 00 00 00 00 00 00 00 00 00 00 00 00 00 0f

----------------

Block 0, Base EDID:
  EDID Structure Version & Revision: 1.3
  Vendor & Product Identification:
    Manufacturer: LEN
    Model: 25286
    Serial Number: ...
    Made in: week 17 of 2023
  Basic Display Parameters & Features:
    Digital display
    Maximum image size: 48 cm x 27 cm
    Gamma: 2.20
    DPMS levels: Off
    RGB color display
    Default (sRGB) color space is primary color space
    First detailed timing is the preferred timing
  Color Characteristics:
    Red  : 0.6601, 0.3320
    Green: 0.3300, 0.6123
    Blue : 0.1503, 0.0595
    White: 0.3134, 0.3291
  Established Timings I & II:
    IBM     :   720x400    70.081663 Hz   9:5     31.467 kHz     28.320000 MHz
    DMT 0x04:   640x480    59.940476 Hz   4:3     31.469 kHz     25.175000 MHz
    DMT 0x05:   640x480    72.808802 Hz   4:3     37.861 kHz     31.500000 MHz
    DMT 0x06:   640x480    75.000000 Hz   4:3     37.500 kHz     31.500000 MHz
    DMT 0x08:   800x600    56.250000 Hz   4:3     35.156 kHz     36.000000 MHz
    DMT 0x09:   800x600    60.316541 Hz   4:3     37.879 kHz     40.000000 MHz
    DMT 0x0a:   800x600    72.187572 Hz   4:3     48.077 kHz     50.000000 MHz
    DMT 0x0b:   800x600    75.000000 Hz   4:3     46.875 kHz     49.500000 MHz
    Apple   :   832x624    74.551266 Hz   4:3     49.726 kHz     57.284000 MHz
    DMT 0x10:  1024x768    60.003840 Hz   4:3     48.363 kHz     65.000000 MHz
    DMT 0x11:  1024x768    70.069359 Hz   4:3     56.476 kHz     75.000000 MHz
    DMT 0x12:  1024x768    75.028582 Hz   4:3     60.023 kHz     78.750000 MHz
    DMT 0x24:  1280x1024   75.024675 Hz   5:4     79.976 kHz    135.000000 MHz
  Standard Timings:
    DMT 0x52:  1920x1080   60.000000 Hz  16:9     67.500 kHz    148.500000 MHz
    DMT 0x23:  1280x1024   60.019740 Hz   5:4     63.981 kHz    108.000000 MHz
    DMT 0x2f:  1440x900    59.887445 Hz  16:10    55.935 kHz    106.500000 MHz
    GTF     :  1280x1024   69.999805 Hz   5:4     74.620 kHz    128.943000 MHz
    DMT 0x53:  1600x900    60.000000 Hz  16:9     60.000 kHz    108.000000 MHz (RB)
    GTF     :  1600x900    75.000000 Hz  16:9     70.500 kHz    152.280000 MHz
    DMT 0x3a:  1680x1050   59.954250 Hz  16:10    65.290 kHz    146.250000 MHz
  Detailed Timing Descriptors:
    DTD 1:  1920x1080   60.000000 Hz  16:9     67.500 kHz    148.500000 MHz (476 mm x 268 mm)
                 Hfront   88 Hsync  44 Hback  148 Hpol P
                 Vfront    4 Vsync   5 Vback   36 Vpol P
    Display Product Serial Number: ...
    Display Range Limits:
      Monitor ranges (GTF): 48-75 Hz V, 54-90 kHz H, max dotclock 210 MHz
    Display Product Name: 'S22e-20'
  Extension blocks: 1
Checksum: 0xe4

----------------

Block 1, CTA-861 Extension Block:
  Revision: 3
  Underscans IT Video Formats by default
  Basic audio support
  Supports YCbCr 4:4:4
  Supports YCbCr 4:2:2
  Native DTDs: 1
  Video Data Block:
    VIC   1:   640x480    59.940476 Hz   4:3     31.469 kHz     25.175000 MHz
    VIC   2:   720x480    59.940060 Hz   4:3     31.469 kHz     27.000000 MHz
    VIC   3:   720x480    59.940060 Hz  16:9     31.469 kHz     27.000000 MHz
    VIC   4:  1280x720    60.000000 Hz  16:9     45.000 kHz     74.250000 MHz
    VIC   4:  1280x720    60.000000 Hz  16:9     45.000 kHz     74.250000 MHz
    VIC   4:  1280x720    60.000000 Hz  16:9     45.000 kHz     74.250000 MHz
    VIC  19:  1280x720    50.000000 Hz  16:9     37.500 kHz     74.250000 MHz
    VIC  16:  1920x1080   60.000000 Hz  16:9     67.500 kHz    148.500000 MHz
    VIC  31:  1920x1080   50.000000 Hz  16:9     56.250 kHz    148.500000 MHz
  Audio Data Block:
    Linear PCM:
      Max channels: 2
      Supported sample rates (kHz): 48 44.1 32
      Supported sample sizes (bits): 24 20 16
  Speaker Allocation Data Block:
    FL/FR - Front Left/Right
  Vendor-Specific Data Block (HDMI), OUI 00-0C-03:
    Source physical address: 1.0.0.0
    Maximum TMDS clock: 175 MHz
  Vendor-Specific Data Block (AMD), OUI 00-00-1A:
    Version: 1
    Flags 1: 0x01
      FreeSync Supported
    Minimum Refresh Rate: 0 Hz
    Maximum Refresh Rate: 75 Hz
    MCCS VCP Code: 0xe6
  Detailed Timing Descriptors:
    DTD 2:  1280x720    60.000000 Hz  16:9     45.000 kHz     74.250000 MHz (476 mm x 268 mm)
                 Hfront  110 Hsync  40 Hback  220 Hpol P
                 Vfront    5 Vsync   5 Vback   20 Vpol P
    DTD 3:  1280x720    60.000000 Hz  16:9     45.000 kHz     74.250000 MHz (476 mm x 268 mm)
                 Hfront  110 Hsync  40 Hback  220 Hpol N
                 Vfront    5 Vsync   5 Vback   20 Vpol N
    DTD 4:  1280x720    60.000000 Hz  16:9     45.000 kHz     74.250000 MHz (476 mm x 268 mm)
                 Hfront  110 Hsync  40 Hback  220 Hpol N
                 Vfront    5 Vsync   5 Vback   20 Vpol N
    DTD 5:  1920x1080   74.997980 Hz  16:9     84.373 kHz    185.620000 MHz (476 mm x 268 mm)
                 Hfront   88 Hsync  44 Hback  148 Hpol P
                 Vfront    4 Vsync   5 Vback   36 Vpol N
Checksum: 0x0f  Unused space in Extension Block: 16 bytes

----------------

Warnings:

Block 1, CTA-861 Extension Block:
  Video Data Block: VIC 1 and the first DTD are not identical. Is this intended?
  Detailed Timing Descriptor #3: DTD is similar but not identical to VIC 4.
  Detailed Timing Descriptor #4: DTD is similar but not identical to VIC 4.
  Display Product Serial Number is set, so the Serial Number in the Base EDID should be 0.
EDID:
  Base EDID: Some timings are out of range of the Monitor Ranges:
    Horizontal Freq: 31.466 - 84.372 kHz (Monitor: 54.000 - 90.000 kHz)

Failures:

Block 0, Base EDID:
  Basic Display Parameters & Features: sRGB is signaled, but the chromaticities do not match.
Block 1, CTA-861 Extension Block:
  Video Data Block: Duplicate VIC 4.
  Missing VCDB, needed for Set Selectable RGB Quantization to avoid interop issues.
EDID:
  Extension Block 2 started with EDID header, ignoring Extension Blocks >= 2.
  CTA-861: The maximum HDMI TMDS clock is 175000 kHz, but one or more video timings go up to 185620 kHz.

EDID conformity: FAIL
