edid-decode (hex):

00 ff ff ff ff ff ff 00 36 69 a1 3d 01 01 01 01
16 1d 01 04 b5 50 21 78 9e 19 c5 ae 50 44 af 26
0e 50 54 21 08 00 71 40 81 c0 81 00 81 40 81 80
a9 00 b3 00 d1 c0 e7 7c 70 a0 d0 a0 29 50 30 58
3a 00 20 4a 31 00 00 1e 00 00 00 fd 00 30 3d 1e
87 4c 00 0a 20 20 20 20 20 20 00 00 00 fc 00 4d
53 49 20 50 53 33 34 31 57 55 0a 20 00 00 00 ff
00 30 30 30 30 30 30 30 30 30 30 30 30 30 02 9c

02 03 2c f1 54 01 02 03 04 05 10 13 14 1f 20 21
22 5d 5e 5f 60 61 7b 7d 7e 23 09 07 07 83 01 00
00 e6 06 07 01 73 73 00 e3 05 e3 01 9d 67 70 a0
d0 a0 22 50 30 20 3a 00 20 4a 31 00 00 1e 08 e8
00 30 f2 70 5a 80 b0 58 8a 00 20 4a 31 00 00 1e
30 3e 70 a0 d0 a0 22 50 30 20 3a 00 20 4a 31 00
00 1e 00 00 00 00 00 00 00 00 00 00 00 00 00 00
00 00 00 00 00 00 00 00 00 00 00 00 00 00 00 8a

70 13 3f 00 00 03 01 3c 6f 1d 01 86 ff 13 68 01
18 80 60 00 6f 08 3d 00 2f 00 08 00 dd ed 00 06
ff 13 68 01 18 80 60 00 6f 08 3d 00 1b 00 08 00
b8 8e 00 06 ff 13 68 01 18 80 60 00 6f 08 3d 00
1b 00 08 00 4d 00 00 00 00 00 00 00 00 00 00 00
00 00 00 00 00 00 00 00 00 00 00 00 00 00 00 00
00 00 00 00 00 00 00 00 00 00 00 00 00 00 00 00
00 00 00 00 00 00 00 00 00 00 00 00 00 00 00 90

00 ff ff ff ff ff ff 00 36 69 a1 3d 01 01 01 01
16 1d 01 04 b5 50 21 78 9e 19 c5 ae 50 44 af 26
0e 50 54 21 08 00 71 40 81 c0 81 00 81 40 81 80
a9 00 b3 00 d1 c0 e7 7c 70 a0 d0 a0 29 50 30 58
3a 00 20 4a 31 00 00 1e 00 00 00 fd 00 30 3d 1e
87 4c 00 0a 20 20 20 20 20 20 00 00 00 fc 00 4d
53 49 20 50 53 33 34 31 57 55 0a 20 00 00 00 ff
00 30 30 30 30 30 30 30 30 30 30 30 30 30 02 9c

02 03 2c f1 54 01 02 03 04 05 10 13 14 1f 20 21
22 5d 5e 5f 60 61 7b 7d 7e 23 09 07 07 83 01 00
00 e6 06 07 01 73 73 00 e3 05 e3 01 9d 67 70 a0
d0 a0 22 50 30 20 3a 00 20 4a 31 00 00 1e 08 e8
00 30 f2 70 5a 80 b0 58 8a 00 20 4a 31 00 00 1e
30 3e 70 a0 d0 a0 22 50 30 20 3a 00 20 4a 31 00
00 1e 00 00 00 00 00 00 00 00 00 00 00 00 00 00
00 00 00 00 00 00 00 00 00 00 00 00 00 00 00 8a

70 13 3f 00 00 03 01 3c 6f 1d 01 86 ff 13 68 01
18 80 60 00 6f 08 3d 00 2f 00 08 00 dd ed 00 06
ff 13 68 01 18 80 60 00 6f 08 3d 00 1b 00 08 00
b8 8e 00 06 ff 13 68 01 18 80 60 00 6f 08 3d 00
1b 00 08 00 4d 00 00 00 00 00 00 00 00 00 00 00
00 00 00 00 00 00 00 00 00 00 00 00 00 00 00 00
00 00 00 00 00 00 00 00 00 00 00 00 00 00 00 00
00 00 00 00 00 00 00 00 00 00 00 00 00 00 00 90

----------------

Block 0, Base EDID:
  EDID Structure Version & Revision: 1.4
  Vendor & Product Identification:
    Manufacturer: MSI
    Model: 15777
    Serial Number: ...
    Made in: week 22 of 2019
  Basic Display Parameters & Features:
    Digital display
    Bits per primary color channel: 10
    DisplayPort interface
    Maximum image size: 80 cm x 33 cm
    Gamma: 2.20
    DPMS levels: Standby
    Supported color formats: RGB 4:4:4, YCrCb 4:4:4, YCrCb 4:2:2
    Default (sRGB) color space is primary color space
    First detailed timing includes the native pixel format and preferred refresh rate
  Color Characteristics:
    Red  : 0.6796, 0.3134
    Green: 0.2675, 0.6845
    Blue : 0.1513, 0.0546
    White: 0.3134, 0.3291
  Established Timings I & II:
    DMT 0x04:   640x480    59.940476 Hz   4:3     31.469 kHz     25.175000 MHz
    DMT 0x09:   800x600    60.316541 Hz   4:3     37.879 kHz     40.000000 MHz
    DMT 0x10:  1024x768    60.003840 Hz   4:3     48.363 kHz     65.000000 MHz
  Standard Timings:
    GTF     :  1152x864    60.000000 Hz   4:3     53.700 kHz     81.624000 MHz
    DMT 0x55:  1280x720    60.000000 Hz  16:9     45.000 kHz     74.250000 MHz
    DMT 0x1c:  1280x800    59.810326 Hz  16:10    49.702 kHz     83.500000 MHz
    DMT 0x20:  1280x960    60.000000 Hz   4:3     60.000 kHz    108.000000 MHz
    DMT 0x23:  1280x1024   60.019740 Hz   5:4     63.981 kHz    108.000000 MHz
    GTF     :  1600x1000   59.999820 Hz  16:10    62.100 kHz    133.142000 MHz
    DMT 0x3a:  1680x1050   59.954250 Hz  16:10    65.290 kHz    146.250000 MHz
    DMT 0x52:  1920x1080   60.000000 Hz  16:9     67.500 kHz    148.500000 MHz
  Detailed Timing Descriptors:
    DTD 1:  3440x1440   59.972616 Hz  43:18    88.819 kHz    319.750000 MHz (800 mm x 330 mm)
                 Hfront   48 Hsync  88 Hback   24 Hpol P
                 Vfront    3 Vsync  10 Vback   28 Vpol P
    Display Range Limits:
      Monitor ranges (GTF): 48-61 Hz V, 30-135 kHz H, max dotclock 760 MHz
    Display Product Name: 'MSI PS341WU'
    Display Product Serial Number: ...
  Extension blocks: 2
Checksum: 0x9c

----------------

Block 1, CTA-861 Extension Block:
  Revision: 3
  Underscans IT Video Formats by default
  Basic audio support
  Supports YCbCr 4:4:4
  Supports YCbCr 4:2:2
  Native detailed modes: 1
  Video Data Block:
    VIC   1:   640x480    59.940476 Hz   4:3     31.469 kHz     25.175000 MHz
    VIC   2:   720x480    59.940060 Hz   4:3     31.469 kHz     27.000000 MHz
    VIC   3:   720x480    59.940060 Hz  16:9     31.469 kHz     27.000000 MHz
    VIC   4:  1280x720    60.000000 Hz  16:9     45.000 kHz     74.250000 MHz
    VIC   5:  1920x1080i  60.000000 Hz  16:9     33.750 kHz     74.250000 MHz
    VIC  16:  1920x1080   60.000000 Hz  16:9     67.500 kHz    148.500000 MHz
    VIC  19:  1280x720    50.000000 Hz  16:9     37.500 kHz     74.250000 MHz
    VIC  20:  1920x1080i  50.000000 Hz  16:9     28.125 kHz     74.250000 MHz
    VIC  31:  1920x1080   50.000000 Hz  16:9     56.250 kHz    148.500000 MHz
    VIC  32:  1920x1080   24.000000 Hz  16:9     27.000 kHz     74.250000 MHz
    VIC  33:  1920x1080   25.000000 Hz  16:9     28.125 kHz     74.250000 MHz
    VIC  34:  1920x1080   30.000000 Hz  16:9     33.750 kHz     74.250000 MHz
    VIC  93:  3840x2160   24.000000 Hz  16:9     54.000 kHz    297.000000 MHz
    VIC  94:  3840x2160   25.000000 Hz  16:9     56.250 kHz    297.000000 MHz
    VIC  95:  3840x2160   30.000000 Hz  16:9     67.500 kHz    297.000000 MHz
    VIC  96:  3840x2160   50.000000 Hz  16:9    112.500 kHz    594.000000 MHz
    VIC  97:  3840x2160   60.000000 Hz  16:9    135.000 kHz    594.000000 MHz
    VIC 123:  5120x2160   30.000000 Hz  64:27    66.000 kHz    396.000000 MHz
    VIC 125:  5120x2160   50.000000 Hz  64:27   112.500 kHz    742.500000 MHz
    VIC 126:  5120x2160   60.000000 Hz  64:27   135.000 kHz    742.500000 MHz
  Audio Data Block:
    Linear PCM:
      Max channels: 2
      Supported sample rates (kHz): 48 44.1 32
      Supported sample sizes (bits): 24 20 16
  Speaker Allocation Data Block:
    FL/FR - Front Left/Right
  HDR Static Metadata Data Block:
    Electro optical transfer functions:
      Traditional gamma - SDR luminance range
      Traditional gamma - HDR luminance range
      SMPTE ST2084
    Supported static metadata descriptors:
      Static metadata type 1
    Desired content max luminance: 115 (603.666 cd/m^2)
    Desired content max frame-average luminance: 115 (603.666 cd/m^2)
    Desired content min luminance: 0 (0.000 cd/m^2)
  Colorimetry Data Block:
    xvYCC601
    xvYCC709
    BT2020cYCC
    BT2020YCC
    BT2020RGB
    Gamut Boundary Description Metadata Profile P0
  Detailed Timing Descriptors:
    DTD 2:  3440x1440   49.986808 Hz  43:18    73.681 kHz    265.250000 MHz (800 mm x 330 mm)
                 Hfront   48 Hsync  32 Hback   80 Hpol P
                 Vfront    3 Vsync  10 Vback   21 Vpol P
    DTD 3:  3840x2160   60.000000 Hz  16:9    135.000 kHz    594.000000 MHz (800 mm x 330 mm)
                 Hfront  176 Hsync  88 Hback  296 Hpol P
                 Vfront    8 Vsync  10 Vback   72 Vpol P
    DTD 4:  3440x1440   30.001508 Hz  43:18    44.222 kHz    159.200000 MHz (800 mm x 330 mm)
                 Hfront   48 Hsync  32 Hback   80 Hpol P
                 Vfront    3 Vsync  10 Vback   21 Vpol P
Checksum: 0x8a  Unused space in Extension Block: 29 bytes

----------------

Block 2, DisplayID Extension Block:
  Version: 1.3
  Extension Count: 0
  Display Product Type: Extension Section
  Video Timing Modes Type 1 - Detailed Timings Data Block:
    DTD:  5120x2160   59.999432 Hz  64:27   133.319 kHz    730.720000 MHz (aspect 64:27, no 3D stereo, preferred)
               Hfront   25 Hsync  97 Hback  239 Hpol P
               Vfront   48 Vsync   9 Vback    5 Vpol N
    DTD:  5120x2160   50.000074 Hz  64:27   111.100 kHz    608.940000 MHz (aspect 64:27, no 3D stereo)
               Hfront   25 Hsync  97 Hback  239 Hpol P
               Vfront   28 Vsync   9 Vback   25 Vpol N
    DTD:  5120x2160   30.000537 Hz  64:27    66.661 kHz    365.370000 MHz (aspect 64:27, no 3D stereo)
               Hfront   25 Hsync  97 Hback  239 Hpol P
               Vfront   28 Vsync   9 Vback   25 Vpol N
  Checksum: 0x4d
Checksum: 0x90  Unused space in Extension Block: 58 bytes

----------------

Block 3, Unknown EDID Extension Block 0x00:
  00 ff ff ff ff ff ff 00 36 69 a1 3d 01 01 01 01 '........6i.=....'
  16 1d 01 04 b5 50 21 78 9e 19 c5 ae 50 44 af 26 '.....P!x....PD.&'
  0e 50 54 21 08 00 71 40 81 c0 81 00 81 40 81 80 '.PT!..q@.....@..'
  a9 00 b3 00 d1 c0 e7 7c 70 a0 d0 a0 29 50 30 58 '.......|p...)P0X'
  3a 00 20 4a 31 00 00 1e 00 00 00 fd 00 30 3d 1e ':. J1........0=.'
  87 4c 00 0a 20 20 20 20 20 20 00 00 00 fc 00 4d '.L..      .....M'
  53 49 20 50 53 33 34 31 57 55 0a 20 00 00 00 ff 'SI PS341WU. ....'
  00 30 30 30 30 30 30 30 30 30 30 30 30 30 02 9c '.0000000000000..'
Checksum: 0x9c

----------------

Block 4, CTA-861 Extension Block:
  Revision: 3
  Underscans IT Video Formats by default
  Basic audio support
  Supports YCbCr 4:4:4
  Supports YCbCr 4:2:2
  Native detailed modes: 1
  Video Data Block:
    VIC   1:   640x480    59.940476 Hz   4:3     31.469 kHz     25.175000 MHz
    VIC   2:   720x480    59.940060 Hz   4:3     31.469 kHz     27.000000 MHz
    VIC   3:   720x480    59.940060 Hz  16:9     31.469 kHz     27.000000 MHz
    VIC   4:  1280x720    60.000000 Hz  16:9     45.000 kHz     74.250000 MHz
    VIC   5:  1920x1080i  60.000000 Hz  16:9     33.750 kHz     74.250000 MHz
    VIC  16:  1920x1080   60.000000 Hz  16:9     67.500 kHz    148.500000 MHz
    VIC  19:  1280x720    50.000000 Hz  16:9     37.500 kHz     74.250000 MHz
    VIC  20:  1920x1080i  50.000000 Hz  16:9     28.125 kHz     74.250000 MHz
    VIC  31:  1920x1080   50.000000 Hz  16:9     56.250 kHz    148.500000 MHz
    VIC  32:  1920x1080   24.000000 Hz  16:9     27.000 kHz     74.250000 MHz
    VIC  33:  1920x1080   25.000000 Hz  16:9     28.125 kHz     74.250000 MHz
    VIC  34:  1920x1080   30.000000 Hz  16:9     33.750 kHz     74.250000 MHz
    VIC  93:  3840x2160   24.000000 Hz  16:9     54.000 kHz    297.000000 MHz
    VIC  94:  3840x2160   25.000000 Hz  16:9     56.250 kHz    297.000000 MHz
    VIC  95:  3840x2160   30.000000 Hz  16:9     67.500 kHz    297.000000 MHz
    VIC  96:  3840x2160   50.000000 Hz  16:9    112.500 kHz    594.000000 MHz
    VIC  97:  3840x2160   60.000000 Hz  16:9    135.000 kHz    594.000000 MHz
    VIC 123:  5120x2160   30.000000 Hz  64:27    66.000 kHz    396.000000 MHz
    VIC 125:  5120x2160   50.000000 Hz  64:27   112.500 kHz    742.500000 MHz
    VIC 126:  5120x2160   60.000000 Hz  64:27   135.000 kHz    742.500000 MHz
  Audio Data Block:
    Linear PCM:
      Max channels: 2
      Supported sample rates (kHz): 48 44.1 32
      Supported sample sizes (bits): 24 20 16
  Speaker Allocation Data Block:
    FL/FR - Front Left/Right
  HDR Static Metadata Data Block:
    Electro optical transfer functions:
      Traditional gamma - SDR luminance range
      Traditional gamma - HDR luminance range
      SMPTE ST2084
    Supported static metadata descriptors:
      Static metadata type 1
    Desired content max luminance: 115 (603.666 cd/m^2)
    Desired content max frame-average luminance: 115 (603.666 cd/m^2)
    Desired content min luminance: 0 (0.000 cd/m^2)
  Colorimetry Data Block:
    xvYCC601
    xvYCC709
    BT2020cYCC
    BT2020YCC
    BT2020RGB
    Gamut Boundary Description Metadata Profile P0
  Detailed Timing Descriptors:
    DTD 5:  3440x1440   49.986808 Hz  43:18    73.681 kHz    265.250000 MHz (800 mm x 330 mm)
                 Hfront   48 Hsync  32 Hback   80 Hpol P
                 Vfront    3 Vsync  10 Vback   21 Vpol P
    DTD 6:  3840x2160   60.000000 Hz  16:9    135.000 kHz    594.000000 MHz (800 mm x 330 mm)
                 Hfront  176 Hsync  88 Hback  296 Hpol P
                 Vfront    8 Vsync  10 Vback   72 Vpol P
    DTD 7:  3440x1440   30.001508 Hz  43:18    44.222 kHz    159.200000 MHz (800 mm x 330 mm)
                 Hfront   48 Hsync  32 Hback   80 Hpol P
                 Vfront    3 Vsync  10 Vback   21 Vpol P
Checksum: 0x8a  Unused space in Extension Block: 29 bytes

----------------

Block 5, DisplayID Extension Block:
  Version: 1.3
  Extension Count: 0
  Video Timing Modes Type 1 - Detailed Timings Data Block:
    DTD:  5120x2160   59.999432 Hz  64:27   133.319 kHz    730.720000 MHz (aspect 64:27, no 3D stereo, preferred)
               Hfront   25 Hsync  97 Hback  239 Hpol P
               Vfront   48 Vsync   9 Vback    5 Vpol N
    DTD:  5120x2160   50.000074 Hz  64:27   111.100 kHz    608.940000 MHz (aspect 64:27, no 3D stereo)
               Hfront   25 Hsync  97 Hback  239 Hpol P
               Vfront   28 Vsync   9 Vback   25 Vpol N
    DTD:  5120x2160   30.000537 Hz  64:27    66.661 kHz    365.370000 MHz (aspect 64:27, no 3D stereo)
               Hfront   25 Hsync  97 Hback  239 Hpol P
               Vfront   28 Vsync   9 Vback   25 Vpol N
  Checksum: 0x4d
Checksum: 0x90  Unused space in Extension Block: 58 bytes

----------------

Warnings:

Block 0, Base EDID:
  Vendor & Product Identification: The serial number is one of the known dummy values, it should probably be set to 0.
  Display Range Limits: GTF support is deprecated in EDID 1.4.
  Display Product Serial Number: ...
Block 1, CTA-861 Extension Block:
  Video Data Block: VIC 1 and the first DTD are not identical. Is this intended?
  Video Data Block: All VICs are in ascending order, and the first (preferred) VIC <= 4, is that intended?
  Detailed Timing Descriptor #3: Image size is 800x330 mm, but based on the picture AR it should be 800x450 mm.
  Display Product Serial Number is set, so the Serial Number in the Base EDID should be 0.
Block 4, CTA-861 Extension Block:
  Video Data Block: All VICs are in ascending order, and the first (preferred) VIC <= 4, is that intended?
  Detailed Timing Descriptor #6: Image size is 800x330 mm, but based on the picture AR it should be 800x450 mm.
EDID:
  Base EDID: Some timings are out of range of the Monitor Ranges:
    Vertical Freq: 24.000 - 60.317 Hz (Monitor: 48.000 - 61.000 Hz)
    Horizontal Freq: 27.000 - 135.000 kHz (Monitor: 30.000 - 135.000 kHz)

Failures:

Block 0, Base EDID:
  Basic Display Parameters & Features: sRGB is signaled, but the chromaticities do not match.
  Display Range Limits: GTF is supported, but the display does not support continuous frequencies.
Block 1, CTA-861 Extension Block:
  Missing VCDB, needed for Set Selectable RGB Quantization to avoid interop issues.
Block 2, DisplayID Extension Block:
  DisplayID Base Block has no product type.
  Expected 0 DisplayID Extension Block, but got 1.
Block 3, Base EDID:
  Unknown Extension Block.
Block 4, CTA-861 Extension Block:
  Video Data Block: Duplicate VIC 1.
  Video Data Block: Duplicate VIC 2.
  Video Data Block: Duplicate VIC 3.
  Video Data Block: Duplicate VIC 4.
  Video Data Block: Duplicate VIC 5.
  Video Data Block: Duplicate VIC 16.
  Video Data Block: Duplicate VIC 19.
  Video Data Block: Duplicate VIC 20.
  Video Data Block: Duplicate VIC 31.
  Video Data Block: Duplicate VIC 32.
  Video Data Block: Duplicate VIC 33.
  Video Data Block: Duplicate VIC 34.
  Video Data Block: Duplicate VIC 93.
  Video Data Block: Duplicate VIC 94.
  Video Data Block: Duplicate VIC 95.
  Video Data Block: Duplicate VIC 96.
  Video Data Block: Duplicate VIC 97.
  Video Data Block: Duplicate VIC 123.
  Video Data Block: Duplicate VIC 125.
  Video Data Block: Duplicate VIC 126.
  Speaker Allocation Data Block: Only one instance of this Data Block is allowed.
  HDR Static Metadata Data Block: Only one instance of this Data Block is allowed.
  Colorimetry Data Block: Only one instance of this Data Block is allowed.
EDID:
  Base EDID: EDID specified 2 extension block(s), but found 5 extension block(s).

EDID conformity: FAIL
