edid-decode (hex):

00 ff ff ff ff ff ff 00 41 0c d2 c0 7c 05 00 00
20 17 01 03 80 3c 22 78 2a b2 05 a3 56 4f 9e 28
0f 50 54 b1 08 00 d1 c0 b3 00 95 00 81 c0 81 80
01 01 01 01 01 01 02 3a 80 18 71 38 2d 40 58 2c
45 00 56 50 21 00 00 1e 00 00 00 ff 00 41 55 35
31 33 33 32 30 30 31 34 30 34 00 00 00 fc 00 50
48 4c 20 32 37 33 56 35 0a 20 20 20 00 00 00 fd
00 38 47 1e 53 11 00 0a 20 20 20 20 20 20 00 ec

00 ff ff ff ff ff ff 00 41 0c d2 c0 7c 05 00 00
20 17 01 03 80 3c 22 78 2a b2 05 a3 56 4f 9e 28
0f 50 54 b1 08 00 d1 c0 b3 00 95 00 81 c0 81 80
01 01 01 01 01 01 02 3a 80 18 71 38 2d 40 58 2c
45 00 56 50 21 00 00 1e 00 00 00 ff 00 41 55 35
31 33 33 32 30 30 31 34 30 34 00 00 00 fc 00 50
48 4c 20 32 37 33 56 35 0a 20 20 20 00 00 00 fd
00 38 47 1e 53 11 00 0a 20 20 20 20 20 20 00 ec

----------------

Block 0, Base EDID:
  EDID Structure Version & Revision: 1.3
  Vendor & Product Identification:
    Manufacturer: PHL
    Model: 49362
    Serial Number: ...
    Made in: week 32 of 2013
  Basic Display Parameters & Features:
    Digital display
    Maximum image size: 60 cm x 34 cm
    Gamma: 2.20
    DPMS levels: Off
    RGB color display
    First detailed timing is the preferred timing
  Color Characteristics:
    Red  : 0.6386, 0.3388
    Green: 0.3085, 0.6191
    Blue : 0.1562, 0.0585
    White: 0.3134, 0.3291
  Established Timings I & II:
    IBM     :   720x400    70.081663 Hz   9:5     31.467 kHz     28.320000 MHz
    DMT 0x04:   640x480    59.940476 Hz   4:3     31.469 kHz     25.175000 MHz
    Apple   :   640x480    66.666667 Hz   4:3     35.000 kHz     30.240000 MHz
    DMT 0x09:   800x600    60.316541 Hz   4:3     37.879 kHz     40.000000 MHz
    DMT 0x10:  1024x768    60.003840 Hz   4:3     48.363 kHz     65.000000 MHz
  Standard Timings:
    DMT 0x52:  1920x1080   60.000000 Hz  16:9     67.500 kHz    148.500000 MHz
    DMT 0x3a:  1680x1050   59.954250 Hz  16:10    65.290 kHz    146.250000 MHz
    DMT 0x2f:  1440x900    59.887445 Hz  16:10    55.935 kHz    106.500000 MHz
    DMT 0x55:  1280x720    60.000000 Hz  16:9     45.000 kHz     74.250000 MHz
    DMT 0x23:  1280x1024   60.019740 Hz   5:4     63.981 kHz    108.000000 MHz
  Detailed Timing Descriptors:
    DTD 1:  1920x1080   60.000000 Hz  16:9     67.500 kHz    148.500000 MHz (598 mm x 336 mm)
                 Hfront   88 Hsync  44 Hback  148 Hpol P
                 Vfront    4 Vsync   5 Vback   36 Vpol P
    Display Product Serial Number: ...
    Display Product Name: 'PHL 273V5'
    Display Range Limits:
      Monitor ranges (GTF): 56-71 Hz V, 30-83 kHz H, max dotclock 170 MHz
Checksum: 0xec

----------------

Failures:

EDID:
  Extension Block 1 started with EDID header, ignoring Extension Blocks >= 1.

EDID conformity: FAIL
