edid-decode (hex):

00 ff ff ff ff ff ff 00 1e 6d 95 43 01 00 00 00
0b 0e 01 03 78 21 19 ac e8 4a c5 a1 54 4b 99 24
12 48 4c ff ff 80 31 59 45 59 61 59 81 80 a9 40
d1 40 a9 4a a9 4f 86 3d 00 c0 51 00 30 40 40 a0
13 00 36 e6 10 00 00 1e 00 00 00 fd 00 32 a0 1e
62 17 00 0a 20 20 20 20 20 20 00 00 00 fc 00 46
37 32 30 50 0a 20 20 20 20 20 20 20 00 00 00 fc
00 0a 20 20 20 20 20 20 20 20 20 20 20 20 00 fb

00 ff ff ff ff ff ff 00 1e 6d 95 43 01 00 00 00
0b 0e 01 03 78 21 19 ac e8 4a c5 a1 54 4b 99 24
12 48 4c ff ff 80 31 59 45 59 61 59 81 80 a9 40
d1 40 a9 4a a9 4f 86 3d 00 c0 51 00 30 40 40 a0
13 00 36 e6 10 00 00 1e 00 00 00 fd 00 32 a0 1e
62 17 00 0a 20 20 20 20 20 20 00 00 00 fc 00 46
37 32 30 50 0a 20 20 20 20 20 20 20 00 00 00 fc
00 0a 20 20 20 20 20 20 20 20 20 20 20 20 00 fb

----------------

Block 0, Base EDID:
  EDID Structure Version & Revision: 1.3
  Vendor & Product Identification:
    Manufacturer: GSM
    Model: 17301
    Serial Number: ...
    Made in: week 11 of 2004
  Basic Display Parameters & Features:
    Analog display
    Signal Level Standard: 0.700 : 0.000 : 0.700 V p-p
    Blank-to-black setup/pedestal
    Sync: Separate
    Maximum image size: 33 cm x 25 cm
    Gamma: 2.72
    DPMS levels: Standby Suspend Off
    RGB color display
  Color Characteristics:
    Red  : 0.6298, 0.3281
    Green: 0.2949, 0.5996
    Blue : 0.1435, 0.0703
    White: 0.2822, 0.2978
  Established Timings I & II:
    IBM     :   720x400    70.081663 Hz   9:5     31.467 kHz     28.320000 MHz
    IBM     :   720x400    87.849542 Hz   9:5     39.444 kHz     35.500000 MHz
    DMT 0x04:   640x480    59.940476 Hz   4:3     31.469 kHz     25.175000 MHz
    Apple   :   640x480    66.666667 Hz   4:3     35.000 kHz     30.240000 MHz
    DMT 0x05:   640x480    72.808802 Hz   4:3     37.861 kHz     31.500000 MHz
    DMT 0x06:   640x480    75.000000 Hz   4:3     37.500 kHz     31.500000 MHz
    DMT 0x08:   800x600    56.250000 Hz   4:3     35.156 kHz     36.000000 MHz
    DMT 0x09:   800x600    60.316541 Hz   4:3     37.879 kHz     40.000000 MHz
    DMT 0x0a:   800x600    72.187572 Hz   4:3     48.077 kHz     50.000000 MHz
    DMT 0x0b:   800x600    75.000000 Hz   4:3     46.875 kHz     49.500000 MHz
    Apple   :   832x624    74.551266 Hz   4:3     49.726 kHz     57.284000 MHz
    DMT 0x0f:  1024x768i   86.957532 Hz   4:3     35.522 kHz     44.900000 MHz
    DMT 0x10:  1024x768    60.003840 Hz   4:3     48.363 kHz     65.000000 MHz
    DMT 0x11:  1024x768    70.069359 Hz   4:3     56.476 kHz     75.000000 MHz
    DMT 0x12:  1024x768    75.028582 Hz   4:3     60.023 kHz     78.750000 MHz
    DMT 0x24:  1280x1024   75.024675 Hz   5:4     79.976 kHz    135.000000 MHz
    Apple   :  1152x870    75.061550 Hz 192:145   68.681 kHz    100.000000 MHz
  Standard Timings:
    DMT 0x07:   640x480    85.008312 Hz   4:3     43.269 kHz     36.000000 MHz
    DMT 0x0c:   800x600    85.061274 Hz   4:3     53.674 kHz     56.250000 MHz
    DMT 0x13:  1024x768    84.996690 Hz   4:3     68.677 kHz     94.500000 MHz
    DMT 0x23:  1280x1024   60.019740 Hz   5:4     63.981 kHz    108.000000 MHz
    DMT 0x33:  1600x1200   60.000000 Hz   4:3     75.000 kHz    162.000000 MHz
    DMT 0x49:  1920x1440   60.000000 Hz   4:3     90.000 kHz    234.000000 MHz
    DMT 0x35:  1600x1200   70.000000 Hz   4:3     87.500 kHz    189.000000 MHz
    DMT 0x36:  1600x1200   75.000000 Hz   4:3     93.750 kHz    202.500000 MHz
  Detailed Timing Descriptors:
    DTD 1:  1280x1024   85.024098 Hz   5:4     91.146 kHz    157.500000 MHz (310 mm x 230 mm)
                 Hfront   64 Hsync 160 Hback  224 Hpol P
                 Vfront    1 Vsync   3 Vback   44 Vpol P
    Display Range Limits:
      Monitor ranges (GTF): 50-160 Hz V, 30-98 kHz H, max dotclock 230 MHz
    Display Product Name: 'F720P'
    Display Product Name: ''
Checksum: 0xfb

----------------

Block 1, Unknown EDID Extension Block 0x00:
  00 ff ff ff ff ff ff 00 1e 6d 95 43 01 00 00 00 '.........m.C....'
  0b 0e 01 03 78 21 19 ac e8 4a c5 a1 54 4b 99 24 '....x!...J..TK.$'
  12 48 4c ff ff 80 31 59 45 59 61 59 81 80 a9 40 '.HL...1YEYaY...@'
  d1 40 a9 4a a9 4f 86 3d 00 c0 51 00 30 40 40 a0 '.@.J.O.=..Q.0@@.'
  13 00 36 e6 10 00 00 1e 00 00 00 fd 00 32 a0 1e '..6..........2..'
  62 17 00 0a 20 20 20 20 20 20 00 00 00 fc 00 46 'b...      .....F'
  37 32 30 50 0a 20 20 20 20 20 20 20 00 00 00 fc '720P.       ....'
  00 0a 20 20 20 20 20 20 20 20 20 20 20 20 00 fb '..            ..'
Checksum: 0xfb

----------------

Warnings:

Block 0, Base EDID:
  Vendor & Product Identification: The serial number is one of the known dummy values, it should probably be set to 0.
  Detailed Timing Descriptor #1: Image size is 310x230 mm, but based on the picture AR it should be 310x248 mm.
EDID:
  Base EDID: Some timings are out of range of the Monitor Ranges:
    Maximum Clock: 234.000 MHz (Monitor: 230.000 MHz)
    Could be due to a Monitor Range off-by-one rounding issue

Failures:

Block 0, Base EDID:
  Basic Display Parameters & Features: EDID 1.3 requires that the first detailed timing is the preferred timing.
  Detailed Timing Descriptor #1: Mismatch of image size 310x230 mm vs display size 330x250 mm.
  Display Product Name: Empty string.
Block 1, Base EDID:
  Unknown Extension Block.
EDID:
  Base EDID: EDID specified 0 extension block(s), but found 1 extension block(s).

EDID conformity: FAIL
