edid-decode (hex):

00 ff ff ff ff ff ff 00 0d af 41 14 00 00 00 00
1f 12 01 03 90 1e 13 78 0a 77 b5 91 55 50 90 28
25 50 54 00 00 00 01 01 01 01 01 01 01 01 01 01
01 01 01 01 01 01 1c 19 00 2e 50 20 08 30 0e 09
12 00 2f be 10 00 00 1a 43 12 00 a0 50 20 0f 30
30 20 36 00 2f be 10 00 00 1a 00 00 00 fe 00 54
36 36 31 48 80 4e 31 34 31 49 36 0a 00 00 00 00
00 00 00 00 00 00 00 00 00 01 01 0a 20 20 00 8e

----------------

Block 0, Base EDID:
  EDID Structure Version & Revision: 1.3
  Vendor & Product Identification:
    Manufacturer: CMO
    Model: 5185
    Made in: week 31 of 2008
  Basic Display Parameters & Features:
    Digital display
    Maximum image size: 30 cm x 19 cm
    Gamma: 2.20
    RGB color display
    First detailed timing is the preferred timing
  Color Characteristics:
    Red  : 0.5673, 0.3349
    Green: 0.3134, 0.5654
    Blue : 0.1582, 0.1474
    White: 0.3134, 0.3291
  Established Timings I & II: none
  Standard Timings: none
  Detailed Timing Descriptors:
    DTD 1:  1280x800    59.995819 Hz  16:10    48.477 kHz     64.280000 MHz (303 mm x 190 mm)
                 Hfront   14 Hsync   9 Hback   23 Hpol P
                 Vfront    1 Vsync   2 Vback    5 Vpol N
    DTD 2:  1280x800    39.834697 Hz  16:10    32.465 kHz     46.750000 MHz (303 mm x 190 mm)
                 Hfront   48 Hsync  32 Hback   80 Hpol P
                 Vfront    3 Vsync   6 Vback    6 Vpol N
    Alphanumeric Data String: 'T661H.N141I6'
    Manufacturer-Specified Display Descriptor (0x00): 00 00 00 00 00 00 00 00 00 00 00 01 01 0a 20 20 '..............  '
Checksum: 0x8e

----------------

Warnings:

Block 0, Base EDID:
  Alphanumeric Data String: Non-ASCII character 0x80 at position 5, can cause problems.

Failures:

Block 0, Base EDID:
  Basic Display Parameters & Features: Digital Video Interface Standard set to reserved value 0x10.
  Missing Display Product Name.
  Missing Display Range Limits Descriptor.

EDID conformity: FAIL
