edid-decode (hex):

00 ff ff ff ff ff ff 00 1e 6d 66 43 9e fe 03 00
03 0e 01 03 18 20 18 b5 e8 2e 99 a5 52 47 99 24
0f 48 4c ff fe 80 31 4f 31 59 71 4f 45 59 61 4f
61 59 81 80 49 4f ea 24 00 60 41 00 28 30 30 60
13 00 36 e6 10 00 00 1e 00 00 00 fd 00 32 a0 1e
47 0b 00 0a 20 20 20 20 20 20 00 00 00 fc 00 54
37 31 30 42 48 0a 20 20 20 20 20 20 00 00 00 fc
00 0a 20 20 20 20 20 20 20 20 20 20 20 20 00 25

00 ff ff ff ff ff ff 00 1e 6d 66 43 9e fe 03 00
03 0e 01 03 18 20 18 b5 e8 2e 99 a5 52 47 99 24
0f 48 4c ff fe 80 31 4f 31 59 71 4f 45 59 61 4f
61 59 81 80 49 4f ea 24 00 60 41 00 28 30 30 60
13 00 36 e6 10 00 00 1e 00 00 00 fd 00 32 a0 1e
47 0b 00 0a 20 20 20 20 20 20 00 00 00 fc 00 54
37 31 30 42 48 0a 20 20 20 20 20 20 00 00 00 fc
00 0a 20 20 20 20 20 20 20 20 20 20 20 20 00 25

----------------

Block 0, Base EDID:
  EDID Structure Version & Revision: 1.3
  Vendor & Product Identification:
    Manufacturer: GSM
    Model: 17254
    Serial Number: ...
    Made in: week 3 of 2004
  Basic Display Parameters & Features:
    Analog display
    Signal Level Standard: 0.700 : 0.300 : 1.000 V p-p
    Blank-to-black setup/pedestal
    Sync: Separate
    Maximum image size: 32 cm x 24 cm
    Gamma: 2.81
    DPMS levels: Standby Suspend Off
    RGB color display
  Color Characteristics:
    Red  : 0.6445, 0.3222
    Green: 0.2802, 0.5996
    Blue : 0.1425, 0.0595
    White: 0.2832, 0.2978
  Established Timings I & II:
    IBM     :   720x400    70.081663 Hz   9:5     31.467 kHz     28.320000 MHz
    IBM     :   720x400    87.849542 Hz   9:5     39.444 kHz     35.500000 MHz
    DMT 0x04:   640x480    59.940476 Hz   4:3     31.469 kHz     25.175000 MHz
    Apple   :   640x480    66.666667 Hz   4:3     35.000 kHz     30.240000 MHz
    DMT 0x05:   640x480    72.808802 Hz   4:3     37.861 kHz     31.500000 MHz
    DMT 0x06:   640x480    75.000000 Hz   4:3     37.500 kHz     31.500000 MHz
    DMT 0x08:   800x600    56.250000 Hz   4:3     35.156 kHz     36.000000 MHz
    DMT 0x09:   800x600    60.316541 Hz   4:3     37.879 kHz     40.000000 MHz
    DMT 0x0a:   800x600    72.187572 Hz   4:3     48.077 kHz     50.000000 MHz
    DMT 0x0b:   800x600    75.000000 Hz   4:3     46.875 kHz     49.500000 MHz
    Apple   :   832x624    74.551266 Hz   4:3     49.726 kHz     57.284000 MHz
    DMT 0x0f:  1024x768i   86.957532 Hz   4:3     35.522 kHz     44.900000 MHz
    DMT 0x10:  1024x768    60.003840 Hz   4:3     48.363 kHz     65.000000 MHz
    DMT 0x11:  1024x768    70.069359 Hz   4:3     56.476 kHz     75.000000 MHz
    DMT 0x12:  1024x768    75.028582 Hz   4:3     60.023 kHz     78.750000 MHz
    Apple   :  1152x870    75.061550 Hz 192:145   68.681 kHz    100.000000 MHz
  Standard Timings:
    DMT 0x06:   640x480    75.000000 Hz   4:3     37.500 kHz     31.500000 MHz
    DMT 0x07:   640x480    85.008312 Hz   4:3     43.269 kHz     36.000000 MHz
    DMT 0x15:  1152x864    75.000000 Hz   4:3     67.500 kHz    108.000000 MHz
    DMT 0x0c:   800x600    85.061274 Hz   4:3     53.674 kHz     56.250000 MHz
    DMT 0x12:  1024x768    75.028582 Hz   4:3     60.023 kHz     78.750000 MHz
    DMT 0x13:  1024x768    84.996690 Hz   4:3     68.677 kHz     94.500000 MHz
    DMT 0x23:  1280x1024   60.019740 Hz   5:4     63.981 kHz    108.000000 MHz
    GTF     :   832x624    74.999718 Hz   4:3     48.900 kHz     53.203000 MHz
  Detailed Timing Descriptors:
    DTD 1:  1024x768    84.996690 Hz   4:3     68.677 kHz     94.500000 MHz (310 mm x 230 mm)
                 Hfront   48 Hsync  96 Hback  208 Hpol P
                 Vfront    1 Vsync   3 Vback   36 Vpol P
    Display Range Limits:
      Monitor ranges (GTF): 50-160 Hz V, 30-71 kHz H, max dotclock 110 MHz
    Display Product Name: 'T710BH'
    Display Product Name: ''
Checksum: 0x25

----------------

Failures:

Block 0, Base EDID:
  Basic Display Parameters & Features: EDID 1.3 requires that the first detailed timing is the preferred timing.
  Detailed Timing Descriptor #1: Mismatch of image size 310x230 mm vs display size 320x240 mm.
  Display Product Name: Empty string.
EDID:
  Extension Block 1 started with EDID header, ignoring Extension Blocks >= 1.

EDID conformity: FAIL
