edid-decode (hex):

00 ff ff ff ff ff ff 00 63 18 10 19 01 00 00 00
0c 1d 01 03 80 28 1b 78 ea d6 a5 a2 59 4a 95 24
14 50 54 a9 4b 00 81 00 81 40 81 80 81 c0 71 40
01 01 45 40 01 01 9a 29 a0 d0 51 84 22 30 50 98
36 00 9a e6 10 00 00 1e 66 21 50 b0 51 00 1b 30
40 70 36 00 9a e6 10 00 00 1c 12 34 a0 d0 51 84
22 30 50 98 36 00 9a 00 11 00 00 1e 00 00 00 fc
00 4c 45 44 20 4d 4f 4e 49 54 4f 52 0a 20 01 49

02 03 27 f1 47 01 02 03 04 12 13 16 23 09 07 07
83 01 00 00 67 03 0c 00 10 00 38 2d e6 06 07 00
60 47 00 e3 05 e3 01 01 1d 00 72 51 d0 1e 20 6e
28 55 00 c4 8e 21 00 00 1e 8c 0a d0 8a 20 e0 2d
10 10 3e 96 00 13 8e 21 00 00 18 00 00 00 00 00
00 00 00 00 00 00 00 00 00 00 00 00 00 00 00 00
00 00 00 00 00 00 00 00 00 00 00 00 00 00 00 00
00 00 00 00 00 00 00 00 00 00 00 00 00 00 00 f2

00 ff ff ff ff ff ff 00 63 18 10 19 01 00 00 00
0c 1d 01 03 80 28 1b 78 ea d6 a5 a2 59 4a 95 24
14 50 54 a9 4b 00 81 00 81 40 81 80 81 c0 71 40
01 01 45 40 01 01 9a 29 a0 d0 51 84 22 30 50 98
36 00 9a e6 10 00 00 1e 66 21 50 b0 51 00 1b 30
40 70 36 00 9a e6 10 00 00 1c 12 34 a0 d0 51 84
22 30 50 98 36 00 9a 00 11 00 00 1e 00 00 00 fc
00 4c 45 44 20 4d 4f 4e 49 54 4f 52 0a 20 01 49

02 03 27 f1 47 01 02 03 04 12 13 16 23 09 07 07
83 01 00 00 67 03 0c 00 10 00 38 2d e6 06 07 00
60 47 00 e3 05 e3 01 01 1d 00 72 51 d0 1e 20 6e
28 55 00 c4 8e 21 00 00 1e 8c 0a d0 8a 20 e0 2d
10 10 3e 96 00 13 8e 21 00 00 18 00 00 00 00 00
00 00 00 00 00 00 00 00 00 00 00 00 00 00 00 00
00 00 00 00 00 00 00 00 00 00 00 00 00 00 00 00
00 00 00 00 00 00 00 00 00 00 00 00 00 00 00 f2

----------------

Block 0, Base EDID:
  EDID Structure Version & Revision: 1.3
  Vendor & Product Identification:
    Manufacturer: XXX
    Model: 6416
    Serial Number: ...
    Made in: week 12 of 2019
  Basic Display Parameters & Features:
    Digital display
    Maximum image size: 40 cm x 27 cm
    Gamma: 2.20
    DPMS levels: Standby Suspend Off
    RGB color display
    First detailed timing is the preferred timing
  Color Characteristics:
    Red  : 0.6357, 0.3486
    Green: 0.2900, 0.5839
    Blue : 0.1425, 0.0800
    White: 0.3134, 0.3291
  Established Timings I & II:
    IBM     :   720x400    70.081663 Hz   9:5     31.467 kHz     28.320000 MHz
    DMT 0x04:   640x480    59.940476 Hz   4:3     31.469 kHz     25.175000 MHz
    DMT 0x05:   640x480    72.808802 Hz   4:3     37.861 kHz     31.500000 MHz
    DMT 0x09:   800x600    60.316541 Hz   4:3     37.879 kHz     40.000000 MHz
    DMT 0x0b:   800x600    75.000000 Hz   4:3     46.875 kHz     49.500000 MHz
    DMT 0x10:  1024x768    60.003840 Hz   4:3     48.363 kHz     65.000000 MHz
    DMT 0x12:  1024x768    75.028582 Hz   4:3     60.023 kHz     78.750000 MHz
    DMT 0x24:  1280x1024   75.024675 Hz   5:4     79.976 kHz    135.000000 MHz
  Standard Timings:
    DMT 0x1c:  1280x800    59.810326 Hz  16:10    49.702 kHz     83.500000 MHz
    DMT 0x20:  1280x960    60.000000 Hz   4:3     60.000 kHz    108.000000 MHz
    DMT 0x23:  1280x1024   60.019740 Hz   5:4     63.981 kHz    108.000000 MHz
    DMT 0x55:  1280x720    60.000000 Hz  16:9     45.000 kHz     74.250000 MHz
    GTF     :  1152x864    60.000000 Hz   4:3     53.700 kHz     81.624000 MHz
    DMT 0x09:   800x600    60.316541 Hz   4:3     37.879 kHz     40.000000 MHz
  Detailed Timing Descriptors:
    DTD 1:  1440x900    59.887445 Hz  16:10    55.935 kHz    106.500000 MHz (410 mm x 230 mm)
                 Hfront   80 Hsync 152 Hback  232 Hpol P
                 Vfront    3 Vsync   6 Vback   25 Vpol P
    DTD 2:  1360x768    60.015162 Hz  85:48    47.712 kHz     85.500000 MHz (410 mm x 230 mm)
                 Hfront   64 Hsync 112 Hback  256 Hpol N
                 Vfront    3 Vsync   6 Vback   18 Vpol P
    DTD 3:  1440x900    74.957713 Hz  16:10    70.011 kHz    133.300000 MHz (410 mm x 256 mm)
                 Hfront   80 Hsync 152 Hback  232 Hpol P
                 Vfront    3 Vsync   6 Vback   25 Vpol P
    Display Product Name: 'LED MONITOR'
  Extension blocks: 1
Checksum: 0x49

----------------

Block 1, CTA-861 Extension Block:
  Revision: 3
  Underscans IT Video Formats by default
  Basic audio support
  Supports YCbCr 4:4:4
  Supports YCbCr 4:2:2
  Native DTDs: 1
  Video Data Block:
    VIC   1:   640x480    59.940476 Hz   4:3     31.469 kHz     25.175000 MHz
    VIC   2:   720x480    59.940060 Hz   4:3     31.469 kHz     27.000000 MHz
    VIC   3:   720x480    59.940060 Hz  16:9     31.469 kHz     27.000000 MHz
    VIC   4:  1280x720    60.000000 Hz  16:9     45.000 kHz     74.250000 MHz
    VIC  18:   720x576    50.000000 Hz  16:9     31.250 kHz     27.000000 MHz
    VIC  19:  1280x720    50.000000 Hz  16:9     37.500 kHz     74.250000 MHz
    VIC  22:  1440x576i   50.000000 Hz  16:9     15.625 kHz     27.000000 MHz
  Audio Data Block:
    Linear PCM:
      Max channels: 2
      Supported sample rates (kHz): 48 44.1 32
      Supported sample sizes (bits): 24 20 16
  Speaker Allocation Data Block:
    FL/FR - Front Left/Right
  Vendor-Specific Data Block (HDMI), OUI 00-0C-03:
    Source physical address: 1.0.0.0
    DC_36bit
    DC_30bit
    DC_Y444
    Maximum TMDS clock: 225 MHz
  HDR Static Metadata Data Block:
    Electro optical transfer functions:
      Traditional gamma - SDR luminance range
      Traditional gamma - HDR luminance range
      SMPTE ST2084
    Supported static metadata descriptors:
    Desired content max luminance: 96 (400.000 cd/m^2)
    Desired content max frame-average luminance: 71 (232.745 cd/m^2)
    Desired content min luminance: 0 (0.000 cd/m^2)
  Colorimetry Data Block:
    xvYCC601
    xvYCC709
    BT2020cYCC
    BT2020YCC
    BT2020RGB
    Gamut Boundary Description Metadata Profile P0
  Detailed Timing Descriptors:
    DTD 4:  1280x720    60.000000 Hz  16:9     45.000 kHz     74.250000 MHz (708 mm x 398 mm)
                 Hfront  110 Hsync  40 Hback  220 Hpol P
                 Vfront    5 Vsync   5 Vback   20 Vpol P
    DTD 5:   720x480    59.940060 Hz   3:2     31.469 kHz     27.000000 MHz (531 mm x 398 mm)
                 Hfront   16 Hsync  62 Hback   60 Hpol N
                 Vfront    9 Vsync   6 Vback   30 Vpol N
Checksum: 0xf2  Unused space in Extension Block: 52 bytes

----------------

Warnings:

Block 0, Base EDID:
  Vendor & Product Identification: The serial number is one of the known dummy values, it should probably be set to 0.
  Detailed Timing Descriptor #1: DTD is similar but not identical to DMT 0x2f.
  Detailed Timing Descriptor #1: Image size is 410x230 mm, but based on the picture AR it should be 368x230 mm.
  Detailed Timing Descriptor #2: DTD is similar but not identical to DMT 0x27.
Block 1, CTA-861 Extension Block:
  Video Data Block: VIC 1 and the first DTD are not identical. Is this intended?
  Video Data Block: All VICs are in ascending order, and the first (preferred) VIC <= 4, is that intended?
  Colorimetry Data Block: Set the sRGB colorimetry bit to avoid interop issues.
  Detailed Timing Descriptor #5: Image size is 531x398 mm, but based on the picture AR it should be 531x354 mm.

Failures:

Block 0, Base EDID:
  Detailed Timing Descriptor #1: Mismatch of image size 410x230 mm vs display size 400x270 mm.
  Detailed Timing Descriptor #2: Mismatch of image size 410x230 mm vs display size 400x270 mm.
  Detailed Timing Descriptor #3: Mismatch of image size 410x256 mm vs display size 400x270 mm.
  Missing Display Range Limits Descriptor.
Block 1, CTA-861 Extension Block:
  Detailed Timing Descriptor #4: Mismatch of image size 708x398 mm vs display size 400x270 mm.
  Detailed Timing Descriptor #5: Mismatch of image size 531x398 mm vs display size 400x270 mm.
  Missing VCDB, needed for Set Selectable RGB Quantization to avoid interop issues.
EDID:
  Extension Block 2 started with EDID header, ignoring Extension Blocks >= 2.
  Base EDID: The DTD max image size is 708x398mm, which is larger than the display size 400.0x270.0mm.

EDID conformity: FAIL
