edid-decode (hex):

00 ff ff ff ff ff ff 00 43 47 00 27 01 00 00 00
0e 1e 01 04 b5 3c 21 78 3b 4e 65 a9 55 4d 9c 26
10 50 54 a5 4b 00 71 4f 81 80 a9 40 d1 c0 01 01
01 01 01 01 01 01 02 3a 80 18 71 38 2d 40 58 2c
45 00 58 4a 21 00 00 1a fd 81 80 a0 70 38 1f 40
30 20 35 00 58 4a 21 00 00 1a 00 00 00 fc 00 44
50 0a 20 20 20 20 20 20 20 20 20 20 00 00 00 fd
00 30 a5 b8 b8 3c 01 0a 20 20 20 20 20 20 01 fc

02 03 27 f1 49 10 1f 04 13 12 11 03 02 01 23 09
7f 07 83 01 00 00 e2 00 c0 e3 05 c0 00 e6 06 05
01 62 62 00 e2 00 c0 0f 5c 80 a0 70 38 35 40 30
20 36 00 58 4a 21 00 00 1e 78 6e 80 a0 70 38 35
40 30 20 36 00 61 5c 21 00 00 1a 35 91 80 6a 70
38 20 40 30 20 3a 00 bc 84 21 00 00 1e 00 00 00
00 00 00 00 00 00 00 00 00 00 00 00 00 00 00 00
00 00 00 00 00 00 00 00 00 00 00 00 00 00 00 e2

00 ff ff ff ff ff ff 00 43 47 00 27 01 00 00 00
0e 1e 01 04 b5 3c 21 78 3b 4e 65 a9 55 4d 9c 26
10 50 54 a5 4b 00 71 4f 81 80 a9 40 d1 c0 01 01
01 01 01 01 01 01 02 3a 80 18 71 38 2d 40 58 2c
45 00 58 4a 21 00 00 1a fd 81 80 a0 70 38 1f 40
30 20 35 00 58 4a 21 00 00 1a 00 00 00 fc 00 44
50 0a 20 20 20 20 20 20 20 20 20 20 00 00 00 fd
00 30 a5 b8 b8 3c 01 0a 20 20 20 20 20 20 01 fc

02 03 27 f1 49 10 1f 04 13 12 11 03 02 01 23 09
7f 07 83 01 00 00 e2 00 c0 e3 05 c0 00 e6 06 05
01 62 62 00 e2 00 c0 0f 5c 80 a0 70 38 35 40 30
20 36 00 58 4a 21 00 00 1e 78 6e 80 a0 70 38 35
40 30 20 36 00 61 5c 21 00 00 1a 35 91 80 6a 70
38 20 40 30 20 3a 00 bc 84 21 00 00 1e 00 00 00
00 00 00 00 00 00 00 00 00 00 00 00 00 00 00 00
00 00 00 00 00 00 00 00 00 00 00 00 00 00 00 e2

----------------

Block 0, Base EDID:
  EDID Structure Version & Revision: 1.4
  Vendor & Product Identification:
    Manufacturer: PZG
    Model: 9984
    Serial Number: ...
    Made in: week 14 of 2020
  Basic Display Parameters & Features:
    Digital display
    Bits per primary color channel: 10
    DisplayPort interface
    Maximum image size: 60 cm x 33 cm
    Gamma: 2.20
    DPMS levels: Off
    Supported color formats: RGB 4:4:4, YCrCb 4:4:4, YCrCb 4:2:2
    First detailed timing includes the native pixel format and preferred refresh rate
    Display supports continuous frequencies
  Color Characteristics:
    Red  : 0.6611, 0.3320
    Green: 0.3037, 0.6113
    Blue : 0.1494, 0.0644
    White: 0.3134, 0.3291
  Established Timings I & II:
    IBM     :   720x400    70.081663 Hz   9:5     31.467 kHz     28.320000 MHz
    DMT 0x04:   640x480    59.940476 Hz   4:3     31.469 kHz     25.175000 MHz
    DMT 0x06:   640x480    75.000000 Hz   4:3     37.500 kHz     31.500000 MHz
    DMT 0x09:   800x600    60.316541 Hz   4:3     37.879 kHz     40.000000 MHz
    DMT 0x0b:   800x600    75.000000 Hz   4:3     46.875 kHz     49.500000 MHz
    DMT 0x10:  1024x768    60.003840 Hz   4:3     48.363 kHz     65.000000 MHz
    DMT 0x12:  1024x768    75.028582 Hz   4:3     60.023 kHz     78.750000 MHz
    DMT 0x24:  1280x1024   75.024675 Hz   5:4     79.976 kHz    135.000000 MHz
  Standard Timings:
    DMT 0x15:  1152x864    75.000000 Hz   4:3     67.500 kHz    108.000000 MHz
    DMT 0x23:  1280x1024   60.019740 Hz   5:4     63.981 kHz    108.000000 MHz
    DMT 0x33:  1600x1200   60.000000 Hz   4:3     75.000 kHz    162.000000 MHz
    DMT 0x52:  1920x1080   60.000000 Hz  16:9     67.500 kHz    148.500000 MHz
  Detailed Timing Descriptors:
    DTD 1:  1920x1080   60.000000 Hz  16:9     67.500 kHz    148.500000 MHz (600 mm x 330 mm)
                 Hfront   88 Hsync  44 Hback  148 Hpol P
                 Vfront    4 Vsync   5 Vback   36 Vpol N
    DTD 2:  1920x1080  144.001419 Hz  16:9    159.986 kHz    332.770000 MHz (600 mm x 330 mm)
                 Hfront   48 Hsync  32 Hback   80 Hpol P
                 Vfront    3 Vsync   5 Vback   23 Vpol N
    Display Product Name: 'DP'
    Display Range Limits:
      Monitor ranges (Range Limits Only): 48-165 Hz V, 184-184 kHz H, max dotclock 600 MHz
  Extension blocks: 1
Checksum: 0xfc

----------------

Block 1, CTA-861 Extension Block:
  Revision: 3
  Underscans IT Video Formats by default
  Basic audio support
  Supports YCbCr 4:4:4
  Supports YCbCr 4:2:2
  Native DTDs: 1
  Video Data Block:
    VIC  16:  1920x1080   60.000000 Hz  16:9     67.500 kHz    148.500000 MHz
    VIC  31:  1920x1080   50.000000 Hz  16:9     56.250 kHz    148.500000 MHz
    VIC   4:  1280x720    60.000000 Hz  16:9     45.000 kHz     74.250000 MHz
    VIC  19:  1280x720    50.000000 Hz  16:9     37.500 kHz     74.250000 MHz
    VIC  18:   720x576    50.000000 Hz  16:9     31.250 kHz     27.000000 MHz
    VIC  17:   720x576    50.000000 Hz   4:3     31.250 kHz     27.000000 MHz
    VIC   3:   720x480    59.940060 Hz  16:9     31.469 kHz     27.000000 MHz
    VIC   2:   720x480    59.940060 Hz   4:3     31.469 kHz     27.000000 MHz
    VIC   1:   640x480    59.940476 Hz   4:3     31.469 kHz     25.175000 MHz
  Audio Data Block:
    Linear PCM:
      Max channels: 2
      Supported sample rates (kHz): 192 176.4 96 88.2 48 44.1 32
      Supported sample sizes (bits): 24 20 16
  Speaker Allocation Data Block:
    FL/FR - Front Left/Right
  Video Capability Data Block:
    YCbCr quantization: Selectable (via AVI YQ)
    RGB quantization: Selectable (via AVI Q)
    PT scan behavior: No Data
    IT scan behavior: IT video formats not supported
    CE scan behavior: CE video formats not supported
  Colorimetry Data Block:
    BT2020YCC
    BT2020RGB
  HDR Static Metadata Data Block:
    Electro optical transfer functions:
      Traditional gamma - SDR luminance range
      SMPTE ST2084
    Supported static metadata descriptors:
      Static metadata type 1
    Desired content max luminance: 98 (417.710 cd/m^2)
    Desired content max frame-average luminance: 98 (417.710 cd/m^2)
    Desired content min luminance: 0 (0.000 cd/m^2)
  Video Capability Data Block:
    YCbCr quantization: Selectable (via AVI YQ)
    RGB quantization: Selectable (via AVI Q)
    PT scan behavior: No Data
    IT scan behavior: IT video formats not supported
    CE scan behavior: CE video formats not supported
  Detailed Timing Descriptors:
    DTD 3:  1920x1080  100.002546 Hz  16:9    113.303 kHz    235.670000 MHz (600 mm x 330 mm)
                 Hfront   48 Hsync  32 Hback   80 Hpol P
                 Vfront    3 Vsync   6 Vback   44 Vpol P
    DTD 4:  1920x1080  120.001358 Hz  16:9    135.962 kHz    282.800000 MHz (609 mm x 348 mm)
                 Hfront   48 Hsync  32 Hback   80 Hpol P
                 Vfront    3 Vsync   6 Vback   44 Vpol N
    DTD 5:  1920x1080  164.999787 Hz  16:9    183.480 kHz    371.730000 MHz (700 mm x 388 mm)
                 Hfront   48 Hsync  32 Hback   26 Hpol P
                 Vfront    3 Vsync  10 Vback   19 Vpol P
Checksum: 0xe2  Unused space in Extension Block: 34 bytes

----------------

Warnings:

Block 0, Base EDID:
  Vendor & Product Identification: The serial number is one of the known dummy values, it should probably be set to 0.
  Detailed Timing Descriptor #1: DTD is similar but not identical to VIC 16.
Block 1, CTA-861 Extension Block:
  Video Data Block: VIC 16 and the first DTD are not identical. Is this intended?
  Video Capability Data Block: IT scan behavior is expected to support underscanned.
  Video Capability Data Block: 'CE video formats not supported' makes no sense.
  Colorimetry Data Block: Set the sRGB colorimetry bit to avoid interop issues.
  Video Capability Data Block: IT scan behavior is expected to support underscanned.
  Video Capability Data Block: 'CE video formats not supported' makes no sense.
EDID:
  Base EDID: Some timings are out of range of the Monitor Ranges:
    Horizontal Freq: 31.250 - 183.479 kHz (Monitor: 184.000 - 184.000 kHz)

Failures:

Block 1, CTA-861 Extension Block:
  Video Capability Data Block: Only one instance of this Data Block is allowed.
  Detailed Timing Descriptor #4: Mismatch of image size 609x348 mm vs display size 600x330 mm.
  Detailed Timing Descriptor #5: Mismatch of image size 700x388 mm vs display size 600x330 mm.
EDID:
  Extension Block 2 started with EDID header, ignoring Extension Blocks >= 2.
  Base EDID: The DTD max image size is 700x388mm, which is larger than the display size 600.0x330.0mm.

EDID conformity: FAIL
