edid-decode (hex):

00 ff ff ff ff ff ff 00 4a 8b 1a 1d 01 01 01 01
1e 19 01 04 a5 66 39 78 e6 ee 91 a3 54 4c 99 26
0f 50 54 bd e8 00 00 40 00 40 00 40 00 40 00 40
00 40 00 40 00 40 64 19 00 40 41 00 26 30 18 88
36 00 a0 5a 00 00 00 1e 00 00 00 10 00 00 00 00
00 00 00 00 00 00 00 00 00 00 00 00 00 10 00 00
00 00 00 00 00 00 00 00 00 00 00 00 00 00 00 fc
00 0a 20 20 20 20 20 20 20 20 20 20 20 20 00 57

----------------

Block 0, Base EDID:
  EDID Structure Version & Revision: 1.4
  Vendor & Product Identification:
    Manufacturer: RTK
    Model: 7450
    Serial Number: ...
    Made in: week 30 of 2015
  Basic Display Parameters & Features:
    Digital display
    Bits per primary color channel: 8
    DisplayPort interface
    Maximum image size: 102 cm x 57 cm
    Gamma: 2.20
    DPMS levels: Standby Suspend Off
    Supported color formats: RGB 4:4:4
    Default (sRGB) color space is primary color space
    First detailed timing includes the native pixel format and preferred refresh rate
  Color Characteristics:
    Red  : 0.6396, 0.3300
    Green: 0.2998, 0.5996
    Blue : 0.1503, 0.0595
    White: 0.3125, 0.3291
  Established Timings I & II:
    IBM     :   720x400    70.081663 Hz   9:5     31.467 kHz     28.320000 MHz
    DMT 0x04:   640x480    59.940476 Hz   4:3     31.469 kHz     25.175000 MHz
    Apple   :   640x480    66.666667 Hz   4:3     35.000 kHz     30.240000 MHz
    DMT 0x05:   640x480    72.808802 Hz   4:3     37.861 kHz     31.500000 MHz
    DMT 0x06:   640x480    75.000000 Hz   4:3     37.500 kHz     31.500000 MHz
    DMT 0x09:   800x600    60.316541 Hz   4:3     37.879 kHz     40.000000 MHz
    DMT 0x0a:   800x600    72.187572 Hz   4:3     48.077 kHz     50.000000 MHz
    DMT 0x0b:   800x600    75.000000 Hz   4:3     46.875 kHz     49.500000 MHz
    Apple   :   832x624    74.551266 Hz   4:3     49.726 kHz     57.284000 MHz
    DMT 0x10:  1024x768    60.003840 Hz   4:3     48.363 kHz     65.000000 MHz
  Standard Timings:
  Detailed Timing Descriptors:
    DTD 1:  1024x768    60.003840 Hz   4:3     48.363 kHz     65.000000 MHz (160 mm x 90 mm)
                 Hfront   24 Hsync 136 Hback  160 Hpol P
                 Vfront    3 Vsync   6 Vback   29 Vpol P
    Dummy Descriptor:
    Dummy Descriptor:
    Display Product Name: ''
Checksum: 0x57

----------------

Warnings:

Block 0, Base EDID:
  Vendor & Product Identification: The serial number is one of the known dummy values, it should probably be set to 0.
  Detailed Timing Descriptor #1: DTD is similar but not identical to DMT 0x10.
  Detailed Timing Descriptor #1: Dubious image size (160x90 mm is smaller than 100x100 mm).

Failures:

Block 0, Base EDID:
  Standard Timings: Use 0x0101 as the invalid Standard Timings code, not 0x0040.
  Standard Timings: Use 0x0101 as the invalid Standard Timings code, not 0x0040.
  Standard Timings: Use 0x0101 as the invalid Standard Timings code, not 0x0040.
  Standard Timings: Use 0x0101 as the invalid Standard Timings code, not 0x0040.
  Standard Timings: Use 0x0101 as the invalid Standard Timings code, not 0x0040.
  Standard Timings: Use 0x0101 as the invalid Standard Timings code, not 0x0040.
  Standard Timings: Use 0x0101 as the invalid Standard Timings code, not 0x0040.
  Standard Timings: Use 0x0101 as the invalid Standard Timings code, not 0x0040.
  Detailed Timing Descriptor #1: Mismatch of image size 160x90 mm vs display size 1020x570 mm.
  Display Product Name: Empty string.

EDID conformity: FAIL
