edid-decode (hex):

00 ff ff ff ff ff ff 00 5a 63 01 f9 01 01 01 01
1f 0a 01 03 80 21 18 78 2b 04 89 a0 57 4a 9b 26
12 48 4c bf ef 80 31 59 45 59 61 59 71 4f 81 40
81 8f 81 99 01 01 ea 24 00 60 41 00 28 30 30 60
13 00 2c e1 10 00 00 1e 00 00 00 ff 00 32 30 35
30 30 33 31 30 30 32 35 31 0a 00 00 00 fd 00 32
55 1e 5c 10 00 0a 20 20 20 20 20 20 00 00 00 fc
00 50 46 37 37 64 0a 20 20 20 20 20 20 20 00 69

00 ff ff ff ff ff ff 00 5a 63 01 f9 01 01 01 01
1f 0a 01 03 80 21 18 78 2b 04 89 a0 57 4a 9b 26
12 48 4c bf ef 80 31 59 45 59 61 59 71 4f 81 40
81 8f 81 99 01 01 ea 24 00 60 41 00 28 30 30 60
13 00 2c e1 10 00 00 1e 00 00 00 ff 00 32 30 35
30 30 33 31 30 30 32 35 31 0a 00 00 00 fd 00 32
55 1e 5c 10 00 0a 20 20 20 20 20 20 00 00 00 fc
00 50 46 37 37 64 0a 20 20 20 20 20 20 20 00 69

----------------

Block 0, Base EDID:
  EDID Structure Version & Revision: 1.3
  Vendor & Product Identification:
    Manufacturer: VSC
    Model: 63745
    Serial Number: ...
    Made in: week 31 of 2000
  Basic Display Parameters & Features:
    Digital display
    Maximum image size: 33 cm x 24 cm
    Gamma: 2.20
    DPMS levels: Off
    RGB color display
    First detailed timing is the preferred timing
    Supports GTF timings within operating range
  Color Characteristics:
    Red  : 0.6250, 0.3398
    Green: 0.2900, 0.6054
    Blue : 0.1503, 0.0703
    White: 0.2832, 0.2978
  Established Timings I & II:
    IBM     :   720x400    70.081663 Hz   9:5     31.467 kHz     28.320000 MHz
    DMT 0x04:   640x480    59.940476 Hz   4:3     31.469 kHz     25.175000 MHz
    Apple   :   640x480    66.666667 Hz   4:3     35.000 kHz     30.240000 MHz
    DMT 0x05:   640x480    72.808802 Hz   4:3     37.861 kHz     31.500000 MHz
    DMT 0x06:   640x480    75.000000 Hz   4:3     37.500 kHz     31.500000 MHz
    DMT 0x08:   800x600    56.250000 Hz   4:3     35.156 kHz     36.000000 MHz
    DMT 0x09:   800x600    60.316541 Hz   4:3     37.879 kHz     40.000000 MHz
    DMT 0x0a:   800x600    72.187572 Hz   4:3     48.077 kHz     50.000000 MHz
    DMT 0x0b:   800x600    75.000000 Hz   4:3     46.875 kHz     49.500000 MHz
    Apple   :   832x624    74.551266 Hz   4:3     49.726 kHz     57.284000 MHz
    DMT 0x10:  1024x768    60.003840 Hz   4:3     48.363 kHz     65.000000 MHz
    DMT 0x11:  1024x768    70.069359 Hz   4:3     56.476 kHz     75.000000 MHz
    DMT 0x12:  1024x768    75.028582 Hz   4:3     60.023 kHz     78.750000 MHz
    DMT 0x24:  1280x1024   75.024675 Hz   5:4     79.976 kHz    135.000000 MHz
    Apple   :  1152x870    75.061550 Hz 192:145   68.681 kHz    100.000000 MHz
  Standard Timings:
    DMT 0x07:   640x480    85.008312 Hz   4:3     43.269 kHz     36.000000 MHz
    DMT 0x0c:   800x600    85.061274 Hz   4:3     53.674 kHz     56.250000 MHz
    DMT 0x13:  1024x768    84.996690 Hz   4:3     68.677 kHz     94.500000 MHz
    DMT 0x15:  1152x864    75.000000 Hz   4:3     67.500 kHz    108.000000 MHz
    DMT 0x20:  1280x960    60.000000 Hz   4:3     60.000 kHz    108.000000 MHz
    DMT 0x24:  1280x1024   75.024675 Hz   5:4     79.976 kHz    135.000000 MHz
    DMT 0x25:  1280x1024   85.024098 Hz   5:4     91.146 kHz    157.500000 MHz
  Detailed Timing Descriptors:
    DTD 1:  1024x768    84.996690 Hz   4:3     68.677 kHz     94.500000 MHz (300 mm x 225 mm)
                 Hfront   48 Hsync  96 Hback  208 Hpol P
                 Vfront    1 Vsync   3 Vback   36 Vpol P
    Display Product Serial Number: ...
    Display Range Limits:
      Monitor ranges (GTF): 50-85 Hz V, 30-92 kHz H, max dotclock 160 MHz
    Display Product Name: 'PF77d'
Checksum: 0x69

----------------

Warnings:

Block 0, Base EDID:
  Vendor & Product Identification: The serial number is one of the known dummy values, it should probably be set to 0.

Failures:

Block 0, Base EDID:
  Detailed Timing Descriptor #1: Mismatch of image size 300x225 mm vs display size 330x240 mm.
EDID:
  Extension Block 1 started with EDID header, ignoring Extension Blocks >= 1.

EDID conformity: FAIL
