edid-decode (hex):

00 ff ff ff ff ff ff 00 5a 8b 60 23 00 00 00 00
2e 1e 01 04 a5 3c 22 78 3b 64 f5 ad 50 49 a3 22
13 50 54 a5 4b 00 81 c0 71 4f 81 80 a9 c0 95 00
b3 00 81 40 d1 c0 02 3a 80 18 71 38 2d 40 58 2c
45 00 56 50 21 00 00 1e 3b a0 80 18 71 38 32 40
58 2c 45 00 56 50 21 00 00 1a 00 00 00 fc 00 47
46 56 32 34 43 42 0a 20 20 20 20 20 00 00 00 fd
00 30 a5 bb bb 24 01 0a 20 20 20 20 20 20 01 0b

02 03 24 f1 23 09 07 07 83 01 00 00 4e 90 01 02
03 04 05 11 12 13 14 1f 29 2f 3f 68 1a 00 00 01
01 30 a5 00 8b 6f 80 a0 70 38 40 40 30 20 35 00
56 50 21 00 00 1a fc 7e 80 88 70 38 12 40 18 20
35 00 56 50 21 00 00 1e 00 00 00 00 00 00 00 00
00 00 00 00 00 00 00 00 00 00 00 00 00 00 00 00
00 00 00 00 00 00 00 00 00 00 00 00 00 00 00 00
00 00 00 00 00 00 00 00 00 00 00 00 00 00 00 6c

00 ff ff ff ff ff ff 00 5a 8b 60 23 00 00 00 00
2e 1e 01 04 a5 3c 22 78 3b 64 f5 ad 50 49 a3 22
13 50 54 a5 4b 00 81 c0 71 4f 81 80 a9 c0 95 00
b3 00 81 40 d1 c0 02 3a 80 18 71 38 2d 40 58 2c
45 00 56 50 21 00 00 1e 3b a0 80 18 71 38 32 40
58 2c 45 00 56 50 21 00 00 1a 00 00 00 fc 00 47
46 56 32 34 43 42 0a 20 20 20 20 20 00 00 00 fd
00 30 a5 bb bb 24 01 0a 20 20 20 20 20 20 01 0b

02 03 24 f1 23 09 07 07 83 01 00 00 4e 90 01 02
03 04 05 11 12 13 14 1f 29 2f 3f 68 1a 00 00 01
01 30 a5 00 8b 6f 80 a0 70 38 40 40 30 20 35 00
56 50 21 00 00 1a fc 7e 80 88 70 38 12 40 18 20
35 00 56 50 21 00 00 1e 00 00 00 00 00 00 00 00
00 00 00 00 00 00 00 00 00 00 00 00 00 00 00 00
00 00 00 00 00 00 00 00 00 00 00 00 00 00 00 00
00 00 00 00 00 00 00 00 00 00 00 00 00 00 00 6c

----------------

Block 0, Base EDID:
  EDID Structure Version & Revision: 1.4
  Vendor & Product Identification:
    Manufacturer: VTK
    Model: 9056
    Made in: week 46 of 2020
  Basic Display Parameters & Features:
    Digital display
    Bits per primary color channel: 8
    DisplayPort interface
    Maximum image size: 60 cm x 34 cm
    Gamma: 2.20
    DPMS levels: Off
    Supported color formats: RGB 4:4:4, YCrCb 4:4:4, YCrCb 4:2:2
    First detailed timing includes the native pixel format and preferred refresh rate
    Display supports continuous frequencies
  Color Characteristics:
    Red  : 0.6767, 0.3144
    Green: 0.2861, 0.6367
    Blue : 0.1357, 0.0771
    White: 0.3134, 0.3291
  Established Timings I & II:
    IBM     :   720x400    70.081663 Hz   9:5     31.467 kHz     28.320000 MHz
    DMT 0x04:   640x480    59.940476 Hz   4:3     31.469 kHz     25.175000 MHz
    DMT 0x06:   640x480    75.000000 Hz   4:3     37.500 kHz     31.500000 MHz
    DMT 0x09:   800x600    60.316541 Hz   4:3     37.879 kHz     40.000000 MHz
    DMT 0x0b:   800x600    75.000000 Hz   4:3     46.875 kHz     49.500000 MHz
    DMT 0x10:  1024x768    60.003840 Hz   4:3     48.363 kHz     65.000000 MHz
    DMT 0x12:  1024x768    75.028582 Hz   4:3     60.023 kHz     78.750000 MHz
    DMT 0x24:  1280x1024   75.024675 Hz   5:4     79.976 kHz    135.000000 MHz
  Standard Timings:
    DMT 0x55:  1280x720    60.000000 Hz  16:9     45.000 kHz     74.250000 MHz
    DMT 0x15:  1152x864    75.000000 Hz   4:3     67.500 kHz    108.000000 MHz
    DMT 0x23:  1280x1024   60.019740 Hz   5:4     63.981 kHz    108.000000 MHz
    DMT 0x53:  1600x900    60.000000 Hz  16:9     60.000 kHz    108.000000 MHz (RB)
    DMT 0x2f:  1440x900    59.887445 Hz  16:10    55.935 kHz    106.500000 MHz
    DMT 0x3a:  1680x1050   59.954250 Hz  16:10    65.290 kHz    146.250000 MHz
    DMT 0x20:  1280x960    60.000000 Hz   4:3     60.000 kHz    108.000000 MHz
    DMT 0x52:  1920x1080   60.000000 Hz  16:9     67.500 kHz    148.500000 MHz
  Detailed Timing Descriptors:
    DTD 1:  1920x1080   60.000000 Hz  16:9     67.500 kHz    148.500000 MHz (598 mm x 336 mm)
                 Hfront   88 Hsync  44 Hback  148 Hpol P
                 Vfront    4 Vsync   5 Vback   36 Vpol P
    DTD 2:  1920x1080  165.000000 Hz  16:9    186.450 kHz    410.190000 MHz (598 mm x 336 mm)
                 Hfront   88 Hsync  44 Hback  148 Hpol P
                 Vfront    4 Vsync   5 Vback   41 Vpol N
    Display Product Name: 'GFV24CB'
    Display Range Limits:
      Monitor ranges (Range Limits Only): 48-165 Hz V, 187-187 kHz H, max dotclock 360 MHz
  Extension blocks: 1
Checksum: 0x0b

----------------

Block 1, CTA-861 Extension Block:
  Revision: 3
  Underscans IT Video Formats by default
  Basic audio support
  Supports YCbCr 4:4:4
  Supports YCbCr 4:2:2
  Native DTDs: 1
  Audio Data Block:
    Linear PCM:
      Max channels: 2
      Supported sample rates (kHz): 48 44.1 32
      Supported sample sizes (bits): 24 20 16
  Speaker Allocation Data Block:
    FL/FR - Front Left/Right
  Video Data Block:
    VIC  16:  1920x1080   60.000000 Hz  16:9     67.500 kHz    148.500000 MHz (native)
    VIC   1:   640x480    59.940476 Hz   4:3     31.469 kHz     25.175000 MHz
    VIC   2:   720x480    59.940060 Hz   4:3     31.469 kHz     27.000000 MHz
    VIC   3:   720x480    59.940060 Hz  16:9     31.469 kHz     27.000000 MHz
    VIC   4:  1280x720    60.000000 Hz  16:9     45.000 kHz     74.250000 MHz
    VIC   5:  1920x1080i  60.000000 Hz  16:9     33.750 kHz     74.250000 MHz
    VIC  17:   720x576    50.000000 Hz   4:3     31.250 kHz     27.000000 MHz
    VIC  18:   720x576    50.000000 Hz  16:9     31.250 kHz     27.000000 MHz
    VIC  19:  1280x720    50.000000 Hz  16:9     37.500 kHz     74.250000 MHz
    VIC  20:  1920x1080i  50.000000 Hz  16:9     28.125 kHz     74.250000 MHz
    VIC  31:  1920x1080   50.000000 Hz  16:9     56.250 kHz    148.500000 MHz
    VIC  41:  1280x720   100.000000 Hz  16:9     75.000 kHz    148.500000 MHz
    VIC  47:  1280x720   120.000000 Hz  16:9     90.000 kHz    148.500000 MHz
    VIC  63:  1920x1080  120.000000 Hz  16:9    135.000 kHz    297.000000 MHz
  Vendor-Specific Data Block (AMD), OUI 00-00-1A:
    Version: 1
    Flags 1: 0x01
      FreeSync Supported
    Minimum Refresh Rate: 48 Hz
    Maximum Refresh Rate: 165 Hz
  Detailed Timing Descriptors:
    DTD 3:  1920x1080  120.003194 Hz  16:9    137.284 kHz    285.550000 MHz (598 mm x 336 mm)
                 Hfront   48 Hsync  32 Hback   80 Hpol P
                 Vfront    3 Vsync   5 Vback   56 Vpol N
    DTD 4:  1920x1080  144.000765 Hz  16:9    158.113 kHz    325.080000 MHz (598 mm x 336 mm)
                 Hfront   24 Hsync  32 Hback   80 Hpol P
                 Vfront    3 Vsync   5 Vback   10 Vpol P
Checksum: 0x6c  Unused space in Extension Block: 55 bytes

----------------

Warnings:

Block 1, CTA-861 Extension Block:
  Add a Colorimetry Data Block with the sRGB colorimetry bit set to avoid interop issues.
EDID:
  Base EDID: Some timings are out of range of the Monitor Ranges:
    Horizontal Freq: 28.125 - 186.450 kHz (Monitor: 187.000 - 187.000 kHz)
    Maximum Clock: 410.190 MHz (Monitor: 360.000 MHz)

Failures:

Block 1, CTA-861 Extension Block:
  Missing VCDB, needed for Set Selectable RGB Quantization to avoid interop issues.
EDID:
  Extension Block 2 started with EDID header, ignoring Extension Blocks >= 2.

EDID conformity: FAIL
