edid-decode (hex):

00 ff ff ff ff ff ff 00 12 67 00 00 ea 79 00 00
2b 0f 01 03 68 1e 17 78 e8 b2 45 a4 55 4c 96 24
14 50 54 af ce 00 31 40 45 40 61 40 00 00 00 00
00 00 00 00 00 00 64 19 00 40 41 00 26 30 a0 88
d6 04 2c e6 10 00 00 18 00 00 00 fd 00 32 4b 1e
3c 08 00 0a 20 20 20 20 20 20 00 00 00 ff 00 35
34 31 30 33 31 32 31 30 0a 20 20 20 00 00 00 fc
00 56 51 35 20 31 35 52 20 4c 43 44 0a 20 00 00

00 ff ff ff ff ff ff 00 12 67 00 00 ea 79 00 00
2b 0f 01 03 68 1e 17 78 e8 b2 45 a4 55 4c 96 24
14 50 54 af ce 00 31 40 45 40 61 40 00 00 00 00
00 00 00 00 00 00 64 19 00 40 41 00 26 30 a0 88
d6 04 2c e6 10 00 00 18 00 00 00 fd 00 32 4b 1e
3c 08 00 0a 20 20 20 20 20 20 00 00 00 ff 00 35
34 31 30 33 31 32 31 30 0a 20 20 20 00 00 00 fc
00 56 51 35 20 31 35 52 20 4c 43 44 0a 20 00 00

----------------

Block 0, Base EDID:
  EDID Structure Version & Revision: 1.3
  Vendor & Product Identification:
    Manufacturer: DSG
    Model: 0
    Serial Number: ...
    Made in: week 43 of 2005
  Basic Display Parameters & Features:
    Analog display
    Signal Level Standard: 0.700 : 0.000 : 0.700 V p-p
    Blank level equals black level
    Sync: Separate
    Maximum image size: 30 cm x 23 cm
    Gamma: 2.20
    DPMS levels: Standby Suspend Off
    RGB color display
  Color Characteristics:
    Red  : 0.6425, 0.3349
    Green: 0.2968, 0.5878
    Blue : 0.1416, 0.0781
    White: 0.3134, 0.3291
  Established Timings I & II:
    IBM     :   720x400    70.081663 Hz   9:5     31.467 kHz     28.320000 MHz
    DMT 0x04:   640x480    59.940476 Hz   4:3     31.469 kHz     25.175000 MHz
    DMT 0x05:   640x480    72.808802 Hz   4:3     37.861 kHz     31.500000 MHz
    DMT 0x06:   640x480    75.000000 Hz   4:3     37.500 kHz     31.500000 MHz
    DMT 0x08:   800x600    56.250000 Hz   4:3     35.156 kHz     36.000000 MHz
    DMT 0x09:   800x600    60.316541 Hz   4:3     37.879 kHz     40.000000 MHz
    DMT 0x0a:   800x600    72.187572 Hz   4:3     48.077 kHz     50.000000 MHz
    DMT 0x0b:   800x600    75.000000 Hz   4:3     46.875 kHz     49.500000 MHz
    DMT 0x10:  1024x768    60.003840 Hz   4:3     48.363 kHz     65.000000 MHz
    DMT 0x11:  1024x768    70.069359 Hz   4:3     56.476 kHz     75.000000 MHz
    DMT 0x12:  1024x768    75.028582 Hz   4:3     60.023 kHz     78.750000 MHz
  Standard Timings:
    DMT 0x04:   640x480    59.940476 Hz   4:3     31.469 kHz     25.175000 MHz
    DMT 0x09:   800x600    60.316541 Hz   4:3     37.879 kHz     40.000000 MHz
    DMT 0x10:  1024x768    60.003840 Hz   4:3     48.363 kHz     65.000000 MHz
  Detailed Timing Descriptors:
    DTD 1:  1024x768    60.003840 Hz   4:3     48.363 kHz     65.000000 MHz (300 mm x 230 mm)
                 Hfront  160 Hsync 136 Hback   24 Hpol N
                 Vfront   29 Vsync   6 Vback    3 Vpol N
    Display Range Limits:
      Monitor ranges (GTF): 50-75 Hz V, 30-60 kHz H, max dotclock 80 MHz
    Display Product Serial Number: ...
    Display Product Name: 'VQ5 15R LCD'
Checksum: 0x00

----------------

Warnings:

Block 0, Base EDID:
  Detailed Timing Descriptor #1: DTD is similar but not identical to DMT 0x10.

Failures:

Block 0, Base EDID:
  Basic Display Parameters & Features: EDID 1.3 requires that the first detailed timing is the preferred timing.
  Standard Timings: Use 0x0101 as the invalid Standard Timings code, not 0x0000.
  Standard Timings: Use 0x0101 as the invalid Standard Timings code, not 0x0000.
  Standard Timings: Use 0x0101 as the invalid Standard Timings code, not 0x0000.
  Standard Timings: Use 0x0101 as the invalid Standard Timings code, not 0x0000.
  Standard Timings: Use 0x0101 as the invalid Standard Timings code, not 0x0000.
EDID:
  Extension Block 1 started with EDID header, ignoring Extension Blocks >= 1.

EDID conformity: FAIL
