edid-decode (hex):

00 ff ff ff ff ff ff 00 06 af 92 28 00 00 00 00
0f 1f 01 04 b5 26 15 78 01 ef 95 a7 52 35 b5 26
0f 50 54 00 00 00 01 01 01 01 01 01 01 01 01 01
01 01 01 01 01 01 94 d9 00 a0 f0 70 a0 80 30 20
35 00 7d d6 10 00 00 1a 00 00 00 fd 0c 3c 78 18
18 6f 01 0a 20 20 20 20 20 20 00 00 00 fe 00 50
56 37 4b 4a 80 42 31 37 33 5a 41 4e 00 00 00 00
00 05 81 0f a8 00 02 00 00 0f 01 0a 20 20 02 a4

02 03 0f 00 e3 05 80 00 e6 06 05 01 6b 6b 47 00
00 00 00 00 00 00 00 00 00 00 00 00 00 00 00 00
00 00 00 00 00 00 00 00 00 00 00 00 00 00 00 00
00 00 00 00 00 00 00 00 00 00 00 00 00 00 00 00
00 00 00 00 00 00 00 00 00 00 00 00 00 00 00 00
00 00 00 00 00 00 00 00 00 00 00 00 00 00 00 00
00 00 00 00 00 00 00 00 00 00 00 00 00 00 00 00
00 00 00 00 00 00 00 00 00 00 00 00 00 00 00 75

70 20 79 02 00 81 00 0b e3 05 80 00 e6 06 05 01
6b 6b 47 21 00 1d ea 0e 64 08 00 0f 70 08 80 7a
6a 52 5c c3 b5 66 52 f5 02 35 54 40 5e 40 5e 47
35 13 78 22 00 14 8f ff 10 84 ff 0e 9f 00 2f 80
1f 00 6f 08 9f 00 02 00 04 00 25 00 09 8f ff 10
8f ff 10 3c 78 80 7e 00 25 00 00 00 00 00 00 00
00 00 00 00 00 00 00 00 00 00 00 00 00 00 00 00
00 00 00 00 00 00 00 00 00 00 00 00 00 00 05 90

----------------

Block 0, Base EDID:
  EDID Structure Version & Revision: 1.4
  Vendor & Product Identification:
    Manufacturer: AUO
    Model: 10386
    Made in: week 15 of 2021
  Basic Display Parameters & Features:
    Digital display
    Bits per primary color channel: 10
    DisplayPort interface
    Maximum image size: 38 cm x 21 cm
    Gamma: 2.20
    Supported color formats: RGB 4:4:4
    First detailed timing does not include the native pixel format and preferred refresh rate
    Display supports continuous frequencies
  Color Characteristics:
    Red  : 0.6552, 0.3222
    Green: 0.2099, 0.7099
    Blue : 0.1503, 0.0595
    White: 0.3134, 0.3291
  Established Timings I & II: none
  Standard Timings: none
  Detailed Timing Descriptors:
    DTD 1:  3840x2160   60.021552 Hz  16:9    139.250 kHz    557.000000 MHz (381 mm x 214 mm)
                 Hfront   48 Hsync  32 Hback   80 Hpol P
                 Vfront    3 Vsync   5 Vback  152 Vpol N
    Display Range Limits:
      Monitor ranges (Range Limits Only): 60-120 Hz V, 279-279 kHz H, max dotclock 1110 MHz
    Alphanumeric Data String: 'PV7KJ.B173ZAN'
    Manufacturer-Specified Display Descriptor (0x00): 00 00 00 05 81 0f a8 00 02 00 00 0f 01 0a 20 20 '..............  '
  Extension blocks: 2
Checksum: 0xa4

----------------

Block 1, CTA-861 Extension Block:
  Revision: 3
  Native detailed modes: 0
  Colorimetry Data Block:
    BT2020RGB
  HDR Static Metadata Data Block:
    Electro optical transfer functions:
      Traditional gamma - SDR luminance range
      SMPTE ST2084
    Supported static metadata descriptors:
      Static metadata type 1
    Desired content max luminance: 107 (507.620 cd/m^2)
    Desired content max frame-average luminance: 107 (507.620 cd/m^2)
    Desired content min luminance: 71 (0.394 cd/m^2)
Checksum: 0x75  Unused space in Extension Block: 112 bytes

----------------

Block 2, DisplayID Extension Block:
  Version: 2.0
  Extension Count: 0
  Display Product Primary Use Case: None of the listed primary use cases; generic display
  CTA-861 DisplayID Data Block:
  Colorimetry Data Block:
    BT2020RGB
  HDR Static Metadata Data Block:
    Electro optical transfer functions:
      Traditional gamma - SDR luminance range
      SMPTE ST2084
    Supported static metadata descriptors:
      Static metadata type 1
    Desired content max luminance: 107 (507.620 cd/m^2)
    Desired content max frame-average luminance: 107 (507.620 cd/m^2)
    Desired content min luminance: 71 (0.394 cd/m^2)
  Display Parameters Data Block (0x21):
    Image size: 381.8 mm x 214.8 mm
    Display native pixel format: 3840x2160
    Scan Orientation: Left to Right, Top to Bottom
    Luminance Information: Minimum guaranteed value
    Color Information: CIE 1931
    Audio Speaker Information: not integrated
    Native Color Chromaticity:
      Primary #1:  (0.654785, 0.321777)
      Primary #2:  (0.209961, 0.709961)
      Primary #3:  (0.149902, 0.958252)
      White Point: (0.312988, 0.328857)
    Native Maximum Luminance (Full Coverage): 400.000000 cd/m^2
    Native Maximum Luminance (10% Rectangular Coverage): 400.000000 cd/m^2
    Native Minimum Luminance: 0.329834 cd/m^2
    Native Color Depth: 12 bpc
    Display Device Technology: Active Matrix LCD
    Native Gamma EOTF: 2.20
  Video Timing Modes Type 7 - Detailed Timings Data Block:
    DTD:  3840x2160  120.043103 Hz  16:9    278.500 kHz   1114.000000 MHz (aspect 16:9, no 3D stereo, preferred)
               Hfront   48 Hsync  32 Hback   80 Hpol P
               Vfront    3 Vsync   5 Vback  152 Vpol N
  Dynamic Video Timing Range Limits Data Block:
    Minimum Pixel Clock: 1114000 kHz
    Maximum Pixel Clock: 1114000 kHz
    Minimum Vertical Refresh Rate: 60 Hz
    Maximum Vertical Refresh Rate: 120 Hz
    Seamless Dynamic Video Timing Support: Yes
  Vendor-Specific Data Block (0x7e), OUI 00-00-00:
    00 00 00 00 00 00 00 00 00 00 00 00 00 00 00 00 '................'
    00 00 00 00 00 00 00 00 00 00 00 00 00 00 00 00 '................'
    00 00                                           '..'
  Checksum: 0x05
Checksum: 0x90

----------------

Warnings:

Block 0, Base EDID:
  Alphanumeric Data String: Non-ASCII character 0x80 at position 5, can cause problems.
  Missing Display Product Name.
Block 1, CTA-861 Extension Block:
  IT Video Formats are overscanned by default, but normally this should be underscanned.
  Colorimetry Data Block: Set the sRGB colorimetry bit to avoid interop issues.
Block 2, DisplayID Extension Block:
  Colorimetry Data Block: Set the sRGB colorimetry bit to avoid interop issues.
  Vendor-Specific Data Block (0x7e), OUI 00-00-00: Unknown OUI 00-00-00.
EDID:
  Base EDID: Some timings are out of range of the Monitor Ranges:
    Horizontal Freq: 139.250 - 278.500 kHz (Monitor: 279.000 - 279.000 kHz)
    Maximum Clock: 1114.000 MHz (Monitor: 1110.000 MHz)

Failures:

Block 1, CTA-861 Extension Block:
  Required 640x480p60 timings are missing in the established timings and the SVD list (VIC 1).
  Missing VCDB, needed for Set Selectable RGB Quantization to avoid interop issues.

EDID conformity: FAIL
