edid-decode (hex):

00 ff ff ff ff ff ff 00 4c 83 29 a0 00 00 00 00
31 19 01 04 a5 1d 10 78 02 44 81 af 50 3e b5 23
0e 50 54 00 00 00 01 01 01 01 01 01 01 01 01 01
01 01 01 01 01 01 9b 5e 00 a0 a0 a0 2c 50 30 20
36 00 26 a5 10 00 00 1a 9b 5e 00 a0 a0 a0 2c 50
30 20 36 00 26 a5 10 00 00 1a 00 00 00 fe 00 4a
4a 54 36 43 80 31 33 33 4b 4c 30 35 00 00 00 10
00 00 00 00 00 00 00 00 00 00 00 00 00 00 00 15

----------------

Block 0, Base EDID:
  EDID Structure Version & Revision: 1.4
  Vendor & Product Identification:
    Manufacturer: SDC
    Model: 41001
    Made in: week 49 of 2015
  Basic Display Parameters & Features:
    Digital display
    Bits per primary color channel: 8
    DisplayPort interface
    Maximum image size: 29 cm x 16 cm
    Gamma: 2.20
    Supported color formats: RGB 4:4:4
    First detailed timing includes the native pixel format and preferred refresh rate
  Color Characteristics:
    Red  : 0.6845, 0.3125
    Green: 0.2431, 0.7070
    Blue : 0.1386, 0.0546
    White: 0.3125, 0.3291
  Established Timings I & II: none
  Standard Timings: none
  Detailed Timing Descriptors:
    DTD 1:  2560x1440   60.000297 Hz  16:9     89.040 kHz    242.190000 MHz (294 mm x 165 mm)
                 Hfront   48 Hsync  32 Hback   80 Hpol P
                 Vfront    3 Vsync   6 Vback   35 Vpol N
    DTD 2:  2560x1440   60.000297 Hz  16:9     89.040 kHz    242.190000 MHz (294 mm x 165 mm)
                 Hfront   48 Hsync  32 Hback   80 Hpol P
                 Vfront    3 Vsync   6 Vback   35 Vpol N
    Alphanumeric Data String: 'JJT6C.133KL05'
    Dummy Descriptor:
Checksum: 0x15

----------------

Warnings:

Block 0, Base EDID:
  Alphanumeric Data String: Non-ASCII character 0x80 at position 5, can cause problems.
  Missing Display Product Name.

EDID conformity: PASS
