edid-decode (hex):

00 ff ff ff ff ff ff 00 44 0c 56 00 00 00 00 00
00 0f 01 03 80 21 15 78 0a bc a5 94 57 4f 8c 27
27 50 54 00 00 00 01 01 01 01 01 01 01 01 01 01
01 01 01 01 01 01 a8 2f 90 e0 60 1a 10 40 20 40
13 00 4b cf 10 00 00 19 00 00 00 0f 00 00 00 00
00 00 00 00 00 18 c0 04 10 00 00 00 00 fe 00 44
44 32 38 36 00 00 00 00 00 00 00 0a 00 00 00 fe
00 2a 39 44 4e 69 98 b2 ff 02 01 0a 20 20 00 08

00 ff ff ff ff ff ff 00 44 0c 56 00 00 00 00 00
00 0f 01 03 80 21 15 78 0a bc a5 94 57 4f 8c 27
27 50 54 00 00 00 01 01 01 01 01 01 01 01 01 01
01 01 01 01 01 01 a8 2f 90 e0 60 1a 10 40 20 40
13 00 4b cf 10 00 00 19 00 00 00 0f 00 00 00 00
00 00 00 00 00 18 c0 04 10 00 00 00 00 fe 00 44
44 32 38 36 00 00 00 00 00 00 00 0a 00 00 00 fe
00 2a 39 44 4e 69 98 b2 ff 02 01 0a 20 20 00 08

----------------

Block 0, Base EDID:
  EDID Structure Version & Revision: 1.3
  Vendor & Product Identification:
    Manufacturer: Q@L
    Model: 86
    Made in: 2005
  Basic Display Parameters & Features:
    Digital display
    Maximum image size: 33 cm x 21 cm
    Gamma: 2.20
    RGB color display
    First detailed timing is the preferred timing
  Color Characteristics:
    Red  : 0.5800, 0.3427
    Green: 0.3115, 0.5468
    Blue : 0.1542, 0.1542
    White: 0.3134, 0.3291
  Established Timings I & II: none
  Standard Timings: none
  Detailed Timing Descriptors:
    DTD 1:  1680x1050   60.108471 Hz  16:10    64.076 kHz    122.000000 MHz (331 mm x 207 mm)
                 Hfront   32 Hsync  64 Hback  128 Hpol N
                 Vfront    1 Vsync   3 Vback   12 Vpol N
    Manufacturer-Specified Display Descriptor (0x0f): 00 0f 00 00 00 00 00 00 00 00 00 18 c0 04 10 00 '................'
    Alphanumeric Data String: 'DD286'
    Alphanumeric Data String: '*9DNi..'
Checksum: 0x08

----------------

Block 1, Unknown EDID Extension Block 0x00:
  00 ff ff ff ff ff ff 00 44 0c 56 00 00 00 00 00 '........D.V.....'
  00 0f 01 03 80 21 15 78 0a bc a5 94 57 4f 8c 27 '.....!.x....WO.''
  27 50 54 00 00 00 01 01 01 01 01 01 01 01 01 01 ''PT.............'
  01 01 01 01 01 01 a8 2f 90 e0 60 1a 10 40 20 40 '......./..`..@ @'
  13 00 4b cf 10 00 00 19 00 00 00 0f 00 00 00 00 '..K.............'
  00 00 00 00 00 18 c0 04 10 00 00 00 00 fe 00 44 '...............D'
  44 32 38 36 00 00 00 00 00 00 00 0a 00 00 00 fe 'D286............'
  00 2a 39 44 4e 69 98 b2 ff 02 01 0a 20 20 00 08 '.*9DNi......  ..'
Checksum: 0x08

----------------

Warnings:

Block 0, Base EDID:
  Alphanumeric Data String: Non-ASCII character 0x98 at position 5, can cause problems.
  Alphanumeric Data String: Non-ASCII character 0xb2 at position 6, can cause problems.

Failures:

Block 0, Base EDID:
  Vendor & Product Identification: Manufacturer name field contains garbage.
  Alphanumeric Data String: NUL byte at position 5.
  Alphanumeric Data String: 0xff byte at position 7.
  Missing Display Product Name.
  Missing Display Range Limits Descriptor.
Block 1, Base EDID:
  Unknown Extension Block.
EDID:
  Base EDID: EDID specified 0 extension block(s), but found 1 extension block(s).

EDID conformity: FAIL
