edid-decode (hex):

00 ff ff ff ff ff ff 00 1e 6d c4 c3 01 01 01 01
10 12 01 03 80 46 27 78 ea d9 b0 a3 57 49 9c 25
11 49 4b a1 08 00 31 40 45 40 61 40 81 80 90 40
d1 c0 01 01 01 01 02 3a 80 18 71 38 2d 40 58 2c
45 00 c4 8e 21 00 00 1e 1b 21 50 a0 51 00 1e 30
48 88 35 00 bc 86 21 00 00 1c 00 00 00 fd 00 39
4b 1f 54 12 00 0a 20 20 20 20 20 20 00 00 00 fc
00 4c 47 54 56 0a 20 20 20 20 20 20 20 20 01 fc

02 03 24 f1 4f 06 07 02 11 01 03 12 13 04 14 05
1f 20 22 10 23 09 57 07 83 01 00 00 67 03 0c 00
10 00 b8 2d 01 1d 00 72 51 d0 1e 20 6e 28 55 00
c4 8e 21 00 00 1e 01 1d 00 bc 52 d0 1e 20 b8 28
55 40 c4 8e 21 00 00 1e 01 1d 80 d0 72 1c 16 20
10 2c 25 80 c4 8e 21 00 00 9e 8c 0a d0 90 20 40
31 20 0c 40 55 00 c4 8e 21 00 00 18 02 3a 80 d0
72 38 2d 40 10 2c 45 00 bc 88 21 00 00 18 00 04

----------------

Block 0, Base EDID:
  EDID Structure Version & Revision: 1.3
  Vendor & Product Identification:
    Manufacturer: GSM
    Model: 50116
    Serial Number: ...
    Made in: week 16 of 2008
  Basic Display Parameters & Features:
    Digital display
    Maximum image size: 70 cm x 39 cm
    Gamma: 2.20
    DPMS levels: Standby Suspend Off
    RGB color display
    First detailed timing is the preferred timing
  Color Characteristics:
    Red  : 0.6396, 0.3408
    Green: 0.2871, 0.6103
    Blue : 0.1464, 0.0693
    White: 0.2851, 0.2929
  Established Timings I & II:
    IBM     :   720x400    70.081663 Hz   9:5     31.467 kHz     28.320000 MHz
    DMT 0x04:   640x480    59.940476 Hz   4:3     31.469 kHz     25.175000 MHz
    DMT 0x09:   800x600    60.316541 Hz   4:3     37.879 kHz     40.000000 MHz
    DMT 0x10:  1024x768    60.003840 Hz   4:3     48.363 kHz     65.000000 MHz
  Standard Timings:
    DMT 0x04:   640x480    59.940476 Hz   4:3     31.469 kHz     25.175000 MHz
    DMT 0x09:   800x600    60.316541 Hz   4:3     37.879 kHz     40.000000 MHz
    DMT 0x10:  1024x768    60.003840 Hz   4:3     48.363 kHz     65.000000 MHz
    DMT 0x23:  1280x1024   60.019740 Hz   5:4     63.981 kHz    108.000000 MHz
    DMT 0x2a:  1400x1050   59.978442 Hz   4:3     65.317 kHz    121.750000 MHz
    DMT 0x52:  1920x1080   60.000000 Hz  16:9     67.500 kHz    148.500000 MHz
  Detailed Timing Descriptors:
    DTD 1:  1920x1080   60.000000 Hz  16:9     67.500 kHz    148.500000 MHz (708 mm x 398 mm)
                 Hfront   88 Hsync  44 Hback  148 Hpol P
                 Vfront    4 Vsync   5 Vback   36 Vpol P
    DTD 2:  1360x768    59.798991 Hz  85:48    47.720 kHz     84.750000 MHz (700 mm x 390 mm)
                 Hfront   72 Hsync 136 Hback  208 Hpol N
                 Vfront    3 Vsync   5 Vback   22 Vpol P
    Display Range Limits:
      Monitor ranges (GTF): 57-75 Hz V, 31-84 kHz H, max dotclock 180 MHz
    Display Product Name: 'LGTV'
  Extension blocks: 1
Checksum: 0xfc

----------------

Block 1, CTA-861 Extension Block:
  Revision: 3
  Underscans IT Video Formats by default
  Basic audio support
  Supports YCbCr 4:4:4
  Supports YCbCr 4:2:2
  Native DTDs: 1
  Video Data Block:
    VIC   6:  1440x480i   59.940060 Hz   4:3     15.734 kHz     27.000000 MHz
    VIC   7:  1440x480i   59.940060 Hz  16:9     15.734 kHz     27.000000 MHz
    VIC   2:   720x480    59.940060 Hz   4:3     31.469 kHz     27.000000 MHz
    VIC  17:   720x576    50.000000 Hz   4:3     31.250 kHz     27.000000 MHz
    VIC   1:   640x480    59.940476 Hz   4:3     31.469 kHz     25.175000 MHz
    VIC   3:   720x480    59.940060 Hz  16:9     31.469 kHz     27.000000 MHz
    VIC  18:   720x576    50.000000 Hz  16:9     31.250 kHz     27.000000 MHz
    VIC  19:  1280x720    50.000000 Hz  16:9     37.500 kHz     74.250000 MHz
    VIC   4:  1280x720    60.000000 Hz  16:9     45.000 kHz     74.250000 MHz
    VIC  20:  1920x1080i  50.000000 Hz  16:9     28.125 kHz     74.250000 MHz
    VIC   5:  1920x1080i  60.000000 Hz  16:9     33.750 kHz     74.250000 MHz
    VIC  31:  1920x1080   50.000000 Hz  16:9     56.250 kHz    148.500000 MHz
    VIC  32:  1920x1080   24.000000 Hz  16:9     27.000 kHz     74.250000 MHz
    VIC  34:  1920x1080   30.000000 Hz  16:9     33.750 kHz     74.250000 MHz
    VIC  16:  1920x1080   60.000000 Hz  16:9     67.500 kHz    148.500000 MHz
  Audio Data Block:
    Linear PCM:
      Max channels: 2
      Supported sample rates (kHz): 192 96 48 44.1 32
      Supported sample sizes (bits): 24 20 16
  Speaker Allocation Data Block:
    FL/FR - Front Left/Right
  Vendor-Specific Data Block (HDMI), OUI 00-0C-03:
    Source physical address: 1.0.0.0
    Supports_AI
    DC_36bit
    DC_30bit
    DC_Y444
    Maximum TMDS clock: 225 MHz
  Detailed Timing Descriptors:
    DTD 3:  1280x720    60.000000 Hz  16:9     45.000 kHz     74.250000 MHz (708 mm x 398 mm)
                 Hfront  110 Hsync  40 Hback  220 Hpol P
                 Vfront    5 Vsync   5 Vback   20 Vpol P
    DTD 4:  1280x720    50.000000 Hz  16:9     37.500 kHz     74.250000 MHz (708 mm x 398 mm)
                 Hfront  440 Hsync  40 Hback  220 Hpol P
                 Vfront    5 Vsync   5 Vback   20 Vpol P
    DTD 5:  1920x1080i  50.000000 Hz  16:9     28.125 kHz     74.250000 MHz (708 mm x 398 mm)
                 Hfront  528 Hsync  44 Hback  148 Hpol P
                 Vfront    2 Vsync   5 Vback   15 Vpol P Vfront +0.5 Odd Field
                 Vfront    2 Vsync   5 Vback   15 Vpol P Vback  +0.5 Even Field
    DTD 6:   720x576    50.000000 Hz   5:4     31.250 kHz     27.000000 MHz (708 mm x 398 mm)
                 Hfront   12 Hsync  64 Hback   68 Hpol N
                 Vfront    5 Vsync   5 Vback   39 Vpol N
    DTD 7:  1920x1080   50.000000 Hz  16:9     56.250 kHz    148.500000 MHz (700 mm x 392 mm)
                 Hfront   16 Hsync  44 Hback  660 Hpol N
                 Vfront    4 Vsync   5 Vback   36 Vpol N
Checksum: 0x04  Unused space in Extension Block: 1 byte

----------------

Warnings:

Block 0, Base EDID:
  Vendor & Product Identification: The serial number is one of the known dummy values, it should probably be set to 0.
Block 1, CTA-861 Extension Block:
  Video Data Block: VIC 6 and the first DTD are not identical. Is this intended?
  Detailed Timing Descriptor #6: Image size is 708x398 mm, but based on the picture AR it should be 497x398 mm.
  Detailed Timing Descriptor #7: DTD is similar but not identical to VIC 31.
  Add a Colorimetry Data Block with the sRGB colorimetry bit set to avoid interop issues.
EDID:
  Base EDID: Some timings are out of range of the Monitor Ranges:
    Vertical Freq: 24.000 - 70.082 Hz (Monitor: 57.000 - 75.000 Hz)
    Horizontal Freq: 15.734 - 67.500 kHz (Monitor: 31.000 - 84.000 kHz)

Failures:

Block 1, CTA-861 Extension Block:
  Missing VCDB, needed for Set Selectable RGB Quantization to avoid interop issues.

EDID conformity: FAIL
