edid-decode (hex):

00 ff ff ff ff ff ff 00 10 ac 20 40 32 52 45 41
2d 11 01 03 80 26 1e 78 ee ee 95 a3 54 4c 99 26
0f 50 54 a5 4b 00 71 4f 81 80 01 01 01 01 01 01
01 01 01 01 01 01 30 2a 00 98 51 00 2a 40 30 70
13 00 78 2d 11 00 00 1e 00 00 00 ff 00 43 43 33
38 38 37 42 36 41 45 52 32 0a 00 00 00 fc 00 44
45 4c 4c 20 31 39 30 37 46 50 56 0a 00 00 00 fd
00 38 4c 1e 51 0e 00 0a 20 20 20 20 20 20 00 94

00 ff ff ff ff ff ff 00 22 d2 01 aa 00 00 00 00
ff 1a 01 03 80 00 00 78 02 9a 8c aa 55 39 b7 23
0e 4c 52 00 00 00 01 01 01 01 01 01 01 01 01 01
01 01 01 01 01 01 04 74 70 6a 80 b0 08 41 28 14
c2 04 7a 44 00 00 00 18 04 74 70 6a 80 b0 08 41
28 14 c2 04 7a 44 00 00 00 18 00 00 00 fc 00 48
54 43 2d 56 49 56 45 0a 20 20 20 20 00 00 00 fd
00 14 78 01 ff 1e 01 0a 20 20 20 20 20 20 01 d7

02 03 15 40 42 01 02 23 09 07 01 83 01 00 00 65
03 0c 00 10 00 04 74 70 6a 80 b0 08 41 28 14 c2
04 7a 44 00 00 00 18 04 74 70 6a 80 b0 08 41 28
14 c2 04 7a 44 00 00 00 18 04 74 70 6a 80 b0 08
41 28 14 c2 04 7a 44 00 00 00 18 04 74 70 6a 80
b0 08 41 28 14 c2 04 7a 44 00 00 00 18 00 00 00
00 00 00 00 00 00 00 00 00 00 00 00 00 00 00 00
00 00 00 00 00 00 00 00 00 00 00 00 00 00 00 99

00 ff ff ff ff ff ff 00 10 ac 20 40 32 52 45 41
2d 11 01 03 80 26 1e 78 ee ee 95 a3 54 4c 99 26
0f 50 54 a5 4b 00 71 4f 81 80 01 01 01 01 01 01
01 01 01 01 01 01 30 2a 00 98 51 00 2a 40 30 70
13 00 78 2d 11 00 00 1e 00 00 00 ff 00 43 43 33
38 38 37 42 36 41 45 52 32 0a 00 00 00 fc 00 44
45 4c 4c 20 31 39 30 37 46 50 56 0a 00 00 00 fd
00 38 4c 1e 51 0e 00 0a 20 20 20 20 20 20 00 94

00 ff ff ff ff ff ff 00 22 d2 01 aa 00 00 00 00
ff 1a 01 03 80 00 00 78 02 9a 8c aa 55 39 b7 23
0e 4c 52 00 00 00 01 01 01 01 01 01 01 01 01 01
01 01 01 01 01 01 04 74 70 6a 80 b0 08 41 28 14
c2 04 7a 44 00 00 00 18 04 74 70 6a 80 b0 08 41
28 14 c2 04 7a 44 00 00 00 18 00 00 00 fc 00 48
54 43 2d 56 49 56 45 0a 20 20 20 20 00 00 00 fd
00 14 78 01 ff 1e 01 0a 20 20 20 20 20 20 01 d7

02 03 15 40 42 01 02 23 09 07 01 83 01 00 00 65
03 0c 00 10 00 04 74 70 6a 80 b0 08 41 28 14 c2
04 7a 44 00 00 00 18 04 74 70 6a 80 b0 08 41 28
14 c2 04 7a 44 00 00 00 18 04 74 70 6a 80 b0 08
41 28 14 c2 04 7a 44 00 00 00 18 04 74 70 6a 80
b0 08 41 28 14 c2 04 7a 44 00 00 00 18 00 00 00
00 00 00 00 00 00 00 00 00 00 00 00 00 00 00 00
00 00 00 00 00 00 00 00 00 00 00 00 00 00 00 99

----------------

Block 0, Base EDID:
  EDID Structure Version & Revision: 1.3
  Vendor & Product Identification:
    Manufacturer: DEL
    Model: 16416
    Serial Number: ...
    Made in: week 45 of 2007
  Basic Display Parameters & Features:
    Digital display
    Maximum image size: 38 cm x 30 cm
    Gamma: 2.20
    DPMS levels: Standby Suspend Off
    RGB color display
    Default (sRGB) color space is primary color space
    First detailed timing is the preferred timing
  Color Characteristics:
    Red  : 0.6396, 0.3300
    Green: 0.2998, 0.5996
    Blue : 0.1503, 0.0595
    White: 0.3134, 0.3291
  Established Timings I & II:
    IBM     :   720x400    70.081663 Hz   9:5     31.467 kHz     28.320000 MHz
    DMT 0x04:   640x480    59.940476 Hz   4:3     31.469 kHz     25.175000 MHz
    DMT 0x06:   640x480    75.000000 Hz   4:3     37.500 kHz     31.500000 MHz
    DMT 0x09:   800x600    60.316541 Hz   4:3     37.879 kHz     40.000000 MHz
    DMT 0x0b:   800x600    75.000000 Hz   4:3     46.875 kHz     49.500000 MHz
    DMT 0x10:  1024x768    60.003840 Hz   4:3     48.363 kHz     65.000000 MHz
    DMT 0x12:  1024x768    75.028582 Hz   4:3     60.023 kHz     78.750000 MHz
    DMT 0x24:  1280x1024   75.024675 Hz   5:4     79.976 kHz    135.000000 MHz
  Standard Timings:
    DMT 0x15:  1152x864    75.000000 Hz   4:3     67.500 kHz    108.000000 MHz
    DMT 0x23:  1280x1024   60.019740 Hz   5:4     63.981 kHz    108.000000 MHz
  Detailed Timing Descriptors:
    DTD 1:  1280x1024   60.019740 Hz   5:4     63.981 kHz    108.000000 MHz (376 mm x 301 mm)
                 Hfront   48 Hsync 112 Hback  248 Hpol P
                 Vfront    1 Vsync   3 Vback   38 Vpol P
    Display Product Serial Number: ...
    Display Product Name: 'DELL 1907FPV'
    Display Range Limits:
      Monitor ranges (GTF): 56-76 Hz V, 30-81 kHz H, max dotclock 140 MHz
Checksum: 0x94

----------------

Block 1, Unknown EDID Extension Block 0x00:
  00 ff ff ff ff ff ff 00 22 d2 01 aa 00 00 00 00 '........".......'
  ff 1a 01 03 80 00 00 78 02 9a 8c aa 55 39 b7 23 '.......x....U9.#'
  0e 4c 52 00 00 00 01 01 01 01 01 01 01 01 01 01 '.LR.............'
  01 01 01 01 01 01 04 74 70 6a 80 b0 08 41 28 14 '.......tpj...A(.'
  c2 04 7a 44 00 00 00 18 04 74 70 6a 80 b0 08 41 '..zD.....tpj...A'
  28 14 c2 04 7a 44 00 00 00 18 00 00 00 fc 00 48 '(...zD.........H'
  54 43 2d 56 49 56 45 0a 20 20 20 20 00 00 00 fd 'TC-VIVE.    ....'
  00 14 78 01 ff 1e 01 0a 20 20 20 20 20 20 01 d7 '..x.....      ..'
Checksum: 0xd7

----------------

Block 2, CTA-861 Extension Block:
  Revision: 3
  Basic audio support
  Native detailed modes: 0
  Video Data Block:
    VIC   1:   640x480    59.940476 Hz   4:3     31.469 kHz     25.175000 MHz
    VIC   2:   720x480    59.940060 Hz   4:3     31.469 kHz     27.000000 MHz
  Audio Data Block:
    Linear PCM:
      Max channels: 2
      Supported sample rates (kHz): 48 44.1 32
      Supported sample sizes (bits): 16
  Speaker Allocation Data Block:
    FL/FR - Front Left/Right
  Vendor-Specific Data Block (HDMI), OUI 00-0C-03:
    Source physical address: 1.0.0.0
  Detailed Timing Descriptors:
    DTD 2:  2160x1200   89.527296 Hz   9:5    131.068 kHz    297.000000 MHz (122 mm x 68 mm)
                 Hfront   40 Hsync  20 Hback   46 Hpol N
                 Vfront   28 Vsync   2 Vback  234 Vpol N
    DTD 3:  2160x1200   89.527296 Hz   9:5    131.068 kHz    297.000000 MHz (122 mm x 68 mm)
                 Hfront   40 Hsync  20 Hback   46 Hpol N
                 Vfront   28 Vsync   2 Vback  234 Vpol N
    DTD 4:  2160x1200   89.527296 Hz   9:5    131.068 kHz    297.000000 MHz (122 mm x 68 mm)
                 Hfront   40 Hsync  20 Hback   46 Hpol N
                 Vfront   28 Vsync   2 Vback  234 Vpol N
    DTD 5:  2160x1200   89.527296 Hz   9:5    131.068 kHz    297.000000 MHz (122 mm x 68 mm)
                 Hfront   40 Hsync  20 Hback   46 Hpol N
                 Vfront   28 Vsync   2 Vback  234 Vpol N
Checksum: 0x99  Unused space in Extension Block: 34 bytes

----------------

Block 3, Unknown EDID Extension Block 0x00:
  00 ff ff ff ff ff ff 00 10 ac 20 40 32 52 45 41 '.......... @2REA'
  2d 11 01 03 80 26 1e 78 ee ee 95 a3 54 4c 99 26 '-....&.x....TL.&'
  0f 50 54 a5 4b 00 71 4f 81 80 01 01 01 01 01 01 '.PT.K.qO........'
  01 01 01 01 01 01 30 2a 00 98 51 00 2a 40 30 70 '......0*..Q.*@0p'
  13 00 78 2d 11 00 00 1e 00 00 00 ff 00 43 43 33 '..x-.........CC3'
  38 38 37 42 36 41 45 52 32 0a 00 00 00 fc 00 44 '887B6AER2......D'
  45 4c 4c 20 31 39 30 37 46 50 56 0a 00 00 00 fd 'ELL 1907FPV.....'
  00 38 4c 1e 51 0e 00 0a 20 20 20 20 20 20 00 94 '.8L.Q...      ..'
Checksum: 0x94

----------------

Block 4, Unknown EDID Extension Block 0x00:
  00 ff ff ff ff ff ff 00 22 d2 01 aa 00 00 00 00 '........".......'
  ff 1a 01 03 80 00 00 78 02 9a 8c aa 55 39 b7 23 '.......x....U9.#'
  0e 4c 52 00 00 00 01 01 01 01 01 01 01 01 01 01 '.LR.............'
  01 01 01 01 01 01 04 74 70 6a 80 b0 08 41 28 14 '.......tpj...A(.'
  c2 04 7a 44 00 00 00 18 04 74 70 6a 80 b0 08 41 '..zD.....tpj...A'
  28 14 c2 04 7a 44 00 00 00 18 00 00 00 fc 00 48 '(...zD.........H'
  54 43 2d 56 49 56 45 0a 20 20 20 20 00 00 00 fd 'TC-VIVE.    ....'
  00 14 78 01 ff 1e 01 0a 20 20 20 20 20 20 01 d7 '..x.....      ..'
Checksum: 0xd7

----------------

Block 5, CTA-861 Extension Block:
  Revision: 3
  Basic audio support
  Native detailed modes: 0
  Video Data Block:
    VIC   1:   640x480    59.940476 Hz   4:3     31.469 kHz     25.175000 MHz
    VIC   2:   720x480    59.940060 Hz   4:3     31.469 kHz     27.000000 MHz
  Audio Data Block:
    Linear PCM:
      Max channels: 2
      Supported sample rates (kHz): 48 44.1 32
      Supported sample sizes (bits): 16
  Speaker Allocation Data Block:
    FL/FR - Front Left/Right
  Vendor-Specific Data Block (HDMI), OUI 00-0C-03:
    Source physical address: 1.0.0.0
  Detailed Timing Descriptors:
    DTD 6:  2160x1200   89.527296 Hz   9:5    131.068 kHz    297.000000 MHz (122 mm x 68 mm)
                 Hfront   40 Hsync  20 Hback   46 Hpol N
                 Vfront   28 Vsync   2 Vback  234 Vpol N
    DTD 7:  2160x1200   89.527296 Hz   9:5    131.068 kHz    297.000000 MHz (122 mm x 68 mm)
                 Hfront   40 Hsync  20 Hback   46 Hpol N
                 Vfront   28 Vsync   2 Vback  234 Vpol N
    DTD 8:  2160x1200   89.527296 Hz   9:5    131.068 kHz    297.000000 MHz (122 mm x 68 mm)
                 Hfront   40 Hsync  20 Hback   46 Hpol N
                 Vfront   28 Vsync   2 Vback  234 Vpol N
    DTD 9:  2160x1200   89.527296 Hz   9:5    131.068 kHz    297.000000 MHz (122 mm x 68 mm)
                 Hfront   40 Hsync  20 Hback   46 Hpol N
                 Vfront   28 Vsync   2 Vback  234 Vpol N
Checksum: 0x99  Unused space in Extension Block: 34 bytes

----------------

Warnings:

Block 2, CTA-861 Extension Block:
  IT Video Formats are overscanned by default, but normally this should be underscanned.
  Video Data Block: VIC 1 and the first DTD are not identical. Is this intended?
  Detailed Timing Descriptor #2: Dubious image size (122x68 mm is smaller than 100x100 mm).
  Detailed Timing Descriptor #3: Dubious image size (122x68 mm is smaller than 100x100 mm).
  Detailed Timing Descriptor #4: Dubious image size (122x68 mm is smaller than 100x100 mm).
  Detailed Timing Descriptor #5: Dubious image size (122x68 mm is smaller than 100x100 mm).
  Display Product Serial Number is set, so the Serial Number in the Base EDID should be 0.
Block 5, CTA-861 Extension Block:
  IT Video Formats are overscanned by default, but normally this should be underscanned.
  Detailed Timing Descriptor #6: Dubious image size (122x68 mm is smaller than 100x100 mm).
  Detailed Timing Descriptor #7: Dubious image size (122x68 mm is smaller than 100x100 mm).
  Detailed Timing Descriptor #8: Dubious image size (122x68 mm is smaller than 100x100 mm).
  Detailed Timing Descriptor #9: Dubious image size (122x68 mm is smaller than 100x100 mm).
EDID:
  Base EDID: Some timings are out of range of the Monitor Ranges:
    Vertical Freq: 59.940 - 89.527 Hz (Monitor: 56.000 - 76.000 Hz)
    Horizontal Freq: 31.466 - 131.067 kHz (Monitor: 30.000 - 81.000 kHz)
    Maximum Clock: 297.000 MHz (Monitor: 140.000 MHz)

Failures:

Block 0, Base EDID:
  Basic Display Parameters & Features: sRGB is signaled, but the chromaticities do not match.
Block 1, Base EDID:
  Unknown Extension Block.
Block 2, CTA-861 Extension Block:
  The HDMI Specification requires that the first Extension Block (that is not a Block Map) is an CTA-861 Extension Block.
  Detailed Timing Descriptor #2: Mismatch of image size 122x68 mm vs display size 380x300 mm.
  Detailed Timing Descriptor #3: Mismatch of image size 122x68 mm vs display size 380x300 mm.
  Detailed Timing Descriptor #4: Mismatch of image size 122x68 mm vs display size 380x300 mm.
  Detailed Timing Descriptor #5: Mismatch of image size 122x68 mm vs display size 380x300 mm.
  Missing VCDB, needed for Set Selectable RGB Quantization to avoid interop issues.
Block 3, Base EDID:
  Unknown Extension Block.
Block 4, Base EDID:
  Unknown Extension Block.
Block 5, CTA-861 Extension Block:
  Video Data Block: Duplicate VIC 1.
  Video Data Block: Duplicate VIC 2.
  Speaker Allocation Data Block: Only one instance of this Data Block is allowed.
  Detailed Timing Descriptor #6: Mismatch of image size 122x68 mm vs display size 380x300 mm.
  Detailed Timing Descriptor #7: Mismatch of image size 122x68 mm vs display size 380x300 mm.
  Detailed Timing Descriptor #8: Mismatch of image size 122x68 mm vs display size 380x300 mm.
  Detailed Timing Descriptor #9: Mismatch of image size 122x68 mm vs display size 380x300 mm.
EDID:
  Base EDID: EDID specified 0 extension block(s), but found 5 extension block(s).
  Base EDID: EDID 1.3 requires a Block Map Extension in Block 1 if there are more than 2 blocks in the EDID.

EDID conformity: FAIL
