edid-decode (hex):

00 ff ff ff ff ff ff 00 09 e5 f5 0a 00 00 00 00
34 1f 01 04 a5 1d 11 78 03 1a d5 a5 54 4c a0 26
0e 50 54 00 00 00 01 01 01 01 01 01 01 01 01 01
01 01 01 01 01 01 2a 36 80 a0 70 38 1f 40 30 20
35 00 26 a5 10 00 00 1a 00 00 00 fd 00 30 3c 43
43 0e 01 0a 20 20 20 20 20 20 00 00 00 fe 00 42
4f 45 20 4e 4a 0a 20 20 20 20 20 20 00 00 00 fe
00 4e 45 31 33 33 46 48 4d 2d 4e 36 37 0a 00 a3

00 ff ff ff ff ff ff 00 09 e5 f5 0a 00 00 00 00
34 1f 01 04 a5 1d 11 78 03 1a d5 a5 54 4c a0 26
0e 50 54 00 00 00 01 01 01 01 01 01 01 01 01 01
01 01 01 01 01 01 2a 36 80 a0 70 38 1f 40 30 20
35 00 26 a5 10 00 00 1a 00 00 00 fd 00 30 3c 43
43 0e 01 0a 20 20 20 20 20 20 00 00 00 fe 00 42
4f 45 20 4e 4a 0a 20 20 20 20 20 20 00 00 00 fe
00 4e 45 31 33 33 46 48 4d 2d 4e 36 37 0a 00 a3

----------------

Block 0, Base EDID:
  EDID Structure Version & Revision: 1.4
  Vendor & Product Identification:
    Manufacturer: BOE
    Model: 2805
    Made in: week 52 of 2021
  Basic Display Parameters & Features:
    Digital display
    Bits per primary color channel: 8
    DisplayPort interface
    Maximum image size: 29 cm x 17 cm
    Gamma: 2.20
    Supported color formats: RGB 4:4:4
    First detailed timing includes the native pixel format and preferred refresh rate
    Display supports continuous frequencies
  Color Characteristics:
    Red  : 0.6445, 0.3291
    Green: 0.2988, 0.6269
    Blue : 0.1513, 0.0556
    White: 0.3134, 0.3291
  Established Timings I & II: none
  Standard Timings: none
  Detailed Timing Descriptors:
    DTD 1:  1920x1080   60.003116 Hz  16:9     66.663 kHz    138.660000 MHz (294 mm x 165 mm)
                 Hfront   48 Hsync  32 Hback   80 Hpol P
                 Vfront    3 Vsync   5 Vback   23 Vpol N
    Display Range Limits:
      Monitor ranges (Range Limits Only): 48-60 Hz V, 67-67 kHz H, max dotclock 140 MHz
    Alphanumeric Data String: 'BOE NJ'
    Alphanumeric Data String: 'NE133FHM-N67'
Checksum: 0xa3

----------------

Block 1, Unknown EDID Extension Block 0x00:
  00 ff ff ff ff ff ff 00 09 e5 f5 0a 00 00 00 00 '................'
  34 1f 01 04 a5 1d 11 78 03 1a d5 a5 54 4c a0 26 '4......x....TL.&'
  0e 50 54 00 00 00 01 01 01 01 01 01 01 01 01 01 '.PT.............'
  01 01 01 01 01 01 2a 36 80 a0 70 38 1f 40 30 20 '......*6..p8.@0 '
  35 00 26 a5 10 00 00 1a 00 00 00 fd 00 30 3c 43 '5.&..........0<C'
  43 0e 01 0a 20 20 20 20 20 20 00 00 00 fe 00 42 'C...      .....B'
  4f 45 20 4e 4a 0a 20 20 20 20 20 20 00 00 00 fe 'OE NJ.      ....'
  00 4e 45 31 33 33 46 48 4d 2d 4e 36 37 0a 00 a3 '.NE133FHM-N67...'
Checksum: 0xa3

----------------

Warnings:

Block 0, Base EDID:
  Missing Display Product Name.

Failures:

Block 1, Base EDID:
  Unknown Extension Block.
EDID:
  Base EDID: EDID specified 0 extension block(s), but found 1 extension block(s).

EDID conformity: FAIL
