edid-decode (hex):

00 ff ff ff ff ff ff 00 25 d8 38 00 00 00 00 00
17 21 01 04 a5 1e 13 78 0b fd 8c a8 51 41 93 23
15 4a 4e 00 00 00 01 01 01 01 01 01 01 01 01 01
01 01 01 01 01 01 2c 41 80 4a 71 b0 24 40 10 10
3e 00 2e bc 10 00 00 18 00 00 00 0f 00 00 00 00
00 00 00 00 00 00 00 00 00 20 00 00 00 fe 00 46
31 34 30 4a 35 32 2d 34 30 31 20 20 00 00 00 fe
00 46 31 34 30 4a 35 32 2d 34 30 31 20 20 00 92

00 ff ff ff ff ff ff 00 25 d8 38 00 00 00 00 00
17 21 01 04 a5 1e 13 78 0b fd 8c a8 51 41 93 23
15 4a 4e 00 00 00 01 01 01 01 01 01 01 01 01 01
01 01 01 01 01 01 2c 41 80 4a 71 b0 24 40 10 10
3e 00 2e bc 10 00 00 18 00 00 00 0f 00 00 00 00
00 00 00 00 00 00 00 00 00 20 00 00 00 fe 00 46
31 34 30 4a 35 32 2d 34 30 31 20 20 00 00 00 fe
00 46 31 34 30 4a 35 32 2d 34 30 31 20 20 00 92

----------------

Block 0, Base EDID:
  EDID Structure Version & Revision: 1.4
  Vendor & Product Identification:
    Manufacturer: INX
    Model: 56
    Made in: week 23 of 2023
  Basic Display Parameters & Features:
    Digital display
    Bits per primary color channel: 8
    DisplayPort interface
    Maximum image size: 30 cm x 19 cm
    Gamma: 2.20
    Supported color formats: RGB 4:4:4, YCrCb 4:4:4
    First detailed timing includes the native pixel format and preferred refresh rate
    Display supports continuous frequencies
  Color Characteristics:
    Red  : 0.6591, 0.3193
    Green: 0.2568, 0.5751
    Blue : 0.1386, 0.0820
    White: 0.2919, 0.3046
  Established Timings I & II: none
  Standard Timings: none
  Detailed Timing Descriptors:
    DTD 1:  1920x1200   59.992808 Hz  16:10    74.151 kHz    166.840000 MHz (302 mm x 188 mm)
                 Hfront   16 Hsync  16 Hback  298 Hpol N
                 Vfront    3 Vsync  14 Vback   19 Vpol N
    Manufacturer-Specified Display Descriptor (0x0f): 00 0f 00 00 00 00 00 00 00 00 00 00 00 00 00 20 '............... '
    Alphanumeric Data String: 'F140J52-401  '
    Alphanumeric Data String: 'F140J52-401  '
Checksum: 0x92

----------------

Block 1, Unknown EDID Extension Block 0x00:
  00 ff ff ff ff ff ff 00 25 d8 38 00 00 00 00 00 '........%.8.....'
  17 21 01 04 a5 1e 13 78 0b fd 8c a8 51 41 93 23 '.!.....x....QA.#'
  15 4a 4e 00 00 00 01 01 01 01 01 01 01 01 01 01 '.JN.............'
  01 01 01 01 01 01 2c 41 80 4a 71 b0 24 40 10 10 '......,A.Jq.$@..'
  3e 00 2e bc 10 00 00 18 00 00 00 0f 00 00 00 00 '>...............'
  00 00 00 00 00 00 00 00 00 20 00 00 00 fe 00 46 '......... .....F'
  31 34 30 4a 35 32 2d 34 30 31 20 20 00 00 00 fe '140J52-401  ....'
  00 46 31 34 30 4a 35 32 2d 34 30 31 20 20 00 92 '.F140J52-401  ..'
Checksum: 0x92

----------------

Warnings:

Block 0, Base EDID:
  Missing Display Product Name.

Failures:

Block 0, Base EDID:
  Alphanumeric Data String: No newline, but one or more trailing spaces.
  Alphanumeric Data String: No newline, but one or more trailing spaces.
  Missing Display Range Limits Descriptor.
Block 1, Base EDID:
  Unknown Extension Block.
EDID:
  Base EDID: EDID specified 0 extension block(s), but found 1 extension block(s).

EDID conformity: FAIL
