edid-decode (hex):

00 ff ff ff ff ff ff 00 1c 54 06 32 01 01 01 01
0d 21 01 04 c5 46 27 78 fb b4 e5 ab 4f 47 a9 27
10 50 54 ff ff 80 71 4f 81 c0 81 00 81 40 81 80
95 00 a9 c0 b3 00 ad 5c 00 6e a0 a0 29 50 17 20
18 04 b9 88 21 00 00 1e 00 00 00 fd 00 30 aa f3
f3 3c 01 0a 20 20 20 20 20 20 00 00 00 fc 00 47
33 32 51 43 20 41 0a 20 20 20 20 20 00 00 00 ff
00 32 33 31 33 30 42 30 30 32 39 35 30 0a 02 2d

02 03 34 71 4e 03 02 12 13 04 29 2f 0f 1f 10 40
3f 60 61 23 09 17 07 83 01 00 00 6d 1a 00 00 02
03 30 aa 00 0f 66 28 66 28 e3 05 e3 01 e6 06 05
01 66 66 28 f5 bd 00 64 a0 a0 55 50 12 20 f8 0c
b9 88 21 00 00 1e 72 8d 80 50 70 38 12 40 1e 19
35 00 b9 88 21 00 00 1e 00 00 00 00 00 00 00 00
00 00 00 00 00 00 00 00 00 00 00 00 00 00 00 00
00 00 00 00 00 00 00 00 00 00 00 00 00 00 00 8d

70 12 79 03 00 03 01 14 6a fb 00 04 ff 09 59 00
09 80 1f 00 9f 05 1f 00 02 80 04 00 00 00 00 00
00 00 00 00 00 00 00 00 00 00 00 00 00 00 00 00
00 00 00 00 00 00 00 00 00 00 00 00 00 00 00 00
00 00 00 00 00 00 00 00 00 00 00 00 00 00 00 00
00 00 00 00 00 00 00 00 00 00 00 00 00 00 00 00
00 00 00 00 00 00 00 00 00 00 00 00 00 00 00 00
00 00 00 00 00 00 00 00 00 00 00 00 00 00 9f 90

00 ff ff ff ff ff ff 00 1c 54 06 32 01 01 01 01
0d 21 01 04 c5 46 27 78 fb b4 e5 ab 4f 47 a9 27
10 50 54 ff ff 80 71 4f 81 c0 81 00 81 40 81 80
95 00 a9 c0 b3 00 ad 5c 00 6e a0 a0 29 50 17 20
18 04 b9 88 21 00 00 1e 00 00 00 fd 00 30 aa f3
f3 3c 01 0a 20 20 20 20 20 20 00 00 00 fc 00 47
33 32 51 43 20 41 0a 20 20 20 20 20 00 00 00 ff
00 32 33 31 33 30 42 30 30 32 39 35 30 0a 02 2d

02 03 34 71 4e 03 02 12 13 04 29 2f 0f 1f 10 40
3f 60 61 23 09 17 07 83 01 00 00 6d 1a 00 00 02
03 30 aa 00 0f 66 28 66 28 e3 05 e3 01 e6 06 05
01 66 66 28 f5 bd 00 64 a0 a0 55 50 12 20 f8 0c
b9 88 21 00 00 1e 72 8d 80 50 70 38 12 40 1e 19
35 00 b9 88 21 00 00 1e 00 00 00 00 00 00 00 00
00 00 00 00 00 00 00 00 00 00 00 00 00 00 00 00
00 00 00 00 00 00 00 00 00 00 00 00 00 00 00 8d

70 12 79 03 00 03 01 14 6a fb 00 04 ff 09 59 00
09 80 1f 00 9f 05 1f 00 02 80 04 00 00 00 00 00
00 00 00 00 00 00 00 00 00 00 00 00 00 00 00 00
00 00 00 00 00 00 00 00 00 00 00 00 00 00 00 00
00 00 00 00 00 00 00 00 00 00 00 00 00 00 00 00
00 00 00 00 00 00 00 00 00 00 00 00 00 00 00 00
00 00 00 00 00 00 00 00 00 00 00 00 00 00 00 00
00 00 00 00 00 00 00 00 00 00 00 00 00 00 9f 90

----------------

Block 0, Base EDID:
  EDID Structure Version & Revision: 1.4
  Vendor & Product Identification:
    Manufacturer: GBT
    Model: 12806
    Serial Number: ...
    Made in: week 13 of 2023
  Basic Display Parameters & Features:
    Digital display
    Bits per primary color channel: 12
    DisplayPort interface
    Maximum image size: 70 cm x 39 cm
    Gamma: 2.20
    DPMS levels: Standby Suspend Off
    Supported color formats: RGB 4:4:4, YCrCb 4:4:4, YCrCb 4:2:2
    First detailed timing includes the native pixel format and preferred refresh rate
    Display supports continuous frequencies
  Color Characteristics:
    Red  : 0.6699, 0.3115
    Green: 0.2783, 0.6601
    Blue : 0.1552, 0.0644
    White: 0.3134, 0.3291
  Established Timings I & II:
    IBM     :   720x400    70.081663 Hz   9:5     31.467 kHz     28.320000 MHz
    IBM     :   720x400    87.849542 Hz   9:5     39.444 kHz     35.500000 MHz
    DMT 0x04:   640x480    59.940476 Hz   4:3     31.469 kHz     25.175000 MHz
    Apple   :   640x480    66.666667 Hz   4:3     35.000 kHz     30.240000 MHz
    DMT 0x05:   640x480    72.808802 Hz   4:3     37.861 kHz     31.500000 MHz
    DMT 0x06:   640x480    75.000000 Hz   4:3     37.500 kHz     31.500000 MHz
    DMT 0x08:   800x600    56.250000 Hz   4:3     35.156 kHz     36.000000 MHz
    DMT 0x09:   800x600    60.316541 Hz   4:3     37.879 kHz     40.000000 MHz
    DMT 0x0a:   800x600    72.187572 Hz   4:3     48.077 kHz     50.000000 MHz
    DMT 0x0b:   800x600    75.000000 Hz   4:3     46.875 kHz     49.500000 MHz
    Apple   :   832x624    74.551266 Hz   4:3     49.726 kHz     57.284000 MHz
    DMT 0x0f:  1024x768i   86.957532 Hz   4:3     35.522 kHz     44.900000 MHz
    DMT 0x10:  1024x768    60.003840 Hz   4:3     48.363 kHz     65.000000 MHz
    DMT 0x11:  1024x768    70.069359 Hz   4:3     56.476 kHz     75.000000 MHz
    DMT 0x12:  1024x768    75.028582 Hz   4:3     60.023 kHz     78.750000 MHz
    DMT 0x24:  1280x1024   75.024675 Hz   5:4     79.976 kHz    135.000000 MHz
    Apple   :  1152x870    75.061550 Hz 192:145   68.681 kHz    100.000000 MHz
  Standard Timings:
    DMT 0x15:  1152x864    75.000000 Hz   4:3     67.500 kHz    108.000000 MHz
    DMT 0x55:  1280x720    60.000000 Hz  16:9     45.000 kHz     74.250000 MHz
    DMT 0x1c:  1280x800    59.810326 Hz  16:10    49.702 kHz     83.500000 MHz
    DMT 0x20:  1280x960    60.000000 Hz   4:3     60.000 kHz    108.000000 MHz
    DMT 0x23:  1280x1024   60.019740 Hz   5:4     63.981 kHz    108.000000 MHz
    DMT 0x2f:  1440x900    59.887445 Hz  16:10    55.935 kHz    106.500000 MHz
    DMT 0x53:  1600x900    60.000000 Hz  16:9     60.000 kHz    108.000000 MHz (RB)
    DMT 0x3a:  1680x1050   59.954250 Hz  16:10    65.290 kHz    146.250000 MHz
  Detailed Timing Descriptors:
    DTD 1:  2560x1440   59.998432 Hz  16:9     88.858 kHz    237.250000 MHz (697 mm x 392 mm)
                 Hfront   23 Hsync  32 Hback   55 Hpol P
                 Vfront   17 Vsync   8 Vback   16 Vpol P
    Display Range Limits:
      Monitor ranges (Range Limits Only): 48-170 Hz V, 243-243 kHz H, max dotclock 600 MHz
    Display Product Name: 'G32QC A'
    Display Product Serial Number: ...
  Extension blocks: 2
Checksum: 0x2d

----------------

Block 1, CTA-861 Extension Block:
  Revision: 3
  Basic audio support
  Supports YCbCr 4:4:4
  Supports YCbCr 4:2:2
  Native DTDs: 1
  Video Data Block:
    VIC   3:   720x480    59.940060 Hz  16:9     31.469 kHz     27.000000 MHz
    VIC   2:   720x480    59.940060 Hz   4:3     31.469 kHz     27.000000 MHz
    VIC  18:   720x576    50.000000 Hz  16:9     31.250 kHz     27.000000 MHz
    VIC  19:  1280x720    50.000000 Hz  16:9     37.500 kHz     74.250000 MHz
    VIC   4:  1280x720    60.000000 Hz  16:9     45.000 kHz     74.250000 MHz
    VIC  41:  1280x720   100.000000 Hz  16:9     75.000 kHz    148.500000 MHz
    VIC  47:  1280x720   120.000000 Hz  16:9     90.000 kHz    148.500000 MHz
    VIC  15:  1440x480    59.940060 Hz  16:9     31.469 kHz     54.000000 MHz
    VIC  31:  1920x1080   50.000000 Hz  16:9     56.250 kHz    148.500000 MHz
    VIC  16:  1920x1080   60.000000 Hz  16:9     67.500 kHz    148.500000 MHz
    VIC  64:  1920x1080  100.000000 Hz  16:9    112.500 kHz    297.000000 MHz
    VIC  63:  1920x1080  120.000000 Hz  16:9    135.000 kHz    297.000000 MHz
    VIC  96:  3840x2160   50.000000 Hz  16:9    112.500 kHz    594.000000 MHz
    VIC  97:  3840x2160   60.000000 Hz  16:9    135.000 kHz    594.000000 MHz
  Audio Data Block:
    Linear PCM:
      Max channels: 2
      Supported sample rates (kHz): 96 48 44.1 32
      Supported sample sizes (bits): 24 20 16
  Speaker Allocation Data Block:
    FL/FR - Front Left/Right
  Vendor-Specific Data Block (AMD), OUI 00-00-1A:
    Version: 2
    Feature Caps: 0x03
    Minimum Refresh Rate: 48 Hz
    Maximum Refresh Rate: 170 Hz
    Flags 1.x: 0x00
    Flags 2.x: 0x0f
      ST 2084 (PQ) EOTF Supported
      Linear EOTF (Windows scRGB, 0.0 - 125.0) Supported
      Gamma 2.2 EOTF Supported
      BT.2020 Gamut Supported
    Maximum luminance: 102 (455.515 cd/m^2)
    Minimum luminance: 40 (0.112 cd/m^2)
  Colorimetry Data Block:
    xvYCC601
    xvYCC709
    BT2020cYCC
    BT2020YCC
    BT2020RGB
    Gamut Boundary Description Metadata Profile P0
  HDR Static Metadata Data Block:
    Electro optical transfer functions:
      Traditional gamma - SDR luminance range
      SMPTE ST2084
    Supported static metadata descriptors:
      Static metadata type 1
    Desired content max luminance: 102 (455.515 cd/m^2)
    Desired content max frame-average luminance: 102 (455.515 cd/m^2)
    Desired content min luminance: 40 (0.112 cd/m^2)
  Detailed Timing Descriptors:
    DTD 2:  2560x1440  119.879206 Hz  16:9    182.816 kHz    486.290000 MHz (697 mm x 392 mm)
                 Hfront   18 Hsync  32 Hback   50 Hpol P
                 Vfront   63 Vsync   8 Vback   14 Vpol P
    DTD 3:  1920x1080  164.890710 Hz  16:9    181.050 kHz    362.100000 MHz (697 mm x 392 mm)
                 Hfront   30 Hsync  25 Hback   25 Hpol P
                 Vfront    3 Vsync   5 Vback   10 Vpol P
Checksum: 0x8d  Unused space in Extension Block: 39 bytes

----------------

Block 2, DisplayID Extension Block:
  Version: 1.2
  Extension Count: 0
  Display Product Type: Standalone display device
  Video Timing Modes Type 1 - Detailed Timings Data Block:
    DTD:  2560x1440  164.999487 Hz  16:9    242.879 kHz    643.630000 MHz (aspect 16:9, no 3D stereo)
               Hfront   10 Hsync  32 Hback   48 Hpol P
               Vfront    3 Vsync   5 Vback   24 Vpol P
  Checksum: 0x9f
Checksum: 0x90

----------------

Warnings:

Block 0, Base EDID:
  Vendor & Product Identification: The serial number is one of the known dummy values, it should probably be set to 0.
Block 1, CTA-861 Extension Block:
  IT Video Formats are overscanned by default, but normally this should be underscanned.
  Video Data Block: VIC 3 and the first DTD are not identical. Is this intended?
  Colorimetry Data Block: Set the sRGB colorimetry bit to avoid interop issues.
  Display Product Serial Number is set, so the Serial Number in the Base EDID should be 0.
EDID:
  Base EDID: Some timings are out of range of the Monitor Ranges:
    Horizontal Freq: 31.250 - 242.879 kHz (Monitor: 243.000 - 243.000 kHz)
    Maximum Clock: 643.630 MHz (Monitor: 600.000 MHz)

Failures:

Block 1, CTA-861 Extension Block:
  Missing VCDB, needed for Set Selectable RGB Quantization to avoid interop issues.
EDID:
  Extension Block 3 started with EDID header, ignoring Extension Blocks >= 3.
  DisplayID: Missing DisplayID Display Parameters Data Block.
  DisplayID: DisplayID expects at least one preferred timing.

EDID conformity: FAIL
