edid-decode (hex):

00 ff ff ff ff ff ff 00 30 64 07 23 30 30 31 30
20 13 01 03 90 1a 10 78 0a 87 f5 94 57 4f 8c 27
27 50 54 00 00 00 01 01 01 01 01 01 01 01 01 01
01 01 01 01 01 01 4e 20 00 7c 51 20 1f 30 48 80
36 00 05 a3 10 00 00 1a fe 15 00 9e 51 20 1f 30
48 80 36 00 05 a3 10 00 00 1a 00 00 00 fe 00 4e
55 34 31 32 80 31 32 31 45 57 55 0a 00 00 00 fe
00 00 00 00 00 00 00 00 00 01 01 0a 20 20 00 84

00 ff ff ff ff ff ff 00 30 64 07 23 30 30 31 30
20 13 01 03 90 1a 10 78 0a 87 f5 94 57 4f 8c 27
27 50 54 00 00 00 01 01 01 01 01 01 01 01 01 01
01 01 01 01 01 01 4e 20 00 7c 51 20 1f 30 48 80
36 00 05 a3 10 00 00 1a fe 15 00 9e 51 20 1f 30
48 80 36 00 05 a3 10 00 00 1a 00 00 00 fe 00 4e
55 34 31 32 80 31 32 31 45 57 55 0a 00 00 00 fe
00 00 00 00 00 00 00 00 00 01 01 0a 20 20 00 84

----------------

Block 0, Base EDID:
  EDID Structure Version & Revision: 1.3
  Vendor & Product Identification:
    Manufacturer: LCD
    Model: 8967
    Serial Number: ...
    Made in: week 32 of 2009
  Basic Display Parameters & Features:
    Digital display
    Maximum image size: 26 cm x 16 cm
    Gamma: 2.20
    RGB color display
    First detailed timing is the preferred timing
  Color Characteristics:
    Red  : 0.5800, 0.3398
    Green: 0.3095, 0.5498
    Blue : 0.1552, 0.1552
    White: 0.3134, 0.3291
  Established Timings I & II: none
  Standard Timings: none
  Detailed Timing Descriptors:
    DTD 1:  1280x800    59.950995 Hz  16:10    49.819 kHz     82.700000 MHz (261 mm x 163 mm)
                 Hfront   72 Hsync 128 Hback  180 Hpol P
                 Vfront    3 Vsync   6 Vback   22 Vpol N
    DTD 2:  1280x800    39.993919 Hz  16:10    33.235 kHz     56.300000 MHz (261 mm x 163 mm)
                 Hfront   72 Hsync 128 Hback  214 Hpol P
                 Vfront    3 Vsync   6 Vback   22 Vpol N
    SPWG Module Revision: 26
    SPWG Descriptor #3:
      SPWG PC Maker P/N: 'NU412'
      SPWG LCD Supplier EEDID Revision: 128
      SPWG Manufacturer P/N: '121EWU'
    SPWG Descriptor #4:
      SMBUS Values: 0x00 0x00 0x00 0x00 0x00 0x00 0x00 0x00
      LVDS Channels: 1
      Panel Self Test Present
Checksum: 0x84

----------------

Failures:

Block 0, Base EDID:
  Basic Display Parameters & Features: Digital Video Interface Standard set to reserved value 0x10.
  Missing Display Product Name.
  Missing Display Range Limits Descriptor.
EDID:
  Extension Block 1 started with EDID header, ignoring Extension Blocks >= 1.

EDID conformity: FAIL
