edid-decode (hex):

00 ff ff ff ff ff ff 00 22 64 7f 22 01 01 01 01
04 0a 01 03 80 33 1d 78 ea dc 55 a3 59 48 9e 24
11 50 54 a5 6b 00 81 80 a9 40 90 40 b3 00 01 01
01 01 01 01 01 01 02 3a 80 18 71 38 2d 40 58 2c
45 00 fd 1e 11 00 00 1e 00 00 00 fc 00 48 61 6e
6e 73 2e 47 20 48 48 32 33 31 00 00 00 fd 00 38
4b 18 53 11 00 0a 20 20 20 20 20 20 00 00 00 ff
00 30 30 34 54 4b 33 58 59 30 31 31 35 36 01 a0

02 03 29 f1 23 09 7f 07 4f 90 01 02 03 06 07 15
16 11 12 13 04 05 14 1f 83 01 00 00 6c 03 0c 00
10 00 b8 2d c0 01 01 01 01 8c 0a d0 8a 20 e0 2d
10 10 3e 96 00 fd 1e 11 00 00 18 8c 0a d0 90 20
40 31 20 0c 40 55 00 fd 1e 11 00 00 18 01 1d 80
18 71 1c 16 20 58 2c 25 00 fd 1e 11 00 00 9e 01
1d 80 d0 72 1c 16 20 10 2c 25 80 fd 1e 11 00 00
9e 00 00 00 00 00 00 00 00 00 00 00 00 00 00 3e

00 ff ff ff ff ff ff 00 22 64 7f 22 01 01 01 01
04 0a 01 03 80 33 1d 78 ea dc 55 a3 59 48 9e 24
11 50 54 a5 6b 00 81 80 a9 40 90 40 b3 00 01 01
01 01 01 01 01 01 02 3a 80 18 71 38 2d 40 58 2c
45 00 fd 1e 11 00 00 1e 00 00 00 fc 00 48 61 6e
6e 73 2e 47 20 48 48 32 33 31 00 00 00 fd 00 38
4b 18 53 11 00 0a 20 20 20 20 20 20 00 00 00 ff
00 30 30 34 54 4b 33 58 59 30 31 31 35 36 01 a0

02 03 29 f1 23 09 7f 07 4f 90 01 02 03 06 07 15
16 11 12 13 04 05 14 1f 83 01 00 00 6c 03 0c 00
10 00 b8 2d c0 01 01 01 01 8c 0a d0 8a 20 e0 2d
10 10 3e 96 00 fd 1e 11 00 00 18 8c 0a d0 90 20
40 31 20 0c 40 55 00 fd 1e 11 00 00 18 01 1d 80
18 71 1c 16 20 58 2c 25 00 fd 1e 11 00 00 9e 01
1d 80 d0 72 1c 16 20 10 2c 25 80 fd 1e 11 00 00
9e 00 00 00 00 00 00 00 00 00 00 00 00 00 00 3e

----------------

Block 0, Base EDID:
  EDID Structure Version & Revision: 1.3
  Vendor & Product Identification:
    Manufacturer: HSD
    Model: 8831
    Serial Number: ...
    Made in: week 4 of 2000
  Basic Display Parameters & Features:
    Digital display
    Maximum image size: 51 cm x 29 cm
    Gamma: 2.20
    DPMS levels: Standby Suspend Off
    RGB color display
    First detailed timing is the preferred timing
  Color Characteristics:
    Red  : 0.6396, 0.3486
    Green: 0.2841, 0.6171
    Blue : 0.1416, 0.0673
    White: 0.3134, 0.3291
  Established Timings I & II:
    IBM     :   720x400    70.081663 Hz   9:5     31.467 kHz     28.320000 MHz
    DMT 0x04:   640x480    59.940476 Hz   4:3     31.469 kHz     25.175000 MHz
    DMT 0x06:   640x480    75.000000 Hz   4:3     37.500 kHz     31.500000 MHz
    DMT 0x09:   800x600    60.316541 Hz   4:3     37.879 kHz     40.000000 MHz
    DMT 0x0b:   800x600    75.000000 Hz   4:3     46.875 kHz     49.500000 MHz
    Apple   :   832x624    74.551266 Hz   4:3     49.726 kHz     57.284000 MHz
    DMT 0x10:  1024x768    60.003840 Hz   4:3     48.363 kHz     65.000000 MHz
    DMT 0x12:  1024x768    75.028582 Hz   4:3     60.023 kHz     78.750000 MHz
    DMT 0x24:  1280x1024   75.024675 Hz   5:4     79.976 kHz    135.000000 MHz
  Standard Timings:
    DMT 0x23:  1280x1024   60.019740 Hz   5:4     63.981 kHz    108.000000 MHz
    DMT 0x33:  1600x1200   60.000000 Hz   4:3     75.000 kHz    162.000000 MHz
    DMT 0x2a:  1400x1050   59.978442 Hz   4:3     65.317 kHz    121.750000 MHz
    DMT 0x3a:  1680x1050   59.954250 Hz  16:10    65.290 kHz    146.250000 MHz
  Detailed Timing Descriptors:
    DTD 1:  1920x1080   60.000000 Hz  16:9     67.500 kHz    148.500000 MHz (509 mm x 286 mm)
                 Hfront   88 Hsync  44 Hback  148 Hpol P
                 Vfront    4 Vsync   5 Vback   36 Vpol P
    Display Product Name: 'Hanns.G HH231'
    Display Range Limits:
      Monitor ranges (GTF): 56-75 Hz V, 24-83 kHz H, max dotclock 170 MHz
    Display Product Serial Number: ...
  Extension blocks: 1
Checksum: 0xa0

----------------

Block 1, CTA-861 Extension Block:
  Revision: 3
  Underscans IT Video Formats by default
  Basic audio support
  Supports YCbCr 4:4:4
  Supports YCbCr 4:2:2
  Native detailed modes: 1
  Audio Data Block:
    Linear PCM:
      Max channels: 2
      Supported sample rates (kHz): 192 176.4 96 88.2 48 44.1 32
      Supported sample sizes (bits): 24 20 16
  Video Data Block:
    VIC  16:  1920x1080   60.000000 Hz  16:9     67.500 kHz    148.500000 MHz (native)
    VIC   1:   640x480    59.940476 Hz   4:3     31.469 kHz     25.175000 MHz
    VIC   2:   720x480    59.940060 Hz   4:3     31.469 kHz     27.000000 MHz
    VIC   3:   720x480    59.940060 Hz  16:9     31.469 kHz     27.000000 MHz
    VIC   6:  1440x480i   59.940060 Hz   4:3     15.734 kHz     27.000000 MHz
    VIC   7:  1440x480i   59.940060 Hz  16:9     15.734 kHz     27.000000 MHz
    VIC  21:  1440x576i   50.000000 Hz   4:3     15.625 kHz     27.000000 MHz
    VIC  22:  1440x576i   50.000000 Hz  16:9     15.625 kHz     27.000000 MHz
    VIC  17:   720x576    50.000000 Hz   4:3     31.250 kHz     27.000000 MHz
    VIC  18:   720x576    50.000000 Hz  16:9     31.250 kHz     27.000000 MHz
    VIC  19:  1280x720    50.000000 Hz  16:9     37.500 kHz     74.250000 MHz
    VIC   4:  1280x720    60.000000 Hz  16:9     45.000 kHz     74.250000 MHz
    VIC   5:  1920x1080i  60.000000 Hz  16:9     33.750 kHz     74.250000 MHz
    VIC  20:  1920x1080i  50.000000 Hz  16:9     28.125 kHz     74.250000 MHz
    VIC  31:  1920x1080   50.000000 Hz  16:9     56.250 kHz    148.500000 MHz
  Speaker Allocation Data Block:
    FL/FR - Front Left/Right
  Vendor-Specific Data Block (HDMI), OUI 00-0C-03:
    Source physical address: 1.0.0.0
    Supports_AI
    DC_36bit
    DC_30bit
    DC_Y444
    Maximum TMDS clock: 225 MHz
    Video latency: 0 ms
    Audio latency: 0 ms
    Interlaced video latency: 0 ms
    Interlaced audio latency: 0 ms
  Detailed Timing Descriptors:
    DTD 2:   720x480    59.940060 Hz   3:2     31.469 kHz     27.000000 MHz (509 mm x 286 mm)
                 Hfront   16 Hsync  62 Hback   60 Hpol N
                 Vfront    9 Vsync   6 Vback   30 Vpol N
    DTD 3:   720x576    50.000000 Hz   5:4     31.250 kHz     27.000000 MHz (509 mm x 286 mm)
                 Hfront   12 Hsync  64 Hback   68 Hpol N
                 Vfront    5 Vsync   5 Vback   39 Vpol N
    DTD 4:  1920x1080i  60.000000 Hz  16:9     33.750 kHz     74.250000 MHz (509 mm x 286 mm)
                 Hfront   88 Hsync  44 Hback  148 Hpol P
                 Vfront    2 Vsync   5 Vback   15 Vpol P Vfront +0.5 Odd Field
                 Vfront    2 Vsync   5 Vback   15 Vpol P Vback  +0.5 Even Field
    DTD 5:  1920x1080i  50.000000 Hz  16:9     28.125 kHz     74.250000 MHz (509 mm x 286 mm)
                 Hfront  528 Hsync  44 Hback  148 Hpol P
                 Vfront    2 Vsync   5 Vback   15 Vpol P Vfront +0.5 Odd Field
                 Vfront    2 Vsync   5 Vback   15 Vpol P Vback  +0.5 Even Field
Checksum: 0x3e  Unused space in Extension Block: 14 bytes

----------------

Block 2, Unknown EDID Extension Block 0x00:
  00 ff ff ff ff ff ff 00 22 64 7f 22 01 01 01 01 '........"d."....'
  04 0a 01 03 80 33 1d 78 ea dc 55 a3 59 48 9e 24 '.....3.x..U.YH.$'
  11 50 54 a5 6b 00 81 80 a9 40 90 40 b3 00 01 01 '.PT.k....@.@....'
  01 01 01 01 01 01 02 3a 80 18 71 38 2d 40 58 2c '.......:..q8-@X,'
  45 00 fd 1e 11 00 00 1e 00 00 00 fc 00 48 61 6e 'E............Han'
  6e 73 2e 47 20 48 48 32 33 31 00 00 00 fd 00 38 'ns.G HH231.....8'
  4b 18 53 11 00 0a 20 20 20 20 20 20 00 00 00 ff 'K.S...      ....'
  00 30 30 34 54 4b 33 58 59 30 31 31 35 36 01 a0 '.004TK3XY01156..'
Checksum: 0xa0

----------------

Block 3, CTA-861 Extension Block:
  Revision: 3
  Underscans IT Video Formats by default
  Basic audio support
  Supports YCbCr 4:4:4
  Supports YCbCr 4:2:2
  Native detailed modes: 1
  Audio Data Block:
    Linear PCM:
      Max channels: 2
      Supported sample rates (kHz): 192 176.4 96 88.2 48 44.1 32
      Supported sample sizes (bits): 24 20 16
  Video Data Block:
    VIC  16:  1920x1080   60.000000 Hz  16:9     67.500 kHz    148.500000 MHz (native)
    VIC   1:   640x480    59.940476 Hz   4:3     31.469 kHz     25.175000 MHz
    VIC   2:   720x480    59.940060 Hz   4:3     31.469 kHz     27.000000 MHz
    VIC   3:   720x480    59.940060 Hz  16:9     31.469 kHz     27.000000 MHz
    VIC   6:  1440x480i   59.940060 Hz   4:3     15.734 kHz     27.000000 MHz
    VIC   7:  1440x480i   59.940060 Hz  16:9     15.734 kHz     27.000000 MHz
    VIC  21:  1440x576i   50.000000 Hz   4:3     15.625 kHz     27.000000 MHz
    VIC  22:  1440x576i   50.000000 Hz  16:9     15.625 kHz     27.000000 MHz
    VIC  17:   720x576    50.000000 Hz   4:3     31.250 kHz     27.000000 MHz
    VIC  18:   720x576    50.000000 Hz  16:9     31.250 kHz     27.000000 MHz
    VIC  19:  1280x720    50.000000 Hz  16:9     37.500 kHz     74.250000 MHz
    VIC   4:  1280x720    60.000000 Hz  16:9     45.000 kHz     74.250000 MHz
    VIC   5:  1920x1080i  60.000000 Hz  16:9     33.750 kHz     74.250000 MHz
    VIC  20:  1920x1080i  50.000000 Hz  16:9     28.125 kHz     74.250000 MHz
    VIC  31:  1920x1080   50.000000 Hz  16:9     56.250 kHz    148.500000 MHz
  Speaker Allocation Data Block:
    FL/FR - Front Left/Right
  Vendor-Specific Data Block (HDMI), OUI 00-0C-03:
    Source physical address: 1.0.0.0
    Supports_AI
    DC_36bit
    DC_30bit
    DC_Y444
    Maximum TMDS clock: 225 MHz
    Video latency: 0 ms
    Audio latency: 0 ms
    Interlaced video latency: 0 ms
    Interlaced audio latency: 0 ms
  Detailed Timing Descriptors:
    DTD 6:   720x480    59.940060 Hz   3:2     31.469 kHz     27.000000 MHz (509 mm x 286 mm)
                 Hfront   16 Hsync  62 Hback   60 Hpol N
                 Vfront    9 Vsync   6 Vback   30 Vpol N
    DTD 7:   720x576    50.000000 Hz   5:4     31.250 kHz     27.000000 MHz (509 mm x 286 mm)
                 Hfront   12 Hsync  64 Hback   68 Hpol N
                 Vfront    5 Vsync   5 Vback   39 Vpol N
    DTD 8:  1920x1080i  60.000000 Hz  16:9     33.750 kHz     74.250000 MHz (509 mm x 286 mm)
                 Hfront   88 Hsync  44 Hback  148 Hpol P
                 Vfront    2 Vsync   5 Vback   15 Vpol P Vfront +0.5 Odd Field
                 Vfront    2 Vsync   5 Vback   15 Vpol P Vback  +0.5 Even Field
    DTD 9:  1920x1080i  50.000000 Hz  16:9     28.125 kHz     74.250000 MHz (509 mm x 286 mm)
                 Hfront  528 Hsync  44 Hback  148 Hpol P
                 Vfront    2 Vsync   5 Vback   15 Vpol P Vfront +0.5 Odd Field
                 Vfront    2 Vsync   5 Vback   15 Vpol P Vback  +0.5 Even Field
Checksum: 0x3e  Unused space in Extension Block: 14 bytes

----------------

Warnings:

Block 0, Base EDID:
  Vendor & Product Identification: The serial number is one of the known dummy values, it should probably be set to 0.
Block 1, CTA-861 Extension Block:
  Vendor-Specific Data Block (HDMI), OUI 00-0C-03: Progressive and Interlaced latency values are identical, no need for both.
  Detailed Timing Descriptor #2: Image size is 509x286 mm, but based on the picture AR it should be 509x339 mm.
  Detailed Timing Descriptor #3: Image size is 509x286 mm, but based on the picture AR it should be 509x407 mm.
  Display Product Serial Number is set, so the Serial Number in the Base EDID should be 0.
  Add a Colorimetry Data Block with the sRGB colorimetry bit set to avoid interop issues.
Block 3, CTA-861 Extension Block:
  Vendor-Specific Data Block (HDMI), OUI 00-0C-03: Progressive and Interlaced latency values are identical, no need for both.
  Detailed Timing Descriptor #6: Image size is 509x286 mm, but based on the picture AR it should be 509x339 mm.
  Detailed Timing Descriptor #7: Image size is 509x286 mm, but based on the picture AR it should be 509x407 mm.
EDID:
  Base EDID: Some timings are out of range of the Monitor Ranges:
    Vertical Freq: 50.000 - 75.029 Hz (Monitor: 56.000 - 75.000 Hz)
    Horizontal Freq: 15.625 - 79.976 kHz (Monitor: 24.000 - 83.000 kHz)
  CTA-861: Multiple native progressive timings are defined.

Failures:

Block 1, CTA-861 Extension Block:
  Missing VCDB, needed for Set Selectable RGB Quantization to avoid interop issues.
Block 2, Base EDID:
  Unknown Extension Block.
Block 3, CTA-861 Extension Block:
  Video Data Block: Duplicate VIC 16.
  Video Data Block: Duplicate VIC 1.
  Video Data Block: Duplicate VIC 2.
  Video Data Block: Duplicate VIC 3.
  Video Data Block: Duplicate VIC 6.
  Video Data Block: Duplicate VIC 7.
  Video Data Block: Duplicate VIC 21.
  Video Data Block: Duplicate VIC 22.
  Video Data Block: Duplicate VIC 17.
  Video Data Block: Duplicate VIC 18.
  Video Data Block: Duplicate VIC 19.
  Video Data Block: Duplicate VIC 4.
  Video Data Block: Duplicate VIC 5.
  Video Data Block: Duplicate VIC 20.
  Video Data Block: Duplicate VIC 31.
  Speaker Allocation Data Block: Only one instance of this Data Block is allowed.
EDID:
  Base EDID: EDID specified 1 extension block(s), but found 3 extension block(s).
  Base EDID: EDID 1.3 requires a Block Map Extension in Block 1 if there are more than 2 blocks in the EDID.

EDID conformity: FAIL
