edid-decode (hex):

00 ff ff ff ff ff ff 00 20 34 02 13 00 00 00 f0
32 1f 01 04 b5 00 00 78 3e 4e 65 a9 55 4d 9c 26
10 50 54 21 08 00 d1 00 b3 00 a9 c0 81 80 61 00
01 01 01 01 01 01 e2 68 00 a0 a0 40 2e 60 30 20
36 00 1e b3 10 00 00 1a 00 00 00 ff 00 64 65 6d
6f 31 0a 20 20 20 20 20 20 20 00 00 00 fc 00 4b
61 6d 76 61 73 20 50 72 6f 20 31 33 00 00 00 fd
00 30 3d 1e 64 1e 01 0a 20 20 20 20 20 20 01 58

02 03 14 b1 48 81 03 0f 04 45 5a 10 4c e2 00 c0
e3 05 c0 00 02 3a 80 18 71 38 2d 40 58 2c 45 00
1e b3 10 00 00 1e bc 1b 00 a0 50 20 17 30 30 20
36 00 1e b3 10 00 00 1e 00 00 00 00 00 00 00 00
00 00 00 00 00 00 00 00 00 00 00 00 00 00 00 00
00 00 00 00 00 00 00 00 00 00 00 00 00 00 00 00
00 00 00 00 00 00 00 00 00 00 00 00 00 00 00 00
00 00 00 00 00 00 00 00 00 00 00 00 00 00 00 ad

00 ff ff ff ff ff ff 00 20 34 02 13 00 00 00 f0
32 1f 01 04 b5 00 00 78 3e 4e 65 a9 55 4d 9c 26
10 50 54 21 08 00 d1 00 b3 00 a9 c0 81 80 61 00
01 01 01 01 01 01 e2 68 00 a0 a0 40 2e 60 30 20
36 00 1e b3 10 00 00 1a 00 00 00 ff 00 64 65 6d
6f 31 0a 20 20 20 20 20 20 20 00 00 00 fc 00 4b
61 6d 76 61 73 20 50 72 6f 20 31 33 00 00 00 fd
00 30 3d 1e 64 1e 01 0a 20 20 20 20 20 20 01 58

02 03 14 b1 48 81 03 0f 04 45 5a 10 4c e2 00 c0
e3 05 c0 00 02 3a 80 18 71 38 2d 40 58 2c 45 00
1e b3 10 00 00 1e bc 1b 00 a0 50 20 17 30 30 20
36 00 1e b3 10 00 00 1e 00 00 00 00 00 00 00 00
00 00 00 00 00 00 00 00 00 00 00 00 00 00 00 00
00 00 00 00 00 00 00 00 00 00 00 00 00 00 00 00
00 00 00 00 00 00 00 00 00 00 00 00 00 00 00 00
00 00 00 00 00 00 00 00 00 00 00 00 00 00 00 ad

----------------

Block 0, Base EDID:
  EDID Structure Version & Revision: 1.4
  Vendor & Product Identification:
    Manufacturer: HAT
    Model: 4866
    Serial Number: ...
    Made in: week 50 of 2021
  Basic Display Parameters & Features:
    Digital display
    Bits per primary color channel: 10
    DisplayPort interface
    Image size is variable
    Gamma: 2.20
    DPMS levels: Off
    Supported color formats: RGB 4:4:4, YCrCb 4:4:4, YCrCb 4:2:2
    Default (sRGB) color space is primary color space
    First detailed timing includes the native pixel format and preferred refresh rate
  Color Characteristics:
    Red  : 0.6611, 0.3320
    Green: 0.3037, 0.6113
    Blue : 0.1494, 0.0644
    White: 0.3134, 0.3291
  Established Timings I & II:
    DMT 0x04:   640x480    59.940476 Hz   4:3     31.469 kHz     25.175000 MHz
    DMT 0x09:   800x600    60.316541 Hz   4:3     37.879 kHz     40.000000 MHz
    DMT 0x10:  1024x768    60.003840 Hz   4:3     48.363 kHz     65.000000 MHz
  Standard Timings:
    DMT 0x45:  1920x1200   59.884600 Hz  16:10    74.556 kHz    193.250000 MHz
    DMT 0x3a:  1680x1050   59.954250 Hz  16:10    65.290 kHz    146.250000 MHz
    DMT 0x53:  1600x900    60.000000 Hz  16:9     60.000 kHz    108.000000 MHz (RB)
    DMT 0x23:  1280x1024   60.019740 Hz   5:4     63.981 kHz    108.000000 MHz
    GTF     :  1024x640    60.000182 Hz  16:10    39.780 kHz     52.828000 MHz
  Detailed Timing Descriptors:
    DTD 1:  2560x1600   59.971589 Hz  16:10    98.713 kHz    268.500000 MHz (286 mm x 179 mm)
                 Hfront   48 Hsync  32 Hback   80 Hpol P
                 Vfront    3 Vsync   6 Vback   37 Vpol N
    Display Product Serial Number: ...
    Display Product Name: 'Kamvas Pro 13'
    Display Range Limits:
      Monitor ranges (Range Limits Only): 48-61 Hz V, 30-100 kHz H, max dotclock 300 MHz
  Extension blocks: 1
Checksum: 0x58

----------------

Block 1, CTA-861 Extension Block:
  Revision: 3
  Underscans IT Video Formats by default
  Supports YCbCr 4:4:4
  Supports YCbCr 4:2:2
  Native DTDs: 1
  Video Data Block:
    VIC   1:   640x480    59.940476 Hz   4:3     31.469 kHz     25.175000 MHz (native)
    VIC   3:   720x480    59.940060 Hz  16:9     31.469 kHz     27.000000 MHz
    VIC  15:  1440x480    59.940060 Hz  16:9     31.469 kHz     54.000000 MHz
    VIC   4:  1280x720    60.000000 Hz  16:9     45.000 kHz     74.250000 MHz
    VIC  69:  1280x720    60.000000 Hz  64:27    45.000 kHz     74.250000 MHz
    VIC  90:  2560x1080   60.000000 Hz  64:27    66.000 kHz    198.000000 MHz
    VIC  16:  1920x1080   60.000000 Hz  16:9     67.500 kHz    148.500000 MHz
    VIC  76:  1920x1080   60.000000 Hz  64:27    67.500 kHz    148.500000 MHz
  Video Capability Data Block:
    YCbCr quantization: Selectable (via AVI YQ)
    RGB quantization: Selectable (via AVI Q)
    PT scan behavior: No Data
    IT scan behavior: IT video formats not supported
    CE scan behavior: CE video formats not supported
  Colorimetry Data Block:
    BT2020YCC
    BT2020RGB
  Detailed Timing Descriptors:
    DTD 2:  1920x1080   60.000000 Hz  16:9     67.500 kHz    148.500000 MHz (286 mm x 179 mm)
                 Hfront   88 Hsync  44 Hback  148 Hpol P
                 Vfront    4 Vsync   5 Vback   36 Vpol P
    DTD 3:  1280x800    59.909545 Hz  16:10    49.306 kHz     71.000000 MHz (286 mm x 179 mm)
                 Hfront   48 Hsync  32 Hback   80 Hpol P
                 Vfront    3 Vsync   6 Vback   14 Vpol P
Checksum: 0xad  Unused space in Extension Block: 71 bytes

----------------

Warnings:

Block 1, CTA-861 Extension Block:
  Video Data Block: VIC 1 and the first DTD are not identical. Is this intended?
  Video Capability Data Block: IT scan behavior is expected to support underscanned.
  Video Capability Data Block: 'CE video formats not supported' makes no sense.
  Detailed Timing Descriptor #2: Image size is 286x179 mm, but based on the picture AR it should be 286x160 mm.
  Detailed Timing Descriptor #3: DTD is similar but not identical to DMT 0x1b.
  Display Product Serial Number is set, so the Serial Number in the Base EDID should be 0.

Failures:

Block 0, Base EDID:
  Basic Display Parameters & Features: sRGB is signaled, but the chromaticities do not match.
EDID:
  Extension Block 2 started with EDID header, ignoring Extension Blocks >= 2.
  Base EDID: The DTD max image size is 286x179mm, but the display size is not specified anywhere.
  CTA-861: Native progressive timings are a mix of several resolutions.

EDID conformity: FAIL
