edid-decode (hex):

00 ff ff ff ff ff ff 00 1c 54 08 27 00 00 00 00
2f 1f 01 03 80 3c 21 78 2a 6c b1 ad 50 46 ae 26
0c 50 54 bf ef 00 81 80 81 bc 95 00 95 3c b3 00
b3 3c d1 c0 d1 fc 02 3a 80 18 71 38 2d 40 58 2c
45 00 57 4f 21 00 00 1e 00 00 00 fd 00 30 90 1e
a0 24 00 0a 20 20 20 20 20 20 00 00 00 ff 00 32
31 34 37 32 42 30 30 35 36 35 32 0a 00 00 00 fc
00 47 32 37 46 0a 20 20 20 20 20 20 20 20 01 e5

02 03 2f f1 4c 90 01 02 03 04 05 11 12 13 14 1f
3f 23 09 07 07 83 01 00 00 67 03 0c 00 20 00 38
44 6d 1a 00 00 02 11 30 90 e6 00 00 00 00 00 fb
7e 80 72 70 38 1e 40 18 20 35 00 57 4f 21 00 00
1e 86 6f 80 a0 70 38 40 40 30 20 35 00 57 4f 21
00 00 1e 9c 45 00 72 51 d0 1e 20 6e 28 55 00 57
4f 21 00 00 1e 02 3a 00 72 51 d0 1e 20 6e 28 55
00 2f 4f 21 00 00 61 00 00 00 00 00 00 00 00 54

00 ff ff ff ff ff ff 00 1c 54 08 27 00 00 00 00
2f 1f 01 03 80 3c 21 78 2a 6c b1 ad 50 46 ae 26
0c 50 54 bf ef 00 81 80 81 bc 95 00 95 3c b3 00
b3 3c d1 c0 d1 fc 02 3a 80 18 71 38 2d 40 58 2c
45 00 57 4f 21 00 00 1e 00 00 00 fd 00 30 90 1e
a0 24 00 0a 20 20 20 20 20 20 00 00 00 ff 00 32
31 34 37 32 42 30 30 35 36 35 32 0a 00 00 00 fc
00 47 32 37 46 0a 20 20 20 20 20 20 20 20 01 e5

02 03 2f f1 4c 90 01 02 03 04 05 11 12 13 14 1f
3f 23 09 07 07 83 01 00 00 67 03 0c 00 20 00 38
44 6d 1a 00 00 02 11 30 90 e6 00 00 00 00 00 fb
7e 80 72 70 38 1e 40 18 20 35 00 57 4f 21 00 00
1e 86 6f 80 a0 70 38 40 40 30 20 35 00 57 4f 21
00 00 1e 9c 45 00 72 51 d0 1e 20 6e 28 55 00 57
4f 21 00 00 1e 02 3a 00 72 51 d0 1e 20 6e 28 55
00 2f 4f 21 00 00 61 00 00 00 00 00 00 00 00 54

----------------

Block 0, Base EDID:
  EDID Structure Version & Revision: 1.3
  Vendor & Product Identification:
    Manufacturer: GBT
    Model: 9992
    Made in: week 47 of 2021
  Basic Display Parameters & Features:
    Digital display
    Maximum image size: 60 cm x 33 cm
    Gamma: 2.20
    DPMS levels: Off
    RGB color display
    First detailed timing is the preferred timing
  Color Characteristics:
    Red  : 0.6767, 0.3144
    Green: 0.2763, 0.6796
    Blue : 0.1503, 0.0498
    White: 0.3125, 0.3291
  Established Timings I & II:
    IBM     :   720x400    70.081663 Hz   9:5     31.467 kHz     28.320000 MHz
    DMT 0x04:   640x480    59.940476 Hz   4:3     31.469 kHz     25.175000 MHz
    Apple   :   640x480    66.666667 Hz   4:3     35.000 kHz     30.240000 MHz
    DMT 0x05:   640x480    72.808802 Hz   4:3     37.861 kHz     31.500000 MHz
    DMT 0x06:   640x480    75.000000 Hz   4:3     37.500 kHz     31.500000 MHz
    DMT 0x08:   800x600    56.250000 Hz   4:3     35.156 kHz     36.000000 MHz
    DMT 0x09:   800x600    60.316541 Hz   4:3     37.879 kHz     40.000000 MHz
    DMT 0x0a:   800x600    72.187572 Hz   4:3     48.077 kHz     50.000000 MHz
    DMT 0x0b:   800x600    75.000000 Hz   4:3     46.875 kHz     49.500000 MHz
    Apple   :   832x624    74.551266 Hz   4:3     49.726 kHz     57.284000 MHz
    DMT 0x10:  1024x768    60.003840 Hz   4:3     48.363 kHz     65.000000 MHz
    DMT 0x11:  1024x768    70.069359 Hz   4:3     56.476 kHz     75.000000 MHz
    DMT 0x12:  1024x768    75.028582 Hz   4:3     60.023 kHz     78.750000 MHz
    DMT 0x24:  1280x1024   75.024675 Hz   5:4     79.976 kHz    135.000000 MHz
  Standard Timings:
    DMT 0x23:  1280x1024   60.019740 Hz   5:4     63.981 kHz    108.000000 MHz
    GTF     :  1280x1024  120.000185 Hz   5:4    131.640 kHz    233.793000 MHz
    DMT 0x2f:  1440x900    59.887445 Hz  16:10    55.935 kHz    106.500000 MHz
    GTF     :  1440x900   119.999896 Hz  16:10   115.800 kHz    229.747000 MHz
    DMT 0x3a:  1680x1050   59.954250 Hz  16:10    65.290 kHz    146.250000 MHz
    GTF     :  1680x1050  120.000000 Hz  16:10   135.000 kHz    313.200000 MHz
    DMT 0x52:  1920x1080   60.000000 Hz  16:9     67.500 kHz    148.500000 MHz
    GTF     :  1920x1080  119.999987 Hz  16:9    138.840 kHz    368.759000 MHz
  Detailed Timing Descriptors:
    DTD 1:  1920x1080   60.000000 Hz  16:9     67.500 kHz    148.500000 MHz (599 mm x 335 mm)
                 Hfront   88 Hsync  44 Hback  148 Hpol P
                 Vfront    4 Vsync   5 Vback   36 Vpol P
    Display Range Limits:
      Monitor ranges (GTF): 48-144 Hz V, 30-160 kHz H, max dotclock 360 MHz
    Display Product Serial Number: ...
    Display Product Name: 'G27F'
  Extension blocks: 1
Checksum: 0xe5

----------------

Block 1, CTA-861 Extension Block:
  Revision: 3
  Underscans IT Video Formats by default
  Basic audio support
  Supports YCbCr 4:4:4
  Supports YCbCr 4:2:2
  Native DTDs: 1
  Video Data Block:
    VIC  16:  1920x1080   60.000000 Hz  16:9     67.500 kHz    148.500000 MHz (native)
    VIC   1:   640x480    59.940476 Hz   4:3     31.469 kHz     25.175000 MHz
    VIC   2:   720x480    59.940060 Hz   4:3     31.469 kHz     27.000000 MHz
    VIC   3:   720x480    59.940060 Hz  16:9     31.469 kHz     27.000000 MHz
    VIC   4:  1280x720    60.000000 Hz  16:9     45.000 kHz     74.250000 MHz
    VIC   5:  1920x1080i  60.000000 Hz  16:9     33.750 kHz     74.250000 MHz
    VIC  17:   720x576    50.000000 Hz   4:3     31.250 kHz     27.000000 MHz
    VIC  18:   720x576    50.000000 Hz  16:9     31.250 kHz     27.000000 MHz
    VIC  19:  1280x720    50.000000 Hz  16:9     37.500 kHz     74.250000 MHz
    VIC  20:  1920x1080i  50.000000 Hz  16:9     28.125 kHz     74.250000 MHz
    VIC  31:  1920x1080   50.000000 Hz  16:9     56.250 kHz    148.500000 MHz
    VIC  63:  1920x1080  120.000000 Hz  16:9    135.000 kHz    297.000000 MHz
  Audio Data Block:
    Linear PCM:
      Max channels: 2
      Supported sample rates (kHz): 48 44.1 32
      Supported sample sizes (bits): 24 20 16
  Speaker Allocation Data Block:
    FL/FR - Front Left/Right
  Vendor-Specific Data Block (HDMI), OUI 00-0C-03:
    Source physical address: 2.0.0.0
    DC_36bit
    DC_30bit
    DC_Y444
    Maximum TMDS clock: 340 MHz
  Vendor-Specific Data Block (AMD), OUI 00-00-1A:
    Version: 2
    Feature Caps: 0x11
    Minimum Refresh Rate: 48 Hz
    Maximum Refresh Rate: 144 Hz
    Flags 1.x: 0xe6 (MCCS)
    Flags 2.x: 0x00
  Detailed Timing Descriptors:
    DTD 2:  1920x1080  143.980263 Hz  16:9    159.818 kHz    325.070000 MHz (599 mm x 335 mm)
                 Hfront   24 Hsync  32 Hback   58 Hpol P
                 Vfront    3 Vsync   5 Vback   22 Vpol P
    DTD 3:  1920x1080  119.982181 Hz  16:9    137.260 kHz    285.500000 MHz (599 mm x 335 mm)
                 Hfront   48 Hsync  32 Hback   80 Hpol P
                 Vfront    3 Vsync   5 Vback   56 Vpol P
    DTD 4:  1280x720   144.000000 Hz  16:9    108.000 kHz    178.200000 MHz (599 mm x 335 mm)
                 Hfront  110 Hsync  40 Hback  220 Hpol P
                 Vfront    5 Vsync   5 Vback   20 Vpol P
    DTD 5:  1280x720   120.000000 Hz  16:9     90.000 kHz    148.500000 MHz (analog composite, sync-on-green, side by side interleaved, 559 mm x 335 mm)
                 Hfront  110 Hsync  40 Hback  220 Hpol N
                 Vfront    5 Vsync   5 Vback   20 Vpol N
Checksum: 0x54  Unused space in Extension Block: 8 bytes

----------------

Warnings:

Block 1, CTA-861 Extension Block:
  Detailed Timing Descriptor #5: DTD is similar but not identical to VIC 47.
  Detailed Timing Descriptor #5: Image size is 559x335 mm, but based on the picture AR it should be 559x314 mm.
  Add a Colorimetry Data Block with the sRGB colorimetry bit set to avoid interop issues.
EDID:
  Base EDID: Some timings are out of range of the Monitor Ranges:
    Horizontal Freq: 28.125 - 159.818 kHz (Monitor: 30.000 - 160.000 kHz)
    Maximum Clock: 368.759 MHz (Monitor: 360.000 MHz)

Failures:

Block 1, CTA-861 Extension Block:
  Missing VCDB, needed for Set Selectable RGB Quantization to avoid interop issues.
EDID:
  Extension Block 2 started with EDID header, ignoring Extension Blocks >= 2.
  CTA-861: The maximum HDMI TMDS clock is 340000 kHz, but one or more video timings go up to 368759 kHz.

EDID conformity: FAIL
