edid-decode (hex):

00 ff ff ff ff ff ff 00 16 09 95 a9 52 1b 00 00
2d 0c 01 02 68 24 1b 78 2a 4f 29 a0 57 49 9b 26
10 48 4c a4 43 00 31 59 45 59 61 59 81 59 81 99
a9 4f 01 01 01 01 86 3d 00 c0 51 00 30 40 40 a0
13 00 68 0e 11 00 00 1e 00 00 00 fc 00 45 4e 56
49 53 49 4f 4e 20 0a 20 20 20 00 00 00 fc 00 45
4e 2d 39 31 30 65 0a 20 20 20 20 20 00 00 00 fd
00 32 a0 1e 5f 14 00 0a 20 20 20 20 20 20 00 85

00 ff ff ff ff ff ff 00 16 09 95 a9 52 1b 00 00
2d 0c 01 02 68 24 1b 78 2a 4f 29 a0 57 49 9b 26
10 48 4c a4 43 00 31 59 45 59 61 59 81 59 81 99
a9 4f 01 01 01 01 86 3d 00 c0 51 00 30 40 40 a0
13 00 68 0e 11 00 00 1e 00 00 00 fc 00 45 4e 56
49 53 49 4f 4e 20 0a 20 20 20 00 00 00 fc 00 45
4e 2d 39 31 30 65 0a 20 20 20 20 20 00 00 00 fd
00 32 a0 1e 5f 14 00 0a 20 20 20 20 20 20 00 85

----------------

Block 0, Base EDID:
  EDID Structure Version & Revision: 1.2
  Vendor & Product Identification:
    Manufacturer: EPI
    Model: 43413
    Serial Number: ...
    Made in: week 45 of 2002
  Basic Display Parameters & Features:
    Analog display
    Signal Level Standard: 0.700 : 0.000 : 0.700 V p-p
    Blank level equals black level
    Sync: Separate
    Maximum image size: 36 cm x 27 cm
    Gamma: 2.20
    DPMS levels: Off
    RGB color display
    First detailed timing is the preferred timing
  Color Characteristics:
    Red  : 0.6259, 0.3398
    Green: 0.2880, 0.6083
    Blue : 0.1484, 0.0644
    White: 0.2832, 0.2978
  Established Timings I & II:
    IBM     :   720x400    70.081663 Hz   9:5     31.467 kHz     28.320000 MHz
    DMT 0x04:   640x480    59.940476 Hz   4:3     31.469 kHz     25.175000 MHz
    DMT 0x06:   640x480    75.000000 Hz   4:3     37.500 kHz     31.500000 MHz
    DMT 0x0b:   800x600    75.000000 Hz   4:3     46.875 kHz     49.500000 MHz
    DMT 0x12:  1024x768    75.028582 Hz   4:3     60.023 kHz     78.750000 MHz
    DMT 0x24:  1280x1024   75.024675 Hz   5:4     79.976 kHz    135.000000 MHz
  Standard Timings:
    DMT 0x07:   640x480    85.008312 Hz   4:3     43.269 kHz     36.000000 MHz
    DMT 0x0c:   800x600    85.061274 Hz   4:3     53.674 kHz     56.250000 MHz
    DMT 0x13:  1024x768    84.996690 Hz   4:3     68.677 kHz     94.500000 MHz
    DMT 0x21:  1280x960    85.002473 Hz   4:3     85.938 kHz    148.500000 MHz
    DMT 0x25:  1280x1024   85.024098 Hz   5:4     91.146 kHz    157.500000 MHz
    DMT 0x36:  1600x1200   75.000000 Hz   4:3     93.750 kHz    202.500000 MHz
  Detailed Timing Descriptors:
    DTD 1:  1280x1024   85.024098 Hz   5:4     91.146 kHz    157.500000 MHz (360 mm x 270 mm)
                 Hfront   64 Hsync 160 Hback  224 Hpol P
                 Vfront    1 Vsync   3 Vback   44 Vpol P
    Display Product Name: 'ENVISION '
    Display Product Name: 'EN-910e'
    Display Range Limits:
      Monitor ranges (GTF): 50-160 Hz V, 30-95 kHz H, max dotclock 200 MHz
Checksum: 0x85

----------------

Block 1, Unknown EDID Extension Block 0x00:
  00 ff ff ff ff ff ff 00 16 09 95 a9 52 1b 00 00 '............R...'
  2d 0c 01 02 68 24 1b 78 2a 4f 29 a0 57 49 9b 26 '-...h$.x*O).WI.&'
  10 48 4c a4 43 00 31 59 45 59 61 59 81 59 81 99 '.HL.C.1YEYaY.Y..'
  a9 4f 01 01 01 01 86 3d 00 c0 51 00 30 40 40 a0 '.O.....=..Q.0@@.'
  13 00 68 0e 11 00 00 1e 00 00 00 fc 00 45 4e 56 '..h..........ENV'
  49 53 49 4f 4e 20 0a 20 20 20 00 00 00 fc 00 45 'ISION .   .....E'
  4e 2d 39 31 30 65 0a 20 20 20 20 20 00 00 00 fd 'N-910e.     ....'
  00 32 a0 1e 5f 14 00 0a 20 20 20 20 20 20 00 85 '.2.._...      ..'
Checksum: 0x85

----------------

Warnings:

Block 0, Base EDID:
  EDID Structure Version & Revision: EDID 1.2 is deprecated, do not use.
  Detailed Timing Descriptor #1: Image size is 360x270 mm, but based on the picture AR it should be 360x288 mm.
EDID:
  Base EDID: Some timings are out of range of the Monitor Ranges:
    Maximum Clock: 202.500 MHz (Monitor: 200.000 MHz)
    Could be due to a Monitor Range off-by-one rounding issue

Failures:

Block 0, Base EDID:
  Display Product Name: One or more trailing spaces before newline.
Block 1, Base EDID:
  Unknown Extension Block.
EDID:
  Base EDID: EDID specified 0 extension block(s), but found 1 extension block(s).

EDID conformity: FAIL
