edid-decode (hex):

00 ff ff ff ff ff ff 00 4c a3 41 37 00 00 00 00
00 11 01 03 80 21 15 78 0a 42 d5 96 58 52 8a 27
21 50 54 00 00 00 01 01 01 01 01 01 01 01 01 01
01 01 01 01 01 01 ee 1a 00 80 50 20 10 30 10 30
13 00 4b cf 10 00 00 19 00 00 00 0f 00 00 00 00
00 00 00 00 00 23 87 02 64 00 00 00 00 fe 00 53
41 4d 53 55 4e 47 0a 20 20 20 20 20 00 00 00 fe
00 31 35 34 41 54 30 37 2d 35 30 31 0a 20 00 41

00 ff ff ff ff ff ff 00 4c a3 41 37 00 00 00 00
00 11 01 03 80 21 15 78 0a 42 d5 96 58 52 8a 27
21 50 54 00 00 00 01 01 01 01 01 01 01 01 01 01
01 01 01 01 01 01 ee 1a 00 80 50 20 10 30 10 30
13 00 4b cf 10 00 00 19 00 00 00 0f 00 00 00 00
00 00 00 00 00 23 87 02 64 00 00 00 00 fe 00 53
41 4d 53 55 4e 47 0a 20 20 20 20 20 00 00 00 fe
00 31 35 34 41 54 30 37 2d 35 30 31 0a 20 00 41

----------------

Block 0, Base EDID:
  EDID Structure Version & Revision: 1.3
  Vendor & Product Identification:
    Manufacturer: SEC
    Model: 14145
    Made in: 2007
  Basic Display Parameters & Features:
    Digital display
    Maximum image size: 33 cm x 21 cm
    Gamma: 2.20
    RGB color display
    First detailed timing is the preferred timing
  Color Characteristics:
    Red  : 0.5869, 0.3437
    Green: 0.3203, 0.5410
    Blue : 0.1552, 0.1298
    White: 0.3134, 0.3291
  Established Timings I & II: none
  Standard Timings: none
  Detailed Timing Descriptors:
    DTD 1:  1280x800    60.003760 Hz  16:10    48.963 kHz     68.940000 MHz (331 mm x 207 mm)
                 Hfront   16 Hsync  48 Hback   64 Hpol N
                 Vfront    1 Vsync   3 Vback   12 Vpol N
    Manufacturer-Specified Display Descriptor (0x0f): 00 0f 00 00 00 00 00 00 00 00 00 23 87 02 64 00 '...........#..d.'
    Alphanumeric Data String: 'SAMSUNG'
    Alphanumeric Data String: '154AT07-501'
Checksum: 0x41

----------------

Failures:

Block 0, Base EDID:
  Missing Display Product Name.
  Missing Display Range Limits Descriptor.
EDID:
  Extension Block 1 started with EDID header, ignoring Extension Blocks >= 1.

EDID conformity: FAIL
