edid-decode (hex):

00 ff ff ff ff ff ff 00 4a 8b 80 23 00 00 00 00
30 20 01 03 80 35 1e 78 2e ee 91 a3 54 4c 99 26
0f 50 54 21 08 00 71 40 81 80 a9 c0 d1 c0 01 01
01 01 01 01 01 01 02 3a 80 18 71 38 2d 40 58 2c
25 00 0f 28 21 00 00 1e 00 00 00 fc 00 32 33 38
0a 20 20 20 20 20 20 20 20 20 00 00 00 ff 00 0a
20 20 20 20 20 20 20 20 20 20 20 20 00 00 00 fd
00 32 4b 1e 54 14 00 0a 20 20 20 20 20 20 01 90

00 ff ff ff ff ff ff 00 4a 8b 80 23 00 00 00 00
30 20 01 03 80 35 1e 78 2e ee 91 a3 54 4c 99 26
0f 50 54 21 08 00 71 40 81 80 a9 c0 d1 c0 01 01
01 01 01 01 01 01 02 3a 80 18 71 38 2d 40 58 2c
25 00 0f 28 21 00 00 1e 00 00 00 fc 00 32 33 38
0a 20 20 20 20 20 20 20 20 20 00 00 00 ff 00 0a
20 20 20 20 20 20 20 20 20 20 20 20 00 00 00 fd
00 32 4b 1e 54 14 00 0a 20 20 20 20 20 20 01 90

----------------

Block 0, Base EDID:
  EDID Structure Version & Revision: 1.3
  Vendor & Product Identification:
    Manufacturer: RTK
    Model: 9088
    Made in: week 48 of 2022
  Basic Display Parameters & Features:
    Digital display
    Maximum image size: 53 cm x 30 cm
    Gamma: 2.20
    DPMS levels: Off
    RGB color display
    Default (sRGB) color space is primary color space
    First detailed timing is the preferred timing
  Color Characteristics:
    Red  : 0.6396, 0.3300
    Green: 0.2998, 0.5996
    Blue : 0.1503, 0.0595
    White: 0.3125, 0.3291
  Established Timings I & II:
    DMT 0x04:   640x480    59.940476 Hz   4:3     31.469 kHz     25.175000 MHz
    DMT 0x09:   800x600    60.316541 Hz   4:3     37.879 kHz     40.000000 MHz
    DMT 0x10:  1024x768    60.003840 Hz   4:3     48.363 kHz     65.000000 MHz
  Standard Timings:
    GTF     :  1152x864    60.000000 Hz   4:3     53.700 kHz     81.624000 MHz
    DMT 0x23:  1280x1024   60.019740 Hz   5:4     63.981 kHz    108.000000 MHz
    DMT 0x53:  1600x900    60.000000 Hz  16:9     60.000 kHz    108.000000 MHz (RB)
    DMT 0x52:  1920x1080   60.000000 Hz  16:9     67.500 kHz    148.500000 MHz
  Detailed Timing Descriptors:
    DTD 1:  1920x1080   60.000000 Hz  16:9     67.500 kHz    148.500000 MHz (527 mm x 296 mm)
                 Hfront   88 Hsync  44 Hback  148 Hpol P
                 Vfront    2 Vsync   5 Vback   38 Vpol P
    Display Product Name: '238'
    Display Product Serial Number: ...
    Display Range Limits:
      Monitor ranges (GTF): 50-75 Hz V, 30-84 kHz H, max dotclock 200 MHz
  Extension blocks: 1
Checksum: 0x90

----------------

Warnings:

Block 0, Base EDID:
  Detailed Timing Descriptor #1: DTD is similar but not identical to VIC 16.

Failures:

Block 0, Base EDID:
  Display Product Serial Number: ...
EDID:
  Extension Block 1 started with EDID header, ignoring Extension Blocks >= 1.
  Base EDID: EDID specified 1 extension block(s), but found 0 extension block(s).

EDID conformity: FAIL
