edid-decode (hex):

00 ff ff ff ff ff ff 00 06 10 1a 9c 00 00 00 00
1f 0b 01 03 80 1d 15 78 08 be 62 94 56 53 88 28
24 52 54 00 08 00 01 01 01 01 01 01 01 01 01 01
01 01 01 01 01 01 64 19 00 40 41 00 26 30 18 88
36 00 1d d6 10 00 00 18 00 00 00 fe 00 4c 54 4e
31 34 31 58 46 00 00 00 0a 20 00 00 00 fe 00 4c
54 4e 31 34 31 58 46 00 00 00 0a 20 00 00 00 fc
00 43 6f 6c 6f 72 20 4c 43 44 0a 20 20 20 00 ba

00 ff ff ff ff ff ff 00 06 10 1a 9c 00 00 00 00
1f 0b 01 03 80 1d 15 78 08 be 62 94 56 53 88 28
24 52 54 00 08 00 01 01 01 01 01 01 01 01 01 01
01 01 01 01 01 01 64 19 00 40 41 00 26 30 18 88
36 00 1d d6 10 00 00 18 00 00 00 fe 00 4c 54 4e
31 34 31 58 46 00 00 00 0a 20 00 00 00 fe 00 4c
54 4e 31 34 31 58 46 00 00 00 0a 20 00 00 00 fc
00 43 6f 6c 6f 72 20 4c 43 44 0a 20 20 20 00 ba

----------------

Block 0, Base EDID:
  EDID Structure Version & Revision: 1.3
  Vendor & Product Identification:
    Manufacturer: APP
    Model: 39962
    Made in: week 31 of 2001
  Basic Display Parameters & Features:
    Digital display
    Maximum image size: 29 cm x 21 cm
    Gamma: 2.20
    RGB color display
  Color Characteristics:
    Red  : 0.5800, 0.3388
    Green: 0.3271, 0.5332
    Blue : 0.1572, 0.1425
    White: 0.3203, 0.3300
  Established Timings I & II:
    DMT 0x10:  1024x768    60.003840 Hz   4:3     48.363 kHz     65.000000 MHz
  Standard Timings: none
  Detailed Timing Descriptors:
    DTD 1:  1024x768    60.003840 Hz   4:3     48.363 kHz     65.000000 MHz (285 mm x 214 mm)
                 Hfront   24 Hsync 136 Hback  160 Hpol N
                 Vfront    3 Vsync   6 Vback   29 Vpol N
    Alphanumeric Data String: 'LTN141XF'
    Alphanumeric Data String: 'LTN141XF'
    Display Product Name: 'Color LCD'
Checksum: 0xba

----------------

Warnings:

EDID:
  No Native Video Resolution was defined.

Failures:

Block 0, Base EDID:
  Basic Display Parameters & Features: EDID 1.3 requires that the first detailed timing is the preferred timing.
  Alphanumeric Data String: NUL byte at position 8.
  Alphanumeric Data String: NUL byte at position 8.
  Missing Display Range Limits Descriptor.
EDID:
  Extension Block 1 started with EDID header, ignoring Extension Blocks >= 1.

EDID conformity: FAIL
