edid-decode (hex):

00 ff ff ff ff ff ff 00 0e 6f 98 14 00 00 00 00
03 21 01 04 a5 1e 13 78 03 2a 11 95 5b 57 91 29
20 50 54 00 00 00 01 01 01 01 01 01 01 01 01 01
01 01 01 01 01 01 e9 3d 80 c8 70 b0 2e 40 30 20
36 00 2e bd 10 00 00 1a 00 00 00 fd 00 30 3c 4d
4d 11 00 0a 20 20 20 20 20 20 00 00 00 fe 00 43
53 4f 54 20 54 39 0a 20 20 20 20 20 00 00 00 fd
00 4d 4e 45 30 30 00 0a 20 20 20 20 20 20 00 49

00 ff ff ff ff ff ff 00 0e 6f 98 14 00 00 00 00
03 21 01 04 a5 1e 13 78 03 2a 11 95 5b 57 91 29
20 50 54 00 00 00 01 01 01 01 01 01 01 01 01 01
01 01 01 01 01 01 e9 3d 80 c8 70 b0 2e 40 30 20
36 00 2e bd 10 00 00 1a 00 00 00 fd 00 30 3c 4d
4d 11 00 0a 20 20 20 20 20 20 00 00 00 fe 00 43
53 4f 54 20 54 39 0a 20 20 20 20 20 00 00 00 fd
00 4d 4e 45 30 30 00 0a 20 20 20 20 20 20 00 49

----------------

Block 0, Base EDID:
  EDID Structure Version & Revision: 1.4
  Vendor & Product Identification:
    Manufacturer: CSO
    Model: 5272
    Made in: week 3 of 2023
  Basic Display Parameters & Features:
    Digital display
    Bits per primary color channel: 8
    DisplayPort interface
    Maximum image size: 30 cm x 19 cm
    Gamma: 2.20
    Supported color formats: RGB 4:4:4
    First detailed timing includes the native pixel format and preferred refresh rate
    Display supports continuous frequencies
  Color Characteristics:
    Red  : 0.5820, 0.3574
    Green: 0.3417, 0.5683
    Blue : 0.1601, 0.1259
    White: 0.3125, 0.3291
  Established Timings I & II: none
  Standard Timings: none
  Detailed Timing Descriptors:
    DTD 1:  1920x1200   59.999546 Hz  16:10    74.759 kHz    158.490000 MHz (302 mm x 189 mm)
                 Hfront   48 Hsync  32 Hback  120 Hpol P
                 Vfront    3 Vsync   6 Vback   37 Vpol N
    Display Range Limits:
      Monitor ranges (GTF): 48-60 Hz V, 77-77 kHz H, max dotclock 170 MHz
    Alphanumeric Data String: 'CSOT T9'
    Display Range Limits:
      Monitor ranges (GTF): 77-78 Hz V, 69-48 kHz H, max dotclock 480 MHz
Checksum: 0x49

----------------

Warnings:

Block 0, Base EDID:
  Display Range Limits: GTF support is deprecated in EDID 1.4.
  Display Range Limits: GTF support is deprecated in EDID 1.4.
  Missing Display Product Name.
EDID:
  Base EDID: Some timings are out of range of the Monitor Ranges:
    Vertical Freq: 60.000 - 60.000 Hz (Monitor: 77.000 - 78.000 Hz)
    Horizontal Freq: 74.759 - 74.759 kHz (Monitor: 69.000 - 48.000 kHz)

Failures:

Block 0, Base EDID:
  Display Range Limits: Min horizontal freq > max horizontal freq.
EDID:
  Extension Block 1 started with EDID header, ignoring Extension Blocks >= 1.

EDID conformity: FAIL
