edid-decode (hex):

00 ff ff ff ff ff ff 00 2e 83 00 32 42 00 00 00
18 15 01 04 68 46 27 78 ea f0 65 98 57 51 91 27
21 50 54 a1 08 00 01 01 01 01 01 01 01 01 01 01
01 01 01 01 01 01 66 21 50 b0 51 00 1b 30 40 70
36 00 ba 88 21 00 00 1e 00 00 00 fd 00 38 4f 1f
32 08 00 0a 20 20 20 20 20 20 00 00 00 fc 00 33
32 54 37 32 2d 48 2d 41 4e 0a 20 20 00 00 00 fe
00 0a 20 20 20 20 20 20 20 20 20 20 20 20 00 5b

----------------

Block 0, Base EDID:
  EDID Structure Version & Revision: 1.4
  Vendor & Product Identification:
    Manufacturer: KTC
    Model: 12800
    Serial Number: ...
    Made in: week 24 of 2011
  Basic Display Parameters & Features:
    Analog display
    Signal Level Standard: 0.700 : 0.000 : 0.700 V p-p
    Blank level equals black level
    Sync: Separate
    Maximum image size: 70 cm x 39 cm
    Gamma: 2.20
    DPMS levels: Standby Suspend Off
    RGB color display
    First detailed timing includes the native pixel format and preferred refresh rate
  Color Characteristics:
    Red  : 0.5966, 0.3427
    Green: 0.3164, 0.5664
    Blue : 0.1533, 0.1308
    White: 0.3134, 0.3291
  Established Timings I & II:
    IBM     :   720x400    70.081663 Hz   9:5     31.467 kHz     28.320000 MHz
    DMT 0x04:   640x480    59.940476 Hz   4:3     31.469 kHz     25.175000 MHz
    DMT 0x09:   800x600    60.316541 Hz   4:3     37.879 kHz     40.000000 MHz
    DMT 0x10:  1024x768    60.003840 Hz   4:3     48.363 kHz     65.000000 MHz
  Standard Timings: none
  Detailed Timing Descriptors:
    DTD 1:  1360x768    60.015162 Hz  85:48    47.712 kHz     85.500000 MHz (698 mm x 392 mm)
                 Hfront   64 Hsync 112 Hback  256 Hpol P
                 Vfront    3 Vsync   6 Vback   18 Vpol P
    Display Range Limits:
      Monitor ranges (GTF): 56-79 Hz V, 31-50 kHz H, max dotclock 80 MHz
    Display Product Name: '32T72-H-AN'
    Alphanumeric Data String: ''
Checksum: 0x5b

----------------

Warnings:

Block 0, Base EDID:
  Display Range Limits: GTF support is deprecated in EDID 1.4.
EDID:
  Base EDID: Some timings are out of range of the Monitor Ranges:
    Maximum Clock: 85.500 MHz (Monitor: 80.000 MHz)
    Could be due to a Monitor Range off-by-one rounding issue

Failures:

Block 0, Base EDID:
  Display Range Limits: GTF is supported, but the display does not support continuous frequencies.
  Alphanumeric Data String: Empty string.

EDID conformity: FAIL
