edid-decode (hex):

00 ff ff ff ff ff ff 00 05 e3 23 b4 5b 04 00 00
1e 23 01 04 b5 36 1e 78 3f 60 e5 af 4f 45 a4 24
0f 50 54 bf ef 00 d1 c0 81 80 31 68 31 7c 45 68
45 7c 61 68 61 7c 6a 5e 00 a0 a0 a0 29 50 30 20
35 00 1d 2f 21 00 00 1e 00 00 00 ff 00 58 4c 32
52 37 48 41 30 30 31 31 31 35 00 00 00 fc 00 51
32 35 47 34 53 0a 20 20 20 20 20 20 00 00 00 fd
0e 30 2d d7 d7 82 01 0a 20 20 20 20 20 20 02 54

02 03 37 f1 4c 01 03 05 14 04 13 1f 12 02 11 90
3f 23 09 07 07 83 01 00 00 e3 05 e3 01 e6 06 07
01 65 65 00 72 1a 00 00 03 01 30 f0 00 00 00 00
00 00 2c 01 00 00 00 f9 e3 00 a0 a0 a0 32 50 30
20 98 04 1d 2f 21 00 00 1a 70 c2 00 a0 a0 a0 55
50 30 20 35 00 1d 2f 21 00 00 1e 08 a2 00 a0 a0
a0 55 50 30 20 35 00 1d 2f 21 00 00 1e 00 00 00
00 00 00 00 00 00 00 00 00 00 00 00 00 00 00 64

70 12 79 03 00 03 01 64 ac e0 01 04 ff 09 9f 00
2f 80 1f 00 9f 05 43 00 07 00 09 00 5e b6 01 04
ff 09 ff 00 2f 80 1f 00 9f 05 23 00 02 00 04 00
99 83 01 04 ff 09 9f 00 2f 80 1f 00 9f 05 4f 00
02 00 04 00 ff 42 01 04 ff 09 9f 00 2f 80 1f 00
9f 05 4f 00 02 00 04 00 76 03 01 04 ff 09 9f 00
2f 80 1f 00 9f 05 27 00 02 00 04 00 00 00 00 00
00 00 00 00 00 00 00 00 00 00 00 00 00 00 4b 90

00 ff ff ff ff ff ff 00 05 e3 23 b4 5b 04 00 00
1e 23 01 04 b5 36 1e 78 3f 60 e5 af 4f 45 a4 24
0f 50 54 bf ef 00 d1 c0 81 80 31 68 31 7c 45 68
45 7c 61 68 61 7c 6a 5e 00 a0 a0 a0 29 50 30 20
35 00 1d 2f 21 00 00 1e 00 00 00 ff 00 58 4c 32
52 37 48 41 30 30 31 31 31 35 00 00 00 fc 00 51
32 35 47 34 53 0a 20 20 20 20 20 20 00 00 00 fd
0e 30 2d d7 d7 82 01 0a 20 20 20 20 20 20 02 54

02 03 37 f1 4c 01 03 05 14 04 13 1f 12 02 11 90
3f 23 09 07 07 83 01 00 00 e3 05 e3 01 e6 06 07
01 65 65 00 72 1a 00 00 03 01 30 f0 00 00 00 00
00 00 2c 01 00 00 00 f9 e3 00 a0 a0 a0 32 50 30
20 98 04 1d 2f 21 00 00 1a 70 c2 00 a0 a0 a0 55
50 30 20 35 00 1d 2f 21 00 00 1e 08 a2 00 a0 a0
a0 55 50 30 20 35 00 1d 2f 21 00 00 1e 00 00 00
00 00 00 00 00 00 00 00 00 00 00 00 00 00 00 64

70 12 79 03 00 03 01 64 ac e0 01 04 ff 09 9f 00
2f 80 1f 00 9f 05 43 00 07 00 09 00 5e b6 01 04
ff 09 ff 00 2f 80 1f 00 9f 05 23 00 02 00 04 00
99 83 01 04 ff 09 9f 00 2f 80 1f 00 9f 05 4f 00
02 00 04 00 ff 42 01 04 ff 09 9f 00 2f 80 1f 00
9f 05 4f 00 02 00 04 00 76 03 01 04 ff 09 9f 00
2f 80 1f 00 9f 05 27 00 02 00 04 00 00 00 00 00
00 00 00 00 00 00 00 00 00 00 00 00 00 00 4b 90

----------------

Block 0, Base EDID:
  EDID Structure Version & Revision: 1.4
  Vendor & Product Identification:
    Manufacturer: AOC
    Model: 46115
    Serial Number: ...
    Made in: week 30 of 2025
  Basic Display Parameters & Features:
    Digital display
    Bits per primary color channel: 10
    DisplayPort interface
    Maximum image size: 54 cm x 30 cm
    Gamma: 2.20
    DPMS levels: Off
    Supported color formats: RGB 4:4:4, YCrCb 4:4:4, YCrCb 4:2:2
    Default (sRGB) color space is primary color space
    First detailed timing includes the native pixel format and preferred refresh rate
    Display supports continuous frequencies
  Color Characteristics:
    Red  : 0.6845, 0.3105
    Green: 0.2695, 0.6406
    Blue : 0.1435, 0.0605
    White: 0.3134, 0.3291
  Established Timings I & II:
    IBM     :   720x400    70.081663 Hz   9:5     31.467 kHz     28.320000 MHz
    DMT 0x04:   640x480    59.940476 Hz   4:3     31.469 kHz     25.175000 MHz
    Apple   :   640x480    66.666667 Hz   4:3     35.000 kHz     30.240000 MHz
    DMT 0x05:   640x480    72.808802 Hz   4:3     37.861 kHz     31.500000 MHz
    DMT 0x06:   640x480    75.000000 Hz   4:3     37.500 kHz     31.500000 MHz
    DMT 0x08:   800x600    56.250000 Hz   4:3     35.156 kHz     36.000000 MHz
    DMT 0x09:   800x600    60.316541 Hz   4:3     37.879 kHz     40.000000 MHz
    DMT 0x0a:   800x600    72.187572 Hz   4:3     48.077 kHz     50.000000 MHz
    DMT 0x0b:   800x600    75.000000 Hz   4:3     46.875 kHz     49.500000 MHz
    Apple   :   832x624    74.551266 Hz   4:3     49.726 kHz     57.284000 MHz
    DMT 0x10:  1024x768    60.003840 Hz   4:3     48.363 kHz     65.000000 MHz
    DMT 0x11:  1024x768    70.069359 Hz   4:3     56.476 kHz     75.000000 MHz
    DMT 0x12:  1024x768    75.028582 Hz   4:3     60.023 kHz     78.750000 MHz
    DMT 0x24:  1280x1024   75.024675 Hz   5:4     79.976 kHz    135.000000 MHz
  Standard Timings:
    DMT 0x52:  1920x1080   60.000000 Hz  16:9     67.500 kHz    148.500000 MHz
    DMT 0x23:  1280x1024   60.019740 Hz   5:4     63.981 kHz    108.000000 MHz
    GTF     :   640x480    99.999537 Hz   4:3     50.900 kHz     43.163000 MHz
    GTF     :   640x480   119.999084 Hz   4:3     61.800 kHz     52.406000 MHz
    GTF     :   800x600    99.999707 Hz   4:3     63.600 kHz     68.179000 MHz
    GTF     :   800x600   119.999886 Hz   4:3     77.160 kHz     83.950000 MHz
    GTF     :  1024x768   100.000177 Hz   4:3     81.400 kHz    113.309000 MHz
    GTF     :  1024x768   119.999931 Hz   4:3     98.760 kHz    139.054000 MHz
  Detailed Timing Descriptors:
    DTD 1:  2560x1440   60.000199 Hz  16:9     88.860 kHz    241.700000 MHz (541 mm x 303 mm)
                 Hfront   48 Hsync  32 Hback   80 Hpol P
                 Vfront    3 Vsync   5 Vback   33 Vpol P
    Display Product Serial Number: ...
    Display Product Name: 'Q25G4S'
    Display Range Limits:
      Monitor ranges (Range Limits Only): 48-300 Hz V, 470-470 kHz H, max dotclock 1300 MHz
  Extension blocks: 2
Checksum: 0x54

----------------

Block 1, CTA-861 Extension Block:
  Revision: 3
  Underscans IT Video Formats by default
  Basic audio support
  Supports YCbCr 4:4:4
  Supports YCbCr 4:2:2
  Native DTDs: 1
  Video Data Block:
    VIC   1:   640x480    59.940476 Hz   4:3     31.469 kHz     25.175000 MHz
    VIC   3:   720x480    59.940060 Hz  16:9     31.469 kHz     27.000000 MHz
    VIC   5:  1920x1080i  60.000000 Hz  16:9     33.750 kHz     74.250000 MHz
    VIC  20:  1920x1080i  50.000000 Hz  16:9     28.125 kHz     74.250000 MHz
    VIC   4:  1280x720    60.000000 Hz  16:9     45.000 kHz     74.250000 MHz
    VIC  19:  1280x720    50.000000 Hz  16:9     37.500 kHz     74.250000 MHz
    VIC  31:  1920x1080   50.000000 Hz  16:9     56.250 kHz    148.500000 MHz
    VIC  18:   720x576    50.000000 Hz  16:9     31.250 kHz     27.000000 MHz
    VIC   2:   720x480    59.940060 Hz   4:3     31.469 kHz     27.000000 MHz
    VIC  17:   720x576    50.000000 Hz   4:3     31.250 kHz     27.000000 MHz
    VIC  16:  1920x1080   60.000000 Hz  16:9     67.500 kHz    148.500000 MHz (native)
    VIC  63:  1920x1080  120.000000 Hz  16:9    135.000 kHz    297.000000 MHz
  Audio Data Block:
    Linear PCM:
      Max channels: 2
      Supported sample rates (kHz): 48 44.1 32
      Supported sample sizes (bits): 24 20 16
  Speaker Allocation Data Block:
    FL/FR - Front Left/Right
  Colorimetry Data Block:
    xvYCC601
    xvYCC709
    BT2020cYCC
    BT2020YCC
    BT2020RGB
    Gamut Boundary Description Metadata Profile P0
  HDR Static Metadata Data Block:
    Electro optical transfer functions:
      Traditional gamma - SDR luminance range
      Traditional gamma - HDR luminance range
      SMPTE ST2084
    Supported static metadata descriptors:
      Static metadata type 1
    Desired content max luminance: 101 (445.755 cd/m^2)
    Desired content max frame-average luminance: 101 (445.755 cd/m^2)
    Desired content min luminance: 0 (0.000 cd/m^2)
  Vendor-Specific Data Block (AMD), OUI 00-00-1A:
    Version: 3
    Feature Caps: 0x01
    Minimum Refresh Rate: 48 Hz
    Maximum Refresh Rate: 300 Hz
    Flags 1.x: 0x00
    Flags 2.x: 0x00
  Detailed Timing Descriptors:
    DTD 2:  2560x1440  144.001678 Hz  16:9    214.562 kHz    583.610000 MHz (541 mm x 303 mm)
                 Hfront   48 Hsync  32 Hback   80 Hpol P
                 Vfront   25 Vsync   8 Vback   17 Vpol N
    DTD 3:  2560x1440  120.000000 Hz  16:9    183.000 kHz    497.760000 MHz (541 mm x 303 mm)
                 Hfront   48 Hsync  32 Hback   80 Hpol P
                 Vfront    3 Vsync   5 Vback   77 Vpol P
    DTD 4:  2560x1440  100.000000 Hz  16:9    152.500 kHz    414.800000 MHz (541 mm x 303 mm)
                 Hfront   48 Hsync  32 Hback   80 Hpol P
                 Vfront    3 Vsync   5 Vback   77 Vpol P
Checksum: 0x64  Unused space in Extension Block: 18 bytes

----------------

Block 2, DisplayID Extension Block:
  Version: 1.2
  Extension Count: 0
  Display Product Type: Standalone display device
  Video Timing Modes Type 1 - Detailed Timings Data Block:
    DTD:  2560x1440  300.000488 Hz  16:9    452.401 kHz   1230.530000 MHz (aspect 16:9, no 3D stereo)
               Hfront   48 Hsync  32 Hback   80 Hpol P
               Vfront    8 Vsync  10 Vback   50 Vpol N
    DTD:  2560x1440  269.999442 Hz  16:9    398.519 kHz   1122.230000 MHz (aspect 16:9, no 3D stereo)
               Hfront   48 Hsync  32 Hback  176 Hpol P
               Vfront    3 Vsync   5 Vback   28 Vpol N
    DTD:  2560x1440  240.000967 Hz  16:9    364.801 kHz    992.260000 MHz (aspect 16:9, no 3D stereo)
               Hfront   48 Hsync  32 Hback   80 Hpol P
               Vfront    3 Vsync   5 Vback   72 Vpol N
    DTD:  2560x1440  200.000000 Hz  16:9    304.000 kHz    826.880000 MHz (aspect 16:9, no 3D stereo)
               Hfront   48 Hsync  32 Hback   80 Hpol P
               Vfront    3 Vsync   5 Vback   72 Vpol N
    DTD:  2560x1440  165.001490 Hz  16:9    244.202 kHz    664.230000 MHz (aspect 16:9, no 3D stereo)
               Hfront   48 Hsync  32 Hback   80 Hpol P
               Vfront    3 Vsync   5 Vback   32 Vpol N
  Checksum: 0x4b
Checksum: 0x90

----------------

Warnings:

Block 1, CTA-861 Extension Block:
  Video Data Block: VIC 1 and the first DTD are not identical. Is this intended?
  Display Product Serial Number is set, so the Serial Number in the Base EDID should be 0.
EDID:
  Base EDID: Some timings are out of range of the Monitor Ranges:
    Horizontal Freq: 28.125 - 452.400 kHz (Monitor: 470.000 - 470.000 kHz)

Failures:

Block 0, Base EDID:
  Basic Display Parameters & Features: sRGB is signaled, but the chromaticities do not match.
Block 1, CTA-861 Extension Block:
  Missing VCDB, needed for Set Selectable RGB Quantization to avoid interop issues.
EDID:
  Extension Block 3 started with EDID header, ignoring Extension Blocks >= 3.
  CTA-861: Native progressive timings are a mix of several resolutions.
  DisplayID: Missing DisplayID Display Parameters Data Block.
  DisplayID: DisplayID expects at least one preferred timing.

EDID conformity: FAIL
