edid-decode (hex):

00 ff ff ff ff ff ff 00 21 63 22 91 00 00 00 00
00 20 01 04 b5 20 15 78 03 ee 95 a3 54 4c 99 26
0f 50 54 00 00 00 01 01 01 01 01 01 01 01 01 01
01 01 01 01 01 01 ad 6c 00 c8 a0 40 50 60 30 20
a5 00 3c cb 10 00 00 1a 04 a3 00 c8 a0 40 50 60
30 20 a5 00 3c cb 10 00 00 1a 00 00 00 fd 00 28
5a 98 98 29 01 0a 20 20 20 20 20 20 00 00 00 fe
00 4d 42 31 34 35 4c 53 30 31 2d 31 20 20 00 d9

00 ff ff ff ff ff ff 00 21 63 22 91 00 00 00 00
00 20 01 04 b5 20 15 78 03 ee 95 a3 54 4c 99 26
0f 50 54 00 00 00 01 01 01 01 01 01 01 01 01 01
01 01 01 01 01 01 ad 6c 00 c8 a0 40 50 60 30 20
a5 00 3c cb 10 00 00 1a 04 a3 00 c8 a0 40 50 60
30 20 a5 00 3c cb 10 00 00 1a 00 00 00 fd 00 28
5a 98 98 29 01 0a 20 20 20 20 20 20 00 00 00 fe
00 4d 42 31 34 35 4c 53 30 31 2d 31 20 20 00 d9

----------------

Block 0, Base EDID:
  EDID Structure Version & Revision: 1.4
  Vendor & Product Identification:
    Manufacturer: HKC
    Model: 37154
    Made in: 2022
  Basic Display Parameters & Features:
    Digital display
    Bits per primary color channel: 10
    DisplayPort interface
    Maximum image size: 32 cm x 21 cm
    Gamma: 2.20
    Supported color formats: RGB 4:4:4
    First detailed timing includes the native pixel format and preferred refresh rate
    Display supports continuous frequencies
  Color Characteristics:
    Red  : 0.6396, 0.3300
    Green: 0.2998, 0.5996
    Blue : 0.1503, 0.0595
    White: 0.3134, 0.3291
  Established Timings I & II: none
  Standard Timings: none
  Detailed Timing Descriptors:
    DTD 1:  2560x1600   60.000431 Hz  16:10   100.801 kHz    278.210000 MHz (316 mm x 203 mm)
                 Hfront   48 Hsync  32 Hback  120 Hpol P
                 Vfront   10 Vsync   5 Vback   65 Vpol N
    DTD 2:  2560x1600   90.001725 Hz  16:10   151.203 kHz    417.320000 MHz (316 mm x 203 mm)
                 Hfront   48 Hsync  32 Hback  120 Hpol P
                 Vfront   10 Vsync   5 Vback   65 Vpol N
    Display Range Limits:
      Monitor ranges (Range Limits Only): 40-90 Hz V, 152-152 kHz H, max dotclock 410 MHz
    Alphanumeric Data String: 'MB145LS01-1  '
Checksum: 0xd9

----------------

Block 1, Unknown EDID Extension Block 0x00:
  00 ff ff ff ff ff ff 00 21 63 22 91 00 00 00 00 '........!c".....'
  00 20 01 04 b5 20 15 78 03 ee 95 a3 54 4c 99 26 '. ... .x....TL.&'
  0f 50 54 00 00 00 01 01 01 01 01 01 01 01 01 01 '.PT.............'
  01 01 01 01 01 01 ad 6c 00 c8 a0 40 50 60 30 20 '.......l...@P`0 '
  a5 00 3c cb 10 00 00 1a 04 a3 00 c8 a0 40 50 60 '..<..........@P`'
  30 20 a5 00 3c cb 10 00 00 1a 00 00 00 fd 00 28 '0 ..<..........('
  5a 98 98 29 01 0a 20 20 20 20 20 20 00 00 00 fe 'Z..)..      ....'
  00 4d 42 31 34 35 4c 53 30 31 2d 31 20 20 00 d9 '.MB145LS01-1  ..'
Checksum: 0xd9

----------------

Warnings:

Block 0, Base EDID:
  Missing Display Product Name.
EDID:
  Base EDID: Some timings are out of range of the Monitor Ranges:
    Horizontal Freq: 100.800 - 151.202 kHz (Monitor: 152.000 - 152.000 kHz)
    Maximum Clock: 417.320 MHz (Monitor: 410.000 MHz)

Failures:

Block 0, Base EDID:
  Alphanumeric Data String: No newline, but one or more trailing spaces.
Block 1, Base EDID:
  Unknown Extension Block.
EDID:
  Base EDID: EDID specified 0 extension block(s), but found 1 extension block(s).

EDID conformity: FAIL
