edid-decode (hex):

00 ff ff ff ff ff ff 00 0d 04 01 90 00 00 00 97
2f 0e 01 03 68 3c 22 61 2a 4e 60 a5 55 44 99 24
12 49 4b 21 08 40 81 80 01 01 01 01 01 01 01 01
01 01 01 01 01 01 4d 1f 00 90 51 00 1b 30 40 86
13 00 58 54 21 00 00 1a 00 00 00 fc 00 4c 53 30
38 0a 20 20 20 20 20 20 20 20 00 00 00 00 00 00
00 00 00 00 00 00 00 00 00 00 00 00 00 00 00 00
00 00 00 00 00 00 00 00 00 00 00 00 00 00 00 0f

----------------

Block 0, Base EDID:
  EDID Structure Version & Revision: 1.3
  Vendor & Product Identification:
    Manufacturer: CHD
    Model: 36865
    Serial Number: ...
    Made in: week 47 of 2004
  Basic Display Parameters & Features:
    Analog display
    Signal Level Standard: 0.700 : 0.000 : 0.700 V p-p
    Blank level equals black level
    Sync: Separate
    Maximum image size: 60 cm x 34 cm
    Gamma: 1.97
    DPMS levels: Off
    RGB color display
    First detailed timing is the preferred timing
  Color Characteristics:
    Red  : 0.6455, 0.3320
    Green: 0.2685, 0.5996
    Blue : 0.1416, 0.0722
    White: 0.2851, 0.2929
  Established Timings I & II:
    DMT 0x04:   640x480    59.940476 Hz   4:3     31.469 kHz     25.175000 MHz
    DMT 0x09:   800x600    60.316541 Hz   4:3     37.879 kHz     40.000000 MHz
    DMT 0x10:  1024x768    60.003840 Hz   4:3     48.363 kHz     65.000000 MHz
  Standard Timings:
    DMT 0x23:  1280x1024   60.019740 Hz   5:4     63.981 kHz    108.000000 MHz
  Detailed Timing Descriptors:
    DTD 1:  1280x768    59.995508 Hz   5:3     47.696 kHz     80.130000 MHz (600 mm x 340 mm)
                 Hfront   64 Hsync 134 Hback  202 Hpol P
                 Vfront    1 Vsync   3 Vback   23 Vpol N
    Display Product Name: 'LS08'
    Empty Descriptor
    Empty Descriptor
Checksum: 0x0f

----------------

Warnings:

Block 0, Base EDID:
  Detailed Timing Descriptor #1: Image size is 600x340 mm, but based on the picture AR it should be 600x360 mm.

Failures:

Block 0, Base EDID:
  Empty Descriptor: Use Dummy Descriptor instead of all zeroes.
  Empty Descriptor: Use Dummy Descriptor instead of all zeroes.
  Missing Display Range Limits Descriptor.

EDID conformity: FAIL
