edid-decode (hex):

00 ff ff ff ff ff ff 00 21 63 76 07 00 00 00 00
00 22 01 04 a5 1e 13 78 e3 99 80 94 5a 58 92 28
1d 50 54 00 00 00 01 01 01 01 01 01 01 01 01 01
01 01 01 01 01 01 35 3c 80 a0 70 b0 23 40 30 20
36 00 2e bc 10 00 00 19 00 00 00 fd 00 30 3c 44
44 0f 01 0a 20 20 20 20 20 20 00 00 00 fe 00 48
4b 43 20 4d 59 20 20 20 20 0a 20 20 00 00 00 fe
00 4d 42 31 34 30 44 53 30 31 2d 37 20 20 00 29

00 ff ff ff ff ff ff 00 21 63 76 07 00 00 00 00
00 22 01 04 a5 1e 13 78 e3 99 80 94 5a 58 92 28
1d 50 54 00 00 00 01 01 01 01 01 01 01 01 01 01
01 01 01 01 01 01 35 3c 80 a0 70 b0 23 40 30 20
36 00 2e bc 10 00 00 19 00 00 00 fd 00 30 3c 44
44 0f 01 0a 20 20 20 20 20 20 00 00 00 fe 00 48
4b 43 20 4d 59 20 20 20 20 0a 20 20 00 00 00 fe
00 4d 42 31 34 30 44 53 30 31 2d 37 20 20 00 29

----------------

Block 0, Base EDID:
  EDID Structure Version & Revision: 1.4
  Vendor & Product Identification:
    Manufacturer: HKC
    Model: 1910
    Made in: 2024
  Basic Display Parameters & Features:
    Digital display
    Bits per primary color channel: 8
    DisplayPort interface
    Maximum image size: 30 cm x 19 cm
    Gamma: 2.20
    DPMS levels: Standby Suspend Off
    Supported color formats: RGB 4:4:4
    First detailed timing includes the native pixel format and preferred refresh rate
    Display supports continuous frequencies
  Color Characteristics:
    Red  : 0.5800, 0.3525
    Green: 0.3457, 0.5712
    Blue : 0.1582, 0.1132
    White: 0.3125, 0.3281
  Established Timings I & II: none
  Standard Timings: none
  Detailed Timing Descriptors:
    DTD 1:  1920x1200   60.000779 Hz  16:10    74.101 kHz    154.130000 MHz (302 mm x 188 mm)
                 Hfront   48 Hsync  32 Hback   80 Hpol N
                 Vfront    3 Vsync   6 Vback   26 Vpol N
    Display Range Limits:
      Monitor ranges (Range Limits Only): 48-60 Hz V, 68-68 kHz H, max dotclock 150 MHz
    Alphanumeric Data String: 'HKC MY    '
    Alphanumeric Data String: 'MB140DS01-7  '
Checksum: 0x29

----------------

Warnings:

Block 0, Base EDID:
  Missing Display Product Name.
EDID:
  Base EDID: Some timings are out of range of the Monitor Ranges:
    Horizontal Freq: 74.100 - 74.100 kHz (Monitor: 68.000 - 68.000 kHz)
    Maximum Clock: 154.130 MHz (Monitor: 150.000 MHz)

Failures:

Block 0, Base EDID:
  Alphanumeric Data String: One or more trailing spaces before newline.
  Alphanumeric Data String: No newline, but one or more trailing spaces.
EDID:
  Extension Block 1 started with EDID header, ignoring Extension Blocks >= 1.

EDID conformity: FAIL
