edid-decode (hex):

00 ff ff ff ff ff ff 00 22 64 a5 06 a2 01 00 00
07 13 01 03 80 27 17 78 0a dc 25 9c 5b 52 98 26
17 50 54 00 00 00 01 01 01 01 01 01 01 01 01 01
01 01 01 01 01 01 cc 33 80 60 70 38 10 40 18 20
46 00 7e d7 10 00 00 19 00 00 00 fe 00 00 00 00
00 00 00 00 00 00 00 00 00 00 00 00 00 fc 00 48
53 44 31 37 33 50 55 57 31 0a 20 20 00 00 00 10
00 0a 20 20 20 20 20 20 20 20 20 20 20 20 00 a9

00 ff ff ff ff ff ff 00 22 64 a5 06 a2 01 00 00
07 13 01 03 80 27 17 78 0a dc 25 9c 5b 52 98 26
17 50 54 00 00 00 01 01 01 01 01 01 01 01 01 01
01 01 01 01 01 01 cc 33 80 60 70 38 10 40 18 20
46 00 7e d7 10 00 00 19 00 00 00 fe 00 00 00 00
00 00 00 00 00 00 00 00 00 00 00 00 00 fc 00 48
53 44 31 37 33 50 55 57 31 0a 20 20 00 00 00 10
00 0a 20 20 20 20 20 20 20 20 20 20 20 20 00 a9

----------------

Block 0, Base EDID:
  EDID Structure Version & Revision: 1.3
  Vendor & Product Identification:
    Manufacturer: HSD
    Model: 1701
    Serial Number: ...
    Made in: week 7 of 2009
  Basic Display Parameters & Features:
    Digital display
    Maximum image size: 39 cm x 23 cm
    Gamma: 2.20
    RGB color display
    First detailed timing is the preferred timing
  Color Characteristics:
    Red  : 0.6123, 0.3564
    Green: 0.3232, 0.5937
    Blue : 0.1484, 0.0917
    White: 0.3134, 0.3291
  Established Timings I & II: none
  Standard Timings: none
  Detailed Timing Descriptors:
    DTD 1:  1920x1080   60.012600 Hz  16:9     65.774 kHz    132.600000 MHz (382 mm x 215 mm)
                 Hfront   24 Hsync  32 Hback   40 Hpol N
                 Vfront    4 Vsync   6 Vback    6 Vpol N
    Alphanumeric Data String: ''
    Display Product Name: 'HSD173PUW1'
    Dummy Descriptor:
Checksum: 0xa9

----------------

Block 1, Unknown EDID Extension Block 0x00:
  00 ff ff ff ff ff ff 00 22 64 a5 06 a2 01 00 00 '........"d......'
  07 13 01 03 80 27 17 78 0a dc 25 9c 5b 52 98 26 '.....'.x..%.[R.&'
  17 50 54 00 00 00 01 01 01 01 01 01 01 01 01 01 '.PT.............'
  01 01 01 01 01 01 cc 33 80 60 70 38 10 40 18 20 '.......3.`p8.@. '
  46 00 7e d7 10 00 00 19 00 00 00 fe 00 00 00 00 'F.~.............'
  00 00 00 00 00 00 00 00 00 00 00 00 00 fc 00 48 '...............H'
  53 44 31 37 33 50 55 57 31 0a 20 20 00 00 00 10 'SD173PUW1.  ....'
  00 0a 20 20 20 20 20 20 20 20 20 20 20 20 00 a9 '..            ..'
Checksum: 0xa9

----------------

Failures:

Block 0, Base EDID:
  Alphanumeric Data String: NUL byte at position 0.
  Dummy Descriptor: Dummy block filled with garbage.
  Missing Display Range Limits Descriptor.
Block 1, Base EDID:
  Unknown Extension Block.
EDID:
  Base EDID: EDID specified 0 extension block(s), but found 1 extension block(s).

EDID conformity: FAIL
