edid-decode (hex):

00 ff ff ff ff ff ff 00 14 8f 45 42 00 00 00 00
19 22 01 04 b5 20 14 78 02 d0 45 ae 51 3e ba 23
0b 50 54 00 00 00 01 01 01 01 01 01 01 01 01 01
01 01 01 01 01 01 00 00 00 10 00 00 00 00 00 00
00 00 00 00 00 00 00 00 00 00 00 10 00 00 00 00
00 00 00 00 00 00 00 00 00 00 00 00 00 fe 00 45
44 4f 20 53 48 0a 20 20 20 20 20 20 00 00 00 fc
00 45 46 31 30 51 42 43 36 34 2e 43 0a 20 02 0b

02 03 1d 00 e3 05 80 00 e6 06 05 01 8b 6b 02 6d
1a 00 00 03 02 3c a5 00 a0 8b 02 6b 02 00 00 00
00 00 00 00 00 00 00 00 00 00 00 00 00 00 00 00
00 00 00 00 00 00 00 00 00 00 00 00 00 00 00 00
00 00 00 00 00 00 00 00 00 00 00 00 00 00 00 00
00 00 00 00 00 00 00 00 00 00 00 00 00 00 00 00
00 00 00 00 00 00 00 00 00 00 00 00 00 00 00 00
00 00 00 00 00 00 00 00 00 00 00 00 00 00 00 85

70 20 79 02 00 20 00 0c 38 ec 11 45 42 00 00 00
00 00 18 00 21 00 1d 80 0c d0 07 00 0a 40 06 00
ee 2a 51 df 23 ba 35 02 0b 02 45 54 ee 5f ee 63
ea 10 23 78 26 00 09 04 00 00 00 00 00 40 00 00
22 00 28 73 f1 0b 05 ff 09 9f 00 4f 00 1f 00 3f
06 7b 0c 31 8c 07 00 73 f1 0b 85 ff 09 9f 00 4f
00 1f 00 3f 06 8f 00 45 80 07 00 00 00 00 00 00
00 00 00 00 00 00 00 00 00 00 00 00 00 00 c0 90

00 ff ff ff ff ff ff 00 14 8f 45 42 00 00 00 00
19 22 01 04 b5 20 14 78 02 d0 45 ae 51 3e ba 23
0b 50 54 00 00 00 01 01 01 01 01 01 01 01 01 01
01 01 01 01 01 01 00 00 00 10 00 00 00 00 00 00
00 00 00 00 00 00 00 00 00 00 00 10 00 00 00 00
00 00 00 00 00 00 00 00 00 00 00 00 00 fe 00 45
44 4f 20 53 48 0a 20 20 20 20 20 20 00 00 00 fc
00 45 46 31 30 51 42 43 36 34 2e 43 0a 20 02 0b

02 03 1d 00 e3 05 80 00 e6 06 05 01 8b 6b 02 6d
1a 00 00 03 02 3c a5 00 a0 8b 02 6b 02 00 00 00
00 00 00 00 00 00 00 00 00 00 00 00 00 00 00 00
00 00 00 00 00 00 00 00 00 00 00 00 00 00 00 00
00 00 00 00 00 00 00 00 00 00 00 00 00 00 00 00
00 00 00 00 00 00 00 00 00 00 00 00 00 00 00 00
00 00 00 00 00 00 00 00 00 00 00 00 00 00 00 00
00 00 00 00 00 00 00 00 00 00 00 00 00 00 00 85

70 20 79 02 00 20 00 0c 38 ec 11 45 42 00 00 00
00 00 18 00 21 00 1d 80 0c d0 07 00 0a 40 06 00
ee 2a 51 df 23 ba 35 02 0b 02 45 54 ee 5f ee 63
ea 10 23 78 26 00 09 04 00 00 00 00 00 40 00 00
22 00 28 73 f1 0b 05 ff 09 9f 00 4f 00 1f 00 3f
06 7b 0c 31 8c 07 00 73 f1 0b 85 ff 09 9f 00 4f
00 1f 00 3f 06 8f 00 45 80 07 00 00 00 00 00 00
00 00 00 00 00 00 00 00 00 00 00 00 00 00 c0 90

----------------

Block 0, Base EDID:
  EDID Structure Version & Revision: 1.4
  Vendor & Product Identification:
    Manufacturer: EDO
    Model: 16965
    Made in: week 25 of 2024
  Basic Display Parameters & Features:
    Digital display
    Bits per primary color channel: 10
    DisplayPort interface
    Maximum image size: 32 cm x 20 cm
    Gamma: 2.20
    Supported color formats: RGB 4:4:4
    First detailed timing includes the native pixel format and preferred refresh rate
  Color Characteristics:
    Red  : 0.6826, 0.3173
    Green: 0.2421, 0.7265
    Blue : 0.1376, 0.0429
    White: 0.3134, 0.3291
  Established Timings I & II: none
  Standard Timings: none
  Detailed Timing Descriptors:
    Dummy Descriptor:
    Dummy Descriptor:
    Alphanumeric Data String: 'EDO SH'
    Display Product Name: 'EF10QBC64.C'
  Extension blocks: 2
Checksum: 0x0b

----------------

Block 1, CTA-861 Extension Block:
  Revision: 3
  Native DTDs: 0
  Colorimetry Data Block:
    BT2020RGB
  HDR Static Metadata Data Block:
    Electro optical transfer functions:
      Traditional gamma - SDR luminance range
      SMPTE ST2084
    Supported static metadata descriptors:
      Static metadata type 1
    Desired content max luminance: 139 (1015.241 cd/m^2)
    Desired content max frame-average luminance: 107 (507.620 cd/m^2)
    Desired content min luminance: 2 (0.001 cd/m^2)
  Vendor-Specific Data Block (AMD), OUI 00-00-1A:
    Version: 3
    Flags 1: 0x02
      FreeSync 2 HDR Supported
    Minimum Refresh Rate: 60 Hz
    Maximum Refresh Rate: 165 Hz
    Flags 5: 0xa0
      Display is OLED
      ST 2084 (PQ) EOTF Supported
    Maximum luminance: 139 (1015.241 cd/m^2)
    Minimum luminance: 2 (0.001 cd/m^2)
    Maximum luminance (without local dimming): 107 (507.620 cd/m^2)
    Minimum luminance (without local dimming): 2 (0.000 cd/m^2)
Checksum: 0x85  Unused space in Extension Block: 98 bytes

----------------

Block 2, DisplayID Extension Block:
  Version: 2.0
  Extension Count: 0
  Display Product Primary Use Case: None of the listed primary use cases; generic display
  Product Identification Data Block (0x20), OUI 38-EC-11:
    Product Code: 16965
    Year of Manufacture: 2024
  Display Parameters Data Block (0x21):
    Image size: 320.0 mm x 200.0 mm
    Display native pixel format: 2560x1600
    Scan Orientation: Left to Right, Top to Bottom
    Luminance Information: Minimum guaranteed value
    Color Information: CIE 1931
    Audio Speaker Information: integrated
    Native Color Chromaticity:
      Primary #1:  (0.683105, 0.316895)
      Primary #2:  (0.241943, 0.727051)
      Primary #3:  (0.137939, 0.042969)
      White Point: (0.312988, 0.329102)
    Native Maximum Luminance (Full Coverage): 507.500000 cd/m^2
    Native Maximum Luminance (10% Rectangular Coverage): 1015.000000 cd/m^2
    Native Minimum Luminance: 0.000600 cd/m^2
    Native Color Depth: 10 bpc
    Display Device Technology: Organic LED
    Native Gamma EOTF: 2.20
  Display Interface Features Data Block:
    Supported bpc for RGB encoding: 10
    Supported color space and EOTF standard combination 1: BT.2020/SMPTE ST 2084
  Video Timing Modes Type 7 - Detailed Timings Data Block:
    DTD:  2560x1600   60.000061 Hz  16:10   287.760 kHz    782.708000 MHz (aspect 16:10, no 3D stereo)
               Hfront   80 Hsync  32 Hback   48 Hpol N
               Vfront 3122 Vsync   8 Vback   66 Vpol P
    DTD:  2560x1600  165.000169 Hz  16:10   287.760 kHz    782.708000 MHz (aspect 16:10, no 3D stereo, preferred)
               Hfront   80 Hsync  32 Hback   48 Hpol N
               Vfront   70 Vsync   8 Vback   66 Vpol P
  Checksum: 0xc0
Checksum: 0x90

----------------

Warnings:

Block 1, CTA-861 Extension Block:
  IT Video Formats are overscanned by default, but normally this should be underscanned.
  Colorimetry Data Block: Set the sRGB colorimetry bit to avoid interop issues.

Failures:

Block 0, Base EDID:
  Standard Timings: Missing preferred timing.
Block 1, CTA-861 Extension Block:
  Required 640x480p60 timings are missing in the established timings and the SVD list (VIC 1).
  Missing VCDB, needed for Set Selectable RGB Quantization to avoid interop issues.
EDID:
  Extension Block 3 started with EDID header, ignoring Extension Blocks >= 3.

EDID conformity: FAIL
