edid-decode (hex):

00 ff ff ff ff ff ff 00 30 e4 e3 03 00 00 00 00
00 17 01 04 95 1f 11 78 0a 4b b5 94 58 56 91 28
1f 50 54 00 00 00 01 01 01 01 01 01 01 01 01 01
01 01 01 01 01 01 ce 1d 56 f4 50 00 16 30 30 20
35 00 35 ae 10 00 00 19 e0 13 56 f4 50 00 16 30
30 20 35 00 35 ae 10 00 00 19 00 00 00 fe 00 44
56 4d 32 44 80 31 34 30 57 48 55 0a 00 00 00 00
00 00 41 31 94 01 10 00 00 09 01 0a 20 20 00 42

----------------

Block 0, Base EDID:
  EDID Structure Version & Revision: 1.4
  Vendor & Product Identification:
    Manufacturer: LGD
    Model: 995
    Made in: 2013
  Basic Display Parameters & Features:
    Digital display
    Bits per primary color channel: 6
    DisplayPort interface
    Maximum image size: 31 cm x 17 cm
    Gamma: 2.20
    Supported color formats: RGB 4:4:4, YCrCb 4:4:4
    First detailed timing includes the native pixel format and preferred refresh rate
  Color Characteristics:
    Red  : 0.5791, 0.3437
    Green: 0.3378, 0.5693
    Blue : 0.1582, 0.1240
    White: 0.3134, 0.3291
  Established Timings I & II: none
  Standard Timings: none
  Detailed Timing Descriptors:
    DTD 1:  1366x768    59.988993 Hz 683:384   47.391 kHz     76.300000 MHz (309 mm x 174 mm)
                 Hfront   48 Hsync  32 Hback  164 Hpol N
                 Vfront    3 Vsync   5 Vback   14 Vpol N
    DTD 2:  1366x768    40.003145 Hz 683:384   31.602 kHz     50.880000 MHz (309 mm x 174 mm)
                 Hfront   48 Hsync  32 Hback  164 Hpol N
                 Vfront    3 Vsync   5 Vback   14 Vpol N
    Alphanumeric Data String: 'DVM2D.140WHU'
    Manufacturer-Specified Display Descriptor (0x00): 00 00 00 00 41 31 94 01 10 00 00 09 01 0a 20 20 '....A1........  '
Checksum: 0x42

----------------

Warnings:

Block 0, Base EDID:
  Alphanumeric Data String: Non-ASCII character 0x80 at position 5, can cause problems.
  Missing Display Product Name.

EDID conformity: PASS
