edid-decode (hex):

00 ff ff ff ff ff ff 00 26 13 00 20 00 00 00 00
27 20 01 03 80 2d 18 78 0a d7 a5 a2 59 4a 96 24
14 50 54 ad ce 00 d1 c0 b3 00 01 01 81 80 81 40
81 c0 01 01 01 01 31 2e 40 00 62 84 22 30 58 a8
35 00 bb f9 10 00 00 1c ca 39 40 00 62 84 22 30
58 a8 35 00 bb f9 10 00 00 1c 00 00 00 fd 00 32
4c 1e 48 13 00 0a 20 20 20 20 20 20 00 00 00 fc
00 4e 32 30 30 20 48 44 56 33 0a 20 20 20 01 6a

02 03 20 f1 48 04 03 13 12 01 02 11 1e 23 09 17
07 83 01 00 00 67 03 0c 00 10 00 00 2d e2 00 4f
01 1d 00 72 51 d0 1e 20 6e 28 55 00 fe 1f 11 00
00 1e 01 1d 00 bc 52 d0 1e 20 b8 28 55 40 e8 12
11 00 00 1e 00 00 00 00 00 00 00 00 00 00 00 00
00 00 00 00 00 00 00 00 00 00 00 00 00 00 00 00
00 00 00 00 00 00 00 00 00 00 00 00 00 00 00 00
00 00 00 00 00 00 00 00 00 00 00 00 00 00 00 94

00 ff ff ff ff ff ff 00 26 13 00 20 00 00 00 00
27 20 01 03 80 2d 18 78 0a d7 a5 a2 59 4a 96 24
14 50 54 ad ce 00 d1 c0 b3 00 01 01 81 80 81 40
81 c0 01 01 01 01 31 2e 40 00 62 84 22 30 58 a8
35 00 bb f9 10 00 00 1c ca 39 40 00 62 84 22 30
58 a8 35 00 bb f9 10 00 00 1c 00 00 00 fd 00 32
4c 1e 48 13 00 0a 20 20 20 20 20 20 00 00 00 fc
00 4e 32 30 30 20 48 44 56 33 0a 20 20 20 01 6a

02 03 20 f1 48 04 03 13 12 01 02 11 1e 23 09 17
07 83 01 00 00 67 03 0c 00 10 00 00 2d e2 00 4f
01 1d 00 72 51 d0 1e 20 6e 28 55 00 fe 1f 11 00
00 1e 01 1d 00 bc 52 d0 1e 20 b8 28 55 40 e8 12
11 00 00 1e 00 00 00 00 00 00 00 00 00 00 00 00
00 00 00 00 00 00 00 00 00 00 00 00 00 00 00 00
00 00 00 00 00 00 00 00 00 00 00 00 00 00 00 00
00 00 00 00 00 00 00 00 00 00 00 00 00 00 00 94

----------------

Block 0, Base EDID:
  EDID Structure Version & Revision: 1.3
  Vendor & Product Identification:
    Manufacturer: IPS
    Model: 8192
    Made in: week 39 of 2022
  Basic Display Parameters & Features:
    Digital display
    Maximum image size: 45 cm x 24 cm
    Gamma: 2.20
    RGB color display
    First detailed timing is the preferred timing
  Color Characteristics:
    Red  : 0.6357, 0.3486
    Green: 0.2900, 0.5888
    Blue : 0.1425, 0.0800
    White: 0.3134, 0.3291
  Established Timings I & II:
    IBM     :   720x400    70.081663 Hz   9:5     31.467 kHz     28.320000 MHz
    DMT 0x04:   640x480    59.940476 Hz   4:3     31.469 kHz     25.175000 MHz
    DMT 0x05:   640x480    72.808802 Hz   4:3     37.861 kHz     31.500000 MHz
    DMT 0x06:   640x480    75.000000 Hz   4:3     37.500 kHz     31.500000 MHz
    DMT 0x09:   800x600    60.316541 Hz   4:3     37.879 kHz     40.000000 MHz
    DMT 0x0a:   800x600    72.187572 Hz   4:3     48.077 kHz     50.000000 MHz
    DMT 0x0b:   800x600    75.000000 Hz   4:3     46.875 kHz     49.500000 MHz
    DMT 0x10:  1024x768    60.003840 Hz   4:3     48.363 kHz     65.000000 MHz
    DMT 0x11:  1024x768    70.069359 Hz   4:3     56.476 kHz     75.000000 MHz
    DMT 0x12:  1024x768    75.028582 Hz   4:3     60.023 kHz     78.750000 MHz
  Standard Timings:
    DMT 0x52:  1920x1080   60.000000 Hz  16:9     67.500 kHz    148.500000 MHz
    DMT 0x3a:  1680x1050   59.954250 Hz  16:10    65.290 kHz    146.250000 MHz
    DMT 0x23:  1280x1024   60.019740 Hz   5:4     63.981 kHz    108.000000 MHz
    DMT 0x20:  1280x960    60.000000 Hz   4:3     60.000 kHz    108.000000 MHz
    DMT 0x55:  1280x720    60.000000 Hz  16:9     45.000 kHz     74.250000 MHz
  Detailed Timing Descriptors:
    DTD 1:  1600x900    59.946021 Hz  16:9     55.990 kHz    118.250000 MHz (443 mm x 249 mm)
                 Hfront   88 Hsync 168 Hback  256 Hpol N
                 Vfront    3 Vsync   5 Vback   26 Vpol P
    DTD 2:  1600x900    74.997161 Hz  16:9     70.047 kHz    147.940000 MHz (443 mm x 249 mm)
                 Hfront   88 Hsync 168 Hback  256 Hpol N
                 Vfront    3 Vsync   5 Vback   26 Vpol P
    Display Range Limits:
      Monitor ranges (GTF): 50-76 Hz V, 30-72 kHz H, max dotclock 190 MHz
    Display Product Name: 'N200 HDV3'
  Extension blocks: 1
Checksum: 0x6a

----------------

Block 1, CTA-861 Extension Block:
  Revision: 3
  Underscans IT Video Formats by default
  Basic audio support
  Supports YCbCr 4:4:4
  Supports YCbCr 4:2:2
  Native DTDs: 1
  Video Data Block:
    VIC   4:  1280x720    60.000000 Hz  16:9     45.000 kHz     74.250000 MHz
    VIC   3:   720x480    59.940060 Hz  16:9     31.469 kHz     27.000000 MHz
    VIC  19:  1280x720    50.000000 Hz  16:9     37.500 kHz     74.250000 MHz
    VIC  18:   720x576    50.000000 Hz  16:9     31.250 kHz     27.000000 MHz
    VIC   1:   640x480    59.940476 Hz   4:3     31.469 kHz     25.175000 MHz
    VIC   2:   720x480    59.940060 Hz   4:3     31.469 kHz     27.000000 MHz
    VIC  17:   720x576    50.000000 Hz   4:3     31.250 kHz     27.000000 MHz
    VIC  30:  1440x576    50.000000 Hz  16:9     31.250 kHz     54.000000 MHz
  Audio Data Block:
    Linear PCM:
      Max channels: 2
      Supported sample rates (kHz): 96 48 44.1 32
      Supported sample sizes (bits): 24 20 16
  Speaker Allocation Data Block:
    FL/FR - Front Left/Right
  Vendor-Specific Data Block (HDMI), OUI 00-0C-03:
    Source physical address: 1.0.0.0
    Maximum TMDS clock: 225 MHz
  Video Capability Data Block:
    YCbCr quantization: No Data
    RGB quantization: Selectable (via AVI Q)
    PT scan behavior: No Data
    IT scan behavior: Supports both over- and underscan
    CE scan behavior: Supports both over- and underscan
  Detailed Timing Descriptors:
    DTD 3:  1280x720    60.000000 Hz  16:9     45.000 kHz     74.250000 MHz (510 mm x 287 mm)
                 Hfront  110 Hsync  40 Hback  220 Hpol P
                 Vfront    5 Vsync   5 Vback   20 Vpol P
    DTD 4:  1280x720    50.000000 Hz  16:9     37.500 kHz     74.250000 MHz (488 mm x 274 mm)
                 Hfront  440 Hsync  40 Hback  220 Hpol P
                 Vfront    5 Vsync   5 Vback   20 Vpol P
Checksum: 0x94  Unused space in Extension Block: 59 bytes

----------------

Warnings:

Block 1, CTA-861 Extension Block:
  Video Data Block: VIC 4 and the first DTD are not identical. Is this intended?
  Video Capability Data Block: Set Selectable YCbCr Quantization to avoid interop issues.
  Add a Colorimetry Data Block with the sRGB colorimetry bit set to avoid interop issues.

Failures:

Block 1, CTA-861 Extension Block:
  Detailed Timing Descriptor #3: Mismatch of image size 510x287 mm vs display size 450x240 mm.
  Detailed Timing Descriptor #4: Mismatch of image size 488x274 mm vs display size 450x240 mm.
EDID:
  Extension Block 2 started with EDID header, ignoring Extension Blocks >= 2.
  Base EDID: The DTD max image size is 510x287mm, which is larger than the display size 450.0x240.0mm.

EDID conformity: FAIL
