edid-decode (hex):

00 ff ff ff ff ff ff 00 5a 8b 00 32 00 00 00 00
13 1d 01 03 80 46 27 78 2a 64 f5 ad 50 49 a3 22
13 50 54 a5 4b 00 71 4f 81 c0 81 80 95 00 a9 c0
b3 00 d1 c0 d1 00 b1 5f 00 a0 a0 a0 3d 50 30 20
45 00 ba 89 21 00 00 1a a8 e5 00 a0 a0 a0 3d 50
20 40 45 00 ba 89 21 00 00 1a 00 00 00 fd 00 30
90 1f f0 3c 00 0a 20 20 20 20 20 20 00 00 00 fc
00 47 4e 33 32 44 41 0a 20 20 20 20 20 20 01 47

02 03 36 f1 4d 90 01 02 03 04 11 12 13 1f 29 2f
3f 40 23 09 07 07 83 01 00 00 6a 03 0c 00 10 00
38 3c 20 00 00 67 d8 5d c4 01 78 c0 03 68 1a 00
00 01 01 30 90 ed 61 bf 00 a0 a0 a0 3d 50 20 40
45 00 ba 89 21 00 00 1a 61 38 00 18 51 a0 66 50
20 28 55 00 ba 8e 21 00 00 1a 38 8b 80 18 71 38
2d 40 58 2c 45 00 ba 89 21 00 00 1e 00 00 00 00
00 00 00 00 00 00 00 00 00 00 00 00 00 00 00 35

00 ff ff ff ff ff ff 00 5a 8b 00 32 00 00 00 00
13 1d 01 03 80 46 27 78 2a 64 f5 ad 50 49 a3 22
13 50 54 a5 4b 00 71 4f 81 c0 81 80 95 00 a9 c0
b3 00 d1 c0 d1 00 b1 5f 00 a0 a0 a0 3d 50 30 20
45 00 ba 89 21 00 00 1a a8 e5 00 a0 a0 a0 3d 50
20 40 45 00 ba 89 21 00 00 1a 00 00 00 fd 00 30
90 1f f0 3c 00 0a 20 20 20 20 20 20 00 00 00 fc
00 47 4e 33 32 44 41 0a 20 20 20 20 20 20 01 47

02 03 36 f1 4d 90 01 02 03 04 11 12 13 1f 29 2f
3f 40 23 09 07 07 83 01 00 00 6a 03 0c 00 10 00
38 3c 20 00 00 67 d8 5d c4 01 78 c0 03 68 1a 00
00 01 01 30 90 ed 61 bf 00 a0 a0 a0 3d 50 20 40
45 00 ba 89 21 00 00 1a 61 38 00 18 51 a0 66 50
20 28 55 00 ba 8e 21 00 00 1a 38 8b 80 18 71 38
2d 40 58 2c 45 00 ba 89 21 00 00 1e 00 00 00 00
00 00 00 00 00 00 00 00 00 00 00 00 00 00 00 35

----------------

Block 0, Base EDID:
  EDID Structure Version & Revision: 1.3
  Vendor & Product Identification:
    Manufacturer: VTK
    Model: 12800
    Made in: week 19 of 2019
  Basic Display Parameters & Features:
    Digital display
    Maximum image size: 70 cm x 39 cm
    Gamma: 2.20
    DPMS levels: Off
    RGB color display
    First detailed timing is the preferred timing
  Color Characteristics:
    Red  : 0.6767, 0.3144
    Green: 0.2861, 0.6367
    Blue : 0.1357, 0.0771
    White: 0.3134, 0.3291
  Established Timings I & II:
    IBM     :   720x400    70.081663 Hz   9:5     31.467 kHz     28.320000 MHz
    DMT 0x04:   640x480    59.940476 Hz   4:3     31.469 kHz     25.175000 MHz
    DMT 0x06:   640x480    75.000000 Hz   4:3     37.500 kHz     31.500000 MHz
    DMT 0x09:   800x600    60.316541 Hz   4:3     37.879 kHz     40.000000 MHz
    DMT 0x0b:   800x600    75.000000 Hz   4:3     46.875 kHz     49.500000 MHz
    DMT 0x10:  1024x768    60.003840 Hz   4:3     48.363 kHz     65.000000 MHz
    DMT 0x12:  1024x768    75.028582 Hz   4:3     60.023 kHz     78.750000 MHz
    DMT 0x24:  1280x1024   75.024675 Hz   5:4     79.976 kHz    135.000000 MHz
  Standard Timings:
    DMT 0x15:  1152x864    75.000000 Hz   4:3     67.500 kHz    108.000000 MHz
    DMT 0x55:  1280x720    60.000000 Hz  16:9     45.000 kHz     74.250000 MHz
    DMT 0x23:  1280x1024   60.019740 Hz   5:4     63.981 kHz    108.000000 MHz
    DMT 0x2f:  1440x900    59.887445 Hz  16:10    55.935 kHz    106.500000 MHz
    DMT 0x53:  1600x900    60.000000 Hz  16:9     60.000 kHz    108.000000 MHz (RB)
    DMT 0x3a:  1680x1050   59.954250 Hz  16:10    65.290 kHz    146.250000 MHz
    DMT 0x52:  1920x1080   60.000000 Hz  16:9     67.500 kHz    148.500000 MHz
    DMT 0x45:  1920x1200   59.884600 Hz  16:10    74.556 kHz    193.250000 MHz
  Detailed Timing Descriptors:
    DTD 1:  2560x1440   60.001666 Hz  16:9     90.062 kHz    244.970000 MHz (698 mm x 393 mm)
                 Hfront   48 Hsync  32 Hback   80 Hpol P
                 Vfront    4 Vsync   5 Vback   52 Vpol N
    DTD 2:  2560x1440  144.002038 Hz  16:9    216.147 kHz    587.920000 MHz (698 mm x 393 mm)
                 Hfront   32 Hsync  64 Hback   64 Hpol P
                 Vfront    4 Vsync   5 Vback   52 Vpol N
    Display Range Limits:
      Monitor ranges (GTF): 48-144 Hz V, 31-240 kHz H, max dotclock 600 MHz
    Display Product Name: 'GN32DA'
  Extension blocks: 1
Checksum: 0x47

----------------

Block 1, CTA-861 Extension Block:
  Revision: 3
  Underscans IT Video Formats by default
  Basic audio support
  Supports YCbCr 4:4:4
  Supports YCbCr 4:2:2
  Native DTDs: 1
  Video Data Block:
    VIC  16:  1920x1080   60.000000 Hz  16:9     67.500 kHz    148.500000 MHz (native)
    VIC   1:   640x480    59.940476 Hz   4:3     31.469 kHz     25.175000 MHz
    VIC   2:   720x480    59.940060 Hz   4:3     31.469 kHz     27.000000 MHz
    VIC   3:   720x480    59.940060 Hz  16:9     31.469 kHz     27.000000 MHz
    VIC   4:  1280x720    60.000000 Hz  16:9     45.000 kHz     74.250000 MHz
    VIC  17:   720x576    50.000000 Hz   4:3     31.250 kHz     27.000000 MHz
    VIC  18:   720x576    50.000000 Hz  16:9     31.250 kHz     27.000000 MHz
    VIC  19:  1280x720    50.000000 Hz  16:9     37.500 kHz     74.250000 MHz
    VIC  31:  1920x1080   50.000000 Hz  16:9     56.250 kHz    148.500000 MHz
    VIC  41:  1280x720   100.000000 Hz  16:9     75.000 kHz    148.500000 MHz
    VIC  47:  1280x720   120.000000 Hz  16:9     90.000 kHz    148.500000 MHz
    VIC  63:  1920x1080  120.000000 Hz  16:9    135.000 kHz    297.000000 MHz
    VIC  64:  1920x1080  100.000000 Hz  16:9    112.500 kHz    297.000000 MHz
  Audio Data Block:
    Linear PCM:
      Max channels: 2
      Supported sample rates (kHz): 48 44.1 32
      Supported sample sizes (bits): 24 20 16
  Speaker Allocation Data Block:
    FL/FR - Front Left/Right
  Vendor-Specific Data Block (HDMI), OUI 00-0C-03:
    Source physical address: 1.0.0.0
    DC_36bit
    DC_30bit
    DC_Y444
    Maximum TMDS clock: 300 MHz
    Extended HDMI video details:
  Vendor-Specific Data Block (HDMI Forum), OUI C4-5D-D8:
    Version: 1
    Maximum TMDS Character Rate: 600 MHz
    SCDC Present
    SCDC Read Request Capable
    Supports 12-bits/component Deep Color 4:2:0 Pixel Encoding
    Supports 10-bits/component Deep Color 4:2:0 Pixel Encoding
  Vendor-Specific Data Block (AMD), OUI 00-00-1A:
    Version: 1
    Flags 1: 0x01
      FreeSync Supported
    Minimum Refresh Rate: 48 Hz
    Maximum Refresh Rate: 144 Hz
    MCCS VCP Code: 0xed
  Detailed Timing Descriptors:
    DTD 3:  2560x1440  120.000882 Hz  16:9    180.121 kHz    489.930000 MHz (698 mm x 393 mm)
                 Hfront   32 Hsync  64 Hback   64 Hpol P
                 Vfront    4 Vsync   5 Vback   52 Vpol N
    DTD 4:  1280x1440   59.999501 Hz   8:9     92.519 kHz    144.330000 MHz (698 mm x 398 mm)
                 Hfront   32 Hsync  40 Hback  208 Hpol P
                 Vfront    5 Vsync   5 Vback   92 Vpol N
    DTD 5:  1920x1080  144.000000 Hz  16:9    162.000 kHz    356.400000 MHz (698 mm x 393 mm)
                 Hfront   88 Hsync  44 Hback  148 Hpol P
                 Vfront    4 Vsync   5 Vback   36 Vpol P
Checksum: 0x35  Unused space in Extension Block: 19 bytes

----------------

Warnings:

Block 1, CTA-861 Extension Block:
  Video Data Block: VIC 16 and the first DTD are not identical. Is this intended?
  Detailed Timing Descriptor #4: Image size is 698x398 mm, but based on the picture AR it should be 353x398 mm.
  Add a Colorimetry Data Block with the sRGB colorimetry bit set to avoid interop issues.

Failures:

Block 1, CTA-861 Extension Block:
  Missing VCDB, needed for Set Selectable RGB Quantization to avoid interop issues.
EDID:
  Extension Block 2 started with EDID header, ignoring Extension Blocks >= 2.
  CTA-861: Native progressive timings are a mix of several resolutions.

EDID conformity: FAIL
