edid-decode (hex):

00 ff ff ff ff ff ff 00 05 e3 16 b3 a2 08 00 00
25 20 01 03 80 50 21 78 2e fe e5 aa 4e 47 a7 27
0f 50 54 bf ef 00 d1 c0 b3 00 95 00 81 80 81 c0
31 68 45 68 61 68 7a 3e 70 a0 d0 a0 29 50 30 20
35 00 1d 4e 31 00 00 1a 00 00 00 ff 00 57 4c 5a
4e 39 48 41 30 30 32 32 31 30 00 00 00 fc 00 55
33 34 47 33 58 4d 0a 20 20 20 20 20 00 00 00 fd
00 30 78 1e a0 3c 00 0a 20 20 20 20 20 20 01 48

02 03 47 f1 4d 90 1f 1f 1f 04 13 5f 5f 4b 4c 4c
59 5a 23 09 07 07 83 01 00 00 67 03 0c 00 10 00
00 42 67 00 00 00 01 78 80 03 e3 05 00 00 e3 0f
00 00 e6 06 00 00 00 00 00 6d 1a 00 00 02 01 00
78 00 00 00 00 00 00 7a 3e 70 a0 d0 a0 29 50 30
20 35 00 1d 4e 31 00 00 1a 7a 3e 70 a0 d0 a0 29
50 30 20 35 00 1d 4e 31 00 00 1a ef 51 b8 70 62
a0 35 50 80 b8 3a 00 1d 4e 31 00 00 1c 00 00 7c

00 ff ff ff ff ff ff 00 05 e3 16 b3 a2 08 00 00
25 20 01 03 80 50 21 78 2e fe e5 aa 4e 47 a7 27
0f 50 54 bf ef 00 d1 c0 b3 00 95 00 81 80 81 c0
31 68 45 68 61 68 7a 3e 70 a0 d0 a0 29 50 30 20
35 00 1d 4e 31 00 00 1a 00 00 00 ff 00 57 4c 5a
4e 39 48 41 30 30 32 32 31 30 00 00 00 fc 00 55
33 34 47 33 58 4d 0a 20 20 20 20 20 00 00 00 fd
00 30 78 1e a0 3c 00 0a 20 20 20 20 20 20 01 48

02 03 47 f1 4d 90 1f 1f 1f 04 13 5f 5f 4b 4c 4c
59 5a 23 09 07 07 83 01 00 00 67 03 0c 00 10 00
00 42 67 00 00 00 01 78 80 03 e3 05 00 00 e3 0f
00 00 e6 06 00 00 00 00 00 6d 1a 00 00 02 01 00
78 00 00 00 00 00 00 7a 3e 70 a0 d0 a0 29 50 30
20 35 00 1d 4e 31 00 00 1a 7a 3e 70 a0 d0 a0 29
50 30 20 35 00 1d 4e 31 00 00 1a ef 51 b8 70 62
a0 35 50 80 b8 3a 00 1d 4e 31 00 00 1c 00 00 7c

----------------

Block 0, Base EDID:
  EDID Structure Version & Revision: 1.3
  Vendor & Product Identification:
    Manufacturer: AOC
    Model: 45846
    Serial Number: ...
    Made in: week 37 of 2022
  Basic Display Parameters & Features:
    Digital display
    Maximum image size: 80 cm x 33 cm
    Gamma: 2.20
    DPMS levels: Off
    RGB color display
    Default (sRGB) color space is primary color space
    First detailed timing is the preferred timing
  Color Characteristics:
    Red  : 0.6669, 0.3076
    Green: 0.2802, 0.6542
    Blue : 0.1552, 0.0605
    White: 0.3134, 0.3291
  Established Timings I & II:
    IBM     :   720x400    70.081663 Hz   9:5     31.467 kHz     28.320000 MHz
    DMT 0x04:   640x480    59.940476 Hz   4:3     31.469 kHz     25.175000 MHz
    Apple   :   640x480    66.666667 Hz   4:3     35.000 kHz     30.240000 MHz
    DMT 0x05:   640x480    72.808802 Hz   4:3     37.861 kHz     31.500000 MHz
    DMT 0x06:   640x480    75.000000 Hz   4:3     37.500 kHz     31.500000 MHz
    DMT 0x08:   800x600    56.250000 Hz   4:3     35.156 kHz     36.000000 MHz
    DMT 0x09:   800x600    60.316541 Hz   4:3     37.879 kHz     40.000000 MHz
    DMT 0x0a:   800x600    72.187572 Hz   4:3     48.077 kHz     50.000000 MHz
    DMT 0x0b:   800x600    75.000000 Hz   4:3     46.875 kHz     49.500000 MHz
    Apple   :   832x624    74.551266 Hz   4:3     49.726 kHz     57.284000 MHz
    DMT 0x10:  1024x768    60.003840 Hz   4:3     48.363 kHz     65.000000 MHz
    DMT 0x11:  1024x768    70.069359 Hz   4:3     56.476 kHz     75.000000 MHz
    DMT 0x12:  1024x768    75.028582 Hz   4:3     60.023 kHz     78.750000 MHz
    DMT 0x24:  1280x1024   75.024675 Hz   5:4     79.976 kHz    135.000000 MHz
  Standard Timings:
    DMT 0x52:  1920x1080   60.000000 Hz  16:9     67.500 kHz    148.500000 MHz
    DMT 0x3a:  1680x1050   59.954250 Hz  16:10    65.290 kHz    146.250000 MHz
    DMT 0x2f:  1440x900    59.887445 Hz  16:10    55.935 kHz    106.500000 MHz
    DMT 0x23:  1280x1024   60.019740 Hz   5:4     63.981 kHz    108.000000 MHz
    DMT 0x55:  1280x720    60.000000 Hz  16:9     45.000 kHz     74.250000 MHz
    GTF     :   640x480    99.999537 Hz   4:3     50.900 kHz     43.163000 MHz
    GTF     :   800x600    99.999707 Hz   4:3     63.600 kHz     68.179000 MHz
    GTF     :  1024x768   100.000177 Hz   4:3     81.400 kHz    113.309000 MHz
  Detailed Timing Descriptors:
    DTD 1:  3440x1440   29.998500 Hz  43:18    44.428 kHz    159.940000 MHz (797 mm x 334 mm)
                 Hfront   48 Hsync  32 Hback   80 Hpol P
                 Vfront    3 Vsync   5 Vback   33 Vpol N
    Display Product Serial Number: ...
    Display Product Name: 'U34G3XM'
    Display Range Limits:
      Monitor ranges (GTF): 48-120 Hz V, 30-160 kHz H, max dotclock 600 MHz
  Extension blocks: 1
Checksum: 0x48

----------------

Block 1, CTA-861 Extension Block:
  Revision: 3
  Underscans IT Video Formats by default
  Basic audio support
  Supports YCbCr 4:4:4
  Supports YCbCr 4:2:2
  Native DTDs: 1
  Video Data Block:
    VIC  16:  1920x1080   60.000000 Hz  16:9     67.500 kHz    148.500000 MHz (native)
    VIC  31:  1920x1080   50.000000 Hz  16:9     56.250 kHz    148.500000 MHz
    VIC  31:  1920x1080   50.000000 Hz  16:9     56.250 kHz    148.500000 MHz
    VIC  31:  1920x1080   50.000000 Hz  16:9     56.250 kHz    148.500000 MHz
    VIC   4:  1280x720    60.000000 Hz  16:9     45.000 kHz     74.250000 MHz
    VIC  19:  1280x720    50.000000 Hz  16:9     37.500 kHz     74.250000 MHz
    VIC  95:  3840x2160   30.000000 Hz  16:9     67.500 kHz    297.000000 MHz
    VIC  95:  3840x2160   30.000000 Hz  16:9     67.500 kHz    297.000000 MHz
    VIC  75:  1920x1080   50.000000 Hz  64:27    56.250 kHz    148.500000 MHz
    VIC  76:  1920x1080   60.000000 Hz  64:27    67.500 kHz    148.500000 MHz
    VIC  76:  1920x1080   60.000000 Hz  64:27    67.500 kHz    148.500000 MHz
    VIC  89:  2560x1080   50.000000 Hz  64:27    56.250 kHz    185.625000 MHz
    VIC  90:  2560x1080   60.000000 Hz  64:27    66.000 kHz    198.000000 MHz
  Audio Data Block:
    Linear PCM:
      Max channels: 2
      Supported sample rates (kHz): 48 44.1 32
      Supported sample sizes (bits): 24 20 16
  Speaker Allocation Data Block:
    FL/FR - Front Left/Right
  Vendor-Specific Data Block (HDMI), OUI 00-0C-03:
    Source physical address: 1.0.0.0
    Maximum TMDS clock: 330 MHz
  Vendor-Specific Data Block, OUI 00-00-00:
    01 78 80 03                                     '.x..'
  Colorimetry Data Block:
  YCbCr 4:2:0 Capability Map Data Block:
    Empty Capability Map
  HDR Static Metadata Data Block:
    Electro optical transfer functions:
    Supported static metadata descriptors:
    Desired content max luminance: 0 (50.000 cd/m^2)
    Desired content max frame-average luminance: 0 (50.000 cd/m^2)
    Desired content min luminance: 0 (0.000 cd/m^2)
  Vendor-Specific Data Block (AMD), OUI 00-00-1A:
    Version: 2
    Flags 1: 0x01
      FreeSync Supported
    Minimum Refresh Rate: 0 Hz
    Maximum Refresh Rate: 120 Hz
    Flags 5: 0x00
  Detailed Timing Descriptors:
    DTD 2:  3440x1440   29.998500 Hz  43:18    44.428 kHz    159.940000 MHz (797 mm x 334 mm)
                 Hfront   48 Hsync  32 Hback   80 Hpol P
                 Vfront    3 Vsync   5 Vback   33 Vpol N
    DTD 3:  3440x1440   29.998500 Hz  43:18    44.428 kHz    159.940000 MHz (797 mm x 334 mm)
                 Hfront   48 Hsync  32 Hback   80 Hpol P
                 Vfront    3 Vsync   5 Vback   33 Vpol N
    DTD 4:  1720x1440   59.935558 Hz  43:36    89.484 kHz    209.750000 MHz (797 mm x 334 mm)
                 Hfront  128 Hsync 184 Hback  312 Hpol N
                 Vfront    3 Vsync  10 Vback   40 Vpol P
Checksum: 0x7c  Unused space in Extension Block: 2 bytes

----------------

Warnings:

Block 1, CTA-861 Extension Block:
  Video Data Block: VIC 16 and the first DTD are not identical. Is this intended?
  Vendor-Specific Data Block, OUI 00-00-00: All zeroes OUI.
  Detailed Timing Descriptor #4: Image size is 797x334 mm, but based on the picture AR it should be 398x334 mm.
  Display Product Serial Number is set, so the Serial Number in the Base EDID should be 0.
EDID:
  Base EDID: Some timings are out of range of the Monitor Ranges:
    Vertical Freq: 29.998 - 100.000 Hz (Monitor: 48.000 - 120.000 Hz)

Failures:

Block 0, Base EDID:
  Basic Display Parameters & Features: sRGB is signaled, but the chromaticities do not match.
Block 1, CTA-861 Extension Block:
  Video Data Block: Duplicate VIC 31.
  Video Data Block: Duplicate VIC 95.
  Video Data Block: Duplicate VIC 76.
  YCbCr 4:2:0 Capability Map Data Block: Empty Capability Map.
  Missing VCDB, needed for Set Selectable RGB Quantization to avoid interop issues.
EDID:
  Extension Block 2 started with EDID header, ignoring Extension Blocks >= 2.
  CTA-861: Native progressive timings are a mix of several resolutions.

EDID conformity: FAIL
