edid-decode (hex):

00 ff ff ff ff ff ff 00 30 ae f1 66 35 50 43 30
01 21 01 04 b5 50 21 78 3b 35 45 ac 4f 46 a7 27
13 50 54 ad cf 00 81 80 81 8a 95 00 a9 c0 b3 00
b3 0a d1 c0 d1 fc e7 7c 70 a0 d0 a0 29 50 30 20
3a 00 1d 4e 31 00 00 1a 00 00 00 ff 00 55 52 33
33 30 43 50 35 0a 20 20 20 20 00 00 00 fd 0c 30
a5 1e 1e 5c 01 0a 20 20 20 20 20 20 00 00 00 fc
00 47 33 34 77 2d 33 30 0a 20 20 20 20 20 02 7d

02 03 2f f1 49 01 03 02 04 90 12 11 13 1f 23 09
07 07 83 01 00 00 6d 1a 00 00 02 01 30 a5 00 00
00 00 00 00 e3 05 c0 00 e6 06 05 01 5a 34 3d 4e
d4 70 a0 d0 a0 46 50 30 40 3a 00 1d 4e 31 00 00
1c 56 5e 00 a0 a0 a0 29 50 30 20 35 00 1d 4e 31
00 00 1a 6f c2 00 a0 a0 a0 55 50 30 20 35 00 1d
4e 31 00 00 1a 9d 67 70 a0 d0 a0 22 50 30 20 3a
00 1d 4e 31 00 00 1a 00 00 00 00 00 00 00 00 18

70 12 79 03 00 03 01 28 57 01 01 06 6f 0d 9f 00
2f 80 1f 00 9f 05 54 00 02 00 09 00 b7 65 01 86
6f 0d 77 00 07 80 1f 00 9f 05 76 00 02 80 09 00
00 00 00 00 00 00 00 00 00 00 00 00 00 00 00 00
00 00 00 00 00 00 00 00 00 00 00 00 00 00 00 00
00 00 00 00 00 00 00 00 00 00 00 00 00 00 00 00
00 00 00 00 00 00 00 00 00 00 00 00 00 00 00 00
00 00 00 00 00 00 00 00 00 00 00 00 00 00 1a 90

00 ff ff ff ff ff ff 00 30 ae f1 66 35 50 43 30
01 21 01 04 b5 50 21 78 3b 35 45 ac 4f 46 a7 27
13 50 54 ad cf 00 81 80 81 8a 95 00 a9 c0 b3 00
b3 0a d1 c0 d1 fc e7 7c 70 a0 d0 a0 29 50 30 20
3a 00 1d 4e 31 00 00 1a 00 00 00 ff 00 55 52 33
33 30 43 50 35 0a 20 20 20 20 00 00 00 fd 0c 30
a5 1e 1e 5c 01 0a 20 20 20 20 20 20 00 00 00 fc
00 47 33 34 77 2d 33 30 0a 20 20 20 20 20 02 7d

02 03 2f f1 49 01 03 02 04 90 12 11 13 1f 23 09
07 07 83 01 00 00 6d 1a 00 00 02 01 30 a5 00 00
00 00 00 00 e3 05 c0 00 e6 06 05 01 5a 34 3d 4e
d4 70 a0 d0 a0 46 50 30 40 3a 00 1d 4e 31 00 00
1c 56 5e 00 a0 a0 a0 29 50 30 20 35 00 1d 4e 31
00 00 1a 6f c2 00 a0 a0 a0 55 50 30 20 35 00 1d
4e 31 00 00 1a 9d 67 70 a0 d0 a0 22 50 30 20 3a
00 1d 4e 31 00 00 1a 00 00 00 00 00 00 00 00 18

70 12 79 03 00 03 01 28 57 01 01 06 6f 0d 9f 00
2f 80 1f 00 9f 05 54 00 02 00 09 00 b7 65 01 86
6f 0d 77 00 07 80 1f 00 9f 05 76 00 02 80 09 00
00 00 00 00 00 00 00 00 00 00 00 00 00 00 00 00
00 00 00 00 00 00 00 00 00 00 00 00 00 00 00 00
00 00 00 00 00 00 00 00 00 00 00 00 00 00 00 00
00 00 00 00 00 00 00 00 00 00 00 00 00 00 00 00
00 00 00 00 00 00 00 00 00 00 00 00 00 00 1a 90

----------------

Block 0, Base EDID:
  EDID Structure Version & Revision: 1.4
  Vendor & Product Identification:
    Manufacturer: LEN
    Model: 26353
    Serial Number: ...
    Made in: week 1 of 2023
  Basic Display Parameters & Features:
    Digital display
    Bits per primary color channel: 10
    DisplayPort interface
    Maximum image size: 80 cm x 33 cm
    Gamma: 2.20
    DPMS levels: Off
    Supported color formats: RGB 4:4:4, YCrCb 4:4:4, YCrCb 4:2:2
    First detailed timing includes the native pixel format and preferred refresh rate
    Display supports continuous frequencies
  Color Characteristics:
    Red  : 0.6718, 0.3115
    Green: 0.2744, 0.6533
    Blue : 0.1533, 0.0742
    White: 0.3134, 0.3291
  Established Timings I & II:
    IBM     :   720x400    70.081663 Hz   9:5     31.467 kHz     28.320000 MHz
    DMT 0x04:   640x480    59.940476 Hz   4:3     31.469 kHz     25.175000 MHz
    DMT 0x05:   640x480    72.808802 Hz   4:3     37.861 kHz     31.500000 MHz
    DMT 0x06:   640x480    75.000000 Hz   4:3     37.500 kHz     31.500000 MHz
    DMT 0x09:   800x600    60.316541 Hz   4:3     37.879 kHz     40.000000 MHz
    DMT 0x0a:   800x600    72.187572 Hz   4:3     48.077 kHz     50.000000 MHz
    DMT 0x0b:   800x600    75.000000 Hz   4:3     46.875 kHz     49.500000 MHz
    DMT 0x10:  1024x768    60.003840 Hz   4:3     48.363 kHz     65.000000 MHz
    DMT 0x11:  1024x768    70.069359 Hz   4:3     56.476 kHz     75.000000 MHz
    DMT 0x12:  1024x768    75.028582 Hz   4:3     60.023 kHz     78.750000 MHz
    DMT 0x24:  1280x1024   75.024675 Hz   5:4     79.976 kHz    135.000000 MHz
  Standard Timings:
    DMT 0x23:  1280x1024   60.019740 Hz   5:4     63.981 kHz    108.000000 MHz
    GTF     :  1280x1024   69.999805 Hz   5:4     74.620 kHz    128.943000 MHz
    DMT 0x2f:  1440x900    59.887445 Hz  16:10    55.935 kHz    106.500000 MHz
    DMT 0x53:  1600x900    60.000000 Hz  16:9     60.000 kHz    108.000000 MHz (RB)
    DMT 0x3a:  1680x1050   59.954250 Hz  16:10    65.290 kHz    146.250000 MHz
    GTF     :  1680x1050   70.000113 Hz  16:10    76.510 kHz    173.831000 MHz
    DMT 0x52:  1920x1080   60.000000 Hz  16:9     67.500 kHz    148.500000 MHz
    GTF     :  1920x1080  119.999987 Hz  16:9    138.840 kHz    368.759000 MHz
  Detailed Timing Descriptors:
    DTD 1:  3440x1440   59.972616 Hz  43:18    88.819 kHz    319.750000 MHz (797 mm x 334 mm)
                 Hfront   48 Hsync  32 Hback   80 Hpol P
                 Vfront    3 Vsync  10 Vback   28 Vpol N
    Display Product Serial Number: ...
    Display Range Limits:
      Monitor ranges (Range Limits Only): 48-165 Hz V, 285-285 kHz H, max dotclock 920 MHz
    Display Product Name: 'G34w-30'
  Extension blocks: 2
Checksum: 0x7d

----------------

Block 1, CTA-861 Extension Block:
  Revision: 3
  Underscans IT Video Formats by default
  Basic audio support
  Supports YCbCr 4:4:4
  Supports YCbCr 4:2:2
  Native detailed modes: 1
  Video Data Block:
    VIC   1:   640x480    59.940476 Hz   4:3     31.469 kHz     25.175000 MHz
    VIC   3:   720x480    59.940060 Hz  16:9     31.469 kHz     27.000000 MHz
    VIC   2:   720x480    59.940060 Hz   4:3     31.469 kHz     27.000000 MHz
    VIC   4:  1280x720    60.000000 Hz  16:9     45.000 kHz     74.250000 MHz
    VIC  16:  1920x1080   60.000000 Hz  16:9     67.500 kHz    148.500000 MHz (native)
    VIC  18:   720x576    50.000000 Hz  16:9     31.250 kHz     27.000000 MHz
    VIC  17:   720x576    50.000000 Hz   4:3     31.250 kHz     27.000000 MHz
    VIC  19:  1280x720    50.000000 Hz  16:9     37.500 kHz     74.250000 MHz
    VIC  31:  1920x1080   50.000000 Hz  16:9     56.250 kHz    148.500000 MHz
  Audio Data Block:
    Linear PCM:
      Max channels: 2
      Supported sample rates (kHz): 48 44.1 32
      Supported sample sizes (bits): 24 20 16
  Speaker Allocation Data Block:
    FL/FR - Front Left/Right
  Vendor-Specific Data Block (AMD), OUI 00-00-1A:
    Version: 2
    Feature Caps: 0x01
    Minimum Refresh Rate: 48 Hz
    Maximum Refresh Rate: 165 Hz
    Flags 1.x: 0x00
    Flags 2.x: 0x00
  Colorimetry Data Block:
    BT2020YCC
    BT2020RGB
  HDR Static Metadata Data Block:
    Electro optical transfer functions:
      Traditional gamma - SDR luminance range
      SMPTE ST2084
    Supported static metadata descriptors:
      Static metadata type 1
    Desired content max luminance: 90 (351.250 cd/m^2)
    Desired content max frame-average luminance: 52 (154.221 cd/m^2)
    Desired content min luminance: 61 (0.201 cd/m^2)
  Detailed Timing Descriptors:
    DTD 2:  3440x1440   99.981604 Hz  43:18   150.972 kHz    543.500000 MHz (797 mm x 334 mm)
                 Hfront   48 Hsync  64 Hback   48 Hpol N
                 Vfront    3 Vsync  10 Vback   57 Vpol P
    DTD 3:  2560x1440   59.950550 Hz  16:9     88.787 kHz    241.500000 MHz (797 mm x 334 mm)
                 Hfront   48 Hsync  32 Hback   80 Hpol P
                 Vfront    3 Vsync   5 Vback   33 Vpol N
    DTD 4:  2560x1440  119.997589 Hz  16:9    182.996 kHz    497.750000 MHz (797 mm x 334 mm)
                 Hfront   48 Hsync  32 Hback   80 Hpol P
                 Vfront    3 Vsync   5 Vback   77 Vpol N
    DTD 5:  3440x1440   49.986808 Hz  43:18    73.681 kHz    265.250000 MHz (797 mm x 334 mm)
                 Hfront   48 Hsync  32 Hback   80 Hpol P
                 Vfront    3 Vsync  10 Vback   21 Vpol N
Checksum: 0x18  Unused space in Extension Block: 8 bytes

----------------

Block 2, DisplayID Extension Block:
  Version: 1.2
  Extension Count: 0
  Display Product Type: Standalone display device
  Video Timing Modes Type 1 - Detailed Timings Data Block:
    DTD:  3440x1440  120.000000 Hz  64:27   183.000 kHz    658.800000 MHz (aspect 64:27, no 3D stereo)
               Hfront   48 Hsync  32 Hback   80 Hpol P
               Vfront    3 Vsync  10 Vback   72 Vpol N
    DTD:  3440x1440  165.000613 Hz  64:27   257.236 kHz    915.760000 MHz (aspect 64:27, no 3D stereo, preferred)
               Hfront    8 Hsync  32 Hback   80 Hpol P
               Vfront    3 Vsync  10 Vback  106 Vpol P
  Checksum: 0x1a
Checksum: 0x90

----------------

Block 3, Unknown EDID Extension Block 0x00:
  00 ff ff ff ff ff ff 00 30 ae f1 66 35 50 43 30 '........0..f5PC0'
  01 21 01 04 b5 50 21 78 3b 35 45 ac 4f 46 a7 27 '.!...P!x;5E.OF.''
  13 50 54 ad cf 00 81 80 81 8a 95 00 a9 c0 b3 00 '.PT.............'
  b3 0a d1 c0 d1 fc e7 7c 70 a0 d0 a0 29 50 30 20 '.......|p...)P0 '
  3a 00 1d 4e 31 00 00 1a 00 00 00 ff 00 55 52 33 ':..N1........UR3'
  33 30 43 50 35 0a 20 20 20 20 00 00 00 fd 0c 30 '30CP5.    .....0'
  a5 1e 1e 5c 01 0a 20 20 20 20 20 20 00 00 00 fc '...\..      ....'
  00 47 33 34 77 2d 33 30 0a 20 20 20 20 20 02 7d '.G34w-30.     .}'
Checksum: 0x7d

----------------

Block 4, CTA-861 Extension Block:
  Revision: 3
  Underscans IT Video Formats by default
  Basic audio support
  Supports YCbCr 4:4:4
  Supports YCbCr 4:2:2
  Native detailed modes: 1
  Video Data Block:
    VIC   1:   640x480    59.940476 Hz   4:3     31.469 kHz     25.175000 MHz
    VIC   3:   720x480    59.940060 Hz  16:9     31.469 kHz     27.000000 MHz
    VIC   2:   720x480    59.940060 Hz   4:3     31.469 kHz     27.000000 MHz
    VIC   4:  1280x720    60.000000 Hz  16:9     45.000 kHz     74.250000 MHz
    VIC  16:  1920x1080   60.000000 Hz  16:9     67.500 kHz    148.500000 MHz (native)
    VIC  18:   720x576    50.000000 Hz  16:9     31.250 kHz     27.000000 MHz
    VIC  17:   720x576    50.000000 Hz   4:3     31.250 kHz     27.000000 MHz
    VIC  19:  1280x720    50.000000 Hz  16:9     37.500 kHz     74.250000 MHz
    VIC  31:  1920x1080   50.000000 Hz  16:9     56.250 kHz    148.500000 MHz
  Audio Data Block:
    Linear PCM:
      Max channels: 2
      Supported sample rates (kHz): 48 44.1 32
      Supported sample sizes (bits): 24 20 16
  Speaker Allocation Data Block:
    FL/FR - Front Left/Right
  Vendor-Specific Data Block (AMD), OUI 00-00-1A:
    Version: 2
    Feature Caps: 0x01
    Minimum Refresh Rate: 48 Hz
    Maximum Refresh Rate: 165 Hz
    Flags 1.x: 0x00
    Flags 2.x: 0x00
  Colorimetry Data Block:
    BT2020YCC
    BT2020RGB
  HDR Static Metadata Data Block:
    Electro optical transfer functions:
      Traditional gamma - SDR luminance range
      SMPTE ST2084
    Supported static metadata descriptors:
      Static metadata type 1
    Desired content max luminance: 90 (351.250 cd/m^2)
    Desired content max frame-average luminance: 52 (154.221 cd/m^2)
    Desired content min luminance: 61 (0.201 cd/m^2)
  Detailed Timing Descriptors:
    DTD 6:  3440x1440   99.981604 Hz  43:18   150.972 kHz    543.500000 MHz (797 mm x 334 mm)
                 Hfront   48 Hsync  64 Hback   48 Hpol N
                 Vfront    3 Vsync  10 Vback   57 Vpol P
    DTD 7:  2560x1440   59.950550 Hz  16:9     88.787 kHz    241.500000 MHz (797 mm x 334 mm)
                 Hfront   48 Hsync  32 Hback   80 Hpol P
                 Vfront    3 Vsync   5 Vback   33 Vpol N
    DTD 8:  2560x1440  119.997589 Hz  16:9    182.996 kHz    497.750000 MHz (797 mm x 334 mm)
                 Hfront   48 Hsync  32 Hback   80 Hpol P
                 Vfront    3 Vsync   5 Vback   77 Vpol N
    DTD 9:  3440x1440   49.986808 Hz  43:18    73.681 kHz    265.250000 MHz (797 mm x 334 mm)
                 Hfront   48 Hsync  32 Hback   80 Hpol P
                 Vfront    3 Vsync  10 Vback   21 Vpol N
Checksum: 0x18  Unused space in Extension Block: 8 bytes

----------------

Block 5, DisplayID Extension Block:
  Version: 1.2
  Extension Count: 0
  Video Timing Modes Type 1 - Detailed Timings Data Block:
    DTD:  3440x1440  120.000000 Hz  64:27   183.000 kHz    658.800000 MHz (aspect 64:27, no 3D stereo)
               Hfront   48 Hsync  32 Hback   80 Hpol P
               Vfront    3 Vsync  10 Vback   72 Vpol N
    DTD:  3440x1440  165.000613 Hz  64:27   257.236 kHz    915.760000 MHz (aspect 64:27, no 3D stereo, preferred)
               Hfront    8 Hsync  32 Hback   80 Hpol P
               Vfront    3 Vsync  10 Vback  106 Vpol P
  Checksum: 0x1a
Checksum: 0x90

----------------

Warnings:

Block 1, CTA-861 Extension Block:
  Video Data Block: VIC 1 and the first DTD are not identical. Is this intended?
  Colorimetry Data Block: Set the sRGB colorimetry bit to avoid interop issues.
  Detailed Timing Descriptor #3: Image size is 797x334 mm, but based on the picture AR it should be 797x448 mm.
  Detailed Timing Descriptor #4: Image size is 797x334 mm, but based on the picture AR it should be 797x448 mm.
  Display Product Serial Number is set, so the Serial Number in the Base EDID should be 0.
Block 4, CTA-861 Extension Block:
  Colorimetry Data Block: Set the sRGB colorimetry bit to avoid interop issues.
  Detailed Timing Descriptor #7: Image size is 797x334 mm, but based on the picture AR it should be 797x448 mm.
  Detailed Timing Descriptor #8: Image size is 797x334 mm, but based on the picture AR it should be 797x448 mm.
EDID:
  Base EDID: Some timings are out of range of the Monitor Ranges:
    Horizontal Freq: 31.250 - 257.235 kHz (Monitor: 285.000 - 285.000 kHz)

Failures:

Block 1, CTA-861 Extension Block:
  Missing VCDB, needed for Set Selectable RGB Quantization to avoid interop issues.
Block 2, DisplayID Extension Block:
  Expected 0 DisplayID Extension Block, but got 1.
Block 3, Base EDID:
  Unknown Extension Block.
Block 4, CTA-861 Extension Block:
  Video Data Block: Duplicate VIC 1.
  Video Data Block: Duplicate VIC 3.
  Video Data Block: Duplicate VIC 2.
  Video Data Block: Duplicate VIC 4.
  Video Data Block: Duplicate VIC 16.
  Video Data Block: Duplicate VIC 18.
  Video Data Block: Duplicate VIC 17.
  Video Data Block: Duplicate VIC 19.
  Video Data Block: Duplicate VIC 31.
  Speaker Allocation Data Block: Only one instance of this Data Block is allowed.
  Colorimetry Data Block: Only one instance of this Data Block is allowed.
  HDR Static Metadata Data Block: Only one instance of this Data Block is allowed.
Block 5, DisplayID Extension Block:
  Product Type should be 0 in extension block.
EDID:
  Base EDID: EDID specified 2 extension block(s), but found 5 extension block(s).
  CTA-861: Native progressive timings are a mix of several resolutions.
  DisplayID: Missing DisplayID Display Parameters Data Block.

EDID conformity: FAIL
