edid-decode (hex):

00 ff ff ff ff ff ff 00 59 3a 43 00 01 01 01 01
2f 12 01 03 80 52 2e 78 0a 6a 3b a3 55 4a 9b 25
0f 47 4a af ce 00 01 01 01 01 01 01 01 01 01 01
01 01 01 01 01 01 02 3a 80 18 71 38 2d 40 58 2c
55 00 34 cc 31 00 00 1e 00 00 00 fd 00 32 4d 1f
46 0f 00 0a 20 20 20 20 20 20 00 00 00 ff 00 51
50 43 59 42 4a 34 37 30 37 31 34 33 00 00 00 fc
00 56 4f 33 37 4c 46 48 44 54 56 31 30 41 01 1d

00 ff ff ff ff ff ff 00 59 3a 43 00 01 01 01 01
2f 12 01 03 80 52 2e 78 0a 6a 3b a3 55 4a 9b 25
0f 47 4a af ce 00 01 01 01 01 01 01 01 01 01 01
01 01 01 01 01 01 02 3a 80 18 71 38 2d 40 58 2c
55 00 34 cc 31 00 00 1e 00 00 00 fd 00 32 4d 1f
46 0f 00 0a 20 20 20 20 20 20 00 00 00 ff 00 51
50 43 59 42 4a 34 37 30 37 31 34 33 00 00 00 fc
00 56 4f 33 37 4c 46 48 44 54 56 31 30 41 01 1d

----------------

Block 0, Base EDID:
  EDID Structure Version & Revision: 1.3
  Vendor & Product Identification:
    Manufacturer: VIZ
    Model: 67
    Serial Number: ...
    Made in: week 47 of 2008
  Basic Display Parameters & Features:
    Digital display
    Maximum image size: 82 cm x 46 cm
    Gamma: 2.20
    RGB color display
    First detailed timing is the preferred timing
  Color Characteristics:
    Red  : 0.6376, 0.3339
    Green: 0.2910, 0.6074
    Blue : 0.1445, 0.0615
    White: 0.2792, 0.2919
  Established Timings I & II:
    IBM     :   720x400    70.081663 Hz   9:5     31.467 kHz     28.320000 MHz
    DMT 0x04:   640x480    59.940476 Hz   4:3     31.469 kHz     25.175000 MHz
    DMT 0x05:   640x480    72.808802 Hz   4:3     37.861 kHz     31.500000 MHz
    DMT 0x06:   640x480    75.000000 Hz   4:3     37.500 kHz     31.500000 MHz
    DMT 0x08:   800x600    56.250000 Hz   4:3     35.156 kHz     36.000000 MHz
    DMT 0x09:   800x600    60.316541 Hz   4:3     37.879 kHz     40.000000 MHz
    DMT 0x0a:   800x600    72.187572 Hz   4:3     48.077 kHz     50.000000 MHz
    DMT 0x0b:   800x600    75.000000 Hz   4:3     46.875 kHz     49.500000 MHz
    DMT 0x10:  1024x768    60.003840 Hz   4:3     48.363 kHz     65.000000 MHz
    DMT 0x11:  1024x768    70.069359 Hz   4:3     56.476 kHz     75.000000 MHz
    DMT 0x12:  1024x768    75.028582 Hz   4:3     60.023 kHz     78.750000 MHz
  Standard Timings: none
  Detailed Timing Descriptors:
    DTD 1:  1920x1080   60.000000 Hz  16:9     67.500 kHz    148.500000 MHz (820 mm x 460 mm)
                 Hfront   88 Hsync  44 Hback  148 Hpol P
                 Vfront    5 Vsync   5 Vback   35 Vpol P
    Display Range Limits:
      Monitor ranges (GTF): 50-77 Hz V, 31-70 kHz H, max dotclock 150 MHz
    Display Product Serial Number: ...
    Display Product Name: 'VO37LFHDTV10A'
  Extension blocks: 1
Checksum: 0x1d

----------------

Warnings:

Block 0, Base EDID:
  Vendor & Product Identification: The serial number is one of the known dummy values, it should probably be set to 0.
  Detailed Timing Descriptor #1: DTD is similar but not identical to VIC 16.

Failures:

EDID:
  Extension Block 1 started with EDID header, ignoring Extension Blocks >= 1.
  Base EDID: EDID specified 1 extension block(s), but found 0 extension block(s).

EDID conformity: FAIL
