edid-decode (hex):

00 ff ff ff ff ff ff 00 06 10 20 92 ef 00 00 02
13 0f 01 03 80 40 28 78 28 60 e5 a3 57 4b 9c 25
11 50 54 00 00 00 01 01 01 01 01 01 01 01 01 01
01 01 01 01 01 01 bc 1b 00 a0 50 20 17 30 30 20
36 00 81 91 21 00 00 1a b0 68 00 a0 a0 40 2e 60
30 20 36 00 81 91 21 00 00 1a 00 00 00 fc 00 43
69 6e 65 6d 61 20 48 44 20 0a 00 00 00 00 00 fc
00 44 69 73 70 6c 61 79 0a 00 00 00 00 00 01 99

40 01 03 00 00 00 00 c0 24 01 a5 00 a5 00 01 02
03 19 19 a8 00 00 00 00 00 00 40 00 00 00 00 00
00 00 00 00 00 00 00 00 00 00 00 00 00 00 00 00
00 00 00 00 00 00 00 00 00 00 00 00 00 00 00 00
00 00 00 00 00 00 00 00 00 00 00 00 00 00 00 00
00 00 00 00 00 00 00 00 00 00 00 00 00 00 00 00
00 00 00 00 00 00 00 00 00 00 00 00 00 00 00 00
00 00 00 00 00 00 00 00 00 00 00 00 00 00 00 6d

00 ff ff ff ff ff ff 00 06 10 20 92 ef 00 00 02
13 0f 01 03 80 40 28 78 28 60 e5 a3 57 4b 9c 25
11 50 54 00 00 00 01 01 01 01 01 01 01 01 01 01
01 01 01 01 01 01 bc 1b 00 a0 50 20 17 30 30 20
36 00 81 91 21 00 00 1a b0 68 00 a0 a0 40 2e 60
30 20 36 00 81 91 21 00 00 1a 00 00 00 fc 00 43
69 6e 65 6d 61 20 48 44 20 0a 00 00 00 00 00 fc
00 44 69 73 70 6c 61 79 0a 00 00 00 00 00 01 99

40 01 03 00 00 00 00 c0 24 01 a5 00 a5 00 01 02
03 19 19 a8 00 00 00 00 00 00 40 00 00 00 00 00
00 00 00 00 00 00 00 00 00 00 00 00 00 00 00 00
00 00 00 00 00 00 00 00 00 00 00 00 00 00 00 00
00 00 00 00 00 00 00 00 00 00 00 00 00 00 00 00
00 00 00 00 00 00 00 00 00 00 00 00 00 00 00 00
00 00 00 00 00 00 00 00 00 00 00 00 00 00 00 00
00 00 00 00 00 00 00 00 00 00 00 00 00 00 00 6d

----------------

Block 0, Base EDID:
  EDID Structure Version & Revision: 1.3
  Vendor & Product Identification:
    Manufacturer: APP
    Model: 37408
    Serial Number: ...
    Made in: week 19 of 2005
  Basic Display Parameters & Features:
    Digital display
    Maximum image size: 64 cm x 40 cm
    Gamma: 2.20
    DPMS levels: Off
    RGB color display
  Color Characteristics:
    Red  : 0.6376, 0.3417
    Green: 0.2929, 0.6093
    Blue : 0.1474, 0.0683
    White: 0.3134, 0.3291
  Established Timings I & II: none
  Standard Timings: none
  Detailed Timing Descriptors:
    DTD 1:  1280x800    59.909545 Hz  16:10    49.306 kHz     71.000000 MHz (641 mm x 401 mm)
                 Hfront   48 Hsync  32 Hback   80 Hpol P
                 Vfront    3 Vsync   6 Vback   14 Vpol N
    DTD 2:  2560x1600   59.859910 Hz  16:10    98.529 kHz    268.000000 MHz (641 mm x 401 mm)
                 Hfront   48 Hsync  32 Hback   80 Hpol P
                 Vfront    3 Vsync   6 Vback   37 Vpol N
    Display Product Name: 'Cinema HD '
    Display Product Name: 'Display'
  Extension blocks: 1
Checksum: 0x99

----------------

Block 1, Display Information Extension Block:
  Version: 1
  Digital Interface:
    Supported Digital Interface: DVI Dual Link - High Resolution
    Data Enable Signal Usage Available
    Data Enable Signal High
    Edge of Shift Clock: Not specified
    HDCP is not supported
    Digital Receivers do not support Double Clocking of Input Data
    Packetized Digital Video is not supported
    Data Formats: 24-Bit MSB-Aligned RGB (Single Link)
    Minimum Pixel Clock Frequency Per Link: 1 MHz
    Maximum Pixel Clock Frequency Per Link: 165 MHz
    Crossover Frequency: 165 MHz
  Display Device:
    Sub-Pixel Layout: RGB
    Sub-Pixel Configuration: Stripe
    Sub-Pixel Shape: Rectangular
    Horizontal Dot/Pixel Pitch: 0.25 mm
    Vertical Dot/Pixel Pitch: 0.25 mm
    Display Device has a Fixed Pixel Format
    View Direction: Direct
    Display Device uses non-transparent background
    Physical Implementation: Desktop or personal display
    Monitor/display does not support DDC/CI
  Display Capabities & Feature Support Set:
    Legacy Modes: Not all VGA/DOS Legacy Timing Modes are supported
    Stereo Video: No direct stereo
    Scaler On Board: No
    Image Centering: No
    Conditional Update: No
    Interlaced Video: No
    Frame Lock: No
    Frame Rate Conversion: Not supported
    Vertical Frequency: Not available
    Horizontal Frequency: Not available
    Display/Scan Orientation Definition Type: Fixed Orientation
    Screen Orientation: Landscape
    Zero Pixel Location: Upper Left
    Scan Direction: Not defined
    Standalone Projector: No
    Default Color/Luminance Decoding: Not defined
    Preferred Color/Luminance Decoder: Uses Default Decoding
    Color/Luminance Decoding Capabilities: None
    Dithering: No
    Supported Color Bit-Depth of Sub-Channel 0 (Blue): No Information
    Supported Color Bit-Depth of Sub-Channel 1 (Green): No Information
    Supported Color Bit-Depth of Sub-Channel 2 (Red): No Information
    Supported Color Bit-Depth of Sub-Channel 0 (Cb/Pb): No Information
    Supported Color Bit-Depth of Sub-Channel 1 (Y): No Information
    Supported Color Bit-Depth of Sub-Channel 2 (Cr/Pr): No Information
    Aspect Ratio Conversion Modes: None
  Display Transfer Characteristics - Gamma:
    No Display Transfer Characteristics
Checksum: 0x6d

----------------

Warnings:

EDID:
  No Native Video Resolution was defined.

Failures:

Block 0, Base EDID:
  Basic Display Parameters & Features: EDID 1.3 requires that the first detailed timing is the preferred timing.
  Display Product Name: One or more trailing spaces before newline.
  Display Product Name: Non-space after newline.
  Display Product Name: Non-space after newline.
  Missing Display Range Limits Descriptor.
Block 1, Display Information Extension Block:
  Digital Interface: Data Format should be 0x48, not 0x24.
EDID:
  Extension Block 2 started with EDID header, ignoring Extension Blocks >= 2.

EDID conformity: FAIL
