edid-decode (hex):

00 ff ff ff ff ff ff 00 09 e5 23 07 00 00 00 00
01 1a 01 04 95 1f 11 78 0a 24 10 97 59 54 8e 27
1e 50 54 00 00 00 01 01 01 01 01 01 01 01 01 01
01 01 01 01 01 01 d6 38 80 b4 70 38 4b 40 30 20
36 00 35 ad 10 00 00 1a 36 2e 80 18 71 38 28 40
30 20 36 00 35 ad 10 00 00 1a 00 00 00 fe 00 58
58 31 33 46 80 4e 54 31 34 4e 34 31 00 00 00 00
00 00 41 21 96 00 10 00 00 0a 01 0a 20 20 00 f3

----------------

Block 0, Base EDID:
  EDID Structure Version & Revision: 1.4
  Vendor & Product Identification:
    Manufacturer: BOE
    Model: 1827
    Made in: week 1 of 2016
  Basic Display Parameters & Features:
    Digital display
    Bits per primary color channel: 6
    DisplayPort interface
    Maximum image size: 31 cm x 17 cm
    Gamma: 2.20
    Supported color formats: RGB 4:4:4, YCrCb 4:4:4
    First detailed timing includes the native pixel format and preferred refresh rate
  Color Characteristics:
    Red  : 0.5898, 0.3496
    Green: 0.3291, 0.5546
    Blue : 0.1523, 0.1181
    White: 0.3125, 0.3281
  Established Timings I & II: none
  Standard Timings: none
  Detailed Timing Descriptors:
    DTD 1:  1920x1080   59.987631 Hz  16:9     69.286 kHz    145.500000 MHz (309 mm x 173 mm)
                 Hfront   48 Hsync  32 Hback  100 Hpol P
                 Vfront    3 Vsync   6 Vback   66 Vpol N
    DTD 2:  1920x1080   48.011364 Hz  16:9     53.773 kHz    118.300000 MHz (309 mm x 173 mm)
                 Hfront   48 Hsync  32 Hback  200 Hpol P
                 Vfront    3 Vsync   6 Vback   31 Vpol N
    Alphanumeric Data String: 'XX13F.NT14N41'
    Manufacturer-Specified Display Descriptor (0x00): 00 00 00 00 41 21 96 00 10 00 00 0a 01 0a 20 20 '....A!........  '
Checksum: 0xf3

----------------

Warnings:

Block 0, Base EDID:
  Alphanumeric Data String: Non-ASCII character 0x80 at position 5, can cause problems.
  Missing Display Product Name.

EDID conformity: PASS
