edid-decode (hex):

00 ff ff ff ff ff ff 00 36 69 c5 5d 01 01 01 01
2b 22 01 04 b5 46 27 78 eb f0 15 ae 4e 3f ac 26
0b 50 54 3f cf 00 3b 80 81 80 95 00 b3 00 d1 c0
d1 d9 d1 fc 81 c0 4d d0 00 a0 f0 70 3e 80 30 20
35 00 b9 88 21 00 00 1a 00 00 00 fd 0c 30 a0 87
87 8e 01 0a 20 20 20 20 20 20 00 00 00 fc 00 4d
41 47 20 33 32 31 43 55 50 44 46 0a 00 00 00 ff
00 0a 20 20 20 20 20 20 20 20 20 20 20 20 02 a4

02 03 2f 61 49 03 12 04 10 61 60 76 2f 3f 23 09
17 07 83 01 00 00 6d 1a 00 00 02 01 30 a0 00 00
65 26 65 26 e3 05 e0 01 e6 06 05 01 65 65 26 80
e5 00 a0 a0 a0 3c 50 18 10 25 00 b9 88 21 00 00
1a 6c c4 00 a1 a0 a0 64 50 18 10 25 00 b9 88 21
00 00 1a 69 61 00 a0 a0 a0 58 50 30 20 35 00 b9
88 21 00 00 1e 5a 87 80 a0 70 38 4d 40 30 20 6a
00 b9 88 21 00 00 1a 00 00 00 00 00 00 00 00 80

70 12 79 03 00 03 01 3c 0f d0 01 04 ff 0e 2f 02
af 80 57 00 6f 08 59 00 07 00 09 00 9f f6 01 04
ff 0e af 00 2f 80 1f 00 6f 08 40 00 05 00 09 00
7f 23 02 04 ff 0e 9f 00 2f 80 1f 00 6f 08 1d 00
05 00 09 00 00 00 00 00 00 00 00 00 00 00 00 00
00 00 00 00 00 00 00 00 00 00 00 00 00 00 00 00
00 00 00 00 00 00 00 00 00 00 00 00 00 00 00 00
00 00 00 00 00 00 00 00 00 00 00 00 00 00 fd 90

00 ff ff ff ff ff ff 00 36 69 c5 5d 01 01 01 01
2b 22 01 04 b5 46 27 78 eb f0 15 ae 4e 3f ac 26
0b 50 54 3f cf 00 3b 80 81 80 95 00 b3 00 d1 c0
d1 d9 d1 fc 81 c0 4d d0 00 a0 f0 70 3e 80 30 20
35 00 b9 88 21 00 00 1a 00 00 00 fd 0c 30 a0 87
87 8e 01 0a 20 20 20 20 20 20 00 00 00 fc 00 4d
41 47 20 33 32 31 43 55 50 44 46 0a 00 00 00 ff
00 0a 20 20 20 20 20 20 20 20 20 20 20 20 02 a4

02 03 2f 61 49 03 12 04 10 61 60 76 2f 3f 23 09
17 07 83 01 00 00 6d 1a 00 00 02 01 30 a0 00 00
65 26 65 26 e3 05 e0 01 e6 06 05 01 65 65 26 80
e5 00 a0 a0 a0 3c 50 18 10 25 00 b9 88 21 00 00
1a 6c c4 00 a1 a0 a0 64 50 18 10 25 00 b9 88 21
00 00 1a 69 61 00 a0 a0 a0 58 50 30 20 35 00 b9
88 21 00 00 1e 5a 87 80 a0 70 38 4d 40 30 20 6a
00 b9 88 21 00 00 1a 00 00 00 00 00 00 00 00 80

70 12 79 03 00 03 01 3c 0f d0 01 04 ff 0e 2f 02
af 80 57 00 6f 08 59 00 07 00 09 00 9f f6 01 04
ff 0e af 00 2f 80 1f 00 6f 08 40 00 05 00 09 00
7f 23 02 04 ff 0e 9f 00 2f 80 1f 00 6f 08 1d 00
05 00 09 00 00 00 00 00 00 00 00 00 00 00 00 00
00 00 00 00 00 00 00 00 00 00 00 00 00 00 00 00
00 00 00 00 00 00 00 00 00 00 00 00 00 00 00 00
00 00 00 00 00 00 00 00 00 00 00 00 00 00 fd 90

----------------

Block 0, Base EDID:
  EDID Structure Version & Revision: 1.4
  Vendor & Product Identification:
    Manufacturer: MSI
    Model: 24005
    Serial Number: ...
    Made in: week 43 of 2024
  Basic Display Parameters & Features:
    Digital display
    Bits per primary color channel: 10
    DisplayPort interface
    Maximum image size: 70 cm x 39 cm
    Gamma: 2.20
    DPMS levels: Standby Suspend Off
    Supported color formats: RGB 4:4:4, YCrCb 4:4:4
    First detailed timing includes the native pixel format and preferred refresh rate
    Display supports continuous frequencies
  Color Characteristics:
    Red  : 0.6826, 0.3076
    Green: 0.2460, 0.6718
    Blue : 0.1484, 0.0439
    White: 0.3134, 0.3291
  Established Timings I & II:
    DMT 0x04:   640x480    59.940476 Hz   4:3     31.469 kHz     25.175000 MHz
    Apple   :   640x480    66.666667 Hz   4:3     35.000 kHz     30.240000 MHz
    DMT 0x05:   640x480    72.808802 Hz   4:3     37.861 kHz     31.500000 MHz
    DMT 0x06:   640x480    75.000000 Hz   4:3     37.500 kHz     31.500000 MHz
    DMT 0x08:   800x600    56.250000 Hz   4:3     35.156 kHz     36.000000 MHz
    DMT 0x09:   800x600    60.316541 Hz   4:3     37.879 kHz     40.000000 MHz
    DMT 0x0a:   800x600    72.187572 Hz   4:3     48.077 kHz     50.000000 MHz
    DMT 0x0b:   800x600    75.000000 Hz   4:3     46.875 kHz     49.500000 MHz
    DMT 0x10:  1024x768    60.003840 Hz   4:3     48.363 kHz     65.000000 MHz
    DMT 0x11:  1024x768    70.069359 Hz   4:3     56.476 kHz     75.000000 MHz
    DMT 0x12:  1024x768    75.028582 Hz   4:3     60.023 kHz     78.750000 MHz
    DMT 0x24:  1280x1024   75.024675 Hz   5:4     79.976 kHz    135.000000 MHz
  Standard Timings:
    GTF     :   720x576    60.000294 Hz   5:4     35.820 kHz     32.668000 MHz
    DMT 0x23:  1280x1024   60.019740 Hz   5:4     63.981 kHz    108.000000 MHz
    DMT 0x2f:  1440x900    59.887445 Hz  16:10    55.935 kHz    106.500000 MHz
    DMT 0x3a:  1680x1050   59.954250 Hz  16:10    65.290 kHz    146.250000 MHz
    DMT 0x52:  1920x1080   60.000000 Hz  16:9     67.500 kHz    148.500000 MHz
    GTF     :  1920x1080   84.999879 Hz  16:9     96.390 kHz    252.927000 MHz
    GTF     :  1920x1080  119.999987 Hz  16:9    138.840 kHz    368.759000 MHz
    DMT 0x55:  1280x720    60.000000 Hz  16:9     45.000 kHz     74.250000 MHz
  Detailed Timing Descriptors:
    DTD 1:  3840x2160   59.996625 Hz  16:9    133.312 kHz    533.250000 MHz (697 mm x 392 mm)
                 Hfront   48 Hsync  32 Hback   80 Hpol P
                 Vfront    3 Vsync   5 Vback   54 Vpol N
    Display Range Limits:
      Monitor ranges (Range Limits Only): 48-160 Hz V, 390-390 kHz H, max dotclock 1420 MHz
    Display Product Name: 'MAG 321CUPDF'
    Display Product Serial Number: ...
  Extension blocks: 2
Checksum: 0xa4

----------------

Block 1, CTA-861 Extension Block:
  Revision: 3
  Basic audio support
  Supports YCbCr 4:4:4
  Native DTDs: 1
  Video Data Block:
    VIC   3:   720x480    59.940060 Hz  16:9     31.469 kHz     27.000000 MHz
    VIC  18:   720x576    50.000000 Hz  16:9     31.250 kHz     27.000000 MHz
    VIC   4:  1280x720    60.000000 Hz  16:9     45.000 kHz     74.250000 MHz
    VIC  16:  1920x1080   60.000000 Hz  16:9     67.500 kHz    148.500000 MHz
    VIC  97:  3840x2160   60.000000 Hz  16:9    135.000 kHz    594.000000 MHz
    VIC  96:  3840x2160   50.000000 Hz  16:9    112.500 kHz    594.000000 MHz
    VIC 118:  3840x2160  120.000000 Hz  16:9    270.000 kHz   1188.000000 MHz
    VIC  47:  1280x720   120.000000 Hz  16:9     90.000 kHz    148.500000 MHz
    VIC  63:  1920x1080  120.000000 Hz  16:9    135.000 kHz    297.000000 MHz
  Audio Data Block:
    Linear PCM:
      Max channels: 2
      Supported sample rates (kHz): 96 48 44.1 32
      Supported sample sizes (bits): 24 20 16
  Speaker Allocation Data Block:
    FL/FR - Front Left/Right
  Vendor-Specific Data Block (AMD), OUI 00-00-1A:
    Version: 2
    Flags 1: 0x01
      FreeSync Supported
    Minimum Refresh Rate: 48 Hz
    Maximum Refresh Rate: 160 Hz
    Flags 5: 0x00
  Colorimetry Data Block:
    BT2020cYCC
    BT2020YCC
    BT2020RGB
    Gamut Boundary Description Metadata Profile P0
  HDR Static Metadata Data Block:
    Electro optical transfer functions:
      Traditional gamma - SDR luminance range
      SMPTE ST2084
    Supported static metadata descriptors:
      Static metadata type 1
    Desired content max luminance: 101 (445.755 cd/m^2)
    Desired content max frame-average luminance: 101 (445.755 cd/m^2)
    Desired content min luminance: 38 (0.099 cd/m^2)
  Detailed Timing Descriptors:
    DTD 2:  2560x1440  144.000000 Hz  16:9    216.000 kHz    587.520000 MHz (697 mm x 392 mm)
                 Hfront   24 Hsync  16 Hback  120 Hpol P
                 Vfront    2 Vsync   5 Vback   53 Vpol N
    DTD 3:  2560x1440  119.999809 Hz  16:9    184.800 kHz    502.840000 MHz (697 mm x 392 mm)
                 Hfront   24 Hsync  16 Hback  121 Hpol P
                 Vfront    2 Vsync   5 Vback   93 Vpol N
    DTD 4:  2560x1440   60.000096 Hz  16:9     91.680 kHz    249.370000 MHz (697 mm x 392 mm)
                 Hfront   48 Hsync  32 Hback   80 Hpol P
                 Vfront    3 Vsync   5 Vback   80 Vpol P
    DTD 5:  1920x1080  143.981451 Hz  16:9    166.587 kHz    346.500000 MHz (697 mm x 392 mm)
                 Hfront   48 Hsync  32 Hback   80 Hpol P
                 Vfront    6 Vsync  10 Vback   61 Vpol N
Checksum: 0x80  Unused space in Extension Block: 8 bytes

----------------

Block 2, DisplayID Extension Block:
  Version: 1.2
  Extension Count: 0
  Display Product Type: Standalone display device
  Video Timing Modes Type 1 - Detailed Timings Data Block:
    DTD:  3840x2160  120.000000 Hz  16:9    270.000 kHz   1188.000000 MHz (aspect 16:9, no 3D stereo)
               Hfront  176 Hsync  88 Hback  296 Hpol P
               Vfront    8 Vsync  10 Vback   72 Vpol N
    DTD:  3840x2160  143.999284 Hz  16:9    320.398 kHz   1286.720000 MHz (aspect 16:9, no 3D stereo)
               Hfront   48 Hsync  32 Hback   96 Hpol P
               Vfront    6 Vsync  10 Vback   49 Vpol N
    DTD:  3840x2160  160.000000 Hz  16:9    350.400 kHz   1401.600000 MHz (aspect 16:9, no 3D stereo)
               Hfront   48 Hsync  32 Hback   80 Hpol P
               Vfront    6 Vsync  10 Vback   14 Vpol N
  Checksum: 0xfd
Checksum: 0x90

----------------

Warnings:

Block 0, Base EDID:
  Vendor & Product Identification: The serial number is one of the known dummy values, it should probably be set to 0.
Block 1, CTA-861 Extension Block:
  IT Video Formats are overscanned by default, but normally this should be underscanned.
  Video Data Block: VIC 3 and the first DTD are not identical. Is this intended?
  Colorimetry Data Block: Set the sRGB colorimetry bit to avoid interop issues.
  Display Product Serial Number is set, so the Serial Number in the Base EDID should be 0.
Block 2, DisplayID Extension Block:
  Video Timing Modes Type 1 - Detailed Timings Data Block: DTD is similar but not identical to VIC 118.
EDID:
  Base EDID: Some timings are out of range of the Monitor Ranges:
    Horizontal Freq: 31.250 - 350.400 kHz (Monitor: 390.000 - 390.000 kHz)

Failures:

Block 0, Base EDID:
  Display Product Serial Number: ...
Block 1, CTA-861 Extension Block:
  Missing VCDB, needed for Set Selectable RGB Quantization to avoid interop issues.
EDID:
  Extension Block 3 started with EDID header, ignoring Extension Blocks >= 3.
  DisplayID: Missing DisplayID Display Parameters Data Block.
  DisplayID: DisplayID expects at least one preferred timing.

EDID conformity: FAIL
