edid-decode (hex):

00 ff ff ff ff ff ff 00 4d 77 00 00 00 00 00 00
0f 16 01 03 80 43 27 78 0a 0d c9 a0 57 47 98 27
12 48 4c 2f cf 00 81 80 01 01 01 01 01 01 01 01
01 01 01 01 01 01 66 21 50 b0 51 00 1b 30 40 70
36 00 ba 89 21 00 00 1e 00 00 00 10 00 00 00 00
00 00 00 00 00 00 00 00 00 00 00 00 00 fc 00 54
56 0a 20 20 20 20 20 20 20 20 20 20 00 00 00 fd
00 17 4c 0f 51 0f 00 0a 20 20 20 20 20 20 01 02

02 03 39 70 54 1f 10 20 21 22 13 04 00 00 14 05
12 11 03 02 16 15 07 06 01 23 09 07 07 78 03 0c
00 10 00 38 2d ef 6f 6f 79 79 d0 09 01 40 2f f7
40 70 80 b3 d3 00 02 00 7f 0e 1f 00 80 51 00 1e
30 40 80 37 00 ba 88 21 00 00 1c f1 27 00 a0 51
00 25 30 50 80 37 00 ba 88 21 00 00 1c a9 1a 00
a0 50 00 16 30 30 20 37 00 62 f2 31 00 00 1a 00
00 00 00 00 00 00 00 00 00 00 00 00 00 00 00 aa

00 ff ff ff ff ff ff 00 4d 77 00 00 00 00 00 00
0f 16 01 03 80 43 27 78 0a 0d c9 a0 57 47 98 27
12 48 4c 2f cf 00 81 80 01 01 01 01 01 01 01 01
01 01 01 01 01 01 66 21 50 b0 51 00 1b 30 40 70
36 00 ba 89 21 00 00 1e 00 00 00 10 00 00 00 00
00 00 00 00 00 00 00 00 00 00 00 00 00 fc 00 54
56 0a 20 20 20 20 20 20 20 20 20 20 00 00 00 fd
00 17 4c 0f 51 0f 00 0a 20 20 20 20 20 20 01 02

02 03 39 70 54 1f 10 20 21 22 13 04 00 00 14 05
12 11 03 02 16 15 07 06 01 23 09 07 07 78 03 0c
00 10 00 38 2d ef 6f 6f 79 79 d0 09 01 40 2f f7
40 70 80 b3 d3 00 02 00 7f 0e 1f 00 80 51 00 1e
30 40 80 37 00 ba 88 21 00 00 1c f1 27 00 a0 51
00 25 30 50 80 37 00 ba 88 21 00 00 1c a9 1a 00
a0 50 00 16 30 30 20 37 00 62 f2 31 00 00 1a 00
00 00 00 00 00 00 00 00 00 00 00 00 00 00 00 aa

----------------

Block 0, Base EDID:
  EDID Structure Version & Revision: 1.3
  Vendor & Product Identification:
    Manufacturer: SKW
    Model: 0
    Made in: week 15 of 2012
  Basic Display Parameters & Features:
    Digital display
    Maximum image size: 67 cm x 39 cm
    Gamma: 2.20
    RGB color display
    First detailed timing is the preferred timing
  Color Characteristics:
    Red  : 0.6250, 0.3398
    Green: 0.2802, 0.5947
    Blue : 0.1552, 0.0703
    White: 0.2832, 0.2978
  Established Timings I & II:
    DMT 0x04:   640x480    59.940476 Hz   4:3     31.469 kHz     25.175000 MHz
    DMT 0x05:   640x480    72.808802 Hz   4:3     37.861 kHz     31.500000 MHz
    DMT 0x06:   640x480    75.000000 Hz   4:3     37.500 kHz     31.500000 MHz
    DMT 0x08:   800x600    56.250000 Hz   4:3     35.156 kHz     36.000000 MHz
    DMT 0x09:   800x600    60.316541 Hz   4:3     37.879 kHz     40.000000 MHz
    DMT 0x0a:   800x600    72.187572 Hz   4:3     48.077 kHz     50.000000 MHz
    DMT 0x0b:   800x600    75.000000 Hz   4:3     46.875 kHz     49.500000 MHz
    DMT 0x10:  1024x768    60.003840 Hz   4:3     48.363 kHz     65.000000 MHz
    DMT 0x11:  1024x768    70.069359 Hz   4:3     56.476 kHz     75.000000 MHz
    DMT 0x12:  1024x768    75.028582 Hz   4:3     60.023 kHz     78.750000 MHz
    DMT 0x24:  1280x1024   75.024675 Hz   5:4     79.976 kHz    135.000000 MHz
  Standard Timings:
    DMT 0x23:  1280x1024   60.019740 Hz   5:4     63.981 kHz    108.000000 MHz
  Detailed Timing Descriptors:
    DTD 1:  1360x768    60.015162 Hz  85:48    47.712 kHz     85.500000 MHz (698 mm x 393 mm)
                 Hfront   64 Hsync 112 Hback  256 Hpol P
                 Vfront    3 Vsync   6 Vback   18 Vpol P
    Dummy Descriptor:
    Display Product Name: 'TV'
    Display Range Limits:
      Monitor ranges (GTF): 23-76 Hz V, 15-81 kHz H, max dotclock 150 MHz
  Extension blocks: 1
Checksum: 0x02

----------------

Block 1, CTA-861 Extension Block:
  Revision: 3
  Basic audio support
  Supports YCbCr 4:4:4
  Supports YCbCr 4:2:2
  Native DTDs: 0
  Video Data Block:
    VIC  31:  1920x1080   50.000000 Hz  16:9     56.250 kHz    148.500000 MHz
    VIC  16:  1920x1080   60.000000 Hz  16:9     67.500 kHz    148.500000 MHz
    VIC  32:  1920x1080   24.000000 Hz  16:9     27.000 kHz     74.250000 MHz
    VIC  33:  1920x1080   25.000000 Hz  16:9     28.125 kHz     74.250000 MHz
    VIC  34:  1920x1080   30.000000 Hz  16:9     33.750 kHz     74.250000 MHz
    VIC  19:  1280x720    50.000000 Hz  16:9     37.500 kHz     74.250000 MHz
    VIC   4:  1280x720    60.000000 Hz  16:9     45.000 kHz     74.250000 MHz
    VIC  20:  1920x1080i  50.000000 Hz  16:9     28.125 kHz     74.250000 MHz
    VIC   5:  1920x1080i  60.000000 Hz  16:9     33.750 kHz     74.250000 MHz
    VIC  18:   720x576    50.000000 Hz  16:9     31.250 kHz     27.000000 MHz
    VIC  17:   720x576    50.000000 Hz   4:3     31.250 kHz     27.000000 MHz
    VIC   3:   720x480    59.940060 Hz  16:9     31.469 kHz     27.000000 MHz
    VIC   2:   720x480    59.940060 Hz   4:3     31.469 kHz     27.000000 MHz
    VIC  22:  1440x576i   50.000000 Hz  16:9     15.625 kHz     27.000000 MHz
    VIC  21:  1440x576i   50.000000 Hz   4:3     15.625 kHz     27.000000 MHz
    VIC   7:  1440x480i   59.940060 Hz  16:9     15.734 kHz     27.000000 MHz
    VIC   6:  1440x480i   59.940060 Hz   4:3     15.734 kHz     27.000000 MHz
    VIC   1:   640x480    59.940476 Hz   4:3     31.469 kHz     25.175000 MHz
  Audio Data Block:
    Linear PCM:
      Max channels: 2
      Supported sample rates (kHz): 48 44.1 32
      Supported sample sizes (bits): 24 20 16
  Vendor-Specific Data Block (HDMI), OUI 00-0C-03:
    Source physical address: 1.0.0.0
    DC_36bit
    DC_30bit
    DC_Y444
    Maximum TMDS clock: 225 MHz
    Supported Content Types:
      Graphics
      Photo
      Cinema
      Game
    Video latency: 220 ms
    Audio latency: 220 ms
    Interlaced video latency: 240 ms
    Interlaced audio latency: 240 ms
    Extended HDMI video details:
      3D present
      3D-capable-VIC mask present
      Base EDID image size is in units of 1 cm
      3D: Side-by-side (half, horizontal)
      3D: Top-and-bottom
      3D VIC indices that support these capabilities:
        VIC  31:  1920x1080   50.000000 Hz  16:9     56.250 kHz    148.500000 MHz
        VIC  16:  1920x1080   60.000000 Hz  16:9     67.500 kHz    148.500000 MHz
        VIC  32:  1920x1080   24.000000 Hz  16:9     27.000 kHz     74.250000 MHz
        VIC  34:  1920x1080   30.000000 Hz  16:9     33.750 kHz     74.250000 MHz
        VIC  19:  1280x720    50.000000 Hz  16:9     37.500 kHz     74.250000 MHz
        VIC   4:  1280x720    60.000000 Hz  16:9     45.000 kHz     74.250000 MHz
        Unknown (VIC   0)
        Unknown (VIC   0)
        VIC  20:  1920x1080i  50.000000 Hz  16:9     28.125 kHz     74.250000 MHz
        VIC   5:  1920x1080i  60.000000 Hz  16:9     33.750 kHz     74.250000 MHz
        VIC  18:   720x576    50.000000 Hz  16:9     31.250 kHz     27.000000 MHz
        VIC   3:   720x480    59.940060 Hz  16:9     31.469 kHz     27.000000 MHz
      3D VIC indices with specific capabilities:
        VIC  34:  1920x1080   30.000000 Hz  16:9     33.750 kHz     74.250000 MHz (frame packing)
        Unknown (VIC   0, frame packing)
        Unknown (VIC   0, frame packing)
        VIC  18:   720x576    50.000000 Hz  16:9     31.250 kHz     27.000000 MHz (side-by-side (full))
        VIC   3:   720x480    59.940060 Hz  16:9     31.469 kHz     27.000000 MHz (side-by-side (full))
  Unknown CTA-861 Data Block (tag 0x00, length 2):
    00 7f                                           '..'
  Detailed Timing Descriptors:
    DTD 2:  1280x768    59.870228 Hz   5:3     47.776 kHz     79.500000 MHz (698 mm x 392 mm)
                 Hfront   64 Hsync 128 Hback  192 Hpol N
                 Vfront    3 Vsync   7 Vback   20 Vpol P
    DTD 3:  1280x768    74.893062 Hz   5:3     60.289 kHz    102.250000 MHz (698 mm x 392 mm)
                 Hfront   80 Hsync 128 Hback  208 Hpol N
                 Vfront    3 Vsync   7 Vback   27 Vpol P
    DTD 4:  1280x768    59.994726 Hz   5:3     47.396 kHz     68.250000 MHz (866 mm x 498 mm)
                 Hfront   48 Hsync  32 Hback   80 Hpol P
                 Vfront    3 Vsync   7 Vback   12 Vpol N
Checksum: 0xaa  Unused space in Extension Block: 16 bytes

----------------

Warnings:

Block 1, CTA-861 Extension Block:
  IT Video Formats are overscanned by default, but normally this should be underscanned.
  Video Data Block: VIC 31 and the first DTD are not identical. Is this intended?
  Unknown CTA-861 Data Block (tag 0x00, length 2).
  Detailed Timing Descriptor #2: Image size is 698x392 mm, but based on the picture AR it should be 653x392 mm.
  Detailed Timing Descriptor #3: Image size is 698x392 mm, but based on the picture AR it should be 653x392 mm.
  Detailed Timing Descriptor #4: Image size is 866x498 mm, but based on the picture AR it should be 830x498 mm.
  Add a Colorimetry Data Block with the sRGB colorimetry bit set to avoid interop issues.

Failures:

Block 0, Base EDID:
  Detailed Timing Descriptor #1: Mismatch of image size 698x393 mm vs display size 670x390 mm.
Block 1, CTA-861 Extension Block:
  Detailed Timing Descriptor #2: Mismatch of image size 698x392 mm vs display size 670x390 mm.
  Detailed Timing Descriptor #3: Mismatch of image size 698x392 mm vs display size 670x390 mm.
  Detailed Timing Descriptor #4: Mismatch of image size 866x498 mm vs display size 670x390 mm.
  Missing VCDB, needed for Set Selectable RGB Quantization to avoid interop issues.
EDID:
  Extension Block 2 started with EDID header, ignoring Extension Blocks >= 2.
  Base EDID: The DTD max image size is 866x498mm, which is larger than the display size 670.0x390.0mm.

EDID conformity: FAIL
