edid-decode (hex):

00 ff ff ff ff ff ff 00 06 af 8e de 00 00 00 00
28 1d 01 04 a5 22 13 78 03 ee 95 a3 54 4c 99 26
0f 50 54 00 00 00 01 01 01 01 01 01 01 01 01 01
01 01 01 01 01 01 50 d0 80 50 70 38 1f 40 30 20
a5 00 58 c1 10 00 00 18 1c 34 80 50 70 38 1f 40
30 20 a5 00 58 c1 10 00 00 18 00 00 00 fd 0e 3c
2d 4f 4f 43 01 0a 20 20 20 20 20 20 00 00 00 fe
00 42 31 35 36 48 41 4e 31 32 2e 30 20 0a 01 b5

70 13 79 00 00 03 01 14 8c 04 01 84 7f 07 4f 00
2f 00 1f 00 37 04 1e 00 09 00 04 00 00 00 00 00
00 00 00 00 00 00 00 00 00 00 00 00 00 00 00 00
00 00 00 00 00 00 00 00 00 00 00 00 00 00 00 00
00 00 00 00 00 00 00 00 00 00 00 00 00 00 00 00
00 00 00 00 00 00 00 00 00 00 00 00 00 00 00 00
00 00 00 00 00 00 00 00 00 00 00 00 00 00 00 00
00 00 00 00 00 00 00 00 00 00 00 00 00 00 be 90

----------------

Block 0, Base EDID:
  EDID Structure Version & Revision: 1.4
  Vendor & Product Identification:
    Manufacturer: AUO
    Model: 56974
    Made in: week 40 of 2019
  Basic Display Parameters & Features:
    Digital display
    Bits per primary color channel: 8
    DisplayPort interface
    Maximum image size: 34 cm x 19 cm
    Gamma: 2.20
    Supported color formats: RGB 4:4:4
    First detailed timing includes the native pixel format and preferred refresh rate
    Display supports continuous frequencies
  Color Characteristics:
    Red  : 0.6396, 0.3300
    Green: 0.2998, 0.5996
    Blue : 0.1503, 0.0595
    White: 0.3134, 0.3291
  Established Timings I & II: none
  Standard Timings: none
  Detailed Timing Descriptors:
    DTD 1:  1920x1080  240.000000 Hz  16:9    266.640 kHz    533.280000 MHz (344 mm x 193 mm)
                 Hfront   48 Hsync  32 Hback    0 Hpol N
                 Vfront   10 Vsync   5 Vback   16 Vpol N
    DTD 2:  1920x1080   60.036004 Hz  16:9     66.700 kHz    133.400000 MHz (344 mm x 193 mm)
                 Hfront   48 Hsync  32 Hback    0 Hpol N
                 Vfront   10 Vsync   5 Vback   16 Vpol N
    Display Range Limits:
      Monitor ranges (Range Limits Only): 60-300 Hz V, 334-334 kHz H, max dotclock 670 MHz
    Alphanumeric Data String: 'B156HAN12.0 '
  Extension blocks: 1
Checksum: 0xb5

----------------

Block 1, DisplayID Extension Block:
  Version: 1.3
  Extension Count: 0
  Display Product Type: Extension Section
  Video Timing Modes Type 1 - Detailed Timings Data Block:
    DTD:  1920x1080  300.184518 Hz  16:9    333.505 kHz    667.010000 MHz (aspect 16:9, no 3D stereo, preferred)
               Hfront   48 Hsync  32 Hback    0 Hpol N
               Vfront   10 Vsync   5 Vback   16 Vpol N
  Checksum: 0xbe
Checksum: 0x90

----------------

Warnings:

Block 0, Base EDID:
  Missing Display Product Name.
EDID:
  Base EDID: Some timings are out of range of the Monitor Ranges:
    Horizontal Freq: 66.700 - 333.505 kHz (Monitor: 334.000 - 334.000 kHz)

Failures:

Block 0, Base EDID:
  Detailed Timing Descriptor #1: 0 or negative horizontal back porch.
  Detailed Timing Descriptor #2: 0 or negative horizontal back porch.
  Alphanumeric Data String: One or more trailing spaces before newline.
Block 1, DisplayID Extension Block:
  DisplayID Base Block has no product type.
  Video Timing Modes Type 1 - Detailed Timings Data Block: 0 or negative horizontal back porch.

EDID conformity: FAIL
