edid-decode (hex):

00 ff ff ff ff ff ff 00 09 d1 3b 78 45 54 00 00
14 13 01 03 80 34 1d 78 2e ee d1 a5 55 48 9b 26
12 50 54 a5 6b 80 71 00 81 c0 81 40 81 80 a9 c0
b3 00 d1 c0 01 01 02 3a 80 18 71 38 2d 40 58 2c
45 00 09 25 21 00 00 1a 00 00 00 ff 00 34 35 39
30 35 39 31 35 53 4c 30 0a 20 00 00 00 fd 00 32
4c 18 53 11 00 0a 20 20 20 20 20 20 00 00 00 fc
00 42 65 6e 51 20 47 32 34 31 32 48 44 0a 00 70

00 ff ff ff ff ff ff 00 09 d1 3b 78 45 54 00 00
14 13 01 03 80 34 1d 78 2e ee d1 a5 55 48 9b 26
12 50 54 a5 6b 80 71 00 81 c0 81 40 81 80 a9 c0
b3 00 d1 c0 01 01 02 3a 80 18 71 38 2d 40 58 2c
45 00 09 25 21 00 00 1a 00 00 00 ff 00 34 35 39
30 35 39 31 35 53 4c 30 0a 20 00 00 00 fd 00 32
4c 18 53 11 00 0a 20 20 20 20 20 20 00 00 00 fc
00 42 65 6e 51 20 47 32 34 31 32 48 44 0a 00 70

----------------

Block 0, Base EDID:
  EDID Structure Version & Revision: 1.3
  Vendor & Product Identification:
    Manufacturer: BNQ
    Model: 30779
    Serial Number: ...
    Made in: week 20 of 2009
  Basic Display Parameters & Features:
    Digital display
    Maximum image size: 52 cm x 29 cm
    Gamma: 2.20
    DPMS levels: Off
    RGB color display
    Default (sRGB) color space is primary color space
    First detailed timing is the preferred timing
  Color Characteristics:
    Red  : 0.6474, 0.3339
    Green: 0.2841, 0.6074
    Blue : 0.1513, 0.0712
    White: 0.3125, 0.3291
  Established Timings I & II:
    IBM     :   720x400    70.081663 Hz   9:5     31.467 kHz     28.320000 MHz
    DMT 0x04:   640x480    59.940476 Hz   4:3     31.469 kHz     25.175000 MHz
    DMT 0x06:   640x480    75.000000 Hz   4:3     37.500 kHz     31.500000 MHz
    DMT 0x09:   800x600    60.316541 Hz   4:3     37.879 kHz     40.000000 MHz
    DMT 0x0b:   800x600    75.000000 Hz   4:3     46.875 kHz     49.500000 MHz
    Apple   :   832x624    74.551266 Hz   4:3     49.726 kHz     57.284000 MHz
    DMT 0x10:  1024x768    60.003840 Hz   4:3     48.363 kHz     65.000000 MHz
    DMT 0x12:  1024x768    75.028582 Hz   4:3     60.023 kHz     78.750000 MHz
    DMT 0x24:  1280x1024   75.024675 Hz   5:4     79.976 kHz    135.000000 MHz
    Apple   :  1152x870    75.061550 Hz 192:145   68.681 kHz    100.000000 MHz
  Standard Timings:
    GTF     :  1152x720    59.999964 Hz  16:10    44.760 kHz     67.319000 MHz
    DMT 0x55:  1280x720    60.000000 Hz  16:9     45.000 kHz     74.250000 MHz
    DMT 0x20:  1280x960    60.000000 Hz   4:3     60.000 kHz    108.000000 MHz
    DMT 0x23:  1280x1024   60.019740 Hz   5:4     63.981 kHz    108.000000 MHz
    DMT 0x53:  1600x900    60.000000 Hz  16:9     60.000 kHz    108.000000 MHz (RB)
    DMT 0x3a:  1680x1050   59.954250 Hz  16:10    65.290 kHz    146.250000 MHz
    DMT 0x52:  1920x1080   60.000000 Hz  16:9     67.500 kHz    148.500000 MHz
  Detailed Timing Descriptors:
    DTD 1:  1920x1080   60.000000 Hz  16:9     67.500 kHz    148.500000 MHz (521 mm x 293 mm)
                 Hfront   88 Hsync  44 Hback  148 Hpol P
                 Vfront    4 Vsync   5 Vback   36 Vpol N
    Display Product Serial Number: ...
    Display Range Limits:
      Monitor ranges (GTF): 50-76 Hz V, 24-83 kHz H, max dotclock 170 MHz
    Display Product Name: 'BenQ G2412HD'
Checksum: 0x70

----------------

Block 1, Unknown EDID Extension Block 0x00:
  00 ff ff ff ff ff ff 00 09 d1 3b 78 45 54 00 00 '..........;xET..'
  14 13 01 03 80 34 1d 78 2e ee d1 a5 55 48 9b 26 '.....4.x....UH.&'
  12 50 54 a5 6b 80 71 00 81 c0 81 40 81 80 a9 c0 '.PT.k.q....@....'
  b3 00 d1 c0 01 01 02 3a 80 18 71 38 2d 40 58 2c '.......:..q8-@X,'
  45 00 09 25 21 00 00 1a 00 00 00 ff 00 34 35 39 'E..%!........459'
  30 35 39 31 35 53 4c 30 0a 20 00 00 00 fd 00 32 '05915SL0. .....2'
  4c 18 53 11 00 0a 20 20 20 20 20 20 00 00 00 fc 'L.S...      ....'
  00 42 65 6e 51 20 47 32 34 31 32 48 44 0a 00 70 '.BenQ G2412HD..p'
Checksum: 0x70

----------------

Warnings:

Block 0, Base EDID:
  Vendor & Product Identification: The serial number is one of the known dummy values, it should probably be set to 0.
  Detailed Timing Descriptor #1: DTD is similar but not identical to VIC 16.

Failures:

Block 0, Base EDID:
  Basic Display Parameters & Features: sRGB is signaled, but the chromaticities do not match.
Block 1, Base EDID:
  Unknown Extension Block.
EDID:
  Base EDID: EDID specified 0 extension block(s), but found 1 extension block(s).

EDID conformity: FAIL
