edid-decode (hex):

00 ff ff ff ff ff ff 00 4e ae 9a 05 01 00 00 00
03 11 01 04 a1 33 20 78 6f de 50 a3 54 4c 9b 26
0f 50 54 bf ef 80 d1 00 d1 c0 81 80 81 90 a9 40
71 86 61 4f 01 01 10 3b 80 88 70 b0 22 40 08 40
24 00 06 44 21 00 00 1e ca 35 80 88 70 38 20 40
08 40 24 00 06 44 21 00 00 1e 30 2a 00 98 51 00
2a 40 30 70 13 00 06 44 21 00 00 18 ae 33 40 b0
60 b0 27 40 08 40 5a 00 06 44 21 00 00 1e 00 39

00 ff ff ff ff ff ff 00 4e ae 9a 05 01 00 00 00
03 11 01 04 a1 33 20 78 6f de 50 a3 54 4c 9b 26
0f 50 54 bf ef 80 d1 00 d1 c0 81 80 81 90 a9 40
71 86 61 4f 01 01 10 3b 80 88 70 b0 22 40 08 40
24 00 06 44 21 00 00 1e ca 35 80 88 70 38 20 40
08 40 24 00 06 44 21 00 00 1e 30 2a 00 98 51 00
2a 40 30 70 13 00 06 44 21 00 00 18 ae 33 40 b0
60 b0 27 40 08 40 5a 00 06 44 21 00 00 1e 00 39

----------------

Block 0, Base EDID:
  EDID Structure Version & Revision: 1.4
  Vendor & Product Identification:
    Manufacturer: SUN
    Model: 1434
    Serial Number: ...
    Made in: week 3 of 2007
  Basic Display Parameters & Features:
    Digital display
    Bits per primary color channel: 8
    DVI interface
    Maximum image size: 51 cm x 32 cm
    Gamma: 2.20
    DPMS levels: Suspend Off
    Supported color formats: RGB 4:4:4, YCrCb 4:4:4
    Default (sRGB) color space is primary color space
    First detailed timing includes the native pixel format and preferred refresh rate
    Display supports continuous frequencies
  Color Characteristics:
    Red  : 0.6396, 0.3291
    Green: 0.2998, 0.6074
    Blue : 0.1494, 0.0595
    White: 0.3125, 0.3281
  Established Timings I & II:
    IBM     :   720x400    70.081663 Hz   9:5     31.467 kHz     28.320000 MHz
    DMT 0x04:   640x480    59.940476 Hz   4:3     31.469 kHz     25.175000 MHz
    Apple   :   640x480    66.666667 Hz   4:3     35.000 kHz     30.240000 MHz
    DMT 0x05:   640x480    72.808802 Hz   4:3     37.861 kHz     31.500000 MHz
    DMT 0x06:   640x480    75.000000 Hz   4:3     37.500 kHz     31.500000 MHz
    DMT 0x08:   800x600    56.250000 Hz   4:3     35.156 kHz     36.000000 MHz
    DMT 0x09:   800x600    60.316541 Hz   4:3     37.879 kHz     40.000000 MHz
    DMT 0x0a:   800x600    72.187572 Hz   4:3     48.077 kHz     50.000000 MHz
    DMT 0x0b:   800x600    75.000000 Hz   4:3     46.875 kHz     49.500000 MHz
    Apple   :   832x624    74.551266 Hz   4:3     49.726 kHz     57.284000 MHz
    DMT 0x10:  1024x768    60.003840 Hz   4:3     48.363 kHz     65.000000 MHz
    DMT 0x11:  1024x768    70.069359 Hz   4:3     56.476 kHz     75.000000 MHz
    DMT 0x12:  1024x768    75.028582 Hz   4:3     60.023 kHz     78.750000 MHz
    DMT 0x24:  1280x1024   75.024675 Hz   5:4     79.976 kHz    135.000000 MHz
    Apple   :  1152x870    75.061550 Hz 192:145   68.681 kHz    100.000000 MHz
  Standard Timings:
    DMT 0x45:  1920x1200   59.884600 Hz  16:10    74.556 kHz    193.250000 MHz
    DMT 0x52:  1920x1080   60.000000 Hz  16:9     67.500 kHz    148.500000 MHz
    DMT 0x23:  1280x1024   60.019740 Hz   5:4     63.981 kHz    108.000000 MHz
    GTF     :  1280x1024   75.999957 Hz   5:4     81.320 kHz    141.822000 MHz
    DMT 0x33:  1600x1200   60.000000 Hz   4:3     75.000 kHz    162.000000 MHz
    GTF     :  1152x921    66.000114 Hz   5:4     63.162 kHz     97.017000 MHz
    DMT 0x12:  1024x768    75.028582 Hz   4:3     60.023 kHz     78.750000 MHz
  Detailed Timing Descriptors:
    DTD 1:  1920x1200   59.595507 Hz  16:10    73.541 kHz    151.200000 MHz (518 mm x 324 mm)
                 Hfront    8 Hsync  64 Hback   64 Hpol P
                 Vfront    2 Vsync   4 Vback   28 Vpol P
    DTD 2:  1920x1080   60.229054 Hz  16:9     66.975 kHz    137.700000 MHz (518 mm x 324 mm)
                 Hfront    8 Hsync  64 Hback   64 Hpol P
                 Vfront    2 Vsync   4 Vback   26 Vpol P
    DTD 3:  1280x1024   60.019740 Hz   5:4     63.981 kHz    108.000000 MHz (518 mm x 324 mm)
                 Hfront   48 Hsync 112 Hback  248 Hpol N
                 Vfront    1 Vsync   3 Vback   38 Vpol N
    DTD 4:  1600x1200   60.123683 Hz   4:3     74.493 kHz    132.300000 MHz (518 mm x 324 mm)
                 Hfront    8 Hsync  64 Hback  104 Hpol P
                 Vfront    5 Vsync  10 Vback   24 Vpol P
Checksum: 0x39

----------------

Block 1, Unknown EDID Extension Block 0x00:
  00 ff ff ff ff ff ff 00 4e ae 9a 05 01 00 00 00 '........N.......'
  03 11 01 04 a1 33 20 78 6f de 50 a3 54 4c 9b 26 '.....3 xo.P.TL.&'
  0f 50 54 bf ef 80 d1 00 d1 c0 81 80 81 90 a9 40 '.PT............@'
  71 86 61 4f 01 01 10 3b 80 88 70 b0 22 40 08 40 'q.aO...;..p."@.@'
  24 00 06 44 21 00 00 1e ca 35 80 88 70 38 20 40 '$..D!....5..p8 @'
  08 40 24 00 06 44 21 00 00 1e 30 2a 00 98 51 00 '.@$..D!...0*..Q.'
  2a 40 30 70 13 00 06 44 21 00 00 18 ae 33 40 b0 '*@0p...D!....3@.'
  60 b0 27 40 08 40 5a 00 06 44 21 00 00 1e 00 39 '`.'@.@Z..D!....9'
Checksum: 0x39

----------------

Warnings:

Block 0, Base EDID:
  Vendor & Product Identification: The serial number is one of the known dummy values, it should probably be set to 0.
  Standard Timings: Standard Timing 1152x921 has a dubious odd vertical resolution.
  Detailed Timing Descriptor #2: Image size is 518x324 mm, but based on the picture AR it should be 518x291 mm.
  Detailed Timing Descriptor #3: DTD is similar but not identical to DMT 0x23.
  Detailed Timing Descriptor #3: Image size is 518x324 mm, but based on the picture AR it should be 518x414 mm.
  Detailed Timing Descriptor #4: Image size is 518x324 mm, but based on the picture AR it should be 518x388 mm.
  Missing Display Product Name.

Failures:

Block 0, Base EDID:
  Basic Display Parameters & Features: sRGB is signaled, but the chromaticities do not match.
  Missing Display Range Limits Descriptor.
Block 1, Base EDID:
  Unknown Extension Block.
EDID:
  Base EDID: EDID specified 0 extension block(s), but found 1 extension block(s).

EDID conformity: FAIL
