edid-decode (hex):

00 ff ff ff ff ff ff 00 34 a9 96 a2 01 01 01 01
00 17 01 03 80 80 48 78 0a da ff a3 58 4a a2 29
17 49 4b 21 08 00 31 40 45 40 61 40 81 80 01 01
01 01 01 01 01 01 02 3a 80 d0 72 38 2d 40 10 2c
45 80 ba 88 21 00 00 1e 02 3a 80 18 71 38 2d 40
58 2c 45 00 ba 88 21 00 00 1e 00 00 00 fc 00 50
61 6e 61 73 6f 6e 69 63 2d 54 56 0a 00 00 00 fd
00 17 3d 0f 44 0f 00 0a 20 20 20 20 20 20 01 5b

02 03 38 f2 4d 9f 90 14 05 20 21 22 13 04 12 03
16 07 23 09 07 01 7a 03 0c 00 20 00 b8 26 2f c8
10 81 41 01 9c 06 16 08 00 18 00 96 a6 98 00 a8
00 e2 00 4b e3 05 1f 01 01 1d 80 d0 72 1c 16 20
10 2c 25 80 ba 88 21 00 00 9e 01 1d 80 18 71 1c
16 20 58 2c 25 00 ba 88 21 00 00 9e 66 21 56 aa
51 00 1e 30 46 8f 33 00 ba 88 21 00 00 1e 00 00
00 00 00 00 00 00 00 00 00 00 00 00 00 00 00 9c

----------------

Block 0, Base EDID:
  EDID Structure Version & Revision: 1.3
  Vendor & Product Identification:
    Manufacturer: MEI
    Model: 41622
    Serial Number: ...
    Made in: 2013
  Basic Display Parameters & Features:
    Digital display
    Maximum image size: 128 cm x 72 cm
    Gamma: 2.20
    RGB color display
    First detailed timing is the preferred timing
  Color Characteristics:
    Red  : 0.6396, 0.3447
    Green: 0.2910, 0.6347
    Blue : 0.1630, 0.0927
    White: 0.2880, 0.2958
  Established Timings I & II:
    DMT 0x04:   640x480    59.940476 Hz   4:3     31.469 kHz     25.175000 MHz
    DMT 0x09:   800x600    60.316541 Hz   4:3     37.879 kHz     40.000000 MHz
    DMT 0x10:  1024x768    60.003840 Hz   4:3     48.363 kHz     65.000000 MHz
  Standard Timings:
    DMT 0x04:   640x480    59.940476 Hz   4:3     31.469 kHz     25.175000 MHz
    DMT 0x09:   800x600    60.316541 Hz   4:3     37.879 kHz     40.000000 MHz
    DMT 0x10:  1024x768    60.003840 Hz   4:3     48.363 kHz     65.000000 MHz
    DMT 0x23:  1280x1024   60.019740 Hz   5:4     63.981 kHz    108.000000 MHz
  Detailed Timing Descriptors:
    DTD 1:  1920x1080   50.000000 Hz  16:9     56.250 kHz    148.500000 MHz (698 mm x 392 mm)
                 Hfront  528 Hsync  44 Hback  148 Hpol P
                 Vfront    4 Vsync   5 Vback   36 Vpol P
    DTD 2:  1920x1080   60.000000 Hz  16:9     67.500 kHz    148.500000 MHz (698 mm x 392 mm)
                 Hfront   88 Hsync  44 Hback  148 Hpol P
                 Vfront    4 Vsync   5 Vback   36 Vpol P
    Display Product Name: 'Panasonic-TV'
    Display Range Limits:
      Monitor ranges (GTF): 23-61 Hz V, 15-68 kHz H, max dotclock 150 MHz
  Extension blocks: 1
Checksum: 0x5b

----------------

Block 1, CTA-861 Extension Block:
  Revision: 3
  Underscans IT Video Formats by default
  Basic audio support
  Supports YCbCr 4:4:4
  Supports YCbCr 4:2:2
  Native detailed modes: 2
  Video Data Block:
    VIC  31:  1920x1080   50.000000 Hz  16:9     56.250 kHz    148.500000 MHz (native)
    VIC  16:  1920x1080   60.000000 Hz  16:9     67.500 kHz    148.500000 MHz (native)
    VIC  20:  1920x1080i  50.000000 Hz  16:9     28.125 kHz     74.250000 MHz
    VIC   5:  1920x1080i  60.000000 Hz  16:9     33.750 kHz     74.250000 MHz
    VIC  32:  1920x1080   24.000000 Hz  16:9     27.000 kHz     74.250000 MHz
    VIC  33:  1920x1080   25.000000 Hz  16:9     28.125 kHz     74.250000 MHz
    VIC  34:  1920x1080   30.000000 Hz  16:9     33.750 kHz     74.250000 MHz
    VIC  19:  1280x720    50.000000 Hz  16:9     37.500 kHz     74.250000 MHz
    VIC   4:  1280x720    60.000000 Hz  16:9     45.000 kHz     74.250000 MHz
    VIC  18:   720x576    50.000000 Hz  16:9     31.250 kHz     27.000000 MHz
    VIC   3:   720x480    59.940060 Hz  16:9     31.469 kHz     27.000000 MHz
    VIC  22:  1440x576i   50.000000 Hz  16:9     15.625 kHz     27.000000 MHz
    VIC   7:  1440x480i   59.940060 Hz  16:9     15.734 kHz     27.000000 MHz
  Audio Data Block:
    Linear PCM:
      Max channels: 2
      Supported sample rates (kHz): 48 44.1 32
      Supported sample sizes (bits): 16
  Vendor-Specific Data Block (HDMI), OUI 00-0C-03:
    Source physical address: 2.0.0.0
    Supports_AI
    DC_36bit
    DC_30bit
    DC_Y444
    Maximum TMDS clock: 190 MHz
    Supported Content Types:
      Graphics
      Photo
      Cinema
      Game
    Extended HDMI video details:
      3D present
      3D-capable-VIC mask present
      Base EDID image size is aspect ratio
      3D: Side-by-side (half, quincunx)
      3D: Side-by-side (half, horizontal)
      3D: Top-and-bottom
      3D: Frame-packing
      3D VIC indices that support these capabilities:
        VIC  20:  1920x1080i  50.000000 Hz  16:9     28.125 kHz     74.250000 MHz
        VIC   5:  1920x1080i  60.000000 Hz  16:9     33.750 kHz     74.250000 MHz
        VIC  32:  1920x1080   24.000000 Hz  16:9     27.000 kHz     74.250000 MHz
        VIC  19:  1280x720    50.000000 Hz  16:9     37.500 kHz     74.250000 MHz
        VIC   4:  1280x720    60.000000 Hz  16:9     45.000 kHz     74.250000 MHz
      3D VIC indices with specific capabilities:
        VIC  31:  1920x1080   50.000000 Hz  16:9     56.250 kHz    148.500000 MHz (top-and-bottom)
        VIC  16:  1920x1080   60.000000 Hz  16:9     67.500 kHz    148.500000 MHz (top-and-bottom)
        VIC  31:  1920x1080   50.000000 Hz  16:9     56.250 kHz    148.500000 MHz (side-by-side, any subsampling)
        VIC  16:  1920x1080   60.000000 Hz  16:9     67.500 kHz    148.500000 MHz (side-by-side, any subsampling)
        VIC  18:   720x576    50.000000 Hz  16:9     31.250 kHz     27.000000 MHz (top-and-bottom)
        VIC   3:   720x480    59.940060 Hz  16:9     31.469 kHz     27.000000 MHz (top-and-bottom)
        VIC  18:   720x576    50.000000 Hz  16:9     31.250 kHz     27.000000 MHz (side-by-side, any subsampling)
        VIC   3:   720x480    59.940060 Hz  16:9     31.469 kHz     27.000000 MHz (side-by-side, any subsampling)
  Video Capability Data Block:
    YCbCr quantization: No Data
    RGB quantization: Selectable (via AVI Q)
    PT scan behavior: No Data
    IT scan behavior: Always Underscanned
    CE scan behavior: Supports both over- and underscan
  Colorimetry Data Block:
    xvYCC601
    xvYCC709
    sYCC601
    opYCC601
    opRGB
    Gamut Boundary Description Metadata Profile P0
  Detailed Timing Descriptors:
    DTD 3:  1920x1080i  50.000000 Hz  16:9     28.125 kHz     74.250000 MHz (698 mm x 392 mm)
                 Hfront  528 Hsync  44 Hback  148 Hpol P
                 Vfront    2 Vsync   5 Vback   15 Vpol P Vfront +0.5 Odd Field
                 Vfront    2 Vsync   5 Vback   15 Vpol P Vback  +0.5 Even Field
    DTD 4:  1920x1080i  60.000000 Hz  16:9     33.750 kHz     74.250000 MHz (698 mm x 392 mm)
                 Hfront   88 Hsync  44 Hback  148 Hpol P
                 Vfront    2 Vsync   5 Vback   15 Vpol P Vfront +0.5 Odd Field
                 Vfront    2 Vsync   5 Vback   15 Vpol P Vback  +0.5 Even Field
    DTD 5:  1366x768    59.789541 Hz 683:384   47.712 kHz     85.500000 MHz (698 mm x 392 mm)
                 Hfront   70 Hsync 143 Hback  213 Hpol P
                 Vfront    3 Vsync   3 Vback   24 Vpol P
Checksum: 0x9c  Unused space in Extension Block: 17 bytes

----------------

Warnings:

Block 0, Base EDID:
  Vendor & Product Identification: The serial number is one of the known dummy values, it should probably be set to 0.
Block 1, CTA-861 Extension Block:
  Video Capability Data Block: Set Selectable YCbCr Quantization to avoid interop issues.
  Colorimetry Data Block: Set the sRGB colorimetry bit to avoid interop issues.
EDID:
  CTA-861: Multiple native progressive timings are defined.

EDID conformity: PASS
