edid-decode (hex):

00 ff ff ff ff ff ff 00 38 a3 71 67 01 01 01 01
03 14 01 04 a5 30 1b 78 e2 e6 15 a6 55 49 99 27
13 50 54 bf ef 00 71 4f 81 4f 81 c0 95 0f b3 00
81 80 01 01 01 01 02 3a 80 18 71 38 2d 40 16 0b
45 00 dd 0c 11 00 00 1e 00 00 00 fd 00 37 4c 1f
51 11 00 0a 20 20 20 20 20 20 00 00 00 fc 00 56
32 32 31 57 0a 20 20 20 20 20 20 20 00 00 00 ff
00 30 31 31 31 37 39 33 38 4e 42 0a 20 20 00 86

00 ff ff ff ff ff ff 00 38 a3 71 67 01 01 01 01
03 14 01 04 a5 30 1b 78 e2 e6 15 a6 55 49 99 27
13 50 54 bf ef 00 71 4f 81 4f 81 c0 95 0f b3 00
81 80 01 01 01 01 02 3a 80 18 71 38 2d 40 16 0b
45 00 dd 0c 11 00 00 1e 00 00 00 fd 00 37 4c 1f
51 11 00 0a 20 20 20 20 20 20 00 00 00 fc 00 56
32 32 31 57 0a 20 20 20 20 20 20 20 00 00 00 ff
00 30 31 31 31 37 39 33 38 4e 42 0a 20 20 00 86

----------------

Block 0, Base EDID:
  EDID Structure Version & Revision: 1.4
  Vendor & Product Identification:
    Manufacturer: NEC
    Model: 26481
    Serial Number: ...
    Made in: week 3 of 2010
  Basic Display Parameters & Features:
    Digital display
    Bits per primary color channel: 8
    DisplayPort interface
    Maximum image size: 48 cm x 27 cm
    Gamma: 2.20
    DPMS levels: Standby Suspend Off
    Supported color formats: RGB 4:4:4
    First detailed timing includes the native pixel format and preferred refresh rate
  Color Characteristics:
    Red  : 0.6513, 0.3339
    Green: 0.2861, 0.5996
    Blue : 0.1523, 0.0751
    White: 0.3134, 0.3291
  Established Timings I & II:
    IBM     :   720x400    70.081663 Hz   9:5     31.467 kHz     28.320000 MHz
    DMT 0x04:   640x480    59.940476 Hz   4:3     31.469 kHz     25.175000 MHz
    Apple   :   640x480    66.666667 Hz   4:3     35.000 kHz     30.240000 MHz
    DMT 0x05:   640x480    72.808802 Hz   4:3     37.861 kHz     31.500000 MHz
    DMT 0x06:   640x480    75.000000 Hz   4:3     37.500 kHz     31.500000 MHz
    DMT 0x08:   800x600    56.250000 Hz   4:3     35.156 kHz     36.000000 MHz
    DMT 0x09:   800x600    60.316541 Hz   4:3     37.879 kHz     40.000000 MHz
    DMT 0x0a:   800x600    72.187572 Hz   4:3     48.077 kHz     50.000000 MHz
    DMT 0x0b:   800x600    75.000000 Hz   4:3     46.875 kHz     49.500000 MHz
    Apple   :   832x624    74.551266 Hz   4:3     49.726 kHz     57.284000 MHz
    DMT 0x10:  1024x768    60.003840 Hz   4:3     48.363 kHz     65.000000 MHz
    DMT 0x11:  1024x768    70.069359 Hz   4:3     56.476 kHz     75.000000 MHz
    DMT 0x12:  1024x768    75.028582 Hz   4:3     60.023 kHz     78.750000 MHz
    DMT 0x24:  1280x1024   75.024675 Hz   5:4     79.976 kHz    135.000000 MHz
  Standard Timings:
    DMT 0x15:  1152x864    75.000000 Hz   4:3     67.500 kHz    108.000000 MHz
    GTF     :  1280x960    74.999884 Hz   4:3     75.150 kHz    129.859000 MHz
    DMT 0x55:  1280x720    60.000000 Hz  16:9     45.000 kHz     74.250000 MHz
    DMT 0x30:  1440x900    74.984427 Hz  16:10    70.635 kHz    136.750000 MHz
    DMT 0x3a:  1680x1050   59.954250 Hz  16:10    65.290 kHz    146.250000 MHz
    DMT 0x23:  1280x1024   60.019740 Hz   5:4     63.981 kHz    108.000000 MHz
  Detailed Timing Descriptors:
    DTD 1:  1920x1080   60.000000 Hz  16:9     67.500 kHz    148.500000 MHz (477 mm x 268 mm)
                 Hfront   22 Hsync  11 Hback  247 Hpol P
                 Vfront    4 Vsync   5 Vback   36 Vpol P
    Display Range Limits:
      Monitor ranges (GTF): 55-76 Hz V, 31-81 kHz H, max dotclock 170 MHz
    Display Product Name: 'V221W'
    Display Product Serial Number: ...
Checksum: 0x86

----------------

Block 1, Unknown EDID Extension Block 0x00:
  00 ff ff ff ff ff ff 00 38 a3 71 67 01 01 01 01 '........8.qg....'
  03 14 01 04 a5 30 1b 78 e2 e6 15 a6 55 49 99 27 '.....0.x....UI.''
  13 50 54 bf ef 00 71 4f 81 4f 81 c0 95 0f b3 00 '.PT...qO.O......'
  81 80 01 01 01 01 02 3a 80 18 71 38 2d 40 16 0b '.......:..q8-@..'
  45 00 dd 0c 11 00 00 1e 00 00 00 fd 00 37 4c 1f 'E............7L.'
  51 11 00 0a 20 20 20 20 20 20 00 00 00 fc 00 56 'Q...      .....V'
  32 32 31 57 0a 20 20 20 20 20 20 20 00 00 00 ff '221W.       ....'
  00 30 31 31 31 37 39 33 38 4e 42 0a 20 20 00 86 '.01117938NB.  ..'
Checksum: 0x86

----------------

Warnings:

Block 0, Base EDID:
  Vendor & Product Identification: The serial number is one of the known dummy values, it should probably be set to 0.
  Detailed Timing Descriptor #1: DTD is similar but not identical to VIC 16.
  Display Range Limits: GTF support is deprecated in EDID 1.4.

Failures:

Block 0, Base EDID:
  Display Range Limits: GTF is supported, but the display does not support continuous frequencies.
Block 1, Base EDID:
  Unknown Extension Block.
EDID:
  Base EDID: EDID specified 0 extension block(s), but found 1 extension block(s).

EDID conformity: FAIL
