edid-decode (hex):

00 ff ff ff ff ff ff 00 63 18 00 27 01 01 01 01
13 23 01 03 80 3c 22 78 2a ee 91 a3 54 4c 99 26
0f 50 54 21 08 00 01 01 01 01 01 01 01 01 01 01
01 01 01 01 01 01 02 3a 80 18 71 38 2d 40 58 2c
25 00 56 50 21 00 00 1e 00 00 00 fc 00 48 44 4d
49 0a 20 20 20 20 20 20 20 20 d0 b6 80 a0 70 38
2d 40 30 20 35 00 56 50 21 00 00 1e 00 00 00 fd
00 3c a5 3c f0 3c 00 0a 20 20 20 20 20 20 01 63

02 03 2f f5 44 90 01 02 3f 23 09 07 07 83 01 00
00 67 03 0c 00 01 00 18 3c 67 d8 5d c4 01 78 80
00 e2 00 d5 e3 05 c0 00 e6 06 05 01 69 69 00 51
7f 80 6e 70 38 23 40 26 16 35 00 56 50 21 00 00
1e 8a 6f 80 a0 70 38 40 40 30 20 25 00 56 50 21
00 00 1e 0e 5c 80 a0 70 38 35 40 30 20 25 00 56
50 21 00 00 1e 35 91 80 6a 70 38 20 40 30 20 35
00 56 50 21 00 00 1e 00 00 00 00 00 00 00 00 df

00 ff ff ff ff ff ff 00 63 18 00 27 01 01 01 01
13 23 01 03 80 3c 22 78 2a ee 91 a3 54 4c 99 26
0f 50 54 21 08 00 01 01 01 01 01 01 01 01 01 01
01 01 01 01 01 01 02 3a 80 18 71 38 2d 40 58 2c
25 00 56 50 21 00 00 1e 00 00 00 fc 00 48 44 4d
49 0a 20 20 20 20 20 20 20 20 d0 b6 80 a0 70 38
2d 40 30 20 35 00 56 50 21 00 00 1e 00 00 00 fd
00 3c a5 3c f0 3c 00 0a 20 20 20 20 20 20 01 63

02 03 2f f5 44 90 01 02 3f 23 09 07 07 83 01 00
00 67 03 0c 00 01 00 18 3c 67 d8 5d c4 01 78 80
00 e2 00 d5 e3 05 c0 00 e6 06 05 01 69 69 00 51
7f 80 6e 70 38 23 40 26 16 35 00 56 50 21 00 00
1e 8a 6f 80 a0 70 38 40 40 30 20 25 00 56 50 21
00 00 1e 0e 5c 80 a0 70 38 35 40 30 20 25 00 56
50 21 00 00 1e 35 91 80 6a 70 38 20 40 30 20 35
00 56 50 21 00 00 1e 00 00 00 00 00 00 00 00 df

----------------

Block 0, Base EDID:
  EDID Structure Version & Revision: 1.3
  Vendor & Product Identification:
    Manufacturer: XXX
    Model: 9984
    Serial Number: ...
    Made in: week 19 of 2025
  Basic Display Parameters & Features:
    Digital display
    Maximum image size: 60 cm x 34 cm
    Gamma: 2.20
    DPMS levels: Off
    RGB color display
    First detailed timing is the preferred timing
  Color Characteristics:
    Red  : 0.6396, 0.3300
    Green: 0.2998, 0.5996
    Blue : 0.1503, 0.0595
    White: 0.3125, 0.3291
  Established Timings I & II:
    DMT 0x04:   640x480    59.940476 Hz   4:3     31.469 kHz     25.175000 MHz
    DMT 0x09:   800x600    60.316541 Hz   4:3     37.879 kHz     40.000000 MHz
    DMT 0x10:  1024x768    60.003840 Hz   4:3     48.363 kHz     65.000000 MHz
  Standard Timings: none
  Detailed Timing Descriptors:
    DTD 1:  1920x1080   60.000000 Hz  16:9     67.500 kHz    148.500000 MHz (598 mm x 336 mm)
                 Hfront   88 Hsync  44 Hback  148 Hpol P
                 Vfront    2 Vsync   5 Vback   38 Vpol P
    Display Product Name: 'HDMI'
    DTD 2:  1920x1080  200.000000 Hz  16:9    225.000 kHz    468.000000 MHz (598 mm x 336 mm)
                 Hfront   48 Hsync  32 Hback   80 Hpol P
                 Vfront    3 Vsync   5 Vback   37 Vpol P
    Display Range Limits:
      Monitor ranges (GTF): 60-165 Hz V, 60-240 kHz H, max dotclock 600 MHz
  Extension blocks: 1
Checksum: 0x63

----------------

Block 1, CTA-861 Extension Block:
  Revision: 3
  Underscans IT Video Formats by default
  Basic audio support
  Supports YCbCr 4:4:4
  Supports YCbCr 4:2:2
  Native DTDs: 5
  Video Data Block:
    VIC  16:  1920x1080   60.000000 Hz  16:9     67.500 kHz    148.500000 MHz (native)
    VIC   1:   640x480    59.940476 Hz   4:3     31.469 kHz     25.175000 MHz
    VIC   2:   720x480    59.940060 Hz   4:3     31.469 kHz     27.000000 MHz
    VIC  63:  1920x1080  120.000000 Hz  16:9    135.000 kHz    297.000000 MHz
  Audio Data Block:
    Linear PCM:
      Max channels: 2
      Supported sample rates (kHz): 48 44.1 32
      Supported sample sizes (bits): 24 20 16
  Speaker Allocation Data Block:
    FL/FR - Front Left/Right
  Vendor-Specific Data Block (HDMI), OUI 00-0C-03:
    Source physical address: 0.1.0.0
    DC_30bit
    DC_Y444
    Maximum TMDS clock: 300 MHz
  Vendor-Specific Data Block (HDMI Forum), OUI C4-5D-D8:
    Version: 1
    Maximum TMDS Character Rate: 600 MHz
    SCDC Present
  Video Capability Data Block:
    YCbCr quantization: Selectable (via AVI YQ)
    RGB quantization: Selectable (via AVI Q)
    PT scan behavior: Always Overscanned
    IT scan behavior: Always Overscanned
    CE scan behavior: Always Overscanned
  Colorimetry Data Block:
    BT2020YCC
    BT2020RGB
  HDR Static Metadata Data Block:
    Electro optical transfer functions:
      Traditional gamma - SDR luminance range
      SMPTE ST2084
    Supported static metadata descriptors:
      Static metadata type 1
    Desired content max luminance: 105 (486.099 cd/m^2)
    Desired content max frame-average luminance: 105 (486.099 cd/m^2)
    Desired content min luminance: 0 (0.000 cd/m^2)
  Detailed Timing Descriptors:
    DTD 3:  1920x1080  143.996996 Hz  16:9    160.557 kHz    325.930000 MHz (598 mm x 336 mm)
                 Hfront   38 Hsync  22 Hback   50 Hpol P
                 Vfront    3 Vsync   5 Vback   27 Vpol P
    DTD 4:  1920x1080  119.998991 Hz  16:9    137.279 kHz    285.540000 MHz (598 mm x 336 mm)
                 Hfront   48 Hsync  32 Hback   80 Hpol P
                 Vfront    2 Vsync   5 Vback   57 Vpol P
    DTD 5:  1920x1080   99.998303 Hz  16:9    113.298 kHz    235.660000 MHz (598 mm x 336 mm)
                 Hfront   48 Hsync  32 Hback   80 Hpol P
                 Vfront    2 Vsync   5 Vback   46 Vpol P
    DTD 6:  1920x1080  164.999787 Hz  16:9    183.480 kHz    371.730000 MHz (598 mm x 336 mm)
                 Hfront   48 Hsync  32 Hback   26 Hpol P
                 Vfront    3 Vsync   5 Vback   24 Vpol P
Checksum: 0xdf  Unused space in Extension Block: 8 bytes

----------------

Warnings:

Block 0, Base EDID:
  Vendor & Product Identification: The serial number is one of the known dummy values, it should probably be set to 0.
  Detailed Timing Descriptor #1: DTD is similar but not identical to VIC 16.
Block 1, CTA-861 Extension Block:
  Video Data Block: VIC 16 and the first DTD are not identical. Is this intended?
  Video Capability Data Block: IT scan behavior is expected to support underscanned.
  Video Capability Data Block: S_PT is equal to S_IT and S_CE, so should be set to 0 instead.
EDID:
  Base EDID: Some timings are out of range of the Monitor Ranges:
    Vertical Freq: 59.940 - 200.000 Hz (Monitor: 60.000 - 165.000 Hz)
    Horizontal Freq: 31.468 - 225.000 kHz (Monitor: 60.000 - 240.000 kHz)

Failures:

Block 0, Base EDID:
  Basic Display Parameters & Features: The chromaticities match sRGB, but sRGB is not signaled.
  Detailed Timing Descriptor #2: Invalid detailed timing descriptor ordering.
Block 1, CTA-861 Extension Block:
  Video Capability Data Block: IT video formats are always overscanned, but bit 7 of Byte 3 of the CTA-861 Extension header is set to underscanned.
EDID:
  Extension Block 2 started with EDID header, ignoring Extension Blocks >= 2.

EDID conformity: FAIL
