edid-decode (hex):

00 ff ff ff ff ff ff 00 36 8b ff 85 00 00 00 00
04 22 01 04 b5 51 23 78 3b 8b 15 af 4e 4b a7 23
0e 50 54 af cf 00 81 a8 81 80 a9 e8 b3 00 95 28
d1 c0 b3 28 d1 e8 36 7d 70 a0 d0 a0 2c 50 30 20
35 00 2a 63 31 00 00 1a 00 00 00 ff 00 30 30 30
30 30 30 30 30 30 30 30 30 30 00 00 00 fd 00 30
a5 de de 59 01 0a 20 20 20 20 20 20 00 00 00 fc
00 4e 51 33 34 38 38 0a 20 20 20 20 20 20 02 1d

02 03 33 f4 4a 01 03 04 90 13 12 5a 5c 5f 61 23
09 07 07 83 01 00 00 e6 06 07 01 60 59 02 e2 00
c0 e3 05 e3 01 6d 1a 00 00 02 01 30 a5 00 00 60
00 00 00 eb f9 70 a0 d0 a0 29 50 30 20 35 00 1d
4d 31 00 00 1e 6a 5e 00 a0 a0 a0 29 50 30 20 35
00 1d 4d 31 00 00 1a 6f c2 00 a0 a0 a0 55 50 30
20 35 00 1d 4d 31 00 00 1e ac d1 70 a0 d0 a0 33
50 30 20 35 00 1d 4d 31 00 00 1e 00 00 00 00 95

00 ff ff ff ff ff ff 00 36 8b ff 85 00 00 00 00
04 22 01 04 b5 51 23 78 3b 8b 15 af 4e 4b a7 23
0e 50 54 af cf 00 81 a8 81 80 a9 e8 b3 00 95 28
d1 c0 b3 28 d1 e8 36 7d 70 a0 d0 a0 2c 50 30 20
35 00 2a 63 31 00 00 1a 00 00 00 ff 00 30 30 30
30 30 30 30 30 30 30 30 30 30 00 00 00 fd 00 30
a5 de de 59 01 0a 20 20 20 20 20 20 00 00 00 fc
00 4e 51 33 34 38 38 0a 20 20 20 20 20 20 02 1d

00 ff ff ff ff ff ff 00 36 8b ff 85 00 00 00 00
04 22 01 04 b5 51 23 78 3b 8b 15 af 4e 4b a7 23
0e 50 54 af cf 00 81 a8 81 80 a9 e8 b3 00 95 28
d1 c0 b3 28 d1 e8 36 7d 70 a0 d0 a0 2c 50 30 20
35 00 2a 63 31 00 00 1a 00 00 00 ff 00 30 30 30
30 30 30 30 30 30 30 30 30 30 00 00 00 fd 00 30
a5 de de 59 01 0a 20 20 20 20 20 20 00 00 00 fc
00 4e 51 33 34 38 38 0a 20 20 20 20 20 20 02 1d

02 03 33 f4 4a 01 03 04 90 13 12 5a 5c 5f 61 23
09 07 07 83 01 00 00 e6 06 07 01 60 59 02 e2 00
c0 e3 05 e3 01 6d 1a 00 00 02 01 30 a5 00 00 60
00 00 00 eb f9 70 a0 d0 a0 29 50 30 20 35 00 1d
4d 31 00 00 1e 6a 5e 00 a0 a0 a0 29 50 30 20 35
00 1d 4d 31 00 00 1a 6f c2 00 a0 a0 a0 55 50 30
20 35 00 1d 4d 31 00 00 1e ac d1 70 a0 d0 a0 33
50 30 20 35 00 1d 4d 31 00 00 1e 00 00 00 00 95

00 ff ff ff ff ff ff 00 36 8b ff 85 00 00 00 00
04 22 01 04 b5 51 23 78 3b 8b 15 af 4e 4b a7 23
0e 50 54 af cf 00 81 a8 81 80 a9 e8 b3 00 95 28
d1 c0 b3 28 d1 e8 36 7d 70 a0 d0 a0 2c 50 30 20
35 00 2a 63 31 00 00 1a 00 00 00 ff 00 30 30 30
30 30 30 30 30 30 30 30 30 30 00 00 00 fd 00 30
a5 de de 59 01 0a 20 20 20 20 20 20 00 00 00 fc
00 4e 51 33 34 38 38 0a 20 20 20 20 20 20 02 1d

----------------

Block 0, Base EDID:
  EDID Structure Version & Revision: 1.4
  Vendor & Product Identification:
    Manufacturer: MTK
    Model: 34303
    Made in: week 4 of 2024
  Basic Display Parameters & Features:
    Digital display
    Bits per primary color channel: 10
    DisplayPort interface
    Maximum image size: 81 cm x 35 cm
    Gamma: 2.20
    DPMS levels: Off
    Supported color formats: RGB 4:4:4, YCrCb 4:4:4, YCrCb 4:2:2
    First detailed timing includes the native pixel format and preferred refresh rate
    Display supports continuous frequencies
  Color Characteristics:
    Red  : 0.6855, 0.3046
    Green: 0.2949, 0.6552
    Blue : 0.1367, 0.0556
    White: 0.3134, 0.3291
  Established Timings I & II:
    IBM     :   720x400    70.081663 Hz   9:5     31.467 kHz     28.320000 MHz
    DMT 0x04:   640x480    59.940476 Hz   4:3     31.469 kHz     25.175000 MHz
    DMT 0x05:   640x480    72.808802 Hz   4:3     37.861 kHz     31.500000 MHz
    DMT 0x06:   640x480    75.000000 Hz   4:3     37.500 kHz     31.500000 MHz
    DMT 0x08:   800x600    56.250000 Hz   4:3     35.156 kHz     36.000000 MHz
    DMT 0x09:   800x600    60.316541 Hz   4:3     37.879 kHz     40.000000 MHz
    DMT 0x0a:   800x600    72.187572 Hz   4:3     48.077 kHz     50.000000 MHz
    DMT 0x0b:   800x600    75.000000 Hz   4:3     46.875 kHz     49.500000 MHz
    DMT 0x10:  1024x768    60.003840 Hz   4:3     48.363 kHz     65.000000 MHz
    DMT 0x11:  1024x768    70.069359 Hz   4:3     56.476 kHz     75.000000 MHz
    DMT 0x12:  1024x768    75.028582 Hz   4:3     60.023 kHz     78.750000 MHz
    DMT 0x24:  1280x1024   75.024675 Hz   5:4     79.976 kHz    135.000000 MHz
  Standard Timings:
    GTF     :  1280x1024  100.000000 Hz   5:4    108.500 kHz    190.960000 MHz
    DMT 0x23:  1280x1024   60.019740 Hz   5:4     63.981 kHz    108.000000 MHz
    GTF     :  1600x900   100.000191 Hz  16:9     95.300 kHz    208.898000 MHz
    DMT 0x3a:  1680x1050   59.954250 Hz  16:10    65.290 kHz    146.250000 MHz
    GTF     :  1440x900    99.999787 Hz  16:10    95.300 kHz    187.550000 MHz
    DMT 0x52:  1920x1080   60.000000 Hz  16:9     67.500 kHz    148.500000 MHz
    GTF     :  1680x1050  100.000078 Hz  16:10   111.200 kHz    256.205000 MHz
    GTF     :  1920x1080  100.000000 Hz  16:9    114.400 kHz    302.016000 MHz
  Detailed Timing Descriptors:
    DTD 1:  3440x1440   59.999251 Hz  43:18    89.039 kHz    320.540000 MHz (810 mm x 355 mm)
                 Hfront   48 Hsync  32 Hback   80 Hpol P
                 Vfront    3 Vsync   5 Vback   36 Vpol N
    Display Product Serial Number: ...
    Display Range Limits:
      Monitor ranges (Range Limits Only): 48-165 Hz V, 222-222 kHz H, max dotclock 890 MHz
    Display Product Name: 'NQ3488'
  Extension blocks: 2
Checksum: 0x1d

----------------

Block 1, CTA-861 Extension Block:
  Revision: 3
  Underscans IT Video Formats by default
  Basic audio support
  Supports YCbCr 4:4:4
  Supports YCbCr 4:2:2
  Native DTDs: 4
  Video Data Block:
    VIC   1:   640x480    59.940476 Hz   4:3     31.469 kHz     25.175000 MHz
    VIC   3:   720x480    59.940060 Hz  16:9     31.469 kHz     27.000000 MHz
    VIC   4:  1280x720    60.000000 Hz  16:9     45.000 kHz     74.250000 MHz
    VIC  16:  1920x1080   60.000000 Hz  16:9     67.500 kHz    148.500000 MHz (native)
    VIC  19:  1280x720    50.000000 Hz  16:9     37.500 kHz     74.250000 MHz
    VIC  18:   720x576    50.000000 Hz  16:9     31.250 kHz     27.000000 MHz
    VIC  90:  2560x1080   60.000000 Hz  64:27    66.000 kHz    198.000000 MHz
    VIC  92:  2560x1080  120.000000 Hz  64:27   150.000 kHz    495.000000 MHz
    VIC  95:  3840x2160   30.000000 Hz  16:9     67.500 kHz    297.000000 MHz
    VIC  97:  3840x2160   60.000000 Hz  16:9    135.000 kHz    594.000000 MHz
  Audio Data Block:
    Linear PCM:
      Max channels: 2
      Supported sample rates (kHz): 48 44.1 32
      Supported sample sizes (bits): 24 20 16
  Speaker Allocation Data Block:
    FL/FR - Front Left/Right
  HDR Static Metadata Data Block:
    Electro optical transfer functions:
      Traditional gamma - SDR luminance range
      Traditional gamma - HDR luminance range
      SMPTE ST2084
    Supported static metadata descriptors:
      Static metadata type 1
    Desired content max luminance: 96 (400.000 cd/m^2)
    Desired content max frame-average luminance: 89 (343.724 cd/m^2)
    Desired content min luminance: 2 (0.000 cd/m^2)
  Video Capability Data Block:
    YCbCr quantization: Selectable (via AVI YQ)
    RGB quantization: Selectable (via AVI Q)
    PT scan behavior: No Data
    IT scan behavior: IT video formats not supported
    CE scan behavior: CE video formats not supported
  Colorimetry Data Block:
    xvYCC601
    xvYCC709
    BT2020cYCC
    BT2020YCC
    BT2020RGB
    Gamut Boundary Description Metadata Profile P0
  Vendor-Specific Data Block (AMD), OUI 00-00-1A:
    Version: 2
    Flags 1: 0x01
      FreeSync Supported
    Minimum Refresh Rate: 48 Hz
    Maximum Refresh Rate: 165 Hz
    Flags 5: 0x00
  Detailed Timing Descriptors:
    DTD 2:  3440x1440  119.999625 Hz  43:18   177.719 kHz    639.790000 MHz (797 mm x 333 mm)
                 Hfront   48 Hsync  32 Hback   80 Hpol P
                 Vfront    3 Vsync   5 Vback   33 Vpol P
    DTD 3:  2560x1440   60.000199 Hz  16:9     88.860 kHz    241.700000 MHz (797 mm x 333 mm)
                 Hfront   48 Hsync  32 Hback   80 Hpol P
                 Vfront    3 Vsync   5 Vback   33 Vpol N
    DTD 4:  2560x1440  119.997589 Hz  16:9    182.996 kHz    497.750000 MHz (797 mm x 333 mm)
                 Hfront   48 Hsync  32 Hback   80 Hpol P
                 Vfront    3 Vsync   5 Vback   77 Vpol P
    DTD 5:  3440x1440  100.000000 Hz  43:18   149.100 kHz    536.760000 MHz (797 mm x 333 mm)
                 Hfront   48 Hsync  32 Hback   80 Hpol P
                 Vfront    3 Vsync   5 Vback   43 Vpol P
Checksum: 0x95  Unused space in Extension Block: 4 bytes

----------------

Warnings:

Block 0, Base EDID:
  Detailed Timing Descriptor #1: Image size is 810x355 mm, but based on the picture AR it should be 810x339 mm.
  Display Product Serial Number: ...
Block 1, CTA-861 Extension Block:
  Video Data Block: VIC 1 and the first DTD are not identical. Is this intended?
  Video Capability Data Block: IT scan behavior is expected to support underscanned.
  Video Capability Data Block: 'CE video formats not supported' makes no sense.
  Colorimetry Data Block: Set the sRGB colorimetry bit to avoid interop issues.
  Detailed Timing Descriptor #3: Image size is 797x333 mm, but based on the picture AR it should be 592x333 mm.
  Detailed Timing Descriptor #4: Image size is 797x333 mm, but based on the picture AR it should be 592x333 mm.
EDID:
  Base EDID: Some timings are out of range of the Monitor Ranges:
    Vertical Freq: 30.000 - 120.000 Hz (Monitor: 48.000 - 165.000 Hz)
    Horizontal Freq: 31.250 - 182.996 kHz (Monitor: 222.000 - 222.000 kHz)

Failures:

Block 1, CTA-861 Extension Block:
  Detailed Timing Descriptor #2: Mismatch of image size 797x333 mm vs display size 810x350 mm.
  Detailed Timing Descriptor #3: Mismatch of image size 797x333 mm vs display size 810x350 mm.
  Detailed Timing Descriptor #4: Mismatch of image size 797x333 mm vs display size 810x350 mm.
  Detailed Timing Descriptor #5: Mismatch of image size 797x333 mm vs display size 810x350 mm.
EDID:
  Extension Block 2 started with EDID header, ignoring Extension Blocks >= 2.
  Base EDID: EDID specified 2 extension block(s), but found 1 extension block(s).
  CTA-861: Native progressive timings are a mix of several resolutions.

EDID conformity: FAIL
