edid-decode (hex):

00 ff ff ff ff ff ff 00 0f 5a 00 24 01 01 01 01
2a 1d 01 03 80 34 20 78 ea 2d 36 a7 54 38 ae 26
0d 4f 54 bf cf 00 81 c0 b3 00 95 00 81 80 a9 c0
81 00 71 40 81 4f 02 3a 80 18 71 38 2d 40 58 2c
45 00 13 2a 21 00 00 1a 66 21 56 aa 51 00 1e 30
46 8f 33 00 70 cf 10 00 00 1c 00 00 00 fd 00 30
4c 0f 96 13 01 0a 20 20 20 20 20 20 00 00 00 fc
00 53 4d 32 33 38 0a 20 20 20 20 20 20 20 01 73

02 03 31 f1 48 90 1f 05 14 04 13 03 12 23 09 07
07 83 01 00 00 67 03 0c 00 10 00 38 2d e6 06 07
01 60 48 00 e3 05 e3 01 68 00 00 00 01 01 2d 4b
ed 7f 48 80 18 71 38 2d 40 30 28 55 00 a0 5a 00
00 00 1e 8c 0a d0 8a 20 e0 2d 10 10 3e 96 00 0f
28 21 00 00 1e 01 1d 00 72 51 d0 1e 20 6e 28 55
00 0f 28 21 00 00 1e 8c 0a d0 8a 20 e0 2d 10 10
3e 96 00 0f 28 21 00 00 1e 00 00 00 00 00 00 25

00 ff ff ff ff ff ff 00 0f 5a 00 24 01 01 01 01
2a 1d 01 03 80 34 20 78 ea 2d 36 a7 54 38 ae 26
0d 4f 54 bf cf 00 81 c0 b3 00 95 00 81 80 a9 c0
81 00 71 40 81 4f 02 3a 80 18 71 38 2d 40 58 2c
45 00 13 2a 21 00 00 1a 66 21 56 aa 51 00 1e 30
46 8f 33 00 70 cf 10 00 00 1c 00 00 00 fd 00 30
4c 0f 96 13 01 0a 20 20 20 20 20 20 00 00 00 fc
00 53 4d 32 33 38 0a 20 20 20 20 20 20 20 01 73

02 03 31 f1 48 90 1f 05 14 04 13 03 12 23 09 07
07 83 01 00 00 67 03 0c 00 10 00 38 2d e6 06 07
01 60 48 00 e3 05 e3 01 68 00 00 00 01 01 2d 4b
ed 7f 48 80 18 71 38 2d 40 30 28 55 00 a0 5a 00
00 00 1e 8c 0a d0 8a 20 e0 2d 10 10 3e 96 00 0f
28 21 00 00 1e 01 1d 00 72 51 d0 1e 20 6e 28 55
00 0f 28 21 00 00 1e 8c 0a d0 8a 20 e0 2d 10 10
3e 96 00 0f 28 21 00 00 1e 00 00 00 00 00 00 25

----------------

Block 0, Base EDID:
  EDID Structure Version & Revision: 1.3
  Vendor & Product Identification:
    Manufacturer: CZZ
    Model: 9216
    Serial Number: ...
    Made in: week 42 of 2019
  Basic Display Parameters & Features:
    Digital display
    Maximum image size: 52 cm x 32 cm
    Gamma: 2.20
    DPMS levels: Standby Suspend Off
    RGB color display
    First detailed timing is the preferred timing
  Color Characteristics:
    Red  : 0.6523, 0.3300
    Green: 0.2216, 0.6806
    Blue : 0.1484, 0.0537
    White: 0.3095, 0.3300
  Established Timings I & II:
    IBM     :   720x400    70.081663 Hz   9:5     31.467 kHz     28.320000 MHz
    DMT 0x04:   640x480    59.940476 Hz   4:3     31.469 kHz     25.175000 MHz
    Apple   :   640x480    66.666667 Hz   4:3     35.000 kHz     30.240000 MHz
    DMT 0x05:   640x480    72.808802 Hz   4:3     37.861 kHz     31.500000 MHz
    DMT 0x06:   640x480    75.000000 Hz   4:3     37.500 kHz     31.500000 MHz
    DMT 0x08:   800x600    56.250000 Hz   4:3     35.156 kHz     36.000000 MHz
    DMT 0x09:   800x600    60.316541 Hz   4:3     37.879 kHz     40.000000 MHz
    DMT 0x0a:   800x600    72.187572 Hz   4:3     48.077 kHz     50.000000 MHz
    DMT 0x0b:   800x600    75.000000 Hz   4:3     46.875 kHz     49.500000 MHz
    DMT 0x10:  1024x768    60.003840 Hz   4:3     48.363 kHz     65.000000 MHz
    DMT 0x11:  1024x768    70.069359 Hz   4:3     56.476 kHz     75.000000 MHz
    DMT 0x12:  1024x768    75.028582 Hz   4:3     60.023 kHz     78.750000 MHz
    DMT 0x24:  1280x1024   75.024675 Hz   5:4     79.976 kHz    135.000000 MHz
  Standard Timings:
    DMT 0x55:  1280x720    60.000000 Hz  16:9     45.000 kHz     74.250000 MHz
    DMT 0x3a:  1680x1050   59.954250 Hz  16:10    65.290 kHz    146.250000 MHz
    DMT 0x2f:  1440x900    59.887445 Hz  16:10    55.935 kHz    106.500000 MHz
    DMT 0x23:  1280x1024   60.019740 Hz   5:4     63.981 kHz    108.000000 MHz
    DMT 0x53:  1600x900    60.000000 Hz  16:9     60.000 kHz    108.000000 MHz (RB)
    DMT 0x1c:  1280x800    59.810326 Hz  16:10    49.702 kHz     83.500000 MHz
    GTF     :  1152x864    60.000000 Hz   4:3     53.700 kHz     81.624000 MHz
    GTF     :  1280x960    74.999884 Hz   4:3     75.150 kHz    129.859000 MHz
  Detailed Timing Descriptors:
    DTD 1:  1920x1080   60.000000 Hz  16:9     67.500 kHz    148.500000 MHz (531 mm x 298 mm)
                 Hfront   88 Hsync  44 Hback  148 Hpol P
                 Vfront    4 Vsync   5 Vback   36 Vpol N
    DTD 2:  1366x768    59.789541 Hz 683:384   47.712 kHz     85.500000 MHz (368 mm x 207 mm)
                 Hfront   70 Hsync 143 Hback  213 Hpol N
                 Vfront    3 Vsync   3 Vback   24 Vpol P
    Display Range Limits:
      Monitor ranges (Range Limits Only): 48-76 Hz V, 15-150 kHz H, max dotclock 190 MHz
    Display Product Name: 'SM238'
  Extension blocks: 1
Checksum: 0x73

----------------

Block 1, CTA-861 Extension Block:
  Revision: 3
  Underscans IT Video Formats by default
  Basic audio support
  Supports YCbCr 4:4:4
  Supports YCbCr 4:2:2
  Native DTDs: 1
  Video Data Block:
    VIC  16:  1920x1080   60.000000 Hz  16:9     67.500 kHz    148.500000 MHz (native)
    VIC  31:  1920x1080   50.000000 Hz  16:9     56.250 kHz    148.500000 MHz
    VIC   5:  1920x1080i  60.000000 Hz  16:9     33.750 kHz     74.250000 MHz
    VIC  20:  1920x1080i  50.000000 Hz  16:9     28.125 kHz     74.250000 MHz
    VIC   4:  1280x720    60.000000 Hz  16:9     45.000 kHz     74.250000 MHz
    VIC  19:  1280x720    50.000000 Hz  16:9     37.500 kHz     74.250000 MHz
    VIC   3:   720x480    59.940060 Hz  16:9     31.469 kHz     27.000000 MHz
    VIC  18:   720x576    50.000000 Hz  16:9     31.250 kHz     27.000000 MHz
  Audio Data Block:
    Linear PCM:
      Max channels: 2
      Supported sample rates (kHz): 48 44.1 32
      Supported sample sizes (bits): 24 20 16
  Speaker Allocation Data Block:
    FL/FR - Front Left/Right
  Vendor-Specific Data Block (HDMI), OUI 00-0C-03:
    Source physical address: 1.0.0.0
    DC_36bit
    DC_30bit
    DC_Y444
    Maximum TMDS clock: 225 MHz
  HDR Static Metadata Data Block:
    Electro optical transfer functions:
      Traditional gamma - SDR luminance range
      Traditional gamma - HDR luminance range
      SMPTE ST2084
    Supported static metadata descriptors:
      Static metadata type 1
    Desired content max luminance: 96 (400.000 cd/m^2)
    Desired content max frame-average luminance: 72 (237.841 cd/m^2)
    Desired content min luminance: 0 (0.000 cd/m^2)
  Colorimetry Data Block:
    xvYCC601
    xvYCC709
    BT2020cYCC
    BT2020YCC
    BT2020RGB
    Gamut Boundary Description Metadata Profile P0
  Vendor-Specific Data Block, OUI 00-00-00:
    01 01 2d 4b ed                                  '..-K.'
  Detailed Timing Descriptors:
    DTD 3:  1920x1080   74.985859 Hz  16:9     84.359 kHz    185.590000 MHz (160 mm x 90 mm)
                 Hfront   48 Hsync  40 Hback  192 Hpol P
                 Vfront    5 Vsync   5 Vback   35 Vpol P
    DTD 4:   720x480    59.940060 Hz   3:2     31.469 kHz     27.000000 MHz (527 mm x 296 mm)
                 Hfront   16 Hsync  62 Hback   60 Hpol P
                 Vfront    9 Vsync   6 Vback   30 Vpol P
    DTD 5:  1280x720    60.000000 Hz  16:9     45.000 kHz     74.250000 MHz (527 mm x 296 mm)
                 Hfront  110 Hsync  40 Hback  220 Hpol P
                 Vfront    5 Vsync   5 Vback   20 Vpol P
    DTD 6:   720x480    59.940060 Hz   3:2     31.469 kHz     27.000000 MHz (527 mm x 296 mm)
                 Hfront   16 Hsync  62 Hback   60 Hpol P
                 Vfront    9 Vsync   6 Vback   30 Vpol P
Checksum: 0x25  Unused space in Extension Block: 6 bytes

----------------

Warnings:

Block 0, Base EDID:
  Vendor & Product Identification: The serial number is one of the known dummy values, it should probably be set to 0.
  Detailed Timing Descriptor #1: DTD is similar but not identical to VIC 16.
  Detailed Timing Descriptor #2: DTD is similar but not identical to DMT 0x51.
Block 1, CTA-861 Extension Block:
  Video Data Block: VIC 16 and the first DTD are not identical. Is this intended?
  Colorimetry Data Block: Set the sRGB colorimetry bit to avoid interop issues.
  Vendor-Specific Data Block, OUI 00-00-00: All zeroes OUI.
  Detailed Timing Descriptor #3: Dubious image size (160x90 mm is smaller than 100x100 mm).
  Detailed Timing Descriptor #4: DTD is similar but not identical to VIC 2.
  Detailed Timing Descriptor #4: Image size is 527x296 mm, but based on the picture AR it should be 444x296 mm.
  Detailed Timing Descriptor #6: DTD is similar but not identical to VIC 2.
  Detailed Timing Descriptor #6: Image size is 527x296 mm, but based on the picture AR it should be 444x296 mm.

Failures:

Block 0, Base EDID:
  Detailed Timing Descriptor #1: Mismatch of image size 531x298 mm vs display size 520x320 mm.
  Detailed Timing Descriptor #2: Mismatch of image size 368x207 mm vs display size 520x320 mm.
  Display Range Limits: 'Range Limits Only' is not allowed for EDID < 1.4.
Block 1, CTA-861 Extension Block:
  Detailed Timing Descriptor #3: Mismatch of image size 160x90 mm vs display size 520x320 mm.
  Missing VCDB, needed for Set Selectable RGB Quantization to avoid interop issues.
EDID:
  Extension Block 2 started with EDID header, ignoring Extension Blocks >= 2.
  Base EDID: The DTD max image size is 531x298mm, which is larger than the display size 520.0x320.0mm.

EDID conformity: FAIL
