edid-decode (hex):

00 ff ff ff ff ff ff 00 4d 10 17 14 00 00 00 00
0c 18 01 04 95 1a 0e 78 0e 3e 77 8b 52 56 92 27
1d 4d 4f 00 00 00 01 01 01 01 01 01 01 01 01 01
01 01 01 01 01 01 bf 1a 56 50 50 00 16 30 08 20
88 00 00 90 10 00 00 18 bf 1a 56 50 50 00 da 30
08 20 c8 00 00 90 10 00 00 18 00 00 00 fe 00 48
39 50 48 4a 80 4c 51 31 31 36 4b 31 00 00 00 00
00 00 01 03 3c 00 12 00 00 09 01 0a 20 20 00 72

----------------

Block 0, Base EDID:
  EDID Structure Version & Revision: 1.4
  Vendor & Product Identification:
    Manufacturer: SHP
    Model: 5143
    Made in: week 12 of 2014
  Basic Display Parameters & Features:
    Digital display
    Bits per primary color channel: 6
    DisplayPort interface
    Maximum image size: 26 cm x 14 cm
    Gamma: 2.20
    Supported color formats: RGB 4:4:4, YCrCb 4:4:4
    Default (sRGB) color space is primary color space
    First detailed timing includes the native pixel format and preferred refresh rate
  Color Characteristics:
    Red  : 0.5429, 0.3232
    Green: 0.3388, 0.5722
    Blue : 0.1533, 0.1162
    White: 0.3017, 0.3115
  Established Timings I & II: none
  Standard Timings: none
  Detailed Timing Descriptors:
    DTD 1:  1366x768    59.938372 Hz 683:384   47.351 kHz     68.470000 MHz (256 mm x 144 mm)
                 Hfront    8 Hsync  32 Hback   40 Hpol N
                 Vfront    8 Vsync   8 Vback    6 Vpol N
    DTD 2:  1366x768    48.023645 Hz 683:384   47.351 kHz     68.470000 MHz (256 mm x 144 mm)
                 Hfront    8 Hsync  32 Hback   40 Hpol N
                 Vfront   12 Vsync   8 Vback  198 Vpol N
    Alphanumeric Data String: 'H9PHJ.LQ116K1'
    Manufacturer-Specified Display Descriptor (0x00): 00 00 00 00 01 03 3c 00 12 00 00 09 01 0a 20 20 '......<.......  '
Checksum: 0x72

----------------

Warnings:

Block 0, Base EDID:
  Alphanumeric Data String: Non-ASCII character 0x80 at position 5, can cause problems.
  Missing Display Product Name.

Failures:

Block 0, Base EDID:
  Basic Display Parameters & Features: sRGB is signaled, but the chromaticities do not match.

EDID conformity: FAIL
