edid-decode (hex):

00 ff ff ff ff ff ff 00 38 69 17 40 01 01 01 01
28 0d 01 03 08 22 1b 78 ea 2e e5 a4 57 4a 9c 25
11 50 54 bf cf 00 81 80 01 01 01 01 01 01 01 01
01 01 01 01 01 01 30 2a 00 98 51 00 2a 40 30 70
13 00 51 0e 11 00 00 1e 00 00 00 fd 00 38 4b 1f
51 0e 00 0a 20 20 20 20 20 20 00 00 00 fc 00 4e
45 43 20 4c 56 31 37 6d 0a 20 20 20 00 00 00 ff
00 31 30 30 30 30 35 37 38 33 30 35 39 0a 00 c7

00 ff ff ff ff ff ff 00 38 69 17 40 01 01 01 01
28 0d 01 03 08 22 1b 78 ea 2e e5 a4 57 4a 9c 25
11 50 54 bf cf 00 81 80 01 01 01 01 01 01 01 01
01 01 01 01 01 01 30 2a 00 98 51 00 2a 40 30 70
13 00 51 0e 11 00 00 1e 00 00 00 fd 00 38 4b 1f
51 0e 00 0a 20 20 20 20 20 20 00 00 00 fc 00 4e
45 43 20 4c 56 31 37 6d 0a 20 20 20 00 00 00 ff
00 31 30 30 30 30 35 37 38 33 30 35 39 0a 00 c7

----------------

Block 0, Base EDID:
  EDID Structure Version & Revision: 1.3
  Vendor & Product Identification:
    Manufacturer: NCI
    Model: 16407
    Serial Number: ...
    Made in: week 40 of 2003
  Basic Display Parameters & Features:
    Analog display
    Signal Level Standard: 0.700 : 0.300 : 1.000 V p-p
    Blank level equals black level
    Sync: Separate
    Maximum image size: 34 cm x 27 cm
    Gamma: 2.20
    DPMS levels: Standby Suspend Off
    RGB color display
    First detailed timing is the preferred timing
  Color Characteristics:
    Red  : 0.6406, 0.3417
    Green: 0.2919, 0.6113
    Blue : 0.1474, 0.0683
    White: 0.3134, 0.3291
  Established Timings I & II:
    IBM     :   720x400    70.081663 Hz   9:5     31.467 kHz     28.320000 MHz
    DMT 0x04:   640x480    59.940476 Hz   4:3     31.469 kHz     25.175000 MHz
    Apple   :   640x480    66.666667 Hz   4:3     35.000 kHz     30.240000 MHz
    DMT 0x05:   640x480    72.808802 Hz   4:3     37.861 kHz     31.500000 MHz
    DMT 0x06:   640x480    75.000000 Hz   4:3     37.500 kHz     31.500000 MHz
    DMT 0x08:   800x600    56.250000 Hz   4:3     35.156 kHz     36.000000 MHz
    DMT 0x09:   800x600    60.316541 Hz   4:3     37.879 kHz     40.000000 MHz
    DMT 0x0a:   800x600    72.187572 Hz   4:3     48.077 kHz     50.000000 MHz
    DMT 0x0b:   800x600    75.000000 Hz   4:3     46.875 kHz     49.500000 MHz
    DMT 0x10:  1024x768    60.003840 Hz   4:3     48.363 kHz     65.000000 MHz
    DMT 0x11:  1024x768    70.069359 Hz   4:3     56.476 kHz     75.000000 MHz
    DMT 0x12:  1024x768    75.028582 Hz   4:3     60.023 kHz     78.750000 MHz
    DMT 0x24:  1280x1024   75.024675 Hz   5:4     79.976 kHz    135.000000 MHz
  Standard Timings:
    DMT 0x23:  1280x1024   60.019740 Hz   5:4     63.981 kHz    108.000000 MHz
  Detailed Timing Descriptors:
    DTD 1:  1280x1024   60.019740 Hz   5:4     63.981 kHz    108.000000 MHz (337 mm x 270 mm)
                 Hfront   48 Hsync 112 Hback  248 Hpol P
                 Vfront    1 Vsync   3 Vback   38 Vpol P
    Display Range Limits:
      Monitor ranges (GTF): 56-75 Hz V, 31-81 kHz H, max dotclock 140 MHz
    Display Product Name: 'NEC LV17m'
    Display Product Serial Number: ...
Checksum: 0xc7

----------------

Warnings:

Block 0, Base EDID:
  Vendor & Product Identification: The serial number is one of the known dummy values, it should probably be set to 0.

Failures:

EDID:
  Extension Block 1 started with EDID header, ignoring Extension Blocks >= 1.

EDID conformity: FAIL
