edid-decode (hex):

00 ff ff ff ff ff ff 00 5c 85 cc 15 01 00 00 00
2c 11 01 03 80 39 20 78 2a 98 6c a3 55 44 98 26
0e 47 49 a1 08 00 8b c0 81 00 81 c0 01 01 01 01
01 01 01 01 01 01 9d 1c 56 82 50 00 30 30 28 20
25 00 3f 43 21 00 00 1a 00 00 00 fd 00 38 47 1f
32 09 00 0a 20 20 20 20 20 20 00 00 00 ff 00 35
35 38 30 47 37 34 34 30 30 30 30 31 00 00 00 fc
00 53 4b 2d 32 36 48 37 33 30 53 0a 20 20 01 c9

02 03 17 71 44 05 84 02 03 23 09 07 07 83 01 00
00 65 03 0c 00 10 00 01 1d 00 72 51 d0 1e 20 6e
28 55 00 10 09 00 00 00 1e 8c 0a d0 8a 20 e0 2d
10 10 3e 96 00 10 09 00 00 00 18 8c 0a d0 8a 20
e0 2d 10 10 3e 96 00 04 03 00 00 00 18 01 1d 80
18 71 1c 16 20 58 2c 25 00 10 09 00 00 00 9e 00
00 00 00 00 00 00 00 00 00 00 00 00 00 00 00 00
00 00 00 00 00 00 00 00 00 00 00 00 00 00 00 03

00 ff ff ff ff ff ff 00 5c 85 cc 15 01 00 00 00
2c 11 01 03 80 39 20 78 2a 98 6c a3 55 44 98 26
0e 47 49 a1 08 00 8b c0 81 00 81 c0 01 01 01 01
01 01 01 01 01 01 9d 1c 56 82 50 00 30 30 28 20
25 00 3f 43 21 00 00 1a 00 00 00 fd 00 38 47 1f
32 09 00 0a 20 20 20 20 20 20 00 00 00 ff 00 35
35 38 30 47 37 34 34 30 30 30 30 31 00 00 00 fc
00 53 4b 2d 32 36 48 37 33 30 53 0a 20 20 01 c9

02 03 17 71 44 05 84 02 03 23 09 07 07 83 01 00
00 65 03 0c 00 10 00 01 1d 00 72 51 d0 1e 20 6e
28 55 00 10 09 00 00 00 1e 8c 0a d0 8a 20 e0 2d
10 10 3e 96 00 10 09 00 00 00 18 8c 0a d0 8a 20
e0 2d 10 10 3e 96 00 04 03 00 00 00 18 01 1d 80
18 71 1c 16 20 58 2c 25 00 10 09 00 00 00 9e 00
00 00 00 00 00 00 00 00 00 00 00 00 00 00 00 00
00 00 00 00 00 00 00 00 00 00 00 00 00 00 00 03

----------------

Block 0, Base EDID:
  EDID Structure Version & Revision: 1.3
  Vendor & Product Identification:
    Manufacturer: WDE
    Model: 5580
    Serial Number: ...
    Made in: week 44 of 2007
  Basic Display Parameters & Features:
    Digital display
    Maximum image size: 57 cm x 32 cm
    Gamma: 2.20
    DPMS levels: Off
    RGB color display
    First detailed timing is the preferred timing
  Color Characteristics:
    Red  : 0.6386, 0.3330
    Green: 0.2675, 0.5937
    Blue : 0.1494, 0.0566
    White: 0.2802, 0.2851
  Established Timings I & II:
    IBM     :   720x400    70.081663 Hz   9:5     31.467 kHz     28.320000 MHz
    DMT 0x04:   640x480    59.940476 Hz   4:3     31.469 kHz     25.175000 MHz
    DMT 0x09:   800x600    60.316541 Hz   4:3     37.879 kHz     40.000000 MHz
    DMT 0x10:  1024x768    60.003840 Hz   4:3     48.363 kHz     65.000000 MHz
  Standard Timings:
    GTF     :  1360x765    60.000341 Hz  16:9     47.520 kHz     84.396000 MHz
    DMT 0x1c:  1280x800    59.810326 Hz  16:10    49.702 kHz     83.500000 MHz
    DMT 0x55:  1280x720    60.000000 Hz  16:9     45.000 kHz     74.250000 MHz
  Detailed Timing Descriptors:
    DTD 1:  1366x768    60.004784 Hz 683:384   48.964 kHz     73.250000 MHz (575 mm x 323 mm)
                 Hfront   40 Hsync  32 Hback   58 Hpol P
                 Vfront    2 Vsync   5 Vback   41 Vpol N
    Display Range Limits:
      Monitor ranges (GTF): 56-71 Hz V, 31-50 kHz H, max dotclock 90 MHz
    Display Product Serial Number: ...
    Display Product Name: 'SK-26H730S'
  Extension blocks: 1
Checksum: 0xc9

----------------

Block 1, CTA-861 Extension Block:
  Revision: 3
  Basic audio support
  Supports YCbCr 4:4:4
  Supports YCbCr 4:2:2
  Native detailed modes: 1
  Video Data Block:
    VIC   5:  1920x1080i  60.000000 Hz  16:9     33.750 kHz     74.250000 MHz
    VIC   4:  1280x720    60.000000 Hz  16:9     45.000 kHz     74.250000 MHz (native)
    VIC   2:   720x480    59.940060 Hz   4:3     31.469 kHz     27.000000 MHz
    VIC   3:   720x480    59.940060 Hz  16:9     31.469 kHz     27.000000 MHz
  Audio Data Block:
    Linear PCM:
      Max channels: 2
      Supported sample rates (kHz): 48 44.1 32
      Supported sample sizes (bits): 24 20 16
  Speaker Allocation Data Block:
    FL/FR - Front Left/Right
  Vendor-Specific Data Block (HDMI), OUI 00-0C-03:
    Source physical address: 1.0.0.0
  Detailed Timing Descriptors:
    DTD 2:  1280x720    60.000000 Hz  16:9     45.000 kHz     74.250000 MHz (16 mm x 9 mm)
                 Hfront  110 Hsync  40 Hback  220 Hpol P
                 Vfront    5 Vsync   5 Vback   20 Vpol P
    DTD 3:   720x480    59.940060 Hz   3:2     31.469 kHz     27.000000 MHz (16 mm x 9 mm)
                 Hfront   16 Hsync  62 Hback   60 Hpol N
                 Vfront    9 Vsync   6 Vback   30 Vpol N
    DTD 4:   720x480    59.940060 Hz   3:2     31.469 kHz     27.000000 MHz (4 mm x 3 mm)
                 Hfront   16 Hsync  62 Hback   60 Hpol N
                 Vfront    9 Vsync   6 Vback   30 Vpol N
    DTD 5:  1920x1080i  60.000000 Hz  16:9     33.750 kHz     74.250000 MHz (16 mm x 9 mm)
                 Hfront   88 Hsync  44 Hback  148 Hpol P
                 Vfront    2 Vsync   5 Vback   15 Vpol P Vfront +0.5 Odd Field
                 Vfront    2 Vsync   5 Vback   15 Vpol P Vback  +0.5 Even Field
Checksum: 0x03  Unused space in Extension Block: 32 bytes

----------------

Block 2, Unknown EDID Extension Block 0x00:
  00 ff ff ff ff ff ff 00 5c 85 cc 15 01 00 00 00 '........\.......'
  2c 11 01 03 80 39 20 78 2a 98 6c a3 55 44 98 26 ',....9 x*.l.UD.&'
  0e 47 49 a1 08 00 8b c0 81 00 81 c0 01 01 01 01 '.GI.............'
  01 01 01 01 01 01 9d 1c 56 82 50 00 30 30 28 20 '........V.P.00( '
  25 00 3f 43 21 00 00 1a 00 00 00 fd 00 38 47 1f '%.?C!........8G.'
  32 09 00 0a 20 20 20 20 20 20 00 00 00 ff 00 35 '2...      .....5'
  35 38 30 47 37 34 34 30 30 30 30 31 00 00 00 fc '580G74400001....'
  00 53 4b 2d 32 36 48 37 33 30 53 0a 20 20 01 c9 '.SK-26H730S.  ..'
Checksum: 0xc9

----------------

Block 3, CTA-861 Extension Block:
  Revision: 3
  Basic audio support
  Supports YCbCr 4:4:4
  Supports YCbCr 4:2:2
  Native detailed modes: 1
  Video Data Block:
    VIC   5:  1920x1080i  60.000000 Hz  16:9     33.750 kHz     74.250000 MHz
    VIC   4:  1280x720    60.000000 Hz  16:9     45.000 kHz     74.250000 MHz (native)
    VIC   2:   720x480    59.940060 Hz   4:3     31.469 kHz     27.000000 MHz
    VIC   3:   720x480    59.940060 Hz  16:9     31.469 kHz     27.000000 MHz
  Audio Data Block:
    Linear PCM:
      Max channels: 2
      Supported sample rates (kHz): 48 44.1 32
      Supported sample sizes (bits): 24 20 16
  Speaker Allocation Data Block:
    FL/FR - Front Left/Right
  Vendor-Specific Data Block (HDMI), OUI 00-0C-03:
    Source physical address: 1.0.0.0
  Detailed Timing Descriptors:
    DTD 6:  1280x720    60.000000 Hz  16:9     45.000 kHz     74.250000 MHz (16 mm x 9 mm)
                 Hfront  110 Hsync  40 Hback  220 Hpol P
                 Vfront    5 Vsync   5 Vback   20 Vpol P
    DTD 7:   720x480    59.940060 Hz   3:2     31.469 kHz     27.000000 MHz (16 mm x 9 mm)
                 Hfront   16 Hsync  62 Hback   60 Hpol N
                 Vfront    9 Vsync   6 Vback   30 Vpol N
    DTD 8:   720x480    59.940060 Hz   3:2     31.469 kHz     27.000000 MHz (4 mm x 3 mm)
                 Hfront   16 Hsync  62 Hback   60 Hpol N
                 Vfront    9 Vsync   6 Vback   30 Vpol N
    DTD 9:  1920x1080i  60.000000 Hz  16:9     33.750 kHz     74.250000 MHz (16 mm x 9 mm)
                 Hfront   88 Hsync  44 Hback  148 Hpol P
                 Vfront    2 Vsync   5 Vback   15 Vpol P Vfront +0.5 Odd Field
                 Vfront    2 Vsync   5 Vback   15 Vpol P Vback  +0.5 Even Field
Checksum: 0x03  Unused space in Extension Block: 32 bytes

----------------

Warnings:

Block 0, Base EDID:
  Vendor & Product Identification: The serial number is one of the known dummy values, it should probably be set to 0.
  Standard Timings: Standard Timing 1360x765 has a dubious odd vertical resolution.
Block 1, CTA-861 Extension Block:
  IT Video Formats are overscanned by default, but normally this should be underscanned.
  Video Data Block: VIC 5 and the first DTD are not identical. Is this intended?
  Detailed Timing Descriptor #2: Dubious image size (16x9 mm is smaller than 100x100 mm).
  Detailed Timing Descriptor #3: Dubious image size (16x9 mm is smaller than 100x100 mm).
  Detailed Timing Descriptor #4: Dubious image size (4x3 mm is smaller than 100x100 mm).
  Detailed Timing Descriptor #5: Dubious image size (16x9 mm is smaller than 100x100 mm).
  Display Product Serial Number is set, so the Serial Number in the Base EDID should be 0.
  Add a Colorimetry Data Block with the sRGB colorimetry bit set to avoid interop issues.
Block 3, CTA-861 Extension Block:
  IT Video Formats are overscanned by default, but normally this should be underscanned.
  Detailed Timing Descriptor #6: Dubious image size (16x9 mm is smaller than 100x100 mm).
  Detailed Timing Descriptor #7: Dubious image size (16x9 mm is smaller than 100x100 mm).
  Detailed Timing Descriptor #8: Dubious image size (4x3 mm is smaller than 100x100 mm).
  Detailed Timing Descriptor #9: Dubious image size (16x9 mm is smaller than 100x100 mm).

Failures:

Block 1, CTA-861 Extension Block:
  Detailed Timing Descriptor #2: Mismatch of image size 16x9 mm vs display size 570x320 mm.
  Detailed Timing Descriptor #3: Mismatch of image size 16x9 mm vs display size 570x320 mm.
  Detailed Timing Descriptor #4: Mismatch of image size 4x3 mm vs display size 570x320 mm.
  Detailed Timing Descriptor #5: Mismatch of image size 16x9 mm vs display size 570x320 mm.
  Missing VCDB, needed for Set Selectable RGB Quantization to avoid interop issues.
Block 2, Base EDID:
  Unknown Extension Block.
Block 3, CTA-861 Extension Block:
  Video Data Block: Duplicate VIC 5.
  Video Data Block: Duplicate VIC 4.
  Video Data Block: Duplicate VIC 2.
  Video Data Block: Duplicate VIC 3.
  Speaker Allocation Data Block: Only one instance of this Data Block is allowed.
  Detailed Timing Descriptor #6: Mismatch of image size 16x9 mm vs display size 570x320 mm.
  Detailed Timing Descriptor #7: Mismatch of image size 16x9 mm vs display size 570x320 mm.
  Detailed Timing Descriptor #8: Mismatch of image size 4x3 mm vs display size 570x320 mm.
  Detailed Timing Descriptor #9: Mismatch of image size 16x9 mm vs display size 570x320 mm.
EDID:
  Base EDID: EDID specified 1 extension block(s), but found 3 extension block(s).
  Base EDID: EDID 1.3 requires a Block Map Extension in Block 1 if there are more than 2 blocks in the EDID.
  CTA-861: Native progressive timings are a mix of several resolutions.

EDID conformity: FAIL
