edid-decode (hex):

00 ff ff ff ff ff ff 00 4d d9 00 48 01 01 01 01
0b 10 01 03 80 26 1e 78 ea c3 55 a5 57 4b 99 24
11 50 54 a1 08 00 81 80 81 40 01 01 01 01 01 01
01 01 01 01 01 01 30 2a 00 98 51 00 2a 40 30 70
13 00 78 2d 11 00 00 1e 00 00 00 fd 00 39 3f 1c
41 0b 00 0a 20 20 20 20 20 20 00 00 00 fc 00 53
44 4d 2d 58 39 35 46 2f 4b 0a 20 20 00 00 00 ff
00 36 30 30 31 33 36 37 0a 20 20 20 20 20 00 3f

00 ff ff ff ff ff ff 00 4d d9 00 48 01 01 01 01
0b 10 01 03 80 26 1e 78 ea c3 55 a5 57 4b 99 24
11 50 54 a1 08 00 81 80 81 40 01 01 01 01 01 01
01 01 01 01 01 01 30 2a 00 98 51 00 2a 40 30 70
13 00 78 2d 11 00 00 1e 00 00 00 fd 00 39 3f 1c
41 0b 00 0a 20 20 20 20 20 20 00 00 00 fc 00 53
44 4d 2d 58 39 35 46 2f 4b 0a 20 20 00 00 00 ff
00 36 30 30 31 33 36 37 0a 20 20 20 20 20 00 3f

----------------

Block 0, Base EDID:
  EDID Structure Version & Revision: 1.3
  Vendor & Product Identification:
    Manufacturer: SNY
    Model: 18432
    Serial Number: ...
    Made in: week 11 of 2006
  Basic Display Parameters & Features:
    Digital display
    Maximum image size: 38 cm x 30 cm
    Gamma: 2.20
    DPMS levels: Standby Suspend Off
    RGB color display
    First detailed timing is the preferred timing
  Color Characteristics:
    Red  : 0.6474, 0.3398
    Green: 0.2929, 0.6005
    Blue : 0.1416, 0.0673
    White: 0.3134, 0.3291
  Established Timings I & II:
    IBM     :   720x400    70.081663 Hz   9:5     31.467 kHz     28.320000 MHz
    DMT 0x04:   640x480    59.940476 Hz   4:3     31.469 kHz     25.175000 MHz
    DMT 0x09:   800x600    60.316541 Hz   4:3     37.879 kHz     40.000000 MHz
    DMT 0x10:  1024x768    60.003840 Hz   4:3     48.363 kHz     65.000000 MHz
  Standard Timings:
    DMT 0x23:  1280x1024   60.019740 Hz   5:4     63.981 kHz    108.000000 MHz
    DMT 0x20:  1280x960    60.000000 Hz   4:3     60.000 kHz    108.000000 MHz
  Detailed Timing Descriptors:
    DTD 1:  1280x1024   60.019740 Hz   5:4     63.981 kHz    108.000000 MHz (376 mm x 301 mm)
                 Hfront   48 Hsync 112 Hback  248 Hpol P
                 Vfront    1 Vsync   3 Vback   38 Vpol P
    Display Range Limits:
      Monitor ranges (GTF): 57-63 Hz V, 28-65 kHz H, max dotclock 110 MHz
    Display Product Name: 'SDM-X95F/K'
    Display Product Serial Number: ...
Checksum: 0x3f

----------------

Warnings:

Block 0, Base EDID:
  Vendor & Product Identification: The serial number is one of the known dummy values, it should probably be set to 0.
EDID:
  Base EDID: Some timings are out of range of the Monitor Ranges:
    Vertical Freq: 59.940 - 70.082 Hz (Monitor: 57.000 - 63.000 Hz)

Failures:

EDID:
  Extension Block 1 started with EDID header, ignoring Extension Blocks >= 1.

EDID conformity: FAIL
