edid-decode (hex):

00 ff ff ff ff ff ff 00 4d 10 18 15 00 00 00 00
2d 1f 01 04 a5 25 17 78 0f de 50 a3 54 4c 99 26
0f 50 54 00 00 00 01 01 01 01 01 01 01 01 01 01
01 01 01 01 01 01 28 3c 80 a0 70 b0 23 40 30 20
36 00 6e e5 10 00 00 18 20 30 80 a0 70 b0 23 40
30 20 36 00 6e e5 10 00 00 18 00 00 00 fe 00 56
52 58 37 33 81 4c 51 31 37 30 4e 31 00 00 00 00
00 02 41 03 32 00 12 00 00 0a 01 0a 20 20 00 58

00 ff ff ff ff ff ff 00 4d 10 18 15 00 00 00 00
2d 1f 01 04 a5 25 17 78 0f de 50 a3 54 4c 99 26
0f 50 54 00 00 00 01 01 01 01 01 01 01 01 01 01
01 01 01 01 01 01 28 3c 80 a0 70 b0 23 40 30 20
36 00 6e e5 10 00 00 18 20 30 80 a0 70 b0 23 40
30 20 36 00 6e e5 10 00 00 18 00 00 00 fe 00 56
52 58 37 33 81 4c 51 31 37 30 4e 31 00 00 00 00
00 02 41 03 32 00 12 00 00 0a 01 0a 20 20 00 58

----------------

Block 0, Base EDID:
  EDID Structure Version & Revision: 1.4
  Vendor & Product Identification:
    Manufacturer: SHP
    Model: 5400
    Made in: week 45 of 2021
  Basic Display Parameters & Features:
    Digital display
    Bits per primary color channel: 8
    DisplayPort interface
    Maximum image size: 37 cm x 23 cm
    Gamma: 2.20
    Supported color formats: RGB 4:4:4, YCrCb 4:4:4
    Default (sRGB) color space is primary color space
    First detailed timing includes the native pixel format and preferred refresh rate
    Display supports continuous frequencies
  Color Characteristics:
    Red  : 0.6396, 0.3291
    Green: 0.2998, 0.5996
    Blue : 0.1494, 0.0595
    White: 0.3125, 0.3281
  Established Timings I & II: none
  Standard Timings: none
  Detailed Timing Descriptors:
    DTD 1:  1920x1200   59.950171 Hz  16:10    74.038 kHz    154.000000 MHz (366 mm x 229 mm)
                 Hfront   48 Hsync  32 Hback   80 Hpol N
                 Vfront    3 Vsync   6 Vback   26 Vpol N
    DTD 2:  1920x1200   47.960137 Hz  16:10    59.231 kHz    123.200000 MHz (366 mm x 229 mm)
                 Hfront   48 Hsync  32 Hback   80 Hpol N
                 Vfront    3 Vsync   6 Vback   26 Vpol N
    Alphanumeric Data String: 'VRX73.LQ170N1'
    Manufacturer-Specified Display Descriptor (0x00): 00 00 00 02 41 03 32 00 12 00 00 0a 01 0a 20 20 '....A.2.......  '
Checksum: 0x58

----------------

Warnings:

Block 0, Base EDID:
  Detailed Timing Descriptor #1: DTD is similar but not identical to DMT 0x44.
  Alphanumeric Data String: Non-ASCII character 0x81 at position 5, can cause problems.
  Missing Display Product Name.

Failures:

Block 0, Base EDID:
  Basic Display Parameters & Features: sRGB is signaled, but the chromaticities do not match.
  Missing Display Range Limits Descriptor.
EDID:
  Extension Block 1 started with EDID header, ignoring Extension Blocks >= 1.

EDID conformity: FAIL
