edid-decode (hex):

00 ff ff ff ff ff ff 00 4c 83 b1 41 00 00 00 00
00 21 01 04 b5 22 13 78 02 0c f1 ae 52 3c b9 23
0c 50 54 00 00 00 01 01 01 01 01 01 01 01 01 01
01 01 01 01 01 01 38 e5 40 50 b0 54 20 60 08 20
08 04 58 c2 10 00 00 1b 38 e5 40 50 b0 54 94 66
08 20 08 04 58 c2 10 00 00 1b 00 00 00 0f 00 ff
09 78 ff 09 3c 28 80 00 00 00 00 00 00 00 00 fe
00 41 54 4e 41 35 36 41 43 30 33 2d 30 20 01 ab

02 03 0f 00 e3 05 80 00 e6 06 05 01 74 60 07 00
00 00 00 00 00 00 00 00 00 00 00 00 00 00 00 00
00 00 00 00 00 00 00 00 00 00 00 00 00 00 00 00
00 00 00 00 00 00 00 00 00 00 00 00 00 00 00 00
00 00 00 00 00 00 00 00 00 00 00 00 00 00 00 00
00 00 00 00 00 00 00 00 00 00 00 00 00 00 00 00
00 00 00 00 00 00 00 00 00 00 00 00 00 00 00 00
00 00 00 00 00 00 00 00 00 00 00 00 00 00 00 b7

00 ff ff ff ff ff ff 00 4c 83 b1 41 00 00 00 00
00 21 01 04 b5 22 13 78 02 0c f1 ae 52 3c b9 23
0c 50 54 00 00 00 01 01 01 01 01 01 01 01 01 01
01 01 01 01 01 01 38 e5 40 50 b0 54 20 60 08 20
08 04 58 c2 10 00 00 1b 38 e5 40 50 b0 54 94 66
08 20 08 04 58 c2 10 00 00 1b 00 00 00 0f 00 ff
09 78 ff 09 3c 28 80 00 00 00 00 00 00 00 00 fe
00 41 54 4e 41 35 36 41 43 30 33 2d 30 20 01 ab

02 03 0f 00 e3 05 80 00 e6 06 05 01 74 60 07 00
00 00 00 00 00 00 00 00 00 00 00 00 00 00 00 00
00 00 00 00 00 00 00 00 00 00 00 00 00 00 00 00
00 00 00 00 00 00 00 00 00 00 00 00 00 00 00 00
00 00 00 00 00 00 00 00 00 00 00 00 00 00 00 00
00 00 00 00 00 00 00 00 00 00 00 00 00 00 00 00
00 00 00 00 00 00 00 00 00 00 00 00 00 00 00 00
00 00 00 00 00 00 00 00 00 00 00 00 00 00 00 b7

----------------

Block 0, Base EDID:
  EDID Structure Version & Revision: 1.4
  Vendor & Product Identification:
    Manufacturer: SDC
    Model: 16817
    Made in: 2023
  Basic Display Parameters & Features:
    Digital display
    Bits per primary color channel: 10
    DisplayPort interface
    Maximum image size: 34 cm x 19 cm
    Gamma: 2.20
    Supported color formats: RGB 4:4:4
    First detailed timing includes the native pixel format and preferred refresh rate
  Color Characteristics:
    Red  : 0.6796, 0.3203
    Green: 0.2373, 0.7226
    Blue : 0.1396, 0.0498
    White: 0.3125, 0.3291
  Established Timings I & II: none
  Standard Timings: none
  Detailed Timing Descriptors:
    DTD 1:  2880x1620  120.001963 Hz  16:9    198.243 kHz    586.800000 MHz (344 mm x 194 mm)
                 Hfront    8 Hsync  32 Hback   40 Hpol P
                 Vfront   16 Vsync   8 Vback    8 Vpol N
    DTD 2:  2880x1620   60.000982 Hz  16:9    198.243 kHz    586.800000 MHz (344 mm x 194 mm)
                 Hfront    8 Hsync  32 Hback   40 Hpol P
                 Vfront   16 Vsync   8 Vback 1660 Vpol N
    Manufacturer-Specified Display Descriptor (0x0f): 00 0f 00 ff 09 78 ff 09 3c 28 80 00 00 00 00 00 '.....x..<(......'
    Alphanumeric Data String: 'ATNA56AC03-0 '
  Extension blocks: 1
Checksum: 0xab

----------------

Block 1, CTA-861 Extension Block:
  Revision: 3
  Native DTDs: 0
  Colorimetry Data Block:
    BT2020RGB
  HDR Static Metadata Data Block:
    Electro optical transfer functions:
      Traditional gamma - SDR luminance range
      SMPTE ST2084
    Supported static metadata descriptors:
      Static metadata type 1
    Desired content max luminance: 116 (616.884 cd/m^2)
    Desired content max frame-average luminance: 96 (400.000 cd/m^2)
    Desired content min luminance: 7 (0.005 cd/m^2)
Checksum: 0xb7  Unused space in Extension Block: 112 bytes

----------------

Warnings:

Block 0, Base EDID:
  Missing Display Product Name.
Block 1, CTA-861 Extension Block:
  IT Video Formats are overscanned by default, but normally this should be underscanned.
  Colorimetry Data Block: Set the sRGB colorimetry bit to avoid interop issues.

Failures:

Block 0, Base EDID:
  Alphanumeric Data String: No newline, but one or more trailing spaces.
Block 1, CTA-861 Extension Block:
  Required 640x480p60 timings are missing in the established timings and the SVD list (VIC 1).
  Missing VCDB, needed for Set Selectable RGB Quantization to avoid interop issues.
EDID:
  Extension Block 2 started with EDID header, ignoring Extension Blocks >= 2.

EDID conformity: FAIL
