edid-decode (hex):

00 ff ff ff ff ff ff 00 30 e4 91 02 00 00 00 00
00 13 01 03 80 1f 11 78 0a 50 85 96 59 56 8f 28
1f 50 54 00 00 00 01 01 01 01 01 01 01 01 01 01
01 01 01 01 01 01 12 1b 56 68 50 00 11 30 20 18
34 00 36 ae 10 00 00 19 12 1b 56 68 50 00 11 30
20 18 34 00 36 ae 10 00 00 19 00 00 00 fe 00 47
56 4b 31 58 80 31 34 30 57 48 31 0a 00 00 00 00
00 00 41 03 94 01 00 00 00 01 01 0a 20 20 00 05

----------------

Block 0, Base EDID:
  EDID Structure Version & Revision: 1.3
  Vendor & Product Identification:
    Manufacturer: LGD
    Model: 657
    Made in: 2009
  Basic Display Parameters & Features:
    Digital display
    Maximum image size: 31 cm x 17 cm
    Gamma: 2.20
    RGB color display
    First detailed timing is the preferred timing
  Color Characteristics:
    Red  : 0.5869, 0.3486
    Green: 0.3359, 0.5585
    Blue : 0.1582, 0.1210
    White: 0.3134, 0.3291
  Established Timings I & II: none
  Standard Timings: none
  Detailed Timing Descriptors:
    DTD 1:  1366x768    60.054595 Hz 683:384   47.143 kHz     69.300000 MHz (310 mm x 174 mm)
                 Hfront   32 Hsync  24 Hback   48 Hpol N
                 Vfront    3 Vsync   4 Vback   10 Vpol N
    DTD 2:  1366x768    60.054595 Hz 683:384   47.143 kHz     69.300000 MHz (310 mm x 174 mm)
                 Hfront   32 Hsync  24 Hback   48 Hpol N
                 Vfront    3 Vsync   4 Vback   10 Vpol N
    Alphanumeric Data String: 'GVK1X.140WH1'
    Manufacturer-Specified Display Descriptor (0x00): 00 00 00 00 41 03 94 01 00 00 00 01 01 0a 20 20 '....A.........  '
Checksum: 0x05

----------------

Warnings:

Block 0, Base EDID:
  Alphanumeric Data String: Non-ASCII character 0x80 at position 5, can cause problems.

Failures:

Block 0, Base EDID:
  Missing Display Product Name.
  Missing Display Range Limits Descriptor.

EDID conformity: FAIL
