edid-decode (hex):

00 ff ff ff ff ff ff 00 22 70 20 00 01 01 01 01
0f 14 01 03 68 45 27 78 2e 3e ad a0 52 4f 9f 27
0c 47 4a 21 08 00 81 80 01 01 01 01 01 01 01 01
01 01 01 01 01 01 66 21 56 aa 51 00 1e 30 46 8f
35 00 ba 88 21 00 00 1e 00 00 00 ff 00 30 30 30
30 30 30 30 30 30 30 30 30 30 00 00 00 fc 00 48
53 47 31 31 33 31 0a 20 20 20 20 20 00 00 00 fd
00 3b 3d 1f 46 0f 00 0a 20 20 20 20 20 20 00 c7

00 ff ff ff ff ff ff 00 22 70 20 00 01 01 01 01
0f 14 01 03 68 45 27 78 2e 3e ad a0 52 4f 9f 27
0c 47 4a 21 08 00 81 80 01 01 01 01 01 01 01 01
01 01 01 01 01 01 66 21 56 aa 51 00 1e 30 46 8f
35 00 ba 88 21 00 00 1e 00 00 00 ff 00 30 30 30
30 30 30 30 30 30 30 30 30 30 00 00 00 fc 00 48
53 47 31 31 33 31 0a 20 20 20 20 20 00 00 00 fd
00 3b 3d 1f 46 0f 00 0a 20 20 20 20 20 20 00 c7

----------------

Block 0, Base EDID:
  EDID Structure Version & Revision: 1.3
  Vendor & Product Identification:
    Manufacturer: HSP
    Model: 32
    Serial Number: ...
    Made in: week 15 of 2010
  Basic Display Parameters & Features:
    Analog display
    Signal Level Standard: 0.700 : 0.000 : 0.700 V p-p
    Blank level equals black level
    Sync: Separate
    Maximum image size: 69 cm x 39 cm
    Gamma: 2.20
    DPMS levels: Off
    RGB color display
    Default (sRGB) color space is primary color space
    First detailed timing is the preferred timing
  Color Characteristics:
    Red  : 0.6250, 0.3232
    Green: 0.3115, 0.6230
    Blue : 0.1542, 0.0488
    White: 0.2802, 0.2900
  Established Timings I & II:
    DMT 0x04:   640x480    59.940476 Hz   4:3     31.469 kHz     25.175000 MHz
    DMT 0x09:   800x600    60.316541 Hz   4:3     37.879 kHz     40.000000 MHz
    DMT 0x10:  1024x768    60.003840 Hz   4:3     48.363 kHz     65.000000 MHz
  Standard Timings:
    DMT 0x23:  1280x1024   60.019740 Hz   5:4     63.981 kHz    108.000000 MHz
  Detailed Timing Descriptors:
    DTD 1:  1366x768    59.789541 Hz 683:384   47.712 kHz     85.500000 MHz (698 mm x 392 mm)
                 Hfront   70 Hsync 143 Hback  213 Hpol P
                 Vfront    3 Vsync   5 Vback   22 Vpol P
    Display Product Serial Number: ...
    Display Product Name: 'HSG1131'
    Display Range Limits:
      Monitor ranges (GTF): 59-61 Hz V, 31-70 kHz H, max dotclock 150 MHz
Checksum: 0xc7

----------------

Block 1, Unknown EDID Extension Block 0x00:
  00 ff ff ff ff ff ff 00 22 70 20 00 01 01 01 01 '........"p .....'
  0f 14 01 03 68 45 27 78 2e 3e ad a0 52 4f 9f 27 '....hE'x.>..RO.''
  0c 47 4a 21 08 00 81 80 01 01 01 01 01 01 01 01 '.GJ!............'
  01 01 01 01 01 01 66 21 56 aa 51 00 1e 30 46 8f '......f!V.Q..0F.'
  35 00 ba 88 21 00 00 1e 00 00 00 ff 00 30 30 30 '5...!........000'
  30 30 30 30 30 30 30 30 30 30 00 00 00 fc 00 48 '0000000000.....H'
  53 47 31 31 33 31 0a 20 20 20 20 20 00 00 00 fd 'SG1131.     ....'
  00 3b 3d 1f 46 0f 00 0a 20 20 20 20 20 20 00 c7 '.;=.F...      ..'
Checksum: 0xc7

----------------

Warnings:

Block 0, Base EDID:
  Vendor & Product Identification: The serial number is one of the known dummy values, it should probably be set to 0.
  Detailed Timing Descriptor #1: DTD is similar but not identical to DMT 0x51.
  Display Product Serial Number: ...

Failures:

Block 0, Base EDID:
  Basic Display Parameters & Features: sRGB is signaled, but the chromaticities do not match.
Block 1, Base EDID:
  Unknown Extension Block.
EDID:
  Base EDID: EDID specified 0 extension block(s), but found 1 extension block(s).

EDID conformity: FAIL
