edid-decode (hex):

00 ff ff ff ff ff ff 00 21 65 ab 09 01 00 00 00
2a 20 01 03 80 35 1d 78 2a 58 75 b0 4e 46 a7 25
10 50 54 23 08 00 d1 c0 b3 00 95 00 81 80 81 40
81 00 a9 c0 81 c0 02 3a 80 18 71 38 2d 40 58 2c
45 00 12 22 21 00 00 1e 00 00 00 10 00 00 00 00
00 00 00 00 00 00 00 00 00 00 00 00 00 fd 00 30
78 1e 96 1e 00 0a 20 20 20 20 20 20 00 00 00 fc
00 4a 42 45 45 20 54 32 34 0a 20 20 20 20 01 99

02 03 33 f1 4a 1f 11 01 10 13 03 12 02 3f 40 23
09 07 07 83 01 00 00 67 03 0c 00 10 00 38 3c 68
1a 00 00 01 01 30 78 ed e3 05 c0 00 e6 06 05 01
60 59 09 04 74 80 18 71 38 2d 40 58 2c 35 00 12
22 21 00 00 1e 2a 44 80 a0 70 38 27 40 30 20 35
00 12 22 21 00 00 18 66 21 56 aa 51 00 1e 30 46
8f 35 00 12 22 21 00 00 18 a8 57 80 78 70 38 14
40 30 20 35 00 0f 28 21 00 00 7f 00 00 00 00 a9

00 ff ff ff ff ff ff 00 21 65 ab 09 01 00 00 00
2a 20 01 03 80 35 1d 78 2a 58 75 b0 4e 46 a7 25
10 50 54 23 08 00 d1 c0 b3 00 95 00 81 80 81 40
81 00 a9 c0 81 c0 02 3a 80 18 71 38 2d 40 58 2c
45 00 12 22 21 00 00 1e 00 00 00 10 00 00 00 00
00 00 00 00 00 00 00 00 00 00 00 00 00 fd 00 30
78 1e 96 1e 00 0a 20 20 20 20 20 20 00 00 00 fc
00 4a 42 45 45 20 54 32 34 0a 20 20 20 20 01 99

02 03 33 f1 4a 1f 11 01 10 13 03 12 02 3f 40 23
09 07 07 83 01 00 00 67 03 0c 00 10 00 38 3c 68
1a 00 00 01 01 30 78 ed e3 05 c0 00 e6 06 05 01
60 59 09 04 74 80 18 71 38 2d 40 58 2c 35 00 12
22 21 00 00 1e 2a 44 80 a0 70 38 27 40 30 20 35
00 12 22 21 00 00 18 66 21 56 aa 51 00 1e 30 46
8f 35 00 12 22 21 00 00 18 a8 57 80 78 70 38 14
40 30 20 35 00 0f 28 21 00 00 7f 00 00 00 00 a9

----------------

Block 0, Base EDID:
  EDID Structure Version & Revision: 1.3
  Vendor & Product Identification:
    Manufacturer: HKE
    Model: 2475
    Serial Number: ...
    Made in: week 42 of 2022
  Basic Display Parameters & Features:
    Digital display
    Maximum image size: 53 cm x 29 cm
    Gamma: 2.20
    DPMS levels: Off
    RGB color display
    First detailed timing is the preferred timing
  Color Characteristics:
    Red  : 0.6884, 0.3056
    Green: 0.2753, 0.6523
    Blue : 0.1455, 0.0654
    White: 0.3134, 0.3291
  Established Timings I & II:
    DMT 0x04:   640x480    59.940476 Hz   4:3     31.469 kHz     25.175000 MHz
    DMT 0x08:   800x600    56.250000 Hz   4:3     35.156 kHz     36.000000 MHz
    DMT 0x09:   800x600    60.316541 Hz   4:3     37.879 kHz     40.000000 MHz
    DMT 0x10:  1024x768    60.003840 Hz   4:3     48.363 kHz     65.000000 MHz
  Standard Timings:
    DMT 0x52:  1920x1080   60.000000 Hz  16:9     67.500 kHz    148.500000 MHz
    DMT 0x3a:  1680x1050   59.954250 Hz  16:10    65.290 kHz    146.250000 MHz
    DMT 0x2f:  1440x900    59.887445 Hz  16:10    55.935 kHz    106.500000 MHz
    DMT 0x23:  1280x1024   60.019740 Hz   5:4     63.981 kHz    108.000000 MHz
    DMT 0x20:  1280x960    60.000000 Hz   4:3     60.000 kHz    108.000000 MHz
    DMT 0x1c:  1280x800    59.810326 Hz  16:10    49.702 kHz     83.500000 MHz
    DMT 0x53:  1600x900    60.000000 Hz  16:9     60.000 kHz    108.000000 MHz (RB)
    DMT 0x55:  1280x720    60.000000 Hz  16:9     45.000 kHz     74.250000 MHz
  Detailed Timing Descriptors:
    DTD 1:  1920x1080   60.000000 Hz  16:9     67.500 kHz    148.500000 MHz (530 mm x 290 mm)
                 Hfront   88 Hsync  44 Hback  148 Hpol P
                 Vfront    4 Vsync   5 Vback   36 Vpol P
    Dummy Descriptor:
    Display Range Limits:
      Monitor ranges (GTF): 48-120 Hz V, 30-150 kHz H, max dotclock 300 MHz
    Display Product Name: 'JBEE T24'
  Extension blocks: 1
Checksum: 0x99

----------------

Block 1, CTA-861 Extension Block:
  Revision: 3
  Underscans IT Video Formats by default
  Basic audio support
  Supports YCbCr 4:4:4
  Supports YCbCr 4:2:2
  Native DTDs: 1
  Video Data Block:
    VIC  31:  1920x1080   50.000000 Hz  16:9     56.250 kHz    148.500000 MHz
    VIC  17:   720x576    50.000000 Hz   4:3     31.250 kHz     27.000000 MHz
    VIC   1:   640x480    59.940476 Hz   4:3     31.469 kHz     25.175000 MHz
    VIC  16:  1920x1080   60.000000 Hz  16:9     67.500 kHz    148.500000 MHz
    VIC  19:  1280x720    50.000000 Hz  16:9     37.500 kHz     74.250000 MHz
    VIC   3:   720x480    59.940060 Hz  16:9     31.469 kHz     27.000000 MHz
    VIC  18:   720x576    50.000000 Hz  16:9     31.250 kHz     27.000000 MHz
    VIC   2:   720x480    59.940060 Hz   4:3     31.469 kHz     27.000000 MHz
    VIC  63:  1920x1080  120.000000 Hz  16:9    135.000 kHz    297.000000 MHz
    VIC  64:  1920x1080  100.000000 Hz  16:9    112.500 kHz    297.000000 MHz
  Audio Data Block:
    Linear PCM:
      Max channels: 2
      Supported sample rates (kHz): 48 44.1 32
      Supported sample sizes (bits): 24 20 16
  Speaker Allocation Data Block:
    FL/FR - Front Left/Right
  Vendor-Specific Data Block (HDMI), OUI 00-0C-03:
    Source physical address: 1.0.0.0
    DC_36bit
    DC_30bit
    DC_Y444
    Maximum TMDS clock: 300 MHz
  Vendor-Specific Data Block (AMD), OUI 00-00-1A:
    Version: 1
    Flags 1: 0x01
      FreeSync Supported
    Minimum Refresh Rate: 48 Hz
    Maximum Refresh Rate: 120 Hz
    MCCS VCP Code: 0xed
  Colorimetry Data Block:
    BT2020YCC
    BT2020RGB
  HDR Static Metadata Data Block:
    Electro optical transfer functions:
      Traditional gamma - SDR luminance range
      SMPTE ST2084
    Supported static metadata descriptors:
      Static metadata type 1
    Desired content max luminance: 96 (400.000 cd/m^2)
    Desired content max frame-average luminance: 89 (343.724 cd/m^2)
    Desired content min luminance: 9 (0.005 cd/m^2)
  Detailed Timing Descriptors:
    DTD 2:  1920x1080  120.000000 Hz  16:9    135.000 kHz    297.000000 MHz (530 mm x 290 mm)
                 Hfront   88 Hsync  44 Hback  148 Hpol P
                 Vfront    3 Vsync   5 Vback   37 Vpol P
    DTD 3:  1920x1080   74.972503 Hz  16:9     83.894 kHz    174.500000 MHz (530 mm x 290 mm)
                 Hfront   48 Hsync  32 Hback   80 Hpol N
                 Vfront    3 Vsync   5 Vback   31 Vpol N
    DTD 4:  1366x768    59.789541 Hz 683:384   47.712 kHz     85.500000 MHz (530 mm x 290 mm)
                 Hfront   70 Hsync 143 Hback  213 Hpol N
                 Vfront    3 Vsync   5 Vback   22 Vpol N
    DTD 5:  1920x1080  100.000000 Hz  16:9    110.000 kHz    224.400000 MHz (side by side interleaved, 527 mm x 296 mm)
                 Hfront   48 Hsync  32 Hback   40 Hpol P
                 Vfront    3 Vsync   5 Vback   12 Vpol P
Checksum: 0xa9  Unused space in Extension Block: 4 bytes

----------------

Warnings:

Block 0, Base EDID:
  Vendor & Product Identification: The serial number is one of the known dummy values, it should probably be set to 0.
Block 1, CTA-861 Extension Block:
  Video Data Block: VIC 31 and the first DTD are not identical. Is this intended?
  Colorimetry Data Block: Set the sRGB colorimetry bit to avoid interop issues.
  Detailed Timing Descriptor #2: DTD is similar but not identical to VIC 63.
  Detailed Timing Descriptor #4: DTD is similar but not identical to DMT 0x51.

Failures:

Block 1, CTA-861 Extension Block:
  Missing VCDB, needed for Set Selectable RGB Quantization to avoid interop issues.
EDID:
  Extension Block 2 started with EDID header, ignoring Extension Blocks >= 2.

EDID conformity: FAIL
