edid-decode (hex):

00 ff ff ff ff ff ff 00 1e e4 61 11 06 02 33 69
19 22 01 03 80 24 14 78 2a ee 95 a3 54 4c 99 26
0f 50 54 a1 cf 00 71 40 81 80 81 40 81 c0 95 00
d1 c0 a9 c0 b3 00 02 3a 80 18 71 38 2d 40 58 2c
45 00 63 c8 10 00 00 1e 00 00 00 fd 00 3a 90 1f
aa 24 00 0a 20 20 20 20 20 20 00 00 00 fc 00 41
52 5a 4f 50 41 0a 20 20 20 20 20 20 00 00 00 ff
00 65 cb 46 96 58 c0 42 53 30 30 30 31 0a 01 16

02 03 38 f3 47 90 01 02 03 04 45 45 23 09 1f 07
83 01 00 00 67 03 0c 00 10 00 38 48 67 d8 5d c4
01 48 00 01 68 1a 00 00 01 01 3a 90 e6 e3 05 c0
00 e6 06 05 01 69 69 4f fd 81 80 a0 70 38 1f 40
30 20 35 00 63 c8 10 00 00 1e 04 74 80 18 71 38
2d 40 58 2c 45 00 63 c8 10 00 00 1a ae 60 80 18
71 38 2d 40 58 2c 45 00 63 c8 10 00 00 1a 00 00
00 00 00 00 00 00 00 00 00 00 00 00 00 00 00 4f

00 ff ff ff ff ff ff 00 1e e4 61 11 06 02 33 69
19 22 01 03 80 24 14 78 2a ee 95 a3 54 4c 99 26
0f 50 54 a1 cf 00 71 40 81 80 81 40 81 c0 95 00
d1 c0 a9 c0 b3 00 02 3a 80 18 71 38 2d 40 58 2c
45 00 63 c8 10 00 00 1e 00 00 00 fd 00 3a 90 1f
aa 24 00 0a 20 20 20 20 20 20 00 00 00 fc 00 41
52 5a 4f 50 41 0a 20 20 20 20 20 20 00 00 00 ff
00 65 cb 46 96 58 c0 42 53 30 30 30 31 0a 01 16

02 03 38 f3 47 90 01 02 03 04 45 45 23 09 1f 07
83 01 00 00 67 03 0c 00 10 00 38 48 67 d8 5d c4
01 48 00 01 68 1a 00 00 01 01 3a 90 e6 e3 05 c0
00 e6 06 05 01 69 69 4f fd 81 80 a0 70 38 1f 40
30 20 35 00 63 c8 10 00 00 1e 04 74 80 18 71 38
2d 40 58 2c 45 00 63 c8 10 00 00 1a ae 60 80 18
71 38 2d 40 58 2c 45 00 63 c8 10 00 00 1a 00 00
00 00 00 00 00 00 00 00 00 00 00 00 00 00 00 4f

----------------

Block 0, Base EDID:
  EDID Structure Version & Revision: 1.3
  Vendor & Product Identification:
    Manufacturer: GWD
    Model: 4449
    Serial Number: ...
    Made in: week 25 of 2024
  Basic Display Parameters & Features:
    Digital display
    Maximum image size: 36 cm x 20 cm
    Gamma: 2.20
    DPMS levels: Off
    RGB color display
    First detailed timing is the preferred timing
  Color Characteristics:
    Red  : 0.6396, 0.3300
    Green: 0.2998, 0.5996
    Blue : 0.1503, 0.0595
    White: 0.3134, 0.3291
  Established Timings I & II:
    IBM     :   720x400    70.081663 Hz   9:5     31.467 kHz     28.320000 MHz
    DMT 0x04:   640x480    59.940476 Hz   4:3     31.469 kHz     25.175000 MHz
    DMT 0x09:   800x600    60.316541 Hz   4:3     37.879 kHz     40.000000 MHz
    DMT 0x0a:   800x600    72.187572 Hz   4:3     48.077 kHz     50.000000 MHz
    DMT 0x0b:   800x600    75.000000 Hz   4:3     46.875 kHz     49.500000 MHz
    DMT 0x10:  1024x768    60.003840 Hz   4:3     48.363 kHz     65.000000 MHz
    DMT 0x11:  1024x768    70.069359 Hz   4:3     56.476 kHz     75.000000 MHz
    DMT 0x12:  1024x768    75.028582 Hz   4:3     60.023 kHz     78.750000 MHz
    DMT 0x24:  1280x1024   75.024675 Hz   5:4     79.976 kHz    135.000000 MHz
  Standard Timings:
    GTF     :  1152x864    60.000000 Hz   4:3     53.700 kHz     81.624000 MHz
    DMT 0x23:  1280x1024   60.019740 Hz   5:4     63.981 kHz    108.000000 MHz
    DMT 0x20:  1280x960    60.000000 Hz   4:3     60.000 kHz    108.000000 MHz
    DMT 0x55:  1280x720    60.000000 Hz  16:9     45.000 kHz     74.250000 MHz
    DMT 0x2f:  1440x900    59.887445 Hz  16:10    55.935 kHz    106.500000 MHz
    DMT 0x52:  1920x1080   60.000000 Hz  16:9     67.500 kHz    148.500000 MHz
    DMT 0x53:  1600x900    60.000000 Hz  16:9     60.000 kHz    108.000000 MHz (RB)
    DMT 0x3a:  1680x1050   59.954250 Hz  16:10    65.290 kHz    146.250000 MHz
  Detailed Timing Descriptors:
    DTD 1:  1920x1080   60.000000 Hz  16:9     67.500 kHz    148.500000 MHz (355 mm x 200 mm)
                 Hfront   88 Hsync  44 Hback  148 Hpol P
                 Vfront    4 Vsync   5 Vback   36 Vpol P
    Display Range Limits:
      Monitor ranges (GTF): 58-144 Hz V, 31-170 kHz H, max dotclock 360 MHz
    Display Product Name: 'ARZOPA'
    Display Product Serial Number: ...
  Extension blocks: 1
Checksum: 0x16

----------------

Block 1, CTA-861 Extension Block:
  Revision: 3
  Underscans IT Video Formats by default
  Basic audio support
  Supports YCbCr 4:4:4
  Supports YCbCr 4:2:2
  Native DTDs: 3
  Video Data Block:
    VIC  16:  1920x1080   60.000000 Hz  16:9     67.500 kHz    148.500000 MHz (native)
    VIC   1:   640x480    59.940476 Hz   4:3     31.469 kHz     25.175000 MHz
    VIC   2:   720x480    59.940060 Hz   4:3     31.469 kHz     27.000000 MHz
    VIC   3:   720x480    59.940060 Hz  16:9     31.469 kHz     27.000000 MHz
    VIC   4:  1280x720    60.000000 Hz  16:9     45.000 kHz     74.250000 MHz
    VIC  69:  1280x720    60.000000 Hz  64:27    45.000 kHz     74.250000 MHz
    VIC  69:  1280x720    60.000000 Hz  64:27    45.000 kHz     74.250000 MHz
  Audio Data Block:
    Linear PCM:
      Max channels: 2
      Supported sample rates (kHz): 96 88.2 48 44.1 32
      Supported sample sizes (bits): 24 20 16
  Speaker Allocation Data Block:
    FL/FR - Front Left/Right
  Vendor-Specific Data Block (HDMI), OUI 00-0C-03:
    Source physical address: 1.0.0.0
    DC_36bit
    DC_30bit
    DC_Y444
    Maximum TMDS clock: 360 MHz
  Vendor-Specific Data Block (HDMI Forum), OUI C4-5D-D8:
    Version: 1
    Maximum TMDS Character Rate: 360 MHz
    Supports 10-bits/component Deep Color 4:2:0 Pixel Encoding
  Vendor-Specific Data Block (AMD), OUI 00-00-1A:
    Version: 1
    Flags 1: 0x01
      FreeSync Supported
    Minimum Refresh Rate: 58 Hz
    Maximum Refresh Rate: 144 Hz
    MCCS VCP Code: 0xe6
  Colorimetry Data Block:
    BT2020YCC
    BT2020RGB
  HDR Static Metadata Data Block:
    Electro optical transfer functions:
      Traditional gamma - SDR luminance range
      SMPTE ST2084
    Supported static metadata descriptors:
      Static metadata type 1
    Desired content max luminance: 105 (486.099 cd/m^2)
    Desired content max frame-average luminance: 105 (486.099 cd/m^2)
    Desired content min luminance: 79 (0.467 cd/m^2)
  Detailed Timing Descriptors:
    DTD 2:  1920x1080  144.001419 Hz  16:9    159.986 kHz    332.770000 MHz (355 mm x 200 mm)
                 Hfront   48 Hsync  32 Hback   80 Hpol P
                 Vfront    3 Vsync   5 Vback   23 Vpol P
    DTD 3:  1920x1080  120.000000 Hz  16:9    135.000 kHz    297.000000 MHz (355 mm x 200 mm)
                 Hfront   88 Hsync  44 Hback  148 Hpol P
                 Vfront    4 Vsync   5 Vback   36 Vpol N
    DTD 4:  1920x1080  100.000000 Hz  16:9    112.500 kHz    247.500000 MHz (355 mm x 200 mm)
                 Hfront   88 Hsync  44 Hback  148 Hpol P
                 Vfront    4 Vsync   5 Vback   36 Vpol N
Checksum: 0x4f  Unused space in Extension Block: 17 bytes

----------------

Warnings:

Block 0, Base EDID:
  Display Product Serial Number: ...
  Display Product Serial Number: ...
  Display Product Serial Number: ...
Block 1, CTA-861 Extension Block:
  Colorimetry Data Block: Set the sRGB colorimetry bit to avoid interop issues.
  Detailed Timing Descriptor #3: DTD is similar but not identical to VIC 63.
  Display Product Serial Number is set, so the Serial Number in the Base EDID should be 0.

Failures:

Block 1, CTA-861 Extension Block:
  Video Data Block: Duplicate VIC 69.
  Vendor-Specific Data Block (HDMI), OUI 00-0C-03: HDMI VSDB Max TMDS rate is > 340.
  Missing VCDB, needed for Set Selectable RGB Quantization to avoid interop issues.
EDID:
  Extension Block 2 started with EDID header, ignoring Extension Blocks >= 2.

EDID conformity: FAIL
