edid-decode (hex):

00 ff ff ff ff ff ff 00 1e e4 61 11 08 02 61 68
26 21 01 04 b5 24 14 78 2b ee 95 a3 54 4c 99 26
0f 50 54 21 cf 00 71 40 81 80 81 40 81 c0 95 00
d1 c0 a9 c0 b3 00 02 3a 80 18 71 38 2d 40 58 2c
45 00 63 c8 10 00 00 1e e4 84 80 b4 70 38 2d 40
58 2c 45 00 63 c8 10 00 00 1e 00 00 00 fc 00 41
52 5a 4f 50 41 0a 20 20 20 20 20 20 00 00 00 fd
00 3a 90 b4 b4 24 01 0a 20 20 20 20 20 20 01 34

02 03 23 f3 48 90 01 02 03 04 45 04 45 23 09 07
07 83 01 00 00 e3 05 c0 00 e6 06 05 01 5d 5d 30
e2 00 c0 be 6e 80 b4 70 38 2d 40 58 20 45 00 63
c8 10 00 00 1e 49 5c 80 b4 70 38 2d 40 58 20 45
00 63 c8 10 00 00 1e 00 00 00 00 00 00 00 00 00
00 00 00 00 00 00 00 00 00 00 00 00 00 00 00 00
00 00 00 00 00 00 00 00 00 00 00 00 00 00 00 00
00 00 00 00 00 00 00 00 00 00 00 00 00 00 00 02

00 ff ff ff ff ff ff 00 1e e4 61 11 08 02 61 68
26 21 01 04 b5 24 14 78 2b ee 95 a3 54 4c 99 26
0f 50 54 21 cf 00 71 40 81 80 81 40 81 c0 95 00
d1 c0 a9 c0 b3 00 02 3a 80 18 71 38 2d 40 58 2c
45 00 63 c8 10 00 00 1e e4 84 80 b4 70 38 2d 40
58 2c 45 00 63 c8 10 00 00 1e 00 00 00 fc 00 41
52 5a 4f 50 41 0a 20 20 20 20 20 20 00 00 00 fd
00 3a 90 b4 b4 24 01 0a 20 20 20 20 20 20 01 34

02 03 23 f3 48 90 01 02 03 04 45 04 45 23 09 07
07 83 01 00 00 e3 05 c0 00 e6 06 05 01 5d 5d 30
e2 00 c0 be 6e 80 b4 70 38 2d 40 58 20 45 00 63
c8 10 00 00 1e 49 5c 80 b4 70 38 2d 40 58 20 45
00 63 c8 10 00 00 1e 00 00 00 00 00 00 00 00 00
00 00 00 00 00 00 00 00 00 00 00 00 00 00 00 00
00 00 00 00 00 00 00 00 00 00 00 00 00 00 00 00
00 00 00 00 00 00 00 00 00 00 00 00 00 00 00 02

----------------

Block 0, Base EDID:
  EDID Structure Version & Revision: 1.4
  Vendor & Product Identification:
    Manufacturer: GWD
    Model: 4449
    Serial Number: ...
    Made in: week 38 of 2023
  Basic Display Parameters & Features:
    Digital display
    Bits per primary color channel: 10
    DisplayPort interface
    Maximum image size: 36 cm x 20 cm
    Gamma: 2.20
    DPMS levels: Off
    Supported color formats: RGB 4:4:4, YCrCb 4:4:4
    First detailed timing includes the native pixel format and preferred refresh rate
    Display supports continuous frequencies
  Color Characteristics:
    Red  : 0.6396, 0.3300
    Green: 0.2998, 0.5996
    Blue : 0.1503, 0.0595
    White: 0.3134, 0.3291
  Established Timings I & II:
    DMT 0x04:   640x480    59.940476 Hz   4:3     31.469 kHz     25.175000 MHz
    DMT 0x09:   800x600    60.316541 Hz   4:3     37.879 kHz     40.000000 MHz
    DMT 0x0a:   800x600    72.187572 Hz   4:3     48.077 kHz     50.000000 MHz
    DMT 0x0b:   800x600    75.000000 Hz   4:3     46.875 kHz     49.500000 MHz
    DMT 0x10:  1024x768    60.003840 Hz   4:3     48.363 kHz     65.000000 MHz
    DMT 0x11:  1024x768    70.069359 Hz   4:3     56.476 kHz     75.000000 MHz
    DMT 0x12:  1024x768    75.028582 Hz   4:3     60.023 kHz     78.750000 MHz
    DMT 0x24:  1280x1024   75.024675 Hz   5:4     79.976 kHz    135.000000 MHz
  Standard Timings:
    GTF     :  1152x864    60.000000 Hz   4:3     53.700 kHz     81.624000 MHz
    DMT 0x23:  1280x1024   60.019740 Hz   5:4     63.981 kHz    108.000000 MHz
    DMT 0x20:  1280x960    60.000000 Hz   4:3     60.000 kHz    108.000000 MHz
    DMT 0x55:  1280x720    60.000000 Hz  16:9     45.000 kHz     74.250000 MHz
    DMT 0x2f:  1440x900    59.887445 Hz  16:10    55.935 kHz    106.500000 MHz
    DMT 0x52:  1920x1080   60.000000 Hz  16:9     67.500 kHz    148.500000 MHz
    DMT 0x53:  1600x900    60.000000 Hz  16:9     60.000 kHz    108.000000 MHz (RB)
    DMT 0x3a:  1680x1050   59.954250 Hz  16:10    65.290 kHz    146.250000 MHz
  Detailed Timing Descriptors:
    DTD 1:  1920x1080   60.000000 Hz  16:9     67.500 kHz    148.500000 MHz (355 mm x 200 mm)
                 Hfront   88 Hsync  44 Hback  148 Hpol P
                 Vfront    4 Vsync   5 Vback   36 Vpol P
    DTD 2:  1920x1080  144.000000 Hz  16:9    162.000 kHz    340.200000 MHz (355 mm x 200 mm)
                 Hfront   88 Hsync  44 Hback   48 Hpol P
                 Vfront    4 Vsync   5 Vback   36 Vpol P
    Display Product Name: 'ARZOPA'
    Display Range Limits:
      Monitor ranges (Range Limits Only): 58-144 Hz V, 180-180 kHz H, max dotclock 360 MHz
  Extension blocks: 1
Checksum: 0x34

----------------

Block 1, CTA-861 Extension Block:
  Revision: 3
  Underscans IT Video Formats by default
  Basic audio support
  Supports YCbCr 4:4:4
  Supports YCbCr 4:2:2
  Native DTDs: 3
  Video Data Block:
    VIC  16:  1920x1080   60.000000 Hz  16:9     67.500 kHz    148.500000 MHz (native)
    VIC   1:   640x480    59.940476 Hz   4:3     31.469 kHz     25.175000 MHz
    VIC   2:   720x480    59.940060 Hz   4:3     31.469 kHz     27.000000 MHz
    VIC   3:   720x480    59.940060 Hz  16:9     31.469 kHz     27.000000 MHz
    VIC   4:  1280x720    60.000000 Hz  16:9     45.000 kHz     74.250000 MHz
    VIC  69:  1280x720    60.000000 Hz  64:27    45.000 kHz     74.250000 MHz
    VIC   4:  1280x720    60.000000 Hz  16:9     45.000 kHz     74.250000 MHz
    VIC  69:  1280x720    60.000000 Hz  64:27    45.000 kHz     74.250000 MHz
  Audio Data Block:
    Linear PCM:
      Max channels: 2
      Supported sample rates (kHz): 48 44.1 32
      Supported sample sizes (bits): 24 20 16
  Speaker Allocation Data Block:
    FL/FR - Front Left/Right
  Colorimetry Data Block:
    BT2020YCC
    BT2020RGB
  HDR Static Metadata Data Block:
    Electro optical transfer functions:
      Traditional gamma - SDR luminance range
      SMPTE ST2084
    Supported static metadata descriptors:
      Static metadata type 1
    Desired content max luminance: 93 (374.834 cd/m^2)
    Desired content max frame-average luminance: 93 (374.834 cd/m^2)
    Desired content min luminance: 48 (0.133 cd/m^2)
  Video Capability Data Block:
    YCbCr quantization: Selectable (via AVI YQ)
    RGB quantization: Selectable (via AVI Q)
    PT scan behavior: No Data
    IT scan behavior: IT video formats not supported
    CE scan behavior: CE video formats not supported
  Detailed Timing Descriptors:
    DTD 3:  1920x1080  120.000000 Hz  16:9    135.000 kHz    283.500000 MHz (355 mm x 200 mm)
                 Hfront   88 Hsync  32 Hback   60 Hpol P
                 Vfront    4 Vsync   5 Vback   36 Vpol P
    DTD 4:  1920x1080  100.000000 Hz  16:9    112.500 kHz    236.250000 MHz (355 mm x 200 mm)
                 Hfront   88 Hsync  32 Hback   60 Hpol P
                 Vfront    4 Vsync   5 Vback   36 Vpol P
Checksum: 0x02  Unused space in Extension Block: 56 bytes

----------------

Warnings:

Block 1, CTA-861 Extension Block:
  Colorimetry Data Block: Set the sRGB colorimetry bit to avoid interop issues.
  Video Capability Data Block: IT scan behavior is expected to support underscanned.
  Video Capability Data Block: 'CE video formats not supported' makes no sense.
EDID:
  Base EDID: Some timings are out of range of the Monitor Ranges:
    Horizontal Freq: 31.468 - 162.000 kHz (Monitor: 180.000 - 180.000 kHz)

Failures:

Block 1, CTA-861 Extension Block:
  Video Data Block: Duplicate VIC 4.
  Video Data Block: Duplicate VIC 69.
EDID:
  Extension Block 2 started with EDID header, ignoring Extension Blocks >= 2.

EDID conformity: FAIL
