edid-decode (hex):

00 ff ff ff ff ff ff 00 09 e5 1c 0b 00 00 00 00
07 20 01 04 a5 1d 12 78 03 ca f5 a4 54 4b 9b 25
0e 50 54 00 00 00 01 01 01 01 01 01 01 01 01 01
01 01 01 01 01 01 62 6b 00 c8 a0 40 3c 60 30 20
36 00 1e b3 10 00 00 1a e8 55 00 c8 a0 40 3c 60
30 20 36 00 1e b3 10 00 00 1a 00 00 00 fd 00 28
3c 64 64 1b 01 0a 20 20 20 20 20 20 00 00 00 fe
00 4e 45 31 33 33 51 44 4d 2d 4e 36 33 0a 01 56

02 03 16 00 6d 1a 00 00 03 01 28 3c 00 00 60 51
60 51 3c 00 00 00 00 00 00 00 00 00 00 00 00 00
00 00 00 00 00 00 00 00 00 00 00 00 00 00 00 00
00 00 00 00 00 00 00 00 00 00 00 00 00 00 00 00
00 00 00 00 00 00 00 00 00 00 00 00 00 00 00 00
00 00 00 00 00 00 00 00 00 00 00 00 00 00 00 00
00 00 00 00 00 00 00 00 00 00 00 00 00 00 00 00
00 00 00 00 00 00 00 00 00 00 00 00 00 00 00 58

00 ff ff ff ff ff ff 00 09 e5 1c 0b 00 00 00 00
07 20 01 04 a5 1d 12 78 03 ca f5 a4 54 4b 9b 25
0e 50 54 00 00 00 01 01 01 01 01 01 01 01 01 01
01 01 01 01 01 01 62 6b 00 c8 a0 40 3c 60 30 20
36 00 1e b3 10 00 00 1a e8 55 00 c8 a0 40 3c 60
30 20 36 00 1e b3 10 00 00 1a 00 00 00 fd 00 28
3c 64 64 1b 01 0a 20 20 20 20 20 20 00 00 00 fe
00 4e 45 31 33 33 51 44 4d 2d 4e 36 33 0a 01 56

02 03 16 00 6d 1a 00 00 03 01 28 3c 00 00 60 51
60 51 3c 00 00 00 00 00 00 00 00 00 00 00 00 00
00 00 00 00 00 00 00 00 00 00 00 00 00 00 00 00
00 00 00 00 00 00 00 00 00 00 00 00 00 00 00 00
00 00 00 00 00 00 00 00 00 00 00 00 00 00 00 00
00 00 00 00 00 00 00 00 00 00 00 00 00 00 00 00
00 00 00 00 00 00 00 00 00 00 00 00 00 00 00 00
00 00 00 00 00 00 00 00 00 00 00 00 00 00 00 58

----------------

Block 0, Base EDID:
  EDID Structure Version & Revision: 1.4
  Vendor & Product Identification:
    Manufacturer: BOE
    Model: 2844
    Made in: week 7 of 2022
  Basic Display Parameters & Features:
    Digital display
    Bits per primary color channel: 8
    DisplayPort interface
    Maximum image size: 29 cm x 18 cm
    Gamma: 2.20
    Supported color formats: RGB 4:4:4
    First detailed timing includes the native pixel format and preferred refresh rate
    Display supports continuous frequencies
  Color Characteristics:
    Red  : 0.6435, 0.3281
    Green: 0.2949, 0.6074
    Blue : 0.1474, 0.0576
    White: 0.3134, 0.3291
  Established Timings I & II: none
  Standard Timings: none
  Detailed Timing Descriptors:
    DTD 1:  2560x1600   60.000873 Hz  16:10    99.601 kHz    274.900000 MHz (286 mm x 179 mm)
                 Hfront   48 Hsync  32 Hback  120 Hpol P
                 Vfront    3 Vsync   6 Vback   51 Vpol N
    DTD 2:  2560x1600   48.000698 Hz  16:10    79.681 kHz    219.920000 MHz (286 mm x 179 mm)
                 Hfront   48 Hsync  32 Hback  120 Hpol P
                 Vfront    3 Vsync   6 Vback   51 Vpol N
    Display Range Limits:
      Monitor ranges (Range Limits Only): 40-60 Hz V, 100-100 kHz H, max dotclock 270 MHz
    Alphanumeric Data String: 'NE133QDM-N63'
  Extension blocks: 1
Checksum: 0x56

----------------

Block 1, CTA-861 Extension Block:
  Revision: 3
  Native DTDs: 0
  Vendor-Specific Data Block (AMD), OUI 00-00-1A:
    Version: 3
    Feature Caps: 0x01
    Minimum Refresh Rate: 40 Hz
    Maximum Refresh Rate: 60 Hz
    Flags 1.x: 0x00
    Flags 2.x: 0x00
  Audio Data Block:
Checksum: 0x58  Unused space in Extension Block: 105 bytes

----------------

Warnings:

Block 0, Base EDID:
  Missing Display Product Name.
Block 1, CTA-861 Extension Block:
  IT Video Formats are overscanned by default, but normally this should be underscanned.
  Add a Colorimetry Data Block with the sRGB colorimetry bit set to avoid interop issues.
EDID:
  Base EDID: Some timings are out of range of the Monitor Ranges:
    Horizontal Freq: 79.681 - 99.601 kHz (Monitor: 100.000 - 100.000 kHz)
    Maximum Clock: 274.900 MHz (Monitor: 270.000 MHz)

Failures:

Block 1, CTA-861 Extension Block:
  Audio Data Block: Audio information is present, but bit 6 of Byte 3 of the CTA-861 Extension header indicates no Basic Audio support.
  Audio Data Block: Broken CTA-861 audio block length 28.
  Offset is 22, but should be 47.
  Required 640x480p60 timings are missing in the established timings and the SVD list (VIC 1).
  Missing VCDB, needed for Set Selectable RGB Quantization to avoid interop issues.
EDID:
  Extension Block 2 started with EDID header, ignoring Extension Blocks >= 2.

EDID conformity: FAIL
