edid-decode (hex):

00 ff ff ff ff ff ff 00 0d ae 16 16 00 00 00 00
22 20 01 04 a5 22 16 78 03 ee 95 a3 54 4c 99 26
0f 50 54 00 00 00 01 01 01 01 01 01 01 01 01 01
01 01 01 01 01 01 26 ae 80 a0 70 b0 63 40 30 20
a6 00 58 d7 10 00 00 18 26 ae 80 a0 70 b0 44 49
30 20 a6 00 58 d7 10 00 00 18 00 00 00 fd 00 3c
a5 d7 d7 2d 01 0a 20 20 20 20 20 20 00 00 00 fe
00 4e 31 36 30 4a 4d 45 2d 47 54 31 0a 20 01 df

70 20 79 02 00 2b 00 06 27 00 3c a4 00 00 81 00
13 72 1a 00 00 03 01 3c a5 00 00 00 00 00 00 a5
00 00 00 00 00 00 00 00 00 00 00 00 00 00 00 00
00 00 00 00 00 00 00 00 00 00 00 00 00 00 00 00
00 00 00 00 00 00 00 00 00 00 00 00 00 00 00 00
00 00 00 00 00 00 00 00 00 00 00 00 00 00 00 00
00 00 00 00 00 00 00 00 00 00 00 00 00 00 00 00
00 00 00 00 00 00 00 00 00 00 00 00 00 00 83 90

00 ff ff ff ff ff ff 00 0d ae 16 16 00 00 00 00
22 20 01 04 a5 22 16 78 03 ee 95 a3 54 4c 99 26
0f 50 54 00 00 00 01 01 01 01 01 01 01 01 01 01
01 01 01 01 01 01 26 ae 80 a0 70 b0 63 40 30 20
a6 00 58 d7 10 00 00 18 26 ae 80 a0 70 b0 44 49
30 20 a6 00 58 d7 10 00 00 18 00 00 00 fd 00 3c
a5 d7 d7 2d 01 0a 20 20 20 20 20 20 00 00 00 fe
00 4e 31 36 30 4a 4d 45 2d 47 54 31 0a 20 01 df

70 20 79 02 00 2b 00 06 27 00 3c a4 00 00 81 00
13 72 1a 00 00 03 01 3c a5 00 00 00 00 00 00 a5
00 00 00 00 00 00 00 00 00 00 00 00 00 00 00 00
00 00 00 00 00 00 00 00 00 00 00 00 00 00 00 00
00 00 00 00 00 00 00 00 00 00 00 00 00 00 00 00
00 00 00 00 00 00 00 00 00 00 00 00 00 00 00 00
00 00 00 00 00 00 00 00 00 00 00 00 00 00 00 00
00 00 00 00 00 00 00 00 00 00 00 00 00 00 83 90

----------------

Block 0, Base EDID:
  EDID Structure Version & Revision: 1.4
  Vendor & Product Identification:
    Manufacturer: CMN
    Model: 5654
    Made in: week 34 of 2022
  Basic Display Parameters & Features:
    Digital display
    Bits per primary color channel: 8
    DisplayPort interface
    Maximum image size: 34 cm x 22 cm
    Gamma: 2.20
    Supported color formats: RGB 4:4:4
    First detailed timing includes the native pixel format and preferred refresh rate
    Display supports continuous frequencies
  Color Characteristics:
    Red  : 0.6396, 0.3300
    Green: 0.2998, 0.5996
    Blue : 0.1503, 0.0595
    White: 0.3134, 0.3291
  Established Timings I & II: none
  Standard Timings: none
  Detailed Timing Descriptors:
    DTD 1:  1920x1200  165.001184 Hz  16:10   214.337 kHz    445.820000 MHz (344 mm x 215 mm)
                 Hfront   48 Hsync  32 Hback   80 Hpol N
                 Vfront   10 Vsync   6 Vback   83 Vpol N
    DTD 2:  1920x1200   60.004630 Hz  16:10   214.337 kHz    445.820000 MHz (344 mm x 215 mm)
                 Hfront   48 Hsync  32 Hback   80 Hpol N
                 Vfront   10 Vsync   6 Vback 2356 Vpol N
    Display Range Limits:
      Monitor ranges (Range Limits Only): 60-165 Hz V, 215-215 kHz H, max dotclock 450 MHz
    Alphanumeric Data String: 'N160JME-GT1'
  Extension blocks: 1
Checksum: 0xdf

----------------

Block 1, DisplayID Extension Block:
  Version: 2.0
  Extension Count: 0
  Display Product Primary Use Case: None of the listed primary use cases; generic display
  Adaptive Sync Data Block:
    Descriptor #1:
      Native Panel Range
      Fixed Average V-Total and Adaptive V-Total
      Supports Seamless Transition
      'Max Single Frame Duration Increase' field value without jitter impact
      'Max Single Frame Duration Decrease' field value without jitter impact
      Max Duration Increase: 0.00 ms
      Max Duration Decrease: 0.00 ms
      Min Refresh Rate: 60 Hz
      Max Refresh Rate: 165 Hz
  CTA-861 DisplayID Data Block:
  Vendor-Specific Data Block (AMD), OUI 00-00-1A:
    Version: 3
    Feature Caps: 0x01
    Minimum Refresh Rate: 60 Hz
    Maximum Refresh Rate: 165 Hz
    Flags 1.x: 0x00
    Flags 2.x: 0x00
  Checksum: 0x83
Checksum: 0x90

----------------

Warnings:

Block 0, Base EDID:
  Missing Display Product Name.
EDID:
  Base EDID: Some timings are out of range of the Monitor Ranges:
    Horizontal Freq: 214.336 - 214.336 kHz (Monitor: 215.000 - 215.000 kHz)
    Could be due to a Monitor Range off-by-one rounding issue

Failures:

EDID:
  Extension Block 2 started with EDID header, ignoring Extension Blocks >= 2.
  DisplayID: Missing DisplayID Display Parameters Data Block.
  DisplayID: Missing DisplayID Type VII Detailed Timing Data Block.
  DisplayID: DisplayID expects at least one preferred timing.

EDID conformity: FAIL
