edid-decode (hex):

00 ff ff ff ff ff ff 00 26 34 01 ad 01 01 01 01
20 14 01 03 e8 3c 22 78 2a 65 15 a5 56 4a 9b 25
12 50 54 bf ef 00 81 c0 81 00 81 40 81 80 81 8a
81 8c b3 00 d1 c0 02 3a 80 18 71 38 2d 40 58 2c
45 00 56 50 21 00 00 1e 00 00 00 fd 00 38 4b 18
50 11 00 0a 20 20 20 20 20 20 00 00 00 fc 00 48
44 49 54 32 37 57 20 44 56 49 0a 20 00 00 00 ff
00 54 32 37 30 57 45 30 38 30 30 33 35 37 00 bb

00 ff ff ff ff ff ff 00 26 34 01 ad 01 01 01 01
20 14 01 03 e8 3c 22 78 2a 65 15 a5 56 4a 9b 25
12 50 54 bf ef 00 81 c0 81 00 81 40 81 80 81 8a
81 8c b3 00 d1 c0 02 3a 80 18 71 38 2d 40 58 2c
45 00 56 50 21 00 00 1e 00 00 00 fd 00 38 4b 18
50 11 00 0a 20 20 20 20 20 20 00 00 00 fc 00 48
44 49 54 32 37 57 20 44 56 49 0a 20 00 00 00 ff
00 54 32 37 30 57 45 30 38 30 30 33 35 37 00 bb

----------------

Block 0, Base EDID:
  EDID Structure Version & Revision: 1.3
  Vendor & Product Identification:
    Manufacturer: IQT
    Model: 44289
    Serial Number: ...
    Made in: week 32 of 2010
  Basic Display Parameters & Features:
    Digital display
    Maximum image size: 60 cm x 34 cm
    Gamma: 2.20
    DPMS levels: Off
    RGB color display
    First detailed timing is the preferred timing
  Color Characteristics:
    Red  : 0.6455, 0.3378
    Green: 0.2900, 0.6064
    Blue : 0.1445, 0.0712
    White: 0.3134, 0.3291
  Established Timings I & II:
    IBM     :   720x400    70.081663 Hz   9:5     31.467 kHz     28.320000 MHz
    DMT 0x04:   640x480    59.940476 Hz   4:3     31.469 kHz     25.175000 MHz
    Apple   :   640x480    66.666667 Hz   4:3     35.000 kHz     30.240000 MHz
    DMT 0x05:   640x480    72.808802 Hz   4:3     37.861 kHz     31.500000 MHz
    DMT 0x06:   640x480    75.000000 Hz   4:3     37.500 kHz     31.500000 MHz
    DMT 0x08:   800x600    56.250000 Hz   4:3     35.156 kHz     36.000000 MHz
    DMT 0x09:   800x600    60.316541 Hz   4:3     37.879 kHz     40.000000 MHz
    DMT 0x0a:   800x600    72.187572 Hz   4:3     48.077 kHz     50.000000 MHz
    DMT 0x0b:   800x600    75.000000 Hz   4:3     46.875 kHz     49.500000 MHz
    Apple   :   832x624    74.551266 Hz   4:3     49.726 kHz     57.284000 MHz
    DMT 0x10:  1024x768    60.003840 Hz   4:3     48.363 kHz     65.000000 MHz
    DMT 0x11:  1024x768    70.069359 Hz   4:3     56.476 kHz     75.000000 MHz
    DMT 0x12:  1024x768    75.028582 Hz   4:3     60.023 kHz     78.750000 MHz
    DMT 0x24:  1280x1024   75.024675 Hz   5:4     79.976 kHz    135.000000 MHz
  Standard Timings:
    DMT 0x55:  1280x720    60.000000 Hz  16:9     45.000 kHz     74.250000 MHz
    DMT 0x1c:  1280x800    59.810326 Hz  16:10    49.702 kHz     83.500000 MHz
    DMT 0x20:  1280x960    60.000000 Hz   4:3     60.000 kHz    108.000000 MHz
    DMT 0x23:  1280x1024   60.019740 Hz   5:4     63.981 kHz    108.000000 MHz
    GTF     :  1280x1024   69.999805 Hz   5:4     74.620 kHz    128.943000 MHz
    GTF     :  1280x1024   72.000069 Hz   5:4     76.824 kHz    132.752000 MHz
    DMT 0x3a:  1680x1050   59.954250 Hz  16:10    65.290 kHz    146.250000 MHz
    DMT 0x52:  1920x1080   60.000000 Hz  16:9     67.500 kHz    148.500000 MHz
  Detailed Timing Descriptors:
    DTD 1:  1920x1080   60.000000 Hz  16:9     67.500 kHz    148.500000 MHz (598 mm x 336 mm)
                 Hfront   88 Hsync  44 Hback  148 Hpol P
                 Vfront    4 Vsync   5 Vback   36 Vpol P
    Display Range Limits:
      Monitor ranges (GTF): 56-75 Hz V, 24-80 kHz H, max dotclock 170 MHz
    Display Product Name: 'HDIT27W DVI'
    Display Product Serial Number: ...
Checksum: 0xbb

----------------

Block 1, Unknown EDID Extension Block 0x00:
  00 ff ff ff ff ff ff 00 26 34 01 ad 01 01 01 01 '........&4......'
  20 14 01 03 e8 3c 22 78 2a 65 15 a5 56 4a 9b 25 ' ....<"x*e..VJ.%'
  12 50 54 bf ef 00 81 c0 81 00 81 40 81 80 81 8a '.PT........@....'
  81 8c b3 00 d1 c0 02 3a 80 18 71 38 2d 40 58 2c '.......:..q8-@X,'
  45 00 56 50 21 00 00 1e 00 00 00 fd 00 38 4b 18 'E.VP!........8K.'
  50 11 00 0a 20 20 20 20 20 20 00 00 00 fc 00 48 'P...      .....H'
  44 49 54 32 37 57 20 44 56 49 0a 20 00 00 00 ff 'DIT27W DVI. ....'
  00 54 32 37 30 57 45 30 38 30 30 33 35 37 00 bb '.T270WE0800357..'
Checksum: 0xbb

----------------

Warnings:

Block 0, Base EDID:
  Vendor & Product Identification: The serial number is one of the known dummy values, it should probably be set to 0.

Failures:

Block 0, Base EDID:
  Basic Display Parameters & Features: Digital Video Interface Standard set to reserved value 0x68.
Block 1, Base EDID:
  Unknown Extension Block.
EDID:
  Base EDID: EDID specified 0 extension block(s), but found 1 extension block(s).

EDID conformity: FAIL
