edid-decode (hex):

00 ff ff ff ff ff ff 00 09 d1 11 7f 45 54 00 00
19 16 01 03 80 35 1e 78 2e 48 a0 a6 54 54 9f 26
0d 50 54 a5 6b 80 31 68 31 7c 45 68 45 7c 61 68
61 7c 95 3c d1 c0 02 3a 80 18 71 38 2d 40 58 2c
45 00 13 2a 21 00 00 1e 00 00 00 ff 00 30 30 30
30 30 30 30 30 53 4c 30 0a 20 00 00 00 fd 00 18
78 0f 87 11 00 0a 20 20 20 20 20 20 00 00 00 fc
00 42 65 6e 51 20 58 4c 32 34 31 31 54 0a 01 6d

00 ff ff ff ff ff ff 00 09 d1 11 7f 45 54 00 00
19 16 01 03 80 35 1e 78 2e 48 a0 a6 54 54 9f 26
0d 50 54 a5 6b 80 31 68 31 7c 45 68 45 7c 61 68
61 7c 95 3c d1 c0 02 3a 80 18 71 38 2d 40 58 2c
45 00 13 2a 21 00 00 1e 00 00 00 ff 00 30 30 30
30 30 30 30 30 53 4c 30 0a 20 00 00 00 fd 00 18
78 0f 87 11 00 0a 20 20 20 20 20 20 00 00 00 fc
00 42 65 6e 51 20 58 4c 32 34 31 31 54 0a 01 6d

----------------

Block 0, Base EDID:
  EDID Structure Version & Revision: 1.3
  Vendor & Product Identification:
    Manufacturer: BNQ
    Model: 32529
    Serial Number: ...
    Made in: week 25 of 2012
  Basic Display Parameters & Features:
    Digital display
    Maximum image size: 53 cm x 30 cm
    Gamma: 2.20
    DPMS levels: Off
    RGB color display
    Default (sRGB) color space is primary color space
    First detailed timing is the preferred timing
  Color Characteristics:
    Red  : 0.6494, 0.3281
    Green: 0.3300, 0.6210
    Blue : 0.1503, 0.0527
    White: 0.3125, 0.3281
  Established Timings I & II:
    IBM     :   720x400    70.081663 Hz   9:5     31.467 kHz     28.320000 MHz
    DMT 0x04:   640x480    59.940476 Hz   4:3     31.469 kHz     25.175000 MHz
    DMT 0x06:   640x480    75.000000 Hz   4:3     37.500 kHz     31.500000 MHz
    DMT 0x09:   800x600    60.316541 Hz   4:3     37.879 kHz     40.000000 MHz
    DMT 0x0b:   800x600    75.000000 Hz   4:3     46.875 kHz     49.500000 MHz
    Apple   :   832x624    74.551266 Hz   4:3     49.726 kHz     57.284000 MHz
    DMT 0x10:  1024x768    60.003840 Hz   4:3     48.363 kHz     65.000000 MHz
    DMT 0x12:  1024x768    75.028582 Hz   4:3     60.023 kHz     78.750000 MHz
    DMT 0x24:  1280x1024   75.024675 Hz   5:4     79.976 kHz    135.000000 MHz
    Apple   :  1152x870    75.061550 Hz 192:145   68.681 kHz    100.000000 MHz
  Standard Timings:
    GTF     :   640x480    99.999537 Hz   4:3     50.900 kHz     43.163000 MHz
    GTF     :   640x480   119.999084 Hz   4:3     61.800 kHz     52.406000 MHz
    GTF     :   800x600    99.999707 Hz   4:3     63.600 kHz     68.179000 MHz
    GTF     :   800x600   119.999886 Hz   4:3     77.160 kHz     83.950000 MHz
    GTF     :  1024x768   100.000177 Hz   4:3     81.400 kHz    113.309000 MHz
    GTF     :  1024x768   119.999931 Hz   4:3     98.760 kHz    139.054000 MHz
    GTF     :  1440x900   119.999896 Hz  16:10   115.800 kHz    229.747000 MHz
    DMT 0x52:  1920x1080   60.000000 Hz  16:9     67.500 kHz    148.500000 MHz
  Detailed Timing Descriptors:
    DTD 1:  1920x1080   60.000000 Hz  16:9     67.500 kHz    148.500000 MHz (531 mm x 298 mm)
                 Hfront   88 Hsync  44 Hback  148 Hpol P
                 Vfront    4 Vsync   5 Vback   36 Vpol P
    Display Product Serial Number: ...
    Display Range Limits:
      Monitor ranges (GTF): 24-120 Hz V, 15-135 kHz H, max dotclock 170 MHz
    Display Product Name: 'BenQ XL2411T'
  Extension blocks: 1
Checksum: 0x6d

----------------

Block 1, Unknown EDID Extension Block 0x00:
  00 ff ff ff ff ff ff 00 09 d1 11 7f 45 54 00 00 '............ET..'
  19 16 01 03 80 35 1e 78 2e 48 a0 a6 54 54 9f 26 '.....5.x.H..TT.&'
  0d 50 54 a5 6b 80 31 68 31 7c 45 68 45 7c 61 68 '.PT.k.1h1|EhE|ah'
  61 7c 95 3c d1 c0 02 3a 80 18 71 38 2d 40 58 2c 'a|.<...:..q8-@X,'
  45 00 13 2a 21 00 00 1e 00 00 00 ff 00 30 30 30 'E..*!........000'
  30 30 30 30 30 53 4c 30 0a 20 00 00 00 fd 00 18 '00000SL0. ......'
  78 0f 87 11 00 0a 20 20 20 20 20 20 00 00 00 fc 'x.....      ....'
  00 42 65 6e 51 20 58 4c 32 34 31 31 54 0a 01 6d '.BenQ XL2411T..m'
Checksum: 0x6d

----------------

Warnings:

Block 0, Base EDID:
  Vendor & Product Identification: The serial number is one of the known dummy values, it should probably be set to 0.
EDID:
  Base EDID: Some timings are out of range of the Monitor Ranges:
    Maximum Clock: 229.747 MHz (Monitor: 170.000 MHz)

Failures:

Block 0, Base EDID:
  Basic Display Parameters & Features: sRGB is signaled, but the chromaticities do not match.
Block 1, Base EDID:
  Unknown Extension Block.

EDID conformity: FAIL
