edid-decode (hex):

00 ff ff ff ff ff ff 00 22 64 25 03 26 15 00 00
2e 12 01 03 80 14 0b 78 0a 80 36 9a 5e 5d 91 28
20 4f 54 00 00 00 01 01 01 01 01 01 01 01 01 01
01 01 01 01 01 01 94 11 00 b0 40 58 19 20 35 23
45 00 c3 71 00 00 00 19 00 00 00 fd 00 37 41 22
29 05 00 0a 20 20 20 20 20 20 00 00 00 fc 00 48
53 44 30 38 39 49 46 57 31 0a 20 20 00 00 00 10
00 0a 20 20 20 20 20 20 20 20 20 20 20 20 00 0b

00 ff ff ff ff ff ff 00 22 64 25 03 26 15 00 00
2e 12 01 03 80 14 0b 78 0a 80 36 9a 5e 5d 91 28
20 4f 54 00 00 00 01 01 01 01 01 01 01 01 01 01
01 01 01 01 01 01 94 11 00 b0 40 58 19 20 35 23
45 00 c3 71 00 00 00 19 00 00 00 fd 00 37 41 22
29 05 00 0a 20 20 20 20 20 20 00 00 00 fc 00 48
53 44 30 38 39 49 46 57 31 0a 20 20 00 00 00 10
00 0a 20 20 20 20 20 20 20 20 20 20 20 20 00 0b

----------------

Block 0, Base EDID:
  EDID Structure Version & Revision: 1.3
  Vendor & Product Identification:
    Manufacturer: HSD
    Model: 805
    Serial Number: ...
    Made in: week 46 of 2008
  Basic Display Parameters & Features:
    Digital display
    Maximum image size: 20 cm x 11 cm
    Gamma: 2.20
    RGB color display
    First detailed timing is the preferred timing
  Color Characteristics:
    Red  : 0.6035, 0.3671
    Green: 0.3632, 0.5664
    Blue : 0.1562, 0.1279
    White: 0.3095, 0.3300
  Established Timings I & II: none
  Standard Timings: none
  Detailed Timing Descriptors:
    DTD 1:  1024x600    60.000000 Hz 128:75    37.500 kHz     45.000000 MHz (195 mm x 113 mm)
                 Hfront   53 Hsync  35 Hback   88 Hpol N
                 Vfront    4 Vsync   5 Vback   16 Vpol N
    Display Range Limits:
      Monitor ranges (GTF): 55-65 Hz V, 34-41 kHz H, max dotclock 50 MHz
    Display Product Name: 'HSD089IFW1'
    Dummy Descriptor:
Checksum: 0x0b

----------------

Failures:

Block 0, Base EDID:
  Dummy Descriptor: Dummy block filled with garbage.
EDID:
  Extension Block 1 started with EDID header, ignoring Extension Blocks >= 1.

EDID conformity: FAIL
