edid-decode (hex):

00 ff ff ff ff ff ff 00 0d af 32 13 00 00 00 00
23 14 01 04 90 1d 10 78 02 98 55 95 59 56 93 28
20 50 54 00 00 00 01 01 01 01 01 01 01 01 01 01
01 01 01 01 01 01 78 1d 56 bc 50 00 26 30 1f 41
4c 00 25 a4 10 00 00 1a 93 13 56 bc 50 00 26 30
1f 41 4c 00 25 a4 10 00 00 1a 00 00 00 fe 00 30
30 57 56 4d 80 31 33 33 42 47 45 0a 00 00 00 00
00 00 41 31 96 00 00 00 00 01 01 0a 20 20 00 4e

----------------

Block 0, Base EDID:
  EDID Structure Version & Revision: 1.4
  Vendor & Product Identification:
    Manufacturer: CMO
    Model: 4914
    Made in: week 35 of 2010
  Basic Display Parameters & Features:
    Digital display
    Bits per primary color channel: 6
    Digital interface is not defined
    Maximum image size: 29 cm x 16 cm
    Gamma: 2.20
    Supported color formats: RGB 4:4:4
    First detailed timing includes the native pixel format and preferred refresh rate
  Color Characteristics:
    Red  : 0.5839, 0.3486
    Green: 0.3378, 0.5742
    Blue : 0.1572, 0.1259
    White: 0.3134, 0.3291
  Established Timings I & II: none
  Standard Timings: none
  Detailed Timing Descriptors:
    DTD 1:  1366x768    60.230383 Hz 683:384   48.546 kHz     75.440000 MHz (293 mm x 164 mm)
                 Hfront   31 Hsync  65 Hback   92 Hpol P
                 Vfront    4 Vsync  12 Vback   22 Vpol N
    DTD 2:  1366x768    40.007217 Hz 683:384   32.246 kHz     50.110000 MHz (293 mm x 164 mm)
                 Hfront   31 Hsync  65 Hback   92 Hpol P
                 Vfront    4 Vsync  12 Vback   22 Vpol N
    Alphanumeric Data String: '00WVM.133BGE'
    Manufacturer-Specified Display Descriptor (0x00): 00 00 00 00 41 31 96 00 00 00 00 01 01 0a 20 20 '....A1........  '
Checksum: 0x4e

----------------

Warnings:

Block 0, Base EDID:
  Alphanumeric Data String: Non-ASCII character 0x80 at position 5, can cause problems.
  Missing Display Product Name.

EDID conformity: PASS
