edid-decode (hex):

00 ff ff ff ff ff ff 00 1e f9 cc 00 12 cd 40 93
22 13 01 03 68 2c 19 78 ea b8 15 a6 55 4b 9b 25
13 50 54 bf ee 80 71 4f 81 c0 81 00 01 01 01 01
01 01 01 01 01 01 31 2e 40 00 62 84 22 30 58 a8
35 00 ba f9 10 00 00 1c 00 00 00 fc 00 48 58 32
30 30 30 0a 20 20 20 20 20 20 00 00 00 fd 00 38
4c 1f 53 12 00 0a 20 20 20 20 20 20 00 00 00 ff
00 43 31 38 30 43 30 30 31 34 30 30 30 0a 00 87

00 ff ff ff ff ff ff 00 1e f9 cc 00 12 cd 40 93
22 13 01 03 68 2c 19 78 ea b8 15 a6 55 4b 9b 25
13 50 54 bf ee 80 71 4f 81 c0 81 00 01 01 01 01
01 01 01 01 01 01 31 2e 40 00 62 84 22 30 58 a8
35 00 ba f9 10 00 00 1c 00 00 00 fc 00 48 58 32
30 30 30 0a 20 20 20 20 20 20 00 00 00 fd 00 38
4c 1f 53 12 00 0a 20 20 20 20 20 20 00 00 00 ff
00 43 31 38 30 43 30 30 31 34 30 30 30 0a 00 87

----------------

Block 0, Base EDID:
  EDID Structure Version & Revision: 1.3
  Vendor & Product Identification:
    Manufacturer: GWY
    Model: 204
    Serial Number: ...
    Made in: week 34 of 2009
  Basic Display Parameters & Features:
    Analog display
    Signal Level Standard: 0.700 : 0.000 : 0.700 V p-p
    Blank level equals black level
    Sync: Separate
    Maximum image size: 44 cm x 25 cm
    Gamma: 2.20
    DPMS levels: Standby Suspend Off
    RGB color display
    First detailed timing is the preferred timing
  Color Characteristics:
    Red  : 0.6503, 0.3349
    Green: 0.2949, 0.6054
    Blue : 0.1445, 0.0751
    White: 0.3134, 0.3291
  Established Timings I & II:
    IBM     :   720x400    70.081663 Hz   9:5     31.467 kHz     28.320000 MHz
    DMT 0x04:   640x480    59.940476 Hz   4:3     31.469 kHz     25.175000 MHz
    Apple   :   640x480    66.666667 Hz   4:3     35.000 kHz     30.240000 MHz
    DMT 0x05:   640x480    72.808802 Hz   4:3     37.861 kHz     31.500000 MHz
    DMT 0x06:   640x480    75.000000 Hz   4:3     37.500 kHz     31.500000 MHz
    DMT 0x08:   800x600    56.250000 Hz   4:3     35.156 kHz     36.000000 MHz
    DMT 0x09:   800x600    60.316541 Hz   4:3     37.879 kHz     40.000000 MHz
    DMT 0x0a:   800x600    72.187572 Hz   4:3     48.077 kHz     50.000000 MHz
    DMT 0x0b:   800x600    75.000000 Hz   4:3     46.875 kHz     49.500000 MHz
    Apple   :   832x624    74.551266 Hz   4:3     49.726 kHz     57.284000 MHz
    DMT 0x10:  1024x768    60.003840 Hz   4:3     48.363 kHz     65.000000 MHz
    DMT 0x11:  1024x768    70.069359 Hz   4:3     56.476 kHz     75.000000 MHz
    DMT 0x12:  1024x768    75.028582 Hz   4:3     60.023 kHz     78.750000 MHz
    Apple   :  1152x870    75.061550 Hz 192:145   68.681 kHz    100.000000 MHz
  Standard Timings:
    DMT 0x15:  1152x864    75.000000 Hz   4:3     67.500 kHz    108.000000 MHz
    DMT 0x55:  1280x720    60.000000 Hz  16:9     45.000 kHz     74.250000 MHz
    DMT 0x1c:  1280x800    59.810326 Hz  16:10    49.702 kHz     83.500000 MHz
  Detailed Timing Descriptors:
    DTD 1:  1600x900    59.946021 Hz  16:9     55.990 kHz    118.250000 MHz (442 mm x 249 mm)
                 Hfront   88 Hsync 168 Hback  256 Hpol N
                 Vfront    3 Vsync   5 Vback   26 Vpol P
    Display Product Name: 'HX2000'
    Display Range Limits:
      Monitor ranges (GTF): 56-76 Hz V, 31-83 kHz H, max dotclock 180 MHz
    Display Product Serial Number: ...
Checksum: 0x87

----------------

Failures:

EDID:
  Extension Block 1 started with EDID header, ignoring Extension Blocks >= 1.

EDID conformity: FAIL
