edid-decode (hex):

00 ff ff ff ff ff ff 00 30 e4 6d 07 00 00 00 00
00 20 01 04 a5 24 14 78 07 ae 95 a6 54 4c 99 26
0f 50 54 00 00 00 01 01 01 01 01 01 01 01 01 01
01 01 01 01 01 01 b9 9c 80 a0 70 38 59 40 30 20
35 00 63 c8 10 00 00 1a fe 38 80 a0 70 38 59 40
30 20 35 00 63 c8 10 00 00 1a 00 00 00 fd 00 3c
a5 c1 c1 29 01 0a 20 20 20 20 20 20 00 00 00 02
00 0c 33 ff 0f 3c 96 1c 17 31 96 00 00 00 01 81

70 20 79 02 00 25 01 09 39 1f 06 39 1f 06 3c a5
00 81 00 13 72 1a 00 00 03 01 3c a5 00 04 53 51
53 51 a5 00 00 00 00 00 00 00 00 00 00 00 00 00
00 00 00 00 00 00 00 00 00 00 00 00 00 00 00 00
00 00 00 00 00 00 00 00 00 00 00 00 00 00 00 00
00 00 00 00 00 00 00 00 00 00 00 00 00 00 00 00
00 00 00 00 00 00 00 00 00 00 00 00 00 00 00 00
00 00 00 00 00 00 00 00 00 00 00 00 00 00 a3 90

00 ff ff ff ff ff ff 00 30 e4 6d 07 00 00 00 00
00 20 01 04 a5 24 14 78 07 ae 95 a6 54 4c 99 26
0f 50 54 00 00 00 01 01 01 01 01 01 01 01 01 01
01 01 01 01 01 01 b9 9c 80 a0 70 38 59 40 30 20
35 00 63 c8 10 00 00 1a fe 38 80 a0 70 38 59 40
30 20 35 00 63 c8 10 00 00 1a 00 00 00 fd 00 3c
a5 c1 c1 29 01 0a 20 20 20 20 20 20 00 00 00 02
00 0c 33 ff 0f 3c 96 1c 17 31 96 00 00 00 01 81

70 20 79 02 00 25 01 09 39 1f 06 39 1f 06 3c a5
00 81 00 13 72 1a 00 00 03 01 3c a5 00 04 53 51
53 51 a5 00 00 00 00 00 00 00 00 00 00 00 00 00
00 00 00 00 00 00 00 00 00 00 00 00 00 00 00 00
00 00 00 00 00 00 00 00 00 00 00 00 00 00 00 00
00 00 00 00 00 00 00 00 00 00 00 00 00 00 00 00
00 00 00 00 00 00 00 00 00 00 00 00 00 00 00 00
00 00 00 00 00 00 00 00 00 00 00 00 00 00 a3 90

----------------

Block 0, Base EDID:
  EDID Structure Version & Revision: 1.4
  Vendor & Product Identification:
    Manufacturer: LGD
    Model: 1901
    Made in: 2022
  Basic Display Parameters & Features:
    Digital display
    Bits per primary color channel: 8
    DisplayPort interface
    Maximum image size: 36 cm x 20 cm
    Gamma: 2.20
    Supported color formats: RGB 4:4:4
    Default (sRGB) color space is primary color space
    First detailed timing includes the native pixel format and preferred refresh rate
    Display supports continuous frequencies
  Color Characteristics:
    Red  : 0.6503, 0.3300
    Green: 0.2998, 0.5996
    Blue : 0.1503, 0.0595
    White: 0.3134, 0.3291
  Established Timings I & II: none
  Standard Timings: none
  Detailed Timing Descriptors:
    DTD 1:  1920x1080  165.003784 Hz  16:9    192.889 kHz    401.210000 MHz (355 mm x 200 mm)
                 Hfront   48 Hsync  32 Hback   80 Hpol P
                 Vfront    3 Vsync   5 Vback   81 Vpol N
    DTD 2:  1920x1080   60.003619 Hz  16:9     70.144 kHz    145.900000 MHz (355 mm x 200 mm)
                 Hfront   48 Hsync  32 Hback   80 Hpol P
                 Vfront    3 Vsync   5 Vback   81 Vpol N
    Display Range Limits:
      Monitor ranges (Range Limits Only): 60-165 Hz V, 193-193 kHz H, max dotclock 410 MHz
    Manufacturer-Specified Display Descriptor (0x02): 00 02 00 0c 33 ff 0f 3c 96 1c 17 31 96 00 00 00 '....3..<...1....'
  Extension blocks: 1
Checksum: 0x81

----------------

Block 1, DisplayID Extension Block:
  Version: 2.0
  Extension Count: 0
  Display Product Primary Use Case: None of the listed primary use cases; generic display
  Dynamic Video Timing Range Limits Data Block:
    Minimum Pixel Clock: 401210 kHz
    Maximum Pixel Clock: 401210 kHz
    Minimum Vertical Refresh Rate: 60 Hz
    Maximum Vertical Refresh Rate: 165 Hz
    Seamless Dynamic Video Timing Support: No
  CTA-861 DisplayID Data Block:
  Vendor-Specific Data Block (AMD), OUI 00-00-1A:
    Version: 3
    Feature Caps: 0x01
    Minimum Refresh Rate: 60 Hz
    Maximum Refresh Rate: 165 Hz
    Flags 1.x: 0x00
    Flags 2.x: 0x04
  Checksum: 0xa3
Checksum: 0x90

----------------

Warnings:

Block 0, Base EDID:
  Missing Display Product Name.
EDID:
  Base EDID: Some timings are out of range of the Monitor Ranges:
    Horizontal Freq: 70.144 - 192.889 kHz (Monitor: 193.000 - 193.000 kHz)

Failures:

Block 0, Base EDID:
  Basic Display Parameters & Features: sRGB is signaled, but the chromaticities do not match.
EDID:
  Extension Block 2 started with EDID header, ignoring Extension Blocks >= 2.
  DisplayID: Missing DisplayID Display Parameters Data Block.
  DisplayID: Missing DisplayID Type VII Detailed Timing Data Block.
  DisplayID: DisplayID expects at least one preferred timing.

EDID conformity: FAIL
