edid-decode (hex):

00 ff ff ff ff ff ff 00 30 ae 8b 41 00 00 00 00
00 1f 01 04 b5 22 13 78 e3 05 db a8 53 37 b4 25
11 50 55 00 00 00 01 01 01 01 01 01 01 01 01 01
01 01 01 01 01 01 50 d0 00 a0 f0 70 3e 80 30 20
35 00 58 c1 10 00 00 18 00 00 00 fd 00 28 3c 86
86 36 01 0a 20 20 20 20 20 20 00 00 00 0f 00 ff
09 3c ff 09 28 3c 0a 02 0e 6f 08 15 00 00 00 fe
00 4d 4e 46 36 30 31 45 41 31 2d 38 0a 20 01 0e

02 03 1d 00 e3 05 80 00 e6 06 05 01 73 73 21 6d
1a 00 00 02 03 30 3c 00 04 73 21 73 21 00 00 00
00 00 00 00 00 00 00 00 00 00 00 00 00 00 00 00
00 00 00 00 00 00 00 00 00 00 00 00 00 00 00 00
00 00 00 00 00 00 00 00 00 00 00 00 00 00 00 00
00 00 00 00 00 00 00 00 00 00 00 00 00 00 00 00
00 00 00 00 00 00 00 00 00 00 00 00 00 00 00 00
00 00 00 00 00 00 00 00 00 00 00 00 00 00 00 59

00 ff ff ff ff ff ff 00 30 ae 8b 41 00 00 00 00
00 1f 01 04 b5 22 13 78 e3 05 db a8 53 37 b4 25
11 50 55 00 00 00 01 01 01 01 01 01 01 01 01 01
01 01 01 01 01 01 50 d0 00 a0 f0 70 3e 80 30 20
35 00 58 c1 10 00 00 18 00 00 00 fd 00 28 3c 86
86 36 01 0a 20 20 20 20 20 20 00 00 00 0f 00 ff
09 3c ff 09 28 3c 0a 02 0e 6f 08 15 00 00 00 fe
00 4d 4e 46 36 30 31 45 41 31 2d 38 0a 20 01 0e

02 03 1d 00 e3 05 80 00 e6 06 05 01 73 73 21 6d
1a 00 00 02 03 30 3c 00 04 73 21 73 21 00 00 00
00 00 00 00 00 00 00 00 00 00 00 00 00 00 00 00
00 00 00 00 00 00 00 00 00 00 00 00 00 00 00 00
00 00 00 00 00 00 00 00 00 00 00 00 00 00 00 00
00 00 00 00 00 00 00 00 00 00 00 00 00 00 00 00
00 00 00 00 00 00 00 00 00 00 00 00 00 00 00 00
00 00 00 00 00 00 00 00 00 00 00 00 00 00 00 59

----------------

Block 0, Base EDID:
  EDID Structure Version & Revision: 1.4
  Vendor & Product Identification:
    Manufacturer: LEN
    Model: 16779
    Made in: 2021
  Basic Display Parameters & Features:
    Digital display
    Bits per primary color channel: 10
    DisplayPort interface
    Maximum image size: 34 cm x 19 cm
    Gamma: 2.20
    DPMS levels: Standby Suspend Off
    Supported color formats: RGB 4:4:4
    First detailed timing includes the native pixel format and preferred refresh rate
    Display supports continuous frequencies
  Color Characteristics:
    Red  : 0.6562, 0.3242
    Green: 0.2158, 0.7041
    Blue : 0.1474, 0.0673
    White: 0.3144, 0.3349
  Established Timings I & II: none
  Standard Timings: none
  Detailed Timing Descriptors:
    DTD 1:  3840x2160   60.000000 Hz  16:9    133.320 kHz    533.280000 MHz (344 mm x 193 mm)
                 Hfront   48 Hsync  32 Hback   80 Hpol N
                 Vfront    3 Vsync   5 Vback   54 Vpol N
    Display Range Limits:
      Monitor ranges (Range Limits Only): 40-60 Hz V, 134-134 kHz H, max dotclock 540 MHz
    Manufacturer-Specified Display Descriptor (0x0f): 00 0f 00 ff 09 3c ff 09 28 3c 0a 02 0e 6f 08 15 '.....<..(<...o..'
    Alphanumeric Data String: 'MNF601EA1-8'
  Extension blocks: 1
Checksum: 0x0e

----------------

Block 1, CTA-861 Extension Block:
  Revision: 3
  Native DTDs: 0
  Colorimetry Data Block:
    BT2020RGB
  HDR Static Metadata Data Block:
    Electro optical transfer functions:
      Traditional gamma - SDR luminance range
      SMPTE ST2084
    Supported static metadata descriptors:
      Static metadata type 1
    Desired content max luminance: 115 (603.666 cd/m^2)
    Desired content max frame-average luminance: 115 (603.666 cd/m^2)
    Desired content min luminance: 33 (0.101 cd/m^2)
  Vendor-Specific Data Block (AMD), OUI 00-00-1A:
    Version: 2
    Flags 1: 0x03
      FreeSync Supported
      FreeSync 2 HDR Supported
    Minimum Refresh Rate: 48 Hz
    Maximum Refresh Rate: 60 Hz
    Flags 5: 0x04
      Gamma 2.2 EOTF Supported
    Maximum luminance: 115 (603.666 cd/m^2)
    Minimum luminance: 33 (0.101 cd/m^2)
Checksum: 0x59  Unused space in Extension Block: 98 bytes

----------------

Warnings:

Block 0, Base EDID:
  Missing Display Product Name.
Block 1, CTA-861 Extension Block:
  IT Video Formats are overscanned by default, but normally this should be underscanned.
  Colorimetry Data Block: Set the sRGB colorimetry bit to avoid interop issues.
EDID:
  Base EDID: Some timings are out of range of the Monitor Ranges:
    Horizontal Freq: 133.320 - 133.320 kHz (Monitor: 134.000 - 134.000 kHz)
    Could be due to a Monitor Range off-by-one rounding issue

Failures:

Block 1, CTA-861 Extension Block:
  Required 640x480p60 timings are missing in the established timings and the SVD list (VIC 1).
  Missing VCDB, needed for Set Selectable RGB Quantization to avoid interop issues.
EDID:
  Extension Block 2 started with EDID header, ignoring Extension Blocks >= 2.

EDID conformity: FAIL
