edid-decode (hex):

00 ff ff ff ff ff ff 00 21 63 01 27 00 00 00 00
34 1b 01 03 80 3b 23 78 ea 3d 85 a6 56 4a 9a 24
12 50 54 af cf 00 d1 c0 b3 00 95 00 81 80 81 c0
81 00 d1 00 d1 c1 56 5e 00 a0 a0 a0 29 50 30 20
35 00 55 50 21 00 00 1e 00 00 00 fc 00 54 37 30
30 30 20 44 4f 0a 20 20 20 20 00 00 00 fd 00 32
4c 70 a5 1e 00 0a 20 20 20 20 20 20 00 00 00 ff
00 43 46 4d 45 30 32 43 32 38 32 31 33 33 01 99

02 03 1f f1 4c 01 02 03 04 05 07 90 12 13 14 16
1f 23 09 07 07 83 01 00 00 65 03 0c 00 10 00 02
3a 80 18 71 38 2d 40 58 2c 45 00 55 50 21 00 00
1e 15 1d 80 18 71 1c 16 20 58 2c 25 00 55 50 21
00 00 1e 01 1d 00 bc 52 d0 1e 20 b8 28 55 40 55
50 21 00 00 9e 8c 0a d0 8a 20 e0 2d 10 10 3e 96
00 55 50 21 00 00 18 00 00 00 00 00 00 00 00 00
00 00 00 00 00 00 00 00 00 00 00 00 00 00 00 96

00 ff ff ff ff ff ff 00 21 63 01 27 00 00 00 00
34 1b 01 03 80 3b 23 78 ea 3d 85 a6 56 4a 9a 24
12 50 54 af cf 00 d1 c0 b3 00 95 00 81 80 81 c0
81 00 d1 00 d1 c1 56 5e 00 a0 a0 a0 29 50 30 20
35 00 55 50 21 00 00 1e 00 00 00 fc 00 54 37 30
30 30 20 44 4f 0a 20 20 20 20 00 00 00 fd 00 32
4c 70 a5 1e 00 0a 20 20 20 20 20 20 00 00 00 ff
00 43 46 4d 45 30 32 43 32 38 32 31 33 33 01 99

02 03 1f f1 4c 01 02 03 04 05 07 90 12 13 14 16
1f 23 09 07 07 83 01 00 00 65 03 0c 00 10 00 02
3a 80 18 71 38 2d 40 58 2c 45 00 55 50 21 00 00
1e 15 1d 80 18 71 1c 16 20 58 2c 25 00 55 50 21
00 00 1e 01 1d 00 bc 52 d0 1e 20 b8 28 55 40 55
50 21 00 00 9e 8c 0a d0 8a 20 e0 2d 10 10 3e 96
00 55 50 21 00 00 18 00 00 00 00 00 00 00 00 00
00 00 00 00 00 00 00 00 00 00 00 00 00 00 00 96

----------------

Block 0, Base EDID:
  EDID Structure Version & Revision: 1.3
  Vendor & Product Identification:
    Manufacturer: HKC
    Model: 9985
    Made in: week 52 of 2017
  Basic Display Parameters & Features:
    Digital display
    Maximum image size: 59 cm x 35 cm
    Gamma: 2.20
    DPMS levels: Standby Suspend Off
    RGB color display
    First detailed timing is the preferred timing
  Color Characteristics:
    Red  : 0.6484, 0.3388
    Green: 0.2919, 0.6025
    Blue : 0.1425, 0.0703
    White: 0.3134, 0.3291
  Established Timings I & II:
    IBM     :   720x400    70.081663 Hz   9:5     31.467 kHz     28.320000 MHz
    DMT 0x04:   640x480    59.940476 Hz   4:3     31.469 kHz     25.175000 MHz
    DMT 0x05:   640x480    72.808802 Hz   4:3     37.861 kHz     31.500000 MHz
    DMT 0x06:   640x480    75.000000 Hz   4:3     37.500 kHz     31.500000 MHz
    DMT 0x08:   800x600    56.250000 Hz   4:3     35.156 kHz     36.000000 MHz
    DMT 0x09:   800x600    60.316541 Hz   4:3     37.879 kHz     40.000000 MHz
    DMT 0x0a:   800x600    72.187572 Hz   4:3     48.077 kHz     50.000000 MHz
    DMT 0x0b:   800x600    75.000000 Hz   4:3     46.875 kHz     49.500000 MHz
    DMT 0x10:  1024x768    60.003840 Hz   4:3     48.363 kHz     65.000000 MHz
    DMT 0x11:  1024x768    70.069359 Hz   4:3     56.476 kHz     75.000000 MHz
    DMT 0x12:  1024x768    75.028582 Hz   4:3     60.023 kHz     78.750000 MHz
    DMT 0x24:  1280x1024   75.024675 Hz   5:4     79.976 kHz    135.000000 MHz
  Standard Timings:
    DMT 0x52:  1920x1080   60.000000 Hz  16:9     67.500 kHz    148.500000 MHz
    DMT 0x3a:  1680x1050   59.954250 Hz  16:10    65.290 kHz    146.250000 MHz
    DMT 0x2f:  1440x900    59.887445 Hz  16:10    55.935 kHz    106.500000 MHz
    DMT 0x23:  1280x1024   60.019740 Hz   5:4     63.981 kHz    108.000000 MHz
    DMT 0x55:  1280x720    60.000000 Hz  16:9     45.000 kHz     74.250000 MHz
    DMT 0x1c:  1280x800    59.810326 Hz  16:10    49.702 kHz     83.500000 MHz
    DMT 0x45:  1920x1200   59.884600 Hz  16:10    74.556 kHz    193.250000 MHz
    GTF     :  1920x1080   60.999936 Hz  16:9     68.259 kHz    175.835000 MHz
  Detailed Timing Descriptors:
    DTD 1:  2560x1440   59.950550 Hz  16:9     88.787 kHz    241.500000 MHz (597 mm x 336 mm)
                 Hfront   48 Hsync  32 Hback   80 Hpol P
                 Vfront    3 Vsync   5 Vback   33 Vpol P
    Display Product Name: 'T7000 DO'
    Display Range Limits:
      Monitor ranges (GTF): 50-76 Hz V, 112-165 kHz H, max dotclock 300 MHz
    Display Product Serial Number: ...
  Extension blocks: 1
Checksum: 0x99

----------------

Block 1, CTA-861 Extension Block:
  Revision: 3
  Underscans IT Video Formats by default
  Basic audio support
  Supports YCbCr 4:4:4
  Supports YCbCr 4:2:2
  Native DTDs: 1
  Video Data Block:
    VIC   1:   640x480    59.940476 Hz   4:3     31.469 kHz     25.175000 MHz
    VIC   2:   720x480    59.940060 Hz   4:3     31.469 kHz     27.000000 MHz
    VIC   3:   720x480    59.940060 Hz  16:9     31.469 kHz     27.000000 MHz
    VIC   4:  1280x720    60.000000 Hz  16:9     45.000 kHz     74.250000 MHz
    VIC   5:  1920x1080i  60.000000 Hz  16:9     33.750 kHz     74.250000 MHz
    VIC   7:  1440x480i   59.940060 Hz  16:9     15.734 kHz     27.000000 MHz
    VIC  16:  1920x1080   60.000000 Hz  16:9     67.500 kHz    148.500000 MHz (native)
    VIC  18:   720x576    50.000000 Hz  16:9     31.250 kHz     27.000000 MHz
    VIC  19:  1280x720    50.000000 Hz  16:9     37.500 kHz     74.250000 MHz
    VIC  20:  1920x1080i  50.000000 Hz  16:9     28.125 kHz     74.250000 MHz
    VIC  22:  1440x576i   50.000000 Hz  16:9     15.625 kHz     27.000000 MHz
    VIC  31:  1920x1080   50.000000 Hz  16:9     56.250 kHz    148.500000 MHz
  Audio Data Block:
    Linear PCM:
      Max channels: 2
      Supported sample rates (kHz): 48 44.1 32
      Supported sample sizes (bits): 24 20 16
  Speaker Allocation Data Block:
    FL/FR - Front Left/Right
  Vendor-Specific Data Block (HDMI), OUI 00-0C-03:
    Source physical address: 1.0.0.0
  Detailed Timing Descriptors:
    DTD 2:  1920x1080   60.000000 Hz  16:9     67.500 kHz    148.500000 MHz (597 mm x 336 mm)
                 Hfront   88 Hsync  44 Hback  148 Hpol P
                 Vfront    4 Vsync   5 Vback   36 Vpol P
    DTD 3:  1920x540    60.215141 Hz  32:9     33.841 kHz     74.450000 MHz (597 mm x 336 mm)
                 Hfront   88 Hsync  44 Hback  148 Hpol P
                 Vfront    2 Vsync   5 Vback   15 Vpol P
    DTD 4:  1280x1440i  49.966689 Hz   8:9     37.500 kHz     74.250000 MHz (597 mm x 336 mm)
                 Hfront  440 Hsync  40 Hback  220 Hpol P
                 Vfront    5 Vsync   5 Vback   20 Vpol P Vfront +0.5 Odd Field
                 Vfront    5 Vsync   5 Vback   20 Vpol P Vback  +0.5 Even Field
    DTD 5:   720x480    59.940060 Hz   3:2     31.469 kHz     27.000000 MHz (597 mm x 336 mm)
                 Hfront   16 Hsync  62 Hback   60 Hpol N
                 Vfront    9 Vsync   6 Vback   30 Vpol N
Checksum: 0x96  Unused space in Extension Block: 24 bytes

----------------

Warnings:

Block 1, CTA-861 Extension Block:
  Video Data Block: VIC 1 and the first DTD are not identical. Is this intended?
  Video Data Block: All VICs are in ascending order, and the first (preferred) VIC <= 4, is that intended?
  Detailed Timing Descriptor #3: Image size is 597x336 mm, but based on the picture AR it should be 597x167 mm.
  Detailed Timing Descriptor #4: Image size is 597x336 mm, but based on the picture AR it should be 298x336 mm.
  Detailed Timing Descriptor #5: Image size is 597x336 mm, but based on the picture AR it should be 504x336 mm.
  Add a Colorimetry Data Block with the sRGB colorimetry bit set to avoid interop issues.
EDID:
  Base EDID: Some timings are out of range of the Monitor Ranges:
    Horizontal Freq: 15.625 - 88.786 kHz (Monitor: 112.000 - 165.000 kHz)

Failures:

Block 1, CTA-861 Extension Block:
  Missing VCDB, needed for Set Selectable RGB Quantization to avoid interop issues.
EDID:
  Extension Block 2 started with EDID header, ignoring Extension Blocks >= 2.
  CTA-861: Native progressive timings are a mix of several resolutions.

EDID conformity: FAIL
