edid-decode (hex):

00 ff ff ff ff ff ff 00 63 18 80 23 01 01 01 01
2e 20 01 03 80 35 1d 78 2a 2a 15 aa 54 49 9f 24
14 50 54 a7 cf 80 71 4f 81 80 81 8a 81 8f 95 00
a9 c0 b3 00 d1 c0 02 3a 80 18 71 38 2d 40 58 2c
45 00 0f 28 21 00 00 1e 00 00 00 fd 00 30 64 1e
72 17 00 0a 20 20 20 20 20 20 00 00 00 fc 00 43
52 32 32 30 41 55 0a 20 20 20 20 20 00 00 00 ff
00 30 30 30 30 30 30 30 31 0a 20 20 20 20 01 6e

02 03 1b f1 46 04 1f 13 12 03 10 23 09 07 07 83
01 00 00 67 03 0c 00 10 00 08 32 01 1d 00 72 51
d0 1e 20 6e 28 55 00 0f 28 21 00 00 1e 66 21 56
aa 51 00 1e 30 46 8f 33 00 0f 28 21 00 00 1a ab
22 a0 a0 50 84 1a 30 30 20 36 00 0f 28 21 00 00
7f 7c 2e 90 a0 60 1a 1e 40 30 20 36 00 0f 28 21
00 00 7f 10 59 80 a0 70 38 14 40 30 20 35 00 0f
28 21 00 00 1e 00 00 00 00 00 00 00 00 00 00 c9

00 ff ff ff ff ff ff 00 63 18 80 23 01 01 01 01
2e 20 01 03 80 35 1d 78 2a 2a 15 aa 54 49 9f 24
14 50 54 a7 cf 80 71 4f 81 80 81 8a 81 8f 95 00
a9 c0 b3 00 d1 c0 02 3a 80 18 71 38 2d 40 58 2c
45 00 0f 28 21 00 00 1e 00 00 00 fd 00 30 64 1e
72 17 00 0a 20 20 20 20 20 20 00 00 00 fc 00 43
52 32 32 30 41 55 0a 20 20 20 20 20 00 00 00 ff
00 30 30 30 30 30 30 30 31 0a 20 20 20 20 01 6e

02 03 1b f1 46 04 1f 13 12 03 10 23 09 07 07 83
01 00 00 67 03 0c 00 10 00 08 32 01 1d 00 72 51
d0 1e 20 6e 28 55 00 0f 28 21 00 00 1e 66 21 56
aa 51 00 1e 30 46 8f 33 00 0f 28 21 00 00 1a ab
22 a0 a0 50 84 1a 30 30 20 36 00 0f 28 21 00 00
7f 7c 2e 90 a0 60 1a 1e 40 30 20 36 00 0f 28 21
00 00 7f 10 59 80 a0 70 38 14 40 30 20 35 00 0f
28 21 00 00 1e 00 00 00 00 00 00 00 00 00 00 c9

----------------

Block 0, Base EDID:
  EDID Structure Version & Revision: 1.3
  Vendor & Product Identification:
    Manufacturer: XXX
    Model: 9088
    Serial Number: ...
    Made in: week 46 of 2022
  Basic Display Parameters & Features:
    Digital display
    Maximum image size: 53 cm x 29 cm
    Gamma: 2.20
    DPMS levels: Off
    RGB color display
    First detailed timing is the preferred timing
  Color Characteristics:
    Red  : 0.6640, 0.3300
    Green: 0.2871, 0.6230
    Blue : 0.1406, 0.0791
    White: 0.3134, 0.3291
  Established Timings I & II:
    IBM     :   720x400    70.081663 Hz   9:5     31.467 kHz     28.320000 MHz
    DMT 0x04:   640x480    59.940476 Hz   4:3     31.469 kHz     25.175000 MHz
    DMT 0x06:   640x480    75.000000 Hz   4:3     37.500 kHz     31.500000 MHz
    DMT 0x08:   800x600    56.250000 Hz   4:3     35.156 kHz     36.000000 MHz
    DMT 0x09:   800x600    60.316541 Hz   4:3     37.879 kHz     40.000000 MHz
    DMT 0x0a:   800x600    72.187572 Hz   4:3     48.077 kHz     50.000000 MHz
    DMT 0x0b:   800x600    75.000000 Hz   4:3     46.875 kHz     49.500000 MHz
    DMT 0x10:  1024x768    60.003840 Hz   4:3     48.363 kHz     65.000000 MHz
    DMT 0x11:  1024x768    70.069359 Hz   4:3     56.476 kHz     75.000000 MHz
    DMT 0x12:  1024x768    75.028582 Hz   4:3     60.023 kHz     78.750000 MHz
    DMT 0x24:  1280x1024   75.024675 Hz   5:4     79.976 kHz    135.000000 MHz
    Apple   :  1152x870    75.061550 Hz 192:145   68.681 kHz    100.000000 MHz
  Standard Timings:
    DMT 0x15:  1152x864    75.000000 Hz   4:3     67.500 kHz    108.000000 MHz
    DMT 0x23:  1280x1024   60.019740 Hz   5:4     63.981 kHz    108.000000 MHz
    GTF     :  1280x1024   69.999805 Hz   5:4     74.620 kHz    128.943000 MHz
    DMT 0x24:  1280x1024   75.024675 Hz   5:4     79.976 kHz    135.000000 MHz
    DMT 0x2f:  1440x900    59.887445 Hz  16:10    55.935 kHz    106.500000 MHz
    DMT 0x53:  1600x900    60.000000 Hz  16:9     60.000 kHz    108.000000 MHz (RB)
    DMT 0x3a:  1680x1050   59.954250 Hz  16:10    65.290 kHz    146.250000 MHz
    DMT 0x52:  1920x1080   60.000000 Hz  16:9     67.500 kHz    148.500000 MHz
  Detailed Timing Descriptors:
    DTD 1:  1920x1080   60.000000 Hz  16:9     67.500 kHz    148.500000 MHz (527 mm x 296 mm)
                 Hfront   88 Hsync  44 Hback  148 Hpol P
                 Vfront    4 Vsync   5 Vback   36 Vpol P
    Display Range Limits:
      Monitor ranges (GTF): 48-100 Hz V, 30-114 kHz H, max dotclock 230 MHz
    Display Product Name: 'CR220AU'
    Display Product Serial Number: ...
  Extension blocks: 1
Checksum: 0x6e

----------------

Block 1, CTA-861 Extension Block:
  Revision: 3
  Underscans IT Video Formats by default
  Basic audio support
  Supports YCbCr 4:4:4
  Supports YCbCr 4:2:2
  Native DTDs: 1
  Video Data Block:
    VIC   4:  1280x720    60.000000 Hz  16:9     45.000 kHz     74.250000 MHz
    VIC  31:  1920x1080   50.000000 Hz  16:9     56.250 kHz    148.500000 MHz
    VIC  19:  1280x720    50.000000 Hz  16:9     37.500 kHz     74.250000 MHz
    VIC  18:   720x576    50.000000 Hz  16:9     31.250 kHz     27.000000 MHz
    VIC   3:   720x480    59.940060 Hz  16:9     31.469 kHz     27.000000 MHz
    VIC  16:  1920x1080   60.000000 Hz  16:9     67.500 kHz    148.500000 MHz
  Audio Data Block:
    Linear PCM:
      Max channels: 2
      Supported sample rates (kHz): 48 44.1 32
      Supported sample sizes (bits): 24 20 16
  Speaker Allocation Data Block:
    FL/FR - Front Left/Right
  Vendor-Specific Data Block (HDMI), OUI 00-0C-03:
    Source physical address: 1.0.0.0
    DC_Y444
    Maximum TMDS clock: 250 MHz
  Detailed Timing Descriptors:
    DTD 2:  1280x720    60.000000 Hz  16:9     45.000 kHz     74.250000 MHz (527 mm x 296 mm)
                 Hfront  110 Hsync  40 Hback  220 Hpol P
                 Vfront    5 Vsync   5 Vback   20 Vpol P
    DTD 3:  1366x768    59.789541 Hz 683:384   47.712 kHz     85.500000 MHz (527 mm x 296 mm)
                 Hfront   70 Hsync 143 Hback  213 Hpol P
                 Vfront    3 Vsync   3 Vback   24 Vpol N
    DTD 4:  1440x900    59.901458 Hz  16:10    55.469 kHz     88.750000 MHz (side by side interleaved, 527 mm x 296 mm)
                 Hfront   48 Hsync  32 Hback   80 Hpol P
                 Vfront    3 Vsync   6 Vback   17 Vpol P
    DTD 5:  1680x1050   59.883253 Hz  16:10    64.674 kHz    119.000000 MHz (side by side interleaved, 527 mm x 296 mm)
                 Hfront   48 Hsync  32 Hback   80 Hpol P
                 Vfront    3 Vsync   6 Vback   21 Vpol P
    DTD 6:  1920x1080   99.650350 Hz  16:9    109.615 kHz    228.000000 MHz (527 mm x 296 mm)
                 Hfront   48 Hsync  32 Hback   80 Hpol P
                 Vfront    3 Vsync   5 Vback   12 Vpol P
Checksum: 0xc9  Unused space in Extension Block: 10 bytes

----------------

Warnings:

Block 0, Base EDID:
  Vendor & Product Identification: The serial number is one of the known dummy values, it should probably be set to 0.
  Display Product Serial Number: ...
Block 1, CTA-861 Extension Block:
  Video Data Block: VIC 4 and the first DTD are not identical. Is this intended?
  Detailed Timing Descriptor #3: DTD is similar but not identical to DMT 0x51.
  Detailed Timing Descriptor #4: DTD is similar but not identical to DMT 0x2e.
  Detailed Timing Descriptor #4: Image size is 527x296 mm, but based on the picture AR it should be 473x296 mm.
  Detailed Timing Descriptor #5: DTD is similar but not identical to DMT 0x39.
  Detailed Timing Descriptor #5: Image size is 527x296 mm, but based on the picture AR it should be 473x296 mm.
  Display Product Serial Number is set, so the Serial Number in the Base EDID should be 0.
  Add a Colorimetry Data Block with the sRGB colorimetry bit set to avoid interop issues.

Failures:

Block 1, CTA-861 Extension Block:
  Missing VCDB, needed for Set Selectable RGB Quantization to avoid interop issues.
EDID:
  Extension Block 2 started with EDID header, ignoring Extension Blocks >= 2.

EDID conformity: FAIL
