edid-decode (hex):

00 ff ff ff ff ff ff 00 4d 67 25 32 01 00 00 00
17 22 01 03 80 46 27 78 2a 2f 45 ae 4e 43 a3 26
0f 50 54 a5 4e 00 81 c0 81 40 81 80 b3 00 a9 c0
d1 c0 01 01 01 01 02 3a 80 18 71 38 2d 40 30 20
45 00 58 4a 21 00 00 1e 66 21 50 b0 51 00 1b 30
40 70 36 00 20 2f 21 00 00 1e 00 00 00 fd 00 30
f2 1e ff 3c 00 0a 20 20 20 20 20 20 00 00 00 fc
00 48 33 32 53 31 37 46 0a 20 20 20 20 20 01 ca

02 03 41 f1 4c 03 12 07 16 04 13 10 1f 05 94 01
3f 23 09 07 07 83 01 00 00 68 03 0c 00 10 00 38
3c 00 68 1a 00 00 01 01 30 f0 ed e3 05 e3 01 67
d8 5d c4 01 78 80 00 e6 06 07 01 60 60 03 e2 00
d5 7c dd 80 c8 70 38 21 40 30 40 35 00 20 2f 21
00 00 1a 2b 81 80 a0 70 38 18 40 30 20 35 00 20
2f 21 00 00 1e 86 6f 80 a0 70 38 40 40 30 20 35
00 20 2f 21 00 00 1e 00 00 00 00 00 00 00 00 47

00 ff ff ff ff ff ff 00 4d 67 25 32 01 00 00 00
17 22 01 03 80 46 27 78 2a 2f 45 ae 4e 43 a3 26
0f 50 54 a5 4e 00 81 c0 81 40 81 80 b3 00 a9 c0
d1 c0 01 01 01 01 02 3a 80 18 71 38 2d 40 30 20
45 00 58 4a 21 00 00 1e 66 21 50 b0 51 00 1b 30
40 70 36 00 20 2f 21 00 00 1e 00 00 00 fd 00 30
f2 1e ff 3c 00 0a 20 20 20 20 20 20 00 00 00 fc
00 48 33 32 53 31 37 46 0a 20 20 20 20 20 01 ca

02 03 41 f1 4c 03 12 07 16 04 13 10 1f 05 94 01
3f 23 09 07 07 83 01 00 00 68 03 0c 00 10 00 38
3c 00 68 1a 00 00 01 01 30 f0 ed e3 05 e3 01 67
d8 5d c4 01 78 80 00 e6 06 07 01 60 60 03 e2 00
d5 7c dd 80 c8 70 38 21 40 30 40 35 00 20 2f 21
00 00 1a 2b 81 80 a0 70 38 18 40 30 20 35 00 20
2f 21 00 00 1e 86 6f 80 a0 70 38 40 40 30 20 35
00 20 2f 21 00 00 1e 00 00 00 00 00 00 00 00 47

----------------

Block 0, Base EDID:
  EDID Structure Version & Revision: 1.3
  Vendor & Product Identification:
    Manufacturer: SKG
    Model: 12837
    Serial Number: ...
    Made in: week 23 of 2024
  Basic Display Parameters & Features:
    Digital display
    Maximum image size: 70 cm x 39 cm
    Gamma: 2.20
    DPMS levels: Off
    RGB color display
    First detailed timing is the preferred timing
  Color Characteristics:
    Red  : 0.6796, 0.3066
    Green: 0.2646, 0.6396
    Blue : 0.1494, 0.0585
    White: 0.3134, 0.3291
  Established Timings I & II:
    IBM     :   720x400    70.081663 Hz   9:5     31.467 kHz     28.320000 MHz
    DMT 0x04:   640x480    59.940476 Hz   4:3     31.469 kHz     25.175000 MHz
    DMT 0x06:   640x480    75.000000 Hz   4:3     37.500 kHz     31.500000 MHz
    DMT 0x09:   800x600    60.316541 Hz   4:3     37.879 kHz     40.000000 MHz
    DMT 0x0b:   800x600    75.000000 Hz   4:3     46.875 kHz     49.500000 MHz
    DMT 0x10:  1024x768    60.003840 Hz   4:3     48.363 kHz     65.000000 MHz
    DMT 0x11:  1024x768    70.069359 Hz   4:3     56.476 kHz     75.000000 MHz
    DMT 0x12:  1024x768    75.028582 Hz   4:3     60.023 kHz     78.750000 MHz
  Standard Timings:
    DMT 0x55:  1280x720    60.000000 Hz  16:9     45.000 kHz     74.250000 MHz
    DMT 0x20:  1280x960    60.000000 Hz   4:3     60.000 kHz    108.000000 MHz
    DMT 0x23:  1280x1024   60.019740 Hz   5:4     63.981 kHz    108.000000 MHz
    DMT 0x3a:  1680x1050   59.954250 Hz  16:10    65.290 kHz    146.250000 MHz
    DMT 0x53:  1600x900    60.000000 Hz  16:9     60.000 kHz    108.000000 MHz (RB)
    DMT 0x52:  1920x1080   60.000000 Hz  16:9     67.500 kHz    148.500000 MHz
  Detailed Timing Descriptors:
    DTD 1:  1920x1080   60.000000 Hz  16:9     67.500 kHz    148.500000 MHz (600 mm x 330 mm)
                 Hfront   48 Hsync  32 Hback  200 Hpol P
                 Vfront    4 Vsync   5 Vback   36 Vpol P
    DTD 2:  1360x768    60.015162 Hz  85:48    47.712 kHz     85.500000 MHz (544 mm x 303 mm)
                 Hfront   64 Hsync 112 Hback  256 Hpol P
                 Vfront    3 Vsync   6 Vback   18 Vpol P
    Display Range Limits:
      Monitor ranges (GTF): 48-242 Hz V, 30-255 kHz H, max dotclock 600 MHz
    Display Product Name: 'H32S17F'
  Extension blocks: 1
Checksum: 0xca

----------------

Block 1, CTA-861 Extension Block:
  Revision: 3
  Underscans IT Video Formats by default
  Basic audio support
  Supports YCbCr 4:4:4
  Supports YCbCr 4:2:2
  Native DTDs: 1
  Video Data Block:
    VIC   3:   720x480    59.940060 Hz  16:9     31.469 kHz     27.000000 MHz
    VIC  18:   720x576    50.000000 Hz  16:9     31.250 kHz     27.000000 MHz
    VIC   7:  1440x480i   59.940060 Hz  16:9     15.734 kHz     27.000000 MHz
    VIC  22:  1440x576i   50.000000 Hz  16:9     15.625 kHz     27.000000 MHz
    VIC   4:  1280x720    60.000000 Hz  16:9     45.000 kHz     74.250000 MHz
    VIC  19:  1280x720    50.000000 Hz  16:9     37.500 kHz     74.250000 MHz
    VIC  16:  1920x1080   60.000000 Hz  16:9     67.500 kHz    148.500000 MHz
    VIC  31:  1920x1080   50.000000 Hz  16:9     56.250 kHz    148.500000 MHz
    VIC   5:  1920x1080i  60.000000 Hz  16:9     33.750 kHz     74.250000 MHz
    VIC  20:  1920x1080i  50.000000 Hz  16:9     28.125 kHz     74.250000 MHz (native)
    VIC   1:   640x480    59.940476 Hz   4:3     31.469 kHz     25.175000 MHz
    VIC  63:  1920x1080  120.000000 Hz  16:9    135.000 kHz    297.000000 MHz
  Audio Data Block:
    Linear PCM:
      Max channels: 2
      Supported sample rates (kHz): 48 44.1 32
      Supported sample sizes (bits): 24 20 16
  Speaker Allocation Data Block:
    FL/FR - Front Left/Right
  Vendor-Specific Data Block (HDMI), OUI 00-0C-03:
    Source physical address: 1.0.0.0
    DC_36bit
    DC_30bit
    DC_Y444
    Maximum TMDS clock: 300 MHz
  Vendor-Specific Data Block (AMD), OUI 00-00-1A:
    Version: 1
    Feature Caps: 0x01
    Minimum Refresh Rate: 48 Hz
    Maximum Refresh Rate: 240 Hz
    Flags 1.x: 0xed (MCCS)
  Colorimetry Data Block:
    xvYCC601
    xvYCC709
    BT2020cYCC
    BT2020YCC
    BT2020RGB
    Gamut Boundary Description Metadata Profile P0
  Vendor-Specific Data Block (HDMI Forum), OUI C4-5D-D8:
    Version: 1
    Maximum TMDS Character Rate: 600 MHz
    SCDC Present
  HDR Static Metadata Data Block:
    Electro optical transfer functions:
      Traditional gamma - SDR luminance range
      Traditional gamma - HDR luminance range
      SMPTE ST2084
    Supported static metadata descriptors:
      Static metadata type 1
    Desired content max luminance: 96 (400.000 cd/m^2)
    Desired content max frame-average luminance: 96 (400.000 cd/m^2)
    Desired content min luminance: 3 (0.001 cd/m^2)
  Video Capability Data Block:
    YCbCr quantization: Selectable (via AVI YQ)
    RGB quantization: Selectable (via AVI Q)
    PT scan behavior: Always Overscanned
    IT scan behavior: Always Overscanned
    CE scan behavior: Always Overscanned
  Detailed Timing Descriptors:
    DTD 3:  1920x1080  240.299039 Hz  16:9    267.453 kHz    567.000000 MHz (544 mm x 303 mm)
                 Hfront   48 Hsync  64 Hback   88 Hpol P
                 Vfront    3 Vsync   5 Vback   25 Vpol N
    DTD 4:  1920x1080  143.999965 Hz  16:9    158.976 kHz    330.670000 MHz (544 mm x 303 mm)
                 Hfront   48 Hsync  32 Hback   80 Hpol P
                 Vfront    3 Vsync   5 Vback   16 Vpol P
    DTD 5:  1920x1080  119.982181 Hz  16:9    137.260 kHz    285.500000 MHz (544 mm x 303 mm)
                 Hfront   48 Hsync  32 Hback   80 Hpol P
                 Vfront    3 Vsync   5 Vback   56 Vpol P
Checksum: 0x47  Unused space in Extension Block: 8 bytes

----------------

Warnings:

Block 0, Base EDID:
  Vendor & Product Identification: The serial number is one of the known dummy values, it should probably be set to 0.
  Detailed Timing Descriptor #1: DTD is similar but not identical to VIC 16.
Block 1, CTA-861 Extension Block:
  Video Data Block: VIC 3 and the first DTD are not identical. Is this intended?
  Colorimetry Data Block: Set the sRGB colorimetry bit to avoid interop issues.
  Video Capability Data Block: IT scan behavior is expected to support underscanned.
  Video Capability Data Block: S_PT is equal to S_IT and S_CE, so should be set to 0 instead.
EDID:
  Base EDID: Some timings are out of range of the Monitor Ranges:
    Horizontal Freq: 15.625 - 267.452 kHz (Monitor: 30.000 - 510.000 kHz)

Failures:

Block 0, Base EDID:
  Detailed Timing Descriptor #1: Mismatch of image size 600x330 mm vs display size 700x390 mm.
  Detailed Timing Descriptor #2: Mismatch of image size 544x303 mm vs display size 700x390 mm.
Block 1, CTA-861 Extension Block:
  Vendor-Specific Data Block (HDMI Forum), OUI C4-5D-D8: HDMI Forum VSDB did not immediately follow the HDMI VSDB.
  Video Capability Data Block: IT video formats are always overscanned, but bit 7 of Byte 3 of the CTA-861 Extension header is set to underscanned.
  Detailed Timing Descriptor #3: Mismatch of image size 544x303 mm vs display size 700x390 mm.
  Detailed Timing Descriptor #4: Mismatch of image size 544x303 mm vs display size 700x390 mm.
  Detailed Timing Descriptor #5: Mismatch of image size 544x303 mm vs display size 700x390 mm.
EDID:
  Extension Block 2 started with EDID header, ignoring Extension Blocks >= 2.

EDID conformity: FAIL
