edid-decode (hex):

00 ff ff ff ff ff ff 00 38 a3 62 2c 01 01 01 01
08 1c 01 03 80 34 20 78 ea 02 85 a5 56 54 9d 25
0e 50 54 23 08 00 81 00 81 40 81 80 81 c0 95 00
90 40 b3 00 d1 c0 28 3c 80 a0 70 b0 23 40 30 20
36 00 07 44 21 00 00 1a 00 00 00 fd 00 38 3d 1f
4d 11 00 0a 20 20 20 20 20 20 00 00 00 fc 00 45
32 34 35 57 4d 69 0a 20 20 20 20 20 00 00 00 ff
00 38 32 31 30 34 33 32 32 54 42 0a 20 20 01 c4

02 01 04 00 01 1d 00 72 51 d0 1e 20 6e 28 55 00
07 44 21 00 00 1e 8c 0a d0 8a 20 e0 2d 10 10 3e
96 00 07 44 21 00 00 18 02 3a 80 18 71 38 2d 40
58 2c 45 00 07 44 21 00 00 1e 00 00 00 00 00 00
00 00 00 00 00 00 00 00 00 00 00 00 00 00 00 00
00 00 00 00 00 00 00 00 00 00 00 00 00 00 00 00
00 00 00 00 00 00 00 00 00 00 00 00 00 00 00 00
00 00 00 00 00 00 00 00 00 00 00 00 00 00 00 c3

00 ff ff ff ff ff ff 00 38 a3 62 2c 01 01 01 01
08 1c 01 03 80 34 20 78 ea 02 85 a5 56 54 9d 25
0e 50 54 23 08 00 81 00 81 40 81 80 81 c0 95 00
90 40 b3 00 d1 c0 28 3c 80 a0 70 b0 23 40 30 20
36 00 07 44 21 00 00 1a 00 00 00 fd 00 38 3d 1f
4d 11 00 0a 20 20 20 20 20 20 00 00 00 fc 00 45
32 34 35 57 4d 69 0a 20 20 20 20 20 00 00 00 ff
00 38 32 31 30 34 33 32 32 54 42 0a 20 20 01 c4

02 01 04 00 01 1d 00 72 51 d0 1e 20 6e 28 55 00
07 44 21 00 00 1e 8c 0a d0 8a 20 e0 2d 10 10 3e
96 00 07 44 21 00 00 18 02 3a 80 18 71 38 2d 40
58 2c 45 00 07 44 21 00 00 1e 00 00 00 00 00 00
00 00 00 00 00 00 00 00 00 00 00 00 00 00 00 00
00 00 00 00 00 00 00 00 00 00 00 00 00 00 00 00
00 00 00 00 00 00 00 00 00 00 00 00 00 00 00 00
00 00 00 00 00 00 00 00 00 00 00 00 00 00 00 c3

----------------

Block 0, Base EDID:
  EDID Structure Version & Revision: 1.3
  Vendor & Product Identification:
    Manufacturer: NEC
    Model: 11362
    Serial Number: ...
    Made in: week 8 of 2018
  Basic Display Parameters & Features:
    Digital display
    Maximum image size: 52 cm x 32 cm
    Gamma: 2.20
    DPMS levels: Standby Suspend Off
    RGB color display
    First detailed timing is the preferred timing
  Color Characteristics:
    Red  : 0.6445, 0.3359
    Green: 0.3281, 0.6152
    Blue : 0.1464, 0.0546
    White: 0.3134, 0.3291
  Established Timings I & II:
    DMT 0x04:   640x480    59.940476 Hz   4:3     31.469 kHz     25.175000 MHz
    DMT 0x08:   800x600    56.250000 Hz   4:3     35.156 kHz     36.000000 MHz
    DMT 0x09:   800x600    60.316541 Hz   4:3     37.879 kHz     40.000000 MHz
    DMT 0x10:  1024x768    60.003840 Hz   4:3     48.363 kHz     65.000000 MHz
  Standard Timings:
    DMT 0x1c:  1280x800    59.810326 Hz  16:10    49.702 kHz     83.500000 MHz
    DMT 0x20:  1280x960    60.000000 Hz   4:3     60.000 kHz    108.000000 MHz
    DMT 0x23:  1280x1024   60.019740 Hz   5:4     63.981 kHz    108.000000 MHz
    DMT 0x55:  1280x720    60.000000 Hz  16:9     45.000 kHz     74.250000 MHz
    DMT 0x2f:  1440x900    59.887445 Hz  16:10    55.935 kHz    106.500000 MHz
    DMT 0x2a:  1400x1050   59.978442 Hz   4:3     65.317 kHz    121.750000 MHz
    DMT 0x3a:  1680x1050   59.954250 Hz  16:10    65.290 kHz    146.250000 MHz
    DMT 0x52:  1920x1080   60.000000 Hz  16:9     67.500 kHz    148.500000 MHz
  Detailed Timing Descriptors:
    DTD 1:  1920x1200   59.950171 Hz  16:10    74.038 kHz    154.000000 MHz (519 mm x 324 mm)
                 Hfront   48 Hsync  32 Hback   80 Hpol P
                 Vfront    3 Vsync   6 Vback   26 Vpol N
    Display Range Limits:
      Monitor ranges (GTF): 56-61 Hz V, 31-77 kHz H, max dotclock 170 MHz
    Display Product Name: 'E245WMi'
    Display Product Serial Number: ...
  Extension blocks: 1
Checksum: 0xc4

----------------

Block 1, CTA-861 Extension Block:
  Revision: 1
  Detailed Timing Descriptors:
    DTD 2:  1280x720    60.000000 Hz  16:9     45.000 kHz     74.250000 MHz (519 mm x 324 mm)
                 Hfront  110 Hsync  40 Hback  220 Hpol P
                 Vfront    5 Vsync   5 Vback   20 Vpol P
    DTD 3:   720x480    59.940060 Hz   3:2     31.469 kHz     27.000000 MHz (519 mm x 324 mm)
                 Hfront   16 Hsync  62 Hback   60 Hpol N
                 Vfront    9 Vsync   6 Vback   30 Vpol N
    DTD 4:  1920x1080   60.000000 Hz  16:9     67.500 kHz    148.500000 MHz (519 mm x 324 mm)
                 Hfront   88 Hsync  44 Hback  148 Hpol P
                 Vfront    4 Vsync   5 Vback   36 Vpol P
Checksum: 0xc3  Unused space in Extension Block: 69 bytes

----------------

Warnings:

Block 0, Base EDID:
  Vendor & Product Identification: The serial number is one of the known dummy values, it should probably be set to 0.
Block 1, CTA-861 Extension Block:
  Detailed Timing Descriptor #2: DTD is identical to VIC 4, which is not present in the CTA Ext Block.
  Detailed Timing Descriptor #2: Image size is 519x324 mm, but based on the picture AR it should be 519x291 mm.
  Detailed Timing Descriptor #3: Image size is 519x324 mm, but based on the picture AR it should be 486x324 mm.
  Detailed Timing Descriptor #4: DTD is identical to VIC 16, which is not present in the CTA Ext Block.
  Detailed Timing Descriptor #4: Image size is 519x324 mm, but based on the picture AR it should be 519x291 mm.
  Display Product Serial Number is set, so the Serial Number in the Base EDID should be 0.
  Add a Colorimetry Data Block with the sRGB colorimetry bit set to avoid interop issues.

Failures:

Block 1, CTA-861 Extension Block:
  Missing VCDB, needed for Set Selectable RGB Quantization to avoid interop issues.
EDID:
  Extension Block 2 started with EDID header, ignoring Extension Blocks >= 2.

EDID conformity: FAIL
