edid-decode (hex):

00 ff ff ff ff ff ff 00 1e 6d 5e 57 01 01 01 01
0a 13 01 04 a5 30 1b 78 e2 ae c5 a2 57 4a 9c 25
12 50 54 a5 4b 00 b3 00 81 80 81 8f 71 4f 01 01
01 01 01 01 01 01 02 3a 80 18 71 38 2d 40 58 2c
45 00 dd 0c 11 00 00 1a 21 39 90 30 62 1a 27 40
68 b0 36 00 dd 0c 11 00 00 1c 00 00 00 fd 00 38
4b 1e 53 0f 00 0a 20 20 20 20 20 20 00 00 00 fc
00 57 32 32 34 33 43 0a 20 20 20 20 20 20 00 90

00 ff ff ff ff ff ff 00 1e 6d 5e 57 01 01 01 01
0a 13 01 04 a5 30 1b 78 e2 ae c5 a2 57 4a 9c 25
12 50 54 a5 4b 00 b3 00 81 80 81 8f 71 4f 01 01
01 01 01 01 01 01 02 3a 80 18 71 38 2d 40 58 2c
45 00 dd 0c 11 00 00 1a 21 39 90 30 62 1a 27 40
68 b0 36 00 dd 0c 11 00 00 1c 00 00 00 fd 00 38
4b 1e 53 0f 00 0a 20 20 20 20 20 20 00 00 00 fc
00 57 32 32 34 33 43 0a 20 20 20 20 20 20 00 90

----------------

Block 0, Base EDID:
  EDID Structure Version & Revision: 1.4
  Vendor & Product Identification:
    Manufacturer: GSM
    Model: 22366
    Serial Number: ...
    Made in: week 10 of 2009
  Basic Display Parameters & Features:
    Digital display
    Bits per primary color channel: 8
    DisplayPort interface
    Maximum image size: 48 cm x 27 cm
    Gamma: 2.20
    DPMS levels: Standby Suspend Off
    Supported color formats: RGB 4:4:4
    First detailed timing includes the native pixel format and preferred refresh rate
  Color Characteristics:
    Red  : 0.6347, 0.3417
    Green: 0.2919, 0.6113
    Blue : 0.1474, 0.0703
    White: 0.3134, 0.3291
  Established Timings I & II:
    IBM     :   720x400    70.081663 Hz   9:5     31.467 kHz     28.320000 MHz
    DMT 0x04:   640x480    59.940476 Hz   4:3     31.469 kHz     25.175000 MHz
    DMT 0x06:   640x480    75.000000 Hz   4:3     37.500 kHz     31.500000 MHz
    DMT 0x09:   800x600    60.316541 Hz   4:3     37.879 kHz     40.000000 MHz
    DMT 0x0b:   800x600    75.000000 Hz   4:3     46.875 kHz     49.500000 MHz
    DMT 0x10:  1024x768    60.003840 Hz   4:3     48.363 kHz     65.000000 MHz
    DMT 0x12:  1024x768    75.028582 Hz   4:3     60.023 kHz     78.750000 MHz
    DMT 0x24:  1280x1024   75.024675 Hz   5:4     79.976 kHz    135.000000 MHz
  Standard Timings:
    DMT 0x3a:  1680x1050   59.954250 Hz  16:10    65.290 kHz    146.250000 MHz
    DMT 0x23:  1280x1024   60.019740 Hz   5:4     63.981 kHz    108.000000 MHz
    DMT 0x24:  1280x1024   75.024675 Hz   5:4     79.976 kHz    135.000000 MHz
    DMT 0x15:  1152x864    75.000000 Hz   4:3     67.500 kHz    108.000000 MHz
  Detailed Timing Descriptors:
    DTD 1:  1920x1080   60.000000 Hz  16:9     67.500 kHz    148.500000 MHz (477 mm x 268 mm)
                 Hfront   88 Hsync  44 Hback  148 Hpol P
                 Vfront    4 Vsync   5 Vback   36 Vpol N
    DTD 2:  1680x1050   59.954250 Hz  16:10    65.290 kHz    146.250000 MHz (477 mm x 268 mm)
                 Hfront  104 Hsync 176 Hback  280 Hpol N
                 Vfront    3 Vsync   6 Vback   30 Vpol P
    Display Range Limits:
      Monitor ranges (GTF): 56-75 Hz V, 30-83 kHz H, max dotclock 150 MHz
    Display Product Name: 'W2243C'
Checksum: 0x90

----------------

Block 1, Unknown EDID Extension Block 0x00:
  00 ff ff ff ff ff ff 00 1e 6d 5e 57 01 01 01 01 '.........m^W....'
  0a 13 01 04 a5 30 1b 78 e2 ae c5 a2 57 4a 9c 25 '.....0.x....WJ.%'
  12 50 54 a5 4b 00 b3 00 81 80 81 8f 71 4f 01 01 '.PT.K.......qO..'
  01 01 01 01 01 01 02 3a 80 18 71 38 2d 40 58 2c '.......:..q8-@X,'
  45 00 dd 0c 11 00 00 1a 21 39 90 30 62 1a 27 40 'E.......!9.0b.'@'
  68 b0 36 00 dd 0c 11 00 00 1c 00 00 00 fd 00 38 'h.6............8'
  4b 1e 53 0f 00 0a 20 20 20 20 20 20 00 00 00 fc 'K.S...      ....'
  00 57 32 32 34 33 43 0a 20 20 20 20 20 20 00 90 '.W2243C.      ..'
Checksum: 0x90

----------------

Warnings:

Block 0, Base EDID:
  Vendor & Product Identification: The serial number is one of the known dummy values, it should probably be set to 0.
  Detailed Timing Descriptor #1: DTD is similar but not identical to VIC 16.
  Detailed Timing Descriptor #2: Image size is 477x268 mm, but based on the picture AR it should be 477x298 mm.
  Display Range Limits: GTF support is deprecated in EDID 1.4.

Failures:

Block 0, Base EDID:
  Display Range Limits: GTF is supported, but the display does not support continuous frequencies.
Block 1, Base EDID:
  Unknown Extension Block.
EDID:
  Base EDID: EDID specified 0 extension block(s), but found 1 extension block(s).

EDID conformity: FAIL
