edid-decode (hex):

00 ff ff ff ff ff ff 00 04 72 66 05 5f ae 97 02
1d 1e 01 03 80 58 25 78 2a a1 95 a9 54 4d 9c 26
0f 50 54 bf ef 80 71 4f 81 40 81 80 81 c0 81 00
95 00 b3 00 d1 c0 4c c2 00 a0 f0 40 3a 60 08 20
c8 08 70 6f 31 00 00 1a 50 9a 00 a0 f0 40 2e 60
08 20 08 08 70 6f 31 00 00 1a 00 00 00 fd 00 1e
4b 1e 82 3c 00 0a 20 20 20 20 20 20 00 00 00 fc
00 41 63 65 72 20 58 52 33 38 32 43 51 4b 01 53

02 03 4c f1 50 01 03 04 12 13 05 14 1f 10 07 5a
5d 5e 5f 60 61 23 09 07 07 83 01 00 00 6d 03 0c
00 10 00 38 3c 20 00 60 01 02 03 67 d8 5d c4 01
78 80 03 68 1a 00 00 01 01 30 4b e6 e3 05 e3 01
e4 0f 00 80 01 e6 06 07 01 60 60 45 13 4c 00 a0
f0 40 17 60 08 20 98 00 70 6f 31 00 00 1a cd 46
00 a0 a0 38 1f 40 30 20 3a 00 70 6f 31 00 00 1a
00 00 00 00 00 00 00 00 00 00 00 00 00 00 00 d1

00 ff ff ff ff ff ff 00 04 72 66 05 5f ae 97 02
1d 1e 01 03 80 58 25 78 2a a1 95 a9 54 4d 9c 26
0f 50 54 bf ef 80 71 4f 81 40 81 80 81 c0 81 00
95 00 b3 00 d1 c0 4c c2 00 a0 f0 40 3a 60 08 20
c8 08 70 6f 31 00 00 1a 50 9a 00 a0 f0 40 2e 60
08 20 08 08 70 6f 31 00 00 1a 00 00 00 fd 00 1e
4b 1e 82 3c 00 0a 20 20 20 20 20 20 00 00 00 fc
00 41 63 65 72 20 58 52 33 38 32 43 51 4b 01 53

02 03 4c f1 50 01 03 04 12 13 05 14 1f 10 07 5a
5d 5e 5f 60 61 23 09 07 07 83 01 00 00 6d 03 0c
00 10 00 38 3c 20 00 60 01 02 03 67 d8 5d c4 01
78 80 03 68 1a 00 00 01 01 30 4b e6 e3 05 e3 01
e4 0f 00 80 01 e6 06 07 01 60 60 45 13 4c 00 a0
f0 40 17 60 08 20 98 00 70 6f 31 00 00 1a cd 46
00 a0 a0 38 1f 40 30 20 3a 00 70 6f 31 00 00 1a
00 00 00 00 00 00 00 00 00 00 00 00 00 00 00 d1

----------------

Block 0, Base EDID:
  EDID Structure Version & Revision: 1.3
  Vendor & Product Identification:
    Manufacturer: ACR
    Model: 1382
    Serial Number: ...
    Made in: week 29 of 2020
  Basic Display Parameters & Features:
    Digital display
    Maximum image size: 88 cm x 37 cm
    Gamma: 2.20
    DPMS levels: Off
    RGB color display
    First detailed timing is the preferred timing
  Color Characteristics:
    Red  : 0.6621, 0.3300
    Green: 0.3007, 0.6103
    Blue : 0.1503, 0.0595
    White: 0.3134, 0.3291
  Established Timings I & II:
    IBM     :   720x400    70.081663 Hz   9:5     31.467 kHz     28.320000 MHz
    DMT 0x04:   640x480    59.940476 Hz   4:3     31.469 kHz     25.175000 MHz
    Apple   :   640x480    66.666667 Hz   4:3     35.000 kHz     30.240000 MHz
    DMT 0x05:   640x480    72.808802 Hz   4:3     37.861 kHz     31.500000 MHz
    DMT 0x06:   640x480    75.000000 Hz   4:3     37.500 kHz     31.500000 MHz
    DMT 0x08:   800x600    56.250000 Hz   4:3     35.156 kHz     36.000000 MHz
    DMT 0x09:   800x600    60.316541 Hz   4:3     37.879 kHz     40.000000 MHz
    DMT 0x0a:   800x600    72.187572 Hz   4:3     48.077 kHz     50.000000 MHz
    DMT 0x0b:   800x600    75.000000 Hz   4:3     46.875 kHz     49.500000 MHz
    Apple   :   832x624    74.551266 Hz   4:3     49.726 kHz     57.284000 MHz
    DMT 0x10:  1024x768    60.003840 Hz   4:3     48.363 kHz     65.000000 MHz
    DMT 0x11:  1024x768    70.069359 Hz   4:3     56.476 kHz     75.000000 MHz
    DMT 0x12:  1024x768    75.028582 Hz   4:3     60.023 kHz     78.750000 MHz
    DMT 0x24:  1280x1024   75.024675 Hz   5:4     79.976 kHz    135.000000 MHz
    Apple   :  1152x870    75.061550 Hz 192:145   68.681 kHz    100.000000 MHz
  Standard Timings:
    DMT 0x15:  1152x864    75.000000 Hz   4:3     67.500 kHz    108.000000 MHz
    DMT 0x20:  1280x960    60.000000 Hz   4:3     60.000 kHz    108.000000 MHz
    DMT 0x23:  1280x1024   60.019740 Hz   5:4     63.981 kHz    108.000000 MHz
    DMT 0x55:  1280x720    60.000000 Hz  16:9     45.000 kHz     74.250000 MHz
    DMT 0x1c:  1280x800    59.810326 Hz  16:10    49.702 kHz     83.500000 MHz
    DMT 0x2f:  1440x900    59.887445 Hz  16:10    55.935 kHz    106.500000 MHz
    DMT 0x3a:  1680x1050   59.954250 Hz  16:10    65.290 kHz    146.250000 MHz
    DMT 0x52:  1920x1080   60.000000 Hz  16:9     67.500 kHz    148.500000 MHz
  Detailed Timing Descriptors:
    DTD 1:  3840x1600   75.000000 Hz  12:5    124.350 kHz    497.400000 MHz (880 mm x 367 mm)
                 Hfront    8 Hsync  32 Hback  120 Hpol P
                 Vfront   44 Vsync   8 Vback    6 Vpol N
    DTD 2:  3840x1600   60.000000 Hz  12:5     98.760 kHz    395.040000 MHz (880 mm x 367 mm)
                 Hfront    8 Hsync  32 Hback  120 Hpol P
                 Vfront   32 Vsync   8 Vback    6 Vpol N
    Display Range Limits:
      Monitor ranges (GTF): 30-75 Hz V, 30-130 kHz H, max dotclock 600 MHz
    Display Product Name: 'Acer XR382CQK'
  Extension blocks: 1
Checksum: 0x53

----------------

Block 1, CTA-861 Extension Block:
  Revision: 3
  Underscans IT Video Formats by default
  Basic audio support
  Supports YCbCr 4:4:4
  Supports YCbCr 4:2:2
  Native DTDs: 1
  Video Data Block:
    VIC   1:   640x480    59.940476 Hz   4:3     31.469 kHz     25.175000 MHz
    VIC   3:   720x480    59.940060 Hz  16:9     31.469 kHz     27.000000 MHz
    VIC   4:  1280x720    60.000000 Hz  16:9     45.000 kHz     74.250000 MHz
    VIC  18:   720x576    50.000000 Hz  16:9     31.250 kHz     27.000000 MHz
    VIC  19:  1280x720    50.000000 Hz  16:9     37.500 kHz     74.250000 MHz
    VIC   5:  1920x1080i  60.000000 Hz  16:9     33.750 kHz     74.250000 MHz
    VIC  20:  1920x1080i  50.000000 Hz  16:9     28.125 kHz     74.250000 MHz
    VIC  31:  1920x1080   50.000000 Hz  16:9     56.250 kHz    148.500000 MHz
    VIC  16:  1920x1080   60.000000 Hz  16:9     67.500 kHz    148.500000 MHz
    VIC   7:  1440x480i   59.940060 Hz  16:9     15.734 kHz     27.000000 MHz
    VIC  90:  2560x1080   60.000000 Hz  64:27    66.000 kHz    198.000000 MHz
    VIC  93:  3840x2160   24.000000 Hz  16:9     54.000 kHz    297.000000 MHz
    VIC  94:  3840x2160   25.000000 Hz  16:9     56.250 kHz    297.000000 MHz
    VIC  95:  3840x2160   30.000000 Hz  16:9     67.500 kHz    297.000000 MHz
    VIC  96:  3840x2160   50.000000 Hz  16:9    112.500 kHz    594.000000 MHz
    VIC  97:  3840x2160   60.000000 Hz  16:9    135.000 kHz    594.000000 MHz
  Audio Data Block:
    Linear PCM:
      Max channels: 2
      Supported sample rates (kHz): 48 44.1 32
      Supported sample sizes (bits): 24 20 16
  Speaker Allocation Data Block:
    FL/FR - Front Left/Right
  Vendor-Specific Data Block (HDMI), OUI 00-0C-03:
    Source physical address: 1.0.0.0
    DC_36bit
    DC_30bit
    DC_Y444
    Maximum TMDS clock: 300 MHz
    Extended HDMI video details:
      HDMI VICs:
        HDMI VIC 1:  3840x2160   30.000000 Hz  16:9     67.500 kHz    297.000000 MHz
        HDMI VIC 2:  3840x2160   25.000000 Hz  16:9     56.250 kHz    297.000000 MHz
        HDMI VIC 3:  3840x2160   24.000000 Hz  16:9     54.000 kHz    297.000000 MHz
  Vendor-Specific Data Block (HDMI Forum), OUI C4-5D-D8:
    Version: 1
    Maximum TMDS Character Rate: 600 MHz
    SCDC Present
    Supports 12-bits/component Deep Color 4:2:0 Pixel Encoding
    Supports 10-bits/component Deep Color 4:2:0 Pixel Encoding
  Vendor-Specific Data Block (AMD), OUI 00-00-1A:
    Version: 1
    Flags 1: 0x01
      FreeSync Supported
    Minimum Refresh Rate: 48 Hz
    Maximum Refresh Rate: 75 Hz
    MCCS VCP Code: 0xe6
  Colorimetry Data Block:
    xvYCC601
    xvYCC709
    BT2020cYCC
    BT2020YCC
    BT2020RGB
    Gamut Boundary Description Metadata Profile P0
  YCbCr 4:2:0 Capability Map Data Block:
    VIC  97:  3840x2160   60.000000 Hz  16:9    135.000 kHz    594.000000 MHz
    SVD Index 17 is out of range
  HDR Static Metadata Data Block:
    Electro optical transfer functions:
      Traditional gamma - SDR luminance range
      Traditional gamma - HDR luminance range
      SMPTE ST2084
    Supported static metadata descriptors:
      Static metadata type 1
    Desired content max luminance: 96 (400.000 cd/m^2)
    Desired content max frame-average luminance: 96 (400.000 cd/m^2)
    Desired content min luminance: 69 (0.293 cd/m^2)
  Detailed Timing Descriptors:
    DTD 3:  3840x1600   29.998460 Hz  12:5     48.688 kHz    194.750000 MHz (880 mm x 367 mm)
                 Hfront    8 Hsync  32 Hback  120 Hpol P
                 Vfront    9 Vsync   8 Vback    6 Vpol N
    DTD 4:  2560x1080   59.978424 Hz  64:27    66.636 kHz    181.250000 MHz (880 mm x 367 mm)
                 Hfront   48 Hsync  32 Hback   80 Hpol P
                 Vfront    3 Vsync  10 Vback   18 Vpol N
Checksum: 0xd1  Unused space in Extension Block: 15 bytes

----------------

Warnings:

Block 1, CTA-861 Extension Block:
  Video Data Block: VIC 1 and the first DTD are not identical. Is this intended?
  Colorimetry Data Block: Set the sRGB colorimetry bit to avoid interop issues.
EDID:
  Base EDID: Some timings are out of range of the Monitor Ranges:
    Vertical Freq: 24.000 - 75.062 Hz (Monitor: 30.000 - 75.000 Hz)
    Horizontal Freq: 15.734 - 135.000 kHz (Monitor: 30.000 - 130.000 kHz)

Failures:

Block 1, CTA-861 Extension Block:
  Vendor-Specific Data Block (HDMI Forum), OUI C4-5D-D8: HDMI VIC and related CTA VIC codes are present, but the UHD VIC bit is 0.
  YCbCr 4:2:0 Capability Map Data Block: Max index 17 > 16 (#SVDs).
  Missing VCDB, needed for Set Selectable RGB Quantization to avoid interop issues.
EDID:
  Extension Block 2 started with EDID header, ignoring Extension Blocks >= 2.

EDID conformity: FAIL
