edid-decode (hex):

00 ff ff ff ff ff ff 00 04 72 66 05 5f ae 97 02
1d 1e 01 04 b5 58 25 78 3b a1 95 a9 54 4d 9c 26
0f 50 54 bf ef 80 71 4f 81 40 81 80 81 c0 81 00
95 00 b3 00 d1 c0 54 ba 00 50 f0 40 21 60 08 20
98 04 70 6f 31 00 00 1a 18 4c 00 a0 f0 40 17 60
08 20 98 00 70 6f 31 00 00 1a 00 00 00 fd 00 30
4b 82 82 3c 01 0a 20 20 20 20 20 20 00 00 00 fc
00 41 63 65 72 20 58 52 33 38 32 43 51 4b 01 47

02 03 2b f1 4b 01 03 04 12 13 05 14 1f 90 07 5a
23 09 07 07 83 01 00 00 67 03 0c 00 20 00 38 78
e3 05 e0 00 e6 06 05 01 60 60 45 02 3a 80 18 71
38 2d 40 58 2c 45 00 70 6f 31 00 00 1e 13 97 00
50 f0 40 2e 60 08 20 08 08 70 6f 31 00 00 1a cd
46 00 a0 a0 38 1f 40 30 20 3a 00 70 6f 31 00 00
1a 00 00 00 00 00 00 00 00 00 00 00 00 00 00 00
00 00 00 00 00 00 00 00 00 00 00 00 00 00 00 e2

00 ff ff ff ff ff ff 00 04 72 66 05 5f ae 97 02
1d 1e 01 04 b5 58 25 78 3b a1 95 a9 54 4d 9c 26
0f 50 54 bf ef 80 71 4f 81 40 81 80 81 c0 81 00
95 00 b3 00 d1 c0 54 ba 00 50 f0 40 21 60 08 20
98 04 70 6f 31 00 00 1a 18 4c 00 a0 f0 40 17 60
08 20 98 00 70 6f 31 00 00 1a 00 00 00 fd 00 30
4b 82 82 3c 01 0a 20 20 20 20 20 20 00 00 00 fc
00 41 63 65 72 20 58 52 33 38 32 43 51 4b 01 47

02 03 2b f1 4b 01 03 04 12 13 05 14 1f 90 07 5a
23 09 07 07 83 01 00 00 67 03 0c 00 20 00 38 78
e3 05 e0 00 e6 06 05 01 60 60 45 02 3a 80 18 71
38 2d 40 58 2c 45 00 70 6f 31 00 00 1e 13 97 00
50 f0 40 2e 60 08 20 08 08 70 6f 31 00 00 1a cd
46 00 a0 a0 38 1f 40 30 20 3a 00 70 6f 31 00 00
1a 00 00 00 00 00 00 00 00 00 00 00 00 00 00 00
00 00 00 00 00 00 00 00 00 00 00 00 00 00 00 e2

----------------

Block 0, Base EDID:
  EDID Structure Version & Revision: 1.4
  Vendor & Product Identification:
    Manufacturer: ACR
    Model: 1382
    Serial Number: ...
    Made in: week 29 of 2020
  Basic Display Parameters & Features:
    Digital display
    Bits per primary color channel: 10
    DisplayPort interface
    Maximum image size: 88 cm x 37 cm
    Gamma: 2.20
    DPMS levels: Off
    Supported color formats: RGB 4:4:4, YCrCb 4:4:4, YCrCb 4:2:2
    First detailed timing includes the native pixel format and preferred refresh rate
    Display supports continuous frequencies
  Color Characteristics:
    Red  : 0.6621, 0.3300
    Green: 0.3007, 0.6103
    Blue : 0.1503, 0.0595
    White: 0.3134, 0.3291
  Established Timings I & II:
    IBM     :   720x400    70.081663 Hz   9:5     31.467 kHz     28.320000 MHz
    DMT 0x04:   640x480    59.940476 Hz   4:3     31.469 kHz     25.175000 MHz
    Apple   :   640x480    66.666667 Hz   4:3     35.000 kHz     30.240000 MHz
    DMT 0x05:   640x480    72.808802 Hz   4:3     37.861 kHz     31.500000 MHz
    DMT 0x06:   640x480    75.000000 Hz   4:3     37.500 kHz     31.500000 MHz
    DMT 0x08:   800x600    56.250000 Hz   4:3     35.156 kHz     36.000000 MHz
    DMT 0x09:   800x600    60.316541 Hz   4:3     37.879 kHz     40.000000 MHz
    DMT 0x0a:   800x600    72.187572 Hz   4:3     48.077 kHz     50.000000 MHz
    DMT 0x0b:   800x600    75.000000 Hz   4:3     46.875 kHz     49.500000 MHz
    Apple   :   832x624    74.551266 Hz   4:3     49.726 kHz     57.284000 MHz
    DMT 0x10:  1024x768    60.003840 Hz   4:3     48.363 kHz     65.000000 MHz
    DMT 0x11:  1024x768    70.069359 Hz   4:3     56.476 kHz     75.000000 MHz
    DMT 0x12:  1024x768    75.028582 Hz   4:3     60.023 kHz     78.750000 MHz
    DMT 0x24:  1280x1024   75.024675 Hz   5:4     79.976 kHz    135.000000 MHz
    Apple   :  1152x870    75.061550 Hz 192:145   68.681 kHz    100.000000 MHz
  Standard Timings:
    DMT 0x15:  1152x864    75.000000 Hz   4:3     67.500 kHz    108.000000 MHz
    DMT 0x20:  1280x960    60.000000 Hz   4:3     60.000 kHz    108.000000 MHz
    DMT 0x23:  1280x1024   60.019740 Hz   5:4     63.981 kHz    108.000000 MHz
    DMT 0x55:  1280x720    60.000000 Hz  16:9     45.000 kHz     74.250000 MHz
    DMT 0x1c:  1280x800    59.810326 Hz  16:10    49.702 kHz     83.500000 MHz
    DMT 0x2f:  1440x900    59.887445 Hz  16:10    55.935 kHz    106.500000 MHz
    DMT 0x3a:  1680x1050   59.954250 Hz  16:10    65.290 kHz    146.250000 MHz
    DMT 0x52:  1920x1080   60.000000 Hz  16:9     67.500 kHz    148.500000 MHz
  Detailed Timing Descriptors:
    DTD 1:  3840x1600   74.515415 Hz  12:5    121.684 kHz    477.000000 MHz (880 mm x 367 mm)
                 Hfront    8 Hsync  32 Hback   40 Hpol P
                 Vfront   25 Vsync   8 Vback    0 Vpol N
    DTD 2:  3840x1600   30.006161 Hz  12:5     48.700 kHz    194.800000 MHz (880 mm x 367 mm)
                 Hfront    8 Hsync  32 Hback  120 Hpol P
                 Vfront    9 Vsync   8 Vback    6 Vpol N
    Display Range Limits:
      Monitor ranges (Range Limits Only): 48-75 Hz V, 130-130 kHz H, max dotclock 600 MHz
    Display Product Name: 'Acer XR382CQK'
  Extension blocks: 1
Checksum: 0x47

----------------

Block 1, CTA-861 Extension Block:
  Revision: 3
  Underscans IT Video Formats by default
  Basic audio support
  Supports YCbCr 4:4:4
  Supports YCbCr 4:2:2
  Native DTDs: 1
  Video Data Block:
    VIC   1:   640x480    59.940476 Hz   4:3     31.469 kHz     25.175000 MHz
    VIC   3:   720x480    59.940060 Hz  16:9     31.469 kHz     27.000000 MHz
    VIC   4:  1280x720    60.000000 Hz  16:9     45.000 kHz     74.250000 MHz
    VIC  18:   720x576    50.000000 Hz  16:9     31.250 kHz     27.000000 MHz
    VIC  19:  1280x720    50.000000 Hz  16:9     37.500 kHz     74.250000 MHz
    VIC   5:  1920x1080i  60.000000 Hz  16:9     33.750 kHz     74.250000 MHz
    VIC  20:  1920x1080i  50.000000 Hz  16:9     28.125 kHz     74.250000 MHz
    VIC  31:  1920x1080   50.000000 Hz  16:9     56.250 kHz    148.500000 MHz
    VIC  16:  1920x1080   60.000000 Hz  16:9     67.500 kHz    148.500000 MHz (native)
    VIC   7:  1440x480i   59.940060 Hz  16:9     15.734 kHz     27.000000 MHz
    VIC  90:  2560x1080   60.000000 Hz  64:27    66.000 kHz    198.000000 MHz
  Audio Data Block:
    Linear PCM:
      Max channels: 2
      Supported sample rates (kHz): 48 44.1 32
      Supported sample sizes (bits): 24 20 16
  Speaker Allocation Data Block:
    FL/FR - Front Left/Right
  Vendor-Specific Data Block (HDMI), OUI 00-0C-03:
    Source physical address: 2.0.0.0
    DC_36bit
    DC_30bit
    DC_Y444
    Maximum TMDS clock: 600 MHz
  Colorimetry Data Block:
    BT2020cYCC
    BT2020YCC
    BT2020RGB
  HDR Static Metadata Data Block:
    Electro optical transfer functions:
      Traditional gamma - SDR luminance range
      SMPTE ST2084
    Supported static metadata descriptors:
      Static metadata type 1
    Desired content max luminance: 96 (400.000 cd/m^2)
    Desired content max frame-average luminance: 96 (400.000 cd/m^2)
    Desired content min luminance: 69 (0.293 cd/m^2)
  Detailed Timing Descriptors:
    DTD 3:  1920x1080   60.000000 Hz  16:9     67.500 kHz    148.500000 MHz (880 mm x 367 mm)
                 Hfront   88 Hsync  44 Hback  148 Hpol P
                 Vfront    4 Vsync   5 Vback   36 Vpol P
    DTD 4:  3840x1600   59.939681 Hz  12:5     98.661 kHz    386.750000 MHz (880 mm x 367 mm)
                 Hfront    8 Hsync  32 Hback   40 Hpol P
                 Vfront   32 Vsync   8 Vback    6 Vpol N
    DTD 5:  2560x1080   59.978424 Hz  64:27    66.636 kHz    181.250000 MHz (880 mm x 367 mm)
                 Hfront   48 Hsync  32 Hback   80 Hpol P
                 Vfront    3 Vsync  10 Vback   18 Vpol N
Checksum: 0xe2  Unused space in Extension Block: 30 bytes

----------------

Warnings:

Block 1, CTA-861 Extension Block:
  Video Data Block: VIC 1 and the first DTD are not identical. Is this intended?
  Colorimetry Data Block: Set the sRGB colorimetry bit to avoid interop issues.
  Detailed Timing Descriptor #3: Image size is 880x367 mm, but based on the picture AR it should be 652x367 mm.
EDID:
  Base EDID: Some timings are out of range of the Monitor Ranges:
    Vertical Freq: 30.006 - 75.062 Hz (Monitor: 48.000 - 75.000 Hz)
    Horizontal Freq: 15.734 - 121.683 kHz (Monitor: 130.000 - 130.000 kHz)

Failures:

Block 0, Base EDID:
  Detailed Timing Descriptor #1: 0 or negative vertical back porch.
Block 1, CTA-861 Extension Block:
  Vendor-Specific Data Block (HDMI), OUI 00-0C-03: HDMI VSDB Max TMDS rate is > 340.
  Vendor-Specific Data Block (HDMI), OUI 00-0C-03: The HDMI Specification requires EDID 1.3 instead of 1.4.
  Missing VCDB, needed for Set Selectable RGB Quantization to avoid interop issues.
EDID:
  Extension Block 2 started with EDID header, ignoring Extension Blocks >= 2.
  CTA-861: Native progressive timings are a mix of several resolutions.

EDID conformity: FAIL
