edid-decode (hex):

00 ff ff ff ff ff ff 00 4c 2d 11 73 00 00 00 00
28 21 01 03 80 34 1f 78 2a 26 75 af 4e 4f 9f 27
0f 50 54 bf ef 80 b3 00 81 c0 81 00 81 80 95 00
a9 c0 71 4f 01 01 02 3a 80 18 71 38 2d 40 58 2c
45 00 08 36 21 00 00 1e 00 00 00 fd 00 30 4b 1e
52 16 00 0a 20 20 20 20 20 20 00 00 00 fc 00 53
32 34 43 33 31 78 0a 20 20 20 20 20 00 00 00 ff
00 48 34 43 57 41 30 30 30 34 38 42 0a 20 01 4e

02 03 1a b1 46 90 04 1f 13 12 03 65 03 0c 00 10
00 68 1a 00 00 01 01 30 4b e6 01 1d 00 bc 52 d0
1e 20 b8 28 55 40 08 39 21 00 00 1e 8c 0a d0 90
20 40 31 20 0c 40 55 00 08 36 21 00 00 18 8c 0a
d0 8a 20 e0 2d 10 10 3e 96 00 08 36 21 00 00 18
2a 44 80 a0 70 38 27 40 30 20 35 00 08 36 21 00
00 1c 00 00 00 00 00 00 00 00 00 00 00 00 00 00
00 00 00 00 00 00 00 00 00 00 00 00 00 00 00 93

00 ff ff ff ff ff ff 00 4c 2d 11 73 00 00 00 00
28 21 01 03 80 34 1f 78 2a 26 75 af 4e 4f 9f 27
0f 50 54 bf ef 80 b3 00 81 c0 81 00 81 80 95 00
a9 c0 71 4f 01 01 02 3a 80 18 71 38 2d 40 58 2c
45 00 08 36 21 00 00 1e 00 00 00 fd 00 30 4b 1e
52 16 00 0a 20 20 20 20 20 20 00 00 00 fc 00 53
32 34 43 33 31 78 0a 20 20 20 20 20 00 00 00 ff
00 48 34 43 57 41 30 30 30 34 38 42 0a 20 01 4e

02 03 1a b1 46 90 04 1f 13 12 03 65 03 0c 00 10
00 68 1a 00 00 01 01 30 4b e6 01 1d 00 bc 52 d0
1e 20 b8 28 55 40 08 39 21 00 00 1e 8c 0a d0 90
20 40 31 20 0c 40 55 00 08 36 21 00 00 18 8c 0a
d0 8a 20 e0 2d 10 10 3e 96 00 08 36 21 00 00 18
2a 44 80 a0 70 38 27 40 30 20 35 00 08 36 21 00
00 1c 00 00 00 00 00 00 00 00 00 00 00 00 00 00
00 00 00 00 00 00 00 00 00 00 00 00 00 00 00 93

----------------

Block 0, Base EDID:
  EDID Structure Version & Revision: 1.3
  Vendor & Product Identification:
    Manufacturer: SAM
    Model: 29457
    Made in: week 40 of 2023
  Basic Display Parameters & Features:
    Digital display
    Maximum image size: 52 cm x 31 cm
    Gamma: 2.20
    DPMS levels: Off
    RGB color display
    First detailed timing is the preferred timing
  Color Characteristics:
    Red  : 0.6835, 0.3066
    Green: 0.3095, 0.6230
    Blue : 0.1533, 0.0615
    White: 0.3134, 0.3291
  Established Timings I & II:
    IBM     :   720x400    70.081663 Hz   9:5     31.467 kHz     28.320000 MHz
    DMT 0x04:   640x480    59.940476 Hz   4:3     31.469 kHz     25.175000 MHz
    Apple   :   640x480    66.666667 Hz   4:3     35.000 kHz     30.240000 MHz
    DMT 0x05:   640x480    72.808802 Hz   4:3     37.861 kHz     31.500000 MHz
    DMT 0x06:   640x480    75.000000 Hz   4:3     37.500 kHz     31.500000 MHz
    DMT 0x08:   800x600    56.250000 Hz   4:3     35.156 kHz     36.000000 MHz
    DMT 0x09:   800x600    60.316541 Hz   4:3     37.879 kHz     40.000000 MHz
    DMT 0x0a:   800x600    72.187572 Hz   4:3     48.077 kHz     50.000000 MHz
    DMT 0x0b:   800x600    75.000000 Hz   4:3     46.875 kHz     49.500000 MHz
    Apple   :   832x624    74.551266 Hz   4:3     49.726 kHz     57.284000 MHz
    DMT 0x10:  1024x768    60.003840 Hz   4:3     48.363 kHz     65.000000 MHz
    DMT 0x11:  1024x768    70.069359 Hz   4:3     56.476 kHz     75.000000 MHz
    DMT 0x12:  1024x768    75.028582 Hz   4:3     60.023 kHz     78.750000 MHz
    DMT 0x24:  1280x1024   75.024675 Hz   5:4     79.976 kHz    135.000000 MHz
    Apple   :  1152x870    75.061550 Hz 192:145   68.681 kHz    100.000000 MHz
  Standard Timings:
    DMT 0x3a:  1680x1050   59.954250 Hz  16:10    65.290 kHz    146.250000 MHz
    DMT 0x55:  1280x720    60.000000 Hz  16:9     45.000 kHz     74.250000 MHz
    DMT 0x1c:  1280x800    59.810326 Hz  16:10    49.702 kHz     83.500000 MHz
    DMT 0x23:  1280x1024   60.019740 Hz   5:4     63.981 kHz    108.000000 MHz
    DMT 0x2f:  1440x900    59.887445 Hz  16:10    55.935 kHz    106.500000 MHz
    DMT 0x53:  1600x900    60.000000 Hz  16:9     60.000 kHz    108.000000 MHz (RB)
    DMT 0x15:  1152x864    75.000000 Hz   4:3     67.500 kHz    108.000000 MHz
  Detailed Timing Descriptors:
    DTD 1:  1920x1080   60.000000 Hz  16:9     67.500 kHz    148.500000 MHz (520 mm x 310 mm)
                 Hfront   88 Hsync  44 Hback  148 Hpol P
                 Vfront    4 Vsync   5 Vback   36 Vpol P
    Display Range Limits:
      Monitor ranges (GTF): 48-75 Hz V, 30-82 kHz H, max dotclock 220 MHz
    Display Product Name: 'S24C31x'
    Display Product Serial Number: ...
  Extension blocks: 1
Checksum: 0x4e

----------------

Block 1, CTA-861 Extension Block:
  Revision: 3
  Underscans IT Video Formats by default
  Supports YCbCr 4:4:4
  Supports YCbCr 4:2:2
  Native DTDs: 1
  Video Data Block:
    VIC  16:  1920x1080   60.000000 Hz  16:9     67.500 kHz    148.500000 MHz (native)
    VIC   4:  1280x720    60.000000 Hz  16:9     45.000 kHz     74.250000 MHz
    VIC  31:  1920x1080   50.000000 Hz  16:9     56.250 kHz    148.500000 MHz
    VIC  19:  1280x720    50.000000 Hz  16:9     37.500 kHz     74.250000 MHz
    VIC  18:   720x576    50.000000 Hz  16:9     31.250 kHz     27.000000 MHz
    VIC   3:   720x480    59.940060 Hz  16:9     31.469 kHz     27.000000 MHz
  Vendor-Specific Data Block (HDMI), OUI 00-0C-03:
    Source physical address: 1.0.0.0
  Vendor-Specific Data Block (AMD), OUI 00-00-1A:
    Version: 1
    Feature Caps: 0x01
    Minimum Refresh Rate: 48 Hz
    Maximum Refresh Rate: 75 Hz
    Flags 1.x: 0xe6 (MCCS)
  Detailed Timing Descriptors:
    DTD 2:  1280x720    50.000000 Hz  16:9     37.500 kHz     74.250000 MHz (520 mm x 313 mm)
                 Hfront  440 Hsync  40 Hback  220 Hpol P
                 Vfront    5 Vsync   5 Vback   20 Vpol P
    DTD 3:   720x576    50.000000 Hz   5:4     31.250 kHz     27.000000 MHz (520 mm x 310 mm)
                 Hfront   12 Hsync  64 Hback   68 Hpol N
                 Vfront    5 Vsync   5 Vback   39 Vpol N
    DTD 4:   720x480    59.940060 Hz   3:2     31.469 kHz     27.000000 MHz (520 mm x 310 mm)
                 Hfront   16 Hsync  62 Hback   60 Hpol N
                 Vfront    9 Vsync   6 Vback   30 Vpol N
    DTD 5:  1920x1080   74.972503 Hz  16:9     83.894 kHz    174.500000 MHz (520 mm x 310 mm)
                 Hfront   48 Hsync  32 Hback   80 Hpol N
                 Vfront    3 Vsync   5 Vback   31 Vpol P
Checksum: 0x93  Unused space in Extension Block: 29 bytes

----------------

Warnings:

Block 0, Base EDID:
  Detailed Timing Descriptor #1: Image size is 520x310 mm, but based on the picture AR it should be 520x292 mm.
Block 1, CTA-861 Extension Block:
  Detailed Timing Descriptor #2: Image size is 520x313 mm, but based on the picture AR it should be 520x292 mm.
  Detailed Timing Descriptor #3: Image size is 520x310 mm, but based on the picture AR it should be 387x310 mm.
  Detailed Timing Descriptor #4: Image size is 520x310 mm, but based on the picture AR it should be 465x310 mm.
  Detailed Timing Descriptor #5: Image size is 520x310 mm, but based on the picture AR it should be 520x292 mm.
  Add a Colorimetry Data Block with the sRGB colorimetry bit set to avoid interop issues.
EDID:
  Base EDID: Some timings are out of range of the Monitor Ranges:
    Horizontal Freq: 31.250 - 83.894 kHz (Monitor: 30.000 - 82.000 kHz)

Failures:

Block 1, CTA-861 Extension Block:
  Missing VCDB, needed for Set Selectable RGB Quantization to avoid interop issues.
EDID:
  Extension Block 2 started with EDID header, ignoring Extension Blocks >= 2.

EDID conformity: FAIL
