edid-decode (hex):

00 ff ff ff ff ff ff 00 09 e5 22 0a 00 00 00 00
0b 1f 01 04 95 22 13 78 02 93 f5 94 5d 5a 92 29
1f 50 54 00 00 00 01 01 01 01 01 01 01 01 01 01
01 01 01 01 01 01 b3 1d 56 de 50 00 1e 30 30 20
36 00 58 c2 10 00 00 1a c2 17 56 de 50 00 1e 30
30 20 36 00 58 c2 10 00 00 1a 00 00 00 fe 00 30
36 37 50 50 80 4e 54 31 35 4e 34 36 00 00 00 00
00 00 41 21 96 00 10 00 00 09 01 0a 20 20 00 60

00 ff ff ff ff ff ff 00 09 e5 22 0a 00 00 00 00
0b 1f 01 04 95 22 13 78 02 93 f5 94 5d 5a 92 29
1f 50 54 00 00 00 01 01 01 01 01 01 01 01 01 01
01 01 01 01 01 01 b3 1d 56 de 50 00 1e 30 30 20
36 00 58 c2 10 00 00 1a c2 17 56 de 50 00 1e 30
30 20 36 00 58 c2 10 00 00 1a 00 00 00 fe 00 30
36 37 50 50 80 4e 54 31 35 4e 34 36 00 00 00 00
00 00 41 21 96 00 10 00 00 09 01 0a 20 20 00 60

----------------

Block 0, Base EDID:
  EDID Structure Version & Revision: 1.4
  Vendor & Product Identification:
    Manufacturer: BOE
    Model: 2594
    Made in: week 11 of 2021
  Basic Display Parameters & Features:
    Digital display
    Bits per primary color channel: 6
    DisplayPort interface
    Maximum image size: 34 cm x 19 cm
    Gamma: 2.20
    Supported color formats: RGB 4:4:4
    First detailed timing includes the native pixel format and preferred refresh rate
  Color Characteristics:
    Red  : 0.5800, 0.3642
    Green: 0.3515, 0.5732
    Blue : 0.1630, 0.1240
    White: 0.3134, 0.3291
  Established Timings I & II: none
  Standard Timings: none
  Detailed Timing Descriptors:
    DTD 1:  1366x768    59.997285 Hz 683:384   47.878 kHz     76.030000 MHz (344 mm x 194 mm)
                 Hfront   48 Hsync  32 Hback  142 Hpol P
                 Vfront    3 Vsync   6 Vback   21 Vpol N
    DTD 2:  1366x768    47.994672 Hz 683:384   38.300 kHz     60.820000 MHz (344 mm x 194 mm)
                 Hfront   48 Hsync  32 Hback  142 Hpol P
                 Vfront    3 Vsync   6 Vback   21 Vpol N
    Alphanumeric Data String: '067PP.NT15N46'
    Manufacturer-Specified Display Descriptor (0x00): 00 00 00 00 41 21 96 00 10 00 00 09 01 0a 20 20 '....A!........  '
Checksum: 0x60

----------------

Block 1, Unknown EDID Extension Block 0x00:
  00 ff ff ff ff ff ff 00 09 e5 22 0a 00 00 00 00 '..........".....'
  0b 1f 01 04 95 22 13 78 02 93 f5 94 5d 5a 92 29 '.....".x....]Z.)'
  1f 50 54 00 00 00 01 01 01 01 01 01 01 01 01 01 '.PT.............'
  01 01 01 01 01 01 b3 1d 56 de 50 00 1e 30 30 20 '........V.P..00 '
  36 00 58 c2 10 00 00 1a c2 17 56 de 50 00 1e 30 '6.X.......V.P..0'
  30 20 36 00 58 c2 10 00 00 1a 00 00 00 fe 00 30 '0 6.X..........0'
  36 37 50 50 80 4e 54 31 35 4e 34 36 00 00 00 00 '67PP.NT15N46....'
  00 00 41 21 96 00 10 00 00 09 01 0a 20 20 00 60 '..A!........  .`'
Checksum: 0x60

----------------

Warnings:

Block 0, Base EDID:
  Alphanumeric Data String: Non-ASCII character 0x80 at position 5, can cause problems.
  Missing Display Product Name.

Failures:

Block 1, Base EDID:
  Unknown Extension Block.
EDID:
  Base EDID: EDID specified 0 extension block(s), but found 1 extension block(s).

EDID conformity: FAIL
