edid-decode (hex):

00 ff ff ff ff ff ff 00 4e 83 12 17 01 01 01 01
00 0a 01 01 0c 20 18 a4 e8 ce 24 a6 52 47 9d 24
0e 48 4c a4 4b 00 81 80 61 59 45 59 31 59 81 99
a9 4f 01 01 01 01 00 00 00 fc 00 20 56 49 44 45
4f 53 45 56 45 4e 0a 20 00 00 00 fc 00 56 37 20
53 39 38 4d 20 0a 20 20 20 20 00 00 00 fd 00 32
a0 1e 62 15 00 0a 20 20 20 20 20 20 00 00 00 ff
00 30 30 30 30 30 31 0a 20 20 20 20 20 20 00 f6

----------------

Block 0, Base EDID:
  EDID Structure Version & Revision: 1.1
  Vendor & Product Identification:
    Manufacturer: STC
    Model: 5906
    Serial Number: ...
    Made in: 2000
  Basic Display Parameters & Features:
    Analog display
    Signal Level Standard: 0.700 : 0.300 : 1.000 V p-p
    Blank level equals black level
    Sync: Separate Composite
    Maximum image size: 32 cm x 24 cm
    Gamma: 2.64
    DPMS levels: Standby Suspend Off
    RGB color display
  Color Characteristics:
    Red  : 0.6513, 0.3203
    Green: 0.2802, 0.6152
    Blue : 0.1406, 0.0566
    White: 0.2822, 0.2968
  Established Timings I & II:
    IBM     :   720x400    70.081663 Hz   9:5     31.467 kHz     28.320000 MHz
    DMT 0x04:   640x480    59.940476 Hz   4:3     31.469 kHz     25.175000 MHz
    DMT 0x06:   640x480    75.000000 Hz   4:3     37.500 kHz     31.500000 MHz
    DMT 0x0b:   800x600    75.000000 Hz   4:3     46.875 kHz     49.500000 MHz
    DMT 0x10:  1024x768    60.003840 Hz   4:3     48.363 kHz     65.000000 MHz
    DMT 0x12:  1024x768    75.028582 Hz   4:3     60.023 kHz     78.750000 MHz
    DMT 0x24:  1280x1024   75.024675 Hz   5:4     79.976 kHz    135.000000 MHz
  Standard Timings:
    DMT 0x23:  1280x1024   60.019740 Hz   5:4     63.981 kHz    108.000000 MHz
    DMT 0x13:  1024x768    84.996690 Hz   4:3     68.677 kHz     94.500000 MHz
    DMT 0x0c:   800x600    85.061274 Hz   4:3     53.674 kHz     56.250000 MHz
    DMT 0x07:   640x480    85.008312 Hz   4:3     43.269 kHz     36.000000 MHz
    DMT 0x25:  1280x1024   85.024098 Hz   5:4     91.146 kHz    157.500000 MHz
    DMT 0x36:  1600x1200   75.000000 Hz   4:3     93.750 kHz    202.500000 MHz
  Detailed Timing Descriptors:
    Display Product Name: ' VIDEOSEVEN'
    Display Product Name: 'V7 S98M '
    Display Range Limits:
      Monitor ranges (GTF): 50-160 Hz V, 30-98 kHz H, max dotclock 210 MHz
    Display Product Serial Number: ...
Checksum: 0xf6

----------------

Warnings:

Block 0, Base EDID:
  EDID Structure Version & Revision: EDID 1.1 is deprecated, do not use.
  Vendor & Product Identification: The serial number is one of the known dummy values, it should probably be set to 0.
  Display Product Serial Number: ...

Failures:

Block 0, Base EDID:
  Display Product Name: One or more trailing spaces before newline.

EDID conformity: FAIL
