edid-decode (hex):

00 ff ff ff ff ff ff 00 4c f4 00 16 25 00 01 01
2a 22 01 03 80 23 14 78 3e 77 81 b6 58 2c c3 19
05 50 54 21 08 00 d1 c0 01 01 01 01 01 01 01 01
01 01 01 01 01 01 bd 3c 80 aa 70 b0 28 40 58 2c
25 00 62 c7 10 00 00 1e 00 00 00 fc 00 48 44 4d
49 0a 20 20 20 20 20 20 20 20 00 00 00 ff 00 0a
20 20 20 20 20 20 20 20 20 20 20 20 00 00 00 fd
00 30 a5 1e ff 3c 00 0a 20 20 20 20 20 20 01 fb

02 03 37 f2 43 90 01 03 23 09 7f 07 83 01 00 00
67 03 0c 00 10 00 18 7e e2 00 d5 e3 05 c0 00 e6
06 05 01 69 69 4f 68 1a 00 00 01 01 30 a5 e6 67
d8 5d c4 01 60 80 01 c4 65 80 a0 70 b0 35 40 30
20 25 00 62 c7 10 00 00 1e 3d 7b 80 a0 70 b0 40
40 30 20 25 00 62 c7 10 00 00 1e e8 a6 80 a0 70
b0 2d 40 30 20 25 00 62 c7 10 00 00 1e 00 00 00
00 00 00 00 00 00 00 00 00 00 00 00 00 00 00 c1

00 ff ff ff ff ff ff 00 4c f4 00 16 25 00 01 01
2a 22 01 03 80 23 14 78 3e 77 81 b6 58 2c c3 19
05 50 54 21 08 00 d1 c0 01 01 01 01 01 01 01 01
01 01 01 01 01 01 bd 3c 80 aa 70 b0 28 40 58 2c
25 00 62 c7 10 00 00 1e 00 00 00 fc 00 48 44 4d
49 0a 20 20 20 20 20 20 20 20 00 00 00 ff 00 0a
20 20 20 20 20 20 20 20 20 20 20 20 00 00 00 fd
00 30 a5 1e ff 3c 00 0a 20 20 20 20 20 20 01 fb

02 03 37 f2 43 90 01 03 23 09 7f 07 83 01 00 00
67 03 0c 00 10 00 18 7e e2 00 d5 e3 05 c0 00 e6
06 05 01 69 69 4f 68 1a 00 00 01 01 30 a5 e6 67
d8 5d c4 01 60 80 01 c4 65 80 a0 70 b0 35 40 30
20 25 00 62 c7 10 00 00 1e 3d 7b 80 a0 70 b0 40
40 30 20 25 00 62 c7 10 00 00 1e e8 a6 80 a0 70
b0 2d 40 30 20 25 00 62 c7 10 00 00 1e 00 00 00
00 00 00 00 00 00 00 00 00 00 00 00 00 00 00 c1

----------------

Block 0, Base EDID:
  EDID Structure Version & Revision: 1.3
  Vendor & Product Identification:
    Manufacturer: SGT
    Model: 5632
    Serial Number: ...
    Made in: week 42 of 2024
  Basic Display Parameters & Features:
    Digital display
    Maximum image size: 35 cm x 20 cm
    Gamma: 2.20
    DPMS levels: Off
    Undefined display color type
    Default (sRGB) color space is primary color space
    First detailed timing is the preferred timing
  Color Characteristics:
    Red  : 0.7119, 0.3466
    Green: 0.1728, 0.7646
    Blue : 0.0996, 0.0195
    White: 0.3125, 0.3291
  Established Timings I & II:
    DMT 0x04:   640x480    59.940476 Hz   4:3     31.469 kHz     25.175000 MHz
    DMT 0x09:   800x600    60.316541 Hz   4:3     37.879 kHz     40.000000 MHz
    DMT 0x10:  1024x768    60.003840 Hz   4:3     48.363 kHz     65.000000 MHz
  Standard Timings:
    DMT 0x52:  1920x1080   60.000000 Hz  16:9     67.500 kHz    148.500000 MHz
  Detailed Timing Descriptors:
    DTD 1:  1920x1200   59.997685 Hz  16:10    74.397 kHz    155.490000 MHz (354 mm x 199 mm)
                 Hfront   88 Hsync  44 Hback   38 Hpol P
                 Vfront    2 Vsync   5 Vback   33 Vpol P
    Display Product Name: 'HDMI'
    Display Product Serial Number: ...
    Display Range Limits:
      Monitor ranges (GTF): 48-165 Hz V, 30-255 kHz H, max dotclock 600 MHz
  Extension blocks: 1
Checksum: 0xfb

----------------

Block 1, CTA-861 Extension Block:
  Revision: 3
  Underscans IT Video Formats by default
  Basic audio support
  Supports YCbCr 4:4:4
  Supports YCbCr 4:2:2
  Native DTDs: 2
  Video Data Block:
    VIC  16:  1920x1080   60.000000 Hz  16:9     67.500 kHz    148.500000 MHz (native)
    VIC   1:   640x480    59.940476 Hz   4:3     31.469 kHz     25.175000 MHz
    VIC   3:   720x480    59.940060 Hz  16:9     31.469 kHz     27.000000 MHz
  Audio Data Block:
    Linear PCM:
      Max channels: 2
      Supported sample rates (kHz): 192 176.4 96 88.2 48 44.1 32
      Supported sample sizes (bits): 24 20 16
  Speaker Allocation Data Block:
    FL/FR - Front Left/Right
  Vendor-Specific Data Block (HDMI), OUI 00-0C-03:
    Source physical address: 1.0.0.0
    DC_30bit
    DC_Y444
    Maximum TMDS clock: 630 MHz
  Video Capability Data Block:
    YCbCr quantization: Selectable (via AVI YQ)
    RGB quantization: Selectable (via AVI Q)
    PT scan behavior: Always Overscanned
    IT scan behavior: Always Overscanned
    CE scan behavior: Always Overscanned
  Colorimetry Data Block:
    BT2020YCC
    BT2020RGB
  HDR Static Metadata Data Block:
    Electro optical transfer functions:
      Traditional gamma - SDR luminance range
      SMPTE ST2084
    Supported static metadata descriptors:
      Static metadata type 1
    Desired content max luminance: 105 (486.099 cd/m^2)
    Desired content max frame-average luminance: 105 (486.099 cd/m^2)
    Desired content min luminance: 79 (0.467 cd/m^2)
  Vendor-Specific Data Block (AMD), OUI 00-00-1A:
    Version: 1
    Feature Caps: 0x01
    Minimum Refresh Rate: 48 Hz
    Maximum Refresh Rate: 165 Hz
    Flags 1.x: 0xe6 (MCCS)
  Vendor-Specific Data Block (HDMI Forum), OUI C4-5D-D8:
    Version: 1
    Maximum TMDS Character Rate: 480 MHz
    SCDC Present
    Supports 10-bits/component Deep Color 4:2:0 Pixel Encoding
  Detailed Timing Descriptors:
    DTD 2:  1920x1200   99.960096 Hz  16:10   125.250 kHz    260.520000 MHz (354 mm x 199 mm)
                 Hfront   48 Hsync  32 Hback   80 Hpol P
                 Vfront    2 Vsync   5 Vback   46 Vpol P
    DTD 3:  1920x1200  119.998326 Hz  16:10   151.678 kHz    315.490000 MHz (354 mm x 199 mm)
                 Hfront   48 Hsync  32 Hback   80 Hpol P
                 Vfront    2 Vsync   5 Vback   57 Vpol P
    DTD 4:  1920x1200  164.998455 Hz  16:10   205.423 kHz    427.280000 MHz (354 mm x 199 mm)
                 Hfront   48 Hsync  32 Hback   80 Hpol P
                 Vfront    2 Vsync   5 Vback   38 Vpol P
Checksum: 0xc1  Unused space in Extension Block: 18 bytes

----------------

Warnings:

Block 0, Base EDID:
  Detailed Timing Descriptor #1: Image size is 354x199 mm, but based on the picture AR it should be 318x199 mm.
Block 1, CTA-861 Extension Block:
  Video Data Block: VIC 16 and the first DTD are not identical. Is this intended?
  Video Capability Data Block: IT scan behavior is expected to support underscanned.
  Video Capability Data Block: S_PT is equal to S_IT and S_CE, so should be set to 0 instead.
  Detailed Timing Descriptor #2: Image size is 354x199 mm, but based on the picture AR it should be 318x199 mm.
  Detailed Timing Descriptor #3: Image size is 354x199 mm, but based on the picture AR it should be 318x199 mm.
  Detailed Timing Descriptor #4: Image size is 354x199 mm, but based on the picture AR it should be 318x199 mm.
  Display Product Serial Number is set, so the Serial Number in the Base EDID should be 0.

Failures:

Block 0, Base EDID:
  Display Product Serial Number: ...
  Basic Display Parameters & Features: sRGB is signaled, but the chromaticities do not match.
Block 1, CTA-861 Extension Block:
  Vendor-Specific Data Block (HDMI), OUI 00-0C-03: HDMI VSDB Max TMDS rate is > 340.
  Video Capability Data Block: IT video formats are always overscanned, but bit 7 of Byte 3 of the CTA-861 Extension header is set to underscanned.
  Vendor-Specific Data Block (HDMI Forum), OUI C4-5D-D8: HDMI Forum VSDB did not immediately follow the HDMI VSDB.
  Vendor-Specific Data Block (HDMI Forum), OUI C4-5D-D8: HDMI Forum VSDB rate < HDMI VSDB rate.
EDID:
  Extension Block 2 started with EDID header, ignoring Extension Blocks >= 2.
  CTA-861: Native progressive timings are a mix of several resolutions.

EDID conformity: FAIL
