edid-decode (hex):

00 ff ff ff ff ff ff 00 2d e3 82 04 01 00 00 00
1a 0d 01 03 78 00 00 bc ef 0b 32 9c 5a 4d 8c 26
20 4e 57 bf ef 00 31 59 45 59 61 59 71 4f 01 01
01 01 01 01 01 01 86 3d 00 c0 51 00 30 40 40 a0
13 00 6d 24 11 00 00 1e 00 00 00 fd 00 28 56 1e
5d 10 00 0a 20 20 20 20 20 20 00 00 00 ff 00 53
58 47 41 38 35 41 5f 30 30 30 30 31 00 00 00 fc
00 53 58 47 41 38 35 5f 41 4e 41 4c 4f 47 00 2e

00 ff ff ff ff ff ff 00 2d e3 82 04 01 00 00 00
1a 0d 01 03 78 00 00 bc ef 0b 32 9c 5a 4d 8c 26
20 4e 57 bf ef 00 31 59 45 59 61 59 71 4f 01 01
01 01 01 01 01 01 86 3d 00 c0 51 00 30 40 40 a0
13 00 6d 24 11 00 00 1e 00 00 00 fd 00 28 56 1e
5d 10 00 0a 20 20 20 20 20 20 00 00 00 ff 00 53
58 47 41 38 35 41 5f 30 30 30 30 31 00 00 00 fc
00 53 58 47 41 38 35 5f 41 4e 41 4c 4f 47 00 2e

----------------

Block 0, Base EDID:
  EDID Structure Version & Revision: 1.3
  Vendor & Product Identification:
    Manufacturer: KOC
    Model: 1154
    Serial Number: ...
    Made in: week 26 of 2003
  Basic Display Parameters & Features:
    Analog display
    Signal Level Standard: 0.700 : 0.000 : 0.700 V p-p
    Blank-to-black setup/pedestal
    Sync: Separate
    Image size is variable
    Gamma: 2.88
    DPMS levels: Standby Suspend Off
    RGB color display
    Default (sRGB) color space is primary color space
    First detailed timing is the preferred timing
    Supports GTF timings within operating range
  Color Characteristics:
    Red  : 0.6093, 0.3515
    Green: 0.3027, 0.5498
    Blue : 0.1484, 0.1279
    White: 0.3046, 0.3417
  Established Timings I & II:
    IBM     :   720x400    70.081663 Hz   9:5     31.467 kHz     28.320000 MHz
    DMT 0x04:   640x480    59.940476 Hz   4:3     31.469 kHz     25.175000 MHz
    Apple   :   640x480    66.666667 Hz   4:3     35.000 kHz     30.240000 MHz
    DMT 0x05:   640x480    72.808802 Hz   4:3     37.861 kHz     31.500000 MHz
    DMT 0x06:   640x480    75.000000 Hz   4:3     37.500 kHz     31.500000 MHz
    DMT 0x08:   800x600    56.250000 Hz   4:3     35.156 kHz     36.000000 MHz
    DMT 0x09:   800x600    60.316541 Hz   4:3     37.879 kHz     40.000000 MHz
    DMT 0x0a:   800x600    72.187572 Hz   4:3     48.077 kHz     50.000000 MHz
    DMT 0x0b:   800x600    75.000000 Hz   4:3     46.875 kHz     49.500000 MHz
    Apple   :   832x624    74.551266 Hz   4:3     49.726 kHz     57.284000 MHz
    DMT 0x10:  1024x768    60.003840 Hz   4:3     48.363 kHz     65.000000 MHz
    DMT 0x11:  1024x768    70.069359 Hz   4:3     56.476 kHz     75.000000 MHz
    DMT 0x12:  1024x768    75.028582 Hz   4:3     60.023 kHz     78.750000 MHz
    DMT 0x24:  1280x1024   75.024675 Hz   5:4     79.976 kHz    135.000000 MHz
  Standard Timings:
    DMT 0x07:   640x480    85.008312 Hz   4:3     43.269 kHz     36.000000 MHz
    DMT 0x0c:   800x600    85.061274 Hz   4:3     53.674 kHz     56.250000 MHz
    DMT 0x13:  1024x768    84.996690 Hz   4:3     68.677 kHz     94.500000 MHz
    DMT 0x15:  1152x864    75.000000 Hz   4:3     67.500 kHz    108.000000 MHz
  Detailed Timing Descriptors:
    DTD 1:  1280x1024   85.024098 Hz   5:4     91.146 kHz    157.500000 MHz (365 mm x 292 mm)
                 Hfront   64 Hsync 160 Hback  224 Hpol P
                 Vfront    1 Vsync   3 Vback   44 Vpol P
    Display Range Limits:
      Monitor ranges (GTF): 40-86 Hz V, 30-93 kHz H, max dotclock 160 MHz
    Display Product Serial Number: ...
    Display Product Name: 'SXGA85_ANALOG'
Checksum: 0x2e

----------------

Warnings:

Block 0, Base EDID:
  Vendor & Product Identification: The serial number is one of the known dummy values, it should probably be set to 0.
  Basic Display Parameters & Features: sRGB is signaled, but the gamma != 2.2.

Failures:

Block 0, Base EDID:
  Basic Display Parameters & Features: sRGB is signaled, but the chromaticities do not match.
EDID:
  Extension Block 1 started with EDID header, ignoring Extension Blocks >= 1.
  Base EDID: The DTD max image size is 365x292mm, but the display size is not specified anywhere.

EDID conformity: FAIL
