edid-decode (hex):

00 ff ff ff ff ff ff 00 2e 83 02 32 01 00 00 00
07 1f 01 03 80 46 27 78 ea 9f d1 a2 57 4c 9c 24
0c 50 54 a5 4b 00 b3 00 d1 c0 71 4f a9 c0 81 80
77 80 01 01 01 01 56 5e 00 a0 a0 a0 29 50 30 20
35 00 bc 86 21 00 00 1a 30 75 00 90 a0 a0 28 50
30 20 35 00 bc 86 21 00 00 1a 00 00 00 fd 00 30
4b 70 70 1f 00 0a 20 20 20 20 20 20 00 00 00 fc
00 51 33 32 30 32 53 0a 20 20 20 20 20 20 01 b8

02 03 26 f1 48 01 03 04 10 1f 13 1f 22 23 09 07
07 83 01 00 00 67 03 0c 00 10 00 b8 3e 68 1a 00
00 01 01 30 4b e6 02 3a 80 18 71 38 2d 40 58 2c
45 00 bc 86 21 00 00 1a 01 1d 80 18 71 1c 16 20
58 2c 25 00 bc 86 21 00 00 9a 01 1d 00 72 51 d0
1e 20 6e 28 55 00 bc 86 21 00 00 1a 34 21 50 b0
51 00 1b 30 40 70 36 00 bc 86 21 00 00 1a 00 00
00 00 00 00 00 00 00 00 00 00 00 00 00 00 00 f8

00 ff ff ff ff ff ff 00 2e 83 02 32 01 00 00 00
07 1f 01 03 80 46 27 78 ea 9f d1 a2 57 4c 9c 24
0c 50 54 a5 4b 00 b3 00 d1 c0 71 4f a9 c0 81 80
77 80 01 01 01 01 56 5e 00 a0 a0 a0 29 50 30 20
35 00 bc 86 21 00 00 1a 30 75 00 90 a0 a0 28 50
30 20 35 00 bc 86 21 00 00 1a 00 00 00 fd 00 30
4b 70 70 1f 00 0a 20 20 20 20 20 20 00 00 00 fc
00 51 33 32 30 32 53 0a 20 20 20 20 20 20 01 b8

02 03 26 f1 48 01 03 04 10 1f 13 1f 22 23 09 07
07 83 01 00 00 67 03 0c 00 10 00 b8 3e 68 1a 00
00 01 01 30 4b e6 02 3a 80 18 71 38 2d 40 58 2c
45 00 bc 86 21 00 00 1a 01 1d 80 18 71 1c 16 20
58 2c 25 00 bc 86 21 00 00 9a 01 1d 00 72 51 d0
1e 20 6e 28 55 00 bc 86 21 00 00 1a 34 21 50 b0
51 00 1b 30 40 70 36 00 bc 86 21 00 00 1a 00 00
00 00 00 00 00 00 00 00 00 00 00 00 00 00 00 f8

----------------

Block 0, Base EDID:
  EDID Structure Version & Revision: 1.3
  Vendor & Product Identification:
    Manufacturer: KTC
    Model: 12802
    Serial Number: ...
    Made in: week 7 of 2021
  Basic Display Parameters & Features:
    Digital display
    Maximum image size: 70 cm x 39 cm
    Gamma: 2.20
    DPMS levels: Standby Suspend Off
    RGB color display
    First detailed timing is the preferred timing
  Color Characteristics:
    Red  : 0.6347, 0.3408
    Green: 0.2998, 0.6123
    Blue : 0.1435, 0.0478
    White: 0.3125, 0.3291
  Established Timings I & II:
    IBM     :   720x400    70.081663 Hz   9:5     31.467 kHz     28.320000 MHz
    DMT 0x04:   640x480    59.940476 Hz   4:3     31.469 kHz     25.175000 MHz
    DMT 0x06:   640x480    75.000000 Hz   4:3     37.500 kHz     31.500000 MHz
    DMT 0x09:   800x600    60.316541 Hz   4:3     37.879 kHz     40.000000 MHz
    DMT 0x0b:   800x600    75.000000 Hz   4:3     46.875 kHz     49.500000 MHz
    DMT 0x10:  1024x768    60.003840 Hz   4:3     48.363 kHz     65.000000 MHz
    DMT 0x12:  1024x768    75.028582 Hz   4:3     60.023 kHz     78.750000 MHz
    DMT 0x24:  1280x1024   75.024675 Hz   5:4     79.976 kHz    135.000000 MHz
  Standard Timings:
    DMT 0x3a:  1680x1050   59.954250 Hz  16:10    65.290 kHz    146.250000 MHz
    DMT 0x52:  1920x1080   60.000000 Hz  16:9     67.500 kHz    148.500000 MHz
    DMT 0x15:  1152x864    75.000000 Hz   4:3     67.500 kHz    108.000000 MHz
    DMT 0x53:  1600x900    60.000000 Hz  16:9     60.000 kHz    108.000000 MHz (RB)
    DMT 0x23:  1280x1024   60.019740 Hz   5:4     63.981 kHz    108.000000 MHz
    GTF     :  1200x960    60.000000 Hz   5:4     59.640 kHz     95.424000 MHz
  Detailed Timing Descriptors:
    DTD 1:  2560x1440   59.950550 Hz  16:9     88.787 kHz    241.500000 MHz (700 mm x 390 mm)
                 Hfront   48 Hsync  32 Hback   80 Hpol P
                 Vfront    3 Vsync   5 Vback   33 Vpol N
    DTD 2:  2560x1440   74.964017 Hz  16:9    110.947 kHz    300.000000 MHz (700 mm x 390 mm)
                 Hfront   48 Hsync  32 Hback   64 Hpol P
                 Vfront    3 Vsync   5 Vback   32 Vpol N
    Display Range Limits:
      Monitor ranges (GTF): 48-75 Hz V, 112-112 kHz H, max dotclock 310 MHz
    Display Product Name: 'Q3202S'
  Extension blocks: 1
Checksum: 0xb8

----------------

Block 1, CTA-861 Extension Block:
  Revision: 3
  Underscans IT Video Formats by default
  Basic audio support
  Supports YCbCr 4:4:4
  Supports YCbCr 4:2:2
  Native DTDs: 1
  Video Data Block:
    VIC   1:   640x480    59.940476 Hz   4:3     31.469 kHz     25.175000 MHz
    VIC   3:   720x480    59.940060 Hz  16:9     31.469 kHz     27.000000 MHz
    VIC   4:  1280x720    60.000000 Hz  16:9     45.000 kHz     74.250000 MHz
    VIC  16:  1920x1080   60.000000 Hz  16:9     67.500 kHz    148.500000 MHz
    VIC  31:  1920x1080   50.000000 Hz  16:9     56.250 kHz    148.500000 MHz
    VIC  19:  1280x720    50.000000 Hz  16:9     37.500 kHz     74.250000 MHz
    VIC  31:  1920x1080   50.000000 Hz  16:9     56.250 kHz    148.500000 MHz
    VIC  34:  1920x1080   30.000000 Hz  16:9     33.750 kHz     74.250000 MHz
  Audio Data Block:
    Linear PCM:
      Max channels: 2
      Supported sample rates (kHz): 48 44.1 32
      Supported sample sizes (bits): 24 20 16
  Speaker Allocation Data Block:
    FL/FR - Front Left/Right
  Vendor-Specific Data Block (HDMI), OUI 00-0C-03:
    Source physical address: 1.0.0.0
    Supports_AI
    DC_36bit
    DC_30bit
    DC_Y444
    Maximum TMDS clock: 310 MHz
  Vendor-Specific Data Block (AMD), OUI 00-00-1A:
    Version: 1
    Flags 1: 0x01
      FreeSync Supported
    Minimum Refresh Rate: 48 Hz
    Maximum Refresh Rate: 75 Hz
    MCCS VCP Code: 0xe6
  Detailed Timing Descriptors:
    DTD 3:  1920x1080   60.000000 Hz  16:9     67.500 kHz    148.500000 MHz (700 mm x 390 mm)
                 Hfront   88 Hsync  44 Hback  148 Hpol P
                 Vfront    4 Vsync   5 Vback   36 Vpol N
    DTD 4:  1920x1080i  60.000000 Hz  16:9     33.750 kHz     74.250000 MHz (700 mm x 390 mm)
                 Hfront   88 Hsync  44 Hback  148 Hpol P
                 Vfront    2 Vsync   5 Vback   15 Vpol N Vfront +0.5 Odd Field
                 Vfront    2 Vsync   5 Vback   15 Vpol N Vback  +0.5 Even Field
    DTD 5:  1280x720    60.000000 Hz  16:9     45.000 kHz     74.250000 MHz (700 mm x 390 mm)
                 Hfront  110 Hsync  40 Hback  220 Hpol P
                 Vfront    5 Vsync   5 Vback   20 Vpol N
    DTD 6:  1360x768    59.664196 Hz  85:48    47.433 kHz     85.000000 MHz (700 mm x 390 mm)
                 Hfront   64 Hsync 112 Hback  256 Hpol P
                 Vfront    3 Vsync   6 Vback   18 Vpol N
Checksum: 0xf8  Unused space in Extension Block: 17 bytes

----------------

Warnings:

Block 0, Base EDID:
  Vendor & Product Identification: The serial number is one of the known dummy values, it should probably be set to 0.
Block 1, CTA-861 Extension Block:
  Video Data Block: VIC 1 and the first DTD are not identical. Is this intended?
  Detailed Timing Descriptor #3: DTD is similar but not identical to VIC 16.
  Detailed Timing Descriptor #4: DTD is similar but not identical to VIC 5.
  Detailed Timing Descriptor #5: DTD is similar but not identical to VIC 4.
  Add a Colorimetry Data Block with the sRGB colorimetry bit set to avoid interop issues.
EDID:
  Base EDID: Some timings are out of range of the Monitor Ranges:
    Vertical Freq: 30.000 - 75.029 Hz (Monitor: 48.000 - 75.000 Hz)
    Horizontal Freq: 31.466 - 110.946 kHz (Monitor: 112.000 - 112.000 kHz)

Failures:

Block 1, CTA-861 Extension Block:
  Video Data Block: Duplicate VIC 31.
  Missing VCDB, needed for Set Selectable RGB Quantization to avoid interop issues.
EDID:
  Extension Block 2 started with EDID header, ignoring Extension Blocks >= 2.

EDID conformity: FAIL
