edid-decode (hex):

00 ff ff ff ff ff ff 00 31 03 ff ff 00 00 00 00
20 21 01 04 b5 55 30 78 39 80 95 ab 51 47 a5 24
13 50 54 bf ef 80 d1 c0 b3 00 95 00 81 80 71 4f
81 c0 81 40 a9 c0 1c 5f 00 b4 a0 a0 29 50 30 20
35 00 54 e0 31 00 00 1a 00 00 00 fd 00 30 a5 f3
f3 50 01 0a 20 20 20 20 20 20 00 00 00 fc 00 44
47 56 49 45 57 33 39 31 57 48 54 0a 00 00 00 ff
00 30 30 30 30 30 30 30 30 30 30 30 30 30 02 0c

02 03 32 f1 4c 01 02 03 04 05 90 11 12 13 14 10
3f 23 09 07 07 83 01 00 00 e3 05 e3 01 6d 1a 00
00 02 11 30 a5 00 00 00 00 00 00 e6 06 07 01 65
5d 10 f5 bd 00 a0 a0 a0 32 50 30 20 35 00 54 e0
31 00 00 1a fc 31 00 a0 50 a0 29 50 30 20 35 00
54 e0 31 00 00 1a 98 e2 00 a0 a0 a0 29 50 30 20
35 00 54 e0 31 00 00 1a 00 00 00 00 00 00 00 00
00 00 00 00 00 00 00 00 00 00 00 00 00 00 00 6c

00 ff ff ff ff ff ff 00 31 03 ff ff 00 00 00 00
20 21 01 04 b5 55 30 78 39 80 95 ab 51 47 a5 24
13 50 54 bf ef 80 d1 c0 b3 00 95 00 81 80 71 4f
81 c0 81 40 a9 c0 1c 5f 00 b4 a0 a0 29 50 30 20
35 00 54 e0 31 00 00 1a 00 00 00 fd 00 30 a5 f3
f3 50 01 0a 20 20 20 20 20 20 00 00 00 fc 00 44
47 56 49 45 57 33 39 31 57 48 54 0a 00 00 00 ff
00 30 30 30 30 30 30 30 30 30 30 30 30 30 02 0c

00 ff ff ff ff ff ff 00 31 03 ff ff 00 00 00 00
20 21 01 04 b5 55 30 78 39 80 95 ab 51 47 a5 24
13 50 54 bf ef 80 d1 c0 b3 00 95 00 81 80 71 4f
81 c0 81 40 a9 c0 1c 5f 00 b4 a0 a0 29 50 30 20
35 00 54 e0 31 00 00 1a 00 00 00 fd 00 30 a5 f3
f3 50 01 0a 20 20 20 20 20 20 00 00 00 fc 00 44
47 56 49 45 57 33 39 31 57 48 54 0a 00 00 00 ff
00 30 30 30 30 30 30 30 30 30 30 30 30 30 02 0c

02 03 32 f1 4c 01 02 03 04 05 90 11 12 13 14 10
3f 23 09 07 07 83 01 00 00 e3 05 e3 01 6d 1a 00
00 02 11 30 a5 00 00 00 00 00 00 e6 06 07 01 65
5d 10 f5 bd 00 a0 a0 a0 32 50 30 20 35 00 54 e0
31 00 00 1a fc 31 00 a0 50 a0 29 50 30 20 35 00
54 e0 31 00 00 1a 98 e2 00 a0 a0 a0 29 50 30 20
35 00 54 e0 31 00 00 1a 00 00 00 00 00 00 00 00
00 00 00 00 00 00 00 00 00 00 00 00 00 00 00 6c

00 ff ff ff ff ff ff 00 31 03 ff ff 00 00 00 00
20 21 01 04 b5 55 30 78 39 80 95 ab 51 47 a5 24
13 50 54 bf ef 80 d1 c0 b3 00 95 00 81 80 71 4f
81 c0 81 40 a9 c0 1c 5f 00 b4 a0 a0 29 50 30 20
35 00 54 e0 31 00 00 1a 00 00 00 fd 00 30 a5 f3
f3 50 01 0a 20 20 20 20 20 20 00 00 00 fc 00 44
47 56 49 45 57 33 39 31 57 48 54 0a 00 00 00 ff
00 30 30 30 30 30 30 30 30 30 30 30 30 30 02 0c

----------------

Block 0, Base EDID:
  EDID Structure Version & Revision: 1.4
  Vendor & Product Identification:
    Manufacturer: LHC
    Model: 65535
    Made in: week 32 of 2023
  Basic Display Parameters & Features:
    Digital display
    Bits per primary color channel: 10
    DisplayPort interface
    Maximum image size: 85 cm x 48 cm
    Gamma: 2.20
    DPMS levels: Off
    Supported color formats: RGB 4:4:4, YCrCb 4:4:4, YCrCb 4:2:2
    First detailed timing does not include the native pixel format and preferred refresh rate
    Display supports continuous frequencies
  Color Characteristics:
    Red  : 0.6699, 0.3164
    Green: 0.2773, 0.6445
    Blue : 0.1425, 0.0751
    White: 0.3134, 0.3291
  Established Timings I & II:
    IBM     :   720x400    70.081663 Hz   9:5     31.467 kHz     28.320000 MHz
    DMT 0x04:   640x480    59.940476 Hz   4:3     31.469 kHz     25.175000 MHz
    Apple   :   640x480    66.666667 Hz   4:3     35.000 kHz     30.240000 MHz
    DMT 0x05:   640x480    72.808802 Hz   4:3     37.861 kHz     31.500000 MHz
    DMT 0x06:   640x480    75.000000 Hz   4:3     37.500 kHz     31.500000 MHz
    DMT 0x08:   800x600    56.250000 Hz   4:3     35.156 kHz     36.000000 MHz
    DMT 0x09:   800x600    60.316541 Hz   4:3     37.879 kHz     40.000000 MHz
    DMT 0x0a:   800x600    72.187572 Hz   4:3     48.077 kHz     50.000000 MHz
    DMT 0x0b:   800x600    75.000000 Hz   4:3     46.875 kHz     49.500000 MHz
    Apple   :   832x624    74.551266 Hz   4:3     49.726 kHz     57.284000 MHz
    DMT 0x10:  1024x768    60.003840 Hz   4:3     48.363 kHz     65.000000 MHz
    DMT 0x11:  1024x768    70.069359 Hz   4:3     56.476 kHz     75.000000 MHz
    DMT 0x12:  1024x768    75.028582 Hz   4:3     60.023 kHz     78.750000 MHz
    DMT 0x24:  1280x1024   75.024675 Hz   5:4     79.976 kHz    135.000000 MHz
    Apple   :  1152x870    75.061550 Hz 192:145   68.681 kHz    100.000000 MHz
  Standard Timings:
    DMT 0x52:  1920x1080   60.000000 Hz  16:9     67.500 kHz    148.500000 MHz
    DMT 0x3a:  1680x1050   59.954250 Hz  16:10    65.290 kHz    146.250000 MHz
    DMT 0x2f:  1440x900    59.887445 Hz  16:10    55.935 kHz    106.500000 MHz
    DMT 0x23:  1280x1024   60.019740 Hz   5:4     63.981 kHz    108.000000 MHz
    DMT 0x15:  1152x864    75.000000 Hz   4:3     67.500 kHz    108.000000 MHz
    DMT 0x55:  1280x720    60.000000 Hz  16:9     45.000 kHz     74.250000 MHz
    DMT 0x20:  1280x960    60.000000 Hz   4:3     60.000 kHz    108.000000 MHz
    DMT 0x53:  1600x900    60.000000 Hz  16:9     60.000 kHz    108.000000 MHz (RB)
  Detailed Timing Descriptors:
    DTD 1:  2560x1440   60.000887 Hz  16:9     88.861 kHz    243.480000 MHz (852 mm x 480 mm)
                 Hfront   48 Hsync  32 Hback  100 Hpol P
                 Vfront    3 Vsync   5 Vback   33 Vpol N
    Display Range Limits:
      Monitor ranges (Range Limits Only): 48-165 Hz V, 243-243 kHz H, max dotclock 800 MHz
    Display Product Name: 'DGVIEW391WHT'
    Display Product Serial Number: ...
  Extension blocks: 2
Checksum: 0x0c

----------------

Block 1, CTA-861 Extension Block:
  Revision: 3
  Underscans IT Video Formats by default
  Basic audio support
  Supports YCbCr 4:4:4
  Supports YCbCr 4:2:2
  Native detailed modes: 1
  Video Data Block:
    VIC   1:   640x480    59.940476 Hz   4:3     31.469 kHz     25.175000 MHz
    VIC   2:   720x480    59.940060 Hz   4:3     31.469 kHz     27.000000 MHz
    VIC   3:   720x480    59.940060 Hz  16:9     31.469 kHz     27.000000 MHz
    VIC   4:  1280x720    60.000000 Hz  16:9     45.000 kHz     74.250000 MHz
    VIC   5:  1920x1080i  60.000000 Hz  16:9     33.750 kHz     74.250000 MHz
    VIC  16:  1920x1080   60.000000 Hz  16:9     67.500 kHz    148.500000 MHz (native)
    VIC  17:   720x576    50.000000 Hz   4:3     31.250 kHz     27.000000 MHz
    VIC  18:   720x576    50.000000 Hz  16:9     31.250 kHz     27.000000 MHz
    VIC  19:  1280x720    50.000000 Hz  16:9     37.500 kHz     74.250000 MHz
    VIC  20:  1920x1080i  50.000000 Hz  16:9     28.125 kHz     74.250000 MHz
    VIC  16:  1920x1080   60.000000 Hz  16:9     67.500 kHz    148.500000 MHz
    VIC  63:  1920x1080  120.000000 Hz  16:9    135.000 kHz    297.000000 MHz
  Audio Data Block:
    Linear PCM:
      Max channels: 2
      Supported sample rates (kHz): 48 44.1 32
      Supported sample sizes (bits): 24 20 16
  Speaker Allocation Data Block:
    FL/FR - Front Left/Right
  Colorimetry Data Block:
    xvYCC601
    xvYCC709
    BT2020cYCC
    BT2020YCC
    BT2020RGB
    Gamut Boundary Description Metadata Profile P0
  Vendor-Specific Data Block (AMD), OUI 00-00-1A:
    Version: 2
    Feature Caps: 0x11
    Minimum Refresh Rate: 48 Hz
    Maximum Refresh Rate: 165 Hz
    Flags 1.x: 0x00
    Flags 2.x: 0x00
    Maximum luminance: 0 (50.000 cd/m^2)
    Minimum luminance: 0 (0.000 cd/m^2)
    Unknown: 0x00 0x00
  HDR Static Metadata Data Block:
    Electro optical transfer functions:
      Traditional gamma - SDR luminance range
      Traditional gamma - HDR luminance range
      SMPTE ST2084
    Supported static metadata descriptors:
      Static metadata type 1
    Desired content max luminance: 101 (445.755 cd/m^2)
    Desired content max frame-average luminance: 93 (374.834 cd/m^2)
    Desired content min luminance: 16 (0.018 cd/m^2)
  Detailed Timing Descriptors:
    DTD 2:  2560x1440  119.988650 Hz  16:9    178.783 kHz    486.290000 MHz (852 mm x 480 mm)
                 Hfront   48 Hsync  32 Hback   80 Hpol P
                 Vfront    3 Vsync   5 Vback   42 Vpol N
    DTD 3:  1280x1440   60.000750 Hz   8:9     88.861 kHz    127.960000 MHz (852 mm x 480 mm)
                 Hfront   48 Hsync  32 Hback   80 Hpol P
                 Vfront    3 Vsync   5 Vback   33 Vpol N
    DTD 4:  2560x1440  144.000477 Hz  16:9    213.265 kHz    580.080000 MHz (852 mm x 480 mm)
                 Hfront   48 Hsync  32 Hback   80 Hpol P
                 Vfront    3 Vsync   5 Vback   33 Vpol N
Checksum: 0x6c  Unused space in Extension Block: 23 bytes

----------------

Block 2, Unknown EDID Extension Block 0x00:
  00 ff ff ff ff ff ff 00 31 03 ff ff 00 00 00 00 '........1.......'
  20 21 01 04 b5 55 30 78 39 80 95 ab 51 47 a5 24 ' !...U0x9...QG.$'
  13 50 54 bf ef 80 d1 c0 b3 00 95 00 81 80 71 4f '.PT...........qO'
  81 c0 81 40 a9 c0 1c 5f 00 b4 a0 a0 29 50 30 20 '...@..._....)P0 '
  35 00 54 e0 31 00 00 1a 00 00 00 fd 00 30 a5 f3 '5.T.1........0..'
  f3 50 01 0a 20 20 20 20 20 20 00 00 00 fc 00 44 '.P..      .....D'
  47 56 49 45 57 33 39 31 57 48 54 0a 00 00 00 ff 'GVIEW391WHT.....'
  00 30 30 30 30 30 30 30 30 30 30 30 30 30 02 0c '.0000000000000..'
Checksum: 0x0c

----------------

Block 3, Unknown EDID Extension Block 0x00:
  00 ff ff ff ff ff ff 00 31 03 ff ff 00 00 00 00 '........1.......'
  20 21 01 04 b5 55 30 78 39 80 95 ab 51 47 a5 24 ' !...U0x9...QG.$'
  13 50 54 bf ef 80 d1 c0 b3 00 95 00 81 80 71 4f '.PT...........qO'
  81 c0 81 40 a9 c0 1c 5f 00 b4 a0 a0 29 50 30 20 '...@..._....)P0 '
  35 00 54 e0 31 00 00 1a 00 00 00 fd 00 30 a5 f3 '5.T.1........0..'
  f3 50 01 0a 20 20 20 20 20 20 00 00 00 fc 00 44 '.P..      .....D'
  47 56 49 45 57 33 39 31 57 48 54 0a 00 00 00 ff 'GVIEW391WHT.....'
  00 30 30 30 30 30 30 30 30 30 30 30 30 30 02 0c '.0000000000000..'
Checksum: 0x0c

----------------

Block 4, CTA-861 Extension Block:
  Revision: 3
  Underscans IT Video Formats by default
  Basic audio support
  Supports YCbCr 4:4:4
  Supports YCbCr 4:2:2
  Native detailed modes: 1
  Video Data Block:
    VIC   1:   640x480    59.940476 Hz   4:3     31.469 kHz     25.175000 MHz
    VIC   2:   720x480    59.940060 Hz   4:3     31.469 kHz     27.000000 MHz
    VIC   3:   720x480    59.940060 Hz  16:9     31.469 kHz     27.000000 MHz
    VIC   4:  1280x720    60.000000 Hz  16:9     45.000 kHz     74.250000 MHz
    VIC   5:  1920x1080i  60.000000 Hz  16:9     33.750 kHz     74.250000 MHz
    VIC  16:  1920x1080   60.000000 Hz  16:9     67.500 kHz    148.500000 MHz (native)
    VIC  17:   720x576    50.000000 Hz   4:3     31.250 kHz     27.000000 MHz
    VIC  18:   720x576    50.000000 Hz  16:9     31.250 kHz     27.000000 MHz
    VIC  19:  1280x720    50.000000 Hz  16:9     37.500 kHz     74.250000 MHz
    VIC  20:  1920x1080i  50.000000 Hz  16:9     28.125 kHz     74.250000 MHz
    VIC  16:  1920x1080   60.000000 Hz  16:9     67.500 kHz    148.500000 MHz
    VIC  63:  1920x1080  120.000000 Hz  16:9    135.000 kHz    297.000000 MHz
  Audio Data Block:
    Linear PCM:
      Max channels: 2
      Supported sample rates (kHz): 48 44.1 32
      Supported sample sizes (bits): 24 20 16
  Speaker Allocation Data Block:
    FL/FR - Front Left/Right
  Colorimetry Data Block:
    xvYCC601
    xvYCC709
    BT2020cYCC
    BT2020YCC
    BT2020RGB
    Gamut Boundary Description Metadata Profile P0
  Vendor-Specific Data Block (AMD), OUI 00-00-1A:
    Version: 2
    Feature Caps: 0x11
    Minimum Refresh Rate: 48 Hz
    Maximum Refresh Rate: 165 Hz
    Flags 1.x: 0x00
    Flags 2.x: 0x00
    Maximum luminance: 0 (50.000 cd/m^2)
    Minimum luminance: 0 (0.000 cd/m^2)
    Unknown: 0x00 0x00
  HDR Static Metadata Data Block:
    Electro optical transfer functions:
      Traditional gamma - SDR luminance range
      Traditional gamma - HDR luminance range
      SMPTE ST2084
    Supported static metadata descriptors:
      Static metadata type 1
    Desired content max luminance: 101 (445.755 cd/m^2)
    Desired content max frame-average luminance: 93 (374.834 cd/m^2)
    Desired content min luminance: 16 (0.018 cd/m^2)
  Detailed Timing Descriptors:
    DTD 5:  2560x1440  119.988650 Hz  16:9    178.783 kHz    486.290000 MHz (852 mm x 480 mm)
                 Hfront   48 Hsync  32 Hback   80 Hpol P
                 Vfront    3 Vsync   5 Vback   42 Vpol N
    DTD 6:  1280x1440   60.000750 Hz   8:9     88.861 kHz    127.960000 MHz (852 mm x 480 mm)
                 Hfront   48 Hsync  32 Hback   80 Hpol P
                 Vfront    3 Vsync   5 Vback   33 Vpol N
    DTD 7:  2560x1440  144.000477 Hz  16:9    213.265 kHz    580.080000 MHz (852 mm x 480 mm)
                 Hfront   48 Hsync  32 Hback   80 Hpol P
                 Vfront    3 Vsync   5 Vback   33 Vpol N
Checksum: 0x6c  Unused space in Extension Block: 23 bytes

----------------

Block 5, Unknown EDID Extension Block 0x00:
  00 ff ff ff ff ff ff 00 31 03 ff ff 00 00 00 00 '........1.......'
  20 21 01 04 b5 55 30 78 39 80 95 ab 51 47 a5 24 ' !...U0x9...QG.$'
  13 50 54 bf ef 80 d1 c0 b3 00 95 00 81 80 71 4f '.PT...........qO'
  81 c0 81 40 a9 c0 1c 5f 00 b4 a0 a0 29 50 30 20 '...@..._....)P0 '
  35 00 54 e0 31 00 00 1a 00 00 00 fd 00 30 a5 f3 '5.T.1........0..'
  f3 50 01 0a 20 20 20 20 20 20 00 00 00 fc 00 44 '.P..      .....D'
  47 56 49 45 57 33 39 31 57 48 54 0a 00 00 00 ff 'GVIEW391WHT.....'
  00 30 30 30 30 30 30 30 30 30 30 30 30 30 02 0c '.0000000000000..'
Checksum: 0x0c

----------------

Warnings:

Block 0, Base EDID:
  Display Product Serial Number: ...
Block 1, CTA-861 Extension Block:
  Video Data Block: VIC 1 and the first DTD are not identical. Is this intended?
  Colorimetry Data Block: Set the sRGB colorimetry bit to avoid interop issues.
  Detailed Timing Descriptor #3: Image size is 852x480 mm, but based on the picture AR it should be 852x958 mm.
Block 4, CTA-861 Extension Block:
  Colorimetry Data Block: Set the sRGB colorimetry bit to avoid interop issues.
  Detailed Timing Descriptor #6: Image size is 852x480 mm, but based on the picture AR it should be 852x958 mm.
EDID:
  Base EDID: Some timings are out of range of the Monitor Ranges:
    Horizontal Freq: 28.125 - 213.264 kHz (Monitor: 243.000 - 243.000 kHz)

Failures:

Block 1, CTA-861 Extension Block:
  Video Data Block: Duplicate VIC 16.
  Missing VCDB, needed for Set Selectable RGB Quantization to avoid interop issues.
Block 2, Base EDID:
  Unknown Extension Block.
Block 3, Base EDID:
  Unknown Extension Block.
Block 4, CTA-861 Extension Block:
  Video Data Block: Duplicate VIC 1.
  Video Data Block: Duplicate VIC 2.
  Video Data Block: Duplicate VIC 3.
  Video Data Block: Duplicate VIC 4.
  Video Data Block: Duplicate VIC 5.
  Video Data Block: Duplicate VIC 17.
  Video Data Block: Duplicate VIC 18.
  Video Data Block: Duplicate VIC 19.
  Video Data Block: Duplicate VIC 20.
  Video Data Block: Duplicate VIC 63.
  Speaker Allocation Data Block: Only one instance of this Data Block is allowed.
  Colorimetry Data Block: Only one instance of this Data Block is allowed.
  HDR Static Metadata Data Block: Only one instance of this Data Block is allowed.
Block 5, Base EDID:
  Unknown Extension Block.
EDID:
  Base EDID: EDID specified 2 extension block(s), but found 5 extension block(s).
  CTA-861: Native progressive timings are a mix of several resolutions.

EDID conformity: FAIL
