edid-decode (hex):

00 ff ff ff ff ff ff 00 31 03 ff ff 00 00 00 00
2e 1f 01 04 b5 50 21 78 3b 01 b5 ac 51 46 a7 26
13 50 54 a5 4b 00 71 4f 81 c0 81 40 81 80 01 01
a9 c0 b3 00 d1 c0 4d 7d 70 a0 d0 a0 2d 50 30 20
35 00 1d 4e 31 00 00 1a 00 00 00 ff 00 30 30 30
30 30 30 30 30 30 30 30 30 30 00 00 00 fd 00 30
90 a0 a0 3c 01 0a 20 20 20 20 20 20 00 00 00 fc
00 33 34 47 4c 52 2d 48 0a 20 20 20 20 20 02 ec

02 03 2e f4 4d 01 02 03 04 05 90 11 12 13 14 1f
40 3f 23 09 07 07 83 01 00 00 e6 06 07 01 65 60
29 e3 05 e3 01 68 1a 00 00 01 01 30 90 00 02 3a
80 18 71 38 2d 40 58 2c 96 00 1d 4e 31 00 00 1e
58 bd 00 a0 a0 a0 2d 50 30 20 35 00 1d 4e 31 00
00 1a d5 d0 70 a0 d0 a0 2d 50 30 20 35 00 1d 4e
31 00 00 1a a3 48 b8 68 61 a0 32 50 30 40 35 00
1d 4e 31 00 00 1a 00 00 00 00 00 00 00 00 00 24

70 12 79 00 00 03 00 64 b6 2c 01 04 6f 0d 9f 00
2f 00 1f 00 9f 05 2c 00 02 80 04 00 ab 5e 00 04
ff 09 9f 00 2f 00 1f 00 9f 05 2c 00 02 00 04 00
1b 82 00 04 7f 07 87 00 17 80 1f 00 37 04 2c 00
02 00 04 00 69 68 00 04 6f 0d 9f 00 2f 00 1f 00
9f 05 2c 00 02 00 04 00 ea f9 00 24 6f 0d 9f 00
2f 00 1f 00 9f 05 28 00 02 00 04 00 07 00 0a 08
81 00 08 04 00 04 02 10 00 00 00 00 00 00 ad 90

00 ff ff ff ff ff ff 00 31 03 ff ff 00 00 00 00
2e 1f 01 04 b5 50 21 78 3b 01 b5 ac 51 46 a7 26
13 50 54 a5 4b 00 71 4f 81 c0 81 40 81 80 01 01
a9 c0 b3 00 d1 c0 4d 7d 70 a0 d0 a0 2d 50 30 20
35 00 1d 4e 31 00 00 1a 00 00 00 ff 00 30 30 30
30 30 30 30 30 30 30 30 30 30 00 00 00 fd 00 30
90 a0 a0 3c 01 0a 20 20 20 20 20 20 00 00 00 fc
00 33 34 47 4c 52 2d 48 0a 20 20 20 20 20 02 ec

02 03 2e f4 4d 01 02 03 04 05 90 11 12 13 14 1f
40 3f 23 09 07 07 83 01 00 00 e6 06 07 01 65 60
29 e3 05 e3 01 68 1a 00 00 01 01 30 90 00 02 3a
80 18 71 38 2d 40 58 2c 96 00 1d 4e 31 00 00 1e
58 bd 00 a0 a0 a0 2d 50 30 20 35 00 1d 4e 31 00
00 1a d5 d0 70 a0 d0 a0 2d 50 30 20 35 00 1d 4e
31 00 00 1a a3 48 b8 68 61 a0 32 50 30 40 35 00
1d 4e 31 00 00 1a 00 00 00 00 00 00 00 00 00 24

70 12 79 00 00 03 00 64 b6 2c 01 04 6f 0d 9f 00
2f 00 1f 00 9f 05 2c 00 02 80 04 00 ab 5e 00 04
ff 09 9f 00 2f 00 1f 00 9f 05 2c 00 02 00 04 00
1b 82 00 04 7f 07 87 00 17 80 1f 00 37 04 2c 00
02 00 04 00 69 68 00 04 6f 0d 9f 00 2f 00 1f 00
9f 05 2c 00 02 00 04 00 ea f9 00 24 6f 0d 9f 00
2f 00 1f 00 9f 05 28 00 02 00 04 00 07 00 0a 08
81 00 08 04 00 04 02 10 00 00 00 00 00 00 ad 90

----------------

Block 0, Base EDID:
  EDID Structure Version & Revision: 1.4
  Vendor & Product Identification:
    Manufacturer: LHC
    Model: 65535
    Made in: week 46 of 2021
  Basic Display Parameters & Features:
    Digital display
    Bits per primary color channel: 10
    DisplayPort interface
    Maximum image size: 80 cm x 33 cm
    Gamma: 2.20
    DPMS levels: Off
    Supported color formats: RGB 4:4:4, YCrCb 4:4:4, YCrCb 4:2:2
    First detailed timing includes the native pixel format and preferred refresh rate
    Display supports continuous frequencies
  Color Characteristics:
    Red  : 0.6718, 0.3164
    Green: 0.2734, 0.6533
    Blue : 0.1503, 0.0771
    White: 0.3134, 0.3291
  Established Timings I & II:
    IBM     :   720x400    70.081663 Hz   9:5     31.467 kHz     28.320000 MHz
    DMT 0x04:   640x480    59.940476 Hz   4:3     31.469 kHz     25.175000 MHz
    DMT 0x06:   640x480    75.000000 Hz   4:3     37.500 kHz     31.500000 MHz
    DMT 0x09:   800x600    60.316541 Hz   4:3     37.879 kHz     40.000000 MHz
    DMT 0x0b:   800x600    75.000000 Hz   4:3     46.875 kHz     49.500000 MHz
    DMT 0x10:  1024x768    60.003840 Hz   4:3     48.363 kHz     65.000000 MHz
    DMT 0x12:  1024x768    75.028582 Hz   4:3     60.023 kHz     78.750000 MHz
    DMT 0x24:  1280x1024   75.024675 Hz   5:4     79.976 kHz    135.000000 MHz
  Standard Timings:
    DMT 0x15:  1152x864    75.000000 Hz   4:3     67.500 kHz    108.000000 MHz
    DMT 0x55:  1280x720    60.000000 Hz  16:9     45.000 kHz     74.250000 MHz
    DMT 0x20:  1280x960    60.000000 Hz   4:3     60.000 kHz    108.000000 MHz
    DMT 0x23:  1280x1024   60.019740 Hz   5:4     63.981 kHz    108.000000 MHz
    DMT 0x53:  1600x900    60.000000 Hz  16:9     60.000 kHz    108.000000 MHz (RB)
    DMT 0x3a:  1680x1050   59.954250 Hz  16:10    65.290 kHz    146.250000 MHz
    DMT 0x52:  1920x1080   60.000000 Hz  16:9     67.500 kHz    148.500000 MHz
  Detailed Timing Descriptors:
    DTD 1:  3440x1440   60.001871 Hz  43:18    89.103 kHz    320.770000 MHz (797 mm x 334 mm)
                 Hfront   48 Hsync  32 Hback   80 Hpol P
                 Vfront    3 Vsync   5 Vback   37 Vpol N
    Display Product Serial Number: ...
    Display Range Limits:
      Monitor ranges (Range Limits Only): 48-144 Hz V, 160-160 kHz H, max dotclock 600 MHz
    Display Product Name: '34GLR-H'
  Extension blocks: 2
Checksum: 0xec

----------------

Block 1, CTA-861 Extension Block:
  Revision: 3
  Underscans IT Video Formats by default
  Basic audio support
  Supports YCbCr 4:4:4
  Supports YCbCr 4:2:2
  Native DTDs: 4
  Video Data Block:
    VIC   1:   640x480    59.940476 Hz   4:3     31.469 kHz     25.175000 MHz
    VIC   2:   720x480    59.940060 Hz   4:3     31.469 kHz     27.000000 MHz
    VIC   3:   720x480    59.940060 Hz  16:9     31.469 kHz     27.000000 MHz
    VIC   4:  1280x720    60.000000 Hz  16:9     45.000 kHz     74.250000 MHz
    VIC   5:  1920x1080i  60.000000 Hz  16:9     33.750 kHz     74.250000 MHz
    VIC  16:  1920x1080   60.000000 Hz  16:9     67.500 kHz    148.500000 MHz (native)
    VIC  17:   720x576    50.000000 Hz   4:3     31.250 kHz     27.000000 MHz
    VIC  18:   720x576    50.000000 Hz  16:9     31.250 kHz     27.000000 MHz
    VIC  19:  1280x720    50.000000 Hz  16:9     37.500 kHz     74.250000 MHz
    VIC  20:  1920x1080i  50.000000 Hz  16:9     28.125 kHz     74.250000 MHz
    VIC  31:  1920x1080   50.000000 Hz  16:9     56.250 kHz    148.500000 MHz
    VIC  64:  1920x1080  100.000000 Hz  16:9    112.500 kHz    297.000000 MHz
    VIC  63:  1920x1080  120.000000 Hz  16:9    135.000 kHz    297.000000 MHz
  Audio Data Block:
    Linear PCM:
      Max channels: 2
      Supported sample rates (kHz): 48 44.1 32
      Supported sample sizes (bits): 24 20 16
  Speaker Allocation Data Block:
    FL/FR - Front Left/Right
  HDR Static Metadata Data Block:
    Electro optical transfer functions:
      Traditional gamma - SDR luminance range
      Traditional gamma - HDR luminance range
      SMPTE ST2084
    Supported static metadata descriptors:
      Static metadata type 1
    Desired content max luminance: 101 (445.755 cd/m^2)
    Desired content max frame-average luminance: 96 (400.000 cd/m^2)
    Desired content min luminance: 41 (0.115 cd/m^2)
  Colorimetry Data Block:
    xvYCC601
    xvYCC709
    BT2020cYCC
    BT2020YCC
    BT2020RGB
    Gamut Boundary Description Metadata Profile P0
  Vendor-Specific Data Block (AMD), OUI 00-00-1A:
    Version: 1
    Feature Caps: 0x01
    Minimum Refresh Rate: 48 Hz
    Maximum Refresh Rate: 144 Hz
    Flags 1.x: 0x00
  Detailed Timing Descriptors:
    DTD 2:  1920x1080   60.000000 Hz  16:9     67.500 kHz    148.500000 MHz (797 mm x 334 mm)
                 Hfront   88 Hsync  44 Hback  148 Hpol P
                 Vfront    9 Vsync   6 Vback   30 Vpol P
    DTD 3:  2560x1440  120.003961 Hz  16:9    178.206 kHz    484.720000 MHz (797 mm x 334 mm)
                 Hfront   48 Hsync  32 Hback   80 Hpol P
                 Vfront    3 Vsync   5 Vback   37 Vpol N
    DTD 4:  3440x1440  100.001871 Hz  43:18   148.503 kHz    534.610000 MHz (797 mm x 334 mm)
                 Hfront   48 Hsync  32 Hback   80 Hpol P
                 Vfront    3 Vsync   5 Vback   37 Vpol N
    DTD 5:  1720x1440   59.999355 Hz  43:36    89.399 kHz    185.950000 MHz (797 mm x 334 mm)
                 Hfront   48 Hsync  64 Hback  248 Hpol P
                 Vfront    3 Vsync   5 Vback   42 Vpol N
Checksum: 0x24  Unused space in Extension Block: 9 bytes

----------------

Block 2, DisplayID Extension Block:
  Version: 1.2
  Extension Count: 0
  Display Product Type: Extension Section
  Video Timing Modes Type 1 - Detailed Timings Data Block:
    DTD:  3440x1440  144.001122 Hz  16:9    213.842 kHz    769.830000 MHz (aspect 16:9, no 3D stereo)
               Hfront   48 Hsync  32 Hback   80 Hpol N
               Vfront    3 Vsync   5 Vback   37 Vpol P
    DTD:  2560x1440   60.001981 Hz  16:9     89.103 kHz    242.360000 MHz (aspect 16:9, no 3D stereo)
               Hfront   48 Hsync  32 Hback   80 Hpol N
               Vfront    3 Vsync   5 Vback   37 Vpol N
    DTD:  1920x1080  144.003459 Hz  16:9    162.004 kHz    333.080000 MHz (aspect 16:9, no 3D stereo)
               Hfront   24 Hsync  32 Hback   80 Hpol P
               Vfront    3 Vsync   5 Vback   37 Vpol N
    DTD:  3440x1440   50.000000 Hz  16:9     74.250 kHz    267.300000 MHz (aspect 16:9, no 3D stereo)
               Hfront   48 Hsync  32 Hback   80 Hpol N
               Vfront    3 Vsync   5 Vback   37 Vpol N
    DTD:  3440x1440  119.999625 Hz  16:9    177.719 kHz    639.790000 MHz (aspect 16:9, 3D stereo)
               Hfront   48 Hsync  32 Hback   80 Hpol N
               Vfront    3 Vsync   5 Vback   33 Vpol N
  Supported Timing Modes Type 1 - VESA DMT Timings Data Block:
    DMT 0x04:   640x480    59.940476 Hz   4:3     31.469 kHz     25.175000 MHz
    DMT 0x09:   800x600    60.316541 Hz   4:3     37.879 kHz     40.000000 MHz
    DMT 0x10:  1024x768    60.003840 Hz   4:3     48.363 kHz     65.000000 MHz
    DMT 0x1c:  1280x800    59.810326 Hz  16:10    49.702 kHz     83.500000 MHz
    DMT 0x23:  1280x1024   60.019740 Hz   5:4     63.981 kHz    108.000000 MHz
    DMT 0x33:  1600x1200   60.000000 Hz   4:3     75.000 kHz    162.000000 MHz
    DMT 0x3a:  1680x1050   59.954250 Hz  16:10    65.290 kHz    146.250000 MHz
    DMT 0x45:  1920x1200   59.884600 Hz  16:10    74.556 kHz    193.250000 MHz
  Checksum: 0xad
Checksum: 0x90

----------------

Warnings:

Block 0, Base EDID:
  Display Product Serial Number: ...
Block 1, CTA-861 Extension Block:
  Video Data Block: VIC 1 and the first DTD are not identical. Is this intended?
  Colorimetry Data Block: Set the sRGB colorimetry bit to avoid interop issues.
  Detailed Timing Descriptor #2: DTD is similar but not identical to VIC 16.
  Detailed Timing Descriptor #2: Image size is 797x334 mm, but based on the picture AR it should be 593x334 mm.
  Detailed Timing Descriptor #3: Image size is 797x334 mm, but based on the picture AR it should be 593x334 mm.
  Detailed Timing Descriptor #5: Image size is 797x334 mm, but based on the picture AR it should be 398x334 mm.
EDID:
  Base EDID: Some timings are out of range of the Monitor Ranges:
    Horizontal Freq: 28.125 - 213.841 kHz (Monitor: 160.000 - 160.000 kHz)
    Maximum Clock: 769.830 MHz (Monitor: 600.000 MHz)

Failures:

Block 1, CTA-861 Extension Block:
  Missing VCDB, needed for Set Selectable RGB Quantization to avoid interop issues.
Block 2, DisplayID Extension Block:
  DisplayID Base Block has no product type.
EDID:
  Extension Block 3 started with EDID header, ignoring Extension Blocks >= 3.
  CTA-861: Native progressive timings are a mix of several resolutions.
  DisplayID: Missing DisplayID Stereo Display Interface Data Block.
  DisplayID: DisplayID expects at least one preferred timing.

EDID conformity: FAIL
