edid-decode (hex):

00 ff ff ff ff ff ff 00 31 03 ff ff 00 00 00 00
0a 21 01 04 b5 3c 22 78 3d 74 e5 aa 50 43 b1 24
09 50 54 a5 4b 00 81 80 01 01 b3 00 d1 c0 71 4f
a9 c0 81 40 81 c0 fd 5e 00 a0 a0 a0 32 50 58 2c
35 00 54 4f 21 00 00 1a 00 00 00 fd 00 30 a5 ff
ff 6e 01 0a 20 20 20 20 20 20 00 00 00 fc 00 50
32 37 41 32 52 0a 20 20 20 20 20 20 00 00 00 ff
00 30 30 30 30 30 30 30 30 30 30 30 30 30 02 50

02 03 2a f1 23 09 07 07 83 01 00 00 48 01 3f 04
90 11 13 1f 12 e2 00 7f e3 05 c0 00 6d 1a 00 00
02 01 30 a5 00 00 00 00 00 00 02 3a 80 18 71 38
2d 40 58 2c 45 00 54 4f 21 00 00 1e 6f c2 00 a0
a0 a0 55 50 30 20 35 00 54 4f 21 00 00 1a 34 e3
00 a0 a0 a0 2d 50 30 20 35 00 54 4f 21 00 00 1a
00 00 00 00 00 00 00 00 00 00 00 00 00 00 00 00
00 00 00 00 00 00 00 00 00 00 00 00 00 00 00 c4

00 ff ff ff ff ff ff 00 31 03 ff ff 00 00 00 00
0a 21 01 04 b5 3c 22 78 3d 74 e5 aa 50 43 b1 24
09 50 54 a5 4b 00 81 80 01 01 b3 00 d1 c0 71 4f
a9 c0 81 40 81 c0 fd 5e 00 a0 a0 a0 32 50 58 2c
35 00 54 4f 21 00 00 1a 00 00 00 fd 00 30 a5 ff
ff 6e 01 0a 20 20 20 20 20 20 00 00 00 fc 00 50
32 37 41 32 52 0a 20 20 20 20 20 20 00 00 00 ff
00 30 30 30 30 30 30 30 30 30 30 30 30 30 02 50

00 ff ff ff ff ff ff 00 31 03 ff ff 00 00 00 00
0a 21 01 04 b5 3c 22 78 3d 74 e5 aa 50 43 b1 24
09 50 54 a5 4b 00 81 80 01 01 b3 00 d1 c0 71 4f
a9 c0 81 40 81 c0 fd 5e 00 a0 a0 a0 32 50 58 2c
35 00 54 4f 21 00 00 1a 00 00 00 fd 00 30 a5 ff
ff 6e 01 0a 20 20 20 20 20 20 00 00 00 fc 00 50
32 37 41 32 52 0a 20 20 20 20 20 20 00 00 00 ff
00 30 30 30 30 30 30 30 30 30 30 30 30 30 02 50

02 03 2a f1 23 09 07 07 83 01 00 00 48 01 3f 04
90 11 13 1f 12 e2 00 7f e3 05 c0 00 6d 1a 00 00
02 01 30 a5 00 00 00 00 00 00 02 3a 80 18 71 38
2d 40 58 2c 45 00 54 4f 21 00 00 1e 6f c2 00 a0
a0 a0 55 50 30 20 35 00 54 4f 21 00 00 1a 34 e3
00 a0 a0 a0 2d 50 30 20 35 00 54 4f 21 00 00 1a
00 00 00 00 00 00 00 00 00 00 00 00 00 00 00 00
00 00 00 00 00 00 00 00 00 00 00 00 00 00 00 c4

00 ff ff ff ff ff ff 00 31 03 ff ff 00 00 00 00
0a 21 01 04 b5 3c 22 78 3d 74 e5 aa 50 43 b1 24
09 50 54 a5 4b 00 81 80 01 01 b3 00 d1 c0 71 4f
a9 c0 81 40 81 c0 fd 5e 00 a0 a0 a0 32 50 58 2c
35 00 54 4f 21 00 00 1a 00 00 00 fd 00 30 a5 ff
ff 6e 01 0a 20 20 20 20 20 20 00 00 00 fc 00 50
32 37 41 32 52 0a 20 20 20 20 20 20 00 00 00 ff
00 30 30 30 30 30 30 30 30 30 30 30 30 30 02 50

----------------

Block 0, Base EDID:
  EDID Structure Version & Revision: 1.4
  Vendor & Product Identification:
    Manufacturer: LHC
    Model: 65535
    Made in: week 10 of 2023
  Basic Display Parameters & Features:
    Digital display
    Bits per primary color channel: 10
    DisplayPort interface
    Maximum image size: 60 cm x 34 cm
    Gamma: 2.20
    DPMS levels: Off
    Supported color formats: RGB 4:4:4, YCrCb 4:4:4, YCrCb 4:2:2
    Default (sRGB) color space is primary color space
    First detailed timing does not include the native pixel format and preferred refresh rate
    Display supports continuous frequencies
  Color Characteristics:
    Red  : 0.6650, 0.3154
    Green: 0.2626, 0.6914
    Blue : 0.1435, 0.0371
    White: 0.3134, 0.3291
  Established Timings I & II:
    IBM     :   720x400    70.081663 Hz   9:5     31.467 kHz     28.320000 MHz
    DMT 0x04:   640x480    59.940476 Hz   4:3     31.469 kHz     25.175000 MHz
    DMT 0x06:   640x480    75.000000 Hz   4:3     37.500 kHz     31.500000 MHz
    DMT 0x09:   800x600    60.316541 Hz   4:3     37.879 kHz     40.000000 MHz
    DMT 0x0b:   800x600    75.000000 Hz   4:3     46.875 kHz     49.500000 MHz
    DMT 0x10:  1024x768    60.003840 Hz   4:3     48.363 kHz     65.000000 MHz
    DMT 0x12:  1024x768    75.028582 Hz   4:3     60.023 kHz     78.750000 MHz
    DMT 0x24:  1280x1024   75.024675 Hz   5:4     79.976 kHz    135.000000 MHz
  Standard Timings:
    DMT 0x23:  1280x1024   60.019740 Hz   5:4     63.981 kHz    108.000000 MHz
    DMT 0x3a:  1680x1050   59.954250 Hz  16:10    65.290 kHz    146.250000 MHz
    DMT 0x52:  1920x1080   60.000000 Hz  16:9     67.500 kHz    148.500000 MHz
    DMT 0x15:  1152x864    75.000000 Hz   4:3     67.500 kHz    108.000000 MHz
    DMT 0x53:  1600x900    60.000000 Hz  16:9     60.000 kHz    108.000000 MHz (RB)
    DMT 0x20:  1280x960    60.000000 Hz   4:3     60.000 kHz    108.000000 MHz
    DMT 0x55:  1280x720    60.000000 Hz  16:9     45.000 kHz     74.250000 MHz
  Detailed Timing Descriptors:
    DTD 1:  2560x1440   60.000493 Hz  16:9     89.401 kHz    243.170000 MHz (596 mm x 335 mm)
                 Hfront   88 Hsync  44 Hback   28 Hpol P
                 Vfront    3 Vsync   5 Vback   42 Vpol N
    Display Range Limits:
      Monitor ranges (Range Limits Only): 48-165 Hz V, 255-255 kHz H, max dotclock 1100 MHz
    Display Product Name: 'P27A2R'
    Display Product Serial Number: ...
  Extension blocks: 2
Checksum: 0x50

----------------

Block 1, CTA-861 Extension Block:
  Revision: 3
  Underscans IT Video Formats by default
  Basic audio support
  Supports YCbCr 4:4:4
  Supports YCbCr 4:2:2
  Native DTDs: 1
  Audio Data Block:
    Linear PCM:
      Max channels: 2
      Supported sample rates (kHz): 48 44.1 32
      Supported sample sizes (bits): 24 20 16
  Speaker Allocation Data Block:
    FL/FR - Front Left/Right
  Video Data Block:
    VIC   1:   640x480    59.940476 Hz   4:3     31.469 kHz     25.175000 MHz
    VIC  63:  1920x1080  120.000000 Hz  16:9    135.000 kHz    297.000000 MHz
    VIC   4:  1280x720    60.000000 Hz  16:9     45.000 kHz     74.250000 MHz
    VIC  16:  1920x1080   60.000000 Hz  16:9     67.500 kHz    148.500000 MHz (native)
    VIC  17:   720x576    50.000000 Hz   4:3     31.250 kHz     27.000000 MHz
    VIC  19:  1280x720    50.000000 Hz  16:9     37.500 kHz     74.250000 MHz
    VIC  31:  1920x1080   50.000000 Hz  16:9     56.250 kHz    148.500000 MHz
    VIC  18:   720x576    50.000000 Hz  16:9     31.250 kHz     27.000000 MHz
  Video Capability Data Block:
    YCbCr quantization: No Data
    RGB quantization: Selectable (via AVI Q)
    PT scan behavior: Supports both over- and underscan
    IT scan behavior: Supports both over- and underscan
    CE scan behavior: Supports both over- and underscan
  Colorimetry Data Block:
    BT2020YCC
    BT2020RGB
  Vendor-Specific Data Block (AMD), OUI 00-00-1A:
    Version: 2
    Feature Caps: 0x01
    Minimum Refresh Rate: 48 Hz
    Maximum Refresh Rate: 165 Hz
    Flags 1.x: 0x00
    Flags 2.x: 0x00
  Detailed Timing Descriptors:
    DTD 2:  1920x1080   60.000000 Hz  16:9     67.500 kHz    148.500000 MHz (596 mm x 335 mm)
                 Hfront   88 Hsync  44 Hback  148 Hpol P
                 Vfront    4 Vsync   5 Vback   36 Vpol P
    DTD 3:  2560x1440  119.997589 Hz  16:9    182.996 kHz    497.750000 MHz (596 mm x 335 mm)
                 Hfront   48 Hsync  32 Hback   80 Hpol P
                 Vfront    3 Vsync   5 Vback   77 Vpol N
    DTD 4:  2560x1440  143.998812 Hz  16:9    213.838 kHz    581.640000 MHz (596 mm x 335 mm)
                 Hfront   48 Hsync  32 Hback   80 Hpol P
                 Vfront    3 Vsync   5 Vback   37 Vpol N
Checksum: 0xc4  Unused space in Extension Block: 31 bytes

----------------

Warnings:

Block 0, Base EDID:
  Display Product Serial Number: ...
Block 1, CTA-861 Extension Block:
  Video Data Block: VIC 1 and the first DTD are not identical. Is this intended?
  Video Capability Data Block: Set Selectable YCbCr Quantization to avoid interop issues.
  Video Capability Data Block: S_PT is equal to S_IT and S_CE, so should be set to 0 instead.
EDID:
  Base EDID: Some timings are out of range of the Monitor Ranges:
    Horizontal Freq: 31.250 - 213.838 kHz (Monitor: 255.000 - 255.000 kHz)

Failures:

Block 0, Base EDID:
  Basic Display Parameters & Features: sRGB is signaled, but the chromaticities do not match.
EDID:
  Extension Block 2 started with EDID header, ignoring Extension Blocks >= 2.
  Base EDID: EDID specified 2 extension block(s), but found 1 extension block(s).
  CTA-861: Native progressive timings are a mix of several resolutions.

EDID conformity: FAIL
