edid-decode (hex):

00 ff ff ff ff ff ff 00 31 03 ff ff 00 00 00 00
2f 20 01 04 b5 78 22 78 3b 28 15 b1 4b 45 a7 27
13 50 54 a5 4b 00 d1 c0 b3 00 01 01 81 80 81 c0
81 40 a9 c0 71 4f 92 69 00 c8 f0 38 23 40 30 20
35 00 ae 4f 41 00 00 1a 10 d1 00 a0 f0 38 23 40
30 20 35 00 ae 4f 41 00 00 1a 00 00 00 fc 00 42
53 34 39 44 46 48 44 2d 43 0a 20 20 00 00 00 fd
00 30 90 88 88 40 01 0a 20 20 20 20 20 20 01 5e

02 03 30 f4 4f 01 02 03 04 05 10 11 12 13 14 1f
3f 5f 60 61 23 09 07 07 83 01 00 00 68 1a 00 00
01 07 30 90 00 e3 05 e3 01 e6 06 07 01 66 5a 1e
3a f6 00 64 f0 38 1f 40 30 20 35 00 ae 4f 41 00
00 1a f2 7f 80 78 70 38 23 40 30 20 35 00 ae 4f
41 00 00 1a 14 47 00 a0 a0 38 23 40 30 20 35 00
ae 4f 41 00 00 1a 00 00 00 00 00 00 00 00 00 00
00 00 00 00 00 00 00 00 00 00 00 00 00 00 00 9f

00 ff ff ff ff ff ff 00 31 03 ff ff 00 00 00 00
2f 20 01 04 b5 78 22 78 3b 28 15 b1 4b 45 a7 27
13 50 54 a5 4b 00 d1 c0 b3 00 01 01 81 80 81 c0
81 40 a9 c0 71 4f 92 69 00 c8 f0 38 23 40 30 20
35 00 ae 4f 41 00 00 1a 10 d1 00 a0 f0 38 23 40
30 20 35 00 ae 4f 41 00 00 1a 00 00 00 fc 00 42
53 34 39 44 46 48 44 2d 43 0a 20 20 00 00 00 fd
00 30 90 88 88 40 01 0a 20 20 20 20 20 20 01 5e

02 03 30 f4 4f 01 02 03 04 05 10 11 12 13 14 1f
3f 5f 60 61 23 09 07 07 83 01 00 00 68 1a 00 00
01 07 30 90 00 e3 05 e3 01 e6 06 07 01 66 5a 1e
3a f6 00 64 f0 38 1f 40 30 20 35 00 ae 4f 41 00
00 1a f2 7f 80 78 70 38 23 40 30 20 35 00 ae 4f
41 00 00 1a 14 47 00 a0 a0 38 23 40 30 20 35 00
ae 4f 41 00 00 1a 00 00 00 00 00 00 00 00 00 00
00 00 00 00 00 00 00 00 00 00 00 00 00 00 00 9f

----------------

Block 0, Base EDID:
  EDID Structure Version & Revision: 1.4
  Vendor & Product Identification:
    Manufacturer: LHC
    Model: 65535
    Made in: week 47 of 2022
  Basic Display Parameters & Features:
    Digital display
    Bits per primary color channel: 10
    DisplayPort interface
    Maximum image size: 120 cm x 34 cm
    Gamma: 2.20
    DPMS levels: Off
    Supported color formats: RGB 4:4:4, YCrCb 4:4:4, YCrCb 4:2:2
    First detailed timing includes the native pixel format and preferred refresh rate
    Display supports continuous frequencies
  Color Characteristics:
    Red  : 0.6914, 0.2949
    Green: 0.2714, 0.6523
    Blue : 0.1523, 0.0751
    White: 0.3134, 0.3291
  Established Timings I & II:
    IBM     :   720x400    70.081663 Hz   9:5     31.467 kHz     28.320000 MHz
    DMT 0x04:   640x480    59.940476 Hz   4:3     31.469 kHz     25.175000 MHz
    DMT 0x06:   640x480    75.000000 Hz   4:3     37.500 kHz     31.500000 MHz
    DMT 0x09:   800x600    60.316541 Hz   4:3     37.879 kHz     40.000000 MHz
    DMT 0x0b:   800x600    75.000000 Hz   4:3     46.875 kHz     49.500000 MHz
    DMT 0x10:  1024x768    60.003840 Hz   4:3     48.363 kHz     65.000000 MHz
    DMT 0x12:  1024x768    75.028582 Hz   4:3     60.023 kHz     78.750000 MHz
    DMT 0x24:  1280x1024   75.024675 Hz   5:4     79.976 kHz    135.000000 MHz
  Standard Timings:
    DMT 0x52:  1920x1080   60.000000 Hz  16:9     67.500 kHz    148.500000 MHz
    DMT 0x3a:  1680x1050   59.954250 Hz  16:10    65.290 kHz    146.250000 MHz
    DMT 0x23:  1280x1024   60.019740 Hz   5:4     63.981 kHz    108.000000 MHz
    DMT 0x55:  1280x720    60.000000 Hz  16:9     45.000 kHz     74.250000 MHz
    DMT 0x20:  1280x960    60.000000 Hz   4:3     60.000 kHz    108.000000 MHz
    DMT 0x53:  1600x900    60.000000 Hz  16:9     60.000 kHz    108.000000 MHz (RB)
    DMT 0x15:  1152x864    75.000000 Hz   4:3     67.500 kHz    108.000000 MHz
  Detailed Timing Descriptors:
    DTD 1:  3840x1080   59.996448 Hz  32:9     66.896 kHz    270.260000 MHz (1198 mm x 335 mm)
                 Hfront   48 Hsync  32 Hback  120 Hpol P
                 Vfront    3 Vsync   5 Vback   27 Vpol N
    DTD 2:  3840x1080  120.000000 Hz  32:9    133.800 kHz    535.200000 MHz (1198 mm x 335 mm)
                 Hfront   48 Hsync  32 Hback   80 Hpol P
                 Vfront    3 Vsync   5 Vback   27 Vpol N
    Display Product Name: 'BS49DFHD-C'
    Display Range Limits:
      Monitor ranges (Range Limits Only): 48-144 Hz V, 136-136 kHz H, max dotclock 640 MHz
  Extension blocks: 1
Checksum: 0x5e

----------------

Block 1, CTA-861 Extension Block:
  Revision: 3
  Underscans IT Video Formats by default
  Basic audio support
  Supports YCbCr 4:4:4
  Supports YCbCr 4:2:2
  Native detailed modes: 4
  Video Data Block:
    VIC   1:   640x480    59.940476 Hz   4:3     31.469 kHz     25.175000 MHz
    VIC   2:   720x480    59.940060 Hz   4:3     31.469 kHz     27.000000 MHz
    VIC   3:   720x480    59.940060 Hz  16:9     31.469 kHz     27.000000 MHz
    VIC   4:  1280x720    60.000000 Hz  16:9     45.000 kHz     74.250000 MHz
    VIC   5:  1920x1080i  60.000000 Hz  16:9     33.750 kHz     74.250000 MHz
    VIC  16:  1920x1080   60.000000 Hz  16:9     67.500 kHz    148.500000 MHz
    VIC  17:   720x576    50.000000 Hz   4:3     31.250 kHz     27.000000 MHz
    VIC  18:   720x576    50.000000 Hz  16:9     31.250 kHz     27.000000 MHz
    VIC  19:  1280x720    50.000000 Hz  16:9     37.500 kHz     74.250000 MHz
    VIC  20:  1920x1080i  50.000000 Hz  16:9     28.125 kHz     74.250000 MHz
    VIC  31:  1920x1080   50.000000 Hz  16:9     56.250 kHz    148.500000 MHz
    VIC  63:  1920x1080  120.000000 Hz  16:9    135.000 kHz    297.000000 MHz
    VIC  95:  3840x2160   30.000000 Hz  16:9     67.500 kHz    297.000000 MHz
    VIC  96:  3840x2160   50.000000 Hz  16:9    112.500 kHz    594.000000 MHz
    VIC  97:  3840x2160   60.000000 Hz  16:9    135.000 kHz    594.000000 MHz
  Audio Data Block:
    Linear PCM:
      Max channels: 2
      Supported sample rates (kHz): 48 44.1 32
      Supported sample sizes (bits): 24 20 16
  Speaker Allocation Data Block:
    FL/FR - Front Left/Right
  Vendor-Specific Data Block (AMD), OUI 00-00-1A:
    Version: 1
    Feature Caps: 0x07
    Minimum Refresh Rate: 48 Hz
    Maximum Refresh Rate: 144 Hz
    Flags 1.x: 0x00
  Colorimetry Data Block:
    xvYCC601
    xvYCC709
    BT2020cYCC
    BT2020YCC
    BT2020RGB
    Gamut Boundary Description Metadata Profile P0
  HDR Static Metadata Data Block:
    Electro optical transfer functions:
      Traditional gamma - SDR luminance range
      Traditional gamma - HDR luminance range
      SMPTE ST2084
    Supported static metadata descriptors:
      Static metadata type 1
    Desired content max luminance: 102 (455.515 cd/m^2)
    Desired content max frame-average luminance: 90 (351.250 cd/m^2)
    Desired content min luminance: 30 (0.063 cd/m^2)
  Detailed Timing Descriptors:
    DTD 3:  3840x1080  144.000694 Hz  32:9    159.985 kHz    630.340000 MHz (1198 mm x 335 mm)
                 Hfront   48 Hsync  32 Hback   20 Hpol P
                 Vfront    3 Vsync   5 Vback   23 Vpol N
    DTD 4:  1920x1080  143.998945 Hz  16:9    160.559 kHz    327.540000 MHz (1198 mm x 335 mm)
                 Hfront   48 Hsync  32 Hback   40 Hpol P
                 Vfront    3 Vsync   5 Vback   27 Vpol N
    DTD 5:  2560x1080   59.997362 Hz  64:27    66.897 kHz    181.960000 MHz (1198 mm x 335 mm)
                 Hfront   48 Hsync  32 Hback   80 Hpol P
                 Vfront    3 Vsync   5 Vback   27 Vpol N
Checksum: 0x9f  Unused space in Extension Block: 25 bytes

----------------

Block 2, Unknown EDID Extension Block 0x00:
  00 ff ff ff ff ff ff 00 31 03 ff ff 00 00 00 00 '........1.......'
  2f 20 01 04 b5 78 22 78 3b 28 15 b1 4b 45 a7 27 '/ ...x"x;(..KE.''
  13 50 54 a5 4b 00 d1 c0 b3 00 01 01 81 80 81 c0 '.PT.K...........'
  81 40 a9 c0 71 4f 92 69 00 c8 f0 38 23 40 30 20 '.@..qO.i...8#@0 '
  35 00 ae 4f 41 00 00 1a 10 d1 00 a0 f0 38 23 40 '5..OA........8#@'
  30 20 35 00 ae 4f 41 00 00 1a 00 00 00 fc 00 42 '0 5..OA........B'
  53 34 39 44 46 48 44 2d 43 0a 20 20 00 00 00 fd 'S49DFHD-C.  ....'
  00 30 90 88 88 40 01 0a 20 20 20 20 20 20 01 5e '.0...@..      .^'
Checksum: 0x5e

----------------

Block 3, CTA-861 Extension Block:
  Revision: 3
  Underscans IT Video Formats by default
  Basic audio support
  Supports YCbCr 4:4:4
  Supports YCbCr 4:2:2
  Native detailed modes: 4
  Video Data Block:
    VIC   1:   640x480    59.940476 Hz   4:3     31.469 kHz     25.175000 MHz
    VIC   2:   720x480    59.940060 Hz   4:3     31.469 kHz     27.000000 MHz
    VIC   3:   720x480    59.940060 Hz  16:9     31.469 kHz     27.000000 MHz
    VIC   4:  1280x720    60.000000 Hz  16:9     45.000 kHz     74.250000 MHz
    VIC   5:  1920x1080i  60.000000 Hz  16:9     33.750 kHz     74.250000 MHz
    VIC  16:  1920x1080   60.000000 Hz  16:9     67.500 kHz    148.500000 MHz
    VIC  17:   720x576    50.000000 Hz   4:3     31.250 kHz     27.000000 MHz
    VIC  18:   720x576    50.000000 Hz  16:9     31.250 kHz     27.000000 MHz
    VIC  19:  1280x720    50.000000 Hz  16:9     37.500 kHz     74.250000 MHz
    VIC  20:  1920x1080i  50.000000 Hz  16:9     28.125 kHz     74.250000 MHz
    VIC  31:  1920x1080   50.000000 Hz  16:9     56.250 kHz    148.500000 MHz
    VIC  63:  1920x1080  120.000000 Hz  16:9    135.000 kHz    297.000000 MHz
    VIC  95:  3840x2160   30.000000 Hz  16:9     67.500 kHz    297.000000 MHz
    VIC  96:  3840x2160   50.000000 Hz  16:9    112.500 kHz    594.000000 MHz
    VIC  97:  3840x2160   60.000000 Hz  16:9    135.000 kHz    594.000000 MHz
  Audio Data Block:
    Linear PCM:
      Max channels: 2
      Supported sample rates (kHz): 48 44.1 32
      Supported sample sizes (bits): 24 20 16
  Speaker Allocation Data Block:
    FL/FR - Front Left/Right
  Vendor-Specific Data Block (AMD), OUI 00-00-1A:
    Version: 1
    Feature Caps: 0x07
    Minimum Refresh Rate: 48 Hz
    Maximum Refresh Rate: 144 Hz
    Flags 1.x: 0x00
  Colorimetry Data Block:
    xvYCC601
    xvYCC709
    BT2020cYCC
    BT2020YCC
    BT2020RGB
    Gamut Boundary Description Metadata Profile P0
  HDR Static Metadata Data Block:
    Electro optical transfer functions:
      Traditional gamma - SDR luminance range
      Traditional gamma - HDR luminance range
      SMPTE ST2084
    Supported static metadata descriptors:
      Static metadata type 1
    Desired content max luminance: 102 (455.515 cd/m^2)
    Desired content max frame-average luminance: 90 (351.250 cd/m^2)
    Desired content min luminance: 30 (0.063 cd/m^2)
  Detailed Timing Descriptors:
    DTD 6:  3840x1080  144.000694 Hz  32:9    159.985 kHz    630.340000 MHz (1198 mm x 335 mm)
                 Hfront   48 Hsync  32 Hback   20 Hpol P
                 Vfront    3 Vsync   5 Vback   23 Vpol N
    DTD 7:  1920x1080  143.998945 Hz  16:9    160.559 kHz    327.540000 MHz (1198 mm x 335 mm)
                 Hfront   48 Hsync  32 Hback   40 Hpol P
                 Vfront    3 Vsync   5 Vback   27 Vpol N
    DTD 8:  2560x1080   59.997362 Hz  64:27    66.897 kHz    181.960000 MHz (1198 mm x 335 mm)
                 Hfront   48 Hsync  32 Hback   80 Hpol P
                 Vfront    3 Vsync   5 Vback   27 Vpol N
Checksum: 0x9f  Unused space in Extension Block: 25 bytes

----------------

Warnings:

Block 1, CTA-861 Extension Block:
  Video Data Block: VIC 1 and the first DTD are not identical. Is this intended?
  Video Data Block: All VICs are in ascending order, and the first (preferred) VIC <= 4, is that intended?
  Colorimetry Data Block: Set the sRGB colorimetry bit to avoid interop issues.
  Detailed Timing Descriptor #4: Image size is 1198x335 mm, but based on the picture AR it should be 1198x673 mm.
  Detailed Timing Descriptor #5: Image size is 1198x335 mm, but based on the picture AR it should be 1198x505 mm.
Block 3, CTA-861 Extension Block:
  Video Data Block: All VICs are in ascending order, and the first (preferred) VIC <= 4, is that intended?
  Colorimetry Data Block: Set the sRGB colorimetry bit to avoid interop issues.
  Detailed Timing Descriptor #7: Image size is 1198x335 mm, but based on the picture AR it should be 1198x673 mm.
  Detailed Timing Descriptor #8: Image size is 1198x335 mm, but based on the picture AR it should be 1198x505 mm.
EDID:
  Base EDID: Some timings are out of range of the Monitor Ranges:
    Vertical Freq: 30.000 - 144.001 Hz (Monitor: 48.000 - 144.000 Hz)
    Horizontal Freq: 28.125 - 160.558 kHz (Monitor: 136.000 - 136.000 kHz)

Failures:

Block 1, CTA-861 Extension Block:
  Missing VCDB, needed for Set Selectable RGB Quantization to avoid interop issues.
Block 2, Base EDID:
  Unknown Extension Block.
Block 3, CTA-861 Extension Block:
  Video Data Block: Duplicate VIC 1.
  Video Data Block: Duplicate VIC 2.
  Video Data Block: Duplicate VIC 3.
  Video Data Block: Duplicate VIC 4.
  Video Data Block: Duplicate VIC 5.
  Video Data Block: Duplicate VIC 16.
  Video Data Block: Duplicate VIC 17.
  Video Data Block: Duplicate VIC 18.
  Video Data Block: Duplicate VIC 19.
  Video Data Block: Duplicate VIC 20.
  Video Data Block: Duplicate VIC 31.
  Video Data Block: Duplicate VIC 63.
  Video Data Block: Duplicate VIC 95.
  Video Data Block: Duplicate VIC 96.
  Video Data Block: Duplicate VIC 97.
  Speaker Allocation Data Block: Only one instance of this Data Block is allowed.
  Colorimetry Data Block: Only one instance of this Data Block is allowed.
  HDR Static Metadata Data Block: Only one instance of this Data Block is allowed.
EDID:
  Base EDID: EDID specified 1 extension block(s), but found 3 extension block(s).
  CTA-861: Native progressive timings are a mix of several resolutions.

EDID conformity: FAIL
