edid-decode (hex):

00 ff ff ff ff ff ff 00 31 03 ff ff 00 00 00 00
2c 20 01 03 80 3c 22 78 2a 64 f5 ad 50 49 a3 22
13 50 54 a5 4b 00 71 4f 81 c0 81 40 81 80 95 00
a9 c0 b3 00 d1 c0 02 3a 80 18 71 38 2d 40 58 2c
45 00 56 4f 21 00 00 1e 00 00 00 fd 00 3c 78 1f
a2 1e 00 0a 20 20 20 20 20 20 00 00 00 fc 00 4c
4d 32 37 2d 45 32 33 31 0a 20 20 20 00 00 00 ff
00 20 20 20 20 20 20 20 20 20 20 20 20 0a 01 09

02 03 2a f1 4c 90 01 02 03 04 05 11 12 13 14 1f
3f 23 09 7f 07 83 01 00 00 67 03 0c 00 20 00 38
42 68 1a 00 00 01 01 30 78 00 8a 6f 80 a0 70 38
40 40 30 20 35 00 56 4f 21 00 00 1e 00 00 00 00
00 00 00 00 00 00 00 00 00 00 00 00 00 00 00 00
00 00 00 00 00 00 00 00 00 00 00 00 00 00 00 00
00 00 00 00 00 00 00 00 00 00 00 00 00 00 00 00
00 00 00 00 00 00 00 00 00 00 00 00 00 00 00 31

00 ff ff ff ff ff ff 00 31 03 ff ff 00 00 00 00
2c 20 01 03 80 3c 22 78 2a 64 f5 ad 50 49 a3 22
13 50 54 a5 4b 00 71 4f 81 c0 81 40 81 80 95 00
a9 c0 b3 00 d1 c0 02 3a 80 18 71 38 2d 40 58 2c
45 00 56 4f 21 00 00 1e 00 00 00 fd 00 3c 78 1f
a2 1e 00 0a 20 20 20 20 20 20 00 00 00 fc 00 4c
4d 32 37 2d 45 32 33 31 0a 20 20 20 00 00 00 ff
00 20 20 20 20 20 20 20 20 20 20 20 20 0a 01 09

02 03 2a f1 4c 90 01 02 03 04 05 11 12 13 14 1f
3f 23 09 7f 07 83 01 00 00 67 03 0c 00 20 00 38
42 68 1a 00 00 01 01 30 78 00 8a 6f 80 a0 70 38
40 40 30 20 35 00 56 4f 21 00 00 1e 00 00 00 00
00 00 00 00 00 00 00 00 00 00 00 00 00 00 00 00
00 00 00 00 00 00 00 00 00 00 00 00 00 00 00 00
00 00 00 00 00 00 00 00 00 00 00 00 00 00 00 00
00 00 00 00 00 00 00 00 00 00 00 00 00 00 00 31

----------------

Block 0, Base EDID:
  EDID Structure Version & Revision: 1.3
  Vendor & Product Identification:
    Manufacturer: LHC
    Model: 65535
    Made in: week 44 of 2022
  Basic Display Parameters & Features:
    Digital display
    Maximum image size: 60 cm x 34 cm
    Gamma: 2.20
    DPMS levels: Off
    RGB color display
    First detailed timing is the preferred timing
  Color Characteristics:
    Red  : 0.6767, 0.3144
    Green: 0.2861, 0.6367
    Blue : 0.1357, 0.0771
    White: 0.3134, 0.3291
  Established Timings I & II:
    IBM     :   720x400    70.081663 Hz   9:5     31.467 kHz     28.320000 MHz
    DMT 0x04:   640x480    59.940476 Hz   4:3     31.469 kHz     25.175000 MHz
    DMT 0x06:   640x480    75.000000 Hz   4:3     37.500 kHz     31.500000 MHz
    DMT 0x09:   800x600    60.316541 Hz   4:3     37.879 kHz     40.000000 MHz
    DMT 0x0b:   800x600    75.000000 Hz   4:3     46.875 kHz     49.500000 MHz
    DMT 0x10:  1024x768    60.003840 Hz   4:3     48.363 kHz     65.000000 MHz
    DMT 0x12:  1024x768    75.028582 Hz   4:3     60.023 kHz     78.750000 MHz
    DMT 0x24:  1280x1024   75.024675 Hz   5:4     79.976 kHz    135.000000 MHz
  Standard Timings:
    DMT 0x15:  1152x864    75.000000 Hz   4:3     67.500 kHz    108.000000 MHz
    DMT 0x55:  1280x720    60.000000 Hz  16:9     45.000 kHz     74.250000 MHz
    DMT 0x20:  1280x960    60.000000 Hz   4:3     60.000 kHz    108.000000 MHz
    DMT 0x23:  1280x1024   60.019740 Hz   5:4     63.981 kHz    108.000000 MHz
    DMT 0x2f:  1440x900    59.887445 Hz  16:10    55.935 kHz    106.500000 MHz
    DMT 0x53:  1600x900    60.000000 Hz  16:9     60.000 kHz    108.000000 MHz (RB)
    DMT 0x3a:  1680x1050   59.954250 Hz  16:10    65.290 kHz    146.250000 MHz
    DMT 0x52:  1920x1080   60.000000 Hz  16:9     67.500 kHz    148.500000 MHz
  Detailed Timing Descriptors:
    DTD 1:  1920x1080   60.000000 Hz  16:9     67.500 kHz    148.500000 MHz (598 mm x 335 mm)
                 Hfront   88 Hsync  44 Hback  148 Hpol P
                 Vfront    4 Vsync   5 Vback   36 Vpol P
    Display Range Limits:
      Monitor ranges (GTF): 60-120 Hz V, 31-162 kHz H, max dotclock 300 MHz
    Display Product Name: 'LM27-E231'
    Display Product Serial Number: ...
  Extension blocks: 1
Checksum: 0x09

----------------

Block 1, CTA-861 Extension Block:
  Revision: 3
  Underscans IT Video Formats by default
  Basic audio support
  Supports YCbCr 4:4:4
  Supports YCbCr 4:2:2
  Native DTDs: 1
  Video Data Block:
    VIC  16:  1920x1080   60.000000 Hz  16:9     67.500 kHz    148.500000 MHz (native)
    VIC   1:   640x480    59.940476 Hz   4:3     31.469 kHz     25.175000 MHz
    VIC   2:   720x480    59.940060 Hz   4:3     31.469 kHz     27.000000 MHz
    VIC   3:   720x480    59.940060 Hz  16:9     31.469 kHz     27.000000 MHz
    VIC   4:  1280x720    60.000000 Hz  16:9     45.000 kHz     74.250000 MHz
    VIC   5:  1920x1080i  60.000000 Hz  16:9     33.750 kHz     74.250000 MHz
    VIC  17:   720x576    50.000000 Hz   4:3     31.250 kHz     27.000000 MHz
    VIC  18:   720x576    50.000000 Hz  16:9     31.250 kHz     27.000000 MHz
    VIC  19:  1280x720    50.000000 Hz  16:9     37.500 kHz     74.250000 MHz
    VIC  20:  1920x1080i  50.000000 Hz  16:9     28.125 kHz     74.250000 MHz
    VIC  31:  1920x1080   50.000000 Hz  16:9     56.250 kHz    148.500000 MHz
    VIC  63:  1920x1080  120.000000 Hz  16:9    135.000 kHz    297.000000 MHz
  Audio Data Block:
    Linear PCM:
      Max channels: 2
      Supported sample rates (kHz): 192 176.4 96 88.2 48 44.1 32
      Supported sample sizes (bits): 24 20 16
  Speaker Allocation Data Block:
    FL/FR - Front Left/Right
  Vendor-Specific Data Block (HDMI), OUI 00-0C-03:
    Source physical address: 2.0.0.0
    DC_36bit
    DC_30bit
    DC_Y444
    Maximum TMDS clock: 330 MHz
  Vendor-Specific Data Block (AMD), OUI 00-00-1A:
    Version: 1
    Feature Caps: 0x01
    Minimum Refresh Rate: 48 Hz
    Maximum Refresh Rate: 120 Hz
    Flags 1.x: 0x00
  Detailed Timing Descriptors:
    DTD 2:  1920x1080  119.998991 Hz  16:9    137.279 kHz    285.540000 MHz (598 mm x 335 mm)
                 Hfront   48 Hsync  32 Hback   80 Hpol P
                 Vfront    3 Vsync   5 Vback   56 Vpol P
Checksum: 0x31  Unused space in Extension Block: 67 bytes

----------------

Warnings:

Block 0, Base EDID:
  Display Product Serial Number: ...
Block 1, CTA-861 Extension Block:
  Add a Colorimetry Data Block with the sRGB colorimetry bit set to avoid interop issues.
EDID:
  Base EDID: Some timings are out of range of the Monitor Ranges:
    Vertical Freq: 50.000 - 120.000 Hz (Monitor: 60.000 - 120.000 Hz)
    Horizontal Freq: 28.125 - 137.278 kHz (Monitor: 31.000 - 162.000 kHz)

Failures:

Block 0, Base EDID:
  Display Product Serial Number: ...
Block 1, CTA-861 Extension Block:
  Missing VCDB, needed for Set Selectable RGB Quantization to avoid interop issues.
EDID:
  Extension Block 2 started with EDID header, ignoring Extension Blocks >= 2.

EDID conformity: FAIL
