edid-decode (hex):

00 ff ff ff ff ff ff 00 31 03 ff ff 00 00 00 00
1f 1f 01 04 b5 3c 22 78 3b f6 39 ac 4f 47 a4 25
10 4f 51 35 6b 80 d1 c0 b3 00 a9 c0 81 80 71 4f
81 c0 81 40 a9 40 56 5e 00 a0 a0 a0 29 50 30 20
35 00 55 50 21 00 00 1a 00 00 00 fd 00 30 90 a0
a0 3c 01 0a 20 20 20 20 20 20 00 00 00 fc 00 4f
56 2d 4b 52 32 37 56 51 31 34 0a 20 00 00 00 ff
00 30 30 30 30 30 30 30 30 30 30 30 30 30 01 78

02 03 2d f1 4c 3f 01 02 03 04 05 90 11 12 13 14
1f 23 09 07 07 83 01 00 00 68 1a 00 00 01 17 30
90 00 e3 05 e3 01 e6 06 07 01 65 60 20 9e e0 00
78 a0 a0 32 50 10 40 35 00 55 50 21 00 00 1a f2
7f 80 78 70 38 23 40 30 20 35 00 81 49 41 00 00
1e f5 bd 00 a0 a0 a0 32 50 20 40 45 00 55 50 21
00 00 1e 61 38 00 18 51 a0 66 50 20 28 55 00 55
50 21 00 00 1e 00 00 00 00 00 00 00 00 00 00 d8

00 ff ff ff ff ff ff 00 31 03 ff ff 00 00 00 00
1f 1f 01 04 b5 3c 22 78 3b f6 39 ac 4f 47 a4 25
10 4f 51 35 6b 80 d1 c0 b3 00 a9 c0 81 80 71 4f
81 c0 81 40 a9 40 56 5e 00 a0 a0 a0 29 50 30 20
35 00 55 50 21 00 00 1a 00 00 00 fd 00 30 90 a0
a0 3c 01 0a 20 20 20 20 20 20 00 00 00 fc 00 4f
56 2d 4b 52 32 37 56 51 31 34 0a 20 00 00 00 ff
00 30 30 30 30 30 30 30 30 30 30 30 30 30 01 78

02 03 2d f1 4c 3f 01 02 03 04 05 90 11 12 13 14
1f 23 09 07 07 83 01 00 00 68 1a 00 00 01 17 30
90 00 e3 05 e3 01 e6 06 07 01 65 60 20 9e e0 00
78 a0 a0 32 50 10 40 35 00 55 50 21 00 00 1a f2
7f 80 78 70 38 23 40 30 20 35 00 81 49 41 00 00
1e f5 bd 00 a0 a0 a0 32 50 20 40 45 00 55 50 21
00 00 1e 61 38 00 18 51 a0 66 50 20 28 55 00 55
50 21 00 00 1e 00 00 00 00 00 00 00 00 00 00 d8

----------------

Block 0, Base EDID:
  EDID Structure Version & Revision: 1.4
  Vendor & Product Identification:
    Manufacturer: LHC
    Model: 65535
    Made in: week 31 of 2021
  Basic Display Parameters & Features:
    Digital display
    Bits per primary color channel: 10
    DisplayPort interface
    Maximum image size: 60 cm x 34 cm
    Gamma: 2.20
    DPMS levels: Off
    Supported color formats: RGB 4:4:4, YCrCb 4:4:4, YCrCb 4:2:2
    First detailed timing includes the native pixel format and preferred refresh rate
    Display supports continuous frequencies
  Color Characteristics:
    Red  : 0.6748, 0.3115
    Green: 0.2783, 0.6425
    Blue : 0.1445, 0.0654
    White: 0.3105, 0.3173
  Established Timings I & II:
    DMT 0x04:   640x480    59.940476 Hz   4:3     31.469 kHz     25.175000 MHz
    Apple   :   640x480    66.666667 Hz   4:3     35.000 kHz     30.240000 MHz
    DMT 0x06:   640x480    75.000000 Hz   4:3     37.500 kHz     31.500000 MHz
    DMT 0x09:   800x600    60.316541 Hz   4:3     37.879 kHz     40.000000 MHz
    DMT 0x0b:   800x600    75.000000 Hz   4:3     46.875 kHz     49.500000 MHz
    Apple   :   832x624    74.551266 Hz   4:3     49.726 kHz     57.284000 MHz
    DMT 0x10:  1024x768    60.003840 Hz   4:3     48.363 kHz     65.000000 MHz
    DMT 0x12:  1024x768    75.028582 Hz   4:3     60.023 kHz     78.750000 MHz
    DMT 0x24:  1280x1024   75.024675 Hz   5:4     79.976 kHz    135.000000 MHz
    Apple   :  1152x870    75.061550 Hz 192:145   68.681 kHz    100.000000 MHz
  Standard Timings:
    DMT 0x52:  1920x1080   60.000000 Hz  16:9     67.500 kHz    148.500000 MHz
    DMT 0x3a:  1680x1050   59.954250 Hz  16:10    65.290 kHz    146.250000 MHz
    DMT 0x53:  1600x900    60.000000 Hz  16:9     60.000 kHz    108.000000 MHz (RB)
    DMT 0x23:  1280x1024   60.019740 Hz   5:4     63.981 kHz    108.000000 MHz
    DMT 0x15:  1152x864    75.000000 Hz   4:3     67.500 kHz    108.000000 MHz
    DMT 0x55:  1280x720    60.000000 Hz  16:9     45.000 kHz     74.250000 MHz
    DMT 0x20:  1280x960    60.000000 Hz   4:3     60.000 kHz    108.000000 MHz
    DMT 0x33:  1600x1200   60.000000 Hz   4:3     75.000 kHz    162.000000 MHz
  Detailed Timing Descriptors:
    DTD 1:  2560x1440   59.950550 Hz  16:9     88.787 kHz    241.500000 MHz (597 mm x 336 mm)
                 Hfront   48 Hsync  32 Hback   80 Hpol P
                 Vfront    3 Vsync   5 Vback   33 Vpol N
    Display Range Limits:
      Monitor ranges (Range Limits Only): 48-144 Hz V, 160-160 kHz H, max dotclock 600 MHz
    Display Product Name: 'OV-KR27VQ14'
    Display Product Serial Number: ...
  Extension blocks: 1
Checksum: 0x78

----------------

Block 1, CTA-861 Extension Block:
  Revision: 3
  Underscans IT Video Formats by default
  Basic audio support
  Supports YCbCr 4:4:4
  Supports YCbCr 4:2:2
  Native DTDs: 1
  Video Data Block:
    VIC  63:  1920x1080  120.000000 Hz  16:9    135.000 kHz    297.000000 MHz
    VIC   1:   640x480    59.940476 Hz   4:3     31.469 kHz     25.175000 MHz
    VIC   2:   720x480    59.940060 Hz   4:3     31.469 kHz     27.000000 MHz
    VIC   3:   720x480    59.940060 Hz  16:9     31.469 kHz     27.000000 MHz
    VIC   4:  1280x720    60.000000 Hz  16:9     45.000 kHz     74.250000 MHz
    VIC   5:  1920x1080i  60.000000 Hz  16:9     33.750 kHz     74.250000 MHz
    VIC  16:  1920x1080   60.000000 Hz  16:9     67.500 kHz    148.500000 MHz (native)
    VIC  17:   720x576    50.000000 Hz   4:3     31.250 kHz     27.000000 MHz
    VIC  18:   720x576    50.000000 Hz  16:9     31.250 kHz     27.000000 MHz
    VIC  19:  1280x720    50.000000 Hz  16:9     37.500 kHz     74.250000 MHz
    VIC  20:  1920x1080i  50.000000 Hz  16:9     28.125 kHz     74.250000 MHz
    VIC  31:  1920x1080   50.000000 Hz  16:9     56.250 kHz    148.500000 MHz
  Audio Data Block:
    Linear PCM:
      Max channels: 2
      Supported sample rates (kHz): 48 44.1 32
      Supported sample sizes (bits): 24 20 16
  Speaker Allocation Data Block:
    FL/FR - Front Left/Right
  Vendor-Specific Data Block (AMD), OUI 00-00-1A:
    Version: 1
    Flags 1: 0x17
      FreeSync Supported
    Minimum Refresh Rate: 48 Hz
    Maximum Refresh Rate: 144 Hz
  Colorimetry Data Block:
    xvYCC601
    xvYCC709
    BT2020cYCC
    BT2020YCC
    BT2020RGB
    Gamut Boundary Description Metadata Profile P0
  HDR Static Metadata Data Block:
    Electro optical transfer functions:
      Traditional gamma - SDR luminance range
      Traditional gamma - HDR luminance range
      SMPTE ST2084
    Supported static metadata descriptors:
      Static metadata type 1
    Desired content max luminance: 101 (445.755 cd/m^2)
    Desired content max frame-average luminance: 96 (400.000 cd/m^2)
    Desired content min luminance: 32 (0.070 cd/m^2)
  Detailed Timing Descriptors:
    DTD 2:  2560x1440  143.999800 Hz  16:9    214.560 kHz    575.020000 MHz (597 mm x 336 mm)
                 Hfront   16 Hsync  64 Hback   40 Hpol P
                 Vfront    3 Vsync   5 Vback   42 Vpol N
    DTD 3:  1920x1080  143.998945 Hz  16:9    160.559 kHz    327.540000 MHz (1153 mm x 329 mm)
                 Hfront   48 Hsync  32 Hback   40 Hpol P
                 Vfront    3 Vsync   5 Vback   27 Vpol P
    DTD 4:  2560x1440  119.988650 Hz  16:9    178.783 kHz    486.290000 MHz (597 mm x 336 mm)
                 Hfront   32 Hsync  64 Hback   64 Hpol P
                 Vfront    4 Vsync   5 Vback   41 Vpol P
    DTD 5:  1280x1440   59.999501 Hz   8:9     92.519 kHz    144.330000 MHz (597 mm x 336 mm)
                 Hfront   32 Hsync  40 Hback  208 Hpol P
                 Vfront    5 Vsync   5 Vback   92 Vpol P
Checksum: 0xd8  Unused space in Extension Block: 10 bytes

----------------

Warnings:

Block 0, Base EDID:
  Display Product Serial Number: ...
Block 1, CTA-861 Extension Block:
  Video Data Block: VIC 63 and the first DTD are not identical. Is this intended?
  Colorimetry Data Block: Set the sRGB colorimetry bit to avoid interop issues.
  Detailed Timing Descriptor #3: Image size is 1153x329 mm, but based on the picture AR it should be 584x329 mm.
  Detailed Timing Descriptor #5: Image size is 597x336 mm, but based on the picture AR it should be 298x336 mm.
EDID:
  Base EDID: Some timings are out of range of the Monitor Ranges:
    Horizontal Freq: 28.125 - 214.559 kHz (Monitor: 160.000 - 160.000 kHz)

Failures:

Block 1, CTA-861 Extension Block:
  Detailed Timing Descriptor #3: Mismatch of image size 1153x329 mm vs display size 600x340 mm.
  Missing VCDB, needed for Set Selectable RGB Quantization to avoid interop issues.
EDID:
  Extension Block 2 started with EDID header, ignoring Extension Blocks >= 2.
  Base EDID: The DTD max image size is 1153x336mm, which is larger than the display size 600.0x340.0mm.
  CTA-861: Native progressive timings are a mix of several resolutions.

EDID conformity: FAIL
