edid-decode (hex):

00 ff ff ff ff ff ff 00 31 03 ff ff 00 00 00 00
17 20 01 04 b5 45 1d 78 3f bd 15 b0 4d 48 aa 27
0e 50 54 25 4a 00 d1 c0 61 40 01 01 01 01 01 01
01 01 01 01 01 01 b8 47 00 a0 a0 38 2d 40 30 20
35 00 b2 23 21 00 00 1a 00 00 00 fd 00 30 c8 fa
fa 40 01 0a 20 20 20 20 20 20 00 00 00 fc 00 43
33 30 53 4b 2d 50 52 4f 00 20 20 20 00 00 00 ff
00 30 30 30 30 30 30 30 30 30 30 30 30 30 01 e8

02 03 29 f1 4a 01 02 03 04 90 11 12 13 1f 3f 23
09 1f 07 83 01 00 00 6d 1a 00 00 02 01 30 c8 00
00 00 00 00 00 e3 05 c0 01 ff f4 00 04 a1 38 20
40 30 40 35 00 b2 23 21 00 00 1a d4 29 00 18 51
38 40 40 30 20 35 00 b2 23 21 00 00 1a 4a aa 00
a0 a0 38 21 40 30 40 35 00 b2 23 21 00 00 1a fe
92 00 04 a1 38 20 40 30 40 35 00 b3 22 21 00 00
1e 00 00 00 00 00 00 00 00 00 00 00 00 00 00 c8

00 ff ff ff ff ff ff 00 31 03 ff ff 00 00 00 00
17 20 01 04 b5 45 1d 78 3f bd 15 b0 4d 48 aa 27
0e 50 54 25 4a 00 d1 c0 61 40 01 01 01 01 01 01
01 01 01 01 01 01 b8 47 00 a0 a0 38 2d 40 30 20
35 00 b2 23 21 00 00 1a 00 00 00 fd 00 30 c8 fa
fa 40 01 0a 20 20 20 20 20 20 00 00 00 fc 00 43
33 30 53 4b 2d 50 52 4f 00 20 20 20 00 00 00 ff
00 30 30 30 30 30 30 30 30 30 30 30 30 30 01 e8

02 03 29 f1 4a 01 02 03 04 90 11 12 13 1f 3f 23
09 1f 07 83 01 00 00 6d 1a 00 00 02 01 30 c8 00
00 00 00 00 00 e3 05 c0 01 ff f4 00 04 a1 38 20
40 30 40 35 00 b2 23 21 00 00 1a d4 29 00 18 51
38 40 40 30 20 35 00 b2 23 21 00 00 1a 4a aa 00
a0 a0 38 21 40 30 40 35 00 b2 23 21 00 00 1a fe
92 00 04 a1 38 20 40 30 40 35 00 b3 22 21 00 00
1e 00 00 00 00 00 00 00 00 00 00 00 00 00 00 c8

----------------

Block 0, Base EDID:
  EDID Structure Version & Revision: 1.4
  Vendor & Product Identification:
    Manufacturer: LHC
    Model: 65535
    Made in: week 23 of 2022
  Basic Display Parameters & Features:
    Digital display
    Bits per primary color channel: 10
    DisplayPort interface
    Maximum image size: 69 cm x 29 cm
    Gamma: 2.20
    DPMS levels: Off
    Supported color formats: RGB 4:4:4, YCrCb 4:4:4, YCrCb 4:2:2
    Default (sRGB) color space is primary color space
    First detailed timing includes the native pixel format and preferred refresh rate
    Display supports continuous frequencies
  Color Characteristics:
    Red  : 0.6894, 0.3037
    Green: 0.2841, 0.6650
    Blue : 0.1523, 0.0556
    White: 0.3134, 0.3291
  Established Timings I & II:
    DMT 0x04:   640x480    59.940476 Hz   4:3     31.469 kHz     25.175000 MHz
    DMT 0x06:   640x480    75.000000 Hz   4:3     37.500 kHz     31.500000 MHz
    DMT 0x09:   800x600    60.316541 Hz   4:3     37.879 kHz     40.000000 MHz
    DMT 0x0b:   800x600    75.000000 Hz   4:3     46.875 kHz     49.500000 MHz
    DMT 0x10:  1024x768    60.003840 Hz   4:3     48.363 kHz     65.000000 MHz
    DMT 0x12:  1024x768    75.028582 Hz   4:3     60.023 kHz     78.750000 MHz
  Standard Timings:
    DMT 0x52:  1920x1080   60.000000 Hz  16:9     67.500 kHz    148.500000 MHz
    DMT 0x10:  1024x768    60.003840 Hz   4:3     48.363 kHz     65.000000 MHz
  Detailed Timing Descriptors:
    DTD 1:  2560x1080   60.000000 Hz  64:27    67.500 kHz    183.600000 MHz (690 mm x 291 mm)
                 Hfront   48 Hsync  32 Hback   80 Hpol P
                 Vfront    3 Vsync   5 Vback   37 Vpol N
    Display Range Limits:
      Monitor ranges (Range Limits Only): 48-200 Hz V, 250-250 kHz H, max dotclock 640 MHz
    Display Product Name: 'C30SK-PRO'
    Display Product Serial Number: ...
  Extension blocks: 1
Checksum: 0xe8

----------------

Block 1, CTA-861 Extension Block:
  Revision: 3
  Underscans IT Video Formats by default
  Basic audio support
  Supports YCbCr 4:4:4
  Supports YCbCr 4:2:2
  Native detailed modes: 1
  Video Data Block:
    VIC   1:   640x480    59.940476 Hz   4:3     31.469 kHz     25.175000 MHz
    VIC   2:   720x480    59.940060 Hz   4:3     31.469 kHz     27.000000 MHz
    VIC   3:   720x480    59.940060 Hz  16:9     31.469 kHz     27.000000 MHz
    VIC   4:  1280x720    60.000000 Hz  16:9     45.000 kHz     74.250000 MHz
    VIC  16:  1920x1080   60.000000 Hz  16:9     67.500 kHz    148.500000 MHz (native)
    VIC  17:   720x576    50.000000 Hz   4:3     31.250 kHz     27.000000 MHz
    VIC  18:   720x576    50.000000 Hz  16:9     31.250 kHz     27.000000 MHz
    VIC  19:  1280x720    50.000000 Hz  16:9     37.500 kHz     74.250000 MHz
    VIC  31:  1920x1080   50.000000 Hz  16:9     56.250 kHz    148.500000 MHz
    VIC  63:  1920x1080  120.000000 Hz  16:9    135.000 kHz    297.000000 MHz
  Audio Data Block:
    Linear PCM:
      Max channels: 2
      Supported sample rates (kHz): 96 88.2 48 44.1 32
      Supported sample sizes (bits): 24 20 16
  Speaker Allocation Data Block:
    FL/FR - Front Left/Right
  Vendor-Specific Data Block (AMD), OUI 00-00-1A:
    Version: 2
    Feature Caps: 0x01
    Minimum Refresh Rate: 48 Hz
    Maximum Refresh Rate: 200 Hz
    Flags 1.x: 0x00
    Flags 2.x: 0x00
    Maximum luminance: 0 (50.000 cd/m^2)
    Minimum luminance: 0 (0.000 cd/m^2)
    Unknown: 0x00 0x00
  Colorimetry Data Block:
    BT2020YCC
    BT2020RGB
    Gamut Boundary Description Metadata Profile P0
  Detailed Timing Descriptors:
    DTD 2:  2560x1080  200.007016 Hz  64:27   222.408 kHz    627.190000 MHz (690 mm x 291 mm)
                 Hfront   48 Hsync  64 Hback  148 Hpol P
                 Vfront    3 Vsync   5 Vback   24 Vpol N
    DTD 3:  1280x1080   60.000897 Hz  32:27    68.641 kHz    107.080000 MHz (690 mm x 291 mm)
                 Hfront   48 Hsync  32 Hback  200 Hpol P
                 Vfront    3 Vsync   5 Vback   56 Vpol N
    DTD 4:  2560x1080  144.000053 Hz  64:27   160.272 kHz    435.940000 MHz (690 mm x 291 mm)
                 Hfront   48 Hsync  64 Hback   48 Hpol P
                 Vfront    3 Vsync   5 Vback   25 Vpol N
    DTD 5:  2560x1080  119.999745 Hz  64:27   133.440 kHz    376.300000 MHz (691 mm x 290 mm)
                 Hfront   48 Hsync  64 Hback  148 Hpol P
                 Vfront    3 Vsync   5 Vback   24 Vpol P
Checksum: 0xc8  Unused space in Extension Block: 14 bytes

----------------

Block 2, Unknown EDID Extension Block 0x00:
  00 ff ff ff ff ff ff 00 31 03 ff ff 00 00 00 00 '........1.......'
  17 20 01 04 b5 45 1d 78 3f bd 15 b0 4d 48 aa 27 '. ...E.x?...MH.''
  0e 50 54 25 4a 00 d1 c0 61 40 01 01 01 01 01 01 '.PT%J...a@......'
  01 01 01 01 01 01 b8 47 00 a0 a0 38 2d 40 30 20 '.......G...8-@0 '
  35 00 b2 23 21 00 00 1a 00 00 00 fd 00 30 c8 fa '5..#!........0..'
  fa 40 01 0a 20 20 20 20 20 20 00 00 00 fc 00 43 '.@..      .....C'
  33 30 53 4b 2d 50 52 4f 00 20 20 20 00 00 00 ff '30SK-PRO.   ....'
  00 30 30 30 30 30 30 30 30 30 30 30 30 30 01 e8 '.0000000000000..'
Checksum: 0xe8

----------------

Block 3, CTA-861 Extension Block:
  Revision: 3
  Underscans IT Video Formats by default
  Basic audio support
  Supports YCbCr 4:4:4
  Supports YCbCr 4:2:2
  Native detailed modes: 1
  Video Data Block:
    VIC   1:   640x480    59.940476 Hz   4:3     31.469 kHz     25.175000 MHz
    VIC   2:   720x480    59.940060 Hz   4:3     31.469 kHz     27.000000 MHz
    VIC   3:   720x480    59.940060 Hz  16:9     31.469 kHz     27.000000 MHz
    VIC   4:  1280x720    60.000000 Hz  16:9     45.000 kHz     74.250000 MHz
    VIC  16:  1920x1080   60.000000 Hz  16:9     67.500 kHz    148.500000 MHz (native)
    VIC  17:   720x576    50.000000 Hz   4:3     31.250 kHz     27.000000 MHz
    VIC  18:   720x576    50.000000 Hz  16:9     31.250 kHz     27.000000 MHz
    VIC  19:  1280x720    50.000000 Hz  16:9     37.500 kHz     74.250000 MHz
    VIC  31:  1920x1080   50.000000 Hz  16:9     56.250 kHz    148.500000 MHz
    VIC  63:  1920x1080  120.000000 Hz  16:9    135.000 kHz    297.000000 MHz
  Audio Data Block:
    Linear PCM:
      Max channels: 2
      Supported sample rates (kHz): 96 88.2 48 44.1 32
      Supported sample sizes (bits): 24 20 16
  Speaker Allocation Data Block:
    FL/FR - Front Left/Right
  Vendor-Specific Data Block (AMD), OUI 00-00-1A:
    Version: 2
    Feature Caps: 0x01
    Minimum Refresh Rate: 48 Hz
    Maximum Refresh Rate: 200 Hz
    Flags 1.x: 0x00
    Flags 2.x: 0x00
    Maximum luminance: 0 (50.000 cd/m^2)
    Minimum luminance: 0 (0.000 cd/m^2)
    Unknown: 0x00 0x00
  Colorimetry Data Block:
    BT2020YCC
    BT2020RGB
    Gamut Boundary Description Metadata Profile P0
  Detailed Timing Descriptors:
    DTD 6:  2560x1080  200.007016 Hz  64:27   222.408 kHz    627.190000 MHz (690 mm x 291 mm)
                 Hfront   48 Hsync  64 Hback  148 Hpol P
                 Vfront    3 Vsync   5 Vback   24 Vpol N
    DTD 7:  1280x1080   60.000897 Hz  32:27    68.641 kHz    107.080000 MHz (690 mm x 291 mm)
                 Hfront   48 Hsync  32 Hback  200 Hpol P
                 Vfront    3 Vsync   5 Vback   56 Vpol N
    DTD 8:  2560x1080  144.000053 Hz  64:27   160.272 kHz    435.940000 MHz (690 mm x 291 mm)
                 Hfront   48 Hsync  64 Hback   48 Hpol P
                 Vfront    3 Vsync   5 Vback   25 Vpol N
    DTD 9:  2560x1080  119.999745 Hz  64:27   133.440 kHz    376.300000 MHz (691 mm x 290 mm)
                 Hfront   48 Hsync  64 Hback  148 Hpol P
                 Vfront    3 Vsync   5 Vback   24 Vpol P
Checksum: 0xc8  Unused space in Extension Block: 14 bytes

----------------

Warnings:

Block 0, Base EDID:
  Display Product Serial Number: ...
Block 1, CTA-861 Extension Block:
  Video Data Block: VIC 1 and the first DTD are not identical. Is this intended?
  Video Data Block: All VICs are in ascending order, and the first (preferred) VIC <= 4, is that intended?
  Detailed Timing Descriptor #3: Image size is 690x291 mm, but based on the picture AR it should be 690x582 mm.
Block 3, CTA-861 Extension Block:
  Video Data Block: All VICs are in ascending order, and the first (preferred) VIC <= 4, is that intended?
  Detailed Timing Descriptor #7: Image size is 690x291 mm, but based on the picture AR it should be 690x582 mm.
EDID:
  Base EDID: Some timings are out of range of the Monitor Ranges:
    Horizontal Freq: 31.250 - 222.407 kHz (Monitor: 250.000 - 250.000 kHz)

Failures:

Block 0, Base EDID:
  Basic Display Parameters & Features: sRGB is signaled, but the chromaticities do not match.
  Display Product Name: NUL byte at position 9.
Block 1, CTA-861 Extension Block:
  Missing VCDB, needed for Set Selectable RGB Quantization to avoid interop issues.
Block 2, Base EDID:
  Unknown Extension Block.
Block 3, CTA-861 Extension Block:
  Video Data Block: Duplicate VIC 1.
  Video Data Block: Duplicate VIC 2.
  Video Data Block: Duplicate VIC 3.
  Video Data Block: Duplicate VIC 4.
  Video Data Block: Duplicate VIC 16.
  Video Data Block: Duplicate VIC 17.
  Video Data Block: Duplicate VIC 18.
  Video Data Block: Duplicate VIC 19.
  Video Data Block: Duplicate VIC 31.
  Video Data Block: Duplicate VIC 63.
  Speaker Allocation Data Block: Only one instance of this Data Block is allowed.
  Colorimetry Data Block: Only one instance of this Data Block is allowed.
EDID:
  Base EDID: EDID specified 1 extension block(s), but found 3 extension block(s).
  CTA-861: Native progressive timings are a mix of several resolutions.

EDID conformity: FAIL
