edid-decode (hex):

00 ff ff ff ff ff ff 00 63 18 00 00 00 00 00 00
06 17 01 03 80 00 00 78 0a d7 a5 a2 59 4a 96 24
14 50 54 a3 08 00 81 c0 01 01 01 01 01 01 01 01
01 01 01 01 01 01 66 21 50 b0 51 00 1b 30 40 70
36 00 3f 43 21 00 00 1e 64 19 00 40 41 00 26 30
18 88 36 00 3f 43 21 00 00 18 00 00 00 fd 00 32
4c 1e 50 10 00 0a 20 20 20 20 20 20 00 00 00 fc
00 50 48 49 4c 43 4f 20 20 20 20 20 20 0a 01 43

02 03 29 f1 23 09 7f 07 4f 90 01 02 03 06 07 15
16 11 12 13 04 05 14 1f 83 01 00 00 6c 03 0c 00
10 00 b8 2d c0 01 01 01 01 8c 0a d0 8a 20 e0 2d
10 10 3e 96 00 fd 1e 11 00 00 18 8c 0a d0 90 20
40 31 20 0c 40 55 00 fd 1e 11 00 00 18 01 1d 80
18 71 1c 16 20 58 2c 25 00 fd 1e 11 00 00 9e 01
1d 80 d0 72 1c 16 20 10 2c 25 80 fd 1e 11 00 00
9e 00 00 00 00 00 00 00 00 00 00 00 00 00 00 3e

----------------

Block 0, Base EDID:
  EDID Structure Version & Revision: 1.3
  Vendor & Product Identification:
    Manufacturer: XXX
    Model: 0
    Made in: week 6 of 2013
  Basic Display Parameters & Features:
    Digital display
    Image size is variable
    Gamma: 2.20
    RGB color display
    First detailed timing is the preferred timing
  Color Characteristics:
    Red  : 0.6357, 0.3486
    Green: 0.2900, 0.5888
    Blue : 0.1425, 0.0800
    White: 0.3134, 0.3291
  Established Timings I & II:
    IBM     :   720x400    70.081663 Hz   9:5     31.467 kHz     28.320000 MHz
    DMT 0x04:   640x480    59.940476 Hz   4:3     31.469 kHz     25.175000 MHz
    DMT 0x08:   800x600    56.250000 Hz   4:3     35.156 kHz     36.000000 MHz
    DMT 0x09:   800x600    60.316541 Hz   4:3     37.879 kHz     40.000000 MHz
    DMT 0x10:  1024x768    60.003840 Hz   4:3     48.363 kHz     65.000000 MHz
  Standard Timings:
    DMT 0x55:  1280x720    60.000000 Hz  16:9     45.000 kHz     74.250000 MHz
  Detailed Timing Descriptors:
    DTD 1:  1360x768    60.015162 Hz  85:48    47.712 kHz     85.500000 MHz (575 mm x 323 mm)
                 Hfront   64 Hsync 112 Hback  256 Hpol P
                 Vfront    3 Vsync   6 Vback   18 Vpol P
    DTD 2:  1024x768    60.003840 Hz   4:3     48.363 kHz     65.000000 MHz (575 mm x 323 mm)
                 Hfront   24 Hsync 136 Hback  160 Hpol N
                 Vfront    3 Vsync   6 Vback   29 Vpol N
    Display Range Limits:
      Monitor ranges (GTF): 50-76 Hz V, 30-80 kHz H, max dotclock 160 MHz
    Display Product Name: 'PHILCO      '
  Extension blocks: 1
Checksum: 0x43

----------------

Block 1, CTA-861 Extension Block:
  Revision: 3
  Underscans IT Video Formats by default
  Basic audio support
  Supports YCbCr 4:4:4
  Supports YCbCr 4:2:2
  Native DTDs: 1
  Audio Data Block:
    Linear PCM:
      Max channels: 2
      Supported sample rates (kHz): 192 176.4 96 88.2 48 44.1 32
      Supported sample sizes (bits): 24 20 16
  Video Data Block:
    VIC  16:  1920x1080   60.000000 Hz  16:9     67.500 kHz    148.500000 MHz (native)
    VIC   1:   640x480    59.940476 Hz   4:3     31.469 kHz     25.175000 MHz
    VIC   2:   720x480    59.940060 Hz   4:3     31.469 kHz     27.000000 MHz
    VIC   3:   720x480    59.940060 Hz  16:9     31.469 kHz     27.000000 MHz
    VIC   6:  1440x480i   59.940060 Hz   4:3     15.734 kHz     27.000000 MHz
    VIC   7:  1440x480i   59.940060 Hz  16:9     15.734 kHz     27.000000 MHz
    VIC  21:  1440x576i   50.000000 Hz   4:3     15.625 kHz     27.000000 MHz
    VIC  22:  1440x576i   50.000000 Hz  16:9     15.625 kHz     27.000000 MHz
    VIC  17:   720x576    50.000000 Hz   4:3     31.250 kHz     27.000000 MHz
    VIC  18:   720x576    50.000000 Hz  16:9     31.250 kHz     27.000000 MHz
    VIC  19:  1280x720    50.000000 Hz  16:9     37.500 kHz     74.250000 MHz
    VIC   4:  1280x720    60.000000 Hz  16:9     45.000 kHz     74.250000 MHz
    VIC   5:  1920x1080i  60.000000 Hz  16:9     33.750 kHz     74.250000 MHz
    VIC  20:  1920x1080i  50.000000 Hz  16:9     28.125 kHz     74.250000 MHz
    VIC  31:  1920x1080   50.000000 Hz  16:9     56.250 kHz    148.500000 MHz
  Speaker Allocation Data Block:
    FL/FR - Front Left/Right
  Vendor-Specific Data Block (HDMI), OUI 00-0C-03:
    Source physical address: 1.0.0.0
    Supports_AI
    DC_36bit
    DC_30bit
    DC_Y444
    Maximum TMDS clock: 225 MHz
    Video latency: 0 ms
    Audio latency: 0 ms
    Interlaced video latency: 0 ms
    Interlaced audio latency: 0 ms
  Detailed Timing Descriptors:
    DTD 3:   720x480    59.940060 Hz   3:2     31.469 kHz     27.000000 MHz (509 mm x 286 mm)
                 Hfront   16 Hsync  62 Hback   60 Hpol N
                 Vfront    9 Vsync   6 Vback   30 Vpol N
    DTD 4:   720x576    50.000000 Hz   5:4     31.250 kHz     27.000000 MHz (509 mm x 286 mm)
                 Hfront   12 Hsync  64 Hback   68 Hpol N
                 Vfront    5 Vsync   5 Vback   39 Vpol N
    DTD 5:  1920x1080i  60.000000 Hz  16:9     33.750 kHz     74.250000 MHz (509 mm x 286 mm)
                 Hfront   88 Hsync  44 Hback  148 Hpol P
                 Vfront    2 Vsync   5 Vback   15 Vpol P Vfront +0.5 Odd Field
                 Vfront    2 Vsync   5 Vback   15 Vpol P Vback  +0.5 Even Field
    DTD 6:  1920x1080i  50.000000 Hz  16:9     28.125 kHz     74.250000 MHz (509 mm x 286 mm)
                 Hfront  528 Hsync  44 Hback  148 Hpol P
                 Vfront    2 Vsync   5 Vback   15 Vpol P Vfront +0.5 Odd Field
                 Vfront    2 Vsync   5 Vback   15 Vpol P Vback  +0.5 Even Field
Checksum: 0x3e  Unused space in Extension Block: 14 bytes

----------------

Warnings:

Block 0, Base EDID:
  Detailed Timing Descriptor #2: Image size is 575x323 mm, but based on the picture AR it should be 430x323 mm.
Block 1, CTA-861 Extension Block:
  Video Data Block: VIC 16 and the first DTD are not identical. Is this intended?
  Vendor-Specific Data Block (HDMI), OUI 00-0C-03: Progressive and Interlaced latency values are identical, no need for both.
  Detailed Timing Descriptor #3: Image size is 509x286 mm, but based on the picture AR it should be 429x286 mm.
  Detailed Timing Descriptor #4: Image size is 509x286 mm, but based on the picture AR it should be 357x286 mm.
  Add a Colorimetry Data Block with the sRGB colorimetry bit set to avoid interop issues.
EDID:
  Base EDID: Some timings are out of range of the Monitor Ranges:
    Horizontal Freq: 15.625 - 67.500 kHz (Monitor: 30.000 - 80.000 kHz)

Failures:

Block 0, Base EDID:
  Display Product Name: One or more trailing spaces before newline.
Block 1, CTA-861 Extension Block:
  Missing VCDB, needed for Set Selectable RGB Quantization to avoid interop issues.
EDID:
  Base EDID: The DTD max image size is 575x323mm, but the display size is not specified anywhere.
  CTA-861: Native progressive timings are a mix of several resolutions.

EDID conformity: FAIL
