edid-decode (hex):

00 ff ff ff ff ff ff 00 63 18 00 00 00 00 00 00
06 1a 01 03 a0 00 00 78 22 d7 a5 a2 59 4a 96 24
14 50 54 a3 08 00 81 c0 01 01 01 01 01 01 01 01
01 01 01 01 01 01 02 3a 80 18 71 38 2d 40 58 2c
45 00 a0 5a 00 00 00 1e a9 1a 00 a0 50 00 16 30
30 20 37 00 3f 43 21 00 00 1a 00 00 00 fd 00 30
4c 1e 50 10 00 0a 20 20 20 20 20 20 00 00 00 fc
00 41 41 41 0a 20 20 20 20 20 20 20 20 20 01 4d

02 03 23 c1 4b 90 00 84 00 00 00 03 00 00 00 00
23 09 04 01 83 01 00 00 67 03 0c 00 30 00 80 1e
e2 00 0f 02 3a 80 d0 72 38 2d 40 10 2c 45 80 a0
5a 00 00 00 1e 00 00 00 00 00 00 00 00 00 00 00
00 00 00 00 00 00 00 00 00 00 00 00 00 00 00 00
00 00 00 00 00 00 00 00 00 00 00 00 00 00 00 00
00 00 00 00 00 00 00 00 00 00 00 00 00 00 00 00
00 00 00 00 00 00 00 00 00 00 00 00 00 00 00 0f

00 ff ff ff ff ff ff 00 63 18 00 00 00 00 00 00
06 1a 01 03 a0 00 00 78 22 d7 a5 a2 59 4a 96 24
14 50 54 a3 08 00 81 c0 01 01 01 01 01 01 01 01
01 01 01 01 01 01 02 3a 80 18 71 38 2d 40 58 2c
45 00 a0 5a 00 00 00 1e a9 1a 00 a0 50 00 16 30
30 20 37 00 3f 43 21 00 00 1a 00 00 00 fd 00 30
4c 1e 50 10 00 0a 20 20 20 20 20 20 00 00 00 fc
00 41 41 41 0a 20 20 20 20 20 20 20 20 20 01 4d

02 03 23 c1 4b 90 00 84 00 00 00 03 00 00 00 00
23 09 04 01 83 01 00 00 67 03 0c 00 30 00 80 1e
e2 00 0f 02 3a 80 d0 72 38 2d 40 10 2c 45 80 a0
5a 00 00 00 1e 00 00 00 00 00 00 00 00 00 00 00
00 00 00 00 00 00 00 00 00 00 00 00 00 00 00 00
00 00 00 00 00 00 00 00 00 00 00 00 00 00 00 00
00 00 00 00 00 00 00 00 00 00 00 00 00 00 00 00
00 00 00 00 00 00 00 00 00 00 00 00 00 00 00 0f

----------------

Block 0, Base EDID:
  EDID Structure Version & Revision: 1.3
  Vendor & Product Identification:
    Manufacturer: XXX
    Model: 0
    Made in: week 6 of 2016
  Basic Display Parameters & Features:
    Digital display
    Image size is variable
    Gamma: 2.20
    DPMS levels: Off
    Monochrome or grayscale display
    First detailed timing is the preferred timing
  Color Characteristics:
    Red  : 0.6357, 0.3486
    Green: 0.2900, 0.5888
    Blue : 0.1425, 0.0800
    White: 0.3134, 0.3291
  Established Timings I & II:
    IBM     :   720x400    70.081663 Hz   9:5     31.467 kHz     28.320000 MHz
    DMT 0x04:   640x480    59.940476 Hz   4:3     31.469 kHz     25.175000 MHz
    DMT 0x08:   800x600    56.250000 Hz   4:3     35.156 kHz     36.000000 MHz
    DMT 0x09:   800x600    60.316541 Hz   4:3     37.879 kHz     40.000000 MHz
    DMT 0x10:  1024x768    60.003840 Hz   4:3     48.363 kHz     65.000000 MHz
  Standard Timings:
    DMT 0x55:  1280x720    60.000000 Hz  16:9     45.000 kHz     74.250000 MHz
  Detailed Timing Descriptors:
    DTD 1:  1920x1080   60.000000 Hz  16:9     67.500 kHz    148.500000 MHz (160 mm x 90 mm)
                 Hfront   88 Hsync  44 Hback  148 Hpol P
                 Vfront    4 Vsync   5 Vback   36 Vpol P
    DTD 2:  1280x768    59.994726 Hz   5:3     47.396 kHz     68.250000 MHz (575 mm x 323 mm)
                 Hfront   48 Hsync  32 Hback   80 Hpol P
                 Vfront    3 Vsync   7 Vback   12 Vpol N
    Display Range Limits:
      Monitor ranges (GTF): 48-76 Hz V, 30-80 kHz H, max dotclock 160 MHz
    Display Product Name: 'AAA'
  Extension blocks: 1
Checksum: 0x4d

----------------

Block 1, CTA-861 Extension Block:
  Revision: 3
  Underscans IT Video Formats by default
  Basic audio support
  Native DTDs: 1
  Video Data Block:
    VIC  16:  1920x1080   60.000000 Hz  16:9     67.500 kHz    148.500000 MHz (native)
    VIC   4:  1280x720    60.000000 Hz  16:9     45.000 kHz     74.250000 MHz (native)
    VIC   3:   720x480    59.940060 Hz  16:9     31.469 kHz     27.000000 MHz
  Audio Data Block:
    Linear PCM:
      Max channels: 2
      Supported sample rates (kHz): 48
      Supported sample sizes (bits): 16
  Speaker Allocation Data Block:
    FL/FR - Front Left/Right
  Vendor-Specific Data Block (HDMI), OUI 00-0C-03:
    Source physical address: 3.0.0.0
    Supports_AI
    Maximum TMDS clock: 150 MHz
  Video Capability Data Block:
    YCbCr quantization: No Data
    RGB quantization: No Data
    PT scan behavior: No Data
    IT scan behavior: Supports both over- and underscan
    CE scan behavior: Supports both over- and underscan
  Detailed Timing Descriptors:
    DTD 3:  1920x1080   50.000000 Hz  16:9     56.250 kHz    148.500000 MHz (160 mm x 90 mm)
                 Hfront  528 Hsync  44 Hback  148 Hpol P
                 Vfront    4 Vsync   5 Vback   36 Vpol P
Checksum: 0x0f  Unused space in Extension Block: 74 bytes

----------------

Warnings:

Block 0, Base EDID:
  Detailed Timing Descriptor #1: Dubious image size (160x90 mm is smaller than 100x100 mm).
  Detailed Timing Descriptor #2: Image size is 575x323 mm, but based on the picture AR it should be 538x323 mm.
Block 1, CTA-861 Extension Block:
  Detailed Timing Descriptor #3: DTD is identical to VIC 31, which is not present in the CTA Ext Block.
  Detailed Timing Descriptor #3: Dubious image size (160x90 mm is smaller than 100x100 mm).
  Add a Colorimetry Data Block with the sRGB colorimetry bit set to avoid interop issues.

Failures:

Block 0, Base EDID:
  Basic Display Parameters & Features: Digital Video Interface Standard set to reserved value 0x20.
Block 1, CTA-861 Extension Block:
  Video Capability Data Block: Set Selectable RGB Quantization to avoid interop issues.
EDID:
  Extension Block 2 started with EDID header, ignoring Extension Blocks >= 2.
  Base EDID: The DTD max image size is 575x323mm, but the display size is not specified anywhere.
  CTA-861: Native progressive timings are a mix of several resolutions.

EDID conformity: FAIL
