edid-decode (hex):

00 ff ff ff ff ff ff 00 0d ae 44 13 00 00 00 00
06 16 01 04 90 1d 10 78 02 53 d5 98 58 52 90 27
21 50 54 00 00 00 01 01 01 01 01 01 01 01 01 01
01 01 01 01 01 01 fc 1a 56 6e 50 00 0c 30 21 16
22 00 25 a4 10 00 00 1a dd 12 56 a0 50 00 17 30
30 20 35 00 25 a4 10 00 00 1a 00 00 00 fe 00 31
56 44 43 35 80 31 33 33 42 47 45 0a 00 00 00 00
00 00 41 31 96 00 10 00 00 01 01 0a 20 20 00 6c

----------------

Block 0, Base EDID:
  EDID Structure Version & Revision: 1.4
  Vendor & Product Identification:
    Manufacturer: CMN
    Model: 4932
    Made in: week 6 of 2012
  Basic Display Parameters & Features:
    Digital display
    Bits per primary color channel: 6
    Digital interface is not defined
    Maximum image size: 29 cm x 16 cm
    Gamma: 2.20
    Supported color formats: RGB 4:4:4
    First detailed timing includes the native pixel format and preferred refresh rate
  Color Characteristics:
    Red  : 0.5947, 0.3447
    Green: 0.3203, 0.5654
    Blue : 0.1552, 0.1298
    White: 0.3134, 0.3291
  Established Timings I & II: none
  Standard Timings: none
  Detailed Timing Descriptors:
    DTD 1:  1366x768    60.002780 Hz 683:384   46.802 kHz     69.080000 MHz (293 mm x 164 mm)
                 Hfront   33 Hsync  22 Hback   55 Hpol P
                 Vfront    2 Vsync   2 Vback    8 Vpol N
    DTD 2:  1366x768    40.006097 Hz 683:384   31.645 kHz     48.290000 MHz (293 mm x 164 mm)
                 Hfront   48 Hsync  32 Hback   80 Hpol P
                 Vfront    3 Vsync   5 Vback   15 Vpol N
    Alphanumeric Data String: '1VDC5.133BGE'
    Manufacturer-Specified Display Descriptor (0x00): 00 00 00 00 41 31 96 00 10 00 00 01 01 0a 20 20 '....A1........  '
Checksum: 0x6c

----------------

Warnings:

Block 0, Base EDID:
  Alphanumeric Data String: Non-ASCII character 0x80 at position 5, can cause problems.
  Missing Display Product Name.

EDID conformity: PASS
