edid-decode (hex):

00 ff ff ff ff ff ff 00 4e 14 04 24 b0 05 00 00
09 12 01 03 08 34 20 78 2b 82 d2 a3 5a 49 a0 24
13 50 53 bf cf 80 81 c0 81 40 95 00 b3 00 d1 c0
81 80 a9 40 71 40 7d 4b 80 a0 72 b0 2d 40 88 c8
36 00 06 44 21 00 00 1c 94 43 80 90 72 38 28 40
80 c8 35 00 06 44 21 00 00 1e 66 21 50 b0 51 00
1b 30 70 00 36 10 7c 22 11 00 00 18 00 00 00 fc
00 53 63 65 70 74 72 65 20 58 32 34 57 47 00 a0

00 ff ff ff ff ff ff 00 4e 14 04 24 b0 05 00 00
09 12 01 03 08 34 20 78 2b 82 d2 a3 5a 49 a0 24
13 50 53 bf cf 80 81 c0 81 40 95 00 b3 00 d1 c0
81 80 a9 40 71 40 7d 4b 80 a0 72 b0 2d 40 88 c8
36 00 06 44 21 00 00 1c 94 43 80 90 72 38 28 40
80 c8 35 00 06 44 21 00 00 1e 66 21 50 b0 51 00
1b 30 70 00 36 10 7c 22 11 00 00 18 00 00 00 fc
00 53 63 65 70 74 72 65 20 58 32 34 57 47 00 a0

----------------

Block 0, Base EDID:
  EDID Structure Version & Revision: 1.3
  Vendor & Product Identification:
    Manufacturer: SPT
    Model: 9220
    Serial Number: ...
    Made in: week 9 of 2008
  Basic Display Parameters & Features:
    Analog display
    Signal Level Standard: 0.700 : 0.300 : 1.000 V p-p
    Blank level equals black level
    Sync: Separate
    Maximum image size: 52 cm x 32 cm
    Gamma: 2.20
    DPMS levels: Off
    RGB color display
    First detailed timing is the preferred timing
    Supports GTF timings within operating range
  Color Characteristics:
    Red  : 0.6386, 0.3515
    Green: 0.2851, 0.6269
    Blue : 0.1435, 0.0751
    White: 0.3125, 0.3261
  Established Timings I & II:
    IBM     :   720x400    70.081663 Hz   9:5     31.467 kHz     28.320000 MHz
    DMT 0x04:   640x480    59.940476 Hz   4:3     31.469 kHz     25.175000 MHz
    Apple   :   640x480    66.666667 Hz   4:3     35.000 kHz     30.240000 MHz
    DMT 0x05:   640x480    72.808802 Hz   4:3     37.861 kHz     31.500000 MHz
    DMT 0x06:   640x480    75.000000 Hz   4:3     37.500 kHz     31.500000 MHz
    DMT 0x08:   800x600    56.250000 Hz   4:3     35.156 kHz     36.000000 MHz
    DMT 0x09:   800x600    60.316541 Hz   4:3     37.879 kHz     40.000000 MHz
    DMT 0x0a:   800x600    72.187572 Hz   4:3     48.077 kHz     50.000000 MHz
    DMT 0x0b:   800x600    75.000000 Hz   4:3     46.875 kHz     49.500000 MHz
    DMT 0x10:  1024x768    60.003840 Hz   4:3     48.363 kHz     65.000000 MHz
    DMT 0x11:  1024x768    70.069359 Hz   4:3     56.476 kHz     75.000000 MHz
    DMT 0x12:  1024x768    75.028582 Hz   4:3     60.023 kHz     78.750000 MHz
    DMT 0x24:  1280x1024   75.024675 Hz   5:4     79.976 kHz    135.000000 MHz
    Apple   :  1152x870    75.061550 Hz 192:145   68.681 kHz    100.000000 MHz
  Standard Timings:
    DMT 0x55:  1280x720    60.000000 Hz  16:9     45.000 kHz     74.250000 MHz
    DMT 0x20:  1280x960    60.000000 Hz   4:3     60.000 kHz    108.000000 MHz
    DMT 0x2f:  1440x900    59.887445 Hz  16:10    55.935 kHz    106.500000 MHz
    DMT 0x3a:  1680x1050   59.954250 Hz  16:10    65.290 kHz    146.250000 MHz
    DMT 0x52:  1920x1080   60.000000 Hz  16:9     67.500 kHz    148.500000 MHz
    DMT 0x23:  1280x1024   60.019740 Hz   5:4     63.981 kHz    108.000000 MHz
    DMT 0x33:  1600x1200   60.000000 Hz   4:3     75.000 kHz    162.000000 MHz
    GTF     :  1152x864    60.000000 Hz   4:3     53.700 kHz     81.624000 MHz
  Detailed Timing Descriptors:
    DTD 1:  1920x1200   59.884600 Hz  16:10    74.556 kHz    193.250000 MHz (518 mm x 324 mm)
                 Hfront  136 Hsync 200 Hback  336 Hpol N
                 Vfront    3 Vsync   6 Vback   36 Vpol P
    DTD 2:  1920x1080   59.962844 Hz  16:9     67.158 kHz    173.000000 MHz (518 mm x 324 mm)
                 Hfront  128 Hsync 200 Hback  328 Hpol P
                 Vfront    3 Vsync   5 Vback   32 Vpol P
    DTD 3:  1360x768    60.015162 Hz  85:48    47.712 kHz     85.500000 MHz (380 mm x 290 mm)
                 Hfront  112 Hsync 256 Hback   64 Hpol N
                 Vfront    3 Vsync   6 Vback   18 Vpol N
    Display Product Name: 'Sceptre X24WG'
Checksum: 0xa0

----------------

Warnings:

Block 0, Base EDID:
  Detailed Timing Descriptor #2: Image size is 518x324 mm, but based on the picture AR it should be 518x291 mm.
  Detailed Timing Descriptor #3: DTD is similar but not identical to DMT 0x27.
  Detailed Timing Descriptor #3: Image size is 380x290 mm, but based on the picture AR it should be 380x214 mm.

Failures:

Block 0, Base EDID:
  Detailed Timing Descriptor #3: Mismatch of image size 380x290 mm vs display size 520x320 mm.
  Missing Display Range Limits Descriptor.
EDID:
  Extension Block 1 started with EDID header, ignoring Extension Blocks >= 1.

EDID conformity: FAIL
