edid-decode (hex):

00 ff ff ff ff ff ff 00 32 68 15 03 01 00 00 00
29 22 01 04 b5 36 1e 78 3b e2 80 a5 51 4c 9f 25
0d 4e 56 bf ef 80 81 80 b3 00 d1 c0 71 40 95 00
81 40 81 c0 a9 c0 02 3a 80 18 71 38 2d 40 58 2c
45 00 20 2f 21 00 00 1e 00 00 00 fd 02 30 2d ff
ff 4b 01 0a 20 20 20 20 20 20 00 00 00 ff 00 30
52 30 30 44 39 51 41 36 42 58 55 35 00 00 00 fc
00 43 46 32 35 46 33 30 30 4c 0a 20 20 20 02 92

02 03 32 f1 23 09 07 07 83 01 00 00 e6 06 07 01
60 50 06 e3 05 c0 00 45 01 02 03 04 90 74 1a 00
00 03 81 30 f0 00 04 00 00 00 00 2c 01 00 00 00
00 00 02 3a 80 18 71 38 2d 40 58 2c 45 00 20 2f
21 00 00 1e 8a 6f 80 a0 70 38 40 40 30 20 35 00
20 2f 21 00 00 1e 7e 97 80 a0 70 38 32 40 30 2c
45 00 20 2f 21 00 00 1e 14 df 80 a0 70 38 40 40
2c 40 35 00 20 2f 21 00 00 1e 00 00 00 00 00 09

70 12 79 03 00 03 01 14 37 12 01 04 7f 07 9f 00
2f 80 1f 00 37 04 2c 00 02 00 04 00 00 00 00 00
00 00 00 00 00 00 00 00 00 00 00 00 00 00 00 00
00 00 00 00 00 00 00 00 00 00 00 00 00 00 00 00
00 00 00 00 00 00 00 00 00 00 00 00 00 00 00 00
00 00 00 00 00 00 00 00 00 00 00 00 00 00 00 00
00 00 00 00 00 00 00 00 00 00 00 00 00 00 00 00
00 00 00 00 00 00 00 00 00 00 00 00 00 00 ac 90

00 ff ff ff ff ff ff 00 32 68 15 03 01 00 00 00
29 22 01 04 b5 36 1e 78 3b e2 80 a5 51 4c 9f 25
0d 4e 56 bf ef 80 81 80 b3 00 d1 c0 71 40 95 00
81 40 81 c0 a9 c0 02 3a 80 18 71 38 2d 40 58 2c
45 00 20 2f 21 00 00 1e 00 00 00 fd 02 30 2d ff
ff 4b 01 0a 20 20 20 20 20 20 00 00 00 ff 00 30
52 30 30 44 39 51 41 36 42 58 55 35 00 00 00 fc
00 43 46 32 35 46 33 30 30 4c 0a 20 20 20 02 92

02 03 32 f1 23 09 07 07 83 01 00 00 e6 06 07 01
60 50 06 e3 05 c0 00 45 01 02 03 04 90 74 1a 00
00 03 81 30 f0 00 04 00 00 00 00 2c 01 00 00 00
00 00 02 3a 80 18 71 38 2d 40 58 2c 45 00 20 2f
21 00 00 1e 8a 6f 80 a0 70 38 40 40 30 20 35 00
20 2f 21 00 00 1e 7e 97 80 a0 70 38 32 40 30 2c
45 00 20 2f 21 00 00 1e 14 df 80 a0 70 38 40 40
2c 40 35 00 20 2f 21 00 00 1e 00 00 00 00 00 09

70 12 79 03 00 03 01 14 37 12 01 04 7f 07 9f 00
2f 80 1f 00 37 04 2c 00 02 00 04 00 00 00 00 00
00 00 00 00 00 00 00 00 00 00 00 00 00 00 00 00
00 00 00 00 00 00 00 00 00 00 00 00 00 00 00 00
00 00 00 00 00 00 00 00 00 00 00 00 00 00 00 00
00 00 00 00 00 00 00 00 00 00 00 00 00 00 00 00
00 00 00 00 00 00 00 00 00 00 00 00 00 00 00 00
00 00 00 00 00 00 00 00 00 00 00 00 00 00 ac 90

----------------

Block 0, Base EDID:
  EDID Structure Version & Revision: 1.4
  Vendor & Product Identification:
    Manufacturer: LSH
    Model: 789
    Serial Number: ...
    Made in: week 41 of 2024
  Basic Display Parameters & Features:
    Digital display
    Bits per primary color channel: 10
    DisplayPort interface
    Maximum image size: 54 cm x 30 cm
    Gamma: 2.20
    DPMS levels: Off
    Supported color formats: RGB 4:4:4, YCrCb 4:4:4, YCrCb 4:2:2
    First detailed timing includes the native pixel format and preferred refresh rate
    Display supports continuous frequencies
  Color Characteristics:
    Red  : 0.6474, 0.3183
    Green: 0.2968, 0.6230
    Blue : 0.1464, 0.0507
    White: 0.3046, 0.3359
  Established Timings I & II:
    IBM     :   720x400    70.081663 Hz   9:5     31.467 kHz     28.320000 MHz
    DMT 0x04:   640x480    59.940476 Hz   4:3     31.469 kHz     25.175000 MHz
    Apple   :   640x480    66.666667 Hz   4:3     35.000 kHz     30.240000 MHz
    DMT 0x05:   640x480    72.808802 Hz   4:3     37.861 kHz     31.500000 MHz
    DMT 0x06:   640x480    75.000000 Hz   4:3     37.500 kHz     31.500000 MHz
    DMT 0x08:   800x600    56.250000 Hz   4:3     35.156 kHz     36.000000 MHz
    DMT 0x09:   800x600    60.316541 Hz   4:3     37.879 kHz     40.000000 MHz
    DMT 0x0a:   800x600    72.187572 Hz   4:3     48.077 kHz     50.000000 MHz
    DMT 0x0b:   800x600    75.000000 Hz   4:3     46.875 kHz     49.500000 MHz
    Apple   :   832x624    74.551266 Hz   4:3     49.726 kHz     57.284000 MHz
    DMT 0x10:  1024x768    60.003840 Hz   4:3     48.363 kHz     65.000000 MHz
    DMT 0x11:  1024x768    70.069359 Hz   4:3     56.476 kHz     75.000000 MHz
    DMT 0x12:  1024x768    75.028582 Hz   4:3     60.023 kHz     78.750000 MHz
    DMT 0x24:  1280x1024   75.024675 Hz   5:4     79.976 kHz    135.000000 MHz
    Apple   :  1152x870    75.061550 Hz 192:145   68.681 kHz    100.000000 MHz
  Standard Timings:
    DMT 0x23:  1280x1024   60.019740 Hz   5:4     63.981 kHz    108.000000 MHz
    DMT 0x3a:  1680x1050   59.954250 Hz  16:10    65.290 kHz    146.250000 MHz
    DMT 0x52:  1920x1080   60.000000 Hz  16:9     67.500 kHz    148.500000 MHz
    GTF     :  1152x864    60.000000 Hz   4:3     53.700 kHz     81.624000 MHz
    DMT 0x2f:  1440x900    59.887445 Hz  16:10    55.935 kHz    106.500000 MHz
    DMT 0x20:  1280x960    60.000000 Hz   4:3     60.000 kHz    108.000000 MHz
    DMT 0x55:  1280x720    60.000000 Hz  16:9     45.000 kHz     74.250000 MHz
    DMT 0x53:  1600x900    60.000000 Hz  16:9     60.000 kHz    108.000000 MHz (RB)
  Detailed Timing Descriptors:
    DTD 1:  1920x1080   60.000000 Hz  16:9     67.500 kHz    148.500000 MHz (544 mm x 303 mm)
                 Hfront   88 Hsync  44 Hback  148 Hpol P
                 Vfront    4 Vsync   5 Vback   36 Vpol P
    Display Range Limits:
      Monitor ranges (Range Limits Only): 48-300 Hz V, 255-255 kHz H, max dotclock 750 MHz
    Display Product Serial Number: ...
    Display Product Name: 'CF25F300L'
  Extension blocks: 2
Checksum: 0x92

----------------

Block 1, CTA-861 Extension Block:
  Revision: 3
  Underscans IT Video Formats by default
  Basic audio support
  Supports YCbCr 4:4:4
  Supports YCbCr 4:2:2
  Native DTDs: 1
  Audio Data Block:
    Linear PCM:
      Max channels: 2
      Supported sample rates (kHz): 48 44.1 32
      Supported sample sizes (bits): 24 20 16
  Speaker Allocation Data Block:
    FL/FR - Front Left/Right
  HDR Static Metadata Data Block:
    Electro optical transfer functions:
      Traditional gamma - SDR luminance range
      Traditional gamma - HDR luminance range
      SMPTE ST2084
    Supported static metadata descriptors:
      Static metadata type 1
    Desired content max luminance: 96 (400.000 cd/m^2)
    Desired content max frame-average luminance: 80 (282.843 cd/m^2)
    Desired content min luminance: 6 (0.002 cd/m^2)
  Colorimetry Data Block:
    BT2020YCC
    BT2020RGB
  Video Data Block:
    VIC   1:   640x480    59.940476 Hz   4:3     31.469 kHz     25.175000 MHz
    VIC   2:   720x480    59.940060 Hz   4:3     31.469 kHz     27.000000 MHz
    VIC   3:   720x480    59.940060 Hz  16:9     31.469 kHz     27.000000 MHz
    VIC   4:  1280x720    60.000000 Hz  16:9     45.000 kHz     74.250000 MHz
    VIC  16:  1920x1080   60.000000 Hz  16:9     67.500 kHz    148.500000 MHz (native)
  Vendor-Specific Data Block (AMD), OUI 00-00-1A:
    Version: 3
    Flags 1: 0x81
      FreeSync Supported
      FreeSync Fast Transport Supported
    Minimum Refresh Rate: 48 Hz
    Maximum Refresh Rate: 300 Hz
    Flags 5: 0x04
    FreeSync Fast Transport maximum pixel clock: 0 kHz
  Detailed Timing Descriptors:
    DTD 2:  1920x1080   60.000000 Hz  16:9     67.500 kHz    148.500000 MHz (544 mm x 303 mm)
                 Hfront   88 Hsync  44 Hback  148 Hpol P
                 Vfront    4 Vsync   5 Vback   36 Vpol P
    DTD 3:  1920x1080  119.998991 Hz  16:9    137.279 kHz    285.540000 MHz (544 mm x 303 mm)
                 Hfront   48 Hsync  32 Hback   80 Hpol P
                 Vfront    3 Vsync   5 Vback   56 Vpol P
    DTD 4:  1920x1080  165.001702 Hz  16:9    186.452 kHz    387.820000 MHz (544 mm x 303 mm)
                 Hfront   48 Hsync  44 Hback   68 Hpol P
                 Vfront    4 Vsync   5 Vback   41 Vpol P
    DTD 5:  1920x1080  239.997983 Hz  16:9    274.558 kHz    571.080000 MHz (544 mm x 303 mm)
                 Hfront   44 Hsync  64 Hback   52 Hpol P
                 Vfront    3 Vsync   5 Vback   56 Vpol P
Checksum: 0x09  Unused space in Extension Block: 5 bytes

----------------

Block 2, DisplayID Extension Block:
  Version: 1.2
  Extension Count: 0
  Display Product Type: Standalone display device
  Video Timing Modes Type 1 - Detailed Timings Data Block:
    DTD:  1920x1080  300.000000 Hz  16:9    337.500 kHz    702.000000 MHz (aspect 16:9, no 3D stereo)
               Hfront   48 Hsync  32 Hback   80 Hpol P
               Vfront    3 Vsync   5 Vback   37 Vpol N
  Checksum: 0xac
Checksum: 0x90

----------------

Warnings:

Block 0, Base EDID:
  Vendor & Product Identification: The serial number is one of the known dummy values, it should probably be set to 0.
Block 1, CTA-861 Extension Block:
  Colorimetry Data Block: Set the sRGB colorimetry bit to avoid interop issues.
  Video Data Block: VIC 1 and the first DTD are not identical. Is this intended?
  Video Data Block: All VICs are in ascending order, and the first (preferred) VIC <= 4, is that intended?
  Display Product Serial Number is set, so the Serial Number in the Base EDID should be 0.
EDID:
  Base EDID: Some timings are out of range of the Monitor Ranges:
    Horizontal Freq: 31.466 - 337.500 kHz (Monitor: 255.000 - 255.000 kHz)

Failures:

Block 1, CTA-861 Extension Block:
  Missing VCDB, needed for Set Selectable RGB Quantization to avoid interop issues.
EDID:
  Extension Block 3 started with EDID header, ignoring Extension Blocks >= 3.
  DisplayID: Missing DisplayID Display Parameters Data Block.
  DisplayID: DisplayID expects at least one preferred timing.

EDID conformity: FAIL
