edid-decode (hex):

00 ff ff ff ff ff ff 00 0c 74 01 01 9c 03 00 00
27 14 01 03 78 58 32 78 ef ee 91 a3 54 4c 99 26
0f 50 54 a5 6f 00 d1 c0 b3 00 95 00 90 40 a9 40
81 00 81 40 81 c0 02 3a 80 18 71 38 2d 40 58 2c
45 00 12 2c 21 00 00 1e 66 21 50 b0 51 00 1b 30
40 70 36 00 12 2c 21 00 00 1e 28 3c 80 a0 70 b0
23 40 30 20 36 00 12 2c 21 00 00 1e 48 3f 40 30
62 b0 32 40 40 c0 13 00 12 2c 21 00 00 1e 00 15

00 ff ff ff ff ff ff 00 0c 74 01 01 9c 03 00 00
27 14 01 03 78 58 32 78 ef ee 91 a3 54 4c 99 26
0f 50 54 a5 6f 00 d1 c0 b3 00 95 00 90 40 a9 40
81 00 81 40 81 c0 02 3a 80 18 71 38 2d 40 58 2c
45 00 12 2c 21 00 00 1e 66 21 50 b0 51 00 1b 30
40 70 36 00 12 2c 21 00 00 1e 28 3c 80 a0 70 b0
23 40 30 20 36 00 12 2c 21 00 00 1e 48 3f 40 30
62 b0 32 40 40 c0 13 00 12 2c 21 00 00 1e 00 15

----------------

Block 0, Base EDID:
  EDID Structure Version & Revision: 1.3
  Vendor & Product Identification:
    Manufacturer: CCT
    Model: 257
    Serial Number: ...
    Made in: week 39 of 2010
  Basic Display Parameters & Features:
    Analog display
    Signal Level Standard: 0.700 : 0.000 : 0.700 V p-p
    Blank-to-black setup/pedestal
    Sync: Separate
    Maximum image size: 88 cm x 50 cm
    Gamma: 2.20
    DPMS levels: Standby Suspend Off
    RGB color display
    Default (sRGB) color space is primary color space
    First detailed timing is the preferred timing
    Supports GTF timings within operating range
  Color Characteristics:
    Red  : 0.6396, 0.3300
    Green: 0.2998, 0.5996
    Blue : 0.1503, 0.0595
    White: 0.3125, 0.3291
  Established Timings I & II:
    IBM     :   720x400    70.081663 Hz   9:5     31.467 kHz     28.320000 MHz
    DMT 0x04:   640x480    59.940476 Hz   4:3     31.469 kHz     25.175000 MHz
    DMT 0x06:   640x480    75.000000 Hz   4:3     37.500 kHz     31.500000 MHz
    DMT 0x09:   800x600    60.316541 Hz   4:3     37.879 kHz     40.000000 MHz
    DMT 0x0b:   800x600    75.000000 Hz   4:3     46.875 kHz     49.500000 MHz
    Apple   :   832x624    74.551266 Hz   4:3     49.726 kHz     57.284000 MHz
    DMT 0x10:  1024x768    60.003840 Hz   4:3     48.363 kHz     65.000000 MHz
    DMT 0x11:  1024x768    70.069359 Hz   4:3     56.476 kHz     75.000000 MHz
    DMT 0x12:  1024x768    75.028582 Hz   4:3     60.023 kHz     78.750000 MHz
    DMT 0x24:  1280x1024   75.024675 Hz   5:4     79.976 kHz    135.000000 MHz
  Standard Timings:
    DMT 0x52:  1920x1080   60.000000 Hz  16:9     67.500 kHz    148.500000 MHz
    DMT 0x3a:  1680x1050   59.954250 Hz  16:10    65.290 kHz    146.250000 MHz
    DMT 0x2f:  1440x900    59.887445 Hz  16:10    55.935 kHz    106.500000 MHz
    DMT 0x2a:  1400x1050   59.978442 Hz   4:3     65.317 kHz    121.750000 MHz
    DMT 0x33:  1600x1200   60.000000 Hz   4:3     75.000 kHz    162.000000 MHz
    DMT 0x1c:  1280x800    59.810326 Hz  16:10    49.702 kHz     83.500000 MHz
    DMT 0x20:  1280x960    60.000000 Hz   4:3     60.000 kHz    108.000000 MHz
    DMT 0x55:  1280x720    60.000000 Hz  16:9     45.000 kHz     74.250000 MHz
  Detailed Timing Descriptors:
    DTD 1:  1920x1080   60.000000 Hz  16:9     67.500 kHz    148.500000 MHz (530 mm x 300 mm)
                 Hfront   88 Hsync  44 Hback  148 Hpol P
                 Vfront    4 Vsync   5 Vback   36 Vpol P
    DTD 2:  1360x768    60.015162 Hz  85:48    47.712 kHz     85.500000 MHz (530 mm x 300 mm)
                 Hfront   64 Hsync 112 Hback  256 Hpol P
                 Vfront    3 Vsync   6 Vback   18 Vpol P
    DTD 3:  1920x1200   59.950171 Hz  16:10    74.038 kHz    154.000000 MHz (530 mm x 300 mm)
                 Hfront   48 Hsync  32 Hback   80 Hpol P
                 Vfront    3 Vsync   6 Vback   26 Vpol P
    DTD 4:  1600x1200   60.000000 Hz   4:3     75.000 kHz    162.000000 MHz (530 mm x 300 mm)
                 Hfront   64 Hsync 192 Hback  304 Hpol P
                 Vfront    1 Vsync   3 Vback   46 Vpol P
Checksum: 0x15

----------------

Warnings:

Block 0, Base EDID:
  Detailed Timing Descriptor #3: DTD is similar but not identical to DMT 0x44.
  Detailed Timing Descriptor #3: Image size is 530x300 mm, but based on the picture AR it should be 480x300 mm.
  Detailed Timing Descriptor #4: Image size is 530x300 mm, but based on the picture AR it should be 400x300 mm.

Failures:

Block 0, Base EDID:
  Detailed Timing Descriptor #1: Mismatch of image size 530x300 mm vs display size 880x500 mm.
  Detailed Timing Descriptor #2: Mismatch of image size 530x300 mm vs display size 880x500 mm.
  Detailed Timing Descriptor #3: Mismatch of image size 530x300 mm vs display size 880x500 mm.
  Detailed Timing Descriptor #4: Mismatch of image size 530x300 mm vs display size 880x500 mm.
  Missing Display Product Name.
  Missing Display Range Limits Descriptor.
EDID:
  Extension Block 1 started with EDID header, ignoring Extension Blocks >= 1.

EDID conformity: FAIL
