edid-decode (hex):

00 ff ff ff ff ff ff 00 09 e5 48 0d 00 00 00 00
20 22 01 04 a5 1e 13 78 02 0a 85 95 5d 59 92 29
1f 50 54 00 00 00 01 01 01 01 01 01 01 01 01 01
01 01 01 01 01 01 61 40 80 04 71 b0 3c 40 30 20
36 00 2e bc 10 00 00 1a 00 00 00 10 20 20 20 20
20 20 20 20 20 20 20 20 20 20 00 00 00 fe 00 42
4f 45 20 43 51 0a 20 20 20 20 20 20 00 00 00 fc
00 4e 56 31 34 30 57 55 4d 2d 4e 34 4d 0a 00 12

00 ff ff ff ff ff ff 00 09 e5 48 0d 00 00 00 00
20 22 01 04 a5 1e 13 78 02 0a 85 95 5d 59 92 29
1f 50 54 00 00 00 01 01 01 01 01 01 01 01 01 01
01 01 01 01 01 01 61 40 80 04 71 b0 3c 40 30 20
36 00 2e bc 10 00 00 1a 00 00 00 10 20 20 20 20
20 20 20 20 20 20 20 20 20 20 00 00 00 fe 00 42
4f 45 20 43 51 0a 20 20 20 20 20 20 00 00 00 fc
00 4e 56 31 34 30 57 55 4d 2d 4e 34 4d 0a 00 12

----------------

Block 0, Base EDID:
  EDID Structure Version & Revision: 1.4
  Vendor & Product Identification:
    Manufacturer: BOE
    Model: 3400
    Made in: week 32 of 2024
  Basic Display Parameters & Features:
    Digital display
    Bits per primary color channel: 8
    DisplayPort interface
    Maximum image size: 30 cm x 19 cm
    Gamma: 2.20
    Supported color formats: RGB 4:4:4
    First detailed timing includes the native pixel format and preferred refresh rate
  Color Characteristics:
    Red  : 0.5820, 0.3632
    Green: 0.3496, 0.5722
    Blue : 0.1621, 0.1210
    White: 0.3134, 0.3291
  Established Timings I & II: none
  Standard Timings: none
  Detailed Timing Descriptors:
    DTD 1:  1920x1200   60.000728 Hz  16:10    75.601 kHz    164.810000 MHz (302 mm x 188 mm)
                 Hfront   48 Hsync  32 Hback  180 Hpol P
                 Vfront    3 Vsync   6 Vback   51 Vpol N
    Dummy Descriptor:
    Alphanumeric Data String: 'BOE CQ'
    Display Product Name: 'NV140WUM-N4M'
Checksum: 0x12

----------------

Failures:

Block 0, Base EDID:
  Display Descriptor #2: Monitor descriptor block has byte 4 nonzero (0x20).
  Dummy Descriptor: Dummy block filled with garbage.
EDID:
  Extension Block 1 started with EDID header, ignoring Extension Blocks >= 1.

EDID conformity: FAIL
