edid-decode (hex):

00 ff ff ff ff ff ff 00 05 f0 c3 06 01 01 01 01
19 1f 01 03 68 30 1b 78 2a d7 a5 a2 59 4a 96 24
14 50 54 bf ef 00 d1 c0 b3 00 95 00 81 80 81 40
81 c0 71 4f 01 01 02 3a 80 18 71 38 2d 40 58 2c
45 00 dd 0c 11 00 00 1e 00 00 00 fd 00 32 4c 1e
53 11 00 0a 20 20 20 20 20 20 00 00 00 fc 00 32
32 43 48 31 51 0a 20 20 20 20 20 20 00 00 00 ff
00 31 32 35 30 34 31 46 41 33 4c 43 4a 00 00 ac

00 ff ff ff ff ff ff 00 05 f0 c3 06 01 01 01 01
19 1f 01 03 68 30 1b 78 2a d7 a5 a2 59 4a 96 24
14 50 54 bf ef 00 d1 c0 b3 00 95 00 81 80 81 40
81 c0 71 4f 01 01 02 3a 80 18 71 38 2d 40 58 2c
45 00 dd 0c 11 00 00 1e 00 00 00 fd 00 32 4c 1e
53 11 00 0a 20 20 20 20 20 20 00 00 00 fc 00 32
32 43 48 31 51 0a 20 20 20 20 20 20 00 00 00 ff
00 31 32 35 30 34 31 46 41 33 4c 43 4a 00 00 ac

----------------

Block 0, Base EDID:
  EDID Structure Version & Revision: 1.3
  Vendor & Product Identification:
    Manufacturer: AOP
    Model: 1731
    Serial Number: ...
    Made in: week 25 of 2021
  Basic Display Parameters & Features:
    Analog display
    Signal Level Standard: 0.700 : 0.000 : 0.700 V p-p
    Blank level equals black level
    Sync: Separate
    Maximum image size: 48 cm x 27 cm
    Gamma: 2.20
    DPMS levels: Off
    RGB color display
    First detailed timing is the preferred timing
  Color Characteristics:
    Red  : 0.6357, 0.3486
    Green: 0.2900, 0.5888
    Blue : 0.1425, 0.0800
    White: 0.3134, 0.3291
  Established Timings I & II:
    IBM     :   720x400    70.081663 Hz   9:5     31.467 kHz     28.320000 MHz
    DMT 0x04:   640x480    59.940476 Hz   4:3     31.469 kHz     25.175000 MHz
    Apple   :   640x480    66.666667 Hz   4:3     35.000 kHz     30.240000 MHz
    DMT 0x05:   640x480    72.808802 Hz   4:3     37.861 kHz     31.500000 MHz
    DMT 0x06:   640x480    75.000000 Hz   4:3     37.500 kHz     31.500000 MHz
    DMT 0x08:   800x600    56.250000 Hz   4:3     35.156 kHz     36.000000 MHz
    DMT 0x09:   800x600    60.316541 Hz   4:3     37.879 kHz     40.000000 MHz
    DMT 0x0a:   800x600    72.187572 Hz   4:3     48.077 kHz     50.000000 MHz
    DMT 0x0b:   800x600    75.000000 Hz   4:3     46.875 kHz     49.500000 MHz
    Apple   :   832x624    74.551266 Hz   4:3     49.726 kHz     57.284000 MHz
    DMT 0x10:  1024x768    60.003840 Hz   4:3     48.363 kHz     65.000000 MHz
    DMT 0x11:  1024x768    70.069359 Hz   4:3     56.476 kHz     75.000000 MHz
    DMT 0x12:  1024x768    75.028582 Hz   4:3     60.023 kHz     78.750000 MHz
    DMT 0x24:  1280x1024   75.024675 Hz   5:4     79.976 kHz    135.000000 MHz
  Standard Timings:
    DMT 0x52:  1920x1080   60.000000 Hz  16:9     67.500 kHz    148.500000 MHz
    DMT 0x3a:  1680x1050   59.954250 Hz  16:10    65.290 kHz    146.250000 MHz
    DMT 0x2f:  1440x900    59.887445 Hz  16:10    55.935 kHz    106.500000 MHz
    DMT 0x23:  1280x1024   60.019740 Hz   5:4     63.981 kHz    108.000000 MHz
    DMT 0x20:  1280x960    60.000000 Hz   4:3     60.000 kHz    108.000000 MHz
    DMT 0x55:  1280x720    60.000000 Hz  16:9     45.000 kHz     74.250000 MHz
    DMT 0x15:  1152x864    75.000000 Hz   4:3     67.500 kHz    108.000000 MHz
  Detailed Timing Descriptors:
    DTD 1:  1920x1080   60.000000 Hz  16:9     67.500 kHz    148.500000 MHz (477 mm x 268 mm)
                 Hfront   88 Hsync  44 Hback  148 Hpol P
                 Vfront    4 Vsync   5 Vback   36 Vpol P
    Display Range Limits:
      Monitor ranges (GTF): 50-76 Hz V, 30-83 kHz H, max dotclock 170 MHz
    Display Product Name: '22CH1Q'
    Display Product Serial Number: ...
Checksum: 0xac

----------------

Warnings:

Block 0, Base EDID:
  Vendor & Product Identification: The serial number is one of the known dummy values, it should probably be set to 0.

Failures:

Block 0, Base EDID:
  Display Product Serial Number: ...
EDID:
  Extension Block 1 started with EDID header, ignoring Extension Blocks >= 1.

EDID conformity: FAIL
