edid-decode (hex):

00 ff ff ff ff ff ff 00 06 af b5 ce 00 00 00 00
18 22 01 04 a5 1d 12 78 03 e4 05 a7 54 4a a0 25
12 50 54 00 00 00 01 01 01 01 01 01 01 01 01 01
01 01 01 01 01 01 26 3d 80 b8 70 b0 28 40 10 10
35 00 1e b2 10 00 00 18 c4 28 80 b8 70 b0 28 40
10 10 35 00 1e b2 10 00 00 18 00 00 00 03 00 02
66 ff 04 64 7d 0c 09 13 7d 00 00 00 00 00 00 03
00 0d 38 ff 22 96 90 0d 0b 49 f4 01 01 20 01 23

70 20 79 02 00 22 00 14 7b 63 02 85 7f 07 b7 00
0f 80 0f 00 af 04 27 00 02 00 04 00 25 01 09 7b
63 02 7b 63 02 28 3c 80 81 00 15 74 1a 00 00 03
01 28 3c 00 00 80 10 80 10 3c 00 00 00 00 00 00
00 00 00 00 00 00 00 00 00 00 00 00 00 00 00 00
00 00 00 00 00 00 00 00 00 00 00 00 00 00 00 00
00 00 00 00 00 00 00 00 00 00 00 00 00 00 00 00
00 00 00 00 00 00 00 00 00 00 00 00 00 00 54 90

00 ff ff ff ff ff ff 00 06 af b5 ce 00 00 00 00
18 22 01 04 a5 1d 12 78 03 e4 05 a7 54 4a a0 25
12 50 54 00 00 00 01 01 01 01 01 01 01 01 01 01
01 01 01 01 01 01 26 3d 80 b8 70 b0 28 40 10 10
35 00 1e b2 10 00 00 18 c4 28 80 b8 70 b0 28 40
10 10 35 00 1e b2 10 00 00 18 00 00 00 03 00 02
66 ff 04 64 7d 0c 09 13 7d 00 00 00 00 00 00 03
00 0d 38 ff 22 96 90 0d 0b 49 f4 01 01 20 01 23

70 20 79 02 00 22 00 14 7b 63 02 85 7f 07 b7 00
0f 80 0f 00 af 04 27 00 02 00 04 00 25 01 09 7b
63 02 7b 63 02 28 3c 80 81 00 15 74 1a 00 00 03
01 28 3c 00 00 80 10 80 10 3c 00 00 00 00 00 00
00 00 00 00 00 00 00 00 00 00 00 00 00 00 00 00
00 00 00 00 00 00 00 00 00 00 00 00 00 00 00 00
00 00 00 00 00 00 00 00 00 00 00 00 00 00 00 00
00 00 00 00 00 00 00 00 00 00 00 00 00 00 54 90

----------------

Block 0, Base EDID:
  EDID Structure Version & Revision: 1.4
  Vendor & Product Identification:
    Manufacturer: AUO
    Model: 52917
    Made in: week 24 of 2024
  Basic Display Parameters & Features:
    Digital display
    Bits per primary color channel: 8
    DisplayPort interface
    Maximum image size: 29 cm x 18 cm
    Gamma: 2.20
    Supported color formats: RGB 4:4:4
    First detailed timing includes the native pixel format and preferred refresh rate
    Display supports continuous frequencies
  Color Characteristics:
    Red  : 0.6552, 0.3300
    Green: 0.2900, 0.6250
    Blue : 0.1445, 0.0703
    White: 0.3134, 0.3291
  Established Timings I & II: none
  Standard Timings: none
  Detailed Timing Descriptors:
    DTD 1:  1920x1200   60.000920 Hz  16:10    74.401 kHz    156.540000 MHz (286 mm x 178 mm)
                 Hfront   16 Hsync  16 Hback  152 Hpol N
                 Vfront    3 Vsync   5 Vback   32 Vpol N
    DTD 2:  1920x1200   40.000613 Hz  16:10    49.601 kHz    104.360000 MHz (286 mm x 178 mm)
                 Hfront   16 Hsync  16 Hback  152 Hpol N
                 Vfront    3 Vsync   5 Vback   32 Vpol N
    Manufacturer-Specified Display Descriptor (0x03): 00 03 00 02 66 ff 04 64 7d 0c 09 13 7d 00 00 00 '....f..d}...}...'
    Manufacturer-Specified Display Descriptor (0x03): 00 03 00 0d 38 ff 22 96 90 0d 0b 49 f4 01 01 20 '....8."....I... '
  Extension blocks: 1
Checksum: 0x23

----------------

Block 1, DisplayID Extension Block:
  Version: 2.0
  Extension Count: 0
  Display Product Primary Use Case: None of the listed primary use cases; generic display
  Video Timing Modes Type 7 - Detailed Timings Data Block:
    DTD:  1920x1200   60.000920 Hz  16:10    74.401 kHz    156.540000 MHz (aspect 16:10, no 3D stereo, preferred)
               Hfront   16 Hsync  16 Hback  152 Hpol P
               Vfront    3 Vsync   5 Vback   32 Vpol N
  Dynamic Video Timing Range Limits Data Block:
    Minimum Pixel Clock: 156540 kHz
    Maximum Pixel Clock: 156540 kHz
    Minimum Vertical Refresh Rate: 40 Hz
    Maximum Vertical Refresh Rate: 60 Hz
    Seamless Dynamic Video Timing Support: Yes
  CTA-861 DisplayID Data Block:
  Vendor-Specific Data Block (AMD), OUI 00-00-1A:
    Version: 3
    Flags 1: 0x01
      FreeSync Supported
    Minimum Refresh Rate: 40 Hz
    Maximum Refresh Rate: 60 Hz
    Flags 5: 0x00
  Checksum: 0x54
Checksum: 0x90

----------------

Warnings:

Block 0, Base EDID:
  Missing Display Product Name.

Failures:

Block 0, Base EDID:
  Missing Display Range Limits Descriptor.
EDID:
  Extension Block 2 started with EDID header, ignoring Extension Blocks >= 2.
  DisplayID: Missing DisplayID Display Parameters Data Block.

EDID conformity: FAIL
