edid-decode (hex):

00 ff ff ff ff ff ff 00 2c ee 25 25 33 00 00 00
21 20 01 03 80 35 1d 78 2a ee 91 a3 54 4c 99 26
0f 50 54 af cf 00 71 40 81 c0 81 80 95 00 a9 c0
b3 00 d1 c0 01 01 02 3a 80 18 71 38 2d 40 30 20
35 00 0f 28 21 00 00 1e 00 00 00 fc 00 4b 41 4d
4e 32 34 46 37 56 41 0a 20 20 00 00 00 ff 00 0a
20 20 20 20 20 20 20 20 20 20 20 20 00 00 00 fd
00 30 4b 1e 64 14 00 0a 20 20 20 20 20 20 01 9f

02 03 26 f2 48 90 01 02 03 04 13 1f 05 23 09 7f
07 83 01 00 00 67 03 0c 00 10 00 18 48 68 1a 00
00 01 01 30 4b e6 02 3a 80 18 71 38 2d 40 30 20
35 00 0f 28 21 00 00 1a 50 44 80 a0 70 38 29 40
30 20 35 00 0f 28 21 00 00 1a f7 1c 50 a0 50 00
2d 30 30 20 35 00 0f 28 21 00 00 1a 00 00 00 00
00 00 00 00 00 00 00 00 00 00 00 00 00 00 00 00
00 00 00 00 00 00 00 00 00 00 00 00 00 00 00 85

00 ff ff ff ff ff ff 00 2c ee 25 25 33 00 00 00
21 20 01 03 80 35 1d 78 2a ee 91 a3 54 4c 99 26
0f 50 54 af cf 00 71 40 81 c0 81 80 95 00 a9 c0
b3 00 d1 c0 01 01 02 3a 80 18 71 38 2d 40 30 20
35 00 0f 28 21 00 00 1e 00 00 00 fc 00 4b 41 4d
4e 32 34 46 37 56 41 0a 20 20 00 00 00 ff 00 0a
20 20 20 20 20 20 20 20 20 20 20 20 00 00 00 fd
00 30 4b 1e 64 14 00 0a 20 20 20 20 20 20 01 9f

02 03 26 f2 48 90 01 02 03 04 13 1f 05 23 09 7f
07 83 01 00 00 67 03 0c 00 10 00 18 48 68 1a 00
00 01 01 30 4b e6 02 3a 80 18 71 38 2d 40 30 20
35 00 0f 28 21 00 00 1a 50 44 80 a0 70 38 29 40
30 20 35 00 0f 28 21 00 00 1a f7 1c 50 a0 50 00
2d 30 30 20 35 00 0f 28 21 00 00 1a 00 00 00 00
00 00 00 00 00 00 00 00 00 00 00 00 00 00 00 00
00 00 00 00 00 00 00 00 00 00 00 00 00 00 00 85

----------------

Block 0, Base EDID:
  EDID Structure Version & Revision: 1.3
  Vendor & Product Identification:
    Manufacturer: KGN
    Model: 9509
    Serial Number: ...
    Made in: week 33 of 2022
  Basic Display Parameters & Features:
    Digital display
    Maximum image size: 53 cm x 29 cm
    Gamma: 2.20
    DPMS levels: Off
    RGB color display
    First detailed timing is the preferred timing
  Color Characteristics:
    Red  : 0.6396, 0.3300
    Green: 0.2998, 0.5996
    Blue : 0.1503, 0.0595
    White: 0.3125, 0.3291
  Established Timings I & II:
    IBM     :   720x400    70.081663 Hz   9:5     31.467 kHz     28.320000 MHz
    DMT 0x04:   640x480    59.940476 Hz   4:3     31.469 kHz     25.175000 MHz
    DMT 0x05:   640x480    72.808802 Hz   4:3     37.861 kHz     31.500000 MHz
    DMT 0x06:   640x480    75.000000 Hz   4:3     37.500 kHz     31.500000 MHz
    DMT 0x08:   800x600    56.250000 Hz   4:3     35.156 kHz     36.000000 MHz
    DMT 0x09:   800x600    60.316541 Hz   4:3     37.879 kHz     40.000000 MHz
    DMT 0x0a:   800x600    72.187572 Hz   4:3     48.077 kHz     50.000000 MHz
    DMT 0x0b:   800x600    75.000000 Hz   4:3     46.875 kHz     49.500000 MHz
    DMT 0x10:  1024x768    60.003840 Hz   4:3     48.363 kHz     65.000000 MHz
    DMT 0x11:  1024x768    70.069359 Hz   4:3     56.476 kHz     75.000000 MHz
    DMT 0x12:  1024x768    75.028582 Hz   4:3     60.023 kHz     78.750000 MHz
    DMT 0x24:  1280x1024   75.024675 Hz   5:4     79.976 kHz    135.000000 MHz
  Standard Timings:
    GTF     :  1152x864    60.000000 Hz   4:3     53.700 kHz     81.624000 MHz
    DMT 0x55:  1280x720    60.000000 Hz  16:9     45.000 kHz     74.250000 MHz
    DMT 0x23:  1280x1024   60.019740 Hz   5:4     63.981 kHz    108.000000 MHz
    DMT 0x2f:  1440x900    59.887445 Hz  16:10    55.935 kHz    106.500000 MHz
    DMT 0x53:  1600x900    60.000000 Hz  16:9     60.000 kHz    108.000000 MHz (RB)
    DMT 0x3a:  1680x1050   59.954250 Hz  16:10    65.290 kHz    146.250000 MHz
    DMT 0x52:  1920x1080   60.000000 Hz  16:9     67.500 kHz    148.500000 MHz
  Detailed Timing Descriptors:
    DTD 1:  1920x1080   60.000000 Hz  16:9     67.500 kHz    148.500000 MHz (527 mm x 296 mm)
                 Hfront   48 Hsync  32 Hback  200 Hpol P
                 Vfront    3 Vsync   5 Vback   37 Vpol P
    Display Product Name: 'KAMN24F7VA'
    Display Product Serial Number: ...
    Display Range Limits:
      Monitor ranges (GTF): 48-75 Hz V, 30-100 kHz H, max dotclock 200 MHz
  Extension blocks: 1
Checksum: 0x9f

----------------

Block 1, CTA-861 Extension Block:
  Revision: 3
  Underscans IT Video Formats by default
  Basic audio support
  Supports YCbCr 4:4:4
  Supports YCbCr 4:2:2
  Native DTDs: 2
  Video Data Block:
    VIC  16:  1920x1080   60.000000 Hz  16:9     67.500 kHz    148.500000 MHz (native)
    VIC   1:   640x480    59.940476 Hz   4:3     31.469 kHz     25.175000 MHz
    VIC   2:   720x480    59.940060 Hz   4:3     31.469 kHz     27.000000 MHz
    VIC   3:   720x480    59.940060 Hz  16:9     31.469 kHz     27.000000 MHz
    VIC   4:  1280x720    60.000000 Hz  16:9     45.000 kHz     74.250000 MHz
    VIC  19:  1280x720    50.000000 Hz  16:9     37.500 kHz     74.250000 MHz
    VIC  31:  1920x1080   50.000000 Hz  16:9     56.250 kHz    148.500000 MHz
    VIC   5:  1920x1080i  60.000000 Hz  16:9     33.750 kHz     74.250000 MHz
  Audio Data Block:
    Linear PCM:
      Max channels: 2
      Supported sample rates (kHz): 192 176.4 96 88.2 48 44.1 32
      Supported sample sizes (bits): 24 20 16
  Speaker Allocation Data Block:
    FL/FR - Front Left/Right
  Vendor-Specific Data Block (HDMI), OUI 00-0C-03:
    Source physical address: 1.0.0.0
    DC_30bit
    DC_Y444
    Maximum TMDS clock: 360 MHz
  Vendor-Specific Data Block (AMD), OUI 00-00-1A:
    Version: 1
    Flags 1: 0x01
      FreeSync Supported
    Minimum Refresh Rate: 48 Hz
    Maximum Refresh Rate: 75 Hz
    MCCS VCP Code: 0xe6
  Detailed Timing Descriptors:
    DTD 2:  1920x1080   60.000000 Hz  16:9     67.500 kHz    148.500000 MHz (527 mm x 296 mm)
                 Hfront   48 Hsync  32 Hback  200 Hpol P
                 Vfront    3 Vsync   5 Vback   37 Vpol N
    DTD 3:  1920x1080   75.001716 Hz  16:9     84.077 kHz    174.880000 MHz (527 mm x 296 mm)
                 Hfront   48 Hsync  32 Hback   80 Hpol P
                 Vfront    3 Vsync   5 Vback   33 Vpol N
    DTD 4:  1360x768    60.003561 Hz  85:48    48.783 kHz     74.150000 MHz (527 mm x 296 mm)
                 Hfront   48 Hsync  32 Hback   80 Hpol P
                 Vfront    3 Vsync   5 Vback   37 Vpol N
Checksum: 0x85  Unused space in Extension Block: 35 bytes

----------------

Warnings:

Block 0, Base EDID:
  Detailed Timing Descriptor #1: DTD is similar but not identical to VIC 16.
Block 1, CTA-861 Extension Block:
  Video Data Block: VIC 16 and the first DTD are not identical. Is this intended?
  Detailed Timing Descriptor #2: DTD is similar but not identical to VIC 16.
  Display Product Serial Number is set, so the Serial Number in the Base EDID should be 0.

Failures:

Block 0, Base EDID:
  Display Product Serial Number: ...
  Basic Display Parameters & Features: The chromaticities match sRGB, but sRGB is not signaled.
Block 1, CTA-861 Extension Block:
  Vendor-Specific Data Block (HDMI), OUI 00-0C-03: HDMI VSDB Max TMDS rate is > 340.
  Missing VCDB, needed for Set Selectable RGB Quantization to avoid interop issues.
EDID:
  Extension Block 2 started with EDID header, ignoring Extension Blocks >= 2.

EDID conformity: FAIL
