edid-decode (hex):

00 ff ff ff ff ff ff 00 1e 6d b2 5b 80 52 02 00
04 20 01 04 b5 35 1e 78 9e 47 e5 aa 56 4c 9b 25
0f 50 54 25 4b 00 d1 c0 61 40 31 7c 45 7c 61 7c
d1 fc 01 01 01 01 5a 87 80 a0 70 38 4d 40 30 20
3a 00 0f 28 21 00 00 1a 02 3a 80 18 71 38 2d 40
58 2c 45 00 0f 28 21 00 00 1e 00 00 00 fd 00 30
90 1e c8 2a 00 0a 20 20 20 20 20 20 00 00 00 fc
00 4c 47 20 55 4c 54 52 41 47 45 41 52 0a 01 57

02 03 13 71 23 09 07 07 e3 05 c0 00 e6 06 05 01
53 53 50 80 48 80 18 71 38 2d 40 58 2c 45 00 0f
28 21 00 00 1e 86 6f 80 a0 70 38 40 40 30 20 3d
02 0f 28 21 00 00 1e 01 1d 00 72 51 d0 1e 20 6e
28 55 00 0f 28 21 00 00 1e 00 00 00 00 00 00 00
00 00 00 00 00 00 00 00 00 00 00 00 00 00 00 00
00 00 00 00 00 00 00 00 00 00 00 00 00 00 00 00
00 00 00 00 00 00 00 00 00 00 00 00 00 00 00 66

00 ff ff ff ff ff ff 00 1e 6d b2 5b 80 52 02 00
04 20 01 04 b5 35 1e 78 9e 47 e5 aa 56 4c 9b 25
0f 50 54 25 4b 00 d1 c0 61 40 31 7c 45 7c 61 7c
d1 fc 01 01 01 01 5a 87 80 a0 70 38 4d 40 30 20
3a 00 0f 28 21 00 00 1a 02 3a 80 18 71 38 2d 40
58 2c 45 00 0f 28 21 00 00 1e 00 00 00 fd 00 30
90 1e c8 2a 00 0a 20 20 20 20 20 20 00 00 00 fc
00 4c 47 20 55 4c 54 52 41 47 45 41 52 0a 01 57

02 03 13 71 23 09 07 07 e3 05 c0 00 e6 06 05 01
53 53 50 80 48 80 18 71 38 2d 40 58 2c 45 00 0f
28 21 00 00 1e 86 6f 80 a0 70 38 40 40 30 20 3d
02 0f 28 21 00 00 1e 01 1d 00 72 51 d0 1e 20 6e
28 55 00 0f 28 21 00 00 1e 00 00 00 00 00 00 00
00 00 00 00 00 00 00 00 00 00 00 00 00 00 00 00
00 00 00 00 00 00 00 00 00 00 00 00 00 00 00 00
00 00 00 00 00 00 00 00 00 00 00 00 00 00 00 66

----------------

Block 0, Base EDID:
  EDID Structure Version & Revision: 1.4
  Vendor & Product Identification:
    Manufacturer: GSM
    Model: 23474
    Serial Number: ...
    Made in: week 4 of 2022
  Basic Display Parameters & Features:
    Digital display
    Bits per primary color channel: 10
    DisplayPort interface
    Maximum image size: 53 cm x 30 cm
    Gamma: 2.20
    DPMS levels: Standby
    Supported color formats: RGB 4:4:4, YCrCb 4:4:4, YCrCb 4:2:2
    Default (sRGB) color space is primary color space
    First detailed timing includes the native pixel format and preferred refresh rate
  Color Characteristics:
    Red  : 0.6650, 0.3359
    Green: 0.2978, 0.6083
    Blue : 0.1474, 0.0605
    White: 0.3134, 0.3291
  Established Timings I & II:
    DMT 0x04:   640x480    59.940476 Hz   4:3     31.469 kHz     25.175000 MHz
    DMT 0x06:   640x480    75.000000 Hz   4:3     37.500 kHz     31.500000 MHz
    DMT 0x09:   800x600    60.316541 Hz   4:3     37.879 kHz     40.000000 MHz
    DMT 0x0b:   800x600    75.000000 Hz   4:3     46.875 kHz     49.500000 MHz
    DMT 0x10:  1024x768    60.003840 Hz   4:3     48.363 kHz     65.000000 MHz
    DMT 0x12:  1024x768    75.028582 Hz   4:3     60.023 kHz     78.750000 MHz
    DMT 0x24:  1280x1024   75.024675 Hz   5:4     79.976 kHz    135.000000 MHz
  Standard Timings:
    DMT 0x52:  1920x1080   60.000000 Hz  16:9     67.500 kHz    148.500000 MHz
    DMT 0x10:  1024x768    60.003840 Hz   4:3     48.363 kHz     65.000000 MHz
    GTF     :   640x480   119.999084 Hz   4:3     61.800 kHz     52.406000 MHz
    GTF     :   800x600   119.999886 Hz   4:3     77.160 kHz     83.950000 MHz
    GTF     :  1024x768   119.999931 Hz   4:3     98.760 kHz    139.054000 MHz
    GTF     :  1920x1080  119.999987 Hz  16:9    138.840 kHz    368.759000 MHz
  Detailed Timing Descriptors:
    DTD 1:  1920x1080  143.981451 Hz  16:9    166.587 kHz    346.500000 MHz (527 mm x 296 mm)
                 Hfront   48 Hsync  32 Hback   80 Hpol P
                 Vfront    3 Vsync  10 Vback   64 Vpol N
    DTD 2:  1920x1080   60.000000 Hz  16:9     67.500 kHz    148.500000 MHz (527 mm x 296 mm)
                 Hfront   88 Hsync  44 Hback  148 Hpol P
                 Vfront    4 Vsync   5 Vback   36 Vpol P
    Display Range Limits:
      Monitor ranges (GTF): 48-144 Hz V, 30-200 kHz H, max dotclock 420 MHz
    Display Product Name: 'LG ULTRAGEAR'
  Extension blocks: 1
Checksum: 0x57

----------------

Block 1, CTA-861 Extension Block:
  Revision: 3
  Basic audio support
  Supports YCbCr 4:4:4
  Supports YCbCr 4:2:2
  Native detailed modes: 1
  Audio Data Block:
    Linear PCM:
      Max channels: 2
      Supported sample rates (kHz): 48 44.1 32
      Supported sample sizes (bits): 24 20 16
  Colorimetry Data Block:
    BT2020YCC
    BT2020RGB
  HDR Static Metadata Data Block:
    Electro optical transfer functions:
      Traditional gamma - SDR luminance range
      SMPTE ST2084
    Supported static metadata descriptors:
      Static metadata type 1
    Desired content max luminance: 83 (301.833 cd/m^2)
    Desired content max frame-average luminance: 83 (301.833 cd/m^2)
    Desired content min luminance: 80 (0.297 cd/m^2)
  Detailed Timing Descriptors:
    DTD 3:  1920x1080   74.989899 Hz  16:9     84.364 kHz    185.600000 MHz (527 mm x 296 mm)
                 Hfront   88 Hsync  44 Hback  148 Hpol P
                 Vfront    4 Vsync   5 Vback   36 Vpol P
    DTD 4:  1920x1080  119.982181 Hz  16:9    137.260 kHz    285.500000 MHz (527 mm x 296 mm)
                 Hfront   48 Hsync  32 Hback   80 Hpol P
                 Vfront    3 Vsync  45 Vback   16 Vpol P
    DTD 5:  1280x720    60.000000 Hz  16:9     45.000 kHz     74.250000 MHz (527 mm x 296 mm)
                 Hfront  110 Hsync  40 Hback  220 Hpol P
                 Vfront    5 Vsync   5 Vback   20 Vpol P
Checksum: 0x66  Unused space in Extension Block: 54 bytes

----------------

Block 2, Unknown EDID Extension Block 0x00:
  00 ff ff ff ff ff ff 00 1e 6d b2 5b 80 52 02 00 '.........m.[.R..'
  04 20 01 04 b5 35 1e 78 9e 47 e5 aa 56 4c 9b 25 '. ...5.x.G..VL.%'
  0f 50 54 25 4b 00 d1 c0 61 40 31 7c 45 7c 61 7c '.PT%K...a@1|E|a|'
  d1 fc 01 01 01 01 5a 87 80 a0 70 38 4d 40 30 20 '......Z...p8M@0 '
  3a 00 0f 28 21 00 00 1a 02 3a 80 18 71 38 2d 40 ':..(!....:..q8-@'
  58 2c 45 00 0f 28 21 00 00 1e 00 00 00 fd 00 30 'X,E..(!........0'
  90 1e c8 2a 00 0a 20 20 20 20 20 20 00 00 00 fc '...*..      ....'
  00 4c 47 20 55 4c 54 52 41 47 45 41 52 0a 01 57 '.LG ULTRAGEAR..W'
Checksum: 0x57

----------------

Block 3, CTA-861 Extension Block:
  Revision: 3
  Basic audio support
  Supports YCbCr 4:4:4
  Supports YCbCr 4:2:2
  Native detailed modes: 1
  Audio Data Block:
    Linear PCM:
      Max channels: 2
      Supported sample rates (kHz): 48 44.1 32
      Supported sample sizes (bits): 24 20 16
  Colorimetry Data Block:
    BT2020YCC
    BT2020RGB
  HDR Static Metadata Data Block:
    Electro optical transfer functions:
      Traditional gamma - SDR luminance range
      SMPTE ST2084
    Supported static metadata descriptors:
      Static metadata type 1
    Desired content max luminance: 83 (301.833 cd/m^2)
    Desired content max frame-average luminance: 83 (301.833 cd/m^2)
    Desired content min luminance: 80 (0.297 cd/m^2)
  Detailed Timing Descriptors:
    DTD 6:  1920x1080   74.989899 Hz  16:9     84.364 kHz    185.600000 MHz (527 mm x 296 mm)
                 Hfront   88 Hsync  44 Hback  148 Hpol P
                 Vfront    4 Vsync   5 Vback   36 Vpol P
    DTD 7:  1920x1080  119.982181 Hz  16:9    137.260 kHz    285.500000 MHz (527 mm x 296 mm)
                 Hfront   48 Hsync  32 Hback   80 Hpol P
                 Vfront    3 Vsync  45 Vback   16 Vpol P
    DTD 8:  1280x720    60.000000 Hz  16:9     45.000 kHz     74.250000 MHz (527 mm x 296 mm)
                 Hfront  110 Hsync  40 Hback  220 Hpol P
                 Vfront    5 Vsync   5 Vback   20 Vpol P
Checksum: 0x66  Unused space in Extension Block: 54 bytes

----------------

Warnings:

Block 0, Base EDID:
  Detailed Timing Descriptor #2: DTD is identical to VIC 16, which is not present in the CTA Ext Block.
  Display Range Limits: GTF support is deprecated in EDID 1.4.
Block 1, CTA-861 Extension Block:
  IT Video Formats are overscanned by default, but normally this should be underscanned.
  Detailed Timing Descriptor #5: DTD is identical to VIC 4, which is not present in the CTA Ext Block.
Block 3, CTA-861 Extension Block:
  IT Video Formats are overscanned by default, but normally this should be underscanned.
  Detailed Timing Descriptor #8: DTD is identical to VIC 4, which is not present in the CTA Ext Block.

Failures:

Block 0, Base EDID:
  Basic Display Parameters & Features: sRGB is signaled, but the chromaticities do not match.
  Display Range Limits: GTF is supported, but the display does not support continuous frequencies.
Block 1, CTA-861 Extension Block:
  Missing VCDB, needed for Set Selectable RGB Quantization to avoid interop issues.
Block 2, Base EDID:
  Unknown Extension Block.
Block 3, CTA-861 Extension Block:
  Colorimetry Data Block: Only one instance of this Data Block is allowed.
  HDR Static Metadata Data Block: Only one instance of this Data Block is allowed.
EDID:
  Base EDID: EDID specified 1 extension block(s), but found 3 extension block(s).

EDID conformity: FAIL
