edid-decode (hex):

00 ff ff ff ff ff ff 00 30 e4 66 03 00 00 00 00
00 15 01 04 90 1f 11 78 02 fc 45 95 58 55 92 28
20 50 54 00 00 00 01 01 01 01 01 01 01 01 01 01
01 01 01 01 01 01 58 2f 40 f8 61 84 3c 30 a0 60
35 00 35 ae 10 00 00 1a 90 1f 40 f8 61 84 3c 30
a0 60 35 00 35 ae 10 00 00 1a 00 00 00 fe 00 33
4e 50 52 36 80 31 34 30 57 44 32 0a 00 00 00 00
00 00 41 31 9e 01 10 00 00 02 01 0a 20 20 00 a7

----------------

Block 0, Base EDID:
  EDID Structure Version & Revision: 1.4
  Vendor & Product Identification:
    Manufacturer: LGD
    Model: 870
    Made in: 2011
  Basic Display Parameters & Features:
    Digital display
    Bits per primary color channel: 6
    Digital interface is not defined
    Maximum image size: 31 cm x 17 cm
    Gamma: 2.20
    Supported color formats: RGB 4:4:4
    First detailed timing includes the native pixel format and preferred refresh rate
  Color Characteristics:
    Red  : 0.5849, 0.3466
    Green: 0.3349, 0.5703
    Blue : 0.1572, 0.1250
    White: 0.3134, 0.3291
  Established Timings I & II: none
  Standard Timings: none
  Detailed Timing Descriptors:
    DTD 1:  1600x900    60.004753 Hz  16:9     57.605 kHz    121.200000 MHz (309 mm x 174 mm)
                 Hfront  160 Hsync  96 Hback  248 Hpol P
                 Vfront    3 Vsync   5 Vback   52 Vpol N
    DTD 2:  1600x900    40.003169 Hz  16:9     38.403 kHz     80.800000 MHz (309 mm x 174 mm)
                 Hfront  160 Hsync  96 Hback  248 Hpol P
                 Vfront    3 Vsync   5 Vback   52 Vpol N
    Alphanumeric Data String: '3NPR6.140WD2'
    Manufacturer-Specified Display Descriptor (0x00): 00 00 00 00 41 31 9e 01 10 00 00 02 01 0a 20 20 '....A1........  '
Checksum: 0xa7

----------------

Warnings:

Block 0, Base EDID:
  Alphanumeric Data String: Non-ASCII character 0x80 at position 5, can cause problems.
  Missing Display Product Name.

EDID conformity: PASS
