edid-decode (hex):

00 ff ff ff ff ff ff 00 22 f0 11 42 01 00 00 00
30 14 01 03 80 33 1d 78 ee ee 20 a3 56 51 9e 27
0b 50 54 00 00 00 01 01 01 01 01 01 01 01 01 01
01 01 01 01 01 01 9d 34 80 64 70 38 1f 40 1e 14
35 00 fd 1e 11 00 00 00 00 00 00 fc 00 48 50 20
54 6f 75 63 68 53 6d 61 72 74 00 00 00 fc 00 0a
20 20 20 20 20 20 20 20 20 20 20 20 00 00 00 fc
00 48 50 5f 74 6f 75 63 68 73 6d 61 72 74 00 76

----------------

Block 0, Base EDID:
  EDID Structure Version & Revision: 1.3
  Vendor & Product Identification:
    Manufacturer: HWP
    Model: 16913
    Serial Number: ...
    Made in: week 48 of 2010
  Basic Display Parameters & Features:
    Digital display
    Maximum image size: 51 cm x 29 cm
    Gamma: 2.20
    DPMS levels: Standby Suspend Off
    RGB color display
    Default (sRGB) color space is primary color space
    First detailed timing is the preferred timing
  Color Characteristics:
    Red  : 0.6396, 0.3378
    Green: 0.3193, 0.6191
    Blue : 0.1523, 0.0449
    White: 0.3125, 0.3281
  Established Timings I & II: none
  Standard Timings: none
  Detailed Timing Descriptors:
    DTD 1:  1920x1080   60.016398 Hz  16:9     66.678 kHz    134.690000 MHz (analog composite, sync-on-green, 509 mm x 286 mm)
                 Hfront   30 Hsync  20 Hback   50 Hpol N
                 Vfront    3 Vsync   5 Vback   23 Vpol N
    Display Product Name: 'HP TouchSmart'
    Display Product Name: ''
    Display Product Name: 'HP_touchsmart'
Checksum: 0x76

----------------

Warnings:

Block 0, Base EDID:
  Vendor & Product Identification: The serial number is one of the known dummy values, it should probably be set to 0.

Failures:

Block 0, Base EDID:
  Basic Display Parameters & Features: sRGB is signaled, but the chromaticities do not match.
  Display Product Name: Empty string.
  Missing Display Range Limits Descriptor.

EDID conformity: FAIL
