edid-decode (hex):

00 ff ff ff ff ff ff 00 36 69 c3 3b 00 00 00 00
1e 22 01 04 b5 34 1d 78 3b 3f f5 ab 4f 47 a4 27
12 50 54 bf ef 00 71 4f 81 c0 81 40 81 80 95 00
b3 00 d1 c0 d1 fc 02 3a 80 18 71 38 2d 40 58 2c
45 00 09 25 21 00 00 1e 4e a2 80 a0 70 38 1e 40
30 40 35 00 09 25 21 00 00 1e 00 00 00 fc 00 4d
41 47 20 32 34 32 43 0a 20 20 20 20 00 00 00 fd
00 30 b4 e1 e1 2b 01 0a 20 20 20 20 20 20 01 26

02 03 2e f1 4a 01 03 02 04 90 4c 12 11 13 3f 23
09 07 07 83 01 00 00 68 1a 00 00 01 01 30 b4 00
e3 05 c2 01 e6 06 05 01 53 53 1c e2 00 ea 29 4c
80 78 70 38 2c 40 08 20 e8 04 09 25 21 00 00 1a
51 5a 80 78 70 38 35 40 08 20 78 08 09 25 21 00
00 1a c2 99 80 78 70 38 59 40 08 20 b8 00 09 25
21 00 00 1a 00 00 00 00 00 00 00 00 00 00 00 00
00 00 00 00 00 00 00 00 00 00 00 00 00 00 00 3a

00 ff ff ff ff ff ff 00 36 69 c3 3b 00 00 00 00
1e 22 01 04 b5 34 1d 78 3b 3f f5 ab 4f 47 a4 27
12 50 54 bf ef 00 71 4f 81 c0 81 40 81 80 95 00
b3 00 d1 c0 d1 fc 02 3a 80 18 71 38 2d 40 58 2c
45 00 09 25 21 00 00 1e 4e a2 80 a0 70 38 1e 40
30 40 35 00 09 25 21 00 00 1e 00 00 00 fc 00 4d
41 47 20 32 34 32 43 0a 20 20 20 20 00 00 00 fd
00 30 b4 e1 e1 2b 01 0a 20 20 20 20 20 20 01 26

02 03 2e f1 4a 01 03 02 04 90 4c 12 11 13 3f 23
09 07 07 83 01 00 00 68 1a 00 00 01 01 30 b4 00
e3 05 c2 01 e6 06 05 01 53 53 1c e2 00 ea 29 4c
80 78 70 38 2c 40 08 20 e8 04 09 25 21 00 00 1a
51 5a 80 78 70 38 35 40 08 20 78 08 09 25 21 00
00 1a c2 99 80 78 70 38 59 40 08 20 b8 00 09 25
21 00 00 1a 00 00 00 00 00 00 00 00 00 00 00 00
00 00 00 00 00 00 00 00 00 00 00 00 00 00 00 3a

----------------

Block 0, Base EDID:
  EDID Structure Version & Revision: 1.4
  Vendor & Product Identification:
    Manufacturer: MSI
    Model: 15299
    Made in: week 30 of 2024
  Basic Display Parameters & Features:
    Digital display
    Bits per primary color channel: 10
    DisplayPort interface
    Maximum image size: 52 cm x 29 cm
    Gamma: 2.20
    DPMS levels: Off
    Supported color formats: RGB 4:4:4, YCrCb 4:4:4, YCrCb 4:2:2
    First detailed timing includes the native pixel format and preferred refresh rate
    Display supports continuous frequencies
  Color Characteristics:
    Red  : 0.6679, 0.3115
    Green: 0.2802, 0.6435
    Blue : 0.1552, 0.0732
    White: 0.3134, 0.3291
  Established Timings I & II:
    IBM     :   720x400    70.081663 Hz   9:5     31.467 kHz     28.320000 MHz
    DMT 0x04:   640x480    59.940476 Hz   4:3     31.469 kHz     25.175000 MHz
    Apple   :   640x480    66.666667 Hz   4:3     35.000 kHz     30.240000 MHz
    DMT 0x05:   640x480    72.808802 Hz   4:3     37.861 kHz     31.500000 MHz
    DMT 0x06:   640x480    75.000000 Hz   4:3     37.500 kHz     31.500000 MHz
    DMT 0x08:   800x600    56.250000 Hz   4:3     35.156 kHz     36.000000 MHz
    DMT 0x09:   800x600    60.316541 Hz   4:3     37.879 kHz     40.000000 MHz
    DMT 0x0a:   800x600    72.187572 Hz   4:3     48.077 kHz     50.000000 MHz
    DMT 0x0b:   800x600    75.000000 Hz   4:3     46.875 kHz     49.500000 MHz
    Apple   :   832x624    74.551266 Hz   4:3     49.726 kHz     57.284000 MHz
    DMT 0x10:  1024x768    60.003840 Hz   4:3     48.363 kHz     65.000000 MHz
    DMT 0x11:  1024x768    70.069359 Hz   4:3     56.476 kHz     75.000000 MHz
    DMT 0x12:  1024x768    75.028582 Hz   4:3     60.023 kHz     78.750000 MHz
    DMT 0x24:  1280x1024   75.024675 Hz   5:4     79.976 kHz    135.000000 MHz
  Standard Timings:
    DMT 0x15:  1152x864    75.000000 Hz   4:3     67.500 kHz    108.000000 MHz
    DMT 0x55:  1280x720    60.000000 Hz  16:9     45.000 kHz     74.250000 MHz
    DMT 0x20:  1280x960    60.000000 Hz   4:3     60.000 kHz    108.000000 MHz
    DMT 0x23:  1280x1024   60.019740 Hz   5:4     63.981 kHz    108.000000 MHz
    DMT 0x2f:  1440x900    59.887445 Hz  16:10    55.935 kHz    106.500000 MHz
    DMT 0x3a:  1680x1050   59.954250 Hz  16:10    65.290 kHz    146.250000 MHz
    DMT 0x52:  1920x1080   60.000000 Hz  16:9     67.500 kHz    148.500000 MHz
    GTF     :  1920x1080  119.999987 Hz  16:9    138.840 kHz    368.759000 MHz
  Detailed Timing Descriptors:
    DTD 1:  1920x1080   60.000000 Hz  16:9     67.500 kHz    148.500000 MHz (521 mm x 293 mm)
                 Hfront   88 Hsync  44 Hback  148 Hpol P
                 Vfront    4 Vsync   5 Vback   36 Vpol P
    DTD 2:  1920x1080  179.963617 Hz  16:9    199.760 kHz    415.500000 MHz (521 mm x 293 mm)
                 Hfront   48 Hsync  64 Hback   48 Hpol P
                 Vfront    3 Vsync   5 Vback   22 Vpol P
    Display Product Name: 'MAG 242C'
    Display Range Limits:
      Monitor ranges (Range Limits Only): 48-180 Hz V, 225-225 kHz H, max dotclock 430 MHz
  Extension blocks: 1
Checksum: 0x26

----------------

Block 1, CTA-861 Extension Block:
  Revision: 3
  Underscans IT Video Formats by default
  Basic audio support
  Supports YCbCr 4:4:4
  Supports YCbCr 4:2:2
  Native DTDs: 1
  Video Data Block:
    VIC   1:   640x480    59.940476 Hz   4:3     31.469 kHz     25.175000 MHz
    VIC   3:   720x480    59.940060 Hz  16:9     31.469 kHz     27.000000 MHz
    VIC   2:   720x480    59.940060 Hz   4:3     31.469 kHz     27.000000 MHz
    VIC   4:  1280x720    60.000000 Hz  16:9     45.000 kHz     74.250000 MHz
    VIC  16:  1920x1080   60.000000 Hz  16:9     67.500 kHz    148.500000 MHz (native)
    VIC  76:  1920x1080   60.000000 Hz  64:27    67.500 kHz    148.500000 MHz
    VIC  18:   720x576    50.000000 Hz  16:9     31.250 kHz     27.000000 MHz
    VIC  17:   720x576    50.000000 Hz   4:3     31.250 kHz     27.000000 MHz
    VIC  19:  1280x720    50.000000 Hz  16:9     37.500 kHz     74.250000 MHz
    VIC  63:  1920x1080  120.000000 Hz  16:9    135.000 kHz    297.000000 MHz
  Audio Data Block:
    Linear PCM:
      Max channels: 2
      Supported sample rates (kHz): 48 44.1 32
      Supported sample sizes (bits): 24 20 16
  Speaker Allocation Data Block:
    FL/FR - Front Left/Right
  Vendor-Specific Data Block (AMD), OUI 00-00-1A:
    Version: 1
    Feature Caps: 0x01
    Minimum Refresh Rate: 48 Hz
    Maximum Refresh Rate: 180 Hz
    Flags 1.x: 0x00
  Colorimetry Data Block:
    xvYCC709
    BT2020YCC
    BT2020RGB
    Gamut Boundary Description Metadata Profile P0
  HDR Static Metadata Data Block:
    Electro optical transfer functions:
      Traditional gamma - SDR luminance range
      SMPTE ST2084
    Supported static metadata descriptors:
      Static metadata type 1
    Desired content max luminance: 83 (301.833 cd/m^2)
    Desired content max frame-average luminance: 83 (301.833 cd/m^2)
    Desired content min luminance: 28 (0.036 cd/m^2)
  Video Capability Data Block:
    YCbCr quantization: Selectable (via AVI YQ)
    RGB quantization: Selectable (via AVI Q)
    PT scan behavior: Always Underscanned
    IT scan behavior: Always Underscanned
    CE scan behavior: Always Underscanned
  Detailed Timing Descriptors:
    DTD 3:  1920x1080   85.029830 Hz  16:9     95.574 kHz    194.970000 MHz (521 mm x 293 mm)
                 Hfront    8 Hsync  32 Hback   80 Hpol P
                 Vfront   30 Vsync   8 Vback    6 Vpol N
    DTD 4:  1920x1080  100.033747 Hz  16:9    113.338 kHz    231.210000 MHz (521 mm x 293 mm)
                 Hfront    8 Hsync  32 Hback   80 Hpol P
                 Vfront   39 Vsync   8 Vback    6 Vpol N
    DTD 5:  1920x1080  165.056442 Hz  16:9    192.951 kHz    393.620000 MHz (521 mm x 293 mm)
                 Hfront    8 Hsync  32 Hback   80 Hpol P
                 Vfront   11 Vsync   8 Vback   70 Vpol N
Checksum: 0x3a  Unused space in Extension Block: 27 bytes

----------------

Warnings:

Block 1, CTA-861 Extension Block:
  Video Data Block: VIC 1 and the first DTD are not identical. Is this intended?
  Colorimetry Data Block: Set the sRGB colorimetry bit to avoid interop issues.
  Video Capability Data Block: S_PT is equal to S_IT and S_CE, so should be set to 0 instead.
EDID:
  Base EDID: Some timings are out of range of the Monitor Ranges:
    Horizontal Freq: 31.250 - 199.759 kHz (Monitor: 225.000 - 225.000 kHz)

Failures:

EDID:
  Extension Block 2 started with EDID header, ignoring Extension Blocks >= 2.

EDID conformity: FAIL
