edid-decode (hex):

00 ff ff ff ff ff ff 00 20 a3 88 00 01 00 00 00
00 12 01 03 68 6e 38 78 0a cf 74 a3 57 4c b0 23
09 48 4c 2d 4a 00 81 c0 61 40 01 01 01 01 01 01
01 01 01 01 01 01 64 19 00 40 41 00 26 30 18 88
36 00 c4 8e 21 00 00 1e 1b 21 50 a0 51 00 1e 30
48 88 35 00 44 4a 21 00 00 1c 00 00 00 fc 00 56
47 41 20 20 20 20 0a 20 20 20 20 20 00 00 00 fd
00 31 50 0e 5b 0f 00 0a 20 20 20 20 20 20 01 9b

02 03 1d 72 48 12 02 84 05 10 13 14 1f 23 09 07
07 83 01 00 00 67 03 0c 00 10 00 38 2d 8c 0a d0
8a 20 e0 2d 10 10 3e 96 00 13 8e 21 00 00 18 8c
0a d0 90 20 40 31 20 0c 40 55 00 13 8e 21 00 00
18 01 1d 00 bc 52 d0 1e 20 b8 28 55 40 c4 8e 21
00 00 18 01 1d 00 72 14 ff ff ff ff ff ff ff ff
ff ff ff ff ff ff ff ff ff ff ff ff ff ff ff ff
ff ff ff ff ff ff ff ff ff ff ff ff ff ff ff ff

----------------

Block 0, Base EDID:
  EDID Structure Version & Revision: 1.3
  Vendor & Product Identification:
    Manufacturer: HEC
    Model: 136
    Serial Number: ...
    Made in: 2008
  Basic Display Parameters & Features:
    Analog display
    Signal Level Standard: 0.700 : 0.000 : 0.700 V p-p
    Blank level equals black level
    Sync: Separate
    Maximum image size: 110 cm x 56 cm
    Gamma: 2.20
    RGB color display
    First detailed timing is the preferred timing
  Color Characteristics:
    Red  : 0.6396, 0.3398
    Green: 0.2998, 0.6904
    Blue : 0.1376, 0.0380
    White: 0.2822, 0.2968
  Established Timings I & II:
    DMT 0x04:   640x480    59.940476 Hz   4:3     31.469 kHz     25.175000 MHz
    DMT 0x05:   640x480    72.808802 Hz   4:3     37.861 kHz     31.500000 MHz
    DMT 0x06:   640x480    75.000000 Hz   4:3     37.500 kHz     31.500000 MHz
    DMT 0x09:   800x600    60.316541 Hz   4:3     37.879 kHz     40.000000 MHz
    DMT 0x0b:   800x600    75.000000 Hz   4:3     46.875 kHz     49.500000 MHz
    DMT 0x10:  1024x768    60.003840 Hz   4:3     48.363 kHz     65.000000 MHz
    DMT 0x12:  1024x768    75.028582 Hz   4:3     60.023 kHz     78.750000 MHz
  Standard Timings:
    DMT 0x55:  1280x720    60.000000 Hz  16:9     45.000 kHz     74.250000 MHz
    DMT 0x10:  1024x768    60.003840 Hz   4:3     48.363 kHz     65.000000 MHz
  Detailed Timing Descriptors:
    DTD 1:  1024x768    60.003840 Hz   4:3     48.363 kHz     65.000000 MHz (708 mm x 398 mm)
                 Hfront   24 Hsync 136 Hback  160 Hpol P
                 Vfront    3 Vsync   6 Vback   29 Vpol P
    DTD 2:  1360x768    59.798991 Hz  85:48    47.720 kHz     84.750000 MHz (580 mm x 330 mm)
                 Hfront   72 Hsync 136 Hback  208 Hpol N
                 Vfront    3 Vsync   5 Vback   22 Vpol P
    Display Product Name: 'VGA    '
    Display Range Limits:
      Monitor ranges (GTF): 49-80 Hz V, 14-91 kHz H, max dotclock 150 MHz
  Extension blocks: 1
Checksum: 0x9b

----------------

Block 1, CTA-861 Extension Block:
  Revision: 3
  Basic audio support
  Supports YCbCr 4:4:4
  Supports YCbCr 4:2:2
  Native detailed modes: 2
  Video Data Block:
    VIC  18:   720x576    50.000000 Hz  16:9     31.250 kHz     27.000000 MHz
    VIC   2:   720x480    59.940060 Hz   4:3     31.469 kHz     27.000000 MHz
    VIC   4:  1280x720    60.000000 Hz  16:9     45.000 kHz     74.250000 MHz (native)
    VIC   5:  1920x1080i  60.000000 Hz  16:9     33.750 kHz     74.250000 MHz
    VIC  16:  1920x1080   60.000000 Hz  16:9     67.500 kHz    148.500000 MHz
    VIC  19:  1280x720    50.000000 Hz  16:9     37.500 kHz     74.250000 MHz
    VIC  20:  1920x1080i  50.000000 Hz  16:9     28.125 kHz     74.250000 MHz
    VIC  31:  1920x1080   50.000000 Hz  16:9     56.250 kHz    148.500000 MHz
  Audio Data Block:
    Linear PCM:
      Max channels: 2
      Supported sample rates (kHz): 48 44.1 32
      Supported sample sizes (bits): 24 20 16
  Speaker Allocation Data Block:
    FL/FR - Front Left/Right
  Vendor-Specific Data Block (HDMI), OUI 00-0C-03:
    Source physical address: 1.0.0.0
    DC_36bit
    DC_30bit
    DC_Y444
    Maximum TMDS clock: 225 MHz
  Detailed Timing Descriptors:
    DTD 3:   720x480    59.940060 Hz   3:2     31.469 kHz     27.000000 MHz (531 mm x 398 mm)
                 Hfront   16 Hsync  62 Hback   60 Hpol N
                 Vfront    9 Vsync   6 Vback   30 Vpol N
    DTD 4:   720x576    50.000000 Hz   5:4     31.250 kHz     27.000000 MHz (531 mm x 398 mm)
                 Hfront   12 Hsync  64 Hback   68 Hpol N
                 Vfront    5 Vsync   5 Vback   39 Vpol N
    DTD 5:  1280x720    50.000000 Hz  16:9     37.500 kHz     74.250000 MHz (708 mm x 398 mm)
                 Hfront  440 Hsync  40 Hback  220 Hpol N
                 Vfront    5 Vsync   5 Vback   20 Vpol N
    DTD 6:   256x8190i   6.934964 Hz 128:4095   53.264 kHz     74.250000 MHz (side by side interleaved, 4095 mm x 4095 mm)
                 Hfront 1023 Hsync 1023 Hback -1418 Hpol P Hborder 255
                 Vfront   63 Vsync  63 Vback 3459 Vpol P Vborder 255 Vfront +0.5 Odd Field
                 Vfront   63 Vsync  63 Vback 3459 Vpol P Vborder 255 Vback  +0.5 Even Field
    DTD 7:  4095x8190i  10.418373 Hz   1:2     80.018 kHz    655.350000 MHz (side by side interleaved, 4095 mm x 4095 mm)
                 Hfront 1023 Hsync 1023 Hback 1539 Hpol P Hborder 255
                 Vfront   63 Vsync  63 Vback 3459 Vpol P Vborder 255 Vfront +0.5 Odd Field
                 Vfront   63 Vsync  63 Vback 3459 Vpol P Vborder 255 Vback  +0.5 Even Field
Checksum: 0xff (should be 0xc4)  Unused space in Extension Block: 8 bytes

----------------

Warnings:

Block 0, Base EDID:
  Vendor & Product Identification: The serial number is one of the known dummy values, it should probably be set to 0.
  Detailed Timing Descriptor #1: DTD is similar but not identical to DMT 0x10.
  Detailed Timing Descriptor #1: Image size is 708x398 mm, but based on the picture AR it should be 708x531 mm.
Block 1, CTA-861 Extension Block:
  IT Video Formats are overscanned by default, but normally this should be underscanned.
  Video Data Block: VIC 18 and the first DTD are not identical. Is this intended?
  Detailed Timing Descriptor #3: Image size is 531x398 mm, but based on the picture AR it should be 531x354 mm.
  Detailed Timing Descriptor #4: Image size is 531x398 mm, but based on the picture AR it should be 531x424 mm.
  Detailed Timing Descriptor #5: DTD is similar but not identical to VIC 19.
  Detailed Timing Descriptor #6: Image size is 4095x4095 mm, but based on the picture AR it should be 4095x131008 mm.
  Detailed Timing Descriptor #6: The use of non-zero borders in a DTD is not recommended.
  Detailed Timing Descriptor #7: Image size is 4095x4095 mm, but based on the picture AR it should be 4095x8190 mm.
  Detailed Timing Descriptor #7: The use of non-zero borders in a DTD is not recommended.
  Add a Colorimetry Data Block with the sRGB colorimetry bit set to avoid interop issues.
EDID:
  Base EDID: Some timings are out of range of the Monitor Ranges:
    Vertical Freq: 6.935 - 75.029 Hz (Monitor: 49.000 - 80.000 Hz)
    Maximum Clock: 655.350 MHz (Monitor: 150.000 MHz)

Failures:

Block 0, Base EDID:
  Detailed Timing Descriptor #1: Mismatch of image size 708x398 mm vs display size 1100x560 mm.
  Detailed Timing Descriptor #2: Mismatch of image size 580x330 mm vs display size 1100x560 mm.
  Display Product Name: One or more trailing spaces before newline.
Block 1, CTA-861 Extension Block:
  Detailed Timing Descriptor #3: Mismatch of image size 531x398 mm vs display size 1100x560 mm.
  Detailed Timing Descriptor #4: Mismatch of image size 531x398 mm vs display size 1100x560 mm.
  Detailed Timing Descriptor #5: Mismatch of image size 708x398 mm vs display size 1100x560 mm.
  Detailed Timing Descriptor #6: 0 or negative horizontal back porch.
  Detailed Timing Descriptor #6: Mismatch of image size 4095x4095 mm vs display size 1100x560 mm.
  Detailed Timing Descriptor #7: Mismatch of image size 4095x4095 mm vs display size 1100x560 mm.
  Padding: Contains non-zero bytes.
  Missing VCDB, needed for Set Selectable RGB Quantization to avoid interop issues.
  Invalid checksum 0xff (should be 0xc4).
EDID:
  Base EDID: The DTD max image size is 4095x4095mm, which is larger than the display size 1100.0x560.0mm.
  CTA-861: The maximum HDMI TMDS clock is 225000 kHz, but one or more video timings go up to 655350 kHz.
  CTA-861: Native progressive timings are a mix of several resolutions.

EDID conformity: FAIL
