edid-decode (hex):

00 ff ff ff ff ff ff 00 09 e5 13 0b 00 00 00 00
10 20 01 04 a5 1e 13 78 07 d8 55 a3 51 4d 9b 26
0e 50 54 00 00 00 01 01 01 01 01 01 01 01 01 01
01 01 01 01 01 01 74 3c 80 a0 70 b0 28 40 30 20
36 00 2e bc 10 00 00 1a 5d 30 80 a0 70 b0 28 40
30 20 36 00 2e bc 10 00 00 1a 00 00 00 fe 00 47
4e 33 43 50 80 4e 56 31 34 54 30 33 00 00 00 00
00 02 41 31 9e 00 00 00 00 0a 01 0a 20 20 00 be

00 ff ff ff ff ff ff 00 09 e5 13 0b 00 00 00 00
10 20 01 04 a5 1e 13 78 07 d8 55 a3 51 4d 9b 26
0e 50 54 00 00 00 01 01 01 01 01 01 01 01 01 01
01 01 01 01 01 01 74 3c 80 a0 70 b0 28 40 30 20
36 00 2e bc 10 00 00 1a 5d 30 80 a0 70 b0 28 40
30 20 36 00 2e bc 10 00 00 1a 00 00 00 fe 00 47
4e 33 43 50 80 4e 56 31 34 54 30 33 00 00 00 00
00 02 41 31 9e 00 00 00 00 0a 01 0a 20 20 00 be

----------------

Block 0, Base EDID:
  EDID Structure Version & Revision: 1.4
  Vendor & Product Identification:
    Manufacturer: BOE
    Model: 2835
    Made in: week 16 of 2022
  Basic Display Parameters & Features:
    Digital display
    Bits per primary color channel: 8
    DisplayPort interface
    Maximum image size: 30 cm x 19 cm
    Gamma: 2.20
    Supported color formats: RGB 4:4:4
    Default (sRGB) color space is primary color space
    First detailed timing includes the native pixel format and preferred refresh rate
    Display supports continuous frequencies
  Color Characteristics:
    Red  : 0.6396, 0.3173
    Green: 0.3027, 0.6054
    Blue : 0.1494, 0.0556
    White: 0.3134, 0.3291
  Established Timings I & II: none
  Standard Timings: none
  Detailed Timing Descriptors:
    DTD 1:  1920x1200   60.003102 Hz  16:10    74.404 kHz    154.760000 MHz (302 mm x 188 mm)
                 Hfront   48 Hsync  32 Hback   80 Hpol P
                 Vfront    3 Vsync   6 Vback   31 Vpol N
    DTD 2:  1920x1200   48.003257 Hz  16:10    59.524 kHz    123.810000 MHz (302 mm x 188 mm)
                 Hfront   48 Hsync  32 Hback   80 Hpol P
                 Vfront    3 Vsync   6 Vback   31 Vpol N
    Alphanumeric Data String: 'GN3CP.NV14T03'
    Manufacturer-Specified Display Descriptor (0x00): 00 00 00 02 41 31 9e 00 00 00 00 0a 01 0a 20 20 '....A1........  '
Checksum: 0xbe

----------------

Block 1, Unknown EDID Extension Block 0x00:
  00 ff ff ff ff ff ff 00 09 e5 13 0b 00 00 00 00 '................'
  10 20 01 04 a5 1e 13 78 07 d8 55 a3 51 4d 9b 26 '. .....x..U.QM.&'
  0e 50 54 00 00 00 01 01 01 01 01 01 01 01 01 01 '.PT.............'
  01 01 01 01 01 01 74 3c 80 a0 70 b0 28 40 30 20 '......t<..p.(@0 '
  36 00 2e bc 10 00 00 1a 5d 30 80 a0 70 b0 28 40 '6.......]0..p.(@'
  30 20 36 00 2e bc 10 00 00 1a 00 00 00 fe 00 47 '0 6............G'
  4e 33 43 50 80 4e 56 31 34 54 30 33 00 00 00 00 'N3CP.NV14T03....'
  00 02 41 31 9e 00 00 00 00 0a 01 0a 20 20 00 be '..A1........  ..'
Checksum: 0xbe

----------------

Warnings:

Block 0, Base EDID:
  Alphanumeric Data String: Non-ASCII character 0x80 at position 5, can cause problems.
  Missing Display Product Name.

Failures:

Block 0, Base EDID:
  Basic Display Parameters & Features: sRGB is signaled, but the chromaticities do not match.
  Missing Display Range Limits Descriptor.
Block 1, Base EDID:
  Unknown Extension Block.
EDID:
  Base EDID: EDID specified 0 extension block(s), but found 1 extension block(s).

EDID conformity: FAIL
