edid-decode (hex):

00 ff ff ff ff ff ff 00 4c f4 25 25 00 00 00 00
30 1e 01 03 00 38 1e 78 ea d7 a5 a2 59 4a 96 24
14 50 54 ad cf 00 31 4a 45 4a 61 4c 81 c0 81 80
81 8f a9 c0 d1 c0 02 3a 80 18 71 38 2d 40 58 2c
45 00 09 35 21 00 00 1e 2a 44 80 a0 70 38 27 40
58 2c 45 00 09 35 21 00 00 1a 45 36 00 c0 51 00
30 40 58 88 37 00 09 35 21 00 00 1a 00 00 00 fc
00 56 47 41 0a 20 20 20 20 20 20 20 20 20 00 21

00 ff ff ff ff ff ff 00 4c f4 25 25 00 00 00 00
30 1e 01 03 00 38 1e 78 ea d7 a5 a2 59 4a 96 24
14 50 54 ad cf 00 31 4a 45 4a 61 4c 81 c0 81 80
81 8f a9 c0 d1 c0 02 3a 80 18 71 38 2d 40 58 2c
45 00 09 35 21 00 00 1e 2a 44 80 a0 70 38 27 40
58 2c 45 00 09 35 21 00 00 1a 45 36 00 c0 51 00
30 40 58 88 37 00 09 35 21 00 00 1a 00 00 00 fc
00 56 47 41 0a 20 20 20 20 20 20 20 20 20 00 21

----------------

Block 0, Base EDID:
  EDID Structure Version & Revision: 1.3
  Vendor & Product Identification:
    Manufacturer: SGT
    Model: 9509
    Made in: week 48 of 2020
  Basic Display Parameters & Features:
    Analog display
    Signal Level Standard: 0.700 : 0.300 : 1.000 V p-p
    Blank level equals black level
    Maximum image size: 56 cm x 30 cm
    Gamma: 2.20
    DPMS levels: Standby Suspend Off
    RGB color display
    First detailed timing is the preferred timing
  Color Characteristics:
    Red  : 0.6357, 0.3486
    Green: 0.2900, 0.5888
    Blue : 0.1425, 0.0800
    White: 0.3134, 0.3291
  Established Timings I & II:
    IBM     :   720x400    70.081663 Hz   9:5     31.467 kHz     28.320000 MHz
    DMT 0x04:   640x480    59.940476 Hz   4:3     31.469 kHz     25.175000 MHz
    DMT 0x05:   640x480    72.808802 Hz   4:3     37.861 kHz     31.500000 MHz
    DMT 0x06:   640x480    75.000000 Hz   4:3     37.500 kHz     31.500000 MHz
    DMT 0x09:   800x600    60.316541 Hz   4:3     37.879 kHz     40.000000 MHz
    DMT 0x0a:   800x600    72.187572 Hz   4:3     48.077 kHz     50.000000 MHz
    DMT 0x0b:   800x600    75.000000 Hz   4:3     46.875 kHz     49.500000 MHz
    DMT 0x10:  1024x768    60.003840 Hz   4:3     48.363 kHz     65.000000 MHz
    DMT 0x11:  1024x768    70.069359 Hz   4:3     56.476 kHz     75.000000 MHz
    DMT 0x12:  1024x768    75.028582 Hz   4:3     60.023 kHz     78.750000 MHz
    DMT 0x24:  1280x1024   75.024675 Hz   5:4     79.976 kHz    135.000000 MHz
  Standard Timings:
    GTF     :   640x480    70.000000 Hz   4:3     35.000 kHz     28.560000 MHz
    GTF     :   800x600    70.000000 Hz   4:3     43.750 kHz     45.500000 MHz
    GTF     :  1024x768    72.000073 Hz   4:3     57.672 kHz     78.434000 MHz
    DMT 0x55:  1280x720    60.000000 Hz  16:9     45.000 kHz     74.250000 MHz
    DMT 0x23:  1280x1024   60.019740 Hz   5:4     63.981 kHz    108.000000 MHz
    DMT 0x24:  1280x1024   75.024675 Hz   5:4     79.976 kHz    135.000000 MHz
    DMT 0x53:  1600x900    60.000000 Hz  16:9     60.000 kHz    108.000000 MHz (RB)
    DMT 0x52:  1920x1080   60.000000 Hz  16:9     67.500 kHz    148.500000 MHz
  Detailed Timing Descriptors:
    DTD 1:  1920x1080   60.000000 Hz  16:9     67.500 kHz    148.500000 MHz (521 mm x 309 mm)
                 Hfront   88 Hsync  44 Hback  148 Hpol P
                 Vfront    4 Vsync   5 Vback   36 Vpol P
    DTD 2:  1920x1080   74.972503 Hz  16:9     83.894 kHz    174.500000 MHz (521 mm x 309 mm)
                 Hfront   88 Hsync  44 Hback   28 Hpol P
                 Vfront    4 Vsync   5 Vback   30 Vpol N
    DTD 3:  1280x1024   74.999352 Hz   5:4     80.399 kHz    138.930000 MHz (521 mm x 309 mm)
                 Hfront   88 Hsync 136 Hback  224 Hpol P
                 Vfront    3 Vsync   7 Vback   38 Vpol N
    Display Product Name: 'VGA'
Checksum: 0x21

----------------

Warnings:

Block 0, Base EDID:
  Detailed Timing Descriptor #1: Image size is 521x309 mm, but based on the picture AR it should be 521x293 mm.
  Detailed Timing Descriptor #2: Image size is 521x309 mm, but based on the picture AR it should be 521x293 mm.
  Detailed Timing Descriptor #3: Image size is 521x309 mm, but based on the picture AR it should be 386x309 mm.

Failures:

Block 0, Base EDID:
  Missing Display Range Limits Descriptor.
EDID:
  Extension Block 1 started with EDID header, ignoring Extension Blocks >= 1.

EDID conformity: FAIL
