edid-decode (hex):

00 ff ff ff ff ff ff 00 14 73 86 24 22 04 16 20
08 17 01 04 a5 34 1e 78 e2 35 85 a6 56 48 9a 24
12 50 54 00 00 00 01 01 01 01 01 01 01 01 01 01
01 01 01 01 01 01 02 3a 80 18 71 38 2d 40 58 2c
45 00 08 2c 21 00 00 1e 00 00 00 fd 00 3c 46 1e
53 10 00 0a 20 20 20 20 20 20 00 00 00 fc 00 41
49 4f 20 50 43 0a 20 20 20 20 20 20 00 00 00 ff
00 30 30 30 30 31 0a 20 20 20 20 20 20 20 00 66

----------------

Block 0, Base EDID:
  EDID Structure Version & Revision: 1.4
  Vendor & Product Identification:
    Manufacturer: ECS
    Model: 9350
    Serial Number: ...
    Made in: week 8 of 2013
  Basic Display Parameters & Features:
    Digital display
    Bits per primary color channel: 8
    DisplayPort interface
    Maximum image size: 52 cm x 30 cm
    Gamma: 2.20
    DPMS levels: Standby Suspend Off
    Supported color formats: RGB 4:4:4
    First detailed timing includes the native pixel format and preferred refresh rate
  Color Characteristics:
    Red  : 0.6484, 0.3388
    Green: 0.2822, 0.6025
    Blue : 0.1425, 0.0703
    White: 0.3134, 0.3291
  Established Timings I & II: none
  Standard Timings: none
  Detailed Timing Descriptors:
    DTD 1:  1920x1080   60.000000 Hz  16:9     67.500 kHz    148.500000 MHz (520 mm x 300 mm)
                 Hfront   88 Hsync  44 Hback  148 Hpol P
                 Vfront    4 Vsync   5 Vback   36 Vpol P
    Display Range Limits:
      Monitor ranges (GTF): 60-70 Hz V, 30-83 kHz H, max dotclock 160 MHz
    Display Product Name: 'AIO PC'
    Display Product Serial Number: ...
Checksum: 0x66

----------------

Warnings:

Block 0, Base EDID:
  Display Range Limits: GTF support is deprecated in EDID 1.4.
  Display Product Serial Number: ...

Failures:

Block 0, Base EDID:
  Display Range Limits: GTF is supported, but the display does not support continuous frequencies.

EDID conformity: FAIL
