edid-decode (hex):

00 ff ff ff ff ff ff 00 31 ee 3b 2a 01 01 01 01
1c 20 01 03 80 14 0e 78 ea 1e c5 ae 4f 34 b1 26
0e 50 54 00 00 00 01 01 01 01 01 01 01 01 01 01
01 01 01 01 01 01 34 11 00 a0 40 58 14 20 30 20
a3 00 55 50 21 00 00 1e 00 00 00 ff 00 4a 32 35
37 4d 39 36 42 30 30 46 4c 0a 00 00 00 fc 00 4c
6f 6e 74 69 75 6d 0a 20 20 20 20 20 00 00 00 fd
00 38 4c 1e 51 11 00 0a 20 20 20 20 20 20 01 ca

02 03 18 f1 23 09 07 07 67 03 0c 00 10 00 38 2d
83 01 00 00 e3 05 03 01 19 05 e0 a0 10 40 14 10
30 20 a3 00 43 50 21 00 00 ff 00 00 00 00 00 00
00 00 00 00 00 00 00 00 00 00 00 00 00 00 00 00
00 00 00 00 00 00 00 00 00 00 00 00 00 00 00 00
00 00 00 00 00 00 00 00 00 00 00 00 00 00 00 00
00 00 00 00 00 00 00 00 00 00 00 00 00 00 00 00
00 00 00 00 00 00 00 00 00 00 00 00 00 00 00 a5

00 ff ff ff ff ff ff 00 31 ee 3b 2a 01 01 01 01
1c 20 01 03 80 14 0e 78 ea 1e c5 ae 4f 34 b1 26
0e 50 54 00 00 00 01 01 01 01 01 01 01 01 01 01
01 01 01 01 01 01 34 11 00 a0 40 58 14 20 30 20
a3 00 55 50 21 00 00 1e 00 00 00 ff 00 4a 32 35
37 4d 39 36 42 30 30 46 4c 0a 00 00 00 fc 00 4c
6f 6e 74 69 75 6d 0a 20 20 20 20 20 00 00 00 fd
00 38 4c 1e 51 11 00 0a 20 20 20 20 20 20 01 ca

02 03 18 f1 23 09 07 07 67 03 0c 00 10 00 38 2d
83 01 00 00 e3 05 03 01 19 05 e0 a0 10 40 14 10
30 20 a3 00 43 50 21 00 00 ff 00 00 00 00 00 00
00 00 00 00 00 00 00 00 00 00 00 00 00 00 00 00
00 00 00 00 00 00 00 00 00 00 00 00 00 00 00 00
00 00 00 00 00 00 00 00 00 00 00 00 00 00 00 00
00 00 00 00 00 00 00 00 00 00 00 00 00 00 00 00
00 00 00 00 00 00 00 00 00 00 00 00 00 00 00 a5

----------------

Block 0, Base EDID:
  EDID Structure Version & Revision: 1.3
  Vendor & Product Identification:
    Manufacturer: LON
    Model: 10811
    Serial Number: ...
    Made in: week 28 of 2022
  Basic Display Parameters & Features:
    Digital display
    Maximum image size: 20 cm x 14 cm
    Gamma: 2.20
    DPMS levels: Standby Suspend Off
    RGB color display
    First detailed timing is the preferred timing
  Color Characteristics:
    Red  : 0.6796, 0.3095
    Green: 0.2060, 0.6933
    Blue : 0.1513, 0.0546
    White: 0.3134, 0.3291
  Established Timings I & II: none
  Standard Timings: none
  Detailed Timing Descriptors:
    DTD 1:  1024x600    59.993461 Hz 128:75    37.196 kHz     44.040000 MHz (597 mm x 336 mm)
                 Hfront   48 Hsync  32 Hback   80 Hpol P
                 Vfront   10 Vsync   3 Vback    7 Vpol P
    Display Product Serial Number: ...
    Display Product Name: 'Lontium'
    Display Range Limits:
      Monitor ranges (GTF): 56-76 Hz V, 30-81 kHz H, max dotclock 170 MHz
  Extension blocks: 1
Checksum: 0xca

----------------

Block 1, CTA-861 Extension Block:
  Revision: 3
  Underscans IT Video Formats by default
  Basic audio support
  Supports YCbCr 4:4:4
  Supports YCbCr 4:2:2
  Native detailed modes: 1
  Audio Data Block:
    Linear PCM:
      Max channels: 2
      Supported sample rates (kHz): 48 44.1 32
      Supported sample sizes (bits): 24 20 16
  Vendor-Specific Data Block (HDMI), OUI 00-0C-03:
    Source physical address: 1.0.0.0
    DC_36bit
    DC_30bit
    DC_Y444
    Maximum TMDS clock: 225 MHz
  Speaker Allocation Data Block:
    FL/FR - Front Left/Right
  Colorimetry Data Block:
    xvYCC601
    xvYCC709
    Gamut Boundary Description Metadata Profile P0
  Detailed Timing Descriptors:
    DTD 2:   480x640i   59.884361 Hz   3:4     20.391 kHz     13.050000 MHz (side by side interleaved, 579 mm x 336 mm)
                 Hfront   48 Hsync  32 Hback   80 Hpol P
                 Vfront   10 Vsync   3 Vback    7 Vpol P Vfront +0.5 Odd Field
                 Vfront   10 Vsync   3 Vback    7 Vpol P Vback  +0.5 Even Field
Checksum: 0xa5  Unused space in Extension Block: 85 bytes

----------------

Block 2, Unknown EDID Extension Block 0x00:
  00 ff ff ff ff ff ff 00 31 ee 3b 2a 01 01 01 01 '........1.;*....'
  1c 20 01 03 80 14 0e 78 ea 1e c5 ae 4f 34 b1 26 '. .....x....O4.&'
  0e 50 54 00 00 00 01 01 01 01 01 01 01 01 01 01 '.PT.............'
  01 01 01 01 01 01 34 11 00 a0 40 58 14 20 30 20 '......4...@X. 0 '
  a3 00 55 50 21 00 00 1e 00 00 00 ff 00 4a 32 35 '..UP!........J25'
  37 4d 39 36 42 30 30 46 4c 0a 00 00 00 fc 00 4c '7M96B00FL......L'
  6f 6e 74 69 75 6d 0a 20 20 20 20 20 00 00 00 fd 'ontium.     ....'
  00 38 4c 1e 51 11 00 0a 20 20 20 20 20 20 01 ca '.8L.Q...      ..'
Checksum: 0xca

----------------

Block 3, CTA-861 Extension Block:
  Revision: 3
  Underscans IT Video Formats by default
  Basic audio support
  Supports YCbCr 4:4:4
  Supports YCbCr 4:2:2
  Native detailed modes: 1
  Audio Data Block:
    Linear PCM:
      Max channels: 2
      Supported sample rates (kHz): 48 44.1 32
      Supported sample sizes (bits): 24 20 16
  Vendor-Specific Data Block (HDMI), OUI 00-0C-03:
    Source physical address: 1.0.0.0
    DC_36bit
    DC_30bit
    DC_Y444
    Maximum TMDS clock: 225 MHz
  Speaker Allocation Data Block:
    FL/FR - Front Left/Right
  Colorimetry Data Block:
    xvYCC601
    xvYCC709
    Gamut Boundary Description Metadata Profile P0
  Detailed Timing Descriptors:
    DTD 3:   480x640i   59.884361 Hz   3:4     20.391 kHz     13.050000 MHz (side by side interleaved, 579 mm x 336 mm)
                 Hfront   48 Hsync  32 Hback   80 Hpol P
                 Vfront   10 Vsync   3 Vback    7 Vpol P Vfront +0.5 Odd Field
                 Vfront   10 Vsync   3 Vback    7 Vpol P Vback  +0.5 Even Field
Checksum: 0xa5  Unused space in Extension Block: 85 bytes

----------------

Warnings:

Block 0, Base EDID:
  Vendor & Product Identification: The serial number is one of the known dummy values, it should probably be set to 0.
  Detailed Timing Descriptor #1: Image size is 597x336 mm, but based on the picture AR it should be 597x349 mm.
Block 1, CTA-861 Extension Block:
  Colorimetry Data Block: Set the sRGB colorimetry bit to avoid interop issues.
  Detailed Timing Descriptor #2: Image size is 579x336 mm, but based on the picture AR it should be 579x772 mm.
  Display Product Serial Number is set, so the Serial Number in the Base EDID should be 0.
Block 3, CTA-861 Extension Block:
  Colorimetry Data Block: Set the sRGB colorimetry bit to avoid interop issues.
  Detailed Timing Descriptor #3: Image size is 579x336 mm, but based on the picture AR it should be 579x772 mm.
EDID:
  Base EDID: Some timings are out of range of the Monitor Ranges:
    Horizontal Freq: 20.390 - 37.195 kHz (Monitor: 30.000 - 81.000 kHz)

Failures:

Block 0, Base EDID:
  Detailed Timing Descriptor #1: Mismatch of image size 597x336 mm vs display size 200x140 mm.
Block 1, CTA-861 Extension Block:
  Detailed Timing Descriptor #2: Mismatch of image size 579x336 mm vs display size 200x140 mm.
  Required 640x480p60 timings are missing in the established timings and the SVD list (VIC 1).
  Missing VCDB, needed for Set Selectable RGB Quantization to avoid interop issues.
Block 2, Base EDID:
  Unknown Extension Block.
Block 3, CTA-861 Extension Block:
  Speaker Allocation Data Block: Only one instance of this Data Block is allowed.
  Colorimetry Data Block: Only one instance of this Data Block is allowed.
  Detailed Timing Descriptor #3: Mismatch of image size 579x336 mm vs display size 200x140 mm.
EDID:
  Base EDID: The DTD max image size is 597x336mm, which is larger than the display size 200.0x140.0mm.
  Base EDID: EDID specified 1 extension block(s), but found 3 extension block(s).
  Base EDID: EDID 1.3 requires a Block Map Extension in Block 1 if there are more than 2 blocks in the EDID.

EDID conformity: FAIL
