edid-decode (hex):

00 ff ff ff ff ff ff 00 06 af ad 5e 00 00 00 00
4c 21 01 04 a5 22 16 78 03 aa 35 94 59 59 94 29
1e 50 54 00 00 00 01 01 01 01 01 01 01 01 01 01
01 01 01 01 01 01 c3 3d 80 c8 70 b0 2b 40 6c 30
aa 00 58 d7 10 00 00 18 2d 29 80 c8 70 b0 2b 40
6c 30 aa 00 58 d7 10 00 00 18 00 00 00 00 00 00
00 00 00 00 00 00 00 00 00 00 00 00 00 00 00 02
00 10 3c ff 0f 3c 96 70 12 2d 96 20 20 20 01 be

70 20 79 02 00 22 00 14 9d 69 02 85 7f 07 c7 00
6b 80 2f 00 af 04 2a 00 09 00 09 00 25 01 09 9d
69 02 9d 69 02 28 3c 80 81 00 10 6f 1a 00 00 03
01 28 3c 00 00 53 11 53 11 3c 00 00 00 00 00 00
00 00 00 00 00 00 00 00 00 00 00 00 00 00 00 00
00 00 00 00 00 00 00 00 00 00 00 00 00 00 00 00
00 00 00 00 00 00 00 00 00 00 00 00 00 00 00 00
00 00 00 00 00 00 00 00 00 00 00 00 00 00 a3 90

00 ff ff ff ff ff ff 00 06 af ad 5e 00 00 00 00
4c 21 01 04 a5 22 16 78 03 aa 35 94 59 59 94 29
1e 50 54 00 00 00 01 01 01 01 01 01 01 01 01 01
01 01 01 01 01 01 c3 3d 80 c8 70 b0 2b 40 6c 30
aa 00 58 d7 10 00 00 18 2d 29 80 c8 70 b0 2b 40
6c 30 aa 00 58 d7 10 00 00 18 00 00 00 00 00 00
00 00 00 00 00 00 00 00 00 00 00 00 00 00 00 02
00 10 3c ff 0f 3c 96 70 12 2d 96 20 20 20 01 be

70 20 79 02 00 22 00 14 9d 69 02 85 7f 07 c7 00
6b 80 2f 00 af 04 2a 00 09 00 09 00 25 01 09 9d
69 02 9d 69 02 28 3c 80 81 00 10 6f 1a 00 00 03
01 28 3c 00 00 53 11 53 11 3c 00 00 00 00 00 00
00 00 00 00 00 00 00 00 00 00 00 00 00 00 00 00
00 00 00 00 00 00 00 00 00 00 00 00 00 00 00 00
00 00 00 00 00 00 00 00 00 00 00 00 00 00 00 00
00 00 00 00 00 00 00 00 00 00 00 00 00 00 a3 90

----------------

Block 0, Base EDID:
  EDID Structure Version & Revision: 1.4
  Vendor & Product Identification:
    Manufacturer: AUO
    Model: 24237
    Made in: week 76 of 2023
  Basic Display Parameters & Features:
    Digital display
    Bits per primary color channel: 8
    DisplayPort interface
    Maximum image size: 34 cm x 22 cm
    Gamma: 2.20
    Supported color formats: RGB 4:4:4
    First detailed timing includes the native pixel format and preferred refresh rate
    Display supports continuous frequencies
  Color Characteristics:
    Red  : 0.5800, 0.3496
    Green: 0.3496, 0.5800
    Blue : 0.1601, 0.1201
    White: 0.3134, 0.3291
  Established Timings I & II: none
  Standard Timings: none
  Detailed Timing Descriptors:
    DTD 1:  1920x1200   60.000152 Hz  16:10    74.580 kHz    158.110000 MHz (344 mm x 215 mm)
                 Hfront  108 Hsync  48 Hback   44 Hpol N
                 Vfront   10 Vsync  10 Vback   23 Vpol N
    DTD 2:  1920x1200   40.001366 Hz  16:10    49.722 kHz    105.410000 MHz (344 mm x 215 mm)
                 Hfront  108 Hsync  48 Hback   44 Hpol N
                 Vfront   10 Vsync  10 Vback   23 Vpol N
    Empty Descriptor
    Manufacturer-Specified Display Descriptor (0x02): 00 02 00 10 3c ff 0f 3c 96 70 12 2d 96 20 20 20 '....<..<.p.-.   '
  Extension blocks: 1
Checksum: 0xbe

----------------

Block 1, DisplayID Extension Block:
  Version: 2.0
  Extension Count: 0
  Display Product Primary Use Case: None of the listed primary use cases; generic display
  Video Timing Modes Type 7 - Detailed Timings Data Block:
    DTD:  1920x1200   60.000152 Hz  16:10    74.580 kHz    158.110000 MHz (aspect 16:10, no 3D stereo, preferred)
               Hfront  108 Hsync  48 Hback   44 Hpol P
               Vfront   10 Vsync  10 Vback   23 Vpol N
  Dynamic Video Timing Range Limits Data Block:
    Minimum Pixel Clock: 158110 kHz
    Maximum Pixel Clock: 158110 kHz
    Minimum Vertical Refresh Rate: 40 Hz
    Maximum Vertical Refresh Rate: 60 Hz
    Seamless Dynamic Video Timing Support: Yes
  CTA-861 DisplayID Data Block:
  Vendor-Specific Data Block (AMD), OUI 00-00-1A:
    Version: 3
    Feature Caps: 0x01
    Minimum Refresh Rate: 40 Hz
    Maximum Refresh Rate: 60 Hz
    Flags 1.x: 0x00
    Flags 2.x: 0x00
  Checksum: 0xa3
Checksum: 0x90

----------------

Warnings:

Block 0, Base EDID:
  Missing Display Product Name.

Failures:

Block 0, Base EDID:
  Vendor & Product Identification: Invalid week of manufacture (> 54).
  Empty Descriptor: Use Dummy Descriptor instead of all zeroes.
  Missing Display Range Limits Descriptor.
EDID:
  Extension Block 2 started with EDID header, ignoring Extension Blocks >= 2.
  DisplayID: Missing DisplayID Display Parameters Data Block.

EDID conformity: FAIL
