edid-decode (hex):

00 ff ff ff ff ff ff 00 34 38 75 07 dc 1a 06 00
05 0f 01 03 a0 26 1e 96 20 67 55 a5 5b 47 9c 25
1e 4f 54 af cf 00 01 01 01 01 61 4c 81 80 01 01
01 01 01 01 01 01 d6 09 80 a0 20 5e 63 10 30 60
02 00 78 2d 11 00 00 1e 00 00 00 ff 00 35 30 35
41 41 30 33 34 30 30 30 39 32 00 00 00 fc 00 31
30 31 39 30 35 0a 20 20 20 20 20 20 00 00 00 fd
00 38 4b 1f 53 0e 00 0a 20 20 20 20 20 20 01 ef

02 03 1b 41 23 09 07 07 83 01 00 00 67 03 0c 00
20 00 00 21 43 10 04 03 e2 00 0f 8c 0a d0 8a 20
e0 2d 10 10 3e 96 00 a0 5a 00 00 00 00 00 00 00
00 00 00 00 00 00 00 00 00 00 00 00 00 00 00 00
00 00 00 00 00 00 00 00 00 00 00 00 00 00 00 00
00 00 00 00 00 00 00 00 00 00 00 00 00 00 00 00
00 00 00 00 00 00 00 00 00 00 00 00 00 00 00 00
00 00 00 00 00 00 00 00 00 00 00 00 00 00 00 d4

00 ff ff ff ff ff ff 00 34 38 75 07 dc 1a 06 00
05 0f 01 03 a0 26 1e 96 20 67 55 a5 5b 47 9c 25
1e 4f 54 af cf 00 01 01 01 01 61 4c 81 80 01 01
01 01 01 01 01 01 d6 09 80 a0 20 5e 63 10 30 60
02 00 78 2d 11 00 00 1e 00 00 00 ff 00 35 30 35
41 41 30 33 34 30 30 30 39 32 00 00 00 fc 00 31
30 31 39 30 35 0a 20 20 20 20 20 20 00 00 00 fd
00 38 4b 1f 53 0e 00 0a 20 20 20 20 20 20 01 ef

02 03 1b 41 23 09 07 07 83 01 00 00 67 03 0c 00
20 00 00 21 43 10 04 03 e2 00 0f 8c 0a d0 8a 20
e0 2d 10 10 3e 96 00 a0 5a 00 00 00 00 00 00 00
00 00 00 00 00 00 00 00 00 00 00 00 00 00 00 00
00 00 00 00 00 00 00 00 00 00 00 00 00 00 00 00
00 00 00 00 00 00 00 00 00 00 00 00 00 00 00 00
00 00 00 00 00 00 00 00 00 00 00 00 00 00 00 00
00 00 00 00 00 00 00 00 00 00 00 00 00 00 00 d4

----------------

Block 0, Base EDID:
  EDID Structure Version & Revision: 1.3
  Vendor & Product Identification:
    Manufacturer: MAX
    Model: 1909
    Serial Number: ...
    Made in: week 5 of 2005
  Basic Display Parameters & Features:
    Digital display
    Maximum image size: 38 cm x 30 cm
    Gamma: 2.50
    DPMS levels: Off
    Monochrome or grayscale display
  Color Characteristics:
    Red  : 0.6455, 0.3574
    Green: 0.2783, 0.6123
    Blue : 0.1455, 0.1181
    White: 0.3095, 0.3291
  Established Timings I & II:
    IBM     :   720x400    70.081663 Hz   9:5     31.467 kHz     28.320000 MHz
    DMT 0x04:   640x480    59.940476 Hz   4:3     31.469 kHz     25.175000 MHz
    DMT 0x05:   640x480    72.808802 Hz   4:3     37.861 kHz     31.500000 MHz
    DMT 0x06:   640x480    75.000000 Hz   4:3     37.500 kHz     31.500000 MHz
    DMT 0x08:   800x600    56.250000 Hz   4:3     35.156 kHz     36.000000 MHz
    DMT 0x09:   800x600    60.316541 Hz   4:3     37.879 kHz     40.000000 MHz
    DMT 0x0a:   800x600    72.187572 Hz   4:3     48.077 kHz     50.000000 MHz
    DMT 0x0b:   800x600    75.000000 Hz   4:3     46.875 kHz     49.500000 MHz
    DMT 0x10:  1024x768    60.003840 Hz   4:3     48.363 kHz     65.000000 MHz
    DMT 0x11:  1024x768    70.069359 Hz   4:3     56.476 kHz     75.000000 MHz
    DMT 0x12:  1024x768    75.028582 Hz   4:3     60.023 kHz     78.750000 MHz
    DMT 0x24:  1280x1024   75.024675 Hz   5:4     79.976 kHz    135.000000 MHz
  Standard Timings:
    DMT 0x11:  1024x768    70.069359 Hz   4:3     56.476 kHz     75.000000 MHz
    DMT 0x23:  1280x1024   60.019740 Hz   5:4     63.981 kHz    108.000000 MHz
  Detailed Timing Descriptors:
    DTD 1:   640x350    70.100223 Hz  64:35    31.475 kHz     25.180000 MHz (376 mm x 301 mm)
                 Hfront   48 Hsync  96 Hback   16 Hpol P
                 Vfront    0 Vsync   2 Vback   97 Vpol P
                   d6 09 80 a0 20 5e 63 10 30 60 02 00 78 2d 11 00 00 1e '.... ^c.0`..x-....'
    Display Product Serial Number: ...
    Display Product Name: '101905'
    Display Range Limits:
      Monitor ranges (GTF): 56-75 Hz V, 31-83 kHz H, max dotclock 140 MHz
  Extension blocks: 1
Checksum: 0xef

----------------

Block 1, CTA-861 Extension Block:
  Revision: 3
  Basic audio support
  Native detailed modes: 1
  Audio Data Block:
    Linear PCM:
      Max channels: 2
      Supported sample rates (kHz): 48 44.1 32
      Supported sample sizes (bits): 24 20 16
  Speaker Allocation Data Block:
    FL/FR - Front Left/Right
  Vendor-Specific Data Block (HDMI), OUI 00-0C-03:
    Source physical address: 2.0.0.0
    Maximum TMDS clock: 165 MHz
  Video Data Block:
    VIC  16:  1920x1080   60.000000 Hz  16:9     67.500 kHz    148.500000 MHz
    VIC   4:  1280x720    60.000000 Hz  16:9     45.000 kHz     74.250000 MHz
    VIC   3:   720x480    59.940060 Hz  16:9     31.469 kHz     27.000000 MHz
  Video Capability Data Block:
    YCbCr quantization: No Data
    RGB quantization: No Data
    PT scan behavior: No Data
    IT scan behavior: Supports both over- and underscan
    CE scan behavior: Supports both over- and underscan
  Detailed Timing Descriptors:
    DTD 2:   720x480    59.940060 Hz   3:2     31.469 kHz     27.000000 MHz (analog composite, sync-on-green, 160 mm x 90 mm)
                 Hfront   16 Hsync  62 Hback   60 Hpol N
                 Vfront    9 Vsync   6 Vback   30 Vpol N
Checksum: 0xd4  Unused space in Extension Block: 82 bytes

----------------

Block 2, Unknown EDID Extension Block 0x00:
  00 ff ff ff ff ff ff 00 34 38 75 07 dc 1a 06 00 '........48u.....'
  05 0f 01 03 a0 26 1e 96 20 67 55 a5 5b 47 9c 25 '.....&.. gU.[G.%'
  1e 4f 54 af cf 00 01 01 01 01 61 4c 81 80 01 01 '.OT.......aL....'
  01 01 01 01 01 01 d6 09 80 a0 20 5e 63 10 30 60 '.......... ^c.0`'
  02 00 78 2d 11 00 00 1e 00 00 00 ff 00 35 30 35 '..x-.........505'
  41 41 30 33 34 30 30 30 39 32 00 00 00 fc 00 31 'AA03400092.....1'
  30 31 39 30 35 0a 20 20 20 20 20 20 00 00 00 fd '01905.      ....'
  00 38 4b 1f 53 0e 00 0a 20 20 20 20 20 20 01 ef '.8K.S...      ..'
Checksum: 0xef

----------------

Block 3, CTA-861 Extension Block:
  Revision: 3
  Basic audio support
  Native detailed modes: 1
  Audio Data Block:
    Linear PCM:
      Max channels: 2
      Supported sample rates (kHz): 48 44.1 32
      Supported sample sizes (bits): 24 20 16
  Speaker Allocation Data Block:
    FL/FR - Front Left/Right
  Vendor-Specific Data Block (HDMI), OUI 00-0C-03:
    Source physical address: 2.0.0.0
    Maximum TMDS clock: 165 MHz
  Video Data Block:
    VIC  16:  1920x1080   60.000000 Hz  16:9     67.500 kHz    148.500000 MHz
    VIC   4:  1280x720    60.000000 Hz  16:9     45.000 kHz     74.250000 MHz
    VIC   3:   720x480    59.940060 Hz  16:9     31.469 kHz     27.000000 MHz
  Video Capability Data Block:
    YCbCr quantization: No Data
    RGB quantization: No Data
    PT scan behavior: No Data
    IT scan behavior: Supports both over- and underscan
    CE scan behavior: Supports both over- and underscan
  Detailed Timing Descriptors:
    DTD 3:   720x480    59.940060 Hz   3:2     31.469 kHz     27.000000 MHz (analog composite, sync-on-green, 160 mm x 90 mm)
                 Hfront   16 Hsync  62 Hback   60 Hpol N
                 Vfront    9 Vsync   6 Vback   30 Vpol N
Checksum: 0xd4  Unused space in Extension Block: 82 bytes

----------------

Warnings:

Block 0, Base EDID:
  Detailed Timing Descriptor #1: Image size is 376x301 mm, but based on the picture AR it should be 376x205 mm.
Block 1, CTA-861 Extension Block:
  IT Video Formats are overscanned by default, but normally this should be underscanned.
  Video Data Block: VIC 16 and the first DTD are not identical. Is this intended?
  Detailed Timing Descriptor #2: Dubious image size (160x90 mm is smaller than 100x100 mm).
  Display Product Serial Number is set, so the Serial Number in the Base EDID should be 0.
  Add a Colorimetry Data Block with the sRGB colorimetry bit set to avoid interop issues.
Block 3, CTA-861 Extension Block:
  IT Video Formats are overscanned by default, but normally this should be underscanned.
  Detailed Timing Descriptor #3: Dubious image size (160x90 mm is smaller than 100x100 mm).
EDID:
  Base EDID: Some timings are out of range of the Monitor Ranges:
    Maximum Clock: 148.500 MHz (Monitor: 140.000 MHz)
    Could be due to a Monitor Range off-by-one rounding issue
  CTA-861: Native progressive resolution of 640x350 is smaller than the max preferred progressive resolution 1920x1080.

Failures:

Block 0, Base EDID:
  Basic Display Parameters & Features: Digital Video Interface Standard set to reserved value 0x20.
  Basic Display Parameters & Features: EDID 1.3 requires that the first detailed timing is the preferred timing.
  Detailed Timing Descriptor #1: 0 values in the video timing:
    Horizontal Active/Blanking 640/160
    Horizontal Frontporch/Sync Width 48/96
    Vertical Active/Blanking 350/99
    Vertical Frontporch/Sync Width 0/2
Block 1, CTA-861 Extension Block:
  Video Capability Data Block: Set Selectable RGB Quantization to avoid interop issues.
  Detailed Timing Descriptor #2: Mismatch of image size 160x90 mm vs display size 380x300 mm.
Block 2, Base EDID:
  Unknown Extension Block.
Block 3, CTA-861 Extension Block:
  Speaker Allocation Data Block: Only one instance of this Data Block is allowed.
  Video Data Block: Duplicate VIC 16.
  Video Data Block: Duplicate VIC 4.
  Video Data Block: Duplicate VIC 3.
  Video Capability Data Block: Only one instance of this Data Block is allowed.
  Video Capability Data Block: Set Selectable RGB Quantization to avoid interop issues.
  Detailed Timing Descriptor #3: Mismatch of image size 160x90 mm vs display size 380x300 mm.
EDID:
  Base EDID: EDID specified 1 extension block(s), but found 3 extension block(s).
  Base EDID: EDID 1.3 requires a Block Map Extension in Block 1 if there are more than 2 blocks in the EDID.

EDID conformity: FAIL
