edid-decode (hex):

00 ff ff ff ff ff ff 00 06 af 97 fb 00 00 00 00
30 1e 01 04 95 19 11 78 02 24 25 97 5a 58 97 28
1b 50 54 00 00 00 01 01 01 01 01 01 01 01 01 01
01 01 01 01 01 01 2e 22 56 b8 50 90 1c 30 68 16
46 00 fd a9 00 00 00 18 00 00 00 0f 00 00 00 00
00 00 00 00 00 00 00 00 00 20 00 00 00 fe 00 41
55 4f 0a 20 20 20 20 20 20 20 20 20 00 00 00 fe
00 42 31 32 30 58 41 42 30 31 2e 30 20 0a 00 34

00 ff ff ff ff ff ff 00 06 af 97 fb 00 00 00 00
30 1e 01 04 95 19 11 78 02 24 25 97 5a 58 97 28
1b 50 54 00 00 00 01 01 01 01 01 01 01 01 01 01
01 01 01 01 01 01 2e 22 56 b8 50 90 1c 30 68 16
46 00 fd a9 00 00 00 18 00 00 00 0f 00 00 00 00
00 00 00 00 00 00 00 00 00 20 00 00 00 fe 00 41
55 4f 0a 20 20 20 20 20 20 20 20 20 00 00 00 fe
00 42 31 32 30 58 41 42 30 31 2e 30 20 0a 00 34

----------------

Block 0, Base EDID:
  EDID Structure Version & Revision: 1.4
  Vendor & Product Identification:
    Manufacturer: AUO
    Model: 64407
    Made in: week 48 of 2020
  Basic Display Parameters & Features:
    Digital display
    Bits per primary color channel: 6
    DisplayPort interface
    Maximum image size: 25 cm x 17 cm
    Gamma: 2.20
    Supported color formats: RGB 4:4:4
    First detailed timing includes the native pixel format and preferred refresh rate
  Color Characteristics:
    Red  : 0.5898, 0.3535
    Green: 0.3447, 0.5898
    Blue : 0.1562, 0.1074
    White: 0.3134, 0.3291
  Established Timings I & II: none
  Standard Timings: none
  Detailed Timing Descriptors:
    DTD 1:  1366x912    60.054907 Hz 683:456   56.452 kHz     87.500000 MHz (253 mm x 169 mm)
                 Hfront  104 Hsync  22 Hback   58 Hpol N
                 Vfront    4 Vsync   6 Vback   18 Vpol N
    Manufacturer-Specified Display Descriptor (0x0f): 00 0f 00 00 00 00 00 00 00 00 00 00 00 00 00 20 '............... '
    Alphanumeric Data String: 'AUO'
    Alphanumeric Data String: 'B120XAB01.0 '
Checksum: 0x34

----------------

Warnings:

Block 0, Base EDID:
  Missing Display Product Name.

Failures:

Block 0, Base EDID:
  Alphanumeric Data String: One or more trailing spaces before newline.
EDID:
  Extension Block 1 started with EDID header, ignoring Extension Blocks >= 1.

EDID conformity: FAIL
