edid-decode (hex):

00 ff ff ff ff ff ff 00 16 09 56 b5 ca 99 0b 00
17 0d 01 02 28 1c 15 a0 2a 06 99 a0 57 4f 98 26
10 48 4c a0 08 00 31 59 45 59 01 01 01 01 01 01
01 01 01 01 01 01 f9 15 20 f8 30 58 1f 20 20 40
13 00 18 d2 10 00 00 1e 00 00 00 fc 00 41 4f 43
20 0a 20 20 20 20 20 20 20 20 00 00 00 fc 00 35
45 0a 20 20 20 20 20 20 20 20 20 20 00 00 00 fd
00 32 78 1e 36 ff 00 0a 20 20 20 20 20 20 00 0c

----------------

Block 0, Base EDID:
  EDID Structure Version & Revision: 1.2
  Vendor & Product Identification:
    Manufacturer: EPI
    Model: 46422
    Serial Number: ...
    Made in: week 23 of 2003
  Basic Display Parameters & Features:
    Analog display
    Signal Level Standard: 0.714 : 0.286 : 1.000 V p-p
    Blank level equals black level
    Sync: Separate
    Maximum image size: 28 cm x 21 cm
    Gamma: 2.60
    DPMS levels: Off
    RGB color display
    First detailed timing is the preferred timing
  Color Characteristics:
    Red  : 0.6250, 0.3398
    Green: 0.3095, 0.5957
    Blue : 0.1503, 0.0634
    White: 0.2832, 0.2978
  Established Timings I & II:
    IBM     :   720x400    70.081663 Hz   9:5     31.467 kHz     28.320000 MHz
    DMT 0x04:   640x480    59.940476 Hz   4:3     31.469 kHz     25.175000 MHz
    DMT 0x10:  1024x768    60.003840 Hz   4:3     48.363 kHz     65.000000 MHz
  Standard Timings:
    DMT 0x07:   640x480    85.008312 Hz   4:3     43.269 kHz     36.000000 MHz
    DMT 0x0c:   800x600    85.061274 Hz   4:3     53.674 kHz     56.250000 MHz
  Detailed Timing Descriptors:
    DTD 1:   800x600    85.061274 Hz   4:3     53.674 kHz     56.250000 MHz (280 mm x 210 mm)
                 Hfront   32 Hsync  64 Hback  152 Hpol P
                 Vfront    1 Vsync   3 Vback   27 Vpol P
    Display Product Name: 'AOC '
    Display Product Name: '5E'
    Display Range Limits:
      Monitor ranges (GTF): 50-120 Hz V, 30-54 kHz H, max dotclock 2550 MHz
Checksum: 0x0c

----------------

Warnings:

Block 0, Base EDID:
  EDID Structure Version & Revision: EDID 1.2 is deprecated, do not use.

Failures:

Block 0, Base EDID:
  Display Product Name: One or more trailing spaces before newline.

EDID conformity: FAIL
