edid-decode (hex):

00 ff ff ff ff ff ff 00 06 af ec 13 00 00 00 00
00 19 01 04 95 22 13 78 02 50 25 93 58 57 92 29
22 50 54 00 00 00 01 01 01 01 01 01 01 01 01 01
01 01 01 01 01 01 14 1e 56 ce 50 00 30 30 08 0a
36 00 58 c1 10 00 00 1a 10 18 56 ce 50 00 30 30
08 0a 36 00 58 c1 10 00 00 1a 00 00 00 fe 00 56
4a 48 52 47 80 42 31 35 36 58 54 54 00 00 00 00
00 00 41 02 94 01 01 00 00 09 01 0a 20 20 00 86

----------------

Block 0, Base EDID:
  EDID Structure Version & Revision: 1.4
  Vendor & Product Identification:
    Manufacturer: AUO
    Model: 5100
    Made in: 2015
  Basic Display Parameters & Features:
    Digital display
    Bits per primary color channel: 6
    DisplayPort interface
    Maximum image size: 34 cm x 19 cm
    Gamma: 2.20
    Supported color formats: RGB 4:4:4
    First detailed timing includes the native pixel format and preferred refresh rate
  Color Characteristics:
    Red  : 0.5751, 0.3447
    Green: 0.3398, 0.5703
    Blue : 0.1601, 0.1347
    White: 0.3134, 0.3291
  Established Timings I & II: none
  Standard Timings: none
  Detailed Timing Descriptors:
    DTD 1:  1366x768    60.027192 Hz 683:384   48.982 kHz     77.000000 MHz (344 mm x 193 mm)
                 Hfront    8 Hsync  10 Hback  188 Hpol P
                 Vfront    3 Vsync   6 Vback   39 Vpol N
    DTD 2:  1366x768    48.021753 Hz 683:384   39.186 kHz     61.600000 MHz (344 mm x 193 mm)
                 Hfront    8 Hsync  10 Hback  188 Hpol P
                 Vfront    3 Vsync   6 Vback   39 Vpol N
    Alphanumeric Data String: 'VJHRG.B156XTT'
    Manufacturer-Specified Display Descriptor (0x00): 00 00 00 00 41 02 94 01 01 00 00 09 01 0a 20 20 '....A.........  '
Checksum: 0x86

----------------

Warnings:

Block 0, Base EDID:
  Alphanumeric Data String: Non-ASCII character 0x80 at position 5, can cause problems.
  Missing Display Product Name.

EDID conformity: PASS
