edid-decode (hex):

00 ff ff ff ff ff ff 00 60 78 44 08 00 00 00 00
01 1c 01 03 95 1a 0e 78 0a 81 e0 96 59 5a 9a 29
1c 50 54 00 00 00 01 01 01 01 01 01 01 01 01 01
01 01 01 01 01 01 6b 1b 56 64 50 00 1e 30 26 16
44 00 00 90 10 00 00 1a ef 15 56 64 50 00 1e 30
26 16 44 00 00 90 10 00 00 1a 00 00 00 fe 00 58
44 59 37 33 80 4e 56 31 31 36 57 48 00 00 00 00
00 00 41 01 96 02 10 00 00 09 01 0a 20 20 00 a1

00 ff ff ff ff ff ff 00 60 78 44 08 00 00 00 00
01 1c 01 03 95 1a 0e 78 0a 81 e0 96 59 5a 9a 29
1c 50 54 00 00 00 01 01 01 01 01 01 01 01 01 01
01 01 01 01 01 01 6b 1b 56 64 50 00 1e 30 26 16
44 00 00 90 10 00 00 1a ef 15 56 64 50 00 1e 30
26 16 44 00 00 90 10 00 00 1a 00 00 00 fe 00 58
44 59 37 33 80 4e 56 31 31 36 57 48 00 00 00 00
00 00 41 01 96 02 10 00 00 09 01 0a 20 20 00 a1

----------------

Block 0, Base EDID:
  EDID Structure Version & Revision: 1.3
  Vendor & Product Identification:
    Manufacturer: XCX
    Model: 2116
    Made in: week 1 of 2018
  Basic Display Parameters & Features:
    Digital display
    DFP 1.x compatible TMDS
    Maximum image size: 26 cm x 14 cm
    Gamma: 2.20
    RGB color display
    First detailed timing is the preferred timing
  Color Characteristics:
    Red  : 0.5878, 0.3476
    Green: 0.3515, 0.6025
    Blue : 0.1630, 0.1113
    White: 0.3125, 0.3281
  Established Timings I & II: none
  Standard Timings: none
  Detailed Timing Descriptors:
    DTD 1:  1366x768    59.998222 Hz 683:384   47.879 kHz     70.190000 MHz (256 mm x 144 mm)
                 Hfront   38 Hsync  22 Hback   40 Hpol P
                 Vfront    4 Vsync   4 Vback   22 Vpol N
    DTD 2:  1366x768    47.996868 Hz 683:384   38.302 kHz     56.150000 MHz (256 mm x 144 mm)
                 Hfront   38 Hsync  22 Hback   40 Hpol P
                 Vfront    4 Vsync   4 Vback   22 Vpol N
    Alphanumeric Data String: 'XDY73.NV116WH'
    Manufacturer-Specified Display Descriptor (0x00): 00 00 00 00 41 01 96 02 10 00 00 09 01 0a 20 20 '....A.........  '
Checksum: 0xa1

----------------

Block 1, Unknown EDID Extension Block 0x00:
  00 ff ff ff ff ff ff 00 60 78 44 08 00 00 00 00 '........`xD.....'
  01 1c 01 03 95 1a 0e 78 0a 81 e0 96 59 5a 9a 29 '.......x....YZ.)'
  1c 50 54 00 00 00 01 01 01 01 01 01 01 01 01 01 '.PT.............'
  01 01 01 01 01 01 6b 1b 56 64 50 00 1e 30 26 16 '......k.VdP..0&.'
  44 00 00 90 10 00 00 1a ef 15 56 64 50 00 1e 30 'D.........VdP..0'
  26 16 44 00 00 90 10 00 00 1a 00 00 00 fe 00 58 '&.D............X'
  44 59 37 33 80 4e 56 31 31 36 57 48 00 00 00 00 'DY73.NV116WH....'
  00 00 41 01 96 02 10 00 00 09 01 0a 20 20 00 a1 '..A.........  ..'
Checksum: 0xa1

----------------

Warnings:

Block 0, Base EDID:
  Alphanumeric Data String: Non-ASCII character 0x80 at position 5, can cause problems.

Failures:

Block 0, Base EDID:
  Basic Display Parameters & Features: Digital Video Interface Standard set to reserved value 0x14.
  Missing Display Product Name.
  Missing Display Range Limits Descriptor.
Block 1, Base EDID:
  Unknown Extension Block.
EDID:
  Base EDID: EDID specified 0 extension block(s), but found 1 extension block(s).

EDID conformity: FAIL
