edid-decode (hex):

00 ff ff ff ff ff ff 00 09 e5 7e 08 00 00 00 00
01 1d 01 04 a5 1f 11 78 02 7c c0 a5 56 53 9d 26
0e 50 54 00 00 00 01 01 01 01 01 01 01 01 01 01
01 01 01 01 01 01 07 35 80 64 70 38 28 40 30 20
35 00 35 ad 10 00 00 1a 6c 2a 80 64 70 38 28 40
30 20 35 00 35 ad 10 00 00 1a 00 00 00 fe 00 4a
4e 37 54 54 80 4e 56 31 34 30 46 48 00 00 00 00
00 02 41 33 9e 02 10 00 00 0a 01 0a 20 20 00 fe

----------------

Block 0, Base EDID:
  EDID Structure Version & Revision: 1.4
  Vendor & Product Identification:
    Manufacturer: BOE
    Model: 2174
    Made in: week 1 of 2019
  Basic Display Parameters & Features:
    Digital display
    Bits per primary color channel: 8
    DisplayPort interface
    Maximum image size: 31 cm x 17 cm
    Gamma: 2.20
    Supported color formats: RGB 4:4:4
    First detailed timing includes the native pixel format and preferred refresh rate
  Color Characteristics:
    Red  : 0.6455, 0.3388
    Green: 0.3271, 0.6132
    Blue : 0.1513, 0.0546
    White: 0.3125, 0.3281
  Established Timings I & II: none
  Standard Timings: none
  Detailed Timing Descriptors:
    DTD 1:  1920x1080   60.002652 Hz  16:9     67.203 kHz    135.750000 MHz (309 mm x 173 mm)
                 Hfront   48 Hsync  32 Hback   20 Hpol P
                 Vfront    3 Vsync   5 Vback   32 Vpol N
    DTD 2:  1920x1080   48.002122 Hz  16:9     53.762 kHz    108.600000 MHz (309 mm x 173 mm)
                 Hfront   48 Hsync  32 Hback   20 Hpol P
                 Vfront    3 Vsync   5 Vback   32 Vpol N
    Alphanumeric Data String: 'JN7TT.NV140FH'
    Manufacturer-Specified Display Descriptor (0x00): 00 00 00 02 41 33 9e 02 10 00 00 0a 01 0a 20 20 '....A3........  '
Checksum: 0xfe

----------------

Warnings:

Block 0, Base EDID:
  Alphanumeric Data String: Non-ASCII character 0x80 at position 5, can cause problems.
  Missing Display Product Name.

EDID conformity: PASS
