edid-decode (hex):

00 ff ff ff ff ff ff 00 04 69 b1 19 01 01 01 01
31 10 01 03 8e 26 1f 3c 28 15 0a a4 57 4a 9c 24
12 4f 54 af ce 00 81 80 71 4f 01 01 01 01 01 01
01 01 01 01 01 01 30 2a 00 98 51 00 2a 40 30 70
13 00 78 2d 11 00 00 1e 00 00 00 fd 00 37 4b 1e
50 0e 00 0a 20 20 20 20 20 20 00 00 00 fe 00 36
43 4c 39 30 30 33 38 39 34 0a 20 20 00 00 00 fc
00 41 53 55 53 20 50 47 31 39 31 0a 20 20 00 e1

00 ff ff ff ff ff ff 00 04 69 b1 19 01 01 01 01
31 10 01 03 8e 26 1f 3c 28 15 0a a4 57 4a 9c 24
12 4f 54 af ce 00 81 80 71 4f 01 01 01 01 01 01
01 01 01 01 01 01 30 2a 00 98 51 00 2a 40 30 70
13 00 78 2d 11 00 00 1e 00 00 00 fd 00 37 4b 1e
50 0e 00 0a 20 20 20 20 20 20 00 00 00 fe 00 36
43 4c 39 30 30 33 38 39 34 0a 20 20 00 00 00 fc
00 41 53 55 53 20 50 47 31 39 31 0a 20 20 00 e1

----------------

Block 0, Base EDID:
  EDID Structure Version & Revision: 1.3
  Vendor & Product Identification:
    Manufacturer: ACI
    Model: 6577
    Serial Number: ...
    Made in: week 49 of 2006
  Basic Display Parameters & Features:
    Digital display
    Maximum image size: 38 cm x 31 cm
    Gamma: 1.60
    DPMS levels: Off
    RGB color display
  Color Characteristics:
    Red  : 0.6406, 0.3408
    Green: 0.2900, 0.6103
    Blue : 0.1406, 0.0703
    White: 0.3105, 0.3300
  Established Timings I & II:
    IBM     :   720x400    70.081663 Hz   9:5     31.467 kHz     28.320000 MHz
    DMT 0x04:   640x480    59.940476 Hz   4:3     31.469 kHz     25.175000 MHz
    DMT 0x05:   640x480    72.808802 Hz   4:3     37.861 kHz     31.500000 MHz
    DMT 0x06:   640x480    75.000000 Hz   4:3     37.500 kHz     31.500000 MHz
    DMT 0x08:   800x600    56.250000 Hz   4:3     35.156 kHz     36.000000 MHz
    DMT 0x09:   800x600    60.316541 Hz   4:3     37.879 kHz     40.000000 MHz
    DMT 0x0a:   800x600    72.187572 Hz   4:3     48.077 kHz     50.000000 MHz
    DMT 0x0b:   800x600    75.000000 Hz   4:3     46.875 kHz     49.500000 MHz
    DMT 0x10:  1024x768    60.003840 Hz   4:3     48.363 kHz     65.000000 MHz
    DMT 0x11:  1024x768    70.069359 Hz   4:3     56.476 kHz     75.000000 MHz
    DMT 0x12:  1024x768    75.028582 Hz   4:3     60.023 kHz     78.750000 MHz
  Standard Timings:
    DMT 0x23:  1280x1024   60.019740 Hz   5:4     63.981 kHz    108.000000 MHz
    DMT 0x15:  1152x864    75.000000 Hz   4:3     67.500 kHz    108.000000 MHz
  Detailed Timing Descriptors:
    DTD 1:  1280x1024   60.019740 Hz   5:4     63.981 kHz    108.000000 MHz (376 mm x 301 mm)
                 Hfront   48 Hsync 112 Hback  248 Hpol P
                 Vfront    1 Vsync   3 Vback   38 Vpol P
    Display Range Limits:
      Monitor ranges (GTF): 55-75 Hz V, 30-80 kHz H, max dotclock 140 MHz
    Alphanumeric Data String: '6CL9003894'
    Display Product Name: 'ASUS PG191'
Checksum: 0xe1

----------------

Block 1, Unknown EDID Extension Block 0x00:
  00 ff ff ff ff ff ff 00 04 69 b1 19 01 01 01 01 '.........i......'
  31 10 01 03 8e 26 1f 3c 28 15 0a a4 57 4a 9c 24 '1....&.<(...WJ.$'
  12 4f 54 af ce 00 81 80 71 4f 01 01 01 01 01 01 '.OT.....qO......'
  01 01 01 01 01 01 30 2a 00 98 51 00 2a 40 30 70 '......0*..Q.*@0p'
  13 00 78 2d 11 00 00 1e 00 00 00 fd 00 37 4b 1e '..x-.........7K.'
  50 0e 00 0a 20 20 20 20 20 20 00 00 00 fe 00 36 'P...      .....6'
  43 4c 39 30 30 33 38 39 34 0a 20 20 00 00 00 fc 'CL9003894.  ....'
  00 41 53 55 53 20 50 47 31 39 31 0a 20 20 00 e1 '.ASUS PG191.  ..'
Checksum: 0xe1

----------------

Warnings:

Block 0, Base EDID:
  Vendor & Product Identification: The serial number is one of the known dummy values, it should probably be set to 0.
EDID:
  No Native Video Resolution was defined.

Failures:

Block 0, Base EDID:
  Basic Display Parameters & Features: Digital Video Interface Standard set to reserved value 0x0e.
  Basic Display Parameters & Features: EDID 1.3 requires that the first detailed timing is the preferred timing.
Block 1, Base EDID:
  Unknown Extension Block.
EDID:
  Base EDID: EDID specified 0 extension block(s), but found 1 extension block(s).

EDID conformity: FAIL
