edid-decode (hex):

00 ff ff ff ff ff ff 00 1a b3 69 08 00 00 00 00
25 18 01 03 80 34 1d 78 ea a9 84 a5 55 48 9b 26
12 50 54 a3 0c 00 81 80 95 00 b3 00 81 00 71 4f
01 01 01 01 01 01 02 3a 80 18 71 38 2d 40 58 2c
45 00 09 25 21 00 00 1e 00 00 00 fd 00 32 4c 1e
52 11 00 0a 20 20 20 20 20 20 00 00 00 fc 00 4c
32 34 54 2d 32 20 4c 45 44 0a 20 20 00 00 00 ff
00 59 56 39 48 30 30 33 39 39 39 0a 20 20 00 f2

00 ff ff ff ff ff ff 00 1a b3 69 08 00 00 00 00
25 18 01 03 80 34 1d 78 ea a9 84 a5 55 48 9b 26
12 50 54 a3 0c 00 81 80 95 00 b3 00 81 00 71 4f
01 01 01 01 01 01 02 3a 80 18 71 38 2d 40 58 2c
45 00 09 25 21 00 00 1e 00 00 00 fd 00 32 4c 1e
52 11 00 0a 20 20 20 20 20 20 00 00 00 fc 00 4c
32 34 54 2d 32 20 4c 45 44 0a 20 20 00 00 00 ff
00 59 56 39 48 30 30 33 39 39 39 0a 20 20 00 f2

----------------

Block 0, Base EDID:
  EDID Structure Version & Revision: 1.3
  Vendor & Product Identification:
    Manufacturer: FUS
    Model: 2153
    Made in: week 37 of 2014
  Basic Display Parameters & Features:
    Digital display
    Maximum image size: 52 cm x 29 cm
    Gamma: 2.20
    DPMS levels: Standby Suspend Off
    RGB color display
    First detailed timing is the preferred timing
  Color Characteristics:
    Red  : 0.6464, 0.3339
    Green: 0.2832, 0.6064
    Blue : 0.1503, 0.0703
    White: 0.3134, 0.3281
  Established Timings I & II:
    IBM     :   720x400    70.081663 Hz   9:5     31.467 kHz     28.320000 MHz
    DMT 0x04:   640x480    59.940476 Hz   4:3     31.469 kHz     25.175000 MHz
    DMT 0x08:   800x600    56.250000 Hz   4:3     35.156 kHz     36.000000 MHz
    DMT 0x09:   800x600    60.316541 Hz   4:3     37.879 kHz     40.000000 MHz
    DMT 0x10:  1024x768    60.003840 Hz   4:3     48.363 kHz     65.000000 MHz
    DMT 0x11:  1024x768    70.069359 Hz   4:3     56.476 kHz     75.000000 MHz
  Standard Timings:
    DMT 0x23:  1280x1024   60.019740 Hz   5:4     63.981 kHz    108.000000 MHz
    DMT 0x2f:  1440x900    59.887445 Hz  16:10    55.935 kHz    106.500000 MHz
    DMT 0x3a:  1680x1050   59.954250 Hz  16:10    65.290 kHz    146.250000 MHz
    DMT 0x1c:  1280x800    59.810326 Hz  16:10    49.702 kHz     83.500000 MHz
    DMT 0x15:  1152x864    75.000000 Hz   4:3     67.500 kHz    108.000000 MHz
  Detailed Timing Descriptors:
    DTD 1:  1920x1080   60.000000 Hz  16:9     67.500 kHz    148.500000 MHz (521 mm x 293 mm)
                 Hfront   88 Hsync  44 Hback  148 Hpol P
                 Vfront    4 Vsync   5 Vback   36 Vpol P
    Display Range Limits:
      Monitor ranges (GTF): 50-76 Hz V, 30-82 kHz H, max dotclock 170 MHz
    Display Product Name: 'L24T-2 LED'
    Display Product Serial Number: ...
Checksum: 0xf2

----------------

Failures:

EDID:
  Extension Block 1 started with EDID header, ignoring Extension Blocks >= 1.

EDID conformity: FAIL
