edid-decode (hex):

00 ff ff ff ff ff ff 00 26 cd 11 71 9e 01 00 00
1d 1d 01 03 80 3e 22 78 2a 08 a5 a2 57 4f a2 28
0f 50 54 bd 4b 00 d1 c0 81 80 81 40 95 0f 95 00
b3 00 81 c0 01 01 04 74 00 30 f2 70 5a 80 b0 58
8a 00 6d 55 21 00 00 1e 04 74 00 30 f2 70 5a 80
b0 58 8a 00 6d 55 21 00 00 1e 00 00 00 fc 00 50
4c 32 38 37 35 55 48 0a 20 20 20 20 00 00 00 fd
00 17 50 1e 63 3c 00 0a 20 20 20 20 20 20 01 c7

02 03 33 f1 4c 90 04 03 1f 13 01 01 5d 5e 5f 5f
5f 23 09 07 07 83 01 00 00 6d 03 0c 00 10 00 01
78 20 00 60 01 02 03 67 00 00 00 01 78 80 03 e3
0f 00 0c 01 1d 00 72 51 d0 1e 20 6e 28 55 00 6d
55 21 00 00 1e 8c 0a d0 8a 20 e0 2d 10 10 3e 96
00 6d 55 21 00 00 18 4d 6c 80 a0 70 70 3e 80 30
20 3a 00 6d 55 21 00 00 1a 04 74 00 30 f2 70 5a
80 b0 58 8a 00 6d 55 21 00 00 1a 00 00 00 00 e6

00 ff ff ff ff ff ff 00 26 cd 11 71 9e 01 00 00
1d 1d 01 03 80 3e 22 78 2a 08 a5 a2 57 4f a2 28
0f 50 54 bd 4b 00 d1 c0 81 80 81 40 95 0f 95 00
b3 00 81 c0 01 01 04 74 00 30 f2 70 5a 80 b0 58
8a 00 6d 55 21 00 00 1e 04 74 00 30 f2 70 5a 80
b0 58 8a 00 6d 55 21 00 00 1e 00 00 00 fc 00 50
4c 32 38 37 35 55 48 0a 20 20 20 20 00 00 00 fd
00 17 50 1e 63 3c 00 0a 20 20 20 20 20 20 01 c7

02 03 33 f1 4c 90 04 03 1f 13 01 01 5d 5e 5f 5f
5f 23 09 07 07 83 01 00 00 6d 03 0c 00 10 00 01
78 20 00 60 01 02 03 67 00 00 00 01 78 80 03 e3
0f 00 0c 01 1d 00 72 51 d0 1e 20 6e 28 55 00 6d
55 21 00 00 1e 8c 0a d0 8a 20 e0 2d 10 10 3e 96
00 6d 55 21 00 00 18 4d 6c 80 a0 70 70 3e 80 30
20 3a 00 6d 55 21 00 00 1a 04 74 00 30 f2 70 5a
80 b0 58 8a 00 6d 55 21 00 00 1a 00 00 00 00 e6

----------------

Block 0, Base EDID:
  EDID Structure Version & Revision: 1.3
  Vendor & Product Identification:
    Manufacturer: IVM
    Model: 28945
    Serial Number: ...
    Made in: week 29 of 2019
  Basic Display Parameters & Features:
    Digital display
    Maximum image size: 62 cm x 34 cm
    Gamma: 2.20
    DPMS levels: Off
    RGB color display
    First detailed timing is the preferred timing
  Color Characteristics:
    Red  : 0.6328, 0.3398
    Green: 0.3105, 0.6328
    Blue : 0.1582, 0.0605
    White: 0.3134, 0.3291
  Established Timings I & II:
    IBM     :   720x400    70.081663 Hz   9:5     31.467 kHz     28.320000 MHz
    DMT 0x04:   640x480    59.940476 Hz   4:3     31.469 kHz     25.175000 MHz
    Apple   :   640x480    66.666667 Hz   4:3     35.000 kHz     30.240000 MHz
    DMT 0x05:   640x480    72.808802 Hz   4:3     37.861 kHz     31.500000 MHz
    DMT 0x06:   640x480    75.000000 Hz   4:3     37.500 kHz     31.500000 MHz
    DMT 0x09:   800x600    60.316541 Hz   4:3     37.879 kHz     40.000000 MHz
    DMT 0x0b:   800x600    75.000000 Hz   4:3     46.875 kHz     49.500000 MHz
    DMT 0x10:  1024x768    60.003840 Hz   4:3     48.363 kHz     65.000000 MHz
    DMT 0x12:  1024x768    75.028582 Hz   4:3     60.023 kHz     78.750000 MHz
    DMT 0x24:  1280x1024   75.024675 Hz   5:4     79.976 kHz    135.000000 MHz
  Standard Timings:
    DMT 0x52:  1920x1080   60.000000 Hz  16:9     67.500 kHz    148.500000 MHz
    DMT 0x23:  1280x1024   60.019740 Hz   5:4     63.981 kHz    108.000000 MHz
    DMT 0x20:  1280x960    60.000000 Hz   4:3     60.000 kHz    108.000000 MHz
    DMT 0x30:  1440x900    74.984427 Hz  16:10    70.635 kHz    136.750000 MHz
    DMT 0x2f:  1440x900    59.887445 Hz  16:10    55.935 kHz    106.500000 MHz
    DMT 0x3a:  1680x1050   59.954250 Hz  16:10    65.290 kHz    146.250000 MHz
    DMT 0x55:  1280x720    60.000000 Hz  16:9     45.000 kHz     74.250000 MHz
  Detailed Timing Descriptors:
    DTD 1:  3840x2160   30.000000 Hz  16:9     67.500 kHz    297.000000 MHz (621 mm x 341 mm)
                 Hfront  176 Hsync  88 Hback  296 Hpol P
                 Vfront    8 Vsync  10 Vback   72 Vpol P
    DTD 2:  3840x2160   30.000000 Hz  16:9     67.500 kHz    297.000000 MHz (621 mm x 341 mm)
                 Hfront  176 Hsync  88 Hback  296 Hpol P
                 Vfront    8 Vsync  10 Vback   72 Vpol P
    Display Product Name: 'PL2875UH'
    Display Range Limits:
      Monitor ranges (GTF): 23-80 Hz V, 30-99 kHz H, max dotclock 600 MHz
  Extension blocks: 1
Checksum: 0xc7

----------------

Block 1, CTA-861 Extension Block:
  Revision: 3
  Underscans IT Video Formats by default
  Basic audio support
  Supports YCbCr 4:4:4
  Supports YCbCr 4:2:2
  Native DTDs: 1
  Video Data Block:
    VIC  16:  1920x1080   60.000000 Hz  16:9     67.500 kHz    148.500000 MHz (native)
    VIC   4:  1280x720    60.000000 Hz  16:9     45.000 kHz     74.250000 MHz
    VIC   3:   720x480    59.940060 Hz  16:9     31.469 kHz     27.000000 MHz
    VIC  31:  1920x1080   50.000000 Hz  16:9     56.250 kHz    148.500000 MHz
    VIC  19:  1280x720    50.000000 Hz  16:9     37.500 kHz     74.250000 MHz
    VIC   1:   640x480    59.940476 Hz   4:3     31.469 kHz     25.175000 MHz
    VIC   1:   640x480    59.940476 Hz   4:3     31.469 kHz     25.175000 MHz
    VIC  93:  3840x2160   24.000000 Hz  16:9     54.000 kHz    297.000000 MHz
    VIC  94:  3840x2160   25.000000 Hz  16:9     56.250 kHz    297.000000 MHz
    VIC  95:  3840x2160   30.000000 Hz  16:9     67.500 kHz    297.000000 MHz
    VIC  95:  3840x2160   30.000000 Hz  16:9     67.500 kHz    297.000000 MHz
    VIC  95:  3840x2160   30.000000 Hz  16:9     67.500 kHz    297.000000 MHz
  Audio Data Block:
    Linear PCM:
      Max channels: 2
      Supported sample rates (kHz): 48 44.1 32
      Supported sample sizes (bits): 24 20 16
  Speaker Allocation Data Block:
    FL/FR - Front Left/Right
  Vendor-Specific Data Block (HDMI), OUI 00-0C-03:
    Source physical address: 1.0.0.0
    DVI_Dual
    Maximum TMDS clock: 600 MHz
    Extended HDMI video details:
      HDMI VICs:
        HDMI VIC 1:  3840x2160   30.000000 Hz  16:9     67.500 kHz    297.000000 MHz
        HDMI VIC 2:  3840x2160   25.000000 Hz  16:9     56.250 kHz    297.000000 MHz
        HDMI VIC 3:  3840x2160   24.000000 Hz  16:9     54.000 kHz    297.000000 MHz
  Vendor-Specific Data Block, OUI 00-00-00:
    01 78 80 03                                     '.x..'
  YCbCr 4:2:0 Capability Map Data Block:
    VIC  95:  3840x2160   30.000000 Hz  16:9     67.500 kHz    297.000000 MHz
    VIC  95:  3840x2160   30.000000 Hz  16:9     67.500 kHz    297.000000 MHz
  Detailed Timing Descriptors:
    DTD 3:  1280x720    60.000000 Hz  16:9     45.000 kHz     74.250000 MHz (621 mm x 341 mm)
                 Hfront  110 Hsync  40 Hback  220 Hpol P
                 Vfront    5 Vsync   5 Vback   20 Vpol P
    DTD 4:   720x480    59.940060 Hz   3:2     31.469 kHz     27.000000 MHz (621 mm x 341 mm)
                 Hfront   16 Hsync  62 Hback   60 Hpol N
                 Vfront    9 Vsync   6 Vback   30 Vpol N
    DTD 5:  1920x2160   59.987970 Hz   8:9    133.293 kHz    277.250000 MHz (621 mm x 341 mm)
                 Hfront   48 Hsync  32 Hback   80 Hpol P
                 Vfront    3 Vsync  10 Vback   49 Vpol N
    DTD 6:  3840x2160   30.000000 Hz  16:9     67.500 kHz    297.000000 MHz (621 mm x 341 mm)
                 Hfront  176 Hsync  88 Hback  296 Hpol P
                 Vfront    8 Vsync  10 Vback   72 Vpol N
Checksum: 0xe6  Unused space in Extension Block: 4 bytes

----------------

Warnings:

Block 1, CTA-861 Extension Block:
  Video Data Block: VIC 16 and the first DTD are not identical. Is this intended?
  Vendor-Specific Data Block, OUI 00-00-00: All zeroes OUI.
  YCbCr 4:2:0 Capability Map Data Block: Some YCbCr 4:2:0 timings are invalid for HDMI 2.1 (which requires an RGB timings pixel rate >= 590 MHz).
  Detailed Timing Descriptor #4: Image size is 621x341 mm, but based on the picture AR it should be 511x341 mm.
  Detailed Timing Descriptor #5: Image size is 621x341 mm, but based on the picture AR it should be 303x341 mm.
  Detailed Timing Descriptor #6: DTD is similar but not identical to VIC 95.
  Add a Colorimetry Data Block with the sRGB colorimetry bit set to avoid interop issues.
EDID:
  Base EDID: Some timings are out of range of the Monitor Ranges:
    Horizontal Freq: 31.466 - 133.293 kHz (Monitor: 30.000 - 99.000 kHz)

Failures:

Block 1, CTA-861 Extension Block:
  Video Data Block: Duplicate VIC 1.
  Video Data Block: Duplicate VIC 95.
  Vendor-Specific Data Block (HDMI), OUI 00-0C-03: HDMI VSDB Max TMDS rate is > 340.
  Missing VCDB, needed for Set Selectable RGB Quantization to avoid interop issues.
EDID:
  Extension Block 2 started with EDID header, ignoring Extension Blocks >= 2.
  CTA-861: Native progressive timings are a mix of several resolutions.

EDID conformity: FAIL
