edid-decode (hex):

00 ff ff ff ff ff ff 00 2c 82 18 03 01 00 00 00
0d 1e 01 04 95 1f 11 78 0a 3d 85 a6 56 4a 9a 24
12 50 54 00 00 00 01 01 01 01 01 01 01 01 01 01
01 01 01 01 01 01 12 1b 56 5a 50 00 19 30 1e 0e
66 00 35 ae 10 00 00 1e 00 00 00 00 00 00 00 00
00 00 00 00 00 00 00 00 00 00 00 00 00 00 00 00
00 00 00 00 00 00 00 00 00 00 00 00 00 00 00 fe
00 4b 44 31 34 30 33 33 30 4e 48 41 38 0a 00 4f

00 ff ff ff ff ff ff 00 2c 82 18 03 01 00 00 00
0d 1e 01 04 95 1f 11 78 0a 3d 85 a6 56 4a 9a 24
12 50 54 00 00 00 01 01 01 01 01 01 01 01 01 01
01 01 01 01 01 01 12 1b 56 5a 50 00 19 30 1e 0e
66 00 35 ae 10 00 00 1e 00 00 00 00 00 00 00 00
00 00 00 00 00 00 00 00 00 00 00 00 00 00 00 00
00 00 00 00 00 00 00 00 00 00 00 00 00 00 00 fe
00 4b 44 31 34 30 33 33 30 4e 48 41 38 0a 00 4f

----------------

Block 0, Base EDID:
  EDID Structure Version & Revision: 1.4
  Vendor & Product Identification:
    Manufacturer: KDB
    Model: 792
    Serial Number: ...
    Made in: week 13 of 2020
  Basic Display Parameters & Features:
    Digital display
    Bits per primary color channel: 6
    DisplayPort interface
    Maximum image size: 31 cm x 17 cm
    Gamma: 2.20
    Supported color formats: RGB 4:4:4, YCrCb 4:4:4
    First detailed timing includes the native pixel format and preferred refresh rate
  Color Characteristics:
    Red  : 0.6484, 0.3388
    Green: 0.2919, 0.6025
    Blue : 0.1425, 0.0703
    White: 0.3134, 0.3291
  Established Timings I & II: none
  Standard Timings: none
  Detailed Timing Descriptors:
    DTD 1:  1366x768    60.020371 Hz 683:384   47.596 kHz     69.300000 MHz (309 mm x 174 mm)
                 Hfront   30 Hsync  14 Hback   46 Hpol P
                 Vfront    6 Vsync   6 Vback   13 Vpol P
    Empty Descriptor
    Empty Descriptor
    Alphanumeric Data String: 'KD140330NHA8'
Checksum: 0x4f

----------------

Warnings:

Block 0, Base EDID:
  Vendor & Product Identification: The serial number is one of the known dummy values, it should probably be set to 0.
  Missing Display Product Name.

Failures:

Block 0, Base EDID:
  Empty Descriptor: Use Dummy Descriptor instead of all zeroes.
  Empty Descriptor: Use Dummy Descriptor instead of all zeroes.
EDID:
  Extension Block 1 started with EDID header, ignoring Extension Blocks >= 1.

EDID conformity: FAIL
