edid-decode (hex):

00 ff ff ff ff ff ff 00 4e 14 84 0c 00 00 00 00
2c 15 01 03 08 00 00 78 ea 00 00 00 00 00 00 00
00 00 00 ad 08 00 01 01 01 01 01 01 01 01 01 01
01 01 01 01 01 01 66 21 50 b0 51 00 1b 30 40 70
36 00 00 00 00 00 00 1e 00 00 00 ff 00 30 38 39
34 0a 0a 0a 0a 0a 0a 0a 0a 0a 00 00 00 fd 00 3a
4b 1e 55 0b 00 0a 20 20 20 20 20 20 00 00 00 fc
00 58 33 32 30 42 56 2d 48 44 0a 0a 0a 0a 00 1f

00 ff ff ff ff ff ff 00 4e 14 84 0c 00 00 00 00
2c 15 01 03 08 00 00 78 ea 00 00 00 00 00 00 00
00 00 00 ad 08 00 01 01 01 01 01 01 01 01 01 01
01 01 01 01 01 01 66 21 50 b0 51 00 1b 30 40 70
36 00 00 00 00 00 00 1e 00 00 00 ff 00 30 38 39
34 0a 0a 0a 0a 0a 0a 0a 0a 0a 00 00 00 fd 00 3a
4b 1e 55 0b 00 0a 20 20 20 20 20 20 00 00 00 fc
00 58 33 32 30 42 56 2d 48 44 0a 0a 0a 0a 00 1f

----------------

Block 0, Base EDID:
  EDID Structure Version & Revision: 1.3
  Vendor & Product Identification:
    Manufacturer: SPT
    Model: 3204
    Made in: week 44 of 2011
  Basic Display Parameters & Features:
    Analog display
    Signal Level Standard: 0.700 : 0.300 : 1.000 V p-p
    Blank level equals black level
    Sync: Separate
    Image size is variable
    Gamma: 2.20
    DPMS levels: Standby Suspend Off
    RGB color display
    First detailed timing is the preferred timing
  Color Characteristics:
    Red  : 0.0000, 0.0000
    Green: 0.0000, 0.0000
    Blue : 0.0000, 0.0000
    White: 0.0000, 0.0000
  Established Timings I & II:
    IBM     :   720x400    70.081663 Hz   9:5     31.467 kHz     28.320000 MHz
    DMT 0x04:   640x480    59.940476 Hz   4:3     31.469 kHz     25.175000 MHz
    DMT 0x05:   640x480    72.808802 Hz   4:3     37.861 kHz     31.500000 MHz
    DMT 0x06:   640x480    75.000000 Hz   4:3     37.500 kHz     31.500000 MHz
    DMT 0x09:   800x600    60.316541 Hz   4:3     37.879 kHz     40.000000 MHz
    DMT 0x10:  1024x768    60.003840 Hz   4:3     48.363 kHz     65.000000 MHz
  Standard Timings: none
  Detailed Timing Descriptors:
    DTD 1:  1360x768    60.015162 Hz  85:48    47.712 kHz     85.500000 MHz
                 Hfront   64 Hsync 112 Hback  256 Hpol P
                 Vfront    3 Vsync   6 Vback   18 Vpol P
    Display Product Serial Number: ...
    Display Range Limits:
      Monitor ranges (GTF): 58-75 Hz V, 30-85 kHz H, max dotclock 110 MHz
    Display Product Name: 'X320BV-HD'
Checksum: 0x1f

----------------

Failures:

Block 0, Base EDID:
  Display Product Serial Number: ...
  Display Product Name: Non-space after newline.
EDID:
  Extension Block 1 started with EDID header, ignoring Extension Blocks >= 1.

EDID conformity: FAIL
