edid-decode (hex):

00 ff ff ff ff ff ff 00 15 3a 00 10 48 30 74 58
0e 08 01 01 0e 1b 14 50 e8 0d 99 a0 57 47 98 26
10 48 4c ff fe 80 61 59 71 4f 81 80 01 01 01 01
01 01 01 01 01 01 00 00 00 ff 00 4b 38 37 34 33
30 34 38 0a 20 20 20 20 00 00 00 fd 00 32 78 1b
46 0b 00 0a 20 20 20 20 20 20 00 00 00 fc 00 45
49 5a 4f 20 46 6c 65 78 53 63 61 6e 00 00 00 fc
00 20 46 33 35 0a 20 20 20 20 20 20 20 20 00 30

00 ff ff ff ff ff ff 00 15 3a 00 10 48 30 74 58
0e 08 01 01 0e 1b 14 50 e8 0d 99 a0 57 47 98 26
10 48 4c ff fe 80 61 59 71 4f 81 80 01 01 01 01
01 01 01 01 01 01 00 00 00 ff 00 4b 38 37 34 33
30 34 38 0a 20 20 20 20 00 00 00 fd 00 32 78 1b
46 0b 00 0a 20 20 20 20 20 20 00 00 00 fc 00 45
49 5a 4f 20 46 6c 65 78 53 63 61 6e 00 00 00 fc
00 20 46 33 35 0a 20 20 20 20 20 20 20 20 00 30

----------------

Block 0, Base EDID:
  EDID Structure Version & Revision: 1.1
  Vendor & Product Identification:
    Manufacturer: EIZ
    Model: 4096
    Serial Number: ...
    Made in: week 14 of 1998
  Basic Display Parameters & Features:
    Analog display
    Signal Level Standard: 0.700 : 0.300 : 1.000 V p-p
    Blank level equals black level
    Sync: Separate Composite SyncOnGreen
    Maximum image size: 27 cm x 20 cm
    Gamma: 1.80
    DPMS levels: Standby Suspend Off
    RGB color display
  Color Characteristics:
    Red  : 0.6250, 0.3398
    Green: 0.2802, 0.5947
    Blue : 0.1503, 0.0634
    White: 0.2832, 0.2978
  Established Timings I & II:
    IBM     :   720x400    70.081663 Hz   9:5     31.467 kHz     28.320000 MHz
    IBM     :   720x400    87.849542 Hz   9:5     39.444 kHz     35.500000 MHz
    DMT 0x04:   640x480    59.940476 Hz   4:3     31.469 kHz     25.175000 MHz
    Apple   :   640x480    66.666667 Hz   4:3     35.000 kHz     30.240000 MHz
    DMT 0x05:   640x480    72.808802 Hz   4:3     37.861 kHz     31.500000 MHz
    DMT 0x06:   640x480    75.000000 Hz   4:3     37.500 kHz     31.500000 MHz
    DMT 0x08:   800x600    56.250000 Hz   4:3     35.156 kHz     36.000000 MHz
    DMT 0x09:   800x600    60.316541 Hz   4:3     37.879 kHz     40.000000 MHz
    DMT 0x0a:   800x600    72.187572 Hz   4:3     48.077 kHz     50.000000 MHz
    DMT 0x0b:   800x600    75.000000 Hz   4:3     46.875 kHz     49.500000 MHz
    Apple   :   832x624    74.551266 Hz   4:3     49.726 kHz     57.284000 MHz
    DMT 0x0f:  1024x768i   86.957532 Hz   4:3     35.522 kHz     44.900000 MHz
    DMT 0x10:  1024x768    60.003840 Hz   4:3     48.363 kHz     65.000000 MHz
    DMT 0x11:  1024x768    70.069359 Hz   4:3     56.476 kHz     75.000000 MHz
    DMT 0x12:  1024x768    75.028582 Hz   4:3     60.023 kHz     78.750000 MHz
    Apple   :  1152x870    75.061550 Hz 192:145   68.681 kHz    100.000000 MHz
  Standard Timings:
    DMT 0x13:  1024x768    84.996690 Hz   4:3     68.677 kHz     94.500000 MHz
    DMT 0x15:  1152x864    75.000000 Hz   4:3     67.500 kHz    108.000000 MHz
    DMT 0x23:  1280x1024   60.019740 Hz   5:4     63.981 kHz    108.000000 MHz
  Detailed Timing Descriptors:
    Display Product Serial Number: ...
    Display Range Limits:
      Monitor ranges (GTF): 50-120 Hz V, 27-70 kHz H, max dotclock 110 MHz
    Display Product Name: 'EIZO FlexScan'
    Display Product Name: ' F35'
Checksum: 0x30

----------------

Warnings:

Block 0, Base EDID:
  EDID Structure Version & Revision: EDID 1.1 is deprecated, do not use.

Failures:

EDID:
  Extension Block 1 started with EDID header, ignoring Extension Blocks >= 1.

EDID conformity: FAIL
