edid-decode (hex):

00 ff ff ff ff ff ff 00 30 e4 21 05 00 00 00 00
00 1a 01 04 95 1f 11 78 ea 9d 35 94 5c 55 8f 29
1e 50 54 00 00 00 01 01 01 01 01 01 01 01 01 01
01 01 01 01 01 01 2e 36 80 a0 70 38 1f 40 30 20
35 00 35 ae 10 00 00 1a 54 2b 80 a0 70 38 1f 40
30 20 35 00 35 ae 10 00 00 1a 00 00 00 fe 00 4c
47 20 44 69 73 70 6c 61 79 0a 20 20 00 00 00 fe
00 4c 50 31 34 30 57 46 36 2d 53 50 42 37 00 74

00 ff ff ff ff ff ff 00 30 ae af 61 01 01 01 01
18 1d 01 03 80 3c 22 78 2e 93 25 a9 54 4d 9e 25
0c 50 54 a1 08 00 81 80 95 00 b3 00 d1 c0 d1 00
a9 c0 01 01 01 01 56 5e 00 a0 a0 a0 29 50 30 20
35 00 55 50 21 00 00 1a 02 3a 80 18 71 38 2d 40
58 2c 45 00 55 50 21 00 00 1e 00 00 00 fd 00 32
4c 1e 78 22 00 0a 20 20 20 20 20 20 00 00 00 fc
00 4c 45 4e 20 50 32 37 68 2d 31 30 0a 20 01 46

02 03 1d f1 4a 01 02 03 04 05 14 13 90 1f 12 23
09 07 07 83 01 00 00 65 03 0c 00 20 00 01 1d 00
72 51 d0 1e 20 6e 28 55 00 55 50 21 00 00 1e 8c
0a d0 8a 20 e0 2d 10 10 3e 96 00 55 50 21 00 00
18 00 00 00 00 00 00 00 00 00 00 00 00 00 00 00
00 00 00 00 00 00 00 00 00 00 00 00 00 00 00 00
00 00 00 00 00 00 00 00 00 00 00 00 00 00 00 00
00 00 00 00 00 00 00 00 00 00 00 00 00 00 00 ad

00 ff ff ff ff ff ff 00 30 e4 21 05 00 00 00 00
00 1a 01 04 95 1f 11 78 ea 9d 35 94 5c 55 8f 29
1e 50 54 00 00 00 01 01 01 01 01 01 01 01 01 01
01 01 01 01 01 01 2e 36 80 a0 70 38 1f 40 30 20
35 00 35 ae 10 00 00 1a 54 2b 80 a0 70 38 1f 40
30 20 35 00 35 ae 10 00 00 1a 00 00 00 fe 00 4c
47 20 44 69 73 70 6c 61 79 0a 20 20 00 00 00 fe
00 4c 50 31 34 30 57 46 36 2d 53 50 42 37 00 74

00 ff ff ff ff ff ff 00 30 ae af 61 01 01 01 01
18 1d 01 03 80 3c 22 78 2e 93 25 a9 54 4d 9e 25
0c 50 54 a1 08 00 81 80 95 00 b3 00 d1 c0 d1 00
a9 c0 01 01 01 01 56 5e 00 a0 a0 a0 29 50 30 20
35 00 55 50 21 00 00 1a 02 3a 80 18 71 38 2d 40
58 2c 45 00 55 50 21 00 00 1e 00 00 00 fd 00 32
4c 1e 78 22 00 0a 20 20 20 20 20 20 00 00 00 fc
00 4c 45 4e 20 50 32 37 68 2d 31 30 0a 20 01 46

02 03 1d f1 4a 01 02 03 04 05 14 13 90 1f 12 23
09 07 07 83 01 00 00 65 03 0c 00 20 00 01 1d 00
72 51 d0 1e 20 6e 28 55 00 55 50 21 00 00 1e 8c
0a d0 8a 20 e0 2d 10 10 3e 96 00 55 50 21 00 00
18 00 00 00 00 00 00 00 00 00 00 00 00 00 00 00
00 00 00 00 00 00 00 00 00 00 00 00 00 00 00 00
00 00 00 00 00 00 00 00 00 00 00 00 00 00 00 00
00 00 00 00 00 00 00 00 00 00 00 00 00 00 00 ad

----------------

Block 0, Base EDID:
  EDID Structure Version & Revision: 1.4
  Vendor & Product Identification:
    Manufacturer: LGD
    Model: 1313
    Made in: 2016
  Basic Display Parameters & Features:
    Digital display
    Bits per primary color channel: 6
    DisplayPort interface
    Maximum image size: 31 cm x 17 cm
    Gamma: 2.20
    DPMS levels: Standby Suspend Off
    Supported color formats: RGB 4:4:4, YCrCb 4:4:4
    First detailed timing includes the native pixel format and preferred refresh rate
  Color Characteristics:
    Red  : 0.5800, 0.3603
    Green: 0.3349, 0.5595
    Blue : 0.1601, 0.1201
    White: 0.3134, 0.3291
  Established Timings I & II: none
  Standard Timings: none
  Detailed Timing Descriptors:
    DTD 1:  1920x1080   60.020425 Hz  16:9     66.683 kHz    138.700000 MHz (309 mm x 174 mm)
                 Hfront   48 Hsync  32 Hback   80 Hpol P
                 Vfront    3 Vsync   5 Vback   23 Vpol N
    DTD 2:  1920x1080   47.999031 Hz  16:9     53.327 kHz    110.920000 MHz (309 mm x 174 mm)
                 Hfront   48 Hsync  32 Hback   80 Hpol P
                 Vfront    3 Vsync   5 Vback   23 Vpol N
    Alphanumeric Data String: 'LG Display'
    Alphanumeric Data String: 'LP140WF6-SPB7'
Checksum: 0x74

----------------

Warnings:

Block 0, Base EDID:
  Missing Display Product Name.

Failures:

EDID:
  Extension Block 1 started with EDID header, ignoring Extension Blocks >= 1.

EDID conformity: FAIL
