edid-decode (hex):

00 ff ff ff ff ff ff 00 06 af ab 91 00 00 00 00
00 21 01 04 a5 1e 13 78 03 4b 45 91 57 5a 91 29
1e 50 54 00 00 00 01 01 01 01 01 01 01 01 01 01
01 01 01 01 01 01 fa 3c 80 b8 70 b0 24 40 10 10
3e 00 2d bc 10 00 00 1a c8 30 80 b8 70 b0 24 40
10 10 3e 00 2d bc 10 00 00 1a 00 00 00 fe 00 39
4a 4b 50 30 81 42 31 34 30 55 41 54 00 00 00 00
00 02 41 22 99 00 10 00 00 0a 01 0a 20 20 00 c7

00 ff ff ff ff ff ff 00 06 af ab 91 00 00 00 00
00 21 01 04 a5 1e 13 78 03 4b 45 91 57 5a 91 29
1e 50 54 00 00 00 01 01 01 01 01 01 01 01 01 01
01 01 01 01 01 01 fa 3c 80 b8 70 b0 24 40 10 10
3e 00 2d bc 10 00 00 1a c8 30 80 b8 70 b0 24 40
10 10 3e 00 2d bc 10 00 00 1a 00 00 00 fe 00 39
4a 4b 50 30 81 42 31 34 30 55 41 54 00 00 00 00
00 02 41 22 99 00 10 00 00 0a 01 0a 20 20 00 c7

----------------

Block 0, Base EDID:
  EDID Structure Version & Revision: 1.4
  Vendor & Product Identification:
    Manufacturer: AUO
    Model: 37291
    Made in: 2023
  Basic Display Parameters & Features:
    Digital display
    Bits per primary color channel: 8
    DisplayPort interface
    Maximum image size: 30 cm x 19 cm
    Gamma: 2.20
    Supported color formats: RGB 4:4:4
    First detailed timing includes the native pixel format and preferred refresh rate
    Display supports continuous frequencies
  Color Characteristics:
    Red  : 0.5673, 0.3398
    Green: 0.3535, 0.5693
    Blue : 0.1611, 0.1171
    White: 0.3134, 0.3291
  Established Timings I & II: none
  Standard Timings: none
  Detailed Timing Descriptors:
    DTD 1:  1920x1200   60.025902 Hz  16:10    74.192 kHz    156.100000 MHz (301 mm x 188 mm)
                 Hfront   16 Hsync  16 Hback  152 Hpol P
                 Vfront    3 Vsync  14 Vback   19 Vpol N
    DTD 2:  1920x1200   48.020722 Hz  16:10    59.354 kHz    124.880000 MHz (301 mm x 188 mm)
                 Hfront   16 Hsync  16 Hback  152 Hpol P
                 Vfront    3 Vsync  14 Vback   19 Vpol N
    Alphanumeric Data String: '9JKP0.B140UAT'
    Manufacturer-Specified Display Descriptor (0x00): 00 00 00 02 41 22 99 00 10 00 00 0a 01 0a 20 20 '....A"........  '
Checksum: 0xc7

----------------

Warnings:

Block 0, Base EDID:
  Alphanumeric Data String: Non-ASCII character 0x81 at position 5, can cause problems.
  Missing Display Product Name.

Failures:

Block 0, Base EDID:
  Missing Display Range Limits Descriptor.
EDID:
  Extension Block 1 started with EDID header, ignoring Extension Blocks >= 1.

EDID conformity: FAIL
