edid-decode (hex):

00 ff ff ff ff ff ff 00 22 0e 16 36 00 00 00 00
1f 1e 01 04 b5 3c 22 78 23 63 45 aa 53 4a a4 26
0d 50 54 a1 08 00 d1 c0 a9 c0 81 c0 d1 00 b3 00
95 00 a9 40 81 80 56 5e 00 a0 a0 a0 29 50 30 20
35 00 55 53 21 00 00 1a 00 00 00 fd 00 2e 4b 70
70 1f 01 0a 20 20 20 20 20 20 00 00 00 fc 00 48
50 20 32 37 20 51 44 0a 20 20 20 20 00 00 00 ff
00 43 4e 34 30 33 31 31 31 54 52 0a 20 20 01 8d

02 03 19 81 49 10 04 03 02 1f 13 12 11 01 e3 05
e0 00 e6 06 07 01 73 5a 01 02 3a 80 18 71 38 2d
40 58 2c 45 00 55 53 21 00 00 1e 02 3a 80 d0 72
38 2d 40 10 2c 45 80 55 53 21 00 00 1e d9 76 00
a0 a0 a0 34 50 30 20 35 00 55 53 21 00 00 1a 2a
44 80 a0 70 38 27 40 30 20 35 00 55 53 21 00 00
1a 00 00 00 00 00 00 00 00 00 00 00 00 00 00 00
00 00 00 00 00 00 00 00 00 00 00 00 00 00 00 da

00 ff ff ff ff ff ff 00 22 0e 16 36 00 00 00 00
1f 1e 01 04 b5 3c 22 78 23 63 45 aa 53 4a a4 26
0d 50 54 a1 08 00 d1 c0 a9 c0 81 c0 d1 00 b3 00
95 00 a9 40 81 80 56 5e 00 a0 a0 a0 29 50 30 20
35 00 55 53 21 00 00 1a 00 00 00 fd 00 2e 4b 70
70 1f 01 0a 20 20 20 20 20 20 00 00 00 fc 00 48
50 20 32 37 20 51 44 0a 20 20 20 20 00 00 00 ff
00 43 4e 34 30 33 31 31 31 54 52 0a 20 20 01 8d

02 03 19 81 49 10 04 03 02 1f 13 12 11 01 e3 05
e0 00 e6 06 07 01 73 5a 01 02 3a 80 18 71 38 2d
40 58 2c 45 00 55 53 21 00 00 1e 02 3a 80 d0 72
38 2d 40 10 2c 45 80 55 53 21 00 00 1e d9 76 00
a0 a0 a0 34 50 30 20 35 00 55 53 21 00 00 1a 2a
44 80 a0 70 38 27 40 30 20 35 00 55 53 21 00 00
1a 00 00 00 00 00 00 00 00 00 00 00 00 00 00 00
00 00 00 00 00 00 00 00 00 00 00 00 00 00 00 da

----------------

Block 0, Base EDID:
  EDID Structure Version & Revision: 1.4
  Vendor & Product Identification:
    Manufacturer: HPN
    Model: 13846
    Made in: week 31 of 2020
  Basic Display Parameters & Features:
    Digital display
    Bits per primary color channel: 10
    DisplayPort interface
    Maximum image size: 60 cm x 34 cm
    Gamma: 2.20
    DPMS levels: Off
    Supported color formats: RGB 4:4:4
    First detailed timing includes the native pixel format and preferred refresh rate
    Display supports continuous frequencies
  Color Characteristics:
    Red  : 0.6650, 0.3261
    Green: 0.2890, 0.6435
    Blue : 0.1494, 0.0507
    White: 0.3134, 0.3291
  Established Timings I & II:
    IBM     :   720x400    70.081663 Hz   9:5     31.467 kHz     28.320000 MHz
    DMT 0x04:   640x480    59.940476 Hz   4:3     31.469 kHz     25.175000 MHz
    DMT 0x09:   800x600    60.316541 Hz   4:3     37.879 kHz     40.000000 MHz
    DMT 0x10:  1024x768    60.003840 Hz   4:3     48.363 kHz     65.000000 MHz
  Standard Timings:
    DMT 0x52:  1920x1080   60.000000 Hz  16:9     67.500 kHz    148.500000 MHz
    DMT 0x53:  1600x900    60.000000 Hz  16:9     60.000 kHz    108.000000 MHz (RB)
    DMT 0x55:  1280x720    60.000000 Hz  16:9     45.000 kHz     74.250000 MHz
    DMT 0x45:  1920x1200   59.884600 Hz  16:10    74.556 kHz    193.250000 MHz
    DMT 0x3a:  1680x1050   59.954250 Hz  16:10    65.290 kHz    146.250000 MHz
    DMT 0x2f:  1440x900    59.887445 Hz  16:10    55.935 kHz    106.500000 MHz
    DMT 0x33:  1600x1200   60.000000 Hz   4:3     75.000 kHz    162.000000 MHz
    DMT 0x23:  1280x1024   60.019740 Hz   5:4     63.981 kHz    108.000000 MHz
  Detailed Timing Descriptors:
    DTD 1:  2560x1440   59.950550 Hz  16:9     88.787 kHz    241.500000 MHz (597 mm x 339 mm)
                 Hfront   48 Hsync  32 Hback   80 Hpol P
                 Vfront    3 Vsync   5 Vback   33 Vpol N
    Display Range Limits:
      Monitor ranges (Range Limits Only): 46-75 Hz V, 112-112 kHz H, max dotclock 310 MHz
    Display Product Name: 'HP 27 QD'
    Display Product Serial Number: ...
  Extension blocks: 1
Checksum: 0x8d

----------------

Block 1, CTA-861 Extension Block:
  Revision: 3
  Underscans IT Video Formats by default
  Native DTDs: 1
  Video Data Block:
    VIC  16:  1920x1080   60.000000 Hz  16:9     67.500 kHz    148.500000 MHz
    VIC   4:  1280x720    60.000000 Hz  16:9     45.000 kHz     74.250000 MHz
    VIC   3:   720x480    59.940060 Hz  16:9     31.469 kHz     27.000000 MHz
    VIC   2:   720x480    59.940060 Hz   4:3     31.469 kHz     27.000000 MHz
    VIC  31:  1920x1080   50.000000 Hz  16:9     56.250 kHz    148.500000 MHz
    VIC  19:  1280x720    50.000000 Hz  16:9     37.500 kHz     74.250000 MHz
    VIC  18:   720x576    50.000000 Hz  16:9     31.250 kHz     27.000000 MHz
    VIC  17:   720x576    50.000000 Hz   4:3     31.250 kHz     27.000000 MHz
    VIC   1:   640x480    59.940476 Hz   4:3     31.469 kHz     25.175000 MHz
  Colorimetry Data Block:
    BT2020cYCC
    BT2020YCC
    BT2020RGB
  HDR Static Metadata Data Block:
    Electro optical transfer functions:
      Traditional gamma - SDR luminance range
      Traditional gamma - HDR luminance range
      SMPTE ST2084
    Supported static metadata descriptors:
      Static metadata type 1
    Desired content max luminance: 115 (603.666 cd/m^2)
    Desired content max frame-average luminance: 90 (351.250 cd/m^2)
    Desired content min luminance: 1 (0.000 cd/m^2)
  Detailed Timing Descriptors:
    DTD 2:  1920x1080   60.000000 Hz  16:9     67.500 kHz    148.500000 MHz (597 mm x 339 mm)
                 Hfront   88 Hsync  44 Hback  148 Hpol P
                 Vfront    4 Vsync   5 Vback   36 Vpol P
    DTD 3:  1920x1080   50.000000 Hz  16:9     56.250 kHz    148.500000 MHz (597 mm x 339 mm)
                 Hfront  528 Hsync  44 Hback  148 Hpol P
                 Vfront    4 Vsync   5 Vback   36 Vpol P
    DTD 4:  2560x1440   74.970923 Hz  16:9    111.857 kHz    304.250000 MHz (597 mm x 339 mm)
                 Hfront   48 Hsync  32 Hback   80 Hpol P
                 Vfront    3 Vsync   5 Vback   44 Vpol N
    DTD 5:  1920x1080   74.972503 Hz  16:9     83.894 kHz    174.500000 MHz (597 mm x 339 mm)
                 Hfront   48 Hsync  32 Hback   80 Hpol P
                 Vfront    3 Vsync   5 Vback   31 Vpol N
Checksum: 0xda  Unused space in Extension Block: 30 bytes

----------------

Warnings:

Block 1, CTA-861 Extension Block:
  Video Data Block: VIC 16 and the first DTD are not identical. Is this intended?
  Colorimetry Data Block: Set the sRGB colorimetry bit to avoid interop issues.
EDID:
  Base EDID: Some timings are out of range of the Monitor Ranges:
    Horizontal Freq: 31.250 - 111.856 kHz (Monitor: 112.000 - 112.000 kHz)

Failures:

Block 1, CTA-861 Extension Block:
  Missing VCDB, needed for Set Selectable RGB Quantization to avoid interop issues.
EDID:
  Extension Block 2 started with EDID header, ignoring Extension Blocks >= 2.

EDID conformity: FAIL
