edid-decode (hex):

00 ff ff ff ff ff ff 00 4c a3 50 32 00 00 00 00
00 10 01 03 80 21 15 78 0a 87 f5 94 57 4f 8c 27
27 50 54 00 00 00 01 01 01 01 01 01 01 01 01 01
01 01 01 01 01 01 93 2e 90 a0 60 1a 1e 40 30 20
26 00 4b cf 10 00 00 19 00 00 00 0f 00 00 00 00
00 00 00 00 00 3c d2 02 64 00 00 00 00 fe 00 46
44 31 36 31 02 31 35 34 50 32 0a 20 00 00 00 fe
00 28 3f 48 54 7d a3 d3 ff 02 01 0a 20 20 00 58

----------------

Block 0, Base EDID:
  EDID Structure Version & Revision: 1.3
  Vendor & Product Identification:
    Manufacturer: SEC
    Model: 12880
    Made in: 2006
  Basic Display Parameters & Features:
    Digital display
    Maximum image size: 33 cm x 21 cm
    Gamma: 2.20
    RGB color display
    First detailed timing is the preferred timing
  Color Characteristics:
    Red  : 0.5800, 0.3398
    Green: 0.3095, 0.5498
    Blue : 0.1552, 0.1552
    White: 0.3134, 0.3291
  Established Timings I & II: none
  Standard Timings: none
  Detailed Timing Descriptors:
    DTD 1:  1680x1050   59.998994 Hz  16:10    64.799 kHz    119.230000 MHz (331 mm x 207 mm)
                 Hfront   48 Hsync  32 Hback   80 Hpol N
                 Vfront    2 Vsync   6 Vback   22 Vpol N
    Manufacturer-Specified Display Descriptor (0x0f): 00 0f 00 00 00 00 00 00 00 00 00 3c d2 02 64 00 '...........<..d.'
    Alphanumeric Data String: 'FD161.154P2'
    Alphanumeric Data String: '(?HT}..'
Checksum: 0x58

----------------

Warnings:

Block 0, Base EDID:
  Alphanumeric Data String: Non-ASCII character 0x02 at position 5, can cause problems.
  Alphanumeric Data String: Non-ASCII character 0xa3 at position 5, can cause problems.
  Alphanumeric Data String: Non-ASCII character 0xd3 at position 6, can cause problems.

Failures:

Block 0, Base EDID:
  Alphanumeric Data String: 0xff byte at position 7.
  Missing Display Product Name.
  Missing Display Range Limits Descriptor.

EDID conformity: FAIL
