edid-decode (hex):

00 ff ff ff ff ff ff 00 04 72 a6 09 a9 34 60 14
2e 1f 01 04 a5 46 27 78 3b 00 85 a2 57 54 9b 21
0f 50 54 bf ef 80 71 4f 81 80 81 40 81 00 81 c0
95 00 b3 00 01 01 44 3a 80 18 71 38 32 40 58 2c
45 00 ba 88 21 00 00 1a 00 00 00 fd 0c 30 f0 10
10 3c 01 0a 20 20 20 20 20 20 00 00 00 fc 00 45
44 33 32 30 51 20 58 0a 20 20 20 20 00 00 00 ff
00 32 31 34 36 30 33 34 41 39 33 57 30 31 01 7f

02 03 23 f1 48 01 03 04 90 11 13 9f 3f 23 09 07
05 83 01 00 00 6d 1a 00 00 02 01 30 f0 00 00 00
00 00 00 c0 de 80 18 71 38 d0 42 58 2c 00 0b ba
88 21 00 00 1a 21 e7 80 18 71 38 26 42 58 2c 00
0b ba 88 21 00 00 1a 08 e8 80 18 71 38 92 44 58
2c 00 0b ba 88 21 00 00 1a 08 e8 80 18 71 38 2d
40 58 2c 45 00 ba 88 21 00 00 1e 00 00 00 00 00
00 00 00 00 00 00 00 00 00 00 00 00 00 00 00 ea

00 ff ff ff ff ff ff 00 04 72 a6 09 a9 34 60 14
2e 1f 01 04 a5 46 27 78 3b 00 85 a2 57 54 9b 21
0f 50 54 bf ef 80 71 4f 81 80 81 40 81 00 81 c0
95 00 b3 00 01 01 44 3a 80 18 71 38 32 40 58 2c
45 00 ba 88 21 00 00 1a 00 00 00 fd 0c 30 f0 10
10 3c 01 0a 20 20 20 20 20 20 00 00 00 fc 00 45
44 33 32 30 51 20 58 0a 20 20 20 20 00 00 00 ff
00 32 31 34 36 30 33 34 41 39 33 57 30 31 01 7f

02 03 23 f1 48 01 03 04 90 11 13 9f 3f 23 09 07
05 83 01 00 00 6d 1a 00 00 02 01 30 f0 00 00 00
00 00 00 c0 de 80 18 71 38 d0 42 58 2c 00 0b ba
88 21 00 00 1a 21 e7 80 18 71 38 26 42 58 2c 00
0b ba 88 21 00 00 1a 08 e8 80 18 71 38 92 44 58
2c 00 0b ba 88 21 00 00 1a 08 e8 80 18 71 38 2d
40 58 2c 45 00 ba 88 21 00 00 1e 00 00 00 00 00
00 00 00 00 00 00 00 00 00 00 00 00 00 00 00 ea

----------------

Block 0, Base EDID:
  EDID Structure Version & Revision: 1.4
  Vendor & Product Identification:
    Manufacturer: ACR
    Model: 2470
    Serial Number: ...
    Made in: week 46 of 2021
  Basic Display Parameters & Features:
    Digital display
    Bits per primary color channel: 8
    DisplayPort interface
    Maximum image size: 70 cm x 39 cm
    Gamma: 2.20
    DPMS levels: Off
    Supported color formats: RGB 4:4:4, YCrCb 4:4:4, YCrCb 4:2:2
    First detailed timing includes the native pixel format and preferred refresh rate
    Display supports continuous frequencies
  Color Characteristics:
    Red  : 0.6328, 0.3398
    Green: 0.3281, 0.6054
    Blue : 0.1308, 0.0585
    White: 0.3134, 0.3291
  Established Timings I & II:
    IBM     :   720x400    70.081663 Hz   9:5     31.467 kHz     28.320000 MHz
    DMT 0x04:   640x480    59.940476 Hz   4:3     31.469 kHz     25.175000 MHz
    Apple   :   640x480    66.666667 Hz   4:3     35.000 kHz     30.240000 MHz
    DMT 0x05:   640x480    72.808802 Hz   4:3     37.861 kHz     31.500000 MHz
    DMT 0x06:   640x480    75.000000 Hz   4:3     37.500 kHz     31.500000 MHz
    DMT 0x08:   800x600    56.250000 Hz   4:3     35.156 kHz     36.000000 MHz
    DMT 0x09:   800x600    60.316541 Hz   4:3     37.879 kHz     40.000000 MHz
    DMT 0x0a:   800x600    72.187572 Hz   4:3     48.077 kHz     50.000000 MHz
    DMT 0x0b:   800x600    75.000000 Hz   4:3     46.875 kHz     49.500000 MHz
    Apple   :   832x624    74.551266 Hz   4:3     49.726 kHz     57.284000 MHz
    DMT 0x10:  1024x768    60.003840 Hz   4:3     48.363 kHz     65.000000 MHz
    DMT 0x11:  1024x768    70.069359 Hz   4:3     56.476 kHz     75.000000 MHz
    DMT 0x12:  1024x768    75.028582 Hz   4:3     60.023 kHz     78.750000 MHz
    DMT 0x24:  1280x1024   75.024675 Hz   5:4     79.976 kHz    135.000000 MHz
    Apple   :  1152x870    75.061550 Hz 192:145   68.681 kHz    100.000000 MHz
  Standard Timings:
    DMT 0x15:  1152x864    75.000000 Hz   4:3     67.500 kHz    108.000000 MHz
    DMT 0x23:  1280x1024   60.019740 Hz   5:4     63.981 kHz    108.000000 MHz
    DMT 0x20:  1280x960    60.000000 Hz   4:3     60.000 kHz    108.000000 MHz
    DMT 0x1c:  1280x800    59.810326 Hz  16:10    49.702 kHz     83.500000 MHz
    DMT 0x55:  1280x720    60.000000 Hz  16:9     45.000 kHz     74.250000 MHz
    DMT 0x2f:  1440x900    59.887445 Hz  16:10    55.935 kHz    106.500000 MHz
    DMT 0x3a:  1680x1050   59.954250 Hz  16:10    65.290 kHz    146.250000 MHz
  Detailed Timing Descriptors:
    DTD 1:  1920x1080   60.000000 Hz  16:9     67.800 kHz    149.160000 MHz (698 mm x 392 mm)
                 Hfront   88 Hsync  44 Hback  148 Hpol P
                 Vfront    4 Vsync   5 Vback   41 Vpol N
    Display Range Limits:
      Monitor ranges (Range Limits Only): 48-240 Hz V, 271-271 kHz H, max dotclock 600 MHz
    Display Product Name: 'ED320Q X'
    Display Product Serial Number: ...
  Extension blocks: 1
Checksum: 0x7f

----------------

Block 1, CTA-861 Extension Block:
  Revision: 3
  Underscans IT Video Formats by default
  Basic audio support
  Supports YCbCr 4:4:4
  Supports YCbCr 4:2:2
  Native detailed modes: 1
  Video Data Block:
    VIC   1:   640x480    59.940476 Hz   4:3     31.469 kHz     25.175000 MHz
    VIC   3:   720x480    59.940060 Hz  16:9     31.469 kHz     27.000000 MHz
    VIC   4:  1280x720    60.000000 Hz  16:9     45.000 kHz     74.250000 MHz
    VIC  16:  1920x1080   60.000000 Hz  16:9     67.500 kHz    148.500000 MHz (native)
    VIC  17:   720x576    50.000000 Hz   4:3     31.250 kHz     27.000000 MHz
    VIC  19:  1280x720    50.000000 Hz  16:9     37.500 kHz     74.250000 MHz
    VIC  31:  1920x1080   50.000000 Hz  16:9     56.250 kHz    148.500000 MHz (native)
    VIC  63:  1920x1080  120.000000 Hz  16:9    135.000 kHz    297.000000 MHz
  Audio Data Block:
    Linear PCM:
      Max channels: 2
      Supported sample rates (kHz): 48 44.1 32
      Supported sample sizes (bits): 24 16
  Speaker Allocation Data Block:
    FL/FR - Front Left/Right
  Vendor-Specific Data Block (AMD), OUI 00-00-1A:
    Version: 2
    Feature Caps: 0x01
    Minimum Refresh Rate: 48 Hz
    Maximum Refresh Rate: 240 Hz
    Flags 1.x: 0x00
    Flags 2.x: 0x00
    Maximum luminance: 0 (50.000 cd/m^2)
    Minimum luminance: 0 (0.000 cd/m^2)
    Unknown: 0x00 0x00
  Detailed Timing Descriptors:
    DTD 2:  1920x1080  144.000000 Hz  16:9    259.200 kHz    570.240000 MHz (698 mm x 392 mm)
                 Hfront   88 Hsync  44 Hback  148 Hpol P
                 Vfront   32 Vsync  48 Vback  640 Vpol N
    DTD 3:  1920x1080  165.000000 Hz  16:9    268.950 kHz    591.690000 MHz (698 mm x 392 mm)
                 Hfront   88 Hsync  44 Hback  148 Hpol P
                 Vfront   32 Vsync  48 Vback  470 Vpol N
    DTD 4:  1920x1080  120.000000 Hz  16:9    270.000 kHz    594.000000 MHz (698 mm x 392 mm)
                 Hfront   88 Hsync  44 Hback  148 Hpol P
                 Vfront   32 Vsync  48 Vback 1090 Vpol N
    DTD 5:  1920x1080  240.000000 Hz  16:9    270.000 kHz    594.000000 MHz (698 mm x 392 mm)
                 Hfront   88 Hsync  44 Hback  148 Hpol P
                 Vfront    4 Vsync   5 Vback   36 Vpol P
Checksum: 0xea  Unused space in Extension Block: 20 bytes

----------------

Block 2, Unknown EDID Extension Block 0x00:
  00 ff ff ff ff ff ff 00 04 72 a6 09 a9 34 60 14 '.........r...4`.'
  2e 1f 01 04 a5 46 27 78 3b 00 85 a2 57 54 9b 21 '.....F'x;...WT.!'
  0f 50 54 bf ef 80 71 4f 81 80 81 40 81 00 81 c0 '.PT...qO...@....'
  95 00 b3 00 01 01 44 3a 80 18 71 38 32 40 58 2c '......D:..q82@X,'
  45 00 ba 88 21 00 00 1a 00 00 00 fd 0c 30 f0 10 'E...!........0..'
  10 3c 01 0a 20 20 20 20 20 20 00 00 00 fc 00 45 '.<..      .....E'
  44 33 32 30 51 20 58 0a 20 20 20 20 00 00 00 ff 'D320Q X.    ....'
  00 32 31 34 36 30 33 34 41 39 33 57 30 31 01 7f '.2146034A93W01..'
Checksum: 0x7f

----------------

Block 3, CTA-861 Extension Block:
  Revision: 3
  Underscans IT Video Formats by default
  Basic audio support
  Supports YCbCr 4:4:4
  Supports YCbCr 4:2:2
  Native detailed modes: 1
  Video Data Block:
    VIC   1:   640x480    59.940476 Hz   4:3     31.469 kHz     25.175000 MHz
    VIC   3:   720x480    59.940060 Hz  16:9     31.469 kHz     27.000000 MHz
    VIC   4:  1280x720    60.000000 Hz  16:9     45.000 kHz     74.250000 MHz
    VIC  16:  1920x1080   60.000000 Hz  16:9     67.500 kHz    148.500000 MHz (native)
    VIC  17:   720x576    50.000000 Hz   4:3     31.250 kHz     27.000000 MHz
    VIC  19:  1280x720    50.000000 Hz  16:9     37.500 kHz     74.250000 MHz
    VIC  31:  1920x1080   50.000000 Hz  16:9     56.250 kHz    148.500000 MHz (native)
    VIC  63:  1920x1080  120.000000 Hz  16:9    135.000 kHz    297.000000 MHz
  Audio Data Block:
    Linear PCM:
      Max channels: 2
      Supported sample rates (kHz): 48 44.1 32
      Supported sample sizes (bits): 24 16
  Speaker Allocation Data Block:
    FL/FR - Front Left/Right
  Vendor-Specific Data Block (AMD), OUI 00-00-1A:
    Version: 2
    Feature Caps: 0x01
    Minimum Refresh Rate: 48 Hz
    Maximum Refresh Rate: 240 Hz
    Flags 1.x: 0x00
    Flags 2.x: 0x00
    Maximum luminance: 0 (50.000 cd/m^2)
    Minimum luminance: 0 (0.000 cd/m^2)
    Unknown: 0x00 0x00
  Detailed Timing Descriptors:
    DTD 6:  1920x1080  144.000000 Hz  16:9    259.200 kHz    570.240000 MHz (698 mm x 392 mm)
                 Hfront   88 Hsync  44 Hback  148 Hpol P
                 Vfront   32 Vsync  48 Vback  640 Vpol N
    DTD 7:  1920x1080  165.000000 Hz  16:9    268.950 kHz    591.690000 MHz (698 mm x 392 mm)
                 Hfront   88 Hsync  44 Hback  148 Hpol P
                 Vfront   32 Vsync  48 Vback  470 Vpol N
    DTD 8:  1920x1080  120.000000 Hz  16:9    270.000 kHz    594.000000 MHz (698 mm x 392 mm)
                 Hfront   88 Hsync  44 Hback  148 Hpol P
                 Vfront   32 Vsync  48 Vback 1090 Vpol N
    DTD 9:  1920x1080  240.000000 Hz  16:9    270.000 kHz    594.000000 MHz (698 mm x 392 mm)
                 Hfront   88 Hsync  44 Hback  148 Hpol P
                 Vfront    4 Vsync   5 Vback   36 Vpol P
Checksum: 0xea  Unused space in Extension Block: 20 bytes

----------------

Warnings:

Block 1, CTA-861 Extension Block:
  Video Data Block: VIC 1 and the first DTD are not identical. Is this intended?
  Video Data Block: All VICs are in ascending order, and the first (preferred) VIC <= 4, is that intended?
  Display Product Serial Number is set, so the Serial Number in the Base EDID should be 0.
  Add a Colorimetry Data Block with the sRGB colorimetry bit set to avoid interop issues.
Block 3, CTA-861 Extension Block:
  Video Data Block: All VICs are in ascending order, and the first (preferred) VIC <= 4, is that intended?
EDID:
  Base EDID: Some timings are out of range of the Monitor Ranges:
    Horizontal Freq: 31.250 - 270.000 kHz (Monitor: 271.000 - 271.000 kHz)
  CTA-861: Multiple native progressive timings are defined.

Failures:

Block 1, CTA-861 Extension Block:
  Missing VCDB, needed for Set Selectable RGB Quantization to avoid interop issues.
Block 2, Base EDID:
  Unknown Extension Block.
Block 3, CTA-861 Extension Block:
  Video Data Block: Duplicate VIC 1.
  Video Data Block: Duplicate VIC 3.
  Video Data Block: Duplicate VIC 4.
  Video Data Block: Duplicate VIC 16.
  Video Data Block: Duplicate VIC 17.
  Video Data Block: Duplicate VIC 19.
  Video Data Block: Duplicate VIC 31.
  Video Data Block: Duplicate VIC 63.
  Speaker Allocation Data Block: Only one instance of this Data Block is allowed.
EDID:
  Base EDID: EDID specified 1 extension block(s), but found 3 extension block(s).

EDID conformity: FAIL
