edid-decode (hex):

00 ff ff ff ff ff ff 00 26 cf 15 05 00 00 00 00
00 1c 01 04 a5 1b 12 78 0a 1d 30 a7 50 47 97 27
13 50 54 00 00 00 01 01 01 01 01 01 01 01 01 01
01 01 01 01 01 01 4c 81 80 c8 70 00 14 50 18 30
a5 00 10 b6 10 00 00 19 00 00 00 fe 00 4d 31 33
30 4e 56 34 31 20 52 30 20 0a 00 00 00 03 00 04
35 ff 05 3c 90 28 17 3f 90 00 00 00 00 00 00 03
00 06 1a ff 0f 3c 24 28 0b 3f 24 01 01 00 00 b6

00 ff ff ff ff ff ff 00 26 cf 15 05 00 00 00 00
00 1c 01 04 a5 1b 12 78 0a 1d 30 a7 50 47 97 27
13 50 54 00 00 00 01 01 01 01 01 01 01 01 01 01
01 01 01 01 01 01 4c 81 80 c8 70 00 14 50 18 30
a5 00 10 b6 10 00 00 19 00 00 00 fe 00 4d 31 33
30 4e 56 34 31 20 52 30 20 0a 00 00 00 03 00 04
35 ff 05 3c 90 28 17 3f 90 00 00 00 00 00 00 03
00 06 1a ff 0f 3c 24 28 0b 3f 24 01 01 00 00 b6

----------------

Block 0, Base EDID:
  EDID Structure Version & Revision: 1.4
  Vendor & Product Identification:
    Manufacturer: IVO
    Model: 1301
    Made in: 2018
  Basic Display Parameters & Features:
    Digital display
    Bits per primary color channel: 8
    DisplayPort interface
    Maximum image size: 27 cm x 18 cm
    Gamma: 2.20
    Supported color formats: RGB 4:4:4, YCrCb 4:4:4
    First detailed timing includes the native pixel format and preferred refresh rate
  Color Characteristics:
    Red  : 0.6523, 0.3134
    Green: 0.2802, 0.5908
    Blue : 0.1523, 0.0771
    White: 0.3125, 0.3281
  Established Timings I & II: none
  Standard Timings: none
  Detailed Timing Descriptors:
    DTD 1:  1920x1280  120.101597 Hz   3:2    156.132 kHz    331.000000 MHz (272 mm x 182 mm)
                 Hfront   24 Hsync  48 Hback  128 Hpol N
                 Vfront   10 Vsync   5 Vback    5 Vpol N
    Alphanumeric Data String: 'M130NV41 R0 '
    Manufacturer-Specified Display Descriptor (0x03): 00 03 00 04 35 ff 05 3c 90 28 17 3f 90 00 00 00 '....5..<.(.?....'
    Manufacturer-Specified Display Descriptor (0x03): 00 03 00 06 1a ff 0f 3c 24 28 0b 3f 24 01 01 00 '.......<$(.?$...'
Checksum: 0xb6

----------------

Warnings:

Block 0, Base EDID:
  Missing Display Product Name.

Failures:

Block 0, Base EDID:
  Alphanumeric Data String: One or more trailing spaces before newline.
EDID:
  Extension Block 1 started with EDID header, ignoring Extension Blocks >= 1.

EDID conformity: FAIL
