edid-decode (hex):

00 ff ff ff ff ff ff 00 36 69 b4 3c 00 00 00 00
23 20 01 04 b5 46 1e 78 3b 1c 95 a7 55 49 a2 26
0f 50 54 bf ef 00 d1 c0 d1 fc b3 00 b3 3c 95 00
95 3c 81 80 81 bc d3 46 00 bc a0 38 12 40 30 20
3a 00 b2 23 21 00 00 1e 00 00 00 fd 00 30 c8 eb
eb 41 01 0a 20 20 20 20 20 20 00 00 00 fc 00 4d
53 49 20 4d 41 47 33 30 31 43 52 32 00 00 00 ff
00 30 30 30 30 30 30 30 30 30 30 30 30 31 01 86

02 03 2a 71 4f 01 02 03 11 12 13 0f 1d 1e 0e 90
1f 04 3f 5b 23 09 07 07 83 01 00 00 e2 00 c0 e3
05 e3 01 e6 06 07 01 5a 5a 1c fe a9 00 a0 a0 38
1f 40 30 2e 3a 00 b2 23 21 00 00 1a dc 91 00 bc
a0 38 33 40 30 20 35 00 b2 23 21 00 00 1a e0 fc
00 a0 a0 38 6e 40 30 20 3a 00 b2 23 21 00 00 1e
00 00 00 00 00 00 00 00 00 00 00 00 00 00 00 00
00 00 00 00 00 00 00 00 00 00 00 00 00 00 00 71

00 ff ff ff ff ff ff 00 36 69 b4 3c 00 00 00 00
23 20 01 04 b5 46 1e 78 3b 1c 95 a7 55 49 a2 26
0f 50 54 bf ef 00 d1 c0 d1 fc b3 00 b3 3c 95 00
95 3c 81 80 81 bc d3 46 00 bc a0 38 12 40 30 20
3a 00 b2 23 21 00 00 1e 00 00 00 fd 00 30 c8 eb
eb 41 01 0a 20 20 20 20 20 20 00 00 00 fc 00 4d
53 49 20 4d 41 47 33 30 31 43 52 32 00 00 00 ff
00 30 30 30 30 30 30 30 30 30 30 30 30 31 01 86

02 03 2a 71 4f 01 02 03 11 12 13 0f 1d 1e 0e 90
1f 04 3f 5b 23 09 07 07 83 01 00 00 e2 00 c0 e3
05 e3 01 e6 06 07 01 5a 5a 1c fe a9 00 a0 a0 38
1f 40 30 2e 3a 00 b2 23 21 00 00 1a dc 91 00 bc
a0 38 33 40 30 20 35 00 b2 23 21 00 00 1a e0 fc
00 a0 a0 38 6e 40 30 20 3a 00 b2 23 21 00 00 1e
00 00 00 00 00 00 00 00 00 00 00 00 00 00 00 00
00 00 00 00 00 00 00 00 00 00 00 00 00 00 00 71

----------------

Block 0, Base EDID:
  EDID Structure Version & Revision: 1.4
  Vendor & Product Identification:
    Manufacturer: MSI
    Model: 15540
    Made in: week 35 of 2022
  Basic Display Parameters & Features:
    Digital display
    Bits per primary color channel: 10
    DisplayPort interface
    Maximum image size: 70 cm x 30 cm
    Gamma: 2.20
    DPMS levels: Off
    Supported color formats: RGB 4:4:4, YCrCb 4:4:4, YCrCb 4:2:2
    First detailed timing includes the native pixel format and preferred refresh rate
    Display supports continuous frequencies
  Color Characteristics:
    Red  : 0.6523, 0.3330
    Green: 0.2880, 0.6328
    Blue : 0.1503, 0.0595
    White: 0.3134, 0.3291
  Established Timings I & II:
    IBM     :   720x400    70.081663 Hz   9:5     31.467 kHz     28.320000 MHz
    DMT 0x04:   640x480    59.940476 Hz   4:3     31.469 kHz     25.175000 MHz
    Apple   :   640x480    66.666667 Hz   4:3     35.000 kHz     30.240000 MHz
    DMT 0x05:   640x480    72.808802 Hz   4:3     37.861 kHz     31.500000 MHz
    DMT 0x06:   640x480    75.000000 Hz   4:3     37.500 kHz     31.500000 MHz
    DMT 0x08:   800x600    56.250000 Hz   4:3     35.156 kHz     36.000000 MHz
    DMT 0x09:   800x600    60.316541 Hz   4:3     37.879 kHz     40.000000 MHz
    DMT 0x0a:   800x600    72.187572 Hz   4:3     48.077 kHz     50.000000 MHz
    DMT 0x0b:   800x600    75.000000 Hz   4:3     46.875 kHz     49.500000 MHz
    Apple   :   832x624    74.551266 Hz   4:3     49.726 kHz     57.284000 MHz
    DMT 0x10:  1024x768    60.003840 Hz   4:3     48.363 kHz     65.000000 MHz
    DMT 0x11:  1024x768    70.069359 Hz   4:3     56.476 kHz     75.000000 MHz
    DMT 0x12:  1024x768    75.028582 Hz   4:3     60.023 kHz     78.750000 MHz
    DMT 0x24:  1280x1024   75.024675 Hz   5:4     79.976 kHz    135.000000 MHz
  Standard Timings:
    DMT 0x52:  1920x1080   60.000000 Hz  16:9     67.500 kHz    148.500000 MHz
    GTF     :  1920x1080  119.999987 Hz  16:9    138.840 kHz    368.759000 MHz
    DMT 0x3a:  1680x1050   59.954250 Hz  16:10    65.290 kHz    146.250000 MHz
    GTF     :  1680x1050  120.000000 Hz  16:10   135.000 kHz    313.200000 MHz
    DMT 0x2f:  1440x900    59.887445 Hz  16:10    55.935 kHz    106.500000 MHz
    GTF     :  1440x900   119.999896 Hz  16:10   115.800 kHz    229.747000 MHz
    DMT 0x23:  1280x1024   60.019740 Hz   5:4     63.981 kHz    108.000000 MHz
    GTF     :  1280x1024  120.000185 Hz   5:4    131.640 kHz    233.793000 MHz
  Detailed Timing Descriptors:
    DTD 1:  2560x1080   60.090067 Hz  64:27    65.979 kHz    181.310000 MHz (690 mm x 291 mm)
                 Hfront   48 Hsync  32 Hback  108 Hpol P
                 Vfront    3 Vsync  10 Vback    5 Vpol P
    Display Range Limits:
      Monitor ranges (Range Limits Only): 48-200 Hz V, 235-235 kHz H, max dotclock 650 MHz
    Display Product Name: 'MSI MAG301CR2'
    Display Product Serial Number: ...
  Extension blocks: 1
Checksum: 0x86

----------------

Block 1, CTA-861 Extension Block:
  Revision: 3
  Basic audio support
  Supports YCbCr 4:4:4
  Supports YCbCr 4:2:2
  Native DTDs: 1
  Video Data Block:
    VIC   1:   640x480    59.940476 Hz   4:3     31.469 kHz     25.175000 MHz
    VIC   2:   720x480    59.940060 Hz   4:3     31.469 kHz     27.000000 MHz
    VIC   3:   720x480    59.940060 Hz  16:9     31.469 kHz     27.000000 MHz
    VIC  17:   720x576    50.000000 Hz   4:3     31.250 kHz     27.000000 MHz
    VIC  18:   720x576    50.000000 Hz  16:9     31.250 kHz     27.000000 MHz
    VIC  19:  1280x720    50.000000 Hz  16:9     37.500 kHz     74.250000 MHz
    VIC  15:  1440x480    59.940060 Hz  16:9     31.469 kHz     54.000000 MHz
    VIC  29:  1440x576    50.000000 Hz   4:3     31.250 kHz     54.000000 MHz
    VIC  30:  1440x576    50.000000 Hz  16:9     31.250 kHz     54.000000 MHz
    VIC  14:  1440x480    59.940060 Hz   4:3     31.469 kHz     54.000000 MHz
    VIC  16:  1920x1080   60.000000 Hz  16:9     67.500 kHz    148.500000 MHz (native)
    VIC  31:  1920x1080   50.000000 Hz  16:9     56.250 kHz    148.500000 MHz
    VIC   4:  1280x720    60.000000 Hz  16:9     45.000 kHz     74.250000 MHz
    VIC  63:  1920x1080  120.000000 Hz  16:9    135.000 kHz    297.000000 MHz
    VIC  91:  2560x1080  100.000000 Hz  64:27   125.000 kHz    371.250000 MHz
  Audio Data Block:
    Linear PCM:
      Max channels: 2
      Supported sample rates (kHz): 48 44.1 32
      Supported sample sizes (bits): 24 20 16
  Speaker Allocation Data Block:
    FL/FR - Front Left/Right
  Video Capability Data Block:
    YCbCr quantization: Selectable (via AVI YQ)
    RGB quantization: Selectable (via AVI Q)
    PT scan behavior: No Data
    IT scan behavior: IT video formats not supported
    CE scan behavior: CE video formats not supported
  Colorimetry Data Block:
    xvYCC601
    xvYCC709
    BT2020cYCC
    BT2020YCC
    BT2020RGB
    Gamut Boundary Description Metadata Profile P0
  HDR Static Metadata Data Block:
    Electro optical transfer functions:
      Traditional gamma - SDR luminance range
      Traditional gamma - HDR luminance range
      SMPTE ST2084
    Supported static metadata descriptors:
      Static metadata type 1
    Desired content max luminance: 90 (351.250 cd/m^2)
    Desired content max frame-average luminance: 90 (351.250 cd/m^2)
    Desired content min luminance: 28 (0.042 cd/m^2)
  Detailed Timing Descriptors:
    DTD 2:  2560x1080  144.007783 Hz  64:27   159.993 kHz    435.180000 MHz (690 mm x 291 mm)
                 Hfront   48 Hsync  46 Hback   66 Hpol P
                 Vfront    3 Vsync  10 Vback   18 Vpol N
    DTD 3:  2560x1080  120.142034 Hz  64:27   135.881 kHz    373.400000 MHz (690 mm x 291 mm)
                 Hfront   48 Hsync  32 Hback  108 Hpol P
                 Vfront    3 Vsync   5 Vback   43 Vpol N
    DTD 4:  2560x1080  200.000000 Hz  64:27   238.000 kHz    647.360000 MHz (690 mm x 291 mm)
                 Hfront   48 Hsync  32 Hback   80 Hpol P
                 Vfront    3 Vsync  10 Vback   97 Vpol P
Checksum: 0x71  Unused space in Extension Block: 31 bytes

----------------

Warnings:

Block 0, Base EDID:
  Display Product Serial Number: ...
Block 1, CTA-861 Extension Block:
  IT Video Formats are overscanned by default, but normally this should be underscanned.
  Video Data Block: VIC 1 and the first DTD are not identical. Is this intended?
  Video Capability Data Block: IT scan behavior is expected to support underscanned.
  Video Capability Data Block: 'CE video formats not supported' makes no sense.
  Colorimetry Data Block: Set the sRGB colorimetry bit to avoid interop issues.
EDID:
  Base EDID: Some timings are out of range of the Monitor Ranges:
    Horizontal Freq: 31.250 - 238.000 kHz (Monitor: 235.000 - 235.000 kHz)

Failures:

EDID:
  Extension Block 2 started with EDID header, ignoring Extension Blocks >= 2.
  CTA-861: Native progressive timings are a mix of several resolutions.

EDID conformity: FAIL
