edid-decode (hex):

00 ff ff ff ff ff ff 00 30 e4 84 07 00 00 00 00
00 21 01 04 a5 22 16 78 07 2a 95 a5 54 4b 9d 26
0f 50 54 00 00 00 01 01 01 01 01 01 01 01 01 01
01 01 01 01 01 01 c0 72 00 a0 a0 40 c8 60 30 20
36 00 59 d7 10 00 00 1a 00 00 00 00 00 00 00 00
00 00 00 00 00 00 00 00 00 00 00 00 00 fe 00 32
46 43 36 43 80 31 36 30 57 51 47 0a 00 00 00 00
00 02 41 1f 9e 00 01 00 00 0f 41 0a 20 20 02 c3

70 20 79 02 00 20 00 13 3c e6 24 84 07 00 00 00
00 00 17 07 31 36 30 57 51 47 0a 21 01 1d 77 0d
6a 08 00 0a 40 06 88 52 8a 54 b8 74 9d 66 62 0f
02 45 54 b0 5c b0 5c cc 34 12 78 22 00 14 ff ed
11 85 ff 09 9f 00 2f 80 1f 00 3f 06 c7 00 02 00
05 00 25 00 09 ff ed 11 ff ed 11 3c f0 80 26 00
09 02 00 00 00 00 00 01 00 00 2b 00 0c 27 00 64
ef 00 00 27 00 30 3b 00 00 00 00 00 00 00 10 90

70 20 79 00 00 81 00 15 74 1a 00 00 03 01 3c f0
00 00 53 51 53 51 f0 00 00 00 00 00 00 00 00 00
00 00 00 00 00 00 00 00 00 00 00 00 00 00 00 00
00 00 00 00 00 00 00 00 00 00 00 00 00 00 00 00
00 00 00 00 00 00 00 00 00 00 00 00 00 00 00 00
00 00 00 00 00 00 00 00 00 00 00 00 00 00 00 00
00 00 00 00 00 00 00 00 00 00 00 00 00 00 00 00
00 00 00 00 00 00 00 00 00 00 00 00 00 00 db 90

00 ff ff ff ff ff ff 00 30 e4 84 07 00 00 00 00
00 21 01 04 a5 22 16 78 07 2a 95 a5 54 4b 9d 26
0f 50 54 00 00 00 01 01 01 01 01 01 01 01 01 01
01 01 01 01 01 01 c0 72 00 a0 a0 40 c8 60 30 20
36 00 59 d7 10 00 00 1a 00 00 00 00 00 00 00 00
00 00 00 00 00 00 00 00 00 00 00 00 00 fe 00 32
46 43 36 43 80 31 36 30 57 51 47 0a 00 00 00 00
00 02 41 1f 9e 00 01 00 00 0f 41 0a 20 20 02 c3

70 20 79 02 00 20 00 13 3c e6 24 84 07 00 00 00
00 00 17 07 31 36 30 57 51 47 0a 21 01 1d 77 0d
6a 08 00 0a 40 06 88 52 8a 54 b8 74 9d 66 62 0f
02 45 54 b0 5c b0 5c cc 34 12 78 22 00 14 ff ed
11 85 ff 09 9f 00 2f 80 1f 00 3f 06 c7 00 02 00
05 00 25 00 09 ff ed 11 ff ed 11 3c f0 80 26 00
09 02 00 00 00 00 00 01 00 00 2b 00 0c 27 00 64
ef 00 00 27 00 30 3b 00 00 00 00 00 00 00 10 90

70 20 79 00 00 81 00 15 74 1a 00 00 03 01 3c f0
00 00 53 51 53 51 f0 00 00 00 00 00 00 00 00 00
00 00 00 00 00 00 00 00 00 00 00 00 00 00 00 00
00 00 00 00 00 00 00 00 00 00 00 00 00 00 00 00
00 00 00 00 00 00 00 00 00 00 00 00 00 00 00 00
00 00 00 00 00 00 00 00 00 00 00 00 00 00 00 00
00 00 00 00 00 00 00 00 00 00 00 00 00 00 00 00
00 00 00 00 00 00 00 00 00 00 00 00 00 00 db 90

----------------

Block 0, Base EDID:
  EDID Structure Version & Revision: 1.4
  Vendor & Product Identification:
    Manufacturer: LGD
    Model: 1924
    Made in: 2023
  Basic Display Parameters & Features:
    Digital display
    Bits per primary color channel: 8
    DisplayPort interface
    Maximum image size: 34 cm x 22 cm
    Gamma: 2.20
    Supported color formats: RGB 4:4:4
    Default (sRGB) color space is primary color space
    First detailed timing includes the native pixel format and preferred refresh rate
    Display supports continuous frequencies
  Color Characteristics:
    Red  : 0.6445, 0.3300
    Green: 0.2949, 0.6152
    Blue : 0.1503, 0.0595
    White: 0.3134, 0.3291
  Established Timings I & II: none
  Standard Timings: none
  Detailed Timing Descriptors:
    DTD 1:  2560x1600   60.000000 Hz  16:10   108.000 kHz    293.760000 MHz (345 mm x 215 mm)
                 Hfront   48 Hsync  32 Hback   80 Hpol P
                 Vfront    3 Vsync   6 Vback  191 Vpol N
    Empty Descriptor
    Alphanumeric Data String: '2FC6C.160WQG'
    Manufacturer-Specified Display Descriptor (0x00): 00 00 00 02 41 1f 9e 00 01 00 00 0f 41 0a 20 20 '....A.......A.  '
  Extension blocks: 2
Checksum: 0xc3

----------------

Block 1, DisplayID Extension Block:
  Version: 2.0
  Extension Count: 0
  Display Product Primary Use Case: None of the listed primary use cases; generic display
  Product Identification Data Block (0x20), OUI 3C-E6-24:
    Product Code: 1924
    Year of Manufacture: 2023
    Product ID: 160WQG

  Display Parameters Data Block (0x21):
    Image size: 344.7 mm x 215.4 mm
    Display native pixel format: 2560x1600
    Scan Orientation: Left to Right, Top to Bottom
    Luminance Information: Guidance for the Source device
    Color Information: CIE 1931
    Audio Speaker Information: not integrated
    Native Color Chromaticity:
      Primary #1:  (0.645020, 0.330078)
      Primary #2:  (0.294922, 0.614990)
      Primary #3:  (0.149902, 0.060059)
      White Point: (0.312988, 0.329102)
    Native Maximum Luminance (Full Coverage): 300.000000 cd/m^2
    Native Maximum Luminance (10% Rectangular Coverage): 300.000000 cd/m^2
    Native Minimum Luminance: 0.299805 cd/m^2
    Native Color Depth: 8 bpc
    Display Device Technology: Active Matrix LCD
    Display Device Theme Preference: No Preference
    Native Gamma EOTF: 2.20
  Video Timing Modes Type 7 - Detailed Timings Data Block:
    DTD:  2560x1600  240.000000 Hz  16:10   432.000 kHz   1175.040000 MHz (aspect 16:10, no 3D stereo, preferred)
               Hfront   48 Hsync  32 Hback   80 Hpol P
               Vfront    3 Vsync   6 Vback  191 Vpol N
  Dynamic Video Timing Range Limits Data Block:
    Minimum Pixel Clock: 1175040 kHz
    Maximum Pixel Clock: 1175040 kHz
    Minimum Vertical Refresh Rate: 60 Hz
    Maximum Vertical Refresh Rate: 240 Hz
    Seamless Dynamic Video Timing Support: Yes
  Display Interface Features Data Block:
    Supported bpc for RGB encoding: 8
    Supported color space and EOTF standard combination 1: sRGB
  Adaptive Sync Data Block:
    Descriptor #1:
      Native Panel Range
      Fixed Average V-Total and Adaptive V-Total
      Supports Seamless Transition
      'Max Single Frame Duration Increase' field value without jitter impact
      'Max Single Frame Duration Decrease' field value without jitter impact
      Max Duration Increase: 0.00 ms
      Max Duration Decrease: 0.00 ms
      Min Refresh Rate: 100 Hz
      Max Refresh Rate: 240 Hz
    Descriptor #2:
      Native Panel Range
      Fixed Average V-Total and Adaptive V-Total
      Supports Seamless Transition
      'Max Single Frame Duration Increase' field value without jitter impact
      'Max Single Frame Duration Decrease' field value without jitter impact
      Max Duration Increase: 0.00 ms
      Max Duration Decrease: 0.00 ms
      Min Refresh Rate: 48 Hz
      Max Refresh Rate: 60 Hz
  Checksum: 0x10
Checksum: 0x90

----------------

Block 2, DisplayID Extension Block:
  Version: 2.0
  Extension Count: 0
  CTA-861 DisplayID Data Block:
  Vendor-Specific Data Block (AMD), OUI 00-00-1A:
    Version: 3
    Flags 1: 0x01
      FreeSync Supported
    Minimum Refresh Rate: 60 Hz
    Maximum Refresh Rate: 240 Hz
    Flags 5: 0x00
  Checksum: 0xdb
Checksum: 0x90

----------------

Warnings:

Block 0, Base EDID:
  Alphanumeric Data String: Non-ASCII character 0x80 at position 5, can cause problems.
  Missing Display Product Name.

Failures:

Block 0, Base EDID:
  Basic Display Parameters & Features: sRGB is signaled, but the chromaticities do not match.
  Empty Descriptor: Use Dummy Descriptor instead of all zeroes.
  Missing Display Range Limits Descriptor.
Block 1, DisplayID Extension Block:
  Expected 0 DisplayID Extension Block, but got 1.
EDID:
  Extension Block 3 started with EDID header, ignoring Extension Blocks >= 3.

EDID conformity: FAIL
