edid-decode (hex):

00 ff ff ff ff ff ff 00 0d ae 6f 17 00 00 00 00
22 1f 01 04 a5 26 15 78 02 05 c5 97 5b 53 8f 27
20 50 54 00 00 00 01 01 01 01 01 01 01 01 01 01
01 01 01 01 01 01 36 36 80 a0 70 38 20 40 30 20
a6 00 7d d6 10 00 00 18 00 00 00 fe 00 4e 31 37
33 48 43 45 2d 45 33 43 0a 20 00 00 00 fe 00 43
4d 4e 0a 20 20 20 20 20 20 20 20 20 00 00 00 fe
00 4e 31 37 33 48 43 45 2d 45 33 43 0a 20 00 ef

00 ff ff ff ff ff ff 00 0d ae 6f 17 00 00 00 00
22 1f 01 04 a5 26 15 78 02 05 c5 97 5b 53 8f 27
20 50 54 00 00 00 01 01 01 01 01 01 01 01 01 01
01 01 01 01 01 01 36 36 80 a0 70 38 20 40 30 20
a6 00 7d d6 10 00 00 18 00 00 00 fe 00 4e 31 37
33 48 43 45 2d 45 33 43 0a 20 00 00 00 fe 00 43
4d 4e 0a 20 20 20 20 20 20 20 20 20 00 00 00 fe
00 4e 31 37 33 48 43 45 2d 45 33 43 0a 20 00 ef

----------------

Block 0, Base EDID:
  EDID Structure Version & Revision: 1.4
  Vendor & Product Identification:
    Manufacturer: CMN
    Model: 5999
    Made in: week 34 of 2021
  Basic Display Parameters & Features:
    Digital display
    Bits per primary color channel: 8
    DisplayPort interface
    Maximum image size: 38 cm x 21 cm
    Gamma: 2.20
    Supported color formats: RGB 4:4:4
    First detailed timing includes the native pixel format and preferred refresh rate
  Color Characteristics:
    Red  : 0.5898, 0.3554
    Green: 0.3251, 0.5595
    Blue : 0.1552, 0.1250
    White: 0.3134, 0.3291
  Established Timings I & II: none
  Standard Timings: none
  Detailed Timing Descriptors:
    DTD 1:  1920x1080   60.001038 Hz  16:9     66.721 kHz    138.780000 MHz (381 mm x 214 mm)
                 Hfront   48 Hsync  32 Hback   80 Hpol N
                 Vfront   10 Vsync   6 Vback   16 Vpol N
    Alphanumeric Data String: 'N173HCE-E3C'
    Alphanumeric Data String: 'CMN'
    Alphanumeric Data String: 'N173HCE-E3C'
Checksum: 0xef

----------------

Warnings:

Block 0, Base EDID:
  Missing Display Product Name.

Failures:

EDID:
  Extension Block 1 started with EDID header, ignoring Extension Blocks >= 1.

EDID conformity: FAIL
