edid-decode (hex):

00 ff ff ff ff ff ff 00 28 89 4c 36 00 00 00 00
00 1d 01 04 a5 1b 12 78 03 2e b5 a5 54 4c 99 26
0d 50 54 00 00 00 01 01 01 01 01 01 01 01 01 01
01 01 01 01 01 01 58 98 b8 a0 b0 d0 39 70 78 10
4a 04 12 b7 10 00 00 1a e0 79 b8 a0 b0 d0 39 70
78 10 4a 04 12 b7 10 00 00 1a 00 00 00 fe 00 4a
44 49 20 20 20 20 20 a9 01 07 52 58 00 00 00 fe
00 4c 50 4d 31 33 30 4d 33 36 34 43 20 20 00 27

----------------

Block 0, Base EDID:
  EDID Structure Version & Revision: 1.4
  Vendor & Product Identification:
    Manufacturer: JDI
    Model: 13900
    Made in: 2019
  Basic Display Parameters & Features:
    Digital display
    Bits per primary color channel: 8
    DisplayPort interface
    Maximum image size: 27 cm x 18 cm
    Gamma: 2.20
    Supported color formats: RGB 4:4:4
    First detailed timing includes the native pixel format and preferred refresh rate
    Display supports continuous frequencies
  Color Characteristics:
    Red  : 0.6445, 0.3300
    Green: 0.2998, 0.5996
    Blue : 0.1503, 0.0537
    White: 0.3134, 0.3291
  Established Timings I & II: none
  Standard Timings: none
  Detailed Timing Descriptors:
    DTD 1:  3000x2000   59.998892 Hz   3:2    123.418 kHz    390.000000 MHz (274 mm x 183 mm)
                 Hfront  120 Hsync  16 Hback   24 Hpol P
                 Vfront   20 Vsync  10 Vback   27 Vpol N
    DTD 2:  3000x2000   47.999114 Hz   3:2     98.734 kHz    312.000000 MHz (274 mm x 183 mm)
                 Hfront  120 Hsync  16 Hback   24 Hpol P
                 Vfront   20 Vsync  10 Vback   27 Vpol N
    Alphanumeric Data String: 'JDI     ...RX'
    Alphanumeric Data String: 'LPM130M364C  '
Checksum: 0x27

----------------

Warnings:

Block 0, Base EDID:
  Alphanumeric Data String: Non-ASCII character 0xa9 at position 8, can cause problems.
  Alphanumeric Data String: Non-ASCII character 0x01 at position 9, can cause problems.
  Alphanumeric Data String: Non-ASCII character 0x07 at position 10, can cause problems.
  Missing Display Product Name.

Failures:

Block 0, Base EDID:
  Alphanumeric Data String: No newline, but one or more trailing spaces.
  Missing Display Range Limits Descriptor.

EDID conformity: FAIL
