edid-decode (hex):

00 ff ff ff ff ff ff 00 06 b3 05 27 01 01 01 01
29 21 01 04 b5 3c 22 78 3b 93 25 ad 4f 44 a9 26
0d 50 54 bf ef 00 71 4f 81 80 95 00 d1 c0 01 01
01 01 01 01 01 01 9e e8 00 78 a0 a0 67 50 08 20
98 04 55 50 21 00 00 1e 00 00 00 fd 00 30 aa f9
f9 42 01 0a 20 20 20 20 20 20 00 00 00 fc 00 56
47 32 37 41 51 4c 31 41 0a 20 20 20 00 00 00 ff
00 52 41 4c 4d 51 53 30 34 35 33 31 31 0a 02 bb

02 03 27 f1 4c 90 11 12 13 04 0e 0f 1d 1e 1f 40
3f 23 09 07 07 83 01 00 00 e2 00 6a e3 05 e0 01
e6 06 07 01 73 73 00 56 5e 00 a0 a0 a0 29 50 30
20 35 00 55 50 21 00 00 1c 6f c2 00 a0 a0 a0 55
50 30 20 35 00 55 50 21 00 00 1a 5a a0 00 a0 a0
a0 46 50 30 20 35 00 55 50 21 00 00 1a 00 00 00
00 00 00 00 00 00 00 00 00 00 00 00 00 00 00 00
00 00 00 00 00 00 00 00 00 00 00 00 00 00 00 c6

00 ff ff ff ff ff ff 00 06 b3 05 27 01 01 01 01
29 21 01 04 b5 3c 22 78 3b 93 25 ad 4f 44 a9 26
0d 50 54 bf ef 00 71 4f 81 80 95 00 d1 c0 01 01
01 01 01 01 01 01 9e e8 00 78 a0 a0 67 50 08 20
98 04 55 50 21 00 00 1e 00 00 00 fd 00 30 aa f9
f9 42 01 0a 20 20 20 20 20 20 00 00 00 fc 00 56
47 32 37 41 51 4c 31 41 0a 20 20 20 00 00 00 ff
00 52 41 4c 4d 51 53 30 34 35 33 31 31 0a 02 bb

00 ff ff ff ff ff ff 00 06 b3 05 27 01 01 01 01
29 21 01 04 b5 3c 22 78 3b 93 25 ad 4f 44 a9 26
0d 50 54 bf ef 00 71 4f 81 80 95 00 d1 c0 01 01
01 01 01 01 01 01 9e e8 00 78 a0 a0 67 50 08 20
98 04 55 50 21 00 00 1e 00 00 00 fd 00 30 aa f9
f9 42 01 0a 20 20 20 20 20 20 00 00 00 fc 00 56
47 32 37 41 51 4c 31 41 0a 20 20 20 00 00 00 ff
00 52 41 4c 4d 51 53 30 34 35 33 31 31 0a 02 bb

02 03 27 f1 4c 90 11 12 13 04 0e 0f 1d 1e 1f 40
3f 23 09 07 07 83 01 00 00 e2 00 6a e3 05 e0 01
e6 06 07 01 73 73 00 56 5e 00 a0 a0 a0 29 50 30
20 35 00 55 50 21 00 00 1c 6f c2 00 a0 a0 a0 55
50 30 20 35 00 55 50 21 00 00 1a 5a a0 00 a0 a0
a0 46 50 30 20 35 00 55 50 21 00 00 1a 00 00 00
00 00 00 00 00 00 00 00 00 00 00 00 00 00 00 00
00 00 00 00 00 00 00 00 00 00 00 00 00 00 00 c6

00 ff ff ff ff ff ff 00 06 b3 05 27 01 01 01 01
29 21 01 04 b5 3c 22 78 3b 93 25 ad 4f 44 a9 26
0d 50 54 bf ef 00 71 4f 81 80 95 00 d1 c0 01 01
01 01 01 01 01 01 9e e8 00 78 a0 a0 67 50 08 20
98 04 55 50 21 00 00 1e 00 00 00 fd 00 30 aa f9
f9 42 01 0a 20 20 20 20 20 20 00 00 00 fc 00 56
47 32 37 41 51 4c 31 41 0a 20 20 20 00 00 00 ff
00 52 41 4c 4d 51 53 30 34 35 33 31 31 0a 02 bb

----------------

Block 0, Base EDID:
  EDID Structure Version & Revision: 1.4
  Vendor & Product Identification:
    Manufacturer: AUS
    Model: 9989
    Serial Number: ...
    Made in: week 41 of 2023
  Basic Display Parameters & Features:
    Digital display
    Bits per primary color channel: 10
    DisplayPort interface
    Maximum image size: 60 cm x 34 cm
    Gamma: 2.20
    DPMS levels: Off
    Supported color formats: RGB 4:4:4, YCrCb 4:4:4, YCrCb 4:2:2
    First detailed timing includes the native pixel format and preferred refresh rate
    Display supports continuous frequencies
  Color Characteristics:
    Red  : 0.6777, 0.3095
    Green: 0.2656, 0.6630
    Blue : 0.1484, 0.0527
    White: 0.3134, 0.3291
  Established Timings I & II:
    IBM     :   720x400    70.081663 Hz   9:5     31.467 kHz     28.320000 MHz
    DMT 0x04:   640x480    59.940476 Hz   4:3     31.469 kHz     25.175000 MHz
    Apple   :   640x480    66.666667 Hz   4:3     35.000 kHz     30.240000 MHz
    DMT 0x05:   640x480    72.808802 Hz   4:3     37.861 kHz     31.500000 MHz
    DMT 0x06:   640x480    75.000000 Hz   4:3     37.500 kHz     31.500000 MHz
    DMT 0x08:   800x600    56.250000 Hz   4:3     35.156 kHz     36.000000 MHz
    DMT 0x09:   800x600    60.316541 Hz   4:3     37.879 kHz     40.000000 MHz
    DMT 0x0a:   800x600    72.187572 Hz   4:3     48.077 kHz     50.000000 MHz
    DMT 0x0b:   800x600    75.000000 Hz   4:3     46.875 kHz     49.500000 MHz
    Apple   :   832x624    74.551266 Hz   4:3     49.726 kHz     57.284000 MHz
    DMT 0x10:  1024x768    60.003840 Hz   4:3     48.363 kHz     65.000000 MHz
    DMT 0x11:  1024x768    70.069359 Hz   4:3     56.476 kHz     75.000000 MHz
    DMT 0x12:  1024x768    75.028582 Hz   4:3     60.023 kHz     78.750000 MHz
    DMT 0x24:  1280x1024   75.024675 Hz   5:4     79.976 kHz    135.000000 MHz
  Standard Timings:
    DMT 0x15:  1152x864    75.000000 Hz   4:3     67.500 kHz    108.000000 MHz
    DMT 0x23:  1280x1024   60.019740 Hz   5:4     63.981 kHz    108.000000 MHz
    DMT 0x2f:  1440x900    59.887445 Hz  16:10    55.935 kHz    106.500000 MHz
    DMT 0x52:  1920x1080   60.000000 Hz  16:9     67.500 kHz    148.500000 MHz
  Detailed Timing Descriptors:
    DTD 1:  2560x1440  144.006152 Hz  16:9    222.201 kHz    595.500000 MHz (597 mm x 336 mm)
                 Hfront    8 Hsync  32 Hback   80 Hpol P
                 Vfront   25 Vsync   8 Vback   70 Vpol P
    Display Range Limits:
      Monitor ranges (Range Limits Only): 48-170 Hz V, 249-249 kHz H, max dotclock 660 MHz
    Display Product Name: 'VG27AQL1A'
    Display Product Serial Number: ...
  Extension blocks: 2
Checksum: 0xbb

----------------

Block 1, CTA-861 Extension Block:
  Revision: 3
  Underscans IT Video Formats by default
  Basic audio support
  Supports YCbCr 4:4:4
  Supports YCbCr 4:2:2
  Native DTDs: 1
  Video Data Block:
    VIC  16:  1920x1080   60.000000 Hz  16:9     67.500 kHz    148.500000 MHz (native)
    VIC  17:   720x576    50.000000 Hz   4:3     31.250 kHz     27.000000 MHz
    VIC  18:   720x576    50.000000 Hz  16:9     31.250 kHz     27.000000 MHz
    VIC  19:  1280x720    50.000000 Hz  16:9     37.500 kHz     74.250000 MHz
    VIC   4:  1280x720    60.000000 Hz  16:9     45.000 kHz     74.250000 MHz
    VIC  14:  1440x480    59.940060 Hz   4:3     31.469 kHz     54.000000 MHz
    VIC  15:  1440x480    59.940060 Hz  16:9     31.469 kHz     54.000000 MHz
    VIC  29:  1440x576    50.000000 Hz   4:3     31.250 kHz     54.000000 MHz
    VIC  30:  1440x576    50.000000 Hz  16:9     31.250 kHz     54.000000 MHz
    VIC  31:  1920x1080   50.000000 Hz  16:9     56.250 kHz    148.500000 MHz
    VIC  64:  1920x1080  100.000000 Hz  16:9    112.500 kHz    297.000000 MHz
    VIC  63:  1920x1080  120.000000 Hz  16:9    135.000 kHz    297.000000 MHz
  Audio Data Block:
    Linear PCM:
      Max channels: 2
      Supported sample rates (kHz): 48 44.1 32
      Supported sample sizes (bits): 24 20 16
  Speaker Allocation Data Block:
    FL/FR - Front Left/Right
  Video Capability Data Block:
    YCbCr quantization: No Data
    RGB quantization: Selectable (via AVI Q)
    PT scan behavior: Always Underscanned
    IT scan behavior: Always Underscanned
    CE scan behavior: Always Underscanned
  Colorimetry Data Block:
    BT2020cYCC
    BT2020YCC
    BT2020RGB
    Gamut Boundary Description Metadata Profile P0
  HDR Static Metadata Data Block:
    Electro optical transfer functions:
      Traditional gamma - SDR luminance range
      Traditional gamma - HDR luminance range
      SMPTE ST2084
    Supported static metadata descriptors:
      Static metadata type 1
    Desired content max luminance: 115 (603.666 cd/m^2)
    Desired content max frame-average luminance: 115 (603.666 cd/m^2)
    Desired content min luminance: 0 (0.000 cd/m^2)
  Detailed Timing Descriptors:
    DTD 2:  2560x1440   59.950550 Hz  16:9     88.787 kHz    241.500000 MHz (597 mm x 336 mm)
                 Hfront   48 Hsync  32 Hback   80 Hpol N
                 Vfront    3 Vsync   5 Vback   33 Vpol P
    DTD 3:  2560x1440  119.997589 Hz  16:9    182.996 kHz    497.750000 MHz (597 mm x 336 mm)
                 Hfront   48 Hsync  32 Hback   80 Hpol P
                 Vfront    3 Vsync   5 Vback   77 Vpol N
    DTD 4:  2560x1440   99.946436 Hz  16:9    150.919 kHz    410.500000 MHz (597 mm x 336 mm)
                 Hfront   48 Hsync  32 Hback   80 Hpol P
                 Vfront    3 Vsync   5 Vback   62 Vpol N
Checksum: 0xc6  Unused space in Extension Block: 34 bytes

----------------

Warnings:

Block 0, Base EDID:
  Vendor & Product Identification: The serial number is one of the known dummy values, it should probably be set to 0.
Block 1, CTA-861 Extension Block:
  Video Data Block: VIC 16 and the first DTD are not identical. Is this intended?
  Video Capability Data Block: Set Selectable YCbCr Quantization to avoid interop issues.
  Video Capability Data Block: S_PT is equal to S_IT and S_CE, so should be set to 0 instead.
  Colorimetry Data Block: Set the sRGB colorimetry bit to avoid interop issues.
  Display Product Serial Number is set, so the Serial Number in the Base EDID should be 0.
EDID:
  Base EDID: Some timings are out of range of the Monitor Ranges:
    Horizontal Freq: 31.250 - 222.201 kHz (Monitor: 249.000 - 249.000 kHz)

Failures:

EDID:
  Extension Block 2 started with EDID header, ignoring Extension Blocks >= 2.
  Base EDID: EDID specified 2 extension block(s), but found 1 extension block(s).
  CTA-861: Native progressive timings are a mix of several resolutions.

EDID conformity: FAIL
