edid-decode (hex):

00 ff ff ff ff ff ff 00 22 f0 37 28 01 01 01 01
01 14 01 04 a5 22 13 78 22 54 15 9b 54 53 95 27
16 50 54 21 08 00 81 c0 81 80 01 01 01 01 01 01
01 01 01 01 01 01 66 21 56 aa 51 00 1e 30 46 8f
33 00 58 c2 10 00 00 1e 00 00 00 fd 00 39 3f 18
53 0e 00 0a 20 20 20 20 20 20 00 00 00 fc 00 48
50 20 4c 56 31 35 36 31 77 0a 20 20 00 00 00 ff
00 43 4e 43 30 30 31 52 42 34 30 0a 20 20 00 b3

00 ff ff ff ff ff ff 00 22 f0 37 28 01 01 01 01
01 14 01 04 a5 22 13 78 22 54 15 9b 54 53 95 27
16 50 54 21 08 00 81 c0 81 80 01 01 01 01 01 01
01 01 01 01 01 01 66 21 56 aa 51 00 1e 30 46 8f
33 00 58 c2 10 00 00 1e 00 00 00 fd 00 39 3f 18
53 0e 00 0a 20 20 20 20 20 20 00 00 00 fc 00 48
50 20 4c 56 31 35 36 31 77 0a 20 20 00 00 00 ff
00 43 4e 43 30 30 31 52 42 34 30 0a 20 20 00 b3

----------------

Block 0, Base EDID:
  EDID Structure Version & Revision: 1.4
  Vendor & Product Identification:
    Manufacturer: HWP
    Model: 10295
    Serial Number: ...
    Made in: week 1 of 2010
  Basic Display Parameters & Features:
    Digital display
    Bits per primary color channel: 8
    DisplayPort interface
    Maximum image size: 34 cm x 19 cm
    Gamma: 2.20
    DPMS levels: Off
    Supported color formats: RGB 4:4:4
    First detailed timing includes the native pixel format and preferred refresh rate
  Color Characteristics:
    Red  : 0.6064, 0.3291
    Green: 0.3251, 0.5820
    Blue : 0.1523, 0.0869
    White: 0.3134, 0.3291
  Established Timings I & II:
    DMT 0x04:   640x480    59.940476 Hz   4:3     31.469 kHz     25.175000 MHz
    DMT 0x09:   800x600    60.316541 Hz   4:3     37.879 kHz     40.000000 MHz
    DMT 0x10:  1024x768    60.003840 Hz   4:3     48.363 kHz     65.000000 MHz
  Standard Timings:
    DMT 0x55:  1280x720    60.000000 Hz  16:9     45.000 kHz     74.250000 MHz
    DMT 0x23:  1280x1024   60.019740 Hz   5:4     63.981 kHz    108.000000 MHz
  Detailed Timing Descriptors:
    DTD 1:  1366x768    59.789541 Hz 683:384   47.712 kHz     85.500000 MHz (344 mm x 194 mm)
                 Hfront   70 Hsync 143 Hback  213 Hpol P
                 Vfront    3 Vsync   3 Vback   24 Vpol P
    Display Range Limits:
      Monitor ranges (GTF): 57-63 Hz V, 24-83 kHz H, max dotclock 140 MHz
    Display Product Name: 'HP LV1561w'
    Display Product Serial Number: ...
Checksum: 0xb3

----------------

Block 1, Unknown EDID Extension Block 0x00:
  00 ff ff ff ff ff ff 00 22 f0 37 28 01 01 01 01 '........".7(....'
  01 14 01 04 a5 22 13 78 22 54 15 9b 54 53 95 27 '.....".x"T..TS.''
  16 50 54 21 08 00 81 c0 81 80 01 01 01 01 01 01 '.PT!............'
  01 01 01 01 01 01 66 21 56 aa 51 00 1e 30 46 8f '......f!V.Q..0F.'
  33 00 58 c2 10 00 00 1e 00 00 00 fd 00 39 3f 18 '3.X..........9?.'
  53 0e 00 0a 20 20 20 20 20 20 00 00 00 fc 00 48 'S...      .....H'
  50 20 4c 56 31 35 36 31 77 0a 20 20 00 00 00 ff 'P LV1561w.  ....'
  00 43 4e 43 30 30 31 52 42 34 30 0a 20 20 00 b3 '.CNC001RB40.  ..'
Checksum: 0xb3

----------------

Warnings:

Block 0, Base EDID:
  Vendor & Product Identification: The serial number is one of the known dummy values, it should probably be set to 0.
  Display Range Limits: GTF support is deprecated in EDID 1.4.

Failures:

Block 0, Base EDID:
  Display Range Limits: GTF is supported, but the display does not support continuous frequencies.
Block 1, Base EDID:
  Unknown Extension Block.
EDID:
  Base EDID: EDID specified 0 extension block(s), but found 1 extension block(s).

EDID conformity: FAIL
