edid-decode (hex):

00 ff ff ff ff ff ff 00 51 b8 05 20 00 00 00 00
2a 20 01 04 b5 21 16 78 07 66 e5 a3 53 4c 98 24
10 50 54 00 00 00 01 01 01 01 01 01 01 01 01 01
01 01 01 01 01 01 4d 84 80 a0 c0 d0 64 70 30 20
36 00 50 d2 10 00 00 18 00 00 00 fd 00 30 78 fc
fc 55 01 0a 20 20 20 20 20 20 60 a5 80 a0 c0 d0
64 70 30 20 36 00 50 d2 10 00 00 18 00 00 00 fc
00 54 4c 31 35 36 4d 44 4d 50 33 31 2d 30 02 ad

02 03 22 00 e3 05 80 00 e6 06 07 01 6a 6a 39 72
1a 00 00 03 03 30 78 00 04 6a 39 6a 39 78 00 00
00 00 00 00 00 00 00 00 00 00 00 00 00 00 00 00
00 00 00 00 00 00 00 00 00 00 00 00 00 00 00 00
00 00 00 00 00 00 00 00 00 00 00 00 00 00 00 00
00 00 00 00 00 00 00 00 00 00 00 00 00 00 00 00
00 00 00 00 00 00 00 00 00 00 00 00 00 00 00 00
00 00 00 00 00 00 00 00 00 00 00 00 00 00 00 74

70 13 79 00 00 03 01 14 bf 4a 01 85 7f 0c 9f 00
2f 00 1f 00 cf 07 63 00 17 00 05 00 00 00 00 00
00 00 00 00 00 00 00 00 00 00 00 00 00 00 00 00
00 00 00 00 00 00 00 00 00 00 00 00 00 00 00 00
00 00 00 00 00 00 00 00 00 00 00 00 00 00 00 00
00 00 00 00 00 00 00 00 00 00 00 00 00 00 00 00
00 00 00 00 00 00 00 00 00 00 00 00 00 00 00 00
00 00 00 00 00 00 00 00 00 00 00 00 00 00 00 90

00 ff ff ff ff ff ff 00 51 b8 05 20 00 00 00 00
2a 20 01 04 b5 21 16 78 07 66 e5 a3 53 4c 98 24
10 50 54 00 00 00 01 01 01 01 01 01 01 01 01 01
01 01 01 01 01 01 4d 84 80 a0 c0 d0 64 70 30 20
36 00 50 d2 10 00 00 18 00 00 00 fd 00 30 78 fc
fc 55 01 0a 20 20 20 20 20 20 60 a5 80 a0 c0 d0
64 70 30 20 36 00 50 d2 10 00 00 18 00 00 00 fc
00 54 4c 31 35 36 4d 44 4d 50 33 31 2d 30 02 ad

02 03 22 00 e3 05 80 00 e6 06 07 01 6a 6a 39 72
1a 00 00 03 03 30 78 00 04 6a 39 6a 39 78 00 00
00 00 00 00 00 00 00 00 00 00 00 00 00 00 00 00
00 00 00 00 00 00 00 00 00 00 00 00 00 00 00 00
00 00 00 00 00 00 00 00 00 00 00 00 00 00 00 00
00 00 00 00 00 00 00 00 00 00 00 00 00 00 00 00
00 00 00 00 00 00 00 00 00 00 00 00 00 00 00 00
00 00 00 00 00 00 00 00 00 00 00 00 00 00 00 74

70 13 79 00 00 03 01 14 bf 4a 01 85 7f 0c 9f 00
2f 00 1f 00 cf 07 63 00 17 00 05 00 00 00 00 00
00 00 00 00 00 00 00 00 00 00 00 00 00 00 00 00
00 00 00 00 00 00 00 00 00 00 00 00 00 00 00 00
00 00 00 00 00 00 00 00 00 00 00 00 00 00 00 00
00 00 00 00 00 00 00 00 00 00 00 00 00 00 00 00
00 00 00 00 00 00 00 00 00 00 00 00 00 00 00 00
00 00 00 00 00 00 00 00 00 00 00 00 00 00 00 90

----------------

Block 0, Base EDID:
  EDID Structure Version & Revision: 1.4
  Vendor & Product Identification:
    Manufacturer: TMX
    Model: 8197
    Made in: week 42 of 2022
  Basic Display Parameters & Features:
    Digital display
    Bits per primary color channel: 10
    DisplayPort interface
    Maximum image size: 33 cm x 22 cm
    Gamma: 2.20
    Supported color formats: RGB 4:4:4
    Default (sRGB) color space is primary color space
    First detailed timing includes the native pixel format and preferred refresh rate
    Display supports continuous frequencies
  Color Characteristics:
    Red  : 0.6376, 0.3261
    Green: 0.2978, 0.5957
    Blue : 0.1435, 0.0644
    White: 0.3134, 0.3291
  Established Timings I & II: none
  Standard Timings: none
  Detailed Timing Descriptors:
    DTD 1:  3200x2000   48.000283 Hz  16:10   100.801 kHz    338.690000 MHz (336 mm x 210 mm)
                 Hfront   48 Hsync  32 Hback   80 Hpol N
                 Vfront    3 Vsync   6 Vback   91 Vpol N
    Display Range Limits:
      Monitor ranges (Range Limits Only): 48-120 Hz V, 252-252 kHz H, max dotclock 850 MHz
    DTD 2:  3200x2000   60.000000 Hz  16:10   126.000 kHz    423.360000 MHz (336 mm x 210 mm)
                 Hfront   48 Hsync  32 Hback   80 Hpol N
                 Vfront    3 Vsync   6 Vback   91 Vpol N
    Display Product Name: 'TL156MDMP31-0'
  Extension blocks: 2
Checksum: 0xad

----------------

Block 1, CTA-861 Extension Block:
  Revision: 3
  Native detailed modes: 0
  Colorimetry Data Block:
    BT2020RGB
  HDR Static Metadata Data Block:
    Electro optical transfer functions:
      Traditional gamma - SDR luminance range
      Traditional gamma - HDR luminance range
      SMPTE ST2084
    Supported static metadata descriptors:
      Static metadata type 1
    Desired content max luminance: 106 (496.743 cd/m^2)
    Desired content max frame-average luminance: 106 (496.743 cd/m^2)
    Desired content min luminance: 57 (0.248 cd/m^2)
  Vendor-Specific Data Block (AMD), OUI 00-00-1A:
    Version: 3
    Feature Caps: 0x03
    Minimum Refresh Rate: 48 Hz
    Maximum Refresh Rate: 120 Hz
    Flags 1.x: 0x00
    Flags 2.x: 0x04
    Maximum luminance: 106 (496.743 cd/m^2)
    Minimum luminance: 57 (0.248 cd/m^2)
    Maximum luminance (without local dimming): 106 (496.743 cd/m^2)
    Minimum luminance (without local dimming): 57 (0.248 cd/m^2)
Checksum: 0x74  Unused space in Extension Block: 93 bytes

----------------

Block 2, DisplayID Extension Block:
  Version: 1.3
  Extension Count: 0
  Display Product Type: Extension Section
  Video Timing Modes Type 1 - Detailed Timings Data Block:
    DTD:  3200x2000  120.000000 Hz  16:10   252.000 kHz    846.720000 MHz (aspect 16:10, no 3D stereo, preferred)
               Hfront   48 Hsync  32 Hback   80 Hpol N
               Vfront   24 Vsync   6 Vback   70 Vpol N
  Checksum: 0x00
Checksum: 0x90

----------------

Block 3, Unknown EDID Extension Block 0x00:
  00 ff ff ff ff ff ff 00 51 b8 05 20 00 00 00 00 '........Q.. ....'
  2a 20 01 04 b5 21 16 78 07 66 e5 a3 53 4c 98 24 '* ...!.x.f..SL.$'
  10 50 54 00 00 00 01 01 01 01 01 01 01 01 01 01 '.PT.............'
  01 01 01 01 01 01 4d 84 80 a0 c0 d0 64 70 30 20 '......M.....dp0 '
  36 00 50 d2 10 00 00 18 00 00 00 fd 00 30 78 fc '6.P..........0x.'
  fc 55 01 0a 20 20 20 20 20 20 60 a5 80 a0 c0 d0 '.U..      `.....'
  64 70 30 20 36 00 50 d2 10 00 00 18 00 00 00 fc 'dp0 6.P.........'
  00 54 4c 31 35 36 4d 44 4d 50 33 31 2d 30 02 ad '.TL156MDMP31-0..'
Checksum: 0xad

----------------

Block 4, CTA-861 Extension Block:
  Revision: 3
  Native detailed modes: 0
  Colorimetry Data Block:
    BT2020RGB
  HDR Static Metadata Data Block:
    Electro optical transfer functions:
      Traditional gamma - SDR luminance range
      Traditional gamma - HDR luminance range
      SMPTE ST2084
    Supported static metadata descriptors:
      Static metadata type 1
    Desired content max luminance: 106 (496.743 cd/m^2)
    Desired content max frame-average luminance: 106 (496.743 cd/m^2)
    Desired content min luminance: 57 (0.248 cd/m^2)
  Vendor-Specific Data Block (AMD), OUI 00-00-1A:
    Version: 3
    Feature Caps: 0x03
    Minimum Refresh Rate: 48 Hz
    Maximum Refresh Rate: 120 Hz
    Flags 1.x: 0x00
    Flags 2.x: 0x04
    Maximum luminance: 106 (496.743 cd/m^2)
    Minimum luminance: 57 (0.248 cd/m^2)
    Maximum luminance (without local dimming): 106 (496.743 cd/m^2)
    Minimum luminance (without local dimming): 57 (0.248 cd/m^2)
Checksum: 0x74  Unused space in Extension Block: 93 bytes

----------------

Block 5, DisplayID Extension Block:
  Version: 1.3
  Extension Count: 0
  Video Timing Modes Type 1 - Detailed Timings Data Block:
    DTD:  3200x2000  120.000000 Hz  16:10   252.000 kHz    846.720000 MHz (aspect 16:10, no 3D stereo, preferred)
               Hfront   48 Hsync  32 Hback   80 Hpol N
               Vfront   24 Vsync   6 Vback   70 Vpol N
  Checksum: 0x00
Checksum: 0x90

----------------

Warnings:

Block 1, CTA-861 Extension Block:
  IT Video Formats are overscanned by default, but normally this should be underscanned.
Block 4, CTA-861 Extension Block:
  IT Video Formats are overscanned by default, but normally this should be underscanned.
EDID:
  Base EDID: Some timings are out of range of the Monitor Ranges:
    Horizontal Freq: 100.800 - 252.000 kHz (Monitor: 252.000 - 252.000 kHz)

Failures:

Block 0, Base EDID:
  Basic Display Parameters & Features: sRGB is signaled, but the chromaticities do not match.
  Detailed Timing Descriptor #2: Invalid detailed timing descriptor ordering.
Block 1, CTA-861 Extension Block:
  Required 640x480p60 timings are missing in the established timings and the SVD list (VIC 1).
  Missing VCDB, needed for Set Selectable RGB Quantization to avoid interop issues.
Block 2, DisplayID Extension Block:
  DisplayID Base Block has no product type.
  Expected 0 DisplayID Extension Block, but got 1.
Block 3, Base EDID:
  Unknown Extension Block.
Block 4, CTA-861 Extension Block:
  Colorimetry Data Block: Only one instance of this Data Block is allowed.
  HDR Static Metadata Data Block: Only one instance of this Data Block is allowed.
EDID:
  Base EDID: EDID specified 2 extension block(s), but found 5 extension block(s).

EDID conformity: FAIL
