edid-decode (hex):

00 ff ff ff ff ff ff 00 06 af 5c 12 00 00 00 00
00 1c 01 04 95 1a 0e 78 03 20 25 97 59 55 93 28
1c 50 54 00 00 00 01 01 01 01 01 01 01 01 01 01
01 01 01 01 01 01 ce 1d 56 ea 50 00 1a 30 30 20
46 00 00 90 10 00 00 1a d8 17 56 ea 50 00 1a 30
30 20 46 00 00 90 10 00 00 1a 00 00 00 fe 00 46
48 4d 57 48 80 42 31 31 36 58 41 42 00 00 00 00
00 00 81 22 96 00 10 00 00 09 01 0a 20 20 00 fd

00 ff ff ff ff ff ff 00 06 af 5c 12 00 00 00 00
00 1c 01 04 95 1a 0e 78 03 20 25 97 59 55 93 28
1c 50 54 00 00 00 01 01 01 01 01 01 01 01 01 01
01 01 01 01 01 01 ce 1d 56 ea 50 00 1a 30 30 20
46 00 00 90 10 00 00 1a d8 17 56 ea 50 00 1a 30
30 20 46 00 00 90 10 00 00 1a 00 00 00 fe 00 46
48 4d 57 48 80 42 31 31 36 58 41 42 00 00 00 00
00 00 81 22 96 00 10 00 00 09 01 0a 20 20 00 fd

----------------

Block 0, Base EDID:
  EDID Structure Version & Revision: 1.4
  Vendor & Product Identification:
    Manufacturer: AUO
    Model: 4700
    Made in: 2018
  Basic Display Parameters & Features:
    Digital display
    Bits per primary color channel: 6
    DisplayPort interface
    Maximum image size: 26 cm x 14 cm
    Gamma: 2.20
    Supported color formats: RGB 4:4:4
    First detailed timing includes the native pixel format and preferred refresh rate
    Display supports continuous frequencies
  Color Characteristics:
    Red  : 0.5898, 0.3496
    Green: 0.3320, 0.5742
    Blue : 0.1562, 0.1113
    White: 0.3134, 0.3291
  Established Timings I & II: none
  Standard Timings: none
  Detailed Timing Descriptors:
    DTD 1:  1366x768    60.059824 Hz 683:384   47.688 kHz     76.300000 MHz (256 mm x 144 mm)
                 Hfront   48 Hsync  32 Hback  154 Hpol P
                 Vfront    4 Vsync   6 Vback   16 Vpol N
    DTD 2:  1366x768    48.047859 Hz 683:384   38.150 kHz     61.040000 MHz (256 mm x 144 mm)
                 Hfront   48 Hsync  32 Hback  154 Hpol P
                 Vfront    4 Vsync   6 Vback   16 Vpol N
    Alphanumeric Data String: 'FHMWH.B116XAB'
    Manufacturer-Specified Display Descriptor (0x00): 00 00 00 00 81 22 96 00 10 00 00 09 01 0a 20 20 '....."........  '
Checksum: 0xfd

----------------

Warnings:

Block 0, Base EDID:
  Alphanumeric Data String: Non-ASCII character 0x80 at position 5, can cause problems.
  Missing Display Product Name.

Failures:

Block 0, Base EDID:
  Missing Display Range Limits Descriptor.
EDID:
  Extension Block 1 started with EDID header, ignoring Extension Blocks >= 1.

EDID conformity: FAIL
