edid-decode (hex):

00 ff ff ff ff ff ff 00 6a 99 10 19 50 2d 31 01
0a 17 01 03 08 21 1b 78 ea ee a6 9e 54 4c 99 26
19 4f 54 af cf 00 61 40 01 01 01 01 01 01 01 01
01 01 01 01 01 01 24 13 00 20 41 58 18 20 10 90
13 00 51 0e 11 00 00 1e 00 00 00 fc 00 4c 4d 31
37 31 30 20 28 56 47 41 29 0a 00 00 00 fd 00 37
4c 1e 51 0e 00 0a 20 20 20 20 20 20 00 00 00 ff
00 32 30 30 30 30 30 38 30 0a 20 20 20 20 01 eb

00 ff ff ff ff ff ff 00 6a 99 10 19 50 2d 31 01
0a 17 01 03 08 21 1b 78 ea ee a6 9e 54 4c 99 26
19 4f 54 af cf 00 61 40 01 01 01 01 01 01 01 01
01 01 01 01 01 01 24 13 00 20 41 58 18 20 10 90
13 00 51 0e 11 00 00 1e 00 00 00 fc 00 4c 4d 31
37 31 30 20 28 56 47 41 29 0a 00 00 00 fd 00 37
4c 1e 51 0e 00 0a 20 20 20 20 20 20 00 00 00 ff
00 32 30 30 30 30 30 38 30 0a 20 20 20 20 01 eb

----------------

Block 0, Base EDID:
  EDID Structure Version & Revision: 1.3
  Vendor & Product Identification:
    Manufacturer: ZTY
    Model: 6416
    Serial Number: ...
    Made in: week 10 of 2013
  Basic Display Parameters & Features:
    Analog display
    Signal Level Standard: 0.700 : 0.300 : 1.000 V p-p
    Blank level equals black level
    Sync: Separate
    Maximum image size: 33 cm x 27 cm
    Gamma: 2.20
    DPMS levels: Standby Suspend Off
    RGB color display
    First detailed timing is the preferred timing
  Color Characteristics:
    Red  : 0.6201, 0.3300
    Green: 0.2998, 0.5996
    Blue : 0.1503, 0.0996
    White: 0.3095, 0.3300
  Established Timings I & II:
    IBM     :   720x400    70.081663 Hz   9:5     31.467 kHz     28.320000 MHz
    DMT 0x04:   640x480    59.940476 Hz   4:3     31.469 kHz     25.175000 MHz
    DMT 0x05:   640x480    72.808802 Hz   4:3     37.861 kHz     31.500000 MHz
    DMT 0x06:   640x480    75.000000 Hz   4:3     37.500 kHz     31.500000 MHz
    DMT 0x08:   800x600    56.250000 Hz   4:3     35.156 kHz     36.000000 MHz
    DMT 0x09:   800x600    60.316541 Hz   4:3     37.879 kHz     40.000000 MHz
    DMT 0x0a:   800x600    72.187572 Hz   4:3     48.077 kHz     50.000000 MHz
    DMT 0x0b:   800x600    75.000000 Hz   4:3     46.875 kHz     49.500000 MHz
    DMT 0x10:  1024x768    60.003840 Hz   4:3     48.363 kHz     65.000000 MHz
    DMT 0x11:  1024x768    70.069359 Hz   4:3     56.476 kHz     75.000000 MHz
    DMT 0x12:  1024x768    75.028582 Hz   4:3     60.023 kHz     78.750000 MHz
    DMT 0x24:  1280x1024   75.024675 Hz   5:4     79.976 kHz    135.000000 MHz
  Standard Timings:
    DMT 0x10:  1024x768    60.003840 Hz   4:3     48.363 kHz     65.000000 MHz
  Detailed Timing Descriptors:
    DTD 1:  1024x600    59.851861 Hz 128:75    37.348 kHz     49.000000 MHz (337 mm x 270 mm)
                 Hfront   16 Hsync 144 Hback  128 Hpol P
                 Vfront    1 Vsync   3 Vback   20 Vpol P
    Display Product Name: 'LM1710 (VGA)'
    Display Range Limits:
      Monitor ranges (GTF): 55-76 Hz V, 30-81 kHz H, max dotclock 140 MHz
    Display Product Serial Number: ...
  Extension blocks: 1
Checksum: 0xeb

----------------

Block 1, Unknown EDID Extension Block 0x00:
  00 ff ff ff ff ff ff 00 6a 99 10 19 50 2d 31 01 '........j...P-1.'
  0a 17 01 03 08 21 1b 78 ea ee a6 9e 54 4c 99 26 '.....!.x....TL.&'
  19 4f 54 af cf 00 61 40 01 01 01 01 01 01 01 01 '.OT...a@........'
  01 01 01 01 01 01 24 13 00 20 41 58 18 20 10 90 '......$.. AX. ..'
  13 00 51 0e 11 00 00 1e 00 00 00 fc 00 4c 4d 31 '..Q..........LM1'
  37 31 30 20 28 56 47 41 29 0a 00 00 00 fd 00 37 '710 (VGA)......7'
  4c 1e 51 0e 00 0a 20 20 20 20 20 20 00 00 00 ff 'L.Q...      ....'
  00 32 30 30 30 30 30 38 30 0a 20 20 20 20 01 eb '.20000080.    ..'
Checksum: 0xeb

----------------

Warnings:

Block 0, Base EDID:
  Vendor & Product Identification: The serial number is one of the known dummy values, it should probably be set to 0.
  Detailed Timing Descriptor #1: Image size is 337x270 mm, but based on the picture AR it should be 337x197 mm.
  Display Product Serial Number: ...

Failures:

Block 1, Base EDID:
  Unknown Extension Block.

EDID conformity: FAIL
