edid-decode (hex):

00 ff ff ff ff ff ff 00 30 ae e0 61 00 00 00 00
10 1f 01 03 6c 29 17 78 ee 22 e5 a3 5b 4f a3 26
13 50 54 ad ef 00 71 4f 81 8a 81 80 01 01 01 01
01 01 01 01 01 01 66 21 56 aa 51 00 1e 30 46 8f
33 00 ae ff 10 00 00 1e 00 00 00 fd 00 32 4b 1e
51 14 00 0a 20 20 20 20 20 20 00 00 00 fc 00 44
31 39 2d 31 30 0a 20 20 20 20 20 20 00 00 00 ff
00 56 39 30 37 54 44 52 47 0a 20 20 20 20 00 da

00 ff ff ff ff ff ff 00 30 ae e0 61 00 00 00 00
10 1f 01 03 6c 29 17 78 ee 22 e5 a3 5b 4f a3 26
13 50 54 ad ef 00 71 4f 81 8a 81 80 01 01 01 01
01 01 01 01 01 01 66 21 56 aa 51 00 1e 30 46 8f
33 00 ae ff 10 00 00 1e 00 00 00 fd 00 32 4b 1e
51 14 00 0a 20 20 20 20 20 20 00 00 00 fc 00 44
31 39 2d 31 30 0a 20 20 20 20 20 20 00 00 00 ff
00 56 39 30 37 54 44 52 47 0a 20 20 20 20 00 da

----------------

Block 0, Base EDID:
  EDID Structure Version & Revision: 1.3
  Vendor & Product Identification:
    Manufacturer: LEN
    Model: 25056
    Made in: week 16 of 2021
  Basic Display Parameters & Features:
    Analog display
    Signal Level Standard: 0.700 : 0.000 : 0.700 V p-p
    Blank level equals black level
    Sync: Separate Composite
    Maximum image size: 41 cm x 23 cm
    Gamma: 2.20
    DPMS levels: Standby Suspend Off
    RGB color display
    Default (sRGB) color space is primary color space
    First detailed timing is the preferred timing
  Color Characteristics:
    Red  : 0.6367, 0.3574
    Green: 0.3085, 0.6386
    Blue : 0.1513, 0.0761
    White: 0.3134, 0.3291
  Established Timings I & II:
    IBM     :   720x400    70.081663 Hz   9:5     31.467 kHz     28.320000 MHz
    DMT 0x04:   640x480    59.940476 Hz   4:3     31.469 kHz     25.175000 MHz
    DMT 0x05:   640x480    72.808802 Hz   4:3     37.861 kHz     31.500000 MHz
    DMT 0x06:   640x480    75.000000 Hz   4:3     37.500 kHz     31.500000 MHz
    DMT 0x09:   800x600    60.316541 Hz   4:3     37.879 kHz     40.000000 MHz
    DMT 0x0a:   800x600    72.187572 Hz   4:3     48.077 kHz     50.000000 MHz
    DMT 0x0b:   800x600    75.000000 Hz   4:3     46.875 kHz     49.500000 MHz
    Apple   :   832x624    74.551266 Hz   4:3     49.726 kHz     57.284000 MHz
    DMT 0x10:  1024x768    60.003840 Hz   4:3     48.363 kHz     65.000000 MHz
    DMT 0x11:  1024x768    70.069359 Hz   4:3     56.476 kHz     75.000000 MHz
    DMT 0x12:  1024x768    75.028582 Hz   4:3     60.023 kHz     78.750000 MHz
    DMT 0x24:  1280x1024   75.024675 Hz   5:4     79.976 kHz    135.000000 MHz
  Standard Timings:
    DMT 0x15:  1152x864    75.000000 Hz   4:3     67.500 kHz    108.000000 MHz
    GTF     :  1280x1024   69.999805 Hz   5:4     74.620 kHz    128.943000 MHz
    DMT 0x23:  1280x1024   60.019740 Hz   5:4     63.981 kHz    108.000000 MHz
  Detailed Timing Descriptors:
    DTD 1:  1366x768    59.789541 Hz 683:384   47.712 kHz     85.500000 MHz (430 mm x 255 mm)
                 Hfront   70 Hsync 143 Hback  213 Hpol P
                 Vfront    3 Vsync   3 Vback   24 Vpol P
    Display Range Limits:
      Monitor ranges (GTF): 50-75 Hz V, 30-81 kHz H, max dotclock 200 MHz
    Display Product Name: 'D19-10'
    Display Product Serial Number: ...
Checksum: 0xda

----------------

Block 1, Unknown EDID Extension Block 0x00:
  00 ff ff ff ff ff ff 00 30 ae e0 61 00 00 00 00 '........0..a....'
  10 1f 01 03 6c 29 17 78 ee 22 e5 a3 5b 4f a3 26 '....l).x."..[O.&'
  13 50 54 ad ef 00 71 4f 81 8a 81 80 01 01 01 01 '.PT...qO........'
  01 01 01 01 01 01 66 21 56 aa 51 00 1e 30 46 8f '......f!V.Q..0F.'
  33 00 ae ff 10 00 00 1e 00 00 00 fd 00 32 4b 1e '3............2K.'
  51 14 00 0a 20 20 20 20 20 20 00 00 00 fc 00 44 'Q...      .....D'
  31 39 2d 31 30 0a 20 20 20 20 20 20 00 00 00 ff '19-10.      ....'
  00 56 39 30 37 54 44 52 47 0a 20 20 20 20 00 da '.V907TDRG.    ..'
Checksum: 0xda

----------------

Warnings:

Block 0, Base EDID:
  Detailed Timing Descriptor #1: Image size is 430x255 mm, but based on the picture AR it should be 430x241 mm.

Failures:

Block 0, Base EDID:
  Basic Display Parameters & Features: sRGB is signaled, but the chromaticities do not match.
  Detailed Timing Descriptor #1: Mismatch of image size 430x255 mm vs display size 410x230 mm.
Block 1, Base EDID:
  Unknown Extension Block.
EDID:
  Base EDID: The DTD max image size is 430x255mm, which is larger than the display size 410.0x230.0mm.
  Base EDID: EDID specified 0 extension block(s), but found 1 extension block(s).

EDID conformity: FAIL
