edid-decode (hex):

00 ff ff ff ff ff ff 00 41 0c 51 95 01 01 01 01
06 10 01 03 80 36 28 78 0a 0d c9 a0 57 47 98 27
12 48 4c 20 00 00 01 01 01 01 01 01 01 01 01 01
01 01 01 01 01 01 01 1d 80 d0 72 1c 16 20 10 2c
25 80 1c 90 21 00 00 9e 01 1d 00 72 51 d0 1e 20
6e 28 55 00 1c 90 21 00 00 1e 00 00 00 fd 00 31
3d 1c 2e 08 00 0a 20 20 20 20 20 20 00 00 00 fc
00 4c 30 36 48 44 20 76 31 20 34 3a 33 0a 01 15

02 03 19 f1 46 94 11 13 05 02 04 23 09 07 07 83
01 00 00 65 03 0c 00 10 00 01 1d 80 d0 72 1c 16
20 10 2c 25 80 1c 90 21 00 00 9e 8c 0a d0 90 20
40 31 20 0c 40 55 00 1c 90 21 00 00 18 01 1d 00
bc 52 d0 1e 20 b8 28 55 40 1c 90 21 00 00 1e 01
1d 80 18 71 1c 16 20 58 2c 25 00 1c 90 21 00 00
9e 8c 0a d0 8a 20 e0 2d 10 10 3e 96 00 1c 90 21
00 00 18 00 00 00 00 00 00 00 00 00 00 00 00 de

----------------

Block 0, Base EDID:
  EDID Structure Version & Revision: 1.3
  Vendor & Product Identification:
    Manufacturer: PHL
    Model: 38225
    Serial Number: ...
    Made in: week 6 of 2006
  Basic Display Parameters & Features:
    Digital display
    Maximum image size: 54 cm x 40 cm
    Gamma: 2.20
    RGB color display
    First detailed timing is the preferred timing
  Color Characteristics:
    Red  : 0.6250, 0.3398
    Green: 0.2802, 0.5947
    Blue : 0.1552, 0.0703
    White: 0.2832, 0.2978
  Established Timings I & II:
    DMT 0x04:   640x480    59.940476 Hz   4:3     31.469 kHz     25.175000 MHz
  Standard Timings: none
  Detailed Timing Descriptors:
    DTD 1:  1920x1080i  50.000000 Hz  16:9     28.125 kHz     74.250000 MHz (540 mm x 400 mm)
                 Hfront  528 Hsync  44 Hback  148 Hpol P
                 Vfront    2 Vsync   5 Vback   15 Vpol P Vfront +0.5 Odd Field
                 Vfront    2 Vsync   5 Vback   15 Vpol P Vback  +0.5 Even Field
    DTD 2:  1280x720    60.000000 Hz  16:9     45.000 kHz     74.250000 MHz (540 mm x 400 mm)
                 Hfront  110 Hsync  40 Hback  220 Hpol P
                 Vfront    5 Vsync   5 Vback   20 Vpol P
    Display Range Limits:
      Monitor ranges (GTF): 49-61 Hz V, 28-46 kHz H, max dotclock 80 MHz
    Display Product Name: 'L06HD v1 4:3'
  Extension blocks: 1
Checksum: 0x15

----------------

Block 1, CTA-861 Extension Block:
  Revision: 3
  Underscans IT Video Formats by default
  Basic audio support
  Supports YCbCr 4:4:4
  Supports YCbCr 4:2:2
  Native DTDs: 1
  Video Data Block:
    VIC  20:  1920x1080i  50.000000 Hz  16:9     28.125 kHz     74.250000 MHz (native)
    VIC  17:   720x576    50.000000 Hz   4:3     31.250 kHz     27.000000 MHz
    VIC  19:  1280x720    50.000000 Hz  16:9     37.500 kHz     74.250000 MHz
    VIC   5:  1920x1080i  60.000000 Hz  16:9     33.750 kHz     74.250000 MHz
    VIC   2:   720x480    59.940060 Hz   4:3     31.469 kHz     27.000000 MHz
    VIC   4:  1280x720    60.000000 Hz  16:9     45.000 kHz     74.250000 MHz
  Audio Data Block:
    Linear PCM:
      Max channels: 2
      Supported sample rates (kHz): 48 44.1 32
      Supported sample sizes (bits): 24 20 16
  Speaker Allocation Data Block:
    FL/FR - Front Left/Right
  Vendor-Specific Data Block (HDMI), OUI 00-0C-03:
    Source physical address: 1.0.0.0
  Detailed Timing Descriptors:
    DTD 3:  1920x1080i  50.000000 Hz  16:9     28.125 kHz     74.250000 MHz (540 mm x 400 mm)
                 Hfront  528 Hsync  44 Hback  148 Hpol P
                 Vfront    2 Vsync   5 Vback   15 Vpol P Vfront +0.5 Odd Field
                 Vfront    2 Vsync   5 Vback   15 Vpol P Vback  +0.5 Even Field
    DTD 4:   720x576    50.000000 Hz   5:4     31.250 kHz     27.000000 MHz (540 mm x 400 mm)
                 Hfront   12 Hsync  64 Hback   68 Hpol N
                 Vfront    5 Vsync   5 Vback   39 Vpol N
    DTD 5:  1280x720    50.000000 Hz  16:9     37.500 kHz     74.250000 MHz (540 mm x 400 mm)
                 Hfront  440 Hsync  40 Hback  220 Hpol P
                 Vfront    5 Vsync   5 Vback   20 Vpol P
    DTD 6:  1920x1080i  60.000000 Hz  16:9     33.750 kHz     74.250000 MHz (540 mm x 400 mm)
                 Hfront   88 Hsync  44 Hback  148 Hpol P
                 Vfront    2 Vsync   5 Vback   15 Vpol P Vfront +0.5 Odd Field
                 Vfront    2 Vsync   5 Vback   15 Vpol P Vback  +0.5 Even Field
    DTD 7:   720x480    59.940060 Hz   3:2     31.469 kHz     27.000000 MHz (540 mm x 400 mm)
                 Hfront   16 Hsync  62 Hback   60 Hpol N
                 Vfront    9 Vsync   6 Vback   30 Vpol N
Checksum: 0xde  Unused space in Extension Block: 12 bytes

----------------

Warnings:

Block 0, Base EDID:
  Vendor & Product Identification: The serial number is one of the known dummy values, it should probably be set to 0.
  Detailed Timing Descriptor #1: Image size is 540x400 mm, but based on the picture AR it should be 540x303 mm.
  Detailed Timing Descriptor #2: Image size is 540x400 mm, but based on the picture AR it should be 540x303 mm.
Block 1, CTA-861 Extension Block:
  Detailed Timing Descriptor #3: Image size is 540x400 mm, but based on the picture AR it should be 540x303 mm.
  Detailed Timing Descriptor #4: Image size is 540x400 mm, but based on the picture AR it should be 500x400 mm.
  Detailed Timing Descriptor #5: Image size is 540x400 mm, but based on the picture AR it should be 540x303 mm.
  Detailed Timing Descriptor #6: Image size is 540x400 mm, but based on the picture AR it should be 540x303 mm.
  Detailed Timing Descriptor #7: Image size is 540x400 mm, but based on the picture AR it should be 540x360 mm.
  Add a Colorimetry Data Block with the sRGB colorimetry bit set to avoid interop issues.

Failures:

Block 1, CTA-861 Extension Block:
  Missing VCDB, needed for Set Selectable RGB Quantization to avoid interop issues.
EDID:
  CTA-861: A native interlaced timing is present, but not a native progressive timing.

EDID conformity: FAIL
