edid-decode (hex):

00 ff ff ff ff ff ff 00 09 e5 7f 0a 00 00 00 00
0e 1f 01 04 a5 1e 13 78 03 a7 e5 a3 54 4a 9e 25
0e 50 54 00 00 00 01 01 01 01 01 01 01 01 01 01
01 01 01 01 01 01 07 53 c0 dc 80 78 28 50 30 20
36 00 2e bd 10 00 00 1a 5a 37 c0 dc 80 78 28 50
30 20 36 00 2e bd 10 00 00 1a 00 00 00 00 00 00
00 00 00 00 00 00 00 00 00 00 00 00 00 00 00 02
00 0d 36 ff 0a 3c 96 12 12 2b 96 00 00 00 00 7c

00 ff ff ff ff ff ff 00 09 e5 7f 0a 00 00 00 00
0e 1f 01 04 a5 1e 13 78 03 a7 e5 a3 54 4a 9e 25
0e 50 54 00 00 00 01 01 01 01 01 01 01 01 01 01
01 01 01 01 01 01 07 53 c0 dc 80 78 28 50 30 20
36 00 2e bd 10 00 00 1a 5a 37 c0 dc 80 78 28 50
30 20 36 00 2e bd 10 00 00 1a 00 00 00 00 00 00
00 00 00 00 00 00 00 00 00 00 00 00 00 00 00 02
00 0d 36 ff 0a 3c 96 12 12 2b 96 00 00 00 00 7c

----------------

Block 0, Base EDID:
  EDID Structure Version & Revision: 1.4
  Vendor & Product Identification:
    Manufacturer: BOE
    Model: 2687
    Made in: week 14 of 2021
  Basic Display Parameters & Features:
    Digital display
    Bits per primary color channel: 8
    DisplayPort interface
    Maximum image size: 30 cm x 19 cm
    Gamma: 2.20
    Supported color formats: RGB 4:4:4
    First detailed timing includes the native pixel format and preferred refresh rate
    Display supports continuous frequencies
  Color Characteristics:
    Red  : 0.6386, 0.3300
    Green: 0.2900, 0.6201
    Blue : 0.1474, 0.0566
    White: 0.3134, 0.3291
  Established Timings I & II: none
  Standard Timings: none
  Detailed Timing Descriptors:
    DTD 1:  2240x1400   60.001694 Hz  16:10    86.402 kHz    212.550000 MHz (302 mm x 189 mm)
                 Hfront   48 Hsync  32 Hback  140 Hpol P
                 Vfront    3 Vsync   6 Vback   31 Vpol N
    DTD 2:  2240x1400   40.001129 Hz  16:10    57.602 kHz    141.700000 MHz (302 mm x 189 mm)
                 Hfront   48 Hsync  32 Hback  140 Hpol P
                 Vfront    3 Vsync   6 Vback   31 Vpol N
    Empty Descriptor
    Manufacturer-Specified Display Descriptor (0x02): 00 02 00 0d 36 ff 0a 3c 96 12 12 2b 96 00 00 00 '....6..<...+....'
Checksum: 0x7c

----------------

Warnings:

Block 0, Base EDID:
  Missing Display Product Name.

Failures:

Block 0, Base EDID:
  Empty Descriptor: Use Dummy Descriptor instead of all zeroes.
  Missing Display Range Limits Descriptor.
EDID:
  Extension Block 1 started with EDID header, ignoring Extension Blocks >= 1.

EDID conformity: FAIL
