edid-decode (hex):

00 ff ff ff ff ff ff 00 36 69 a8 3c 01 01 01 01
2c 1f 01 04 b5 3c 22 78 fb b8 e5 a6 53 37 b9 26
0a 50 54 3d cf 00 3b 80 81 80 95 00 b3 00 d1 c0
d1 d9 d1 fc 81 c0 69 61 00 a0 a0 a0 58 50 30 20
35 00 54 4f 21 00 00 1e 00 00 00 fd 0c 30 f0 87
87 67 01 0a 20 20 20 20 20 20 00 00 00 fc 00 4d
53 49 20 4d 41 47 32 37 34 51 52 58 00 00 00 ff
00 46 41 33 54 30 31 31 39 30 30 30 30 30 02 98

02 03 2c 71 46 03 2b 04 10 3f 61 23 09 17 07 83
01 00 00 6d 1a 00 00 02 01 30 f0 00 00 61 4c 61
4c e3 05 c0 00 e6 06 07 01 61 61 4c f0 e9 00 a0
a0 a0 59 50 18 10 25 00 54 4f 21 00 00 1a 6c c4
00 a1 a0 a0 64 50 18 10 25 00 54 4f 21 00 00 1a
45 9e 80 a1 70 38 64 40 18 10 25 00 54 4f 21 00
00 1a b7 8c 80 c8 70 38 64 40 18 10 25 00 54 4f
21 00 00 1a 00 00 00 00 00 00 00 00 00 00 00 c0

70 12 79 03 00 03 01 3c 86 86 01 04 ff 09 a7 00
2f 00 1f 00 9f 05 56 00 02 00 04 00 a1 26 01 04
ff 09 a0 00 17 00 0f 00 9f 05 63 00 01 00 04 00
86 0b 01 04 ff 09 9f 00 17 00 0f 00 9f 05 55 00
01 00 04 00 00 00 00 00 00 00 00 00 00 00 00 00
00 00 00 00 00 00 00 00 00 00 00 00 00 00 00 00
00 00 00 00 00 00 00 00 00 00 00 00 00 00 00 00
00 00 00 00 00 00 00 00 00 00 00 00 00 00 1d 90

00 ff ff ff ff ff ff 00 36 69 a8 3c 01 01 01 01
2c 1f 01 04 b5 3c 22 78 fb b8 e5 a6 53 37 b9 26
0a 50 54 3d cf 00 3b 80 81 80 95 00 b3 00 d1 c0
d1 d9 d1 fc 81 c0 69 61 00 a0 a0 a0 58 50 30 20
35 00 54 4f 21 00 00 1e 00 00 00 fd 0c 30 f0 87
87 67 01 0a 20 20 20 20 20 20 00 00 00 fc 00 4d
53 49 20 4d 41 47 32 37 34 51 52 58 00 00 00 ff
00 46 41 33 54 30 31 31 39 30 30 30 30 30 02 98

02 03 2c 71 46 03 2b 04 10 3f 61 23 09 17 07 83
01 00 00 6d 1a 00 00 02 01 30 f0 00 00 61 4c 61
4c e3 05 c0 00 e6 06 07 01 61 61 4c f0 e9 00 a0
a0 a0 59 50 18 10 25 00 54 4f 21 00 00 1a 6c c4
00 a1 a0 a0 64 50 18 10 25 00 54 4f 21 00 00 1a
45 9e 80 a1 70 38 64 40 18 10 25 00 54 4f 21 00
00 1a b7 8c 80 c8 70 38 64 40 18 10 25 00 54 4f
21 00 00 1a 00 00 00 00 00 00 00 00 00 00 00 c0

70 12 79 03 00 03 01 3c 86 86 01 04 ff 09 a7 00
2f 00 1f 00 9f 05 56 00 02 00 04 00 a1 26 01 04
ff 09 a0 00 17 00 0f 00 9f 05 63 00 01 00 04 00
86 0b 01 04 ff 09 9f 00 17 00 0f 00 9f 05 55 00
01 00 04 00 00 00 00 00 00 00 00 00 00 00 00 00
00 00 00 00 00 00 00 00 00 00 00 00 00 00 00 00
00 00 00 00 00 00 00 00 00 00 00 00 00 00 00 00
00 00 00 00 00 00 00 00 00 00 00 00 00 00 1d 90

----------------

Block 0, Base EDID:
  EDID Structure Version & Revision: 1.4
  Vendor & Product Identification:
    Manufacturer: MSI
    Model: 15528
    Serial Number: ...
    Made in: week 44 of 2021
  Basic Display Parameters & Features:
    Digital display
    Bits per primary color channel: 10
    DisplayPort interface
    Maximum image size: 60 cm x 34 cm
    Gamma: 2.20
    DPMS levels: Standby Suspend Off
    Supported color formats: RGB 4:4:4, YCrCb 4:4:4, YCrCb 4:2:2
    First detailed timing includes the native pixel format and preferred refresh rate
    Display supports continuous frequencies
  Color Characteristics:
    Red  : 0.6503, 0.3271
    Green: 0.2167, 0.7226
    Blue : 0.1513, 0.0410
    White: 0.3134, 0.3291
  Established Timings I & II:
    DMT 0x04:   640x480    59.940476 Hz   4:3     31.469 kHz     25.175000 MHz
    Apple   :   640x480    66.666667 Hz   4:3     35.000 kHz     30.240000 MHz
    DMT 0x05:   640x480    72.808802 Hz   4:3     37.861 kHz     31.500000 MHz
    DMT 0x06:   640x480    75.000000 Hz   4:3     37.500 kHz     31.500000 MHz
    DMT 0x09:   800x600    60.316541 Hz   4:3     37.879 kHz     40.000000 MHz
    DMT 0x0a:   800x600    72.187572 Hz   4:3     48.077 kHz     50.000000 MHz
    DMT 0x0b:   800x600    75.000000 Hz   4:3     46.875 kHz     49.500000 MHz
    DMT 0x10:  1024x768    60.003840 Hz   4:3     48.363 kHz     65.000000 MHz
    DMT 0x11:  1024x768    70.069359 Hz   4:3     56.476 kHz     75.000000 MHz
    DMT 0x12:  1024x768    75.028582 Hz   4:3     60.023 kHz     78.750000 MHz
    DMT 0x24:  1280x1024   75.024675 Hz   5:4     79.976 kHz    135.000000 MHz
  Standard Timings:
    GTF     :   720x576    60.000294 Hz   5:4     35.820 kHz     32.668000 MHz
    DMT 0x23:  1280x1024   60.019740 Hz   5:4     63.981 kHz    108.000000 MHz
    DMT 0x2f:  1440x900    59.887445 Hz  16:10    55.935 kHz    106.500000 MHz
    DMT 0x3a:  1680x1050   59.954250 Hz  16:10    65.290 kHz    146.250000 MHz
    DMT 0x52:  1920x1080   60.000000 Hz  16:9     67.500 kHz    148.500000 MHz
    GTF     :  1920x1080   84.999879 Hz  16:9     96.390 kHz    252.927000 MHz
    GTF     :  1920x1080  119.999987 Hz  16:9    138.840 kHz    368.759000 MHz
    DMT 0x55:  1280x720    60.000000 Hz  16:9     45.000 kHz     74.250000 MHz
  Detailed Timing Descriptors:
    DTD 1:  2560x1440   60.000096 Hz  16:9     91.680 kHz    249.370000 MHz (596 mm x 335 mm)
                 Hfront   48 Hsync  32 Hback   80 Hpol P
                 Vfront    3 Vsync   5 Vback   80 Vpol P
    Display Range Limits:
      Monitor ranges (Range Limits Only): 48-240 Hz V, 390-390 kHz H, max dotclock 1030 MHz
    Display Product Name: 'MSI MAG274QRX'
    Display Product Serial Number: ...
  Extension blocks: 2
Checksum: 0x98

----------------

Block 1, CTA-861 Extension Block:
  Revision: 3
  Basic audio support
  Supports YCbCr 4:4:4
  Supports YCbCr 4:2:2
  Native DTDs: 1
  Video Data Block:
    VIC   3:   720x480    59.940060 Hz  16:9     31.469 kHz     27.000000 MHz
    VIC  43:   720x576   100.000000 Hz  16:9     62.500 kHz     54.000000 MHz
    VIC   4:  1280x720    60.000000 Hz  16:9     45.000 kHz     74.250000 MHz
    VIC  16:  1920x1080   60.000000 Hz  16:9     67.500 kHz    148.500000 MHz
    VIC  63:  1920x1080  120.000000 Hz  16:9    135.000 kHz    297.000000 MHz
    VIC  97:  3840x2160   60.000000 Hz  16:9    135.000 kHz    594.000000 MHz
  Audio Data Block:
    Linear PCM:
      Max channels: 2
      Supported sample rates (kHz): 96 48 44.1 32
      Supported sample sizes (bits): 24 20 16
  Speaker Allocation Data Block:
    FL/FR - Front Left/Right
  Vendor-Specific Data Block (AMD), OUI 00-00-1A:
    Version: 2
    Flags 1: 0x01
      FreeSync Supported
    Minimum Refresh Rate: 48 Hz
    Maximum Refresh Rate: 240 Hz
    Flags 5: 0x00
  Colorimetry Data Block:
    BT2020YCC
    BT2020RGB
  HDR Static Metadata Data Block:
    Electro optical transfer functions:
      Traditional gamma - SDR luminance range
      Traditional gamma - HDR luminance range
      SMPTE ST2084
    Supported static metadata descriptors:
      Static metadata type 1
    Desired content max luminance: 97 (408.759 cd/m^2)
    Desired content max frame-average luminance: 97 (408.759 cd/m^2)
    Desired content min luminance: 76 (0.363 cd/m^2)
  Detailed Timing Descriptors:
    DTD 2:  2560x1440  144.000308 Hz  16:9    220.176 kHz    598.880000 MHz (596 mm x 335 mm)
                 Hfront   24 Hsync  16 Hback  120 Hpol P
                 Vfront    2 Vsync   5 Vback   82 Vpol N
    DTD 3:  2560x1440  119.999809 Hz  16:9    184.800 kHz    502.840000 MHz (596 mm x 335 mm)
                 Hfront   24 Hsync  16 Hback  121 Hpol P
                 Vfront    2 Vsync   5 Vback   93 Vpol N
    DTD 4:  1920x1080  164.999715 Hz  16:9    194.700 kHz    405.170000 MHz (596 mm x 335 mm)
                 Hfront   24 Hsync  16 Hback  121 Hpol P
                 Vfront    2 Vsync   5 Vback   93 Vpol N
    DTD 5:  1920x1080  143.999840 Hz  16:9    169.920 kHz    360.230000 MHz (596 mm x 335 mm)
                 Hfront   24 Hsync  16 Hback  160 Hpol P
                 Vfront    2 Vsync   5 Vback   93 Vpol N
Checksum: 0xc0  Unused space in Extension Block: 11 bytes

----------------

Block 2, DisplayID Extension Block:
  Version: 1.2
  Extension Count: 0
  Display Product Type: Standalone display device
  Video Timing Modes Type 1 - Detailed Timings Data Block:
    DTD:  2560x1440  239.998214 Hz  16:9    366.477 kHz    999.750000 MHz (aspect 16:9, no 3D stereo)
               Hfront   48 Hsync  32 Hback   88 Hpol N
               Vfront    3 Vsync   5 Vback   79 Vpol N
    DTD:  2560x1440  179.999714 Hz  16:9    277.200 kHz    754.260000 MHz (aspect 16:9, no 3D stereo)
               Hfront   24 Hsync  16 Hback  121 Hpol N
               Vfront    2 Vsync   5 Vback   93 Vpol N
    DTD:  2560x1440  165.000289 Hz  16:9    251.790 kHz    684.870000 MHz (aspect 16:9, no 3D stereo)
               Hfront   24 Hsync  16 Hback  120 Hpol N
               Vfront    2 Vsync   5 Vback   79 Vpol N
  Checksum: 0x1d
Checksum: 0x90

----------------

Warnings:

Block 0, Base EDID:
  Vendor & Product Identification: The serial number is one of the known dummy values, it should probably be set to 0.
Block 1, CTA-861 Extension Block:
  IT Video Formats are overscanned by default, but normally this should be underscanned.
  Video Data Block: VIC 3 and the first DTD are not identical. Is this intended?
  Colorimetry Data Block: Set the sRGB colorimetry bit to avoid interop issues.
  Display Product Serial Number is set, so the Serial Number in the Base EDID should be 0.
EDID:
  Base EDID: Some timings are out of range of the Monitor Ranges:
    Horizontal Freq: 31.468 - 366.477 kHz (Monitor: 390.000 - 390.000 kHz)

Failures:

Block 1, CTA-861 Extension Block:
  Missing VCDB, needed for Set Selectable RGB Quantization to avoid interop issues.
EDID:
  Extension Block 3 started with EDID header, ignoring Extension Blocks >= 3.
  DisplayID: Missing DisplayID Display Parameters Data Block.
  DisplayID: DisplayID expects at least one preferred timing.

EDID conformity: FAIL
