edid-decode (hex):

00 ff ff ff ff ff ff 00 26 cd 12 76 01 01 01 01
0e 1e 01 03 80 50 23 78 2a 81 95 a3 55 53 9f 25
0a 50 54 bf ef 80 d1 c0 e1 c0 d1 00 d1 cf a9 40
a9 c0 81 80 81 00 4e ab 70 b8 d1 a0 42 50 90 60
64 08 20 59 31 00 00 1a 00 00 00 ff 00 31 31 37
31 34 30 31 34 30 30 30 33 33 00 00 00 fc 00 50
4c 33 34 39 33 57 51 0a 20 20 20 20 00 00 00 fd
00 30 4c 0f 72 3c 00 0a 20 20 20 20 20 20 01 e0

02 03 3a f0 4f 10 1f 04 13 03 12 02 11 05 14 07
16 06 15 01 23 09 07 07 83 01 00 00 67 03 0c 00
11 00 00 3c 67 d8 5d c4 01 78 80 00 e6 06 07 01
8b 60 11 e3 05 e0 00 e2 00 ea 02 3a 80 18 71 38
2d 40 58 2c 45 00 10 09 00 00 00 1e 02 3a 80 d0
72 38 2d 40 10 2c 45 80 10 09 00 00 00 1e 01 1d
00 72 51 d0 1e 20 6e 28 55 00 10 09 00 00 00 1e
00 00 00 00 00 00 00 00 00 00 00 00 00 00 00 8e

00 ff ff ff ff ff ff 00 26 cd 12 76 01 01 01 01
0e 1e 01 03 80 50 23 78 2a 81 95 a3 55 53 9f 25
0a 50 54 bf ef 80 d1 c0 e1 c0 d1 00 d1 cf a9 40
a9 c0 81 80 81 00 4e ab 70 b8 d1 a0 42 50 90 60
64 08 20 59 31 00 00 1a 00 00 00 ff 00 31 31 37
31 34 30 31 34 30 30 30 33 33 00 00 00 fc 00 50
4c 33 34 39 33 57 51 0a 20 20 20 20 00 00 00 fd
00 30 4c 0f 72 3c 00 0a 20 20 20 20 20 20 01 e0

02 03 3a f0 4f 10 1f 04 13 03 12 02 11 05 14 07
16 06 15 01 23 09 07 07 83 01 00 00 67 03 0c 00
11 00 00 3c 67 d8 5d c4 01 78 80 00 e6 06 07 01
8b 60 11 e3 05 e0 00 e2 00 ea 02 3a 80 18 71 38
2d 40 58 2c 45 00 10 09 00 00 00 1e 02 3a 80 d0
72 38 2d 40 10 2c 45 80 10 09 00 00 00 1e 01 1d
00 72 51 d0 1e 20 6e 28 55 00 10 09 00 00 00 1e
00 00 00 00 00 00 00 00 00 00 00 00 00 00 00 8e

----------------

Block 0, Base EDID:
  EDID Structure Version & Revision: 1.3
  Vendor & Product Identification:
    Manufacturer: IVM
    Model: 30226
    Serial Number: ...
    Made in: week 14 of 2020
  Basic Display Parameters & Features:
    Digital display
    Maximum image size: 80 cm x 35 cm
    Gamma: 2.20
    DPMS levels: Off
    RGB color display
    First detailed timing is the preferred timing
  Color Characteristics:
    Red  : 0.6386, 0.3320
    Green: 0.3242, 0.6220
    Blue : 0.1464, 0.0400
    White: 0.3134, 0.3291
  Established Timings I & II:
    IBM     :   720x400    70.081663 Hz   9:5     31.467 kHz     28.320000 MHz
    DMT 0x04:   640x480    59.940476 Hz   4:3     31.469 kHz     25.175000 MHz
    Apple   :   640x480    66.666667 Hz   4:3     35.000 kHz     30.240000 MHz
    DMT 0x05:   640x480    72.808802 Hz   4:3     37.861 kHz     31.500000 MHz
    DMT 0x06:   640x480    75.000000 Hz   4:3     37.500 kHz     31.500000 MHz
    DMT 0x08:   800x600    56.250000 Hz   4:3     35.156 kHz     36.000000 MHz
    DMT 0x09:   800x600    60.316541 Hz   4:3     37.879 kHz     40.000000 MHz
    DMT 0x0a:   800x600    72.187572 Hz   4:3     48.077 kHz     50.000000 MHz
    DMT 0x0b:   800x600    75.000000 Hz   4:3     46.875 kHz     49.500000 MHz
    Apple   :   832x624    74.551266 Hz   4:3     49.726 kHz     57.284000 MHz
    DMT 0x10:  1024x768    60.003840 Hz   4:3     48.363 kHz     65.000000 MHz
    DMT 0x11:  1024x768    70.069359 Hz   4:3     56.476 kHz     75.000000 MHz
    DMT 0x12:  1024x768    75.028582 Hz   4:3     60.023 kHz     78.750000 MHz
    DMT 0x24:  1280x1024   75.024675 Hz   5:4     79.976 kHz    135.000000 MHz
    Apple   :  1152x870    75.061550 Hz 192:145   68.681 kHz    100.000000 MHz
  Standard Timings:
    DMT 0x52:  1920x1080   60.000000 Hz  16:9     67.500 kHz    148.500000 MHz
    DMT 0x54:  2048x1152   60.000000 Hz  16:9     72.000 kHz    162.000000 MHz (RB)
    DMT 0x45:  1920x1200   59.884600 Hz  16:10    74.556 kHz    193.250000 MHz
    GTF     :  1920x1080   75.000068 Hz  16:9     84.600 kHz    220.637000 MHz
    DMT 0x33:  1600x1200   60.000000 Hz   4:3     75.000 kHz    162.000000 MHz
    DMT 0x53:  1600x900    60.000000 Hz  16:9     60.000 kHz    108.000000 MHz (RB)
    DMT 0x23:  1280x1024   60.019740 Hz   5:4     63.981 kHz    108.000000 MHz
    DMT 0x1c:  1280x800    59.810326 Hz  16:10    49.702 kHz     83.500000 MHz
  Detailed Timing Descriptors:
    DTD 1:  3440x1440   75.050314 Hz  43:18   113.026 kHz    438.540000 MHz (800 mm x 345 mm)
                 Hfront  144 Hsync  96 Hback  200 Hpol P
                 Vfront   38 Vsync   4 Vback   24 Vpol N
    Display Product Serial Number: ...
    Display Product Name: 'PL3493WQ'
    Display Range Limits:
      Monitor ranges (GTF): 48-76 Hz V, 15-114 kHz H, max dotclock 600 MHz
  Extension blocks: 1
Checksum: 0xe0

----------------

Block 1, CTA-861 Extension Block:
  Revision: 3
  Underscans IT Video Formats by default
  Basic audio support
  Supports YCbCr 4:4:4
  Supports YCbCr 4:2:2
  Native DTDs: 0
  Video Data Block:
    VIC  16:  1920x1080   60.000000 Hz  16:9     67.500 kHz    148.500000 MHz
    VIC  31:  1920x1080   50.000000 Hz  16:9     56.250 kHz    148.500000 MHz
    VIC   4:  1280x720    60.000000 Hz  16:9     45.000 kHz     74.250000 MHz
    VIC  19:  1280x720    50.000000 Hz  16:9     37.500 kHz     74.250000 MHz
    VIC   3:   720x480    59.940060 Hz  16:9     31.469 kHz     27.000000 MHz
    VIC  18:   720x576    50.000000 Hz  16:9     31.250 kHz     27.000000 MHz
    VIC   2:   720x480    59.940060 Hz   4:3     31.469 kHz     27.000000 MHz
    VIC  17:   720x576    50.000000 Hz   4:3     31.250 kHz     27.000000 MHz
    VIC   5:  1920x1080i  60.000000 Hz  16:9     33.750 kHz     74.250000 MHz
    VIC  20:  1920x1080i  50.000000 Hz  16:9     28.125 kHz     74.250000 MHz
    VIC   7:  1440x480i   59.940060 Hz  16:9     15.734 kHz     27.000000 MHz
    VIC  22:  1440x576i   50.000000 Hz  16:9     15.625 kHz     27.000000 MHz
    VIC   6:  1440x480i   59.940060 Hz   4:3     15.734 kHz     27.000000 MHz
    VIC  21:  1440x576i   50.000000 Hz   4:3     15.625 kHz     27.000000 MHz
    VIC   1:   640x480    59.940476 Hz   4:3     31.469 kHz     25.175000 MHz
  Audio Data Block:
    Linear PCM:
      Max channels: 2
      Supported sample rates (kHz): 48 44.1 32
      Supported sample sizes (bits): 24 20 16
  Speaker Allocation Data Block:
    FL/FR - Front Left/Right
  Vendor-Specific Data Block (HDMI), OUI 00-0C-03:
    Source physical address: 1.1.0.0
    Maximum TMDS clock: 300 MHz
  Vendor-Specific Data Block (HDMI Forum), OUI C4-5D-D8:
    Version: 1
    Maximum TMDS Character Rate: 600 MHz
    SCDC Present
  HDR Static Metadata Data Block:
    Electro optical transfer functions:
      Traditional gamma - SDR luminance range
      Traditional gamma - HDR luminance range
      SMPTE ST2084
    Supported static metadata descriptors:
      Static metadata type 1
    Desired content max luminance: 139 (1015.241 cd/m^2)
    Desired content max frame-average luminance: 96 (400.000 cd/m^2)
    Desired content min luminance: 17 (0.045 cd/m^2)
  Colorimetry Data Block:
    BT2020cYCC
    BT2020YCC
    BT2020RGB
  Video Capability Data Block:
    YCbCr quantization: Selectable (via AVI YQ)
    RGB quantization: Selectable (via AVI Q)
    PT scan behavior: Always Underscanned
    IT scan behavior: Always Underscanned
    CE scan behavior: Always Underscanned
  Detailed Timing Descriptors:
    DTD 2:  1920x1080   60.000000 Hz  16:9     67.500 kHz    148.500000 MHz (16 mm x 9 mm)
                 Hfront   88 Hsync  44 Hback  148 Hpol P
                 Vfront    4 Vsync   5 Vback   36 Vpol P
    DTD 3:  1920x1080   50.000000 Hz  16:9     56.250 kHz    148.500000 MHz (16 mm x 9 mm)
                 Hfront  528 Hsync  44 Hback  148 Hpol P
                 Vfront    4 Vsync   5 Vback   36 Vpol P
    DTD 4:  1280x720    60.000000 Hz  16:9     45.000 kHz     74.250000 MHz (16 mm x 9 mm)
                 Hfront  110 Hsync  40 Hback  220 Hpol P
                 Vfront    5 Vsync   5 Vback   20 Vpol P
Checksum: 0x8e  Unused space in Extension Block: 15 bytes

----------------

Warnings:

Block 0, Base EDID:
  Vendor & Product Identification: The serial number is one of the known dummy values, it should probably be set to 0.
  Detailed Timing Descriptor #1: Image size is 800x345 mm, but based on the picture AR it should be 800x334 mm.
Block 1, CTA-861 Extension Block:
  Video Data Block: VIC 16 and the first DTD are not identical. Is this intended?
  Colorimetry Data Block: Set the sRGB colorimetry bit to avoid interop issues.
  Video Capability Data Block: S_PT is equal to S_IT and S_CE, so should be set to 0 instead.
  Detailed Timing Descriptor #2: Dubious image size (16x9 mm is smaller than 100x100 mm).
  Detailed Timing Descriptor #3: Dubious image size (16x9 mm is smaller than 100x100 mm).
  Detailed Timing Descriptor #4: Dubious image size (16x9 mm is smaller than 100x100 mm).
  Display Product Serial Number is set, so the Serial Number in the Base EDID should be 0.

Failures:

Block 1, CTA-861 Extension Block:
  Detailed Timing Descriptor #2: Mismatch of image size 16x9 mm vs display size 800x350 mm.
  Detailed Timing Descriptor #3: Mismatch of image size 16x9 mm vs display size 800x350 mm.
  Detailed Timing Descriptor #4: Mismatch of image size 16x9 mm vs display size 800x350 mm.
EDID:
  Extension Block 2 started with EDID header, ignoring Extension Blocks >= 2.

EDID conformity: FAIL
