edid-decode (hex):

00 ff ff ff ff ff ff 00 06 af ed 52 fc 43 35 30
20 1a 01 04 a5 22 13 78 02 96 85 a2 58 54 9f 27
0e 50 54 00 00 00 01 01 01 01 01 01 01 01 01 01
01 01 01 01 01 01 98 71 80 c8 70 38 3e 40 6c 30
aa 00 58 c1 10 00 00 18 98 71 80 c8 70 38 b4 44
6c 30 aa 00 58 c1 10 00 00 18 00 00 00 fe 00 41
55 4f 0a 20 20 20 20 20 20 20 20 20 00 00 00 fe
00 42 31 35 36 48 54 4e 30 35 2e 32 20 0a 00 b2

----------------

Block 0, Base EDID:
  EDID Structure Version & Revision: 1.4
  Vendor & Product Identification:
    Manufacturer: AUO
    Model: 21229
    Serial Number: ...
    Made in: week 32 of 2016
  Basic Display Parameters & Features:
    Digital display
    Bits per primary color channel: 8
    DisplayPort interface
    Maximum image size: 34 cm x 19 cm
    Gamma: 2.20
    Supported color formats: RGB 4:4:4
    First detailed timing includes the native pixel format and preferred refresh rate
  Color Characteristics:
    Red  : 0.6347, 0.3447
    Green: 0.3291, 0.6230
    Blue : 0.1542, 0.0546
    White: 0.3134, 0.3291
  Established Timings I & II: none
  Standard Timings: none
  Detailed Timing Descriptors:
    DTD 1:  1920x1080  120.113670 Hz  16:9    137.170 kHz    290.800000 MHz (344 mm x 193 mm)
                 Hfront  108 Hsync  48 Hback   44 Hpol N
                 Vfront   10 Vsync  10 Vback   42 Vpol N
    DTD 2:  1920x1080   60.056835 Hz  16:9    137.170 kHz    290.800000 MHz (344 mm x 193 mm)
                 Hfront  108 Hsync  48 Hback   44 Hpol N
                 Vfront   10 Vsync  10 Vback 1184 Vpol N
    Alphanumeric Data String: 'AUO'
    Alphanumeric Data String: 'B156HTN05.2 '
Checksum: 0xb2

----------------

Warnings:

Block 0, Base EDID:
  Missing Display Product Name.

Failures:

Block 0, Base EDID:
  Alphanumeric Data String: One or more trailing spaces before newline.

EDID conformity: FAIL
