edid-decode (hex):

00 ff ff ff ff ff ff 00 50 74 70 02 00 00 00 00
16 1c 01 03 80 34 1d 78 2e 35 85 a6 56 48 9a 24
12 50 54 2f cf 00 71 4f 81 80 81 00 95 00 b3 00
a9 c0 d1 00 81 c0 02 3a 80 18 71 38 2d 40 58 2c
45 00 e0 0e 11 00 00 1e 56 5e 00 a0 a0 a0 29 50
30 20 35 00 80 68 21 00 00 1a e2 68 00 a0 a0 40
2e 60 30 20 36 00 80 90 21 00 00 1a 00 00 00 fc
00 57 6f 69 65 79 65 6b 73 2d 44 50 0a 20 01 c8

02 03 0b 40 26 09 7f 07 11 7f 50 35 2f 00 a0 a0
a0 29 50 30 20 35 00 80 68 21 00 00 1a 71 34 00
a0 a0 40 2e 60 30 20 36 00 80 90 21 00 00 1a 04
74 80 18 71 38 2d 40 58 2c 45 00 e0 0e 11 00 00
1e 28 68 00 a0 f0 70 3e 80 30 20 35 00 c0 1c 32
00 00 1a 06 3b 00 a0 f0 70 3e 80 30 20 35 00 c0
1c 32 00 00 1a 00 00 00 00 00 00 00 00 00 00 00
00 00 00 00 00 00 00 00 00 00 00 00 00 00 00 7f

00 ff ff ff ff ff ff 00 50 74 70 02 00 00 00 00
16 1c 01 03 80 34 1d 78 2e 35 85 a6 56 48 9a 24
12 50 54 2f cf 00 71 4f 81 80 81 00 95 00 b3 00
a9 c0 d1 00 81 c0 02 3a 80 18 71 38 2d 40 58 2c
45 00 e0 0e 11 00 00 1e 56 5e 00 a0 a0 a0 29 50
30 20 35 00 80 68 21 00 00 1a e2 68 00 a0 a0 40
2e 60 30 20 36 00 80 90 21 00 00 1a 00 00 00 fc
00 57 6f 69 65 79 65 6b 73 2d 44 50 0a 20 01 c8

02 03 0b 40 26 09 7f 07 11 7f 50 35 2f 00 a0 a0
a0 29 50 30 20 35 00 80 68 21 00 00 1a 71 34 00
a0 a0 40 2e 60 30 20 36 00 80 90 21 00 00 1a 04
74 80 18 71 38 2d 40 58 2c 45 00 e0 0e 11 00 00
1e 28 68 00 a0 f0 70 3e 80 30 20 35 00 c0 1c 32
00 00 1a 06 3b 00 a0 f0 70 3e 80 30 20 35 00 c0
1c 32 00 00 1a 00 00 00 00 00 00 00 00 00 00 00
00 00 00 00 00 00 00 00 00 00 00 00 00 00 00 7f

----------------

Block 0, Base EDID:
  EDID Structure Version & Revision: 1.3
  Vendor & Product Identification:
    Manufacturer: TCT
    Model: 624
    Made in: week 22 of 2018
  Basic Display Parameters & Features:
    Digital display
    Maximum image size: 52 cm x 29 cm
    Gamma: 2.20
    DPMS levels: Off
    RGB color display
    Default (sRGB) color space is primary color space
    First detailed timing is the preferred timing
  Color Characteristics:
    Red  : 0.6484, 0.3388
    Green: 0.2822, 0.6025
    Blue : 0.1425, 0.0703
    White: 0.3134, 0.3291
  Established Timings I & II:
    DMT 0x04:   640x480    59.940476 Hz   4:3     31.469 kHz     25.175000 MHz
    DMT 0x05:   640x480    72.808802 Hz   4:3     37.861 kHz     31.500000 MHz
    DMT 0x06:   640x480    75.000000 Hz   4:3     37.500 kHz     31.500000 MHz
    DMT 0x08:   800x600    56.250000 Hz   4:3     35.156 kHz     36.000000 MHz
    DMT 0x09:   800x600    60.316541 Hz   4:3     37.879 kHz     40.000000 MHz
    DMT 0x0a:   800x600    72.187572 Hz   4:3     48.077 kHz     50.000000 MHz
    DMT 0x0b:   800x600    75.000000 Hz   4:3     46.875 kHz     49.500000 MHz
    DMT 0x10:  1024x768    60.003840 Hz   4:3     48.363 kHz     65.000000 MHz
    DMT 0x11:  1024x768    70.069359 Hz   4:3     56.476 kHz     75.000000 MHz
    DMT 0x12:  1024x768    75.028582 Hz   4:3     60.023 kHz     78.750000 MHz
    DMT 0x24:  1280x1024   75.024675 Hz   5:4     79.976 kHz    135.000000 MHz
  Standard Timings:
    DMT 0x15:  1152x864    75.000000 Hz   4:3     67.500 kHz    108.000000 MHz
    DMT 0x23:  1280x1024   60.019740 Hz   5:4     63.981 kHz    108.000000 MHz
    DMT 0x1c:  1280x800    59.810326 Hz  16:10    49.702 kHz     83.500000 MHz
    DMT 0x2f:  1440x900    59.887445 Hz  16:10    55.935 kHz    106.500000 MHz
    DMT 0x3a:  1680x1050   59.954250 Hz  16:10    65.290 kHz    146.250000 MHz
    DMT 0x53:  1600x900    60.000000 Hz  16:9     60.000 kHz    108.000000 MHz (RB)
    DMT 0x45:  1920x1200   59.884600 Hz  16:10    74.556 kHz    193.250000 MHz
    DMT 0x55:  1280x720    60.000000 Hz  16:9     45.000 kHz     74.250000 MHz
  Detailed Timing Descriptors:
    DTD 1:  1920x1080   60.000000 Hz  16:9     67.500 kHz    148.500000 MHz (480 mm x 270 mm)
                 Hfront   88 Hsync  44 Hback  148 Hpol P
                 Vfront    4 Vsync   5 Vback   36 Vpol P
    DTD 2:  2560x1440   59.950550 Hz  16:9     88.787 kHz    241.500000 MHz (640 mm x 360 mm)
                 Hfront   48 Hsync  32 Hback   80 Hpol P
                 Vfront    3 Vsync   5 Vback   33 Vpol N
    DTD 3:  2560x1600   59.971589 Hz  16:10    98.713 kHz    268.500000 MHz (640 mm x 400 mm)
                 Hfront   48 Hsync  32 Hback   80 Hpol P
                 Vfront    3 Vsync   6 Vback   37 Vpol N
    Display Product Name: 'Woieyeks-DP'
  Extension blocks: 1
Checksum: 0xc8

----------------

Block 1, CTA-861 Extension Block:
  Revision: 3
  Basic audio support
  Native DTDs: 0
  Audio Data Block:
    Linear PCM:
      Max channels: 2
      Supported sample rates (kHz): 192 176.4 96 88.2 48 44.1 32
      Supported sample sizes (bits): 24 20 16
    AC-3:
      Max channels: 2
      Supported sample rates (kHz): 192 176.4 96 88.2 48 44.1 32
      Maximum bit rate: 640 kb/s
  Detailed Timing Descriptors:
    DTD 4:  2560x1440   30.000099 Hz  16:9     44.430 kHz    120.850000 MHz (640 mm x 360 mm)
                 Hfront   48 Hsync  32 Hback   80 Hpol P
                 Vfront    3 Vsync   5 Vback   33 Vpol N
    DTD 5:  2560x1600   29.985794 Hz  16:10    49.357 kHz    134.250000 MHz (640 mm x 400 mm)
                 Hfront   48 Hsync  32 Hback   80 Hpol P
                 Vfront    3 Vsync   6 Vback   37 Vpol N
    DTD 6:  1920x1080  120.000000 Hz  16:9    135.000 kHz    297.000000 MHz (480 mm x 270 mm)
                 Hfront   88 Hsync  44 Hback  148 Hpol P
                 Vfront    4 Vsync   5 Vback   36 Vpol P
    DTD 7:  3840x2160   30.000000 Hz  16:9     66.660 kHz    266.640000 MHz (960 mm x 540 mm)
                 Hfront   48 Hsync  32 Hback   80 Hpol P
                 Vfront    3 Vsync   5 Vback   54 Vpol N
    DTD 8:  3840x2160   17.000450 Hz  16:9     37.775 kHz    151.100000 MHz (960 mm x 540 mm)
                 Hfront   48 Hsync  32 Hback   80 Hpol P
                 Vfront    3 Vsync   5 Vback   54 Vpol N
Checksum: 0x7f  Unused space in Extension Block: 26 bytes

----------------

Warnings:

Block 0, Base EDID:
  Detailed Timing Descriptor #1: DTD is identical to VIC 16, which is not present in the CTA Ext Block.
Block 1, CTA-861 Extension Block:
  IT Video Formats are overscanned by default, but normally this should be underscanned.
  Detailed Timing Descriptor #6: DTD is identical to VIC 63, which is not present in the CTA Ext Block.

Failures:

Block 0, Base EDID:
  Basic Display Parameters & Features: sRGB is signaled, but the chromaticities do not match.
  Detailed Timing Descriptor #1: Mismatch of image size 480x270 mm vs display size 520x290 mm.
  Detailed Timing Descriptor #2: Mismatch of image size 640x360 mm vs display size 520x290 mm.
  Detailed Timing Descriptor #3: Mismatch of image size 640x400 mm vs display size 520x290 mm.
  Missing Display Range Limits Descriptor.
Block 1, CTA-861 Extension Block:
  Detailed Timing Descriptor #4: Mismatch of image size 640x360 mm vs display size 520x290 mm.
  Detailed Timing Descriptor #5: Mismatch of image size 640x400 mm vs display size 520x290 mm.
  Detailed Timing Descriptor #6: Mismatch of image size 480x270 mm vs display size 520x290 mm.
  Detailed Timing Descriptor #7: Mismatch of image size 960x540 mm vs display size 520x290 mm.
  Detailed Timing Descriptor #8: Mismatch of image size 960x540 mm vs display size 520x290 mm.
  Missing VCDB, needed for Set Selectable RGB Quantization to avoid interop issues.
EDID:
  Extension Block 2 started with EDID header, ignoring Extension Blocks >= 2.
  Base EDID: The DTD max image size is 960x540mm, which is larger than the display size 520.0x290.0mm.

EDID conformity: FAIL
