edid-decode (hex):

00 ff ff ff ff ff ff 00 20 a3 47 10 00 00 00 00
14 21 01 04 b5 3c 22 78 3b 95 d9 b2 4b 32 bd 24
0d 50 54 af cf 00 81 80 71 4f b3 00 a9 c0 81 bc
95 3c b3 3c d1 fc 6a 5e 00 a0 a0 a0 29 50 30 20
35 00 55 50 21 00 00 1a 00 00 00 fd 00 30 a5 fa
fa 46 01 0a 20 20 20 20 20 20 00 00 00 fc 00 32
37 47 37 48 0a 20 20 20 20 20 20 20 00 00 00 ff
00 37 33 37 41 39 31 44 48 4b 30 31 32 34 02 3b

02 03 2f f4 49 01 02 03 04 90 12 13 1f 3f 23 09
07 07 83 01 00 00 6d 1a 00 00 02 01 30 a5 00 00
00 00 00 00 e6 06 07 01 73 59 01 e3 05 c0 00 6f
c2 00 a0 a0 a0 55 50 30 20 35 00 55 50 21 00 00
1a 98 e2 00 a0 a0 a0 29 50 30 20 35 00 55 50 21
00 00 1a ab 22 a0 a0 50 84 1a 30 30 20 36 00 55
50 21 00 00 1e 00 00 00 00 00 00 00 00 00 00 00
00 00 00 00 00 00 00 00 00 00 00 00 00 00 00 04

70 12 79 00 00 03 01 14 f4 ff 00 84 ff 09 9f 00
37 00 27 00 9f 05 13 00 02 00 09 00 00 00 00 00
00 00 00 00 00 00 00 00 00 00 00 00 00 00 00 00
00 00 00 00 00 00 00 00 00 00 00 00 00 00 00 00
00 00 00 00 00 00 00 00 00 00 00 00 00 00 00 00
00 00 00 00 00 00 00 00 00 00 00 00 00 00 00 00
00 00 00 00 00 00 00 00 00 00 00 00 00 00 00 00
00 00 00 00 00 00 00 00 00 00 00 00 00 00 1f 90

00 ff ff ff ff ff ff 00 20 a3 47 10 00 00 00 00
14 21 01 04 b5 3c 22 78 3b 95 d9 b2 4b 32 bd 24
0d 50 54 af cf 00 81 80 71 4f b3 00 a9 c0 81 bc
95 3c b3 3c d1 fc 6a 5e 00 a0 a0 a0 29 50 30 20
35 00 55 50 21 00 00 1a 00 00 00 fd 00 30 a5 fa
fa 46 01 0a 20 20 20 20 20 20 00 00 00 fc 00 32
37 47 37 48 0a 20 20 20 20 20 20 20 00 00 00 ff
00 37 33 37 41 39 31 44 48 4b 30 31 32 34 02 3b

02 03 2f f4 49 01 02 03 04 90 12 13 1f 3f 23 09
07 07 83 01 00 00 6d 1a 00 00 02 01 30 a5 00 00
00 00 00 00 e6 06 07 01 73 59 01 e3 05 c0 00 6f
c2 00 a0 a0 a0 55 50 30 20 35 00 55 50 21 00 00
1a 98 e2 00 a0 a0 a0 29 50 30 20 35 00 55 50 21
00 00 1a ab 22 a0 a0 50 84 1a 30 30 20 36 00 55
50 21 00 00 1e 00 00 00 00 00 00 00 00 00 00 00
00 00 00 00 00 00 00 00 00 00 00 00 00 00 00 04

70 12 79 00 00 03 01 14 f4 ff 00 84 ff 09 9f 00
37 00 27 00 9f 05 13 00 02 00 09 00 00 00 00 00
00 00 00 00 00 00 00 00 00 00 00 00 00 00 00 00
00 00 00 00 00 00 00 00 00 00 00 00 00 00 00 00
00 00 00 00 00 00 00 00 00 00 00 00 00 00 00 00
00 00 00 00 00 00 00 00 00 00 00 00 00 00 00 00
00 00 00 00 00 00 00 00 00 00 00 00 00 00 00 00
00 00 00 00 00 00 00 00 00 00 00 00 00 00 1f 90

----------------

Block 0, Base EDID:
  EDID Structure Version & Revision: 1.4
  Vendor & Product Identification:
    Manufacturer: HEC
    Model: 4167
    Made in: week 20 of 2023
  Basic Display Parameters & Features:
    Digital display
    Bits per primary color channel: 10
    DisplayPort interface
    Maximum image size: 60 cm x 34 cm
    Gamma: 2.20
    DPMS levels: Off
    Supported color formats: RGB 4:4:4, YCrCb 4:4:4, YCrCb 4:2:2
    First detailed timing includes the native pixel format and preferred refresh rate
    Display supports continuous frequencies
  Color Characteristics:
    Red  : 0.6972, 0.2939
    Green: 0.1962, 0.7392
    Blue : 0.1435, 0.0517
    White: 0.3144, 0.3291
  Established Timings I & II:
    IBM     :   720x400    70.081663 Hz   9:5     31.467 kHz     28.320000 MHz
    DMT 0x04:   640x480    59.940476 Hz   4:3     31.469 kHz     25.175000 MHz
    DMT 0x05:   640x480    72.808802 Hz   4:3     37.861 kHz     31.500000 MHz
    DMT 0x06:   640x480    75.000000 Hz   4:3     37.500 kHz     31.500000 MHz
    DMT 0x08:   800x600    56.250000 Hz   4:3     35.156 kHz     36.000000 MHz
    DMT 0x09:   800x600    60.316541 Hz   4:3     37.879 kHz     40.000000 MHz
    DMT 0x0a:   800x600    72.187572 Hz   4:3     48.077 kHz     50.000000 MHz
    DMT 0x0b:   800x600    75.000000 Hz   4:3     46.875 kHz     49.500000 MHz
    DMT 0x10:  1024x768    60.003840 Hz   4:3     48.363 kHz     65.000000 MHz
    DMT 0x11:  1024x768    70.069359 Hz   4:3     56.476 kHz     75.000000 MHz
    DMT 0x12:  1024x768    75.028582 Hz   4:3     60.023 kHz     78.750000 MHz
    DMT 0x24:  1280x1024   75.024675 Hz   5:4     79.976 kHz    135.000000 MHz
  Standard Timings:
    DMT 0x23:  1280x1024   60.019740 Hz   5:4     63.981 kHz    108.000000 MHz
    DMT 0x15:  1152x864    75.000000 Hz   4:3     67.500 kHz    108.000000 MHz
    DMT 0x3a:  1680x1050   59.954250 Hz  16:10    65.290 kHz    146.250000 MHz
    DMT 0x53:  1600x900    60.000000 Hz  16:9     60.000 kHz    108.000000 MHz (RB)
    GTF     :  1280x1024  120.000185 Hz   5:4    131.640 kHz    233.793000 MHz
    GTF     :  1440x900   119.999896 Hz  16:10   115.800 kHz    229.747000 MHz
    GTF     :  1680x1050  120.000000 Hz  16:10   135.000 kHz    313.200000 MHz
    GTF     :  1920x1080  119.999987 Hz  16:9    138.840 kHz    368.759000 MHz
  Detailed Timing Descriptors:
    DTD 1:  2560x1440   60.000199 Hz  16:9     88.860 kHz    241.700000 MHz (597 mm x 336 mm)
                 Hfront   48 Hsync  32 Hback   80 Hpol P
                 Vfront    3 Vsync   5 Vback   33 Vpol N
    Display Range Limits:
      Monitor ranges (Range Limits Only): 48-165 Hz V, 250-250 kHz H, max dotclock 700 MHz
    Display Product Name: '27G7H'
    Display Product Serial Number: ...
  Extension blocks: 2
Checksum: 0x3b

----------------

Block 1, CTA-861 Extension Block:
  Revision: 3
  Underscans IT Video Formats by default
  Basic audio support
  Supports YCbCr 4:4:4
  Supports YCbCr 4:2:2
  Native DTDs: 4
  Video Data Block:
    VIC   1:   640x480    59.940476 Hz   4:3     31.469 kHz     25.175000 MHz
    VIC   2:   720x480    59.940060 Hz   4:3     31.469 kHz     27.000000 MHz
    VIC   3:   720x480    59.940060 Hz  16:9     31.469 kHz     27.000000 MHz
    VIC   4:  1280x720    60.000000 Hz  16:9     45.000 kHz     74.250000 MHz
    VIC  16:  1920x1080   60.000000 Hz  16:9     67.500 kHz    148.500000 MHz (native)
    VIC  18:   720x576    50.000000 Hz  16:9     31.250 kHz     27.000000 MHz
    VIC  19:  1280x720    50.000000 Hz  16:9     37.500 kHz     74.250000 MHz
    VIC  31:  1920x1080   50.000000 Hz  16:9     56.250 kHz    148.500000 MHz
    VIC  63:  1920x1080  120.000000 Hz  16:9    135.000 kHz    297.000000 MHz
  Audio Data Block:
    Linear PCM:
      Max channels: 2
      Supported sample rates (kHz): 48 44.1 32
      Supported sample sizes (bits): 24 20 16
  Speaker Allocation Data Block:
    FL/FR - Front Left/Right
  Vendor-Specific Data Block (AMD), OUI 00-00-1A:
    Version: 2
    Feature Caps: 0x01
    Minimum Refresh Rate: 48 Hz
    Maximum Refresh Rate: 165 Hz
    Flags 1.x: 0x00
    Flags 2.x: 0x00
  HDR Static Metadata Data Block:
    Electro optical transfer functions:
      Traditional gamma - SDR luminance range
      Traditional gamma - HDR luminance range
      SMPTE ST2084
    Supported static metadata descriptors:
      Static metadata type 1
    Desired content max luminance: 115 (603.666 cd/m^2)
    Desired content max frame-average luminance: 89 (343.724 cd/m^2)
    Desired content min luminance: 1 (0.000 cd/m^2)
  Colorimetry Data Block:
    BT2020YCC
    BT2020RGB
  Detailed Timing Descriptors:
    DTD 2:  2560x1440  119.997589 Hz  16:9    182.996 kHz    497.750000 MHz (597 mm x 336 mm)
                 Hfront   48 Hsync  32 Hback   80 Hpol P
                 Vfront    3 Vsync   5 Vback   77 Vpol N
    DTD 3:  2560x1440  144.000477 Hz  16:9    213.265 kHz    580.080000 MHz (597 mm x 336 mm)
                 Hfront   48 Hsync  32 Hback   80 Hpol P
                 Vfront    3 Vsync   5 Vback   33 Vpol N
    DTD 4:  1440x900    59.901458 Hz  16:10    55.469 kHz     88.750000 MHz (597 mm x 336 mm)
                 Hfront   48 Hsync  32 Hback   80 Hpol P
                 Vfront    3 Vsync   6 Vback   17 Vpol P
Checksum: 0x04  Unused space in Extension Block: 26 bytes

----------------

Block 2, DisplayID Extension Block:
  Version: 1.2
  Extension Count: 0
  Display Product Type: Extension Section
  Video Timing Modes Type 1 - Detailed Timings Data Block:
    DTD:  2560x1440  165.000504 Hz  16:9    240.901 kHz    655.250000 MHz (aspect 16:9, no 3D stereo, preferred)
               Hfront   56 Hsync  40 Hback   64 Hpol N
               Vfront    3 Vsync  10 Vback    7 Vpol N
  Checksum: 0x1f
Checksum: 0x90

----------------

Warnings:

Block 1, CTA-861 Extension Block:
  Video Data Block: VIC 1 and the first DTD are not identical. Is this intended?
  Video Data Block: All VICs are in ascending order, and the first (preferred) VIC <= 4, is that intended?
  Colorimetry Data Block: Set the sRGB colorimetry bit to avoid interop issues.
  Detailed Timing Descriptor #4: DTD is similar but not identical to DMT 0x2e.
  Detailed Timing Descriptor #4: Image size is 597x336 mm, but based on the picture AR it should be 537x336 mm.
EDID:
  Base EDID: Some timings are out of range of the Monitor Ranges:
    Horizontal Freq: 31.250 - 240.900 kHz (Monitor: 250.000 - 250.000 kHz)

Failures:

Block 1, CTA-861 Extension Block:
  Missing VCDB, needed for Set Selectable RGB Quantization to avoid interop issues.
Block 2, DisplayID Extension Block:
  DisplayID Base Block has no product type.
EDID:
  Extension Block 3 started with EDID header, ignoring Extension Blocks >= 3.
  CTA-861: Native progressive timings are a mix of several resolutions.

EDID conformity: FAIL
