edid-decode (hex):

00 ff ff ff ff ff ff 00 15 c3 97 27 9e a3 17 04
1c 1c 01 03 80 34 21 78 ea 3a 05 a9 54 4c 9c 26
11 50 54 a1 08 00 a9 40 81 80 b3 00 a9 c0 81 c0
81 00 01 01 01 01 28 3c 80 a0 70 b0 23 40 30 20
36 00 07 44 21 00 00 1a 02 3a 80 18 71 38 2d 40
58 2c 45 00 07 44 21 00 00 1e 00 00 00 fd 00 31
3d 0f 4c 11 00 0a 20 20 20 20 20 20 00 00 00 fc
00 45 56 32 34 35 36 0a 20 20 20 20 20 20 01 09

02 03 25 f1 4e 10 1f 1f 1f 04 13 03 13 02 13 13
13 13 13 23 09 07 07 83 01 00 00 66 03 0c 00 10
00 80 e2 00 7b 01 1d 00 72 51 d0 1e 20 6e 28 55
00 07 44 21 00 00 1e 01 1d 00 72 51 d0 1e 20 6e
28 55 00 07 44 21 00 00 1e 01 1d 00 72 51 d0 1e
20 6e 28 55 00 07 44 21 00 00 18 01 1d 00 72 51
d0 1e 20 6e 28 55 00 07 44 21 00 00 18 00 00 00
00 00 00 00 00 00 00 00 00 00 00 00 00 00 00 f8

00 ff ff ff ff ff ff 00 15 c3 97 27 9e a3 17 04
1c 1c 01 03 80 34 21 78 ea 3a 05 a9 54 4c 9c 26
11 50 54 a1 08 00 a9 40 81 80 b3 00 a9 c0 81 c0
81 00 01 01 01 01 28 3c 80 a0 70 b0 23 40 30 20
36 00 07 44 21 00 00 1a 02 3a 80 18 71 38 2d 40
58 2c 45 00 07 44 21 00 00 1e 00 00 00 fd 00 31
3d 0f 4c 11 00 0a 20 20 20 20 20 20 00 00 00 fc
00 45 56 32 34 35 36 0a 20 20 20 20 20 20 01 09

02 03 25 f1 4e 10 1f 1f 1f 04 13 03 13 02 13 13
13 13 13 23 09 07 07 83 01 00 00 66 03 0c 00 10
00 80 e2 00 7b 01 1d 00 72 51 d0 1e 20 6e 28 55
00 07 44 21 00 00 1e 01 1d 00 72 51 d0 1e 20 6e
28 55 00 07 44 21 00 00 1e 01 1d 00 72 51 d0 1e
20 6e 28 55 00 07 44 21 00 00 18 01 1d 00 72 51
d0 1e 20 6e 28 55 00 07 44 21 00 00 18 00 00 00
00 00 00 00 00 00 00 00 00 00 00 00 00 00 00 f8

----------------

Block 0, Base EDID:
  EDID Structure Version & Revision: 1.3
  Vendor & Product Identification:
    Manufacturer: ENC
    Model: 10135
    Serial Number: ...
    Made in: week 28 of 2018
  Basic Display Parameters & Features:
    Digital display
    Maximum image size: 52 cm x 33 cm
    Gamma: 2.20
    DPMS levels: Standby Suspend Off
    RGB color display
    First detailed timing is the preferred timing
  Color Characteristics:
    Red  : 0.6601, 0.3310
    Green: 0.2988, 0.6113
    Blue : 0.1484, 0.0664
    White: 0.3134, 0.3291
  Established Timings I & II:
    IBM     :   720x400    70.081663 Hz   9:5     31.467 kHz     28.320000 MHz
    DMT 0x04:   640x480    59.940476 Hz   4:3     31.469 kHz     25.175000 MHz
    DMT 0x09:   800x600    60.316541 Hz   4:3     37.879 kHz     40.000000 MHz
    DMT 0x10:  1024x768    60.003840 Hz   4:3     48.363 kHz     65.000000 MHz
  Standard Timings:
    DMT 0x33:  1600x1200   60.000000 Hz   4:3     75.000 kHz    162.000000 MHz
    DMT 0x23:  1280x1024   60.019740 Hz   5:4     63.981 kHz    108.000000 MHz
    DMT 0x3a:  1680x1050   59.954250 Hz  16:10    65.290 kHz    146.250000 MHz
    DMT 0x53:  1600x900    60.000000 Hz  16:9     60.000 kHz    108.000000 MHz (RB)
    DMT 0x55:  1280x720    60.000000 Hz  16:9     45.000 kHz     74.250000 MHz
    DMT 0x1c:  1280x800    59.810326 Hz  16:10    49.702 kHz     83.500000 MHz
  Detailed Timing Descriptors:
    DTD 1:  1920x1200   59.950171 Hz  16:10    74.038 kHz    154.000000 MHz (519 mm x 324 mm)
                 Hfront   48 Hsync  32 Hback   80 Hpol P
                 Vfront    3 Vsync   6 Vback   26 Vpol N
    DTD 2:  1920x1080   60.000000 Hz  16:9     67.500 kHz    148.500000 MHz (519 mm x 324 mm)
                 Hfront   88 Hsync  44 Hback  148 Hpol P
                 Vfront    4 Vsync   5 Vback   36 Vpol P
    Display Range Limits:
      Monitor ranges (GTF): 49-61 Hz V, 15-76 kHz H, max dotclock 170 MHz
    Display Product Name: 'EV2456'
  Extension blocks: 1
Checksum: 0x09

----------------

Block 1, CTA-861 Extension Block:
  Revision: 3
  Underscans IT Video Formats by default
  Basic audio support
  Supports YCbCr 4:4:4
  Supports YCbCr 4:2:2
  Native DTDs: 1
  Video Data Block:
    VIC  16:  1920x1080   60.000000 Hz  16:9     67.500 kHz    148.500000 MHz
    VIC  31:  1920x1080   50.000000 Hz  16:9     56.250 kHz    148.500000 MHz
    VIC  31:  1920x1080   50.000000 Hz  16:9     56.250 kHz    148.500000 MHz
    VIC  31:  1920x1080   50.000000 Hz  16:9     56.250 kHz    148.500000 MHz
    VIC   4:  1280x720    60.000000 Hz  16:9     45.000 kHz     74.250000 MHz
    VIC  19:  1280x720    50.000000 Hz  16:9     37.500 kHz     74.250000 MHz
    VIC   3:   720x480    59.940060 Hz  16:9     31.469 kHz     27.000000 MHz
    VIC  19:  1280x720    50.000000 Hz  16:9     37.500 kHz     74.250000 MHz
    VIC   2:   720x480    59.940060 Hz   4:3     31.469 kHz     27.000000 MHz
    VIC  19:  1280x720    50.000000 Hz  16:9     37.500 kHz     74.250000 MHz
    VIC  19:  1280x720    50.000000 Hz  16:9     37.500 kHz     74.250000 MHz
    VIC  19:  1280x720    50.000000 Hz  16:9     37.500 kHz     74.250000 MHz
    VIC  19:  1280x720    50.000000 Hz  16:9     37.500 kHz     74.250000 MHz
    VIC  19:  1280x720    50.000000 Hz  16:9     37.500 kHz     74.250000 MHz
  Audio Data Block:
    Linear PCM:
      Max channels: 2
      Supported sample rates (kHz): 48 44.1 32
      Supported sample sizes (bits): 24 20 16
  Speaker Allocation Data Block:
    FL/FR - Front Left/Right
  Vendor-Specific Data Block (HDMI), OUI 00-0C-03:
    Source physical address: 1.0.0.0
    Supports_AI
  Video Capability Data Block:
    YCbCr quantization: No Data
    RGB quantization: Selectable (via AVI Q)
    PT scan behavior: Supports both over- and underscan
    IT scan behavior: Always Underscanned
    CE scan behavior: Supports both over- and underscan
  Detailed Timing Descriptors:
    DTD 3:  1280x720    60.000000 Hz  16:9     45.000 kHz     74.250000 MHz (519 mm x 324 mm)
                 Hfront  110 Hsync  40 Hback  220 Hpol P
                 Vfront    5 Vsync   5 Vback   20 Vpol P
    DTD 4:  1280x720    60.000000 Hz  16:9     45.000 kHz     74.250000 MHz (519 mm x 324 mm)
                 Hfront  110 Hsync  40 Hback  220 Hpol P
                 Vfront    5 Vsync   5 Vback   20 Vpol P
    DTD 5:  1280x720    60.000000 Hz  16:9     45.000 kHz     74.250000 MHz (519 mm x 324 mm)
                 Hfront  110 Hsync  40 Hback  220 Hpol N
                 Vfront    5 Vsync   5 Vback   20 Vpol N
    DTD 6:  1280x720    60.000000 Hz  16:9     45.000 kHz     74.250000 MHz (519 mm x 324 mm)
                 Hfront  110 Hsync  40 Hback  220 Hpol N
                 Vfront    5 Vsync   5 Vback   20 Vpol N
Checksum: 0xf8  Unused space in Extension Block: 18 bytes

----------------

Warnings:

Block 0, Base EDID:
  Detailed Timing Descriptor #2: Image size is 519x324 mm, but based on the picture AR it should be 519x291 mm.
Block 1, CTA-861 Extension Block:
  Video Data Block: VIC 16 and the first DTD are not identical. Is this intended?
  Video Capability Data Block: Set Selectable YCbCr Quantization to avoid interop issues.
  Detailed Timing Descriptor #3: Image size is 519x324 mm, but based on the picture AR it should be 519x291 mm.
  Detailed Timing Descriptor #4: Image size is 519x324 mm, but based on the picture AR it should be 519x291 mm.
  Detailed Timing Descriptor #5: DTD is similar but not identical to VIC 4.
  Detailed Timing Descriptor #5: Image size is 519x324 mm, but based on the picture AR it should be 519x291 mm.
  Detailed Timing Descriptor #6: DTD is similar but not identical to VIC 4.
  Detailed Timing Descriptor #6: Image size is 519x324 mm, but based on the picture AR it should be 519x291 mm.
  Add a Colorimetry Data Block with the sRGB colorimetry bit set to avoid interop issues.
EDID:
  Base EDID: Some timings are out of range of the Monitor Ranges:
    Vertical Freq: 50.000 - 70.082 Hz (Monitor: 49.000 - 61.000 Hz)

Failures:

Block 1, CTA-861 Extension Block:
  Video Data Block: Duplicate VIC 31.
  Video Data Block: Duplicate VIC 19.
EDID:
  Extension Block 2 started with EDID header, ignoring Extension Blocks >= 2.

EDID conformity: FAIL
