edid-decode (hex):

00 ff ff ff ff ff ff 00 30 ae a4 40 00 00 00 00
00 19 01 04 81 1f 11 78 ea 42 95 a1 5a 57 94 27
0d 50 54 00 00 00 01 01 01 01 01 01 01 01 01 01
01 01 01 01 01 01 e4 5c 00 a0 a0 a0 11 50 30 20
23 00 36 ae 10 00 00 1e 00 00 00 fc 00 4c 50 31
34 30 51 48 31 2d 53 50 42 31 00 00 00 fd 00 00
3c 00 82 18 00 00 00 00 00 00 00 00 00 00 00 00
00 00 00 00 00 00 00 00 5b 00 00 00 00 00 00 00

----------------

Block 0, Base EDID:
  EDID Structure Version & Revision: 1.4
  Vendor & Product Identification:
    Manufacturer: LEN
    Model: 16548
    Made in: 2015
  Basic Display Parameters & Features:
    Digital display
    Color depth is undefined
    DVI interface
    Maximum image size: 31 cm x 17 cm
    Gamma: 2.20
    DPMS levels: Standby Suspend Off
    Supported color formats: RGB 4:4:4, YCrCb 4:4:4
    First detailed timing includes the native pixel format and preferred refresh rate
  Color Characteristics:
    Red  : 0.6298, 0.3515
    Green: 0.3398, 0.5800
    Blue : 0.1542, 0.0517
    White: 0.3134, 0.3291
  Established Timings I & II: none
  Standard Timings: none
  Detailed Timing Descriptors:
    DTD 1:  2560x1440   60.004441 Hz  16:9     87.426 kHz    237.800000 MHz (310 mm x 174 mm)
                 Hfront   48 Hsync  32 Hback   80 Hpol P
                 Vfront    2 Vsync   3 Vback   12 Vpol P
    Display Product Name: 'LP140QH1-SPB1'
    Display Range Limits:
      Monitor ranges (GTF): 0-60 Hz V, 0-130 kHz H, max dotclock 240 MHz
    Manufacturer-Specified Display Descriptor (0x00): 00 00 00 00 00 00 00 00 00 00 5b 00 00 00 00 00 '..........[.....'
Checksum: 0x00

----------------

Warnings:

Block 0, Base EDID:
  Display Range Limits: GTF support is deprecated in EDID 1.4.

Failures:

Block 0, Base EDID:
  Display Range Limits: GTF is supported, but the display does not support continuous frequencies.
  Display Range Limits: Byte 11 is 0x00 instead of 0x0a.
  Display Range Limits: Bytes 12-17 must be 0x20.

EDID conformity: FAIL
