edid-decode (hex):

00 ff ff ff ff ff ff 00 3e 83 20 01 00 00 00 00
01 15 01 03 81 22 1b 64 ca fd 7c a4 57 49 9a 25
12 47 4f af cf 00 81 40 81 80 01 01 61 59 01 01
01 01 01 01 01 01 94 2a 00 b0 51 00 24 40 50 88
17 00 52 0e 11 00 00 1c 00 00 00 ff 00 30 30 30
30 30 30 30 30 30 30 30 30 0a 00 00 00 fd 00 37
4b 1e 50 0f 00 0a 20 20 20 20 20 20 00 00 00 fc
00 31 37 52 54 43 0a 20 20 20 20 20 20 20 01 10

02 03 1c 71 49 85 04 03 01 11 13 14 10 1f 23 09
07 07 83 01 00 00 66 03 0c 00 10 00 01 1d 80 18
71 1c 16 20 58 2c 25 00 24 cd 31 00 00 9f 01 1d
00 72 51 d0 1e 20 6e 28 55 00 34 cd 31 00 00 1e
8c 0a d0 8a 20 e0 2d 10 10 3e 96 00 34 cd 31 00
00 19 01 1d 80 d0 72 1c 16 20 10 2c 25 80 34 cd
31 00 00 9e 00 00 00 00 00 00 00 00 00 00 00 00
00 00 00 00 00 00 00 00 00 00 00 00 00 00 00 a2

00 ff ff ff ff ff ff 00 3e 83 20 01 00 00 00 00
01 15 01 03 81 22 1b 64 ca fd 7c a4 57 49 9a 25
12 47 4f af cf 00 81 40 81 80 01 01 61 59 01 01
01 01 01 01 01 01 94 2a 00 b0 51 00 24 40 50 88
17 00 52 0e 11 00 00 1c 00 00 00 ff 00 30 30 30
30 30 30 30 30 30 30 30 30 0a 00 00 00 fd 00 37
4b 1e 50 0f 00 0a 20 20 20 20 20 20 00 00 00 fc
00 31 37 52 54 43 0a 20 20 20 20 20 20 20 01 10

02 03 1c 71 49 85 04 03 01 11 13 14 10 1f 23 09
07 07 83 01 00 00 66 03 0c 00 10 00 01 1d 80 18
71 1c 16 20 58 2c 25 00 24 cd 31 00 00 9f 01 1d
00 72 51 d0 1e 20 6e 28 55 00 34 cd 31 00 00 1e
8c 0a d0 8a 20 e0 2d 10 10 3e 96 00 34 cd 31 00
00 19 01 1d 80 d0 72 1c 16 20 10 2c 25 80 34 cd
31 00 00 9e 00 00 00 00 00 00 00 00 00 00 00 00
00 00 00 00 00 00 00 00 00 00 00 00 00 00 00 a2

----------------

Block 0, Base EDID:
  EDID Structure Version & Revision: 1.3
  Vendor & Product Identification:
    Manufacturer: OTC
    Model: 288
    Made in: week 1 of 2011
  Basic Display Parameters & Features:
    Digital display
    DFP 1.x compatible TMDS
    Maximum image size: 34 cm x 27 cm
    Gamma: 2.00
    DPMS levels: Standby Suspend
    RGB color display
    First detailed timing is the preferred timing
  Color Characteristics:
    Red  : 0.6435, 0.3427
    Green: 0.2880, 0.6025
    Blue : 0.1455, 0.0732
    White: 0.2802, 0.3085
  Established Timings I & II:
    IBM     :   720x400    70.081663 Hz   9:5     31.467 kHz     28.320000 MHz
    DMT 0x04:   640x480    59.940476 Hz   4:3     31.469 kHz     25.175000 MHz
    DMT 0x05:   640x480    72.808802 Hz   4:3     37.861 kHz     31.500000 MHz
    DMT 0x06:   640x480    75.000000 Hz   4:3     37.500 kHz     31.500000 MHz
    DMT 0x08:   800x600    56.250000 Hz   4:3     35.156 kHz     36.000000 MHz
    DMT 0x09:   800x600    60.316541 Hz   4:3     37.879 kHz     40.000000 MHz
    DMT 0x0a:   800x600    72.187572 Hz   4:3     48.077 kHz     50.000000 MHz
    DMT 0x0b:   800x600    75.000000 Hz   4:3     46.875 kHz     49.500000 MHz
    DMT 0x10:  1024x768    60.003840 Hz   4:3     48.363 kHz     65.000000 MHz
    DMT 0x11:  1024x768    70.069359 Hz   4:3     56.476 kHz     75.000000 MHz
    DMT 0x12:  1024x768    75.028582 Hz   4:3     60.023 kHz     78.750000 MHz
    DMT 0x24:  1280x1024   75.024675 Hz   5:4     79.976 kHz    135.000000 MHz
  Standard Timings:
    DMT 0x20:  1280x960    60.000000 Hz   4:3     60.000 kHz    108.000000 MHz
    DMT 0x23:  1280x1024   60.019740 Hz   5:4     63.981 kHz    108.000000 MHz
    DMT 0x13:  1024x768    84.996690 Hz   4:3     68.677 kHz     94.500000 MHz
  Detailed Timing Descriptors:
    DTD 1:  1280x1024   60.064363 Hz   5:4     63.668 kHz    109.000000 MHz (338 mm x 270 mm)
                 Hfront   80 Hsync 136 Hback  216 Hpol N
                 Vfront    1 Vsync   7 Vback   28 Vpol P
    Display Product Serial Number: ...
    Display Range Limits:
      Monitor ranges (GTF): 55-75 Hz V, 30-80 kHz H, max dotclock 150 MHz
    Display Product Name: '17RTC'
  Extension blocks: 1
Checksum: 0x10

----------------

Block 1, CTA-861 Extension Block:
  Revision: 3
  Basic audio support
  Supports YCbCr 4:4:4
  Supports YCbCr 4:2:2
  Native DTDs: 1
  Video Data Block:
    VIC   5:  1920x1080i  60.000000 Hz  16:9     33.750 kHz     74.250000 MHz (native)
    VIC   4:  1280x720    60.000000 Hz  16:9     45.000 kHz     74.250000 MHz
    VIC   3:   720x480    59.940060 Hz  16:9     31.469 kHz     27.000000 MHz
    VIC   1:   640x480    59.940476 Hz   4:3     31.469 kHz     25.175000 MHz
    VIC  17:   720x576    50.000000 Hz   4:3     31.250 kHz     27.000000 MHz
    VIC  19:  1280x720    50.000000 Hz  16:9     37.500 kHz     74.250000 MHz
    VIC  20:  1920x1080i  50.000000 Hz  16:9     28.125 kHz     74.250000 MHz
    VIC  16:  1920x1080   60.000000 Hz  16:9     67.500 kHz    148.500000 MHz
    VIC  31:  1920x1080   50.000000 Hz  16:9     56.250 kHz    148.500000 MHz
  Audio Data Block:
    Linear PCM:
      Max channels: 2
      Supported sample rates (kHz): 48 44.1 32
      Supported sample sizes (bits): 24 20 16
  Speaker Allocation Data Block:
    FL/FR - Front Left/Right
  Vendor-Specific Data Block (HDMI), OUI 00-0C-03:
    Source physical address: 1.0.0.0
    DVI_Dual
  Detailed Timing Descriptors:
    DTD 2:  1920x1080i  60.000000 Hz  16:9     33.750 kHz     74.250000 MHz (804 mm x 461 mm)
                 Hfront   88 Hsync  44 Hback  148 Hpol P
                 Vfront    2 Vsync   5 Vback   15 Vpol P Vfront +0.5 Odd Field
                 Vfront    2 Vsync   5 Vback   15 Vpol P Vback  +0.5 Even Field
    DTD 3:  1280x720    60.000000 Hz  16:9     45.000 kHz     74.250000 MHz (820 mm x 461 mm)
                 Hfront  110 Hsync  40 Hback  220 Hpol P
                 Vfront    5 Vsync   5 Vback   20 Vpol P
    DTD 4:   720x480    59.940060 Hz   3:2     31.469 kHz     27.000000 MHz (820 mm x 461 mm)
                 Hfront   16 Hsync  62 Hback   60 Hpol N
                 Vfront    9 Vsync   6 Vback   30 Vpol N
    DTD 5:  1920x1080i  50.000000 Hz  16:9     28.125 kHz     74.250000 MHz (820 mm x 461 mm)
                 Hfront  528 Hsync  44 Hback  148 Hpol P
                 Vfront    2 Vsync   5 Vback   15 Vpol P Vfront +0.5 Odd Field
                 Vfront    2 Vsync   5 Vback   15 Vpol P Vback  +0.5 Even Field
Checksum: 0xa2  Unused space in Extension Block: 27 bytes

----------------

Warnings:

Block 0, Base EDID:
  Display Product Serial Number: ...
Block 1, CTA-861 Extension Block:
  IT Video Formats are overscanned by default, but normally this should be underscanned.
  Video Data Block: VIC 5 and the first DTD are not identical. Is this intended?
  Detailed Timing Descriptor #4: Image size is 820x461 mm, but based on the picture AR it should be 691x461 mm.
  Add a Colorimetry Data Block with the sRGB colorimetry bit set to avoid interop issues.
EDID:
  Base EDID: Some timings are out of range of the Monitor Ranges:
    Vertical Freq: 50.000 - 84.997 Hz (Monitor: 55.000 - 75.000 Hz)
    Horizontal Freq: 28.125 - 79.976 kHz (Monitor: 30.000 - 80.000 kHz)

Failures:

Block 1, CTA-861 Extension Block:
  Offset is 28, but should be 29.
  Detailed Timing Descriptor #2: Mismatch of image size 804x461 mm vs display size 340x270 mm.
  Detailed Timing Descriptor #3: Mismatch of image size 820x461 mm vs display size 340x270 mm.
  Detailed Timing Descriptor #4: Mismatch of image size 820x461 mm vs display size 340x270 mm.
  Detailed Timing Descriptor #5: Mismatch of image size 820x461 mm vs display size 340x270 mm.
  Missing VCDB, needed for Set Selectable RGB Quantization to avoid interop issues.
EDID:
  Extension Block 2 started with EDID header, ignoring Extension Blocks >= 2.
  Base EDID: The DTD max image size is 820x461mm, which is larger than the display size 340.0x270.0mm.

EDID conformity: FAIL
