edid-decode (hex):

00 ff ff ff ff ff ff 00 09 e5 f3 08 00 00 00 00
01 1d 01 04 a5 23 13 78 02 df 50 a3 54 35 b5 26
0f 50 54 00 00 00 01 01 01 01 01 01 01 01 01 01
01 01 01 01 01 01 52 d0 00 a0 f0 70 3e 80 30 20
35 00 58 c2 10 00 00 1a ae a6 00 a0 f0 70 3e 80
30 20 35 00 58 c2 10 00 00 1a 00 00 00 fe 00 42
4f 45 20 48 46 0a 20 20 20 20 20 20 00 00 00 fe
00 4e 45 31 35 36 51 55 4d 2d 4e 36 36 0a 00 cb

00 ff ff ff ff ff ff 00 09 e5 f3 08 00 00 00 00
01 1d 01 04 a5 23 13 78 02 df 50 a3 54 35 b5 26
0f 50 54 00 00 00 01 01 01 01 01 01 01 01 01 01
01 01 01 01 01 01 52 d0 00 a0 f0 70 3e 80 30 20
35 00 58 c2 10 00 00 1a ae a6 00 a0 f0 70 3e 80
30 20 35 00 58 c2 10 00 00 1a 00 00 00 fe 00 42
4f 45 20 48 46 0a 20 20 20 20 20 20 00 00 00 fe
00 4e 45 31 35 36 51 55 4d 2d 4e 36 36 0a 00 cb

----------------

Block 0, Base EDID:
  EDID Structure Version & Revision: 1.4
  Vendor & Product Identification:
    Manufacturer: BOE
    Model: 2291
    Made in: week 1 of 2019
  Basic Display Parameters & Features:
    Digital display
    Bits per primary color channel: 8
    DisplayPort interface
    Maximum image size: 35 cm x 19 cm
    Gamma: 2.20
    Supported color formats: RGB 4:4:4
    First detailed timing includes the native pixel format and preferred refresh rate
  Color Characteristics:
    Red  : 0.6396, 0.3291
    Green: 0.2099, 0.7099
    Blue : 0.1494, 0.0595
    White: 0.3125, 0.3281
  Established Timings I & II: none
  Standard Timings: none
  Detailed Timing Descriptors:
    DTD 1:  3840x2160   60.002250 Hz  16:9    133.325 kHz    533.300000 MHz (344 mm x 194 mm)
                 Hfront   48 Hsync  32 Hback   80 Hpol P
                 Vfront    3 Vsync   5 Vback   54 Vpol N
    DTD 2:  3840x2160   48.008551 Hz  16:9    106.675 kHz    426.700000 MHz (344 mm x 194 mm)
                 Hfront   48 Hsync  32 Hback   80 Hpol P
                 Vfront    3 Vsync   5 Vback   54 Vpol N
    Alphanumeric Data String: 'BOE HF'
    Alphanumeric Data String: 'NE156QUM-N66'
Checksum: 0xcb

----------------

Warnings:

Block 0, Base EDID:
  Missing Display Product Name.

Failures:

EDID:
  Extension Block 1 started with EDID header, ignoring Extension Blocks >= 1.

EDID conformity: FAIL
