edid-decode (hex):

00 ff ff ff ff ff ff 00 09 e5 77 0b 00 00 00 00
1a 20 01 04 a5 22 15 78 03 66 ea 95 54 58 92 27
1f 51 56 00 00 00 01 01 01 01 01 01 01 01 01 01
01 01 01 01 01 01 66 3f 80 a0 70 b0 64 40 30 20
36 00 59 d7 10 00 00 1a 00 00 00 fd 00 3c a5 d7
d7 2d 01 0a 20 20 20 20 20 20 00 00 00 fe 00 4e
45 31 36 30 57 55 4d 2d 4e 58 36 0a 00 00 00 00
00 00 00 00 00 00 00 00 00 00 00 00 00 00 01 be

70 20 79 02 00 22 00 14 f7 ce 06 85 7f 07 9f 00
2f 00 1f 00 af 04 63 00 02 00 05 00 2b 00 06 27
00 3c a4 00 00 81 00 13 72 1a 00 00 03 01 3c a5
00 00 00 00 00 00 a5 00 00 00 00 00 00 00 00 00
00 00 00 00 00 00 00 00 00 00 00 00 00 00 00 00
00 00 00 00 00 00 00 00 00 00 00 00 00 00 00 00
00 00 00 00 00 00 00 00 00 00 00 00 00 00 00 00
00 00 00 00 00 00 00 00 00 00 00 00 00 00 6d 90

00 ff ff ff ff ff ff 00 09 e5 77 0b 00 00 00 00
1a 20 01 04 a5 22 15 78 03 66 ea 95 54 58 92 27
1f 51 56 00 00 00 01 01 01 01 01 01 01 01 01 01
01 01 01 01 01 01 66 3f 80 a0 70 b0 64 40 30 20
36 00 59 d7 10 00 00 1a 00 00 00 fd 00 3c a5 d7
d7 2d 01 0a 20 20 20 20 20 20 00 00 00 fe 00 4e
45 31 36 30 57 55 4d 2d 4e 58 36 0a 00 00 00 00
00 00 00 00 00 00 00 00 00 00 00 00 00 00 01 be

70 20 79 02 00 22 00 14 f7 ce 06 85 7f 07 9f 00
2f 00 1f 00 af 04 63 00 02 00 05 00 2b 00 06 27
00 3c a4 00 00 81 00 13 72 1a 00 00 03 01 3c a5
00 00 00 00 00 00 a5 00 00 00 00 00 00 00 00 00
00 00 00 00 00 00 00 00 00 00 00 00 00 00 00 00
00 00 00 00 00 00 00 00 00 00 00 00 00 00 00 00
00 00 00 00 00 00 00 00 00 00 00 00 00 00 00 00
00 00 00 00 00 00 00 00 00 00 00 00 00 00 6d 90

----------------

Block 0, Base EDID:
  EDID Structure Version & Revision: 1.4
  Vendor & Product Identification:
    Manufacturer: BOE
    Model: 2935
    Made in: week 26 of 2022
  Basic Display Parameters & Features:
    Digital display
    Bits per primary color channel: 8
    DisplayPort interface
    Maximum image size: 34 cm x 21 cm
    Gamma: 2.20
    Supported color formats: RGB 4:4:4
    First detailed timing includes the native pixel format and preferred refresh rate
    Display supports continuous frequencies
  Color Characteristics:
    Red  : 0.5830, 0.3300
    Green: 0.3447, 0.5722
    Blue : 0.1552, 0.1230
    White: 0.3183, 0.3378
  Established Timings I & II: none
  Standard Timings: none
  Detailed Timing Descriptors:
    DTD 1:  1920x1200   60.022189 Hz  16:10    78.029 kHz    162.300000 MHz (345 mm x 215 mm)
                 Hfront   48 Hsync  32 Hback   80 Hpol P
                 Vfront    3 Vsync   6 Vback   91 Vpol N
    Display Range Limits:
      Monitor ranges (Range Limits Only): 60-165 Hz V, 215-215 kHz H, max dotclock 450 MHz
    Alphanumeric Data String: 'NE160WUM-NX6'
    Empty Descriptor
  Extension blocks: 1
Checksum: 0xbe

----------------

Block 1, DisplayID Extension Block:
  Version: 2.0
  Extension Count: 0
  Display Product Primary Use Case: None of the listed primary use cases; generic display
  Video Timing Modes Type 7 - Detailed Timings Data Block:
    DTD:  1920x1200  165.014793 Hz  16:10   214.519 kHz    446.200000 MHz (aspect 16:10, no 3D stereo, preferred)
               Hfront   48 Hsync  32 Hback   80 Hpol N
               Vfront    3 Vsync   6 Vback   91 Vpol N
  Adaptive Sync Data Block:
    Descriptor #1:
      Native Panel Range
      Fixed Average V-Total and Adaptive V-Total
      Supports Seamless Transition
      'Max Single Frame Duration Increase' field value without jitter impact
      'Max Single Frame Duration Decrease' field value without jitter impact
      Max Duration Increase: 0.00 ms
      Max Duration Decrease: 0.00 ms
      Min Refresh Rate: 60 Hz
      Max Refresh Rate: 165 Hz
  CTA-861 DisplayID Data Block:
  Vendor-Specific Data Block (AMD), OUI 00-00-1A:
    Version: 3
    Feature Caps: 0x01
    Minimum Refresh Rate: 60 Hz
    Maximum Refresh Rate: 165 Hz
    Flags 1.x: 0x00
    Flags 2.x: 0x00
  Checksum: 0x6d
Checksum: 0x90

----------------

Warnings:

Block 0, Base EDID:
  Missing Display Product Name.
EDID:
  Base EDID: Some timings are out of range of the Monitor Ranges:
    Horizontal Freq: 78.028 - 214.519 kHz (Monitor: 215.000 - 215.000 kHz)

Failures:

Block 0, Base EDID:
  Empty Descriptor: Use Dummy Descriptor instead of all zeroes.
EDID:
  Extension Block 2 started with EDID header, ignoring Extension Blocks >= 2.
  DisplayID: Missing DisplayID Display Parameters Data Block.

EDID conformity: FAIL
