edid-decode (hex):

00 ff ff ff ff ff ff 00 10 ac 14 20 45 4a 5a 32
21 22 01 03 80 3c 22 78 2a d3 65 ab 53 46 a8 24
0e 50 54 2f cf 00 d1 c0 81 80 01 01 01 01 01 01
01 01 01 01 01 01 56 5e 00 a0 a0 a0 29 50 30 20
35 00 55 50 21 00 00 1a 00 00 00 fd 00 30 90 1e
d7 3c 00 0a 20 20 20 20 20 20 00 00 00 fc 00 44
45 4c 4c 20 47 32 37 32 35 44 0a 20 00 00 00 ff
00 47 31 58 33 53 33 34 0a 20 20 20 20 20 01 4b

02 03 31 f1 48 3f 90 1f 12 03 01 04 13 67 03 0c
00 10 00 38 44 67 d8 5d c4 01 78 80 00 68 1a 00
00 01 01 30 90 e6 e2 00 ea 23 09 07 07 83 01 00
00 04 74 80 18 71 38 2d 40 58 2c 45 00 55 50 21
00 00 1e 02 3a 80 18 71 38 2d 40 58 2c 45 00 55
50 21 00 00 1e 70 c2 00 a0 a0 a0 55 50 30 20 35
00 55 50 21 00 00 1a f8 e3 00 a0 a0 a0 32 50 30
20 98 04 55 50 21 00 00 1a 00 00 00 00 00 00 d8

00 ff ff ff ff ff ff 00 10 ac 14 20 45 4a 5a 32
21 22 01 03 80 3c 22 78 2a d3 65 ab 53 46 a8 24
0e 50 54 2f cf 00 d1 c0 81 80 01 01 01 01 01 01
01 01 01 01 01 01 56 5e 00 a0 a0 a0 29 50 30 20
35 00 55 50 21 00 00 1a 00 00 00 fd 00 30 90 1e
d7 3c 00 0a 20 20 20 20 20 20 00 00 00 fc 00 44
45 4c 4c 20 47 32 37 32 35 44 0a 20 00 00 00 ff
00 47 31 58 33 53 33 34 0a 20 20 20 20 20 01 4b

02 03 31 f1 48 3f 90 1f 12 03 01 04 13 67 03 0c
00 10 00 38 44 67 d8 5d c4 01 78 80 00 68 1a 00
00 01 01 30 90 e6 e2 00 ea 23 09 07 07 83 01 00
00 04 74 80 18 71 38 2d 40 58 2c 45 00 55 50 21
00 00 1e 02 3a 80 18 71 38 2d 40 58 2c 45 00 55
50 21 00 00 1e 70 c2 00 a0 a0 a0 55 50 30 20 35
00 55 50 21 00 00 1a f8 e3 00 a0 a0 a0 32 50 30
20 98 04 55 50 21 00 00 1a 00 00 00 00 00 00 d8

----------------

Block 0, Base EDID:
  EDID Structure Version & Revision: 1.3
  Vendor & Product Identification:
    Manufacturer: DEL
    Model: 8212
    Serial Number: ...
    Made in: week 33 of 2024
  Basic Display Parameters & Features:
    Digital display
    Maximum image size: 60 cm x 34 cm
    Gamma: 2.20
    DPMS levels: Off
    RGB color display
    First detailed timing is the preferred timing
  Color Characteristics:
    Red  : 0.6708, 0.3251
    Green: 0.2734, 0.6591
    Blue : 0.1416, 0.0566
    White: 0.3134, 0.3291
  Established Timings I & II:
    DMT 0x04:   640x480    59.940476 Hz   4:3     31.469 kHz     25.175000 MHz
    DMT 0x05:   640x480    72.808802 Hz   4:3     37.861 kHz     31.500000 MHz
    DMT 0x06:   640x480    75.000000 Hz   4:3     37.500 kHz     31.500000 MHz
    DMT 0x08:   800x600    56.250000 Hz   4:3     35.156 kHz     36.000000 MHz
    DMT 0x09:   800x600    60.316541 Hz   4:3     37.879 kHz     40.000000 MHz
    DMT 0x0a:   800x600    72.187572 Hz   4:3     48.077 kHz     50.000000 MHz
    DMT 0x0b:   800x600    75.000000 Hz   4:3     46.875 kHz     49.500000 MHz
    DMT 0x10:  1024x768    60.003840 Hz   4:3     48.363 kHz     65.000000 MHz
    DMT 0x11:  1024x768    70.069359 Hz   4:3     56.476 kHz     75.000000 MHz
    DMT 0x12:  1024x768    75.028582 Hz   4:3     60.023 kHz     78.750000 MHz
    DMT 0x24:  1280x1024   75.024675 Hz   5:4     79.976 kHz    135.000000 MHz
  Standard Timings:
    DMT 0x52:  1920x1080   60.000000 Hz  16:9     67.500 kHz    148.500000 MHz
    DMT 0x23:  1280x1024   60.019740 Hz   5:4     63.981 kHz    108.000000 MHz
  Detailed Timing Descriptors:
    DTD 1:  2560x1440   59.950550 Hz  16:9     88.787 kHz    241.500000 MHz (597 mm x 336 mm)
                 Hfront   48 Hsync  32 Hback   80 Hpol P
                 Vfront    3 Vsync   5 Vback   33 Vpol N
    Display Range Limits:
      Monitor ranges (GTF): 48-144 Hz V, 30-215 kHz H, max dotclock 600 MHz
    Display Product Name: 'DELL G2725D'
    Display Product Serial Number: ...
  Extension blocks: 1
Checksum: 0x4b

----------------

Block 1, CTA-861 Extension Block:
  Revision: 3
  Underscans IT Video Formats by default
  Basic audio support
  Supports YCbCr 4:4:4
  Supports YCbCr 4:2:2
  Native DTDs: 1
  Video Data Block:
    VIC  63:  1920x1080  120.000000 Hz  16:9    135.000 kHz    297.000000 MHz
    VIC  16:  1920x1080   60.000000 Hz  16:9     67.500 kHz    148.500000 MHz (native)
    VIC  31:  1920x1080   50.000000 Hz  16:9     56.250 kHz    148.500000 MHz
    VIC  18:   720x576    50.000000 Hz  16:9     31.250 kHz     27.000000 MHz
    VIC   3:   720x480    59.940060 Hz  16:9     31.469 kHz     27.000000 MHz
    VIC   1:   640x480    59.940476 Hz   4:3     31.469 kHz     25.175000 MHz
    VIC   4:  1280x720    60.000000 Hz  16:9     45.000 kHz     74.250000 MHz
    VIC  19:  1280x720    50.000000 Hz  16:9     37.500 kHz     74.250000 MHz
  Vendor-Specific Data Block (HDMI), OUI 00-0C-03:
    Source physical address: 1.0.0.0
    DC_36bit
    DC_30bit
    DC_Y444
    Maximum TMDS clock: 340 MHz
  Vendor-Specific Data Block (HDMI Forum), OUI C4-5D-D8:
    Version: 1
    Maximum TMDS Character Rate: 600 MHz
    SCDC Present
  Vendor-Specific Data Block (AMD), OUI 00-00-1A:
    Version: 1
    Feature Caps: 0x01
    Minimum Refresh Rate: 48 Hz
    Maximum Refresh Rate: 144 Hz
    Flags 1.x: 0xe6 (MCCS)
  Video Capability Data Block:
    YCbCr quantization: Selectable (via AVI YQ)
    RGB quantization: Selectable (via AVI Q)
    PT scan behavior: Always Underscanned
    IT scan behavior: Always Underscanned
    CE scan behavior: Always Underscanned
  Audio Data Block:
    Linear PCM:
      Max channels: 2
      Supported sample rates (kHz): 48 44.1 32
      Supported sample sizes (bits): 24 20 16
  Speaker Allocation Data Block:
    FL/FR - Front Left/Right
  Detailed Timing Descriptors:
    DTD 2:  1920x1080  120.000000 Hz  16:9    135.000 kHz    297.000000 MHz (597 mm x 336 mm)
                 Hfront   88 Hsync  44 Hback  148 Hpol P
                 Vfront    4 Vsync   5 Vback   36 Vpol P
    DTD 3:  1920x1080   60.000000 Hz  16:9     67.500 kHz    148.500000 MHz (597 mm x 336 mm)
                 Hfront   88 Hsync  44 Hback  148 Hpol P
                 Vfront    4 Vsync   5 Vback   36 Vpol P
    DTD 4:  2560x1440  120.000000 Hz  16:9    183.000 kHz    497.760000 MHz (597 mm x 336 mm)
                 Hfront   48 Hsync  32 Hback   80 Hpol P
                 Vfront    3 Vsync   5 Vback   77 Vpol N
    DTD 5:  2560x1440  143.999210 Hz  16:9    214.559 kHz    583.600000 MHz (597 mm x 336 mm)
                 Hfront   48 Hsync  32 Hback   80 Hpol P
                 Vfront   25 Vsync   8 Vback   17 Vpol N
Checksum: 0xd8  Unused space in Extension Block: 6 bytes

----------------

Warnings:

Block 1, CTA-861 Extension Block:
  Video Data Block: VIC 63 and the first DTD are not identical. Is this intended?
  Video Capability Data Block: S_PT is equal to S_IT and S_CE, so should be set to 0 instead.
  Display Product Serial Number is set, so the Serial Number in the Base EDID should be 0.
  Add a Colorimetry Data Block with the sRGB colorimetry bit set to avoid interop issues.

Failures:

EDID:
  Extension Block 2 started with EDID header, ignoring Extension Blocks >= 2.
  CTA-861: Native progressive timings are a mix of several resolutions.

EDID conformity: FAIL
