edid-decode (hex):

00 ff ff ff ff ff ff 00 42 93 d7 00 01 00 00 00
2a 13 01 03 08 30 1b 78 2a 12 f5 a7 55 4a 9b 25
15 50 54 a1 08 00 81 00 95 00 81 80 01 01 01 01
01 01 01 01 01 01 02 3a 80 18 71 38 2d 40 58 2c
45 00 dd 0c 11 00 00 1e 00 00 00 fd 00 3b 47 1f
44 0f 00 0a 20 20 20 20 20 20 00 00 00 fc 00 46
55 4c 4c 20 48 44 54 56 0a 20 20 20 00 00 00 ff
00 31 4b 5a 42 39 41 30 30 30 38 32 37 33 00 29

00 ff ff ff ff ff ff 00 42 93 d7 00 01 00 00 00
2a 13 01 03 08 30 1b 78 2a 12 f5 a7 55 4a 9b 25
15 50 54 a1 08 00 81 00 95 00 81 80 01 01 01 01
01 01 01 01 01 01 02 3a 80 18 71 38 2d 40 58 2c
45 00 dd 0c 11 00 00 1e 00 00 00 fd 00 3b 47 1f
44 0f 00 0a 20 20 20 20 20 20 00 00 00 fc 00 46
55 4c 4c 20 48 44 54 56 0a 20 20 20 00 00 00 ff
00 31 4b 5a 42 39 41 30 30 30 38 32 37 33 00 29

----------------

Block 0, Base EDID:
  EDID Structure Version & Revision: 1.3
  Vendor & Product Identification:
    Manufacturer: PTS
    Model: 215
    Serial Number: ...
    Made in: week 42 of 2009
  Basic Display Parameters & Features:
    Analog display
    Signal Level Standard: 0.700 : 0.300 : 1.000 V p-p
    Blank level equals black level
    Sync: Separate
    Maximum image size: 48 cm x 27 cm
    Gamma: 2.20
    DPMS levels: Off
    RGB color display
    First detailed timing is the preferred timing
  Color Characteristics:
    Red  : 0.6523, 0.3330
    Green: 0.2890, 0.6074
    Blue : 0.1474, 0.0849
    White: 0.3134, 0.3291
  Established Timings I & II:
    IBM     :   720x400    70.081663 Hz   9:5     31.467 kHz     28.320000 MHz
    DMT 0x04:   640x480    59.940476 Hz   4:3     31.469 kHz     25.175000 MHz
    DMT 0x09:   800x600    60.316541 Hz   4:3     37.879 kHz     40.000000 MHz
    DMT 0x10:  1024x768    60.003840 Hz   4:3     48.363 kHz     65.000000 MHz
  Standard Timings:
    DMT 0x1c:  1280x800    59.810326 Hz  16:10    49.702 kHz     83.500000 MHz
    DMT 0x2f:  1440x900    59.887445 Hz  16:10    55.935 kHz    106.500000 MHz
    DMT 0x23:  1280x1024   60.019740 Hz   5:4     63.981 kHz    108.000000 MHz
  Detailed Timing Descriptors:
    DTD 1:  1920x1080   60.000000 Hz  16:9     67.500 kHz    148.500000 MHz (477 mm x 268 mm)
                 Hfront   88 Hsync  44 Hback  148 Hpol P
                 Vfront    4 Vsync   5 Vback   36 Vpol P
    Display Range Limits:
      Monitor ranges (GTF): 59-71 Hz V, 31-68 kHz H, max dotclock 150 MHz
    Display Product Name: 'FULL HDTV'
    Display Product Serial Number: ...
Checksum: 0x29

----------------

Warnings:

Block 0, Base EDID:
  Vendor & Product Identification: The serial number is one of the known dummy values, it should probably be set to 0.

Failures:

EDID:
  Extension Block 1 started with EDID header, ignoring Extension Blocks >= 1.

EDID conformity: FAIL
