edid-decode (hex):

00 ff ff ff ff ff ff 00 30 ae 3a 40 00 00 00 00
00 22 01 04 a5 1e 13 78 07 eb a9 a7 55 49 9e 25
0d 50 55 00 00 00 01 01 01 01 01 01 01 01 01 01
01 01 01 01 01 01 0e 3d 80 a4 70 b0 32 40 30 20
35 00 2e bc 10 00 00 18 00 00 00 fd 00 28 3c 4b
4b 10 01 0a 20 20 20 20 20 20 00 00 00 0f 00 d1
0a 3c d1 0a 28 32 0a 04 06 af b2 0f 00 00 00 fc
00 42 31 34 30 55 41 4e 30 32 2e 37 20 0a 01 e2

70 20 79 02 00 25 01 09 8b 62 02 8b 62 02 28 3c
80 81 00 15 74 1a 00 00 03 01 28 3c 00 00 66 45
66 45 3c 00 00 00 00 8d 00 00 00 00 00 00 00 00
00 00 00 00 00 00 00 00 00 00 00 00 00 00 00 00
00 00 00 00 00 00 00 00 00 00 00 00 00 00 00 00
00 00 00 00 00 00 00 00 00 00 00 00 00 00 00 00
00 00 00 00 00 00 00 00 00 00 00 00 00 00 00 00
00 00 00 00 00 00 00 00 00 00 00 00 00 00 c9 90

00 ff ff ff ff ff ff 00 30 ae 3a 40 00 00 00 00
00 22 01 04 a5 1e 13 78 07 eb a9 a7 55 49 9e 25
0d 50 55 00 00 00 01 01 01 01 01 01 01 01 01 01
01 01 01 01 01 01 0e 3d 80 a4 70 b0 32 40 30 20
35 00 2e bc 10 00 00 18 00 00 00 fd 00 28 3c 4b
4b 10 01 0a 20 20 20 20 20 20 00 00 00 0f 00 d1
0a 3c d1 0a 28 32 0a 04 06 af b2 0f 00 00 00 fc
00 42 31 34 30 55 41 4e 30 32 2e 37 20 0a 01 e2

70 20 79 02 00 25 01 09 8b 62 02 8b 62 02 28 3c
80 81 00 15 74 1a 00 00 03 01 28 3c 00 00 66 45
66 45 3c 00 00 00 00 8d 00 00 00 00 00 00 00 00
00 00 00 00 00 00 00 00 00 00 00 00 00 00 00 00
00 00 00 00 00 00 00 00 00 00 00 00 00 00 00 00
00 00 00 00 00 00 00 00 00 00 00 00 00 00 00 00
00 00 00 00 00 00 00 00 00 00 00 00 00 00 00 00
00 00 00 00 00 00 00 00 00 00 00 00 00 00 c9 90

----------------

Block 0, Base EDID:
  EDID Structure Version & Revision: 1.4
  Vendor & Product Identification:
    Manufacturer: LEN
    Model: 16442
    Made in: 2024
  Basic Display Parameters & Features:
    Digital display
    Bits per primary color channel: 8
    DisplayPort interface
    Maximum image size: 30 cm x 19 cm
    Gamma: 2.20
    Supported color formats: RGB 4:4:4
    Default (sRGB) color space is primary color space
    First detailed timing includes the native pixel format and preferred refresh rate
    Display supports continuous frequencies
  Color Characteristics:
    Red  : 0.6552, 0.3339
    Green: 0.2871, 0.6201
    Blue : 0.1464, 0.0527
    White: 0.3144, 0.3330
  Established Timings I & II: none
  Standard Timings: none
  Detailed Timing Descriptors:
    DTD 1:  1920x1200   60.000000 Hz  16:10    75.000 kHz    156.300000 MHz (302 mm x 188 mm)
                 Hfront   48 Hsync  32 Hback   84 Hpol N
                 Vfront    3 Vsync   5 Vback   42 Vpol N
    Display Range Limits:
      Monitor ranges (Range Limits Only): 40-60 Hz V, 75-75 kHz H, max dotclock 160 MHz
    Manufacturer-Specified Display Descriptor (0x0f): 00 0f 00 d1 0a 3c d1 0a 28 32 0a 04 06 af b2 0f '.....<..(2......'
    Display Product Name: 'B140UAN02.7 '
  Extension blocks: 1
Checksum: 0xe2

----------------

Block 1, DisplayID Extension Block:
  Version: 2.0
  Extension Count: 0
  Display Product Primary Use Case: None of the listed primary use cases; generic display
  Dynamic Video Timing Range Limits Data Block:
    Minimum Pixel Clock: 156300 kHz
    Maximum Pixel Clock: 156300 kHz
    Minimum Vertical Refresh Rate: 40 Hz
    Maximum Vertical Refresh Rate: 60 Hz
    Seamless Dynamic Video Timing Support: Yes
  CTA-861 DisplayID Data Block:
  Vendor-Specific Data Block (AMD), OUI 00-00-1A:
    Version: 3
    Flags 1: 0x01
      FreeSync Supported
    Minimum Refresh Rate: 40 Hz
    Maximum Refresh Rate: 60 Hz
    Flags 5: 0x00
    Additional Sink Information Address: 0x410
  Checksum: 0xc9
Checksum: 0x90

----------------

Failures:

Block 0, Base EDID:
  Basic Display Parameters & Features: sRGB is signaled, but the chromaticities do not match.
  Display Product Name: One or more trailing spaces before newline.
EDID:
  Extension Block 2 started with EDID header, ignoring Extension Blocks >= 2.
  DisplayID: Missing DisplayID Display Parameters Data Block.
  DisplayID: Missing DisplayID Type VII Detailed Timing Data Block.
  DisplayID: DisplayID expects at least one preferred timing.

EDID conformity: FAIL
