edid-decode (hex):

00 ff ff ff ff ff ff 00 30 ae 3a 40 00 00 00 00
00 1e 01 04 a5 1e 13 78 e3 c5 d6 a4 55 4d 9a 23
0e 52 57 00 00 00 01 01 01 01 01 01 01 01 01 01
01 01 01 01 01 01 35 3c 80 a0 70 b0 23 40 30 20
36 00 2e bd 10 00 00 18 00 00 00 fd 00 28 3c 4a
4a 0f 01 0a 20 20 20 20 20 20 00 00 00 0f 00 d1
0a 28 d1 0a 28 28 0a 04 0e 6f 04 14 00 00 00 fe
00 4d 4e 45 30 30 37 4a 41 31 2d 31 0a 20 00 e0

00 ff ff ff ff ff ff 00 30 ae 3a 40 00 00 00 00
00 1e 01 04 a5 1e 13 78 e3 c5 d6 a4 55 4d 9a 23
0e 52 57 00 00 00 01 01 01 01 01 01 01 01 01 01
01 01 01 01 01 01 35 3c 80 a0 70 b0 23 40 30 20
36 00 2e bd 10 00 00 18 00 00 00 fd 00 28 3c 4a
4a 0f 01 0a 20 20 20 20 20 20 00 00 00 0f 00 d1
0a 28 d1 0a 28 28 0a 04 0e 6f 04 14 00 00 00 fe
00 4d 4e 45 30 30 37 4a 41 31 2d 31 0a 20 00 e0

----------------

Block 0, Base EDID:
  EDID Structure Version & Revision: 1.4
  Vendor & Product Identification:
    Manufacturer: LEN
    Model: 16442
    Made in: 2020
  Basic Display Parameters & Features:
    Digital display
    Bits per primary color channel: 8
    DisplayPort interface
    Maximum image size: 30 cm x 19 cm
    Gamma: 2.20
    DPMS levels: Standby Suspend Off
    Supported color formats: RGB 4:4:4
    First detailed timing includes the native pixel format and preferred refresh rate
    Display supports continuous frequencies
  Color Characteristics:
    Red  : 0.6435, 0.3320
    Green: 0.3017, 0.6025
    Blue : 0.1396, 0.0556
    White: 0.3212, 0.3417
  Established Timings I & II: none
  Standard Timings: none
  Detailed Timing Descriptors:
    DTD 1:  1920x1200   60.000779 Hz  16:10    74.101 kHz    154.130000 MHz (302 mm x 189 mm)
                 Hfront   48 Hsync  32 Hback   80 Hpol N
                 Vfront    3 Vsync   6 Vback   26 Vpol N
    Display Range Limits:
      Monitor ranges (Range Limits Only): 40-60 Hz V, 74-74 kHz H, max dotclock 150 MHz
    Manufacturer-Specified Display Descriptor (0x0f): 00 0f 00 d1 0a 28 d1 0a 28 28 0a 04 0e 6f 04 14 '.....(..((...o..'
    Alphanumeric Data String: 'MNE007JA1-1'
Checksum: 0xe0

----------------

Warnings:

Block 0, Base EDID:
  Missing Display Product Name.
EDID:
  Base EDID: Some timings are out of range of the Monitor Ranges:
    Maximum Clock: 154.130 MHz (Monitor: 150.000 MHz)
    Could be due to a Monitor Range off-by-one rounding issue

Failures:

EDID:
  Extension Block 1 started with EDID header, ignoring Extension Blocks >= 1.

EDID conformity: FAIL
