edid-decode (hex):

00 ff ff ff ff ff ff 00 5c 2d 00 30 01 00 00 00
19 1e 01 03 80 42 26 78 de ee 95 a3 54 4c 99 26
0f 50 54 a7 cb 00 81 c0 81 80 95 00 01 01 b3 00
d1 c0 01 01 01 01 b8 47 00 a0 a0 38 2d 40 30 20
35 00 55 50 21 00 00 1a 4a aa 00 a0 a0 38 21 40
30 40 35 00 55 50 21 00 00 1a 00 00 00 fd 00 3c
c8 1e e9 3c 01 0a 20 20 20 20 20 20 00 00 00 fc
00 55 47 33 30 0a 20 20 20 20 20 20 20 20 01 58

02 03 3b f1 48 01 02 03 04 90 12 13 1f 23 09 07
07 83 01 00 00 6a 03 0c 00 10 00 38 78 20 00 00
67 d8 5d c4 01 78 c0 00 68 1a 00 00 01 01 30 c8
ed e3 05 e3 01 e6 06 07 00 60 50 06 e9 00 78 a0
38 21 40 30 40 36 00 56 50 21 00 00 1e bb d1 00
78 a0 38 21 40 30 40 36 00 6e e5 31 00 00 1e 70
8f 00 a0 a0 38 2d 40 30 40 35 00 55 6b 21 00 00
1e 00 00 00 00 00 00 00 00 00 00 00 00 00 00 e9

----------------

Block 0, Base EDID:
  EDID Structure Version & Revision: 1.3
  Vendor & Product Identification:
    Manufacturer: WAM
    Model: 12288
    Serial Number: ...
    Made in: week 25 of 2020
  Basic Display Parameters & Features:
    Digital display
    Maximum image size: 66 cm x 38 cm
    Gamma: 2.20
    DPMS levels: Standby Suspend
    Undefined display color type
    Default (sRGB) color space is primary color space
    First detailed timing is the preferred timing
  Color Characteristics:
    Red  : 0.6396, 0.3300
    Green: 0.2998, 0.5996
    Blue : 0.1503, 0.0595
    White: 0.3134, 0.3291
  Established Timings I & II:
    IBM     :   720x400    70.081663 Hz   9:5     31.467 kHz     28.320000 MHz
    DMT 0x04:   640x480    59.940476 Hz   4:3     31.469 kHz     25.175000 MHz
    DMT 0x06:   640x480    75.000000 Hz   4:3     37.500 kHz     31.500000 MHz
    DMT 0x08:   800x600    56.250000 Hz   4:3     35.156 kHz     36.000000 MHz
    DMT 0x09:   800x600    60.316541 Hz   4:3     37.879 kHz     40.000000 MHz
    DMT 0x0a:   800x600    72.187572 Hz   4:3     48.077 kHz     50.000000 MHz
    DMT 0x0b:   800x600    75.000000 Hz   4:3     46.875 kHz     49.500000 MHz
    DMT 0x10:  1024x768    60.003840 Hz   4:3     48.363 kHz     65.000000 MHz
    DMT 0x12:  1024x768    75.028582 Hz   4:3     60.023 kHz     78.750000 MHz
    DMT 0x24:  1280x1024   75.024675 Hz   5:4     79.976 kHz    135.000000 MHz
  Standard Timings:
    DMT 0x55:  1280x720    60.000000 Hz  16:9     45.000 kHz     74.250000 MHz
    DMT 0x23:  1280x1024   60.019740 Hz   5:4     63.981 kHz    108.000000 MHz
    DMT 0x2f:  1440x900    59.887445 Hz  16:10    55.935 kHz    106.500000 MHz
    DMT 0x3a:  1680x1050   59.954250 Hz  16:10    65.290 kHz    146.250000 MHz
    DMT 0x52:  1920x1080   60.000000 Hz  16:9     67.500 kHz    148.500000 MHz
  Detailed Timing Descriptors:
    DTD 1:  2560x1080   60.000000 Hz  64:27    67.500 kHz    183.600000 MHz (597 mm x 336 mm)
                 Hfront   48 Hsync  32 Hback   80 Hpol P
                 Vfront    3 Vsync   5 Vback   37 Vpol N
    DTD 2:  2560x1080  144.000053 Hz  64:27   160.272 kHz    435.940000 MHz (597 mm x 336 mm)
                 Hfront   48 Hsync  64 Hback   48 Hpol P
                 Vfront    3 Vsync   5 Vback   25 Vpol N
    Display Range Limits:
      Monitor ranges (Range Limits Only): 60-200 Hz V, 30-233 kHz H, max dotclock 600 MHz
    Display Product Name: 'UG30'
  Extension blocks: 1
Checksum: 0x58

----------------

Block 1, CTA-861 Extension Block:
  Revision: 3
  Underscans IT Video Formats by default
  Basic audio support
  Supports YCbCr 4:4:4
  Supports YCbCr 4:2:2
  Native DTDs: 1
  Video Data Block:
    VIC   1:   640x480    59.940476 Hz   4:3     31.469 kHz     25.175000 MHz
    VIC   2:   720x480    59.940060 Hz   4:3     31.469 kHz     27.000000 MHz
    VIC   3:   720x480    59.940060 Hz  16:9     31.469 kHz     27.000000 MHz
    VIC   4:  1280x720    60.000000 Hz  16:9     45.000 kHz     74.250000 MHz
    VIC  16:  1920x1080   60.000000 Hz  16:9     67.500 kHz    148.500000 MHz (native)
    VIC  18:   720x576    50.000000 Hz  16:9     31.250 kHz     27.000000 MHz
    VIC  19:  1280x720    50.000000 Hz  16:9     37.500 kHz     74.250000 MHz
    VIC  31:  1920x1080   50.000000 Hz  16:9     56.250 kHz    148.500000 MHz
  Audio Data Block:
    Linear PCM:
      Max channels: 2
      Supported sample rates (kHz): 48 44.1 32
      Supported sample sizes (bits): 24 20 16
  Speaker Allocation Data Block:
    FL/FR - Front Left/Right
  Vendor-Specific Data Block (HDMI), OUI 00-0C-03:
    Source physical address: 1.0.0.0
    DC_36bit
    DC_30bit
    DC_Y444
    Maximum TMDS clock: 600 MHz
    Extended HDMI video details:
  Vendor-Specific Data Block (HDMI Forum), OUI C4-5D-D8:
    Version: 1
    Maximum TMDS Character Rate: 600 MHz
    SCDC Present
    SCDC Read Request Capable
  Vendor-Specific Data Block (AMD), OUI 00-00-1A:
    Version: 1
    Flags 1: 0x01
      FreeSync Supported
    Minimum Refresh Rate: 48 Hz
    Maximum Refresh Rate: 200 Hz
    MCCS VCP Code: 0xed
  Colorimetry Data Block:
    xvYCC601
    xvYCC709
    BT2020cYCC
    BT2020YCC
    BT2020RGB
    Gamut Boundary Description Metadata Profile P0
  HDR Static Metadata Data Block:
    Electro optical transfer functions:
      Traditional gamma - SDR luminance range
      Traditional gamma - HDR luminance range
      SMPTE ST2084
    Supported static metadata descriptors:
    Desired content max luminance: 96 (400.000 cd/m^2)
    Desired content max frame-average luminance: 80 (282.843 cd/m^2)
    Desired content min luminance: 6 (0.002 cd/m^2)
  Detailed Timing Descriptors:
    DTD 3:  2560x1080  199.990613 Hz  64:27   222.590 kHz    596.540000 MHz (598 mm x 336 mm)
                 Hfront   48 Hsync  64 Hback    8 Hpol P
                 Vfront    3 Vsync   6 Vback   24 Vpol P
    DTD 4:  2560x1080  179.999598 Hz  64:27   200.340 kHz    536.910000 MHz (878 mm x 485 mm)
                 Hfront   48 Hsync  64 Hback    8 Hpol P
                 Vfront    3 Vsync   6 Vback   24 Vpol P
    DTD 5:  2560x1080  120.000000 Hz  64:27   135.000 kHz    367.200000 MHz (597 mm x 363 mm)
                 Hfront   48 Hsync  64 Hback   48 Hpol P
                 Vfront    3 Vsync   5 Vback   37 Vpol P
Checksum: 0xe9  Unused space in Extension Block: 14 bytes

----------------

Warnings:

Block 0, Base EDID:
  Vendor & Product Identification: The serial number is one of the known dummy values, it should probably be set to 0.
  Detailed Timing Descriptor #1: Image size is 597x336 mm, but based on the picture AR it should be 597x251 mm.
  Detailed Timing Descriptor #2: Image size is 597x336 mm, but based on the picture AR it should be 597x251 mm.
Block 1, CTA-861 Extension Block:
  Video Data Block: VIC 1 and the first DTD are not identical. Is this intended?
  Video Data Block: All VICs are in ascending order, and the first (preferred) VIC <= 4, is that intended?
  Detailed Timing Descriptor #3: Image size is 598x336 mm, but based on the picture AR it should be 598x252 mm.
  Detailed Timing Descriptor #4: Image size is 878x485 mm, but based on the picture AR it should be 878x370 mm.
  Detailed Timing Descriptor #5: Image size is 597x363 mm, but based on the picture AR it should be 597x251 mm.
EDID:
  Base EDID: Some timings are out of range of the Monitor Ranges:
    Vertical Freq: 50.000 - 199.991 Hz (Monitor: 60.000 - 200.000 Hz)

Failures:

Block 0, Base EDID:
  Basic Display Parameters & Features: sRGB is signaled, but the chromaticities do not match.
  Detailed Timing Descriptor #1: Mismatch of image size 597x336 mm vs display size 660x380 mm.
  Detailed Timing Descriptor #2: Mismatch of image size 597x336 mm vs display size 660x380 mm.
  Display Range Limits: 'Range Limits Only' is not allowed for EDID < 1.4.
Block 1, CTA-861 Extension Block:
  Vendor-Specific Data Block (HDMI), OUI 00-0C-03: HDMI VSDB Max TMDS rate is > 340.
  Offset is 59, but should be 60.
  Detailed Timing Descriptor #3: Mismatch of image size 598x336 mm vs display size 660x380 mm.
  Detailed Timing Descriptor #4: Mismatch of image size 878x485 mm vs display size 660x380 mm.
  Detailed Timing Descriptor #5: Mismatch of image size 597x363 mm vs display size 660x380 mm.
  Missing VCDB, needed for Set Selectable RGB Quantization to avoid interop issues.
EDID:
  Base EDID: The DTD max image size is 878x485mm, which is larger than the display size 660.0x380.0mm.
  CTA-861: Native progressive timings are a mix of several resolutions.

EDID conformity: FAIL
