edid-decode (hex):

00 ff ff ff ff ff ff 00 44 6d 01 00 01 00 00 00
1b 10 01 03 80 19 11 78 0a 0d c9 a0 57 47 98 27
12 48 4c 00 00 00 01 01 01 01 01 01 01 01 01 01
01 01 01 01 01 01 01 a3 b8 dc b1 48 ec 80 ec 28
a2 04 00 00 00 00 00 00 01 a3 b8 e6 b0 48 ec 80
72 28 a2 04 00 00 00 00 00 00 01 a3 b8 dc b1 48
fd 83 ec 28 b2 08 00 00 00 00 00 00 00 00 00 fe
00 44 75 61 6c 20 64 73 69 20 63 73 6f 74 00 f6

00 ff ff ff ff ff ff 00 44 6d 01 00 01 00 00 00
1b 10 01 03 80 19 11 78 0a 0d c9 a0 57 47 98 27
12 48 4c 00 00 00 01 01 01 01 01 01 01 01 01 01
01 01 01 01 01 01 01 a3 b8 dc b1 48 ec 80 ec 28
a2 04 00 00 00 00 00 00 01 a3 b8 e6 b0 48 ec 80
72 28 a2 04 00 00 00 00 00 00 01 a3 b8 dc b1 48
fd 83 ec 28 b2 08 00 00 00 00 00 00 00 00 00 fe
00 44 75 61 6c 20 64 73 69 20 63 73 6f 74 00 f6

----------------

Block 0, Base EDID:
  EDID Structure Version & Revision: 1.3
  Vendor & Product Identification:
    Manufacturer: QCM
    Model: 1
    Serial Number: ...
    Made in: week 27 of 2006
  Basic Display Parameters & Features:
    Digital display
    Maximum image size: 25 cm x 17 cm
    Gamma: 2.20
    RGB color display
    First detailed timing is the preferred timing
  Color Characteristics:
    Red  : 0.6250, 0.3398
    Green: 0.2802, 0.5947
    Blue : 0.1552, 0.0703
    White: 0.2832, 0.2978
  Established Timings I & II: none
  Standard Timings: none
  Detailed Timing Descriptors:
    DTD 1:  3000x2120   50.954544 Hz  75:53   120.049 kHz    417.290000 MHz (analog composite, sync-on-green)
                 Hfront  236 Hsync  40 Hback  200 Hpol N
                 Vfront   26 Vsync   2 Vback  208 Vpol N
    DTD 2:  3000x2120   54.835293 Hz  75:53   129.192 kHz    417.290000 MHz (analog composite, sync-on-green)
                 Hfront  114 Hsync  40 Hback   76 Hpol N
                 Vfront   26 Vsync   2 Vback  208 Vpol N
    DTD 3:  3000x2120   38.219964 Hz  75:53   120.049 kHz    417.290000 MHz (analog composite, sync-on-green)
                 Hfront  236 Hsync  40 Hback  200 Hpol N
                 Vfront   43 Vsync   2 Vback  976 Vpol N
    Alphanumeric Data String: 'Dual dsi csot'
Checksum: 0xf6

----------------

Warnings:

Block 0, Base EDID:
  Vendor & Product Identification: The serial number is one of the known dummy values, it should probably be set to 0.

Failures:

Block 0, Base EDID:
  Detailed Timing Descriptor #1: Mismatch of image size vs display size: image size is not set, but display size is.
  Detailed Timing Descriptor #2: Mismatch of image size vs display size: image size is not set, but display size is.
  Detailed Timing Descriptor #3: Mismatch of image size vs display size: image size is not set, but display size is.
  Missing Display Product Name.
  Missing Display Range Limits Descriptor.
EDID:
  Extension Block 1 started with EDID header, ignoring Extension Blocks >= 1.

EDID conformity: FAIL
