edid-decode (hex):

00 ff ff ff ff ff ff 00 44 6d 01 00 01 00 00 00
1b 10 01 03 80 45 9a 78 0a 0d c9 a0 57 47 98 27
12 48 4c 00 00 00 01 01 01 01 01 01 01 01 01 01
01 01 01 01 01 01 9f 47 38 20 40 60 a8 94 10 08
80 06 00 00 00 00 00 00 a0 47 38 20 40 60 54 92
10 08 c0 09 00 00 00 00 00 00 9f 47 38 20 40 60
10 90 10 08 44 00 00 00 00 00 00 00 00 00 00 fe
00 78 69 61 6f 6d 69 20 33 38 20 30 38 20 00 ca

----------------

Block 0, Base EDID:
  EDID Structure Version & Revision: 1.3
  Vendor & Product Identification:
    Manufacturer: QCM
    Model: 1
    Serial Number: ...
    Made in: week 27 of 2006
  Basic Display Parameters & Features:
    Digital display
    Maximum image size: 69 cm x 154 cm
    Gamma: 2.20
    RGB color display
    First detailed timing is the preferred timing
  Color Characteristics:
    Red  : 0.6250, 0.3398
    Green: 0.2802, 0.5947
    Blue : 0.1552, 0.0703
    White: 0.2832, 0.2978
  Established Timings I & II: none
  Standard Timings: none
  Detailed Timing Descriptors:
    DTD 1:  1080x2400   45.902866 Hz   9:20   164.883 kHz    183.350000 MHz (analog composite, sync-on-green)
                 Hfront   16 Hsync   8 Hback    8 Hpol N
                 Vfront   24 Vsync  32 Vback 1136 Vpol N
    DTD 2:  1080x2400   55.037412 Hz   9:20   164.892 kHz    183.360000 MHz (analog composite, sync-on-green)
                 Hfront   16 Hsync   8 Hback    8 Hpol N
                 Vfront   44 Vsync  16 Vback  536 Vpol N
    DTD 3:  1080x2400   68.246314 Hz   9:20   164.883 kHz    183.350000 MHz (analog composite, sync-on-green)
                 Hfront   16 Hsync   8 Hback    8 Hpol N
                 Vfront    4 Vsync   4 Vback    8 Vpol N
    Alphanumeric Data String: 'xiaomi 38 08 '
Checksum: 0xca

----------------

Warnings:

Block 0, Base EDID:
  Vendor & Product Identification: The serial number is one of the known dummy values, it should probably be set to 0.

Failures:

Block 0, Base EDID:
  Detailed Timing Descriptor #1: Mismatch of image size vs display size: image size is not set, but display size is.
  Detailed Timing Descriptor #2: Mismatch of image size vs display size: image size is not set, but display size is.
  Detailed Timing Descriptor #3: Mismatch of image size vs display size: image size is not set, but display size is.
  Alphanumeric Data String: No newline, but one or more trailing spaces.
  Missing Display Product Name.
  Missing Display Range Limits Descriptor.

EDID conformity: FAIL
