edid-decode (hex):

00 ff ff ff ff ff ff 00 44 6d 01 00 01 00 00 00
1b 10 01 03 80 50 2d 78 0a 0d c9 a0 57 47 98 27
12 48 4c 00 00 00 01 01 01 01 01 01 01 01 01 01
01 01 01 01 01 01 58 37 38 77 40 60 41 90 43 0c
12 08 00 00 00 00 00 00 58 37 38 77 40 60 76 93
43 0c 62 04 00 00 00 00 00 00 58 37 38 77 40 60
e2 99 43 0c 22 00 00 00 00 00 00 00 00 00 00 fe
00 78 69 61 6f 6d 69 20 33 36 20 30 32 20 00 ee

00 ff ff ff ff ff ff 00 44 6d 01 00 01 00 00 00
1b 10 01 03 80 50 2d 78 0a 0d c9 a0 57 47 98 27
12 48 4c 00 00 00 01 01 01 01 01 01 01 01 01 01
01 01 01 01 01 01 58 37 38 77 40 60 41 90 43 0c
12 08 00 00 00 00 00 00 58 37 38 77 40 60 76 93
43 0c 62 04 00 00 00 00 00 00 58 37 38 77 40 60
e2 99 43 0c 22 00 00 00 00 00 00 00 00 00 00 fe
00 78 69 61 6f 6d 69 20 33 36 20 30 32 20 00 ee

----------------

Block 0, Base EDID:
  EDID Structure Version & Revision: 1.3
  Vendor & Product Identification:
    Manufacturer: QCM
    Model: 1
    Serial Number: ...
    Made in: week 27 of 2006
  Basic Display Parameters & Features:
    Digital display
    Maximum image size: 80 cm x 45 cm
    Gamma: 2.20
    RGB color display
    First detailed timing is the preferred timing
  Color Characteristics:
    Red  : 0.6250, 0.3398
    Green: 0.2802, 0.5947
    Blue : 0.1552, 0.0703
    White: 0.2832, 0.2978
  Established Timings I & II: none
  Standard Timings: none
  Detailed Timing Descriptors:
    DTD 1:  1080x2400   47.937176 Hz   9:20   118.165 kHz    141.680000 MHz (analog composite, sync-on-green)
                 Hfront   67 Hsync  12 Hback   40 Hpol N
                 Vfront   33 Vsync   2 Vback   30 Vpol N
    DTD 2:  1080x2400   35.960176 Hz   9:20   118.165 kHz    141.680000 MHz (analog composite, sync-on-green)
                 Hfront   67 Hsync  12 Hback   40 Hpol N
                 Vfront   22 Vsync   2 Vback  862 Vpol N
    DTD 3:  1080x2400   23.968588 Hz   9:20   118.165 kHz    141.680000 MHz (analog composite, sync-on-green)
                 Hfront   67 Hsync  12 Hback   40 Hpol N
                 Vfront    2 Vsync   2 Vback 2526 Vpol N
    Alphanumeric Data String: 'xiaomi 36 02 '
Checksum: 0xee

----------------

Block 1, Unknown EDID Extension Block 0x00:
  00 ff ff ff ff ff ff 00 44 6d 01 00 01 00 00 00 '........Dm......'
  1b 10 01 03 80 50 2d 78 0a 0d c9 a0 57 47 98 27 '.....P-x....WG.''
  12 48 4c 00 00 00 01 01 01 01 01 01 01 01 01 01 '.HL.............'
  01 01 01 01 01 01 58 37 38 77 40 60 41 90 43 0c '......X78w@`A.C.'
  12 08 00 00 00 00 00 00 58 37 38 77 40 60 76 93 '........X78w@`v.'
  43 0c 62 04 00 00 00 00 00 00 58 37 38 77 40 60 'C.b.......X78w@`'
  e2 99 43 0c 22 00 00 00 00 00 00 00 00 00 00 fe '..C."...........'
  00 78 69 61 6f 6d 69 20 33 36 20 30 32 20 00 ee '.xiaomi 36 02 ..'
Checksum: 0xee

----------------

Warnings:

Block 0, Base EDID:
  Vendor & Product Identification: The serial number is one of the known dummy values, it should probably be set to 0.

Failures:

Block 0, Base EDID:
  Detailed Timing Descriptor #1: Mismatch of image size vs display size: image size is not set, but display size is.
  Detailed Timing Descriptor #2: Mismatch of image size vs display size: image size is not set, but display size is.
  Detailed Timing Descriptor #3: Mismatch of image size vs display size: image size is not set, but display size is.
  Alphanumeric Data String: No newline, but one or more trailing spaces.
  Missing Display Product Name.
  Missing Display Range Limits Descriptor.
Block 1, Base EDID:
  Unknown Extension Block.
EDID:
  Base EDID: EDID specified 0 extension block(s), but found 1 extension block(s).

EDID conformity: FAIL
