edid-decode (hex):

00 ff ff ff ff ff ff 00 44 6d 01 00 01 00 00 00
1b 10 01 03 80 0e 17 78 0a 0d c9 a0 57 47 98 27
12 48 4c 00 00 00 01 01 01 01 01 01 01 01 01 01
01 01 01 01 01 01 c2 de 40 e8 60 00 22 a0 a8 04
a1 04 00 00 00 00 00 00 c2 de 40 e8 60 00 aa a2
a8 04 21 08 00 00 00 00 00 00 c2 de 40 e8 60 00
44 aa a8 04 c1 0c 00 00 00 00 00 00 00 00 00 fe
00 73 73 5f 64 73 69 5f 70 61 6e 65 6c 5f 00 10

00 ff ff ff ff ff ff 00 44 6d 01 00 01 00 00 00
1b 10 01 03 80 0e 17 78 0a 0d c9 a0 57 47 98 27
12 48 4c 00 00 00 01 01 01 01 01 01 01 01 01 01
01 01 01 01 01 01 c2 de 40 e8 60 00 22 a0 a8 04
a1 04 00 00 00 00 00 00 c2 de 40 e8 60 00 aa a2
a8 04 21 08 00 00 00 00 00 00 c2 de 40 e8 60 00
44 aa a8 04 c1 0c 00 00 00 00 00 00 00 00 00 fe
00 73 73 5f 64 73 69 5f 70 61 6e 65 6c 5f 00 10

----------------

Block 0, Base EDID:
  EDID Structure Version & Revision: 1.3
  Vendor & Product Identification:
    Manufacturer: QCM
    Model: 1
    Serial Number: ...
    Made in: week 27 of 2006
  Basic Display Parameters & Features:
    Digital display
    Maximum image size: 14 cm x 23 cm
    Gamma: 2.20
    RGB color display
    First detailed timing is the preferred timing
  Color Characteristics:
    Red  : 0.6250, 0.3398
    Green: 0.2802, 0.5947
    Blue : 0.1552, 0.0703
    White: 0.2832, 0.2978
  Established Timings I & II: none
  Standard Timings: none
  Detailed Timing Descriptors:
    DTD 1:  1600x2560  119.998956 Hz   5:8    311.277 kHz    570.260000 MHz (analog composite, sync-on-green)
                 Hfront  168 Hsync   4 Hback   60 Hpol N
                 Vfront   26 Vsync   1 Vback    7 Vpol N
    DTD 2:  1600x2560   96.013971 Hz   5:8    311.277 kHz    570.260000 MHz (analog composite, sync-on-green)
                 Hfront  168 Hsync   4 Hback   60 Hpol N
                 Vfront   34 Vsync   1 Vback  647 Vpol N
    DTD 3:  1600x2560   59.999478 Hz   5:8    311.277 kHz    570.260000 MHz (analog composite, sync-on-green)
                 Hfront  168 Hsync   4 Hback   60 Hpol N
                 Vfront   60 Vsync   1 Vback 2567 Vpol N
    Alphanumeric Data String: 'ss_dsi_panel_'
Checksum: 0x10

----------------

Warnings:

Block 0, Base EDID:
  Vendor & Product Identification: The serial number is one of the known dummy values, it should probably be set to 0.

Failures:

Block 0, Base EDID:
  Detailed Timing Descriptor #1: Mismatch of image size vs display size: image size is not set, but display size is.
  Detailed Timing Descriptor #2: Mismatch of image size vs display size: image size is not set, but display size is.
  Detailed Timing Descriptor #3: Mismatch of image size vs display size: image size is not set, but display size is.
  Missing Display Product Name.
  Missing Display Range Limits Descriptor.
EDID:
  Extension Block 1 started with EDID header, ignoring Extension Blocks >= 1.

EDID conformity: FAIL
