edid-decode (hex):

00 ff ff ff ff ff ff 00 44 6d 01 00 01 00 00 00
1b 10 01 03 80 47 9d 78 0a 0d c9 a0 57 47 98 27
12 48 4c 00 00 00 01 01 01 01 01 01 01 01 01 01
01 01 01 01 01 01 d5 46 a0 60 50 80 50 c0 20 20
88 05 00 00 00 00 00 00 d5 46 a0 f8 50 80 c8 c7
40 78 88 0e 00 00 00 00 00 00 d6 46 a0 d0 50 80
e0 c1 40 50 00 0a 00 00 00 00 00 00 00 00 00 fe
00 78 69 61 6f 6d 69 20 33 38 20 30 38 20 00 3e

00 ff ff ff ff ff ff 00 44 6d 01 00 01 00 00 00
1b 10 01 03 80 47 9d 78 0a 0d c9 a0 57 47 98 27
12 48 4c 00 00 00 01 01 01 01 01 01 01 01 01 01
01 01 01 01 01 01 d5 46 a0 60 50 80 50 c0 20 20
88 05 00 00 00 00 00 00 d5 46 a0 f8 50 80 c8 c7
40 78 88 0e 00 00 00 00 00 00 d6 46 a0 d0 50 80
e0 c1 40 50 00 0a 00 00 00 00 00 00 00 00 00 fe
00 78 69 61 6f 6d 69 20 33 38 20 30 38 20 00 3e

----------------

Block 0, Base EDID:
  EDID Structure Version & Revision: 1.3
  Vendor & Product Identification:
    Manufacturer: QCM
    Model: 1
    Serial Number: ...
    Made in: week 27 of 2006
  Basic Display Parameters & Features:
    Digital display
    Maximum image size: 71 cm x 157 cm
    Gamma: 2.20
    RGB color display
    First detailed timing is the preferred timing
  Color Characteristics:
    Red  : 0.6250, 0.3398
    Green: 0.2802, 0.5947
    Blue : 0.1552, 0.0703
    White: 0.2832, 0.2978
  Established Timings I & II: none
  Standard Timings: none
  Detailed Timing Descriptors:
    DTD 1:  1440x3200   35.991886 Hz   9:20   118.053 kHz    181.330000 MHz (analog composite, sync-on-green)
                 Hfront   32 Hsync  32 Hback   32 Hpol N
                 Vfront   24 Vsync  24 Vback   32 Vpol N
    DTD 2:  1440x3200   20.690097 Hz   9:20   107.423 kHz    181.330000 MHz (analog composite, sync-on-green)
                 Hfront   64 Hsync 120 Hback   64 Hpol N
                 Vfront   56 Vsync  40 Vback 1896 Vpol N
    DTD 3:  1440x3200   29.901198 Hz   9:20   110.036 kHz    181.340000 MHz (analog composite, sync-on-green)
                 Hfront   64 Hsync  80 Hback   64 Hpol N
                 Vfront   32 Vsync  32 Vback  416 Vpol N
    Alphanumeric Data String: 'xiaomi 38 08 '
Checksum: 0x3e

----------------

Warnings:

Block 0, Base EDID:
  Vendor & Product Identification: The serial number is one of the known dummy values, it should probably be set to 0.

Failures:

Block 0, Base EDID:
  Detailed Timing Descriptor #1: Mismatch of image size vs display size: image size is not set, but display size is.
  Detailed Timing Descriptor #2: Mismatch of image size vs display size: image size is not set, but display size is.
  Detailed Timing Descriptor #3: Mismatch of image size vs display size: image size is not set, but display size is.
  Alphanumeric Data String: No newline, but one or more trailing spaces.
  Missing Display Product Name.
  Missing Display Range Limits Descriptor.
EDID:
  Extension Block 1 started with EDID header, ignoring Extension Blocks >= 1.

EDID conformity: FAIL
