edid-decode (hex):

00 ff ff ff ff ff ff 00 44 6d 01 00 01 00 00 00
1b 10 01 03 80 41 91 78 0a 0d c9 a0 57 47 98 27
12 48 4c 00 00 00 01 01 01 01 01 01 01 01 01 01
01 01 01 01 01 01 56 2b 38 50 40 60 70 90 20 10
00 01 00 00 00 00 00 00 56 2b 38 50 40 60 70 90
20 10 00 01 00 00 00 00 00 00 55 2b 38 50 40 60
70 90 20 10 00 01 00 00 00 00 00 00 00 00 00 fe
00 78 69 61 6f 6d 69 20 34 32 20 30 32 20 00 8d

00 ff ff ff ff ff ff 00 44 6d 01 00 01 00 00 00
1b 10 01 03 80 41 91 78 0a 0d c9 a0 57 47 98 27
12 48 4c 00 00 00 01 01 01 01 01 01 01 01 01 01
01 01 01 01 01 01 56 2b 38 50 40 60 70 90 20 10
00 01 00 00 00 00 00 00 56 2b 38 50 40 60 70 90
20 10 00 01 00 00 00 00 00 00 55 2b 38 50 40 60
70 90 20 10 00 01 00 00 00 00 00 00 00 00 00 fe
00 78 69 61 6f 6d 69 20 34 32 20 30 32 20 00 8d

----------------

Block 0, Base EDID:
  EDID Structure Version & Revision: 1.3
  Vendor & Product Identification:
    Manufacturer: QCM
    Model: 1
    Serial Number: ...
    Made in: week 27 of 2006
  Basic Display Parameters & Features:
    Digital display
    Maximum image size: 65 cm x 145 cm
    Gamma: 2.20
    RGB color display
    First detailed timing is the preferred timing
  Color Characteristics:
    Red  : 0.6250, 0.3398
    Green: 0.2802, 0.5947
    Blue : 0.1552, 0.0703
    White: 0.2832, 0.2978
  Established Timings I & II: none
  Standard Timings: none
  Detailed Timing Descriptors:
    DTD 1:  1080x2400   38.072425 Hz   9:20    95.638 kHz    110.940000 MHz (analog composite, sync-on-green)
                 Hfront   32 Hsync  16 Hback   32 Hpol N
                 Vfront    0 Vsync  16 Vback   96 Vpol N
                   56 2b 38 50 40 60 70 90 20 10 00 01 00 00 00 00 00 00 'V+8P@`p. .........'
    DTD 2:  1080x2400   38.072425 Hz   9:20    95.638 kHz    110.940000 MHz (analog composite, sync-on-green)
                 Hfront   32 Hsync  16 Hback   32 Hpol N
                 Vfront    0 Vsync  16 Vback   96 Vpol N
                   56 2b 38 50 40 60 70 90 20 10 00 01 00 00 00 00 00 00 'V+8P@`p. .........'
    DTD 3:  1080x2400   38.068993 Hz   9:20    95.629 kHz    110.930000 MHz (analog composite, sync-on-green)
                 Hfront   32 Hsync  16 Hback   32 Hpol N
                 Vfront    0 Vsync  16 Vback   96 Vpol N
                   55 2b 38 50 40 60 70 90 20 10 00 01 00 00 00 00 00 00 'U+8P@`p. .........'
    Alphanumeric Data String: 'xiaomi 42 02 '
Checksum: 0x8d

----------------

Block 1, Unknown EDID Extension Block 0x00:
  00 ff ff ff ff ff ff 00 44 6d 01 00 01 00 00 00 '........Dm......'
  1b 10 01 03 80 41 91 78 0a 0d c9 a0 57 47 98 27 '.....A.x....WG.''
  12 48 4c 00 00 00 01 01 01 01 01 01 01 01 01 01 '.HL.............'
  01 01 01 01 01 01 56 2b 38 50 40 60 70 90 20 10 '......V+8P@`p. .'
  00 01 00 00 00 00 00 00 56 2b 38 50 40 60 70 90 '........V+8P@`p.'
  20 10 00 01 00 00 00 00 00 00 55 2b 38 50 40 60 ' .........U+8P@`'
  70 90 20 10 00 01 00 00 00 00 00 00 00 00 00 fe 'p. .............'
  00 78 69 61 6f 6d 69 20 34 32 20 30 32 20 00 8d '.xiaomi 42 02 ..'
Checksum: 0x8d

----------------

Warnings:

Block 0, Base EDID:
  Vendor & Product Identification: The serial number is one of the known dummy values, it should probably be set to 0.

Failures:

Block 0, Base EDID:
  Detailed Timing Descriptor #1: 0 values in the video timing:
    Horizontal Active/Blanking 1080/80
    Horizontal Frontporch/Sync Width 32/16
    Vertical Active/Blanking 2400/112
    Vertical Frontporch/Sync Width 0/16
  Detailed Timing Descriptor #1: Mismatch of image size vs display size: image size is not set, but display size is.
  Detailed Timing Descriptor #2: 0 values in the video timing:
    Horizontal Active/Blanking 1080/80
    Horizontal Frontporch/Sync Width 32/16
    Vertical Active/Blanking 2400/112
    Vertical Frontporch/Sync Width 0/16
  Detailed Timing Descriptor #2: Mismatch of image size vs display size: image size is not set, but display size is.
  Detailed Timing Descriptor #3: 0 values in the video timing:
    Horizontal Active/Blanking 1080/80
    Horizontal Frontporch/Sync Width 32/16
    Vertical Active/Blanking 2400/112
    Vertical Frontporch/Sync Width 0/16
  Detailed Timing Descriptor #3: Mismatch of image size vs display size: image size is not set, but display size is.
  Alphanumeric Data String: No newline, but one or more trailing spaces.
  Missing Display Product Name.
  Missing Display Range Limits Descriptor.
Block 1, Base EDID:
  Unknown Extension Block.
EDID:
  Base EDID: EDID specified 0 extension block(s), but found 1 extension block(s).

EDID conformity: FAIL
