edid-decode (hex):

00 ff ff ff ff ff ff 00 44 6d 01 00 01 00 00 00
1b 10 01 03 80 50 2d 78 0a 0d c9 a0 57 47 98 27
12 48 4c 00 00 00 01 01 01 01 01 01 01 01 01 01
01 01 01 01 01 01 30 2a 38 64 40 60 c4 94 34 18
84 0c 00 00 00 00 00 00 30 2a 38 64 40 60 10 90
34 18 44 00 00 00 00 00 00 00 00 00 00 00 00 00
00 00 00 00 00 00 00 00 00 00 00 00 00 00 00 fe
00 73 61 6d 73 75 6e 67 20 73 6f 66 65 66 00 5d

----------------

Block 0, Base EDID:
  EDID Structure Version & Revision: 1.3
  Vendor & Product Identification:
    Manufacturer: QCM
    Model: 1
    Serial Number: ...
    Made in: week 27 of 2006
  Basic Display Parameters & Features:
    Digital display
    Maximum image size: 80 cm x 45 cm
    Gamma: 2.20
    RGB color display
    First detailed timing is the preferred timing
  Color Characteristics:
    Red  : 0.6250, 0.3398
    Green: 0.2802, 0.5947
    Blue : 0.1552, 0.0703
    White: 0.2832, 0.2978
  Established Timings I & II: none
  Standard Timings: none
  Detailed Timing Descriptors:
    DTD 1:  1080x2400   25.283266 Hz   9:20    91.525 kHz    108.000000 MHz (analog composite, sync-on-green)
                 Hfront   52 Hsync  24 Hback   24 Hpol N
                 Vfront   56 Vsync   4 Vback 1160 Vpol N
    DTD 2:  1080x2400   37.883040 Hz   9:20    91.525 kHz    108.000000 MHz (analog composite, sync-on-green)
                 Hfront   52 Hsync  24 Hback   24 Hpol N
                 Vfront    4 Vsync   4 Vback    8 Vpol N
    Empty Descriptor
    Alphanumeric Data String: 'samsung sofef'
Checksum: 0x5d

----------------

Warnings:

Block 0, Base EDID:
  Vendor & Product Identification: The serial number is one of the known dummy values, it should probably be set to 0.

Failures:

Block 0, Base EDID:
  Detailed Timing Descriptor #1: Mismatch of image size vs display size: image size is not set, but display size is.
  Detailed Timing Descriptor #2: Mismatch of image size vs display size: image size is not set, but display size is.
  Empty Descriptor: Use Dummy Descriptor instead of all zeroes.
  Missing Display Product Name.
  Missing Display Range Limits Descriptor.

EDID conformity: FAIL
