edid-decode (hex):

00 ff ff ff ff ff ff 00 44 6d 01 00 01 00 00 00
1b 10 01 03 80 50 2d 78 0a 0d c9 a0 57 47 98 27
12 48 4c 00 00 00 01 01 01 01 01 01 01 01 01 01
01 01 01 01 01 01 20 49 a0 20 50 30 30 c6 10 08
0c 05 00 00 00 00 00 00 22 29 38 20 40 24 10 90
10 08 44 00 00 00 00 00 00 00 22 29 38 20 40 24
30 96 10 08 0c 05 00 00 00 00 00 00 00 00 00 fe
00 73 61 6d 73 75 6e 67 20 64 73 63 20 63 00 82

----------------

Block 0, Base EDID:
  EDID Structure Version & Revision: 1.3
  Vendor & Product Identification:
    Manufacturer: QCM
    Model: 1
    Serial Number: ...
    Made in: week 27 of 2006
  Basic Display Parameters & Features:
    Digital display
    Maximum image size: 80 cm x 45 cm
    Gamma: 2.20
    RGB color display
    First detailed timing is the preferred timing
  Color Characteristics:
    Red  : 0.6250, 0.3398
    Green: 0.2802, 0.5947
    Blue : 0.1552, 0.0703
    White: 0.2832, 0.2978
  Established Timings I & II: none
  Standard Timings: none
  Detailed Timing Descriptors:
    DTD 1:  1440x3120   27.035271 Hz   6:13   127.174 kHz    187.200000 MHz (analog composite, sync-on-green)
                 Hfront   16 Hsync   8 Hback    8 Hpol N
                 Vfront   16 Vsync  28 Vback 1540 Vpol N
    DTD 2:  1080x2340   40.192803 Hz   6:13    94.694 kHz    105.300000 MHz (analog composite, sync-on-green)
                 Hfront   16 Hsync   8 Hback    8 Hpol N
                 Vfront    4 Vsync   4 Vback    8 Vpol N
    DTD 3:  1080x2340   24.132070 Hz   6:13    94.694 kHz    105.300000 MHz (analog composite, sync-on-green)
                 Hfront   16 Hsync   8 Hback    8 Hpol N
                 Vfront   16 Vsync  28 Vback 1540 Vpol N
    Alphanumeric Data String: 'samsung dsc c'
Checksum: 0x82

----------------

Warnings:

Block 0, Base EDID:
  Vendor & Product Identification: The serial number is one of the known dummy values, it should probably be set to 0.

Failures:

Block 0, Base EDID:
  Detailed Timing Descriptor #1: Mismatch of image size vs display size: image size is not set, but display size is.
  Detailed Timing Descriptor #2: Mismatch of image size vs display size: image size is not set, but display size is.
  Detailed Timing Descriptor #3: Mismatch of image size vs display size: image size is not set, but display size is.
  Missing Display Product Name.
  Missing Display Range Limits Descriptor.

EDID conformity: FAIL
