edid-decode (hex):

00 ff ff ff ff ff ff 00 1e 6d 34 3b 88 08 00 00
02 0c 01 03 28 1e 17 96 e8 99 aa a3 54 4d 95 24
19 51 54 bf ee 00 31 4f 45 4f 61 4f 01 01 01 01
01 01 01 01 01 01 64 19 00 40 41 00 26 30 18 88
36 00 30 e4 10 00 00 18 00 00 00 fd 00 38 4b 1f
3d 08 00 0a 20 20 20 20 20 20 00 00 00 fc 00 46
4c 41 54 52 4f 4e 20 4c 43 44 20 35 00 00 00 fc
00 37 35 4c 45 0a 20 20 20 20 20 20 20 20 00 a5

00 ff ff ff ff ff ff 00 1e 6d 34 3b 88 08 00 00
02 0c 01 03 28 1e 17 96 e8 99 aa a3 54 4d 95 24
19 51 54 bf ee 00 31 4f 45 4f 61 4f 01 01 01 01
01 01 01 01 01 01 64 19 00 40 41 00 26 30 18 88
36 00 30 e4 10 00 00 18 00 00 00 fd 00 38 4b 1f
3d 08 00 0a 20 20 20 20 20 20 00 00 00 fc 00 46
4c 41 54 52 4f 4e 20 4c 43 44 20 35 00 00 00 fc
00 37 35 4c 45 0a 20 20 20 20 20 20 20 20 00 a5

----------------

Block 0, Base EDID:
  EDID Structure Version & Revision: 1.3
  Vendor & Product Identification:
    Manufacturer: GSM
    Model: 15156
    Serial Number: ...
    Made in: week 2 of 2002
  Basic Display Parameters & Features:
    Analog display
    Signal Level Standard: 0.714 : 0.286 : 1.000 V p-p
    Blank level equals black level
    Sync: Separate
    Maximum image size: 30 cm x 23 cm
    Gamma: 2.50
    DPMS levels: Standby Suspend Off
    RGB color display
  Color Characteristics:
    Red  : 0.6386, 0.3291
    Green: 0.3027, 0.5830
    Blue : 0.1425, 0.0996
    White: 0.3183, 0.3300
  Established Timings I & II:
    IBM     :   720x400    70.081663 Hz   9:5     31.467 kHz     28.320000 MHz
    DMT 0x04:   640x480    59.940476 Hz   4:3     31.469 kHz     25.175000 MHz
    Apple   :   640x480    66.666667 Hz   4:3     35.000 kHz     30.240000 MHz
    DMT 0x05:   640x480    72.808802 Hz   4:3     37.861 kHz     31.500000 MHz
    DMT 0x06:   640x480    75.000000 Hz   4:3     37.500 kHz     31.500000 MHz
    DMT 0x08:   800x600    56.250000 Hz   4:3     35.156 kHz     36.000000 MHz
    DMT 0x09:   800x600    60.316541 Hz   4:3     37.879 kHz     40.000000 MHz
    DMT 0x0a:   800x600    72.187572 Hz   4:3     48.077 kHz     50.000000 MHz
    DMT 0x0b:   800x600    75.000000 Hz   4:3     46.875 kHz     49.500000 MHz
    Apple   :   832x624    74.551266 Hz   4:3     49.726 kHz     57.284000 MHz
    DMT 0x10:  1024x768    60.003840 Hz   4:3     48.363 kHz     65.000000 MHz
    DMT 0x11:  1024x768    70.069359 Hz   4:3     56.476 kHz     75.000000 MHz
    DMT 0x12:  1024x768    75.028582 Hz   4:3     60.023 kHz     78.750000 MHz
  Standard Timings:
    DMT 0x06:   640x480    75.000000 Hz   4:3     37.500 kHz     31.500000 MHz
    DMT 0x0b:   800x600    75.000000 Hz   4:3     46.875 kHz     49.500000 MHz
    DMT 0x12:  1024x768    75.028582 Hz   4:3     60.023 kHz     78.750000 MHz
  Detailed Timing Descriptors:
    DTD 1:  1024x768    60.003840 Hz   4:3     48.363 kHz     65.000000 MHz (304 mm x 228 mm)
                 Hfront   24 Hsync 136 Hback  160 Hpol N
                 Vfront    3 Vsync   6 Vback   29 Vpol N
    Display Range Limits:
      Monitor ranges (GTF): 56-75 Hz V, 31-61 kHz H, max dotclock 80 MHz
    Display Product Name: 'FLATRON LCD 5'
    Display Product Name: '75LE'
Checksum: 0xa5

----------------

Failures:

Block 0, Base EDID:
  Basic Display Parameters & Features: EDID 1.3 requires that the first detailed timing is the preferred timing.
EDID:
  Extension Block 1 started with EDID header, ignoring Extension Blocks >= 1.

EDID conformity: FAIL
