edid-decode (hex):

00 ff ff ff ff ff ff 00 0e 14 00 00 00 00 00 00
00 17 01 03 95 1d 10 78 0a 80 85 91 56 59 92 29
1f 50 54 00 00 00 01 01 01 01 01 01 01 01 01 01
01 01 01 01 01 01 30 26 40 a0 60 84 1a 30 30 20
35 00 35 ae 10 00 00 19 00 00 00 fe 00 0a 20 20
20 20 20 20 20 20 20 20 20 20 00 00 00 fe 00 43
50 54 00 00 0a 20 20 20 20 20 20 20 00 00 00 fe
00 43 4c 41 41 31 34 30 55 41 30 31 43 0a 00 7e

----------------

Block 0, Base EDID:
  EDID Structure Version & Revision: 1.3
  Vendor & Product Identification:
    Manufacturer: CPT
    Model: 0
    Made in: 2013
  Basic Display Parameters & Features:
    Digital display
    DFP 1.x compatible TMDS
    Maximum image size: 29 cm x 16 cm
    Gamma: 2.20
    RGB color display
    First detailed timing is the preferred timing
  Color Characteristics:
    Red  : 0.5683, 0.3359
    Green: 0.3476, 0.5703
    Blue : 0.1621, 0.1210
    White: 0.3134, 0.3291
  Established Timings I & II: none
  Standard Timings: none
  Detailed Timing Descriptors:
    DTD 1:  1600x900    59.984292 Hz  16:9     55.545 kHz     97.760000 MHz (309 mm x 174 mm)
                 Hfront   48 Hsync  32 Hback   80 Hpol N
                 Vfront    3 Vsync   5 Vback   18 Vpol N
    Alphanumeric Data String: ''
    Alphanumeric Data String: 'CPT'
    Alphanumeric Data String: 'CLAA140UA01C'
Checksum: 0x7e

----------------

Failures:

Block 0, Base EDID:
  Basic Display Parameters & Features: Digital Video Interface Standard set to reserved value 0x14.
  Detailed Timing Descriptor #1: Mismatch of image size 309x174 mm vs display size 290x160 mm.
  Alphanumeric Data String: Empty string.
  Alphanumeric Data String: NUL byte at position 3.
  Missing Display Product Name.
  Missing Display Range Limits Descriptor.
EDID:
  Base EDID: The DTD max image size is 309x174mm, which is larger than the display size 290.0x160.0mm.

EDID conformity: FAIL
