edid-decode (hex):

00 ff ff ff ff ff ff 00 0e 14 00 00 00 00 00 00
00 17 01 03 80 1a 0f 78 0a a1 25 91 56 55 92 27
1a 50 54 00 00 00 01 01 01 01 01 01 01 01 01 01
01 01 01 01 01 01 30 26 40 a0 60 84 1a 30 30 20
35 00 0b 96 10 00 00 19 00 00 00 fe 00 0a 20 20
20 20 20 20 20 20 20 20 20 20 00 00 00 fe 00 43
50 54 00 00 0a 20 20 20 20 20 20 20 00 00 00 fe
00 43 4c 41 41 31 32 31 55 41 30 32 43 0a 00 23

----------------

Block 0, Base EDID:
  EDID Structure Version & Revision: 1.3
  Vendor & Product Identification:
    Manufacturer: CPT
    Model: 0
    Made in: 2013
  Basic Display Parameters & Features:
    Digital display
    Maximum image size: 26 cm x 15 cm
    Gamma: 2.20
    RGB color display
    First detailed timing is the preferred timing
  Color Characteristics:
    Red  : 0.5683, 0.3378
    Green: 0.3320, 0.5712
    Blue : 0.1523, 0.1035
    White: 0.3134, 0.3291
  Established Timings I & II: none
  Standard Timings: none
  Detailed Timing Descriptors:
    DTD 1:  1600x900    59.984292 Hz  16:9     55.545 kHz     97.760000 MHz (267 mm x 150 mm)
                 Hfront   48 Hsync  32 Hback   80 Hpol N
                 Vfront    3 Vsync   5 Vback   18 Vpol N
    Alphanumeric Data String: ''
    Alphanumeric Data String: 'CPT'
    Alphanumeric Data String: 'CLAA121UA02C'
Checksum: 0x23

----------------

Failures:

Block 0, Base EDID:
  Alphanumeric Data String: Empty string.
  Alphanumeric Data String: NUL byte at position 3.
  Missing Display Product Name.
  Missing Display Range Limits Descriptor.

EDID conformity: FAIL
