edid-decode (hex):

00 ff ff ff ff ff ff 00 4d d9 00 f9 01 01 01 01
31 11 01 03 80 46 27 78 ee 46 2f a3 54 4a 99 26
0f 4a 4c a1 08 00 81 80 4b c0 8b c0 01 01 01 01
01 01 01 01 01 01 1b 21 50 a0 51 00 1e 30 48 88
35 00 b8 88 21 00 00 1c 0e 1f 00 80 51 00 1e 30
40 80 37 00 8d 88 21 00 00 1c 00 00 00 fc 00 4b
4c 48 2d 57 32 36 2f 57 33 32 0a 20 00 00 00 fd
00 30 3e 0d 46 0f 00 0a 20 20 20 20 20 20 01 d0

02 03 27 70 53 10 1f 05 14 04 13 03 12 02 11 06
15 07 16 09 08 18 17 01 23 09 07 07 83 01 00 00
66 03 0c 00 10 00 80 01 1d 80 18 71 1c 16 20 58
2c 25 00 b8 88 21 00 00 9e 01 1d 80 d0 72 1c 16
20 10 2c 25 10 b8 88 21 00 00 9e 8c 0a a0 14 51
f0 16 00 26 7c 43 00 0a 88 21 00 00 98 8c 0a a0
20 51 20 18 10 18 7e 23 00 0a 88 21 00 00 98 00
00 00 00 00 00 00 00 00 00 00 00 00 00 00 00 c7

00 ff ff ff ff ff ff 00 4d d9 00 f9 01 01 01 01
31 11 01 03 80 46 27 78 ee 46 2f a3 54 4a 99 26
0f 4a 4c a1 08 00 81 80 4b c0 8b c0 01 01 01 01
01 01 01 01 01 01 1b 21 50 a0 51 00 1e 30 48 88
35 00 b8 88 21 00 00 1c 0e 1f 00 80 51 00 1e 30
40 80 37 00 8d 88 21 00 00 1c 00 00 00 fc 00 4b
4c 48 2d 57 32 36 2f 57 33 32 0a 20 00 00 00 fd
00 30 3e 0d 46 0f 00 0a 20 20 20 20 20 20 01 d0

02 03 27 70 53 10 1f 05 14 04 13 03 12 02 11 06
15 07 16 09 08 18 17 01 23 09 07 07 83 01 00 00
66 03 0c 00 10 00 80 01 1d 80 18 71 1c 16 20 58
2c 25 00 b8 88 21 00 00 9e 01 1d 80 d0 72 1c 16
20 10 2c 25 10 b8 88 21 00 00 9e 8c 0a a0 14 51
f0 16 00 26 7c 43 00 0a 88 21 00 00 98 8c 0a a0
20 51 20 18 10 18 7e 23 00 0a 88 21 00 00 98 00
00 00 00 00 00 00 00 00 00 00 00 00 00 00 00 c7

----------------

Block 0, Base EDID:
  EDID Structure Version & Revision: 1.3
  Vendor & Product Identification:
    Manufacturer: SNY
    Model: 63744
    Serial Number: ...
    Made in: week 49 of 2007
  Basic Display Parameters & Features:
    Digital display
    Maximum image size: 70 cm x 39 cm
    Gamma: 2.20
    DPMS levels: Standby Suspend Off
    RGB color display
    Default (sRGB) color space is primary color space
    First detailed timing is the preferred timing
  Color Characteristics:
    Red  : 0.6376, 0.3281
    Green: 0.2900, 0.5996
    Blue : 0.1484, 0.0605
    White: 0.2919, 0.2998
  Established Timings I & II:
    IBM     :   720x400    70.081663 Hz   9:5     31.467 kHz     28.320000 MHz
    DMT 0x04:   640x480    59.940476 Hz   4:3     31.469 kHz     25.175000 MHz
    DMT 0x09:   800x600    60.316541 Hz   4:3     37.879 kHz     40.000000 MHz
    DMT 0x10:  1024x768    60.003840 Hz   4:3     48.363 kHz     65.000000 MHz
  Standard Timings:
    DMT 0x23:  1280x1024   60.019740 Hz   5:4     63.981 kHz    108.000000 MHz
    GTF     :   848x477    60.000307 Hz  16:9     29.640 kHz     31.300000 MHz
    GTF     :  1360x765    60.000341 Hz  16:9     47.520 kHz     84.396000 MHz
  Detailed Timing Descriptors:
    DTD 1:  1360x768    59.798991 Hz  85:48    47.720 kHz     84.750000 MHz (696 mm x 392 mm)
                 Hfront   72 Hsync 136 Hback  208 Hpol N
                 Vfront    3 Vsync   5 Vback   22 Vpol P
    DTD 2:  1280x768    59.870228 Hz   5:3     47.776 kHz     79.500000 MHz (653 mm x 392 mm)
                 Hfront   64 Hsync 128 Hback  192 Hpol N
                 Vfront    3 Vsync   7 Vback   20 Vpol P
    Display Product Name: 'KLH-W26/W32'
    Display Range Limits:
      Monitor ranges (GTF): 48-62 Hz V, 13-70 kHz H, max dotclock 150 MHz
  Extension blocks: 1
Checksum: 0xd0

----------------

Block 1, CTA-861 Extension Block:
  Revision: 3
  Basic audio support
  Supports YCbCr 4:4:4
  Supports YCbCr 4:2:2
  Native DTDs: 0
  Video Data Block:
    VIC  16:  1920x1080   60.000000 Hz  16:9     67.500 kHz    148.500000 MHz
    VIC  31:  1920x1080   50.000000 Hz  16:9     56.250 kHz    148.500000 MHz
    VIC   5:  1920x1080i  60.000000 Hz  16:9     33.750 kHz     74.250000 MHz
    VIC  20:  1920x1080i  50.000000 Hz  16:9     28.125 kHz     74.250000 MHz
    VIC   4:  1280x720    60.000000 Hz  16:9     45.000 kHz     74.250000 MHz
    VIC  19:  1280x720    50.000000 Hz  16:9     37.500 kHz     74.250000 MHz
    VIC   3:   720x480    59.940060 Hz  16:9     31.469 kHz     27.000000 MHz
    VIC  18:   720x576    50.000000 Hz  16:9     31.250 kHz     27.000000 MHz
    VIC   2:   720x480    59.940060 Hz   4:3     31.469 kHz     27.000000 MHz
    VIC  17:   720x576    50.000000 Hz   4:3     31.250 kHz     27.000000 MHz
    VIC   6:  1440x480i   59.940060 Hz   4:3     15.734 kHz     27.000000 MHz
    VIC  21:  1440x576i   50.000000 Hz   4:3     15.625 kHz     27.000000 MHz
    VIC   7:  1440x480i   59.940060 Hz  16:9     15.734 kHz     27.000000 MHz
    VIC  22:  1440x576i   50.000000 Hz  16:9     15.625 kHz     27.000000 MHz
    VIC   9:  1440x240    60.054449 Hz  16:9     15.734 kHz     27.000000 MHz
    VIC   8:  1440x240    60.054449 Hz   4:3     15.734 kHz     27.000000 MHz
    VIC  24:  1440x288    50.080128 Hz  16:9     15.625 kHz     27.000000 MHz
    VIC  23:  1440x288    50.080128 Hz   4:3     15.625 kHz     27.000000 MHz
    VIC   1:   640x480    59.940476 Hz   4:3     31.469 kHz     25.175000 MHz
  Audio Data Block:
    Linear PCM:
      Max channels: 2
      Supported sample rates (kHz): 48 44.1 32
      Supported sample sizes (bits): 24 20 16
  Speaker Allocation Data Block:
    FL/FR - Front Left/Right
  Vendor-Specific Data Block (HDMI), OUI 00-0C-03:
    Source physical address: 1.0.0.0
    Supports_AI
  Detailed Timing Descriptors:
    DTD 3:  1920x1080i  60.000000 Hz  16:9     33.750 kHz     74.250000 MHz (696 mm x 392 mm)
                 Hfront   88 Hsync  44 Hback  148 Hpol P
                 Vfront    2 Vsync   5 Vback   15 Vpol P Vfront +0.5 Odd Field
                 Vfront    2 Vsync   5 Vback   15 Vpol P Vback  +0.5 Even Field
    DTD 4:  1920x1080i  50.000000 Hz  16:9     28.125 kHz     74.250000 MHz (696 mm x 392 mm)
                 Hfront   16 Hsync 300 Hback  404 Hpol P
                 Vfront    2 Vsync   5 Vback   15 Vpol P Vfront +0.5 Odd Field
                 Vfront    2 Vsync   5 Vback   15 Vpol P Vback  +0.5 Even Field
    DTD 5:  1440x480i   59.940060 Hz   3:1     15.734 kHz     27.000000 MHz (522 mm x 392 mm)
                 Hfront   38 Hsync 124 Hback  114 Hpol N
                 Vfront    4 Vsync   3 Vback   15 Vpol N Vfront +0.5 Odd Field
                 Vfront    4 Vsync   3 Vback   15 Vpol N Vback  +0.5 Even Field
    DTD 6:  1440x576i   50.000000 Hz   5:2     15.625 kHz     27.000000 MHz (522 mm x 392 mm)
                 Hfront   24 Hsync 126 Hback  138 Hpol N
                 Vfront    2 Vsync   3 Vback   19 Vpol N Vfront +0.5 Odd Field
                 Vfront    2 Vsync   3 Vback   19 Vpol N Vback  +0.5 Even Field
Checksum: 0xc7  Unused space in Extension Block: 16 bytes

----------------

Warnings:

Block 0, Base EDID:
  Vendor & Product Identification: The serial number is one of the known dummy values, it should probably be set to 0.
  Standard Timings: Standard Timing 848x477 has a dubious odd vertical resolution.
  Standard Timings: Standard Timing 1360x765 has a dubious odd vertical resolution.
Block 1, CTA-861 Extension Block:
  IT Video Formats are overscanned by default, but normally this should be underscanned.
  Video Data Block: VIC 16 and the first DTD are not identical. Is this intended?
  Detailed Timing Descriptor #4: DTD is similar but not identical to VIC 20.
  Detailed Timing Descriptor #5: Image size is 522x392 mm, but based on the picture AR it should be 522x174 mm.
  Detailed Timing Descriptor #6: Image size is 522x392 mm, but based on the picture AR it should be 522x208 mm.
EDID:
  Base EDID: Some timings are out of range of the Monitor Ranges:
    Vertical Freq: 50.000 - 70.082 Hz (Monitor: 48.000 - 62.000 Hz)

Failures:

Block 0, Base EDID:
  Basic Display Parameters & Features: sRGB is signaled, but the chromaticities do not match.
Block 1, CTA-861 Extension Block:
  Missing VCDB, needed for Set Selectable RGB Quantization to avoid interop issues.
EDID:
  Extension Block 2 started with EDID header, ignoring Extension Blocks >= 2.

EDID conformity: FAIL
