edid-decode (hex):

00 ff ff ff ff ff ff 00 36 69 e4 6c 00 00 00 00
10 23 01 04 b5 3c 22 78 39 96 65 ae 4f 41 b6 25
0d 50 54 bf cf 00 81 80 95 00 b3 00 01 01 01 01
01 01 01 01 01 01 56 5e 00 a0 a0 a0 29 50 30 20
35 00 55 50 21 00 00 1a 00 00 00 fd 02 30 41 ff
ff 8c 01 0a 20 20 20 20 20 20 00 00 00 fc 00 4d
41 47 20 32 37 34 51 46 20 58 33 32 00 00 00 ff
00 43 45 34 48 33 36 35 36 30 30 30 31 34 02 6e

02 03 38 f1 23 09 07 07 83 01 00 00 48 01 03 04
90 12 13 1f 3f e2 00 7f e3 05 c0 00 e6 06 0f 01
62 5f 00 74 1a 00 00 03 00 30 f0 00 00 00 00 00
00 00 01 00 00 00 00 00 6f c2 00 a0 a0 a0 55 50
30 20 35 00 55 50 21 00 00 1a 98 e2 00 a0 a0 a0
29 50 30 40 35 00 55 50 21 00 00 1e 08 e8 80 18
71 38 2d 40 40 30 35 00 55 50 21 00 00 1e 00 00
00 00 00 00 00 00 00 00 00 00 00 00 00 00 00 9b

70 12 79 03 00 03 01 50 8c 9a 01 04 ff 09 9f 00
2f 80 1f 00 9f 05 a9 00 09 00 04 00 b5 3a 01 04
ff 09 9f 00 2f 80 1f 00 9f 05 28 00 02 00 04 00
ee da 01 04 ff 09 9f 00 2f 80 3f 00 9f 05 31 00
02 00 04 00 98 fa 01 04 ff 09 9f 00 2f 80 3f 00
9f 05 31 00 02 00 04 00 00 00 00 00 00 00 00 00
00 00 00 00 00 00 00 00 00 00 00 00 00 00 00 00
00 00 00 00 00 00 00 00 00 00 00 00 00 00 a5 90

00 ff ff ff ff ff ff 00 36 69 e4 6c 00 00 00 00
10 23 01 04 b5 3c 22 78 39 96 65 ae 4f 41 b6 25
0d 50 54 bf cf 00 81 80 95 00 b3 00 01 01 01 01
01 01 01 01 01 01 56 5e 00 a0 a0 a0 29 50 30 20
35 00 55 50 21 00 00 1a 00 00 00 fd 02 30 41 ff
ff 8c 01 0a 20 20 20 20 20 20 00 00 00 fc 00 4d
41 47 20 32 37 34 51 46 20 58 33 32 00 00 00 ff
00 43 45 34 48 33 36 35 36 30 30 30 31 34 02 6e

02 03 38 f1 23 09 07 07 83 01 00 00 48 01 03 04
90 12 13 1f 3f e2 00 7f e3 05 c0 00 e6 06 0f 01
62 5f 00 74 1a 00 00 03 00 30 f0 00 00 00 00 00
00 00 01 00 00 00 00 00 6f c2 00 a0 a0 a0 55 50
30 20 35 00 55 50 21 00 00 1a 98 e2 00 a0 a0 a0
29 50 30 40 35 00 55 50 21 00 00 1e 08 e8 80 18
71 38 2d 40 40 30 35 00 55 50 21 00 00 1e 00 00
00 00 00 00 00 00 00 00 00 00 00 00 00 00 00 9b

70 12 79 03 00 03 01 50 8c 9a 01 04 ff 09 9f 00
2f 80 1f 00 9f 05 a9 00 09 00 04 00 b5 3a 01 04
ff 09 9f 00 2f 80 1f 00 9f 05 28 00 02 00 04 00
ee da 01 04 ff 09 9f 00 2f 80 3f 00 9f 05 31 00
02 00 04 00 98 fa 01 04 ff 09 9f 00 2f 80 3f 00
9f 05 31 00 02 00 04 00 00 00 00 00 00 00 00 00
00 00 00 00 00 00 00 00 00 00 00 00 00 00 00 00
00 00 00 00 00 00 00 00 00 00 00 00 00 00 a5 90

----------------

Block 0, Base EDID:
  EDID Structure Version & Revision: 1.4
  Vendor & Product Identification:
    Manufacturer: MSI
    Model: 27876
    Made in: week 16 of 2025
  Basic Display Parameters & Features:
    Digital display
    Bits per primary color channel: 10
    DisplayPort interface
    Maximum image size: 60 cm x 34 cm
    Gamma: 2.20
    DPMS levels: Off
    Supported color formats: RGB 4:4:4, YCrCb 4:4:4, YCrCb 4:2:2
    First detailed timing does not include the native pixel format and preferred refresh rate
    Display supports continuous frequencies
  Color Characteristics:
    Red  : 0.6816, 0.3095
    Green: 0.2548, 0.7128
    Blue : 0.1455, 0.0527
    White: 0.3134, 0.3291
  Established Timings I & II:
    IBM     :   720x400    70.081663 Hz   9:5     31.467 kHz     28.320000 MHz
    DMT 0x04:   640x480    59.940476 Hz   4:3     31.469 kHz     25.175000 MHz
    Apple   :   640x480    66.666667 Hz   4:3     35.000 kHz     30.240000 MHz
    DMT 0x05:   640x480    72.808802 Hz   4:3     37.861 kHz     31.500000 MHz
    DMT 0x06:   640x480    75.000000 Hz   4:3     37.500 kHz     31.500000 MHz
    DMT 0x08:   800x600    56.250000 Hz   4:3     35.156 kHz     36.000000 MHz
    DMT 0x09:   800x600    60.316541 Hz   4:3     37.879 kHz     40.000000 MHz
    DMT 0x0a:   800x600    72.187572 Hz   4:3     48.077 kHz     50.000000 MHz
    DMT 0x0b:   800x600    75.000000 Hz   4:3     46.875 kHz     49.500000 MHz
    DMT 0x10:  1024x768    60.003840 Hz   4:3     48.363 kHz     65.000000 MHz
    DMT 0x11:  1024x768    70.069359 Hz   4:3     56.476 kHz     75.000000 MHz
    DMT 0x12:  1024x768    75.028582 Hz   4:3     60.023 kHz     78.750000 MHz
    DMT 0x24:  1280x1024   75.024675 Hz   5:4     79.976 kHz    135.000000 MHz
  Standard Timings:
    DMT 0x23:  1280x1024   60.019740 Hz   5:4     63.981 kHz    108.000000 MHz
    DMT 0x2f:  1440x900    59.887445 Hz  16:10    55.935 kHz    106.500000 MHz
    DMT 0x3a:  1680x1050   59.954250 Hz  16:10    65.290 kHz    146.250000 MHz
  Detailed Timing Descriptors:
    DTD 1:  2560x1440   59.950550 Hz  16:9     88.787 kHz    241.500000 MHz (597 mm x 336 mm)
                 Hfront   48 Hsync  32 Hback   80 Hpol P
                 Vfront    3 Vsync   5 Vback   33 Vpol N
    Display Range Limits:
      Monitor ranges (Range Limits Only): 48-320 Hz V, 255-255 kHz H, max dotclock 1400 MHz
    Display Product Name: 'MAG 274QF X32'
    Display Product Serial Number: ...
  Extension blocks: 2
Checksum: 0x6e

----------------

Block 1, CTA-861 Extension Block:
  Revision: 3
  Underscans IT Video Formats by default
  Basic audio support
  Supports YCbCr 4:4:4
  Supports YCbCr 4:2:2
  Native DTDs: 1
  Audio Data Block:
    Linear PCM:
      Max channels: 2
      Supported sample rates (kHz): 48 44.1 32
      Supported sample sizes (bits): 24 20 16
  Speaker Allocation Data Block:
    FL/FR - Front Left/Right
  Video Data Block:
    VIC   1:   640x480    59.940476 Hz   4:3     31.469 kHz     25.175000 MHz
    VIC   3:   720x480    59.940060 Hz  16:9     31.469 kHz     27.000000 MHz
    VIC   4:  1280x720    60.000000 Hz  16:9     45.000 kHz     74.250000 MHz
    VIC  16:  1920x1080   60.000000 Hz  16:9     67.500 kHz    148.500000 MHz (native)
    VIC  18:   720x576    50.000000 Hz  16:9     31.250 kHz     27.000000 MHz
    VIC  19:  1280x720    50.000000 Hz  16:9     37.500 kHz     74.250000 MHz
    VIC  31:  1920x1080   50.000000 Hz  16:9     56.250 kHz    148.500000 MHz
    VIC  63:  1920x1080  120.000000 Hz  16:9    135.000 kHz    297.000000 MHz
  Video Capability Data Block:
    YCbCr quantization: No Data
    RGB quantization: Selectable (via AVI Q)
    PT scan behavior: Supports both over- and underscan
    IT scan behavior: Supports both over- and underscan
    CE scan behavior: Supports both over- and underscan
  Colorimetry Data Block:
    BT2020YCC
    BT2020RGB
  HDR Static Metadata Data Block:
    Electro optical transfer functions:
      Traditional gamma - SDR luminance range
      Traditional gamma - HDR luminance range
      SMPTE ST2084
      Hybrid Log-Gamma
    Supported static metadata descriptors:
      Static metadata type 1
    Desired content max luminance: 98 (417.710 cd/m^2)
    Desired content max frame-average luminance: 95 (391.429 cd/m^2)
    Desired content min luminance: 0 (0.000 cd/m^2)
  Vendor-Specific Data Block (AMD), OUI 00-00-1A:
    Version: 3
    Flags 1: 0x00
    Minimum Refresh Rate: 48 Hz
    Maximum Refresh Rate: 256 Hz
    Flags 5: 0x00
  Detailed Timing Descriptors:
    DTD 2:  2560x1440  119.997589 Hz  16:9    182.996 kHz    497.750000 MHz (597 mm x 336 mm)
                 Hfront   48 Hsync  32 Hback   80 Hpol P
                 Vfront    3 Vsync   5 Vback   77 Vpol N
    DTD 3:  2560x1440  144.000477 Hz  16:9    213.265 kHz    580.080000 MHz (597 mm x 336 mm)
                 Hfront   48 Hsync  64 Hback   48 Hpol P
                 Vfront    3 Vsync   5 Vback   33 Vpol P
    DTD 4:  1920x1080  240.000000 Hz  16:9    270.000 kHz    594.000000 MHz (597 mm x 336 mm)
                 Hfront   64 Hsync  48 Hback  168 Hpol P
                 Vfront    3 Vsync   5 Vback   37 Vpol P
Checksum: 0x9b  Unused space in Extension Block: 17 bytes

----------------

Block 2, DisplayID Extension Block:
  Version: 1.2
  Extension Count: 0
  Display Product Type: Standalone display device
  Video Timing Modes Type 1 - Detailed Timings Data Block:
    DTD:  2560x1440  240.000457 Hz  16:9    386.401 kHz   1051.010000 MHz (aspect 16:9, no 3D stereo)
               Hfront   48 Hsync  32 Hback   80 Hpol P
               Vfront   10 Vsync   5 Vback  155 Vpol N
    DTD:  2560x1440  199.999007 Hz  16:9    296.199 kHz    805.660000 MHz (aspect 16:9, no 3D stereo)
               Hfront   48 Hsync  32 Hback   80 Hpol P
               Vfront    3 Vsync   5 Vback   33 Vpol N
    DTD:  2560x1440  299.997533 Hz  16:9    446.996 kHz   1215.830000 MHz (aspect 16:9, no 3D stereo)
               Hfront   48 Hsync  64 Hback   48 Hpol P
               Vfront    3 Vsync   5 Vback   42 Vpol N
    DTD:  2560x1440  319.998520 Hz  16:9    476.798 kHz   1296.890000 MHz (aspect 16:9, no 3D stereo)
               Hfront   48 Hsync  64 Hback   48 Hpol P
               Vfront    3 Vsync   5 Vback   42 Vpol N
  Checksum: 0xa5
Checksum: 0x90

----------------

Warnings:

Block 1, CTA-861 Extension Block:
  Video Data Block: VIC 1 and the first DTD are not identical. Is this intended?
  Video Data Block: All VICs are in ascending order, and the first (preferred) VIC <= 4, is that intended?
  Video Capability Data Block: Set Selectable YCbCr Quantization to avoid interop issues.
  Video Capability Data Block: S_PT is equal to S_IT and S_CE, so should be set to 0 instead.
  Colorimetry Data Block: Set the sRGB colorimetry bit to avoid interop issues.
EDID:
  Base EDID: Some timings are out of range of the Monitor Ranges:
    Horizontal Freq: 31.250 - 476.797 kHz (Monitor: 255.000 - 255.000 kHz)

Failures:

EDID:
  Extension Block 3 started with EDID header, ignoring Extension Blocks >= 3.
  CTA-861: Native progressive timings are a mix of several resolutions.
  DisplayID: Missing DisplayID Display Parameters Data Block.
  DisplayID: DisplayID expects at least one preferred timing.

EDID conformity: FAIL
