edid-decode (hex):

00 ff ff ff ff ff ff 00 3b 10 23 20 01 00 00 00
0a 21 01 04 a0 1e 14 78 1b 0d c9 a0 57 47 98 27
12 48 4c 00 00 00 01 00 01 00 01 00 01 00 01 00
01 00 01 00 01 00 00 14 00 40 41 58 23 20 a0 18
c2 00 00 58 42 00 00 1e 00 14 00 40 41 58 23 20
a0 18 c2 00 00 58 42 00 00 1e 00 00 00 10 00 00
00 00 00 00 00 00 00 00 00 00 00 00 00 00 00 10
00 00 00 00 00 00 00 00 00 00 00 00 00 00 01 7c

02 02 04 00 00 00 00 00 00 00 00 00 00 00 00 00
00 00 00 00 00 00 00 00 00 00 00 00 00 00 00 00
00 00 00 00 00 00 00 00 00 00 00 00 00 00 00 00
00 00 00 00 00 00 00 00 00 00 00 00 00 00 00 00
00 00 00 00 00 00 00 00 00 00 00 00 00 00 00 00
00 00 00 00 00 00 00 00 00 00 00 00 00 00 00 00
00 00 00 00 00 00 00 00 00 00 00 00 00 00 00 00
00 00 00 00 00 00 00 00 00 00 00 00 00 00 00 f8

00 ff ff ff ff ff ff 00 3b 10 23 20 01 00 00 00
0a 21 01 04 a0 1e 14 78 1b 0d c9 a0 57 47 98 27
12 48 4c 00 00 00 01 00 01 00 01 00 01 00 01 00
01 00 01 00 01 00 00 14 00 40 41 58 23 20 a0 18
c2 00 00 58 42 00 00 1e 00 14 00 40 41 58 23 20
a0 18 c2 00 00 58 42 00 00 1e 00 00 00 10 00 00
00 00 00 00 00 00 00 00 00 00 00 00 00 00 00 10
00 00 00 00 00 00 00 00 00 00 00 00 00 00 01 7c

02 02 04 00 00 00 00 00 00 00 00 00 00 00 00 00
00 00 00 00 00 00 00 00 00 00 00 00 00 00 00 00
00 00 00 00 00 00 00 00 00 00 00 00 00 00 00 00
00 00 00 00 00 00 00 00 00 00 00 00 00 00 00 00
00 00 00 00 00 00 00 00 00 00 00 00 00 00 00 00
00 00 00 00 00 00 00 00 00 00 00 00 00 00 00 00
00 00 00 00 00 00 00 00 00 00 00 00 00 00 00 00
00 00 00 00 00 00 00 00 00 00 00 00 00 00 00 f8

----------------

Block 0, Base EDID:
  EDID Structure Version & Revision: 1.4
  Vendor & Product Identification:
    Manufacturer: NXP
    Model: 8227
    Serial Number: ...
    Made in: week 10 of 2023
  Basic Display Parameters & Features:
    Digital display
    Bits per primary color channel: 8
    Digital interface is not defined
    Maximum image size: 30 cm x 20 cm
    Gamma: 2.20
    Supported color formats: RGB 4:4:4, YCrCb 4:4:4, YCrCb 4:2:2
    First detailed timing includes the native pixel format and preferred refresh rate
    Display supports continuous frequencies
  Color Characteristics:
    Red  : 0.6250, 0.3398
    Green: 0.2802, 0.5947
    Blue : 0.1552, 0.0703
    White: 0.2832, 0.2978
  Established Timings I & II: none
  Standard Timings:
  Detailed Timing Descriptors:
    DTD 1:  1024x600    59.992501 Hz 128:75    38.095 kHz     51.200000 MHz (1024 mm x 600 mm)
                 Hfront  160 Hsync  24 Hback  136 Hpol P
                 Vfront   12 Vsync   2 Vback   21 Vpol P
    DTD 2:  1024x600    59.992501 Hz 128:75    38.095 kHz     51.200000 MHz (1024 mm x 600 mm)
                 Hfront  160 Hsync  24 Hback  136 Hpol P
                 Vfront   12 Vsync   2 Vback   21 Vpol P
    Dummy Descriptor:
    Dummy Descriptor:
  Extension blocks: 1
Checksum: 0x7c

----------------

Block 1, CTA-861 Extension Block:
  Revision: 2
  Native DTDs: 0
Checksum: 0xf8  Unused space in Extension Block: 123 bytes

----------------

Warnings:

Block 0, Base EDID:
  Vendor & Product Identification: The serial number is one of the known dummy values, it should probably be set to 0.
  Missing Display Product Name.
Block 1, CTA-861 Extension Block:
  IT Video Formats are overscanned by default, but normally this should be underscanned.
  Add a Colorimetry Data Block with the sRGB colorimetry bit set to avoid interop issues.

Failures:

Block 0, Base EDID:
  Standard Timings: Use 0x0101 as the invalid Standard Timings code, not 0x0100.
  Standard Timings: Use 0x0101 as the invalid Standard Timings code, not 0x0100.
  Standard Timings: Use 0x0101 as the invalid Standard Timings code, not 0x0100.
  Standard Timings: Use 0x0101 as the invalid Standard Timings code, not 0x0100.
  Standard Timings: Use 0x0101 as the invalid Standard Timings code, not 0x0100.
  Standard Timings: Use 0x0101 as the invalid Standard Timings code, not 0x0100.
  Standard Timings: Use 0x0101 as the invalid Standard Timings code, not 0x0100.
  Standard Timings: Use 0x0101 as the invalid Standard Timings code, not 0x0100.
  Detailed Timing Descriptor #1: Mismatch of image size 1024x600 mm vs display size 300x200 mm.
  Detailed Timing Descriptor #2: Mismatch of image size 1024x600 mm vs display size 300x200 mm.
  Missing Display Range Limits Descriptor.
Block 1, CTA-861 Extension Block:
  Deprecated CTA-861 Extension revision 2.
  Required 640x480p60 timings are missing in the established timings and the SVD list (VIC 1).
  Missing VCDB, needed for Set Selectable RGB Quantization to avoid interop issues.
EDID:
  Extension Block 2 started with EDID header, ignoring Extension Blocks >= 2.
  Base EDID: The DTD max image size is 1024x600mm, which is larger than the display size 300.0x200.0mm.

EDID conformity: FAIL
