edid-decode (hex):

00 ff ff ff ff ff ff 00 24 96 11 ed 38 fc 24 01
03 1b 01 03 80 3e 22 78 ea 1e c5 ae 4f 34 b1 26
0e 50 54 27 cf 00 d1 cf b3 00 a9 c0 95 00 81 81
81 00 81 c0 d1 00 02 3a 80 18 71 38 2d 40 58 2c
35 00 e0 0e 11 00 00 1a e2 68 00 a0 a0 40 2e 60
30 20 36 00 80 90 21 00 00 1a 56 5e 00 a0 a0 a0
29 50 30 20 36 00 80 68 21 00 00 1a 00 00 00 fc
00 41 4f 43 32 38 45 38 35 30 2e 48 44 52 01 55

02 03 43 70 52 61 bf 05 04 60 65 66 03 01 1f 12
13 14 20 5d 5e 5f 62 23 09 07 07 83 01 00 00 6d
03 0c 00 10 00 39 44 20 00 60 01 02 03 67 d8 5d
c4 01 78 80 03 e3 05 ef 01 e2 0f 71 e6 06 07 01
65 54 26 88 83 40 a0 b0 08 2e 70 30 20 36 00 d0
c2 21 00 00 1a 04 74 00 30 f2 70 5a 80 30 20 46
00 c0 1c 32 00 00 1a 08 e8 00 30 f2 70 5a 80 b0
58 2a 00 c0 1c 32 00 00 1e 00 00 00 00 00 00 04

00 ff ff ff ff ff ff 00 24 96 11 ed 38 fc 24 01
03 1b 01 03 80 3e 22 78 ea 1e c5 ae 4f 34 b1 26
0e 50 54 27 cf 00 d1 cf b3 00 a9 c0 95 00 81 81
81 00 81 c0 d1 00 02 3a 80 18 71 38 2d 40 58 2c
35 00 e0 0e 11 00 00 1a e2 68 00 a0 a0 40 2e 60
30 20 36 00 80 90 21 00 00 1a 56 5e 00 a0 a0 a0
29 50 30 20 36 00 80 68 21 00 00 1a 00 00 00 fc
00 41 4f 43 32 38 45 38 35 30 2e 48 44 52 01 55

02 03 43 70 52 61 bf 05 04 60 65 66 03 01 1f 12
13 14 20 5d 5e 5f 62 23 09 07 07 83 01 00 00 6d
03 0c 00 10 00 39 44 20 00 60 01 02 03 67 d8 5d
c4 01 78 80 03 e3 05 ef 01 e2 0f 71 e6 06 07 01
65 54 26 88 83 40 a0 b0 08 2e 70 30 20 36 00 d0
c2 21 00 00 1a 04 74 00 30 f2 70 5a 80 30 20 46
00 c0 1c 32 00 00 1a 08 e8 00 30 f2 70 5a 80 b0
58 2a 00 c0 1c 32 00 00 1e 00 00 00 00 00 00 04

----------------

Block 0, Base EDID:
  EDID Structure Version & Revision: 1.3
  Vendor & Product Identification:
    Manufacturer: IDV
    Model: 60689
    Serial Number: ...
    Made in: week 3 of 2017
  Basic Display Parameters & Features:
    Digital display
    Maximum image size: 62 cm x 34 cm
    Gamma: 2.20
    DPMS levels: Standby Suspend Off
    RGB color display
    First detailed timing is the preferred timing
  Color Characteristics:
    Red  : 0.6796, 0.3095
    Green: 0.2060, 0.6933
    Blue : 0.1513, 0.0546
    White: 0.3134, 0.3291
  Established Timings I & II:
    DMT 0x04:   640x480    59.940476 Hz   4:3     31.469 kHz     25.175000 MHz
    DMT 0x06:   640x480    75.000000 Hz   4:3     37.500 kHz     31.500000 MHz
    DMT 0x08:   800x600    56.250000 Hz   4:3     35.156 kHz     36.000000 MHz
    DMT 0x09:   800x600    60.316541 Hz   4:3     37.879 kHz     40.000000 MHz
    DMT 0x0a:   800x600    72.187572 Hz   4:3     48.077 kHz     50.000000 MHz
    DMT 0x0b:   800x600    75.000000 Hz   4:3     46.875 kHz     49.500000 MHz
    DMT 0x10:  1024x768    60.003840 Hz   4:3     48.363 kHz     65.000000 MHz
    DMT 0x11:  1024x768    70.069359 Hz   4:3     56.476 kHz     75.000000 MHz
    DMT 0x12:  1024x768    75.028582 Hz   4:3     60.023 kHz     78.750000 MHz
    DMT 0x24:  1280x1024   75.024675 Hz   5:4     79.976 kHz    135.000000 MHz
  Standard Timings:
    GTF     :  1920x1080   75.000068 Hz  16:9     84.600 kHz    220.637000 MHz
    DMT 0x3a:  1680x1050   59.954250 Hz  16:10    65.290 kHz    146.250000 MHz
    DMT 0x53:  1600x900    60.000000 Hz  16:9     60.000 kHz    108.000000 MHz (RB)
    DMT 0x2f:  1440x900    59.887445 Hz  16:10    55.935 kHz    106.500000 MHz
    GTF     :  1280x1024   60.999806 Hz   5:4     64.721 kHz    110.802000 MHz
    DMT 0x1c:  1280x800    59.810326 Hz  16:10    49.702 kHz     83.500000 MHz
    DMT 0x55:  1280x720    60.000000 Hz  16:9     45.000 kHz     74.250000 MHz
    DMT 0x45:  1920x1200   59.884600 Hz  16:10    74.556 kHz    193.250000 MHz
  Detailed Timing Descriptors:
    DTD 1:  1920x1080   60.000000 Hz  16:9     67.500 kHz    148.500000 MHz (480 mm x 270 mm)
                 Hfront   88 Hsync  44 Hback  148 Hpol P
                 Vfront    3 Vsync   5 Vback   37 Vpol N
    DTD 2:  2560x1600   59.971589 Hz  16:10    98.713 kHz    268.500000 MHz (640 mm x 400 mm)
                 Hfront   48 Hsync  32 Hback   80 Hpol P
                 Vfront    3 Vsync   6 Vback   37 Vpol N
    DTD 3:  2560x1440   59.950550 Hz  16:9     88.787 kHz    241.500000 MHz (640 mm x 360 mm)
                 Hfront   48 Hsync  32 Hback   80 Hpol P
                 Vfront    3 Vsync   6 Vback   32 Vpol N
    Display Product Name: 'AOC28E850.HDR'
  Extension blocks: 1
Checksum: 0x55

----------------

Block 1, CTA-861 Extension Block:
  Revision: 3
  Basic audio support
  Supports YCbCr 4:4:4
  Supports YCbCr 4:2:2
  Native DTDs: 0
  Video Data Block:
    VIC  97:  3840x2160   60.000000 Hz  16:9    135.000 kHz    594.000000 MHz
    VIC  63:  1920x1080  120.000000 Hz  16:9    135.000 kHz    297.000000 MHz (native)
    VIC   5:  1920x1080i  60.000000 Hz  16:9     33.750 kHz     74.250000 MHz
    VIC   4:  1280x720    60.000000 Hz  16:9     45.000 kHz     74.250000 MHz
    VIC  96:  3840x2160   50.000000 Hz  16:9    112.500 kHz    594.000000 MHz
    VIC 101:  4096x2160   50.000000 Hz 256:135  112.500 kHz    594.000000 MHz
    VIC 102:  4096x2160   60.000000 Hz 256:135  135.000 kHz    594.000000 MHz
    VIC   3:   720x480    59.940060 Hz  16:9     31.469 kHz     27.000000 MHz
    VIC   1:   640x480    59.940476 Hz   4:3     31.469 kHz     25.175000 MHz
    VIC  31:  1920x1080   50.000000 Hz  16:9     56.250 kHz    148.500000 MHz
    VIC  18:   720x576    50.000000 Hz  16:9     31.250 kHz     27.000000 MHz
    VIC  19:  1280x720    50.000000 Hz  16:9     37.500 kHz     74.250000 MHz
    VIC  20:  1920x1080i  50.000000 Hz  16:9     28.125 kHz     74.250000 MHz
    VIC  32:  1920x1080   24.000000 Hz  16:9     27.000 kHz     74.250000 MHz
    VIC  93:  3840x2160   24.000000 Hz  16:9     54.000 kHz    297.000000 MHz
    VIC  94:  3840x2160   25.000000 Hz  16:9     56.250 kHz    297.000000 MHz
    VIC  95:  3840x2160   30.000000 Hz  16:9     67.500 kHz    297.000000 MHz
    VIC  98:  4096x2160   24.000000 Hz 256:135   54.000 kHz    297.000000 MHz
  Audio Data Block:
    Linear PCM:
      Max channels: 2
      Supported sample rates (kHz): 48 44.1 32
      Supported sample sizes (bits): 24 20 16
  Speaker Allocation Data Block:
    FL/FR - Front Left/Right
  Vendor-Specific Data Block (HDMI), OUI 00-0C-03:
    Source physical address: 1.0.0.0
    DC_36bit
    DC_30bit
    DC_Y444
    DVI_Dual
    Maximum TMDS clock: 340 MHz
    Extended HDMI video details:
      HDMI VICs:
        HDMI VIC 1:  3840x2160   30.000000 Hz  16:9     67.500 kHz    297.000000 MHz
        HDMI VIC 2:  3840x2160   25.000000 Hz  16:9     56.250 kHz    297.000000 MHz
        HDMI VIC 3:  3840x2160   24.000000 Hz  16:9     54.000 kHz    297.000000 MHz
  Vendor-Specific Data Block (HDMI Forum), OUI C4-5D-D8:
    Version: 1
    Maximum TMDS Character Rate: 600 MHz
    SCDC Present
    Supports 12-bits/component Deep Color 4:2:0 Pixel Encoding
    Supports 10-bits/component Deep Color 4:2:0 Pixel Encoding
  Colorimetry Data Block:
    xvYCC601
    xvYCC709
    sYCC601
    opYCC601
    BT2020cYCC
    BT2020YCC
    BT2020RGB
    Gamut Boundary Description Metadata Profile P0
  YCbCr 4:2:0 Capability Map Data Block:
    VIC  97:  3840x2160   60.000000 Hz  16:9    135.000 kHz    594.000000 MHz
    VIC  96:  3840x2160   50.000000 Hz  16:9    112.500 kHz    594.000000 MHz
    VIC 101:  4096x2160   50.000000 Hz 256:135  112.500 kHz    594.000000 MHz
    VIC 102:  4096x2160   60.000000 Hz 256:135  135.000 kHz    594.000000 MHz
  HDR Static Metadata Data Block:
    Electro optical transfer functions:
      Traditional gamma - SDR luminance range
      Traditional gamma - HDR luminance range
      SMPTE ST2084
    Supported static metadata descriptors:
      Static metadata type 1
    Desired content max luminance: 101 (445.755 cd/m^2)
    Desired content max frame-average luminance: 84 (308.442 cd/m^2)
    Desired content min luminance: 38 (0.099 cd/m^2)
  Detailed Timing Descriptors:
    DTD 4:  2880x1800   60.001711 Hz  16:10   110.763 kHz    336.720000 MHz (720 mm x 450 mm)
                 Hfront   48 Hsync  32 Hback   80 Hpol P
                 Vfront    3 Vsync   6 Vback   37 Vpol N
    DTD 5:  3840x2160   30.000000 Hz  16:9     67.500 kHz    297.000000 MHz (960 mm x 540 mm)
                 Hfront   48 Hsync  32 Hback  480 Hpol P
                 Vfront    4 Vsync   6 Vback   80 Vpol N
    DTD 6:  3840x2160   60.000000 Hz  16:9    135.000 kHz    594.000000 MHz (960 mm x 540 mm)
                 Hfront  176 Hsync  88 Hback  296 Hpol P
                 Vfront    2 Vsync  10 Vback   78 Vpol P
Checksum: 0x04  Unused space in Extension Block: 6 bytes

----------------

Warnings:

Block 0, Base EDID:
  Detailed Timing Descriptor #1: DTD is similar but not identical to VIC 16.
Block 1, CTA-861 Extension Block:
  IT Video Formats are overscanned by default, but normally this should be underscanned.
  Video Data Block: VIC 97 and the first DTD are not identical. Is this intended?
  Colorimetry Data Block: Set the sRGB colorimetry bit to avoid interop issues.
  Detailed Timing Descriptor #5: DTD is similar but not identical to VIC 95.
  Detailed Timing Descriptor #6: DTD is similar but not identical to VIC 97.
EDID:
  CTA-861: Native progressive resolution of 1920x1080 is smaller than the max preferred progressive resolution 3840x2160.

Failures:

Block 0, Base EDID:
  Detailed Timing Descriptor #1: Mismatch of image size 480x270 mm vs display size 620x340 mm.
  Detailed Timing Descriptor #2: Mismatch of image size 640x400 mm vs display size 620x340 mm.
  Detailed Timing Descriptor #3: Mismatch of image size 640x360 mm vs display size 620x340 mm.
  Missing Display Range Limits Descriptor.
Block 1, CTA-861 Extension Block:
  Vendor-Specific Data Block (HDMI Forum), OUI C4-5D-D8: HDMI VIC and related CTA VIC codes are present, but the UHD VIC bit is 0.
  Detailed Timing Descriptor #4: Mismatch of image size 720x450 mm vs display size 620x340 mm.
  Detailed Timing Descriptor #5: Mismatch of image size 960x540 mm vs display size 620x340 mm.
  Detailed Timing Descriptor #6: Mismatch of image size 960x540 mm vs display size 620x340 mm.
  Missing VCDB, needed for Set Selectable RGB Quantization to avoid interop issues.
EDID:
  Extension Block 2 started with EDID header, ignoring Extension Blocks >= 2.
  Base EDID: The DTD max image size is 960x540mm, which is larger than the display size 620.0x340.0mm.

EDID conformity: FAIL
