edid-decode (hex):

00 ff ff ff ff ff ff 00 06 10 40 a0 00 00 00 00
10 1b 01 04 b5 21 15 78 02 0f 91 ae 52 43 b0 26
0d 50 54 00 00 00 01 01 01 01 01 01 01 01 01 01
01 01 01 01 01 01 7c 80 40 50 b0 08 34 70 08 20
68 08 4b cf 10 00 00 1a 00 00 00 fc 00 43 6f 6c
6f 72 20 4c 43 44 0a 20 20 20 00 00 00 10 00 00
00 00 00 00 00 00 00 00 00 00 00 00 00 00 00 10
00 00 00 00 00 00 00 00 00 00 00 00 00 00 01 c4

70 12 79 03 00 7f 81 3f fa 10 00 03 01 18 0f 28
17 00 00 00 00 00 00 00 00 00 00 00 00 00 00 00
4c 50 31 35 34 57 54 35 2d 53 4a 41 31 0a 20 00
44 43 4e 38 31 39 32 30 31 52 47 4a 34 36 52 33
44 0a 20 20 20 20 20 7f 81 29 fa 10 00 02 01 00
11 00 00 02 90 03 65 04 89 06 18 08 38 0b 20 0f
19 14 8a 1c 00 26 3d 34 51 47 ae 62 5a 87 21 b9
e3 fd 71 00 00 00 00 00 00 00 00 00 00 00 f5 90

00 ff ff ff ff ff ff 00 06 10 40 a0 00 00 00 00
10 1b 01 04 b5 21 15 78 02 0f 91 ae 52 43 b0 26
0d 50 54 00 00 00 01 01 01 01 01 01 01 01 01 01
01 01 01 01 01 01 7c 80 40 50 b0 08 34 70 08 20
68 08 4b cf 10 00 00 1a 00 00 00 fc 00 43 6f 6c
6f 72 20 4c 43 44 0a 20 20 20 00 00 00 10 00 00
00 00 00 00 00 00 00 00 00 00 00 00 00 00 00 10
00 00 00 00 00 00 00 00 00 00 00 00 00 00 01 c4

70 12 79 03 00 7f 81 3f fa 10 00 03 01 18 0f 28
17 00 00 00 00 00 00 00 00 00 00 00 00 00 00 00
4c 50 31 35 34 57 54 35 2d 53 4a 41 31 0a 20 00
44 43 4e 38 31 39 32 30 31 52 47 4a 34 36 52 33
44 0a 20 20 20 20 20 7f 81 29 fa 10 00 02 01 00
11 00 00 02 90 03 65 04 89 06 18 08 38 0b 20 0f
19 14 8a 1c 00 26 3d 34 51 47 ae 62 5a 87 21 b9
e3 fd 71 00 00 00 00 00 00 00 00 00 00 00 f5 90

----------------

Block 0, Base EDID:
  EDID Structure Version & Revision: 1.4
  Vendor & Product Identification:
    Manufacturer: APP
    Model: 41024
    Made in: week 16 of 2017
  Basic Display Parameters & Features:
    Digital display
    Bits per primary color channel: 10
    DisplayPort interface
    Maximum image size: 33 cm x 21 cm
    Gamma: 2.20
    Supported color formats: RGB 4:4:4
    First detailed timing includes the native pixel format and preferred refresh rate
  Color Characteristics:
    Red  : 0.6796, 0.3203
    Green: 0.2646, 0.6904
    Blue : 0.1503, 0.0517
    White: 0.3125, 0.3291
  Established Timings I & II: none
  Standard Timings: none
  Detailed Timing Descriptors:
    DTD 1:  2880x1800   60.000876 Hz  16:10   111.122 kHz    328.920000 MHz (331 mm x 207 mm)
                 Hfront    8 Hsync  32 Hback   40 Hpol P
                 Vfront   38 Vsync   8 Vback    6 Vpol N
    Display Product Name: 'Color LCD'
    Dummy Descriptor:
    Dummy Descriptor:
  Extension blocks: 1
Checksum: 0xc4

----------------

Block 1, DisplayID Extension Block:
  Version: 1.2
  Extension Count: 0
  Display Product Type: Standalone display device
  Vendor-Specific Data Block (0x7f) (Apple), OUI 00-10-FA:
    Type: 3, Version: 1
    18 0f 28 17 00 00 00 00 00 00 00 00 00 00 00 00 '..(.............'
    00 00 00 4c 50 31 35 34 57 54 35 2d 53 4a 41 31 '...LP154WT5-SJA1'
    0a 20 00 44 43 4e 38 31 39 32 30 31 52 47 4a 34 '. .DCN819201RGJ4'
    36 52 33 44 0a 20 20 20 20 20                   '6R3D.     '
  Vendor-Specific Data Block (0x7f) (Apple), OUI 00-10-FA:
    Type: 2, Version: 1
    00 11 00 00 02 90 03 65 04 89 06 18 08 38 0b 20 '.......e.....8. '
    0f 19 14 8a 1c 00 26 3d 34 51 47 ae 62 5a 87 21 '......&=4QG.bZ.!'
    b9 e3 fd 71                                     '...q'
  Checksum: 0xf5
Checksum: 0x90

----------------

Block 2, Unknown EDID Extension Block 0x00:
  00 ff ff ff ff ff ff 00 06 10 40 a0 00 00 00 00 '..........@.....'
  10 1b 01 04 b5 21 15 78 02 0f 91 ae 52 43 b0 26 '.....!.x....RC.&'
  0d 50 54 00 00 00 01 01 01 01 01 01 01 01 01 01 '.PT.............'
  01 01 01 01 01 01 7c 80 40 50 b0 08 34 70 08 20 '......|.@P..4p. '
  68 08 4b cf 10 00 00 1a 00 00 00 fc 00 43 6f 6c 'h.K..........Col'
  6f 72 20 4c 43 44 0a 20 20 20 00 00 00 10 00 00 'or LCD.   ......'
  00 00 00 00 00 00 00 00 00 00 00 00 00 00 00 10 '................'
  00 00 00 00 00 00 00 00 00 00 00 00 00 00 01 c4 '................'
Checksum: 0xc4

----------------

Block 3, DisplayID Extension Block:
  Version: 1.2
  Extension Count: 0
  Vendor-Specific Data Block (0x7f) (Apple), OUI 00-10-FA:
    Type: 3, Version: 1
    18 0f 28 17 00 00 00 00 00 00 00 00 00 00 00 00 '..(.............'
    00 00 00 4c 50 31 35 34 57 54 35 2d 53 4a 41 31 '...LP154WT5-SJA1'
    0a 20 00 44 43 4e 38 31 39 32 30 31 52 47 4a 34 '. .DCN819201RGJ4'
    36 52 33 44 0a 20 20 20 20 20                   '6R3D.     '
  Vendor-Specific Data Block (0x7f) (Apple), OUI 00-10-FA:
    Type: 2, Version: 1
    00 11 00 00 02 90 03 65 04 89 06 18 08 38 0b 20 '.......e.....8. '
    0f 19 14 8a 1c 00 26 3d 34 51 47 ae 62 5a 87 21 '......&=4QG.bZ.!'
    b9 e3 fd 71                                     '...q'
  Checksum: 0xf5
Checksum: 0x90

----------------

Warnings:

Block 1, DisplayID Extension Block:
  Vendor-Specific Data Block (0x7f) (Apple), OUI 00-10-FA: Expected PNP ID but found OUI.
  Vendor-Specific Data Block (0x7f) (Apple), OUI 00-10-FA: Expected PNP ID but found OUI.
Block 3, DisplayID Extension Block:
  Vendor-Specific Data Block (0x7f) (Apple), OUI 00-10-FA: Expected PNP ID but found OUI.
  Vendor-Specific Data Block (0x7f) (Apple), OUI 00-10-FA: Expected PNP ID but found OUI.

Failures:

Block 1, DisplayID Extension Block:
  Expected 0 DisplayID Extension Block, but got 1.
  Vendor-Specific Data Block (0x7f) (Apple), OUI 00-10-FA: Endian-ness (le) of OUI is different than expected (be).
  Vendor-Specific Data Block (0x7f) (Apple), OUI 00-10-FA: Endian-ness (le) of OUI is different than expected (be).
Block 2, Base EDID:
  Unknown Extension Block.
Block 3, DisplayID Extension Block:
  Product Type should be 0 in extension block.
  Vendor-Specific Data Block (0x7f) (Apple), OUI 00-10-FA: Endian-ness (le) of OUI is different than expected (be).
  Vendor-Specific Data Block (0x7f) (Apple), OUI 00-10-FA: Endian-ness (le) of OUI is different than expected (be).
EDID:
  Base EDID: EDID specified 1 extension block(s), but found 3 extension block(s).
  DisplayID: Missing DisplayID Display Parameters Data Block.
  DisplayID: Missing DisplayID Type I Detailed Timing Data Block.
  DisplayID: DisplayID expects at least one preferred timing.

EDID conformity: FAIL
