edid-decode (hex):

00 ff ff ff ff ff ff 00 60 a3 31 15 22 00 00 00
2e 21 01 03 68 3c 22 78 28 d7 a5 a2 59 4a 96 24
14 50 54 2d cb 00 71 4f 81 00 81 80 81 40 81 c0
b3 00 a9 c0 95 00 02 3a 80 18 71 38 2d 40 30 20
35 00 56 50 21 00 00 06 00 00 00 10 00 00 00 00
00 00 00 00 00 00 00 00 00 00 25 22 56 aa 51 00
2d 30 30 20 35 00 56 50 21 00 00 06 00 00 00 fc
00 45 53 2d 32 37 58 33 41 4c 0a 20 20 20 00 83

00 ff ff ff ff ff ff 00 60 a3 31 15 22 00 00 00
2e 21 01 03 68 3c 22 78 28 d7 a5 a2 59 4a 96 24
14 50 54 2d cb 00 71 4f 81 00 81 80 81 40 81 c0
b3 00 a9 c0 95 00 02 3a 80 18 71 38 2d 40 30 20
35 00 56 50 21 00 00 06 00 00 00 10 00 00 00 00
00 00 00 00 00 00 00 00 00 00 25 22 56 aa 51 00
2d 30 30 20 35 00 56 50 21 00 00 06 00 00 00 fc
00 45 53 2d 32 37 58 33 41 4c 0a 20 20 20 00 83

----------------

Block 0, Base EDID:
  EDID Structure Version & Revision: 1.3
  Vendor & Product Identification:
    Manufacturer: XEC
    Model: 5425
    Serial Number: ...
    Made in: week 46 of 2023
  Basic Display Parameters & Features:
    Analog display
    Signal Level Standard: 0.700 : 0.000 : 0.700 V p-p
    Blank level equals black level
    Sync: Separate
    Maximum image size: 60 cm x 34 cm
    Gamma: 2.20
    DPMS levels: Off
    RGB color display
  Color Characteristics:
    Red  : 0.6357, 0.3486
    Green: 0.2900, 0.5888
    Blue : 0.1425, 0.0800
    White: 0.3134, 0.3291
  Established Timings I & II:
    DMT 0x04:   640x480    59.940476 Hz   4:3     31.469 kHz     25.175000 MHz
    DMT 0x05:   640x480    72.808802 Hz   4:3     37.861 kHz     31.500000 MHz
    DMT 0x06:   640x480    75.000000 Hz   4:3     37.500 kHz     31.500000 MHz
    DMT 0x09:   800x600    60.316541 Hz   4:3     37.879 kHz     40.000000 MHz
    DMT 0x0a:   800x600    72.187572 Hz   4:3     48.077 kHz     50.000000 MHz
    DMT 0x0b:   800x600    75.000000 Hz   4:3     46.875 kHz     49.500000 MHz
    DMT 0x10:  1024x768    60.003840 Hz   4:3     48.363 kHz     65.000000 MHz
    DMT 0x12:  1024x768    75.028582 Hz   4:3     60.023 kHz     78.750000 MHz
    DMT 0x24:  1280x1024   75.024675 Hz   5:4     79.976 kHz    135.000000 MHz
  Standard Timings:
    DMT 0x15:  1152x864    75.000000 Hz   4:3     67.500 kHz    108.000000 MHz
    DMT 0x1c:  1280x800    59.810326 Hz  16:10    49.702 kHz     83.500000 MHz
    DMT 0x23:  1280x1024   60.019740 Hz   5:4     63.981 kHz    108.000000 MHz
    DMT 0x20:  1280x960    60.000000 Hz   4:3     60.000 kHz    108.000000 MHz
    DMT 0x55:  1280x720    60.000000 Hz  16:9     45.000 kHz     74.250000 MHz
    DMT 0x3a:  1680x1050   59.954250 Hz  16:10    65.290 kHz    146.250000 MHz
    DMT 0x53:  1600x900    60.000000 Hz  16:9     60.000 kHz    108.000000 MHz (RB)
    DMT 0x2f:  1440x900    59.887445 Hz  16:10    55.935 kHz    106.500000 MHz
  Detailed Timing Descriptors:
    DTD 1:  1920x1080   60.000000 Hz  16:9     67.500 kHz    148.500000 MHz (analog composite, serrate, 598 mm x 336 mm)
                 Hfront   48 Hsync  32 Hback  200 Hpol N
                 Vfront    3 Vsync   5 Vback   37 Vpol N
    Dummy Descriptor:
    DTD 2:  1366x768    59.997419 Hz 683:384   48.778 kHz     87.410000 MHz (analog composite, serrate, 598 mm x 336 mm)
                 Hfront   48 Hsync  32 Hback  346 Hpol N
                 Vfront    3 Vsync   5 Vback   37 Vpol N
    Display Product Name: 'ES-27X3AL'
Checksum: 0x83

----------------

Warnings:

Block 0, Base EDID:
  Detailed Timing Descriptor #1: DTD is similar but not identical to VIC 16.

Failures:

Block 0, Base EDID:
  Basic Display Parameters & Features: EDID 1.3 requires that the first detailed timing is the preferred timing.
  Detailed Timing Descriptor #2: Invalid detailed timing descriptor ordering.
  Missing Display Range Limits Descriptor.
EDID:
  Extension Block 1 started with EDID header, ignoring Extension Blocks >= 1.

EDID conformity: FAIL
