edid-decode (hex):

00 ff ff ff ff ff ff 00 4e f2 00 00 00 00 00 00
05 1f 01 03 6d 30 24 78 0a 5e c0 a4 59 4a 98 25
20 50 54 00 00 00 01 01 01 01 01 01 01 01 01 01
01 01 01 01 01 01 44 05 80 dd 20 e0 2a 10 2f 3f
46 00 e5 6c 11 00 00 98 00 00 00 ff 00 53 77 69
74 63 68 72 65 73 32 30 30 0a 00 00 00 fd 00 31
41 0f 0f ff 00 0a 20 20 20 20 20 20 00 00 00 fc
00 63 75 73 74 6f 6d 00 00 00 00 00 00 0a 00 89

----------------

Block 0, Base EDID:
  EDID Structure Version & Revision: 1.3
  Vendor & Product Identification:
    Manufacturer: SWR
    Model: 0
    Made in: week 5 of 2021
  Basic Display Parameters & Features:
    Analog display
    Signal Level Standard: 0.700 : 0.000 : 0.700 V p-p
    Blank level equals black level
    Sync: Separate Composite Serration
    Maximum image size: 48 cm x 36 cm
    Gamma: 2.20
    RGB color display
    First detailed timing is the preferred timing
  Color Characteristics:
    Red  : 0.6416, 0.3486
    Green: 0.2919, 0.5957
    Blue : 0.1474, 0.1250
    White: 0.3125, 0.3281
  Established Timings I & II: none
  Standard Timings: none
  Detailed Timing Descriptors:
    DTD 1:   640x960i   29.964045 Hz   2:3     15.656 kHz     13.480000 MHz (485 mm x 364 mm)
                 Hfront   47 Hsync  63 Hback  111 Hpol N
                 Vfront    4 Vsync   6 Vback   32 Vpol N Vfront +0.5 Odd Field
                 Vfront    4 Vsync   6 Vback   32 Vpol N Vback  +0.5 Even Field
    Display Product Serial Number: ...
    Display Range Limits:
      Monitor ranges (GTF): 49-65 Hz V, 15-15 kHz H, max dotclock 2550 MHz
    Display Product Name: 'custom'
Checksum: 0x89

----------------

Warnings:

Block 0, Base EDID:
  Detailed Timing Descriptor #1: Image size is 485x364 mm, but based on the picture AR it should be 242x364 mm.
EDID:
  Base EDID: Some timings are out of range of the Monitor Ranges:
    Vertical Freq: 29.964 - 29.964 Hz (Monitor: 49.000 - 65.000 Hz)
    Horizontal Freq: 15.656 - 15.656 kHz (Monitor: 15.000 - 15.000 kHz)

Failures:

Block 0, Base EDID:
  Display Product Name: NUL byte at position 6.

EDID conformity: FAIL
