edid-decode (hex):

00 ff ff ff ff ff ff 00 09 e5 eb 09 00 00 00 00
2b 1e 01 04 95 26 16 78 03 e2 35 a1 59 56 98 28
18 50 54 00 00 00 01 01 01 01 01 01 01 01 01 01
01 01 01 01 01 01 31 29 40 fa 60 84 32 30 30 20
36 00 7e d7 10 00 00 1a 76 1b 40 fa 60 84 32 30
30 20 36 00 7e d7 10 00 00 1a 00 00 00 00 00 00
00 00 00 00 00 00 00 00 00 00 00 00 00 00 00 02
00 0d 40 ff 0a 3c 7d 11 15 2a 7d 00 00 00 00 c4

00 ff ff ff ff ff ff 00 09 e5 eb 09 00 00 00 00
2b 1e 01 04 95 26 16 78 03 e2 35 a1 59 56 98 28
18 50 54 00 00 00 01 01 01 01 01 01 01 01 01 01
01 01 01 01 01 01 31 29 40 fa 60 84 32 30 30 20
36 00 7e d7 10 00 00 1a 76 1b 40 fa 60 84 32 30
30 20 36 00 7e d7 10 00 00 1a 00 00 00 00 00 00
00 00 00 00 00 00 00 00 00 00 00 00 00 00 00 02
00 0d 40 ff 0a 3c 7d 11 15 2a 7d 00 00 00 00 c4

----------------

Block 0, Base EDID:
  EDID Structure Version & Revision: 1.4
  Vendor & Product Identification:
    Manufacturer: BOE
    Model: 2539
    Made in: week 43 of 2020
  Basic Display Parameters & Features:
    Digital display
    Bits per primary color channel: 6
    DisplayPort interface
    Maximum image size: 38 cm x 22 cm
    Gamma: 2.20
    Supported color formats: RGB 4:4:4
    First detailed timing includes the native pixel format and preferred refresh rate
    Display supports continuous frequencies
  Color Characteristics:
    Red  : 0.6318, 0.3496
    Green: 0.3359, 0.5957
    Blue : 0.1562, 0.0966
    White: 0.3134, 0.3291
  Established Timings I & II: none
  Standard Timings: none
  Detailed Timing Descriptors:
    DTD 1:  1600x900    60.000000 Hz  16:9     57.000 kHz    105.450000 MHz (382 mm x 215 mm)
                 Hfront   48 Hsync  32 Hback  170 Hpol P
                 Vfront    3 Vsync   6 Vback   41 Vpol N
    DTD 2:  1600x900    40.000000 Hz  16:9     38.000 kHz     70.300000 MHz (382 mm x 215 mm)
                 Hfront   48 Hsync  32 Hback  170 Hpol P
                 Vfront    3 Vsync   6 Vback   41 Vpol N
    Empty Descriptor
    Manufacturer-Specified Display Descriptor (0x02): 00 02 00 0d 40 ff 0a 3c 7d 11 15 2a 7d 00 00 00 '....@..<}..*}...'
Checksum: 0xc4

----------------

Warnings:

Block 0, Base EDID:
  Missing Display Product Name.

Failures:

Block 0, Base EDID:
  Empty Descriptor: Use Dummy Descriptor instead of all zeroes.
  Missing Display Range Limits Descriptor.
EDID:
  Extension Block 1 started with EDID header, ignoring Extension Blocks >= 1.

EDID conformity: FAIL
