edid-decode (hex):

00 ff ff ff ff ff ff 00 05 e3 02 27 26 19 00 00
2f 1e 01 03 80 3c 22 78 2a b3 e5 ac 50 48 a4 26
11 50 54 bf ef 00 d1 c0 81 80 31 68 31 7c 45 68
45 7c 61 68 61 7c 56 5e 00 a0 a0 a0 29 50 30 20
35 00 55 50 21 00 00 1e 40 e7 00 6a a0 a0 67 50
08 20 98 04 55 50 21 00 00 1a 00 00 00 fc 00 51
32 37 47 32 47 34 0a 20 20 20 20 20 00 00 00 fd
00 30 90 1e e6 3c 00 0a 20 20 20 20 20 20 01 32

02 03 30 f1 4c 10 1f 04 04 04 13 03 12 02 11 01
3f 23 09 07 07 83 01 00 00 65 03 0c 00 10 00 67
d8 5d c4 01 78 80 00 68 1a 00 00 01 01 30 90 e6
37 61 00 20 a0 a0 55 50 30 20 35 00 55 50 21 00
00 1e 2d 50 00 a0 a0 a0 46 50 30 20 35 00 55 50
21 00 00 1e 02 3a 80 18 71 38 2d 40 58 2c 45 00
55 50 21 00 00 1e f0 3c 00 d0 51 a0 35 50 60 88
3a 00 55 50 21 00 00 1c 00 00 00 00 00 00 00 a4

00 ff ff ff ff ff ff 00 05 e3 02 27 26 19 00 00
2f 1e 01 03 80 3c 22 78 2a b3 e5 ac 50 48 a4 26
11 50 54 bf ef 00 d1 c0 81 80 31 68 31 7c 45 68
45 7c 61 68 61 7c 56 5e 00 a0 a0 a0 29 50 30 20
35 00 55 50 21 00 00 1e 40 e7 00 6a a0 a0 67 50
08 20 98 04 55 50 21 00 00 1a 00 00 00 fc 00 51
32 37 47 32 47 34 0a 20 20 20 20 20 00 00 00 fd
00 30 90 1e e6 3c 00 0a 20 20 20 20 20 20 01 32

02 03 30 f1 4c 10 1f 04 04 04 13 03 12 02 11 01
3f 23 09 07 07 83 01 00 00 65 03 0c 00 10 00 67
d8 5d c4 01 78 80 00 68 1a 00 00 01 01 30 90 e6
37 61 00 20 a0 a0 55 50 30 20 35 00 55 50 21 00
00 1e 2d 50 00 a0 a0 a0 46 50 30 20 35 00 55 50
21 00 00 1e 02 3a 80 18 71 38 2d 40 58 2c 45 00
55 50 21 00 00 1e f0 3c 00 d0 51 a0 35 50 60 88
3a 00 55 50 21 00 00 1c 00 00 00 00 00 00 00 a4

----------------

Block 0, Base EDID:
  EDID Structure Version & Revision: 1.3
  Vendor & Product Identification:
    Manufacturer: AOC
    Model: 9986
    Serial Number: ...
    Made in: week 47 of 2020
  Basic Display Parameters & Features:
    Digital display
    Maximum image size: 60 cm x 34 cm
    Gamma: 2.20
    DPMS levels: Off
    RGB color display
    First detailed timing is the preferred timing
  Color Characteristics:
    Red  : 0.6738, 0.3154
    Green: 0.2812, 0.6435
    Blue : 0.1513, 0.0683
    White: 0.3134, 0.3291
  Established Timings I & II:
    IBM     :   720x400    70.081663 Hz   9:5     31.467 kHz     28.320000 MHz
    DMT 0x04:   640x480    59.940476 Hz   4:3     31.469 kHz     25.175000 MHz
    Apple   :   640x480    66.666667 Hz   4:3     35.000 kHz     30.240000 MHz
    DMT 0x05:   640x480    72.808802 Hz   4:3     37.861 kHz     31.500000 MHz
    DMT 0x06:   640x480    75.000000 Hz   4:3     37.500 kHz     31.500000 MHz
    DMT 0x08:   800x600    56.250000 Hz   4:3     35.156 kHz     36.000000 MHz
    DMT 0x09:   800x600    60.316541 Hz   4:3     37.879 kHz     40.000000 MHz
    DMT 0x0a:   800x600    72.187572 Hz   4:3     48.077 kHz     50.000000 MHz
    DMT 0x0b:   800x600    75.000000 Hz   4:3     46.875 kHz     49.500000 MHz
    Apple   :   832x624    74.551266 Hz   4:3     49.726 kHz     57.284000 MHz
    DMT 0x10:  1024x768    60.003840 Hz   4:3     48.363 kHz     65.000000 MHz
    DMT 0x11:  1024x768    70.069359 Hz   4:3     56.476 kHz     75.000000 MHz
    DMT 0x12:  1024x768    75.028582 Hz   4:3     60.023 kHz     78.750000 MHz
    DMT 0x24:  1280x1024   75.024675 Hz   5:4     79.976 kHz    135.000000 MHz
  Standard Timings:
    DMT 0x52:  1920x1080   60.000000 Hz  16:9     67.500 kHz    148.500000 MHz
    DMT 0x23:  1280x1024   60.019740 Hz   5:4     63.981 kHz    108.000000 MHz
    GTF     :   640x480    99.999537 Hz   4:3     50.900 kHz     43.163000 MHz
    GTF     :   640x480   119.999084 Hz   4:3     61.800 kHz     52.406000 MHz
    GTF     :   800x600    99.999707 Hz   4:3     63.600 kHz     68.179000 MHz
    GTF     :   800x600   119.999886 Hz   4:3     77.160 kHz     83.950000 MHz
    GTF     :  1024x768   100.000177 Hz   4:3     81.400 kHz    113.309000 MHz
    GTF     :  1024x768   119.999931 Hz   4:3     98.760 kHz    139.054000 MHz
  Detailed Timing Descriptors:
    DTD  1:  2560x1440   59.950550 Hz  16:9     88.787 kHz    241.500000 MHz (597 mm x 336 mm)
                  Hfront   48 Hsync  32 Hback   80 Hpol P
                  Vfront    3 Vsync   5 Vback   33 Vpol P
    DTD  2:  2560x1440  143.911545 Hz  16:9    222.056 kHz    592.000000 MHz (597 mm x 336 mm)
                  Hfront    8 Hsync  32 Hback   66 Hpol P
                  Vfront   25 Vsync   8 Vback   70 Vpol N
    Display Product Name: 'Q27G2G4'
    Display Range Limits:
      Monitor ranges (GTF): 48-144 Hz V, 30-230 kHz H, max dotclock 600 MHz
  Extension blocks: 1
Checksum: 0x32

----------------

Block 1, CTA-861 Extension Block:
  Revision: 3
  Underscans IT Video Formats by default
  Basic audio support
  Supports YCbCr 4:4:4
  Supports YCbCr 4:2:2
  Native detailed modes: 1
  Video Data Block:
    VIC  16:  1920x1080   60.000000 Hz  16:9     67.500 kHz    148.500000 MHz
    VIC  31:  1920x1080   50.000000 Hz  16:9     56.250 kHz    148.500000 MHz
    VIC   4:  1280x720    60.000000 Hz  16:9     45.000 kHz     74.250000 MHz
    VIC   4:  1280x720    60.000000 Hz  16:9     45.000 kHz     74.250000 MHz
    VIC   4:  1280x720    60.000000 Hz  16:9     45.000 kHz     74.250000 MHz
    VIC  19:  1280x720    50.000000 Hz  16:9     37.500 kHz     74.250000 MHz
    VIC   3:   720x480    59.940060 Hz  16:9     31.469 kHz     27.000000 MHz
    VIC  18:   720x576    50.000000 Hz  16:9     31.250 kHz     27.000000 MHz
    VIC   2:   720x480    59.940060 Hz   4:3     31.469 kHz     27.000000 MHz
    VIC  17:   720x576    50.000000 Hz   4:3     31.250 kHz     27.000000 MHz
    VIC   1:   640x480    59.940476 Hz   4:3     31.469 kHz     25.175000 MHz
    VIC  63:  1920x1080  120.000000 Hz  16:9    135.000 kHz    297.000000 MHz
  Audio Data Block:
    Linear PCM:
      Max channels: 2
      Supported sample rates (kHz): 48 44.1 32
      Supported sample sizes (bits): 24 20 16
  Speaker Allocation Data Block:
    FL/FR - Front Left/Right
  Vendor-Specific Data Block (HDMI), OUI 00-0C-03:
    Source physical address: 1.0.0.0
  Vendor-Specific Data Block (HDMI Forum), OUI C4-5D-D8:
    Version: 1
    Maximum TMDS Character Rate: 600 MHz
    SCDC Present
  Vendor-Specific Data Block (AMD), OUI 00-00-1A:
    Version: 1
    Feature Caps: 0x01
    Minimum Refresh Rate: 48 Hz
    Maximum Refresh Rate: 144 Hz
    Flags 1.x: 0xe6 (MCCS)
  Detailed Timing Descriptors:
    DTD  3:  2560x1440   62.960433 Hz  16:9     96.015 kHz    248.870000 MHz (597 mm x 336 mm)
                  Hfront   48 Hsync  32 Hback  -48 Hpol P
                  Vfront    3 Vsync   5 Vback   77 Vpol P
    DTD  4:  2560x1440   49.973218 Hz  16:9     75.460 kHz    205.250000 MHz (597 mm x 336 mm)
                  Hfront   48 Hsync  32 Hback   80 Hpol P
                  Vfront    3 Vsync   5 Vback   62 Vpol P
    DTD  5:  1920x1080   60.000000 Hz  16:9     67.500 kHz    148.500000 MHz (597 mm x 336 mm)
                  Hfront   88 Hsync  44 Hback  148 Hpol P
                  Vfront    4 Vsync   5 Vback   36 Vpol P
    DTD  6:  1280x1440   59.912620 Hz   8:9     89.450 kHz    156.000000 MHz (597 mm x 336 mm)
                  Hfront   96 Hsync 136 Hback  232 Hpol N
                  Vfront    3 Vsync  10 Vback   40 Vpol P
Checksum: 0xa4  Unused space in Extension Block: 7 bytes

----------------

Block 2, Unknown EDID Extension Block 0x00:
  00 ff ff ff ff ff ff 00 05 e3 02 27 26 19 00 00 '...........'&...'
  2f 1e 01 03 80 3c 22 78 2a b3 e5 ac 50 48 a4 26 '/....<"x*...PH.&'
  11 50 54 bf ef 00 d1 c0 81 80 31 68 31 7c 45 68 '.PT.......1h1|Eh'
  45 7c 61 68 61 7c 56 5e 00 a0 a0 a0 29 50 30 20 'E|aha|V^....)P0 '
  35 00 55 50 21 00 00 1e 40 e7 00 6a a0 a0 67 50 '5.UP!...@..j..gP'
  08 20 98 04 55 50 21 00 00 1a 00 00 00 fc 00 51 '. ..UP!........Q'
  32 37 47 32 47 34 0a 20 20 20 20 20 00 00 00 fd '27G2G4.     ....'
  00 30 90 1e e6 3c 00 0a 20 20 20 20 20 20 01 32 '.0...<..      .2'
Checksum: 0x32

----------------

Block 3, CTA-861 Extension Block:
  Revision: 3
  Underscans IT Video Formats by default
  Basic audio support
  Supports YCbCr 4:4:4
  Supports YCbCr 4:2:2
  Native detailed modes: 1
  Video Data Block:
    VIC  16:  1920x1080   60.000000 Hz  16:9     67.500 kHz    148.500000 MHz
    VIC  31:  1920x1080   50.000000 Hz  16:9     56.250 kHz    148.500000 MHz
    VIC   4:  1280x720    60.000000 Hz  16:9     45.000 kHz     74.250000 MHz
    VIC   4:  1280x720    60.000000 Hz  16:9     45.000 kHz     74.250000 MHz
    VIC   4:  1280x720    60.000000 Hz  16:9     45.000 kHz     74.250000 MHz
    VIC  19:  1280x720    50.000000 Hz  16:9     37.500 kHz     74.250000 MHz
    VIC   3:   720x480    59.940060 Hz  16:9     31.469 kHz     27.000000 MHz
    VIC  18:   720x576    50.000000 Hz  16:9     31.250 kHz     27.000000 MHz
    VIC   2:   720x480    59.940060 Hz   4:3     31.469 kHz     27.000000 MHz
    VIC  17:   720x576    50.000000 Hz   4:3     31.250 kHz     27.000000 MHz
    VIC   1:   640x480    59.940476 Hz   4:3     31.469 kHz     25.175000 MHz
    VIC  63:  1920x1080  120.000000 Hz  16:9    135.000 kHz    297.000000 MHz
  Audio Data Block:
    Linear PCM:
      Max channels: 2
      Supported sample rates (kHz): 48 44.1 32
      Supported sample sizes (bits): 24 20 16
  Speaker Allocation Data Block:
    FL/FR - Front Left/Right
  Vendor-Specific Data Block (HDMI), OUI 00-0C-03:
    Source physical address: 1.0.0.0
  Vendor-Specific Data Block (HDMI Forum), OUI C4-5D-D8:
    Version: 1
    Maximum TMDS Character Rate: 600 MHz
    SCDC Present
  Vendor-Specific Data Block (AMD), OUI 00-00-1A:
    Version: 1
    Feature Caps: 0x01
    Minimum Refresh Rate: 48 Hz
    Maximum Refresh Rate: 144 Hz
    Flags 1.x: 0xe6 (MCCS)
  Detailed Timing Descriptors:
    DTD  7:  2560x1440   62.960433 Hz  16:9     96.015 kHz    248.870000 MHz (597 mm x 336 mm)
                  Hfront   48 Hsync  32 Hback  -48 Hpol P
                  Vfront    3 Vsync   5 Vback   77 Vpol P
    DTD  8:  2560x1440   49.973218 Hz  16:9     75.460 kHz    205.250000 MHz (597 mm x 336 mm)
                  Hfront   48 Hsync  32 Hback   80 Hpol P
                  Vfront    3 Vsync   5 Vback   62 Vpol P
    DTD  9:  1920x1080   60.000000 Hz  16:9     67.500 kHz    148.500000 MHz (597 mm x 336 mm)
                  Hfront   88 Hsync  44 Hback  148 Hpol P
                  Vfront    4 Vsync   5 Vback   36 Vpol P
    DTD 10:  1280x1440   59.912620 Hz   8:9     89.450 kHz    156.000000 MHz (597 mm x 336 mm)
                  Hfront   96 Hsync 136 Hback  232 Hpol N
                  Vfront    3 Vsync  10 Vback   40 Vpol P
Checksum: 0xa4  Unused space in Extension Block: 7 bytes

----------------

Warnings:

Block 1, CTA-861 Extension Block:
  Video Data Block: VIC 16 and the first DTD are not identical. Is this intended?
  Detailed Timing Descriptor #6: Image size is 597x336 mm, but based on the picture AR it should be 597x671 mm.
  Add a Colorimetry Data Block with the sRGB colorimetry bit set to avoid interop issues.
Block 3, CTA-861 Extension Block:
  Detailed Timing Descriptor #10: Image size is 597x336 mm, but based on the picture AR it should be 597x671 mm.

Failures:

Block 1, CTA-861 Extension Block:
  Video Data Block: Duplicate VIC 4.
  Detailed Timing Descriptor #3: 0 or negative horizontal back porch.
  Missing VCDB, needed for Set Selectable RGB Quantization to avoid interop issues.
Block 2, Base EDID:
  Unknown Extension Block.
Block 3, CTA-861 Extension Block:
  Video Data Block: Duplicate VIC 16.
  Video Data Block: Duplicate VIC 31.
  Video Data Block: Duplicate VIC 19.
  Video Data Block: Duplicate VIC 3.
  Video Data Block: Duplicate VIC 18.
  Video Data Block: Duplicate VIC 2.
  Video Data Block: Duplicate VIC 17.
  Video Data Block: Duplicate VIC 1.
  Video Data Block: Duplicate VIC 63.
  Speaker Allocation Data Block: Only one instance of this Data Block is allowed.
  Vendor-Specific Data Block (HDMI Forum), OUI C4-5D-D8: Duplicate HDMI Forum VSDB/SCDB.
  Detailed Timing Descriptor #7: 0 or negative horizontal back porch.
EDID:
  Base EDID: EDID specified 1 extension block(s), but found 3 extension block(s).
  Base EDID: EDID 1.3 requires a Block Map Extension in Block 1 if there are more than 2 blocks in the EDID.

EDID conformity: FAIL
