edid-decode (hex):

00 ff ff ff ff ff ff 00 05 e3 02 27 bc d8 01 00
13 1e 01 03 80 3c 22 78 2b 1c b5 a9 50 45 a4 27
0d 50 54 bf ef 00 d1 c0 81 80 31 68 31 7c 45 68
45 7c 61 68 61 7c 02 3a 80 18 71 38 2d 40 58 2c
45 00 56 50 21 00 00 1e fc 7e 80 88 70 38 12 40
18 20 35 00 56 50 21 00 00 1e 00 00 00 fc 00 32
37 47 32 47 34 0a 20 20 20 20 20 20 00 00 00 fd
00 30 90 1e a0 1e 00 0a 20 20 20 20 20 20 01 98

02 03 1f f1 4c 10 1f 04 04 04 04 03 12 02 11 01
3f 23 09 07 07 83 01 00 00 65 03 0c 00 10 00 00
00 00 00 00 00 00 00 00 00 00 00 00 00 00 00 00
00 00 00 00 00 00 00 00 00 00 00 00 00 00 00 00
00 00 00 00 00 00 00 00 00 00 00 00 00 00 00 00
00 00 00 00 00 00 00 00 00 00 00 00 00 00 00 00
00 00 00 00 00 00 00 00 00 00 00 00 00 00 00 00
00 00 00 00 00 00 00 00 00 00 00 00 00 00 00 b6

00 ff ff ff ff ff ff 00 05 e3 02 27 bc d8 01 00
13 1e 01 03 80 3c 22 78 2b 1c b5 a9 50 45 a4 27
0d 50 54 bf ef 00 d1 c0 81 80 31 68 31 7c 45 68
45 7c 61 68 61 7c 02 3a 80 18 71 38 2d 40 58 2c
45 00 56 50 21 00 00 1e fc 7e 80 88 70 38 12 40
18 20 35 00 56 50 21 00 00 1e 00 00 00 fc 00 32
37 47 32 47 34 0a 20 20 20 20 20 20 00 00 00 fd
00 30 90 1e a0 1e 00 0a 20 20 20 20 20 20 01 98

02 03 1f f1 4c 10 1f 04 04 04 04 03 12 02 11 01
3f 23 09 07 07 83 01 00 00 65 03 0c 00 10 00 00
00 00 00 00 00 00 00 00 00 00 00 00 00 00 00 00
00 00 00 00 00 00 00 00 00 00 00 00 00 00 00 00
00 00 00 00 00 00 00 00 00 00 00 00 00 00 00 00
00 00 00 00 00 00 00 00 00 00 00 00 00 00 00 00
00 00 00 00 00 00 00 00 00 00 00 00 00 00 00 00
00 00 00 00 00 00 00 00 00 00 00 00 00 00 00 b6

----------------

Block 0, Base EDID:
  EDID Structure Version & Revision: 1.3
  Vendor & Product Identification:
    Manufacturer: AOC
    Model: 9986
    Serial Number: ...
    Made in: week 19 of 2020
  Basic Display Parameters & Features:
    Digital display
    Maximum image size: 60 cm x 34 cm
    Gamma: 2.20
    DPMS levels: Off
    RGB color display
    First detailed timing is the preferred timing
    Supports GTF timings within operating range
  Color Characteristics:
    Red  : 0.6601, 0.3134
    Green: 0.2724, 0.6406
    Blue : 0.1542, 0.0537
    White: 0.3134, 0.3291
  Established Timings I & II:
    IBM     :   720x400    70.081663 Hz   9:5     31.467 kHz     28.320000 MHz
    DMT 0x04:   640x480    59.940476 Hz   4:3     31.469 kHz     25.175000 MHz
    Apple   :   640x480    66.666667 Hz   4:3     35.000 kHz     30.240000 MHz
    DMT 0x05:   640x480    72.808802 Hz   4:3     37.861 kHz     31.500000 MHz
    DMT 0x06:   640x480    75.000000 Hz   4:3     37.500 kHz     31.500000 MHz
    DMT 0x08:   800x600    56.250000 Hz   4:3     35.156 kHz     36.000000 MHz
    DMT 0x09:   800x600    60.316541 Hz   4:3     37.879 kHz     40.000000 MHz
    DMT 0x0a:   800x600    72.187572 Hz   4:3     48.077 kHz     50.000000 MHz
    DMT 0x0b:   800x600    75.000000 Hz   4:3     46.875 kHz     49.500000 MHz
    Apple   :   832x624    74.551266 Hz   4:3     49.726 kHz     57.284000 MHz
    DMT 0x10:  1024x768    60.003840 Hz   4:3     48.363 kHz     65.000000 MHz
    DMT 0x11:  1024x768    70.069359 Hz   4:3     56.476 kHz     75.000000 MHz
    DMT 0x12:  1024x768    75.028582 Hz   4:3     60.023 kHz     78.750000 MHz
    DMT 0x24:  1280x1024   75.024675 Hz   5:4     79.976 kHz    135.000000 MHz
  Standard Timings:
    DMT 0x52:  1920x1080   60.000000 Hz  16:9     67.500 kHz    148.500000 MHz
    DMT 0x23:  1280x1024   60.019740 Hz   5:4     63.981 kHz    108.000000 MHz
    GTF     :   640x480    99.999537 Hz   4:3     50.900 kHz     43.163000 MHz
    GTF     :   640x480   119.999084 Hz   4:3     61.800 kHz     52.406000 MHz
    GTF     :   800x600    99.999707 Hz   4:3     63.600 kHz     68.179000 MHz
    GTF     :   800x600   119.999886 Hz   4:3     77.160 kHz     83.950000 MHz
    GTF     :  1024x768   100.000177 Hz   4:3     81.400 kHz    113.309000 MHz
    GTF     :  1024x768   119.999931 Hz   4:3     98.760 kHz    139.054000 MHz
  Detailed Timing Descriptors:
    DTD 1:  1920x1080   60.000000 Hz  16:9     67.500 kHz    148.500000 MHz (598 mm x 336 mm)
                 Hfront   88 Hsync  44 Hback  148 Hpol P
                 Vfront    4 Vsync   5 Vback   36 Vpol P
    DTD 2:  1920x1080  144.000765 Hz  16:9    158.113 kHz    325.080000 MHz (598 mm x 336 mm)
                 Hfront   24 Hsync  32 Hback   80 Hpol P
                 Vfront    3 Vsync   5 Vback   10 Vpol P
    Display Product Name: '27G2G4'
    Display Range Limits:
      Monitor ranges (GTF): 48-144 Hz V, 30-160 kHz H, max dotclock 300 MHz
  Extension blocks: 1
Checksum: 0x98

----------------

Block 1, CTA-861 Extension Block:
  Revision: 3
  Underscans IT Video Formats by default
  Basic audio support
  Supports YCbCr 4:4:4
  Supports YCbCr 4:2:2
  Native DTDs: 1
  Video Data Block:
    VIC  16:  1920x1080   60.000000 Hz  16:9     67.500 kHz    148.500000 MHz
    VIC  31:  1920x1080   50.000000 Hz  16:9     56.250 kHz    148.500000 MHz
    VIC   4:  1280x720    60.000000 Hz  16:9     45.000 kHz     74.250000 MHz
    VIC   4:  1280x720    60.000000 Hz  16:9     45.000 kHz     74.250000 MHz
    VIC   4:  1280x720    60.000000 Hz  16:9     45.000 kHz     74.250000 MHz
    VIC   4:  1280x720    60.000000 Hz  16:9     45.000 kHz     74.250000 MHz
    VIC   3:   720x480    59.940060 Hz  16:9     31.469 kHz     27.000000 MHz
    VIC  18:   720x576    50.000000 Hz  16:9     31.250 kHz     27.000000 MHz
    VIC   2:   720x480    59.940060 Hz   4:3     31.469 kHz     27.000000 MHz
    VIC  17:   720x576    50.000000 Hz   4:3     31.250 kHz     27.000000 MHz
    VIC   1:   640x480    59.940476 Hz   4:3     31.469 kHz     25.175000 MHz
    VIC  63:  1920x1080  120.000000 Hz  16:9    135.000 kHz    297.000000 MHz
  Audio Data Block:
    Linear PCM:
      Max channels: 2
      Supported sample rates (kHz): 48 44.1 32
      Supported sample sizes (bits): 24 20 16
  Speaker Allocation Data Block:
    FL/FR - Front Left/Right
  Vendor-Specific Data Block (HDMI), OUI 00-0C-03:
    Source physical address: 1.0.0.0
Checksum: 0xb6  Unused space in Extension Block: 96 bytes

----------------

Warnings:

Block 1, CTA-861 Extension Block:
  Add a Colorimetry Data Block with the sRGB colorimetry bit set to avoid interop issues.
EDID:
  Base EDID: Some timings are out of range of the Monitor Ranges:
    Maximum Clock: 325.080 MHz (Monitor: 300.000 MHz)

Failures:

Block 1, CTA-861 Extension Block:
  Video Data Block: Duplicate VIC 4.
  Missing VCDB, needed for Set Selectable RGB Quantization to avoid interop issues.
EDID:
  Extension Block 2 started with EDID header, ignoring Extension Blocks >= 2.

EDID conformity: FAIL
