edid-decode (hex):

00 ff ff ff ff ff ff 00 30 e4 f8 05 00 00 00 00
06 1c 01 04 a5 25 17 78 02 45 26 a3 54 4d 9b 28
0d 4f 53 00 00 00 01 01 01 01 01 01 01 01 01 01
01 01 01 01 01 01 ec 68 00 a0 a0 40 2e 60 30 20
36 00 6e e5 10 00 00 19 00 00 00 00 00 00 00 00
00 00 00 00 00 00 00 00 00 00 00 00 00 fe 00 4c
47 20 44 69 73 70 6c 61 79 0a 20 20 00 00 00 fe
00 4c 50 31 37 30 57 51 31 2d 53 50 41 31 00 c0

00 ff ff ff ff ff ff 00 30 e4 f8 05 00 00 00 00
06 1c 01 04 a5 25 17 78 02 45 26 a3 54 4d 9b 28
0d 4f 53 00 00 00 01 01 01 01 01 01 01 01 01 01
01 01 01 01 01 01 ec 68 00 a0 a0 40 2e 60 30 20
36 00 6e e5 10 00 00 19 00 00 00 00 00 00 00 00
00 00 00 00 00 00 00 00 00 00 00 00 00 fe 00 4c
47 20 44 69 73 70 6c 61 79 0a 20 20 00 00 00 fe
00 4c 50 31 37 30 57 51 31 2d 53 50 41 31 00 c0

----------------

Block 0, Base EDID:
  EDID Structure Version & Revision: 1.4
  Vendor & Product Identification:
    Manufacturer: LGD
    Model: 1528
    Made in: week 6 of 2018
  Basic Display Parameters & Features:
    Digital display
    Bits per primary color channel: 8
    DisplayPort interface
    Maximum image size: 37 cm x 23 cm
    Gamma: 2.20
    Supported color formats: RGB 4:4:4
    First detailed timing includes the native pixel format and preferred refresh rate
  Color Characteristics:
    Red  : 0.6376, 0.3281
    Green: 0.3017, 0.6064
    Blue : 0.1562, 0.0527
    White: 0.3095, 0.3261
  Established Timings I & II: none
  Standard Timings: none
  Detailed Timing Descriptors:
    DTD 1:  2560x1600   59.993925 Hz  16:10    98.750 kHz    268.600000 MHz (366 mm x 229 mm)
                 Hfront   48 Hsync  32 Hback   80 Hpol N
                 Vfront    3 Vsync   6 Vback   37 Vpol N
    Empty Descriptor
    Alphanumeric Data String: 'LG Display'
    Alphanumeric Data String: 'LP170WQ1-SPA1'
Checksum: 0xc0

----------------

Warnings:

Block 0, Base EDID:
  Missing Display Product Name.

Failures:

Block 0, Base EDID:
  Empty Descriptor: Use Dummy Descriptor instead of all zeroes.
EDID:
  Extension Block 1 started with EDID header, ignoring Extension Blocks >= 1.

EDID conformity: FAIL
