edid-decode (hex):

00 ff ff ff ff ff ff 00 4a 8b 00 19 01 00 00 00
1d 21 01 03 00 2a 18 78 ea c9 05 a3 57 4b 9c 25
12 50 54 2d cf 00 95 00 61 40 01 01 81 80 95 00
01 01 01 01 01 01 9a 29 a0 d0 51 84 22 30 50 98
36 00 a4 ec 10 00 00 1e 7f 21 56 aa 51 00 1e 30
46 8f 33 00 a4 ec 10 00 00 1c 00 00 00 ff 00 30
30 30 30 30 31 0a 20 20 20 20 20 20 00 00 00 fc
00 50 47 0a 20 20 20 20 20 20 20 20 20 20 00 d7

00 ff ff ff ff ff ff 00 4a 8b 00 19 01 00 00 00
1d 21 01 03 00 2a 18 78 ea c9 05 a3 57 4b 9c 25
12 50 54 2d cf 00 95 00 61 40 01 01 81 80 95 00
01 01 01 01 01 01 9a 29 a0 d0 51 84 22 30 50 98
36 00 a4 ec 10 00 00 1e 7f 21 56 aa 51 00 1e 30
46 8f 33 00 a4 ec 10 00 00 1c 00 00 00 ff 00 30
30 30 30 30 31 0a 20 20 20 20 20 20 00 00 00 fc
00 50 47 0a 20 20 20 20 20 20 20 20 20 20 00 d7

----------------

Block 0, Base EDID:
  EDID Structure Version & Revision: 1.3
  Vendor & Product Identification:
    Manufacturer: RTK
    Model: 6400
    Serial Number: ...
    Made in: week 29 of 2023
  Basic Display Parameters & Features:
    Analog display
    Signal Level Standard: 0.700 : 0.300 : 1.000 V p-p
    Blank level equals black level
    Maximum image size: 42 cm x 24 cm
    Gamma: 2.20
    DPMS levels: Standby Suspend Off
    RGB color display
    First detailed timing is the preferred timing
  Color Characteristics:
    Red  : 0.6396, 0.3398
    Green: 0.2949, 0.6103
    Blue : 0.1445, 0.0703
    White: 0.3134, 0.3291
  Established Timings I & II:
    DMT 0x04:   640x480    59.940476 Hz   4:3     31.469 kHz     25.175000 MHz
    DMT 0x05:   640x480    72.808802 Hz   4:3     37.861 kHz     31.500000 MHz
    DMT 0x06:   640x480    75.000000 Hz   4:3     37.500 kHz     31.500000 MHz
    DMT 0x09:   800x600    60.316541 Hz   4:3     37.879 kHz     40.000000 MHz
    DMT 0x0a:   800x600    72.187572 Hz   4:3     48.077 kHz     50.000000 MHz
    DMT 0x0b:   800x600    75.000000 Hz   4:3     46.875 kHz     49.500000 MHz
    DMT 0x10:  1024x768    60.003840 Hz   4:3     48.363 kHz     65.000000 MHz
    DMT 0x11:  1024x768    70.069359 Hz   4:3     56.476 kHz     75.000000 MHz
    DMT 0x12:  1024x768    75.028582 Hz   4:3     60.023 kHz     78.750000 MHz
    DMT 0x24:  1280x1024   75.024675 Hz   5:4     79.976 kHz    135.000000 MHz
  Standard Timings:
    DMT 0x2f:  1440x900    59.887445 Hz  16:10    55.935 kHz    106.500000 MHz
    DMT 0x10:  1024x768    60.003840 Hz   4:3     48.363 kHz     65.000000 MHz
    DMT 0x23:  1280x1024   60.019740 Hz   5:4     63.981 kHz    108.000000 MHz
    DMT 0x2f:  1440x900    59.887445 Hz  16:10    55.935 kHz    106.500000 MHz
  Detailed Timing Descriptors:
    DTD 1:  1440x900    59.887445 Hz  16:10    55.935 kHz    106.500000 MHz (420 mm x 236 mm)
                 Hfront   80 Hsync 152 Hback  232 Hpol P
                 Vfront    3 Vsync   6 Vback   25 Vpol P
    DTD 2:  1366x768    59.964364 Hz 683:384   47.852 kHz     85.750000 MHz (420 mm x 236 mm)
                 Hfront   70 Hsync 143 Hback  213 Hpol N
                 Vfront    3 Vsync   3 Vback   24 Vpol P
    Display Product Serial Number: ...
    Display Product Name: 'PG'
Checksum: 0xd7

----------------

Block 1, Unknown EDID Extension Block 0x00:
  00 ff ff ff ff ff ff 00 4a 8b 00 19 01 00 00 00 '........J.......'
  1d 21 01 03 00 2a 18 78 ea c9 05 a3 57 4b 9c 25 '.!...*.x....WK.%'
  12 50 54 2d cf 00 95 00 61 40 01 01 81 80 95 00 '.PT-....a@......'
  01 01 01 01 01 01 9a 29 a0 d0 51 84 22 30 50 98 '.......)..Q."0P.'
  36 00 a4 ec 10 00 00 1e 7f 21 56 aa 51 00 1e 30 '6........!V.Q..0'
  46 8f 33 00 a4 ec 10 00 00 1c 00 00 00 ff 00 30 'F.3............0'
  30 30 30 30 31 0a 20 20 20 20 20 20 00 00 00 fc '00001.      ....'
  00 50 47 0a 20 20 20 20 20 20 20 20 20 20 00 d7 '.PG.          ..'
Checksum: 0xd7

----------------

Warnings:

Block 0, Base EDID:
  Vendor & Product Identification: The serial number is one of the known dummy values, it should probably be set to 0.
  Detailed Timing Descriptor #1: DTD is similar but not identical to DMT 0x2f.
  Detailed Timing Descriptor #1: Image size is 420x236 mm, but based on the picture AR it should be 420x262 mm.
  Display Product Serial Number: ...

Failures:

Block 0, Base EDID:
  Missing Display Range Limits Descriptor.
Block 1, Base EDID:
  Unknown Extension Block.
EDID:
  Base EDID: EDID specified 0 extension block(s), but found 1 extension block(s).

EDID conformity: FAIL
