edid-decode (hex):

00 ff ff ff ff ff ff 00 63 18 0c 32 00 00 00 00
19 22 01 04 b5 47 28 78 3b 94 25 a2 55 43 a0 26
10 50 54 21 08 00 01 01 b3 00 95 00 81 80 01 01
81 c0 81 40 a9 c0 02 3a 80 18 71 38 2d 40 58 2c
45 00 c4 8e 21 00 00 1e 00 00 00 fd 0e 32 23 5f
5f 48 01 0a 20 20 20 20 20 20 00 00 00 fc 00 47
46 33 32 30 43 0a 20 20 20 20 20 20 00 00 00 ff
00 30 30 30 30 30 30 30 30 30 30 30 30 30 01 d8

02 03 2d f1 44 01 02 03 04 23 09 07 07 83 01 00
00 e3 05 c2 01 e6 06 05 01 59 59 3e 6d 1a 00 00
02 01 3a 3e 00 00 00 00 00 00 e2 00 ca 30 44 80
a0 70 38 27 40 30 20 35 00 c4 8e 21 00 00 1e b8
9c 80 a0 70 38 59 40 30 20 35 00 c4 8e 21 00 00
1e 98 df 80 c8 70 38 2d 40 30 40 35 00 c4 8e 21
00 00 1e 8a 6f 80 a0 70 38 40 40 30 20 35 00 c4
8e 21 00 00 1e 00 00 00 00 00 00 00 00 00 00 b1

00 ff ff ff ff ff ff 00 63 18 0c 32 00 00 00 00
19 22 01 04 b5 47 28 78 3b 94 25 a2 55 43 a0 26
10 50 54 21 08 00 01 01 b3 00 95 00 81 80 01 01
81 c0 81 40 a9 c0 02 3a 80 18 71 38 2d 40 58 2c
45 00 c4 8e 21 00 00 1e 00 00 00 fd 0e 32 23 5f
5f 48 01 0a 20 20 20 20 20 20 00 00 00 fc 00 47
46 33 32 30 43 0a 20 20 20 20 20 20 00 00 00 ff
00 30 30 30 30 30 30 30 30 30 30 30 30 30 01 d8

02 03 2d f1 44 01 02 03 04 23 09 07 07 83 01 00
00 e3 05 c2 01 e6 06 05 01 59 59 3e 6d 1a 00 00
02 01 3a 3e 00 00 00 00 00 00 e2 00 ca 30 44 80
a0 70 38 27 40 30 20 35 00 c4 8e 21 00 00 1e b8
9c 80 a0 70 38 59 40 30 20 35 00 c4 8e 21 00 00
1e 98 df 80 c8 70 38 2d 40 30 40 35 00 c4 8e 21
00 00 1e 8a 6f 80 a0 70 38 40 40 30 20 35 00 c4
8e 21 00 00 1e 00 00 00 00 00 00 00 00 00 00 b1

----------------

Block 0, Base EDID:
  EDID Structure Version & Revision: 1.4
  Vendor & Product Identification:
    Manufacturer: XXX
    Model: 12812
    Made in: week 25 of 2024
  Basic Display Parameters & Features:
    Digital display
    Bits per primary color channel: 10
    DisplayPort interface
    Maximum image size: 71 cm x 40 cm
    Gamma: 2.20
    DPMS levels: Off
    Supported color formats: RGB 4:4:4, YCrCb 4:4:4, YCrCb 4:2:2
    First detailed timing includes the native pixel format and preferred refresh rate
    Display supports continuous frequencies
  Color Characteristics:
    Red  : 0.6347, 0.3330
    Green: 0.2626, 0.6250
    Blue : 0.1484, 0.0644
    White: 0.3134, 0.3291
  Established Timings I & II:
    DMT 0x04:   640x480    59.940476 Hz   4:3     31.469 kHz     25.175000 MHz
    DMT 0x09:   800x600    60.316541 Hz   4:3     37.879 kHz     40.000000 MHz
    DMT 0x10:  1024x768    60.003840 Hz   4:3     48.363 kHz     65.000000 MHz
  Standard Timings:
    DMT 0x3a:  1680x1050   59.954250 Hz  16:10    65.290 kHz    146.250000 MHz
    DMT 0x2f:  1440x900    59.887445 Hz  16:10    55.935 kHz    106.500000 MHz
    DMT 0x23:  1280x1024   60.019740 Hz   5:4     63.981 kHz    108.000000 MHz
    DMT 0x55:  1280x720    60.000000 Hz  16:9     45.000 kHz     74.250000 MHz
    DMT 0x20:  1280x960    60.000000 Hz   4:3     60.000 kHz    108.000000 MHz
    DMT 0x53:  1600x900    60.000000 Hz  16:9     60.000 kHz    108.000000 MHz (RB)
  Detailed Timing Descriptors:
    DTD 1:  1920x1080   60.000000 Hz  16:9     67.500 kHz    148.500000 MHz (708 mm x 398 mm)
                 Hfront   88 Hsync  44 Hback  148 Hpol P
                 Vfront    4 Vsync   5 Vback   36 Vpol P
    Display Range Limits:
      Monitor ranges (Range Limits Only): 50-290 Hz V, 350-350 kHz H, max dotclock 720 MHz
    Display Product Name: 'GF320C'
    Display Product Serial Number: ...
  Extension blocks: 1
Checksum: 0xd8

----------------

Block 1, CTA-861 Extension Block:
  Revision: 3
  Underscans IT Video Formats by default
  Basic audio support
  Supports YCbCr 4:4:4
  Supports YCbCr 4:2:2
  Native DTDs: 1
  Video Data Block:
    VIC   1:   640x480    59.940476 Hz   4:3     31.469 kHz     25.175000 MHz
    VIC   2:   720x480    59.940060 Hz   4:3     31.469 kHz     27.000000 MHz
    VIC   3:   720x480    59.940060 Hz  16:9     31.469 kHz     27.000000 MHz
    VIC   4:  1280x720    60.000000 Hz  16:9     45.000 kHz     74.250000 MHz
  Audio Data Block:
    Linear PCM:
      Max channels: 2
      Supported sample rates (kHz): 48 44.1 32
      Supported sample sizes (bits): 24 20 16
  Speaker Allocation Data Block:
    FL/FR - Front Left/Right
  Colorimetry Data Block:
    xvYCC709
    BT2020YCC
    BT2020RGB
    Gamut Boundary Description Metadata Profile P0
  HDR Static Metadata Data Block:
    Electro optical transfer functions:
      Traditional gamma - SDR luminance range
      SMPTE ST2084
    Supported static metadata descriptors:
      Static metadata type 1
    Desired content max luminance: 89 (343.724 cd/m^2)
    Desired content max frame-average luminance: 89 (343.724 cd/m^2)
    Desired content min luminance: 62 (0.203 cd/m^2)
  Vendor-Specific Data Block (AMD), OUI 00-00-1A:
    Version: 2
    Flags 1: 0x01
      FreeSync Supported
    Minimum Refresh Rate: 58 Hz
    Maximum Refresh Rate: 62 Hz
    Flags 5: 0x00
  Video Capability Data Block:
    YCbCr quantization: Selectable (via AVI YQ)
    RGB quantization: Selectable (via AVI Q)
    PT scan behavior: No Data
    IT scan behavior: Always Underscanned
    CE scan behavior: Always Underscanned
  Detailed Timing Descriptors:
    DTD 2:  1920x1080   74.998281 Hz  16:9     83.923 kHz    174.560000 MHz (708 mm x 398 mm)
                 Hfront   48 Hsync  32 Hback   80 Hpol P
                 Vfront    3 Vsync   5 Vback   31 Vpol P
    DTD 3:  1920x1080  164.999671 Hz  16:9    192.885 kHz    401.200000 MHz (708 mm x 398 mm)
                 Hfront   48 Hsync  32 Hback   80 Hpol P
                 Vfront    3 Vsync   5 Vback   81 Vpol P
    DTD 4:  1920x1080  240.000000 Hz  16:9    270.000 kHz    572.400000 MHz (708 mm x 398 mm)
                 Hfront   48 Hsync  64 Hback   88 Hpol P
                 Vfront    3 Vsync   5 Vback   37 Vpol P
    DTD 5:  1920x1080  119.998991 Hz  16:9    137.279 kHz    285.540000 MHz (708 mm x 398 mm)
                 Hfront   48 Hsync  32 Hback   80 Hpol P
                 Vfront    3 Vsync   5 Vback   56 Vpol P
Checksum: 0xb1  Unused space in Extension Block: 10 bytes

----------------

Warnings:

Block 0, Base EDID:
  Detailed Timing Descriptor #1: DTD is identical to VIC 16, which is not present in the CTA Ext Block.
  Display Product Serial Number: ...
Block 1, CTA-861 Extension Block:
  Video Data Block: VIC 1 and the first DTD are not identical. Is this intended?
  Colorimetry Data Block: Set the sRGB colorimetry bit to avoid interop issues.
EDID:
  Base EDID: Some timings are out of range of the Monitor Ranges:
    Horizontal Freq: 31.468 - 270.000 kHz (Monitor: 350.000 - 350.000 kHz)

Failures:

EDID:
  Extension Block 2 started with EDID header, ignoring Extension Blocks >= 2.

EDID conformity: FAIL
