edid-decode (hex):

00 ff ff ff ff ff ff 00 05 e3 03 22 01 01 01 01
19 22 01 03 80 30 1a 78 2a 9d 15 a7 54 51 9b 25
11 50 54 bf ef 00 d1 c0 b3 00 95 00 81 80 81 c0
01 01 01 01 01 01 02 3a 80 18 71 38 2d 40 58 2c
45 00 df 04 11 00 00 1e 00 00 00 ff 00 31 33 32
32 31 33 31 32 33 31 32 33 33 00 00 00 fc 00 32
32 42 33 35 48 4d 32 33 0a 20 20 20 00 00 00 fd
00 30 78 1e 8c 1d 00 0a 20 20 20 20 20 20 01 14

02 03 22 b1 4c 10 1f 05 14 04 13 03 12 02 11 01
3f 67 03 0c 00 10 00 00 3c 68 1a 00 00 01 01 30
78 e6 8b 6f 80 a0 70 38 40 40 30 20 35 00 df 04
11 00 00 1e 60 59 80 a0 70 38 14 40 30 20 35 00
df 04 11 00 00 1e 31 44 80 a0 70 38 27 40 30 20
35 00 df 04 11 00 00 1a 01 1d 00 72 51 d0 1e 20
6e 28 55 00 df 04 11 00 00 1e 8c 0a d0 8a 20 e0
2d 10 10 3e 96 00 df 04 11 00 00 18 00 00 00 bc

00 ff ff ff ff ff ff 00 05 e3 03 22 01 01 01 01
19 22 01 03 80 30 1a 78 2a 9d 15 a7 54 51 9b 25
11 50 54 bf ef 00 d1 c0 b3 00 95 00 81 80 81 c0
01 01 01 01 01 01 02 3a 80 18 71 38 2d 40 58 2c
45 00 df 04 11 00 00 1e 00 00 00 ff 00 31 33 32
32 31 33 31 32 33 31 32 33 33 00 00 00 fc 00 32
32 42 33 35 48 4d 32 33 0a 20 20 20 00 00 00 fd
00 30 78 1e 8c 1d 00 0a 20 20 20 20 20 20 01 14

02 03 22 b1 4c 10 1f 05 14 04 13 03 12 02 11 01
3f 67 03 0c 00 10 00 00 3c 68 1a 00 00 01 01 30
78 e6 8b 6f 80 a0 70 38 40 40 30 20 35 00 df 04
11 00 00 1e 60 59 80 a0 70 38 14 40 30 20 35 00
df 04 11 00 00 1e 31 44 80 a0 70 38 27 40 30 20
35 00 df 04 11 00 00 1a 01 1d 00 72 51 d0 1e 20
6e 28 55 00 df 04 11 00 00 1e 8c 0a d0 8a 20 e0
2d 10 10 3e 96 00 df 04 11 00 00 18 00 00 00 bc

----------------

Block 0, Base EDID:
  EDID Structure Version & Revision: 1.3
  Vendor & Product Identification:
    Manufacturer: AOC
    Model: 8707
    Serial Number: ...
    Made in: week 25 of 2024
  Basic Display Parameters & Features:
    Digital display
    Maximum image size: 48 cm x 26 cm
    Gamma: 2.20
    DPMS levels: Off
    RGB color display
    First detailed timing is the preferred timing
  Color Characteristics:
    Red  : 0.6542, 0.3291
    Green: 0.3193, 0.6064
    Blue : 0.1445, 0.0673
    White: 0.3134, 0.3291
  Established Timings I & II:
    IBM     :   720x400    70.081663 Hz   9:5     31.467 kHz     28.320000 MHz
    DMT 0x04:   640x480    59.940476 Hz   4:3     31.469 kHz     25.175000 MHz
    Apple   :   640x480    66.666667 Hz   4:3     35.000 kHz     30.240000 MHz
    DMT 0x05:   640x480    72.808802 Hz   4:3     37.861 kHz     31.500000 MHz
    DMT 0x06:   640x480    75.000000 Hz   4:3     37.500 kHz     31.500000 MHz
    DMT 0x08:   800x600    56.250000 Hz   4:3     35.156 kHz     36.000000 MHz
    DMT 0x09:   800x600    60.316541 Hz   4:3     37.879 kHz     40.000000 MHz
    DMT 0x0a:   800x600    72.187572 Hz   4:3     48.077 kHz     50.000000 MHz
    DMT 0x0b:   800x600    75.000000 Hz   4:3     46.875 kHz     49.500000 MHz
    Apple   :   832x624    74.551266 Hz   4:3     49.726 kHz     57.284000 MHz
    DMT 0x10:  1024x768    60.003840 Hz   4:3     48.363 kHz     65.000000 MHz
    DMT 0x11:  1024x768    70.069359 Hz   4:3     56.476 kHz     75.000000 MHz
    DMT 0x12:  1024x768    75.028582 Hz   4:3     60.023 kHz     78.750000 MHz
    DMT 0x24:  1280x1024   75.024675 Hz   5:4     79.976 kHz    135.000000 MHz
  Standard Timings:
    DMT 0x52:  1920x1080   60.000000 Hz  16:9     67.500 kHz    148.500000 MHz
    DMT 0x3a:  1680x1050   59.954250 Hz  16:10    65.290 kHz    146.250000 MHz
    DMT 0x2f:  1440x900    59.887445 Hz  16:10    55.935 kHz    106.500000 MHz
    DMT 0x23:  1280x1024   60.019740 Hz   5:4     63.981 kHz    108.000000 MHz
    DMT 0x55:  1280x720    60.000000 Hz  16:9     45.000 kHz     74.250000 MHz
  Detailed Timing Descriptors:
    DTD 1:  1920x1080   60.000000 Hz  16:9     67.500 kHz    148.500000 MHz (479 mm x 260 mm)
                 Hfront   88 Hsync  44 Hback  148 Hpol P
                 Vfront    4 Vsync   5 Vback   36 Vpol P
    Display Product Serial Number: ...
    Display Product Name: '22B35HM23'
    Display Range Limits:
      Monitor ranges (GTF): 48-120 Hz V, 30-140 kHz H, max dotclock 290 MHz
  Extension blocks: 1
Checksum: 0x14

----------------

Block 1, CTA-861 Extension Block:
  Revision: 3
  Underscans IT Video Formats by default
  Supports YCbCr 4:4:4
  Supports YCbCr 4:2:2
  Native DTDs: 1
  Video Data Block:
    VIC  16:  1920x1080   60.000000 Hz  16:9     67.500 kHz    148.500000 MHz
    VIC  31:  1920x1080   50.000000 Hz  16:9     56.250 kHz    148.500000 MHz
    VIC   5:  1920x1080i  60.000000 Hz  16:9     33.750 kHz     74.250000 MHz
    VIC  20:  1920x1080i  50.000000 Hz  16:9     28.125 kHz     74.250000 MHz
    VIC   4:  1280x720    60.000000 Hz  16:9     45.000 kHz     74.250000 MHz
    VIC  19:  1280x720    50.000000 Hz  16:9     37.500 kHz     74.250000 MHz
    VIC   3:   720x480    59.940060 Hz  16:9     31.469 kHz     27.000000 MHz
    VIC  18:   720x576    50.000000 Hz  16:9     31.250 kHz     27.000000 MHz
    VIC   2:   720x480    59.940060 Hz   4:3     31.469 kHz     27.000000 MHz
    VIC  17:   720x576    50.000000 Hz   4:3     31.250 kHz     27.000000 MHz
    VIC   1:   640x480    59.940476 Hz   4:3     31.469 kHz     25.175000 MHz
    VIC  63:  1920x1080  120.000000 Hz  16:9    135.000 kHz    297.000000 MHz
  Vendor-Specific Data Block (HDMI), OUI 00-0C-03:
    Source physical address: 1.0.0.0
    Maximum TMDS clock: 300 MHz
  Vendor-Specific Data Block (AMD), OUI 00-00-1A:
    Version: 1
    Flags 1: 0x01
      FreeSync Supported
    Minimum Refresh Rate: 48 Hz
    Maximum Refresh Rate: 120 Hz
    MCCS VCP Code: 0xe6
  Detailed Timing Descriptors:
    DTD 2:  1920x1080  120.003194 Hz  16:9    137.284 kHz    285.550000 MHz (479 mm x 260 mm)
                 Hfront   48 Hsync  32 Hback   80 Hpol P
                 Vfront    3 Vsync   5 Vback   56 Vpol P
    DTD 3:  1920x1080  100.000000 Hz  16:9    110.000 kHz    228.800000 MHz (479 mm x 260 mm)
                 Hfront   48 Hsync  32 Hback   80 Hpol P
                 Vfront    3 Vsync   5 Vback   12 Vpol P
    DTD 4:  1920x1080   75.002578 Hz  16:9     83.928 kHz    174.570000 MHz (479 mm x 260 mm)
                 Hfront   48 Hsync  32 Hback   80 Hpol P
                 Vfront    3 Vsync   5 Vback   31 Vpol N
    DTD 5:  1280x720    60.000000 Hz  16:9     45.000 kHz     74.250000 MHz (479 mm x 260 mm)
                 Hfront  110 Hsync  40 Hback  220 Hpol P
                 Vfront    5 Vsync   5 Vback   20 Vpol P
    DTD 6:   720x480    59.940060 Hz   3:2     31.469 kHz     27.000000 MHz (479 mm x 260 mm)
                 Hfront   16 Hsync  62 Hback   60 Hpol N
                 Vfront    9 Vsync   6 Vback   30 Vpol N
Checksum: 0xbc  Unused space in Extension Block: 3 bytes

----------------

Warnings:

Block 0, Base EDID:
  Vendor & Product Identification: The serial number is one of the known dummy values, it should probably be set to 0.
Block 1, CTA-861 Extension Block:
  Detailed Timing Descriptor #6: Image size is 479x260 mm, but based on the picture AR it should be 390x260 mm.
  Display Product Serial Number is set, so the Serial Number in the Base EDID should be 0.
  Add a Colorimetry Data Block with the sRGB colorimetry bit set to avoid interop issues.
EDID:
  Base EDID: Some timings are out of range of the Monitor Ranges:
    Horizontal Freq: 28.125 - 137.283 kHz (Monitor: 30.000 - 140.000 kHz)
    Maximum Clock: 297.000 MHz (Monitor: 290.000 MHz)

Failures:

Block 1, CTA-861 Extension Block:
  Missing VCDB, needed for Set Selectable RGB Quantization to avoid interop issues.
EDID:
  Extension Block 2 started with EDID header, ignoring Extension Blocks >= 2.

EDID conformity: FAIL
