edid-decode (hex):

00 ff ff ff ff ff ff 00 09 d1 04 80 45 54 00 00
21 15 01 03 80 30 1e 78 2e 0b b5 a2 58 54 9e 27
0f 50 54 a5 6b 80 71 00 81 00 81 0f 81 80 a9 c0
b3 00 01 01 01 01 21 39 90 30 62 1a 27 40 68 b0
36 00 de 2c 11 00 00 1c 00 00 00 fd 00 32 4c 1e
53 11 00 0a 20 20 20 20 20 20 00 00 00 fc 00 42
65 6e 51 20 42 4c 32 32 30 31 0a 20 00 00 00 ff
00 47 38 42 30 30 34 38 34 30 31 39 0a 20 00 dc

00 ff ff ff ff ff ff 00 09 d1 04 80 45 54 00 00
21 15 01 03 80 30 1e 78 2e 0b b5 a2 58 54 9e 27
0f 50 54 a5 6b 80 71 00 81 00 81 0f 81 80 a9 c0
b3 00 01 01 01 01 21 39 90 30 62 1a 27 40 68 b0
36 00 de 2c 11 00 00 1c 00 00 00 fd 00 32 4c 1e
53 11 00 0a 20 20 20 20 20 20 00 00 00 fc 00 42
65 6e 51 20 42 4c 32 32 30 31 0a 20 00 00 00 ff
00 47 38 42 30 30 34 38 34 30 31 39 0a 20 00 dc

----------------

Block 0, Base EDID:
  EDID Structure Version & Revision: 1.3
  Vendor & Product Identification:
    Manufacturer: BNQ
    Model: 32772
    Serial Number: ...
    Made in: week 33 of 2011
  Basic Display Parameters & Features:
    Digital display
    Maximum image size: 48 cm x 30 cm
    Gamma: 2.20
    DPMS levels: Off
    RGB color display
    Default (sRGB) color space is primary color space
    First detailed timing is the preferred timing
  Color Characteristics:
    Red  : 0.6328, 0.3437
    Green: 0.3300, 0.6201
    Blue : 0.1542, 0.0615
    White: 0.3134, 0.3291
  Established Timings I & II:
    IBM     :   720x400    70.081663 Hz   9:5     31.467 kHz     28.320000 MHz
    DMT 0x04:   640x480    59.940476 Hz   4:3     31.469 kHz     25.175000 MHz
    DMT 0x06:   640x480    75.000000 Hz   4:3     37.500 kHz     31.500000 MHz
    DMT 0x09:   800x600    60.316541 Hz   4:3     37.879 kHz     40.000000 MHz
    DMT 0x0b:   800x600    75.000000 Hz   4:3     46.875 kHz     49.500000 MHz
    Apple   :   832x624    74.551266 Hz   4:3     49.726 kHz     57.284000 MHz
    DMT 0x10:  1024x768    60.003840 Hz   4:3     48.363 kHz     65.000000 MHz
    DMT 0x12:  1024x768    75.028582 Hz   4:3     60.023 kHz     78.750000 MHz
    DMT 0x24:  1280x1024   75.024675 Hz   5:4     79.976 kHz    135.000000 MHz
    Apple   :  1152x870    75.061550 Hz 192:145   68.681 kHz    100.000000 MHz
  Standard Timings:
    GTF     :  1152x720    59.999964 Hz  16:10    44.760 kHz     67.319000 MHz
    DMT 0x1c:  1280x800    59.810326 Hz  16:10    49.702 kHz     83.500000 MHz
    DMT 0x1d:  1280x800    74.934142 Hz  16:10    62.795 kHz    106.500000 MHz
    DMT 0x23:  1280x1024   60.019740 Hz   5:4     63.981 kHz    108.000000 MHz
    DMT 0x53:  1600x900    60.000000 Hz  16:9     60.000 kHz    108.000000 MHz (RB)
    DMT 0x3a:  1680x1050   59.954250 Hz  16:10    65.290 kHz    146.250000 MHz
  Detailed Timing Descriptors:
    DTD 1:  1680x1050   59.954250 Hz  16:10    65.290 kHz    146.250000 MHz (478 mm x 300 mm)
                 Hfront  104 Hsync 176 Hback  280 Hpol N
                 Vfront    3 Vsync   6 Vback   30 Vpol P
    Display Range Limits:
      Monitor ranges (GTF): 50-76 Hz V, 30-83 kHz H, max dotclock 170 MHz
    Display Product Name: 'BenQ BL2201'
    Display Product Serial Number: ...
Checksum: 0xdc

----------------

Block 1, Unknown EDID Extension Block 0x00:
  00 ff ff ff ff ff ff 00 09 d1 04 80 45 54 00 00 '............ET..'
  21 15 01 03 80 30 1e 78 2e 0b b5 a2 58 54 9e 27 '!....0.x....XT.''
  0f 50 54 a5 6b 80 71 00 81 00 81 0f 81 80 a9 c0 '.PT.k.q.........'
  b3 00 01 01 01 01 21 39 90 30 62 1a 27 40 68 b0 '......!9.0b.'@h.'
  36 00 de 2c 11 00 00 1c 00 00 00 fd 00 32 4c 1e '6..,.........2L.'
  53 11 00 0a 20 20 20 20 20 20 00 00 00 fc 00 42 'S...      .....B'
  65 6e 51 20 42 4c 32 32 30 31 0a 20 00 00 00 ff 'enQ BL2201. ....'
  00 47 38 42 30 30 34 38 34 30 31 39 0a 20 00 dc '.G8B00484019. ..'
Checksum: 0xdc

----------------

Warnings:

Block 0, Base EDID:
  Vendor & Product Identification: The serial number is one of the known dummy values, it should probably be set to 0.

Failures:

Block 0, Base EDID:
  Basic Display Parameters & Features: sRGB is signaled, but the chromaticities do not match.
Block 1, Base EDID:
  Unknown Extension Block.
EDID:
  Base EDID: EDID specified 0 extension block(s), but found 1 extension block(s).

EDID conformity: FAIL
