edid-decode (hex):

00 ff ff ff ff ff ff 00 3b 07 8b 13 01 01 01 01
23 10 01 03 68 22 1b 78 ee 8b c5 a4 5a 48 9b 25
1a 50 54 bf ef 00 81 80 71 4f 01 01 01 01 01 01
01 01 01 01 01 01 30 2a 00 98 51 00 2a 40 30 70
13 00 52 0e 11 00 00 1e 00 00 00 fd 00 38 4c 1e
52 0e 00 0a 20 20 20 20 20 20 00 00 00 ff 00 30
0a 20 20 20 20 20 20 20 20 20 20 20 00 00 00 fc
00 4d 49 52 41 49 20 44 4d 4c 2d 35 31 37 00 cb

00 ff ff ff ff ff ff 00 3b 07 8b 13 01 01 01 01
23 10 01 03 68 22 1b 78 ee 8b c5 a4 5a 48 9b 25
1a 50 54 bf ef 00 81 80 71 4f 01 01 01 01 01 01
01 01 01 01 01 01 30 2a 00 98 51 00 2a 40 30 70
13 00 52 0e 11 00 00 1e 00 00 00 fd 00 38 4c 1e
52 0e 00 0a 20 20 20 20 20 20 00 00 00 ff 00 30
0a 20 20 20 20 20 20 20 20 20 20 20 00 00 00 fc
00 4d 49 52 41 49 20 44 4d 4c 2d 35 31 37 00 cb

----------------

Block 0, Base EDID:
  EDID Structure Version & Revision: 1.3
  Vendor & Product Identification:
    Manufacturer: NXG
    Model: 5003
    Serial Number: ...
    Made in: week 35 of 2006
  Basic Display Parameters & Features:
    Analog display
    Signal Level Standard: 0.700 : 0.000 : 0.700 V p-p
    Blank level equals black level
    Sync: Separate
    Maximum image size: 34 cm x 27 cm
    Gamma: 2.20
    DPMS levels: Standby Suspend Off
    RGB color display
    Default (sRGB) color space is primary color space
    First detailed timing is the preferred timing
  Color Characteristics:
    Red  : 0.6425, 0.3515
    Green: 0.2832, 0.6083
    Blue : 0.1474, 0.1015
    White: 0.3134, 0.3291
  Established Timings I & II:
    IBM     :   720x400    70.081663 Hz   9:5     31.467 kHz     28.320000 MHz
    DMT 0x04:   640x480    59.940476 Hz   4:3     31.469 kHz     25.175000 MHz
    Apple   :   640x480    66.666667 Hz   4:3     35.000 kHz     30.240000 MHz
    DMT 0x05:   640x480    72.808802 Hz   4:3     37.861 kHz     31.500000 MHz
    DMT 0x06:   640x480    75.000000 Hz   4:3     37.500 kHz     31.500000 MHz
    DMT 0x08:   800x600    56.250000 Hz   4:3     35.156 kHz     36.000000 MHz
    DMT 0x09:   800x600    60.316541 Hz   4:3     37.879 kHz     40.000000 MHz
    DMT 0x0a:   800x600    72.187572 Hz   4:3     48.077 kHz     50.000000 MHz
    DMT 0x0b:   800x600    75.000000 Hz   4:3     46.875 kHz     49.500000 MHz
    Apple   :   832x624    74.551266 Hz   4:3     49.726 kHz     57.284000 MHz
    DMT 0x10:  1024x768    60.003840 Hz   4:3     48.363 kHz     65.000000 MHz
    DMT 0x11:  1024x768    70.069359 Hz   4:3     56.476 kHz     75.000000 MHz
    DMT 0x12:  1024x768    75.028582 Hz   4:3     60.023 kHz     78.750000 MHz
    DMT 0x24:  1280x1024   75.024675 Hz   5:4     79.976 kHz    135.000000 MHz
  Standard Timings:
    DMT 0x23:  1280x1024   60.019740 Hz   5:4     63.981 kHz    108.000000 MHz
    DMT 0x15:  1152x864    75.000000 Hz   4:3     67.500 kHz    108.000000 MHz
  Detailed Timing Descriptors:
    DTD 1:  1280x1024   60.019740 Hz   5:4     63.981 kHz    108.000000 MHz (338 mm x 270 mm)
                 Hfront   48 Hsync 112 Hback  248 Hpol P
                 Vfront    1 Vsync   3 Vback   38 Vpol P
    Display Range Limits:
      Monitor ranges (GTF): 56-76 Hz V, 30-82 kHz H, max dotclock 140 MHz
    Display Product Serial Number: ...
    Display Product Name: 'MIRAI DML-517'
Checksum: 0xcb

----------------

Block 1, Unknown EDID Extension Block 0x00:
  00 ff ff ff ff ff ff 00 3b 07 8b 13 01 01 01 01 '........;.......'
  23 10 01 03 68 22 1b 78 ee 8b c5 a4 5a 48 9b 25 '#...h".x....ZH.%'
  1a 50 54 bf ef 00 81 80 71 4f 01 01 01 01 01 01 '.PT.....qO......'
  01 01 01 01 01 01 30 2a 00 98 51 00 2a 40 30 70 '......0*..Q.*@0p'
  13 00 52 0e 11 00 00 1e 00 00 00 fd 00 38 4c 1e '..R..........8L.'
  52 0e 00 0a 20 20 20 20 20 20 00 00 00 ff 00 30 'R...      .....0'
  0a 20 20 20 20 20 20 20 20 20 20 20 00 00 00 fc '.           ....'
  00 4d 49 52 41 49 20 44 4d 4c 2d 35 31 37 00 cb '.MIRAI DML-517..'
Checksum: 0xcb

----------------

Warnings:

Block 0, Base EDID:
  Vendor & Product Identification: The serial number is one of the known dummy values, it should probably be set to 0.
  Display Product Serial Number: ...

Failures:

Block 0, Base EDID:
  Basic Display Parameters & Features: sRGB is signaled, but the chromaticities do not match.
Block 1, Base EDID:
  Unknown Extension Block.
EDID:
  Base EDID: EDID specified 0 extension block(s), but found 1 extension block(s).

EDID conformity: FAIL
