edid-decode (hex):

00 ff ff ff ff ff ff 00 4e 14 ab 09 01 00 00 00
10 21 01 03 b4 35 1d 78 28 ee 91 a3 54 4c 99 26
0f 50 54 21 09 00 31 40 45 40 61 40 81 c0 81 80
95 00 b3 00 45 4f 02 3a 80 18 71 38 2d 40 58 2c
45 00 12 22 21 00 00 1e 00 00 00 fd 00 28 4b 1e
55 14 00 0a 20 20 20 20 20 20 00 00 00 ff 00 30
30 30 30 30 30 30 30 30 30 30 30 31 00 00 00 fc
00 53 63 65 70 74 72 65 20 46 32 34 0a 20 01 e1

02 03 28 f1 47 90 1f 04 13 03 01 05 23 09 07 07
83 01 00 00 67 03 0c 00 10 00 18 28 68 1a 00 00
01 01 28 4b e6 e2 00 d5 50 44 80 a0 70 38 29 40
30 20 35 00 00 00 00 00 00 1e 7f 21 56 aa 51 00
1e 30 46 8f 33 00 00 00 00 00 00 1e d1 26 40 a0
60 84 29 30 30 20 35 00 00 00 00 00 00 1e ac 26
80 18 71 38 2d 40 30 20 35 00 00 00 00 00 00 1e
00 00 00 00 00 00 00 00 00 00 00 00 00 00 00 0d

00 ff ff ff ff ff ff 00 4e 14 ab 09 01 00 00 00
10 21 01 03 b4 35 1d 78 28 ee 91 a3 54 4c 99 26
0f 50 54 21 09 00 31 40 45 40 61 40 81 c0 81 80
95 00 b3 00 45 4f 02 3a 80 18 71 38 2d 40 58 2c
45 00 12 22 21 00 00 1e 00 00 00 fd 00 28 4b 1e
55 14 00 0a 20 20 20 20 20 20 00 00 00 ff 00 30
30 30 30 30 30 30 30 30 30 30 30 31 00 00 00 fc
00 53 63 65 70 74 72 65 20 46 32 34 0a 20 01 e1

02 03 28 f1 47 90 1f 04 13 03 01 05 23 09 07 07
83 01 00 00 67 03 0c 00 10 00 18 28 68 1a 00 00
01 01 28 4b e6 e2 00 d5 50 44 80 a0 70 38 29 40
30 20 35 00 00 00 00 00 00 1e 7f 21 56 aa 51 00
1e 30 46 8f 33 00 00 00 00 00 00 1e d1 26 40 a0
60 84 29 30 30 20 35 00 00 00 00 00 00 1e ac 26
80 18 71 38 2d 40 30 20 35 00 00 00 00 00 00 1e
00 00 00 00 00 00 00 00 00 00 00 00 00 00 00 0d

----------------

Block 0, Base EDID:
  EDID Structure Version & Revision: 1.3
  Vendor & Product Identification:
    Manufacturer: SPT
    Model: 2475
    Serial Number: ...
    Made in: week 16 of 2023
  Basic Display Parameters & Features:
    Digital display
    Maximum image size: 53 cm x 29 cm
    Gamma: 2.20
    DPMS levels: Off
    RGB color display
  Color Characteristics:
    Red  : 0.6396, 0.3300
    Green: 0.2998, 0.5996
    Blue : 0.1503, 0.0595
    White: 0.3125, 0.3291
  Established Timings I & II:
    DMT 0x04:   640x480    59.940476 Hz   4:3     31.469 kHz     25.175000 MHz
    DMT 0x09:   800x600    60.316541 Hz   4:3     37.879 kHz     40.000000 MHz
    DMT 0x10:  1024x768    60.003840 Hz   4:3     48.363 kHz     65.000000 MHz
    DMT 0x24:  1280x1024   75.024675 Hz   5:4     79.976 kHz    135.000000 MHz
  Standard Timings:
    DMT 0x04:   640x480    59.940476 Hz   4:3     31.469 kHz     25.175000 MHz
    DMT 0x09:   800x600    60.316541 Hz   4:3     37.879 kHz     40.000000 MHz
    DMT 0x10:  1024x768    60.003840 Hz   4:3     48.363 kHz     65.000000 MHz
    DMT 0x55:  1280x720    60.000000 Hz  16:9     45.000 kHz     74.250000 MHz
    DMT 0x23:  1280x1024   60.019740 Hz   5:4     63.981 kHz    108.000000 MHz
    DMT 0x2f:  1440x900    59.887445 Hz  16:10    55.935 kHz    106.500000 MHz
    DMT 0x3a:  1680x1050   59.954250 Hz  16:10    65.290 kHz    146.250000 MHz
    DMT 0x0b:   800x600    75.000000 Hz   4:3     46.875 kHz     49.500000 MHz
  Detailed Timing Descriptors:
    DTD 1:  1920x1080   60.000000 Hz  16:9     67.500 kHz    148.500000 MHz (530 mm x 290 mm)
                 Hfront   88 Hsync  44 Hback  148 Hpol P
                 Vfront    4 Vsync   5 Vback   36 Vpol P
    Display Range Limits:
      Monitor ranges (GTF): 40-75 Hz V, 30-85 kHz H, max dotclock 200 MHz
    Display Product Serial Number: ...
    Display Product Name: 'Sceptre F24'
  Extension blocks: 1
Checksum: 0xe1

----------------

Block 1, CTA-861 Extension Block:
  Revision: 3
  Underscans IT Video Formats by default
  Basic audio support
  Supports YCbCr 4:4:4
  Supports YCbCr 4:2:2
  Native DTDs: 1
  Video Data Block:
    VIC  16:  1920x1080   60.000000 Hz  16:9     67.500 kHz    148.500000 MHz (native)
    VIC  31:  1920x1080   50.000000 Hz  16:9     56.250 kHz    148.500000 MHz
    VIC   4:  1280x720    60.000000 Hz  16:9     45.000 kHz     74.250000 MHz
    VIC  19:  1280x720    50.000000 Hz  16:9     37.500 kHz     74.250000 MHz
    VIC   3:   720x480    59.940060 Hz  16:9     31.469 kHz     27.000000 MHz
    VIC   1:   640x480    59.940476 Hz   4:3     31.469 kHz     25.175000 MHz
    VIC   5:  1920x1080i  60.000000 Hz  16:9     33.750 kHz     74.250000 MHz
  Audio Data Block:
    Linear PCM:
      Max channels: 2
      Supported sample rates (kHz): 48 44.1 32
      Supported sample sizes (bits): 24 20 16
  Speaker Allocation Data Block:
    FL/FR - Front Left/Right
  Vendor-Specific Data Block (HDMI), OUI 00-0C-03:
    Source physical address: 1.0.0.0
    DC_30bit
    DC_Y444
    Maximum TMDS clock: 200 MHz
  Vendor-Specific Data Block (AMD), OUI 00-00-1A:
    Version: 1
    Flags 1: 0x01
      FreeSync Supported
    Minimum Refresh Rate: 40 Hz
    Maximum Refresh Rate: 75 Hz
    MCCS VCP Code: 0xe6
  Video Capability Data Block:
    YCbCr quantization: Selectable (via AVI YQ)
    RGB quantization: Selectable (via AVI Q)
    PT scan behavior: Always Overscanned
    IT scan behavior: Always Overscanned
    CE scan behavior: Always Overscanned
  Detailed Timing Descriptors:
    DTD 2:  1920x1080   75.001716 Hz  16:9     84.077 kHz    174.880000 MHz
                 Hfront   48 Hsync  32 Hback   80 Hpol P
                 Vfront    3 Vsync   5 Vback   33 Vpol P
    DTD 3:  1366x768    59.964364 Hz 683:384   47.852 kHz     85.750000 MHz
                 Hfront   70 Hsync 143 Hback  213 Hpol P
                 Vfront    3 Vsync   3 Vback   24 Vpol P
    DTD 4:  1600x900    60.000242 Hz  16:9     56.460 kHz     99.370000 MHz
                 Hfront   48 Hsync  32 Hback   80 Hpol P
                 Vfront    3 Vsync   5 Vback   33 Vpol P
    DTD 5:  1920x1080   40.000000 Hz  16:9     45.000 kHz     99.000000 MHz
                 Hfront   48 Hsync  32 Hback  200 Hpol P
                 Vfront    3 Vsync   5 Vback   37 Vpol P
Checksum: 0x0d  Unused space in Extension Block: 15 bytes

----------------

Warnings:

Block 0, Base EDID:
  Vendor & Product Identification: The serial number is one of the known dummy values, it should probably be set to 0.
  Display Product Serial Number: ...
Block 1, CTA-861 Extension Block:
  Video Capability Data Block: IT scan behavior is expected to support underscanned.
  Video Capability Data Block: S_PT is equal to S_IT and S_CE, so should be set to 0 instead.
  Display Product Serial Number is set, so the Serial Number in the Base EDID should be 0.

Failures:

Block 0, Base EDID:
  Basic Display Parameters & Features: Digital Video Interface Standard set to reserved value 0x34.
  Basic Display Parameters & Features: The chromaticities match sRGB, but sRGB is not signaled.
  Basic Display Parameters & Features: EDID 1.3 requires that the first detailed timing is the preferred timing.
Block 1, CTA-861 Extension Block:
  Video Capability Data Block: IT video formats are always overscanned, but bit 7 of Byte 3 of the CTA-861 Extension header is set to underscanned.
  Detailed Timing Descriptor #2: Mismatch of image size vs display size: image size is not set, but display size is.
  Detailed Timing Descriptor #3: Mismatch of image size vs display size: image size is not set, but display size is.
  Detailed Timing Descriptor #4: Mismatch of image size vs display size: image size is not set, but display size is.
  Detailed Timing Descriptor #5: Mismatch of image size vs display size: image size is not set, but display size is.
EDID:
  Extension Block 2 started with EDID header, ignoring Extension Blocks >= 2.

EDID conformity: FAIL
