edid-decode (hex):

00 ff ff ff ff ff ff 00 4e 14 ab 09 01 01 01 01
29 22 01 03 80 34 1e 78 2a f9 75 a6 55 53 9d 26
0e 50 54 2d cf 00 81 c0 81 00 81 40 81 80 95 00
a9 c0 b3 00 01 01 02 3a 80 18 71 38 2d 40 58 2c
45 00 09 27 21 00 00 1e 00 00 00 fd 00 30 64 1e
7d 17 00 0a 20 20 20 20 20 20 00 00 00 ff 00 0a
20 20 20 20 20 20 20 20 20 20 20 20 00 00 00 fc
00 53 63 65 70 74 72 65 20 46 32 34 0a 20 01 44

02 03 25 f1 46 01 03 02 04 90 05 23 09 07 07 83
01 00 00 e2 00 ca 65 03 0c 00 10 00 68 1a 00 00
01 01 30 64 ed 2a 44 80 a0 70 38 27 40 08 20 98
04 09 27 21 00 00 1a 02 3a 80 d0 72 38 2d 40 10
2c 45 80 09 27 21 00 00 1a a8 57 80 78 70 38 14
40 30 20 35 00 09 27 21 00 00 1e 00 00 00 00 00
00 00 00 00 00 00 00 00 00 00 00 00 00 00 00 00
00 00 00 00 00 00 00 00 00 00 00 00 00 00 00 4b

00 ff ff ff ff ff ff 00 4e 14 ab 09 01 01 01 01
29 22 01 03 80 34 1e 78 2a f9 75 a6 55 53 9d 26
0e 50 54 2d cf 00 81 c0 81 00 81 40 81 80 95 00
a9 c0 b3 00 01 01 02 3a 80 18 71 38 2d 40 58 2c
45 00 09 27 21 00 00 1e 00 00 00 fd 00 30 64 1e
7d 17 00 0a 20 20 20 20 20 20 00 00 00 ff 00 0a
20 20 20 20 20 20 20 20 20 20 20 20 00 00 00 fc
00 53 63 65 70 74 72 65 20 46 32 34 0a 20 01 44

02 03 25 f1 46 01 03 02 04 90 05 23 09 07 07 83
01 00 00 e2 00 ca 65 03 0c 00 10 00 68 1a 00 00
01 01 30 64 ed 2a 44 80 a0 70 38 27 40 08 20 98
04 09 27 21 00 00 1a 02 3a 80 d0 72 38 2d 40 10
2c 45 80 09 27 21 00 00 1a a8 57 80 78 70 38 14
40 30 20 35 00 09 27 21 00 00 1e 00 00 00 00 00
00 00 00 00 00 00 00 00 00 00 00 00 00 00 00 00
00 00 00 00 00 00 00 00 00 00 00 00 00 00 00 4b

----------------

Block 0, Base EDID:
  EDID Structure Version & Revision: 1.3
  Vendor & Product Identification:
    Manufacturer: SPT
    Model: 2475
    Serial Number: ...
    Made in: week 41 of 2024
  Basic Display Parameters & Features:
    Digital display
    Maximum image size: 52 cm x 30 cm
    Gamma: 2.20
    DPMS levels: Off
    RGB color display
    First detailed timing is the preferred timing
  Color Characteristics:
    Red  : 0.6513, 0.3349
    Green: 0.3261, 0.6142
    Blue : 0.1494, 0.0576
    White: 0.3134, 0.3291
  Established Timings I & II:
    DMT 0x04:   640x480    59.940476 Hz   4:3     31.469 kHz     25.175000 MHz
    DMT 0x05:   640x480    72.808802 Hz   4:3     37.861 kHz     31.500000 MHz
    DMT 0x06:   640x480    75.000000 Hz   4:3     37.500 kHz     31.500000 MHz
    DMT 0x09:   800x600    60.316541 Hz   4:3     37.879 kHz     40.000000 MHz
    DMT 0x0a:   800x600    72.187572 Hz   4:3     48.077 kHz     50.000000 MHz
    DMT 0x0b:   800x600    75.000000 Hz   4:3     46.875 kHz     49.500000 MHz
    DMT 0x10:  1024x768    60.003840 Hz   4:3     48.363 kHz     65.000000 MHz
    DMT 0x11:  1024x768    70.069359 Hz   4:3     56.476 kHz     75.000000 MHz
    DMT 0x12:  1024x768    75.028582 Hz   4:3     60.023 kHz     78.750000 MHz
    DMT 0x24:  1280x1024   75.024675 Hz   5:4     79.976 kHz    135.000000 MHz
  Standard Timings:
    DMT 0x55:  1280x720    60.000000 Hz  16:9     45.000 kHz     74.250000 MHz
    DMT 0x1c:  1280x800    59.810326 Hz  16:10    49.702 kHz     83.500000 MHz
    DMT 0x20:  1280x960    60.000000 Hz   4:3     60.000 kHz    108.000000 MHz
    DMT 0x23:  1280x1024   60.019740 Hz   5:4     63.981 kHz    108.000000 MHz
    DMT 0x2f:  1440x900    59.887445 Hz  16:10    55.935 kHz    106.500000 MHz
    DMT 0x53:  1600x900    60.000000 Hz  16:9     60.000 kHz    108.000000 MHz (RB)
    DMT 0x3a:  1680x1050   59.954250 Hz  16:10    65.290 kHz    146.250000 MHz
  Detailed Timing Descriptors:
    DTD 1:  1920x1080   60.000000 Hz  16:9     67.500 kHz    148.500000 MHz (521 mm x 295 mm)
                 Hfront   88 Hsync  44 Hback  148 Hpol P
                 Vfront    4 Vsync   5 Vback   36 Vpol P
    Display Range Limits:
      Monitor ranges (GTF): 48-100 Hz V, 30-125 kHz H, max dotclock 230 MHz
    Display Product Serial Number: ...
    Display Product Name: 'Sceptre F24'
  Extension blocks: 1
Checksum: 0x44

----------------

Block 1, CTA-861 Extension Block:
  Revision: 3
  Underscans IT Video Formats by default
  Basic audio support
  Supports YCbCr 4:4:4
  Supports YCbCr 4:2:2
  Native DTDs: 1
  Video Data Block:
    VIC   1:   640x480    59.940476 Hz   4:3     31.469 kHz     25.175000 MHz
    VIC   3:   720x480    59.940060 Hz  16:9     31.469 kHz     27.000000 MHz
    VIC   2:   720x480    59.940060 Hz   4:3     31.469 kHz     27.000000 MHz
    VIC   4:  1280x720    60.000000 Hz  16:9     45.000 kHz     74.250000 MHz
    VIC  16:  1920x1080   60.000000 Hz  16:9     67.500 kHz    148.500000 MHz (native)
    VIC   5:  1920x1080i  60.000000 Hz  16:9     33.750 kHz     74.250000 MHz
  Audio Data Block:
    Linear PCM:
      Max channels: 2
      Supported sample rates (kHz): 48 44.1 32
      Supported sample sizes (bits): 24 20 16
  Speaker Allocation Data Block:
    FL/FR - Front Left/Right
  Video Capability Data Block:
    YCbCr quantization: Selectable (via AVI YQ)
    RGB quantization: Selectable (via AVI Q)
    PT scan behavior: No Data
    IT scan behavior: Always Underscanned
    CE scan behavior: Always Underscanned
  Vendor-Specific Data Block (HDMI), OUI 00-0C-03:
    Source physical address: 1.0.0.0
  Vendor-Specific Data Block (AMD), OUI 00-00-1A:
    Version: 1
    Feature Caps: 0x01
    Minimum Refresh Rate: 48 Hz
    Maximum Refresh Rate: 100 Hz
    Flags 1.x: 0xed (MCCS)
  Detailed Timing Descriptors:
    DTD 2:  1920x1080   74.972503 Hz  16:9     83.894 kHz    174.500000 MHz (521 mm x 295 mm)
                 Hfront    8 Hsync  32 Hback  120 Hpol P
                 Vfront   25 Vsync   8 Vback    6 Vpol N
    DTD 3:  1920x1080   50.000000 Hz  16:9     56.250 kHz    148.500000 MHz (521 mm x 295 mm)
                 Hfront  528 Hsync  44 Hback  148 Hpol P
                 Vfront    4 Vsync   5 Vback   36 Vpol N
    DTD 4:  1920x1080  100.000000 Hz  16:9    110.000 kHz    224.400000 MHz (521 mm x 295 mm)
                 Hfront   48 Hsync  32 Hback   40 Hpol P
                 Vfront    3 Vsync   5 Vback   12 Vpol P
Checksum: 0x4b  Unused space in Extension Block: 36 bytes

----------------

Warnings:

Block 0, Base EDID:
  Vendor & Product Identification: The serial number is one of the known dummy values, it should probably be set to 0.
Block 1, CTA-861 Extension Block:
  Video Data Block: VIC 1 and the first DTD are not identical. Is this intended?
  Detailed Timing Descriptor #3: DTD is similar but not identical to VIC 31.
  Display Product Serial Number is set, so the Serial Number in the Base EDID should be 0.
  Add a Colorimetry Data Block with the sRGB colorimetry bit set to avoid interop issues.

Failures:

Block 0, Base EDID:
  Display Product Serial Number: ...
EDID:
  Extension Block 2 started with EDID header, ignoring Extension Blocks >= 2.

EDID conformity: FAIL
