edid-decode (hex):

00 ff ff ff ff ff ff 00 0d af 01 16 00 00 00 00
05 15 01 03 80 25 13 78 0a cf 45 90 59 57 95 29
1f 50 54 00 00 00 01 01 01 01 01 01 01 01 01 01
01 01 01 01 01 01 77 3a 80 18 71 38 37 40 54 38
59 00 76 c0 10 00 00 18 00 00 00 fe 00 4e 31 36
34 48 47 45 2d 4c 31 32 0a 20 00 00 00 fe 00 43
4d 4f 0a 20 20 20 20 20 20 20 20 20 00 00 00 fe
00 4e 31 36 34 48 47 45 2d 4c 31 32 0a 20 00 c1

----------------

Block 0, Base EDID:
  EDID Structure Version & Revision: 1.3
  Vendor & Product Identification:
    Manufacturer: CMO
    Model: 5633
    Made in: week 5 of 2011
  Basic Display Parameters & Features:
    Digital display
    Maximum image size: 37 cm x 19 cm
    Gamma: 2.20
    RGB color display
    First detailed timing is the preferred timing
  Color Characteristics:
    Red  : 0.5654, 0.3476
    Green: 0.3427, 0.5849
    Blue : 0.1611, 0.1210
    White: 0.3134, 0.3291
  Established Timings I & II: none
  Standard Timings: none
  Detailed Timing Descriptors:
    DTD 1:  1920x1080   59.939928 Hz  16:9     68.032 kHz    149.670000 MHz (374 mm x 192 mm)
                 Hfront   84 Hsync  56 Hback  140 Hpol N
                 Vfront    5 Vsync   9 Vback   41 Vpol N
    Alphanumeric Data String: 'N164HGE-L12'
    Alphanumeric Data String: 'CMO'
    Alphanumeric Data String: 'N164HGE-L12'
Checksum: 0xc1

----------------

Warnings:

Block 0, Base EDID:
  Detailed Timing Descriptor #1: Image size is 374x192 mm, but based on the picture AR it should be 374x210 mm.

Failures:

Block 0, Base EDID:
  Missing Display Product Name.
  Missing Display Range Limits Descriptor.

EDID conformity: FAIL
