edid-decode (hex):

00 ff ff ff ff ff ff 00 4e 84 23 20 00 00 00 00
17 21 01 03 08 3c 21 78 0a d7 a5 a2 59 4a 96 24
14 50 54 ad ca 00 01 01 01 01 81 80 81 40 01 01
01 01 01 01 01 01 02 3a 80 18 71 38 2d 40 58 2c
45 00 57 50 21 00 00 1e 80 45 80 c8 70 38 27 40
30 2c 45 00 57 50 21 00 00 1a 3b 2e 40 00 62 84
22 30 58 a8 35 00 10 09 00 00 00 1c 00 00 00 fc
00 4d 6f 6e 69 74 6f 72 0a 20 20 20 20 20 00 45

00 ff ff ff ff ff ff 00 4e 84 23 20 00 00 00 00
17 21 01 03 08 3c 21 78 0a d7 a5 a2 59 4a 96 24
14 50 54 ad ca 00 01 01 01 01 81 80 81 40 01 01
01 01 01 01 01 01 02 3a 80 18 71 38 2d 40 58 2c
45 00 57 50 21 00 00 1e 80 45 80 c8 70 38 27 40
30 2c 45 00 57 50 21 00 00 1a 3b 2e 40 00 62 84
22 30 58 a8 35 00 10 09 00 00 00 1c 00 00 00 fc
00 4d 6f 6e 69 74 6f 72 0a 20 20 20 20 20 00 45

----------------

Block 0, Base EDID:
  EDID Structure Version & Revision: 1.3
  Vendor & Product Identification:
    Manufacturer: STD
    Model: 8227
    Made in: week 23 of 2023
  Basic Display Parameters & Features:
    Analog display
    Signal Level Standard: 0.700 : 0.300 : 1.000 V p-p
    Blank level equals black level
    Sync: Separate
    Maximum image size: 60 cm x 33 cm
    Gamma: 2.20
    RGB color display
    First detailed timing is the preferred timing
  Color Characteristics:
    Red  : 0.6357, 0.3486
    Green: 0.2900, 0.5888
    Blue : 0.1425, 0.0800
    White: 0.3134, 0.3291
  Established Timings I & II:
    IBM     :   720x400    70.081663 Hz   9:5     31.467 kHz     28.320000 MHz
    DMT 0x04:   640x480    59.940476 Hz   4:3     31.469 kHz     25.175000 MHz
    DMT 0x05:   640x480    72.808802 Hz   4:3     37.861 kHz     31.500000 MHz
    DMT 0x06:   640x480    75.000000 Hz   4:3     37.500 kHz     31.500000 MHz
    DMT 0x09:   800x600    60.316541 Hz   4:3     37.879 kHz     40.000000 MHz
    DMT 0x0a:   800x600    72.187572 Hz   4:3     48.077 kHz     50.000000 MHz
    DMT 0x0b:   800x600    75.000000 Hz   4:3     46.875 kHz     49.500000 MHz
    DMT 0x10:  1024x768    60.003840 Hz   4:3     48.363 kHz     65.000000 MHz
    DMT 0x12:  1024x768    75.028582 Hz   4:3     60.023 kHz     78.750000 MHz
  Standard Timings:
    DMT 0x23:  1280x1024   60.019740 Hz   5:4     63.981 kHz    108.000000 MHz
    DMT 0x20:  1280x960    60.000000 Hz   4:3     60.000 kHz    108.000000 MHz
  Detailed Timing Descriptors:
    DTD 1:  1920x1080   60.000000 Hz  16:9     67.500 kHz    148.500000 MHz (599 mm x 336 mm)
                 Hfront   88 Hsync  44 Hback  148 Hpol P
                 Vfront    4 Vsync   5 Vback   36 Vpol P
    DTD 2:  1920x1080   74.999578 Hz  16:9     83.925 kHz    177.920000 MHz (599 mm x 336 mm)
                 Hfront   48 Hsync  44 Hback  108 Hpol P
                 Vfront    4 Vsync   5 Vback   30 Vpol N
    DTD 3:  1600x900    59.996715 Hz  16:9     56.037 kHz    118.350000 MHz (16 mm x 9 mm)
                 Hfront   88 Hsync 168 Hback  256 Hpol N
                 Vfront    3 Vsync   5 Vback   26 Vpol P
    Display Product Name: 'Monitor'
Checksum: 0x45

----------------

Warnings:

Block 0, Base EDID:
  Detailed Timing Descriptor #3: Dubious image size (16x9 mm is smaller than 100x100 mm).

Failures:

Block 0, Base EDID:
  Detailed Timing Descriptor #3: Mismatch of image size 16x9 mm vs display size 600x330 mm.
  Missing Display Range Limits Descriptor.
EDID:
  Extension Block 1 started with EDID header, ignoring Extension Blocks >= 1.

EDID conformity: FAIL
