edid-decode (hex):

00 ff ff ff ff ff ff 00 22 0e 27 40 01 00 00 00
08 1e 01 04 b5 3c 22 78 22 0c 95 ab 55 4c a0 24
0d 50 54 21 08 00 b3 00 d1 00 71 4f a9 40 81 80
77 80 01 01 01 01 56 5e 00 a0 a0 a0 29 50 30 20
35 00 55 50 21 00 00 1a 00 00 00 fd 00 38 4b 1e
71 1e 01 0a 20 20 20 20 20 20 00 00 00 fc 00 48
50 20 41 6c 6c 2d 69 6e 2d 4f 6e 65 00 00 00 ff
00 4d 32 37 30 44 41 4e 30 32 2e 38 0a 20 00 ae

00 ff ff ff ff ff ff 00 22 0e 27 40 01 00 00 00
08 1e 01 04 b5 3c 22 78 22 0c 95 ab 55 4c a0 24
0d 50 54 21 08 00 b3 00 d1 00 71 4f a9 40 81 80
77 80 01 01 01 01 56 5e 00 a0 a0 a0 29 50 30 20
35 00 55 50 21 00 00 1a 00 00 00 fd 00 38 4b 1e
71 1e 01 0a 20 20 20 20 20 20 00 00 00 fc 00 48
50 20 41 6c 6c 2d 69 6e 2d 4f 6e 65 00 00 00 ff
00 4d 32 37 30 44 41 4e 30 32 2e 38 0a 20 00 ae

----------------

Block 0, Base EDID:
  EDID Structure Version & Revision: 1.4
  Vendor & Product Identification:
    Manufacturer: HPN
    Model: 16423
    Serial Number: ...
    Made in: week 8 of 2020
  Basic Display Parameters & Features:
    Digital display
    Bits per primary color channel: 10
    DisplayPort interface
    Maximum image size: 60 cm x 34 cm
    Gamma: 2.20
    DPMS levels: Off
    Supported color formats: RGB 4:4:4
    First detailed timing includes the native pixel format and preferred refresh rate
  Color Characteristics:
    Red  : 0.6679, 0.3320
    Green: 0.2998, 0.6250
    Blue : 0.1425, 0.0517
    White: 0.3134, 0.3291
  Established Timings I & II:
    DMT 0x04:   640x480    59.940476 Hz   4:3     31.469 kHz     25.175000 MHz
    DMT 0x09:   800x600    60.316541 Hz   4:3     37.879 kHz     40.000000 MHz
    DMT 0x10:  1024x768    60.003840 Hz   4:3     48.363 kHz     65.000000 MHz
  Standard Timings:
    DMT 0x3a:  1680x1050   59.954250 Hz  16:10    65.290 kHz    146.250000 MHz
    DMT 0x45:  1920x1200   59.884600 Hz  16:10    74.556 kHz    193.250000 MHz
    DMT 0x15:  1152x864    75.000000 Hz   4:3     67.500 kHz    108.000000 MHz
    DMT 0x33:  1600x1200   60.000000 Hz   4:3     75.000 kHz    162.000000 MHz
    DMT 0x23:  1280x1024   60.019740 Hz   5:4     63.981 kHz    108.000000 MHz
    GTF     :  1200x960    60.000000 Hz   5:4     59.640 kHz     95.424000 MHz
  Detailed Timing Descriptors:
    DTD 1:  2560x1440   59.950550 Hz  16:9     88.787 kHz    241.500000 MHz (597 mm x 336 mm)
                 Hfront   48 Hsync  32 Hback   80 Hpol P
                 Vfront    3 Vsync   5 Vback   33 Vpol N
    Display Range Limits:
      Monitor ranges (Range Limits Only): 56-75 Hz V, 30-113 kHz H, max dotclock 300 MHz
    Display Product Name: 'HP All-in-One'
    Display Product Serial Number: ...
Checksum: 0xae

----------------

Warnings:

Block 0, Base EDID:
  Vendor & Product Identification: The serial number is one of the known dummy values, it should probably be set to 0.

Failures:

EDID:
  Extension Block 1 started with EDID header, ignoring Extension Blocks >= 1.

EDID conformity: FAIL
