edid-decode (hex):

00 ff ff ff ff ff ff 00 10 ac 03 40 39 32 33 41
2f 0e 01 03 80 39 22 78 2e 3e 3d a6 54 46 98 24
11 47 4a a5 4a 00 61 40 81 80 01 01 01 01 01 01
01 01 01 01 01 01 0e 1f 00 80 51 00 1e 30 40 80
37 00 36 54 21 00 00 1a 8c 0a d0 8a 20 e0 2d 10
10 3e 96 00 13 8e 21 00 00 18 00 00 00 fc 00 57
32 36 30 30 20 4c 43 44 20 54 56 0a 00 00 00 fd
00 38 4b 1f 40 0b 04 90 00 00 00 00 00 00 01 5c

02 03 10 76 47 85 04 02 03 06 11 15 83 01 00 00
01 1d 80 18 71 1c 16 20 58 2c 25 00 c4 8e 21 00
00 9e 01 1d 00 72 51 d0 1e 20 6e 28 55 00 c4 8e
21 00 00 1e 8c 0a d0 8a 20 e0 2d 10 10 3e 96 00
c4 8e 21 00 00 18 8c 0a a0 14 51 f0 16 00 26 7c
43 00 c4 8e 21 00 00 98 8c 0a d0 90 20 40 31 20
0c 40 55 00 c4 8e 21 00 00 18 8c 0a a0 20 51 20
18 10 18 7e 23 00 c4 8e 21 00 00 98 00 00 00 9f

00 ff ff ff ff ff ff 00 10 ac 03 40 39 32 33 41
2f 0e 01 03 80 39 22 78 2e 3e 3d a6 54 46 98 24
11 47 4a a5 4a 00 61 40 81 80 01 01 01 01 01 01
01 01 01 01 01 01 0e 1f 00 80 51 00 1e 30 40 80
37 00 36 54 21 00 00 1a 8c 0a d0 8a 20 e0 2d 10
10 3e 96 00 13 8e 21 00 00 18 00 00 00 fc 00 57
32 36 30 30 20 4c 43 44 20 54 56 0a 00 00 00 fd
00 38 4b 1f 40 0b 04 90 00 00 00 00 00 00 01 5c

02 03 10 76 47 85 04 02 03 06 11 15 83 01 00 00
01 1d 80 18 71 1c 16 20 58 2c 25 00 c4 8e 21 00
00 9e 01 1d 00 72 51 d0 1e 20 6e 28 55 00 c4 8e
21 00 00 1e 8c 0a d0 8a 20 e0 2d 10 10 3e 96 00
c4 8e 21 00 00 18 8c 0a a0 14 51 f0 16 00 26 7c
43 00 c4 8e 21 00 00 98 8c 0a d0 90 20 40 31 20
0c 40 55 00 c4 8e 21 00 00 18 8c 0a a0 20 51 20
18 10 18 7e 23 00 c4 8e 21 00 00 98 00 00 00 9f

----------------

Block 0, Base EDID:
  EDID Structure Version & Revision: 1.3
  Vendor & Product Identification:
    Manufacturer: DEL
    Model: 16387
    Serial Number: ...
    Made in: week 47 of 2004
  Basic Display Parameters & Features:
    Digital display
    Maximum image size: 57 cm x 34 cm
    Gamma: 2.20
    DPMS levels: Off
    RGB color display
    Default (sRGB) color space is primary color space
    First detailed timing is the preferred timing
  Color Characteristics:
    Red  : 0.6484, 0.3310
    Green: 0.2763, 0.5957
    Blue : 0.1406, 0.0693
    White: 0.2802, 0.2900
  Established Timings I & II:
    IBM     :   720x400    70.081663 Hz   9:5     31.467 kHz     28.320000 MHz
    DMT 0x04:   640x480    59.940476 Hz   4:3     31.469 kHz     25.175000 MHz
    DMT 0x06:   640x480    75.000000 Hz   4:3     37.500 kHz     31.500000 MHz
    DMT 0x09:   800x600    60.316541 Hz   4:3     37.879 kHz     40.000000 MHz
    DMT 0x0b:   800x600    75.000000 Hz   4:3     46.875 kHz     49.500000 MHz
    DMT 0x10:  1024x768    60.003840 Hz   4:3     48.363 kHz     65.000000 MHz
    DMT 0x12:  1024x768    75.028582 Hz   4:3     60.023 kHz     78.750000 MHz
  Standard Timings:
    DMT 0x10:  1024x768    60.003840 Hz   4:3     48.363 kHz     65.000000 MHz
    DMT 0x23:  1280x1024   60.019740 Hz   5:4     63.981 kHz    108.000000 MHz
  Detailed Timing Descriptors:
    DTD  1:  1280x768    59.870228 Hz   5:3     47.776 kHz     79.500000 MHz (566 mm x 340 mm)
                  Hfront   64 Hsync 128 Hback  192 Hpol P
                  Vfront    3 Vsync   7 Vback   20 Vpol N
    DTD  2:   720x480    59.940060 Hz   3:2     31.469 kHz     27.000000 MHz (531 mm x 398 mm)
                  Hfront   16 Hsync  62 Hback   60 Hpol N
                  Vfront    9 Vsync   6 Vback   30 Vpol N
    Display Product Name: 'W2600 LCD TV'
    Display Range Limits:
      Monitor ranges (CVT): 56-75 Hz V, 31-64 kHz H, max dotclock 110 MHz
      CVT version 9.0
      Supported aspect ratios:
      Preferred aspect ratio: 4:3
  Extension blocks: 1
Checksum: 0x5c

----------------

Block 1, CTA-861 Extension Block:
  Revision: 3
  Basic audio support
  Supports YCbCr 4:4:4
  Supports YCbCr 4:2:2
  Native detailed modes: 6
  Video Data Block:
    VIC   5:  1920x1080i  60.000000 Hz  16:9     33.750 kHz     74.250000 MHz (native)
    VIC   4:  1280x720    60.000000 Hz  16:9     45.000 kHz     74.250000 MHz
    VIC   2:   720x480    59.940060 Hz   4:3     31.469 kHz     27.000000 MHz
    VIC   3:   720x480    59.940060 Hz  16:9     31.469 kHz     27.000000 MHz
    VIC   6:  1440x480i   59.940060 Hz   4:3     15.734 kHz     27.000000 MHz
    VIC  17:   720x576    50.000000 Hz   4:3     31.250 kHz     27.000000 MHz
    VIC  21:  1440x576i   50.000000 Hz   4:3     15.625 kHz     27.000000 MHz
  Speaker Allocation Data Block:
    FL/FR - Front Left/Right
  Detailed Timing Descriptors:
    DTD  3:  1920x1080i  60.000000 Hz  16:9     33.750 kHz     74.250000 MHz (708 mm x 398 mm)
                  Hfront   88 Hsync  44 Hback  148 Hpol P
                  Vfront    2 Vsync   5 Vback   15 Vpol P Vfront +0.5 Odd Field
                  Vfront    2 Vsync   5 Vback   15 Vpol P Vback  +0.5 Even Field
    DTD  4:  1280x720    60.000000 Hz  16:9     45.000 kHz     74.250000 MHz (708 mm x 398 mm)
                  Hfront  110 Hsync  40 Hback  220 Hpol P
                  Vfront    5 Vsync   5 Vback   20 Vpol P
    DTD  5:   720x480    59.940060 Hz   3:2     31.469 kHz     27.000000 MHz (708 mm x 398 mm)
                  Hfront   16 Hsync  62 Hback   60 Hpol N
                  Vfront    9 Vsync   6 Vback   30 Vpol N
    DTD  6:  1440x480i   59.940060 Hz   3:1     15.734 kHz     27.000000 MHz (708 mm x 398 mm)
                  Hfront   38 Hsync 124 Hback  114 Hpol N
                  Vfront    4 Vsync   3 Vback   15 Vpol N Vfront +0.5 Odd Field
                  Vfront    4 Vsync   3 Vback   15 Vpol N Vback  +0.5 Even Field
    DTD  7:   720x576    50.000000 Hz   5:4     31.250 kHz     27.000000 MHz (708 mm x 398 mm)
                  Hfront   12 Hsync  64 Hback   68 Hpol N
                  Vfront    5 Vsync   5 Vback   39 Vpol N
    DTD  8:  1440x576i   50.000000 Hz   5:2     15.625 kHz     27.000000 MHz (708 mm x 398 mm)
                  Hfront   24 Hsync 126 Hback  138 Hpol N
                  Vfront    2 Vsync   3 Vback   19 Vpol N Vfront +0.5 Odd Field
                  Vfront    2 Vsync   3 Vback   19 Vpol N Vback  +0.5 Even Field
Checksum: 0x9f  Unused space in Extension Block: 3 bytes

----------------

Block 2, Unknown EDID Extension Block 0x00:
  00 ff ff ff ff ff ff 00 10 ac 03 40 39 32 33 41 '...........@923A'
  2f 0e 01 03 80 39 22 78 2e 3e 3d a6 54 46 98 24 '/....9"x.>=.TF.$'
  11 47 4a a5 4a 00 61 40 81 80 01 01 01 01 01 01 '.GJ.J.a@........'
  01 01 01 01 01 01 0e 1f 00 80 51 00 1e 30 40 80 '..........Q..0@.'
  37 00 36 54 21 00 00 1a 8c 0a d0 8a 20 e0 2d 10 '7.6T!....... .-.'
  10 3e 96 00 13 8e 21 00 00 18 00 00 00 fc 00 57 '.>....!........W'
  32 36 30 30 20 4c 43 44 20 54 56 0a 00 00 00 fd '2600 LCD TV.....'
  00 38 4b 1f 40 0b 04 90 00 00 00 00 00 00 01 5c '.8K.@..........\'
Checksum: 0x5c

----------------

Block 3, CTA-861 Extension Block:
  Revision: 3
  Basic audio support
  Supports YCbCr 4:4:4
  Supports YCbCr 4:2:2
  Native detailed modes: 6
  Video Data Block:
    VIC   5:  1920x1080i  60.000000 Hz  16:9     33.750 kHz     74.250000 MHz (native)
    VIC   4:  1280x720    60.000000 Hz  16:9     45.000 kHz     74.250000 MHz
    VIC   2:   720x480    59.940060 Hz   4:3     31.469 kHz     27.000000 MHz
    VIC   3:   720x480    59.940060 Hz  16:9     31.469 kHz     27.000000 MHz
    VIC   6:  1440x480i   59.940060 Hz   4:3     15.734 kHz     27.000000 MHz
    VIC  17:   720x576    50.000000 Hz   4:3     31.250 kHz     27.000000 MHz
    VIC  21:  1440x576i   50.000000 Hz   4:3     15.625 kHz     27.000000 MHz
  Speaker Allocation Data Block:
    FL/FR - Front Left/Right
  Detailed Timing Descriptors:
    DTD  9:  1920x1080i  60.000000 Hz  16:9     33.750 kHz     74.250000 MHz (708 mm x 398 mm)
                  Hfront   88 Hsync  44 Hback  148 Hpol P
                  Vfront    2 Vsync   5 Vback   15 Vpol P Vfront +0.5 Odd Field
                  Vfront    2 Vsync   5 Vback   15 Vpol P Vback  +0.5 Even Field
    DTD 10:  1280x720    60.000000 Hz  16:9     45.000 kHz     74.250000 MHz (708 mm x 398 mm)
                  Hfront  110 Hsync  40 Hback  220 Hpol P
                  Vfront    5 Vsync   5 Vback   20 Vpol P
    DTD 11:   720x480    59.940060 Hz   3:2     31.469 kHz     27.000000 MHz (708 mm x 398 mm)
                  Hfront   16 Hsync  62 Hback   60 Hpol N
                  Vfront    9 Vsync   6 Vback   30 Vpol N
    DTD 12:  1440x480i   59.940060 Hz   3:1     15.734 kHz     27.000000 MHz (708 mm x 398 mm)
                  Hfront   38 Hsync 124 Hback  114 Hpol N
                  Vfront    4 Vsync   3 Vback   15 Vpol N Vfront +0.5 Odd Field
                  Vfront    4 Vsync   3 Vback   15 Vpol N Vback  +0.5 Even Field
    DTD 13:   720x576    50.000000 Hz   5:4     31.250 kHz     27.000000 MHz (708 mm x 398 mm)
                  Hfront   12 Hsync  64 Hback   68 Hpol N
                  Vfront    5 Vsync   5 Vback   39 Vpol N
    DTD 14:  1440x576i   50.000000 Hz   5:2     15.625 kHz     27.000000 MHz (708 mm x 398 mm)
                  Hfront   24 Hsync 126 Hback  138 Hpol N
                  Vfront    2 Vsync   3 Vback   19 Vpol N Vfront +0.5 Odd Field
                  Vfront    2 Vsync   3 Vback   19 Vpol N Vback  +0.5 Even Field
Checksum: 0x9f  Unused space in Extension Block: 3 bytes

----------------

Warnings:

Block 0, Base EDID:
  Detailed Timing Descriptor #1: DTD is similar but not identical to DMT 0x17.
  Detailed Timing Descriptor #2: Image size is 531x398 mm, but based on the picture AR it should be 531x354 mm.
  Display Range Limits: CVT block does not set preferred refresh rate.
Block 1, CTA-861 Extension Block:
  IT Video Formats are overscanned by default, but normally this should be underscanned.
  Video Data Block: VIC 5 and the first DTD are not identical. Is this intended?
  Detailed Timing Descriptor #5: Image size is 708x398 mm, but based on the picture AR it should be 708x472 mm.
  Detailed Timing Descriptor #6: Image size is 708x398 mm, but based on the picture AR it should be 708x236 mm.
  Detailed Timing Descriptor #7: Image size is 708x398 mm, but based on the picture AR it should be 708x566 mm.
  Detailed Timing Descriptor #8: Image size is 708x398 mm, but based on the picture AR it should be 708x283 mm.
Block 3, CTA-861 Extension Block:
  IT Video Formats are overscanned by default, but normally this should be underscanned.
  Detailed Timing Descriptor #11: Image size is 708x398 mm, but based on the picture AR it should be 708x472 mm.
  Detailed Timing Descriptor #12: Image size is 708x398 mm, but based on the picture AR it should be 708x236 mm.
  Detailed Timing Descriptor #13: Image size is 708x398 mm, but based on the picture AR it should be 708x566 mm.
  Detailed Timing Descriptor #14: Image size is 708x398 mm, but based on the picture AR it should be 708x283 mm.
EDID:
  Base EDID: Some timings are out of range of the Monitor Ranges:
    Vertical Freq: 50.000 - 75.029 Hz (Monitor: 56.000 - 75.000 Hz)
    Horizontal Freq: 15.625 - 63.981 kHz (Monitor: 31.000 - 64.000 kHz)

Failures:

Block 0, Base EDID:
  Basic Display Parameters & Features: sRGB is signaled, but the chromaticities do not match.
  Detailed Timing Descriptor #2: Mismatch of image size 531x398 mm vs display size 570x340 mm.
  Display Range Limits: 'CVT' is not allowed for EDID < 1.4.
Block 1, CTA-861 Extension Block:
  Detailed Timing Descriptor #3: Mismatch of image size 708x398 mm vs display size 570x340 mm.
  Detailed Timing Descriptor #4: Mismatch of image size 708x398 mm vs display size 570x340 mm.
  Detailed Timing Descriptor #5: Mismatch of image size 708x398 mm vs display size 570x340 mm.
  Detailed Timing Descriptor #6: Mismatch of image size 708x398 mm vs display size 570x340 mm.
  Detailed Timing Descriptor #7: Mismatch of image size 708x398 mm vs display size 570x340 mm.
  Detailed Timing Descriptor #8: Mismatch of image size 708x398 mm vs display size 570x340 mm.
  Missing VCDB, needed for Set Selectable RGB Quantization to avoid interop issues.
Block 2, Base EDID:
  Unknown Extension Block.
Block 3, CTA-861 Extension Block:
  Video Data Block: Duplicate VIC 5.
  Video Data Block: Duplicate VIC 4.
  Video Data Block: Duplicate VIC 2.
  Video Data Block: Duplicate VIC 3.
  Video Data Block: Duplicate VIC 6.
  Video Data Block: Duplicate VIC 17.
  Video Data Block: Duplicate VIC 21.
  Speaker Allocation Data Block: Only one instance of this Data Block is allowed.
  Detailed Timing Descriptor #9: Mismatch of image size 708x398 mm vs display size 570x340 mm.
  Detailed Timing Descriptor #10: Mismatch of image size 708x398 mm vs display size 570x340 mm.
  Detailed Timing Descriptor #11: Mismatch of image size 708x398 mm vs display size 570x340 mm.
  Detailed Timing Descriptor #12: Mismatch of image size 708x398 mm vs display size 570x340 mm.
  Detailed Timing Descriptor #13: Mismatch of image size 708x398 mm vs display size 570x340 mm.
  Detailed Timing Descriptor #14: Mismatch of image size 708x398 mm vs display size 570x340 mm.
EDID:
  Base EDID: The DTD max image size is 708x398mm, which is larger than the display size 570.0x340.0mm.
  Base EDID: EDID specified 1 extension block(s), but found 3 extension block(s).
  Base EDID: EDID 1.3 requires a Block Map Extension in Block 1 if there are more than 2 blocks in the EDID.
  CTA-861: Native progressive timings are a mix of several resolutions.
  CTA-861: Native interlaced timings are a mix of several resolutions.

EDID conformity: FAIL
