edid-decode (hex):

00 ff ff ff ff ff ff 00 06 af a5 c1 a5 c1 00 00
1c 20 01 04 b5 22 16 78 03 ca 35 a6 55 49 99 25
10 50 54 00 00 00 01 01 01 01 01 01 01 01 01 01
01 01 01 01 01 01 78 6e 00 a0 a0 40 84 60 30 20
aa 00 58 d7 10 00 00 18 00 00 00 fd 0c 30 a5 1f
1f 4e 01 0a 20 20 20 20 20 20 00 00 00 fe 00 41
55 4f 0a 20 20 20 20 20 20 20 20 20 00 00 00 fe
00 42 31 36 30 51 41 4e 30 33 2e 4c 20 0a 01 7b

70 13 79 00 00 03 01 14 b6 2f 01 84 ff 09 9f 00
2f 00 1f 00 3f 06 83 00 09 00 09 00 00 00 00 00
00 00 00 00 00 00 00 00 00 00 00 00 00 00 00 00
00 00 00 00 00 00 00 00 00 00 00 00 00 00 00 00
00 00 00 00 00 00 00 00 00 00 00 00 00 00 00 00
00 00 00 00 00 00 00 00 00 00 00 00 00 00 00 00
00 00 00 00 00 00 00 00 00 00 00 00 00 00 00 00
00 00 00 00 00 00 00 00 00 00 00 00 00 00 23 90

00 ff ff ff ff ff ff 00 06 af a5 c1 a5 c1 00 00
1c 20 01 04 b5 22 16 78 03 ca 35 a6 55 49 99 25
10 50 54 00 00 00 01 01 01 01 01 01 01 01 01 01
01 01 01 01 01 01 78 6e 00 a0 a0 40 84 60 30 20
aa 00 58 d7 10 00 00 18 00 00 00 fd 0c 30 a5 1f
1f 4e 01 0a 20 20 20 20 20 20 00 00 00 fe 00 41
55 4f 0a 20 20 20 20 20 20 20 20 20 00 00 00 fe
00 42 31 36 30 51 41 4e 30 33 2e 4c 20 0a 01 7b

70 13 79 00 00 03 01 14 b6 2f 01 84 ff 09 9f 00
2f 00 1f 00 3f 06 83 00 09 00 09 00 00 00 00 00
00 00 00 00 00 00 00 00 00 00 00 00 00 00 00 00
00 00 00 00 00 00 00 00 00 00 00 00 00 00 00 00
00 00 00 00 00 00 00 00 00 00 00 00 00 00 00 00
00 00 00 00 00 00 00 00 00 00 00 00 00 00 00 00
00 00 00 00 00 00 00 00 00 00 00 00 00 00 00 00
00 00 00 00 00 00 00 00 00 00 00 00 00 00 23 90

----------------

Block 0, Base EDID:
  EDID Structure Version & Revision: 1.4
  Vendor & Product Identification:
    Manufacturer: AUO
    Model: 49573
    Serial Number: ...
    Made in: week 28 of 2022
  Basic Display Parameters & Features:
    Digital display
    Bits per primary color channel: 10
    DisplayPort interface
    Maximum image size: 34 cm x 22 cm
    Gamma: 2.20
    Supported color formats: RGB 4:4:4
    First detailed timing includes the native pixel format and preferred refresh rate
    Display supports continuous frequencies
  Color Characteristics:
    Red  : 0.6513, 0.3320
    Green: 0.2871, 0.5996
    Blue : 0.1445, 0.0654
    White: 0.3134, 0.3291
  Established Timings I & II: none
  Standard Timings: none
  Detailed Timing Descriptors:
    DTD 1:  2560x1600   60.029208 Hz  16:10   103.971 kHz    282.800000 MHz (344 mm x 215 mm)
                 Hfront   48 Hsync  32 Hback   80 Hpol N
                 Vfront   10 Vsync  10 Vback  112 Vpol N
    Display Range Limits:
      Monitor ranges (Range Limits Only): 48-165 Hz V, 286-286 kHz H, max dotclock 780 MHz
    Alphanumeric Data String: 'AUO'
    Alphanumeric Data String: 'B160QAN03.L '
  Extension blocks: 1
Checksum: 0x7b

----------------

Block 1, DisplayID Extension Block:
  Version: 1.3
  Extension Count: 0
  Display Product Type: Extension Section
  Video Timing Modes Type 1 - Detailed Timings Data Block:
    DTD:  2560x1600  165.039991 Hz  16:9    285.849 kHz    777.510000 MHz (aspect 16:9, no 3D stereo, preferred)
               Hfront   48 Hsync  32 Hback   80 Hpol N
               Vfront   10 Vsync  10 Vback  112 Vpol N
  Checksum: 0x23
Checksum: 0x90

----------------

Warnings:

Block 0, Base EDID:
  Missing Display Product Name.
EDID:
  Base EDID: Some timings are out of range of the Monitor Ranges:
    Horizontal Freq: 103.970 - 285.849 kHz (Monitor: 286.000 - 286.000 kHz)

Failures:

Block 0, Base EDID:
  Alphanumeric Data String: One or more trailing spaces before newline.
Block 1, DisplayID Extension Block:
  DisplayID Base Block has no product type.
EDID:
  Extension Block 2 started with EDID header, ignoring Extension Blocks >= 2.

EDID conformity: FAIL
