edid-decode (hex):

00 ff ff ff ff ff ff 00 51 a1 25 20 00 00 00 00
24 21 01 04 a5 1f 14 78 03 8e d5 a9 53 4c 99 23
0f 50 54 00 00 00 01 01 01 01 01 01 01 01 01 01
01 01 01 01 01 01 74 3c 80 a0 70 b0 28 40 30 20
35 00 2d bc 10 00 00 18 5d 30 80 a0 70 b0 28 40
30 20 35 00 2d bc 10 00 00 18 00 00 00 fe 00 0a
20 20 20 20 20 20 20 20 20 20 20 20 00 00 00 fc
00 54 4d 31 34 30 56 44 48 50 32 31 0a 20 00 d6

00 ff ff ff ff ff ff 00 51 a1 25 20 00 00 00 00
24 21 01 04 a5 1f 14 78 03 8e d5 a9 53 4c 99 23
0f 50 54 00 00 00 01 01 01 01 01 01 01 01 01 01
01 01 01 01 01 01 74 3c 80 a0 70 b0 28 40 30 20
35 00 2d bc 10 00 00 18 5d 30 80 a0 70 b0 28 40
30 20 35 00 2d bc 10 00 00 18 00 00 00 fe 00 0a
20 20 20 20 20 20 20 20 20 20 20 20 00 00 00 fc
00 54 4d 31 34 30 56 44 48 50 32 31 0a 20 00 d6

----------------

Block 0, Base EDID:
  EDID Structure Version & Revision: 1.4
  Vendor & Product Identification:
    Manufacturer: TMA
    Model: 8229
    Made in: week 36 of 2023
  Basic Display Parameters & Features:
    Digital display
    Bits per primary color channel: 8
    DisplayPort interface
    Maximum image size: 31 cm x 20 cm
    Gamma: 2.20
    Supported color formats: RGB 4:4:4
    First detailed timing includes the native pixel format and preferred refresh rate
    Display supports continuous frequencies
  Color Characteristics:
    Red  : 0.6621, 0.3242
    Green: 0.2998, 0.5996
    Blue : 0.1396, 0.0595
    White: 0.3134, 0.3291
  Established Timings I & II: none
  Standard Timings: none
  Detailed Timing Descriptors:
    DTD 1:  1920x1200   60.003102 Hz  16:10    74.404 kHz    154.760000 MHz (301 mm x 188 mm)
                 Hfront   48 Hsync  32 Hback   80 Hpol N
                 Vfront    3 Vsync   5 Vback   32 Vpol N
    DTD 2:  1920x1200   48.003257 Hz  16:10    59.524 kHz    123.810000 MHz (301 mm x 188 mm)
                 Hfront   48 Hsync  32 Hback   80 Hpol N
                 Vfront    3 Vsync   5 Vback   32 Vpol N
    Alphanumeric Data String: ''
    Display Product Name: 'TM140VDHP21'
Checksum: 0xd6

----------------

Failures:

Block 0, Base EDID:
  Alphanumeric Data String: Empty string.
  Missing Display Range Limits Descriptor.
EDID:
  Extension Block 1 started with EDID header, ignoring Extension Blocks >= 1.

EDID conformity: FAIL
