edid-decode (hex):

00 ff ff ff ff ff ff 00 4c 2d 14 0f 00 0e 00 01
01 1c 01 03 80 59 32 78 0a 23 ad a4 54 4d 99 26
0f 47 4a bd ef 80 71 4f 81 c0 81 00 81 80 95 00
a9 c0 b3 00 01 01 08 e8 00 30 f2 70 5a 80 b0 58
8a 00 50 1d 74 00 00 1e 02 3a 80 18 71 38 2d 40
58 2c 45 00 50 1d 74 00 00 1e 00 00 00 fd 00 18
4b 0f 87 3c 00 0a 20 20 20 20 20 20 00 00 00 fc
00 53 41 4d 53 55 4e 47 0a 20 20 20 20 20 01 77

02 03 56 f0 57 61 10 1f 04 13 05 14 20 21 22 5d
5e 5f 60 65 66 62 63 64 07 16 03 12 29 09 07 07
15 07 50 57 07 01 83 01 00 00 e2 00 4f e3 05 c3
01 6e 03 0c 00 10 00 bf ff ff ff ff ff ff ff ff
ff ff ff ff ff ff ff ff ff ff ff ff ff ff ff ff
ff ff ff ff ff ff ff ff ff ff ff ff ff ff ff ff
ff ff ff ff ff ff ff ff ff ff ff ff ff ff ff ff
ff ff ff ff ff ff ff ff ff ff ff ff ff ff ff ff

----------------

Block 0, Base EDID:
  EDID Structure Version & Revision: 1.3
  Vendor & Product Identification:
    Manufacturer: SAM
    Model: 3860
    Serial Number: ...
    Made in: week 1 of 2018
  Basic Display Parameters & Features:
    Digital display
    Maximum image size: 445 cm x 250 cm (HDMI VSDB indicates 5 cm units)
    Gamma: 2.20
    RGB color display
    First detailed timing is the preferred timing
  Color Characteristics:
    Red  : 0.6406, 0.3300
    Green: 0.3007, 0.6005
    Blue : 0.1503, 0.0605
    White: 0.2802, 0.2900
  Established Timings I & II:
    IBM     :   720x400    70.081663 Hz   9:5     31.467 kHz     28.320000 MHz
    DMT 0x04:   640x480    59.940476 Hz   4:3     31.469 kHz     25.175000 MHz
    Apple   :   640x480    66.666667 Hz   4:3     35.000 kHz     30.240000 MHz
    DMT 0x05:   640x480    72.808802 Hz   4:3     37.861 kHz     31.500000 MHz
    DMT 0x06:   640x480    75.000000 Hz   4:3     37.500 kHz     31.500000 MHz
    DMT 0x09:   800x600    60.316541 Hz   4:3     37.879 kHz     40.000000 MHz
    DMT 0x0a:   800x600    72.187572 Hz   4:3     48.077 kHz     50.000000 MHz
    DMT 0x0b:   800x600    75.000000 Hz   4:3     46.875 kHz     49.500000 MHz
    Apple   :   832x624    74.551266 Hz   4:3     49.726 kHz     57.284000 MHz
    DMT 0x10:  1024x768    60.003840 Hz   4:3     48.363 kHz     65.000000 MHz
    DMT 0x11:  1024x768    70.069359 Hz   4:3     56.476 kHz     75.000000 MHz
    DMT 0x12:  1024x768    75.028582 Hz   4:3     60.023 kHz     78.750000 MHz
    DMT 0x24:  1280x1024   75.024675 Hz   5:4     79.976 kHz    135.000000 MHz
    Apple   :  1152x870    75.061550 Hz 192:145   68.681 kHz    100.000000 MHz
  Standard Timings:
    DMT 0x15:  1152x864    75.000000 Hz   4:3     67.500 kHz    108.000000 MHz
    DMT 0x55:  1280x720    60.000000 Hz  16:9     45.000 kHz     74.250000 MHz
    DMT 0x1c:  1280x800    59.810326 Hz  16:10    49.702 kHz     83.500000 MHz
    DMT 0x23:  1280x1024   60.019740 Hz   5:4     63.981 kHz    108.000000 MHz
    DMT 0x2f:  1440x900    59.887445 Hz  16:10    55.935 kHz    106.500000 MHz
    DMT 0x53:  1600x900    60.000000 Hz  16:9     60.000 kHz    108.000000 MHz (RB)
    DMT 0x3a:  1680x1050   59.954250 Hz  16:10    65.290 kHz    146.250000 MHz
  Detailed Timing Descriptors:
    DTD 1:  3840x2160   60.000000 Hz  16:9    135.000 kHz    594.000000 MHz (1872 mm x 1053 mm)
                 Hfront  176 Hsync  88 Hback  296 Hpol P
                 Vfront    8 Vsync  10 Vback   72 Vpol P
    DTD 2:  1920x1080   60.000000 Hz  16:9     67.500 kHz    148.500000 MHz (1872 mm x 1053 mm)
                 Hfront   88 Hsync  44 Hback  148 Hpol P
                 Vfront    4 Vsync   5 Vback   36 Vpol P
    Display Range Limits:
      Monitor ranges (GTF): 24-75 Hz V, 15-135 kHz H, max dotclock 600 MHz
    Display Product Name: 'SAMSUNG'
  Extension blocks: 1
Checksum: 0x77

----------------

Block 1, CTA-861 Extension Block:
  Revision: 3
  Underscans IT Video Formats by default
  Basic audio support
  Supports YCbCr 4:4:4
  Supports YCbCr 4:2:2
  Native DTDs: 0
  Video Data Block:
    VIC  97:  3840x2160   60.000000 Hz  16:9    135.000 kHz    594.000000 MHz
    VIC  16:  1920x1080   60.000000 Hz  16:9     67.500 kHz    148.500000 MHz
    VIC  31:  1920x1080   50.000000 Hz  16:9     56.250 kHz    148.500000 MHz
    VIC   4:  1280x720    60.000000 Hz  16:9     45.000 kHz     74.250000 MHz
    VIC  19:  1280x720    50.000000 Hz  16:9     37.500 kHz     74.250000 MHz
    VIC   5:  1920x1080i  60.000000 Hz  16:9     33.750 kHz     74.250000 MHz
    VIC  20:  1920x1080i  50.000000 Hz  16:9     28.125 kHz     74.250000 MHz
    VIC  32:  1920x1080   24.000000 Hz  16:9     27.000 kHz     74.250000 MHz
    VIC  33:  1920x1080   25.000000 Hz  16:9     28.125 kHz     74.250000 MHz
    VIC  34:  1920x1080   30.000000 Hz  16:9     33.750 kHz     74.250000 MHz
    VIC  93:  3840x2160   24.000000 Hz  16:9     54.000 kHz    297.000000 MHz
    VIC  94:  3840x2160   25.000000 Hz  16:9     56.250 kHz    297.000000 MHz
    VIC  95:  3840x2160   30.000000 Hz  16:9     67.500 kHz    297.000000 MHz
    VIC  96:  3840x2160   50.000000 Hz  16:9    112.500 kHz    594.000000 MHz
    VIC 101:  4096x2160   50.000000 Hz 256:135  112.500 kHz    594.000000 MHz
    VIC 102:  4096x2160   60.000000 Hz 256:135  135.000 kHz    594.000000 MHz
    VIC  98:  4096x2160   24.000000 Hz 256:135   54.000 kHz    297.000000 MHz
    VIC  99:  4096x2160   25.000000 Hz 256:135   56.250 kHz    297.000000 MHz
    VIC 100:  4096x2160   30.000000 Hz 256:135   67.500 kHz    297.000000 MHz
    VIC   7:  1440x480i   59.940060 Hz  16:9     15.734 kHz     27.000000 MHz
    VIC  22:  1440x576i   50.000000 Hz  16:9     15.625 kHz     27.000000 MHz
    VIC   3:   720x480    59.940060 Hz  16:9     31.469 kHz     27.000000 MHz
    VIC  18:   720x576    50.000000 Hz  16:9     31.250 kHz     27.000000 MHz
  Audio Data Block:
    Linear PCM:
      Max channels: 2
      Supported sample rates (kHz): 48 44.1 32
      Supported sample sizes (bits): 24 20 16
    AC-3:
      Max channels: 6
      Supported sample rates (kHz): 48 44.1 32
      Maximum bit rate: 640 kb/s
    Enhanced AC-3 (DD+):
      Max channels: 8
      Supported sample rates (kHz): 48 44.1 32
      Supports Joint Object Coding
  Speaker Allocation Data Block:
    FL/FR - Front Left/Right
  Video Capability Data Block:
    YCbCr quantization: No Data
    RGB quantization: Selectable (via AVI Q)
    PT scan behavior: No Data
    IT scan behavior: Supports both over- and underscan
    CE scan behavior: Supports both over- and underscan
  Colorimetry Data Block:
    xvYCC601
    xvYCC709
    BT2020YCC
    BT2020RGB
    Gamut Boundary Description Metadata Profile P0
  Vendor-Specific Data Block (HDMI), OUI 00-0C-03:
    Source physical address: 1.0.0.0
    Supports_AI
    DC_36bit
    DC_30bit
    DC_Y444
    DVI_Dual
    Maximum TMDS clock: 1275 MHz
    Supported Content Types:
      Graphics
      Photo
      Cinema
      Game
    Video latency: Video not supported
    Audio latency: Audio not supported
    Interlaced video latency: Video not supported
    Interlaced audio latency: Audio not supported
    Extended HDMI video details:
      3D present
      Base EDID image size is in units of 5 cm
      HDMI VICs:
         Unknown (HDMI VIC 255)
         Unknown (HDMI VIC 255)
         Unknown (HDMI VIC 255)
         Unknown (HDMI VIC 255)
         Unknown (HDMI VIC 255)
         Unknown (HDMI VIC 255)
         Unknown (HDMI VIC 255)
      3D VIC indices with specific capabilities:
        VIC 102:  4096x2160   60.000000 Hz 256:135  135.000 kHz    594.000000 MHz (unknown (0x0f))
        VIC 102:  4096x2160   60.000000 Hz 256:135  135.000 kHz    594.000000 MHz (unknown (0x0f))
        VIC 102:  4096x2160   60.000000 Hz 256:135  135.000 kHz    594.000000 MHz (unknown (0x0f))
        VIC 102:  4096x2160   60.000000 Hz 256:135  135.000 kHz    594.000000 MHz (unknown (0x0f))
        VIC 102:  4096x2160   60.000000 Hz 256:135  135.000 kHz    594.000000 MHz (unknown (0x0f))
        VIC 102:  4096x2160   60.000000 Hz 256:135  135.000 kHz    594.000000 MHz (unknown (0x0f))
        VIC 102:  4096x2160   60.000000 Hz 256:135  135.000 kHz    594.000000 MHz (unknown (0x0f))
        VIC 102:  4096x2160   60.000000 Hz 256:135  135.000 kHz    594.000000 MHz (unknown (0x0f))
        VIC 102:  4096x2160   60.000000 Hz 256:135  135.000 kHz    594.000000 MHz (unknown (0x0f))
        VIC 102:  4096x2160   60.000000 Hz 256:135  135.000 kHz    594.000000 MHz (unknown (0x0f))
        VIC 102:  4096x2160   60.000000 Hz 256:135  135.000 kHz    594.000000 MHz (unknown (0x0f))
        VIC 102:  4096x2160   60.000000 Hz 256:135  135.000 kHz    594.000000 MHz (unknown (0x0f))
        VIC 102:  4096x2160   60.000000 Hz 256:135  135.000 kHz    594.000000 MHz (unknown (0x0f))
        VIC 102:  4096x2160   60.000000 Hz 256:135  135.000 kHz    594.000000 MHz (unknown (0x0f))
        VIC 102:  4096x2160   60.000000 Hz 256:135  135.000 kHz    594.000000 MHz (unknown (0x0f))
        VIC 102:  4096x2160   60.000000 Hz 256:135  135.000 kHz    594.000000 MHz (unknown (0x0f))
  Unknown CTA-861 Data Block (extended tag 0xff, length 30):
    ff ff ff ff ff ff ff ff ff ff ff ff ff ff ff ff '................'
    ff ff ff ff ff ff ff ff ff ff ff ff ff ff       '..............'
  Detailed Timing Descriptors:
    DTD 3:  4095x8190i  10.418373 Hz   1:2     80.018 kHz    655.350000 MHz (side by side interleaved, 4095 mm x 4095 mm)
                 Hfront 1023 Hsync 1023 Hback 1539 Hpol P Hborder 255
                 Vfront   63 Vsync  63 Vback 3459 Vpol P Vborder 255 Vfront +0.5 Odd Field
                 Vfront   63 Vsync  63 Vback 3459 Vpol P Vborder 255 Vback  +0.5 Even Field
    DTD 4:  4095x8190i  10.418373 Hz   1:2     80.018 kHz    655.350000 MHz (side by side interleaved, 4095 mm x 4095 mm)
                 Hfront 1023 Hsync 1023 Hback 1539 Hpol P Hborder 255
                 Vfront   63 Vsync  63 Vback 3459 Vpol P Vborder 255 Vfront +0.5 Odd Field
                 Vfront   63 Vsync  63 Vback 3459 Vpol P Vborder 255 Vback  +0.5 Even Field
Checksum: 0xff (should be 0x2a)  Unused space in Extension Block: 5 bytes

----------------

Warnings:

Block 1, CTA-861 Extension Block:
  Video Data Block: For improved preferred timing interoperability, set 'Native DTDs' to 1.
  Video Capability Data Block: Set Selectable YCbCr Quantization to avoid interop issues.
  Colorimetry Data Block: Set the sRGB colorimetry bit to avoid interop issues.
  Vendor-Specific Data Block (HDMI), OUI 00-0C-03: Progressive and Interlaced latency values are identical, no need for both.
  Vendor-Specific Data Block (HDMI), OUI 00-0C-03: Recommended to set Image_Size bits to 'Indicate Aspect Ratio' for large displays
  Vendor-Specific Data Block (HDMI), OUI 00-0C-03: Using 5 cm units is not recommended. Specify the actual size with a CTA NVRDB or DisplayID Display Parameters
  Unknown CTA-861 Data Block (extended tag 0xff, length 30).
  Detailed Timing Descriptor #3: Image size is 4095x4095 mm, but based on the picture AR it should be 2047x4095 mm.
  Detailed Timing Descriptor #3: The use of non-zero borders in a DTD is not recommended.
  Detailed Timing Descriptor #4: Image size is 4095x4095 mm, but based on the picture AR it should be 2047x4095 mm.
  Detailed Timing Descriptor #4: The use of non-zero borders in a DTD is not recommended.
EDID:
  Base EDID: Some timings are out of range of the Monitor Ranges:
    Vertical Freq: 10.418 - 75.062 Hz (Monitor: 24.000 - 75.000 Hz)
    Maximum Clock: 655.350 MHz (Monitor: 600.000 MHz)

Failures:

Block 0, Base EDID:
  Detailed Timing Descriptor #1: Mismatch of image size 1872x1053 mm vs display size 4450x2500 mm.
  Detailed Timing Descriptor #2: Mismatch of image size 1872x1053 mm vs display size 4450x2500 mm.
Block 1, CTA-861 Extension Block:
  Vendor-Specific Data Block (HDMI), OUI 00-0C-03: HDMI VSDB Max TMDS rate is > 340.
  Vendor-Specific Data Block (HDMI), OUI 00-0C-03: Unknown HDMI VIC 255.
  Vendor-Specific Data Block (HDMI), OUI 00-0C-03: Unknown HDMI VIC 255.
  Vendor-Specific Data Block (HDMI), OUI 00-0C-03: Unknown HDMI VIC 255.
  Vendor-Specific Data Block (HDMI), OUI 00-0C-03: Unknown HDMI VIC 255.
  Vendor-Specific Data Block (HDMI), OUI 00-0C-03: Unknown HDMI VIC 255.
  Vendor-Specific Data Block (HDMI), OUI 00-0C-03: Unknown HDMI VIC 255.
  Vendor-Specific Data Block (HDMI), OUI 00-0C-03: Unknown HDMI VIC 255.
  Vendor-Specific Data Block (HDMI), OUI 00-0C-03: Unknown 3D_Structure_X value 0x0f.
  Vendor-Specific Data Block (HDMI), OUI 00-0C-03: Unknown 3D_Structure_X value 0x0f.
  Vendor-Specific Data Block (HDMI), OUI 00-0C-03: Unknown 3D_Structure_X value 0x0f.
  Vendor-Specific Data Block (HDMI), OUI 00-0C-03: Unknown 3D_Structure_X value 0x0f.
  Vendor-Specific Data Block (HDMI), OUI 00-0C-03: Unknown 3D_Structure_X value 0x0f.
  Vendor-Specific Data Block (HDMI), OUI 00-0C-03: Unknown 3D_Structure_X value 0x0f.
  Vendor-Specific Data Block (HDMI), OUI 00-0C-03: Unknown 3D_Structure_X value 0x0f.
  Vendor-Specific Data Block (HDMI), OUI 00-0C-03: Unknown 3D_Structure_X value 0x0f.
  Vendor-Specific Data Block (HDMI), OUI 00-0C-03: Unknown 3D_Structure_X value 0x0f.
  Vendor-Specific Data Block (HDMI), OUI 00-0C-03: Unknown 3D_Structure_X value 0x0f.
  Vendor-Specific Data Block (HDMI), OUI 00-0C-03: Unknown 3D_Structure_X value 0x0f.
  Vendor-Specific Data Block (HDMI), OUI 00-0C-03: Unknown 3D_Structure_X value 0x0f.
  Vendor-Specific Data Block (HDMI), OUI 00-0C-03: Unknown 3D_Structure_X value 0x0f.
  Vendor-Specific Data Block (HDMI), OUI 00-0C-03: Unknown 3D_Structure_X value 0x0f.
  Vendor-Specific Data Block (HDMI), OUI 00-0C-03: Unknown 3D_Structure_X value 0x0f.
  Vendor-Specific Data Block (HDMI), OUI 00-0C-03: Unknown 3D_Structure_X value 0x0f.
  Offset is 86, but should be 96.
  Detailed Timing Descriptor #3: Mismatch of image size 4095x4095 mm vs display size 4450x2500 mm.
  Detailed Timing Descriptor #4: Mismatch of image size 4095x4095 mm vs display size 4450x2500 mm.
  Padding: Contains non-zero bytes.
  Invalid checksum 0xff (should be 0x2a).
EDID:
  Base EDID: The DTD max image size is 4095x4095mm, which is larger than the display size 4450.0x2500.0mm.

EDID conformity: FAIL
