edid-decode (hex):

00 ff ff ff ff ff ff 00 0a d4 3c 62 01 00 00 00
1e 21 01 03 80 3c 22 78 2e 3f 58 9f 59 4c 9d 23
0d 4d 58 bf ef 80 e1 c0 d1 40 d1 00 d1 c0 b3 00
95 00 81 80 81 c0 56 5e 00 a0 a0 a0 29 50 30 20
35 00 55 50 21 00 00 1e 00 00 00 ff 00 20 20 9b
00 00 00 00 00 20 ff 07 a4 0a 00 00 00 fd 00 30
4c 1f 73 21 00 0a 20 20 20 20 20 20 00 00 00 fc
00 43 53 32 37 51 54 0a 20 20 20 20 20 20 01 24

02 03 37 f1 4d 01 02 03 04 0e 0f 10 11 12 93 1d
1e 1f 23 09 07 07 83 01 00 00 67 03 0c 00 10 00
38 42 68 1a 00 00 01 01 30 4c e6 67 d8 5d c4 01
42 c0 00 e3 05 c0 00 2a 44 80 a0 70 38 27 40 30
20 35 00 55 50 21 00 00 1e 27 75 00 8c a0 a0 29
50 30 20 35 00 55 50 21 00 00 1e 00 00 00 00 00
00 00 00 00 00 00 00 00 00 00 00 00 00 00 00 00
00 00 00 00 00 00 00 00 00 00 00 00 00 00 00 40

00 ff ff ff ff ff ff 00 0a d4 3c 62 01 00 00 00
1e 21 01 03 80 3c 22 78 2e 3f 58 9f 59 4c 9d 23
0d 4d 58 bf ef 80 e1 c0 d1 40 d1 00 d1 c0 b3 00
95 00 81 80 81 c0 56 5e 00 a0 a0 a0 29 50 30 20
35 00 55 50 21 00 00 1e 00 00 00 ff 00 20 20 9b
00 00 00 00 00 20 ff 07 a4 0a 00 00 00 fd 00 30
4c 1f 73 21 00 0a 20 20 20 20 20 20 00 00 00 fc
00 43 53 32 37 51 54 0a 20 20 20 20 20 20 01 24

02 03 37 f1 4d 01 02 03 04 0e 0f 10 11 12 93 1d
1e 1f 23 09 07 07 83 01 00 00 67 03 0c 00 10 00
38 42 68 1a 00 00 01 01 30 4c e6 67 d8 5d c4 01
42 c0 00 e3 05 c0 00 2a 44 80 a0 70 38 27 40 30
20 35 00 55 50 21 00 00 1e 27 75 00 8c a0 a0 29
50 30 20 35 00 55 50 21 00 00 1e 00 00 00 00 00
00 00 00 00 00 00 00 00 00 00 00 00 00 00 00 00
00 00 00 00 00 00 00 00 00 00 00 00 00 00 00 40

----------------

Block 0, Base EDID:
  EDID Structure Version & Revision: 1.3
  Vendor & Product Identification:
    Manufacturer: BVT
    Model: 25148
    Serial Number: ...
    Made in: week 30 of 2023
  Basic Display Parameters & Features:
    Digital display
    Maximum image size: 60 cm x 34 cm
    Gamma: 2.20
    DPMS levels: Off
    RGB color display
    Default (sRGB) color space is primary color space
    First detailed timing is the preferred timing
  Color Characteristics:
    Red  : 0.6210, 0.3505
    Green: 0.2998, 0.6162
    Blue : 0.1376, 0.0517
    White: 0.3027, 0.3437
  Established Timings I & II:
    IBM     :   720x400    70.081663 Hz   9:5     31.467 kHz     28.320000 MHz
    DMT 0x04:   640x480    59.940476 Hz   4:3     31.469 kHz     25.175000 MHz
    Apple   :   640x480    66.666667 Hz   4:3     35.000 kHz     30.240000 MHz
    DMT 0x05:   640x480    72.808802 Hz   4:3     37.861 kHz     31.500000 MHz
    DMT 0x06:   640x480    75.000000 Hz   4:3     37.500 kHz     31.500000 MHz
    DMT 0x08:   800x600    56.250000 Hz   4:3     35.156 kHz     36.000000 MHz
    DMT 0x09:   800x600    60.316541 Hz   4:3     37.879 kHz     40.000000 MHz
    DMT 0x0a:   800x600    72.187572 Hz   4:3     48.077 kHz     50.000000 MHz
    DMT 0x0b:   800x600    75.000000 Hz   4:3     46.875 kHz     49.500000 MHz
    Apple   :   832x624    74.551266 Hz   4:3     49.726 kHz     57.284000 MHz
    DMT 0x10:  1024x768    60.003840 Hz   4:3     48.363 kHz     65.000000 MHz
    DMT 0x11:  1024x768    70.069359 Hz   4:3     56.476 kHz     75.000000 MHz
    DMT 0x12:  1024x768    75.028582 Hz   4:3     60.023 kHz     78.750000 MHz
    DMT 0x24:  1280x1024   75.024675 Hz   5:4     79.976 kHz    135.000000 MHz
    Apple   :  1152x870    75.061550 Hz 192:145   68.681 kHz    100.000000 MHz
  Standard Timings:
    DMT 0x54:  2048x1152   60.000000 Hz  16:9     72.000 kHz    162.000000 MHz (RB)
    DMT 0x49:  1920x1440   60.000000 Hz   4:3     90.000 kHz    234.000000 MHz
    DMT 0x45:  1920x1200   59.884600 Hz  16:10    74.556 kHz    193.250000 MHz
    DMT 0x52:  1920x1080   60.000000 Hz  16:9     67.500 kHz    148.500000 MHz
    DMT 0x3a:  1680x1050   59.954250 Hz  16:10    65.290 kHz    146.250000 MHz
    DMT 0x2f:  1440x900    59.887445 Hz  16:10    55.935 kHz    106.500000 MHz
    DMT 0x23:  1280x1024   60.019740 Hz   5:4     63.981 kHz    108.000000 MHz
    DMT 0x55:  1280x720    60.000000 Hz  16:9     45.000 kHz     74.250000 MHz
  Detailed Timing Descriptors:
    DTD 1:  2560x1440   59.950550 Hz  16:9     88.787 kHz    241.500000 MHz (597 mm x 336 mm)
                 Hfront   48 Hsync  32 Hback   80 Hpol P
                 Vfront    3 Vsync   5 Vback   33 Vpol P
    Display Product Serial Number: ...
    Display Range Limits:
      Monitor ranges (GTF): 48-76 Hz V, 31-115 kHz H, max dotclock 330 MHz
    Display Product Name: 'CS27QT'
  Extension blocks: 1
Checksum: 0x24

----------------

Block 1, CTA-861 Extension Block:
  Revision: 3
  Underscans IT Video Formats by default
  Basic audio support
  Supports YCbCr 4:4:4
  Supports YCbCr 4:2:2
  Native DTDs: 1
  Video Data Block:
    VIC   1:   640x480    59.940476 Hz   4:3     31.469 kHz     25.175000 MHz
    VIC   2:   720x480    59.940060 Hz   4:3     31.469 kHz     27.000000 MHz
    VIC   3:   720x480    59.940060 Hz  16:9     31.469 kHz     27.000000 MHz
    VIC   4:  1280x720    60.000000 Hz  16:9     45.000 kHz     74.250000 MHz
    VIC  14:  1440x480    59.940060 Hz   4:3     31.469 kHz     54.000000 MHz
    VIC  15:  1440x480    59.940060 Hz  16:9     31.469 kHz     54.000000 MHz
    VIC  16:  1920x1080   60.000000 Hz  16:9     67.500 kHz    148.500000 MHz
    VIC  17:   720x576    50.000000 Hz   4:3     31.250 kHz     27.000000 MHz
    VIC  18:   720x576    50.000000 Hz  16:9     31.250 kHz     27.000000 MHz
    VIC  19:  1280x720    50.000000 Hz  16:9     37.500 kHz     74.250000 MHz (native)
    VIC  29:  1440x576    50.000000 Hz   4:3     31.250 kHz     54.000000 MHz
    VIC  30:  1440x576    50.000000 Hz  16:9     31.250 kHz     54.000000 MHz
    VIC  31:  1920x1080   50.000000 Hz  16:9     56.250 kHz    148.500000 MHz
  Audio Data Block:
    Linear PCM:
      Max channels: 2
      Supported sample rates (kHz): 48 44.1 32
      Supported sample sizes (bits): 24 20 16
  Speaker Allocation Data Block:
    FL/FR - Front Left/Right
  Vendor-Specific Data Block (HDMI), OUI 00-0C-03:
    Source physical address: 1.0.0.0
    DC_36bit
    DC_30bit
    DC_Y444
    Maximum TMDS clock: 330 MHz
  Vendor-Specific Data Block (AMD), OUI 00-00-1A:
    Version: 1
    Flags 1: 0x01
      FreeSync Supported
    Minimum Refresh Rate: 48 Hz
    Maximum Refresh Rate: 76 Hz
    MCCS VCP Code: 0xe6
  Vendor-Specific Data Block (HDMI Forum), OUI C4-5D-D8:
    Version: 1
    Maximum TMDS Character Rate: 330 MHz
    SCDC Present
    SCDC Read Request Capable
  Colorimetry Data Block:
    BT2020YCC
    BT2020RGB
  Detailed Timing Descriptors:
    DTD 2:  1920x1080   74.972503 Hz  16:9     83.894 kHz    174.500000 MHz (597 mm x 336 mm)
                 Hfront   48 Hsync  32 Hback   80 Hpol P
                 Vfront    3 Vsync   5 Vback   31 Vpol P
    DTD 3:  2560x1440   75.001876 Hz  16:9    111.078 kHz    299.910000 MHz (597 mm x 336 mm)
                 Hfront   48 Hsync  32 Hback   60 Hpol P
                 Vfront    3 Vsync   5 Vback   33 Vpol P
Checksum: 0x40  Unused space in Extension Block: 36 bytes

----------------

Warnings:

Block 0, Base EDID:
  Display Product Serial Number: ...
  Vendor & Product Identification: The serial number is one of the known dummy values, it should probably be set to 0.
Block 1, CTA-861 Extension Block:
  Video Data Block: VIC 1 and the first DTD are not identical. Is this intended?
  Video Data Block: All VICs are in ascending order, and the first (preferred) VIC <= 4, is that intended?
  Display Product Serial Number is set, so the Serial Number in the Base EDID should be 0.

Failures:

Block 0, Base EDID:
  Display Product Serial Number: ...
  Basic Display Parameters & Features: sRGB is signaled, but the chromaticities do not match.
Block 1, CTA-861 Extension Block:
  Vendor-Specific Data Block (HDMI Forum), OUI C4-5D-D8: HDMI Forum VSDB did not immediately follow the HDMI VSDB.
  Vendor-Specific Data Block (HDMI Forum), OUI C4-5D-D8: Max TMDS rate is > 0 and <= 340 or > 600.
  Missing VCDB, needed for Set Selectable RGB Quantization to avoid interop issues.
EDID:
  Extension Block 2 started with EDID header, ignoring Extension Blocks >= 2.
  CTA-861: Native progressive timings are a mix of several resolutions.

EDID conformity: FAIL
