edid-decode (hex):

00 ff ff ff ff ff ff 00 4c 2d 6f 03 39 31 59 4d
21 12 01 04 a5 29 1a 78 22 80 c5 a6 57 49 9b 23
12 50 54 bf ef 80 95 00 95 0f 81 80 81 40 71 4f
01 01 01 01 01 01 9a 29 a0 d0 51 84 22 30 50 98
36 00 ac ff 10 00 00 1c 00 00 00 fd 00 38 4b 1e
51 0e 00 0a 20 20 20 20 20 20 00 00 00 fc 00 53
79 6e 63 4d 61 73 74 65 72 0a 20 20 00 00 00 ff
00 48 4d 44 51 38 32 33 30 30 31 0a 20 20 00 5d

00 ff ff ff ff ff ff 00 4c 2d 6f 03 39 31 59 4d
21 12 01 04 a5 29 1a 78 22 80 c5 a6 57 49 9b 23
12 50 54 bf ef 80 95 00 95 0f 81 80 81 40 71 4f
01 01 01 01 01 01 9a 29 a0 d0 51 84 22 30 50 98
36 00 ac ff 10 00 00 1c 00 00 00 fd 00 38 4b 1e
51 0e 00 0a 20 20 20 20 20 20 00 00 00 fc 00 53
79 6e 63 4d 61 73 74 65 72 0a 20 20 00 00 00 ff
00 48 4d 44 51 38 32 33 30 30 31 0a 20 20 00 5d

----------------

Block 0, Base EDID:
  EDID Structure Version & Revision: 1.4
  Vendor & Product Identification:
    Manufacturer: SAM
    Model: 879
    Serial Number: ...
    Made in: week 33 of 2008
  Basic Display Parameters & Features:
    Digital display
    Bits per primary color channel: 8
    DisplayPort interface
    Maximum image size: 41 cm x 26 cm
    Gamma: 2.20
    DPMS levels: Off
    Supported color formats: RGB 4:4:4
    First detailed timing includes the native pixel format and preferred refresh rate
  Color Characteristics:
    Red  : 0.6503, 0.3398
    Green: 0.2851, 0.6054
    Blue : 0.1396, 0.0703
    White: 0.3134, 0.3291
  Established Timings I & II:
    IBM     :   720x400    70.081663 Hz   9:5     31.467 kHz     28.320000 MHz
    DMT 0x04:   640x480    59.940476 Hz   4:3     31.469 kHz     25.175000 MHz
    Apple   :   640x480    66.666667 Hz   4:3     35.000 kHz     30.240000 MHz
    DMT 0x05:   640x480    72.808802 Hz   4:3     37.861 kHz     31.500000 MHz
    DMT 0x06:   640x480    75.000000 Hz   4:3     37.500 kHz     31.500000 MHz
    DMT 0x08:   800x600    56.250000 Hz   4:3     35.156 kHz     36.000000 MHz
    DMT 0x09:   800x600    60.316541 Hz   4:3     37.879 kHz     40.000000 MHz
    DMT 0x0a:   800x600    72.187572 Hz   4:3     48.077 kHz     50.000000 MHz
    DMT 0x0b:   800x600    75.000000 Hz   4:3     46.875 kHz     49.500000 MHz
    Apple   :   832x624    74.551266 Hz   4:3     49.726 kHz     57.284000 MHz
    DMT 0x10:  1024x768    60.003840 Hz   4:3     48.363 kHz     65.000000 MHz
    DMT 0x11:  1024x768    70.069359 Hz   4:3     56.476 kHz     75.000000 MHz
    DMT 0x12:  1024x768    75.028582 Hz   4:3     60.023 kHz     78.750000 MHz
    DMT 0x24:  1280x1024   75.024675 Hz   5:4     79.976 kHz    135.000000 MHz
    Apple   :  1152x870    75.061550 Hz 192:145   68.681 kHz    100.000000 MHz
  Standard Timings:
    DMT 0x2f:  1440x900    59.887445 Hz  16:10    55.935 kHz    106.500000 MHz
    DMT 0x30:  1440x900    74.984427 Hz  16:10    70.635 kHz    136.750000 MHz
    DMT 0x23:  1280x1024   60.019740 Hz   5:4     63.981 kHz    108.000000 MHz
    DMT 0x20:  1280x960    60.000000 Hz   4:3     60.000 kHz    108.000000 MHz
    DMT 0x15:  1152x864    75.000000 Hz   4:3     67.500 kHz    108.000000 MHz
  Detailed Timing Descriptors:
    DTD 1:  1440x900    59.887445 Hz  16:10    55.935 kHz    106.500000 MHz (428 mm x 255 mm)
                 Hfront   80 Hsync 152 Hback  232 Hpol N
                 Vfront    3 Vsync   6 Vback   25 Vpol P
    Display Range Limits:
      Monitor ranges (GTF): 56-75 Hz V, 30-81 kHz H, max dotclock 140 MHz
    Display Product Name: 'SyncMaster'
    Display Product Serial Number: ...
Checksum: 0x5d

----------------

Block 1, Unknown EDID Extension Block 0x00:
  00 ff ff ff ff ff ff 00 4c 2d 6f 03 39 31 59 4d '........L-o.91YM'
  21 12 01 04 a5 29 1a 78 22 80 c5 a6 57 49 9b 23 '!....).x"...WI.#'
  12 50 54 bf ef 80 95 00 95 0f 81 80 81 40 71 4f '.PT..........@qO'
  01 01 01 01 01 01 9a 29 a0 d0 51 84 22 30 50 98 '.......)..Q."0P.'
  36 00 ac ff 10 00 00 1c 00 00 00 fd 00 38 4b 1e '6............8K.'
  51 0e 00 0a 20 20 20 20 20 20 00 00 00 fc 00 53 'Q...      .....S'
  79 6e 63 4d 61 73 74 65 72 0a 20 20 00 00 00 ff 'yncMaster.  ....'
  00 48 4d 44 51 38 32 33 30 30 31 0a 20 20 00 5d '.HMDQ823001.  .]'
Checksum: 0x5d

----------------

Warnings:

Block 0, Base EDID:
  Detailed Timing Descriptor #1: Image size is 428x255 mm, but based on the picture AR it should be 428x267 mm.
  Display Range Limits: GTF support is deprecated in EDID 1.4.

Failures:

Block 0, Base EDID:
  Detailed Timing Descriptor #1: Mismatch of image size 428x255 mm vs display size 410x260 mm.
  Display Range Limits: GTF is supported, but the display does not support continuous frequencies.
Block 1, Base EDID:
  Unknown Extension Block.
EDID:
  Base EDID: The DTD max image size is 428x255mm, which is larger than the display size 410.0x260.0mm.
  Base EDID: EDID specified 0 extension block(s), but found 1 extension block(s).

EDID conformity: FAIL
