edid-decode (hex):

00 ff ff ff ff ff ff 00 41 0c 50 46 01 01 01 01
12 0f 01 03 80 4c 2d 78 88 28 8e 9e 55 48 97 24
16 48 4b bf ef 00 31 d9 45 d9 61 d9 71 cf 81 c0
81 c0 01 c1 01 c1 f4 1a 00 90 50 00 2c 30 00 14
16 00 f8 c2 21 00 00 18 00 00 00 ff 00 20 20 20
20 20 20 20 20 20 20 20 20 20 00 00 00 fc 00 33
32 20 4c 43 44 20 54 56 0a 20 20 20 00 00 00 fd
00 2f 55 1f 50 0e 00 0a 20 20 20 20 20 20 01 ff

02 03 1a 75 47 01 11 12 93 14 15 16 23 09 07 07
83 01 00 00 65 03 0c 00 10 00 8f 0a d0 90 20 40
31 20 0c 40 55 00 58 c2 21 00 00 18 8f 0a d0 90
20 40 31 20 0c 40 55 00 f8 c2 21 00 00 18 01 1d
00 bc 52 d0 1e 20 b8 28 55 40 f8 c2 21 00 00 1e
01 1d 80 d0 72 1c 16 20 10 2c 25 80 f8 c2 21 00
00 9e d6 09 80 a0 20 e0 2d 10 08 60 22 00 58 c2
21 08 08 18 00 00 00 ff 00 00 00 00 00 00 00 b5

----------------

Block 0, Base EDID:
  EDID Structure Version & Revision: 1.3
  Vendor & Product Identification:
    Manufacturer: PHL
    Model: 18000
    Serial Number: ...
    Made in: week 18 of 2005
  Basic Display Parameters & Features:
    Digital display
    Maximum image size: 76 cm x 45 cm
    Gamma: 2.20
    DPMS levels: Standby
    RGB color display
  Color Characteristics:
    Red  : 0.6171, 0.3339
    Green: 0.2832, 0.5898
    Blue : 0.1425, 0.0859
    White: 0.2841, 0.2949
  Established Timings I & II:
    IBM     :   720x400    70.081663 Hz   9:5     31.467 kHz     28.320000 MHz
    DMT 0x04:   640x480    59.940476 Hz   4:3     31.469 kHz     25.175000 MHz
    Apple   :   640x480    66.666667 Hz   4:3     35.000 kHz     30.240000 MHz
    DMT 0x05:   640x480    72.808802 Hz   4:3     37.861 kHz     31.500000 MHz
    DMT 0x06:   640x480    75.000000 Hz   4:3     37.500 kHz     31.500000 MHz
    DMT 0x08:   800x600    56.250000 Hz   4:3     35.156 kHz     36.000000 MHz
    DMT 0x09:   800x600    60.316541 Hz   4:3     37.879 kHz     40.000000 MHz
    DMT 0x0a:   800x600    72.187572 Hz   4:3     48.077 kHz     50.000000 MHz
    DMT 0x0b:   800x600    75.000000 Hz   4:3     46.875 kHz     49.500000 MHz
    Apple   :   832x624    74.551266 Hz   4:3     49.726 kHz     57.284000 MHz
    DMT 0x10:  1024x768    60.003840 Hz   4:3     48.363 kHz     65.000000 MHz
    DMT 0x11:  1024x768    70.069359 Hz   4:3     56.476 kHz     75.000000 MHz
    DMT 0x12:  1024x768    75.028582 Hz   4:3     60.023 kHz     78.750000 MHz
    DMT 0x24:  1280x1024   75.024675 Hz   5:4     79.976 kHz    135.000000 MHz
  Standard Timings:
    GTF     :   640x360    85.000000 Hz  16:9     32.215 kHz     25.772000 MHz
    GTF     :   800x450    84.999593 Hz  16:9     40.205 kHz     41.813000 MHz
    GTF     :  1024x576    84.999754 Hz  16:9     51.425 kHz     69.115000 MHz
    GTF     :  1152x648    75.000000 Hz  16:9     50.775 kHz     77.178000 MHz
    DMT 0x55:  1280x720    60.000000 Hz  16:9     45.000 kHz     74.250000 MHz
    DMT 0x55:  1280x720    60.000000 Hz  16:9     45.000 kHz     74.250000 MHz
  Detailed Timing Descriptors:
    DTD 1:  1280x768    59.673715 Hz   5:3     48.455 kHz     69.000000 MHz (760 mm x 450 mm)
                 Hfront    0 Hsync  20 Hback  124 Hpol N
                 Vfront    1 Vsync   6 Vback   37 Vpol N
                   f4 1a 00 90 50 00 2c 30 00 14 16 00 f8 c2 21 00 00 18 '....P.,0......!...'
    Display Product Serial Number: ...
    Display Product Name: '32 LCD TV'
    Display Range Limits:
      Monitor ranges (GTF): 47-85 Hz V, 31-80 kHz H, max dotclock 140 MHz
  Extension blocks: 1
Checksum: 0xff

----------------

Block 1, CTA-861 Extension Block:
  Revision: 3
  Basic audio support
  Supports YCbCr 4:4:4
  Supports YCbCr 4:2:2
  Native detailed modes: 5
  Video Data Block:
    VIC   1:   640x480    59.940476 Hz   4:3     31.469 kHz     25.175000 MHz
    VIC  17:   720x576    50.000000 Hz   4:3     31.250 kHz     27.000000 MHz
    VIC  18:   720x576    50.000000 Hz  16:9     31.250 kHz     27.000000 MHz
    VIC  19:  1280x720    50.000000 Hz  16:9     37.500 kHz     74.250000 MHz (native)
    VIC  20:  1920x1080i  50.000000 Hz  16:9     28.125 kHz     74.250000 MHz
    VIC  21:  1440x576i   50.000000 Hz   4:3     15.625 kHz     27.000000 MHz
    VIC  22:  1440x576i   50.000000 Hz  16:9     15.625 kHz     27.000000 MHz
  Audio Data Block:
    Linear PCM:
      Max channels: 2
      Supported sample rates (kHz): 48 44.1 32
      Supported sample sizes (bits): 24 20 16
  Speaker Allocation Data Block:
    FL/FR - Front Left/Right
  Vendor-Specific Data Block (HDMI), OUI 00-0C-03:
    Source physical address: 1.0.0.0
  Detailed Timing Descriptors:
    DTD 2:   720x576    50.055556 Hz   5:4     31.285 kHz     27.030000 MHz (600 mm x 450 mm)
                 Hfront   12 Hsync  64 Hback   68 Hpol N
                 Vfront    5 Vsync   5 Vback   39 Vpol N
    DTD 3:   720x576    50.055556 Hz   5:4     31.285 kHz     27.030000 MHz (760 mm x 450 mm)
                 Hfront   12 Hsync  64 Hback   68 Hpol N
                 Vfront    5 Vsync   5 Vback   39 Vpol N
    DTD 4:  1280x720    50.000000 Hz  16:9     37.500 kHz     74.250000 MHz (760 mm x 450 mm)
                 Hfront  440 Hsync  40 Hback  220 Hpol P
                 Vfront    5 Vsync   5 Vback   20 Vpol P
    DTD 5:  1920x1080i  50.000000 Hz  16:9     28.125 kHz     74.250000 MHz (760 mm x 450 mm)
                 Hfront  528 Hsync  44 Hback  148 Hpol P
                 Vfront    2 Vsync   5 Vback   15 Vpol P Vfront +0.5 Odd Field
                 Vfront    2 Vsync   5 Vback   15 Vpol P Vback  +0.5 Even Field
    DTD 6:   640x480    59.952381 Hz   4:3     31.475 kHz     25.180000 MHz (600 mm x 450 mm)
                 Hfront    8 Hsync  96 Hback   40 Hpol N Hborder 8
                 Vfront    2 Vsync   2 Vback   25 Vpol N Vborder 8
Checksum: 0xb5  Unused space in Extension Block: 11 bytes

----------------

Warnings:

Block 0, Base EDID:
  Vendor & Product Identification: The serial number is one of the known dummy values, it should probably be set to 0.
  Display Product Serial Number: ...
Block 1, CTA-861 Extension Block:
  IT Video Formats are overscanned by default, but normally this should be underscanned.
  Video Data Block: VIC 1 and the first DTD are not identical. Is this intended?
  Video Data Block: All VICs are in ascending order, and the first (preferred) VIC <= 4, is that intended?
  Detailed Timing Descriptor #2: Image size is 600x450 mm, but based on the picture AR it should be 600x480 mm.
  Detailed Timing Descriptor #3: Image size is 760x450 mm, but based on the picture AR it should be 760x608 mm.
  Detailed Timing Descriptor #4: Image size is 760x450 mm, but based on the picture AR it should be 760x427 mm.
  Detailed Timing Descriptor #5: Image size is 760x450 mm, but based on the picture AR it should be 760x427 mm.
  Detailed Timing Descriptor #6: The use of non-zero borders in a DTD is not recommended.
  Display Product Serial Number is set, so the Serial Number in the Base EDID should be 0.
  Add a Colorimetry Data Block with the sRGB colorimetry bit set to avoid interop issues.
EDID:
  Base EDID: Some timings are out of range of the Monitor Ranges:
    Horizontal Freq: 15.625 - 79.976 kHz (Monitor: 31.000 - 80.000 kHz)

Failures:

Block 0, Base EDID:
  Display Product Serial Number: ...
  Basic Display Parameters & Features: EDID 1.3 requires that the first detailed timing is the preferred timing.
  Standard Timings: Use 0x0101 as the invalid Standard Timings code, not 0x01c1.
  Standard Timings: Use 0x0101 as the invalid Standard Timings code, not 0x01c1.
  Detailed Timing Descriptor #1: 0 values in the video timing:
    Horizontal Active/Blanking 1280/144
    Horizontal Frontporch/Sync Width 0/20
    Vertical Active/Blanking 768/44
    Vertical Frontporch/Sync Width 1/6
  Detailed Timing Descriptor #1: 0 or negative horizontal front porch.
Block 1, CTA-861 Extension Block:
  Padding: Contains non-zero bytes.
  Missing VCDB, needed for Set Selectable RGB Quantization to avoid interop issues.
EDID:
  CTA-861: Native progressive timings are a mix of several resolutions.

EDID conformity: FAIL
