edid-decode (hex):

00 ff ff ff ff ff ff 00 41 0c 50 46 15 03 60 86
00 10 01 03 80 1e 17 78 0a b4 43 9e 57 4c 94 26
15 4a 4d bf ee 00 31 d9 31 19 01 01 01 01 01 01
01 01 01 01 01 01 64 19 00 40 41 00 26 30 18 88
36 00 30 e4 10 00 00 18 00 00 00 fd 00 2f 4b 1f
3c 08 00 00 00 00 00 00 00 00 00 00 00 fc 00 50
48 4c 20 31 35 22 58 47 41 54 56 0a 00 00 00 ff
00 00 00 00 00 00 00 00 00 00 00 00 00 00 01 d3

02 03 0c 01 47 01 02 04 05 91 13 14 8c 0a d0 8a
20 e0 2d 10 10 3e 96 00 13 8e 21 00 00 18 8c 0a
d0 90 20 40 31 20 0c 40 55 00 13 8e 21 00 00 18
01 1d 00 bc 52 d0 1e 20 b8 28 55 40 c4 8e 21 00
00 1e 01 1d 00 72 51 d0 1e 20 6e 28 55 00 c4 8e
21 00 00 1e 01 1d 80 d0 72 1c 16 20 10 2c 25 80
c4 8e 21 00 00 9e 01 1d 80 18 71 1c 16 20 58 2c
25 00 c4 8e 21 00 00 9e 00 00 00 00 00 00 00 d4

----------------

Block 0, Base EDID:
  EDID Structure Version & Revision: 1.3
  Vendor & Product Identification:
    Manufacturer: PHL
    Model: 18000
    Serial Number: ...
    Made in: 2006
  Basic Display Parameters & Features:
    Digital display
    Maximum image size: 30 cm x 23 cm
    Gamma: 2.20
    RGB color display
    First detailed timing is the preferred timing
  Color Characteristics:
    Red  : 0.6191, 0.3427
    Green: 0.2978, 0.5781
    Blue : 0.1494, 0.0820
    White: 0.2890, 0.3037
  Established Timings I & II:
    IBM     :   720x400    70.081663 Hz   9:5     31.467 kHz     28.320000 MHz
    DMT 0x04:   640x480    59.940476 Hz   4:3     31.469 kHz     25.175000 MHz
    Apple   :   640x480    66.666667 Hz   4:3     35.000 kHz     30.240000 MHz
    DMT 0x05:   640x480    72.808802 Hz   4:3     37.861 kHz     31.500000 MHz
    DMT 0x06:   640x480    75.000000 Hz   4:3     37.500 kHz     31.500000 MHz
    DMT 0x08:   800x600    56.250000 Hz   4:3     35.156 kHz     36.000000 MHz
    DMT 0x09:   800x600    60.316541 Hz   4:3     37.879 kHz     40.000000 MHz
    DMT 0x0a:   800x600    72.187572 Hz   4:3     48.077 kHz     50.000000 MHz
    DMT 0x0b:   800x600    75.000000 Hz   4:3     46.875 kHz     49.500000 MHz
    Apple   :   832x624    74.551266 Hz   4:3     49.726 kHz     57.284000 MHz
    DMT 0x10:  1024x768    60.003840 Hz   4:3     48.363 kHz     65.000000 MHz
    DMT 0x11:  1024x768    70.069359 Hz   4:3     56.476 kHz     75.000000 MHz
    DMT 0x12:  1024x768    75.028582 Hz   4:3     60.023 kHz     78.750000 MHz
  Standard Timings:
    GTF     :   640x360    85.000000 Hz  16:9     32.215 kHz     25.772000 MHz
    DMT 0x02:   640x400    85.079948 Hz  16:10    37.861 kHz     31.500000 MHz
  Detailed Timing Descriptors:
    DTD 1:  1024x768    60.003840 Hz   4:3     48.363 kHz     65.000000 MHz (304 mm x 228 mm)
                 Hfront   24 Hsync 136 Hback  160 Hpol N
                 Vfront    3 Vsync   6 Vback   29 Vpol N
    Display Range Limits:
      Monitor ranges (GTF): 47-75 Hz V, 31-60 kHz H, max dotclock 80 MHz
    Display Product Name: 'PHL 15"XGATV'
    Display Product Serial Number: ...
  Extension blocks: 1
Checksum: 0xd3

----------------

Block 1, CTA-861 Extension Block:
  Revision: 3
  Native DTDs: 1
  Video Data Block:
    VIC   1:   640x480    59.940476 Hz   4:3     31.469 kHz     25.175000 MHz
    VIC   2:   720x480    59.940060 Hz   4:3     31.469 kHz     27.000000 MHz
    VIC   4:  1280x720    60.000000 Hz  16:9     45.000 kHz     74.250000 MHz
    VIC   5:  1920x1080i  60.000000 Hz  16:9     33.750 kHz     74.250000 MHz
    VIC  17:   720x576    50.000000 Hz   4:3     31.250 kHz     27.000000 MHz (native)
    VIC  19:  1280x720    50.000000 Hz  16:9     37.500 kHz     74.250000 MHz
    VIC  20:  1920x1080i  50.000000 Hz  16:9     28.125 kHz     74.250000 MHz
  Detailed Timing Descriptors:
    DTD 2:   720x480    59.940060 Hz   3:2     31.469 kHz     27.000000 MHz (531 mm x 398 mm)
                 Hfront   16 Hsync  62 Hback   60 Hpol N
                 Vfront    9 Vsync   6 Vback   30 Vpol N
    DTD 3:   720x576    50.000000 Hz   5:4     31.250 kHz     27.000000 MHz (531 mm x 398 mm)
                 Hfront   12 Hsync  64 Hback   68 Hpol N
                 Vfront    5 Vsync   5 Vback   39 Vpol N
    DTD 4:  1280x720    50.000000 Hz  16:9     37.500 kHz     74.250000 MHz (708 mm x 398 mm)
                 Hfront  440 Hsync  40 Hback  220 Hpol P
                 Vfront    5 Vsync   5 Vback   20 Vpol P
    DTD 5:  1280x720    60.000000 Hz  16:9     45.000 kHz     74.250000 MHz (708 mm x 398 mm)
                 Hfront  110 Hsync  40 Hback  220 Hpol P
                 Vfront    5 Vsync   5 Vback   20 Vpol P
    DTD 6:  1920x1080i  50.000000 Hz  16:9     28.125 kHz     74.250000 MHz (708 mm x 398 mm)
                 Hfront  528 Hsync  44 Hback  148 Hpol P
                 Vfront    2 Vsync   5 Vback   15 Vpol P Vfront +0.5 Odd Field
                 Vfront    2 Vsync   5 Vback   15 Vpol P Vback  +0.5 Even Field
    DTD 7:  1920x1080i  60.000000 Hz  16:9     33.750 kHz     74.250000 MHz (708 mm x 398 mm)
                 Hfront   88 Hsync  44 Hback  148 Hpol P
                 Vfront    2 Vsync   5 Vback   15 Vpol P Vfront +0.5 Odd Field
                 Vfront    2 Vsync   5 Vback   15 Vpol P Vback  +0.5 Even Field
Checksum: 0xd4  Unused space in Extension Block: 7 bytes

----------------

Warnings:

Block 1, CTA-861 Extension Block:
  IT Video Formats are overscanned by default, but normally this should be underscanned.
  Video Data Block: VIC 1 and the first DTD are not identical. Is this intended?
  Video Data Block: All VICs are in ascending order, and the first (preferred) VIC <= 4, is that intended?
  Detailed Timing Descriptor #2: Image size is 531x398 mm, but based on the picture AR it should be 531x354 mm.
  Detailed Timing Descriptor #3: Image size is 531x398 mm, but based on the picture AR it should be 497x398 mm.
  Display Product Serial Number is set, so the Serial Number in the Base EDID should be 0.
  Add a Colorimetry Data Block with the sRGB colorimetry bit set to avoid interop issues.
EDID:
  Base EDID: Some timings are out of range of the Monitor Ranges:
    Vertical Freq: 50.000 - 85.080 Hz (Monitor: 47.000 - 75.000 Hz)
    Horizontal Freq: 28.125 - 60.022 kHz (Monitor: 31.000 - 60.000 kHz)

Failures:

Block 0, Base EDID:
  Display Product Serial Number: ...
  Display Range Limits: Byte 11 is 0x00 instead of 0x0a.
  Display Range Limits: Bytes 12-17 must be 0x20.
Block 1, CTA-861 Extension Block:
  Detailed Timing Descriptor #2: Mismatch of image size 531x398 mm vs display size 300x230 mm.
  Detailed Timing Descriptor #3: Mismatch of image size 531x398 mm vs display size 300x230 mm.
  Detailed Timing Descriptor #4: Mismatch of image size 708x398 mm vs display size 300x230 mm.
  Detailed Timing Descriptor #5: Mismatch of image size 708x398 mm vs display size 300x230 mm.
  Detailed Timing Descriptor #6: Mismatch of image size 708x398 mm vs display size 300x230 mm.
  Detailed Timing Descriptor #7: Mismatch of image size 708x398 mm vs display size 300x230 mm.
  Missing VCDB, needed for Set Selectable RGB Quantization to avoid interop issues.
EDID:
  Base EDID: The DTD max image size is 708x398mm, which is larger than the display size 300.0x230.0mm.
  CTA-861: Native progressive timings are a mix of several resolutions.

EDID conformity: FAIL
