edid-decode (hex):

00 ff ff ff ff ff ff 00 30 ae 4b 41 00 00 00 00
00 21 01 04 b5 1e 13 78 02 0c f1 ae 52 3c b9 23
0c 50 54 00 00 00 01 01 01 01 01 01 01 01 01 01
01 01 01 01 01 01 ca fe 40 64 b0 08 18 70 20 08
88 00 2e bc 10 00 00 1b ca fe 40 64 b0 08 38 77
08 20 88 00 2e bc 10 00 00 1b 00 00 00 0f 00 ff
0a 3c ff 0a 3c 27 00 03 4c 83 9f 41 00 00 00 fe
00 41 54 4e 41 34 30 59 4b 32 30 2d 30 20 01 bc

02 03 0f 00 e3 05 80 00 e6 06 05 01 74 60 07 00
00 00 00 00 00 00 00 00 00 00 00 00 00 00 00 00
00 00 00 00 00 00 00 00 00 00 00 00 00 00 00 00
00 00 00 00 00 00 00 00 00 00 00 00 00 00 00 00
00 00 00 00 00 00 00 00 00 00 00 00 00 00 00 00
00 00 00 00 00 00 00 00 00 00 00 00 00 00 00 00
00 00 00 00 00 00 00 00 00 00 00 00 00 00 00 00
00 00 00 00 00 00 00 00 00 00 00 00 00 00 00 b7

00 ff ff ff ff ff ff 00 30 ae 4b 41 00 00 00 00
00 21 01 04 b5 1e 13 78 02 0c f1 ae 52 3c b9 23
0c 50 54 00 00 00 01 01 01 01 01 01 01 01 01 01
01 01 01 01 01 01 ca fe 40 64 b0 08 18 70 20 08
88 00 2e bc 10 00 00 1b ca fe 40 64 b0 08 38 77
08 20 88 00 2e bc 10 00 00 1b 00 00 00 0f 00 ff
0a 3c ff 0a 3c 27 00 03 4c 83 9f 41 00 00 00 fe
00 41 54 4e 41 34 30 59 4b 32 30 2d 30 20 01 bc

02 03 0f 00 e3 05 80 00 e6 06 05 01 74 60 07 00
00 00 00 00 00 00 00 00 00 00 00 00 00 00 00 00
00 00 00 00 00 00 00 00 00 00 00 00 00 00 00 00
00 00 00 00 00 00 00 00 00 00 00 00 00 00 00 00
00 00 00 00 00 00 00 00 00 00 00 00 00 00 00 00
00 00 00 00 00 00 00 00 00 00 00 00 00 00 00 00
00 00 00 00 00 00 00 00 00 00 00 00 00 00 00 00
00 00 00 00 00 00 00 00 00 00 00 00 00 00 00 b7

----------------

Block 0, Base EDID:
  EDID Structure Version & Revision: 1.4
  Vendor & Product Identification:
    Manufacturer: LEN
    Model: 16715
    Made in: 2023
  Basic Display Parameters & Features:
    Digital display
    Bits per primary color channel: 10
    DisplayPort interface
    Maximum image size: 30 cm x 19 cm
    Gamma: 2.20
    Supported color formats: RGB 4:4:4
    First detailed timing includes the native pixel format and preferred refresh rate
  Color Characteristics:
    Red  : 0.6796, 0.3203
    Green: 0.2373, 0.7226
    Blue : 0.1396, 0.0498
    White: 0.3125, 0.3291
  Established Timings I & II: none
  Standard Timings: none
  Detailed Timing Descriptors:
    DTD 1:  2880x1800  119.999558 Hz  16:10   218.879 kHz    652.260000 MHz (302 mm x 188 mm)
                 Hfront   32 Hsync   8 Hback   60 Hpol P
                 Vfront    8 Vsync   8 Vback    8 Vpol N
    DTD 2:  2880x1800   59.999779 Hz  16:10   218.879 kHz    652.260000 MHz (302 mm x 188 mm)
                 Hfront    8 Hsync  32 Hback   60 Hpol P
                 Vfront    8 Vsync   8 Vback 1832 Vpol N
    Manufacturer-Specified Display Descriptor (0x0f): 00 0f 00 ff 0a 3c ff 0a 3c 27 00 03 4c 83 9f 41 '.....<..<'..L..A'
    Alphanumeric Data String: 'ATNA40YK20-0 '
  Extension blocks: 1
Checksum: 0xbc

----------------

Block 1, CTA-861 Extension Block:
  Revision: 3
  Native DTDs: 0
  Colorimetry Data Block:
    BT2020RGB
  HDR Static Metadata Data Block:
    Electro optical transfer functions:
      Traditional gamma - SDR luminance range
      SMPTE ST2084
    Supported static metadata descriptors:
      Static metadata type 1
    Desired content max luminance: 116 (616.884 cd/m^2)
    Desired content max frame-average luminance: 96 (400.000 cd/m^2)
    Desired content min luminance: 7 (0.005 cd/m^2)
Checksum: 0xb7  Unused space in Extension Block: 112 bytes

----------------

Warnings:

Block 0, Base EDID:
  Missing Display Product Name.
Block 1, CTA-861 Extension Block:
  IT Video Formats are overscanned by default, but normally this should be underscanned.
  Colorimetry Data Block: Set the sRGB colorimetry bit to avoid interop issues.

Failures:

Block 0, Base EDID:
  Alphanumeric Data String: No newline, but one or more trailing spaces.
Block 1, CTA-861 Extension Block:
  Required 640x480p60 timings are missing in the established timings and the SVD list (VIC 1).
  Missing VCDB, needed for Set Selectable RGB Quantization to avoid interop issues.
EDID:
  Extension Block 2 started with EDID header, ignoring Extension Blocks >= 2.

EDID conformity: FAIL
