edid-decode (hex):

00 ff ff ff ff ff ff 00 4e 14 01 22 cf 04 00 00
25 11 01 03 81 2f 1e 78 2b a0 d8 a3 53 4a 99 25
0f 47 4a bf ef 80 71 40 81 c0 81 00 81 40 81 80
8b c0 95 00 b3 00 02 3a 80 04 71 38 23 40 58 58
36 00 da 28 11 00 00 1c 00 00 00 fd 00 18 4d 0f
5e 11 00 0a 20 20 20 20 20 20 00 00 00 fc 00 53
63 65 70 74 72 65 0a 20 20 20 20 20 00 00 00 fc
00 58 32 32 57 47 2d 31 30 38 30 50 0a 20 00 2a

----------------

Block 0, Base EDID:
  EDID Structure Version & Revision: 1.3
  Vendor & Product Identification:
    Manufacturer: SPT
    Model: 8705
    Serial Number: ...
    Made in: week 37 of 2007
  Basic Display Parameters & Features:
    Digital display
    DFP 1.x compatible TMDS
    Maximum image size: 47 cm x 30 cm
    Gamma: 2.20
    DPMS levels: Off
    RGB color display
    First detailed timing is the preferred timing
    Supports GTF timings within operating range
  Color Characteristics:
    Red  : 0.6386, 0.3261
    Green: 0.2890, 0.5976
    Blue : 0.1474, 0.0595
    White: 0.2792, 0.2890
  Established Timings I & II:
    IBM     :   720x400    70.081663 Hz   9:5     31.467 kHz     28.320000 MHz
    DMT 0x04:   640x480    59.940476 Hz   4:3     31.469 kHz     25.175000 MHz
    Apple   :   640x480    66.666667 Hz   4:3     35.000 kHz     30.240000 MHz
    DMT 0x05:   640x480    72.808802 Hz   4:3     37.861 kHz     31.500000 MHz
    DMT 0x06:   640x480    75.000000 Hz   4:3     37.500 kHz     31.500000 MHz
    DMT 0x08:   800x600    56.250000 Hz   4:3     35.156 kHz     36.000000 MHz
    DMT 0x09:   800x600    60.316541 Hz   4:3     37.879 kHz     40.000000 MHz
    DMT 0x0a:   800x600    72.187572 Hz   4:3     48.077 kHz     50.000000 MHz
    DMT 0x0b:   800x600    75.000000 Hz   4:3     46.875 kHz     49.500000 MHz
    Apple   :   832x624    74.551266 Hz   4:3     49.726 kHz     57.284000 MHz
    DMT 0x10:  1024x768    60.003840 Hz   4:3     48.363 kHz     65.000000 MHz
    DMT 0x11:  1024x768    70.069359 Hz   4:3     56.476 kHz     75.000000 MHz
    DMT 0x12:  1024x768    75.028582 Hz   4:3     60.023 kHz     78.750000 MHz
    DMT 0x24:  1280x1024   75.024675 Hz   5:4     79.976 kHz    135.000000 MHz
    Apple   :  1152x870    75.061550 Hz 192:145   68.681 kHz    100.000000 MHz
  Standard Timings:
    GTF     :  1152x864    60.000000 Hz   4:3     53.700 kHz     81.624000 MHz
    DMT 0x55:  1280x720    60.000000 Hz  16:9     45.000 kHz     74.250000 MHz
    DMT 0x1c:  1280x800    59.810326 Hz  16:10    49.702 kHz     83.500000 MHz
    DMT 0x20:  1280x960    60.000000 Hz   4:3     60.000 kHz    108.000000 MHz
    DMT 0x23:  1280x1024   60.019740 Hz   5:4     63.981 kHz    108.000000 MHz
    GTF     :  1360x765    60.000341 Hz  16:9     47.520 kHz     84.396000 MHz
    DMT 0x2f:  1440x900    59.887445 Hz  16:10    55.935 kHz    106.500000 MHz
    DMT 0x3a:  1680x1050   59.954250 Hz  16:10    65.290 kHz    146.250000 MHz
  Detailed Timing Descriptors:
    DTD 1:  1920x1080   61.093512 Hz  16:9     68.119 kHz    148.500000 MHz (474 mm x 296 mm)
                 Hfront   88 Hsync  88 Hback   84 Hpol N
                 Vfront    3 Vsync   6 Vback   26 Vpol P
    Display Range Limits:
      Monitor ranges (GTF): 24-77 Hz V, 15-94 kHz H, max dotclock 170 MHz
    Display Product Name: 'Sceptre'
    Display Product Name: 'X22WG-1080P'
Checksum: 0x2a

----------------

Warnings:

Block 0, Base EDID:
  Standard Timings: Standard Timing 1360x765 has a dubious odd vertical resolution.
  Detailed Timing Descriptor #1: Image size is 474x296 mm, but based on the picture AR it should be 474x266 mm.

EDID conformity: PASS
