edid-decode (hex):

00 ff ff ff ff ff ff 00 4d 79 89 08 00 00 00 00
28 1a 01 03 80 3c 22 78 2a 73 a1 a4 54 4d 99 26
0f 50 54 bf ef 80 81 c0 81 00 d1 00 b3 00 d1 c0
e1 c0 d1 40 01 00 56 5e 00 a0 a0 a0 29 50 30 20
35 00 5f 59 21 00 00 1e 02 3a 80 18 71 38 2d 40
58 2c 45 00 55 50 21 00 00 1e 00 00 00 fd 00 38
4b 1e 51 11 00 0a 20 20 20 20 20 20 00 00 00 fc
00 53 6b 79 77 6f 72 74 68 0a 20 20 20 20 01 8a

02 03 1c f1 47 81 02 04 10 11 13 1f 23 09 07 07
83 01 00 00 67 03 0c 00 10 00 b8 3c 01 1d 00 bc
52 d0 1e 20 b8 28 55 40 55 50 21 00 00 1e 66 21
50 b0 51 00 1b 30 70 40 36 00 6d 55 21 00 00 18
56 5e 00 a0 a0 a0 29 50 30 20 35 00 6d 55 21 00
00 18 02 3a 80 d0 72 38 2d 40 10 2c 45 80 55 50
21 00 00 1e 00 00 00 00 00 00 00 00 00 00 00 00
00 00 00 00 00 00 00 00 00 00 00 00 00 00 00 e9

00 ff ff ff ff ff ff 00 4d 79 89 08 00 00 00 00
28 1a 01 03 80 3c 22 78 2a 73 a1 a4 54 4d 99 26
0f 50 54 bf ef 80 81 c0 81 00 d1 00 b3 00 d1 c0
e1 c0 d1 40 01 00 56 5e 00 a0 a0 a0 29 50 30 20
35 00 5f 59 21 00 00 1e 02 3a 80 18 71 38 2d 40
58 2c 45 00 55 50 21 00 00 1e 00 00 00 fd 00 38
4b 1e 51 11 00 0a 20 20 20 20 20 20 00 00 00 fc
00 53 6b 79 77 6f 72 74 68 0a 20 20 20 20 01 8a

02 03 1c f1 47 81 02 04 10 11 13 1f 23 09 07 07
83 01 00 00 67 03 0c 00 10 00 b8 3c 01 1d 00 bc
52 d0 1e 20 b8 28 55 40 55 50 21 00 00 1e 66 21
50 b0 51 00 1b 30 70 40 36 00 6d 55 21 00 00 18
56 5e 00 a0 a0 a0 29 50 30 20 35 00 6d 55 21 00
00 18 02 3a 80 d0 72 38 2d 40 10 2c 45 80 55 50
21 00 00 1e 00 00 00 00 00 00 00 00 00 00 00 00
00 00 00 00 00 00 00 00 00 00 00 00 00 00 00 e9

----------------

Block 0, Base EDID:
  EDID Structure Version & Revision: 1.3
  Vendor & Product Identification:
    Manufacturer: SKY
    Model: 2185
    Made in: week 40 of 2016
  Basic Display Parameters & Features:
    Digital display
    Maximum image size: 60 cm x 34 cm
    Gamma: 2.20
    DPMS levels: Off
    RGB color display
    First detailed timing is the preferred timing
  Color Characteristics:
    Red  : 0.6416, 0.3310
    Green: 0.3007, 0.6005
    Blue : 0.1503, 0.0605
    White: 0.3125, 0.3291
  Established Timings I & II:
    IBM     :   720x400    70.081663 Hz   9:5     31.467 kHz     28.320000 MHz
    DMT 0x04:   640x480    59.940476 Hz   4:3     31.469 kHz     25.175000 MHz
    Apple   :   640x480    66.666667 Hz   4:3     35.000 kHz     30.240000 MHz
    DMT 0x05:   640x480    72.808802 Hz   4:3     37.861 kHz     31.500000 MHz
    DMT 0x06:   640x480    75.000000 Hz   4:3     37.500 kHz     31.500000 MHz
    DMT 0x08:   800x600    56.250000 Hz   4:3     35.156 kHz     36.000000 MHz
    DMT 0x09:   800x600    60.316541 Hz   4:3     37.879 kHz     40.000000 MHz
    DMT 0x0a:   800x600    72.187572 Hz   4:3     48.077 kHz     50.000000 MHz
    DMT 0x0b:   800x600    75.000000 Hz   4:3     46.875 kHz     49.500000 MHz
    Apple   :   832x624    74.551266 Hz   4:3     49.726 kHz     57.284000 MHz
    DMT 0x10:  1024x768    60.003840 Hz   4:3     48.363 kHz     65.000000 MHz
    DMT 0x11:  1024x768    70.069359 Hz   4:3     56.476 kHz     75.000000 MHz
    DMT 0x12:  1024x768    75.028582 Hz   4:3     60.023 kHz     78.750000 MHz
    DMT 0x24:  1280x1024   75.024675 Hz   5:4     79.976 kHz    135.000000 MHz
    Apple   :  1152x870    75.061550 Hz 192:145   68.681 kHz    100.000000 MHz
  Standard Timings:
    DMT 0x55:  1280x720    60.000000 Hz  16:9     45.000 kHz     74.250000 MHz
    DMT 0x1c:  1280x800    59.810326 Hz  16:10    49.702 kHz     83.500000 MHz
    DMT 0x45:  1920x1200   59.884600 Hz  16:10    74.556 kHz    193.250000 MHz
    DMT 0x3a:  1680x1050   59.954250 Hz  16:10    65.290 kHz    146.250000 MHz
    DMT 0x52:  1920x1080   60.000000 Hz  16:9     67.500 kHz    148.500000 MHz
    DMT 0x54:  2048x1152   60.000000 Hz  16:9     72.000 kHz    162.000000 MHz (RB)
    DMT 0x49:  1920x1440   60.000000 Hz   4:3     90.000 kHz    234.000000 MHz
  Detailed Timing Descriptors:
    DTD 1:  2560x1440   59.950550 Hz  16:9     88.787 kHz    241.500000 MHz (607 mm x 345 mm)
                 Hfront   48 Hsync  32 Hback   80 Hpol P
                 Vfront    3 Vsync   5 Vback   33 Vpol P
    DTD 2:  1920x1080   60.000000 Hz  16:9     67.500 kHz    148.500000 MHz (597 mm x 336 mm)
                 Hfront   88 Hsync  44 Hback  148 Hpol P
                 Vfront    4 Vsync   5 Vback   36 Vpol P
    Display Range Limits:
      Monitor ranges (GTF): 56-75 Hz V, 30-81 kHz H, max dotclock 170 MHz
    Display Product Name: 'Skyworth'
  Extension blocks: 1
Checksum: 0x8a

----------------

Block 1, CTA-861 Extension Block:
  Revision: 3
  Underscans IT Video Formats by default
  Basic audio support
  Supports YCbCr 4:4:4
  Supports YCbCr 4:2:2
  Native DTDs: 1
  Video Data Block:
    VIC   1:   640x480    59.940476 Hz   4:3     31.469 kHz     25.175000 MHz (native)
    VIC   2:   720x480    59.940060 Hz   4:3     31.469 kHz     27.000000 MHz
    VIC   4:  1280x720    60.000000 Hz  16:9     45.000 kHz     74.250000 MHz
    VIC  16:  1920x1080   60.000000 Hz  16:9     67.500 kHz    148.500000 MHz
    VIC  17:   720x576    50.000000 Hz   4:3     31.250 kHz     27.000000 MHz
    VIC  19:  1280x720    50.000000 Hz  16:9     37.500 kHz     74.250000 MHz
    VIC  31:  1920x1080   50.000000 Hz  16:9     56.250 kHz    148.500000 MHz
  Audio Data Block:
    Linear PCM:
      Max channels: 2
      Supported sample rates (kHz): 48 44.1 32
      Supported sample sizes (bits): 24 20 16
  Speaker Allocation Data Block:
    FL/FR - Front Left/Right
  Vendor-Specific Data Block (HDMI), OUI 00-0C-03:
    Source physical address: 1.0.0.0
    Supports_AI
    DC_36bit
    DC_30bit
    DC_Y444
    Maximum TMDS clock: 300 MHz
  Detailed Timing Descriptors:
    DTD 3:  1280x720    50.000000 Hz  16:9     37.500 kHz     74.250000 MHz (597 mm x 336 mm)
                 Hfront  440 Hsync  40 Hback  220 Hpol P
                 Vfront    5 Vsync   5 Vback   20 Vpol P
    DTD 4:  1360x768    60.015162 Hz  85:48    47.712 kHz     85.500000 MHz (621 mm x 341 mm)
                 Hfront  112 Hsync  64 Hback  256 Hpol N
                 Vfront    3 Vsync   6 Vback   18 Vpol N
    DTD 5:  2560x1440   59.950550 Hz  16:9     88.787 kHz    241.500000 MHz (621 mm x 341 mm)
                 Hfront   48 Hsync  32 Hback   80 Hpol N
                 Vfront    3 Vsync   5 Vback   33 Vpol N
    DTD 6:  1920x1080   50.000000 Hz  16:9     56.250 kHz    148.500000 MHz (597 mm x 336 mm)
                 Hfront  528 Hsync  44 Hback  148 Hpol P
                 Vfront    4 Vsync   5 Vback   36 Vpol P
Checksum: 0xe9  Unused space in Extension Block: 27 bytes

----------------

Warnings:

Block 1, CTA-861 Extension Block:
  Video Data Block: VIC 1 and the first DTD are not identical. Is this intended?
  Video Data Block: All VICs are in ascending order, and the first (preferred) VIC <= 4, is that intended?
  Detailed Timing Descriptor #4: DTD is similar but not identical to DMT 0x27.
  Add a Colorimetry Data Block with the sRGB colorimetry bit set to avoid interop issues.
EDID:
  Base EDID: Some timings are out of range of the Monitor Ranges:
    Vertical Freq: 50.000 - 75.062 Hz (Monitor: 56.000 - 75.000 Hz)
    Horizontal Freq: 31.250 - 90.000 kHz (Monitor: 30.000 - 81.000 kHz)
    Maximum Clock: 241.500 MHz (Monitor: 170.000 MHz)

Failures:

Block 0, Base EDID:
  Standard Timings: Use 0x0101 as the invalid Standard Timings code, not 0x0100.
Block 1, CTA-861 Extension Block:
  Detailed Timing Descriptor #4: Mismatch of image size 621x341 mm vs display size 600x340 mm.
  Detailed Timing Descriptor #5: Mismatch of image size 621x341 mm vs display size 600x340 mm.
  Missing VCDB, needed for Set Selectable RGB Quantization to avoid interop issues.
EDID:
  Extension Block 2 started with EDID header, ignoring Extension Blocks >= 2.
  Base EDID: The DTD max image size is 621x345mm, which is larger than the display size 600.0x340.0mm.
  CTA-861: Native progressive timings are a mix of several resolutions.

EDID conformity: FAIL
