edid-decode (hex):

00 ff ff ff ff ff ff 00 15 8f 42 22 80 7b 01 00
19 16 01 03 6e 2f 1d 78 ee b5 45 a5 56 4a 9a 25
12 50 54 bf eb 00 81 80 a9 40 8b c0 81 05 01 01
01 01 01 01 01 01 7c 2e 90 a0 60 1a 1e 40 30 20
36 00 d9 28 11 00 00 1a 68 29 a0 d0 51 84 22 30
50 98 36 00 98 ff 10 00 00 1c 00 00 00 fc 00 45
6c 6f 20 32 32 34 32 20 56 47 41 0a 00 00 00 fd
00 38 4b 1e 4b 10 00 0a 20 20 20 20 20 20 00 50

00 ff ff ff ff ff ff 00 15 8f 42 22 80 7b 01 00
19 16 01 03 6e 2f 1d 78 ee b5 45 a5 56 4a 9a 25
12 50 54 bf eb 00 81 80 a9 40 8b c0 81 05 01 01
01 01 01 01 01 01 7c 2e 90 a0 60 1a 1e 40 30 20
36 00 d9 28 11 00 00 1a 68 29 a0 d0 51 84 22 30
50 98 36 00 98 ff 10 00 00 1c 00 00 00 fc 00 45
6c 6f 20 32 32 34 32 20 56 47 41 0a 00 00 00 fd
00 38 4b 1e 4b 10 00 0a 20 20 20 20 20 20 00 50

----------------

Block 0, Base EDID:
  EDID Structure Version & Revision: 1.3
  Vendor & Product Identification:
    Manufacturer: ELO
    Model: 8770
    Serial Number: ...
    Made in: week 25 of 2012
  Basic Display Parameters & Features:
    Analog display
    Signal Level Standard: 0.700 : 0.000 : 0.700 V p-p
    Blank level equals black level
    Sync: Separate Composite SyncOnGreen
    Maximum image size: 47 cm x 29 cm
    Gamma: 2.20
    DPMS levels: Standby Suspend Off
    RGB color display
    Default (sRGB) color space is primary color space
    First detailed timing is the preferred timing
  Color Characteristics:
    Red  : 0.6464, 0.3388
    Green: 0.2900, 0.6025
    Blue : 0.1455, 0.0703
    White: 0.3134, 0.3291
  Established Timings I & II:
    IBM     :   720x400    70.081663 Hz   9:5     31.467 kHz     28.320000 MHz
    DMT 0x04:   640x480    59.940476 Hz   4:3     31.469 kHz     25.175000 MHz
    Apple   :   640x480    66.666667 Hz   4:3     35.000 kHz     30.240000 MHz
    DMT 0x05:   640x480    72.808802 Hz   4:3     37.861 kHz     31.500000 MHz
    DMT 0x06:   640x480    75.000000 Hz   4:3     37.500 kHz     31.500000 MHz
    DMT 0x08:   800x600    56.250000 Hz   4:3     35.156 kHz     36.000000 MHz
    DMT 0x09:   800x600    60.316541 Hz   4:3     37.879 kHz     40.000000 MHz
    DMT 0x0a:   800x600    72.187572 Hz   4:3     48.077 kHz     50.000000 MHz
    DMT 0x0b:   800x600    75.000000 Hz   4:3     46.875 kHz     49.500000 MHz
    Apple   :   832x624    74.551266 Hz   4:3     49.726 kHz     57.284000 MHz
    DMT 0x10:  1024x768    60.003840 Hz   4:3     48.363 kHz     65.000000 MHz
    DMT 0x12:  1024x768    75.028582 Hz   4:3     60.023 kHz     78.750000 MHz
    DMT 0x24:  1280x1024   75.024675 Hz   5:4     79.976 kHz    135.000000 MHz
  Standard Timings:
    DMT 0x23:  1280x1024   60.019740 Hz   5:4     63.981 kHz    108.000000 MHz
    DMT 0x33:  1600x1200   60.000000 Hz   4:3     75.000 kHz    162.000000 MHz
    GTF     :  1360x765    60.000341 Hz  16:9     47.520 kHz     84.396000 MHz
    GTF     :  1280x800    64.999688 Hz  16:10    54.015 kHz     91.609000 MHz
  Detailed Timing Descriptors:
    DTD 1:  1680x1050   59.883253 Hz  16:10    64.674 kHz    119.000000 MHz (473 mm x 296 mm)
                 Hfront   48 Hsync  32 Hback   80 Hpol P
                 Vfront    3 Vsync   6 Vback   21 Vpol N
    DTD 2:  1440x900    59.606284 Hz  16:10    55.672 kHz    106.000000 MHz (408 mm x 255 mm)
                 Hfront   80 Hsync 152 Hback  232 Hpol N
                 Vfront    3 Vsync   6 Vback   25 Vpol P
    Display Product Name: 'Elo 2242 VGA'
    Display Range Limits:
      Monitor ranges (GTF): 56-75 Hz V, 30-75 kHz H, max dotclock 160 MHz
Checksum: 0x50

----------------

Warnings:

Block 0, Base EDID:
  Standard Timings: Standard Timing 1360x765 has a dubious odd vertical resolution.
EDID:
  Base EDID: Some timings are out of range of the Monitor Ranges:
    Horizontal Freq: 31.466 - 79.976 kHz (Monitor: 30.000 - 75.000 kHz)
    Maximum Clock: 162.000 MHz (Monitor: 160.000 MHz)

Failures:

Block 0, Base EDID:
  Basic Display Parameters & Features: sRGB is signaled, but the chromaticities do not match.
  Detailed Timing Descriptor #2: Mismatch of image size 408x255 mm vs display size 470x290 mm.
EDID:
  Extension Block 1 started with EDID header, ignoring Extension Blocks >= 1.

EDID conformity: FAIL
