edid-decode (hex):

00 ff ff ff ff ff ff 00 4c 2d 5d 0e 36 30 53 30
2e 1c 01 03 80 78 22 78 2a cf f5 ae 4f 45 a8 26
0e 50 54 bf ef 80 71 4f 81 c0 81 00 81 80 95 00
a9 c0 b3 00 01 01 5a 87 80 a0 70 38 4d 40 30 20
35 00 ac 50 41 00 00 1a 00 00 00 fd 00 32 90 1e
aa 23 00 0a 20 20 20 20 20 20 00 00 00 fc 00 43
34 39 48 47 39 78 0a 20 20 20 20 20 00 00 00 ff
00 48 54 4a 4b 42 30 30 30 35 32 0a 20 20 01 75

02 03 25 f1 48 90 04 1f 13 03 12 3f 40 23 09 07
07 83 01 00 00 67 03 0c 00 10 00 b8 3c 67 d8 5d
c4 01 6a 80 00 02 3a 80 d0 72 38 2d 40 10 2c 45
80 ac 50 41 00 00 1e 01 1d 00 72 51 d0 1e 20 6e
28 55 00 ac 50 41 00 00 1e 01 1d 00 bc 52 d0 1e
20 b8 28 55 40 ac 50 41 00 00 1e 8c 0a d0 8a 20
e0 2d 10 10 3e 96 00 ac 50 41 00 00 18 8c 0a d0
90 20 40 31 20 0c 40 55 00 ac 50 41 00 00 18 7f

00 ff ff ff ff ff ff 00 4c 2d 5d 0e 36 30 53 30
2e 1c 01 03 80 78 22 78 2a cf f5 ae 4f 45 a8 26
0e 50 54 bf ef 80 71 4f 81 c0 81 00 81 80 95 00
a9 c0 b3 00 01 01 5a 87 80 a0 70 38 4d 40 30 20
35 00 ac 50 41 00 00 1a 00 00 00 fd 00 32 90 1e
aa 23 00 0a 20 20 20 20 20 20 00 00 00 fc 00 43
34 39 48 47 39 78 0a 20 20 20 20 20 00 00 00 ff
00 48 54 4a 4b 42 30 30 30 35 32 0a 20 20 01 75

02 03 25 f1 48 90 04 1f 13 03 12 3f 40 23 09 07
07 83 01 00 00 67 03 0c 00 10 00 b8 3c 67 d8 5d
c4 01 6a 80 00 02 3a 80 d0 72 38 2d 40 10 2c 45
80 ac 50 41 00 00 1e 01 1d 00 72 51 d0 1e 20 6e
28 55 00 ac 50 41 00 00 1e 01 1d 00 bc 52 d0 1e
20 b8 28 55 40 ac 50 41 00 00 1e 8c 0a d0 8a 20
e0 2d 10 10 3e 96 00 ac 50 41 00 00 18 8c 0a d0
90 20 40 31 20 0c 40 55 00 ac 50 41 00 00 18 7f

----------------

Block 0, Base EDID:
  EDID Structure Version & Revision: 1.3
  Vendor & Product Identification:
    Manufacturer: SAM
    Model: 3677
    Serial Number: ...
    Made in: week 46 of 2018
  Basic Display Parameters & Features:
    Digital display
    Maximum image size: 120 cm x 34 cm
    Gamma: 2.20
    DPMS levels: Off
    RGB color display
    First detailed timing is the preferred timing
  Color Characteristics:
    Red  : 0.6826, 0.3085
    Green: 0.2724, 0.6591
    Blue : 0.1513, 0.0576
    White: 0.3134, 0.3291
  Established Timings I & II:
    IBM     :   720x400    70.081663 Hz   9:5     31.467 kHz     28.320000 MHz
    DMT 0x04:   640x480    59.940476 Hz   4:3     31.469 kHz     25.175000 MHz
    Apple   :   640x480    66.666667 Hz   4:3     35.000 kHz     30.240000 MHz
    DMT 0x05:   640x480    72.808802 Hz   4:3     37.861 kHz     31.500000 MHz
    DMT 0x06:   640x480    75.000000 Hz   4:3     37.500 kHz     31.500000 MHz
    DMT 0x08:   800x600    56.250000 Hz   4:3     35.156 kHz     36.000000 MHz
    DMT 0x09:   800x600    60.316541 Hz   4:3     37.879 kHz     40.000000 MHz
    DMT 0x0a:   800x600    72.187572 Hz   4:3     48.077 kHz     50.000000 MHz
    DMT 0x0b:   800x600    75.000000 Hz   4:3     46.875 kHz     49.500000 MHz
    Apple   :   832x624    74.551266 Hz   4:3     49.726 kHz     57.284000 MHz
    DMT 0x10:  1024x768    60.003840 Hz   4:3     48.363 kHz     65.000000 MHz
    DMT 0x11:  1024x768    70.069359 Hz   4:3     56.476 kHz     75.000000 MHz
    DMT 0x12:  1024x768    75.028582 Hz   4:3     60.023 kHz     78.750000 MHz
    DMT 0x24:  1280x1024   75.024675 Hz   5:4     79.976 kHz    135.000000 MHz
    Apple   :  1152x870    75.061550 Hz 192:145   68.681 kHz    100.000000 MHz
  Standard Timings:
    DMT 0x15:  1152x864    75.000000 Hz   4:3     67.500 kHz    108.000000 MHz
    DMT 0x55:  1280x720    60.000000 Hz  16:9     45.000 kHz     74.250000 MHz
    DMT 0x1c:  1280x800    59.810326 Hz  16:10    49.702 kHz     83.500000 MHz
    DMT 0x23:  1280x1024   60.019740 Hz   5:4     63.981 kHz    108.000000 MHz
    DMT 0x2f:  1440x900    59.887445 Hz  16:10    55.935 kHz    106.500000 MHz
    DMT 0x53:  1600x900    60.000000 Hz  16:9     60.000 kHz    108.000000 MHz (RB)
    DMT 0x3a:  1680x1050   59.954250 Hz  16:10    65.290 kHz    146.250000 MHz
  Detailed Timing Descriptors:
    DTD  1:  1920x1080  143.981451 Hz  16:9    166.587 kHz    346.500000 MHz (1196 mm x 336 mm)
                  Hfront   48 Hsync  32 Hback   80 Hpol P
                  Vfront    3 Vsync   5 Vback   69 Vpol N
    Display Range Limits:
      Monitor ranges (GTF): 50-144 Hz V, 30-170 kHz H, max dotclock 350 MHz
    Display Product Name: 'C49HG9x'
    Display Product Serial Number: ...
  Extension blocks: 1
Checksum: 0x75

----------------

Block 1, CTA-861 Extension Block:
  Revision: 3
  Underscans IT Video Formats by default
  Basic audio support
  Supports YCbCr 4:4:4
  Supports YCbCr 4:2:2
  Native detailed modes: 1
  Video Data Block:
    VIC  16:  1920x1080   60.000000 Hz  16:9     67.500 kHz    148.500000 MHz (native)
    VIC   4:  1280x720    60.000000 Hz  16:9     45.000 kHz     74.250000 MHz
    VIC  31:  1920x1080   50.000000 Hz  16:9     56.250 kHz    148.500000 MHz
    VIC  19:  1280x720    50.000000 Hz  16:9     37.500 kHz     74.250000 MHz
    VIC   3:   720x480    59.940060 Hz  16:9     31.469 kHz     27.000000 MHz
    VIC  18:   720x576    50.000000 Hz  16:9     31.250 kHz     27.000000 MHz
    VIC  63:  1920x1080  120.000000 Hz  16:9    135.000 kHz    297.000000 MHz
    VIC  64:  1920x1080  100.000000 Hz  16:9    112.500 kHz    297.000000 MHz
  Audio Data Block:
    Linear PCM:
      Max channels: 2
      Supported sample rates (kHz): 48 44.1 32
      Supported sample sizes (bits): 24 20 16
  Speaker Allocation Data Block:
    FL/FR - Front Left/Right
  Vendor-Specific Data Block (HDMI), OUI 00-0C-03:
    Source physical address: 1.0.0.0
    Supports_AI
    DC_36bit
    DC_30bit
    DC_Y444
    Maximum TMDS clock: 300 MHz
  Vendor-Specific Data Block (HDMI Forum), OUI C4-5D-D8:
    Version: 1
    Maximum TMDS Character Rate: 530 MHz
    SCDC Present
  Detailed Timing Descriptors:
    DTD  2:  1920x1080   50.000000 Hz  16:9     56.250 kHz    148.500000 MHz (1196 mm x 336 mm)
                  Hfront  528 Hsync  44 Hback  148 Hpol P
                  Vfront    4 Vsync   5 Vback   36 Vpol P
    DTD  3:  1280x720    60.000000 Hz  16:9     45.000 kHz     74.250000 MHz (1196 mm x 336 mm)
                  Hfront  110 Hsync  40 Hback  220 Hpol P
                  Vfront    5 Vsync   5 Vback   20 Vpol P
    DTD  4:  1280x720    50.000000 Hz  16:9     37.500 kHz     74.250000 MHz (1196 mm x 336 mm)
                  Hfront  440 Hsync  40 Hback  220 Hpol P
                  Vfront    5 Vsync   5 Vback   20 Vpol P
    DTD  5:   720x480    59.940060 Hz   3:2     31.469 kHz     27.000000 MHz (1196 mm x 336 mm)
                  Hfront   16 Hsync  62 Hback   60 Hpol N
                  Vfront    9 Vsync   6 Vback   30 Vpol N
    DTD  6:   720x576    50.000000 Hz   5:4     31.250 kHz     27.000000 MHz (1196 mm x 336 mm)
                  Hfront   12 Hsync  64 Hback   68 Hpol N
                  Vfront    5 Vsync   5 Vback   39 Vpol N
Checksum: 0x7f

----------------

Block 2, Unknown EDID Extension Block 0x00:
  00 ff ff ff ff ff ff 00 4c 2d 5d 0e 36 30 53 30 '........L-].60S0'
  2e 1c 01 03 80 78 22 78 2a cf f5 ae 4f 45 a8 26 '.....x"x*...OE.&'
  0e 50 54 bf ef 80 71 4f 81 c0 81 00 81 80 95 00 '.PT...qO........'
  a9 c0 b3 00 01 01 5a 87 80 a0 70 38 4d 40 30 20 '......Z...p8M@0 '
  35 00 ac 50 41 00 00 1a 00 00 00 fd 00 32 90 1e '5..PA........2..'
  aa 23 00 0a 20 20 20 20 20 20 00 00 00 fc 00 43 '.#..      .....C'
  34 39 48 47 39 78 0a 20 20 20 20 20 00 00 00 ff '49HG9x.     ....'
  00 48 54 4a 4b 42 30 30 30 35 32 0a 20 20 01 75 '.HTJKB00052.  .u'
Checksum: 0x75

----------------

Block 3, CTA-861 Extension Block:
  Revision: 3
  Underscans IT Video Formats by default
  Basic audio support
  Supports YCbCr 4:4:4
  Supports YCbCr 4:2:2
  Native detailed modes: 1
  Video Data Block:
    VIC  16:  1920x1080   60.000000 Hz  16:9     67.500 kHz    148.500000 MHz (native)
    VIC   4:  1280x720    60.000000 Hz  16:9     45.000 kHz     74.250000 MHz
    VIC  31:  1920x1080   50.000000 Hz  16:9     56.250 kHz    148.500000 MHz
    VIC  19:  1280x720    50.000000 Hz  16:9     37.500 kHz     74.250000 MHz
    VIC   3:   720x480    59.940060 Hz  16:9     31.469 kHz     27.000000 MHz
    VIC  18:   720x576    50.000000 Hz  16:9     31.250 kHz     27.000000 MHz
    VIC  63:  1920x1080  120.000000 Hz  16:9    135.000 kHz    297.000000 MHz
    VIC  64:  1920x1080  100.000000 Hz  16:9    112.500 kHz    297.000000 MHz
  Audio Data Block:
    Linear PCM:
      Max channels: 2
      Supported sample rates (kHz): 48 44.1 32
      Supported sample sizes (bits): 24 20 16
  Speaker Allocation Data Block:
    FL/FR - Front Left/Right
  Vendor-Specific Data Block (HDMI), OUI 00-0C-03:
    Source physical address: 1.0.0.0
    Supports_AI
    DC_36bit
    DC_30bit
    DC_Y444
    Maximum TMDS clock: 300 MHz
  Vendor-Specific Data Block (HDMI Forum), OUI C4-5D-D8:
    Version: 1
    Maximum TMDS Character Rate: 530 MHz
    SCDC Present
  Detailed Timing Descriptors:
    DTD  7:  1920x1080   50.000000 Hz  16:9     56.250 kHz    148.500000 MHz (1196 mm x 336 mm)
                  Hfront  528 Hsync  44 Hback  148 Hpol P
                  Vfront    4 Vsync   5 Vback   36 Vpol P
    DTD  8:  1280x720    60.000000 Hz  16:9     45.000 kHz     74.250000 MHz (1196 mm x 336 mm)
                  Hfront  110 Hsync  40 Hback  220 Hpol P
                  Vfront    5 Vsync   5 Vback   20 Vpol P
    DTD  9:  1280x720    50.000000 Hz  16:9     37.500 kHz     74.250000 MHz (1196 mm x 336 mm)
                  Hfront  440 Hsync  40 Hback  220 Hpol P
                  Vfront    5 Vsync   5 Vback   20 Vpol P
    DTD 10:   720x480    59.940060 Hz   3:2     31.469 kHz     27.000000 MHz (1196 mm x 336 mm)
                  Hfront   16 Hsync  62 Hback   60 Hpol N
                  Vfront    9 Vsync   6 Vback   30 Vpol N
    DTD 11:   720x576    50.000000 Hz   5:4     31.250 kHz     27.000000 MHz (1196 mm x 336 mm)
                  Hfront   12 Hsync  64 Hback   68 Hpol N
                  Vfront    5 Vsync   5 Vback   39 Vpol N
Checksum: 0x7f

----------------

Warnings:

Block 0, Base EDID:
  Detailed Timing Descriptor #1: Image size is 1196x336 mm, but based on the picture AR it should be 1196x672 mm.
Block 1, CTA-861 Extension Block:
  Video Data Block: VIC 16 and the first DTD are not identical. Is this intended?
  Detailed Timing Descriptor #2: Image size is 1196x336 mm, but based on the picture AR it should be 1196x672 mm.
  Detailed Timing Descriptor #3: Image size is 1196x336 mm, but based on the picture AR it should be 1196x672 mm.
  Detailed Timing Descriptor #4: Image size is 1196x336 mm, but based on the picture AR it should be 1196x672 mm.
  Detailed Timing Descriptor #5: Image size is 1196x336 mm, but based on the picture AR it should be 1196x797 mm.
  Detailed Timing Descriptor #6: Image size is 1196x336 mm, but based on the picture AR it should be 1196x956 mm.
  Display Product Serial Number is set, so the Serial Number in the Base EDID should be 0.
  Add a Colorimetry Data Block with the sRGB colorimetry bit set to avoid interop issues.
Block 3, CTA-861 Extension Block:
  Detailed Timing Descriptor #7: Image size is 1196x336 mm, but based on the picture AR it should be 1196x672 mm.
  Detailed Timing Descriptor #8: Image size is 1196x336 mm, but based on the picture AR it should be 1196x672 mm.
  Detailed Timing Descriptor #9: Image size is 1196x336 mm, but based on the picture AR it should be 1196x672 mm.
  Detailed Timing Descriptor #10: Image size is 1196x336 mm, but based on the picture AR it should be 1196x797 mm.
  Detailed Timing Descriptor #11: Image size is 1196x336 mm, but based on the picture AR it should be 1196x956 mm.
EDID:
  CTA-861: Multiple native progressive timings are defined.

Failures:

Block 1, CTA-861 Extension Block:
  Missing VCDB, needed for Set Selectable RGB Quantization to avoid interop issues.
Block 2, Base EDID:
  Unknown Extension Block.
Block 3, CTA-861 Extension Block:
  Video Data Block: Duplicate VIC 16.
  Video Data Block: Duplicate VIC 4.
  Video Data Block: Duplicate VIC 31.
  Video Data Block: Duplicate VIC 19.
  Video Data Block: Duplicate VIC 3.
  Video Data Block: Duplicate VIC 18.
  Video Data Block: Duplicate VIC 63.
  Video Data Block: Duplicate VIC 64.
  Speaker Allocation Data Block: Only one instance of this Data Block is allowed.
  Vendor-Specific Data Block (HDMI Forum), OUI C4-5D-D8: Duplicate HDMI Forum VSDB/SCDB.
EDID:
  Base EDID: EDID specified 1 extension block(s), but found 3 extension block(s).
  Base EDID: EDID 1.3 requires a Block Map Extension in Block 1 if there are more than 2 blocks in the EDID.

EDID conformity: FAIL
