edid-decode (hex):

00 ff ff ff ff ff ff 00 09 e5 9f 0c 6a 00 00 00
32 21 01 04 b5 21 15 78 03 1b 8d af 50 44 af 24
0f 4f 54 00 00 00 01 01 01 01 01 01 01 01 01 01
01 01 01 01 01 01 01 00 40 a0 b0 08 80 77 30 20
36 00 4a ce 10 00 00 1a 00 00 00 fd 00 1e 78 df
df 44 01 0a 20 20 20 20 20 20 00 00 00 fe 00 42
4f 45 20 48 46 0a 20 20 20 20 20 20 00 00 00 fe
00 4e 53 31 35 33 42 39 4d 2d 4b 36 31 0a 02 d6

02 03 0f 00 e3 05 80 80 e6 06 05 01 6a 6a 42 00
00 00 00 00 00 00 00 00 00 00 00 00 00 00 00 00
00 00 00 00 00 00 00 00 00 00 00 00 00 00 00 00
00 00 00 00 00 00 00 00 00 00 00 00 00 00 00 00
00 00 00 00 00 00 00 00 00 00 00 00 00 00 00 00
00 00 00 00 00 00 00 00 00 00 00 00 00 00 00 00
00 00 00 00 00 00 00 00 00 00 00 00 00 00 00 00
00 00 00 00 00 00 00 00 00 00 00 00 00 00 00 fc

70 20 79 02 00 22 00 28 7f 5a 0a 05 3f 0b 9f 00
2f 00 1f 00 07 07 3b 00 02 00 05 00 7f 5a 0a 85
3f 0b 9f 00 2f 00 1f 00 07 07 7f 07 02 00 05 00
2b 00 0c 27 00 1e 77 00 00 27 00 1e 3b 00 00 81
00 13 72 1a 00 00 03 01 1e 78 00 04 6a 42 6a 42
78 00 00 00 00 00 00 00 00 00 00 00 00 00 00 00
00 00 00 00 00 00 00 00 00 00 00 00 00 00 00 00
00 00 00 00 00 00 00 00 00 00 00 00 00 00 71 90

00 ff ff ff ff ff ff 00 09 e5 9f 0c 6a 00 00 00
32 21 01 04 b5 21 15 78 03 1b 8d af 50 44 af 24
0f 4f 54 00 00 00 01 01 01 01 01 01 01 01 01 01
01 01 01 01 01 01 01 00 40 a0 b0 08 80 77 30 20
36 00 4a ce 10 00 00 1a 00 00 00 fd 00 1e 78 df
df 44 01 0a 20 20 20 20 20 20 00 00 00 fe 00 42
4f 45 20 48 46 0a 20 20 20 20 20 20 00 00 00 fe
00 4e 53 31 35 33 42 39 4d 2d 4b 36 31 0a 02 d6

02 03 0f 00 e3 05 80 80 e6 06 05 01 6a 6a 42 00
00 00 00 00 00 00 00 00 00 00 00 00 00 00 00 00
00 00 00 00 00 00 00 00 00 00 00 00 00 00 00 00
00 00 00 00 00 00 00 00 00 00 00 00 00 00 00 00
00 00 00 00 00 00 00 00 00 00 00 00 00 00 00 00
00 00 00 00 00 00 00 00 00 00 00 00 00 00 00 00
00 00 00 00 00 00 00 00 00 00 00 00 00 00 00 00
00 00 00 00 00 00 00 00 00 00 00 00 00 00 00 fc

70 20 79 02 00 22 00 28 7f 5a 0a 05 3f 0b 9f 00
2f 00 1f 00 07 07 3b 00 02 00 05 00 7f 5a 0a 85
3f 0b 9f 00 2f 00 1f 00 07 07 7f 07 02 00 05 00
2b 00 0c 27 00 1e 77 00 00 27 00 1e 3b 00 00 81
00 13 72 1a 00 00 03 01 1e 78 00 04 6a 42 6a 42
78 00 00 00 00 00 00 00 00 00 00 00 00 00 00 00
00 00 00 00 00 00 00 00 00 00 00 00 00 00 00 00
00 00 00 00 00 00 00 00 00 00 00 00 00 00 71 90

----------------

Block 0, Base EDID:
  EDID Structure Version & Revision: 1.4
  Vendor & Product Identification:
    Manufacturer: BOE
    Model: 3231
    Serial Number: ...
    Made in: week 50 of 2023
  Basic Display Parameters & Features:
    Digital display
    Bits per primary color channel: 10
    DisplayPort interface
    Maximum image size: 33 cm x 21 cm
    Gamma: 2.20
    Supported color formats: RGB 4:4:4
    First detailed timing includes the native pixel format and preferred refresh rate
    Display supports continuous frequencies
  Color Characteristics:
    Red  : 0.6835, 0.3134
    Green: 0.2675, 0.6865
    Blue : 0.1425, 0.0585
    White: 0.3115, 0.3291
  Established Timings I & II: none
  Standard Timings: none
  Detailed Timing Descriptors:
    Detailed mode: 01 00 40 a0 b0 08 80 77 30 20 36 00 4a ce 10 00 00 1a '..@....w0 6.J.....'
    Display Range Limits:
      Monitor ranges (Range Limits Only): 30-120 Hz V, 223-223 kHz H, max dotclock 680 MHz
    Alphanumeric Data String: 'BOE HF'
    Alphanumeric Data String: 'NS153B9M-K61'
  Extension blocks: 2
Checksum: 0xd6

----------------

Block 1, CTA-861 Extension Block:
  Revision: 3
  Native DTDs: 0
  Colorimetry Data Block:
    BT2020RGB
    ST2113RGB
  HDR Static Metadata Data Block:
    Electro optical transfer functions:
      Traditional gamma - SDR luminance range
      SMPTE ST2084
    Supported static metadata descriptors:
      Static metadata type 1
    Desired content max luminance: 106 (496.743 cd/m^2)
    Desired content max frame-average luminance: 106 (496.743 cd/m^2)
    Desired content min luminance: 66 (0.333 cd/m^2)
Checksum: 0xfc  Unused space in Extension Block: 112 bytes

----------------

Block 2, DisplayID Extension Block:
  Version: 2.0
  Extension Count: 0
  Display Product Primary Use Case: None of the listed primary use cases; generic display
  Video Timing Modes Type 7 - Detailed Timings Data Block:
    DTD:  2880x1800  120.000000 Hz  16:10   223.200 kHz    678.528000 MHz (aspect 16:10, no 3D stereo)
               Hfront   48 Hsync  32 Hback   80 Hpol N
               Vfront    3 Vsync   6 Vback   51 Vpol N
    DTD:  2880x1800   60.000000 Hz  16:10   223.200 kHz    678.528000 MHz (aspect 16:10, no 3D stereo, preferred)
               Hfront   48 Hsync  32 Hback   80 Hpol N
               Vfront    3 Vsync   6 Vback 1911 Vpol N
  Adaptive Sync Data Block:
    Descriptor #1:
      Native Panel Range
      Fixed Average V-Total and Adaptive V-Total
      Supports Seamless Transition
      'Max Single Frame Duration Increase' field value without jitter impact
      'Max Single Frame Duration Decrease' field value without jitter impact
      Max Duration Increase: 0.00 ms
      Max Duration Decrease: 0.00 ms
      Min Refresh Rate: 30 Hz
      Max Refresh Rate: 120 Hz
    Descriptor #2:
      Native Panel Range
      Fixed Average V-Total and Adaptive V-Total
      Supports Seamless Transition
      'Max Single Frame Duration Increase' field value without jitter impact
      'Max Single Frame Duration Decrease' field value without jitter impact
      Max Duration Increase: 0.00 ms
      Max Duration Decrease: 0.00 ms
      Min Refresh Rate: 30 Hz
      Max Refresh Rate: 60 Hz
  CTA-861 DisplayID Data Block:
  Vendor-Specific Data Block (AMD), OUI 00-00-1A:
    Version: 3
    Feature Caps: 0x01
    Minimum Refresh Rate: 30 Hz
    Maximum Refresh Rate: 120 Hz
    Flags 1.x: 0x00
    Flags 2.x: 0x04
  Checksum: 0x71
Checksum: 0x90

----------------

Warnings:

Block 0, Base EDID:
  Missing Display Product Name.
Block 1, CTA-861 Extension Block:
  IT Video Formats are overscanned by default, but normally this should be underscanned.
  Colorimetry Data Block: Set the sRGB colorimetry bit to avoid interop issues.
EDID:
  No Native Video Resolution was defined.
    Hint: set 'Native DTDs' to a non-0 value, or add a Native Video Resolution Data Block.

Failures:

Block 0, Base EDID:
  Detailed Timing Descriptor #1: Pixelclock < 10 MHz, assuming invalid data 0x01 0x00.
Block 1, CTA-861 Extension Block:
  Required 640x480p60 timings are missing in the established timings and the SVD list (VIC 1).
  Missing VCDB, needed for Set Selectable RGB Quantization to avoid interop issues.
EDID:
  Extension Block 3 started with EDID header, ignoring Extension Blocks >= 3.
  DisplayID: Missing DisplayID Display Parameters Data Block.

EDID conformity: FAIL
