edid-decode (hex):

00 ff ff ff ff ff ff 00 22 f0 60 00 00 00 00 00
00 19 01 04 80 33 1d 78 0a eb f5 a6 56 51 9c 26
10 50 54 00 00 00 01 01 01 01 01 01 01 01 01 01
01 01 01 01 01 01 fe 33 80 54 70 38 1b 40 20 1c
84 00 fd 1e 11 00 00 1e 00 00 00 10 00 00 00 00
00 00 00 00 00 00 00 00 00 00 00 00 00 10 00 00
00 00 00 00 00 00 00 00 00 00 00 00 00 00 00 fc
00 48 50 45 4c 69 74 65 4f 6e 65 38 30 30 00 1e

00 ff ff ff ff ff ff 00 22 f0 60 00 00 00 00 00
00 19 01 04 80 33 1d 78 0a eb f5 a6 56 51 9c 26
10 50 54 00 00 00 01 01 01 01 01 01 01 01 01 01
01 01 01 01 01 01 fe 33 80 54 70 38 1b 40 20 1c
84 00 fd 1e 11 00 00 1e 00 00 00 10 00 00 00 00
00 00 00 00 00 00 00 00 00 00 00 00 00 10 00 00
00 00 00 00 00 00 00 00 00 00 00 00 00 00 00 fc
00 48 50 45 4c 69 74 65 4f 6e 65 38 30 30 00 1e

----------------

Block 0, Base EDID:
  EDID Structure Version & Revision: 1.4
  Vendor & Product Identification:
    Manufacturer: HWP
    Model: 96
    Made in: 2015
  Basic Display Parameters & Features:
    Digital display
    Color depth is undefined
    Digital interface is not defined
    Maximum image size: 51 cm x 29 cm
    Gamma: 2.20
    Supported color formats: RGB 4:4:4, YCrCb 4:4:4
    First detailed timing includes the native pixel format and preferred refresh rate
  Color Characteristics:
    Red  : 0.6513, 0.3378
    Green: 0.3183, 0.6123
    Blue : 0.1513, 0.0654
    White: 0.3134, 0.3291
  Established Timings I & II: none
  Standard Timings: none
  Detailed Timing Descriptors:
    DTD 1:  1920x1080   59.997440 Hz  16:9     66.417 kHz    133.100000 MHz (509 mm x 286 mm)
                 Hfront   32 Hsync  28 Hback   24 Hpol P
                 Vfront    8 Vsync   4 Vback   15 Vpol P
    Dummy Descriptor:
    Dummy Descriptor:
    Display Product Name: 'HPELiteOne800'
Checksum: 0x1e

----------------

Failures:

EDID:
  Extension Block 1 started with EDID header, ignoring Extension Blocks >= 1.

EDID conformity: FAIL
