edid-decode (hex):

00 ff ff ff ff ff ff 00 4a 8b 73 00 01 01 01 01
18 22 01 03 a2 00 00 78 2e ee 91 a3 54 4c 99 26
0f 50 54 00 00 00 01 01 01 01 01 01 01 01 01 01
01 01 01 01 01 01 01 14 00 40 41 58 23 20 30 20
45 00 9a 56 00 00 00 1a 00 00 00 fc 00 54 30 30
37 2d 34 0a 20 20 20 20 20 20 00 00 00 ff 00 64
65 6d 6f 73 65 74 2d 31 0a 20 20 20 00 00 00 fd
00 32 3c 32 3c 17 00 0a 20 20 20 20 20 20 01 9b

02 03 29 f2 43 10 04 13 e2 00 d5 e3 05 c0 00 23
09 7f 07 83 01 00 00 68 03 0c 00 10 00 38 2d 00
68 1a 00 00 01 01 32 3c e1 e0 0f 00 00 41 58 23
20 30 20 45 00 9a 56 00 00 00 1a b8 0f 20 00 31
58 23 20 30 20 45 00 9a 56 00 00 00 1a 68 10 20
90 31 58 64 20 30 20 45 00 9a 56 00 00 00 1a 70
23 a0 a0 50 84 2d 30 30 20 45 00 9a 56 00 00 00
1a 00 00 00 00 00 00 00 00 00 00 00 00 00 00 ef

00 ff ff ff ff ff ff 00 4a 8b 73 00 01 01 01 01
18 22 01 03 a2 00 00 78 2e ee 91 a3 54 4c 99 26
0f 50 54 00 00 00 01 01 01 01 01 01 01 01 01 01
01 01 01 01 01 01 01 14 00 40 41 58 23 20 30 20
45 00 9a 56 00 00 00 1a 00 00 00 fc 00 54 30 30
37 2d 34 0a 20 20 20 20 20 20 00 00 00 ff 00 64
65 6d 6f 73 65 74 2d 31 0a 20 20 20 00 00 00 fd
00 32 3c 32 3c 17 00 0a 20 20 20 20 20 20 01 9b

02 03 29 f2 43 10 04 13 e2 00 d5 e3 05 c0 00 23
09 7f 07 83 01 00 00 68 03 0c 00 10 00 38 2d 00
68 1a 00 00 01 01 32 3c e1 e0 0f 00 00 41 58 23
20 30 20 45 00 9a 56 00 00 00 1a b8 0f 20 00 31
58 23 20 30 20 45 00 9a 56 00 00 00 1a 68 10 20
90 31 58 64 20 30 20 45 00 9a 56 00 00 00 1a 70
23 a0 a0 50 84 2d 30 30 20 45 00 9a 56 00 00 00
1a 00 00 00 00 00 00 00 00 00 00 00 00 00 00 ef

----------------

Block 0, Base EDID:
  EDID Structure Version & Revision: 1.3
  Vendor & Product Identification:
    Manufacturer: RTK
    Model: 115
    Serial Number: ...
    Made in: week 24 of 2024
  Basic Display Parameters & Features:
    Digital display
    Image size is variable
    Gamma: 2.20
    DPMS levels: Off
    RGB color display
    Default (sRGB) color space is primary color space
    First detailed timing is the preferred timing
  Color Characteristics:
    Red  : 0.6396, 0.3300
    Green: 0.2998, 0.5996
    Blue : 0.1503, 0.0595
    White: 0.3125, 0.3291
  Established Timings I & II: none
  Standard Timings: none
  Detailed Timing Descriptors:
    DTD 1:  1024x600    60.004218 Hz 128:75    38.103 kHz     51.210000 MHz (154 mm x 86 mm)
                 Hfront   48 Hsync  32 Hback  240 Hpol P
                 Vfront    4 Vsync   5 Vback   26 Vpol N
    Display Product Name: 'T007-4'
    Display Product Serial Number: ...
    Display Range Limits:
      Monitor ranges (GTF): 50-60 Hz V, 50-60 kHz H, max dotclock 230 MHz
  Extension blocks: 1
Checksum: 0x9b

----------------

Block 1, CTA-861 Extension Block:
  Revision: 3
  Underscans IT Video Formats by default
  Basic audio support
  Supports YCbCr 4:4:4
  Supports YCbCr 4:2:2
  Native DTDs: 2
  Video Data Block:
    VIC  16:  1920x1080   60.000000 Hz  16:9     67.500 kHz    148.500000 MHz
    VIC   4:  1280x720    60.000000 Hz  16:9     45.000 kHz     74.250000 MHz
    VIC  19:  1280x720    50.000000 Hz  16:9     37.500 kHz     74.250000 MHz
  Video Capability Data Block:
    YCbCr quantization: Selectable (via AVI YQ)
    RGB quantization: Selectable (via AVI Q)
    PT scan behavior: Always Overscanned
    IT scan behavior: Always Overscanned
    CE scan behavior: Always Overscanned
  Colorimetry Data Block:
    BT2020YCC
    BT2020RGB
  Audio Data Block:
    Linear PCM:
      Max channels: 2
      Supported sample rates (kHz): 192 176.4 96 88.2 48 44.1 32
      Supported sample sizes (bits): 24 20 16
  Speaker Allocation Data Block:
    FL/FR - Front Left/Right
  Vendor-Specific Data Block (HDMI), OUI 00-0C-03:
    Source physical address: 1.0.0.0
    DC_36bit
    DC_30bit
    DC_Y444
    Maximum TMDS clock: 225 MHz
  Vendor-Specific Data Block (AMD), OUI 00-00-1A:
    Version: 1
    Flags 1: 0x01
      FreeSync Supported
    Minimum Refresh Rate: 50 Hz
    Maximum Refresh Rate: 60 Hz
    MCCS VCP Code: 0xe1
  Detailed Timing Descriptors:
    DTD 2:  1024x600    50.000000 Hz 128:75    31.750 kHz     40.640000 MHz (154 mm x 86 mm)
                 Hfront   48 Hsync  32 Hback  176 Hpol P
                 Vfront    4 Vsync   5 Vback   26 Vpol N
    DTD 3:   800x600    60.009544 Hz   4:3     38.106 kHz     40.240000 MHz (154 mm x 86 mm)
                 Hfront   48 Hsync  32 Hback  176 Hpol P
                 Vfront    4 Vsync   5 Vback   26 Vpol N
    DTD 4:   800x600    50.000000 Hz   4:3     35.000 kHz     42.000000 MHz (154 mm x 86 mm)
                 Hfront   48 Hsync  32 Hback  320 Hpol P
                 Vfront    4 Vsync   5 Vback   91 Vpol N
    DTD 5:  1440x900    60.000000 Hz  16:10    56.700 kHz     90.720000 MHz (154 mm x 86 mm)
                 Hfront   48 Hsync  32 Hback   80 Hpol P
                 Vfront    4 Vsync   5 Vback   36 Vpol N
Checksum: 0xef  Unused space in Extension Block: 14 bytes

----------------

Warnings:

Block 0, Base EDID:
  Vendor & Product Identification: The serial number is one of the known dummy values, it should probably be set to 0.
  Detailed Timing Descriptor #1: Dubious image size (154x86 mm is smaller than 100x100 mm).
  Display Product Serial Number: ...
Block 1, CTA-861 Extension Block:
  Video Data Block: VIC 16 and the first DTD are not identical. Is this intended?
  Video Capability Data Block: IT scan behavior is expected to support underscanned.
  Video Capability Data Block: S_PT is equal to S_IT and S_CE, so should be set to 0 instead.
  Detailed Timing Descriptor #2: Dubious image size (154x86 mm is smaller than 100x100 mm).
  Detailed Timing Descriptor #3: Dubious image size (154x86 mm is smaller than 100x100 mm).
  Detailed Timing Descriptor #4: Dubious image size (154x86 mm is smaller than 100x100 mm).
  Detailed Timing Descriptor #5: Dubious image size (154x86 mm is smaller than 100x100 mm).
  Display Product Serial Number is set, so the Serial Number in the Base EDID should be 0.
EDID:
  Base EDID: Some timings are out of range of the Monitor Ranges:
    Horizontal Freq: 31.750 - 67.500 kHz (Monitor: 50.000 - 60.000 kHz)
  CTA-861: Native progressive resolution of 1024x600 is smaller than the max preferred progressive resolution 1920x1080.

Failures:

Block 0, Base EDID:
  Basic Display Parameters & Features: Digital Video Interface Standard set to reserved value 0x22.
Block 1, CTA-861 Extension Block:
  Video Capability Data Block: IT video formats are always overscanned, but bit 7 of Byte 3 of the CTA-861 Extension header is set to underscanned.
  Required 640x480p60 timings are missing in the established timings and the SVD list (VIC 1).
EDID:
  Extension Block 2 started with EDID header, ignoring Extension Blocks >= 2.
  Base EDID: The DTD max image size is 154x86mm, but the display size is not specified anywhere.

EDID conformity: FAIL
