edid-decode (hex):

00 ff ff ff ff ff ff 00 04 72 6d 04 e6 a9 30 82
17 1c 01 04 b5 52 23 78 3f 12 b0 aa 52 4c a3 26
0f 50 54 bf ef 80 71 4f 81 40 81 80 81 c0 81 00
95 00 b3 00 d1 c0 cd 46 00 a0 a0 38 1f 40 30 20
3a 00 34 5a 31 00 00 1a 00 00 00 fd 00 30 c8 dc
dc 3c 01 0a 20 20 20 20 20 20 00 00 00 fc 00 58
5a 33 35 30 43 55 0a 20 20 20 20 20 00 00 00 ff
00 54 33 59 41 41 30 30 31 38 35 31 33 0a 01 9d

02 03 18 f1 4b 01 02 03 04 05 90 11 12 13 14 1f
23 09 07 07 83 01 00 00 f4 b0 00 a0 a0 38 4d 40
30 20 3a 00 34 5a 31 00 00 1a d8 59 00 60 a3 38
28 40 a0 10 3a 10 34 5a 31 00 00 1e a4 ab 00 50
a0 38 4d 40 08 20 f8 0c 34 5a 31 00 00 1a 02 3a
80 18 71 38 2d 40 58 2c 45 00 34 5a 31 00 00 1e
c0 e9 00 a0 a0 38 14 40 30 20 3a 00 34 5a 31 00
00 1e 00 00 00 00 00 00 00 00 00 00 00 00 00 b5

00 ff ff ff ff ff ff 00 04 72 6d 04 e6 a9 30 82
17 1c 01 04 b5 52 23 78 3f 12 b0 aa 52 4c a3 26
0f 50 54 bf ef 80 71 4f 81 40 81 80 81 c0 81 00
95 00 b3 00 d1 c0 cd 46 00 a0 a0 38 1f 40 30 20
3a 00 34 5a 31 00 00 1a 00 00 00 fd 00 30 c8 dc
dc 3c 01 0a 20 20 20 20 20 20 00 00 00 fc 00 58
5a 33 35 30 43 55 0a 20 20 20 20 20 00 00 00 ff
00 54 33 59 41 41 30 30 31 38 35 31 33 0a 01 9d

02 03 18 f1 4b 01 02 03 04 05 90 11 12 13 14 1f
23 09 07 07 83 01 00 00 f4 b0 00 a0 a0 38 4d 40
30 20 3a 00 34 5a 31 00 00 1a d8 59 00 60 a3 38
28 40 a0 10 3a 10 34 5a 31 00 00 1e a4 ab 00 50
a0 38 4d 40 08 20 f8 0c 34 5a 31 00 00 1a 02 3a
80 18 71 38 2d 40 58 2c 45 00 34 5a 31 00 00 1e
c0 e9 00 a0 a0 38 14 40 30 20 3a 00 34 5a 31 00
00 1e 00 00 00 00 00 00 00 00 00 00 00 00 00 b5

----------------

Block 0, Base EDID:
  EDID Structure Version & Revision: 1.4
  Vendor & Product Identification:
    Manufacturer: ACR
    Model: 1133
    Serial Number: ...
    Made in: week 23 of 2018
  Basic Display Parameters & Features:
    Digital display
    Bits per primary color channel: 10
    DisplayPort interface
    Maximum image size: 82 cm x 35 cm
    Gamma: 2.20
    DPMS levels: Off
    Supported color formats: RGB 4:4:4, YCrCb 4:4:4, YCrCb 4:2:2
    Default (sRGB) color space is primary color space
    First detailed timing includes the native pixel format and preferred refresh rate
    Display supports continuous frequencies
  Color Characteristics:
    Red  : 0.6640, 0.3212
    Green: 0.2968, 0.6386
    Blue : 0.1503, 0.0615
    White: 0.3125, 0.3281
  Established Timings I & II:
    IBM     :   720x400    70.081663 Hz   9:5     31.467 kHz     28.320000 MHz
    DMT 0x04:   640x480    59.940476 Hz   4:3     31.469 kHz     25.175000 MHz
    Apple   :   640x480    66.666667 Hz   4:3     35.000 kHz     30.240000 MHz
    DMT 0x05:   640x480    72.808802 Hz   4:3     37.861 kHz     31.500000 MHz
    DMT 0x06:   640x480    75.000000 Hz   4:3     37.500 kHz     31.500000 MHz
    DMT 0x08:   800x600    56.250000 Hz   4:3     35.156 kHz     36.000000 MHz
    DMT 0x09:   800x600    60.316541 Hz   4:3     37.879 kHz     40.000000 MHz
    DMT 0x0a:   800x600    72.187572 Hz   4:3     48.077 kHz     50.000000 MHz
    DMT 0x0b:   800x600    75.000000 Hz   4:3     46.875 kHz     49.500000 MHz
    Apple   :   832x624    74.551266 Hz   4:3     49.726 kHz     57.284000 MHz
    DMT 0x10:  1024x768    60.003840 Hz   4:3     48.363 kHz     65.000000 MHz
    DMT 0x11:  1024x768    70.069359 Hz   4:3     56.476 kHz     75.000000 MHz
    DMT 0x12:  1024x768    75.028582 Hz   4:3     60.023 kHz     78.750000 MHz
    DMT 0x24:  1280x1024   75.024675 Hz   5:4     79.976 kHz    135.000000 MHz
    Apple   :  1152x870    75.061550 Hz 192:145   68.681 kHz    100.000000 MHz
  Standard Timings:
    DMT 0x15:  1152x864    75.000000 Hz   4:3     67.500 kHz    108.000000 MHz
    DMT 0x20:  1280x960    60.000000 Hz   4:3     60.000 kHz    108.000000 MHz
    DMT 0x23:  1280x1024   60.019740 Hz   5:4     63.981 kHz    108.000000 MHz
    DMT 0x55:  1280x720    60.000000 Hz  16:9     45.000 kHz     74.250000 MHz
    DMT 0x1c:  1280x800    59.810326 Hz  16:10    49.702 kHz     83.500000 MHz
    DMT 0x2f:  1440x900    59.887445 Hz  16:10    55.935 kHz    106.500000 MHz
    DMT 0x3a:  1680x1050   59.954250 Hz  16:10    65.290 kHz    146.250000 MHz
    DMT 0x52:  1920x1080   60.000000 Hz  16:9     67.500 kHz    148.500000 MHz
  Detailed Timing Descriptors:
    DTD 1:  2560x1080   59.978424 Hz  64:27    66.636 kHz    181.250000 MHz (820 mm x 346 mm)
                 Hfront   48 Hsync  32 Hback   80 Hpol P
                 Vfront    3 Vsync  10 Vback   18 Vpol N
    Display Range Limits:
      Monitor ranges (Range Limits Only): 48-200 Hz V, 220-220 kHz H, max dotclock 600 MHz
    Display Product Name: 'XZ350CU'
    Display Product Serial Number: ...
  Extension blocks: 1
Checksum: 0x9d

----------------

Block 1, CTA-861 Extension Block:
  Revision: 3
  Underscans IT Video Formats by default
  Basic audio support
  Supports YCbCr 4:4:4
  Supports YCbCr 4:2:2
  Native DTDs: 1
  Video Data Block:
    VIC   1:   640x480    59.940476 Hz   4:3     31.469 kHz     25.175000 MHz
    VIC   2:   720x480    59.940060 Hz   4:3     31.469 kHz     27.000000 MHz
    VIC   3:   720x480    59.940060 Hz  16:9     31.469 kHz     27.000000 MHz
    VIC   4:  1280x720    60.000000 Hz  16:9     45.000 kHz     74.250000 MHz
    VIC   5:  1920x1080i  60.000000 Hz  16:9     33.750 kHz     74.250000 MHz
    VIC  16:  1920x1080   60.000000 Hz  16:9     67.500 kHz    148.500000 MHz (native)
    VIC  17:   720x576    50.000000 Hz   4:3     31.250 kHz     27.000000 MHz
    VIC  18:   720x576    50.000000 Hz  16:9     31.250 kHz     27.000000 MHz
    VIC  19:  1280x720    50.000000 Hz  16:9     37.500 kHz     74.250000 MHz
    VIC  20:  1920x1080i  50.000000 Hz  16:9     28.125 kHz     74.250000 MHz
    VIC  31:  1920x1080   50.000000 Hz  16:9     56.250 kHz    148.500000 MHz
  Audio Data Block:
    Linear PCM:
      Max channels: 2
      Supported sample rates (kHz): 48 44.1 32
      Supported sample sizes (bits): 24 20 16
  Speaker Allocation Data Block:
    FL/FR - Front Left/Right
  Detailed Timing Descriptors:
    DTD 2:  2560x1080  143.944786 Hz  64:27   166.544 kHz    453.000000 MHz (820 mm x 346 mm)
                 Hfront   48 Hsync  32 Hback   80 Hpol P
                 Vfront    3 Vsync  10 Vback   64 Vpol N
    DTD 3:  2560x1080   59.975801 Hz  64:27    67.173 kHz    230.000000 MHz (820 mm x 346 mm)
                 Hfront  160 Hsync 272 Hback  432 Hpol P
                 Vfront    3 Vsync  10 Vback   27 Vpol P
    DTD 4:  2560x1080  143.854273 Hz  64:27   166.439 kHz    439.400000 MHz (820 mm x 346 mm)
                 Hfront    8 Hsync  32 Hback   40 Hpol P
                 Vfront   63 Vsync   8 Vback    6 Vpol N
    DTD 5:  1920x1080   60.000000 Hz  16:9     67.500 kHz    148.500000 MHz (820 mm x 346 mm)
                 Hfront   88 Hsync  44 Hback  148 Hpol P
                 Vfront    4 Vsync   5 Vback   36 Vpol P
    DTD 6:  2560x1080  200.000000 Hz  64:27   220.000 kHz    598.400000 MHz (820 mm x 346 mm)
                 Hfront   48 Hsync  32 Hback   80 Hpol P
                 Vfront    3 Vsync  10 Vback    7 Vpol P
Checksum: 0xb5  Unused space in Extension Block: 13 bytes

----------------

Warnings:

Block 1, CTA-861 Extension Block:
  Video Data Block: VIC 1 and the first DTD are not identical. Is this intended?
  Video Data Block: All VICs are in ascending order, and the first (preferred) VIC <= 4, is that intended?
  Detailed Timing Descriptor #5: Image size is 820x346 mm, but based on the picture AR it should be 615x346 mm.
  Display Product Serial Number is set, so the Serial Number in the Base EDID should be 0.
EDID:
  Base EDID: Some timings are out of range of the Monitor Ranges:
    Horizontal Freq: 28.125 - 220.000 kHz (Monitor: 220.000 - 220.000 kHz)

Failures:

Block 0, Base EDID:
  Basic Display Parameters & Features: sRGB is signaled, but the chromaticities do not match.
Block 1, CTA-861 Extension Block:
  Missing VCDB, needed for Set Selectable RGB Quantization to avoid interop issues.
EDID:
  Extension Block 2 started with EDID header, ignoring Extension Blocks >= 2.
  CTA-861: Native progressive timings are a mix of several resolutions.

EDID conformity: FAIL
