edid-decode (hex):

00 ff ff ff ff ff ff 00 4d 10 92 41 00 00 00 00
01 14 01 03 80 46 28 78 2a ef bc a3 54 4c 9e 26
0c 45 47 bf ef 80 a9 40 81 80 90 40 01 01 01 00
01 01 01 01 01 01 02 3a 80 d0 72 38 2d 40 10 2c
45 80 c4 8e 21 00 00 1e 66 21 50 b0 51 00 1b 30
40 70 36 00 c4 8e 21 00 00 1e 00 00 00 fd 00 17
4d 0e 54 14 00 0a 20 20 20 20 20 20 00 00 00 fc
00 53 48 41 52 50 20 48 44 4d 49 0a 20 20 01 7b

00 ff ff ff ff ff ff 00 4d 10 92 41 00 00 00 00
01 14 01 03 80 46 28 78 2a ef bc a3 54 4c 9e 26
0c 45 47 bf ef 80 a9 40 81 80 90 40 01 01 01 00
01 01 01 01 01 01 02 3a 80 d0 72 38 2d 40 10 2c
45 80 c4 8e 21 00 00 1e 66 21 50 b0 51 00 1b 30
40 70 36 00 c4 8e 21 00 00 1e 00 00 00 fd 00 17
4d 0e 54 14 00 0a 20 20 20 20 20 20 00 00 00 fc
00 53 48 41 52 50 20 48 44 4d 49 0a 20 20 01 7b

----------------

Block 0, Base EDID:
  EDID Structure Version & Revision: 1.3
  Vendor & Product Identification:
    Manufacturer: SHP
    Model: 16786
    Made in: week 1 of 2010
  Basic Display Parameters & Features:
    Digital display
    Maximum image size: 70 cm x 40 cm
    Gamma: 2.20
    DPMS levels: Off
    RGB color display
    First detailed timing is the preferred timing
  Color Characteristics:
    Red  : 0.6396, 0.3300
    Green: 0.2998, 0.6201
    Blue : 0.1503, 0.0498
    White: 0.2724, 0.2773
  Established Timings I & II:
    IBM     :   720x400    70.081663 Hz   9:5     31.467 kHz     28.320000 MHz
    DMT 0x04:   640x480    59.940476 Hz   4:3     31.469 kHz     25.175000 MHz
    Apple   :   640x480    66.666667 Hz   4:3     35.000 kHz     30.240000 MHz
    DMT 0x05:   640x480    72.808802 Hz   4:3     37.861 kHz     31.500000 MHz
    DMT 0x06:   640x480    75.000000 Hz   4:3     37.500 kHz     31.500000 MHz
    DMT 0x08:   800x600    56.250000 Hz   4:3     35.156 kHz     36.000000 MHz
    DMT 0x09:   800x600    60.316541 Hz   4:3     37.879 kHz     40.000000 MHz
    DMT 0x0a:   800x600    72.187572 Hz   4:3     48.077 kHz     50.000000 MHz
    DMT 0x0b:   800x600    75.000000 Hz   4:3     46.875 kHz     49.500000 MHz
    Apple   :   832x624    74.551266 Hz   4:3     49.726 kHz     57.284000 MHz
    DMT 0x10:  1024x768    60.003840 Hz   4:3     48.363 kHz     65.000000 MHz
    DMT 0x11:  1024x768    70.069359 Hz   4:3     56.476 kHz     75.000000 MHz
    DMT 0x12:  1024x768    75.028582 Hz   4:3     60.023 kHz     78.750000 MHz
    DMT 0x24:  1280x1024   75.024675 Hz   5:4     79.976 kHz    135.000000 MHz
    Apple   :  1152x870    75.061550 Hz 192:145   68.681 kHz    100.000000 MHz
  Standard Timings:
    DMT 0x33:  1600x1200   60.000000 Hz   4:3     75.000 kHz    162.000000 MHz
    DMT 0x23:  1280x1024   60.019740 Hz   5:4     63.981 kHz    108.000000 MHz
    DMT 0x2a:  1400x1050   59.978442 Hz   4:3     65.317 kHz    121.750000 MHz
  Detailed Timing Descriptors:
    DTD 1:  1920x1080   50.000000 Hz  16:9     56.250 kHz    148.500000 MHz (708 mm x 398 mm)
                 Hfront  528 Hsync  44 Hback  148 Hpol P
                 Vfront    4 Vsync   5 Vback   36 Vpol P
    DTD 2:  1360x768    60.015162 Hz  85:48    47.712 kHz     85.500000 MHz (708 mm x 398 mm)
                 Hfront   64 Hsync 112 Hback  256 Hpol P
                 Vfront    3 Vsync   6 Vback   18 Vpol P
    Display Range Limits:
      Monitor ranges (GTF): 23-77 Hz V, 14-84 kHz H, max dotclock 200 MHz
    Display Product Name: 'SHARP HDMI'
  Extension blocks: 1
Checksum: 0x7b

----------------

Failures:

Block 0, Base EDID:
  Standard Timings: Use 0x0101 as the invalid Standard Timings code, not 0x0100.
EDID:
  Extension Block 1 started with EDID header, ignoring Extension Blocks >= 1.
  Base EDID: EDID specified 1 extension block(s), but found 0 extension block(s).

EDID conformity: FAIL
