edid-decode (hex):

00 ff ff ff ff ff ff 00 5c 2d 00 34 01 00 00 00
23 22 01 03 b4 51 1e 78 2a e6 40 ac 4f 44 ad 27
0c 50 54 25 4b 80 71 40 81 c0 81 00 81 80 95 00
a9 c0 b3 c0 01 01 f5 7c 70 a0 d0 a0 29 50 30 20
35 00 2a 2c 31 00 00 1a 02 3a 80 18 71 38 2d 40
58 2c 35 00 55 50 21 00 00 1e 00 00 00 fd 00 1e
64 1e ff 3c 00 0a 20 20 20 20 20 20 00 00 00 fc
00 55 47 33 34 57 0a 20 20 20 20 20 20 20 01 80

02 03 38 f3 47 01 02 03 04 90 1f 3f 23 09 07 07
83 01 00 00 67 03 0c 00 10 00 18 78 67 d8 5d c4
01 78 80 00 68 1a 00 00 01 01 1e 64 ed e3 05 e3
01 e6 06 07 01 60 50 00 58 d4 70 a0 d0 a0 46 50
30 20 45 00 fe 1f 11 00 00 1e 6a 5e 00 a0 a0 a0
29 50 30 20 35 00 55 50 21 00 00 1e 26 9d 70 a0
d0 a0 32 50 30 20 35 00 55 50 21 00 00 1e 00 00
00 00 00 00 00 00 00 00 00 00 00 00 00 00 00 26

00 ff ff ff ff ff ff 00 5c 2d 00 34 01 00 00 00
23 22 01 03 b4 51 1e 78 2a e6 40 ac 4f 44 ad 27
0c 50 54 25 4b 80 71 40 81 c0 81 00 81 80 95 00
a9 c0 b3 c0 01 01 f5 7c 70 a0 d0 a0 29 50 30 20
35 00 2a 2c 31 00 00 1a 02 3a 80 18 71 38 2d 40
58 2c 35 00 55 50 21 00 00 1e 00 00 00 fd 00 1e
64 1e ff 3c 00 0a 20 20 20 20 20 20 00 00 00 fc
00 55 47 33 34 57 0a 20 20 20 20 20 20 20 01 80

02 03 38 f3 47 01 02 03 04 90 1f 3f 23 09 07 07
83 01 00 00 67 03 0c 00 10 00 18 78 67 d8 5d c4
01 78 80 00 68 1a 00 00 01 01 1e 64 ed e3 05 e3
01 e6 06 07 01 60 50 00 58 d4 70 a0 d0 a0 46 50
30 20 45 00 fe 1f 11 00 00 1e 6a 5e 00 a0 a0 a0
29 50 30 20 35 00 55 50 21 00 00 1e 26 9d 70 a0
d0 a0 32 50 30 20 35 00 55 50 21 00 00 1e 00 00
00 00 00 00 00 00 00 00 00 00 00 00 00 00 00 26

----------------

Block 0, Base EDID:
  EDID Structure Version & Revision: 1.3
  Vendor & Product Identification:
    Manufacturer: WAM
    Model: 13312
    Serial Number: ...
    Made in: week 35 of 2024
  Basic Display Parameters & Features:
    Digital display
    Maximum image size: 81 cm x 30 cm
    Gamma: 2.20
    DPMS levels: Off
    RGB color display
    First detailed timing is the preferred timing
  Color Characteristics:
    Red  : 0.6748, 0.3105
    Green: 0.2666, 0.6777
    Blue : 0.1533, 0.0468
    White: 0.3125, 0.3281
  Established Timings I & II:
    DMT 0x04:   640x480    59.940476 Hz   4:3     31.469 kHz     25.175000 MHz
    DMT 0x06:   640x480    75.000000 Hz   4:3     37.500 kHz     31.500000 MHz
    DMT 0x09:   800x600    60.316541 Hz   4:3     37.879 kHz     40.000000 MHz
    DMT 0x0b:   800x600    75.000000 Hz   4:3     46.875 kHz     49.500000 MHz
    DMT 0x10:  1024x768    60.003840 Hz   4:3     48.363 kHz     65.000000 MHz
    DMT 0x12:  1024x768    75.028582 Hz   4:3     60.023 kHz     78.750000 MHz
    DMT 0x24:  1280x1024   75.024675 Hz   5:4     79.976 kHz    135.000000 MHz
    Apple   :  1152x870    75.061550 Hz 192:145   68.681 kHz    100.000000 MHz
  Standard Timings:
    GTF     :  1152x864    60.000000 Hz   4:3     53.700 kHz     81.624000 MHz
    DMT 0x55:  1280x720    60.000000 Hz  16:9     45.000 kHz     74.250000 MHz
    DMT 0x1c:  1280x800    59.810326 Hz  16:10    49.702 kHz     83.500000 MHz
    DMT 0x23:  1280x1024   60.019740 Hz   5:4     63.981 kHz    108.000000 MHz
    DMT 0x2f:  1440x900    59.887445 Hz  16:10    55.935 kHz    106.500000 MHz
    DMT 0x53:  1600x900    60.000000 Hz  16:9     60.000 kHz    108.000000 MHz (RB)
    GTF     :  1680x945    59.999909 Hz  16:9     58.680 kHz    131.443000 MHz
  Detailed Timing Descriptors:
    DTD 1:  3440x1440   59.998875 Hz  43:18    88.858 kHz    319.890000 MHz (810 mm x 300 mm)
                 Hfront   48 Hsync  32 Hback   80 Hpol P
                 Vfront    3 Vsync   5 Vback   33 Vpol N
    DTD 2:  1920x1080   60.000000 Hz  16:9     67.500 kHz    148.500000 MHz (597 mm x 336 mm)
                 Hfront   88 Hsync  44 Hback  148 Hpol P
                 Vfront    3 Vsync   5 Vback   37 Vpol P
    Display Range Limits:
      Monitor ranges (GTF): 30-100 Hz V, 30-255 kHz H, max dotclock 600 MHz
    Display Product Name: 'UG34W'
  Extension blocks: 1
Checksum: 0x80

----------------

Block 1, CTA-861 Extension Block:
  Revision: 3
  Underscans IT Video Formats by default
  Basic audio support
  Supports YCbCr 4:4:4
  Supports YCbCr 4:2:2
  Native DTDs: 3
  Video Data Block:
    VIC   1:   640x480    59.940476 Hz   4:3     31.469 kHz     25.175000 MHz
    VIC   2:   720x480    59.940060 Hz   4:3     31.469 kHz     27.000000 MHz
    VIC   3:   720x480    59.940060 Hz  16:9     31.469 kHz     27.000000 MHz
    VIC   4:  1280x720    60.000000 Hz  16:9     45.000 kHz     74.250000 MHz
    VIC  16:  1920x1080   60.000000 Hz  16:9     67.500 kHz    148.500000 MHz (native)
    VIC  31:  1920x1080   50.000000 Hz  16:9     56.250 kHz    148.500000 MHz
    VIC  63:  1920x1080  120.000000 Hz  16:9    135.000 kHz    297.000000 MHz
  Audio Data Block:
    Linear PCM:
      Max channels: 2
      Supported sample rates (kHz): 48 44.1 32
      Supported sample sizes (bits): 24 20 16
  Speaker Allocation Data Block:
    FL/FR - Front Left/Right
  Vendor-Specific Data Block (HDMI), OUI 00-0C-03:
    Source physical address: 1.0.0.0
    DC_30bit
    DC_Y444
    Maximum TMDS clock: 600 MHz
  Vendor-Specific Data Block (HDMI Forum), OUI C4-5D-D8:
    Version: 1
    Maximum TMDS Character Rate: 600 MHz
    SCDC Present
  Vendor-Specific Data Block (AMD), OUI 00-00-1A:
    Version: 1
    Flags 1: 0x01
      FreeSync Supported
    Minimum Refresh Rate: 30 Hz
    Maximum Refresh Rate: 100 Hz
    MCCS VCP Code: 0xed
  Colorimetry Data Block:
    xvYCC601
    xvYCC709
    BT2020cYCC
    BT2020YCC
    BT2020RGB
    Gamut Boundary Description Metadata Profile P0
  HDR Static Metadata Data Block:
    Electro optical transfer functions:
      Traditional gamma - SDR luminance range
      Traditional gamma - HDR luminance range
      SMPTE ST2084
    Supported static metadata descriptors:
      Static metadata type 1
    Desired content max luminance: 96 (400.000 cd/m^2)
    Desired content max frame-average luminance: 80 (282.843 cd/m^2)
    Desired content min luminance: 0 (0.000 cd/m^2)
  Detailed Timing Descriptors:
    DTD 3:  3440x1440  100.000000 Hz  43:18   151.000 kHz    543.600000 MHz (510 mm x 287 mm)
                 Hfront   48 Hsync  32 Hback   80 Hpol P
                 Vfront    4 Vsync   5 Vback   61 Vpol P
    DTD 4:  2560x1440   60.000199 Hz  16:9     88.860 kHz    241.700000 MHz (597 mm x 336 mm)
                 Hfront   48 Hsync  32 Hback   80 Hpol P
                 Vfront    3 Vsync   5 Vback   33 Vpol P
    DTD 5:  3440x1440   75.000000 Hz  43:18   111.750 kHz    402.300000 MHz (597 mm x 336 mm)
                 Hfront   48 Hsync  32 Hback   80 Hpol P
                 Vfront    3 Vsync   5 Vback   42 Vpol P
Checksum: 0x26  Unused space in Extension Block: 17 bytes

----------------

Warnings:

Block 0, Base EDID:
  Vendor & Product Identification: The serial number is one of the known dummy values, it should probably be set to 0.
  Standard Timings: Standard Timing 1680x945 has a dubious odd vertical resolution.
  Detailed Timing Descriptor #1: Image size is 810x300 mm, but based on the picture AR it should be 716x300 mm.
  Detailed Timing Descriptor #2: DTD is similar but not identical to VIC 16.
Block 1, CTA-861 Extension Block:
  Video Data Block: VIC 1 and the first DTD are not identical. Is this intended?
  Video Data Block: All VICs are in ascending order, and the first (preferred) VIC <= 4, is that intended?
  Colorimetry Data Block: Set the sRGB colorimetry bit to avoid interop issues.
  Detailed Timing Descriptor #3: Image size is 510x287 mm, but based on the picture AR it should be 510x213 mm.
  Detailed Timing Descriptor #5: Image size is 597x336 mm, but based on the picture AR it should be 597x249 mm.
EDID:
  Base EDID: Some timings are out of range of the Monitor Ranges:
    Vertical Freq: 50.000 - 120.000 Hz (Monitor: 30.000 - 100.000 Hz)

Failures:

Block 0, Base EDID:
  Basic Display Parameters & Features: Digital Video Interface Standard set to reserved value 0x34.
  Detailed Timing Descriptor #2: Mismatch of image size 597x336 mm vs display size 810x300 mm.
Block 1, CTA-861 Extension Block:
  Vendor-Specific Data Block (HDMI), OUI 00-0C-03: HDMI VSDB Max TMDS rate is > 340.
  Detailed Timing Descriptor #3: Mismatch of image size 510x287 mm vs display size 810x300 mm.
  Detailed Timing Descriptor #4: Mismatch of image size 597x336 mm vs display size 810x300 mm.
  Detailed Timing Descriptor #5: Mismatch of image size 597x336 mm vs display size 810x300 mm.
  Missing VCDB, needed for Set Selectable RGB Quantization to avoid interop issues.
EDID:
  Extension Block 2 started with EDID header, ignoring Extension Blocks >= 2.
  Base EDID: The DTD max image size is 810x336mm, which is larger than the display size 810.0x300.0mm.
  CTA-861: Native progressive timings are a mix of several resolutions.

EDID conformity: FAIL
