edid-decode (hex):

00 ff ff ff ff ff ff 00 1e 6d c2 5b 74 27 0f 00
06 21 01 04 b5 3c 22 78 fb 40 b5 ae 51 42 ad 26
0f 50 54 21 08 00 d1 c0 61 40 01 01 01 01 01 01
01 01 01 01 01 01 00 d2 00 a0 f0 70 50 80 30 20
35 00 58 54 21 00 00 1a 00 00 00 fd 00 28 3c 87
87 3c 01 0a 20 20 20 20 20 20 00 00 00 fc 00 4c
47 20 55 4c 54 52 41 46 49 4e 45 0a 00 00 00 ff
00 33 30 36 4d 41 45 47 38 4c 33 34 30 0a 01 20

02 03 28 72 23 09 07 07 83 01 00 00 44 01 03 04
10 e2 00 6a e3 05 c0 00 e6 06 05 01 60 60 50 68
1a 00 00 01 01 28 3c 00 a3 66 00 a0 f0 70 1f 80
30 20 35 00 58 54 21 00 00 1a 56 5e 00 a0 a0 a0
29 50 30 20 35 00 58 54 21 00 00 1a 02 3a 80 18
71 38 2d 40 58 2c 45 00 58 54 21 00 00 1a 00 00
00 00 00 00 00 00 00 00 00 00 00 00 00 00 00 00
00 00 00 00 00 00 00 00 00 00 00 00 00 00 00 42

00 ff ff ff ff ff ff 00 1e 6d c2 5b 74 27 0f 00
06 21 01 04 b5 3c 22 78 fb 40 b5 ae 51 42 ad 26
0f 50 54 21 08 00 d1 c0 61 40 01 01 01 01 01 01
01 01 01 01 01 01 00 d2 00 a0 f0 70 50 80 30 20
35 00 58 54 21 00 00 1a 00 00 00 fd 00 28 3c 87
87 3c 01 0a 20 20 20 20 20 20 00 00 00 fc 00 4c
47 20 55 4c 54 52 41 46 49 4e 45 0a 00 00 00 ff
00 33 30 36 4d 41 45 47 38 4c 33 34 30 0a 01 20

02 03 28 72 23 09 07 07 83 01 00 00 44 01 03 04
10 e2 00 6a e3 05 c0 00 e6 06 05 01 60 60 50 68
1a 00 00 01 01 28 3c 00 a3 66 00 a0 f0 70 1f 80
30 20 35 00 58 54 21 00 00 1a 56 5e 00 a0 a0 a0
29 50 30 20 35 00 58 54 21 00 00 1a 02 3a 80 18
71 38 2d 40 58 2c 45 00 58 54 21 00 00 1a 00 00
00 00 00 00 00 00 00 00 00 00 00 00 00 00 00 00
00 00 00 00 00 00 00 00 00 00 00 00 00 00 00 42

----------------

Block 0, Base EDID:
  EDID Structure Version & Revision: 1.4
  Vendor & Product Identification:
    Manufacturer: GSM
    Model: 23490
    Serial Number: ...
    Made in: week 6 of 2023
  Basic Display Parameters & Features:
    Digital display
    Bits per primary color channel: 10
    DisplayPort interface
    Maximum image size: 60 cm x 34 cm
    Gamma: 2.20
    DPMS levels: Standby Suspend Off
    Supported color formats: RGB 4:4:4, YCrCb 4:4:4, YCrCb 4:2:2
    First detailed timing includes the native pixel format and preferred refresh rate
    Display supports continuous frequencies
  Color Characteristics:
    Red  : 0.6806, 0.3164
    Green: 0.2578, 0.6757
    Blue : 0.1503, 0.0615
    White: 0.3134, 0.3291
  Established Timings I & II:
    DMT 0x04:   640x480    59.940476 Hz   4:3     31.469 kHz     25.175000 MHz
    DMT 0x09:   800x600    60.316541 Hz   4:3     37.879 kHz     40.000000 MHz
    DMT 0x10:  1024x768    60.003840 Hz   4:3     48.363 kHz     65.000000 MHz
  Standard Timings:
    DMT 0x52:  1920x1080   60.000000 Hz  16:9     67.500 kHz    148.500000 MHz
    DMT 0x10:  1024x768    60.003840 Hz   4:3     48.363 kHz     65.000000 MHz
  Detailed Timing Descriptors:
    DTD 1:  3840x2160   60.000000 Hz  16:9    134.400 kHz    537.600000 MHz (600 mm x 340 mm)
                 Hfront   48 Hsync  32 Hback   80 Hpol P
                 Vfront    3 Vsync   5 Vback   72 Vpol N
    Display Range Limits:
      Monitor ranges (Range Limits Only): 40-60 Hz V, 135-135 kHz H, max dotclock 600 MHz
    Display Product Name: 'LG ULTRAFINE'
    Display Product Serial Number: ...
  Extension blocks: 1
Checksum: 0x20

----------------

Block 1, CTA-861 Extension Block:
  Revision: 3
  Basic audio support
  Supports YCbCr 4:4:4
  Supports YCbCr 4:2:2
  Native DTDs: 2
  Audio Data Block:
    Linear PCM:
      Max channels: 2
      Supported sample rates (kHz): 48 44.1 32
      Supported sample sizes (bits): 24 20 16
  Speaker Allocation Data Block:
    FL/FR - Front Left/Right
  Video Data Block:
    VIC   1:   640x480    59.940476 Hz   4:3     31.469 kHz     25.175000 MHz
    VIC   3:   720x480    59.940060 Hz  16:9     31.469 kHz     27.000000 MHz
    VIC   4:  1280x720    60.000000 Hz  16:9     45.000 kHz     74.250000 MHz
    VIC  16:  1920x1080   60.000000 Hz  16:9     67.500 kHz    148.500000 MHz
  Video Capability Data Block:
    YCbCr quantization: No Data
    RGB quantization: Selectable (via AVI Q)
    PT scan behavior: Always Underscanned
    IT scan behavior: Always Underscanned
    CE scan behavior: Always Underscanned
  Colorimetry Data Block:
    BT2020YCC
    BT2020RGB
  HDR Static Metadata Data Block:
    Electro optical transfer functions:
      Traditional gamma - SDR luminance range
      SMPTE ST2084
    Supported static metadata descriptors:
      Static metadata type 1
    Desired content max luminance: 96 (400.000 cd/m^2)
    Desired content max frame-average luminance: 96 (400.000 cd/m^2)
    Desired content min luminance: 80 (0.394 cd/m^2)
  Vendor-Specific Data Block (AMD), OUI 00-00-1A:
    Version: 1
    Feature Caps: 0x01
    Minimum Refresh Rate: 40 Hz
    Maximum Refresh Rate: 60 Hz
    Flags 1.x: 0x00
  Detailed Timing Descriptors:
    DTD 2:  3840x2160   29.980602 Hz  16:9     65.688 kHz    262.750000 MHz (600 mm x 340 mm)
                 Hfront   48 Hsync  32 Hback   80 Hpol P
                 Vfront    3 Vsync   5 Vback   23 Vpol N
    DTD 3:  2560x1440   59.950550 Hz  16:9     88.787 kHz    241.500000 MHz (600 mm x 340 mm)
                 Hfront   48 Hsync  32 Hback   80 Hpol P
                 Vfront    3 Vsync   5 Vback   33 Vpol N
    DTD 4:  1920x1080   60.000000 Hz  16:9     67.500 kHz    148.500000 MHz (600 mm x 340 mm)
                 Hfront   88 Hsync  44 Hback  148 Hpol P
                 Vfront    4 Vsync   5 Vback   36 Vpol N
Checksum: 0x42  Unused space in Extension Block: 33 bytes

----------------

Warnings:

Block 1, CTA-861 Extension Block:
  IT Video Formats are overscanned by default, but normally this should be underscanned.
  Video Data Block: VIC 1 and the first DTD are not identical. Is this intended?
  Video Data Block: All VICs are in ascending order, and the first (preferred) VIC <= 4, is that intended?
  Video Capability Data Block: Set Selectable YCbCr Quantization to avoid interop issues.
  Video Capability Data Block: S_PT is equal to S_IT and S_CE, so should be set to 0 instead.
  Colorimetry Data Block: Set the sRGB colorimetry bit to avoid interop issues.
  Detailed Timing Descriptor #4: DTD is similar but not identical to VIC 16.
  Display Product Serial Number is set, so the Serial Number in the Base EDID should be 0.
EDID:
  Base EDID: Some timings are out of range of the Monitor Ranges:
    Vertical Freq: 29.981 - 60.317 Hz (Monitor: 40.000 - 60.000 Hz)
    Horizontal Freq: 31.468 - 134.400 kHz (Monitor: 135.000 - 135.000 kHz)

Failures:

Block 1, CTA-861 Extension Block:
  Video Capability Data Block: IT video formats are always underscanned, but bit 7 of Byte 3 of the CTA-861 Extension header is set to overscanned.
EDID:
  Extension Block 2 started with EDID header, ignoring Extension Blocks >= 2.

EDID conformity: FAIL
