edid-decode (hex):

00 ff ff ff ff ff ff 00 09 e5 1e 0b 00 00 00 00
10 20 01 04 a5 1e 13 78 07 fd 85 a7 53 4c 9b 25
0f 50 54 00 00 00 01 01 01 01 01 01 01 01 01 01
01 01 01 01 01 01 a7 6d 00 a0 a0 40 78 60 30 20
36 00 2e bc 10 00 00 1a b9 57 00 a0 a0 40 78 60
30 20 36 00 2e bc 10 00 00 1a 00 00 00 fe 00 30
52 47 4e 52 80 4e 45 31 34 51 44 4d 00 00 00 00
00 02 41 31 a8 00 01 00 00 1a 41 0a 20 20 00 8f

00 ff ff ff ff ff ff 00 09 e5 1e 0b 00 00 00 00
10 20 01 04 a5 1e 13 78 07 fd 85 a7 53 4c 9b 25
0f 50 54 00 00 00 01 01 01 01 01 01 01 01 01 01
01 01 01 01 01 01 a7 6d 00 a0 a0 40 78 60 30 20
36 00 2e bc 10 00 00 1a b9 57 00 a0 a0 40 78 60
30 20 36 00 2e bc 10 00 00 1a 00 00 00 fe 00 30
52 47 4e 52 80 4e 45 31 34 51 44 4d 00 00 00 00
00 02 41 31 a8 00 01 00 00 1a 41 0a 20 20 00 8f

----------------

Block 0, Base EDID:
  EDID Structure Version & Revision: 1.4
  Vendor & Product Identification:
    Manufacturer: BOE
    Model: 2846
    Made in: week 16 of 2022
  Basic Display Parameters & Features:
    Digital display
    Bits per primary color channel: 8
    DisplayPort interface
    Maximum image size: 30 cm x 19 cm
    Gamma: 2.20
    Supported color formats: RGB 4:4:4
    Default (sRGB) color space is primary color space
    First detailed timing includes the native pixel format and preferred refresh rate
    Display supports continuous frequencies
  Color Characteristics:
    Red  : 0.6552, 0.3271
    Green: 0.2998, 0.6064
    Blue : 0.1464, 0.0585
    White: 0.3134, 0.3291
  Established Timings I & II: none
  Standard Timings: none
  Detailed Timing Descriptors:
    DTD 1:  2560x1600   60.001282 Hz  16:10   103.202 kHz    280.710000 MHz (302 mm x 188 mm)
                 Hfront   48 Hsync  32 Hback   80 Hpol P
                 Vfront    3 Vsync   6 Vback  111 Vpol N
    DTD 2:  2560x1600   48.001453 Hz  16:10    82.562 kHz    224.570000 MHz (302 mm x 188 mm)
                 Hfront   48 Hsync  32 Hback   80 Hpol P
                 Vfront    3 Vsync   6 Vback  111 Vpol N
    Alphanumeric Data String: '0RGNR.NE14QDM'
    Manufacturer-Specified Display Descriptor (0x00): 00 00 00 02 41 31 a8 00 01 00 00 1a 41 0a 20 20 '....A1......A.  '
Checksum: 0x8f

----------------

Warnings:

Block 0, Base EDID:
  Alphanumeric Data String: Non-ASCII character 0x80 at position 5, can cause problems.
  Missing Display Product Name.

Failures:

Block 0, Base EDID:
  Basic Display Parameters & Features: sRGB is signaled, but the chromaticities do not match.
  Missing Display Range Limits Descriptor.
EDID:
  Extension Block 1 started with EDID header, ignoring Extension Blocks >= 1.

EDID conformity: FAIL
