edid-decode (hex):

00 ff ff ff ff ff ff 00 06 b3 fd 27 ff ff ff ff
1f 21 01 04 b5 3c 23 78 3b 54 bb ad 52 41 af 25
0d 4a 4c bf cf 80 71 4f 81 40 81 80 81 c0 81 00
95 00 b3 00 d1 c0 56 5e 00 a0 a0 a0 29 50 30 20
35 00 4e 4e 21 00 00 1a 00 00 00 fd 0c 28 f0 86
86 6a 01 0a 20 20 20 20 20 20 00 00 00 fc 00 50
47 32 37 41 51 44 4d 0a 20 20 20 20 00 00 00 ff
00 52 38 4c 4d 52 53 30 30 30 34 35 31 0a 02 bf

02 03 37 f1 4e 01 02 03 04 10 11 12 13 1f 3f 40
20 21 22 23 09 07 07 83 01 00 00 e2 00 ea e3 05
c3 01 e6 06 05 01 65 32 02 6d 1a 00 00 02 01 28
f0 00 04 65 02 65 02 56 5e 00 a0 a0 a0 29 50 30
20 35 00 4e 4e 21 00 00 1a 6f c2 00 a0 a0 a0 55
50 30 20 35 00 4e 4e 21 00 00 1a 26 e4 80 a0 70
38 5a 40 08 20 68 00 4e 4e 21 00 00 1a 00 00 00
00 00 00 00 00 00 00 00 00 00 00 00 00 00 00 b1

70 12 79 03 00 03 01 28 c0 8d 01 84 ff 09 9f 00
2f 80 1f 00 9f 05 77 00 02 00 04 00 bf c3 00 04
ff 09 df 00 2f 80 1f 00 9f 05 3b 00 02 00 04 00
00 00 00 00 00 00 00 00 00 00 00 00 00 00 00 00
00 00 00 00 00 00 00 00 00 00 00 00 00 00 00 00
00 00 00 00 00 00 00 00 00 00 00 00 00 00 00 00
00 00 00 00 00 00 00 00 00 00 00 00 00 00 00 00
00 00 00 00 00 00 00 00 00 00 00 00 00 00 be 90

00 ff ff ff ff ff ff 00 06 b3 fd 27 ff ff ff ff
1f 21 01 04 b5 3c 23 78 3b 54 bb ad 52 41 af 25
0d 4a 4c bf cf 80 71 4f 81 40 81 80 81 c0 81 00
95 00 b3 00 d1 c0 56 5e 00 a0 a0 a0 29 50 30 20
35 00 4e 4e 21 00 00 1a 00 00 00 fd 0c 28 f0 86
86 6a 01 0a 20 20 20 20 20 20 00 00 00 fc 00 50
47 32 37 41 51 44 4d 0a 20 20 20 20 00 00 00 ff
00 52 38 4c 4d 52 53 30 30 30 34 35 31 0a 02 bf

02 03 37 f1 4e 01 02 03 04 10 11 12 13 1f 3f 40
20 21 22 23 09 07 07 83 01 00 00 e2 00 ea e3 05
c3 01 e6 06 05 01 65 32 02 6d 1a 00 00 02 01 28
f0 00 04 65 02 65 02 56 5e 00 a0 a0 a0 29 50 30
20 35 00 4e 4e 21 00 00 1a 6f c2 00 a0 a0 a0 55
50 30 20 35 00 4e 4e 21 00 00 1a 26 e4 80 a0 70
38 5a 40 08 20 68 00 4e 4e 21 00 00 1a 00 00 00
00 00 00 00 00 00 00 00 00 00 00 00 00 00 00 b1

70 12 79 03 00 03 01 28 c0 8d 01 84 ff 09 9f 00
2f 80 1f 00 9f 05 77 00 02 00 04 00 bf c3 00 04
ff 09 df 00 2f 80 1f 00 9f 05 3b 00 02 00 04 00
00 00 00 00 00 00 00 00 00 00 00 00 00 00 00 00
00 00 00 00 00 00 00 00 00 00 00 00 00 00 00 00
00 00 00 00 00 00 00 00 00 00 00 00 00 00 00 00
00 00 00 00 00 00 00 00 00 00 00 00 00 00 00 00
00 00 00 00 00 00 00 00 00 00 00 00 00 00 be 90

----------------

Block 0, Base EDID:
  EDID Structure Version & Revision: 1.4
  Vendor & Product Identification:
    Manufacturer: AUS
    Model: 10237
    Serial Number: ...
    Made in: week 31 of 2023
  Basic Display Parameters & Features:
    Digital display
    Bits per primary color channel: 10
    DisplayPort interface
    Maximum image size: 60 cm x 35 cm
    Gamma: 2.20
    DPMS levels: Off
    Supported color formats: RGB 4:4:4, YCrCb 4:4:4, YCrCb 4:2:2
    First detailed timing includes the native pixel format and preferred refresh rate
    Display supports continuous frequencies
  Color Characteristics:
    Red  : 0.6767, 0.3212
    Green: 0.2548, 0.6835
    Blue : 0.1464, 0.0537
    White: 0.2910, 0.2998
  Established Timings I & II:
    IBM     :   720x400    70.081663 Hz   9:5     31.467 kHz     28.320000 MHz
    DMT 0x04:   640x480    59.940476 Hz   4:3     31.469 kHz     25.175000 MHz
    Apple   :   640x480    66.666667 Hz   4:3     35.000 kHz     30.240000 MHz
    DMT 0x05:   640x480    72.808802 Hz   4:3     37.861 kHz     31.500000 MHz
    DMT 0x06:   640x480    75.000000 Hz   4:3     37.500 kHz     31.500000 MHz
    DMT 0x08:   800x600    56.250000 Hz   4:3     35.156 kHz     36.000000 MHz
    DMT 0x09:   800x600    60.316541 Hz   4:3     37.879 kHz     40.000000 MHz
    DMT 0x0a:   800x600    72.187572 Hz   4:3     48.077 kHz     50.000000 MHz
    DMT 0x0b:   800x600    75.000000 Hz   4:3     46.875 kHz     49.500000 MHz
    DMT 0x10:  1024x768    60.003840 Hz   4:3     48.363 kHz     65.000000 MHz
    DMT 0x11:  1024x768    70.069359 Hz   4:3     56.476 kHz     75.000000 MHz
    DMT 0x12:  1024x768    75.028582 Hz   4:3     60.023 kHz     78.750000 MHz
    DMT 0x24:  1280x1024   75.024675 Hz   5:4     79.976 kHz    135.000000 MHz
    Apple   :  1152x870    75.061550 Hz 192:145   68.681 kHz    100.000000 MHz
  Standard Timings:
    DMT 0x15:  1152x864    75.000000 Hz   4:3     67.500 kHz    108.000000 MHz
    DMT 0x20:  1280x960    60.000000 Hz   4:3     60.000 kHz    108.000000 MHz
    DMT 0x23:  1280x1024   60.019740 Hz   5:4     63.981 kHz    108.000000 MHz
    DMT 0x55:  1280x720    60.000000 Hz  16:9     45.000 kHz     74.250000 MHz
    DMT 0x1c:  1280x800    59.810326 Hz  16:10    49.702 kHz     83.500000 MHz
    DMT 0x2f:  1440x900    59.887445 Hz  16:10    55.935 kHz    106.500000 MHz
    DMT 0x3a:  1680x1050   59.954250 Hz  16:10    65.290 kHz    146.250000 MHz
    DMT 0x52:  1920x1080   60.000000 Hz  16:9     67.500 kHz    148.500000 MHz
  Detailed Timing Descriptors:
    DTD 1:  2560x1440   59.950550 Hz  16:9     88.787 kHz    241.500000 MHz (590 mm x 334 mm)
                 Hfront   48 Hsync  32 Hback   80 Hpol P
                 Vfront    3 Vsync   5 Vback   33 Vpol N
    Display Range Limits:
      Monitor ranges (Range Limits Only): 40-240 Hz V, 389-389 kHz H, max dotclock 1060 MHz
    Display Product Name: 'PG27AQDM'
    Display Product Serial Number: ...
  Extension blocks: 2
Checksum: 0xbf

----------------

Block 1, CTA-861 Extension Block:
  Revision: 3
  Underscans IT Video Formats by default
  Basic audio support
  Supports YCbCr 4:4:4
  Supports YCbCr 4:2:2
  Native detailed modes: 1
  Video Data Block:
    VIC   1:   640x480    59.940476 Hz   4:3     31.469 kHz     25.175000 MHz
    VIC   2:   720x480    59.940060 Hz   4:3     31.469 kHz     27.000000 MHz
    VIC   3:   720x480    59.940060 Hz  16:9     31.469 kHz     27.000000 MHz
    VIC   4:  1280x720    60.000000 Hz  16:9     45.000 kHz     74.250000 MHz
    VIC  16:  1920x1080   60.000000 Hz  16:9     67.500 kHz    148.500000 MHz
    VIC  17:   720x576    50.000000 Hz   4:3     31.250 kHz     27.000000 MHz
    VIC  18:   720x576    50.000000 Hz  16:9     31.250 kHz     27.000000 MHz
    VIC  19:  1280x720    50.000000 Hz  16:9     37.500 kHz     74.250000 MHz
    VIC  31:  1920x1080   50.000000 Hz  16:9     56.250 kHz    148.500000 MHz
    VIC  63:  1920x1080  120.000000 Hz  16:9    135.000 kHz    297.000000 MHz
    VIC  64:  1920x1080  100.000000 Hz  16:9    112.500 kHz    297.000000 MHz
    VIC  32:  1920x1080   24.000000 Hz  16:9     27.000 kHz     74.250000 MHz
    VIC  33:  1920x1080   25.000000 Hz  16:9     28.125 kHz     74.250000 MHz
    VIC  34:  1920x1080   30.000000 Hz  16:9     33.750 kHz     74.250000 MHz
  Audio Data Block:
    Linear PCM:
      Max channels: 2
      Supported sample rates (kHz): 48 44.1 32
      Supported sample sizes (bits): 24 20 16
  Speaker Allocation Data Block:
    FL/FR - Front Left/Right
  Video Capability Data Block:
    YCbCr quantization: Selectable (via AVI YQ)
    RGB quantization: Selectable (via AVI Q)
    PT scan behavior: Always Underscanned
    IT scan behavior: Always Underscanned
    CE scan behavior: Always Underscanned
  Colorimetry Data Block:
    xvYCC601
    xvYCC709
    BT2020YCC
    BT2020RGB
    Gamut Boundary Description Metadata Profile P0
  HDR Static Metadata Data Block:
    Electro optical transfer functions:
      Traditional gamma - SDR luminance range
      SMPTE ST2084
    Supported static metadata descriptors:
      Static metadata type 1
    Desired content max luminance: 101 (445.755 cd/m^2)
    Desired content max frame-average luminance: 50 (147.683 cd/m^2)
    Desired content min luminance: 2 (0.000 cd/m^2)
  Vendor-Specific Data Block (AMD), OUI 00-00-1A:
    Version: 2
    Feature Caps: 0x01
    Minimum Refresh Rate: 40 Hz
    Maximum Refresh Rate: 240 Hz
    Flags 1.x: 0x00
    Flags 2.x: 0x04
  Detailed Timing Descriptors:
    DTD 2:  2560x1440   59.950550 Hz  16:9     88.787 kHz    241.500000 MHz (590 mm x 334 mm)
                 Hfront   48 Hsync  32 Hback   80 Hpol P
                 Vfront    3 Vsync   5 Vback   33 Vpol N
    DTD 3:  2560x1440  119.997589 Hz  16:9    182.996 kHz    497.750000 MHz (590 mm x 334 mm)
                 Hfront   48 Hsync  32 Hback   80 Hpol P
                 Vfront    3 Vsync   5 Vback   77 Vpol N
    DTD 4:  1920x1080  239.998356 Hz  16:9    280.798 kHz    584.060000 MHz (590 mm x 334 mm)
                 Hfront    8 Hsync  32 Hback  120 Hpol P
                 Vfront    6 Vsync   8 Vback   76 Vpol N
Checksum: 0xb1  Unused space in Extension Block: 18 bytes

----------------

Block 2, DisplayID Extension Block:
  Version: 1.2
  Extension Count: 0
  Display Product Type: Standalone display device
  Video Timing Modes Type 1 - Detailed Timings Data Block:
    DTD:  2560x1440  239.972191 Hz  16:9    374.357 kHz   1018.250000 MHz (aspect 16:9, no 3D stereo, preferred)
               Hfront   48 Hsync  32 Hback   80 Hpol P
               Vfront    3 Vsync   5 Vback  112 Vpol N
    DTD:  2560x1440  120.000000 Hz  16:9    180.000 kHz    501.120000 MHz (aspect 16:9, no 3D stereo)
               Hfront   48 Hsync  32 Hback  144 Hpol P
               Vfront    3 Vsync   5 Vback   52 Vpol N
  Checksum: 0xbe
Checksum: 0x90

----------------

Block 3, Unknown EDID Extension Block 0x00:
  00 ff ff ff ff ff ff 00 06 b3 fd 27 ff ff ff ff '...........'....'
  1f 21 01 04 b5 3c 23 78 3b 54 bb ad 52 41 af 25 '.!...<#x;T..RA.%'
  0d 4a 4c bf cf 80 71 4f 81 40 81 80 81 c0 81 00 '.JL...qO.@......'
  95 00 b3 00 d1 c0 56 5e 00 a0 a0 a0 29 50 30 20 '......V^....)P0 '
  35 00 4e 4e 21 00 00 1a 00 00 00 fd 0c 28 f0 86 '5.NN!........(..'
  86 6a 01 0a 20 20 20 20 20 20 00 00 00 fc 00 50 '.j..      .....P'
  47 32 37 41 51 44 4d 0a 20 20 20 20 00 00 00 ff 'G27AQDM.    ....'
  00 52 38 4c 4d 52 53 30 30 30 34 35 31 0a 02 bf '.R8LMRS000451...'
Checksum: 0xbf

----------------

Block 4, CTA-861 Extension Block:
  Revision: 3
  Underscans IT Video Formats by default
  Basic audio support
  Supports YCbCr 4:4:4
  Supports YCbCr 4:2:2
  Native detailed modes: 1
  Video Data Block:
    VIC   1:   640x480    59.940476 Hz   4:3     31.469 kHz     25.175000 MHz
    VIC   2:   720x480    59.940060 Hz   4:3     31.469 kHz     27.000000 MHz
    VIC   3:   720x480    59.940060 Hz  16:9     31.469 kHz     27.000000 MHz
    VIC   4:  1280x720    60.000000 Hz  16:9     45.000 kHz     74.250000 MHz
    VIC  16:  1920x1080   60.000000 Hz  16:9     67.500 kHz    148.500000 MHz
    VIC  17:   720x576    50.000000 Hz   4:3     31.250 kHz     27.000000 MHz
    VIC  18:   720x576    50.000000 Hz  16:9     31.250 kHz     27.000000 MHz
    VIC  19:  1280x720    50.000000 Hz  16:9     37.500 kHz     74.250000 MHz
    VIC  31:  1920x1080   50.000000 Hz  16:9     56.250 kHz    148.500000 MHz
    VIC  63:  1920x1080  120.000000 Hz  16:9    135.000 kHz    297.000000 MHz
    VIC  64:  1920x1080  100.000000 Hz  16:9    112.500 kHz    297.000000 MHz
    VIC  32:  1920x1080   24.000000 Hz  16:9     27.000 kHz     74.250000 MHz
    VIC  33:  1920x1080   25.000000 Hz  16:9     28.125 kHz     74.250000 MHz
    VIC  34:  1920x1080   30.000000 Hz  16:9     33.750 kHz     74.250000 MHz
  Audio Data Block:
    Linear PCM:
      Max channels: 2
      Supported sample rates (kHz): 48 44.1 32
      Supported sample sizes (bits): 24 20 16
  Speaker Allocation Data Block:
    FL/FR - Front Left/Right
  Video Capability Data Block:
    YCbCr quantization: Selectable (via AVI YQ)
    RGB quantization: Selectable (via AVI Q)
    PT scan behavior: Always Underscanned
    IT scan behavior: Always Underscanned
    CE scan behavior: Always Underscanned
  Colorimetry Data Block:
    xvYCC601
    xvYCC709
    BT2020YCC
    BT2020RGB
    Gamut Boundary Description Metadata Profile P0
  HDR Static Metadata Data Block:
    Electro optical transfer functions:
      Traditional gamma - SDR luminance range
      SMPTE ST2084
    Supported static metadata descriptors:
      Static metadata type 1
    Desired content max luminance: 101 (445.755 cd/m^2)
    Desired content max frame-average luminance: 50 (147.683 cd/m^2)
    Desired content min luminance: 2 (0.000 cd/m^2)
  Vendor-Specific Data Block (AMD), OUI 00-00-1A:
    Version: 2
    Feature Caps: 0x01
    Minimum Refresh Rate: 40 Hz
    Maximum Refresh Rate: 240 Hz
    Flags 1.x: 0x00
    Flags 2.x: 0x04
  Detailed Timing Descriptors:
    DTD 5:  2560x1440   59.950550 Hz  16:9     88.787 kHz    241.500000 MHz (590 mm x 334 mm)
                 Hfront   48 Hsync  32 Hback   80 Hpol P
                 Vfront    3 Vsync   5 Vback   33 Vpol N
    DTD 6:  2560x1440  119.997589 Hz  16:9    182.996 kHz    497.750000 MHz (590 mm x 334 mm)
                 Hfront   48 Hsync  32 Hback   80 Hpol P
                 Vfront    3 Vsync   5 Vback   77 Vpol N
    DTD 7:  1920x1080  239.998356 Hz  16:9    280.798 kHz    584.060000 MHz (590 mm x 334 mm)
                 Hfront    8 Hsync  32 Hback  120 Hpol P
                 Vfront    6 Vsync   8 Vback   76 Vpol N
Checksum: 0xb1  Unused space in Extension Block: 18 bytes

----------------

Block 5, DisplayID Extension Block:
  Version: 1.2
  Extension Count: 0
  Video Timing Modes Type 1 - Detailed Timings Data Block:
    DTD:  2560x1440  239.972191 Hz  16:9    374.357 kHz   1018.250000 MHz (aspect 16:9, no 3D stereo, preferred)
               Hfront   48 Hsync  32 Hback   80 Hpol P
               Vfront    3 Vsync   5 Vback  112 Vpol N
    DTD:  2560x1440  120.000000 Hz  16:9    180.000 kHz    501.120000 MHz (aspect 16:9, no 3D stereo)
               Hfront   48 Hsync  32 Hback  144 Hpol P
               Vfront    3 Vsync   5 Vback   52 Vpol N
  Checksum: 0xbe
Checksum: 0x90

----------------

Warnings:

Block 1, CTA-861 Extension Block:
  Video Data Block: VIC 1 and the first DTD are not identical. Is this intended?
  Video Capability Data Block: S_PT is equal to S_IT and S_CE, so should be set to 0 instead.
  Colorimetry Data Block: Set the sRGB colorimetry bit to avoid interop issues.
  Display Product Serial Number is set, so the Serial Number in the Base EDID should be 0.
Block 4, CTA-861 Extension Block:
  Video Capability Data Block: S_PT is equal to S_IT and S_CE, so should be set to 0 instead.
  Colorimetry Data Block: Set the sRGB colorimetry bit to avoid interop issues.
EDID:
  Base EDID: Some timings are out of range of the Monitor Ranges:
    Vertical Freq: 24.000 - 239.998 Hz (Monitor: 40.000 - 240.000 Hz)
    Horizontal Freq: 27.000 - 374.356 kHz (Monitor: 389.000 - 389.000 kHz)

Failures:

Block 0, Base EDID:
  Detailed Timing Descriptor #1: Mismatch of image size 590x334 mm vs display size 600x350 mm.
Block 1, CTA-861 Extension Block:
  Detailed Timing Descriptor #2: Mismatch of image size 590x334 mm vs display size 600x350 mm.
  Detailed Timing Descriptor #3: Mismatch of image size 590x334 mm vs display size 600x350 mm.
  Detailed Timing Descriptor #4: Mismatch of image size 590x334 mm vs display size 600x350 mm.
Block 2, DisplayID Extension Block:
  Expected 0 DisplayID Extension Block, but got 1.
Block 3, Base EDID:
  Unknown Extension Block.
Block 4, CTA-861 Extension Block:
  Video Data Block: Duplicate VIC 1.
  Video Data Block: Duplicate VIC 2.
  Video Data Block: Duplicate VIC 3.
  Video Data Block: Duplicate VIC 4.
  Video Data Block: Duplicate VIC 16.
  Video Data Block: Duplicate VIC 17.
  Video Data Block: Duplicate VIC 18.
  Video Data Block: Duplicate VIC 19.
  Video Data Block: Duplicate VIC 31.
  Video Data Block: Duplicate VIC 63.
  Video Data Block: Duplicate VIC 64.
  Video Data Block: Duplicate VIC 32.
  Video Data Block: Duplicate VIC 33.
  Video Data Block: Duplicate VIC 34.
  Speaker Allocation Data Block: Only one instance of this Data Block is allowed.
  Video Capability Data Block: Only one instance of this Data Block is allowed.
  Colorimetry Data Block: Only one instance of this Data Block is allowed.
  HDR Static Metadata Data Block: Only one instance of this Data Block is allowed.
  Detailed Timing Descriptor #5: Mismatch of image size 590x334 mm vs display size 600x350 mm.
  Detailed Timing Descriptor #6: Mismatch of image size 590x334 mm vs display size 600x350 mm.
  Detailed Timing Descriptor #7: Mismatch of image size 590x334 mm vs display size 600x350 mm.
Block 5, DisplayID Extension Block:
  Product Type should be 0 in extension block.
EDID:
  Base EDID: EDID specified 2 extension block(s), but found 5 extension block(s).
  DisplayID: Missing DisplayID Display Parameters Data Block.

EDID conformity: FAIL
