edid-decode (hex):

00 ff ff ff ff ff ff 00 52 62 0c 02 01 01 01 01
ff 15 01 03 80 31 1b 78 0a 0d c9 a0 57 47 98 27
12 48 4c 2d ce 00 81 80 01 01 01 01 01 01 01 01
01 01 01 01 01 01 02 3a 80 18 71 38 2d 40 58 2c
45 00 e7 12 11 00 00 1e 66 21 50 b0 51 00 1b 30
40 70 36 00 e5 12 11 00 00 1e 00 00 00 fc 00 54
4f 53 48 49 42 41 2d 54 56 0a 20 20 00 00 00 fd
00 17 4c 0f 44 0f 00 0a 20 20 20 20 20 20 01 99

02 03 24 70 4a 10 20 22 04 05 03 02 07 06 01 23
09 07 07 6d 03 0c 00 10 00 38 2d cf 19 19 22 22
00 e2 00 7f 01 1d 80 18 71 1c 16 20 58 2c 25 00
e7 12 11 00 00 9e 01 1d 00 72 51 d0 1e 20 6e 28
55 00 e7 12 11 00 00 1e 8c 0a d0 8a 20 e0 2d 10
10 3e 96 00 6d 12 11 00 00 18 0e 1f 00 80 51 00
1e 30 40 80 37 00 c9 12 11 00 00 1c f1 27 00 a0
51 00 25 30 50 80 37 00 c9 12 11 00 00 1c 00 a1

00 ff ff ff ff ff ff 00 52 62 0c 02 01 01 01 01
ff 15 01 03 80 31 1b 78 0a 0d c9 a0 57 47 98 27
12 48 4c 2d ce 00 81 80 01 01 01 01 01 01 01 01
01 01 01 01 01 01 02 3a 80 18 71 38 2d 40 58 2c
45 00 e7 12 11 00 00 1e 66 21 50 b0 51 00 1b 30
40 70 36 00 e5 12 11 00 00 1e 00 00 00 fc 00 54
4f 53 48 49 42 41 2d 54 56 0a 20 20 00 00 00 fd
00 17 4c 0f 44 0f 00 0a 20 20 20 20 20 20 01 99

02 03 24 70 4a 10 20 22 04 05 03 02 07 06 01 23
09 07 07 6d 03 0c 00 10 00 38 2d cf 19 19 22 22
00 e2 00 7f 01 1d 80 18 71 1c 16 20 58 2c 25 00
e7 12 11 00 00 9e 01 1d 00 72 51 d0 1e 20 6e 28
55 00 e7 12 11 00 00 1e 8c 0a d0 8a 20 e0 2d 10
10 3e 96 00 6d 12 11 00 00 18 0e 1f 00 80 51 00
1e 30 40 80 37 00 c9 12 11 00 00 1c f1 27 00 a0
51 00 25 30 50 80 37 00 c9 12 11 00 00 1c 00 a1

----------------

Block 0, Base EDID:
  EDID Structure Version & Revision: 1.3
  Vendor & Product Identification:
    Manufacturer: TSB
    Model: 524
    Serial Number: ...
    Model year: 2011
  Basic Display Parameters & Features:
    Digital display
    Maximum image size: 49 cm x 27 cm
    Gamma: 2.20
    RGB color display
    First detailed timing is the preferred timing
  Color Characteristics:
    Red  : 0.6250, 0.3398
    Green: 0.2802, 0.5947
    Blue : 0.1552, 0.0703
    White: 0.2832, 0.2978
  Established Timings I & II:
    DMT 0x04:   640x480    59.940476 Hz   4:3     31.469 kHz     25.175000 MHz
    DMT 0x05:   640x480    72.808802 Hz   4:3     37.861 kHz     31.500000 MHz
    DMT 0x06:   640x480    75.000000 Hz   4:3     37.500 kHz     31.500000 MHz
    DMT 0x09:   800x600    60.316541 Hz   4:3     37.879 kHz     40.000000 MHz
    DMT 0x0a:   800x600    72.187572 Hz   4:3     48.077 kHz     50.000000 MHz
    DMT 0x0b:   800x600    75.000000 Hz   4:3     46.875 kHz     49.500000 MHz
    DMT 0x10:  1024x768    60.003840 Hz   4:3     48.363 kHz     65.000000 MHz
    DMT 0x11:  1024x768    70.069359 Hz   4:3     56.476 kHz     75.000000 MHz
    DMT 0x12:  1024x768    75.028582 Hz   4:3     60.023 kHz     78.750000 MHz
  Standard Timings:
    DMT 0x23:  1280x1024   60.019740 Hz   5:4     63.981 kHz    108.000000 MHz
  Detailed Timing Descriptors:
    DTD 1:  1920x1080   60.000000 Hz  16:9     67.500 kHz    148.500000 MHz (487 mm x 274 mm)
                 Hfront   88 Hsync  44 Hback  148 Hpol P
                 Vfront    4 Vsync   5 Vback   36 Vpol P
    DTD 2:  1360x768    60.015162 Hz  85:48    47.712 kHz     85.500000 MHz (485 mm x 274 mm)
                 Hfront   64 Hsync 112 Hback  256 Hpol P
                 Vfront    3 Vsync   6 Vback   18 Vpol P
    Display Product Name: 'TOSHIBA-TV'
    Display Range Limits:
      Monitor ranges (GTF): 23-76 Hz V, 15-68 kHz H, max dotclock 150 MHz
  Extension blocks: 1
Checksum: 0x99

----------------

Block 1, CTA-861 Extension Block:
  Revision: 3
  Basic audio support
  Supports YCbCr 4:4:4
  Supports YCbCr 4:2:2
  Native DTDs: 0
  Video Data Block:
    VIC  16:  1920x1080   60.000000 Hz  16:9     67.500 kHz    148.500000 MHz
    VIC  32:  1920x1080   24.000000 Hz  16:9     27.000 kHz     74.250000 MHz
    VIC  34:  1920x1080   30.000000 Hz  16:9     33.750 kHz     74.250000 MHz
    VIC   4:  1280x720    60.000000 Hz  16:9     45.000 kHz     74.250000 MHz
    VIC   5:  1920x1080i  60.000000 Hz  16:9     33.750 kHz     74.250000 MHz
    VIC   3:   720x480    59.940060 Hz  16:9     31.469 kHz     27.000000 MHz
    VIC   2:   720x480    59.940060 Hz   4:3     31.469 kHz     27.000000 MHz
    VIC   7:  1440x480i   59.940060 Hz  16:9     15.734 kHz     27.000000 MHz
    VIC   6:  1440x480i   59.940060 Hz   4:3     15.734 kHz     27.000000 MHz
    VIC   1:   640x480    59.940476 Hz   4:3     31.469 kHz     25.175000 MHz
  Audio Data Block:
    Linear PCM:
      Max channels: 2
      Supported sample rates (kHz): 48 44.1 32
      Supported sample sizes (bits): 24 20 16
  Vendor-Specific Data Block (HDMI), OUI 00-0C-03:
    Source physical address: 1.0.0.0
    DC_36bit
    DC_30bit
    DC_Y444
    Maximum TMDS clock: 225 MHz
    Supported Content Types:
      Graphics
      Photo
      Cinema
      Game
    Video latency: 48 ms
    Audio latency: 48 ms
    Interlaced video latency: 66 ms
    Interlaced audio latency: 66 ms
  Video Capability Data Block:
    YCbCr quantization: No Data
    RGB quantization: Selectable (via AVI Q)
    PT scan behavior: Supports both over- and underscan
    IT scan behavior: Supports both over- and underscan
    CE scan behavior: Supports both over- and underscan
  Detailed Timing Descriptors:
    DTD 3:  1920x1080i  60.000000 Hz  16:9     33.750 kHz     74.250000 MHz (487 mm x 274 mm)
                 Hfront   88 Hsync  44 Hback  148 Hpol P
                 Vfront    2 Vsync   5 Vback   15 Vpol P Vfront +0.5 Odd Field
                 Vfront    2 Vsync   5 Vback   15 Vpol P Vback  +0.5 Even Field
    DTD 4:  1280x720    60.000000 Hz  16:9     45.000 kHz     74.250000 MHz (487 mm x 274 mm)
                 Hfront  110 Hsync  40 Hback  220 Hpol P
                 Vfront    5 Vsync   5 Vback   20 Vpol P
    DTD 5:   720x480    59.940060 Hz   3:2     31.469 kHz     27.000000 MHz (365 mm x 274 mm)
                 Hfront   16 Hsync  62 Hback   60 Hpol N
                 Vfront    9 Vsync   6 Vback   30 Vpol N
    DTD 6:  1280x768    59.870228 Hz   5:3     47.776 kHz     79.500000 MHz (457 mm x 274 mm)
                 Hfront   64 Hsync 128 Hback  192 Hpol N
                 Vfront    3 Vsync   7 Vback   20 Vpol P
    DTD 7:  1280x768    74.893062 Hz   5:3     60.289 kHz    102.250000 MHz (457 mm x 274 mm)
                 Hfront   80 Hsync 128 Hback  208 Hpol N
                 Vfront    3 Vsync   7 Vback   27 Vpol P
Checksum: 0xa1  Unused space in Extension Block: 1 byte

----------------

Warnings:

Block 0, Base EDID:
  Vendor & Product Identification: The serial number is one of the known dummy values, it should probably be set to 0.
Block 1, CTA-861 Extension Block:
  IT Video Formats are overscanned by default, but normally this should be underscanned.
  Video Data Block: For improved preferred timing interoperability, set 'Native DTDs' to 1.
  Video Capability Data Block: Set Selectable YCbCr Quantization to avoid interop issues.
  Video Capability Data Block: S_PT is equal to S_IT and S_CE, so should be set to 0 instead.
  Detailed Timing Descriptor #5: Image size is 365x274 mm, but based on the picture AR it should be 365x243 mm.
  Add a Colorimetry Data Block with the sRGB colorimetry bit set to avoid interop issues.

Failures:

Block 0, Base EDID:
  Vendor & Product Identification: EDID 1.3 does not support week 0xff.
EDID:
  Extension Block 2 started with EDID header, ignoring Extension Blocks >= 2.

EDID conformity: FAIL
