edid-decode (hex):

00 ff ff ff ff ff ff 00 0e 14 d9 17 00 00 00 00
1f 15 01 03 80 1d 10 78 0a 4a fd 91 56 59 91 29
1e 50 54 00 00 00 01 01 01 01 01 01 01 01 01 01
01 01 01 01 01 01 24 27 40 c0 60 84 20 30 30 20
35 00 25 a4 10 00 00 18 24 27 40 c0 60 84 20 30
30 20 35 00 25 a4 10 00 00 18 00 00 00 fe 00 43
50 54 20 20 20 20 20 20 20 20 20 20 00 00 00 00
00 43 4c 41 41 31 33 33 55 41 30 31 0a 20 00 a2

00 ff ff ff ff ff ff 00 0e 14 d9 17 00 00 00 00
1f 15 01 03 80 1d 10 78 0a 4a fd 91 56 59 91 29
1e 50 54 00 00 00 01 01 01 01 01 01 01 01 01 01
01 01 01 01 01 01 24 27 40 c0 60 84 20 30 30 20
35 00 25 a4 10 00 00 18 24 27 40 c0 60 84 20 30
30 20 35 00 25 a4 10 00 00 18 00 00 00 fe 00 43
50 54 20 20 20 20 20 20 20 20 20 20 00 00 00 00
00 43 4c 41 41 31 33 33 55 41 30 31 0a 20 00 a2

----------------

Block 0, Base EDID:
  EDID Structure Version & Revision: 1.3
  Vendor & Product Identification:
    Manufacturer: CPT
    Model: 6105
    Made in: week 31 of 2011
  Basic Display Parameters & Features:
    Digital display
    Maximum image size: 29 cm x 16 cm
    Gamma: 2.20
    RGB color display
    First detailed timing is the preferred timing
  Color Characteristics:
    Red  : 0.5673, 0.3359
    Green: 0.3496, 0.5683
    Blue : 0.1630, 0.1201
    White: 0.3154, 0.3291
  Established Timings I & II: none
  Standard Timings: none
  Detailed Timing Descriptors:
    DTD 1:  1600x900    59.994827 Hz  16:9     55.915 kHz    100.200000 MHz (293 mm x 164 mm)
                 Hfront   48 Hsync  32 Hback  112 Hpol N
                 Vfront    3 Vsync   5 Vback   24 Vpol N
    DTD 2:  1600x900    59.994827 Hz  16:9     55.915 kHz    100.200000 MHz (293 mm x 164 mm)
                 Hfront   48 Hsync  32 Hback  112 Hpol N
                 Vfront    3 Vsync   5 Vback   24 Vpol N
    Alphanumeric Data String: 'CPT          '
    Manufacturer-Specified Display Descriptor (0x00): 00 00 00 43 4c 41 41 31 33 33 55 41 30 31 0a 20 '...CLAA133UA01. '
Checksum: 0xa2

----------------

Failures:

Block 0, Base EDID:
  Alphanumeric Data String: No newline, but one or more trailing spaces.
  Missing Display Product Name.
  Missing Display Range Limits Descriptor.
EDID:
  Extension Block 1 started with EDID header, ignoring Extension Blocks >= 1.

EDID conformity: FAIL
