edid-decode (hex):

00 ff ff ff ff ff ff 00 1e 6d db 56 70 87 01 00
01 15 01 03 6a 31 20 78 ea ae c5 a2 57 4a 9c 25
12 50 54 a7 6b 80 b3 00 81 8f 81 80 71 4f 01 01
01 01 01 01 01 01 02 3a 80 18 71 38 2d 40 58 2c
45 00 fe 22 11 00 00 1e 21 39 90 30 62 1a 27 40
68 b0 36 00 da 28 11 00 00 1c 00 00 00 fd 00 38
4b 1e 53 0f 00 0a 20 20 20 20 20 20 00 00 00 fc
00 57 32 32 35 33 0a 20 20 20 20 20 20 20 00 81

00 ff ff ff ff ff ff 00 1e 6d db 56 70 87 01 00
01 15 01 03 6a 31 20 78 ea ae c5 a2 57 4a 9c 25
12 50 54 a7 6b 80 b3 00 81 8f 81 80 71 4f 01 01
01 01 01 01 01 01 02 3a 80 18 71 38 2d 40 58 2c
45 00 fe 22 11 00 00 1e 21 39 90 30 62 1a 27 40
68 b0 36 00 da 28 11 00 00 1c 00 00 00 fd 00 38
4b 1e 53 0f 00 0a 20 20 20 20 20 20 00 00 00 fc
00 57 32 32 35 33 0a 20 20 20 20 20 20 20 00 81

----------------

Block 0, Base EDID:
  EDID Structure Version & Revision: 1.3
  Vendor & Product Identification:
    Manufacturer: GSM
    Model: 22235
    Serial Number: ...
    Made in: week 1 of 2011
  Basic Display Parameters & Features:
    Analog display
    Signal Level Standard: 0.700 : 0.000 : 0.700 V p-p
    Blank level equals black level
    Sync: Separate SyncOnGreen
    Maximum image size: 49 cm x 32 cm
    Gamma: 2.20
    DPMS levels: Standby Suspend Off
    RGB color display
    First detailed timing is the preferred timing
  Color Characteristics:
    Red  : 0.6347, 0.3417
    Green: 0.2919, 0.6113
    Blue : 0.1474, 0.0703
    White: 0.3134, 0.3291
  Established Timings I & II:
    IBM     :   720x400    70.081663 Hz   9:5     31.467 kHz     28.320000 MHz
    DMT 0x04:   640x480    59.940476 Hz   4:3     31.469 kHz     25.175000 MHz
    DMT 0x06:   640x480    75.000000 Hz   4:3     37.500 kHz     31.500000 MHz
    DMT 0x08:   800x600    56.250000 Hz   4:3     35.156 kHz     36.000000 MHz
    DMT 0x09:   800x600    60.316541 Hz   4:3     37.879 kHz     40.000000 MHz
    DMT 0x0b:   800x600    75.000000 Hz   4:3     46.875 kHz     49.500000 MHz
    Apple   :   832x624    74.551266 Hz   4:3     49.726 kHz     57.284000 MHz
    DMT 0x10:  1024x768    60.003840 Hz   4:3     48.363 kHz     65.000000 MHz
    DMT 0x12:  1024x768    75.028582 Hz   4:3     60.023 kHz     78.750000 MHz
    DMT 0x24:  1280x1024   75.024675 Hz   5:4     79.976 kHz    135.000000 MHz
    Apple   :  1152x870    75.061550 Hz 192:145   68.681 kHz    100.000000 MHz
  Standard Timings:
    DMT 0x3a:  1680x1050   59.954250 Hz  16:10    65.290 kHz    146.250000 MHz
    DMT 0x24:  1280x1024   75.024675 Hz   5:4     79.976 kHz    135.000000 MHz
    DMT 0x23:  1280x1024   60.019740 Hz   5:4     63.981 kHz    108.000000 MHz
    DMT 0x15:  1152x864    75.000000 Hz   4:3     67.500 kHz    108.000000 MHz
  Detailed Timing Descriptors:
    DTD 1:  1920x1080   60.000000 Hz  16:9     67.500 kHz    148.500000 MHz (510 mm x 290 mm)
                 Hfront   88 Hsync  44 Hback  148 Hpol P
                 Vfront    4 Vsync   5 Vback   36 Vpol P
    DTD 2:  1680x1050   59.954250 Hz  16:10    65.290 kHz    146.250000 MHz (474 mm x 296 mm)
                 Hfront  104 Hsync 176 Hback  280 Hpol N
                 Vfront    3 Vsync   6 Vback   30 Vpol P
    Display Range Limits:
      Monitor ranges (GTF): 56-75 Hz V, 30-83 kHz H, max dotclock 150 MHz
    Display Product Name: 'W2253'
Checksum: 0x81

----------------

Failures:

Block 0, Base EDID:
  Detailed Timing Descriptor #1: Mismatch of image size 510x290 mm vs display size 490x320 mm.
  Detailed Timing Descriptor #2: Mismatch of image size 474x296 mm vs display size 490x320 mm.
EDID:
  Extension Block 1 started with EDID header, ignoring Extension Blocks >= 1.
  Base EDID: The DTD max image size is 510x296mm, which is larger than the display size 490.0x320.0mm.

EDID conformity: FAIL
