edid-decode (hex):

00 ff ff ff ff ff ff 00 0c 33 49 80 01 01 01 01
12 19 01 04 a5 00 00 78 02 de ba af 4f 59 9d 24
02 4b 59 2f cf 00 81 80 81 40 71 4f a9 40 81 00
95 00 b3 00 01 01 64 19 00 40 41 00 26 30 18 88
36 00 00 00 00 00 00 18 00 00 00 fd 00 32 56 0f
64 11 00 0a 20 20 20 20 20 20 00 00 00 fc 00 43
41 53 49 4f 2d 50 4a 0a 20 20 20 20 00 00 00 fe
00 0a 20 20 20 20 20 20 20 20 20 20 20 20 01 c7

10 01 01 00 00 66 21 56 aa 51 00 1e 30 46 8f 33
00 00 00 00 00 00 1e 00 00 00 00 00 00 00 00 00
00 00 00 00 00 00 00 00 00 00 00 00 00 00 00 00
00 00 00 00 00 00 00 00 00 00 00 00 00 00 00 00
00 00 00 00 00 00 00 00 00 00 00 00 00 00 00 00
00 00 00 00 00 00 00 00 00 00 00 00 00 00 00 00
00 00 00 00 00 00 00 00 00 00 00 00 00 00 00 00
00 00 00 00 00 00 00 00 00 00 00 00 00 00 00 a2

----------------

Block 0, Base EDID:
  EDID Structure Version & Revision: 1.4
  Vendor & Product Identification:
    Manufacturer: CAS
    Model: 32841
    Serial Number: ...
    Made in: week 18 of 2015
  Basic Display Parameters & Features:
    Digital display
    Bits per primary color channel: 8
    DisplayPort interface
    Image size is variable
    Gamma: 2.20
    Supported color formats: RGB 4:4:4
    First detailed timing includes the native pixel format and preferred refresh rate
  Color Characteristics:
    Red  : 0.6865, 0.3095
    Green: 0.3505, 0.6152
    Blue : 0.1425, 0.0107
    White: 0.2949, 0.3496
  Established Timings I & II:
    DMT 0x04:   640x480    59.940476 Hz   4:3     31.469 kHz     25.175000 MHz
    DMT 0x05:   640x480    72.808802 Hz   4:3     37.861 kHz     31.500000 MHz
    DMT 0x06:   640x480    75.000000 Hz   4:3     37.500 kHz     31.500000 MHz
    DMT 0x08:   800x600    56.250000 Hz   4:3     35.156 kHz     36.000000 MHz
    DMT 0x09:   800x600    60.316541 Hz   4:3     37.879 kHz     40.000000 MHz
    DMT 0x0a:   800x600    72.187572 Hz   4:3     48.077 kHz     50.000000 MHz
    DMT 0x0b:   800x600    75.000000 Hz   4:3     46.875 kHz     49.500000 MHz
    DMT 0x10:  1024x768    60.003840 Hz   4:3     48.363 kHz     65.000000 MHz
    DMT 0x11:  1024x768    70.069359 Hz   4:3     56.476 kHz     75.000000 MHz
    DMT 0x12:  1024x768    75.028582 Hz   4:3     60.023 kHz     78.750000 MHz
    DMT 0x24:  1280x1024   75.024675 Hz   5:4     79.976 kHz    135.000000 MHz
  Standard Timings:
    DMT 0x23:  1280x1024   60.019740 Hz   5:4     63.981 kHz    108.000000 MHz
    DMT 0x20:  1280x960    60.000000 Hz   4:3     60.000 kHz    108.000000 MHz
    DMT 0x15:  1152x864    75.000000 Hz   4:3     67.500 kHz    108.000000 MHz
    DMT 0x33:  1600x1200   60.000000 Hz   4:3     75.000 kHz    162.000000 MHz
    DMT 0x1c:  1280x800    59.810326 Hz  16:10    49.702 kHz     83.500000 MHz
    DMT 0x2f:  1440x900    59.887445 Hz  16:10    55.935 kHz    106.500000 MHz
    DMT 0x3a:  1680x1050   59.954250 Hz  16:10    65.290 kHz    146.250000 MHz
  Detailed Timing Descriptors:
    DTD 1:  1024x768    60.003840 Hz   4:3     48.363 kHz     65.000000 MHz
                 Hfront   24 Hsync 136 Hback  160 Hpol N
                 Vfront    3 Vsync   6 Vback   29 Vpol N
    Display Range Limits:
      Monitor ranges (GTF): 50-86 Hz V, 15-100 kHz H, max dotclock 170 MHz
    Display Product Name: 'CASIO-PJ'
    Alphanumeric Data String: ''
  Extension blocks: 1
Checksum: 0xc7

----------------

Block 1, Video Timing Extension Block:
  Version: 1
  Detailed Timing Descriptors:
    DTD:  1366x768    59.789541 Hz 683:384   47.712 kHz     85.500000 MHz
               Hfront   70 Hsync 143 Hback  213 Hpol P
               Vfront    3 Vsync   3 Vback   24 Vpol P
Checksum: 0xa2  Unused space in Extension Block: 104 bytes

----------------

Warnings:

Block 0, Base EDID:
  Vendor & Product Identification: The serial number is one of the known dummy values, it should probably be set to 0.
  Display Range Limits: GTF support is deprecated in EDID 1.4.

Failures:

Block 0, Base EDID:
  Display Range Limits: GTF is supported, but the display does not support continuous frequencies.
  Alphanumeric Data String: Empty string.

EDID conformity: FAIL
