edid-decode (hex):

00 ff ff ff ff ff ff 00 09 e5 5f 0b 00 00 00 00
6b 16 01 04 a5 1f 11 78 03 1c 65 9b 58 5e 92 2a
22 50 54 00 00 00 01 01 01 01 01 01 01 01 01 01
01 01 01 01 01 01 c2 37 80 cc 70 38 28 40 6c 30
aa 00 35 ae 10 00 00 1a 2c 25 80 cc 70 38 28 40
6c 30 aa 00 35 ae 10 00 00 1a 00 00 00 00 00 00
00 00 00 00 00 00 00 00 00 00 00 00 00 00 00 02
00 0d 40 ff 0a 3c 7d 09 0b 17 7d 00 00 00 01 12

70 20 79 02 00 25 01 09 8c 2d 02 8c 2d 02 28 3c
80 81 00 13 72 1a 00 00 03 01 28 3c 00 00 4a 48
4a 48 3c 00 00 00 00 00 00 00 00 00 00 00 00 00
00 00 00 00 00 00 00 00 00 00 00 00 00 00 00 00
00 00 00 00 00 00 00 00 00 00 00 00 00 00 00 00
00 00 00 00 00 00 00 00 00 00 00 00 00 00 00 00
00 00 00 00 00 00 00 00 00 00 00 00 00 00 00 00
00 00 00 00 00 00 00 00 00 00 00 00 00 00 f4 90

00 ff ff ff ff ff ff 00 09 e5 5f 0b 00 00 00 00
6b 16 01 04 a5 1f 11 78 03 1c 65 9b 58 5e 92 2a
22 50 54 00 00 00 01 01 01 01 01 01 01 01 01 01
01 01 01 01 01 01 c2 37 80 cc 70 38 28 40 6c 30
aa 00 35 ae 10 00 00 1a 2c 25 80 cc 70 38 28 40
6c 30 aa 00 35 ae 10 00 00 1a 00 00 00 00 00 00
00 00 00 00 00 00 00 00 00 00 00 00 00 00 00 02
00 0d 40 ff 0a 3c 7d 09 0b 17 7d 00 00 00 01 12

70 20 79 02 00 25 01 09 8c 2d 02 8c 2d 02 28 3c
80 81 00 13 72 1a 00 00 03 01 28 3c 00 00 4a 48
4a 48 3c 00 00 00 00 00 00 00 00 00 00 00 00 00
00 00 00 00 00 00 00 00 00 00 00 00 00 00 00 00
00 00 00 00 00 00 00 00 00 00 00 00 00 00 00 00
00 00 00 00 00 00 00 00 00 00 00 00 00 00 00 00
00 00 00 00 00 00 00 00 00 00 00 00 00 00 00 00
00 00 00 00 00 00 00 00 00 00 00 00 00 00 f4 90

----------------

Block 0, Base EDID:
  EDID Structure Version & Revision: 1.4
  Vendor & Product Identification:
    Manufacturer: BOE
    Model: 2911
    Made in: week 107 of 2012
  Basic Display Parameters & Features:
    Digital display
    Bits per primary color channel: 8
    DisplayPort interface
    Maximum image size: 31 cm x 17 cm
    Gamma: 2.20
    Supported color formats: RGB 4:4:4
    First detailed timing includes the native pixel format and preferred refresh rate
    Display supports continuous frequencies
  Color Characteristics:
    Red  : 0.6054, 0.3447
    Green: 0.3701, 0.5703
    Blue : 0.1650, 0.1347
    White: 0.3134, 0.3291
  Established Timings I & II: none
  Standard Timings: none
  Detailed Timing Descriptors:
    DTD 1:  1920x1080   60.003027 Hz  16:9     67.203 kHz    142.740000 MHz (309 mm x 174 mm)
                 Hfront  108 Hsync  48 Hback   48 Hpol P
                 Vfront   10 Vsync  10 Vback   20 Vpol N
    DTD 2:  1920x1080   40.002018 Hz  16:9     44.802 kHz     95.160000 MHz (309 mm x 174 mm)
                 Hfront  108 Hsync  48 Hback   48 Hpol P
                 Vfront   10 Vsync  10 Vback   20 Vpol N
    Empty Descriptor
    Manufacturer-Specified Display Descriptor (0x02): 00 02 00 0d 40 ff 0a 3c 7d 09 0b 17 7d 00 00 00 '....@..<}...}...'
  Extension blocks: 1
Checksum: 0x12

----------------

Block 1, DisplayID Extension Block:
  Version: 2.0
  Extension Count: 0
  Display Product Primary Use Case: None of the listed primary use cases; generic display
  Dynamic Video Timing Range Limits Data Block:
    Minimum Pixel Clock: 142733 kHz
    Maximum Pixel Clock: 142733 kHz
    Minimum Vertical Refresh Rate: 40 Hz
    Maximum Vertical Refresh Rate: 60 Hz
    Seamless Dynamic Video Timing Support: Yes
  CTA-861 DisplayID Data Block:
  Vendor-Specific Data Block (AMD), OUI 00-00-1A:
    Version: 3
    Feature Caps: 0x01
    Minimum Refresh Rate: 40 Hz
    Maximum Refresh Rate: 60 Hz
    Flags 1.x: 0x00
    Flags 2.x: 0x00
    Maximum luminance: 74 (248.372 cd/m^2)
    Minimum luminance: 72 (0.198 cd/m^2)
    Unknown: 0x4a 0x48
  Checksum: 0xf4
Checksum: 0x90

----------------

Block 2, Unknown EDID Extension Block 0x00:
  00 ff ff ff ff ff ff 00 09 e5 5f 0b 00 00 00 00 '.........._.....'
  6b 16 01 04 a5 1f 11 78 03 1c 65 9b 58 5e 92 2a 'k......x..e.X^.*'
  22 50 54 00 00 00 01 01 01 01 01 01 01 01 01 01 '"PT.............'
  01 01 01 01 01 01 c2 37 80 cc 70 38 28 40 6c 30 '.......7..p8(@l0'
  aa 00 35 ae 10 00 00 1a 2c 25 80 cc 70 38 28 40 '..5.....,%..p8(@'
  6c 30 aa 00 35 ae 10 00 00 1a 00 00 00 00 00 00 'l0..5...........'
  00 00 00 00 00 00 00 00 00 00 00 00 00 00 00 02 '................'
  00 0d 40 ff 0a 3c 7d 09 0b 17 7d 00 00 00 01 12 '..@..<}...}.....'
Checksum: 0x12

----------------

Block 3, DisplayID Extension Block:
  Version: 2.0
  Extension Count: 0
  Dynamic Video Timing Range Limits Data Block:
    Minimum Pixel Clock: 142733 kHz
    Maximum Pixel Clock: 142733 kHz
    Minimum Vertical Refresh Rate: 40 Hz
    Maximum Vertical Refresh Rate: 60 Hz
    Seamless Dynamic Video Timing Support: Yes
  CTA-861 DisplayID Data Block:
  Vendor-Specific Data Block (AMD), OUI 00-00-1A:
    Version: 3
    Feature Caps: 0x01
    Minimum Refresh Rate: 40 Hz
    Maximum Refresh Rate: 60 Hz
    Flags 1.x: 0x00
    Flags 2.x: 0x00
    Maximum luminance: 74 (248.372 cd/m^2)
    Minimum luminance: 72 (0.198 cd/m^2)
    Unknown: 0x4a 0x48
  Checksum: 0xf4
Checksum: 0x90

----------------

Warnings:

Block 0, Base EDID:
  Missing Display Product Name.

Failures:

Block 0, Base EDID:
  Vendor & Product Identification: Invalid week of manufacture (> 54).
  Empty Descriptor: Use Dummy Descriptor instead of all zeroes.
  Missing Display Range Limits Descriptor.
Block 1, DisplayID Extension Block:
  Expected 0 DisplayID Extension Block, but got 1.
Block 2, Base EDID:
  Unknown Extension Block.
Block 3, DisplayID Extension Block:
  Product Type should be 0 in extension block.
EDID:
  Base EDID: EDID specified 1 extension block(s), but found 3 extension block(s).
  DisplayID: Missing DisplayID Display Parameters Data Block.
  DisplayID: Missing DisplayID Type VII Detailed Timing Data Block.
  DisplayID: DisplayID expects at least one preferred timing.

EDID conformity: FAIL
