edid-decode (hex):

00 ff ff ff ff ff ff 00 58 b3 00 37 00 00 00 00
0a 16 01 03 80 10 09 78 0a 68 37 a4 54 48 9a 25
0f 4a 4c 3f ef 80 d1 00 d1 c0 81 19 90 59 01 01
01 01 01 01 01 01 01 1d 80 18 71 1c 16 20 58 2c
25 00 10 09 00 00 00 9e 01 1d 00 72 51 d0 1e 20
6e 28 55 00 10 09 00 00 00 1e 00 00 00 fc 00 32
34 57 5f 4c 43 44 5f 54 56 0a 20 20 00 00 00 fd
00 31 3d 0f 2e 08 00 0a 20 20 20 20 20 20 01 04

02 03 27 71 50 01 02 04 85 06 11 13 14 15 03 07
12 16 1f 20 10 26 15 07 50 09 07 00 83 01 00 00
66 03 0c 00 20 00 80 8c 0a d0 8a 20 e0 2d 10 10
3e 96 00 04 03 00 00 00 18 8c 0a a0 14 51 f0 16
00 26 7c 43 00 04 03 00 00 00 98 01 1d 80 d0 72
1c 16 20 10 2c 25 80 10 09 00 00 00 9e 01 1d 00
bc 52 d0 1e 20 b8 28 55 40 10 09 00 00 00 1e 00
00 00 00 00 00 00 00 00 00 00 00 00 00 00 00 73

00 ff ff ff ff ff ff 00 58 b3 00 37 00 00 00 00
0a 16 01 03 80 10 09 78 0a 68 37 a4 54 48 9a 25
0f 4a 4c 3f ef 80 d1 00 d1 c0 81 19 90 59 01 01
01 01 01 01 01 01 01 1d 80 18 71 1c 16 20 58 2c
25 00 10 09 00 00 00 9e 01 1d 00 72 51 d0 1e 20
6e 28 55 00 10 09 00 00 00 1e 00 00 00 fc 00 32
34 57 5f 4c 43 44 5f 54 56 0a 20 20 00 00 00 fd
00 31 3d 0f 2e 08 00 0a 20 20 20 20 20 20 01 04

02 03 27 71 50 01 02 04 85 06 11 13 14 15 03 07
12 16 1f 20 10 26 15 07 50 09 07 00 83 01 00 00
66 03 0c 00 20 00 80 8c 0a d0 8a 20 e0 2d 10 10
3e 96 00 04 03 00 00 00 18 8c 0a a0 14 51 f0 16
00 26 7c 43 00 04 03 00 00 00 98 01 1d 80 d0 72
1c 16 20 10 2c 25 80 10 09 00 00 00 9e 01 1d 00
bc 52 d0 1e 20 b8 28 55 40 10 09 00 00 00 1e 00
00 00 00 00 00 00 00 00 00 00 00 00 00 00 00 73

----------------

Block 0, Base EDID:
  EDID Structure Version & Revision: 1.3
  Vendor & Product Identification:
    Manufacturer: VES
    Model: 14080
    Made in: week 10 of 2012
  Basic Display Parameters & Features:
    Digital display
    Maximum image size: 16 cm x 9 cm
    Gamma: 2.20
    RGB color display
    First detailed timing is the preferred timing
  Color Characteristics:
    Red  : 0.6416, 0.3300
    Green: 0.2832, 0.6015
    Blue : 0.1445, 0.0615
    White: 0.2900, 0.2998
  Established Timings I & II:
    DMT 0x04:   640x480    59.940476 Hz   4:3     31.469 kHz     25.175000 MHz
    Apple   :   640x480    66.666667 Hz   4:3     35.000 kHz     30.240000 MHz
    DMT 0x05:   640x480    72.808802 Hz   4:3     37.861 kHz     31.500000 MHz
    DMT 0x06:   640x480    75.000000 Hz   4:3     37.500 kHz     31.500000 MHz
    DMT 0x08:   800x600    56.250000 Hz   4:3     35.156 kHz     36.000000 MHz
    DMT 0x09:   800x600    60.316541 Hz   4:3     37.879 kHz     40.000000 MHz
    DMT 0x0a:   800x600    72.187572 Hz   4:3     48.077 kHz     50.000000 MHz
    DMT 0x0b:   800x600    75.000000 Hz   4:3     46.875 kHz     49.500000 MHz
    Apple   :   832x624    74.551266 Hz   4:3     49.726 kHz     57.284000 MHz
    DMT 0x10:  1024x768    60.003840 Hz   4:3     48.363 kHz     65.000000 MHz
    DMT 0x11:  1024x768    70.069359 Hz   4:3     56.476 kHz     75.000000 MHz
    DMT 0x12:  1024x768    75.028582 Hz   4:3     60.023 kHz     78.750000 MHz
    DMT 0x24:  1280x1024   75.024675 Hz   5:4     79.976 kHz    135.000000 MHz
    Apple   :  1152x870    75.061550 Hz 192:145   68.681 kHz    100.000000 MHz
  Standard Timings:
    DMT 0x45:  1920x1200   59.884600 Hz  16:10    74.556 kHz    193.250000 MHz
    DMT 0x52:  1920x1080   60.000000 Hz  16:9     67.500 kHz    148.500000 MHz
    DMT 0x1e:  1280x800    84.879879 Hz  16:10    71.554 kHz    122.500000 MHz
    DMT 0x2c:  1400x1050   84.959958 Hz   4:3     93.881 kHz    179.500000 MHz
  Detailed Timing Descriptors:
    DTD  1:  1920x1080i  60.000000 Hz  16:9     33.750 kHz     74.250000 MHz (16 mm x 9 mm)
                  Hfront   88 Hsync  44 Hback  148 Hpol P
                  Vfront    2 Vsync   5 Vback   15 Vpol P Vfront +0.5 Odd Field
                  Vfront    2 Vsync   5 Vback   15 Vpol P Vback  +0.5 Even Field
    DTD  2:  1280x720    60.000000 Hz  16:9     45.000 kHz     74.250000 MHz (16 mm x 9 mm)
                  Hfront  110 Hsync  40 Hback  220 Hpol P
                  Vfront    5 Vsync   5 Vback   20 Vpol P
    Display Product Name: '24W_LCD_TV'
    Display Range Limits:
      Monitor ranges (GTF): 49-61 Hz V, 15-46 kHz H, max dotclock 80 MHz
  Extension blocks: 1
Checksum: 0x04

----------------

Block 1, CTA-861 Extension Block:
  Revision: 3
  Basic audio support
  Supports YCbCr 4:4:4
  Supports YCbCr 4:2:2
  Native detailed modes: 1
  Video Data Block:
    VIC   1:   640x480    59.940476 Hz   4:3     31.469 kHz     25.175000 MHz
    VIC   2:   720x480    59.940060 Hz   4:3     31.469 kHz     27.000000 MHz
    VIC   4:  1280x720    60.000000 Hz  16:9     45.000 kHz     74.250000 MHz
    VIC   5:  1920x1080i  60.000000 Hz  16:9     33.750 kHz     74.250000 MHz (native)
    VIC   6:  1440x480i   59.940060 Hz   4:3     15.734 kHz     27.000000 MHz
    VIC  17:   720x576    50.000000 Hz   4:3     31.250 kHz     27.000000 MHz
    VIC  19:  1280x720    50.000000 Hz  16:9     37.500 kHz     74.250000 MHz
    VIC  20:  1920x1080i  50.000000 Hz  16:9     28.125 kHz     74.250000 MHz
    VIC  21:  1440x576i   50.000000 Hz   4:3     15.625 kHz     27.000000 MHz
    VIC   3:   720x480    59.940060 Hz  16:9     31.469 kHz     27.000000 MHz
    VIC   7:  1440x480i   59.940060 Hz  16:9     15.734 kHz     27.000000 MHz
    VIC  18:   720x576    50.000000 Hz  16:9     31.250 kHz     27.000000 MHz
    VIC  22:  1440x576i   50.000000 Hz  16:9     15.625 kHz     27.000000 MHz
    VIC  31:  1920x1080   50.000000 Hz  16:9     56.250 kHz    148.500000 MHz
    VIC  32:  1920x1080   24.000000 Hz  16:9     27.000 kHz     74.250000 MHz
    VIC  16:  1920x1080   60.000000 Hz  16:9     67.500 kHz    148.500000 MHz
  Audio Data Block:
    AC-3:
      Max channels: 6
      Supported sample rates (kHz): 48 44.1 32
      Maximum bit rate: 640 kb/s
    Linear PCM:
      Max channels: 2
      Supported sample rates (kHz): 48 44.1 32
      Supported sample sizes (bits):
  Speaker Allocation Data Block:
    FL/FR - Front Left/Right
  Vendor-Specific Data Block (HDMI), OUI 00-0C-03:
    Source physical address: 2.0.0.0
    Supports_AI
  Detailed Timing Descriptors:
    DTD  3:   720x480    59.940060 Hz   3:2     31.469 kHz     27.000000 MHz (4 mm x 3 mm)
                  Hfront   16 Hsync  62 Hback   60 Hpol N
                  Vfront    9 Vsync   6 Vback   30 Vpol N
    DTD  4:  1440x480i   59.940060 Hz   3:1     15.734 kHz     27.000000 MHz (4 mm x 3 mm)
                  Hfront   38 Hsync 124 Hback  114 Hpol N
                  Vfront    4 Vsync   3 Vback   15 Vpol N Vfront +0.5 Odd Field
                  Vfront    4 Vsync   3 Vback   15 Vpol N Vback  +0.5 Even Field
    DTD  5:  1920x1080i  50.000000 Hz  16:9     28.125 kHz     74.250000 MHz (16 mm x 9 mm)
                  Hfront  528 Hsync  44 Hback  148 Hpol P
                  Vfront    2 Vsync   5 Vback   15 Vpol P Vfront +0.5 Odd Field
                  Vfront    2 Vsync   5 Vback   15 Vpol P Vback  +0.5 Even Field
    DTD  6:  1280x720    50.000000 Hz  16:9     37.500 kHz     74.250000 MHz (16 mm x 9 mm)
                  Hfront  440 Hsync  40 Hback  220 Hpol P
                  Vfront    5 Vsync   5 Vback   20 Vpol P
Checksum: 0x73  Unused space in Extension Block: 16 bytes

----------------

Block 2, Unknown EDID Extension Block 0x00:
  00 ff ff ff ff ff ff 00 58 b3 00 37 00 00 00 00 '........X..7....'
  0a 16 01 03 80 10 09 78 0a 68 37 a4 54 48 9a 25 '.......x.h7.TH.%'
  0f 4a 4c 3f ef 80 d1 00 d1 c0 81 19 90 59 01 01 '.JL?.........Y..'
  01 01 01 01 01 01 01 1d 80 18 71 1c 16 20 58 2c '..........q.. X,'
  25 00 10 09 00 00 00 9e 01 1d 00 72 51 d0 1e 20 '%..........rQ.. '
  6e 28 55 00 10 09 00 00 00 1e 00 00 00 fc 00 32 'n(U............2'
  34 57 5f 4c 43 44 5f 54 56 0a 20 20 00 00 00 fd '4W_LCD_TV.  ....'
  00 31 3d 0f 2e 08 00 0a 20 20 20 20 20 20 01 04 '.1=.....      ..'
Checksum: 0x04

----------------

Block 3, CTA-861 Extension Block:
  Revision: 3
  Basic audio support
  Supports YCbCr 4:4:4
  Supports YCbCr 4:2:2
  Native detailed modes: 1
  Video Data Block:
    VIC   1:   640x480    59.940476 Hz   4:3     31.469 kHz     25.175000 MHz
    VIC   2:   720x480    59.940060 Hz   4:3     31.469 kHz     27.000000 MHz
    VIC   4:  1280x720    60.000000 Hz  16:9     45.000 kHz     74.250000 MHz
    VIC   5:  1920x1080i  60.000000 Hz  16:9     33.750 kHz     74.250000 MHz (native)
    VIC   6:  1440x480i   59.940060 Hz   4:3     15.734 kHz     27.000000 MHz
    VIC  17:   720x576    50.000000 Hz   4:3     31.250 kHz     27.000000 MHz
    VIC  19:  1280x720    50.000000 Hz  16:9     37.500 kHz     74.250000 MHz
    VIC  20:  1920x1080i  50.000000 Hz  16:9     28.125 kHz     74.250000 MHz
    VIC  21:  1440x576i   50.000000 Hz   4:3     15.625 kHz     27.000000 MHz
    VIC   3:   720x480    59.940060 Hz  16:9     31.469 kHz     27.000000 MHz
    VIC   7:  1440x480i   59.940060 Hz  16:9     15.734 kHz     27.000000 MHz
    VIC  18:   720x576    50.000000 Hz  16:9     31.250 kHz     27.000000 MHz
    VIC  22:  1440x576i   50.000000 Hz  16:9     15.625 kHz     27.000000 MHz
    VIC  31:  1920x1080   50.000000 Hz  16:9     56.250 kHz    148.500000 MHz
    VIC  32:  1920x1080   24.000000 Hz  16:9     27.000 kHz     74.250000 MHz
    VIC  16:  1920x1080   60.000000 Hz  16:9     67.500 kHz    148.500000 MHz
  Audio Data Block:
    AC-3:
      Max channels: 6
      Supported sample rates (kHz): 48 44.1 32
      Maximum bit rate: 640 kb/s
    Linear PCM:
      Max channels: 2
      Supported sample rates (kHz): 48 44.1 32
      Supported sample sizes (bits):
  Speaker Allocation Data Block:
    FL/FR - Front Left/Right
  Vendor-Specific Data Block (HDMI), OUI 00-0C-03:
    Source physical address: 2.0.0.0
    Supports_AI
  Detailed Timing Descriptors:
    DTD  7:   720x480    59.940060 Hz   3:2     31.469 kHz     27.000000 MHz (4 mm x 3 mm)
                  Hfront   16 Hsync  62 Hback   60 Hpol N
                  Vfront    9 Vsync   6 Vback   30 Vpol N
    DTD  8:  1440x480i   59.940060 Hz   3:1     15.734 kHz     27.000000 MHz (4 mm x 3 mm)
                  Hfront   38 Hsync 124 Hback  114 Hpol N
                  Vfront    4 Vsync   3 Vback   15 Vpol N Vfront +0.5 Odd Field
                  Vfront    4 Vsync   3 Vback   15 Vpol N Vback  +0.5 Even Field
    DTD  9:  1920x1080i  50.000000 Hz  16:9     28.125 kHz     74.250000 MHz (16 mm x 9 mm)
                  Hfront  528 Hsync  44 Hback  148 Hpol P
                  Vfront    2 Vsync   5 Vback   15 Vpol P Vfront +0.5 Odd Field
                  Vfront    2 Vsync   5 Vback   15 Vpol P Vback  +0.5 Even Field
    DTD 10:  1280x720    50.000000 Hz  16:9     37.500 kHz     74.250000 MHz (16 mm x 9 mm)
                  Hfront  440 Hsync  40 Hback  220 Hpol P
                  Vfront    5 Vsync   5 Vback   20 Vpol P
Checksum: 0x73  Unused space in Extension Block: 16 bytes

----------------

Warnings:

Block 0, Base EDID:
  Basic Display Parameters & Features: Dubious maximum image size (16x9 is smaller than 10x10 cm).
  Detailed Timing Descriptor #1: Dubious image size (16x9 mm is smaller than 100x100 mm).
  Detailed Timing Descriptor #2: Dubious image size (16x9 mm is smaller than 100x100 mm).
Block 1, CTA-861 Extension Block:
  IT Video Formats are overscanned by default, but normally this should be underscanned.
  Video Data Block: VIC 1 and the first DTD are not identical. Is this intended?
  Detailed Timing Descriptor #3: Dubious image size (4x3 mm is smaller than 100x100 mm).
  Detailed Timing Descriptor #4: Dubious image size (4x3 mm is smaller than 100x100 mm).
  Detailed Timing Descriptor #5: Dubious image size (16x9 mm is smaller than 100x100 mm).
  Detailed Timing Descriptor #6: Dubious image size (16x9 mm is smaller than 100x100 mm).
  Add a Colorimetry Data Block with the sRGB colorimetry bit set to avoid interop issues.
Block 3, CTA-861 Extension Block:
  IT Video Formats are overscanned by default, but normally this should be underscanned.
  Detailed Timing Descriptor #7: Dubious image size (4x3 mm is smaller than 100x100 mm).
  Detailed Timing Descriptor #8: Dubious image size (4x3 mm is smaller than 100x100 mm).
  Detailed Timing Descriptor #9: Dubious image size (16x9 mm is smaller than 100x100 mm).
  Detailed Timing Descriptor #10: Dubious image size (16x9 mm is smaller than 100x100 mm).
EDID:
  Base EDID: Some timings are out of range of the Monitor Ranges:
    Vertical Freq: 24.000 - 84.960 Hz (Monitor: 49.000 - 61.000 Hz)
    Horizontal Freq: 15.625 - 93.880 kHz (Monitor: 15.000 - 46.000 kHz)
    Maximum Clock: 193.250 MHz (Monitor: 80.000 MHz)
  CTA-861: Multiple native interlaced timings are defined.

Failures:

Block 0, Base EDID:
  Detailed Timing Descriptor #1: Mismatch of image size 16x9 mm vs display size 160x90 mm.
  Detailed Timing Descriptor #2: Mismatch of image size 16x9 mm vs display size 160x90 mm.
Block 1, CTA-861 Extension Block:
  Detailed Timing Descriptor #3: Mismatch of image size 4x3 mm vs display size 160x90 mm.
  Detailed Timing Descriptor #4: Mismatch of image size 4x3 mm vs display size 160x90 mm.
  Detailed Timing Descriptor #5: Mismatch of image size 16x9 mm vs display size 160x90 mm.
  Detailed Timing Descriptor #6: Mismatch of image size 16x9 mm vs display size 160x90 mm.
  Missing VCDB, needed for Set Selectable RGB Quantization to avoid interop issues.
Block 2, Base EDID:
  Unknown Extension Block.
Block 3, CTA-861 Extension Block:
  Video Data Block: Duplicate VIC 1.
  Video Data Block: Duplicate VIC 2.
  Video Data Block: Duplicate VIC 4.
  Video Data Block: Duplicate VIC 5.
  Video Data Block: Duplicate VIC 6.
  Video Data Block: Duplicate VIC 17.
  Video Data Block: Duplicate VIC 19.
  Video Data Block: Duplicate VIC 20.
  Video Data Block: Duplicate VIC 21.
  Video Data Block: Duplicate VIC 3.
  Video Data Block: Duplicate VIC 7.
  Video Data Block: Duplicate VIC 18.
  Video Data Block: Duplicate VIC 22.
  Video Data Block: Duplicate VIC 31.
  Video Data Block: Duplicate VIC 32.
  Video Data Block: Duplicate VIC 16.
  Speaker Allocation Data Block: Only one instance of this Data Block is allowed.
  Detailed Timing Descriptor #7: Mismatch of image size 4x3 mm vs display size 160x90 mm.
  Detailed Timing Descriptor #8: Mismatch of image size 4x3 mm vs display size 160x90 mm.
  Detailed Timing Descriptor #9: Mismatch of image size 16x9 mm vs display size 160x90 mm.
  Detailed Timing Descriptor #10: Mismatch of image size 16x9 mm vs display size 160x90 mm.
EDID:
  Base EDID: EDID specified 1 extension block(s), but found 3 extension block(s).
  Base EDID: EDID 1.3 requires a Block Map Extension in Block 1 if there are more than 2 blocks in the EDID.
  CTA-861: A native interlaced timing is present, but not a native progressive timing.

EDID conformity: FAIL
