edid-decode (hex):

00 ff ff ff ff ff ff 00 06 af 3c 21 00 00 00 00
01 13 01 03 90 1f 11 78 0a 09 e5 97 57 54 93 27
22 50 54 00 00 00 01 01 01 01 01 01 01 01 01 01
01 01 01 01 01 01 20 1c 56 80 50 00 23 30 30 20
36 00 35 ae 10 00 00 1a 20 1c 56 80 50 00 23 30
30 20 36 00 35 ae 10 00 00 1a 00 00 00 fe 00 54
50 33 48 52 80 42 31 34 30 58 57 32 00 00 00 00
00 00 00 00 00 00 00 00 00 01 01 0a 20 20 00 57

00 ff ff ff ff ff ff 00 06 af 3c 21 00 00 00 00
01 13 01 03 90 1f 11 78 0a 09 e5 97 57 54 93 27
22 50 54 00 00 00 01 01 01 01 01 01 01 01 01 01
01 01 01 01 01 01 20 1c 56 80 50 00 23 30 30 20
36 00 35 ae 10 00 00 1a 20 1c 56 80 50 00 23 30
30 20 36 00 35 ae 10 00 00 1a 00 00 00 fe 00 54
50 33 48 52 80 42 31 34 30 58 57 32 00 00 00 00
00 00 00 00 00 00 00 00 00 01 01 0a 20 20 00 57

----------------

Block 0, Base EDID:
  EDID Structure Version & Revision: 1.3
  Vendor & Product Identification:
    Manufacturer: AUO
    Model: 8508
    Made in: week 1 of 2009
  Basic Display Parameters & Features:
    Digital display
    Maximum image size: 31 cm x 17 cm
    Gamma: 2.20
    RGB color display
    First detailed timing is the preferred timing
  Color Characteristics:
    Red  : 0.5898, 0.3398
    Green: 0.3300, 0.5751
    Blue : 0.1552, 0.1347
    White: 0.3134, 0.3291
  Established Timings I & II: none
  Standard Timings: none
  Detailed Timing Descriptors:
    DTD 1:  1366x768    60.015904 Hz 683:384   48.193 kHz     72.000000 MHz (309 mm x 174 mm)
                 Hfront   48 Hsync  32 Hback   48 Hpol P
                 Vfront    3 Vsync   6 Vback   26 Vpol N
    DTD 2:  1366x768    60.015904 Hz 683:384   48.193 kHz     72.000000 MHz (309 mm x 174 mm)
                 Hfront   48 Hsync  32 Hback   48 Hpol P
                 Vfront    3 Vsync   6 Vback   26 Vpol N
    Alphanumeric Data String: 'TP3HR.B140XW2'
    Manufacturer-Specified Display Descriptor (0x00): 00 00 00 00 00 00 00 00 00 00 00 01 01 0a 20 20 '..............  '
Checksum: 0x57

----------------

Warnings:

Block 0, Base EDID:
  Alphanumeric Data String: Non-ASCII character 0x80 at position 5, can cause problems.

Failures:

Block 0, Base EDID:
  Basic Display Parameters & Features: Digital Video Interface Standard set to reserved value 0x10.
  Missing Display Product Name.
  Missing Display Range Limits Descriptor.
EDID:
  Extension Block 1 started with EDID header, ignoring Extension Blocks >= 1.

EDID conformity: FAIL
