edid-decode (hex):

00 ff ff ff ff ff ff 00 22 64 75 22 01 01 01 01
23 13 01 03 80 34 1d 78 ea ee d5 a5 55 48 9b 26
12 50 54 a5 4b 80 81 80 81 c0 95 00 a9 40 b3 00
01 01 01 01 01 01 02 3a 80 18 71 38 2d 40 58 2c
45 00 09 25 21 00 00 1e 00 00 00 fc 00 48 61 6e
6e 73 2e 47 20 48 48 32 34 31 00 00 00 fd 00 38
4c 1f 52 11 00 0a 20 20 20 20 20 20 00 00 00 ff
00 39 33 35 52 58 33 58 59 30 33 38 33 39 01 40

02 03 29 f1 23 09 7f 07 4f 90 01 02 03 06 07 15
16 11 12 13 04 05 14 1f 83 01 00 00 6c 03 0c 00
10 00 b8 2d c0 01 01 01 01 8c 0a d0 8a 20 e0 2d
10 10 3e 96 00 09 25 21 00 00 18 8c 0a d0 90 20
40 31 20 0c 40 55 00 09 25 21 00 00 18 01 1d 80
18 71 1c 16 20 58 2c 25 00 09 25 21 00 00 9e 01
1d 80 d0 72 1c 16 20 10 2c 25 80 09 25 21 00 00
9e 00 00 00 00 00 00 00 00 00 00 00 00 00 00 b2

00 ff ff ff ff ff ff 00 22 64 75 22 01 01 01 01
23 13 01 03 80 34 1d 78 ea ee d5 a5 55 48 9b 26
12 50 54 a5 4b 80 81 80 81 c0 95 00 a9 40 b3 00
01 01 01 01 01 01 02 3a 80 18 71 38 2d 40 58 2c
45 00 09 25 21 00 00 1e 00 00 00 fc 00 48 61 6e
6e 73 2e 47 20 48 48 32 34 31 00 00 00 fd 00 38
4c 1f 52 11 00 0a 20 20 20 20 20 20 00 00 00 ff
00 39 33 35 52 58 33 58 59 30 33 38 33 39 01 40

02 03 29 f1 23 09 7f 07 4f 90 01 02 03 06 07 15
16 11 12 13 04 05 14 1f 83 01 00 00 6c 03 0c 00
10 00 b8 2d c0 01 01 01 01 8c 0a d0 8a 20 e0 2d
10 10 3e 96 00 09 25 21 00 00 18 8c 0a d0 90 20
40 31 20 0c 40 55 00 09 25 21 00 00 18 01 1d 80
18 71 1c 16 20 58 2c 25 00 09 25 21 00 00 9e 01
1d 80 d0 72 1c 16 20 10 2c 25 80 09 25 21 00 00
9e 00 00 00 00 00 00 00 00 00 00 00 00 00 00 b2

----------------

Block 0, Base EDID:
  EDID Structure Version & Revision: 1.3
  Vendor & Product Identification:
    Manufacturer: HSD
    Model: 8821
    Serial Number: ...
    Made in: week 35 of 2009
  Basic Display Parameters & Features:
    Digital display
    Maximum image size: 52 cm x 29 cm
    Gamma: 2.20
    DPMS levels: Standby Suspend Off
    RGB color display
    First detailed timing is the preferred timing
  Color Characteristics:
    Red  : 0.6474, 0.3339
    Green: 0.2841, 0.6074
    Blue : 0.1513, 0.0712
    White: 0.3134, 0.3291
  Established Timings I & II:
    IBM     :   720x400    70.081663 Hz   9:5     31.467 kHz     28.320000 MHz
    DMT 0x04:   640x480    59.940476 Hz   4:3     31.469 kHz     25.175000 MHz
    DMT 0x06:   640x480    75.000000 Hz   4:3     37.500 kHz     31.500000 MHz
    DMT 0x09:   800x600    60.316541 Hz   4:3     37.879 kHz     40.000000 MHz
    DMT 0x0b:   800x600    75.000000 Hz   4:3     46.875 kHz     49.500000 MHz
    DMT 0x10:  1024x768    60.003840 Hz   4:3     48.363 kHz     65.000000 MHz
    DMT 0x12:  1024x768    75.028582 Hz   4:3     60.023 kHz     78.750000 MHz
    DMT 0x24:  1280x1024   75.024675 Hz   5:4     79.976 kHz    135.000000 MHz
    Apple   :  1152x870    75.061550 Hz 192:145   68.681 kHz    100.000000 MHz
  Standard Timings:
    DMT 0x23:  1280x1024   60.019740 Hz   5:4     63.981 kHz    108.000000 MHz
    DMT 0x55:  1280x720    60.000000 Hz  16:9     45.000 kHz     74.250000 MHz
    DMT 0x2f:  1440x900    59.887445 Hz  16:10    55.935 kHz    106.500000 MHz
    DMT 0x33:  1600x1200   60.000000 Hz   4:3     75.000 kHz    162.000000 MHz
    DMT 0x3a:  1680x1050   59.954250 Hz  16:10    65.290 kHz    146.250000 MHz
  Detailed Timing Descriptors:
    DTD 1:  1920x1080   60.000000 Hz  16:9     67.500 kHz    148.500000 MHz (521 mm x 293 mm)
                 Hfront   88 Hsync  44 Hback  148 Hpol P
                 Vfront    4 Vsync   5 Vback   36 Vpol P
    Display Product Name: 'Hanns.G HH241'
    Display Range Limits:
      Monitor ranges (GTF): 56-76 Hz V, 31-82 kHz H, max dotclock 170 MHz
    Display Product Serial Number: ...
  Extension blocks: 1
Checksum: 0x40

----------------

Block 1, CTA-861 Extension Block:
  Revision: 3
  Underscans IT Video Formats by default
  Basic audio support
  Supports YCbCr 4:4:4
  Supports YCbCr 4:2:2
  Native DTDs: 1
  Audio Data Block:
    Linear PCM:
      Max channels: 2
      Supported sample rates (kHz): 192 176.4 96 88.2 48 44.1 32
      Supported sample sizes (bits): 24 20 16
  Video Data Block:
    VIC  16:  1920x1080   60.000000 Hz  16:9     67.500 kHz    148.500000 MHz (native)
    VIC   1:   640x480    59.940476 Hz   4:3     31.469 kHz     25.175000 MHz
    VIC   2:   720x480    59.940060 Hz   4:3     31.469 kHz     27.000000 MHz
    VIC   3:   720x480    59.940060 Hz  16:9     31.469 kHz     27.000000 MHz
    VIC   6:  1440x480i   59.940060 Hz   4:3     15.734 kHz     27.000000 MHz
    VIC   7:  1440x480i   59.940060 Hz  16:9     15.734 kHz     27.000000 MHz
    VIC  21:  1440x576i   50.000000 Hz   4:3     15.625 kHz     27.000000 MHz
    VIC  22:  1440x576i   50.000000 Hz  16:9     15.625 kHz     27.000000 MHz
    VIC  17:   720x576    50.000000 Hz   4:3     31.250 kHz     27.000000 MHz
    VIC  18:   720x576    50.000000 Hz  16:9     31.250 kHz     27.000000 MHz
    VIC  19:  1280x720    50.000000 Hz  16:9     37.500 kHz     74.250000 MHz
    VIC   4:  1280x720    60.000000 Hz  16:9     45.000 kHz     74.250000 MHz
    VIC   5:  1920x1080i  60.000000 Hz  16:9     33.750 kHz     74.250000 MHz
    VIC  20:  1920x1080i  50.000000 Hz  16:9     28.125 kHz     74.250000 MHz
    VIC  31:  1920x1080   50.000000 Hz  16:9     56.250 kHz    148.500000 MHz
  Speaker Allocation Data Block:
    FL/FR - Front Left/Right
  Vendor-Specific Data Block (HDMI), OUI 00-0C-03:
    Source physical address: 1.0.0.0
    Supports_AI
    DC_36bit
    DC_30bit
    DC_Y444
    Maximum TMDS clock: 225 MHz
    Video latency: 0 ms
    Audio latency: 0 ms
    Interlaced video latency: 0 ms
    Interlaced audio latency: 0 ms
  Detailed Timing Descriptors:
    DTD 2:   720x480    59.940060 Hz   3:2     31.469 kHz     27.000000 MHz (521 mm x 293 mm)
                 Hfront   16 Hsync  62 Hback   60 Hpol N
                 Vfront    9 Vsync   6 Vback   30 Vpol N
    DTD 3:   720x576    50.000000 Hz   5:4     31.250 kHz     27.000000 MHz (521 mm x 293 mm)
                 Hfront   12 Hsync  64 Hback   68 Hpol N
                 Vfront    5 Vsync   5 Vback   39 Vpol N
    DTD 4:  1920x1080i  60.000000 Hz  16:9     33.750 kHz     74.250000 MHz (521 mm x 293 mm)
                 Hfront   88 Hsync  44 Hback  148 Hpol P
                 Vfront    2 Vsync   5 Vback   15 Vpol P Vfront +0.5 Odd Field
                 Vfront    2 Vsync   5 Vback   15 Vpol P Vback  +0.5 Even Field
    DTD 5:  1920x1080i  50.000000 Hz  16:9     28.125 kHz     74.250000 MHz (521 mm x 293 mm)
                 Hfront  528 Hsync  44 Hback  148 Hpol P
                 Vfront    2 Vsync   5 Vback   15 Vpol P Vfront +0.5 Odd Field
                 Vfront    2 Vsync   5 Vback   15 Vpol P Vback  +0.5 Even Field
Checksum: 0xb2  Unused space in Extension Block: 14 bytes

----------------

Warnings:

Block 0, Base EDID:
  Vendor & Product Identification: The serial number is one of the known dummy values, it should probably be set to 0.
Block 1, CTA-861 Extension Block:
  Vendor-Specific Data Block (HDMI), OUI 00-0C-03: Progressive and Interlaced latency values are identical, no need for both.
  Detailed Timing Descriptor #2: Image size is 521x293 mm, but based on the picture AR it should be 439x293 mm.
  Detailed Timing Descriptor #3: Image size is 521x293 mm, but based on the picture AR it should be 366x293 mm.
  Display Product Serial Number is set, so the Serial Number in the Base EDID should be 0.
  Add a Colorimetry Data Block with the sRGB colorimetry bit set to avoid interop issues.
EDID:
  Base EDID: Some timings are out of range of the Monitor Ranges:
    Vertical Freq: 50.000 - 75.062 Hz (Monitor: 56.000 - 76.000 Hz)
    Horizontal Freq: 15.625 - 79.976 kHz (Monitor: 31.000 - 82.000 kHz)

Failures:

Block 1, CTA-861 Extension Block:
  Missing VCDB, needed for Set Selectable RGB Quantization to avoid interop issues.
EDID:
  Extension Block 2 started with EDID header, ignoring Extension Blocks >= 2.

EDID conformity: FAIL
