edid-decode (hex):

00 ff ff ff ff ff ff 00 09 e5 42 0c 00 00 00 00
17 21 01 04 a5 23 16 78 07 14 a5 a7 53 4d 9d 26
0e 50 54 00 00 00 01 01 01 01 01 01 01 01 01 01
01 01 01 01 01 01 4c ae 80 a0 70 b0 47 49 30 20
36 00 59 d7 10 00 00 1a 00 00 00 fd 00 30 a5 d7
d7 2d 01 0a 20 20 20 20 20 20 00 00 00 fc 00 4e
45 31 36 30 57 55 4d 2d 4e 58 34 0a 00 00 00 00
00 00 00 00 00 00 00 00 00 00 00 00 00 00 01 58

70 20 79 02 00 21 00 1d 7a 0d 66 08 80 07 b0 04
88 6e 3a 53 d4 e4 9c 66 92 0e 02 35 54 00 80 00
80 00 80 12 78 25 00 09 f7 ce 06 f7 ce 06 30 a5
80 22 00 14 f7 ce 06 85 7f 07 9f 00 2f 00 1f 00
af 04 63 00 02 00 05 00 2b 00 0c 27 00 30 a4 00
00 27 00 30 3b 00 00 81 00 13 72 1a 00 00 03 01
30 a5 00 00 4a 51 4a 51 a5 00 00 00 00 00 00 00
00 00 00 00 00 00 00 00 00 00 00 00 00 00 be 90

00 ff ff ff ff ff ff 00 09 e5 42 0c 00 00 00 00
17 21 01 04 a5 23 16 78 07 14 a5 a7 53 4d 9d 26
0e 50 54 00 00 00 01 01 01 01 01 01 01 01 01 01
01 01 01 01 01 01 4c ae 80 a0 70 b0 47 49 30 20
36 00 59 d7 10 00 00 1a 00 00 00 fd 00 30 a5 d7
d7 2d 01 0a 20 20 20 20 20 20 00 00 00 fc 00 4e
45 31 36 30 57 55 4d 2d 4e 58 34 0a 00 00 00 00
00 00 00 00 00 00 00 00 00 00 00 00 00 00 01 58

70 20 79 02 00 21 00 1d 7a 0d 66 08 80 07 b0 04
88 6e 3a 53 d4 e4 9c 66 92 0e 02 35 54 00 80 00
80 00 80 12 78 25 00 09 f7 ce 06 f7 ce 06 30 a5
80 22 00 14 f7 ce 06 85 7f 07 9f 00 2f 00 1f 00
af 04 63 00 02 00 05 00 2b 00 0c 27 00 30 a4 00
00 27 00 30 3b 00 00 81 00 13 72 1a 00 00 03 01
30 a5 00 00 4a 51 4a 51 a5 00 00 00 00 00 00 00
00 00 00 00 00 00 00 00 00 00 00 00 00 00 be 90

----------------

Block 0, Base EDID:
  EDID Structure Version & Revision: 1.4
  Vendor & Product Identification:
    Manufacturer: BOE
    Model: 3138
    Made in: week 23 of 2023
  Basic Display Parameters & Features:
    Digital display
    Bits per primary color channel: 8
    DisplayPort interface
    Maximum image size: 35 cm x 22 cm
    Gamma: 2.20
    Supported color formats: RGB 4:4:4
    Default (sRGB) color space is primary color space
    First detailed timing includes the native pixel format and preferred refresh rate
    Display supports continuous frequencies
  Color Characteristics:
    Red  : 0.6523, 0.3251
    Green: 0.3017, 0.6132
    Blue : 0.1503, 0.0566
    White: 0.3134, 0.3291
  Established Timings I & II: none
  Standard Timings: none
  Detailed Timing Descriptors:
    DTD 1:  1920x1200   60.005379 Hz  16:10   214.519 kHz    446.200000 MHz (345 mm x 215 mm)
                 Hfront   48 Hsync  32 Hback   80 Hpol P
                 Vfront    3 Vsync   6 Vback 2366 Vpol N
    Display Range Limits:
      Monitor ranges (Range Limits Only): 48-165 Hz V, 215-215 kHz H, max dotclock 450 MHz
    Display Product Name: 'NE160WUM-NX4'
    Empty Descriptor
  Extension blocks: 1
Checksum: 0x58

----------------

Block 1, DisplayID Extension Block:
  Version: 2.0
  Extension Count: 0
  Display Product Primary Use Case: None of the listed primary use cases; generic display
  Display Parameters Data Block (0x21):
    Image size: 345.0 mm x 215.0 mm
    Display native pixel format: 1920x1200
    Scan Orientation: Left to Right, Top to Bottom
    Luminance Information: Guidance for the Source device
    Color Information: CIE 1931
    Audio Speaker Information: not integrated
    Native Color Chromaticity:
      Primary #1:  (0.651855, 0.324951)
      Primary #2:  (0.301758, 0.612793)
      Primary #3:  (0.149902, 0.056885)
      White Point: (0.312988, 0.328857)
    Native Maximum Luminance (Full Coverage): do not use
    Native Maximum Luminance (10% Rectangular Coverage): do not use
    Native Minimum Luminance: do not use
    Native Color Depth: 10 bpc
    Display Device Technology: Active Matrix LCD
    Native Gamma EOTF: 2.20
  Dynamic Video Timing Range Limits Data Block:
    Minimum Pixel Clock: 446200 kHz
    Maximum Pixel Clock: 446200 kHz
    Minimum Vertical Refresh Rate: 48 Hz
    Maximum Vertical Refresh Rate: 165 Hz
    Seamless Dynamic Video Timing Support: Yes
  Video Timing Modes Type 7 - Detailed Timings Data Block:
    DTD:  1920x1200  165.014793 Hz  16:10   214.519 kHz    446.200000 MHz (aspect 16:10, no 3D stereo, preferred)
               Hfront   48 Hsync  32 Hback   80 Hpol N
               Vfront    3 Vsync   6 Vback   91 Vpol N
  Adaptive Sync Data Block:
    Descriptor #1:
      Native Panel Range
      Fixed Average V-Total and Adaptive V-Total
      Supports Seamless Transition
      'Max Single Frame Duration Increase' field value without jitter impact
      'Max Single Frame Duration Decrease' field value without jitter impact
      Max Duration Increase: 0.00 ms
      Max Duration Decrease: 0.00 ms
      Min Refresh Rate: 48 Hz
      Max Refresh Rate: 165 Hz
    Descriptor #2:
      Native Panel Range
      Fixed Average V-Total and Adaptive V-Total
      Supports Seamless Transition
      'Max Single Frame Duration Increase' field value without jitter impact
      'Max Single Frame Duration Decrease' field value without jitter impact
      Max Duration Increase: 0.00 ms
      Max Duration Decrease: 0.00 ms
      Min Refresh Rate: 48 Hz
      Max Refresh Rate: 60 Hz
  CTA-861 DisplayID Data Block:
  Vendor-Specific Data Block (AMD), OUI 00-00-1A:
    Version: 3
    Feature Caps: 0x01
    Minimum Refresh Rate: 48 Hz
    Maximum Refresh Rate: 165 Hz
    Flags 1.x: 0x00
    Flags 2.x: 0x00
  Checksum: 0xbe
Checksum: 0x90

----------------

Block 2, Unknown EDID Extension Block 0x00:
  00 ff ff ff ff ff ff 00 09 e5 42 0c 00 00 00 00 '..........B.....'
  17 21 01 04 a5 23 16 78 07 14 a5 a7 53 4d 9d 26 '.!...#.x....SM.&'
  0e 50 54 00 00 00 01 01 01 01 01 01 01 01 01 01 '.PT.............'
  01 01 01 01 01 01 4c ae 80 a0 70 b0 47 49 30 20 '......L...p.GI0 '
  36 00 59 d7 10 00 00 1a 00 00 00 fd 00 30 a5 d7 '6.Y..........0..'
  d7 2d 01 0a 20 20 20 20 20 20 00 00 00 fc 00 4e '.-..      .....N'
  45 31 36 30 57 55 4d 2d 4e 58 34 0a 00 00 00 00 'E160WUM-NX4.....'
  00 00 00 00 00 00 00 00 00 00 00 00 00 00 01 58 '...............X'
Checksum: 0x58

----------------

Block 3, DisplayID Extension Block:
  Version: 2.0
  Extension Count: 0
  Display Parameters Data Block (0x21):
    Image size: 345.0 mm x 215.0 mm
    Display native pixel format: 1920x1200
    Scan Orientation: Left to Right, Top to Bottom
    Luminance Information: Guidance for the Source device
    Color Information: CIE 1931
    Audio Speaker Information: not integrated
    Native Color Chromaticity:
      Primary #1:  (0.651855, 0.324951)
      Primary #2:  (0.301758, 0.612793)
      Primary #3:  (0.149902, 0.056885)
      White Point: (0.312988, 0.328857)
    Native Maximum Luminance (Full Coverage): do not use
    Native Maximum Luminance (10% Rectangular Coverage): do not use
    Native Minimum Luminance: do not use
    Native Color Depth: 10 bpc
    Display Device Technology: Active Matrix LCD
    Native Gamma EOTF: 2.20
  Dynamic Video Timing Range Limits Data Block:
    Minimum Pixel Clock: 446200 kHz
    Maximum Pixel Clock: 446200 kHz
    Minimum Vertical Refresh Rate: 48 Hz
    Maximum Vertical Refresh Rate: 165 Hz
    Seamless Dynamic Video Timing Support: Yes
  Video Timing Modes Type 7 - Detailed Timings Data Block:
    DTD:  1920x1200  165.014793 Hz  16:10   214.519 kHz    446.200000 MHz (aspect 16:10, no 3D stereo, preferred)
               Hfront   48 Hsync  32 Hback   80 Hpol N
               Vfront    3 Vsync   6 Vback   91 Vpol N
  Adaptive Sync Data Block:
    Descriptor #1:
      Native Panel Range
      Fixed Average V-Total and Adaptive V-Total
      Supports Seamless Transition
      'Max Single Frame Duration Increase' field value without jitter impact
      'Max Single Frame Duration Decrease' field value without jitter impact
      Max Duration Increase: 0.00 ms
      Max Duration Decrease: 0.00 ms
      Min Refresh Rate: 48 Hz
      Max Refresh Rate: 165 Hz
    Descriptor #2:
      Native Panel Range
      Fixed Average V-Total and Adaptive V-Total
      Supports Seamless Transition
      'Max Single Frame Duration Increase' field value without jitter impact
      'Max Single Frame Duration Decrease' field value without jitter impact
      Max Duration Increase: 0.00 ms
      Max Duration Decrease: 0.00 ms
      Min Refresh Rate: 48 Hz
      Max Refresh Rate: 60 Hz
  CTA-861 DisplayID Data Block:
  Vendor-Specific Data Block (AMD), OUI 00-00-1A:
    Version: 3
    Feature Caps: 0x01
    Minimum Refresh Rate: 48 Hz
    Maximum Refresh Rate: 165 Hz
    Flags 1.x: 0x00
    Flags 2.x: 0x00
  Checksum: 0xbe
Checksum: 0x90

----------------

Failures:

Block 0, Base EDID:
  Basic Display Parameters & Features: sRGB is signaled, but the chromaticities do not match.
  Empty Descriptor: Use Dummy Descriptor instead of all zeroes.
Block 1, DisplayID Extension Block:
  Expected 0 DisplayID Extension Block, but got 1.
Block 2, Base EDID:
  Unknown Extension Block.
Block 3, DisplayID Extension Block:
  Product Type should be 0 in extension block.
  Display Parameters Data Block (0x21): Duplicate Display Parameters Data Block.
EDID:
  Base EDID: EDID specified 1 extension block(s), but found 3 extension block(s).

EDID conformity: FAIL
