edid-decode (hex):

00 ff ff ff ff ff ff 00 0c ac 00 01 01 00 00 00
08 1c 01 03 80 00 00 78 0a 23 ad a4 54 4d 99 26
0f 47 4a a3 08 00 b3 00 81 80 81 40 81 c0 00 00
00 00 00 00 00 00 02 3a 80 18 71 38 2d 40 58 2c
45 00 50 1d 74 00 00 1e 01 1d 00 72 51 d0 1e 20
6e 28 55 00 c4 8e 21 00 00 1e 00 00 00 fd 00 32
4b 1e 50 10 01 00 0a 20 20 20 20 20 00 00 00 fc
00 34 4b 2f 36 30 48 5a 20 31 58 32 00 00 01 ff

02 03 25 f4 4a 90 1f 04 13 05 14 03 12 07 16 23
09 07 03 83 01 00 00 6a 03 0c 00 11 00 00 2d 00
08 00 e2 00 ff 02 3a 80 18 71 38 2d 40 58 2c 45
00 50 1d 74 00 00 1e 01 1d 00 72 51 d0 1e 20 6e
28 55 00 c4 8e 21 00 00 1e 01 1d 80 18 71 1c 16
20 58 2c 25 00 c4 8e 21 00 00 9e 8c 0a d0 8a 20
e0 2d 10 10 3e 96 00 13 8e 21 00 00 18 00 00 00
00 00 00 00 00 00 00 00 00 00 00 00 00 00 00 f2

00 ff ff ff ff ff ff 00 0c ac 00 01 01 00 00 00
08 1c 01 03 80 00 00 78 0a 23 ad a4 54 4d 99 26
0f 47 4a a3 08 00 b3 00 81 80 81 40 81 c0 00 00
00 00 00 00 00 00 02 3a 80 18 71 38 2d 40 58 2c
45 00 50 1d 74 00 00 1e 01 1d 00 72 51 d0 1e 20
6e 28 55 00 c4 8e 21 00 00 1e 00 00 00 fd 00 32
4b 1e 50 10 01 00 0a 20 20 20 20 20 00 00 00 fc
00 34 4b 2f 36 30 48 5a 20 31 58 32 00 00 01 ff

02 03 25 f4 4a 90 1f 04 13 05 14 03 12 07 16 23
09 07 03 83 01 00 00 6a 03 0c 00 11 00 00 2d 00
08 00 e2 00 ff 02 3a 80 18 71 38 2d 40 58 2c 45
00 50 1d 74 00 00 1e 01 1d 00 72 51 d0 1e 20 6e
28 55 00 c4 8e 21 00 00 1e 01 1d 80 18 71 1c 16
20 58 2c 25 00 c4 8e 21 00 00 9e 8c 0a d0 8a 20
e0 2d 10 10 3e 96 00 13 8e 21 00 00 18 00 00 00
00 00 00 00 00 00 00 00 00 00 00 00 00 00 00 f2

----------------

Block 0, Base EDID:
  EDID Structure Version & Revision: 1.3
  Vendor & Product Identification:
    Manufacturer: CEL
    Model: 256
    Serial Number: ...
    Made in: week 8 of 2018
  Basic Display Parameters & Features:
    Digital display
    Image size is variable
    Gamma: 2.20
    RGB color display
    First detailed timing is the preferred timing
  Color Characteristics:
    Red  : 0.6406, 0.3300
    Green: 0.3007, 0.6005
    Blue : 0.1503, 0.0605
    White: 0.2802, 0.2900
  Established Timings I & II:
    IBM     :   720x400    70.081663 Hz   9:5     31.467 kHz     28.320000 MHz
    DMT 0x04:   640x480    59.940476 Hz   4:3     31.469 kHz     25.175000 MHz
    DMT 0x08:   800x600    56.250000 Hz   4:3     35.156 kHz     36.000000 MHz
    DMT 0x09:   800x600    60.316541 Hz   4:3     37.879 kHz     40.000000 MHz
    DMT 0x10:  1024x768    60.003840 Hz   4:3     48.363 kHz     65.000000 MHz
  Standard Timings:
    DMT 0x3a:  1680x1050   59.954250 Hz  16:10    65.290 kHz    146.250000 MHz
    DMT 0x23:  1280x1024   60.019740 Hz   5:4     63.981 kHz    108.000000 MHz
    DMT 0x20:  1280x960    60.000000 Hz   4:3     60.000 kHz    108.000000 MHz
    DMT 0x55:  1280x720    60.000000 Hz  16:9     45.000 kHz     74.250000 MHz
  Detailed Timing Descriptors:
    DTD 1:  1920x1080   60.000000 Hz  16:9     67.500 kHz    148.500000 MHz (1872 mm x 1053 mm)
                 Hfront   88 Hsync  44 Hback  148 Hpol P
                 Vfront    4 Vsync   5 Vback   36 Vpol P
    DTD 2:  1280x720    60.000000 Hz  16:9     45.000 kHz     74.250000 MHz (708 mm x 398 mm)
                 Hfront  110 Hsync  40 Hback  220 Hpol P
                 Vfront    5 Vsync   5 Vback   20 Vpol P
    Display Range Limits:
      Monitor ranges (Range Limits Only): 50-75 Hz V, 30-80 kHz H, max dotclock 160 MHz
    Display Product Name: '4K/60HZ 1X2'
  Extension blocks: 1
Checksum: 0xff

----------------

Block 1, CTA-861 Extension Block:
  Revision: 3
  Underscans IT Video Formats by default
  Basic audio support
  Supports YCbCr 4:4:4
  Supports YCbCr 4:2:2
  Native DTDs: 4
  Video Data Block:
    VIC  16:  1920x1080   60.000000 Hz  16:9     67.500 kHz    148.500000 MHz (native)
    VIC  31:  1920x1080   50.000000 Hz  16:9     56.250 kHz    148.500000 MHz
    VIC   4:  1280x720    60.000000 Hz  16:9     45.000 kHz     74.250000 MHz
    VIC  19:  1280x720    50.000000 Hz  16:9     37.500 kHz     74.250000 MHz
    VIC   5:  1920x1080i  60.000000 Hz  16:9     33.750 kHz     74.250000 MHz
    VIC  20:  1920x1080i  50.000000 Hz  16:9     28.125 kHz     74.250000 MHz
    VIC   3:   720x480    59.940060 Hz  16:9     31.469 kHz     27.000000 MHz
    VIC  18:   720x576    50.000000 Hz  16:9     31.250 kHz     27.000000 MHz
    VIC   7:  1440x480i   59.940060 Hz  16:9     15.734 kHz     27.000000 MHz
    VIC  22:  1440x576i   50.000000 Hz  16:9     15.625 kHz     27.000000 MHz
  Audio Data Block:
    Linear PCM:
      Max channels: 2
      Supported sample rates (kHz): 48 44.1 32
      Supported sample sizes (bits): 20 16
  Speaker Allocation Data Block:
    FL/FR - Front Left/Right
  Vendor-Specific Data Block (HDMI), OUI 00-0C-03:
    Source physical address: 1.1.0.0
    Maximum TMDS clock: 225 MHz
  Video Capability Data Block:
    YCbCr quantization: Selectable (via AVI YQ)
    RGB quantization: Selectable (via AVI Q)
    PT scan behavior: Supports both over- and underscan
    IT scan behavior: Supports both over- and underscan
    CE scan behavior: Supports both over- and underscan
  Detailed Timing Descriptors:
    DTD 3:  1920x1080   60.000000 Hz  16:9     67.500 kHz    148.500000 MHz (1872 mm x 1053 mm)
                 Hfront   88 Hsync  44 Hback  148 Hpol P
                 Vfront    4 Vsync   5 Vback   36 Vpol P
    DTD 4:  1280x720    60.000000 Hz  16:9     45.000 kHz     74.250000 MHz (708 mm x 398 mm)
                 Hfront  110 Hsync  40 Hback  220 Hpol P
                 Vfront    5 Vsync   5 Vback   20 Vpol P
    DTD 5:  1920x1080i  60.000000 Hz  16:9     33.750 kHz     74.250000 MHz (708 mm x 398 mm)
                 Hfront   88 Hsync  44 Hback  148 Hpol P
                 Vfront    2 Vsync   5 Vback   15 Vpol P Vfront +0.5 Odd Field
                 Vfront    2 Vsync   5 Vback   15 Vpol P Vback  +0.5 Even Field
    DTD 6:   720x480    59.940060 Hz   3:2     31.469 kHz     27.000000 MHz (531 mm x 398 mm)
                 Hfront   16 Hsync  62 Hback   60 Hpol N
                 Vfront    9 Vsync   6 Vback   30 Vpol N
Checksum: 0xf2  Unused space in Extension Block: 18 bytes

----------------

Warnings:

Block 0, Base EDID:
  Vendor & Product Identification: The serial number is one of the known dummy values, it should probably be set to 0.
Block 1, CTA-861 Extension Block:
  Video Capability Data Block: S_PT is equal to S_IT and S_CE, so should be set to 0 instead.
  Detailed Timing Descriptor #6: Image size is 531x398 mm, but based on the picture AR it should be 531x354 mm.
  Add a Colorimetry Data Block with the sRGB colorimetry bit set to avoid interop issues.
EDID:
  Base EDID: Some timings are out of range of the Monitor Ranges:
    Horizontal Freq: 15.625 - 67.500 kHz (Monitor: 30.000 - 80.000 kHz)

Failures:

Block 0, Base EDID:
  Standard Timings: Use 0x0101 as the invalid Standard Timings code, not 0x0000.
  Standard Timings: Use 0x0101 as the invalid Standard Timings code, not 0x0000.
  Standard Timings: Use 0x0101 as the invalid Standard Timings code, not 0x0000.
  Standard Timings: Use 0x0101 as the invalid Standard Timings code, not 0x0000.
  Display Range Limits: 'Range Limits Only' is not allowed for EDID < 1.4.
  Display Range Limits: Byte 11 is 0x00 instead of 0x0a.
  Display Range Limits: Bytes 12-17 must be 0x20.
  Display Product Name: NUL byte at position 11.
EDID:
  Extension Block 2 started with EDID header, ignoring Extension Blocks >= 2.
  Base EDID: The DTD max image size is 1872x1053mm, but the display size is not specified anywhere.
  CTA-861: Native progressive timings are a mix of several resolutions.

EDID conformity: FAIL
