edid-decode (hex):

00 ff ff ff ff ff ff 00 4e 84 00 27 00 00 00 00
1d 23 01 03 80 3c 21 78 2a 2b 9e a9 54 4d 9f 24
10 50 54 af cf 00 95 00 95 0f 81 80 a9 c0 a9 cf
b3 00 b3 0f d1 cf 59 5e 00 a0 a0 a0 28 50 30 20
35 00 56 50 21 00 00 1a 00 00 00 fd 00 30 78 de
de 32 00 0a 20 20 20 20 20 20 00 00 00 fc 00 41
52 55 52 0a 20 20 20 20 20 20 20 20 00 00 00 ff
00 31 32 33 34 35 36 37 38 39 30 31 32 33 01 5d

02 03 35 f1 49 01 02 03 12 13 04 1f 90 3f 23 09
1f 07 83 01 00 00 67 03 0c 00 10 00 18 48 6d d8
5d c4 01 78 80 01 00 00 00 00 00 00 68 1a 00 00
01 01 30 78 00 02 3a 80 18 71 38 2d 40 30 20 36
00 56 50 21 00 00 1e ac 73 00 6a a0 a0 29 50 30
20 35 00 56 50 21 00 00 1e e4 99 00 78 a0 a0 1e
50 18 20 35 00 56 50 21 00 00 1a 69 b7 00 78 a0
a0 14 50 30 20 35 00 56 50 21 00 00 1e 00 00 8f

00 ff ff ff ff ff ff 00 4e 84 00 27 00 00 00 00
1d 23 01 03 80 3c 21 78 2a 2b 9e a9 54 4d 9f 24
10 50 54 af cf 00 95 00 95 0f 81 80 a9 c0 a9 cf
b3 00 b3 0f d1 cf 59 5e 00 a0 a0 a0 28 50 30 20
35 00 56 50 21 00 00 1a 00 00 00 fd 00 30 78 de
de 32 00 0a 20 20 20 20 20 20 00 00 00 fc 00 41
52 55 52 0a 20 20 20 20 20 20 20 20 00 00 00 ff
00 31 32 33 34 35 36 37 38 39 30 31 32 33 01 5d

02 03 35 f1 49 01 02 03 12 13 04 1f 90 3f 23 09
1f 07 83 01 00 00 67 03 0c 00 10 00 18 48 6d d8
5d c4 01 78 80 01 00 00 00 00 00 00 68 1a 00 00
01 01 30 78 00 02 3a 80 18 71 38 2d 40 30 20 36
00 56 50 21 00 00 1e ac 73 00 6a a0 a0 29 50 30
20 35 00 56 50 21 00 00 1e e4 99 00 78 a0 a0 1e
50 18 20 35 00 56 50 21 00 00 1a 69 b7 00 78 a0
a0 14 50 30 20 35 00 56 50 21 00 00 1e 00 00 8f

----------------

Block 0, Base EDID:
  EDID Structure Version & Revision: 1.3
  Vendor & Product Identification:
    Manufacturer: STD
    Model: 9984
    Made in: week 29 of 2025
  Basic Display Parameters & Features:
    Digital display
    Maximum image size: 60 cm x 33 cm
    Gamma: 2.20
    DPMS levels: Off
    RGB color display
    First detailed timing is the preferred timing
  Color Characteristics:
    Red  : 0.6601, 0.3300
    Green: 0.3027, 0.6240
    Blue : 0.1425, 0.0634
    White: 0.3154, 0.3300
  Established Timings I & II:
    IBM     :   720x400    70.081663 Hz   9:5     31.467 kHz     28.320000 MHz
    DMT 0x04:   640x480    59.940476 Hz   4:3     31.469 kHz     25.175000 MHz
    DMT 0x05:   640x480    72.808802 Hz   4:3     37.861 kHz     31.500000 MHz
    DMT 0x06:   640x480    75.000000 Hz   4:3     37.500 kHz     31.500000 MHz
    DMT 0x08:   800x600    56.250000 Hz   4:3     35.156 kHz     36.000000 MHz
    DMT 0x09:   800x600    60.316541 Hz   4:3     37.879 kHz     40.000000 MHz
    DMT 0x0a:   800x600    72.187572 Hz   4:3     48.077 kHz     50.000000 MHz
    DMT 0x0b:   800x600    75.000000 Hz   4:3     46.875 kHz     49.500000 MHz
    DMT 0x10:  1024x768    60.003840 Hz   4:3     48.363 kHz     65.000000 MHz
    DMT 0x11:  1024x768    70.069359 Hz   4:3     56.476 kHz     75.000000 MHz
    DMT 0x12:  1024x768    75.028582 Hz   4:3     60.023 kHz     78.750000 MHz
    DMT 0x24:  1280x1024   75.024675 Hz   5:4     79.976 kHz    135.000000 MHz
  Standard Timings:
    DMT 0x2f:  1440x900    59.887445 Hz  16:10    55.935 kHz    106.500000 MHz
    DMT 0x30:  1440x900    74.984427 Hz  16:10    70.635 kHz    136.750000 MHz
    DMT 0x23:  1280x1024   60.019740 Hz   5:4     63.981 kHz    108.000000 MHz
    DMT 0x53:  1600x900    60.000000 Hz  16:9     60.000 kHz    108.000000 MHz (RB)
    GTF     :  1600x900    75.000000 Hz  16:9     70.500 kHz    152.280000 MHz
    DMT 0x3a:  1680x1050   59.954250 Hz  16:10    65.290 kHz    146.250000 MHz
    DMT 0x3b:  1680x1050   74.892027 Hz  16:10    82.306 kHz    187.000000 MHz
    GTF     :  1920x1080   75.000068 Hz  16:9     84.600 kHz    220.637000 MHz
  Detailed Timing Descriptors:
    DTD 1:  2560x1440   59.998510 Hz  16:9     88.798 kHz    241.530000 MHz (598 mm x 336 mm)
                 Hfront   48 Hsync  32 Hback   80 Hpol P
                 Vfront    3 Vsync   5 Vback   32 Vpol N
    Display Range Limits:
      Monitor ranges (GTF): 48-120 Hz V, 222-222 kHz H, max dotclock 500 MHz
    Display Product Name: 'ARUR'
    Display Product Serial Number: ...
  Extension blocks: 1
Checksum: 0x5d

----------------

Block 1, CTA-861 Extension Block:
  Revision: 3
  Underscans IT Video Formats by default
  Basic audio support
  Supports YCbCr 4:4:4
  Supports YCbCr 4:2:2
  Native DTDs: 1
  Video Data Block:
    VIC   1:   640x480    59.940476 Hz   4:3     31.469 kHz     25.175000 MHz
    VIC   2:   720x480    59.940060 Hz   4:3     31.469 kHz     27.000000 MHz
    VIC   3:   720x480    59.940060 Hz  16:9     31.469 kHz     27.000000 MHz
    VIC  18:   720x576    50.000000 Hz  16:9     31.250 kHz     27.000000 MHz
    VIC  19:  1280x720    50.000000 Hz  16:9     37.500 kHz     74.250000 MHz
    VIC   4:  1280x720    60.000000 Hz  16:9     45.000 kHz     74.250000 MHz
    VIC  31:  1920x1080   50.000000 Hz  16:9     56.250 kHz    148.500000 MHz
    VIC  16:  1920x1080   60.000000 Hz  16:9     67.500 kHz    148.500000 MHz (native)
    VIC  63:  1920x1080  120.000000 Hz  16:9    135.000 kHz    297.000000 MHz
  Audio Data Block:
    Linear PCM:
      Max channels: 2
      Supported sample rates (kHz): 96 88.2 48 44.1 32
      Supported sample sizes (bits): 24 20 16
  Speaker Allocation Data Block:
    FL/FR - Front Left/Right
  Vendor-Specific Data Block (HDMI), OUI 00-0C-03:
    Source physical address: 1.0.0.0
    DC_30bit
    DC_Y444
    Maximum TMDS clock: 360 MHz
  Vendor-Specific Data Block (HDMI Forum), OUI C4-5D-D8:
    Version: 1
    Maximum TMDS Character Rate: 600 MHz
    SCDC Present
    Supports 10-bits/component Deep Color 4:2:0 Pixel Encoding
    VRRmin: 0 Hz
    VRRmax: 0 Hz
  Vendor-Specific Data Block (AMD), OUI 00-00-1A:
    Version: 1
    Flags 1: 0x01
      FreeSync Supported
    Minimum Refresh Rate: 48 Hz
    Maximum Refresh Rate: 120 Hz
  Detailed Timing Descriptors:
    DTD 2:  1920x1080   60.000000 Hz  16:9     67.500 kHz    148.500000 MHz (598 mm x 336 mm)
                 Hfront   48 Hsync  32 Hback  200 Hpol P
                 Vfront    3 Vsync   6 Vback   36 Vpol P
    DTD 3:  2560x1440   74.998493 Hz  16:9    111.073 kHz    296.120000 MHz (598 mm x 336 mm)
                 Hfront   48 Hsync  32 Hback   26 Hpol P
                 Vfront    3 Vsync   5 Vback   33 Vpol P
    DTD 4:  2560x1440  100.000000 Hz  16:9    147.000 kHz    393.960000 MHz (598 mm x 336 mm)
                 Hfront   24 Hsync  32 Hback   64 Hpol P
                 Vfront    3 Vsync   5 Vback   22 Vpol N
    DTD 5:  2560x1440  119.998467 Hz  16:9    175.198 kHz    469.530000 MHz (598 mm x 336 mm)
                 Hfront   48 Hsync  32 Hback   40 Hpol P
                 Vfront    3 Vsync   5 Vback   12 Vpol P
Checksum: 0x8f  Unused space in Extension Block: 2 bytes

----------------

Warnings:

Block 0, Base EDID:
  Display Product Serial Number: ...
Block 1, CTA-861 Extension Block:
  Video Data Block: VIC 1 and the first DTD are not identical. Is this intended?
  Detailed Timing Descriptor #2: DTD is similar but not identical to VIC 16.
  Add a Colorimetry Data Block with the sRGB colorimetry bit set to avoid interop issues.
EDID:
  Base EDID: Some timings are out of range of the Monitor Ranges:
    Horizontal Freq: 31.250 - 175.197 kHz (Monitor: 222.000 - 222.000 kHz)

Failures:

Block 1, CTA-861 Extension Block:
  Vendor-Specific Data Block (HDMI), OUI 00-0C-03: HDMI VSDB Max TMDS rate is > 340.
  Missing VCDB, needed for Set Selectable RGB Quantization to avoid interop issues.
EDID:
  Extension Block 2 started with EDID header, ignoring Extension Blocks >= 2.
  CTA-861: Native progressive timings are a mix of several resolutions.

EDID conformity: FAIL
