edid-decode (hex):

00 ff ff ff ff ff ff 00 26 cd 0c 00 47 02 00 00
34 1d 01 04 b5 5e 35 78 3e 2e dd a6 55 4e 9a 26
0e 47 4a bf ef 00 d1 c0 b3 00 a9 40 a9 c0 95 00
90 40 81 80 81 40 4d d0 00 a0 f0 70 3e 80 30 20
35 00 ad 11 32 00 00 1a 56 5e 00 a0 a0 a0 29 50
30 20 35 00 ad 11 32 00 00 1a 00 00 00 fd 00 32
4b 18 a0 3c 01 0a 20 20 20 20 20 20 00 00 00 fc
00 50 4c 34 33 37 32 55 48 0a 20 20 20 20 01 7d

02 03 3b f1 52 01 03 04 05 07 0a 0b 0e 0f 90 12
13 14 16 1f 60 61 5d 23 09 7f 07 83 01 00 00 6b
03 0c 00 10 00 38 78 20 00 01 00 e3 05 e3 00 e4
0f 00 80 01 e6 06 05 01 69 69 45 92 72 80 18 71
70 3e 80 58 2c 35 00 ad 11 32 00 00 1e 78 69 00
a0 f0 38 2d 40 30 20 35 00 ad 11 32 00 00 18 a3
66 00 a0 f0 70 1f 80 30 20 35 00 ad 11 32 00 00
1a 00 00 00 00 00 00 00 00 00 00 00 00 00 00 66

00 ff ff ff ff ff ff 00 26 cd 0c 00 47 02 00 00
34 1d 01 04 b5 5e 35 78 3e 2e dd a6 55 4e 9a 26
0e 47 4a bf ef 00 d1 c0 b3 00 a9 40 a9 c0 95 00
90 40 81 80 81 40 4d d0 00 a0 f0 70 3e 80 30 20
35 00 ad 11 32 00 00 1a 56 5e 00 a0 a0 a0 29 50
30 20 35 00 ad 11 32 00 00 1a 00 00 00 fd 00 32
4b 18 a0 3c 01 0a 20 20 20 20 20 20 00 00 00 fc
00 50 4c 34 33 37 32 55 48 0a 20 20 20 20 01 7d

02 03 3b f1 52 01 03 04 05 07 0a 0b 0e 0f 90 12
13 14 16 1f 60 61 5d 23 09 7f 07 83 01 00 00 6b
03 0c 00 10 00 38 78 20 00 01 00 e3 05 e3 00 e4
0f 00 80 01 e6 06 05 01 69 69 45 92 72 80 18 71
70 3e 80 58 2c 35 00 ad 11 32 00 00 1e 78 69 00
a0 f0 38 2d 40 30 20 35 00 ad 11 32 00 00 18 a3
66 00 a0 f0 70 1f 80 30 20 35 00 ad 11 32 00 00
1a 00 00 00 00 00 00 00 00 00 00 00 00 00 00 66

----------------

Block 0, Base EDID:
  EDID Structure Version & Revision: 1.4
  Vendor & Product Identification:
    Manufacturer: IVM
    Model: 12
    Serial Number: ...
    Made in: week 52 of 2019
  Basic Display Parameters & Features:
    Digital display
    Bits per primary color channel: 10
    DisplayPort interface
    Maximum image size: 94 cm x 53 cm
    Gamma: 2.20
    DPMS levels: Off
    Supported color formats: RGB 4:4:4, YCrCb 4:4:4, YCrCb 4:2:2
    Default (sRGB) color space is primary color space
    First detailed timing includes the native pixel format and preferred refresh rate
  Color Characteristics:
    Red  : 0.6484, 0.3339
    Green: 0.3076, 0.6035
    Blue : 0.1513, 0.0556
    White: 0.2802, 0.2900
  Established Timings I & II:
    IBM     :   720x400    70.081663 Hz   9:5     31.467 kHz     28.320000 MHz
    DMT 0x04:   640x480    59.940476 Hz   4:3     31.469 kHz     25.175000 MHz
    Apple   :   640x480    66.666667 Hz   4:3     35.000 kHz     30.240000 MHz
    DMT 0x05:   640x480    72.808802 Hz   4:3     37.861 kHz     31.500000 MHz
    DMT 0x06:   640x480    75.000000 Hz   4:3     37.500 kHz     31.500000 MHz
    DMT 0x08:   800x600    56.250000 Hz   4:3     35.156 kHz     36.000000 MHz
    DMT 0x09:   800x600    60.316541 Hz   4:3     37.879 kHz     40.000000 MHz
    DMT 0x0a:   800x600    72.187572 Hz   4:3     48.077 kHz     50.000000 MHz
    DMT 0x0b:   800x600    75.000000 Hz   4:3     46.875 kHz     49.500000 MHz
    Apple   :   832x624    74.551266 Hz   4:3     49.726 kHz     57.284000 MHz
    DMT 0x10:  1024x768    60.003840 Hz   4:3     48.363 kHz     65.000000 MHz
    DMT 0x11:  1024x768    70.069359 Hz   4:3     56.476 kHz     75.000000 MHz
    DMT 0x12:  1024x768    75.028582 Hz   4:3     60.023 kHz     78.750000 MHz
    DMT 0x24:  1280x1024   75.024675 Hz   5:4     79.976 kHz    135.000000 MHz
  Standard Timings:
    DMT 0x52:  1920x1080   60.000000 Hz  16:9     67.500 kHz    148.500000 MHz
    DMT 0x3a:  1680x1050   59.954250 Hz  16:10    65.290 kHz    146.250000 MHz
    DMT 0x33:  1600x1200   60.000000 Hz   4:3     75.000 kHz    162.000000 MHz
    DMT 0x53:  1600x900    60.000000 Hz  16:9     60.000 kHz    108.000000 MHz (RB)
    DMT 0x2f:  1440x900    59.887445 Hz  16:10    55.935 kHz    106.500000 MHz
    DMT 0x2a:  1400x1050   59.978442 Hz   4:3     65.317 kHz    121.750000 MHz
    DMT 0x23:  1280x1024   60.019740 Hz   5:4     63.981 kHz    108.000000 MHz
    DMT 0x20:  1280x960    60.000000 Hz   4:3     60.000 kHz    108.000000 MHz
  Detailed Timing Descriptors:
    DTD 1:  3840x2160   59.996625 Hz  16:9    133.312 kHz    533.250000 MHz (941 mm x 529 mm)
                 Hfront   48 Hsync  32 Hback   80 Hpol P
                 Vfront    3 Vsync   5 Vback   54 Vpol N
    DTD 2:  2560x1440   59.950550 Hz  16:9     88.787 kHz    241.500000 MHz (941 mm x 529 mm)
                 Hfront   48 Hsync  32 Hback   80 Hpol P
                 Vfront    3 Vsync   5 Vback   33 Vpol N
    Display Range Limits:
      Monitor ranges (Range Limits Only): 50-75 Hz V, 24-160 kHz H, max dotclock 600 MHz
    Display Product Name: 'PL4372UH'
  Extension blocks: 1
Checksum: 0x7d

----------------

Block 1, CTA-861 Extension Block:
  Revision: 3
  Underscans IT Video Formats by default
  Basic audio support
  Supports YCbCr 4:4:4
  Supports YCbCr 4:2:2
  Native DTDs: 1
  Video Data Block:
    VIC   1:   640x480    59.940476 Hz   4:3     31.469 kHz     25.175000 MHz
    VIC   3:   720x480    59.940060 Hz  16:9     31.469 kHz     27.000000 MHz
    VIC   4:  1280x720    60.000000 Hz  16:9     45.000 kHz     74.250000 MHz
    VIC   5:  1920x1080i  60.000000 Hz  16:9     33.750 kHz     74.250000 MHz
    VIC   7:  1440x480i   59.940060 Hz  16:9     15.734 kHz     27.000000 MHz
    VIC  10:  2880x480i   59.940060 Hz   4:3     15.734 kHz     54.000000 MHz
    VIC  11:  2880x480i   59.940060 Hz  16:9     15.734 kHz     54.000000 MHz
    VIC  14:  1440x480    59.940060 Hz   4:3     31.469 kHz     54.000000 MHz
    VIC  15:  1440x480    59.940060 Hz  16:9     31.469 kHz     54.000000 MHz
    VIC  16:  1920x1080   60.000000 Hz  16:9     67.500 kHz    148.500000 MHz (native)
    VIC  18:   720x576    50.000000 Hz  16:9     31.250 kHz     27.000000 MHz
    VIC  19:  1280x720    50.000000 Hz  16:9     37.500 kHz     74.250000 MHz
    VIC  20:  1920x1080i  50.000000 Hz  16:9     28.125 kHz     74.250000 MHz
    VIC  22:  1440x576i   50.000000 Hz  16:9     15.625 kHz     27.000000 MHz
    VIC  31:  1920x1080   50.000000 Hz  16:9     56.250 kHz    148.500000 MHz
    VIC  96:  3840x2160   50.000000 Hz  16:9    112.500 kHz    594.000000 MHz
    VIC  97:  3840x2160   60.000000 Hz  16:9    135.000 kHz    594.000000 MHz
    VIC  93:  3840x2160   24.000000 Hz  16:9     54.000 kHz    297.000000 MHz
  Audio Data Block:
    Linear PCM:
      Max channels: 2
      Supported sample rates (kHz): 192 176.4 96 88.2 48 44.1 32
      Supported sample sizes (bits): 24 20 16
  Speaker Allocation Data Block:
    FL/FR - Front Left/Right
  Vendor-Specific Data Block (HDMI), OUI 00-0C-03:
    Source physical address: 1.0.0.0
    DC_36bit
    DC_30bit
    DC_Y444
    Maximum TMDS clock: 600 MHz
    Extended HDMI video details:
      3D VIC indices with specific capabilities:
        VIC   1:   640x480    59.940476 Hz   4:3     31.469 kHz     25.175000 MHz (frame packing)
  Colorimetry Data Block:
    xvYCC601
    xvYCC709
    BT2020cYCC
    BT2020YCC
    BT2020RGB
  YCbCr 4:2:0 Capability Map Data Block:
    VIC  96:  3840x2160   50.000000 Hz  16:9    112.500 kHz    594.000000 MHz
    VIC  97:  3840x2160   60.000000 Hz  16:9    135.000 kHz    594.000000 MHz
  HDR Static Metadata Data Block:
    Electro optical transfer functions:
      Traditional gamma - SDR luminance range
      SMPTE ST2084
    Supported static metadata descriptors:
      Static metadata type 1
    Desired content max luminance: 105 (486.099 cd/m^2)
    Desired content max frame-average luminance: 105 (486.099 cd/m^2)
    Desired content min luminance: 69 (0.356 cd/m^2)
  Detailed Timing Descriptors:
    DTD 3:  1920x2160   59.999182 Hz   8:9    133.318 kHz    293.300000 MHz (941 mm x 529 mm)
                 Hfront   88 Hsync  44 Hback  148 Hpol P
                 Vfront    3 Vsync   5 Vback   54 Vpol P
    DTD 4:  3840x1080   60.000000 Hz  32:9     67.500 kHz    270.000000 MHz (941 mm x 529 mm)
                 Hfront   48 Hsync  32 Hback   80 Hpol N
                 Vfront    3 Vsync   5 Vback   37 Vpol N
    DTD 5:  3840x2160   29.980602 Hz  16:9     65.688 kHz    262.750000 MHz (941 mm x 529 mm)
                 Hfront   48 Hsync  32 Hback   80 Hpol P
                 Vfront    3 Vsync   5 Vback   23 Vpol N
Checksum: 0x66  Unused space in Extension Block: 14 bytes

----------------

Warnings:

Block 1, CTA-861 Extension Block:
  Video Data Block: VIC 1 and the first DTD are not identical. Is this intended?
  Detailed Timing Descriptor #3: Image size is 941x529 mm, but based on the picture AR it should be 470x529 mm.
  Detailed Timing Descriptor #4: Image size is 941x529 mm, but based on the picture AR it should be 941x264 mm.
EDID:
  Base EDID: Some timings are out of range of the Monitor Ranges:
    Vertical Freq: 24.000 - 75.029 Hz (Monitor: 50.000 - 75.000 Hz)
    Horizontal Freq: 15.625 - 135.000 kHz (Monitor: 24.000 - 160.000 kHz)

Failures:

Block 0, Base EDID:
  Basic Display Parameters & Features: sRGB is signaled, but the chromaticities do not match.
Block 1, CTA-861 Extension Block:
  Vendor-Specific Data Block (HDMI), OUI 00-0C-03: HDMI VSDB Max TMDS rate is > 340.
  Vendor-Specific Data Block (HDMI), OUI 00-0C-03: The HDMI Specification requires EDID 1.3 instead of 1.4.
  Missing VCDB, needed for Set Selectable RGB Quantization to avoid interop issues.
EDID:
  Extension Block 2 started with EDID header, ignoring Extension Blocks >= 2.
  CTA-861: Native progressive timings are a mix of several resolutions.

EDID conformity: FAIL
