edid-decode (hex):

00 ff ff ff ff ff ff 00 1e 41 4e 6e 00 00 00 01
14 22 01 04 b5 18 09 78 1b fa 58 a4 55 53 a2 24
0d 4b 4e 00 00 00 01 01 01 01 01 01 01 01 01 01
01 01 01 01 01 01 c4 24 80 90 70 d0 28 20 32 2c
a4 01 f3 5b 00 00 00 1e 00 00 00 ff 00 0a 20 20
20 20 20 20 20 20 20 20 20 20 00 00 00 fc 00 48
44 20 44 69 73 70 6c 61 79 0a 20 20 00 00 00 10
00 00 00 00 00 00 00 00 00 00 00 00 00 00 01 db

02 03 21 75 40 23 09 07 07 83 01 00 00 68 1a 00
00 01 01 32 64 00 e3 05 c0 00 e6 06 05 01 60 48
00 a4 38 80 c8 70 38 3c 40 30 20 45 00 f3 5b 00
00 00 18 00 00 00 00 00 00 00 00 00 00 00 00 00
00 00 00 00 00 00 00 00 00 00 00 00 00 00 00 00
00 00 00 00 00 00 00 00 00 00 00 00 00 00 00 00
00 00 00 00 00 00 00 00 00 00 00 00 00 00 00 00
00 00 00 00 00 00 00 00 00 00 00 00 00 00 00 c8

00 ff ff ff ff ff ff 00 1e 41 4e 6e 00 00 00 01
14 22 01 04 b5 18 09 78 1b fa 58 a4 55 53 a2 24
0d 4b 4e 00 00 00 01 01 01 01 01 01 01 01 01 01
01 01 01 01 01 01 c4 24 80 90 70 d0 28 20 32 2c
a4 01 f3 5b 00 00 00 1e 00 00 00 ff 00 0a 20 20
20 20 20 20 20 20 20 20 20 20 00 00 00 fc 00 48
44 20 44 69 73 70 6c 61 79 0a 20 20 00 00 00 10
00 00 00 00 00 00 00 00 00 00 00 00 00 00 01 db

02 03 21 75 40 23 09 07 07 83 01 00 00 68 1a 00
00 01 01 32 64 00 e3 05 c0 00 e6 06 05 01 60 48
00 a4 38 80 c8 70 38 3c 40 30 20 45 00 f3 5b 00
00 00 18 00 00 00 00 00 00 00 00 00 00 00 00 00
00 00 00 00 00 00 00 00 00 00 00 00 00 00 00 00
00 00 00 00 00 00 00 00 00 00 00 00 00 00 00 00
00 00 00 00 00 00 00 00 00 00 00 00 00 00 00 00
00 00 00 00 00 00 00 00 00 00 00 00 00 00 00 c8

----------------

Block 0, Base EDID:
  EDID Structure Version & Revision: 1.4
  Vendor & Product Identification:
    Manufacturer: GRA
    Model: 28238
    Serial Number: ...
    Made in: week 20 of 2024
  Basic Display Parameters & Features:
    Digital display
    Bits per primary color channel: 10
    DisplayPort interface
    Maximum image size: 24 cm x 9 cm
    Gamma: 2.20
    Supported color formats: RGB 4:4:4, YCrCb 4:4:4, YCrCb 4:2:2
    First detailed timing includes the native pixel format and preferred refresh rate
    Display supports continuous frequencies
  Color Characteristics:
    Red  : 0.6435, 0.3349
    Green: 0.3261, 0.6347
    Blue : 0.1416, 0.0517
    White: 0.2949, 0.3046
  Established Timings I & II: none
  Standard Timings: none
  Detailed Timing Descriptors:
    DTD 1:  1920x720    60.001020 Hz   8:3     45.601 kHz     94.120000 MHz (243 mm x 91 mm)
                 Hfront   50 Hsync  44 Hback   50 Hpol P
                 Vfront   10 Vsync  20 Vback   10 Vpol P
    Display Product Serial Number: ...
    Display Product Name: 'HD Display'
    Dummy Descriptor:
  Extension blocks: 1
Checksum: 0xdb

----------------

Block 1, CTA-861 Extension Block:
  Revision: 3
  Basic audio support
  Supports YCbCr 4:4:4
  Supports YCbCr 4:2:2
  Native DTDs: 5
  Video Data Block:
  Audio Data Block:
    Linear PCM:
      Max channels: 2
      Supported sample rates (kHz): 48 44.1 32
      Supported sample sizes (bits): 24 20 16
  Speaker Allocation Data Block:
    FL/FR - Front Left/Right
  Vendor-Specific Data Block (AMD), OUI 00-00-1A:
    Version: 1
    Flags 1: 0x01
      FreeSync Supported
    Minimum Refresh Rate: 50 Hz
    Maximum Refresh Rate: 100 Hz
  Colorimetry Data Block:
    BT2020YCC
    BT2020RGB
  HDR Static Metadata Data Block:
    Electro optical transfer functions:
      Traditional gamma - SDR luminance range
      SMPTE ST2084
    Supported static metadata descriptors:
      Static metadata type 1
    Desired content max luminance: 96 (400.000 cd/m^2)
    Desired content max frame-average luminance: 72 (237.841 cd/m^2)
    Desired content min luminance: 0 (0.000 cd/m^2)
  Detailed Timing Descriptors:
    DTD 2:  1920x1080   59.996690 Hz  16:9     68.396 kHz    145.000000 MHz (243 mm x 91 mm)
                 Hfront   48 Hsync  32 Hback  120 Hpol N
                 Vfront    4 Vsync   5 Vback   51 Vpol N
Checksum: 0xc8  Unused space in Extension Block: 76 bytes

----------------

Warnings:

Block 0, Base EDID:
  Basic Display Parameters & Features: Dubious maximum image size (24x9 is smaller than 10x10 cm).
  Detailed Timing Descriptor #1: Dubious image size (243x91 mm is smaller than 100x100 mm).
Block 1, CTA-861 Extension Block:
  IT Video Formats are overscanned by default, but normally this should be underscanned.
  Colorimetry Data Block: Set the sRGB colorimetry bit to avoid interop issues.
  Detailed Timing Descriptor #2: Dubious image size (243x91 mm is smaller than 100x100 mm).
  Display Product Serial Number is set, so the Serial Number in the Base EDID should be 0.

Failures:

Block 0, Base EDID:
  Display Product Serial Number: ...
  Missing Display Range Limits Descriptor.
Block 1, CTA-861 Extension Block:
  There are more Native DTDs (5) than DTDs (2).
  Video Data Block: This Data Block is empty.
  Required 640x480p60 timings are missing in the established timings and the SVD list (VIC 1).
  Missing VCDB, needed for Set Selectable RGB Quantization to avoid interop issues.
EDID:
  Extension Block 2 started with EDID header, ignoring Extension Blocks >= 2.
  CTA-861: Native progressive timings are a mix of several resolutions.

EDID conformity: FAIL
