edid-decode (hex):

00 ff ff ff ff ff ff 00 1e 6d 00 22 01 01 01 01
09 12 01 03 80 2f 1e 78 2a 78 f5 a6 55 48 9b 26
12 50 54 00 00 00 01 01 01 01 01 01 01 01 01 01
01 01 01 01 01 01 01 1d 00 72 51 d0 1e 20 6e 28
55 00 c4 8e 21 00 00 1e 00 00 00 ff 00 38 30 39
54 50 54 4d 33 42 38 32 35 0a 00 00 00 fd 00 38
4e 1e 50 11 00 0a 20 20 20 20 20 20 00 00 00 fc
00 32 32 4c 47 33 30 30 30 0a 20 20 20 20 01 15

02 03 21 f1 4e 81 02 03 15 12 13 04 14 05 20 21
22 1f 10 23 15 07 50 83 01 00 00 65 03 0c 00 20
00 01 1d 00 bc 52 d0 1e 20 b8 28 55 40 34 cd 31
00 00 1e 01 1d 80 18 71 1c 16 20 58 2c 25 00 34
cd 31 00 00 9e 01 1d 00 72 51 d0 1e 20 6e 28 55
00 34 cd 31 00 00 1e 01 1d 80 d0 72 1c 16 20 10
2c 25 80 34 cd 31 00 00 9e 8c 0a d0 90 20 40 31
20 0c 40 55 00 34 cd 31 00 00 18 00 00 00 00 f5

00 ff ff ff ff ff ff 00 1e 6d 00 22 01 01 01 01
09 12 01 03 80 2f 1e 78 2a 78 f5 a6 55 48 9b 26
12 50 54 00 00 00 01 01 01 01 01 01 01 01 01 01
01 01 01 01 01 01 01 1d 00 72 51 d0 1e 20 6e 28
55 00 c4 8e 21 00 00 1e 00 00 00 ff 00 38 30 39
54 50 54 4d 33 42 38 32 35 0a 00 00 00 fd 00 38
4e 1e 50 11 00 0a 20 20 20 20 20 20 00 00 00 fc
00 32 32 4c 47 33 30 30 30 0a 20 20 20 20 01 15

02 03 21 f1 4e 81 02 03 15 12 13 04 14 05 20 21
22 1f 10 23 15 07 50 83 01 00 00 65 03 0c 00 20
00 01 1d 00 bc 52 d0 1e 20 b8 28 55 40 34 cd 31
00 00 1e 01 1d 80 18 71 1c 16 20 58 2c 25 00 34
cd 31 00 00 9e 01 1d 00 72 51 d0 1e 20 6e 28 55
00 34 cd 31 00 00 1e 01 1d 80 d0 72 1c 16 20 10
2c 25 80 34 cd 31 00 00 9e 8c 0a d0 90 20 40 31
20 0c 40 55 00 34 cd 31 00 00 18 00 00 00 00 f5

----------------

Block 0, Base EDID:
  EDID Structure Version & Revision: 1.3
  Vendor & Product Identification:
    Manufacturer: GSM
    Model: 8704
    Serial Number: ...
    Made in: week 9 of 2008
  Basic Display Parameters & Features:
    Digital display
    Maximum image size: 47 cm x 30 cm
    Gamma: 2.20
    DPMS levels: Off
    RGB color display
    First detailed timing is the preferred timing
  Color Characteristics:
    Red  : 0.6494, 0.3349
    Green: 0.2832, 0.6054
    Blue : 0.1513, 0.0732
    White: 0.3134, 0.3291
  Established Timings I & II: none
  Standard Timings: none
  Detailed Timing Descriptors:
    DTD 1:  1280x720    60.000000 Hz  16:9     45.000 kHz     74.250000 MHz (708 mm x 398 mm)
                 Hfront  110 Hsync  40 Hback  220 Hpol P
                 Vfront    5 Vsync   5 Vback   20 Vpol P
    Display Product Serial Number: ...
    Display Range Limits:
      Monitor ranges (GTF): 56-78 Hz V, 30-80 kHz H, max dotclock 170 MHz
    Display Product Name: '22LG3000'
  Extension blocks: 1
Checksum: 0x15

----------------

Block 1, CTA-861 Extension Block:
  Revision: 3
  Underscans IT Video Formats by default
  Basic audio support
  Supports YCbCr 4:4:4
  Supports YCbCr 4:2:2
  Native DTDs: 1
  Video Data Block:
    VIC   1:   640x480    59.940476 Hz   4:3     31.469 kHz     25.175000 MHz (native)
    VIC   2:   720x480    59.940060 Hz   4:3     31.469 kHz     27.000000 MHz
    VIC   3:   720x480    59.940060 Hz  16:9     31.469 kHz     27.000000 MHz
    VIC  21:  1440x576i   50.000000 Hz   4:3     15.625 kHz     27.000000 MHz
    VIC  18:   720x576    50.000000 Hz  16:9     31.250 kHz     27.000000 MHz
    VIC  19:  1280x720    50.000000 Hz  16:9     37.500 kHz     74.250000 MHz
    VIC   4:  1280x720    60.000000 Hz  16:9     45.000 kHz     74.250000 MHz
    VIC  20:  1920x1080i  50.000000 Hz  16:9     28.125 kHz     74.250000 MHz
    VIC   5:  1920x1080i  60.000000 Hz  16:9     33.750 kHz     74.250000 MHz
    VIC  32:  1920x1080   24.000000 Hz  16:9     27.000 kHz     74.250000 MHz
    VIC  33:  1920x1080   25.000000 Hz  16:9     28.125 kHz     74.250000 MHz
    VIC  34:  1920x1080   30.000000 Hz  16:9     33.750 kHz     74.250000 MHz
    VIC  31:  1920x1080   50.000000 Hz  16:9     56.250 kHz    148.500000 MHz
    VIC  16:  1920x1080   60.000000 Hz  16:9     67.500 kHz    148.500000 MHz
  Audio Data Block:
    AC-3:
      Max channels: 6
      Supported sample rates (kHz): 48 44.1 32
      Maximum bit rate: 640 kb/s
  Speaker Allocation Data Block:
    FL/FR - Front Left/Right
  Vendor-Specific Data Block (HDMI), OUI 00-0C-03:
    Source physical address: 2.0.0.0
  Detailed Timing Descriptors:
    DTD 2:  1280x720    50.000000 Hz  16:9     37.500 kHz     74.250000 MHz (820 mm x 461 mm)
                 Hfront  440 Hsync  40 Hback  220 Hpol P
                 Vfront    5 Vsync   5 Vback   20 Vpol P
    DTD 3:  1920x1080i  60.000000 Hz  16:9     33.750 kHz     74.250000 MHz (820 mm x 461 mm)
                 Hfront   88 Hsync  44 Hback  148 Hpol P
                 Vfront    2 Vsync   5 Vback   15 Vpol P Vfront +0.5 Odd Field
                 Vfront    2 Vsync   5 Vback   15 Vpol P Vback  +0.5 Even Field
    DTD 4:  1280x720    60.000000 Hz  16:9     45.000 kHz     74.250000 MHz (820 mm x 461 mm)
                 Hfront  110 Hsync  40 Hback  220 Hpol P
                 Vfront    5 Vsync   5 Vback   20 Vpol P
    DTD 5:  1920x1080i  50.000000 Hz  16:9     28.125 kHz     74.250000 MHz (820 mm x 461 mm)
                 Hfront  528 Hsync  44 Hback  148 Hpol P
                 Vfront    2 Vsync   5 Vback   15 Vpol P Vfront +0.5 Odd Field
                 Vfront    2 Vsync   5 Vback   15 Vpol P Vback  +0.5 Even Field
    DTD 6:   720x576    50.000000 Hz   5:4     31.250 kHz     27.000000 MHz (820 mm x 461 mm)
                 Hfront   12 Hsync  64 Hback   68 Hpol N
                 Vfront    5 Vsync   5 Vback   39 Vpol N
Checksum: 0xf5  Unused space in Extension Block: 4 bytes

----------------

Warnings:

Block 0, Base EDID:
  Vendor & Product Identification: The serial number is one of the known dummy values, it should probably be set to 0.
Block 1, CTA-861 Extension Block:
  Video Data Block: VIC 1 and the first DTD are not identical. Is this intended?
  Detailed Timing Descriptor #6: Image size is 820x461 mm, but based on the picture AR it should be 576x461 mm.
  Display Product Serial Number is set, so the Serial Number in the Base EDID should be 0.
  Add a Colorimetry Data Block with the sRGB colorimetry bit set to avoid interop issues.
EDID:
  Base EDID: Some timings are out of range of the Monitor Ranges:
    Vertical Freq: 24.000 - 60.000 Hz (Monitor: 56.000 - 78.000 Hz)
    Horizontal Freq: 15.625 - 67.500 kHz (Monitor: 30.000 - 80.000 kHz)

Failures:

Block 0, Base EDID:
  Detailed Timing Descriptor #1: Mismatch of image size 708x398 mm vs display size 470x300 mm.
Block 1, CTA-861 Extension Block:
  Detailed Timing Descriptor #2: Mismatch of image size 820x461 mm vs display size 470x300 mm.
  Detailed Timing Descriptor #3: Mismatch of image size 820x461 mm vs display size 470x300 mm.
  Detailed Timing Descriptor #4: Mismatch of image size 820x461 mm vs display size 470x300 mm.
  Detailed Timing Descriptor #5: Mismatch of image size 820x461 mm vs display size 470x300 mm.
  Detailed Timing Descriptor #6: Mismatch of image size 820x461 mm vs display size 470x300 mm.
  Missing VCDB, needed for Set Selectable RGB Quantization to avoid interop issues.
EDID:
  Extension Block 2 started with EDID header, ignoring Extension Blocks >= 2.
  Base EDID: The DTD max image size is 820x461mm, which is larger than the display size 470.0x300.0mm.
  CTA-861: Native progressive timings are a mix of several resolutions.

EDID conformity: FAIL
