edid-decode (hex):

00 ff ff ff ff ff ff 00 1e 6d 10 5b d3 32 04 00
09 1a 01 03 80 30 1b 78 80 0f 91 ae 52 43 b0 26
0f 50 54 20 00 00 01 01 01 01 01 01 01 01 01 01
01 01 01 01 01 01 4f d0 00 a0 f0 70 3e 80 30 20
18 00 db 0b 11 00 00 1a 00 00 00 ff 00 36 30 39
4e 54 43 5a 38 33 31 35 35 00 00 00 00 fd 00 30
3c 58 8f 3c 00 0a 20 20 20 20 20 20 00 00 00 fc
00 4c 47 20 55 6c 74 72 61 46 69 6e 65 0a 01 ae

02 03 22 c1 45 84 13 03 02 01 23 09 07 07 83 01
00 00 67 03 0c 00 10 00 00 78 67 d8 5d c4 01 78
c8 00 4f d0 00 a0 f0 70 3e 80 30 20 18 00 db 0b
11 00 00 1a 00 00 00 00 00 00 00 00 00 00 00 00
00 00 00 00 00 00 00 00 00 00 00 00 00 00 00 00
00 00 00 00 00 00 00 00 00 00 00 00 00 00 00 00
00 00 00 00 00 00 00 00 00 00 00 00 00 00 00 00
00 00 00 00 00 00 00 00 00 00 00 00 00 00 00 83

00 ff ff ff ff ff ff 00 1e 6d 10 5b d3 32 04 00
09 1a 01 03 80 30 1b 78 80 0f 91 ae 52 43 b0 26
0f 50 54 20 00 00 01 01 01 01 01 01 01 01 01 01
01 01 01 01 01 01 4f d0 00 a0 f0 70 3e 80 30 20
18 00 db 0b 11 00 00 1a 00 00 00 ff 00 36 30 39
4e 54 43 5a 38 33 31 35 35 00 00 00 00 fd 00 30
3c 58 8f 3c 00 0a 20 20 20 20 20 20 00 00 00 fc
00 4c 47 20 55 6c 74 72 61 46 69 6e 65 0a 01 ae

02 03 22 c1 45 84 13 03 02 01 23 09 07 07 83 01
00 00 67 03 0c 00 10 00 00 78 67 d8 5d c4 01 78
c8 00 4f d0 00 a0 f0 70 3e 80 30 20 18 00 db 0b
11 00 00 1a 00 00 00 00 00 00 00 00 00 00 00 00
00 00 00 00 00 00 00 00 00 00 00 00 00 00 00 00
00 00 00 00 00 00 00 00 00 00 00 00 00 00 00 00
00 00 00 00 00 00 00 00 00 00 00 00 00 00 00 00
00 00 00 00 00 00 00 00 00 00 00 00 00 00 00 83

----------------

Block 0, Base EDID:
  EDID Structure Version & Revision: 1.3
  Vendor & Product Identification:
    Manufacturer: GSM
    Model: 23312
    Serial Number: ...
    Made in: week 9 of 2016
  Basic Display Parameters & Features:
    Digital display
    Maximum image size: 48 cm x 27 cm
    Gamma: 2.20
    DPMS levels: Standby
    Monochrome or grayscale display
  Color Characteristics:
    Red  : 0.6796, 0.3203
    Green: 0.2646, 0.6904
    Blue : 0.1503, 0.0595
    White: 0.3125, 0.3291
  Established Timings I & II:
    DMT 0x04:   640x480    59.940476 Hz   4:3     31.469 kHz     25.175000 MHz
  Standard Timings: none
  Detailed Timing Descriptors:
    DTD 1:  3840x2160   59.998875 Hz  16:9    133.317 kHz    533.270000 MHz (475 mm x 267 mm)
                 Hfront   48 Hsync  32 Hback   80 Hpol P
                 Vfront    1 Vsync   8 Vback   53 Vpol N
    Display Product Serial Number: ...
    Display Range Limits:
      Monitor ranges (GTF): 48-60 Hz V, 88-143 kHz H, max dotclock 600 MHz
    Display Product Name: 'LG UltraFine'
  Extension blocks: 1
Checksum: 0xae

----------------

Block 1, CTA-861 Extension Block:
  Revision: 3
  Underscans IT Video Formats by default
  Basic audio support
  Native detailed modes: 1
  Video Data Block:
    VIC   4:  1280x720    60.000000 Hz  16:9     45.000 kHz     74.250000 MHz (native)
    VIC  19:  1280x720    50.000000 Hz  16:9     37.500 kHz     74.250000 MHz
    VIC   3:   720x480    59.940060 Hz  16:9     31.469 kHz     27.000000 MHz
    VIC   2:   720x480    59.940060 Hz   4:3     31.469 kHz     27.000000 MHz
    VIC   1:   640x480    59.940476 Hz   4:3     31.469 kHz     25.175000 MHz
  Audio Data Block:
    Linear PCM:
      Max channels: 2
      Supported sample rates (kHz): 48 44.1 32
      Supported sample sizes (bits): 24 20 16
  Speaker Allocation Data Block:
    FL/FR - Front Left/Right
  Vendor-Specific Data Block (HDMI), OUI 00-0C-03:
    Source physical address: 1.0.0.0
    Maximum TMDS clock: 600 MHz
  Vendor-Specific Data Block (HDMI Forum), OUI C4-5D-D8:
    Version: 1
    Maximum TMDS Character Rate: 600 MHz
    SCDC Present
    SCDC Read Request Capable
    Supports scrambling for <= 340 Mcsc
  Detailed Timing Descriptors:
    DTD 2:  3840x2160   59.998875 Hz  16:9    133.317 kHz    533.270000 MHz (475 mm x 267 mm)
                 Hfront   48 Hsync  32 Hback   80 Hpol P
                 Vfront    1 Vsync   8 Vback   53 Vpol N
Checksum: 0x83  Unused space in Extension Block: 75 bytes

----------------

Block 2, Unknown EDID Extension Block 0x00:
  00 ff ff ff ff ff ff 00 1e 6d 10 5b d3 32 04 00 '.........m.[.2..'
  09 1a 01 03 80 30 1b 78 80 0f 91 ae 52 43 b0 26 '.....0.x....RC.&'
  0f 50 54 20 00 00 01 01 01 01 01 01 01 01 01 01 '.PT ............'
  01 01 01 01 01 01 4f d0 00 a0 f0 70 3e 80 30 20 '......O....p>.0 '
  18 00 db 0b 11 00 00 1a 00 00 00 ff 00 36 30 39 '.............609'
  4e 54 43 5a 38 33 31 35 35 00 00 00 00 fd 00 30 'NTCZ83155......0'
  3c 58 8f 3c 00 0a 20 20 20 20 20 20 00 00 00 fc '<X.<..      ....'
  00 4c 47 20 55 6c 74 72 61 46 69 6e 65 0a 01 ae '.LG UltraFine...'
Checksum: 0xae

----------------

Block 3, CTA-861 Extension Block:
  Revision: 3
  Underscans IT Video Formats by default
  Basic audio support
  Native detailed modes: 1
  Video Data Block:
    VIC   4:  1280x720    60.000000 Hz  16:9     45.000 kHz     74.250000 MHz (native)
    VIC  19:  1280x720    50.000000 Hz  16:9     37.500 kHz     74.250000 MHz
    VIC   3:   720x480    59.940060 Hz  16:9     31.469 kHz     27.000000 MHz
    VIC   2:   720x480    59.940060 Hz   4:3     31.469 kHz     27.000000 MHz
    VIC   1:   640x480    59.940476 Hz   4:3     31.469 kHz     25.175000 MHz
  Audio Data Block:
    Linear PCM:
      Max channels: 2
      Supported sample rates (kHz): 48 44.1 32
      Supported sample sizes (bits): 24 20 16
  Speaker Allocation Data Block:
    FL/FR - Front Left/Right
  Vendor-Specific Data Block (HDMI), OUI 00-0C-03:
    Source physical address: 1.0.0.0
    Maximum TMDS clock: 600 MHz
  Vendor-Specific Data Block (HDMI Forum), OUI C4-5D-D8:
    Version: 1
    Maximum TMDS Character Rate: 600 MHz
    SCDC Present
    SCDC Read Request Capable
    Supports scrambling for <= 340 Mcsc
  Detailed Timing Descriptors:
    DTD 3:  3840x2160   59.998875 Hz  16:9    133.317 kHz    533.270000 MHz (475 mm x 267 mm)
                 Hfront   48 Hsync  32 Hback   80 Hpol P
                 Vfront    1 Vsync   8 Vback   53 Vpol N
Checksum: 0x83  Unused space in Extension Block: 75 bytes

----------------

Warnings:

Block 1, CTA-861 Extension Block:
  Video Data Block: VIC 4 and the first DTD are not identical. Is this intended?
  Display Product Serial Number is set, so the Serial Number in the Base EDID should be 0.
  Add a Colorimetry Data Block with the sRGB colorimetry bit set to avoid interop issues.
EDID:
  Base EDID: Some timings are out of range of the Monitor Ranges:
    Horizontal Freq: 31.468 - 133.317 kHz (Monitor: 88.000 - 143.000 kHz)

Failures:

Block 0, Base EDID:
  Display Product Serial Number: ...
  Basic Display Parameters & Features: EDID 1.3 requires that the first detailed timing is the preferred timing.
Block 1, CTA-861 Extension Block:
  Vendor-Specific Data Block (HDMI), OUI 00-0C-03: HDMI VSDB Max TMDS rate is > 340.
  Missing VCDB, needed for Set Selectable RGB Quantization to avoid interop issues.
Block 2, Base EDID:
  Unknown Extension Block.
Block 3, CTA-861 Extension Block:
  Video Data Block: Duplicate VIC 4.
  Video Data Block: Duplicate VIC 19.
  Video Data Block: Duplicate VIC 3.
  Video Data Block: Duplicate VIC 2.
  Video Data Block: Duplicate VIC 1.
  Speaker Allocation Data Block: Only one instance of this Data Block is allowed.
  Vendor-Specific Data Block (HDMI), OUI 00-0C-03: HDMI VSDB Max TMDS rate is > 340.
  Vendor-Specific Data Block (HDMI Forum), OUI C4-5D-D8: Duplicate HDMI Forum VSDB/SCDB.
EDID:
  Base EDID: EDID specified 1 extension block(s), but found 3 extension block(s).
  Base EDID: EDID 1.3 requires a Block Map Extension in Block 1 if there are more than 2 blocks in the EDID.
  CTA-861: Native progressive timings are a mix of several resolutions.

EDID conformity: FAIL
