edid-decode (hex):

00 ff ff ff ff ff ff 00 1e 6d 10 5b ee d3 03 00
0a 1c 01 04 a5 30 1b 78 80 0f 91 ae 52 43 b0 26
0f 50 54 20 00 00 01 01 01 01 01 01 01 01 01 01
01 01 01 01 01 01 25 cc 00 50 f0 70 3e 80 08 20
18 00 db 0b 11 00 00 1a 00 00 00 ff 00 38 31 30
4e 54 52 4c 37 43 38 36 32 0a 00 00 00 fd 00 30
3c 58 8f 3c 01 0a 20 20 20 20 20 20 00 00 00 fc
00 4c 47 20 55 6c 74 72 61 46 69 6e 65 0a 02 55

70 12 79 00 00 01 00 0c 8e 12 6e 0a 00 10 00 09
50 78 4e 77 29 00 10 53 44 f1 9b e0 ee 4e 53 ab
2d 7f 0c 8a 2d ae d6 03 00 50 a5 64 00 84 ff 0e
4f 00 07 80 1f 00 6f 08 1e 00 00 00 07 00 bb 9c
00 04 1f 0d 4f 00 07 80 1f 00 61 07 35 00 00 00
07 00 a2 5b 00 04 ff 09 4f 00 07 80 1f 00 9f 05
28 00 00 00 07 00 13 34 00 04 7f 07 4f 00 07 80
1f 00 37 04 1e 00 00 00 07 00 00 00 00 00 ac 90

70 12 79 00 00 03 00 50 f5 e7 00 84 ff 0f 4f 00
07 80 1f 00 ff 08 41 00 00 00 07 00 8c b8 00 84
ff 0f 4f 00 07 80 1f 00 ff 08 34 00 00 00 07 00
5c 72 00 84 ff 0f 4f 00 07 80 1f 00 ff 08 20 00
00 00 07 00 24 cc 00 84 ff 0e 4f 00 07 80 1f 00
6f 08 3d 00 00 00 07 00 00 00 00 00 00 00 00 00
00 00 00 00 00 00 00 00 00 00 00 00 00 00 00 00
00 00 00 00 00 00 00 00 00 00 00 00 00 00 af 90

00 ff ff ff ff ff ff 00 1e 6d 10 5b ee d3 03 00
0a 1c 01 04 a5 30 1b 78 80 0f 91 ae 52 43 b0 26
0f 50 54 20 00 00 01 01 01 01 01 01 01 01 01 01
01 01 01 01 01 01 25 cc 00 50 f0 70 3e 80 08 20
18 00 db 0b 11 00 00 1a 00 00 00 ff 00 38 31 30
4e 54 52 4c 37 43 38 36 32 0a 00 00 00 fd 00 30
3c 58 8f 3c 01 0a 20 20 20 20 20 20 00 00 00 fc
00 4c 47 20 55 6c 74 72 61 46 69 6e 65 0a 02 55

70 12 79 00 00 01 00 0c 8e 12 6e 0a 00 10 00 09
50 78 4e 77 29 00 10 53 44 f1 9b e0 ee 4e 53 ab
2d 7f 0c 8a 2d ae d6 03 00 50 a5 64 00 84 ff 0e
4f 00 07 80 1f 00 6f 08 1e 00 00 00 07 00 bb 9c
00 04 1f 0d 4f 00 07 80 1f 00 61 07 35 00 00 00
07 00 a2 5b 00 04 ff 09 4f 00 07 80 1f 00 9f 05
28 00 00 00 07 00 13 34 00 04 7f 07 4f 00 07 80
1f 00 37 04 1e 00 00 00 07 00 00 00 00 00 ac 90

70 12 79 00 00 03 00 50 f5 e7 00 84 ff 0f 4f 00
07 80 1f 00 ff 08 41 00 00 00 07 00 8c b8 00 84
ff 0f 4f 00 07 80 1f 00 ff 08 34 00 00 00 07 00
5c 72 00 84 ff 0f 4f 00 07 80 1f 00 ff 08 20 00
00 00 07 00 24 cc 00 84 ff 0e 4f 00 07 80 1f 00
6f 08 3d 00 00 00 07 00 00 00 00 00 00 00 00 00
00 00 00 00 00 00 00 00 00 00 00 00 00 00 00 00
00 00 00 00 00 00 00 00 00 00 00 00 00 00 af 90

----------------

Block 0, Base EDID:
  EDID Structure Version & Revision: 1.4
  Vendor & Product Identification:
    Manufacturer: GSM
    Model: 23312
    Serial Number: ...
    Made in: week 10 of 2018
  Basic Display Parameters & Features:
    Digital display
    Bits per primary color channel: 8
    DisplayPort interface
    Maximum image size: 48 cm x 27 cm
    Gamma: 2.20
    DPMS levels: Standby
    Supported color formats: RGB 4:4:4
    First detailed timing does not include the native pixel format and preferred refresh rate
  Color Characteristics:
    Red  : 0.6796, 0.3203
    Green: 0.2646, 0.6904
    Blue : 0.1503, 0.0595
    White: 0.3125, 0.3291
  Established Timings I & II:
    DMT 0x04:   640x480    59.940476 Hz   4:3     31.469 kHz     25.175000 MHz
  Standard Timings: none
  Detailed Timing Descriptors:
    DTD 1:  3840x2160   59.999495 Hz  16:9    133.319 kHz    522.610000 MHz (475 mm x 267 mm)
                 Hfront    8 Hsync  32 Hback   40 Hpol P
                 Vfront    1 Vsync   8 Vback   53 Vpol N
    Display Product Serial Number: ...
    Display Range Limits:
      Monitor ranges (Range Limits Only): 48-60 Hz V, 88-143 kHz H, max dotclock 600 MHz
    Display Product Name: 'LG UltraFine'
  Extension blocks: 2
Checksum: 0x55

----------------

Block 1, DisplayID Extension Block:
  Version: 1.2
  Extension Count: 0
  Display Product Type: Extension Section
  Display Parameters Data Block (0x01):
    Image size: 475.0 mm x 267.0 mm
    Display native pixel format: 4096x2304
    Feature support flags:
      Power management (DPM)
      Separate audio inputs provided
    Gamma: 2.20
    Aspect ratio: 1.78
    Dynamic bpc native: 8
    Dynamic bpc overall: 8
  ContainerID Data Block:
    Container ID: 5344f19b-e0ee-4e53-ab2d-7f0c8a2daed6
  Video Timing Modes Type 1 - Detailed Timings Data Block:
    DTD:  3840x2160   29.999814 Hz  16:9     65.730 kHz    257.660000 MHz (aspect 16:9, no 3D stereo, preferred)
               Hfront    8 Hsync  32 Hback   40 Hpol P
               Vfront    1 Vsync   8 Vback   22 Vpol N
    DTD:  3360x1890   59.999761 Hz  16:9    116.640 kHz    401.240000 MHz (aspect 16:9, no 3D stereo)
               Hfront    8 Hsync  32 Hback   40 Hpol P
               Vfront    1 Vsync   8 Vback   45 Vpol N
    DTD:  2560x1440   59.999898 Hz  16:9     88.860 kHz    234.590000 MHz (aspect 16:9, no 3D stereo)
               Hfront    8 Hsync  32 Hback   40 Hpol P
               Vfront    1 Vsync   8 Vback   32 Vpol N
    DTD:  1920x1080   60.000000 Hz  16:9     66.660 kHz    133.320000 MHz (aspect 16:9, no 3D stereo)
               Hfront    8 Hsync  32 Hback   40 Hpol P
               Vfront    1 Vsync   8 Vback   22 Vpol N
  Checksum: 0xac
Checksum: 0x90

----------------

Block 2, DisplayID Extension Block:
  Version: 1.2
  Extension Count: 0
  Video Timing Modes Type 1 - Detailed Timings Data Block:
    DTD:  4096x2304   59.999273 Hz  16:9    142.198 kHz    593.820000 MHz (aspect 16:9, no 3D stereo, preferred)
               Hfront    8 Hsync  32 Hback   40 Hpol P
               Vfront    1 Vsync   8 Vback   57 Vpol N
    DTD:  4096x2304   47.999397 Hz  16:9    113.135 kHz    472.450000 MHz (aspect 16:9, no 3D stereo, preferred)
               Hfront    8 Hsync  32 Hback   40 Hpol P
               Vfront    1 Vsync   8 Vback   44 Vpol N
    DTD:  4096x2304   29.999041 Hz  16:9     70.108 kHz    292.770000 MHz (aspect 16:9, no 3D stereo, preferred)
               Hfront    8 Hsync  32 Hback   40 Hpol P
               Vfront    1 Vsync   8 Vback   24 Vpol N
    DTD:  3840x2160   59.999495 Hz  16:9    133.319 kHz    522.610000 MHz (aspect 16:9, no 3D stereo, preferred)
               Hfront    8 Hsync  32 Hback   40 Hpol P
               Vfront    1 Vsync   8 Vback   53 Vpol N
  Checksum: 0xaf
Checksum: 0x90

----------------

Warnings:

EDID:
  Base EDID: Some timings are out of range of the Monitor Ranges:
    Vertical Freq: 29.999 - 60.000 Hz (Monitor: 48.000 - 60.000 Hz)
    Horizontal Freq: 31.468 - 142.198 kHz (Monitor: 88.000 - 143.000 kHz)

Failures:

Block 1, DisplayID Extension Block:
  DisplayID Base Block has no product type.
  Expected 0 DisplayID Extension Block, but got 1.
  ContainerID Data Block: Use of DisplayID v2.0 tag for DisplayID v1.2.
EDID:
  Extension Block 3 started with EDID header, ignoring Extension Blocks >= 3.

EDID conformity: FAIL
