edid-decode (hex):

00 ff ff ff ff ff ff 00 20 e3 00 27 77 77 07 00
34 21 01 03 80 3c 22 78 3e ee 91 a3 54 4c 99 26
0f 50 54 21 08 00 d1 c0 01 01 01 01 01 01 01 01
01 01 01 01 01 01 02 3a 80 18 71 38 2d 40 58 2c
25 00 56 50 21 00 00 1e 00 00 00 fc 00 43 52 32
37 30 45 0a 20 20 20 20 20 20 00 00 00 ff 00 64
65 6d 6f 73 65 74 2d 31 0a 20 30 20 00 00 00 fd
00 34 b4 1e d0 3c 00 0a 20 20 20 20 20 20 01 ab

02 03 37 f2 43 90 01 02 23 09 7f 07 83 01 00 00
67 03 0c 00 10 00 18 78 e2 00 d5 e3 05 c0 00 e6
06 05 01 69 69 4f 68 1a 00 00 01 01 32 b4 e6 67
d8 5d c4 01 78 80 01 5c 82 80 8c 70 38 2d 40 30
20 3a 00 56 50 21 00 00 1e d2 96 80 a0 70 38 2d
40 30 20 25 00 56 50 21 00 00 1e c4 6d 80 a0 70
38 2d 40 30 20 25 00 56 50 21 00 00 1a 4c 9f 80
70 70 38 23 40 30 20 25 00 58 4a 21 00 00 1a 3b

00 ff ff ff ff ff ff 00 20 e3 00 27 77 77 07 00
34 21 01 03 80 3c 22 78 3e ee 91 a3 54 4c 99 26
0f 50 54 21 08 00 d1 c0 01 01 01 01 01 01 01 01
01 01 01 01 01 01 02 3a 80 18 71 38 2d 40 58 2c
25 00 56 50 21 00 00 1e 00 00 00 fc 00 43 52 32
37 30 45 0a 20 20 20 20 20 20 00 00 00 ff 00 64
65 6d 6f 73 65 74 2d 31 0a 20 30 20 00 00 00 fd
00 34 b4 1e d0 3c 00 0a 20 20 20 20 20 20 01 ab

02 03 37 f2 43 90 01 02 23 09 7f 07 83 01 00 00
67 03 0c 00 10 00 18 78 e2 00 d5 e3 05 c0 00 e6
06 05 01 69 69 4f 68 1a 00 00 01 01 32 b4 e6 67
d8 5d c4 01 78 80 01 5c 82 80 8c 70 38 2d 40 30
20 3a 00 56 50 21 00 00 1e d2 96 80 a0 70 38 2d
40 30 20 25 00 56 50 21 00 00 1e c4 6d 80 a0 70
38 2d 40 30 20 25 00 56 50 21 00 00 1a 4c 9f 80
70 70 38 23 40 30 20 25 00 58 4a 21 00 00 1a 3b

----------------

Block 0, Base EDID:
  EDID Structure Version & Revision: 1.3
  Vendor & Product Identification:
    Manufacturer: HGC
    Model: 9984
    Serial Number: ...
    Made in: week 52 of 2023
  Basic Display Parameters & Features:
    Digital display
    Maximum image size: 60 cm x 34 cm
    Gamma: 2.20
    DPMS levels: Off
    Undefined display color type
    Default (sRGB) color space is primary color space
    First detailed timing is the preferred timing
  Color Characteristics:
    Red  : 0.6396, 0.3300
    Green: 0.2998, 0.5996
    Blue : 0.1503, 0.0595
    White: 0.3125, 0.3291
  Established Timings I & II:
    DMT 0x04:   640x480    59.940476 Hz   4:3     31.469 kHz     25.175000 MHz
    DMT 0x09:   800x600    60.316541 Hz   4:3     37.879 kHz     40.000000 MHz
    DMT 0x10:  1024x768    60.003840 Hz   4:3     48.363 kHz     65.000000 MHz
  Standard Timings:
    DMT 0x52:  1920x1080   60.000000 Hz  16:9     67.500 kHz    148.500000 MHz
  Detailed Timing Descriptors:
    DTD 1:  1920x1080   60.000000 Hz  16:9     67.500 kHz    148.500000 MHz (598 mm x 336 mm)
                 Hfront   88 Hsync  44 Hback  148 Hpol P
                 Vfront    2 Vsync   5 Vback   38 Vpol P
    Display Product Name: 'CR270E'
    Display Product Serial Number: ...
    Display Range Limits:
      Monitor ranges (GTF): 52-180 Hz V, 30-208 kHz H, max dotclock 600 MHz
  Extension blocks: 1
Checksum: 0xab

----------------

Block 1, CTA-861 Extension Block:
  Revision: 3
  Underscans IT Video Formats by default
  Basic audio support
  Supports YCbCr 4:4:4
  Supports YCbCr 4:2:2
  Native DTDs: 2
  Video Data Block:
    VIC  16:  1920x1080   60.000000 Hz  16:9     67.500 kHz    148.500000 MHz (native)
    VIC   1:   640x480    59.940476 Hz   4:3     31.469 kHz     25.175000 MHz
    VIC   2:   720x480    59.940060 Hz   4:3     31.469 kHz     27.000000 MHz
  Audio Data Block:
    Linear PCM:
      Max channels: 2
      Supported sample rates (kHz): 192 176.4 96 88.2 48 44.1 32
      Supported sample sizes (bits): 24 20 16
  Speaker Allocation Data Block:
    FL/FR - Front Left/Right
  Vendor-Specific Data Block (HDMI), OUI 00-0C-03:
    Source physical address: 1.0.0.0
    DC_30bit
    DC_Y444
    Maximum TMDS clock: 600 MHz
  Video Capability Data Block:
    YCbCr quantization: Selectable (via AVI YQ)
    RGB quantization: Selectable (via AVI Q)
    PT scan behavior: Always Overscanned
    IT scan behavior: Always Overscanned
    CE scan behavior: Always Overscanned
  Colorimetry Data Block:
    BT2020YCC
    BT2020RGB
  HDR Static Metadata Data Block:
    Electro optical transfer functions:
      Traditional gamma - SDR luminance range
      SMPTE ST2084
    Supported static metadata descriptors:
      Static metadata type 1
    Desired content max luminance: 105 (486.099 cd/m^2)
    Desired content max frame-average luminance: 105 (486.099 cd/m^2)
    Desired content min luminance: 79 (0.467 cd/m^2)
  Vendor-Specific Data Block (AMD), OUI 00-00-1A:
    Version: 1
    Flags 1: 0x01
      FreeSync Supported
    Minimum Refresh Rate: 50 Hz
    Maximum Refresh Rate: 180 Hz
    MCCS VCP Code: 0xe6
  Vendor-Specific Data Block (HDMI Forum), OUI C4-5D-D8:
    Version: 1
    Maximum TMDS Character Rate: 600 MHz
    SCDC Present
    Supports 10-bits/component Deep Color 4:2:0 Pixel Encoding
  Detailed Timing Descriptors:
    DTD 2:  1920x1080  144.000000 Hz  16:9    162.000 kHz    333.720000 MHz (598 mm x 336 mm)
                 Hfront   48 Hsync  32 Hback   60 Hpol P
                 Vfront    3 Vsync  10 Vback   32 Vpol P
    DTD 3:  1920x1080  165.000000 Hz  16:9    185.625 kHz    386.100000 MHz (598 mm x 336 mm)
                 Hfront   48 Hsync  32 Hback   80 Hpol P
                 Vfront    2 Vsync   5 Vback   38 Vpol P
    DTD 4:  1920x1080  120.085470 Hz  16:9    135.096 kHz    281.000000 MHz (598 mm x 336 mm)
                 Hfront   48 Hsync  32 Hback   80 Hpol P
                 Vfront    2 Vsync   5 Vback   38 Vpol N
    DTD 5:  1920x1080  179.990113 Hz  16:9    200.689 kHz    407.800000 MHz (600 mm x 330 mm)
                 Hfront   48 Hsync  32 Hback   32 Hpol P
                 Vfront    2 Vsync   5 Vback   28 Vpol N
Checksum: 0x3b

----------------

Warnings:

Block 0, Base EDID:
  Detailed Timing Descriptor #1: DTD is similar but not identical to VIC 16.
  Display Product Serial Number: ...
Block 1, CTA-861 Extension Block:
  Video Data Block: VIC 16 and the first DTD are not identical. Is this intended?
  Video Capability Data Block: IT scan behavior is expected to support underscanned.
  Video Capability Data Block: S_PT is equal to S_IT and S_CE, so should be set to 0 instead.
  Display Product Serial Number is set, so the Serial Number in the Base EDID should be 0.

Failures:

Block 0, Base EDID:
  Display Product Serial Number: ...
Block 1, CTA-861 Extension Block:
  Vendor-Specific Data Block (HDMI), OUI 00-0C-03: HDMI VSDB Max TMDS rate is > 340.
  Video Capability Data Block: IT video formats are always overscanned, but bit 7 of Byte 3 of the CTA-861 Extension header is set to underscanned.
  Vendor-Specific Data Block (HDMI Forum), OUI C4-5D-D8: HDMI Forum VSDB did not immediately follow the HDMI VSDB.
EDID:
  Extension Block 2 started with EDID header, ignoring Extension Blocks >= 2.

EDID conformity: FAIL
