edid-decode (hex):

00 ff ff ff ff ff ff 00 09 e5 07 0b 00 00 00 00
34 1f 01 04 95 22 13 78 03 66 c5 96 5e 5b 91 28
20 50 54 00 00 00 01 01 01 01 01 01 01 01 01 01
01 01 01 01 01 01 70 3a 80 0b 71 38 3c 40 30 20
36 00 58 c2 10 00 00 1a f5 26 80 0b 71 38 3c 40
30 20 36 00 58 c2 10 00 00 1a 00 00 00 00 00 00
00 00 00 00 00 00 00 00 00 00 00 00 00 00 00 02
00 0b 40 ff 0a 3c 7d 16 13 25 7d 00 00 00 00 cf

00 ff ff ff ff ff ff 00 09 e5 07 0b 00 00 00 00
34 1f 01 04 95 22 13 78 03 66 c5 96 5e 5b 91 28
20 50 54 00 00 00 01 01 01 01 01 01 01 01 01 01
01 01 01 01 01 01 70 3a 80 0b 71 38 3c 40 30 20
36 00 58 c2 10 00 00 1a f5 26 80 0b 71 38 3c 40
30 20 36 00 58 c2 10 00 00 1a 00 00 00 00 00 00
00 00 00 00 00 00 00 00 00 00 00 00 00 00 00 02
00 0b 40 ff 0a 3c 7d 16 13 25 7d 00 00 00 00 cf

----------------

Block 0, Base EDID:
  EDID Structure Version & Revision: 1.4
  Vendor & Product Identification:
    Manufacturer: BOE
    Model: 2823
    Made in: week 52 of 2021
  Basic Display Parameters & Features:
    Digital display
    Bits per primary color channel: 6
    DisplayPort interface
    Maximum image size: 34 cm x 19 cm
    Gamma: 2.20
    Supported color formats: RGB 4:4:4
    First detailed timing includes the native pixel format and preferred refresh rate
    Display supports continuous frequencies
  Color Characteristics:
    Red  : 0.5869, 0.3691
    Green: 0.3564, 0.5683
    Blue : 0.1591, 0.1250
    White: 0.3134, 0.3291
  Established Timings I & II: none
  Standard Timings: none
  Detailed Timing Descriptors:
    DTD 1:  1920x1080   60.003690 Hz  16:9     68.404 kHz    149.600000 MHz (344 mm x 194 mm)
                 Hfront   48 Hsync  32 Hback  187 Hpol P
                 Vfront    3 Vsync   6 Vback   51 Vpol N
    DTD 2:  1920x1080   40.001123 Hz  16:9     45.601 kHz     99.730000 MHz (344 mm x 194 mm)
                 Hfront   48 Hsync  32 Hback  187 Hpol P
                 Vfront    3 Vsync   6 Vback   51 Vpol N
    Empty Descriptor
    Manufacturer-Specified Display Descriptor (0x02): 00 02 00 0b 40 ff 0a 3c 7d 16 13 25 7d 00 00 00 '....@..<}..%}...'
Checksum: 0xcf

----------------

Warnings:

Block 0, Base EDID:
  Missing Display Product Name.

Failures:

Block 0, Base EDID:
  Empty Descriptor: Use Dummy Descriptor instead of all zeroes.
  Missing Display Range Limits Descriptor.
EDID:
  Extension Block 1 started with EDID header, ignoring Extension Blocks >= 1.

EDID conformity: FAIL
