edid-decode (hex):

00 ff ff ff ff ff ff 00 60 a3 25 18 00 00 00 00
20 22 01 04 b5 3c 22 78 3b 7a f7 ac 50 47 a5 25
10 50 52 01 08 00 81 00 b3 00 d1 c0 a9 c0 81 80
81 c0 01 01 01 01 6a 5e 00 a0 a0 a0 29 50 30 20
45 00 55 50 21 00 00 1a 00 00 00 ff 00 0a 20 20
20 20 20 20 20 20 20 20 20 20 00 00 00 fc 00 45
53 2d 47 32 37 46 32 51 0a 20 20 20 00 00 00 fd
00 30 b4 ff ff 4b 01 0a 20 20 20 20 20 20 02 52

02 03 21 f3 46 10 01 03 04 05 1f 23 09 7f 07 83
01 00 00 e2 00 c0 e3 05 c0 00 e6 06 05 01 62 62
00 e6 c6 00 a0 a0 a0 78 50 30 20 45 00 55 50 21
00 00 1a 80 e5 00 a0 a0 a0 3c 50 30 20 45 00 55
50 21 00 00 1a af fc 00 50 a0 a0 2d 50 30 20 45
00 55 50 21 00 00 1a 00 00 00 00 00 00 00 00 00
00 00 00 00 00 00 00 00 00 00 00 00 00 00 00 00
00 00 00 00 00 00 00 00 00 00 00 00 00 00 00 f3

70 12 79 00 00 03 00 14 d4 17 01 04 ff 09 77 00
2f 80 1f 00 9f 05 2c 00 02 00 04 00 00 00 00 00
00 00 00 00 00 00 00 00 00 00 00 00 00 00 00 00
00 00 00 00 00 00 00 00 00 00 00 00 00 00 00 00
00 00 00 00 00 00 00 00 00 00 00 00 00 00 00 00
00 00 00 00 00 00 00 00 00 00 00 00 00 00 00 00
00 00 00 00 00 00 00 00 00 00 00 00 00 00 00 00
00 00 00 00 00 00 00 00 00 00 00 00 00 00 4b 90

00 ff ff ff ff ff ff 00 60 a3 25 18 00 00 00 00
20 22 01 04 b5 3c 22 78 3b 7a f7 ac 50 47 a5 25
10 50 52 01 08 00 81 00 b3 00 d1 c0 a9 c0 81 80
81 c0 01 01 01 01 6a 5e 00 a0 a0 a0 29 50 30 20
45 00 55 50 21 00 00 1a 00 00 00 ff 00 0a 20 20
20 20 20 20 20 20 20 20 20 20 00 00 00 fc 00 45
53 2d 47 32 37 46 32 51 0a 20 20 20 00 00 00 fd
00 30 b4 ff ff 4b 01 0a 20 20 20 20 20 20 02 52

02 03 21 f3 46 10 01 03 04 05 1f 23 09 7f 07 83
01 00 00 e2 00 c0 e3 05 c0 00 e6 06 05 01 62 62
00 e6 c6 00 a0 a0 a0 78 50 30 20 45 00 55 50 21
00 00 1a 80 e5 00 a0 a0 a0 3c 50 30 20 45 00 55
50 21 00 00 1a af fc 00 50 a0 a0 2d 50 30 20 45
00 55 50 21 00 00 1a 00 00 00 00 00 00 00 00 00
00 00 00 00 00 00 00 00 00 00 00 00 00 00 00 00
00 00 00 00 00 00 00 00 00 00 00 00 00 00 00 f3

70 12 79 00 00 03 00 14 d4 17 01 04 ff 09 77 00
2f 80 1f 00 9f 05 2c 00 02 00 04 00 00 00 00 00
00 00 00 00 00 00 00 00 00 00 00 00 00 00 00 00
00 00 00 00 00 00 00 00 00 00 00 00 00 00 00 00
00 00 00 00 00 00 00 00 00 00 00 00 00 00 00 00
00 00 00 00 00 00 00 00 00 00 00 00 00 00 00 00
00 00 00 00 00 00 00 00 00 00 00 00 00 00 00 00
00 00 00 00 00 00 00 00 00 00 00 00 00 00 4b 90

----------------

Block 0, Base EDID:
  EDID Structure Version & Revision: 1.4
  Vendor & Product Identification:
    Manufacturer: XEC
    Model: 6181
    Made in: week 32 of 2024
  Basic Display Parameters & Features:
    Digital display
    Bits per primary color channel: 10
    DisplayPort interface
    Maximum image size: 60 cm x 34 cm
    Gamma: 2.20
    DPMS levels: Off
    Supported color formats: RGB 4:4:4, YCrCb 4:4:4, YCrCb 4:2:2
    First detailed timing includes the native pixel format and preferred refresh rate
    Display supports continuous frequencies
  Color Characteristics:
    Red  : 0.6728, 0.3154
    Green: 0.2792, 0.6464
    Blue : 0.1474, 0.0654
    White: 0.3134, 0.3232
  Established Timings I & II:
    DMT 0x09:   800x600    60.316541 Hz   4:3     37.879 kHz     40.000000 MHz
    DMT 0x10:  1024x768    60.003840 Hz   4:3     48.363 kHz     65.000000 MHz
  Standard Timings:
    DMT 0x1c:  1280x800    59.810326 Hz  16:10    49.702 kHz     83.500000 MHz
    DMT 0x3a:  1680x1050   59.954250 Hz  16:10    65.290 kHz    146.250000 MHz
    DMT 0x52:  1920x1080   60.000000 Hz  16:9     67.500 kHz    148.500000 MHz
    DMT 0x53:  1600x900    60.000000 Hz  16:9     60.000 kHz    108.000000 MHz (RB)
    DMT 0x23:  1280x1024   60.019740 Hz   5:4     63.981 kHz    108.000000 MHz
    DMT 0x55:  1280x720    60.000000 Hz  16:9     45.000 kHz     74.250000 MHz
  Detailed Timing Descriptors:
    DTD 1:  2560x1440   60.000199 Hz  16:9     88.860 kHz    241.700000 MHz (597 mm x 336 mm)
                 Hfront   48 Hsync  32 Hback   80 Hpol P
                 Vfront    4 Vsync   5 Vback   32 Vpol N
    Display Product Serial Number: ...
    Display Product Name: 'ES-G27F2Q'
    Display Range Limits:
      Monitor ranges (Range Limits Only): 48-180 Hz V, 255-255 kHz H, max dotclock 750 MHz
  Extension blocks: 2
Checksum: 0x52

----------------

Block 1, CTA-861 Extension Block:
  Revision: 3
  Underscans IT Video Formats by default
  Basic audio support
  Supports YCbCr 4:4:4
  Supports YCbCr 4:2:2
  Native DTDs: 3
  Video Data Block:
    VIC  16:  1920x1080   60.000000 Hz  16:9     67.500 kHz    148.500000 MHz
    VIC   1:   640x480    59.940476 Hz   4:3     31.469 kHz     25.175000 MHz
    VIC   3:   720x480    59.940060 Hz  16:9     31.469 kHz     27.000000 MHz
    VIC   4:  1280x720    60.000000 Hz  16:9     45.000 kHz     74.250000 MHz
    VIC   5:  1920x1080i  60.000000 Hz  16:9     33.750 kHz     74.250000 MHz
    VIC  31:  1920x1080   50.000000 Hz  16:9     56.250 kHz    148.500000 MHz
  Audio Data Block:
    Linear PCM:
      Max channels: 2
      Supported sample rates (kHz): 192 176.4 96 88.2 48 44.1 32
      Supported sample sizes (bits): 24 20 16
  Speaker Allocation Data Block:
    FL/FR - Front Left/Right
  Video Capability Data Block:
    YCbCr quantization: Selectable (via AVI YQ)
    RGB quantization: Selectable (via AVI Q)
    PT scan behavior: No Data
    IT scan behavior: IT video formats not supported
    CE scan behavior: CE video formats not supported
  Colorimetry Data Block:
    BT2020YCC
    BT2020RGB
  HDR Static Metadata Data Block:
    Electro optical transfer functions:
      Traditional gamma - SDR luminance range
      SMPTE ST2084
    Supported static metadata descriptors:
      Static metadata type 1
    Desired content max luminance: 98 (417.710 cd/m^2)
    Desired content max frame-average luminance: 98 (417.710 cd/m^2)
    Desired content min luminance: 0 (0.000 cd/m^2)
  Detailed Timing Descriptors:
    DTD 2:  2560x1440  119.999057 Hz  16:9    187.199 kHz    509.180000 MHz (597 mm x 336 mm)
                 Hfront   48 Hsync  32 Hback   80 Hpol P
                 Vfront    4 Vsync   5 Vback  111 Vpol N
    DTD 3:  2560x1440  144.000000 Hz  16:9    216.000 kHz    587.520000 MHz (597 mm x 336 mm)
                 Hfront   48 Hsync  32 Hback   80 Hpol P
                 Vfront    4 Vsync   5 Vback   51 Vpol N
    DTD 4:  2560x1440  165.001020 Hz  16:9    245.027 kHz    646.870000 MHz (597 mm x 336 mm)
                 Hfront   48 Hsync  32 Hback    0 Hpol P
                 Vfront    4 Vsync   5 Vback   36 Vpol N
Checksum: 0xf3  Unused space in Extension Block: 40 bytes

----------------

Block 2, DisplayID Extension Block:
  Version: 1.2
  Extension Count: 0
  Display Product Type: Extension Section
  Video Timing Modes Type 1 - Detailed Timings Data Block:
    DTD:  2560x1440  180.001508 Hz  16:9    267.302 kHz    716.370000 MHz (aspect 16:9, no 3D stereo)
               Hfront   48 Hsync  32 Hback   40 Hpol P
               Vfront    3 Vsync   5 Vback   37 Vpol N
  Checksum: 0x4b
Checksum: 0x90

----------------

Warnings:

Block 1, CTA-861 Extension Block:
  Video Data Block: VIC 16 and the first DTD are not identical. Is this intended?
  Video Capability Data Block: IT scan behavior is expected to support underscanned.
  Video Capability Data Block: 'CE video formats not supported' makes no sense.
  Colorimetry Data Block: Set the sRGB colorimetry bit to avoid interop issues.
EDID:
  Base EDID: Some timings are out of range of the Monitor Ranges:
    Horizontal Freq: 31.468 - 267.302 kHz (Monitor: 255.000 - 255.000 kHz)

Failures:

Block 0, Base EDID:
  Display Product Serial Number: ...
Block 1, CTA-861 Extension Block:
  Detailed Timing Descriptor #4: 0 or negative horizontal back porch.
Block 2, DisplayID Extension Block:
  DisplayID Base Block has no product type.
EDID:
  Extension Block 3 started with EDID header, ignoring Extension Blocks >= 3.
  DisplayID: DisplayID expects at least one preferred timing.

EDID conformity: FAIL
