edid-decode (hex):

00 ff ff ff ff ff ff 00 4d 10 94 14 00 00 00 00
14 1b 01 04 a5 1a 11 78 06 de 50 a3 54 4c 99 26
0f 50 54 00 00 00 01 01 01 01 01 01 01 01 01 01
01 01 01 01 01 01 e7 8b 40 a0 b0 80 2c 70 30 20
3a 00 03 ad 10 00 00 18 e7 8b 40 a0 b0 80 17 72
30 20 3a 00 03 ad 10 00 00 18 00 00 00 10 00 00
00 00 00 00 00 00 00 00 00 00 00 00 00 00 00 fe
00 4c 51 31 32 33 5a 31 4a 58 33 58 0a 20 00 7c

00 ff ff ff ff ff ff 00 4d 10 94 14 00 00 00 00
14 1b 01 04 a5 1a 11 78 06 de 50 a3 54 4c 99 26
0f 50 54 00 00 00 01 01 01 01 01 01 01 01 01 01
01 01 01 01 01 01 e7 8b 40 a0 b0 80 2c 70 30 20
3a 00 03 ad 10 00 00 18 e7 8b 40 a0 b0 80 17 72
30 20 3a 00 03 ad 10 00 00 18 00 00 00 10 00 00
00 00 00 00 00 00 00 00 00 00 00 00 00 00 00 fe
00 4c 51 31 32 33 5a 31 4a 58 33 58 0a 20 00 7c

----------------

Block 0, Base EDID:
  EDID Structure Version & Revision: 1.4
  Vendor & Product Identification:
    Manufacturer: SHP
    Model: 5268
    Made in: week 20 of 2017
  Basic Display Parameters & Features:
    Digital display
    Bits per primary color channel: 8
    DisplayPort interface
    Maximum image size: 26 cm x 17 cm
    Gamma: 2.20
    Supported color formats: RGB 4:4:4
    Default (sRGB) color space is primary color space
    First detailed timing includes the native pixel format and preferred refresh rate
  Color Characteristics:
    Red  : 0.6396, 0.3291
    Green: 0.2998, 0.5996
    Blue : 0.1494, 0.0595
    White: 0.3125, 0.3281
  Established Timings I & II: none
  Standard Timings: none
  Detailed Timing Descriptors:
    DTD 1:  2880x1920   59.985998 Hz   3:2    117.812 kHz    358.150000 MHz (259 mm x 173 mm)
                 Hfront   48 Hsync  32 Hback   80 Hpol N
                 Vfront    3 Vsync  10 Vback   31 Vpol N
    DTD 2:  2880x1920   47.988798 Hz   3:2    117.812 kHz    358.150000 MHz (259 mm x 173 mm)
                 Hfront   48 Hsync  32 Hback   80 Hpol N
                 Vfront    3 Vsync  10 Vback  522 Vpol N
    Dummy Descriptor:
    Alphanumeric Data String: 'LQ123Z1JX3X'
Checksum: 0x7c

----------------

Warnings:

Block 0, Base EDID:
  Missing Display Product Name.

Failures:

Block 0, Base EDID:
  Basic Display Parameters & Features: sRGB is signaled, but the chromaticities do not match.
EDID:
  Extension Block 1 started with EDID header, ignoring Extension Blocks >= 1.

EDID conformity: FAIL
