edid-decode (hex):

00 ff ff ff ff ff ff 00 0e 14 bd 1b 00 00 00 00
08 15 01 03 80 16 0c 78 0a ab 4d 92 56 59 91 29
1d 50 54 00 00 00 01 01 01 01 01 01 01 01 01 01
01 01 01 01 01 01 72 16 00 dd 41 58 26 20 30 20
36 00 df 7d 00 00 00 1a 72 16 00 dd 41 58 26 20
30 20 36 00 df 7d 00 00 00 1a 00 00 00 fe 00 43
50 54 0a 20 20 20 20 20 20 20 20 20 00 00 00 fe
00 43 4c 41 41 31 30 31 4e 42 30 31 0a 20 00 b8

00 ff ff ff ff ff ff 00 0e 14 bd 1b 00 00 00 00
08 15 01 03 80 16 0c 78 0a ab 4d 92 56 59 91 29
1d 50 54 00 00 00 01 01 01 01 01 01 01 01 01 01
01 01 01 01 01 01 72 16 00 dd 41 58 26 20 30 20
36 00 df 7d 00 00 00 1a 72 16 00 dd 41 58 26 20
30 20 36 00 df 7d 00 00 00 1a 00 00 00 fe 00 43
50 54 0a 20 20 20 20 20 20 20 20 20 00 00 00 fe
00 43 4c 41 41 31 30 31 4e 42 30 31 0a 20 00 b8

----------------

Block 0, Base EDID:
  EDID Structure Version & Revision: 1.3
  Vendor & Product Identification:
    Manufacturer: CPT
    Model: 7101
    Made in: week 8 of 2011
  Basic Display Parameters & Features:
    Digital display
    Maximum image size: 22 cm x 12 cm
    Gamma: 2.20
    RGB color display
    First detailed timing is the preferred timing
  Color Characteristics:
    Red  : 0.5722, 0.3378
    Green: 0.3496, 0.5693
    Blue : 0.1611, 0.1132
    White: 0.3154, 0.3291
  Established Timings I & II: none
  Standard Timings: none
  Detailed Timing Descriptors:
    DTD 1:  1024x600    60.001796 Hz 128:75    38.281 kHz     57.460000 MHz (223 mm x 125 mm)
                 Hfront   48 Hsync  32 Hback  397 Hpol P
                 Vfront    3 Vsync   6 Vback   29 Vpol N
    DTD 2:  1024x600    60.001796 Hz 128:75    38.281 kHz     57.460000 MHz (223 mm x 125 mm)
                 Hfront   48 Hsync  32 Hback  397 Hpol P
                 Vfront    3 Vsync   6 Vback   29 Vpol N
    Alphanumeric Data String: 'CPT'
    Alphanumeric Data String: 'CLAA101NB01'
Checksum: 0xb8

----------------

Failures:

Block 0, Base EDID:
  Missing Display Product Name.
  Missing Display Range Limits Descriptor.
EDID:
  Extension Block 1 started with EDID header, ignoring Extension Blocks >= 1.

EDID conformity: FAIL
