edid-decode (hex):

00 ff ff ff ff ff ff 00 4a 8b 3a 3b 01 01 01 01
24 1d 01 03 80 00 00 78 3e ee 91 a3 54 4c 99 26
0f 50 54 21 08 00 d1 c0 d1 e8 d1 fc a9 c0 81 c0
01 01 01 01 01 01 04 74 80 18 71 38 2d 40 58 2c
45 00 58 c3 10 00 00 1a 00 00 00 fc 00 52 54 4b
20 46 48 44 20 48 44 52 0a 20 00 00 00 ff 00 64
65 6d 6f 73 65 74 2d 31 0a 20 30 20 00 00 00 fd
00 3c 90 1e a2 1e 00 0a 20 20 20 20 20 20 01 a4

02 03 37 f0 5e 04 10 4d 4e 2f 2f 2f 2f 3f 00 00
00 00 00 00 00 00 00 00 00 00 00 00 00 00 00 00
00 00 00 23 09 7f 07 83 01 00 00 68 03 0c 00 11
00 28 44 00 e2 00 d5 01 1d 00 72 51 d0 1e 20 6e
28 55 00 10 09 00 00 00 1e 02 3a 80 18 71 38 2d
40 58 2c 45 00 10 09 00 00 00 1e 02 3a 00 72 51
d0 1e 20 6e 28 55 00 10 09 00 00 00 1e 02 3a 00
72 51 d0 1e 20 6e 28 55 00 10 09 00 00 00 00 b0

----------------

Block 0, Base EDID:
  EDID Structure Version & Revision: 1.3
  Vendor & Product Identification:
    Manufacturer: RTK
    Model: 15162
    Serial Number: ...
    Made in: week 36 of 2019
  Basic Display Parameters & Features:
    Digital display
    Image size is variable
    Gamma: 2.20
    DPMS levels: Off
    Undefined display color type
    Default (sRGB) color space is primary color space
    First detailed timing is the preferred timing
  Color Characteristics:
    Red  : 0.6396, 0.3300
    Green: 0.2998, 0.5996
    Blue : 0.1503, 0.0595
    White: 0.3125, 0.3291
  Established Timings I & II:
    DMT 0x04:   640x480    59.940476 Hz   4:3     31.469 kHz     25.175000 MHz
    DMT 0x09:   800x600    60.316541 Hz   4:3     37.879 kHz     40.000000 MHz
    DMT 0x10:  1024x768    60.003840 Hz   4:3     48.363 kHz     65.000000 MHz
  Standard Timings:
    DMT 0x52:  1920x1080   60.000000 Hz  16:9     67.500 kHz    148.500000 MHz
    GTF     :  1920x1080  100.000000 Hz  16:9    114.400 kHz    302.016000 MHz
    GTF     :  1920x1080  119.999987 Hz  16:9    138.840 kHz    368.759000 MHz
    DMT 0x53:  1600x900    60.000000 Hz  16:9     60.000 kHz    108.000000 MHz (RB)
    DMT 0x55:  1280x720    60.000000 Hz  16:9     45.000 kHz     74.250000 MHz
  Detailed Timing Descriptors:
    DTD 1:  1920x1080  120.000000 Hz  16:9    135.000 kHz    297.000000 MHz (344 mm x 195 mm)
                 Hfront   88 Hsync  44 Hback  148 Hpol P
                 Vfront    4 Vsync   5 Vback   36 Vpol N
    Display Product Name: 'RTK FHD HDR'
    Display Product Serial Number: ...
    Display Range Limits:
      Monitor ranges (GTF): 60-144 Hz V, 30-162 kHz H, max dotclock 300 MHz
  Extension blocks: 1
Checksum: 0xa4

----------------

Block 1, CTA-861 Extension Block:
  Revision: 3
  Underscans IT Video Formats by default
  Basic audio support
  Supports YCbCr 4:4:4
  Supports YCbCr 4:2:2
  Native DTDs: 0
  Video Data Block:
    VIC   4:  1280x720    60.000000 Hz  16:9     45.000 kHz     74.250000 MHz
    VIC  16:  1920x1080   60.000000 Hz  16:9     67.500 kHz    148.500000 MHz
    VIC  77:  1920x1080  100.000000 Hz  64:27   112.500 kHz    297.000000 MHz
    VIC  78:  1920x1080  120.000000 Hz  64:27   135.000 kHz    297.000000 MHz
    VIC  47:  1280x720   120.000000 Hz  16:9     90.000 kHz    148.500000 MHz
    VIC  47:  1280x720   120.000000 Hz  16:9     90.000 kHz    148.500000 MHz
    VIC  47:  1280x720   120.000000 Hz  16:9     90.000 kHz    148.500000 MHz
    VIC  47:  1280x720   120.000000 Hz  16:9     90.000 kHz    148.500000 MHz
    VIC  63:  1920x1080  120.000000 Hz  16:9    135.000 kHz    297.000000 MHz
  Audio Data Block:
    Linear PCM:
      Max channels: 2
      Supported sample rates (kHz): 192 176.4 96 88.2 48 44.1 32
      Supported sample sizes (bits): 24 20 16
  Speaker Allocation Data Block:
    FL/FR - Front Left/Right
  Vendor-Specific Data Block (HDMI), OUI 00-0C-03:
    Source physical address: 1.1.0.0
    DC_36bit
    DC_Y444
    Maximum TMDS clock: 340 MHz
  Video Capability Data Block:
    YCbCr quantization: Selectable (via AVI YQ)
    RGB quantization: Selectable (via AVI Q)
    PT scan behavior: Always Overscanned
    IT scan behavior: Always Overscanned
    CE scan behavior: Always Overscanned
  Detailed Timing Descriptors:
    DTD 2:  1280x720    60.000000 Hz  16:9     45.000 kHz     74.250000 MHz (16 mm x 9 mm)
                 Hfront  110 Hsync  40 Hback  220 Hpol P
                 Vfront    5 Vsync   5 Vback   20 Vpol P
    DTD 3:  1920x1080   60.000000 Hz  16:9     67.500 kHz    148.500000 MHz (16 mm x 9 mm)
                 Hfront   88 Hsync  44 Hback  148 Hpol P
                 Vfront    4 Vsync   5 Vback   36 Vpol P
    DTD 4:  1280x720   120.000000 Hz  16:9     90.000 kHz    148.500000 MHz (16 mm x 9 mm)
                 Hfront  110 Hsync  40 Hback  220 Hpol P
                 Vfront    5 Vsync   5 Vback   20 Vpol P
    DTD 5:  1280x720   120.000000 Hz  16:9     90.000 kHz    148.500000 MHz (analog composite, sync-on-green, 16 mm x 9 mm)
                 Hfront  110 Hsync  40 Hback  220 Hpol N
                 Vfront    5 Vsync   5 Vback   20 Vpol N
Checksum: 0xb0

----------------

Warnings:

Block 0, Base EDID:
  Vendor & Product Identification: The serial number is one of the known dummy values, it should probably be set to 0.
  Detailed Timing Descriptor #1: DTD is similar but not identical to VIC 63.
  Display Product Serial Number: ...
Block 1, CTA-861 Extension Block:
  Video Data Block: VIC 4 and the first DTD are not identical. Is this intended?
  Video Capability Data Block: IT scan behavior is expected to support underscanned.
  Video Capability Data Block: S_PT is equal to S_IT and S_CE, so should be set to 0 instead.
  Detailed Timing Descriptor #2: Dubious image size (16x9 mm is smaller than 100x100 mm).
  Detailed Timing Descriptor #3: Dubious image size (16x9 mm is smaller than 100x100 mm).
  Detailed Timing Descriptor #4: Dubious image size (16x9 mm is smaller than 100x100 mm).
  Detailed Timing Descriptor #5: DTD is similar but not identical to VIC 47.
  Detailed Timing Descriptor #5: Dubious image size (16x9 mm is smaller than 100x100 mm).
  Display Product Serial Number is set, so the Serial Number in the Base EDID should be 0.
EDID:
  Base EDID: Some timings are out of range of the Monitor Ranges:
    Maximum Clock: 368.759 MHz (Monitor: 300.000 MHz)

Failures:

Block 0, Base EDID:
  Display Product Serial Number: ...
Block 1, CTA-861 Extension Block:
  Video Data Block: Duplicate VIC 47.
  Video Capability Data Block: IT video formats are always overscanned, but bit 7 of Byte 3 of the CTA-861 Extension header is set to underscanned.
EDID:
  Base EDID: The DTD max image size is 344x195mm, but the display size is not specified anywhere.
  CTA-861: The maximum HDMI TMDS clock is 340000 kHz, but one or more video timings go up to 368759 kHz.

EDID conformity: FAIL
