edid-decode (hex):

00 ff ff ff ff ff ff 00 30 ae 3f 18 83 52 02 00
0c 13 01 04 a5 29 17 78 22 ee d1 a5 55 48 9b 26
12 50 54 bf ee 00 31 4a 61 4c 01 01 01 01 01 01
01 01 01 01 01 01 66 21 56 aa 51 00 1e 30 46 8f
33 00 9d ea 10 00 00 1e 66 21 50 b0 51 00 1b 30
40 70 36 00 22 13 00 00 00 1e 00 00 00 fd 00 32
4c 1e 41 0e 00 0a 20 20 20 20 20 20 00 00 00 fc
00 44 31 38 35 77 41 0a 20 20 20 20 20 20 00 ad

----------------

Block 0, Base EDID:
  EDID Structure Version & Revision: 1.4
  Vendor & Product Identification:
    Manufacturer: LEN
    Model: 6207
    Serial Number: ...
    Made in: week 12 of 2009
  Basic Display Parameters & Features:
    Digital display
    Bits per primary color channel: 8
    DisplayPort interface
    Maximum image size: 41 cm x 23 cm
    Gamma: 2.20
    DPMS levels: Off
    Supported color formats: RGB 4:4:4
    First detailed timing includes the native pixel format and preferred refresh rate
  Color Characteristics:
    Red  : 0.6474, 0.3339
    Green: 0.2841, 0.6074
    Blue : 0.1513, 0.0712
    White: 0.3125, 0.3291
  Established Timings I & II:
    IBM     :   720x400    70.081663 Hz   9:5     31.467 kHz     28.320000 MHz
    DMT 0x04:   640x480    59.940476 Hz   4:3     31.469 kHz     25.175000 MHz
    Apple   :   640x480    66.666667 Hz   4:3     35.000 kHz     30.240000 MHz
    DMT 0x05:   640x480    72.808802 Hz   4:3     37.861 kHz     31.500000 MHz
    DMT 0x06:   640x480    75.000000 Hz   4:3     37.500 kHz     31.500000 MHz
    DMT 0x08:   800x600    56.250000 Hz   4:3     35.156 kHz     36.000000 MHz
    DMT 0x09:   800x600    60.316541 Hz   4:3     37.879 kHz     40.000000 MHz
    DMT 0x0a:   800x600    72.187572 Hz   4:3     48.077 kHz     50.000000 MHz
    DMT 0x0b:   800x600    75.000000 Hz   4:3     46.875 kHz     49.500000 MHz
    Apple   :   832x624    74.551266 Hz   4:3     49.726 kHz     57.284000 MHz
    DMT 0x10:  1024x768    60.003840 Hz   4:3     48.363 kHz     65.000000 MHz
    DMT 0x11:  1024x768    70.069359 Hz   4:3     56.476 kHz     75.000000 MHz
    DMT 0x12:  1024x768    75.028582 Hz   4:3     60.023 kHz     78.750000 MHz
  Standard Timings:
    GTF     :   640x480    70.000000 Hz   4:3     35.000 kHz     28.560000 MHz
    DMT 0x11:  1024x768    70.069359 Hz   4:3     56.476 kHz     75.000000 MHz
  Detailed Timing Descriptors:
    DTD 1:  1366x768    59.789541 Hz 683:384   47.712 kHz     85.500000 MHz (413 mm x 234 mm)
                 Hfront   70 Hsync 143 Hback  213 Hpol P
                 Vfront    3 Vsync   3 Vback   24 Vpol P
    DTD 2:  1360x768    60.015162 Hz  85:48    47.712 kHz     85.500000 MHz (34 mm x 19 mm)
                 Hfront   64 Hsync 112 Hback  256 Hpol P
                 Vfront    3 Vsync   6 Vback   18 Vpol P
    Display Range Limits:
      Monitor ranges (GTF): 50-76 Hz V, 30-65 kHz H, max dotclock 140 MHz
    Display Product Name: 'D185wA'
Checksum: 0xad

----------------

Warnings:

Block 0, Base EDID:
  Detailed Timing Descriptor #2: Dubious image size (34x19 mm is smaller than 100x100 mm).
  Display Range Limits: GTF support is deprecated in EDID 1.4.

Failures:

Block 0, Base EDID:
  Detailed Timing Descriptor #2: Mismatch of image size 34x19 mm vs display size 410x230 mm.
  Display Range Limits: GTF is supported, but the display does not support continuous frequencies.

EDID conformity: FAIL
