edid-decode (hex):

00 ff ff ff ff ff ff 00 0e 14 c5 14 00 00 00 00
18 14 01 04 80 22 13 78 0a 4e 4d 9e 57 54 91 26
0f 50 54 00 00 00 01 01 01 01 01 01 01 01 01 01
01 01 01 01 01 01 78 1d 56 c2 50 00 26 30 3b 27
36 00 58 c2 10 00 00 1a 78 1d 56 c2 50 00 26 30
3b 27 36 00 58 c2 10 00 00 1a 00 00 00 fe 00 4e
47 35 31 30 80 31 35 36 57 41 32 20 00 00 00 00
00 00 41 21 16 00 00 00 00 09 01 0a 20 20 00 ec

----------------

Block 0, Base EDID:
  EDID Structure Version & Revision: 1.4
  Vendor & Product Identification:
    Manufacturer: CPT
    Model: 5317
    Made in: week 24 of 2010
  Basic Display Parameters & Features:
    Digital display
    Color depth is undefined
    Digital interface is not defined
    Maximum image size: 34 cm x 19 cm
    Gamma: 2.20
    Supported color formats: RGB 4:4:4, YCrCb 4:4:4
    First detailed timing includes the native pixel format and preferred refresh rate
  Color Characteristics:
    Red  : 0.6181, 0.3398
    Green: 0.3310, 0.5683
    Blue : 0.1494, 0.0585
    White: 0.3154, 0.3291
  Established Timings I & II: none
  Standard Timings: none
  Detailed Timing Descriptors:
    DTD 1:  1366x768    59.998727 Hz 683:384   48.359 kHz     75.440000 MHz (344 mm x 194 mm)
                 Hfront   59 Hsync  39 Hback   96 Hpol P
                 Vfront    3 Vsync   6 Vback   29 Vpol N
    DTD 2:  1366x768    59.998727 Hz 683:384   48.359 kHz     75.440000 MHz (344 mm x 194 mm)
                 Hfront   59 Hsync  39 Hback   96 Hpol P
                 Vfront    3 Vsync   6 Vback   29 Vpol N
    Alphanumeric Data String: 'NG510.156WA2 '
    Manufacturer-Specified Display Descriptor (0x00): 00 00 00 00 41 21 16 00 00 00 00 09 01 0a 20 20 '....A!........  '
Checksum: 0xec

----------------

Warnings:

Block 0, Base EDID:
  Alphanumeric Data String: Non-ASCII character 0x80 at position 5, can cause problems.
  Missing Display Product Name.

Failures:

Block 0, Base EDID:
  Alphanumeric Data String: No newline, but one or more trailing spaces.

EDID conformity: FAIL
