edid-decode (hex):

00 ff ff ff ff ff ff 00 30 e4 20 02 00 00 00 00
00 13 01 04 b0 23 13 78 0a bc 25 af 4e 34 b7 25
0b 50 54 00 00 00 01 01 01 01 01 01 01 01 01 01
01 01 01 01 01 01 2e 36 80 a0 70 38 1f 40 30 20
35 00 5e be 10 00 00 19 58 2b 80 a0 70 38 1f 40
30 20 35 00 5e be 10 00 00 19 90 19 85 0f 00 f8
00 50 00 1f 00 1f 01 01 00 00 00 00 26 2d 80 a0
70 38 1f 40 30 20 35 00 5e be 10 00 00 19 00 d1

00 ff ff ff ff ff ff 00 30 e4 20 02 00 00 00 00
00 13 01 04 b0 23 13 78 0a bc 25 af 4e 34 b7 25
0b 50 54 00 00 00 01 01 01 01 01 01 01 01 01 01
01 01 01 01 01 01 2e 36 80 a0 70 38 1f 40 30 20
35 00 5e be 10 00 00 19 58 2b 80 a0 70 38 1f 40
30 20 35 00 5e be 10 00 00 19 90 19 85 0f 00 f8
00 50 00 1f 00 1f 01 01 00 00 00 00 26 2d 80 a0
70 38 1f 40 30 20 35 00 5e be 10 00 00 19 00 d1

----------------

Block 0, Base EDID:
  EDID Structure Version & Revision: 1.4
  Vendor & Product Identification:
    Manufacturer: LGD
    Model: 544
    Made in: 2009
  Basic Display Parameters & Features:
    Digital display
    Bits per primary color channel: 10
    Digital interface is not defined
    Maximum image size: 35 cm x 19 cm
    Gamma: 2.20
    Supported color formats: RGB 4:4:4, YCrCb 4:4:4
    First detailed timing includes the native pixel format and preferred refresh rate
  Color Characteristics:
    Red  : 0.6855, 0.3076
    Green: 0.2060, 0.7148
    Blue : 0.1445, 0.0449
    White: 0.3134, 0.3291
  Established Timings I & II: none
  Standard Timings: none
  Detailed Timing Descriptors:
    DTD 1:  1920x1080   60.020425 Hz  16:9     66.683 kHz    138.700000 MHz (350 mm x 190 mm)
                 Hfront   48 Hsync  32 Hback   80 Hpol N
                 Vfront    3 Vsync   5 Vback   23 Vpol N
    DTD 2:  1920x1080   48.016340 Hz  16:9     53.346 kHz    110.960000 MHz (350 mm x 190 mm)
                 Hfront   48 Hsync  32 Hback   80 Hpol N
                 Vfront    3 Vsync   5 Vback   23 Vpol N
    DTD 3:   133x1528  289.373143 Hz 133:1528  442.162 kHz     65.440000 MHz (analog composite, sync-on-green, 1 mm x 1 mm)
                 Hfront    0 Hsync 287 Hback -272 Hpol N
                 Vfront   48 Vsync  48 Vback  -96 Vpol N
                   90 19 85 0f 00 f8 00 50 00 1f 00 1f 01 01 00 00 00 00 '.......P..........'
    DTD 4:  1920x1080   50.015578 Hz  16:9     55.567 kHz    115.580000 MHz (350 mm x 190 mm)
                 Hfront   48 Hsync  32 Hback   80 Hpol N
                 Vfront    3 Vsync   5 Vback   23 Vpol N
Checksum: 0xd1

----------------

Warnings:

Block 0, Base EDID:
  Detailed Timing Descriptor #3: Dubious image size (1x1 mm is smaller than 100x100 mm).
  Missing Display Product Name.

Failures:

Block 0, Base EDID:
  Detailed Timing Descriptor #3: 0 values in the video timing:
    Horizontal Active/Blanking 133/15
    Horizontal Frontporch/Sync Width 0/287
    Vertical Active/Blanking 1528/0
    Vertical Frontporch/Sync Width 48/48
  Detailed Timing Descriptor #3: 0 or negative horizontal front porch.
  Detailed Timing Descriptor #3: 0 or negative horizontal back porch.
  Detailed Timing Descriptor #3: 0 or negative vertical back porch.
  Detailed Timing Descriptor #3: Mismatch of image size 1x1 mm vs display size 350x190 mm.
EDID:
  Extension Block 1 started with EDID header, ignoring Extension Blocks >= 1.

EDID conformity: FAIL
