edid-decode (hex):

00 ff ff ff ff ff ff 00 15 85 08 63 00 00 00 00
1d 1b 01 03 08 56 2f 78 ea d6 a5 a2 59 4a 95 24
14 50 54 a1 08 00 45 40 61 40 81 c0 81 00 81 40
01 01 01 01 01 01 66 21 56 aa 51 00 1e 30 40 70
33 00 56 00 53 00 00 1e 0e 1f 00 80 51 00 1e 30
40 80 37 00 55 00 53 00 00 1c 00 00 00 fd 00 38
3f 1e 5a 0a 00 0a 20 20 20 20 20 20 00 00 00 fc
00 45 4c 53 57 33 39 31 37 42 46 0a 20 20 00 d9

00 ff ff ff ff ff ff 00 15 85 08 63 00 00 00 00
1d 1b 01 03 08 56 2f 78 ea d6 a5 a2 59 4a 95 24
14 50 54 a1 08 00 45 40 61 40 81 c0 81 00 81 40
01 01 01 01 01 01 66 21 56 aa 51 00 1e 30 40 70
33 00 56 00 53 00 00 1e 0e 1f 00 80 51 00 1e 30
40 80 37 00 55 00 53 00 00 1c 00 00 00 fd 00 38
3f 1e 5a 0a 00 0a 20 20 20 20 20 20 00 00 00 fc
00 45 4c 53 57 33 39 31 37 42 46 0a 20 20 00 d9

----------------

Block 0, Base EDID:
  EDID Structure Version & Revision: 1.3
  Vendor & Product Identification:
    Manufacturer: ELE
    Model: 25352
    Made in: week 29 of 2017
  Basic Display Parameters & Features:
    Analog display
    Signal Level Standard: 0.700 : 0.300 : 1.000 V p-p
    Blank level equals black level
    Sync: Separate
    Maximum image size: 86 cm x 47 cm
    Gamma: 2.20
    DPMS levels: Standby Suspend Off
    RGB color display
    First detailed timing is the preferred timing
  Color Characteristics:
    Red  : 0.6357, 0.3486
    Green: 0.2900, 0.5839
    Blue : 0.1425, 0.0800
    White: 0.3134, 0.3291
  Established Timings I & II:
    IBM     :   720x400    70.081663 Hz   9:5     31.467 kHz     28.320000 MHz
    DMT 0x04:   640x480    59.940476 Hz   4:3     31.469 kHz     25.175000 MHz
    DMT 0x09:   800x600    60.316541 Hz   4:3     37.879 kHz     40.000000 MHz
    DMT 0x10:  1024x768    60.003840 Hz   4:3     48.363 kHz     65.000000 MHz
  Standard Timings:
    DMT 0x09:   800x600    60.316541 Hz   4:3     37.879 kHz     40.000000 MHz
    DMT 0x10:  1024x768    60.003840 Hz   4:3     48.363 kHz     65.000000 MHz
    DMT 0x55:  1280x720    60.000000 Hz  16:9     45.000 kHz     74.250000 MHz
    DMT 0x1c:  1280x800    59.810326 Hz  16:10    49.702 kHz     83.500000 MHz
    DMT 0x20:  1280x960    60.000000 Hz   4:3     60.000 kHz    108.000000 MHz
  Detailed Timing Descriptors:
    DTD 1:  1366x768    59.789541 Hz 683:384   47.712 kHz     85.500000 MHz (1366 mm x 768 mm)
                 Hfront   64 Hsync 112 Hback  250 Hpol P
                 Vfront    3 Vsync   3 Vback   24 Vpol P
    DTD 2:  1280x768    59.870228 Hz   5:3     47.776 kHz     79.500000 MHz (1365 mm x 768 mm)
                 Hfront   64 Hsync 128 Hback  192 Hpol N
                 Vfront    3 Vsync   7 Vback   20 Vpol P
    Display Range Limits:
      Monitor ranges (GTF): 56-63 Hz V, 30-90 kHz H, max dotclock 100 MHz
    Display Product Name: 'ELSW3917BF'
Checksum: 0xd9

----------------

Warnings:

Block 0, Base EDID:
  Detailed Timing Descriptor #1: DTD is similar but not identical to DMT 0x51.
  Detailed Timing Descriptor #2: Image size is 1365x768 mm, but based on the picture AR it should be 1280x768 mm.
EDID:
  Base EDID: Some timings are out of range of the Monitor Ranges:
    Vertical Freq: 59.790 - 70.082 Hz (Monitor: 56.000 - 63.000 Hz)
    Maximum Clock: 108.000 MHz (Monitor: 100.000 MHz)

Failures:

Block 0, Base EDID:
  Detailed Timing Descriptor #1: Mismatch of image size 1366x768 mm vs display size 860x470 mm.
  Detailed Timing Descriptor #2: Mismatch of image size 1365x768 mm vs display size 860x470 mm.
EDID:
  Extension Block 1 started with EDID header, ignoring Extension Blocks >= 1.
  Base EDID: The DTD max image size is 1366x768mm, which is larger than the display size 860.0x470.0mm.

EDID conformity: FAIL
