edid-decode (hex):

00 ff ff ff ff ff ff 00 09 d1 0e 79 45 54 00 00
23 12 01 03 80 30 1b 78 2e ee 95 a3 54 4c 99 26
0f 50 54 bf ef 80 81 c0 81 40 81 80 95 00 a9 40
b3 00 d1 c0 01 01 1a 36 80 a0 70 38 1f 40 30 20
35 00 e0 0e 11 00 00 1e 00 00 00 fd 00 37 55 1e
53 15 00 0a 20 20 20 20 20 20 00 00 00 fc 00 42
45 4e 51 20 45 32 34 30 30 48 44 0a 00 00 00 ff
00 58 38 38 30 30 33 31 31 30 31 39 0a 20 01 df

02 03 21 71 4c 10 05 04 13 03 12 07 16 01 14 15
1f 23 09 07 07 83 01 00 00 67 03 0c 00 10 00 38
2d 8c 0a d0 8a 20 e0 2d 10 10 3e 96 00 e0 0e 11
00 00 18 01 1d 00 72 51 d0 1e 20 6e 28 55 00 e0
0e 11 00 00 1e 01 1d 00 bc 52 d0 1e 20 b8 28 55
40 e0 0e 11 00 00 1e 8c 0a d0 90 20 40 31 20 0c
40 55 00 e0 0e 11 00 00 18 8c 0a a0 20 51 20 18
10 18 7e 23 00 e0 0e 11 00 00 98 00 00 00 00 44

00 ff ff ff ff ff ff 00 09 d1 0e 79 45 54 00 00
23 12 01 03 80 30 1b 78 2e ee 95 a3 54 4c 99 26
0f 50 54 bf ef 80 81 c0 81 40 81 80 95 00 a9 40
b3 00 d1 c0 01 01 1a 36 80 a0 70 38 1f 40 30 20
35 00 e0 0e 11 00 00 1e 00 00 00 fd 00 37 55 1e
53 15 00 0a 20 20 20 20 20 20 00 00 00 fc 00 42
45 4e 51 20 45 32 34 30 30 48 44 0a 00 00 00 ff
00 58 38 38 30 30 33 31 31 30 31 39 0a 20 01 df

02 03 21 71 4c 10 05 04 13 03 12 07 16 01 14 15
1f 23 09 07 07 83 01 00 00 67 03 0c 00 10 00 38
2d 8c 0a d0 8a 20 e0 2d 10 10 3e 96 00 e0 0e 11
00 00 18 01 1d 00 72 51 d0 1e 20 6e 28 55 00 e0
0e 11 00 00 1e 01 1d 00 bc 52 d0 1e 20 b8 28 55
40 e0 0e 11 00 00 1e 8c 0a d0 90 20 40 31 20 0c
40 55 00 e0 0e 11 00 00 18 8c 0a a0 20 51 20 18
10 18 7e 23 00 e0 0e 11 00 00 98 00 00 00 00 44

----------------

Block 0, Base EDID:
  EDID Structure Version & Revision: 1.3
  Vendor & Product Identification:
    Manufacturer: BNQ
    Model: 30990
    Serial Number: ...
    Made in: week 35 of 2008
  Basic Display Parameters & Features:
    Digital display
    Maximum image size: 48 cm x 27 cm
    Gamma: 2.20
    DPMS levels: Off
    RGB color display
    Default (sRGB) color space is primary color space
    First detailed timing is the preferred timing
  Color Characteristics:
    Red  : 0.6396, 0.3300
    Green: 0.2998, 0.5996
    Blue : 0.1503, 0.0595
    White: 0.3134, 0.3291
  Established Timings I & II:
    IBM     :   720x400    70.081663 Hz   9:5     31.467 kHz     28.320000 MHz
    DMT 0x04:   640x480    59.940476 Hz   4:3     31.469 kHz     25.175000 MHz
    Apple   :   640x480    66.666667 Hz   4:3     35.000 kHz     30.240000 MHz
    DMT 0x05:   640x480    72.808802 Hz   4:3     37.861 kHz     31.500000 MHz
    DMT 0x06:   640x480    75.000000 Hz   4:3     37.500 kHz     31.500000 MHz
    DMT 0x08:   800x600    56.250000 Hz   4:3     35.156 kHz     36.000000 MHz
    DMT 0x09:   800x600    60.316541 Hz   4:3     37.879 kHz     40.000000 MHz
    DMT 0x0a:   800x600    72.187572 Hz   4:3     48.077 kHz     50.000000 MHz
    DMT 0x0b:   800x600    75.000000 Hz   4:3     46.875 kHz     49.500000 MHz
    Apple   :   832x624    74.551266 Hz   4:3     49.726 kHz     57.284000 MHz
    DMT 0x10:  1024x768    60.003840 Hz   4:3     48.363 kHz     65.000000 MHz
    DMT 0x11:  1024x768    70.069359 Hz   4:3     56.476 kHz     75.000000 MHz
    DMT 0x12:  1024x768    75.028582 Hz   4:3     60.023 kHz     78.750000 MHz
    DMT 0x24:  1280x1024   75.024675 Hz   5:4     79.976 kHz    135.000000 MHz
    Apple   :  1152x870    75.061550 Hz 192:145   68.681 kHz    100.000000 MHz
  Standard Timings:
    DMT 0x55:  1280x720    60.000000 Hz  16:9     45.000 kHz     74.250000 MHz
    DMT 0x20:  1280x960    60.000000 Hz   4:3     60.000 kHz    108.000000 MHz
    DMT 0x23:  1280x1024   60.019740 Hz   5:4     63.981 kHz    108.000000 MHz
    DMT 0x2f:  1440x900    59.887445 Hz  16:10    55.935 kHz    106.500000 MHz
    DMT 0x33:  1600x1200   60.000000 Hz   4:3     75.000 kHz    162.000000 MHz
    DMT 0x3a:  1680x1050   59.954250 Hz  16:10    65.290 kHz    146.250000 MHz
    DMT 0x52:  1920x1080   60.000000 Hz  16:9     67.500 kHz    148.500000 MHz
  Detailed Timing Descriptors:
    DTD 1:  1920x1080   59.933878 Hz  16:9     66.587 kHz    138.500000 MHz (480 mm x 270 mm)
                 Hfront   48 Hsync  32 Hback   80 Hpol P
                 Vfront    3 Vsync   5 Vback   23 Vpol P
    Display Range Limits:
      Monitor ranges (GTF): 55-85 Hz V, 30-83 kHz H, max dotclock 210 MHz
    Display Product Name: 'BENQ E2400HD'
    Display Product Serial Number: ...
  Extension blocks: 1
Checksum: 0xdf

----------------

Block 1, CTA-861 Extension Block:
  Revision: 3
  Basic audio support
  Supports YCbCr 4:4:4
  Supports YCbCr 4:2:2
  Native DTDs: 1
  Video Data Block:
    VIC  16:  1920x1080   60.000000 Hz  16:9     67.500 kHz    148.500000 MHz
    VIC   5:  1920x1080i  60.000000 Hz  16:9     33.750 kHz     74.250000 MHz
    VIC   4:  1280x720    60.000000 Hz  16:9     45.000 kHz     74.250000 MHz
    VIC  19:  1280x720    50.000000 Hz  16:9     37.500 kHz     74.250000 MHz
    VIC   3:   720x480    59.940060 Hz  16:9     31.469 kHz     27.000000 MHz
    VIC  18:   720x576    50.000000 Hz  16:9     31.250 kHz     27.000000 MHz
    VIC   7:  1440x480i   59.940060 Hz  16:9     15.734 kHz     27.000000 MHz
    VIC  22:  1440x576i   50.000000 Hz  16:9     15.625 kHz     27.000000 MHz
    VIC   1:   640x480    59.940476 Hz   4:3     31.469 kHz     25.175000 MHz
    VIC  20:  1920x1080i  50.000000 Hz  16:9     28.125 kHz     74.250000 MHz
    VIC  21:  1440x576i   50.000000 Hz   4:3     15.625 kHz     27.000000 MHz
    VIC  31:  1920x1080   50.000000 Hz  16:9     56.250 kHz    148.500000 MHz
  Audio Data Block:
    Linear PCM:
      Max channels: 2
      Supported sample rates (kHz): 48 44.1 32
      Supported sample sizes (bits): 24 20 16
  Speaker Allocation Data Block:
    FL/FR - Front Left/Right
  Vendor-Specific Data Block (HDMI), OUI 00-0C-03:
    Source physical address: 1.0.0.0
    DC_36bit
    DC_30bit
    DC_Y444
    Maximum TMDS clock: 225 MHz
  Detailed Timing Descriptors:
    DTD 2:   720x480    59.940060 Hz   3:2     31.469 kHz     27.000000 MHz (480 mm x 270 mm)
                 Hfront   16 Hsync  62 Hback   60 Hpol N
                 Vfront    9 Vsync   6 Vback   30 Vpol N
    DTD 3:  1280x720    60.000000 Hz  16:9     45.000 kHz     74.250000 MHz (480 mm x 270 mm)
                 Hfront  110 Hsync  40 Hback  220 Hpol P
                 Vfront    5 Vsync   5 Vback   20 Vpol P
    DTD 4:  1280x720    50.000000 Hz  16:9     37.500 kHz     74.250000 MHz (480 mm x 270 mm)
                 Hfront  440 Hsync  40 Hback  220 Hpol P
                 Vfront    5 Vsync   5 Vback   20 Vpol P
    DTD 5:   720x576    50.000000 Hz   5:4     31.250 kHz     27.000000 MHz (480 mm x 270 mm)
                 Hfront   12 Hsync  64 Hback   68 Hpol N
                 Vfront    5 Vsync   5 Vback   39 Vpol N
    DTD 6:  1440x576i   50.000000 Hz   5:2     15.625 kHz     27.000000 MHz (480 mm x 270 mm)
                 Hfront   24 Hsync 126 Hback  138 Hpol N
                 Vfront    2 Vsync   3 Vback   19 Vpol N Vfront +0.5 Odd Field
                 Vfront    2 Vsync   3 Vback   19 Vpol N Vback  +0.5 Even Field
Checksum: 0x44  Unused space in Extension Block: 4 bytes

----------------

Warnings:

Block 0, Base EDID:
  Vendor & Product Identification: The serial number is one of the known dummy values, it should probably be set to 0.
Block 1, CTA-861 Extension Block:
  IT Video Formats are overscanned by default, but normally this should be underscanned.
  Video Data Block: VIC 16 and the first DTD are not identical. Is this intended?
  Detailed Timing Descriptor #2: Image size is 480x270 mm, but based on the picture AR it should be 405x270 mm.
  Detailed Timing Descriptor #5: Image size is 480x270 mm, but based on the picture AR it should be 337x270 mm.
  Detailed Timing Descriptor #6: Image size is 480x270 mm, but based on the picture AR it should be 480x192 mm.
  Display Product Serial Number is set, so the Serial Number in the Base EDID should be 0.
EDID:
  Base EDID: Some timings are out of range of the Monitor Ranges:
    Vertical Freq: 50.000 - 75.062 Hz (Monitor: 55.000 - 85.000 Hz)
    Horizontal Freq: 15.625 - 79.976 kHz (Monitor: 30.000 - 83.000 kHz)

Failures:

Block 0, Base EDID:
  Basic Display Parameters & Features: sRGB is signaled, but the chromaticities do not match.
Block 1, CTA-861 Extension Block:
  Missing VCDB, needed for Set Selectable RGB Quantization to avoid interop issues.
EDID:
  Extension Block 2 started with EDID header, ignoring Extension Blocks >= 2.

EDID conformity: FAIL
