edid-decode (hex):

00 ff ff ff ff ff ff 00 63 25 00 27 00 00 00 00
2c 20 01 04 b5 3c 21 78 3b dc 5b a3 54 4c 99 26
0f 47 49 af cf 00 81 80 61 7c 81 bc 95 00 95 3c
b3 00 b3 3c 01 01 02 3a 80 18 71 38 2d 40 58 2c
45 00 55 50 21 00 00 1e 00 00 00 ff 00 30 30 30
30 30 30 30 30 30 30 30 30 31 00 00 00 fc 00 4e
32 34 30 38 48 5a 0a 20 20 20 20 20 00 00 00 fd
00 30 a5 de de 30 01 0a 20 20 20 20 20 20 01 d1

02 03 14 f1 47 01 03 04 05 10 1f 3f 23 09 07 07
83 01 00 00 5e 7f 80 78 70 38 1e 40 18 20 35 00
55 50 21 00 00 1e 87 74 80 18 71 38 32 40 30 20
35 00 55 50 21 00 00 1e d7 94 80 8c 70 38 29 40
30 2c 35 00 55 50 21 00 00 1e 5e a2 80 8c 70 38
29 40 30 2c 35 00 55 50 21 00 00 1e b5 b0 80 8c
70 38 12 40 30 2c 35 00 55 50 21 00 00 1e 00 00
00 00 00 00 00 00 00 00 00 00 00 00 00 00 00 c4

00 ff ff ff ff ff ff 00 63 25 00 27 00 00 00 00
2c 20 01 04 b5 3c 21 78 3b dc 5b a3 54 4c 99 26
0f 47 49 af cf 00 81 80 61 7c 81 bc 95 00 95 3c
b3 00 b3 3c 01 01 02 3a 80 18 71 38 2d 40 58 2c
45 00 55 50 21 00 00 1e 00 00 00 ff 00 30 30 30
30 30 30 30 30 30 30 30 30 31 00 00 00 fc 00 4e
32 34 30 38 48 5a 0a 20 20 20 20 20 00 00 00 fd
00 30 a5 de de 30 01 0a 20 20 20 20 20 20 01 d1

02 03 14 f1 47 01 03 04 05 10 1f 3f 23 09 07 07
83 01 00 00 5e 7f 80 78 70 38 1e 40 18 20 35 00
55 50 21 00 00 1e 87 74 80 18 71 38 32 40 30 20
35 00 55 50 21 00 00 1e d7 94 80 8c 70 38 29 40
30 2c 35 00 55 50 21 00 00 1e 5e a2 80 8c 70 38
29 40 30 2c 35 00 55 50 21 00 00 1e b5 b0 80 8c
70 38 12 40 30 2c 35 00 55 50 21 00 00 1e 00 00
00 00 00 00 00 00 00 00 00 00 00 00 00 00 00 c4

----------------

Block 0, Base EDID:
  EDID Structure Version & Revision: 1.4
  Vendor & Product Identification:
    Manufacturer: XYE
    Model: 9984
    Made in: week 44 of 2022
  Basic Display Parameters & Features:
    Digital display
    Bits per primary color channel: 10
    DisplayPort interface
    Maximum image size: 60 cm x 33 cm
    Gamma: 2.20
    DPMS levels: Off
    Supported color formats: RGB 4:4:4, YCrCb 4:4:4, YCrCb 4:2:2
    First detailed timing includes the native pixel format and preferred refresh rate
    Display supports continuous frequencies
  Color Characteristics:
    Red  : 0.6396, 0.3291
    Green: 0.2998, 0.5976
    Blue : 0.1494, 0.0595
    White: 0.2792, 0.2880
  Established Timings I & II:
    IBM     :   720x400    70.081663 Hz   9:5     31.467 kHz     28.320000 MHz
    DMT 0x04:   640x480    59.940476 Hz   4:3     31.469 kHz     25.175000 MHz
    DMT 0x05:   640x480    72.808802 Hz   4:3     37.861 kHz     31.500000 MHz
    DMT 0x06:   640x480    75.000000 Hz   4:3     37.500 kHz     31.500000 MHz
    DMT 0x08:   800x600    56.250000 Hz   4:3     35.156 kHz     36.000000 MHz
    DMT 0x09:   800x600    60.316541 Hz   4:3     37.879 kHz     40.000000 MHz
    DMT 0x0a:   800x600    72.187572 Hz   4:3     48.077 kHz     50.000000 MHz
    DMT 0x0b:   800x600    75.000000 Hz   4:3     46.875 kHz     49.500000 MHz
    DMT 0x10:  1024x768    60.003840 Hz   4:3     48.363 kHz     65.000000 MHz
    DMT 0x11:  1024x768    70.069359 Hz   4:3     56.476 kHz     75.000000 MHz
    DMT 0x12:  1024x768    75.028582 Hz   4:3     60.023 kHz     78.750000 MHz
    DMT 0x24:  1280x1024   75.024675 Hz   5:4     79.976 kHz    135.000000 MHz
  Standard Timings:
    DMT 0x23:  1280x1024   60.019740 Hz   5:4     63.981 kHz    108.000000 MHz
    GTF     :  1024x768   119.999931 Hz   4:3     98.760 kHz    139.054000 MHz
    GTF     :  1280x1024  120.000185 Hz   5:4    131.640 kHz    233.793000 MHz
    DMT 0x2f:  1440x900    59.887445 Hz  16:10    55.935 kHz    106.500000 MHz
    GTF     :  1440x900   119.999896 Hz  16:10   115.800 kHz    229.747000 MHz
    DMT 0x3a:  1680x1050   59.954250 Hz  16:10    65.290 kHz    146.250000 MHz
    GTF     :  1680x1050  120.000000 Hz  16:10   135.000 kHz    313.200000 MHz
  Detailed Timing Descriptors:
    DTD 1:  1920x1080   60.000000 Hz  16:9     67.500 kHz    148.500000 MHz (597 mm x 336 mm)
                 Hfront   88 Hsync  44 Hback  148 Hpol P
                 Vfront    4 Vsync   5 Vback   36 Vpol P
    Display Product Serial Number: ...
    Display Product Name: 'N2408HZ'
    Display Range Limits:
      Monitor ranges (Range Limits Only): 48-165 Hz V, 222-222 kHz H, max dotclock 480 MHz
  Extension blocks: 1
Checksum: 0xd1

----------------

Block 1, CTA-861 Extension Block:
  Revision: 3
  Underscans IT Video Formats by default
  Basic audio support
  Supports YCbCr 4:4:4
  Supports YCbCr 4:2:2
  Native DTDs: 1
  Video Data Block:
    VIC   1:   640x480    59.940476 Hz   4:3     31.469 kHz     25.175000 MHz
    VIC   3:   720x480    59.940060 Hz  16:9     31.469 kHz     27.000000 MHz
    VIC   4:  1280x720    60.000000 Hz  16:9     45.000 kHz     74.250000 MHz
    VIC   5:  1920x1080i  60.000000 Hz  16:9     33.750 kHz     74.250000 MHz
    VIC  16:  1920x1080   60.000000 Hz  16:9     67.500 kHz    148.500000 MHz
    VIC  31:  1920x1080   50.000000 Hz  16:9     56.250 kHz    148.500000 MHz
    VIC  63:  1920x1080  120.000000 Hz  16:9    135.000 kHz    297.000000 MHz
  Audio Data Block:
    Linear PCM:
      Max channels: 2
      Supported sample rates (kHz): 48 44.1 32
      Supported sample sizes (bits): 24 20 16
  Speaker Allocation Data Block:
    FL/FR - Front Left/Right
  Detailed Timing Descriptors:
    DTD 2:  1920x1080  143.993994 Hz  16:9    159.833 kHz    326.060000 MHz (597 mm x 336 mm)
                 Hfront   24 Hsync  32 Hback   64 Hpol P
                 Vfront    3 Vsync   5 Vback   22 Vpol P
    DTD 3:  1920x1080  119.995977 Hz  16:9    135.595 kHz    298.310000 MHz (597 mm x 336 mm)
                 Hfront   48 Hsync  32 Hback  200 Hpol P
                 Vfront    3 Vsync   5 Vback   42 Vpol P
    DTD 4:  1920x1080  165.000909 Hz  16:9    184.966 kHz    381.030000 MHz (597 mm x 336 mm)
                 Hfront   48 Hsync  44 Hback   48 Hpol P
                 Vfront    3 Vsync   5 Vback   33 Vpol P
    DTD 5:  1920x1080  179.997055 Hz  16:9    201.777 kHz    415.660000 MHz (597 mm x 336 mm)
                 Hfront   48 Hsync  44 Hback   48 Hpol P
                 Vfront    3 Vsync   5 Vback   33 Vpol P
    DTD 6:  1920x1080  199.997347 Hz  16:9    219.597 kHz    452.370000 MHz (597 mm x 336 mm)
                 Hfront   48 Hsync  44 Hback   48 Hpol P
                 Vfront    3 Vsync   5 Vback   10 Vpol P
Checksum: 0xc4  Unused space in Extension Block: 17 bytes

----------------

Warnings:

Block 0, Base EDID:
  Display Product Serial Number: ...
Block 1, CTA-861 Extension Block:
  Video Data Block: VIC 1 and the first DTD are not identical. Is this intended?
  Video Data Block: All VICs are in ascending order, and the first (preferred) VIC <= 4, is that intended?
  Add a Colorimetry Data Block with the sRGB colorimetry bit set to avoid interop issues.
EDID:
  Base EDID: Some timings are out of range of the Monitor Ranges:
    Vertical Freq: 50.000 - 199.997 Hz (Monitor: 48.000 - 165.000 Hz)
    Horizontal Freq: 31.466 - 219.597 kHz (Monitor: 222.000 - 222.000 kHz)

Failures:

Block 1, CTA-861 Extension Block:
  Missing VCDB, needed for Set Selectable RGB Quantization to avoid interop issues.
EDID:
  Extension Block 2 started with EDID header, ignoring Extension Blocks >= 2.

EDID conformity: FAIL
