edid-decode (hex):

00 ff ff ff ff ff ff 00 36 69 d1 3d 00 00 00 00
02 22 01 04 b5 4f 23 78 3b 6a 35 ab 50 45 a7 27
0e 50 54 a5 cb 00 81 a8 81 80 95 00 b3 00 95 28
d1 c0 b3 28 d1 e8 f5 7c 70 a0 d0 a0 29 50 30 20
35 00 1d 4e 31 00 00 1a 00 00 00 ff 00 44 44 31
48 30 31 34 32 30 30 37 36 30 00 00 00 fd 00 30
b4 ff ff 61 01 0a 20 20 20 20 20 20 00 00 00 fc
00 4d 53 49 20 4d 41 47 33 34 35 43 51 52 02 61

02 03 21 f4 46 90 13 02 12 04 3f 23 09 07 07 83
01 00 00 e6 06 07 01 57 4f 00 e2 00 e7 e3 05 c0
00 44 d0 70 a0 d0 a0 29 50 30 20 35 00 1d 4e 31
00 00 1e c4 68 70 a0 d0 a0 32 50 30 20 35 00 1d
4e 31 00 00 1a 6a 5e 00 a0 a0 a0 29 50 30 20 35
00 1d 4e 31 00 00 1e 98 e2 00 a0 a0 a0 29 50 30
20 35 00 1d 4e 31 00 00 1e 42 41 b8 a0 60 a0 29
50 30 20 35 00 1d 4e 31 00 00 1e 00 00 00 00 23

70 12 79 00 00 03 01 50 e6 2b 01 04 6f 0d 9f 00
2f 00 1f 00 9f 05 28 00 02 80 04 00 e3 77 01 04
6f 0d 9f 00 2f 00 1f 00 9f 05 2c 00 02 00 04 00
ea f9 00 04 6f 0d 9f 00 2f 00 1f 00 9f 05 28 00
02 00 04 00 55 58 01 04 6f 0d 9f 00 2f 00 1f 00
9f 05 2b 00 02 00 04 00 07 00 0a 08 81 00 08 04
00 04 02 10 00 03 01 14 d3 bc 00 04 ff 09 9f 00
2f 00 1f 00 9f 05 28 00 02 00 04 00 00 00 72 90

00 ff ff ff ff ff ff 00 36 69 d1 3d 00 00 00 00
02 22 01 04 b5 4f 23 78 3b 6a 35 ab 50 45 a7 27
0e 50 54 a5 cb 00 81 a8 81 80 95 00 b3 00 95 28
d1 c0 b3 28 d1 e8 f5 7c 70 a0 d0 a0 29 50 30 20
35 00 1d 4e 31 00 00 1a 00 00 00 ff 00 44 44 31
48 30 31 34 32 30 30 37 36 30 00 00 00 fd 00 30
b4 ff ff 61 01 0a 20 20 20 20 20 20 00 00 00 fc
00 4d 53 49 20 4d 41 47 33 34 35 43 51 52 02 61

02 03 21 f4 46 90 13 02 12 04 3f 23 09 07 07 83
01 00 00 e6 06 07 01 57 4f 00 e2 00 e7 e3 05 c0
00 44 d0 70 a0 d0 a0 29 50 30 20 35 00 1d 4e 31
00 00 1e c4 68 70 a0 d0 a0 32 50 30 20 35 00 1d
4e 31 00 00 1a 6a 5e 00 a0 a0 a0 29 50 30 20 35
00 1d 4e 31 00 00 1e 98 e2 00 a0 a0 a0 29 50 30
20 35 00 1d 4e 31 00 00 1e 42 41 b8 a0 60 a0 29
50 30 20 35 00 1d 4e 31 00 00 1e 00 00 00 00 23

70 12 79 00 00 03 01 50 e6 2b 01 04 6f 0d 9f 00
2f 00 1f 00 9f 05 28 00 02 80 04 00 e3 77 01 04
6f 0d 9f 00 2f 00 1f 00 9f 05 2c 00 02 00 04 00
ea f9 00 04 6f 0d 9f 00 2f 00 1f 00 9f 05 28 00
02 00 04 00 55 58 01 04 6f 0d 9f 00 2f 00 1f 00
9f 05 2b 00 02 00 04 00 07 00 0a 08 81 00 08 04
00 04 02 10 00 03 01 14 d3 bc 00 04 ff 09 9f 00
2f 00 1f 00 9f 05 28 00 02 00 04 00 00 00 72 90

----------------

Block 0, Base EDID:
  EDID Structure Version & Revision: 1.4
  Vendor & Product Identification:
    Manufacturer: MSI
    Model: 15825
    Made in: week 2 of 2024
  Basic Display Parameters & Features:
    Digital display
    Bits per primary color channel: 10
    DisplayPort interface
    Maximum image size: 79 cm x 35 cm
    Gamma: 2.20
    DPMS levels: Off
    Supported color formats: RGB 4:4:4, YCrCb 4:4:4, YCrCb 4:2:2
    First detailed timing includes the native pixel format and preferred refresh rate
    Display supports continuous frequencies
  Color Characteristics:
    Red  : 0.6689, 0.3144
    Green: 0.2714, 0.6542
    Blue : 0.1523, 0.0576
    White: 0.3134, 0.3291
  Established Timings I & II:
    IBM     :   720x400    70.081663 Hz   9:5     31.467 kHz     28.320000 MHz
    DMT 0x04:   640x480    59.940476 Hz   4:3     31.469 kHz     25.175000 MHz
    DMT 0x06:   640x480    75.000000 Hz   4:3     37.500 kHz     31.500000 MHz
    DMT 0x09:   800x600    60.316541 Hz   4:3     37.879 kHz     40.000000 MHz
    DMT 0x0a:   800x600    72.187572 Hz   4:3     48.077 kHz     50.000000 MHz
    DMT 0x0b:   800x600    75.000000 Hz   4:3     46.875 kHz     49.500000 MHz
    DMT 0x10:  1024x768    60.003840 Hz   4:3     48.363 kHz     65.000000 MHz
    DMT 0x12:  1024x768    75.028582 Hz   4:3     60.023 kHz     78.750000 MHz
    DMT 0x24:  1280x1024   75.024675 Hz   5:4     79.976 kHz    135.000000 MHz
  Standard Timings:
    GTF     :  1280x1024  100.000000 Hz   5:4    108.500 kHz    190.960000 MHz
    DMT 0x23:  1280x1024   60.019740 Hz   5:4     63.981 kHz    108.000000 MHz
    DMT 0x2f:  1440x900    59.887445 Hz  16:10    55.935 kHz    106.500000 MHz
    DMT 0x3a:  1680x1050   59.954250 Hz  16:10    65.290 kHz    146.250000 MHz
    GTF     :  1440x900    99.999787 Hz  16:10    95.300 kHz    187.550000 MHz
    DMT 0x52:  1920x1080   60.000000 Hz  16:9     67.500 kHz    148.500000 MHz
    GTF     :  1680x1050  100.000078 Hz  16:10   111.200 kHz    256.205000 MHz
    GTF     :  1920x1080  100.000000 Hz  16:9    114.400 kHz    302.016000 MHz
  Detailed Timing Descriptors:
    DTD 1:  3440x1440   59.998875 Hz  43:18    88.858 kHz    319.890000 MHz (797 mm x 334 mm)
                 Hfront   48 Hsync  32 Hback   80 Hpol P
                 Vfront    3 Vsync   5 Vback   33 Vpol N
    Display Product Serial Number: ...
    Display Range Limits:
      Monitor ranges (Range Limits Only): 48-180 Hz V, 255-255 kHz H, max dotclock 970 MHz
    Display Product Name: 'MSI MAG345CQR'
  Extension blocks: 2
Checksum: 0x61

----------------

Block 1, CTA-861 Extension Block:
  Revision: 3
  Underscans IT Video Formats by default
  Basic audio support
  Supports YCbCr 4:4:4
  Supports YCbCr 4:2:2
  Native DTDs: 4
  Video Data Block:
    VIC  16:  1920x1080   60.000000 Hz  16:9     67.500 kHz    148.500000 MHz (native)
    VIC  19:  1280x720    50.000000 Hz  16:9     37.500 kHz     74.250000 MHz
    VIC   2:   720x480    59.940060 Hz   4:3     31.469 kHz     27.000000 MHz
    VIC  18:   720x576    50.000000 Hz  16:9     31.250 kHz     27.000000 MHz
    VIC   4:  1280x720    60.000000 Hz  16:9     45.000 kHz     74.250000 MHz
    VIC  63:  1920x1080  120.000000 Hz  16:9    135.000 kHz    297.000000 MHz
  Audio Data Block:
    Linear PCM:
      Max channels: 2
      Supported sample rates (kHz): 48 44.1 32
      Supported sample sizes (bits): 24 20 16
  Speaker Allocation Data Block:
    FL/FR - Front Left/Right
  HDR Static Metadata Data Block:
    Electro optical transfer functions:
      Traditional gamma - SDR luminance range
      Traditional gamma - HDR luminance range
      SMPTE ST2084
    Supported static metadata descriptors:
      Static metadata type 1
    Desired content max luminance: 87 (329.151 cd/m^2)
    Desired content max frame-average luminance: 79 (276.782 cd/m^2)
    Desired content min luminance: 0 (0.000 cd/m^2)
  Video Capability Data Block:
    YCbCr quantization: Selectable (via AVI YQ)
    RGB quantization: Selectable (via AVI Q)
    PT scan behavior: Always Underscanned
    IT scan behavior: Always Overscanned
    CE scan behavior: Supports both over- and underscan
  Colorimetry Data Block:
    BT2020YCC
    BT2020RGB
  Detailed Timing Descriptors:
    DTD 2:  3440x1440  100.000000 Hz  43:18   148.100 kHz    533.160000 MHz (797 mm x 334 mm)
                 Hfront   48 Hsync  32 Hback   80 Hpol P
                 Vfront    3 Vsync   5 Vback   33 Vpol P
    DTD 3:  3440x1440   50.000000 Hz  43:18    74.500 kHz    268.200000 MHz (797 mm x 334 mm)
                 Hfront   48 Hsync  32 Hback   80 Hpol P
                 Vfront    3 Vsync   5 Vback   42 Vpol N
    DTD 4:  2560x1440   60.000199 Hz  16:9     88.860 kHz    241.700000 MHz (797 mm x 334 mm)
                 Hfront   48 Hsync  32 Hback   80 Hpol P
                 Vfront    3 Vsync   5 Vback   33 Vpol P
    DTD 5:  2560x1440  144.000477 Hz  16:9    213.265 kHz    580.080000 MHz (797 mm x 334 mm)
                 Hfront   48 Hsync  32 Hback   80 Hpol P
                 Vfront    3 Vsync   5 Vback   33 Vpol P
    DTD 6:  1720x1440   60.001149 Hz  43:36    88.862 kHz    167.060000 MHz (797 mm x 334 mm)
                 Hfront   48 Hsync  32 Hback   80 Hpol P
                 Vfront    3 Vsync   5 Vback   33 Vpol P
Checksum: 0x23  Unused space in Extension Block: 4 bytes

----------------

Block 2, DisplayID Extension Block:
  Version: 1.2
  Extension Count: 0
  Display Product Type: Extension Section
  Video Timing Modes Type 1 - Detailed Timings Data Block:
    DTD:  3440x1440  143.999925 Hz  16:9    213.264 kHz    767.750000 MHz (aspect 16:9, no 3D stereo)
               Hfront   48 Hsync  32 Hback   80 Hpol N
               Vfront    3 Vsync   5 Vback   33 Vpol P
    DTD:  3440x1440  180.000000 Hz  16:9    267.300 kHz    962.280000 MHz (aspect 16:9, no 3D stereo)
               Hfront   48 Hsync  32 Hback   80 Hpol N
               Vfront    3 Vsync   5 Vback   37 Vpol N
    DTD:  3440x1440  119.999625 Hz  16:9    177.719 kHz    639.790000 MHz (aspect 16:9, no 3D stereo)
               Hfront   48 Hsync  32 Hback   80 Hpol N
               Vfront    3 Vsync   5 Vback   33 Vpol N
    DTD:  3440x1440  165.000749 Hz  16:9    244.861 kHz    881.500000 MHz (aspect 16:9, no 3D stereo)
               Hfront   48 Hsync  32 Hback   80 Hpol N
               Vfront    3 Vsync   5 Vback   36 Vpol N
  Supported Timing Modes Type 1 - VESA DMT Timings Data Block:
    DMT 0x04:   640x480    59.940476 Hz   4:3     31.469 kHz     25.175000 MHz
    DMT 0x09:   800x600    60.316541 Hz   4:3     37.879 kHz     40.000000 MHz
    DMT 0x10:  1024x768    60.003840 Hz   4:3     48.363 kHz     65.000000 MHz
    DMT 0x1c:  1280x800    59.810326 Hz  16:10    49.702 kHz     83.500000 MHz
    DMT 0x23:  1280x1024   60.019740 Hz   5:4     63.981 kHz    108.000000 MHz
    DMT 0x33:  1600x1200   60.000000 Hz   4:3     75.000 kHz    162.000000 MHz
    DMT 0x3a:  1680x1050   59.954250 Hz  16:10    65.290 kHz    146.250000 MHz
    DMT 0x45:  1920x1200   59.884600 Hz  16:10    74.556 kHz    193.250000 MHz
  Video Timing Modes Type 1 - Detailed Timings Data Block:
    DTD:  2560x1440  120.000397 Hz  16:9    177.721 kHz    483.400000 MHz (aspect 16:9, no 3D stereo)
               Hfront   48 Hsync  32 Hback   80 Hpol N
               Vfront    3 Vsync   5 Vback   33 Vpol N
  Checksum: 0x72
Checksum: 0x90

----------------

Warnings:

Block 1, CTA-861 Extension Block:
  Video Data Block: VIC 16 and the first DTD are not identical. Is this intended?
  Video Capability Data Block: IT scan behavior is expected to support underscanned.
  Colorimetry Data Block: Set the sRGB colorimetry bit to avoid interop issues.
  Detailed Timing Descriptor #4: Image size is 797x334 mm, but based on the picture AR it should be 593x334 mm.
  Detailed Timing Descriptor #5: Image size is 797x334 mm, but based on the picture AR it should be 593x334 mm.
  Detailed Timing Descriptor #6: Image size is 797x334 mm, but based on the picture AR it should be 398x334 mm.
EDID:
  Base EDID: Some timings are out of range of the Monitor Ranges:
    Horizontal Freq: 31.250 - 267.300 kHz (Monitor: 255.000 - 255.000 kHz)

Failures:

Block 1, CTA-861 Extension Block:
  Video Capability Data Block: IT video formats are always overscanned, but bit 7 of Byte 3 of the CTA-861 Extension header is set to underscanned.
Block 2, DisplayID Extension Block:
  DisplayID Base Block has no product type.
EDID:
  Extension Block 3 started with EDID header, ignoring Extension Blocks >= 3.
  CTA-861: Native progressive timings are a mix of several resolutions.
  DisplayID: DisplayID expects at least one preferred timing.

EDID conformity: FAIL
