edid-decode (hex):

00 ff ff ff ff ff ff 00 21 ee 10 00 01 00 00 00
30 17 01 03 80 00 00 78 8f 00 13 a0 57 49 9b 26
10 48 4e af ce 00 81 00 81 c0 81 80 81 40 95 00
71 40 81 c0 a9 01 2f 26 40 a0 60 84 1a 30 30 20
35 00 00 00 00 00 00 06 9a 29 a0 d0 51 84 22 30
50 98 36 00 00 00 00 00 00 1a 34 21 50 b0 51 00
1b 30 40 70 36 00 20 56 00 00 00 1a 00 00 00 fc
00 53 4b 55 20 36 36 34 34 38 0a 20 20 20 00 bc

00 ff ff ff ff ff ff 00 21 ee 10 00 01 00 00 00
30 17 01 03 80 00 00 78 8f 00 13 a0 57 49 9b 26
10 48 4e af ce 00 81 00 81 c0 81 80 81 40 95 00
71 40 81 c0 a9 01 2f 26 40 a0 60 84 1a 30 30 20
35 00 00 00 00 00 00 06 9a 29 a0 d0 51 84 22 30
50 98 36 00 00 00 00 00 00 1a 34 21 50 b0 51 00
1b 30 40 70 36 00 20 56 00 00 00 1a 00 00 00 fc
00 53 4b 55 20 36 36 34 34 38 0a 20 20 20 00 bc

----------------

Block 0, Base EDID:
  EDID Structure Version & Revision: 1.3
  Vendor & Product Identification:
    Manufacturer: HON
    Model: 16
    Serial Number: ...
    Made in: week 48 of 2013
  Basic Display Parameters & Features:
    Digital display
    Image size is variable
    Gamma: 2.20
    DPMS levels: Standby
    RGB color display
    Default (sRGB) color space is primary color space
    First detailed timing is the preferred timing
    Supports GTF timings within operating range
  Color Characteristics:
    Red  : 0.6250, 0.3398
    Green: 0.2851, 0.6054
    Blue : 0.1484, 0.0634
    White: 0.2812, 0.3076
  Established Timings I & II:
    IBM     :   720x400    70.081663 Hz   9:5     31.467 kHz     28.320000 MHz
    DMT 0x04:   640x480    59.940476 Hz   4:3     31.469 kHz     25.175000 MHz
    DMT 0x05:   640x480    72.808802 Hz   4:3     37.861 kHz     31.500000 MHz
    DMT 0x06:   640x480    75.000000 Hz   4:3     37.500 kHz     31.500000 MHz
    DMT 0x08:   800x600    56.250000 Hz   4:3     35.156 kHz     36.000000 MHz
    DMT 0x09:   800x600    60.316541 Hz   4:3     37.879 kHz     40.000000 MHz
    DMT 0x0a:   800x600    72.187572 Hz   4:3     48.077 kHz     50.000000 MHz
    DMT 0x0b:   800x600    75.000000 Hz   4:3     46.875 kHz     49.500000 MHz
    DMT 0x10:  1024x768    60.003840 Hz   4:3     48.363 kHz     65.000000 MHz
    DMT 0x11:  1024x768    70.069359 Hz   4:3     56.476 kHz     75.000000 MHz
    DMT 0x12:  1024x768    75.028582 Hz   4:3     60.023 kHz     78.750000 MHz
  Standard Timings:
    DMT 0x1c:  1280x800    59.810326 Hz  16:10    49.702 kHz     83.500000 MHz
    DMT 0x55:  1280x720    60.000000 Hz  16:9     45.000 kHz     74.250000 MHz
    DMT 0x23:  1280x1024   60.019740 Hz   5:4     63.981 kHz    108.000000 MHz
    DMT 0x20:  1280x960    60.000000 Hz   4:3     60.000 kHz    108.000000 MHz
    DMT 0x2f:  1440x900    59.887445 Hz  16:10    55.935 kHz    106.500000 MHz
    GTF     :  1152x864    60.000000 Hz   4:3     53.700 kHz     81.624000 MHz
    DMT 0x55:  1280x720    60.000000 Hz  16:9     45.000 kHz     74.250000 MHz
    GTF     :  1600x1000   60.999899 Hz  16:10    63.196 kHz    135.492000 MHz
  Detailed Timing Descriptors:
    DTD 1:  1600x900    59.978156 Hz  16:9     55.540 kHz     97.750000 MHz (analog composite, serrate)
                 Hfront   48 Hsync  32 Hback   80 Hpol N
                 Vfront    3 Vsync   5 Vback   18 Vpol N
    DTD 2:  1440x900    59.887445 Hz  16:10    55.935 kHz    106.500000 MHz
                 Hfront   80 Hsync 152 Hback  232 Hpol P
                 Vfront    3 Vsync   6 Vback   25 Vpol N
    DTD 3:  1360x768    59.664196 Hz  85:48    47.433 kHz     85.000000 MHz (32 mm x 86 mm)
                 Hfront   64 Hsync 112 Hback  256 Hpol P
                 Vfront    3 Vsync   6 Vback   18 Vpol N
    Display Product Name: 'SKU 66448'
Checksum: 0xbc

----------------

Warnings:

Block 0, Base EDID:
  Vendor & Product Identification: The serial number is one of the known dummy values, it should probably be set to 0.
  Detailed Timing Descriptor #2: DTD is similar but not identical to DMT 0x2f.
  Detailed Timing Descriptor #3: Dubious image size (32x86 mm is smaller than 100x100 mm).

Failures:

Block 0, Base EDID:
  Basic Display Parameters & Features: sRGB is signaled, but the chromaticities do not match.
  Missing Display Range Limits Descriptor.
EDID:
  Extension Block 1 started with EDID header, ignoring Extension Blocks >= 1.
  Base EDID: The DTD max image size is 32x86mm, but the display size is not specified anywhere.

EDID conformity: FAIL
