edid-decode (hex):

00 ff ff ff ff ff ff 00 25 cc 03 00 00 00 00 00
00 13 01 03 80 16 0c 78 0a 40 85 93 59 56 93 27
1b 50 54 00 00 00 01 01 01 01 01 01 01 01 01 01
01 01 01 01 01 01 20 12 00 bc 40 58 26 20 30 20
36 00 de 7d 00 00 00 18 00 00 00 00 00 00 00 00
00 00 00 00 00 00 00 00 00 00 00 00 00 fe 00 49
4e 4c 20 20 20 20 20 20 20 20 20 20 00 00 00 00
00 42 54 31 30 31 49 57 30 31 56 30 20 20 00 72

----------------

Block 0, Base EDID:
  EDID Structure Version & Revision: 1.3
  Vendor & Product Identification:
    Manufacturer: INL
    Model: 3
    Made in: 2009
  Basic Display Parameters & Features:
    Digital display
    Maximum image size: 22 cm x 12 cm
    Gamma: 2.20
    RGB color display
    First detailed timing is the preferred timing
  Color Characteristics:
    Red  : 0.5751, 0.3476
    Green: 0.3359, 0.5742
    Blue : 0.1542, 0.1054
    White: 0.3134, 0.3291
  Established Timings I & II: none
  Standard Timings: none
  Detailed Timing Descriptors:
    DTD 1:  1024x600    60.006001 Hz 128:75    38.284 kHz     46.400000 MHz (222 mm x 125 mm)
                 Hfront   48 Hsync  32 Hback  108 Hpol N
                 Vfront    3 Vsync   6 Vback   29 Vpol N
    Empty Descriptor
    Alphanumeric Data String: 'INL          '
    Manufacturer-Specified Display Descriptor (0x00): 00 00 00 42 54 31 30 31 49 57 30 31 56 30 20 20 '...BT101IW01V0  '
Checksum: 0x72

----------------

Failures:

Block 0, Base EDID:
  Empty Descriptor: Use Dummy Descriptor instead of all zeroes.
  Alphanumeric Data String: No newline, but one or more trailing spaces.
  Missing Display Product Name.
  Missing Display Range Limits Descriptor.

EDID conformity: FAIL
