edid-decode (hex):

00 ff ff ff ff ff ff 00 49 a7 8d 0a 00 00 00 00
0c 21 01 04 b5 3c 22 78 3b a7 e5 b1 4c 36 bb 26
0b 50 54 a5 4b 00 d1 c0 81 80 71 4f a9 c0 b3 00
b3 3c d1 fc 95 00 08 e8 00 30 f2 70 5a 80 b0 58
4a 00 55 4f 21 00 00 1a 00 00 00 fd 00 3c a0 ff
ff 95 01 0a 20 20 20 20 20 20 00 00 00 fc 00 47
4d 30 30 31 4a 00 20 20 20 20 20 20 00 00 00 ff
00 4c 31 33 32 32 32 30 31 34 33 00 00 00 02 8b

02 03 34 f1 23 09 07 07 83 01 00 00 4b 90 04 03
01 12 13 1f 3f 61 76 5f e2 00 7f e3 05 c2 00 e6
06 07 01 8b 89 21 6d 1a 00 00 02 01 3c a0 00 00
73 21 73 21 70 c2 00 a0 a0 a0 55 50 30 20 35 00
58 4a 21 00 00 1a 38 61 00 a0 a0 a0 55 50 30 20
34 00 58 4a 21 00 00 1a 00 00 00 00 00 00 00 00
00 00 00 00 00 00 00 00 00 00 00 00 00 00 00 00
00 00 00 00 00 00 00 00 00 00 00 00 00 00 00 22

70 12 79 03 00 03 01 28 4a 0b 02 04 ff 0e 67 01
2f 80 1f 00 6f 08 36 00 02 00 04 00 3f 22 02 04
ff 0e 9f 00 2f 80 1f 00 6f 08 18 00 02 00 04 00
00 00 00 00 00 00 00 00 00 00 00 00 00 00 00 00
00 00 00 00 00 00 00 00 00 00 00 00 00 00 00 00
00 00 00 00 00 00 00 00 00 00 00 00 00 00 00 00
00 00 00 00 00 00 00 00 00 00 00 00 00 00 00 00
00 00 00 00 00 00 00 00 00 00 00 00 00 00 7f 90

00 ff ff ff ff ff ff 00 49 a7 8d 0a 00 00 00 00
0c 21 01 04 b5 3c 22 78 3b a7 e5 b1 4c 36 bb 26
0b 50 54 a5 4b 00 d1 c0 81 80 71 4f a9 c0 b3 00
b3 3c d1 fc 95 00 08 e8 00 30 f2 70 5a 80 b0 58
4a 00 55 4f 21 00 00 1a 00 00 00 fd 00 3c a0 ff
ff 95 01 0a 20 20 20 20 20 20 00 00 00 fc 00 47
4d 30 30 31 4a 00 20 20 20 20 20 20 00 00 00 ff
00 4c 31 33 32 32 32 30 31 34 33 00 00 00 02 8b

02 03 34 f1 23 09 07 07 83 01 00 00 4b 90 04 03
01 12 13 1f 3f 61 76 5f e2 00 7f e3 05 c2 00 e6
06 07 01 8b 89 21 6d 1a 00 00 02 01 3c a0 00 00
73 21 73 21 70 c2 00 a0 a0 a0 55 50 30 20 35 00
58 4a 21 00 00 1a 38 61 00 a0 a0 a0 55 50 30 20
34 00 58 4a 21 00 00 1a 00 00 00 00 00 00 00 00
00 00 00 00 00 00 00 00 00 00 00 00 00 00 00 00
00 00 00 00 00 00 00 00 00 00 00 00 00 00 00 22

70 12 79 03 00 03 01 28 4a 0b 02 04 ff 0e 67 01
2f 80 1f 00 6f 08 36 00 02 00 04 00 3f 22 02 04
ff 0e 9f 00 2f 80 1f 00 6f 08 18 00 02 00 04 00
00 00 00 00 00 00 00 00 00 00 00 00 00 00 00 00
00 00 00 00 00 00 00 00 00 00 00 00 00 00 00 00
00 00 00 00 00 00 00 00 00 00 00 00 00 00 00 00
00 00 00 00 00 00 00 00 00 00 00 00 00 00 00 00
00 00 00 00 00 00 00 00 00 00 00 00 00 00 7f 90

----------------

Block 0, Base EDID:
  EDID Structure Version & Revision: 1.4
  Vendor & Product Identification:
    Manufacturer: RMG
    Model: 2701
    Made in: week 12 of 2023
  Basic Display Parameters & Features:
    Digital display
    Bits per primary color channel: 10
    DisplayPort interface
    Maximum image size: 60 cm x 34 cm
    Gamma: 2.20
    DPMS levels: Off
    Supported color formats: RGB 4:4:4, YCrCb 4:4:4, YCrCb 4:2:2
    First detailed timing includes the native pixel format and preferred refresh rate
    Display supports continuous frequencies
  Color Characteristics:
    Red  : 0.6933, 0.2988
    Green: 0.2119, 0.7333
    Blue : 0.1513, 0.0449
    White: 0.3134, 0.3291
  Established Timings I & II:
    IBM     :   720x400    70.081663 Hz   9:5     31.467 kHz     28.320000 MHz
    DMT 0x04:   640x480    59.940476 Hz   4:3     31.469 kHz     25.175000 MHz
    DMT 0x06:   640x480    75.000000 Hz   4:3     37.500 kHz     31.500000 MHz
    DMT 0x09:   800x600    60.316541 Hz   4:3     37.879 kHz     40.000000 MHz
    DMT 0x0b:   800x600    75.000000 Hz   4:3     46.875 kHz     49.500000 MHz
    DMT 0x10:  1024x768    60.003840 Hz   4:3     48.363 kHz     65.000000 MHz
    DMT 0x12:  1024x768    75.028582 Hz   4:3     60.023 kHz     78.750000 MHz
    DMT 0x24:  1280x1024   75.024675 Hz   5:4     79.976 kHz    135.000000 MHz
  Standard Timings:
    DMT 0x52:  1920x1080   60.000000 Hz  16:9     67.500 kHz    148.500000 MHz
    DMT 0x23:  1280x1024   60.019740 Hz   5:4     63.981 kHz    108.000000 MHz
    DMT 0x15:  1152x864    75.000000 Hz   4:3     67.500 kHz    108.000000 MHz
    DMT 0x53:  1600x900    60.000000 Hz  16:9     60.000 kHz    108.000000 MHz (RB)
    DMT 0x3a:  1680x1050   59.954250 Hz  16:10    65.290 kHz    146.250000 MHz
    GTF     :  1680x1050  120.000000 Hz  16:10   135.000 kHz    313.200000 MHz
    GTF     :  1920x1080  119.999987 Hz  16:9    138.840 kHz    368.759000 MHz
    DMT 0x2f:  1440x900    59.887445 Hz  16:10    55.935 kHz    106.500000 MHz
  Detailed Timing Descriptors:
    DTD 1:  3840x2160   60.000000 Hz  16:9    135.000 kHz    594.000000 MHz (597 mm x 335 mm)
                 Hfront  176 Hsync  88 Hback  296 Hpol P
                 Vfront    4 Vsync  10 Vback   76 Vpol N
    Display Range Limits:
      Monitor ranges (Range Limits Only): 60-160 Hz V, 255-255 kHz H, max dotclock 1490 MHz
    Display Product Name: 'GM001J'
    Display Product Serial Number: ...
  Extension blocks: 2
Checksum: 0x8b

----------------

Block 1, CTA-861 Extension Block:
  Revision: 3
  Underscans IT Video Formats by default
  Basic audio support
  Supports YCbCr 4:4:4
  Supports YCbCr 4:2:2
  Native detailed modes: 1
  Audio Data Block:
    Linear PCM:
      Max channels: 2
      Supported sample rates (kHz): 48 44.1 32
      Supported sample sizes (bits): 24 20 16
  Speaker Allocation Data Block:
    FL/FR - Front Left/Right
  Video Data Block:
    VIC  16:  1920x1080   60.000000 Hz  16:9     67.500 kHz    148.500000 MHz (native)
    VIC   4:  1280x720    60.000000 Hz  16:9     45.000 kHz     74.250000 MHz
    VIC   3:   720x480    59.940060 Hz  16:9     31.469 kHz     27.000000 MHz
    VIC   1:   640x480    59.940476 Hz   4:3     31.469 kHz     25.175000 MHz
    VIC  18:   720x576    50.000000 Hz  16:9     31.250 kHz     27.000000 MHz
    VIC  19:  1280x720    50.000000 Hz  16:9     37.500 kHz     74.250000 MHz
    VIC  31:  1920x1080   50.000000 Hz  16:9     56.250 kHz    148.500000 MHz
    VIC  63:  1920x1080  120.000000 Hz  16:9    135.000 kHz    297.000000 MHz
    VIC  97:  3840x2160   60.000000 Hz  16:9    135.000 kHz    594.000000 MHz
    VIC 118:  3840x2160  120.000000 Hz  16:9    270.000 kHz   1188.000000 MHz
    VIC  95:  3840x2160   30.000000 Hz  16:9     67.500 kHz    297.000000 MHz
  Video Capability Data Block:
    YCbCr quantization: No Data
    RGB quantization: Selectable (via AVI Q)
    PT scan behavior: Supports both over- and underscan
    IT scan behavior: Supports both over- and underscan
    CE scan behavior: Supports both over- and underscan
  Colorimetry Data Block:
    xvYCC709
    BT2020YCC
    BT2020RGB
  HDR Static Metadata Data Block:
    Electro optical transfer functions:
      Traditional gamma - SDR luminance range
      Traditional gamma - HDR luminance range
      SMPTE ST2084
    Supported static metadata descriptors:
      Static metadata type 1
    Desired content max luminance: 139 (1015.241 cd/m^2)
    Desired content max frame-average luminance: 137 (972.198 cd/m^2)
    Desired content min luminance: 33 (0.170 cd/m^2)
  Vendor-Specific Data Block (AMD), OUI 00-00-1A:
    Version: 2
    Feature Caps: 0x01
    Minimum Refresh Rate: 60 Hz
    Maximum Refresh Rate: 160 Hz
    Flags 1.x: 0x00
    Flags 2.x: 0x00
    Maximum luminance: 115 (603.666 cd/m^2)
    Minimum luminance: 33 (0.101 cd/m^2)
    Unknown: 0x73 0x21
  Detailed Timing Descriptors:
    DTD 2:  2560x1440  120.000000 Hz  16:9    183.000 kHz    497.760000 MHz (600 mm x 330 mm)
                 Hfront   48 Hsync  32 Hback   80 Hpol P
                 Vfront    3 Vsync   5 Vback   77 Vpol N
    DTD 3:  2560x1440   60.000000 Hz  16:9     91.500 kHz    248.880000 MHz (600 mm x 330 mm)
                 Hfront   48 Hsync  32 Hback   80 Hpol P
                 Vfront    3 Vsync   4 Vback   78 Vpol N
Checksum: 0x22  Unused space in Extension Block: 39 bytes

----------------

Block 2, DisplayID Extension Block:
  Version: 1.2
  Extension Count: 0
  Display Product Type: Standalone display device
  Video Timing Modes Type 1 - Detailed Timings Data Block:
    DTD:  3840x2160  143.999785 Hz  16:9    318.960 kHz   1339.630000 MHz (aspect 16:9, no 3D stereo)
               Hfront   48 Hsync  32 Hback  280 Hpol P
               Vfront    3 Vsync   5 Vback   47 Vpol N
    DTD:  3840x2160  160.000000 Hz  16:9    349.600 kHz   1398.400000 MHz (aspect 16:9, no 3D stereo)
               Hfront   48 Hsync  32 Hback   80 Hpol P
               Vfront    3 Vsync   5 Vback   17 Vpol N
  Checksum: 0x7f
Checksum: 0x90

----------------

Block 3, Unknown EDID Extension Block 0x00:
  00 ff ff ff ff ff ff 00 49 a7 8d 0a 00 00 00 00 '........I.......'
  0c 21 01 04 b5 3c 22 78 3b a7 e5 b1 4c 36 bb 26 '.!...<"x;...L6.&'
  0b 50 54 a5 4b 00 d1 c0 81 80 71 4f a9 c0 b3 00 '.PT.K.....qO....'
  b3 3c d1 fc 95 00 08 e8 00 30 f2 70 5a 80 b0 58 '.<.......0.pZ..X'
  4a 00 55 4f 21 00 00 1a 00 00 00 fd 00 3c a0 ff 'J.UO!........<..'
  ff 95 01 0a 20 20 20 20 20 20 00 00 00 fc 00 47 '....      .....G'
  4d 30 30 31 4a 00 20 20 20 20 20 20 00 00 00 ff 'M001J.      ....'
  00 4c 31 33 32 32 32 30 31 34 33 00 00 00 02 8b '.L132220143.....'
Checksum: 0x8b

----------------

Block 4, CTA-861 Extension Block:
  Revision: 3
  Underscans IT Video Formats by default
  Basic audio support
  Supports YCbCr 4:4:4
  Supports YCbCr 4:2:2
  Native detailed modes: 1
  Audio Data Block:
    Linear PCM:
      Max channels: 2
      Supported sample rates (kHz): 48 44.1 32
      Supported sample sizes (bits): 24 20 16
  Speaker Allocation Data Block:
    FL/FR - Front Left/Right
  Video Data Block:
    VIC  16:  1920x1080   60.000000 Hz  16:9     67.500 kHz    148.500000 MHz (native)
    VIC   4:  1280x720    60.000000 Hz  16:9     45.000 kHz     74.250000 MHz
    VIC   3:   720x480    59.940060 Hz  16:9     31.469 kHz     27.000000 MHz
    VIC   1:   640x480    59.940476 Hz   4:3     31.469 kHz     25.175000 MHz
    VIC  18:   720x576    50.000000 Hz  16:9     31.250 kHz     27.000000 MHz
    VIC  19:  1280x720    50.000000 Hz  16:9     37.500 kHz     74.250000 MHz
    VIC  31:  1920x1080   50.000000 Hz  16:9     56.250 kHz    148.500000 MHz
    VIC  63:  1920x1080  120.000000 Hz  16:9    135.000 kHz    297.000000 MHz
    VIC  97:  3840x2160   60.000000 Hz  16:9    135.000 kHz    594.000000 MHz
    VIC 118:  3840x2160  120.000000 Hz  16:9    270.000 kHz   1188.000000 MHz
    VIC  95:  3840x2160   30.000000 Hz  16:9     67.500 kHz    297.000000 MHz
  Video Capability Data Block:
    YCbCr quantization: No Data
    RGB quantization: Selectable (via AVI Q)
    PT scan behavior: Supports both over- and underscan
    IT scan behavior: Supports both over- and underscan
    CE scan behavior: Supports both over- and underscan
  Colorimetry Data Block:
    xvYCC709
    BT2020YCC
    BT2020RGB
  HDR Static Metadata Data Block:
    Electro optical transfer functions:
      Traditional gamma - SDR luminance range
      Traditional gamma - HDR luminance range
      SMPTE ST2084
    Supported static metadata descriptors:
      Static metadata type 1
    Desired content max luminance: 139 (1015.241 cd/m^2)
    Desired content max frame-average luminance: 137 (972.198 cd/m^2)
    Desired content min luminance: 33 (0.170 cd/m^2)
  Vendor-Specific Data Block (AMD), OUI 00-00-1A:
    Version: 2
    Feature Caps: 0x01
    Minimum Refresh Rate: 60 Hz
    Maximum Refresh Rate: 160 Hz
    Flags 1.x: 0x00
    Flags 2.x: 0x00
    Maximum luminance: 115 (603.666 cd/m^2)
    Minimum luminance: 33 (0.101 cd/m^2)
    Unknown: 0x73 0x21
  Detailed Timing Descriptors:
    DTD 4:  2560x1440  120.000000 Hz  16:9    183.000 kHz    497.760000 MHz (600 mm x 330 mm)
                 Hfront   48 Hsync  32 Hback   80 Hpol P
                 Vfront    3 Vsync   5 Vback   77 Vpol N
    DTD 5:  2560x1440   60.000000 Hz  16:9     91.500 kHz    248.880000 MHz (600 mm x 330 mm)
                 Hfront   48 Hsync  32 Hback   80 Hpol P
                 Vfront    3 Vsync   4 Vback   78 Vpol N
Checksum: 0x22  Unused space in Extension Block: 39 bytes

----------------

Block 5, DisplayID Extension Block:
  Version: 1.2
  Extension Count: 0
  Video Timing Modes Type 1 - Detailed Timings Data Block:
    DTD:  3840x2160  143.999785 Hz  16:9    318.960 kHz   1339.630000 MHz (aspect 16:9, no 3D stereo)
               Hfront   48 Hsync  32 Hback  280 Hpol P
               Vfront    3 Vsync   5 Vback   47 Vpol N
    DTD:  3840x2160  160.000000 Hz  16:9    349.600 kHz   1398.400000 MHz (aspect 16:9, no 3D stereo)
               Hfront   48 Hsync  32 Hback   80 Hpol P
               Vfront    3 Vsync   5 Vback   17 Vpol N
  Checksum: 0x7f
Checksum: 0x90

----------------

Warnings:

Block 0, Base EDID:
  Detailed Timing Descriptor #1: DTD is similar but not identical to VIC 97.
Block 1, CTA-861 Extension Block:
  Video Data Block: VIC 16 and the first DTD are not identical. Is this intended?
  Video Capability Data Block: Set Selectable YCbCr Quantization to avoid interop issues.
  Video Capability Data Block: S_PT is equal to S_IT and S_CE, so should be set to 0 instead.
  Colorimetry Data Block: Set the sRGB colorimetry bit to avoid interop issues.
Block 4, CTA-861 Extension Block:
  Video Capability Data Block: Set Selectable YCbCr Quantization to avoid interop issues.
  Video Capability Data Block: S_PT is equal to S_IT and S_CE, so should be set to 0 instead.
  Colorimetry Data Block: Set the sRGB colorimetry bit to avoid interop issues.
EDID:
  Base EDID: Some timings are out of range of the Monitor Ranges:
    Vertical Freq: 30.000 - 160.000 Hz (Monitor: 60.000 - 160.000 Hz)
    Horizontal Freq: 31.250 - 349.600 kHz (Monitor: 255.000 - 255.000 kHz)

Failures:

Block 0, Base EDID:
  Display Product Serial Number: ...
  Display Product Name: NUL byte at position 6.
Block 2, DisplayID Extension Block:
  Expected 0 DisplayID Extension Block, but got 1.
Block 3, Base EDID:
  Unknown Extension Block.
Block 4, CTA-861 Extension Block:
  Speaker Allocation Data Block: Only one instance of this Data Block is allowed.
  Video Data Block: Duplicate VIC 16.
  Video Data Block: Duplicate VIC 4.
  Video Data Block: Duplicate VIC 3.
  Video Data Block: Duplicate VIC 1.
  Video Data Block: Duplicate VIC 18.
  Video Data Block: Duplicate VIC 19.
  Video Data Block: Duplicate VIC 31.
  Video Data Block: Duplicate VIC 63.
  Video Data Block: Duplicate VIC 97.
  Video Data Block: Duplicate VIC 118.
  Video Data Block: Duplicate VIC 95.
  Video Capability Data Block: Only one instance of this Data Block is allowed.
  Colorimetry Data Block: Only one instance of this Data Block is allowed.
  HDR Static Metadata Data Block: Only one instance of this Data Block is allowed.
Block 5, DisplayID Extension Block:
  Product Type should be 0 in extension block.
EDID:
  Base EDID: EDID specified 2 extension block(s), but found 5 extension block(s).
  CTA-861: Native progressive timings are a mix of several resolutions.
  DisplayID: Missing DisplayID Display Parameters Data Block.
  DisplayID: DisplayID expects at least one preferred timing.

EDID conformity: FAIL
