edid-decode (hex):

00 ff ff ff ff ff ff 00 4a 8b 55 25 01 01 01 01
20 23 01 03 80 0b 06 78 ea 1e c5 ae 4f 34 b1 26
0e 50 54 01 08 00 59 c0 d1 c0 59 00 45 40 61 40
01 01 01 01 01 01 01 1d 00 72 51 d0 1e 20 6e 28
55 00 77 41 00 00 00 1c 02 3a 80 18 71 38 2d 40
58 2c 35 00 77 41 00 00 00 1e 00 00 00 fc 00 57
6f 6b 79 69 73 0a 20 20 20 20 20 20 00 00 00 fd
00 38 3e 0f 87 24 00 0a 20 20 20 20 20 20 01 39

02 03 1d 35 41 04 68 03 0c 00 10 00 38 48 00 00
68 1a 00 00 01 01 3b 3d e6 e3 05 83 00 ef 68 00
a0 a0 40 2e 60 30 20 36 00 77 41 00 00 00 1a 9a
0c e0 20 12 40 cd 10 30 20 3a 00 77 41 00 00 00
1e 04 10 c0 00 31 1c 16 20 20 60 35 00 49 31 00
00 00 1c 0d 25 a0 a0 50 c0 1c 30 30 20 3a 00 49
31 00 00 00 1a 01 1d 00 72 51 d0 1e 20 6e 28 55
00 49 31 00 00 00 1e 00 00 00 00 00 00 00 00 1e

00 ff ff ff ff ff ff 00 4a 8b 55 25 01 01 01 01
20 23 01 03 80 0b 06 78 ea 1e c5 ae 4f 34 b1 26
0e 50 54 01 08 00 59 c0 d1 c0 59 00 45 40 61 40
01 01 01 01 01 01 01 1d 00 72 51 d0 1e 20 6e 28
55 00 77 41 00 00 00 1c 02 3a 80 18 71 38 2d 40
58 2c 35 00 77 41 00 00 00 1e 00 00 00 fc 00 57
6f 6b 79 69 73 0a 20 20 20 20 20 20 00 00 00 fd
00 38 3e 0f 87 24 00 0a 20 20 20 20 20 20 01 39

02 03 1d 35 41 04 68 03 0c 00 10 00 38 48 00 00
68 1a 00 00 01 01 3b 3d e6 e3 05 83 00 ef 68 00
a0 a0 40 2e 60 30 20 36 00 77 41 00 00 00 1a 9a
0c e0 20 12 40 cd 10 30 20 3a 00 77 41 00 00 00
1e 04 10 c0 00 31 1c 16 20 20 60 35 00 49 31 00
00 00 1c 0d 25 a0 a0 50 c0 1c 30 30 20 3a 00 49
31 00 00 00 1a 01 1d 00 72 51 d0 1e 20 6e 28 55
00 49 31 00 00 00 1e 00 00 00 00 00 00 00 00 1e

----------------

Block 0, Base EDID:
  EDID Structure Version & Revision: 1.3
  Vendor & Product Identification:
    Manufacturer: RTK
    Model: 9557
    Serial Number: ...
    Made in: week 32 of 2025
  Basic Display Parameters & Features:
    Digital display
    Maximum image size: 11 cm x 6 cm
    Gamma: 2.20
    DPMS levels: Standby Suspend Off
    RGB color display
    First detailed timing is the preferred timing
  Color Characteristics:
    Red  : 0.6796, 0.3095
    Green: 0.2060, 0.6933
    Blue : 0.1513, 0.0546
    White: 0.3134, 0.3291
  Established Timings I & II:
    DMT 0x09:   800x600    60.316541 Hz   4:3     37.879 kHz     40.000000 MHz
    DMT 0x10:  1024x768    60.003840 Hz   4:3     48.363 kHz     65.000000 MHz
  Standard Timings:
    GTF     :   960x540    60.000530 Hz  16:9     33.540 kHz     40.785000 MHz
    DMT 0x52:  1920x1080   60.000000 Hz  16:9     67.500 kHz    148.500000 MHz
    GTF     :   960x600    59.999687 Hz  16:10    37.320 kHz     45.978000 MHz
    DMT 0x09:   800x600    60.316541 Hz   4:3     37.879 kHz     40.000000 MHz
    DMT 0x10:  1024x768    60.003840 Hz   4:3     48.363 kHz     65.000000 MHz
  Detailed Timing Descriptors:
    DTD 1:  1280x720    60.000000 Hz  16:9     45.000 kHz     74.250000 MHz (119 mm x 65 mm)
                 Hfront  110 Hsync  40 Hback  220 Hpol N
                 Vfront    5 Vsync   5 Vback   20 Vpol P
    DTD 2:  1920x1080   60.000000 Hz  16:9     67.500 kHz    148.500000 MHz (119 mm x 65 mm)
                 Hfront   88 Hsync  44 Hback  148 Hpol P
                 Vfront    3 Vsync   5 Vback   37 Vpol P
    Display Product Name: 'Wokyis'
    Display Range Limits:
      Monitor ranges (GTF): 56-62 Hz V, 15-135 kHz H, max dotclock 360 MHz
  Extension blocks: 1
Checksum: 0x39

----------------

Block 1, CTA-861 Extension Block:
  Revision: 3
  Supports YCbCr 4:4:4
  Supports YCbCr 4:2:2
  Native DTDs: 5
  Video Data Block:
    VIC   4:  1280x720    60.000000 Hz  16:9     45.000 kHz     74.250000 MHz
  Vendor-Specific Data Block (HDMI), OUI 00-0C-03:
    Source physical address: 1.0.0.0
    DC_36bit
    DC_30bit
    DC_Y444
    Maximum TMDS clock: 360 MHz
  Unknown CTA-861 Data Block (tag 0x00, length 0):
  Vendor-Specific Data Block (AMD), OUI 00-00-1A:
    Version: 1
    Flags 1: 0x01
      FreeSync Supported
    Minimum Refresh Rate: 59 Hz
    Maximum Refresh Rate: 61 Hz
    MCCS VCP Code: 0xe6
  Colorimetry Data Block:
    xvYCC601
    xvYCC709
    BT2020RGB
  Detailed Timing Descriptors:
    DTD 3:  2560x1600   60.000625 Hz  16:10    98.761 kHz    268.630000 MHz (119 mm x 65 mm)
                 Hfront   48 Hsync  32 Hback   80 Hpol P
                 Vfront    3 Vsync   6 Vback   37 Vpol N
    DTD 4:   480x320    60.007440 Hz   3:2     31.504 kHz     32.260000 MHz (119 mm x 65 mm)
                 Hfront   48 Hsync  32 Hback  464 Hpol P
                 Vfront    3 Vsync  10 Vback  192 Vpol P
    DTD 5:   960x540    59.994849 Hz  16:9     33.717 kHz     41.000000 MHz (73 mm x 49 mm)
                 Hfront   32 Hsync  96 Hback  128 Hpol N
                 Vfront    3 Vsync   5 Vback   14 Vpol P
    DTD 6:  1440x960    60.001265 Hz   3:2     59.281 kHz     94.850000 MHz (73 mm x 49 mm)
                 Hfront   48 Hsync  32 Hback   80 Hpol P
                 Vfront    3 Vsync  10 Vback   15 Vpol N
    DTD 7:  1280x720    60.000000 Hz  16:9     45.000 kHz     74.250000 MHz (73 mm x 49 mm)
                 Hfront  110 Hsync  40 Hback  220 Hpol P
                 Vfront    5 Vsync   5 Vback   20 Vpol P
Checksum: 0x1e  Unused space in Extension Block: 8 bytes

----------------

Warnings:

Block 0, Base EDID:
  Vendor & Product Identification: The serial number is one of the known dummy values, it should probably be set to 0.
  Basic Display Parameters & Features: Dubious maximum image size (11x6 is smaller than 10x10 cm).
  Detailed Timing Descriptor #1: DTD is similar but not identical to VIC 4.
  Detailed Timing Descriptor #1: Dubious image size (119x65 mm is smaller than 100x100 mm).
  Detailed Timing Descriptor #2: DTD is similar but not identical to VIC 16.
  Detailed Timing Descriptor #2: Dubious image size (119x65 mm is smaller than 100x100 mm).
Block 1, CTA-861 Extension Block:
  IT Video Formats are overscanned by default, but normally this should be underscanned.
  Video Data Block: VIC 4 and the first DTD are not identical. Is this intended?
  Unknown CTA-861 Data Block (tag 0x00, length 0).
  Colorimetry Data Block: Set the sRGB colorimetry bit to avoid interop issues.
  Detailed Timing Descriptor #3: Dubious image size (119x65 mm is smaller than 100x100 mm).
  Detailed Timing Descriptor #4: Dubious image size (119x65 mm is smaller than 100x100 mm).
  Detailed Timing Descriptor #5: Dubious image size (73x49 mm is smaller than 100x100 mm).
  Detailed Timing Descriptor #6: Dubious image size (73x49 mm is smaller than 100x100 mm).
  Detailed Timing Descriptor #7: Dubious image size (73x49 mm is smaller than 100x100 mm).

Failures:

Block 1, CTA-861 Extension Block:
  Vendor-Specific Data Block (HDMI), OUI 00-0C-03: HDMI VSDB Max TMDS rate is > 340.
  Detailed Timing Descriptor #5: Mismatch of image size 73x49 mm vs display size 110x60 mm.
  Detailed Timing Descriptor #6: Mismatch of image size 73x49 mm vs display size 110x60 mm.
  Detailed Timing Descriptor #7: Mismatch of image size 73x49 mm vs display size 110x60 mm.
  Required 640x480p60 timings are missing in the established timings and the SVD list (VIC 1).
  Missing VCDB, needed for Set Selectable RGB Quantization to avoid interop issues.
EDID:
  Extension Block 2 started with EDID header, ignoring Extension Blocks >= 2.
  CTA-861: Native progressive timings are a mix of several resolutions.

EDID conformity: FAIL
