edid-decode (hex):

00 ff ff ff ff ff ff 00 10 ac 93 d0 42 36 33 41
1c 1a 01 03 80 26 1e 78 ee ee 95 a3 54 4c 99 26
0f 50 54 a5 4b 00 71 4f 81 80 01 01 01 01 01 01
01 01 01 01 01 01 30 2a 00 98 51 00 2a 40 30 70
13 00 78 2d 11 00 00 1e 00 00 00 ff 00 43 44 4e
39 43 36 37 33 41 33 36 42 0a 00 00 00 fc 00 44
45 4c 4c 20 50 31 39 31 37 53 0a 20 00 00 00 fd
00 38 4c 1e 51 0e 00 0a 20 20 20 20 20 20 01 e3

02 03 17 b1 4c 05 90 01 02 03 07 12 16 04 13 14
1f 65 03 0c 00 10 00 01 1d 00 72 51 d0 1e 20 6e
28 55 00 78 2d 11 00 00 1e 02 3a 80 18 71 38 2d
40 58 2c 45 00 78 2d 11 00 00 1e 01 1d 80 18 71
1c 16 20 58 2c 25 00 78 2d 11 00 00 9e 8c 0a d0
8a 20 e0 2d 10 10 3e 96 00 78 2d 11 00 00 18 00
00 00 00 00 00 00 00 00 00 00 00 00 00 00 00 00
00 00 00 00 00 00 00 00 00 00 00 00 00 00 00 c5

00 ff ff ff ff ff ff 00 10 ac 93 d0 42 36 33 41
1c 1a 01 03 80 26 1e 78 ee ee 95 a3 54 4c 99 26
0f 50 54 a5 4b 00 71 4f 81 80 01 01 01 01 01 01
01 01 01 01 01 01 30 2a 00 98 51 00 2a 40 30 70
13 00 78 2d 11 00 00 1e 00 00 00 ff 00 43 44 4e
39 43 36 37 33 41 33 36 42 0a 00 00 00 fc 00 44
45 4c 4c 20 50 31 39 31 37 53 0a 20 00 00 00 fd
00 38 4c 1e 51 0e 00 0a 20 20 20 20 20 20 01 e3

02 03 17 b1 4c 05 90 01 02 03 07 12 16 04 13 14
1f 65 03 0c 00 10 00 01 1d 00 72 51 d0 1e 20 6e
28 55 00 78 2d 11 00 00 1e 02 3a 80 18 71 38 2d
40 58 2c 45 00 78 2d 11 00 00 1e 01 1d 80 18 71
1c 16 20 58 2c 25 00 78 2d 11 00 00 9e 8c 0a d0
8a 20 e0 2d 10 10 3e 96 00 78 2d 11 00 00 18 00
00 00 00 00 00 00 00 00 00 00 00 00 00 00 00 00
00 00 00 00 00 00 00 00 00 00 00 00 00 00 00 c5

----------------

Block 0, Base EDID:
  EDID Structure Version & Revision: 1.3
  Vendor & Product Identification:
    Manufacturer: DEL
    Model: 53395
    Serial Number: ...
    Made in: week 28 of 2016
  Basic Display Parameters & Features:
    Digital display
    Maximum image size: 38 cm x 30 cm
    Gamma: 2.20
    DPMS levels: Standby Suspend Off
    RGB color display
    Default (sRGB) color space is primary color space
    First detailed timing is the preferred timing
  Color Characteristics:
    Red  : 0.6396, 0.3300
    Green: 0.2998, 0.5996
    Blue : 0.1503, 0.0595
    White: 0.3134, 0.3291
  Established Timings I & II:
    IBM     :   720x400    70.081663 Hz   9:5     31.467 kHz     28.320000 MHz
    DMT 0x04:   640x480    59.940476 Hz   4:3     31.469 kHz     25.175000 MHz
    DMT 0x06:   640x480    75.000000 Hz   4:3     37.500 kHz     31.500000 MHz
    DMT 0x09:   800x600    60.316541 Hz   4:3     37.879 kHz     40.000000 MHz
    DMT 0x0b:   800x600    75.000000 Hz   4:3     46.875 kHz     49.500000 MHz
    DMT 0x10:  1024x768    60.003840 Hz   4:3     48.363 kHz     65.000000 MHz
    DMT 0x12:  1024x768    75.028582 Hz   4:3     60.023 kHz     78.750000 MHz
    DMT 0x24:  1280x1024   75.024675 Hz   5:4     79.976 kHz    135.000000 MHz
  Standard Timings:
    DMT 0x15:  1152x864    75.000000 Hz   4:3     67.500 kHz    108.000000 MHz
    DMT 0x23:  1280x1024   60.019740 Hz   5:4     63.981 kHz    108.000000 MHz
  Detailed Timing Descriptors:
    DTD 1:  1280x1024   60.019740 Hz   5:4     63.981 kHz    108.000000 MHz (376 mm x 301 mm)
                 Hfront   48 Hsync 112 Hback  248 Hpol P
                 Vfront    1 Vsync   3 Vback   38 Vpol P
    Display Product Serial Number: ...
    Display Product Name: 'DELL P1917S'
    Display Range Limits:
      Monitor ranges (GTF): 56-76 Hz V, 30-81 kHz H, max dotclock 140 MHz
  Extension blocks: 1
Checksum: 0xe3

----------------

Block 1, CTA-861 Extension Block:
  Revision: 3
  Underscans IT Video Formats by default
  Supports YCbCr 4:4:4
  Supports YCbCr 4:2:2
  Native DTDs: 1
  Video Data Block:
    VIC   5:  1920x1080i  60.000000 Hz  16:9     33.750 kHz     74.250000 MHz
    VIC  16:  1920x1080   60.000000 Hz  16:9     67.500 kHz    148.500000 MHz (native)
    VIC   1:   640x480    59.940476 Hz   4:3     31.469 kHz     25.175000 MHz
    VIC   2:   720x480    59.940060 Hz   4:3     31.469 kHz     27.000000 MHz
    VIC   3:   720x480    59.940060 Hz  16:9     31.469 kHz     27.000000 MHz
    VIC   7:  1440x480i   59.940060 Hz  16:9     15.734 kHz     27.000000 MHz
    VIC  18:   720x576    50.000000 Hz  16:9     31.250 kHz     27.000000 MHz
    VIC  22:  1440x576i   50.000000 Hz  16:9     15.625 kHz     27.000000 MHz
    VIC   4:  1280x720    60.000000 Hz  16:9     45.000 kHz     74.250000 MHz
    VIC  19:  1280x720    50.000000 Hz  16:9     37.500 kHz     74.250000 MHz
    VIC  20:  1920x1080i  50.000000 Hz  16:9     28.125 kHz     74.250000 MHz
    VIC  31:  1920x1080   50.000000 Hz  16:9     56.250 kHz    148.500000 MHz
  Vendor-Specific Data Block (HDMI), OUI 00-0C-03:
    Source physical address: 1.0.0.0
  Detailed Timing Descriptors:
    DTD 2:  1280x720    60.000000 Hz  16:9     45.000 kHz     74.250000 MHz (376 mm x 301 mm)
                 Hfront  110 Hsync  40 Hback  220 Hpol P
                 Vfront    5 Vsync   5 Vback   20 Vpol P
    DTD 3:  1920x1080   60.000000 Hz  16:9     67.500 kHz    148.500000 MHz (376 mm x 301 mm)
                 Hfront   88 Hsync  44 Hback  148 Hpol P
                 Vfront    4 Vsync   5 Vback   36 Vpol P
    DTD 4:  1920x1080i  60.000000 Hz  16:9     33.750 kHz     74.250000 MHz (376 mm x 301 mm)
                 Hfront   88 Hsync  44 Hback  148 Hpol P
                 Vfront    2 Vsync   5 Vback   15 Vpol P Vfront +0.5 Odd Field
                 Vfront    2 Vsync   5 Vback   15 Vpol P Vback  +0.5 Even Field
    DTD 5:   720x480    59.940060 Hz   3:2     31.469 kHz     27.000000 MHz (376 mm x 301 mm)
                 Hfront   16 Hsync  62 Hback   60 Hpol N
                 Vfront    9 Vsync   6 Vback   30 Vpol N
Checksum: 0xc5  Unused space in Extension Block: 32 bytes

----------------

Warnings:

Block 1, CTA-861 Extension Block:
  Video Data Block: VIC 5 and the first DTD are not identical. Is this intended?
  Detailed Timing Descriptor #2: Image size is 376x301 mm, but based on the picture AR it should be 376x211 mm.
  Detailed Timing Descriptor #3: Image size is 376x301 mm, but based on the picture AR it should be 376x211 mm.
  Detailed Timing Descriptor #4: Image size is 376x301 mm, but based on the picture AR it should be 376x211 mm.
  Detailed Timing Descriptor #5: Image size is 376x301 mm, but based on the picture AR it should be 376x250 mm.
  Display Product Serial Number is set, so the Serial Number in the Base EDID should be 0.
EDID:
  Base EDID: Some timings are out of range of the Monitor Ranges:
    Vertical Freq: 50.000 - 75.029 Hz (Monitor: 56.000 - 76.000 Hz)
    Horizontal Freq: 15.625 - 79.976 kHz (Monitor: 30.000 - 81.000 kHz)
    Maximum Clock: 148.500 MHz (Monitor: 140.000 MHz)

Failures:

Block 0, Base EDID:
  Basic Display Parameters & Features: sRGB is signaled, but the chromaticities do not match.
Block 1, CTA-861 Extension Block:
  Missing VCDB, needed for Set Selectable RGB Quantization to avoid interop issues.
EDID:
  Extension Block 2 started with EDID header, ignoring Extension Blocks >= 2.
  CTA-861: Native progressive timings are a mix of several resolutions.

EDID conformity: FAIL
