edid-decode (hex):

00 ff ff ff ff ff ff 00 05 e3 36 20 fb 91 00 00
2e 14 01 04 a5 2c 19 78 22 b8 15 a6 55 4b 9b 25
13 50 54 bf ee 00 81 c0 a9 c0 01 01 01 01 01 01
01 01 01 01 01 01 30 2a 40 c8 60 84 64 30 18 50
13 00 bb f9 10 00 00 1e 00 00 00 fd 00 37 4b 1e
53 0e 00 0a 20 20 20 20 20 20 00 00 00 fc 00 32
30 33 36 0a 20 20 20 20 20 20 20 20 00 00 00 ff
00 51 38 31 41 42 48 41 33 33 37 33 37 31 00 b7

00 ff ff ff ff ff ff 00 05 e3 36 20 fb 91 00 00
2e 14 01 04 a5 2c 19 78 22 b8 15 a6 55 4b 9b 25
13 50 54 bf ee 00 81 c0 a9 c0 01 01 01 01 01 01
01 01 01 01 01 01 30 2a 40 c8 60 84 64 30 18 50
13 00 bb f9 10 00 00 1e 00 00 00 fd 00 37 4b 1e
53 0e 00 0a 20 20 20 20 20 20 00 00 00 fc 00 32
30 33 36 0a 20 20 20 20 20 20 20 20 00 00 00 ff
00 51 38 31 41 42 48 41 33 33 37 33 37 31 00 b7

----------------

Block 0, Base EDID:
  EDID Structure Version & Revision: 1.4
  Vendor & Product Identification:
    Manufacturer: AOC
    Model: 8246
    Serial Number: ...
    Made in: week 46 of 2010
  Basic Display Parameters & Features:
    Digital display
    Bits per primary color channel: 8
    DisplayPort interface
    Maximum image size: 44 cm x 25 cm
    Gamma: 2.20
    DPMS levels: Off
    Supported color formats: RGB 4:4:4
    First detailed timing includes the native pixel format and preferred refresh rate
  Color Characteristics:
    Red  : 0.6503, 0.3349
    Green: 0.2949, 0.6054
    Blue : 0.1445, 0.0751
    White: 0.3134, 0.3291
  Established Timings I & II:
    IBM     :   720x400    70.081663 Hz   9:5     31.467 kHz     28.320000 MHz
    DMT 0x04:   640x480    59.940476 Hz   4:3     31.469 kHz     25.175000 MHz
    Apple   :   640x480    66.666667 Hz   4:3     35.000 kHz     30.240000 MHz
    DMT 0x05:   640x480    72.808802 Hz   4:3     37.861 kHz     31.500000 MHz
    DMT 0x06:   640x480    75.000000 Hz   4:3     37.500 kHz     31.500000 MHz
    DMT 0x08:   800x600    56.250000 Hz   4:3     35.156 kHz     36.000000 MHz
    DMT 0x09:   800x600    60.316541 Hz   4:3     37.879 kHz     40.000000 MHz
    DMT 0x0a:   800x600    72.187572 Hz   4:3     48.077 kHz     50.000000 MHz
    DMT 0x0b:   800x600    75.000000 Hz   4:3     46.875 kHz     49.500000 MHz
    Apple   :   832x624    74.551266 Hz   4:3     49.726 kHz     57.284000 MHz
    DMT 0x10:  1024x768    60.003840 Hz   4:3     48.363 kHz     65.000000 MHz
    DMT 0x11:  1024x768    70.069359 Hz   4:3     56.476 kHz     75.000000 MHz
    DMT 0x12:  1024x768    75.028582 Hz   4:3     60.023 kHz     78.750000 MHz
  Standard Timings:
    DMT 0x55:  1280x720    60.000000 Hz  16:9     45.000 kHz     74.250000 MHz
    DMT 0x53:  1600x900    60.000000 Hz  16:9     60.000 kHz    108.000000 MHz (RB)
  Detailed Timing Descriptors:
    DTD 1:  1600x900    60.000000 Hz  16:9     60.000 kHz    108.000000 MHz (443 mm x 249 mm)
                 Hfront   24 Hsync  80 Hback   96 Hpol P
                 Vfront    1 Vsync   3 Vback   96 Vpol P
    Display Range Limits:
      Monitor ranges (GTF): 55-75 Hz V, 30-83 kHz H, max dotclock 140 MHz
    Display Product Name: '2036'
    Display Product Serial Number: ...
Checksum: 0xb7

----------------

Block 1, Unknown EDID Extension Block 0x00:
  00 ff ff ff ff ff ff 00 05 e3 36 20 fb 91 00 00 '..........6 ....'
  2e 14 01 04 a5 2c 19 78 22 b8 15 a6 55 4b 9b 25 '.....,.x"...UK.%'
  13 50 54 bf ee 00 81 c0 a9 c0 01 01 01 01 01 01 '.PT.............'
  01 01 01 01 01 01 30 2a 40 c8 60 84 64 30 18 50 '......0*@.`.d0.P'
  13 00 bb f9 10 00 00 1e 00 00 00 fd 00 37 4b 1e '.............7K.'
  53 0e 00 0a 20 20 20 20 20 20 00 00 00 fc 00 32 'S...      .....2'
  30 33 36 0a 20 20 20 20 20 20 20 20 00 00 00 ff '036.        ....'
  00 51 38 31 41 42 48 41 33 33 37 33 37 31 00 b7 '.Q81ABHA337371..'
Checksum: 0xb7

----------------

Warnings:

Block 0, Base EDID:
  Display Range Limits: GTF support is deprecated in EDID 1.4.

Failures:

Block 0, Base EDID:
  Display Range Limits: GTF is supported, but the display does not support continuous frequencies.
Block 1, Base EDID:
  Unknown Extension Block.
EDID:
  Base EDID: EDID specified 0 extension block(s), but found 1 extension block(s).

EDID conformity: FAIL
