edid-decode (hex):

00 ff ff ff ff ff ff 00 5a 8b 00 30 00 00 00 00
13 1d 01 03 80 45 1d 78 2a 64 f5 ad 50 49 a3 22
13 50 54 a5 4b 00 81 c0 81 80 95 00 71 4f b3 00
d1 c0 01 01 01 01 b8 47 00 a0 a0 38 2d 40 30 40
35 00 b2 23 21 00 00 1e 20 ac 00 a0 a0 38 2d 40
30 40 35 00 b2 23 21 00 00 1e 00 00 00 fd 00 32
7a 36 df 32 00 0a 20 20 20 20 20 20 00 00 00 fc
00 47 4e 56 33 30 43 42 0a 20 20 20 20 20 01 14

02 03 32 f1 49 01 02 03 04 90 12 13 1f 4e 23 09
07 07 83 01 00 00 6a 03 0c 00 10 00 38 3c 20 00
00 67 d8 5d c4 01 78 80 03 68 1a 00 00 01 01 32
7a ed 70 8f 00 a0 a0 38 2d 40 30 40 35 00 b2 23
21 00 00 1e 3e 29 00 18 51 38 30 40 30 20 35 00
b2 23 21 00 00 1e 0c 5a 00 a0 a0 38 32 40 30 20
35 00 b2 23 21 00 00 1e 00 00 00 00 00 00 00 00
00 00 00 00 00 00 00 00 00 00 00 00 00 00 00 78

00 ff ff ff ff ff ff 00 5a 8b 00 30 00 00 00 00
13 1d 01 03 80 45 1d 78 2a 64 f5 ad 50 49 a3 22
13 50 54 a5 4b 00 81 c0 81 80 95 00 71 4f b3 00
d1 c0 01 01 01 01 b8 47 00 a0 a0 38 2d 40 30 40
35 00 b2 23 21 00 00 1e 20 ac 00 a0 a0 38 2d 40
30 40 35 00 b2 23 21 00 00 1e 00 00 00 fd 00 32
7a 36 df 32 00 0a 20 20 20 20 20 20 00 00 00 fc
00 47 4e 56 33 30 43 42 0a 20 20 20 20 20 01 14

02 03 32 f1 49 01 02 03 04 90 12 13 1f 4e 23 09
07 07 83 01 00 00 6a 03 0c 00 10 00 38 3c 20 00
00 67 d8 5d c4 01 78 80 03 68 1a 00 00 01 01 32
7a ed 70 8f 00 a0 a0 38 2d 40 30 40 35 00 b2 23
21 00 00 1e 3e 29 00 18 51 38 30 40 30 20 35 00
b2 23 21 00 00 1e 0c 5a 00 a0 a0 38 32 40 30 20
35 00 b2 23 21 00 00 1e 00 00 00 00 00 00 00 00
00 00 00 00 00 00 00 00 00 00 00 00 00 00 00 78

----------------

Block 0, Base EDID:
  EDID Structure Version & Revision: 1.3
  Vendor & Product Identification:
    Manufacturer: VTK
    Model: 12288
    Made in: week 19 of 2019
  Basic Display Parameters & Features:
    Digital display
    Maximum image size: 69 cm x 29 cm
    Gamma: 2.20
    DPMS levels: Off
    RGB color display
    First detailed timing is the preferred timing
  Color Characteristics:
    Red  : 0.6767, 0.3144
    Green: 0.2861, 0.6367
    Blue : 0.1357, 0.0771
    White: 0.3134, 0.3291
  Established Timings I & II:
    IBM     :   720x400    70.081663 Hz   9:5     31.467 kHz     28.320000 MHz
    DMT 0x04:   640x480    59.940476 Hz   4:3     31.469 kHz     25.175000 MHz
    DMT 0x06:   640x480    75.000000 Hz   4:3     37.500 kHz     31.500000 MHz
    DMT 0x09:   800x600    60.316541 Hz   4:3     37.879 kHz     40.000000 MHz
    DMT 0x0b:   800x600    75.000000 Hz   4:3     46.875 kHz     49.500000 MHz
    DMT 0x10:  1024x768    60.003840 Hz   4:3     48.363 kHz     65.000000 MHz
    DMT 0x12:  1024x768    75.028582 Hz   4:3     60.023 kHz     78.750000 MHz
    DMT 0x24:  1280x1024   75.024675 Hz   5:4     79.976 kHz    135.000000 MHz
  Standard Timings:
    DMT 0x55:  1280x720    60.000000 Hz  16:9     45.000 kHz     74.250000 MHz
    DMT 0x23:  1280x1024   60.019740 Hz   5:4     63.981 kHz    108.000000 MHz
    DMT 0x2f:  1440x900    59.887445 Hz  16:10    55.935 kHz    106.500000 MHz
    DMT 0x15:  1152x864    75.000000 Hz   4:3     67.500 kHz    108.000000 MHz
    DMT 0x3a:  1680x1050   59.954250 Hz  16:10    65.290 kHz    146.250000 MHz
    DMT 0x52:  1920x1080   60.000000 Hz  16:9     67.500 kHz    148.500000 MHz
  Detailed Timing Descriptors:
    DTD 1:  2560x1080   60.000000 Hz  64:27    67.500 kHz    183.600000 MHz (690 mm x 291 mm)
                 Hfront   48 Hsync  64 Hback   48 Hpol P
                 Vfront    3 Vsync   5 Vback   37 Vpol P
    DTD 2:  2560x1080  144.000000 Hz  64:27   162.000 kHz    440.640000 MHz (690 mm x 291 mm)
                 Hfront   48 Hsync  64 Hback   48 Hpol P
                 Vfront    3 Vsync   5 Vback   37 Vpol P
    Display Range Limits:
      Monitor ranges (GTF): 50-122 Hz V, 54-223 kHz H, max dotclock 500 MHz
    Display Product Name: 'GNV30CB'
  Extension blocks: 1
Checksum: 0x14

----------------

Block 1, CTA-861 Extension Block:
  Revision: 3
  Underscans IT Video Formats by default
  Basic audio support
  Supports YCbCr 4:4:4
  Supports YCbCr 4:2:2
  Native DTDs: 1
  Video Data Block:
    VIC   1:   640x480    59.940476 Hz   4:3     31.469 kHz     25.175000 MHz
    VIC   2:   720x480    59.940060 Hz   4:3     31.469 kHz     27.000000 MHz
    VIC   3:   720x480    59.940060 Hz  16:9     31.469 kHz     27.000000 MHz
    VIC   4:  1280x720    60.000000 Hz  16:9     45.000 kHz     74.250000 MHz
    VIC  16:  1920x1080   60.000000 Hz  16:9     67.500 kHz    148.500000 MHz (native)
    VIC  18:   720x576    50.000000 Hz  16:9     31.250 kHz     27.000000 MHz
    VIC  19:  1280x720    50.000000 Hz  16:9     37.500 kHz     74.250000 MHz
    VIC  31:  1920x1080   50.000000 Hz  16:9     56.250 kHz    148.500000 MHz
    VIC  78:  1920x1080  120.000000 Hz  64:27   135.000 kHz    297.000000 MHz
  Audio Data Block:
    Linear PCM:
      Max channels: 2
      Supported sample rates (kHz): 48 44.1 32
      Supported sample sizes (bits): 24 20 16
  Speaker Allocation Data Block:
    FL/FR - Front Left/Right
  Vendor-Specific Data Block (HDMI), OUI 00-0C-03:
    Source physical address: 1.0.0.0
    DC_36bit
    DC_30bit
    DC_Y444
    Maximum TMDS clock: 300 MHz
    Extended HDMI video details:
  Vendor-Specific Data Block (HDMI Forum), OUI C4-5D-D8:
    Version: 1
    Maximum TMDS Character Rate: 600 MHz
    SCDC Present
    Supports 12-bits/component Deep Color 4:2:0 Pixel Encoding
    Supports 10-bits/component Deep Color 4:2:0 Pixel Encoding
  Vendor-Specific Data Block (AMD), OUI 00-00-1A:
    Version: 1
    Feature Caps: 0x01
    Minimum Refresh Rate: 50 Hz
    Maximum Refresh Rate: 122 Hz
    Flags 1.x: 0xed (MCCS)
  Detailed Timing Descriptors:
    DTD 3:  2560x1080  120.000000 Hz  64:27   135.000 kHz    367.200000 MHz (690 mm x 291 mm)
                 Hfront   48 Hsync  64 Hback   48 Hpol P
                 Vfront    3 Vsync   5 Vback   37 Vpol P
    DTD 4:  1280x1080   59.999545 Hz  32:27    67.679 kHz    105.580000 MHz (690 mm x 291 mm)
                 Hfront   48 Hsync  32 Hback  200 Hpol P
                 Vfront    3 Vsync   5 Vback   40 Vpol P
    DTD 5:  2560x1080   75.000000 Hz  64:27    84.750 kHz    230.520000 MHz (690 mm x 291 mm)
                 Hfront   48 Hsync  32 Hback   80 Hpol P
                 Vfront    3 Vsync   5 Vback   42 Vpol P
Checksum: 0x78  Unused space in Extension Block: 23 bytes

----------------

Warnings:

Block 1, CTA-861 Extension Block:
  Video Data Block: VIC 1 and the first DTD are not identical. Is this intended?
  Video Data Block: All VICs are in ascending order, and the first (preferred) VIC <= 4, is that intended?
  Detailed Timing Descriptor #4: Image size is 690x291 mm, but based on the picture AR it should be 344x291 mm.
  Add a Colorimetry Data Block with the sRGB colorimetry bit set to avoid interop issues.
EDID:
  Base EDID: Some timings are out of range of the Monitor Ranges:
    Vertical Freq: 50.000 - 144.000 Hz (Monitor: 50.000 - 122.000 Hz)
    Horizontal Freq: 31.250 - 162.000 kHz (Monitor: 54.000 - 223.000 kHz)

Failures:

Block 1, CTA-861 Extension Block:
  Missing VCDB, needed for Set Selectable RGB Quantization to avoid interop issues.
EDID:
  Extension Block 2 started with EDID header, ignoring Extension Blocks >= 2.
  CTA-861: Native progressive timings are a mix of several resolutions.

EDID conformity: FAIL
