edid-decode (hex):

00 ff ff ff ff ff ff 00 4e 84 01 00 01 00 00 00
28 17 01 03 80 00 00 00 8a 00 13 a0 57 49 9b 26
10 48 4e af cf 00 45 4a 61 4c 81 80 81 8a 81 c0
81 4f 81 cf 81 40 2a 36 80 a0 70 38 1f 40 20 40
36 00 00 00 00 00 00 18 2d 39 90 30 62 1a 27 40
68 b0 36 00 00 00 00 00 00 1c 99 21 56 aa 51 00
20 30 46 8f 33 00 20 56 00 00 00 18 2f 26 40 a0
60 84 1a 30 30 20 35 00 00 00 00 00 00 1a 00 a8

00 ff ff ff ff ff ff 00 4e 84 01 00 01 00 00 00
28 17 01 03 80 00 00 00 8a 00 13 a0 57 49 9b 26
10 48 4e af cf 00 45 4a 61 4c 81 80 81 8a 81 c0
81 4f 81 cf 81 40 2a 36 80 a0 70 38 1f 40 20 40
36 00 00 00 00 00 00 18 2d 39 90 30 62 1a 27 40
68 b0 36 00 00 00 00 00 00 1c 99 21 56 aa 51 00
20 30 46 8f 33 00 20 56 00 00 00 18 2f 26 40 a0
60 84 1a 30 30 20 35 00 00 00 00 00 00 1a 00 a8

----------------

Block 0, Base EDID:
  EDID Structure Version & Revision: 1.3
  Vendor & Product Identification:
    Manufacturer: STD
    Model: 1
    Serial Number: ...
    Made in: week 40 of 2013
  Basic Display Parameters & Features:
    Digital display
    Image size is variable
    Gamma: 1.00
    DPMS levels: Standby
    RGB color display
    First detailed timing is the preferred timing
  Color Characteristics:
    Red  : 0.6250, 0.3398
    Green: 0.2851, 0.6054
    Blue : 0.1484, 0.0634
    White: 0.2812, 0.3076
  Established Timings I & II:
    IBM     :   720x400    70.081663 Hz   9:5     31.467 kHz     28.320000 MHz
    DMT 0x04:   640x480    59.940476 Hz   4:3     31.469 kHz     25.175000 MHz
    DMT 0x05:   640x480    72.808802 Hz   4:3     37.861 kHz     31.500000 MHz
    DMT 0x06:   640x480    75.000000 Hz   4:3     37.500 kHz     31.500000 MHz
    DMT 0x08:   800x600    56.250000 Hz   4:3     35.156 kHz     36.000000 MHz
    DMT 0x09:   800x600    60.316541 Hz   4:3     37.879 kHz     40.000000 MHz
    DMT 0x0a:   800x600    72.187572 Hz   4:3     48.077 kHz     50.000000 MHz
    DMT 0x0b:   800x600    75.000000 Hz   4:3     46.875 kHz     49.500000 MHz
    DMT 0x10:  1024x768    60.003840 Hz   4:3     48.363 kHz     65.000000 MHz
    DMT 0x11:  1024x768    70.069359 Hz   4:3     56.476 kHz     75.000000 MHz
    DMT 0x12:  1024x768    75.028582 Hz   4:3     60.023 kHz     78.750000 MHz
    DMT 0x24:  1280x1024   75.024675 Hz   5:4     79.976 kHz    135.000000 MHz
  Standard Timings:
    GTF     :   800x600    70.000000 Hz   4:3     43.750 kHz     45.500000 MHz
    DMT 0x11:  1024x768    70.069359 Hz   4:3     56.476 kHz     75.000000 MHz
    DMT 0x23:  1280x1024   60.019740 Hz   5:4     63.981 kHz    108.000000 MHz
    GTF     :  1280x1024   69.999805 Hz   5:4     74.620 kHz    128.943000 MHz
    DMT 0x55:  1280x720    60.000000 Hz  16:9     45.000 kHz     74.250000 MHz
    GTF     :  1280x960    74.999884 Hz   4:3     75.150 kHz    129.859000 MHz
    GTF     :  1280x720    74.999686 Hz  16:9     56.400 kHz     95.654000 MHz
    DMT 0x20:  1280x960    60.000000 Hz   4:3     60.000 kHz    108.000000 MHz
  Detailed Timing Descriptors:
    DTD 1:  1920x1080   60.003116 Hz  16:9     66.663 kHz    138.660000 MHz
                 Hfront   32 Hsync  64 Hback   64 Hpol N
                 Vfront    3 Vsync   6 Vback   22 Vpol N
    DTD 2:  1680x1050   60.003444 Hz  16:10    65.344 kHz    146.370000 MHz
                 Hfront  104 Hsync 176 Hback  280 Hpol N
                 Vfront    3 Vsync   6 Vback   30 Vpol P
    DTD 3:  1366x768    59.995815 Hz 683:384   47.997 kHz     86.010000 MHz (32 mm x 86 mm)
                 Hfront   70 Hsync 143 Hback  213 Hpol N
                 Vfront    3 Vsync   3 Vback   26 Vpol N
    DTD 4:  1600x900    59.978156 Hz  16:9     55.540 kHz     97.750000 MHz
                 Hfront   48 Hsync  32 Hback   80 Hpol P
                 Vfront    3 Vsync   5 Vback   18 Vpol N
Checksum: 0xa8

----------------

Block 1, Unknown EDID Extension Block 0x00:
  00 ff ff ff ff ff ff 00 4e 84 01 00 01 00 00 00 '........N.......'
  28 17 01 03 80 00 00 00 8a 00 13 a0 57 49 9b 26 '(...........WI.&'
  10 48 4e af cf 00 45 4a 61 4c 81 80 81 8a 81 c0 '.HN...EJaL......'
  81 4f 81 cf 81 40 2a 36 80 a0 70 38 1f 40 20 40 '.O...@*6..p8.@ @'
  36 00 00 00 00 00 00 18 2d 39 90 30 62 1a 27 40 '6.......-9.0b.'@'
  68 b0 36 00 00 00 00 00 00 1c 99 21 56 aa 51 00 'h.6........!V.Q.'
  20 30 46 8f 33 00 20 56 00 00 00 18 2f 26 40 a0 ' 0F.3. V..../&@.'
  60 84 1a 30 30 20 35 00 00 00 00 00 00 1a 00 a8 '`..00 5.........'
Checksum: 0xa8

----------------

Warnings:

Block 0, Base EDID:
  Vendor & Product Identification: The serial number is one of the known dummy values, it should probably be set to 0.
  Detailed Timing Descriptor #3: Dubious image size (32x86 mm is smaller than 100x100 mm).

Failures:

Block 0, Base EDID:
  Missing Display Product Name.
  Missing Display Range Limits Descriptor.
Block 1, Base EDID:
  Unknown Extension Block.
EDID:
  Base EDID: The DTD max image size is 32x86mm, but the display size is not specified anywhere.
  Base EDID: EDID specified 0 extension block(s), but found 1 extension block(s).

EDID conformity: FAIL
