edid-decode (hex):

00 ff ff ff ff ff ff 00 4e 84 01 00 00 00 00 00
1b 1c 01 03 80 21 16 78 0a d7 a5 a2 59 4a 96 24
14 50 54 ad 4f 00 d1 c0 b3 00 01 01 81 80 81 40
81 c0 01 01 01 01 56 5e 00 a0 a0 a0 29 50 30 20
35 00 c4 8e 21 00 00 1e 02 3a 80 18 71 38 2d 40
58 2c 45 00 10 09 00 00 00 1e 31 2e 40 00 62 84
22 30 58 a8 35 00 10 09 00 00 00 1c 00 00 00 fc
00 4c 45 44 0a 0a 0a 0a 0a 0a 0a 0a 0a 0a 01 bf

02 03 24 f2 4c 9f 90 14 13 12 1e 01 04 05 03 07
16 23 09 07 07 83 01 00 00 e2 00 4f 67 03 0c 00
10 00 38 2d 8c 0a d0 8a 20 e0 2d 10 10 3e 96 00
dd 0c 11 00 00 18 01 1d 80 18 71 1c 16 20 58 2c
25 00 dd 0c 11 00 00 9e 02 3a 80 18 71 38 2d 40
58 2c 45 00 dd 0c 11 00 00 1e 01 1d 80 d0 72 1c
16 20 10 2c 25 80 dd 0c 11 00 00 9e 02 3a 80 d0
72 38 2d 40 10 2c 45 80 dd 0c 11 00 00 1e 00 00

----------------

Block 0, Base EDID:
  EDID Structure Version & Revision: 1.3
  Vendor & Product Identification:
    Manufacturer: STD
    Model: 1
    Made in: week 27 of 2018
  Basic Display Parameters & Features:
    Digital display
    Maximum image size: 33 cm x 22 cm
    Gamma: 2.20
    RGB color display
    First detailed timing is the preferred timing
  Color Characteristics:
    Red  : 0.6357, 0.3486
    Green: 0.2900, 0.5888
    Blue : 0.1425, 0.0800
    White: 0.3134, 0.3291
  Established Timings I & II:
    IBM     :   720x400    70.081663 Hz   9:5     31.467 kHz     28.320000 MHz
    DMT 0x04:   640x480    59.940476 Hz   4:3     31.469 kHz     25.175000 MHz
    DMT 0x05:   640x480    72.808802 Hz   4:3     37.861 kHz     31.500000 MHz
    DMT 0x06:   640x480    75.000000 Hz   4:3     37.500 kHz     31.500000 MHz
    DMT 0x09:   800x600    60.316541 Hz   4:3     37.879 kHz     40.000000 MHz
    DMT 0x0b:   800x600    75.000000 Hz   4:3     46.875 kHz     49.500000 MHz
    DMT 0x10:  1024x768    60.003840 Hz   4:3     48.363 kHz     65.000000 MHz
    DMT 0x11:  1024x768    70.069359 Hz   4:3     56.476 kHz     75.000000 MHz
    DMT 0x12:  1024x768    75.028582 Hz   4:3     60.023 kHz     78.750000 MHz
    DMT 0x24:  1280x1024   75.024675 Hz   5:4     79.976 kHz    135.000000 MHz
  Standard Timings:
    DMT 0x52:  1920x1080   60.000000 Hz  16:9     67.500 kHz    148.500000 MHz
    DMT 0x3a:  1680x1050   59.954250 Hz  16:10    65.290 kHz    146.250000 MHz
    DMT 0x23:  1280x1024   60.019740 Hz   5:4     63.981 kHz    108.000000 MHz
    DMT 0x20:  1280x960    60.000000 Hz   4:3     60.000 kHz    108.000000 MHz
    DMT 0x55:  1280x720    60.000000 Hz  16:9     45.000 kHz     74.250000 MHz
  Detailed Timing Descriptors:
    DTD 1:  2560x1440   59.950550 Hz  16:9     88.787 kHz    241.500000 MHz (708 mm x 398 mm)
                 Hfront   48 Hsync  32 Hback   80 Hpol P
                 Vfront    3 Vsync   5 Vback   33 Vpol P
    DTD 2:  1920x1080   60.000000 Hz  16:9     67.500 kHz    148.500000 MHz (16 mm x 9 mm)
                 Hfront   88 Hsync  44 Hback  148 Hpol P
                 Vfront    4 Vsync   5 Vback   36 Vpol P
    DTD 3:  1600x900    59.946021 Hz  16:9     55.990 kHz    118.250000 MHz (16 mm x 9 mm)
                 Hfront   88 Hsync 168 Hback  256 Hpol N
                 Vfront    3 Vsync   5 Vback   26 Vpol P
    Display Product Name: 'LED'
  Extension blocks: 1
Checksum: 0xbf

----------------

Block 1, CTA-861 Extension Block:
  Revision: 3
  Underscans IT Video Formats by default
  Basic audio support
  Supports YCbCr 4:4:4
  Supports YCbCr 4:2:2
  Native DTDs: 2
  Video Data Block:
    VIC  31:  1920x1080   50.000000 Hz  16:9     56.250 kHz    148.500000 MHz (native)
    VIC  16:  1920x1080   60.000000 Hz  16:9     67.500 kHz    148.500000 MHz (native)
    VIC  20:  1920x1080i  50.000000 Hz  16:9     28.125 kHz     74.250000 MHz
    VIC  19:  1280x720    50.000000 Hz  16:9     37.500 kHz     74.250000 MHz
    VIC  18:   720x576    50.000000 Hz  16:9     31.250 kHz     27.000000 MHz
    VIC  30:  1440x576    50.000000 Hz  16:9     31.250 kHz     54.000000 MHz
    VIC   1:   640x480    59.940476 Hz   4:3     31.469 kHz     25.175000 MHz
    VIC   4:  1280x720    60.000000 Hz  16:9     45.000 kHz     74.250000 MHz
    VIC   5:  1920x1080i  60.000000 Hz  16:9     33.750 kHz     74.250000 MHz
    VIC   3:   720x480    59.940060 Hz  16:9     31.469 kHz     27.000000 MHz
    VIC   7:  1440x480i   59.940060 Hz  16:9     15.734 kHz     27.000000 MHz
    VIC  22:  1440x576i   50.000000 Hz  16:9     15.625 kHz     27.000000 MHz
  Audio Data Block:
    Linear PCM:
      Max channels: 2
      Supported sample rates (kHz): 48 44.1 32
      Supported sample sizes (bits): 24 20 16
  Speaker Allocation Data Block:
    FL/FR - Front Left/Right
  Video Capability Data Block:
    YCbCr quantization: No Data
    RGB quantization: Selectable (via AVI Q)
    PT scan behavior: No Data
    IT scan behavior: Supports both over- and underscan
    CE scan behavior: Supports both over- and underscan
  Vendor-Specific Data Block (HDMI), OUI 00-0C-03:
    Source physical address: 1.0.0.0
    DC_36bit
    DC_30bit
    DC_Y444
    Maximum TMDS clock: 225 MHz
  Detailed Timing Descriptors:
    DTD 4:   720x480    59.940060 Hz   3:2     31.469 kHz     27.000000 MHz (477 mm x 268 mm)
                 Hfront   16 Hsync  62 Hback   60 Hpol N
                 Vfront    9 Vsync   6 Vback   30 Vpol N
    DTD 5:  1920x1080i  60.000000 Hz  16:9     33.750 kHz     74.250000 MHz (477 mm x 268 mm)
                 Hfront   88 Hsync  44 Hback  148 Hpol P
                 Vfront    2 Vsync   5 Vback   15 Vpol P Vfront +0.5 Odd Field
                 Vfront    2 Vsync   5 Vback   15 Vpol P Vback  +0.5 Even Field
    DTD 6:  1920x1080   60.000000 Hz  16:9     67.500 kHz    148.500000 MHz (477 mm x 268 mm)
                 Hfront   88 Hsync  44 Hback  148 Hpol P
                 Vfront    4 Vsync   5 Vback   36 Vpol P
    DTD 7:  1920x1080i  50.000000 Hz  16:9     28.125 kHz     74.250000 MHz (477 mm x 268 mm)
                 Hfront  528 Hsync  44 Hback  148 Hpol P
                 Vfront    2 Vsync   5 Vback   15 Vpol P Vfront +0.5 Odd Field
                 Vfront    2 Vsync   5 Vback   15 Vpol P Vback  +0.5 Even Field
    DTD 8:  1920x1080   50.000000 Hz  16:9     56.250 kHz    148.500000 MHz (477 mm x 268 mm)
                 Hfront  528 Hsync  44 Hback  148 Hpol P
                 Vfront    4 Vsync   5 Vback   36 Vpol P
Checksum: 0x00  Unused space in Extension Block: 1 byte

----------------

Warnings:

Block 0, Base EDID:
  Detailed Timing Descriptor #2: Dubious image size (16x9 mm is smaller than 100x100 mm).
  Detailed Timing Descriptor #3: Dubious image size (16x9 mm is smaller than 100x100 mm).
Block 1, CTA-861 Extension Block:
  Video Data Block: VIC 31 and the first DTD are not identical. Is this intended?
  Video Capability Data Block: Set Selectable YCbCr Quantization to avoid interop issues.
  Detailed Timing Descriptor #4: Image size is 477x268 mm, but based on the picture AR it should be 402x268 mm.
  Add a Colorimetry Data Block with the sRGB colorimetry bit set to avoid interop issues.

Failures:

Block 0, Base EDID:
  Detailed Timing Descriptor #1: Mismatch of image size 708x398 mm vs display size 330x220 mm.
  Detailed Timing Descriptor #2: Mismatch of image size 16x9 mm vs display size 330x220 mm.
  Detailed Timing Descriptor #3: Mismatch of image size 16x9 mm vs display size 330x220 mm.
  Display Product Name: Non-space after newline.
  Missing Display Range Limits Descriptor.
Block 1, CTA-861 Extension Block:
  Detailed Timing Descriptor #4: Mismatch of image size 477x268 mm vs display size 330x220 mm.
  Detailed Timing Descriptor #5: Mismatch of image size 477x268 mm vs display size 330x220 mm.
  Detailed Timing Descriptor #6: Mismatch of image size 477x268 mm vs display size 330x220 mm.
  Detailed Timing Descriptor #7: Mismatch of image size 477x268 mm vs display size 330x220 mm.
  Detailed Timing Descriptor #8: Mismatch of image size 477x268 mm vs display size 330x220 mm.
EDID:
  Base EDID: The DTD max image size is 708x398mm, which is larger than the display size 330.0x220.0mm.
  CTA-861: The maximum HDMI TMDS clock is 225000 kHz, but one or more video timings go up to 241500 kHz.
  CTA-861: Native progressive timings are a mix of several resolutions.

EDID conformity: FAIL
