edid-decode (hex):

00 ff ff ff ff ff ff 00 22 f0 1b 32 01 01 01 01
0b 1a 01 03 80 47 28 78 2a 87 d5 a8 55 4d 9f 25
0e 50 54 21 08 00 d1 c0 a9 c0 81 c0 d1 00 b3 00
95 00 a9 40 81 80 04 74 00 30 f2 70 5a 80 b0 58
8a 00 c4 8f 21 00 00 1a 00 00 00 fd 00 18 3c 1b
64 1e 00 0a 20 20 20 20 20 20 00 00 00 fc 00 48
50 20 53 70 65 63 74 72 65 20 33 32 00 00 00 ff
00 43 4e 43 36 31 31 30 33 50 4c 0a 20 20 01 e6

02 03 2c f1 4f 10 1f 04 13 03 12 02 11 01 00 00
00 00 00 00 23 09 07 07 83 01 00 00 6c 03 0c 00
20 00 30 3c 20 00 40 01 03 e2 00 2b 56 5e 00 a0
a0 a0 29 50 30 20 35 00 c4 8f 21 00 00 1a ef 51
00 a0 f0 70 19 80 30 20 35 00 c4 8f 21 00 00 1a
b3 39 00 a0 80 38 1f 40 30 20 3a 00 c4 8f 21 00
00 1a 28 3c 80 a0 70 b0 23 40 30 20 36 00 c4 8f
21 00 00 1a 00 00 00 00 00 00 00 00 00 00 00 08

00 ff ff ff ff ff ff 00 22 f0 1b 32 01 01 01 01
0b 1a 01 03 80 47 28 78 2a 87 d5 a8 55 4d 9f 25
0e 50 54 21 08 00 d1 c0 a9 c0 81 c0 d1 00 b3 00
95 00 a9 40 81 80 04 74 00 30 f2 70 5a 80 b0 58
8a 00 c4 8f 21 00 00 1a 00 00 00 fd 00 18 3c 1b
64 1e 00 0a 20 20 20 20 20 20 00 00 00 fc 00 48
50 20 53 70 65 63 74 72 65 20 33 32 00 00 00 ff
00 43 4e 43 36 31 31 30 33 50 4c 0a 20 20 01 e6

02 03 2c f1 4f 10 1f 04 13 03 12 02 11 01 00 00
00 00 00 00 23 09 07 07 83 01 00 00 6c 03 0c 00
20 00 30 3c 20 00 40 01 03 e2 00 2b 56 5e 00 a0
a0 a0 29 50 30 20 35 00 c4 8f 21 00 00 1a ef 51
00 a0 f0 70 19 80 30 20 35 00 c4 8f 21 00 00 1a
b3 39 00 a0 80 38 1f 40 30 20 3a 00 c4 8f 21 00
00 1a 28 3c 80 a0 70 b0 23 40 30 20 36 00 c4 8f
21 00 00 1a 00 00 00 00 00 00 00 00 00 00 00 08

----------------

Block 0, Base EDID:
  EDID Structure Version & Revision: 1.3
  Vendor & Product Identification:
    Manufacturer: HWP
    Model: 12827
    Serial Number: ...
    Made in: week 11 of 2016
  Basic Display Parameters & Features:
    Digital display
    Maximum image size: 71 cm x 40 cm
    Gamma: 2.20
    DPMS levels: Off
    RGB color display
    First detailed timing is the preferred timing
  Color Characteristics:
    Red  : 0.6582, 0.3320
    Green: 0.3017, 0.6240
    Blue : 0.1474, 0.0556
    White: 0.3134, 0.3291
  Established Timings I & II:
    DMT 0x04:   640x480    59.940476 Hz   4:3     31.469 kHz     25.175000 MHz
    DMT 0x09:   800x600    60.316541 Hz   4:3     37.879 kHz     40.000000 MHz
    DMT 0x10:  1024x768    60.003840 Hz   4:3     48.363 kHz     65.000000 MHz
  Standard Timings:
    DMT 0x52:  1920x1080   60.000000 Hz  16:9     67.500 kHz    148.500000 MHz
    DMT 0x53:  1600x900    60.000000 Hz  16:9     60.000 kHz    108.000000 MHz (RB)
    DMT 0x55:  1280x720    60.000000 Hz  16:9     45.000 kHz     74.250000 MHz
    DMT 0x45:  1920x1200   59.884600 Hz  16:10    74.556 kHz    193.250000 MHz
    DMT 0x3a:  1680x1050   59.954250 Hz  16:10    65.290 kHz    146.250000 MHz
    DMT 0x2f:  1440x900    59.887445 Hz  16:10    55.935 kHz    106.500000 MHz
    DMT 0x33:  1600x1200   60.000000 Hz   4:3     75.000 kHz    162.000000 MHz
    DMT 0x23:  1280x1024   60.019740 Hz   5:4     63.981 kHz    108.000000 MHz
  Detailed Timing Descriptors:
    DTD 1:  3840x2160   30.000000 Hz  16:9     67.500 kHz    297.000000 MHz (708 mm x 399 mm)
                 Hfront  176 Hsync  88 Hback  296 Hpol P
                 Vfront    8 Vsync  10 Vback   72 Vpol N
    Display Range Limits:
      Monitor ranges (GTF): 24-60 Hz V, 27-100 kHz H, max dotclock 300 MHz
    Display Product Name: 'HP Spectre 32'
    Display Product Serial Number: ...
  Extension blocks: 1
Checksum: 0xe6

----------------

Block 1, CTA-861 Extension Block:
  Revision: 3
  Underscans IT Video Formats by default
  Basic audio support
  Supports YCbCr 4:4:4
  Supports YCbCr 4:2:2
  Native detailed modes: 1
  Video Data Block:
    VIC  16:  1920x1080   60.000000 Hz  16:9     67.500 kHz    148.500000 MHz
    VIC  31:  1920x1080   50.000000 Hz  16:9     56.250 kHz    148.500000 MHz
    VIC   4:  1280x720    60.000000 Hz  16:9     45.000 kHz     74.250000 MHz
    VIC  19:  1280x720    50.000000 Hz  16:9     37.500 kHz     74.250000 MHz
    VIC   3:   720x480    59.940060 Hz  16:9     31.469 kHz     27.000000 MHz
    VIC  18:   720x576    50.000000 Hz  16:9     31.250 kHz     27.000000 MHz
    VIC   2:   720x480    59.940060 Hz   4:3     31.469 kHz     27.000000 MHz
    VIC  17:   720x576    50.000000 Hz   4:3     31.250 kHz     27.000000 MHz
    VIC   1:   640x480    59.940476 Hz   4:3     31.469 kHz     25.175000 MHz
  Audio Data Block:
    Linear PCM:
      Max channels: 2
      Supported sample rates (kHz): 48 44.1 32
      Supported sample sizes (bits): 24 20 16
  Speaker Allocation Data Block:
    FL/FR - Front Left/Right
  Vendor-Specific Data Block (HDMI), OUI 00-0C-03:
    Source physical address: 2.0.0.0
    DC_36bit
    DC_30bit
    Maximum TMDS clock: 300 MHz
    Extended HDMI video details:
      HDMI VICs:
        HDMI VIC 1:  3840x2160   30.000000 Hz  16:9     67.500 kHz    297.000000 MHz
        HDMI VIC 3:  3840x2160   24.000000 Hz  16:9     54.000 kHz    297.000000 MHz
  Video Capability Data Block:
    YCbCr quantization: No Data
    RGB quantization: No Data
    PT scan behavior: Always Underscanned
    IT scan behavior: Always Underscanned
    CE scan behavior: Supports both over- and underscan
  Detailed Timing Descriptors:
    DTD 2:  2560x1440   59.950550 Hz  16:9     88.787 kHz    241.500000 MHz (708 mm x 399 mm)
                 Hfront   48 Hsync  32 Hback   80 Hpol P
                 Vfront    3 Vsync   5 Vback   33 Vpol N
    DTD 3:  3840x2160   23.998856 Hz  16:9     52.438 kHz    209.750000 MHz (708 mm x 399 mm)
                 Hfront   48 Hsync  32 Hback   80 Hpol P
                 Vfront    3 Vsync   5 Vback   17 Vpol N
    DTD 4:  2048x1080   60.213902 Hz 256:135   66.898 kHz    147.710000 MHz (708 mm x 399 mm)
                 Hfront   48 Hsync  32 Hback   80 Hpol P
                 Vfront    3 Vsync  10 Vback   18 Vpol N
    DTD 5:  1920x1200   59.950171 Hz  16:10    74.038 kHz    154.000000 MHz (708 mm x 399 mm)
                 Hfront   48 Hsync  32 Hback   80 Hpol P
                 Vfront    3 Vsync   6 Vback   26 Vpol N
Checksum: 0x08  Unused space in Extension Block: 11 bytes

----------------

Block 2, Unknown EDID Extension Block 0x00:
  00 ff ff ff ff ff ff 00 22 f0 1b 32 01 01 01 01 '........"..2....'
  0b 1a 01 03 80 47 28 78 2a 87 d5 a8 55 4d 9f 25 '.....G(x*...UM.%'
  0e 50 54 21 08 00 d1 c0 a9 c0 81 c0 d1 00 b3 00 '.PT!............'
  95 00 a9 40 81 80 04 74 00 30 f2 70 5a 80 b0 58 '...@...t.0.pZ..X'
  8a 00 c4 8f 21 00 00 1a 00 00 00 fd 00 18 3c 1b '....!.........<.'
  64 1e 00 0a 20 20 20 20 20 20 00 00 00 fc 00 48 'd...      .....H'
  50 20 53 70 65 63 74 72 65 20 33 32 00 00 00 ff 'P Spectre 32....'
  00 43 4e 43 36 31 31 30 33 50 4c 0a 20 20 01 e6 '.CNC61103PL.  ..'
Checksum: 0xe6

----------------

Block 3, CTA-861 Extension Block:
  Revision: 3
  Underscans IT Video Formats by default
  Basic audio support
  Supports YCbCr 4:4:4
  Supports YCbCr 4:2:2
  Native detailed modes: 1
  Video Data Block:
    VIC  16:  1920x1080   60.000000 Hz  16:9     67.500 kHz    148.500000 MHz
    VIC  31:  1920x1080   50.000000 Hz  16:9     56.250 kHz    148.500000 MHz
    VIC   4:  1280x720    60.000000 Hz  16:9     45.000 kHz     74.250000 MHz
    VIC  19:  1280x720    50.000000 Hz  16:9     37.500 kHz     74.250000 MHz
    VIC   3:   720x480    59.940060 Hz  16:9     31.469 kHz     27.000000 MHz
    VIC  18:   720x576    50.000000 Hz  16:9     31.250 kHz     27.000000 MHz
    VIC   2:   720x480    59.940060 Hz   4:3     31.469 kHz     27.000000 MHz
    VIC  17:   720x576    50.000000 Hz   4:3     31.250 kHz     27.000000 MHz
    VIC   1:   640x480    59.940476 Hz   4:3     31.469 kHz     25.175000 MHz
  Audio Data Block:
    Linear PCM:
      Max channels: 2
      Supported sample rates (kHz): 48 44.1 32
      Supported sample sizes (bits): 24 20 16
  Speaker Allocation Data Block:
    FL/FR - Front Left/Right
  Vendor-Specific Data Block (HDMI), OUI 00-0C-03:
    Source physical address: 2.0.0.0
    DC_36bit
    DC_30bit
    Maximum TMDS clock: 300 MHz
    Extended HDMI video details:
      HDMI VICs:
        HDMI VIC 1:  3840x2160   30.000000 Hz  16:9     67.500 kHz    297.000000 MHz
        HDMI VIC 3:  3840x2160   24.000000 Hz  16:9     54.000 kHz    297.000000 MHz
  Video Capability Data Block:
    YCbCr quantization: No Data
    RGB quantization: No Data
    PT scan behavior: Always Underscanned
    IT scan behavior: Always Underscanned
    CE scan behavior: Supports both over- and underscan
  Detailed Timing Descriptors:
    DTD 6:  2560x1440   59.950550 Hz  16:9     88.787 kHz    241.500000 MHz (708 mm x 399 mm)
                 Hfront   48 Hsync  32 Hback   80 Hpol P
                 Vfront    3 Vsync   5 Vback   33 Vpol N
    DTD 7:  3840x2160   23.998856 Hz  16:9     52.438 kHz    209.750000 MHz (708 mm x 399 mm)
                 Hfront   48 Hsync  32 Hback   80 Hpol P
                 Vfront    3 Vsync   5 Vback   17 Vpol N
    DTD 8:  2048x1080   60.213902 Hz 256:135   66.898 kHz    147.710000 MHz (708 mm x 399 mm)
                 Hfront   48 Hsync  32 Hback   80 Hpol P
                 Vfront    3 Vsync  10 Vback   18 Vpol N
    DTD 9:  1920x1200   59.950171 Hz  16:10    74.038 kHz    154.000000 MHz (708 mm x 399 mm)
                 Hfront   48 Hsync  32 Hback   80 Hpol P
                 Vfront    3 Vsync   6 Vback   26 Vpol N
Checksum: 0x08  Unused space in Extension Block: 11 bytes

----------------

Warnings:

Block 0, Base EDID:
  Vendor & Product Identification: The serial number is one of the known dummy values, it should probably be set to 0.
  Detailed Timing Descriptor #1: DTD is similar but not identical to VIC 95.
Block 1, CTA-861 Extension Block:
  Video Data Block: VIC 16 and the first DTD are not identical. Is this intended?
  Video Capability Data Block: Set Selectable YCbCr Quantization to avoid interop issues.
  Detailed Timing Descriptor #4: Image size is 708x399 mm, but based on the picture AR it should be 708x373 mm.
  Detailed Timing Descriptor #5: Image size is 708x399 mm, but based on the picture AR it should be 708x442 mm.
  Display Product Serial Number is set, so the Serial Number in the Base EDID should be 0.
  Add a Colorimetry Data Block with the sRGB colorimetry bit set to avoid interop issues.
Block 3, CTA-861 Extension Block:
  Video Capability Data Block: Set Selectable YCbCr Quantization to avoid interop issues.
  Detailed Timing Descriptor #8: Image size is 708x399 mm, but based on the picture AR it should be 708x373 mm.
  Detailed Timing Descriptor #9: Image size is 708x399 mm, but based on the picture AR it should be 708x442 mm.

Failures:

Block 1, CTA-861 Extension Block:
  Vendor-Specific Data Block (HDMI), OUI 00-0C-03: HDMI VIC Codes must have their CTA-861 VIC equivalents in the VSB.
  Video Capability Data Block: Set Selectable RGB Quantization to avoid interop issues.
Block 2, Base EDID:
  Unknown Extension Block.
Block 3, CTA-861 Extension Block:
  Video Data Block: Duplicate VIC 16.
  Video Data Block: Duplicate VIC 31.
  Video Data Block: Duplicate VIC 4.
  Video Data Block: Duplicate VIC 19.
  Video Data Block: Duplicate VIC 3.
  Video Data Block: Duplicate VIC 18.
  Video Data Block: Duplicate VIC 2.
  Video Data Block: Duplicate VIC 17.
  Video Data Block: Duplicate VIC 1.
  Speaker Allocation Data Block: Only one instance of this Data Block is allowed.
  Vendor-Specific Data Block (HDMI), OUI 00-0C-03: HDMI VIC Codes must have their CTA-861 VIC equivalents in the VSB.
  Video Capability Data Block: Only one instance of this Data Block is allowed.
  Video Capability Data Block: Set Selectable RGB Quantization to avoid interop issues.
EDID:
  Base EDID: EDID specified 1 extension block(s), but found 3 extension block(s).
  Base EDID: EDID 1.3 requires a Block Map Extension in Block 1 if there are more than 2 blocks in the EDID.

EDID conformity: FAIL
