edid-decode (hex):

00 ff ff ff ff ff ff 00 04 72 de 03 8c 03 20 61
0c 1a 01 03 80 30 1b 78 ee 43 f5 a7 56 53 9c 26
10 50 54 b3 0c 00 71 4f 81 80 81 c0 81 00 95 00
b3 00 d1 c0 01 01 02 3a 80 18 71 38 2d 40 58 2c
45 00 dc 0b 11 00 00 1e 00 00 00 fd 00 38 4b 1f
4b 12 00 0a 20 20 20 20 20 20 00 00 00 fc 00 47
32 32 37 48 51 4c 0a 20 20 20 20 20 00 00 00 ff
00 54 30 4c 45 45 30 31 35 32 34 33 31 0a 01 69

02 03 1c f1 49 90 01 03 04 12 13 1f 05 14 03 09
07 07 03 01 00 00 65 03 0c 00 10 00 02 3a 80 18
71 38 2d 40 58 2c 45 00 0f 28 21 00 00 1e 01 1d
00 72 51 d0 1e 20 6e 28 55 00 0f 28 21 00 00 1e
8c 0a d0 8a 20 e0 2d 10 10 3e 96 00 0f 28 21 00
00 18 d6 09 80 a0 20 e0 2d 10 08 60 22 00 0f 28
21 08 08 18 00 00 00 00 00 00 00 00 00 00 00 00
00 00 00 00 00 00 00 00 00 00 00 00 00 00 00 ce

00 ff ff ff ff ff ff 00 04 72 de 03 8c 03 20 61
0c 1a 01 03 80 30 1b 78 ee 43 f5 a7 56 53 9c 26
10 50 54 b3 0c 00 71 4f 81 80 81 c0 81 00 95 00
b3 00 d1 c0 01 01 02 3a 80 18 71 38 2d 40 58 2c
45 00 dc 0b 11 00 00 1e 00 00 00 fd 00 38 4b 1f
4b 12 00 0a 20 20 20 20 20 20 00 00 00 fc 00 47
32 32 37 48 51 4c 0a 20 20 20 20 20 00 00 00 ff
00 54 30 4c 45 45 30 31 35 32 34 33 31 0a 01 69

02 03 1c f1 49 90 01 03 04 12 13 1f 05 14 03 09
07 07 03 01 00 00 65 03 0c 00 10 00 02 3a 80 18
71 38 2d 40 58 2c 45 00 0f 28 21 00 00 1e 01 1d
00 72 51 d0 1e 20 6e 28 55 00 0f 28 21 00 00 1e
8c 0a d0 8a 20 e0 2d 10 10 3e 96 00 0f 28 21 00
00 18 d6 09 80 a0 20 e0 2d 10 08 60 22 00 0f 28
21 08 08 18 00 00 00 00 00 00 00 00 00 00 00 00
00 00 00 00 00 00 00 00 00 00 00 00 00 00 00 ce

----------------

Block 0, Base EDID:
  EDID Structure Version & Revision: 1.3
  Vendor & Product Identification:
    Manufacturer: ACR
    Model: 990
    Serial Number: ...
    Made in: week 12 of 2016
  Basic Display Parameters & Features:
    Digital display
    Maximum image size: 48 cm x 27 cm
    Gamma: 2.20
    DPMS levels: Standby Suspend Off
    RGB color display
    Default (sRGB) color space is primary color space
    First detailed timing is the preferred timing
  Color Characteristics:
    Red  : 0.6533, 0.3359
    Green: 0.3242, 0.6123
    Blue : 0.1513, 0.0654
    White: 0.3134, 0.3291
  Established Timings I & II:
    IBM     :   720x400    70.081663 Hz   9:5     31.467 kHz     28.320000 MHz
    DMT 0x04:   640x480    59.940476 Hz   4:3     31.469 kHz     25.175000 MHz
    Apple   :   640x480    66.666667 Hz   4:3     35.000 kHz     30.240000 MHz
    DMT 0x08:   800x600    56.250000 Hz   4:3     35.156 kHz     36.000000 MHz
    DMT 0x09:   800x600    60.316541 Hz   4:3     37.879 kHz     40.000000 MHz
    DMT 0x10:  1024x768    60.003840 Hz   4:3     48.363 kHz     65.000000 MHz
    DMT 0x11:  1024x768    70.069359 Hz   4:3     56.476 kHz     75.000000 MHz
  Standard Timings:
    DMT 0x15:  1152x864    75.000000 Hz   4:3     67.500 kHz    108.000000 MHz
    DMT 0x23:  1280x1024   60.019740 Hz   5:4     63.981 kHz    108.000000 MHz
    DMT 0x55:  1280x720    60.000000 Hz  16:9     45.000 kHz     74.250000 MHz
    DMT 0x1c:  1280x800    59.810326 Hz  16:10    49.702 kHz     83.500000 MHz
    DMT 0x2f:  1440x900    59.887445 Hz  16:10    55.935 kHz    106.500000 MHz
    DMT 0x3a:  1680x1050   59.954250 Hz  16:10    65.290 kHz    146.250000 MHz
    DMT 0x52:  1920x1080   60.000000 Hz  16:9     67.500 kHz    148.500000 MHz
  Detailed Timing Descriptors:
    DTD 1:  1920x1080   60.000000 Hz  16:9     67.500 kHz    148.500000 MHz (476 mm x 267 mm)
                 Hfront   88 Hsync  44 Hback  148 Hpol P
                 Vfront    4 Vsync   5 Vback   36 Vpol P
    Display Range Limits:
      Monitor ranges (GTF): 56-75 Hz V, 31-75 kHz H, max dotclock 180 MHz
    Display Product Name: 'G227HQL'
    Display Product Serial Number: ...
  Extension blocks: 1
Checksum: 0x69

----------------

Block 1, CTA-861 Extension Block:
  Revision: 3
  Underscans IT Video Formats by default
  Basic audio support
  Supports YCbCr 4:4:4
  Supports YCbCr 4:2:2
  Native detailed modes: 1
  Video Data Block:
    VIC  16:  1920x1080   60.000000 Hz  16:9     67.500 kHz    148.500000 MHz (native)
    VIC   1:   640x480    59.940476 Hz   4:3     31.469 kHz     25.175000 MHz
    VIC   3:   720x480    59.940060 Hz  16:9     31.469 kHz     27.000000 MHz
    VIC   4:  1280x720    60.000000 Hz  16:9     45.000 kHz     74.250000 MHz
    VIC  18:   720x576    50.000000 Hz  16:9     31.250 kHz     27.000000 MHz
    VIC  19:  1280x720    50.000000 Hz  16:9     37.500 kHz     74.250000 MHz
    VIC  31:  1920x1080   50.000000 Hz  16:9     56.250 kHz    148.500000 MHz
    VIC   5:  1920x1080i  60.000000 Hz  16:9     33.750 kHz     74.250000 MHz
    VIC  20:  1920x1080i  50.000000 Hz  16:9     28.125 kHz     74.250000 MHz
  Unknown CTA-861 Data Block (tag 0x00, length 3):
    09 07 07                                        '...'
  Unknown CTA-861 Data Block (tag 0x00, length 3):
    01 00 00                                        '...'
  Vendor-Specific Data Block (HDMI), OUI 00-0C-03:
    Source physical address: 1.0.0.0
  Detailed Timing Descriptors:
    DTD 2:  1920x1080   60.000000 Hz  16:9     67.500 kHz    148.500000 MHz (527 mm x 296 mm)
                 Hfront   88 Hsync  44 Hback  148 Hpol P
                 Vfront    4 Vsync   5 Vback   36 Vpol P
    DTD 3:  1280x720    60.000000 Hz  16:9     45.000 kHz     74.250000 MHz (527 mm x 296 mm)
                 Hfront  110 Hsync  40 Hback  220 Hpol P
                 Vfront    5 Vsync   5 Vback   20 Vpol P
    DTD 4:   720x480    59.940060 Hz   3:2     31.469 kHz     27.000000 MHz (527 mm x 296 mm)
                 Hfront   16 Hsync  62 Hback   60 Hpol N
                 Vfront    9 Vsync   6 Vback   30 Vpol N
    DTD 5:   640x480    59.952381 Hz   4:3     31.475 kHz     25.180000 MHz (527 mm x 296 mm)
                 Hfront    8 Hsync  96 Hback   40 Hpol N Hborder 8
                 Vfront    2 Vsync   2 Vback   25 Vpol N Vborder 8
Checksum: 0xce  Unused space in Extension Block: 27 bytes

----------------

Block 2, Unknown EDID Extension Block 0x00:
  00 ff ff ff ff ff ff 00 04 72 de 03 8c 03 20 61 '.........r.... a'
  0c 1a 01 03 80 30 1b 78 ee 43 f5 a7 56 53 9c 26 '.....0.x.C..VS.&'
  10 50 54 b3 0c 00 71 4f 81 80 81 c0 81 00 95 00 '.PT...qO........'
  b3 00 d1 c0 01 01 02 3a 80 18 71 38 2d 40 58 2c '.......:..q8-@X,'
  45 00 dc 0b 11 00 00 1e 00 00 00 fd 00 38 4b 1f 'E............8K.'
  4b 12 00 0a 20 20 20 20 20 20 00 00 00 fc 00 47 'K...      .....G'
  32 32 37 48 51 4c 0a 20 20 20 20 20 00 00 00 ff '227HQL.     ....'
  00 54 30 4c 45 45 30 31 35 32 34 33 31 0a 01 69 '.T0LEE0152431..i'
Checksum: 0x69

----------------

Block 3, CTA-861 Extension Block:
  Revision: 3
  Underscans IT Video Formats by default
  Basic audio support
  Supports YCbCr 4:4:4
  Supports YCbCr 4:2:2
  Native detailed modes: 1
  Video Data Block:
    VIC  16:  1920x1080   60.000000 Hz  16:9     67.500 kHz    148.500000 MHz (native)
    VIC   1:   640x480    59.940476 Hz   4:3     31.469 kHz     25.175000 MHz
    VIC   3:   720x480    59.940060 Hz  16:9     31.469 kHz     27.000000 MHz
    VIC   4:  1280x720    60.000000 Hz  16:9     45.000 kHz     74.250000 MHz
    VIC  18:   720x576    50.000000 Hz  16:9     31.250 kHz     27.000000 MHz
    VIC  19:  1280x720    50.000000 Hz  16:9     37.500 kHz     74.250000 MHz
    VIC  31:  1920x1080   50.000000 Hz  16:9     56.250 kHz    148.500000 MHz
    VIC   5:  1920x1080i  60.000000 Hz  16:9     33.750 kHz     74.250000 MHz
    VIC  20:  1920x1080i  50.000000 Hz  16:9     28.125 kHz     74.250000 MHz
  Unknown CTA-861 Data Block (tag 0x00, length 3):
    09 07 07                                        '...'
  Unknown CTA-861 Data Block (tag 0x00, length 3):
    01 00 00                                        '...'
  Vendor-Specific Data Block (HDMI), OUI 00-0C-03:
    Source physical address: 1.0.0.0
  Detailed Timing Descriptors:
    DTD 6:  1920x1080   60.000000 Hz  16:9     67.500 kHz    148.500000 MHz (527 mm x 296 mm)
                 Hfront   88 Hsync  44 Hback  148 Hpol P
                 Vfront    4 Vsync   5 Vback   36 Vpol P
    DTD 7:  1280x720    60.000000 Hz  16:9     45.000 kHz     74.250000 MHz (527 mm x 296 mm)
                 Hfront  110 Hsync  40 Hback  220 Hpol P
                 Vfront    5 Vsync   5 Vback   20 Vpol P
    DTD 8:   720x480    59.940060 Hz   3:2     31.469 kHz     27.000000 MHz (527 mm x 296 mm)
                 Hfront   16 Hsync  62 Hback   60 Hpol N
                 Vfront    9 Vsync   6 Vback   30 Vpol N
    DTD 9:   640x480    59.952381 Hz   4:3     31.475 kHz     25.180000 MHz (527 mm x 296 mm)
                 Hfront    8 Hsync  96 Hback   40 Hpol N Hborder 8
                 Vfront    2 Vsync   2 Vback   25 Vpol N Vborder 8
Checksum: 0xce  Unused space in Extension Block: 27 bytes

----------------

Warnings:

Block 1, CTA-861 Extension Block:
  Unknown CTA-861 Data Block (tag 0x00, length 3).
  Unknown CTA-861 Data Block (tag 0x00, length 3).
  Detailed Timing Descriptor #4: Image size is 527x296 mm, but based on the picture AR it should be 527x351 mm.
  Detailed Timing Descriptor #5: Image size is 527x296 mm, but based on the picture AR it should be 527x395 mm.
  Detailed Timing Descriptor #5: The use of non-zero borders in a DTD is not recommended.
  Display Product Serial Number is set, so the Serial Number in the Base EDID should be 0.
Block 3, CTA-861 Extension Block:
  Unknown CTA-861 Data Block (tag 0x00, length 3).
  Unknown CTA-861 Data Block (tag 0x00, length 3).
  Detailed Timing Descriptor #8: Image size is 527x296 mm, but based on the picture AR it should be 527x351 mm.
  Detailed Timing Descriptor #9: Image size is 527x296 mm, but based on the picture AR it should be 527x395 mm.
  Detailed Timing Descriptor #9: The use of non-zero borders in a DTD is not recommended.
EDID:
  Base EDID: Some timings are out of range of the Monitor Ranges:
    Vertical Freq: 50.000 - 75.000 Hz (Monitor: 56.000 - 75.000 Hz)
    Horizontal Freq: 28.125 - 67.500 kHz (Monitor: 31.000 - 75.000 kHz)
  CTA-861: Multiple native progressive timings are defined.

Failures:

Block 0, Base EDID:
  Basic Display Parameters & Features: sRGB is signaled, but the chromaticities do not match.
Block 1, CTA-861 Extension Block:
  Detailed Timing Descriptor #2: Mismatch of image size 527x296 mm vs display size 480x270 mm.
  Detailed Timing Descriptor #3: Mismatch of image size 527x296 mm vs display size 480x270 mm.
  Detailed Timing Descriptor #4: Mismatch of image size 527x296 mm vs display size 480x270 mm.
  Detailed Timing Descriptor #5: Mismatch of image size 527x296 mm vs display size 480x270 mm.
  Missing VCDB, needed for Set Selectable RGB Quantization to avoid interop issues.
Block 2, Base EDID:
  Unknown Extension Block.
Block 3, CTA-861 Extension Block:
  Video Data Block: Duplicate VIC 16.
  Video Data Block: Duplicate VIC 1.
  Video Data Block: Duplicate VIC 3.
  Video Data Block: Duplicate VIC 4.
  Video Data Block: Duplicate VIC 18.
  Video Data Block: Duplicate VIC 19.
  Video Data Block: Duplicate VIC 31.
  Video Data Block: Duplicate VIC 5.
  Video Data Block: Duplicate VIC 20.
  Detailed Timing Descriptor #6: Mismatch of image size 527x296 mm vs display size 480x270 mm.
  Detailed Timing Descriptor #7: Mismatch of image size 527x296 mm vs display size 480x270 mm.
  Detailed Timing Descriptor #8: Mismatch of image size 527x296 mm vs display size 480x270 mm.
  Detailed Timing Descriptor #9: Mismatch of image size 527x296 mm vs display size 480x270 mm.
EDID:
  Base EDID: The DTD max image size is 527x296mm, which is larger than the display size 480.0x270.0mm.
  Base EDID: EDID specified 1 extension block(s), but found 3 extension block(s).
  Base EDID: EDID 1.3 requires a Block Map Extension in Block 1 if there are more than 2 blocks in the EDID.

EDID conformity: FAIL
