edid-decode (hex):

00 ff ff ff ff ff ff 00 06 b3 19 27 01 01 01 01
1e 23 01 04 b5 3c 22 78 3b 39 35 ab 53 47 a9 25
0c 50 54 25 4a 00 81 40 81 80 81 c0 a9 40 d1 c0
01 01 01 01 01 01 56 5e 00 a0 a0 a0 29 50 30 20
35 00 55 50 21 00 00 1a 00 00 00 fd 0c 30 c8 41
41 57 01 0a 20 20 20 20 20 20 00 00 00 fc 00 56
47 32 37 41 51 4c 35 41 0a 20 20 20 00 00 00 ff
00 54 37 4c 4d 51 53 31 32 31 38 32 30 0a 02 02

02 03 34 f1 4b 01 03 02 12 11 13 04 1f 10 40 3f
23 09 07 07 83 01 00 00 e2 00 ea e3 05 c0 00 e6
06 05 01 65 65 00 6d 1a 00 00 02 01 30 c8 00 04
60 00 60 00 6f c2 00 a0 a0 a0 55 50 30 20 35 00
55 50 21 00 00 1a 09 ec 00 a0 a0 a0 67 50 30 20
35 00 55 50 21 00 00 1a 00 00 00 00 00 00 00 00
00 00 00 00 00 00 00 00 00 00 00 00 00 00 00 00
00 00 00 00 00 00 00 00 00 00 00 00 00 00 00 5d

70 12 79 03 00 01 00 0c 52 17 20 0d 00 0a a0 05
10 78 4d 99 03 01 3c b8 3d 01 04 ff 09 8f 00 2f
80 1f 00 9f 05 3f 00 02 00 04 00 3d 11 01 04 ff
09 9f 00 2f 80 1f 00 9f 05 76 00 02 00 04 00 5b
c1 00 04 7f 07 9f 00 2f 80 1f 00 37 04 81 00 02
00 04 00 00 00 00 00 00 00 00 00 00 00 00 00 00
00 00 00 00 00 00 00 00 00 00 00 00 00 00 00 00
00 00 00 00 00 00 00 00 00 00 00 00 00 00 6d 90

00 ff ff ff ff ff ff 00 06 b3 19 27 01 01 01 01
1e 23 01 04 b5 3c 22 78 3b 39 35 ab 53 47 a9 25
0c 50 54 25 4a 00 81 40 81 80 81 c0 a9 40 d1 c0
01 01 01 01 01 01 56 5e 00 a0 a0 a0 29 50 30 20
35 00 55 50 21 00 00 1a 00 00 00 fd 0c 30 c8 41
41 57 01 0a 20 20 20 20 20 20 00 00 00 fc 00 56
47 32 37 41 51 4c 35 41 0a 20 20 20 00 00 00 ff
00 54 37 4c 4d 51 53 31 32 31 38 32 30 0a 02 02

02 03 34 f1 4b 01 03 02 12 11 13 04 1f 10 40 3f
23 09 07 07 83 01 00 00 e2 00 ea e3 05 c0 00 e6
06 05 01 65 65 00 6d 1a 00 00 02 01 30 c8 00 04
60 00 60 00 6f c2 00 a0 a0 a0 55 50 30 20 35 00
55 50 21 00 00 1a 09 ec 00 a0 a0 a0 67 50 30 20
35 00 55 50 21 00 00 1a 00 00 00 00 00 00 00 00
00 00 00 00 00 00 00 00 00 00 00 00 00 00 00 00
00 00 00 00 00 00 00 00 00 00 00 00 00 00 00 5d

70 12 79 03 00 01 00 0c 52 17 20 0d 00 0a a0 05
10 78 4d 99 03 01 3c b8 3d 01 04 ff 09 8f 00 2f
80 1f 00 9f 05 3f 00 02 00 04 00 3d 11 01 04 ff
09 9f 00 2f 80 1f 00 9f 05 76 00 02 00 04 00 5b
c1 00 04 7f 07 9f 00 2f 80 1f 00 37 04 81 00 02
00 04 00 00 00 00 00 00 00 00 00 00 00 00 00 00
00 00 00 00 00 00 00 00 00 00 00 00 00 00 00 00
00 00 00 00 00 00 00 00 00 00 00 00 00 00 6d 90

----------------

Block 0, Base EDID:
  EDID Structure Version & Revision: 1.4
  Vendor & Product Identification:
    Manufacturer: AUS
    Model: 10009
    Serial Number: ...
    Made in: week 30 of 2025
  Basic Display Parameters & Features:
    Digital display
    Bits per primary color channel: 10
    DisplayPort interface
    Maximum image size: 60 cm x 34 cm
    Gamma: 2.20
    DPMS levels: Off
    Supported color formats: RGB 4:4:4, YCrCb 4:4:4, YCrCb 4:2:2
    First detailed timing includes the native pixel format and preferred refresh rate
    Display supports continuous frequencies
  Color Characteristics:
    Red  : 0.6679, 0.3271
    Green: 0.2792, 0.6611
    Blue : 0.1445, 0.0498
    White: 0.3134, 0.3291
  Established Timings I & II:
    DMT 0x04:   640x480    59.940476 Hz   4:3     31.469 kHz     25.175000 MHz
    DMT 0x06:   640x480    75.000000 Hz   4:3     37.500 kHz     31.500000 MHz
    DMT 0x09:   800x600    60.316541 Hz   4:3     37.879 kHz     40.000000 MHz
    DMT 0x0b:   800x600    75.000000 Hz   4:3     46.875 kHz     49.500000 MHz
    DMT 0x10:  1024x768    60.003840 Hz   4:3     48.363 kHz     65.000000 MHz
    DMT 0x12:  1024x768    75.028582 Hz   4:3     60.023 kHz     78.750000 MHz
  Standard Timings:
    DMT 0x20:  1280x960    60.000000 Hz   4:3     60.000 kHz    108.000000 MHz
    DMT 0x23:  1280x1024   60.019740 Hz   5:4     63.981 kHz    108.000000 MHz
    DMT 0x55:  1280x720    60.000000 Hz  16:9     45.000 kHz     74.250000 MHz
    DMT 0x33:  1600x1200   60.000000 Hz   4:3     75.000 kHz    162.000000 MHz
    DMT 0x52:  1920x1080   60.000000 Hz  16:9     67.500 kHz    148.500000 MHz
  Detailed Timing Descriptors:
    DTD 1:  2560x1440   59.950550 Hz  16:9     88.787 kHz    241.500000 MHz (597 mm x 336 mm)
                 Hfront   48 Hsync  32 Hback   80 Hpol P
                 Vfront    3 Vsync   5 Vback   33 Vpol N
    Display Range Limits:
      Monitor ranges (Range Limits Only): 48-200 Hz V, 320-320 kHz H, max dotclock 870 MHz
    Display Product Name: 'VG27AQL5A'
    Display Product Serial Number: ...
  Extension blocks: 2
Checksum: 0x02

----------------

Block 1, CTA-861 Extension Block:
  Revision: 3
  Underscans IT Video Formats by default
  Basic audio support
  Supports YCbCr 4:4:4
  Supports YCbCr 4:2:2
  Native DTDs: 1
  Video Data Block:
    VIC   1:   640x480    59.940476 Hz   4:3     31.469 kHz     25.175000 MHz
    VIC   3:   720x480    59.940060 Hz  16:9     31.469 kHz     27.000000 MHz
    VIC   2:   720x480    59.940060 Hz   4:3     31.469 kHz     27.000000 MHz
    VIC  18:   720x576    50.000000 Hz  16:9     31.250 kHz     27.000000 MHz
    VIC  17:   720x576    50.000000 Hz   4:3     31.250 kHz     27.000000 MHz
    VIC  19:  1280x720    50.000000 Hz  16:9     37.500 kHz     74.250000 MHz
    VIC   4:  1280x720    60.000000 Hz  16:9     45.000 kHz     74.250000 MHz
    VIC  31:  1920x1080   50.000000 Hz  16:9     56.250 kHz    148.500000 MHz
    VIC  16:  1920x1080   60.000000 Hz  16:9     67.500 kHz    148.500000 MHz
    VIC  64:  1920x1080  100.000000 Hz  16:9    112.500 kHz    297.000000 MHz
    VIC  63:  1920x1080  120.000000 Hz  16:9    135.000 kHz    297.000000 MHz
  Audio Data Block:
    Linear PCM:
      Max channels: 2
      Supported sample rates (kHz): 48 44.1 32
      Supported sample sizes (bits): 24 20 16
  Speaker Allocation Data Block:
    FL/FR - Front Left/Right
  Video Capability Data Block:
    YCbCr quantization: Selectable (via AVI YQ)
    RGB quantization: Selectable (via AVI Q)
    PT scan behavior: Always Underscanned
    IT scan behavior: Always Underscanned
    CE scan behavior: Always Underscanned
  Colorimetry Data Block:
    BT2020YCC
    BT2020RGB
  HDR Static Metadata Data Block:
    Electro optical transfer functions:
      Traditional gamma - SDR luminance range
      SMPTE ST2084
    Supported static metadata descriptors:
      Static metadata type 1
    Desired content max luminance: 101 (445.755 cd/m^2)
    Desired content max frame-average luminance: 101 (445.755 cd/m^2)
    Desired content min luminance: 0 (0.000 cd/m^2)
  Vendor-Specific Data Block (AMD), OUI 00-00-1A:
    Version: 2
    Feature Caps: 0x01
    Minimum Refresh Rate: 48 Hz
    Maximum Refresh Rate: 200 Hz
    Flags 1.x: 0x00
    Flags 2.x: 0x04
  Detailed Timing Descriptors:
    DTD 2:  2560x1440  119.997589 Hz  16:9    182.996 kHz    497.750000 MHz (597 mm x 336 mm)
                 Hfront   48 Hsync  32 Hback   80 Hpol P
                 Vfront    3 Vsync   5 Vback   77 Vpol N
    DTD 3:  2560x1440  143.973257 Hz  16:9    222.151 kHz    604.250000 MHz (597 mm x 336 mm)
                 Hfront   48 Hsync  32 Hback   80 Hpol P
                 Vfront    3 Vsync   5 Vback   95 Vpol N
Checksum: 0x5d  Unused space in Extension Block: 39 bytes

----------------

Block 2, DisplayID Extension Block:
  Version: 1.2
  Extension Count: 0
  Display Product Type: Standalone display device
  Display Parameters Data Block (0x01):
    Image size: 597.0 mm x 336.0 mm
    Display native pixel format: 2560x1440
    Feature support flags:
      Power management (DPM)
    Gamma: 2.20
    Aspect ratio: 1.77
    Dynamic bpc native: 10
    Dynamic bpc overall: 10
  Video Timing Modes Type 1 - Detailed Timings Data Block:
    DTD:  2560x1440  200.001672 Hz  16:9    300.803 kHz    813.370000 MHz (aspect 16:9, no 3D stereo)
               Hfront   48 Hsync  32 Hback   64 Hpol P
               Vfront    3 Vsync   5 Vback   56 Vpol N
    DTD:  2560x1440  164.957741 Hz  16:9    257.169 kHz    699.500000 MHz (aspect 16:9, no 3D stereo)
               Hfront   48 Hsync  32 Hback   80 Hpol P
               Vfront    3 Vsync   5 Vback  111 Vpol N
    DTD:  1920x1080  196.678322 Hz  16:9    237.981 kHz    495.000000 MHz (aspect 16:9, no 3D stereo)
               Hfront   48 Hsync  32 Hback   80 Hpol P
               Vfront    3 Vsync   5 Vback  122 Vpol N
  Checksum: 0x6d
Checksum: 0x90

----------------

Warnings:

Block 0, Base EDID:
  Vendor & Product Identification: The serial number is one of the known dummy values, it should probably be set to 0.
Block 1, CTA-861 Extension Block:
  Video Data Block: VIC 1 and the first DTD are not identical. Is this intended?
  Video Capability Data Block: S_PT is equal to S_IT and S_CE, so should be set to 0 instead.
  Colorimetry Data Block: Set the sRGB colorimetry bit to avoid interop issues.
  Display Product Serial Number is set, so the Serial Number in the Base EDID should be 0.
EDID:
  Base EDID: Some timings are out of range of the Monitor Ranges:
    Horizontal Freq: 31.250 - 300.802 kHz (Monitor: 320.000 - 320.000 kHz)

Failures:

EDID:
  Extension Block 3 started with EDID header, ignoring Extension Blocks >= 3.
  DisplayID: DisplayID expects at least one preferred timing.

EDID conformity: FAIL
