edid-decode (hex):

00 ff ff ff ff ff ff 00 32 0c 00 3d 00 00 00 00
00 10 01 03 80 2b 1b 78 0a fe 09 98 58 52 8c 28
23 50 54 00 00 00 01 01 01 01 01 01 01 01 01 01
01 01 01 01 01 01 7c 2e 90 a0 60 1a 1c 40 30 20
36 00 b1 0f 11 00 00 19 00 00 00 00 00 00 00 00
00 00 00 00 00 00 00 00 00 00 00 00 00 fe 00 59
39 31 31 36 02 32 30 31 57 45 31 0a 00 00 00 fe
00 37 3f 4a 58 6d 8d b7 ff 02 01 0a 20 20 00 94

----------------

Block 0, Base EDID:
  EDID Structure Version & Revision: 1.3
  Vendor & Product Identification:
    Manufacturer: LPL
    Model: 15616
    Made in: 2006
  Basic Display Parameters & Features:
    Digital display
    Maximum image size: 43 cm x 27 cm
    Gamma: 2.20
    RGB color display
    First detailed timing is the preferred timing
  Color Characteristics:
    Red  : 0.5966, 0.3466
    Green: 0.3232, 0.5488
    Blue : 0.1562, 0.1367
    White: 0.3144, 0.3291
  Established Timings I & II: none
  Standard Timings: none
  Detailed Timing Descriptors:
    DTD 1:  1680x1050   59.994353 Hz  16:10    64.674 kHz    119.000000 MHz (433 mm x 271 mm)
                 Hfront   48 Hsync  32 Hback   80 Hpol N
                 Vfront    3 Vsync   6 Vback   19 Vpol N
    Empty Descriptor
    Alphanumeric Data String: 'Y9116.201WE1'
    Alphanumeric Data String: '7?JXm..'
Checksum: 0x94

----------------

Warnings:

Block 0, Base EDID:
  Alphanumeric Data String: Non-ASCII character 0x02 at position 5, can cause problems.
  Alphanumeric Data String: Non-ASCII character 0x8d at position 5, can cause problems.
  Alphanumeric Data String: Non-ASCII character 0xb7 at position 6, can cause problems.

Failures:

Block 0, Base EDID:
  Empty Descriptor: Use Dummy Descriptor instead of all zeroes.
  Alphanumeric Data String: 0xff byte at position 7.
  Missing Display Product Name.
  Missing Display Range Limits Descriptor.

EDID conformity: FAIL
