edid-decode (hex):

00 ff ff ff ff ff ff 00 41 0c 45 d0 00 00 00 00
00 12 01 03 08 00 00 78 0a 52 7d a2 54 53 95 25
10 46 47 21 08 00 31 40 45 40 61 40 01 01 01 01
01 01 01 01 01 01 66 21 50 b0 51 00 1b 30 40 70
36 00 00 00 00 00 00 1e 0e 1f 00 80 51 00 1e 30
40 80 37 00 00 00 00 00 00 1c 00 00 00 fd 00 38
4c 1e 53 08 00 0a 20 20 20 20 20 20 00 00 00 fc
00 4d 41 47 20 33 32 4d 46 33 33 38 42 0a 00 ae

00 ff ff ff ff ff ff 00 41 0c 45 d0 00 00 00 00
00 12 01 03 08 00 00 78 0a 52 7d a2 54 53 95 25
10 46 47 21 08 00 31 40 45 40 61 40 01 01 01 01
01 01 01 01 01 01 66 21 50 b0 51 00 1b 30 40 70
36 00 00 00 00 00 00 1e 0e 1f 00 80 51 00 1e 30
40 80 37 00 00 00 00 00 00 1c 00 00 00 fd 00 38
4c 1e 53 08 00 0a 20 20 20 20 20 20 00 00 00 fc
00 4d 41 47 20 33 32 4d 46 33 33 38 42 0a 00 ae

----------------

Block 0, Base EDID:
  EDID Structure Version & Revision: 1.3
  Vendor & Product Identification:
    Manufacturer: PHL
    Model: 53317
    Made in: 2008
  Basic Display Parameters & Features:
    Analog display
    Signal Level Standard: 0.700 : 0.300 : 1.000 V p-p
    Blank level equals black level
    Sync: Separate
    Image size is variable
    Gamma: 2.20
    RGB color display
    First detailed timing is the preferred timing
  Color Characteristics:
    Red  : 0.6337, 0.3291
    Green: 0.3242, 0.5839
    Blue : 0.1455, 0.0654
    White: 0.2763, 0.2783
  Established Timings I & II:
    DMT 0x04:   640x480    59.940476 Hz   4:3     31.469 kHz     25.175000 MHz
    DMT 0x09:   800x600    60.316541 Hz   4:3     37.879 kHz     40.000000 MHz
    DMT 0x10:  1024x768    60.003840 Hz   4:3     48.363 kHz     65.000000 MHz
  Standard Timings:
    DMT 0x04:   640x480    59.940476 Hz   4:3     31.469 kHz     25.175000 MHz
    DMT 0x09:   800x600    60.316541 Hz   4:3     37.879 kHz     40.000000 MHz
    DMT 0x10:  1024x768    60.003840 Hz   4:3     48.363 kHz     65.000000 MHz
  Detailed Timing Descriptors:
    DTD 1:  1360x768    60.015162 Hz  85:48    47.712 kHz     85.500000 MHz
                 Hfront   64 Hsync 112 Hback  256 Hpol P
                 Vfront    3 Vsync   6 Vback   18 Vpol P
    DTD 2:  1280x768    59.870228 Hz   5:3     47.776 kHz     79.500000 MHz
                 Hfront   64 Hsync 128 Hback  192 Hpol N
                 Vfront    3 Vsync   7 Vback   20 Vpol P
    Display Range Limits:
      Monitor ranges (GTF): 56-76 Hz V, 30-83 kHz H, max dotclock 80 MHz
    Display Product Name: 'MAG 32MF338B'
Checksum: 0xae

----------------

Warnings:

EDID:
  Base EDID: Some timings are out of range of the Monitor Ranges:
    Maximum Clock: 85.500 MHz (Monitor: 80.000 MHz)
    Could be due to a Monitor Range off-by-one rounding issue

Failures:

EDID:
  Extension Block 1 started with EDID header, ignoring Extension Blocks >= 1.

EDID conformity: FAIL
