edid-decode (hex):

00 ff ff ff ff ff ff 00 41 0c 18 09 7f 65 00 00
33 1c 01 03 80 3c 22 78 2a 20 31 a5 54 4c 9f 26
0e 50 54 bf ef 00 d1 c0 b3 00 95 00 81 80 81 40
81 c0 01 01 01 01 56 5e 00 a0 a0 a0 29 50 30 20
35 00 55 50 21 00 00 1e 00 00 00 ff 00 55 4b 30
31 38 35 31 30 32 35 39 38 33 00 00 00 fc 00 50
48 4c 20 32 37 32 42 38 51 0a 20 20 00 00 00 fd
00 32 4c 1e 63 1e 00 0a 20 20 20 20 20 20 01 62

02 01 04 00 02 3a 80 18 71 38 2d 40 58 2c 45 00
55 50 21 00 00 1e 01 1d 00 72 51 d0 1e 20 6e 28
55 00 55 50 21 00 00 1e 8c 0a d0 8a 20 e0 2d 10
10 3e 96 00 55 50 21 00 00 18 8c 0a d0 90 20 40
31 20 0c 40 55 00 55 50 21 00 00 18 f0 3c 00 d0
51 a0 35 50 60 88 3a 00 55 50 21 00 00 1c 00 00
00 00 00 00 00 00 00 00 00 00 00 00 00 00 00 00
00 00 00 00 00 00 00 00 00 00 00 00 00 00 00 19

00 ff ff ff ff ff ff 00 41 0c 18 09 7f 65 00 00
33 1c 01 03 80 3c 22 78 2a 20 31 a5 54 4c 9f 26
0e 50 54 bf ef 00 d1 c0 b3 00 95 00 81 80 81 40
81 c0 01 01 01 01 56 5e 00 a0 a0 a0 29 50 30 20
35 00 55 50 21 00 00 1e 00 00 00 ff 00 55 4b 30
31 38 35 31 30 32 35 39 38 33 00 00 00 fc 00 50
48 4c 20 32 37 32 42 38 51 0a 20 20 00 00 00 fd
00 32 4c 1e 63 1e 00 0a 20 20 20 20 20 20 01 62

02 01 04 00 02 3a 80 18 71 38 2d 40 58 2c 45 00
55 50 21 00 00 1e 01 1d 00 72 51 d0 1e 20 6e 28
55 00 55 50 21 00 00 1e 8c 0a d0 8a 20 e0 2d 10
10 3e 96 00 55 50 21 00 00 18 8c 0a d0 90 20 40
31 20 0c 40 55 00 55 50 21 00 00 18 f0 3c 00 d0
51 a0 35 50 60 88 3a 00 55 50 21 00 00 1c 00 00
00 00 00 00 00 00 00 00 00 00 00 00 00 00 00 00
00 00 00 00 00 00 00 00 00 00 00 00 00 00 00 19

----------------

Block 0, Base EDID:
  EDID Structure Version & Revision: 1.3
  Vendor & Product Identification:
    Manufacturer: PHL
    Model: 2328
    Serial Number: ...
    Made in: week 51 of 2018
  Basic Display Parameters & Features:
    Digital display
    Maximum image size: 60 cm x 34 cm
    Gamma: 2.20
    DPMS levels: Off
    RGB color display
    First detailed timing is the preferred timing
  Color Characteristics:
    Red  : 0.6445, 0.3300
    Green: 0.2968, 0.6210
    Blue : 0.1484, 0.0576
    White: 0.3125, 0.3291
  Established Timings I & II:
    IBM     :   720x400    70.081663 Hz   9:5     31.467 kHz     28.320000 MHz
    DMT 0x04:   640x480    59.940476 Hz   4:3     31.469 kHz     25.175000 MHz
    Apple   :   640x480    66.666667 Hz   4:3     35.000 kHz     30.240000 MHz
    DMT 0x05:   640x480    72.808802 Hz   4:3     37.861 kHz     31.500000 MHz
    DMT 0x06:   640x480    75.000000 Hz   4:3     37.500 kHz     31.500000 MHz
    DMT 0x08:   800x600    56.250000 Hz   4:3     35.156 kHz     36.000000 MHz
    DMT 0x09:   800x600    60.316541 Hz   4:3     37.879 kHz     40.000000 MHz
    DMT 0x0a:   800x600    72.187572 Hz   4:3     48.077 kHz     50.000000 MHz
    DMT 0x0b:   800x600    75.000000 Hz   4:3     46.875 kHz     49.500000 MHz
    Apple   :   832x624    74.551266 Hz   4:3     49.726 kHz     57.284000 MHz
    DMT 0x10:  1024x768    60.003840 Hz   4:3     48.363 kHz     65.000000 MHz
    DMT 0x11:  1024x768    70.069359 Hz   4:3     56.476 kHz     75.000000 MHz
    DMT 0x12:  1024x768    75.028582 Hz   4:3     60.023 kHz     78.750000 MHz
    DMT 0x24:  1280x1024   75.024675 Hz   5:4     79.976 kHz    135.000000 MHz
  Standard Timings:
    DMT 0x52:  1920x1080   60.000000 Hz  16:9     67.500 kHz    148.500000 MHz
    DMT 0x3a:  1680x1050   59.954250 Hz  16:10    65.290 kHz    146.250000 MHz
    DMT 0x2f:  1440x900    59.887445 Hz  16:10    55.935 kHz    106.500000 MHz
    DMT 0x23:  1280x1024   60.019740 Hz   5:4     63.981 kHz    108.000000 MHz
    DMT 0x20:  1280x960    60.000000 Hz   4:3     60.000 kHz    108.000000 MHz
    DMT 0x55:  1280x720    60.000000 Hz  16:9     45.000 kHz     74.250000 MHz
  Detailed Timing Descriptors:
    DTD  1:  2560x1440   59.950550 Hz  16:9     88.787 kHz    241.500000 MHz (597 mm x 336 mm)
                  Hfront   48 Hsync  32 Hback   80 Hpol P
                  Vfront    3 Vsync   5 Vback   33 Vpol P
    Display Product Serial Number: ...
    Display Product Name: 'PHL 272B8Q'
    Display Range Limits:
      Monitor ranges (GTF): 50-76 Hz V, 30-99 kHz H, max dotclock 300 MHz
  Extension blocks: 1
Checksum: 0x62

----------------

Block 1, CTA-861 Extension Block:
  Revision: 1
  Detailed Timing Descriptors:
    DTD  2:  1920x1080   60.000000 Hz  16:9     67.500 kHz    148.500000 MHz (597 mm x 336 mm)
                  Hfront   88 Hsync  44 Hback  148 Hpol P
                  Vfront    4 Vsync   5 Vback   36 Vpol P
    DTD  3:  1280x720    60.000000 Hz  16:9     45.000 kHz     74.250000 MHz (597 mm x 336 mm)
                  Hfront  110 Hsync  40 Hback  220 Hpol P
                  Vfront    5 Vsync   5 Vback   20 Vpol P
    DTD  4:   720x480    59.940060 Hz   3:2     31.469 kHz     27.000000 MHz (597 mm x 336 mm)
                  Hfront   16 Hsync  62 Hback   60 Hpol N
                  Vfront    9 Vsync   6 Vback   30 Vpol N
    DTD  5:   720x576    50.000000 Hz   5:4     31.250 kHz     27.000000 MHz (597 mm x 336 mm)
                  Hfront   12 Hsync  64 Hback   68 Hpol N
                  Vfront    5 Vsync   5 Vback   39 Vpol N
    DTD  6:  1280x1440   59.912620 Hz   8:9     89.450 kHz    156.000000 MHz (597 mm x 336 mm)
                  Hfront   96 Hsync 136 Hback  232 Hpol N
                  Vfront    3 Vsync  10 Vback   40 Vpol P
Checksum: 0x19  Unused space in Extension Block: 33 bytes

----------------

Block 2, Unknown EDID Extension Block 0x00:
  00 ff ff ff ff ff ff 00 41 0c 18 09 7f 65 00 00 '........A....e..'
  33 1c 01 03 80 3c 22 78 2a 20 31 a5 54 4c 9f 26 '3....<"x* 1.TL.&'
  0e 50 54 bf ef 00 d1 c0 b3 00 95 00 81 80 81 40 '.PT............@'
  81 c0 01 01 01 01 56 5e 00 a0 a0 a0 29 50 30 20 '......V^....)P0 '
  35 00 55 50 21 00 00 1e 00 00 00 ff 00 55 4b 30 '5.UP!........UK0'
  31 38 35 31 30 32 35 39 38 33 00 00 00 fc 00 50 '1851025983.....P'
  48 4c 20 32 37 32 42 38 51 0a 20 20 00 00 00 fd 'HL 272B8Q.  ....'
  00 32 4c 1e 63 1e 00 0a 20 20 20 20 20 20 01 62 '.2L.c...      .b'
Checksum: 0x62

----------------

Block 3, CTA-861 Extension Block:
  Revision: 1
  Detailed Timing Descriptors:
    DTD  7:  1920x1080   60.000000 Hz  16:9     67.500 kHz    148.500000 MHz (597 mm x 336 mm)
                  Hfront   88 Hsync  44 Hback  148 Hpol P
                  Vfront    4 Vsync   5 Vback   36 Vpol P
    DTD  8:  1280x720    60.000000 Hz  16:9     45.000 kHz     74.250000 MHz (597 mm x 336 mm)
                  Hfront  110 Hsync  40 Hback  220 Hpol P
                  Vfront    5 Vsync   5 Vback   20 Vpol P
    DTD  9:   720x480    59.940060 Hz   3:2     31.469 kHz     27.000000 MHz (597 mm x 336 mm)
                  Hfront   16 Hsync  62 Hback   60 Hpol N
                  Vfront    9 Vsync   6 Vback   30 Vpol N
    DTD 10:   720x576    50.000000 Hz   5:4     31.250 kHz     27.000000 MHz (597 mm x 336 mm)
                  Hfront   12 Hsync  64 Hback   68 Hpol N
                  Vfront    5 Vsync   5 Vback   39 Vpol N
    DTD 11:  1280x1440   59.912620 Hz   8:9     89.450 kHz    156.000000 MHz (597 mm x 336 mm)
                  Hfront   96 Hsync 136 Hback  232 Hpol N
                  Vfront    3 Vsync  10 Vback   40 Vpol P
Checksum: 0x19  Unused space in Extension Block: 33 bytes

----------------

Warnings:

Block 1, CTA-861 Extension Block:
  Detailed Timing Descriptor #2: DTD is identical to VIC 16, which is not present in the CTA Ext Block.
  Detailed Timing Descriptor #3: DTD is identical to VIC 4, which is not present in the CTA Ext Block.
  Detailed Timing Descriptor #4: Image size is 597x336 mm, but based on the picture AR it should be 597x398 mm.
  Detailed Timing Descriptor #5: Image size is 597x336 mm, but based on the picture AR it should be 597x477 mm.
  Detailed Timing Descriptor #6: Image size is 597x336 mm, but based on the picture AR it should be 597x671 mm.
  Display Product Serial Number is set, so the Serial Number in the Base EDID should be 0.
  Add a Colorimetry Data Block with the sRGB colorimetry bit set to avoid interop issues.
Block 3, CTA-861 Extension Block:
  Detailed Timing Descriptor #7: DTD is identical to VIC 16, which is not present in the CTA Ext Block.
  Detailed Timing Descriptor #8: DTD is identical to VIC 4, which is not present in the CTA Ext Block.
  Detailed Timing Descriptor #9: Image size is 597x336 mm, but based on the picture AR it should be 597x398 mm.
  Detailed Timing Descriptor #10: Image size is 597x336 mm, but based on the picture AR it should be 597x477 mm.
  Detailed Timing Descriptor #11: Image size is 597x336 mm, but based on the picture AR it should be 597x671 mm.

Failures:

Block 1, CTA-861 Extension Block:
  Missing VCDB, needed for Set Selectable RGB Quantization to avoid interop issues.
Block 2, Base EDID:
  Unknown Extension Block.
EDID:
  Base EDID: EDID specified 1 extension block(s), but found 3 extension block(s).
  Base EDID: EDID 1.3 requires a Block Map Extension in Block 1 if there are more than 2 blocks in the EDID.

EDID conformity: FAIL
