edid-decode (hex):

00 ff ff ff ff ff ff 00 22 45 63 36 00 00 00 00
04 1c 01 03 80 50 2d 78 0a cf 74 a3 57 4c b0 23
09 48 4c a1 08 00 81 80 61 40 45 40 31 40 01 01
01 01 01 01 01 01 02 3a 80 18 71 38 2d 40 58 2c
45 00 7e 8a 42 00 00 1e 01 1d 00 72 51 d0 1e 20
6e 28 55 00 7e 8a 42 00 00 1e 00 00 00 fd 00 17
47 0f 53 10 00 0a 20 20 20 20 20 20 00 00 00 fc
00 48 41 49 45 52 20 54 56 0a 20 20 20 20 01 73

02 03 2e f1 56 01 02 03 04 85 06 07 0e 0f 90 11
12 13 94 15 16 1d 1e 9f 20 21 22 26 09 7f 07 15
07 50 83 01 00 00 67 03 0c 00 10 00 80 1e 01 1d
80 18 71 1c 16 20 58 2c 25 00 7e 8a 42 00 00 9e
01 1d 00 80 51 d0 0c 20 40 80 35 00 7e 8a 42 00
00 1e 02 3a 80 18 71 38 2d 40 58 2c 45 00 7e 8a
42 00 00 1e 66 21 50 b0 51 00 1b 30 40 70 36 00
84 8a 42 00 00 1e 00 00 00 00 00 00 00 00 00 5e

00 ff ff ff ff ff ff 00 22 45 63 36 00 00 00 00
04 1c 01 03 80 50 2d 78 0a cf 74 a3 57 4c b0 23
09 48 4c a1 08 00 81 80 61 40 45 40 31 40 01 01
01 01 01 01 01 01 02 3a 80 18 71 38 2d 40 58 2c
45 00 7e 8a 42 00 00 1e 01 1d 00 72 51 d0 1e 20
6e 28 55 00 7e 8a 42 00 00 1e 00 00 00 fd 00 17
47 0f 53 10 00 0a 20 20 20 20 20 20 00 00 00 fc
00 48 41 49 45 52 20 54 56 0a 20 20 20 20 01 73

02 03 2e f1 56 01 02 03 04 85 06 07 0e 0f 90 11
12 13 94 15 16 1d 1e 9f 20 21 22 26 09 7f 07 15
07 50 83 01 00 00 67 03 0c 00 10 00 80 1e 01 1d
80 18 71 1c 16 20 58 2c 25 00 7e 8a 42 00 00 9e
01 1d 00 80 51 d0 0c 20 40 80 35 00 7e 8a 42 00
00 1e 02 3a 80 18 71 38 2d 40 58 2c 45 00 7e 8a
42 00 00 1e 66 21 50 b0 51 00 1b 30 40 70 36 00
84 8a 42 00 00 1e 00 00 00 00 00 00 00 00 00 5e

----------------

Block 0, Base EDID:
  EDID Structure Version & Revision: 1.3
  Vendor & Product Identification:
    Manufacturer: HRE
    Model: 13923
    Made in: week 4 of 2018
  Basic Display Parameters & Features:
    Digital display
    Maximum image size: 80 cm x 45 cm
    Gamma: 2.20
    RGB color display
    First detailed timing is the preferred timing
  Color Characteristics:
    Red  : 0.6396, 0.3398
    Green: 0.2998, 0.6904
    Blue : 0.1376, 0.0380
    White: 0.2822, 0.2968
  Established Timings I & II:
    IBM     :   720x400    70.081663 Hz   9:5     31.467 kHz     28.320000 MHz
    DMT 0x04:   640x480    59.940476 Hz   4:3     31.469 kHz     25.175000 MHz
    DMT 0x09:   800x600    60.316541 Hz   4:3     37.879 kHz     40.000000 MHz
    DMT 0x10:  1024x768    60.003840 Hz   4:3     48.363 kHz     65.000000 MHz
  Standard Timings:
    DMT 0x23:  1280x1024   60.019740 Hz   5:4     63.981 kHz    108.000000 MHz
    DMT 0x10:  1024x768    60.003840 Hz   4:3     48.363 kHz     65.000000 MHz
    DMT 0x09:   800x600    60.316541 Hz   4:3     37.879 kHz     40.000000 MHz
    DMT 0x04:   640x480    59.940476 Hz   4:3     31.469 kHz     25.175000 MHz
  Detailed Timing Descriptors:
    DTD 1:  1920x1080   60.000000 Hz  16:9     67.500 kHz    148.500000 MHz (1150 mm x 650 mm)
                 Hfront   88 Hsync  44 Hback  148 Hpol P
                 Vfront    4 Vsync   5 Vback   36 Vpol P
    DTD 2:  1280x720    60.000000 Hz  16:9     45.000 kHz     74.250000 MHz (1150 mm x 650 mm)
                 Hfront  110 Hsync  40 Hback  220 Hpol P
                 Vfront    5 Vsync   5 Vback   20 Vpol P
    Display Range Limits:
      Monitor ranges (GTF): 23-71 Hz V, 15-83 kHz H, max dotclock 160 MHz
    Display Product Name: 'HAIER TV'
  Extension blocks: 1
Checksum: 0x73

----------------

Block 1, CTA-861 Extension Block:
  Revision: 3
  Underscans IT Video Formats by default
  Basic audio support
  Supports YCbCr 4:4:4
  Supports YCbCr 4:2:2
  Native DTDs: 1
  Video Data Block:
    VIC   1:   640x480    59.940476 Hz   4:3     31.469 kHz     25.175000 MHz
    VIC   2:   720x480    59.940060 Hz   4:3     31.469 kHz     27.000000 MHz
    VIC   3:   720x480    59.940060 Hz  16:9     31.469 kHz     27.000000 MHz
    VIC   4:  1280x720    60.000000 Hz  16:9     45.000 kHz     74.250000 MHz
    VIC   5:  1920x1080i  60.000000 Hz  16:9     33.750 kHz     74.250000 MHz (native)
    VIC   6:  1440x480i   59.940060 Hz   4:3     15.734 kHz     27.000000 MHz
    VIC   7:  1440x480i   59.940060 Hz  16:9     15.734 kHz     27.000000 MHz
    VIC  14:  1440x480    59.940060 Hz   4:3     31.469 kHz     54.000000 MHz
    VIC  15:  1440x480    59.940060 Hz  16:9     31.469 kHz     54.000000 MHz
    VIC  16:  1920x1080   60.000000 Hz  16:9     67.500 kHz    148.500000 MHz (native)
    VIC  17:   720x576    50.000000 Hz   4:3     31.250 kHz     27.000000 MHz
    VIC  18:   720x576    50.000000 Hz  16:9     31.250 kHz     27.000000 MHz
    VIC  19:  1280x720    50.000000 Hz  16:9     37.500 kHz     74.250000 MHz
    VIC  20:  1920x1080i  50.000000 Hz  16:9     28.125 kHz     74.250000 MHz (native)
    VIC  21:  1440x576i   50.000000 Hz   4:3     15.625 kHz     27.000000 MHz
    VIC  22:  1440x576i   50.000000 Hz  16:9     15.625 kHz     27.000000 MHz
    VIC  29:  1440x576    50.000000 Hz   4:3     31.250 kHz     54.000000 MHz
    VIC  30:  1440x576    50.000000 Hz  16:9     31.250 kHz     54.000000 MHz
    VIC  31:  1920x1080   50.000000 Hz  16:9     56.250 kHz    148.500000 MHz (native)
    VIC  32:  1920x1080   24.000000 Hz  16:9     27.000 kHz     74.250000 MHz
    VIC  33:  1920x1080   25.000000 Hz  16:9     28.125 kHz     74.250000 MHz
    VIC  34:  1920x1080   30.000000 Hz  16:9     33.750 kHz     74.250000 MHz
  Audio Data Block:
    Linear PCM:
      Max channels: 2
      Supported sample rates (kHz): 192 176.4 96 88.2 48 44.1 32
      Supported sample sizes (bits): 24 20 16
    AC-3:
      Max channels: 6
      Supported sample rates (kHz): 48 44.1 32
      Maximum bit rate: 640 kb/s
  Speaker Allocation Data Block:
    FL/FR - Front Left/Right
  Vendor-Specific Data Block (HDMI), OUI 00-0C-03:
    Source physical address: 1.0.0.0
    Supports_AI
    Maximum TMDS clock: 150 MHz
  Detailed Timing Descriptors:
    DTD 3:  1920x1080i  60.000000 Hz  16:9     33.750 kHz     74.250000 MHz (1150 mm x 650 mm)
                 Hfront   88 Hsync  44 Hback  148 Hpol P
                 Vfront    2 Vsync   5 Vback   15 Vpol P Vfront +0.5 Odd Field
                 Vfront    2 Vsync   5 Vback   15 Vpol P Vback  +0.5 Even Field
    DTD 4:  1280x720    60.958189 Hz  16:9     44.621 kHz     74.250000 MHz (1150 mm x 650 mm)
                 Hfront   64 Hsync 128 Hback  192 Hpol P
                 Vfront    3 Vsync   5 Vback    4 Vpol P
    DTD 5:  1920x1080   60.000000 Hz  16:9     67.500 kHz    148.500000 MHz (1150 mm x 650 mm)
                 Hfront   88 Hsync  44 Hback  148 Hpol P
                 Vfront    4 Vsync   5 Vback   36 Vpol P
    DTD 6:  1360x768    60.015162 Hz  85:48    47.712 kHz     85.500000 MHz (1156 mm x 650 mm)
                 Hfront   64 Hsync 112 Hback  256 Hpol P
                 Vfront    3 Vsync   6 Vback   18 Vpol P
Checksum: 0x5e  Unused space in Extension Block: 9 bytes

----------------

Warnings:

Block 1, CTA-861 Extension Block:
  Video Data Block: VIC 1 and the first DTD are not identical. Is this intended?
  Video Data Block: All VICs are in ascending order, and the first (preferred) VIC <= 4, is that intended?
  Add a Colorimetry Data Block with the sRGB colorimetry bit set to avoid interop issues.

Failures:

Block 0, Base EDID:
  Detailed Timing Descriptor #1: Mismatch of image size 1150x650 mm vs display size 800x450 mm.
  Detailed Timing Descriptor #2: Mismatch of image size 1150x650 mm vs display size 800x450 mm.
Block 1, CTA-861 Extension Block:
  Detailed Timing Descriptor #3: Mismatch of image size 1150x650 mm vs display size 800x450 mm.
  Detailed Timing Descriptor #4: Mismatch of image size 1150x650 mm vs display size 800x450 mm.
  Detailed Timing Descriptor #5: Mismatch of image size 1150x650 mm vs display size 800x450 mm.
  Detailed Timing Descriptor #6: Mismatch of image size 1156x650 mm vs display size 800x450 mm.
  Missing VCDB, needed for Set Selectable RGB Quantization to avoid interop issues.
EDID:
  Extension Block 2 started with EDID header, ignoring Extension Blocks >= 2.
  Base EDID: The DTD max image size is 1156x650mm, which is larger than the display size 800.0x450.0mm.

EDID conformity: FAIL
