edid-decode (hex):

00 ff ff ff ff ff ff 00 06 10 5a 9c 01 01 01 01
00 0f 01 03 81 2b 1b 78 0a e6 95 a3 54 4a 99 26
0f 50 54 00 00 10 01 01 01 01 01 01 01 01 01 01
01 01 01 01 01 01 7c 2e 90 a0 60 1a 1e 40 30 20
36 00 b1 0e 11 00 00 18 00 00 00 01 00 06 10 30
11 00 00 00 00 00 00 00 0a 20 00 00 00 fe 00 4c
54 4d 32 30 31 4d 31 00 00 00 0a 20 00 00 00 fc
00 43 6f 6c 6f 72 20 4c 43 44 0a 20 20 20 00 2c

----------------

Block 0, Base EDID:
  EDID Structure Version & Revision: 1.3
  Vendor & Product Identification:
    Manufacturer: APP
    Model: 40026
    Serial Number: ...
    Made in: 2005
  Basic Display Parameters & Features:
    Digital display
    DFP 1.x compatible TMDS
    Maximum image size: 43 cm x 27 cm
    Gamma: 2.20
    RGB color display
    First detailed timing is the preferred timing
  Color Characteristics:
    Red  : 0.6396, 0.3300
    Green: 0.2900, 0.5996
    Blue : 0.1503, 0.0595
    White: 0.3134, 0.3291
  Established Timings I & II:
  Standard Timings: none
  Detailed Timing Descriptors:
    DTD 1:  1680x1050   59.883253 Hz  16:10    64.674 kHz    119.000000 MHz (433 mm x 270 mm)
                 Hfront   48 Hsync  32 Hback   80 Hpol N
                 Vfront    3 Vsync   6 Vback   21 Vpol N
    Manufacturer-Specified Display Descriptor (0x01): 00 01 00 06 10 30 11 00 00 00 00 00 00 00 0a 20 '.....0......... '
    Alphanumeric Data String: 'LTM201M1'
    Display Product Name: 'Color LCD'
Checksum: 0x2c

----------------

Warnings:

Block 0, Base EDID:
  Vendor & Product Identification: The serial number is one of the known dummy values, it should probably be set to 0.
  Detailed Timing Descriptor #1: DTD is similar but not identical to DMT 0x39.

Failures:

Block 0, Base EDID:
  Alphanumeric Data String: NUL byte at position 8.
  Missing Display Range Limits Descriptor.

EDID conformity: FAIL
