edid-decode (hex):

00 ff ff ff ff ff ff 00 06 af 74 27 00 00 00 00
01 12 01 03 90 21 15 78 0a 07 f5 97 57 4f 8c 27
27 50 54 00 00 00 01 01 01 01 01 01 01 01 01 01
01 01 01 01 01 01 c7 1b 00 a5 50 20 14 30 30 20
36 00 4b cf 10 00 00 1a c7 1b 00 a5 50 20 14 30
30 20 36 00 4b cf 10 00 00 1a 00 00 00 fe 00 59
32 38 36 47 80 42 31 35 34 45 57 32 00 00 00 00
00 29 38 42 49 66 84 b0 ff 01 01 0a 20 20 00 4d

----------------

Block 0, Base EDID:
  EDID Structure Version & Revision: 1.3
  Vendor & Product Identification:
    Manufacturer: AUO
    Model: 10100
    Made in: week 1 of 2008
  Basic Display Parameters & Features:
    Digital display
    Maximum image size: 33 cm x 21 cm
    Gamma: 2.20
    RGB color display
    First detailed timing is the preferred timing
  Color Characteristics:
    Red  : 0.5898, 0.3398
    Green: 0.3095, 0.5498
    Blue : 0.1552, 0.1552
    White: 0.3134, 0.3291
  Established Timings I & II: none
  Standard Timings: none
  Detailed Timing Descriptors:
    DTD 1:  1280x800    60.013503 Hz  16:10    49.211 kHz     71.110000 MHz (331 mm x 207 mm)
                 Hfront   48 Hsync  32 Hback   85 Hpol P
                 Vfront    3 Vsync   6 Vback   11 Vpol N
    DTD 2:  1280x800    60.013503 Hz  16:10    49.211 kHz     71.110000 MHz (331 mm x 207 mm)
                 Hfront   48 Hsync  32 Hback   85 Hpol P
                 Vfront    3 Vsync   6 Vback   11 Vpol N
    Alphanumeric Data String: 'Y286G.B154EW2'
    Manufacturer-Specified Display Descriptor (0x00): 00 00 00 29 38 42 49 66 84 b0 ff 01 01 0a 20 20 '...)8BIf......  '
Checksum: 0x4d

----------------

Warnings:

Block 0, Base EDID:
  Alphanumeric Data String: Non-ASCII character 0x80 at position 5, can cause problems.

Failures:

Block 0, Base EDID:
  Basic Display Parameters & Features: Digital Video Interface Standard set to reserved value 0x10.
  Missing Display Product Name.
  Missing Display Range Limits Descriptor.

EDID conformity: FAIL
