edid-decode (hex):

00 ff ff ff ff ff ff 00 09 e5 5c 0a 00 00 00 00
15 1f 01 04 a5 26 15 78 02 f7 e2 ad 50 44 b0 24
0e 52 56 00 00 00 01 01 01 01 01 01 01 01 01 01
01 01 01 01 01 01 c0 39 80 18 71 38 28 40 30 20
36 00 7e d7 10 00 00 1a 34 2e 80 18 71 38 28 40
30 20 36 00 7e d7 10 00 00 1a 00 00 00 fe 00 48
47 50 31 30 80 4e 56 31 37 4e 34 4c 00 00 00 00
00 02 41 21 b2 00 10 00 00 0a 41 0a 20 20 00 61

----------------

Block 0, Base EDID:
  EDID Structure Version & Revision: 1.4
  Vendor & Product Identification:
    Manufacturer: BOE
    Model: 2652
    Made in: week 21 of 2021
  Basic Display Parameters & Features:
    Digital display
    Bits per primary color channel: 8
    DisplayPort interface
    Maximum image size: 38 cm x 21 cm
    Gamma: 2.20
    Supported color formats: RGB 4:4:4
    First detailed timing includes the native pixel format and preferred refresh rate
  Color Characteristics:
    Red  : 0.6787, 0.3154
    Green: 0.2666, 0.6904
    Blue : 0.1435, 0.0566
    White: 0.3203, 0.3378
  Established Timings I & II: none
  Standard Timings: none
  Detailed Timing Descriptors:
    DTD 1:  1920x1080   60.000000 Hz  16:9     67.200 kHz    147.840000 MHz (382 mm x 215 mm)
                 Hfront   48 Hsync  32 Hback  200 Hpol P
                 Vfront    3 Vsync   6 Vback   31 Vpol N
    DTD 2:  1920x1080   48.003247 Hz  16:9     53.764 kHz    118.280000 MHz (382 mm x 215 mm)
                 Hfront   48 Hsync  32 Hback  200 Hpol P
                 Vfront    3 Vsync   6 Vback   31 Vpol N
    Alphanumeric Data String: 'HGP10.NV17N4L'
    Manufacturer-Specified Display Descriptor (0x00): 00 00 00 02 41 21 b2 00 10 00 00 0a 41 0a 20 20 '....A!......A.  '
Checksum: 0x61

----------------

Warnings:

Block 0, Base EDID:
  Alphanumeric Data String: Non-ASCII character 0x80 at position 5, can cause problems.
  Missing Display Product Name.

EDID conformity: PASS
