edid-decode (hex):

00 ff ff ff ff ff ff 00 06 af b8 2d 00 00 00 00
32 22 01 04 b5 1e 13 78 03 89 e5 a4 54 4c a1 26
0f 50 54 00 00 00 01 01 01 01 01 01 01 01 01 01
01 01 01 01 01 01 3e d8 00 a0 a0 40 60 60 30 20
a5 00 2d bc 10 00 00 1a 7f 56 00 a0 a0 40 60 60
30 20 a5 00 2d bc 10 00 00 1a 00 00 00 fe 00 50
4b 44 35 57 80 42 31 34 30 51 41 4e 00 00 00 00
00 03 41 2e 9e 00 11 00 00 0b 41 0a 20 20 01 a3

70 20 79 02 00 20 00 13 4f 55 41 b8 2d 00 00 00
00 32 18 07 42 31 34 30 51 41 4e 21 01 1d c8 0b
5d 07 00 0a 40 06 88 49 fa 53 c8 44 a1 6a 92 0f
02 35 54 b0 5c d0 5f cc 34 13 78 22 00 14 6b 72
08 85 ff 09 9f 00 2f 80 1f 00 3f 06 5f 00 09 00
04 00 25 01 09 6b 72 08 6b 72 08 30 78 80 81 00
15 74 1a 00 00 03 51 30 78 00 00 53 49 53 49 78
00 00 00 00 00 00 00 00 00 00 00 00 00 00 bc 90

00 ff ff ff ff ff ff 00 06 af b8 2d 00 00 00 00
32 22 01 04 b5 1e 13 78 03 89 e5 a4 54 4c a1 26
0f 50 54 00 00 00 01 01 01 01 01 01 01 01 01 01
01 01 01 01 01 01 3e d8 00 a0 a0 40 60 60 30 20
a5 00 2d bc 10 00 00 1a 7f 56 00 a0 a0 40 60 60
30 20 a5 00 2d bc 10 00 00 1a 00 00 00 fe 00 50
4b 44 35 57 80 42 31 34 30 51 41 4e 00 00 00 00
00 03 41 2e 9e 00 11 00 00 0b 41 0a 20 20 01 a3

70 20 79 02 00 20 00 13 4f 55 41 b8 2d 00 00 00
00 32 18 07 42 31 34 30 51 41 4e 21 01 1d c8 0b
5d 07 00 0a 40 06 88 49 fa 53 c8 44 a1 6a 92 0f
02 35 54 b0 5c d0 5f cc 34 13 78 22 00 14 6b 72
08 85 ff 09 9f 00 2f 80 1f 00 3f 06 5f 00 09 00
04 00 25 01 09 6b 72 08 6b 72 08 30 78 80 81 00
15 74 1a 00 00 03 51 30 78 00 00 53 49 53 49 78
00 00 00 00 00 00 00 00 00 00 00 00 00 00 bc 90

----------------

Block 0, Base EDID:
  EDID Structure Version & Revision: 1.4
  Vendor & Product Identification:
    Manufacturer: AUO
    Model: 11704
    Made in: week 50 of 2024
  Basic Display Parameters & Features:
    Digital display
    Bits per primary color channel: 10
    DisplayPort interface
    Maximum image size: 30 cm x 19 cm
    Gamma: 2.20
    Supported color formats: RGB 4:4:4
    First detailed timing includes the native pixel format and preferred refresh rate
    Display supports continuous frequencies
  Color Characteristics:
    Red  : 0.6425, 0.3281
    Green: 0.2988, 0.6298
    Blue : 0.1513, 0.0605
    White: 0.3134, 0.3291
  Established Timings I & II: none
  Standard Timings: none
  Detailed Timing Descriptors:
    DTD 1:  2560x1600  120.001214 Hz  16:10   203.522 kHz    553.580000 MHz (301 mm x 188 mm)
                 Hfront   48 Hsync  32 Hback   80 Hpol P
                 Vfront   10 Vsync   5 Vback   81 Vpol N
    DTD 2:  2560x1600   48.000052 Hz  16:10    81.408 kHz    221.430000 MHz (301 mm x 188 mm)
                 Hfront   48 Hsync  32 Hback   80 Hpol P
                 Vfront   10 Vsync   5 Vback   81 Vpol N
    Alphanumeric Data String: 'PKD5W.B140QAN'
    Manufacturer-Specified Display Descriptor (0x00): 00 00 00 03 41 2e 9e 00 11 00 00 0b 41 0a 20 20 '....A.......A.  '
  Extension blocks: 1
Checksum: 0xa3

----------------

Block 1, DisplayID Extension Block:
  Version: 2.0
  Extension Count: 0
  Display Product Primary Use Case: None of the listed primary use cases; generic display
  Product Identification Data Block (0x20), OUI 4F-55-41:
    Product Code: 11704
    Year of Manufacture: 2024, Week 50
    Product ID: B140QAN
  Display Parameters Data Block (0x21):
    Image size: 301.6 mm x 188.5 mm
    Display native pixel format: 2560x1600
    Scan Orientation: Left to Right, Top to Bottom
    Luminance Information: Guidance for the Source device
    Color Information: CIE 1931
    Audio Speaker Information: not integrated
    Native Color Chromaticity:
      Primary #1:  (0.642822, 0.327881)
      Primary #2:  (0.298828, 0.629883)
      Primary #3:  (0.150879, 0.060791)
      White Point: (0.312988, 0.328857)
    Native Maximum Luminance (Full Coverage): 300.000000 cd/m^2
    Native Maximum Luminance (10% Rectangular Coverage): 500.000000 cd/m^2
    Native Minimum Luminance: 0.299805 cd/m^2
    Native Color Depth: 10 bpc
    Display Device Technology: Active Matrix LCD
    Display Device Theme Preference: No Preference
    Native Gamma EOTF: 2.20
  Video Timing Modes Type 7 - Detailed Timings Data Block:
    DTD:  2560x1600  120.001214 Hz  16:10   203.522 kHz    553.580000 MHz (aspect 16:10, no 3D stereo, preferred)
               Hfront   48 Hsync  32 Hback   80 Hpol P
               Vfront   10 Vsync   5 Vback   81 Vpol N
  Dynamic Video Timing Range Limits Data Block:
    Minimum Pixel Clock: 553580 kHz
    Maximum Pixel Clock: 553580 kHz
    Minimum Vertical Refresh Rate: 48 Hz
    Maximum Vertical Refresh Rate: 120 Hz
    Seamless Dynamic Video Timing Support: Yes
  CTA-861 DisplayID Data Block:
  Vendor-Specific Data Block (AMD), OUI 00-00-1A:
    Version: 3
    Feature Caps: 0x51
      FreeSync Panel Replay Supported
    Minimum Refresh Rate: 48 Hz
    Maximum Refresh Rate: 120 Hz
    Flags 1.x: 0x00
    Flags 2.x: 0x00
  Checksum: 0xbc
Checksum: 0x90

----------------

Warnings:

Block 0, Base EDID:
  Alphanumeric Data String: Non-ASCII character 0x80 at position 5, can cause problems.
  Missing Display Product Name.
Block 1, DisplayID Extension Block:
  Product Identification Data Block (0x20), OUI 4F-55-41: Unknown OUI 4F-55-41 (possible PNP OUA).

Failures:

Block 0, Base EDID:
  Missing Display Range Limits Descriptor.
EDID:
  Extension Block 2 started with EDID header, ignoring Extension Blocks >= 2.

EDID conformity: FAIL
