edid-decode (hex):

00 ff ff ff ff ff ff 00 10 ac ec 93 f2 06 22 00
27 17 01 03 80 33 1d 78 0a c6 65 a0 59 58 9d 27
0e 50 54 21 08 00 d1 c0 81 c0 81 80 95 00 b3 00
01 01 01 01 01 01 02 3a 80 18 71 38 2d 40 94 2c
45 08 fe 1f 11 00 00 1e 66 21 50 b0 51 00 1b 30
40 70 36 00 fe 1f 11 00 00 1e 00 00 00 fc 00 4f
70 74 69 50 6c 65 78 20 37 34 34 30 00 00 00 fd
00 31 4b 1c 5f 09 00 0a 20 20 20 20 20 20 01 61

02 03 1c 71 49 90 01 03 04 11 12 13 02 1f 23 09
07 07 83 01 00 00 65 03 0c 00 10 00 8c 0a d0 8a
20 e0 2d 10 10 3e 96 00 c4 8e 21 00 00 19 8c 0a
d0 90 20 40 31 20 0c 40 55 00 c4 8e 21 00 00 19
01 1d 00 bc 52 d0 1e 20 b8 28 55 40 c4 8e 21 00
00 1f 01 1d 00 72 51 d0 1e 20 6e 28 55 00 c4 8e
21 00 00 1f 02 3a 80 d0 72 38 2d 40 94 2c 45 08
fe 1f 11 00 00 1f 00 00 00 00 00 00 00 00 00 d9

00 ff ff ff ff ff ff 00 10 ac ec 93 f2 06 22 00
27 17 01 03 80 33 1d 78 0a c6 65 a0 59 58 9d 27
0e 50 54 21 08 00 d1 c0 81 c0 81 80 95 00 b3 00
01 01 01 01 01 01 02 3a 80 18 71 38 2d 40 94 2c
45 08 fe 1f 11 00 00 1e 66 21 50 b0 51 00 1b 30
40 70 36 00 fe 1f 11 00 00 1e 00 00 00 fc 00 4f
70 74 69 50 6c 65 78 20 37 34 34 30 00 00 00 fd
00 31 4b 1c 5f 09 00 0a 20 20 20 20 20 20 01 61

02 03 1c 71 49 90 01 03 04 11 12 13 02 1f 23 09
07 07 83 01 00 00 65 03 0c 00 10 00 8c 0a d0 8a
20 e0 2d 10 10 3e 96 00 c4 8e 21 00 00 19 8c 0a
d0 90 20 40 31 20 0c 40 55 00 c4 8e 21 00 00 19
01 1d 00 bc 52 d0 1e 20 b8 28 55 40 c4 8e 21 00
00 1f 01 1d 00 72 51 d0 1e 20 6e 28 55 00 c4 8e
21 00 00 1f 02 3a 80 d0 72 38 2d 40 94 2c 45 08
fe 1f 11 00 00 1f 00 00 00 00 00 00 00 00 00 d9

----------------

Block 0, Base EDID:
  EDID Structure Version & Revision: 1.3
  Vendor & Product Identification:
    Manufacturer: DEL
    Model: 37868
    Serial Number: ...
    Made in: week 39 of 2013
  Basic Display Parameters & Features:
    Digital display
    Maximum image size: 51 cm x 29 cm
    Gamma: 2.20
    RGB color display
    First detailed timing is the preferred timing
  Color Characteristics:
    Red  : 0.6279, 0.3476
    Green: 0.3447, 0.6152
    Blue : 0.1533, 0.0566
    White: 0.3134, 0.3291
  Established Timings I & II:
    DMT 0x04:   640x480    59.940476 Hz   4:3     31.469 kHz     25.175000 MHz
    DMT 0x09:   800x600    60.316541 Hz   4:3     37.879 kHz     40.000000 MHz
    DMT 0x10:  1024x768    60.003840 Hz   4:3     48.363 kHz     65.000000 MHz
  Standard Timings:
    DMT 0x52:  1920x1080   60.000000 Hz  16:9     67.500 kHz    148.500000 MHz
    DMT 0x55:  1280x720    60.000000 Hz  16:9     45.000 kHz     74.250000 MHz
    DMT 0x23:  1280x1024   60.019740 Hz   5:4     63.981 kHz    108.000000 MHz
    DMT 0x2f:  1440x900    59.887445 Hz  16:10    55.935 kHz    106.500000 MHz
    DMT 0x3a:  1680x1050   59.954250 Hz  16:10    65.290 kHz    146.250000 MHz
  Detailed Timing Descriptors:
    DTD 1:  1920x1080   60.000000 Hz  16:9     67.500 kHz    148.500000 MHz (510 mm x 287 mm)
                 Hfront  148 Hsync  44 Hback   88 Hpol P
                 Vfront   36 Vsync   5 Vback    4 Vpol P
    DTD 2:  1360x768    60.015162 Hz  85:48    47.712 kHz     85.500000 MHz (510 mm x 287 mm)
                 Hfront   64 Hsync 112 Hback  256 Hpol P
                 Vfront    3 Vsync   6 Vback   18 Vpol P
    Display Product Name: 'OptiPlex 7440'
    Display Range Limits:
      Monitor ranges (GTF): 49-75 Hz V, 28-95 kHz H, max dotclock 90 MHz
  Extension blocks: 1
Checksum: 0x61

----------------

Block 1, CTA-861 Extension Block:
  Revision: 3
  Basic audio support
  Supports YCbCr 4:4:4
  Supports YCbCr 4:2:2
  Native DTDs: 1
  Video Data Block:
    VIC  16:  1920x1080   60.000000 Hz  16:9     67.500 kHz    148.500000 MHz (native)
    VIC   1:   640x480    59.940476 Hz   4:3     31.469 kHz     25.175000 MHz
    VIC   3:   720x480    59.940060 Hz  16:9     31.469 kHz     27.000000 MHz
    VIC   4:  1280x720    60.000000 Hz  16:9     45.000 kHz     74.250000 MHz
    VIC  17:   720x576    50.000000 Hz   4:3     31.250 kHz     27.000000 MHz
    VIC  18:   720x576    50.000000 Hz  16:9     31.250 kHz     27.000000 MHz
    VIC  19:  1280x720    50.000000 Hz  16:9     37.500 kHz     74.250000 MHz
    VIC   2:   720x480    59.940060 Hz   4:3     31.469 kHz     27.000000 MHz
    VIC  31:  1920x1080   50.000000 Hz  16:9     56.250 kHz    148.500000 MHz
  Audio Data Block:
    Linear PCM:
      Max channels: 2
      Supported sample rates (kHz): 48 44.1 32
      Supported sample sizes (bits): 24 20 16
  Speaker Allocation Data Block:
    FL/FR - Front Left/Right
  Vendor-Specific Data Block (HDMI), OUI 00-0C-03:
    Source physical address: 1.0.0.0
  Detailed Timing Descriptors:
    DTD 3:   720x480    59.940060 Hz   3:2     31.469 kHz     27.000000 MHz (708 mm x 398 mm)
                 Hfront   16 Hsync  62 Hback   60 Hpol N
                 Vfront    9 Vsync   6 Vback   30 Vpol N
    DTD 4:   720x576    50.000000 Hz   5:4     31.250 kHz     27.000000 MHz (708 mm x 398 mm)
                 Hfront   12 Hsync  64 Hback   68 Hpol N
                 Vfront    5 Vsync   5 Vback   39 Vpol N
    DTD 5:  1280x720    50.000000 Hz  16:9     37.500 kHz     74.250000 MHz (708 mm x 398 mm)
                 Hfront  440 Hsync  40 Hback  220 Hpol P
                 Vfront    5 Vsync   5 Vback   20 Vpol P
    DTD 6:  1280x720    60.000000 Hz  16:9     45.000 kHz     74.250000 MHz (708 mm x 398 mm)
                 Hfront  110 Hsync  40 Hback  220 Hpol P
                 Vfront    5 Vsync   5 Vback   20 Vpol P
    DTD 7:  1920x1080   50.000000 Hz  16:9     56.250 kHz    148.500000 MHz (510 mm x 287 mm)
                 Hfront  148 Hsync  44 Hback  528 Hpol P
                 Vfront   36 Vsync   5 Vback    4 Vpol P
Checksum: 0xd9  Unused space in Extension Block: 9 bytes

----------------

Warnings:

Block 0, Base EDID:
  Detailed Timing Descriptor #1: DTD is similar but not identical to VIC 16.
Block 1, CTA-861 Extension Block:
  IT Video Formats are overscanned by default, but normally this should be underscanned.
  Video Data Block: VIC 16 and the first DTD are not identical. Is this intended?
  Detailed Timing Descriptor #3: Image size is 708x398 mm, but based on the picture AR it should be 597x398 mm.
  Detailed Timing Descriptor #4: Image size is 708x398 mm, but based on the picture AR it should be 497x398 mm.
  Detailed Timing Descriptor #7: DTD is similar but not identical to VIC 31.
  Add a Colorimetry Data Block with the sRGB colorimetry bit set to avoid interop issues.
EDID:
  Base EDID: Some timings are out of range of the Monitor Ranges:
    Maximum Clock: 148.500 MHz (Monitor: 90.000 MHz)

Failures:

Block 1, CTA-861 Extension Block:
  Detailed Timing Descriptor #3: Mismatch of image size 708x398 mm vs display size 510x290 mm.
  Detailed Timing Descriptor #4: Mismatch of image size 708x398 mm vs display size 510x290 mm.
  Detailed Timing Descriptor #5: Mismatch of image size 708x398 mm vs display size 510x290 mm.
  Detailed Timing Descriptor #6: Mismatch of image size 708x398 mm vs display size 510x290 mm.
  Missing VCDB, needed for Set Selectable RGB Quantization to avoid interop issues.
EDID:
  Extension Block 2 started with EDID header, ignoring Extension Blocks >= 2.
  Base EDID: The DTD max image size is 708x398mm, which is larger than the display size 510.0x290.0mm.

EDID conformity: FAIL
