edid-decode (hex):

00 ff ff ff ff ff ff 00 1e 6d 05 9d 01 01 01 01
07 12 01 03 08 46 27 78 ea d9 b0 a3 57 49 9c 25
11 49 4b a1 08 00 01 01 45 40 61 40 01 01 01 01
01 01 01 01 01 01 64 19 00 40 41 00 26 30 18 88
36 00 bc 86 21 00 00 00 a0 0f 20 00 31 58 1c 20
28 80 11 00 bc 39 20 00 00 00 00 00 00 fd 00 3b
46 1f 4a 10 00 0a 20 20 20 20 20 20 00 00 00 fc
00 4c 47 20 54 56 0a 20 20 20 20 20 20 20 00 e1

----------------

Block 0, Base EDID:
  EDID Structure Version & Revision: 1.3
  Vendor & Product Identification:
    Manufacturer: GSM
    Model: 40197
    Serial Number: ...
    Made in: week 7 of 2008
  Basic Display Parameters & Features:
    Analog display
    Signal Level Standard: 0.700 : 0.300 : 1.000 V p-p
    Blank level equals black level
    Sync: Separate
    Maximum image size: 70 cm x 39 cm
    Gamma: 2.20
    DPMS levels: Standby Suspend Off
    RGB color display
    First detailed timing is the preferred timing
  Color Characteristics:
    Red  : 0.6396, 0.3408
    Green: 0.2871, 0.6103
    Blue : 0.1464, 0.0693
    White: 0.2851, 0.2929
  Established Timings I & II:
    IBM     :   720x400    70.081663 Hz   9:5     31.467 kHz     28.320000 MHz
    DMT 0x04:   640x480    59.940476 Hz   4:3     31.469 kHz     25.175000 MHz
    DMT 0x09:   800x600    60.316541 Hz   4:3     37.879 kHz     40.000000 MHz
    DMT 0x10:  1024x768    60.003840 Hz   4:3     48.363 kHz     65.000000 MHz
  Standard Timings:
    DMT 0x09:   800x600    60.316541 Hz   4:3     37.879 kHz     40.000000 MHz
    DMT 0x10:  1024x768    60.003840 Hz   4:3     48.363 kHz     65.000000 MHz
  Detailed Timing Descriptors:
    DTD 1:  1024x768    60.003840 Hz   4:3     48.363 kHz     65.000000 MHz (analog composite, sync-on-green, 700 mm x 390 mm)
                 Hfront   24 Hsync 136 Hback  160 Hpol N
                 Vfront    3 Vsync   6 Vback   29 Vpol N
    DTD 2:   800x600    60.316541 Hz   4:3     37.879 kHz     40.000000 MHz (analog composite, sync-on-green, 700 mm x 57 mm)
                 Hfront   40 Hsync 128 Hback   88 Hpol N
                 Vfront    1 Vsync   1 Vback   26 Vpol N
    Display Range Limits:
      Monitor ranges (GTF): 59-70 Hz V, 31-74 kHz H, max dotclock 160 MHz
    Display Product Name: 'LG TV'
Checksum: 0xe1

----------------

Warnings:

Block 0, Base EDID:
  Vendor & Product Identification: The serial number is one of the known dummy values, it should probably be set to 0.
  Detailed Timing Descriptor #1: Image size is 700x390 mm, but based on the picture AR it should be 700x525 mm.
  Detailed Timing Descriptor #2: DTD is similar but not identical to DMT 0x09.
  Detailed Timing Descriptor #2: Dubious image size (700x57 mm is smaller than 100x100 mm).

EDID conformity: PASS
