edid-decode (hex):

00 ff ff ff ff ff ff 00 30 ae a0 40 00 00 00 00
2a 1a 01 04 95 1f 11 78 ea 8e d5 94 57 53 93 27
21 50 54 00 00 00 01 01 01 01 01 01 01 01 01 01
01 01 01 01 01 01 da 1d 56 e2 50 00 20 30 44 2d
47 00 35 ad 10 00 00 18 e1 17 56 e2 50 00 20 30
44 2d 47 00 35 ad 10 00 00 18 00 00 00 0f 00 8c
09 30 8c 09 30 16 09 00 0d ae d6 14 00 00 00 fe
00 4e 31 34 30 42 47 41 2d 45 41 34 0a 20 00 6c

00 ff ff ff ff ff ff 00 30 ae a0 40 00 00 00 00
2a 1a 01 04 95 1f 11 78 ea 8e d5 94 57 53 93 27
21 50 54 00 00 00 01 01 01 01 01 01 01 01 01 01
01 01 01 01 01 01 da 1d 56 e2 50 00 20 30 44 2d
47 00 35 ad 10 00 00 18 e1 17 56 e2 50 00 20 30
44 2d 47 00 35 ad 10 00 00 18 00 00 00 0f 00 8c
09 30 8c 09 30 16 09 00 0d ae d6 14 00 00 00 fe
00 4e 31 34 30 42 47 41 2d 45 41 34 0a 20 00 6c

----------------

Block 0, Base EDID:
  EDID Structure Version & Revision: 1.4
  Vendor & Product Identification:
    Manufacturer: LEN
    Model: 16544
    Made in: week 42 of 2016
  Basic Display Parameters & Features:
    Digital display
    Bits per primary color channel: 6
    DisplayPort interface
    Maximum image size: 31 cm x 17 cm
    Gamma: 2.20
    DPMS levels: Standby Suspend Off
    Supported color formats: RGB 4:4:4, YCrCb 4:4:4
    First detailed timing includes the native pixel format and preferred refresh rate
  Color Characteristics:
    Red  : 0.5800, 0.3398
    Green: 0.3271, 0.5761
    Blue : 0.1552, 0.1298
    White: 0.3134, 0.3291
  Established Timings I & II: none
  Standard Timings: none
  Detailed Timing Descriptors:
    DTD 1:  1366x768    60.003141 Hz 683:384   48.003 kHz     76.420000 MHz (309 mm x 173 mm)
                 Hfront   68 Hsync  45 Hback  113 Hpol N
                 Vfront    4 Vsync   7 Vback   21 Vpol N
    DTD 2:  1366x768    47.997802 Hz 683:384   38.398 kHz     61.130000 MHz (309 mm x 173 mm)
                 Hfront   68 Hsync  45 Hback  113 Hpol N
                 Vfront    4 Vsync   7 Vback   21 Vpol N
    Manufacturer-Specified Display Descriptor (0x0f): 00 0f 00 8c 09 30 8c 09 30 16 09 00 0d ae d6 14 '.....0..0.......'
    Alphanumeric Data String: 'N140BGA-EA4'
Checksum: 0x6c

----------------

Warnings:

Block 0, Base EDID:
  Missing Display Product Name.

Failures:

EDID:
  Extension Block 1 started with EDID header, ignoring Extension Blocks >= 1.

EDID conformity: FAIL
