edid-decode (hex):

00 ff ff ff ff ff ff 00 30 ae a0 40 00 00 00 00
00 1b 01 04 95 1f 11 78 e2 c0 d5 8f 56 58 93 29
20 50 54 00 00 00 01 01 01 01 01 01 01 01 01 01
01 01 01 01 01 01 ce 1d 56 e2 50 00 1e 30 26 16
36 00 35 ad 10 00 00 18 d8 17 56 e2 50 00 1e 30
26 16 36 00 35 ad 10 00 00 18 00 00 00 0f 00 8c
09 3c 8c 09 30 16 09 00 06 af 3c 72 00 00 00 fe
00 42 31 34 30 58 54 4e 30 37 2e 32 20 0a 00 42

00 ff ff ff ff ff ff 00 30 ae a0 40 00 00 00 00
00 1b 01 04 95 1f 11 78 e2 c0 d5 8f 56 58 93 29
20 50 54 00 00 00 01 01 01 01 01 01 01 01 01 01
01 01 01 01 01 01 ce 1d 56 e2 50 00 1e 30 26 16
36 00 35 ad 10 00 00 18 d8 17 56 e2 50 00 1e 30
26 16 36 00 35 ad 10 00 00 18 00 00 00 0f 00 8c
09 3c 8c 09 30 16 09 00 06 af 3c 72 00 00 00 fe
00 42 31 34 30 58 54 4e 30 37 2e 32 20 0a 00 42

----------------

Block 0, Base EDID:
  EDID Structure Version & Revision: 1.4
  Vendor & Product Identification:
    Manufacturer: LEN
    Model: 16544
    Made in: 2017
  Basic Display Parameters & Features:
    Digital display
    Bits per primary color channel: 6
    DisplayPort interface
    Maximum image size: 31 cm x 17 cm
    Gamma: 2.20
    DPMS levels: Standby Suspend Off
    Supported color formats: RGB 4:4:4
    First detailed timing includes the native pixel format and preferred refresh rate
  Color Characteristics:
    Red  : 0.5615, 0.3359
    Green: 0.3437, 0.5742
    Blue : 0.1630, 0.1259
    White: 0.3134, 0.3291
  Established Timings I & II: none
  Standard Timings: none
  Detailed Timing Descriptors:
    DTD 1:  1366x768    60.059067 Hz 683:384   47.927 kHz     76.300000 MHz (309 mm x 173 mm)
                 Hfront   38 Hsync  22 Hback  166 Hpol N
                 Vfront    3 Vsync   6 Vback   21 Vpol N
    DTD 2:  1366x768    48.047254 Hz 683:384   38.342 kHz     61.040000 MHz (309 mm x 173 mm)
                 Hfront   38 Hsync  22 Hback  166 Hpol N
                 Vfront    3 Vsync   6 Vback   21 Vpol N
    Manufacturer-Specified Display Descriptor (0x0f): 00 0f 00 8c 09 3c 8c 09 30 16 09 00 06 af 3c 72 '.....<..0.....<r'
    Alphanumeric Data String: 'B140XTN07.2 '
Checksum: 0x42

----------------

Warnings:

Block 0, Base EDID:
  Missing Display Product Name.

Failures:

Block 0, Base EDID:
  Alphanumeric Data String: One or more trailing spaces before newline.
EDID:
  Extension Block 1 started with EDID header, ignoring Extension Blocks >= 1.

EDID conformity: FAIL
