edid-decode (hex):

00 ff ff ff ff ff ff 00 30 ae 11 40 00 00 00 00
1c 14 01 03 80 1a 10 78 ea e5 95 93 56 4f 90 28
28 50 54 00 00 00 01 01 01 01 01 01 01 01 01 01
01 01 01 01 01 01 c7 1b 00 a0 50 20 17 30 30 20
36 00 05 a3 10 00 00 18 2a 17 00 a0 50 20 17 30
30 20 36 00 05 a3 10 00 00 18 00 00 00 0f 00 81
0a 3c 81 0a 32 16 09 00 30 64 09 12 00 00 00 fe
00 4c 54 31 32 31 44 45 56 51 42 30 30 0a 00 65

00 ff ff ff ff ff ff 00 30 ae 11 40 00 00 00 00
1c 14 01 03 80 1a 10 78 ea e5 95 93 56 4f 90 28
28 50 54 00 00 00 01 01 01 01 01 01 01 01 01 01
01 01 01 01 01 01 c7 1b 00 a0 50 20 17 30 30 20
36 00 05 a3 10 00 00 18 2a 17 00 a0 50 20 17 30
30 20 36 00 05 a3 10 00 00 18 00 00 00 0f 00 81
0a 3c 81 0a 32 16 09 00 30 64 09 12 00 00 00 fe
00 4c 54 31 32 31 44 45 56 51 42 30 30 0a 00 65

----------------

Block 0, Base EDID:
  EDID Structure Version & Revision: 1.3
  Vendor & Product Identification:
    Manufacturer: LEN
    Model: 16401
    Made in: week 28 of 2010
  Basic Display Parameters & Features:
    Digital display
    Maximum image size: 26 cm x 16 cm
    Gamma: 2.20
    DPMS levels: Standby Suspend Off
    RGB color display
    First detailed timing is the preferred timing
  Color Characteristics:
    Red  : 0.5771, 0.3378
    Green: 0.3095, 0.5634
    Blue : 0.1582, 0.1572
    White: 0.3134, 0.3291
  Established Timings I & II: none
  Standard Timings: none
  Detailed Timing Descriptors:
    DTD 1:  1280x800    60.002363 Hz  16:10    49.382 kHz     71.110000 MHz (261 mm x 163 mm)
                 Hfront   48 Hsync  32 Hback   80 Hpol N
                 Vfront    3 Vsync   6 Vback   14 Vpol N
    DTD 2:  1280x800    50.037127 Hz  16:10    41.181 kHz     59.300000 MHz (261 mm x 163 mm)
                 Hfront   48 Hsync  32 Hback   80 Hpol N
                 Vfront    3 Vsync   6 Vback   14 Vpol N
    Manufacturer-Specified Display Descriptor (0x0f): 00 0f 00 81 0a 3c 81 0a 32 16 09 00 30 64 09 12 '.....<..2...0d..'
    Alphanumeric Data String: 'LT121DEVQB00'
Checksum: 0x65

----------------

Failures:

Block 0, Base EDID:
  Missing Display Product Name.
  Missing Display Range Limits Descriptor.
EDID:
  Extension Block 1 started with EDID header, ignoring Extension Blocks >= 1.

EDID conformity: FAIL
