edid-decode (hex):

00 ff ff ff ff ff ff 00 30 ae 11 40 00 00 00 00
12 14 01 03 80 1a 10 78 ea d0 a3 96 5b 57 94 26
23 52 59 00 00 00 01 01 01 01 01 01 01 01 01 01
01 01 01 01 01 01 8a 1b 00 ab 50 20 0a 30 30 20
33 00 05 a3 10 00 00 18 8a 1b 00 ab 50 20 0a 30
30 20 33 00 05 a3 10 00 00 18 00 00 00 0f 00 81
0a 3c 81 0a 3c 1e 09 00 30 64 00 08 00 00 00 fe
00 4c 54 44 31 32 31 4b 58 36 42 0a 20 20 00 79

00 ff ff ff ff ff ff 00 30 ae 11 40 00 00 00 00
12 14 01 03 80 1a 10 78 ea d0 a3 96 5b 57 94 26
23 52 59 00 00 00 01 01 01 01 01 01 01 01 01 01
01 01 01 01 01 01 8a 1b 00 ab 50 20 0a 30 30 20
33 00 05 a3 10 00 00 18 8a 1b 00 ab 50 20 0a 30
30 20 33 00 05 a3 10 00 00 18 00 00 00 0f 00 81
0a 3c 81 0a 3c 1e 09 00 30 64 00 08 00 00 00 fe
00 4c 54 44 31 32 31 4b 58 36 42 0a 20 20 00 79

----------------

Block 0, Base EDID:
  EDID Structure Version & Revision: 1.3
  Vendor & Product Identification:
    Manufacturer: LEN
    Model: 16401
    Made in: week 18 of 2010
  Basic Display Parameters & Features:
    Digital display
    Maximum image size: 26 cm x 16 cm
    Gamma: 2.20
    DPMS levels: Standby Suspend Off
    RGB color display
    First detailed timing is the preferred timing
  Color Characteristics:
    Red  : 0.5888, 0.3564
    Green: 0.3398, 0.5781
    Blue : 0.1503, 0.1386
    White: 0.3203, 0.3505
  Established Timings I & II: none
  Standard Timings: none
  Detailed Timing Descriptors:
    DTD 1:  1280x800    59.984174 Hz  16:10    48.587 kHz     70.500000 MHz (261 mm x 163 mm)
                 Hfront   48 Hsync  32 Hback   91 Hpol N
                 Vfront    3 Vsync   3 Vback    4 Vpol N
    DTD 2:  1280x800    59.984174 Hz  16:10    48.587 kHz     70.500000 MHz (261 mm x 163 mm)
                 Hfront   48 Hsync  32 Hback   91 Hpol N
                 Vfront    3 Vsync   3 Vback    4 Vpol N
    Manufacturer-Specified Display Descriptor (0x0f): 00 0f 00 81 0a 3c 81 0a 3c 1e 09 00 30 64 00 08 '.....<..<...0d..'
    Alphanumeric Data String: 'LTD121KX6B'
Checksum: 0x79

----------------

Failures:

Block 0, Base EDID:
  Missing Display Product Name.
  Missing Display Range Limits Descriptor.
EDID:
  Extension Block 1 started with EDID header, ignoring Extension Blocks >= 1.

EDID conformity: FAIL
