edid-decode (hex):

00 ff ff ff ff ff ff 00 22 f0 80 10 01 00 00 00
15 17 01 03 80 33 1d 78 0a 05 40 a5 56 51 9d 25
0e 50 54 00 00 00 01 01 01 01 01 01 01 01 01 01
01 01 01 01 01 01 9d 34 80 64 70 38 1f 40 30 20
26 00 fe 1f 11 00 00 18 00 00 00 fe 00 56 30 38
0a 20 20 20 20 20 20 20 20 20 00 00 00 fc 00 48
50 51 20 38 30 30 20 41 49 4f 0a 20 00 00 00 fe
00 4c 54 4d 32 33 30 48 4c 30 38 0a 20 20 00 e8

----------------

Block 0, Base EDID:
  EDID Structure Version & Revision: 1.3
  Vendor & Product Identification:
    Manufacturer: HWP
    Model: 4224
    Serial Number: ...
    Made in: week 21 of 2013
  Basic Display Parameters & Features:
    Digital display
    Maximum image size: 51 cm x 29 cm
    Gamma: 2.20
    RGB color display
    First detailed timing is the preferred timing
  Color Characteristics:
    Red  : 0.6445, 0.3359
    Green: 0.3173, 0.6142
    Blue : 0.1455, 0.0546
    White: 0.3125, 0.3281
  Established Timings I & II: none
  Standard Timings: none
  Detailed Timing Descriptors:
    DTD 1:  1920x1080   60.016398 Hz  16:9     66.678 kHz    134.690000 MHz (510 mm x 287 mm)
                 Hfront   48 Hsync  32 Hback   20 Hpol N
                 Vfront    2 Vsync   6 Vback   23 Vpol N
    Alphanumeric Data String: 'V08'
    Display Product Name: 'HPQ 800 AIO'
    Alphanumeric Data String: 'LTM230HL08'
Checksum: 0xe8

----------------

Warnings:

Block 0, Base EDID:
  Vendor & Product Identification: The serial number is one of the known dummy values, it should probably be set to 0.

Failures:

Block 0, Base EDID:
  Missing Display Range Limits Descriptor.

EDID conformity: FAIL
