edid-decode (hex):

00 ff ff ff ff ff ff 00 30 64 e1 58 01 01 01 01
0f 11 01 03 80 1a 10 78 0a 87 ae 99 57 4f 8c 26
22 50 54 00 00 00 01 01 01 01 01 01 01 01 01 01
01 01 01 01 01 01 9e 20 00 90 51 20 1f 30 48 80
36 00 05 a3 10 00 00 18 00 00 00 0f 00 02 d3 04
d5 00 17 01 18 b9 d7 04 19 00 00 00 00 fe 00 54
4d 44 49 53 50 4c 41 59 0a 20 20 20 00 00 00 fe
00 4c 54 44 31 32 31 45 58 45 56 0a 20 20 00 5c

00 ff ff ff ff ff ff 00 30 64 e1 58 01 01 01 01
0f 11 01 03 80 1a 10 78 0a 87 ae 99 57 4f 8c 26
22 50 54 00 00 00 01 01 01 01 01 01 01 01 01 01
01 01 01 01 01 01 9e 20 00 90 51 20 1f 30 48 80
36 00 05 a3 10 00 00 18 00 00 00 0f 00 02 d3 04
d5 00 17 01 18 b9 d7 04 19 00 00 00 00 fe 00 54
4d 44 49 53 50 4c 41 59 0a 20 20 20 00 00 00 fe
00 4c 54 44 31 32 31 45 58 45 56 0a 20 20 00 5c

----------------

Block 0, Base EDID:
  EDID Structure Version & Revision: 1.3
  Vendor & Product Identification:
    Manufacturer: LCD
    Model: 22753
    Serial Number: ...
    Made in: week 15 of 2007
  Basic Display Parameters & Features:
    Digital display
    Maximum image size: 26 cm x 16 cm
    Gamma: 2.20
    RGB color display
    First detailed timing is the preferred timing
  Color Characteristics:
    Red  : 0.5996, 0.3398
    Green: 0.3095, 0.5498
    Blue : 0.1503, 0.1347
    White: 0.3154, 0.3300
  Established Timings I & II: none
  Standard Timings: none
  Detailed Timing Descriptors:
    DTD 1:  1280x800    59.810326 Hz  16:10    49.702 kHz     83.500000 MHz (261 mm x 163 mm)
                 Hfront   72 Hsync 128 Hback  200 Hpol N
                 Vfront    3 Vsync   6 Vback   22 Vpol N
    Manufacturer-Specified Display Descriptor (0x0f): 00 0f 00 02 d3 04 d5 00 17 01 18 b9 d7 04 19 00 '................'
    Alphanumeric Data String: 'TMDISPLAY'
    Alphanumeric Data String: 'LTD121EXEV'
Checksum: 0x5c

----------------

Warnings:

Block 0, Base EDID:
  Vendor & Product Identification: The serial number is one of the known dummy values, it should probably be set to 0.
  Detailed Timing Descriptor #1: DTD is similar but not identical to DMT 0x1c.

Failures:

Block 0, Base EDID:
  Missing Display Product Name.
  Missing Display Range Limits Descriptor.
EDID:
  Extension Block 1 started with EDID header, ignoring Extension Blocks >= 1.

EDID conformity: FAIL
