edid-decode (hex):

00 ff ff ff ff ff ff 00 5c 23 13 10 a9 00 00 00
08 14 01 03 0c 1f 17 78 ea 6b 1e 97 4c 43 94 1d
13 48 4b b5 6c 00 01 01 01 01 01 01 01 01 01 01
01 01 01 01 01 01 64 19 00 40 41 00 26 30 18 88
36 00 37 ea 10 00 00 19 00 00 00 fd 00 32 4b 1e
3c 0a 00 0a 20 20 20 20 20 20 00 00 00 fc 00 44
54 49 2d 35 32 30 0a 20 20 20 20 20 00 00 00 ff
00 30 42 46 50 30 30 31 36 39 0a 20 20 20 00 e8

00 ff ff ff ff ff ff 00 5c 23 13 10 a9 00 00 00
08 14 01 03 0c 1f 17 78 ea 6b 1e 97 4c 43 94 1d
13 48 4b b5 6c 00 01 01 01 01 01 01 01 01 01 01
01 01 01 01 01 01 64 19 00 40 41 00 26 30 18 88
36 00 37 ea 10 00 00 19 00 00 00 fd 00 32 4b 1e
3c 0a 00 0a 20 20 20 20 20 20 00 00 00 fc 00 44
54 49 2d 35 32 30 0a 20 20 20 20 20 00 00 00 ff
00 30 42 46 50 30 30 31 36 39 0a 20 20 20 00 e8

----------------

Block 0, Base EDID:
  EDID Structure Version & Revision: 1.3
  Vendor & Product Identification:
    Manufacturer: WAC
    Model: 4115
    Serial Number: ...
    Made in: week 8 of 2010
  Basic Display Parameters & Features:
    Analog display
    Signal Level Standard: 0.700 : 0.300 : 1.000 V p-p
    Blank level equals black level
    Sync: Separate Composite
    Maximum image size: 31 cm x 23 cm
    Gamma: 2.20
    DPMS levels: Standby Suspend Off
    RGB color display
    First detailed timing is the preferred timing
  Color Characteristics:
    Red  : 0.5908, 0.2988
    Green: 0.2636, 0.5810
    Blue : 0.1132, 0.0751
    White: 0.2841, 0.2949
  Established Timings I & II:
    IBM     :   720x400    70.081663 Hz   9:5     31.467 kHz     28.320000 MHz
    DMT 0x04:   640x480    59.940476 Hz   4:3     31.469 kHz     25.175000 MHz
    Apple   :   640x480    66.666667 Hz   4:3     35.000 kHz     30.240000 MHz
    DMT 0x06:   640x480    75.000000 Hz   4:3     37.500 kHz     31.500000 MHz
    DMT 0x09:   800x600    60.316541 Hz   4:3     37.879 kHz     40.000000 MHz
    DMT 0x0b:   800x600    75.000000 Hz   4:3     46.875 kHz     49.500000 MHz
    Apple   :   832x624    74.551266 Hz   4:3     49.726 kHz     57.284000 MHz
    DMT 0x10:  1024x768    60.003840 Hz   4:3     48.363 kHz     65.000000 MHz
    DMT 0x11:  1024x768    70.069359 Hz   4:3     56.476 kHz     75.000000 MHz
  Standard Timings: none
  Detailed Timing Descriptors:
    DTD 1:  1024x768    60.003840 Hz   4:3     48.363 kHz     65.000000 MHz (311 mm x 234 mm)
                 Hfront   24 Hsync 136 Hback  160 Hpol N
                 Vfront    3 Vsync   6 Vback   29 Vpol N
    Display Range Limits:
      Monitor ranges (GTF): 50-75 Hz V, 30-60 kHz H, max dotclock 100 MHz
    Display Product Name: 'DTI-520'
    Display Product Serial Number: ...
Checksum: 0xe8

----------------

Failures:

EDID:
  Extension Block 1 started with EDID header, ignoring Extension Blocks >= 1.

EDID conformity: FAIL
