edid-decode (hex):

00 ff ff ff ff ff ff 00 2a 59 50 19 00 00 00 00
07 1f 01 03 80 2c 17 78 ea 93 15 a2 54 45 97 25
1a 50 54 bf e8 00 81 80 81 8f 01 01 01 01 01 01
01 01 01 01 01 01 30 2a 40 c8 60 84 64 30 18 50
13 00 b0 f3 10 00 00 1e 00 00 00 fd 00 38 4b 1e
50 10 00 0a 20 20 20 20 20 20 00 00 00 fc 00 48
44 4d 49 0a 20 20 20 20 20 20 20 20 00 00 00 ff
00 31 0a 20 20 20 20 20 20 20 20 20 20 20 01 f9

02 03 21 f1 4c 01 02 03 04 05 07 90 12 13 14 16
1f 23 09 07 07 83 01 00 00 67 03 0c 00 10 00 38
2d 00 00 00 10 00 01 01 40 58 2c 45 00 fe 1f 11
00 00 1e 00 00 00 10 00 1c 16 20 58 2c 25 00 fe
1f 11 00 00 9e 01 1d 00 72 51 d0 1e 20 6e 28 55
00 fe 1f 11 00 00 1e 8c 0a d0 8a 20 e0 2d 10 10
3e 96 00 fe 1f 11 00 00 18 01 1d 00 bc 52 d0 1e
20 b8 28 55 40 e8 12 11 00 00 1e 00 00 00 00 4d

00 ff ff ff ff ff ff 00 2a 59 50 19 00 00 00 00
07 1f 01 03 80 2c 17 78 ea 93 15 a2 54 45 97 25
1a 50 54 bf e8 00 81 80 81 8f 01 01 01 01 01 01
01 01 01 01 01 01 30 2a 40 c8 60 84 64 30 18 50
13 00 b0 f3 10 00 00 1e 00 00 00 fd 00 38 4b 1e
50 10 00 0a 20 20 20 20 20 20 00 00 00 fc 00 48
44 4d 49 0a 20 20 20 20 20 20 20 20 00 00 00 ff
00 31 0a 20 20 20 20 20 20 20 20 20 20 20 01 f9

02 03 21 f1 4c 01 02 03 04 05 07 90 12 13 14 16
1f 23 09 07 07 83 01 00 00 67 03 0c 00 10 00 38
2d 00 00 00 10 00 01 01 40 58 2c 45 00 fe 1f 11
00 00 1e 00 00 00 10 00 1c 16 20 58 2c 25 00 fe
1f 11 00 00 9e 01 1d 00 72 51 d0 1e 20 6e 28 55
00 fe 1f 11 00 00 1e 8c 0a d0 8a 20 e0 2d 10 10
3e 96 00 fe 1f 11 00 00 18 01 1d 00 bc 52 d0 1e
20 b8 28 55 40 e8 12 11 00 00 1e 00 00 00 00 4d

----------------

Block 0, Base EDID:
  EDID Structure Version & Revision: 1.3
  Vendor & Product Identification:
    Manufacturer: JRY
    Model: 6480
    Made in: week 7 of 2021
  Basic Display Parameters & Features:
    Digital display
    Maximum image size: 44 cm x 23 cm
    Gamma: 2.20
    DPMS levels: Standby Suspend Off
    RGB color display
    First detailed timing is the preferred timing
  Color Characteristics:
    Red  : 0.6347, 0.3291
    Green: 0.2695, 0.5927
    Blue : 0.1445, 0.1025
    White: 0.3134, 0.3291
  Established Timings I & II:
    IBM     :   720x400    70.081663 Hz   9:5     31.467 kHz     28.320000 MHz
    DMT 0x04:   640x480    59.940476 Hz   4:3     31.469 kHz     25.175000 MHz
    Apple   :   640x480    66.666667 Hz   4:3     35.000 kHz     30.240000 MHz
    DMT 0x05:   640x480    72.808802 Hz   4:3     37.861 kHz     31.500000 MHz
    DMT 0x06:   640x480    75.000000 Hz   4:3     37.500 kHz     31.500000 MHz
    DMT 0x08:   800x600    56.250000 Hz   4:3     35.156 kHz     36.000000 MHz
    DMT 0x09:   800x600    60.316541 Hz   4:3     37.879 kHz     40.000000 MHz
    DMT 0x0a:   800x600    72.187572 Hz   4:3     48.077 kHz     50.000000 MHz
    DMT 0x0b:   800x600    75.000000 Hz   4:3     46.875 kHz     49.500000 MHz
    Apple   :   832x624    74.551266 Hz   4:3     49.726 kHz     57.284000 MHz
    DMT 0x10:  1024x768    60.003840 Hz   4:3     48.363 kHz     65.000000 MHz
  Standard Timings:
    DMT 0x23:  1280x1024   60.019740 Hz   5:4     63.981 kHz    108.000000 MHz
    DMT 0x24:  1280x1024   75.024675 Hz   5:4     79.976 kHz    135.000000 MHz
  Detailed Timing Descriptors:
    DTD 1:  1600x900    60.000000 Hz  16:9     60.000 kHz    108.000000 MHz (432 mm x 243 mm)
                 Hfront   24 Hsync  80 Hback   96 Hpol P
                 Vfront    1 Vsync   3 Vback   96 Vpol P
    Display Range Limits:
      Monitor ranges (GTF): 56-75 Hz V, 30-80 kHz H, max dotclock 160 MHz
    Display Product Name: 'HDMI'
    Display Product Serial Number: ...
  Extension blocks: 1
Checksum: 0xf9

----------------

Block 1, CTA-861 Extension Block:
  Revision: 3
  Underscans IT Video Formats by default
  Basic audio support
  Supports YCbCr 4:4:4
  Supports YCbCr 4:2:2
  Native DTDs: 1
  Video Data Block:
    VIC   1:   640x480    59.940476 Hz   4:3     31.469 kHz     25.175000 MHz
    VIC   2:   720x480    59.940060 Hz   4:3     31.469 kHz     27.000000 MHz
    VIC   3:   720x480    59.940060 Hz  16:9     31.469 kHz     27.000000 MHz
    VIC   4:  1280x720    60.000000 Hz  16:9     45.000 kHz     74.250000 MHz
    VIC   5:  1920x1080i  60.000000 Hz  16:9     33.750 kHz     74.250000 MHz
    VIC   7:  1440x480i   59.940060 Hz  16:9     15.734 kHz     27.000000 MHz
    VIC  16:  1920x1080   60.000000 Hz  16:9     67.500 kHz    148.500000 MHz (native)
    VIC  18:   720x576    50.000000 Hz  16:9     31.250 kHz     27.000000 MHz
    VIC  19:  1280x720    50.000000 Hz  16:9     37.500 kHz     74.250000 MHz
    VIC  20:  1920x1080i  50.000000 Hz  16:9     28.125 kHz     74.250000 MHz
    VIC  22:  1440x576i   50.000000 Hz  16:9     15.625 kHz     27.000000 MHz
    VIC  31:  1920x1080   50.000000 Hz  16:9     56.250 kHz    148.500000 MHz
  Audio Data Block:
    Linear PCM:
      Max channels: 2
      Supported sample rates (kHz): 48 44.1 32
      Supported sample sizes (bits): 24 20 16
  Speaker Allocation Data Block:
    FL/FR - Front Left/Right
  Vendor-Specific Data Block (HDMI), OUI 00-0C-03:
    Source physical address: 1.0.0.0
    DC_36bit
    DC_30bit
    DC_Y444
    Maximum TMDS clock: 225 MHz
  Detailed Timing Descriptors:
    Dummy Descriptor:
    Dummy Descriptor:
    DTD 2:  1280x720    60.000000 Hz  16:9     45.000 kHz     74.250000 MHz (510 mm x 287 mm)
                 Hfront  110 Hsync  40 Hback  220 Hpol P
                 Vfront    5 Vsync   5 Vback   20 Vpol P
    DTD 3:   720x480    59.940060 Hz   3:2     31.469 kHz     27.000000 MHz (510 mm x 287 mm)
                 Hfront   16 Hsync  62 Hback   60 Hpol N
                 Vfront    9 Vsync   6 Vback   30 Vpol N
    DTD 4:  1280x720    50.000000 Hz  16:9     37.500 kHz     74.250000 MHz (488 mm x 274 mm)
                 Hfront  440 Hsync  40 Hback  220 Hpol P
                 Vfront    5 Vsync   5 Vback   20 Vpol P
Checksum: 0x4d  Unused space in Extension Block: 4 bytes

----------------

Warnings:

Block 0, Base EDID:
  Display Product Serial Number: ...
Block 1, CTA-861 Extension Block:
  Video Data Block: VIC 1 and the first DTD are not identical. Is this intended?
  Video Data Block: All VICs are in ascending order, and the first (preferred) VIC <= 4, is that intended?
  Detailed Timing Descriptor #3: Image size is 510x287 mm, but based on the picture AR it should be 430x287 mm.
  Add a Colorimetry Data Block with the sRGB colorimetry bit set to avoid interop issues.
EDID:
  Base EDID: Some timings are out of range of the Monitor Ranges:
    Vertical Freq: 50.000 - 75.025 Hz (Monitor: 56.000 - 75.000 Hz)
    Horizontal Freq: 15.625 - 79.976 kHz (Monitor: 30.000 - 80.000 kHz)

Failures:

Block 0, Base EDID:
  Detailed Timing Descriptor #1: Mismatch of image size 432x243 mm vs display size 440x230 mm.
Block 1, CTA-861 Extension Block:
  Dummy Descriptor: Dummy block filled with garbage.
  Dummy Descriptor: Dummy block filled with garbage.
  Detailed Timing Descriptor #2: Mismatch of image size 510x287 mm vs display size 440x230 mm.
  Detailed Timing Descriptor #2: Invalid detailed timing descriptor ordering.
  Detailed Timing Descriptor #3: Mismatch of image size 510x287 mm vs display size 440x230 mm.
  Detailed Timing Descriptor #3: Invalid detailed timing descriptor ordering.
  Detailed Timing Descriptor #4: Mismatch of image size 488x274 mm vs display size 440x230 mm.
  Detailed Timing Descriptor #4: Invalid detailed timing descriptor ordering.
  Missing VCDB, needed for Set Selectable RGB Quantization to avoid interop issues.
EDID:
  Extension Block 2 started with EDID header, ignoring Extension Blocks >= 2.
  Base EDID: The DTD max image size is 510x287mm, which is larger than the display size 440.0x230.0mm.
  CTA-861: Native progressive timings are a mix of several resolutions.

EDID conformity: FAIL
