edid-decode (hex):

00 ff ff ff ff ff ff 00 06 10 79 9c 00 00 00 00
03 12 01 03 80 25 17 78 0a 50 c5 98 58 52 8e 27
25 50 54 00 00 00 01 01 01 01 01 01 01 01 01 01
01 01 01 01 01 01 b1 3d 80 b8 70 b0 33 40 30 20
26 00 6f e6 10 00 00 19 00 00 00 01 00 06 10 30
00 00 00 00 00 00 00 00 0a 20 00 00 00 fe 00 4c
54 4e 31 37 30 43 54 00 00 00 0a 20 00 00 00 fc
00 43 6f 6c 6f 72 20 4c 43 44 0a 20 20 20 00 e4

00 ff ff ff ff ff ff 00 06 10 79 9c 00 00 00 00
03 12 01 03 80 25 17 78 0a 50 c5 98 58 52 8e 27
25 50 54 00 00 00 01 01 01 01 01 01 01 01 01 01
01 01 01 01 01 01 b1 3d 80 b8 70 b0 33 40 30 20
26 00 6f e6 10 00 00 19 00 00 00 01 00 06 10 30
00 00 00 00 00 00 00 00 0a 20 00 00 00 fe 00 4c
54 4e 31 37 30 43 54 00 00 00 0a 20 00 00 00 fc
00 43 6f 6c 6f 72 20 4c 43 44 0a 20 20 20 00 e4

----------------

Block 0, Base EDID:
  EDID Structure Version & Revision: 1.3
  Vendor & Product Identification:
    Manufacturer: APP
    Model: 40057
    Made in: week 3 of 2008
  Basic Display Parameters & Features:
    Digital display
    Maximum image size: 37 cm x 23 cm
    Gamma: 2.20
    RGB color display
    First detailed timing is the preferred timing
  Color Characteristics:
    Red  : 0.5947, 0.3447
    Green: 0.3203, 0.5546
    Blue : 0.1552, 0.1445
    White: 0.3134, 0.3291
  Established Timings I & II: none
  Standard Timings: none
  Detailed Timing Descriptors:
    DTD 1:  1920x1200   60.001429 Hz  16:10    75.062 kHz    157.930000 MHz (367 mm x 230 mm)
                 Hfront   48 Hsync  32 Hback  104 Hpol N
                 Vfront    2 Vsync   6 Vback   43 Vpol N
    Manufacturer-Specified Display Descriptor (0x01): 00 01 00 06 10 30 00 00 00 00 00 00 00 00 0a 20 '.....0......... '
    Alphanumeric Data String: 'LTN170CT'
    Display Product Name: 'Color LCD'
Checksum: 0xe4

----------------

Block 1, Unknown EDID Extension Block 0x00:
  00 ff ff ff ff ff ff 00 06 10 79 9c 00 00 00 00 '..........y.....'
  03 12 01 03 80 25 17 78 0a 50 c5 98 58 52 8e 27 '.....%.x.P..XR.''
  25 50 54 00 00 00 01 01 01 01 01 01 01 01 01 01 '%PT.............'
  01 01 01 01 01 01 b1 3d 80 b8 70 b0 33 40 30 20 '.......=..p.3@0 '
  26 00 6f e6 10 00 00 19 00 00 00 01 00 06 10 30 '&.o............0'
  00 00 00 00 00 00 00 00 0a 20 00 00 00 fe 00 4c '......... .....L'
  54 4e 31 37 30 43 54 00 00 00 0a 20 00 00 00 fc 'TN170CT.... ....'
  00 43 6f 6c 6f 72 20 4c 43 44 0a 20 20 20 00 e4 '.Color LCD.   ..'
Checksum: 0xe4

----------------

Failures:

Block 0, Base EDID:
  Alphanumeric Data String: NUL byte at position 8.
  Missing Display Range Limits Descriptor.
Block 1, Base EDID:
  Unknown Extension Block.
EDID:
  Base EDID: EDID specified 0 extension block(s), but found 1 extension block(s).

EDID conformity: FAIL
