edid-decode (hex):

00 ff ff ff ff ff ff 00 22 0e 3b 39 01 01 01 01
18 21 01 03 80 35 1e 78 2a fe e5 ae 4f 45 a7 24
0f 50 54 a5 4b 00 d1 c0 81 c0 a9 c0 95 00 b3 00
81 00 81 80 01 01 02 3a 80 18 71 38 2d 40 58 2c
45 00 0f 28 21 00 00 1e 00 00 00 fd 00 3c a5 1e
d2 32 00 0a 20 20 20 20 20 20 00 00 00 fc 00 4f
4d 45 4e 20 32 34 0a 20 20 20 20 20 00 00 00 ff
00 43 4e 43 33 32 34 30 51 51 58 0a 20 20 01 e3

02 03 2e b1 48 90 3f 40 04 03 02 01 55 67 03 0c
00 10 00 00 44 67 d8 5d c4 01 78 80 00 6d 1a 00
00 02 01 3c a5 ed 00 00 00 00 00 e2 00 ea d0 94
80 a0 70 38 1e 40 30 40 35 00 0f 28 21 00 00 1a
5a 87 80 a0 70 38 4d 40 30 20 35 00 0f 28 21 00
00 1a 04 74 80 18 71 38 2d 40 58 2c 45 00 0f 28
21 00 00 1e 2a 44 80 a0 70 38 27 40 30 20 35 00
0f 28 21 00 00 1a 00 00 00 00 00 00 00 00 00 58

00 ff ff ff ff ff ff 00 22 0e 3b 39 01 01 01 01
18 21 01 03 80 35 1e 78 2a fe e5 ae 4f 45 a7 24
0f 50 54 a5 4b 00 d1 c0 81 c0 a9 c0 95 00 b3 00
81 00 81 80 01 01 02 3a 80 18 71 38 2d 40 58 2c
45 00 0f 28 21 00 00 1e 00 00 00 fd 00 3c a5 1e
d2 32 00 0a 20 20 20 20 20 20 00 00 00 fc 00 4f
4d 45 4e 20 32 34 0a 20 20 20 20 20 00 00 00 ff
00 43 4e 43 33 32 34 30 51 51 58 0a 20 20 01 e3

02 03 2e b1 48 90 3f 40 04 03 02 01 55 67 03 0c
00 10 00 00 44 67 d8 5d c4 01 78 80 00 6d 1a 00
00 02 01 3c a5 ed 00 00 00 00 00 e2 00 ea d0 94
80 a0 70 38 1e 40 30 40 35 00 0f 28 21 00 00 1a
5a 87 80 a0 70 38 4d 40 30 20 35 00 0f 28 21 00
00 1a 04 74 80 18 71 38 2d 40 58 2c 45 00 0f 28
21 00 00 1e 2a 44 80 a0 70 38 27 40 30 20 35 00
0f 28 21 00 00 1a 00 00 00 00 00 00 00 00 00 58

----------------

Block 0, Base EDID:
  EDID Structure Version & Revision: 1.3
  Vendor & Product Identification:
    Manufacturer: HPN
    Model: 14651
    Serial Number: ...
    Made in: week 24 of 2023
  Basic Display Parameters & Features:
    Digital display
    Maximum image size: 53 cm x 30 cm
    Gamma: 2.20
    DPMS levels: Off
    RGB color display
    First detailed timing is the preferred timing
  Color Characteristics:
    Red  : 0.6826, 0.3115
    Green: 0.2724, 0.6542
    Blue : 0.1435, 0.0605
    White: 0.3134, 0.3291
  Established Timings I & II:
    IBM     :   720x400    70.081663 Hz   9:5     31.467 kHz     28.320000 MHz
    DMT 0x04:   640x480    59.940476 Hz   4:3     31.469 kHz     25.175000 MHz
    DMT 0x06:   640x480    75.000000 Hz   4:3     37.500 kHz     31.500000 MHz
    DMT 0x09:   800x600    60.316541 Hz   4:3     37.879 kHz     40.000000 MHz
    DMT 0x0b:   800x600    75.000000 Hz   4:3     46.875 kHz     49.500000 MHz
    DMT 0x10:  1024x768    60.003840 Hz   4:3     48.363 kHz     65.000000 MHz
    DMT 0x12:  1024x768    75.028582 Hz   4:3     60.023 kHz     78.750000 MHz
    DMT 0x24:  1280x1024   75.024675 Hz   5:4     79.976 kHz    135.000000 MHz
  Standard Timings:
    DMT 0x52:  1920x1080   60.000000 Hz  16:9     67.500 kHz    148.500000 MHz
    DMT 0x55:  1280x720    60.000000 Hz  16:9     45.000 kHz     74.250000 MHz
    DMT 0x53:  1600x900    60.000000 Hz  16:9     60.000 kHz    108.000000 MHz (RB)
    DMT 0x2f:  1440x900    59.887445 Hz  16:10    55.935 kHz    106.500000 MHz
    DMT 0x3a:  1680x1050   59.954250 Hz  16:10    65.290 kHz    146.250000 MHz
    DMT 0x1c:  1280x800    59.810326 Hz  16:10    49.702 kHz     83.500000 MHz
    DMT 0x23:  1280x1024   60.019740 Hz   5:4     63.981 kHz    108.000000 MHz
  Detailed Timing Descriptors:
    DTD 1:  1920x1080   60.000000 Hz  16:9     67.500 kHz    148.500000 MHz (527 mm x 296 mm)
                 Hfront   88 Hsync  44 Hback  148 Hpol P
                 Vfront    4 Vsync   5 Vback   36 Vpol P
    Display Range Limits:
      Monitor ranges (GTF): 60-165 Hz V, 30-210 kHz H, max dotclock 500 MHz
    Display Product Name: 'OMEN 24'
    Display Product Serial Number: ...
  Extension blocks: 1
Checksum: 0xe3

----------------

Block 1, CTA-861 Extension Block:
  Revision: 3
  Underscans IT Video Formats by default
  Supports YCbCr 4:4:4
  Supports YCbCr 4:2:2
  Native DTDs: 1
  Video Data Block:
    VIC  16:  1920x1080   60.000000 Hz  16:9     67.500 kHz    148.500000 MHz (native)
    VIC  63:  1920x1080  120.000000 Hz  16:9    135.000 kHz    297.000000 MHz
    VIC  64:  1920x1080  100.000000 Hz  16:9    112.500 kHz    297.000000 MHz
    VIC   4:  1280x720    60.000000 Hz  16:9     45.000 kHz     74.250000 MHz
    VIC   3:   720x480    59.940060 Hz  16:9     31.469 kHz     27.000000 MHz
    VIC   2:   720x480    59.940060 Hz   4:3     31.469 kHz     27.000000 MHz
    VIC   1:   640x480    59.940476 Hz   4:3     31.469 kHz     25.175000 MHz
    VIC  85:  1680x720   120.000000 Hz  64:27    99.000 kHz    198.000000 MHz
  Vendor-Specific Data Block (HDMI), OUI 00-0C-03:
    Source physical address: 1.0.0.0
    Maximum TMDS clock: 340 MHz
  Vendor-Specific Data Block (HDMI Forum), OUI C4-5D-D8:
    Version: 1
    Maximum TMDS Character Rate: 600 MHz
    SCDC Present
  Vendor-Specific Data Block (AMD), OUI 00-00-1A:
    Version: 2
    Flags 1: 0x01
      FreeSync Supported
    Minimum Refresh Rate: 60 Hz
    Maximum Refresh Rate: 165 Hz
    MCCS VCP Code: 0xed
    Flags 5: 0x00
  Video Capability Data Block:
    YCbCr quantization: Selectable (via AVI YQ)
    RGB quantization: Selectable (via AVI Q)
    PT scan behavior: Always Underscanned
    IT scan behavior: Always Underscanned
    CE scan behavior: Always Underscanned
  Detailed Timing Descriptors:
    DTD 2:  1920x1080  165.003465 Hz  16:9    183.154 kHz    380.960000 MHz (527 mm x 296 mm)
                 Hfront   48 Hsync  64 Hback   48 Hpol P
                 Vfront    3 Vsync   5 Vback   22 Vpol N
    DTD 3:  1920x1080  143.981451 Hz  16:9    166.587 kHz    346.500000 MHz (527 mm x 296 mm)
                 Hfront   48 Hsync  32 Hback   80 Hpol P
                 Vfront    3 Vsync   5 Vback   69 Vpol N
    DTD 4:  1920x1080  120.000000 Hz  16:9    135.000 kHz    297.000000 MHz (527 mm x 296 mm)
                 Hfront   88 Hsync  44 Hback  148 Hpol P
                 Vfront    4 Vsync   5 Vback   36 Vpol P
    DTD 5:  1920x1080   74.972503 Hz  16:9     83.894 kHz    174.500000 MHz (527 mm x 296 mm)
                 Hfront   48 Hsync  32 Hback   80 Hpol P
                 Vfront    3 Vsync   5 Vback   31 Vpol N
Checksum: 0x58  Unused space in Extension Block: 9 bytes

----------------

Warnings:

Block 0, Base EDID:
  Vendor & Product Identification: The serial number is one of the known dummy values, it should probably be set to 0.
Block 1, CTA-861 Extension Block:
  Video Capability Data Block: S_PT is equal to S_IT and S_CE, so should be set to 0 instead.
  Display Product Serial Number is set, so the Serial Number in the Base EDID should be 0.
  Add a Colorimetry Data Block with the sRGB colorimetry bit set to avoid interop issues.

Failures:

EDID:
  Extension Block 2 started with EDID header, ignoring Extension Blocks >= 2.

EDID conformity: FAIL
