edid-decode (hex):

00 ff ff ff ff ff ff 00 24 4d 02 03 00 00 00 00
00 16 01 03 81 1e 17 78 ea 98 05 9a 5b 56 97 26
19 50 54 00 00 00 01 01 01 01 01 01 01 01 01 01
01 01 01 01 01 01 64 19 00 40 41 00 26 30 18 88
36 00 30 e4 10 00 00 18 00 00 00 fc 00 31 30 32
34 78 37 36 38 20 4c 43 44 0a 00 00 00 fe 00 43
4d 49 20 47 31 35 30 58 47 45 0a 20 00 00 00 fd
00 33 4b 29 39 08 00 00 00 00 00 0a 20 20 00 98

00 ff ff ff ff ff ff 00 24 4d 02 03 00 00 00 00
00 16 01 03 81 1e 17 78 ea 98 05 9a 5b 56 97 26
19 50 54 00 00 00 01 01 01 01 01 01 01 01 01 01
01 01 01 01 01 01 64 19 00 40 41 00 26 30 18 88
36 00 30 e4 10 00 00 18 00 00 00 fc 00 31 30 32
34 78 37 36 38 20 4c 43 44 0a 00 00 00 fe 00 43
4d 49 20 47 31 35 30 58 47 45 0a 20 00 00 00 fd
00 33 4b 29 39 08 00 00 00 00 00 0a 20 20 00 98

----------------

Block 0, Base EDID:
  EDID Structure Version & Revision: 1.3
  Vendor & Product Identification:
    Manufacturer: IBM
    Model: 770
    Made in: 2012
  Basic Display Parameters & Features:
    Digital display
    DFP 1.x compatible TMDS
    Maximum image size: 30 cm x 23 cm
    Gamma: 2.20
    DPMS levels: Standby Suspend Off
    RGB color display
    First detailed timing is the preferred timing
  Color Characteristics:
    Red  : 0.6035, 0.3564
    Green: 0.3378, 0.5898
    Blue : 0.1484, 0.0976
    White: 0.3134, 0.3291
  Established Timings I & II: none
  Standard Timings: none
  Detailed Timing Descriptors:
    DTD 1:  1024x768    60.003840 Hz   4:3     48.363 kHz     65.000000 MHz (304 mm x 228 mm)
                 Hfront   24 Hsync 136 Hback  160 Hpol N
                 Vfront    3 Vsync   6 Vback   29 Vpol N
    Display Product Name: '1024x768 LCD'
    Alphanumeric Data String: 'CMI G150XGE'
    Display Range Limits:
      Monitor ranges (GTF): 51-75 Hz V, 41-57 kHz H, max dotclock 80 MHz
Checksum: 0x98

----------------

Failures:

Block 0, Base EDID:
  Display Range Limits: Byte 11 is 0x00 instead of 0x0a.
  Display Range Limits: Bytes 12-17 must be 0x20.
EDID:
  Extension Block 1 started with EDID header, ignoring Extension Blocks >= 1.

EDID conformity: FAIL
