edid-decode (hex):

00 ff ff ff ff ff ff 00 30 ae 94 40 00 00 00 00
00 1c 01 04 a5 1d 11 78 e2 b2 f5 a5 53 4e 9b 27
0c 50 54 00 00 00 01 01 01 01 01 01 01 01 01 01
01 01 01 01 01 01 2e 36 80 a0 70 38 1f 40 30 20
35 00 26 a5 10 00 00 19 58 2b 80 a0 70 38 1f 40
30 20 35 00 26 a5 10 00 00 19 00 00 00 0f 00 d1
09 3c d1 09 30 1e 0a 00 30 e4 0a 06 00 00 00 fe
00 4c 50 31 33 33 57 46 37 2d 53 50 42 31 00 ad

00 ff ff ff ff ff ff 00 30 ae 94 40 00 00 00 00
00 1c 01 04 a5 1d 11 78 e2 b2 f5 a5 53 4e 9b 27
0c 50 54 00 00 00 01 01 01 01 01 01 01 01 01 01
01 01 01 01 01 01 2e 36 80 a0 70 38 1f 40 30 20
35 00 26 a5 10 00 00 19 58 2b 80 a0 70 38 1f 40
30 20 35 00 26 a5 10 00 00 19 00 00 00 0f 00 d1
09 3c d1 09 30 1e 0a 00 30 e4 0a 06 00 00 00 fe
00 4c 50 31 33 33 57 46 37 2d 53 50 42 31 00 ad

----------------

Block 0, Base EDID:
  EDID Structure Version & Revision: 1.4
  Vendor & Product Identification:
    Manufacturer: LEN
    Model: 16532
    Made in: 2018
  Basic Display Parameters & Features:
    Digital display
    Bits per primary color channel: 8
    DisplayPort interface
    Maximum image size: 29 cm x 17 cm
    Gamma: 2.20
    DPMS levels: Standby Suspend Off
    Supported color formats: RGB 4:4:4
    First detailed timing includes the native pixel format and preferred refresh rate
  Color Characteristics:
    Red  : 0.6464, 0.3271
    Green: 0.3046, 0.6074
    Blue : 0.1552, 0.0498
    White: 0.3134, 0.3291
  Established Timings I & II: none
  Standard Timings: none
  Detailed Timing Descriptors:
    DTD 1:  1920x1080   60.020425 Hz  16:9     66.683 kHz    138.700000 MHz (294 mm x 165 mm)
                 Hfront   48 Hsync  32 Hback   80 Hpol N
                 Vfront    3 Vsync   5 Vback   23 Vpol N
    DTD 2:  1920x1080   48.016340 Hz  16:9     53.346 kHz    110.960000 MHz (294 mm x 165 mm)
                 Hfront   48 Hsync  32 Hback   80 Hpol N
                 Vfront    3 Vsync   5 Vback   23 Vpol N
    Manufacturer-Specified Display Descriptor (0x0f): 00 0f 00 d1 09 3c d1 09 30 1e 0a 00 30 e4 0a 06 '.....<..0...0...'
    Alphanumeric Data String: 'LP133WF7-SPB1'
Checksum: 0xad

----------------

Warnings:

Block 0, Base EDID:
  Missing Display Product Name.

Failures:

EDID:
  Extension Block 1 started with EDID header, ignoring Extension Blocks >= 1.

EDID conformity: FAIL
