edid-decode (hex):

00 ff ff ff ff ff ff 00 30 ae 94 40 00 00 00 00
16 1c 01 04 a5 1d 11 78 e2 ee 95 a3 54 4c 99 26
0f 50 54 00 00 00 01 01 01 01 01 01 01 01 01 01
01 01 01 01 01 01 b4 3b 80 4a 71 38 34 40 30 20
36 00 25 a5 10 00 00 18 c2 2f 80 4a 71 38 34 40
30 20 36 00 25 a5 10 00 00 18 00 00 00 0f 00 d1
09 3c d1 09 30 1e 0a 00 0d ae 87 13 00 00 00 fe
00 4e 31 33 33 48 43 45 2d 45 50 32 0a 20 00 8d

00 ff ff ff ff ff ff 00 30 ae 94 40 00 00 00 00
16 1c 01 04 a5 1d 11 78 e2 ee 95 a3 54 4c 99 26
0f 50 54 00 00 00 01 01 01 01 01 01 01 01 01 01
01 01 01 01 01 01 b4 3b 80 4a 71 38 34 40 30 20
36 00 25 a5 10 00 00 18 c2 2f 80 4a 71 38 34 40
30 20 36 00 25 a5 10 00 00 18 00 00 00 0f 00 d1
09 3c d1 09 30 1e 0a 00 0d ae 87 13 00 00 00 fe
00 4e 31 33 33 48 43 45 2d 45 50 32 0a 20 00 8d

----------------

Block 0, Base EDID:
  EDID Structure Version & Revision: 1.4
  Vendor & Product Identification:
    Manufacturer: LEN
    Model: 16532
    Made in: week 22 of 2018
  Basic Display Parameters & Features:
    Digital display
    Bits per primary color channel: 8
    DisplayPort interface
    Maximum image size: 29 cm x 17 cm
    Gamma: 2.20
    DPMS levels: Standby Suspend Off
    Supported color formats: RGB 4:4:4
    First detailed timing includes the native pixel format and preferred refresh rate
  Color Characteristics:
    Red  : 0.6396, 0.3300
    Green: 0.2998, 0.5996
    Blue : 0.1503, 0.0595
    White: 0.3134, 0.3291
  Established Timings I & II: none
  Standard Timings: none
  Detailed Timing Descriptors:
    DTD 1:  1920x1080   60.007852 Hz  16:9     67.929 kHz    152.840000 MHz (293 mm x 165 mm)
                 Hfront   48 Hsync  32 Hback  250 Hpol N
                 Vfront    3 Vsync   6 Vback   43 Vpol N
    DTD 2:  1920x1080   48.001570 Hz  16:9     54.338 kHz    122.260000 MHz (293 mm x 165 mm)
                 Hfront   48 Hsync  32 Hback  250 Hpol N
                 Vfront    3 Vsync   6 Vback   43 Vpol N
    Manufacturer-Specified Display Descriptor (0x0f): 00 0f 00 d1 09 3c d1 09 30 1e 0a 00 0d ae 87 13 '.....<..0.......'
    Alphanumeric Data String: 'N133HCE-EP2'
Checksum: 0x8d

----------------

Warnings:

Block 0, Base EDID:
  Missing Display Product Name.

Failures:

EDID:
  Extension Block 1 started with EDID header, ignoring Extension Blocks >= 1.

EDID conformity: FAIL
