edid-decode (hex):

00 ff ff ff ff ff ff 00 4d d9 ee 07 00 00 00 03
27 22 01 04 b5 3c 22 78 bb 49 60 ad 52 40 ae 25
0e 50 54 21 08 00 81 80 d1 c0 01 01 01 01 01 01
01 01 01 01 01 01 56 5e 00 a0 a0 a0 29 50 30 20
35 00 58 54 21 00 00 1a 00 00 00 ff 00 39 35 30
34 30 33 35 0a 20 20 20 20 20 00 00 00 fc 00 53
44 4d 32 37 51 31 30 53 2a 31 30 0a 00 00 00 fd
0e 30 e1 ff ff fa 01 0a 20 20 20 20 20 20 03 cf

02 03 28 f1 4d 3f 10 1f 22 21 20 04 13 12 11 03
02 01 23 09 07 07 83 01 00 00 e3 05 c0 00 e6 06
05 01 65 4c 02 e2 0f 00 56 5e 00 a0 a0 a0 29 50
30 20 35 00 58 54 21 00 00 1a 79 c2 00 a0 a0 a0
55 50 30 20 35 00 58 54 21 00 00 1a 00 00 00 00
00 00 00 00 00 00 00 00 00 00 00 00 00 00 00 00
00 00 00 00 00 00 00 00 00 00 00 00 00 00 00 00
00 00 00 00 00 00 00 00 00 00 00 00 00 00 00 e3

70 12 79 03 00 03 01 3c ba 9d 01 04 ff 09 9f 00
7f 80 1f 00 9f 05 b5 00 02 00 04 00 5e 8f 02 04
ff 09 9f 00 07 80 1f 00 9f 05 10 01 86 00 04 00
f7 ae 03 84 ff 09 9f 00 2f 80 1f 00 9f 05 98 01
02 00 04 00 00 00 00 00 00 00 00 00 00 00 00 00
00 00 00 00 00 00 00 00 00 00 00 00 00 00 00 00
00 00 00 00 00 00 00 00 00 00 00 00 00 00 00 00
00 00 00 00 00 00 00 00 00 00 00 00 00 00 4f 90

70 12 79 00 00 03 01 3c 65 e9 00 04 7f 07 9f 00
2f 80 1f 00 37 04 74 00 02 00 04 00 94 a3 01 04
7f 07 9f 00 2f 80 1f 00 37 04 61 01 02 00 04 00
2d 57 02 04 7f 07 7f 01 2f 80 1f 00 37 04 32 01
02 00 04 00 00 00 00 00 00 00 00 00 00 00 00 00
00 00 00 00 00 00 00 00 00 00 00 00 00 00 00 00
00 00 00 00 00 00 00 00 00 00 00 00 00 00 00 00
00 00 00 00 00 00 00 00 00 00 00 00 00 00 97 90

00 ff ff ff ff ff ff 00 4d d9 ee 07 00 00 00 03
27 22 01 04 b5 3c 22 78 bb 49 60 ad 52 40 ae 25
0e 50 54 21 08 00 81 80 d1 c0 01 01 01 01 01 01
01 01 01 01 01 01 56 5e 00 a0 a0 a0 29 50 30 20
35 00 58 54 21 00 00 1a 00 00 00 ff 00 39 35 30
34 30 33 35 0a 20 20 20 20 20 00 00 00 fc 00 53
44 4d 32 37 51 31 30 53 2a 31 30 0a 00 00 00 fd
0e 30 e1 ff ff fa 01 0a 20 20 20 20 20 20 03 cf

02 03 28 f1 4d 3f 10 1f 22 21 20 04 13 12 11 03
02 01 23 09 07 07 83 01 00 00 e3 05 c0 00 e6 06
05 01 65 4c 02 e2 0f 00 56 5e 00 a0 a0 a0 29 50
30 20 35 00 58 54 21 00 00 1a 79 c2 00 a0 a0 a0
55 50 30 20 35 00 58 54 21 00 00 1a 00 00 00 00
00 00 00 00 00 00 00 00 00 00 00 00 00 00 00 00
00 00 00 00 00 00 00 00 00 00 00 00 00 00 00 00
00 00 00 00 00 00 00 00 00 00 00 00 00 00 00 e3

70 12 79 03 00 03 01 3c ba 9d 01 04 ff 09 9f 00
7f 80 1f 00 9f 05 b5 00 02 00 04 00 5e 8f 02 04
ff 09 9f 00 07 80 1f 00 9f 05 10 01 86 00 04 00
f7 ae 03 84 ff 09 9f 00 2f 80 1f 00 9f 05 98 01
02 00 04 00 00 00 00 00 00 00 00 00 00 00 00 00
00 00 00 00 00 00 00 00 00 00 00 00 00 00 00 00
00 00 00 00 00 00 00 00 00 00 00 00 00 00 00 00
00 00 00 00 00 00 00 00 00 00 00 00 00 00 4f 90

70 12 79 00 00 03 01 3c 65 e9 00 04 7f 07 9f 00
2f 80 1f 00 37 04 74 00 02 00 04 00 94 a3 01 04
7f 07 9f 00 2f 80 1f 00 37 04 61 01 02 00 04 00
2d 57 02 04 7f 07 7f 01 2f 80 1f 00 37 04 32 01
02 00 04 00 00 00 00 00 00 00 00 00 00 00 00 00
00 00 00 00 00 00 00 00 00 00 00 00 00 00 00 00
00 00 00 00 00 00 00 00 00 00 00 00 00 00 00 00
00 00 00 00 00 00 00 00 00 00 00 00 00 00 97 90

----------------

Block 0, Base EDID:
  EDID Structure Version & Revision: 1.4
  Vendor & Product Identification:
    Manufacturer: SNY
    Model: 2030
    Serial Number: ...
    Made in: week 39 of 2024
  Basic Display Parameters & Features:
    Digital display
    Bits per primary color channel: 10
    DisplayPort interface
    Maximum image size: 60 cm x 34 cm
    Gamma: 2.20
    DPMS levels: Standby Off
    Supported color formats: RGB 4:4:4, YCrCb 4:4:4, YCrCb 4:2:2
    First detailed timing includes the native pixel format and preferred refresh rate
    Display supports continuous frequencies
  Color Characteristics:
    Red  : 0.6767, 0.3203
    Green: 0.2519, 0.6806
    Blue : 0.1455, 0.0566
    White: 0.3125, 0.3281
  Established Timings I & II:
    DMT 0x04:   640x480    59.940476 Hz   4:3     31.469 kHz     25.175000 MHz
    DMT 0x09:   800x600    60.316541 Hz   4:3     37.879 kHz     40.000000 MHz
    DMT 0x10:  1024x768    60.003840 Hz   4:3     48.363 kHz     65.000000 MHz
  Standard Timings:
    DMT 0x23:  1280x1024   60.019740 Hz   5:4     63.981 kHz    108.000000 MHz
    DMT 0x52:  1920x1080   60.000000 Hz  16:9     67.500 kHz    148.500000 MHz
  Detailed Timing Descriptors:
    DTD 1:  2560x1440   59.950550 Hz  16:9     88.787 kHz    241.500000 MHz (600 mm x 340 mm)
                 Hfront   48 Hsync  32 Hback   80 Hpol P
                 Vfront    3 Vsync   5 Vback   33 Vpol N
    Display Product Serial Number: ...
    Display Product Name: 'SDM27Q10S*10'
    Display Range Limits:
      Monitor ranges (Range Limits Only): 48-480 Hz V, 510-510 kHz H, max dotclock 2500 MHz
  Extension blocks: 3
Checksum: 0xcf

----------------

Block 1, CTA-861 Extension Block:
  Revision: 3
  Underscans IT Video Formats by default
  Basic audio support
  Supports YCbCr 4:4:4
  Supports YCbCr 4:2:2
  Native DTDs: 1
  Video Data Block:
    VIC  63:  1920x1080  120.000000 Hz  16:9    135.000 kHz    297.000000 MHz
    VIC  16:  1920x1080   60.000000 Hz  16:9     67.500 kHz    148.500000 MHz
    VIC  31:  1920x1080   50.000000 Hz  16:9     56.250 kHz    148.500000 MHz
    VIC  34:  1920x1080   30.000000 Hz  16:9     33.750 kHz     74.250000 MHz
    VIC  33:  1920x1080   25.000000 Hz  16:9     28.125 kHz     74.250000 MHz
    VIC  32:  1920x1080   24.000000 Hz  16:9     27.000 kHz     74.250000 MHz
    VIC   4:  1280x720    60.000000 Hz  16:9     45.000 kHz     74.250000 MHz
    VIC  19:  1280x720    50.000000 Hz  16:9     37.500 kHz     74.250000 MHz
    VIC  18:   720x576    50.000000 Hz  16:9     31.250 kHz     27.000000 MHz
    VIC  17:   720x576    50.000000 Hz   4:3     31.250 kHz     27.000000 MHz
    VIC   3:   720x480    59.940060 Hz  16:9     31.469 kHz     27.000000 MHz
    VIC   2:   720x480    59.940060 Hz   4:3     31.469 kHz     27.000000 MHz
    VIC   1:   640x480    59.940476 Hz   4:3     31.469 kHz     25.175000 MHz
  Audio Data Block:
    Linear PCM:
      Max channels: 2
      Supported sample rates (kHz): 48 44.1 32
      Supported sample sizes (bits): 24 20 16
  Speaker Allocation Data Block:
    FL/FR - Front Left/Right
  Colorimetry Data Block:
    BT2020YCC
    BT2020RGB
  HDR Static Metadata Data Block:
    Electro optical transfer functions:
      Traditional gamma - SDR luminance range
      SMPTE ST2084
    Supported static metadata descriptors:
      Static metadata type 1
    Desired content max luminance: 101 (445.755 cd/m^2)
    Desired content max frame-average luminance: 76 (259.368 cd/m^2)
    Desired content min luminance: 2 (0.000 cd/m^2)
  YCbCr 4:2:0 Capability Map Data Block:
    Empty Capability Map
  Detailed Timing Descriptors:
    DTD 2:  2560x1440   59.950550 Hz  16:9     88.787 kHz    241.500000 MHz (600 mm x 340 mm)
                 Hfront   48 Hsync  32 Hback   80 Hpol P
                 Vfront    3 Vsync   5 Vback   33 Vpol N
    DTD 3:  2560x1440  120.021697 Hz  16:9    183.033 kHz    497.850000 MHz (600 mm x 340 mm)
                 Hfront   48 Hsync  32 Hback   80 Hpol P
                 Vfront    3 Vsync   5 Vback   77 Vpol N
Checksum: 0xe3  Unused space in Extension Block: 51 bytes

----------------

Block 2, DisplayID Extension Block:
  Version: 1.2
  Extension Count: 0
  Display Product Type: Standalone display device
  Video Timing Modes Type 1 - Detailed Timings Data Block:
    DTD:  2560x1440  240.069903 Hz  16:9    389.393 kHz   1059.150000 MHz (aspect 16:9, no 3D stereo)
               Hfront  128 Hsync  32 Hback    0 Hpol P
               Vfront    3 Vsync   5 Vback  174 Vpol N
    DTD:  2560x1440  360.081642 Hz  16:9    616.820 kHz   1677.750000 MHz (aspect 16:9, no 3D stereo)
               Hfront    8 Hsync  32 Hback  120 Hpol P
               Vfront  135 Vsync   5 Vback  133 Vpol N
    DTD:  2560x1440  479.989183 Hz  16:9    887.500 kHz   2414.000000 MHz (aspect 16:9, no 3D stereo, preferred)
               Hfront   48 Hsync  32 Hback   80 Hpol P
               Vfront    3 Vsync   5 Vback  401 Vpol N
  Checksum: 0x4f
Checksum: 0x90

----------------

Block 3, DisplayID Extension Block:
  Version: 1.2
  Extension Count: 0
  Video Timing Modes Type 1 - Detailed Timings Data Block:
    DTD:  1920x1080  239.982970 Hz  16:9    287.260 kHz    597.500000 MHz (aspect 16:9, no 3D stereo)
               Hfront   48 Hsync  32 Hback   80 Hpol P
               Vfront    3 Vsync   5 Vback  109 Vpol N
    DTD:  1920x1080  360.117611 Hz  16:9    516.409 kHz   1074.130000 MHz (aspect 16:9, no 3D stereo)
               Hfront   48 Hsync  32 Hback   80 Hpol P
               Vfront    3 Vsync   5 Vback  346 Vpol N
    DTD:  1920x1080  479.996545 Hz  16:9    665.755 kHz   1533.900000 MHz (aspect 16:9, no 3D stereo)
               Hfront   48 Hsync  32 Hback  304 Hpol P
               Vfront    3 Vsync   5 Vback  299 Vpol N
  Checksum: 0x97
Checksum: 0x90

----------------

Warnings:

Block 1, CTA-861 Extension Block:
  Video Data Block: VIC 63 and the first DTD are not identical. Is this intended?
  Colorimetry Data Block: Set the sRGB colorimetry bit to avoid interop issues.
  Display Product Serial Number is set, so the Serial Number in the Base EDID should be 0.
EDID:
  Base EDID: Some timings are out of range of the Monitor Ranges:
    Vertical Freq: 24.000 - 479.997 Hz (Monitor: 48.000 - 480.000 Hz)
    Horizontal Freq: 27.000 - 887.500 kHz (Monitor: 510.000 - 510.000 kHz)

Failures:

Block 1, CTA-861 Extension Block:
  YCbCr 4:2:0 Capability Map Data Block: Empty Capability Map.
  Missing VCDB, needed for Set Selectable RGB Quantization to avoid interop issues.
Block 2, DisplayID Extension Block:
  Expected 0 DisplayID Extension Block, but got 1.
  Video Timing Modes Type 1 - Detailed Timings Data Block: 0 or negative horizontal back porch.
EDID:
  Extension Block 4 started with EDID header, ignoring Extension Blocks >= 4.
  DisplayID: Missing DisplayID Display Parameters Data Block.

EDID conformity: FAIL
