edid-decode (hex):

00 ff ff ff ff ff ff 00 59 3a 35 00 01 01 01 01
0d 12 01 03 80 46 27 78 0a 9d 1b a3 55 4a 9a 25
10 47 4a af ce 00 81 c0 01 01 01 01 01 01 01 01
01 01 01 01 01 01 66 21 56 b0 51 00 1b 30 80 82
26 00 bc 86 21 00 00 1a 00 00 00 fd 00 32 4d 1f
46 0f 00 0a 20 20 20 20 20 20 00 00 00 ff 00 55
4b 45 41 44 4b 30 31 30 30 30 30 31 00 00 00 fc
00 56 4f 33 32 30 45 0a 20 20 20 20 20 20 01 ae

02 03 1c 71 49 20 84 01 03 13 05 12 15 14 23 09
07 03 83 01 00 00 65 03 0c 00 10 00 01 1d 00 bc
52 d0 1e 20 b8 28 55 40 bc 86 21 00 00 1e 01 1d
80 d0 72 1c 16 20 10 2c 25 80 bc 86 21 00 00 9e
8c 0a d0 8a 20 e0 2d 10 10 3e 96 00 bc 86 21 00
00 18 00 00 00 00 00 00 00 00 00 00 00 00 00 00
00 00 00 00 8c 0a d0 90 20 40 31 20 0c 40 55 00
bc 86 21 00 00 18 00 00 00 00 00 00 00 00 00 59

----------------

Block 0, Base EDID:
  EDID Structure Version & Revision: 1.3
  Vendor & Product Identification:
    Manufacturer: VIZ
    Model: 53
    Serial Number: ...
    Made in: week 13 of 2008
  Basic Display Parameters & Features:
    Digital display
    Maximum image size: 70 cm x 39 cm
    Gamma: 2.20
    RGB color display
    First detailed timing is the preferred timing
  Color Characteristics:
    Red  : 0.6386, 0.3330
    Green: 0.2919, 0.6025
    Blue : 0.1445, 0.0634
    White: 0.2792, 0.2919
  Established Timings I & II:
    IBM     :   720x400    70.081663 Hz   9:5     31.467 kHz     28.320000 MHz
    DMT 0x04:   640x480    59.940476 Hz   4:3     31.469 kHz     25.175000 MHz
    DMT 0x05:   640x480    72.808802 Hz   4:3     37.861 kHz     31.500000 MHz
    DMT 0x06:   640x480    75.000000 Hz   4:3     37.500 kHz     31.500000 MHz
    DMT 0x08:   800x600    56.250000 Hz   4:3     35.156 kHz     36.000000 MHz
    DMT 0x09:   800x600    60.316541 Hz   4:3     37.879 kHz     40.000000 MHz
    DMT 0x0a:   800x600    72.187572 Hz   4:3     48.077 kHz     50.000000 MHz
    DMT 0x0b:   800x600    75.000000 Hz   4:3     46.875 kHz     49.500000 MHz
    DMT 0x10:  1024x768    60.003840 Hz   4:3     48.363 kHz     65.000000 MHz
    DMT 0x11:  1024x768    70.069359 Hz   4:3     56.476 kHz     75.000000 MHz
    DMT 0x12:  1024x768    75.028582 Hz   4:3     60.023 kHz     78.750000 MHz
  Standard Timings:
    DMT 0x55:  1280x720    60.000000 Hz  16:9     45.000 kHz     74.250000 MHz
  Detailed Timing Descriptors:
    DTD 1:  1366x768    59.814889 Hz 683:384   47.553 kHz     85.500000 MHz (700 mm x 390 mm)
                 Hfront  128 Hsync 130 Hback  174 Hpol P
                 Vfront    2 Vsync   6 Vback   19 Vpol N
    Display Range Limits:
      Monitor ranges (GTF): 50-77 Hz V, 31-70 kHz H, max dotclock 150 MHz
    Display Product Serial Number: ...
    Display Product Name: 'VO320E'
  Extension blocks: 1
Checksum: 0xae

----------------

Block 1, CTA-861 Extension Block:
  Revision: 3
  Basic audio support
  Supports YCbCr 4:4:4
  Supports YCbCr 4:2:2
  Native detailed modes: 1
  Video Data Block:
    VIC  32:  1920x1080   24.000000 Hz  16:9     27.000 kHz     74.250000 MHz
    VIC   4:  1280x720    60.000000 Hz  16:9     45.000 kHz     74.250000 MHz (native)
    VIC   1:   640x480    59.940476 Hz   4:3     31.469 kHz     25.175000 MHz
    VIC   3:   720x480    59.940060 Hz  16:9     31.469 kHz     27.000000 MHz
    VIC  19:  1280x720    50.000000 Hz  16:9     37.500 kHz     74.250000 MHz
    VIC   5:  1920x1080i  60.000000 Hz  16:9     33.750 kHz     74.250000 MHz
    VIC  18:   720x576    50.000000 Hz  16:9     31.250 kHz     27.000000 MHz
    VIC  21:  1440x576i   50.000000 Hz   4:3     15.625 kHz     27.000000 MHz
    VIC  20:  1920x1080i  50.000000 Hz  16:9     28.125 kHz     74.250000 MHz
  Audio Data Block:
    Linear PCM:
      Max channels: 2
      Supported sample rates (kHz): 48 44.1 32
      Supported sample sizes (bits): 20 16
  Speaker Allocation Data Block:
    FL/FR - Front Left/Right
  Vendor-Specific Data Block (HDMI), OUI 00-0C-03:
    Source physical address: 1.0.0.0
  Detailed Timing Descriptors:
    DTD 2:  1280x720    50.000000 Hz  16:9     37.500 kHz     74.250000 MHz (700 mm x 390 mm)
                 Hfront  440 Hsync  40 Hback  220 Hpol P
                 Vfront    5 Vsync   5 Vback   20 Vpol P
    DTD 3:  1920x1080i  50.000000 Hz  16:9     28.125 kHz     74.250000 MHz (700 mm x 390 mm)
                 Hfront  528 Hsync  44 Hback  148 Hpol P
                 Vfront    2 Vsync   5 Vback   15 Vpol P Vfront +0.5 Odd Field
                 Vfront    2 Vsync   5 Vback   15 Vpol P Vback  +0.5 Even Field
    DTD 4:   720x480    59.940060 Hz   3:2     31.469 kHz     27.000000 MHz (700 mm x 390 mm)
                 Hfront   16 Hsync  62 Hback   60 Hpol N
                 Vfront    9 Vsync   6 Vback   30 Vpol N
Checksum: 0x59  Unused space in Extension Block: 45 bytes

----------------

Warnings:

Block 0, Base EDID:
  Vendor & Product Identification: The serial number is one of the known dummy values, it should probably be set to 0.
Block 1, CTA-861 Extension Block:
  IT Video Formats are overscanned by default, but normally this should be underscanned.
  Video Data Block: VIC 32 and the first DTD are not identical. Is this intended?
  Detailed Timing Descriptor #4: Image size is 700x390 mm, but based on the picture AR it should be 700x466 mm.
  Display Product Serial Number is set, so the Serial Number in the Base EDID should be 0.
  Add a Colorimetry Data Block with the sRGB colorimetry bit set to avoid interop issues.
EDID:
  Base EDID: Some timings are out of range of the Monitor Ranges:
    Vertical Freq: 24.000 - 75.029 Hz (Monitor: 50.000 - 77.000 Hz)
    Horizontal Freq: 15.625 - 60.022 kHz (Monitor: 31.000 - 70.000 kHz)

Failures:

Block 1, CTA-861 Extension Block:
  Padding: Contains non-zero bytes.
  Missing VCDB, needed for Set Selectable RGB Quantization to avoid interop issues.
EDID:
  CTA-861: Native progressive timings are a mix of several resolutions.

EDID conformity: FAIL
