edid-decode (hex):

00 ff ff ff ff ff ff 00 5c 85 01 37 01 01 01 01
11 0f 01 03 80 52 2e 78 2a 55 50 a7 55 46 99 24
12 49 4b bf ee 80 71 4f 81 80 01 01 01 01 01 01
01 01 01 01 01 01 00 00 00 00 00 00 00 00 00 00
00 00 00 00 00 00 00 00 00 00 00 fe 00 57 65 73
74 69 6e 67 68 6f 75 73 65 0a 00 00 00 fd 00 32
4b 1e 41 0b 00 0a 20 20 20 20 20 20 00 00 00 fc
00 4c 56 4d 2d 33 37 77 31 0a 20 20 20 20 00 70

00 ff ff ff ff ff ff 00 5c 85 01 37 01 01 01 01
11 0f 01 03 80 52 2e 78 2a 55 50 a7 55 46 99 24
12 49 4b bf ee 80 71 4f 81 80 01 01 01 01 01 01
01 01 01 01 01 01 00 00 00 00 00 00 00 00 00 00
00 00 00 00 00 00 00 00 00 00 00 fe 00 57 65 73
74 69 6e 67 68 6f 75 73 65 0a 00 00 00 fd 00 32
4b 1e 41 0b 00 0a 20 20 20 20 20 20 00 00 00 fc
00 4c 56 4d 2d 33 37 77 31 0a 20 20 20 20 00 70

----------------

Block 0, Base EDID:
  EDID Structure Version & Revision: 1.3
  Vendor & Product Identification:
    Manufacturer: WDE
    Model: 14081
    Serial Number: ...
    Made in: week 17 of 2005
  Basic Display Parameters & Features:
    Digital display
    Maximum image size: 82 cm x 46 cm
    Gamma: 2.20
    DPMS levels: Off
    RGB color display
    First detailed timing is the preferred timing
  Color Characteristics:
    Red  : 0.6533, 0.3330
    Green: 0.2744, 0.5986
    Blue : 0.1416, 0.0712
    White: 0.2851, 0.2929
  Established Timings I & II:
    IBM     :   720x400    70.081663 Hz   9:5     31.467 kHz     28.320000 MHz
    DMT 0x04:   640x480    59.940476 Hz   4:3     31.469 kHz     25.175000 MHz
    Apple   :   640x480    66.666667 Hz   4:3     35.000 kHz     30.240000 MHz
    DMT 0x05:   640x480    72.808802 Hz   4:3     37.861 kHz     31.500000 MHz
    DMT 0x06:   640x480    75.000000 Hz   4:3     37.500 kHz     31.500000 MHz
    DMT 0x08:   800x600    56.250000 Hz   4:3     35.156 kHz     36.000000 MHz
    DMT 0x09:   800x600    60.316541 Hz   4:3     37.879 kHz     40.000000 MHz
    DMT 0x0a:   800x600    72.187572 Hz   4:3     48.077 kHz     50.000000 MHz
    DMT 0x0b:   800x600    75.000000 Hz   4:3     46.875 kHz     49.500000 MHz
    Apple   :   832x624    74.551266 Hz   4:3     49.726 kHz     57.284000 MHz
    DMT 0x10:  1024x768    60.003840 Hz   4:3     48.363 kHz     65.000000 MHz
    DMT 0x11:  1024x768    70.069359 Hz   4:3     56.476 kHz     75.000000 MHz
    DMT 0x12:  1024x768    75.028582 Hz   4:3     60.023 kHz     78.750000 MHz
    Apple   :  1152x870    75.061550 Hz 192:145   68.681 kHz    100.000000 MHz
  Standard Timings:
    DMT 0x15:  1152x864    75.000000 Hz   4:3     67.500 kHz    108.000000 MHz
    DMT 0x23:  1280x1024   60.019740 Hz   5:4     63.981 kHz    108.000000 MHz
  Detailed Timing Descriptors:
    Empty Descriptor
    Alphanumeric Data String: 'Westinghouse'
    Display Range Limits:
      Monitor ranges (GTF): 50-75 Hz V, 30-65 kHz H, max dotclock 110 MHz
    Display Product Name: 'LVM-37w1'
Checksum: 0x70

----------------

Warnings:

Block 0, Base EDID:
  Vendor & Product Identification: The serial number is one of the known dummy values, it should probably be set to 0.
EDID:
  No Native Video Resolution was defined.
  Base EDID: Some timings are out of range of the Monitor Ranges:
    Horizontal Freq: 31.466 - 68.681 kHz (Monitor: 30.000 - 65.000 kHz)

Failures:

Block 0, Base EDID:
  Standard Timings: Missing preferred timing.
  Empty Descriptor: Use Dummy Descriptor instead of all zeroes.
EDID:
  Extension Block 1 started with EDID header, ignoring Extension Blocks >= 1.

EDID conformity: FAIL
