edid-decode (hex):

00 ff ff ff ff ff ff 00 22 0e 76 34 01 01 01 01
0f 1e 01 04 a5 3c 22 78 22 93 25 a9 54 4d 9e 25
0c 50 54 a1 08 00 d1 c0 81 c0 a9 c0 b3 00 95 00
81 00 81 80 d1 00 28 3c 80 a0 70 b0 23 40 30 20
36 00 55 50 21 00 00 1a 00 00 00 fd 00 32 3c 1e
50 14 00 0a 20 20 20 20 20 20 00 00 00 fc 00 48
50 20 45 32 37 33 71 0a 20 20 20 20 00 00 00 ff
00 36 43 4d 30 31 35 31 31 39 44 0a 20 20 00 2d

00 ff ff ff ff ff ff 00 22 0e 76 34 01 01 01 01
0f 1e 01 04 a5 3c 22 78 22 93 25 a9 54 4d 9e 25
0c 50 54 a1 08 00 d1 c0 81 c0 a9 c0 b3 00 95 00
81 00 81 80 d1 00 28 3c 80 a0 70 b0 23 40 30 20
36 00 55 50 21 00 00 1a 00 00 00 fd 00 32 3c 1e
50 14 00 0a 20 20 20 20 20 20 00 00 00 fc 00 48
50 20 45 32 37 33 71 0a 20 20 20 20 00 00 00 ff
00 36 43 4d 30 31 35 31 31 39 44 0a 20 20 00 2d

----------------

Block 0, Base EDID:
  EDID Structure Version & Revision: 1.4
  Vendor & Product Identification:
    Manufacturer: HPN
    Model: 13430
    Serial Number: ...
    Made in: week 15 of 2020
  Basic Display Parameters & Features:
    Digital display
    Bits per primary color channel: 8
    DisplayPort interface
    Maximum image size: 60 cm x 34 cm
    Gamma: 2.20
    DPMS levels: Off
    Supported color formats: RGB 4:4:4
    First detailed timing includes the native pixel format and preferred refresh rate
  Color Characteristics:
    Red  : 0.6621, 0.3291
    Green: 0.3007, 0.6201
    Blue : 0.1445, 0.0488
    White: 0.3134, 0.3291
  Established Timings I & II:
    IBM     :   720x400    70.081663 Hz   9:5     31.467 kHz     28.320000 MHz
    DMT 0x04:   640x480    59.940476 Hz   4:3     31.469 kHz     25.175000 MHz
    DMT 0x09:   800x600    60.316541 Hz   4:3     37.879 kHz     40.000000 MHz
    DMT 0x10:  1024x768    60.003840 Hz   4:3     48.363 kHz     65.000000 MHz
  Standard Timings:
    DMT 0x52:  1920x1080   60.000000 Hz  16:9     67.500 kHz    148.500000 MHz
    DMT 0x55:  1280x720    60.000000 Hz  16:9     45.000 kHz     74.250000 MHz
    DMT 0x53:  1600x900    60.000000 Hz  16:9     60.000 kHz    108.000000 MHz (RB)
    DMT 0x3a:  1680x1050   59.954250 Hz  16:10    65.290 kHz    146.250000 MHz
    DMT 0x2f:  1440x900    59.887445 Hz  16:10    55.935 kHz    106.500000 MHz
    DMT 0x1c:  1280x800    59.810326 Hz  16:10    49.702 kHz     83.500000 MHz
    DMT 0x23:  1280x1024   60.019740 Hz   5:4     63.981 kHz    108.000000 MHz
    DMT 0x45:  1920x1200   59.884600 Hz  16:10    74.556 kHz    193.250000 MHz
  Detailed Timing Descriptors:
    DTD 1:  1920x1200   59.950171 Hz  16:10    74.038 kHz    154.000000 MHz (597 mm x 336 mm)
                 Hfront   48 Hsync  32 Hback   80 Hpol P
                 Vfront    3 Vsync   6 Vback   26 Vpol N
    Display Range Limits:
      Monitor ranges (GTF): 50-60 Hz V, 30-80 kHz H, max dotclock 200 MHz
    Display Product Name: 'HP E273q'
    Display Product Serial Number: ...
Checksum: 0x2d

----------------

Warnings:

Block 0, Base EDID:
  Vendor & Product Identification: The serial number is one of the known dummy values, it should probably be set to 0.
  Detailed Timing Descriptor #1: Image size is 597x336 mm, but based on the picture AR it should be 537x336 mm.
  Display Range Limits: GTF support is deprecated in EDID 1.4.
EDID:
  Base EDID: Some timings are out of range of the Monitor Ranges:
    Vertical Freq: 59.810 - 70.082 Hz (Monitor: 50.000 - 60.000 Hz)

Failures:

Block 0, Base EDID:
  Display Range Limits: GTF is supported, but the display does not support continuous frequencies.
EDID:
  Extension Block 1 started with EDID header, ignoring Extension Blocks >= 1.

EDID conformity: FAIL
