edid-decode (hex):

00 ff ff ff ff ff ff 00 26 cf be 8c 04 00 00 00
00 1f 01 04 a5 1e 13 78 0b de 50 a3 54 4c 99 26
0f 50 54 00 00 00 01 01 01 01 01 01 01 01 01 01
01 01 01 01 01 01 32 3c 80 a0 70 b0 23 40 18 30
6c 00 2e bd 10 00 00 19 00 00 00 fe 00 58 31 34
30 4e 56 34 4a 20 52 30 20 0a 00 00 00 03 00 03
54 d8 04 64 7d 13 0c 19 af 00 00 00 00 00 00 03
00 19 51 ff 64 a0 f4 15 0c 4a f4 01 01 00 01 dd

02 03 0b 00 e6 06 01 01 8a 8a c8 00 00 00 00 00
00 00 00 00 00 00 00 00 00 00 00 00 00 00 00 00
00 00 00 00 00 00 00 00 00 00 00 00 00 00 00 00
00 00 00 00 00 00 00 00 00 00 00 00 00 00 00 00
00 00 00 00 00 00 00 00 00 00 00 00 00 00 00 00
00 00 00 00 00 00 00 00 00 00 00 00 00 00 00 00
00 00 00 00 00 00 00 00 00 00 00 00 00 00 00 00
00 00 00 00 00 00 00 00 00 00 00 00 00 00 00 26

00 ff ff ff ff ff ff 00 26 cf be 8c 04 00 00 00
00 1f 01 04 a5 1e 13 78 0b de 50 a3 54 4c 99 26
0f 50 54 00 00 00 01 01 01 01 01 01 01 01 01 01
01 01 01 01 01 01 32 3c 80 a0 70 b0 23 40 18 30
6c 00 2e bd 10 00 00 19 00 00 00 fe 00 58 31 34
30 4e 56 34 4a 20 52 30 20 0a 00 00 00 03 00 03
54 d8 04 64 7d 13 0c 19 af 00 00 00 00 00 00 03
00 19 51 ff 64 a0 f4 15 0c 4a f4 01 01 00 01 dd

02 03 0b 00 e6 06 01 01 8a 8a c8 00 00 00 00 00
00 00 00 00 00 00 00 00 00 00 00 00 00 00 00 00
00 00 00 00 00 00 00 00 00 00 00 00 00 00 00 00
00 00 00 00 00 00 00 00 00 00 00 00 00 00 00 00
00 00 00 00 00 00 00 00 00 00 00 00 00 00 00 00
00 00 00 00 00 00 00 00 00 00 00 00 00 00 00 00
00 00 00 00 00 00 00 00 00 00 00 00 00 00 00 00
00 00 00 00 00 00 00 00 00 00 00 00 00 00 00 26

----------------

Block 0, Base EDID:
  EDID Structure Version & Revision: 1.4
  Vendor & Product Identification:
    Manufacturer: IVO
    Model: 36030
    Serial Number: ...
    Made in: 2021
  Basic Display Parameters & Features:
    Digital display
    Bits per primary color channel: 8
    DisplayPort interface
    Maximum image size: 30 cm x 19 cm
    Gamma: 2.20
    Supported color formats: RGB 4:4:4, YCrCb 4:4:4
    First detailed timing includes the native pixel format and preferred refresh rate
    Display supports continuous frequencies
  Color Characteristics:
    Red  : 0.6396, 0.3291
    Green: 0.2998, 0.5996
    Blue : 0.1494, 0.0595
    White: 0.3125, 0.3281
  Established Timings I & II: none
  Standard Timings: none
  Detailed Timing Descriptors:
    DTD 1:  1920x1200   59.989100 Hz  16:10    74.087 kHz    154.100000 MHz (302 mm x 189 mm)
                 Hfront   24 Hsync  48 Hback   88 Hpol N
                 Vfront    6 Vsync  12 Vback   17 Vpol N
    Alphanumeric Data String: 'X140NV4J R0 '
    Manufacturer-Specified Display Descriptor (0x03): 00 03 00 03 54 d8 04 64 7d 13 0c 19 af 00 00 00 '....T..d}.......'
    Manufacturer-Specified Display Descriptor (0x03): 00 03 00 19 51 ff 64 a0 f4 15 0c 4a f4 01 01 00 '....Q.d....J....'
  Extension blocks: 1
Checksum: 0xdd

----------------

Block 1, CTA-861 Extension Block:
  Revision: 3
  Native DTDs: 0
  HDR Static Metadata Data Block:
    Electro optical transfer functions:
      Traditional gamma - SDR luminance range
    Supported static metadata descriptors:
      Static metadata type 1
    Desired content max luminance: 138 (993.486 cd/m^2)
    Desired content max frame-average luminance: 138 (993.486 cd/m^2)
    Desired content min luminance: 200 (6.111 cd/m^2)
Checksum: 0x26  Unused space in Extension Block: 116 bytes

----------------

Warnings:

Block 0, Base EDID:
  Missing Display Product Name.
Block 1, CTA-861 Extension Block:
  IT Video Formats are overscanned by default, but normally this should be underscanned.
  Add a Colorimetry Data Block with the sRGB colorimetry bit set to avoid interop issues.

Failures:

Block 0, Base EDID:
  Alphanumeric Data String: One or more trailing spaces before newline.
  Missing Display Range Limits Descriptor.
Block 1, CTA-861 Extension Block:
  Required 640x480p60 timings are missing in the established timings and the SVD list (VIC 1).
  Missing VCDB, needed for Set Selectable RGB Quantization to avoid interop issues.
EDID:
  Extension Block 2 started with EDID header, ignoring Extension Blocks >= 2.

EDID conformity: FAIL
