edid-decode (hex):

00 ff ff ff ff ff ff 00 30 ae c6 41 00 00 00 00
00 22 01 04 a5 1e 13 78 22 ca 9e 92 5a 58 94 29
20 50 57 00 00 00 01 01 01 01 01 01 01 01 01 01
01 01 01 01 01 01 26 3d 80 b8 70 b0 28 40 10 10
3e 00 2e bc 10 00 00 18 00 00 00 00 00 00 00 00
00 00 00 00 00 00 00 00 00 00 00 00 00 0f 00 d1
0a 3c d1 0a 3c 28 0a 04 06 af ad 3c 00 00 00 fe
00 42 31 34 30 55 41 4e 30 34 2e 37 20 0a 00 fa

00 ff ff ff ff ff ff 00 30 ae c6 41 00 00 00 00
00 22 01 04 a5 1e 13 78 22 ca 9e 92 5a 58 94 29
20 50 57 00 00 00 01 01 01 01 01 01 01 01 01 01
01 01 01 01 01 01 26 3d 80 b8 70 b0 28 40 10 10
3e 00 2e bc 10 00 00 18 00 00 00 00 00 00 00 00
00 00 00 00 00 00 00 00 00 00 00 00 00 0f 00 d1
0a 3c d1 0a 3c 28 0a 04 06 af ad 3c 00 00 00 fe
00 42 31 34 30 55 41 4e 30 34 2e 37 20 0a 00 fa

----------------

Block 0, Base EDID:
  EDID Structure Version & Revision: 1.4
  Vendor & Product Identification:
    Manufacturer: LEN
    Model: 16838
    Made in: 2024
  Basic Display Parameters & Features:
    Digital display
    Bits per primary color channel: 8
    DisplayPort interface
    Maximum image size: 30 cm x 19 cm
    Gamma: 2.20
    DPMS levels: Off
    Supported color formats: RGB 4:4:4
    First detailed timing includes the native pixel format and preferred refresh rate
  Color Characteristics:
    Red  : 0.5732, 0.3515
    Green: 0.3457, 0.5800
    Blue : 0.1621, 0.1259
    White: 0.3154, 0.3417
  Established Timings I & II: none
  Standard Timings: none
  Detailed Timing Descriptors:
    DTD 1:  1920x1200   60.000920 Hz  16:10    74.401 kHz    156.540000 MHz (302 mm x 188 mm)
                 Hfront   16 Hsync  16 Hback  152 Hpol N
                 Vfront    3 Vsync  14 Vback   23 Vpol N
    Empty Descriptor
    Manufacturer-Specified Display Descriptor (0x0f): 00 0f 00 d1 0a 3c d1 0a 3c 28 0a 04 06 af ad 3c '.....<..<(.....<'
    Alphanumeric Data String: 'B140UAN04.7 '
Checksum: 0xfa

----------------

Warnings:

Block 0, Base EDID:
  Missing Display Product Name.

Failures:

Block 0, Base EDID:
  Empty Descriptor: Use Dummy Descriptor instead of all zeroes.
  Alphanumeric Data String: One or more trailing spaces before newline.
EDID:
  Extension Block 1 started with EDID header, ignoring Extension Blocks >= 1.

EDID conformity: FAIL
