edid-decode (hex):

00 ff ff ff ff ff ff 00 30 ae c6 41 00 00 00 00
00 22 01 04 a5 1e 13 78 03 7c cc 96 5d 5a 92 28
21 51 58 00 00 00 01 01 01 01 01 01 01 01 01 01
01 01 01 01 01 01 ea 3d 80 c8 70 b0 2e 40 30 20
36 00 2e bc 10 00 00 1a 00 00 00 fd 00 28 3c 4b
4b 10 01 0a 20 20 20 20 20 20 00 00 00 0f 00 d1
0a 3c d1 0a 3c 28 0a 04 0e 6f 32 14 00 00 00 fe
00 4d 4e 45 30 30 37 51 53 33 2d 33 0a 20 00 0b

00 ff ff ff ff ff ff 00 30 ae c6 41 00 00 00 00
00 22 01 04 a5 1e 13 78 03 7c cc 96 5d 5a 92 28
21 51 58 00 00 00 01 01 01 01 01 01 01 01 01 01
01 01 01 01 01 01 ea 3d 80 c8 70 b0 2e 40 30 20
36 00 2e bc 10 00 00 1a 00 00 00 fd 00 28 3c 4b
4b 10 01 0a 20 20 20 20 20 20 00 00 00 0f 00 d1
0a 3c d1 0a 3c 28 0a 04 0e 6f 32 14 00 00 00 fe
00 4d 4e 45 30 30 37 51 53 33 2d 33 0a 20 00 0b

----------------

Block 0, Base EDID:
  EDID Structure Version & Revision: 1.4
  Vendor & Product Identification:
    Manufacturer: LEN
    Model: 16838
    Made in: 2024
  Basic Display Parameters & Features:
    Digital display
    Bits per primary color channel: 8
    DisplayPort interface
    Maximum image size: 30 cm x 19 cm
    Gamma: 2.20
    Supported color formats: RGB 4:4:4
    First detailed timing includes the native pixel format and preferred refresh rate
    Display supports continuous frequencies
  Color Characteristics:
    Red  : 0.5869, 0.3662
    Green: 0.3544, 0.5703
    Blue : 0.1591, 0.1289
    White: 0.3193, 0.3437
  Established Timings I & II: none
  Standard Timings: none
  Detailed Timing Descriptors:
    DTD 1:  1920x1200   60.003331 Hz  16:10    74.764 kHz    158.500000 MHz (302 mm x 188 mm)
                 Hfront   48 Hsync  32 Hback  120 Hpol P
                 Vfront    3 Vsync   6 Vback   37 Vpol N
    Display Range Limits:
      Monitor ranges (Range Limits Only): 40-60 Hz V, 75-75 kHz H, max dotclock 160 MHz
    Manufacturer-Specified Display Descriptor (0x0f): 00 0f 00 d1 0a 3c d1 0a 3c 28 0a 04 0e 6f 32 14 '.....<..<(...o2.'
    Alphanumeric Data String: 'MNE007QS3-3'
Checksum: 0x0b

----------------

Warnings:

Block 0, Base EDID:
  Missing Display Product Name.

Failures:

EDID:
  Extension Block 1 started with EDID header, ignoring Extension Blocks >= 1.

EDID conformity: FAIL
