edid-decode (hex):

00 ff ff ff ff ff ff 00 09 e5 e8 0a 00 00 00 00
2a 1f 01 04 a5 1e 13 78 03 fb f5 96 5d 5a 91 29
1e 50 54 00 00 00 01 01 01 01 01 01 01 01 01 01
01 01 01 01 01 01 9c 3e 80 c8 70 b0 3c 40 30 20
36 00 2e bc 10 00 00 1a 00 00 00 fd 00 28 3c 4c
4c 10 01 0a 20 20 20 20 20 20 00 00 00 fe 00 42
4f 45 20 43 51 0a 20 20 20 20 20 20 00 00 00 fe
00 4e 56 31 34 30 57 55 4d 2d 4e 34 31 0a 00 26

00 ff ff ff ff ff ff 00 09 e5 e8 0a 00 00 00 00
2a 1f 01 04 a5 1e 13 78 03 fb f5 96 5d 5a 91 29
1e 50 54 00 00 00 01 01 01 01 01 01 01 01 01 01
01 01 01 01 01 01 9c 3e 80 c8 70 b0 3c 40 30 20
36 00 2e bc 10 00 00 1a 00 00 00 fd 00 28 3c 4c
4c 10 01 0a 20 20 20 20 20 20 00 00 00 fe 00 42
4f 45 20 43 51 0a 20 20 20 20 20 20 00 00 00 fe
00 4e 56 31 34 30 57 55 4d 2d 4e 34 31 0a 00 26

----------------

Block 0, Base EDID:
  EDID Structure Version & Revision: 1.4
  Vendor & Product Identification:
    Manufacturer: BOE
    Model: 2792
    Made in: week 42 of 2021
  Basic Display Parameters & Features:
    Digital display
    Bits per primary color channel: 8
    DisplayPort interface
    Maximum image size: 30 cm x 19 cm
    Gamma: 2.20
    Supported color formats: RGB 4:4:4
    First detailed timing includes the native pixel format and preferred refresh rate
    Display supports continuous frequencies
  Color Characteristics:
    Red  : 0.5888, 0.3662
    Green: 0.3535, 0.5693
    Blue : 0.1630, 0.1201
    White: 0.3134, 0.3291
  Established Timings I & II: none
  Standard Timings: none
  Detailed Timing Descriptors:
    DTD 1:  1920x1200   60.002995 Hz  16:10    75.604 kHz    160.280000 MHz (302 mm x 188 mm)
                 Hfront   48 Hsync  32 Hback  120 Hpol P
                 Vfront    3 Vsync   6 Vback   51 Vpol N
    Display Range Limits:
      Monitor ranges (Range Limits Only): 40-60 Hz V, 76-76 kHz H, max dotclock 160 MHz
    Alphanumeric Data String: 'BOE CQ'
    Alphanumeric Data String: 'NV140WUM-N41'
Checksum: 0x26

----------------

Block 1, Unknown EDID Extension Block 0x00:
  00 ff ff ff ff ff ff 00 09 e5 e8 0a 00 00 00 00 '................'
  2a 1f 01 04 a5 1e 13 78 03 fb f5 96 5d 5a 91 29 '*......x....]Z.)'
  1e 50 54 00 00 00 01 01 01 01 01 01 01 01 01 01 '.PT.............'
  01 01 01 01 01 01 9c 3e 80 c8 70 b0 3c 40 30 20 '.......>..p.<@0 '
  36 00 2e bc 10 00 00 1a 00 00 00 fd 00 28 3c 4c '6............(<L'
  4c 10 01 0a 20 20 20 20 20 20 00 00 00 fe 00 42 'L...      .....B'
  4f 45 20 43 51 0a 20 20 20 20 20 20 00 00 00 fe 'OE CQ.      ....'
  00 4e 56 31 34 30 57 55 4d 2d 4e 34 31 0a 00 26 '.NV140WUM-N41..&'
Checksum: 0x26

----------------

Warnings:

Block 0, Base EDID:
  Missing Display Product Name.
EDID:
  Base EDID: Some timings are out of range of the Monitor Ranges:
    Maximum Clock: 160.280 MHz (Monitor: 160.000 MHz)
    Could be due to a Monitor Range off-by-one rounding issue

Failures:

Block 1, Base EDID:
  Unknown Extension Block.
EDID:
  Base EDID: EDID specified 0 extension block(s), but found 1 extension block(s).

EDID conformity: FAIL
