edid-decode (hex):

00 ff ff ff ff ff ff 00 38 b8 ed 22 01 01 01 01
0b 13 01 03 80 32 1d 78 ea d4 25 a4 55 49 9b 27
13 50 54 a5 4b 00 81 c0 81 80 a9 40 a9 c0 01 01
01 01 01 01 01 01 02 3a 80 18 71 38 2d 40 58 2c
96 00 f1 24 11 00 00 1e 00 00 00 ff 00 32 32 45
44 41 47 39 31 31 30 36 30 32 00 00 00 fd 00 38
4c 1f 52 10 00 0a 20 20 20 20 20 20 00 00 00 fc
00 32 32 45 44 0a 20 20 20 20 20 20 20 20 00 92

----------------

Block 0, Base EDID:
  EDID Structure Version & Revision: 1.3
  Vendor & Product Identification:
    Manufacturer: NEX
    Model: 8941
    Serial Number: ...
    Made in: week 11 of 2009
  Basic Display Parameters & Features:
    Digital display
    Maximum image size: 50 cm x 29 cm
    Gamma: 2.20
    DPMS levels: Standby Suspend Off
    RGB color display
    First detailed timing is the preferred timing
  Color Characteristics:
    Red  : 0.6435, 0.3330
    Green: 0.2861, 0.6054
    Blue : 0.1523, 0.0761
    White: 0.3134, 0.3291
  Established Timings I & II:
    IBM     :   720x400    70.081663 Hz   9:5     31.467 kHz     28.320000 MHz
    DMT 0x04:   640x480    59.940476 Hz   4:3     31.469 kHz     25.175000 MHz
    DMT 0x06:   640x480    75.000000 Hz   4:3     37.500 kHz     31.500000 MHz
    DMT 0x09:   800x600    60.316541 Hz   4:3     37.879 kHz     40.000000 MHz
    DMT 0x0b:   800x600    75.000000 Hz   4:3     46.875 kHz     49.500000 MHz
    DMT 0x10:  1024x768    60.003840 Hz   4:3     48.363 kHz     65.000000 MHz
    DMT 0x12:  1024x768    75.028582 Hz   4:3     60.023 kHz     78.750000 MHz
    DMT 0x24:  1280x1024   75.024675 Hz   5:4     79.976 kHz    135.000000 MHz
  Standard Timings:
    DMT 0x55:  1280x720    60.000000 Hz  16:9     45.000 kHz     74.250000 MHz
    DMT 0x23:  1280x1024   60.019740 Hz   5:4     63.981 kHz    108.000000 MHz
    DMT 0x33:  1600x1200   60.000000 Hz   4:3     75.000 kHz    162.000000 MHz
    DMT 0x53:  1600x900    60.000000 Hz  16:9     60.000 kHz    108.000000 MHz (RB)
  Detailed Timing Descriptors:
    DTD 1:  1920x1080   60.000000 Hz  16:9     67.500 kHz    148.500000 MHz (497 mm x 292 mm)
                 Hfront   88 Hsync  44 Hback  148 Hpol P
                 Vfront    9 Vsync   6 Vback   30 Vpol P
    Display Product Serial Number: ...
    Display Range Limits:
      Monitor ranges (GTF): 56-76 Hz V, 31-82 kHz H, max dotclock 160 MHz
    Display Product Name: '22ED'
Checksum: 0x92

----------------

Warnings:

Block 0, Base EDID:
  Vendor & Product Identification: The serial number is one of the known dummy values, it should probably be set to 0.
  Detailed Timing Descriptor #1: DTD is similar but not identical to VIC 16.
  Detailed Timing Descriptor #1: Image size is 497x292 mm, but based on the picture AR it should be 497x279 mm.
EDID:
  Base EDID: Some timings are out of range of the Monitor Ranges:
    Maximum Clock: 162.000 MHz (Monitor: 160.000 MHz)
    Could be due to a Monitor Range off-by-one rounding issue

EDID conformity: PASS
