edid-decode (hex):

00 ff ff ff ff ff ff 00 30 23 0b 20 21 17 00 00
0b 0e 01 03 8e 29 1f 78 ea 60 e5 a3 57 4b 9c 25
11 50 54 a5 6a 80 81 80 71 4f 61 59 45 59 31 80
01 01 01 01 01 01 21 33 40 b4 60 b0 19 40 14 50
13 00 06 44 21 00 00 1e 00 00 00 fd 00 38 55 1c
50 0e 00 0a 20 20 20 20 20 20 00 00 00 fc 00 70
68 6f 74 6f 6e 32 30 76 69 73 69 6f 00 00 00 fc
00 6e 32 0a 20 20 20 20 20 20 20 20 20 20 00 17

00 ff ff ff ff ff ff 00 30 23 0b 20 21 17 00 00
0b 0e 01 03 8e 29 1f 78 ea 60 e5 a3 57 4b 9c 25
11 50 54 a5 6a 80 81 80 71 4f 61 59 45 59 31 80
01 01 01 01 01 01 21 33 40 b4 60 b0 19 40 14 50
13 00 06 44 21 00 00 1e 00 00 00 fd 00 38 55 1c
50 0e 00 0a 20 20 20 20 20 20 00 00 00 fc 00 70
68 6f 74 6f 6e 32 30 76 69 73 69 6f 00 00 00 fc
00 6e 32 0a 20 20 20 20 20 20 20 20 20 20 00 17

----------------

Block 0, Base EDID:
  EDID Structure Version & Revision: 1.3
  Vendor & Product Identification:
    Manufacturer: LAC
    Model: 8203
    Serial Number: ...
    Made in: week 11 of 2004
  Basic Display Parameters & Features:
    Digital display
    Maximum image size: 41 cm x 31 cm
    Gamma: 2.20
    DPMS levels: Standby Suspend Off
    RGB color display
    First detailed timing is the preferred timing
  Color Characteristics:
    Red  : 0.6376, 0.3417
    Green: 0.2929, 0.6093
    Blue : 0.1474, 0.0683
    White: 0.3134, 0.3291
  Established Timings I & II:
    IBM     :   720x400    70.081663 Hz   9:5     31.467 kHz     28.320000 MHz
    DMT 0x04:   640x480    59.940476 Hz   4:3     31.469 kHz     25.175000 MHz
    DMT 0x06:   640x480    75.000000 Hz   4:3     37.500 kHz     31.500000 MHz
    DMT 0x09:   800x600    60.316541 Hz   4:3     37.879 kHz     40.000000 MHz
    DMT 0x0b:   800x600    75.000000 Hz   4:3     46.875 kHz     49.500000 MHz
    Apple   :   832x624    74.551266 Hz   4:3     49.726 kHz     57.284000 MHz
    DMT 0x10:  1024x768    60.003840 Hz   4:3     48.363 kHz     65.000000 MHz
    DMT 0x12:  1024x768    75.028582 Hz   4:3     60.023 kHz     78.750000 MHz
    Apple   :  1152x870    75.061550 Hz 192:145   68.681 kHz    100.000000 MHz
  Standard Timings:
    DMT 0x23:  1280x1024   60.019740 Hz   5:4     63.981 kHz    108.000000 MHz
    DMT 0x15:  1152x864    75.000000 Hz   4:3     67.500 kHz    108.000000 MHz
    DMT 0x13:  1024x768    84.996690 Hz   4:3     68.677 kHz     94.500000 MHz
    DMT 0x0c:   800x600    85.061274 Hz   4:3     53.674 kHz     56.250000 MHz
    GTF     :   640x512    60.000000 Hz   5:4     31.860 kHz     25.488000 MHz
  Detailed Timing Descriptors:
    DTD 1:  1600x1200   60.027517 Hz   4:3     73.534 kHz    130.890000 MHz (518 mm x 324 mm)
                 Hfront   20 Hsync  80 Hback   80 Hpol P
                 Vfront    1 Vsync   3 Vback   21 Vpol P
    Display Range Limits:
      Monitor ranges (GTF): 56-85 Hz V, 28-80 kHz H, max dotclock 140 MHz
    Display Product Name: 'photon20visio'
    Display Product Name: 'n2'
Checksum: 0x17

----------------

Warnings:

Block 0, Base EDID:
  Detailed Timing Descriptor #1: Image size is 518x324 mm, but based on the picture AR it should be 432x324 mm.

Failures:

Block 0, Base EDID:
  Basic Display Parameters & Features: Digital Video Interface Standard set to reserved value 0x0e.
  Detailed Timing Descriptor #1: Mismatch of image size 518x324 mm vs display size 410x310 mm.
EDID:
  Extension Block 1 started with EDID header, ignoring Extension Blocks >= 1.
  Base EDID: The DTD max image size is 518x324mm, which is larger than the display size 410.0x310.0mm.

EDID conformity: FAIL
