edid-decode (hex):

00 ff ff ff ff ff ff 00 0d af 26 14 00 00 00 00
0c 11 01 03 80 1e 13 78 0a 47 a0 94 57 4f 8c 27
27 50 54 00 00 00 01 01 01 01 01 01 01 01 01 01
01 01 01 01 01 01 e4 1b 00 a5 50 20 17 30 30 20
36 00 2f be 10 00 00 19 00 00 00 00 00 00 00 00
00 00 00 00 00 00 00 00 00 00 00 00 00 fe 00 52
37 36 37 47 38 4e 31 34 31 49 33 0a 00 00 00 fe
00 2c 40 4d 56 7a 9f db ff 01 01 0a 20 20 00 ed

----------------

Block 0, Base EDID:
  EDID Structure Version & Revision: 1.3
  Vendor & Product Identification:
    Manufacturer: CMO
    Model: 5158
    Made in: week 12 of 2007
  Basic Display Parameters & Features:
    Digital display
    Maximum image size: 30 cm x 19 cm
    Gamma: 2.20
    RGB color display
    First detailed timing is the preferred timing
  Color Characteristics:
    Red  : 0.5791, 0.3398
    Green: 0.3095, 0.5498
    Blue : 0.1542, 0.1542
    White: 0.3125, 0.3281
  Established Timings I & II: none
  Standard Timings: none
  Detailed Timing Descriptors:
    DTD 1:  1280x800    60.038596 Hz  16:10    49.412 kHz     71.400000 MHz (303 mm x 190 mm)
                 Hfront   48 Hsync  32 Hback   85 Hpol N
                 Vfront    3 Vsync   6 Vback   14 Vpol N
    Empty Descriptor
    Alphanumeric Data String: 'R767G8N141I3'
    Alphanumeric Data String: ',@MVz..'
Checksum: 0xed

----------------

Warnings:

Block 0, Base EDID:
  Alphanumeric Data String: Non-ASCII character 0x9f at position 5, can cause problems.
  Alphanumeric Data String: Non-ASCII character 0xdb at position 6, can cause problems.

Failures:

Block 0, Base EDID:
  Empty Descriptor: Use Dummy Descriptor instead of all zeroes.
  Alphanumeric Data String: 0xff byte at position 7.
  Missing Display Product Name.
  Missing Display Range Limits Descriptor.

EDID conformity: FAIL
