edid-decode (hex):

00 ff ff ff ff ff ff 00 0e 14 8b 1c 00 00 00 00
13 16 01 03 80 16 0c 78 0a 82 7d 99 57 4f 99 26
1c 50 54 00 00 00 01 01 01 01 01 01 01 01 01 01
01 01 01 01 01 01 b0 1c 56 a6 50 00 1f 30 30 20
35 00 de 7d 00 00 00 19 b0 1c 56 a6 50 00 1f 30
30 20 35 00 de 7d 00 00 00 19 00 00 00 fe 00 43
50 54 20 20 20 20 20 20 20 20 20 20 00 00 00 fe
00 43 4c 41 41 31 30 31 57 42 30 33 20 20 00 5d

----------------

Block 0, Base EDID:
  EDID Structure Version & Revision: 1.3
  Vendor & Product Identification:
    Manufacturer: CPT
    Model: 7307
    Made in: week 19 of 2012
  Basic Display Parameters & Features:
    Digital display
    Maximum image size: 22 cm x 12 cm
    Gamma: 2.20
    RGB color display
    First detailed timing is the preferred timing
  Color Characteristics:
    Red  : 0.5996, 0.3398
    Green: 0.3085, 0.5996
    Blue : 0.1494, 0.1123
    White: 0.3154, 0.3291
  Established Timings I & II: none
  Standard Timings: none
  Detailed Timing Descriptors:
    DTD 1:  1366x768    59.996667 Hz 683:384   47.937 kHz     73.440000 MHz (222 mm x 125 mm)
                 Hfront   48 Hsync  32 Hback   86 Hpol N
                 Vfront    3 Vsync   5 Vback   23 Vpol N
    DTD 2:  1366x768    59.996667 Hz 683:384   47.937 kHz     73.440000 MHz (222 mm x 125 mm)
                 Hfront   48 Hsync  32 Hback   86 Hpol N
                 Vfront    3 Vsync   5 Vback   23 Vpol N
    Alphanumeric Data String: 'CPT          '
    Alphanumeric Data String: 'CLAA101WB03  '
Checksum: 0x5d

----------------

Failures:

Block 0, Base EDID:
  Alphanumeric Data String: No newline, but one or more trailing spaces.
  Alphanumeric Data String: No newline, but one or more trailing spaces.
  Missing Display Product Name.
  Missing Display Range Limits Descriptor.

EDID conformity: FAIL
