edid-decode (hex):

00 ff ff ff ff ff ff 00 0d ae 13 16 00 00 00 00
14 1f 01 04 a5 22 16 78 02 ee 95 a3 54 4c 99 26
0f 50 54 00 00 00 01 01 01 01 01 01 01 01 01 01
01 01 01 01 01 01 42 3c 80 a0 70 b0 24 40 2e 1e
a6 00 58 d7 10 00 00 1a 42 3c 80 a0 70 b0 59 41
2e 1e a6 00 58 d7 10 00 00 1a 00 00 00 fe 00 35
30 44 30 34 80 31 36 30 4a 43 41 0a 00 00 00 00
00 02 41 01 9e 00 10 00 00 0a 41 0a 20 20 00 ba

00 ff ff ff ff ff ff 00 0d ae 13 16 00 00 00 00
14 1f 01 04 a5 22 16 78 02 ee 95 a3 54 4c 99 26
0f 50 54 00 00 00 01 01 01 01 01 01 01 01 01 01
01 01 01 01 01 01 42 3c 80 a0 70 b0 24 40 2e 1e
a6 00 58 d7 10 00 00 1a 42 3c 80 a0 70 b0 59 41
2e 1e a6 00 58 d7 10 00 00 1a 00 00 00 fe 00 35
30 44 30 34 80 31 36 30 4a 43 41 0a 00 00 00 00
00 02 41 01 9e 00 10 00 00 0a 41 0a 20 20 00 ba

----------------

Block 0, Base EDID:
  EDID Structure Version & Revision: 1.4
  Vendor & Product Identification:
    Manufacturer: CMN
    Model: 5651
    Made in: week 20 of 2021
  Basic Display Parameters & Features:
    Digital display
    Bits per primary color channel: 8
    DisplayPort interface
    Maximum image size: 34 cm x 22 cm
    Gamma: 2.20
    Supported color formats: RGB 4:4:4
    First detailed timing includes the native pixel format and preferred refresh rate
  Color Characteristics:
    Red  : 0.6396, 0.3300
    Green: 0.2998, 0.5996
    Blue : 0.1503, 0.0595
    White: 0.3134, 0.3291
  Established Timings I & II: none
  Standard Timings: none
  Detailed Timing Descriptors:
    DTD 1:  1920x1200   60.002801 Hz  16:10    74.163 kHz    154.260000 MHz (344 mm x 215 mm)
                 Hfront   46 Hsync  30 Hback   84 Hpol P
                 Vfront   10 Vsync   6 Vback   20 Vpol N
    DTD 2:  1920x1200   48.002240 Hz  16:10    74.163 kHz    154.260000 MHz (344 mm x 215 mm)
                 Hfront   46 Hsync  30 Hback   84 Hpol P
                 Vfront   10 Vsync   6 Vback  329 Vpol N
    Alphanumeric Data String: '50D04.160JCA'
    Manufacturer-Specified Display Descriptor (0x00): 00 00 00 02 41 01 9e 00 10 00 00 0a 41 0a 20 20 '....A.......A.  '
Checksum: 0xba

----------------

Warnings:

Block 0, Base EDID:
  Alphanumeric Data String: Non-ASCII character 0x80 at position 5, can cause problems.
  Missing Display Product Name.

Failures:

EDID:
  Extension Block 1 started with EDID header, ignoring Extension Blocks >= 1.

EDID conformity: FAIL
