edid-decode (hex):

00 ff ff ff ff ff ff 00 52 5f 11 55 01 04 00 00
00 2a 01 04 a5 00 00 78 02 80 42 ac 51 30 b4 25
10 50 53 00 00 00 01 01 01 01 01 01 01 01 01 01
01 01 01 01 01 01 02 3a 80 18 71 38 2d 40 30 20
35 00 00 00 00 00 00 18 02 3a 80 18 71 38 2d 40
30 20 35 00 00 00 00 00 00 18 00 00 00 fe 00 0a
20 20 20 20 20 20 20 20 20 20 20 20 00 00 00 fe
00 31 39 32 30 78 31 30 38 30 0a 20 20 20 00 06

00 ff ff ff ff ff ff 00 52 5f 11 55 01 04 00 00
00 2a 01 04 a5 00 00 78 02 80 42 ac 51 30 b4 25
10 50 53 00 00 00 01 01 01 01 01 01 01 01 01 01
01 01 01 01 01 01 02 3a 80 18 71 38 2d 40 30 20
35 00 00 00 00 00 00 18 02 3a 80 18 71 38 2d 40
30 20 35 00 00 00 00 00 00 18 00 00 00 fe 00 0a
20 20 20 20 20 20 20 20 20 20 20 20 00 00 00 fe
00 31 39 32 30 78 31 30 38 30 0a 20 20 20 00 06

----------------

Block 0, Base EDID:
  EDID Structure Version & Revision: 1.4
  Vendor & Product Identification:
    Manufacturer: TR_
    Model: 21777
    Serial Number: ...
    Made in: 2032
  Basic Display Parameters & Features:
    Digital display
    Bits per primary color channel: 8
    DisplayPort interface
    Image size is variable
    Gamma: 2.20
    Supported color formats: RGB 4:4:4
    First detailed timing includes the native pixel format and preferred refresh rate
  Color Characteristics:
    Red  : 0.6738, 0.3164
    Green: 0.1875, 0.7031
    Blue : 0.1455, 0.0625
    White: 0.3125, 0.3261
  Established Timings I & II: none
  Standard Timings: none
  Detailed Timing Descriptors:
    DTD 1:  1920x1080   60.000000 Hz  16:9     67.500 kHz    148.500000 MHz
                 Hfront   48 Hsync  32 Hback  200 Hpol N
                 Vfront    3 Vsync   5 Vback   37 Vpol N
    DTD 2:  1920x1080   60.000000 Hz  16:9     67.500 kHz    148.500000 MHz
                 Hfront   48 Hsync  32 Hback  200 Hpol N
                 Vfront    3 Vsync   5 Vback   37 Vpol N
    Alphanumeric Data String: ''
    Alphanumeric Data String: '1920x1080'
Checksum: 0x06

----------------

Block 1, Unknown EDID Extension Block 0x00:
  00 ff ff ff ff ff ff 00 52 5f 11 55 01 04 00 00 '........R_.U....'
  00 2a 01 04 a5 00 00 78 02 80 42 ac 51 30 b4 25 '.*.....x..B.Q0.%'
  10 50 53 00 00 00 01 01 01 01 01 01 01 01 01 01 '.PS.............'
  01 01 01 01 01 01 02 3a 80 18 71 38 2d 40 30 20 '.......:..q8-@0 '
  35 00 00 00 00 00 00 18 02 3a 80 18 71 38 2d 40 '5........:..q8-@'
  30 20 35 00 00 00 00 00 00 18 00 00 00 fe 00 0a '0 5.............'
  20 20 20 20 20 20 20 20 20 20 20 20 00 00 00 fe '            ....'
  00 31 39 32 30 78 31 30 38 30 0a 20 20 20 00 06 '.1920x1080.   ..'
Checksum: 0x06

----------------

Warnings:

Block 0, Base EDID:
  Detailed Timing Descriptor #1: DTD is similar but not identical to VIC 16.
  Detailed Timing Descriptor #2: DTD is similar but not identical to VIC 16.
  Missing Display Product Name.

Failures:

Block 0, Base EDID:
  Vendor & Product Identification: Manufacturer name field contains garbage.
  Vendor & Product Identification: The year is more than one year in the future.
  Alphanumeric Data String: Empty string.
Block 1, Base EDID:
  Unknown Extension Block.
EDID:
  Base EDID: EDID specified 0 extension block(s), but found 1 extension block(s).

EDID conformity: FAIL
