edid-decode (hex):

00 ff ff ff ff ff ff 00 52 5f 11 55 01 04 00 00
05 1f 01 04 a5 2b 1d 78 02 80 42 ac 51 30 b4 25
10 50 53 00 00 00 01 01 01 01 01 01 01 01 01 01
01 01 01 01 01 01 a6 37 80 c8 70 38 28 40 50 20
35 00 06 4d 21 00 00 1a 60 2e 80 c8 70 38 28 40
50 20 35 00 06 4d 21 00 00 1a 00 00 00 fe 00 0a
20 20 20 20 20 20 20 20 20 20 20 20 00 00 00 fe
00 31 39 32 30 78 31 30 38 30 20 20 20 20 00 3b

00 ff ff ff ff ff ff 00 52 5f 11 55 01 04 00 00
05 1f 01 04 a5 2b 1d 78 02 80 42 ac 51 30 b4 25
10 50 53 00 00 00 01 01 01 01 01 01 01 01 01 01
01 01 01 01 01 01 a6 37 80 c8 70 38 28 40 50 20
35 00 06 4d 21 00 00 1a 60 2e 80 c8 70 38 28 40
50 20 35 00 06 4d 21 00 00 1a 00 00 00 fe 00 0a
20 20 20 20 20 20 20 20 20 20 20 20 00 00 00 fe
00 31 39 32 30 78 31 30 38 30 20 20 20 20 00 3b

----------------

Block 0, Base EDID:
  EDID Structure Version & Revision: 1.4
  Vendor & Product Identification:
    Manufacturer: TR_
    Model: 21777
    Serial Number: ...
    Made in: week 5 of 2021
  Basic Display Parameters & Features:
    Digital display
    Bits per primary color channel: 8
    DisplayPort interface
    Maximum image size: 43 cm x 29 cm
    Gamma: 2.20
    Supported color formats: RGB 4:4:4
    First detailed timing includes the native pixel format and preferred refresh rate
  Color Characteristics:
    Red  : 0.6738, 0.3164
    Green: 0.1875, 0.7031
    Blue : 0.1455, 0.0625
    White: 0.3125, 0.3261
  Established Timings I & II: none
  Standard Timings: none
  Detailed Timing Descriptors:
    DTD 1:  1920x1080   59.998315 Hz  16:9     67.198 kHz    142.460000 MHz (518 mm x 333 mm)
                 Hfront   80 Hsync  32 Hback   88 Hpol P
                 Vfront    3 Vsync   5 Vback   32 Vpol N
    DTD 2:  1920x1080   50.000000 Hz  16:9     56.000 kHz    118.720000 MHz (518 mm x 333 mm)
                 Hfront   80 Hsync  32 Hback   88 Hpol P
                 Vfront    3 Vsync   5 Vback   32 Vpol N
    Alphanumeric Data String: ''
    Alphanumeric Data String: '1920x1080    '
Checksum: 0x3b

----------------

Block 1, Unknown EDID Extension Block 0x00:
  00 ff ff ff ff ff ff 00 52 5f 11 55 01 04 00 00 '........R_.U....'
  05 1f 01 04 a5 2b 1d 78 02 80 42 ac 51 30 b4 25 '.....+.x..B.Q0.%'
  10 50 53 00 00 00 01 01 01 01 01 01 01 01 01 01 '.PS.............'
  01 01 01 01 01 01 a6 37 80 c8 70 38 28 40 50 20 '.......7..p8(@P '
  35 00 06 4d 21 00 00 1a 60 2e 80 c8 70 38 28 40 '5..M!...`...p8(@'
  50 20 35 00 06 4d 21 00 00 1a 00 00 00 fe 00 0a 'P 5..M!.........'
  20 20 20 20 20 20 20 20 20 20 20 20 00 00 00 fe '            ....'
  00 31 39 32 30 78 31 30 38 30 20 20 20 20 00 3b '.1920x1080    .;'
Checksum: 0x3b

----------------

Warnings:

Block 0, Base EDID:
  Detailed Timing Descriptor #1: Image size is 518x333 mm, but based on the picture AR it should be 518x291 mm.
  Detailed Timing Descriptor #2: Image size is 518x333 mm, but based on the picture AR it should be 518x291 mm.
  Missing Display Product Name.

Failures:

Block 0, Base EDID:
  Vendor & Product Identification: Manufacturer name field contains garbage.
  Detailed Timing Descriptor #1: Mismatch of image size 518x333 mm vs display size 430x290 mm.
  Detailed Timing Descriptor #2: Mismatch of image size 518x333 mm vs display size 430x290 mm.
  Alphanumeric Data String: Empty string.
  Alphanumeric Data String: No newline, but one or more trailing spaces.
Block 1, Base EDID:
  Unknown Extension Block.
EDID:
  Base EDID: The DTD max image size is 518x333mm, which is larger than the display size 430.0x290.0mm.
  Base EDID: EDID specified 0 extension block(s), but found 1 extension block(s).

EDID conformity: FAIL
