edid-decode (hex):

00 ff ff ff ff ff ff 00 52 5f 11 55 01 04 00 00
15 15 01 04 95 00 00 78 02 80 42 ac 51 30 b4 25
10 50 53 00 00 00 01 01 01 01 01 01 01 01 01 01
01 01 01 01 01 01 58 1b 56 7e 50 00 0e 30 30 24
35 00 06 4d 21 00 00 18 ca 16 56 7e 50 00 0e 30
30 24 35 00 06 4d 21 00 00 08 00 00 00 fe 00 0a
20 20 20 20 20 20 20 20 20 20 20 20 00 00 00 fe
00 31 33 36 36 78 37 36 38 20 20 20 20 20 00 dd

----------------

Block 0, Base EDID:
  EDID Structure Version & Revision: 1.4
  Vendor & Product Identification:
    Manufacturer: TR_
    Model: 21777
    Serial Number: ...
    Made in: week 21 of 2011
  Basic Display Parameters & Features:
    Digital display
    Bits per primary color channel: 6
    DisplayPort interface
    Image size is variable
    Gamma: 2.20
    Supported color formats: RGB 4:4:4
    First detailed timing includes the native pixel format and preferred refresh rate
  Color Characteristics:
    Red  : 0.6738, 0.3164
    Green: 0.1875, 0.7031
    Blue : 0.1455, 0.0625
    White: 0.3125, 0.3261
  Established Timings I & II: none
  Standard Timings: none
  Detailed Timing Descriptors:
    DTD 1:  1366x768    59.996023 Hz 683:384   46.917 kHz     70.000000 MHz (518 mm x 333 mm)
                 Hfront   48 Hsync  36 Hback   42 Hpol N
                 Vfront    3 Vsync   5 Vback    6 Vpol N
    DTD 2:  1366x768    50.002400 Hz 683:384   39.102 kHz     58.340000 MHz (bipolar analog composite, sync-on-green, 518 mm x 333 mm)
                 Hfront   48 Hsync  36 Hback   42 Hpol N
                 Vfront    3 Vsync   5 Vback    6 Vpol N
    Alphanumeric Data String: ''
    Alphanumeric Data String: '1366x768     '
Checksum: 0xdd

----------------

Warnings:

Block 0, Base EDID:
  Detailed Timing Descriptor #1: Image size is 518x333 mm, but based on the picture AR it should be 518x291 mm.
  Detailed Timing Descriptor #2: Image size is 518x333 mm, but based on the picture AR it should be 518x291 mm.
  Missing Display Product Name.

Failures:

Block 0, Base EDID:
  Vendor & Product Identification: Manufacturer name field contains garbage.
  Alphanumeric Data String: Empty string.
  Alphanumeric Data String: No newline, but one or more trailing spaces.
EDID:
  Base EDID: The DTD max image size is 518x333mm, but the display size is not specified anywhere.

EDID conformity: FAIL
