edid-decode (hex):

00 ff ff ff ff ff ff 00 52 5f 11 55 01 04 00 00
05 17 01 04 a5 35 1e 78 02 80 42 ac 51 30 b4 25
10 50 53 00 00 00 01 01 01 01 01 01 01 01 01 01
01 01 01 01 01 01 c4 38 80 04 71 38 1f 40 30 20
35 00 07 44 21 00 00 1a c4 38 80 04 71 38 1f 40
30 20 35 00 07 44 21 00 00 1a 00 00 00 fe 00 0a
20 20 20 20 20 20 20 20 20 20 20 20 00 00 00 fe
00 31 39 32 30 78 31 30 38 30 0a 20 20 20 00 a9

00 ff ff ff ff ff ff 00 52 5f 11 55 01 04 00 00
05 17 01 04 a5 35 1e 78 02 80 42 ac 51 30 b4 25
10 50 53 00 00 00 01 01 01 01 01 01 01 01 01 01
01 01 01 01 01 01 c4 38 80 04 71 38 1f 40 30 20
35 00 07 44 21 00 00 1a c4 38 80 04 71 38 1f 40
30 20 35 00 07 44 21 00 00 1a 00 00 00 fe 00 0a
20 20 20 20 20 20 20 20 20 20 20 20 00 00 00 fe
00 31 39 32 30 78 31 30 38 30 0a 20 20 20 00 a9

----------------

Block 0, Base EDID:
  EDID Structure Version & Revision: 1.4
  Vendor & Product Identification:
    Manufacturer: TR_
    Model: 21777
    Serial Number: ...
    Made in: week 5 of 2013
  Basic Display Parameters & Features:
    Digital display
    Bits per primary color channel: 8
    DisplayPort interface
    Maximum image size: 53 cm x 30 cm
    Gamma: 2.20
    Supported color formats: RGB 4:4:4
    First detailed timing includes the native pixel format and preferred refresh rate
  Color Characteristics:
    Red  : 0.6738, 0.3164
    Green: 0.1875, 0.7031
    Blue : 0.1455, 0.0625
    White: 0.3125, 0.3261
  Established Timings I & II: none
  Standard Timings: none
  Detailed Timing Descriptors:
    DTD 1:  1920x1080   60.000495 Hz  16:9     66.661 kHz    145.320000 MHz (519 mm x 324 mm)
                 Hfront   48 Hsync  32 Hback  180 Hpol P
                 Vfront    3 Vsync   5 Vback   23 Vpol N
    DTD 2:  1920x1080   60.000495 Hz  16:9     66.661 kHz    145.320000 MHz (519 mm x 324 mm)
                 Hfront   48 Hsync  32 Hback  180 Hpol P
                 Vfront    3 Vsync   5 Vback   23 Vpol N
    Alphanumeric Data String: ''
    Alphanumeric Data String: '1920x1080'
Checksum: 0xa9

----------------

Warnings:

Block 0, Base EDID:
  Detailed Timing Descriptor #1: Image size is 519x324 mm, but based on the picture AR it should be 519x291 mm.
  Detailed Timing Descriptor #2: Image size is 519x324 mm, but based on the picture AR it should be 519x291 mm.
  Missing Display Product Name.

Failures:

Block 0, Base EDID:
  Vendor & Product Identification: Manufacturer name field contains garbage.
  Detailed Timing Descriptor #1: Mismatch of image size 519x324 mm vs display size 530x300 mm.
  Detailed Timing Descriptor #2: Mismatch of image size 519x324 mm vs display size 530x300 mm.
  Alphanumeric Data String: Empty string.
EDID:
  Extension Block 1 started with EDID header, ignoring Extension Blocks >= 1.
  Base EDID: The DTD max image size is 519x324mm, which is larger than the display size 530.0x300.0mm.

EDID conformity: FAIL
