edid-decode (hex):

00 ff ff ff ff ff ff 00 2c a2 56 01 01 01 01 01
0e 1c 01 03 80 1e 1a 78 3e 64 35 a5 54 4f 9e 27
12 50 54 21 08 00 d1 c0 d1 c0 d1 c0 95 00 90 40
81 80 81 40 81 c0 e2 68 00 a0 a0 40 2e 60 30 20
36 00 2c 04 11 00 00 1a 00 00 00 fc 00 64 69 73
70 6c 61 79 0a 20 20 20 20 20 00 00 00 ff 00 0a
20 20 20 20 20 20 20 20 20 20 20 20 00 00 00 fd
00 3b 3e 1c 6e 1d 01 0a 20 20 20 20 20 20 01 5a

02 03 43 f1 49 10 04 10 0f 13 10 49 45 4c 23 09
07 07 83 01 00 00 67 03 0c 00 10 00 38 44 67 d8
5d c4 01 44 80 01 68 1a 00 00 01 09 28 3c e6 e5
0f 00 00 06 00 e3 05 c0 00 e2 00 ff e6 06 05 01
59 59 49 e2 68 00 a0 a0 40 2e 60 30 20 36 00 2c
04 11 00 00 1a 00 00 00 00 00 00 00 00 00 00 00
00 00 00 00 00 00 00 00 00 00 00 00 00 00 00 00
00 00 00 00 00 00 00 00 00 00 00 00 00 00 00 e9

00 ff ff ff ff ff ff 00 2c a2 56 01 01 01 01 01
0e 1c 01 03 80 1e 1a 78 3e 64 35 a5 54 4f 9e 27
12 50 54 21 08 00 d1 c0 d1 c0 d1 c0 95 00 90 40
81 80 81 40 81 c0 e2 68 00 a0 a0 40 2e 60 30 20
36 00 2c 04 11 00 00 1a 00 00 00 fc 00 64 69 73
70 6c 61 79 0a 20 20 20 20 20 00 00 00 ff 00 0a
20 20 20 20 20 20 20 20 20 20 20 20 00 00 00 fd
00 3b 3e 1c 6e 1d 01 0a 20 20 20 20 20 20 01 5a

02 03 43 f1 49 10 04 10 0f 13 10 49 45 4c 23 09
07 07 83 01 00 00 67 03 0c 00 10 00 38 44 67 d8
5d c4 01 44 80 01 68 1a 00 00 01 09 28 3c e6 e5
0f 00 00 06 00 e3 05 c0 00 e2 00 ff e6 06 05 01
59 59 49 e2 68 00 a0 a0 40 2e 60 30 20 36 00 2c
04 11 00 00 1a 00 00 00 00 00 00 00 00 00 00 00
00 00 00 00 00 00 00 00 00 00 00 00 00 00 00 00
00 00 00 00 00 00 00 00 00 00 00 00 00 00 00 e9

----------------

Block 0, Base EDID:
  EDID Structure Version & Revision: 1.3
  Vendor & Product Identification:
    Manufacturer: KEB
    Model: 342
    Serial Number: ...
    Made in: week 14 of 2018
  Basic Display Parameters & Features:
    Digital display
    Maximum image size: 30 cm x 26 cm
    Gamma: 2.20
    DPMS levels: Off
    Undefined display color type
    Default (sRGB) color space is primary color space
    First detailed timing is the preferred timing
  Color Characteristics:
    Red  : 0.6455, 0.3300
    Green: 0.3095, 0.6171
    Blue : 0.1523, 0.0732
    White: 0.3134, 0.3291
  Established Timings I & II:
    DMT 0x04:   640x480    59.940476 Hz   4:3     31.469 kHz     25.175000 MHz
    DMT 0x09:   800x600    60.316541 Hz   4:3     37.879 kHz     40.000000 MHz
    DMT 0x10:  1024x768    60.003840 Hz   4:3     48.363 kHz     65.000000 MHz
  Standard Timings:
    DMT 0x52:  1920x1080   60.000000 Hz  16:9     67.500 kHz    148.500000 MHz
    DMT 0x52:  1920x1080   60.000000 Hz  16:9     67.500 kHz    148.500000 MHz
    DMT 0x52:  1920x1080   60.000000 Hz  16:9     67.500 kHz    148.500000 MHz
    DMT 0x2f:  1440x900    59.887445 Hz  16:10    55.935 kHz    106.500000 MHz
    DMT 0x2a:  1400x1050   59.978442 Hz   4:3     65.317 kHz    121.750000 MHz
    DMT 0x23:  1280x1024   60.019740 Hz   5:4     63.981 kHz    108.000000 MHz
    DMT 0x20:  1280x960    60.000000 Hz   4:3     60.000 kHz    108.000000 MHz
    DMT 0x55:  1280x720    60.000000 Hz  16:9     45.000 kHz     74.250000 MHz
  Detailed Timing Descriptors:
    DTD 1:  2560x1600   59.971589 Hz  16:10    98.713 kHz    268.500000 MHz (300 mm x 260 mm)
                 Hfront   48 Hsync  32 Hback   80 Hpol P
                 Vfront    3 Vsync   6 Vback   37 Vpol N
    Display Product Name: 'display'
    Display Product Serial Number: ...
    Display Range Limits:
      Monitor ranges (Range Limits Only): 59-62 Hz V, 28-110 kHz H, max dotclock 290 MHz
  Extension blocks: 1
Checksum: 0x5a

----------------

Block 1, CTA-861 Extension Block:
  Revision: 3
  Underscans IT Video Formats by default
  Basic audio support
  Supports YCbCr 4:4:4
  Supports YCbCr 4:2:2
  Native detailed modes: 1
  Video Data Block:
    VIC  16:  1920x1080   60.000000 Hz  16:9     67.500 kHz    148.500000 MHz
    VIC   4:  1280x720    60.000000 Hz  16:9     45.000 kHz     74.250000 MHz
    VIC  16:  1920x1080   60.000000 Hz  16:9     67.500 kHz    148.500000 MHz
    VIC  15:  1440x480    59.940060 Hz  16:9     31.469 kHz     54.000000 MHz
    VIC  19:  1280x720    50.000000 Hz  16:9     37.500 kHz     74.250000 MHz
    VIC  16:  1920x1080   60.000000 Hz  16:9     67.500 kHz    148.500000 MHz
    VIC  73:  1920x1080   25.000000 Hz  64:27    28.125 kHz     74.250000 MHz
    VIC  69:  1280x720    60.000000 Hz  64:27    45.000 kHz     74.250000 MHz
    VIC  76:  1920x1080   60.000000 Hz  64:27    67.500 kHz    148.500000 MHz
  Audio Data Block:
    Linear PCM:
      Max channels: 2
      Supported sample rates (kHz): 48 44.1 32
      Supported sample sizes (bits): 24 20 16
  Speaker Allocation Data Block:
    FL/FR - Front Left/Right
  Vendor-Specific Data Block (HDMI), OUI 00-0C-03:
    Source physical address: 1.0.0.0
    DC_36bit
    DC_30bit
    DC_Y444
    Maximum TMDS clock: 340 MHz
  Vendor-Specific Data Block (HDMI Forum), OUI C4-5D-D8:
    Version: 1
    Maximum TMDS Character Rate: 340 MHz
    SCDC Present
    Supports 10-bits/component Deep Color 4:2:0 Pixel Encoding
  Vendor-Specific Data Block (AMD), OUI 00-00-1A:
    Version: 1
    Feature Caps: 0x09
    Minimum Refresh Rate: 40 Hz
    Maximum Refresh Rate: 60 Hz
    Flags 1.x: 0xe6 (MCCS)
  YCbCr 4:2:0 Capability Map Data Block:
    VIC  76:  1920x1080   60.000000 Hz  64:27    67.500 kHz    148.500000 MHz
    SVD Index 19 is out of range
  Colorimetry Data Block:
    BT2020YCC
    BT2020RGB
  Video Capability Data Block:
    YCbCr quantization: Selectable (via AVI YQ)
    RGB quantization: Selectable (via AVI Q)
    PT scan behavior: Supports both over- and underscan
    IT scan behavior: Supports both over- and underscan
    CE scan behavior: Supports both over- and underscan
  HDR Static Metadata Data Block:
    Electro optical transfer functions:
      Traditional gamma - SDR luminance range
      SMPTE ST2084
    Supported static metadata descriptors:
      Static metadata type 1
    Desired content max luminance: 89 (343.724 cd/m^2)
    Desired content max frame-average luminance: 89 (343.724 cd/m^2)
    Desired content min luminance: 73 (0.282 cd/m^2)
  Detailed Timing Descriptors:
    DTD 2:  2560x1600   59.971589 Hz  16:10    98.713 kHz    268.500000 MHz (300 mm x 260 mm)
                 Hfront   48 Hsync  32 Hback   80 Hpol P
                 Vfront    3 Vsync   6 Vback   37 Vpol N
Checksum: 0xe9  Unused space in Extension Block: 42 bytes

----------------

Block 2, Unknown EDID Extension Block 0x00:
  00 ff ff ff ff ff ff 00 2c a2 56 01 01 01 01 01 '........,.V.....'
  0e 1c 01 03 80 1e 1a 78 3e 64 35 a5 54 4f 9e 27 '.......x>d5.TO.''
  12 50 54 21 08 00 d1 c0 d1 c0 d1 c0 95 00 90 40 '.PT!...........@'
  81 80 81 40 81 c0 e2 68 00 a0 a0 40 2e 60 30 20 '...@...h...@.`0 '
  36 00 2c 04 11 00 00 1a 00 00 00 fc 00 64 69 73 '6.,..........dis'
  70 6c 61 79 0a 20 20 20 20 20 00 00 00 ff 00 0a 'play.     ......'
  20 20 20 20 20 20 20 20 20 20 20 20 00 00 00 fd '            ....'
  00 3b 3e 1c 6e 1d 01 0a 20 20 20 20 20 20 01 5a '.;>.n...      .Z'
Checksum: 0x5a

----------------

Block 3, CTA-861 Extension Block:
  Revision: 3
  Underscans IT Video Formats by default
  Basic audio support
  Supports YCbCr 4:4:4
  Supports YCbCr 4:2:2
  Native detailed modes: 1
  Video Data Block:
    VIC  16:  1920x1080   60.000000 Hz  16:9     67.500 kHz    148.500000 MHz
    VIC   4:  1280x720    60.000000 Hz  16:9     45.000 kHz     74.250000 MHz
    VIC  16:  1920x1080   60.000000 Hz  16:9     67.500 kHz    148.500000 MHz
    VIC  15:  1440x480    59.940060 Hz  16:9     31.469 kHz     54.000000 MHz
    VIC  19:  1280x720    50.000000 Hz  16:9     37.500 kHz     74.250000 MHz
    VIC  16:  1920x1080   60.000000 Hz  16:9     67.500 kHz    148.500000 MHz
    VIC  73:  1920x1080   25.000000 Hz  64:27    28.125 kHz     74.250000 MHz
    VIC  69:  1280x720    60.000000 Hz  64:27    45.000 kHz     74.250000 MHz
    VIC  76:  1920x1080   60.000000 Hz  64:27    67.500 kHz    148.500000 MHz
  Audio Data Block:
    Linear PCM:
      Max channels: 2
      Supported sample rates (kHz): 48 44.1 32
      Supported sample sizes (bits): 24 20 16
  Speaker Allocation Data Block:
    FL/FR - Front Left/Right
  Vendor-Specific Data Block (HDMI), OUI 00-0C-03:
    Source physical address: 1.0.0.0
    DC_36bit
    DC_30bit
    DC_Y444
    Maximum TMDS clock: 340 MHz
  Vendor-Specific Data Block (HDMI Forum), OUI C4-5D-D8:
    Version: 1
    Maximum TMDS Character Rate: 340 MHz
    SCDC Present
    Supports 10-bits/component Deep Color 4:2:0 Pixel Encoding
  Vendor-Specific Data Block (AMD), OUI 00-00-1A:
    Version: 1
    Feature Caps: 0x09
    Minimum Refresh Rate: 40 Hz
    Maximum Refresh Rate: 60 Hz
    Flags 1.x: 0xe6 (MCCS)
  YCbCr 4:2:0 Capability Map Data Block:
    VIC  76:  1920x1080   60.000000 Hz  64:27    67.500 kHz    148.500000 MHz
    SVD Index 19 is out of range
  Colorimetry Data Block:
    BT2020YCC
    BT2020RGB
  Video Capability Data Block:
    YCbCr quantization: Selectable (via AVI YQ)
    RGB quantization: Selectable (via AVI Q)
    PT scan behavior: Supports both over- and underscan
    IT scan behavior: Supports both over- and underscan
    CE scan behavior: Supports both over- and underscan
  HDR Static Metadata Data Block:
    Electro optical transfer functions:
      Traditional gamma - SDR luminance range
      SMPTE ST2084
    Supported static metadata descriptors:
      Static metadata type 1
    Desired content max luminance: 89 (343.724 cd/m^2)
    Desired content max frame-average luminance: 89 (343.724 cd/m^2)
    Desired content min luminance: 73 (0.282 cd/m^2)
  Detailed Timing Descriptors:
    DTD 3:  2560x1600   59.971589 Hz  16:10    98.713 kHz    268.500000 MHz (300 mm x 260 mm)
                 Hfront   48 Hsync  32 Hback   80 Hpol P
                 Vfront    3 Vsync   6 Vback   37 Vpol N
Checksum: 0xe9  Unused space in Extension Block: 42 bytes

----------------

Warnings:

Block 0, Base EDID:
  Vendor & Product Identification: The serial number is one of the known dummy values, it should probably be set to 0.
  Detailed Timing Descriptor #1: Image size is 300x260 mm, but based on the picture AR it should be 300x187 mm.
Block 1, CTA-861 Extension Block:
  Video Data Block: VIC 16 and the first DTD are not identical. Is this intended?
  YCbCr 4:2:0 Capability Map Data Block: Some YCbCr 4:2:0 timings are invalid for HDMI 2.1 (which requires an RGB timings pixel rate >= 590 MHz).
  Video Capability Data Block: S_PT is equal to S_IT and S_CE, so should be set to 0 instead.
  Detailed Timing Descriptor #2: Image size is 300x260 mm, but based on the picture AR it should be 300x187 mm.
  Display Product Serial Number is set, so the Serial Number in the Base EDID should be 0.
Block 3, CTA-861 Extension Block:
  Video Capability Data Block: S_PT is equal to S_IT and S_CE, so should be set to 0 instead.
  Detailed Timing Descriptor #3: Image size is 300x260 mm, but based on the picture AR it should be 300x187 mm.
EDID:
  Base EDID: Some timings are out of range of the Monitor Ranges:
    Vertical Freq: 25.000 - 60.317 Hz (Monitor: 59.000 - 62.000 Hz)

Failures:

Block 0, Base EDID:
  Display Product Serial Number: ...
  Basic Display Parameters & Features: sRGB is signaled, but the chromaticities do not match.
  Display Range Limits: 'Range Limits Only' is not allowed for EDID < 1.4.
Block 1, CTA-861 Extension Block:
  Video Data Block: Duplicate VIC 16.
  Vendor-Specific Data Block (HDMI Forum), OUI C4-5D-D8: Max TMDS rate is > 0 and <= 340 or > 600.
  YCbCr 4:2:0 Capability Map Data Block: Max index 19 > 18 (#SVDs).
Block 2, Base EDID:
  Unknown Extension Block.
Block 3, CTA-861 Extension Block:
  Video Data Block: Duplicate VIC 4.
  Video Data Block: Duplicate VIC 15.
  Video Data Block: Duplicate VIC 19.
  Video Data Block: Duplicate VIC 73.
  Video Data Block: Duplicate VIC 69.
  Video Data Block: Duplicate VIC 76.
  Speaker Allocation Data Block: Only one instance of this Data Block is allowed.
  Vendor-Specific Data Block (HDMI Forum), OUI C4-5D-D8: Duplicate HDMI Forum VSDB/SCDB.
  Vendor-Specific Data Block (HDMI Forum), OUI C4-5D-D8: Max TMDS rate is > 0 and <= 340 or > 600.
  YCbCr 4:2:0 Capability Map Data Block: Only one instance of this Data Block is allowed.
  YCbCr 4:2:0 Capability Map Data Block: Max index 19 > 18 (#SVDs).
  Colorimetry Data Block: Only one instance of this Data Block is allowed.
  Video Capability Data Block: Only one instance of this Data Block is allowed.
  HDR Static Metadata Data Block: Only one instance of this Data Block is allowed.
EDID:
  Base EDID: EDID specified 1 extension block(s), but found 3 extension block(s).
  Base EDID: EDID 1.3 requires a Block Map Extension in Block 1 if there are more than 2 blocks in the EDID.

EDID conformity: FAIL
