edid-decode (hex):

00 ff ff ff ff ff ff 00 1a 6e 0c 30 01 01 01 01
04 16 01 03 ff 79 44 78 ea 61 1a a6 56 48 9c 24
13 49 4b af ef 80 31 4a a9 40 81 80 d1 c0 81 c0
01 01 01 01 01 01 02 3a 80 18 71 38 2d 40 58 2c
55 00 c0 6c 00 00 00 1c 41 3c 80 a0 70 b0 23 40
30 20 26 00 d3 3d 01 00 00 1a 00 00 00 fd 00 2d
50 19 50 11 00 0a 20 20 20 20 20 20 00 00 00 fc
00 46 53 2d 53 35 35 30 32 46 28 4c 29 0a 00 29

----------------

Block 0, Base EDID:
  EDID Structure Version & Revision: 1.3
  Vendor & Product Identification:
    Manufacturer: FSN
    Model: 12300
    Serial Number: ...
    Made in: week 4 of 2012
  Basic Display Parameters & Features:
    Digital display
    DFP 1.x compatible TMDS
    Maximum image size: 121 cm x 68 cm
    Gamma: 2.20
    DPMS levels: Standby Suspend Off
    RGB color display
    First detailed timing is the preferred timing
  Color Characteristics:
    Red  : 0.6494, 0.3378
    Green: 0.2812, 0.6103
    Blue : 0.1406, 0.0751
    White: 0.2871, 0.2949
  Established Timings I & II:
    IBM     :   720x400    70.081663 Hz   9:5     31.467 kHz     28.320000 MHz
    DMT 0x04:   640x480    59.940476 Hz   4:3     31.469 kHz     25.175000 MHz
    DMT 0x05:   640x480    72.808802 Hz   4:3     37.861 kHz     31.500000 MHz
    DMT 0x06:   640x480    75.000000 Hz   4:3     37.500 kHz     31.500000 MHz
    DMT 0x08:   800x600    56.250000 Hz   4:3     35.156 kHz     36.000000 MHz
    DMT 0x09:   800x600    60.316541 Hz   4:3     37.879 kHz     40.000000 MHz
    DMT 0x0a:   800x600    72.187572 Hz   4:3     48.077 kHz     50.000000 MHz
    DMT 0x0b:   800x600    75.000000 Hz   4:3     46.875 kHz     49.500000 MHz
    Apple   :   832x624    74.551266 Hz   4:3     49.726 kHz     57.284000 MHz
    DMT 0x10:  1024x768    60.003840 Hz   4:3     48.363 kHz     65.000000 MHz
    DMT 0x11:  1024x768    70.069359 Hz   4:3     56.476 kHz     75.000000 MHz
    DMT 0x12:  1024x768    75.028582 Hz   4:3     60.023 kHz     78.750000 MHz
    DMT 0x24:  1280x1024   75.024675 Hz   5:4     79.976 kHz    135.000000 MHz
    Apple   :  1152x870    75.061550 Hz 192:145   68.681 kHz    100.000000 MHz
  Standard Timings:
    GTF     :   640x480    70.000000 Hz   4:3     35.000 kHz     28.560000 MHz
    DMT 0x33:  1600x1200   60.000000 Hz   4:3     75.000 kHz    162.000000 MHz
    DMT 0x23:  1280x1024   60.019740 Hz   5:4     63.981 kHz    108.000000 MHz
    DMT 0x52:  1920x1080   60.000000 Hz  16:9     67.500 kHz    148.500000 MHz
    DMT 0x55:  1280x720    60.000000 Hz  16:9     45.000 kHz     74.250000 MHz
  Detailed Timing Descriptors:
    DTD 1:  1920x1080   60.000000 Hz  16:9     67.500 kHz    148.500000 MHz (192 mm x 108 mm)
                 Hfront   88 Hsync  44 Hback  148 Hpol N
                 Vfront    5 Vsync   5 Vback   35 Vpol P
    DTD 2:  1920x1200   60.047493 Hz  16:10    74.159 kHz    154.250000 MHz (211 mm x 317 mm)
                 Hfront   48 Hsync  32 Hback   80 Hpol P
                 Vfront    2 Vsync   6 Vback   27 Vpol N
    Display Range Limits:
      Monitor ranges (GTF): 45-80 Hz V, 25-80 kHz H, max dotclock 170 MHz
    Display Product Name: 'FS-S5502F(L)'
Checksum: 0x29

----------------

Warnings:

Block 0, Base EDID:
  Vendor & Product Identification: The serial number is one of the known dummy values, it should probably be set to 0.
  Detailed Timing Descriptor #1: DTD is similar but not identical to VIC 16.
  Detailed Timing Descriptor #2: Image size is 211x317 mm, but based on the picture AR it should be 211x131 mm.

Failures:

Block 0, Base EDID:
  Basic Display Parameters & Features: Digital Video Interface Standard set to reserved value 0x7e.
  Detailed Timing Descriptor #1: Mismatch of image size 192x108 mm vs display size 1210x680 mm.
  Detailed Timing Descriptor #2: Mismatch of image size 211x317 mm vs display size 1210x680 mm.

EDID conformity: FAIL
