edid-decode (hex):

00 ff ff ff ff ff ff 00 36 69 d4 30 00 00 00 00
24 22 01 03 80 36 1f 78 ea 42 bc a7 57 51 a0 26
0f 51 56 3f cf 00 d1 c0 b3 00 95 00 81 80 01 01
01 01 01 01 01 01 02 3a 80 18 71 38 2d 40 58 2c
45 00 1c 36 21 00 00 1e 00 00 00 fc 00 4d 53 49
20 4d 50 32 35 31 57 20 45 32 00 00 00 fd 00 30
78 34 89 1c 00 0a 20 20 20 20 20 20 00 00 00 ff
00 50 44 34 4d 30 31 34 39 30 30 39 33 30 01 96

02 03 35 f1 49 3f 01 02 03 04 12 13 90 11 23 09
07 07 83 01 00 00 68 03 0c 00 10 00 18 42 00 e2
00 7f e3 05 e3 01 e6 06 07 01 60 5f 3d 67 d8 5d
c4 01 42 00 00 48 4d 80 a0 70 38 27 40 30 20 35
00 1c 36 21 00 00 1a eb 5a 80 a0 70 38 27 40 30
20 35 00 1c 36 21 00 00 1a 01 6b 80 78 70 38 27
40 30 20 35 00 1c 36 21 00 00 1a 00 00 00 00 00
00 00 00 00 00 00 00 00 00 00 00 00 00 00 00 3d

00 ff ff ff ff ff ff 00 36 69 d4 30 00 00 00 00
24 22 01 03 80 36 1f 78 ea 42 bc a7 57 51 a0 26
0f 51 56 3f cf 00 d1 c0 b3 00 95 00 81 80 01 01
01 01 01 01 01 01 02 3a 80 18 71 38 2d 40 58 2c
45 00 1c 36 21 00 00 1e 00 00 00 fc 00 4d 53 49
20 4d 50 32 35 31 57 20 45 32 00 00 00 fd 00 30
78 34 89 1c 00 0a 20 20 20 20 20 20 00 00 00 ff
00 50 44 34 4d 30 31 34 39 30 30 39 33 30 01 96

02 03 35 f1 49 3f 01 02 03 04 12 13 90 11 23 09
07 07 83 01 00 00 68 03 0c 00 10 00 18 42 00 e2
00 7f e3 05 e3 01 e6 06 07 01 60 5f 3d 67 d8 5d
c4 01 42 00 00 48 4d 80 a0 70 38 27 40 30 20 35
00 1c 36 21 00 00 1a eb 5a 80 a0 70 38 27 40 30
20 35 00 1c 36 21 00 00 1a 01 6b 80 78 70 38 27
40 30 20 35 00 1c 36 21 00 00 1a 00 00 00 00 00
00 00 00 00 00 00 00 00 00 00 00 00 00 00 00 3d

----------------

Block 0, Base EDID:
  EDID Structure Version & Revision: 1.3
  Vendor & Product Identification:
    Manufacturer: MSI
    Model: 12500
    Made in: week 36 of 2024
  Basic Display Parameters & Features:
    Digital display
    Maximum image size: 54 cm x 31 cm
    Gamma: 2.20
    DPMS levels: Standby Suspend Off
    RGB color display
    First detailed timing is the preferred timing
  Color Characteristics:
    Red  : 0.6533, 0.3398
    Green: 0.3164, 0.6269
    Blue : 0.1503, 0.0615
    White: 0.3193, 0.3359
  Established Timings I & II:
    DMT 0x04:   640x480    59.940476 Hz   4:3     31.469 kHz     25.175000 MHz
    Apple   :   640x480    66.666667 Hz   4:3     35.000 kHz     30.240000 MHz
    DMT 0x05:   640x480    72.808802 Hz   4:3     37.861 kHz     31.500000 MHz
    DMT 0x06:   640x480    75.000000 Hz   4:3     37.500 kHz     31.500000 MHz
    DMT 0x08:   800x600    56.250000 Hz   4:3     35.156 kHz     36.000000 MHz
    DMT 0x09:   800x600    60.316541 Hz   4:3     37.879 kHz     40.000000 MHz
    DMT 0x0a:   800x600    72.187572 Hz   4:3     48.077 kHz     50.000000 MHz
    DMT 0x0b:   800x600    75.000000 Hz   4:3     46.875 kHz     49.500000 MHz
    DMT 0x10:  1024x768    60.003840 Hz   4:3     48.363 kHz     65.000000 MHz
    DMT 0x11:  1024x768    70.069359 Hz   4:3     56.476 kHz     75.000000 MHz
    DMT 0x12:  1024x768    75.028582 Hz   4:3     60.023 kHz     78.750000 MHz
    DMT 0x24:  1280x1024   75.024675 Hz   5:4     79.976 kHz    135.000000 MHz
  Standard Timings:
    DMT 0x52:  1920x1080   60.000000 Hz  16:9     67.500 kHz    148.500000 MHz
    DMT 0x3a:  1680x1050   59.954250 Hz  16:10    65.290 kHz    146.250000 MHz
    DMT 0x2f:  1440x900    59.887445 Hz  16:10    55.935 kHz    106.500000 MHz
    DMT 0x23:  1280x1024   60.019740 Hz   5:4     63.981 kHz    108.000000 MHz
  Detailed Timing Descriptors:
    DTD 1:  1920x1080   60.000000 Hz  16:9     67.500 kHz    148.500000 MHz (540 mm x 310 mm)
                 Hfront   88 Hsync  44 Hback  148 Hpol P
                 Vfront    4 Vsync   5 Vback   36 Vpol P
    Display Product Name: 'MSI MP251W E2'
    Display Range Limits:
      Monitor ranges (GTF): 48-120 Hz V, 52-137 kHz H, max dotclock 280 MHz
    Display Product Serial Number: ...
  Extension blocks: 1
Checksum: 0x96

----------------

Block 1, CTA-861 Extension Block:
  Revision: 3
  Underscans IT Video Formats by default
  Basic audio support
  Supports YCbCr 4:4:4
  Supports YCbCr 4:2:2
  Native DTDs: 1
  Video Data Block:
    VIC  63:  1920x1080  120.000000 Hz  16:9    135.000 kHz    297.000000 MHz
    VIC   1:   640x480    59.940476 Hz   4:3     31.469 kHz     25.175000 MHz
    VIC   2:   720x480    59.940060 Hz   4:3     31.469 kHz     27.000000 MHz
    VIC   3:   720x480    59.940060 Hz  16:9     31.469 kHz     27.000000 MHz
    VIC   4:  1280x720    60.000000 Hz  16:9     45.000 kHz     74.250000 MHz
    VIC  18:   720x576    50.000000 Hz  16:9     31.250 kHz     27.000000 MHz
    VIC  19:  1280x720    50.000000 Hz  16:9     37.500 kHz     74.250000 MHz
    VIC  16:  1920x1080   60.000000 Hz  16:9     67.500 kHz    148.500000 MHz (native)
    VIC  17:   720x576    50.000000 Hz   4:3     31.250 kHz     27.000000 MHz
  Audio Data Block:
    Linear PCM:
      Max channels: 2
      Supported sample rates (kHz): 48 44.1 32
      Supported sample sizes (bits): 24 20 16
  Speaker Allocation Data Block:
    FL/FR - Front Left/Right
  Vendor-Specific Data Block (HDMI), OUI 00-0C-03:
    Source physical address: 1.0.0.0
    DC_30bit
    DC_Y444
    Maximum TMDS clock: 330 MHz
  Video Capability Data Block:
    YCbCr quantization: No Data
    RGB quantization: Selectable (via AVI Q)
    PT scan behavior: Supports both over- and underscan
    IT scan behavior: Supports both over- and underscan
    CE scan behavior: Supports both over- and underscan
  Colorimetry Data Block:
    xvYCC601
    xvYCC709
    BT2020cYCC
    BT2020YCC
    BT2020RGB
    Gamut Boundary Description Metadata Profile P0
  HDR Static Metadata Data Block:
    Electro optical transfer functions:
      Traditional gamma - SDR luminance range
      Traditional gamma - HDR luminance range
      SMPTE ST2084
    Supported static metadata descriptors:
      Static metadata type 1
    Desired content max luminance: 96 (400.000 cd/m^2)
    Desired content max frame-average luminance: 95 (391.429 cd/m^2)
    Desired content min luminance: 61 (0.229 cd/m^2)
  Vendor-Specific Data Block (HDMI Forum), OUI C4-5D-D8:
    Version: 1
    Maximum TMDS Character Rate: 330 MHz
  Detailed Timing Descriptors:
    DTD 2:  1920x1080   85.000344 Hz  16:9     95.115 kHz    197.840000 MHz (540 mm x 310 mm)
                 Hfront   48 Hsync  32 Hback   80 Hpol P
                 Vfront    3 Vsync   5 Vback   31 Vpol N
    DTD 3:  1920x1080   99.999141 Hz  16:9    111.899 kHz    232.750000 MHz (540 mm x 310 mm)
                 Hfront   48 Hsync  32 Hback   80 Hpol P
                 Vfront    3 Vsync   5 Vback   31 Vpol N
    DTD 4:  1920x1080  119.999474 Hz  16:9    134.279 kHz    273.930000 MHz (540 mm x 310 mm)
                 Hfront   48 Hsync  32 Hback   40 Hpol P
                 Vfront    3 Vsync   5 Vback   31 Vpol N
Checksum: 0x3d  Unused space in Extension Block: 20 bytes

----------------

Warnings:

Block 1, CTA-861 Extension Block:
  Video Data Block: VIC 63 and the first DTD are not identical. Is this intended?
  Video Capability Data Block: Set Selectable YCbCr Quantization to avoid interop issues.
  Video Capability Data Block: S_PT is equal to S_IT and S_CE, so should be set to 0 instead.
  Colorimetry Data Block: Set the sRGB colorimetry bit to avoid interop issues.
EDID:
  Base EDID: Some timings are out of range of the Monitor Ranges:
    Horizontal Freq: 31.250 - 135.000 kHz (Monitor: 52.000 - 137.000 kHz)
    Maximum Clock: 297.000 MHz (Monitor: 280.000 MHz)

Failures:

Block 1, CTA-861 Extension Block:
  Vendor-Specific Data Block (HDMI Forum), OUI C4-5D-D8: HDMI Forum VSDB did not immediately follow the HDMI VSDB.
  Vendor-Specific Data Block (HDMI Forum), OUI C4-5D-D8: Max TMDS rate is > 0 and <= 340 or > 600.
EDID:
  Extension Block 2 started with EDID header, ignoring Extension Blocks >= 2.

EDID conformity: FAIL
