edid-decode (hex):

00 ff ff ff ff ff ff 00 22 f0 07 41 01 01 00 00
01 15 01 03 80 29 17 78 0a 6c d0 a5 55 4b 9a 24
11 50 54 00 00 00 01 01 01 01 01 01 01 01 01 01
01 01 01 01 01 01 b0 1d 56 c2 50 00 26 30 18 8c
23 00 9a e6 10 00 00 18 00 00 00 fe 00 43 43 46
4c 43 4d 49 4d 31 38 35 42 31 00 00 00 fc 00 43
6f 6d 70 61 71 20 43 51 2d 31 0a 20 00 00 00 fe
00 4d 31 38 35 42 31 2d 4c 30 37 20 20 20 00 ce

00 ff ff ff ff ff ff 00 22 f0 07 41 01 01 00 00
01 15 01 03 80 29 17 78 0a 6c d0 a5 55 4b 9a 24
11 50 54 00 00 00 01 01 01 01 01 01 01 01 01 01
01 01 01 01 01 01 b0 1d 56 c2 50 00 26 30 18 8c
23 00 9a e6 10 00 00 18 00 00 00 fe 00 43 43 46
4c 43 4d 49 4d 31 38 35 42 31 00 00 00 fc 00 43
6f 6d 70 61 71 20 43 51 2d 31 0a 20 00 00 00 fe
00 4d 31 38 35 42 31 2d 4c 30 37 20 20 20 00 ce

----------------

Block 0, Base EDID:
  EDID Structure Version & Revision: 1.3
  Vendor & Product Identification:
    Manufacturer: HWP
    Model: 16647
    Serial Number: ...
    Made in: week 1 of 2011
  Basic Display Parameters & Features:
    Digital display
    Maximum image size: 41 cm x 23 cm
    Gamma: 2.20
    RGB color display
    First detailed timing is the preferred timing
  Color Characteristics:
    Red  : 0.6455, 0.3339
    Green: 0.2958, 0.6015
    Blue : 0.1435, 0.0673
    White: 0.3125, 0.3281
  Established Timings I & II: none
  Standard Timings: none
  Detailed Timing Descriptors:
    DTD 1:  1366x768    60.444105 Hz 683:384   48.718 kHz     76.000000 MHz (410 mm x 230 mm)
                 Hfront   24 Hsync 140 Hback   30 Hpol N
                 Vfront    2 Vsync   3 Vback   33 Vpol N
    Alphanumeric Data String: 'CCFLCMIM185B1'
    Display Product Name: 'Compaq CQ-1'
    Alphanumeric Data String: 'M185B1-L07   '
Checksum: 0xce

----------------

Failures:

Block 0, Base EDID:
  Alphanumeric Data String: No newline, but one or more trailing spaces.
  Missing Display Range Limits Descriptor.
EDID:
  Extension Block 1 started with EDID header, ignoring Extension Blocks >= 1.

EDID conformity: FAIL
