edid-decode (hex):

00 ff ff ff ff ff ff 00 0e 6f 07 15 00 00 00 00
00 1f 01 04 a5 22 13 78 03 da 45 a4 54 4b 9b 26
0f 50 54 00 00 00 01 01 01 01 01 01 01 01 01 01
01 01 01 01 01 01 63 63 00 a0 a0 a0 77 50 30 20
35 00 58 c1 10 00 00 18 00 00 00 fd 0c 3c a5 02
02 46 01 0a 20 20 20 20 20 20 00 00 00 fe 00 43
53 4f 54 20 54 33 0a 20 20 20 20 20 00 00 00 fe
00 4d 4e 46 36 30 31 43 41 31 2d 31 0a 20 01 a0

70 13 79 00 00 03 01 14 50 11 01 85 ff 09 9f 00
2f 00 1f 00 9f 05 76 00 02 00 04 00 00 00 00 00
00 00 00 00 00 00 00 00 00 00 00 00 00 00 00 00
00 00 00 00 00 00 00 00 00 00 00 00 00 00 00 00
00 00 00 00 00 00 00 00 00 00 00 00 00 00 00 00
00 00 00 00 00 00 00 00 00 00 00 00 00 00 00 00
00 00 00 00 00 00 00 00 00 00 00 00 00 00 00 00
00 00 00 00 00 00 00 00 00 00 00 00 00 00 60 90

00 ff ff ff ff ff ff 00 0e 6f 07 15 00 00 00 00
00 1f 01 04 a5 22 13 78 03 da 45 a4 54 4b 9b 26
0f 50 54 00 00 00 01 01 01 01 01 01 01 01 01 01
01 01 01 01 01 01 63 63 00 a0 a0 a0 77 50 30 20
35 00 58 c1 10 00 00 18 00 00 00 fd 0c 3c a5 02
02 46 01 0a 20 20 20 20 20 20 00 00 00 fe 00 43
53 4f 54 20 54 33 0a 20 20 20 20 20 00 00 00 fe
00 4d 4e 46 36 30 31 43 41 31 2d 31 0a 20 01 a0

70 13 79 00 00 03 01 14 50 11 01 85 ff 09 9f 00
2f 00 1f 00 9f 05 76 00 02 00 04 00 00 00 00 00
00 00 00 00 00 00 00 00 00 00 00 00 00 00 00 00
00 00 00 00 00 00 00 00 00 00 00 00 00 00 00 00
00 00 00 00 00 00 00 00 00 00 00 00 00 00 00 00
00 00 00 00 00 00 00 00 00 00 00 00 00 00 00 00
00 00 00 00 00 00 00 00 00 00 00 00 00 00 00 00
00 00 00 00 00 00 00 00 00 00 00 00 00 00 60 90

----------------

Block 0, Base EDID:
  EDID Structure Version & Revision: 1.4
  Vendor & Product Identification:
    Manufacturer: CSO
    Model: 5383
    Made in: 2021
  Basic Display Parameters & Features:
    Digital display
    Bits per primary color channel: 8
    DisplayPort interface
    Maximum image size: 34 cm x 19 cm
    Gamma: 2.20
    Supported color formats: RGB 4:4:4
    First detailed timing includes the native pixel format and preferred refresh rate
    Display supports continuous frequencies
  Color Characteristics:
    Red  : 0.6435, 0.3291
    Green: 0.2949, 0.6074
    Blue : 0.1494, 0.0585
    White: 0.3134, 0.3291
  Established Timings I & II: none
  Standard Timings: none
  Detailed Timing Descriptors:
    DTD 1:  2560x1440   60.000283 Hz  16:9     93.540 kHz    254.430000 MHz (344 mm x 193 mm)
                 Hfront   48 Hsync  32 Hback   80 Hpol N
                 Vfront    3 Vsync   5 Vback  111 Vpol N
    Display Range Limits:
      Monitor ranges (Range Limits Only): 60-165 Hz V, 257-257 kHz H, max dotclock 700 MHz
    Alphanumeric Data String: 'CSOT T3'
    Alphanumeric Data String: 'MNF601CA1-1'
  Extension blocks: 1
Checksum: 0xa0

----------------

Block 1, DisplayID Extension Block:
  Version: 1.3
  Extension Count: 0
  Display Product Type: Extension Section
  Video Timing Modes Type 1 - Detailed Timings Data Block:
    DTD:  2560x1440  165.002547 Hz  16:10   257.239 kHz    699.690000 MHz (aspect 16:10, no 3D stereo, preferred)
               Hfront   48 Hsync  32 Hback   80 Hpol N
               Vfront    3 Vsync   5 Vback  111 Vpol N
  Checksum: 0x60
Checksum: 0x90

----------------

Warnings:

Block 0, Base EDID:
  Missing Display Product Name.
EDID:
  Base EDID: Some timings are out of range of the Monitor Ranges:
    Horizontal Freq: 93.540 - 257.238 kHz (Monitor: 257.000 - 257.000 kHz)

Failures:

Block 1, DisplayID Extension Block:
  DisplayID Base Block has no product type.
EDID:
  Extension Block 2 started with EDID header, ignoring Extension Blocks >= 2.

EDID conformity: FAIL
