edid-decode (hex):

00 ff ff ff ff ff ff 00 5a 63 3e bb 01 01 01 01
15 22 01 03 80 3c 21 78 2a eb fa ad 51 45 a6 22
0e 4f 55 af ef 80 31 40 45 40 61 40 81 c0 81 80
95 00 b3 00 a9 c0 56 5e 00 a0 a0 a0 29 50 30 20
35 00 55 50 21 00 00 1e 00 00 00 ff 00 58 36 45
32 34 32 31 38 30 31 32 39 0a 00 00 00 fd 00 30
90 1f d7 3e 00 0a 20 20 20 20 20 20 00 00 00 fc
00 56 58 32 37 38 31 2d 32 4b 2d 50 52 4f 01 29

02 03 48 f1 4c 90 6b 04 13 03 12 01 40 3f 1f 02
05 23 09 07 07 83 01 00 00 67 03 0c 00 10 00 38
7c 6d 1a 00 00 02 01 30 90 e6 00 00 00 00 00 67
d8 5d c4 01 7c 80 00 e3 05 c2 00 e6 06 05 01 62
62 4a e2 00 e7 e2 0f 02 70 c2 00 a0 a0 a0 55 50
30 20 35 00 55 50 21 00 00 1e 97 e2 00 a0 a0 a0
29 50 3c 38 35 00 55 50 21 00 00 1e d0 d3 00 e0
a3 a0 57 50 d8 18 35 10 00 00 00 00 00 1e 00 7f

00 ff ff ff ff ff ff 00 5a 63 3e bb 01 01 01 01
15 22 01 03 80 3c 21 78 2a eb fa ad 51 45 a6 22
0e 4f 55 af ef 80 31 40 45 40 61 40 81 c0 81 80
95 00 b3 00 a9 c0 56 5e 00 a0 a0 a0 29 50 30 20
35 00 55 50 21 00 00 1e 00 00 00 ff 00 58 36 45
32 34 32 31 38 30 31 32 39 0a 00 00 00 fd 00 30
90 1f d7 3e 00 0a 20 20 20 20 20 20 00 00 00 fc
00 56 58 32 37 38 31 2d 32 4b 2d 50 52 4f 01 29

02 03 48 f1 4c 90 6b 04 13 03 12 01 40 3f 1f 02
05 23 09 07 07 83 01 00 00 67 03 0c 00 10 00 38
7c 6d 1a 00 00 02 01 30 90 e6 00 00 00 00 00 67
d8 5d c4 01 7c 80 00 e3 05 c2 00 e6 06 05 01 62
62 4a e2 00 e7 e2 0f 02 70 c2 00 a0 a0 a0 55 50
30 20 35 00 55 50 21 00 00 1e 97 e2 00 a0 a0 a0
29 50 3c 38 35 00 55 50 21 00 00 1e d0 d3 00 e0
a3 a0 57 50 d8 18 35 10 00 00 00 00 00 1e 00 7f

----------------

Block 0, Base EDID:
  EDID Structure Version & Revision: 1.3
  Vendor & Product Identification:
    Manufacturer: VSC
    Model: 47934
    Serial Number: ...
    Made in: week 21 of 2024
  Basic Display Parameters & Features:
    Digital display
    Maximum image size: 60 cm x 33 cm
    Gamma: 2.20
    DPMS levels: Off
    RGB color display
    First detailed timing is the preferred timing
  Color Characteristics:
    Red  : 0.6787, 0.3183
    Green: 0.2714, 0.6513
    Blue : 0.1357, 0.0576
    White: 0.3105, 0.3339
  Established Timings I & II:
    IBM     :   720x400    70.081663 Hz   9:5     31.467 kHz     28.320000 MHz
    DMT 0x04:   640x480    59.940476 Hz   4:3     31.469 kHz     25.175000 MHz
    DMT 0x05:   640x480    72.808802 Hz   4:3     37.861 kHz     31.500000 MHz
    DMT 0x06:   640x480    75.000000 Hz   4:3     37.500 kHz     31.500000 MHz
    DMT 0x08:   800x600    56.250000 Hz   4:3     35.156 kHz     36.000000 MHz
    DMT 0x09:   800x600    60.316541 Hz   4:3     37.879 kHz     40.000000 MHz
    DMT 0x0a:   800x600    72.187572 Hz   4:3     48.077 kHz     50.000000 MHz
    DMT 0x0b:   800x600    75.000000 Hz   4:3     46.875 kHz     49.500000 MHz
    Apple   :   832x624    74.551266 Hz   4:3     49.726 kHz     57.284000 MHz
    DMT 0x10:  1024x768    60.003840 Hz   4:3     48.363 kHz     65.000000 MHz
    DMT 0x11:  1024x768    70.069359 Hz   4:3     56.476 kHz     75.000000 MHz
    DMT 0x12:  1024x768    75.028582 Hz   4:3     60.023 kHz     78.750000 MHz
    DMT 0x24:  1280x1024   75.024675 Hz   5:4     79.976 kHz    135.000000 MHz
    Apple   :  1152x870    75.061550 Hz 192:145   68.681 kHz    100.000000 MHz
  Standard Timings:
    DMT 0x04:   640x480    59.940476 Hz   4:3     31.469 kHz     25.175000 MHz
    DMT 0x09:   800x600    60.316541 Hz   4:3     37.879 kHz     40.000000 MHz
    DMT 0x10:  1024x768    60.003840 Hz   4:3     48.363 kHz     65.000000 MHz
    DMT 0x55:  1280x720    60.000000 Hz  16:9     45.000 kHz     74.250000 MHz
    DMT 0x23:  1280x1024   60.019740 Hz   5:4     63.981 kHz    108.000000 MHz
    DMT 0x2f:  1440x900    59.887445 Hz  16:10    55.935 kHz    106.500000 MHz
    DMT 0x3a:  1680x1050   59.954250 Hz  16:10    65.290 kHz    146.250000 MHz
    DMT 0x53:  1600x900    60.000000 Hz  16:9     60.000 kHz    108.000000 MHz (RB)
  Detailed Timing Descriptors:
    DTD 1:  2560x1440   59.950550 Hz  16:9     88.787 kHz    241.500000 MHz (597 mm x 336 mm)
                 Hfront   48 Hsync  32 Hback   80 Hpol P
                 Vfront    3 Vsync   5 Vback   33 Vpol P
    Display Product Serial Number: ...
    Display Range Limits:
      Monitor ranges (GTF): 48-144 Hz V, 31-215 kHz H, max dotclock 620 MHz
    Display Product Name: 'VX2781-2K-PRO'
  Extension blocks: 1
Checksum: 0x29

----------------

Block 1, CTA-861 Extension Block:
  Revision: 3
  Underscans IT Video Formats by default
  Basic audio support
  Supports YCbCr 4:4:4
  Supports YCbCr 4:2:2
  Native DTDs: 1
  Video Data Block:
    VIC  16:  1920x1080   60.000000 Hz  16:9     67.500 kHz    148.500000 MHz (native)
    VIC 107:  3840x2160   60.000000 Hz  64:27   135.000 kHz    594.000000 MHz
    VIC   4:  1280x720    60.000000 Hz  16:9     45.000 kHz     74.250000 MHz
    VIC  19:  1280x720    50.000000 Hz  16:9     37.500 kHz     74.250000 MHz
    VIC   3:   720x480    59.940060 Hz  16:9     31.469 kHz     27.000000 MHz
    VIC  18:   720x576    50.000000 Hz  16:9     31.250 kHz     27.000000 MHz
    VIC   1:   640x480    59.940476 Hz   4:3     31.469 kHz     25.175000 MHz
    VIC  64:  1920x1080  100.000000 Hz  16:9    112.500 kHz    297.000000 MHz
    VIC  63:  1920x1080  120.000000 Hz  16:9    135.000 kHz    297.000000 MHz
    VIC  31:  1920x1080   50.000000 Hz  16:9     56.250 kHz    148.500000 MHz
    VIC   2:   720x480    59.940060 Hz   4:3     31.469 kHz     27.000000 MHz
    VIC   5:  1920x1080i  60.000000 Hz  16:9     33.750 kHz     74.250000 MHz
  Audio Data Block:
    Linear PCM:
      Max channels: 2
      Supported sample rates (kHz): 48 44.1 32
      Supported sample sizes (bits): 24 20 16
  Speaker Allocation Data Block:
    FL/FR - Front Left/Right
  Vendor-Specific Data Block (HDMI), OUI 00-0C-03:
    Source physical address: 1.0.0.0
    DC_36bit
    DC_30bit
    DC_Y444
    Maximum TMDS clock: 620 MHz
  Vendor-Specific Data Block (AMD), OUI 00-00-1A:
    Version: 2
    Feature Caps: 0x01
    Minimum Refresh Rate: 48 Hz
    Maximum Refresh Rate: 144 Hz
    Flags 1.x: 0xe6 (MCCS)
    Flags 2.x: 0x00
  Vendor-Specific Data Block (HDMI Forum), OUI C4-5D-D8:
    Version: 1
    Maximum TMDS Character Rate: 620 MHz
    SCDC Present
  Colorimetry Data Block:
    xvYCC709
    BT2020YCC
    BT2020RGB
  HDR Static Metadata Data Block:
    Electro optical transfer functions:
      Traditional gamma - SDR luminance range
      SMPTE ST2084
    Supported static metadata descriptors:
      Static metadata type 1
    Desired content max luminance: 98 (417.710 cd/m^2)
    Desired content max frame-average luminance: 98 (417.710 cd/m^2)
    Desired content min luminance: 74 (0.352 cd/m^2)
  Video Capability Data Block:
    YCbCr quantization: Selectable (via AVI YQ)
    RGB quantization: Selectable (via AVI Q)
    PT scan behavior: Always Underscanned
    IT scan behavior: Always Overscanned
    CE scan behavior: Supports both over- and underscan
  YCbCr 4:2:0 Capability Map Data Block:
    VIC 107:  3840x2160   60.000000 Hz  64:27   135.000 kHz    594.000000 MHz
  Detailed Timing Descriptors:
    DTD 2:  2560x1440  120.000000 Hz  16:9    183.000 kHz    497.760000 MHz (597 mm x 336 mm)
                 Hfront   48 Hsync  32 Hback   80 Hpol P
                 Vfront    3 Vsync   5 Vback   77 Vpol P
    DTD 3:  2560x1440  143.997994 Hz  16:9    213.261 kHz    580.070000 MHz (597 mm x 336 mm)
                 Hfront   60 Hsync  56 Hback   44 Hpol P
                 Vfront    3 Vsync   5 Vback   33 Vpol P
    DTD 4:  2560x1440   99.972271 Hz  16:9    152.658 kHz    542.240000 MHz
                 Hfront  216 Hsync 280 Hback  496 Hpol P
                 Vfront    3 Vsync   5 Vback   79 Vpol P
Checksum: 0x7f  Unused space in Extension Block: 1 byte

----------------

Warnings:

Block 0, Base EDID:
  Vendor & Product Identification: The serial number is one of the known dummy values, it should probably be set to 0.
Block 1, CTA-861 Extension Block:
  Video Data Block: VIC 16 and the first DTD are not identical. Is this intended?
  Colorimetry Data Block: Set the sRGB colorimetry bit to avoid interop issues.
  Video Capability Data Block: IT scan behavior is expected to support underscanned.
  Display Product Serial Number is set, so the Serial Number in the Base EDID should be 0.

Failures:

Block 1, CTA-861 Extension Block:
  Vendor-Specific Data Block (HDMI), OUI 00-0C-03: HDMI VSDB Max TMDS rate is > 340.
  Vendor-Specific Data Block (HDMI Forum), OUI C4-5D-D8: HDMI Forum VSDB did not immediately follow the HDMI VSDB.
  Vendor-Specific Data Block (HDMI Forum), OUI C4-5D-D8: Max TMDS rate is > 0 and <= 340 or > 600.
  Video Capability Data Block: IT video formats are always overscanned, but bit 7 of Byte 3 of the CTA-861 Extension header is set to underscanned.
  Detailed Timing Descriptor #4: Mismatch of image size vs display size: image size is not set, but display size is.
EDID:
  Extension Block 2 started with EDID header, ignoring Extension Blocks >= 2.
  CTA-861: Native progressive timings are a mix of several resolutions.

EDID conformity: FAIL
