edid-decode (hex):

00 ff ff ff ff ff ff 00 41 0c 00 00 01 01 01 01
04 18 01 03 80 40 24 78 0a f9 ab a2 55 4a 9a 25
0f 47 4a 21 08 00 81 80 01 01 01 01 01 01 01 01
01 01 01 01 01 01 02 3a 80 18 71 38 2d 40 58 2c
45 00 80 68 21 00 00 1e 1b 21 50 a0 51 00 1e 30
48 88 35 00 80 68 21 00 00 18 00 00 00 fc 00 50
48 49 4c 49 50 53 20 46 54 56 0a 20 00 00 00 fd
00 38 4c 1e 53 11 00 0a 20 20 20 20 20 20 01 cb

02 03 39 71 4d 9f 10 20 21 14 05 13 04 11 02 15
06 01 29 09 07 03 15 07 50 3d 07 c0 83 01 00 00
78 03 0c 00 10 00 b8 2d 20 c8 0e 01 41 00 fc 20
30 60 70 28 10 38 10 68 10 02 3a 80 d0 72 38 2d
40 10 2c 45 80 80 68 21 00 00 1a 01 1d 80 3e 73
38 2d 40 7e 2c 45 80 80 68 21 00 00 1e 01 1d 80
d0 72 1c 16 20 10 2c 25 80 80 68 21 00 00 9e 00
00 00 00 00 00 00 00 00 00 00 00 00 00 00 00 b2

----------------

Block 0, Base EDID:
  EDID Structure Version & Revision: 1.3
  Vendor & Product Identification:
    Manufacturer: PHL
    Model: 0
    Serial Number: ...
    Made in: week 4 of 2014
  Basic Display Parameters & Features:
    Digital display
    Maximum image size: 64 cm x 36 cm
    Gamma: 2.20
    RGB color display
    First detailed timing is the preferred timing
  Color Characteristics:
    Red  : 0.6357, 0.3349
    Green: 0.2910, 0.6025
    Blue : 0.1464, 0.0605
    White: 0.2792, 0.2919
  Established Timings I & II:
    DMT 0x04:   640x480    59.940476 Hz   4:3     31.469 kHz     25.175000 MHz
    DMT 0x09:   800x600    60.316541 Hz   4:3     37.879 kHz     40.000000 MHz
    DMT 0x10:  1024x768    60.003840 Hz   4:3     48.363 kHz     65.000000 MHz
  Standard Timings:
    DMT 0x23:  1280x1024   60.019740 Hz   5:4     63.981 kHz    108.000000 MHz
  Detailed Timing Descriptors:
    DTD 1:  1920x1080   60.000000 Hz  16:9     67.500 kHz    148.500000 MHz (640 mm x 360 mm)
                 Hfront   88 Hsync  44 Hback  148 Hpol P
                 Vfront    4 Vsync   5 Vback   36 Vpol P
    DTD 2:  1360x768    59.798991 Hz  85:48    47.720 kHz     84.750000 MHz (640 mm x 360 mm)
                 Hfront   72 Hsync 136 Hback  208 Hpol N
                 Vfront    3 Vsync   5 Vback   22 Vpol N
    Display Product Name: 'PHILIPS FTV'
    Display Range Limits:
      Monitor ranges (GTF): 56-76 Hz V, 30-83 kHz H, max dotclock 170 MHz
  Extension blocks: 1
Checksum: 0xcb

----------------

Block 1, CTA-861 Extension Block:
  Revision: 3
  Basic audio support
  Supports YCbCr 4:4:4
  Supports YCbCr 4:2:2
  Native DTDs: 1
  Video Data Block:
    VIC  31:  1920x1080   50.000000 Hz  16:9     56.250 kHz    148.500000 MHz (native)
    VIC  16:  1920x1080   60.000000 Hz  16:9     67.500 kHz    148.500000 MHz
    VIC  32:  1920x1080   24.000000 Hz  16:9     27.000 kHz     74.250000 MHz
    VIC  33:  1920x1080   25.000000 Hz  16:9     28.125 kHz     74.250000 MHz
    VIC  20:  1920x1080i  50.000000 Hz  16:9     28.125 kHz     74.250000 MHz
    VIC   5:  1920x1080i  60.000000 Hz  16:9     33.750 kHz     74.250000 MHz
    VIC  19:  1280x720    50.000000 Hz  16:9     37.500 kHz     74.250000 MHz
    VIC   4:  1280x720    60.000000 Hz  16:9     45.000 kHz     74.250000 MHz
    VIC  17:   720x576    50.000000 Hz   4:3     31.250 kHz     27.000000 MHz
    VIC   2:   720x480    59.940060 Hz   4:3     31.469 kHz     27.000000 MHz
    VIC  21:  1440x576i   50.000000 Hz   4:3     15.625 kHz     27.000000 MHz
    VIC   6:  1440x480i   59.940060 Hz   4:3     15.734 kHz     27.000000 MHz
    VIC   1:   640x480    59.940476 Hz   4:3     31.469 kHz     25.175000 MHz
  Audio Data Block:
    Linear PCM:
      Max channels: 2
      Supported sample rates (kHz): 48 44.1 32
      Supported sample sizes (bits): 20 16
    AC-3:
      Max channels: 6
      Supported sample rates (kHz): 48 44.1 32
      Maximum bit rate: 640 kb/s
    DTS:
      Max channels: 6
      Supported sample rates (kHz): 48 44.1 32
      Maximum bit rate: 1536 kb/s
  Speaker Allocation Data Block:
    FL/FR - Front Left/Right
  Vendor-Specific Data Block (HDMI), OUI 00-0C-03:
    Source physical address: 1.0.0.0
    Supports_AI
    DC_36bit
    DC_30bit
    DC_Y444
    Maximum TMDS clock: 225 MHz
    Extended HDMI video details:
      3D present
      3D-capable-VIC mask present
      Base EDID image size indicates aspect ratio
      3D: Side-by-side (half, horizontal)
      3D: Top-and-bottom
      3D: Frame-packing
      3D VIC indices that support these capabilities:
        VIC  32:  1920x1080   24.000000 Hz  16:9     27.000 kHz     74.250000 MHz
        VIC  33:  1920x1080   25.000000 Hz  16:9     28.125 kHz     74.250000 MHz
        VIC  20:  1920x1080i  50.000000 Hz  16:9     28.125 kHz     74.250000 MHz
        VIC   5:  1920x1080i  60.000000 Hz  16:9     33.750 kHz     74.250000 MHz
        VIC  19:  1280x720    50.000000 Hz  16:9     37.500 kHz     74.250000 MHz
        VIC   4:  1280x720    60.000000 Hz  16:9     45.000 kHz     74.250000 MHz
      3D VIC indices with specific capabilities:
        VIC  32:  1920x1080   24.000000 Hz  16:9     27.000 kHz     74.250000 MHz (frame packing)
        VIC  33:  1920x1080   25.000000 Hz  16:9     28.125 kHz     74.250000 MHz (frame packing)
        VIC  19:  1280x720    50.000000 Hz  16:9     37.500 kHz     74.250000 MHz (frame packing)
        VIC   4:  1280x720    60.000000 Hz  16:9     45.000 kHz     74.250000 MHz (frame packing)
        VIC  32:  1920x1080   24.000000 Hz  16:9     27.000 kHz     74.250000 MHz (side-by-side, horizontal)
        VIC  33:  1920x1080   25.000000 Hz  16:9     28.125 kHz     74.250000 MHz (side-by-side, horizontal)
        VIC  19:  1280x720    50.000000 Hz  16:9     37.500 kHz     74.250000 MHz (side-by-side, horizontal)
  Detailed Timing Descriptors:
    DTD 3:  1920x1080   50.000000 Hz  16:9     56.250 kHz    148.500000 MHz (640 mm x 360 mm)
                 Hfront  528 Hsync  44 Hback  148 Hpol P
                 Vfront    4 Vsync   5 Vback   36 Vpol N
    DTD 4:  1920x1080   24.000000 Hz  16:9     27.000 kHz     74.250000 MHz (640 mm x 360 mm)
                 Hfront  638 Hsync  44 Hback  148 Hpol P
                 Vfront    4 Vsync   5 Vback   36 Vpol P
    DTD 5:  1920x1080i  50.000000 Hz  16:9     28.125 kHz     74.250000 MHz (640 mm x 360 mm)
                 Hfront  528 Hsync  44 Hback  148 Hpol P
                 Vfront    2 Vsync   5 Vback   15 Vpol P Vfront +0.5 Odd Field
                 Vfront    2 Vsync   5 Vback   15 Vpol P Vback  +0.5 Even Field
Checksum: 0xb2  Unused space in Extension Block: 16 bytes

----------------

Warnings:

Block 0, Base EDID:
  Vendor & Product Identification: The serial number is one of the known dummy values, it should probably be set to 0.
Block 1, CTA-861 Extension Block:
  IT Video Formats are overscanned by default, but normally this should be underscanned.
  Video Data Block: VIC 31 and the first DTD are not identical. Is this intended?
  Vendor-Specific Data Block (HDMI), OUI 00-0C-03: 'Indicates Aspect Ratio' is used for a small display (<= 255 cm), it is better to fill in the actual size
  Detailed Timing Descriptor #3: DTD is similar but not identical to VIC 31.
  Add a Colorimetry Data Block with the sRGB colorimetry bit set to avoid interop issues.
EDID:
  Base EDID: Some timings are out of range of the Monitor Ranges:
    Vertical Freq: 24.000 - 60.317 Hz (Monitor: 56.000 - 76.000 Hz)
    Horizontal Freq: 15.625 - 67.500 kHz (Monitor: 30.000 - 83.000 kHz)

Failures:

Block 1, CTA-861 Extension Block:
  Missing VCDB, needed for Set Selectable RGB Quantization to avoid interop issues.

EDID conformity: FAIL
