edid-decode (hex):

00 ff ff ff ff ff ff 00 36 89 1a 1b 08 08 23 20
00 21 01 03 81 00 00 78 ee bf c0 a3 53 35 b5 25
0f 50 54 2f cf 00 d1 c0 a9 c0 81 c0 61 40 45 40
45 40 01 01 01 01 72 e7 00 a0 f0 60 45 90 30 20
35 00 61 63 21 00 00 1a 3e d0 00 a0 f0 70 3e 80
30 20 35 00 61 63 21 00 00 1a 35 e3 00 a0 a0 40
2d 60 30 20 36 00 4a dc 10 00 00 1a 00 00 00 fd
00 30 a5 1e d7 41 00 0a 20 20 20 20 20 20 01 d4

02 03 38 f1 23 09 07 07 4d 10 04 03 01 1f 13 12
3f 3f 5e 5f 60 61 67 03 0c 00 20 00 b8 82 67 d8
5d c4 01 82 80 03 e3 0f 00 18 e2 00 6a e3 05 c0
00 e6 06 05 01 61 61 4f 6f c2 00 a0 a0 a0 55 50
30 20 35 00 b9 88 21 00 00 1a 50 e9 00 a0 a0 a0
55 50 30 20 35 00 58 4a 21 00 00 1a 37 d1 00 a0
a0 40 29 60 30 20 35 00 58 4a 21 00 00 1a 00 00
00 00 00 00 00 00 00 00 00 00 00 00 00 00 00 72

00 ff ff ff ff ff ff 00 36 89 1a 1b 08 08 23 20
00 21 01 03 81 00 00 78 ee bf c0 a3 53 35 b5 25
0f 50 54 2f cf 00 d1 c0 a9 c0 81 c0 61 40 45 40
45 40 01 01 01 01 72 e7 00 a0 f0 60 45 90 30 20
35 00 61 63 21 00 00 1a 3e d0 00 a0 f0 70 3e 80
30 20 35 00 61 63 21 00 00 1a 35 e3 00 a0 a0 40
2d 60 30 20 36 00 4a dc 10 00 00 1a 00 00 00 fd
00 30 a5 1e d7 41 00 0a 20 20 20 20 20 20 01 d4

02 03 38 f1 23 09 07 07 4d 10 04 03 01 1f 13 12
3f 3f 5e 5f 60 61 67 03 0c 00 20 00 b8 82 67 d8
5d c4 01 82 80 03 e3 0f 00 18 e2 00 6a e3 05 c0
00 e6 06 05 01 61 61 4f 6f c2 00 a0 a0 a0 55 50
30 20 35 00 b9 88 21 00 00 1a 50 e9 00 a0 a0 a0
55 50 30 20 35 00 58 4a 21 00 00 1a 37 d1 00 a0
a0 40 29 60 30 20 35 00 58 4a 21 00 00 1a 00 00
00 00 00 00 00 00 00 00 00 00 00 00 00 00 00 72

----------------

Block 0, Base EDID:
  EDID Structure Version & Revision: 1.3
  Vendor & Product Identification:
    Manufacturer: MTI
    Model: 6938
    Serial Number: ...
    Made in: 2023
  Basic Display Parameters & Features:
    Digital display
    DFP 1.x compatible TMDS
    Image size is variable
    Gamma: 2.20
    DPMS levels: Standby Suspend Off
    RGB color display
    Default (sRGB) color space is primary color space
    First detailed timing is the preferred timing
  Color Characteristics:
    Red  : 0.6386, 0.3271
    Green: 0.2099, 0.7099
    Blue : 0.1474, 0.0585
    White: 0.3125, 0.3281
  Established Timings I & II:
    DMT 0x04:   640x480    59.940476 Hz   4:3     31.469 kHz     25.175000 MHz
    DMT 0x05:   640x480    72.808802 Hz   4:3     37.861 kHz     31.500000 MHz
    DMT 0x06:   640x480    75.000000 Hz   4:3     37.500 kHz     31.500000 MHz
    DMT 0x08:   800x600    56.250000 Hz   4:3     35.156 kHz     36.000000 MHz
    DMT 0x09:   800x600    60.316541 Hz   4:3     37.879 kHz     40.000000 MHz
    DMT 0x0a:   800x600    72.187572 Hz   4:3     48.077 kHz     50.000000 MHz
    DMT 0x0b:   800x600    75.000000 Hz   4:3     46.875 kHz     49.500000 MHz
    DMT 0x10:  1024x768    60.003840 Hz   4:3     48.363 kHz     65.000000 MHz
    DMT 0x11:  1024x768    70.069359 Hz   4:3     56.476 kHz     75.000000 MHz
    DMT 0x12:  1024x768    75.028582 Hz   4:3     60.023 kHz     78.750000 MHz
    DMT 0x24:  1280x1024   75.024675 Hz   5:4     79.976 kHz    135.000000 MHz
  Standard Timings:
    DMT 0x52:  1920x1080   60.000000 Hz  16:9     67.500 kHz    148.500000 MHz
    DMT 0x53:  1600x900    60.000000 Hz  16:9     60.000 kHz    108.000000 MHz (RB)
    DMT 0x55:  1280x720    60.000000 Hz  16:9     45.000 kHz     74.250000 MHz
    DMT 0x10:  1024x768    60.003840 Hz   4:3     48.363 kHz     65.000000 MHz
    DMT 0x09:   800x600    60.316541 Hz   4:3     37.879 kHz     40.000000 MHz
    DMT 0x09:   800x600    60.316541 Hz   4:3     37.879 kHz     40.000000 MHz
  Detailed Timing Descriptors:
    DTD 1:  3840x2400   59.993925 Hz  16:10   148.125 kHz    592.500000 MHz (609 mm x 355 mm)
                 Hfront   48 Hsync  32 Hback   80 Hpol P
                 Vfront    3 Vsync   5 Vback   61 Vpol N
    DTD 2:  3840x2160   59.979748 Hz  16:9    133.275 kHz    533.100000 MHz (609 mm x 355 mm)
                 Hfront   48 Hsync  32 Hback   80 Hpol P
                 Vfront    3 Vsync   5 Vback   54 Vpol N
    DTD 3:  2560x1600  129.995083 Hz  16:10   213.842 kHz    581.650000 MHz (330 mm x 220 mm)
                 Hfront   48 Hsync  32 Hback   80 Hpol P
                 Vfront    3 Vsync   6 Vback   36 Vpol N
    Display Range Limits:
      Monitor ranges (GTF): 48-165 Hz V, 30-215 kHz H, max dotclock 650 MHz
  Extension blocks: 1
Checksum: 0xd4

----------------

Block 1, CTA-861 Extension Block:
  Revision: 3
  Underscans IT Video Formats by default
  Basic audio support
  Supports YCbCr 4:4:4
  Supports YCbCr 4:2:2
  Native DTDs: 1
  Audio Data Block:
    Linear PCM:
      Max channels: 2
      Supported sample rates (kHz): 48 44.1 32
      Supported sample sizes (bits): 24 20 16
  Video Data Block:
    VIC  16:  1920x1080   60.000000 Hz  16:9     67.500 kHz    148.500000 MHz
    VIC   4:  1280x720    60.000000 Hz  16:9     45.000 kHz     74.250000 MHz
    VIC   3:   720x480    59.940060 Hz  16:9     31.469 kHz     27.000000 MHz
    VIC   1:   640x480    59.940476 Hz   4:3     31.469 kHz     25.175000 MHz
    VIC  31:  1920x1080   50.000000 Hz  16:9     56.250 kHz    148.500000 MHz
    VIC  19:  1280x720    50.000000 Hz  16:9     37.500 kHz     74.250000 MHz
    VIC  18:   720x576    50.000000 Hz  16:9     31.250 kHz     27.000000 MHz
    VIC  63:  1920x1080  120.000000 Hz  16:9    135.000 kHz    297.000000 MHz
    VIC  63:  1920x1080  120.000000 Hz  16:9    135.000 kHz    297.000000 MHz
    VIC  94:  3840x2160   25.000000 Hz  16:9     56.250 kHz    297.000000 MHz
    VIC  95:  3840x2160   30.000000 Hz  16:9     67.500 kHz    297.000000 MHz
    VIC  96:  3840x2160   50.000000 Hz  16:9    112.500 kHz    594.000000 MHz
    VIC  97:  3840x2160   60.000000 Hz  16:9    135.000 kHz    594.000000 MHz
  Vendor-Specific Data Block (HDMI), OUI 00-0C-03:
    Source physical address: 2.0.0.0
    Supports_AI
    DC_36bit
    DC_30bit
    DC_Y444
    Maximum TMDS clock: 650 MHz
  Vendor-Specific Data Block (HDMI Forum), OUI C4-5D-D8:
    Version: 1
    Maximum TMDS Character Rate: 650 MHz
    SCDC Present
    Supports 12-bits/component Deep Color 4:2:0 Pixel Encoding
    Supports 10-bits/component Deep Color 4:2:0 Pixel Encoding
  YCbCr 4:2:0 Capability Map Data Block:
    VIC  96:  3840x2160   50.000000 Hz  16:9    112.500 kHz    594.000000 MHz
    VIC  97:  3840x2160   60.000000 Hz  16:9    135.000 kHz    594.000000 MHz
  Video Capability Data Block:
    YCbCr quantization: No Data
    RGB quantization: Selectable (via AVI Q)
    PT scan behavior: Always Underscanned
    IT scan behavior: Always Underscanned
    CE scan behavior: Always Underscanned
  Colorimetry Data Block:
    BT2020YCC
    BT2020RGB
  HDR Static Metadata Data Block:
    Electro optical transfer functions:
      Traditional gamma - SDR luminance range
      SMPTE ST2084
    Supported static metadata descriptors:
      Static metadata type 1
    Desired content max luminance: 97 (408.759 cd/m^2)
    Desired content max frame-average luminance: 97 (408.759 cd/m^2)
    Desired content min luminance: 79 (0.392 cd/m^2)
  Detailed Timing Descriptors:
    DTD 4:  2560x1440  119.997589 Hz  16:9    182.996 kHz    497.750000 MHz (697 mm x 392 mm)
                 Hfront   48 Hsync  32 Hback   80 Hpol P
                 Vfront    3 Vsync   5 Vback   77 Vpol N
    DTD 5:  2560x1440  143.992285 Hz  16:9    219.588 kHz    597.280000 MHz (600 mm x 330 mm)
                 Hfront   48 Hsync  32 Hback   80 Hpol P
                 Vfront    3 Vsync   5 Vback   77 Vpol N
    DTD 6:  2560x1600  119.992741 Hz  16:10   196.908 kHz    535.590000 MHz (600 mm x 330 mm)
                 Hfront   48 Hsync  32 Hback   80 Hpol P
                 Vfront    3 Vsync   5 Vback   33 Vpol N
Checksum: 0x72  Unused space in Extension Block: 17 bytes

----------------

Warnings:

Block 0, Base EDID:
  Detailed Timing Descriptor #1: Image size is 609x355 mm, but based on the picture AR it should be 568x355 mm.
  Detailed Timing Descriptor #2: Image size is 609x355 mm, but based on the picture AR it should be 609x342 mm.
  Detailed Timing Descriptor #3: Image size is 330x220 mm, but based on the picture AR it should be 330x206 mm.
Block 1, CTA-861 Extension Block:
  Video Data Block: VIC 16 and the first DTD are not identical. Is this intended?
  Video Capability Data Block: Set Selectable YCbCr Quantization to avoid interop issues.
  Video Capability Data Block: S_PT is equal to S_IT and S_CE, so should be set to 0 instead.
  Detailed Timing Descriptor #6: Image size is 600x330 mm, but based on the picture AR it should be 528x330 mm.
EDID:
  Base EDID: Some timings are out of range of the Monitor Ranges:
    Vertical Freq: 25.000 - 143.992 Hz (Monitor: 48.000 - 165.000 Hz)
    Horizontal Freq: 31.250 - 219.588 kHz (Monitor: 30.000 - 215.000 kHz)

Failures:

Block 0, Base EDID:
  Basic Display Parameters & Features: sRGB is signaled, but the chromaticities do not match.
  Missing Display Product Name.
Block 1, CTA-861 Extension Block:
  Video Data Block: Duplicate VIC 63.
  Vendor-Specific Data Block (HDMI), OUI 00-0C-03: HDMI VSDB Max TMDS rate is > 340.
  Vendor-Specific Data Block (HDMI Forum), OUI C4-5D-D8: Max TMDS rate is > 0 and <= 340 or > 600.
EDID:
  Extension Block 2 started with EDID header, ignoring Extension Blocks >= 2.
  Base EDID: The DTD max image size is 697x392mm, but the display size is not specified anywhere.

EDID conformity: FAIL
