edid-decode (hex):

00 ff ff ff ff ff ff 00 0e 8f 16 14 00 00 00 00
00 1e 01 04 a5 1e 13 78 03 ee 95 a3 54 4c 99 26
0f 50 54 00 00 00 01 01 01 01 01 01 01 01 01 01
01 01 01 01 01 01 74 3c 80 a0 70 b0 28 40 30 20
36 00 2d bc 10 00 00 1a 00 00 00 fd 00 30 3c 4a
4a 0f 01 0a 20 20 20 20 20 20 00 00 00 fe 00 43
54 4f 0a 20 20 20 20 20 20 20 20 20 00 00 00 fe
00 4c 45 42 31 34 32 30 31 2d 30 31 4e 0a 00 fe

00 ff ff ff ff ff ff 00 0e 8f 16 14 00 00 00 00
00 1e 01 04 a5 1e 13 78 03 ee 95 a3 54 4c 99 26
0f 50 54 00 00 00 01 01 01 01 01 01 01 01 01 01
01 01 01 01 01 01 74 3c 80 a0 70 b0 28 40 30 20
36 00 2d bc 10 00 00 1a 00 00 00 fd 00 30 3c 4a
4a 0f 01 0a 20 20 20 20 20 20 00 00 00 fe 00 43
54 4f 0a 20 20 20 20 20 20 20 20 20 00 00 00 fe
00 4c 45 42 31 34 32 30 31 2d 30 31 4e 0a 00 fe

----------------

Block 0, Base EDID:
  EDID Structure Version & Revision: 1.4
  Vendor & Product Identification:
    Manufacturer: CTO
    Model: 5142
    Made in: 2020
  Basic Display Parameters & Features:
    Digital display
    Bits per primary color channel: 8
    DisplayPort interface
    Maximum image size: 30 cm x 19 cm
    Gamma: 2.20
    Supported color formats: RGB 4:4:4
    First detailed timing includes the native pixel format and preferred refresh rate
    Display supports continuous frequencies
  Color Characteristics:
    Red  : 0.6396, 0.3300
    Green: 0.2998, 0.5996
    Blue : 0.1503, 0.0595
    White: 0.3134, 0.3291
  Established Timings I & II: none
  Standard Timings: none
  Detailed Timing Descriptors:
    DTD 1:  1920x1200   60.003102 Hz  16:10    74.404 kHz    154.760000 MHz (301 mm x 188 mm)
                 Hfront   48 Hsync  32 Hback   80 Hpol P
                 Vfront    3 Vsync   6 Vback   31 Vpol N
    Display Range Limits:
      Monitor ranges (Range Limits Only): 48-60 Hz V, 74-74 kHz H, max dotclock 150 MHz
    Alphanumeric Data String: 'CTO'
    Alphanumeric Data String: 'LEB14201-01N'
Checksum: 0xfe

----------------

Warnings:

Block 0, Base EDID:
  Missing Display Product Name.
EDID:
  Base EDID: Some timings are out of range of the Monitor Ranges:
    Maximum Clock: 154.760 MHz (Monitor: 150.000 MHz)
    Could be due to a Monitor Range off-by-one rounding issue

Failures:

EDID:
  Extension Block 1 started with EDID header, ignoring Extension Blocks >= 1.

EDID conformity: FAIL
