edid-decode (hex):

00 ff ff ff ff ff ff 00 06 af 8d 2e 00 00 00 00
00 1d 01 04 a5 22 13 78 03 6e 85 93 58 58 92 28
1e 50 54 00 00 00 01 01 01 01 01 01 01 01 01 01
01 01 01 01 01 01 14 37 80 b4 70 38 26 40 6c 30
aa 00 58 c2 10 00 00 18 10 2c 80 b4 70 38 26 40
6c 30 aa 00 58 c2 10 00 00 18 00 00 00 fd 00 30
3c 44 44 0e 01 0a 20 20 20 20 20 20 00 00 00 fe
00 42 31 35 36 48 41 4e 30 32 2e 31 20 0a 00 da

----------------

Block 0, Base EDID:
  EDID Structure Version & Revision: 1.4
  Vendor & Product Identification:
    Manufacturer: AUO
    Model: 11917
    Made in: 2019
  Basic Display Parameters & Features:
    Digital display
    Bits per primary color channel: 8
    DisplayPort interface
    Maximum image size: 34 cm x 19 cm
    Gamma: 2.20
    Supported color formats: RGB 4:4:4
    First detailed timing includes the native pixel format and preferred refresh rate
    Display supports continuous frequencies
  Color Characteristics:
    Red  : 0.5751, 0.3457
    Green: 0.3466, 0.5722
    Blue : 0.1582, 0.1171
    White: 0.3134, 0.3291
  Established Timings I & II: none
  Standard Timings: none
  Detailed Timing Descriptors:
    DTD 1:  1920x1080   60.056223 Hz  16:9     67.143 kHz    141.000000 MHz (344 mm x 194 mm)
                 Hfront  108 Hsync  48 Hback   24 Hpol N
                 Vfront   10 Vsync  10 Vback   18 Vpol N
    DTD 2:  1920x1080   48.044978 Hz  16:9     53.714 kHz    112.800000 MHz (344 mm x 194 mm)
                 Hfront  108 Hsync  48 Hback   24 Hpol N
                 Vfront   10 Vsync  10 Vback   18 Vpol N
    Display Range Limits:
      Monitor ranges (Range Limits Only): 48-60 Hz V, 68-68 kHz H, max dotclock 140 MHz
    Alphanumeric Data String: 'B156HAN02.1 '
Checksum: 0xda

----------------

Warnings:

Block 0, Base EDID:
  Missing Display Product Name.
EDID:
  Base EDID: Some timings are out of range of the Monitor Ranges:
    Horizontal Freq: 53.714 - 67.142 kHz (Monitor: 68.000 - 68.000 kHz)
    Maximum Clock: 141.000 MHz (Monitor: 140.000 MHz)

Failures:

Block 0, Base EDID:
  Alphanumeric Data String: One or more trailing spaces before newline.

EDID conformity: FAIL
