edid-decode (hex):

00 ff ff ff ff ff ff 00 06 af 9e 21 00 00 00 00
0f 19 01 04 95 26 15 78 02 ee 85 9e 59 50 9d 26
1d 50 54 00 00 00 01 01 01 01 01 01 01 01 01 01
01 01 01 01 01 01 1c 2a 40 52 61 84 1a 30 30 20
36 00 7e d6 10 00 00 18 00 00 00 00 00 00 00 00
00 00 00 00 00 00 00 00 00 00 00 00 00 fe 00 41
55 4f 0a 20 20 20 20 20 20 20 20 20 00 00 00 fe
00 42 31 37 33 52 54 4e 30 32 2e 31 20 0a 00 fd

----------------

Block 0, Base EDID:
  EDID Structure Version & Revision: 1.4
  Vendor & Product Identification:
    Manufacturer: AUO
    Model: 8606
    Made in: week 15 of 2015
  Basic Display Parameters & Features:
    Digital display
    Bits per primary color channel: 6
    DisplayPort interface
    Maximum image size: 38 cm x 21 cm
    Gamma: 2.20
    Supported color formats: RGB 4:4:4
    First detailed timing includes the native pixel format and preferred refresh rate
  Color Characteristics:
    Red  : 0.6201, 0.3496
    Green: 0.3154, 0.6152
    Blue : 0.1503, 0.1132
    White: 0.3134, 0.3291
  Established Timings I & II: none
  Standard Timings: none
  Detailed Timing Descriptors:
    DTD 1:  1600x900    60.069498 Hz  16:9     55.624 kHz    107.800000 MHz (382 mm x 214 mm)
                 Hfront   48 Hsync  32 Hback  258 Hpol N
                 Vfront    3 Vsync   6 Vback   17 Vpol N
    Empty Descriptor
    Alphanumeric Data String: 'AUO'
    Alphanumeric Data String: 'B173RTN02.1 '
Checksum: 0xfd

----------------

Warnings:

Block 0, Base EDID:
  Missing Display Product Name.

Failures:

Block 0, Base EDID:
  Empty Descriptor: Use Dummy Descriptor instead of all zeroes.
  Alphanumeric Data String: One or more trailing spaces before newline.

EDID conformity: FAIL
