edid-decode (hex):

00 ff ff ff ff ff ff 00 4d 67 12 32 01 00 00 00
1c 21 01 03 80 46 27 78 af 01 05 b0 4f 44 aa 26
0c 50 54 a7 cf 00 81 c0 81 80 95 00 a9 c0 b3 00
d1 c0 01 01 01 01 5d 5e 00 a0 a0 a0 29 50 30 20
35 00 55 50 21 00 00 1e 02 3a 80 18 71 38 2d 40
58 2c 45 00 55 50 21 00 00 1e 00 00 00 fd 00 30
92 19 fa 3c 00 0a 20 20 20 20 20 20 00 00 00 fc
00 51 33 32 31 32 52 55 43 0a 20 20 20 20 01 7b

02 03 46 f3 4b 01 02 03 04 05 10 12 13 14 1f 3f
23 09 07 07 83 01 00 00 6a 03 0c 00 10 00 38 78
20 00 00 67 d8 5d c4 01 78 c0 03 68 1a 00 00 01
01 30 92 ed e3 05 c0 00 e6 06 07 01 53 49 37 e2
00 7f e3 0f 00 3c 19 76 00 a0 a0 a0 2a 50 30 40
45 00 55 50 21 00 00 1e 6f c2 00 a0 a0 a0 55 50
30 20 35 00 55 50 21 00 00 1e f9 e3 00 a0 a0 a0
32 50 10 40 35 00 55 50 21 00 00 1e 00 00 00 95

00 ff ff ff ff ff ff 00 4d 67 12 32 01 00 00 00
1c 21 01 03 80 46 27 78 af 01 05 b0 4f 44 aa 26
0c 50 54 a7 cf 00 81 c0 81 80 95 00 a9 c0 b3 00
d1 c0 01 01 01 01 5d 5e 00 a0 a0 a0 29 50 30 20
35 00 55 50 21 00 00 1e 02 3a 80 18 71 38 2d 40
58 2c 45 00 55 50 21 00 00 1e 00 00 00 fd 00 30
92 19 fa 3c 00 0a 20 20 20 20 20 20 00 00 00 fc
00 51 33 32 31 32 52 55 43 0a 20 20 20 20 01 7b

02 03 46 f3 4b 01 02 03 04 05 10 12 13 14 1f 3f
23 09 07 07 83 01 00 00 6a 03 0c 00 10 00 38 78
20 00 00 67 d8 5d c4 01 78 c0 03 68 1a 00 00 01
01 30 92 ed e3 05 c0 00 e6 06 07 01 53 49 37 e2
00 7f e3 0f 00 3c 19 76 00 a0 a0 a0 2a 50 30 40
45 00 55 50 21 00 00 1e 6f c2 00 a0 a0 a0 55 50
30 20 35 00 55 50 21 00 00 1e f9 e3 00 a0 a0 a0
32 50 10 40 35 00 55 50 21 00 00 1e 00 00 00 95

----------------

Block 0, Base EDID:
  EDID Structure Version & Revision: 1.3
  Vendor & Product Identification:
    Manufacturer: SKG
    Model: 12818
    Serial Number: ...
    Made in: week 28 of 2023
  Basic Display Parameters & Features:
    Digital display
    Maximum image size: 70 cm x 39 cm
    Gamma: 2.20
    DPMS levels: Standby Off
    RGB color display
    Default (sRGB) color space is primary color space
    First detailed timing is the preferred timing
    Supports GTF timings within operating range
  Color Characteristics:
    Red  : 0.6875, 0.3085
    Green: 0.2656, 0.6650
    Blue : 0.1484, 0.0468
    White: 0.3134, 0.3291
  Established Timings I & II:
    IBM     :   720x400    70.081663 Hz   9:5     31.467 kHz     28.320000 MHz
    DMT 0x04:   640x480    59.940476 Hz   4:3     31.469 kHz     25.175000 MHz
    DMT 0x06:   640x480    75.000000 Hz   4:3     37.500 kHz     31.500000 MHz
    DMT 0x08:   800x600    56.250000 Hz   4:3     35.156 kHz     36.000000 MHz
    DMT 0x09:   800x600    60.316541 Hz   4:3     37.879 kHz     40.000000 MHz
    DMT 0x0a:   800x600    72.187572 Hz   4:3     48.077 kHz     50.000000 MHz
    DMT 0x0b:   800x600    75.000000 Hz   4:3     46.875 kHz     49.500000 MHz
    DMT 0x10:  1024x768    60.003840 Hz   4:3     48.363 kHz     65.000000 MHz
    DMT 0x11:  1024x768    70.069359 Hz   4:3     56.476 kHz     75.000000 MHz
    DMT 0x12:  1024x768    75.028582 Hz   4:3     60.023 kHz     78.750000 MHz
    DMT 0x24:  1280x1024   75.024675 Hz   5:4     79.976 kHz    135.000000 MHz
  Standard Timings:
    DMT 0x55:  1280x720    60.000000 Hz  16:9     45.000 kHz     74.250000 MHz
    DMT 0x23:  1280x1024   60.019740 Hz   5:4     63.981 kHz    108.000000 MHz
    DMT 0x2f:  1440x900    59.887445 Hz  16:10    55.935 kHz    106.500000 MHz
    DMT 0x53:  1600x900    60.000000 Hz  16:9     60.000 kHz    108.000000 MHz (RB)
    DMT 0x3a:  1680x1050   59.954250 Hz  16:10    65.290 kHz    146.250000 MHz
    DMT 0x52:  1920x1080   60.000000 Hz  16:9     67.500 kHz    148.500000 MHz
  Detailed Timing Descriptors:
    DTD 1:  2560x1440   59.967927 Hz  16:9     88.812 kHz    241.570000 MHz (597 mm x 336 mm)
                 Hfront   48 Hsync  32 Hback   80 Hpol P
                 Vfront    3 Vsync   5 Vback   33 Vpol P
    DTD 2:  1920x1080   60.000000 Hz  16:9     67.500 kHz    148.500000 MHz (597 mm x 336 mm)
                 Hfront   88 Hsync  44 Hback  148 Hpol P
                 Vfront    4 Vsync   5 Vback   36 Vpol P
    Display Range Limits:
      Monitor ranges (GTF): 48-146 Hz V, 25-250 kHz H, max dotclock 600 MHz
    Display Product Name: 'Q3212RUC'
  Extension blocks: 1
Checksum: 0x7b

----------------

Block 1, CTA-861 Extension Block:
  Revision: 3
  Underscans IT Video Formats by default
  Basic audio support
  Supports YCbCr 4:4:4
  Supports YCbCr 4:2:2
  Native DTDs: 3
  Video Data Block:
    VIC   1:   640x480    59.940476 Hz   4:3     31.469 kHz     25.175000 MHz
    VIC   2:   720x480    59.940060 Hz   4:3     31.469 kHz     27.000000 MHz
    VIC   3:   720x480    59.940060 Hz  16:9     31.469 kHz     27.000000 MHz
    VIC   4:  1280x720    60.000000 Hz  16:9     45.000 kHz     74.250000 MHz
    VIC   5:  1920x1080i  60.000000 Hz  16:9     33.750 kHz     74.250000 MHz
    VIC  16:  1920x1080   60.000000 Hz  16:9     67.500 kHz    148.500000 MHz
    VIC  18:   720x576    50.000000 Hz  16:9     31.250 kHz     27.000000 MHz
    VIC  19:  1280x720    50.000000 Hz  16:9     37.500 kHz     74.250000 MHz
    VIC  20:  1920x1080i  50.000000 Hz  16:9     28.125 kHz     74.250000 MHz
    VIC  31:  1920x1080   50.000000 Hz  16:9     56.250 kHz    148.500000 MHz
    VIC  63:  1920x1080  120.000000 Hz  16:9    135.000 kHz    297.000000 MHz
  Audio Data Block:
    Linear PCM:
      Max channels: 2
      Supported sample rates (kHz): 48 44.1 32
      Supported sample sizes (bits): 24 20 16
  Speaker Allocation Data Block:
    FL/FR - Front Left/Right
  Vendor-Specific Data Block (HDMI), OUI 00-0C-03:
    Source physical address: 1.0.0.0
    DC_36bit
    DC_30bit
    DC_Y444
    Maximum TMDS clock: 600 MHz
    Extended HDMI video details:
  Vendor-Specific Data Block (HDMI Forum), OUI C4-5D-D8:
    Version: 1
    Maximum TMDS Character Rate: 600 MHz
    SCDC Present
    SCDC Read Request Capable
    Supports 12-bits/component Deep Color 4:2:0 Pixel Encoding
    Supports 10-bits/component Deep Color 4:2:0 Pixel Encoding
  Vendor-Specific Data Block (AMD), OUI 00-00-1A:
    Version: 1
    Flags 1: 0x01
      FreeSync Supported
    Minimum Refresh Rate: 48 Hz
    Maximum Refresh Rate: 146 Hz
    MCCS VCP Code: 0xed
  Colorimetry Data Block:
    BT2020YCC
    BT2020RGB
  HDR Static Metadata Data Block:
    Electro optical transfer functions:
      Traditional gamma - SDR luminance range
      Traditional gamma - HDR luminance range
      SMPTE ST2084
    Supported static metadata descriptors:
      Static metadata type 1
    Desired content max luminance: 83 (301.833 cd/m^2)
    Desired content max frame-average luminance: 73 (243.049 cd/m^2)
    Desired content min luminance: 55 (0.140 cd/m^2)
  Video Capability Data Block:
    YCbCr quantization: No Data
    RGB quantization: Selectable (via AVI Q)
    PT scan behavior: Supports both over- and underscan
    IT scan behavior: Supports both over- and underscan
    CE scan behavior: Supports both over- and underscan
  YCbCr 4:2:0 Capability Map Data Block:
    VIC  63:  1920x1080  120.000000 Hz  16:9    135.000 kHz    297.000000 MHz
    SVD Index 12 is out of range
    SVD Index 13 is out of range
    SVD Index 14 is out of range
  Detailed Timing Descriptors:
    DTD 3:  2560x1440   75.000496 Hz  16:9    111.151 kHz    302.330000 MHz (597 mm x 336 mm)
                 Hfront   48 Hsync  64 Hback   48 Hpol P
                 Vfront    4 Vsync   5 Vback   33 Vpol P
    DTD 4:  2560x1440  119.997589 Hz  16:9    182.996 kHz    497.750000 MHz (597 mm x 336 mm)
                 Hfront   48 Hsync  32 Hback   80 Hpol P
                 Vfront    3 Vsync   5 Vback   77 Vpol P
    DTD 5:  2560x1440  144.001678 Hz  16:9    214.562 kHz    583.610000 MHz (597 mm x 336 mm)
                 Hfront   16 Hsync  64 Hback   80 Hpol P
                 Vfront    3 Vsync   5 Vback   42 Vpol P
Checksum: 0x95  Unused space in Extension Block: 3 bytes

----------------

Warnings:

Block 0, Base EDID:
  Vendor & Product Identification: The serial number is one of the known dummy values, it should probably be set to 0.
Block 1, CTA-861 Extension Block:
  Video Data Block: VIC 1 and the first DTD are not identical. Is this intended?
  Video Data Block: All VICs are in ascending order, and the first (preferred) VIC <= 4, is that intended?
  Video Capability Data Block: Set Selectable YCbCr Quantization to avoid interop issues.
  Video Capability Data Block: S_PT is equal to S_IT and S_CE, so should be set to 0 instead.
  YCbCr 4:2:0 Capability Map Data Block: Some YCbCr 4:2:0 timings are invalid for HDMI 2.1 (which requires an RGB timings pixel rate >= 590 MHz).

Failures:

Block 0, Base EDID:
  Basic Display Parameters & Features: sRGB is signaled, but the chromaticities do not match.
  Detailed Timing Descriptor #1: Mismatch of image size 597x336 mm vs display size 700x390 mm.
  Detailed Timing Descriptor #2: Mismatch of image size 597x336 mm vs display size 700x390 mm.
Block 1, CTA-861 Extension Block:
  Vendor-Specific Data Block (HDMI), OUI 00-0C-03: HDMI VSDB Max TMDS rate is > 340.
  YCbCr 4:2:0 Capability Map Data Block: Max index 14 > 11 (#SVDs).
  Detailed Timing Descriptor #3: Mismatch of image size 597x336 mm vs display size 700x390 mm.
  Detailed Timing Descriptor #4: Mismatch of image size 597x336 mm vs display size 700x390 mm.
  Detailed Timing Descriptor #5: Mismatch of image size 597x336 mm vs display size 700x390 mm.
EDID:
  Extension Block 2 started with EDID header, ignoring Extension Blocks >= 2.
  CTA-861: Native progressive timings are a mix of several resolutions.

EDID conformity: FAIL
