edid-decode (hex):

00 ff ff ff ff ff ff 00 09 e5 4e 0b 00 00 00 00
11 20 01 04 a5 22 13 78 03 09 50 94 56 59 91 28
1f 50 54 00 00 00 01 01 01 01 01 01 01 01 01 01
01 01 01 01 01 01 7d 87 80 a0 70 38 4e 40 30 20
35 00 58 c2 10 00 00 1a 74 38 80 a0 70 38 4e 40
30 20 35 00 58 c2 10 00 00 1a 00 00 00 fd 00 30
90 a7 a7 23 01 0a 20 20 20 20 20 20 00 00 00 fe
00 4e 45 31 35 36 46 48 4d 2d 4e 58 35 0a 00 0b

00 ff ff ff ff ff ff 00 09 e5 4e 0b 00 00 00 00
11 20 01 04 a5 22 13 78 03 09 50 94 56 59 91 28
1f 50 54 00 00 00 01 01 01 01 01 01 01 01 01 01
01 01 01 01 01 01 7d 87 80 a0 70 38 4e 40 30 20
35 00 58 c2 10 00 00 1a 74 38 80 a0 70 38 4e 40
30 20 35 00 58 c2 10 00 00 1a 00 00 00 fd 00 30
90 a7 a7 23 01 0a 20 20 20 20 20 20 00 00 00 fe
00 4e 45 31 35 36 46 48 4d 2d 4e 58 35 0a 00 0b

----------------

Block 0, Base EDID:
  EDID Structure Version & Revision: 1.4
  Vendor & Product Identification:
    Manufacturer: BOE
    Model: 2894
    Made in: week 17 of 2022
  Basic Display Parameters & Features:
    Digital display
    Bits per primary color channel: 8
    DisplayPort interface
    Maximum image size: 34 cm x 19 cm
    Gamma: 2.20
    Supported color formats: RGB 4:4:4
    First detailed timing includes the native pixel format and preferred refresh rate
    Display supports continuous frequencies
  Color Characteristics:
    Red  : 0.5781, 0.3359
    Green: 0.3496, 0.5673
    Blue : 0.1572, 0.1220
    White: 0.3125, 0.3281
  Established Timings I & II: none
  Standard Timings: none
  Detailed Timing Descriptors:
    DTD 1:  1920x1080  144.002425 Hz  16:9    166.755 kHz    346.850000 MHz (344 mm x 194 mm)
                 Hfront   48 Hsync  32 Hback   80 Hpol P
                 Vfront    3 Vsync   5 Vback   70 Vpol N
    DTD 2:  1920x1080   60.000664 Hz  16:9     69.481 kHz    144.520000 MHz (344 mm x 194 mm)
                 Hfront   48 Hsync  32 Hback   80 Hpol P
                 Vfront    3 Vsync   5 Vback   70 Vpol N
    Display Range Limits:
      Monitor ranges (Range Limits Only): 48-144 Hz V, 167-167 kHz H, max dotclock 350 MHz
    Alphanumeric Data String: 'NE156FHM-NX5'
Checksum: 0x0b

----------------

Warnings:

Block 0, Base EDID:
  Missing Display Product Name.
EDID:
  Base EDID: Some timings are out of range of the Monitor Ranges:
    Horizontal Freq: 69.480 - 166.754 kHz (Monitor: 167.000 - 167.000 kHz)

Failures:

EDID:
  Extension Block 1 started with EDID header, ignoring Extension Blocks >= 1.

EDID conformity: FAIL
