edid-decode (hex):

00 ff ff ff ff ff ff 00 63 2b 00 00 00 00 00 00
22 20 01 04 b5 24 13 78 2b 15 25 a5 55 4d 9f 27
0d 50 54 21 08 00 d1 c0 81 00 a9 00 01 01 01 01
01 01 01 01 01 01 66 3e 80 a0 70 b0 50 40 3c 08
82 00 59 d7 10 00 00 1a 00 00 00 ff 00 0a 20 20
20 20 20 20 20 20 20 20 20 20 00 00 00 fd 00 30
90 b4 b4 24 01 0a 20 20 20 20 20 20 00 00 00 fc
00 44 69 73 70 6c 61 79 0a 20 20 20 20 20 01 0e

02 03 20 f1 45 90 01 02 03 04 e2 00 c0 23 09 7f
07 83 01 00 00 e3 05 c0 00 e6 06 05 01 5e 5e 30
cd 7c 80 a0 70 b0 50 40 3c 06 62 00 59 d7 10 00
00 1a 00 00 00 00 00 00 00 00 00 00 00 00 00 00
00 00 00 00 00 00 00 00 00 00 00 00 00 00 00 00
00 00 00 00 00 00 00 00 00 00 00 00 00 00 00 00
00 00 00 00 00 00 00 00 00 00 00 00 00 00 00 00
00 00 00 00 00 00 00 00 00 00 00 00 00 00 00 96

00 ff ff ff ff ff ff 00 63 2b 00 00 00 00 00 00
22 20 01 04 b5 24 13 78 2b 15 25 a5 55 4d 9f 27
0d 50 54 21 08 00 d1 c0 81 00 a9 00 01 01 01 01
01 01 01 01 01 01 66 3e 80 a0 70 b0 50 40 3c 08
82 00 59 d7 10 00 00 1a 00 00 00 ff 00 0a 20 20
20 20 20 20 20 20 20 20 20 20 00 00 00 fd 00 30
90 b4 b4 24 01 0a 20 20 20 20 20 20 00 00 00 fc
00 44 69 73 70 6c 61 79 0a 20 20 20 20 20 01 0e

02 03 20 f1 45 90 01 02 03 04 e2 00 c0 23 09 7f
07 83 01 00 00 e3 05 c0 00 e6 06 05 01 5e 5e 30
cd 7c 80 a0 70 b0 50 40 3c 06 62 00 59 d7 10 00
00 1a 00 00 00 00 00 00 00 00 00 00 00 00 00 00
00 00 00 00 00 00 00 00 00 00 00 00 00 00 00 00
00 00 00 00 00 00 00 00 00 00 00 00 00 00 00 00
00 00 00 00 00 00 00 00 00 00 00 00 00 00 00 00
00 00 00 00 00 00 00 00 00 00 00 00 00 00 00 96

----------------

Block 0, Base EDID:
  EDID Structure Version & Revision: 1.4
  Vendor & Product Identification:
    Manufacturer: XYK
    Model: 0
    Made in: week 34 of 2022
  Basic Display Parameters & Features:
    Digital display
    Bits per primary color channel: 10
    DisplayPort interface
    Maximum image size: 36 cm x 19 cm
    Gamma: 2.20
    DPMS levels: Off
    Supported color formats: RGB 4:4:4, YCrCb 4:4:4
    First detailed timing includes the native pixel format and preferred refresh rate
    Display supports continuous frequencies
  Color Characteristics:
    Red  : 0.6445, 0.3330
    Green: 0.3017, 0.6220
    Blue : 0.1523, 0.0527
    White: 0.3134, 0.3291
  Established Timings I & II:
    DMT 0x04:   640x480    59.940476 Hz   4:3     31.469 kHz     25.175000 MHz
    DMT 0x09:   800x600    60.316541 Hz   4:3     37.879 kHz     40.000000 MHz
    DMT 0x10:  1024x768    60.003840 Hz   4:3     48.363 kHz     65.000000 MHz
  Standard Timings:
    DMT 0x52:  1920x1080   60.000000 Hz  16:9     67.500 kHz    148.500000 MHz
    DMT 0x1c:  1280x800    59.810326 Hz  16:10    49.702 kHz     83.500000 MHz
    GTF     :  1600x1000   59.999820 Hz  16:10    62.100 kHz    133.142000 MHz
  Detailed Timing Descriptors:
    DTD 1:  1920x1200   59.998498 Hz  16:10    76.798 kHz    159.740000 MHz (345 mm x 215 mm)
                 Hfront   60 Hsync   8 Hback   92 Hpol P
                 Vfront    8 Vsync   2 Vback   70 Vpol N
    Display Product Serial Number: ...
    Display Range Limits:
      Monitor ranges (Range Limits Only): 48-144 Hz V, 180-180 kHz H, max dotclock 360 MHz
    Display Product Name: 'Display'
  Extension blocks: 1
Checksum: 0x0e

----------------

Block 1, CTA-861 Extension Block:
  Revision: 3
  Underscans IT Video Formats by default
  Basic audio support
  Supports YCbCr 4:4:4
  Supports YCbCr 4:2:2
  Native detailed modes: 1
  Video Data Block:
    VIC  16:  1920x1080   60.000000 Hz  16:9     67.500 kHz    148.500000 MHz (native)
    VIC   1:   640x480    59.940476 Hz   4:3     31.469 kHz     25.175000 MHz
    VIC   2:   720x480    59.940060 Hz   4:3     31.469 kHz     27.000000 MHz
    VIC   3:   720x480    59.940060 Hz  16:9     31.469 kHz     27.000000 MHz
    VIC   4:  1280x720    60.000000 Hz  16:9     45.000 kHz     74.250000 MHz
  Video Capability Data Block:
    YCbCr quantization: Selectable (via AVI YQ)
    RGB quantization: Selectable (via AVI Q)
    PT scan behavior: No Data
    IT scan behavior: IT video formats not supported
    CE scan behavior: CE video formats not supported
  Audio Data Block:
    Linear PCM:
      Max channels: 2
      Supported sample rates (kHz): 192 176.4 96 88.2 48 44.1 32
      Supported sample sizes (bits): 24 20 16
  Speaker Allocation Data Block:
    FL/FR - Front Left/Right
  Colorimetry Data Block:
    BT2020YCC
    BT2020RGB
  HDR Static Metadata Data Block:
    Electro optical transfer functions:
      Traditional gamma - SDR luminance range
      SMPTE ST2084
    Supported static metadata descriptors:
      Static metadata type 1
    Desired content max luminance: 94 (383.041 cd/m^2)
    Desired content max frame-average luminance: 94 (383.041 cd/m^2)
    Desired content min luminance: 48 (0.136 cd/m^2)
  Detailed Timing Descriptors:
    DTD 2:  1920x1200  120.000751 Hz  16:10   153.601 kHz    319.490000 MHz (345 mm x 215 mm)
                 Hfront   60 Hsync   6 Hback   94 Hpol P
                 Vfront    6 Vsync   2 Vback   72 Vpol N
Checksum: 0x96  Unused space in Extension Block: 77 bytes

----------------

Block 2, Unknown EDID Extension Block 0x00:
  00 ff ff ff ff ff ff 00 63 2b 00 00 00 00 00 00 '........c+......'
  22 20 01 04 b5 24 13 78 2b 15 25 a5 55 4d 9f 27 '" ...$.x+.%.UM.''
  0d 50 54 21 08 00 d1 c0 81 00 a9 00 01 01 01 01 '.PT!............'
  01 01 01 01 01 01 66 3e 80 a0 70 b0 50 40 3c 08 '......f>..p.P@<.'
  82 00 59 d7 10 00 00 1a 00 00 00 ff 00 0a 20 20 '..Y...........  '
  20 20 20 20 20 20 20 20 20 20 00 00 00 fd 00 30 '          .....0'
  90 b4 b4 24 01 0a 20 20 20 20 20 20 00 00 00 fc '...$..      ....'
  00 44 69 73 70 6c 61 79 0a 20 20 20 20 20 01 0e '.Display.     ..'
Checksum: 0x0e

----------------

Block 3, CTA-861 Extension Block:
  Revision: 3
  Underscans IT Video Formats by default
  Basic audio support
  Supports YCbCr 4:4:4
  Supports YCbCr 4:2:2
  Native detailed modes: 1
  Video Data Block:
    VIC  16:  1920x1080   60.000000 Hz  16:9     67.500 kHz    148.500000 MHz (native)
    VIC   1:   640x480    59.940476 Hz   4:3     31.469 kHz     25.175000 MHz
    VIC   2:   720x480    59.940060 Hz   4:3     31.469 kHz     27.000000 MHz
    VIC   3:   720x480    59.940060 Hz  16:9     31.469 kHz     27.000000 MHz
    VIC   4:  1280x720    60.000000 Hz  16:9     45.000 kHz     74.250000 MHz
  Video Capability Data Block:
    YCbCr quantization: Selectable (via AVI YQ)
    RGB quantization: Selectable (via AVI Q)
    PT scan behavior: No Data
    IT scan behavior: IT video formats not supported
    CE scan behavior: CE video formats not supported
  Audio Data Block:
    Linear PCM:
      Max channels: 2
      Supported sample rates (kHz): 192 176.4 96 88.2 48 44.1 32
      Supported sample sizes (bits): 24 20 16
  Speaker Allocation Data Block:
    FL/FR - Front Left/Right
  Colorimetry Data Block:
    BT2020YCC
    BT2020RGB
  HDR Static Metadata Data Block:
    Electro optical transfer functions:
      Traditional gamma - SDR luminance range
      SMPTE ST2084
    Supported static metadata descriptors:
      Static metadata type 1
    Desired content max luminance: 94 (383.041 cd/m^2)
    Desired content max frame-average luminance: 94 (383.041 cd/m^2)
    Desired content min luminance: 48 (0.136 cd/m^2)
  Detailed Timing Descriptors:
    DTD 3:  1920x1200  120.000751 Hz  16:10   153.601 kHz    319.490000 MHz (345 mm x 215 mm)
                 Hfront   60 Hsync   6 Hback   94 Hpol P
                 Vfront    6 Vsync   2 Vback   72 Vpol N
Checksum: 0x96  Unused space in Extension Block: 77 bytes

----------------

Warnings:

Block 1, CTA-861 Extension Block:
  Video Data Block: VIC 16 and the first DTD are not identical. Is this intended?
  Video Capability Data Block: IT scan behavior is expected to support underscanned.
  Video Capability Data Block: 'CE video formats not supported' makes no sense.
  Colorimetry Data Block: Set the sRGB colorimetry bit to avoid interop issues.
Block 3, CTA-861 Extension Block:
  Video Capability Data Block: IT scan behavior is expected to support underscanned.
  Video Capability Data Block: 'CE video formats not supported' makes no sense.
  Colorimetry Data Block: Set the sRGB colorimetry bit to avoid interop issues.
EDID:
  Base EDID: Some timings are out of range of the Monitor Ranges:
    Horizontal Freq: 31.468 - 153.600 kHz (Monitor: 180.000 - 180.000 kHz)

Failures:

Block 0, Base EDID:
  Display Product Serial Number: ...
  Detailed Timing Descriptor #1: Mismatch of image size 345x215 mm vs display size 360x190 mm.
Block 1, CTA-861 Extension Block:
  Detailed Timing Descriptor #2: Mismatch of image size 345x215 mm vs display size 360x190 mm.
Block 2, Base EDID:
  Unknown Extension Block.
Block 3, CTA-861 Extension Block:
  Video Data Block: Duplicate VIC 16.
  Video Data Block: Duplicate VIC 1.
  Video Data Block: Duplicate VIC 2.
  Video Data Block: Duplicate VIC 3.
  Video Data Block: Duplicate VIC 4.
  Video Capability Data Block: Only one instance of this Data Block is allowed.
  Speaker Allocation Data Block: Only one instance of this Data Block is allowed.
  Colorimetry Data Block: Only one instance of this Data Block is allowed.
  HDR Static Metadata Data Block: Only one instance of this Data Block is allowed.
  Detailed Timing Descriptor #3: Mismatch of image size 345x215 mm vs display size 360x190 mm.
EDID:
  Base EDID: The DTD max image size is 345x215mm, which is larger than the display size 360.0x190.0mm.
  Base EDID: EDID specified 1 extension block(s), but found 3 extension block(s).
  CTA-861: Native progressive timings are a mix of several resolutions.

EDID conformity: FAIL
