edid-decode (hex):

00 ff ff ff ff ff ff 00 15 c3 53 30 01 01 01 01
11 20 01 03 80 21 2c 78 ea e3 84 a6 55 51 9f 26
11 4d 56 a1 08 00 01 01 01 01 01 01 01 01 01 01
01 01 01 01 01 01 44 3f b0 b0 41 40 37 60 58 80
3a 00 44 b0 11 00 00 1c 00 00 00 ff 00 36 33 34
34 38 30 34 32 0a 20 20 20 20 00 00 00 fd 00 3b
3d 1f 64 11 00 0a 20 20 20 20 20 20 00 00 00 fc
00 4d 58 32 31 36 0a 20 20 20 20 20 20 20 00 11

00 ff ff ff ff ff ff 00 15 c3 53 30 01 01 01 01
11 20 01 03 80 21 2c 78 ea e3 84 a6 55 51 9f 26
11 4d 56 a1 08 00 01 01 01 01 01 01 01 01 01 01
01 01 01 01 01 01 44 3f b0 b0 41 40 37 60 58 80
3a 00 44 b0 11 00 00 1c 00 00 00 ff 00 36 33 34
34 38 30 34 32 0a 20 20 20 20 00 00 00 fd 00 3b
3d 1f 64 11 00 0a 20 20 20 20 20 20 00 00 00 fc
00 4d 58 32 31 36 0a 20 20 20 20 20 20 20 00 11

----------------

Block 0, Base EDID:
  EDID Structure Version & Revision: 1.3
  Vendor & Product Identification:
    Manufacturer: ENC
    Model: 12371
    Serial Number: ...
    Made in: week 17 of 2022
  Basic Display Parameters & Features:
    Digital display
    Maximum image size: 33 cm x 44 cm
    Gamma: 2.20
    DPMS levels: Standby Suspend Off
    RGB color display
    First detailed timing is the preferred timing
  Color Characteristics:
    Red  : 0.6513, 0.3339
    Green: 0.3164, 0.6240
    Blue : 0.1503, 0.0664
    White: 0.3017, 0.3359
  Established Timings I & II:
    IBM     :   720x400    70.081663 Hz   9:5     31.467 kHz     28.320000 MHz
    DMT 0x04:   640x480    59.940476 Hz   4:3     31.469 kHz     25.175000 MHz
    DMT 0x09:   800x600    60.316541 Hz   4:3     37.879 kHz     40.000000 MHz
    DMT 0x10:  1024x768    60.003840 Hz   4:3     48.363 kHz     65.000000 MHz
  Standard Timings: none
  Detailed Timing Descriptors:
    DTD 1:  1200x1600   59.963865 Hz   3:4     99.240 kHz    161.960000 MHz (324 mm x 432 mm)
                 Hfront   88 Hsync 128 Hback  216 Hpol N
                 Vfront    3 Vsync  10 Vback   42 Vpol P
    Display Product Serial Number: ...
    Display Range Limits:
      Monitor ranges (GTF): 59-61 Hz V, 31-100 kHz H, max dotclock 170 MHz
    Display Product Name: 'MX216'
Checksum: 0x11

----------------

Warnings:

Block 0, Base EDID:
  Vendor & Product Identification: The serial number is one of the known dummy values, it should probably be set to 0.
EDID:
  Base EDID: Some timings are out of range of the Monitor Ranges:
    Vertical Freq: 59.940 - 70.082 Hz (Monitor: 59.000 - 61.000 Hz)

Failures:

EDID:
  Extension Block 1 started with EDID header, ignoring Extension Blocks >= 1.

EDID conformity: FAIL
