edid-decode (hex):

00 ff ff ff ff ff ff 00 51 a1 22 20 00 00 00 00
20 22 01 04 b5 21 16 78 07 46 70 ad 52 44 b0 25
0c 4e 52 00 00 00 01 01 01 01 01 01 01 01 01 01
01 01 01 01 01 01 88 9a 00 a0 c0 80 78 70 30 20
36 00 59 d7 10 00 00 38 00 00 00 fd 0c 30 78 52
52 6d 01 0a 20 20 20 20 20 20 00 00 00 10 00 00
00 00 00 00 00 00 00 00 00 00 00 00 00 00 00 fc
00 54 4c 31 36 30 4d 44 4d 50 30 33 2d 30 02 ee

02 03 0f 00 e3 05 80 00 e6 06 07 01 6a 6a 39 00
00 00 00 00 00 00 00 00 00 00 00 00 00 00 00 00
00 00 00 00 00 00 00 00 00 00 00 00 00 00 00 00
00 00 00 00 00 00 00 00 00 00 00 00 00 00 00 00
00 00 00 00 00 00 00 00 00 00 00 00 00 00 00 00
00 00 00 00 00 00 00 00 00 00 00 00 00 00 00 00
00 00 00 00 00 00 00 00 00 00 00 00 00 00 00 00
00 00 00 00 00 00 00 00 00 00 00 00 00 00 00 83

70 12 79 00 00 03 01 28 f4 a8 01 85 ff 0b 9f 00
2f 00 1f 00 7f 07 77 00 02 00 05 00 0f 35 01 05
ff 0b 9f 00 2f 00 1f 00 7f 07 77 00 02 00 05 00
00 00 00 00 00 00 00 00 00 00 00 00 00 00 00 00
00 00 00 00 00 00 00 00 00 00 00 00 00 00 00 00
00 00 00 00 00 00 00 00 00 00 00 00 00 00 00 00
00 00 00 00 00 00 00 00 00 00 00 00 00 00 00 00
00 00 00 00 00 00 00 00 00 00 00 00 00 00 e7 90

00 ff ff ff ff ff ff 00 51 a1 22 20 00 00 00 00
20 22 01 04 b5 21 16 78 07 46 70 ad 52 44 b0 25
0c 4e 52 00 00 00 01 01 01 01 01 01 01 01 01 01
01 01 01 01 01 01 88 9a 00 a0 c0 80 78 70 30 20
36 00 59 d7 10 00 00 38 00 00 00 fd 0c 30 78 52
52 6d 01 0a 20 20 20 20 20 20 00 00 00 10 00 00
00 00 00 00 00 00 00 00 00 00 00 00 00 00 00 fc
00 54 4c 31 36 30 4d 44 4d 50 30 33 2d 30 02 ee

02 03 0f 00 e3 05 80 00 e6 06 07 01 6a 6a 39 00
00 00 00 00 00 00 00 00 00 00 00 00 00 00 00 00
00 00 00 00 00 00 00 00 00 00 00 00 00 00 00 00
00 00 00 00 00 00 00 00 00 00 00 00 00 00 00 00
00 00 00 00 00 00 00 00 00 00 00 00 00 00 00 00
00 00 00 00 00 00 00 00 00 00 00 00 00 00 00 00
00 00 00 00 00 00 00 00 00 00 00 00 00 00 00 00
00 00 00 00 00 00 00 00 00 00 00 00 00 00 00 83

70 12 79 00 00 03 01 28 f4 a8 01 85 ff 0b 9f 00
2f 00 1f 00 7f 07 77 00 02 00 05 00 0f 35 01 05
ff 0b 9f 00 2f 00 1f 00 7f 07 77 00 02 00 05 00
00 00 00 00 00 00 00 00 00 00 00 00 00 00 00 00
00 00 00 00 00 00 00 00 00 00 00 00 00 00 00 00
00 00 00 00 00 00 00 00 00 00 00 00 00 00 00 00
00 00 00 00 00 00 00 00 00 00 00 00 00 00 00 00
00 00 00 00 00 00 00 00 00 00 00 00 00 00 e7 90

----------------

Block 0, Base EDID:
  EDID Structure Version & Revision: 1.4
  Vendor & Product Identification:
    Manufacturer: TMA
    Model: 8226
    Made in: week 32 of 2024
  Basic Display Parameters & Features:
    Digital display
    Bits per primary color channel: 10
    DisplayPort interface
    Maximum image size: 33 cm x 22 cm
    Gamma: 2.20
    Supported color formats: RGB 4:4:4
    Default (sRGB) color space is primary color space
    First detailed timing includes the native pixel format and preferred refresh rate
    Display supports continuous frequencies
  Color Characteristics:
    Red  : 0.6767, 0.3203
    Green: 0.2666, 0.6894
    Blue : 0.1455, 0.0498
    White: 0.3046, 0.3203
  Established Timings I & II: none
  Standard Timings: none
  Detailed Timing Descriptors:
    DTD 1:  3072x1920   60.000485 Hz  16:10   122.401 kHz    395.600000 MHz (field sequential L/R, 345 mm x 215 mm)
                 Hfront   48 Hsync  32 Hback   80 Hpol N
                 Vfront    3 Vsync   6 Vback  111 Vpol N
    Display Range Limits:
      Monitor ranges (Range Limits Only): 48-120 Hz V, 337-337 kHz H, max dotclock 1090 MHz
    Dummy Descriptor:
    Display Product Name: 'TL160MDMP03-0'
  Extension blocks: 2
Checksum: 0xee

----------------

Block 1, CTA-861 Extension Block:
  Revision: 3
  Native DTDs: 0
  Colorimetry Data Block:
    BT2020RGB
  HDR Static Metadata Data Block:
    Electro optical transfer functions:
      Traditional gamma - SDR luminance range
      Traditional gamma - HDR luminance range
      SMPTE ST2084
    Supported static metadata descriptors:
      Static metadata type 1
    Desired content max luminance: 106 (496.743 cd/m^2)
    Desired content max frame-average luminance: 106 (496.743 cd/m^2)
    Desired content min luminance: 57 (0.248 cd/m^2)
Checksum: 0x83  Unused space in Extension Block: 112 bytes

----------------

Block 2, DisplayID Extension Block:
  Version: 1.2
  Extension Count: 0
  Display Product Type: Extension Section
  Video Timing Modes Type 1 - Detailed Timings Data Block:
    DTD:  3072x1920  164.999818 Hz  16:10   336.600 kHz   1087.890000 MHz (aspect 16:10, no 3D stereo, preferred)
               Hfront   48 Hsync  32 Hback   80 Hpol N
               Vfront    3 Vsync   6 Vback  111 Vpol N
    DTD:  3072x1920  120.000971 Hz  16:10   244.802 kHz    791.200000 MHz (aspect 16:10, no 3D stereo)
               Hfront   48 Hsync  32 Hback   80 Hpol N
               Vfront    3 Vsync   6 Vback  111 Vpol N
  Checksum: 0xe7
Checksum: 0x90

----------------

Warnings:

Block 1, CTA-861 Extension Block:
  IT Video Formats are overscanned by default, but normally this should be underscanned.
EDID:
  Base EDID: Some timings are out of range of the Monitor Ranges:
    Vertical Freq: 60.000 - 165.000 Hz (Monitor: 48.000 - 120.000 Hz)
    Horizontal Freq: 122.400 - 336.599 kHz (Monitor: 337.000 - 337.000 kHz)

Failures:

Block 0, Base EDID:
  Basic Display Parameters & Features: sRGB is signaled, but the chromaticities do not match.
  Detailed Timing Descriptor #1: Mismatch of image size 345x215 mm vs display size 330x220 mm.
Block 1, CTA-861 Extension Block:
  Required 640x480p60 timings are missing in the established timings and the SVD list (VIC 1).
  Missing VCDB, needed for Set Selectable RGB Quantization to avoid interop issues.
Block 2, DisplayID Extension Block:
  DisplayID Base Block has no product type.
EDID:
  Extension Block 3 started with EDID header, ignoring Extension Blocks >= 3.
  Base EDID: The DTD max image size is 345x215mm, which is larger than the display size 330.0x220.0mm.

EDID conformity: FAIL
