edid-decode (hex):

00 ff ff ff ff ff ff 00 06 af 91 92 00 00 00 00
00 1e 01 04 95 1d 11 78 02 93 05 92 58 59 90 29
1d 50 54 00 00 00 01 01 01 01 01 01 01 01 01 01
01 01 01 01 01 01 00 37 80 a0 70 38 30 40 10 10
3e 00 25 a5 10 00 00 1a 00 2c 80 a0 70 38 30 40
10 10 3e 00 25 a5 10 00 00 1a 00 00 00 fe 00 4a
4d 37 54 32 80 42 31 33 33 48 41 4e 00 00 00 00
00 01 41 23 99 00 10 00 00 0a 01 0a 20 20 00 0d

----------------

Block 0, Base EDID:
  EDID Structure Version & Revision: 1.4
  Vendor & Product Identification:
    Manufacturer: AUO
    Model: 37521
    Made in: 2020
  Basic Display Parameters & Features:
    Digital display
    Bits per primary color channel: 6
    DisplayPort interface
    Maximum image size: 29 cm x 17 cm
    Gamma: 2.20
    Supported color formats: RGB 4:4:4
    First detailed timing includes the native pixel format and preferred refresh rate
  Color Characteristics:
    Red  : 0.5722, 0.3447
    Green: 0.3476, 0.5654
    Blue : 0.1601, 0.1132
    White: 0.3134, 0.3291
  Established Timings I & II: none
  Standard Timings: none
  Detailed Timing Descriptors:
    DTD 1:  1920x1080   60.010911 Hz  16:9     67.692 kHz    140.800000 MHz (293 mm x 165 mm)
                 Hfront   16 Hsync  16 Hback  128 Hpol P
                 Vfront    3 Vsync  14 Vback   31 Vpol N
    DTD 2:  1920x1080   48.008729 Hz  16:9     54.154 kHz    112.640000 MHz (293 mm x 165 mm)
                 Hfront   16 Hsync  16 Hback  128 Hpol P
                 Vfront    3 Vsync  14 Vback   31 Vpol N
    Alphanumeric Data String: 'JM7T2.B133HAN'
    Manufacturer-Specified Display Descriptor (0x00): 00 00 00 01 41 23 99 00 10 00 00 0a 01 0a 20 20 '....A#........  '
Checksum: 0x0d

----------------

Warnings:

Block 0, Base EDID:
  Alphanumeric Data String: Non-ASCII character 0x80 at position 5, can cause problems.
  Missing Display Product Name.

EDID conformity: PASS
