edid-decode (hex):

00 ff ff ff ff ff ff 00 21 94 13 09 01 00 00 00
30 1d 01 03 a3 3d 00 78 02 0d c9 a0 57 47 98 27
12 48 4c 00 00 00 01 01 01 01 01 01 01 01 01 01
01 01 01 01 01 01 04 74 00 a4 a1 40 34 60 78 20
0a 08 00 a0 10 00 00 18 04 74 00 b3 a1 40 34 60
2c 20 0a 48 00 a0 10 00 00 18 00 00 00 fc 00 57
61 76 65 53 68 61 72 65 5f 31 31 35 00 00 00 00
00 00 00 00 00 00 00 00 00 00 00 00 00 00 01 7e

02 03 1a 71 47 00 00 00 00 00 00 00 23 09 07 01
83 01 00 00 65 03 0c 00 10 00 c0 67 00 ac a0 40
14 60 64 20 c4 00 c0 78 00 00 00 18 c0 67 00 ac
a0 40 14 60 64 20 c4 00 c0 78 00 00 00 18 c0 67
00 ac a0 40 14 60 64 20 c4 00 c0 78 00 00 00 18
c0 67 00 ac a0 40 14 60 64 20 c4 00 c0 78 00 00
00 18 00 00 00 00 00 00 00 00 00 00 00 00 00 00
00 00 00 00 00 00 00 00 00 00 00 00 00 00 00 f1

00 ff ff ff ff ff ff 00 21 94 13 09 01 00 00 00
30 1d 01 03 a3 3d 00 78 02 0d c9 a0 57 47 98 27
12 48 4c 00 00 00 01 01 01 01 01 01 01 01 01 01
01 01 01 01 01 01 04 74 00 a4 a1 40 34 60 78 20
0a 08 00 a0 10 00 00 18 04 74 00 b3 a1 40 34 60
2c 20 0a 48 00 a0 10 00 00 18 00 00 00 fc 00 57
61 76 65 53 68 61 72 65 5f 31 31 35 00 00 00 00
00 00 00 00 00 00 00 00 00 00 00 00 00 00 01 7e

02 03 1a 71 47 00 00 00 00 00 00 00 23 09 07 01
83 01 00 00 65 03 0c 00 10 00 c0 67 00 ac a0 40
14 60 64 20 c4 00 c0 78 00 00 00 18 c0 67 00 ac
a0 40 14 60 64 20 c4 00 c0 78 00 00 00 18 c0 67
00 ac a0 40 14 60 64 20 c4 00 c0 78 00 00 00 18
c0 67 00 ac a0 40 14 60 64 20 c4 00 c0 78 00 00
00 18 00 00 00 00 00 00 00 00 00 00 00 00 00 00
00 00 00 00 00 00 00 00 00 00 00 00 00 00 00 f1

----------------

Block 0, Base EDID:
  EDID Structure Version & Revision: 1.3
  Vendor & Product Identification:
    Manufacturer: HLT
    Model: 2323
    Serial Number: ...
    Made in: week 48 of 2019
  Basic Display Parameters & Features:
    Digital display
    DFP 1.x compatible TMDS
    Image size is variable
    Gamma: 2.20
    Monochrome or grayscale display
    First detailed timing is the preferred timing
  Color Characteristics:
    Red  : 0.6250, 0.3398
    Green: 0.2802, 0.5947
    Blue : 0.1552, 0.0703
    White: 0.2832, 0.2978
  Established Timings I & II: none
  Standard Timings: none
  Detailed Timing Descriptors:
    DTD 1:  2560x1600   60.329558 Hz  16:10    99.664 kHz    297.000000 MHz (256 mm x 160 mm)
                 Hfront  120 Hsync  32 Hback  268 Hpol N
                 Vfront   32 Vsync  10 Vback   10 Vpol N
    DTD 2:  2560x1600   60.027406 Hz  16:10    99.165 kHz    297.000000 MHz (256 mm x 160 mm)
                 Hfront  300 Hsync  32 Hback  103 Hpol N
                 Vfront   32 Vsync  10 Vback   10 Vpol N
    Display Product Name: 'WaveShare_115'
    Empty Descriptor
  Extension blocks: 1
Checksum: 0x7e

----------------

Block 1, CTA-861 Extension Block:
  Revision: 3
  Basic audio support
  Supports YCbCr 4:4:4
  Supports YCbCr 4:2:2
  Native DTDs: 1
  Video Data Block:
  Audio Data Block:
    Linear PCM:
      Max channels: 2
      Supported sample rates (kHz): 48 44.1 32
      Supported sample sizes (bits): 16
  Speaker Allocation Data Block:
    FL/FR - Front Left/Right
  Vendor-Specific Data Block (HDMI), OUI 00-0C-03:
    Source physical address: 1.0.0.0
  Detailed Timing Descriptors:
    DTD 3:  2560x1600   60.011207 Hz  16:10    97.218 kHz    265.600000 MHz (192 mm x 120 mm)
                 Hfront  100 Hsync  32 Hback   40 Hpol N
                 Vfront   12 Vsync   4 Vback    4 Vpol N
    DTD 4:  2560x1600   60.011207 Hz  16:10    97.218 kHz    265.600000 MHz (192 mm x 120 mm)
                 Hfront  100 Hsync  32 Hback   40 Hpol N
                 Vfront   12 Vsync   4 Vback    4 Vpol N
    DTD 5:  2560x1600   60.011207 Hz  16:10    97.218 kHz    265.600000 MHz (192 mm x 120 mm)
                 Hfront  100 Hsync  32 Hback   40 Hpol N
                 Vfront   12 Vsync   4 Vback    4 Vpol N
    DTD 6:  2560x1600   60.011207 Hz  16:10    97.218 kHz    265.600000 MHz (192 mm x 120 mm)
                 Hfront  100 Hsync  32 Hback   40 Hpol N
                 Vfront   12 Vsync   4 Vback    4 Vpol N
Checksum: 0xf1  Unused space in Extension Block: 29 bytes

----------------

Warnings:

Block 0, Base EDID:
  Vendor & Product Identification: The serial number is one of the known dummy values, it should probably be set to 0.
Block 1, CTA-861 Extension Block:
  IT Video Formats are overscanned by default, but normally this should be underscanned.
  Add a Colorimetry Data Block with the sRGB colorimetry bit set to avoid interop issues.

Failures:

Block 0, Base EDID:
  Basic Display Parameters & Features: Digital Video Interface Standard set to reserved value 0x22.
  Empty Descriptor: Use Dummy Descriptor instead of all zeroes.
  Missing Display Range Limits Descriptor.
Block 1, CTA-861 Extension Block:
  Required 640x480p60 timings are missing in the established timings and the SVD list (VIC 1).
  Missing VCDB, needed for Set Selectable RGB Quantization to avoid interop issues.
EDID:
  Extension Block 2 started with EDID header, ignoring Extension Blocks >= 2.
  Base EDID: The DTD max image size is 256x160mm, but the display size is not specified anywhere.

EDID conformity: FAIL
