edid-decode (hex):

00 ff ff ff ff ff ff 00 30 8e 16 24 04 09 24 20
0a 22 01 04 a2 35 1e 78 2e ee 91 a3 54 4c 99 26
0f 50 54 a5 6b 80 d1 c0 81 c0 81 00 81 80 a9 c0
b3 00 01 01 01 01 42 df 00 78 a0 a0 29 50 30 20
35 00 0f 28 21 00 00 1a 00 00 00 fc 00 4d 44 32
34 30 51 48 0a 20 20 20 20 20 00 00 00 fd 00 1e
90 1e a0 3c 00 0a 20 20 20 20 20 20 00 00 00 ff
00 32 30 32 34 30 39 30 34 0a 20 20 20 20 01 7c

02 03 29 f2 4a 10 1f 01 02 03 04 05 06 07 11 23
09 5f 07 83 01 00 00 e3 05 03 01 65 03 0c 00 20
00 67 d8 5d c4 01 78 c0 00 81 bf 00 a0 a0 a0 3e
50 30 20 35 00 54 4f 21 00 00 1e c1 5f 00 a0 a0
a0 3e 50 30 20 35 00 54 4f 21 00 00 1e 00 00 00
00 00 00 00 00 00 00 00 00 00 00 00 00 00 00 00
00 00 00 00 00 00 00 00 00 00 00 00 00 00 00 00
00 00 00 00 00 00 00 00 00 00 00 00 00 00 00 01

00 ff ff ff ff ff ff 00 30 8e 16 24 04 09 24 20
0a 22 01 04 a2 35 1e 78 2e ee 91 a3 54 4c 99 26
0f 50 54 a5 6b 80 d1 c0 81 c0 81 00 81 80 a9 c0
b3 00 01 01 01 01 42 df 00 78 a0 a0 29 50 30 20
35 00 0f 28 21 00 00 1a 00 00 00 fc 00 4d 44 32
34 30 51 48 0a 20 20 20 20 20 00 00 00 fd 00 1e
90 1e a0 3c 00 0a 20 20 20 20 20 20 00 00 00 ff
00 32 30 32 34 30 39 30 34 0a 20 20 20 20 01 7c

02 03 29 f2 4a 10 1f 01 02 03 04 05 06 07 11 23
09 5f 07 83 01 00 00 e3 05 03 01 65 03 0c 00 20
00 67 d8 5d c4 01 78 c0 00 81 bf 00 a0 a0 a0 3e
50 30 20 35 00 54 4f 21 00 00 1e c1 5f 00 a0 a0
a0 3e 50 30 20 35 00 54 4f 21 00 00 1e 00 00 00
00 00 00 00 00 00 00 00 00 00 00 00 00 00 00 00
00 00 00 00 00 00 00 00 00 00 00 00 00 00 00 00
00 00 00 00 00 00 00 00 00 00 00 00 00 00 00 01

----------------

Block 0, Base EDID:
  EDID Structure Version & Revision: 1.4
  Vendor & Product Identification:
    Manufacturer: LDN
    Model: 9238
    Serial Number: ...
    Made in: week 10 of 2024
  Basic Display Parameters & Features:
    Digital display
    Bits per primary color channel: 8
    HDMI-a interface
    Maximum image size: 53 cm x 30 cm
    Gamma: 2.20
    DPMS levels: Off
    Supported color formats: RGB 4:4:4, YCrCb 4:4:4
    Default (sRGB) color space is primary color space
    First detailed timing includes the native pixel format and preferred refresh rate
  Color Characteristics:
    Red  : 0.6396, 0.3300
    Green: 0.2998, 0.5996
    Blue : 0.1503, 0.0595
    White: 0.3125, 0.3291
  Established Timings I & II:
    IBM     :   720x400    70.081663 Hz   9:5     31.467 kHz     28.320000 MHz
    DMT 0x04:   640x480    59.940476 Hz   4:3     31.469 kHz     25.175000 MHz
    DMT 0x06:   640x480    75.000000 Hz   4:3     37.500 kHz     31.500000 MHz
    DMT 0x09:   800x600    60.316541 Hz   4:3     37.879 kHz     40.000000 MHz
    DMT 0x0b:   800x600    75.000000 Hz   4:3     46.875 kHz     49.500000 MHz
    Apple   :   832x624    74.551266 Hz   4:3     49.726 kHz     57.284000 MHz
    DMT 0x10:  1024x768    60.003840 Hz   4:3     48.363 kHz     65.000000 MHz
    DMT 0x12:  1024x768    75.028582 Hz   4:3     60.023 kHz     78.750000 MHz
    DMT 0x24:  1280x1024   75.024675 Hz   5:4     79.976 kHz    135.000000 MHz
    Apple   :  1152x870    75.061550 Hz 192:145   68.681 kHz    100.000000 MHz
  Standard Timings:
    DMT 0x52:  1920x1080   60.000000 Hz  16:9     67.500 kHz    148.500000 MHz
    DMT 0x55:  1280x720    60.000000 Hz  16:9     45.000 kHz     74.250000 MHz
    DMT 0x1c:  1280x800    59.810326 Hz  16:10    49.702 kHz     83.500000 MHz
    DMT 0x23:  1280x1024   60.019740 Hz   5:4     63.981 kHz    108.000000 MHz
    DMT 0x53:  1600x900    60.000000 Hz  16:9     60.000 kHz    108.000000 MHz (RB)
    DMT 0x3a:  1680x1050   59.954250 Hz  16:10    65.290 kHz    146.250000 MHz
  Detailed Timing Descriptors:
    DTD 1:  2560x1440  143.998105 Hz  16:9    213.261 kHz    571.540000 MHz (527 mm x 296 mm)
                 Hfront   48 Hsync  32 Hback   40 Hpol P
                 Vfront    3 Vsync   5 Vback   33 Vpol N
    Display Product Name: 'MD240QH'
    Display Range Limits:
      Monitor ranges (GTF): 30-144 Hz V, 30-160 kHz H, max dotclock 600 MHz
    Display Product Serial Number: ...
  Extension blocks: 1
Checksum: 0x7c

----------------

Block 1, CTA-861 Extension Block:
  Revision: 3
  Underscans IT Video Formats by default
  Basic audio support
  Supports YCbCr 4:4:4
  Supports YCbCr 4:2:2
  Native DTDs: 2
  Video Data Block:
    VIC  16:  1920x1080   60.000000 Hz  16:9     67.500 kHz    148.500000 MHz
    VIC  31:  1920x1080   50.000000 Hz  16:9     56.250 kHz    148.500000 MHz
    VIC   1:   640x480    59.940476 Hz   4:3     31.469 kHz     25.175000 MHz
    VIC   2:   720x480    59.940060 Hz   4:3     31.469 kHz     27.000000 MHz
    VIC   3:   720x480    59.940060 Hz  16:9     31.469 kHz     27.000000 MHz
    VIC   4:  1280x720    60.000000 Hz  16:9     45.000 kHz     74.250000 MHz
    VIC   5:  1920x1080i  60.000000 Hz  16:9     33.750 kHz     74.250000 MHz
    VIC   6:  1440x480i   59.940060 Hz   4:3     15.734 kHz     27.000000 MHz
    VIC   7:  1440x480i   59.940060 Hz  16:9     15.734 kHz     27.000000 MHz
    VIC  17:   720x576    50.000000 Hz   4:3     31.250 kHz     27.000000 MHz
  Audio Data Block:
    Linear PCM:
      Max channels: 2
      Supported sample rates (kHz): 192 96 88.2 48 44.1 32
      Supported sample sizes (bits): 24 20 16
  Speaker Allocation Data Block:
    FL/FR - Front Left/Right
  Colorimetry Data Block:
    xvYCC601
    xvYCC709
    Gamut Boundary Description Metadata Profile P0
  Vendor-Specific Data Block (HDMI), OUI 00-0C-03:
    Source physical address: 2.0.0.0
  Vendor-Specific Data Block (HDMI Forum), OUI C4-5D-D8:
    Version: 1
    Maximum TMDS Character Rate: 600 MHz
    SCDC Present
    SCDC Read Request Capable
  Detailed Timing Descriptors:
    DTD 2:  2560x1440  119.999315 Hz  16:9    180.239 kHz    490.250000 MHz (596 mm x 335 mm)
                 Hfront   48 Hsync  32 Hback   80 Hpol P
                 Vfront    3 Vsync   5 Vback   54 Vpol P
    DTD 3:  2560x1440   60.000881 Hz  16:9     90.121 kHz    245.130000 MHz (596 mm x 335 mm)
                 Hfront   48 Hsync  32 Hback   80 Hpol P
                 Vfront    3 Vsync   5 Vback   54 Vpol P
Checksum: 0x01  Unused space in Extension Block: 50 bytes

----------------

Warnings:

Block 0, Base EDID:
  Display Range Limits: GTF support is deprecated in EDID 1.4.
Block 1, CTA-861 Extension Block:
  Video Data Block: VIC 16 and the first DTD are not identical. Is this intended?
  Display Product Serial Number is set, so the Serial Number in the Base EDID should be 0.
EDID:
  Base EDID: Some timings are out of range of the Monitor Ranges:
    Horizontal Freq: 15.734 - 213.261 kHz (Monitor: 30.000 - 160.000 kHz)

Failures:

Block 0, Base EDID:
  Display Range Limits: GTF is supported, but the display does not support continuous frequencies.
Block 1, CTA-861 Extension Block:
  Vendor-Specific Data Block (HDMI), OUI 00-0C-03: The HDMI Specification requires EDID 1.3 instead of 1.4.
  Detailed Timing Descriptor #2: Mismatch of image size 596x335 mm vs display size 530x300 mm.
  Detailed Timing Descriptor #3: Mismatch of image size 596x335 mm vs display size 530x300 mm.
  Missing VCDB, needed for Set Selectable RGB Quantization to avoid interop issues.
EDID:
  Extension Block 2 started with EDID header, ignoring Extension Blocks >= 2.
  Base EDID: The DTD max image size is 596x335mm, which is larger than the display size 530.0x300.0mm.

EDID conformity: FAIL
