edid-decode (hex):

00 ff ff ff ff ff ff 00 61 a9 10 a0 00 00 00 00
03 20 01 04 b5 45 1d 78 3f 8a b5 ab 52 46 a6 26
0c 50 54 ad cf 00 71 4f 01 01 81 40 81 80 95 00
a9 c0 b3 00 d1 c0 0a 48 00 a0 a0 38 32 40 30 20
35 00 b2 23 21 00 00 1e 00 00 00 fd 00 30 c8 dc
dc 40 01 0a 20 20 20 20 20 20 00 00 00 fc 00 4d
69 20 33 30 20 48 46 43 57 0a 20 20 00 00 00 ff
00 33 34 31 30 33 30 30 30 30 38 34 35 38 01 2e

02 03 26 f1 4b 01 02 12 13 04 14 05 1f 10 40 3f
23 09 07 07 83 01 00 00 6d 1a 00 00 02 01 50 c8
00 00 00 00 00 00 94 f2 00 c8 a0 38 2d 40 30 40
35 00 b2 23 21 00 00 1e c4 c9 00 f0 a0 38 26 40
30 40 8a 00 b2 23 21 00 00 1e 70 8f 00 a0 a0 38
2d 40 30 40 35 00 b2 23 21 00 00 1e 4a aa 00 a0
a0 38 21 40 30 40 35 00 b2 23 21 00 00 1a 00 00
00 00 00 00 00 00 00 00 00 00 00 00 00 00 00 12

00 ff ff ff ff ff ff 00 61 a9 10 a0 00 00 00 00
03 20 01 04 b5 45 1d 78 3f 8a b5 ab 52 46 a6 26
0c 50 54 ad cf 00 71 4f 01 01 81 40 81 80 95 00
a9 c0 b3 00 d1 c0 0a 48 00 a0 a0 38 32 40 30 20
35 00 b2 23 21 00 00 1e 00 00 00 fd 00 30 c8 dc
dc 40 01 0a 20 20 20 20 20 20 00 00 00 fc 00 4d
69 20 33 30 20 48 46 43 57 0a 20 20 00 00 00 ff
00 33 34 31 30 33 30 30 30 30 38 34 35 38 01 2e

02 03 26 f1 4b 01 02 12 13 04 14 05 1f 10 40 3f
23 09 07 07 83 01 00 00 6d 1a 00 00 02 01 50 c8
00 00 00 00 00 00 94 f2 00 c8 a0 38 2d 40 30 40
35 00 b2 23 21 00 00 1e c4 c9 00 f0 a0 38 26 40
30 40 8a 00 b2 23 21 00 00 1e 70 8f 00 a0 a0 38
2d 40 30 40 35 00 b2 23 21 00 00 1e 4a aa 00 a0
a0 38 21 40 30 40 35 00 b2 23 21 00 00 1a 00 00
00 00 00 00 00 00 00 00 00 00 00 00 00 00 00 12

----------------

Block 0, Base EDID:
  EDID Structure Version & Revision: 1.4
  Vendor & Product Identification:
    Manufacturer: XMI
    Model: 40976
    Made in: week 3 of 2022
  Basic Display Parameters & Features:
    Digital display
    Bits per primary color channel: 10
    DisplayPort interface
    Maximum image size: 69 cm x 29 cm
    Gamma: 2.20
    DPMS levels: Off
    Supported color formats: RGB 4:4:4, YCrCb 4:4:4, YCrCb 4:2:2
    Default (sRGB) color space is primary color space
    First detailed timing includes the native pixel format and preferred refresh rate
    Display supports continuous frequencies
  Color Characteristics:
    Red  : 0.6699, 0.3203
    Green: 0.2753, 0.6503
    Blue : 0.1503, 0.0498
    White: 0.3134, 0.3291
  Established Timings I & II:
    IBM     :   720x400    70.081663 Hz   9:5     31.467 kHz     28.320000 MHz
    DMT 0x04:   640x480    59.940476 Hz   4:3     31.469 kHz     25.175000 MHz
    DMT 0x05:   640x480    72.808802 Hz   4:3     37.861 kHz     31.500000 MHz
    DMT 0x06:   640x480    75.000000 Hz   4:3     37.500 kHz     31.500000 MHz
    DMT 0x09:   800x600    60.316541 Hz   4:3     37.879 kHz     40.000000 MHz
    DMT 0x0a:   800x600    72.187572 Hz   4:3     48.077 kHz     50.000000 MHz
    DMT 0x0b:   800x600    75.000000 Hz   4:3     46.875 kHz     49.500000 MHz
    DMT 0x10:  1024x768    60.003840 Hz   4:3     48.363 kHz     65.000000 MHz
    DMT 0x11:  1024x768    70.069359 Hz   4:3     56.476 kHz     75.000000 MHz
    DMT 0x12:  1024x768    75.028582 Hz   4:3     60.023 kHz     78.750000 MHz
    DMT 0x24:  1280x1024   75.024675 Hz   5:4     79.976 kHz    135.000000 MHz
  Standard Timings:
    DMT 0x15:  1152x864    75.000000 Hz   4:3     67.500 kHz    108.000000 MHz
    DMT 0x20:  1280x960    60.000000 Hz   4:3     60.000 kHz    108.000000 MHz
    DMT 0x23:  1280x1024   60.019740 Hz   5:4     63.981 kHz    108.000000 MHz
    DMT 0x2f:  1440x900    59.887445 Hz  16:10    55.935 kHz    106.500000 MHz
    DMT 0x53:  1600x900    60.000000 Hz  16:9     60.000 kHz    108.000000 MHz (RB)
    DMT 0x3a:  1680x1050   59.954250 Hz  16:10    65.290 kHz    146.250000 MHz
    DMT 0x52:  1920x1080   60.000000 Hz  16:9     67.500 kHz    148.500000 MHz
  Detailed Timing Descriptors:
    DTD 1:  2560x1080   60.001301 Hz  64:27    67.801 kHz    184.420000 MHz (690 mm x 291 mm)
                 Hfront   48 Hsync  32 Hback   80 Hpol P
                 Vfront    3 Vsync   5 Vback   42 Vpol P
    Display Range Limits:
      Monitor ranges (Range Limits Only): 48-200 Hz V, 220-220 kHz H, max dotclock 640 MHz
    Display Product Name: 'Mi 30 HFCW'
    Display Product Serial Number: ...
  Extension blocks: 1
Checksum: 0x2e

----------------

Block 1, CTA-861 Extension Block:
  Revision: 3
  Underscans IT Video Formats by default
  Basic audio support
  Supports YCbCr 4:4:4
  Supports YCbCr 4:2:2
  Native DTDs: 1
  Video Data Block:
    VIC   1:   640x480    59.940476 Hz   4:3     31.469 kHz     25.175000 MHz
    VIC   2:   720x480    59.940060 Hz   4:3     31.469 kHz     27.000000 MHz
    VIC  18:   720x576    50.000000 Hz  16:9     31.250 kHz     27.000000 MHz
    VIC  19:  1280x720    50.000000 Hz  16:9     37.500 kHz     74.250000 MHz
    VIC   4:  1280x720    60.000000 Hz  16:9     45.000 kHz     74.250000 MHz
    VIC  20:  1920x1080i  50.000000 Hz  16:9     28.125 kHz     74.250000 MHz
    VIC   5:  1920x1080i  60.000000 Hz  16:9     33.750 kHz     74.250000 MHz
    VIC  31:  1920x1080   50.000000 Hz  16:9     56.250 kHz    148.500000 MHz
    VIC  16:  1920x1080   60.000000 Hz  16:9     67.500 kHz    148.500000 MHz
    VIC  64:  1920x1080  100.000000 Hz  16:9    112.500 kHz    297.000000 MHz
    VIC  63:  1920x1080  120.000000 Hz  16:9    135.000 kHz    297.000000 MHz
  Audio Data Block:
    Linear PCM:
      Max channels: 2
      Supported sample rates (kHz): 48 44.1 32
      Supported sample sizes (bits): 24 20 16
  Speaker Allocation Data Block:
    FL/FR - Front Left/Right
  Vendor-Specific Data Block (AMD), OUI 00-00-1A:
    Version: 2
    Feature Caps: 0x01
    Minimum Refresh Rate: 80 Hz
    Maximum Refresh Rate: 200 Hz
    Flags 1.x: 0x00
    Flags 2.x: 0x00
  Detailed Timing Descriptors:
    DTD 2:  2560x1080  200.000000 Hz  64:27   225.000 kHz    621.000000 MHz (690 mm x 291 mm)
                 Hfront   48 Hsync  64 Hback   88 Hpol P
                 Vfront    3 Vsync   5 Vback   37 Vpol P
    DTD 3:  2560x1080  165.001278 Hz  64:27   184.471 kHz    516.520000 MHz (690 mm x 291 mm)
                 Hfront   48 Hsync  64 Hback  128 Hpol P
                 Vfront    8 Vsync  10 Vback   20 Vpol P
    DTD 4:  2560x1080  120.000000 Hz  64:27   135.000 kHz    367.200000 MHz (690 mm x 291 mm)
                 Hfront   48 Hsync  64 Hback   48 Hpol P
                 Vfront    3 Vsync   5 Vback   37 Vpol P
    DTD 5:  2560x1080  144.000053 Hz  64:27   160.272 kHz    435.940000 MHz (690 mm x 291 mm)
                 Hfront   48 Hsync  64 Hback   48 Hpol P
                 Vfront    3 Vsync   5 Vback   25 Vpol N
Checksum: 0x12  Unused space in Extension Block: 17 bytes

----------------

Warnings:

Block 1, CTA-861 Extension Block:
  Video Data Block: VIC 1 and the first DTD are not identical. Is this intended?
EDID:
  Base EDID: Some timings are out of range of the Monitor Ranges:
    Horizontal Freq: 28.125 - 225.000 kHz (Monitor: 220.000 - 220.000 kHz)

Failures:

Block 0, Base EDID:
  Basic Display Parameters & Features: sRGB is signaled, but the chromaticities do not match.
Block 1, CTA-861 Extension Block:
  Missing VCDB, needed for Set Selectable RGB Quantization to avoid interop issues.
EDID:
  Extension Block 2 started with EDID header, ignoring Extension Blocks >= 2.

EDID conformity: FAIL
