edid-decode (hex):

00 ff ff ff ff ff ff 00 d6 72 00 01 01 00 00 00
08 1c 01 03 80 34 1d 78 2a 2a c5 a4 56 4f 9e 28
0f 50 54 b7 ef 00 71 4f 81 40 81 80 95 00 b3 00
d1 c0 81 c0 81 00 02 3a 80 18 71 38 2d 40 58 2c
45 00 50 1d 74 00 00 1e 01 1d 00 72 51 d0 1e 20
6e 28 55 00 c4 8e 21 00 00 1e 00 00 00 fd 00 32
4b 18 53 11 01 00 0a 20 20 20 20 20 00 00 00 fc
00 47 53 56 32 36 20 50 41 53 53 20 00 00 01 23

02 03 23 f4 48 10 1f 04 13 05 14 03 12 23 09 17
07 83 01 00 00 6a 03 0c 00 12 00 88 0a 00 08 00
e2 00 ff 02 3a 80 18 71 38 2d 40 58 2c 45 00 50
1d 74 00 00 1e 01 1d 00 72 51 d0 1e 20 6e 28 55
00 c4 8e 21 00 00 1e 01 1d 80 18 71 1c 16 20 58
2c 25 00 c4 8e 21 00 00 9e 8c 0a d0 8a 20 e0 2d
10 10 3e 96 00 13 8e 21 00 00 18 00 00 00 00 00
00 00 00 00 00 00 00 00 00 00 00 00 00 00 00 19

----------------

Block 0, Base EDID:
  EDID Structure Version & Revision: 1.3
  Vendor & Product Identification:
    Manufacturer: USR
    Model: 256
    Serial Number: ...
    Made in: week 8 of 2018
  Basic Display Parameters & Features:
    Digital display
    Maximum image size: 52 cm x 29 cm
    Gamma: 2.20
    DPMS levels: Off
    RGB color display
    First detailed timing is the preferred timing
  Color Characteristics:
    Red  : 0.6406, 0.3378
    Green: 0.3105, 0.6191
    Blue : 0.1591, 0.0585
    White: 0.3134, 0.3291
  Established Timings I & II:
    IBM     :   720x400    70.081663 Hz   9:5     31.467 kHz     28.320000 MHz
    DMT 0x04:   640x480    59.940476 Hz   4:3     31.469 kHz     25.175000 MHz
    Apple   :   640x480    66.666667 Hz   4:3     35.000 kHz     30.240000 MHz
    DMT 0x06:   640x480    75.000000 Hz   4:3     37.500 kHz     31.500000 MHz
    DMT 0x08:   800x600    56.250000 Hz   4:3     35.156 kHz     36.000000 MHz
    DMT 0x09:   800x600    60.316541 Hz   4:3     37.879 kHz     40.000000 MHz
    DMT 0x0a:   800x600    72.187572 Hz   4:3     48.077 kHz     50.000000 MHz
    DMT 0x0b:   800x600    75.000000 Hz   4:3     46.875 kHz     49.500000 MHz
    Apple   :   832x624    74.551266 Hz   4:3     49.726 kHz     57.284000 MHz
    DMT 0x10:  1024x768    60.003840 Hz   4:3     48.363 kHz     65.000000 MHz
    DMT 0x11:  1024x768    70.069359 Hz   4:3     56.476 kHz     75.000000 MHz
    DMT 0x12:  1024x768    75.028582 Hz   4:3     60.023 kHz     78.750000 MHz
    DMT 0x24:  1280x1024   75.024675 Hz   5:4     79.976 kHz    135.000000 MHz
  Standard Timings:
    DMT 0x15:  1152x864    75.000000 Hz   4:3     67.500 kHz    108.000000 MHz
    DMT 0x20:  1280x960    60.000000 Hz   4:3     60.000 kHz    108.000000 MHz
    DMT 0x23:  1280x1024   60.019740 Hz   5:4     63.981 kHz    108.000000 MHz
    DMT 0x2f:  1440x900    59.887445 Hz  16:10    55.935 kHz    106.500000 MHz
    DMT 0x3a:  1680x1050   59.954250 Hz  16:10    65.290 kHz    146.250000 MHz
    DMT 0x52:  1920x1080   60.000000 Hz  16:9     67.500 kHz    148.500000 MHz
    DMT 0x55:  1280x720    60.000000 Hz  16:9     45.000 kHz     74.250000 MHz
    DMT 0x1c:  1280x800    59.810326 Hz  16:10    49.702 kHz     83.500000 MHz
  Detailed Timing Descriptors:
    DTD 1:  1920x1080   60.000000 Hz  16:9     67.500 kHz    148.500000 MHz (1872 mm x 1053 mm)
                 Hfront   88 Hsync  44 Hback  148 Hpol P
                 Vfront    4 Vsync   5 Vback   36 Vpol P
    DTD 2:  1280x720    60.000000 Hz  16:9     45.000 kHz     74.250000 MHz (708 mm x 398 mm)
                 Hfront  110 Hsync  40 Hback  220 Hpol P
                 Vfront    5 Vsync   5 Vback   20 Vpol P
    Display Range Limits:
      Monitor ranges (Range Limits Only): 50-75 Hz V, 24-83 kHz H, max dotclock 170 MHz
    Display Product Name: 'GSV26 PASS '
  Extension blocks: 1
Checksum: 0x23

----------------

Block 1, CTA-861 Extension Block:
  Revision: 3
  Underscans IT Video Formats by default
  Basic audio support
  Supports YCbCr 4:4:4
  Supports YCbCr 4:2:2
  Native DTDs: 4
  Video Data Block:
    VIC  16:  1920x1080   60.000000 Hz  16:9     67.500 kHz    148.500000 MHz
    VIC  31:  1920x1080   50.000000 Hz  16:9     56.250 kHz    148.500000 MHz
    VIC   4:  1280x720    60.000000 Hz  16:9     45.000 kHz     74.250000 MHz
    VIC  19:  1280x720    50.000000 Hz  16:9     37.500 kHz     74.250000 MHz
    VIC   5:  1920x1080i  60.000000 Hz  16:9     33.750 kHz     74.250000 MHz
    VIC  20:  1920x1080i  50.000000 Hz  16:9     28.125 kHz     74.250000 MHz
    VIC   3:   720x480    59.940060 Hz  16:9     31.469 kHz     27.000000 MHz
    VIC  18:   720x576    50.000000 Hz  16:9     31.250 kHz     27.000000 MHz
  Audio Data Block:
    Linear PCM:
      Max channels: 2
      Supported sample rates (kHz): 96 48 44.1 32
      Supported sample sizes (bits): 24 20 16
  Speaker Allocation Data Block:
    FL/FR - Front Left/Right
  Vendor-Specific Data Block (HDMI), OUI 00-0C-03:
    Source physical address: 1.2.0.0
    Supports_AI
    DC_Y444
    Maximum TMDS clock: 50 MHz
  Video Capability Data Block:
    YCbCr quantization: Selectable (via AVI YQ)
    RGB quantization: Selectable (via AVI Q)
    PT scan behavior: Supports both over- and underscan
    IT scan behavior: Supports both over- and underscan
    CE scan behavior: Supports both over- and underscan
  Detailed Timing Descriptors:
    DTD 3:  1920x1080   60.000000 Hz  16:9     67.500 kHz    148.500000 MHz (1872 mm x 1053 mm)
                 Hfront   88 Hsync  44 Hback  148 Hpol P
                 Vfront    4 Vsync   5 Vback   36 Vpol P
    DTD 4:  1280x720    60.000000 Hz  16:9     45.000 kHz     74.250000 MHz (708 mm x 398 mm)
                 Hfront  110 Hsync  40 Hback  220 Hpol P
                 Vfront    5 Vsync   5 Vback   20 Vpol P
    DTD 5:  1920x1080i  60.000000 Hz  16:9     33.750 kHz     74.250000 MHz (708 mm x 398 mm)
                 Hfront   88 Hsync  44 Hback  148 Hpol P
                 Vfront    2 Vsync   5 Vback   15 Vpol P Vfront +0.5 Odd Field
                 Vfront    2 Vsync   5 Vback   15 Vpol P Vback  +0.5 Even Field
    DTD 6:   720x480    59.940060 Hz   3:2     31.469 kHz     27.000000 MHz (531 mm x 398 mm)
                 Hfront   16 Hsync  62 Hback   60 Hpol N
                 Vfront    9 Vsync   6 Vback   30 Vpol N
Checksum: 0x19  Unused space in Extension Block: 20 bytes

----------------

Warnings:

Block 0, Base EDID:
  Vendor & Product Identification: The serial number is one of the known dummy values, it should probably be set to 0.
Block 1, CTA-861 Extension Block:
  Video Capability Data Block: S_PT is equal to S_IT and S_CE, so should be set to 0 instead.
  Detailed Timing Descriptor #6: Image size is 531x398 mm, but based on the picture AR it should be 531x354 mm.
  Add a Colorimetry Data Block with the sRGB colorimetry bit set to avoid interop issues.

Failures:

Block 0, Base EDID:
  Detailed Timing Descriptor #1: Mismatch of image size 1872x1053 mm vs display size 520x290 mm.
  Detailed Timing Descriptor #2: Mismatch of image size 708x398 mm vs display size 520x290 mm.
  Display Range Limits: 'Range Limits Only' is not allowed for EDID < 1.4.
  Display Range Limits: Byte 11 is 0x00 instead of 0x0a.
  Display Range Limits: Bytes 12-17 must be 0x20.
  Display Product Name: NUL byte at position 11.
Block 1, CTA-861 Extension Block:
  Detailed Timing Descriptor #3: Mismatch of image size 1872x1053 mm vs display size 520x290 mm.
  Detailed Timing Descriptor #4: Mismatch of image size 708x398 mm vs display size 520x290 mm.
  Detailed Timing Descriptor #5: Mismatch of image size 708x398 mm vs display size 520x290 mm.
  Detailed Timing Descriptor #6: Mismatch of image size 531x398 mm vs display size 520x290 mm.
EDID:
  Base EDID: The DTD max image size is 1872x1053mm, which is larger than the display size 520.0x290.0mm.
  CTA-861: The maximum HDMI TMDS clock is 50000 kHz, but one or more video timings go up to 148500 kHz.
  CTA-861: Native progressive timings are a mix of several resolutions.

EDID conformity: FAIL
