edid-decode (hex):

00 ff ff ff ff ff ff 00 35 f4 c4 3d 01 00 00 00
20 14 01 03 80 1a 0e 78 0a fe 75 92 5b 56 91 27
1f 50 54 00 00 00 01 01 01 01 01 01 01 01 01 01
01 01 01 01 01 01 20 1c 56 86 50 00 20 30 0e 38
13 00 00 90 10 00 00 1e 00 00 00 ff 00 30 30 30
30 30 31 0a 0a 0a 0a 0a 0a 0a 00 00 00 fd 00 32
4b 1e 55 0f 00 0a 20 20 20 20 20 20 00 00 00 fc
00 4d 6f 74 6f 41 74 74 61 63 68 0a 20 20 01 02

----------------

Block 0, Base EDID:
  EDID Structure Version & Revision: 1.3
  Vendor & Product Identification:
    Manufacturer: MOT
    Model: 15812
    Serial Number: ...
    Made in: week 32 of 2010
  Basic Display Parameters & Features:
    Digital display
    Maximum image size: 26 cm x 14 cm
    Gamma: 2.20
    RGB color display
    First detailed timing is the preferred timing
  Color Characteristics:
    Red  : 0.5732, 0.3583
    Green: 0.3388, 0.5683
    Blue : 0.1533, 0.1240
    White: 0.3134, 0.3291
  Established Timings I & II: none
  Standard Timings: none
  Detailed Timing Descriptors:
    DTD 1:  1366x768    60.000000 Hz 683:384   48.000 kHz     72.000000 MHz (256 mm x 144 mm)
                 Hfront   14 Hsync  56 Hback   64 Hpol P
                 Vfront    1 Vsync   3 Vback   28 Vpol P
    Display Product Serial Number: ...
    Display Range Limits:
      Monitor ranges (GTF): 50-75 Hz V, 30-85 kHz H, max dotclock 150 MHz
    Display Product Name: 'MotoAttach'
  Extension blocks: 1
Checksum: 0x02

----------------

Warnings:

Block 0, Base EDID:
  Vendor & Product Identification: The serial number is one of the known dummy values, it should probably be set to 0.
  Display Product Serial Number: ...

Failures:

Block 0, Base EDID:
  Display Product Serial Number: ...
EDID:
  Base EDID: EDID specified 1 extension block(s), but found 0 extension block(s).

EDID conformity: FAIL
