edid-decode (hex):

00 ff ff ff ff ff ff 00 30 ae 18 e4 01 00 00 00
17 21 01 04 a0 3c 22 78 e6 73 50 aa 56 57 a3 2b
0f 50 54 00 00 00 01 01 01 01 01 01 01 01 01 01
01 01 01 01 01 01 60 59 80 a0 70 38 14 40 30 20
68 00 56 50 21 00 00 1a 00 00 00 fc 00 4c 45 4e
2d 41 33 39 30 2d 41 2d 41 0a 00 00 00 fd 00 30
64 6e 6e 17 01 0a 20 20 20 20 20 20 00 00 00 fe
00 4d 56 32 37 30 46 48 4d 2d 4e 58 32 0a 00 3b

00 ff ff ff ff ff ff 00 30 ae 18 e4 01 00 00 00
17 21 01 04 a0 3c 22 78 e6 73 50 aa 56 57 a3 2b
0f 50 54 00 00 00 01 01 01 01 01 01 01 01 01 01
01 01 01 01 01 01 60 59 80 a0 70 38 14 40 30 20
68 00 56 50 21 00 00 1a 00 00 00 fc 00 4c 45 4e
2d 41 33 39 30 2d 41 2d 41 0a 00 00 00 fd 00 30
64 6e 6e 17 01 0a 20 20 20 20 20 20 00 00 00 fe
00 4d 56 32 37 30 46 48 4d 2d 4e 58 32 0a 00 3b

----------------

Block 0, Base EDID:
  EDID Structure Version & Revision: 1.4
  Vendor & Product Identification:
    Manufacturer: LEN
    Model: 58392
    Serial Number: ...
    Made in: week 23 of 2023
  Basic Display Parameters & Features:
    Digital display
    Bits per primary color channel: 8
    Digital interface is not defined
    Maximum image size: 60 cm x 34 cm
    Gamma: 2.20
    DPMS levels: Standby Suspend Off
    Supported color formats: RGB 4:4:4
    Default (sRGB) color space is primary color space
    First detailed timing includes the native pixel format and preferred refresh rate
  Color Characteristics:
    Red  : 0.6650, 0.3388
    Green: 0.3398, 0.6396
    Blue : 0.1689, 0.0595
    White: 0.3125, 0.3281
  Established Timings I & II: none
  Standard Timings: none
  Detailed Timing Descriptors:
    DTD 1:  1920x1080  100.000000 Hz  16:9    110.000 kHz    228.800000 MHz (598 mm x 336 mm)
                 Hfront   48 Hsync  32 Hback   80 Hpol P
                 Vfront    6 Vsync   8 Vback    6 Vpol N
    Display Product Name: 'LEN-A390-A-A'
    Display Range Limits:
      Monitor ranges (Range Limits Only): 48-100 Hz V, 110-110 kHz H, max dotclock 230 MHz
    Alphanumeric Data String: 'MV270FHM-NX2'
Checksum: 0x3b

----------------

Warnings:

Block 0, Base EDID:
  Vendor & Product Identification: The serial number is one of the known dummy values, it should probably be set to 0.

Failures:

Block 0, Base EDID:
  Basic Display Parameters & Features: sRGB is signaled, but the chromaticities do not match.
EDID:
  Extension Block 1 started with EDID header, ignoring Extension Blocks >= 1.

EDID conformity: FAIL
