edid-decode (hex):

00 ff ff ff ff ff ff 00 51 a1 39 20 01 00 00 00
18 22 01 04 b5 22 16 78 03 0f 91 ae 52 43 b0 26
0f 50 54 00 00 00 01 01 01 01 01 01 01 01 01 01
01 01 01 01 01 01 85 70 00 a0 a0 40 a5 60 30 20
f6 0c 59 d7 10 00 00 1a 00 00 00 fd 0c 3c f0 a9
a9 74 01 0a 20 20 20 20 20 20 00 00 00 10 00 30
f0 50 50 43 00 0a 20 20 20 20 20 20 00 00 00 fc
00 54 4c 31 36 30 41 44 4d 50 32 30 0a 20 02 eb

02 03 0f 00 e3 05 80 80 e6 06 05 01 6a 6a 48 00
00 00 00 00 00 00 00 00 00 00 00 00 00 00 00 00
00 00 00 00 00 00 00 00 00 00 00 00 00 00 00 00
00 00 00 00 00 00 00 00 00 00 00 00 00 00 00 00
00 00 00 00 00 00 00 00 00 00 00 00 00 00 00 00
00 00 00 00 00 00 00 00 00 00 00 00 00 00 00 00
00 00 00 00 00 00 00 00 00 00 00 00 00 00 00 00
00 00 00 00 00 00 00 00 00 00 00 00 00 00 00 f6

70 20 79 02 00 22 00 14 bd 94 11 85 ff 09 9f 00
2f 00 1f 00 3f 06 a4 00 3e 00 05 00 25 01 09 bd
94 11 bd 94 11 3c f0 80 2b 00 0c 27 00 64 ef 00
00 27 00 30 3b 00 00 81 00 15 74 1a 00 00 03 03
3c f0 00 20 6a 48 6a 48 f0 00 00 00 00 00 00 21
01 1d 77 0d 6a 08 00 0a 40 06 08 e9 6a 50 3d 24
b1 51 d2 0e 02 35 54 d0 5f d0 5f 66 36 13 78 2e
00 06 00 45 d0 5f d0 5f 00 00 00 00 00 00 21 90

00 ff ff ff ff ff ff 00 51 a1 39 20 01 00 00 00
18 22 01 04 b5 22 16 78 03 0f 91 ae 52 43 b0 26
0f 50 54 00 00 00 01 01 01 01 01 01 01 01 01 01
01 01 01 01 01 01 85 70 00 a0 a0 40 a5 60 30 20
f6 0c 59 d7 10 00 00 1a 00 00 00 fd 0c 3c f0 a9
a9 74 01 0a 20 20 20 20 20 20 00 00 00 10 00 30
f0 50 50 43 00 0a 20 20 20 20 20 20 00 00 00 fc
00 54 4c 31 36 30 41 44 4d 50 32 30 0a 20 02 eb

02 03 0f 00 e3 05 80 80 e6 06 05 01 6a 6a 48 00
00 00 00 00 00 00 00 00 00 00 00 00 00 00 00 00
00 00 00 00 00 00 00 00 00 00 00 00 00 00 00 00
00 00 00 00 00 00 00 00 00 00 00 00 00 00 00 00
00 00 00 00 00 00 00 00 00 00 00 00 00 00 00 00
00 00 00 00 00 00 00 00 00 00 00 00 00 00 00 00
00 00 00 00 00 00 00 00 00 00 00 00 00 00 00 00
00 00 00 00 00 00 00 00 00 00 00 00 00 00 00 f6

70 20 79 02 00 22 00 14 bd 94 11 85 ff 09 9f 00
2f 00 1f 00 3f 06 a4 00 3e 00 05 00 25 01 09 bd
94 11 bd 94 11 3c f0 80 2b 00 0c 27 00 64 ef 00
00 27 00 30 3b 00 00 81 00 15 74 1a 00 00 03 03
3c f0 00 20 6a 48 6a 48 f0 00 00 00 00 00 00 21
01 1d 77 0d 6a 08 00 0a 40 06 08 e9 6a 50 3d 24
b1 51 d2 0e 02 35 54 d0 5f d0 5f 66 36 13 78 2e
00 06 00 45 d0 5f d0 5f 00 00 00 00 00 00 21 90

----------------

Block 0, Base EDID:
  EDID Structure Version & Revision: 1.4
  Vendor & Product Identification:
    Manufacturer: TMA
    Model: 8249
    Serial Number: ...
    Made in: week 24 of 2024
  Basic Display Parameters & Features:
    Digital display
    Bits per primary color channel: 10
    DisplayPort interface
    Maximum image size: 34 cm x 22 cm
    Gamma: 2.20
    Supported color formats: RGB 4:4:4
    First detailed timing includes the native pixel format and preferred refresh rate
    Display supports continuous frequencies
  Color Characteristics:
    Red  : 0.6796, 0.3203
    Green: 0.2646, 0.6904
    Blue : 0.1503, 0.0595
    White: 0.3125, 0.3291
  Established Timings I & II: none
  Standard Timings: none
  Detailed Timing Descriptors:
    DTD 1:  2560x1600   60.000417 Hz  16:10   105.901 kHz    288.050000 MHz (345 mm x 215 mm)
                 Hfront   48 Hsync  32 Hback   80 Hpol P
                 Vfront   63 Vsync   6 Vback   96 Vpol N
    Display Range Limits:
      Monitor ranges (Range Limits Only): 60-240 Hz V, 424-424 kHz H, max dotclock 1160 MHz
    Dummy Descriptor:
    Display Product Name: 'TL160ADMP20'
  Extension blocks: 2
Checksum: 0xeb

----------------

Block 1, CTA-861 Extension Block:
  Revision: 3
  Native DTDs: 0
  Colorimetry Data Block:
    BT2020RGB
    ST2113RGB
  HDR Static Metadata Data Block:
    Electro optical transfer functions:
      Traditional gamma - SDR luminance range
      SMPTE ST2084
    Supported static metadata descriptors:
      Static metadata type 1
    Desired content max luminance: 106 (496.743 cd/m^2)
    Desired content max frame-average luminance: 106 (496.743 cd/m^2)
    Desired content min luminance: 72 (0.396 cd/m^2)
Checksum: 0xf6  Unused space in Extension Block: 112 bytes

----------------

Block 2, DisplayID Extension Block:
  Version: 2.0
  Extension Count: 0
  Display Product Primary Use Case: None of the listed primary use cases; generic display
  Video Timing Modes Type 7 - Detailed Timings Data Block:
    DTD:  2560x1600  239.999583 Hz  16:10   423.599 kHz   1152.190000 MHz (aspect 16:10, no 3D stereo, preferred)
               Hfront   48 Hsync  32 Hback   80 Hpol N
               Vfront   63 Vsync   6 Vback   96 Vpol N
  Dynamic Video Timing Range Limits Data Block:
    Minimum Pixel Clock: 1152190 kHz
    Maximum Pixel Clock: 1152190 kHz
    Minimum Vertical Refresh Rate: 60 Hz
    Maximum Vertical Refresh Rate: 240 Hz
    Seamless Dynamic Video Timing Support: Yes
  Adaptive Sync Data Block:
    Descriptor #1:
      Native Panel Range
      Fixed Average V-Total and Adaptive V-Total
      Supports Seamless Transition
      'Max Single Frame Duration Increase' field value without jitter impact
      'Max Single Frame Duration Decrease' field value without jitter impact
      Max Duration Increase: 0.00 ms
      Max Duration Decrease: 0.00 ms
      Min Refresh Rate: 100 Hz
      Max Refresh Rate: 240 Hz
    Descriptor #2:
      Native Panel Range
      Fixed Average V-Total and Adaptive V-Total
      Supports Seamless Transition
      'Max Single Frame Duration Increase' field value without jitter impact
      'Max Single Frame Duration Decrease' field value without jitter impact
      Max Duration Increase: 0.00 ms
      Max Duration Decrease: 0.00 ms
      Min Refresh Rate: 48 Hz
      Max Refresh Rate: 60 Hz
  CTA-861 DisplayID Data Block:
  Vendor-Specific Data Block (AMD), OUI 00-00-1A:
    Version: 3
    Feature Caps: 0x03
    Minimum Refresh Rate: 60 Hz
    Maximum Refresh Rate: 240 Hz
    Flags 1.x: 0x00
    Flags 2.x: 0x20
      ST 2084 (PQ) EOTF Supported
      Linear EOTF (Windows scRGB, 0.0 - 125.0) Supported
      BT.2020 Gamut Supported
      Display is Mini LED
    Maximum luminance: 106 (496.743 cd/m^2)
    Minimum luminance: 72 (0.396 cd/m^2)
  Display Parameters Data Block (0x21):
    Image size: 344.7 mm x 215.4 mm
    Display native pixel format: 2560x1600
    Scan Orientation: Left to Right, Top to Bottom
    Luminance Information: Guidance for the Source device
    Color Information: CIE 1931
    Audio Speaker Information: integrated
    Native Color Chromaticity:
      Primary #1:  (0.681885, 0.313965)
      Primary #2:  (0.264893, 0.691895)
      Primary #3:  (0.144775, 0.057861)
      White Point: (0.312988, 0.328857)
    Native Maximum Luminance (Full Coverage): 500.000000 cd/m^2
    Native Maximum Luminance (10% Rectangular Coverage): 500.000000 cd/m^2
    Native Minimum Luminance: 0.399902 cd/m^2
    Native Color Depth: 10 bpc
    Display Device Technology: Active Matrix LCD
    Display Device Theme Preference: No Preference
    Native Gamma EOTF: 2.20
  Brightness Luminance Range Data Block:
    Minimum SDR Luminance (Full Coverage): 5.000000 cd/m^2
    Maximum Suggested SDR Luminance (Full Coverage): 500.000000 cd/m^2
    Maximum Boost SDR Luminance: 500.000000 cd/m^2
  Checksum: 0x21
Checksum: 0x90

----------------

Warnings:

Block 0, Base EDID:
  Vendor & Product Identification: The serial number is one of the known dummy values, it should probably be set to 0.
Block 1, CTA-861 Extension Block:
  IT Video Formats are overscanned by default, but normally this should be underscanned.
  Colorimetry Data Block: Set the sRGB colorimetry bit to avoid interop issues.
EDID:
  Base EDID: Some timings are out of range of the Monitor Ranges:
    Horizontal Freq: 105.900 - 423.599 kHz (Monitor: 424.000 - 424.000 kHz)

Failures:

Block 0, Base EDID:
  Dummy Descriptor: Dummy block filled with garbage.
Block 1, CTA-861 Extension Block:
  Required 640x480p60 timings are missing in the established timings and the SVD list (VIC 1).
  Missing VCDB, needed for Set Selectable RGB Quantization to avoid interop issues.
EDID:
  Extension Block 3 started with EDID header, ignoring Extension Blocks >= 3.

EDID conformity: FAIL
