edid-decode (hex):

00 ff ff ff ff ff ff 00 31 cb 01 00 53 14 03 00
2e 1c 01 03 a0 1e 17 61 ea e4 de 9e 54 4a 97 23
1c 4c 54 00 08 00 81 80 81 40 81 00 01 01 95 00
01 01 01 01 01 01 64 19 00 40 41 00 26 30 18 88
36 00 00 c0 10 00 00 18 02 3a 80 18 71 38 2d 40
58 2c 45 00 dd 0c 11 00 00 1e 66 21 50 b0 51 00
1b 30 40 70 36 00 32 31 34 00 00 1e 00 00 00 fa
00 81 99 81 c0 81 fc 01 01 01 01 95 0f 0a 01 b5

02 03 1b c1 23 09 04 03 83 01 00 00 67 03 0c 00
20 00 80 2d 43 04 04 02 e2 00 0f 8c 0a d0 8a 20
e0 2d 10 10 3e 96 00 a0 5a 00 00 00 00 00 00 00
00 00 00 00 00 00 00 00 00 00 00 00 00 00 00 00
00 00 00 00 00 00 00 00 00 00 00 00 00 00 00 00
00 00 00 00 00 00 00 00 00 00 00 00 00 00 00 00
00 00 00 00 00 00 00 00 00 00 00 00 00 00 00 00
00 00 00 00 00 00 00 00 00 00 00 00 00 00 00 dc

00 ff ff ff ff ff ff 00 31 cb 01 00 53 14 03 00
2e 1c 01 03 a0 1e 17 61 ea e4 de 9e 54 4a 97 23
1c 4c 54 00 08 00 81 80 81 40 81 00 01 01 95 00
01 01 01 01 01 01 64 19 00 40 41 00 26 30 18 88
36 00 00 c0 10 00 00 18 02 3a 80 18 71 38 2d 40
58 2c 45 00 dd 0c 11 00 00 1e 66 21 50 b0 51 00
1b 30 40 70 36 00 32 31 34 00 00 1e 00 00 00 fa
00 81 99 81 c0 81 fc 01 01 01 01 95 0f 0a 01 b5

02 03 1b c1 23 09 04 03 83 01 00 00 67 03 0c 00
20 00 80 2d 43 04 04 02 e2 00 0f 8c 0a d0 8a 20
e0 2d 10 10 3e 96 00 a0 5a 00 00 00 00 00 00 00
00 00 00 00 00 00 00 00 00 00 00 00 00 00 00 00
00 00 00 00 00 00 00 00 00 00 00 00 00 00 00 00
00 00 00 00 00 00 00 00 00 00 00 00 00 00 00 00
00 00 00 00 00 00 00 00 00 00 00 00 00 00 00 00
00 00 00 00 00 00 00 00 00 00 00 00 00 00 00 dc

----------------

Block 0, Base EDID:
  EDID Structure Version & Revision: 1.3
  Vendor & Product Identification:
    Manufacturer: LNK
    Model: 1
    Serial Number: ...
    Made in: week 46 of 2018
  Basic Display Parameters & Features:
    Digital display
    Maximum image size: 30 cm x 23 cm
    Gamma: 1.97
    DPMS levels: Standby Suspend Off
    RGB color display
    First detailed timing is the preferred timing
  Color Characteristics:
    Red  : 0.6201, 0.3300
    Green: 0.2900, 0.5898
    Blue : 0.1396, 0.1103
    White: 0.2998, 0.3300
  Established Timings I & II:
    DMT 0x10:  1024x768    60.003840 Hz   4:3     48.363 kHz     65.000000 MHz
  Standard Timings:
    DMT 0x23:  1280x1024   60.019740 Hz   5:4     63.981 kHz    108.000000 MHz
    DMT 0x20:  1280x960    60.000000 Hz   4:3     60.000 kHz    108.000000 MHz
    DMT 0x1c:  1280x800    59.810326 Hz  16:10    49.702 kHz     83.500000 MHz
    DMT 0x2f:  1440x900    59.887445 Hz  16:10    55.935 kHz    106.500000 MHz
  Detailed Timing Descriptors:
    DTD 1:  1024x768    60.003840 Hz   4:3     48.363 kHz     65.000000 MHz (256 mm x 192 mm)
                 Hfront   24 Hsync 136 Hback  160 Hpol N
                 Vfront    3 Vsync   6 Vback   29 Vpol N
    DTD 2:  1920x1080   60.000000 Hz  16:9     67.500 kHz    148.500000 MHz (477 mm x 268 mm)
                 Hfront   88 Hsync  44 Hback  148 Hpol P
                 Vfront    4 Vsync   5 Vback   36 Vpol P
    DTD 3:  1360x768    60.015162 Hz  85:48    47.712 kHz     85.500000 MHz (818 mm x 1073 mm)
                 Hfront   64 Hsync 112 Hback  256 Hpol P
                 Vfront    3 Vsync   6 Vback   18 Vpol P
    Standard Timing Identifications:
      DMT 0x25:  1280x1024   85.024098 Hz   5:4     91.146 kHz    157.500000 MHz
      DMT 0x55:  1280x720    60.000000 Hz  16:9     45.000 kHz     74.250000 MHz
      GTF     :  1280x720   119.999881 Hz  16:9     92.640 kHz    161.564000 MHz
      DMT 0x30:  1440x900    74.984427 Hz  16:10    70.635 kHz    136.750000 MHz
  Extension blocks: 1
Checksum: 0xb5

----------------

Block 1, CTA-861 Extension Block:
  Revision: 3
  Underscans IT Video Formats by default
  Basic audio support
  Native detailed modes: 1
  Audio Data Block:
    Linear PCM:
      Max channels: 2
      Supported sample rates (kHz): 48
      Supported sample sizes (bits): 20 16
  Speaker Allocation Data Block:
    FL/FR - Front Left/Right
  Vendor-Specific Data Block (HDMI), OUI 00-0C-03:
    Source physical address: 2.0.0.0
    Supports_AI
    Maximum TMDS clock: 225 MHz
  Video Data Block:
    VIC   4:  1280x720    60.000000 Hz  16:9     45.000 kHz     74.250000 MHz
    VIC   4:  1280x720    60.000000 Hz  16:9     45.000 kHz     74.250000 MHz
    VIC   2:   720x480    59.940060 Hz   4:3     31.469 kHz     27.000000 MHz
  Video Capability Data Block:
    YCbCr quantization: No Data
    RGB quantization: No Data
    PT scan behavior: No Data
    IT scan behavior: Supports both over- and underscan
    CE scan behavior: Supports both over- and underscan
  Detailed Timing Descriptors:
    DTD 4:   720x480    59.940060 Hz   3:2     31.469 kHz     27.000000 MHz (analog composite, sync-on-green, 160 mm x 90 mm)
                 Hfront   16 Hsync  62 Hback   60 Hpol N
                 Vfront    9 Vsync   6 Vback   30 Vpol N
Checksum: 0xdc  Unused space in Extension Block: 82 bytes

----------------

Block 2, Unknown EDID Extension Block 0x00:
  00 ff ff ff ff ff ff 00 31 cb 01 00 53 14 03 00 '........1...S...'
  2e 1c 01 03 a0 1e 17 61 ea e4 de 9e 54 4a 97 23 '.......a....TJ.#'
  1c 4c 54 00 08 00 81 80 81 40 81 00 01 01 95 00 '.LT......@......'
  01 01 01 01 01 01 64 19 00 40 41 00 26 30 18 88 '......d..@A.&0..'
  36 00 00 c0 10 00 00 18 02 3a 80 18 71 38 2d 40 '6........:..q8-@'
  58 2c 45 00 dd 0c 11 00 00 1e 66 21 50 b0 51 00 'X,E.......f!P.Q.'
  1b 30 40 70 36 00 32 31 34 00 00 1e 00 00 00 fa '.0@p6.214.......'
  00 81 99 81 c0 81 fc 01 01 01 01 95 0f 0a 01 b5 '................'
Checksum: 0xb5

----------------

Block 3, CTA-861 Extension Block:
  Revision: 3
  Underscans IT Video Formats by default
  Basic audio support
  Native detailed modes: 1
  Audio Data Block:
    Linear PCM:
      Max channels: 2
      Supported sample rates (kHz): 48
      Supported sample sizes (bits): 20 16
  Speaker Allocation Data Block:
    FL/FR - Front Left/Right
  Vendor-Specific Data Block (HDMI), OUI 00-0C-03:
    Source physical address: 2.0.0.0
    Supports_AI
    Maximum TMDS clock: 225 MHz
  Video Data Block:
    VIC   4:  1280x720    60.000000 Hz  16:9     45.000 kHz     74.250000 MHz
    VIC   4:  1280x720    60.000000 Hz  16:9     45.000 kHz     74.250000 MHz
    VIC   2:   720x480    59.940060 Hz   4:3     31.469 kHz     27.000000 MHz
  Video Capability Data Block:
    YCbCr quantization: No Data
    RGB quantization: No Data
    PT scan behavior: No Data
    IT scan behavior: Supports both over- and underscan
    CE scan behavior: Supports both over- and underscan
  Detailed Timing Descriptors:
    DTD 5:   720x480    59.940060 Hz   3:2     31.469 kHz     27.000000 MHz (analog composite, sync-on-green, 160 mm x 90 mm)
                 Hfront   16 Hsync  62 Hback   60 Hpol N
                 Vfront    9 Vsync   6 Vback   30 Vpol N
Checksum: 0xdc  Unused space in Extension Block: 82 bytes

----------------

Warnings:

Block 0, Base EDID:
  Detailed Timing Descriptor #2: DTD is identical to VIC 16, which is not present in the CTA Ext Block.
  Detailed Timing Descriptor #3: Image size is 818x1073 mm, but based on the picture AR it should be 818x461 mm.
Block 1, CTA-861 Extension Block:
  Video Data Block: VIC 4 and the first DTD are not identical. Is this intended?
  Detailed Timing Descriptor #4: Dubious image size (160x90 mm is smaller than 100x100 mm).
  Add a Colorimetry Data Block with the sRGB colorimetry bit set to avoid interop issues.
Block 3, CTA-861 Extension Block:
  Detailed Timing Descriptor #5: Dubious image size (160x90 mm is smaller than 100x100 mm).

Failures:

Block 0, Base EDID:
  Basic Display Parameters & Features: Digital Video Interface Standard set to reserved value 0x20.
  Detailed Timing Descriptor #1: Mismatch of image size 256x192 mm vs display size 300x230 mm.
  Detailed Timing Descriptor #2: Mismatch of image size 477x268 mm vs display size 300x230 mm.
  Detailed Timing Descriptor #3: Mismatch of image size 818x1073 mm vs display size 300x230 mm.
  Missing Display Product Name.
  Missing Display Range Limits Descriptor.
Block 1, CTA-861 Extension Block:
  Video Data Block: Duplicate VIC 4.
  Video Capability Data Block: Set Selectable RGB Quantization to avoid interop issues.
  Detailed Timing Descriptor #4: Mismatch of image size 160x90 mm vs display size 300x230 mm.
  Required 640x480p60 timings are missing in the established timings and the SVD list (VIC 1).
Block 2, Base EDID:
  Unknown Extension Block.
Block 3, CTA-861 Extension Block:
  Speaker Allocation Data Block: Only one instance of this Data Block is allowed.
  Video Data Block: Duplicate VIC 2.
  Video Capability Data Block: Only one instance of this Data Block is allowed.
  Video Capability Data Block: Set Selectable RGB Quantization to avoid interop issues.
  Detailed Timing Descriptor #5: Mismatch of image size 160x90 mm vs display size 300x230 mm.
EDID:
  Base EDID: The DTD max image size is 818x1073mm, which is larger than the display size 300.0x230.0mm.
  Base EDID: EDID specified 1 extension block(s), but found 3 extension block(s).
  Base EDID: EDID 1.3 requires a Block Map Extension in Block 1 if there are more than 2 blocks in the EDID.

EDID conformity: FAIL
