edid-decode (hex):

00 ff ff ff ff ff ff 00 4c f4 00 17 0a 1a 00 00
01 21 01 03 80 26 15 00 8a 00 00 00 00 00 00 00
00 00 00 af cf 00 01 01 01 01 01 01 01 01 01 01
01 01 01 01 01 01 30 2a 00 98 51 00 2a 40 30 70
16 00 7b d5 10 00 00 1e 0e 1f 00 80 51 00 20 30
40 80 37 00 20 56 00 00 00 1c 00 00 00 10 00 0a
0a 0a 0a 0a 0a 0a 0a 0a 0a 0a 0a 0a 00 00 00 fc
00 0a 20 20 20 20 20 20 20 20 20 20 20 20 00 c2

00 ff ff ff ff ff ff 00 4c f4 00 17 0a 1a 00 00
01 21 01 03 80 26 15 00 8a 00 00 00 00 00 00 00
00 00 00 af cf 00 01 01 01 01 01 01 01 01 01 01
01 01 01 01 01 01 30 2a 00 98 51 00 2a 40 30 70
16 00 7b d5 10 00 00 1e 0e 1f 00 80 51 00 20 30
40 80 37 00 20 56 00 00 00 1c 00 00 00 10 00 0a
0a 0a 0a 0a 0a 0a 0a 0a 0a 0a 0a 0a 00 00 00 fc
00 0a 20 20 20 20 20 20 20 20 20 20 20 20 00 c2

----------------

Block 0, Base EDID:
  EDID Structure Version & Revision: 1.3
  Vendor & Product Identification:
    Manufacturer: SGT
    Model: 5888
    Serial Number: ...
    Made in: week 1 of 2023
  Basic Display Parameters & Features:
    Digital display
    Maximum image size: 38 cm x 21 cm
    Gamma: 1.00
    DPMS levels: Standby
    RGB color display
    First detailed timing is the preferred timing
  Color Characteristics:
    Red  : 0.0000, 0.0000
    Green: 0.0000, 0.0000
    Blue : 0.0000, 0.0000
    White: 0.0000, 0.0000
  Established Timings I & II:
    IBM     :   720x400    70.081663 Hz   9:5     31.467 kHz     28.320000 MHz
    DMT 0x04:   640x480    59.940476 Hz   4:3     31.469 kHz     25.175000 MHz
    DMT 0x05:   640x480    72.808802 Hz   4:3     37.861 kHz     31.500000 MHz
    DMT 0x06:   640x480    75.000000 Hz   4:3     37.500 kHz     31.500000 MHz
    DMT 0x08:   800x600    56.250000 Hz   4:3     35.156 kHz     36.000000 MHz
    DMT 0x09:   800x600    60.316541 Hz   4:3     37.879 kHz     40.000000 MHz
    DMT 0x0a:   800x600    72.187572 Hz   4:3     48.077 kHz     50.000000 MHz
    DMT 0x0b:   800x600    75.000000 Hz   4:3     46.875 kHz     49.500000 MHz
    DMT 0x10:  1024x768    60.003840 Hz   4:3     48.363 kHz     65.000000 MHz
    DMT 0x11:  1024x768    70.069359 Hz   4:3     56.476 kHz     75.000000 MHz
    DMT 0x12:  1024x768    75.028582 Hz   4:3     60.023 kHz     78.750000 MHz
    DMT 0x24:  1280x1024   75.024675 Hz   5:4     79.976 kHz    135.000000 MHz
  Standard Timings: none
  Detailed Timing Descriptors:
    DTD 1:  1280x1024   60.019740 Hz   5:4     63.981 kHz    108.000000 MHz (379 mm x 213 mm)
                 Hfront   48 Hsync 112 Hback  248 Hpol P
                 Vfront    1 Vsync   6 Vback   35 Vpol P
    DTD 2:  1280x768    59.720553 Hz   5:3     47.776 kHz     79.500000 MHz (32 mm x 86 mm)
                 Hfront   64 Hsync 128 Hback  192 Hpol N
                 Vfront    3 Vsync   7 Vback   22 Vpol P
    Dummy Descriptor:
    Display Product Name: ''
Checksum: 0xc2

----------------

Warnings:

Block 0, Base EDID:
  Vendor & Product Identification: The serial number is one of the known dummy values, it should probably be set to 0.
  Detailed Timing Descriptor #1: DTD is similar but not identical to DMT 0x23.
  Detailed Timing Descriptor #1: Image size is 379x213 mm, but based on the picture AR it should be 266x213 mm.
  Detailed Timing Descriptor #2: Dubious image size (32x86 mm is smaller than 100x100 mm).

Failures:

Block 0, Base EDID:
  Detailed Timing Descriptor #2: Mismatch of image size 32x86 mm vs display size 380x210 mm.
  Dummy Descriptor: Dummy block filled with garbage.
  Display Product Name: Empty string.
  Missing Display Range Limits Descriptor.
EDID:
  Extension Block 1 started with EDID header, ignoring Extension Blocks >= 1.

EDID conformity: FAIL
