edid-decode (hex):

00 ff ff ff ff ff ff 00 31 e5 10 6c 01 01 01 01
00 ff 01 03 80 59 32 78 0a 0d c9 a0 57 47 98 27
12 48 4c 01 08 00 b3 00 81 80 81 00 01 01 01 01
01 01 01 01 01 01 01 1d 80 d0 72 1c 16 20 10 2c
25 80 bc 8a 21 00 00 9e 01 1d 00 bc 52 d0 1e 20
b8 28 55 40 bc 8a 21 00 00 1e 00 00 00 fc 00 4c
4f 45 57 45 20 48 44 4d 49 20 54 56 00 00 00 fd
00 30 3e 0f 46 16 00 0a 20 20 20 20 20 20 01 ae

02 03 2e 71 4e 9f 14 05 13 11 04 02 10 20 15 03
07 12 16 23 15 07 07 23 3d 07 07 23 09 07 07 83
01 00 00 6a 03 0c 00 20 00 b8 2c 20 80 00 02 3a
80 d0 72 38 2d 40 10 2c 45 80 c4 8e 21 00 00 1e
01 1d 80 d0 72 1c 16 20 10 2c 25 80 c4 8e 21 00
00 9e 01 1d 80 18 71 1c 16 20 58 2c 25 00 c4 8e
21 00 00 9e 01 1d 00 bc 52 d0 1e 20 b8 28 55 40
c4 8e 21 00 00 18 00 00 00 00 00 00 00 00 00 60

----------------

Block 0, Base EDID:
  EDID Structure Version & Revision: 1.3
  Vendor & Product Identification:
    Manufacturer: LOE
    Model: 27664
    Serial Number: ...
    Made in: 2245
  Basic Display Parameters & Features:
    Digital display
    Maximum image size: 89 cm x 50 cm
    Gamma: 2.20
    RGB color display
    First detailed timing is the preferred timing
  Color Characteristics:
    Red  : 0.6250, 0.3398
    Green: 0.2802, 0.5947
    Blue : 0.1552, 0.0703
    White: 0.2832, 0.2978
  Established Timings I & II:
    DMT 0x09:   800x600    60.316541 Hz   4:3     37.879 kHz     40.000000 MHz
    DMT 0x10:  1024x768    60.003840 Hz   4:3     48.363 kHz     65.000000 MHz
  Standard Timings:
    DMT 0x3a:  1680x1050   59.954250 Hz  16:10    65.290 kHz    146.250000 MHz
    DMT 0x23:  1280x1024   60.019740 Hz   5:4     63.981 kHz    108.000000 MHz
    DMT 0x1c:  1280x800    59.810326 Hz  16:10    49.702 kHz     83.500000 MHz
  Detailed Timing Descriptors:
    DTD 1:  1920x1080i  50.000000 Hz  16:9     28.125 kHz     74.250000 MHz (700 mm x 394 mm)
                 Hfront  528 Hsync  44 Hback  148 Hpol P
                 Vfront    2 Vsync   5 Vback   15 Vpol P Vfront +0.5 Odd Field
                 Vfront    2 Vsync   5 Vback   15 Vpol P Vback  +0.5 Even Field
    DTD 2:  1280x720    50.000000 Hz  16:9     37.500 kHz     74.250000 MHz (700 mm x 394 mm)
                 Hfront  440 Hsync  40 Hback  220 Hpol P
                 Vfront    5 Vsync   5 Vback   20 Vpol P
    Display Product Name: 'LOEWE HDMI TV'
    Display Range Limits:
      Monitor ranges (GTF): 48-62 Hz V, 15-70 kHz H, max dotclock 220 MHz
  Extension blocks: 1
Checksum: 0xae

----------------

Block 1, CTA-861 Extension Block:
  Revision: 3
  Basic audio support
  Supports YCbCr 4:4:4
  Supports YCbCr 4:2:2
  Native detailed modes: 1
  Video Data Block:
    VIC  31:  1920x1080   50.000000 Hz  16:9     56.250 kHz    148.500000 MHz (native)
    VIC  20:  1920x1080i  50.000000 Hz  16:9     28.125 kHz     74.250000 MHz
    VIC   5:  1920x1080i  60.000000 Hz  16:9     33.750 kHz     74.250000 MHz
    VIC  19:  1280x720    50.000000 Hz  16:9     37.500 kHz     74.250000 MHz
    VIC  17:   720x576    50.000000 Hz   4:3     31.250 kHz     27.000000 MHz
    VIC   4:  1280x720    60.000000 Hz  16:9     45.000 kHz     74.250000 MHz
    VIC   2:   720x480    59.940060 Hz   4:3     31.469 kHz     27.000000 MHz
    VIC  16:  1920x1080   60.000000 Hz  16:9     67.500 kHz    148.500000 MHz
    VIC  32:  1920x1080   24.000000 Hz  16:9     27.000 kHz     74.250000 MHz
    VIC  21:  1440x576i   50.000000 Hz   4:3     15.625 kHz     27.000000 MHz
    VIC   3:   720x480    59.940060 Hz  16:9     31.469 kHz     27.000000 MHz
    VIC   7:  1440x480i   59.940060 Hz  16:9     15.734 kHz     27.000000 MHz
    VIC  18:   720x576    50.000000 Hz  16:9     31.250 kHz     27.000000 MHz
    VIC  22:  1440x576i   50.000000 Hz  16:9     15.625 kHz     27.000000 MHz
  Audio Data Block:
    AC-3:
      Max channels: 6
      Supported sample rates (kHz): 48 44.1 32
      Maximum bit rate: 56 kb/s
  Audio Data Block:
    DTS:
      Max channels: 6
      Supported sample rates (kHz): 48 44.1 32
      Maximum bit rate: 56 kb/s
  Audio Data Block:
    Linear PCM:
      Max channels: 2
      Supported sample rates (kHz): 48 44.1 32
      Supported sample sizes (bits): 24 20 16
  Speaker Allocation Data Block:
    FL/FR - Front Left/Right
  Vendor-Specific Data Block (HDMI), OUI 00-0C-03:
    Source physical address: 2.0.0.0
    Supports_AI
    DC_36bit
    DC_30bit
    DC_Y444
    Maximum TMDS clock: 220 MHz
    Extended HDMI video details:
      3D present
  Detailed Timing Descriptors:
    DTD 3:  1920x1080   50.000000 Hz  16:9     56.250 kHz    148.500000 MHz (708 mm x 398 mm)
                 Hfront  528 Hsync  44 Hback  148 Hpol P
                 Vfront    4 Vsync   5 Vback   36 Vpol P
    DTD 4:  1920x1080i  50.000000 Hz  16:9     28.125 kHz     74.250000 MHz (708 mm x 398 mm)
                 Hfront  528 Hsync  44 Hback  148 Hpol P
                 Vfront    2 Vsync   5 Vback   15 Vpol P Vfront +0.5 Odd Field
                 Vfront    2 Vsync   5 Vback   15 Vpol P Vback  +0.5 Even Field
    DTD 5:  1920x1080i  60.000000 Hz  16:9     33.750 kHz     74.250000 MHz (708 mm x 398 mm)
                 Hfront   88 Hsync  44 Hback  148 Hpol P
                 Vfront    2 Vsync   5 Vback   15 Vpol P Vfront +0.5 Odd Field
                 Vfront    2 Vsync   5 Vback   15 Vpol P Vback  +0.5 Even Field
    DTD 6:  1280x720    50.000000 Hz  16:9     37.500 kHz     74.250000 MHz (708 mm x 398 mm)
                 Hfront  440 Hsync  40 Hback  220 Hpol N
                 Vfront    5 Vsync   5 Vback   20 Vpol N
Checksum: 0x60  Unused space in Extension Block: 9 bytes

----------------

Warnings:

Block 0, Base EDID:
  Vendor & Product Identification: The serial number is one of the known dummy values, it should probably be set to 0.
Block 1, CTA-861 Extension Block:
  IT Video Formats are overscanned by default, but normally this should be underscanned.
  Video Data Block: VIC 31 and the first DTD are not identical. Is this intended?
  Detailed Timing Descriptor #6: DTD is similar but not identical to VIC 19.
  Add a Colorimetry Data Block with the sRGB colorimetry bit set to avoid interop issues.
EDID:
  Base EDID: Some timings are out of range of the Monitor Ranges:
    Vertical Freq: 24.000 - 60.317 Hz (Monitor: 48.000 - 62.000 Hz)

Failures:

Block 0, Base EDID:
  Vendor & Product Identification: The year is more than one year in the future.
  Detailed Timing Descriptor #1: Mismatch of image size 700x394 mm vs display size 890x500 mm.
  Detailed Timing Descriptor #2: Mismatch of image size 700x394 mm vs display size 890x500 mm.
Block 1, CTA-861 Extension Block:
  Detailed Timing Descriptor #3: Mismatch of image size 708x398 mm vs display size 890x500 mm.
  Detailed Timing Descriptor #4: Mismatch of image size 708x398 mm vs display size 890x500 mm.
  Detailed Timing Descriptor #5: Mismatch of image size 708x398 mm vs display size 890x500 mm.
  Detailed Timing Descriptor #6: Mismatch of image size 708x398 mm vs display size 890x500 mm.
  Required 640x480p60 timings are missing in the established timings and the SVD list (VIC 1).
  Missing VCDB, needed for Set Selectable RGB Quantization to avoid interop issues.

EDID conformity: FAIL
