edid-decode (hex):

00 ff ff ff ff ff ff 00 08 59 91 24 01 01 01 01
0f 1e 01 03 80 30 1b 78 0a f2 4d 9f 56 4e 99 28
16 47 4a ad cf 00 71 4f 81 40 81 80 81 00 95 00
b3 00 d1 c0 81 c0 66 21 56 aa 51 00 1e 30 46 8f
33 00 7e 8a 42 00 00 1e 01 1d 00 72 51 d0 1e 20
6e 28 55 00 09 25 21 00 00 1e 00 00 00 fc 00 4e
53 32 34 44 46 33 31 30 4e 41 32 31 00 00 00 fd
00 17 4c 0f 51 0f 00 0a 20 20 20 20 20 20 01 61

02 03 23 f1 4a 10 22 20 20 04 02 01 01 03 01 29
09 07 07 09 07 07 09 07 07 66 03 0c 00 10 00 80
e2 00 0f 02 3a 80 18 71 38 2d 40 58 2c 45 00 09
25 21 00 00 1e 01 1d 00 72 51 d0 1e 20 6e 28 55
00 09 25 21 00 00 1e 01 1d 00 72 51 d0 1e 20 6e
28 55 00 09 25 21 00 00 00 66 21 50 b0 51 00 1b
30 40 70 36 00 09 25 21 00 00 18 00 00 00 00 00
00 00 00 00 00 00 00 00 00 00 00 00 00 00 00 bb

00 ff ff ff ff ff ff 00 08 59 91 24 01 01 01 01
0f 1e 01 03 80 30 1b 78 0a f2 4d 9f 56 4e 99 28
16 47 4a ad cf 00 71 4f 81 40 81 80 81 00 95 00
b3 00 d1 c0 81 c0 66 21 56 aa 51 00 1e 30 46 8f
33 00 7e 8a 42 00 00 1e 01 1d 00 72 51 d0 1e 20
6e 28 55 00 09 25 21 00 00 1e 00 00 00 fc 00 4e
53 32 34 44 46 33 31 30 4e 41 32 31 00 00 00 fd
00 17 4c 0f 51 0f 00 0a 20 20 20 20 20 20 01 61

02 03 23 f1 4a 10 22 20 20 04 02 01 01 03 01 29
09 07 07 09 07 07 09 07 07 66 03 0c 00 10 00 80
e2 00 0f 02 3a 80 18 71 38 2d 40 58 2c 45 00 09
25 21 00 00 1e 01 1d 00 72 51 d0 1e 20 6e 28 55
00 09 25 21 00 00 1e 01 1d 00 72 51 d0 1e 20 6e
28 55 00 09 25 21 00 00 00 66 21 50 b0 51 00 1b
30 40 70 36 00 09 25 21 00 00 18 00 00 00 00 00
00 00 00 00 00 00 00 00 00 00 00 00 00 00 00 bb

----------------

Block 0, Base EDID:
  EDID Structure Version & Revision: 1.3
  Vendor & Product Identification:
    Manufacturer: BBY
    Model: 9361
    Serial Number: ...
    Made in: week 15 of 2020
  Basic Display Parameters & Features:
    Digital display
    Maximum image size: 48 cm x 27 cm
    Gamma: 2.20
    RGB color display
    First detailed timing is the preferred timing
  Color Characteristics:
    Red  : 0.6240, 0.3388
    Green: 0.3046, 0.5996
    Blue : 0.1572, 0.0859
    White: 0.2802, 0.2900
  Established Timings I & II:
    IBM     :   720x400    70.081663 Hz   9:5     31.467 kHz     28.320000 MHz
    DMT 0x04:   640x480    59.940476 Hz   4:3     31.469 kHz     25.175000 MHz
    DMT 0x05:   640x480    72.808802 Hz   4:3     37.861 kHz     31.500000 MHz
    DMT 0x06:   640x480    75.000000 Hz   4:3     37.500 kHz     31.500000 MHz
    DMT 0x09:   800x600    60.316541 Hz   4:3     37.879 kHz     40.000000 MHz
    DMT 0x0a:   800x600    72.187572 Hz   4:3     48.077 kHz     50.000000 MHz
    DMT 0x0b:   800x600    75.000000 Hz   4:3     46.875 kHz     49.500000 MHz
    DMT 0x10:  1024x768    60.003840 Hz   4:3     48.363 kHz     65.000000 MHz
    DMT 0x11:  1024x768    70.069359 Hz   4:3     56.476 kHz     75.000000 MHz
    DMT 0x12:  1024x768    75.028582 Hz   4:3     60.023 kHz     78.750000 MHz
    DMT 0x24:  1280x1024   75.024675 Hz   5:4     79.976 kHz    135.000000 MHz
  Standard Timings:
    DMT 0x15:  1152x864    75.000000 Hz   4:3     67.500 kHz    108.000000 MHz
    DMT 0x20:  1280x960    60.000000 Hz   4:3     60.000 kHz    108.000000 MHz
    DMT 0x23:  1280x1024   60.019740 Hz   5:4     63.981 kHz    108.000000 MHz
    DMT 0x1c:  1280x800    59.810326 Hz  16:10    49.702 kHz     83.500000 MHz
    DMT 0x2f:  1440x900    59.887445 Hz  16:10    55.935 kHz    106.500000 MHz
    DMT 0x3a:  1680x1050   59.954250 Hz  16:10    65.290 kHz    146.250000 MHz
    DMT 0x52:  1920x1080   60.000000 Hz  16:9     67.500 kHz    148.500000 MHz
    DMT 0x55:  1280x720    60.000000 Hz  16:9     45.000 kHz     74.250000 MHz
  Detailed Timing Descriptors:
    DTD 1:  1366x768    59.789541 Hz 683:384   47.712 kHz     85.500000 MHz (1150 mm x 650 mm)
                 Hfront   70 Hsync 143 Hback  213 Hpol P
                 Vfront    3 Vsync   3 Vback   24 Vpol P
    DTD 2:  1280x720    60.000000 Hz  16:9     45.000 kHz     74.250000 MHz (521 mm x 293 mm)
                 Hfront  110 Hsync  40 Hback  220 Hpol P
                 Vfront    5 Vsync   5 Vback   20 Vpol P
    Display Product Name: 'NS24DF310NA21'
    Display Range Limits:
      Monitor ranges (GTF): 23-76 Hz V, 15-81 kHz H, max dotclock 150 MHz
  Extension blocks: 1
Checksum: 0x61

----------------

Block 1, CTA-861 Extension Block:
  Revision: 3
  Underscans IT Video Formats by default
  Basic audio support
  Supports YCbCr 4:4:4
  Supports YCbCr 4:2:2
  Native DTDs: 1
  Video Data Block:
    VIC  16:  1920x1080   60.000000 Hz  16:9     67.500 kHz    148.500000 MHz
    VIC  34:  1920x1080   30.000000 Hz  16:9     33.750 kHz     74.250000 MHz
    VIC  32:  1920x1080   24.000000 Hz  16:9     27.000 kHz     74.250000 MHz
    VIC  32:  1920x1080   24.000000 Hz  16:9     27.000 kHz     74.250000 MHz
    VIC   4:  1280x720    60.000000 Hz  16:9     45.000 kHz     74.250000 MHz
    VIC   2:   720x480    59.940060 Hz   4:3     31.469 kHz     27.000000 MHz
    VIC   1:   640x480    59.940476 Hz   4:3     31.469 kHz     25.175000 MHz
    VIC   1:   640x480    59.940476 Hz   4:3     31.469 kHz     25.175000 MHz
    VIC   3:   720x480    59.940060 Hz  16:9     31.469 kHz     27.000000 MHz
    VIC   1:   640x480    59.940476 Hz   4:3     31.469 kHz     25.175000 MHz
  Audio Data Block:
    Linear PCM:
      Max channels: 2
      Supported sample rates (kHz): 48 44.1 32
      Supported sample sizes (bits): 24 20 16
    Linear PCM:
      Max channels: 2
      Supported sample rates (kHz): 48 44.1 32
      Supported sample sizes (bits): 24 20 16
    Linear PCM:
      Max channels: 2
      Supported sample rates (kHz): 48 44.1 32
      Supported sample sizes (bits): 24 20 16
  Vendor-Specific Data Block (HDMI), OUI 00-0C-03:
    Source physical address: 1.0.0.0
    Supports_AI
  Video Capability Data Block:
    YCbCr quantization: No Data
    RGB quantization: No Data
    PT scan behavior: No Data
    IT scan behavior: Supports both over- and underscan
    CE scan behavior: Supports both over- and underscan
  Detailed Timing Descriptors:
    DTD 3:  1920x1080   60.000000 Hz  16:9     67.500 kHz    148.500000 MHz (521 mm x 293 mm)
                 Hfront   88 Hsync  44 Hback  148 Hpol P
                 Vfront    4 Vsync   5 Vback   36 Vpol P
    DTD 4:  1280x720    60.000000 Hz  16:9     45.000 kHz     74.250000 MHz (521 mm x 293 mm)
                 Hfront  110 Hsync  40 Hback  220 Hpol P
                 Vfront    5 Vsync   5 Vback   20 Vpol P
    DTD 5:  1280x720    60.000000 Hz  16:9     45.000 kHz     74.250000 MHz (analog composite, sync-on-green, 521 mm x 293 mm)
                 Hfront  110 Hsync  40 Hback  220 Hpol N
                 Vfront    5 Vsync   5 Vback   20 Vpol N
    DTD 6:  1360x768    60.015162 Hz  85:48    47.712 kHz     85.500000 MHz (521 mm x 293 mm)
                 Hfront   64 Hsync 112 Hback  256 Hpol N
                 Vfront    3 Vsync   6 Vback   18 Vpol N
Checksum: 0xbb  Unused space in Extension Block: 20 bytes

----------------

Warnings:

Block 0, Base EDID:
  Vendor & Product Identification: The serial number is one of the known dummy values, it should probably be set to 0.
Block 1, CTA-861 Extension Block:
  Video Data Block: VIC 16 and the first DTD are not identical. Is this intended?
  Video Capability Data Block: Set Selectable YCbCr Quantization to avoid interop issues.
  Detailed Timing Descriptor #5: DTD is similar but not identical to VIC 4.
  Detailed Timing Descriptor #6: DTD is similar but not identical to DMT 0x27.
  Add a Colorimetry Data Block with the sRGB colorimetry bit set to avoid interop issues.
EDID:
  CTA-861: Native progressive resolution of 1366x768 is smaller than the max preferred progressive resolution 1920x1080.

Failures:

Block 0, Base EDID:
  Detailed Timing Descriptor #1: Mismatch of image size 1150x650 mm vs display size 480x270 mm.
  Detailed Timing Descriptor #2: Mismatch of image size 521x293 mm vs display size 480x270 mm.
Block 1, CTA-861 Extension Block:
  Video Data Block: Duplicate VIC 32.
  Video Data Block: Duplicate VIC 1.
  Video Capability Data Block: Set Selectable RGB Quantization to avoid interop issues.
  Detailed Timing Descriptor #3: Mismatch of image size 521x293 mm vs display size 480x270 mm.
  Detailed Timing Descriptor #4: Mismatch of image size 521x293 mm vs display size 480x270 mm.
  Detailed Timing Descriptor #5: Mismatch of image size 521x293 mm vs display size 480x270 mm.
  Detailed Timing Descriptor #6: Mismatch of image size 521x293 mm vs display size 480x270 mm.
EDID:
  Extension Block 2 started with EDID header, ignoring Extension Blocks >= 2.
  Base EDID: The DTD max image size is 1150x650mm, which is larger than the display size 480.0x270.0mm.

EDID conformity: FAIL
