edid-decode (hex):

00 ff ff ff ff ff ff 00 22 0e 2f 40 01 00 00 00
01 1d 01 03 81 30 1b 78 ea 64 b5 ab 52 38 ab 25
13 50 54 00 00 00 01 01 01 01 01 01 01 01 01 01
01 01 01 01 01 01 9e 37 80 b4 70 38 32 40 2c 2c
45 00 dc 0c 11 00 00 1c 00 00 00 10 00 00 00 00
00 00 00 00 00 00 00 00 00 00 00 00 00 fc 00 48
50 20 41 4c 4c 2d 69 6e 2d 4f 6e 65 00 00 00 ff
00 54 32 31 35 48 56 4e 30 35 2e 31 0a 20 00 a7

00 ff ff ff ff ff ff 00 22 0e 2f 40 01 00 00 00
01 1d 01 03 81 30 1b 78 ea 64 b5 ab 52 38 ab 25
13 50 54 00 00 00 01 01 01 01 01 01 01 01 01 01
01 01 01 01 01 01 9e 37 80 b4 70 38 32 40 2c 2c
45 00 dc 0c 11 00 00 1c 00 00 00 10 00 00 00 00
00 00 00 00 00 00 00 00 00 00 00 00 00 fc 00 48
50 20 41 4c 4c 2d 69 6e 2d 4f 6e 65 00 00 00 ff
00 54 32 31 35 48 56 4e 30 35 2e 31 0a 20 00 a7

----------------

Block 0, Base EDID:
  EDID Structure Version & Revision: 1.3
  Vendor & Product Identification:
    Manufacturer: HPN
    Model: 16431
    Serial Number: ...
    Made in: week 1 of 2019
  Basic Display Parameters & Features:
    Digital display
    DFP 1.x compatible TMDS
    Maximum image size: 48 cm x 27 cm
    Gamma: 2.20
    DPMS levels: Standby Suspend Off
    RGB color display
    First detailed timing is the preferred timing
  Color Characteristics:
    Red  : 0.6689, 0.3222
    Green: 0.2197, 0.6679
    Blue : 0.1464, 0.0771
    White: 0.3134, 0.3291
  Established Timings I & II: none
  Standard Timings: none
  Detailed Timing Descriptors:
    DTD 1:  1920x1080   60.000000 Hz  16:9     67.800 kHz    142.380000 MHz (476 mm x 268 mm)
                 Hfront   44 Hsync  44 Hback   92 Hpol N
                 Vfront    4 Vsync   5 Vback   41 Vpol P
    Dummy Descriptor:
    Display Product Name: 'HP ALL-in-One'
    Display Product Serial Number: ...
Checksum: 0xa7

----------------

Warnings:

Block 0, Base EDID:
  Vendor & Product Identification: The serial number is one of the known dummy values, it should probably be set to 0.

Failures:

Block 0, Base EDID:
  Missing Display Range Limits Descriptor.
EDID:
  Extension Block 1 started with EDID header, ignoring Extension Blocks >= 1.

EDID conformity: FAIL
