edid-decode (hex):

00 ff ff ff ff ff ff 00 30 ae e6 40 00 00 00 00
00 19 01 04 95 1c 10 78 ea 16 85 95 59 58 96 28
1d 50 54 00 00 00 01 01 01 01 01 01 01 01 01 01
01 01 01 01 01 01 14 37 80 b8 70 38 24 40 10 10
3e 00 14 9b 10 00 00 18 14 37 80 b8 70 38 24 40
10 10 3e 00 14 9b 10 00 00 18 00 00 00 0f 00 d1
09 3c d1 09 3c 1e 0a 00 06 af 6d 22 00 00 00 fe
00 42 31 32 35 48 41 4e 30 32 2e 32 20 0a 00 87

00 ff ff ff ff ff ff 00 30 ae e6 40 00 00 00 00
00 19 01 04 95 1c 10 78 ea 16 85 95 59 58 96 28
1d 50 54 00 00 00 01 01 01 01 01 01 01 01 01 01
01 01 01 01 01 01 14 37 80 b8 70 38 24 40 10 10
3e 00 14 9b 10 00 00 18 14 37 80 b8 70 38 24 40
10 10 3e 00 14 9b 10 00 00 18 00 00 00 0f 00 d1
09 3c d1 09 3c 1e 0a 00 06 af 6d 22 00 00 00 fe
00 42 31 32 35 48 41 4e 30 32 2e 32 20 0a 00 87

----------------

Block 0, Base EDID:
  EDID Structure Version & Revision: 1.4
  Vendor & Product Identification:
    Manufacturer: LEN
    Model: 16614
    Made in: 2015
  Basic Display Parameters & Features:
    Digital display
    Bits per primary color channel: 6
    DisplayPort interface
    Maximum image size: 28 cm x 16 cm
    Gamma: 2.20
    DPMS levels: Standby Suspend Off
    Supported color formats: RGB 4:4:4, YCrCb 4:4:4
    First detailed timing includes the native pixel format and preferred refresh rate
  Color Characteristics:
    Red  : 0.5820, 0.3486
    Green: 0.3447, 0.5878
    Blue : 0.1582, 0.1132
    White: 0.3134, 0.3291
  Established Timings I & II: none
  Standard Timings: none
  Detailed Timing Descriptors:
    DTD 1:  1920x1080   60.049471 Hz  16:9     67.015 kHz    141.000000 MHz (276 mm x 155 mm)
                 Hfront   16 Hsync  16 Hback  152 Hpol N
                 Vfront    3 Vsync  14 Vback   19 Vpol N
    DTD 2:  1920x1080   60.049471 Hz  16:9     67.015 kHz    141.000000 MHz (276 mm x 155 mm)
                 Hfront   16 Hsync  16 Hback  152 Hpol N
                 Vfront    3 Vsync  14 Vback   19 Vpol N
    Manufacturer-Specified Display Descriptor (0x0f): 00 0f 00 d1 09 3c d1 09 3c 1e 0a 00 06 af 6d 22 '.....<..<.....m"'
    Alphanumeric Data String: 'B125HAN02.2 '
Checksum: 0x87

----------------

Warnings:

Block 0, Base EDID:
  Missing Display Product Name.

Failures:

Block 0, Base EDID:
  Alphanumeric Data String: One or more trailing spaces before newline.
EDID:
  Extension Block 1 started with EDID header, ignoring Extension Blocks >= 1.

EDID conformity: FAIL
