edid-decode (hex):

00 ff ff ff ff ff ff 00 30 ae e6 40 00 00 00 00
00 19 01 04 a5 1c 10 78 e2 5d 45 96 58 52 98 27
26 50 54 00 00 00 01 01 01 01 01 01 01 01 01 01
01 01 01 01 01 01 36 36 80 a0 70 38 20 40 2e 1e
24 00 14 9b 10 00 00 1a 36 36 80 a0 70 38 20 40
2e 1e 24 00 14 9b 10 00 00 1a 00 00 00 0f 00 d1
09 3c d1 09 3c 1e 0a 00 0d ae 39 12 00 00 00 fe
00 4e 31 32 35 48 43 45 2d 47 4e 31 0a 20 00 4a

00 ff ff ff ff ff ff 00 30 ae e6 40 00 00 00 00
00 19 01 04 a5 1c 10 78 e2 5d 45 96 58 52 98 27
26 50 54 00 00 00 01 01 01 01 01 01 01 01 01 01
01 01 01 01 01 01 36 36 80 a0 70 38 20 40 2e 1e
24 00 14 9b 10 00 00 1a 36 36 80 a0 70 38 20 40
2e 1e 24 00 14 9b 10 00 00 1a 00 00 00 0f 00 d1
09 3c d1 09 3c 1e 0a 00 0d ae 39 12 00 00 00 fe
00 4e 31 32 35 48 43 45 2d 47 4e 31 0a 20 00 4a

----------------

Block 0, Base EDID:
  EDID Structure Version & Revision: 1.4
  Vendor & Product Identification:
    Manufacturer: LEN
    Model: 16614
    Made in: 2015
  Basic Display Parameters & Features:
    Digital display
    Bits per primary color channel: 8
    DisplayPort interface
    Maximum image size: 28 cm x 16 cm
    Gamma: 2.20
    DPMS levels: Standby Suspend Off
    Supported color formats: RGB 4:4:4
    First detailed timing includes the native pixel format and preferred refresh rate
  Color Characteristics:
    Red  : 0.5869, 0.3447
    Green: 0.3232, 0.5947
    Blue : 0.1533, 0.1484
    White: 0.3134, 0.3291
  Established Timings I & II: none
  Standard Timings: none
  Detailed Timing Descriptors:
    DTD 1:  1920x1080   60.001038 Hz  16:9     66.721 kHz    138.780000 MHz (276 mm x 155 mm)
                 Hfront   46 Hsync  30 Hback   84 Hpol P
                 Vfront    2 Vsync   4 Vback   26 Vpol N
    DTD 2:  1920x1080   60.001038 Hz  16:9     66.721 kHz    138.780000 MHz (276 mm x 155 mm)
                 Hfront   46 Hsync  30 Hback   84 Hpol P
                 Vfront    2 Vsync   4 Vback   26 Vpol N
    Manufacturer-Specified Display Descriptor (0x0f): 00 0f 00 d1 09 3c d1 09 3c 1e 0a 00 0d ae 39 12 '.....<..<.....9.'
    Alphanumeric Data String: 'N125HCE-GN1'
Checksum: 0x4a

----------------

Warnings:

Block 0, Base EDID:
  Missing Display Product Name.

Failures:

EDID:
  Extension Block 1 started with EDID header, ignoring Extension Blocks >= 1.

EDID conformity: FAIL
