edid-decode (hex):

00 ff ff ff ff ff ff 00 09 e5 bf 09 00 00 00 00
14 1e 01 04 a5 26 15 78 03 ee 95 a3 54 4c 99 26
0f 50 54 00 00 00 01 01 01 01 01 01 01 01 01 01
01 01 01 01 01 01 09 64 00 b0 a0 a0 78 50 30 20
36 00 7e d7 10 00 00 00 00 00 00 fd 0c 3c a5 02
02 46 01 0a 20 20 20 20 20 20 00 00 00 00 00 00
00 00 00 00 00 00 00 00 00 00 00 00 00 00 00 02
00 0d 36 ff 0a 3c 96 32 1a 3d 96 00 00 00 01 27

70 13 79 00 00 03 01 14 19 13 01 84 ff 09 af 00
2f 00 1f 00 9f 05 77 00 02 00 05 00 00 00 00 00
00 00 00 00 00 00 00 00 00 00 00 00 00 00 00 00
00 00 00 00 00 00 00 00 00 00 00 00 00 00 00 00
00 00 00 00 00 00 00 00 00 00 00 00 00 00 00 00
00 00 00 00 00 00 00 00 00 00 00 00 00 00 00 00
00 00 00 00 00 00 00 00 00 00 00 00 00 00 00 00
00 00 00 00 00 00 00 00 00 00 00 00 00 00 84 90

----------------

Block 0, Base EDID:
  EDID Structure Version & Revision: 1.4
  Vendor & Product Identification:
    Manufacturer: BOE
    Model: 2495
    Made in: week 20 of 2020
  Basic Display Parameters & Features:
    Digital display
    Bits per primary color channel: 8
    DisplayPort interface
    Maximum image size: 38 cm x 21 cm
    Gamma: 2.20
    Supported color formats: RGB 4:4:4
    First detailed timing includes the native pixel format and preferred refresh rate
    Display supports continuous frequencies
  Color Characteristics:
    Red  : 0.6396, 0.3300
    Green: 0.2998, 0.5996
    Blue : 0.1503, 0.0595
    White: 0.3134, 0.3291
  Established Timings I & II: none
  Standard Timings: none
  Detailed Timing Descriptors:
    DTD 1:  2560x1440   60.000094 Hz  16:9     93.600 kHz    256.090000 MHz (analog composite, sync-on-green, 382 mm x 215 mm)
                 Hfront   48 Hsync  32 Hback   96 Hpol N
                 Vfront    3 Vsync   6 Vback  111 Vpol N
    Display Range Limits:
      Monitor ranges (Range Limits Only): 60-165 Hz V, 257-257 kHz H, max dotclock 700 MHz
    Empty Descriptor
    Manufacturer-Specified Display Descriptor (0x02): 00 02 00 0d 36 ff 0a 3c 96 32 1a 3d 96 00 00 00 '....6..<.2.=....'
  Extension blocks: 1
Checksum: 0x27

----------------

Block 1, DisplayID Extension Block:
  Version: 1.3
  Extension Count: 0
  Display Product Type: Extension Section
  Video Timing Modes Type 1 - Detailed Timings Data Block:
    DTD:  2560x1440  165.003186 Hz  16:9    257.405 kHz    704.260000 MHz (aspect 16:9, no 3D stereo, preferred)
               Hfront   48 Hsync  32 Hback   96 Hpol N
               Vfront    3 Vsync   6 Vback  111 Vpol N
  Checksum: 0x84
Checksum: 0x90

----------------

Warnings:

Block 0, Base EDID:
  Missing Display Product Name.
EDID:
  Base EDID: Some timings are out of range of the Monitor Ranges:
    Horizontal Freq: 93.600 - 257.404 kHz (Monitor: 257.000 - 257.000 kHz)
    Maximum Clock: 704.260 MHz (Monitor: 700.000 MHz)

Failures:

Block 0, Base EDID:
  Empty Descriptor: Use Dummy Descriptor instead of all zeroes.
Block 1, DisplayID Extension Block:
  DisplayID Base Block has no product type.

EDID conformity: FAIL
