edid-decode (hex):

00 ff ff ff ff ff ff 00 06 b3 31 38 4a 20 02 00
04 1d 01 04 b5 58 25 78 3b a1 95 a9 54 4d 9c 26
0f 50 54 bf ef 00 71 4f 81 40 81 80 81 c0 81 00
95 00 b3 00 d1 c0 1a c2 00 a0 f0 40 3a 60 30 20
c8 08 70 6f 31 00 00 1a 50 9a 00 a0 f0 40 2e 60
08 20 08 08 70 6f 31 00 00 1a 00 00 00 fd 00 34
4b a0 a0 3c 01 0a 20 20 20 20 20 20 00 00 00 fc
00 41 53 55 53 20 4d 58 33 38 56 0a 20 20 01 a7

02 03 23 f1 4e 02 03 11 12 13 04 0e 0f 1d 1e 90
1f 05 14 23 09 07 07 83 01 00 00 67 03 0c 00 10
00 38 78 2d 50 80 a0 70 40 2e 60 30 20 3a 00 70
6f 31 00 00 1a e2 68 00 a0 a0 40 2e 60 30 20 36
00 70 6f 31 00 00 1a 2d 07 80 50 20 5e 0f 10 08
20 18 00 70 6f 31 00 00 18 13 4c 00 a0 f0 40 17
60 30 20 3a 00 70 6f 31 00 00 1a 56 5e 00 a0 a0
a0 29 50 30 20 35 00 70 6f 31 00 00 1e 00 00 8c

00 ff ff ff ff ff ff 00 06 b3 31 38 4a 20 02 00
04 1d 01 04 b5 58 25 78 3b a1 95 a9 54 4d 9c 26
0f 50 54 bf ef 00 71 4f 81 40 81 80 81 c0 81 00
95 00 b3 00 d1 c0 1a c2 00 a0 f0 40 3a 60 30 20
c8 08 70 6f 31 00 00 1a 50 9a 00 a0 f0 40 2e 60
08 20 08 08 70 6f 31 00 00 1a 00 00 00 fd 00 34
4b a0 a0 3c 01 0a 20 20 20 20 20 20 00 00 00 fc
00 41 53 55 53 20 4d 58 33 38 56 0a 20 20 01 a7

02 03 23 f1 4e 02 03 11 12 13 04 0e 0f 1d 1e 90
1f 05 14 23 09 07 07 83 01 00 00 67 03 0c 00 10
00 38 78 2d 50 80 a0 70 40 2e 60 30 20 3a 00 70
6f 31 00 00 1a e2 68 00 a0 a0 40 2e 60 30 20 36
00 70 6f 31 00 00 1a 2d 07 80 50 20 5e 0f 10 08
20 18 00 70 6f 31 00 00 18 13 4c 00 a0 f0 40 17
60 30 20 3a 00 70 6f 31 00 00 1a 56 5e 00 a0 a0
a0 29 50 30 20 35 00 70 6f 31 00 00 1e 00 00 8c

----------------

Block 0, Base EDID:
  EDID Structure Version & Revision: 1.4
  Vendor & Product Identification:
    Manufacturer: AUS
    Model: 14385
    Serial Number: ...
    Made in: week 4 of 2019
  Basic Display Parameters & Features:
    Digital display
    Bits per primary color channel: 10
    DisplayPort interface
    Maximum image size: 88 cm x 37 cm
    Gamma: 2.20
    DPMS levels: Off
    Supported color formats: RGB 4:4:4, YCrCb 4:4:4, YCrCb 4:2:2
    First detailed timing includes the native pixel format and preferred refresh rate
    Display supports continuous frequencies
  Color Characteristics:
    Red  : 0.6621, 0.3300
    Green: 0.3007, 0.6103
    Blue : 0.1503, 0.0595
    White: 0.3134, 0.3291
  Established Timings I & II:
    IBM     :   720x400    70.081663 Hz   9:5     31.467 kHz     28.320000 MHz
    DMT 0x04:   640x480    59.940476 Hz   4:3     31.469 kHz     25.175000 MHz
    Apple   :   640x480    66.666667 Hz   4:3     35.000 kHz     30.240000 MHz
    DMT 0x05:   640x480    72.808802 Hz   4:3     37.861 kHz     31.500000 MHz
    DMT 0x06:   640x480    75.000000 Hz   4:3     37.500 kHz     31.500000 MHz
    DMT 0x08:   800x600    56.250000 Hz   4:3     35.156 kHz     36.000000 MHz
    DMT 0x09:   800x600    60.316541 Hz   4:3     37.879 kHz     40.000000 MHz
    DMT 0x0a:   800x600    72.187572 Hz   4:3     48.077 kHz     50.000000 MHz
    DMT 0x0b:   800x600    75.000000 Hz   4:3     46.875 kHz     49.500000 MHz
    Apple   :   832x624    74.551266 Hz   4:3     49.726 kHz     57.284000 MHz
    DMT 0x10:  1024x768    60.003840 Hz   4:3     48.363 kHz     65.000000 MHz
    DMT 0x11:  1024x768    70.069359 Hz   4:3     56.476 kHz     75.000000 MHz
    DMT 0x12:  1024x768    75.028582 Hz   4:3     60.023 kHz     78.750000 MHz
    DMT 0x24:  1280x1024   75.024675 Hz   5:4     79.976 kHz    135.000000 MHz
  Standard Timings:
    DMT 0x15:  1152x864    75.000000 Hz   4:3     67.500 kHz    108.000000 MHz
    DMT 0x20:  1280x960    60.000000 Hz   4:3     60.000 kHz    108.000000 MHz
    DMT 0x23:  1280x1024   60.019740 Hz   5:4     63.981 kHz    108.000000 MHz
    DMT 0x55:  1280x720    60.000000 Hz  16:9     45.000 kHz     74.250000 MHz
    DMT 0x1c:  1280x800    59.810326 Hz  16:10    49.702 kHz     83.500000 MHz
    DMT 0x2f:  1440x900    59.887445 Hz  16:10    55.935 kHz    106.500000 MHz
    DMT 0x3a:  1680x1050   59.954250 Hz  16:10    65.290 kHz    146.250000 MHz
    DMT 0x52:  1920x1080   60.000000 Hz  16:9     67.500 kHz    148.500000 MHz
  Detailed Timing Descriptors:
    DTD 1:  3840x1600   74.924608 Hz  12:5    124.225 kHz    496.900000 MHz (880 mm x 367 mm)
                 Hfront   48 Hsync  32 Hback   80 Hpol P
                 Vfront   44 Vsync   8 Vback    6 Vpol N
    DTD 2:  3840x1600   60.000000 Hz  12:5     98.760 kHz    395.040000 MHz (880 mm x 367 mm)
                 Hfront    8 Hsync  32 Hback  120 Hpol P
                 Vfront   32 Vsync   8 Vback    6 Vpol N
    Display Range Limits:
      Monitor ranges (Range Limits Only): 52-75 Hz V, 160-160 kHz H, max dotclock 600 MHz
    Display Product Name: 'ASUS MX38V'
  Extension blocks: 1
Checksum: 0xa7

----------------

Block 1, CTA-861 Extension Block:
  Revision: 3
  Underscans IT Video Formats by default
  Basic audio support
  Supports YCbCr 4:4:4
  Supports YCbCr 4:2:2
  Native DTDs: 1
  Video Data Block:
    VIC   2:   720x480    59.940060 Hz   4:3     31.469 kHz     27.000000 MHz
    VIC   3:   720x480    59.940060 Hz  16:9     31.469 kHz     27.000000 MHz
    VIC  17:   720x576    50.000000 Hz   4:3     31.250 kHz     27.000000 MHz
    VIC  18:   720x576    50.000000 Hz  16:9     31.250 kHz     27.000000 MHz
    VIC  19:  1280x720    50.000000 Hz  16:9     37.500 kHz     74.250000 MHz
    VIC   4:  1280x720    60.000000 Hz  16:9     45.000 kHz     74.250000 MHz
    VIC  14:  1440x480    59.940060 Hz   4:3     31.469 kHz     54.000000 MHz
    VIC  15:  1440x480    59.940060 Hz  16:9     31.469 kHz     54.000000 MHz
    VIC  29:  1440x576    50.000000 Hz   4:3     31.250 kHz     54.000000 MHz
    VIC  30:  1440x576    50.000000 Hz  16:9     31.250 kHz     54.000000 MHz
    VIC  16:  1920x1080   60.000000 Hz  16:9     67.500 kHz    148.500000 MHz (native)
    VIC  31:  1920x1080   50.000000 Hz  16:9     56.250 kHz    148.500000 MHz
    VIC   5:  1920x1080i  60.000000 Hz  16:9     33.750 kHz     74.250000 MHz
    VIC  20:  1920x1080i  50.000000 Hz  16:9     28.125 kHz     74.250000 MHz
  Audio Data Block:
    Linear PCM:
      Max channels: 2
      Supported sample rates (kHz): 48 44.1 32
      Supported sample sizes (bits): 24 20 16
  Speaker Allocation Data Block:
    FL/FR - Front Left/Right
  Vendor-Specific Data Block (HDMI), OUI 00-0C-03:
    Source physical address: 1.0.0.0
    DC_36bit
    DC_30bit
    DC_Y444
    Maximum TMDS clock: 600 MHz
  Detailed Timing Descriptors:
    DTD 3:  1920x1600   59.950112 Hz   6:5     98.678 kHz    205.250000 MHz (880 mm x 367 mm)
                 Hfront   48 Hsync  32 Hback   80 Hpol P
                 Vfront    3 Vsync  10 Vback   33 Vpol N
    DTD 4:  2560x1600   59.971589 Hz  16:10    98.713 kHz    268.500000 MHz (880 mm x 367 mm)
                 Hfront   48 Hsync  32 Hback   80 Hpol P
                 Vfront    3 Vsync   6 Vback   37 Vpol N
    DTD 5:   640x350    69.901065 Hz  64:35    25.514 kHz     18.370000 MHz (880 mm x 367 mm)
                 Hfront    8 Hsync  32 Hback   40 Hpol N
                 Vfront    1 Vsync   8 Vback    6 Vpol N
    DTD 6:  3840x1600   29.998460 Hz  12:5     48.688 kHz    194.750000 MHz (880 mm x 367 mm)
                 Hfront   48 Hsync  32 Hback   80 Hpol P
                 Vfront    3 Vsync  10 Vback   10 Vpol N
    DTD 7:  2560x1440   59.950550 Hz  16:9     88.787 kHz    241.500000 MHz (880 mm x 367 mm)
                 Hfront   48 Hsync  32 Hback   80 Hpol P
                 Vfront    3 Vsync   5 Vback   33 Vpol P
Checksum: 0x8c  Unused space in Extension Block: 2 bytes

----------------

Warnings:

Block 1, CTA-861 Extension Block:
  Video Data Block: VIC 2 and the first DTD are not identical. Is this intended?
  Detailed Timing Descriptor #3: Image size is 880x367 mm, but based on the picture AR it should be 440x367 mm.
  Detailed Timing Descriptor #4: Image size is 880x367 mm, but based on the picture AR it should be 587x367 mm.
  Detailed Timing Descriptor #5: Image size is 880x367 mm, but based on the picture AR it should be 671x367 mm.
  Detailed Timing Descriptor #7: Image size is 880x367 mm, but based on the picture AR it should be 652x367 mm.
  Add a Colorimetry Data Block with the sRGB colorimetry bit set to avoid interop issues.
EDID:
  Base EDID: Some timings are out of range of the Monitor Ranges:
    Vertical Freq: 29.998 - 75.029 Hz (Monitor: 52.000 - 75.000 Hz)
    Horizontal Freq: 25.513 - 124.225 kHz (Monitor: 160.000 - 160.000 kHz)

Failures:

Block 1, CTA-861 Extension Block:
  Vendor-Specific Data Block (HDMI), OUI 00-0C-03: HDMI VSDB Max TMDS rate is > 340.
  Vendor-Specific Data Block (HDMI), OUI 00-0C-03: The HDMI Specification requires EDID 1.3 instead of 1.4.
  Missing VCDB, needed for Set Selectable RGB Quantization to avoid interop issues.
EDID:
  Extension Block 2 started with EDID header, ignoring Extension Blocks >= 2.
  CTA-861: Native progressive timings are a mix of several resolutions.

EDID conformity: FAIL
