edid-decode (hex):

00 ff ff ff ff ff ff 00 06 af ec 70 00 00 00 00
16 1a 01 04 95 22 13 78 02 50 25 93 58 57 92 29
22 50 54 00 00 00 01 01 01 01 01 01 01 01 01 01
01 01 01 01 01 01 ce 1d 56 c0 50 00 30 30 08 0a
31 00 58 c1 10 00 00 1a df 13 56 c0 50 00 30 30
08 0a 31 00 58 c1 10 00 00 1a 00 00 00 fe 00 46
4d 54 32 43 80 42 31 35 36 58 54 4e 00 00 00 00
00 00 41 21 96 01 11 00 00 09 01 0a 20 20 00 af

----------------

Block 0, Base EDID:
  EDID Structure Version & Revision: 1.4
  Vendor & Product Identification:
    Manufacturer: AUO
    Model: 28908
    Made in: week 22 of 2016
  Basic Display Parameters & Features:
    Digital display
    Bits per primary color channel: 6
    DisplayPort interface
    Maximum image size: 34 cm x 19 cm
    Gamma: 2.20
    Supported color formats: RGB 4:4:4
    First detailed timing includes the native pixel format and preferred refresh rate
  Color Characteristics:
    Red  : 0.5751, 0.3447
    Green: 0.3398, 0.5703
    Blue : 0.1601, 0.1347
    White: 0.3134, 0.3291
  Established Timings I & II: none
  Standard Timings: none
  Detailed Timing Descriptors:
    DTD 1:  1366x768    60.015983 Hz 683:384   48.973 kHz     76.300000 MHz (344 mm x 193 mm)
                 Hfront    8 Hsync  10 Hback  174 Hpol P
                 Vfront    3 Vsync   1 Vback   44 Vpol N
    DTD 2:  1366x768    40.013277 Hz 683:384   32.651 kHz     50.870000 MHz (344 mm x 193 mm)
                 Hfront    8 Hsync  10 Hback  174 Hpol P
                 Vfront    3 Vsync   1 Vback   44 Vpol N
    Alphanumeric Data String: 'FMT2C.B156XTN'
    Manufacturer-Specified Display Descriptor (0x00): 00 00 00 00 41 21 96 01 11 00 00 09 01 0a 20 20 '....A!........  '
Checksum: 0xaf

----------------

Warnings:

Block 0, Base EDID:
  Alphanumeric Data String: Non-ASCII character 0x80 at position 5, can cause problems.
  Missing Display Product Name.

EDID conformity: PASS
