edid-decode (hex):

00 ff ff ff ff ff ff 00 10 ac 28 d1 56 53 36 32
23 1f 01 03 80 50 21 78 ea 19 f5 aa 4d 43 aa 24
10 50 54 a5 4b 00 71 4f 81 40 81 80 81 c0 81 00
95 00 b3 00 d1 c0 e7 7c 70 a0 d0 a0 29 50 30 20
3a 00 1d 4e 31 00 00 1a 00 00 00 ff 00 43 42 51
56 53 36 33 0a 20 20 20 20 20 00 00 00 fc 00 44
45 4c 4c 20 53 33 34 32 32 44 57 47 00 00 00 fd
00 30 78 1d c8 3c 00 0a 20 20 20 20 20 20 01 d5

02 03 53 f1 55 01 02 03 07 11 12 16 13 04 2f 46
47 14 1f 05 10 3f 4c 4e 60 61 23 09 07 07 83 01
00 00 e2 00 d5 67 03 0c 00 20 00 38 3c 67 d8 5d
c4 01 78 88 03 6d 1a 00 00 02 03 30 78 e6 07 6c
2c 6c 2c e3 05 c0 00 e4 0f 00 00 38 e6 06 05 01
6c 6c 2c 4e d4 70 a0 d0 a0 46 50 30 20 3a 00 1d
4e 31 00 00 1a 6f c2 00 a0 a0 a0 55 50 30 20 35
00 1d 4e 31 00 00 1a 00 00 00 00 00 00 00 00 01

00 ff ff ff ff ff ff 00 10 ac 28 d1 56 53 36 32
23 1f 01 03 80 50 21 78 ea 19 f5 aa 4d 43 aa 24
10 50 54 a5 4b 00 71 4f 81 40 81 80 81 c0 81 00
95 00 b3 00 d1 c0 e7 7c 70 a0 d0 a0 29 50 30 20
3a 00 1d 4e 31 00 00 1a 00 00 00 ff 00 43 42 51
56 53 36 33 0a 20 20 20 20 20 00 00 00 fc 00 44
45 4c 4c 20 53 33 34 32 32 44 57 47 00 00 00 fd
00 30 78 1d c8 3c 00 0a 20 20 20 20 20 20 01 d5

02 03 53 f1 55 01 02 03 07 11 12 16 13 04 2f 46
47 14 1f 05 10 3f 4c 4e 60 61 23 09 07 07 83 01
00 00 e2 00 d5 67 03 0c 00 20 00 38 3c 67 d8 5d
c4 01 78 88 03 6d 1a 00 00 02 03 30 78 e6 07 6c
2c 6c 2c e3 05 c0 00 e4 0f 00 00 38 e6 06 05 01
6c 6c 2c 4e d4 70 a0 d0 a0 46 50 30 20 3a 00 1d
4e 31 00 00 1a 6f c2 00 a0 a0 a0 55 50 30 20 35
00 1d 4e 31 00 00 1a 00 00 00 00 00 00 00 00 01

----------------

Block 0, Base EDID:
  EDID Structure Version & Revision: 1.3
  Vendor & Product Identification:
    Manufacturer: DEL
    Model: 53544
    Serial Number: ...
    Made in: week 35 of 2021
  Basic Display Parameters & Features:
    Digital display
    Maximum image size: 80 cm x 33 cm
    Gamma: 2.20
    DPMS levels: Standby Suspend Off
    RGB color display
    First detailed timing is the preferred timing
  Color Characteristics:
    Red  : 0.6640, 0.3017
    Green: 0.2636, 0.6650
    Blue : 0.1435, 0.0654
    White: 0.3134, 0.3291
  Established Timings I & II:
    IBM     :   720x400    70.081663 Hz   9:5     31.467 kHz     28.320000 MHz
    DMT 0x04:   640x480    59.940476 Hz   4:3     31.469 kHz     25.175000 MHz
    DMT 0x06:   640x480    75.000000 Hz   4:3     37.500 kHz     31.500000 MHz
    DMT 0x09:   800x600    60.316541 Hz   4:3     37.879 kHz     40.000000 MHz
    DMT 0x0b:   800x600    75.000000 Hz   4:3     46.875 kHz     49.500000 MHz
    DMT 0x10:  1024x768    60.003840 Hz   4:3     48.363 kHz     65.000000 MHz
    DMT 0x12:  1024x768    75.028582 Hz   4:3     60.023 kHz     78.750000 MHz
    DMT 0x24:  1280x1024   75.024675 Hz   5:4     79.976 kHz    135.000000 MHz
  Standard Timings:
    DMT 0x15:  1152x864    75.000000 Hz   4:3     67.500 kHz    108.000000 MHz
    DMT 0x20:  1280x960    60.000000 Hz   4:3     60.000 kHz    108.000000 MHz
    DMT 0x23:  1280x1024   60.019740 Hz   5:4     63.981 kHz    108.000000 MHz
    DMT 0x55:  1280x720    60.000000 Hz  16:9     45.000 kHz     74.250000 MHz
    DMT 0x1c:  1280x800    59.810326 Hz  16:10    49.702 kHz     83.500000 MHz
    DMT 0x2f:  1440x900    59.887445 Hz  16:10    55.935 kHz    106.500000 MHz
    DMT 0x3a:  1680x1050   59.954250 Hz  16:10    65.290 kHz    146.250000 MHz
    DMT 0x52:  1920x1080   60.000000 Hz  16:9     67.500 kHz    148.500000 MHz
  Detailed Timing Descriptors:
    DTD 1:  3440x1440   59.972616 Hz  43:18    88.819 kHz    319.750000 MHz (797 mm x 334 mm)
                 Hfront   48 Hsync  32 Hback   80 Hpol P
                 Vfront    3 Vsync  10 Vback   28 Vpol N
    Display Product Serial Number: ...
    Display Product Name: 'DELL S3422DWG'
    Display Range Limits:
      Monitor ranges (GTF): 48-120 Hz V, 29-200 kHz H, max dotclock 600 MHz
  Extension blocks: 1
Checksum: 0xd5

----------------

Block 1, CTA-861 Extension Block:
  Revision: 3
  Underscans IT Video Formats by default
  Basic audio support
  Supports YCbCr 4:4:4
  Supports YCbCr 4:2:2
  Native detailed modes: 1
  Video Data Block:
    VIC   1:   640x480    59.940476 Hz   4:3     31.469 kHz     25.175000 MHz
    VIC   2:   720x480    59.940060 Hz   4:3     31.469 kHz     27.000000 MHz
    VIC   3:   720x480    59.940060 Hz  16:9     31.469 kHz     27.000000 MHz
    VIC   7:  1440x480i   59.940060 Hz  16:9     15.734 kHz     27.000000 MHz
    VIC  17:   720x576    50.000000 Hz   4:3     31.250 kHz     27.000000 MHz
    VIC  18:   720x576    50.000000 Hz  16:9     31.250 kHz     27.000000 MHz
    VIC  22:  1440x576i   50.000000 Hz  16:9     15.625 kHz     27.000000 MHz
    VIC  19:  1280x720    50.000000 Hz  16:9     37.500 kHz     74.250000 MHz
    VIC   4:  1280x720    60.000000 Hz  16:9     45.000 kHz     74.250000 MHz
    VIC  47:  1280x720   120.000000 Hz  16:9     90.000 kHz    148.500000 MHz
    VIC  70:  1280x720   100.000000 Hz  64:27    75.000 kHz    148.500000 MHz
    VIC  71:  1280x720   120.000000 Hz  64:27    90.000 kHz    148.500000 MHz
    VIC  20:  1920x1080i  50.000000 Hz  16:9     28.125 kHz     74.250000 MHz
    VIC  31:  1920x1080   50.000000 Hz  16:9     56.250 kHz    148.500000 MHz
    VIC   5:  1920x1080i  60.000000 Hz  16:9     33.750 kHz     74.250000 MHz
    VIC  16:  1920x1080   60.000000 Hz  16:9     67.500 kHz    148.500000 MHz
    VIC  63:  1920x1080  120.000000 Hz  16:9    135.000 kHz    297.000000 MHz
    VIC  76:  1920x1080   60.000000 Hz  64:27    67.500 kHz    148.500000 MHz
    VIC  78:  1920x1080  120.000000 Hz  64:27   135.000 kHz    297.000000 MHz
    VIC  96:  3840x2160   50.000000 Hz  16:9    112.500 kHz    594.000000 MHz
    VIC  97:  3840x2160   60.000000 Hz  16:9    135.000 kHz    594.000000 MHz
  Audio Data Block:
    Linear PCM:
      Max channels: 2
      Supported sample rates (kHz): 48 44.1 32
      Supported sample sizes (bits): 24 20 16
  Speaker Allocation Data Block:
    FL/FR - Front Left/Right
  Video Capability Data Block:
    YCbCr quantization: Selectable (via AVI YQ)
    RGB quantization: Selectable (via AVI Q)
    PT scan behavior: Always Overscanned
    IT scan behavior: Always Overscanned
    CE scan behavior: Always Overscanned
  Vendor-Specific Data Block (HDMI), OUI 00-0C-03:
    Source physical address: 2.0.0.0
    DC_36bit
    DC_30bit
    DC_Y444
    Maximum TMDS clock: 300 MHz
  Vendor-Specific Data Block (HDMI Forum), OUI C4-5D-D8:
    Version: 1
    Maximum TMDS Character Rate: 600 MHz
    SCDC Present
    Supports scrambling for <= 340 Mcsc
    Supports 12-bits/component Deep Color 4:2:0 Pixel Encoding
    Supports 10-bits/component Deep Color 4:2:0 Pixel Encoding
  Vendor-Specific Data Block (AMD), OUI 00-00-1A:
    Version: 2
    Feature Caps: 0x03
    Minimum Refresh Rate: 48 Hz
    Maximum Refresh Rate: 120 Hz
    Flags 1.x: 0xe6 (MCCS)
    Flags 2.x: 0x07
      ST 2084 (PQ) EOTF Supported
      Linear EOTF (Windows scRGB, 0.0 - 125.0) Supported
      Gamma 2.2 EOTF Supported
      BT.2020 Gamut Supported
    Maximum luminance: 108 (518.736 cd/m^2)
    Minimum luminance: 44 (0.154 cd/m^2)
  Colorimetry Data Block:
    BT2020YCC
    BT2020RGB
  YCbCr 4:2:0 Capability Map Data Block:
    VIC  96:  3840x2160   50.000000 Hz  16:9    112.500 kHz    594.000000 MHz
    VIC  97:  3840x2160   60.000000 Hz  16:9    135.000 kHz    594.000000 MHz
    VIC   1:   640x480    59.940476 Hz   4:3     31.469 kHz     25.175000 MHz
  HDR Static Metadata Data Block:
    Electro optical transfer functions:
      Traditional gamma - SDR luminance range
      SMPTE ST2084
    Supported static metadata descriptors:
      Static metadata type 1
    Desired content max luminance: 108 (518.736 cd/m^2)
    Desired content max frame-average luminance: 108 (518.736 cd/m^2)
    Desired content min luminance: 44 (0.154 cd/m^2)
  Detailed Timing Descriptors:
    DTD 2:  3440x1440   99.981604 Hz  43:18   150.972 kHz    543.500000 MHz (797 mm x 334 mm)
                 Hfront   48 Hsync  32 Hback   80 Hpol P
                 Vfront    3 Vsync  10 Vback   57 Vpol N
    DTD 3:  2560x1440  119.997589 Hz  16:9    182.996 kHz    497.750000 MHz (797 mm x 334 mm)
                 Hfront   48 Hsync  32 Hback   80 Hpol P
                 Vfront    3 Vsync   5 Vback   77 Vpol N
Checksum: 0x01  Unused space in Extension Block: 8 bytes

----------------

Block 2, Unknown EDID Extension Block 0x00:
  00 ff ff ff ff ff ff 00 10 ac 28 d1 56 53 36 32 '..........(.VS62'
  23 1f 01 03 80 50 21 78 ea 19 f5 aa 4d 43 aa 24 '#....P!x....MC.$'
  10 50 54 a5 4b 00 71 4f 81 40 81 80 81 c0 81 00 '.PT.K.qO.@......'
  95 00 b3 00 d1 c0 e7 7c 70 a0 d0 a0 29 50 30 20 '.......|p...)P0 '
  3a 00 1d 4e 31 00 00 1a 00 00 00 ff 00 43 42 51 ':..N1........CBQ'
  56 53 36 33 0a 20 20 20 20 20 00 00 00 fc 00 44 'VS63.     .....D'
  45 4c 4c 20 53 33 34 32 32 44 57 47 00 00 00 fd 'ELL S3422DWG....'
  00 30 78 1d c8 3c 00 0a 20 20 20 20 20 20 01 d5 '.0x..<..      ..'
Checksum: 0xd5

----------------

Block 3, CTA-861 Extension Block:
  Revision: 3
  Underscans IT Video Formats by default
  Basic audio support
  Supports YCbCr 4:4:4
  Supports YCbCr 4:2:2
  Native detailed modes: 1
  Video Data Block:
    VIC   1:   640x480    59.940476 Hz   4:3     31.469 kHz     25.175000 MHz
    VIC   2:   720x480    59.940060 Hz   4:3     31.469 kHz     27.000000 MHz
    VIC   3:   720x480    59.940060 Hz  16:9     31.469 kHz     27.000000 MHz
    VIC   7:  1440x480i   59.940060 Hz  16:9     15.734 kHz     27.000000 MHz
    VIC  17:   720x576    50.000000 Hz   4:3     31.250 kHz     27.000000 MHz
    VIC  18:   720x576    50.000000 Hz  16:9     31.250 kHz     27.000000 MHz
    VIC  22:  1440x576i   50.000000 Hz  16:9     15.625 kHz     27.000000 MHz
    VIC  19:  1280x720    50.000000 Hz  16:9     37.500 kHz     74.250000 MHz
    VIC   4:  1280x720    60.000000 Hz  16:9     45.000 kHz     74.250000 MHz
    VIC  47:  1280x720   120.000000 Hz  16:9     90.000 kHz    148.500000 MHz
    VIC  70:  1280x720   100.000000 Hz  64:27    75.000 kHz    148.500000 MHz
    VIC  71:  1280x720   120.000000 Hz  64:27    90.000 kHz    148.500000 MHz
    VIC  20:  1920x1080i  50.000000 Hz  16:9     28.125 kHz     74.250000 MHz
    VIC  31:  1920x1080   50.000000 Hz  16:9     56.250 kHz    148.500000 MHz
    VIC   5:  1920x1080i  60.000000 Hz  16:9     33.750 kHz     74.250000 MHz
    VIC  16:  1920x1080   60.000000 Hz  16:9     67.500 kHz    148.500000 MHz
    VIC  63:  1920x1080  120.000000 Hz  16:9    135.000 kHz    297.000000 MHz
    VIC  76:  1920x1080   60.000000 Hz  64:27    67.500 kHz    148.500000 MHz
    VIC  78:  1920x1080  120.000000 Hz  64:27   135.000 kHz    297.000000 MHz
    VIC  96:  3840x2160   50.000000 Hz  16:9    112.500 kHz    594.000000 MHz
    VIC  97:  3840x2160   60.000000 Hz  16:9    135.000 kHz    594.000000 MHz
  Audio Data Block:
    Linear PCM:
      Max channels: 2
      Supported sample rates (kHz): 48 44.1 32
      Supported sample sizes (bits): 24 20 16
  Speaker Allocation Data Block:
    FL/FR - Front Left/Right
  Video Capability Data Block:
    YCbCr quantization: Selectable (via AVI YQ)
    RGB quantization: Selectable (via AVI Q)
    PT scan behavior: Always Overscanned
    IT scan behavior: Always Overscanned
    CE scan behavior: Always Overscanned
  Vendor-Specific Data Block (HDMI), OUI 00-0C-03:
    Source physical address: 2.0.0.0
    DC_36bit
    DC_30bit
    DC_Y444
    Maximum TMDS clock: 300 MHz
  Vendor-Specific Data Block (HDMI Forum), OUI C4-5D-D8:
    Version: 1
    Maximum TMDS Character Rate: 600 MHz
    SCDC Present
    Supports scrambling for <= 340 Mcsc
    Supports 12-bits/component Deep Color 4:2:0 Pixel Encoding
    Supports 10-bits/component Deep Color 4:2:0 Pixel Encoding
  Vendor-Specific Data Block (AMD), OUI 00-00-1A:
    Version: 2
    Feature Caps: 0x03
    Minimum Refresh Rate: 48 Hz
    Maximum Refresh Rate: 120 Hz
    Flags 1.x: 0xe6 (MCCS)
    Flags 2.x: 0x07
      ST 2084 (PQ) EOTF Supported
      Linear EOTF (Windows scRGB, 0.0 - 125.0) Supported
      Gamma 2.2 EOTF Supported
      BT.2020 Gamut Supported
    Maximum luminance: 108 (518.736 cd/m^2)
    Minimum luminance: 44 (0.154 cd/m^2)
  Colorimetry Data Block:
    BT2020YCC
    BT2020RGB
  YCbCr 4:2:0 Capability Map Data Block:
    VIC  96:  3840x2160   50.000000 Hz  16:9    112.500 kHz    594.000000 MHz
    VIC  97:  3840x2160   60.000000 Hz  16:9    135.000 kHz    594.000000 MHz
    VIC   1:   640x480    59.940476 Hz   4:3     31.469 kHz     25.175000 MHz
  HDR Static Metadata Data Block:
    Electro optical transfer functions:
      Traditional gamma - SDR luminance range
      SMPTE ST2084
    Supported static metadata descriptors:
      Static metadata type 1
    Desired content max luminance: 108 (518.736 cd/m^2)
    Desired content max frame-average luminance: 108 (518.736 cd/m^2)
    Desired content min luminance: 44 (0.154 cd/m^2)
  Detailed Timing Descriptors:
    DTD 4:  3440x1440   99.981604 Hz  43:18   150.972 kHz    543.500000 MHz (797 mm x 334 mm)
                 Hfront   48 Hsync  32 Hback   80 Hpol P
                 Vfront    3 Vsync  10 Vback   57 Vpol N
    DTD 5:  2560x1440  119.997589 Hz  16:9    182.996 kHz    497.750000 MHz (797 mm x 334 mm)
                 Hfront   48 Hsync  32 Hback   80 Hpol P
                 Vfront    3 Vsync   5 Vback   77 Vpol N
Checksum: 0x01  Unused space in Extension Block: 8 bytes

----------------

Warnings:

Block 1, CTA-861 Extension Block:
  Video Data Block: VIC 1 and the first DTD are not identical. Is this intended?
  Video Capability Data Block: IT scan behavior is expected to support underscanned.
  Video Capability Data Block: S_PT is equal to S_IT and S_CE, so should be set to 0 instead.
  Colorimetry Data Block: Set the sRGB colorimetry bit to avoid interop issues.
  YCbCr 4:2:0 Capability Map Data Block: Some YCbCr 4:2:0 timings are invalid for HDMI 2.1 (which requires an RGB timings pixel rate >= 590 MHz).
  Detailed Timing Descriptor #3: Image size is 797x334 mm, but based on the picture AR it should be 797x448 mm.
  Display Product Serial Number is set, so the Serial Number in the Base EDID should be 0.
Block 3, CTA-861 Extension Block:
  Video Capability Data Block: IT scan behavior is expected to support underscanned.
  Video Capability Data Block: S_PT is equal to S_IT and S_CE, so should be set to 0 instead.
  Colorimetry Data Block: Set the sRGB colorimetry bit to avoid interop issues.
  Detailed Timing Descriptor #5: Image size is 797x334 mm, but based on the picture AR it should be 797x448 mm.
EDID:
  Base EDID: Some timings are out of range of the Monitor Ranges:
    Horizontal Freq: 15.625 - 182.996 kHz (Monitor: 29.000 - 200.000 kHz)

Failures:

Block 1, CTA-861 Extension Block:
  Video Capability Data Block: IT video formats are always overscanned, but bit 7 of Byte 3 of the CTA-861 Extension header is set to underscanned.
Block 2, Base EDID:
  Unknown Extension Block.
Block 3, CTA-861 Extension Block:
  Video Data Block: Duplicate VIC 1.
  Video Data Block: Duplicate VIC 2.
  Video Data Block: Duplicate VIC 3.
  Video Data Block: Duplicate VIC 7.
  Video Data Block: Duplicate VIC 17.
  Video Data Block: Duplicate VIC 18.
  Video Data Block: Duplicate VIC 22.
  Video Data Block: Duplicate VIC 19.
  Video Data Block: Duplicate VIC 4.
  Video Data Block: Duplicate VIC 47.
  Video Data Block: Duplicate VIC 70.
  Video Data Block: Duplicate VIC 71.
  Video Data Block: Duplicate VIC 20.
  Video Data Block: Duplicate VIC 31.
  Video Data Block: Duplicate VIC 5.
  Video Data Block: Duplicate VIC 16.
  Video Data Block: Duplicate VIC 63.
  Video Data Block: Duplicate VIC 76.
  Video Data Block: Duplicate VIC 78.
  Video Data Block: Duplicate VIC 96.
  Video Data Block: Duplicate VIC 97.
  Speaker Allocation Data Block: Only one instance of this Data Block is allowed.
  Video Capability Data Block: Only one instance of this Data Block is allowed.
  Video Capability Data Block: IT video formats are always overscanned, but bit 7 of Byte 3 of the CTA-861 Extension header is set to underscanned.
  Vendor-Specific Data Block (HDMI Forum), OUI C4-5D-D8: Duplicate HDMI Forum VSDB/SCDB.
  Colorimetry Data Block: Only one instance of this Data Block is allowed.
  YCbCr 4:2:0 Capability Map Data Block: Only one instance of this Data Block is allowed.
  HDR Static Metadata Data Block: Only one instance of this Data Block is allowed.
EDID:
  Base EDID: EDID specified 1 extension block(s), but found 3 extension block(s).
  Base EDID: EDID 1.3 requires a Block Map Extension in Block 1 if there are more than 2 blocks in the EDID.

EDID conformity: FAIL
