edid-decode (hex):

00 ff ff ff ff ff ff 00 4d d9 00 bf 01 01 01 01
00 10 01 03 80 00 00 78 0a 13 b1 a3 52 4a 99 25
14 49 4b a1 08 00 71 c0 61 40 45 40 31 40 01 01
01 01 01 01 01 01 25 17 80 40 41 88 1a 20 30 70
35 00 10 09 00 00 00 1c a9 1a 00 a0 50 00 16 30
30 20 37 00 10 09 00 00 00 1a 00 00 00 fd 00 3a
3e 0f 32 08 00 0a 20 20 20 20 20 20 00 00 00 fc
00 53 4f 4e 59 20 54 56 0a 20 20 20 20 20 01 27

02 03 1b 77 47 84 05 03 02 07 06 01 23 09 07 07
83 01 00 00 66 03 0c 00 20 00 80 01 1d 00 72 51
d0 1e 20 6e 28 55 00 10 09 00 00 00 1e 01 1d 80
18 71 1c 16 20 58 2c 25 00 10 09 00 00 00 9e 8c
0a d0 8a 20 e0 2d 10 10 3e 96 00 04 03 00 00 00
18 8c 0a a0 14 51 f0 16 00 26 7c 43 00 04 03 00
00 00 98 8c 0a d0 8a 20 e0 2d 10 10 3e 96 00 10
09 00 00 00 18 00 00 00 00 00 00 00 00 00 00 32

00 ff ff ff ff ff ff 00 4d d9 00 bf 01 01 01 01
00 10 01 03 80 00 00 78 0a 13 b1 a3 52 4a 99 25
14 49 4b a1 08 00 71 c0 61 40 45 40 31 40 01 01
01 01 01 01 01 01 25 17 80 40 41 88 1a 20 30 70
35 00 10 09 00 00 00 1c a9 1a 00 a0 50 00 16 30
30 20 37 00 10 09 00 00 00 1a 00 00 00 fd 00 3a
3e 0f 32 08 00 0a 20 20 20 20 20 20 00 00 00 fc
00 53 4f 4e 59 20 54 56 0a 20 20 20 20 20 01 27

02 03 1b 77 47 84 05 03 02 07 06 01 23 09 07 07
83 01 00 00 66 03 0c 00 20 00 80 01 1d 00 72 51
d0 1e 20 6e 28 55 00 10 09 00 00 00 1e 01 1d 80
18 71 1c 16 20 58 2c 25 00 10 09 00 00 00 9e 8c
0a d0 8a 20 e0 2d 10 10 3e 96 00 04 03 00 00 00
18 8c 0a a0 14 51 f0 16 00 26 7c 43 00 04 03 00
00 00 98 8c 0a d0 8a 20 e0 2d 10 10 3e 96 00 10
09 00 00 00 18 00 00 00 00 00 00 00 00 00 00 32

----------------

Block 0, Base EDID:
  EDID Structure Version & Revision: 1.3
  Vendor & Product Identification:
    Manufacturer: SNY
    Model: 48896
    Serial Number: ...
    Made in: 2006
  Basic Display Parameters & Features:
    Digital display
    Image size is variable
    Gamma: 2.20
    RGB color display
    First detailed timing is the preferred timing
  Color Characteristics:
    Red  : 0.6367, 0.3212
    Green: 0.2890, 0.6005
    Blue : 0.1464, 0.0810
    White: 0.2851, 0.2939
  Established Timings I & II:
    IBM     :   720x400    70.081663 Hz   9:5     31.467 kHz     28.320000 MHz
    DMT 0x04:   640x480    59.940476 Hz   4:3     31.469 kHz     25.175000 MHz
    DMT 0x09:   800x600    60.316541 Hz   4:3     37.879 kHz     40.000000 MHz
    DMT 0x10:  1024x768    60.003840 Hz   4:3     48.363 kHz     65.000000 MHz
  Standard Timings:
    GTF     :  1152x648    60.000120 Hz  16:9     40.260 kHz     59.907000 MHz
    DMT 0x10:  1024x768    60.003840 Hz   4:3     48.363 kHz     65.000000 MHz
    DMT 0x09:   800x600    60.316541 Hz   4:3     37.879 kHz     40.000000 MHz
    DMT 0x04:   640x480    59.940476 Hz   4:3     31.469 kHz     25.175000 MHz
  Detailed Timing Descriptors:
    DTD  1:  1152x648    59.720117 Hz  16:9     40.251 kHz     59.250000 MHz (16 mm x 9 mm)
                  Hfront   48 Hsync 112 Hback  160 Hpol N
                  Vfront    3 Vsync   5 Vback   18 Vpol P
    DTD  2:  1280x768    59.994726 Hz   5:3     47.396 kHz     68.250000 MHz (16 mm x 9 mm)
                  Hfront   48 Hsync  32 Hback   80 Hpol P
                  Vfront    3 Vsync   7 Vback   12 Vpol N
    Display Range Limits:
      Monitor ranges (GTF): 58-62 Hz V, 15-50 kHz H, max dotclock 80 MHz
    Display Product Name: 'SONY TV'
  Extension blocks: 1
Checksum: 0x27

----------------

Block 1, CTA-861 Extension Block:
  Revision: 3
  Basic audio support
  Supports YCbCr 4:4:4
  Supports YCbCr 4:2:2
  Native detailed modes: 7
  Video Data Block:
    VIC   4:  1280x720    60.000000 Hz  16:9     45.000 kHz     74.250000 MHz (native)
    VIC   5:  1920x1080i  60.000000 Hz  16:9     33.750 kHz     74.250000 MHz
    VIC   3:   720x480    59.940060 Hz  16:9     31.469 kHz     27.000000 MHz
    VIC   2:   720x480    59.940060 Hz   4:3     31.469 kHz     27.000000 MHz
    VIC   7:  1440x480i   59.940060 Hz  16:9     15.734 kHz     27.000000 MHz
    VIC   6:  1440x480i   59.940060 Hz   4:3     15.734 kHz     27.000000 MHz
    VIC   1:   640x480    59.940476 Hz   4:3     31.469 kHz     25.175000 MHz
  Audio Data Block:
    Linear PCM:
      Max channels: 2
      Supported sample rates (kHz): 48 44.1 32
      Supported sample sizes (bits): 24 20 16
  Speaker Allocation Data Block:
    FL/FR - Front Left/Right
  Vendor-Specific Data Block (HDMI), OUI 00-0C-03:
    Source physical address: 2.0.0.0
    Supports_AI
  Detailed Timing Descriptors:
    DTD  3:  1280x720    60.000000 Hz  16:9     45.000 kHz     74.250000 MHz (16 mm x 9 mm)
                  Hfront  110 Hsync  40 Hback  220 Hpol P
                  Vfront    5 Vsync   5 Vback   20 Vpol P
    DTD  4:  1920x1080i  60.000000 Hz  16:9     33.750 kHz     74.250000 MHz (16 mm x 9 mm)
                  Hfront   88 Hsync  44 Hback  148 Hpol P
                  Vfront    2 Vsync   5 Vback   15 Vpol P Vfront +0.5 Odd Field
                  Vfront    2 Vsync   5 Vback   15 Vpol P Vback  +0.5 Even Field
    DTD  5:   720x480    59.940060 Hz   3:2     31.469 kHz     27.000000 MHz (4 mm x 3 mm)
                  Hfront   16 Hsync  62 Hback   60 Hpol N
                  Vfront    9 Vsync   6 Vback   30 Vpol N
    DTD  6:  1440x480i   59.940060 Hz   3:1     15.734 kHz     27.000000 MHz (4 mm x 3 mm)
                  Hfront   38 Hsync 124 Hback  114 Hpol N
                  Vfront    4 Vsync   3 Vback   15 Vpol N Vfront +0.5 Odd Field
                  Vfront    4 Vsync   3 Vback   15 Vpol N Vback  +0.5 Even Field
    DTD  7:   720x480    59.940060 Hz   3:2     31.469 kHz     27.000000 MHz (16 mm x 9 mm)
                  Hfront   16 Hsync  62 Hback   60 Hpol N
                  Vfront    9 Vsync   6 Vback   30 Vpol N
Checksum: 0x32  Unused space in Extension Block: 10 bytes

----------------

Block 2, Unknown EDID Extension Block 0x00:
  00 ff ff ff ff ff ff 00 4d d9 00 bf 01 01 01 01 '........M.......'
  00 10 01 03 80 00 00 78 0a 13 b1 a3 52 4a 99 25 '.......x....RJ.%'
  14 49 4b a1 08 00 71 c0 61 40 45 40 31 40 01 01 '.IK...q.a@E@1@..'
  01 01 01 01 01 01 25 17 80 40 41 88 1a 20 30 70 '......%..@A.. 0p'
  35 00 10 09 00 00 00 1c a9 1a 00 a0 50 00 16 30 '5...........P..0'
  30 20 37 00 10 09 00 00 00 1a 00 00 00 fd 00 3a '0 7............:'
  3e 0f 32 08 00 0a 20 20 20 20 20 20 00 00 00 fc '>.2...      ....'
  00 53 4f 4e 59 20 54 56 0a 20 20 20 20 20 01 27 '.SONY TV.     .''
Checksum: 0x27

----------------

Block 3, CTA-861 Extension Block:
  Revision: 3
  Basic audio support
  Supports YCbCr 4:4:4
  Supports YCbCr 4:2:2
  Native detailed modes: 7
  Video Data Block:
    VIC   4:  1280x720    60.000000 Hz  16:9     45.000 kHz     74.250000 MHz (native)
    VIC   5:  1920x1080i  60.000000 Hz  16:9     33.750 kHz     74.250000 MHz
    VIC   3:   720x480    59.940060 Hz  16:9     31.469 kHz     27.000000 MHz
    VIC   2:   720x480    59.940060 Hz   4:3     31.469 kHz     27.000000 MHz
    VIC   7:  1440x480i   59.940060 Hz  16:9     15.734 kHz     27.000000 MHz
    VIC   6:  1440x480i   59.940060 Hz   4:3     15.734 kHz     27.000000 MHz
    VIC   1:   640x480    59.940476 Hz   4:3     31.469 kHz     25.175000 MHz
  Audio Data Block:
    Linear PCM:
      Max channels: 2
      Supported sample rates (kHz): 48 44.1 32
      Supported sample sizes (bits): 24 20 16
  Speaker Allocation Data Block:
    FL/FR - Front Left/Right
  Vendor-Specific Data Block (HDMI), OUI 00-0C-03:
    Source physical address: 2.0.0.0
    Supports_AI
  Detailed Timing Descriptors:
    DTD  8:  1280x720    60.000000 Hz  16:9     45.000 kHz     74.250000 MHz (16 mm x 9 mm)
                  Hfront  110 Hsync  40 Hback  220 Hpol P
                  Vfront    5 Vsync   5 Vback   20 Vpol P
    DTD  9:  1920x1080i  60.000000 Hz  16:9     33.750 kHz     74.250000 MHz (16 mm x 9 mm)
                  Hfront   88 Hsync  44 Hback  148 Hpol P
                  Vfront    2 Vsync   5 Vback   15 Vpol P Vfront +0.5 Odd Field
                  Vfront    2 Vsync   5 Vback   15 Vpol P Vback  +0.5 Even Field
    DTD 10:   720x480    59.940060 Hz   3:2     31.469 kHz     27.000000 MHz (4 mm x 3 mm)
                  Hfront   16 Hsync  62 Hback   60 Hpol N
                  Vfront    9 Vsync   6 Vback   30 Vpol N
    DTD 11:  1440x480i   59.940060 Hz   3:1     15.734 kHz     27.000000 MHz (4 mm x 3 mm)
                  Hfront   38 Hsync 124 Hback  114 Hpol N
                  Vfront    4 Vsync   3 Vback   15 Vpol N Vfront +0.5 Odd Field
                  Vfront    4 Vsync   3 Vback   15 Vpol N Vback  +0.5 Even Field
    DTD 12:   720x480    59.940060 Hz   3:2     31.469 kHz     27.000000 MHz (16 mm x 9 mm)
                  Hfront   16 Hsync  62 Hback   60 Hpol N
                  Vfront    9 Vsync   6 Vback   30 Vpol N
Checksum: 0x32  Unused space in Extension Block: 10 bytes

----------------

Warnings:

Block 0, Base EDID:
  Vendor & Product Identification: The serial number is one of the known dummy values, it should probably be set to 0.
  Detailed Timing Descriptor #1: Dubious image size (16x9 mm is smaller than 100x100 mm).
  Detailed Timing Descriptor #2: Dubious image size (16x9 mm is smaller than 100x100 mm).
Block 1, CTA-861 Extension Block:
  IT Video Formats are overscanned by default, but normally this should be underscanned.
  Video Data Block: VIC 4 and the first DTD are not identical. Is this intended?
  Detailed Timing Descriptor #3: Dubious image size (16x9 mm is smaller than 100x100 mm).
  Detailed Timing Descriptor #4: Dubious image size (16x9 mm is smaller than 100x100 mm).
  Detailed Timing Descriptor #5: Dubious image size (4x3 mm is smaller than 100x100 mm).
  Detailed Timing Descriptor #6: Dubious image size (4x3 mm is smaller than 100x100 mm).
  Detailed Timing Descriptor #7: Dubious image size (16x9 mm is smaller than 100x100 mm).
  Add a Colorimetry Data Block with the sRGB colorimetry bit set to avoid interop issues.
Block 3, CTA-861 Extension Block:
  IT Video Formats are overscanned by default, but normally this should be underscanned.
  Detailed Timing Descriptor #8: Dubious image size (16x9 mm is smaller than 100x100 mm).
  Detailed Timing Descriptor #9: Dubious image size (16x9 mm is smaller than 100x100 mm).
  Detailed Timing Descriptor #10: Dubious image size (4x3 mm is smaller than 100x100 mm).
  Detailed Timing Descriptor #11: Dubious image size (4x3 mm is smaller than 100x100 mm).
  Detailed Timing Descriptor #12: Dubious image size (16x9 mm is smaller than 100x100 mm).
EDID:
  Base EDID: Some timings are out of range of the Monitor Ranges:
    Vertical Freq: 59.720 - 70.082 Hz (Monitor: 58.000 - 62.000 Hz)

Failures:

Block 1, CTA-861 Extension Block:
  Missing VCDB, needed for Set Selectable RGB Quantization to avoid interop issues.
Block 2, Base EDID:
  Unknown Extension Block.
Block 3, CTA-861 Extension Block:
  Video Data Block: Duplicate VIC 4.
  Video Data Block: Duplicate VIC 5.
  Video Data Block: Duplicate VIC 3.
  Video Data Block: Duplicate VIC 2.
  Video Data Block: Duplicate VIC 7.
  Video Data Block: Duplicate VIC 6.
  Video Data Block: Duplicate VIC 1.
  Speaker Allocation Data Block: Only one instance of this Data Block is allowed.
EDID:
  Base EDID: The DTD max image size is 16x9mm, but the display size is not specified anywhere.
  Base EDID: EDID specified 1 extension block(s), but found 3 extension block(s).
  Base EDID: EDID 1.3 requires a Block Map Extension in Block 1 if there are more than 2 blocks in the EDID.
  CTA-861: Native progressive timings are a mix of several resolutions.
  CTA-861: Native interlaced timings are a mix of several resolutions.

EDID conformity: FAIL
