edid-decode (hex):

00 ff ff ff ff ff ff 00 4d 10 59 15 00 00 00 00
17 1f 01 04 a5 22 13 78 07 de 50 a3 54 4c 99 26
0f 50 54 00 00 00 01 01 01 01 01 01 01 01 01 01
01 01 01 01 01 01 ed ec 80 a0 70 38 87 40 30 20
35 00 58 c2 10 00 00 18 3c 3b 80 a0 70 38 87 40
30 20 35 00 58 c2 10 00 00 18 00 00 00 fd 0c 3c
f0 24 24 3d 01 0a 20 20 20 20 20 20 00 00 00 fc
00 4c 51 31 35 36 4d 31 4a 57 32 36 0a 20 00 4d

----------------

Block 0, Base EDID:
  EDID Structure Version & Revision: 1.4
  Vendor & Product Identification:
    Manufacturer: SHP
    Model: 5465
    Made in: week 23 of 2021
  Basic Display Parameters & Features:
    Digital display
    Bits per primary color channel: 8
    DisplayPort interface
    Maximum image size: 34 cm x 19 cm
    Gamma: 2.20
    Supported color formats: RGB 4:4:4
    Default (sRGB) color space is primary color space
    First detailed timing includes the native pixel format and preferred refresh rate
    Display supports continuous frequencies
  Color Characteristics:
    Red  : 0.6396, 0.3291
    Green: 0.2998, 0.5996
    Blue : 0.1494, 0.0595
    White: 0.3125, 0.3281
  Established Timings I & II: none
  Standard Timings: none
  Detailed Timing Descriptors:
    DTD 1:  1920x1080  240.000791 Hz  16:9    291.601 kHz    606.530000 MHz (344 mm x 194 mm)
                 Hfront   48 Hsync  32 Hback   80 Hpol N
                 Vfront    3 Vsync   5 Vback  127 Vpol N
    DTD 2:  1920x1080   60.003166 Hz  16:9     72.904 kHz    151.640000 MHz (344 mm x 194 mm)
                 Hfront   48 Hsync  32 Hback   80 Hpol N
                 Vfront    3 Vsync   5 Vback  127 Vpol N
    Display Range Limits:
      Monitor ranges (Range Limits Only): 60-240 Hz V, 291-291 kHz H, max dotclock 610 MHz
    Display Product Name: 'LQ156M1JW26'
Checksum: 0x4d

----------------

Warnings:

EDID:
  Base EDID: Some timings are out of range of the Monitor Ranges:
    Horizontal Freq: 72.903 - 291.600 kHz (Monitor: 291.000 - 291.000 kHz)

Failures:

Block 0, Base EDID:
  Basic Display Parameters & Features: sRGB is signaled, but the chromaticities do not match.

EDID conformity: FAIL
