edid-decode (hex):

00 ff ff ff ff ff ff 00 34 a4 42 39 01 01 01 01
00 15 01 03 81 2e 1b 78 2a ec 85 a2 54 4d a1 27
12 50 54 bf ef 80 81 80 71 4f 81 40 95 0f 95 00
01 01 01 01 01 01 2f 26 40 a0 60 84 1a 30 30 20
35 00 ce 10 11 00 00 1a 66 21 50 b0 51 00 1b 30
40 70 36 00 ce 10 11 00 00 1e 00 00 00 fd 00 37
4c 1e 52 0f 00 0a 20 20 20 20 20 20 00 00 00 fc
00 4d 44 32 30 33 32 38 0a 20 20 20 20 20 00 03

00 ff ff ff ff ff ff 00 34 a4 42 39 01 01 01 01
00 15 01 03 81 2e 1b 78 2a ec 85 a2 54 4d a1 27
12 50 54 bf ef 80 81 80 71 4f 81 40 95 0f 95 00
01 01 01 01 01 01 2f 26 40 a0 60 84 1a 30 30 20
35 00 ce 10 11 00 00 1a 66 21 50 b0 51 00 1b 30
40 70 36 00 ce 10 11 00 00 1e 00 00 00 fd 00 37
4c 1e 52 0f 00 0a 20 20 20 20 20 20 00 00 00 fc
00 4d 44 32 30 33 32 38 0a 20 20 20 20 20 00 03

----------------

Block 0, Base EDID:
  EDID Structure Version & Revision: 1.3
  Vendor & Product Identification:
    Manufacturer: MED
    Model: 14658
    Serial Number: ...
    Made in: 2011
  Basic Display Parameters & Features:
    Digital display
    DFP 1.x compatible TMDS
    Maximum image size: 46 cm x 27 cm
    Gamma: 2.20
    DPMS levels: Off
    RGB color display
    First detailed timing is the preferred timing
  Color Characteristics:
    Red  : 0.6357, 0.3300
    Green: 0.3037, 0.6289
    Blue : 0.1542, 0.0703
    White: 0.3134, 0.3291
  Established Timings I & II:
    IBM     :   720x400    70.081663 Hz   9:5     31.467 kHz     28.320000 MHz
    DMT 0x04:   640x480    59.940476 Hz   4:3     31.469 kHz     25.175000 MHz
    Apple   :   640x480    66.666667 Hz   4:3     35.000 kHz     30.240000 MHz
    DMT 0x05:   640x480    72.808802 Hz   4:3     37.861 kHz     31.500000 MHz
    DMT 0x06:   640x480    75.000000 Hz   4:3     37.500 kHz     31.500000 MHz
    DMT 0x08:   800x600    56.250000 Hz   4:3     35.156 kHz     36.000000 MHz
    DMT 0x09:   800x600    60.316541 Hz   4:3     37.879 kHz     40.000000 MHz
    DMT 0x0a:   800x600    72.187572 Hz   4:3     48.077 kHz     50.000000 MHz
    DMT 0x0b:   800x600    75.000000 Hz   4:3     46.875 kHz     49.500000 MHz
    Apple   :   832x624    74.551266 Hz   4:3     49.726 kHz     57.284000 MHz
    DMT 0x10:  1024x768    60.003840 Hz   4:3     48.363 kHz     65.000000 MHz
    DMT 0x11:  1024x768    70.069359 Hz   4:3     56.476 kHz     75.000000 MHz
    DMT 0x12:  1024x768    75.028582 Hz   4:3     60.023 kHz     78.750000 MHz
    DMT 0x24:  1280x1024   75.024675 Hz   5:4     79.976 kHz    135.000000 MHz
    Apple   :  1152x870    75.061550 Hz 192:145   68.681 kHz    100.000000 MHz
  Standard Timings:
    DMT 0x23:  1280x1024   60.019740 Hz   5:4     63.981 kHz    108.000000 MHz
    DMT 0x15:  1152x864    75.000000 Hz   4:3     67.500 kHz    108.000000 MHz
    DMT 0x20:  1280x960    60.000000 Hz   4:3     60.000 kHz    108.000000 MHz
    DMT 0x30:  1440x900    74.984427 Hz  16:10    70.635 kHz    136.750000 MHz
    DMT 0x2f:  1440x900    59.887445 Hz  16:10    55.935 kHz    106.500000 MHz
  Detailed Timing Descriptors:
    DTD 1:  1600x900    59.978156 Hz  16:9     55.540 kHz     97.750000 MHz (462 mm x 272 mm)
                 Hfront   48 Hsync  32 Hback   80 Hpol P
                 Vfront    3 Vsync   5 Vback   18 Vpol N
    DTD 2:  1360x768    60.015162 Hz  85:48    47.712 kHz     85.500000 MHz (462 mm x 272 mm)
                 Hfront   64 Hsync 112 Hback  256 Hpol P
                 Vfront    3 Vsync   6 Vback   18 Vpol P
    Display Range Limits:
      Monitor ranges (GTF): 55-76 Hz V, 30-82 kHz H, max dotclock 150 MHz
    Display Product Name: 'MD20328'
Checksum: 0x03

----------------

Block 1, Unknown EDID Extension Block 0x00:
  00 ff ff ff ff ff ff 00 34 a4 42 39 01 01 01 01 '........4.B9....'
  00 15 01 03 81 2e 1b 78 2a ec 85 a2 54 4d a1 27 '.......x*...TM.''
  12 50 54 bf ef 80 81 80 71 4f 81 40 95 0f 95 00 '.PT.....qO.@....'
  01 01 01 01 01 01 2f 26 40 a0 60 84 1a 30 30 20 '....../&@.`..00 '
  35 00 ce 10 11 00 00 1a 66 21 50 b0 51 00 1b 30 '5.......f!P.Q..0'
  40 70 36 00 ce 10 11 00 00 1e 00 00 00 fd 00 37 '@p6............7'
  4c 1e 52 0f 00 0a 20 20 20 20 20 20 00 00 00 fc 'L.R...      ....'
  00 4d 44 32 30 33 32 38 0a 20 20 20 20 20 00 03 '.MD20328.     ..'
Checksum: 0x03

----------------

Warnings:

Block 0, Base EDID:
  Vendor & Product Identification: The serial number is one of the known dummy values, it should probably be set to 0.
  Detailed Timing Descriptor #1: Image size is 462x272 mm, but based on the picture AR it should be 462x259 mm.
  Detailed Timing Descriptor #2: Image size is 462x272 mm, but based on the picture AR it should be 462x260 mm.

Failures:

Block 1, Base EDID:
  Unknown Extension Block.
EDID:
  Base EDID: EDID specified 0 extension block(s), but found 1 extension block(s).

EDID conformity: FAIL
