edid-decode (hex):

00 ff ff ff ff ff ff 00 06 af eb 20 00 00 00 00
00 1a 01 04 a5 23 13 78 02 d2 95 a3 56 52 9d 27
0b 50 54 00 00 00 01 01 01 01 01 01 01 01 01 01
01 01 01 01 01 01 66 d0 00 a0 f0 70 3e 80 30 20
35 00 59 c2 10 00 00 1a 66 d0 00 a0 f0 70 6a 82
30 20 35 00 59 c2 10 00 00 1a 00 00 00 fe 00 46
32 54 57 32 80 42 31 35 36 5a 41 4e 00 00 00 00
00 02 81 02 a8 00 11 00 00 0b 01 0a 20 20 00 c5

----------------

Block 0, Base EDID:
  EDID Structure Version & Revision: 1.4
  Vendor & Product Identification:
    Manufacturer: AUO
    Model: 8427
    Made in: 2016
  Basic Display Parameters & Features:
    Digital display
    Bits per primary color channel: 8
    DisplayPort interface
    Maximum image size: 35 cm x 19 cm
    Gamma: 2.20
    Supported color formats: RGB 4:4:4
    First detailed timing includes the native pixel format and preferred refresh rate
  Color Characteristics:
    Red  : 0.6396, 0.3369
    Green: 0.3203, 0.6152
    Blue : 0.1542, 0.0439
    White: 0.3134, 0.3291
  Established Timings I & II: none
  Standard Timings: none
  Detailed Timing Descriptors:
    DTD 1:  3840x2160   60.024752 Hz  16:9    133.375 kHz    533.500000 MHz (345 mm x 194 mm)
                 Hfront   48 Hsync  32 Hback   80 Hpol P
                 Vfront    3 Vsync   5 Vback   54 Vpol N
    DTD 2:  3840x2160   48.011159 Hz  16:9    133.375 kHz    533.500000 MHz (345 mm x 194 mm)
                 Hfront   48 Hsync  32 Hback   80 Hpol P
                 Vfront    3 Vsync   5 Vback  610 Vpol N
    Alphanumeric Data String: 'F2TW2.B156ZAN'
    Manufacturer-Specified Display Descriptor (0x00): 00 00 00 02 81 02 a8 00 11 00 00 0b 01 0a 20 20 '..............  '
Checksum: 0xc5

----------------

Warnings:

Block 0, Base EDID:
  Alphanumeric Data String: Non-ASCII character 0x80 at position 5, can cause problems.
  Missing Display Product Name.

EDID conformity: PASS
