edid-decode (hex):

00 ff ff ff ff ff ff 00 15 c3 23 17 01 01 01 01
1b 11 01 03 80 26 1f 50 ea a7 eb a6 54 4a 9e 23
14 58 5b a1 08 00 81 80 01 01 01 01 01 01 01 01
01 01 01 01 01 01 30 2a 00 98 51 00 2a 40 30 70
13 00 79 2e 11 00 00 1e 00 00 00 ff 00 33 36 37
38 31 30 36 37 0a 20 20 20 20 00 00 00 fd 00 3b
3d 1e 41 0b 00 0a 20 20 20 20 20 20 00 00 00 fc
00 43 47 31 39 0a 20 20 20 20 20 20 20 20 00 a3

00 ff ff ff ff ff ff 00 15 c3 23 17 01 01 01 01
1b 11 01 03 80 26 1f 50 ea a7 eb a6 54 4a 9e 23
14 58 5b a1 08 00 81 80 01 01 01 01 01 01 01 01
01 01 01 01 01 01 30 2a 00 98 51 00 2a 40 30 70
13 00 79 2e 11 00 00 1e 00 00 00 ff 00 33 36 37
38 31 30 36 37 0a 20 20 20 20 00 00 00 fd 00 3b
3d 1e 41 0b 00 0a 20 20 20 20 20 20 00 00 00 fc
00 43 47 31 39 0a 20 20 20 20 20 20 20 20 00 a3

----------------

Block 0, Base EDID:
  EDID Structure Version & Revision: 1.3
  Vendor & Product Identification:
    Manufacturer: ENC
    Model: 5923
    Serial Number: ...
    Made in: week 27 of 2007
  Basic Display Parameters & Features:
    Digital display
    Maximum image size: 38 cm x 31 cm
    Gamma: 1.80
    DPMS levels: Standby Suspend Off
    RGB color display
    First detailed timing is the preferred timing
  Color Characteristics:
    Red  : 0.6503, 0.3300
    Green: 0.2900, 0.6201
    Blue : 0.1396, 0.0800
    White: 0.3457, 0.3583
  Established Timings I & II:
    IBM     :   720x400    70.081663 Hz   9:5     31.467 kHz     28.320000 MHz
    DMT 0x04:   640x480    59.940476 Hz   4:3     31.469 kHz     25.175000 MHz
    DMT 0x09:   800x600    60.316541 Hz   4:3     37.879 kHz     40.000000 MHz
    DMT 0x10:  1024x768    60.003840 Hz   4:3     48.363 kHz     65.000000 MHz
  Standard Timings:
    DMT 0x23:  1280x1024   60.019740 Hz   5:4     63.981 kHz    108.000000 MHz
  Detailed Timing Descriptors:
    DTD 1:  1280x1024   60.019740 Hz   5:4     63.981 kHz    108.000000 MHz (377 mm x 302 mm)
                 Hfront   48 Hsync 112 Hback  248 Hpol P
                 Vfront    1 Vsync   3 Vback   38 Vpol P
    Display Product Serial Number: ...
    Display Range Limits:
      Monitor ranges (GTF): 59-61 Hz V, 30-65 kHz H, max dotclock 110 MHz
    Display Product Name: 'CG19'
Checksum: 0xa3

----------------

Warnings:

Block 0, Base EDID:
  Vendor & Product Identification: The serial number is one of the known dummy values, it should probably be set to 0.
EDID:
  Base EDID: Some timings are out of range of the Monitor Ranges:
    Vertical Freq: 59.940 - 70.082 Hz (Monitor: 59.000 - 61.000 Hz)

Failures:

EDID:
  Extension Block 1 started with EDID header, ignoring Extension Blocks >= 1.

EDID conformity: FAIL
