edid-decode (hex):

00 ff ff ff ff ff ff 00 4a 8b 36 21 05 11 14 20
2e 18 01 04 a5 2f 1d 78 e2 64 b5 ab 52 38 ab 25
13 50 54 00 00 00 01 01 01 01 01 01 01 01 01 01
01 01 01 01 01 01 64 19 00 40 41 00 26 30 18 88
36 00 d9 28 11 00 00 18 00 00 00 10 00 50 4b 35
37 33 37 41 47 35 37 35 55 0a 00 00 00 fc 00 41
49 4f 20 50 43 0a 20 20 20 20 20 20 00 00 00 fd
00 38 3c 1e 32 08 00 0a 20 20 20 20 20 20 00 d3

00 ff ff ff ff ff ff 00 4a 8b 36 21 05 11 14 20
2e 18 01 04 a5 2f 1d 78 e2 64 b5 ab 52 38 ab 25
13 50 54 00 00 00 01 01 01 01 01 01 01 01 01 01
01 01 01 01 01 01 64 19 00 40 41 00 26 30 18 88
36 00 d9 28 11 00 00 18 00 00 00 10 00 50 4b 35
37 33 37 41 47 35 37 35 55 0a 00 00 00 fc 00 41
49 4f 20 50 43 0a 20 20 20 20 20 20 00 00 00 fd
00 38 3c 1e 32 08 00 0a 20 20 20 20 20 20 00 d3

----------------

Block 0, Base EDID:
  EDID Structure Version & Revision: 1.4
  Vendor & Product Identification:
    Manufacturer: RTK
    Model: 8502
    Serial Number: ...
    Made in: week 46 of 2014
  Basic Display Parameters & Features:
    Digital display
    Bits per primary color channel: 8
    DisplayPort interface
    Maximum image size: 47 cm x 29 cm
    Gamma: 2.20
    DPMS levels: Standby Suspend Off
    Supported color formats: RGB 4:4:4
    First detailed timing includes the native pixel format and preferred refresh rate
  Color Characteristics:
    Red  : 0.6689, 0.3222
    Green: 0.2197, 0.6679
    Blue : 0.1464, 0.0771
    White: 0.3134, 0.3291
  Established Timings I & II: none
  Standard Timings: none
  Detailed Timing Descriptors:
    DTD 1:  1024x768    60.003840 Hz   4:3     48.363 kHz     65.000000 MHz (473 mm x 296 mm)
                 Hfront   24 Hsync 136 Hback  160 Hpol N
                 Vfront    3 Vsync   6 Vback   29 Vpol N
    Dummy Descriptor:
    Display Product Name: 'AIO PC'
    Display Range Limits:
      Monitor ranges (GTF): 56-60 Hz V, 30-50 kHz H, max dotclock 80 MHz
Checksum: 0xd3

----------------

Warnings:

Block 0, Base EDID:
  Detailed Timing Descriptor #1: Image size is 473x296 mm, but based on the picture AR it should be 394x296 mm.
  Display Range Limits: GTF support is deprecated in EDID 1.4.

Failures:

Block 0, Base EDID:
  Dummy Descriptor: Dummy block filled with garbage.
  Display Range Limits: GTF is supported, but the display does not support continuous frequencies.
EDID:
  Extension Block 1 started with EDID header, ignoring Extension Blocks >= 1.

EDID conformity: FAIL
