edid-decode (hex):

00 ff ff ff ff ff ff 00 4a 8b 36 21 21 04 15 20
12 19 01 04 a5 2b 18 78 e2 54 60 ab 52 38 ab 25
13 50 54 00 00 00 01 01 01 01 01 01 01 01 01 01
01 01 01 01 01 01 2f 26 40 a0 60 84 1a 30 30 20
35 00 b0 ef 10 00 00 1e 00 00 00 10 00 50 4b 35
37 33 37 41 47 35 37 35 55 0a 00 00 00 fc 00 41
49 4f 20 50 43 0a 20 20 20 20 20 20 00 00 00 fd
00 3b 3d 32 3c 0a 00 0a 20 20 20 20 20 20 00 c7

00 ff ff ff ff ff ff 00 4a 8b 36 21 21 04 15 20
12 19 01 04 a5 2b 18 78 e2 54 60 ab 52 38 ab 25
13 50 54 00 00 00 01 01 01 01 01 01 01 01 01 01
01 01 01 01 01 01 2f 26 40 a0 60 84 1a 30 30 20
35 00 b0 ef 10 00 00 1e 00 00 00 10 00 50 4b 35
37 33 37 41 47 35 37 35 55 0a 00 00 00 fc 00 41
49 4f 20 50 43 0a 20 20 20 20 20 20 00 00 00 fd
00 3b 3d 32 3c 0a 00 0a 20 20 20 20 20 20 00 c7

----------------

Block 0, Base EDID:
  EDID Structure Version & Revision: 1.4
  Vendor & Product Identification:
    Manufacturer: RTK
    Model: 8502
    Serial Number: ...
    Made in: week 18 of 2015
  Basic Display Parameters & Features:
    Digital display
    Bits per primary color channel: 8
    DisplayPort interface
    Maximum image size: 43 cm x 24 cm
    Gamma: 2.20
    DPMS levels: Standby Suspend Off
    Supported color formats: RGB 4:4:4
    First detailed timing includes the native pixel format and preferred refresh rate
  Color Characteristics:
    Red  : 0.6689, 0.3212
    Green: 0.2197, 0.6679
    Blue : 0.1455, 0.0761
    White: 0.3125, 0.3281
  Established Timings I & II: none
  Standard Timings: none
  Detailed Timing Descriptors:
    DTD 1:  1600x900    59.978156 Hz  16:9     55.540 kHz     97.750000 MHz (432 mm x 239 mm)
                 Hfront   48 Hsync  32 Hback   80 Hpol P
                 Vfront    3 Vsync   5 Vback   18 Vpol P
    Dummy Descriptor:
    Display Product Name: 'AIO PC'
    Display Range Limits:
      Monitor ranges (GTF): 59-61 Hz V, 50-60 kHz H, max dotclock 100 MHz
Checksum: 0xc7

----------------

Block 1, Unknown EDID Extension Block 0x00:
  00 ff ff ff ff ff ff 00 4a 8b 36 21 21 04 15 20 '........J.6!!.. '
  12 19 01 04 a5 2b 18 78 e2 54 60 ab 52 38 ab 25 '.....+.x.T`.R8.%'
  13 50 54 00 00 00 01 01 01 01 01 01 01 01 01 01 '.PT.............'
  01 01 01 01 01 01 2f 26 40 a0 60 84 1a 30 30 20 '....../&@.`..00 '
  35 00 b0 ef 10 00 00 1e 00 00 00 10 00 50 4b 35 '5............PK5'
  37 33 37 41 47 35 37 35 55 0a 00 00 00 fc 00 41 '737AG575U......A'
  49 4f 20 50 43 0a 20 20 20 20 20 20 00 00 00 fd 'IO PC.      ....'
  00 3b 3d 32 3c 0a 00 0a 20 20 20 20 20 20 00 c7 '.;=2<...      ..'
Checksum: 0xc7

----------------

Warnings:

Block 0, Base EDID:
  Display Range Limits: GTF support is deprecated in EDID 1.4.

Failures:

Block 0, Base EDID:
  Dummy Descriptor: Dummy block filled with garbage.
  Display Range Limits: GTF is supported, but the display does not support continuous frequencies.
Block 1, Base EDID:
  Unknown Extension Block.
EDID:
  Base EDID: EDID specified 0 extension block(s), but found 1 extension block(s).

EDID conformity: FAIL
