edid-decode (hex):

00 ff ff ff ff ff ff 00 4a 8b 36 21 05 11 14 20
2e 18 01 04 a5 2f 1d 78 e2 54 60 ab 52 38 ab 25
13 50 54 00 00 00 01 01 01 01 01 01 01 01 01 01
01 01 01 01 01 01 02 3a 80 18 71 38 2d 40 58 2c
45 00 d9 28 11 00 00 1a 00 00 00 10 00 50 4b 35
37 33 37 41 47 35 37 35 55 0a 00 00 00 fc 00 41
49 4f 20 50 43 0a 20 20 20 20 20 20 00 00 00 fd
00 38 3c 1e 46 0f 00 0a 20 20 20 20 20 20 00 92

----------------

Block 0, Base EDID:
  EDID Structure Version & Revision: 1.4
  Vendor & Product Identification:
    Manufacturer: RTK
    Model: 8502
    Serial Number: ...
    Made in: week 46 of 2014
  Basic Display Parameters & Features:
    Digital display
    Bits per primary color channel: 8
    DisplayPort interface
    Maximum image size: 47 cm x 29 cm
    Gamma: 2.20
    DPMS levels: Standby Suspend Off
    Supported color formats: RGB 4:4:4
    First detailed timing includes the native pixel format and preferred refresh rate
  Color Characteristics:
    Red  : 0.6689, 0.3212
    Green: 0.2197, 0.6679
    Blue : 0.1455, 0.0761
    White: 0.3125, 0.3281
  Established Timings I & II: none
  Standard Timings: none
  Detailed Timing Descriptors:
    DTD 1:  1920x1080   60.000000 Hz  16:9     67.500 kHz    148.500000 MHz (473 mm x 296 mm)
                 Hfront   88 Hsync  44 Hback  148 Hpol P
                 Vfront    4 Vsync   5 Vback   36 Vpol N
    Dummy Descriptor:
    Display Product Name: 'AIO PC'
    Display Range Limits:
      Monitor ranges (GTF): 56-60 Hz V, 30-70 kHz H, max dotclock 150 MHz
Checksum: 0x92

----------------

Warnings:

Block 0, Base EDID:
  Detailed Timing Descriptor #1: DTD is similar but not identical to VIC 16.
  Detailed Timing Descriptor #1: Image size is 473x296 mm, but based on the picture AR it should be 473x266 mm.
  Display Range Limits: GTF support is deprecated in EDID 1.4.

Failures:

Block 0, Base EDID:
  Dummy Descriptor: Dummy block filled with garbage.
  Display Range Limits: GTF is supported, but the display does not support continuous frequencies.

EDID conformity: FAIL
