edid-decode (hex):

00 ff ff ff ff ff ff 00 0e 14 75 17 00 00 00 00
2a 11 01 03 80 1e 13 78 0a ad 0f 96 53 50 8a 27
20 50 54 00 00 00 01 01 01 01 01 01 01 01 01 01
01 01 01 01 01 01 17 1e 00 18 51 20 17 30 30 20
36 00 30 be 10 00 00 1a 17 1e 00 18 51 20 17 30
30 20 36 00 30 be 10 00 00 1a 00 00 00 fe 00 50
59 36 37 36 81 31 34 31 57 42 33 20 00 00 00 00
00 2f 3d 4a 52 6f 8f c0 ff 01 01 0a 20 20 00 c8

----------------

Block 0, Base EDID:
  EDID Structure Version & Revision: 1.3
  Vendor & Product Identification:
    Manufacturer: CPT
    Model: 6005
    Made in: week 42 of 2007
  Basic Display Parameters & Features:
    Digital display
    Maximum image size: 30 cm x 19 cm
    Gamma: 2.20
    RGB color display
    First detailed timing is the preferred timing
  Color Characteristics:
    Red  : 0.5878, 0.3261
    Green: 0.3154, 0.5400
    Blue : 0.1523, 0.1250
    White: 0.3154, 0.3310
  Established Timings I & II: none
  Standard Timings: none
  Detailed Timing Descriptors:
    DTD 1:  1280x800    59.997819 Hz  16:10    49.378 kHz     77.030000 MHz (304 mm x 190 mm)
                 Hfront   48 Hsync  32 Hback  200 Hpol P
                 Vfront    3 Vsync   6 Vback   14 Vpol N
    DTD 2:  1280x800    59.997819 Hz  16:10    49.378 kHz     77.030000 MHz (304 mm x 190 mm)
                 Hfront   48 Hsync  32 Hback  200 Hpol P
                 Vfront    3 Vsync   6 Vback   14 Vpol N
    Alphanumeric Data String: 'PY676.141WB3 '
    Manufacturer-Specified Display Descriptor (0x00): 00 00 00 2f 3d 4a 52 6f 8f c0 ff 01 01 0a 20 20 '.../=JRo......  '
Checksum: 0xc8

----------------

Warnings:

Block 0, Base EDID:
  Alphanumeric Data String: Non-ASCII character 0x81 at position 5, can cause problems.

Failures:

Block 0, Base EDID:
  Alphanumeric Data String: No newline, but one or more trailing spaces.
  Missing Display Product Name.
  Missing Display Range Limits Descriptor.

EDID conformity: FAIL
