edid-decode (hex):

00 ff ff ff ff ff ff 00 30 ae a7 41 00 00 00 00
00 1f 01 04 a5 1d 12 78 e3 93 88 a7 53 4c 98 24
11 52 58 00 00 00 01 01 01 01 01 01 01 01 01 01
01 01 01 01 01 01 74 3c 80 a0 70 b0 28 40 30 20
36 00 1e b3 10 00 00 1a 00 00 00 fd 00 28 3c 4b
4b 10 01 0a 20 20 20 20 20 20 00 00 00 0f 00 d1
0a 28 d1 0a 28 28 0a 00 09 e5 1b 0a 00 00 00 fe
00 4e 56 31 33 33 57 55 4d 2d 4e 36 33 0a 00 e0

00 ff ff ff ff ff ff 00 30 ae a7 41 00 00 00 00
00 1f 01 04 a5 1d 12 78 e3 93 88 a7 53 4c 98 24
11 52 58 00 00 00 01 01 01 01 01 01 01 01 01 01
01 01 01 01 01 01 74 3c 80 a0 70 b0 28 40 30 20
36 00 1e b3 10 00 00 1a 00 00 00 fd 00 28 3c 4b
4b 10 01 0a 20 20 20 20 20 20 00 00 00 0f 00 d1
0a 28 d1 0a 28 28 0a 00 09 e5 1b 0a 00 00 00 fe
00 4e 56 31 33 33 57 55 4d 2d 4e 36 33 0a 00 e0

----------------

Block 0, Base EDID:
  EDID Structure Version & Revision: 1.4
  Vendor & Product Identification:
    Manufacturer: LEN
    Model: 16807
    Made in: 2021
  Basic Display Parameters & Features:
    Digital display
    Bits per primary color channel: 8
    DisplayPort interface
    Maximum image size: 29 cm x 18 cm
    Gamma: 2.20
    DPMS levels: Standby Suspend Off
    Supported color formats: RGB 4:4:4
    First detailed timing includes the native pixel format and preferred refresh rate
    Display supports continuous frequencies
  Color Characteristics:
    Red  : 0.6542, 0.3251
    Green: 0.2968, 0.5966
    Blue : 0.1425, 0.0664
    White: 0.3222, 0.3437
  Established Timings I & II: none
  Standard Timings: none
  Detailed Timing Descriptors:
    DTD 1:  1920x1200   60.003102 Hz  16:10    74.404 kHz    154.760000 MHz (286 mm x 179 mm)
                 Hfront   48 Hsync  32 Hback   80 Hpol P
                 Vfront    3 Vsync   6 Vback   31 Vpol N
    Display Range Limits:
      Monitor ranges (Range Limits Only): 40-60 Hz V, 75-75 kHz H, max dotclock 160 MHz
    Manufacturer-Specified Display Descriptor (0x0f): 00 0f 00 d1 0a 28 d1 0a 28 28 0a 00 09 e5 1b 0a '.....(..((......'
    Alphanumeric Data String: 'NV133WUM-N63'
Checksum: 0xe0

----------------

Warnings:

Block 0, Base EDID:
  Missing Display Product Name.
EDID:
  Base EDID: Some timings are out of range of the Monitor Ranges:
    Horizontal Freq: 74.403 - 74.403 kHz (Monitor: 75.000 - 75.000 kHz)
    Could be due to a Monitor Range off-by-one rounding issue

Failures:

EDID:
  Extension Block 1 started with EDID header, ignoring Extension Blocks >= 1.

EDID conformity: FAIL
