edid-decode (hex):

00 ff ff ff ff ff ff 00 36 74 11 11 01 00 00 00
1e 15 01 03 80 33 1d 78 ee ee 20 a3 56 51 9e 27
0b 50 54 00 00 00 01 01 01 01 01 01 01 01 01 01
01 01 01 01 01 01 9d 34 80 64 70 38 1f 40 1e 14
35 00 fd 1e 11 00 00 00 00 00 00 fc 00 4f 70 74
69 50 6c 65 78 20 39 30 31 30 00 00 00 fc 00 0a
20 20 20 20 20 20 20 20 20 20 20 20 00 00 00 fc
00 0a 20 20 20 20 20 20 20 20 20 20 20 20 00 7a

00 ff ff ff ff ff ff 00 36 74 11 11 01 00 00 00
1e 15 01 03 80 33 1d 78 ee ee 20 a3 56 51 9e 27
0b 50 54 00 00 00 01 01 01 01 01 01 01 01 01 01
01 01 01 01 01 01 9d 34 80 64 70 38 1f 40 1e 14
35 00 fd 1e 11 00 00 00 00 00 00 fc 00 4f 70 74
69 50 6c 65 78 20 39 30 31 30 00 00 00 fc 00 0a
20 20 20 20 20 20 20 20 20 20 20 20 00 00 00 fc
00 0a 20 20 20 20 20 20 20 20 20 20 20 20 00 7a

----------------

Block 0, Base EDID:
  EDID Structure Version & Revision: 1.3
  Vendor & Product Identification:
    Manufacturer: MST
    Model: 4369
    Serial Number: ...
    Made in: week 30 of 2011
  Basic Display Parameters & Features:
    Digital display
    Maximum image size: 51 cm x 29 cm
    Gamma: 2.20
    DPMS levels: Standby Suspend Off
    RGB color display
    Default (sRGB) color space is primary color space
    First detailed timing is the preferred timing
  Color Characteristics:
    Red  : 0.6396, 0.3378
    Green: 0.3193, 0.6191
    Blue : 0.1523, 0.0449
    White: 0.3125, 0.3281
  Established Timings I & II: none
  Standard Timings: none
  Detailed Timing Descriptors:
    DTD 1:  1920x1080   60.016398 Hz  16:9     66.678 kHz    134.690000 MHz (analog composite, sync-on-green, 509 mm x 286 mm)
                 Hfront   30 Hsync  20 Hback   50 Hpol N
                 Vfront    3 Vsync   5 Vback   23 Vpol N
    Display Product Name: 'OptiPlex 9010'
    Display Product Name: ''
    Display Product Name: ''
Checksum: 0x7a

----------------

Block 1, Unknown EDID Extension Block 0x00:
  00 ff ff ff ff ff ff 00 36 74 11 11 01 00 00 00 '........6t......'
  1e 15 01 03 80 33 1d 78 ee ee 20 a3 56 51 9e 27 '.....3.x.. .VQ.''
  0b 50 54 00 00 00 01 01 01 01 01 01 01 01 01 01 '.PT.............'
  01 01 01 01 01 01 9d 34 80 64 70 38 1f 40 1e 14 '.......4.dp8.@..'
  35 00 fd 1e 11 00 00 00 00 00 00 fc 00 4f 70 74 '5............Opt'
  69 50 6c 65 78 20 39 30 31 30 00 00 00 fc 00 0a 'iPlex 9010......'
  20 20 20 20 20 20 20 20 20 20 20 20 00 00 00 fc '            ....'
  00 0a 20 20 20 20 20 20 20 20 20 20 20 20 00 7a '..            .z'
Checksum: 0x7a

----------------

Warnings:

Block 0, Base EDID:
  Vendor & Product Identification: The serial number is one of the known dummy values, it should probably be set to 0.

Failures:

Block 0, Base EDID:
  Basic Display Parameters & Features: sRGB is signaled, but the chromaticities do not match.
  Display Product Name: Empty string.
  Display Product Name: Empty string.
  Missing Display Range Limits Descriptor.
Block 1, Base EDID:
  Unknown Extension Block.
EDID:
  Base EDID: EDID specified 0 extension block(s), but found 1 extension block(s).

EDID conformity: FAIL
