edid-decode (hex):

00 ff ff ff ff ff ff 00 59 3a 63 00 01 01 01 01
02 14 01 03 80 79 44 78 0a 49 4b a6 55 4e 98 26
0f 47 4a a5 ce 00 01 01 01 01 01 01 01 01 01 01
01 01 01 01 01 01 02 3a 80 18 71 38 2d 40 58 2c
45 00 ba a8 42 00 00 1e 00 00 00 fd 00 32 4d 1f
46 0f 00 0a 20 20 20 20 20 20 00 00 00 ff 00 53
50 47 53 41 4c 30 31 30 30 30 30 31 00 00 00 fc
00 4d 35 35 30 4e 56 0a 20 20 20 20 20 20 01 d9

02 03 1b 71 46 01 03 04 05 90 20 23 11 07 38 83
01 00 00 67 03 0c 00 30 00 28 2d 02 3a 80 18 71
38 2d 40 58 2c 55 00 ba a8 42 00 00 1e 01 1d 00
72 51 d0 1e 20 6e 28 55 00 ba a8 42 00 00 1e 00
00 00 00 00 00 00 00 00 00 00 01 ff ff ff ff ff
ff ff ff ff ff ff ff ff ff ff ff ff ff ff ff ff
ff ff ff ff ff ff ff ff ff ff ff ff ff ff ff ff
ff ff ff ff ff ff ff ff ff ff ff ff ff ff ff ff

----------------

Block 0, Base EDID:
  EDID Structure Version & Revision: 1.3
  Vendor & Product Identification:
    Manufacturer: VIZ
    Model: 99
    Serial Number: ...
    Made in: week 2 of 2010
  Basic Display Parameters & Features:
    Digital display
    Maximum image size: 121 cm x 68 cm
    Gamma: 2.20
    RGB color display
    First detailed timing is the preferred timing
  Color Characteristics:
    Red  : 0.6494, 0.3320
    Green: 0.3066, 0.5947
    Blue : 0.1494, 0.0585
    White: 0.2792, 0.2919
  Established Timings I & II:
    IBM     :   720x400    70.081663 Hz   9:5     31.467 kHz     28.320000 MHz
    DMT 0x04:   640x480    59.940476 Hz   4:3     31.469 kHz     25.175000 MHz
    DMT 0x06:   640x480    75.000000 Hz   4:3     37.500 kHz     31.500000 MHz
    DMT 0x09:   800x600    60.316541 Hz   4:3     37.879 kHz     40.000000 MHz
    DMT 0x0a:   800x600    72.187572 Hz   4:3     48.077 kHz     50.000000 MHz
    DMT 0x0b:   800x600    75.000000 Hz   4:3     46.875 kHz     49.500000 MHz
    DMT 0x10:  1024x768    60.003840 Hz   4:3     48.363 kHz     65.000000 MHz
    DMT 0x11:  1024x768    70.069359 Hz   4:3     56.476 kHz     75.000000 MHz
    DMT 0x12:  1024x768    75.028582 Hz   4:3     60.023 kHz     78.750000 MHz
  Standard Timings: none
  Detailed Timing Descriptors:
    DTD 1:  1920x1080   60.000000 Hz  16:9     67.500 kHz    148.500000 MHz (1210 mm x 680 mm)
                 Hfront   88 Hsync  44 Hback  148 Hpol P
                 Vfront    4 Vsync   5 Vback   36 Vpol P
    Display Range Limits:
      Monitor ranges (GTF): 50-77 Hz V, 31-70 kHz H, max dotclock 150 MHz
    Display Product Serial Number: ...
    Display Product Name: 'M550NV'
  Extension blocks: 1
Checksum: 0xd9

----------------

Block 1, CTA-861 Extension Block:
  Revision: 3
  Basic audio support
  Supports YCbCr 4:4:4
  Supports YCbCr 4:2:2
  Native DTDs: 1
  Video Data Block:
    VIC   1:   640x480    59.940476 Hz   4:3     31.469 kHz     25.175000 MHz
    VIC   3:   720x480    59.940060 Hz  16:9     31.469 kHz     27.000000 MHz
    VIC   4:  1280x720    60.000000 Hz  16:9     45.000 kHz     74.250000 MHz
    VIC   5:  1920x1080i  60.000000 Hz  16:9     33.750 kHz     74.250000 MHz
    VIC  16:  1920x1080   60.000000 Hz  16:9     67.500 kHz    148.500000 MHz (native)
    VIC  32:  1920x1080   24.000000 Hz  16:9     27.000 kHz     74.250000 MHz
  Audio Data Block:
    AC-3:
      Max channels: 2
      Supported sample rates (kHz): 48 44.1 32
      Maximum bit rate: 448 kb/s
  Speaker Allocation Data Block:
    FL/FR - Front Left/Right
  Vendor-Specific Data Block (HDMI), OUI 00-0C-03:
    Source physical address: 3.0.0.0
    DC_36bit
    DC_Y444
    Maximum TMDS clock: 225 MHz
  Detailed Timing Descriptors:
    DTD 2:  1920x1080   60.000000 Hz  16:9     67.500 kHz    148.500000 MHz (1210 mm x 680 mm)
                 Hfront   88 Hsync  44 Hback  148 Hpol P
                 Vfront    5 Vsync   5 Vback   35 Vpol P
    DTD 3:  1280x720    60.000000 Hz  16:9     45.000 kHz     74.250000 MHz (1210 mm x 680 mm)
                 Hfront  110 Hsync  40 Hback  220 Hpol P
                 Vfront    5 Vsync   5 Vback   20 Vpol P
    Manufacturer-Specified Display Descriptor (0x00): 00 00 00 00 00 00 00 00 00 01 ff ff ff ff ff ff '................'
    DTD 4:  4095x8190i  10.418373 Hz   1:2     80.018 kHz    655.350000 MHz (side by side interleaved, 4095 mm x 4095 mm)
                 Hfront 1023 Hsync 1023 Hback 1539 Hpol P Hborder 255
                 Vfront   63 Vsync  63 Vback 3459 Vpol P Vborder 255 Vfront +0.5 Odd Field
                 Vfront   63 Vsync  63 Vback 3459 Vpol P Vborder 255 Vback  +0.5 Even Field
    DTD 5:  4095x8190i  10.418373 Hz   1:2     80.018 kHz    655.350000 MHz (side by side interleaved, 4095 mm x 4095 mm)
                 Hfront 1023 Hsync 1023 Hback 1539 Hpol P Hborder 255
                 Vfront   63 Vsync  63 Vback 3459 Vpol P Vborder 255 Vfront +0.5 Odd Field
                 Vfront   63 Vsync  63 Vback 3459 Vpol P Vborder 255 Vback  +0.5 Even Field
Checksum: 0xff (should be 0x8c)  Unused space in Extension Block: 10 bytes

----------------

Warnings:

Block 0, Base EDID:
  Vendor & Product Identification: The serial number is one of the known dummy values, it should probably be set to 0.
Block 1, CTA-861 Extension Block:
  IT Video Formats are overscanned by default, but normally this should be underscanned.
  Video Data Block: VIC 1 and the first DTD are not identical. Is this intended?
  Video Data Block: All VICs are in ascending order, and the first (preferred) VIC <= 4, is that intended?
  Detailed Timing Descriptor #2: DTD is similar but not identical to VIC 16.
  Detailed Timing Descriptor #4: Image size is 4095x4095 mm, but based on the picture AR it should be 2047x4095 mm.
  Detailed Timing Descriptor #4: The use of non-zero borders in a DTD is not recommended.
  Detailed Timing Descriptor #5: Image size is 4095x4095 mm, but based on the picture AR it should be 2047x4095 mm.
  Detailed Timing Descriptor #5: The use of non-zero borders in a DTD is not recommended.
  Display Product Serial Number is set, so the Serial Number in the Base EDID should be 0.
  Add a Colorimetry Data Block with the sRGB colorimetry bit set to avoid interop issues.
EDID:
  Base EDID: Some timings are out of range of the Monitor Ranges:
    Vertical Freq: 10.418 - 75.029 Hz (Monitor: 50.000 - 77.000 Hz)
    Horizontal Freq: 27.000 - 80.018 kHz (Monitor: 31.000 - 70.000 kHz)
    Maximum Clock: 655.350 MHz (Monitor: 150.000 MHz)

Failures:

Block 1, CTA-861 Extension Block:
  Detailed Timing Descriptor #4: Mismatch of image size 4095x4095 mm vs display size 1210x680 mm.
  Detailed Timing Descriptor #4: Invalid detailed timing descriptor ordering.
  Detailed Timing Descriptor #5: Mismatch of image size 4095x4095 mm vs display size 1210x680 mm.
  Detailed Timing Descriptor #5: Invalid detailed timing descriptor ordering.
  Padding: Contains non-zero bytes.
  Missing VCDB, needed for Set Selectable RGB Quantization to avoid interop issues.
  Invalid checksum 0xff (should be 0x8c).
EDID:
  Base EDID: The DTD max image size is 4095x4095mm, which is larger than the display size 1210.0x680.0mm.
  CTA-861: The maximum HDMI TMDS clock is 225000 kHz, but one or more video timings go up to 655350 kHz.

EDID conformity: FAIL
