edid-decode (hex):

00 ff ff ff ff ff ff 00 30 ae 81 90 00 00 00 00
29 1e 01 04 a5 26 16 78 03 d3 35 a3 57 52 9f 28
0e 50 54 00 00 00 01 01 01 01 01 01 01 01 01 01
01 01 01 01 01 01 3b 38 80 de 70 38 28 40 30 20
36 00 7e d7 10 00 00 1a 00 00 00 fd 00 28 3c 43
43 0e 01 0a 20 20 20 20 20 20 00 00 00 fe 00 42
4f 45 20 43 51 0a 20 20 20 20 20 20 00 00 00 fe
00 4e 56 31 37 33 46 48 4d 2d 4e 34 4b 0a 00 7e

00 ff ff ff ff ff ff 00 30 ae 81 90 00 00 00 00
29 1e 01 04 a5 26 16 78 03 d3 35 a3 57 52 9f 28
0e 50 54 00 00 00 01 01 01 01 01 01 01 01 01 01
01 01 01 01 01 01 3b 38 80 de 70 38 28 40 30 20
36 00 7e d7 10 00 00 1a 00 00 00 fd 00 28 3c 43
43 0e 01 0a 20 20 20 20 20 20 00 00 00 fe 00 42
4f 45 20 43 51 0a 20 20 20 20 20 20 00 00 00 fe
00 4e 56 31 37 33 46 48 4d 2d 4e 34 4b 0a 00 7e

----------------

Block 0, Base EDID:
  EDID Structure Version & Revision: 1.4
  Vendor & Product Identification:
    Manufacturer: LEN
    Model: 36993
    Made in: week 41 of 2020
  Basic Display Parameters & Features:
    Digital display
    Bits per primary color channel: 8
    DisplayPort interface
    Maximum image size: 38 cm x 22 cm
    Gamma: 2.20
    Supported color formats: RGB 4:4:4
    First detailed timing includes the native pixel format and preferred refresh rate
    Display supports continuous frequencies
  Color Characteristics:
    Red  : 0.6396, 0.3408
    Green: 0.3203, 0.6240
    Blue : 0.1562, 0.0576
    White: 0.3134, 0.3291
  Established Timings I & II: none
  Standard Timings: none
  Detailed Timing Descriptors:
    DTD 1:  1920x1080   60.003168 Hz  16:9     67.204 kHz    143.950000 MHz (382 mm x 215 mm)
                 Hfront   48 Hsync  32 Hback  142 Hpol P
                 Vfront    3 Vsync   6 Vback   31 Vpol N
    Display Range Limits:
      Monitor ranges (Range Limits Only): 40-60 Hz V, 67-67 kHz H, max dotclock 140 MHz
    Alphanumeric Data String: 'BOE CQ'
    Alphanumeric Data String: 'NV173FHM-N4K'
Checksum: 0x7e

----------------

Warnings:

Block 0, Base EDID:
  Missing Display Product Name.
EDID:
  Base EDID: Some timings are out of range of the Monitor Ranges:
    Maximum Clock: 143.950 MHz (Monitor: 140.000 MHz)
    Could be due to a Monitor Range off-by-one rounding issue

Failures:

EDID:
  Extension Block 1 started with EDID header, ignoring Extension Blocks >= 1.

EDID conformity: FAIL
