edid-decode (hex):

00 ff ff ff ff ff ff 00 26 13 00 19 00 00 00 00
21 1f 01 03 08 29 1a 78 2a d7 a5 a2 59 4a 96 24
14 50 54 ad cf 00 71 40 81 00 81 80 81 40 81 c0
45 40 61 40 45 40 ba 22 a0 a0 50 84 1a 30 30 20
36 00 98 ff 10 00 00 1a 66 21 56 aa 51 00 1e 30
46 8f 33 00 55 00 11 00 00 1a 68 2b a0 a0 50 84
1a 30 30 20 37 00 c7 00 11 00 00 1a 00 00 00 fc
00 49 50 53 31 39 30 30 0a 20 20 20 20 20 00 ff

00 ff ff ff ff ff ff 00 26 13 00 19 00 00 00 00
21 1f 01 03 08 29 1a 78 2a d7 a5 a2 59 4a 96 24
14 50 54 ad cf 00 71 40 81 00 81 80 81 40 81 c0
45 40 61 40 45 40 ba 22 a0 a0 50 84 1a 30 30 20
36 00 98 ff 10 00 00 1a 66 21 56 aa 51 00 1e 30
46 8f 33 00 55 00 11 00 00 1a 68 2b a0 a0 50 84
1a 30 30 20 37 00 c7 00 11 00 00 1a 00 00 00 fc
00 49 50 53 31 39 30 30 0a 20 20 20 20 20 00 ff

----------------

Block 0, Base EDID:
  EDID Structure Version & Revision: 1.3
  Vendor & Product Identification:
    Manufacturer: IPS
    Model: 6400
    Made in: week 33 of 2021
  Basic Display Parameters & Features:
    Analog display
    Signal Level Standard: 0.700 : 0.300 : 1.000 V p-p
    Blank level equals black level
    Sync: Separate
    Maximum image size: 41 cm x 26 cm
    Gamma: 2.20
    DPMS levels: Off
    RGB color display
    First detailed timing is the preferred timing
  Color Characteristics:
    Red  : 0.6357, 0.3486
    Green: 0.2900, 0.5888
    Blue : 0.1425, 0.0800
    White: 0.3134, 0.3291
  Established Timings I & II:
    IBM     :   720x400    70.081663 Hz   9:5     31.467 kHz     28.320000 MHz
    DMT 0x04:   640x480    59.940476 Hz   4:3     31.469 kHz     25.175000 MHz
    DMT 0x05:   640x480    72.808802 Hz   4:3     37.861 kHz     31.500000 MHz
    DMT 0x06:   640x480    75.000000 Hz   4:3     37.500 kHz     31.500000 MHz
    DMT 0x09:   800x600    60.316541 Hz   4:3     37.879 kHz     40.000000 MHz
    DMT 0x0a:   800x600    72.187572 Hz   4:3     48.077 kHz     50.000000 MHz
    DMT 0x0b:   800x600    75.000000 Hz   4:3     46.875 kHz     49.500000 MHz
    DMT 0x10:  1024x768    60.003840 Hz   4:3     48.363 kHz     65.000000 MHz
    DMT 0x11:  1024x768    70.069359 Hz   4:3     56.476 kHz     75.000000 MHz
    DMT 0x12:  1024x768    75.028582 Hz   4:3     60.023 kHz     78.750000 MHz
    DMT 0x24:  1280x1024   75.024675 Hz   5:4     79.976 kHz    135.000000 MHz
  Standard Timings:
    GTF     :  1152x864    60.000000 Hz   4:3     53.700 kHz     81.624000 MHz
    DMT 0x1c:  1280x800    59.810326 Hz  16:10    49.702 kHz     83.500000 MHz
    DMT 0x23:  1280x1024   60.019740 Hz   5:4     63.981 kHz    108.000000 MHz
    DMT 0x20:  1280x960    60.000000 Hz   4:3     60.000 kHz    108.000000 MHz
    DMT 0x55:  1280x720    60.000000 Hz  16:9     45.000 kHz     74.250000 MHz
    DMT 0x09:   800x600    60.316541 Hz   4:3     37.879 kHz     40.000000 MHz
    DMT 0x10:  1024x768    60.003840 Hz   4:3     48.363 kHz     65.000000 MHz
    DMT 0x09:   800x600    60.316541 Hz   4:3     37.879 kHz     40.000000 MHz
  Detailed Timing Descriptors:
    DTD 1:  1440x900    60.002700 Hz  16:10    55.562 kHz     88.900000 MHz (408 mm x 255 mm)
                 Hfront   48 Hsync  32 Hback   80 Hpol P
                 Vfront    3 Vsync   6 Vback   17 Vpol N
    DTD 2:  1366x768    59.789541 Hz 683:384   47.712 kHz     85.500000 MHz (341 mm x 256 mm)
                 Hfront   70 Hsync 143 Hback  213 Hpol P
                 Vfront    3 Vsync   3 Vback   24 Vpol N
    DTD 3:  1440x900    75.000000 Hz  16:10    69.450 kHz    111.120000 MHz (455 mm x 256 mm)
                 Hfront   48 Hsync  32 Hback   80 Hpol P
                 Vfront    3 Vsync   7 Vback   16 Vpol N
    Display Product Name: 'IPS1900'
Checksum: 0xff

----------------

Block 1, Unknown EDID Extension Block 0x00:
  00 ff ff ff ff ff ff 00 26 13 00 19 00 00 00 00 '........&.......'
  21 1f 01 03 08 29 1a 78 2a d7 a5 a2 59 4a 96 24 '!....).x*...YJ.$'
  14 50 54 ad cf 00 71 40 81 00 81 80 81 40 81 c0 '.PT...q@.....@..'
  45 40 61 40 45 40 ba 22 a0 a0 50 84 1a 30 30 20 'E@a@E@."..P..00 '
  36 00 98 ff 10 00 00 1a 66 21 56 aa 51 00 1e 30 '6.......f!V.Q..0'
  46 8f 33 00 55 00 11 00 00 1a 68 2b a0 a0 50 84 'F.3.U.....h+..P.'
  1a 30 30 20 37 00 c7 00 11 00 00 1a 00 00 00 fc '.00 7...........'
  00 49 50 53 31 39 30 30 0a 20 20 20 20 20 00 ff '.IPS1900.     ..'
Checksum: 0xff

----------------

Warnings:

Block 0, Base EDID:
  Detailed Timing Descriptor #2: DTD is similar but not identical to DMT 0x51.
  Detailed Timing Descriptor #2: Image size is 341x256 mm, but based on the picture AR it should be 341x191 mm.
  Detailed Timing Descriptor #3: Image size is 455x256 mm, but based on the picture AR it should be 455x284 mm.

Failures:

Block 0, Base EDID:
  Detailed Timing Descriptor #3: Mismatch of image size 455x256 mm vs display size 410x260 mm.
  Missing Display Range Limits Descriptor.
Block 1, Base EDID:
  Unknown Extension Block.
EDID:
  Base EDID: The DTD max image size is 455x256mm, which is larger than the display size 410.0x260.0mm.
  Base EDID: EDID specified 0 extension block(s), but found 1 extension block(s).

EDID conformity: FAIL
