edid-decode (hex):

00 ff ff ff ff ff ff 00 34 a4 60 81 01 01 01 01
14 22 01 04 b5 46 27 78 3b ce 62 ac 51 45 a6 22
0c 4d 52 af ef 00 71 4f 81 80 81 8a 95 00 a9 c0
a9 cf b3 00 b3 0a 4c 98 80 a0 70 38 38 40 30 40
35 00 ba 88 21 00 00 1e 00 00 00 ff 00 30 30 30
30 30 30 30 30 30 30 30 30 31 00 00 00 fd 00 30
a5 c8 c8 2d 01 0a 20 20 20 20 20 20 00 00 00 fc
00 4d 44 32 32 30 39 33 0a 20 20 20 20 20 01 b8

02 03 33 f1 4a 90 1f 05 14 04 13 03 12 3f 01 23
09 07 07 83 01 00 00 e3 05 e0 00 6d 1a 00 00 02
01 30 b4 00 00 00 00 00 00 e6 06 07 01 60 5b 29
e2 00 ca ab 22 a0 a0 50 84 1a 30 30 20 36 00 ba
88 21 00 00 1e 36 84 80 a0 70 38 32 40 30 20 35
00 ba 88 21 00 00 1e 02 3a 80 18 71 38 2d 40 58
2c 45 00 ba 88 21 00 00 1e 0e 5c 80 a0 70 38 35
40 30 20 35 00 ba 88 21 00 00 1e 00 00 00 00 d4

00 ff ff ff ff ff ff 00 34 a4 60 81 01 01 01 01
14 22 01 04 b5 46 27 78 3b ce 62 ac 51 45 a6 22
0c 4d 52 af ef 00 71 4f 81 80 81 8a 95 00 a9 c0
a9 cf b3 00 b3 0a 4c 98 80 a0 70 38 38 40 30 40
35 00 ba 88 21 00 00 1e 00 00 00 ff 00 30 30 30
30 30 30 30 30 30 30 30 30 31 00 00 00 fd 00 30
a5 c8 c8 2d 01 0a 20 20 20 20 20 20 00 00 00 fc
00 4d 44 32 32 30 39 33 0a 20 20 20 20 20 01 b8

02 03 33 f1 4a 90 1f 05 14 04 13 03 12 3f 01 23
09 07 07 83 01 00 00 e3 05 e0 00 6d 1a 00 00 02
01 30 b4 00 00 00 00 00 00 e6 06 07 01 60 5b 29
e2 00 ca ab 22 a0 a0 50 84 1a 30 30 20 36 00 ba
88 21 00 00 1e 36 84 80 a0 70 38 32 40 30 20 35
00 ba 88 21 00 00 1e 02 3a 80 18 71 38 2d 40 58
2c 45 00 ba 88 21 00 00 1e 0e 5c 80 a0 70 38 35
40 30 20 35 00 ba 88 21 00 00 1e 00 00 00 00 d4

----------------

Block 0, Base EDID:
  EDID Structure Version & Revision: 1.4
  Vendor & Product Identification:
    Manufacturer: MED
    Model: 33120
    Serial Number: ...
    Made in: week 20 of 2024
  Basic Display Parameters & Features:
    Digital display
    Bits per primary color channel: 10
    DisplayPort interface
    Maximum image size: 70 cm x 39 cm
    Gamma: 2.20
    DPMS levels: Off
    Supported color formats: RGB 4:4:4, YCrCb 4:4:4, YCrCb 4:2:2
    First detailed timing includes the native pixel format and preferred refresh rate
    Display supports continuous frequencies
  Color Characteristics:
    Red  : 0.6748, 0.3164
    Green: 0.2724, 0.6503
    Blue : 0.1337, 0.0488
    White: 0.3007, 0.3222
  Established Timings I & II:
    IBM     :   720x400    70.081663 Hz   9:5     31.467 kHz     28.320000 MHz
    DMT 0x04:   640x480    59.940476 Hz   4:3     31.469 kHz     25.175000 MHz
    DMT 0x05:   640x480    72.808802 Hz   4:3     37.861 kHz     31.500000 MHz
    DMT 0x06:   640x480    75.000000 Hz   4:3     37.500 kHz     31.500000 MHz
    DMT 0x08:   800x600    56.250000 Hz   4:3     35.156 kHz     36.000000 MHz
    DMT 0x09:   800x600    60.316541 Hz   4:3     37.879 kHz     40.000000 MHz
    DMT 0x0a:   800x600    72.187572 Hz   4:3     48.077 kHz     50.000000 MHz
    DMT 0x0b:   800x600    75.000000 Hz   4:3     46.875 kHz     49.500000 MHz
    Apple   :   832x624    74.551266 Hz   4:3     49.726 kHz     57.284000 MHz
    DMT 0x10:  1024x768    60.003840 Hz   4:3     48.363 kHz     65.000000 MHz
    DMT 0x11:  1024x768    70.069359 Hz   4:3     56.476 kHz     75.000000 MHz
    DMT 0x12:  1024x768    75.028582 Hz   4:3     60.023 kHz     78.750000 MHz
    DMT 0x24:  1280x1024   75.024675 Hz   5:4     79.976 kHz    135.000000 MHz
  Standard Timings:
    DMT 0x15:  1152x864    75.000000 Hz   4:3     67.500 kHz    108.000000 MHz
    DMT 0x23:  1280x1024   60.019740 Hz   5:4     63.981 kHz    108.000000 MHz
    GTF     :  1280x1024   69.999805 Hz   5:4     74.620 kHz    128.943000 MHz
    DMT 0x2f:  1440x900    59.887445 Hz  16:10    55.935 kHz    106.500000 MHz
    DMT 0x53:  1600x900    60.000000 Hz  16:9     60.000 kHz    108.000000 MHz (RB)
    GTF     :  1600x900    75.000000 Hz  16:9     70.500 kHz    152.280000 MHz
    DMT 0x3a:  1680x1050   59.954250 Hz  16:10    65.290 kHz    146.250000 MHz
    GTF     :  1680x1050   70.000113 Hz  16:10    76.510 kHz    173.831000 MHz
  Detailed Timing Descriptors:
    DTD 1:  1920x1080  165.002031 Hz  16:9    187.442 kHz    389.880000 MHz (698 mm x 392 mm)
                 Hfront   48 Hsync  64 Hback   48 Hpol P
                 Vfront    3 Vsync   5 Vback   48 Vpol P
    Display Product Serial Number: ...
    Display Range Limits:
      Monitor ranges (Range Limits Only): 48-165 Hz V, 200-200 kHz H, max dotclock 450 MHz
    Display Product Name: 'MD22093'
  Extension blocks: 1
Checksum: 0xb8

----------------

Block 1, CTA-861 Extension Block:
  Revision: 3
  Underscans IT Video Formats by default
  Basic audio support
  Supports YCbCr 4:4:4
  Supports YCbCr 4:2:2
  Native DTDs: 1
  Video Data Block:
    VIC  16:  1920x1080   60.000000 Hz  16:9     67.500 kHz    148.500000 MHz (native)
    VIC  31:  1920x1080   50.000000 Hz  16:9     56.250 kHz    148.500000 MHz
    VIC   5:  1920x1080i  60.000000 Hz  16:9     33.750 kHz     74.250000 MHz
    VIC  20:  1920x1080i  50.000000 Hz  16:9     28.125 kHz     74.250000 MHz
    VIC   4:  1280x720    60.000000 Hz  16:9     45.000 kHz     74.250000 MHz
    VIC  19:  1280x720    50.000000 Hz  16:9     37.500 kHz     74.250000 MHz
    VIC   3:   720x480    59.940060 Hz  16:9     31.469 kHz     27.000000 MHz
    VIC  18:   720x576    50.000000 Hz  16:9     31.250 kHz     27.000000 MHz
    VIC  63:  1920x1080  120.000000 Hz  16:9    135.000 kHz    297.000000 MHz
    VIC   1:   640x480    59.940476 Hz   4:3     31.469 kHz     25.175000 MHz
  Audio Data Block:
    Linear PCM:
      Max channels: 2
      Supported sample rates (kHz): 48 44.1 32
      Supported sample sizes (bits): 24 20 16
  Speaker Allocation Data Block:
    FL/FR - Front Left/Right
  Colorimetry Data Block:
    BT2020cYCC
    BT2020YCC
    BT2020RGB
  Vendor-Specific Data Block (AMD), OUI 00-00-1A:
    Version: 2
    Feature Caps: 0x01
    Minimum Refresh Rate: 48 Hz
    Maximum Refresh Rate: 180 Hz
    Flags 1.x: 0x00
    Flags 2.x: 0x00
  HDR Static Metadata Data Block:
    Electro optical transfer functions:
      Traditional gamma - SDR luminance range
      Traditional gamma - HDR luminance range
      SMPTE ST2084
    Supported static metadata descriptors:
      Static metadata type 1
    Desired content max luminance: 96 (400.000 cd/m^2)
    Desired content max frame-average luminance: 91 (358.942 cd/m^2)
    Desired content min luminance: 41 (0.103 cd/m^2)
  Video Capability Data Block:
    YCbCr quantization: Selectable (via AVI YQ)
    RGB quantization: Selectable (via AVI Q)
    PT scan behavior: No Data
    IT scan behavior: Always Underscanned
    CE scan behavior: Always Underscanned
  Detailed Timing Descriptors:
    DTD 2:  1440x900    59.901458 Hz  16:10    55.469 kHz     88.750000 MHz (698 mm x 392 mm)
                 Hfront   48 Hsync  32 Hback   80 Hpol P
                 Vfront    3 Vsync   6 Vback   17 Vpol P
    DTD 3:  1920x1080  144.001021 Hz  16:9    162.721 kHz    338.460000 MHz (698 mm x 392 mm)
                 Hfront   48 Hsync  32 Hback   80 Hpol P
                 Vfront    3 Vsync   5 Vback   42 Vpol P
    DTD 4:  1920x1080   60.000000 Hz  16:9     67.500 kHz    148.500000 MHz (698 mm x 392 mm)
                 Hfront   88 Hsync  44 Hback  148 Hpol P
                 Vfront    4 Vsync   5 Vback   36 Vpol P
    DTD 5:  1920x1080   99.998303 Hz  16:9    113.298 kHz    235.660000 MHz (698 mm x 392 mm)
                 Hfront   48 Hsync  32 Hback   80 Hpol P
                 Vfront    3 Vsync   5 Vback   45 Vpol P
Checksum: 0xd4  Unused space in Extension Block: 4 bytes

----------------

Warnings:

Block 0, Base EDID:
  Vendor & Product Identification: The serial number is one of the known dummy values, it should probably be set to 0.
  Display Product Serial Number: ...
Block 1, CTA-861 Extension Block:
  Video Data Block: VIC 16 and the first DTD are not identical. Is this intended?
  Colorimetry Data Block: Set the sRGB colorimetry bit to avoid interop issues.
  Detailed Timing Descriptor #2: DTD is similar but not identical to DMT 0x2e.
  Detailed Timing Descriptor #2: Image size is 698x392 mm, but based on the picture AR it should be 627x392 mm.
  Display Product Serial Number is set, so the Serial Number in the Base EDID should be 0.
EDID:
  Base EDID: Some timings are out of range of the Monitor Ranges:
    Horizontal Freq: 28.125 - 187.442 kHz (Monitor: 200.000 - 200.000 kHz)

Failures:

EDID:
  Extension Block 2 started with EDID header, ignoring Extension Blocks >= 2.

EDID conformity: FAIL
