edid-decode (hex):

00 ff ff ff ff ff ff 00 26 cd a4 66 c2 0a 00 00
09 22 01 03 80 3c 22 78 2a 34 d5 a5 55 4f a0 27
0a 50 54 a5 6b 80 71 00 81 40 81 80 a9 40 b3 00
95 00 d1 c0 01 01 02 3a 80 18 71 38 2d 40 58 2c
45 00 56 50 21 00 00 1e 00 00 00 ff 00 31 32 33
30 36 34 30 39 42 32 37 35 34 00 00 00 fd 00 37
64 1e 6e 17 00 0a 20 20 20 20 20 20 00 00 00 fc
00 50 4c 32 37 39 33 48 0a 20 20 20 20 20 01 97

02 03 28 f1 49 00 04 03 02 01 12 11 13 1f 23 09
07 07 83 01 00 00 65 03 0c 00 10 00 e2 00 d5 68
1a 00 00 01 01 30 64 e6 02 3a 80 18 71 38 2d 40
58 2c 45 00 56 50 21 00 00 1e 2a 44 80 a0 70 38
27 40 30 20 35 00 56 50 21 00 00 1a 8a 4d 80 a0
70 38 2c 40 30 20 35 00 56 50 21 00 00 1a 60 59
80 a0 70 38 14 40 30 20 68 00 56 50 21 00 00 1a
00 00 00 00 00 00 00 00 00 00 00 00 00 00 00 c9

00 ff ff ff ff ff ff 00 26 cd a4 66 c2 0a 00 00
09 22 01 03 80 3c 22 78 2a 34 d5 a5 55 4f a0 27
0a 50 54 a5 6b 80 71 00 81 40 81 80 a9 40 b3 00
95 00 d1 c0 01 01 02 3a 80 18 71 38 2d 40 58 2c
45 00 56 50 21 00 00 1e 00 00 00 ff 00 31 32 33
30 36 34 30 39 42 32 37 35 34 00 00 00 fd 00 37
64 1e 6e 17 00 0a 20 20 20 20 20 20 00 00 00 fc
00 50 4c 32 37 39 33 48 0a 20 20 20 20 20 01 97

02 03 28 f1 49 00 04 03 02 01 12 11 13 1f 23 09
07 07 83 01 00 00 65 03 0c 00 10 00 e2 00 d5 68
1a 00 00 01 01 30 64 e6 02 3a 80 18 71 38 2d 40
58 2c 45 00 56 50 21 00 00 1e 2a 44 80 a0 70 38
27 40 30 20 35 00 56 50 21 00 00 1a 8a 4d 80 a0
70 38 2c 40 30 20 35 00 56 50 21 00 00 1a 60 59
80 a0 70 38 14 40 30 20 68 00 56 50 21 00 00 1a
00 00 00 00 00 00 00 00 00 00 00 00 00 00 00 c9

----------------

Block 0, Base EDID:
  EDID Structure Version & Revision: 1.3
  Vendor & Product Identification:
    Manufacturer: IVM
    Model: 26276
    Serial Number: ...
    Made in: week 9 of 2024
  Basic Display Parameters & Features:
    Digital display
    Maximum image size: 60 cm x 34 cm
    Gamma: 2.20
    DPMS levels: Off
    RGB color display
    First detailed timing is the preferred timing
  Color Characteristics:
    Red  : 0.6445, 0.3349
    Green: 0.3095, 0.6250
    Blue : 0.1552, 0.0400
    White: 0.3134, 0.3291
  Established Timings I & II:
    IBM     :   720x400    70.081663 Hz   9:5     31.467 kHz     28.320000 MHz
    DMT 0x04:   640x480    59.940476 Hz   4:3     31.469 kHz     25.175000 MHz
    DMT 0x06:   640x480    75.000000 Hz   4:3     37.500 kHz     31.500000 MHz
    DMT 0x09:   800x600    60.316541 Hz   4:3     37.879 kHz     40.000000 MHz
    DMT 0x0b:   800x600    75.000000 Hz   4:3     46.875 kHz     49.500000 MHz
    Apple   :   832x624    74.551266 Hz   4:3     49.726 kHz     57.284000 MHz
    DMT 0x10:  1024x768    60.003840 Hz   4:3     48.363 kHz     65.000000 MHz
    DMT 0x12:  1024x768    75.028582 Hz   4:3     60.023 kHz     78.750000 MHz
    DMT 0x24:  1280x1024   75.024675 Hz   5:4     79.976 kHz    135.000000 MHz
    Apple   :  1152x870    75.061550 Hz 192:145   68.681 kHz    100.000000 MHz
  Standard Timings:
    GTF     :  1152x720    59.999964 Hz  16:10    44.760 kHz     67.319000 MHz
    DMT 0x20:  1280x960    60.000000 Hz   4:3     60.000 kHz    108.000000 MHz
    DMT 0x23:  1280x1024   60.019740 Hz   5:4     63.981 kHz    108.000000 MHz
    DMT 0x33:  1600x1200   60.000000 Hz   4:3     75.000 kHz    162.000000 MHz
    DMT 0x3a:  1680x1050   59.954250 Hz  16:10    65.290 kHz    146.250000 MHz
    DMT 0x2f:  1440x900    59.887445 Hz  16:10    55.935 kHz    106.500000 MHz
    DMT 0x52:  1920x1080   60.000000 Hz  16:9     67.500 kHz    148.500000 MHz
  Detailed Timing Descriptors:
    DTD 1:  1920x1080   60.000000 Hz  16:9     67.500 kHz    148.500000 MHz (598 mm x 336 mm)
                 Hfront   88 Hsync  44 Hback  148 Hpol P
                 Vfront    4 Vsync   5 Vback   36 Vpol P
    Display Product Serial Number: ...
    Display Range Limits:
      Monitor ranges (GTF): 55-100 Hz V, 30-110 kHz H, max dotclock 230 MHz
    Display Product Name: 'PL2793H'
  Extension blocks: 1
Checksum: 0x97

----------------

Block 1, CTA-861 Extension Block:
  Revision: 3
  Underscans IT Video Formats by default
  Basic audio support
  Supports YCbCr 4:4:4
  Supports YCbCr 4:2:2
  Native DTDs: 1
  Video Data Block:
    VIC   4:  1280x720    60.000000 Hz  16:9     45.000 kHz     74.250000 MHz
    VIC   3:   720x480    59.940060 Hz  16:9     31.469 kHz     27.000000 MHz
    VIC   2:   720x480    59.940060 Hz   4:3     31.469 kHz     27.000000 MHz
    VIC   1:   640x480    59.940476 Hz   4:3     31.469 kHz     25.175000 MHz
    VIC  18:   720x576    50.000000 Hz  16:9     31.250 kHz     27.000000 MHz
    VIC  17:   720x576    50.000000 Hz   4:3     31.250 kHz     27.000000 MHz
    VIC  19:  1280x720    50.000000 Hz  16:9     37.500 kHz     74.250000 MHz
    VIC  31:  1920x1080   50.000000 Hz  16:9     56.250 kHz    148.500000 MHz
  Audio Data Block:
    Linear PCM:
      Max channels: 2
      Supported sample rates (kHz): 48 44.1 32
      Supported sample sizes (bits): 24 20 16
  Speaker Allocation Data Block:
    FL/FR - Front Left/Right
  Vendor-Specific Data Block (HDMI), OUI 00-0C-03:
    Source physical address: 1.0.0.0
  Video Capability Data Block:
    YCbCr quantization: Selectable (via AVI YQ)
    RGB quantization: Selectable (via AVI Q)
    PT scan behavior: Always Overscanned
    IT scan behavior: Always Overscanned
    CE scan behavior: Always Overscanned
  Vendor-Specific Data Block (AMD), OUI 00-00-1A:
    Version: 1
    Flags 1: 0x01
      FreeSync Supported
    Minimum Refresh Rate: 48 Hz
    Maximum Refresh Rate: 100 Hz
    MCCS VCP Code: 0xe6
  Detailed Timing Descriptors:
    DTD 2:  1920x1080   60.000000 Hz  16:9     67.500 kHz    148.500000 MHz (598 mm x 336 mm)
                 Hfront   88 Hsync  44 Hback  148 Hpol P
                 Vfront    4 Vsync   5 Vback   36 Vpol P
    DTD 3:  1920x1080   74.972503 Hz  16:9     83.894 kHz    174.500000 MHz (598 mm x 336 mm)
                 Hfront   48 Hsync  32 Hback   80 Hpol P
                 Vfront    3 Vsync   5 Vback   31 Vpol N
    DTD 4:  1920x1080   84.904531 Hz  16:9     95.433 kHz    198.500000 MHz (598 mm x 336 mm)
                 Hfront   48 Hsync  32 Hback   80 Hpol P
                 Vfront    3 Vsync   5 Vback   36 Vpol N
    DTD 5:  1920x1080  100.000000 Hz  16:9    110.000 kHz    228.800000 MHz (598 mm x 336 mm)
                 Hfront   48 Hsync  32 Hback   80 Hpol P
                 Vfront    6 Vsync   8 Vback    6 Vpol N
Checksum: 0xc9  Unused space in Extension Block: 15 bytes

----------------

Warnings:

Block 0, Base EDID:
  Detailed Timing Descriptor #1: DTD is identical to VIC 16, which is not present in the CTA Ext Block.
Block 1, CTA-861 Extension Block:
  Video Data Block: VIC 4 and the first DTD are not identical. Is this intended?
  Video Capability Data Block: IT scan behavior is expected to support underscanned.
  Video Capability Data Block: S_PT is equal to S_IT and S_CE, so should be set to 0 instead.
  Detailed Timing Descriptor #2: DTD is identical to VIC 16, which is not present in the CTA Ext Block.
  Display Product Serial Number is set, so the Serial Number in the Base EDID should be 0.
  Add a Colorimetry Data Block with the sRGB colorimetry bit set to avoid interop issues.
EDID:
  Base EDID: Some timings are out of range of the Monitor Ranges:
    Vertical Freq: 50.000 - 100.000 Hz (Monitor: 55.000 - 100.000 Hz)

Failures:

Block 1, CTA-861 Extension Block:
  Video Capability Data Block: IT video formats are always overscanned, but bit 7 of Byte 3 of the CTA-861 Extension header is set to underscanned.
EDID:
  Extension Block 2 started with EDID header, ignoring Extension Blocks >= 2.

EDID conformity: FAIL
