edid-decode (hex):

00 ff ff ff ff ff ff 00 0e d4 68 46 00 00 00 00
23 0c 01 03 00 24 1d 78 ef 0d c2 a0 57 47 98 27
12 48 4f bf ef 00 01 01 01 01 01 01 01 01 01 01
81 80 01 01 01 01 cc 29 a0 d0 51 84 22 30 0a 98
36 00 68 22 11 00 00 1e 00 00 00 fe 00 4d 32 31
36 48 31 0a 0a 0a 0a 0a 0a 0a 02 3a 80 18 71 38
2d 40 58 2c 45 00 c4 8e 21 00 00 1e 84 35 a0 f0
51 84 2a 30 0c 98 36 00 68 22 11 00 00 1e 00 5a

00 ff ff ff ff ff ff 00 0e d4 68 46 00 00 00 00
23 0c 01 03 00 24 1d 78 ef 0d c2 a0 57 47 98 27
12 48 4f bf ef 00 01 01 01 01 01 01 01 01 01 01
81 80 01 01 01 01 cc 29 a0 d0 51 84 22 30 0a 98
36 00 68 22 11 00 00 1e 00 00 00 fe 00 4d 32 31
36 48 31 0a 0a 0a 0a 0a 0a 0a 02 3a 80 18 71 38
2d 40 58 2c 45 00 c4 8e 21 00 00 1e 84 35 a0 f0
51 84 2a 30 0c 98 36 00 68 22 11 00 00 1e 00 5a

----------------

Block 0, Base EDID:
  EDID Structure Version & Revision: 1.3
  Vendor & Product Identification:
    Manufacturer: CVT
    Model: 18024
    Made in: week 35 of 2002
  Basic Display Parameters & Features:
    Analog display
    Signal Level Standard: 0.700 : 0.300 : 1.000 V p-p
    Blank level equals black level
    Maximum image size: 36 cm x 29 cm
    Gamma: 2.20
    DPMS levels: Standby Suspend Off
    RGB color display
    Default (sRGB) color space is primary color space
    First detailed timing is the preferred timing
    Supports GTF timings within operating range
  Color Characteristics:
    Red  : 0.6250, 0.3398
    Green: 0.2802, 0.5947
    Blue : 0.1552, 0.0703
    White: 0.2812, 0.3105
  Established Timings I & II:
    IBM     :   720x400    70.081663 Hz   9:5     31.467 kHz     28.320000 MHz
    DMT 0x04:   640x480    59.940476 Hz   4:3     31.469 kHz     25.175000 MHz
    Apple   :   640x480    66.666667 Hz   4:3     35.000 kHz     30.240000 MHz
    DMT 0x05:   640x480    72.808802 Hz   4:3     37.861 kHz     31.500000 MHz
    DMT 0x06:   640x480    75.000000 Hz   4:3     37.500 kHz     31.500000 MHz
    DMT 0x08:   800x600    56.250000 Hz   4:3     35.156 kHz     36.000000 MHz
    DMT 0x09:   800x600    60.316541 Hz   4:3     37.879 kHz     40.000000 MHz
    DMT 0x0a:   800x600    72.187572 Hz   4:3     48.077 kHz     50.000000 MHz
    DMT 0x0b:   800x600    75.000000 Hz   4:3     46.875 kHz     49.500000 MHz
    Apple   :   832x624    74.551266 Hz   4:3     49.726 kHz     57.284000 MHz
    DMT 0x10:  1024x768    60.003840 Hz   4:3     48.363 kHz     65.000000 MHz
    DMT 0x11:  1024x768    70.069359 Hz   4:3     56.476 kHz     75.000000 MHz
    DMT 0x12:  1024x768    75.028582 Hz   4:3     60.023 kHz     78.750000 MHz
    DMT 0x24:  1280x1024   75.024675 Hz   5:4     79.976 kHz    135.000000 MHz
  Standard Timings:
    DMT 0x23:  1280x1024   60.019740 Hz   5:4     63.981 kHz    108.000000 MHz
  Detailed Timing Descriptors:
    DTD 1:  1440x900    60.168607 Hz  16:10    56.197 kHz    107.000000 MHz (360 mm x 290 mm)
                 Hfront   10 Hsync 152 Hback  302 Hpol P
                 Vfront    3 Vsync   6 Vback   25 Vpol P
    Alphanumeric Data String: 'M216H1'
    DTD 2:  1920x1080   60.000000 Hz  16:9     67.500 kHz    148.500000 MHz (708 mm x 398 mm)
                 Hfront   88 Hsync  44 Hback  148 Hpol P
                 Vfront    4 Vsync   5 Vback   36 Vpol P
    DTD 3:  1440x900    75.121510 Hz  16:10    70.764 kHz    137.000000 MHz (360 mm x 290 mm)
                 Hfront   12 Hsync 152 Hback  332 Hpol P
                 Vfront    3 Vsync   6 Vback   33 Vpol P
Checksum: 0x5a

----------------

Warnings:

Block 0, Base EDID:
  Detailed Timing Descriptor #1: Image size is 360x290 mm, but based on the picture AR it should be 360x225 mm.
  Detailed Timing Descriptor #3: Image size is 360x290 mm, but based on the picture AR it should be 360x225 mm.

Failures:

Block 0, Base EDID:
  Basic Display Parameters & Features: sRGB is signaled, but the chromaticities do not match.
  Alphanumeric Data String: Non-space after newline.
  Detailed Timing Descriptor #2: Mismatch of image size 708x398 mm vs display size 360x290 mm.
  Detailed Timing Descriptor #2: Invalid detailed timing descriptor ordering.
  Detailed Timing Descriptor #3: Invalid detailed timing descriptor ordering.
  Missing Display Product Name.
  Missing Display Range Limits Descriptor.
EDID:
  Extension Block 1 started with EDID header, ignoring Extension Blocks >= 1.
  Base EDID: The DTD max image size is 708x398mm, which is larger than the display size 360.0x290.0mm.

EDID conformity: FAIL
