edid-decode (hex):

00 ff ff ff ff ff ff 00 0e d4 68 46 00 00 00 00
23 0c 01 03 00 24 1d 78 ef 0d c2 a0 57 47 98 27
12 48 4f a1 08 00 81 80 01 01 01 01 01 01 01 01
01 01 01 01 01 01 0e 1f 00 80 51 00 1e 30 40 80
37 00 f8 c2 21 00 00 1c cc 29 a0 d0 51 84 22 30
0a 98 36 00 68 22 11 00 00 1e 66 21 50 b0 51 00
1b 30 40 70 36 00 f8 c2 21 00 00 1e 94 43 80 90
72 38 28 40 a3 20 35 00 13 29 21 00 00 1c 00 ab

----------------

Block 0, Base EDID:
  EDID Structure Version & Revision: 1.3
  Vendor & Product Identification:
    Manufacturer: CVT
    Model: 18024
    Made in: week 35 of 2002
  Basic Display Parameters & Features:
    Analog display
    Signal Level Standard: 0.700 : 0.300 : 1.000 V p-p
    Blank level equals black level
    Maximum image size: 36 cm x 29 cm
    Gamma: 2.20
    DPMS levels: Standby Suspend Off
    RGB color display
    Default (sRGB) color space is primary color space
    First detailed timing is the preferred timing
    Supports GTF timings within operating range
  Color Characteristics:
    Red  : 0.6250, 0.3398
    Green: 0.2802, 0.5947
    Blue : 0.1552, 0.0703
    White: 0.2812, 0.3105
  Established Timings I & II:
    IBM     :   720x400    70.081663 Hz   9:5     31.467 kHz     28.320000 MHz
    DMT 0x04:   640x480    59.940476 Hz   4:3     31.469 kHz     25.175000 MHz
    DMT 0x09:   800x600    60.316541 Hz   4:3     37.879 kHz     40.000000 MHz
    DMT 0x10:  1024x768    60.003840 Hz   4:3     48.363 kHz     65.000000 MHz
  Standard Timings:
    DMT 0x23:  1280x1024   60.019740 Hz   5:4     63.981 kHz    108.000000 MHz
  Detailed Timing Descriptors:
    DTD 1:  1280x768    59.870228 Hz   5:3     47.776 kHz     79.500000 MHz (760 mm x 450 mm)
                 Hfront   64 Hsync 128 Hback  192 Hpol N
                 Vfront    3 Vsync   7 Vback   20 Vpol P
    DTD 2:  1440x900    60.168607 Hz  16:10    56.197 kHz    107.000000 MHz (360 mm x 290 mm)
                 Hfront   10 Hsync 152 Hback  302 Hpol P
                 Vfront    3 Vsync   6 Vback   25 Vpol P
    DTD 3:  1360x768    60.015162 Hz  85:48    47.712 kHz     85.500000 MHz (760 mm x 450 mm)
                 Hfront   64 Hsync 112 Hback  256 Hpol P
                 Vfront    3 Vsync   6 Vback   18 Vpol P
    DTD 4:  1920x1080   59.962844 Hz  16:9     67.158 kHz    173.000000 MHz (531 mm x 297 mm)
                 Hfront  163 Hsync  32 Hback  461 Hpol N
                 Vfront    3 Vsync   5 Vback   32 Vpol P
Checksum: 0xab

----------------

Warnings:

Block 0, Base EDID:
  Detailed Timing Descriptor #2: Image size is 360x290 mm, but based on the picture AR it should be 360x225 mm.
  Detailed Timing Descriptor #3: Image size is 760x450 mm, but based on the picture AR it should be 760x429 mm.

Failures:

Block 0, Base EDID:
  Basic Display Parameters & Features: sRGB is signaled, but the chromaticities do not match.
  Detailed Timing Descriptor #1: Mismatch of image size 760x450 mm vs display size 360x290 mm.
  Detailed Timing Descriptor #3: Mismatch of image size 760x450 mm vs display size 360x290 mm.
  Detailed Timing Descriptor #4: Mismatch of image size 531x297 mm vs display size 360x290 mm.
  Missing Display Product Name.
  Missing Display Range Limits Descriptor.
EDID:
  Base EDID: The DTD max image size is 760x450mm, which is larger than the display size 360.0x290.0mm.

EDID conformity: FAIL
