edid-decode (hex):

00 ff ff ff ff ff ff 00 3c ad 00 00 00 00 00 00
2d 16 01 04 08 45 27 00 0a c6 9c 96 4e 42 8d 22
10 41 44 3f ef 00 01 01 01 01 01 01 01 01 01 01
01 01 01 01 01 01 66 21 50 b0 51 00 1b 30 40 70
36 00 50 00 53 00 00 1e 30 2a 00 98 51 00 2a 40
30 70 13 00 00 00 54 00 00 1e 0e 1f 00 80 51 00
1e 30 40 80 37 00 00 00 53 00 00 1c 00 00 00 fc
00 32 34 57 5f 4c 43 44 5f 54 56 0a 20 20 00 c1

00 ff ff ff ff ff ff 00 3c ad 00 00 00 00 00 00
2d 16 01 04 08 45 27 00 0a c6 9c 96 4e 42 8d 22
10 41 44 3f ef 00 01 01 01 01 01 01 01 01 01 01
01 01 01 01 01 01 66 21 50 b0 51 00 1b 30 40 70
36 00 50 00 53 00 00 1e 30 2a 00 98 51 00 2a 40
30 70 13 00 00 00 54 00 00 1e 0e 1f 00 80 51 00
1e 30 40 80 37 00 00 00 53 00 00 1c 00 00 00 fc
00 32 34 57 5f 4c 43 44 5f 54 56 0a 20 20 00 c1

----------------

Block 0, Base EDID:
  EDID Structure Version & Revision: 1.4
  Vendor & Product Identification:
    Manufacturer: OEM
    Model: 0
    Made in: week 45 of 2012
  Basic Display Parameters & Features:
    Analog display
    Signal Level Standard: 0.700 : 0.300 : 1.000 V p-p
    Blank level equals black level
    Sync: Separate
    Maximum image size: 69 cm x 39 cm
    Gamma: 1.00
    RGB color display
    First detailed timing includes the native pixel format and preferred refresh rate
  Color Characteristics:
    Red  : 0.5888, 0.3046
    Green: 0.2587, 0.5527
    Blue : 0.1347, 0.0634
    White: 0.2568, 0.2656
  Established Timings I & II:
    DMT 0x04:   640x480    59.940476 Hz   4:3     31.469 kHz     25.175000 MHz
    Apple   :   640x480    66.666667 Hz   4:3     35.000 kHz     30.240000 MHz
    DMT 0x05:   640x480    72.808802 Hz   4:3     37.861 kHz     31.500000 MHz
    DMT 0x06:   640x480    75.000000 Hz   4:3     37.500 kHz     31.500000 MHz
    DMT 0x08:   800x600    56.250000 Hz   4:3     35.156 kHz     36.000000 MHz
    DMT 0x09:   800x600    60.316541 Hz   4:3     37.879 kHz     40.000000 MHz
    DMT 0x0a:   800x600    72.187572 Hz   4:3     48.077 kHz     50.000000 MHz
    DMT 0x0b:   800x600    75.000000 Hz   4:3     46.875 kHz     49.500000 MHz
    Apple   :   832x624    74.551266 Hz   4:3     49.726 kHz     57.284000 MHz
    DMT 0x10:  1024x768    60.003840 Hz   4:3     48.363 kHz     65.000000 MHz
    DMT 0x11:  1024x768    70.069359 Hz   4:3     56.476 kHz     75.000000 MHz
    DMT 0x12:  1024x768    75.028582 Hz   4:3     60.023 kHz     78.750000 MHz
    DMT 0x24:  1280x1024   75.024675 Hz   5:4     79.976 kHz    135.000000 MHz
  Standard Timings: none
  Detailed Timing Descriptors:
    DTD 1:  1360x768    60.015162 Hz  85:48    47.712 kHz     85.500000 MHz (1360 mm x 768 mm)
                 Hfront   64 Hsync 112 Hback  256 Hpol P
                 Vfront    3 Vsync   6 Vback   18 Vpol P
    DTD 2:  1280x1024   60.019740 Hz   5:4     63.981 kHz    108.000000 MHz (1280 mm x 1024 mm)
                 Hfront   48 Hsync 112 Hback  248 Hpol P
                 Vfront    1 Vsync   3 Vback   38 Vpol P
    DTD 3:  1280x768    59.870228 Hz   5:3     47.776 kHz     79.500000 MHz (1280 mm x 768 mm)
                 Hfront   64 Hsync 128 Hback  192 Hpol N
                 Vfront    3 Vsync   7 Vback   20 Vpol P
    Display Product Name: '24W_LCD_TV'
Checksum: 0xc1

----------------

Failures:

Block 0, Base EDID:
  Detailed Timing Descriptor #1: Mismatch of image size 1360x768 mm vs display size 690x390 mm.
  Detailed Timing Descriptor #2: Mismatch of image size 1280x1024 mm vs display size 690x390 mm.
  Detailed Timing Descriptor #3: Mismatch of image size 1280x768 mm vs display size 690x390 mm.
EDID:
  Extension Block 1 started with EDID header, ignoring Extension Blocks >= 1.
  Base EDID: The DTD max image size is 1360x1024mm, which is larger than the display size 690.0x390.0mm.

EDID conformity: FAIL
