edid-decode (hex):

00 ff ff ff ff ff ff 00 1e 6d 2e 5a fb bc 02 00
0a 1b 01 03 80 30 1e 78 ea 23 c5 a5 57 4f 9e 26
0f 50 54 a5 4b 80 71 40 81 80 81 80 61 40 61 40
01 01 01 01 01 01 7c 2e 90 a0 60 1a 1e 40 30 20
36 00 e0 2c 11 00 00 1a 00 00 00 fd 00 38 4b 1e
53 0f 00 0a 20 20 20 20 20 20 00 00 00 fc 00 32
32 4d 42 36 35 0a 20 20 20 20 20 20 00 00 00 ff
00 37 31 30 4e 54 46 41 35 39 34 35 31 0a 01 9c

02 03 10 00 65 03 0c 00 10 00 45 01 03 12 04 13
00 00 00 00 00 00 00 00 00 00 00 00 00 00 00 00
00 00 00 00 00 00 00 00 00 00 00 00 00 00 00 00
00 00 00 00 00 00 00 00 00 00 00 00 00 00 00 00
00 00 00 00 00 00 00 00 00 00 00 00 00 00 00 00
00 00 00 00 00 00 00 00 00 00 00 00 00 00 00 00
00 00 00 00 00 00 00 00 00 00 00 00 00 00 00 00
00 00 00 00 00 00 00 00 00 00 00 00 00 00 00 f5

00 ff ff ff ff ff ff 00 1e 6d 2e 5a fb bc 02 00
0a 1b 01 03 80 30 1e 78 ea 23 c5 a5 57 4f 9e 26
0f 50 54 a5 4b 80 71 40 81 80 81 80 61 40 61 40
01 01 01 01 01 01 7c 2e 90 a0 60 1a 1e 40 30 20
36 00 e0 2c 11 00 00 1a 00 00 00 fd 00 38 4b 1e
53 0f 00 0a 20 20 20 20 20 20 00 00 00 fc 00 32
32 4d 42 36 35 0a 20 20 20 20 20 20 00 00 00 ff
00 37 31 30 4e 54 46 41 35 39 34 35 31 0a 01 9c

02 03 10 00 65 03 0c 00 10 00 45 01 03 12 04 13
00 00 00 00 00 00 00 00 00 00 00 00 00 00 00 00
00 00 00 00 00 00 00 00 00 00 00 00 00 00 00 00
00 00 00 00 00 00 00 00 00 00 00 00 00 00 00 00
00 00 00 00 00 00 00 00 00 00 00 00 00 00 00 00
00 00 00 00 00 00 00 00 00 00 00 00 00 00 00 00
00 00 00 00 00 00 00 00 00 00 00 00 00 00 00 00
00 00 00 00 00 00 00 00 00 00 00 00 00 00 00 f5

----------------

Block 0, Base EDID:
  EDID Structure Version & Revision: 1.3
  Vendor & Product Identification:
    Manufacturer: GSM
    Model: 23086
    Serial Number: ...
    Made in: week 10 of 2017
  Basic Display Parameters & Features:
    Digital display
    Maximum image size: 48 cm x 30 cm
    Gamma: 2.20
    DPMS levels: Standby Suspend Off
    RGB color display
    First detailed timing is the preferred timing
  Color Characteristics:
    Red  : 0.6445, 0.3417
    Green: 0.3085, 0.6201
    Blue : 0.1513, 0.0585
    White: 0.3134, 0.3291
  Established Timings I & II:
    IBM     :   720x400    70.081663 Hz   9:5     31.467 kHz     28.320000 MHz
    DMT 0x04:   640x480    59.940476 Hz   4:3     31.469 kHz     25.175000 MHz
    DMT 0x06:   640x480    75.000000 Hz   4:3     37.500 kHz     31.500000 MHz
    DMT 0x09:   800x600    60.316541 Hz   4:3     37.879 kHz     40.000000 MHz
    DMT 0x0b:   800x600    75.000000 Hz   4:3     46.875 kHz     49.500000 MHz
    DMT 0x10:  1024x768    60.003840 Hz   4:3     48.363 kHz     65.000000 MHz
    DMT 0x12:  1024x768    75.028582 Hz   4:3     60.023 kHz     78.750000 MHz
    DMT 0x24:  1280x1024   75.024675 Hz   5:4     79.976 kHz    135.000000 MHz
    Apple   :  1152x870    75.061550 Hz 192:145   68.681 kHz    100.000000 MHz
  Standard Timings:
    GTF     :  1152x864    60.000000 Hz   4:3     53.700 kHz     81.624000 MHz
    DMT 0x23:  1280x1024   60.019740 Hz   5:4     63.981 kHz    108.000000 MHz
    DMT 0x23:  1280x1024   60.019740 Hz   5:4     63.981 kHz    108.000000 MHz
    DMT 0x10:  1024x768    60.003840 Hz   4:3     48.363 kHz     65.000000 MHz
    DMT 0x10:  1024x768    60.003840 Hz   4:3     48.363 kHz     65.000000 MHz
  Detailed Timing Descriptors:
    DTD 1:  1680x1050   59.883253 Hz  16:10    64.674 kHz    119.000000 MHz (480 mm x 300 mm)
                 Hfront   48 Hsync  32 Hback   80 Hpol P
                 Vfront    3 Vsync   6 Vback   21 Vpol N
    Display Range Limits:
      Monitor ranges (GTF): 56-75 Hz V, 30-83 kHz H, max dotclock 150 MHz
    Display Product Name: '22MB65'
    Display Product Serial Number: ...
  Extension blocks: 1
Checksum: 0x9c

----------------

Block 1, CTA-861 Extension Block:
  Revision: 3
  Native detailed modes: 0
  Vendor-Specific Data Block (HDMI), OUI 00-0C-03:
    Source physical address: 1.0.0.0
  Video Data Block:
    VIC   1:   640x480    59.940476 Hz   4:3     31.469 kHz     25.175000 MHz
    VIC   3:   720x480    59.940060 Hz  16:9     31.469 kHz     27.000000 MHz
    VIC  18:   720x576    50.000000 Hz  16:9     31.250 kHz     27.000000 MHz
    VIC   4:  1280x720    60.000000 Hz  16:9     45.000 kHz     74.250000 MHz
    VIC  19:  1280x720    50.000000 Hz  16:9     37.500 kHz     74.250000 MHz
Checksum: 0xf5  Unused space in Extension Block: 111 bytes

----------------

Block 2, Unknown EDID Extension Block 0x00:
  00 ff ff ff ff ff ff 00 1e 6d 2e 5a fb bc 02 00 '.........m.Z....'
  0a 1b 01 03 80 30 1e 78 ea 23 c5 a5 57 4f 9e 26 '.....0.x.#..WO.&'
  0f 50 54 a5 4b 80 71 40 81 80 81 80 61 40 61 40 '.PT.K.q@....a@a@'
  01 01 01 01 01 01 7c 2e 90 a0 60 1a 1e 40 30 20 '......|...`..@0 '
  36 00 e0 2c 11 00 00 1a 00 00 00 fd 00 38 4b 1e '6..,.........8K.'
  53 0f 00 0a 20 20 20 20 20 20 00 00 00 fc 00 32 'S...      .....2'
  32 4d 42 36 35 0a 20 20 20 20 20 20 00 00 00 ff '2MB65.      ....'
  00 37 31 30 4e 54 46 41 35 39 34 35 31 0a 01 9c '.710NTFA59451...'
Checksum: 0x9c

----------------

Block 3, CTA-861 Extension Block:
  Revision: 3
  Native detailed modes: 0
  Vendor-Specific Data Block (HDMI), OUI 00-0C-03:
    Source physical address: 1.0.0.0
  Video Data Block:
    VIC   1:   640x480    59.940476 Hz   4:3     31.469 kHz     25.175000 MHz
    VIC   3:   720x480    59.940060 Hz  16:9     31.469 kHz     27.000000 MHz
    VIC  18:   720x576    50.000000 Hz  16:9     31.250 kHz     27.000000 MHz
    VIC   4:  1280x720    60.000000 Hz  16:9     45.000 kHz     74.250000 MHz
    VIC  19:  1280x720    50.000000 Hz  16:9     37.500 kHz     74.250000 MHz
Checksum: 0xf5  Unused space in Extension Block: 111 bytes

----------------

Warnings:

Block 1, CTA-861 Extension Block:
  IT Video Formats are overscanned by default, but normally this should be underscanned.
  Video Data Block: VIC 1 and the first DTD are not identical. Is this intended?
  Display Product Serial Number is set, so the Serial Number in the Base EDID should be 0.
  Add a Colorimetry Data Block with the sRGB colorimetry bit set to avoid interop issues.
Block 3, CTA-861 Extension Block:
  IT Video Formats are overscanned by default, but normally this should be underscanned.
EDID:
  Base EDID: Some timings are out of range of the Monitor Ranges:
    Vertical Freq: 50.000 - 75.062 Hz (Monitor: 56.000 - 75.000 Hz)

Failures:

Block 1, CTA-861 Extension Block:
  Missing VCDB, needed for Set Selectable RGB Quantization to avoid interop issues.
Block 2, Base EDID:
  Unknown Extension Block.
Block 3, CTA-861 Extension Block:
  Video Data Block: Duplicate VIC 1.
  Video Data Block: Duplicate VIC 3.
  Video Data Block: Duplicate VIC 18.
  Video Data Block: Duplicate VIC 4.
  Video Data Block: Duplicate VIC 19.
EDID:
  Base EDID: EDID specified 1 extension block(s), but found 3 extension block(s).
  Base EDID: EDID 1.3 requires a Block Map Extension in Block 1 if there are more than 2 blocks in the EDID.

EDID conformity: FAIL
