edid-decode (hex):

00 ff ff ff ff ff ff 00 06 af 2d 5b 00 00 00 00
00 1c 01 04 a5 1d 10 78 03 ee 95 a3 54 4c 99 26
0f 50 54 00 00 00 01 01 01 01 01 01 01 01 01 01
01 01 01 01 01 01 b4 37 80 a0 70 38 3e 40 3a 2a
35 00 25 a2 10 00 00 1a 90 2c 80 a0 70 38 3e 40
3a 2a 35 00 25 a2 10 00 00 1a 00 00 00 fe 00 30
36 56 47 36 81 42 31 33 33 48 41 4e 00 00 00 00
00 02 41 22 a8 01 11 00 00 0a 01 0a 20 20 00 f0

----------------

Block 0, Base EDID:
  EDID Structure Version & Revision: 1.4
  Vendor & Product Identification:
    Manufacturer: AUO
    Model: 23341
    Made in: 2018
  Basic Display Parameters & Features:
    Digital display
    Bits per primary color channel: 8
    DisplayPort interface
    Maximum image size: 29 cm x 16 cm
    Gamma: 2.20
    Supported color formats: RGB 4:4:4
    First detailed timing includes the native pixel format and preferred refresh rate
    Display supports continuous frequencies
  Color Characteristics:
    Red  : 0.6396, 0.3300
    Green: 0.2998, 0.5996
    Blue : 0.1503, 0.0595
    White: 0.3134, 0.3291
  Established Timings I & II: none
  Standard Timings: none
  Detailed Timing Descriptors:
    DTD 1:  1920x1080   60.033006 Hz  16:9     68.558 kHz    142.600000 MHz (293 mm x 162 mm)
                 Hfront   58 Hsync  42 Hback   60 Hpol P
                 Vfront    3 Vsync   5 Vback   54 Vpol N
    DTD 2:  1920x1080   48.026404 Hz  16:9     54.846 kHz    114.080000 MHz (293 mm x 162 mm)
                 Hfront   58 Hsync  42 Hback   60 Hpol P
                 Vfront    3 Vsync   5 Vback   54 Vpol N
    Alphanumeric Data String: '06VG6.B133HAN'
    Manufacturer-Specified Display Descriptor (0x00): 00 00 00 02 41 22 a8 01 11 00 00 0a 01 0a 20 20 '....A"........  '
Checksum: 0xf0

----------------

Warnings:

Block 0, Base EDID:
  Alphanumeric Data String: Non-ASCII character 0x81 at position 5, can cause problems.
  Missing Display Product Name.

Failures:

Block 0, Base EDID:
  Missing Display Range Limits Descriptor.

EDID conformity: FAIL
