edid-decode (hex):

00 ff ff ff ff ff ff 00 2a 59 80 23 01 00 00 00
06 1f 01 03 80 35 1d 78 ea 2d 36 a7 54 38 ae 26
0d 4f 54 bf ef 00 b3 00 a9 40 a9 c0 95 00 81 00
81 40 81 80 81 c0 02 3a 80 18 71 38 2d 40 58 2c
45 00 0f 28 21 00 00 1e 66 21 50 b0 51 00 1b 30
40 70 36 00 70 cf 10 00 00 1e 66 21 56 aa 51 00
1e 30 46 8f 33 00 99 e6 10 00 00 1e 00 00 00 fc
00 44 58 32 33 38 41 31 0a 20 20 20 20 20 01 d0

02 03 25 f1 48 90 1f 05 14 04 13 03 12 23 09 07
07 83 01 00 00 67 03 0c 00 10 00 38 2d 1a 00 00
01 01 2d 4b 00 2a 44 80 a0 70 38 27 40 30 28 55
00 a0 5a 00 00 00 1e 01 1d 00 bc 52 d0 1e 20 b8
28 55 40 a0 5a 00 00 00 1e 8c 0a d0 8a 20 e0 2d
10 10 3e 96 00 a0 5a 00 00 00 18 00 00 00 00 00
00 00 00 00 00 00 00 00 00 00 00 00 00 00 00 00
00 00 00 00 00 00 00 00 00 00 00 00 00 00 00 20

00 ff ff ff ff ff ff 00 2a 59 80 23 01 00 00 00
06 1f 01 03 80 35 1d 78 ea 2d 36 a7 54 38 ae 26
0d 4f 54 bf ef 00 b3 00 a9 40 a9 c0 95 00 81 00
81 40 81 80 81 c0 02 3a 80 18 71 38 2d 40 58 2c
45 00 0f 28 21 00 00 1e 66 21 50 b0 51 00 1b 30
40 70 36 00 70 cf 10 00 00 1e 66 21 56 aa 51 00
1e 30 46 8f 33 00 99 e6 10 00 00 1e 00 00 00 fc
00 44 58 32 33 38 41 31 0a 20 20 20 20 20 01 d0

02 03 25 f1 48 90 1f 05 14 04 13 03 12 23 09 07
07 83 01 00 00 67 03 0c 00 10 00 38 2d 1a 00 00
01 01 2d 4b 00 2a 44 80 a0 70 38 27 40 30 28 55
00 a0 5a 00 00 00 1e 01 1d 00 bc 52 d0 1e 20 b8
28 55 40 a0 5a 00 00 00 1e 8c 0a d0 8a 20 e0 2d
10 10 3e 96 00 a0 5a 00 00 00 18 00 00 00 00 00
00 00 00 00 00 00 00 00 00 00 00 00 00 00 00 00
00 00 00 00 00 00 00 00 00 00 00 00 00 00 00 20

----------------

Block 0, Base EDID:
  EDID Structure Version & Revision: 1.3
  Vendor & Product Identification:
    Manufacturer: JRY
    Model: 9088
    Serial Number: ...
    Made in: week 6 of 2021
  Basic Display Parameters & Features:
    Digital display
    Maximum image size: 53 cm x 29 cm
    Gamma: 2.20
    DPMS levels: Standby Suspend Off
    RGB color display
    First detailed timing is the preferred timing
  Color Characteristics:
    Red  : 0.6523, 0.3300
    Green: 0.2216, 0.6806
    Blue : 0.1484, 0.0537
    White: 0.3095, 0.3300
  Established Timings I & II:
    IBM     :   720x400    70.081663 Hz   9:5     31.467 kHz     28.320000 MHz
    DMT 0x04:   640x480    59.940476 Hz   4:3     31.469 kHz     25.175000 MHz
    Apple   :   640x480    66.666667 Hz   4:3     35.000 kHz     30.240000 MHz
    DMT 0x05:   640x480    72.808802 Hz   4:3     37.861 kHz     31.500000 MHz
    DMT 0x06:   640x480    75.000000 Hz   4:3     37.500 kHz     31.500000 MHz
    DMT 0x08:   800x600    56.250000 Hz   4:3     35.156 kHz     36.000000 MHz
    DMT 0x09:   800x600    60.316541 Hz   4:3     37.879 kHz     40.000000 MHz
    DMT 0x0a:   800x600    72.187572 Hz   4:3     48.077 kHz     50.000000 MHz
    DMT 0x0b:   800x600    75.000000 Hz   4:3     46.875 kHz     49.500000 MHz
    Apple   :   832x624    74.551266 Hz   4:3     49.726 kHz     57.284000 MHz
    DMT 0x10:  1024x768    60.003840 Hz   4:3     48.363 kHz     65.000000 MHz
    DMT 0x11:  1024x768    70.069359 Hz   4:3     56.476 kHz     75.000000 MHz
    DMT 0x12:  1024x768    75.028582 Hz   4:3     60.023 kHz     78.750000 MHz
    DMT 0x24:  1280x1024   75.024675 Hz   5:4     79.976 kHz    135.000000 MHz
  Standard Timings:
    DMT 0x3a:  1680x1050   59.954250 Hz  16:10    65.290 kHz    146.250000 MHz
    DMT 0x33:  1600x1200   60.000000 Hz   4:3     75.000 kHz    162.000000 MHz
    DMT 0x53:  1600x900    60.000000 Hz  16:9     60.000 kHz    108.000000 MHz (RB)
    DMT 0x2f:  1440x900    59.887445 Hz  16:10    55.935 kHz    106.500000 MHz
    DMT 0x1c:  1280x800    59.810326 Hz  16:10    49.702 kHz     83.500000 MHz
    DMT 0x20:  1280x960    60.000000 Hz   4:3     60.000 kHz    108.000000 MHz
    DMT 0x23:  1280x1024   60.019740 Hz   5:4     63.981 kHz    108.000000 MHz
    DMT 0x55:  1280x720    60.000000 Hz  16:9     45.000 kHz     74.250000 MHz
  Detailed Timing Descriptors:
    DTD 1:  1920x1080   60.000000 Hz  16:9     67.500 kHz    148.500000 MHz (527 mm x 296 mm)
                 Hfront   88 Hsync  44 Hback  148 Hpol P
                 Vfront    4 Vsync   5 Vback   36 Vpol P
    DTD 2:  1360x768    60.015162 Hz  85:48    47.712 kHz     85.500000 MHz (368 mm x 207 mm)
                 Hfront   64 Hsync 112 Hback  256 Hpol P
                 Vfront    3 Vsync   6 Vback   18 Vpol P
    DTD 3:  1366x768    59.789541 Hz 683:384   47.712 kHz     85.500000 MHz (409 mm x 230 mm)
                 Hfront   70 Hsync 143 Hback  213 Hpol P
                 Vfront    3 Vsync   3 Vback   24 Vpol P
    Display Product Name: 'DX238A1'
  Extension blocks: 1
Checksum: 0xd0

----------------

Block 1, CTA-861 Extension Block:
  Revision: 3
  Underscans IT Video Formats by default
  Basic audio support
  Supports YCbCr 4:4:4
  Supports YCbCr 4:2:2
  Native DTDs: 1
  Video Data Block:
    VIC  16:  1920x1080   60.000000 Hz  16:9     67.500 kHz    148.500000 MHz (native)
    VIC  31:  1920x1080   50.000000 Hz  16:9     56.250 kHz    148.500000 MHz
    VIC   5:  1920x1080i  60.000000 Hz  16:9     33.750 kHz     74.250000 MHz
    VIC  20:  1920x1080i  50.000000 Hz  16:9     28.125 kHz     74.250000 MHz
    VIC   4:  1280x720    60.000000 Hz  16:9     45.000 kHz     74.250000 MHz
    VIC  19:  1280x720    50.000000 Hz  16:9     37.500 kHz     74.250000 MHz
    VIC   3:   720x480    59.940060 Hz  16:9     31.469 kHz     27.000000 MHz
    VIC  18:   720x576    50.000000 Hz  16:9     31.250 kHz     27.000000 MHz
  Audio Data Block:
    Linear PCM:
      Max channels: 2
      Supported sample rates (kHz): 48 44.1 32
      Supported sample sizes (bits): 24 20 16
  Speaker Allocation Data Block:
    FL/FR - Front Left/Right
  Vendor-Specific Data Block (HDMI), OUI 00-0C-03:
    Source physical address: 1.0.0.0
    DC_36bit
    DC_30bit
    DC_Y444
    Maximum TMDS clock: 225 MHz
  Unknown CTA-861 Data Block (tag 0x00, length 26):
    00 00 01 01 2d 4b 00 2a 44 80 a0 70 38 27 40 30 '....-K.*D..p8'@0'
    28 55 00 a0 5a 00 00 00 1e 01                   '(U..Z.....'
  Detailed Timing Descriptors:
    DTD 4:  1920x1080   74.972503 Hz  16:9     83.894 kHz    174.500000 MHz (160 mm x 90 mm)
                 Hfront   48 Hsync  40 Hback   72 Hpol P
                 Vfront    5 Vsync   5 Vback   29 Vpol P
    DTD 5:  1280x720    50.000000 Hz  16:9     37.500 kHz     74.250000 MHz (160 mm x 90 mm)
                 Hfront  440 Hsync  40 Hback  220 Hpol P
                 Vfront    5 Vsync   5 Vback   20 Vpol P
    DTD 6:   720x480    59.940060 Hz   3:2     31.469 kHz     27.000000 MHz (160 mm x 90 mm)
                 Hfront   16 Hsync  62 Hback   60 Hpol N
                 Vfront    9 Vsync   6 Vback   30 Vpol N
Checksum: 0x20  Unused space in Extension Block: 36 bytes

----------------

Warnings:

Block 0, Base EDID:
  Vendor & Product Identification: The serial number is one of the known dummy values, it should probably be set to 0.
Block 1, CTA-861 Extension Block:
  Unknown CTA-861 Data Block (tag 0x00, length 26).
  Detailed Timing Descriptor #4: Dubious image size (160x90 mm is smaller than 100x100 mm).
  Detailed Timing Descriptor #5: Dubious image size (160x90 mm is smaller than 100x100 mm).
  Detailed Timing Descriptor #6: Dubious image size (160x90 mm is smaller than 100x100 mm).
  Add a Colorimetry Data Block with the sRGB colorimetry bit set to avoid interop issues.

Failures:

Block 0, Base EDID:
  Detailed Timing Descriptor #2: Mismatch of image size 368x207 mm vs display size 530x290 mm.
  Detailed Timing Descriptor #3: Mismatch of image size 409x230 mm vs display size 530x290 mm.
  Missing Display Range Limits Descriptor.
Block 1, CTA-861 Extension Block:
  Offset is 37, but should be 56.
  Detailed Timing Descriptor #4: Mismatch of image size 160x90 mm vs display size 530x290 mm.
  Detailed Timing Descriptor #5: Mismatch of image size 160x90 mm vs display size 530x290 mm.
  Detailed Timing Descriptor #6: Mismatch of image size 160x90 mm vs display size 530x290 mm.
  Missing VCDB, needed for Set Selectable RGB Quantization to avoid interop issues.
EDID:
  Extension Block 2 started with EDID header, ignoring Extension Blocks >= 2.

EDID conformity: FAIL
