edid-decode (hex):

00 ff ff ff ff ff ff 00 51 b8 85 14 00 00 00 00
12 1f 01 04 a5 1e 13 78 07 ee 91 a3 54 4c 99 26
0f 50 54 00 00 00 01 01 01 01 01 01 01 01 01 01
01 01 01 01 01 01 ef 96 80 a0 70 b0 5a 40 2b 20
75 04 2d bc 10 00 00 18 e4 3e 80 a0 70 b0 5a 40
2b 20 75 04 2d bc 10 00 00 18 00 00 00 fd 00 30
90 bb bb 27 01 0a 20 20 20 20 20 20 00 00 00 fc
00 54 4c 31 34 30 56 44 58 50 31 30 0a 20 00 6d

----------------

Block 0, Base EDID:
  EDID Structure Version & Revision: 1.4
  Vendor & Product Identification:
    Manufacturer: TMX
    Model: 5253
    Made in: week 18 of 2021
  Basic Display Parameters & Features:
    Digital display
    Bits per primary color channel: 8
    DisplayPort interface
    Maximum image size: 30 cm x 19 cm
    Gamma: 2.20
    Supported color formats: RGB 4:4:4
    Default (sRGB) color space is primary color space
    First detailed timing includes the native pixel format and preferred refresh rate
    Display supports continuous frequencies
  Color Characteristics:
    Red  : 0.6396, 0.3300
    Green: 0.2998, 0.5996
    Blue : 0.1503, 0.0595
    White: 0.3125, 0.3291
  Established Timings I & II: none
  Standard Timings: none
  Detailed Timing Descriptors:
    DTD 1:  1920x1200  144.003429 Hz  16:10   185.764 kHz    386.390000 MHz (301 mm x 188 mm)
                 Hfront   43 Hsync  32 Hback   85 Hpol N
                 Vfront   23 Vsync   5 Vback   62 Vpol N
    DTD 2:  1920x1200   60.002982 Hz  16:10    77.404 kHz    161.000000 MHz (301 mm x 188 mm)
                 Hfront   43 Hsync  32 Hback   85 Hpol N
                 Vfront   23 Vsync   5 Vback   62 Vpol N
    Display Range Limits:
      Monitor ranges (Range Limits Only): 48-144 Hz V, 187-187 kHz H, max dotclock 390 MHz
    Display Product Name: 'TL140VDXP10'
Checksum: 0x6d

----------------

Warnings:

EDID:
  Base EDID: Some timings are out of range of the Monitor Ranges:
    Horizontal Freq: 77.403 - 185.764 kHz (Monitor: 187.000 - 187.000 kHz)

EDID conformity: PASS
