edid-decode (hex):

00 ff ff ff ff ff ff 00 30 ae ae 0f 01 01 01 01
08 16 01 04 b5 33 1d 78 3a c2 85 a4 56 4d 9c 25
12 50 54 bf cf 00 71 4f 81 80 81 8c 81 8a 95 00
95 0f b3 00 b3 0f 02 3a 80 18 71 38 2d 40 58 2c
45 00 fe 1f 11 00 00 1e 00 00 00 fd 00 32 4b 1e
53 14 00 0a 20 20 20 20 20 20 00 00 00 fc 00 4c
32 33 32 31 78 20 57 69 64 65 0a 20 00 00 00 ff
00 36 56 38 4d 36 31 33 39 0a 20 20 20 20 01 e2

02 03 16 f1 49 90 1f 04 13 12 11 03 02 01 23 09
07 07 83 01 00 00 01 1d 00 72 51 d0 1e 20 6e 28
55 00 fe 1f 11 00 00 1e 8c 0a d0 8a 20 e0 2d 10
10 3e 96 00 fe 1f 11 00 00 18 2b 16 80 d0 20 38
28 40 28 40 3a 00 fe 1f 11 00 00 1a 98 21 c0 40
31 38 28 40 40 60 3a 00 fe 1f 11 00 00 1a ec 2c
00 b0 51 38 28 40 50 88 3a 00 fe 1f 11 00 00 1c
00 00 00 00 00 00 00 00 00 00 00 00 00 00 00 85

00 ff ff ff ff ff ff 00 30 ae ae 0f 01 01 01 01
08 16 01 04 b5 33 1d 78 3a c2 85 a4 56 4d 9c 25
12 50 54 bf cf 00 71 4f 81 80 81 8c 81 8a 95 00
95 0f b3 00 b3 0f 02 3a 80 18 71 38 2d 40 58 2c
45 00 fe 1f 11 00 00 1e 00 00 00 fd 00 32 4b 1e
53 14 00 0a 20 20 20 20 20 20 00 00 00 fc 00 4c
32 33 32 31 78 20 57 69 64 65 0a 20 00 00 00 ff
00 36 56 38 4d 36 31 33 39 0a 20 20 20 20 01 e2

02 03 16 f1 49 90 1f 04 13 12 11 03 02 01 23 09
07 07 83 01 00 00 01 1d 00 72 51 d0 1e 20 6e 28
55 00 fe 1f 11 00 00 1e 8c 0a d0 8a 20 e0 2d 10
10 3e 96 00 fe 1f 11 00 00 18 2b 16 80 d0 20 38
28 40 28 40 3a 00 fe 1f 11 00 00 1a 98 21 c0 40
31 38 28 40 40 60 3a 00 fe 1f 11 00 00 1a ec 2c
00 b0 51 38 28 40 50 88 3a 00 fe 1f 11 00 00 1c
00 00 00 00 00 00 00 00 00 00 00 00 00 00 00 85

----------------

Block 0, Base EDID:
  EDID Structure Version & Revision: 1.4
  Vendor & Product Identification:
    Manufacturer: LEN
    Model: 4014
    Serial Number: ...
    Made in: week 8 of 2012
  Basic Display Parameters & Features:
    Digital display
    Bits per primary color channel: 10
    DisplayPort interface
    Maximum image size: 51 cm x 29 cm
    Gamma: 2.20
    DPMS levels: Off
    Supported color formats: RGB 4:4:4, YCrCb 4:4:4, YCrCb 4:2:2
    First detailed timing includes the native pixel format and preferred refresh rate
  Color Characteristics:
    Red  : 0.6435, 0.3359
    Green: 0.3007, 0.6113
    Blue : 0.1464, 0.0703
    White: 0.3134, 0.3291
  Established Timings I & II:
    IBM     :   720x400    70.081663 Hz   9:5     31.467 kHz     28.320000 MHz
    DMT 0x04:   640x480    59.940476 Hz   4:3     31.469 kHz     25.175000 MHz
    Apple   :   640x480    66.666667 Hz   4:3     35.000 kHz     30.240000 MHz
    DMT 0x05:   640x480    72.808802 Hz   4:3     37.861 kHz     31.500000 MHz
    DMT 0x06:   640x480    75.000000 Hz   4:3     37.500 kHz     31.500000 MHz
    DMT 0x08:   800x600    56.250000 Hz   4:3     35.156 kHz     36.000000 MHz
    DMT 0x09:   800x600    60.316541 Hz   4:3     37.879 kHz     40.000000 MHz
    DMT 0x0a:   800x600    72.187572 Hz   4:3     48.077 kHz     50.000000 MHz
    DMT 0x0b:   800x600    75.000000 Hz   4:3     46.875 kHz     49.500000 MHz
    DMT 0x10:  1024x768    60.003840 Hz   4:3     48.363 kHz     65.000000 MHz
    DMT 0x11:  1024x768    70.069359 Hz   4:3     56.476 kHz     75.000000 MHz
    DMT 0x12:  1024x768    75.028582 Hz   4:3     60.023 kHz     78.750000 MHz
    DMT 0x24:  1280x1024   75.024675 Hz   5:4     79.976 kHz    135.000000 MHz
  Standard Timings:
    DMT 0x15:  1152x864    75.000000 Hz   4:3     67.500 kHz    108.000000 MHz
    DMT 0x23:  1280x1024   60.019740 Hz   5:4     63.981 kHz    108.000000 MHz
    GTF     :  1280x1024   72.000069 Hz   5:4     76.824 kHz    132.752000 MHz
    GTF     :  1280x1024   69.999805 Hz   5:4     74.620 kHz    128.943000 MHz
    DMT 0x2f:  1440x900    59.887445 Hz  16:10    55.935 kHz    106.500000 MHz
    DMT 0x30:  1440x900    74.984427 Hz  16:10    70.635 kHz    136.750000 MHz
    DMT 0x3a:  1680x1050   59.954250 Hz  16:10    65.290 kHz    146.250000 MHz
    DMT 0x3b:  1680x1050   74.892027 Hz  16:10    82.306 kHz    187.000000 MHz
  Detailed Timing Descriptors:
    DTD 1:  1920x1080   60.000000 Hz  16:9     67.500 kHz    148.500000 MHz (510 mm x 287 mm)
                 Hfront   88 Hsync  44 Hback  148 Hpol P
                 Vfront    4 Vsync   5 Vback   36 Vpol P
    Display Range Limits:
      Monitor ranges (GTF): 50-75 Hz V, 30-83 kHz H, max dotclock 200 MHz
    Display Product Name: 'L2321x Wide'
    Display Product Serial Number: ...
  Extension blocks: 1
Checksum: 0xe2

----------------

Block 1, CTA-861 Extension Block:
  Revision: 3
  Underscans IT Video Formats by default
  Basic audio support
  Supports YCbCr 4:4:4
  Supports YCbCr 4:2:2
  Native DTDs: 1
  Video Data Block:
    VIC  16:  1920x1080   60.000000 Hz  16:9     67.500 kHz    148.500000 MHz (native)
    VIC  31:  1920x1080   50.000000 Hz  16:9     56.250 kHz    148.500000 MHz
    VIC   4:  1280x720    60.000000 Hz  16:9     45.000 kHz     74.250000 MHz
    VIC  19:  1280x720    50.000000 Hz  16:9     37.500 kHz     74.250000 MHz
    VIC  18:   720x576    50.000000 Hz  16:9     31.250 kHz     27.000000 MHz
    VIC  17:   720x576    50.000000 Hz   4:3     31.250 kHz     27.000000 MHz
    VIC   3:   720x480    59.940060 Hz  16:9     31.469 kHz     27.000000 MHz
    VIC   2:   720x480    59.940060 Hz   4:3     31.469 kHz     27.000000 MHz
    VIC   1:   640x480    59.940476 Hz   4:3     31.469 kHz     25.175000 MHz
  Audio Data Block:
    Linear PCM:
      Max channels: 2
      Supported sample rates (kHz): 48 44.1 32
      Supported sample sizes (bits): 24 20 16
  Speaker Allocation Data Block:
    FL/FR - Front Left/Right
  Detailed Timing Descriptors:
    DTD 2:  1280x720    60.000000 Hz  16:9     45.000 kHz     74.250000 MHz (510 mm x 287 mm)
                 Hfront  110 Hsync  40 Hback  220 Hpol P
                 Vfront    5 Vsync   5 Vback   20 Vpol P
    DTD 3:   720x480    59.940060 Hz   3:2     31.469 kHz     27.000000 MHz (510 mm x 287 mm)
                 Hfront   16 Hsync  62 Hback   60 Hpol N
                 Vfront    9 Vsync   6 Vback   30 Vpol N
    DTD 4:   640x1080   59.751937 Hz  16:27    66.922 kHz     56.750000 MHz (510 mm x 287 mm)
                 Hfront   40 Hsync  64 Hback  104 Hpol P
                 Vfront    3 Vsync  10 Vback   27 Vpol N
    DTD 5:   960x1080   59.988839 Hz   8:9     67.188 kHz     86.000000 MHz (510 mm x 287 mm)
                 Hfront   64 Hsync  96 Hback  160 Hpol P
                 Vfront    3 Vsync  10 Vback   27 Vpol N
    DTD 6:  1280x1080   59.975801 Hz  32:27    67.173 kHz    115.000000 MHz (510 mm x 287 mm)
                 Hfront   80 Hsync 136 Hback  216 Hpol N
                 Vfront    3 Vsync  10 Vback   27 Vpol P
Checksum: 0x85  Unused space in Extension Block: 15 bytes

----------------

Warnings:

Block 0, Base EDID:
  Vendor & Product Identification: The serial number is one of the known dummy values, it should probably be set to 0.
  Display Range Limits: GTF support is deprecated in EDID 1.4.
Block 1, CTA-861 Extension Block:
  Detailed Timing Descriptor #3: Image size is 510x287 mm, but based on the picture AR it should be 430x287 mm.
  Detailed Timing Descriptor #4: Image size is 510x287 mm, but based on the picture AR it should be 170x287 mm.
  Detailed Timing Descriptor #5: Image size is 510x287 mm, but based on the picture AR it should be 255x287 mm.
  Detailed Timing Descriptor #6: Image size is 510x287 mm, but based on the picture AR it should be 340x287 mm.
  Display Product Serial Number is set, so the Serial Number in the Base EDID should be 0.
  Add a Colorimetry Data Block with the sRGB colorimetry bit set to avoid interop issues.

Failures:

Block 0, Base EDID:
  Display Range Limits: GTF is supported, but the display does not support continuous frequencies.
Block 1, CTA-861 Extension Block:
  Missing VCDB, needed for Set Selectable RGB Quantization to avoid interop issues.
EDID:
  Extension Block 2 started with EDID header, ignoring Extension Blocks >= 2.

EDID conformity: FAIL
