edid-decode (hex):

00 ff ff ff ff ff ff 00 1e 6d 96 9e ca 4e 03 00
09 21 01 03 80 6d 1f 78 ea a6 b5 ad 4e 48 ab 26
0c 50 54 21 09 00 d1 c0 81 c0 61 40 01 01 01 01
01 01 01 01 01 01 74 d6 00 a0 f0 38 40 40 30 20
3a 00 42 31 41 00 00 1a 00 00 00 fd 00 50 c8 1e
ff af 00 0a 20 20 20 20 20 20 00 00 00 fc 00 4c
47 20 55 4c 54 52 41 47 45 41 52 0a 00 00 00 ff
00 33 30 39 4e 54 58 52 36 43 37 37 38 0a 03 c2

f0 02 70 00 00 00 00 00 00 00 00 00 00 00 00 00
00 00 00 00 00 00 00 00 00 00 00 00 00 00 00 00
00 00 00 00 00 00 00 00 00 00 00 00 00 00 00 00
00 00 00 00 00 00 00 00 00 00 00 00 00 00 00 00
00 00 00 00 00 00 00 00 00 00 00 00 00 00 00 00
00 00 00 00 00 00 00 00 00 00 00 00 00 00 00 00
00 00 00 00 00 00 00 00 00 00 00 00 00 00 00 00
00 00 00 00 00 00 00 00 00 00 00 00 00 00 00 9e

02 03 59 70 23 0f 07 07 83 47 40 00 50 76 61 60
5f 5e 5d 3f 22 20 1f 13 12 10 04 03 01 6d 03 0c
00 10 00 b8 44 20 00 60 01 02 03 6d d8 5d c4 01
78 80 63 00 30 c8 c3 64 3f e3 0f 07 00 e2 00 6a
e3 05 c0 00 e6 06 05 01 7a 61 16 6d 1a 00 00 02
0b 50 c8 00 04 7a 16 61 1c 6f c2 00 a0 a0 a0 55
50 30 20 35 00 42 31 41 00 00 1a 1a 68 00 a0 f0
38 1f 40 30 20 3a 00 42 31 41 00 00 1a 00 00 a5

70 12 79 03 00 01 00 0c 94 2a ea 0b 00 14 a0 05
90 78 ff bb 0f 00 0a 74 21 0e 0e 07 01 23 00 00
00 03 01 50 fa a9 02 88 ff 13 7f 01 2f 80 1f 00
9f 05 91 00 02 00 09 00 33 ca 01 08 ff 13 9f 00
2f 80 1f 00 9f 05 66 00 02 00 09 00 57 79 01 08
ff 13 9f 00 2f 80 1f 00 9f 05 54 00 02 00 09 00
33 b7 00 08 ff 13 9f 00 2f 80 1f 00 9f 05 28 00
02 00 09 00 00 00 00 00 00 00 00 00 00 00 e4 90

00 ff ff ff ff ff ff 00 1e 6d 96 9e ca 4e 03 00
09 21 01 03 80 6d 1f 78 ea a6 b5 ad 4e 48 ab 26
0c 50 54 21 09 00 d1 c0 81 c0 61 40 01 01 01 01
01 01 01 01 01 01 74 d6 00 a0 f0 38 40 40 30 20
3a 00 42 31 41 00 00 1a 00 00 00 fd 00 50 c8 1e
ff af 00 0a 20 20 20 20 20 20 00 00 00 fc 00 4c
47 20 55 4c 54 52 41 47 45 41 52 0a 00 00 00 ff
00 33 30 39 4e 54 58 52 36 43 37 37 38 0a 03 c2

f0 02 70 00 00 00 00 00 00 00 00 00 00 00 00 00
00 00 00 00 00 00 00 00 00 00 00 00 00 00 00 00
00 00 00 00 00 00 00 00 00 00 00 00 00 00 00 00
00 00 00 00 00 00 00 00 00 00 00 00 00 00 00 00
00 00 00 00 00 00 00 00 00 00 00 00 00 00 00 00
00 00 00 00 00 00 00 00 00 00 00 00 00 00 00 00
00 00 00 00 00 00 00 00 00 00 00 00 00 00 00 00
00 00 00 00 00 00 00 00 00 00 00 00 00 00 00 9e

02 03 59 70 23 0f 07 07 83 47 40 00 50 76 61 60
5f 5e 5d 3f 22 20 1f 13 12 10 04 03 01 6d 03 0c
00 10 00 b8 44 20 00 60 01 02 03 6d d8 5d c4 01
78 80 63 00 30 c8 c3 64 3f e3 0f 07 00 e2 00 6a
e3 05 c0 00 e6 06 05 01 7a 61 16 6d 1a 00 00 02
0b 50 c8 00 04 7a 16 61 1c 6f c2 00 a0 a0 a0 55
50 30 20 35 00 42 31 41 00 00 1a 1a 68 00 a0 f0
38 1f 40 30 20 3a 00 42 31 41 00 00 1a 00 00 a5

70 12 79 03 00 01 00 0c 94 2a ea 0b 00 14 a0 05
90 78 ff bb 0f 00 0a 74 21 0e 0e 07 01 23 00 00
00 03 01 50 fa a9 02 88 ff 13 7f 01 2f 80 1f 00
9f 05 91 00 02 00 09 00 33 ca 01 08 ff 13 9f 00
2f 80 1f 00 9f 05 66 00 02 00 09 00 57 79 01 08
ff 13 9f 00 2f 80 1f 00 9f 05 54 00 02 00 09 00
33 b7 00 08 ff 13 9f 00 2f 80 1f 00 9f 05 28 00
02 00 09 00 00 00 00 00 00 00 00 00 00 00 e4 90

----------------

Block 0, Base EDID:
  EDID Structure Version & Revision: 1.3
  Vendor & Product Identification:
    Manufacturer: GSM
    Model: 40598
    Serial Number: ...
    Made in: week 9 of 2023
  Basic Display Parameters & Features:
    Digital display
    Maximum image size: 109 cm x 31 cm
    Gamma: 2.20
    DPMS levels: Standby Suspend Off
    RGB color display
    First detailed timing is the preferred timing
  Color Characteristics:
    Red  : 0.6777, 0.3066
    Green: 0.2822, 0.6699
    Blue : 0.1503, 0.0498
    White: 0.3134, 0.3291
  Established Timings I & II:
    DMT 0x04:   640x480    59.940476 Hz   4:3     31.469 kHz     25.175000 MHz
    DMT 0x09:   800x600    60.316541 Hz   4:3     37.879 kHz     40.000000 MHz
    DMT 0x10:  1024x768    60.003840 Hz   4:3     48.363 kHz     65.000000 MHz
    DMT 0x24:  1280x1024   75.024675 Hz   5:4     79.976 kHz    135.000000 MHz
  Standard Timings:
    DMT 0x52:  1920x1080   60.000000 Hz  16:9     67.500 kHz    148.500000 MHz
    DMT 0x55:  1280x720    60.000000 Hz  16:9     45.000 kHz     74.250000 MHz
    DMT 0x10:  1024x768    60.003840 Hz   4:3     48.363 kHz     65.000000 MHz
  Detailed Timing Descriptors:
    DTD 1:  3840x1080  119.973776 Hz  32:9    137.250 kHz    549.000000 MHz (1090 mm x 305 mm)
                 Hfront   48 Hsync  32 Hback   80 Hpol P
                 Vfront    3 Vsync  10 Vback   51 Vpol N
    Display Range Limits:
      Monitor ranges (GTF): 80-200 Hz V, 30-255 kHz H, max dotclock 1750 MHz
    Display Product Name: 'LG ULTRAGEAR'
    Display Product Serial Number: ...
  Extension blocks: 3
Checksum: 0xc2

----------------

Block 1, Block Map Extension Block:
  Block   2: CTA-861 Extension Block
  Block   3: DisplayID Extension Block
Checksum: 0x9e

----------------

Block 2, CTA-861 Extension Block:
  Revision: 3
  Basic audio support
  Supports YCbCr 4:4:4
  Supports YCbCr 4:2:2
  Native detailed modes: 0
  Audio Data Block:
    Linear PCM:
      Max channels: 8
      Supported sample rates (kHz): 48 44.1 32
      Supported sample sizes (bits): 24 20 16
  Speaker Allocation Data Block:
    FL/FR - Front Left/Right
    LFE1 - Low Frequency Effects 1
    FC - Front Center
    BL/BR - Back Left/Right
    SiL/SiR - Side Left/Right (Deprecated, use the RCDB)
  Video Data Block:
    VIC 118:  3840x2160  120.000000 Hz  16:9    270.000 kHz   1188.000000 MHz
    VIC  97:  3840x2160   60.000000 Hz  16:9    135.000 kHz    594.000000 MHz
    VIC  96:  3840x2160   50.000000 Hz  16:9    112.500 kHz    594.000000 MHz
    VIC  95:  3840x2160   30.000000 Hz  16:9     67.500 kHz    297.000000 MHz
    VIC  94:  3840x2160   25.000000 Hz  16:9     56.250 kHz    297.000000 MHz
    VIC  93:  3840x2160   24.000000 Hz  16:9     54.000 kHz    297.000000 MHz
    VIC  63:  1920x1080  120.000000 Hz  16:9    135.000 kHz    297.000000 MHz
    VIC  34:  1920x1080   30.000000 Hz  16:9     33.750 kHz     74.250000 MHz
    VIC  32:  1920x1080   24.000000 Hz  16:9     27.000 kHz     74.250000 MHz
    VIC  31:  1920x1080   50.000000 Hz  16:9     56.250 kHz    148.500000 MHz
    VIC  19:  1280x720    50.000000 Hz  16:9     37.500 kHz     74.250000 MHz
    VIC  18:   720x576    50.000000 Hz  16:9     31.250 kHz     27.000000 MHz
    VIC  16:  1920x1080   60.000000 Hz  16:9     67.500 kHz    148.500000 MHz
    VIC   4:  1280x720    60.000000 Hz  16:9     45.000 kHz     74.250000 MHz
    VIC   3:   720x480    59.940060 Hz  16:9     31.469 kHz     27.000000 MHz
    VIC   1:   640x480    59.940476 Hz   4:3     31.469 kHz     25.175000 MHz
  Vendor-Specific Data Block (HDMI), OUI 00-0C-03:
    Source physical address: 1.0.0.0
    Supports_AI
    DC_36bit
    DC_30bit
    DC_Y444
    Maximum TMDS clock: 340 MHz
    Extended HDMI video details:
      HDMI VICs:
        HDMI VIC 1:  3840x2160   30.000000 Hz  16:9     67.500 kHz    297.000000 MHz
        HDMI VIC 2:  3840x2160   25.000000 Hz  16:9     56.250 kHz    297.000000 MHz
        HDMI VIC 3:  3840x2160   24.000000 Hz  16:9     54.000 kHz    297.000000 MHz
  Vendor-Specific Data Block (HDMI Forum), OUI C4-5D-D8:
    Version: 1
    Maximum TMDS Character Rate: 600 MHz
    SCDC Present
    Max Fixed Rate Link: 3 and 6 Gbps per lane on 3 lanes, 6, 8, 10 and 12 Gbps on 4 lanes
    Supports 12-bits/component Deep Color 4:2:0 Pixel Encoding
    Supports 10-bits/component Deep Color 4:2:0 Pixel Encoding
    VRRmin: 48 Hz
    VRRmax: 200 Hz
    Supports VESA DSC 1.2a compression
    Supports Compressed Video Transport for 4:2:0 Pixel Encoding
    Supports 12 bpc Compressed Video Transport
    Supports 10 bpc Compressed Video Transport
    DSC Max Slices: up to 8 slices and up to (340 MHz/Ksliceadjust) pixel clock per slice
    DSC Max Fixed Rate Link: 3 and 6 Gbps per lane on 3 lanes, 6, 8, 10 and 12 Gbps on 4 lanes
    Maximum number of bytes in a line of chunks: 65536
  YCbCr 4:2:0 Capability Map Data Block:
    VIC 118:  3840x2160  120.000000 Hz  16:9    270.000 kHz   1188.000000 MHz
    VIC  97:  3840x2160   60.000000 Hz  16:9    135.000 kHz    594.000000 MHz
    VIC  96:  3840x2160   50.000000 Hz  16:9    112.500 kHz    594.000000 MHz
  Video Capability Data Block:
    YCbCr quantization: No Data
    RGB quantization: Selectable (via AVI Q)
    PT scan behavior: Always Underscanned
    IT scan behavior: Always Underscanned
    CE scan behavior: Always Underscanned
  Colorimetry Data Block:
    BT2020YCC
    BT2020RGB
  HDR Static Metadata Data Block:
    Electro optical transfer functions:
      Traditional gamma - SDR luminance range
      SMPTE ST2084
    Supported static metadata descriptors:
      Static metadata type 1
    Desired content max luminance: 122 (702.501 cd/m^2)
    Desired content max frame-average luminance: 97 (408.759 cd/m^2)
    Desired content min luminance: 22 (0.052 cd/m^2)
  Vendor-Specific Data Block (AMD), OUI 00-00-1A:
    Version: 2
    Feature Caps: 0x0b
      Local Dimming Supported
    Minimum Refresh Rate: 80 Hz
    Maximum Refresh Rate: 200 Hz
    Flags 1.x: 0x00
    Flags 2.x: 0x04
      ST 2084 (PQ) EOTF Supported
      Linear EOTF (Windows scRGB, 0.0 - 125.0) Supported
      Gamma 2.2 EOTF Supported
      BT.2020 Gamut Supported
    Maximum luminance: 122 (702.501 cd/m^2)
    Minimum luminance: 22 (0.052 cd/m^2)
    Maximum luminance (without local dimming): 97 (408.759 cd/m^2)
    Minimum luminance (without local dimming): 28 (0.049 cd/m^2)
  Detailed Timing Descriptors:
    DTD 2:  2560x1440  119.997589 Hz  16:9    182.996 kHz    497.750000 MHz (1090 mm x 305 mm)
                 Hfront   48 Hsync  32 Hback   80 Hpol P
                 Vfront    3 Vsync   5 Vback   77 Vpol N
    DTD 3:  3840x1080   59.968497 Hz  32:9     66.625 kHz    266.500000 MHz (1090 mm x 305 mm)
                 Hfront   48 Hsync  32 Hback   80 Hpol P
                 Vfront    3 Vsync  10 Vback   18 Vpol N
Checksum: 0xa5  Unused space in Extension Block: 2 bytes

----------------

Block 3, DisplayID Extension Block:
  Version: 1.2
  Extension Count: 0
  Display Product Type: Standalone display device
  Display Parameters Data Block (0x01):
    Image size: 1090.0 mm x 305.0 mm
    Display native pixel format: 5120x1440
    Feature support flags:
      Power management (DPM)
      Audio support on video interface
    Gamma: 2.20
    Aspect ratio: 3.55
    Dynamic bpc native: 12
    Dynamic bpc overall: 12
  Display Interface Data Block:
    Interface Type: HDMI-A
    Number of Links: 4
    Interface Standard Version: 2.1
    Supported bpc for RGB encoding: 8, 10, 12
    Supported bpc for YCbCr 4:4:4 encoding: 8, 10, 12
    Supported bpc for YCbCr 4:2:2 encoding: 8, 10, 12
    Supported Content Protection: HDCP 2.3
    Spread Spectrum: None
  Video Timing Modes Type 1 - Detailed Timings Data Block:
    DTD:  5120x1440  200.000137 Hz   0:0    317.200 kHz   1745.870000 MHz (aspect undefined, no 3D stereo, preferred)
               Hfront   48 Hsync  32 Hback  304 Hpol P
               Vfront    3 Vsync  10 Vback  133 Vpol N
    DTD:  5120x1440  143.978672 Hz   0:0    222.159 kHz   1173.000000 MHz (aspect undefined, no 3D stereo)
               Hfront   48 Hsync  32 Hback   80 Hpol P
               Vfront    3 Vsync  10 Vback   90 Vpol N
    DTD:  5120x1440  119.970194 Hz   0:0    182.955 kHz    966.000000 MHz (aspect undefined, no 3D stereo)
               Hfront   48 Hsync  32 Hback   80 Hpol P
               Vfront    3 Vsync  10 Vback   72 Vpol N
    DTD:  5120x1440   59.976879 Hz   0:0     88.826 kHz    469.000000 MHz (aspect undefined, no 3D stereo)
               Hfront   48 Hsync  32 Hback   80 Hpol P
               Vfront    3 Vsync  10 Vback   28 Vpol N
  Checksum: 0xe4
Checksum: 0x90

----------------

Block 4, Unknown EDID Extension Block 0x00:
  00 ff ff ff ff ff ff 00 1e 6d 96 9e ca 4e 03 00 '.........m...N..'
  09 21 01 03 80 6d 1f 78 ea a6 b5 ad 4e 48 ab 26 '.!...m.x....NH.&'
  0c 50 54 21 09 00 d1 c0 81 c0 61 40 01 01 01 01 '.PT!......a@....'
  01 01 01 01 01 01 74 d6 00 a0 f0 38 40 40 30 20 '......t....8@@0 '
  3a 00 42 31 41 00 00 1a 00 00 00 fd 00 50 c8 1e ':.B1A........P..'
  ff af 00 0a 20 20 20 20 20 20 00 00 00 fc 00 4c '....      .....L'
  47 20 55 4c 54 52 41 47 45 41 52 0a 00 00 00 ff 'G ULTRAGEAR.....'
  00 33 30 39 4e 54 58 52 36 43 37 37 38 0a 03 c2 '.309NTXR6C778...'
Checksum: 0xc2

----------------

Block 5, Block Map Extension Block:
  Block 129: CTA-861 Extension Block
  Block 130: DisplayID Extension Block
Checksum: 0x9e

----------------

Block 6, CTA-861 Extension Block:
  Revision: 3
  Basic audio support
  Supports YCbCr 4:4:4
  Supports YCbCr 4:2:2
  Native detailed modes: 0
  Audio Data Block:
    Linear PCM:
      Max channels: 8
      Supported sample rates (kHz): 48 44.1 32
      Supported sample sizes (bits): 24 20 16
  Speaker Allocation Data Block:
    FL/FR - Front Left/Right
    LFE1 - Low Frequency Effects 1
    FC - Front Center
    BL/BR - Back Left/Right
    SiL/SiR - Side Left/Right (Deprecated, use the RCDB)
  Video Data Block:
    VIC 118:  3840x2160  120.000000 Hz  16:9    270.000 kHz   1188.000000 MHz
    VIC  97:  3840x2160   60.000000 Hz  16:9    135.000 kHz    594.000000 MHz
    VIC  96:  3840x2160   50.000000 Hz  16:9    112.500 kHz    594.000000 MHz
    VIC  95:  3840x2160   30.000000 Hz  16:9     67.500 kHz    297.000000 MHz
    VIC  94:  3840x2160   25.000000 Hz  16:9     56.250 kHz    297.000000 MHz
    VIC  93:  3840x2160   24.000000 Hz  16:9     54.000 kHz    297.000000 MHz
    VIC  63:  1920x1080  120.000000 Hz  16:9    135.000 kHz    297.000000 MHz
    VIC  34:  1920x1080   30.000000 Hz  16:9     33.750 kHz     74.250000 MHz
    VIC  32:  1920x1080   24.000000 Hz  16:9     27.000 kHz     74.250000 MHz
    VIC  31:  1920x1080   50.000000 Hz  16:9     56.250 kHz    148.500000 MHz
    VIC  19:  1280x720    50.000000 Hz  16:9     37.500 kHz     74.250000 MHz
    VIC  18:   720x576    50.000000 Hz  16:9     31.250 kHz     27.000000 MHz
    VIC  16:  1920x1080   60.000000 Hz  16:9     67.500 kHz    148.500000 MHz
    VIC   4:  1280x720    60.000000 Hz  16:9     45.000 kHz     74.250000 MHz
    VIC   3:   720x480    59.940060 Hz  16:9     31.469 kHz     27.000000 MHz
    VIC   1:   640x480    59.940476 Hz   4:3     31.469 kHz     25.175000 MHz
  Vendor-Specific Data Block (HDMI), OUI 00-0C-03:
    Source physical address: 1.0.0.0
    Supports_AI
    DC_36bit
    DC_30bit
    DC_Y444
    Maximum TMDS clock: 340 MHz
    Extended HDMI video details:
      HDMI VICs:
        HDMI VIC 1:  3840x2160   30.000000 Hz  16:9     67.500 kHz    297.000000 MHz
        HDMI VIC 2:  3840x2160   25.000000 Hz  16:9     56.250 kHz    297.000000 MHz
        HDMI VIC 3:  3840x2160   24.000000 Hz  16:9     54.000 kHz    297.000000 MHz
  Vendor-Specific Data Block (HDMI Forum), OUI C4-5D-D8:
    Version: 1
    Maximum TMDS Character Rate: 600 MHz
    SCDC Present
    Max Fixed Rate Link: 3 and 6 Gbps per lane on 3 lanes, 6, 8, 10 and 12 Gbps on 4 lanes
    Supports 12-bits/component Deep Color 4:2:0 Pixel Encoding
    Supports 10-bits/component Deep Color 4:2:0 Pixel Encoding
    VRRmin: 48 Hz
    VRRmax: 200 Hz
    Supports VESA DSC 1.2a compression
    Supports Compressed Video Transport for 4:2:0 Pixel Encoding
    Supports 12 bpc Compressed Video Transport
    Supports 10 bpc Compressed Video Transport
    DSC Max Slices: up to 8 slices and up to (340 MHz/Ksliceadjust) pixel clock per slice
    DSC Max Fixed Rate Link: 3 and 6 Gbps per lane on 3 lanes, 6, 8, 10 and 12 Gbps on 4 lanes
    Maximum number of bytes in a line of chunks: 65536
  YCbCr 4:2:0 Capability Map Data Block:
    VIC 118:  3840x2160  120.000000 Hz  16:9    270.000 kHz   1188.000000 MHz
    VIC  97:  3840x2160   60.000000 Hz  16:9    135.000 kHz    594.000000 MHz
    VIC  96:  3840x2160   50.000000 Hz  16:9    112.500 kHz    594.000000 MHz
  Video Capability Data Block:
    YCbCr quantization: No Data
    RGB quantization: Selectable (via AVI Q)
    PT scan behavior: Always Underscanned
    IT scan behavior: Always Underscanned
    CE scan behavior: Always Underscanned
  Colorimetry Data Block:
    BT2020YCC
    BT2020RGB
  HDR Static Metadata Data Block:
    Electro optical transfer functions:
      Traditional gamma - SDR luminance range
      SMPTE ST2084
    Supported static metadata descriptors:
      Static metadata type 1
    Desired content max luminance: 122 (702.501 cd/m^2)
    Desired content max frame-average luminance: 97 (408.759 cd/m^2)
    Desired content min luminance: 22 (0.052 cd/m^2)
  Vendor-Specific Data Block (AMD), OUI 00-00-1A:
    Version: 2
    Feature Caps: 0x0b
      Local Dimming Supported
    Minimum Refresh Rate: 80 Hz
    Maximum Refresh Rate: 200 Hz
    Flags 1.x: 0x00
    Flags 2.x: 0x04
      ST 2084 (PQ) EOTF Supported
      Linear EOTF (Windows scRGB, 0.0 - 125.0) Supported
      Gamma 2.2 EOTF Supported
      BT.2020 Gamut Supported
    Maximum luminance: 122 (702.501 cd/m^2)
    Minimum luminance: 22 (0.052 cd/m^2)
    Maximum luminance (without local dimming): 97 (408.759 cd/m^2)
    Minimum luminance (without local dimming): 28 (0.049 cd/m^2)
  Detailed Timing Descriptors:
    DTD 4:  2560x1440  119.997589 Hz  16:9    182.996 kHz    497.750000 MHz (1090 mm x 305 mm)
                 Hfront   48 Hsync  32 Hback   80 Hpol P
                 Vfront    3 Vsync   5 Vback   77 Vpol N
    DTD 5:  3840x1080   59.968497 Hz  32:9     66.625 kHz    266.500000 MHz (1090 mm x 305 mm)
                 Hfront   48 Hsync  32 Hback   80 Hpol P
                 Vfront    3 Vsync  10 Vback   18 Vpol N
Checksum: 0xa5  Unused space in Extension Block: 2 bytes

----------------

Block 7, DisplayID Extension Block:
  Version: 1.2
  Extension Count: 0
  Display Parameters Data Block (0x01):
    Image size: 1090.0 mm x 305.0 mm
    Display native pixel format: 5120x1440
    Feature support flags:
      Power management (DPM)
      Audio support on video interface
    Gamma: 2.20
    Aspect ratio: 3.55
    Dynamic bpc native: 12
    Dynamic bpc overall: 12
  Display Interface Data Block:
    Interface Type: HDMI-A
    Number of Links: 4
    Interface Standard Version: 2.1
    Supported bpc for RGB encoding: 8, 10, 12
    Supported bpc for YCbCr 4:4:4 encoding: 8, 10, 12
    Supported bpc for YCbCr 4:2:2 encoding: 8, 10, 12
    Supported Content Protection: HDCP 2.3
    Spread Spectrum: None
  Video Timing Modes Type 1 - Detailed Timings Data Block:
    DTD:  5120x1440  200.000137 Hz   0:0    317.200 kHz   1745.870000 MHz (aspect undefined, no 3D stereo, preferred)
               Hfront   48 Hsync  32 Hback  304 Hpol P
               Vfront    3 Vsync  10 Vback  133 Vpol N
    DTD:  5120x1440  143.978672 Hz   0:0    222.159 kHz   1173.000000 MHz (aspect undefined, no 3D stereo)
               Hfront   48 Hsync  32 Hback   80 Hpol P
               Vfront    3 Vsync  10 Vback   90 Vpol N
    DTD:  5120x1440  119.970194 Hz   0:0    182.955 kHz    966.000000 MHz (aspect undefined, no 3D stereo)
               Hfront   48 Hsync  32 Hback   80 Hpol P
               Vfront    3 Vsync  10 Vback   72 Vpol N
    DTD:  5120x1440   59.976879 Hz   0:0     88.826 kHz    469.000000 MHz (aspect undefined, no 3D stereo)
               Hfront   48 Hsync  32 Hback   80 Hpol P
               Vfront    3 Vsync  10 Vback   28 Vpol N
  Checksum: 0xe4
Checksum: 0x90

----------------

Warnings:

Block 2, CTA-861 Extension Block:
  IT Video Formats are overscanned by default, but normally this should be underscanned.
  Speaker Allocation Data Block: Specifies deprecated speakers.
  Video Data Block: VIC 118 and the first DTD are not identical. Is this intended?
  Video Capability Data Block: Set Selectable YCbCr Quantization to avoid interop issues.
  Video Capability Data Block: S_PT is equal to S_IT and S_CE, so should be set to 0 instead.
  Colorimetry Data Block: Set the sRGB colorimetry bit to avoid interop issues.
  Detailed Timing Descriptor #2: Image size is 1090x305 mm, but based on the picture AR it should be 1090x613 mm.
  Display Product Serial Number is set, so the Serial Number in the Base EDID should be 0.
Block 6, CTA-861 Extension Block:
  IT Video Formats are overscanned by default, but normally this should be underscanned.
  Speaker Allocation Data Block: Specifies deprecated speakers.
  Video Capability Data Block: Set Selectable YCbCr Quantization to avoid interop issues.
  Video Capability Data Block: S_PT is equal to S_IT and S_CE, so should be set to 0 instead.
  Colorimetry Data Block: Set the sRGB colorimetry bit to avoid interop issues.
  Detailed Timing Descriptor #4: Image size is 1090x305 mm, but based on the picture AR it should be 1090x613 mm.
EDID:
  Base EDID: Some timings are out of range of the Monitor Ranges:
    Vertical Freq: 24.000 - 200.000 Hz (Monitor: 80.000 - 200.000 Hz)
    Horizontal Freq: 27.000 - 317.200 kHz (Monitor: 30.000 - 510.000 kHz)

Failures:

Block 1, Block Map Extension Block:
  Block 4 tag mismatch: expected 0x00, but got 0x00.
  Block 5 tag mismatch: expected 0xf0, but got 0x00.
  Block 6 tag mismatch: expected 0x02, but got 0x00.
  Block 7 tag mismatch: expected 0x70, but got 0x00.
Block 2, CTA-861 Extension Block:
  Vendor-Specific Data Block (HDMI Forum), OUI C4-5D-D8: HDMI VIC and related CTA VIC codes are present, but the UHD VIC bit is 0.
  Video Capability Data Block: IT video formats are always underscanned, but bit 7 of Byte 3 of the CTA-861 Extension header is set to overscanned.
Block 3, DisplayID Extension Block:
  Expected 0 DisplayID Extension Block, but got 1.
Block 4, Base EDID:
  Unknown Extension Block.
Block 5, Block Map Extension Block:
  Invalid block number 129.
  Must be used in block 1 and 128.
Block 6, CTA-861 Extension Block:
  Speaker Allocation Data Block: Only one instance of this Data Block is allowed.
  Video Data Block: Duplicate VIC 118.
  Video Data Block: Duplicate VIC 97.
  Video Data Block: Duplicate VIC 96.
  Video Data Block: Duplicate VIC 95.
  Video Data Block: Duplicate VIC 94.
  Video Data Block: Duplicate VIC 93.
  Video Data Block: Duplicate VIC 63.
  Video Data Block: Duplicate VIC 34.
  Video Data Block: Duplicate VIC 32.
  Video Data Block: Duplicate VIC 31.
  Video Data Block: Duplicate VIC 19.
  Video Data Block: Duplicate VIC 18.
  Video Data Block: Duplicate VIC 16.
  Video Data Block: Duplicate VIC 4.
  Video Data Block: Duplicate VIC 3.
  Video Data Block: Duplicate VIC 1.
  Vendor-Specific Data Block (HDMI Forum), OUI C4-5D-D8: Duplicate HDMI Forum VSDB/SCDB.
  Vendor-Specific Data Block (HDMI Forum), OUI C4-5D-D8: HDMI VIC and related CTA VIC codes are present, but the UHD VIC bit is 0.
  YCbCr 4:2:0 Capability Map Data Block: Only one instance of this Data Block is allowed.
  Video Capability Data Block: Only one instance of this Data Block is allowed.
  Video Capability Data Block: IT video formats are always underscanned, but bit 7 of Byte 3 of the CTA-861 Extension header is set to overscanned.
  Colorimetry Data Block: Only one instance of this Data Block is allowed.
  HDR Static Metadata Data Block: Only one instance of this Data Block is allowed.
Block 7, DisplayID Extension Block:
  Product Type should be 0 in extension block.
  Display Parameters Data Block (0x01): Duplicate Display Parameters Data Block.
EDID:
  Base EDID: EDID specified 3 extension block(s), but found 7 extension block(s).

EDID conformity: FAIL
