edid-decode (hex):

00 ff ff ff ff ff ff 00 22 0e 3e 37 00 00 00 00
1c 20 01 04 b5 47 29 78 3a 19 c5 ae 50 44 af 26
0e 50 54 a1 08 00 d1 00 d1 c0 a9 c0 95 00 81 80
01 01 01 01 01 01 4d d0 00 a0 f0 70 3e 80 30 20
35 00 c5 9b 21 00 00 1a 00 00 00 fd 00 1e 3c 1e
88 3c 01 0a 20 20 20 20 20 20 00 00 00 fc 00 48
50 20 55 33 32 20 34 4b 20 48 44 52 00 00 00 ff
00 31 43 52 32 32 38 30 34 58 57 0a 20 20 01 c9

02 03 26 f1 4b 60 5f 10 1f 04 13 12 03 11 02 01
23 09 07 07 83 01 00 00 e6 06 07 01 64 64 01 e3
05 e0 00 e2 00 eb a3 66 00 a0 f0 70 1f 80 30 20
35 00 c5 9b 21 00 00 1a e2 68 00 a0 a0 40 2e 60
30 20 36 00 c5 9b 21 00 00 1a 56 5e 00 a0 a0 a0
29 50 30 20 35 00 c5 9b 21 00 00 1a 00 00 00 00
00 00 00 00 00 00 00 00 00 00 00 00 00 00 00 00
00 00 00 00 00 00 00 00 00 00 00 00 00 00 00 ed

00 ff ff ff ff ff ff 00 22 0e 3e 37 00 00 00 00
1c 20 01 04 b5 47 29 78 3a 19 c5 ae 50 44 af 26
0e 50 54 a1 08 00 d1 00 d1 c0 a9 c0 95 00 81 80
01 01 01 01 01 01 4d d0 00 a0 f0 70 3e 80 30 20
35 00 c5 9b 21 00 00 1a 00 00 00 fd 00 1e 3c 1e
88 3c 01 0a 20 20 20 20 20 20 00 00 00 fc 00 48
50 20 55 33 32 20 34 4b 20 48 44 52 00 00 00 ff
00 31 43 52 32 32 38 30 34 58 57 0a 20 20 01 c9

02 03 26 f1 4b 60 5f 10 1f 04 13 12 03 11 02 01
23 09 07 07 83 01 00 00 e6 06 07 01 64 64 01 e3
05 e0 00 e2 00 eb a3 66 00 a0 f0 70 1f 80 30 20
35 00 c5 9b 21 00 00 1a e2 68 00 a0 a0 40 2e 60
30 20 36 00 c5 9b 21 00 00 1a 56 5e 00 a0 a0 a0
29 50 30 20 35 00 c5 9b 21 00 00 1a 00 00 00 00
00 00 00 00 00 00 00 00 00 00 00 00 00 00 00 00
00 00 00 00 00 00 00 00 00 00 00 00 00 00 00 ed

----------------

Block 0, Base EDID:
  EDID Structure Version & Revision: 1.4
  Vendor & Product Identification:
    Manufacturer: HPN
    Model: 14142
    Made in: week 28 of 2022
  Basic Display Parameters & Features:
    Digital display
    Bits per primary color channel: 10
    DisplayPort interface
    Maximum image size: 71 cm x 41 cm
    Gamma: 2.20
    DPMS levels: Off
    Supported color formats: RGB 4:4:4, YCrCb 4:4:4, YCrCb 4:2:2
    First detailed timing includes the native pixel format and preferred refresh rate
  Color Characteristics:
    Red  : 0.6796, 0.3134
    Green: 0.2675, 0.6845
    Blue : 0.1513, 0.0546
    White: 0.3134, 0.3291
  Established Timings I & II:
    IBM     :   720x400    70.081663 Hz   9:5     31.467 kHz     28.320000 MHz
    DMT 0x04:   640x480    59.940476 Hz   4:3     31.469 kHz     25.175000 MHz
    DMT 0x09:   800x600    60.316541 Hz   4:3     37.879 kHz     40.000000 MHz
    DMT 0x10:  1024x768    60.003840 Hz   4:3     48.363 kHz     65.000000 MHz
  Standard Timings:
    DMT 0x45:  1920x1200   59.884600 Hz  16:10    74.556 kHz    193.250000 MHz
    DMT 0x52:  1920x1080   60.000000 Hz  16:9     67.500 kHz    148.500000 MHz
    DMT 0x53:  1600x900    60.000000 Hz  16:9     60.000 kHz    108.000000 MHz (RB)
    DMT 0x2f:  1440x900    59.887445 Hz  16:10    55.935 kHz    106.500000 MHz
    DMT 0x23:  1280x1024   60.019740 Hz   5:4     63.981 kHz    108.000000 MHz
  Detailed Timing Descriptors:
    DTD 1:  3840x2160   59.996625 Hz  16:9    133.312 kHz    533.250000 MHz (709 mm x 411 mm)
                 Hfront   48 Hsync  32 Hback   80 Hpol P
                 Vfront    3 Vsync   5 Vback   54 Vpol N
    Display Range Limits:
      Monitor ranges (Range Limits Only): 30-60 Hz V, 30-136 kHz H, max dotclock 600 MHz
    Display Product Name: 'HP U32 4K HDR'
    Display Product Serial Number: ...
  Extension blocks: 1
Checksum: 0xc9

----------------

Block 1, CTA-861 Extension Block:
  Revision: 3
  Underscans IT Video Formats by default
  Basic audio support
  Supports YCbCr 4:4:4
  Supports YCbCr 4:2:2
  Native detailed modes: 1
  Video Data Block:
    VIC  96:  3840x2160   50.000000 Hz  16:9    112.500 kHz    594.000000 MHz
    VIC  95:  3840x2160   30.000000 Hz  16:9     67.500 kHz    297.000000 MHz
    VIC  16:  1920x1080   60.000000 Hz  16:9     67.500 kHz    148.500000 MHz
    VIC  31:  1920x1080   50.000000 Hz  16:9     56.250 kHz    148.500000 MHz
    VIC   4:  1280x720    60.000000 Hz  16:9     45.000 kHz     74.250000 MHz
    VIC  19:  1280x720    50.000000 Hz  16:9     37.500 kHz     74.250000 MHz
    VIC  18:   720x576    50.000000 Hz  16:9     31.250 kHz     27.000000 MHz
    VIC   3:   720x480    59.940060 Hz  16:9     31.469 kHz     27.000000 MHz
    VIC  17:   720x576    50.000000 Hz   4:3     31.250 kHz     27.000000 MHz
    VIC   2:   720x480    59.940060 Hz   4:3     31.469 kHz     27.000000 MHz
    VIC   1:   640x480    59.940476 Hz   4:3     31.469 kHz     25.175000 MHz
  Audio Data Block:
    Linear PCM:
      Max channels: 2
      Supported sample rates (kHz): 48 44.1 32
      Supported sample sizes (bits): 24 20 16
  Speaker Allocation Data Block:
    FL/FR - Front Left/Right
  HDR Static Metadata Data Block:
    Electro optical transfer functions:
      Traditional gamma - SDR luminance range
      Traditional gamma - HDR luminance range
      SMPTE ST2084
    Supported static metadata descriptors:
      Static metadata type 1
    Desired content max luminance: 100 (436.203 cd/m^2)
    Desired content max frame-average luminance: 100 (436.203 cd/m^2)
    Desired content min luminance: 1 (0.000 cd/m^2)
  Colorimetry Data Block:
    BT2020cYCC
    BT2020YCC
    BT2020RGB
  Video Capability Data Block:
    YCbCr quantization: Selectable (via AVI YQ)
    RGB quantization: Selectable (via AVI Q)
    PT scan behavior: Always Underscanned
    IT scan behavior: Always Underscanned
    CE scan behavior: Supports both over- and underscan
  Detailed Timing Descriptors:
    DTD 2:  3840x2160   29.980602 Hz  16:9     65.688 kHz    262.750000 MHz (709 mm x 411 mm)
                 Hfront   48 Hsync  32 Hback   80 Hpol P
                 Vfront    3 Vsync   5 Vback   23 Vpol N
    DTD 3:  2560x1600   59.971589 Hz  16:10    98.713 kHz    268.500000 MHz (709 mm x 411 mm)
                 Hfront   48 Hsync  32 Hback   80 Hpol P
                 Vfront    3 Vsync   6 Vback   37 Vpol N
    DTD 4:  2560x1440   59.950550 Hz  16:9     88.787 kHz    241.500000 MHz (709 mm x 411 mm)
                 Hfront   48 Hsync  32 Hback   80 Hpol P
                 Vfront    3 Vsync   5 Vback   33 Vpol N
Checksum: 0xed  Unused space in Extension Block: 35 bytes

----------------

Block 2, Unknown EDID Extension Block 0x00:
  00 ff ff ff ff ff ff 00 22 0e 3e 37 00 00 00 00 '........".>7....'
  1c 20 01 04 b5 47 29 78 3a 19 c5 ae 50 44 af 26 '. ...G)x:...PD.&'
  0e 50 54 a1 08 00 d1 00 d1 c0 a9 c0 95 00 81 80 '.PT.............'
  01 01 01 01 01 01 4d d0 00 a0 f0 70 3e 80 30 20 '......M....p>.0 '
  35 00 c5 9b 21 00 00 1a 00 00 00 fd 00 1e 3c 1e '5...!.........<.'
  88 3c 01 0a 20 20 20 20 20 20 00 00 00 fc 00 48 '.<..      .....H'
  50 20 55 33 32 20 34 4b 20 48 44 52 00 00 00 ff 'P U32 4K HDR....'
  00 31 43 52 32 32 38 30 34 58 57 0a 20 20 01 c9 '.1CR22804XW.  ..'
Checksum: 0xc9

----------------

Block 3, CTA-861 Extension Block:
  Revision: 3
  Underscans IT Video Formats by default
  Basic audio support
  Supports YCbCr 4:4:4
  Supports YCbCr 4:2:2
  Native detailed modes: 1
  Video Data Block:
    VIC  96:  3840x2160   50.000000 Hz  16:9    112.500 kHz    594.000000 MHz
    VIC  95:  3840x2160   30.000000 Hz  16:9     67.500 kHz    297.000000 MHz
    VIC  16:  1920x1080   60.000000 Hz  16:9     67.500 kHz    148.500000 MHz
    VIC  31:  1920x1080   50.000000 Hz  16:9     56.250 kHz    148.500000 MHz
    VIC   4:  1280x720    60.000000 Hz  16:9     45.000 kHz     74.250000 MHz
    VIC  19:  1280x720    50.000000 Hz  16:9     37.500 kHz     74.250000 MHz
    VIC  18:   720x576    50.000000 Hz  16:9     31.250 kHz     27.000000 MHz
    VIC   3:   720x480    59.940060 Hz  16:9     31.469 kHz     27.000000 MHz
    VIC  17:   720x576    50.000000 Hz   4:3     31.250 kHz     27.000000 MHz
    VIC   2:   720x480    59.940060 Hz   4:3     31.469 kHz     27.000000 MHz
    VIC   1:   640x480    59.940476 Hz   4:3     31.469 kHz     25.175000 MHz
  Audio Data Block:
    Linear PCM:
      Max channels: 2
      Supported sample rates (kHz): 48 44.1 32
      Supported sample sizes (bits): 24 20 16
  Speaker Allocation Data Block:
    FL/FR - Front Left/Right
  HDR Static Metadata Data Block:
    Electro optical transfer functions:
      Traditional gamma - SDR luminance range
      Traditional gamma - HDR luminance range
      SMPTE ST2084
    Supported static metadata descriptors:
      Static metadata type 1
    Desired content max luminance: 100 (436.203 cd/m^2)
    Desired content max frame-average luminance: 100 (436.203 cd/m^2)
    Desired content min luminance: 1 (0.000 cd/m^2)
  Colorimetry Data Block:
    BT2020cYCC
    BT2020YCC
    BT2020RGB
  Video Capability Data Block:
    YCbCr quantization: Selectable (via AVI YQ)
    RGB quantization: Selectable (via AVI Q)
    PT scan behavior: Always Underscanned
    IT scan behavior: Always Underscanned
    CE scan behavior: Supports both over- and underscan
  Detailed Timing Descriptors:
    DTD 5:  3840x2160   29.980602 Hz  16:9     65.688 kHz    262.750000 MHz (709 mm x 411 mm)
                 Hfront   48 Hsync  32 Hback   80 Hpol P
                 Vfront    3 Vsync   5 Vback   23 Vpol N
    DTD 6:  2560x1600   59.971589 Hz  16:10    98.713 kHz    268.500000 MHz (709 mm x 411 mm)
                 Hfront   48 Hsync  32 Hback   80 Hpol P
                 Vfront    3 Vsync   6 Vback   37 Vpol N
    DTD 7:  2560x1440   59.950550 Hz  16:9     88.787 kHz    241.500000 MHz (709 mm x 411 mm)
                 Hfront   48 Hsync  32 Hback   80 Hpol P
                 Vfront    3 Vsync   5 Vback   33 Vpol N
Checksum: 0xed  Unused space in Extension Block: 35 bytes

----------------

Warnings:

Block 0, Base EDID:
  Detailed Timing Descriptor #1: Image size is 709x411 mm, but based on the picture AR it should be 709x398 mm.
Block 1, CTA-861 Extension Block:
  Video Data Block: VIC 96 and the first DTD are not identical. Is this intended?
  Colorimetry Data Block: Set the sRGB colorimetry bit to avoid interop issues.
  Detailed Timing Descriptor #2: Image size is 709x411 mm, but based on the picture AR it should be 709x398 mm.
  Detailed Timing Descriptor #3: Image size is 709x411 mm, but based on the picture AR it should be 709x443 mm.
  Detailed Timing Descriptor #4: Image size is 709x411 mm, but based on the picture AR it should be 709x398 mm.
Block 3, CTA-861 Extension Block:
  Colorimetry Data Block: Set the sRGB colorimetry bit to avoid interop issues.
  Detailed Timing Descriptor #5: Image size is 709x411 mm, but based on the picture AR it should be 709x398 mm.
  Detailed Timing Descriptor #6: Image size is 709x411 mm, but based on the picture AR it should be 709x443 mm.
  Detailed Timing Descriptor #7: Image size is 709x411 mm, but based on the picture AR it should be 709x398 mm.
EDID:
  Base EDID: Some timings are out of range of the Monitor Ranges:
    Vertical Freq: 29.981 - 70.082 Hz (Monitor: 30.000 - 60.000 Hz)

Failures:

Block 2, Base EDID:
  Unknown Extension Block.
Block 3, CTA-861 Extension Block:
  Video Data Block: Duplicate VIC 96.
  Video Data Block: Duplicate VIC 95.
  Video Data Block: Duplicate VIC 16.
  Video Data Block: Duplicate VIC 31.
  Video Data Block: Duplicate VIC 4.
  Video Data Block: Duplicate VIC 19.
  Video Data Block: Duplicate VIC 18.
  Video Data Block: Duplicate VIC 3.
  Video Data Block: Duplicate VIC 17.
  Video Data Block: Duplicate VIC 2.
  Video Data Block: Duplicate VIC 1.
  Speaker Allocation Data Block: Only one instance of this Data Block is allowed.
  HDR Static Metadata Data Block: Only one instance of this Data Block is allowed.
  Colorimetry Data Block: Only one instance of this Data Block is allowed.
  Video Capability Data Block: Only one instance of this Data Block is allowed.
EDID:
  Base EDID: EDID specified 1 extension block(s), but found 3 extension block(s).

EDID conformity: FAIL
