edid-decode (hex):

00 ff ff ff ff ff ff 00 36 69 62 14 00 00 00 00
29 1b 01 03 81 3b 23 78 2a dc 5b a3 54 4c 99 26
0f 47 49 af cf 00 81 80 61 7c 81 bc 95 00 95 3c
b3 00 b3 3c d1 fc 02 3a 80 18 71 38 2d 40 58 2c
45 00 56 50 21 00 00 1e 00 00 00 fc 00 4f 70 74
69 78 20 4d 41 47 32 37 43 0a 00 00 00 fd 00 32
90 a2 a2 21 01 0a 20 20 20 20 20 20 00 00 00 ff
00 30 30 30 30 30 30 30 30 30 30 30 30 31 01 2f

02 03 2d e1 4f 90 01 02 03 04 05 11 12 13 14 1f
29 2f 3f 40 23 09 07 07 83 01 00 00 67 03 0c 00
10 00 38 3c 68 1a 00 00 01 01 30 90 00 51 6c 80
a0 70 38 1f 40 30 20 35 00 56 50 21 00 00 1e 00
00 00 00 00 00 00 00 00 00 00 00 00 00 00 00 00
00 00 00 00 00 00 00 00 00 00 00 00 00 00 00 00
00 00 00 00 00 00 00 00 00 00 00 00 00 00 00 00
00 00 00 00 00 00 00 00 00 00 00 00 00 00 00 75

00 ff ff ff ff ff ff 00 36 69 62 14 00 00 00 00
29 1b 01 03 81 3b 23 78 2a dc 5b a3 54 4c 99 26
0f 47 49 af cf 00 81 80 61 7c 81 bc 95 00 95 3c
b3 00 b3 3c d1 fc 02 3a 80 18 71 38 2d 40 58 2c
45 00 56 50 21 00 00 1e 00 00 00 fc 00 4f 70 74
69 78 20 4d 41 47 32 37 43 0a 00 00 00 fd 00 32
90 a2 a2 21 01 0a 20 20 20 20 20 20 00 00 00 ff
00 30 30 30 30 30 30 30 30 30 30 30 30 31 01 2f

02 03 2d e1 4f 90 01 02 03 04 05 11 12 13 14 1f
29 2f 3f 40 23 09 07 07 83 01 00 00 67 03 0c 00
10 00 38 3c 68 1a 00 00 01 01 30 90 00 51 6c 80
a0 70 38 1f 40 30 20 35 00 56 50 21 00 00 1e 00
00 00 00 00 00 00 00 00 00 00 00 00 00 00 00 00
00 00 00 00 00 00 00 00 00 00 00 00 00 00 00 00
00 00 00 00 00 00 00 00 00 00 00 00 00 00 00 00
00 00 00 00 00 00 00 00 00 00 00 00 00 00 00 75

----------------

Block 0, Base EDID:
  EDID Structure Version & Revision: 1.3
  Vendor & Product Identification:
    Manufacturer: MSI
    Model: 5218
    Made in: week 41 of 2017
  Basic Display Parameters & Features:
    Digital display
    DFP 1.x compatible TMDS
    Maximum image size: 59 cm x 35 cm
    Gamma: 2.20
    DPMS levels: Off
    RGB color display
    First detailed timing is the preferred timing
  Color Characteristics:
    Red  : 0.6396, 0.3291
    Green: 0.2998, 0.5976
    Blue : 0.1494, 0.0595
    White: 0.2792, 0.2880
  Established Timings I & II:
    IBM     :   720x400    70.081663 Hz   9:5     31.467 kHz     28.320000 MHz
    DMT 0x04:   640x480    59.940476 Hz   4:3     31.469 kHz     25.175000 MHz
    DMT 0x05:   640x480    72.808802 Hz   4:3     37.861 kHz     31.500000 MHz
    DMT 0x06:   640x480    75.000000 Hz   4:3     37.500 kHz     31.500000 MHz
    DMT 0x08:   800x600    56.250000 Hz   4:3     35.156 kHz     36.000000 MHz
    DMT 0x09:   800x600    60.316541 Hz   4:3     37.879 kHz     40.000000 MHz
    DMT 0x0a:   800x600    72.187572 Hz   4:3     48.077 kHz     50.000000 MHz
    DMT 0x0b:   800x600    75.000000 Hz   4:3     46.875 kHz     49.500000 MHz
    DMT 0x10:  1024x768    60.003840 Hz   4:3     48.363 kHz     65.000000 MHz
    DMT 0x11:  1024x768    70.069359 Hz   4:3     56.476 kHz     75.000000 MHz
    DMT 0x12:  1024x768    75.028582 Hz   4:3     60.023 kHz     78.750000 MHz
    DMT 0x24:  1280x1024   75.024675 Hz   5:4     79.976 kHz    135.000000 MHz
  Standard Timings:
    DMT 0x23:  1280x1024   60.019740 Hz   5:4     63.981 kHz    108.000000 MHz
    GTF     :  1024x768   119.999931 Hz   4:3     98.760 kHz    139.054000 MHz
    GTF     :  1280x1024  120.000185 Hz   5:4    131.640 kHz    233.793000 MHz
    DMT 0x2f:  1440x900    59.887445 Hz  16:10    55.935 kHz    106.500000 MHz
    GTF     :  1440x900   119.999896 Hz  16:10   115.800 kHz    229.747000 MHz
    DMT 0x3a:  1680x1050   59.954250 Hz  16:10    65.290 kHz    146.250000 MHz
    GTF     :  1680x1050  120.000000 Hz  16:10   135.000 kHz    313.200000 MHz
    GTF     :  1920x1080  119.999987 Hz  16:9    138.840 kHz    368.759000 MHz
  Detailed Timing Descriptors:
    DTD 1:  1920x1080   60.000000 Hz  16:9     67.500 kHz    148.500000 MHz (598 mm x 336 mm)
                 Hfront   88 Hsync  44 Hback  148 Hpol P
                 Vfront    4 Vsync   5 Vback   36 Vpol P
    Display Product Name: 'Optix MAG27C'
    Display Range Limits:
      Monitor ranges (Range Limits Only): 50-144 Hz V, 162-162 kHz H, max dotclock 330 MHz
    Display Product Serial Number: ...
  Extension blocks: 1
Checksum: 0x2f

----------------

Block 1, CTA-861 Extension Block:
  Revision: 3
  Underscans IT Video Formats by default
  Basic audio support
  Supports YCbCr 4:4:4
  Native DTDs: 1
  Video Data Block:
    VIC  16:  1920x1080   60.000000 Hz  16:9     67.500 kHz    148.500000 MHz (native)
    VIC   1:   640x480    59.940476 Hz   4:3     31.469 kHz     25.175000 MHz
    VIC   2:   720x480    59.940060 Hz   4:3     31.469 kHz     27.000000 MHz
    VIC   3:   720x480    59.940060 Hz  16:9     31.469 kHz     27.000000 MHz
    VIC   4:  1280x720    60.000000 Hz  16:9     45.000 kHz     74.250000 MHz
    VIC   5:  1920x1080i  60.000000 Hz  16:9     33.750 kHz     74.250000 MHz
    VIC  17:   720x576    50.000000 Hz   4:3     31.250 kHz     27.000000 MHz
    VIC  18:   720x576    50.000000 Hz  16:9     31.250 kHz     27.000000 MHz
    VIC  19:  1280x720    50.000000 Hz  16:9     37.500 kHz     74.250000 MHz
    VIC  20:  1920x1080i  50.000000 Hz  16:9     28.125 kHz     74.250000 MHz
    VIC  31:  1920x1080   50.000000 Hz  16:9     56.250 kHz    148.500000 MHz
    VIC  41:  1280x720   100.000000 Hz  16:9     75.000 kHz    148.500000 MHz
    VIC  47:  1280x720   120.000000 Hz  16:9     90.000 kHz    148.500000 MHz
    VIC  63:  1920x1080  120.000000 Hz  16:9    135.000 kHz    297.000000 MHz
    VIC  64:  1920x1080  100.000000 Hz  16:9    112.500 kHz    297.000000 MHz
  Audio Data Block:
    Linear PCM:
      Max channels: 2
      Supported sample rates (kHz): 48 44.1 32
      Supported sample sizes (bits): 24 20 16
  Speaker Allocation Data Block:
    FL/FR - Front Left/Right
  Vendor-Specific Data Block (HDMI), OUI 00-0C-03:
    Source physical address: 1.0.0.0
    DC_36bit
    DC_30bit
    DC_Y444
    Maximum TMDS clock: 300 MHz
  Vendor-Specific Data Block (AMD), OUI 00-00-1A:
    Version: 1
    Feature Caps: 0x01
    Minimum Refresh Rate: 48 Hz
    Maximum Refresh Rate: 144 Hz
    Flags 1.x: 0x00
  Detailed Timing Descriptors:
    DTD 2:  1920x1080  119.993249 Hz  16:9    133.312 kHz    277.290000 MHz (598 mm x 336 mm)
                 Hfront   48 Hsync  32 Hback   80 Hpol P
                 Vfront    3 Vsync   5 Vback   23 Vpol P
Checksum: 0x75  Unused space in Extension Block: 64 bytes

----------------

Warnings:

Block 0, Base EDID:
  Display Product Serial Number: ...
Block 1, CTA-861 Extension Block:
  Add a Colorimetry Data Block with the sRGB colorimetry bit set to avoid interop issues.
EDID:
  Base EDID: Some timings are out of range of the Monitor Ranges:
    Horizontal Freq: 28.125 - 138.839 kHz (Monitor: 162.000 - 162.000 kHz)
    Maximum Clock: 368.759 MHz (Monitor: 330.000 MHz)

Failures:

Block 0, Base EDID:
  Display Range Limits: 'Range Limits Only' is not allowed for EDID < 1.4.
Block 1, CTA-861 Extension Block:
  Missing VCDB, needed for Set Selectable RGB Quantization to avoid interop issues.
EDID:
  Extension Block 2 started with EDID header, ignoring Extension Blocks >= 2.
  CTA-861: The maximum HDMI TMDS clock is 300000 kHz, but one or more video timings go up to 368759 kHz.

EDID conformity: FAIL
