edid-decode (hex):

00 ff ff ff ff ff ff 00 36 69 62 14 01 00 00 00
25 1d 01 03 80 50 21 78 2a 1a d5 ae 50 48 a6 25
12 50 54 bf cf 00 61 40 81 80 95 00 b3 00 95 28
d1 e8 b3 28 d1 c0 f5 7c 70 a0 d0 a0 2a 50 30 20
3a 00 1d 4d 31 00 00 1e 80 3e 70 a0 d0 a0 22 50
30 20 3a 00 1d 4d 31 00 00 1e 00 00 00 fc 00 4d
53 49 20 4d 41 47 33 34 31 43 51 0a 00 00 00 ff
00 4d 41 30 48 30 31 39 33 37 30 31 32 31 01 88

02 03 2f 31 4f 01 02 03 04 05 86 87 10 91 92 13
14 95 96 1f 83 00 00 00 65 03 0c 00 10 00 67 d8
5d c4 01 78 88 00 68 1a 00 00 01 01 30 90 00 f5
7c 70 a0 d0 a0 29 50 30 20 35 00 1d 4d 31 00 00
1a 43 d0 70 a0 d0 a0 29 50 30 20 35 00 1d 4d 31
00 00 1a 56 5e 00 a0 a0 a0 29 50 30 20 35 00 1d
4d 31 00 00 06 02 3a 80 d0 72 38 2d 40 10 2c 35
80 1d 4d 31 00 00 00 00 00 00 00 00 00 00 00 94

00 ff ff ff ff ff ff 00 36 69 62 14 01 00 00 00
25 1d 01 03 80 50 21 78 2a 1a d5 ae 50 48 a6 25
12 50 54 bf cf 00 61 40 81 80 95 00 b3 00 95 28
d1 e8 b3 28 d1 c0 f5 7c 70 a0 d0 a0 2a 50 30 20
3a 00 1d 4d 31 00 00 1e 80 3e 70 a0 d0 a0 22 50
30 20 3a 00 1d 4d 31 00 00 1e 00 00 00 fc 00 4d
53 49 20 4d 41 47 33 34 31 43 51 0a 00 00 00 ff
00 4d 41 30 48 30 31 39 33 37 30 31 32 31 01 88

02 03 2f 31 4f 01 02 03 04 05 86 87 10 91 92 13
14 95 96 1f 83 00 00 00 65 03 0c 00 10 00 67 d8
5d c4 01 78 88 00 68 1a 00 00 01 01 30 90 00 f5
7c 70 a0 d0 a0 29 50 30 20 35 00 1d 4d 31 00 00
1a 43 d0 70 a0 d0 a0 29 50 30 20 35 00 1d 4d 31
00 00 1a 56 5e 00 a0 a0 a0 29 50 30 20 35 00 1d
4d 31 00 00 06 02 3a 80 d0 72 38 2d 40 10 2c 35
80 1d 4d 31 00 00 00 00 00 00 00 00 00 00 00 94

----------------

Block 0, Base EDID:
  EDID Structure Version & Revision: 1.3
  Vendor & Product Identification:
    Manufacturer: MSI
    Model: 5218
    Serial Number: ...
    Made in: week 37 of 2019
  Basic Display Parameters & Features:
    Digital display
    Maximum image size: 80 cm x 33 cm
    Gamma: 2.20
    DPMS levels: Off
    RGB color display
    First detailed timing is the preferred timing
  Color Characteristics:
    Red  : 0.6796, 0.3134
    Green: 0.2832, 0.6503
    Blue : 0.1474, 0.0712
    White: 0.3134, 0.3291
  Established Timings I & II:
    IBM     :   720x400    70.081663 Hz   9:5     31.467 kHz     28.320000 MHz
    DMT 0x04:   640x480    59.940476 Hz   4:3     31.469 kHz     25.175000 MHz
    Apple   :   640x480    66.666667 Hz   4:3     35.000 kHz     30.240000 MHz
    DMT 0x05:   640x480    72.808802 Hz   4:3     37.861 kHz     31.500000 MHz
    DMT 0x06:   640x480    75.000000 Hz   4:3     37.500 kHz     31.500000 MHz
    DMT 0x08:   800x600    56.250000 Hz   4:3     35.156 kHz     36.000000 MHz
    DMT 0x09:   800x600    60.316541 Hz   4:3     37.879 kHz     40.000000 MHz
    DMT 0x0a:   800x600    72.187572 Hz   4:3     48.077 kHz     50.000000 MHz
    DMT 0x0b:   800x600    75.000000 Hz   4:3     46.875 kHz     49.500000 MHz
    DMT 0x10:  1024x768    60.003840 Hz   4:3     48.363 kHz     65.000000 MHz
    DMT 0x11:  1024x768    70.069359 Hz   4:3     56.476 kHz     75.000000 MHz
    DMT 0x12:  1024x768    75.028582 Hz   4:3     60.023 kHz     78.750000 MHz
    DMT 0x24:  1280x1024   75.024675 Hz   5:4     79.976 kHz    135.000000 MHz
  Standard Timings:
    DMT 0x10:  1024x768    60.003840 Hz   4:3     48.363 kHz     65.000000 MHz
    DMT 0x23:  1280x1024   60.019740 Hz   5:4     63.981 kHz    108.000000 MHz
    DMT 0x2f:  1440x900    59.887445 Hz  16:10    55.935 kHz    106.500000 MHz
    DMT 0x3a:  1680x1050   59.954250 Hz  16:10    65.290 kHz    146.250000 MHz
    GTF     :  1440x900    99.999787 Hz  16:10    95.300 kHz    187.550000 MHz
    GTF     :  1920x1080  100.000000 Hz  16:9    114.400 kHz    302.016000 MHz
    GTF     :  1680x1050  100.000078 Hz  16:10   111.200 kHz    256.205000 MHz
    DMT 0x52:  1920x1080   60.000000 Hz  16:9     67.500 kHz    148.500000 MHz
  Detailed Timing Descriptors:
    DTD 1:  3440x1440   59.958390 Hz  43:18    88.858 kHz    319.890000 MHz (797 mm x 333 mm)
                 Hfront   48 Hsync  32 Hback   80 Hpol P
                 Vfront    3 Vsync  10 Vback   29 Vpol P
    DTD 2:  3440x1440   30.152269 Hz  43:18    44.444 kHz    160.000000 MHz (797 mm x 333 mm)
                 Hfront   48 Hsync  32 Hback   80 Hpol P
                 Vfront    3 Vsync  10 Vback   21 Vpol P
    Display Product Name: 'MSI MAG341CQ'
    Display Product Serial Number: ...
  Extension blocks: 1
Checksum: 0x88

----------------

Block 1, CTA-861 Extension Block:
  Revision: 3
  Supports YCbCr 4:4:4
  Supports YCbCr 4:2:2
  Native DTDs: 1
  Video Data Block:
    VIC   1:   640x480    59.940476 Hz   4:3     31.469 kHz     25.175000 MHz
    VIC   2:   720x480    59.940060 Hz   4:3     31.469 kHz     27.000000 MHz
    VIC   3:   720x480    59.940060 Hz  16:9     31.469 kHz     27.000000 MHz
    VIC   4:  1280x720    60.000000 Hz  16:9     45.000 kHz     74.250000 MHz
    VIC   5:  1920x1080i  60.000000 Hz  16:9     33.750 kHz     74.250000 MHz
    VIC   6:  1440x480i   59.940060 Hz   4:3     15.734 kHz     27.000000 MHz (native)
    VIC   7:  1440x480i   59.940060 Hz  16:9     15.734 kHz     27.000000 MHz (native)
    VIC  16:  1920x1080   60.000000 Hz  16:9     67.500 kHz    148.500000 MHz
    VIC  17:   720x576    50.000000 Hz   4:3     31.250 kHz     27.000000 MHz (native)
    VIC  18:   720x576    50.000000 Hz  16:9     31.250 kHz     27.000000 MHz (native)
    VIC  19:  1280x720    50.000000 Hz  16:9     37.500 kHz     74.250000 MHz
    VIC  20:  1920x1080i  50.000000 Hz  16:9     28.125 kHz     74.250000 MHz
    VIC  21:  1440x576i   50.000000 Hz   4:3     15.625 kHz     27.000000 MHz (native)
    VIC  22:  1440x576i   50.000000 Hz  16:9     15.625 kHz     27.000000 MHz (native)
    VIC  31:  1920x1080   50.000000 Hz  16:9     56.250 kHz    148.500000 MHz
  Speaker Allocation Data Block:
  Vendor-Specific Data Block (HDMI), OUI 00-0C-03:
    Source physical address: 1.0.0.0
  Vendor-Specific Data Block (HDMI Forum), OUI C4-5D-D8:
    Version: 1
    Maximum TMDS Character Rate: 600 MHz
    SCDC Present
    Supports scrambling for <= 340 Mcsc
  Vendor-Specific Data Block (AMD), OUI 00-00-1A:
    Version: 1
    Feature Caps: 0x01
    Minimum Refresh Rate: 48 Hz
    Maximum Refresh Rate: 144 Hz
    Flags 1.x: 0x00
  Detailed Timing Descriptors:
    DTD 3:  3440x1440   59.998875 Hz  43:18    88.858 kHz    319.890000 MHz (797 mm x 333 mm)
                 Hfront   48 Hsync  32 Hback   80 Hpol P
                 Vfront    3 Vsync   5 Vback   33 Vpol N
    DTD 4:  3440x1440   99.998124 Hz  43:18   148.097 kHz    533.150000 MHz (797 mm x 333 mm)
                 Hfront   48 Hsync  32 Hback   80 Hpol P
                 Vfront    3 Vsync   5 Vback   33 Vpol N
    DTD 5:  2560x1440   59.950550 Hz  16:9     88.787 kHz    241.500000 MHz (analog composite, serrate, 797 mm x 333 mm)
                 Hfront   48 Hsync  32 Hback   80 Hpol N
                 Vfront    3 Vsync   5 Vback   33 Vpol N
    DTD 6:  1920x1080   50.000000 Hz  16:9     56.250 kHz    148.500000 MHz (analog composite, sync-on-green, 797 mm x 333 mm)
                 Hfront  528 Hsync  44 Hback  148 Hpol N
                 Vfront    3 Vsync   5 Vback   37 Vpol N
Checksum: 0x94  Unused space in Extension Block: 8 bytes

----------------

Warnings:

Block 0, Base EDID:
  Vendor & Product Identification: The serial number is one of the known dummy values, it should probably be set to 0.
Block 1, CTA-861 Extension Block:
  IT Video Formats are overscanned by default, but normally this should be underscanned.
  Video Data Block: VIC 1 and the first DTD are not identical. Is this intended?
  Video Data Block: All VICs are in ascending order, and the first (preferred) VIC <= 4, is that intended?
  Detailed Timing Descriptor #5: Image size is 797x333 mm, but based on the picture AR it should be 592x333 mm.
  Detailed Timing Descriptor #6: DTD is similar but not identical to VIC 31.
  Detailed Timing Descriptor #6: Image size is 797x333 mm, but based on the picture AR it should be 592x333 mm.
  Display Product Serial Number is set, so the Serial Number in the Base EDID should be 0.
  Add a Colorimetry Data Block with the sRGB colorimetry bit set to avoid interop issues.

Failures:

Block 0, Base EDID:
  Missing Display Range Limits Descriptor.
Block 1, CTA-861 Extension Block:
  Speaker Allocation Data Block: Audio information is present, but bit 6 of Byte 3 of the CTA-861 Extension header indicates no Basic Audio support.
  Missing VCDB, needed for Set Selectable RGB Quantization to avoid interop issues.
EDID:
  Extension Block 2 started with EDID header, ignoring Extension Blocks >= 2.
  CTA-861: Native progressive timings are a mix of several resolutions.
  CTA-861: Native interlaced timings are a mix of several resolutions.

EDID conformity: FAIL
