edid-decode (hex):

00 ff ff ff ff ff ff 00 36 69 62 14 00 00 00 00
2a 1c 01 03 80 46 27 78 2a 1a d5 ae 50 48 a6 25
12 50 54 bf cf 00 81 80 81 bc 95 00 b3 00 81 bc
95 3c b3 3c d1 c0 59 e7 00 6a a0 a0 67 50 15 20
35 00 ba 89 21 00 00 1e 00 00 00 fd 00 30 90 1e
de 08 00 0a 20 20 20 20 20 20 00 00 00 fc 00 4d
53 49 20 4d 41 47 33 32 31 43 51 52 00 00 00 ff
00 4b 41 33 48 30 31 38 34 32 30 31 32 37 01 82

02 03 35 71 51 01 02 03 11 12 13 0f 1d 1e 0e a8
3f 04 4b 4c 05 14 23 09 17 07 83 01 00 00 65 03
0c 00 10 00 67 d8 5d c4 01 78 88 00 68 1a 00 00
01 01 30 90 00 6f c2 00 a0 a0 a0 55 50 30 20 35
00 55 50 21 00 00 1a 56 5e 00 a0 a0 a0 29 50 30
20 35 00 b1 89 21 00 00 1a 51 6c 80 a0 70 38 1f
40 30 05 04 08 b5 88 21 00 00 73 44 5a 80 a0 70
38 1f 40 30 05 04 08 b5 88 21 00 00 73 00 00 ef

00 ff ff ff ff ff ff 00 36 69 62 14 00 00 00 00
2a 1c 01 03 80 46 27 78 2a 1a d5 ae 50 48 a6 25
12 50 54 bf cf 00 81 80 81 bc 95 00 b3 00 81 bc
95 3c b3 3c d1 c0 59 e7 00 6a a0 a0 67 50 15 20
35 00 ba 89 21 00 00 1e 00 00 00 fd 00 30 90 1e
de 08 00 0a 20 20 20 20 20 20 00 00 00 fc 00 4d
53 49 20 4d 41 47 33 32 31 43 51 52 00 00 00 ff
00 4b 41 33 48 30 31 38 34 32 30 31 32 37 01 82

02 03 35 71 51 01 02 03 11 12 13 0f 1d 1e 0e a8
3f 04 4b 4c 05 14 23 09 17 07 83 01 00 00 65 03
0c 00 10 00 67 d8 5d c4 01 78 88 00 68 1a 00 00
01 01 30 90 00 6f c2 00 a0 a0 a0 55 50 30 20 35
00 55 50 21 00 00 1a 56 5e 00 a0 a0 a0 29 50 30
20 35 00 b1 89 21 00 00 1a 51 6c 80 a0 70 38 1f
40 30 05 04 08 b5 88 21 00 00 73 44 5a 80 a0 70
38 1f 40 30 05 04 08 b5 88 21 00 00 73 00 00 ef

----------------

Block 0, Base EDID:
  EDID Structure Version & Revision: 1.3
  Vendor & Product Identification:
    Manufacturer: MSI
    Model: 5218
    Made in: week 42 of 2018
  Basic Display Parameters & Features:
    Digital display
    Maximum image size: 70 cm x 39 cm
    Gamma: 2.20
    DPMS levels: Off
    RGB color display
    First detailed timing is the preferred timing
  Color Characteristics:
    Red  : 0.6796, 0.3134
    Green: 0.2832, 0.6503
    Blue : 0.1474, 0.0712
    White: 0.3134, 0.3291
  Established Timings I & II:
    IBM     :   720x400    70.081663 Hz   9:5     31.467 kHz     28.320000 MHz
    DMT 0x04:   640x480    59.940476 Hz   4:3     31.469 kHz     25.175000 MHz
    Apple   :   640x480    66.666667 Hz   4:3     35.000 kHz     30.240000 MHz
    DMT 0x05:   640x480    72.808802 Hz   4:3     37.861 kHz     31.500000 MHz
    DMT 0x06:   640x480    75.000000 Hz   4:3     37.500 kHz     31.500000 MHz
    DMT 0x08:   800x600    56.250000 Hz   4:3     35.156 kHz     36.000000 MHz
    DMT 0x09:   800x600    60.316541 Hz   4:3     37.879 kHz     40.000000 MHz
    DMT 0x0a:   800x600    72.187572 Hz   4:3     48.077 kHz     50.000000 MHz
    DMT 0x0b:   800x600    75.000000 Hz   4:3     46.875 kHz     49.500000 MHz
    DMT 0x10:  1024x768    60.003840 Hz   4:3     48.363 kHz     65.000000 MHz
    DMT 0x11:  1024x768    70.069359 Hz   4:3     56.476 kHz     75.000000 MHz
    DMT 0x12:  1024x768    75.028582 Hz   4:3     60.023 kHz     78.750000 MHz
    DMT 0x24:  1280x1024   75.024675 Hz   5:4     79.976 kHz    135.000000 MHz
  Standard Timings:
    DMT 0x23:  1280x1024   60.019740 Hz   5:4     63.981 kHz    108.000000 MHz
    GTF     :  1280x1024  120.000185 Hz   5:4    131.640 kHz    233.793000 MHz
    DMT 0x2f:  1440x900    59.887445 Hz  16:10    55.935 kHz    106.500000 MHz
    DMT 0x3a:  1680x1050   59.954250 Hz  16:10    65.290 kHz    146.250000 MHz
    GTF     :  1280x1024  120.000185 Hz   5:4    131.640 kHz    233.793000 MHz
    GTF     :  1440x900   119.999896 Hz  16:10   115.800 kHz    229.747000 MHz
    GTF     :  1680x1050  120.000000 Hz  16:10   135.000 kHz    313.200000 MHz
    DMT 0x52:  1920x1080   60.000000 Hz  16:9     67.500 kHz    148.500000 MHz
  Detailed Timing Descriptors:
    DTD 1:  2560x1440  143.972318 Hz  16:9    222.149 kHz    592.250000 MHz (698 mm x 393 mm)
                 Hfront   21 Hsync  32 Hback   53 Hpol P
                 Vfront    3 Vsync   5 Vback   95 Vpol P
    Display Range Limits:
      Monitor ranges (GTF): 48-144 Hz V, 30-222 kHz H, max dotclock 80 MHz
    Display Product Name: 'MSI MAG321CQR'
    Display Product Serial Number: ...
  Extension blocks: 1
Checksum: 0x82

----------------

Block 1, CTA-861 Extension Block:
  Revision: 3
  Basic audio support
  Supports YCbCr 4:4:4
  Supports YCbCr 4:2:2
  Native DTDs: 1
  Video Data Block:
    VIC   1:   640x480    59.940476 Hz   4:3     31.469 kHz     25.175000 MHz
    VIC   2:   720x480    59.940060 Hz   4:3     31.469 kHz     27.000000 MHz
    VIC   3:   720x480    59.940060 Hz  16:9     31.469 kHz     27.000000 MHz
    VIC  17:   720x576    50.000000 Hz   4:3     31.250 kHz     27.000000 MHz
    VIC  18:   720x576    50.000000 Hz  16:9     31.250 kHz     27.000000 MHz
    VIC  19:  1280x720    50.000000 Hz  16:9     37.500 kHz     74.250000 MHz
    VIC  15:  1440x480    59.940060 Hz  16:9     31.469 kHz     54.000000 MHz
    VIC  29:  1440x576    50.000000 Hz   4:3     31.250 kHz     54.000000 MHz
    VIC  30:  1440x576    50.000000 Hz  16:9     31.250 kHz     54.000000 MHz
    VIC  14:  1440x480    59.940060 Hz   4:3     31.469 kHz     54.000000 MHz
    VIC  40:  1920x1080i 100.000000 Hz  16:9     56.250 kHz    148.500000 MHz (native)
    VIC  63:  1920x1080  120.000000 Hz  16:9    135.000 kHz    297.000000 MHz
    VIC   4:  1280x720    60.000000 Hz  16:9     45.000 kHz     74.250000 MHz
    VIC  75:  1920x1080   50.000000 Hz  64:27    56.250 kHz    148.500000 MHz
    VIC  76:  1920x1080   60.000000 Hz  64:27    67.500 kHz    148.500000 MHz
    VIC   5:  1920x1080i  60.000000 Hz  16:9     33.750 kHz     74.250000 MHz
    VIC  20:  1920x1080i  50.000000 Hz  16:9     28.125 kHz     74.250000 MHz
  Audio Data Block:
    Linear PCM:
      Max channels: 2
      Supported sample rates (kHz): 96 48 44.1 32
      Supported sample sizes (bits): 24 20 16
  Speaker Allocation Data Block:
    FL/FR - Front Left/Right
  Vendor-Specific Data Block (HDMI), OUI 00-0C-03:
    Source physical address: 1.0.0.0
  Vendor-Specific Data Block (HDMI Forum), OUI C4-5D-D8:
    Version: 1
    Maximum TMDS Character Rate: 600 MHz
    SCDC Present
    Supports scrambling for <= 340 Mcsc
  Vendor-Specific Data Block (AMD), OUI 00-00-1A:
    Version: 1
    Flags 1: 0x01
      FreeSync Supported
    Minimum Refresh Rate: 48 Hz
    Maximum Refresh Rate: 144 Hz
  Detailed Timing Descriptors:
    DTD 2:  2560x1440  119.997589 Hz  16:9    182.996 kHz    497.750000 MHz (597 mm x 336 mm)
                 Hfront   48 Hsync  32 Hback   80 Hpol P
                 Vfront    3 Vsync   5 Vback   77 Vpol N
    DTD 3:  2560x1440   59.950550 Hz  16:9     88.787 kHz    241.500000 MHz (689 mm x 393 mm)
                 Hfront   48 Hsync  32 Hback   80 Hpol P
                 Vfront    3 Vsync   5 Vback   33 Vpol N
    DTD 4:  1920x1080  119.993249 Hz  16:9    133.312 kHz    277.290000 MHz (digital composite, side by side interleaved, 693 mm x 392 mm)
                 Hfront   48 Hsync   5 Hback  107 Hpol P
                 Vfront   32 Vsync   4 Vback   -5
    DTD 5:  1920x1080   99.996538 Hz  16:9    111.096 kHz    231.080000 MHz (digital composite, side by side interleaved, 693 mm x 392 mm)
                 Hfront   48 Hsync   5 Hback  107 Hpol P
                 Vfront   32 Vsync   4 Vback   -5
Checksum: 0xef  Unused space in Extension Block: 2 bytes

----------------

Warnings:

Block 1, CTA-861 Extension Block:
  IT Video Formats are overscanned by default, but normally this should be underscanned.
  Video Data Block: VIC 1 and the first DTD are not identical. Is this intended?
  Add a Colorimetry Data Block with the sRGB colorimetry bit set to avoid interop issues.
EDID:
  Base EDID: Some timings are out of range of the Monitor Ranges:
    Horizontal Freq: 28.125 - 222.149 kHz (Monitor: 30.000 - 222.000 kHz)
    Maximum Clock: 592.250 MHz (Monitor: 80.000 MHz)

Failures:

Block 1, CTA-861 Extension Block:
  Detailed Timing Descriptor #2: Mismatch of image size 597x336 mm vs display size 700x390 mm.
  Detailed Timing Descriptor #4: 0 or negative vertical back porch.
  Detailed Timing Descriptor #5: 0 or negative vertical back porch.
  Missing VCDB, needed for Set Selectable RGB Quantization to avoid interop issues.
EDID:
  Extension Block 2 started with EDID header, ignoring Extension Blocks >= 2.

EDID conformity: FAIL
