edid-decode (hex):

00 ff ff ff ff ff ff 00 36 69 62 14 01 00 00 00
1a 1d 01 04 80 34 1e 78 3a 9d e5 a6 54 54 9f 26
0d 50 54 af cf 00 81 80 61 7c 81 bc 95 00 95 3c
b3 00 b3 3c d1 fc fb 7e 80 88 70 38 12 40 18 20
35 00 09 25 21 00 00 1e 02 3a 80 18 71 38 2d 40
58 2c 45 00 09 25 21 00 00 1e 00 00 00 fd 00 30
90 a2 a2 24 01 00 20 20 20 20 20 20 00 00 00 fc
00 4f 70 74 69 78 20 47 32 34 43 0a 20 20 00 b7

----------------

Block 0, Base EDID:
  EDID Structure Version & Revision: 1.4
  Vendor & Product Identification:
    Manufacturer: MSI
    Model: 5218
    Serial Number: ...
    Made in: week 26 of 2019
  Basic Display Parameters & Features:
    Digital display
    Color depth is undefined
    Digital interface is not defined
    Maximum image size: 52 cm x 30 cm
    Gamma: 2.20
    DPMS levels: Off
    Supported color formats: RGB 4:4:4, YCrCb 4:4:4, YCrCb 4:2:2
    First detailed timing includes the native pixel format and preferred refresh rate
  Color Characteristics:
    Red  : 0.6503, 0.3291
    Green: 0.3310, 0.6220
    Blue : 0.1513, 0.0527
    White: 0.3134, 0.3291
  Established Timings I & II:
    IBM     :   720x400    70.081663 Hz   9:5     31.467 kHz     28.320000 MHz
    DMT 0x04:   640x480    59.940476 Hz   4:3     31.469 kHz     25.175000 MHz
    DMT 0x05:   640x480    72.808802 Hz   4:3     37.861 kHz     31.500000 MHz
    DMT 0x06:   640x480    75.000000 Hz   4:3     37.500 kHz     31.500000 MHz
    DMT 0x08:   800x600    56.250000 Hz   4:3     35.156 kHz     36.000000 MHz
    DMT 0x09:   800x600    60.316541 Hz   4:3     37.879 kHz     40.000000 MHz
    DMT 0x0a:   800x600    72.187572 Hz   4:3     48.077 kHz     50.000000 MHz
    DMT 0x0b:   800x600    75.000000 Hz   4:3     46.875 kHz     49.500000 MHz
    DMT 0x10:  1024x768    60.003840 Hz   4:3     48.363 kHz     65.000000 MHz
    DMT 0x11:  1024x768    70.069359 Hz   4:3     56.476 kHz     75.000000 MHz
    DMT 0x12:  1024x768    75.028582 Hz   4:3     60.023 kHz     78.750000 MHz
    DMT 0x24:  1280x1024   75.024675 Hz   5:4     79.976 kHz    135.000000 MHz
  Standard Timings:
    DMT 0x23:  1280x1024   60.019740 Hz   5:4     63.981 kHz    108.000000 MHz
    GTF     :  1024x768   119.999931 Hz   4:3     98.760 kHz    139.054000 MHz
    GTF     :  1280x1024  120.000185 Hz   5:4    131.640 kHz    233.793000 MHz
    DMT 0x2f:  1440x900    59.887445 Hz  16:10    55.935 kHz    106.500000 MHz
    GTF     :  1440x900   119.999896 Hz  16:10   115.800 kHz    229.747000 MHz
    DMT 0x3a:  1680x1050   59.954250 Hz  16:10    65.290 kHz    146.250000 MHz
    GTF     :  1680x1050  120.000000 Hz  16:10   135.000 kHz    313.200000 MHz
    GTF     :  1920x1080  119.999987 Hz  16:9    138.840 kHz    368.759000 MHz
  Detailed Timing Descriptors:
    DTD 1:  1920x1080  143.996336 Hz  16:9    158.108 kHz    325.070000 MHz (521 mm x 293 mm)
                 Hfront   24 Hsync  32 Hback   80 Hpol P
                 Vfront    3 Vsync   5 Vback   10 Vpol P
    DTD 2:  1920x1080   60.000000 Hz  16:9     67.500 kHz    148.500000 MHz (521 mm x 293 mm)
                 Hfront   88 Hsync  44 Hback  148 Hpol P
                 Vfront    4 Vsync   5 Vback   36 Vpol P
    Display Range Limits:
      Monitor ranges (Range Limits Only): 48-144 Hz V, 162-162 kHz H, max dotclock 360 MHz
    Display Product Name: 'Optix G24C'
Checksum: 0xb7

----------------

Warnings:

Block 0, Base EDID:
  Vendor & Product Identification: The serial number is one of the known dummy values, it should probably be set to 0.
EDID:
  Base EDID: Some timings are out of range of the Monitor Ranges:
    Horizontal Freq: 31.466 - 158.107 kHz (Monitor: 162.000 - 162.000 kHz)
    Maximum Clock: 368.759 MHz (Monitor: 360.000 MHz)

Failures:

Block 0, Base EDID:
  Display Range Limits: Byte 11 is 0x00 instead of 0x0a.

EDID conformity: FAIL
