edid-decode (hex):

00 ff ff ff ff ff ff 00 58 b3 00 00 00 00 00 00
01 1b 01 04 a5 35 1e 00 02 c6 9c 96 4e 42 8d 22
10 41 44 3f ef 00 01 01 01 01 01 01 01 01 01 01
01 01 01 01 01 01 66 21 56 b0 51 00 1b 30 40 70
36 00 50 00 53 00 00 1e 30 2a 00 98 51 00 2a 40
30 70 13 00 00 00 54 00 00 1e 00 00 00 fd 00 31
3d 0f 2e 08 00 0a 20 20 20 20 20 20 00 00 00 fc
00 32 34 57 5f 4c 43 44 5f 54 56 0a 20 20 00 7c

00 ff ff ff ff ff ff 00 58 b3 00 00 00 00 00 00
01 1b 01 04 a5 35 1e 00 02 c6 9c 96 4e 42 8d 22
10 41 44 3f ef 00 01 01 01 01 01 01 01 01 01 01
01 01 01 01 01 01 66 21 56 b0 51 00 1b 30 40 70
36 00 50 00 53 00 00 1e 30 2a 00 98 51 00 2a 40
30 70 13 00 00 00 54 00 00 1e 00 00 00 fd 00 31
3d 0f 2e 08 00 0a 20 20 20 20 20 20 00 00 00 fc
00 32 34 57 5f 4c 43 44 5f 54 56 0a 20 20 00 7c

----------------

Block 0, Base EDID:
  EDID Structure Version & Revision: 1.4
  Vendor & Product Identification:
    Manufacturer: VES
    Model: 0
    Made in: week 1 of 2017
  Basic Display Parameters & Features:
    Digital display
    Bits per primary color channel: 8
    DisplayPort interface
    Maximum image size: 53 cm x 30 cm
    Gamma: 1.00
    Supported color formats: RGB 4:4:4
    First detailed timing includes the native pixel format and preferred refresh rate
  Color Characteristics:
    Red  : 0.5888, 0.3046
    Green: 0.2587, 0.5527
    Blue : 0.1347, 0.0634
    White: 0.2568, 0.2656
  Established Timings I & II:
    DMT 0x04:   640x480    59.940476 Hz   4:3     31.469 kHz     25.175000 MHz
    Apple   :   640x480    66.666667 Hz   4:3     35.000 kHz     30.240000 MHz
    DMT 0x05:   640x480    72.808802 Hz   4:3     37.861 kHz     31.500000 MHz
    DMT 0x06:   640x480    75.000000 Hz   4:3     37.500 kHz     31.500000 MHz
    DMT 0x08:   800x600    56.250000 Hz   4:3     35.156 kHz     36.000000 MHz
    DMT 0x09:   800x600    60.316541 Hz   4:3     37.879 kHz     40.000000 MHz
    DMT 0x0a:   800x600    72.187572 Hz   4:3     48.077 kHz     50.000000 MHz
    DMT 0x0b:   800x600    75.000000 Hz   4:3     46.875 kHz     49.500000 MHz
    Apple   :   832x624    74.551266 Hz   4:3     49.726 kHz     57.284000 MHz
    DMT 0x10:  1024x768    60.003840 Hz   4:3     48.363 kHz     65.000000 MHz
    DMT 0x11:  1024x768    70.069359 Hz   4:3     56.476 kHz     75.000000 MHz
    DMT 0x12:  1024x768    75.028582 Hz   4:3     60.023 kHz     78.750000 MHz
    DMT 0x24:  1280x1024   75.024675 Hz   5:4     79.976 kHz    135.000000 MHz
  Standard Timings: none
  Detailed Timing Descriptors:
    DTD 1:  1366x768    59.814889 Hz 683:384   47.553 kHz     85.500000 MHz (1360 mm x 768 mm)
                 Hfront   64 Hsync 112 Hback  256 Hpol P
                 Vfront    3 Vsync   6 Vback   18 Vpol P
    DTD 2:  1280x1024   60.019740 Hz   5:4     63.981 kHz    108.000000 MHz (1280 mm x 1024 mm)
                 Hfront   48 Hsync 112 Hback  248 Hpol P
                 Vfront    1 Vsync   3 Vback   38 Vpol P
    Display Range Limits:
      Monitor ranges (GTF): 49-61 Hz V, 15-46 kHz H, max dotclock 80 MHz
    Display Product Name: '24W_LCD_TV'
Checksum: 0x7c

----------------

Warnings:

Block 0, Base EDID:
  Display Range Limits: GTF support is deprecated in EDID 1.4.
EDID:
  Base EDID: Some timings are out of range of the Monitor Ranges:
    Vertical Freq: 56.250 - 75.029 Hz (Monitor: 49.000 - 61.000 Hz)
    Horizontal Freq: 31.468 - 79.976 kHz (Monitor: 15.000 - 46.000 kHz)
    Maximum Clock: 135.000 MHz (Monitor: 80.000 MHz)

Failures:

Block 0, Base EDID:
  Detailed Timing Descriptor #1: Mismatch of image size 1360x768 mm vs display size 530x300 mm.
  Detailed Timing Descriptor #2: Mismatch of image size 1280x1024 mm vs display size 530x300 mm.
  Display Range Limits: GTF is supported, but the display does not support continuous frequencies.
EDID:
  Extension Block 1 started with EDID header, ignoring Extension Blocks >= 1.
  Base EDID: The DTD max image size is 1360x1024mm, which is larger than the display size 530.0x300.0mm.

EDID conformity: FAIL
