edid-decode (hex):

00 ff ff ff ff ff ff 00 58 b3 00 00 00 00 00 00
01 17 01 04 a5 2f 1d 78 c2 ba 55 a5 54 49 9b 26
13 50 54 af cf 00 01 01 01 01 01 01 01 01 01 01
01 01 01 01 01 01 6c 3a 80 b0 72 38 43 40 10 58
45 80 80 38 74 00 00 18 30 2a 00 98 51 00 2a 40
30 70 13 00 00 00 54 00 00 1e 0e 1f 00 80 51 00
1e 30 40 80 37 00 00 00 53 00 00 1c 00 00 00 fc
00 33 32 57 20 4c 43 44 2d 54 56 0a 20 20 00 98

00 ff ff ff ff ff ff 00 58 b3 00 00 00 00 00 00
01 17 01 04 a5 2f 1d 78 c2 ba 55 a5 54 49 9b 26
13 50 54 af cf 00 01 01 01 01 01 01 01 01 01 01
01 01 01 01 01 01 6c 3a 80 b0 72 38 43 40 10 58
45 80 80 38 74 00 00 18 30 2a 00 98 51 00 2a 40
30 70 13 00 00 00 54 00 00 1e 0e 1f 00 80 51 00
1e 30 40 80 37 00 00 00 53 00 00 1c 00 00 00 fc
00 33 32 57 20 4c 43 44 2d 54 56 0a 20 20 00 98

----------------

Block 0, Base EDID:
  EDID Structure Version & Revision: 1.4
  Vendor & Product Identification:
    Manufacturer: VES
    Model: 0
    Made in: week 1 of 2013
  Basic Display Parameters & Features:
    Digital display
    Bits per primary color channel: 8
    DisplayPort interface
    Maximum image size: 47 cm x 29 cm
    Gamma: 2.20
    DPMS levels: Standby Suspend
    Supported color formats: RGB 4:4:4
    First detailed timing includes the native pixel format and preferred refresh rate
  Color Characteristics:
    Red  : 0.6464, 0.3310
    Green: 0.2871, 0.6074
    Blue : 0.1494, 0.0751
    White: 0.3134, 0.3291
  Established Timings I & II:
    IBM     :   720x400    70.081663 Hz   9:5     31.467 kHz     28.320000 MHz
    DMT 0x04:   640x480    59.940476 Hz   4:3     31.469 kHz     25.175000 MHz
    DMT 0x05:   640x480    72.808802 Hz   4:3     37.861 kHz     31.500000 MHz
    DMT 0x06:   640x480    75.000000 Hz   4:3     37.500 kHz     31.500000 MHz
    DMT 0x08:   800x600    56.250000 Hz   4:3     35.156 kHz     36.000000 MHz
    DMT 0x09:   800x600    60.316541 Hz   4:3     37.879 kHz     40.000000 MHz
    DMT 0x0a:   800x600    72.187572 Hz   4:3     48.077 kHz     50.000000 MHz
    DMT 0x0b:   800x600    75.000000 Hz   4:3     46.875 kHz     49.500000 MHz
    DMT 0x10:  1024x768    60.003840 Hz   4:3     48.363 kHz     65.000000 MHz
    DMT 0x11:  1024x768    70.069359 Hz   4:3     56.476 kHz     75.000000 MHz
    DMT 0x12:  1024x768    75.028582 Hz   4:3     60.023 kHz     78.750000 MHz
    DMT 0x24:  1280x1024   75.024675 Hz   5:4     79.976 kHz    135.000000 MHz
  Standard Timings: none
  Detailed Timing Descriptors:
    DTD 1:  1920x1080   49.997058 Hz  16:9     57.347 kHz    149.560000 MHz (1920 mm x 1080 mm)
                 Hfront  528 Hsync  88 Hback   72 Hpol N
                 Vfront    4 Vsync   5 Vback   58 Vpol N
    DTD 2:  1280x1024   60.019740 Hz   5:4     63.981 kHz    108.000000 MHz (1280 mm x 1024 mm)
                 Hfront   48 Hsync 112 Hback  248 Hpol P
                 Vfront    1 Vsync   3 Vback   38 Vpol P
    DTD 3:  1280x768    59.870228 Hz   5:3     47.776 kHz     79.500000 MHz (1280 mm x 768 mm)
                 Hfront   64 Hsync 128 Hback  192 Hpol N
                 Vfront    3 Vsync   7 Vback   20 Vpol P
    Display Product Name: '32W LCD-TV'
Checksum: 0x98

----------------

Failures:

Block 0, Base EDID:
  Detailed Timing Descriptor #1: Mismatch of image size 1920x1080 mm vs display size 470x290 mm.
  Detailed Timing Descriptor #2: Mismatch of image size 1280x1024 mm vs display size 470x290 mm.
  Detailed Timing Descriptor #3: Mismatch of image size 1280x768 mm vs display size 470x290 mm.
EDID:
  Extension Block 1 started with EDID header, ignoring Extension Blocks >= 1.
  Base EDID: The DTD max image size is 1920x1080mm, which is larger than the display size 470.0x290.0mm.

EDID conformity: FAIL
