edid-decode (hex):

00 ff ff ff ff ff ff 00 30 ae 01 00 88 88 88 00
6c 21 01 04 a5 0c 13 78 08 0d c9 a0 57 47 98 27
12 48 4c 00 00 00 01 01 01 01 01 01 01 01 01 01
01 01 01 01 01 01 75 83 40 70 61 00 22 a1 de 1e
e4 04 ba 88 21 00 00 1e 00 00 00 10 00 00 00 00
00 00 00 00 00 00 00 00 00 00 00 00 00 fd 00 32
96 14 3c 46 00 0a 20 20 20 20 20 20 00 00 00 fc
00 47 6f 20 44 69 73 70 6c 61 79 0a 20 20 01 d7

70 12 2b 00 00 03 01 28 62 13 01 84 3f 06 db 00
3b 80 1d 00 ff 09 81 00 1d 80 03 00 62 13 01 84
3f 06 db 00 3b 80 1d 00 ff 09 37 0f d6 8e 03 00
d5 00 00 00 00 00 00 00 00 00 00 00 00 00 00 00
00 00 00 00 00 00 00 00 00 00 00 00 00 00 00 00
00 00 00 00 00 00 00 00 00 00 00 00 00 00 00 00
00 00 00 00 00 00 00 00 00 00 00 00 00 00 00 00
00 00 00 00 00 00 00 00 00 00 00 00 00 00 00 90

00 ff ff ff ff ff ff 00 30 ae 01 00 88 88 88 00
6c 21 01 04 a5 0c 13 78 08 0d c9 a0 57 47 98 27
12 48 4c 00 00 00 01 01 01 01 01 01 01 01 01 01
01 01 01 01 01 01 75 83 40 70 61 00 22 a1 de 1e
e4 04 ba 88 21 00 00 1e 00 00 00 10 00 00 00 00
00 00 00 00 00 00 00 00 00 00 00 00 00 fd 00 32
96 14 3c 46 00 0a 20 20 20 20 20 20 00 00 00 fc
00 47 6f 20 44 69 73 70 6c 61 79 0a 20 20 01 d7

70 12 2b 00 00 03 01 28 62 13 01 84 3f 06 db 00
3b 80 1d 00 ff 09 81 00 1d 80 03 00 62 13 01 84
3f 06 db 00 3b 80 1d 00 ff 09 37 0f d6 8e 03 00
d5 00 00 00 00 00 00 00 00 00 00 00 00 00 00 00
00 00 00 00 00 00 00 00 00 00 00 00 00 00 00 00
00 00 00 00 00 00 00 00 00 00 00 00 00 00 00 00
00 00 00 00 00 00 00 00 00 00 00 00 00 00 00 00
00 00 00 00 00 00 00 00 00 00 00 00 00 00 00 90

----------------

Block 0, Base EDID:
  EDID Structure Version & Revision: 1.4
  Vendor & Product Identification:
    Manufacturer: LEN
    Model: 1
    Serial Number: ...
    Made in: week 108 of 2023
  Basic Display Parameters & Features:
    Digital display
    Bits per primary color channel: 8
    DisplayPort interface
    Maximum image size: 12 cm x 19 cm
    Gamma: 2.20
    Supported color formats: RGB 4:4:4, YCrCb 4:4:4
    First detailed timing does not include the native pixel format and preferred refresh rate
  Color Characteristics:
    Red  : 0.6250, 0.3398
    Green: 0.2802, 0.5947
    Blue : 0.1552, 0.0703
    White: 0.2832, 0.2978
  Established Timings I & II: none
  Standard Timings: none
  Detailed Timing Descriptors:
    DTD 1:  1600x2560   60.000357 Hz   5:8    171.001 kHz    336.530000 MHz (698 mm x 392 mm)
                 Hfront  222 Hsync  30 Hback  116 Hpol P
                 Vfront   30 Vsync   4 Vback  256 Vpol P
    Dummy Descriptor:
    Display Range Limits:
      Monitor ranges (GTF): 50-150 Hz V, 20-60 kHz H, max dotclock 700 MHz
    Display Product Name: 'Go Display'
  Extension blocks: 1
Checksum: 0xd7

----------------

Block 1, DisplayID Extension Block:
  Version: 1.2
  Extension Count: 0
  Display Product Type: Extension Section
  Video Timing Modes Type 1 - Detailed Timings Data Block:
    DTD:  1600x2560  143.998938 Hz  16:9    387.357 kHz    704.990000 MHz (aspect 16:9, no 3D stereo, preferred)
               Hfront   60 Hsync  30 Hback  130 Hpol P
               Vfront   30 Vsync   4 Vback   96 Vpol P
    DTD:  1600x2560   59.999557 Hz  16:9    387.357 kHz    704.990000 MHz (aspect 16:9, no 3D stereo, preferred)
               Hfront   60 Hsync  30 Hback  130 Hpol P
               Vfront 3799 Vsync   4 Vback   93 Vpol P
  Checksum: 0xd5
Checksum: 0x90  Unused space in Extension Block: 78 bytes

----------------

Warnings:

Block 0, Base EDID:
  Detailed Timing Descriptor #1: Image size is 698x392 mm, but based on the picture AR it should be 245x392 mm.
  Display Range Limits: GTF support is deprecated in EDID 1.4.
EDID:
  No Native Video Resolution was defined.
  Base EDID: Some timings are out of range of the Monitor Ranges:
    Horizontal Freq: 171.001 - 387.357 kHz (Monitor: 20.000 - 60.000 kHz)
    Maximum Clock: 704.990 MHz (Monitor: 700.000 MHz)

Failures:

Block 0, Base EDID:
  Vendor & Product Identification: Invalid week of manufacture (> 54).
  Detailed Timing Descriptor #1: Mismatch of image size 698x392 mm vs display size 120x190 mm.
  Display Range Limits: GTF is supported, but the display does not support continuous frequencies.
Block 1, DisplayID Extension Block:
  DisplayID Base Block has no product type.
EDID:
  Extension Block 2 started with EDID header, ignoring Extension Blocks >= 2.
  Base EDID: The DTD max image size is 698x392mm, which is larger than the display size 120.0x190.0mm.

EDID conformity: FAIL
