edid-decode (hex):

00 ff ff ff ff ff ff 00 0e 14 01 14 00 00 00 00
17 12 01 04 80 21 15 78 0a 74 3d 98 57 51 8f 28
21 50 54 00 00 00 01 01 01 01 01 01 01 01 01 01
01 01 01 01 01 01 12 1b 00 7b 50 20 17 30 20 20
13 00 4b cf 10 00 00 19 00 00 00 0f 00 20 20 20
20 20 20 20 20 20 6e 05 0f 00 00 00 00 fe 00 43
50 54 0a 20 20 20 20 20 20 20 20 20 00 00 00 fe
00 43 4c 41 41 31 35 34 57 42 30 33 41 20 00 31

00 ff ff ff ff ff ff 00 0e 14 01 14 00 00 00 00
17 12 01 04 80 21 15 78 0a 74 3d 98 57 51 8f 28
21 50 54 00 00 00 01 01 01 01 01 01 01 01 01 01
01 01 01 01 01 01 12 1b 00 7b 50 20 17 30 20 20
13 00 4b cf 10 00 00 19 00 00 00 0f 00 20 20 20
20 20 20 20 20 20 6e 05 0f 00 00 00 00 fe 00 43
50 54 0a 20 20 20 20 20 20 20 20 20 00 00 00 fe
00 43 4c 41 41 31 35 34 57 42 30 33 41 20 00 31

----------------

Block 0, Base EDID:
  EDID Structure Version & Revision: 1.4
  Vendor & Product Identification:
    Manufacturer: CPT
    Model: 5121
    Made in: week 23 of 2008
  Basic Display Parameters & Features:
    Digital display
    Color depth is undefined
    Digital interface is not defined
    Maximum image size: 33 cm x 21 cm
    Gamma: 2.20
    Supported color formats: RGB 4:4:4, YCrCb 4:4:4
    First detailed timing includes the native pixel format and preferred refresh rate
  Color Characteristics:
    Red  : 0.5947, 0.3427
    Green: 0.3173, 0.5585
    Blue : 0.1562, 0.1318
    White: 0.3154, 0.3291
  Established Timings I & II: none
  Standard Timings: none
  Detailed Timing Descriptors:
    DTD 1:  1280x800    60.017200 Hz  16:10    49.394 kHz     69.300000 MHz (331 mm x 207 mm)
                 Hfront   32 Hsync  32 Hback   59 Hpol N
                 Vfront    1 Vsync   3 Vback   19 Vpol N
    Manufacturer-Specified Display Descriptor (0x0f): 00 0f 00 20 20 20 20 20 20 20 20 20 6e 05 0f 00 '...         n...'
    Alphanumeric Data String: 'CPT'
    Alphanumeric Data String: 'CLAA154WB03A '
Checksum: 0x31

----------------

Warnings:

Block 0, Base EDID:
  Missing Display Product Name.

Failures:

Block 0, Base EDID:
  Alphanumeric Data String: No newline, but one or more trailing spaces.
EDID:
  Extension Block 1 started with EDID header, ignoring Extension Blocks >= 1.

EDID conformity: FAIL
