edid-decode (hex):

00 ff ff ff ff ff ff 00 1e 6d 20 37 01 01 01 01
01 1a 01 03 80 80 50 78 0a 31 14 ab 51 4d a3 24
05 48 4c a1 08 00 71 40 81 c0 81 80 95 00 90 40
a9 c0 b3 00 d1 c0 9e 20 00 90 51 20 1f 30 48 80
36 00 00 20 53 00 00 1e 21 39 90 30 62 1a 27 40
68 b0 36 00 00 20 53 00 00 1c 00 00 00 fd 00 3a
3e 1e 53 10 00 0a 20 20 20 20 20 20 00 00 00 fc
00 4c 47 20 50 52 4f 4a 45 43 54 4f 52 0a 01 ea

02 03 33 f1 4e 10 1f 04 93 05 14 03 02 12 20 21
22 15 01 26 15 07 50 09 57 07 78 03 0c 00 10 00
80 1e 20 c0 0e 01 40 0a 0f 08 10 18 10 98 10 58
10 38 10 01 1d 80 18 71 1c 16 20 58 2c 25 00 00
20 53 00 00 9e 01 1d 00 72 51 d0 1e 20 6e 28 55
00 00 20 53 00 00 1e 8c 0a d0 8a 20 e0 2d 10 10
3e 96 00 00 20 53 00 00 18 02 3a 80 18 71 38 2d
40 58 2c 45 00 00 20 53 00 00 1e 00 00 00 00 8e

00 ff ff ff ff ff ff 00 1e 6d 20 37 01 01 01 01
01 1a 01 03 80 80 50 78 0a 31 14 ab 51 4d a3 24
05 48 4c a1 08 00 71 40 81 c0 81 80 95 00 90 40
a9 c0 b3 00 d1 c0 9e 20 00 90 51 20 1f 30 48 80
36 00 00 20 53 00 00 1e 21 39 90 30 62 1a 27 40
68 b0 36 00 00 20 53 00 00 1c 00 00 00 fd 00 3a
3e 1e 53 10 00 0a 20 20 20 20 20 20 00 00 00 fc
00 4c 47 20 50 52 4f 4a 45 43 54 4f 52 0a 01 ea

02 03 33 f1 4e 10 1f 04 93 05 14 03 02 12 20 21
22 15 01 26 15 07 50 09 57 07 78 03 0c 00 10 00
80 1e 20 c0 0e 01 40 0a 0f 08 10 18 10 98 10 58
10 38 10 01 1d 80 18 71 1c 16 20 58 2c 25 00 00
20 53 00 00 9e 01 1d 00 72 51 d0 1e 20 6e 28 55
00 00 20 53 00 00 1e 8c 0a d0 8a 20 e0 2d 10 10
3e 96 00 00 20 53 00 00 18 02 3a 80 18 71 38 2d
40 58 2c 45 00 00 20 53 00 00 1e 00 00 00 00 8e

----------------

Block 0, Base EDID:
  EDID Structure Version & Revision: 1.3
  Vendor & Product Identification:
    Manufacturer: GSM
    Model: 14112
    Serial Number: ...
    Made in: week 1 of 2016
  Basic Display Parameters & Features:
    Digital display
    Maximum image size: 128 cm x 80 cm
    Gamma: 2.20
    RGB color display
    First detailed timing is the preferred timing
  Color Characteristics:
    Red  : 0.6679, 0.3193
    Green: 0.3007, 0.6376
    Blue : 0.1406, 0.0205
    White: 0.2822, 0.2968
  Established Timings I & II:
    IBM     :   720x400    70.081663 Hz   9:5     31.467 kHz     28.320000 MHz
    DMT 0x04:   640x480    59.940476 Hz   4:3     31.469 kHz     25.175000 MHz
    DMT 0x09:   800x600    60.316541 Hz   4:3     37.879 kHz     40.000000 MHz
    DMT 0x10:  1024x768    60.003840 Hz   4:3     48.363 kHz     65.000000 MHz
  Standard Timings:
    GTF     :  1152x864    60.000000 Hz   4:3     53.700 kHz     81.624000 MHz
    DMT 0x55:  1280x720    60.000000 Hz  16:9     45.000 kHz     74.250000 MHz
    DMT 0x23:  1280x1024   60.019740 Hz   5:4     63.981 kHz    108.000000 MHz
    DMT 0x2f:  1440x900    59.887445 Hz  16:10    55.935 kHz    106.500000 MHz
    DMT 0x2a:  1400x1050   59.978442 Hz   4:3     65.317 kHz    121.750000 MHz
    DMT 0x53:  1600x900    60.000000 Hz  16:9     60.000 kHz    108.000000 MHz (RB)
    DMT 0x3a:  1680x1050   59.954250 Hz  16:10    65.290 kHz    146.250000 MHz
    DMT 0x52:  1920x1080   60.000000 Hz  16:9     67.500 kHz    148.500000 MHz
  Detailed Timing Descriptors:
    DTD  1:  1280x800    59.810326 Hz  16:10    49.702 kHz     83.500000 MHz (1280 mm x 800 mm)
                  Hfront   72 Hsync 128 Hback  200 Hpol P
                  Vfront    3 Vsync   6 Vback   22 Vpol P
    DTD  2:  1680x1050   59.954250 Hz  16:10    65.290 kHz    146.250000 MHz (1280 mm x 800 mm)
                  Hfront  104 Hsync 176 Hback  280 Hpol N
                  Vfront    3 Vsync   6 Vback   30 Vpol P
    Display Range Limits:
      Monitor ranges (GTF): 58-62 Hz V, 30-83 kHz H, max dotclock 160 MHz
    Display Product Name: 'LG PROJECTOR'
  Extension blocks: 1
Checksum: 0xea

----------------

Block 1, CTA-861 Extension Block:
  Revision: 3
  Underscans IT Video Formats by default
  Basic audio support
  Supports YCbCr 4:4:4
  Supports YCbCr 4:2:2
  Native detailed modes: 1
  Video Data Block:
    VIC  16:  1920x1080   60.000000 Hz  16:9     67.500 kHz    148.500000 MHz
    VIC  31:  1920x1080   50.000000 Hz  16:9     56.250 kHz    148.500000 MHz
    VIC   4:  1280x720    60.000000 Hz  16:9     45.000 kHz     74.250000 MHz
    VIC  19:  1280x720    50.000000 Hz  16:9     37.500 kHz     74.250000 MHz (native)
    VIC   5:  1920x1080i  60.000000 Hz  16:9     33.750 kHz     74.250000 MHz
    VIC  20:  1920x1080i  50.000000 Hz  16:9     28.125 kHz     74.250000 MHz
    VIC   3:   720x480    59.940060 Hz  16:9     31.469 kHz     27.000000 MHz
    VIC   2:   720x480    59.940060 Hz   4:3     31.469 kHz     27.000000 MHz
    VIC  18:   720x576    50.000000 Hz  16:9     31.250 kHz     27.000000 MHz
    VIC  32:  1920x1080   24.000000 Hz  16:9     27.000 kHz     74.250000 MHz
    VIC  33:  1920x1080   25.000000 Hz  16:9     28.125 kHz     74.250000 MHz
    VIC  34:  1920x1080   30.000000 Hz  16:9     33.750 kHz     74.250000 MHz
    VIC  21:  1440x576i   50.000000 Hz   4:3     15.625 kHz     27.000000 MHz
    VIC   1:   640x480    59.940476 Hz   4:3     31.469 kHz     25.175000 MHz
  Audio Data Block:
    AC-3:
      Max channels: 6
      Supported sample rates (kHz): 48 44.1 32
      Maximum bit rate: 640 kb/s
    Linear PCM:
      Max channels: 2
      Supported sample rates (kHz): 192 96 48 44.1 32
      Supported sample sizes (bits): 24 20 16
  Vendor-Specific Data Block (HDMI), OUI 00-0C-03:
    Source physical address: 1.0.0.0
    Supports_AI
    Maximum TMDS clock: 150 MHz
    Extended HDMI video details:
      3D present
      3D-capable-VIC mask present
      3D: Side-by-side (half, horizontal)
      3D: Top-and-bottom
      3D VIC indices that support these capabilities:
        VIC  16:  1920x1080   60.000000 Hz  16:9     67.500 kHz    148.500000 MHz
        VIC  31:  1920x1080   50.000000 Hz  16:9     56.250 kHz    148.500000 MHz
        VIC   4:  1280x720    60.000000 Hz  16:9     45.000 kHz     74.250000 MHz
        VIC  19:  1280x720    50.000000 Hz  16:9     37.500 kHz     74.250000 MHz
        VIC  32:  1920x1080   24.000000 Hz  16:9     27.000 kHz     74.250000 MHz
        VIC  34:  1920x1080   30.000000 Hz  16:9     33.750 kHz     74.250000 MHz
      3D VIC indices with specific capabilities:
        VIC  16:  1920x1080   60.000000 Hz  16:9     67.500 kHz    148.500000 MHz (side-by-side, horizontal)
        VIC  31:  1920x1080   50.000000 Hz  16:9     56.250 kHz    148.500000 MHz (side-by-side, horizontal)
        VIC  32:  1920x1080   24.000000 Hz  16:9     27.000 kHz     74.250000 MHz (side-by-side, horizontal)
        VIC  20:  1920x1080i  50.000000 Hz  16:9     28.125 kHz     74.250000 MHz (side-by-side, horizontal)
        VIC  19:  1280x720    50.000000 Hz  16:9     37.500 kHz     74.250000 MHz (side-by-side, horizontal)
  Detailed Timing Descriptors:
    DTD  3:  1920x1080i  60.000000 Hz  16:9     33.750 kHz     74.250000 MHz (1280 mm x 800 mm)
                  Hfront   88 Hsync  44 Hback  148 Hpol P
                  Vfront    2 Vsync   5 Vback   15 Vpol P Vfront +0.5 Odd Field
                  Vfront    2 Vsync   5 Vback   15 Vpol P Vback  +0.5 Even Field
    DTD  4:  1280x720    60.000000 Hz  16:9     45.000 kHz     74.250000 MHz (1280 mm x 800 mm)
                  Hfront  110 Hsync  40 Hback  220 Hpol P
                  Vfront    5 Vsync   5 Vback   20 Vpol P
    DTD  5:   720x480    59.940060 Hz   3:2     31.469 kHz     27.000000 MHz (1280 mm x 800 mm)
                  Hfront   16 Hsync  62 Hback   60 Hpol N
                  Vfront    9 Vsync   6 Vback   30 Vpol N
    DTD  6:  1920x1080   60.000000 Hz  16:9     67.500 kHz    148.500000 MHz (1280 mm x 800 mm)
                  Hfront   88 Hsync  44 Hback  148 Hpol P
                  Vfront    4 Vsync   5 Vback   36 Vpol P
Checksum: 0x8e  Unused space in Extension Block: 4 bytes

----------------

Block 2, Unknown EDID Extension Block 0x00:
  00 ff ff ff ff ff ff 00 1e 6d 20 37 01 01 01 01 '.........m 7....'
  01 1a 01 03 80 80 50 78 0a 31 14 ab 51 4d a3 24 '......Px.1..QM.$'
  05 48 4c a1 08 00 71 40 81 c0 81 80 95 00 90 40 '.HL...q@.......@'
  a9 c0 b3 00 d1 c0 9e 20 00 90 51 20 1f 30 48 80 '....... ..Q .0H.'
  36 00 00 20 53 00 00 1e 21 39 90 30 62 1a 27 40 '6.. S...!9.0b.'@'
  68 b0 36 00 00 20 53 00 00 1c 00 00 00 fd 00 3a 'h.6.. S........:'
  3e 1e 53 10 00 0a 20 20 20 20 20 20 00 00 00 fc '>.S...      ....'
  00 4c 47 20 50 52 4f 4a 45 43 54 4f 52 0a 01 ea '.LG PROJECTOR...'
Checksum: 0xea

----------------

Block 3, CTA-861 Extension Block:
  Revision: 3
  Underscans IT Video Formats by default
  Basic audio support
  Supports YCbCr 4:4:4
  Supports YCbCr 4:2:2
  Native detailed modes: 1
  Video Data Block:
    VIC  16:  1920x1080   60.000000 Hz  16:9     67.500 kHz    148.500000 MHz
    VIC  31:  1920x1080   50.000000 Hz  16:9     56.250 kHz    148.500000 MHz
    VIC   4:  1280x720    60.000000 Hz  16:9     45.000 kHz     74.250000 MHz
    VIC  19:  1280x720    50.000000 Hz  16:9     37.500 kHz     74.250000 MHz (native)
    VIC   5:  1920x1080i  60.000000 Hz  16:9     33.750 kHz     74.250000 MHz
    VIC  20:  1920x1080i  50.000000 Hz  16:9     28.125 kHz     74.250000 MHz
    VIC   3:   720x480    59.940060 Hz  16:9     31.469 kHz     27.000000 MHz
    VIC   2:   720x480    59.940060 Hz   4:3     31.469 kHz     27.000000 MHz
    VIC  18:   720x576    50.000000 Hz  16:9     31.250 kHz     27.000000 MHz
    VIC  32:  1920x1080   24.000000 Hz  16:9     27.000 kHz     74.250000 MHz
    VIC  33:  1920x1080   25.000000 Hz  16:9     28.125 kHz     74.250000 MHz
    VIC  34:  1920x1080   30.000000 Hz  16:9     33.750 kHz     74.250000 MHz
    VIC  21:  1440x576i   50.000000 Hz   4:3     15.625 kHz     27.000000 MHz
    VIC   1:   640x480    59.940476 Hz   4:3     31.469 kHz     25.175000 MHz
  Audio Data Block:
    AC-3:
      Max channels: 6
      Supported sample rates (kHz): 48 44.1 32
      Maximum bit rate: 640 kb/s
    Linear PCM:
      Max channels: 2
      Supported sample rates (kHz): 192 96 48 44.1 32
      Supported sample sizes (bits): 24 20 16
  Vendor-Specific Data Block (HDMI), OUI 00-0C-03:
    Source physical address: 1.0.0.0
    Supports_AI
    Maximum TMDS clock: 150 MHz
    Extended HDMI video details:
      3D present
      3D-capable-VIC mask present
      3D: Side-by-side (half, horizontal)
      3D: Top-and-bottom
      3D VIC indices that support these capabilities:
        VIC  16:  1920x1080   60.000000 Hz  16:9     67.500 kHz    148.500000 MHz
        VIC  31:  1920x1080   50.000000 Hz  16:9     56.250 kHz    148.500000 MHz
        VIC   4:  1280x720    60.000000 Hz  16:9     45.000 kHz     74.250000 MHz
        VIC  19:  1280x720    50.000000 Hz  16:9     37.500 kHz     74.250000 MHz
        VIC  32:  1920x1080   24.000000 Hz  16:9     27.000 kHz     74.250000 MHz
        VIC  34:  1920x1080   30.000000 Hz  16:9     33.750 kHz     74.250000 MHz
      3D VIC indices with specific capabilities:
        VIC  16:  1920x1080   60.000000 Hz  16:9     67.500 kHz    148.500000 MHz (side-by-side, horizontal)
        VIC  31:  1920x1080   50.000000 Hz  16:9     56.250 kHz    148.500000 MHz (side-by-side, horizontal)
        VIC  32:  1920x1080   24.000000 Hz  16:9     27.000 kHz     74.250000 MHz (side-by-side, horizontal)
        VIC  20:  1920x1080i  50.000000 Hz  16:9     28.125 kHz     74.250000 MHz (side-by-side, horizontal)
        VIC  19:  1280x720    50.000000 Hz  16:9     37.500 kHz     74.250000 MHz (side-by-side, horizontal)
  Detailed Timing Descriptors:
    DTD  7:  1920x1080i  60.000000 Hz  16:9     33.750 kHz     74.250000 MHz (1280 mm x 800 mm)
                  Hfront   88 Hsync  44 Hback  148 Hpol P
                  Vfront    2 Vsync   5 Vback   15 Vpol P Vfront +0.5 Odd Field
                  Vfront    2 Vsync   5 Vback   15 Vpol P Vback  +0.5 Even Field
    DTD  8:  1280x720    60.000000 Hz  16:9     45.000 kHz     74.250000 MHz (1280 mm x 800 mm)
                  Hfront  110 Hsync  40 Hback  220 Hpol P
                  Vfront    5 Vsync   5 Vback   20 Vpol P
    DTD  9:   720x480    59.940060 Hz   3:2     31.469 kHz     27.000000 MHz (1280 mm x 800 mm)
                  Hfront   16 Hsync  62 Hback   60 Hpol N
                  Vfront    9 Vsync   6 Vback   30 Vpol N
    DTD 10:  1920x1080   60.000000 Hz  16:9     67.500 kHz    148.500000 MHz (1280 mm x 800 mm)
                  Hfront   88 Hsync  44 Hback  148 Hpol P
                  Vfront    4 Vsync   5 Vback   36 Vpol P
Checksum: 0x8e  Unused space in Extension Block: 4 bytes

----------------

Warnings:

Block 0, Base EDID:
  Vendor & Product Identification: The serial number is one of the known dummy values, it should probably be set to 0.
  Detailed Timing Descriptor #1: DTD is similar but not identical to DMT 0x1c.
Block 1, CTA-861 Extension Block:
  Video Data Block: VIC 16 and the first DTD are not identical. Is this intended?
  Detailed Timing Descriptor #3: Image size is 1280x800 mm, but based on the picture AR it should be 1280x720 mm.
  Detailed Timing Descriptor #4: Image size is 1280x800 mm, but based on the picture AR it should be 1280x720 mm.
  Detailed Timing Descriptor #5: Image size is 1280x800 mm, but based on the picture AR it should be 1280x853 mm.
  Detailed Timing Descriptor #6: Image size is 1280x800 mm, but based on the picture AR it should be 1280x720 mm.
  Add a Colorimetry Data Block with the sRGB colorimetry bit set to avoid interop issues.
Block 3, CTA-861 Extension Block:
  Detailed Timing Descriptor #7: Image size is 1280x800 mm, but based on the picture AR it should be 1280x720 mm.
  Detailed Timing Descriptor #8: Image size is 1280x800 mm, but based on the picture AR it should be 1280x720 mm.
  Detailed Timing Descriptor #9: Image size is 1280x800 mm, but based on the picture AR it should be 1280x853 mm.
  Detailed Timing Descriptor #10: Image size is 1280x800 mm, but based on the picture AR it should be 1280x720 mm.
EDID:
  Base EDID: Some timings are out of range of the Monitor Ranges:
    Vertical Freq: 24.000 - 70.082 Hz (Monitor: 58.000 - 62.000 Hz)
    Horizontal Freq: 15.625 - 67.500 kHz (Monitor: 30.000 - 83.000 kHz)

Failures:

Block 1, CTA-861 Extension Block:
  Missing VCDB, needed for Set Selectable RGB Quantization to avoid interop issues.
Block 2, Base EDID:
  Unknown Extension Block.
Block 3, CTA-861 Extension Block:
  Video Data Block: Duplicate VIC 16.
  Video Data Block: Duplicate VIC 31.
  Video Data Block: Duplicate VIC 4.
  Video Data Block: Duplicate VIC 19.
  Video Data Block: Duplicate VIC 5.
  Video Data Block: Duplicate VIC 20.
  Video Data Block: Duplicate VIC 3.
  Video Data Block: Duplicate VIC 2.
  Video Data Block: Duplicate VIC 18.
  Video Data Block: Duplicate VIC 32.
  Video Data Block: Duplicate VIC 33.
  Video Data Block: Duplicate VIC 34.
  Video Data Block: Duplicate VIC 21.
  Video Data Block: Duplicate VIC 1.
EDID:
  Base EDID: EDID specified 1 extension block(s), but found 3 extension block(s).
  Base EDID: EDID 1.3 requires a Block Map Extension in Block 1 if there are more than 2 blocks in the EDID.
  CTA-861: Native progressive timings are a mix of several resolutions.

EDID conformity: FAIL
