edid-decode (hex):

00 ff ff ff ff ff ff 00 06 af ab 10 00 00 00 00
01 11 01 03 80 2b 1b 78 0a 60 85 a6 56 4a 9c 25
12 50 54 00 00 00 01 01 01 01 01 01 01 01 01 01
01 01 01 01 01 01 5e 38 90 40 62 1a 10 40 40 c0
13 00 b1 0f 11 00 00 18 00 00 00 0f 00 00 00 00
00 00 00 00 00 00 00 00 00 20 00 00 00 fe 00 41
55 4f 0a 20 20 20 20 20 20 20 20 20 00 00 00 fe
00 42 32 30 31 53 57 30 31 20 56 30 20 0a 00 6e

00 ff ff ff ff ff ff 00 06 af ab 10 00 00 00 00
01 11 01 03 80 2b 1b 78 0a 60 85 a6 56 4a 9c 25
12 50 54 00 00 00 01 01 01 01 01 01 01 01 01 01
01 01 01 01 01 01 5e 38 90 40 62 1a 10 40 40 c0
13 00 b1 0f 11 00 00 18 00 00 00 0f 00 00 00 00
00 00 00 00 00 00 00 00 00 20 00 00 00 fe 00 41
55 4f 0a 20 20 20 20 20 20 20 20 20 00 00 00 fe
00 42 32 30 31 53 57 30 31 20 56 30 20 0a 00 6e

----------------

Block 0, Base EDID:
  EDID Structure Version & Revision: 1.3
  Vendor & Product Identification:
    Manufacturer: AUO
    Model: 4267
    Made in: week 1 of 2007
  Basic Display Parameters & Features:
    Digital display
    Maximum image size: 43 cm x 27 cm
    Gamma: 2.20
    RGB color display
    First detailed timing is the preferred timing
  Color Characteristics:
    Red  : 0.6494, 0.3378
    Green: 0.2890, 0.6093
    Blue : 0.1464, 0.0703
    White: 0.3134, 0.3291
  Established Timings I & II: none
  Standard Timings: none
  Detailed Timing Descriptors:
    DTD 1:  1680x1050   60.002595 Hz  16:10    63.963 kHz    144.300000 MHz (433 mm x 271 mm)
                 Hfront   64 Hsync 192 Hback  320 Hpol N
                 Vfront    1 Vsync   3 Vback   12 Vpol N
    Manufacturer-Specified Display Descriptor (0x0f): 00 0f 00 00 00 00 00 00 00 00 00 00 00 00 00 20 '............... '
    Alphanumeric Data String: 'AUO'
    Alphanumeric Data String: 'B201SW01 V0 '
Checksum: 0x6e

----------------

Block 1, Unknown EDID Extension Block 0x00:
  00 ff ff ff ff ff ff 00 06 af ab 10 00 00 00 00 '................'
  01 11 01 03 80 2b 1b 78 0a 60 85 a6 56 4a 9c 25 '.....+.x.`..VJ.%'
  12 50 54 00 00 00 01 01 01 01 01 01 01 01 01 01 '.PT.............'
  01 01 01 01 01 01 5e 38 90 40 62 1a 10 40 40 c0 '......^8.@b..@@.'
  13 00 b1 0f 11 00 00 18 00 00 00 0f 00 00 00 00 '................'
  00 00 00 00 00 00 00 00 00 20 00 00 00 fe 00 41 '......... .....A'
  55 4f 0a 20 20 20 20 20 20 20 20 20 00 00 00 fe 'UO.         ....'
  00 42 32 30 31 53 57 30 31 20 56 30 20 0a 00 6e '.B201SW01 V0 ..n'
Checksum: 0x6e

----------------

Failures:

Block 0, Base EDID:
  Alphanumeric Data String: One or more trailing spaces before newline.
  Missing Display Product Name.
  Missing Display Range Limits Descriptor.
Block 1, Base EDID:
  Unknown Extension Block.
EDID:
  Base EDID: EDID specified 0 extension block(s), but found 1 extension block(s).

EDID conformity: FAIL
