edid-decode (hex):

00 ff ff ff ff ff ff 00 09 e5 eb 08 00 00 00 00
27 1d 01 04 a5 22 13 78 02 27 c5 b1 51 44 ae 26
0f 50 54 00 00 00 01 01 01 01 01 01 01 01 01 01
01 01 01 01 01 01 be 3a 80 cc 70 38 64 40 30 20
36 00 58 c2 10 00 00 1a ff 2e 80 cc 70 38 64 40
30 20 36 00 58 c2 10 00 00 1a 00 00 00 fe 00 34
30 4a 38 47 80 4e 56 31 35 41 32 34 00 00 00 00
00 01 41 21 b2 00 10 00 00 0a 01 0a 20 20 00 00

----------------

Block 0, Base EDID:
  EDID Structure Version & Revision: 1.4
  Vendor & Product Identification:
    Manufacturer: BOE
    Model: 2283
    Made in: week 39 of 2019
  Basic Display Parameters & Features:
    Digital display
    Bits per primary color channel: 8
    DisplayPort interface
    Maximum image size: 34 cm x 19 cm
    Gamma: 2.20
    Supported color formats: RGB 4:4:4
    First detailed timing includes the native pixel format and preferred refresh rate
  Color Characteristics:
    Red  : 0.6914, 0.3183
    Green: 0.2666, 0.6826
    Blue : 0.1513, 0.0585
    White: 0.3134, 0.3291
  Established Timings I & II: none
  Standard Timings: none
  Detailed Timing Descriptors:
    DTD 1:  1920x1080   60.000319 Hz  16:9     70.800 kHz    150.380000 MHz (344 mm x 194 mm)
                 Hfront   48 Hsync  32 Hback  124 Hpol P
                 Vfront    3 Vsync   6 Vback   91 Vpol N
    DTD 2:  1920x1080   48.002649 Hz  16:9     56.643 kHz    120.310000 MHz (344 mm x 194 mm)
                 Hfront   48 Hsync  32 Hback  124 Hpol P
                 Vfront    3 Vsync   6 Vback   91 Vpol N
    Alphanumeric Data String: '40J8G.NV15A24'
    Manufacturer-Specified Display Descriptor (0x00): 00 00 00 01 41 21 b2 00 10 00 00 0a 01 0a 20 20 '....A!........  '
Checksum: 0x00

----------------

Warnings:

Block 0, Base EDID:
  Alphanumeric Data String: Non-ASCII character 0x80 at position 5, can cause problems.
  Missing Display Product Name.

EDID conformity: PASS
