edid-decode (hex):

00 ff ff ff ff ff ff 00 06 af a7 1a 00 00 00 00
1a 20 01 04 a5 22 16 78 03 f2 25 91 57 58 95 2a
1f 50 54 00 00 00 01 01 01 01 01 01 01 01 01 01
01 01 01 01 01 01 86 3d 80 c8 70 b0 26 40 6c 30
aa 00 58 d7 10 00 00 18 04 29 80 c8 70 b0 26 40
6c 30 aa 00 58 d7 10 00 00 18 00 00 00 00 00 00
00 00 00 00 00 00 00 00 00 00 00 00 00 00 00 02
00 10 48 ff 0f 3c 7d 61 12 25 7d 20 20 20 00 b4

00 ff ff ff ff ff ff 00 06 af a7 1a 00 00 00 00
1a 20 01 04 a5 22 16 78 03 f2 25 91 57 58 95 2a
1f 50 54 00 00 00 01 01 01 01 01 01 01 01 01 01
01 01 01 01 01 01 86 3d 80 c8 70 b0 26 40 6c 30
aa 00 58 d7 10 00 00 18 04 29 80 c8 70 b0 26 40
6c 30 aa 00 58 d7 10 00 00 18 00 00 00 00 00 00
00 00 00 00 00 00 00 00 00 00 00 00 00 00 00 02
00 10 48 ff 0f 3c 7d 61 12 25 7d 20 20 20 00 b4

----------------

Block 0, Base EDID:
  EDID Structure Version & Revision: 1.4
  Vendor & Product Identification:
    Manufacturer: AUO
    Model: 6823
    Made in: week 26 of 2022
  Basic Display Parameters & Features:
    Digital display
    Bits per primary color channel: 8
    DisplayPort interface
    Maximum image size: 34 cm x 22 cm
    Gamma: 2.20
    Supported color formats: RGB 4:4:4
    First detailed timing includes the native pixel format and preferred refresh rate
    Display supports continuous frequencies
  Color Characteristics:
    Red  : 0.5693, 0.3427
    Green: 0.3437, 0.5839
    Blue : 0.1640, 0.1230
    White: 0.3134, 0.3291
  Established Timings I & II: none
  Standard Timings: none
  Detailed Timing Descriptors:
    DTD 1:  1920x1200   60.010059 Hz  16:10    74.292 kHz    157.500000 MHz (344 mm x 215 mm)
                 Hfront  108 Hsync  48 Hback   44 Hpol N
                 Vfront   10 Vsync  10 Vback   18 Vpol N
    DTD 2:  1920x1200   40.006706 Hz  16:10    49.528 kHz    105.000000 MHz (344 mm x 215 mm)
                 Hfront  108 Hsync  48 Hback   44 Hpol N
                 Vfront   10 Vsync  10 Vback   18 Vpol N
    Empty Descriptor
    Manufacturer-Specified Display Descriptor (0x02): 00 02 00 10 48 ff 0f 3c 7d 61 12 25 7d 20 20 20 '....H..<}a.%}   '
Checksum: 0xb4

----------------

Warnings:

Block 0, Base EDID:
  Missing Display Product Name.

Failures:

Block 0, Base EDID:
  Empty Descriptor: Use Dummy Descriptor instead of all zeroes.
  Missing Display Range Limits Descriptor.
EDID:
  Extension Block 1 started with EDID header, ignoring Extension Blocks >= 1.

EDID conformity: FAIL
