edid-decode (hex):

00 ff ff ff ff ff ff 00 09 e5 80 0c 00 00 00 00
1f 21 01 04 a5 22 16 78 07 a2 a5 a5 54 4d 9b 25
0f 50 54 00 00 00 01 01 01 01 01 01 01 01 01 01
01 01 01 01 01 01 a7 6d 00 a0 a0 40 78 60 30 20
36 00 58 d7 10 00 00 1a 00 00 00 fd 0c 30 a5 1d
1d 4d 01 0a 20 20 20 20 20 20 00 00 00 fc 00 4e
45 31 36 30 51 44 4d 2d 4e 59 4a 0a 00 00 00 fe
00 42 4f 45 20 43 51 0a 20 20 20 20 20 20 01 dd

70 20 79 02 00 21 00 1d 7a 0d 66 08 00 0a 40 06
80 56 7a 54 d0 64 9b 56 92 0f 02 35 54 00 80 00
80 00 80 12 78 22 00 14 63 c7 0b 85 ff 09 9f 00
2f 00 1f 00 3f 06 77 00 02 00 05 00 2b 00 0c 27
00 3c a4 00 00 27 00 30 3b 00 00 81 00 13 72 1a
00 00 03 01 30 a5 00 00 00 00 00 00 a5 00 00 00
00 00 00 00 00 00 00 00 00 00 00 00 00 00 00 00
00 00 00 00 00 00 00 00 00 00 00 00 00 00 cd 90

00 ff ff ff ff ff ff 00 09 e5 80 0c 00 00 00 00
1f 21 01 04 a5 22 16 78 07 a2 a5 a5 54 4d 9b 25
0f 50 54 00 00 00 01 01 01 01 01 01 01 01 01 01
01 01 01 01 01 01 a7 6d 00 a0 a0 40 78 60 30 20
36 00 58 d7 10 00 00 1a 00 00 00 fd 0c 30 a5 1d
1d 4d 01 0a 20 20 20 20 20 20 00 00 00 fc 00 4e
45 31 36 30 51 44 4d 2d 4e 59 4a 0a 00 00 00 fe
00 42 4f 45 20 43 51 0a 20 20 20 20 20 20 01 dd

70 20 79 02 00 21 00 1d 7a 0d 66 08 00 0a 40 06
80 56 7a 54 d0 64 9b 56 92 0f 02 35 54 00 80 00
80 00 80 12 78 22 00 14 63 c7 0b 85 ff 09 9f 00
2f 00 1f 00 3f 06 77 00 02 00 05 00 2b 00 0c 27
00 3c a4 00 00 27 00 30 3b 00 00 81 00 13 72 1a
00 00 03 01 30 a5 00 00 00 00 00 00 a5 00 00 00
00 00 00 00 00 00 00 00 00 00 00 00 00 00 00 00
00 00 00 00 00 00 00 00 00 00 00 00 00 00 cd 90

----------------

Block 0, Base EDID:
  EDID Structure Version & Revision: 1.4
  Vendor & Product Identification:
    Manufacturer: BOE
    Model: 3200
    Made in: week 31 of 2023
  Basic Display Parameters & Features:
    Digital display
    Bits per primary color channel: 8
    DisplayPort interface
    Maximum image size: 34 cm x 22 cm
    Gamma: 2.20
    Supported color formats: RGB 4:4:4
    Default (sRGB) color space is primary color space
    First detailed timing includes the native pixel format and preferred refresh rate
    Display supports continuous frequencies
  Color Characteristics:
    Red  : 0.6464, 0.3300
    Green: 0.3007, 0.6074
    Blue : 0.1464, 0.0605
    White: 0.3134, 0.3291
  Established Timings I & II: none
  Standard Timings: none
  Detailed Timing Descriptors:
    DTD 1:  2560x1600   60.001282 Hz  16:10   103.202 kHz    280.710000 MHz (344 mm x 215 mm)
                 Hfront   48 Hsync  32 Hback   80 Hpol P
                 Vfront    3 Vsync   6 Vback  111 Vpol N
    Display Range Limits:
      Monitor ranges (Range Limits Only): 48-165 Hz V, 284-284 kHz H, max dotclock 770 MHz
    Display Product Name: 'NE160QDM-NYJ'
    Alphanumeric Data String: 'BOE CQ'
  Extension blocks: 1
Checksum: 0xdd

----------------

Block 1, DisplayID Extension Block:
  Version: 2.0
  Extension Count: 0
  Display Product Primary Use Case: None of the listed primary use cases; generic display
  Display Parameters Data Block (0x21):
    Image size: 345.0 mm x 215.0 mm
    Display native pixel format: 2560x1600
    Scan Orientation: Left to Right, Top to Bottom
    Luminance Information: Minimum guaranteed value
    Color Information: CIE 1931
    Audio Speaker Information: not integrated
    Native Color Chromaticity:
      Primary #1:  (0.645996, 0.329834)
      Primary #2:  (0.300781, 0.606934)
      Primary #3:  (0.145996, 0.060791)
      White Point: (0.312988, 0.328857)
    Native Maximum Luminance (Full Coverage): do not use
    Native Maximum Luminance (10% Rectangular Coverage): do not use
    Native Minimum Luminance: do not use
    Native Color Depth: 8 bpc
    Display Device Technology: Active Matrix LCD
    Native Gamma EOTF: 2.20
  Video Timing Modes Type 7 - Detailed Timings Data Block:
    DTD:  2560x1600  165.000855 Hz  16:10   283.801 kHz    771.940000 MHz (aspect 16:10, no 3D stereo, preferred)
               Hfront   48 Hsync  32 Hback   80 Hpol N
               Vfront    3 Vsync   6 Vback  111 Vpol N
  Adaptive Sync Data Block:
    Descriptor #1:
      Native Panel Range
      Fixed Average V-Total and Adaptive V-Total
      Supports Seamless Transition
      'Max Single Frame Duration Increase' field value without jitter impact
      'Max Single Frame Duration Decrease' field value without jitter impact
      Max Duration Increase: 0.00 ms
      Max Duration Decrease: 0.00 ms
      Min Refresh Rate: 60 Hz
      Max Refresh Rate: 165 Hz
    Descriptor #2:
      Native Panel Range
      Fixed Average V-Total and Adaptive V-Total
      Supports Seamless Transition
      'Max Single Frame Duration Increase' field value without jitter impact
      'Max Single Frame Duration Decrease' field value without jitter impact
      Max Duration Increase: 0.00 ms
      Max Duration Decrease: 0.00 ms
      Min Refresh Rate: 48 Hz
      Max Refresh Rate: 60 Hz
  CTA-861 DisplayID Data Block:
  Vendor-Specific Data Block (AMD), OUI 00-00-1A:
    Version: 3
    Feature Caps: 0x01
    Minimum Refresh Rate: 48 Hz
    Maximum Refresh Rate: 165 Hz
    Flags 1.x: 0x00
    Flags 2.x: 0x00
  Checksum: 0xcd
Checksum: 0x90

----------------

Warnings:

EDID:
  Base EDID: Some timings are out of range of the Monitor Ranges:
    Horizontal Freq: 103.202 - 283.801 kHz (Monitor: 284.000 - 284.000 kHz)
    Maximum Clock: 771.940 MHz (Monitor: 770.000 MHz)

Failures:

Block 0, Base EDID:
  Basic Display Parameters & Features: sRGB is signaled, but the chromaticities do not match.
EDID:
  Extension Block 2 started with EDID header, ignoring Extension Blocks >= 2.

EDID conformity: FAIL
