edid-decode (hex):

00 ff ff ff ff ff ff 00 30 e4 ea 03 00 00 00 00
00 17 01 04 95 1f 11 78 02 85 45 a4 5a 54 a1 27
0c 50 54 00 00 00 01 01 01 01 01 01 01 01 01 01
01 01 01 01 01 01 2e 36 80 a0 70 38 1f 40 30 24
35 00 35 ae 10 00 00 1a 2e 36 80 a0 70 38 1f 40
30 24 35 00 35 ae 10 00 00 1a 00 00 00 fe 00 30
4d 4a 32 50 80 31 34 30 57 46 31 0a 00 00 00 00
00 00 41 21 9e 01 00 00 00 0a 01 0a 20 20 00 3a

----------------

Block 0, Base EDID:
  EDID Structure Version & Revision: 1.4
  Vendor & Product Identification:
    Manufacturer: LGD
    Model: 1002
    Made in: 2013
  Basic Display Parameters & Features:
    Digital display
    Bits per primary color channel: 6
    DisplayPort interface
    Maximum image size: 31 cm x 17 cm
    Gamma: 2.20
    Supported color formats: RGB 4:4:4
    First detailed timing includes the native pixel format and preferred refresh rate
  Color Characteristics:
    Red  : 0.6425, 0.3515
    Green: 0.3291, 0.6298
    Blue : 0.1533, 0.0468
    White: 0.3134, 0.3291
  Established Timings I & II: none
  Standard Timings: none
  Detailed Timing Descriptors:
    DTD 1:  1920x1080   60.020425 Hz  16:9     66.683 kHz    138.700000 MHz (309 mm x 174 mm)
                 Hfront   48 Hsync  36 Hback   76 Hpol P
                 Vfront    3 Vsync   5 Vback   23 Vpol N
    DTD 2:  1920x1080   60.020425 Hz  16:9     66.683 kHz    138.700000 MHz (309 mm x 174 mm)
                 Hfront   48 Hsync  36 Hback   76 Hpol P
                 Vfront    3 Vsync   5 Vback   23 Vpol N
    Alphanumeric Data String: '0MJ2P.140WF1'
    Manufacturer-Specified Display Descriptor (0x00): 00 00 00 00 41 21 9e 01 00 00 00 0a 01 0a 20 20 '....A!........  '
Checksum: 0x3a

----------------

Warnings:

Block 0, Base EDID:
  Alphanumeric Data String: Non-ASCII character 0x80 at position 5, can cause problems.
  Missing Display Product Name.

EDID conformity: PASS
