edid-decode (hex):

00 ff ff ff ff ff ff 00 2a c3 4c 21 01 01 01 01
00 10 01 03 80 7c 46 78 2a 7c 11 9e 59 47 9b 27
10 50 54 00 00 00 01 01 01 01 01 01 01 01 01 01
01 01 01 01 01 01 01 1d 80 18 71 1c 16 20 58 2c
25 00 d8 b9 42 00 00 9e 8c 0a d0 8a 20 e0 2d 10
10 3e 96 00 a1 b9 32 00 00 18 00 00 00 fc 00 48
44 2d 35 36 47 37 38 37 0a 20 20 20 00 00 00 fd
00 3b 3d 0f 2e 08 00 0a 20 20 20 20 20 20 01 1b

02 03 1a 72 47 85 02 04 01 03 06 07 23 09 07 07
83 01 00 00 65 03 0c 00 10 00 01 1d 00 72 51 d0
1e 20 6e 28 55 00 d8 b9 42 00 00 1e d6 09 80 a0
20 e0 2d 10 10 60 a2 00 a1 b9 32 00 00 18 8c 0a
d0 8a 20 e0 2d 10 10 3e 96 00 d8 b9 42 00 00 18
8c 0a a0 14 51 f0 16 00 26 7c 43 00 a1 b9 32 00
00 98 8c 0a a0 14 51 f0 16 00 26 7c 43 00 d8 b9
42 00 00 98 00 00 00 00 00 00 00 00 00 00 00 f6

00 ff ff ff ff ff ff 00 2a c3 4c 21 01 01 01 01
00 10 01 03 80 7c 46 78 2a 7c 11 9e 59 47 9b 27
10 50 54 00 00 00 01 01 01 01 01 01 01 01 01 01
01 01 01 01 01 01 01 1d 80 18 71 1c 16 20 58 2c
25 00 d8 b9 42 00 00 9e 8c 0a d0 8a 20 e0 2d 10
10 3e 96 00 a1 b9 32 00 00 18 00 00 00 fc 00 48
44 2d 35 36 47 37 38 37 0a 20 20 20 00 00 00 fd
00 3b 3d 0f 2e 08 00 0a 20 20 20 20 20 20 01 1b

02 03 1a 72 47 85 02 04 01 03 06 07 23 09 07 07
83 01 00 00 65 03 0c 00 10 00 01 1d 00 72 51 d0
1e 20 6e 28 55 00 d8 b9 42 00 00 1e d6 09 80 a0
20 e0 2d 10 10 60 a2 00 a1 b9 32 00 00 18 8c 0a
d0 8a 20 e0 2d 10 10 3e 96 00 d8 b9 42 00 00 18
8c 0a a0 14 51 f0 16 00 26 7c 43 00 a1 b9 32 00
00 98 8c 0a a0 14 51 f0 16 00 26 7c 43 00 d8 b9
42 00 00 98 00 00 00 00 00 00 00 00 00 00 00 f6

----------------

Block 0, Base EDID:
  EDID Structure Version & Revision: 1.3
  Vendor & Product Identification:
    Manufacturer: JVC
    Model: 8524
    Serial Number: ...
    Made in: 2006
  Basic Display Parameters & Features:
    Digital display
    Maximum image size: 124 cm x 70 cm
    Gamma: 2.20
    DPMS levels: Off
    RGB color display
    First detailed timing is the preferred timing
  Color Characteristics:
    Red  : 0.6181, 0.3505
    Green: 0.2802, 0.6054
    Blue : 0.1523, 0.0634
    White: 0.3125, 0.3291
  Established Timings I & II: none
  Standard Timings: none
  Detailed Timing Descriptors:
    DTD 1:  1920x1080i  60.000000 Hz  16:9     33.750 kHz     74.250000 MHz (1240 mm x 697 mm)
                 Hfront   88 Hsync  44 Hback  148 Hpol P
                 Vfront    2 Vsync   5 Vback   15 Vpol P Vfront +0.5 Odd Field
                 Vfront    2 Vsync   5 Vback   15 Vpol P Vback  +0.5 Even Field
    DTD 2:   720x480    59.940060 Hz   3:2     31.469 kHz     27.000000 MHz (929 mm x 697 mm)
                 Hfront   16 Hsync  62 Hback   60 Hpol N
                 Vfront    9 Vsync   6 Vback   30 Vpol N
    Display Product Name: 'HD-56G787'
    Display Range Limits:
      Monitor ranges (GTF): 59-61 Hz V, 15-46 kHz H, max dotclock 80 MHz
  Extension blocks: 1
Checksum: 0x1b

----------------

Block 1, CTA-861 Extension Block:
  Revision: 3
  Basic audio support
  Supports YCbCr 4:4:4
  Supports YCbCr 4:2:2
  Native DTDs: 2
  Video Data Block:
    VIC   5:  1920x1080i  60.000000 Hz  16:9     33.750 kHz     74.250000 MHz (native)
    VIC   2:   720x480    59.940060 Hz   4:3     31.469 kHz     27.000000 MHz
    VIC   4:  1280x720    60.000000 Hz  16:9     45.000 kHz     74.250000 MHz
    VIC   1:   640x480    59.940476 Hz   4:3     31.469 kHz     25.175000 MHz
    VIC   3:   720x480    59.940060 Hz  16:9     31.469 kHz     27.000000 MHz
    VIC   6:  1440x480i   59.940060 Hz   4:3     15.734 kHz     27.000000 MHz
    VIC   7:  1440x480i   59.940060 Hz  16:9     15.734 kHz     27.000000 MHz
  Audio Data Block:
    Linear PCM:
      Max channels: 2
      Supported sample rates (kHz): 48 44.1 32
      Supported sample sizes (bits): 24 20 16
  Speaker Allocation Data Block:
    FL/FR - Front Left/Right
  Vendor-Specific Data Block (HDMI), OUI 00-0C-03:
    Source physical address: 1.0.0.0
  Detailed Timing Descriptors:
    DTD 3:  1280x720    60.000000 Hz  16:9     45.000 kHz     74.250000 MHz (1240 mm x 697 mm)
                 Hfront  110 Hsync  40 Hback  220 Hpol P
                 Vfront    5 Vsync   5 Vback   20 Vpol P
    DTD 4:   640x480    59.952381 Hz   4:3     31.475 kHz     25.180000 MHz (929 mm x 697 mm)
                 Hfront   16 Hsync  96 Hback   48 Hpol N
                 Vfront   10 Vsync   2 Vback   33 Vpol N
    DTD 5:   720x480    59.940060 Hz   3:2     31.469 kHz     27.000000 MHz (1240 mm x 697 mm)
                 Hfront   16 Hsync  62 Hback   60 Hpol N
                 Vfront    9 Vsync   6 Vback   30 Vpol N
    DTD 6:  1440x480i   59.940060 Hz   3:1     15.734 kHz     27.000000 MHz (929 mm x 697 mm)
                 Hfront   38 Hsync 124 Hback  114 Hpol N
                 Vfront    4 Vsync   3 Vback   15 Vpol N Vfront +0.5 Odd Field
                 Vfront    4 Vsync   3 Vback   15 Vpol N Vback  +0.5 Even Field
    DTD 7:  1440x480i   59.940060 Hz   3:1     15.734 kHz     27.000000 MHz (1240 mm x 697 mm)
                 Hfront   38 Hsync 124 Hback  114 Hpol N
                 Vfront    4 Vsync   3 Vback   15 Vpol N Vfront +0.5 Odd Field
                 Vfront    4 Vsync   3 Vback   15 Vpol N Vback  +0.5 Even Field
Checksum: 0xf6  Unused space in Extension Block: 11 bytes

----------------

Warnings:

Block 0, Base EDID:
  Vendor & Product Identification: The serial number is one of the known dummy values, it should probably be set to 0.
  Detailed Timing Descriptor #2: Image size is 929x697 mm, but based on the picture AR it should be 929x619 mm.
Block 1, CTA-861 Extension Block:
  IT Video Formats are overscanned by default, but normally this should be underscanned.
  Detailed Timing Descriptor #5: Image size is 1240x697 mm, but based on the picture AR it should be 1045x697 mm.
  Detailed Timing Descriptor #6: Image size is 929x697 mm, but based on the picture AR it should be 929x309 mm.
  Detailed Timing Descriptor #7: Image size is 1240x697 mm, but based on the picture AR it should be 1240x413 mm.
  Add a Colorimetry Data Block with the sRGB colorimetry bit set to avoid interop issues.

Failures:

Block 1, CTA-861 Extension Block:
  Missing VCDB, needed for Set Selectable RGB Quantization to avoid interop issues.
EDID:
  Extension Block 2 started with EDID header, ignoring Extension Blocks >= 2.

EDID conformity: FAIL
