edid-decode (hex):

00 ff ff ff ff ff ff 00 12 03 70 45 0f 08 00 00
06 09 01 01 0c 1c 15 a5 e8 06 62 a0 57 4d 99 24
10 48 4f ff fe 80 45 59 61 59 71 4f 31 59 81 40
01 01 01 01 01 01 30 2a 00 98 51 00 2a 40 30 70
13 00 0a c8 10 00 00 1e de 0d d0 d8 20 90 2e 10
24 48 13 00 0a c8 10 00 00 1c 4e 0c 80 c0 20 90
2d 10 20 40 13 00 0a c8 10 00 00 1c 4e 0c 80 c0
20 5e 5f 10 20 40 03 08 0a c8 10 00 00 1a 00 10

----------------

Block 0, Base EDID:
  EDID Structure Version & Revision: 1.1
  Vendor & Product Identification:
    Manufacturer: DPC
    Model: 17776
    Serial Number: ...
    Made in: week 6 of 1999
  Basic Display Parameters & Features:
    Analog display
    Signal Level Standard: 0.700 : 0.300 : 1.000 V p-p
    Blank level equals black level
    Sync: Separate Composite
    Maximum image size: 28 cm x 21 cm
    Gamma: 2.65
    DPMS levels: Standby Suspend Off
    RGB color display
  Color Characteristics:
    Red  : 0.6250, 0.3398
    Green: 0.3017, 0.5996
    Blue : 0.1416, 0.0644
    White: 0.2812, 0.3105
  Established Timings I & II:
    IBM     :   720x400    70.081663 Hz   9:5     31.467 kHz     28.320000 MHz
    IBM     :   720x400    87.849542 Hz   9:5     39.444 kHz     35.500000 MHz
    DMT 0x04:   640x480    59.940476 Hz   4:3     31.469 kHz     25.175000 MHz
    Apple   :   640x480    66.666667 Hz   4:3     35.000 kHz     30.240000 MHz
    DMT 0x05:   640x480    72.808802 Hz   4:3     37.861 kHz     31.500000 MHz
    DMT 0x06:   640x480    75.000000 Hz   4:3     37.500 kHz     31.500000 MHz
    DMT 0x08:   800x600    56.250000 Hz   4:3     35.156 kHz     36.000000 MHz
    DMT 0x09:   800x600    60.316541 Hz   4:3     37.879 kHz     40.000000 MHz
    DMT 0x0a:   800x600    72.187572 Hz   4:3     48.077 kHz     50.000000 MHz
    DMT 0x0b:   800x600    75.000000 Hz   4:3     46.875 kHz     49.500000 MHz
    Apple   :   832x624    74.551266 Hz   4:3     49.726 kHz     57.284000 MHz
    DMT 0x0f:  1024x768i   86.957532 Hz   4:3     35.522 kHz     44.900000 MHz
    DMT 0x10:  1024x768    60.003840 Hz   4:3     48.363 kHz     65.000000 MHz
    DMT 0x11:  1024x768    70.069359 Hz   4:3     56.476 kHz     75.000000 MHz
    DMT 0x12:  1024x768    75.028582 Hz   4:3     60.023 kHz     78.750000 MHz
    Apple   :  1152x870    75.061550 Hz 192:145   68.681 kHz    100.000000 MHz
  Standard Timings:
    DMT 0x0c:   800x600    85.061274 Hz   4:3     53.674 kHz     56.250000 MHz
    DMT 0x13:  1024x768    84.996690 Hz   4:3     68.677 kHz     94.500000 MHz
    DMT 0x15:  1152x864    75.000000 Hz   4:3     67.500 kHz    108.000000 MHz
    DMT 0x07:   640x480    85.008312 Hz   4:3     43.269 kHz     36.000000 MHz
    DMT 0x20:  1280x960    60.000000 Hz   4:3     60.000 kHz    108.000000 MHz
  Detailed Timing Descriptors:
    DTD 1:  1280x1024   60.019740 Hz   5:4     63.981 kHz    108.000000 MHz (266 mm x 200 mm)
                 Hfront   48 Hsync 112 Hback  248 Hpol P
                 Vfront    1 Vsync   3 Vback   38 Vpol P
    DTD 2:   720x400    85.038902 Hz   9:5     37.927 kHz     35.500000 MHz (266 mm x 200 mm)
                 Hfront   36 Hsync  72 Hback  108 Hpol N
                 Vfront    1 Vsync   3 Vback   42 Vpol P
    DTD 3:   640x400    85.079948 Hz  16:10    37.861 kHz     31.500000 MHz (266 mm x 200 mm)
                 Hfront   32 Hsync  64 Hback   96 Hpol N
                 Vfront    1 Vsync   3 Vback   41 Vpol P
    DTD 4:   640x350    85.079948 Hz  64:35    37.861 kHz     31.500000 MHz (266 mm x 200 mm)
                 Hfront   32 Hsync  64 Hback   96 Hpol P
                 Vfront   32 Vsync   3 Vback   60 Vpol N
Checksum: 0x10

----------------

Warnings:

Block 0, Base EDID:
  EDID Structure Version & Revision: EDID 1.1 is deprecated, do not use.
  Detailed Timing Descriptor #1: Image size is 266x200 mm, but based on the picture AR it should be 266x212 mm.
  Detailed Timing Descriptor #2: Image size is 266x200 mm, but based on the picture AR it should be 266x147 mm.
  Detailed Timing Descriptor #3: Image size is 266x200 mm, but based on the picture AR it should be 266x166 mm.
  Detailed Timing Descriptor #4: Image size is 266x200 mm, but based on the picture AR it should be 266x145 mm.

Failures:

Block 0, Base EDID:
  Detailed Timing Descriptor #1: Mismatch of image size 266x200 mm vs display size 280x210 mm.
  Detailed Timing Descriptor #2: Mismatch of image size 266x200 mm vs display size 280x210 mm.
  Detailed Timing Descriptor #3: Mismatch of image size 266x200 mm vs display size 280x210 mm.
  Detailed Timing Descriptor #4: Mismatch of image size 266x200 mm vs display size 280x210 mm.

EDID conformity: FAIL
