edid-decode (hex):

00 ff ff ff ff ff ff 00 09 e5 a0 07 00 00 00 00
03 1c 01 04 a5 1d 11 78 02 18 20 a6 58 53 9e 26
0f 50 54 00 00 00 01 01 01 01 01 01 01 01 01 01
01 01 01 01 01 01 b2 39 80 f0 70 38 3c 40 30 20
36 00 26 a5 10 00 00 1a 2c 2e 80 f0 70 38 3c 40
30 20 36 00 26 a5 10 00 00 1a 00 00 00 fe 00 52
46 38 59 44 80 4e 56 31 33 46 48 4d 00 00 00 00
00 01 41 21 9e 00 10 00 00 0a 01 0a 20 20 00 59

----------------

Block 0, Base EDID:
  EDID Structure Version & Revision: 1.4
  Vendor & Product Identification:
    Manufacturer: BOE
    Model: 1952
    Made in: week 3 of 2018
  Basic Display Parameters & Features:
    Digital display
    Bits per primary color channel: 8
    DisplayPort interface
    Maximum image size: 29 cm x 17 cm
    Gamma: 2.20
    Supported color formats: RGB 4:4:4
    First detailed timing includes the native pixel format and preferred refresh rate
  Color Characteristics:
    Red  : 0.6484, 0.3447
    Green: 0.3261, 0.6171
    Blue : 0.1484, 0.0605
    White: 0.3125, 0.3281
  Established Timings I & II: none
  Standard Timings: none
  Detailed Timing Descriptors:
    DTD 1:  1920x1080   59.982131 Hz  16:9     68.380 kHz    147.700000 MHz (294 mm x 165 mm)
                 Hfront   48 Hsync  32 Hback  160 Hpol P
                 Vfront    3 Vsync   6 Vback   51 Vpol N
    DTD 2:  1920x1080   48.001949 Hz  16:9     54.722 kHz    118.200000 MHz (294 mm x 165 mm)
                 Hfront   48 Hsync  32 Hback  160 Hpol P
                 Vfront    3 Vsync   6 Vback   51 Vpol N
    Alphanumeric Data String: 'RF8YD.NV13FHM'
    Manufacturer-Specified Display Descriptor (0x00): 00 00 00 01 41 21 9e 00 10 00 00 0a 01 0a 20 20 '....A!........  '
Checksum: 0x59

----------------

Warnings:

Block 0, Base EDID:
  Alphanumeric Data String: Non-ASCII character 0x80 at position 5, can cause problems.
  Missing Display Product Name.

EDID conformity: PASS
