edid-decode (hex):

00 ff ff ff ff ff ff 00 30 e4 5b 07 00 00 00 00
00 20 01 04 a5 22 16 78 01 07 d5 ae 52 44 af 24
0f 50 54 00 00 00 01 01 01 01 01 01 01 01 01 01
01 01 01 01 01 01 00 00 00 00 00 00 00 00 00 00
00 00 00 00 00 00 00 00 00 00 00 fd 00 1f 90 f7
f7 44 01 0a 20 20 20 20 20 20 00 00 00 fe 00 4c
47 20 44 49 53 50 4c 41 59 0a 20 20 00 00 00 fe
00 4c 50 31 36 30 57 51 32 2d 53 50 42 31 02 55

02 03 0f 00 e3 05 80 00 e6 06 01 01 60 60 42 00
00 00 00 00 00 00 00 00 00 00 00 00 00 00 00 00
00 00 00 00 00 00 00 00 00 00 00 00 00 00 00 00
00 00 00 00 00 00 00 00 00 00 00 00 00 00 00 00
00 00 00 00 00 00 00 00 00 00 00 00 00 00 00 00
00 00 00 00 00 00 00 00 00 00 00 00 00 00 00 00
00 00 00 00 00 00 00 00 00 00 00 00 00 00 00 00
00 00 00 00 00 00 00 00 00 00 00 00 00 00 00 94

70 20 79 02 00 22 00 28 6b 3e 0a 85 ff 09 9f 00
2f 80 1f 00 3f 06 71 00 02 00 05 00 6b 3e 0a 05
ff 09 9f 00 2f 80 1f 00 3f 06 d0 09 02 00 05 00
25 01 09 00 00 00 00 00 00 1f 90 80 26 00 09 02
00 00 00 00 00 10 00 00 00 00 00 00 00 00 00 00
00 00 00 00 00 00 00 00 00 00 00 00 00 00 00 00
00 00 00 00 00 00 00 00 00 00 00 00 00 00 00 00
00 00 00 00 00 00 00 00 00 00 00 00 00 00 c0 90

00 ff ff ff ff ff ff 00 30 e4 5b 07 00 00 00 00
00 20 01 04 a5 22 16 78 01 07 d5 ae 52 44 af 24
0f 50 54 00 00 00 01 01 01 01 01 01 01 01 01 01
01 01 01 01 01 01 00 00 00 00 00 00 00 00 00 00
00 00 00 00 00 00 00 00 00 00 00 fd 00 1f 90 f7
f7 44 01 0a 20 20 20 20 20 20 00 00 00 fe 00 4c
47 20 44 49 53 50 4c 41 59 0a 20 20 00 00 00 fe
00 4c 50 31 36 30 57 51 32 2d 53 50 42 31 02 55

02 03 0f 00 e3 05 80 00 e6 06 01 01 60 60 42 00
00 00 00 00 00 00 00 00 00 00 00 00 00 00 00 00
00 00 00 00 00 00 00 00 00 00 00 00 00 00 00 00
00 00 00 00 00 00 00 00 00 00 00 00 00 00 00 00
00 00 00 00 00 00 00 00 00 00 00 00 00 00 00 00
00 00 00 00 00 00 00 00 00 00 00 00 00 00 00 00
00 00 00 00 00 00 00 00 00 00 00 00 00 00 00 00
00 00 00 00 00 00 00 00 00 00 00 00 00 00 00 94

70 20 79 02 00 22 00 28 6b 3e 0a 85 ff 09 9f 00
2f 80 1f 00 3f 06 71 00 02 00 05 00 6b 3e 0a 05
ff 09 9f 00 2f 80 1f 00 3f 06 d0 09 02 00 05 00
25 01 09 00 00 00 00 00 00 1f 90 80 26 00 09 02
00 00 00 00 00 10 00 00 00 00 00 00 00 00 00 00
00 00 00 00 00 00 00 00 00 00 00 00 00 00 00 00
00 00 00 00 00 00 00 00 00 00 00 00 00 00 00 00
00 00 00 00 00 00 00 00 00 00 00 00 00 00 c0 90

----------------

Block 0, Base EDID:
  EDID Structure Version & Revision: 1.4
  Vendor & Product Identification:
    Manufacturer: LGD
    Model: 1883
    Made in: 2022
  Basic Display Parameters & Features:
    Digital display
    Bits per primary color channel: 8
    DisplayPort interface
    Maximum image size: 34 cm x 22 cm
    Gamma: 2.20
    Supported color formats: RGB 4:4:4
    First detailed timing does not include the native pixel format and preferred refresh rate
    Display supports continuous frequencies
  Color Characteristics:
    Red  : 0.6796, 0.3203
    Green: 0.2666, 0.6865
    Blue : 0.1435, 0.0595
    White: 0.3134, 0.3291
  Established Timings I & II: none
  Standard Timings: none
  Detailed Timing Descriptors:
    Empty Descriptor
    Display Range Limits:
      Monitor ranges (Range Limits Only): 31-144 Hz V, 247-247 kHz H, max dotclock 680 MHz
    Alphanumeric Data String: 'LG DISPLAY'
    Alphanumeric Data String: 'LP160WQ2-SPB1'
  Extension blocks: 2
Checksum: 0x55

----------------

Block 1, CTA-861 Extension Block:
  Revision: 3
  Native detailed modes: 0
  Colorimetry Data Block:
    BT2020RGB
  HDR Static Metadata Data Block:
    Electro optical transfer functions:
      Traditional gamma - SDR luminance range
    Supported static metadata descriptors:
      Static metadata type 1
    Desired content max luminance: 96 (400.000 cd/m^2)
    Desired content max frame-average luminance: 96 (400.000 cd/m^2)
    Desired content min luminance: 66 (0.268 cd/m^2)
Checksum: 0x94  Unused space in Extension Block: 112 bytes

----------------

Block 2, DisplayID Extension Block:
  Version: 2.0
  Extension Count: 0
  Display Product Primary Use Case: None of the listed primary use cases; generic display
  Video Timing Modes Type 7 - Detailed Timings Data Block:
    DTD:  2560x1600  144.000103 Hz  16:10   246.816 kHz    671.340000 MHz (aspect 16:10, no 3D stereo, preferred)
               Hfront   48 Hsync  32 Hback   80 Hpol P
               Vfront    3 Vsync   6 Vback  105 Vpol N
    DTD:  2560x1600   60.008796 Hz  16:10   246.816 kHz    671.340000 MHz (aspect 16:10, no 3D stereo)
               Hfront   48 Hsync  32 Hback   80 Hpol P
               Vfront    3 Vsync   6 Vback 2504 Vpol N
  Dynamic Video Timing Range Limits Data Block:
    Minimum Pixel Clock: 1 kHz
    Maximum Pixel Clock: 1 kHz
    Minimum Vertical Refresh Rate: 31 Hz
    Maximum Vertical Refresh Rate: 144 Hz
    Seamless Dynamic Video Timing Support: Yes
  Display Interface Features Data Block:
    Supported bpc for RGB encoding: 8
    Supported color space and EOTF standard combination 1: DCI-P3
  Checksum: 0xc0
Checksum: 0x90

----------------

Block 3, Unknown EDID Extension Block 0x00:
  00 ff ff ff ff ff ff 00 30 e4 5b 07 00 00 00 00 '........0.[.....'
  00 20 01 04 a5 22 16 78 01 07 d5 ae 52 44 af 24 '. ...".x....RD.$'
  0f 50 54 00 00 00 01 01 01 01 01 01 01 01 01 01 '.PT.............'
  01 01 01 01 01 01 00 00 00 00 00 00 00 00 00 00 '................'
  00 00 00 00 00 00 00 00 00 00 00 fd 00 1f 90 f7 '................'
  f7 44 01 0a 20 20 20 20 20 20 00 00 00 fe 00 4c '.D..      .....L'
  47 20 44 49 53 50 4c 41 59 0a 20 20 00 00 00 fe 'G DISPLAY.  ....'
  00 4c 50 31 36 30 57 51 32 2d 53 50 42 31 02 55 '.LP160WQ2-SPB1.U'
Checksum: 0x55

----------------

Block 4, CTA-861 Extension Block:
  Revision: 3
  Native detailed modes: 0
  Colorimetry Data Block:
    BT2020RGB
  HDR Static Metadata Data Block:
    Electro optical transfer functions:
      Traditional gamma - SDR luminance range
    Supported static metadata descriptors:
      Static metadata type 1
    Desired content max luminance: 96 (400.000 cd/m^2)
    Desired content max frame-average luminance: 96 (400.000 cd/m^2)
    Desired content min luminance: 66 (0.268 cd/m^2)
Checksum: 0x94  Unused space in Extension Block: 112 bytes

----------------

Block 5, DisplayID Extension Block:
  Version: 2.0
  Extension Count: 0
  Video Timing Modes Type 7 - Detailed Timings Data Block:
    DTD:  2560x1600  144.000103 Hz  16:10   246.816 kHz    671.340000 MHz (aspect 16:10, no 3D stereo, preferred)
               Hfront   48 Hsync  32 Hback   80 Hpol P
               Vfront    3 Vsync   6 Vback  105 Vpol N
    DTD:  2560x1600   60.008796 Hz  16:10   246.816 kHz    671.340000 MHz (aspect 16:10, no 3D stereo)
               Hfront   48 Hsync  32 Hback   80 Hpol P
               Vfront    3 Vsync   6 Vback 2504 Vpol N
  Dynamic Video Timing Range Limits Data Block:
    Minimum Pixel Clock: 1 kHz
    Maximum Pixel Clock: 1 kHz
    Minimum Vertical Refresh Rate: 31 Hz
    Maximum Vertical Refresh Rate: 144 Hz
    Seamless Dynamic Video Timing Support: Yes
  Display Interface Features Data Block:
    Supported bpc for RGB encoding: 8
    Supported color space and EOTF standard combination 1: DCI-P3
  Checksum: 0xc0
Checksum: 0x90

----------------

Warnings:

Block 0, Base EDID:
  Missing Display Product Name.
Block 1, CTA-861 Extension Block:
  IT Video Formats are overscanned by default, but normally this should be underscanned.
  Colorimetry Data Block: Set the sRGB colorimetry bit to avoid interop issues.
Block 4, CTA-861 Extension Block:
  IT Video Formats are overscanned by default, but normally this should be underscanned.
  Colorimetry Data Block: Set the sRGB colorimetry bit to avoid interop issues.
EDID:
  No Native Video Resolution was defined.
    Hint: set 'Native detailed modes' to a non-0 value, or add a Native Video Resolution Data Block.

Failures:

Block 0, Base EDID:
  Standard Timings: Missing preferred timing.
  Empty Descriptor: Use Dummy Descriptor instead of all zeroes.
Block 1, CTA-861 Extension Block:
  Required 640x480p60 timings are missing in the established timings and the SVD list (VIC 1).
  Missing VCDB, needed for Set Selectable RGB Quantization to avoid interop issues.
Block 2, DisplayID Extension Block:
  Expected 0 DisplayID Extension Block, but got 1.
Block 3, Base EDID:
  Unknown Extension Block.
Block 4, CTA-861 Extension Block:
  Colorimetry Data Block: Only one instance of this Data Block is allowed.
  HDR Static Metadata Data Block: Only one instance of this Data Block is allowed.
Block 5, DisplayID Extension Block:
  Product Type should be 0 in extension block.
EDID:
  Base EDID: EDID specified 2 extension block(s), but found 5 extension block(s).
  DisplayID: Missing DisplayID Display Parameters Data Block.

EDID conformity: FAIL
