edid-decode (hex):

00 ff ff ff ff ff ff 00 06 af 3d 20 00 00 00 00
00 19 01 04 95 1f 11 78 02 c3 25 92 57 5a 94 2a
22 50 54 00 00 00 01 01 01 01 01 01 01 01 01 01
01 01 01 01 01 01 84 3a 80 34 71 38 28 40 30 64
31 00 35 ad 10 00 00 18 00 00 00 0f 00 00 00 00
00 00 00 00 00 00 00 00 00 20 00 00 00 fe 00 41
55 4f 0a 20 20 20 20 20 20 20 20 20 00 00 00 fe
00 42 31 34 30 48 41 4e 30 32 2e 30 20 0a 00 b4

----------------

Block 0, Base EDID:
  EDID Structure Version & Revision: 1.4
  Vendor & Product Identification:
    Manufacturer: AUO
    Model: 8253
    Made in: 2015
  Basic Display Parameters & Features:
    Digital display
    Bits per primary color channel: 6
    DisplayPort interface
    Maximum image size: 31 cm x 17 cm
    Gamma: 2.20
    Supported color formats: RGB 4:4:4
    First detailed timing includes the native pixel format and preferred refresh rate
  Color Characteristics:
    Red  : 0.5732, 0.3398
    Green: 0.3515, 0.5810
    Blue : 0.1640, 0.1347
    White: 0.3134, 0.3291
  Established Timings I & II: none
  Standard Timings: none
  Detailed Timing Descriptors:
    DTD 1:  1920x1080   60.031418 Hz  16:9     67.235 kHz    149.800000 MHz (309 mm x 173 mm)
                 Hfront   48 Hsync 100 Hback  160 Hpol N
                 Vfront    3 Vsync   1 Vback   36 Vpol N
    Manufacturer-Specified Display Descriptor (0x0f): 00 0f 00 00 00 00 00 00 00 00 00 00 00 00 00 20 '............... '
    Alphanumeric Data String: 'AUO'
    Alphanumeric Data String: 'B140HAN02.0 '
Checksum: 0xb4

----------------

Warnings:

Block 0, Base EDID:
  Missing Display Product Name.

Failures:

Block 0, Base EDID:
  Alphanumeric Data String: One or more trailing spaces before newline.

EDID conformity: FAIL
