edid-decode (hex):

00 ff ff ff ff ff ff 00 36 83 27 95 01 00 00 00
2e 18 01 03 68 73 41 78 0a cf 74 a3 57 4c b0 23
09 48 4c a1 08 00 81 80 61 40 45 40 31 40 01 01
01 01 01 01 01 01 66 21 56 aa 51 00 1e 30 46 8f
33 00 7e 8a 42 00 00 1e 0e 1f 00 80 51 00 1e 30
40 80 37 00 7e 8a 42 00 00 1c 00 00 00 fd 00 3a
3e 1e 53 10 00 0a 20 20 20 20 20 20 00 00 00 fc
00 4d 79 73 74 65 72 79 20 54 56 0a 20 20 00 5a

00 ff ff ff ff ff ff 00 36 83 27 95 01 00 00 00
2e 18 01 03 68 73 41 78 0a cf 74 a3 57 4c b0 23
09 48 4c a1 08 00 81 80 61 40 45 40 31 40 01 01
01 01 01 01 01 01 66 21 56 aa 51 00 1e 30 46 8f
33 00 7e 8a 42 00 00 1e 0e 1f 00 80 51 00 1e 30
40 80 37 00 7e 8a 42 00 00 1c 00 00 00 fd 00 3a
3e 1e 53 10 00 0a 20 20 20 20 20 20 00 00 00 fc
00 4d 79 73 74 65 72 79 20 54 56 0a 20 20 00 5a

----------------

Block 0, Base EDID:
  EDID Structure Version & Revision: 1.3
  Vendor & Product Identification:
    Manufacturer: MTC
    Model: 38183
    Serial Number: ...
    Made in: week 46 of 2014
  Basic Display Parameters & Features:
    Analog display
    Signal Level Standard: 0.700 : 0.000 : 0.700 V p-p
    Blank level equals black level
    Sync: Separate
    Maximum image size: 115 cm x 65 cm
    Gamma: 2.20
    RGB color display
    First detailed timing is the preferred timing
  Color Characteristics:
    Red  : 0.6396, 0.3398
    Green: 0.2998, 0.6904
    Blue : 0.1376, 0.0380
    White: 0.2822, 0.2968
  Established Timings I & II:
    IBM     :   720x400    70.081663 Hz   9:5     31.467 kHz     28.320000 MHz
    DMT 0x04:   640x480    59.940476 Hz   4:3     31.469 kHz     25.175000 MHz
    DMT 0x09:   800x600    60.316541 Hz   4:3     37.879 kHz     40.000000 MHz
    DMT 0x10:  1024x768    60.003840 Hz   4:3     48.363 kHz     65.000000 MHz
  Standard Timings:
    DMT 0x23:  1280x1024   60.019740 Hz   5:4     63.981 kHz    108.000000 MHz
    DMT 0x10:  1024x768    60.003840 Hz   4:3     48.363 kHz     65.000000 MHz
    DMT 0x09:   800x600    60.316541 Hz   4:3     37.879 kHz     40.000000 MHz
    DMT 0x04:   640x480    59.940476 Hz   4:3     31.469 kHz     25.175000 MHz
  Detailed Timing Descriptors:
    DTD 1:  1366x768    59.789541 Hz 683:384   47.712 kHz     85.500000 MHz (1150 mm x 650 mm)
                 Hfront   70 Hsync 143 Hback  213 Hpol P
                 Vfront    3 Vsync   3 Vback   24 Vpol P
    DTD 2:  1280x768    59.870228 Hz   5:3     47.776 kHz     79.500000 MHz (1150 mm x 650 mm)
                 Hfront   64 Hsync 128 Hback  192 Hpol N
                 Vfront    3 Vsync   7 Vback   20 Vpol P
    Display Range Limits:
      Monitor ranges (GTF): 58-62 Hz V, 30-83 kHz H, max dotclock 160 MHz
    Display Product Name: 'Mystery TV'
Checksum: 0x5a

----------------

Block 1, Unknown EDID Extension Block 0x00:
  00 ff ff ff ff ff ff 00 36 83 27 95 01 00 00 00 '........6.'.....'
  2e 18 01 03 68 73 41 78 0a cf 74 a3 57 4c b0 23 '....hsAx..t.WL.#'
  09 48 4c a1 08 00 81 80 61 40 45 40 31 40 01 01 '.HL.....a@E@1@..'
  01 01 01 01 01 01 66 21 56 aa 51 00 1e 30 46 8f '......f!V.Q..0F.'
  33 00 7e 8a 42 00 00 1e 0e 1f 00 80 51 00 1e 30 '3.~.B.......Q..0'
  40 80 37 00 7e 8a 42 00 00 1c 00 00 00 fd 00 3a '@.7.~.B........:'
  3e 1e 53 10 00 0a 20 20 20 20 20 20 00 00 00 fc '>.S...      ....'
  00 4d 79 73 74 65 72 79 20 54 56 0a 20 20 00 5a '.Mystery TV.  .Z'
Checksum: 0x5a

----------------

Warnings:

Block 0, Base EDID:
  Vendor & Product Identification: The serial number is one of the known dummy values, it should probably be set to 0.
  Detailed Timing Descriptor #2: Image size is 1150x650 mm, but based on the picture AR it should be 1150x690 mm.
EDID:
  Base EDID: Some timings are out of range of the Monitor Ranges:
    Vertical Freq: 59.790 - 70.082 Hz (Monitor: 58.000 - 62.000 Hz)

Failures:

Block 1, Base EDID:
  Unknown Extension Block.
EDID:
  Base EDID: EDID specified 0 extension block(s), but found 1 extension block(s).

EDID conformity: FAIL
