edid-decode (hex):

00 ff ff ff ff ff ff 00 30 e4 7f 01 00 00 00 00
00 12 01 03 80 13 0b 78 0a d9 95 94 58 57 91 29
20 50 54 00 00 00 01 01 01 01 01 01 01 01 01 01
01 01 01 01 01 01 1a 13 00 18 41 58 19 20 18 88
03 01 c3 71 10 00 00 18 00 00 00 00 00 00 00 00
00 00 00 00 00 00 00 00 00 00 00 00 00 fe 00 4c
47 20 44 69 73 70 6c 61 79 0a 20 20 00 00 00 fe
00 4c 50 30 38 39 57 53 31 2d 54 4c 41 31 00 c0

----------------

Block 0, Base EDID:
  EDID Structure Version & Revision: 1.3
  Vendor & Product Identification:
    Manufacturer: LGD
    Model: 383
    Made in: 2008
  Basic Display Parameters & Features:
    Digital display
    Maximum image size: 19 cm x 11 cm
    Gamma: 2.20
    RGB color display
    First detailed timing is the preferred timing
  Color Characteristics:
    Red  : 0.5810, 0.3447
    Green: 0.3417, 0.5673
    Blue : 0.1621, 0.1259
    White: 0.3134, 0.3291
  Established Timings I & II: none
  Standard Timings: none
  Detailed Timing Descriptors:
    DTD 1:  1024x600    60.000000 Hz 128:75    37.500 kHz     48.900000 MHz (451 mm x 113 mm)
                 Hfront   24 Hsync 136 Hback  120 Hpol N
                 Vfront    0 Vsync  19 Vback    6 Vpol N
                   1a 13 00 18 41 58 19 20 18 88 03 01 c3 71 10 00 00 18 '....AX. .....q....'
    Empty Descriptor
    Alphanumeric Data String: 'LG Display'
    Alphanumeric Data String: 'LP089WS1-TLA1'
Checksum: 0xc0

----------------

Warnings:

Block 0, Base EDID:
  Detailed Timing Descriptor #1: Image size is 451x113 mm, but based on the picture AR it should be 192x113 mm.

Failures:

Block 0, Base EDID:
  Detailed Timing Descriptor #1: 0 values in the video timing:
    Horizontal Active/Blanking 1024/280
    Horizontal Frontporch/Sync Width 24/136
    Vertical Active/Blanking 600/25
    Vertical Frontporch/Sync Width 0/19
  Detailed Timing Descriptor #1: Mismatch of image size 451x113 mm vs display size 190x110 mm.
  Empty Descriptor: Use Dummy Descriptor instead of all zeroes.
  Missing Display Product Name.
  Missing Display Range Limits Descriptor.
EDID:
  Base EDID: The DTD max image size is 451x113mm, which is larger than the display size 190.0x110.0mm.

EDID conformity: FAIL
