edid-decode (hex):

00 ff ff ff ff ff ff 00 30 ae 50 05 01 00 00 00
20 1d 01 04 a5 3c 21 78 1a 4c 55 a9 55 4d 9d 26
0f 50 54 00 00 00 01 01 01 01 01 01 01 01 01 01
01 01 01 01 01 01 56 5e 00 a0 a0 a0 29 50 30 20
35 00 54 4f 21 00 00 1e 00 00 00 fd 00 3b 3d 1e
5d 1a 00 0a 20 20 20 20 20 20 00 00 00 ff 00 4c
4d 32 37 30 57 51 34 0a 20 20 20 20 00 00 00 fc
00 4c 45 4e 2d 41 35 35 30 2d 41 0a 20 20 00 10

00 ff ff ff ff ff ff 00 30 ae 50 05 01 00 00 00
20 1d 01 04 a5 3c 21 78 1a 4c 55 a9 55 4d 9d 26
0f 50 54 00 00 00 01 01 01 01 01 01 01 01 01 01
01 01 01 01 01 01 56 5e 00 a0 a0 a0 29 50 30 20
35 00 54 4f 21 00 00 1e 00 00 00 fd 00 3b 3d 1e
5d 1a 00 0a 20 20 20 20 20 20 00 00 00 ff 00 4c
4d 32 37 30 57 51 34 0a 20 20 20 20 00 00 00 fc
00 4c 45 4e 2d 41 35 35 30 2d 41 0a 20 20 00 10

----------------

Block 0, Base EDID:
  EDID Structure Version & Revision: 1.4
  Vendor & Product Identification:
    Manufacturer: LEN
    Model: 1360
    Serial Number: ...
    Made in: week 32 of 2019
  Basic Display Parameters & Features:
    Digital display
    Bits per primary color channel: 8
    DisplayPort interface
    Maximum image size: 60 cm x 33 cm
    Gamma: 2.20
    Supported color formats: RGB 4:4:4, YCrCb 4:4:4, YCrCb 4:2:2
    First detailed timing includes the native pixel format and preferred refresh rate
  Color Characteristics:
    Red  : 0.6611, 0.3320
    Green: 0.3037, 0.6132
    Blue : 0.1494, 0.0595
    White: 0.3134, 0.3291
  Established Timings I & II: none
  Standard Timings: none
  Detailed Timing Descriptors:
    DTD 1:  2560x1440   59.950550 Hz  16:9     88.787 kHz    241.500000 MHz (596 mm x 335 mm)
                 Hfront   48 Hsync  32 Hback   80 Hpol P
                 Vfront    3 Vsync   5 Vback   33 Vpol P
    Display Range Limits:
      Monitor ranges (GTF): 59-61 Hz V, 30-93 kHz H, max dotclock 260 MHz
    Display Product Serial Number: ...
    Display Product Name: 'LEN-A550-A'
Checksum: 0x10

----------------

Block 1, Unknown EDID Extension Block 0x00:
  00 ff ff ff ff ff ff 00 30 ae 50 05 01 00 00 00 '........0.P.....'
  20 1d 01 04 a5 3c 21 78 1a 4c 55 a9 55 4d 9d 26 ' ....<!x.LU.UM.&'
  0f 50 54 00 00 00 01 01 01 01 01 01 01 01 01 01 '.PT.............'
  01 01 01 01 01 01 56 5e 00 a0 a0 a0 29 50 30 20 '......V^....)P0 '
  35 00 54 4f 21 00 00 1e 00 00 00 fd 00 3b 3d 1e '5.TO!........;=.'
  5d 1a 00 0a 20 20 20 20 20 20 00 00 00 ff 00 4c ']...      .....L'
  4d 32 37 30 57 51 34 0a 20 20 20 20 00 00 00 fc 'M270WQ4.    ....'
  00 4c 45 4e 2d 41 35 35 30 2d 41 0a 20 20 00 10 '.LEN-A550-A.  ..'
Checksum: 0x10

----------------

Warnings:

Block 0, Base EDID:
  Vendor & Product Identification: The serial number is one of the known dummy values, it should probably be set to 0.
  Display Range Limits: GTF support is deprecated in EDID 1.4.

Failures:

Block 0, Base EDID:
  Display Range Limits: GTF is supported, but the display does not support continuous frequencies.
Block 1, Base EDID:
  Unknown Extension Block.
EDID:
  Base EDID: EDID specified 0 extension block(s), but found 1 extension block(s).

EDID conformity: FAIL
