edid-decode (hex):

00 ff ff ff ff ff ff 00 30 ae 50 05 01 00 00 00
20 1d 01 04 a5 35 1d 78 22 05 65 a7 56 52 9c 27
0f 50 54 00 00 00 01 01 01 01 01 01 01 01 01 01
01 01 01 01 01 01 40 38 80 00 71 38 14 40 30 20
84 00 0f 28 21 00 00 1e 00 00 00 fd 00 33 4c 36
5a 12 00 0a 20 20 20 20 20 20 00 00 00 ff 00 4c
4d 32 33 38 57 46 35 2d 53 53 45 31 00 00 00 fc
00 4c 45 4e 2d 41 35 35 30 2d 42 0a 20 20 00 ad

00 ff ff ff ff ff ff 00 30 ae 50 05 01 00 00 00
20 1d 01 04 a5 35 1d 78 22 05 65 a7 56 52 9c 27
0f 50 54 00 00 00 01 01 01 01 01 01 01 01 01 01
01 01 01 01 01 01 40 38 80 00 71 38 14 40 30 20
84 00 0f 28 21 00 00 1e 00 00 00 fd 00 33 4c 36
5a 12 00 0a 20 20 20 20 20 20 00 00 00 ff 00 4c
4d 32 33 38 57 46 35 2d 53 53 45 31 00 00 00 fc
00 4c 45 4e 2d 41 35 35 30 2d 42 0a 20 20 00 ad

----------------

Block 0, Base EDID:
  EDID Structure Version & Revision: 1.4
  Vendor & Product Identification:
    Manufacturer: LEN
    Model: 1360
    Serial Number: ...
    Made in: week 32 of 2019
  Basic Display Parameters & Features:
    Digital display
    Bits per primary color channel: 8
    DisplayPort interface
    Maximum image size: 53 cm x 29 cm
    Gamma: 2.20
    DPMS levels: Off
    Supported color formats: RGB 4:4:4
    First detailed timing includes the native pixel format and preferred refresh rate
  Color Characteristics:
    Red  : 0.6523, 0.3359
    Green: 0.3212, 0.6103
    Blue : 0.1533, 0.0605
    White: 0.3134, 0.3291
  Established Timings I & II: none
  Standard Timings: none
  Detailed Timing Descriptors:
    DTD 1:  1920x1080   60.160428 Hz  16:9     66.176 kHz    144.000000 MHz (527 mm x 296 mm)
                 Hfront   48 Hsync  32 Hback  176 Hpol P
                 Vfront    8 Vsync   4 Vback    8 Vpol P
    Display Range Limits:
      Monitor ranges (GTF): 51-76 Hz V, 54-90 kHz H, max dotclock 180 MHz
    Display Product Serial Number: ...
    Display Product Name: 'LEN-A550-B'
Checksum: 0xad

----------------

Block 1, Unknown EDID Extension Block 0x00:
  00 ff ff ff ff ff ff 00 30 ae 50 05 01 00 00 00 '........0.P.....'
  20 1d 01 04 a5 35 1d 78 22 05 65 a7 56 52 9c 27 ' ....5.x".e.VR.''
  0f 50 54 00 00 00 01 01 01 01 01 01 01 01 01 01 '.PT.............'
  01 01 01 01 01 01 40 38 80 00 71 38 14 40 30 20 '......@8..q8.@0 '
  84 00 0f 28 21 00 00 1e 00 00 00 fd 00 33 4c 36 '...(!........3L6'
  5a 12 00 0a 20 20 20 20 20 20 00 00 00 ff 00 4c 'Z...      .....L'
  4d 32 33 38 57 46 35 2d 53 53 45 31 00 00 00 fc 'M238WF5-SSE1....'
  00 4c 45 4e 2d 41 35 35 30 2d 42 0a 20 20 00 ad '.LEN-A550-B.  ..'
Checksum: 0xad

----------------

Warnings:

Block 0, Base EDID:
  Vendor & Product Identification: The serial number is one of the known dummy values, it should probably be set to 0.
  Display Range Limits: GTF support is deprecated in EDID 1.4.

Failures:

Block 0, Base EDID:
  Display Range Limits: GTF is supported, but the display does not support continuous frequencies.
Block 1, Base EDID:
  Unknown Extension Block.
EDID:
  Base EDID: EDID specified 0 extension block(s), but found 1 extension block(s).

EDID conformity: FAIL
