edid-decode (hex):

00 ff ff ff ff ff ff 00 08 4b 75 20 01 00 00 00
03 12 01 03 80 2b 1b 78 ea de 95 a3 54 4c 99 26
0f 50 54 af cf 00 b3 00 a9 40 95 00 81 80 01 01
01 01 01 01 01 01 21 39 90 30 62 1a 27 40 68 b0
36 00 0e 28 21 00 00 1c 9a 29 a0 d0 51 84 22 30
50 98 36 00 c5 ff 10 00 00 1e 30 2a 00 98 51 00
2a 40 30 70 13 00 68 0e 11 00 00 1e 00 00 00 fc
00 42 42 4b 20 4c 43 44 0a 20 20 20 20 20 00 67

----------------

Block 0, Base EDID:
  EDID Structure Version & Revision: 1.3
  Vendor & Product Identification:
    Manufacturer: BBK
    Model: 8309
    Serial Number: ...
    Made in: week 3 of 2008
  Basic Display Parameters & Features:
    Digital display
    Maximum image size: 43 cm x 27 cm
    Gamma: 2.20
    DPMS levels: Standby Suspend Off
    RGB color display
    First detailed timing is the preferred timing
  Color Characteristics:
    Red  : 0.6396, 0.3291
    Green: 0.2998, 0.5996
    Blue : 0.1503, 0.0595
    White: 0.3134, 0.3291
  Established Timings I & II:
    IBM     :   720x400    70.081663 Hz   9:5     31.467 kHz     28.320000 MHz
    DMT 0x04:   640x480    59.940476 Hz   4:3     31.469 kHz     25.175000 MHz
    DMT 0x05:   640x480    72.808802 Hz   4:3     37.861 kHz     31.500000 MHz
    DMT 0x06:   640x480    75.000000 Hz   4:3     37.500 kHz     31.500000 MHz
    DMT 0x08:   800x600    56.250000 Hz   4:3     35.156 kHz     36.000000 MHz
    DMT 0x09:   800x600    60.316541 Hz   4:3     37.879 kHz     40.000000 MHz
    DMT 0x0a:   800x600    72.187572 Hz   4:3     48.077 kHz     50.000000 MHz
    DMT 0x0b:   800x600    75.000000 Hz   4:3     46.875 kHz     49.500000 MHz
    DMT 0x10:  1024x768    60.003840 Hz   4:3     48.363 kHz     65.000000 MHz
    DMT 0x11:  1024x768    70.069359 Hz   4:3     56.476 kHz     75.000000 MHz
    DMT 0x12:  1024x768    75.028582 Hz   4:3     60.023 kHz     78.750000 MHz
    DMT 0x24:  1280x1024   75.024675 Hz   5:4     79.976 kHz    135.000000 MHz
  Standard Timings:
    DMT 0x3a:  1680x1050   59.954250 Hz  16:10    65.290 kHz    146.250000 MHz
    DMT 0x33:  1600x1200   60.000000 Hz   4:3     75.000 kHz    162.000000 MHz
    DMT 0x2f:  1440x900    59.887445 Hz  16:10    55.935 kHz    106.500000 MHz
    DMT 0x23:  1280x1024   60.019740 Hz   5:4     63.981 kHz    108.000000 MHz
  Detailed Timing Descriptors:
    DTD 1:  1680x1050   59.954250 Hz  16:10    65.290 kHz    146.250000 MHz (526 mm x 296 mm)
                 Hfront  104 Hsync 176 Hback  280 Hpol N
                 Vfront    3 Vsync   6 Vback   30 Vpol P
    DTD 2:  1440x900    59.887445 Hz  16:10    55.935 kHz    106.500000 MHz (453 mm x 255 mm)
                 Hfront   80 Hsync 152 Hback  232 Hpol P
                 Vfront    3 Vsync   6 Vback   25 Vpol P
    DTD 3:  1280x1024   60.019740 Hz   5:4     63.981 kHz    108.000000 MHz (360 mm x 270 mm)
                 Hfront   48 Hsync 112 Hback  248 Hpol P
                 Vfront    1 Vsync   3 Vback   38 Vpol P
    Display Product Name: 'BBK LCD'
Checksum: 0x67

----------------

Warnings:

Block 0, Base EDID:
  Vendor & Product Identification: The serial number is one of the known dummy values, it should probably be set to 0.
  Detailed Timing Descriptor #1: Image size is 526x296 mm, but based on the picture AR it should be 473x296 mm.
  Detailed Timing Descriptor #2: DTD is similar but not identical to DMT 0x2f.
  Detailed Timing Descriptor #2: Image size is 453x255 mm, but based on the picture AR it should be 408x255 mm.
  Detailed Timing Descriptor #3: Image size is 360x270 mm, but based on the picture AR it should be 337x270 mm.

Failures:

Block 0, Base EDID:
  Detailed Timing Descriptor #1: Mismatch of image size 526x296 mm vs display size 430x270 mm.
  Detailed Timing Descriptor #2: Mismatch of image size 453x255 mm vs display size 430x270 mm.
  Missing Display Range Limits Descriptor.
EDID:
  Base EDID: The DTD max image size is 526x296mm, which is larger than the display size 430.0x270.0mm.

EDID conformity: FAIL
