edid-decode (hex):

00 ff ff ff ff ff ff 00 5a 63 40 fd 01 00 00 00
04 23 01 04 b5 3c 22 78 2b 02 31 a8 53 4b a0 23
0e 50 54 23 08 00 31 40 45 40 61 40 81 c0 81 80
95 00 b3 00 a9 c0 50 d0 00 a0 f0 70 3e 80 30 20
35 00 56 50 21 00 00 1e 00 00 00 ff 00 58 50 30
32 35 30 34 32 30 32 37 36 0a 00 00 00 fd 00 30
3c 87 87 3c 01 0a 20 20 20 20 20 20 00 00 00 fc
00 56 41 32 37 30 38 2d 55 48 44 0a 20 20 01 56

02 03 25 f1 4d 10 1f 04 13 03 12 01 5d 5e 5f 60
61 05 23 09 07 01 83 01 00 00 e3 05 c0 00 e6 06
05 01 60 59 08 7f 21 56 aa 51 00 1e 30 46 8f 33
00 00 00 00 00 00 1e 00 00 00 00 00 00 00 00 00
00 00 00 00 00 00 00 00 00 00 00 00 00 00 00 00
00 00 00 00 00 00 00 00 00 00 00 00 00 00 00 00
00 00 00 00 00 00 00 00 00 00 00 00 00 00 00 00
00 00 00 00 00 00 00 00 00 00 00 00 00 00 00 e4

00 ff ff ff ff ff ff 00 5a 63 40 fd 01 00 00 00
04 23 01 04 b5 3c 22 78 2b 02 31 a8 53 4b a0 23
0e 50 54 23 08 00 31 40 45 40 61 40 81 c0 81 80
95 00 b3 00 a9 c0 50 d0 00 a0 f0 70 3e 80 30 20
35 00 56 50 21 00 00 1e 00 00 00 ff 00 58 50 30
32 35 30 34 32 30 32 37 36 0a 00 00 00 fd 00 30
3c 87 87 3c 01 0a 20 20 20 20 20 20 00 00 00 fc
00 56 41 32 37 30 38 2d 55 48 44 0a 20 20 01 56

02 03 25 f1 4d 10 1f 04 13 03 12 01 5d 5e 5f 60
61 05 23 09 07 01 83 01 00 00 e3 05 c0 00 e6 06
05 01 60 59 08 7f 21 56 aa 51 00 1e 30 46 8f 33
00 00 00 00 00 00 1e 00 00 00 00 00 00 00 00 00
00 00 00 00 00 00 00 00 00 00 00 00 00 00 00 00
00 00 00 00 00 00 00 00 00 00 00 00 00 00 00 00
00 00 00 00 00 00 00 00 00 00 00 00 00 00 00 00
00 00 00 00 00 00 00 00 00 00 00 00 00 00 00 e4

----------------

Block 0, Base EDID:
  EDID Structure Version & Revision: 1.4
  Vendor & Product Identification:
    Manufacturer: VSC
    Model: 64832
    Serial Number: ...
    Made in: week 4 of 2025
  Basic Display Parameters & Features:
    Digital display
    Bits per primary color channel: 10
    DisplayPort interface
    Maximum image size: 60 cm x 34 cm
    Gamma: 2.20
    DPMS levels: Off
    Supported color formats: RGB 4:4:4, YCrCb 4:4:4
    First detailed timing includes the native pixel format and preferred refresh rate
    Display supports continuous frequencies
  Color Characteristics:
    Red  : 0.6562, 0.3242
    Green: 0.2929, 0.6269
    Blue : 0.1367, 0.0576
    White: 0.3125, 0.3291
  Established Timings I & II:
    DMT 0x04:   640x480    59.940476 Hz   4:3     31.469 kHz     25.175000 MHz
    DMT 0x08:   800x600    56.250000 Hz   4:3     35.156 kHz     36.000000 MHz
    DMT 0x09:   800x600    60.316541 Hz   4:3     37.879 kHz     40.000000 MHz
    DMT 0x10:  1024x768    60.003840 Hz   4:3     48.363 kHz     65.000000 MHz
  Standard Timings:
    DMT 0x04:   640x480    59.940476 Hz   4:3     31.469 kHz     25.175000 MHz
    DMT 0x09:   800x600    60.316541 Hz   4:3     37.879 kHz     40.000000 MHz
    DMT 0x10:  1024x768    60.003840 Hz   4:3     48.363 kHz     65.000000 MHz
    DMT 0x55:  1280x720    60.000000 Hz  16:9     45.000 kHz     74.250000 MHz
    DMT 0x23:  1280x1024   60.019740 Hz   5:4     63.981 kHz    108.000000 MHz
    DMT 0x2f:  1440x900    59.887445 Hz  16:10    55.935 kHz    106.500000 MHz
    DMT 0x3a:  1680x1050   59.954250 Hz  16:10    65.290 kHz    146.250000 MHz
    DMT 0x53:  1600x900    60.000000 Hz  16:9     60.000 kHz    108.000000 MHz (RB)
  Detailed Timing Descriptors:
    DTD 1:  3840x2160   60.000000 Hz  16:9    133.320 kHz    533.280000 MHz (598 mm x 336 mm)
                 Hfront   48 Hsync  32 Hback   80 Hpol P
                 Vfront    3 Vsync   5 Vback   54 Vpol P
    Display Product Serial Number: ...
    Display Range Limits:
      Monitor ranges (Range Limits Only): 48-60 Hz V, 135-135 kHz H, max dotclock 600 MHz
    Display Product Name: 'VA2708-UHD'
  Extension blocks: 1
Checksum: 0x56

----------------

Block 1, CTA-861 Extension Block:
  Revision: 3
  Underscans IT Video Formats by default
  Basic audio support
  Supports YCbCr 4:4:4
  Supports YCbCr 4:2:2
  Native DTDs: 1
  Video Data Block:
    VIC  16:  1920x1080   60.000000 Hz  16:9     67.500 kHz    148.500000 MHz
    VIC  31:  1920x1080   50.000000 Hz  16:9     56.250 kHz    148.500000 MHz
    VIC   4:  1280x720    60.000000 Hz  16:9     45.000 kHz     74.250000 MHz
    VIC  19:  1280x720    50.000000 Hz  16:9     37.500 kHz     74.250000 MHz
    VIC   3:   720x480    59.940060 Hz  16:9     31.469 kHz     27.000000 MHz
    VIC  18:   720x576    50.000000 Hz  16:9     31.250 kHz     27.000000 MHz
    VIC   1:   640x480    59.940476 Hz   4:3     31.469 kHz     25.175000 MHz
    VIC  93:  3840x2160   24.000000 Hz  16:9     54.000 kHz    297.000000 MHz
    VIC  94:  3840x2160   25.000000 Hz  16:9     56.250 kHz    297.000000 MHz
    VIC  95:  3840x2160   30.000000 Hz  16:9     67.500 kHz    297.000000 MHz
    VIC  96:  3840x2160   50.000000 Hz  16:9    112.500 kHz    594.000000 MHz
    VIC  97:  3840x2160   60.000000 Hz  16:9    135.000 kHz    594.000000 MHz
    VIC   5:  1920x1080i  60.000000 Hz  16:9     33.750 kHz     74.250000 MHz
  Audio Data Block:
    Linear PCM:
      Max channels: 2
      Supported sample rates (kHz): 48 44.1 32
      Supported sample sizes (bits): 16
  Speaker Allocation Data Block:
    FL/FR - Front Left/Right
  Colorimetry Data Block:
    BT2020YCC
    BT2020RGB
  HDR Static Metadata Data Block:
    Electro optical transfer functions:
      Traditional gamma - SDR luminance range
      SMPTE ST2084
    Supported static metadata descriptors:
      Static metadata type 1
    Desired content max luminance: 96 (400.000 cd/m^2)
    Desired content max frame-average luminance: 89 (343.724 cd/m^2)
    Desired content min luminance: 8 (0.004 cd/m^2)
  Detailed Timing Descriptors:
    DTD 2:  1366x768    59.964364 Hz 683:384   47.852 kHz     85.750000 MHz
                 Hfront   70 Hsync 143 Hback  213 Hpol P
                 Vfront    3 Vsync   3 Vback   24 Vpol P
Checksum: 0xe4  Unused space in Extension Block: 72 bytes

----------------

Warnings:

Block 0, Base EDID:
  Vendor & Product Identification: The serial number is one of the known dummy values, it should probably be set to 0.
Block 1, CTA-861 Extension Block:
  Video Data Block: VIC 16 and the first DTD are not identical. Is this intended?
  Colorimetry Data Block: Set the sRGB colorimetry bit to avoid interop issues.
  Display Product Serial Number is set, so the Serial Number in the Base EDID should be 0.
EDID:
  Base EDID: Some timings are out of range of the Monitor Ranges:
    Vertical Freq: 24.000 - 60.317 Hz (Monitor: 48.000 - 60.000 Hz)
    Horizontal Freq: 31.250 - 135.000 kHz (Monitor: 135.000 - 135.000 kHz)

Failures:

Block 1, CTA-861 Extension Block:
  Detailed Timing Descriptor #2: Mismatch of image size vs display size: image size is not set, but display size is.
  Missing VCDB, needed for Set Selectable RGB Quantization to avoid interop issues.
EDID:
  Extension Block 2 started with EDID header, ignoring Extension Blocks >= 2.

EDID conformity: FAIL
