edid-decode (hex):

00 ff ff ff ff ff ff 00 26 cf e4 04 00 00 00 00
19 18 01 04 a5 1c 10 78 0a 46 10 96 54 4d 8e 2d
1a 50 54 00 00 00 01 01 01 01 01 01 01 01 01 01
01 01 01 01 01 01 bd 1b 56 88 50 00 14 30 22 28
46 00 14 9b 10 00 00 19 00 00 00 00 00 00 00 00
00 00 00 00 00 00 00 00 00 00 00 00 00 fe 00 49
6e 66 6f 56 69 73 69 6f 6e 0a 20 20 00 00 00 fe
00 4d 31 32 35 4e 57 52 32 20 52 31 20 0a 00 b3

----------------

Block 0, Base EDID:
  EDID Structure Version & Revision: 1.4
  Vendor & Product Identification:
    Manufacturer: IVO
    Model: 1252
    Made in: week 25 of 2014
  Basic Display Parameters & Features:
    Digital display
    Bits per primary color channel: 8
    DisplayPort interface
    Maximum image size: 28 cm x 16 cm
    Gamma: 2.20
    Supported color formats: RGB 4:4:4, YCrCb 4:4:4
    First detailed timing includes the native pixel format and preferred refresh rate
  Color Characteristics:
    Red  : 0.5869, 0.3281
    Green: 0.3017, 0.5566
    Blue : 0.1757, 0.1025
    White: 0.3125, 0.3281
  Established Timings I & II: none
  Standard Timings: none
  Detailed Timing Descriptors:
    DTD 1:  1366x768    59.996147 Hz 683:384   47.277 kHz     71.010000 MHz (276 mm x 155 mm)
                 Hfront   34 Hsync  40 Hback   62 Hpol N
                 Vfront    4 Vsync   6 Vback   10 Vpol N
    Empty Descriptor
    Alphanumeric Data String: 'InfoVision'
    Alphanumeric Data String: 'M125NWR2 R1 '
Checksum: 0xb3

----------------

Warnings:

Block 0, Base EDID:
  Missing Display Product Name.

Failures:

Block 0, Base EDID:
  Empty Descriptor: Use Dummy Descriptor instead of all zeroes.
  Alphanumeric Data String: One or more trailing spaces before newline.

EDID conformity: FAIL
