edid-decode (hex):

00 ff ff ff ff ff ff 00 35 67 00 00 01 01 01 01
05 21 01 04 b5 50 22 78 3b bb 79 a9 51 46 a5 27
12 51 56 bf cf 80 81 c0 81 80 95 00 a9 c0 b3 00
d1 c0 d1 fc 71 4f f5 7c 70 a0 d0 a0 29 50 30 20
3a 00 1d 4e 31 00 00 1a 00 00 00 ff 00 32 48 31
39 37 50 32 32 4c 30 44 33 0a 00 00 00 fc 00 4d
4b 33 34 51 47 53 43 32 0a 20 20 20 00 00 00 fd
00 30 a5 fe fe 6c 01 0a 20 20 20 20 20 20 02 08

02 03 32 f1 4c 01 03 04 12 13 05 14 1f 10 02 5a
59 23 09 7f 07 83 01 00 00 e3 05 e3 01 e6 06 07
01 60 60 29 6d 1a 00 00 02 01 30 a5 00 00 00 00
00 00 d4 bc 00 a0 a0 a0 29 50 30 20 35 00 1d 4e
31 00 00 1e 86 6f 80 a0 70 38 40 40 30 20 35 00
1d 4e 31 00 00 1a 56 5e 00 a0 a0 a0 29 50 30 20
35 00 1d 4e 31 00 00 1a 00 00 00 00 00 00 00 00
00 00 00 00 00 00 00 00 00 00 00 00 00 00 00 3c

70 12 79 00 00 03 01 3c 91 58 01 04 6f 0d 9f 00
2f 00 3f 00 9f 05 2c 00 02 00 04 00 b5 2c 01 04
6f 0d 9f 00 2f 00 3f 00 9f 05 2c 00 02 00 04 00
97 fa 00 04 6f 0d 9f 00 2f 00 3f 00 9f 05 2c 00
02 00 04 00 00 00 00 00 00 00 00 00 00 00 00 00
00 00 00 00 00 00 00 00 00 00 00 00 00 00 00 00
00 00 00 00 00 00 00 00 00 00 00 00 00 00 00 00
00 00 00 00 00 00 00 00 00 00 00 00 00 00 af 90

00 ff ff ff ff ff ff 00 35 67 00 00 01 01 01 01
05 21 01 04 b5 50 22 78 3b bb 79 a9 51 46 a5 27
12 51 56 bf cf 80 81 c0 81 80 95 00 a9 c0 b3 00
d1 c0 d1 fc 71 4f f5 7c 70 a0 d0 a0 29 50 30 20
3a 00 1d 4e 31 00 00 1a 00 00 00 ff 00 32 48 31
39 37 50 32 32 4c 30 44 33 0a 00 00 00 fc 00 4d
4b 33 34 51 47 53 43 32 0a 20 20 20 00 00 00 fd
00 30 a5 fe fe 6c 01 0a 20 20 20 20 20 20 02 08

02 03 32 f1 4c 01 03 04 12 13 05 14 1f 10 02 5a
59 23 09 7f 07 83 01 00 00 e3 05 e3 01 e6 06 07
01 60 60 29 6d 1a 00 00 02 01 30 a5 00 00 00 00
00 00 d4 bc 00 a0 a0 a0 29 50 30 20 35 00 1d 4e
31 00 00 1e 86 6f 80 a0 70 38 40 40 30 20 35 00
1d 4e 31 00 00 1a 56 5e 00 a0 a0 a0 29 50 30 20
35 00 1d 4e 31 00 00 1a 00 00 00 00 00 00 00 00
00 00 00 00 00 00 00 00 00 00 00 00 00 00 00 3c

70 12 79 00 00 03 01 3c 91 58 01 04 6f 0d 9f 00
2f 00 3f 00 9f 05 2c 00 02 00 04 00 b5 2c 01 04
6f 0d 9f 00 2f 00 3f 00 9f 05 2c 00 02 00 04 00
97 fa 00 04 6f 0d 9f 00 2f 00 3f 00 9f 05 2c 00
02 00 04 00 00 00 00 00 00 00 00 00 00 00 00 00
00 00 00 00 00 00 00 00 00 00 00 00 00 00 00 00
00 00 00 00 00 00 00 00 00 00 00 00 00 00 00 00
00 00 00 00 00 00 00 00 00 00 00 00 00 00 af 90

----------------

Block 0, Base EDID:
  EDID Structure Version & Revision: 1.4
  Vendor & Product Identification:
    Manufacturer: MKG
    Model: 0
    Serial Number: ...
    Made in: week 5 of 2023
  Basic Display Parameters & Features:
    Digital display
    Bits per primary color channel: 10
    DisplayPort interface
    Maximum image size: 80 cm x 34 cm
    Gamma: 2.20
    DPMS levels: Off
    Supported color formats: RGB 4:4:4, YCrCb 4:4:4, YCrCb 4:2:2
    First detailed timing includes the native pixel format and preferred refresh rate
    Display supports continuous frequencies
  Color Characteristics:
    Red  : 0.6621, 0.3193
    Green: 0.2753, 0.6474
    Blue : 0.1533, 0.0732
    White: 0.3183, 0.3369
  Established Timings I & II:
    IBM     :   720x400    70.081663 Hz   9:5     31.467 kHz     28.320000 MHz
    DMT 0x04:   640x480    59.940476 Hz   4:3     31.469 kHz     25.175000 MHz
    Apple   :   640x480    66.666667 Hz   4:3     35.000 kHz     30.240000 MHz
    DMT 0x05:   640x480    72.808802 Hz   4:3     37.861 kHz     31.500000 MHz
    DMT 0x06:   640x480    75.000000 Hz   4:3     37.500 kHz     31.500000 MHz
    DMT 0x08:   800x600    56.250000 Hz   4:3     35.156 kHz     36.000000 MHz
    DMT 0x09:   800x600    60.316541 Hz   4:3     37.879 kHz     40.000000 MHz
    DMT 0x0a:   800x600    72.187572 Hz   4:3     48.077 kHz     50.000000 MHz
    DMT 0x0b:   800x600    75.000000 Hz   4:3     46.875 kHz     49.500000 MHz
    DMT 0x10:  1024x768    60.003840 Hz   4:3     48.363 kHz     65.000000 MHz
    DMT 0x11:  1024x768    70.069359 Hz   4:3     56.476 kHz     75.000000 MHz
    DMT 0x12:  1024x768    75.028582 Hz   4:3     60.023 kHz     78.750000 MHz
    DMT 0x24:  1280x1024   75.024675 Hz   5:4     79.976 kHz    135.000000 MHz
    Apple   :  1152x870    75.061550 Hz 192:145   68.681 kHz    100.000000 MHz
  Standard Timings:
    DMT 0x55:  1280x720    60.000000 Hz  16:9     45.000 kHz     74.250000 MHz
    DMT 0x23:  1280x1024   60.019740 Hz   5:4     63.981 kHz    108.000000 MHz
    DMT 0x2f:  1440x900    59.887445 Hz  16:10    55.935 kHz    106.500000 MHz
    DMT 0x53:  1600x900    60.000000 Hz  16:9     60.000 kHz    108.000000 MHz (RB)
    DMT 0x3a:  1680x1050   59.954250 Hz  16:10    65.290 kHz    146.250000 MHz
    DMT 0x52:  1920x1080   60.000000 Hz  16:9     67.500 kHz    148.500000 MHz
    GTF     :  1920x1080  119.999987 Hz  16:9    138.840 kHz    368.759000 MHz
    DMT 0x15:  1152x864    75.000000 Hz   4:3     67.500 kHz    108.000000 MHz
  Detailed Timing Descriptors:
    DTD 1:  3440x1440   59.998875 Hz  43:18    88.858 kHz    319.890000 MHz (797 mm x 334 mm)
                 Hfront   48 Hsync  32 Hback   80 Hpol P
                 Vfront    3 Vsync  10 Vback   28 Vpol N
    Display Product Serial Number: ...
    Display Product Name: 'MK34QGSC2'
    Display Range Limits:
      Monitor ranges (Range Limits Only): 48-165 Hz V, 254-254 kHz H, max dotclock 1080 MHz
  Extension blocks: 2
Checksum: 0x08

----------------

Block 1, CTA-861 Extension Block:
  Revision: 3
  Underscans IT Video Formats by default
  Basic audio support
  Supports YCbCr 4:4:4
  Supports YCbCr 4:2:2
  Native DTDs: 1
  Video Data Block:
    VIC   1:   640x480    59.940476 Hz   4:3     31.469 kHz     25.175000 MHz
    VIC   3:   720x480    59.940060 Hz  16:9     31.469 kHz     27.000000 MHz
    VIC   4:  1280x720    60.000000 Hz  16:9     45.000 kHz     74.250000 MHz
    VIC  18:   720x576    50.000000 Hz  16:9     31.250 kHz     27.000000 MHz
    VIC  19:  1280x720    50.000000 Hz  16:9     37.500 kHz     74.250000 MHz
    VIC   5:  1920x1080i  60.000000 Hz  16:9     33.750 kHz     74.250000 MHz
    VIC  20:  1920x1080i  50.000000 Hz  16:9     28.125 kHz     74.250000 MHz
    VIC  31:  1920x1080   50.000000 Hz  16:9     56.250 kHz    148.500000 MHz
    VIC  16:  1920x1080   60.000000 Hz  16:9     67.500 kHz    148.500000 MHz
    VIC   2:   720x480    59.940060 Hz   4:3     31.469 kHz     27.000000 MHz
    VIC  90:  2560x1080   60.000000 Hz  64:27    66.000 kHz    198.000000 MHz
    VIC  89:  2560x1080   50.000000 Hz  64:27    56.250 kHz    185.625000 MHz
  Audio Data Block:
    Linear PCM:
      Max channels: 2
      Supported sample rates (kHz): 192 176.4 96 88.2 48 44.1 32
      Supported sample sizes (bits): 24 20 16
  Speaker Allocation Data Block:
    FL/FR - Front Left/Right
  Colorimetry Data Block:
    xvYCC601
    xvYCC709
    BT2020cYCC
    BT2020YCC
    BT2020RGB
    Gamut Boundary Description Metadata Profile P0
  HDR Static Metadata Data Block:
    Electro optical transfer functions:
      Traditional gamma - SDR luminance range
      Traditional gamma - HDR luminance range
      SMPTE ST2084
    Supported static metadata descriptors:
      Static metadata type 1
    Desired content max luminance: 96 (400.000 cd/m^2)
    Desired content max frame-average luminance: 96 (400.000 cd/m^2)
    Desired content min luminance: 41 (0.103 cd/m^2)
  Vendor-Specific Data Block (AMD), OUI 00-00-1A:
    Version: 2
    Flags 1: 0x01
      FreeSync Supported
    Minimum Refresh Rate: 48 Hz
    Maximum Refresh Rate: 165 Hz
    Flags 5: 0x00
  Detailed Timing Descriptors:
    DTD 2:  2560x1440  120.000397 Hz  16:9    177.721 kHz    483.400000 MHz (797 mm x 334 mm)
                 Hfront   48 Hsync  32 Hback   80 Hpol P
                 Vfront    3 Vsync   5 Vback   33 Vpol P
    DTD 3:  1920x1080  119.982181 Hz  16:9    137.260 kHz    285.500000 MHz (797 mm x 334 mm)
                 Hfront   48 Hsync  32 Hback   80 Hpol P
                 Vfront    3 Vsync   5 Vback   56 Vpol N
    DTD 4:  2560x1440   59.950550 Hz  16:9     88.787 kHz    241.500000 MHz (797 mm x 334 mm)
                 Hfront   48 Hsync  32 Hback   80 Hpol P
                 Vfront    3 Vsync   5 Vback   33 Vpol N
Checksum: 0x3c  Unused space in Extension Block: 23 bytes

----------------

Block 2, DisplayID Extension Block:
  Version: 1.2
  Extension Count: 0
  Display Product Type: Extension Section
  Video Timing Modes Type 1 - Detailed Timings Data Block:
    DTD:  3440x1440  165.001871 Hz  16:9    245.028 kHz    882.100000 MHz (aspect 16:9, no 3D stereo)
               Hfront   48 Hsync  64 Hback   48 Hpol N
               Vfront    3 Vsync   5 Vback   37 Vpol N
    DTD:  3440x1440  143.999252 Hz  16:9    213.839 kHz    769.820000 MHz (aspect 16:9, no 3D stereo)
               Hfront   48 Hsync  64 Hback   48 Hpol N
               Vfront    3 Vsync   5 Vback   37 Vpol N
    DTD:  3440x1440  120.000000 Hz  16:9    178.200 kHz    641.520000 MHz (aspect 16:9, no 3D stereo)
               Hfront   48 Hsync  64 Hback   48 Hpol N
               Vfront    3 Vsync   5 Vback   37 Vpol N
  Checksum: 0xaf
Checksum: 0x90

----------------

Warnings:

Block 0, Base EDID:
  Vendor & Product Identification: The serial number is one of the known dummy values, it should probably be set to 0.
Block 1, CTA-861 Extension Block:
  Video Data Block: VIC 1 and the first DTD are not identical. Is this intended?
  Colorimetry Data Block: Set the sRGB colorimetry bit to avoid interop issues.
  Detailed Timing Descriptor #2: Image size is 797x334 mm, but based on the picture AR it should be 593x334 mm.
  Detailed Timing Descriptor #3: Image size is 797x334 mm, but based on the picture AR it should be 593x334 mm.
  Detailed Timing Descriptor #4: Image size is 797x334 mm, but based on the picture AR it should be 593x334 mm.
  Display Product Serial Number is set, so the Serial Number in the Base EDID should be 0.
EDID:
  Base EDID: Some timings are out of range of the Monitor Ranges:
    Horizontal Freq: 28.125 - 245.027 kHz (Monitor: 254.000 - 254.000 kHz)

Failures:

Block 1, CTA-861 Extension Block:
  Missing VCDB, needed for Set Selectable RGB Quantization to avoid interop issues.
Block 2, DisplayID Extension Block:
  DisplayID Base Block has no product type.
EDID:
  Extension Block 3 started with EDID header, ignoring Extension Blocks >= 3.
  DisplayID: DisplayID expects at least one preferred timing.

EDID conformity: FAIL
