edid-decode (hex):

00 ff ff ff ff ff ff 00 30 e4 8e 01 00 00 00 00
00 12 01 04 a0 25 17 78 02 88 c5 b1 4d 37 b6 26
0b 50 54 00 00 00 01 01 01 01 01 01 01 01 01 01
01 01 01 01 01 01 8c 3c 80 a0 70 b0 23 40 30 20
36 00 6f e6 10 00 00 19 8c 3c 80 a0 70 b0 23 40
30 20 36 00 6f e6 10 00 00 19 00 00 00 fe 00 52
4d 32 34 34 80 31 37 31 57 55 35 0a 00 00 00 00
00 00 00 00 00 00 00 00 00 06 01 0a 20 20 00 6f

00 ff ff ff ff ff ff 00 30 e4 8e 01 00 00 00 00
00 12 01 04 a0 25 17 78 02 88 c5 b1 4d 37 b6 26
0b 50 54 00 00 00 01 01 01 01 01 01 01 01 01 01
01 01 01 01 01 01 8c 3c 80 a0 70 b0 23 40 30 20
36 00 6f e6 10 00 00 19 8c 3c 80 a0 70 b0 23 40
30 20 36 00 6f e6 10 00 00 19 00 00 00 fe 00 52
4d 32 34 34 80 31 37 31 57 55 35 0a 00 00 00 00
00 00 00 00 00 00 00 00 00 06 01 0a 20 20 00 6f

----------------

Block 0, Base EDID:
  EDID Structure Version & Revision: 1.4
  Vendor & Product Identification:
    Manufacturer: LGD
    Model: 398
    Made in: 2008
  Basic Display Parameters & Features:
    Digital display
    Bits per primary color channel: 8
    Digital interface is not defined
    Maximum image size: 37 cm x 23 cm
    Gamma: 2.20
    Supported color formats: RGB 4:4:4
    First detailed timing includes the native pixel format and preferred refresh rate
  Color Characteristics:
    Red  : 0.6933, 0.3007
    Green: 0.2167, 0.7109
    Blue : 0.1513, 0.0429
    White: 0.3134, 0.3291
  Established Timings I & II: none
  Standard Timings: none
  Detailed Timing Descriptors:
    DTD 1:  1920x1200   60.339458 Hz  16:10    74.519 kHz    155.000000 MHz (367 mm x 230 mm)
                 Hfront   48 Hsync  32 Hback   80 Hpol N
                 Vfront    3 Vsync   6 Vback   26 Vpol N
    DTD 2:  1920x1200   60.339458 Hz  16:10    74.519 kHz    155.000000 MHz (367 mm x 230 mm)
                 Hfront   48 Hsync  32 Hback   80 Hpol N
                 Vfront    3 Vsync   6 Vback   26 Vpol N
    Alphanumeric Data String: 'RM244.171WU5'
    Manufacturer-Specified Display Descriptor (0x00): 00 00 00 00 00 00 00 00 00 00 00 06 01 0a 20 20 '..............  '
Checksum: 0x6f

----------------

Warnings:

Block 0, Base EDID:
  Alphanumeric Data String: Non-ASCII character 0x80 at position 5, can cause problems.
  Missing Display Product Name.

Failures:

EDID:
  Extension Block 1 started with EDID header, ignoring Extension Blocks >= 1.

EDID conformity: FAIL
