edid-decode (hex):

00 ff ff ff ff ff ff 00 4e 14 05 6c 00 00 00 00
21 1f 01 04 a5 3c 21 78 3b 8e 05 ad 4f 33 b0 26
0d 50 54 a5 4b 00 81 c0 81 00 81 40 81 80 95 00
a9 c0 b3 00 d1 cf 02 3a 80 18 71 38 2d 40 30 20
35 00 08 40 21 00 00 1a 1b 82 80 88 70 38 2d 40
18 20 35 00 56 50 21 00 00 1e 00 00 00 fd 00 30
a6 de de 3c 01 0a 20 20 20 20 20 20 00 00 00 fc
00 53 63 65 70 74 72 65 20 4d 32 37 0a 20 01 c4

02 03 26 f1 4b 01 03 05 14 04 13 1f 12 02 11 90
23 09 07 07 83 01 00 00 6d 1a 00 00 02 01 30 a5
00 00 00 00 00 00 81 91 80 88 70 38 12 40 18 20
35 00 56 50 21 00 00 18 f8 25 00 a0 50 38 2d 40
30 20 45 00 56 50 21 00 00 1e 66 21 56 aa 51 00
1e 30 46 8f 33 00 56 50 21 00 00 18 66 21 50 b0
51 00 1b 30 40 70 36 00 56 50 21 00 00 1e 00 00
00 00 00 00 00 00 00 00 00 00 00 00 00 00 00 ed

00 ff ff ff ff ff ff 00 4e 14 05 6c 00 00 00 00
21 1f 01 04 a5 3c 21 78 3b 8e 05 ad 4f 33 b0 26
0d 50 54 a5 4b 00 81 c0 81 00 81 40 81 80 95 00
a9 c0 b3 00 d1 cf 02 3a 80 18 71 38 2d 40 30 20
35 00 08 40 21 00 00 1a 1b 82 80 88 70 38 2d 40
18 20 35 00 56 50 21 00 00 1e 00 00 00 fd 00 30
a6 de de 3c 01 0a 20 20 20 20 20 20 00 00 00 fc
00 53 63 65 70 74 72 65 20 4d 32 37 0a 20 01 c4

02 03 26 f1 4b 01 03 05 14 04 13 1f 12 02 11 90
23 09 07 07 83 01 00 00 6d 1a 00 00 02 01 30 a5
00 00 00 00 00 00 81 91 80 88 70 38 12 40 18 20
35 00 56 50 21 00 00 18 f8 25 00 a0 50 38 2d 40
30 20 45 00 56 50 21 00 00 1e 66 21 56 aa 51 00
1e 30 46 8f 33 00 56 50 21 00 00 18 66 21 50 b0
51 00 1b 30 40 70 36 00 56 50 21 00 00 1e 00 00
00 00 00 00 00 00 00 00 00 00 00 00 00 00 00 ed

----------------

Block 0, Base EDID:
  EDID Structure Version & Revision: 1.4
  Vendor & Product Identification:
    Manufacturer: SPT
    Model: 27653
    Made in: week 33 of 2021
  Basic Display Parameters & Features:
    Digital display
    Bits per primary color channel: 8
    DisplayPort interface
    Maximum image size: 60 cm x 33 cm
    Gamma: 2.20
    DPMS levels: Off
    Supported color formats: RGB 4:4:4, YCrCb 4:4:4, YCrCb 4:2:2
    First detailed timing includes the native pixel format and preferred refresh rate
    Display supports continuous frequencies
  Color Characteristics:
    Red  : 0.6777, 0.3085
    Green: 0.2021, 0.6894
    Blue : 0.1484, 0.0507
    White: 0.3134, 0.3291
  Established Timings I & II:
    IBM     :   720x400    70.081663 Hz   9:5     31.467 kHz     28.320000 MHz
    DMT 0x04:   640x480    59.940476 Hz   4:3     31.469 kHz     25.175000 MHz
    DMT 0x06:   640x480    75.000000 Hz   4:3     37.500 kHz     31.500000 MHz
    DMT 0x09:   800x600    60.316541 Hz   4:3     37.879 kHz     40.000000 MHz
    DMT 0x0b:   800x600    75.000000 Hz   4:3     46.875 kHz     49.500000 MHz
    DMT 0x10:  1024x768    60.003840 Hz   4:3     48.363 kHz     65.000000 MHz
    DMT 0x12:  1024x768    75.028582 Hz   4:3     60.023 kHz     78.750000 MHz
    DMT 0x24:  1280x1024   75.024675 Hz   5:4     79.976 kHz    135.000000 MHz
  Standard Timings:
    DMT 0x55:  1280x720    60.000000 Hz  16:9     45.000 kHz     74.250000 MHz
    DMT 0x1c:  1280x800    59.810326 Hz  16:10    49.702 kHz     83.500000 MHz
    DMT 0x20:  1280x960    60.000000 Hz   4:3     60.000 kHz    108.000000 MHz
    DMT 0x23:  1280x1024   60.019740 Hz   5:4     63.981 kHz    108.000000 MHz
    DMT 0x2f:  1440x900    59.887445 Hz  16:10    55.935 kHz    106.500000 MHz
    DMT 0x53:  1600x900    60.000000 Hz  16:9     60.000 kHz    108.000000 MHz (RB)
    DMT 0x3a:  1680x1050   59.954250 Hz  16:10    65.290 kHz    146.250000 MHz
    GTF     :  1920x1080   75.000068 Hz  16:9     84.600 kHz    220.637000 MHz
  Detailed Timing Descriptors:
    DTD  1:  1920x1080   60.000000 Hz  16:9     67.500 kHz    148.500000 MHz (520 mm x 320 mm)
                  Hfront   48 Hsync  32 Hback  200 Hpol P
                  Vfront    3 Vsync   5 Vback   37 Vpol N
    DTD  2:  1920x1080  143.999135 Hz  16:9    161.999 kHz    333.070000 MHz (598 mm x 336 mm)
                  Hfront   24 Hsync  32 Hback   80 Hpol P
                  Vfront    3 Vsync   5 Vback   37 Vpol P
    Display Range Limits:
      Monitor ranges (Range Limits Only): 48-166 Hz V, 222-222 kHz H, max dotclock 600 MHz
    Display Product Name: 'Sceptre M27'
  Extension blocks: 1
Checksum: 0xc4

----------------

Block 1, CTA-861 Extension Block:
  Revision: 3
  Underscans IT Video Formats by default
  Basic audio support
  Supports YCbCr 4:4:4
  Supports YCbCr 4:2:2
  Native detailed modes: 1
  Video Data Block:
    VIC   1:   640x480    59.940476 Hz   4:3     31.469 kHz     25.175000 MHz
    VIC   3:   720x480    59.940060 Hz  16:9     31.469 kHz     27.000000 MHz
    VIC   5:  1920x1080i  60.000000 Hz  16:9     33.750 kHz     74.250000 MHz
    VIC  20:  1920x1080i  50.000000 Hz  16:9     28.125 kHz     74.250000 MHz
    VIC   4:  1280x720    60.000000 Hz  16:9     45.000 kHz     74.250000 MHz
    VIC  19:  1280x720    50.000000 Hz  16:9     37.500 kHz     74.250000 MHz
    VIC  31:  1920x1080   50.000000 Hz  16:9     56.250 kHz    148.500000 MHz
    VIC  18:   720x576    50.000000 Hz  16:9     31.250 kHz     27.000000 MHz
    VIC   2:   720x480    59.940060 Hz   4:3     31.469 kHz     27.000000 MHz
    VIC  17:   720x576    50.000000 Hz   4:3     31.250 kHz     27.000000 MHz
    VIC  16:  1920x1080   60.000000 Hz  16:9     67.500 kHz    148.500000 MHz (native)
  Audio Data Block:
    Linear PCM:
      Max channels: 2
      Supported sample rates (kHz): 48 44.1 32
      Supported sample sizes (bits): 24 20 16
  Speaker Allocation Data Block:
    FL/FR - Front Left/Right
  Vendor-Specific Data Block (AMD), OUI 00-00-1A:
    Version: 2
    Feature Caps: 0x01
    Minimum Refresh Rate: 48 Hz
    Maximum Refresh Rate: 165 Hz
    Flags 1.x: 0x00
    Flags 2.x: 0x00
    Maximum luminance: 0 (50.000 cd/m^2)
    Minimum luminance: 0 (0.000 cd/m^2)
    Unknown: 0x00 0x00
  Detailed Timing Descriptors:
    DTD  3:  1920x1080  165.001985 Hz  16:9    181.172 kHz    372.490000 MHz (598 mm x 336 mm)
                  Hfront   24 Hsync  32 Hback   80 Hpol N
                  Vfront    3 Vsync   5 Vback   10 Vpol N
    DTD  4:  1280x1080   60.000000 Hz  32:27    67.500 kHz     97.200000 MHz (598 mm x 336 mm)
                  Hfront   48 Hsync  32 Hback   80 Hpol P
                  Vfront    4 Vsync   5 Vback   36 Vpol P
    DTD  5:  1366x768    59.789541 Hz 683:384   47.712 kHz     85.500000 MHz (598 mm x 336 mm)
                  Hfront   70 Hsync 143 Hback  213 Hpol N
                  Vfront    3 Vsync   3 Vback   24 Vpol N
    DTD  6:  1360x768    60.015162 Hz  85:48    47.712 kHz     85.500000 MHz (598 mm x 336 mm)
                  Hfront   64 Hsync 112 Hback  256 Hpol P
                  Vfront    3 Vsync   6 Vback   18 Vpol P
Checksum: 0xed  Unused space in Extension Block: 17 bytes

----------------

Block 2, Unknown EDID Extension Block 0x00:
  00 ff ff ff ff ff ff 00 4e 14 05 6c 00 00 00 00 '........N..l....'
  21 1f 01 04 a5 3c 21 78 3b 8e 05 ad 4f 33 b0 26 '!....<!x;...O3.&'
  0d 50 54 a5 4b 00 81 c0 81 00 81 40 81 80 95 00 '.PT.K......@....'
  a9 c0 b3 00 d1 cf 02 3a 80 18 71 38 2d 40 30 20 '.......:..q8-@0 '
  35 00 08 40 21 00 00 1a 1b 82 80 88 70 38 2d 40 '5..@!.......p8-@'
  18 20 35 00 56 50 21 00 00 1e 00 00 00 fd 00 30 '. 5.VP!........0'
  a6 de de 3c 01 0a 20 20 20 20 20 20 00 00 00 fc '...<..      ....'
  00 53 63 65 70 74 72 65 20 4d 32 37 0a 20 01 c4 '.Sceptre M27. ..'
Checksum: 0xc4

----------------

Block 3, CTA-861 Extension Block:
  Revision: 3
  Underscans IT Video Formats by default
  Basic audio support
  Supports YCbCr 4:4:4
  Supports YCbCr 4:2:2
  Native detailed modes: 1
  Video Data Block:
    VIC   1:   640x480    59.940476 Hz   4:3     31.469 kHz     25.175000 MHz
    VIC   3:   720x480    59.940060 Hz  16:9     31.469 kHz     27.000000 MHz
    VIC   5:  1920x1080i  60.000000 Hz  16:9     33.750 kHz     74.250000 MHz
    VIC  20:  1920x1080i  50.000000 Hz  16:9     28.125 kHz     74.250000 MHz
    VIC   4:  1280x720    60.000000 Hz  16:9     45.000 kHz     74.250000 MHz
    VIC  19:  1280x720    50.000000 Hz  16:9     37.500 kHz     74.250000 MHz
    VIC  31:  1920x1080   50.000000 Hz  16:9     56.250 kHz    148.500000 MHz
    VIC  18:   720x576    50.000000 Hz  16:9     31.250 kHz     27.000000 MHz
    VIC   2:   720x480    59.940060 Hz   4:3     31.469 kHz     27.000000 MHz
    VIC  17:   720x576    50.000000 Hz   4:3     31.250 kHz     27.000000 MHz
    VIC  16:  1920x1080   60.000000 Hz  16:9     67.500 kHz    148.500000 MHz (native)
  Audio Data Block:
    Linear PCM:
      Max channels: 2
      Supported sample rates (kHz): 48 44.1 32
      Supported sample sizes (bits): 24 20 16
  Speaker Allocation Data Block:
    FL/FR - Front Left/Right
  Vendor-Specific Data Block (AMD), OUI 00-00-1A:
    Version: 2
    Feature Caps: 0x01
    Minimum Refresh Rate: 48 Hz
    Maximum Refresh Rate: 165 Hz
    Flags 1.x: 0x00
    Flags 2.x: 0x00
    Maximum luminance: 0 (50.000 cd/m^2)
    Minimum luminance: 0 (0.000 cd/m^2)
    Unknown: 0x00 0x00
  Detailed Timing Descriptors:
    DTD  7:  1920x1080  165.001985 Hz  16:9    181.172 kHz    372.490000 MHz (598 mm x 336 mm)
                  Hfront   24 Hsync  32 Hback   80 Hpol N
                  Vfront    3 Vsync   5 Vback   10 Vpol N
    DTD  8:  1280x1080   60.000000 Hz  32:27    67.500 kHz     97.200000 MHz (598 mm x 336 mm)
                  Hfront   48 Hsync  32 Hback   80 Hpol P
                  Vfront    4 Vsync   5 Vback   36 Vpol P
    DTD  9:  1366x768    59.789541 Hz 683:384   47.712 kHz     85.500000 MHz (598 mm x 336 mm)
                  Hfront   70 Hsync 143 Hback  213 Hpol N
                  Vfront    3 Vsync   3 Vback   24 Vpol N
    DTD 10:  1360x768    60.015162 Hz  85:48    47.712 kHz     85.500000 MHz (598 mm x 336 mm)
                  Hfront   64 Hsync 112 Hback  256 Hpol P
                  Vfront    3 Vsync   6 Vback   18 Vpol P
Checksum: 0xed  Unused space in Extension Block: 17 bytes

----------------

Warnings:

Block 0, Base EDID:
  Detailed Timing Descriptor #1: DTD is similar but not identical to VIC 16.
  Detailed Timing Descriptor #1: Image size is 520x320 mm, but based on the picture AR it should be 520x292 mm.
Block 1, CTA-861 Extension Block:
  Video Data Block: VIC 1 and the first DTD are not identical. Is this intended?
  Detailed Timing Descriptor #4: Image size is 598x336 mm, but based on the picture AR it should be 598x504 mm.
  Detailed Timing Descriptor #5: DTD is similar but not identical to DMT 0x51.
  Add a Colorimetry Data Block with the sRGB colorimetry bit set to avoid interop issues.
Block 3, CTA-861 Extension Block:
  Detailed Timing Descriptor #8: Image size is 598x336 mm, but based on the picture AR it should be 598x504 mm.
  Detailed Timing Descriptor #9: DTD is similar but not identical to DMT 0x51.
EDID:
  Base EDID: Some timings are out of range of the Monitor Ranges:
    Horizontal Freq: 28.125 - 181.172 kHz (Monitor: 222.000 - 222.000 kHz)
  CTA-861: Multiple native progressive timings are defined.

Failures:

Block 0, Base EDID:
  Detailed Timing Descriptor #1: Mismatch of image size 520x320 mm vs display size 600x330 mm.
Block 1, CTA-861 Extension Block:
  Missing VCDB, needed for Set Selectable RGB Quantization to avoid interop issues.
Block 2, Base EDID:
  Unknown Extension Block.
Block 3, CTA-861 Extension Block:
  Video Data Block: Duplicate VIC 1.
  Video Data Block: Duplicate VIC 3.
  Video Data Block: Duplicate VIC 5.
  Video Data Block: Duplicate VIC 20.
  Video Data Block: Duplicate VIC 4.
  Video Data Block: Duplicate VIC 19.
  Video Data Block: Duplicate VIC 31.
  Video Data Block: Duplicate VIC 18.
  Video Data Block: Duplicate VIC 2.
  Video Data Block: Duplicate VIC 17.
  Video Data Block: Duplicate VIC 16.
  Speaker Allocation Data Block: Only one instance of this Data Block is allowed.
EDID:
  Base EDID: EDID specified 1 extension block(s), but found 3 extension block(s).

EDID conformity: FAIL
