edid-decode (hex):

00 ff ff ff ff ff ff 00 0e 98 02 15 00 00 00 00
00 0a 01 01 78 1f 17 00 e8 04 88 a0 57 4a 9b 26
12 48 4c ad ce 00 01 01 01 01 01 01 01 01 01 01
01 01 01 01 01 01 00 00 00 fd 00 3b 4c 1e 46 08
00 0a 20 20 20 20 20 20 00 00 00 fc 00 50 56 35
32 30 0a 20 20 20 20 20 20 20 00 00 00 fe 00 4c
4b 43 31 35 58 41 0a 20 20 20 20 20 00 00 00 fe
00 42 45 20 53 4d 49 4c 45 20 45 4e 44 0a 00 6a

00 ff ff ff ff ff ff 00 0e 98 02 15 00 00 00 00
00 0a 01 01 78 1f 17 00 e8 04 88 a0 57 4a 9b 26
12 48 4c ad ce 00 01 01 01 01 01 01 01 01 01 01
01 01 01 01 01 01 00 00 00 fd 00 3b 4c 1e 46 08
00 0a 20 20 20 20 20 20 00 00 00 fc 00 50 56 35
32 30 0a 20 20 20 20 20 20 20 00 00 00 fe 00 4c
4b 43 31 35 58 41 0a 20 20 20 20 20 00 00 00 fe
00 42 45 20 53 4d 49 4c 45 20 45 4e 44 0a 00 6a

----------------

Block 0, Base EDID:
  EDID Structure Version & Revision: 1.1
  Vendor & Product Identification:
    Manufacturer: CTX
    Model: 5378
    Made in: 2000
  Basic Display Parameters & Features:
    Analog display
    Signal Level Standard: 0.700 : 0.000 : 0.700 V p-p
    Blank-to-black setup/pedestal
    Sync: Separate
    Maximum image size: 31 cm x 23 cm
    Gamma: 1.00
    DPMS levels: Standby Suspend Off
    RGB color display
  Color Characteristics:
    Red  : 0.6250, 0.3398
    Green: 0.2900, 0.6054
    Blue : 0.1503, 0.0703
    White: 0.2832, 0.2968
  Established Timings I & II:
    IBM     :   720x400    70.081663 Hz   9:5     31.467 kHz     28.320000 MHz
    DMT 0x04:   640x480    59.940476 Hz   4:3     31.469 kHz     25.175000 MHz
    DMT 0x05:   640x480    72.808802 Hz   4:3     37.861 kHz     31.500000 MHz
    DMT 0x06:   640x480    75.000000 Hz   4:3     37.500 kHz     31.500000 MHz
    DMT 0x09:   800x600    60.316541 Hz   4:3     37.879 kHz     40.000000 MHz
    DMT 0x0a:   800x600    72.187572 Hz   4:3     48.077 kHz     50.000000 MHz
    DMT 0x0b:   800x600    75.000000 Hz   4:3     46.875 kHz     49.500000 MHz
    DMT 0x10:  1024x768    60.003840 Hz   4:3     48.363 kHz     65.000000 MHz
    DMT 0x11:  1024x768    70.069359 Hz   4:3     56.476 kHz     75.000000 MHz
    DMT 0x12:  1024x768    75.028582 Hz   4:3     60.023 kHz     78.750000 MHz
  Standard Timings: none
  Detailed Timing Descriptors:
    Display Range Limits:
      Monitor ranges (GTF): 59-76 Hz V, 30-70 kHz H, max dotclock 80 MHz
    Display Product Name: 'PV520'
    Alphanumeric Data String: 'LKC15XA'
    Alphanumeric Data String: 'BE SMILE END'
Checksum: 0x6a

----------------

Warnings:

Block 0, Base EDID:
  EDID Structure Version & Revision: EDID 1.1 is deprecated, do not use.

Failures:

EDID:
  Extension Block 1 started with EDID header, ignoring Extension Blocks >= 1.

EDID conformity: FAIL
