edid-decode (hex):

00 ff ff ff ff ff ff 00 4c 2d 7b 00 30 30 30 30
16 0c 01 03 80 5c 34 8c 0a 6f 8b a2 5a 4d 94 24
1a 51 56 af ce 00 31 59 45 59 31 40 01 01 01 01
01 01 01 01 01 01 64 19 00 40 41 00 26 30 18 88
36 00 98 06 32 00 00 18 4d 0c 50 d0 30 e0 11 10
10 58 13 00 98 06 32 00 00 1c 00 00 00 fd 00 32
55 1c 3d 08 00 0a 20 20 20 20 20 20 00 00 00 fc
00 53 41 4d 53 55 4e 47 20 50 44 50 0a 20 00 90

----------------

Block 0, Base EDID:
  EDID Structure Version & Revision: 1.3
  Vendor & Product Identification:
    Manufacturer: SAM
    Model: 123
    Serial Number: ...
    Made in: week 22 of 2002
  Basic Display Parameters & Features:
    Digital display
    Maximum image size: 92 cm x 52 cm
    Gamma: 2.40
    RGB color display
    First detailed timing is the preferred timing
  Color Characteristics:
    Red  : 0.6337, 0.3535
    Green: 0.3037, 0.5810
    Blue : 0.1425, 0.1015
    White: 0.3183, 0.3388
  Established Timings I & II:
    IBM     :   720x400    70.081663 Hz   9:5     31.467 kHz     28.320000 MHz
    DMT 0x04:   640x480    59.940476 Hz   4:3     31.469 kHz     25.175000 MHz
    DMT 0x05:   640x480    72.808802 Hz   4:3     37.861 kHz     31.500000 MHz
    DMT 0x06:   640x480    75.000000 Hz   4:3     37.500 kHz     31.500000 MHz
    DMT 0x08:   800x600    56.250000 Hz   4:3     35.156 kHz     36.000000 MHz
    DMT 0x09:   800x600    60.316541 Hz   4:3     37.879 kHz     40.000000 MHz
    DMT 0x0a:   800x600    72.187572 Hz   4:3     48.077 kHz     50.000000 MHz
    DMT 0x0b:   800x600    75.000000 Hz   4:3     46.875 kHz     49.500000 MHz
    DMT 0x10:  1024x768    60.003840 Hz   4:3     48.363 kHz     65.000000 MHz
    DMT 0x11:  1024x768    70.069359 Hz   4:3     56.476 kHz     75.000000 MHz
    DMT 0x12:  1024x768    75.028582 Hz   4:3     60.023 kHz     78.750000 MHz
  Standard Timings:
    DMT 0x07:   640x480    85.008312 Hz   4:3     43.269 kHz     36.000000 MHz
    DMT 0x0c:   800x600    85.061274 Hz   4:3     53.674 kHz     56.250000 MHz
    DMT 0x04:   640x480    59.940476 Hz   4:3     31.469 kHz     25.175000 MHz
  Detailed Timing Descriptors:
    DTD 1:  1024x768    60.003840 Hz   4:3     48.363 kHz     65.000000 MHz (920 mm x 518 mm)
                 Hfront   24 Hsync 136 Hback  160 Hpol N
                 Vfront    3 Vsync   6 Vback   29 Vpol N
    DTD 2:   848x480    60.000152 Hz  53:30    29.820 kHz     31.490000 MHz (920 mm x 518 mm)
                 Hfront   16 Hsync  88 Hback  104 Hpol N
                 Vfront    1 Vsync   3 Vback   13 Vpol P
    Display Range Limits:
      Monitor ranges (GTF): 50-85 Hz V, 28-61 kHz H, max dotclock 80 MHz
    Display Product Name: 'SAMSUNG PDP'
Checksum: 0x90

----------------

Warnings:

Block 0, Base EDID:
  Detailed Timing Descriptor #1: Image size is 920x518 mm, but based on the picture AR it should be 920x690 mm.

EDID conformity: PASS
