edid-decode (hex):

00 ff ff ff ff ff ff 00 09 e5 5d 0c 00 00 00 00
19 21 01 04 b5 22 15 78 07 0e 25 a4 55 4a 9c 25
0e 50 54 00 00 00 01 01 01 01 01 01 01 01 01 01
01 01 01 01 01 01 ff 6b 00 a0 a0 40 5e 60 30 20
36 00 58 d7 10 00 00 1a 00 00 00 fd 00 30 78 cb
cb 37 01 0a 20 20 20 20 20 20 00 00 00 fc 00 4e
45 31 36 30 51 44 4d 2d 4e 58 33 0a 00 00 00 fe
00 42 4f 45 20 43 51 0a 20 20 20 20 20 20 01 dd

70 20 79 02 00 22 00 28 d9 6f 08 85 ff 09 9f 00
2f 00 1f 00 3f 06 5d 00 02 00 05 00 f0 5f 03 85
ff 09 9f 00 2f 00 1f 00 3f 06 5d 00 02 00 05 00
00 00 00 00 00 00 00 00 00 00 00 00 00 00 00 00
00 00 00 00 00 00 00 00 00 00 00 00 00 00 00 00
00 00 00 00 00 00 00 00 00 00 00 00 00 00 00 00
00 00 00 00 00 00 00 00 00 00 00 00 00 00 00 00
00 00 00 00 00 00 00 00 00 00 00 00 00 00 33 90

00 ff ff ff ff ff ff 00 09 e5 5d 0c 00 00 00 00
19 21 01 04 b5 22 15 78 07 0e 25 a4 55 4a 9c 25
0e 50 54 00 00 00 01 01 01 01 01 01 01 01 01 01
01 01 01 01 01 01 ff 6b 00 a0 a0 40 5e 60 30 20
36 00 58 d7 10 00 00 1a 00 00 00 fd 00 30 78 cb
cb 37 01 0a 20 20 20 20 20 20 00 00 00 fc 00 4e
45 31 36 30 51 44 4d 2d 4e 58 33 0a 00 00 00 fe
00 42 4f 45 20 43 51 0a 20 20 20 20 20 20 01 dd

70 20 79 02 00 22 00 28 d9 6f 08 85 ff 09 9f 00
2f 00 1f 00 3f 06 5d 00 02 00 05 00 f0 5f 03 85
ff 09 9f 00 2f 00 1f 00 3f 06 5d 00 02 00 05 00
00 00 00 00 00 00 00 00 00 00 00 00 00 00 00 00
00 00 00 00 00 00 00 00 00 00 00 00 00 00 00 00
00 00 00 00 00 00 00 00 00 00 00 00 00 00 00 00
00 00 00 00 00 00 00 00 00 00 00 00 00 00 00 00
00 00 00 00 00 00 00 00 00 00 00 00 00 00 33 90

----------------

Block 0, Base EDID:
  EDID Structure Version & Revision: 1.4
  Vendor & Product Identification:
    Manufacturer: BOE
    Model: 3165
    Made in: week 25 of 2023
  Basic Display Parameters & Features:
    Digital display
    Bits per primary color channel: 10
    DisplayPort interface
    Maximum image size: 34 cm x 21 cm
    Gamma: 2.20
    Supported color formats: RGB 4:4:4
    Default (sRGB) color space is primary color space
    First detailed timing includes the native pixel format and preferred refresh rate
    Display supports continuous frequencies
  Color Characteristics:
    Red  : 0.6406, 0.3320
    Green: 0.2919, 0.6113
    Blue : 0.1445, 0.0566
    White: 0.3134, 0.3291
  Established Timings I & II: none
  Standard Timings: none
  Detailed Timing Descriptors:
    DTD 1:  2560x1600   60.001997 Hz  16:10   101.643 kHz    276.470000 MHz (344 mm x 215 mm)
                 Hfront   48 Hsync  32 Hback   80 Hpol P
                 Vfront    3 Vsync   6 Vback   85 Vpol N
    Display Range Limits:
      Monitor ranges (Range Limits Only): 48-120 Hz V, 203-203 kHz H, max dotclock 550 MHz
    Display Product Name: 'NE160QDM-NX3'
    Alphanumeric Data String: 'BOE CQ'
  Extension blocks: 1
Checksum: 0xdd

----------------

Block 1, DisplayID Extension Block:
  Version: 2.0
  Extension Count: 0
  Display Product Primary Use Case: None of the listed primary use cases; generic display
  Video Timing Modes Type 7 - Detailed Timings Data Block:
    DTD:  2560x1600  120.000087 Hz  16:10   203.280 kHz    552.922000 MHz (aspect 16:10, no 3D stereo, preferred)
               Hfront   48 Hsync  32 Hback   80 Hpol N
               Vfront    3 Vsync   6 Vback   85 Vpol N
    DTD:  2560x1600   48.000078 Hz  16:10    81.312 kHz    221.169000 MHz (aspect 16:10, no 3D stereo, preferred)
               Hfront   48 Hsync  32 Hback   80 Hpol N
               Vfront    3 Vsync   6 Vback   85 Vpol N
  Checksum: 0x33
Checksum: 0x90

----------------

Warnings:

EDID:
  Base EDID: Some timings are out of range of the Monitor Ranges:
    Horizontal Freq: 81.312 - 203.280 kHz (Monitor: 203.000 - 203.000 kHz)
    Maximum Clock: 552.922 MHz (Monitor: 550.000 MHz)

Failures:

Block 0, Base EDID:
  Basic Display Parameters & Features: sRGB is signaled, but the chromaticities do not match.
EDID:
  Extension Block 2 started with EDID header, ignoring Extension Blocks >= 2.
  DisplayID: Missing DisplayID Display Parameters Data Block.

EDID conformity: FAIL
