edid-decode (hex):

00 ff ff ff ff ff ff 00 20 34 53 19 01 01 01 01
10 1e 01 03 80 2b 18 78 ea de 50 a3 54 4c 99 26
0f 50 54 a5 4b 00 81 80 a9 40 d1 c0 8b 00 01 01
01 01 01 01 01 01 02 3a 80 18 71 38 2d 40 58 2c
45 00 b0 f3 10 00 00 1e 00 00 00 ff 00 00 0a 20
20 20 20 20 20 20 20 20 20 20 00 00 00 fc 00 4b
61 6d 76 61 73 20 50 72 6f 20 32 30 00 00 00 fd
00 31 4c 1e 51 11 00 0a 20 20 20 20 20 20 01 26

02 03 00 b1 40 20 67 03 0c 00 10 00 38 2d 80 e3
05 03 01 02 3a 80 18 71 38 2d 40 58 2c 45 00 06
44 21 00 00 1e 01 1d 00 72 51 d0 1e 20 6e 28 55
00 06 44 21 00 00 1e 8c 0a d0 8a 20 e0 2d 10 10
3e 96 00 06 44 21 00 00 18 00 00 00 00 00 00 00
00 00 00 00 00 00 00 00 00 00 00 00 00 00 00 00
00 00 00 00 00 00 00 00 00 00 00 00 00 00 00 00
00 00 00 00 00 00 00 00 00 00 00 00 00 00 00 60

00 ff ff ff ff ff ff 00 20 34 53 19 01 01 01 01
10 1e 01 03 80 2b 18 78 ea de 50 a3 54 4c 99 26
0f 50 54 a5 4b 00 81 80 a9 40 d1 c0 8b 00 01 01
01 01 01 01 01 01 02 3a 80 18 71 38 2d 40 58 2c
45 00 b0 f3 10 00 00 1e 00 00 00 ff 00 00 0a 20
20 20 20 20 20 20 20 20 20 20 00 00 00 fc 00 4b
61 6d 76 61 73 20 50 72 6f 20 32 30 00 00 00 fd
00 31 4c 1e 51 11 00 0a 20 20 20 20 20 20 01 26

02 03 00 b1 40 20 67 03 0c 00 10 00 38 2d 80 e3
05 03 01 02 3a 80 18 71 38 2d 40 58 2c 45 00 06
44 21 00 00 1e 01 1d 00 72 51 d0 1e 20 6e 28 55
00 06 44 21 00 00 1e 8c 0a d0 8a 20 e0 2d 10 10
3e 96 00 06 44 21 00 00 18 00 00 00 00 00 00 00
00 00 00 00 00 00 00 00 00 00 00 00 00 00 00 00
00 00 00 00 00 00 00 00 00 00 00 00 00 00 00 00
00 00 00 00 00 00 00 00 00 00 00 00 00 00 00 60

----------------

Block 0, Base EDID:
  EDID Structure Version & Revision: 1.3
  Vendor & Product Identification:
    Manufacturer: HAT
    Model: 6483
    Serial Number: ...
    Made in: week 16 of 2020
  Basic Display Parameters & Features:
    Digital display
    Maximum image size: 43 cm x 24 cm
    Gamma: 2.20
    DPMS levels: Standby Suspend Off
    RGB color display
    First detailed timing is the preferred timing
  Color Characteristics:
    Red  : 0.6396, 0.3291
    Green: 0.2998, 0.5996
    Blue : 0.1494, 0.0595
    White: 0.3125, 0.3281
  Established Timings I & II:
    IBM     :   720x400    70.081663 Hz   9:5     31.467 kHz     28.320000 MHz
    DMT 0x04:   640x480    59.940476 Hz   4:3     31.469 kHz     25.175000 MHz
    DMT 0x06:   640x480    75.000000 Hz   4:3     37.500 kHz     31.500000 MHz
    DMT 0x09:   800x600    60.316541 Hz   4:3     37.879 kHz     40.000000 MHz
    DMT 0x0b:   800x600    75.000000 Hz   4:3     46.875 kHz     49.500000 MHz
    DMT 0x10:  1024x768    60.003840 Hz   4:3     48.363 kHz     65.000000 MHz
    DMT 0x12:  1024x768    75.028582 Hz   4:3     60.023 kHz     78.750000 MHz
    DMT 0x24:  1280x1024   75.024675 Hz   5:4     79.976 kHz    135.000000 MHz
  Standard Timings:
    DMT 0x23:  1280x1024   60.019740 Hz   5:4     63.981 kHz    108.000000 MHz
    DMT 0x33:  1600x1200   60.000000 Hz   4:3     75.000 kHz    162.000000 MHz
    DMT 0x52:  1920x1080   60.000000 Hz  16:9     67.500 kHz    148.500000 MHz
    GTF     :  1360x850    60.000254 Hz  16:10    52.800 kHz     94.618000 MHz
  Detailed Timing Descriptors:
    DTD 1:  1920x1080   60.000000 Hz  16:9     67.500 kHz    148.500000 MHz (432 mm x 243 mm)
                 Hfront   88 Hsync  44 Hback  148 Hpol P
                 Vfront    4 Vsync   5 Vback   36 Vpol P
    Display Product Serial Number: ...
    Display Product Name: 'Kamvas Pro 20'
    Display Range Limits:
      Monitor ranges (GTF): 49-76 Hz V, 30-81 kHz H, max dotclock 170 MHz
  Extension blocks: 1
Checksum: 0x26

----------------

Block 1, CTA-861 Extension Block:
  Revision: 3
  Underscans IT Video Formats by default
  Supports YCbCr 4:4:4
  Supports YCbCr 4:2:2
  Native detailed modes: 1
Checksum: 0x60

----------------

Block 2, Unknown EDID Extension Block 0x00:
  00 ff ff ff ff ff ff 00 20 34 53 19 01 01 01 01 '........ 4S.....'
  10 1e 01 03 80 2b 18 78 ea de 50 a3 54 4c 99 26 '.....+.x..P.TL.&'
  0f 50 54 a5 4b 00 81 80 a9 40 d1 c0 8b 00 01 01 '.PT.K....@......'
  01 01 01 01 01 01 02 3a 80 18 71 38 2d 40 58 2c '.......:..q8-@X,'
  45 00 b0 f3 10 00 00 1e 00 00 00 ff 00 00 0a 20 'E.............. '
  20 20 20 20 20 20 20 20 20 20 00 00 00 fc 00 4b '          .....K'
  61 6d 76 61 73 20 50 72 6f 20 32 30 00 00 00 fd 'amvas Pro 20....'
  00 31 4c 1e 51 11 00 0a 20 20 20 20 20 20 01 26 '.1L.Q...      .&'
Checksum: 0x26

----------------

Block 3, CTA-861 Extension Block:
  Revision: 3
  Underscans IT Video Formats by default
  Supports YCbCr 4:4:4
  Supports YCbCr 4:2:2
  Native detailed modes: 1
Checksum: 0x60

----------------

Warnings:

Block 0, Base EDID:
  Vendor & Product Identification: The serial number is one of the known dummy values, it should probably be set to 0.
  Detailed Timing Descriptor #1: DTD is identical to VIC 16, which is not present in the CTA Ext Block.
Block 1, CTA-861 Extension Block:
  Display Product Serial Number is set, so the Serial Number in the Base EDID should be 0.
  Add a Colorimetry Data Block with the sRGB colorimetry bit set to avoid interop issues.

Failures:

Block 0, Base EDID:
  Display Product Serial Number: ...
Block 1, CTA-861 Extension Block:
  Padding: Contains non-zero bytes.
  Missing VCDB, needed for Set Selectable RGB Quantization to avoid interop issues.
Block 2, Base EDID:
  Unknown Extension Block.
Block 3, CTA-861 Extension Block:
  Padding: Contains non-zero bytes.
EDID:
  Base EDID: EDID specified 1 extension block(s), but found 3 extension block(s).
  Base EDID: EDID 1.3 requires a Block Map Extension in Block 1 if there are more than 2 blocks in the EDID.

EDID conformity: FAIL
