edid-decode (hex):

00 ff ff ff ff ff ff 00 66 88 56 01 00 00 00 00
16 1c 01 03 80 1e 1a 78 3e 64 35 a5 54 4f 9e 27
12 50 54 bf ef 80 d1 c0 d1 e8 d1 fc 95 00 90 40
81 80 81 40 81 c0 d8 91 80 a0 c0 08 34 70 30 20
35 00 2c 04 11 00 00 1a 00 00 00 fc 00 48 53 2d
31 35 36 4b 50 0a 20 20 20 20 00 00 00 ff 00 0a
20 20 20 20 20 20 20 20 20 20 20 20 00 00 00 fd
00 18 90 0f de 3c 00 0a 20 20 20 20 20 20 01 98

02 03 61 f1 56 04 05 10 13 14 1f 20 21 22 27 48
49 4a 4b 4c 5d 5e 5f 60 61 00 00 e3 05 c0 00 23
09 7f 07 83 01 00 00 e5 0f 00 00 0c 00 6a 03 0c
00 10 00 38 78 20 00 00 67 d8 5d c4 01 78 88 01
e6 06 05 01 69 69 4f 68 1a 00 00 01 00 30 3c e6
3a 80 18 71 38 2d 40 58 2c 25 00 55 50 21 00 00
1e ec 48 80 a0 c0 08 34 70 30 20 35 00 2c 04 11
00 00 7f 00 00 00 00 00 00 00 00 00 00 00 00 22

----------------

Block 0, Base EDID:
  EDID Structure Version & Revision: 1.3
  Vendor & Product Identification:
    Manufacturer: YTH
    Model: 342
    Made in: week 22 of 2018
  Basic Display Parameters & Features:
    Digital display
    Maximum image size: 30 cm x 26 cm
    Gamma: 2.20
    DPMS levels: Off
    Undefined display color type
    Default (sRGB) color space is primary color space
    First detailed timing is the preferred timing
  Color Characteristics:
    Red  : 0.6455, 0.3300
    Green: 0.3095, 0.6171
    Blue : 0.1523, 0.0732
    White: 0.3134, 0.3291
  Established Timings I & II:
    IBM     :   720x400    70.081663 Hz   9:5     31.467 kHz     28.320000 MHz
    DMT 0x04:   640x480    59.940476 Hz   4:3     31.469 kHz     25.175000 MHz
    Apple   :   640x480    66.666667 Hz   4:3     35.000 kHz     30.240000 MHz
    DMT 0x05:   640x480    72.808802 Hz   4:3     37.861 kHz     31.500000 MHz
    DMT 0x06:   640x480    75.000000 Hz   4:3     37.500 kHz     31.500000 MHz
    DMT 0x08:   800x600    56.250000 Hz   4:3     35.156 kHz     36.000000 MHz
    DMT 0x09:   800x600    60.316541 Hz   4:3     37.879 kHz     40.000000 MHz
    DMT 0x0a:   800x600    72.187572 Hz   4:3     48.077 kHz     50.000000 MHz
    DMT 0x0b:   800x600    75.000000 Hz   4:3     46.875 kHz     49.500000 MHz
    Apple   :   832x624    74.551266 Hz   4:3     49.726 kHz     57.284000 MHz
    DMT 0x10:  1024x768    60.003840 Hz   4:3     48.363 kHz     65.000000 MHz
    DMT 0x11:  1024x768    70.069359 Hz   4:3     56.476 kHz     75.000000 MHz
    DMT 0x12:  1024x768    75.028582 Hz   4:3     60.023 kHz     78.750000 MHz
    DMT 0x24:  1280x1024   75.024675 Hz   5:4     79.976 kHz    135.000000 MHz
    Apple   :  1152x870    75.061550 Hz 192:145   68.681 kHz    100.000000 MHz
  Standard Timings:
    DMT 0x52:  1920x1080   60.000000 Hz  16:9     67.500 kHz    148.500000 MHz
    GTF     :  1920x1080  100.000000 Hz  16:9    114.400 kHz    302.016000 MHz
    GTF     :  1920x1080  119.999987 Hz  16:9    138.840 kHz    368.759000 MHz
    DMT 0x2f:  1440x900    59.887445 Hz  16:10    55.935 kHz    106.500000 MHz
    DMT 0x2a:  1400x1050   59.978442 Hz   4:3     65.317 kHz    121.750000 MHz
    DMT 0x23:  1280x1024   60.019740 Hz   5:4     63.981 kHz    108.000000 MHz
    DMT 0x20:  1280x960    60.000000 Hz   4:3     60.000 kHz    108.000000 MHz
    DMT 0x55:  1280x720    60.000000 Hz  16:9     45.000 kHz     74.250000 MHz
  Detailed Timing Descriptors:
    DTD 1:  3200x1800   59.999486 Hz  16:9    111.119 kHz    373.360000 MHz (300 mm x 260 mm)
                 Hfront   48 Hsync  32 Hback   80 Hpol P
                 Vfront    3 Vsync   5 Vback   44 Vpol N
    Display Product Name: 'HS-156KP'
    Display Product Serial Number: ...
    Display Range Limits:
      Monitor ranges (GTF): 24-144 Hz V, 15-222 kHz H, max dotclock 600 MHz
  Extension blocks: 1
Checksum: 0x98

----------------

Block 1, CTA-861 Extension Block:
  Revision: 3
  Underscans IT Video Formats by default
  Basic audio support
  Supports YCbCr 4:4:4
  Supports YCbCr 4:2:2
  Native DTDs: 1
  Video Data Block:
    VIC   4:  1280x720    60.000000 Hz  16:9     45.000 kHz     74.250000 MHz
    VIC   5:  1920x1080i  60.000000 Hz  16:9     33.750 kHz     74.250000 MHz
    VIC  16:  1920x1080   60.000000 Hz  16:9     67.500 kHz    148.500000 MHz
    VIC  19:  1280x720    50.000000 Hz  16:9     37.500 kHz     74.250000 MHz
    VIC  20:  1920x1080i  50.000000 Hz  16:9     28.125 kHz     74.250000 MHz
    VIC  31:  1920x1080   50.000000 Hz  16:9     56.250 kHz    148.500000 MHz
    VIC  32:  1920x1080   24.000000 Hz  16:9     27.000 kHz     74.250000 MHz
    VIC  33:  1920x1080   25.000000 Hz  16:9     28.125 kHz     74.250000 MHz
    VIC  34:  1920x1080   30.000000 Hz  16:9     33.750 kHz     74.250000 MHz
    VIC  39:  1920x1080i  50.000000 Hz  16:9     31.250 kHz     72.000000 MHz
    VIC  72:  1920x1080   24.000000 Hz  64:27    27.000 kHz     74.250000 MHz
    VIC  73:  1920x1080   25.000000 Hz  64:27    28.125 kHz     74.250000 MHz
    VIC  74:  1920x1080   30.000000 Hz  64:27    33.750 kHz     74.250000 MHz
    VIC  75:  1920x1080   50.000000 Hz  64:27    56.250 kHz    148.500000 MHz
    VIC  76:  1920x1080   60.000000 Hz  64:27    67.500 kHz    148.500000 MHz
    VIC  93:  3840x2160   24.000000 Hz  16:9     54.000 kHz    297.000000 MHz
    VIC  94:  3840x2160   25.000000 Hz  16:9     56.250 kHz    297.000000 MHz
    VIC  95:  3840x2160   30.000000 Hz  16:9     67.500 kHz    297.000000 MHz
    VIC  96:  3840x2160   50.000000 Hz  16:9    112.500 kHz    594.000000 MHz
    VIC  97:  3840x2160   60.000000 Hz  16:9    135.000 kHz    594.000000 MHz
  Colorimetry Data Block:
    BT2020YCC
    BT2020RGB
  Audio Data Block:
    Linear PCM:
      Max channels: 2
      Supported sample rates (kHz): 192 176.4 96 88.2 48 44.1 32
      Supported sample sizes (bits): 24 20 16
  Speaker Allocation Data Block:
    FL/FR - Front Left/Right
  YCbCr 4:2:0 Capability Map Data Block:
    VIC  96:  3840x2160   50.000000 Hz  16:9    112.500 kHz    594.000000 MHz
    VIC  97:  3840x2160   60.000000 Hz  16:9    135.000 kHz    594.000000 MHz
  Vendor-Specific Data Block (HDMI), OUI 00-0C-03:
    Source physical address: 1.0.0.0
    DC_36bit
    DC_30bit
    DC_Y444
    Maximum TMDS clock: 600 MHz
    Extended HDMI video details:
  Vendor-Specific Data Block (HDMI Forum), OUI C4-5D-D8:
    Version: 1
    Maximum TMDS Character Rate: 600 MHz
    SCDC Present
    Supports scrambling for <= 340 Mcsc
    Supports 10-bits/component Deep Color 4:2:0 Pixel Encoding
  HDR Static Metadata Data Block:
    Electro optical transfer functions:
      Traditional gamma - SDR luminance range
      SMPTE ST2084
    Supported static metadata descriptors:
      Static metadata type 1
    Desired content max luminance: 105 (486.099 cd/m^2)
    Desired content max frame-average luminance: 105 (486.099 cd/m^2)
    Desired content min luminance: 79 (0.467 cd/m^2)
  Vendor-Specific Data Block (AMD), OUI 00-00-1A:
    Version: 1
    Flags 1: 0x00
    Minimum Refresh Rate: 48 Hz
    Maximum Refresh Rate: 60 Hz
    MCCS VCP Code: 0xe6
  Audio Data Block:
  Detailed Timing Descriptors:
    DTD 2:  3200x1800   29.999743 Hz  16:9     55.560 kHz    186.680000 MHz (side by side interleaved, 300 mm x 260 mm)
                 Hfront   48 Hsync  32 Hback   80 Hpol P
                 Vfront    3 Vsync   5 Vback   44 Vpol P
Checksum: 0x22  Unused space in Extension Block: 12 bytes

----------------

Warnings:

Block 0, Base EDID:
  Detailed Timing Descriptor #1: Image size is 300x260 mm, but based on the picture AR it should be 300x168 mm.
Block 1, CTA-861 Extension Block:
  Video Data Block: VIC 4 and the first DTD are not identical. Is this intended?
  Video Data Block: All VICs are in ascending order, and the first (preferred) VIC <= 4, is that intended?
  Detailed Timing Descriptor #2: Image size is 300x260 mm, but based on the picture AR it should be 300x168 mm.

Failures:

Block 0, Base EDID:
  Display Product Serial Number: ...
  Basic Display Parameters & Features: sRGB is signaled, but the chromaticities do not match.
Block 1, CTA-861 Extension Block:
  Vendor-Specific Data Block (HDMI), OUI 00-0C-03: HDMI VSDB Max TMDS rate is > 340.
  Audio Data Block: Broken CTA-861 audio block length 26.
  Offset is 97, but should be 107.
  Missing VCDB, needed for Set Selectable RGB Quantization to avoid interop issues.

EDID conformity: FAIL
