edid-decode (hex):

00 ff ff ff ff ff ff 00 06 af 3d 1e 00 00 00 00
00 19 01 04 95 1f 11 78 02 67 75 93 57 58 8e 29
21 50 54 00 00 00 01 01 01 01 01 01 01 01 01 01
01 01 01 01 01 01 b0 36 80 ae 70 38 22 40 30 64
31 00 35 ad 10 00 00 18 c0 2b 80 ae 70 38 22 40
30 64 31 00 35 ad 10 00 00 1a 00 00 00 fe 00 41
55 4f 0a 20 20 20 20 20 20 20 20 20 00 00 00 fe
00 42 31 34 30 48 54 4e 30 31 2e 45 20 0a 00 44

----------------

Block 0, Base EDID:
  EDID Structure Version & Revision: 1.4
  Vendor & Product Identification:
    Manufacturer: AUO
    Model: 7741
    Made in: 2015
  Basic Display Parameters & Features:
    Digital display
    Bits per primary color channel: 6
    DisplayPort interface
    Maximum image size: 31 cm x 17 cm
    Gamma: 2.20
    Supported color formats: RGB 4:4:4
    First detailed timing includes the native pixel format and preferred refresh rate
  Color Characteristics:
    Red  : 0.5751, 0.3417
    Green: 0.3447, 0.5576
    Blue : 0.1611, 0.1318
    White: 0.3134, 0.3291
  Established Timings I & II: none
  Standard Timings: none
  Detailed Timing Descriptors:
    DTD 1:  1920x1080   60.015878 Hz  16:9     66.858 kHz    140.000000 MHz (309 mm x 173 mm)
                 Hfront   48 Hsync 100 Hback   26 Hpol N
                 Vfront    3 Vsync   1 Vback   30 Vpol N
    DTD 2:  1920x1080   48.012703 Hz  16:9     53.486 kHz    112.000000 MHz (309 mm x 173 mm)
                 Hfront   48 Hsync 100 Hback   26 Hpol P
                 Vfront    3 Vsync   1 Vback   30 Vpol N
    Alphanumeric Data String: 'AUO'
    Alphanumeric Data String: 'B140HTN01.E '
Checksum: 0x44

----------------

Warnings:

Block 0, Base EDID:
  Missing Display Product Name.

Failures:

Block 0, Base EDID:
  Alphanumeric Data String: One or more trailing spaces before newline.

EDID conformity: FAIL
