edid-decode (hex):

00 ff ff ff ff ff ff 00 30 e4 b1 07 00 00 00 00
00 22 01 04 a5 27 18 78 03 08 05 ae 52 42 b2 25
0e 50 54 00 00 00 01 01 01 01 01 01 01 01 01 01
01 01 01 01 01 01 0f 6c 00 a0 a0 40 5f 60 30 20
76 04 84 f2 10 00 00 1a 00 00 00 fd 00 1e 78 cb
cb 38 01 0a 20 20 20 20 20 20 00 00 00 fe 00 43
58 4a 33 38 80 31 38 30 57 51 31 0a 00 00 00 00
00 02 41 1c b2 00 03 00 00 0b 41 0a 20 20 01 87

70 20 79 02 00 20 00 13 3c e6 24 b1 07 00 00 00
00 00 18 07 31 38 30 57 51 31 0a 21 01 1d 26 0f
78 09 00 0a 40 06 88 e1 fa 51 29 f4 b1 52 12 0e
02 45 54 d0 5f d0 5f 55 35 12 78 22 00 14 21 71
08 85 ff 09 9f 00 2f 80 1f 00 3f 06 5e 00 16 00
05 00 2b 00 06 27 00 1e 77 00 00 2e 00 06 40 4e
d0 5f d0 5f 00 00 00 00 00 00 00 00 00 00 00 00
00 00 00 00 00 00 00 00 00 00 00 00 00 00 be 90

00 ff ff ff ff ff ff 00 30 e4 b1 07 00 00 00 00
00 22 01 04 a5 27 18 78 03 08 05 ae 52 42 b2 25
0e 50 54 00 00 00 01 01 01 01 01 01 01 01 01 01
01 01 01 01 01 01 0f 6c 00 a0 a0 40 5f 60 30 20
76 04 84 f2 10 00 00 1a 00 00 00 fd 00 1e 78 cb
cb 38 01 0a 20 20 20 20 20 20 00 00 00 fe 00 43
58 4a 33 38 80 31 38 30 57 51 31 0a 00 00 00 00
00 02 41 1c b2 00 03 00 00 0b 41 0a 20 20 01 87

70 20 79 02 00 20 00 13 3c e6 24 b1 07 00 00 00
00 00 18 07 31 38 30 57 51 31 0a 21 01 1d 26 0f
78 09 00 0a 40 06 88 e1 fa 51 29 f4 b1 52 12 0e
02 45 54 d0 5f d0 5f 55 35 12 78 22 00 14 21 71
08 85 ff 09 9f 00 2f 80 1f 00 3f 06 5e 00 16 00
05 00 2b 00 06 27 00 1e 77 00 00 2e 00 06 40 4e
d0 5f d0 5f 00 00 00 00 00 00 00 00 00 00 00 00
00 00 00 00 00 00 00 00 00 00 00 00 00 00 be 90

----------------

Block 0, Base EDID:
  EDID Structure Version & Revision: 1.4
  Vendor & Product Identification:
    Manufacturer: LGD
    Model: 1969
    Made in: 2024
  Basic Display Parameters & Features:
    Digital display
    Bits per primary color channel: 8
    DisplayPort interface
    Maximum image size: 39 cm x 24 cm
    Gamma: 2.20
    Supported color formats: RGB 4:4:4
    First detailed timing includes the native pixel format and preferred refresh rate
    Display supports continuous frequencies
  Color Characteristics:
    Red  : 0.6796, 0.3203
    Green: 0.2597, 0.6953
    Blue : 0.1445, 0.0546
    White: 0.3134, 0.3291
  Established Timings I & II: none
  Standard Timings: none
  Detailed Timing Descriptors:
    DTD 1:  2560x1600   60.001301 Hz  16:10   101.702 kHz    276.630000 MHz (388 mm x 242 mm)
                 Hfront   48 Hsync  32 Hback   80 Hpol P
                 Vfront   23 Vsync   6 Vback   66 Vpol N
    Display Range Limits:
      Monitor ranges (Range Limits Only): 30-120 Hz V, 203-203 kHz H, max dotclock 560 MHz
    Alphanumeric Data String: 'CXJ38.180WQ1'
    Manufacturer-Specified Display Descriptor (0x00): 00 00 00 02 41 1c b2 00 03 00 00 0b 41 0a 20 20 '....A.......A.  '
  Extension blocks: 1
Checksum: 0x87

----------------

Block 1, DisplayID Extension Block:
  Version: 2.0
  Extension Count: 0
  Display Product Primary Use Case: None of the listed primary use cases; generic display
  Product Identification Data Block (0x20), OUI 3C-E6-24:
    Product Code: 1969
    Year of Manufacture: 2024
    Product ID: 180WQ1

  Display Parameters Data Block (0x21):
    Image size: 387.8 mm x 242.4 mm
    Display native pixel format: 2560x1600
    Scan Orientation: Left to Right, Top to Bottom
    Luminance Information: Guidance for the Source device
    Color Information: CIE 1931
    Audio Speaker Information: not integrated
    Native Color Chromaticity:
      Primary #1:  (0.679932, 0.320068)
      Primary #2:  (0.260010, 0.695068)
      Primary #3:  (0.145020, 0.054932)
      White Point: (0.312988, 0.329102)
    Native Maximum Luminance (Full Coverage): 500.000000 cd/m^2
    Native Maximum Luminance (10% Rectangular Coverage): 500.000000 cd/m^2
    Native Minimum Luminance: 0.333252 cd/m^2
    Native Color Depth: 8 bpc
    Display Device Technology: Active Matrix LCD
    Display Device Theme Preference: No Preference
    Native Gamma EOTF: 2.20
  Video Timing Modes Type 7 - Detailed Timings Data Block:
    DTD:  2560x1600  120.000434 Hz  16:10   203.401 kHz    553.250000 MHz (aspect 16:10, no 3D stereo, preferred)
               Hfront   48 Hsync  32 Hback   80 Hpol P
               Vfront   23 Vsync   6 Vback   66 Vpol N
  Adaptive Sync Data Block:
    Descriptor #1:
      Native Panel Range
      Fixed Average V-Total and Adaptive V-Total
      Supports Seamless Transition
      'Max Single Frame Duration Increase' field value without jitter impact
      'Max Single Frame Duration Decrease' field value without jitter impact
      Max Duration Increase: 0.00 ms
      Max Duration Decrease: 0.00 ms
      Min Refresh Rate: 30 Hz
      Max Refresh Rate: 120 Hz
  Brightness Luminance Range Data Block:
    Minimum SDR Luminance (Full Coverage): 25.000000 cd/m^2
    Maximum Suggested SDR Luminance (Full Coverage): 500.000000 cd/m^2
    Maximum Boost SDR Luminance: 500.000000 cd/m^2
  Checksum: 0xbe
Checksum: 0x90

----------------

Warnings:

Block 0, Base EDID:
  Alphanumeric Data String: Non-ASCII character 0x80 at position 5, can cause problems.
  Missing Display Product Name.
EDID:
  Base EDID: Some timings are out of range of the Monitor Ranges:
    Horizontal Freq: 101.702 - 203.400 kHz (Monitor: 203.000 - 203.000 kHz)

Failures:

EDID:
  Extension Block 2 started with EDID header, ignoring Extension Blocks >= 2.

EDID conformity: FAIL
