edid-decode (hex):

00 ff ff ff ff ff ff 00 5c 85 50 60 ad 03 00 00
2f 13 01 03 80 47 28 78 0a 82 ff a6 55 46 98 24
0f 47 49 25 4a 00 8b c0 81 80 95 00 01 01 01 01
01 01 01 01 01 01 1b 21 50 a0 51 00 1e 30 48 88
35 00 c6 90 21 00 00 1c 9d 1c 56 82 50 00 30 30
28 20 35 00 c5 8f 21 00 00 1a 00 00 00 fd 00 32
4b 1e 46 0b 00 0a 20 20 20 20 20 20 00 00 00 fc
00 53 4b 2d 33 32 48 36 34 30 47 0a 20 20 01 94

02 03 1b 71 48 84 05 02 06 07 03 0e 0f 23 09 07
07 83 01 00 00 65 03 0c 00 10 00 20 1c 50 a0 50
00 16 30 30 20 35 00 c6 90 21 00 00 1a a9 1a 00
a0 50 00 16 30 30 20 37 00 c6 90 21 00 00 1a 7c
2e 90 a0 60 1a 1e 40 30 20 36 00 c6 90 21 00 00
1a f1 27 00 a0 51 00 25 30 50 80 37 00 c6 90 21
00 00 1c 00 00 00 00 00 00 00 00 00 00 00 00 00
00 00 00 00 00 00 00 00 00 00 00 00 00 00 00 83

00 ff ff ff ff ff ff 00 5c 85 50 60 ad 03 00 00
2f 13 01 03 80 47 28 78 0a 82 ff a6 55 46 98 24
0f 47 49 25 4a 00 8b c0 81 80 95 00 01 01 01 01
01 01 01 01 01 01 1b 21 50 a0 51 00 1e 30 48 88
35 00 c6 90 21 00 00 1c 9d 1c 56 82 50 00 30 30
28 20 35 00 c5 8f 21 00 00 1a 00 00 00 fd 00 32
4b 1e 46 0b 00 0a 20 20 20 20 20 20 00 00 00 fc
00 53 4b 2d 33 32 48 36 34 30 47 0a 20 20 01 94

02 03 1b 71 48 84 05 02 06 07 03 0e 0f 23 09 07
07 83 01 00 00 65 03 0c 00 10 00 20 1c 50 a0 50
00 16 30 30 20 35 00 c6 90 21 00 00 1a a9 1a 00
a0 50 00 16 30 30 20 37 00 c6 90 21 00 00 1a 7c
2e 90 a0 60 1a 1e 40 30 20 36 00 c6 90 21 00 00
1a f1 27 00 a0 51 00 25 30 50 80 37 00 c6 90 21
00 00 1c 00 00 00 00 00 00 00 00 00 00 00 00 00
00 00 00 00 00 00 00 00 00 00 00 00 00 00 00 83

----------------

Block 0, Base EDID:
  EDID Structure Version & Revision: 1.3
  Vendor & Product Identification:
    Manufacturer: WDE
    Model: 24656
    Serial Number: ...
    Made in: week 47 of 2009
  Basic Display Parameters & Features:
    Digital display
    Maximum image size: 71 cm x 40 cm
    Gamma: 2.20
    RGB color display
    First detailed timing is the preferred timing
  Color Characteristics:
    Red  : 0.6503, 0.3320
    Green: 0.2734, 0.5957
    Blue : 0.1435, 0.0615
    White: 0.2802, 0.2880
  Established Timings I & II:
    DMT 0x04:   640x480    59.940476 Hz   4:3     31.469 kHz     25.175000 MHz
    DMT 0x06:   640x480    75.000000 Hz   4:3     37.500 kHz     31.500000 MHz
    DMT 0x09:   800x600    60.316541 Hz   4:3     37.879 kHz     40.000000 MHz
    DMT 0x0b:   800x600    75.000000 Hz   4:3     46.875 kHz     49.500000 MHz
    DMT 0x10:  1024x768    60.003840 Hz   4:3     48.363 kHz     65.000000 MHz
    DMT 0x12:  1024x768    75.028582 Hz   4:3     60.023 kHz     78.750000 MHz
  Standard Timings:
    GTF     :  1360x765    60.000341 Hz  16:9     47.520 kHz     84.396000 MHz
    DMT 0x23:  1280x1024   60.019740 Hz   5:4     63.981 kHz    108.000000 MHz
    DMT 0x2f:  1440x900    59.887445 Hz  16:10    55.935 kHz    106.500000 MHz
  Detailed Timing Descriptors:
    DTD 1:  1360x768    59.798991 Hz  85:48    47.720 kHz     84.750000 MHz (710 mm x 400 mm)
                 Hfront   72 Hsync 136 Hback  208 Hpol N
                 Vfront    3 Vsync   5 Vback   22 Vpol P
    DTD 2:  1366x768    60.004784 Hz 683:384   48.964 kHz     73.250000 MHz (709 mm x 399 mm)
                 Hfront   40 Hsync  32 Hback   58 Hpol P
                 Vfront    3 Vsync   5 Vback   40 Vpol N
    Display Range Limits:
      Monitor ranges (GTF): 50-75 Hz V, 30-70 kHz H, max dotclock 110 MHz
    Display Product Name: 'SK-32H640G'
  Extension blocks: 1
Checksum: 0x94

----------------

Block 1, CTA-861 Extension Block:
  Revision: 3
  Basic audio support
  Supports YCbCr 4:4:4
  Supports YCbCr 4:2:2
  Native DTDs: 1
  Video Data Block:
    VIC   4:  1280x720    60.000000 Hz  16:9     45.000 kHz     74.250000 MHz (native)
    VIC   5:  1920x1080i  60.000000 Hz  16:9     33.750 kHz     74.250000 MHz
    VIC   2:   720x480    59.940060 Hz   4:3     31.469 kHz     27.000000 MHz
    VIC   6:  1440x480i   59.940060 Hz   4:3     15.734 kHz     27.000000 MHz
    VIC   7:  1440x480i   59.940060 Hz  16:9     15.734 kHz     27.000000 MHz
    VIC   3:   720x480    59.940060 Hz  16:9     31.469 kHz     27.000000 MHz
    VIC  14:  1440x480    59.940060 Hz   4:3     31.469 kHz     54.000000 MHz
    VIC  15:  1440x480    59.940060 Hz  16:9     31.469 kHz     54.000000 MHz
  Audio Data Block:
    Linear PCM:
      Max channels: 2
      Supported sample rates (kHz): 48 44.1 32
      Supported sample sizes (bits): 24 20 16
  Speaker Allocation Data Block:
    FL/FR - Front Left/Right
  Vendor-Specific Data Block (HDMI), OUI 00-0C-03:
    Source physical address: 1.0.0.0
  Detailed Timing Descriptors:
    DTD 3:  1360x768    59.960027 Hz  85:48    47.368 kHz     72.000000 MHz (710 mm x 400 mm)
                 Hfront   48 Hsync  32 Hback   80 Hpol P
                 Vfront    3 Vsync   5 Vback   14 Vpol N
    DTD 4:  1280x768    59.994726 Hz   5:3     47.396 kHz     68.250000 MHz (710 mm x 400 mm)
                 Hfront   48 Hsync  32 Hback   80 Hpol P
                 Vfront    3 Vsync   7 Vback   12 Vpol N
    DTD 5:  1680x1050   59.883253 Hz  16:10    64.674 kHz    119.000000 MHz (710 mm x 400 mm)
                 Hfront   48 Hsync  32 Hback   80 Hpol P
                 Vfront    3 Vsync   6 Vback   21 Vpol N
    DTD 6:  1280x768    74.893062 Hz   5:3     60.289 kHz    102.250000 MHz (710 mm x 400 mm)
                 Hfront   80 Hsync 128 Hback  208 Hpol N
                 Vfront    3 Vsync   7 Vback   27 Vpol P
Checksum: 0x83  Unused space in Extension Block: 28 bytes

----------------

Warnings:

Block 0, Base EDID:
  Standard Timings: Standard Timing 1360x765 has a dubious odd vertical resolution.
Block 1, CTA-861 Extension Block:
  IT Video Formats are overscanned by default, but normally this should be underscanned.
  Video Data Block: VIC 4 and the first DTD are not identical. Is this intended?
  Detailed Timing Descriptor #4: Image size is 710x400 mm, but based on the picture AR it should be 666x400 mm.
  Detailed Timing Descriptor #5: Image size is 710x400 mm, but based on the picture AR it should be 640x400 mm.
  Detailed Timing Descriptor #6: Image size is 710x400 mm, but based on the picture AR it should be 666x400 mm.
  Add a Colorimetry Data Block with the sRGB colorimetry bit set to avoid interop issues.
EDID:
  Base EDID: Some timings are out of range of the Monitor Ranges:
    Horizontal Freq: 15.734 - 64.673 kHz (Monitor: 30.000 - 70.000 kHz)
    Maximum Clock: 119.000 MHz (Monitor: 110.000 MHz)

Failures:

Block 1, CTA-861 Extension Block:
  Missing VCDB, needed for Set Selectable RGB Quantization to avoid interop issues.
EDID:
  Extension Block 2 started with EDID header, ignoring Extension Blocks >= 2.
  CTA-861: Native progressive timings are a mix of several resolutions.

EDID conformity: FAIL
