edid-decode (hex):

00 ff ff ff ff ff ff 00 4c f4 61 15 00 00 00 00
0d 21 01 03 80 21 16 78 3e 64 35 a5 54 4f 9e 27
12 50 54 23 08 00 d1 c0 8b c0 b3 00 95 00 90 40
81 80 81 40 81 c0 c4 3b 80 4a 71 38 34 40 58 2c
25 00 4a dc 10 00 00 1e 00 00 00 fc 00 52 45 41
4c 54 45 4b 0a 20 20 20 20 20 00 00 00 ff 00 0a
20 20 20 20 20 20 20 20 20 20 20 20 00 00 00 fd
00 30 3d 1e 54 0f 00 0a 20 20 20 20 20 20 01 63

02 03 3c f1 42 10 84 23 09 07 07 83 01 00 00 67
03 0c 00 10 00 38 44 67 d8 5d c4 01 44 80 01 68
1a 00 00 01 09 30 4b e6 e5 0f 00 00 06 00 e3 05
c0 00 e2 00 ff e6 06 05 01 59 59 49 5d 1f 56 18
51 00 2d 30 58 2c 25 00 4a dc 10 00 00 1e ba 09
80 a0 20 e0 27 10 30 20 35 00 4a dc 10 00 00 1e
82 0f 20 00 31 58 1c 20 28 80 14 00 4a dc 10 00
00 1e 00 00 00 00 00 00 00 00 00 00 00 00 00 a7

00 ff ff ff ff ff ff 00 4c f4 61 15 00 00 00 00
0d 21 01 03 80 21 16 78 3e 64 35 a5 54 4f 9e 27
12 50 54 23 08 00 d1 c0 8b c0 b3 00 95 00 90 40
81 80 81 40 81 c0 c4 3b 80 4a 71 38 34 40 58 2c
25 00 4a dc 10 00 00 1e 00 00 00 fc 00 52 45 41
4c 54 45 4b 0a 20 20 20 20 20 00 00 00 ff 00 0a
20 20 20 20 20 20 20 20 20 20 20 20 00 00 00 fd
00 30 3d 1e 54 0f 00 0a 20 20 20 20 20 20 01 63

02 03 3c f1 42 10 84 23 09 07 07 83 01 00 00 67
03 0c 00 10 00 38 44 67 d8 5d c4 01 44 80 01 68
1a 00 00 01 09 30 4b e6 e5 0f 00 00 06 00 e3 05
c0 00 e2 00 ff e6 06 05 01 59 59 49 5d 1f 56 18
51 00 2d 30 58 2c 25 00 4a dc 10 00 00 1e ba 09
80 a0 20 e0 27 10 30 20 35 00 4a dc 10 00 00 1e
82 0f 20 00 31 58 1c 20 28 80 14 00 4a dc 10 00
00 1e 00 00 00 00 00 00 00 00 00 00 00 00 00 a7

----------------

Block 0, Base EDID:
  EDID Structure Version & Revision: 1.3
  Vendor & Product Identification:
    Manufacturer: SGT
    Model: 5473
    Made in: week 13 of 2023
  Basic Display Parameters & Features:
    Digital display
    Maximum image size: 33 cm x 22 cm
    Gamma: 2.20
    DPMS levels: Off
    Undefined display color type
    Default (sRGB) color space is primary color space
    First detailed timing is the preferred timing
  Color Characteristics:
    Red  : 0.6455, 0.3300
    Green: 0.3095, 0.6171
    Blue : 0.1523, 0.0732
    White: 0.3134, 0.3291
  Established Timings I & II:
    DMT 0x04:   640x480    59.940476 Hz   4:3     31.469 kHz     25.175000 MHz
    DMT 0x08:   800x600    56.250000 Hz   4:3     35.156 kHz     36.000000 MHz
    DMT 0x09:   800x600    60.316541 Hz   4:3     37.879 kHz     40.000000 MHz
    DMT 0x10:  1024x768    60.003840 Hz   4:3     48.363 kHz     65.000000 MHz
  Standard Timings:
    DMT 0x52:  1920x1080   60.000000 Hz  16:9     67.500 kHz    148.500000 MHz
    GTF     :  1360x765    60.000341 Hz  16:9     47.520 kHz     84.396000 MHz
    DMT 0x3a:  1680x1050   59.954250 Hz  16:10    65.290 kHz    146.250000 MHz
    DMT 0x2f:  1440x900    59.887445 Hz  16:10    55.935 kHz    106.500000 MHz
    DMT 0x2a:  1400x1050   59.978442 Hz   4:3     65.317 kHz    121.750000 MHz
    DMT 0x23:  1280x1024   60.019740 Hz   5:4     63.981 kHz    108.000000 MHz
    DMT 0x20:  1280x960    60.000000 Hz   4:3     60.000 kHz    108.000000 MHz
    DMT 0x55:  1280x720    60.000000 Hz  16:9     45.000 kHz     74.250000 MHz
  Detailed Timing Descriptors:
    DTD 1:  1920x1080   60.070671 Hz  16:9     68.000 kHz    153.000000 MHz (330 mm x 220 mm)
                 Hfront   88 Hsync  44 Hback  198 Hpol P
                 Vfront    2 Vsync   5 Vback   45 Vpol P
    Display Product Name: 'REALTEK'
    Display Product Serial Number: ...
    Display Range Limits:
      Monitor ranges (GTF): 48-61 Hz V, 30-84 kHz H, max dotclock 150 MHz
  Extension blocks: 1
Checksum: 0x63

----------------

Block 1, CTA-861 Extension Block:
  Revision: 3
  Underscans IT Video Formats by default
  Basic audio support
  Supports YCbCr 4:4:4
  Supports YCbCr 4:2:2
  Native DTDs: 1
  Video Data Block:
    VIC  16:  1920x1080   60.000000 Hz  16:9     67.500 kHz    148.500000 MHz
    VIC   4:  1280x720    60.000000 Hz  16:9     45.000 kHz     74.250000 MHz (native)
  Audio Data Block:
    Linear PCM:
      Max channels: 2
      Supported sample rates (kHz): 48 44.1 32
      Supported sample sizes (bits): 24 20 16
  Speaker Allocation Data Block:
    FL/FR - Front Left/Right
  Vendor-Specific Data Block (HDMI), OUI 00-0C-03:
    Source physical address: 1.0.0.0
    DC_36bit
    DC_30bit
    DC_Y444
    Maximum TMDS clock: 340 MHz
  Vendor-Specific Data Block (HDMI Forum), OUI C4-5D-D8:
    Version: 1
    Maximum TMDS Character Rate: 340 MHz
    SCDC Present
    Supports 10-bits/component Deep Color 4:2:0 Pixel Encoding
  Vendor-Specific Data Block (AMD), OUI 00-00-1A:
    Version: 1
    Flags 1: 0x09
      FreeSync Supported
    Minimum Refresh Rate: 48 Hz
    Maximum Refresh Rate: 75 Hz
    MCCS VCP Code: 0xe6
  YCbCr 4:2:0 Capability Map Data Block:
    SVD Index 18 is out of range
    SVD Index 19 is out of range
  Colorimetry Data Block:
    BT2020YCC
    BT2020RGB
  Video Capability Data Block:
    YCbCr quantization: Selectable (via AVI YQ)
    RGB quantization: Selectable (via AVI Q)
    PT scan behavior: Supports both over- and underscan
    IT scan behavior: Supports both over- and underscan
    CE scan behavior: Supports both over- and underscan
  HDR Static Metadata Data Block:
    Electro optical transfer functions:
      Traditional gamma - SDR luminance range
      SMPTE ST2084
    Supported static metadata descriptors:
      Static metadata type 1
    Desired content max luminance: 89 (343.724 cd/m^2)
    Desired content max frame-average luminance: 89 (343.724 cd/m^2)
    Desired content min luminance: 73 (0.282 cd/m^2)
  Detailed Timing Descriptors:
    DTD 2:  1366x768    59.998595 Hz 683:384   48.779 kHz     80.290000 MHz (330 mm x 220 mm)
                 Hfront   88 Hsync  44 Hback  148 Hpol P
                 Vfront    2 Vsync   5 Vback   38 Vpol P
    DTD 3:   640x480    59.971098 Hz   4:3     31.125 kHz     24.900000 MHz (330 mm x 220 mm)
                 Hfront   48 Hsync  32 Hback   80 Hpol P
                 Vfront    3 Vsync   5 Vback   31 Vpol P
    DTD 4:   800x600    59.864167 Hz   4:3     37.595 kHz     39.700000 MHz (330 mm x 220 mm)
                 Hfront   40 Hsync 128 Hback   88 Hpol P
                 Vfront    1 Vsync   4 Vback   23 Vpol P
Checksum: 0xa7  Unused space in Extension Block: 13 bytes

----------------

Warnings:

Block 0, Base EDID:
  Standard Timings: Standard Timing 1360x765 has a dubious odd vertical resolution.
  Detailed Timing Descriptor #1: Image size is 330x220 mm, but based on the picture AR it should be 330x185 mm.
Block 1, CTA-861 Extension Block:
  Video Data Block: VIC 16 and the first DTD are not identical. Is this intended?
  Video Capability Data Block: S_PT is equal to S_IT and S_CE, so should be set to 0 instead.
  Detailed Timing Descriptor #2: Image size is 330x220 mm, but based on the picture AR it should be 330x185 mm.
  Detailed Timing Descriptor #3: Image size is 330x220 mm, but based on the picture AR it should be 293x220 mm.
  Detailed Timing Descriptor #4: Image size is 330x220 mm, but based on the picture AR it should be 293x220 mm.
EDID:
  Base EDID: Some timings are out of range of the Monitor Ranges:
    Maximum Clock: 153.000 MHz (Monitor: 150.000 MHz)
    Could be due to a Monitor Range off-by-one rounding issue

Failures:

Block 0, Base EDID:
  Display Product Serial Number: ...
  Basic Display Parameters & Features: sRGB is signaled, but the chromaticities do not match.
Block 1, CTA-861 Extension Block:
  Vendor-Specific Data Block (HDMI Forum), OUI C4-5D-D8: Max TMDS rate is > 0 and <= 340 or > 600.
  YCbCr 4:2:0 Capability Map Data Block: Max index 19 > 2 (#SVDs).
EDID:
  Extension Block 2 started with EDID header, ignoring Extension Blocks >= 2.
  CTA-861: Native progressive timings are a mix of several resolutions.

EDID conformity: FAIL
