edid-decode (hex):

00 ff ff ff ff ff ff 00 05 05 50 31 01 00 00 00
0c 1e 01 03 80 26 1e 78 ea 1e c5 ae 4f 34 b1 26
0e 50 54 a7 cf 00 81 c0 81 00 81 80 95 00 71 40
01 01 01 01 01 01 9a 29 a0 d0 51 84 22 30 50 8e
36 00 78 2d 11 00 00 1e 01 1d 00 72 51 d0 1e 20
6e 28 55 00 78 2d 11 00 00 1e 66 21 50 b0 51 00
1b 30 40 70 36 00 78 2d 11 00 00 1e 00 00 00 fc
00 4c 45 44 20 57 31 39 00 20 20 20 20 20 00 e5

00 ff ff ff ff ff ff 00 05 05 50 31 01 00 00 00
0c 1e 01 03 80 26 1e 78 ea 1e c5 ae 4f 34 b1 26
0e 50 54 a7 cf 00 81 c0 81 00 81 80 95 00 71 40
01 01 01 01 01 01 9a 29 a0 d0 51 84 22 30 50 8e
36 00 78 2d 11 00 00 1e 01 1d 00 72 51 d0 1e 20
6e 28 55 00 78 2d 11 00 00 1e 66 21 50 b0 51 00
1b 30 40 70 36 00 78 2d 11 00 00 1e 00 00 00 fc
00 4c 45 44 20 57 31 39 00 20 20 20 20 20 00 e5

----------------

Block 0, Base EDID:
  EDID Structure Version & Revision: 1.3
  Vendor & Product Identification:
    Manufacturer: AHE
    Model: 12624
    Serial Number: ...
    Made in: week 12 of 2020
  Basic Display Parameters & Features:
    Digital display
    Maximum image size: 38 cm x 30 cm
    Gamma: 2.20
    DPMS levels: Standby Suspend Off
    RGB color display
    First detailed timing is the preferred timing
  Color Characteristics:
    Red  : 0.6796, 0.3095
    Green: 0.2060, 0.6933
    Blue : 0.1513, 0.0546
    White: 0.3134, 0.3291
  Established Timings I & II:
    IBM     :   720x400    70.081663 Hz   9:5     31.467 kHz     28.320000 MHz
    DMT 0x04:   640x480    59.940476 Hz   4:3     31.469 kHz     25.175000 MHz
    DMT 0x06:   640x480    75.000000 Hz   4:3     37.500 kHz     31.500000 MHz
    DMT 0x08:   800x600    56.250000 Hz   4:3     35.156 kHz     36.000000 MHz
    DMT 0x09:   800x600    60.316541 Hz   4:3     37.879 kHz     40.000000 MHz
    DMT 0x0a:   800x600    72.187572 Hz   4:3     48.077 kHz     50.000000 MHz
    DMT 0x0b:   800x600    75.000000 Hz   4:3     46.875 kHz     49.500000 MHz
    DMT 0x10:  1024x768    60.003840 Hz   4:3     48.363 kHz     65.000000 MHz
    DMT 0x11:  1024x768    70.069359 Hz   4:3     56.476 kHz     75.000000 MHz
    DMT 0x12:  1024x768    75.028582 Hz   4:3     60.023 kHz     78.750000 MHz
    DMT 0x24:  1280x1024   75.024675 Hz   5:4     79.976 kHz    135.000000 MHz
  Standard Timings:
    DMT 0x55:  1280x720    60.000000 Hz  16:9     45.000 kHz     74.250000 MHz
    DMT 0x1c:  1280x800    59.810326 Hz  16:10    49.702 kHz     83.500000 MHz
    DMT 0x23:  1280x1024   60.019740 Hz   5:4     63.981 kHz    108.000000 MHz
    DMT 0x2f:  1440x900    59.887445 Hz  16:10    55.935 kHz    106.500000 MHz
    GTF     :  1152x864    60.000000 Hz   4:3     53.700 kHz     81.624000 MHz
  Detailed Timing Descriptors:
    DTD 1:  1440x900    59.887445 Hz  16:10    55.935 kHz    106.500000 MHz (376 mm x 301 mm)
                 Hfront   80 Hsync 142 Hback  242 Hpol P
                 Vfront    3 Vsync   6 Vback   25 Vpol P
    DTD 2:  1280x720    60.000000 Hz  16:9     45.000 kHz     74.250000 MHz (376 mm x 301 mm)
                 Hfront  110 Hsync  40 Hback  220 Hpol P
                 Vfront    5 Vsync   5 Vback   20 Vpol P
    DTD 3:  1360x768    60.015162 Hz  85:48    47.712 kHz     85.500000 MHz (376 mm x 301 mm)
                 Hfront   64 Hsync 112 Hback  256 Hpol P
                 Vfront    3 Vsync   6 Vback   18 Vpol P
    Display Product Name: 'LED W19'
Checksum: 0xe5

----------------

Block 1, Unknown EDID Extension Block 0x00:
  00 ff ff ff ff ff ff 00 05 05 50 31 01 00 00 00 '..........P1....'
  0c 1e 01 03 80 26 1e 78 ea 1e c5 ae 4f 34 b1 26 '.....&.x....O4.&'
  0e 50 54 a7 cf 00 81 c0 81 00 81 80 95 00 71 40 '.PT...........q@'
  01 01 01 01 01 01 9a 29 a0 d0 51 84 22 30 50 8e '.......)..Q."0P.'
  36 00 78 2d 11 00 00 1e 01 1d 00 72 51 d0 1e 20 '6.x-.......rQ.. '
  6e 28 55 00 78 2d 11 00 00 1e 66 21 50 b0 51 00 'n(U.x-....f!P.Q.'
  1b 30 40 70 36 00 78 2d 11 00 00 1e 00 00 00 fc '.0@p6.x-........'
  00 4c 45 44 20 57 31 39 00 20 20 20 20 20 00 e5 '.LED W19.     ..'
Checksum: 0xe5

----------------

Warnings:

Block 0, Base EDID:
  Vendor & Product Identification: The serial number is one of the known dummy values, it should probably be set to 0.
  Detailed Timing Descriptor #1: DTD is similar but not identical to DMT 0x2f.
  Detailed Timing Descriptor #1: Image size is 376x301 mm, but based on the picture AR it should be 376x235 mm.
  Detailed Timing Descriptor #2: Image size is 376x301 mm, but based on the picture AR it should be 376x211 mm.
  Detailed Timing Descriptor #3: Image size is 376x301 mm, but based on the picture AR it should be 376x212 mm.

Failures:

Block 0, Base EDID:
  Display Product Name: NUL byte at position 7.
  Missing Display Range Limits Descriptor.
Block 1, Base EDID:
  Unknown Extension Block.
EDID:
  Base EDID: EDID specified 0 extension block(s), but found 1 extension block(s).

EDID conformity: FAIL
