edid-decode (hex):

00 ff ff ff ff ff ff 00 4c 2d 07 01 37 31 45 4c
0a 0f 01 03 80 1f 17 78 2a ee 91 a3 54 4c 99 26
0f 50 54 bf ee 80 61 59 45 59 31 59 81 80 71 4f
01 01 01 01 81 c0 ea 24 00 60 41 00 28 30 30 60
13 00 38 ea 10 00 00 1e 00 00 00 fd 00 32 a0 1e
47 0b 00 0a 20 20 20 20 20 20 00 00 00 fc 00 53
79 6e 63 4d 61 73 74 65 72 0a 20 20 00 00 00 ff
00 48 58 41 59 33 30 37 32 33 34 0a 20 20 00 c6

00 ff ff ff ff ff ff 00 4c 2d 07 01 37 31 45 4c
0a 0f 01 03 80 1f 17 78 2a ee 91 a3 54 4c 99 26
0f 50 54 bf ee 80 61 59 45 59 31 59 81 80 71 4f
01 01 01 01 81 c0 ea 24 00 60 41 00 28 30 30 60
13 00 38 ea 10 00 00 1e 00 00 00 fd 00 32 a0 1e
47 0b 00 0a 20 20 20 20 20 20 00 00 00 fc 00 53
79 6e 63 4d 61 73 74 65 72 0a 20 20 00 00 00 ff
00 48 58 41 59 33 30 37 32 33 34 0a 20 20 00 c6

----------------

Block 0, Base EDID:
  EDID Structure Version & Revision: 1.3
  Vendor & Product Identification:
    Manufacturer: SAM
    Model: 263
    Serial Number: ...
    Made in: week 10 of 2005
  Basic Display Parameters & Features:
    Digital display
    Maximum image size: 31 cm x 23 cm
    Gamma: 2.20
    DPMS levels: Off
    RGB color display
    First detailed timing is the preferred timing
  Color Characteristics:
    Red  : 0.6396, 0.3300
    Green: 0.2998, 0.5996
    Blue : 0.1503, 0.0595
    White: 0.3125, 0.3291
  Established Timings I & II:
    IBM     :   720x400    70.081663 Hz   9:5     31.467 kHz     28.320000 MHz
    DMT 0x04:   640x480    59.940476 Hz   4:3     31.469 kHz     25.175000 MHz
    Apple   :   640x480    66.666667 Hz   4:3     35.000 kHz     30.240000 MHz
    DMT 0x05:   640x480    72.808802 Hz   4:3     37.861 kHz     31.500000 MHz
    DMT 0x06:   640x480    75.000000 Hz   4:3     37.500 kHz     31.500000 MHz
    DMT 0x08:   800x600    56.250000 Hz   4:3     35.156 kHz     36.000000 MHz
    DMT 0x09:   800x600    60.316541 Hz   4:3     37.879 kHz     40.000000 MHz
    DMT 0x0a:   800x600    72.187572 Hz   4:3     48.077 kHz     50.000000 MHz
    DMT 0x0b:   800x600    75.000000 Hz   4:3     46.875 kHz     49.500000 MHz
    Apple   :   832x624    74.551266 Hz   4:3     49.726 kHz     57.284000 MHz
    DMT 0x10:  1024x768    60.003840 Hz   4:3     48.363 kHz     65.000000 MHz
    DMT 0x11:  1024x768    70.069359 Hz   4:3     56.476 kHz     75.000000 MHz
    DMT 0x12:  1024x768    75.028582 Hz   4:3     60.023 kHz     78.750000 MHz
    Apple   :  1152x870    75.061550 Hz 192:145   68.681 kHz    100.000000 MHz
  Standard Timings:
    DMT 0x13:  1024x768    84.996690 Hz   4:3     68.677 kHz     94.500000 MHz
    DMT 0x0c:   800x600    85.061274 Hz   4:3     53.674 kHz     56.250000 MHz
    DMT 0x07:   640x480    85.008312 Hz   4:3     43.269 kHz     36.000000 MHz
    DMT 0x23:  1280x1024   60.019740 Hz   5:4     63.981 kHz    108.000000 MHz
    DMT 0x15:  1152x864    75.000000 Hz   4:3     67.500 kHz    108.000000 MHz
    DMT 0x55:  1280x720    60.000000 Hz  16:9     45.000 kHz     74.250000 MHz
  Detailed Timing Descriptors:
    DTD 1:  1024x768    84.996690 Hz   4:3     68.677 kHz     94.500000 MHz (312 mm x 234 mm)
                 Hfront   48 Hsync  96 Hback  208 Hpol P
                 Vfront    1 Vsync   3 Vback   36 Vpol P
    Display Range Limits:
      Monitor ranges (GTF): 50-160 Hz V, 30-71 kHz H, max dotclock 110 MHz
    Display Product Name: 'SyncMaster'
    Display Product Serial Number: ...
Checksum: 0xc6

----------------

Failures:

Block 0, Base EDID:
  Basic Display Parameters & Features: The chromaticities match sRGB, but sRGB is not signaled.
EDID:
  Extension Block 1 started with EDID header, ignoring Extension Blocks >= 1.

EDID conformity: FAIL
