edid-decode (hex):

00 ff ff ff ff ff ff 00 06 af ed 21 00 00 00 00
01 15 01 03 80 22 13 78 0a e2 b5 9e 59 52 99 26
1e 50 54 00 00 00 01 01 01 01 01 01 01 01 01 01
01 01 01 01 01 01 b6 35 80 7e 70 38 28 40 3c 3c
ee 00 58 c2 10 00 00 18 00 00 00 00 00 38 58 42
3c 3c ee 00 58 c2 10 00 00 18 00 00 00 fe 00 41
55 4f 0a 20 20 20 20 20 20 20 20 20 00 00 00 fe
00 42 31 35 36 48 57 30 32 20 56 31 20 0a 00 ab

00 ff ff ff ff ff ff 00 06 af ed 21 00 00 00 00
01 15 01 03 80 22 13 78 0a e2 b5 9e 59 52 99 26
1e 50 54 00 00 00 01 01 01 01 01 01 01 01 01 01
01 01 01 01 01 01 b6 35 80 7e 70 38 28 40 3c 3c
ee 00 58 c2 10 00 00 18 00 00 00 00 00 38 58 42
3c 3c ee 00 58 c2 10 00 00 18 00 00 00 fe 00 41
55 4f 0a 20 20 20 20 20 20 20 20 20 00 00 00 fe
00 42 31 35 36 48 57 30 32 20 56 31 20 0a 00 ab

----------------

Block 0, Base EDID:
  EDID Structure Version & Revision: 1.3
  Vendor & Product Identification:
    Manufacturer: AUO
    Model: 8685
    Made in: week 1 of 2011
  Basic Display Parameters & Features:
    Digital display
    Maximum image size: 34 cm x 19 cm
    Gamma: 2.20
    RGB color display
    First detailed timing is the preferred timing
  Color Characteristics:
    Red  : 0.6201, 0.3496
    Green: 0.3203, 0.5996
    Blue : 0.1503, 0.1201
    White: 0.3134, 0.3291
  Established Timings I & II: none
  Standard Timings: none
  Detailed Timing Descriptors:
    DTD 1:  1920x1080   60.003840 Hz  16:9     67.204 kHz    137.500000 MHz (344 mm x 194 mm)
                 Hfront   60 Hsync  60 Hback    6 Hpol N
                 Vfront   14 Vsync  14 Vback   12 Vpol N
    Manufacturer-Specified Display Descriptor (0x00): 00 00 00 38 58 42 3c 3c ee 00 58 c2 10 00 00 18 '...8XB<<..X.....'
    Alphanumeric Data String: 'AUO'
    Alphanumeric Data String: 'B156HW02 V1 '
Checksum: 0xab

----------------

Failures:

Block 0, Base EDID:
  Alphanumeric Data String: One or more trailing spaces before newline.
  Missing Display Product Name.
  Missing Display Range Limits Descriptor.
EDID:
  Extension Block 1 started with EDID header, ignoring Extension Blocks >= 1.

EDID conformity: FAIL
