edid-decode (hex):

00 ff ff ff ff ff ff 00 06 af ed 21 00 00 00 00
04 15 01 04 90 22 13 78 02 e2 b5 9e 59 52 99 26
1e 50 54 00 00 00 01 01 01 01 01 01 01 01 01 01
01 01 01 01 01 01 d0 39 80 0a 71 38 30 40 64 14
aa 00 58 c2 10 00 00 1a 8b 26 80 0a 71 38 30 40
64 14 aa 00 58 c2 10 00 00 1a 00 00 00 fe 00 33
35 4b 30 36 80 42 31 35 36 48 57 32 00 00 00 00
00 00 41 21 9e 00 00 00 00 02 01 0a 20 20 00 16

----------------

Block 0, Base EDID:
  EDID Structure Version & Revision: 1.4
  Vendor & Product Identification:
    Manufacturer: AUO
    Model: 8685
    Made in: week 4 of 2011
  Basic Display Parameters & Features:
    Digital display
    Bits per primary color channel: 6
    Digital interface is not defined
    Maximum image size: 34 cm x 19 cm
    Gamma: 2.20
    Supported color formats: RGB 4:4:4
    First detailed timing includes the native pixel format and preferred refresh rate
  Color Characteristics:
    Red  : 0.6201, 0.3496
    Green: 0.3203, 0.5996
    Blue : 0.1503, 0.1201
    White: 0.3134, 0.3291
  Established Timings I & II: none
  Standard Timings: none
  Detailed Timing Descriptors:
    DTD 1:  1920x1080   60.020894 Hz  16:9     67.704 kHz    148.000000 MHz (344 mm x 194 mm)
                 Hfront  100 Hsync  20 Hback  146 Hpol P
                 Vfront   10 Vsync  10 Vback   28 Vpol N
    DTD 2:  1920x1080   40.015281 Hz  16:9     45.137 kHz     98.670000 MHz (344 mm x 194 mm)
                 Hfront  100 Hsync  20 Hback  146 Hpol P
                 Vfront   10 Vsync  10 Vback   28 Vpol N
    Alphanumeric Data String: '35K06.B156HW2'
    Manufacturer-Specified Display Descriptor (0x00): 00 00 00 00 41 21 9e 00 00 00 00 02 01 0a 20 20 '....A!........  '
Checksum: 0x16

----------------

Warnings:

Block 0, Base EDID:
  Alphanumeric Data String: Non-ASCII character 0x80 at position 5, can cause problems.
  Missing Display Product Name.

EDID conformity: PASS
