edid-decode (hex):

00 ff ff ff ff ff ff 00 06 af ed 21 00 00 00 00
04 15 01 04 90 22 13 78 02 e2 b5 9e 59 52 99 26
1e 50 54 00 00 00 01 01 01 01 01 01 01 01 01 01
01 01 01 01 01 01 78 37 80 cc 70 38 22 40 30 64
aa 00 58 c2 10 00 00 18 fb 24 80 cc 70 38 22 40
30 64 aa 00 58 c2 10 00 00 18 00 00 00 fe 00 41
55 4f 0a 20 20 20 20 20 20 20 20 20 00 00 00 fe
00 42 31 35 36 48 57 30 32 20 56 31 20 0a 00 40

----------------

Block 0, Base EDID:
  EDID Structure Version & Revision: 1.4
  Vendor & Product Identification:
    Manufacturer: AUO
    Model: 8685
    Made in: week 4 of 2011
  Basic Display Parameters & Features:
    Digital display
    Bits per primary color channel: 6
    Digital interface is not defined
    Maximum image size: 34 cm x 19 cm
    Gamma: 2.20
    Supported color formats: RGB 4:4:4
    First detailed timing includes the native pixel format and preferred refresh rate
  Color Characteristics:
    Red  : 0.6201, 0.3496
    Green: 0.3203, 0.5996
    Blue : 0.1503, 0.1201
    White: 0.3134, 0.3291
  Established Timings I & II: none
  Standard Timings: none
  Detailed Timing Descriptors:
    DTD 1:  1920x1080   60.013457 Hz  16:9     66.855 kHz    142.000000 MHz (344 mm x 194 mm)
                 Hfront   48 Hsync 100 Hback   56 Hpol N
                 Vfront   10 Vsync  10 Vback   14 Vpol N
    DTD 2:  1920x1080   40.010380 Hz  16:9     44.572 kHz     94.670000 MHz (344 mm x 194 mm)
                 Hfront   48 Hsync 100 Hback   56 Hpol N
                 Vfront   10 Vsync  10 Vback   14 Vpol N
    Alphanumeric Data String: 'AUO'
    Alphanumeric Data String: 'B156HW02 V1 '
Checksum: 0x40

----------------

Warnings:

Block 0, Base EDID:
  Missing Display Product Name.

Failures:

Block 0, Base EDID:
  Alphanumeric Data String: One or more trailing spaces before newline.

EDID conformity: FAIL
