edid-decode (hex):

00 ff ff ff ff ff ff 00 4c 68 71 05 7e 01 00 00
13 0c 01 03 08 1e 16 64 e8 99 aa a3 54 4d 95 24
19 51 54 ad 4e 00 01 01 01 01 01 01 01 01 01 01
01 01 01 01 01 01 c3 1e 00 20 41 00 20 30 10 60
13 00 2c dc 10 00 00 1e 56 13 20 00 31 58 19 20
10 50 13 00 2c dc 10 00 00 1c 00 00 00 fd 00 38
4b 1f 3c ff 00 0a 20 20 20 20 20 20 00 00 00 fc
00 4c 35 37 30 20 53 69 6c 62 65 72 0a 20 00 39

00 ff ff ff ff ff ff 00 4c 68 71 05 7e 01 00 00
13 0c 01 03 08 1e 16 64 e8 99 aa a3 54 4d 95 24
19 51 54 ad 4e 00 01 01 01 01 01 01 01 01 01 01
01 01 01 01 01 01 c3 1e 00 20 41 00 20 30 10 60
13 00 2c dc 10 00 00 1e 56 13 20 00 31 58 19 20
10 50 13 00 2c dc 10 00 00 1c 00 00 00 fd 00 38
4b 1f 3c ff 00 0a 20 20 20 20 20 20 00 00 00 fc
00 4c 35 37 30 20 53 69 6c 62 65 72 0a 20 00 39

----------------

Block 0, Base EDID:
  EDID Structure Version & Revision: 1.3
  Vendor & Product Identification:
    Manufacturer: SCH
    Model: 1393
    Serial Number: ...
    Made in: week 19 of 2002
  Basic Display Parameters & Features:
    Analog display
    Signal Level Standard: 0.700 : 0.300 : 1.000 V p-p
    Blank level equals black level
    Sync: Separate
    Maximum image size: 30 cm x 22 cm
    Gamma: 2.00
    DPMS levels: Standby Suspend Off
    RGB color display
  Color Characteristics:
    Red  : 0.6386, 0.3291
    Green: 0.3027, 0.5830
    Blue : 0.1425, 0.0996
    White: 0.3183, 0.3300
  Established Timings I & II:
    IBM     :   720x400    70.081663 Hz   9:5     31.467 kHz     28.320000 MHz
    DMT 0x04:   640x480    59.940476 Hz   4:3     31.469 kHz     25.175000 MHz
    DMT 0x05:   640x480    72.808802 Hz   4:3     37.861 kHz     31.500000 MHz
    DMT 0x06:   640x480    75.000000 Hz   4:3     37.500 kHz     31.500000 MHz
    DMT 0x09:   800x600    60.316541 Hz   4:3     37.879 kHz     40.000000 MHz
    DMT 0x0b:   800x600    75.000000 Hz   4:3     46.875 kHz     49.500000 MHz
    DMT 0x10:  1024x768    60.003840 Hz   4:3     48.363 kHz     65.000000 MHz
    DMT 0x11:  1024x768    70.069359 Hz   4:3     56.476 kHz     75.000000 MHz
    DMT 0x12:  1024x768    75.028582 Hz   4:3     60.023 kHz     78.750000 MHz
  Standard Timings: none
  Detailed Timing Descriptors:
    DTD 1:  1024x768    75.028582 Hz   4:3     60.023 kHz     78.750000 MHz (300 mm x 220 mm)
                 Hfront   16 Hsync  96 Hback  176 Hpol P
                 Vfront    1 Vsync   3 Vback   28 Vpol P
    DTD 2:   800x600    75.000000 Hz   4:3     46.875 kHz     49.500000 MHz (300 mm x 220 mm)
                 Hfront   16 Hsync  80 Hback  160 Hpol N
                 Vfront    1 Vsync   3 Vback   21 Vpol P
    Display Range Limits:
      Monitor ranges (GTF): 56-75 Hz V, 31-60 kHz H, max dotclock 2550 MHz
    Display Product Name: 'L570 Silber'
Checksum: 0x39

----------------

Warnings:

Block 0, Base EDID:
  Detailed Timing Descriptor #2: DTD is similar but not identical to DMT 0x0b.

Failures:

Block 0, Base EDID:
  Basic Display Parameters & Features: EDID 1.3 requires that the first detailed timing is the preferred timing.
EDID:
  Extension Block 1 started with EDID header, ignoring Extension Blocks >= 1.

EDID conformity: FAIL
