edid-decode (hex):

00 ff ff ff ff ff ff 00 10 ac 1a d0 4c 58 46 30
17 12 01 04 80 2b 1b 78 ef bd 23 a7 53 46 9e 25
14 50 5b a5 4b 00 71 4f 81 80 01 01 01 01 01 01
01 01 01 01 01 01 21 39 90 30 62 1a 27 40 68 b0
36 00 ae 0e 11 00 00 1c 00 00 00 ff 00 4d 35 31
31 44 38 36 36 30 46 58 4c 0a 00 00 00 fd 00 38
4b 1e 53 0f 04 11 3c d2 f8 58 f0 00 00 00 00 fc
00 44 45 4c 4c 20 53 50 32 30 30 39 57 0a 00 fa

00 ff ff ff ff ff ff 00 10 ac 1a d0 4c 58 46 30
17 12 01 04 80 2b 1b 78 ef bd 23 a7 53 46 9e 25
14 50 5b a5 4b 00 71 4f 81 80 01 01 01 01 01 01
01 01 01 01 01 01 21 39 90 30 62 1a 27 40 68 b0
36 00 ae 0e 11 00 00 1c 00 00 00 ff 00 4d 35 31
31 44 38 36 36 30 46 58 4c 0a 00 00 00 fd 00 38
4b 1e 53 0f 04 11 3c d2 f8 58 f0 00 00 00 00 fc
00 44 45 4c 4c 20 53 50 32 30 30 39 57 0a 00 fa

----------------

Block 0, Base EDID:
  EDID Structure Version & Revision: 1.4
  Vendor & Product Identification:
    Manufacturer: DEL
    Model: 53274
    Serial Number: ...
    Made in: week 23 of 2008
  Basic Display Parameters & Features:
    Digital display
    Color depth is undefined
    Digital interface is not defined
    Maximum image size: 43 cm x 27 cm
    Gamma: 2.20
    DPMS levels: Standby Suspend Off
    Supported color formats: RGB 4:4:4, YCrCb 4:4:4
    Default (sRGB) color space is primary color space
    First detailed timing includes the native pixel format and preferred refresh rate
    Display supports continuous frequencies
  Color Characteristics:
    Red  : 0.6542, 0.3271
    Green: 0.2763, 0.6181
    Blue : 0.1445, 0.0800
    White: 0.3125, 0.3583
  Established Timings I & II:
    IBM     :   720x400    70.081663 Hz   9:5     31.467 kHz     28.320000 MHz
    DMT 0x04:   640x480    59.940476 Hz   4:3     31.469 kHz     25.175000 MHz
    DMT 0x06:   640x480    75.000000 Hz   4:3     37.500 kHz     31.500000 MHz
    DMT 0x09:   800x600    60.316541 Hz   4:3     37.879 kHz     40.000000 MHz
    DMT 0x0b:   800x600    75.000000 Hz   4:3     46.875 kHz     49.500000 MHz
    DMT 0x10:  1024x768    60.003840 Hz   4:3     48.363 kHz     65.000000 MHz
    DMT 0x12:  1024x768    75.028582 Hz   4:3     60.023 kHz     78.750000 MHz
    DMT 0x24:  1280x1024   75.024675 Hz   5:4     79.976 kHz    135.000000 MHz
  Standard Timings:
    DMT 0x15:  1152x864    75.000000 Hz   4:3     67.500 kHz    108.000000 MHz
    DMT 0x23:  1280x1024   60.019740 Hz   5:4     63.981 kHz    108.000000 MHz
  Detailed Timing Descriptors:
    DTD 1:  1680x1050   59.954250 Hz  16:10    65.290 kHz    146.250000 MHz (430 mm x 270 mm)
                 Hfront  104 Hsync 176 Hback  280 Hpol N
                 Vfront    3 Vsync   6 Vback   30 Vpol P
    Display Product Serial Number: ...
    Display Range Limits:
      Monitor ranges (CVT): 56-75 Hz V, 30-83 kHz H, max dotclock 150 MHz
      CVT version 1.1
      Real max dotclock: 146.25 MHz
      Max active pixels per line: 1680
      Supported aspect ratios: 4:3 16:9 16:10 5:4 15:9
      Preferred aspect ratio: 16:10
      Supports CVT standard blanking
      Supports CVT reduced blanking
      Supported display scaling:
        Horizontal shrink
        Horizontal stretch
        Vertical shrink
        Vertical stretch
    Display Product Name: 'DELL SP2009W'
Checksum: 0xfa

----------------

Warnings:

Block 0, Base EDID:
  Display Range Limits: CVT block does not set preferred refresh rate.

Failures:

Block 0, Base EDID:
  Basic Display Parameters & Features: sRGB is signaled, but the chromaticities do not match.
EDID:
  Extension Block 1 started with EDID header, ignoring Extension Blocks >= 1.

EDID conformity: FAIL
