edid-decode (hex):

00 ff ff ff ff ff ff 00 06 af 62 10 00 00 00 00
17 1c 01 04 95 19 11 78 02 24 25 97 5a 58 97 28
1b 50 54 00 00 00 01 01 01 01 01 01 01 01 01 01
01 01 01 01 01 01 2e 22 56 b8 50 90 1c 30 68 16
46 00 fd a9 00 00 00 18 c9 16 56 b8 50 90 1c 30
68 16 46 00 fd a9 00 00 00 18 00 00 00 00 00 00
00 00 00 00 00 00 00 00 00 00 00 00 00 00 00 02
00 10 44 ff 0f 3c 75 0a 0c 14 75 20 20 20 00 93

00 ff ff ff ff ff ff 00 06 af 62 10 00 00 00 00
17 1c 01 04 95 19 11 78 02 24 25 97 5a 58 97 28
1b 50 54 00 00 00 01 01 01 01 01 01 01 01 01 01
01 01 01 01 01 01 2e 22 56 b8 50 90 1c 30 68 16
46 00 fd a9 00 00 00 18 c9 16 56 b8 50 90 1c 30
68 16 46 00 fd a9 00 00 00 18 00 00 00 00 00 00
00 00 00 00 00 00 00 00 00 00 00 00 00 00 00 02
00 10 44 ff 0f 3c 75 0a 0c 14 75 20 20 20 00 93

----------------

Block 0, Base EDID:
  EDID Structure Version & Revision: 1.4
  Vendor & Product Identification:
    Manufacturer: AUO
    Model: 4194
    Made in: week 23 of 2018
  Basic Display Parameters & Features:
    Digital display
    Bits per primary color channel: 6
    DisplayPort interface
    Maximum image size: 25 cm x 17 cm
    Gamma: 2.20
    Supported color formats: RGB 4:4:4
    First detailed timing includes the native pixel format and preferred refresh rate
  Color Characteristics:
    Red  : 0.5898, 0.3535
    Green: 0.3447, 0.5898
    Blue : 0.1562, 0.1074
    White: 0.3134, 0.3291
  Established Timings I & II: none
  Standard Timings: none
  Detailed Timing Descriptors:
    DTD 1:  1366x912    60.054907 Hz 683:456   56.452 kHz     87.500000 MHz (253 mm x 169 mm)
                 Hfront  104 Hsync  22 Hback   58 Hpol N
                 Vfront    4 Vsync   6 Vback   18 Vpol N
    DTD 2:  1366x912    40.034317 Hz 683:456   37.632 kHz     58.330000 MHz (253 mm x 169 mm)
                 Hfront  104 Hsync  22 Hback   58 Hpol N
                 Vfront    4 Vsync   6 Vback   18 Vpol N
    Empty Descriptor
    Manufacturer-Specified Display Descriptor (0x02): 00 02 00 10 44 ff 0f 3c 75 0a 0c 14 75 20 20 20 '....D..<u...u   '
Checksum: 0x93

----------------

Warnings:

Block 0, Base EDID:
  Missing Display Product Name.

Failures:

Block 0, Base EDID:
  Empty Descriptor: Use Dummy Descriptor instead of all zeroes.
EDID:
  Extension Block 1 started with EDID header, ignoring Extension Blocks >= 1.

EDID conformity: FAIL
