edid-decode (hex):

00 ff ff ff ff ff ff 00 09 e5 70 07 00 00 00 00
01 1b 01 03 95 1a 0e 78 0a 81 e0 96 59 5a 9a 29
1c 50 54 00 00 00 01 01 01 01 01 01 01 01 01 01
01 01 01 01 01 01 6b 1b 56 64 50 00 1e 30 26 16
44 00 00 90 10 00 00 1a 00 00 00 00 00 00 00 00
00 00 00 00 00 00 00 00 00 00 00 00 00 fe 00 42
4f 45 20 48 46 0a 20 20 20 20 20 20 00 00 00 fe
00 4e 56 31 31 36 57 48 4d 2d 54 30 30 0a 00 90

00 ff ff ff ff ff ff 00 09 e5 70 07 00 00 00 00
01 1b 01 03 95 1a 0e 78 0a 81 e0 96 59 5a 9a 29
1c 50 54 00 00 00 01 01 01 01 01 01 01 01 01 01
01 01 01 01 01 01 6b 1b 56 64 50 00 1e 30 26 16
44 00 00 90 10 00 00 1a 00 00 00 00 00 00 00 00
00 00 00 00 00 00 00 00 00 00 00 00 00 fe 00 42
4f 45 20 48 46 0a 20 20 20 20 20 20 00 00 00 fe
00 4e 56 31 31 36 57 48 4d 2d 54 30 30 0a 00 90

----------------

Block 0, Base EDID:
  EDID Structure Version & Revision: 1.3
  Vendor & Product Identification:
    Manufacturer: BOE
    Model: 1904
    Made in: week 1 of 2017
  Basic Display Parameters & Features:
    Digital display
    DFP 1.x compatible TMDS
    Maximum image size: 26 cm x 14 cm
    Gamma: 2.20
    RGB color display
    First detailed timing is the preferred timing
  Color Characteristics:
    Red  : 0.5878, 0.3476
    Green: 0.3515, 0.6025
    Blue : 0.1630, 0.1113
    White: 0.3125, 0.3281
  Established Timings I & II: none
  Standard Timings: none
  Detailed Timing Descriptors:
    DTD 1:  1366x768    59.998222 Hz 683:384   47.879 kHz     70.190000 MHz (256 mm x 144 mm)
                 Hfront   38 Hsync  22 Hback   40 Hpol P
                 Vfront    4 Vsync   4 Vback   22 Vpol N
    Empty Descriptor
    Alphanumeric Data String: 'BOE HF'
    Alphanumeric Data String: 'NV116WHM-T00'
Checksum: 0x90

----------------

Failures:

Block 0, Base EDID:
  Basic Display Parameters & Features: Digital Video Interface Standard set to reserved value 0x14.
  Empty Descriptor: Use Dummy Descriptor instead of all zeroes.
  Missing Display Product Name.
  Missing Display Range Limits Descriptor.
EDID:
  Extension Block 1 started with EDID header, ignoring Extension Blocks >= 1.

EDID conformity: FAIL
