edid-decode (hex):

00 ff ff ff ff ff ff 00 09 e5 63 0b 00 00 00 00
14 20 01 04 a5 1e 13 78 07 8d f9 a8 53 4b 9a 24
0f 52 58 00 00 00 01 01 01 01 01 01 01 01 01 01
01 01 01 01 01 01 74 3c 80 a0 70 b0 28 40 30 20
36 00 2e bc 10 00 00 1a 00 00 00 fd 00 30 3c 4a
4a 0f 01 0a 20 20 20 20 20 20 00 00 00 fe 00 42
4f 45 20 48 46 20 20 20 20 20 20 20 00 00 00 fe
00 4e 56 31 34 30 57 55 4d 2d 54 30 34 0a 00 7f

00 ff ff ff ff ff ff 00 09 e5 63 0b 00 00 00 00
14 20 01 04 a5 1e 13 78 07 8d f9 a8 53 4b 9a 24
0f 52 58 00 00 00 01 01 01 01 01 01 01 01 01 01
01 01 01 01 01 01 74 3c 80 a0 70 b0 28 40 30 20
36 00 2e bc 10 00 00 1a 00 00 00 fd 00 30 3c 4a
4a 0f 01 0a 20 20 20 20 20 20 00 00 00 fe 00 42
4f 45 20 48 46 20 20 20 20 20 20 20 00 00 00 fe
00 4e 56 31 34 30 57 55 4d 2d 54 30 34 0a 00 7f

----------------

Block 0, Base EDID:
  EDID Structure Version & Revision: 1.4
  Vendor & Product Identification:
    Manufacturer: BOE
    Model: 2915
    Made in: week 20 of 2022
  Basic Display Parameters & Features:
    Digital display
    Bits per primary color channel: 8
    DisplayPort interface
    Maximum image size: 30 cm x 19 cm
    Gamma: 2.20
    Supported color formats: RGB 4:4:4
    Default (sRGB) color space is primary color space
    First detailed timing includes the native pixel format and preferred refresh rate
    Display supports continuous frequencies
  Color Characteristics:
    Red  : 0.6582, 0.3242
    Green: 0.2958, 0.6025
    Blue : 0.1435, 0.0615
    White: 0.3222, 0.3447
  Established Timings I & II: none
  Standard Timings: none
  Detailed Timing Descriptors:
    DTD 1:  1920x1200   60.003102 Hz  16:10    74.404 kHz    154.760000 MHz (302 mm x 188 mm)
                 Hfront   48 Hsync  32 Hback   80 Hpol P
                 Vfront    3 Vsync   6 Vback   31 Vpol N
    Display Range Limits:
      Monitor ranges (Range Limits Only): 48-60 Hz V, 74-74 kHz H, max dotclock 150 MHz
    Alphanumeric Data String: 'BOE HF       '
    Alphanumeric Data String: 'NV140WUM-T04'
Checksum: 0x7f

----------------

Block 1, Unknown EDID Extension Block 0x00:
  00 ff ff ff ff ff ff 00 09 e5 63 0b 00 00 00 00 '..........c.....'
  14 20 01 04 a5 1e 13 78 07 8d f9 a8 53 4b 9a 24 '. .....x....SK.$'
  0f 52 58 00 00 00 01 01 01 01 01 01 01 01 01 01 '.RX.............'
  01 01 01 01 01 01 74 3c 80 a0 70 b0 28 40 30 20 '......t<..p.(@0 '
  36 00 2e bc 10 00 00 1a 00 00 00 fd 00 30 3c 4a '6............0<J'
  4a 0f 01 0a 20 20 20 20 20 20 00 00 00 fe 00 42 'J...      .....B'
  4f 45 20 48 46 20 20 20 20 20 20 20 00 00 00 fe 'OE HF       ....'
  00 4e 56 31 34 30 57 55 4d 2d 54 30 34 0a 00 7f '.NV140WUM-T04...'
Checksum: 0x7f

----------------

Warnings:

Block 0, Base EDID:
  Missing Display Product Name.
EDID:
  Base EDID: Some timings are out of range of the Monitor Ranges:
    Maximum Clock: 154.760 MHz (Monitor: 150.000 MHz)
    Could be due to a Monitor Range off-by-one rounding issue

Failures:

Block 0, Base EDID:
  Basic Display Parameters & Features: sRGB is signaled, but the chromaticities do not match.
  Alphanumeric Data String: No newline, but one or more trailing spaces.
Block 1, Base EDID:
  Unknown Extension Block.
EDID:
  Base EDID: EDID specified 0 extension block(s), but found 1 extension block(s).

EDID conformity: FAIL
