edid-decode (hex):

00 ff ff ff ff ff ff 00 06 af ec 25 00 00 00 00
00 13 01 04 95 22 13 78 02 c8 95 9e 57 54 92 26
0f 50 54 00 00 00 01 01 01 01 01 01 01 01 01 01
01 01 01 01 01 01 f4 1a 56 3c 50 00 26 30 20 18
34 00 58 c1 10 00 00 1a f8 11 56 3c 50 00 26 30
20 18 34 00 58 c1 10 00 00 1a 00 00 00 fe 00 54
35 43 44 52 80 42 31 35 36 58 57 32 00 00 00 00
00 00 41 21 19 00 00 00 00 09 01 0a 20 20 00 70

----------------

Block 0, Base EDID:
  EDID Structure Version & Revision: 1.4
  Vendor & Product Identification:
    Manufacturer: AUO
    Model: 9708
    Made in: 2009
  Basic Display Parameters & Features:
    Digital display
    Bits per primary color channel: 6
    DisplayPort interface
    Maximum image size: 34 cm x 19 cm
    Gamma: 2.20
    Supported color formats: RGB 4:4:4
    First detailed timing includes the native pixel format and preferred refresh rate
  Color Characteristics:
    Red  : 0.6201, 0.3398
    Green: 0.3300, 0.5703
    Blue : 0.1503, 0.0595
    White: 0.3134, 0.3291
  Established Timings I & II: none
  Standard Timings: none
  Detailed Timing Descriptors:
    DTD 1:  1366x768    60.033619 Hz 683:384   48.387 kHz     69.000000 MHz (344 mm x 193 mm)
                 Hfront   32 Hsync  24 Hback    4 Hpol P
                 Vfront    3 Vsync   4 Vback   31 Vpol N
    DTD 2:  1366x768    40.022413 Hz 683:384   32.258 kHz     46.000000 MHz (344 mm x 193 mm)
                 Hfront   32 Hsync  24 Hback    4 Hpol P
                 Vfront    3 Vsync   4 Vback   31 Vpol N
    Alphanumeric Data String: 'T5CDR.B156XW2'
    Manufacturer-Specified Display Descriptor (0x00): 00 00 00 00 41 21 19 00 00 00 00 09 01 0a 20 20 '....A!........  '
Checksum: 0x70

----------------

Warnings:

Block 0, Base EDID:
  Alphanumeric Data String: Non-ASCII character 0x80 at position 5, can cause problems.
  Missing Display Product Name.

EDID conformity: PASS
