edid-decode (hex):

00 ff ff ff ff ff ff 00 4c a3 58 4a 00 00 00 00
00 0f 01 03 80 19 12 78 0a 87 f5 94 57 4f 8c 27
27 50 54 00 08 00 01 01 01 01 01 01 01 01 01 01
01 01 01 01 01 01 64 19 00 40 41 00 26 30 18 88
36 00 f6 b8 00 00 00 19 00 00 00 0f 00 00 00 00
00 00 00 00 00 18 ee 02 74 00 00 00 00 fe 00 54
44 34 31 39 00 31 32 31 58 4a 0a 20 00 00 00 fe
00 ec d3 c5 b7 91 68 42 00 01 01 0a 20 20 00 19

----------------

Block 0, Base EDID:
  EDID Structure Version & Revision: 1.3
  Vendor & Product Identification:
    Manufacturer: SEC
    Model: 19032
    Made in: 2005
  Basic Display Parameters & Features:
    Digital display
    Maximum image size: 25 cm x 18 cm
    Gamma: 2.20
    RGB color display
    First detailed timing is the preferred timing
  Color Characteristics:
    Red  : 0.5800, 0.3398
    Green: 0.3095, 0.5498
    Blue : 0.1552, 0.1552
    White: 0.3134, 0.3291
  Established Timings I & II:
    DMT 0x10:  1024x768    60.003840 Hz   4:3     48.363 kHz     65.000000 MHz
  Standard Timings: none
  Detailed Timing Descriptors:
    DTD 1:  1024x768    60.003840 Hz   4:3     48.363 kHz     65.000000 MHz (246 mm x 184 mm)
                 Hfront   24 Hsync 136 Hback  160 Hpol N
                 Vfront    3 Vsync   6 Vback   29 Vpol N
    Manufacturer-Specified Display Descriptor (0x0f): 00 0f 00 00 00 00 00 00 00 00 00 18 ee 02 74 00 '..............t.'
    Alphanumeric Data String: 'TD419'
    Alphanumeric Data String: '.....hB'
Checksum: 0x19

----------------

Warnings:

Block 0, Base EDID:
  Alphanumeric Data String: Non-ASCII character 0xec at position 0, can cause problems.
  Alphanumeric Data String: Non-ASCII character 0xd3 at position 1, can cause problems.
  Alphanumeric Data String: Non-ASCII character 0xc5 at position 2, can cause problems.
  Alphanumeric Data String: Non-ASCII character 0xb7 at position 3, can cause problems.
  Alphanumeric Data String: Non-ASCII character 0x91 at position 4, can cause problems.

Failures:

Block 0, Base EDID:
  Alphanumeric Data String: NUL byte at position 5.
  Alphanumeric Data String: NUL byte at position 7.
  Missing Display Product Name.
  Missing Display Range Limits Descriptor.

EDID conformity: FAIL
