edid-decode (hex):

00 ff ff ff ff ff ff 00 06 b3 f2 27 ff ff ff ff
18 22 01 04 b5 3b 21 78 3b 54 20 ad 52 3f af 25
0c 50 54 25 4a 00 81 40 81 80 81 00 a9 40 d1 c0
01 01 01 01 01 01 56 5e 00 a0 a0 a0 29 50 30 20
35 00 4b 4a 21 00 00 1a 00 00 00 fd 0c 28 f0 87
87 6a 01 0a 20 20 20 20 20 20 00 00 00 fc 00 58
47 32 37 41 51 44 4d 47 0a 20 20 20 00 00 00 ff
00 53 36 4c 4d 52 53 30 30 31 38 35 39 0a 02 26

02 03 2c f1 4e 04 13 10 1f 3f 40 22 21 20 03 12
02 11 01 23 09 07 07 83 01 00 00 e2 00 ea 6d 1a
00 00 02 01 28 f0 00 84 7a 03 4c 03 09 ec 00 a0
a0 a0 67 50 30 20 35 00 4b 4a 21 00 00 1a 6f c2
00 a0 a0 a0 55 50 30 20 35 00 4b 4a 21 00 00 1a
ea ec 80 a0 70 38 87 40 30 20 35 00 4b 4a 21 00
00 1a 00 00 00 00 00 00 00 00 00 00 00 00 00 00
00 00 00 00 00 00 00 00 00 00 00 00 00 00 00 1d

00 ff ff ff ff ff ff 00 06 b3 f2 27 ff ff ff ff
18 22 01 04 b5 3b 21 78 3b 54 20 ad 52 3f af 25
0c 50 54 25 4a 00 81 40 81 80 81 00 a9 40 d1 c0
01 01 01 01 01 01 56 5e 00 a0 a0 a0 29 50 30 20
35 00 4b 4a 21 00 00 1a 00 00 00 fd 0c 28 f0 87
87 6a 01 0a 20 20 20 20 20 20 00 00 00 fc 00 58
47 32 37 41 51 44 4d 47 0a 20 20 20 00 00 00 ff
00 53 36 4c 4d 52 53 30 30 31 38 35 39 0a 02 26

00 ff ff ff ff ff ff 00 06 b3 f2 27 ff ff ff ff
18 22 01 04 b5 3b 21 78 3b 54 20 ad 52 3f af 25
0c 50 54 25 4a 00 81 40 81 80 81 00 a9 40 d1 c0
01 01 01 01 01 01 56 5e 00 a0 a0 a0 29 50 30 20
35 00 4b 4a 21 00 00 1a 00 00 00 fd 0c 28 f0 87
87 6a 01 0a 20 20 20 20 20 20 00 00 00 fc 00 58
47 32 37 41 51 44 4d 47 0a 20 20 20 00 00 00 ff
00 53 36 4c 4d 52 53 30 30 31 38 35 39 0a 02 26

02 03 2c f1 4e 04 13 10 1f 3f 40 22 21 20 03 12
02 11 01 23 09 07 07 83 01 00 00 e2 00 ea 6d 1a
00 00 02 01 28 f0 00 84 7a 03 4c 03 09 ec 00 a0
a0 a0 67 50 30 20 35 00 4b 4a 21 00 00 1a 6f c2
00 a0 a0 a0 55 50 30 20 35 00 4b 4a 21 00 00 1a
ea ec 80 a0 70 38 87 40 30 20 35 00 4b 4a 21 00
00 1a 00 00 00 00 00 00 00 00 00 00 00 00 00 00
00 00 00 00 00 00 00 00 00 00 00 00 00 00 00 1d

00 ff ff ff ff ff ff 00 06 b3 f2 27 ff ff ff ff
18 22 01 04 b5 3b 21 78 3b 54 20 ad 52 3f af 25
0c 50 54 25 4a 00 81 40 81 80 81 00 a9 40 d1 c0
01 01 01 01 01 01 56 5e 00 a0 a0 a0 29 50 30 20
35 00 4b 4a 21 00 00 1a 00 00 00 fd 0c 28 f0 87
87 6a 01 0a 20 20 20 20 20 20 00 00 00 fc 00 58
47 32 37 41 51 44 4d 47 0a 20 20 20 00 00 00 ff
00 53 36 4c 4d 52 53 30 30 31 38 35 39 0a 02 26

----------------

Block 0, Base EDID:
  EDID Structure Version & Revision: 1.4
  Vendor & Product Identification:
    Manufacturer: AUS
    Model: 10226
    Serial Number: ...
    Made in: week 24 of 2024
  Basic Display Parameters & Features:
    Digital display
    Bits per primary color channel: 10
    DisplayPort interface
    Maximum image size: 59 cm x 33 cm
    Gamma: 2.20
    DPMS levels: Off
    Supported color formats: RGB 4:4:4, YCrCb 4:4:4, YCrCb 4:2:2
    First detailed timing includes the native pixel format and preferred refresh rate
    Display supports continuous frequencies
  Color Characteristics:
    Red  : 0.6767, 0.3212
    Green: 0.2470, 0.6835
    Blue : 0.1445, 0.0488
    White: 0.3125, 0.3281
  Established Timings I & II:
    DMT 0x04:   640x480    59.940476 Hz   4:3     31.469 kHz     25.175000 MHz
    DMT 0x06:   640x480    75.000000 Hz   4:3     37.500 kHz     31.500000 MHz
    DMT 0x09:   800x600    60.316541 Hz   4:3     37.879 kHz     40.000000 MHz
    DMT 0x0b:   800x600    75.000000 Hz   4:3     46.875 kHz     49.500000 MHz
    DMT 0x10:  1024x768    60.003840 Hz   4:3     48.363 kHz     65.000000 MHz
    DMT 0x12:  1024x768    75.028582 Hz   4:3     60.023 kHz     78.750000 MHz
  Standard Timings:
    DMT 0x20:  1280x960    60.000000 Hz   4:3     60.000 kHz    108.000000 MHz
    DMT 0x23:  1280x1024   60.019740 Hz   5:4     63.981 kHz    108.000000 MHz
    DMT 0x1c:  1280x800    59.810326 Hz  16:10    49.702 kHz     83.500000 MHz
    DMT 0x33:  1600x1200   60.000000 Hz   4:3     75.000 kHz    162.000000 MHz
    DMT 0x52:  1920x1080   60.000000 Hz  16:9     67.500 kHz    148.500000 MHz
  Detailed Timing Descriptors:
    DTD 1:  2560x1440   59.950550 Hz  16:9     88.787 kHz    241.500000 MHz (587 mm x 330 mm)
                 Hfront   48 Hsync  32 Hback   80 Hpol P
                 Vfront    3 Vsync   5 Vback   33 Vpol N
    Display Range Limits:
      Monitor ranges (Range Limits Only): 40-240 Hz V, 390-390 kHz H, max dotclock 1060 MHz
    Display Product Name: 'XG27AQDMG'
    Display Product Serial Number: ...
  Extension blocks: 2
Checksum: 0x26

----------------

Block 1, CTA-861 Extension Block:
  Revision: 3
  Underscans IT Video Formats by default
  Basic audio support
  Supports YCbCr 4:4:4
  Supports YCbCr 4:2:2
  Native DTDs: 1
  Video Data Block:
    VIC   4:  1280x720    60.000000 Hz  16:9     45.000 kHz     74.250000 MHz
    VIC  19:  1280x720    50.000000 Hz  16:9     37.500 kHz     74.250000 MHz
    VIC  16:  1920x1080   60.000000 Hz  16:9     67.500 kHz    148.500000 MHz
    VIC  31:  1920x1080   50.000000 Hz  16:9     56.250 kHz    148.500000 MHz
    VIC  63:  1920x1080  120.000000 Hz  16:9    135.000 kHz    297.000000 MHz
    VIC  64:  1920x1080  100.000000 Hz  16:9    112.500 kHz    297.000000 MHz
    VIC  34:  1920x1080   30.000000 Hz  16:9     33.750 kHz     74.250000 MHz
    VIC  33:  1920x1080   25.000000 Hz  16:9     28.125 kHz     74.250000 MHz
    VIC  32:  1920x1080   24.000000 Hz  16:9     27.000 kHz     74.250000 MHz
    VIC   3:   720x480    59.940060 Hz  16:9     31.469 kHz     27.000000 MHz
    VIC  18:   720x576    50.000000 Hz  16:9     31.250 kHz     27.000000 MHz
    VIC   2:   720x480    59.940060 Hz   4:3     31.469 kHz     27.000000 MHz
    VIC  17:   720x576    50.000000 Hz   4:3     31.250 kHz     27.000000 MHz
    VIC   1:   640x480    59.940476 Hz   4:3     31.469 kHz     25.175000 MHz
  Audio Data Block:
    Linear PCM:
      Max channels: 2
      Supported sample rates (kHz): 48 44.1 32
      Supported sample sizes (bits): 24 20 16
  Speaker Allocation Data Block:
    FL/FR - Front Left/Right
  Video Capability Data Block:
    YCbCr quantization: Selectable (via AVI YQ)
    RGB quantization: Selectable (via AVI Q)
    PT scan behavior: Always Underscanned
    IT scan behavior: Always Underscanned
    CE scan behavior: Always Underscanned
  Vendor-Specific Data Block (AMD), OUI 00-00-1A:
    Version: 2
    Feature Caps: 0x01
    Minimum Refresh Rate: 40 Hz
    Maximum Refresh Rate: 240 Hz
    Flags 1.x: 0x00
    Flags 2.x: 0x84
  Detailed Timing Descriptors:
    DTD 2:  2560x1440  143.973257 Hz  16:9    222.151 kHz    604.250000 MHz (587 mm x 330 mm)
                 Hfront   48 Hsync  32 Hback   80 Hpol P
                 Vfront    3 Vsync   5 Vback   95 Vpol N
    DTD 3:  2560x1440  119.997589 Hz  16:9    182.996 kHz    497.750000 MHz (587 mm x 330 mm)
                 Hfront   48 Hsync  32 Hback   80 Hpol P
                 Vfront    3 Vsync   5 Vback   77 Vpol N
    DTD 4:  1920x1080  239.988921 Hz  16:9    291.587 kHz    606.500000 MHz (587 mm x 330 mm)
                 Hfront   48 Hsync  32 Hback   80 Hpol P
                 Vfront    3 Vsync   5 Vback  127 Vpol N
Checksum: 0x1d  Unused space in Extension Block: 29 bytes

----------------

Warnings:

Block 1, CTA-861 Extension Block:
  Video Data Block: VIC 4 and the first DTD are not identical. Is this intended?
  Video Capability Data Block: S_PT is equal to S_IT and S_CE, so should be set to 0 instead.
  Display Product Serial Number is set, so the Serial Number in the Base EDID should be 0.
  Add a Colorimetry Data Block with the sRGB colorimetry bit set to avoid interop issues.
EDID:
  Base EDID: Some timings are out of range of the Monitor Ranges:
    Vertical Freq: 24.000 - 239.989 Hz (Monitor: 40.000 - 240.000 Hz)
    Horizontal Freq: 27.000 - 291.586 kHz (Monitor: 390.000 - 390.000 kHz)

Failures:

EDID:
  Extension Block 2 started with EDID header, ignoring Extension Blocks >= 2.
  Base EDID: EDID specified 2 extension block(s), but found 1 extension block(s).

EDID conformity: FAIL
