edid-decode (hex):

00 ff ff ff ff ff ff 00 0c f4 1b 00 01 00 00 00
2d 12 01 03 80 16 0d 00 ee 00 00 00 00 00 00 00
00 00 00 00 00 00 45 c0 01 01 01 01 01 01 01 01
01 01 01 01 01 01 99 0c 20 e0 30 e0 2d 10 2a 80
a2 00 de 84 00 00 00 18 00 00 00 10 00 00 00 00
00 00 00 00 00 00 00 00 00 00 00 00 00 fe 00 63
6f 6e 67 61 74 65 63 20 41 47 0a 20 00 00 00 0e
00 01 20 00 00 00 00 00 00 00 00 00 00 10 00 e8

00 ff ff ff ff ff ff 00 0c f4 1b 00 01 00 00 00
2d 12 01 03 80 16 0d 00 ee 00 00 00 00 00 00 00
00 00 00 00 00 00 45 c0 01 01 01 01 01 01 01 01
01 01 01 01 01 01 99 0c 20 e0 30 e0 2d 10 2a 80
a2 00 de 84 00 00 00 18 00 00 00 10 00 00 00 00
00 00 00 00 00 00 00 00 00 00 00 00 00 fe 00 63
6f 6e 67 61 74 65 63 20 41 47 0a 20 00 00 00 0e
00 01 20 00 00 00 00 00 00 00 00 00 00 10 00 e8

----------------

Block 0, Base EDID:
  EDID Structure Version & Revision: 1.3
  Vendor & Product Identification:
    Manufacturer: CGT
    Model: 27
    Serial Number: ...
    Made in: week 45 of 2008
  Basic Display Parameters & Features:
    Digital display
    Maximum image size: 22 cm x 13 cm
    Gamma: 1.00
    DPMS levels: Standby Suspend Off
    RGB color display
    Default (sRGB) color space is primary color space
    First detailed timing is the preferred timing
  Color Characteristics:
    Red  : 0.0000, 0.0000
    Green: 0.0000, 0.0000
    Blue : 0.0000, 0.0000
    White: 0.0000, 0.0000
  Established Timings I & II: none
  Standard Timings:
    GTF     :   800x450    59.999308 Hz  16:9     27.960 kHz     27.736000 MHz
  Detailed Timing Descriptors:
    DTD 1:   800x480    59.988839 Hz   5:3     31.494 kHz     32.250000 MHz (222 mm x 132 mm)
                 Hfront   42 Hsync 128 Hback   54 Hpol N
                 Vfront   10 Vsync   2 Vback   33 Vpol N
    Dummy Descriptor:
    Alphanumeric Data String: 'congatec AG'
    EPI Descriptor:
      Bits per pixel: 24
      Pixels per clock: 1
      Data color mapping: conventional
      Interface type: LVDS TFT
      DE polarity: DE high active
      FPSCLK polarity: FPSCLK inverted
      Vertical display mode: normal
      Horizontal display mode: normal
      Total power on sequencing delay: VGA controller default
      Total power off sequencing delay: VGA controller default
      Contrast power on sequencing delay: VGA controller default
      Contrast power off sequencing delay: VGA controller default
      Backlight brightness control: 0 steps (ignored)
      Backlight enable at boot: on (ignored)
      Backlight control enable: disabled
      Contrast voltable control: 0 steps (ignored)
      Contrast control enable: disabled
      EPI Version: 1.0
Checksum: 0xe8

----------------

Warnings:

Block 0, Base EDID:
  Vendor & Product Identification: The serial number is one of the known dummy values, it should probably be set to 0.
  Basic Display Parameters & Features: sRGB is signaled, but the gamma != 2.2.

Failures:

Block 0, Base EDID:
  Basic Display Parameters & Features: sRGB is signaled, but the chromaticities do not match.
  Missing Display Product Name.
  Missing Display Range Limits Descriptor.
EDID:
  Extension Block 1 started with EDID header, ignoring Extension Blocks >= 1.

EDID conformity: FAIL
