edid-decode (hex):

00 ff ff ff ff ff ff 00 24 62 00 27 10 10 10 10
01 1c 01 03 80 3c 22 78 2a 4e 65 a9 55 4d 9c 26
10 50 54 a5 4b 00 71 4f 81 c0 81 00 81 80 95 00
a9 c0 b3 00 01 01 04 74 00 30 f2 70 5a 80 30 20
35 00 20 4f 31 00 00 1a 04 74 00 30 f2 70 5a 80
30 20 35 00 20 4f 31 00 00 1a 00 00 00 fc 00 32
37 37 39 55 48 0a 20 20 20 20 20 20 00 00 00 fd
00 1e 4b 1f 8c 21 00 0a 20 20 20 20 20 20 01 5f

02 03 3a f1 4f 00 00 5f 5e 5d 10 1f 20 04 13 12
11 03 02 01 23 09 7f 07 83 01 00 00 6d 03 0c 00
10 00 30 3c 20 00 60 03 02 01 67 00 00 00 00 00
00 00 e3 05 00 00 e2 0f 03 00 56 5e 00 a0 a0 a0
29 50 30 20 36 00 61 5c 21 00 00 1e 02 3a 80 18
71 38 2d 40 58 2c 45 00 61 5c 21 00 00 1e 00 00
00 00 00 00 00 00 00 00 00 00 00 00 00 00 00 00
00 00 00 00 00 00 00 00 00 00 00 00 00 00 00 a3

00 ff ff ff ff ff ff 00 24 62 00 27 10 10 10 10
01 1c 01 03 80 3c 22 78 2a 4e 65 a9 55 4d 9c 26
10 50 54 a5 4b 00 71 4f 81 c0 81 00 81 80 95 00
a9 c0 b3 00 01 01 04 74 00 30 f2 70 5a 80 30 20
35 00 20 4f 31 00 00 1a 04 74 00 30 f2 70 5a 80
30 20 35 00 20 4f 31 00 00 1a 00 00 00 fc 00 32
37 37 39 55 48 0a 20 20 20 20 20 20 00 00 00 fd
00 1e 4b 1f 8c 21 00 0a 20 20 20 20 20 20 01 5f

02 03 3a f1 4f 00 00 5f 5e 5d 10 1f 20 04 13 12
11 03 02 01 23 09 7f 07 83 01 00 00 6d 03 0c 00
10 00 30 3c 20 00 60 03 02 01 67 00 00 00 00 00
00 00 e3 05 00 00 e2 0f 03 00 56 5e 00 a0 a0 a0
29 50 30 20 36 00 61 5c 21 00 00 1e 02 3a 80 18
71 38 2d 40 58 2c 45 00 61 5c 21 00 00 1e 00 00
00 00 00 00 00 00 00 00 00 00 00 00 00 00 00 00
00 00 00 00 00 00 00 00 00 00 00 00 00 00 00 a3

----------------

Block 0, Base EDID:
  EDID Structure Version & Revision: 1.3
  Vendor & Product Identification:
    Manufacturer: ICB
    Model: 9984
    Serial Number: ...
    Made in: week 1 of 2018
  Basic Display Parameters & Features:
    Digital display
    Maximum image size: 60 cm x 34 cm
    Gamma: 2.20
    DPMS levels: Off
    RGB color display
    First detailed timing is the preferred timing
  Color Characteristics:
    Red  : 0.6611, 0.3320
    Green: 0.3037, 0.6113
    Blue : 0.1494, 0.0644
    White: 0.3134, 0.3291
  Established Timings I & II:
    IBM     :   720x400    70.081663 Hz   9:5     31.467 kHz     28.320000 MHz
    DMT 0x04:   640x480    59.940476 Hz   4:3     31.469 kHz     25.175000 MHz
    DMT 0x06:   640x480    75.000000 Hz   4:3     37.500 kHz     31.500000 MHz
    DMT 0x09:   800x600    60.316541 Hz   4:3     37.879 kHz     40.000000 MHz
    DMT 0x0b:   800x600    75.000000 Hz   4:3     46.875 kHz     49.500000 MHz
    DMT 0x10:  1024x768    60.003840 Hz   4:3     48.363 kHz     65.000000 MHz
    DMT 0x12:  1024x768    75.028582 Hz   4:3     60.023 kHz     78.750000 MHz
    DMT 0x24:  1280x1024   75.024675 Hz   5:4     79.976 kHz    135.000000 MHz
  Standard Timings:
    DMT 0x15:  1152x864    75.000000 Hz   4:3     67.500 kHz    108.000000 MHz
    DMT 0x55:  1280x720    60.000000 Hz  16:9     45.000 kHz     74.250000 MHz
    DMT 0x1c:  1280x800    59.810326 Hz  16:10    49.702 kHz     83.500000 MHz
    DMT 0x23:  1280x1024   60.019740 Hz   5:4     63.981 kHz    108.000000 MHz
    DMT 0x2f:  1440x900    59.887445 Hz  16:10    55.935 kHz    106.500000 MHz
    DMT 0x53:  1600x900    60.000000 Hz  16:9     60.000 kHz    108.000000 MHz (RB)
    DMT 0x3a:  1680x1050   59.954250 Hz  16:10    65.290 kHz    146.250000 MHz
  Detailed Timing Descriptors:
    DTD 1:  3840x2160   30.000000 Hz  16:9     67.500 kHz    297.000000 MHz (800 mm x 335 mm)
                 Hfront   48 Hsync  32 Hback  480 Hpol P
                 Vfront    3 Vsync   5 Vback   82 Vpol N
    DTD 2:  3840x2160   30.000000 Hz  16:9     67.500 kHz    297.000000 MHz (800 mm x 335 mm)
                 Hfront   48 Hsync  32 Hback  480 Hpol P
                 Vfront    3 Vsync   5 Vback   82 Vpol N
    Display Product Name: '2779UH'
    Display Range Limits:
      Monitor ranges (GTF): 30-75 Hz V, 31-140 kHz H, max dotclock 330 MHz
  Extension blocks: 1
Checksum: 0x5f

----------------

Block 1, CTA-861 Extension Block:
  Revision: 3
  Underscans IT Video Formats by default
  Basic audio support
  Supports YCbCr 4:4:4
  Supports YCbCr 4:2:2
  Native DTDs: 1
  Video Data Block:
    VIC  95:  3840x2160   30.000000 Hz  16:9     67.500 kHz    297.000000 MHz
    VIC  94:  3840x2160   25.000000 Hz  16:9     56.250 kHz    297.000000 MHz
    VIC  93:  3840x2160   24.000000 Hz  16:9     54.000 kHz    297.000000 MHz
    VIC  16:  1920x1080   60.000000 Hz  16:9     67.500 kHz    148.500000 MHz
    VIC  31:  1920x1080   50.000000 Hz  16:9     56.250 kHz    148.500000 MHz
    VIC  32:  1920x1080   24.000000 Hz  16:9     27.000 kHz     74.250000 MHz
    VIC   4:  1280x720    60.000000 Hz  16:9     45.000 kHz     74.250000 MHz
    VIC  19:  1280x720    50.000000 Hz  16:9     37.500 kHz     74.250000 MHz
    VIC  18:   720x576    50.000000 Hz  16:9     31.250 kHz     27.000000 MHz
    VIC  17:   720x576    50.000000 Hz   4:3     31.250 kHz     27.000000 MHz
    VIC   3:   720x480    59.940060 Hz  16:9     31.469 kHz     27.000000 MHz
    VIC   2:   720x480    59.940060 Hz   4:3     31.469 kHz     27.000000 MHz
    VIC   1:   640x480    59.940476 Hz   4:3     31.469 kHz     25.175000 MHz
  Audio Data Block:
    Linear PCM:
      Max channels: 2
      Supported sample rates (kHz): 192 176.4 96 88.2 48 44.1 32
      Supported sample sizes (bits): 24 20 16
  Speaker Allocation Data Block:
    FL/FR - Front Left/Right
  Vendor-Specific Data Block (HDMI), OUI 00-0C-03:
    Source physical address: 1.0.0.0
    DC_36bit
    DC_30bit
    Maximum TMDS clock: 300 MHz
    Extended HDMI video details:
      HDMI VICs:
        HDMI VIC 3:  3840x2160   24.000000 Hz  16:9     54.000 kHz    297.000000 MHz
        HDMI VIC 2:  3840x2160   25.000000 Hz  16:9     56.250 kHz    297.000000 MHz
        HDMI VIC 1:  3840x2160   30.000000 Hz  16:9     67.500 kHz    297.000000 MHz
  Vendor-Specific Data Block, OUI 00-00-00:
    00 00 00 00                                     '....'
  Colorimetry Data Block:
  YCbCr 4:2:0 Capability Map Data Block:
    Unknown (VIC   0)
    Unknown (VIC   0)
  Unknown CTA-861 Data Block (tag 0x00, length 0):
  Detailed Timing Descriptors:
    DTD 3:  2560x1440   59.950550 Hz  16:9     88.787 kHz    241.500000 MHz (609 mm x 348 mm)
                 Hfront   48 Hsync  32 Hback   80 Hpol P
                 Vfront    3 Vsync   6 Vback   32 Vpol P
    DTD 4:  1920x1080   60.000000 Hz  16:9     67.500 kHz    148.500000 MHz (609 mm x 348 mm)
                 Hfront   88 Hsync  44 Hback  148 Hpol P
                 Vfront    4 Vsync   5 Vback   36 Vpol P
Checksum: 0xa3  Unused space in Extension Block: 33 bytes

----------------

Warnings:

Block 0, Base EDID:
  Detailed Timing Descriptor #1: DTD is similar but not identical to VIC 95.
  Detailed Timing Descriptor #1: Image size is 800x335 mm, but based on the picture AR it should be 595x335 mm.
  Detailed Timing Descriptor #2: DTD is similar but not identical to VIC 95.
  Detailed Timing Descriptor #2: Image size is 800x335 mm, but based on the picture AR it should be 595x335 mm.
Block 1, CTA-861 Extension Block:
  Video Data Block: VIC 95 and the first DTD are not identical. Is this intended?
  Vendor-Specific Data Block, OUI 00-00-00: All zeroes OUI.
  Colorimetry Data Block: Set the sRGB colorimetry bit to avoid interop issues.
  Unknown CTA-861 Data Block (tag 0x00, length 0).
EDID:
  Base EDID: Some timings are out of range of the Monitor Ranges:
    Vertical Freq: 24.000 - 75.029 Hz (Monitor: 30.000 - 75.000 Hz)
    Horizontal Freq: 27.000 - 88.786 kHz (Monitor: 31.000 - 140.000 kHz)

Failures:

Block 0, Base EDID:
  Detailed Timing Descriptor #1: Mismatch of image size 800x335 mm vs display size 600x340 mm.
  Detailed Timing Descriptor #2: Mismatch of image size 800x335 mm vs display size 600x340 mm.
Block 1, CTA-861 Extension Block:
  Missing VCDB, needed for Set Selectable RGB Quantization to avoid interop issues.
EDID:
  Extension Block 2 started with EDID header, ignoring Extension Blocks >= 2.
  Base EDID: The DTD max image size is 800x348mm, which is larger than the display size 600.0x340.0mm.

EDID conformity: FAIL
