edid-decode (hex):

00 ff ff ff ff ff ff 00 4c a3 54 32 00 00 00 00
00 12 01 03 80 25 17 78 0a 87 f5 94 57 4f 8c 27
27 50 54 00 00 00 01 01 01 01 01 01 01 01 01 01
01 01 01 01 01 01 1c 2a 40 00 61 84 44 30 40 20
33 00 6f e6 10 00 00 19 00 00 00 0f 00 00 00 00
00 00 00 00 00 78 e6 02 23 00 00 00 00 fe 00 53
41 4d 53 55 4e 47 0a 20 20 20 20 20 00 00 00 fe
00 31 37 33 4b 54 30 31 2d 31 30 31 0a 20 00 2f

----------------

Block 0, Base EDID:
  EDID Structure Version & Revision: 1.3
  Vendor & Product Identification:
    Manufacturer: SEC
    Model: 12884
    Made in: 2008
  Basic Display Parameters & Features:
    Digital display
    Maximum image size: 37 cm x 23 cm
    Gamma: 2.20
    RGB color display
    First detailed timing is the preferred timing
  Color Characteristics:
    Red  : 0.5800, 0.3398
    Green: 0.3095, 0.5498
    Blue : 0.1552, 0.1552
    White: 0.3134, 0.3291
  Established Timings I & II: none
  Standard Timings: none
  Detailed Timing Descriptors:
    DTD 1:  1600x900    60.001959 Hz  16:9     58.082 kHz    107.800000 MHz (367 mm x 230 mm)
                 Hfront   64 Hsync  32 Hback  160 Hpol N
                 Vfront    3 Vsync   3 Vback   62 Vpol N
    Manufacturer-Specified Display Descriptor (0x0f): 00 0f 00 00 00 00 00 00 00 00 00 78 e6 02 23 00 '...........x..#.'
    Alphanumeric Data String: 'SAMSUNG'
    Alphanumeric Data String: '173KT01-101'
Checksum: 0x2f

----------------

Warnings:

Block 0, Base EDID:
  Detailed Timing Descriptor #1: Image size is 367x230 mm, but based on the picture AR it should be 367x206 mm.

Failures:

Block 0, Base EDID:
  Missing Display Product Name.
  Missing Display Range Limits Descriptor.

EDID conformity: FAIL
