edid-decode (hex):

00 ff ff ff ff ff ff 00 06 b3 35 34 6a a2 01 00
08 22 01 04 b5 50 21 78 3b 58 10 aa 50 46 a3 24
10 50 54 bf cf 00 81 40 81 80 95 00 71 4f 81 c0
b3 00 d1 c0 01 01 e7 7c 70 a0 d0 a0 29 50 30 20
3a 00 1d 4e 31 00 00 1a 00 00 00 fd 00 30 a5 e0
e0 51 01 0a 20 20 20 20 20 20 00 00 00 fc 00 41
53 55 53 20 56 47 33 34 56 0a 20 20 00 00 00 ff
00 53 32 4c 4d 54 46 31 30 37 31 31 34 0a 02 49

00 ff ff ff ff ff ff 00 06 b3 35 34 6a a2 01 00
08 22 01 04 b5 50 21 78 3b 58 10 aa 50 46 a3 24
10 50 54 bf cf 00 81 40 81 80 95 00 71 4f 81 c0
b3 00 d1 c0 01 01 e7 7c 70 a0 d0 a0 29 50 30 20
3a 00 1d 4e 31 00 00 1a 00 00 00 fd 00 30 a5 e0
e0 51 01 0a 20 20 20 20 20 20 00 00 00 fc 00 41
53 55 53 20 56 47 33 34 56 0a 20 20 00 00 00 ff
00 53 32 4c 4d 54 46 31 30 37 31 31 34 0a 02 49

00 ff ff ff ff ff ff 00 06 b3 35 34 6a a2 01 00
08 22 01 04 b5 50 21 78 3b 58 10 aa 50 46 a3 24
10 50 54 bf cf 00 81 40 81 80 95 00 71 4f 81 c0
b3 00 d1 c0 01 01 e7 7c 70 a0 d0 a0 29 50 30 20
3a 00 1d 4e 31 00 00 1a 00 00 00 fd 00 30 a5 e0
e0 51 01 0a 20 20 20 20 20 20 00 00 00 fc 00 41
53 55 53 20 56 47 33 34 56 0a 20 20 00 00 00 ff
00 53 32 4c 4d 54 46 31 30 37 31 31 34 0a 02 49

00 ff ff ff ff ff ff 00 06 b3 35 34 6a a2 01 00
08 22 01 04 b5 50 21 78 3b 58 10 aa 50 46 a3 24
10 50 54 bf cf 00 81 40 81 80 95 00 71 4f 81 c0
b3 00 d1 c0 01 01 e7 7c 70 a0 d0 a0 29 50 30 20
3a 00 1d 4e 31 00 00 1a 00 00 00 fd 00 30 a5 e0
e0 51 01 0a 20 20 20 20 20 20 00 00 00 fc 00 41
53 55 53 20 56 47 33 34 56 0a 20 20 00 00 00 ff
00 53 32 4c 4d 54 46 31 30 37 31 31 34 0a 02 49

00 ff ff ff ff ff ff 00 06 b3 35 34 6a a2 01 00
08 22 01 04 b5 50 21 78 3b 58 10 aa 50 46 a3 24
10 50 54 bf cf 00 81 40 81 80 95 00 71 4f 81 c0
b3 00 d1 c0 01 01 e7 7c 70 a0 d0 a0 29 50 30 20
3a 00 1d 4e 31 00 00 1a 00 00 00 fd 00 30 a5 e0
e0 51 01 0a 20 20 20 20 20 20 00 00 00 fc 00 41
53 55 53 20 56 47 33 34 56 0a 20 20 00 00 00 ff
00 53 32 4c 4d 54 46 31 30 37 31 31 34 0a 02 49

00 ff ff ff ff ff ff 00 06 b3 35 34 6a a2 01 00
08 22 01 04 b5 50 21 78 3b 58 10 aa 50 46 a3 24
10 50 54 bf cf 00 81 40 81 80 95 00 71 4f 81 c0
b3 00 d1 c0 01 01 e7 7c 70 a0 d0 a0 29 50 30 20
3a 00 1d 4e 31 00 00 1a 00 00 00 fd 00 30 a5 e0
e0 51 01 0a 20 20 20 20 20 20 00 00 00 fc 00 41
53 55 53 20 56 47 33 34 56 0a 20 20 00 00 00 ff
00 53 32 4c 4d 54 46 31 30 37 31 31 34 0a 02 49

----------------

Block 0, Base EDID:
  EDID Structure Version & Revision: 1.4
  Vendor & Product Identification:
    Manufacturer: AUS
    Model: 13365
    Serial Number: ...
    Made in: week 8 of 2024
  Basic Display Parameters & Features:
    Digital display
    Bits per primary color channel: 10
    DisplayPort interface
    Maximum image size: 80 cm x 33 cm
    Gamma: 2.20
    DPMS levels: Off
    Supported color formats: RGB 4:4:4, YCrCb 4:4:4, YCrCb 4:2:2
    First detailed timing includes the native pixel format and preferred refresh rate
    Display supports continuous frequencies
  Color Characteristics:
    Red  : 0.6650, 0.3134
    Green: 0.2753, 0.6367
    Blue : 0.1406, 0.0634
    White: 0.3125, 0.3281
  Established Timings I & II:
    IBM     :   720x400    70.081663 Hz   9:5     31.467 kHz     28.320000 MHz
    DMT 0x04:   640x480    59.940476 Hz   4:3     31.469 kHz     25.175000 MHz
    Apple   :   640x480    66.666667 Hz   4:3     35.000 kHz     30.240000 MHz
    DMT 0x05:   640x480    72.808802 Hz   4:3     37.861 kHz     31.500000 MHz
    DMT 0x06:   640x480    75.000000 Hz   4:3     37.500 kHz     31.500000 MHz
    DMT 0x08:   800x600    56.250000 Hz   4:3     35.156 kHz     36.000000 MHz
    DMT 0x09:   800x600    60.316541 Hz   4:3     37.879 kHz     40.000000 MHz
    DMT 0x0a:   800x600    72.187572 Hz   4:3     48.077 kHz     50.000000 MHz
    DMT 0x0b:   800x600    75.000000 Hz   4:3     46.875 kHz     49.500000 MHz
    DMT 0x10:  1024x768    60.003840 Hz   4:3     48.363 kHz     65.000000 MHz
    DMT 0x11:  1024x768    70.069359 Hz   4:3     56.476 kHz     75.000000 MHz
    DMT 0x12:  1024x768    75.028582 Hz   4:3     60.023 kHz     78.750000 MHz
    DMT 0x24:  1280x1024   75.024675 Hz   5:4     79.976 kHz    135.000000 MHz
  Standard Timings:
    DMT 0x20:  1280x960    60.000000 Hz   4:3     60.000 kHz    108.000000 MHz
    DMT 0x23:  1280x1024   60.019740 Hz   5:4     63.981 kHz    108.000000 MHz
    DMT 0x2f:  1440x900    59.887445 Hz  16:10    55.935 kHz    106.500000 MHz
    DMT 0x15:  1152x864    75.000000 Hz   4:3     67.500 kHz    108.000000 MHz
    DMT 0x55:  1280x720    60.000000 Hz  16:9     45.000 kHz     74.250000 MHz
    DMT 0x3a:  1680x1050   59.954250 Hz  16:10    65.290 kHz    146.250000 MHz
    DMT 0x52:  1920x1080   60.000000 Hz  16:9     67.500 kHz    148.500000 MHz
  Detailed Timing Descriptors:
    DTD 1:  3440x1440   59.972616 Hz  43:18    88.819 kHz    319.750000 MHz (797 mm x 334 mm)
                 Hfront   48 Hsync  32 Hback   80 Hpol P
                 Vfront    3 Vsync  10 Vback   28 Vpol N
    Display Range Limits:
      Monitor ranges (Range Limits Only): 48-165 Hz V, 224-224 kHz H, max dotclock 810 MHz
    Display Product Name: 'ASUS VG34V'
    Display Product Serial Number: ...
  Extension blocks: 2
Checksum: 0x49

----------------

Warnings:

EDID:
  Base EDID: Some timings are out of range of the Monitor Ranges:
    Horizontal Freq: 31.466 - 88.819 kHz (Monitor: 224.000 - 224.000 kHz)

Failures:

EDID:
  Extension Block 1 started with EDID header, ignoring Extension Blocks >= 1.
  Base EDID: EDID specified 2 extension block(s), but found 0 extension block(s).

EDID conformity: FAIL
