edid-decode (hex):

00 ff ff ff ff ff ff 00 06 b3 35 34 3b e9 00 00
24 21 01 03 80 50 21 78 0a 58 10 aa 50 46 a3 24
10 50 54 bf cf 00 81 40 81 80 95 00 71 4f 81 c0
b3 00 d1 c0 01 01 e7 7c 70 a0 d0 a0 29 50 30 20
3a 00 1d 4e 31 00 00 1a 00 00 00 fd 00 30 90 1e
a0 3c 01 0a 20 20 20 20 20 20 00 00 00 fc 00 41
53 55 53 20 56 47 33 34 56 0a 20 20 00 00 00 ff
00 52 39 4c 4d 54 46 30 35 39 37 30 37 0a 01 97

02 03 48 f1 4c 61 60 1f 90 14 01 03 04 12 13 02
3f 23 09 07 07 83 01 00 00 e2 00 d5 67 03 0c 00
10 00 30 3c 67 d8 5d c4 01 78 80 03 6d 1a 00 00
02 01 30 90 f0 00 00 00 00 00 e3 05 c0 81 e2 0f
03 e6 06 05 01 73 73 1c 40 e7 00 6a a0 a0 67 50
08 20 98 04 1d 4e 31 00 00 1a 1c 40 b8 a0 60 a0
0f 50 30 20 18 00 1d 4e 31 00 00 1a 4e d4 70 a0
d0 a0 46 50 30 40 3a 00 1d 4e 31 00 00 1c 00 a9

00 ff ff ff ff ff ff 00 06 b3 35 34 3b e9 00 00
24 21 01 03 80 50 21 78 0a 58 10 aa 50 46 a3 24
10 50 54 bf cf 00 81 40 81 80 95 00 71 4f 81 c0
b3 00 d1 c0 01 01 e7 7c 70 a0 d0 a0 29 50 30 20
3a 00 1d 4e 31 00 00 1a 00 00 00 fd 00 30 90 1e
a0 3c 01 0a 20 20 20 20 20 20 00 00 00 fc 00 41
53 55 53 20 56 47 33 34 56 0a 20 20 00 00 00 ff
00 52 39 4c 4d 54 46 30 35 39 37 30 37 0a 01 97

02 03 48 f1 4c 61 60 1f 90 14 01 03 04 12 13 02
3f 23 09 07 07 83 01 00 00 e2 00 d5 67 03 0c 00
10 00 30 3c 67 d8 5d c4 01 78 80 03 6d 1a 00 00
02 01 30 90 f0 00 00 00 00 00 e3 05 c0 81 e2 0f
03 e6 06 05 01 73 73 1c 40 e7 00 6a a0 a0 67 50
08 20 98 04 1d 4e 31 00 00 1a 1c 40 b8 a0 60 a0
0f 50 30 20 18 00 1d 4e 31 00 00 1a 4e d4 70 a0
d0 a0 46 50 30 40 3a 00 1d 4e 31 00 00 1c 00 a9

----------------

Block 0, Base EDID:
  EDID Structure Version & Revision: 1.3
  Vendor & Product Identification:
    Manufacturer: AUS
    Model: 13365
    Serial Number: ...
    Made in: week 36 of 2023
  Basic Display Parameters & Features:
    Digital display
    Maximum image size: 80 cm x 33 cm
    Gamma: 2.20
    RGB color display
    First detailed timing is the preferred timing
  Color Characteristics:
    Red  : 0.6650, 0.3134
    Green: 0.2753, 0.6367
    Blue : 0.1406, 0.0634
    White: 0.3125, 0.3281
  Established Timings I & II:
    IBM     :   720x400    70.081663 Hz   9:5     31.467 kHz     28.320000 MHz
    DMT 0x04:   640x480    59.940476 Hz   4:3     31.469 kHz     25.175000 MHz
    Apple   :   640x480    66.666667 Hz   4:3     35.000 kHz     30.240000 MHz
    DMT 0x05:   640x480    72.808802 Hz   4:3     37.861 kHz     31.500000 MHz
    DMT 0x06:   640x480    75.000000 Hz   4:3     37.500 kHz     31.500000 MHz
    DMT 0x08:   800x600    56.250000 Hz   4:3     35.156 kHz     36.000000 MHz
    DMT 0x09:   800x600    60.316541 Hz   4:3     37.879 kHz     40.000000 MHz
    DMT 0x0a:   800x600    72.187572 Hz   4:3     48.077 kHz     50.000000 MHz
    DMT 0x0b:   800x600    75.000000 Hz   4:3     46.875 kHz     49.500000 MHz
    DMT 0x10:  1024x768    60.003840 Hz   4:3     48.363 kHz     65.000000 MHz
    DMT 0x11:  1024x768    70.069359 Hz   4:3     56.476 kHz     75.000000 MHz
    DMT 0x12:  1024x768    75.028582 Hz   4:3     60.023 kHz     78.750000 MHz
    DMT 0x24:  1280x1024   75.024675 Hz   5:4     79.976 kHz    135.000000 MHz
  Standard Timings:
    DMT 0x20:  1280x960    60.000000 Hz   4:3     60.000 kHz    108.000000 MHz
    DMT 0x23:  1280x1024   60.019740 Hz   5:4     63.981 kHz    108.000000 MHz
    DMT 0x2f:  1440x900    59.887445 Hz  16:10    55.935 kHz    106.500000 MHz
    DMT 0x15:  1152x864    75.000000 Hz   4:3     67.500 kHz    108.000000 MHz
    DMT 0x55:  1280x720    60.000000 Hz  16:9     45.000 kHz     74.250000 MHz
    DMT 0x3a:  1680x1050   59.954250 Hz  16:10    65.290 kHz    146.250000 MHz
    DMT 0x52:  1920x1080   60.000000 Hz  16:9     67.500 kHz    148.500000 MHz
  Detailed Timing Descriptors:
    DTD 1:  3440x1440   59.972616 Hz  43:18    88.819 kHz    319.750000 MHz (797 mm x 334 mm)
                 Hfront   48 Hsync  32 Hback   80 Hpol P
                 Vfront    3 Vsync  10 Vback   28 Vpol N
    Display Range Limits:
      Monitor ranges (Range Limits Only): 48-144 Hz V, 30-160 kHz H, max dotclock 600 MHz
    Display Product Name: 'ASUS VG34V'
    Display Product Serial Number: ...
  Extension blocks: 1
Checksum: 0x97

----------------

Block 1, CTA-861 Extension Block:
  Revision: 3
  Underscans IT Video Formats by default
  Basic audio support
  Supports YCbCr 4:4:4
  Supports YCbCr 4:2:2
  Native DTDs: 1
  Video Data Block:
    VIC  97:  3840x2160   60.000000 Hz  16:9    135.000 kHz    594.000000 MHz
    VIC  96:  3840x2160   50.000000 Hz  16:9    112.500 kHz    594.000000 MHz
    VIC  31:  1920x1080   50.000000 Hz  16:9     56.250 kHz    148.500000 MHz
    VIC  16:  1920x1080   60.000000 Hz  16:9     67.500 kHz    148.500000 MHz (native)
    VIC  20:  1920x1080i  50.000000 Hz  16:9     28.125 kHz     74.250000 MHz
    VIC   1:   640x480    59.940476 Hz   4:3     31.469 kHz     25.175000 MHz
    VIC   3:   720x480    59.940060 Hz  16:9     31.469 kHz     27.000000 MHz
    VIC   4:  1280x720    60.000000 Hz  16:9     45.000 kHz     74.250000 MHz
    VIC  18:   720x576    50.000000 Hz  16:9     31.250 kHz     27.000000 MHz
    VIC  19:  1280x720    50.000000 Hz  16:9     37.500 kHz     74.250000 MHz
    VIC   2:   720x480    59.940060 Hz   4:3     31.469 kHz     27.000000 MHz
    VIC  63:  1920x1080  120.000000 Hz  16:9    135.000 kHz    297.000000 MHz
  Audio Data Block:
    Linear PCM:
      Max channels: 2
      Supported sample rates (kHz): 48 44.1 32
      Supported sample sizes (bits): 24 20 16
  Speaker Allocation Data Block:
    FL/FR - Front Left/Right
  Video Capability Data Block:
    YCbCr quantization: Selectable (via AVI YQ)
    RGB quantization: Selectable (via AVI Q)
    PT scan behavior: Always Overscanned
    IT scan behavior: Always Overscanned
    CE scan behavior: Always Overscanned
  Vendor-Specific Data Block (HDMI), OUI 00-0C-03:
    Source physical address: 1.0.0.0
    DC_36bit
    DC_30bit
    Maximum TMDS clock: 300 MHz
  Vendor-Specific Data Block (HDMI Forum), OUI C4-5D-D8:
    Version: 1
    Maximum TMDS Character Rate: 600 MHz
    SCDC Present
    Supports 12-bits/component Deep Color 4:2:0 Pixel Encoding
    Supports 10-bits/component Deep Color 4:2:0 Pixel Encoding
  Vendor-Specific Data Block (AMD), OUI 00-00-1A:
    Version: 2
    Feature Caps: 0x01
    Minimum Refresh Rate: 48 Hz
    Maximum Refresh Rate: 144 Hz
    Flags 1.x: 0xf0 (MCCS)
    Flags 2.x: 0x00
  Colorimetry Data Block:
    BT2020YCC
    BT2020RGB
    Gamut Boundary Description Metadata Profile P0
    ST2113RGB
  YCbCr 4:2:0 Capability Map Data Block:
    VIC  97:  3840x2160   60.000000 Hz  16:9    135.000 kHz    594.000000 MHz
    VIC  96:  3840x2160   50.000000 Hz  16:9    112.500 kHz    594.000000 MHz
  HDR Static Metadata Data Block:
    Electro optical transfer functions:
      Traditional gamma - SDR luminance range
      SMPTE ST2084
    Supported static metadata descriptors:
      Static metadata type 1
    Desired content max luminance: 115 (603.666 cd/m^2)
    Desired content max frame-average luminance: 115 (603.666 cd/m^2)
    Desired content min luminance: 28 (0.073 cd/m^2)
  Detailed Timing Descriptors:
    DTD 2:  2560x1440  143.911545 Hz  16:9    222.056 kHz    592.000000 MHz (797 mm x 334 mm)
                 Hfront    8 Hsync  32 Hback   66 Hpol P
                 Vfront   25 Vsync   8 Vback   70 Vpol N
    DTD 3:  1720x1440   59.998538 Hz  43:36    87.298 kHz    164.120000 MHz (797 mm x 334 mm)
                 Hfront   48 Hsync  32 Hback   80 Hpol P
                 Vfront    1 Vsync   8 Vback    6 Vpol N
    DTD 4:  3440x1440   99.981604 Hz  43:18   150.972 kHz    543.500000 MHz (797 mm x 334 mm)
                 Hfront   48 Hsync  64 Hback   48 Hpol N
                 Vfront    3 Vsync  10 Vback   57 Vpol P
Checksum: 0xa9  Unused space in Extension Block: 1 byte

----------------

Warnings:

Block 1, CTA-861 Extension Block:
  Video Data Block: VIC 97 and the first DTD are not identical. Is this intended?
  Video Capability Data Block: IT scan behavior is expected to support underscanned.
  Video Capability Data Block: S_PT is equal to S_IT and S_CE, so should be set to 0 instead.
  Colorimetry Data Block: Set the sRGB colorimetry bit to avoid interop issues.
  Detailed Timing Descriptor #2: Image size is 797x334 mm, but based on the picture AR it should be 593x334 mm.
  Detailed Timing Descriptor #3: Image size is 797x334 mm, but based on the picture AR it should be 398x334 mm.
  Display Product Serial Number is set, so the Serial Number in the Base EDID should be 0.
EDID:
  Base EDID: Some timings are out of range of the Monitor Ranges:
    Horizontal Freq: 28.125 - 222.055 kHz (Monitor: 30.000 - 160.000 kHz)

Failures:

Block 0, Base EDID:
  Display Range Limits: 'Range Limits Only' is not allowed for EDID < 1.4.
Block 1, CTA-861 Extension Block:
  Video Capability Data Block: IT video formats are always overscanned, but bit 7 of Byte 3 of the CTA-861 Extension header is set to underscanned.
EDID:
  Extension Block 2 started with EDID header, ignoring Extension Blocks >= 2.
  CTA-861: Native progressive timings are a mix of several resolutions.

EDID conformity: FAIL
