edid-decode (hex):

00 ff ff ff ff ff ff 00 0e 77 32 16 00 00 00 00
00 21 01 04 a5 22 16 78 03 ee 95 a3 54 4c 99 26
0f 50 54 00 00 00 01 01 01 01 01 01 01 01 01 01
01 01 01 01 01 01 60 6c 00 a0 a0 40 64 60 30 20
36 00 58 d7 10 00 00 18 00 00 00 fd 0c 30 a5 1a
1a 4d 01 0a 20 20 20 20 20 20 00 00 00 fc 00 4d
4e 47 30 30 37 44 41 35 2d 31 0a 20 00 00 00 fe
00 43 53 4f 54 20 54 33 0a 20 20 20 20 20 01 1c

70 20 79 02 00 21 00 1d 77 0d 6a 08 00 0a 40 06
00 3d 8a 54 9a d9 4c 66 62 0f 02 45 54 00 80 00
80 00 80 12 78 22 00 14 4f a4 0b 85 ff 09 9f 00
2f 00 1f 00 3f 06 63 00 02 00 05 00 2b 00 0c 27
00 30 3b 00 00 27 00 3c a4 00 00 81 00 14 74 1a
00 00 03 01 30 a5 00 04 00 00 00 00 a5 00 8d 36
0e 00 00 00 00 00 00 00 00 00 00 00 00 00 00 00
00 00 00 00 00 00 00 00 00 00 00 00 00 00 e8 90

00 ff ff ff ff ff ff 00 0e 77 32 16 00 00 00 00
00 21 01 04 a5 22 16 78 03 ee 95 a3 54 4c 99 26
0f 50 54 00 00 00 01 01 01 01 01 01 01 01 01 01
01 01 01 01 01 01 60 6c 00 a0 a0 40 64 60 30 20
36 00 58 d7 10 00 00 18 00 00 00 fd 0c 30 a5 1a
1a 4d 01 0a 20 20 20 20 20 20 00 00 00 fc 00 4d
4e 47 30 30 37 44 41 35 2d 31 0a 20 00 00 00 fe
00 43 53 4f 54 20 54 33 0a 20 20 20 20 20 01 1c

70 20 79 02 00 21 00 1d 77 0d 6a 08 00 0a 40 06
00 3d 8a 54 9a d9 4c 66 62 0f 02 45 54 00 80 00
80 00 80 12 78 22 00 14 4f a4 0b 85 ff 09 9f 00
2f 00 1f 00 3f 06 63 00 02 00 05 00 2b 00 0c 27
00 30 3b 00 00 27 00 3c a4 00 00 81 00 14 74 1a
00 00 03 01 30 a5 00 04 00 00 00 00 a5 00 8d 36
0e 00 00 00 00 00 00 00 00 00 00 00 00 00 00 00
00 00 00 00 00 00 00 00 00 00 00 00 00 00 e8 90

----------------

Block 0, Base EDID:
  EDID Structure Version & Revision: 1.4
  Vendor & Product Identification:
    Manufacturer: CSW
    Model: 5682
    Made in: 2023
  Basic Display Parameters & Features:
    Digital display
    Bits per primary color channel: 8
    DisplayPort interface
    Maximum image size: 34 cm x 22 cm
    Gamma: 2.20
    Supported color formats: RGB 4:4:4
    First detailed timing includes the native pixel format and preferred refresh rate
    Display supports continuous frequencies
  Color Characteristics:
    Red  : 0.6396, 0.3300
    Green: 0.2998, 0.5996
    Blue : 0.1503, 0.0595
    White: 0.3134, 0.3291
  Established Timings I & II: none
  Standard Timings: none
  Detailed Timing Descriptors:
    DTD 1:  2560x1600   60.000000 Hz  16:10   102.000 kHz    277.440000 MHz (344 mm x 215 mm)
                 Hfront   48 Hsync  32 Hback   80 Hpol N
                 Vfront    3 Vsync   6 Vback   91 Vpol N
    Display Range Limits:
      Monitor ranges (Range Limits Only): 48-165 Hz V, 281-281 kHz H, max dotclock 770 MHz
    Display Product Name: 'MNG007DA5-1'
    Alphanumeric Data String: 'CSOT T3'
  Extension blocks: 1
Checksum: 0x1c

----------------

Block 1, DisplayID Extension Block:
  Version: 2.0
  Extension Count: 0
  Display Product Primary Use Case: None of the listed primary use cases; generic display
  Display Parameters Data Block (0x21):
    Image size: 344.7 mm x 215.4 mm
    Display native pixel format: 2560x1600
    Scan Orientation: Left to Right, Top to Bottom
    Luminance Information: Minimum guaranteed value
    Color Information: CIE 1931
    Audio Speaker Information: integrated
    Native Color Chromaticity:
      Primary #1:  (0.639893, 0.330078)
      Primary #2:  (0.600098, 0.300049)
      Primary #3:  (0.149902, 0.060059)
      White Point: (0.312988, 0.329102)
    Native Maximum Luminance (Full Coverage): do not use
    Native Maximum Luminance (10% Rectangular Coverage): do not use
    Native Minimum Luminance: do not use
    Native Color Depth: 10 bpc
    Display Device Technology: Active Matrix LCD
    Native Gamma EOTF: 2.20
  Video Timing Modes Type 7 - Detailed Timings Data Block:
    DTD:  2560x1600  165.000000 Hz  16:10   280.500 kHz    762.960000 MHz (aspect 16:10, no 3D stereo, preferred)
               Hfront   48 Hsync  32 Hback   80 Hpol N
               Vfront    3 Vsync   6 Vback   91 Vpol N
  Adaptive Sync Data Block:
    Descriptor #1:
      Native Panel Range
      Fixed Average V-Total and Adaptive V-Total
      Supports Seamless Transition
      'Max Single Frame Duration Increase' field value without jitter impact
      'Max Single Frame Duration Decrease' field value without jitter impact
      Max Duration Increase: 0.00 ms
      Max Duration Decrease: 0.00 ms
      Min Refresh Rate: 48 Hz
      Max Refresh Rate: 60 Hz
    Descriptor #2:
      Native Panel Range
      Fixed Average V-Total and Adaptive V-Total
      Supports Seamless Transition
      'Max Single Frame Duration Increase' field value without jitter impact
      'Max Single Frame Duration Decrease' field value without jitter impact
      Max Duration Increase: 0.00 ms
      Max Duration Decrease: 0.00 ms
      Min Refresh Rate: 60 Hz
      Max Refresh Rate: 165 Hz
  CTA-861 DisplayID Data Block:
  Vendor-Specific Data Block (AMD), OUI 00-00-1A:
    Version: 3
    Feature Caps: 0x01
    Minimum Refresh Rate: 48 Hz
    Maximum Refresh Rate: 165 Hz
    Flags 1.x: 0x00
    Flags 2.x: 0x04
  Checksum: 0xe8
Checksum: 0x90

----------------

Block 2, Unknown EDID Extension Block 0x00:
  00 ff ff ff ff ff ff 00 0e 77 32 16 00 00 00 00 '.........w2.....'
  00 21 01 04 a5 22 16 78 03 ee 95 a3 54 4c 99 26 '.!...".x....TL.&'
  0f 50 54 00 00 00 01 01 01 01 01 01 01 01 01 01 '.PT.............'
  01 01 01 01 01 01 60 6c 00 a0 a0 40 64 60 30 20 '......`l...@d`0 '
  36 00 58 d7 10 00 00 18 00 00 00 fd 0c 30 a5 1a '6.X..........0..'
  1a 4d 01 0a 20 20 20 20 20 20 00 00 00 fc 00 4d '.M..      .....M'
  4e 47 30 30 37 44 41 35 2d 31 0a 20 00 00 00 fe 'NG007DA5-1. ....'
  00 43 53 4f 54 20 54 33 0a 20 20 20 20 20 01 1c '.CSOT T3.     ..'
Checksum: 0x1c

----------------

Block 3, DisplayID Extension Block:
  Version: 2.0
  Extension Count: 0
  Display Parameters Data Block (0x21):
    Image size: 344.7 mm x 215.4 mm
    Display native pixel format: 2560x1600
    Scan Orientation: Left to Right, Top to Bottom
    Luminance Information: Minimum guaranteed value
    Color Information: CIE 1931
    Audio Speaker Information: integrated
    Native Color Chromaticity:
      Primary #1:  (0.639893, 0.330078)
      Primary #2:  (0.600098, 0.300049)
      Primary #3:  (0.149902, 0.060059)
      White Point: (0.312988, 0.329102)
    Native Maximum Luminance (Full Coverage): do not use
    Native Maximum Luminance (10% Rectangular Coverage): do not use
    Native Minimum Luminance: do not use
    Native Color Depth: 10 bpc
    Display Device Technology: Active Matrix LCD
    Native Gamma EOTF: 2.20
  Video Timing Modes Type 7 - Detailed Timings Data Block:
    DTD:  2560x1600  165.000000 Hz  16:10   280.500 kHz    762.960000 MHz (aspect 16:10, no 3D stereo, preferred)
               Hfront   48 Hsync  32 Hback   80 Hpol N
               Vfront    3 Vsync   6 Vback   91 Vpol N
  Adaptive Sync Data Block:
    Descriptor #1:
      Native Panel Range
      Fixed Average V-Total and Adaptive V-Total
      Supports Seamless Transition
      'Max Single Frame Duration Increase' field value without jitter impact
      'Max Single Frame Duration Decrease' field value without jitter impact
      Max Duration Increase: 0.00 ms
      Max Duration Decrease: 0.00 ms
      Min Refresh Rate: 48 Hz
      Max Refresh Rate: 60 Hz
    Descriptor #2:
      Native Panel Range
      Fixed Average V-Total and Adaptive V-Total
      Supports Seamless Transition
      'Max Single Frame Duration Increase' field value without jitter impact
      'Max Single Frame Duration Decrease' field value without jitter impact
      Max Duration Increase: 0.00 ms
      Max Duration Decrease: 0.00 ms
      Min Refresh Rate: 60 Hz
      Max Refresh Rate: 165 Hz
  CTA-861 DisplayID Data Block:
  Vendor-Specific Data Block (AMD), OUI 00-00-1A:
    Version: 3
    Feature Caps: 0x01
    Minimum Refresh Rate: 48 Hz
    Maximum Refresh Rate: 165 Hz
    Flags 1.x: 0x00
    Flags 2.x: 0x04
  Checksum: 0xe8
Checksum: 0x90

----------------

Warnings:

EDID:
  Base EDID: Some timings are out of range of the Monitor Ranges:
    Horizontal Freq: 102.000 - 280.500 kHz (Monitor: 281.000 - 281.000 kHz)

Failures:

Block 1, DisplayID Extension Block:
  Expected 0 DisplayID Extension Block, but got 1.
  Vendor-Specific Data Block (AMD), OUI 00-00-1A: Length is 20 instead of 21.
Block 2, Base EDID:
  Unknown Extension Block.
Block 3, DisplayID Extension Block:
  Product Type should be 0 in extension block.
  Display Parameters Data Block (0x21): Duplicate Display Parameters Data Block.
  Vendor-Specific Data Block (AMD), OUI 00-00-1A: Length is 20 instead of 21.
EDID:
  Base EDID: EDID specified 1 extension block(s), but found 3 extension block(s).

EDID conformity: FAIL
