edid-decode (hex):

00 ff ff ff ff ff ff 00 0d af 11 11 00 00 00 00
18 14 01 03 90 19 0e 78 0a fe 75 92 5b 56 91 27
1f 50 54 00 00 00 01 01 01 01 01 01 01 01 01 01
01 01 01 01 01 01 12 1b 56 6c 50 00 10 30 20 16
24 00 00 90 10 00 00 1a 00 00 00 00 00 00 00 00
00 00 00 00 00 00 00 00 00 00 00 00 00 fe 00 48
46 39 44 32 80 4e 31 31 36 42 36 0a 00 00 00 00
00 00 00 00 00 00 00 00 00 01 01 0a 20 20 00 7c

----------------

Block 0, Base EDID:
  EDID Structure Version & Revision: 1.3
  Vendor & Product Identification:
    Manufacturer: CMO
    Model: 4369
    Made in: week 24 of 2010
  Basic Display Parameters & Features:
    Digital display
    Maximum image size: 25 cm x 14 cm
    Gamma: 2.20
    RGB color display
    First detailed timing is the preferred timing
  Color Characteristics:
    Red  : 0.5732, 0.3583
    Green: 0.3388, 0.5683
    Blue : 0.1533, 0.1240
    White: 0.3134, 0.3291
  Established Timings I & II: none
  Standard Timings: none
  Detailed Timing Descriptors:
    DTD 1:  1366x768    59.968017 Hz 683:384   47.015 kHz     69.300000 MHz (256 mm x 144 mm)
                 Hfront   32 Hsync  22 Hback   54 Hpol P
                 Vfront    2 Vsync   4 Vback   10 Vpol N
    Empty Descriptor
    Alphanumeric Data String: 'HF9D2.N116B6'
    Manufacturer-Specified Display Descriptor (0x00): 00 00 00 00 00 00 00 00 00 00 00 01 01 0a 20 20 '..............  '
Checksum: 0x7c

----------------

Warnings:

Block 0, Base EDID:
  Alphanumeric Data String: Non-ASCII character 0x80 at position 5, can cause problems.

Failures:

Block 0, Base EDID:
  Basic Display Parameters & Features: Digital Video Interface Standard set to reserved value 0x10.
  Empty Descriptor: Use Dummy Descriptor instead of all zeroes.
  Missing Display Product Name.
  Missing Display Range Limits Descriptor.

EDID conformity: FAIL
