edid-decode (hex):

00 ff ff ff ff ff ff 00 10 ac 37 a0 55 4a 59 31
09 13 01 04 0e 35 1e 78 ee ee 91 a3 54 4c 99 26
0f 50 54 a5 4b 00 71 4f 81 80 d1 c0 01 01 01 01
01 01 01 01 01 01 02 3a 80 18 71 38 2d 40 58 2c
45 00 13 2a 21 00 00 1e 00 00 00 ff 00 59 31 38
33 44 39 32 4e 31 59 4a 55 0a 00 00 00 fc 00 44
45 4c 4c 20 53 32 34 30 39 57 0a 20 00 00 00 fd
00 32 4c 1e 53 11 00 0a 20 20 20 20 20 20 00 e8

00 ff ff ff ff ff ff 00 10 ac 37 a0 55 4a 59 31
09 13 01 04 0e 35 1e 78 ee ee 91 a3 54 4c 99 26
0f 50 54 a5 4b 00 71 4f 81 80 d1 c0 01 01 01 01
01 01 01 01 01 01 02 3a 80 18 71 38 2d 40 58 2c
45 00 13 2a 21 00 00 1e 00 00 00 ff 00 59 31 38
33 44 39 32 4e 31 59 4a 55 0a 00 00 00 fc 00 44
45 4c 4c 20 53 32 34 30 39 57 0a 20 00 00 00 fd
00 32 4c 1e 53 11 00 0a 20 20 20 20 20 20 00 e8

----------------

Block 0, Base EDID:
  EDID Structure Version & Revision: 1.4
  Vendor & Product Identification:
    Manufacturer: DEL
    Model: 41015
    Serial Number: ...
    Made in: week 9 of 2009
  Basic Display Parameters & Features:
    Analog display
    Signal Level Standard: 0.700 : 0.300 : 1.000 V p-p
    Blank level equals black level
    Sync: Separate Composite SyncOnGreen
    Maximum image size: 53 cm x 30 cm
    Gamma: 2.20
    DPMS levels: Standby Suspend Off
    RGB color display
    Default (sRGB) color space is primary color space
    First detailed timing includes the native pixel format and preferred refresh rate
  Color Characteristics:
    Red  : 0.6396, 0.3300
    Green: 0.2998, 0.5996
    Blue : 0.1503, 0.0595
    White: 0.3125, 0.3291
  Established Timings I & II:
    IBM     :   720x400    70.081663 Hz   9:5     31.467 kHz     28.320000 MHz
    DMT 0x04:   640x480    59.940476 Hz   4:3     31.469 kHz     25.175000 MHz
    DMT 0x06:   640x480    75.000000 Hz   4:3     37.500 kHz     31.500000 MHz
    DMT 0x09:   800x600    60.316541 Hz   4:3     37.879 kHz     40.000000 MHz
    DMT 0x0b:   800x600    75.000000 Hz   4:3     46.875 kHz     49.500000 MHz
    DMT 0x10:  1024x768    60.003840 Hz   4:3     48.363 kHz     65.000000 MHz
    DMT 0x12:  1024x768    75.028582 Hz   4:3     60.023 kHz     78.750000 MHz
    DMT 0x24:  1280x1024   75.024675 Hz   5:4     79.976 kHz    135.000000 MHz
  Standard Timings:
    DMT 0x15:  1152x864    75.000000 Hz   4:3     67.500 kHz    108.000000 MHz
    DMT 0x23:  1280x1024   60.019740 Hz   5:4     63.981 kHz    108.000000 MHz
    DMT 0x52:  1920x1080   60.000000 Hz  16:9     67.500 kHz    148.500000 MHz
  Detailed Timing Descriptors:
    DTD 1:  1920x1080   60.000000 Hz  16:9     67.500 kHz    148.500000 MHz (531 mm x 298 mm)
                 Hfront   88 Hsync  44 Hback  148 Hpol P
                 Vfront    4 Vsync   5 Vback   36 Vpol P
    Display Product Serial Number: ...
    Display Product Name: 'DELL S2409W'
    Display Range Limits:
      Monitor ranges (GTF): 50-76 Hz V, 30-83 kHz H, max dotclock 170 MHz
Checksum: 0xe8

----------------

Block 1, Unknown EDID Extension Block 0x00:
  00 ff ff ff ff ff ff 00 10 ac 37 a0 55 4a 59 31 '..........7.UJY1'
  09 13 01 04 0e 35 1e 78 ee ee 91 a3 54 4c 99 26 '.....5.x....TL.&'
  0f 50 54 a5 4b 00 71 4f 81 80 d1 c0 01 01 01 01 '.PT.K.qO........'
  01 01 01 01 01 01 02 3a 80 18 71 38 2d 40 58 2c '.......:..q8-@X,'
  45 00 13 2a 21 00 00 1e 00 00 00 ff 00 59 31 38 'E..*!........Y18'
  33 44 39 32 4e 31 59 4a 55 0a 00 00 00 fc 00 44 '3D92N1YJU......D'
  45 4c 4c 20 53 32 34 30 39 57 0a 20 00 00 00 fd 'ELL S2409W. ....'
  00 32 4c 1e 53 11 00 0a 20 20 20 20 20 20 00 e8 '.2L.S...      ..'
Checksum: 0xe8

----------------

Warnings:

Block 0, Base EDID:
  Display Range Limits: GTF support is deprecated in EDID 1.4.

Failures:

Block 0, Base EDID:
  Display Range Limits: GTF is supported, but the display does not support continuous frequencies.
Block 1, Base EDID:
  Unknown Extension Block.
EDID:
  Base EDID: EDID specified 0 extension block(s), but found 1 extension block(s).

EDID conformity: FAIL
