edid-decode (hex):

00 ff ff ff ff ff ff 00 06 6d 60 15 01 01 01 01
2a 1d 01 03 80 3c 21 78 3b 64 35 a5 54 4f 9e 27
12 50 54 a1 08 00 d1 c0 b3 00 a9 c0 95 00 90 40
81 80 81 40 61 40 02 3a 80 18 71 38 2d 40 58 2c
25 00 2c 04 11 00 00 1e 00 00 00 fc 00 41 53 4d
2d 31 35 36 46 43 0a 20 20 20 66 21 50 b0 51 00
1b 30 40 70 36 00 2c 04 11 00 00 00 00 00 00 fd
00 30 3f 1e 96 13 00 0a 20 20 20 20 20 20 01 f2

02 03 40 f1 46 01 02 03 04 10 04 23 09 07 07 83
01 00 00 67 03 0c 00 10 00 38 26 67 d8 5d c4 01
26 80 01 68 1a 00 00 01 09 30 3f e6 e5 0f 00 00
06 00 e3 05 c0 00 e2 00 ff e6 06 05 01 59 59 49
2c 27 40 b4 60 84 27 30 58 2c 33 00 2c 04 11 00
00 1e 80 21 56 b0 51 00 1b 30 40 70 36 00 2c 04
11 00 00 1e 00 00 00 00 00 00 00 00 00 00 00 00
00 00 00 00 00 00 00 00 00 00 00 00 00 00 00 4b

00 ff ff ff ff ff ff 00 06 6d 60 15 01 01 01 01
2a 1d 01 03 80 3c 21 78 3b 64 35 a5 54 4f 9e 27
12 50 54 a1 08 00 d1 c0 b3 00 a9 c0 95 00 90 40
81 80 81 40 61 40 02 3a 80 18 71 38 2d 40 58 2c
25 00 2c 04 11 00 00 1e 00 00 00 fc 00 41 53 4d
2d 31 35 36 46 43 0a 20 20 20 66 21 50 b0 51 00
1b 30 40 70 36 00 2c 04 11 00 00 00 00 00 00 fd
00 30 3f 1e 96 13 00 0a 20 20 20 20 20 20 01 f2

02 03 40 f1 46 01 02 03 04 10 04 23 09 07 07 83
01 00 00 67 03 0c 00 10 00 38 26 67 d8 5d c4 01
26 80 01 68 1a 00 00 01 09 30 3f e6 e5 0f 00 00
06 00 e3 05 c0 00 e2 00 ff e6 06 05 01 59 59 49
2c 27 40 b4 60 84 27 30 58 2c 33 00 2c 04 11 00
00 1e 80 21 56 b0 51 00 1b 30 40 70 36 00 2c 04
11 00 00 1e 00 00 00 00 00 00 00 00 00 00 00 00
00 00 00 00 00 00 00 00 00 00 00 00 00 00 00 4b

----------------

Block 0, Base EDID:
  EDID Structure Version & Revision: 1.3
  Vendor & Product Identification:
    Manufacturer: ASM
    Model: 5472
    Serial Number: ...
    Made in: week 42 of 2019
  Basic Display Parameters & Features:
    Digital display
    Maximum image size: 60 cm x 33 cm
    Gamma: 2.20
    DPMS levels: Off
    Undefined display color type
    First detailed timing is the preferred timing
    Supports GTF timings within operating range
  Color Characteristics:
    Red  : 0.6455, 0.3300
    Green: 0.3095, 0.6171
    Blue : 0.1523, 0.0732
    White: 0.3134, 0.3291
  Established Timings I & II:
    IBM     :   720x400    70.081663 Hz   9:5     31.467 kHz     28.320000 MHz
    DMT 0x04:   640x480    59.940476 Hz   4:3     31.469 kHz     25.175000 MHz
    DMT 0x09:   800x600    60.316541 Hz   4:3     37.879 kHz     40.000000 MHz
    DMT 0x10:  1024x768    60.003840 Hz   4:3     48.363 kHz     65.000000 MHz
  Standard Timings:
    DMT 0x52:  1920x1080   60.000000 Hz  16:9     67.500 kHz    148.500000 MHz
    DMT 0x3a:  1680x1050   59.954250 Hz  16:10    65.290 kHz    146.250000 MHz
    DMT 0x53:  1600x900    60.000000 Hz  16:9     60.000 kHz    108.000000 MHz (RB)
    DMT 0x2f:  1440x900    59.887445 Hz  16:10    55.935 kHz    106.500000 MHz
    DMT 0x2a:  1400x1050   59.978442 Hz   4:3     65.317 kHz    121.750000 MHz
    DMT 0x23:  1280x1024   60.019740 Hz   5:4     63.981 kHz    108.000000 MHz
    DMT 0x20:  1280x960    60.000000 Hz   4:3     60.000 kHz    108.000000 MHz
    DMT 0x10:  1024x768    60.003840 Hz   4:3     48.363 kHz     65.000000 MHz
  Detailed Timing Descriptors:
    DTD 1:  1920x1080   60.000000 Hz  16:9     67.500 kHz    148.500000 MHz (300 mm x 260 mm)
                 Hfront   88 Hsync  44 Hback  148 Hpol P
                 Vfront    2 Vsync   5 Vback   38 Vpol P
    Display Product Name: 'ASM-156FC'
    DTD 2:  1360x768    60.015162 Hz  85:48    47.712 kHz     85.500000 MHz (analog composite, sync-on-green, 300 mm x 260 mm)
                 Hfront   64 Hsync 112 Hback  256 Hpol N
                 Vfront    3 Vsync   6 Vback   18 Vpol N
    Display Range Limits:
      Monitor ranges (GTF): 48-63 Hz V, 30-150 kHz H, max dotclock 190 MHz
  Extension blocks: 1
Checksum: 0xf2

----------------

Block 1, CTA-861 Extension Block:
  Revision: 3
  Underscans IT Video Formats by default
  Basic audio support
  Supports YCbCr 4:4:4
  Supports YCbCr 4:2:2
  Native DTDs: 1
  Video Data Block:
    VIC   1:   640x480    59.940476 Hz   4:3     31.469 kHz     25.175000 MHz
    VIC   2:   720x480    59.940060 Hz   4:3     31.469 kHz     27.000000 MHz
    VIC   3:   720x480    59.940060 Hz  16:9     31.469 kHz     27.000000 MHz
    VIC   4:  1280x720    60.000000 Hz  16:9     45.000 kHz     74.250000 MHz
    VIC  16:  1920x1080   60.000000 Hz  16:9     67.500 kHz    148.500000 MHz
    VIC   4:  1280x720    60.000000 Hz  16:9     45.000 kHz     74.250000 MHz
  Audio Data Block:
    Linear PCM:
      Max channels: 2
      Supported sample rates (kHz): 48 44.1 32
      Supported sample sizes (bits): 24 20 16
  Speaker Allocation Data Block:
    FL/FR - Front Left/Right
  Vendor-Specific Data Block (HDMI), OUI 00-0C-03:
    Source physical address: 1.0.0.0
    DC_36bit
    DC_30bit
    DC_Y444
    Maximum TMDS clock: 190 MHz
  Vendor-Specific Data Block (HDMI Forum), OUI C4-5D-D8:
    Version: 1
    Maximum TMDS Character Rate: 190 MHz
    SCDC Present
    Supports 10-bits/component Deep Color 4:2:0 Pixel Encoding
  Vendor-Specific Data Block (AMD), OUI 00-00-1A:
    Version: 1
    Flags 1: 0x09
      FreeSync Supported
    Minimum Refresh Rate: 48 Hz
    Maximum Refresh Rate: 63 Hz
    MCCS VCP Code: 0xe6
  YCbCr 4:2:0 Capability Map Data Block:
    SVD Index 18 is out of range
    SVD Index 19 is out of range
  Colorimetry Data Block:
    BT2020YCC
    BT2020RGB
  Video Capability Data Block:
    YCbCr quantization: Selectable (via AVI YQ)
    RGB quantization: Selectable (via AVI Q)
    PT scan behavior: Supports both over- and underscan
    IT scan behavior: Supports both over- and underscan
    CE scan behavior: Supports both over- and underscan
  HDR Static Metadata Data Block:
    Electro optical transfer functions:
      Traditional gamma - SDR luminance range
      SMPTE ST2084
    Supported static metadata descriptors:
      Static metadata type 1
    Desired content max luminance: 89 (343.724 cd/m^2)
    Desired content max frame-average luminance: 89 (343.724 cd/m^2)
    Desired content min luminance: 73 (0.282 cd/m^2)
  Detailed Timing Descriptors:
    DTD 3:  1600x900    59.996889 Hz  16:9     56.337 kHz    100.280000 MHz (300 mm x 260 mm)
                 Hfront   88 Hsync  44 Hback   48 Hpol P
                 Vfront    3 Vsync   3 Vback   33 Vpol P
    DTD 4:  1366x768    59.996782 Hz 683:384   47.697 kHz     85.760000 MHz (300 mm x 260 mm)
                 Hfront   64 Hsync 112 Hback  256 Hpol P
                 Vfront    3 Vsync   6 Vback   18 Vpol P
Checksum: 0x4b  Unused space in Extension Block: 27 bytes

----------------

Warnings:

Block 0, Base EDID:
  Vendor & Product Identification: The serial number is one of the known dummy values, it should probably be set to 0.
  Detailed Timing Descriptor #1: DTD is similar but not identical to VIC 16.
  Detailed Timing Descriptor #1: Image size is 300x260 mm, but based on the picture AR it should be 300x168 mm.
  Detailed Timing Descriptor #2: DTD is similar but not identical to DMT 0x27.
  Detailed Timing Descriptor #2: Image size is 300x260 mm, but based on the picture AR it should be 300x169 mm.
Block 1, CTA-861 Extension Block:
  Video Data Block: VIC 1 and the first DTD are not identical. Is this intended?
  Colorimetry Data Block: Set the sRGB colorimetry bit to avoid interop issues.
  Video Capability Data Block: S_PT is equal to S_IT and S_CE, so should be set to 0 instead.
  Detailed Timing Descriptor #3: Image size is 300x260 mm, but based on the picture AR it should be 300x168 mm.
  Detailed Timing Descriptor #4: Image size is 300x260 mm, but based on the picture AR it should be 300x168 mm.
EDID:
  Base EDID: Some timings are out of range of the Monitor Ranges:
    Vertical Freq: 59.887 - 70.082 Hz (Monitor: 48.000 - 63.000 Hz)

Failures:

Block 0, Base EDID:
  Detailed Timing Descriptor #1: Mismatch of image size 300x260 mm vs display size 600x330 mm.
  Detailed Timing Descriptor #2: Mismatch of image size 300x260 mm vs display size 600x330 mm.
  Detailed Timing Descriptor #2: Invalid detailed timing descriptor ordering.
Block 1, CTA-861 Extension Block:
  Video Data Block: Duplicate VIC 4.
  Vendor-Specific Data Block (HDMI Forum), OUI C4-5D-D8: Max TMDS rate is > 0 and <= 340 or > 600.
  YCbCr 4:2:0 Capability Map Data Block: Max index 19 > 6 (#SVDs).
  Detailed Timing Descriptor #3: Mismatch of image size 300x260 mm vs display size 600x330 mm.
  Detailed Timing Descriptor #4: Mismatch of image size 300x260 mm vs display size 600x330 mm.
EDID:
  Extension Block 2 started with EDID header, ignoring Extension Blocks >= 2.

EDID conformity: FAIL
