edid-decode (hex):

00 ff ff ff ff ff ff 00 0e 77 68 16 00 00 00 00
00 22 01 04 b5 22 16 78 03 06 45 ae 51 42 b2 24
0e 50 54 00 00 00 01 01 01 01 01 01 01 01 01 01
01 01 01 01 01 01 90 6f 00 a0 a0 40 96 60 30 20
66 00 58 d7 10 00 00 18 00 00 00 fd 0e 3c 2d a5
a5 8f 01 0a 20 20 20 20 20 20 00 00 00 fe 00 43
53 4f 54 20 54 33 0a 20 20 20 20 20 00 00 00 fc
00 4d 4e 47 30 30 37 44 41 36 2d 34 0a 20 02 71

02 03 24 00 e3 05 80 80 e6 06 05 01 6a 6a 48 74
1a 00 00 03 51 3c f0 00 00 6a 48 6a 48 2c 01 00
00 00 00 00 00 00 00 00 00 00 00 00 00 00 00 00
00 00 00 00 00 00 00 00 00 00 00 00 00 00 00 00
00 00 00 00 00 00 00 00 00 00 00 00 00 00 00 00
00 00 00 00 00 00 00 00 00 00 00 00 00 00 00 00
00 00 00 00 00 00 00 00 00 00 00 00 00 00 00 00
00 00 00 00 00 00 00 00 00 00 00 00 00 00 00 42

70 20 79 02 00 21 00 1d 77 0d 6a 08 00 0a 40 06
00 e1 ea 50 25 74 b2 46 12 0e 02 45 54 d0 5f d0
5f 00 38 13 78 22 00 28 1f ca 15 85 ff 09 9f 00
2f 00 1f 00 3f 06 95 00 05 00 05 00 7f 6e 11 85
ff 09 9f 00 2f 00 1f 00 3f 06 95 00 05 00 05 00
2b 00 0c 27 00 32 3b 00 00 27 00 3c 2b 01 00 00
00 00 00 00 00 00 00 00 00 00 00 00 00 00 00 00
00 00 00 00 00 00 00 00 00 00 00 00 00 00 fd 90

00 ff ff ff ff ff ff 00 0e 77 68 16 00 00 00 00
00 22 01 04 b5 22 16 78 03 06 45 ae 51 42 b2 24
0e 50 54 00 00 00 01 01 01 01 01 01 01 01 01 01
01 01 01 01 01 01 90 6f 00 a0 a0 40 96 60 30 20
66 00 58 d7 10 00 00 18 00 00 00 fd 0e 3c 2d a5
a5 8f 01 0a 20 20 20 20 20 20 00 00 00 fe 00 43
53 4f 54 20 54 33 0a 20 20 20 20 20 00 00 00 fc
00 4d 4e 47 30 30 37 44 41 36 2d 34 0a 20 02 71

02 03 24 00 e3 05 80 80 e6 06 05 01 6a 6a 48 74
1a 00 00 03 51 3c f0 00 00 6a 48 6a 48 2c 01 00
00 00 00 00 00 00 00 00 00 00 00 00 00 00 00 00
00 00 00 00 00 00 00 00 00 00 00 00 00 00 00 00
00 00 00 00 00 00 00 00 00 00 00 00 00 00 00 00
00 00 00 00 00 00 00 00 00 00 00 00 00 00 00 00
00 00 00 00 00 00 00 00 00 00 00 00 00 00 00 00
00 00 00 00 00 00 00 00 00 00 00 00 00 00 00 42

70 20 79 02 00 21 00 1d 77 0d 6a 08 00 0a 40 06
00 e1 ea 50 25 74 b2 46 12 0e 02 45 54 d0 5f d0
5f 00 38 13 78 22 00 28 1f ca 15 85 ff 09 9f 00
2f 00 1f 00 3f 06 95 00 05 00 05 00 7f 6e 11 85
ff 09 9f 00 2f 00 1f 00 3f 06 95 00 05 00 05 00
2b 00 0c 27 00 32 3b 00 00 27 00 3c 2b 01 00 00
00 00 00 00 00 00 00 00 00 00 00 00 00 00 00 00
00 00 00 00 00 00 00 00 00 00 00 00 00 00 fd 90

----------------

Block 0, Base EDID:
  EDID Structure Version & Revision: 1.4
  Vendor & Product Identification:
    Manufacturer: CSW
    Model: 5736
    Made in: 2024
  Basic Display Parameters & Features:
    Digital display
    Bits per primary color channel: 10
    DisplayPort interface
    Maximum image size: 34 cm x 22 cm
    Gamma: 2.20
    Supported color formats: RGB 4:4:4
    First detailed timing includes the native pixel format and preferred refresh rate
    Display supports continuous frequencies
  Color Characteristics:
    Red  : 0.6796, 0.3164
    Green: 0.2587, 0.6972
    Blue : 0.1416, 0.0546
    White: 0.3134, 0.3291
  Established Timings I & II: none
  Standard Timings: none
  Detailed Timing Descriptors:
    DTD 1:  2560x1600   60.000000 Hz  16:10   105.000 kHz    285.600000 MHz (344 mm x 215 mm)
                 Hfront   48 Hsync  32 Hback   80 Hpol N
                 Vfront    6 Vsync   6 Vback  138 Vpol N
    Display Range Limits:
      Monitor ranges (Range Limits Only): 60-300 Hz V, 420-420 kHz H, max dotclock 1430 MHz
    Alphanumeric Data String: 'CSOT T3'
    Display Product Name: 'MNG007DA6-4'
  Extension blocks: 2
Checksum: 0x71

----------------

Block 1, CTA-861 Extension Block:
  Revision: 3
  Native DTDs: 0
  Colorimetry Data Block:
    BT2020RGB
    ST2113RGB
  HDR Static Metadata Data Block:
    Electro optical transfer functions:
      Traditional gamma - SDR luminance range
      SMPTE ST2084
    Supported static metadata descriptors:
      Static metadata type 1
    Desired content max luminance: 106 (496.743 cd/m^2)
    Desired content max frame-average luminance: 106 (496.743 cd/m^2)
    Desired content min luminance: 72 (0.396 cd/m^2)
  Vendor-Specific Data Block (AMD), OUI 00-00-1A:
    Version: 3
    Flags 1: 0x51
      FreeSync Supported
      Panel Replay/PSR Switch Supported
      Panel Replay Supported
    Minimum Refresh Rate: 60 Hz
    Maximum Refresh Rate: 300 Hz
    Flags 5: 0x00
Checksum: 0x42  Unused space in Extension Block: 91 bytes

----------------

Block 2, DisplayID Extension Block:
  Version: 2.0
  Extension Count: 0
  Display Product Primary Use Case: None of the listed primary use cases; generic display
  Display Parameters Data Block (0x21):
    Image size: 344.7 mm x 215.4 mm
    Display native pixel format: 2560x1600
    Scan Orientation: Left to Right, Top to Bottom
    Luminance Information: Minimum guaranteed value
    Color Information: CIE 1931
    Audio Speaker Information: integrated
    Native Color Chromaticity:
      Primary #1:  (0.679932, 0.315918)
      Primary #2:  (0.259033, 0.697021)
      Primary #3:  (0.142090, 0.054932)
      White Point: (0.312988, 0.329102)
    Native Maximum Luminance (Full Coverage): 500.000000 cd/m^2
    Native Maximum Luminance (10% Rectangular Coverage): 500.000000 cd/m^2
    Native Minimum Luminance: 0.500000 cd/m^2
    Native Color Depth: 10 bpc
    Display Device Technology: Active Matrix LCD
    Native Gamma EOTF: 2.20
  Video Timing Modes Type 7 - Detailed Timings Data Block:
    DTD:  2560x1600  300.000000 Hz  16:10   525.000 kHz   1428.000000 MHz (aspect 16:10, no 3D stereo, preferred)
               Hfront   48 Hsync  32 Hback   80 Hpol N
               Vfront    6 Vsync   6 Vback  138 Vpol N
    DTD:  2560x1600  240.000000 Hz  16:10   420.000 kHz   1142.400000 MHz (aspect 16:10, no 3D stereo, preferred)
               Hfront   48 Hsync  32 Hback   80 Hpol N
               Vfront    6 Vsync   6 Vback  138 Vpol N
  Adaptive Sync Data Block:
    Descriptor #1:
      Native Panel Range
      Fixed Average V-Total and Adaptive V-Total
      Supports Seamless Transition
      'Max Single Frame Duration Increase' field value without jitter impact
      'Max Single Frame Duration Decrease' field value without jitter impact
      Max Duration Increase: 0.00 ms
      Max Duration Decrease: 0.00 ms
      Min Refresh Rate: 50 Hz
      Max Refresh Rate: 60 Hz
    Descriptor #2:
      Native Panel Range
      Fixed Average V-Total and Adaptive V-Total
      Supports Seamless Transition
      'Max Single Frame Duration Increase' field value without jitter impact
      'Max Single Frame Duration Decrease' field value without jitter impact
      Max Duration Increase: 0.00 ms
      Max Duration Decrease: 0.00 ms
      Min Refresh Rate: 60 Hz
      Max Refresh Rate: 300 Hz
  Checksum: 0xfd
Checksum: 0x90

----------------

Warnings:

Block 1, CTA-861 Extension Block:
  IT Video Formats are overscanned by default, but normally this should be underscanned.
  Colorimetry Data Block: Set the sRGB colorimetry bit to avoid interop issues.
EDID:
  Base EDID: Some timings are out of range of the Monitor Ranges:
    Horizontal Freq: 105.000 - 525.000 kHz (Monitor: 420.000 - 420.000 kHz)

Failures:

Block 1, CTA-861 Extension Block:
  Required 640x480p60 timings are missing in the established timings and the SVD list (VIC 1).
  Missing VCDB, needed for Set Selectable RGB Quantization to avoid interop issues.
EDID:
  Extension Block 3 started with EDID header, ignoring Extension Blocks >= 3.

EDID conformity: FAIL
