edid-decode (hex):

00 ff ff ff ff ff ff 00 05 e3 02 24 91 09 00 00
09 21 01 04 a5 35 1e 78 3b 0a 85 aa 4f 46 ab 27
0d 50 54 2f cf 00 d1 c0 81 80 31 68 31 7c 45 68
45 7c 61 68 61 7c 02 3a 80 18 71 38 2d 40 58 2c
45 00 e0 0e 11 00 00 1e 00 00 00 fd 00 30 90 a0
a0 21 01 0a 20 20 20 20 20 20 00 00 00 fc 00 32
34 47 32 57 31 47 34 0a 20 20 20 20 00 00 00 ff
00 41 54 4e 4e 32 58 41 30 30 32 34 34 39 01 f9

02 03 27 40 4c 01 03 05 14 04 13 1f 12 02 11 90
3f 23 09 07 07 83 01 00 00 6d 1a 00 00 02 01 30
90 00 00 00 00 00 00 2a 82 80 50 70 38 4d 40 08
20 f8 0c e0 0e 11 00 00 1a 3c 6b 80 50 70 38 40
40 08 20 28 0c e0 0e 11 00 00 1a 75 58 80 50 70
38 35 40 08 20 78 08 e0 0e 11 00 00 1a 8b 41 80
50 70 38 27 40 08 20 98 04 e0 0e 11 00 00 1a 00
00 00 00 00 00 00 00 00 00 00 00 00 00 00 00 ec

00 ff ff ff ff ff ff 00 05 e3 02 24 91 09 00 00
09 21 01 04 a5 35 1e 78 3b 0a 85 aa 4f 46 ab 27
0d 50 54 2f cf 00 d1 c0 81 80 31 68 31 7c 45 68
45 7c 61 68 61 7c 02 3a 80 18 71 38 2d 40 58 2c
45 00 e0 0e 11 00 00 1e 00 00 00 fd 00 30 90 a0
a0 21 01 0a 20 20 20 20 20 20 00 00 00 fc 00 32
34 47 32 57 31 47 34 0a 20 20 20 20 00 00 00 ff
00 41 54 4e 4e 32 58 41 30 30 32 34 34 39 01 f9

02 03 27 40 4c 01 03 05 14 04 13 1f 12 02 11 90
3f 23 09 07 07 83 01 00 00 6d 1a 00 00 02 01 30
90 00 00 00 00 00 00 2a 82 80 50 70 38 4d 40 08
20 f8 0c e0 0e 11 00 00 1a 3c 6b 80 50 70 38 40
40 08 20 28 0c e0 0e 11 00 00 1a 75 58 80 50 70
38 35 40 08 20 78 08 e0 0e 11 00 00 1a 8b 41 80
50 70 38 27 40 08 20 98 04 e0 0e 11 00 00 1a 00
00 00 00 00 00 00 00 00 00 00 00 00 00 00 00 ec

----------------

Block 0, Base EDID:
  EDID Structure Version & Revision: 1.4
  Vendor & Product Identification:
    Manufacturer: AOC
    Model: 9218
    Serial Number: ...
    Made in: week 9 of 2023
  Basic Display Parameters & Features:
    Digital display
    Bits per primary color channel: 8
    DisplayPort interface
    Maximum image size: 53 cm x 30 cm
    Gamma: 2.20
    DPMS levels: Off
    Supported color formats: RGB 4:4:4, YCrCb 4:4:4, YCrCb 4:2:2
    First detailed timing includes the native pixel format and preferred refresh rate
    Display supports continuous frequencies
  Color Characteristics:
    Red  : 0.6640, 0.3085
    Green: 0.2753, 0.6699
    Blue : 0.1542, 0.0507
    White: 0.3134, 0.3291
  Established Timings I & II:
    DMT 0x04:   640x480    59.940476 Hz   4:3     31.469 kHz     25.175000 MHz
    DMT 0x05:   640x480    72.808802 Hz   4:3     37.861 kHz     31.500000 MHz
    DMT 0x06:   640x480    75.000000 Hz   4:3     37.500 kHz     31.500000 MHz
    DMT 0x08:   800x600    56.250000 Hz   4:3     35.156 kHz     36.000000 MHz
    DMT 0x09:   800x600    60.316541 Hz   4:3     37.879 kHz     40.000000 MHz
    DMT 0x0a:   800x600    72.187572 Hz   4:3     48.077 kHz     50.000000 MHz
    DMT 0x0b:   800x600    75.000000 Hz   4:3     46.875 kHz     49.500000 MHz
    DMT 0x10:  1024x768    60.003840 Hz   4:3     48.363 kHz     65.000000 MHz
    DMT 0x11:  1024x768    70.069359 Hz   4:3     56.476 kHz     75.000000 MHz
    DMT 0x12:  1024x768    75.028582 Hz   4:3     60.023 kHz     78.750000 MHz
    DMT 0x24:  1280x1024   75.024675 Hz   5:4     79.976 kHz    135.000000 MHz
  Standard Timings:
    DMT 0x52:  1920x1080   60.000000 Hz  16:9     67.500 kHz    148.500000 MHz
    DMT 0x23:  1280x1024   60.019740 Hz   5:4     63.981 kHz    108.000000 MHz
    GTF     :   640x480    99.999537 Hz   4:3     50.900 kHz     43.163000 MHz
    GTF     :   640x480   119.999084 Hz   4:3     61.800 kHz     52.406000 MHz
    GTF     :   800x600    99.999707 Hz   4:3     63.600 kHz     68.179000 MHz
    GTF     :   800x600   119.999886 Hz   4:3     77.160 kHz     83.950000 MHz
    GTF     :  1024x768   100.000177 Hz   4:3     81.400 kHz    113.309000 MHz
    GTF     :  1024x768   119.999931 Hz   4:3     98.760 kHz    139.054000 MHz
  Detailed Timing Descriptors:
    DTD 1:  1920x1080   60.000000 Hz  16:9     67.500 kHz    148.500000 MHz (480 mm x 270 mm)
                 Hfront   88 Hsync  44 Hback  148 Hpol P
                 Vfront    4 Vsync   5 Vback   36 Vpol P
    Display Range Limits:
      Monitor ranges (Range Limits Only): 48-144 Hz V, 160-160 kHz H, max dotclock 330 MHz
    Display Product Name: '24G2W1G4'
    Display Product Serial Number: ...
  Extension blocks: 1
Checksum: 0xf9

----------------

Block 1, CTA-861 Extension Block:
  Revision: 3
  Basic audio support
  Native detailed modes: 0
  Video Data Block:
    VIC   1:   640x480    59.940476 Hz   4:3     31.469 kHz     25.175000 MHz
    VIC   3:   720x480    59.940060 Hz  16:9     31.469 kHz     27.000000 MHz
    VIC   5:  1920x1080i  60.000000 Hz  16:9     33.750 kHz     74.250000 MHz
    VIC  20:  1920x1080i  50.000000 Hz  16:9     28.125 kHz     74.250000 MHz
    VIC   4:  1280x720    60.000000 Hz  16:9     45.000 kHz     74.250000 MHz
    VIC  19:  1280x720    50.000000 Hz  16:9     37.500 kHz     74.250000 MHz
    VIC  31:  1920x1080   50.000000 Hz  16:9     56.250 kHz    148.500000 MHz
    VIC  18:   720x576    50.000000 Hz  16:9     31.250 kHz     27.000000 MHz
    VIC   2:   720x480    59.940060 Hz   4:3     31.469 kHz     27.000000 MHz
    VIC  17:   720x576    50.000000 Hz   4:3     31.250 kHz     27.000000 MHz
    VIC  16:  1920x1080   60.000000 Hz  16:9     67.500 kHz    148.500000 MHz (native)
    VIC  63:  1920x1080  120.000000 Hz  16:9    135.000 kHz    297.000000 MHz
  Audio Data Block:
    Linear PCM:
      Max channels: 2
      Supported sample rates (kHz): 48 44.1 32
      Supported sample sizes (bits): 24 20 16
  Speaker Allocation Data Block:
    FL/FR - Front Left/Right
  Vendor-Specific Data Block (AMD), OUI 00-00-1A:
    Version: 2
    Feature Caps: 0x01
    Minimum Refresh Rate: 48 Hz
    Maximum Refresh Rate: 144 Hz
    Flags 1.x: 0x00
    Flags 2.x: 0x00
  Detailed Timing Descriptors:
    DTD 2:  1920x1080  144.001729 Hz  16:9    166.610 kHz    333.220000 MHz (480 mm x 270 mm)
                 Hfront    8 Hsync  32 Hback   40 Hpol P
                 Vfront   63 Vsync   8 Vback    6 Vpol N
    DTD 3:  1920x1080  119.982517 Hz  16:9    137.260 kHz    274.520000 MHz (480 mm x 270 mm)
                 Hfront    8 Hsync  32 Hback   40 Hpol P
                 Vfront   50 Vsync   8 Vback    6 Vpol N
    DTD 4:  1920x1080   99.933804 Hz  16:9    113.225 kHz    226.450000 MHz (480 mm x 270 mm)
                 Hfront    8 Hsync  32 Hback   40 Hpol P
                 Vfront   39 Vsync   8 Vback    6 Vpol N
    DTD 5:  1920x1080   74.973190 Hz  16:9     83.895 kHz    167.790000 MHz (480 mm x 270 mm)
                 Hfront    8 Hsync  32 Hback   40 Hpol P
                 Vfront   25 Vsync   8 Vback    6 Vpol N
Checksum: 0xec  Unused space in Extension Block: 16 bytes

----------------

Block 2, Unknown EDID Extension Block 0x00:
  00 ff ff ff ff ff ff 00 05 e3 02 24 91 09 00 00 '...........$....'
  09 21 01 04 a5 35 1e 78 3b 0a 85 aa 4f 46 ab 27 '.!...5.x;...OF.''
  0d 50 54 2f cf 00 d1 c0 81 80 31 68 31 7c 45 68 '.PT/......1h1|Eh'
  45 7c 61 68 61 7c 02 3a 80 18 71 38 2d 40 58 2c 'E|aha|.:..q8-@X,'
  45 00 e0 0e 11 00 00 1e 00 00 00 fd 00 30 90 a0 'E............0..'
  a0 21 01 0a 20 20 20 20 20 20 00 00 00 fc 00 32 '.!..      .....2'
  34 47 32 57 31 47 34 0a 20 20 20 20 00 00 00 ff '4G2W1G4.    ....'
  00 41 54 4e 4e 32 58 41 30 30 32 34 34 39 01 f9 '.ATNN2XA002449..'
Checksum: 0xf9

----------------

Block 3, CTA-861 Extension Block:
  Revision: 3
  Basic audio support
  Native detailed modes: 0
  Video Data Block:
    VIC   1:   640x480    59.940476 Hz   4:3     31.469 kHz     25.175000 MHz
    VIC   3:   720x480    59.940060 Hz  16:9     31.469 kHz     27.000000 MHz
    VIC   5:  1920x1080i  60.000000 Hz  16:9     33.750 kHz     74.250000 MHz
    VIC  20:  1920x1080i  50.000000 Hz  16:9     28.125 kHz     74.250000 MHz
    VIC   4:  1280x720    60.000000 Hz  16:9     45.000 kHz     74.250000 MHz
    VIC  19:  1280x720    50.000000 Hz  16:9     37.500 kHz     74.250000 MHz
    VIC  31:  1920x1080   50.000000 Hz  16:9     56.250 kHz    148.500000 MHz
    VIC  18:   720x576    50.000000 Hz  16:9     31.250 kHz     27.000000 MHz
    VIC   2:   720x480    59.940060 Hz   4:3     31.469 kHz     27.000000 MHz
    VIC  17:   720x576    50.000000 Hz   4:3     31.250 kHz     27.000000 MHz
    VIC  16:  1920x1080   60.000000 Hz  16:9     67.500 kHz    148.500000 MHz (native)
    VIC  63:  1920x1080  120.000000 Hz  16:9    135.000 kHz    297.000000 MHz
  Audio Data Block:
    Linear PCM:
      Max channels: 2
      Supported sample rates (kHz): 48 44.1 32
      Supported sample sizes (bits): 24 20 16
  Speaker Allocation Data Block:
    FL/FR - Front Left/Right
  Vendor-Specific Data Block (AMD), OUI 00-00-1A:
    Version: 2
    Feature Caps: 0x01
    Minimum Refresh Rate: 48 Hz
    Maximum Refresh Rate: 144 Hz
    Flags 1.x: 0x00
    Flags 2.x: 0x00
  Detailed Timing Descriptors:
    DTD 6:  1920x1080  144.001729 Hz  16:9    166.610 kHz    333.220000 MHz (480 mm x 270 mm)
                 Hfront    8 Hsync  32 Hback   40 Hpol P
                 Vfront   63 Vsync   8 Vback    6 Vpol N
    DTD 7:  1920x1080  119.982517 Hz  16:9    137.260 kHz    274.520000 MHz (480 mm x 270 mm)
                 Hfront    8 Hsync  32 Hback   40 Hpol P
                 Vfront   50 Vsync   8 Vback    6 Vpol N
    DTD 8:  1920x1080   99.933804 Hz  16:9    113.225 kHz    226.450000 MHz (480 mm x 270 mm)
                 Hfront    8 Hsync  32 Hback   40 Hpol P
                 Vfront   39 Vsync   8 Vback    6 Vpol N
    DTD 9:  1920x1080   74.973190 Hz  16:9     83.895 kHz    167.790000 MHz (480 mm x 270 mm)
                 Hfront    8 Hsync  32 Hback   40 Hpol P
                 Vfront   25 Vsync   8 Vback    6 Vpol N
Checksum: 0xec  Unused space in Extension Block: 16 bytes

----------------

Warnings:

Block 1, CTA-861 Extension Block:
  IT Video Formats are overscanned by default, but normally this should be underscanned.
  Video Data Block: VIC 1 and the first DTD are not identical. Is this intended?
  Display Product Serial Number is set, so the Serial Number in the Base EDID should be 0.
  Add a Colorimetry Data Block with the sRGB colorimetry bit set to avoid interop issues.
Block 3, CTA-861 Extension Block:
  IT Video Formats are overscanned by default, but normally this should be underscanned.
EDID:
  Base EDID: Some timings are out of range of the Monitor Ranges:
    Horizontal Freq: 28.125 - 166.610 kHz (Monitor: 160.000 - 160.000 kHz)
    Maximum Clock: 333.220 MHz (Monitor: 330.000 MHz)
  CTA-861: Multiple native progressive timings are defined.

Failures:

Block 0, Base EDID:
  Detailed Timing Descriptor #1: Mismatch of image size 480x270 mm vs display size 530x300 mm.
Block 1, CTA-861 Extension Block:
  Detailed Timing Descriptor #2: Mismatch of image size 480x270 mm vs display size 530x300 mm.
  Detailed Timing Descriptor #3: Mismatch of image size 480x270 mm vs display size 530x300 mm.
  Detailed Timing Descriptor #4: Mismatch of image size 480x270 mm vs display size 530x300 mm.
  Detailed Timing Descriptor #5: Mismatch of image size 480x270 mm vs display size 530x300 mm.
  Missing VCDB, needed for Set Selectable RGB Quantization to avoid interop issues.
Block 2, Base EDID:
  Unknown Extension Block.
Block 3, CTA-861 Extension Block:
  Video Data Block: Duplicate VIC 1.
  Video Data Block: Duplicate VIC 3.
  Video Data Block: Duplicate VIC 5.
  Video Data Block: Duplicate VIC 20.
  Video Data Block: Duplicate VIC 4.
  Video Data Block: Duplicate VIC 19.
  Video Data Block: Duplicate VIC 31.
  Video Data Block: Duplicate VIC 18.
  Video Data Block: Duplicate VIC 2.
  Video Data Block: Duplicate VIC 17.
  Video Data Block: Duplicate VIC 16.
  Video Data Block: Duplicate VIC 63.
  Speaker Allocation Data Block: Only one instance of this Data Block is allowed.
  Detailed Timing Descriptor #6: Mismatch of image size 480x270 mm vs display size 530x300 mm.
  Detailed Timing Descriptor #7: Mismatch of image size 480x270 mm vs display size 530x300 mm.
  Detailed Timing Descriptor #8: Mismatch of image size 480x270 mm vs display size 530x300 mm.
  Detailed Timing Descriptor #9: Mismatch of image size 480x270 mm vs display size 530x300 mm.
EDID:
  Base EDID: EDID specified 1 extension block(s), but found 3 extension block(s).

EDID conformity: FAIL
