edid-decode (hex):

00 ff ff ff ff ff ff 00 65 09 54 4c 00 00 00 00
00 10 01 03 80 52 2e 78 08 d9 b0 a3 57 49 9c 25
11 49 4b 21 08 00 8c c0 45 40 81 80 81 c0 61 40
45 40 31 40 01 01 60 22 56 a0 50 00 16 30 00 20
05 00 34 cd 31 00 00 1e 00 00 00 fd 00 39 3f 2d
32 09 00 00 00 00 00 00 00 00 00 00 00 ff 00 4e
2f 41 0a 20 20 20 20 20 20 20 20 20 00 00 00 fc
00 33 37 4d 41 48 2d 4c 36 41 0a 20 20 20 01 7f

02 03 1a 71 46 85 04 02 01 06 21 23 09 7f 07 83
01 00 00 66 03 0c 00 10 00 80 01 1d 80 18 71 1c
16 20 58 2c 25 00 c4 8e 21 00 00 9e 01 1d 00 72
51 d0 1e 20 6e 28 55 00 c4 8e 21 00 00 1e 8c 0a
d0 8a 20 e0 2d 10 10 3e 96 00 13 8e 21 00 00 18
d6 09 80 a0 20 e0 2d 10 08 60 22 00 12 8e 21 08
08 18 8c 0a a0 14 51 f0 16 00 26 7c 43 00 13 8e
21 00 00 98 00 00 00 00 00 00 00 00 00 00 00 24

----------------

Block 0, Base EDID:
  EDID Structure Version & Revision: 1.3
  Vendor & Product Identification:
    Manufacturer: YHI
    Model: 19540
    Made in: 2006
  Basic Display Parameters & Features:
    Digital display
    Maximum image size: 82 cm x 46 cm
    Gamma: 2.20
    RGB color display
  Color Characteristics:
    Red  : 0.6396, 0.3408
    Green: 0.2871, 0.6103
    Blue : 0.1464, 0.0693
    White: 0.2851, 0.2929
  Established Timings I & II:
    DMT 0x04:   640x480    59.940476 Hz   4:3     31.469 kHz     25.175000 MHz
    DMT 0x09:   800x600    60.316541 Hz   4:3     37.879 kHz     40.000000 MHz
    DMT 0x10:  1024x768    60.003840 Hz   4:3     48.363 kHz     65.000000 MHz
  Standard Timings:
    GTF     :  1368x769    60.000000 Hz  16:9     47.760 kHz     85.968000 MHz
    DMT 0x09:   800x600    60.316541 Hz   4:3     37.879 kHz     40.000000 MHz
    DMT 0x23:  1280x1024   60.019740 Hz   5:4     63.981 kHz    108.000000 MHz
    DMT 0x55:  1280x720    60.000000 Hz  16:9     45.000 kHz     74.250000 MHz
    DMT 0x10:  1024x768    60.003840 Hz   4:3     48.363 kHz     65.000000 MHz
    DMT 0x09:   800x600    60.316541 Hz   4:3     37.879 kHz     40.000000 MHz
    DMT 0x04:   640x480    59.940476 Hz   4:3     31.469 kHz     25.175000 MHz
  Detailed Timing Descriptors:
    DTD 1:  1366x768    72.996334 Hz 683:384   57.667 kHz     88.000000 MHz (820 mm x 461 mm)
                 Hfront    0 Hsync  32 Hback  128 Hpol P
                 Vfront    0 Vsync   5 Vback   17 Vpol P
                   60 22 56 a0 50 00 16 30 00 20 05 00 34 cd 31 00 00 1e '`"V.P..0. ..4.1...'
    Display Range Limits:
      Monitor ranges (GTF): 57-63 Hz V, 45-50 kHz H, max dotclock 90 MHz
    Display Product Serial Number: ...
    Display Product Name: '37MAH-L6A'
  Extension blocks: 1
Checksum: 0x7f

----------------

Block 1, CTA-861 Extension Block:
  Revision: 3
  Basic audio support
  Supports YCbCr 4:4:4
  Supports YCbCr 4:2:2
  Native DTDs: 1
  Video Data Block:
    VIC   5:  1920x1080i  60.000000 Hz  16:9     33.750 kHz     74.250000 MHz (native)
    VIC   4:  1280x720    60.000000 Hz  16:9     45.000 kHz     74.250000 MHz
    VIC   2:   720x480    59.940060 Hz   4:3     31.469 kHz     27.000000 MHz
    VIC   1:   640x480    59.940476 Hz   4:3     31.469 kHz     25.175000 MHz
    VIC   6:  1440x480i   59.940060 Hz   4:3     15.734 kHz     27.000000 MHz
    VIC  33:  1920x1080   25.000000 Hz  16:9     28.125 kHz     74.250000 MHz
  Audio Data Block:
    Linear PCM:
      Max channels: 2
      Supported sample rates (kHz): 192 176.4 96 88.2 48 44.1 32
      Supported sample sizes (bits): 24 20 16
  Speaker Allocation Data Block:
    FL/FR - Front Left/Right
  Vendor-Specific Data Block (HDMI), OUI 00-0C-03:
    Source physical address: 1.0.0.0
    Supports_AI
  Detailed Timing Descriptors:
    DTD 2:  1920x1080i  60.000000 Hz  16:9     33.750 kHz     74.250000 MHz (708 mm x 398 mm)
                 Hfront   88 Hsync  44 Hback  148 Hpol P
                 Vfront    2 Vsync   5 Vback   15 Vpol P Vfront +0.5 Odd Field
                 Vfront    2 Vsync   5 Vback   15 Vpol P Vback  +0.5 Even Field
    DTD 3:  1280x720    60.000000 Hz  16:9     45.000 kHz     74.250000 MHz (708 mm x 398 mm)
                 Hfront  110 Hsync  40 Hback  220 Hpol P
                 Vfront    5 Vsync   5 Vback   20 Vpol P
    DTD 4:   720x480    59.940060 Hz   3:2     31.469 kHz     27.000000 MHz (531 mm x 398 mm)
                 Hfront   16 Hsync  62 Hback   60 Hpol N
                 Vfront    9 Vsync   6 Vback   30 Vpol N
    DTD 5:   640x480    59.952381 Hz   4:3     31.475 kHz     25.180000 MHz (530 mm x 398 mm)
                 Hfront    8 Hsync  96 Hback   40 Hpol N Hborder 8
                 Vfront    2 Vsync   2 Vback   25 Vpol N Vborder 8
    DTD 6:  1440x480i   59.940060 Hz   3:1     15.734 kHz     27.000000 MHz (531 mm x 398 mm)
                 Hfront   38 Hsync 124 Hback  114 Hpol N
                 Vfront    4 Vsync   3 Vback   15 Vpol N Vfront +0.5 Odd Field
                 Vfront    4 Vsync   3 Vback   15 Vpol N Vback  +0.5 Even Field
Checksum: 0x24  Unused space in Extension Block: 11 bytes

----------------

Warnings:

Block 0, Base EDID:
  Standard Timings: Standard Timing 1368x769 has a dubious odd vertical resolution.
Block 1, CTA-861 Extension Block:
  IT Video Formats are overscanned by default, but normally this should be underscanned.
  Video Data Block: VIC 5 and the first DTD are not identical. Is this intended?
  Detailed Timing Descriptor #4: Image size is 531x398 mm, but based on the picture AR it should be 531x354 mm.
  Detailed Timing Descriptor #5: The use of non-zero borders in a DTD is not recommended.
  Detailed Timing Descriptor #6: Image size is 531x398 mm, but based on the picture AR it should be 531x177 mm.
  Add a Colorimetry Data Block with the sRGB colorimetry bit set to avoid interop issues.
EDID:
  Base EDID: Some timings are out of range of the Monitor Ranges:
    Vertical Freq: 25.000 - 72.996 Hz (Monitor: 57.000 - 63.000 Hz)
    Horizontal Freq: 15.734 - 63.981 kHz (Monitor: 45.000 - 50.000 kHz)
    Maximum Clock: 108.000 MHz (Monitor: 90.000 MHz)

Failures:

Block 0, Base EDID:
  Basic Display Parameters & Features: EDID 1.3 requires that the first detailed timing is the preferred timing.
  Detailed Timing Descriptor #1: 0 values in the video timing:
    Horizontal Active/Blanking 1366/160
    Horizontal Frontporch/Sync Width 0/32
    Vertical Active/Blanking 768/22
    Vertical Frontporch/Sync Width 0/5
  Detailed Timing Descriptor #1: 0 or negative horizontal front porch.
  Display Range Limits: Byte 11 is 0x00 instead of 0x0a.
  Display Range Limits: Bytes 12-17 must be 0x20.
Block 1, CTA-861 Extension Block:
  Detailed Timing Descriptor #2: Mismatch of image size 708x398 mm vs display size 820x460 mm.
  Detailed Timing Descriptor #3: Mismatch of image size 708x398 mm vs display size 820x460 mm.
  Detailed Timing Descriptor #4: Mismatch of image size 531x398 mm vs display size 820x460 mm.
  Detailed Timing Descriptor #5: Mismatch of image size 530x398 mm vs display size 820x460 mm.
  Detailed Timing Descriptor #6: Mismatch of image size 531x398 mm vs display size 820x460 mm.
  Missing VCDB, needed for Set Selectable RGB Quantization to avoid interop issues.

EDID conformity: FAIL
