edid-decode (hex):

00 ff ff ff ff ff ff 00 09 e5 3f 0c 00 00 00 00
14 21 01 04 a5 1e 13 78 03 f6 c5 99 5d 57 91 27
24 50 54 00 00 00 01 01 01 01 01 01 01 01 01 01
01 01 01 01 01 01 33 3f 80 dc 70 b0 3c 40 30 20
36 00 2e bc 10 00 00 1a 00 00 00 fd 00 28 3c 4c
4c 10 01 0a 20 20 20 20 20 20 8f 32 80 dc 70 b0
3c 40 30 20 36 00 2e bc 10 00 00 00 00 00 00 fe
00 4e 56 31 34 30 57 55 4d 2d 4e 34 39 0a 00 77

00 ff ff ff ff ff ff 00 09 e5 3f 0c 00 00 00 00
14 21 01 04 a5 1e 13 78 03 f6 c5 99 5d 57 91 27
24 50 54 00 00 00 01 01 01 01 01 01 01 01 01 01
01 01 01 01 01 01 33 3f 80 dc 70 b0 3c 40 30 20
36 00 2e bc 10 00 00 1a 00 00 00 fd 00 28 3c 4c
4c 10 01 0a 20 20 20 20 20 20 8f 32 80 dc 70 b0
3c 40 30 20 36 00 2e bc 10 00 00 00 00 00 00 fe
00 4e 56 31 34 30 57 55 4d 2d 4e 34 39 0a 00 77

----------------

Block 0, Base EDID:
  EDID Structure Version & Revision: 1.4
  Vendor & Product Identification:
    Manufacturer: BOE
    Model: 3135
    Made in: week 20 of 2023
  Basic Display Parameters & Features:
    Digital display
    Bits per primary color channel: 8
    DisplayPort interface
    Maximum image size: 30 cm x 19 cm
    Gamma: 2.20
    Supported color formats: RGB 4:4:4
    First detailed timing includes the native pixel format and preferred refresh rate
    Display supports continuous frequencies
  Color Characteristics:
    Red  : 0.6005, 0.3662
    Green: 0.3408, 0.5683
    Blue : 0.1552, 0.1406
    White: 0.3134, 0.3291
  Established Timings I & II: none
  Standard Timings: none
  Detailed Timing Descriptors:
    DTD 1:  1920x1200   60.002225 Hz  16:10    75.603 kHz    161.790000 MHz (302 mm x 188 mm)
                 Hfront   48 Hsync  32 Hback  140 Hpol P
                 Vfront    3 Vsync   6 Vback   51 Vpol N
    Display Range Limits:
      Monitor ranges (Range Limits Only): 40-60 Hz V, 76-76 kHz H, max dotclock 160 MHz
    DTD 2:  1920x1200   48.001038 Hz  16:10    60.481 kHz    129.430000 MHz (analog composite, sync-on-green, 302 mm x 188 mm)
                 Hfront   48 Hsync  32 Hback  140 Hpol N
                 Vfront    3 Vsync   6 Vback   51 Vpol N
    Alphanumeric Data String: 'NV140WUM-N49'
Checksum: 0x77

----------------

Block 1, Unknown EDID Extension Block 0x00:
  00 ff ff ff ff ff ff 00 09 e5 3f 0c 00 00 00 00 '..........?.....'
  14 21 01 04 a5 1e 13 78 03 f6 c5 99 5d 57 91 27 '.!.....x....]W.''
  24 50 54 00 00 00 01 01 01 01 01 01 01 01 01 01 '$PT.............'
  01 01 01 01 01 01 33 3f 80 dc 70 b0 3c 40 30 20 '......3?..p.<@0 '
  36 00 2e bc 10 00 00 1a 00 00 00 fd 00 28 3c 4c '6............(<L'
  4c 10 01 0a 20 20 20 20 20 20 8f 32 80 dc 70 b0 'L...      .2..p.'
  3c 40 30 20 36 00 2e bc 10 00 00 00 00 00 00 fe '<@0 6...........'
  00 4e 56 31 34 30 57 55 4d 2d 4e 34 39 0a 00 77 '.NV140WUM-N49..w'
Checksum: 0x77

----------------

Warnings:

Block 0, Base EDID:
  Missing Display Product Name.
EDID:
  Base EDID: Some timings are out of range of the Monitor Ranges:
    Horizontal Freq: 60.481 - 75.602 kHz (Monitor: 76.000 - 76.000 kHz)
    Maximum Clock: 161.790 MHz (Monitor: 160.000 MHz)

Failures:

Block 0, Base EDID:
  Detailed Timing Descriptor #2: Invalid detailed timing descriptor ordering.
Block 1, Base EDID:
  Unknown Extension Block.
EDID:
  Base EDID: EDID specified 0 extension block(s), but found 1 extension block(s).

EDID conformity: FAIL
