edid-decode (hex):

00 ff ff ff ff ff ff 00 11 09 66 08 01 00 00 00
32 22 01 03 80 30 1b 78 2a 2d 36 a7 54 38 ae 26
0d 4f 54 21 08 00 81 80 81 40 81 00 81 c0 a9 40
a9 c0 95 00 b3 00 02 3a 80 18 71 38 2d 40 58 2c
25 00 dc 0c 11 00 00 1e 8e 44 80 a0 70 38 2d 40
58 2c 45 00 dc 0c 11 00 00 1e 00 00 00 fd 00 32
64 38 8c 24 00 0a 20 20 20 20 20 20 00 00 00 fc
00 41 44 32 32 5a 46 41 0a 20 20 20 20 20 01 10

02 03 29 f1 45 90 01 02 03 04 23 09 07 07 83 01
00 00 67 03 0c 00 10 00 08 48 e2 00 d5 e3 05 c0
00 67 d8 5d c4 01 00 80 01 01 1d 00 72 51 d0 1e
20 6e 28 55 00 dc 0c 11 00 00 1e 14 1d 56 a0 50
00 2d 30 58 2c 45 00 dc 0c 11 00 00 1e 68 5b 80
a0 70 38 2d 40 30 20 35 00 dc 0c 11 00 00 1e 02
3a 80 18 71 38 2d 40 58 2c 45 00 dc 0c 11 00 00
1e 00 00 00 00 00 00 00 00 00 00 00 00 00 00 2a

00 ff ff ff ff ff ff 00 11 09 66 08 01 00 00 00
32 22 01 03 80 30 1b 78 2a 2d 36 a7 54 38 ae 26
0d 4f 54 21 08 00 81 80 81 40 81 00 81 c0 a9 40
a9 c0 95 00 b3 00 02 3a 80 18 71 38 2d 40 58 2c
25 00 dc 0c 11 00 00 1e 8e 44 80 a0 70 38 2d 40
58 2c 45 00 dc 0c 11 00 00 1e 00 00 00 fd 00 32
64 38 8c 24 00 0a 20 20 20 20 20 20 00 00 00 fc
00 41 44 32 32 5a 46 41 0a 20 20 20 20 20 01 10

02 03 29 f1 45 90 01 02 03 04 23 09 07 07 83 01
00 00 67 03 0c 00 10 00 08 48 e2 00 d5 e3 05 c0
00 67 d8 5d c4 01 00 80 01 01 1d 00 72 51 d0 1e
20 6e 28 55 00 dc 0c 11 00 00 1e 14 1d 56 a0 50
00 2d 30 58 2c 45 00 dc 0c 11 00 00 1e 68 5b 80
a0 70 38 2d 40 30 20 35 00 dc 0c 11 00 00 1e 02
3a 80 18 71 38 2d 40 58 2c 45 00 dc 0c 11 00 00
1e 00 00 00 00 00 00 00 00 00 00 00 00 00 00 2a

----------------

Block 0, Base EDID:
  EDID Structure Version & Revision: 1.3
  Vendor & Product Identification:
    Manufacturer: DHI
    Model: 2150
    Serial Number: ...
    Made in: week 50 of 2024
  Basic Display Parameters & Features:
    Digital display
    Maximum image size: 48 cm x 27 cm
    Gamma: 2.20
    DPMS levels: Off
    RGB color display
    First detailed timing is the preferred timing
  Color Characteristics:
    Red  : 0.6523, 0.3300
    Green: 0.2216, 0.6806
    Blue : 0.1484, 0.0537
    White: 0.3095, 0.3300
  Established Timings I & II:
    DMT 0x04:   640x480    59.940476 Hz   4:3     31.469 kHz     25.175000 MHz
    DMT 0x09:   800x600    60.316541 Hz   4:3     37.879 kHz     40.000000 MHz
    DMT 0x10:  1024x768    60.003840 Hz   4:3     48.363 kHz     65.000000 MHz
  Standard Timings:
    DMT 0x23:  1280x1024   60.019740 Hz   5:4     63.981 kHz    108.000000 MHz
    DMT 0x20:  1280x960    60.000000 Hz   4:3     60.000 kHz    108.000000 MHz
    DMT 0x1c:  1280x800    59.810326 Hz  16:10    49.702 kHz     83.500000 MHz
    DMT 0x55:  1280x720    60.000000 Hz  16:9     45.000 kHz     74.250000 MHz
    DMT 0x33:  1600x1200   60.000000 Hz   4:3     75.000 kHz    162.000000 MHz
    DMT 0x53:  1600x900    60.000000 Hz  16:9     60.000 kHz    108.000000 MHz (RB)
    DMT 0x2f:  1440x900    59.887445 Hz  16:10    55.935 kHz    106.500000 MHz
    DMT 0x3a:  1680x1050   59.954250 Hz  16:10    65.290 kHz    146.250000 MHz
  Detailed Timing Descriptors:
    DTD 1:  1920x1080   60.000000 Hz  16:9     67.500 kHz    148.500000 MHz (476 mm x 268 mm)
                 Hfront   88 Hsync  44 Hback  148 Hpol P
                 Vfront    2 Vsync   5 Vback   38 Vpol P
    DTD 2:  1920x1080   75.000000 Hz  16:9     84.375 kHz    175.500000 MHz (476 mm x 268 mm)
                 Hfront   88 Hsync  44 Hback   28 Hpol P
                 Vfront    4 Vsync   5 Vback   36 Vpol P
    Display Range Limits:
      Monitor ranges (GTF): 50-100 Hz V, 56-140 kHz H, max dotclock 360 MHz
    Display Product Name: 'AD22ZFA'
  Extension blocks: 1
Checksum: 0x10

----------------

Block 1, CTA-861 Extension Block:
  Revision: 3
  Underscans IT Video Formats by default
  Basic audio support
  Supports YCbCr 4:4:4
  Supports YCbCr 4:2:2
  Native DTDs: 1
  Video Data Block:
    VIC  16:  1920x1080   60.000000 Hz  16:9     67.500 kHz    148.500000 MHz (native)
    VIC   1:   640x480    59.940476 Hz   4:3     31.469 kHz     25.175000 MHz
    VIC   2:   720x480    59.940060 Hz   4:3     31.469 kHz     27.000000 MHz
    VIC   3:   720x480    59.940060 Hz  16:9     31.469 kHz     27.000000 MHz
    VIC   4:  1280x720    60.000000 Hz  16:9     45.000 kHz     74.250000 MHz
  Audio Data Block:
    Linear PCM:
      Max channels: 2
      Supported sample rates (kHz): 48 44.1 32
      Supported sample sizes (bits): 24 20 16
  Speaker Allocation Data Block:
    FL/FR - Front Left/Right
  Vendor-Specific Data Block (HDMI), OUI 00-0C-03:
    Source physical address: 1.0.0.0
    DC_Y444
    Maximum TMDS clock: 360 MHz
  Video Capability Data Block:
    YCbCr quantization: Selectable (via AVI YQ)
    RGB quantization: Selectable (via AVI Q)
    PT scan behavior: Always Overscanned
    IT scan behavior: Always Overscanned
    CE scan behavior: Always Overscanned
  Colorimetry Data Block:
    BT2020YCC
    BT2020RGB
  Vendor-Specific Data Block (HDMI Forum), OUI C4-5D-D8:
    Version: 1
    SCDC Present
    Supports 10-bits/component Deep Color 4:2:0 Pixel Encoding
  Detailed Timing Descriptors:
    DTD 3:  1280x720    60.000000 Hz  16:9     45.000 kHz     74.250000 MHz (476 mm x 268 mm)
                 Hfront  110 Hsync  40 Hback  220 Hpol P
                 Vfront    5 Vsync   5 Vback   20 Vpol P
    DTD 4:  1366x768    60.001386 Hz 683:384   48.781 kHz     74.440000 MHz (476 mm x 268 mm)
                 Hfront   88 Hsync  44 Hback   28 Hpol P
                 Vfront    4 Vsync   5 Vback   36 Vpol P
    DTD 5:  1920x1080  100.000000 Hz  16:9    112.500 kHz    234.000000 MHz (476 mm x 268 mm)
                 Hfront   48 Hsync  32 Hback   80 Hpol P
                 Vfront    3 Vsync   5 Vback   37 Vpol P
    DTD 6:  1920x1080   60.000000 Hz  16:9     67.500 kHz    148.500000 MHz (476 mm x 268 mm)
                 Hfront   88 Hsync  44 Hback  148 Hpol P
                 Vfront    4 Vsync   5 Vback   36 Vpol P
Checksum: 0x2a  Unused space in Extension Block: 14 bytes

----------------

Warnings:

Block 0, Base EDID:
  Vendor & Product Identification: The serial number is one of the known dummy values, it should probably be set to 0.
  Detailed Timing Descriptor #1: DTD is similar but not identical to VIC 16.
Block 1, CTA-861 Extension Block:
  Video Data Block: VIC 16 and the first DTD are not identical. Is this intended?
  Video Capability Data Block: IT scan behavior is expected to support underscanned.
  Video Capability Data Block: S_PT is equal to S_IT and S_CE, so should be set to 0 instead.
  Colorimetry Data Block: Set the sRGB colorimetry bit to avoid interop issues.
EDID:
  Base EDID: Some timings are out of range of the Monitor Ranges:
    Horizontal Freq: 31.468 - 112.500 kHz (Monitor: 56.000 - 140.000 kHz)

Failures:

Block 1, CTA-861 Extension Block:
  Vendor-Specific Data Block (HDMI), OUI 00-0C-03: HDMI VSDB Max TMDS rate is > 340.
  Video Capability Data Block: IT video formats are always overscanned, but bit 7 of Byte 3 of the CTA-861 Extension header is set to underscanned.
  Vendor-Specific Data Block (HDMI Forum), OUI C4-5D-D8: HDMI Forum VSDB did not immediately follow the HDMI VSDB.
EDID:
  Extension Block 2 started with EDID header, ignoring Extension Blocks >= 2.

EDID conformity: FAIL
