edid-decode (hex):

00 ff ff ff ff ff ff 00 11 09 66 08 59 01 00 00
0f 22 01 03 80 30 1b 78 2a ce 75 a3 55 50 96 25
0d 50 54 bf ef 80 81 40 81 80 81 cf 81 00 a9 c0
a9 40 95 00 b3 c0 02 3a 80 18 71 38 2d 40 58 2c
45 00 dc 0c 11 00 00 1e 00 00 00 fd 00 30 64 1e
55 18 00 0a 20 20 20 20 20 20 00 00 00 fc 00 4c
4d 32 32 2d 42 32 30 30 53 0a 20 20 00 00 00 ff
00 30 30 30 30 30 30 30 31 30 30 30 30 0a 01 de

02 03 2a f1 4b 90 02 03 04 11 12 13 00 00 1f 01
23 09 07 07 83 01 00 00 65 03 0c 00 10 00 68 1a
00 00 01 01 30 64 e6 e2 00 7b 68 5b 80 a0 70 38
2d 40 58 2c 45 00 dc 0c 11 00 00 1a 2a 44 80 a0
70 38 27 40 08 20 98 04 dc 0c 11 00 00 1e 02 3a
80 18 71 38 2d 40 58 2c 45 00 dc 0c 11 00 00 1e
8c 0a d0 90 20 40 31 20 0c 40 55 00 0f 29 21 00
00 18 00 00 00 00 00 00 00 00 00 00 00 00 00 3a

00 ff ff ff ff ff ff 00 11 09 66 08 59 01 00 00
0f 22 01 03 80 30 1b 78 2a ce 75 a3 55 50 96 25
0d 50 54 bf ef 80 81 40 81 80 81 cf 81 00 a9 c0
a9 40 95 00 b3 c0 02 3a 80 18 71 38 2d 40 58 2c
45 00 dc 0c 11 00 00 1e 00 00 00 fd 00 30 64 1e
55 18 00 0a 20 20 20 20 20 20 00 00 00 fc 00 4c
4d 32 32 2d 42 32 30 30 53 0a 20 20 00 00 00 ff
00 30 30 30 30 30 30 30 31 30 30 30 30 0a 01 de

02 03 2a f1 4b 90 02 03 04 11 12 13 00 00 1f 01
23 09 07 07 83 01 00 00 65 03 0c 00 10 00 68 1a
00 00 01 01 30 64 e6 e2 00 7b 68 5b 80 a0 70 38
2d 40 58 2c 45 00 dc 0c 11 00 00 1a 2a 44 80 a0
70 38 27 40 08 20 98 04 dc 0c 11 00 00 1e 02 3a
80 18 71 38 2d 40 58 2c 45 00 dc 0c 11 00 00 1e
8c 0a d0 90 20 40 31 20 0c 40 55 00 0f 29 21 00
00 18 00 00 00 00 00 00 00 00 00 00 00 00 00 3a

----------------

Block 0, Base EDID:
  EDID Structure Version & Revision: 1.3
  Vendor & Product Identification:
    Manufacturer: DHI
    Model: 2150
    Serial Number: ...
    Made in: week 15 of 2024
  Basic Display Parameters & Features:
    Digital display
    Maximum image size: 48 cm x 27 cm
    Gamma: 2.20
    DPMS levels: Off
    RGB color display
    First detailed timing is the preferred timing
  Color Characteristics:
    Red  : 0.6396, 0.3320
    Green: 0.3154, 0.5878
    Blue : 0.1455, 0.0537
    White: 0.3134, 0.3291
  Established Timings I & II:
    IBM     :   720x400    70.081663 Hz   9:5     31.467 kHz     28.320000 MHz
    DMT 0x04:   640x480    59.940476 Hz   4:3     31.469 kHz     25.175000 MHz
    Apple   :   640x480    66.666667 Hz   4:3     35.000 kHz     30.240000 MHz
    DMT 0x05:   640x480    72.808802 Hz   4:3     37.861 kHz     31.500000 MHz
    DMT 0x06:   640x480    75.000000 Hz   4:3     37.500 kHz     31.500000 MHz
    DMT 0x08:   800x600    56.250000 Hz   4:3     35.156 kHz     36.000000 MHz
    DMT 0x09:   800x600    60.316541 Hz   4:3     37.879 kHz     40.000000 MHz
    DMT 0x0a:   800x600    72.187572 Hz   4:3     48.077 kHz     50.000000 MHz
    DMT 0x0b:   800x600    75.000000 Hz   4:3     46.875 kHz     49.500000 MHz
    Apple   :   832x624    74.551266 Hz   4:3     49.726 kHz     57.284000 MHz
    DMT 0x10:  1024x768    60.003840 Hz   4:3     48.363 kHz     65.000000 MHz
    DMT 0x11:  1024x768    70.069359 Hz   4:3     56.476 kHz     75.000000 MHz
    DMT 0x12:  1024x768    75.028582 Hz   4:3     60.023 kHz     78.750000 MHz
    DMT 0x24:  1280x1024   75.024675 Hz   5:4     79.976 kHz    135.000000 MHz
    Apple   :  1152x870    75.061550 Hz 192:145   68.681 kHz    100.000000 MHz
  Standard Timings:
    DMT 0x20:  1280x960    60.000000 Hz   4:3     60.000 kHz    108.000000 MHz
    DMT 0x23:  1280x1024   60.019740 Hz   5:4     63.981 kHz    108.000000 MHz
    GTF     :  1280x720    74.999686 Hz  16:9     56.400 kHz     95.654000 MHz
    DMT 0x1c:  1280x800    59.810326 Hz  16:10    49.702 kHz     83.500000 MHz
    DMT 0x53:  1600x900    60.000000 Hz  16:9     60.000 kHz    108.000000 MHz (RB)
    DMT 0x33:  1600x1200   60.000000 Hz   4:3     75.000 kHz    162.000000 MHz
    DMT 0x2f:  1440x900    59.887445 Hz  16:10    55.935 kHz    106.500000 MHz
    GTF     :  1680x945    59.999909 Hz  16:9     58.680 kHz    131.443000 MHz
  Detailed Timing Descriptors:
    DTD 1:  1920x1080   60.000000 Hz  16:9     67.500 kHz    148.500000 MHz (476 mm x 268 mm)
                 Hfront   88 Hsync  44 Hback  148 Hpol P
                 Vfront    4 Vsync   5 Vback   36 Vpol P
    Display Range Limits:
      Monitor ranges (GTF): 48-100 Hz V, 30-85 kHz H, max dotclock 240 MHz
    Display Product Name: 'LM22-B200S'
    Display Product Serial Number: ...
  Extension blocks: 1
Checksum: 0xde

----------------

Block 1, CTA-861 Extension Block:
  Revision: 3
  Underscans IT Video Formats by default
  Basic audio support
  Supports YCbCr 4:4:4
  Supports YCbCr 4:2:2
  Native DTDs: 1
  Video Data Block:
    VIC  16:  1920x1080   60.000000 Hz  16:9     67.500 kHz    148.500000 MHz (native)
    VIC   2:   720x480    59.940060 Hz   4:3     31.469 kHz     27.000000 MHz
    VIC   3:   720x480    59.940060 Hz  16:9     31.469 kHz     27.000000 MHz
    VIC   4:  1280x720    60.000000 Hz  16:9     45.000 kHz     74.250000 MHz
    VIC  17:   720x576    50.000000 Hz   4:3     31.250 kHz     27.000000 MHz
    VIC  18:   720x576    50.000000 Hz  16:9     31.250 kHz     27.000000 MHz
    VIC  19:  1280x720    50.000000 Hz  16:9     37.500 kHz     74.250000 MHz
    VIC  31:  1920x1080   50.000000 Hz  16:9     56.250 kHz    148.500000 MHz
    VIC   1:   640x480    59.940476 Hz   4:3     31.469 kHz     25.175000 MHz
  Audio Data Block:
    Linear PCM:
      Max channels: 2
      Supported sample rates (kHz): 48 44.1 32
      Supported sample sizes (bits): 24 20 16
  Speaker Allocation Data Block:
    FL/FR - Front Left/Right
  Vendor-Specific Data Block (HDMI), OUI 00-0C-03:
    Source physical address: 1.0.0.0
  Vendor-Specific Data Block (AMD), OUI 00-00-1A:
    Version: 1
    Feature Caps: 0x01
    Minimum Refresh Rate: 48 Hz
    Maximum Refresh Rate: 100 Hz
    Flags 1.x: 0xe6 (MCCS)
  Video Capability Data Block:
    YCbCr quantization: No Data
    RGB quantization: Selectable (via AVI Q)
    PT scan behavior: Supports both over- and underscan
    IT scan behavior: Always Underscanned
    CE scan behavior: Supports both over- and underscan
  Detailed Timing Descriptors:
    DTD 2:  1920x1080  100.000000 Hz  16:9    112.500 kHz    234.000000 MHz (476 mm x 268 mm)
                 Hfront   88 Hsync  44 Hback   28 Hpol P
                 Vfront    4 Vsync   5 Vback   36 Vpol N
    DTD 3:  1920x1080   74.972503 Hz  16:9     83.894 kHz    174.500000 MHz (476 mm x 268 mm)
                 Hfront    8 Hsync  32 Hback  120 Hpol P
                 Vfront   25 Vsync   8 Vback    6 Vpol P
    DTD 4:  1920x1080   60.000000 Hz  16:9     67.500 kHz    148.500000 MHz (476 mm x 268 mm)
                 Hfront   88 Hsync  44 Hback  148 Hpol P
                 Vfront    4 Vsync   5 Vback   36 Vpol P
    DTD 5:   720x576    50.000000 Hz   5:4     31.250 kHz     27.000000 MHz (527 mm x 297 mm)
                 Hfront   12 Hsync  64 Hback   68 Hpol N
                 Vfront    5 Vsync   5 Vback   39 Vpol N
Checksum: 0x3a  Unused space in Extension Block: 13 bytes

----------------

Warnings:

Block 0, Base EDID:
  Standard Timings: Standard Timing 1680x945 has a dubious odd vertical resolution.
  Display Product Serial Number: ...
Block 1, CTA-861 Extension Block:
  Video Capability Data Block: Set Selectable YCbCr Quantization to avoid interop issues.
  Detailed Timing Descriptor #5: Image size is 527x297 mm, but based on the picture AR it should be 371x297 mm.
  Display Product Serial Number is set, so the Serial Number in the Base EDID should be 0.
  Add a Colorimetry Data Block with the sRGB colorimetry bit set to avoid interop issues.
EDID:
  Base EDID: Some timings are out of range of the Monitor Ranges:
    Horizontal Freq: 31.250 - 112.500 kHz (Monitor: 30.000 - 85.000 kHz)

Failures:

Block 1, CTA-861 Extension Block:
  Detailed Timing Descriptor #5: Mismatch of image size 527x297 mm vs display size 480x270 mm.
EDID:
  Extension Block 2 started with EDID header, ignoring Extension Blocks >= 2.
  Base EDID: The DTD max image size is 527x297mm, which is larger than the display size 480.0x270.0mm.

EDID conformity: FAIL
