edid-decode (hex):

00 ff ff ff ff ff ff 00 06 af 2d 4b 00 00 00 00
2d 1c 01 04 95 1d 11 78 03 3b 35 92 57 59 5e 29
1e 50 54 00 00 00 01 01 01 01 01 01 01 01 01 01
01 01 01 01 01 01 90 38 80 b8 70 38 42 40 10 10
3e 00 25 a5 10 00 00 18 b5 25 80 b8 70 38 42 40
10 10 3e 00 25 a5 10 00 00 18 00 00 00 00 00 00
00 00 00 00 00 00 00 00 00 00 00 00 00 00 00 02
00 10 40 ff 0f 3c 7d 19 0e 1e 7d 20 20 20 00 01

00 ff ff ff ff ff ff 00 06 af 2d 4b 00 00 00 00
2d 1c 01 04 95 1d 11 78 03 3b 35 92 57 59 5e 29
1e 50 54 00 00 00 01 01 01 01 01 01 01 01 01 01
01 01 01 01 01 01 90 38 80 b8 70 38 42 40 10 10
3e 00 25 a5 10 00 00 18 b5 25 80 b8 70 38 42 40
10 10 3e 00 25 a5 10 00 00 18 00 00 00 00 00 00
00 00 00 00 00 00 00 00 00 00 00 00 00 00 00 02
00 10 40 ff 0f 3c 7d 19 0e 1e 7d 20 20 20 00 01

----------------

Block 0, Base EDID:
  EDID Structure Version & Revision: 1.4
  Vendor & Product Identification:
    Manufacturer: AUO
    Model: 19245
    Made in: week 45 of 2018
  Basic Display Parameters & Features:
    Digital display
    Bits per primary color channel: 6
    DisplayPort interface
    Maximum image size: 29 cm x 17 cm
    Gamma: 2.20
    Supported color formats: RGB 4:4:4
    First detailed timing includes the native pixel format and preferred refresh rate
    Display supports continuous frequencies
  Color Characteristics:
    Red  : 0.5703, 0.3427
    Green: 0.3496, 0.3701
    Blue : 0.1601, 0.1201
    White: 0.3134, 0.3291
  Established Timings I & II: none
  Standard Timings: none
  Detailed Timing Descriptors:
    DTD 1:  1920x1080   60.053484 Hz  16:9     68.821 kHz    144.800000 MHz (293 mm x 165 mm)
                 Hfront   16 Hsync  16 Hback  152 Hpol N
                 Vfront    3 Vsync  14 Vback   49 Vpol N
    DTD 2:  1920x1080   40.034274 Hz  16:9     45.879 kHz     96.530000 MHz (293 mm x 165 mm)
                 Hfront   16 Hsync  16 Hback  152 Hpol N
                 Vfront    3 Vsync  14 Vback   49 Vpol N
    Empty Descriptor
    Manufacturer-Specified Display Descriptor (0x02): 00 02 00 10 40 ff 0f 3c 7d 19 0e 1e 7d 20 20 20 '....@..<}...}   '
Checksum: 0x01

----------------

Warnings:

Block 0, Base EDID:
  Missing Display Product Name.

Failures:

Block 0, Base EDID:
  Empty Descriptor: Use Dummy Descriptor instead of all zeroes.
  Missing Display Range Limits Descriptor.
EDID:
  Extension Block 1 started with EDID header, ignoring Extension Blocks >= 1.

EDID conformity: FAIL
