edid-decode (hex):

00 ff ff ff ff ff ff 00 0e 14 21 1c 00 00 00 00
0b 13 01 03 80 19 0e 78 0a 1d 1d 92 55 57 90 27
1b 50 54 00 00 00 01 01 01 01 01 01 01 01 01 01
01 01 01 01 01 01 20 1c 56 80 50 00 23 30 30 20
36 00 00 90 10 00 00 19 00 00 00 0f 00 20 20 20
20 20 20 20 20 a0 ff 02 32 00 00 00 00 fe 00 43
50 54 0a 20 20 20 20 20 20 20 20 20 00 00 00 fe
00 43 4c 41 41 31 31 36 57 41 30 31 41 20 00 78

----------------

Block 0, Base EDID:
  EDID Structure Version & Revision: 1.3
  Vendor & Product Identification:
    Manufacturer: CPT
    Model: 7201
    Made in: week 11 of 2009
  Basic Display Parameters & Features:
    Digital display
    Maximum image size: 25 cm x 14 cm
    Gamma: 2.20
    RGB color display
    First detailed timing is the preferred timing
  Color Characteristics:
    Red  : 0.5703, 0.3330
    Green: 0.3427, 0.5634
    Blue : 0.1523, 0.1064
    White: 0.3154, 0.3291
  Established Timings I & II: none
  Standard Timings: none
  Detailed Timing Descriptors:
    DTD 1:  1366x768    60.015904 Hz 683:384   48.193 kHz     72.000000 MHz (256 mm x 144 mm)
                 Hfront   48 Hsync  32 Hback   48 Hpol N
                 Vfront    3 Vsync   6 Vback   26 Vpol N
    Manufacturer-Specified Display Descriptor (0x0f): 00 0f 00 20 20 20 20 20 20 20 20 a0 ff 02 32 00 '...        ...2.'
    Alphanumeric Data String: 'CPT'
    Alphanumeric Data String: 'CLAA116WA01A '
Checksum: 0x78

----------------

Failures:

Block 0, Base EDID:
  Alphanumeric Data String: No newline, but one or more trailing spaces.
  Missing Display Product Name.
  Missing Display Range Limits Descriptor.

EDID conformity: FAIL
