edid-decode (hex):

00 ff ff ff ff ff ff 00 0d af 24 10 00 00 00 00
33 13 01 03 90 16 0c 78 0a 01 c5 92 5d 5a 8f 27
20 50 54 00 00 00 01 01 01 01 01 01 01 01 01 01
01 01 01 01 01 01 05 18 00 f4 41 58 46 20 88 5b
9b 00 de 7d 00 00 00 1a 00 00 00 00 00 00 00 00
00 00 00 00 00 00 00 00 00 00 00 00 00 fe 00 4a
4a 34 35 31 80 4e 31 30 31 4c 36 0a 00 00 00 00
00 00 00 00 00 00 00 00 00 01 01 0a 20 20 00 98

----------------

Block 0, Base EDID:
  EDID Structure Version & Revision: 1.3
  Vendor & Product Identification:
    Manufacturer: CMO
    Model: 4132
    Made in: week 51 of 2009
  Basic Display Parameters & Features:
    Digital display
    Maximum image size: 22 cm x 12 cm
    Gamma: 2.20
    RGB color display
    First detailed timing is the preferred timing
  Color Characteristics:
    Red  : 0.5703, 0.3632
    Green: 0.3515, 0.5595
    Blue : 0.1552, 0.1250
    White: 0.3134, 0.3291
  Established Timings I & II: none
  Standard Timings: none
  Detailed Timing Descriptors:
    DTD 1:  1024x600    60.220551 Hz 128:75    40.348 kHz     61.490000 MHz (222 mm x 125 mm)
                 Hfront  136 Hsync  91 Hback  273 Hpol P
                 Vfront    9 Vsync  11 Vback   50 Vpol N
    Empty Descriptor
    Alphanumeric Data String: 'JJ451.N101L6'
    Manufacturer-Specified Display Descriptor (0x00): 00 00 00 00 00 00 00 00 00 00 00 01 01 0a 20 20 '..............  '
Checksum: 0x98

----------------

Warnings:

Block 0, Base EDID:
  Alphanumeric Data String: Non-ASCII character 0x80 at position 5, can cause problems.

Failures:

Block 0, Base EDID:
  Basic Display Parameters & Features: Digital Video Interface Standard set to reserved value 0x10.
  Empty Descriptor: Use Dummy Descriptor instead of all zeroes.
  Missing Display Product Name.
  Missing Display Range Limits Descriptor.

EDID conformity: FAIL
