edid-decode (hex):

00 ff ff ff ff ff ff 00 04 72 98 05 cd 72 20 84
2a 1c 01 03 80 3c 22 78 2a 0b 75 a6 55 53 9f 28
0e 50 54 b3 0c 00 71 4f 81 80 81 c0 81 00 95 00
b3 00 01 01 01 01 68 42 80 6a 70 38 27 40 08 20
98 04 56 50 21 00 00 1e 02 3a 80 18 71 38 2d 40
58 2c 45 00 56 50 21 00 00 1e 00 00 00 fd 00 37
4c 1e 5b 12 00 0a 20 20 20 20 20 20 00 00 00 fc
00 41 63 65 72 20 43 42 32 37 31 48 20 42 01 57

02 03 1e f1 4b 01 02 03 04 05 90 11 12 13 14 1f
23 09 07 07 83 01 00 00 65 03 0c 00 10 00 02 3a
80 d0 72 38 2d 40 10 2c 96 80 56 50 21 00 00 18
02 3a 80 18 71 38 2d 40 58 2c 96 00 56 50 21 00
00 18 01 1d 00 bc 52 d0 1e 20 b8 28 55 40 56 50
21 00 00 1e 8c 0a d0 90 20 40 31 20 0c 40 55 00
56 50 21 00 00 18 00 00 00 00 00 00 00 00 00 00
00 00 00 00 00 00 00 00 00 00 00 00 00 00 00 e5

00 ff ff ff ff ff ff 00 04 72 98 05 cd 72 20 84
2a 1c 01 03 80 3c 22 78 2a 0b 75 a6 55 53 9f 28
0e 50 54 b3 0c 00 71 4f 81 80 81 c0 81 00 95 00
b3 00 01 01 01 01 68 42 80 6a 70 38 27 40 08 20
98 04 56 50 21 00 00 1e 02 3a 80 18 71 38 2d 40
58 2c 45 00 56 50 21 00 00 1e 00 00 00 fd 00 37
4c 1e 5b 12 00 0a 20 20 20 20 20 20 00 00 00 fc
00 41 63 65 72 20 43 42 32 37 31 48 20 42 01 57

02 03 1e f1 4b 01 02 03 04 05 90 11 12 13 14 1f
23 09 07 07 83 01 00 00 65 03 0c 00 10 00 02 3a
80 d0 72 38 2d 40 10 2c 96 80 56 50 21 00 00 18
02 3a 80 18 71 38 2d 40 58 2c 96 00 56 50 21 00
00 18 01 1d 00 bc 52 d0 1e 20 b8 28 55 40 56 50
21 00 00 1e 8c 0a d0 90 20 40 31 20 0c 40 55 00
56 50 21 00 00 18 00 00 00 00 00 00 00 00 00 00
00 00 00 00 00 00 00 00 00 00 00 00 00 00 00 e5

----------------

Block 0, Base EDID:
  EDID Structure Version & Revision: 1.3
  Vendor & Product Identification:
    Manufacturer: ACR
    Model: 1432
    Serial Number: ...
    Made in: week 42 of 2018
  Basic Display Parameters & Features:
    Digital display
    Maximum image size: 60 cm x 34 cm
    Gamma: 2.20
    DPMS levels: Off
    RGB color display
    First detailed timing is the preferred timing
  Color Characteristics:
    Red  : 0.6484, 0.3320
    Green: 0.3261, 0.6240
    Blue : 0.1572, 0.0576
    White: 0.3134, 0.3291
  Established Timings I & II:
    IBM     :   720x400    70.081663 Hz   9:5     31.467 kHz     28.320000 MHz
    DMT 0x04:   640x480    59.940476 Hz   4:3     31.469 kHz     25.175000 MHz
    Apple   :   640x480    66.666667 Hz   4:3     35.000 kHz     30.240000 MHz
    DMT 0x08:   800x600    56.250000 Hz   4:3     35.156 kHz     36.000000 MHz
    DMT 0x09:   800x600    60.316541 Hz   4:3     37.879 kHz     40.000000 MHz
    DMT 0x10:  1024x768    60.003840 Hz   4:3     48.363 kHz     65.000000 MHz
    DMT 0x11:  1024x768    70.069359 Hz   4:3     56.476 kHz     75.000000 MHz
  Standard Timings:
    DMT 0x15:  1152x864    75.000000 Hz   4:3     67.500 kHz    108.000000 MHz
    DMT 0x23:  1280x1024   60.019740 Hz   5:4     63.981 kHz    108.000000 MHz
    DMT 0x55:  1280x720    60.000000 Hz  16:9     45.000 kHz     74.250000 MHz
    DMT 0x1c:  1280x800    59.810326 Hz  16:10    49.702 kHz     83.500000 MHz
    DMT 0x2f:  1440x900    59.887445 Hz  16:10    55.935 kHz    106.500000 MHz
    DMT 0x3a:  1680x1050   59.954250 Hz  16:10    65.290 kHz    146.250000 MHz
  Detailed Timing Descriptors:
    DTD  1:  1920x1080   74.985863 Hz  16:9     83.909 kHz    170.000000 MHz (598 mm x 336 mm)
                  Hfront    8 Hsync  32 Hback   66 Hpol P
                  Vfront   25 Vsync   8 Vback    6 Vpol P
    DTD  2:  1920x1080   60.000000 Hz  16:9     67.500 kHz    148.500000 MHz (598 mm x 336 mm)
                  Hfront   88 Hsync  44 Hback  148 Hpol P
                  Vfront    4 Vsync   5 Vback   36 Vpol P
    Display Range Limits:
      Monitor ranges (GTF): 55-76 Hz V, 30-91 kHz H, max dotclock 180 MHz
    Display Product Name: 'Acer CB271H B'
  Extension blocks: 1
Checksum: 0x57

----------------

Block 1, CTA-861 Extension Block:
  Revision: 3
  Underscans IT Video Formats by default
  Basic audio support
  Supports YCbCr 4:4:4
  Supports YCbCr 4:2:2
  Native detailed modes: 1
  Video Data Block:
    VIC   1:   640x480    59.940476 Hz   4:3     31.469 kHz     25.175000 MHz
    VIC   2:   720x480    59.940060 Hz   4:3     31.469 kHz     27.000000 MHz
    VIC   3:   720x480    59.940060 Hz  16:9     31.469 kHz     27.000000 MHz
    VIC   4:  1280x720    60.000000 Hz  16:9     45.000 kHz     74.250000 MHz
    VIC   5:  1920x1080i  60.000000 Hz  16:9     33.750 kHz     74.250000 MHz
    VIC  16:  1920x1080   60.000000 Hz  16:9     67.500 kHz    148.500000 MHz (native)
    VIC  17:   720x576    50.000000 Hz   4:3     31.250 kHz     27.000000 MHz
    VIC  18:   720x576    50.000000 Hz  16:9     31.250 kHz     27.000000 MHz
    VIC  19:  1280x720    50.000000 Hz  16:9     37.500 kHz     74.250000 MHz
    VIC  20:  1920x1080i  50.000000 Hz  16:9     28.125 kHz     74.250000 MHz
    VIC  31:  1920x1080   50.000000 Hz  16:9     56.250 kHz    148.500000 MHz
  Audio Data Block:
    Linear PCM:
      Max channels: 2
      Supported sample rates (kHz): 48 44.1 32
      Supported sample sizes (bits): 24 20 16
  Speaker Allocation Data Block:
    FL/FR - Front Left/Right
  Vendor-Specific Data Block (HDMI), OUI 00-0C-03:
    Source physical address: 1.0.0.0
  Detailed Timing Descriptors:
    DTD  3:  1920x1080   50.000000 Hz  16:9     56.250 kHz    148.500000 MHz (598 mm x 336 mm)
                  Hfront  528 Hsync  44 Hback  148 Hpol N
                  Vfront    9 Vsync   6 Vback   30 Vpol N
    DTD  4:  1920x1080   60.000000 Hz  16:9     67.500 kHz    148.500000 MHz (598 mm x 336 mm)
                  Hfront   88 Hsync  44 Hback  148 Hpol N
                  Vfront    9 Vsync   6 Vback   30 Vpol N
    DTD  5:  1280x720    50.000000 Hz  16:9     37.500 kHz     74.250000 MHz (598 mm x 336 mm)
                  Hfront  440 Hsync  40 Hback  220 Hpol P
                  Vfront    5 Vsync   5 Vback   20 Vpol P
    DTD  6:   720x576    50.000000 Hz   5:4     31.250 kHz     27.000000 MHz (598 mm x 336 mm)
                  Hfront   12 Hsync  64 Hback   68 Hpol N
                  Vfront    5 Vsync   5 Vback   39 Vpol N
Checksum: 0xe5  Unused space in Extension Block: 25 bytes

----------------

Block 2, Unknown EDID Extension Block 0x00:
  00 ff ff ff ff ff ff 00 04 72 98 05 cd 72 20 84 '.........r...r .'
  2a 1c 01 03 80 3c 22 78 2a 0b 75 a6 55 53 9f 28 '*....<"x*.u.US.('
  0e 50 54 b3 0c 00 71 4f 81 80 81 c0 81 00 95 00 '.PT...qO........'
  b3 00 01 01 01 01 68 42 80 6a 70 38 27 40 08 20 '......hB.jp8'@. '
  98 04 56 50 21 00 00 1e 02 3a 80 18 71 38 2d 40 '..VP!....:..q8-@'
  58 2c 45 00 56 50 21 00 00 1e 00 00 00 fd 00 37 'X,E.VP!........7'
  4c 1e 5b 12 00 0a 20 20 20 20 20 20 00 00 00 fc 'L.[...      ....'
  00 41 63 65 72 20 43 42 32 37 31 48 20 42 01 57 '.Acer CB271H B.W'
Checksum: 0x57

----------------

Block 3, CTA-861 Extension Block:
  Revision: 3
  Underscans IT Video Formats by default
  Basic audio support
  Supports YCbCr 4:4:4
  Supports YCbCr 4:2:2
  Native detailed modes: 1
  Video Data Block:
    VIC   1:   640x480    59.940476 Hz   4:3     31.469 kHz     25.175000 MHz
    VIC   2:   720x480    59.940060 Hz   4:3     31.469 kHz     27.000000 MHz
    VIC   3:   720x480    59.940060 Hz  16:9     31.469 kHz     27.000000 MHz
    VIC   4:  1280x720    60.000000 Hz  16:9     45.000 kHz     74.250000 MHz
    VIC   5:  1920x1080i  60.000000 Hz  16:9     33.750 kHz     74.250000 MHz
    VIC  16:  1920x1080   60.000000 Hz  16:9     67.500 kHz    148.500000 MHz (native)
    VIC  17:   720x576    50.000000 Hz   4:3     31.250 kHz     27.000000 MHz
    VIC  18:   720x576    50.000000 Hz  16:9     31.250 kHz     27.000000 MHz
    VIC  19:  1280x720    50.000000 Hz  16:9     37.500 kHz     74.250000 MHz
    VIC  20:  1920x1080i  50.000000 Hz  16:9     28.125 kHz     74.250000 MHz
    VIC  31:  1920x1080   50.000000 Hz  16:9     56.250 kHz    148.500000 MHz
  Audio Data Block:
    Linear PCM:
      Max channels: 2
      Supported sample rates (kHz): 48 44.1 32
      Supported sample sizes (bits): 24 20 16
  Speaker Allocation Data Block:
    FL/FR - Front Left/Right
  Vendor-Specific Data Block (HDMI), OUI 00-0C-03:
    Source physical address: 1.0.0.0
  Detailed Timing Descriptors:
    DTD  7:  1920x1080   50.000000 Hz  16:9     56.250 kHz    148.500000 MHz (598 mm x 336 mm)
                  Hfront  528 Hsync  44 Hback  148 Hpol N
                  Vfront    9 Vsync   6 Vback   30 Vpol N
    DTD  8:  1920x1080   60.000000 Hz  16:9     67.500 kHz    148.500000 MHz (598 mm x 336 mm)
                  Hfront   88 Hsync  44 Hback  148 Hpol N
                  Vfront    9 Vsync   6 Vback   30 Vpol N
    DTD  9:  1280x720    50.000000 Hz  16:9     37.500 kHz     74.250000 MHz (598 mm x 336 mm)
                  Hfront  440 Hsync  40 Hback  220 Hpol P
                  Vfront    5 Vsync   5 Vback   20 Vpol P
    DTD 10:   720x576    50.000000 Hz   5:4     31.250 kHz     27.000000 MHz (598 mm x 336 mm)
                  Hfront   12 Hsync  64 Hback   68 Hpol N
                  Vfront    5 Vsync   5 Vback   39 Vpol N
Checksum: 0xe5  Unused space in Extension Block: 25 bytes

----------------

Warnings:

Block 1, CTA-861 Extension Block:
  Video Data Block: VIC 1 and the first DTD are not identical. Is this intended?
  Video Data Block: All VICs are in ascending order, and the first (preferred) VIC <= 4, is that intended?
  Detailed Timing Descriptor #3: DTD is similar but not identical to VIC 31.
  Detailed Timing Descriptor #4: DTD is similar but not identical to VIC 16.
  Detailed Timing Descriptor #6: Image size is 598x336 mm, but based on the picture AR it should be 598x478 mm.
  Add a Colorimetry Data Block with the sRGB colorimetry bit set to avoid interop issues.
Block 3, CTA-861 Extension Block:
  Video Data Block: All VICs are in ascending order, and the first (preferred) VIC <= 4, is that intended?
  Detailed Timing Descriptor #7: DTD is similar but not identical to VIC 31.
  Detailed Timing Descriptor #8: DTD is similar but not identical to VIC 16.
  Detailed Timing Descriptor #10: Image size is 598x336 mm, but based on the picture AR it should be 598x478 mm.
EDID:
  Base EDID: Some timings are out of range of the Monitor Ranges:
    Vertical Freq: 50.000 - 75.000 Hz (Monitor: 55.000 - 76.000 Hz)
    Horizontal Freq: 28.125 - 83.909 kHz (Monitor: 30.000 - 91.000 kHz)
  CTA-861: Multiple native progressive timings are defined.

Failures:

Block 1, CTA-861 Extension Block:
  Missing VCDB, needed for Set Selectable RGB Quantization to avoid interop issues.
Block 2, Base EDID:
  Unknown Extension Block.
Block 3, CTA-861 Extension Block:
  Video Data Block: Duplicate VIC 1.
  Video Data Block: Duplicate VIC 2.
  Video Data Block: Duplicate VIC 3.
  Video Data Block: Duplicate VIC 4.
  Video Data Block: Duplicate VIC 5.
  Video Data Block: Duplicate VIC 16.
  Video Data Block: Duplicate VIC 17.
  Video Data Block: Duplicate VIC 18.
  Video Data Block: Duplicate VIC 19.
  Video Data Block: Duplicate VIC 20.
  Video Data Block: Duplicate VIC 31.
  Speaker Allocation Data Block: Only one instance of this Data Block is allowed.
EDID:
  Base EDID: EDID specified 1 extension block(s), but found 3 extension block(s).
  Base EDID: EDID 1.3 requires a Block Map Extension in Block 1 if there are more than 2 blocks in the EDID.

EDID conformity: FAIL
