edid-decode (hex):

00 ff ff ff ff ff ff 00 4c 2d 00 00 00 00 00 00
1e 11 01 03 80 0f 09 78 0a 00 00 00 00 00 00 00
00 00 00 00 00 00 01 01 01 01 01 01 01 01 01 01
01 01 01 01 01 01 92 09 20 18 30 e0 0d 10 00 03
01 00 99 5c 00 00 00 1e 00 00 00 fd 00 38 4b 14
28 03 00 0a 20 20 20 20 20 20 00 00 00 10 00 20
16 30 00 05 0a 00 5c 99 00 00 00 1c 00 00 00 10
00 ff ff ff ff ff ff ff ff ff ff 00 00 1c 00 d8

00 ff ff ff ff ff ff 00 4c 2d 00 00 00 00 00 00
1e 11 01 03 80 0f 09 78 0a 00 00 00 00 00 00 00
00 00 00 00 00 00 01 01 01 01 01 01 01 01 01 01
01 01 01 01 01 01 92 09 20 18 30 e0 0d 10 00 03
01 00 99 5c 00 00 00 1e 00 00 00 fd 00 38 4b 14
28 03 00 0a 20 20 20 20 20 20 00 00 00 10 00 20
16 30 00 05 0a 00 5c 99 00 00 00 1c 00 00 00 10
00 ff ff ff ff ff ff ff ff ff ff 00 00 1c 00 d8

----------------

Block 0, Base EDID:
  EDID Structure Version & Revision: 1.3
  Vendor & Product Identification:
    Manufacturer: SAM
    Model: 0
    Made in: week 30 of 2007
  Basic Display Parameters & Features:
    Digital display
    Maximum image size: 15 cm x 9 cm
    Gamma: 2.20
    RGB color display
    First detailed timing is the preferred timing
  Color Characteristics:
    Red  : 0.0000, 0.0000
    Green: 0.0000, 0.0000
    Blue : 0.0000, 0.0000
    White: 0.0000, 0.0000
  Established Timings I & II: none
  Standard Timings: none
  Detailed Timing Descriptors:
    DTD 1:   800x480    60.310365 Hz   5:3     29.733 kHz     24.500000 MHz (153 mm x 92 mm)
                 Hfront    0 Hsync   3 Hback   21 Hpol P
                 Vfront    0 Vsync   1 Vback   12 Vpol P
                   92 09 20 18 30 e0 0d 10 00 03 01 00 99 5c 00 00 00 1e '.. .0........\....'
    Display Range Limits:
      Monitor ranges (GTF): 56-75 Hz V, 20-40 kHz H, max dotclock 30 MHz
    Dummy Descriptor:
    Dummy Descriptor:
Checksum: 0xd8

----------------

Warnings:

Block 0, Base EDID:
  Basic Display Parameters & Features: Dubious maximum image size (15x9 is smaller than 10x10 cm).
  Detailed Timing Descriptor #1: Dubious image size (153x92 mm is smaller than 100x100 mm).

Failures:

Block 0, Base EDID:
  Detailed Timing Descriptor #1: 0 values in the video timing:
    Horizontal Active/Blanking 800/24
    Horizontal Frontporch/Sync Width 0/3
    Vertical Active/Blanking 480/13
    Vertical Frontporch/Sync Width 0/1
  Detailed Timing Descriptor #1: 0 or negative horizontal front porch.
  Dummy Descriptor: Dummy block filled with garbage.
  Dummy Descriptor: Dummy block filled with garbage.
  Missing Display Product Name.
EDID:
  Extension Block 1 started with EDID header, ignoring Extension Blocks >= 1.

EDID conformity: FAIL
