edid-decode (hex):

00 ff ff ff ff ff ff 00 22 64 16 00 01 01 01 01
01 14 01 03 1f 30 1b 78 ea af 75 a4 55 4d 9b 25
12 50 54 af ce 00 81 c0 81 80 01 01 01 01 01 01
01 01 01 01 01 01 1b 21 50 a0 51 00 1e 30 48 88
35 00 dd 0c 11 00 00 1c 0e 1f 00 80 51 00 1e 30
40 80 37 00 dd 0c 11 00 00 1c 00 00 00 fc 00 48
53 47 31 31 31 33 0a 20 20 20 20 20 00 00 00 fd
00 38 4c 1f 41 0b 00 0a 20 20 20 20 20 20 00 93

00 ff ff ff ff ff ff 00 22 64 16 00 01 01 01 01
01 14 01 03 1f 30 1b 78 ea af 75 a4 55 4d 9b 25
12 50 54 af ce 00 81 c0 81 80 01 01 01 01 01 01
01 01 01 01 01 01 1b 21 50 a0 51 00 1e 30 48 88
35 00 dd 0c 11 00 00 1c 0e 1f 00 80 51 00 1e 30
40 80 37 00 dd 0c 11 00 00 1c 00 00 00 fc 00 48
53 47 31 31 31 33 0a 20 20 20 20 20 00 00 00 fd
00 38 4c 1f 41 0b 00 0a 20 20 20 20 20 20 00 93

----------------

Block 0, Base EDID:
  EDID Structure Version & Revision: 1.3
  Vendor & Product Identification:
    Manufacturer: HSD
    Model: 22
    Serial Number: ...
    Made in: week 1 of 2010
  Basic Display Parameters & Features:
    Analog display
    Signal Level Standard: 0.700 : 0.300 : 1.000 V p-p
    Blank-to-black setup/pedestal
    Sync: Separate Composite SyncOnGreen Serration
    Maximum image size: 48 cm x 27 cm
    Gamma: 2.20
    DPMS levels: Standby Suspend Off
    RGB color display
    First detailed timing is the preferred timing
  Color Characteristics:
    Red  : 0.6425, 0.3339
    Green: 0.3037, 0.6083
    Blue : 0.1455, 0.0732
    White: 0.3134, 0.3291
  Established Timings I & II:
    IBM     :   720x400    70.081663 Hz   9:5     31.467 kHz     28.320000 MHz
    DMT 0x04:   640x480    59.940476 Hz   4:3     31.469 kHz     25.175000 MHz
    DMT 0x05:   640x480    72.808802 Hz   4:3     37.861 kHz     31.500000 MHz
    DMT 0x06:   640x480    75.000000 Hz   4:3     37.500 kHz     31.500000 MHz
    DMT 0x08:   800x600    56.250000 Hz   4:3     35.156 kHz     36.000000 MHz
    DMT 0x09:   800x600    60.316541 Hz   4:3     37.879 kHz     40.000000 MHz
    DMT 0x0a:   800x600    72.187572 Hz   4:3     48.077 kHz     50.000000 MHz
    DMT 0x0b:   800x600    75.000000 Hz   4:3     46.875 kHz     49.500000 MHz
    DMT 0x10:  1024x768    60.003840 Hz   4:3     48.363 kHz     65.000000 MHz
    DMT 0x11:  1024x768    70.069359 Hz   4:3     56.476 kHz     75.000000 MHz
    DMT 0x12:  1024x768    75.028582 Hz   4:3     60.023 kHz     78.750000 MHz
  Standard Timings:
    DMT 0x55:  1280x720    60.000000 Hz  16:9     45.000 kHz     74.250000 MHz
    DMT 0x23:  1280x1024   60.019740 Hz   5:4     63.981 kHz    108.000000 MHz
  Detailed Timing Descriptors:
    DTD 1:  1360x768    59.798991 Hz  85:48    47.720 kHz     84.750000 MHz (477 mm x 268 mm)
                 Hfront   72 Hsync 136 Hback  208 Hpol N
                 Vfront    3 Vsync   5 Vback   22 Vpol P
    DTD 2:  1280x768    59.870228 Hz   5:3     47.776 kHz     79.500000 MHz (477 mm x 268 mm)
                 Hfront   64 Hsync 128 Hback  192 Hpol N
                 Vfront    3 Vsync   7 Vback   20 Vpol P
    Display Product Name: 'HSG1113'
    Display Range Limits:
      Monitor ranges (GTF): 56-76 Hz V, 31-65 kHz H, max dotclock 110 MHz
Checksum: 0x93

----------------

Block 1, Unknown EDID Extension Block 0x00:
  00 ff ff ff ff ff ff 00 22 64 16 00 01 01 01 01 '........"d......'
  01 14 01 03 1f 30 1b 78 ea af 75 a4 55 4d 9b 25 '.....0.x..u.UM.%'
  12 50 54 af ce 00 81 c0 81 80 01 01 01 01 01 01 '.PT.............'
  01 01 01 01 01 01 1b 21 50 a0 51 00 1e 30 48 88 '.......!P.Q..0H.'
  35 00 dd 0c 11 00 00 1c 0e 1f 00 80 51 00 1e 30 '5...........Q..0'
  40 80 37 00 dd 0c 11 00 00 1c 00 00 00 fc 00 48 '@.7............H'
  53 47 31 31 31 33 0a 20 20 20 20 20 00 00 00 fd 'SG1113.     ....'
  00 38 4c 1f 41 0b 00 0a 20 20 20 20 20 20 00 93 '.8L.A...      ..'
Checksum: 0x93

----------------

Warnings:

Block 0, Base EDID:
  Vendor & Product Identification: The serial number is one of the known dummy values, it should probably be set to 0.
  Detailed Timing Descriptor #2: Image size is 477x268 mm, but based on the picture AR it should be 477x286 mm.

Failures:

Block 1, Base EDID:
  Unknown Extension Block.
EDID:
  Base EDID: EDID specified 0 extension block(s), but found 1 extension block(s).

EDID conformity: FAIL
