edid-decode (hex):

00 ff ff ff ff ff ff 00 09 e5 dc 0c 00 00 00 00
01 22 01 04 b5 23 16 78 03 ed b0 af 4f 42 b4 25
0c 51 55 00 00 00 01 01 01 01 01 01 01 01 01 01
01 01 01 01 01 01 c0 72 00 a0 a0 40 c8 60 30 20
66 00 59 d7 10 00 00 1a 00 00 00 fd 0c 30 f0 b1
b1 76 01 0a 20 20 20 20 20 20 00 00 00 fe 00 3d
4d 33 30 20 20 20 20 20 20 20 20 ff 00 00 00 fc
00 4e 45 31 36 30 51 44 4d 2d 4e 4d 38 0a 02 73

02 03 0f 00 e3 05 80 80 e6 06 05 01 95 73 10 00
00 00 00 00 00 00 00 00 00 00 00 00 00 00 00 00
00 00 00 00 00 00 00 00 00 00 00 00 00 00 00 00
00 00 00 00 00 00 00 00 00 00 00 00 00 00 00 00
00 00 00 00 00 00 00 00 00 00 00 00 00 00 00 00
00 00 00 00 00 00 00 00 00 00 00 00 00 00 00 00
00 00 00 00 00 00 00 00 00 00 00 00 00 00 00 00
00 00 00 00 00 00 00 00 00 00 00 00 00 00 00 fa

70 20 79 02 00 21 00 1d 7a 0d 66 08 00 0a 40 06
80 fd 9a 4f 2d 34 b4 56 c2 0c 0e f5 54 b0 60 ec
64 66 2a 13 78 22 00 14 ff ed 11 85 ff 09 9f 00
2f 00 1f 00 3f 06 c7 00 05 00 05 00 2b 00 0c 27
00 30 ef 00 00 27 00 30 3b 00 00 2e 00 06 00 55
b0 60 ec 64 81 00 15 74 1a 00 00 03 7b 30 f0 00
60 95 10 73 10 f0 00 00 00 00 8d 00 00 00 00 00
00 00 00 00 00 00 00 00 00 00 00 00 00 00 ef 90

00 ff ff ff ff ff ff 00 09 e5 dc 0c 00 00 00 00
01 22 01 04 b5 23 16 78 03 ed b0 af 4f 42 b4 25
0c 51 55 00 00 00 01 01 01 01 01 01 01 01 01 01
01 01 01 01 01 01 c0 72 00 a0 a0 40 c8 60 30 20
66 00 59 d7 10 00 00 1a 00 00 00 fd 0c 30 f0 b1
b1 76 01 0a 20 20 20 20 20 20 00 00 00 fe 00 3d
4d 33 30 20 20 20 20 20 20 20 20 ff 00 00 00 fc
00 4e 45 31 36 30 51 44 4d 2d 4e 4d 38 0a 02 73

02 03 0f 00 e3 05 80 80 e6 06 05 01 95 73 10 00
00 00 00 00 00 00 00 00 00 00 00 00 00 00 00 00
00 00 00 00 00 00 00 00 00 00 00 00 00 00 00 00
00 00 00 00 00 00 00 00 00 00 00 00 00 00 00 00
00 00 00 00 00 00 00 00 00 00 00 00 00 00 00 00
00 00 00 00 00 00 00 00 00 00 00 00 00 00 00 00
00 00 00 00 00 00 00 00 00 00 00 00 00 00 00 00
00 00 00 00 00 00 00 00 00 00 00 00 00 00 00 fa

70 20 79 02 00 21 00 1d 7a 0d 66 08 00 0a 40 06
80 fd 9a 4f 2d 34 b4 56 c2 0c 0e f5 54 b0 60 ec
64 66 2a 13 78 22 00 14 ff ed 11 85 ff 09 9f 00
2f 00 1f 00 3f 06 c7 00 05 00 05 00 2b 00 0c 27
00 30 ef 00 00 27 00 30 3b 00 00 2e 00 06 00 55
b0 60 ec 64 81 00 15 74 1a 00 00 03 7b 30 f0 00
60 95 10 73 10 f0 00 00 00 00 8d 00 00 00 00 00
00 00 00 00 00 00 00 00 00 00 00 00 00 00 ef 90

----------------

Block 0, Base EDID:
  EDID Structure Version & Revision: 1.4
  Vendor & Product Identification:
    Manufacturer: BOE
    Model: 3292
    Made in: week 1 of 2024
  Basic Display Parameters & Features:
    Digital display
    Bits per primary color channel: 10
    DisplayPort interface
    Maximum image size: 35 cm x 22 cm
    Gamma: 2.20
    Supported color formats: RGB 4:4:4
    First detailed timing includes the native pixel format and preferred refresh rate
    Display supports continuous frequencies
  Color Characteristics:
    Red  : 0.6865, 0.3105
    Green: 0.2607, 0.7041
    Blue : 0.1464, 0.0498
    White: 0.3164, 0.3320
  Established Timings I & II: none
  Standard Timings: none
  Detailed Timing Descriptors:
    DTD 1:  2560x1600   60.000000 Hz  16:10   108.000 kHz    293.760000 MHz (345 mm x 215 mm)
                 Hfront   48 Hsync  32 Hback   80 Hpol P
                 Vfront    6 Vsync   6 Vback  188 Vpol N
    Display Range Limits:
      Monitor ranges (Range Limits Only): 48-240 Hz V, 432-432 kHz H, max dotclock 1180 MHz
    Alphanumeric Data String: '=M30        '
    Display Product Name: 'NE160QDM-NM8'
  Extension blocks: 2
Checksum: 0x73

----------------

Block 1, CTA-861 Extension Block:
  Revision: 3
  Native DTDs: 0
  Colorimetry Data Block:
    BT2020RGB
    ST2113RGB
  HDR Static Metadata Data Block:
    Electro optical transfer functions:
      Traditional gamma - SDR luminance range
      SMPTE ST2084
    Supported static metadata descriptors:
      Static metadata type 1
    Desired content max luminance: 149 (1260.785 cd/m^2)
    Desired content max frame-average luminance: 115 (603.666 cd/m^2)
    Desired content min luminance: 16 (0.050 cd/m^2)
Checksum: 0xfa  Unused space in Extension Block: 112 bytes

----------------

Block 2, DisplayID Extension Block:
  Version: 2.0
  Extension Count: 0
  Display Product Primary Use Case: None of the listed primary use cases; generic display
  Display Parameters Data Block (0x21):
    Image size: 345.0 mm x 215.0 mm
    Display native pixel format: 2560x1600
    Scan Orientation: Left to Right, Top to Bottom
    Luminance Information: Minimum guaranteed value
    Color Information: CIE 1931
    Audio Speaker Information: not integrated
    Native Color Chromaticity:
      Primary #1:  (0.686768, 0.310791)
      Primary #2:  (0.260986, 0.703857)
      Primary #3:  (0.145996, 0.049805)
      White Point: (0.315918, 0.331787)
    Native Maximum Luminance (Full Coverage): 600.000000 cd/m^2
    Native Maximum Luminance (10% Rectangular Coverage): 1260.000000 cd/m^2
    Native Minimum Luminance: 0.049988 cd/m^2
    Native Color Depth: 10 bpc
    Display Device Technology: Active Matrix LCD
    Native Gamma EOTF: 2.20
  Video Timing Modes Type 7 - Detailed Timings Data Block:
    DTD:  2560x1600  240.000000 Hz  16:10   432.000 kHz   1175.040000 MHz (aspect 16:10, no 3D stereo, preferred)
               Hfront   48 Hsync  32 Hback   80 Hpol N
               Vfront    6 Vsync   6 Vback  188 Vpol N
  Adaptive Sync Data Block:
    Descriptor #1:
      Native Panel Range
      Fixed Average V-Total and Adaptive V-Total
      Supports Seamless Transition
      'Max Single Frame Duration Increase' field value without jitter impact
      'Max Single Frame Duration Decrease' field value without jitter impact
      Max Duration Increase: 0.00 ms
      Max Duration Decrease: 0.00 ms
      Min Refresh Rate: 48 Hz
      Max Refresh Rate: 240 Hz
    Descriptor #2:
      Native Panel Range
      Fixed Average V-Total and Adaptive V-Total
      Supports Seamless Transition
      'Max Single Frame Duration Increase' field value without jitter impact
      'Max Single Frame Duration Decrease' field value without jitter impact
      Max Duration Increase: 0.00 ms
      Max Duration Decrease: 0.00 ms
      Min Refresh Rate: 48 Hz
      Max Refresh Rate: 60 Hz
  Brightness Luminance Range Data Block:
    Minimum SDR Luminance (Full Coverage): 80.000000 cd/m^2
    Maximum Suggested SDR Luminance (Full Coverage): 600.000000 cd/m^2
    Maximum Boost SDR Luminance: 1260.000000 cd/m^2
  CTA-861 DisplayID Data Block:
  Vendor-Specific Data Block (AMD), OUI 00-00-1A:
    Version: 3
    Feature Caps: 0x7b
      Local Dimming Supported
      FreeSync Panel Replay Supported
    Minimum Refresh Rate: 48 Hz
    Maximum Refresh Rate: 240 Hz
    Flags 1.x: 0x00
    Flags 2.x: 0x60
      ST 2084 (PQ) EOTF Supported
      Linear EOTF (Windows scRGB, 0.0 - 125.0) Supported
      BT.2020 Gamut Supported
    Maximum luminance: 149 (1260.785 cd/m^2)
    Minimum luminance: 16 (0.050 cd/m^2)
    Maximum luminance (without local dimming): 115 (603.666 cd/m^2)
    Minimum luminance (without local dimming): 16 (0.024 cd/m^2)
  Checksum: 0xef
Checksum: 0x90

----------------

Warnings:

Block 1, CTA-861 Extension Block:
  IT Video Formats are overscanned by default, but normally this should be underscanned.
  Colorimetry Data Block: Set the sRGB colorimetry bit to avoid interop issues.
EDID:
  Base EDID: Some timings are out of range of the Monitor Ranges:
    Horizontal Freq: 108.000 - 432.000 kHz (Monitor: 432.000 - 432.000 kHz)

Failures:

Block 0, Base EDID:
  Alphanumeric Data String: 0xff byte at position 12.
Block 1, CTA-861 Extension Block:
  Required 640x480p60 timings are missing in the established timings and the SVD list (VIC 1).
  Missing VCDB, needed for Set Selectable RGB Quantization to avoid interop issues.
EDID:
  Extension Block 3 started with EDID header, ignoring Extension Blocks >= 3.

EDID conformity: FAIL
