edid-decode (hex):

00 ff ff ff ff ff ff 00 1c 54 0d 27 01 01 01 01
14 1e 01 04 b5 3c 22 78 fb cb 85 a7 53 35 b6 25
0d 50 54 00 00 00 01 01 01 01 01 01 01 01 01 01
01 01 01 01 01 01 ff ff 00 68 a0 a0 28 50 18 20
a8 04 80 68 21 00 00 1a 00 00 00 fd 0c 20 af 2d
2d 78 01 0a 20 20 20 20 20 20 00 00 00 fc 00 4d
32 37 51 0a 20 20 20 20 20 20 20 20 00 00 00 ff
00 32 30 31 32 30 42 30 30 30 30 30 31 0a 02 7c

02 03 2f 40 49 02 03 11 12 04 2f 90 3f 05 23 09
17 07 83 01 00 00 6d 1a 00 00 02 01 20 b0 00 00
00 00 00 00 e3 05 e3 01 e6 06 05 01 64 64 1e 4e
99 80 c8 70 38 4d 40 44 20 f8 0c e0 0e 11 00 00
1e c7 cc 80 68 70 a0 28 50 18 20 a8 04 e0 68 11
00 00 1a 00 00 00 00 00 00 00 00 00 00 00 00 00
00 00 00 00 00 00 00 00 00 00 00 00 00 00 00 00
00 00 00 00 00 00 00 00 00 00 00 00 00 00 00 05

70 12 79 00 00 03 01 14 6c 0e 01 80 ff 09 67 00
17 80 1f 00 9f 05 2c 00 19 80 07 00 00 00 00 00
00 00 00 00 00 00 00 00 00 00 00 00 00 00 00 00
00 00 00 00 00 00 00 00 00 00 00 00 00 00 00 00
00 00 00 00 00 00 00 00 00 00 00 00 00 00 00 00
00 00 00 00 00 00 00 00 00 00 00 00 00 00 00 00
00 00 00 00 00 00 00 00 00 00 00 00 00 00 00 00
00 00 00 00 00 00 00 00 00 00 00 00 00 00 cd 90

00 ff ff ff ff ff ff 00 1c 54 0d 27 01 01 01 01
14 1e 01 04 b5 3c 22 78 fb cb 85 a7 53 35 b6 25
0d 50 54 00 00 00 01 01 01 01 01 01 01 01 01 01
01 01 01 01 01 01 ff ff 00 68 a0 a0 28 50 18 20
a8 04 80 68 21 00 00 1a 00 00 00 fd 0c 20 af 2d
2d 78 01 0a 20 20 20 20 20 20 00 00 00 fc 00 4d
32 37 51 0a 20 20 20 20 20 20 20 20 00 00 00 ff
00 32 30 31 32 30 42 30 30 30 30 30 31 0a 02 7c

02 03 2f 40 49 02 03 11 12 04 2f 90 3f 05 23 09
17 07 83 01 00 00 6d 1a 00 00 02 01 20 b0 00 00
00 00 00 00 e3 05 e3 01 e6 06 05 01 64 64 1e 4e
99 80 c8 70 38 4d 40 44 20 f8 0c e0 0e 11 00 00
1e c7 cc 80 68 70 a0 28 50 18 20 a8 04 e0 68 11
00 00 1a 00 00 00 00 00 00 00 00 00 00 00 00 00
00 00 00 00 00 00 00 00 00 00 00 00 00 00 00 00
00 00 00 00 00 00 00 00 00 00 00 00 00 00 00 05

70 12 79 00 00 03 01 14 6c 0e 01 80 ff 09 67 00
17 80 1f 00 9f 05 2c 00 19 80 07 00 00 00 00 00
00 00 00 00 00 00 00 00 00 00 00 00 00 00 00 00
00 00 00 00 00 00 00 00 00 00 00 00 00 00 00 00
00 00 00 00 00 00 00 00 00 00 00 00 00 00 00 00
00 00 00 00 00 00 00 00 00 00 00 00 00 00 00 00
00 00 00 00 00 00 00 00 00 00 00 00 00 00 00 00
00 00 00 00 00 00 00 00 00 00 00 00 00 00 cd 90

----------------

Block 0, Base EDID:
  EDID Structure Version & Revision: 1.4
  Vendor & Product Identification:
    Manufacturer: GBT
    Model: 9997
    Serial Number: ...
    Made in: week 20 of 2020
  Basic Display Parameters & Features:
    Digital display
    Bits per primary color channel: 10
    DisplayPort interface
    Maximum image size: 60 cm x 34 cm
    Gamma: 2.20
    DPMS levels: Standby Suspend Off
    Supported color formats: RGB 4:4:4, YCrCb 4:4:4, YCrCb 4:2:2
    First detailed timing includes the native pixel format and preferred refresh rate
    Display supports continuous frequencies
  Color Characteristics:
    Red  : 0.6552, 0.3242
    Green: 0.2089, 0.7138
    Blue : 0.1464, 0.0507
    White: 0.3134, 0.3291
  Established Timings I & II: none
  Standard Timings: none
  Detailed Timing Descriptors:
    DTD 1:  2560x1440  166.217738 Hz  16:9    246.002 kHz    655.350000 MHz (640 mm x 360 mm)
                 Hfront   24 Hsync  32 Hback   48 Hpol P
                 Vfront   26 Vsync   8 Vback    6 Vpol N
    Display Range Limits:
      Monitor ranges (Range Limits Only): 32-175 Hz V, 300-300 kHz H, max dotclock 1200 MHz
    Display Product Name: 'M27Q'
    Display Product Serial Number: ...
  Extension blocks: 2
Checksum: 0x7c

----------------

Block 1, CTA-861 Extension Block:
  Revision: 3
  Basic audio support
  Native DTDs: 0
  Video Data Block:
    VIC   2:   720x480    59.940060 Hz   4:3     31.469 kHz     27.000000 MHz
    VIC   3:   720x480    59.940060 Hz  16:9     31.469 kHz     27.000000 MHz
    VIC  17:   720x576    50.000000 Hz   4:3     31.250 kHz     27.000000 MHz
    VIC  18:   720x576    50.000000 Hz  16:9     31.250 kHz     27.000000 MHz
    VIC   4:  1280x720    60.000000 Hz  16:9     45.000 kHz     74.250000 MHz
    VIC  47:  1280x720   120.000000 Hz  16:9     90.000 kHz    148.500000 MHz
    VIC  16:  1920x1080   60.000000 Hz  16:9     67.500 kHz    148.500000 MHz (native)
    VIC  63:  1920x1080  120.000000 Hz  16:9    135.000 kHz    297.000000 MHz
    VIC   5:  1920x1080i  60.000000 Hz  16:9     33.750 kHz     74.250000 MHz
  Audio Data Block:
    Linear PCM:
      Max channels: 2
      Supported sample rates (kHz): 96 48 44.1 32
      Supported sample sizes (bits): 24 20 16
  Speaker Allocation Data Block:
    FL/FR - Front Left/Right
  Vendor-Specific Data Block (AMD), OUI 00-00-1A:
    Version: 2
    Flags 1: 0x01
      FreeSync Supported
    Minimum Refresh Rate: 32 Hz
    Maximum Refresh Rate: 176 Hz
    Flags 5: 0x00
  Colorimetry Data Block:
    xvYCC601
    xvYCC709
    BT2020cYCC
    BT2020YCC
    BT2020RGB
    Gamut Boundary Description Metadata Profile P0
  HDR Static Metadata Data Block:
    Electro optical transfer functions:
      Traditional gamma - SDR luminance range
      SMPTE ST2084
    Supported static metadata descriptors:
      Static metadata type 1
    Desired content max luminance: 100 (436.203 cd/m^2)
    Desired content max frame-average luminance: 100 (436.203 cd/m^2)
    Desired content min luminance: 30 (0.060 cd/m^2)
  Detailed Timing Descriptors:
    DTD 2:  1920x1080  160.002283 Hz  16:9    185.123 kHz    392.460000 MHz (480 mm x 270 mm)
                 Hfront   68 Hsync  32 Hback  100 Hpol P
                 Vfront   63 Vsync   8 Vback    6 Vpol P
    DTD 3:  1920x1440  175.004674 Hz   4:3    259.007 kHz    524.230000 MHz (480 mm x 360 mm)
                 Hfront   24 Hsync  32 Hback   48 Hpol P
                 Vfront   26 Vsync   8 Vback    6 Vpol N
Checksum: 0x05  Unused space in Extension Block: 44 bytes

----------------

Block 2, DisplayID Extension Block:
  Version: 1.2
  Extension Count: 0
  Display Product Type: Extension Section
  Video Timing Modes Type 1 - Detailed Timings Data Block:
    DTD:  2560x1440  174.995703 Hz   1:1    259.869 kHz    692.290000 MHz (aspect 1:1, no 3D stereo, preferred)
               Hfront   24 Hsync  32 Hback   48 Hpol P
               Vfront   26 Vsync   8 Vback   11 Vpol P
  Checksum: 0xcd
Checksum: 0x90

----------------

Warnings:

Block 0, Base EDID:
  Vendor & Product Identification: The serial number is one of the known dummy values, it should probably be set to 0.
Block 1, CTA-861 Extension Block:
  IT Video Formats are overscanned by default, but normally this should be underscanned.
  Video Data Block: VIC 2 and the first DTD are not identical. Is this intended?
  Colorimetry Data Block: Set the sRGB colorimetry bit to avoid interop issues.
  Display Product Serial Number is set, so the Serial Number in the Base EDID should be 0.
EDID:
  Base EDID: Some timings are out of range of the Monitor Ranges:
    Horizontal Freq: 31.250 - 259.868 kHz (Monitor: 300.000 - 300.000 kHz)
  CTA-861: Native progressive resolution of 1920x1080 is smaller than the max preferred progressive resolution 2560x1440.

Failures:

Block 0, Base EDID:
  Detailed Timing Descriptor #1: Mismatch of image size 640x360 mm vs display size 600x340 mm.
Block 1, CTA-861 Extension Block:
  Detailed Timing Descriptor #2: Mismatch of image size 480x270 mm vs display size 600x340 mm.
  Detailed Timing Descriptor #3: Mismatch of image size 480x360 mm vs display size 600x340 mm.
  Required 640x480p60 timings are missing in the established timings and the SVD list (VIC 1).
  Missing VCDB, needed for Set Selectable RGB Quantization to avoid interop issues.
Block 2, DisplayID Extension Block:
  DisplayID Base Block has no product type.
EDID:
  Extension Block 3 started with EDID header, ignoring Extension Blocks >= 3.
  Base EDID: The DTD max image size is 640x360mm, which is larger than the display size 600.0x340.0mm.

EDID conformity: FAIL
