edid-decode (hex):

00 ff ff ff ff ff ff 00 1c 54 0d 27 01 01 01 01
15 1f 01 04 b5 46 27 78 fb cb 85 a7 53 35 b6 25
0d 50 54 2f cf 00 d1 c0 01 01 01 01 01 01 81 80
95 00 b3 00 01 01 f6 5b 00 6e a0 a0 1f 50 17 20
18 04 54 4f 21 00 00 1e 00 00 00 fd 00 30 a5 f3
f3 3c 01 0a 20 20 20 20 20 20 00 00 00 fc 00 4d
32 37 51 0a 20 20 20 20 20 20 20 20 00 00 00 ff
00 32 31 32 31 30 42 30 30 35 32 30 33 0a 02 c9

02 03 3f 71 49 02 03 11 12 04 2f 90 3f 05 23 09
17 07 83 01 00 00 67 03 0c 00 10 00 38 3c 67 d8
5d c4 01 78 80 03 6d 1a 00 00 02 01 30 aa 00 00
00 00 00 00 e3 05 e3 01 e6 06 05 01 64 64 1e 00
fa 00 50 a0 a0 1f 50 0a 3c 35 00 54 4f 21 00 00
1e f5 bd 00 64 a0 a0 55 50 12 20 f8 0c 54 4f 21
00 00 1e d5 89 80 c8 70 38 4d 40 44 20 f8 0c 54
4f 21 00 00 1e 00 00 00 00 00 00 00 00 00 00 19

70 12 2e 00 00 03 01 14 0e 0b 01 00 ff 09 9f 00
2f 80 1f 00 9f 05 27 00 19 00 07 00 03 01 14 5f
e8 00 00 ff 09 77 00 1b 00 1f 00 9f 05 66 00 08
00 07 00 fd 00 00 00 00 00 00 00 00 00 00 00 00
00 00 00 00 00 00 00 00 00 00 00 00 00 00 00 00
00 00 00 00 00 00 00 00 00 00 00 00 00 00 00 00
00 00 00 00 00 00 00 00 00 00 00 00 00 00 00 00
00 00 00 00 00 00 00 00 00 00 00 00 00 00 00 90

00 ff ff ff ff ff ff 00 1c 54 0d 27 01 01 01 01
15 1f 01 04 b5 46 27 78 fb cb 85 a7 53 35 b6 25
0d 50 54 2f cf 00 d1 c0 01 01 01 01 01 01 81 80
95 00 b3 00 01 01 f6 5b 00 6e a0 a0 1f 50 17 20
18 04 54 4f 21 00 00 1e 00 00 00 fd 00 30 a5 f3
f3 3c 01 0a 20 20 20 20 20 20 00 00 00 fc 00 4d
32 37 51 0a 20 20 20 20 20 20 20 20 00 00 00 ff
00 32 31 32 31 30 42 30 30 35 32 30 33 0a 02 c9

02 03 3f 71 49 02 03 11 12 04 2f 90 3f 05 23 09
17 07 83 01 00 00 67 03 0c 00 10 00 38 3c 67 d8
5d c4 01 78 80 03 6d 1a 00 00 02 01 30 aa 00 00
00 00 00 00 e3 05 e3 01 e6 06 05 01 64 64 1e 00
fa 00 50 a0 a0 1f 50 0a 3c 35 00 54 4f 21 00 00
1e f5 bd 00 64 a0 a0 55 50 12 20 f8 0c 54 4f 21
00 00 1e d5 89 80 c8 70 38 4d 40 44 20 f8 0c 54
4f 21 00 00 1e 00 00 00 00 00 00 00 00 00 00 19

70 12 2e 00 00 03 01 14 0e 0b 01 00 ff 09 9f 00
2f 80 1f 00 9f 05 27 00 19 00 07 00 03 01 14 5f
e8 00 00 ff 09 77 00 1b 00 1f 00 9f 05 66 00 08
00 07 00 fd 00 00 00 00 00 00 00 00 00 00 00 00
00 00 00 00 00 00 00 00 00 00 00 00 00 00 00 00
00 00 00 00 00 00 00 00 00 00 00 00 00 00 00 00
00 00 00 00 00 00 00 00 00 00 00 00 00 00 00 00
00 00 00 00 00 00 00 00 00 00 00 00 00 00 00 90

----------------

Block 0, Base EDID:
  EDID Structure Version & Revision: 1.4
  Vendor & Product Identification:
    Manufacturer: GBT
    Model: 9997
    Serial Number: ...
    Made in: week 21 of 2021
  Basic Display Parameters & Features:
    Digital display
    Bits per primary color channel: 10
    DisplayPort interface
    Maximum image size: 70 cm x 39 cm
    Gamma: 2.20
    DPMS levels: Standby Suspend Off
    Supported color formats: RGB 4:4:4, YCrCb 4:4:4, YCrCb 4:2:2
    First detailed timing includes the native pixel format and preferred refresh rate
    Display supports continuous frequencies
  Color Characteristics:
    Red  : 0.6552, 0.3242
    Green: 0.2089, 0.7138
    Blue : 0.1464, 0.0507
    White: 0.3134, 0.3291
  Established Timings I & II:
    DMT 0x04:   640x480    59.940476 Hz   4:3     31.469 kHz     25.175000 MHz
    DMT 0x05:   640x480    72.808802 Hz   4:3     37.861 kHz     31.500000 MHz
    DMT 0x06:   640x480    75.000000 Hz   4:3     37.500 kHz     31.500000 MHz
    DMT 0x08:   800x600    56.250000 Hz   4:3     35.156 kHz     36.000000 MHz
    DMT 0x09:   800x600    60.316541 Hz   4:3     37.879 kHz     40.000000 MHz
    DMT 0x0a:   800x600    72.187572 Hz   4:3     48.077 kHz     50.000000 MHz
    DMT 0x0b:   800x600    75.000000 Hz   4:3     46.875 kHz     49.500000 MHz
    DMT 0x10:  1024x768    60.003840 Hz   4:3     48.363 kHz     65.000000 MHz
    DMT 0x11:  1024x768    70.069359 Hz   4:3     56.476 kHz     75.000000 MHz
    DMT 0x12:  1024x768    75.028582 Hz   4:3     60.023 kHz     78.750000 MHz
    DMT 0x24:  1280x1024   75.024675 Hz   5:4     79.976 kHz    135.000000 MHz
  Standard Timings:
    DMT 0x52:  1920x1080   60.000000 Hz  16:9     67.500 kHz    148.500000 MHz
    DMT 0x23:  1280x1024   60.019740 Hz   5:4     63.981 kHz    108.000000 MHz
    DMT 0x2f:  1440x900    59.887445 Hz  16:10    55.935 kHz    106.500000 MHz
    DMT 0x3a:  1680x1050   59.954250 Hz  16:10    65.290 kHz    146.250000 MHz
  Detailed Timing Descriptors:
    DTD 1:  2560x1440   59.940370 Hz  16:9     88.172 kHz    235.420000 MHz (596 mm x 335 mm)
                 Hfront   23 Hsync  32 Hback   55 Hpol P
                 Vfront   17 Vsync   8 Vback    6 Vpol P
    Display Range Limits:
      Monitor ranges (Range Limits Only): 48-165 Hz V, 243-243 kHz H, max dotclock 600 MHz
    Display Product Name: 'M27Q'
    Display Product Serial Number: ...
  Extension blocks: 2
Checksum: 0xc9

----------------

Block 1, CTA-861 Extension Block:
  Revision: 3
  Basic audio support
  Supports YCbCr 4:4:4
  Supports YCbCr 4:2:2
  Native DTDs: 1
  Video Data Block:
    VIC   2:   720x480    59.940060 Hz   4:3     31.469 kHz     27.000000 MHz
    VIC   3:   720x480    59.940060 Hz  16:9     31.469 kHz     27.000000 MHz
    VIC  17:   720x576    50.000000 Hz   4:3     31.250 kHz     27.000000 MHz
    VIC  18:   720x576    50.000000 Hz  16:9     31.250 kHz     27.000000 MHz
    VIC   4:  1280x720    60.000000 Hz  16:9     45.000 kHz     74.250000 MHz
    VIC  47:  1280x720   120.000000 Hz  16:9     90.000 kHz    148.500000 MHz
    VIC  16:  1920x1080   60.000000 Hz  16:9     67.500 kHz    148.500000 MHz (native)
    VIC  63:  1920x1080  120.000000 Hz  16:9    135.000 kHz    297.000000 MHz
    VIC   5:  1920x1080i  60.000000 Hz  16:9     33.750 kHz     74.250000 MHz
  Audio Data Block:
    Linear PCM:
      Max channels: 2
      Supported sample rates (kHz): 96 48 44.1 32
      Supported sample sizes (bits): 24 20 16
  Speaker Allocation Data Block:
    FL/FR - Front Left/Right
  Vendor-Specific Data Block (HDMI), OUI 00-0C-03:
    Source physical address: 1.0.0.0
    DC_36bit
    DC_30bit
    DC_Y444
    Maximum TMDS clock: 300 MHz
  Vendor-Specific Data Block (HDMI Forum), OUI C4-5D-D8:
    Version: 1
    Maximum TMDS Character Rate: 600 MHz
    SCDC Present
    Supports 12-bits/component Deep Color 4:2:0 Pixel Encoding
    Supports 10-bits/component Deep Color 4:2:0 Pixel Encoding
  Vendor-Specific Data Block (AMD), OUI 00-00-1A:
    Version: 2
    Feature Caps: 0x01
    Minimum Refresh Rate: 48 Hz
    Maximum Refresh Rate: 170 Hz
    Flags 1.x: 0x00
    Flags 2.x: 0x00
  Colorimetry Data Block:
    xvYCC601
    xvYCC709
    BT2020cYCC
    BT2020YCC
    BT2020RGB
    Gamut Boundary Description Metadata Profile P0
  HDR Static Metadata Data Block:
    Electro optical transfer functions:
      Traditional gamma - SDR luminance range
      SMPTE ST2084
    Supported static metadata descriptors:
      Static metadata type 1
    Desired content max luminance: 100 (436.203 cd/m^2)
    Desired content max frame-average luminance: 100 (436.203 cd/m^2)
    Desired content min luminance: 30 (0.060 cd/m^2)
  Detailed Timing Descriptors:
    DTD 2:  2560x1440  164.802340 Hz  16:9    242.424 kHz    640.000000 MHz (596 mm x 335 mm)
                 Hfront   10 Hsync  60 Hback   10 Hpol P
                 Vfront    3 Vsync   5 Vback   23 Vpol P
    DTD 3:  2560x1440  119.879206 Hz  16:9    182.816 kHz    486.290000 MHz (596 mm x 335 mm)
                 Hfront   18 Hsync  32 Hback   50 Hpol P
                 Vfront   63 Vsync   8 Vback   14 Vpol P
    DTD 4:  1920x1080  143.853655 Hz  16:9    166.439 kHz    352.850000 MHz (596 mm x 335 mm)
                 Hfront   68 Hsync  32 Hback  100 Hpol P
                 Vfront   63 Vsync   8 Vback    6 Vpol P
Checksum: 0x19  Unused space in Extension Block: 10 bytes

----------------

Block 2, DisplayID Extension Block:
  Version: 1.2
  Extension Count: 0
  Display Product Type: Extension Section
  Video Timing Modes Type 1 - Detailed Timings Data Block:
    DTD:  2560x1440  169.830584 Hz   1:1    251.349 kHz    683.670000 MHz (aspect 1:1, no 3D stereo)
               Hfront   48 Hsync  32 Hback   80 Hpol P
               Vfront   26 Vsync   8 Vback    6 Vpol N
  Video Timing Modes Type 1 - Detailed Timings Data Block:
    DTD:  2560x1440  143.856221 Hz   1:1    221.970 kHz    594.880000 MHz (aspect 1:1, no 3D stereo)
               Hfront   28 Hsync  32 Hback   60 Hpol N
               Vfront    9 Vsync   8 Vback   86 Vpol N
  Checksum: 0xfd
Checksum: 0x90  Unused space in Extension Block: 75 bytes

----------------

Warnings:

Block 0, Base EDID:
  Vendor & Product Identification: The serial number is one of the known dummy values, it should probably be set to 0.
Block 1, CTA-861 Extension Block:
  IT Video Formats are overscanned by default, but normally this should be underscanned.
  Video Data Block: VIC 2 and the first DTD are not identical. Is this intended?
  Colorimetry Data Block: Set the sRGB colorimetry bit to avoid interop issues.
  Display Product Serial Number is set, so the Serial Number in the Base EDID should be 0.
EDID:
  Base EDID: Some timings are out of range of the Monitor Ranges:
    Vertical Freq: 50.000 - 169.831 Hz (Monitor: 48.000 - 165.000 Hz)
    Horizontal Freq: 31.250 - 251.349 kHz (Monitor: 243.000 - 243.000 kHz)
    Maximum Clock: 683.670 MHz (Monitor: 600.000 MHz)

Failures:

Block 0, Base EDID:
  Detailed Timing Descriptor #1: Mismatch of image size 596x335 mm vs display size 700x390 mm.
Block 1, CTA-861 Extension Block:
  Vendor-Specific Data Block (HDMI), OUI 00-0C-03: The HDMI Specification requires EDID 1.3 instead of 1.4.
  Detailed Timing Descriptor #2: Mismatch of image size 596x335 mm vs display size 700x390 mm.
  Detailed Timing Descriptor #3: Mismatch of image size 596x335 mm vs display size 700x390 mm.
  Detailed Timing Descriptor #4: Mismatch of image size 596x335 mm vs display size 700x390 mm.
  Missing VCDB, needed for Set Selectable RGB Quantization to avoid interop issues.
Block 2, DisplayID Extension Block:
  DisplayID Base Block has no product type.
EDID:
  Extension Block 3 started with EDID header, ignoring Extension Blocks >= 3.
  CTA-861: The maximum HDMI TMDS clock is 600000 kHz, but one or more video timings go up to 683670 kHz.
  CTA-861: Native progressive timings are a mix of several resolutions.
  DisplayID: DisplayID expects at least one preferred timing.

EDID conformity: FAIL
