edid-decode (hex):

00 ff ff ff ff ff ff 00 06 b3 3a 30 00 00 00 00
34 1f 01 03 80 45 1d 78 2f 23 75 b2 4d 45 b0 24
0c 50 54 af cf 00 71 4f 81 8f 81 80 95 00 d1 c0
b3 00 81 00 81 40 ef 48 00 a0 a0 38 40 40 30 20
3a 00 b2 23 21 00 00 1e 00 00 00 fd 00 30 b4 1e
d4 3a 00 0a 20 20 20 20 20 20 00 00 00 ff 00 4d
43 4c 4d 44 57 30 31 32 39 35 35 0a 00 00 00 fc
00 56 47 33 30 56 51 4c 31 41 0a 20 20 20 01 c6

02 03 49 f3 4b 01 04 90 13 1f 3f 03 05 5d 60 61
23 09 07 07 83 01 00 00 68 03 0c 00 10 00 38 3c
00 67 d8 5d c4 01 78 80 07 6d 1a 00 00 02 01 30
b4 ed 00 00 00 00 00 e3 05 e3 01 e3 0f 00 06 e6
06 05 01 5b 5b 0d e2 00 6a dd 91 00 a0 a0 38 40
40 30 20 3a 00 b2 23 21 00 00 1e 06 b1 00 a0 a0
38 4d 40 10 40 35 00 b2 23 21 00 00 1e 4b e1 00
a0 a0 38 62 40 10 40 35 00 b2 23 21 00 00 1e d7

00 ff ff ff ff ff ff 00 06 b3 3a 30 00 00 00 00
34 1f 01 03 80 45 1d 78 2f 23 75 b2 4d 45 b0 24
0c 50 54 af cf 00 71 4f 81 8f 81 80 95 00 d1 c0
b3 00 81 00 81 40 ef 48 00 a0 a0 38 40 40 30 20
3a 00 b2 23 21 00 00 1e 00 00 00 fd 00 30 b4 1e
d4 3a 00 0a 20 20 20 20 20 20 00 00 00 ff 00 4d
43 4c 4d 44 57 30 31 32 39 35 35 0a 00 00 00 fc
00 56 47 33 30 56 51 4c 31 41 0a 20 20 20 01 c6

02 03 49 f3 4b 01 04 90 13 1f 3f 03 05 5d 60 61
23 09 07 07 83 01 00 00 68 03 0c 00 10 00 38 3c
00 67 d8 5d c4 01 78 80 07 6d 1a 00 00 02 01 30
b4 ed 00 00 00 00 00 e3 05 e3 01 e3 0f 00 06 e6
06 05 01 5b 5b 0d e2 00 6a dd 91 00 a0 a0 38 40
40 30 20 3a 00 b2 23 21 00 00 1e 06 b1 00 a0 a0
38 4d 40 10 40 35 00 b2 23 21 00 00 1e 4b e1 00
a0 a0 38 62 40 10 40 35 00 b2 23 21 00 00 1e d7

----------------

Block 0, Base EDID:
  EDID Structure Version & Revision: 1.3
  Vendor & Product Identification:
    Manufacturer: AUS
    Model: 12346
    Made in: week 52 of 2021
  Basic Display Parameters & Features:
    Digital display
    Maximum image size: 69 cm x 29 cm
    Gamma: 2.20
    DPMS levels: Off
    RGB color display
    Default (sRGB) color space is primary color space
    First detailed timing is the preferred timing
    Supports GTF timings within operating range
  Color Characteristics:
    Red  : 0.6953, 0.3027
    Green: 0.2695, 0.6904
    Blue : 0.1416, 0.0498
    White: 0.3134, 0.3291
  Established Timings I & II:
    IBM     :   720x400    70.081663 Hz   9:5     31.467 kHz     28.320000 MHz
    DMT 0x04:   640x480    59.940476 Hz   4:3     31.469 kHz     25.175000 MHz
    DMT 0x05:   640x480    72.808802 Hz   4:3     37.861 kHz     31.500000 MHz
    DMT 0x06:   640x480    75.000000 Hz   4:3     37.500 kHz     31.500000 MHz
    DMT 0x08:   800x600    56.250000 Hz   4:3     35.156 kHz     36.000000 MHz
    DMT 0x09:   800x600    60.316541 Hz   4:3     37.879 kHz     40.000000 MHz
    DMT 0x0a:   800x600    72.187572 Hz   4:3     48.077 kHz     50.000000 MHz
    DMT 0x0b:   800x600    75.000000 Hz   4:3     46.875 kHz     49.500000 MHz
    DMT 0x10:  1024x768    60.003840 Hz   4:3     48.363 kHz     65.000000 MHz
    DMT 0x11:  1024x768    70.069359 Hz   4:3     56.476 kHz     75.000000 MHz
    DMT 0x12:  1024x768    75.028582 Hz   4:3     60.023 kHz     78.750000 MHz
    DMT 0x24:  1280x1024   75.024675 Hz   5:4     79.976 kHz    135.000000 MHz
  Standard Timings:
    DMT 0x15:  1152x864    75.000000 Hz   4:3     67.500 kHz    108.000000 MHz
    DMT 0x24:  1280x1024   75.024675 Hz   5:4     79.976 kHz    135.000000 MHz
    DMT 0x23:  1280x1024   60.019740 Hz   5:4     63.981 kHz    108.000000 MHz
    DMT 0x2f:  1440x900    59.887445 Hz  16:10    55.935 kHz    106.500000 MHz
    DMT 0x52:  1920x1080   60.000000 Hz  16:9     67.500 kHz    148.500000 MHz
    DMT 0x3a:  1680x1050   59.954250 Hz  16:10    65.290 kHz    146.250000 MHz
    DMT 0x1c:  1280x800    59.810326 Hz  16:10    49.702 kHz     83.500000 MHz
    DMT 0x20:  1280x960    60.000000 Hz   4:3     60.000 kHz    108.000000 MHz
  Detailed Timing Descriptors:
    DTD 1:  2560x1080   60.002957 Hz  64:27    68.643 kHz    186.710000 MHz (690 mm x 291 mm)
                 Hfront   48 Hsync  32 Hback   80 Hpol P
                 Vfront    3 Vsync  10 Vback   51 Vpol P
    Display Range Limits:
      Monitor ranges (GTF): 48-180 Hz V, 30-212 kHz H, max dotclock 580 MHz
    Display Product Serial Number: ...
    Display Product Name: 'VG30VQL1A'
  Extension blocks: 1
Checksum: 0xc6

----------------

Block 1, CTA-861 Extension Block:
  Revision: 3
  Underscans IT Video Formats by default
  Basic audio support
  Supports YCbCr 4:4:4
  Supports YCbCr 4:2:2
  Native DTDs: 3
  Video Data Block:
    VIC   1:   640x480    59.940476 Hz   4:3     31.469 kHz     25.175000 MHz
    VIC   4:  1280x720    60.000000 Hz  16:9     45.000 kHz     74.250000 MHz
    VIC  16:  1920x1080   60.000000 Hz  16:9     67.500 kHz    148.500000 MHz (native)
    VIC  19:  1280x720    50.000000 Hz  16:9     37.500 kHz     74.250000 MHz
    VIC  31:  1920x1080   50.000000 Hz  16:9     56.250 kHz    148.500000 MHz
    VIC  63:  1920x1080  120.000000 Hz  16:9    135.000 kHz    297.000000 MHz
    VIC   3:   720x480    59.940060 Hz  16:9     31.469 kHz     27.000000 MHz
    VIC   5:  1920x1080i  60.000000 Hz  16:9     33.750 kHz     74.250000 MHz
    VIC  93:  3840x2160   24.000000 Hz  16:9     54.000 kHz    297.000000 MHz
    VIC  96:  3840x2160   50.000000 Hz  16:9    112.500 kHz    594.000000 MHz
    VIC  97:  3840x2160   60.000000 Hz  16:9    135.000 kHz    594.000000 MHz
  Audio Data Block:
    Linear PCM:
      Max channels: 2
      Supported sample rates (kHz): 48 44.1 32
      Supported sample sizes (bits): 24 20 16
  Speaker Allocation Data Block:
    FL/FR - Front Left/Right
  Vendor-Specific Data Block (HDMI), OUI 00-0C-03:
    Source physical address: 1.0.0.0
    DC_36bit
    DC_30bit
    DC_Y444
    Maximum TMDS clock: 300 MHz
  Vendor-Specific Data Block (HDMI Forum), OUI C4-5D-D8:
    Version: 1
    Maximum TMDS Character Rate: 600 MHz
    SCDC Present
    Supports 16-bits/component Deep Color 4:2:0 Pixel Encoding
    Supports 12-bits/component Deep Color 4:2:0 Pixel Encoding
    Supports 10-bits/component Deep Color 4:2:0 Pixel Encoding
  Vendor-Specific Data Block (AMD), OUI 00-00-1A:
    Version: 2
    Flags 1: 0x01
      FreeSync Supported
    Minimum Refresh Rate: 48 Hz
    Maximum Refresh Rate: 180 Hz
    MCCS VCP Code: 0xed
    Flags 5: 0x00
  Colorimetry Data Block:
    xvYCC601
    xvYCC709
    BT2020cYCC
    BT2020YCC
    BT2020RGB
    Gamut Boundary Description Metadata Profile P0
  YCbCr 4:2:0 Capability Map Data Block:
    VIC  96:  3840x2160   50.000000 Hz  16:9    112.500 kHz    594.000000 MHz
    VIC  97:  3840x2160   60.000000 Hz  16:9    135.000 kHz    594.000000 MHz
  HDR Static Metadata Data Block:
    Electro optical transfer functions:
      Traditional gamma - SDR luminance range
      SMPTE ST2084
    Supported static metadata descriptors:
      Static metadata type 1
    Desired content max luminance: 91 (358.942 cd/m^2)
    Desired content max frame-average luminance: 91 (358.942 cd/m^2)
    Desired content min luminance: 13 (0.009 cd/m^2)
  Video Capability Data Block:
    YCbCr quantization: No Data
    RGB quantization: Selectable (via AVI Q)
    PT scan behavior: Always Underscanned
    IT scan behavior: Always Underscanned
    CE scan behavior: Always Underscanned
  Detailed Timing Descriptors:
    DTD 2:  2560x1080  120.002700 Hz  64:27   137.283 kHz    373.410000 MHz (690 mm x 291 mm)
                 Hfront   48 Hsync  32 Hback   80 Hpol P
                 Vfront    3 Vsync  10 Vback   51 Vpol P
    DTD 3:  2560x1080  144.001983 Hz  64:27   166.610 kHz    453.180000 MHz (690 mm x 291 mm)
                 Hfront   16 Hsync  64 Hback   80 Hpol P
                 Vfront    3 Vsync   5 Vback   69 Vpol P
    DTD 4:  2560x1080  180.000375 Hz  64:27   212.040 kHz    576.750000 MHz (690 mm x 291 mm)
                 Hfront   16 Hsync  64 Hback   80 Hpol P
                 Vfront    3 Vsync   5 Vback   90 Vpol P
Checksum: 0xd7

----------------

Warnings:

Block 1, CTA-861 Extension Block:
  Video Data Block: VIC 1 and the first DTD are not identical. Is this intended?
  Video Capability Data Block: Set Selectable YCbCr Quantization to avoid interop issues.
  Video Capability Data Block: S_PT is equal to S_IT and S_CE, so should be set to 0 instead.
EDID:
  Base EDID: Some timings are out of range of the Monitor Ranges:
    Vertical Freq: 24.000 - 180.000 Hz (Monitor: 48.000 - 180.000 Hz)
    Maximum Clock: 594.000 MHz (Monitor: 580.000 MHz)

Failures:

Block 0, Base EDID:
  Basic Display Parameters & Features: sRGB is signaled, but the chromaticities do not match.
EDID:
  Extension Block 2 started with EDID header, ignoring Extension Blocks >= 2.
  CTA-861: Native progressive timings are a mix of several resolutions.

EDID conformity: FAIL
