edid-decode (hex):

00 ff ff ff ff ff ff 00 06 b3 3a 30 00 00 00 00
0a 20 01 04 b5 45 1d 78 3b 23 75 b2 4d 45 b0 24
0c 50 54 af cf 00 71 4f 81 c0 81 80 95 00 d1 c0
b3 00 81 00 81 40 cd 46 00 a0 a0 38 1f 40 30 20
3a 00 b2 23 21 00 00 1e 00 00 00 fd 00 30 c8 e1
e1 40 01 0a 20 20 20 20 20 20 00 00 00 ff 00 4e
33 4c 4d 44 57 30 30 30 31 36 38 0a 00 00 00 fc
00 56 47 33 30 56 51 4c 31 41 0a 20 20 20 01 ec

02 03 35 f1 4c 01 02 03 04 90 12 13 1f 3f 5b 5c
05 23 09 07 07 83 01 00 00 6d 1a 00 00 02 01 30
c8 00 00 00 00 00 00 e3 05 e3 01 e6 06 05 01 5b
5b 29 e2 00 6a aa f5 00 f0 a0 38 2b 40 30 40 35
00 b2 23 21 00 00 1e f4 b0 00 a0 a0 38 4d 40 30
20 3a 00 b2 23 21 00 00 1e e2 cc 00 a0 a0 38 59
40 30 20 3a 00 b2 23 21 00 00 1e 32 e1 00 a0 a0
38 62 40 30 20 3a 00 b2 23 21 00 00 1e 00 00 8d

00 ff ff ff ff ff ff 00 06 b3 3a 30 00 00 00 00
0a 20 01 04 b5 45 1d 78 3b 23 75 b2 4d 45 b0 24
0c 50 54 af cf 00 71 4f 81 c0 81 80 95 00 d1 c0
b3 00 81 00 81 40 cd 46 00 a0 a0 38 1f 40 30 20
3a 00 b2 23 21 00 00 1e 00 00 00 fd 00 30 c8 e1
e1 40 01 0a 20 20 20 20 20 20 00 00 00 ff 00 4e
33 4c 4d 44 57 30 30 30 31 36 38 0a 00 00 00 fc
00 56 47 33 30 56 51 4c 31 41 0a 20 20 20 01 ec

02 03 35 f1 4c 01 02 03 04 90 12 13 1f 3f 5b 5c
05 23 09 07 07 83 01 00 00 6d 1a 00 00 02 01 30
c8 00 00 00 00 00 00 e3 05 e3 01 e6 06 05 01 5b
5b 29 e2 00 6a aa f5 00 f0 a0 38 2b 40 30 40 35
00 b2 23 21 00 00 1e f4 b0 00 a0 a0 38 4d 40 30
20 3a 00 b2 23 21 00 00 1e e2 cc 00 a0 a0 38 59
40 30 20 3a 00 b2 23 21 00 00 1e 32 e1 00 a0 a0
38 62 40 30 20 3a 00 b2 23 21 00 00 1e 00 00 8d

----------------

Block 0, Base EDID:
  EDID Structure Version & Revision: 1.4
  Vendor & Product Identification:
    Manufacturer: AUS
    Model: 12346
    Made in: week 10 of 2022
  Basic Display Parameters & Features:
    Digital display
    Bits per primary color channel: 10
    DisplayPort interface
    Maximum image size: 69 cm x 29 cm
    Gamma: 2.20
    DPMS levels: Off
    Supported color formats: RGB 4:4:4, YCrCb 4:4:4, YCrCb 4:2:2
    First detailed timing includes the native pixel format and preferred refresh rate
    Display supports continuous frequencies
  Color Characteristics:
    Red  : 0.6953, 0.3027
    Green: 0.2695, 0.6904
    Blue : 0.1416, 0.0498
    White: 0.3134, 0.3291
  Established Timings I & II:
    IBM     :   720x400    70.081663 Hz   9:5     31.467 kHz     28.320000 MHz
    DMT 0x04:   640x480    59.940476 Hz   4:3     31.469 kHz     25.175000 MHz
    DMT 0x05:   640x480    72.808802 Hz   4:3     37.861 kHz     31.500000 MHz
    DMT 0x06:   640x480    75.000000 Hz   4:3     37.500 kHz     31.500000 MHz
    DMT 0x08:   800x600    56.250000 Hz   4:3     35.156 kHz     36.000000 MHz
    DMT 0x09:   800x600    60.316541 Hz   4:3     37.879 kHz     40.000000 MHz
    DMT 0x0a:   800x600    72.187572 Hz   4:3     48.077 kHz     50.000000 MHz
    DMT 0x0b:   800x600    75.000000 Hz   4:3     46.875 kHz     49.500000 MHz
    DMT 0x10:  1024x768    60.003840 Hz   4:3     48.363 kHz     65.000000 MHz
    DMT 0x11:  1024x768    70.069359 Hz   4:3     56.476 kHz     75.000000 MHz
    DMT 0x12:  1024x768    75.028582 Hz   4:3     60.023 kHz     78.750000 MHz
    DMT 0x24:  1280x1024   75.024675 Hz   5:4     79.976 kHz    135.000000 MHz
  Standard Timings:
    DMT 0x15:  1152x864    75.000000 Hz   4:3     67.500 kHz    108.000000 MHz
    DMT 0x55:  1280x720    60.000000 Hz  16:9     45.000 kHz     74.250000 MHz
    DMT 0x23:  1280x1024   60.019740 Hz   5:4     63.981 kHz    108.000000 MHz
    DMT 0x2f:  1440x900    59.887445 Hz  16:10    55.935 kHz    106.500000 MHz
    DMT 0x52:  1920x1080   60.000000 Hz  16:9     67.500 kHz    148.500000 MHz
    DMT 0x3a:  1680x1050   59.954250 Hz  16:10    65.290 kHz    146.250000 MHz
    DMT 0x1c:  1280x800    59.810326 Hz  16:10    49.702 kHz     83.500000 MHz
    DMT 0x20:  1280x960    60.000000 Hz   4:3     60.000 kHz    108.000000 MHz
  Detailed Timing Descriptors:
    DTD 1:  2560x1080   59.978424 Hz  64:27    66.636 kHz    181.250000 MHz (690 mm x 291 mm)
                 Hfront   48 Hsync  32 Hback   80 Hpol P
                 Vfront    3 Vsync  10 Vback   18 Vpol P
    Display Range Limits:
      Monitor ranges (Range Limits Only): 48-200 Hz V, 225-225 kHz H, max dotclock 640 MHz
    Display Product Serial Number: ...
    Display Product Name: 'VG30VQL1A'
  Extension blocks: 1
Checksum: 0xec

----------------

Block 1, CTA-861 Extension Block:
  Revision: 3
  Underscans IT Video Formats by default
  Basic audio support
  Supports YCbCr 4:4:4
  Supports YCbCr 4:2:2
  Native DTDs: 1
  Video Data Block:
    VIC   1:   640x480    59.940476 Hz   4:3     31.469 kHz     25.175000 MHz
    VIC   2:   720x480    59.940060 Hz   4:3     31.469 kHz     27.000000 MHz
    VIC   3:   720x480    59.940060 Hz  16:9     31.469 kHz     27.000000 MHz
    VIC   4:  1280x720    60.000000 Hz  16:9     45.000 kHz     74.250000 MHz
    VIC  16:  1920x1080   60.000000 Hz  16:9     67.500 kHz    148.500000 MHz (native)
    VIC  18:   720x576    50.000000 Hz  16:9     31.250 kHz     27.000000 MHz
    VIC  19:  1280x720    50.000000 Hz  16:9     37.500 kHz     74.250000 MHz
    VIC  31:  1920x1080   50.000000 Hz  16:9     56.250 kHz    148.500000 MHz
    VIC  63:  1920x1080  120.000000 Hz  16:9    135.000 kHz    297.000000 MHz
    VIC  91:  2560x1080  100.000000 Hz  64:27   125.000 kHz    371.250000 MHz
    VIC  92:  2560x1080  120.000000 Hz  64:27   150.000 kHz    495.000000 MHz
    VIC   5:  1920x1080i  60.000000 Hz  16:9     33.750 kHz     74.250000 MHz
  Audio Data Block:
    Linear PCM:
      Max channels: 2
      Supported sample rates (kHz): 48 44.1 32
      Supported sample sizes (bits): 24 20 16
  Speaker Allocation Data Block:
    FL/FR - Front Left/Right
  Vendor-Specific Data Block (AMD), OUI 00-00-1A:
    Version: 2
    Feature Caps: 0x01
    Minimum Refresh Rate: 48 Hz
    Maximum Refresh Rate: 200 Hz
    Flags 1.x: 0x00
    Flags 2.x: 0x00
  Colorimetry Data Block:
    xvYCC601
    xvYCC709
    BT2020cYCC
    BT2020YCC
    BT2020RGB
    Gamut Boundary Description Metadata Profile P0
  HDR Static Metadata Data Block:
    Electro optical transfer functions:
      Traditional gamma - SDR luminance range
      SMPTE ST2084
    Supported static metadata descriptors:
      Static metadata type 1
    Desired content max luminance: 91 (358.942 cd/m^2)
    Desired content max frame-average luminance: 91 (358.942 cd/m^2)
    Desired content min luminance: 41 (0.093 cd/m^2)
  Video Capability Data Block:
    YCbCr quantization: No Data
    RGB quantization: Selectable (via AVI Q)
    PT scan behavior: Always Underscanned
    IT scan behavior: Always Underscanned
    CE scan behavior: Always Underscanned
  Detailed Timing Descriptors:
    DTD 2:  2560x1080  200.006361 Hz  64:27   224.607 kHz    628.900000 MHz (690 mm x 291 mm)
                 Hfront   48 Hsync  64 Hback  128 Hpol P
                 Vfront    3 Vsync   5 Vback   35 Vpol P
    DTD 3:  2560x1080  143.944786 Hz  64:27   166.544 kHz    453.000000 MHz (690 mm x 291 mm)
                 Hfront   48 Hsync  32 Hback   80 Hpol P
                 Vfront    3 Vsync  10 Vback   64 Vpol P
    DTD 4:  2560x1080  164.953706 Hz  64:27   192.831 kHz    524.500000 MHz (690 mm x 291 mm)
                 Hfront   48 Hsync  32 Hback   80 Hpol P
                 Vfront    3 Vsync  10 Vback   76 Vpol P
    DTD 5:  2560x1080  179.922351 Hz  64:27   211.949 kHz    576.500000 MHz (690 mm x 291 mm)
                 Hfront   48 Hsync  32 Hback   80 Hpol P
                 Vfront    3 Vsync  10 Vback   85 Vpol P
Checksum: 0x8d  Unused space in Extension Block: 2 bytes

----------------

Warnings:

Block 1, CTA-861 Extension Block:
  Video Data Block: VIC 1 and the first DTD are not identical. Is this intended?
  Colorimetry Data Block: Set the sRGB colorimetry bit to avoid interop issues.
  Video Capability Data Block: Set Selectable YCbCr Quantization to avoid interop issues.
  Video Capability Data Block: S_PT is equal to S_IT and S_CE, so should be set to 0 instead.
EDID:
  Base EDID: Some timings are out of range of the Monitor Ranges:
    Horizontal Freq: 31.250 - 224.607 kHz (Monitor: 225.000 - 225.000 kHz)

Failures:

EDID:
  Extension Block 2 started with EDID header, ignoring Extension Blocks >= 2.
  CTA-861: Native progressive timings are a mix of several resolutions.

EDID conformity: FAIL
