edid-decode (hex):

00 ff ff ff ff ff ff 00 06 af a7 18 00 00 00 00
1a 20 01 04 a5 22 16 78 02 f2 25 91 57 58 95 2a
1f 50 54 00 00 00 01 01 01 01 01 01 01 01 01 01
01 01 01 01 01 01 86 3d 80 c8 70 b0 26 40 6c 30
aa 00 58 d7 10 00 00 1a 38 31 80 c8 70 b0 26 40
6c 30 aa 00 58 d7 10 00 00 1a 00 00 00 fe 00 56
59 56 50 30 80 42 31 36 30 55 41 4e 00 00 00 00
00 01 41 02 99 00 10 00 00 0a 01 0a 20 20 00 0b

00 ff ff ff ff ff ff 00 06 af a7 18 00 00 00 00
1a 20 01 04 a5 22 16 78 02 f2 25 91 57 58 95 2a
1f 50 54 00 00 00 01 01 01 01 01 01 01 01 01 01
01 01 01 01 01 01 86 3d 80 c8 70 b0 26 40 6c 30
aa 00 58 d7 10 00 00 1a 38 31 80 c8 70 b0 26 40
6c 30 aa 00 58 d7 10 00 00 1a 00 00 00 fe 00 56
59 56 50 30 80 42 31 36 30 55 41 4e 00 00 00 00
00 01 41 02 99 00 10 00 00 0a 01 0a 20 20 00 0b

----------------

Block 0, Base EDID:
  EDID Structure Version & Revision: 1.4
  Vendor & Product Identification:
    Manufacturer: AUO
    Model: 6311
    Made in: week 26 of 2022
  Basic Display Parameters & Features:
    Digital display
    Bits per primary color channel: 8
    DisplayPort interface
    Maximum image size: 34 cm x 22 cm
    Gamma: 2.20
    Supported color formats: RGB 4:4:4
    First detailed timing includes the native pixel format and preferred refresh rate
  Color Characteristics:
    Red  : 0.5693, 0.3427
    Green: 0.3437, 0.5839
    Blue : 0.1640, 0.1230
    White: 0.3134, 0.3291
  Established Timings I & II: none
  Standard Timings: none
  Detailed Timing Descriptors:
    DTD 1:  1920x1200   60.010059 Hz  16:10    74.292 kHz    157.500000 MHz (344 mm x 215 mm)
                 Hfront  108 Hsync  48 Hback   44 Hpol P
                 Vfront   10 Vsync  10 Vback   18 Vpol N
    DTD 2:  1920x1200   48.008047 Hz  16:10    59.434 kHz    126.000000 MHz (344 mm x 215 mm)
                 Hfront  108 Hsync  48 Hback   44 Hpol P
                 Vfront   10 Vsync  10 Vback   18 Vpol N
    Alphanumeric Data String: 'VYVP0.B160UAN'
    Manufacturer-Specified Display Descriptor (0x00): 00 00 00 01 41 02 99 00 10 00 00 0a 01 0a 20 20 '....A.........  '
Checksum: 0x0b

----------------

Block 1, Unknown EDID Extension Block 0x00:
  00 ff ff ff ff ff ff 00 06 af a7 18 00 00 00 00 '................'
  1a 20 01 04 a5 22 16 78 02 f2 25 91 57 58 95 2a '. ...".x..%.WX.*'
  1f 50 54 00 00 00 01 01 01 01 01 01 01 01 01 01 '.PT.............'
  01 01 01 01 01 01 86 3d 80 c8 70 b0 26 40 6c 30 '.......=..p.&@l0'
  aa 00 58 d7 10 00 00 1a 38 31 80 c8 70 b0 26 40 '..X.....81..p.&@'
  6c 30 aa 00 58 d7 10 00 00 1a 00 00 00 fe 00 56 'l0..X..........V'
  59 56 50 30 80 42 31 36 30 55 41 4e 00 00 00 00 'YVP0.B160UAN....'
  00 01 41 02 99 00 10 00 00 0a 01 0a 20 20 00 0b '..A.........  ..'
Checksum: 0x0b

----------------

Warnings:

Block 0, Base EDID:
  Alphanumeric Data String: Non-ASCII character 0x80 at position 5, can cause problems.
  Missing Display Product Name.

Failures:

Block 1, Base EDID:
  Unknown Extension Block.
EDID:
  Base EDID: EDID specified 0 extension block(s), but found 1 extension block(s).

EDID conformity: FAIL
