edid-decode (hex):

00 ff ff ff ff ff ff 00 0e 14 98 17 00 00 00 00
2c 13 01 01 80 1e 13 78 0a ad 0d 96 53 50 8a 27
20 50 54 00 00 00 01 01 01 01 01 01 01 01 01 01
01 01 01 01 01 01 12 1b 00 7b 50 20 17 30 30 20
36 00 30 be 10 00 00 18 00 00 00 0f 00 20 20 20
20 20 20 20 20 20 20 20 20 20 00 00 00 fe 00 43
50 54 20 20 20 20 20 20 20 20 20 20 00 00 00 fe
00 43 4c 41 41 31 34 31 57 42 31 31 20 20 00 9a

00 ff ff ff ff ff ff 00 0e 14 98 17 00 00 00 00
2c 13 01 01 80 1e 13 78 0a ad 0d 96 53 50 8a 27
20 50 54 00 00 00 01 01 01 01 01 01 01 01 01 01
01 01 01 01 01 01 12 1b 00 7b 50 20 17 30 30 20
36 00 30 be 10 00 00 18 00 00 00 0f 00 20 20 20
20 20 20 20 20 20 20 20 20 20 00 00 00 fe 00 43
50 54 20 20 20 20 20 20 20 20 20 20 00 00 00 fe
00 43 4c 41 41 31 34 31 57 42 31 31 20 20 00 9a

----------------

Block 0, Base EDID:
  EDID Structure Version & Revision: 1.1
  Vendor & Product Identification:
    Manufacturer: CPT
    Model: 6040
    Made in: week 44 of 2009
  Basic Display Parameters & Features:
    Digital display
    Maximum image size: 30 cm x 19 cm
    Gamma: 2.20
    RGB color display
    First detailed timing is the preferred timing
  Color Characteristics:
    Red  : 0.5878, 0.3261
    Green: 0.3154, 0.5400
    Blue : 0.1523, 0.1250
    White: 0.3154, 0.3291
  Established Timings I & II: none
  Standard Timings: none
  Detailed Timing Descriptors:
    DTD 1:  1280x800    60.017200 Hz  16:10    49.394 kHz     69.300000 MHz (304 mm x 190 mm)
                 Hfront   48 Hsync  32 Hback   43 Hpol N
                 Vfront    3 Vsync   6 Vback   14 Vpol N
    Manufacturer-Specified Display Descriptor (0x0f): 00 0f 00 20 20 20 20 20 20 20 20 20 20 20 20 20 '...             '
    Alphanumeric Data String: 'CPT          '
    Alphanumeric Data String: 'CLAA141WB11  '
Checksum: 0x9a

----------------

Warnings:

Block 0, Base EDID:
  EDID Structure Version & Revision: EDID 1.1 is deprecated, do not use.

Failures:

Block 0, Base EDID:
  Alphanumeric Data String: No newline, but one or more trailing spaces.
  Alphanumeric Data String: No newline, but one or more trailing spaces.
EDID:
  Extension Block 1 started with EDID header, ignoring Extension Blocks >= 1.

EDID conformity: FAIL
