edid-decode (hex):

00 ff ff ff ff ff ff 00 04 72 93 0d 4c 19 50 44
2d 22 01 04 b5 4f 23 78 3b 79 15 a9 54 4b a3 27
0d 50 54 bf ef 80 71 4f 81 40 81 80 81 c0 81 00
95 00 b3 00 d1 c0 84 82 70 40 d1 a0 29 50 30 20
3a 00 1d 4e 31 00 00 1a 00 00 00 ff 00 32 34 34
35 30 31 39 34 43 33 57 30 31 00 00 00 fd 00 30
b4 fa fa 60 01 0a 20 20 20 20 20 20 00 00 00 fc
00 45 44 33 34 30 43 55 20 53 33 0a 20 20 02 dd

02 03 35 f1 4c 01 03 04 4c 90 12 44 13 4b 9f 4e
3f 23 09 07 07 83 01 00 00 6d 1a 00 00 02 01 30
b4 00 00 00 00 00 00 e3 05 c0 01 e2 00 ff e6 06
07 01 64 64 23 23 5a 00 70 a3 38 26 40 2a 20 13
00 1d 4e 31 00 00 1c c8 dd 70 40 d1 a0 46 50 30
20 35 00 1d 4e 31 00 00 1a 5a 87 80 a0 70 38 4d
40 30 20 35 00 1d 4e 31 00 00 1a d4 bc 00 a0 a0
a0 29 50 30 20 35 00 1d 4e 31 00 00 1e 00 00 bd

70 12 79 03 00 03 00 50 3f 3d 01 04 6f 0d 3f 01
2f 00 1f 00 9f 05 3b 00 02 80 04 00 c7 63 01 04
6f 0d ef 00 2f 00 1f 00 9f 05 3b 00 02 80 09 00
5f 08 01 04 6f 0d 3f 01 2f 00 1f 00 9f 05 3b 00
02 80 04 00 1e 73 01 04 6f 0d 87 00 2f 00 3f 00
9f 05 23 00 02 00 04 00 07 00 0a 08 81 00 08 04
00 04 02 10 00 00 00 00 00 00 00 00 00 00 00 00
00 00 00 00 00 00 00 00 00 00 00 00 00 00 72 90

00 ff ff ff ff ff ff 00 04 72 93 0d 4c 19 50 44
2d 22 01 04 b5 4f 23 78 3b 79 15 a9 54 4b a3 27
0d 50 54 bf ef 80 71 4f 81 40 81 80 81 c0 81 00
95 00 b3 00 d1 c0 84 82 70 40 d1 a0 29 50 30 20
3a 00 1d 4e 31 00 00 1a 00 00 00 ff 00 32 34 34
35 30 31 39 34 43 33 57 30 31 00 00 00 fd 00 30
b4 fa fa 60 01 0a 20 20 20 20 20 20 00 00 00 fc
00 45 44 33 34 30 43 55 20 53 33 0a 20 20 02 dd

02 03 35 f1 4c 01 03 04 4c 90 12 44 13 4b 9f 4e
3f 23 09 07 07 83 01 00 00 6d 1a 00 00 02 01 30
b4 00 00 00 00 00 00 e3 05 c0 01 e2 00 ff e6 06
07 01 64 64 23 23 5a 00 70 a3 38 26 40 2a 20 13
00 1d 4e 31 00 00 1c c8 dd 70 40 d1 a0 46 50 30
20 35 00 1d 4e 31 00 00 1a 5a 87 80 a0 70 38 4d
40 30 20 35 00 1d 4e 31 00 00 1a d4 bc 00 a0 a0
a0 29 50 30 20 35 00 1d 4e 31 00 00 1e 00 00 bd

70 12 79 03 00 03 00 50 3f 3d 01 04 6f 0d 3f 01
2f 00 1f 00 9f 05 3b 00 02 80 04 00 c7 63 01 04
6f 0d ef 00 2f 00 1f 00 9f 05 3b 00 02 80 09 00
5f 08 01 04 6f 0d 3f 01 2f 00 1f 00 9f 05 3b 00
02 80 04 00 1e 73 01 04 6f 0d 87 00 2f 00 3f 00
9f 05 23 00 02 00 04 00 07 00 0a 08 81 00 08 04
00 04 02 10 00 00 00 00 00 00 00 00 00 00 00 00
00 00 00 00 00 00 00 00 00 00 00 00 00 00 72 90

----------------

Block 0, Base EDID:
  EDID Structure Version & Revision: 1.4
  Vendor & Product Identification:
    Manufacturer: ACR
    Model: 3475
    Serial Number: ...
    Made in: week 45 of 2024
  Basic Display Parameters & Features:
    Digital display
    Bits per primary color channel: 10
    DisplayPort interface
    Maximum image size: 79 cm x 35 cm
    Gamma: 2.20
    DPMS levels: Off
    Supported color formats: RGB 4:4:4, YCrCb 4:4:4, YCrCb 4:2:2
    First detailed timing includes the native pixel format and preferred refresh rate
    Display supports continuous frequencies
  Color Characteristics:
    Red  : 0.6611, 0.3310
    Green: 0.2949, 0.6376
    Blue : 0.1523, 0.0517
    White: 0.3134, 0.3291
  Established Timings I & II:
    IBM     :   720x400    70.081663 Hz   9:5     31.467 kHz     28.320000 MHz
    DMT 0x04:   640x480    59.940476 Hz   4:3     31.469 kHz     25.175000 MHz
    Apple   :   640x480    66.666667 Hz   4:3     35.000 kHz     30.240000 MHz
    DMT 0x05:   640x480    72.808802 Hz   4:3     37.861 kHz     31.500000 MHz
    DMT 0x06:   640x480    75.000000 Hz   4:3     37.500 kHz     31.500000 MHz
    DMT 0x08:   800x600    56.250000 Hz   4:3     35.156 kHz     36.000000 MHz
    DMT 0x09:   800x600    60.316541 Hz   4:3     37.879 kHz     40.000000 MHz
    DMT 0x0a:   800x600    72.187572 Hz   4:3     48.077 kHz     50.000000 MHz
    DMT 0x0b:   800x600    75.000000 Hz   4:3     46.875 kHz     49.500000 MHz
    Apple   :   832x624    74.551266 Hz   4:3     49.726 kHz     57.284000 MHz
    DMT 0x10:  1024x768    60.003840 Hz   4:3     48.363 kHz     65.000000 MHz
    DMT 0x11:  1024x768    70.069359 Hz   4:3     56.476 kHz     75.000000 MHz
    DMT 0x12:  1024x768    75.028582 Hz   4:3     60.023 kHz     78.750000 MHz
    DMT 0x24:  1280x1024   75.024675 Hz   5:4     79.976 kHz    135.000000 MHz
    Apple   :  1152x870    75.061550 Hz 192:145   68.681 kHz    100.000000 MHz
  Standard Timings:
    DMT 0x15:  1152x864    75.000000 Hz   4:3     67.500 kHz    108.000000 MHz
    DMT 0x20:  1280x960    60.000000 Hz   4:3     60.000 kHz    108.000000 MHz
    DMT 0x23:  1280x1024   60.019740 Hz   5:4     63.981 kHz    108.000000 MHz
    DMT 0x55:  1280x720    60.000000 Hz  16:9     45.000 kHz     74.250000 MHz
    DMT 0x1c:  1280x800    59.810326 Hz  16:10    49.702 kHz     83.500000 MHz
    DMT 0x2f:  1440x900    59.887445 Hz  16:10    55.935 kHz    106.500000 MHz
    DMT 0x3a:  1680x1050   59.954250 Hz  16:10    65.290 kHz    146.250000 MHz
    DMT 0x52:  1920x1080   60.000000 Hz  16:9     67.500 kHz    148.500000 MHz
  Detailed Timing Descriptors:
    DTD 1:  3440x1440   60.001149 Hz  43:18    88.862 kHz    334.120000 MHz (797 mm x 334 mm)
                 Hfront   48 Hsync  32 Hback  240 Hpol P
                 Vfront    3 Vsync  10 Vback   28 Vpol N
    Display Product Serial Number: ...
    Display Range Limits:
      Monitor ranges (Range Limits Only): 48-180 Hz V, 250-250 kHz H, max dotclock 960 MHz
    Display Product Name: 'ED340CU S3'
  Extension blocks: 2
Checksum: 0xdd

----------------

Block 1, CTA-861 Extension Block:
  Revision: 3
  Underscans IT Video Formats by default
  Basic audio support
  Supports YCbCr 4:4:4
  Supports YCbCr 4:2:2
  Native DTDs: 1
  Video Data Block:
    VIC   1:   640x480    59.940476 Hz   4:3     31.469 kHz     25.175000 MHz
    VIC   3:   720x480    59.940060 Hz  16:9     31.469 kHz     27.000000 MHz
    VIC   4:  1280x720    60.000000 Hz  16:9     45.000 kHz     74.250000 MHz
    VIC  76:  1920x1080   60.000000 Hz  64:27    67.500 kHz    148.500000 MHz
    VIC  16:  1920x1080   60.000000 Hz  16:9     67.500 kHz    148.500000 MHz (native)
    VIC  18:   720x576    50.000000 Hz  16:9     31.250 kHz     27.000000 MHz
    VIC  68:  1280x720    50.000000 Hz  64:27    37.500 kHz     74.250000 MHz
    VIC  19:  1280x720    50.000000 Hz  16:9     37.500 kHz     74.250000 MHz
    VIC  75:  1920x1080   50.000000 Hz  64:27    56.250 kHz    148.500000 MHz
    VIC  31:  1920x1080   50.000000 Hz  16:9     56.250 kHz    148.500000 MHz (native)
    VIC  78:  1920x1080  120.000000 Hz  64:27   135.000 kHz    297.000000 MHz
    VIC  63:  1920x1080  120.000000 Hz  16:9    135.000 kHz    297.000000 MHz
  Audio Data Block:
    Linear PCM:
      Max channels: 2
      Supported sample rates (kHz): 48 44.1 32
      Supported sample sizes (bits): 24 20 16
  Speaker Allocation Data Block:
    FL/FR - Front Left/Right
  Vendor-Specific Data Block (AMD), OUI 00-00-1A:
    Version: 2
    Feature Caps: 0x01
    Minimum Refresh Rate: 48 Hz
    Maximum Refresh Rate: 180 Hz
    Flags 1.x: 0x00
    Flags 2.x: 0x00
  Colorimetry Data Block:
    BT2020YCC
    BT2020RGB
    Gamut Boundary Description Metadata Profile P0
  Video Capability Data Block:
    YCbCr quantization: Selectable (via AVI YQ)
    RGB quantization: Selectable (via AVI Q)
    PT scan behavior: Supports both over- and underscan
    IT scan behavior: Supports both over- and underscan
    CE scan behavior: Supports both over- and underscan
  HDR Static Metadata Data Block:
    Electro optical transfer functions:
      Traditional gamma - SDR luminance range
      Traditional gamma - HDR luminance range
      SMPTE ST2084
    Supported static metadata descriptors:
      Static metadata type 1
    Desired content max luminance: 100 (436.203 cd/m^2)
    Desired content max frame-average luminance: 100 (436.203 cd/m^2)
    Desired content min luminance: 35 (0.082 cd/m^2)
  Detailed Timing Descriptors:
    DTD 2:  2560x1080   59.998648 Hz  64:27    67.078 kHz    230.750000 MHz (797 mm x 334 mm)
                 Hfront   42 Hsync  32 Hback  806 Hpol N
                 Vfront    1 Vsync   3 Vback   34 Vpol P
    DTD 3:  3440x1440  100.000000 Hz  43:18   151.000 kHz    567.760000 MHz (797 mm x 334 mm)
                 Hfront   48 Hsync  32 Hback  240 Hpol P
                 Vfront    3 Vsync   5 Vback   62 Vpol N
    DTD 4:  1920x1080  143.981451 Hz  16:9    166.587 kHz    346.500000 MHz (797 mm x 334 mm)
                 Hfront   48 Hsync  32 Hback   80 Hpol P
                 Vfront    3 Vsync   5 Vback   69 Vpol N
    DTD 5:  2560x1440  120.000397 Hz  16:9    177.721 kHz    483.400000 MHz (797 mm x 334 mm)
                 Hfront   48 Hsync  32 Hback   80 Hpol P
                 Vfront    3 Vsync   5 Vback   33 Vpol P
Checksum: 0xbd  Unused space in Extension Block: 2 bytes

----------------

Block 2, DisplayID Extension Block:
  Version: 1.2
  Extension Count: 0
  Display Product Type: Standalone display device
  Video Timing Modes Type 1 - Detailed Timings Data Block:
    DTD:  3440x1440  144.000000 Hz  16:9    216.000 kHz    812.160000 MHz (aspect 16:9, no 3D stereo)
               Hfront   48 Hsync  32 Hback  240 Hpol N
               Vfront    3 Vsync   5 Vback   52 Vpol P
    DTD:  3440x1440  165.000000 Hz  16:9    247.500 kHz    910.800000 MHz (aspect 16:9, no 3D stereo)
               Hfront   48 Hsync  32 Hback  160 Hpol N
               Vfront    3 Vsync  10 Vback   47 Vpol P
    DTD:  3440x1440  120.000000 Hz  16:9    180.000 kHz    676.800000 MHz (aspect 16:9, no 3D stereo)
               Hfront   48 Hsync  32 Hback  240 Hpol N
               Vfront    3 Vsync   5 Vback   52 Vpol P
    DTD:  3440x1440  179.999682 Hz  16:9    265.680 kHz    950.070000 MHz (aspect 16:9, no 3D stereo)
               Hfront   48 Hsync  64 Hback   24 Hpol N
               Vfront    3 Vsync   5 Vback   28 Vpol N
  Supported Timing Modes Type 1 - VESA DMT Timings Data Block:
    DMT 0x04:   640x480    59.940476 Hz   4:3     31.469 kHz     25.175000 MHz
    DMT 0x09:   800x600    60.316541 Hz   4:3     37.879 kHz     40.000000 MHz
    DMT 0x10:  1024x768    60.003840 Hz   4:3     48.363 kHz     65.000000 MHz
    DMT 0x1c:  1280x800    59.810326 Hz  16:10    49.702 kHz     83.500000 MHz
    DMT 0x23:  1280x1024   60.019740 Hz   5:4     63.981 kHz    108.000000 MHz
    DMT 0x33:  1600x1200   60.000000 Hz   4:3     75.000 kHz    162.000000 MHz
    DMT 0x3a:  1680x1050   59.954250 Hz  16:10    65.290 kHz    146.250000 MHz
    DMT 0x45:  1920x1200   59.884600 Hz  16:10    74.556 kHz    193.250000 MHz
  Checksum: 0x72
Checksum: 0x90

----------------

Warnings:

Block 1, CTA-861 Extension Block:
  Video Data Block: VIC 1 and the first DTD are not identical. Is this intended?
  Colorimetry Data Block: Set the sRGB colorimetry bit to avoid interop issues.
  Video Capability Data Block: S_PT is equal to S_IT and S_CE, so should be set to 0 instead.
  Detailed Timing Descriptor #4: Image size is 797x334 mm, but based on the picture AR it should be 593x334 mm.
  Detailed Timing Descriptor #5: Image size is 797x334 mm, but based on the picture AR it should be 593x334 mm.
  Display Product Serial Number is set, so the Serial Number in the Base EDID should be 0.
EDID:
  Base EDID: Some timings are out of range of the Monitor Ranges:
    Horizontal Freq: 31.250 - 265.679 kHz (Monitor: 250.000 - 250.000 kHz)

Failures:

EDID:
  Extension Block 3 started with EDID header, ignoring Extension Blocks >= 3.
  CTA-861: Native progressive timings are a mix of several resolutions.
  DisplayID: Missing DisplayID Display Parameters Data Block.
  DisplayID: DisplayID expects at least one preferred timing.

EDID conformity: FAIL
