edid-decode (hex):

00 ff ff ff ff ff ff 00 0e 6f 0e 13 00 00 00 00
00 1f 01 04 a5 1d 12 78 03 b3 30 a7 53 4c 9b 23
0f 53 58 00 00 00 01 01 01 01 01 01 01 01 01 01
01 01 01 01 01 01 fd 3c 80 a0 70 b0 33 40 30 20
36 00 1e b3 10 00 00 18 00 00 00 fd 00 30 3c 4a
4a 0f 01 0a 20 20 20 20 20 20 00 00 00 fe 00 43
53 4f 54 20 54 33 0a 20 20 20 20 20 00 00 00 fe
00 4d 4e 44 33 30 37 4a 41 31 2d 32 0a 20 00 be

00 ff ff ff ff ff ff 00 0e 6f 0e 13 00 00 00 00
00 1f 01 04 a5 1d 12 78 03 b3 30 a7 53 4c 9b 23
0f 53 58 00 00 00 01 01 01 01 01 01 01 01 01 01
01 01 01 01 01 01 fd 3c 80 a0 70 b0 33 40 30 20
36 00 1e b3 10 00 00 18 00 00 00 fd 00 30 3c 4a
4a 0f 01 0a 20 20 20 20 20 20 00 00 00 fe 00 43
53 4f 54 20 54 33 0a 20 20 20 20 20 00 00 00 fe
00 4d 4e 44 33 30 37 4a 41 31 2d 32 0a 20 00 be

----------------

Block 0, Base EDID:
  EDID Structure Version & Revision: 1.4
  Vendor & Product Identification:
    Manufacturer: CSO
    Model: 4878
    Made in: 2021
  Basic Display Parameters & Features:
    Digital display
    Bits per primary color channel: 8
    DisplayPort interface
    Maximum image size: 29 cm x 18 cm
    Gamma: 2.20
    Supported color formats: RGB 4:4:4
    First detailed timing includes the native pixel format and preferred refresh rate
    Display supports continuous frequencies
  Color Characteristics:
    Red  : 0.6542, 0.3271
    Green: 0.2968, 0.6083
    Blue : 0.1367, 0.0615
    White: 0.3242, 0.3437
  Established Timings I & II: none
  Standard Timings: none
  Detailed Timing Descriptors:
    DTD 1:  1920x1200   60.001998 Hz  16:10    75.062 kHz    156.130000 MHz (286 mm x 179 mm)
                 Hfront   48 Hsync  32 Hback   80 Hpol N
                 Vfront    3 Vsync   6 Vback   42 Vpol N
    Display Range Limits:
      Monitor ranges (Range Limits Only): 48-60 Hz V, 74-74 kHz H, max dotclock 150 MHz
    Alphanumeric Data String: 'CSOT T3'
    Alphanumeric Data String: 'MND307JA1-2'
Checksum: 0xbe

----------------

Warnings:

Block 0, Base EDID:
  Missing Display Product Name.
EDID:
  Base EDID: Some timings are out of range of the Monitor Ranges:
    Horizontal Freq: 75.062 - 75.062 kHz (Monitor: 74.000 - 74.000 kHz)
    Maximum Clock: 156.130 MHz (Monitor: 150.000 MHz)

Failures:

EDID:
  Extension Block 1 started with EDID header, ignoring Extension Blocks >= 1.

EDID conformity: FAIL
