edid-decode (hex):

00 ff ff ff ff ff ff 00 30 ae a2 8b 00 00 00 00
00 20 01 04 b5 22 16 78 03 74 50 ac 51 44 b0 26
0f 51 55 00 00 00 01 01 01 01 01 01 01 01 01 01
01 01 01 01 01 01 bb aa 80 a0 c0 d0 a8 70 30 20
36 00 58 d7 10 00 00 18 00 00 00 fd 0c 30 a5 67
67 78 01 0a 20 20 20 20 20 20 00 00 00 fe 00 4c
45 4e 4f 56 4f 0a 0a 20 20 20 20 20 00 00 00 fe
00 4c 45 4e 31 36 30 2d 33 2e 32 4b 0a 20 02 a5

02 03 1d 00 e3 05 80 00 e6 06 05 01 93 93 11 6d
1a 00 00 02 0b 30 a5 00 04 93 11 93 11 00 00 00
00 00 00 00 00 00 00 00 00 00 00 00 00 00 00 00
00 00 00 00 00 00 00 00 00 00 00 00 00 00 00 00
00 00 00 00 00 00 00 00 00 00 00 00 00 00 00 00
00 00 00 00 00 00 00 00 00 00 00 00 00 00 00 00
00 00 00 00 00 00 00 00 00 00 00 00 00 00 00 00
00 00 00 00 00 00 00 00 00 00 00 00 00 00 9a fe

70 12 79 00 00 03 01 14 82 d5 01 05 7f 0c 9f 00
2f 00 1f 00 cf 07 a7 00 02 00 05 00 00 00 00 00
00 00 00 00 00 00 00 00 00 00 00 00 00 00 00 00
00 00 00 00 00 00 00 00 00 00 00 00 00 00 00 00
00 00 00 00 00 00 00 00 00 00 00 00 00 00 00 00
00 00 00 00 00 00 00 00 00 00 00 00 00 00 00 00
00 00 00 00 00 00 00 00 00 00 00 00 00 00 00 00
00 00 00 00 00 00 00 00 00 00 00 00 00 00 04 90

00 ff ff ff ff ff ff 00 30 ae a2 8b 00 00 00 00
00 20 01 04 b5 22 16 78 03 74 50 ac 51 44 b0 26
0f 51 55 00 00 00 01 01 01 01 01 01 01 01 01 01
01 01 01 01 01 01 bb aa 80 a0 c0 d0 a8 70 30 20
36 00 58 d7 10 00 00 18 00 00 00 fd 0c 30 a5 67
67 78 01 0a 20 20 20 20 20 20 00 00 00 fe 00 4c
45 4e 4f 56 4f 0a 0a 20 20 20 20 20 00 00 00 fe
00 4c 45 4e 31 36 30 2d 33 2e 32 4b 0a 20 02 a5

02 03 1d 00 e3 05 80 00 e6 06 05 01 93 93 11 6d
1a 00 00 02 0b 30 a5 00 04 93 11 93 11 00 00 00
00 00 00 00 00 00 00 00 00 00 00 00 00 00 00 00
00 00 00 00 00 00 00 00 00 00 00 00 00 00 00 00
00 00 00 00 00 00 00 00 00 00 00 00 00 00 00 00
00 00 00 00 00 00 00 00 00 00 00 00 00 00 00 00
00 00 00 00 00 00 00 00 00 00 00 00 00 00 00 00
00 00 00 00 00 00 00 00 00 00 00 00 00 00 9a fe

70 12 79 00 00 03 01 14 82 d5 01 05 7f 0c 9f 00
2f 00 1f 00 cf 07 a7 00 02 00 05 00 00 00 00 00
00 00 00 00 00 00 00 00 00 00 00 00 00 00 00 00
00 00 00 00 00 00 00 00 00 00 00 00 00 00 00 00
00 00 00 00 00 00 00 00 00 00 00 00 00 00 00 00
00 00 00 00 00 00 00 00 00 00 00 00 00 00 00 00
00 00 00 00 00 00 00 00 00 00 00 00 00 00 00 00
00 00 00 00 00 00 00 00 00 00 00 00 00 00 04 90

----------------

Block 0, Base EDID:
  EDID Structure Version & Revision: 1.4
  Vendor & Product Identification:
    Manufacturer: LEN
    Model: 35746
    Made in: 2022
  Basic Display Parameters & Features:
    Digital display
    Bits per primary color channel: 10
    DisplayPort interface
    Maximum image size: 34 cm x 22 cm
    Gamma: 2.20
    Supported color formats: RGB 4:4:4
    First detailed timing includes the native pixel format and preferred refresh rate
    Display supports continuous frequencies
  Color Characteristics:
    Red  : 0.6728, 0.3193
    Green: 0.2666, 0.6875
    Blue : 0.1494, 0.0595
    White: 0.3164, 0.3320
  Established Timings I & II: none
  Standard Timings: none
  Detailed Timing Descriptors:
    DTD 1:  3200x2000   60.000165 Hz  16:10   130.080 kHz    437.070000 MHz (344 mm x 215 mm)
                 Hfront   48 Hsync  32 Hback   80 Hpol N
                 Vfront    3 Vsync   6 Vback  159 Vpol N
    Display Range Limits:
      Monitor ranges (Range Limits Only): 48-165 Hz V, 358-358 kHz H, max dotclock 1200 MHz
    Alphanumeric Data String: 'LENOVO'
    Alphanumeric Data String: 'LEN160-3.2K'
  Extension blocks: 2
Checksum: 0xa5

----------------

Block 1, CTA-861 Extension Block:
  Revision: 3
  Native detailed modes: 0
  Colorimetry Data Block:
    BT2020RGB
  HDR Static Metadata Data Block:
    Electro optical transfer functions:
      Traditional gamma - SDR luminance range
      SMPTE ST2084
    Supported static metadata descriptors:
      Static metadata type 1
    Desired content max luminance: 147 (1207.332 cd/m^2)
    Desired content max frame-average luminance: 147 (1207.332 cd/m^2)
    Desired content min luminance: 17 (0.054 cd/m^2)
  Vendor-Specific Data Block (AMD), OUI 00-00-1A:
    Version: 2
    Feature Caps: 0x0b
      Local Dimming Supported
    Minimum Refresh Rate: 48 Hz
    Maximum Refresh Rate: 165 Hz
    Flags 1.x: 0x00
    Flags 2.x: 0x04
      ST 2084 (PQ) EOTF Supported
      Linear EOTF (Windows scRGB, 0.0 - 125.0) Supported
      Gamma 2.2 EOTF Supported
      BT.2020 Gamut Supported
    Maximum luminance: 147 (1207.332 cd/m^2)
    Minimum luminance: 17 (0.054 cd/m^2)
    Maximum luminance (without local dimming): 147 (1207.332 cd/m^2)
    Minimum luminance (without local dimming): 17 (0.054 cd/m^2)
Checksum: 0xfe  Unused space in Extension Block: 98 bytes

----------------

Block 2, DisplayID Extension Block:
  Version: 1.2
  Extension Count: 0
  Display Product Type: Extension Section
  Video Timing Modes Type 1 - Detailed Timings Data Block:
    DTD:  3200x2000  165.001483 Hz  16:10   357.723 kHz   1201.950000 MHz (aspect 16:10, no 3D stereo)
               Hfront   48 Hsync  32 Hback   80 Hpol N
               Vfront    3 Vsync   6 Vback  159 Vpol N
  Checksum: 0x04
Checksum: 0x90

----------------

Block 3, Unknown EDID Extension Block 0x00:
  00 ff ff ff ff ff ff 00 30 ae a2 8b 00 00 00 00 '........0.......'
  00 20 01 04 b5 22 16 78 03 74 50 ac 51 44 b0 26 '. ...".x.tP.QD.&'
  0f 51 55 00 00 00 01 01 01 01 01 01 01 01 01 01 '.QU.............'
  01 01 01 01 01 01 bb aa 80 a0 c0 d0 a8 70 30 20 '.............p0 '
  36 00 58 d7 10 00 00 18 00 00 00 fd 0c 30 a5 67 '6.X..........0.g'
  67 78 01 0a 20 20 20 20 20 20 00 00 00 fe 00 4c 'gx..      .....L'
  45 4e 4f 56 4f 0a 0a 20 20 20 20 20 00 00 00 fe 'ENOVO..     ....'
  00 4c 45 4e 31 36 30 2d 33 2e 32 4b 0a 20 02 a5 '.LEN160-3.2K. ..'
Checksum: 0xa5

----------------

Block 4, CTA-861 Extension Block:
  Revision: 3
  Native detailed modes: 0
  Colorimetry Data Block:
    BT2020RGB
  HDR Static Metadata Data Block:
    Electro optical transfer functions:
      Traditional gamma - SDR luminance range
      SMPTE ST2084
    Supported static metadata descriptors:
      Static metadata type 1
    Desired content max luminance: 147 (1207.332 cd/m^2)
    Desired content max frame-average luminance: 147 (1207.332 cd/m^2)
    Desired content min luminance: 17 (0.054 cd/m^2)
  Vendor-Specific Data Block (AMD), OUI 00-00-1A:
    Version: 2
    Feature Caps: 0x0b
      Local Dimming Supported
    Minimum Refresh Rate: 48 Hz
    Maximum Refresh Rate: 165 Hz
    Flags 1.x: 0x00
    Flags 2.x: 0x04
      ST 2084 (PQ) EOTF Supported
      Linear EOTF (Windows scRGB, 0.0 - 125.0) Supported
      Gamma 2.2 EOTF Supported
      BT.2020 Gamut Supported
    Maximum luminance: 147 (1207.332 cd/m^2)
    Minimum luminance: 17 (0.054 cd/m^2)
    Maximum luminance (without local dimming): 147 (1207.332 cd/m^2)
    Minimum luminance (without local dimming): 17 (0.054 cd/m^2)
Checksum: 0xfe  Unused space in Extension Block: 98 bytes

----------------

Block 5, DisplayID Extension Block:
  Version: 1.2
  Extension Count: 0
  Video Timing Modes Type 1 - Detailed Timings Data Block:
    DTD:  3200x2000  165.001483 Hz  16:10   357.723 kHz   1201.950000 MHz (aspect 16:10, no 3D stereo)
               Hfront   48 Hsync  32 Hback   80 Hpol N
               Vfront    3 Vsync   6 Vback  159 Vpol N
  Checksum: 0x04
Checksum: 0x90

----------------

Warnings:

Block 0, Base EDID:
  Missing Display Product Name.
Block 1, CTA-861 Extension Block:
  IT Video Formats are overscanned by default, but normally this should be underscanned.
  Colorimetry Data Block: Set the sRGB colorimetry bit to avoid interop issues.
Block 4, CTA-861 Extension Block:
  IT Video Formats are overscanned by default, but normally this should be underscanned.
  Colorimetry Data Block: Set the sRGB colorimetry bit to avoid interop issues.
EDID:
  Base EDID: Some timings are out of range of the Monitor Ranges:
    Horizontal Freq: 130.080 - 357.723 kHz (Monitor: 358.000 - 358.000 kHz)
    Maximum Clock: 1201.950 MHz (Monitor: 1200.000 MHz)

Failures:

Block 0, Base EDID:
  Alphanumeric Data String: Non-space after newline.
Block 1, CTA-861 Extension Block:
  Padding: Contains non-zero bytes.
  Required 640x480p60 timings are missing in the established timings and the SVD list (VIC 1).
  Missing VCDB, needed for Set Selectable RGB Quantization to avoid interop issues.
Block 2, DisplayID Extension Block:
  DisplayID Base Block has no product type.
  Expected 0 DisplayID Extension Block, but got 1.
Block 3, Base EDID:
  Unknown Extension Block.
Block 4, CTA-861 Extension Block:
  Colorimetry Data Block: Only one instance of this Data Block is allowed.
  HDR Static Metadata Data Block: Only one instance of this Data Block is allowed.
  Padding: Contains non-zero bytes.
EDID:
  Base EDID: EDID specified 2 extension block(s), but found 5 extension block(s).
  DisplayID: DisplayID expects at least one preferred timing.

EDID conformity: FAIL
