edid-decode (hex):

00 ff ff ff ff ff ff 00 4c 2d 1f 71 33 32 4c 34
0b 20 01 03 0e 29 17 78 2a 22 e5 a3 5b 4f a3 26
13 50 54 bf ee 00 01 01 81 c0 01 01 01 01 01 01
01 01 01 01 01 01 66 21 56 aa 51 00 1e 30 46 8f
33 00 9a e6 10 00 00 1e 00 00 00 fd 00 38 4b 1e
51 11 00 0a 20 20 20 20 20 20 00 00 00 fc 00 53
31 39 41 33 33 78 0a 20 20 20 20 20 00 00 00 ff
00 48 34 54 54 33 30 31 30 37 35 0a 20 20 00 64

00 ff ff ff ff ff ff 00 4c 2d 1f 71 33 32 4c 34
0b 20 01 03 0e 29 17 78 2a 22 e5 a3 5b 4f a3 26
13 50 54 bf ee 00 01 01 81 c0 01 01 01 01 01 01
01 01 01 01 01 01 66 21 56 aa 51 00 1e 30 46 8f
33 00 9a e6 10 00 00 1e 00 00 00 fd 00 38 4b 1e
51 11 00 0a 20 20 20 20 20 20 00 00 00 fc 00 53
31 39 41 33 33 78 0a 20 20 20 20 20 00 00 00 ff
00 48 34 54 54 33 30 31 30 37 35 0a 20 20 00 64

----------------

Block 0, Base EDID:
  EDID Structure Version & Revision: 1.3
  Vendor & Product Identification:
    Manufacturer: SAM
    Model: 28959
    Serial Number: ...
    Made in: week 11 of 2022
  Basic Display Parameters & Features:
    Analog display
    Signal Level Standard: 0.700 : 0.300 : 1.000 V p-p
    Blank level equals black level
    Sync: Separate Composite SyncOnGreen
    Maximum image size: 41 cm x 23 cm
    Gamma: 2.20
    DPMS levels: Off
    RGB color display
    First detailed timing is the preferred timing
  Color Characteristics:
    Red  : 0.6367, 0.3574
    Green: 0.3085, 0.6386
    Blue : 0.1513, 0.0761
    White: 0.3134, 0.3291
  Established Timings I & II:
    IBM     :   720x400    70.081663 Hz   9:5     31.467 kHz     28.320000 MHz
    DMT 0x04:   640x480    59.940476 Hz   4:3     31.469 kHz     25.175000 MHz
    Apple   :   640x480    66.666667 Hz   4:3     35.000 kHz     30.240000 MHz
    DMT 0x05:   640x480    72.808802 Hz   4:3     37.861 kHz     31.500000 MHz
    DMT 0x06:   640x480    75.000000 Hz   4:3     37.500 kHz     31.500000 MHz
    DMT 0x08:   800x600    56.250000 Hz   4:3     35.156 kHz     36.000000 MHz
    DMT 0x09:   800x600    60.316541 Hz   4:3     37.879 kHz     40.000000 MHz
    DMT 0x0a:   800x600    72.187572 Hz   4:3     48.077 kHz     50.000000 MHz
    DMT 0x0b:   800x600    75.000000 Hz   4:3     46.875 kHz     49.500000 MHz
    Apple   :   832x624    74.551266 Hz   4:3     49.726 kHz     57.284000 MHz
    DMT 0x10:  1024x768    60.003840 Hz   4:3     48.363 kHz     65.000000 MHz
    DMT 0x11:  1024x768    70.069359 Hz   4:3     56.476 kHz     75.000000 MHz
    DMT 0x12:  1024x768    75.028582 Hz   4:3     60.023 kHz     78.750000 MHz
  Standard Timings:
    DMT 0x55:  1280x720    60.000000 Hz  16:9     45.000 kHz     74.250000 MHz
  Detailed Timing Descriptors:
    DTD 1:  1366x768    59.789541 Hz 683:384   47.712 kHz     85.500000 MHz (410 mm x 230 mm)
                 Hfront   70 Hsync 143 Hback  213 Hpol P
                 Vfront    3 Vsync   3 Vback   24 Vpol P
    Display Range Limits:
      Monitor ranges (GTF): 56-75 Hz V, 30-81 kHz H, max dotclock 170 MHz
    Display Product Name: 'S19A33x'
    Display Product Serial Number: ...
Checksum: 0x64

----------------

Failures:

EDID:
  Extension Block 1 started with EDID header, ignoring Extension Blocks >= 1.

EDID conformity: FAIL
