edid-decode (hex):

00 ff ff ff ff ff ff 00 30 ae f2 63 00 00 00 00
2e 21 01 03 80 50 21 78 2a 70 15 af 4f 46 a5 24
0d 50 54 21 08 00 81 c0 81 80 8b c0 a9 c0 b3 00
d1 c0 01 01 01 01 e7 7c 70 a0 d0 a0 29 50 30 20
3a 00 20 4f 31 00 00 1a 00 00 00 ff 00 56 56 51
37 33 35 36 33 0a 20 20 20 20 00 00 00 fd 00 1e
3d 0f 5a 3c 00 0a 20 20 20 20 20 20 00 00 00 fc
00 50 33 34 77 2d 32 30 0a 20 20 20 20 20 01 ea

02 03 38 f3 4d 03 12 07 16 13 0f 1e 14 05 1f 10
5a 01 23 09 07 07 83 01 00 00 67 03 0c 00 20 00
38 40 67 d8 5d c4 01 78 80 00 e3 05 e0 00 e6 06
07 01 60 60 01 e2 00 ca 56 5e 00 a0 a0 a0 29 50
30 20 35 00 20 4f 31 00 00 1a 93 3d 70 a0 d0 a0
15 50 30 20 78 00 20 4f 31 00 00 1a c1 46 00 a0
a0 38 1f 40 30 20 18 04 20 4f 31 00 00 1a 00 00
00 00 00 00 00 00 00 00 00 00 00 00 00 00 00 99

00 ff ff ff ff ff ff 00 30 ae f2 63 00 00 00 00
2e 21 01 03 80 50 21 78 2a 70 15 af 4f 46 a5 24
0d 50 54 21 08 00 81 c0 81 80 8b c0 a9 c0 b3 00
d1 c0 01 01 01 01 e7 7c 70 a0 d0 a0 29 50 30 20
3a 00 20 4f 31 00 00 1a 00 00 00 ff 00 56 56 51
37 33 35 36 33 0a 20 20 20 20 00 00 00 fd 00 1e
3d 0f 5a 3c 00 0a 20 20 20 20 20 20 00 00 00 fc
00 50 33 34 77 2d 32 30 0a 20 20 20 20 20 01 ea

02 03 38 f3 4d 03 12 07 16 13 0f 1e 14 05 1f 10
5a 01 23 09 07 07 83 01 00 00 67 03 0c 00 20 00
38 40 67 d8 5d c4 01 78 80 00 e3 05 e0 00 e6 06
07 01 60 60 01 e2 00 ca 56 5e 00 a0 a0 a0 29 50
30 20 35 00 20 4f 31 00 00 1a 93 3d 70 a0 d0 a0
15 50 30 20 78 00 20 4f 31 00 00 1a c1 46 00 a0
a0 38 1f 40 30 20 18 04 20 4f 31 00 00 1a 00 00
00 00 00 00 00 00 00 00 00 00 00 00 00 00 00 99

----------------

Block 0, Base EDID:
  EDID Structure Version & Revision: 1.3
  Vendor & Product Identification:
    Manufacturer: LEN
    Model: 25586
    Made in: week 46 of 2023
  Basic Display Parameters & Features:
    Digital display
    Maximum image size: 80 cm x 33 cm
    Gamma: 2.20
    DPMS levels: Off
    RGB color display
    First detailed timing is the preferred timing
  Color Characteristics:
    Red  : 0.6845, 0.3115
    Green: 0.2734, 0.6445
    Blue : 0.1406, 0.0517
    White: 0.3134, 0.3291
  Established Timings I & II:
    DMT 0x04:   640x480    59.940476 Hz   4:3     31.469 kHz     25.175000 MHz
    DMT 0x09:   800x600    60.316541 Hz   4:3     37.879 kHz     40.000000 MHz
    DMT 0x10:  1024x768    60.003840 Hz   4:3     48.363 kHz     65.000000 MHz
  Standard Timings:
    DMT 0x55:  1280x720    60.000000 Hz  16:9     45.000 kHz     74.250000 MHz
    DMT 0x23:  1280x1024   60.019740 Hz   5:4     63.981 kHz    108.000000 MHz
    GTF     :  1360x765    60.000341 Hz  16:9     47.520 kHz     84.396000 MHz
    DMT 0x53:  1600x900    60.000000 Hz  16:9     60.000 kHz    108.000000 MHz (RB)
    DMT 0x3a:  1680x1050   59.954250 Hz  16:10    65.290 kHz    146.250000 MHz
    DMT 0x52:  1920x1080   60.000000 Hz  16:9     67.500 kHz    148.500000 MHz
  Detailed Timing Descriptors:
    DTD 1:  3440x1440   59.972616 Hz  43:18    88.819 kHz    319.750000 MHz (800 mm x 335 mm)
                 Hfront   48 Hsync  32 Hback   80 Hpol P
                 Vfront    3 Vsync  10 Vback   28 Vpol N
    Display Product Serial Number: ...
    Display Range Limits:
      Monitor ranges (GTF): 30-61 Hz V, 15-90 kHz H, max dotclock 600 MHz
    Display Product Name: 'P34w-20'
  Extension blocks: 1
Checksum: 0xea

----------------

Block 1, CTA-861 Extension Block:
  Revision: 3
  Underscans IT Video Formats by default
  Basic audio support
  Supports YCbCr 4:4:4
  Supports YCbCr 4:2:2
  Native DTDs: 3
  Video Data Block:
    VIC   3:   720x480    59.940060 Hz  16:9     31.469 kHz     27.000000 MHz
    VIC  18:   720x576    50.000000 Hz  16:9     31.250 kHz     27.000000 MHz
    VIC   7:  1440x480i   59.940060 Hz  16:9     15.734 kHz     27.000000 MHz
    VIC  22:  1440x576i   50.000000 Hz  16:9     15.625 kHz     27.000000 MHz
    VIC  19:  1280x720    50.000000 Hz  16:9     37.500 kHz     74.250000 MHz
    VIC  15:  1440x480    59.940060 Hz  16:9     31.469 kHz     54.000000 MHz
    VIC  30:  1440x576    50.000000 Hz  16:9     31.250 kHz     54.000000 MHz
    VIC  20:  1920x1080i  50.000000 Hz  16:9     28.125 kHz     74.250000 MHz
    VIC   5:  1920x1080i  60.000000 Hz  16:9     33.750 kHz     74.250000 MHz
    VIC  31:  1920x1080   50.000000 Hz  16:9     56.250 kHz    148.500000 MHz
    VIC  16:  1920x1080   60.000000 Hz  16:9     67.500 kHz    148.500000 MHz
    VIC  90:  2560x1080   60.000000 Hz  64:27    66.000 kHz    198.000000 MHz
    VIC   1:   640x480    59.940476 Hz   4:3     31.469 kHz     25.175000 MHz
  Audio Data Block:
    Linear PCM:
      Max channels: 2
      Supported sample rates (kHz): 48 44.1 32
      Supported sample sizes (bits): 24 20 16
  Speaker Allocation Data Block:
    FL/FR - Front Left/Right
  Vendor-Specific Data Block (HDMI), OUI 00-0C-03:
    Source physical address: 2.0.0.0
    DC_36bit
    DC_30bit
    DC_Y444
    Maximum TMDS clock: 320 MHz
  Vendor-Specific Data Block (HDMI Forum), OUI C4-5D-D8:
    Version: 1
    Maximum TMDS Character Rate: 600 MHz
    SCDC Present
  Colorimetry Data Block:
    BT2020cYCC
    BT2020YCC
    BT2020RGB
  HDR Static Metadata Data Block:
    Electro optical transfer functions:
      Traditional gamma - SDR luminance range
      Traditional gamma - HDR luminance range
      SMPTE ST2084
    Supported static metadata descriptors:
      Static metadata type 1
    Desired content max luminance: 96 (400.000 cd/m^2)
    Desired content max frame-average luminance: 96 (400.000 cd/m^2)
    Desired content min luminance: 1 (0.000 cd/m^2)
  Video Capability Data Block:
    YCbCr quantization: Selectable (via AVI YQ)
    RGB quantization: Selectable (via AVI Q)
    PT scan behavior: No Data
    IT scan behavior: Always Underscanned
    CE scan behavior: Always Underscanned
  Detailed Timing Descriptors:
    DTD 2:  2560x1440   59.950550 Hz  16:9     88.787 kHz    241.500000 MHz (800 mm x 335 mm)
                 Hfront   48 Hsync  32 Hback   80 Hpol P
                 Vfront    3 Vsync   5 Vback   33 Vpol N
    DTD 3:  3440x1440   29.969960 Hz  43:18    43.786 kHz    157.630000 MHz (800 mm x 335 mm)
                 Hfront   48 Hsync  32 Hback   80 Hpol P
                 Vfront    7 Vsync   8 Vback    6 Vpol N
    DTD 4:  2560x1080   59.938714 Hz  64:27    66.592 kHz    181.130000 MHz (800 mm x 335 mm)
                 Hfront   48 Hsync  32 Hback   80 Hpol P
                 Vfront   17 Vsync   8 Vback    6 Vpol N
Checksum: 0x99  Unused space in Extension Block: 17 bytes

----------------

Warnings:

Block 0, Base EDID:
  Standard Timings: Standard Timing 1360x765 has a dubious odd vertical resolution.
Block 1, CTA-861 Extension Block:
  Video Data Block: VIC 3 and the first DTD are not identical. Is this intended?
  Colorimetry Data Block: Set the sRGB colorimetry bit to avoid interop issues.
  Detailed Timing Descriptor #2: Image size is 800x335 mm, but based on the picture AR it should be 595x335 mm.

Failures:

EDID:
  Extension Block 2 started with EDID header, ignoring Extension Blocks >= 2.
  CTA-861: Native progressive timings are a mix of several resolutions.

EDID conformity: FAIL
