edid-decode (hex):

00 ff ff ff ff ff ff 00 43 0f 74 02 01 00 00 00
2d 1f 01 04 a5 3c 21 78 3b a6 61 a9 53 45 98 22
1e 4d 5d a5 4f 00 81 c0 81 40 81 80 b3 00 a9 c0
d1 c0 01 01 01 01 56 5e 00 a0 a0 a0 29 50 30 20
35 00 55 50 21 00 00 1a d3 80 00 68 a1 a0 42 50
30 20 25 00 55 50 21 00 00 1a 00 00 00 fd 00 30
4b a2 a2 22 01 0a 20 20 20 20 20 20 00 00 00 fc
00 50 69 78 69 6f 20 50 58 32 37 34 50 0a 01 02

02 03 21 74 4b 01 03 12 07 16 04 13 90 1f 05 14
23 09 07 07 83 01 00 00 68 1a 00 00 01 01 30 4b
00 02 3a 80 18 71 38 2d 40 58 2c 45 00 55 50 21
00 00 18 66 21 50 b0 51 00 1b 30 40 70 36 00 55
50 21 00 00 18 7c 2e 90 a0 60 1a 1e 40 30 20 35
00 55 50 21 00 00 1e 30 2a 40 c8 60 84 64 30 18
50 13 00 55 50 21 00 00 18 00 00 00 00 00 00 00
00 00 00 00 00 00 00 00 00 00 00 00 00 00 00 86

00 ff ff ff ff ff ff 00 43 0f 74 02 01 00 00 00
2d 1f 01 04 a5 3c 21 78 3b a6 61 a9 53 45 98 22
1e 4d 5d a5 4f 00 81 c0 81 40 81 80 b3 00 a9 c0
d1 c0 01 01 01 01 56 5e 00 a0 a0 a0 29 50 30 20
35 00 55 50 21 00 00 1a d3 80 00 68 a1 a0 42 50
30 20 25 00 55 50 21 00 00 1a 00 00 00 fd 00 30
4b a2 a2 22 01 0a 20 20 20 20 20 20 00 00 00 fc
00 50 69 78 69 6f 20 50 58 32 37 34 50 0a 01 02

02 03 21 74 4b 01 03 12 07 16 04 13 90 1f 05 14
23 09 07 07 83 01 00 00 68 1a 00 00 01 01 30 4b
00 02 3a 80 18 71 38 2d 40 58 2c 45 00 55 50 21
00 00 18 66 21 50 b0 51 00 1b 30 40 70 36 00 55
50 21 00 00 18 7c 2e 90 a0 60 1a 1e 40 30 20 35
00 55 50 21 00 00 1e 30 2a 40 c8 60 84 64 30 18
50 13 00 55 50 21 00 00 18 00 00 00 00 00 00 00
00 00 00 00 00 00 00 00 00 00 00 00 00 00 00 86

----------------

Block 0, Base EDID:
  EDID Structure Version & Revision: 1.4
  Vendor & Product Identification:
    Manufacturer: PXO
    Model: 628
    Serial Number: ...
    Made in: week 45 of 2021
  Basic Display Parameters & Features:
    Digital display
    Bits per primary color channel: 8
    DisplayPort interface
    Maximum image size: 60 cm x 33 cm
    Gamma: 2.20
    DPMS levels: Off
    Supported color formats: RGB 4:4:4, YCrCb 4:4:4, YCrCb 4:2:2
    First detailed timing includes the native pixel format and preferred refresh rate
    Display supports continuous frequencies
  Color Characteristics:
    Red  : 0.6621, 0.3261
    Green: 0.2705, 0.5957
    Blue : 0.1337, 0.1191
    White: 0.3007, 0.3642
  Established Timings I & II:
    IBM     :   720x400    70.081663 Hz   9:5     31.467 kHz     28.320000 MHz
    DMT 0x04:   640x480    59.940476 Hz   4:3     31.469 kHz     25.175000 MHz
    DMT 0x06:   640x480    75.000000 Hz   4:3     37.500 kHz     31.500000 MHz
    DMT 0x09:   800x600    60.316541 Hz   4:3     37.879 kHz     40.000000 MHz
    DMT 0x0b:   800x600    75.000000 Hz   4:3     46.875 kHz     49.500000 MHz
    DMT 0x10:  1024x768    60.003840 Hz   4:3     48.363 kHz     65.000000 MHz
    DMT 0x11:  1024x768    70.069359 Hz   4:3     56.476 kHz     75.000000 MHz
    DMT 0x12:  1024x768    75.028582 Hz   4:3     60.023 kHz     78.750000 MHz
    DMT 0x24:  1280x1024   75.024675 Hz   5:4     79.976 kHz    135.000000 MHz
  Standard Timings:
    DMT 0x55:  1280x720    60.000000 Hz  16:9     45.000 kHz     74.250000 MHz
    DMT 0x20:  1280x960    60.000000 Hz   4:3     60.000 kHz    108.000000 MHz
    DMT 0x23:  1280x1024   60.019740 Hz   5:4     63.981 kHz    108.000000 MHz
    DMT 0x3a:  1680x1050   59.954250 Hz  16:10    65.290 kHz    146.250000 MHz
    DMT 0x53:  1600x900    60.000000 Hz  16:9     60.000 kHz    108.000000 MHz (RB)
    DMT 0x52:  1920x1080   60.000000 Hz  16:9     67.500 kHz    148.500000 MHz
  Detailed Timing Descriptors:
    DTD 1:  2560x1440   59.950550 Hz  16:9     88.787 kHz    241.500000 MHz (597 mm x 336 mm)
                 Hfront   48 Hsync  32 Hback   80 Hpol P
                 Vfront    3 Vsync   5 Vback   33 Vpol N
    DTD 2:  2560x1440   74.994542 Hz  16:9    112.942 kHz    329.790000 MHz (597 mm x 336 mm)
                 Hfront   48 Hsync  32 Hback  280 Hpol P
                 Vfront    2 Vsync   5 Vback   59 Vpol N
    Display Range Limits:
      Monitor ranges (Range Limits Only): 48-75 Hz V, 162-162 kHz H, max dotclock 340 MHz
    Display Product Name: 'Pixio PX274P'
  Extension blocks: 1
Checksum: 0x02

----------------

Block 1, CTA-861 Extension Block:
  Revision: 3
  Basic audio support
  Supports YCbCr 4:4:4
  Supports YCbCr 4:2:2
  Native DTDs: 4
  Video Data Block:
    VIC   1:   640x480    59.940476 Hz   4:3     31.469 kHz     25.175000 MHz
    VIC   3:   720x480    59.940060 Hz  16:9     31.469 kHz     27.000000 MHz
    VIC  18:   720x576    50.000000 Hz  16:9     31.250 kHz     27.000000 MHz
    VIC   7:  1440x480i   59.940060 Hz  16:9     15.734 kHz     27.000000 MHz
    VIC  22:  1440x576i   50.000000 Hz  16:9     15.625 kHz     27.000000 MHz
    VIC   4:  1280x720    60.000000 Hz  16:9     45.000 kHz     74.250000 MHz
    VIC  19:  1280x720    50.000000 Hz  16:9     37.500 kHz     74.250000 MHz
    VIC  16:  1920x1080   60.000000 Hz  16:9     67.500 kHz    148.500000 MHz (native)
    VIC  31:  1920x1080   50.000000 Hz  16:9     56.250 kHz    148.500000 MHz
    VIC   5:  1920x1080i  60.000000 Hz  16:9     33.750 kHz     74.250000 MHz
    VIC  20:  1920x1080i  50.000000 Hz  16:9     28.125 kHz     74.250000 MHz
  Audio Data Block:
    Linear PCM:
      Max channels: 2
      Supported sample rates (kHz): 48 44.1 32
      Supported sample sizes (bits): 24 20 16
  Speaker Allocation Data Block:
    FL/FR - Front Left/Right
  Vendor-Specific Data Block (AMD), OUI 00-00-1A:
    Version: 1
    Feature Caps: 0x01
    Minimum Refresh Rate: 48 Hz
    Maximum Refresh Rate: 75 Hz
    Flags 1.x: 0x00
  Detailed Timing Descriptors:
    DTD 3:  1920x1080   60.000000 Hz  16:9     67.500 kHz    148.500000 MHz (597 mm x 336 mm)
                 Hfront   88 Hsync  44 Hback  148 Hpol N
                 Vfront    4 Vsync   5 Vback   36 Vpol N
    DTD 4:  1360x768    60.015162 Hz  85:48    47.712 kHz     85.500000 MHz (597 mm x 336 mm)
                 Hfront   64 Hsync 112 Hback  256 Hpol N
                 Vfront    3 Vsync   6 Vback   18 Vpol N
    DTD 5:  1680x1050   59.883253 Hz  16:10    64.674 kHz    119.000000 MHz (597 mm x 336 mm)
                 Hfront   48 Hsync  32 Hback   80 Hpol P
                 Vfront    3 Vsync   5 Vback   22 Vpol P
    DTD 6:  1600x900    60.000000 Hz  16:9     60.000 kHz    108.000000 MHz (597 mm x 336 mm)
                 Hfront   24 Hsync  80 Hback   96 Hpol N
                 Vfront    1 Vsync   3 Vback   96 Vpol N
Checksum: 0x86  Unused space in Extension Block: 22 bytes

----------------

Warnings:

Block 0, Base EDID:
  Vendor & Product Identification: The serial number is one of the known dummy values, it should probably be set to 0.
Block 1, CTA-861 Extension Block:
  IT Video Formats are overscanned by default, but normally this should be underscanned.
  Video Data Block: VIC 1 and the first DTD are not identical. Is this intended?
  Detailed Timing Descriptor #3: DTD is similar but not identical to VIC 16.
  Detailed Timing Descriptor #4: DTD is similar but not identical to DMT 0x27.
  Detailed Timing Descriptor #5: DTD is similar but not identical to DMT 0x39.
  Detailed Timing Descriptor #5: Image size is 597x336 mm, but based on the picture AR it should be 537x336 mm.
  Detailed Timing Descriptor #6: DTD is similar but not identical to DMT 0x53.
  Add a Colorimetry Data Block with the sRGB colorimetry bit set to avoid interop issues.
EDID:
  Base EDID: Some timings are out of range of the Monitor Ranges:
    Horizontal Freq: 15.625 - 112.941 kHz (Monitor: 162.000 - 162.000 kHz)

Failures:

Block 1, CTA-861 Extension Block:
  Missing VCDB, needed for Set Selectable RGB Quantization to avoid interop issues.
EDID:
  Extension Block 2 started with EDID header, ignoring Extension Blocks >= 2.
  CTA-861: Native progressive timings are a mix of several resolutions.

EDID conformity: FAIL
