edid-decode (hex):

00 ff ff ff ff ff ff 00 4a 8b 37 45 01 00 50 63
0c 23 01 04 b5 00 00 78 fe bf c0 a3 53 35 b5 25
0f 50 54 21 08 00 71 40 81 c0 81 80 95 00 a9 c0
b3 00 d1 c0 d1 00 56 5e 00 a0 a0 a0 29 50 30 20
35 00 58 4a 21 00 00 1a e9 e8 00 a0 a0 a0 53 50
30 20 35 00 b9 88 21 00 00 1a 00 00 00 fc 00 48
47 36 34 35 4a 33 37 0a 20 20 20 20 00 00 00 fd
00 30 a5 0f e1 46 01 0a 20 20 20 20 20 20 01 3c

02 03 33 f1 23 09 07 07 48 10 04 03 01 1f 13 12
3f 67 03 0c 00 20 00 b8 90 67 d8 5d c4 01 90 80
03 e3 0f 00 18 e2 00 6a e3 05 c0 00 e6 06 05 01
61 61 4f 6f c2 00 a0 a0 a0 55 50 30 20 35 00 b9
88 21 00 00 1a 56 5e 00 a0 a0 a0 29 50 30 20 35
00 b9 88 21 00 00 1a d2 ff 00 78 a0 a0 29 50 30
20 35 00 58 4a 21 00 00 1e 00 00 00 00 00 00 00
00 00 00 00 00 00 00 00 00 00 00 00 00 00 00 3a

00 ff ff ff ff ff ff 00 4a 8b 37 45 01 00 50 63
0c 23 01 04 b5 00 00 78 fe bf c0 a3 53 35 b5 25
0f 50 54 21 08 00 71 40 81 c0 81 80 95 00 a9 c0
b3 00 d1 c0 d1 00 56 5e 00 a0 a0 a0 29 50 30 20
35 00 58 4a 21 00 00 1a e9 e8 00 a0 a0 a0 53 50
30 20 35 00 b9 88 21 00 00 1a 00 00 00 fc 00 48
47 36 34 35 4a 33 37 0a 20 20 20 20 00 00 00 fd
00 30 a5 0f e1 46 01 0a 20 20 20 20 20 20 01 3c

02 03 33 f1 23 09 07 07 48 10 04 03 01 1f 13 12
3f 67 03 0c 00 20 00 b8 90 67 d8 5d c4 01 90 80
03 e3 0f 00 18 e2 00 6a e3 05 c0 00 e6 06 05 01
61 61 4f 6f c2 00 a0 a0 a0 55 50 30 20 35 00 b9
88 21 00 00 1a 56 5e 00 a0 a0 a0 29 50 30 20 35
00 b9 88 21 00 00 1a d2 ff 00 78 a0 a0 29 50 30
20 35 00 58 4a 21 00 00 1e 00 00 00 00 00 00 00
00 00 00 00 00 00 00 00 00 00 00 00 00 00 00 3a

----------------

Block 0, Base EDID:
  EDID Structure Version & Revision: 1.4
  Vendor & Product Identification:
    Manufacturer: RTK
    Model: 17719
    Serial Number: ...
    Made in: week 12 of 2025
  Basic Display Parameters & Features:
    Digital display
    Bits per primary color channel: 10
    DisplayPort interface
    Image size is variable
    Gamma: 2.20
    DPMS levels: Standby Suspend Off
    Supported color formats: RGB 4:4:4, YCrCb 4:4:4, YCrCb 4:2:2
    Default (sRGB) color space is primary color space
    First detailed timing includes the native pixel format and preferred refresh rate
  Color Characteristics:
    Red  : 0.6386, 0.3271
    Green: 0.2099, 0.7099
    Blue : 0.1474, 0.0585
    White: 0.3125, 0.3281
  Established Timings I & II:
    DMT 0x04:   640x480    59.940476 Hz   4:3     31.469 kHz     25.175000 MHz
    DMT 0x09:   800x600    60.316541 Hz   4:3     37.879 kHz     40.000000 MHz
    DMT 0x10:  1024x768    60.003840 Hz   4:3     48.363 kHz     65.000000 MHz
  Standard Timings:
    GTF     :  1152x864    60.000000 Hz   4:3     53.700 kHz     81.624000 MHz
    DMT 0x55:  1280x720    60.000000 Hz  16:9     45.000 kHz     74.250000 MHz
    DMT 0x23:  1280x1024   60.019740 Hz   5:4     63.981 kHz    108.000000 MHz
    DMT 0x2f:  1440x900    59.887445 Hz  16:10    55.935 kHz    106.500000 MHz
    DMT 0x53:  1600x900    60.000000 Hz  16:9     60.000 kHz    108.000000 MHz (RB)
    DMT 0x3a:  1680x1050   59.954250 Hz  16:10    65.290 kHz    146.250000 MHz
    DMT 0x52:  1920x1080   60.000000 Hz  16:9     67.500 kHz    148.500000 MHz
    DMT 0x45:  1920x1200   59.884600 Hz  16:10    74.556 kHz    193.250000 MHz
  Detailed Timing Descriptors:
    DTD 1:  2560x1440   59.950550 Hz  16:9     88.787 kHz    241.500000 MHz (600 mm x 330 mm)
                 Hfront   48 Hsync  32 Hback   80 Hpol P
                 Vfront    3 Vsync   5 Vback   33 Vpol N
    DTD 2:  2560x1440  143.932737 Hz  16:9    219.210 kHz    596.250000 MHz (697 mm x 392 mm)
                 Hfront   48 Hsync  32 Hback   80 Hpol P
                 Vfront    3 Vsync   5 Vback   75 Vpol N
    Display Product Name: 'HG645J37'
    Display Range Limits:
      Monitor ranges (Range Limits Only): 48-165 Hz V, 15-225 kHz H, max dotclock 700 MHz
  Extension blocks: 1
Checksum: 0x3c

----------------

Block 1, CTA-861 Extension Block:
  Revision: 3
  Underscans IT Video Formats by default
  Basic audio support
  Supports YCbCr 4:4:4
  Supports YCbCr 4:2:2
  Native DTDs: 1
  Audio Data Block:
    Linear PCM:
      Max channels: 2
      Supported sample rates (kHz): 48 44.1 32
      Supported sample sizes (bits): 24 20 16
  Video Data Block:
    VIC  16:  1920x1080   60.000000 Hz  16:9     67.500 kHz    148.500000 MHz
    VIC   4:  1280x720    60.000000 Hz  16:9     45.000 kHz     74.250000 MHz
    VIC   3:   720x480    59.940060 Hz  16:9     31.469 kHz     27.000000 MHz
    VIC   1:   640x480    59.940476 Hz   4:3     31.469 kHz     25.175000 MHz
    VIC  31:  1920x1080   50.000000 Hz  16:9     56.250 kHz    148.500000 MHz
    VIC  19:  1280x720    50.000000 Hz  16:9     37.500 kHz     74.250000 MHz
    VIC  18:   720x576    50.000000 Hz  16:9     31.250 kHz     27.000000 MHz
    VIC  63:  1920x1080  120.000000 Hz  16:9    135.000 kHz    297.000000 MHz
  Vendor-Specific Data Block (HDMI), OUI 00-0C-03:
    Source physical address: 2.0.0.0
    Supports_AI
    DC_36bit
    DC_30bit
    DC_Y444
    Maximum TMDS clock: 720 MHz
  Vendor-Specific Data Block (HDMI Forum), OUI C4-5D-D8:
    Version: 1
    Maximum TMDS Character Rate: 720 MHz
    SCDC Present
    Supports 12-bits/component Deep Color 4:2:0 Pixel Encoding
    Supports 10-bits/component Deep Color 4:2:0 Pixel Encoding
  YCbCr 4:2:0 Capability Map Data Block:
    SVD Index 12 is out of range
    SVD Index 13 is out of range
  Video Capability Data Block:
    YCbCr quantization: No Data
    RGB quantization: Selectable (via AVI Q)
    PT scan behavior: Always Underscanned
    IT scan behavior: Always Underscanned
    CE scan behavior: Always Underscanned
  Colorimetry Data Block:
    BT2020YCC
    BT2020RGB
  HDR Static Metadata Data Block:
    Electro optical transfer functions:
      Traditional gamma - SDR luminance range
      SMPTE ST2084
    Supported static metadata descriptors:
      Static metadata type 1
    Desired content max luminance: 97 (408.759 cd/m^2)
    Desired content max frame-average luminance: 97 (408.759 cd/m^2)
    Desired content min luminance: 79 (0.392 cd/m^2)
  Detailed Timing Descriptors:
    DTD 3:  2560x1440  119.997589 Hz  16:9    182.996 kHz    497.750000 MHz (697 mm x 392 mm)
                 Hfront   48 Hsync  32 Hback   80 Hpol P
                 Vfront    3 Vsync   5 Vback   77 Vpol N
    DTD 4:  2560x1440   59.950550 Hz  16:9     88.787 kHz    241.500000 MHz (697 mm x 392 mm)
                 Hfront   48 Hsync  32 Hback   80 Hpol P
                 Vfront    3 Vsync   5 Vback   33 Vpol N
    DTD 5:  2560x1440  165.000454 Hz  16:9    244.366 kHz    654.900000 MHz (600 mm x 330 mm)
                 Hfront   48 Hsync  32 Hback   40 Hpol P
                 Vfront    3 Vsync   5 Vback   33 Vpol P
Checksum: 0x3a  Unused space in Extension Block: 22 bytes

----------------

Warnings:

Block 1, CTA-861 Extension Block:
  Video Data Block: VIC 16 and the first DTD are not identical. Is this intended?
  Video Capability Data Block: Set Selectable YCbCr Quantization to avoid interop issues.
  Video Capability Data Block: S_PT is equal to S_IT and S_CE, so should be set to 0 instead.
EDID:
  Base EDID: Some timings are out of range of the Monitor Ranges:
    Horizontal Freq: 31.250 - 244.365 kHz (Monitor: 15.000 - 225.000 kHz)

Failures:

Block 0, Base EDID:
  Basic Display Parameters & Features: sRGB is signaled, but the chromaticities do not match.
Block 1, CTA-861 Extension Block:
  Vendor-Specific Data Block (HDMI), OUI 00-0C-03: HDMI VSDB Max TMDS rate is > 340.
  Vendor-Specific Data Block (HDMI), OUI 00-0C-03: The HDMI Specification requires EDID 1.3 instead of 1.4.
  Vendor-Specific Data Block (HDMI Forum), OUI C4-5D-D8: Max TMDS rate is > 0 and <= 340 or > 600.
  YCbCr 4:2:0 Capability Map Data Block: Max index 13 > 8 (#SVDs).
EDID:
  Extension Block 2 started with EDID header, ignoring Extension Blocks >= 2.
  Base EDID: The DTD max image size is 697x392mm, but the display size is not specified anywhere.

EDID conformity: FAIL
