edid-decode (hex):

00 ff ff ff ff ff ff 00 06 af 94 1a 00 00 00 00
00 1d 01 04 a5 1d 14 78 03 16 91 af 50 43 b0 26
0f 4d 53 00 00 00 01 01 01 01 01 01 01 01 01 01
01 01 01 01 01 01 8e b7 e4 a0 c0 98 3f 80 30 20
35 00 25 c3 10 00 00 18 d8 92 e4 a0 c0 98 3f 80
30 20 35 00 25 c3 10 00 00 18 00 00 00 fe 00 41
55 4f 0a 20 20 20 20 20 20 20 20 20 00 00 00 fe
00 42 31 33 39 4b 41 4e 30 31 2e 30 20 0a 00 f6

----------------

Block 0, Base EDID:
  EDID Structure Version & Revision: 1.4
  Vendor & Product Identification:
    Manufacturer: AUO
    Model: 6804
    Made in: 2019
  Basic Display Parameters & Features:
    Digital display
    Bits per primary color channel: 8
    DisplayPort interface
    Maximum image size: 29 cm x 20 cm
    Gamma: 2.20
    Supported color formats: RGB 4:4:4
    First detailed timing includes the native pixel format and preferred refresh rate
    Display supports continuous frequencies
  Color Characteristics:
    Red  : 0.6835, 0.3134
    Green: 0.2626, 0.6894
    Blue : 0.1503, 0.0595
    White: 0.3007, 0.3251
  Established Timings I & II: none
  Standard Timings: none
  Detailed Timing Descriptors:
    DTD 1:  3300x2200   60.012925 Hz   3:2    135.809 kHz    469.900000 MHz (293 mm x 195 mm)
                 Hfront   48 Hsync  32 Hback   80 Hpol N
                 Vfront    3 Vsync   5 Vback   55 Vpol N
    DTD 2:  3300x2200   48.010340 Hz   3:2    108.647 kHz    375.920000 MHz (293 mm x 195 mm)
                 Hfront   48 Hsync  32 Hback   80 Hpol N
                 Vfront    3 Vsync   5 Vback   55 Vpol N
    Alphanumeric Data String: 'AUO'
    Alphanumeric Data String: 'B139KAN01.0 '
Checksum: 0xf6

----------------

Warnings:

Block 0, Base EDID:
  Missing Display Product Name.

Failures:

Block 0, Base EDID:
  Alphanumeric Data String: One or more trailing spaces before newline.
  Missing Display Range Limits Descriptor.

EDID conformity: FAIL
