edid-decode (hex):

00 ff ff ff ff ff ff 00 10 ac 5a f0 4d 37 54 41
14 18 01 04 b5 3e 22 78 3a 0a a5 a2 57 4f a2 28
0f 50 54 a5 4b 00 71 4f 81 00 81 80 a9 40 b3 00
d1 c0 d1 00 01 01 a3 66 00 a0 f0 70 1f 80 30 20
35 00 6d 55 21 00 00 1a 00 00 00 ff 00 57 4a 4a
47 52 34 35 43 41 54 37 4d 0a 00 00 00 fc 00 44
45 4c 4c 20 50 32 38 31 35 51 0a 20 00 00 00 fd
00 18 55 1f 72 1e 00 0a 20 20 20 20 20 20 01 11

02 03 1f f1 52 90 1f 01 02 03 07 16 04 13 14 05
12 11 06 15 20 21 22 23 09 1f 07 83 01 00 00 04
74 00 30 f2 70 5a 80 b0 58 8a 00 6d 55 21 00 00
1e 02 3a 80 18 71 38 2d 40 58 2c 45 00 6d 55 21
00 00 1e 01 1d 80 18 71 1c 16 20 58 2c 25 00 6d
55 21 00 00 9e 01 1d 00 72 51 d0 1e 20 6e 28 55
00 6d 55 21 00 00 1e 8c 0a d0 8a 20 e0 2d 10 10
3e 96 00 6d 55 21 00 00 18 00 00 00 00 00 00 6b

00 ff ff ff ff ff ff 00 10 ac 5a f0 4d 37 54 41
14 18 01 04 b5 3e 22 78 3a 0a a5 a2 57 4f a2 28
0f 50 54 a5 4b 00 71 4f 81 00 81 80 a9 40 b3 00
d1 c0 d1 00 01 01 a3 66 00 a0 f0 70 1f 80 30 20
35 00 6d 55 21 00 00 1a 00 00 00 ff 00 57 4a 4a
47 52 34 35 43 41 54 37 4d 0a 00 00 00 fc 00 44
45 4c 4c 20 50 32 38 31 35 51 0a 20 00 00 00 fd
00 18 55 1f 72 1e 00 0a 20 20 20 20 20 20 01 11

02 03 1f f1 52 90 1f 01 02 03 07 16 04 13 14 05
12 11 06 15 20 21 22 23 09 1f 07 83 01 00 00 04
74 00 30 f2 70 5a 80 b0 58 8a 00 6d 55 21 00 00
1e 02 3a 80 18 71 38 2d 40 58 2c 45 00 6d 55 21
00 00 1e 01 1d 80 18 71 1c 16 20 58 2c 25 00 6d
55 21 00 00 9e 01 1d 00 72 51 d0 1e 20 6e 28 55
00 6d 55 21 00 00 1e 8c 0a d0 8a 20 e0 2d 10 10
3e 96 00 6d 55 21 00 00 18 00 00 00 00 00 00 6b

----------------

Block 0, Base EDID:
  EDID Structure Version & Revision: 1.4
  Vendor & Product Identification:
    Manufacturer: DEL
    Model: 61530
    Serial Number: ...
    Made in: week 20 of 2014
  Basic Display Parameters & Features:
    Digital display
    Bits per primary color channel: 10
    DisplayPort interface
    Maximum image size: 62 cm x 34 cm
    Gamma: 2.20
    DPMS levels: Off
    Supported color formats: RGB 4:4:4, YCrCb 4:4:4, YCrCb 4:2:2
    First detailed timing includes the native pixel format and preferred refresh rate
  Color Characteristics:
    Red  : 0.6328, 0.3398
    Green: 0.3105, 0.6347
    Blue : 0.1582, 0.0605
    White: 0.3134, 0.3291
  Established Timings I & II:
    IBM     :   720x400    70.081663 Hz   9:5     31.467 kHz     28.320000 MHz
    DMT 0x04:   640x480    59.940476 Hz   4:3     31.469 kHz     25.175000 MHz
    DMT 0x06:   640x480    75.000000 Hz   4:3     37.500 kHz     31.500000 MHz
    DMT 0x09:   800x600    60.316541 Hz   4:3     37.879 kHz     40.000000 MHz
    DMT 0x0b:   800x600    75.000000 Hz   4:3     46.875 kHz     49.500000 MHz
    DMT 0x10:  1024x768    60.003840 Hz   4:3     48.363 kHz     65.000000 MHz
    DMT 0x12:  1024x768    75.028582 Hz   4:3     60.023 kHz     78.750000 MHz
    DMT 0x24:  1280x1024   75.024675 Hz   5:4     79.976 kHz    135.000000 MHz
  Standard Timings:
    DMT 0x15:  1152x864    75.000000 Hz   4:3     67.500 kHz    108.000000 MHz
    DMT 0x1c:  1280x800    59.810326 Hz  16:10    49.702 kHz     83.500000 MHz
    DMT 0x23:  1280x1024   60.019740 Hz   5:4     63.981 kHz    108.000000 MHz
    DMT 0x33:  1600x1200   60.000000 Hz   4:3     75.000 kHz    162.000000 MHz
    DMT 0x3a:  1680x1050   59.954250 Hz  16:10    65.290 kHz    146.250000 MHz
    DMT 0x52:  1920x1080   60.000000 Hz  16:9     67.500 kHz    148.500000 MHz
    DMT 0x45:  1920x1200   59.884600 Hz  16:10    74.556 kHz    193.250000 MHz
  Detailed Timing Descriptors:
    DTD  1:  3840x2160   29.980602 Hz  16:9     65.688 kHz    262.750000 MHz (621 mm x 341 mm)
                  Hfront   48 Hsync  32 Hback   80 Hpol P
                  Vfront    3 Vsync   5 Vback   23 Vpol N
    Display Product Serial Number: ...
    Display Product Name: 'DELL P2815Q'
    Display Range Limits:
      Monitor ranges (GTF): 24-85 Hz V, 31-114 kHz H, max dotclock 300 MHz
  Extension blocks: 1
Checksum: 0x11

----------------

Block 1, CTA-861 Extension Block:
  Revision: 3
  Underscans IT Video Formats by default
  Basic audio support
  Supports YCbCr 4:4:4
  Supports YCbCr 4:2:2
  Native detailed modes: 1
  Video Data Block:
    VIC  16:  1920x1080   60.000000 Hz  16:9     67.500 kHz    148.500000 MHz (native)
    VIC  31:  1920x1080   50.000000 Hz  16:9     56.250 kHz    148.500000 MHz
    VIC   1:   640x480    59.940476 Hz   4:3     31.469 kHz     25.175000 MHz
    VIC   2:   720x480    59.940060 Hz   4:3     31.469 kHz     27.000000 MHz
    VIC   3:   720x480    59.940060 Hz  16:9     31.469 kHz     27.000000 MHz
    VIC   7:  1440x480i   59.940060 Hz  16:9     15.734 kHz     27.000000 MHz
    VIC  22:  1440x576i   50.000000 Hz  16:9     15.625 kHz     27.000000 MHz
    VIC   4:  1280x720    60.000000 Hz  16:9     45.000 kHz     74.250000 MHz
    VIC  19:  1280x720    50.000000 Hz  16:9     37.500 kHz     74.250000 MHz
    VIC  20:  1920x1080i  50.000000 Hz  16:9     28.125 kHz     74.250000 MHz
    VIC   5:  1920x1080i  60.000000 Hz  16:9     33.750 kHz     74.250000 MHz
    VIC  18:   720x576    50.000000 Hz  16:9     31.250 kHz     27.000000 MHz
    VIC  17:   720x576    50.000000 Hz   4:3     31.250 kHz     27.000000 MHz
    VIC   6:  1440x480i   59.940060 Hz   4:3     15.734 kHz     27.000000 MHz
    VIC  21:  1440x576i   50.000000 Hz   4:3     15.625 kHz     27.000000 MHz
    VIC  32:  1920x1080   24.000000 Hz  16:9     27.000 kHz     74.250000 MHz
    VIC  33:  1920x1080   25.000000 Hz  16:9     28.125 kHz     74.250000 MHz
    VIC  34:  1920x1080   30.000000 Hz  16:9     33.750 kHz     74.250000 MHz
  Audio Data Block:
    Linear PCM:
      Max channels: 2
      Supported sample rates (kHz): 96 88.2 48 44.1 32
      Supported sample sizes (bits): 24 20 16
  Speaker Allocation Data Block:
    FL/FR - Front Left/Right
  Detailed Timing Descriptors:
    DTD  2:  3840x2160   30.000000 Hz  16:9     67.500 kHz    297.000000 MHz (621 mm x 341 mm)
                  Hfront  176 Hsync  88 Hback  296 Hpol P
                  Vfront    8 Vsync  10 Vback   72 Vpol P
    DTD  3:  1920x1080   60.000000 Hz  16:9     67.500 kHz    148.500000 MHz (621 mm x 341 mm)
                  Hfront   88 Hsync  44 Hback  148 Hpol P
                  Vfront    4 Vsync   5 Vback   36 Vpol P
    DTD  4:  1920x1080i  60.000000 Hz  16:9     33.750 kHz     74.250000 MHz (621 mm x 341 mm)
                  Hfront   88 Hsync  44 Hback  148 Hpol P
                  Vfront    2 Vsync   5 Vback   15 Vpol P Vfront +0.5 Odd Field
                  Vfront    2 Vsync   5 Vback   15 Vpol P Vback  +0.5 Even Field
    DTD  5:  1280x720    60.000000 Hz  16:9     45.000 kHz     74.250000 MHz (621 mm x 341 mm)
                  Hfront  110 Hsync  40 Hback  220 Hpol P
                  Vfront    5 Vsync   5 Vback   20 Vpol P
    DTD  6:   720x480    59.940060 Hz   3:2     31.469 kHz     27.000000 MHz (621 mm x 341 mm)
                  Hfront   16 Hsync  62 Hback   60 Hpol N
                  Vfront    9 Vsync   6 Vback   30 Vpol N
Checksum: 0x6b  Unused space in Extension Block: 6 bytes

----------------

Block 2, Unknown EDID Extension Block 0x00:
  00 ff ff ff ff ff ff 00 10 ac 5a f0 4d 37 54 41 '..........Z.M7TA'
  14 18 01 04 b5 3e 22 78 3a 0a a5 a2 57 4f a2 28 '.....>"x:...WO.('
  0f 50 54 a5 4b 00 71 4f 81 00 81 80 a9 40 b3 00 '.PT.K.qO.....@..'
  d1 c0 d1 00 01 01 a3 66 00 a0 f0 70 1f 80 30 20 '.......f...p..0 '
  35 00 6d 55 21 00 00 1a 00 00 00 ff 00 57 4a 4a '5.mU!........WJJ'
  47 52 34 35 43 41 54 37 4d 0a 00 00 00 fc 00 44 'GR45CAT7M......D'
  45 4c 4c 20 50 32 38 31 35 51 0a 20 00 00 00 fd 'ELL P2815Q. ....'
  00 18 55 1f 72 1e 00 0a 20 20 20 20 20 20 01 11 '..U.r...      ..'
Checksum: 0x11

----------------

Block 3, CTA-861 Extension Block:
  Revision: 3
  Underscans IT Video Formats by default
  Basic audio support
  Supports YCbCr 4:4:4
  Supports YCbCr 4:2:2
  Native detailed modes: 1
  Video Data Block:
    VIC  16:  1920x1080   60.000000 Hz  16:9     67.500 kHz    148.500000 MHz (native)
    VIC  31:  1920x1080   50.000000 Hz  16:9     56.250 kHz    148.500000 MHz
    VIC   1:   640x480    59.940476 Hz   4:3     31.469 kHz     25.175000 MHz
    VIC   2:   720x480    59.940060 Hz   4:3     31.469 kHz     27.000000 MHz
    VIC   3:   720x480    59.940060 Hz  16:9     31.469 kHz     27.000000 MHz
    VIC   7:  1440x480i   59.940060 Hz  16:9     15.734 kHz     27.000000 MHz
    VIC  22:  1440x576i   50.000000 Hz  16:9     15.625 kHz     27.000000 MHz
    VIC   4:  1280x720    60.000000 Hz  16:9     45.000 kHz     74.250000 MHz
    VIC  19:  1280x720    50.000000 Hz  16:9     37.500 kHz     74.250000 MHz
    VIC  20:  1920x1080i  50.000000 Hz  16:9     28.125 kHz     74.250000 MHz
    VIC   5:  1920x1080i  60.000000 Hz  16:9     33.750 kHz     74.250000 MHz
    VIC  18:   720x576    50.000000 Hz  16:9     31.250 kHz     27.000000 MHz
    VIC  17:   720x576    50.000000 Hz   4:3     31.250 kHz     27.000000 MHz
    VIC   6:  1440x480i   59.940060 Hz   4:3     15.734 kHz     27.000000 MHz
    VIC  21:  1440x576i   50.000000 Hz   4:3     15.625 kHz     27.000000 MHz
    VIC  32:  1920x1080   24.000000 Hz  16:9     27.000 kHz     74.250000 MHz
    VIC  33:  1920x1080   25.000000 Hz  16:9     28.125 kHz     74.250000 MHz
    VIC  34:  1920x1080   30.000000 Hz  16:9     33.750 kHz     74.250000 MHz
  Audio Data Block:
    Linear PCM:
      Max channels: 2
      Supported sample rates (kHz): 96 88.2 48 44.1 32
      Supported sample sizes (bits): 24 20 16
  Speaker Allocation Data Block:
    FL/FR - Front Left/Right
  Detailed Timing Descriptors:
    DTD  7:  3840x2160   30.000000 Hz  16:9     67.500 kHz    297.000000 MHz (621 mm x 341 mm)
                  Hfront  176 Hsync  88 Hback  296 Hpol P
                  Vfront    8 Vsync  10 Vback   72 Vpol P
    DTD  8:  1920x1080   60.000000 Hz  16:9     67.500 kHz    148.500000 MHz (621 mm x 341 mm)
                  Hfront   88 Hsync  44 Hback  148 Hpol P
                  Vfront    4 Vsync   5 Vback   36 Vpol P
    DTD  9:  1920x1080i  60.000000 Hz  16:9     33.750 kHz     74.250000 MHz (621 mm x 341 mm)
                  Hfront   88 Hsync  44 Hback  148 Hpol P
                  Vfront    2 Vsync   5 Vback   15 Vpol P Vfront +0.5 Odd Field
                  Vfront    2 Vsync   5 Vback   15 Vpol P Vback  +0.5 Even Field
    DTD 10:  1280x720    60.000000 Hz  16:9     45.000 kHz     74.250000 MHz (621 mm x 341 mm)
                  Hfront  110 Hsync  40 Hback  220 Hpol P
                  Vfront    5 Vsync   5 Vback   20 Vpol P
    DTD 11:   720x480    59.940060 Hz   3:2     31.469 kHz     27.000000 MHz (621 mm x 341 mm)
                  Hfront   16 Hsync  62 Hback   60 Hpol N
                  Vfront    9 Vsync   6 Vback   30 Vpol N
Checksum: 0x6b  Unused space in Extension Block: 6 bytes

----------------

Warnings:

Block 0, Base EDID:
  Display Range Limits: GTF support is deprecated in EDID 1.4.
Block 1, CTA-861 Extension Block:
  Video Data Block: VIC 16 and the first DTD are not identical. Is this intended?
  Detailed Timing Descriptor #2: DTD is identical to VIC 95, which is not present in the CTA Ext Block.
  Detailed Timing Descriptor #6: Image size is 621x341 mm, but based on the picture AR it should be 621x414 mm.
  Display Product Serial Number is set, so the Serial Number in the Base EDID should be 0.
  Add a Colorimetry Data Block with the sRGB colorimetry bit set to avoid interop issues.
Block 3, CTA-861 Extension Block:
  Detailed Timing Descriptor #7: DTD is identical to VIC 95, which is not present in the CTA Ext Block.
  Detailed Timing Descriptor #11: Image size is 621x341 mm, but based on the picture AR it should be 621x414 mm.
EDID:
  Base EDID: Some timings are out of range of the Monitor Ranges:
    Horizontal Freq: 15.625 - 79.976 kHz (Monitor: 31.000 - 114.000 kHz)

Failures:

Block 0, Base EDID:
  Display Range Limits: GTF is supported, but the display does not support continuous frequencies.
Block 1, CTA-861 Extension Block:
  Missing VCDB, needed for Set Selectable RGB Quantization to avoid interop issues.
Block 2, Base EDID:
  Unknown Extension Block.
Block 3, CTA-861 Extension Block:
  Video Data Block: Duplicate VIC 16.
  Video Data Block: Duplicate VIC 31.
  Video Data Block: Duplicate VIC 1.
  Video Data Block: Duplicate VIC 2.
  Video Data Block: Duplicate VIC 3.
  Video Data Block: Duplicate VIC 7.
  Video Data Block: Duplicate VIC 22.
  Video Data Block: Duplicate VIC 4.
  Video Data Block: Duplicate VIC 19.
  Video Data Block: Duplicate VIC 20.
  Video Data Block: Duplicate VIC 5.
  Video Data Block: Duplicate VIC 18.
  Video Data Block: Duplicate VIC 17.
  Video Data Block: Duplicate VIC 6.
  Video Data Block: Duplicate VIC 21.
  Video Data Block: Duplicate VIC 32.
  Video Data Block: Duplicate VIC 33.
  Video Data Block: Duplicate VIC 34.
  Speaker Allocation Data Block: Only one instance of this Data Block is allowed.
EDID:
  Base EDID: EDID specified 1 extension block(s), but found 3 extension block(s).
  CTA-861: Native progressive timings are a mix of several resolutions.

EDID conformity: FAIL
