edid-decode (hex):

00 ff ff ff ff ff ff 00 1e 6d 86 3e ad 36 04 00
02 13 01 04 a5 23 14 78 e2 1e 95 a3 55 48 98 27
15 50 54 a5 6a 00 31 4f 45 4f 61 4f 01 01 01 01
01 01 01 01 01 01 66 21 50 b0 51 00 1b 30 40 70
36 00 58 c2 10 00 00 1e 0e 1f 00 80 51 00 1e 30
40 80 37 00 58 c2 10 00 00 1c 00 00 00 fd 00 38
4b 1c 3d 09 00 0a 20 20 20 20 20 20 00 00 00 fc
00 57 31 36 34 32 0a 20 20 20 20 20 20 20 00 a8

00 ff ff ff ff ff ff 00 1e 6d 86 3e ad 36 04 00
02 13 01 04 a5 23 14 78 e2 1e 95 a3 55 48 98 27
15 50 54 a5 6a 00 31 4f 45 4f 61 4f 01 01 01 01
01 01 01 01 01 01 66 21 50 b0 51 00 1b 30 40 70
36 00 58 c2 10 00 00 1e 0e 1f 00 80 51 00 1e 30
40 80 37 00 58 c2 10 00 00 1c 00 00 00 fd 00 38
4b 1c 3d 09 00 0a 20 20 20 20 20 20 00 00 00 fc
00 57 31 36 34 32 0a 20 20 20 20 20 20 20 00 a8

----------------

Block 0, Base EDID:
  EDID Structure Version & Revision: 1.4
  Vendor & Product Identification:
    Manufacturer: GSM
    Model: 16006
    Serial Number: ...
    Made in: week 2 of 2009
  Basic Display Parameters & Features:
    Digital display
    Bits per primary color channel: 8
    DisplayPort interface
    Maximum image size: 35 cm x 20 cm
    Gamma: 2.20
    DPMS levels: Standby Suspend Off
    Supported color formats: RGB 4:4:4
    First detailed timing includes the native pixel format and preferred refresh rate
  Color Characteristics:
    Red  : 0.6367, 0.3330
    Green: 0.2841, 0.5957
    Blue : 0.1542, 0.0830
    White: 0.3134, 0.3291
  Established Timings I & II:
    IBM     :   720x400    70.081663 Hz   9:5     31.467 kHz     28.320000 MHz
    DMT 0x04:   640x480    59.940476 Hz   4:3     31.469 kHz     25.175000 MHz
    DMT 0x06:   640x480    75.000000 Hz   4:3     37.500 kHz     31.500000 MHz
    DMT 0x09:   800x600    60.316541 Hz   4:3     37.879 kHz     40.000000 MHz
    DMT 0x0b:   800x600    75.000000 Hz   4:3     46.875 kHz     49.500000 MHz
    Apple   :   832x624    74.551266 Hz   4:3     49.726 kHz     57.284000 MHz
    DMT 0x10:  1024x768    60.003840 Hz   4:3     48.363 kHz     65.000000 MHz
    DMT 0x12:  1024x768    75.028582 Hz   4:3     60.023 kHz     78.750000 MHz
  Standard Timings:
    DMT 0x06:   640x480    75.000000 Hz   4:3     37.500 kHz     31.500000 MHz
    DMT 0x0b:   800x600    75.000000 Hz   4:3     46.875 kHz     49.500000 MHz
    DMT 0x12:  1024x768    75.028582 Hz   4:3     60.023 kHz     78.750000 MHz
  Detailed Timing Descriptors:
    DTD 1:  1360x768    60.015162 Hz  85:48    47.712 kHz     85.500000 MHz (344 mm x 194 mm)
                 Hfront   64 Hsync 112 Hback  256 Hpol P
                 Vfront    3 Vsync   6 Vback   18 Vpol P
    DTD 2:  1280x768    59.870228 Hz   5:3     47.776 kHz     79.500000 MHz (344 mm x 194 mm)
                 Hfront   64 Hsync 128 Hback  192 Hpol N
                 Vfront    3 Vsync   7 Vback   20 Vpol P
    Display Range Limits:
      Monitor ranges (GTF): 56-75 Hz V, 28-61 kHz H, max dotclock 90 MHz
    Display Product Name: 'W1642'
Checksum: 0xa8

----------------

Block 1, Unknown EDID Extension Block 0x00:
  00 ff ff ff ff ff ff 00 1e 6d 86 3e ad 36 04 00 '.........m.>.6..'
  02 13 01 04 a5 23 14 78 e2 1e 95 a3 55 48 98 27 '.....#.x....UH.''
  15 50 54 a5 6a 00 31 4f 45 4f 61 4f 01 01 01 01 '.PT.j.1OEOaO....'
  01 01 01 01 01 01 66 21 50 b0 51 00 1b 30 40 70 '......f!P.Q..0@p'
  36 00 58 c2 10 00 00 1e 0e 1f 00 80 51 00 1e 30 '6.X.........Q..0'
  40 80 37 00 58 c2 10 00 00 1c 00 00 00 fd 00 38 '@.7.X..........8'
  4b 1c 3d 09 00 0a 20 20 20 20 20 20 00 00 00 fc 'K.=...      ....'
  00 57 31 36 34 32 0a 20 20 20 20 20 20 20 00 a8 '.W1642.       ..'
Checksum: 0xa8

----------------

Warnings:

Block 0, Base EDID:
  Detailed Timing Descriptor #2: Image size is 344x194 mm, but based on the picture AR it should be 344x206 mm.
  Display Range Limits: GTF support is deprecated in EDID 1.4.

Failures:

Block 0, Base EDID:
  Display Range Limits: GTF is supported, but the display does not support continuous frequencies.
Block 1, Base EDID:
  Unknown Extension Block.
EDID:
  Base EDID: EDID specified 0 extension block(s), but found 1 extension block(s).

EDID conformity: FAIL
