edid-decode (hex):

00 ff ff ff ff ff ff 00 1e 6d 20 77 a6 65 03 00
0a 1c 01 04 b5 50 21 78 9e 09 c1 ae 50 44 af 26
0e 50 54 21 08 00 71 40 81 80 81 c0 a9 c0 d1 c0
81 00 01 01 01 01 e7 7c 70 a0 d0 a0 29 50 30 20
3a 00 20 4a 31 00 00 1a 9d 67 70 a0 d0 a0 22 50
30 20 3a 00 20 4a 31 00 00 1a 00 00 00 fd 00 30
3d 1e 87 4c 00 0a 20 20 20 20 20 20 00 00 00 fc
00 4c 47 20 48 44 52 20 35 4b 0a 20 20 20 02 b3

02 03 19 71 44 90 04 03 01 23 09 07 07 83 01 00
00 e3 05 c0 00 e3 06 05 01 4d d0 00 a0 f0 70 3e
80 30 20 65 0c 20 4a 31 00 00 1a 28 68 00 a0 f0
70 3e 80 08 90 65 0c 20 4a 31 00 00 1a 00 00 00
00 00 00 00 00 00 00 00 00 00 00 00 00 00 00 00
00 00 00 00 00 00 00 00 00 00 00 00 00 00 00 00
00 00 00 00 00 00 00 00 00 00 00 00 00 00 00 00
00 00 00 00 00 00 00 00 00 00 00 00 00 00 00 e3

70 12 79 03 00 03 00 28 70 1d 01 86 ff 13 68 01
18 80 60 00 6f 08 3d 00 2f 00 08 00 b8 8e 00 86
ff 13 68 01 18 80 60 00 6f 08 3d 00 2f 00 08 00
00 00 00 00 00 00 00 00 00 00 00 00 00 00 00 00
00 00 00 00 00 00 00 00 00 00 00 00 00 00 00 00
00 00 00 00 00 00 00 00 00 00 00 00 00 00 00 00
00 00 00 00 00 00 00 00 00 00 00 00 00 00 00 00
00 00 00 00 00 00 00 00 00 00 00 00 00 00 ab 90

00 ff ff ff ff ff ff 00 1e 6d 20 77 a6 65 03 00
0a 1c 01 04 b5 50 21 78 9e 09 c1 ae 50 44 af 26
0e 50 54 21 08 00 71 40 81 80 81 c0 a9 c0 d1 c0
81 00 01 01 01 01 e7 7c 70 a0 d0 a0 29 50 30 20
3a 00 20 4a 31 00 00 1a 9d 67 70 a0 d0 a0 22 50
30 20 3a 00 20 4a 31 00 00 1a 00 00 00 fd 00 30
3d 1e 87 4c 00 0a 20 20 20 20 20 20 00 00 00 fc
00 4c 47 20 48 44 52 20 35 4b 0a 20 20 20 02 b3

02 03 19 71 44 90 04 03 01 23 09 07 07 83 01 00
00 e3 05 c0 00 e3 06 05 01 4d d0 00 a0 f0 70 3e
80 30 20 65 0c 20 4a 31 00 00 1a 28 68 00 a0 f0
70 3e 80 08 90 65 0c 20 4a 31 00 00 1a 00 00 00
00 00 00 00 00 00 00 00 00 00 00 00 00 00 00 00
00 00 00 00 00 00 00 00 00 00 00 00 00 00 00 00
00 00 00 00 00 00 00 00 00 00 00 00 00 00 00 00
00 00 00 00 00 00 00 00 00 00 00 00 00 00 00 e3

70 12 79 03 00 03 00 28 70 1d 01 86 ff 13 68 01
18 80 60 00 6f 08 3d 00 2f 00 08 00 b8 8e 00 86
ff 13 68 01 18 80 60 00 6f 08 3d 00 2f 00 08 00
00 00 00 00 00 00 00 00 00 00 00 00 00 00 00 00
00 00 00 00 00 00 00 00 00 00 00 00 00 00 00 00
00 00 00 00 00 00 00 00 00 00 00 00 00 00 00 00
00 00 00 00 00 00 00 00 00 00 00 00 00 00 00 00
00 00 00 00 00 00 00 00 00 00 00 00 00 00 ab 90

----------------

Block 0, Base EDID:
  EDID Structure Version & Revision: 1.4
  Vendor & Product Identification:
    Manufacturer: GSM
    Model: 30496
    Serial Number: ...
    Made in: week 10 of 2018
  Basic Display Parameters & Features:
    Digital display
    Bits per primary color channel: 10
    DisplayPort interface
    Maximum image size: 80 cm x 33 cm
    Gamma: 2.20
    DPMS levels: Standby
    Supported color formats: RGB 4:4:4, YCrCb 4:4:4, YCrCb 4:2:2
    Default (sRGB) color space is primary color space
    First detailed timing includes the native pixel format and preferred refresh rate
  Color Characteristics:
    Red  : 0.6796, 0.3125
    Green: 0.2675, 0.6845
    Blue : 0.1513, 0.0546
    White: 0.3125, 0.3291
  Established Timings I & II:
    DMT 0x04:   640x480    59.940476 Hz   4:3     31.469 kHz     25.175000 MHz
    DMT 0x09:   800x600    60.316541 Hz   4:3     37.879 kHz     40.000000 MHz
    DMT 0x10:  1024x768    60.003840 Hz   4:3     48.363 kHz     65.000000 MHz
  Standard Timings:
    GTF     :  1152x864    60.000000 Hz   4:3     53.700 kHz     81.624000 MHz
    DMT 0x23:  1280x1024   60.019740 Hz   5:4     63.981 kHz    108.000000 MHz
    DMT 0x55:  1280x720    60.000000 Hz  16:9     45.000 kHz     74.250000 MHz
    DMT 0x53:  1600x900    60.000000 Hz  16:9     60.000 kHz    108.000000 MHz (RB)
    DMT 0x52:  1920x1080   60.000000 Hz  16:9     67.500 kHz    148.500000 MHz
    DMT 0x1c:  1280x800    59.810326 Hz  16:10    49.702 kHz     83.500000 MHz
  Detailed Timing Descriptors:
    DTD 1:  3440x1440   59.972616 Hz  43:18    88.819 kHz    319.750000 MHz (800 mm x 330 mm)
                 Hfront   48 Hsync  32 Hback   80 Hpol P
                 Vfront    3 Vsync  10 Vback   28 Vpol N
    DTD 2:  3440x1440   49.986808 Hz  43:18    73.681 kHz    265.250000 MHz (800 mm x 330 mm)
                 Hfront   48 Hsync  32 Hback   80 Hpol P
                 Vfront    3 Vsync  10 Vback   21 Vpol N
    Display Range Limits:
      Monitor ranges (GTF): 48-61 Hz V, 30-135 kHz H, max dotclock 760 MHz
    Display Product Name: 'LG HDR 5K'
  Extension blocks: 2
Checksum: 0xb3

----------------

Block 1, CTA-861 Extension Block:
  Revision: 3
  Basic audio support
  Supports YCbCr 4:4:4
  Supports YCbCr 4:2:2
  Native DTDs: 1
  Video Data Block:
    VIC  16:  1920x1080   60.000000 Hz  16:9     67.500 kHz    148.500000 MHz (native)
    VIC   4:  1280x720    60.000000 Hz  16:9     45.000 kHz     74.250000 MHz
    VIC   3:   720x480    59.940060 Hz  16:9     31.469 kHz     27.000000 MHz
    VIC   1:   640x480    59.940476 Hz   4:3     31.469 kHz     25.175000 MHz
  Audio Data Block:
    Linear PCM:
      Max channels: 2
      Supported sample rates (kHz): 48 44.1 32
      Supported sample sizes (bits): 24 20 16
  Speaker Allocation Data Block:
    FL/FR - Front Left/Right
  Colorimetry Data Block:
    BT2020YCC
    BT2020RGB
  HDR Static Metadata Data Block:
    Electro optical transfer functions:
      Traditional gamma - SDR luminance range
      SMPTE ST2084
    Supported static metadata descriptors:
      Static metadata type 1
  Detailed Timing Descriptors:
    DTD 3:  3840x2160   59.996625 Hz  16:9    133.312 kHz    533.250000 MHz (800 mm x 330 mm)
                 Hfront   48 Hsync  32 Hback   80 Hpol P
                 Vfront   54 Vsync   5 Vback    3 Vpol N
    DTD 4:  3840x2160   30.000000 Hz  16:9     66.660 kHz    266.640000 MHz (800 mm x 330 mm)
                 Hfront    8 Hsync 144 Hback    8 Hpol P
                 Vfront   54 Vsync   5 Vback    3 Vpol N
Checksum: 0xe3  Unused space in Extension Block: 66 bytes

----------------

Block 2, DisplayID Extension Block:
  Version: 1.2
  Extension Count: 0
  Display Product Type: Standalone display device
  Video Timing Modes Type 1 - Detailed Timings Data Block:
    DTD:  5120x2160   60.000253 Hz  64:27   133.321 kHz    730.730000 MHz (aspect 64:27, no 3D stereo, preferred)
               Hfront   25 Hsync  97 Hback  239 Hpol P
               Vfront   48 Vsync   9 Vback    5 Vpol N
    DTD:  5120x2160   30.000537 Hz  64:27    66.661 kHz    365.370000 MHz (aspect 64:27, no 3D stereo, preferred)
               Hfront   25 Hsync  97 Hback  239 Hpol P
               Vfront   48 Vsync   9 Vback    5 Vpol N
  Checksum: 0xab
Checksum: 0x90

----------------

Warnings:

Block 0, Base EDID:
  Display Range Limits: GTF support is deprecated in EDID 1.4.
Block 1, CTA-861 Extension Block:
  IT Video Formats are overscanned by default, but normally this should be underscanned.
  Video Data Block: VIC 16 and the first DTD are not identical. Is this intended?
  Detailed Timing Descriptor #3: Image size is 800x330 mm, but based on the picture AR it should be 586x330 mm.
  Detailed Timing Descriptor #4: Image size is 800x330 mm, but based on the picture AR it should be 586x330 mm.
EDID:
  Base EDID: Some timings are out of range of the Monitor Ranges:
    Vertical Freq: 30.000 - 60.317 Hz (Monitor: 48.000 - 61.000 Hz)

Failures:

Block 0, Base EDID:
  Basic Display Parameters & Features: sRGB is signaled, but the chromaticities do not match.
  Display Range Limits: GTF is supported, but the display does not support continuous frequencies.
Block 1, CTA-861 Extension Block:
  Missing VCDB, needed for Set Selectable RGB Quantization to avoid interop issues.
EDID:
  Extension Block 3 started with EDID header, ignoring Extension Blocks >= 3.
  CTA-861: Native progressive timings are a mix of several resolutions.
  DisplayID: Missing DisplayID Display Parameters Data Block.

EDID conformity: FAIL
