edid-decode (hex):

00 ff ff ff ff ff ff 00 04 72 58 09 5c 03 00 00
26 1f 01 03 80 35 1e 78 2a b5 d1 ae 4e 44 a9 25
13 50 54 bf ef 80 45 40 b3 00 95 00 81 80 71 4f
81 c0 81 40 a9 40 02 3a 80 18 71 38 2d 40 58 2c
45 00 0a 26 21 00 00 1e 00 00 00 fd 00 30 90 38
a2 3c 00 0a 20 20 20 20 20 20 00 00 00 fc 00 45
49 32 34 32 51 52 20 50 0a 20 20 20 00 00 00 ff
00 54 4b 30 53 41 30 30 31 33 5a 30 31 0a 01 d6

02 03 43 f1 4d 01 03 04 05 02 12 13 14 1f 20 21
22 3f 23 09 7f 07 83 01 00 00 68 03 0c 00 10 00
38 42 00 67 d8 5d c4 01 78 80 03 6d 1a 00 00 02
11 30 90 ed 00 00 00 00 00 e2 0f 01 e6 01 02 00
04 00 11 df 81 80 a0 70 38 1e 40 18 20 35 00 0a
26 21 00 00 1a 8a 6f 80 a0 70 38 40 40 18 20 35
00 0a 26 21 00 00 1a b2 20 c0 18 31 38 2d 40 58
2c 35 00 0a 26 21 00 00 1a 00 00 00 00 00 00 8c

00 ff ff ff ff ff ff 00 04 72 58 09 5c 03 00 00
26 1f 01 03 80 35 1e 78 2a b5 d1 ae 4e 44 a9 25
13 50 54 bf ef 80 45 40 b3 00 95 00 81 80 71 4f
81 c0 81 40 a9 40 02 3a 80 18 71 38 2d 40 58 2c
45 00 0a 26 21 00 00 1e 00 00 00 fd 00 30 90 38
a2 3c 00 0a 20 20 20 20 20 20 00 00 00 fc 00 45
49 32 34 32 51 52 20 50 0a 20 20 20 00 00 00 ff
00 54 4b 30 53 41 30 30 31 33 5a 30 31 0a 01 d6

02 03 43 f1 4d 01 03 04 05 02 12 13 14 1f 20 21
22 3f 23 09 7f 07 83 01 00 00 68 03 0c 00 10 00
38 42 00 67 d8 5d c4 01 78 80 03 6d 1a 00 00 02
11 30 90 ed 00 00 00 00 00 e2 0f 01 e6 01 02 00
04 00 11 df 81 80 a0 70 38 1e 40 18 20 35 00 0a
26 21 00 00 1a 8a 6f 80 a0 70 38 40 40 18 20 35
00 0a 26 21 00 00 1a b2 20 c0 18 31 38 2d 40 58
2c 35 00 0a 26 21 00 00 1a 00 00 00 00 00 00 8c

----------------

Block 0, Base EDID:
  EDID Structure Version & Revision: 1.3
  Vendor & Product Identification:
    Manufacturer: ACR
    Model: 2392
    Serial Number: ...
    Made in: week 38 of 2021
  Basic Display Parameters & Features:
    Digital display
    Maximum image size: 53 cm x 30 cm
    Gamma: 2.20
    DPMS levels: Off
    RGB color display
    First detailed timing is the preferred timing
  Color Characteristics:
    Red  : 0.6816, 0.3076
    Green: 0.2666, 0.6611
    Blue : 0.1474, 0.0751
    White: 0.3125, 0.3291
  Established Timings I & II:
    IBM     :   720x400    70.081663 Hz   9:5     31.467 kHz     28.320000 MHz
    DMT 0x04:   640x480    59.940476 Hz   4:3     31.469 kHz     25.175000 MHz
    Apple   :   640x480    66.666667 Hz   4:3     35.000 kHz     30.240000 MHz
    DMT 0x05:   640x480    72.808802 Hz   4:3     37.861 kHz     31.500000 MHz
    DMT 0x06:   640x480    75.000000 Hz   4:3     37.500 kHz     31.500000 MHz
    DMT 0x08:   800x600    56.250000 Hz   4:3     35.156 kHz     36.000000 MHz
    DMT 0x09:   800x600    60.316541 Hz   4:3     37.879 kHz     40.000000 MHz
    DMT 0x0a:   800x600    72.187572 Hz   4:3     48.077 kHz     50.000000 MHz
    DMT 0x0b:   800x600    75.000000 Hz   4:3     46.875 kHz     49.500000 MHz
    Apple   :   832x624    74.551266 Hz   4:3     49.726 kHz     57.284000 MHz
    DMT 0x10:  1024x768    60.003840 Hz   4:3     48.363 kHz     65.000000 MHz
    DMT 0x11:  1024x768    70.069359 Hz   4:3     56.476 kHz     75.000000 MHz
    DMT 0x12:  1024x768    75.028582 Hz   4:3     60.023 kHz     78.750000 MHz
    DMT 0x24:  1280x1024   75.024675 Hz   5:4     79.976 kHz    135.000000 MHz
    Apple   :  1152x870    75.061550 Hz 192:145   68.681 kHz    100.000000 MHz
  Standard Timings:
    DMT 0x09:   800x600    60.316541 Hz   4:3     37.879 kHz     40.000000 MHz
    DMT 0x3a:  1680x1050   59.954250 Hz  16:10    65.290 kHz    146.250000 MHz
    DMT 0x2f:  1440x900    59.887445 Hz  16:10    55.935 kHz    106.500000 MHz
    DMT 0x23:  1280x1024   60.019740 Hz   5:4     63.981 kHz    108.000000 MHz
    DMT 0x15:  1152x864    75.000000 Hz   4:3     67.500 kHz    108.000000 MHz
    DMT 0x55:  1280x720    60.000000 Hz  16:9     45.000 kHz     74.250000 MHz
    DMT 0x20:  1280x960    60.000000 Hz   4:3     60.000 kHz    108.000000 MHz
    DMT 0x33:  1600x1200   60.000000 Hz   4:3     75.000 kHz    162.000000 MHz
  Detailed Timing Descriptors:
    DTD 1:  1920x1080   60.000000 Hz  16:9     67.500 kHz    148.500000 MHz (522 mm x 294 mm)
                 Hfront   88 Hsync  44 Hback  148 Hpol P
                 Vfront    4 Vsync   5 Vback   36 Vpol P
    Display Range Limits:
      Monitor ranges (GTF): 48-144 Hz V, 56-162 kHz H, max dotclock 600 MHz
    Display Product Name: 'EI242QR P'
    Display Product Serial Number: ...
  Extension blocks: 1
Checksum: 0xd6

----------------

Block 1, CTA-861 Extension Block:
  Revision: 3
  Underscans IT Video Formats by default
  Basic audio support
  Supports YCbCr 4:4:4
  Supports YCbCr 4:2:2
  Native DTDs: 1
  Video Data Block:
    VIC   1:   640x480    59.940476 Hz   4:3     31.469 kHz     25.175000 MHz
    VIC   3:   720x480    59.940060 Hz  16:9     31.469 kHz     27.000000 MHz
    VIC   4:  1280x720    60.000000 Hz  16:9     45.000 kHz     74.250000 MHz
    VIC   5:  1920x1080i  60.000000 Hz  16:9     33.750 kHz     74.250000 MHz
    VIC   2:   720x480    59.940060 Hz   4:3     31.469 kHz     27.000000 MHz
    VIC  18:   720x576    50.000000 Hz  16:9     31.250 kHz     27.000000 MHz
    VIC  19:  1280x720    50.000000 Hz  16:9     37.500 kHz     74.250000 MHz
    VIC  20:  1920x1080i  50.000000 Hz  16:9     28.125 kHz     74.250000 MHz
    VIC  31:  1920x1080   50.000000 Hz  16:9     56.250 kHz    148.500000 MHz
    VIC  32:  1920x1080   24.000000 Hz  16:9     27.000 kHz     74.250000 MHz
    VIC  33:  1920x1080   25.000000 Hz  16:9     28.125 kHz     74.250000 MHz
    VIC  34:  1920x1080   30.000000 Hz  16:9     33.750 kHz     74.250000 MHz
    VIC  63:  1920x1080  120.000000 Hz  16:9    135.000 kHz    297.000000 MHz
  Audio Data Block:
    Linear PCM:
      Max channels: 2
      Supported sample rates (kHz): 192 176.4 96 88.2 48 44.1 32
      Supported sample sizes (bits): 24 20 16
  Speaker Allocation Data Block:
    FL/FR - Front Left/Right
  Vendor-Specific Data Block (HDMI), OUI 00-0C-03:
    Source physical address: 1.0.0.0
    DC_36bit
    DC_30bit
    DC_Y444
    Maximum TMDS clock: 330 MHz
  Vendor-Specific Data Block (HDMI Forum), OUI C4-5D-D8:
    Version: 1
    Maximum TMDS Character Rate: 600 MHz
    SCDC Present
    Supports 12-bits/component Deep Color 4:2:0 Pixel Encoding
    Supports 10-bits/component Deep Color 4:2:0 Pixel Encoding
  Vendor-Specific Data Block (AMD), OUI 00-00-1A:
    Version: 2
    Flags 1: 0x11
      FreeSync Supported
    Minimum Refresh Rate: 48 Hz
    Maximum Refresh Rate: 144 Hz
    MCCS VCP Code: 0xed
    Flags 5: 0x00
  YCbCr 4:2:0 Capability Map Data Block:
    VIC   1:   640x480    59.940476 Hz   4:3     31.469 kHz     25.175000 MHz
  Vendor-Specific Video Data Block, OUI 04-00-02:
    00 11                                           '..'
  Detailed Timing Descriptors:
    DTD 2:  1920x1080  144.001213 Hz  16:9    159.841 kHz    332.470000 MHz (522 mm x 294 mm)
                 Hfront   24 Hsync  32 Hback  104 Hpol P
                 Vfront    3 Vsync   5 Vback   22 Vpol N
    DTD 3:  1920x1080  119.998991 Hz  16:9    137.279 kHz    285.540000 MHz (522 mm x 294 mm)
                 Hfront   24 Hsync  32 Hback  104 Hpol P
                 Vfront    3 Vsync   5 Vback   56 Vpol N
    DTD 4:   960x1080   60.000000 Hz   8:9     67.500 kHz     83.700000 MHz (522 mm x 294 mm)
                 Hfront   88 Hsync  44 Hback  148 Hpol P
                 Vfront    3 Vsync   5 Vback   37 Vpol N
Checksum: 0x8c  Unused space in Extension Block: 6 bytes

----------------

Warnings:

Block 0, Base EDID:
  Detailed Timing Descriptor #1: DTD is identical to VIC 16, which is not present in the CTA Ext Block.
Block 1, CTA-861 Extension Block:
  Video Data Block: VIC 1 and the first DTD are not identical. Is this intended?
  YCbCr 4:2:0 Capability Map Data Block: Some YCbCr 4:2:0 timings are invalid for HDMI 2.1 (which requires an RGB timings pixel rate >= 590 MHz).
  Detailed Timing Descriptor #4: Image size is 522x294 mm, but based on the picture AR it should be 261x294 mm.
  Display Product Serial Number is set, so the Serial Number in the Base EDID should be 0.
  Add a Colorimetry Data Block with the sRGB colorimetry bit set to avoid interop issues.
EDID:
  Base EDID: Some timings are out of range of the Monitor Ranges:
    Vertical Freq: 24.000 - 144.001 Hz (Monitor: 48.000 - 144.000 Hz)
    Horizontal Freq: 15.734 - 159.841 kHz (Monitor: 56.000 - 162.000 kHz)

Failures:

Block 1, CTA-861 Extension Block:
  Missing VCDB, needed for Set Selectable RGB Quantization to avoid interop issues.
EDID:
  Extension Block 2 started with EDID header, ignoring Extension Blocks >= 2.

EDID conformity: FAIL
