edid-decode (hex):

00 ff ff ff ff ff ff 00 12 6c 10 00 bc 02 00 00
0a 14 01 03 80 08 05 78 ea ee 91 a3 54 4c 99 26
0f 50 54 00 00 00 01 01 01 01 01 01 01 01 01 01
01 01 01 01 01 01 2c 15 00 40 41 58 49 20 18 88
23 00 99 5a 00 00 00 1e 00 00 00 fd 00 37 41 23
2d 06 00 0a 20 20 20 20 20 20 00 00 00 fc 00 44
69 73 70 6c 61 79 6c 69 6e 6b 0a 0a 00 00 00 ff
00 4d 54 31 32 30 39 35 30 30 30 36 32 0a 00 42

00 ff ff ff ff ff ff 00 12 6c 10 00 bc 02 00 00
0a 14 01 03 80 08 05 78 ea ee 91 a3 54 4c 99 26
0f 50 54 00 00 00 01 01 01 01 01 01 01 01 01 01
01 01 01 01 01 01 2c 15 00 40 41 58 49 20 18 88
23 00 99 5a 00 00 00 1e 00 00 00 fd 00 37 41 23
2d 06 00 0a 20 20 20 20 20 20 00 00 00 fc 00 44
69 73 70 6c 61 79 6c 69 6e 6b 0a 0a 00 00 00 ff
00 4d 54 31 32 30 39 35 30 30 30 36 32 0a 00 42

----------------

Block 0, Base EDID:
  EDID Structure Version & Revision: 1.3
  Vendor & Product Identification:
    Manufacturer: DSL
    Model: 16
    Serial Number: ...
    Made in: week 10 of 2010
  Basic Display Parameters & Features:
    Digital display
    Maximum image size: 8 cm x 5 cm
    Gamma: 2.20
    DPMS levels: Standby Suspend Off
    RGB color display
    First detailed timing is the preferred timing
  Color Characteristics:
    Red  : 0.6396, 0.3300
    Green: 0.2998, 0.5996
    Blue : 0.1503, 0.0595
    White: 0.3125, 0.3291
  Established Timings I & II: none
  Standard Timings: none
  Detailed Timing Descriptors:
    DTD 1:  1024x600    59.921814 Hz 128:75    40.327 kHz     54.200000 MHz (153 mm x 90 mm)
                 Hfront   24 Hsync 136 Hback  160 Hpol P
                 Vfront    2 Vsync   3 Vback   68 Vpol P
    Display Range Limits:
      Monitor ranges (GTF): 55-65 Hz V, 35-45 kHz H, max dotclock 60 MHz
    Display Product Name: 'Displaylink'
    Display Product Serial Number: ...
Checksum: 0x42

----------------

Warnings:

Block 0, Base EDID:
  Basic Display Parameters & Features: Dubious maximum image size (8x5 is smaller than 10x10 cm).
  Detailed Timing Descriptor #1: Dubious image size (153x90 mm is smaller than 100x100 mm).

Failures:

Block 0, Base EDID:
  Basic Display Parameters & Features: The chromaticities match sRGB, but sRGB is not signaled.
  Detailed Timing Descriptor #1: Mismatch of image size 153x90 mm vs display size 80x50 mm.
  Display Product Name: Non-space after newline.
EDID:
  Extension Block 1 started with EDID header, ignoring Extension Blocks >= 1.
  Base EDID: The DTD max image size is 153x90mm, which is larger than the display size 80.0x50.0mm.

EDID conformity: FAIL
