edid-decode (hex):

00 ff ff ff ff ff ff 00 0e d4 01 00 00 00 00 00
0c 14 01 04 08 58 31 78 0a ee 9d a3 54 4c 99 26
0f 4f 54 a1 08 00 95 00 b3 00 01 01 01 01 01 01
01 01 01 01 01 01 02 3a 80 18 71 38 2d 40 58 2c
45 00 70 ea 31 00 00 1e 66 21 50 b0 51 00 1b 30
40 70 36 00 70 ea 31 00 00 1e 00 00 00 fd 00 3b
47 1e 50 0f 00 0a 20 20 20 20 20 20 00 00 00 fc
00 4c 43 44 20 54 56 0a 0a 0a 0a 0a 0a 0a 00 fc

00 ff ff ff ff ff ff 00 0e d4 01 00 00 00 00 00
0c 14 01 04 08 58 31 78 0a ee 9d a3 54 4c 99 26
0f 4f 54 a1 08 00 95 00 b3 00 01 01 01 01 01 01
01 01 01 01 01 01 02 3a 80 18 71 38 2d 40 58 2c
45 00 70 ea 31 00 00 1e 66 21 50 b0 51 00 1b 30
40 70 36 00 70 ea 31 00 00 1e 00 00 00 fd 00 3b
47 1e 50 0f 00 0a 20 20 20 20 20 20 00 00 00 fc
00 4c 43 44 20 54 56 0a 0a 0a 0a 0a 0a 0a 00 fc

----------------

Block 0, Base EDID:
  EDID Structure Version & Revision: 1.4
  Vendor & Product Identification:
    Manufacturer: CVT
    Model: 1
    Made in: week 12 of 2010
  Basic Display Parameters & Features:
    Analog display
    Signal Level Standard: 0.700 : 0.300 : 1.000 V p-p
    Blank level equals black level
    Sync: Separate
    Maximum image size: 88 cm x 49 cm
    Gamma: 2.20
    RGB color display
    First detailed timing includes the native pixel format and preferred refresh rate
  Color Characteristics:
    Red  : 0.6396, 0.3300
    Green: 0.2998, 0.5996
    Blue : 0.1503, 0.0595
    White: 0.3115, 0.3291
  Established Timings I & II:
    IBM     :   720x400    70.081663 Hz   9:5     31.467 kHz     28.320000 MHz
    DMT 0x04:   640x480    59.940476 Hz   4:3     31.469 kHz     25.175000 MHz
    DMT 0x09:   800x600    60.316541 Hz   4:3     37.879 kHz     40.000000 MHz
    DMT 0x10:  1024x768    60.003840 Hz   4:3     48.363 kHz     65.000000 MHz
  Standard Timings:
    DMT 0x2f:  1440x900    59.887445 Hz  16:10    55.935 kHz    106.500000 MHz
    DMT 0x3a:  1680x1050   59.954250 Hz  16:10    65.290 kHz    146.250000 MHz
  Detailed Timing Descriptors:
    DTD 1:  1920x1080   60.000000 Hz  16:9     67.500 kHz    148.500000 MHz (880 mm x 490 mm)
                 Hfront   88 Hsync  44 Hback  148 Hpol P
                 Vfront    4 Vsync   5 Vback   36 Vpol P
    DTD 2:  1360x768    60.015162 Hz  85:48    47.712 kHz     85.500000 MHz (880 mm x 490 mm)
                 Hfront   64 Hsync 112 Hback  256 Hpol P
                 Vfront    3 Vsync   6 Vback   18 Vpol P
    Display Range Limits:
      Monitor ranges (GTF): 59-71 Hz V, 30-80 kHz H, max dotclock 150 MHz
    Display Product Name: 'LCD TV'
Checksum: 0xfc

----------------

Warnings:

Block 0, Base EDID:
  Display Range Limits: GTF support is deprecated in EDID 1.4.

Failures:

Block 0, Base EDID:
  Display Range Limits: GTF is supported, but the display does not support continuous frequencies.
  Display Product Name: Non-space after newline.
EDID:
  Extension Block 1 started with EDID header, ignoring Extension Blocks >= 1.

EDID conformity: FAIL
