edid-decode (hex):

00 ff ff ff ff ff ff 00 1e 6d 89 9e 7e 86 07 00
0c 21 01 04 c5 77 22 78 f9 f1 25 ac 50 42 ab 27
12 50 54 21 09 00 d1 c0 61 40 01 01 01 01 01 01
01 01 01 01 01 01 74 d6 00 a0 f0 38 40 40 30 20
3a 00 a8 4f 41 00 00 1a 00 00 00 fd 0c 60 f0 91
91 d2 01 0a 20 20 20 20 20 20 00 00 00 fc 00 4c
47 20 55 4c 54 52 41 47 45 41 52 2b 00 00 00 ff
00 33 31 32 4e 54 52 4c 45 48 31 38 32 0a 02 f4

02 03 2a 70 23 0f 07 07 83 01 00 00 41 3f e3 05
c0 00 e6 06 05 01 8b 7d 12 e2 00 6a 6d 1a 00 00
02 0b 60 f0 00 04 8b 12 7d 15 f4 b0 00 a0 f0 38
35 40 30 20 3a 00 a8 4f 41 00 00 1a 00 00 00 00
00 00 00 00 00 00 00 00 00 00 00 00 00 00 00 00
00 00 00 00 00 00 00 00 00 00 00 00 00 00 00 00
00 00 00 00 00 00 00 00 00 00 00 00 00 00 00 00
00 00 00 00 00 00 00 00 00 00 00 00 00 00 00 49

70 12 79 03 00 01 00 0c 90 2e 16 0d 00 14 a0 05
90 78 ff bb 0f 00 0a a4 14 0e 0e 07 01 23 00 00
00 03 01 50 5d 21 03 88 ff 13 9f 00 2f 80 1f 00
9f 05 b2 00 02 00 09 00 33 ca 01 08 ff 13 9f 00
2f 80 1f 00 9f 05 66 00 02 00 09 00 57 79 01 08
ff 13 9f 00 2f 80 1f 00 9f 05 54 00 02 00 09 00
33 b7 00 08 ff 13 9f 00 2f 80 1f 00 9f 05 28 00
02 00 09 00 00 00 00 00 00 00 00 00 00 00 77 90

00 ff ff ff ff ff ff 00 1e 6d 89 9e 7e 86 07 00
0c 21 01 04 c5 77 22 78 f9 f1 25 ac 50 42 ab 27
12 50 54 21 09 00 d1 c0 61 40 01 01 01 01 01 01
01 01 01 01 01 01 74 d6 00 a0 f0 38 40 40 30 20
3a 00 a8 4f 41 00 00 1a 00 00 00 fd 0c 60 f0 91
91 d2 01 0a 20 20 20 20 20 20 00 00 00 fc 00 4c
47 20 55 4c 54 52 41 47 45 41 52 2b 00 00 00 ff
00 33 31 32 4e 54 52 4c 45 48 31 38 32 0a 02 f4

02 03 2a 70 23 0f 07 07 83 01 00 00 41 3f e3 05
c0 00 e6 06 05 01 8b 7d 12 e2 00 6a 6d 1a 00 00
02 0b 60 f0 00 04 8b 12 7d 15 f4 b0 00 a0 f0 38
35 40 30 20 3a 00 a8 4f 41 00 00 1a 00 00 00 00
00 00 00 00 00 00 00 00 00 00 00 00 00 00 00 00
00 00 00 00 00 00 00 00 00 00 00 00 00 00 00 00
00 00 00 00 00 00 00 00 00 00 00 00 00 00 00 00
00 00 00 00 00 00 00 00 00 00 00 00 00 00 00 49

70 12 79 03 00 01 00 0c 90 2e 16 0d 00 14 a0 05
90 78 ff bb 0f 00 0a a4 14 0e 0e 07 01 23 00 00
00 03 01 50 5d 21 03 88 ff 13 9f 00 2f 80 1f 00
9f 05 b2 00 02 00 09 00 33 ca 01 08 ff 13 9f 00
2f 80 1f 00 9f 05 66 00 02 00 09 00 57 79 01 08
ff 13 9f 00 2f 80 1f 00 9f 05 54 00 02 00 09 00
33 b7 00 08 ff 13 9f 00 2f 80 1f 00 9f 05 28 00
02 00 09 00 00 00 00 00 00 00 00 00 00 00 77 90

----------------

Block 0, Base EDID:
  EDID Structure Version & Revision: 1.4
  Vendor & Product Identification:
    Manufacturer: GSM
    Model: 40585
    Serial Number: ...
    Made in: week 12 of 2023
  Basic Display Parameters & Features:
    Digital display
    Bits per primary color channel: 12
    DisplayPort interface
    Maximum image size: 119 cm x 34 cm
    Gamma: 2.20
    DPMS levels: Standby Suspend Off
    Supported color formats: RGB 4:4:4, YCrCb 4:4:4, YCrCb 4:2:2
    First detailed timing does not include the native pixel format and preferred refresh rate
    Display supports continuous frequencies
  Color Characteristics:
    Red  : 0.6748, 0.3154
    Green: 0.2578, 0.6689
    Blue : 0.1523, 0.0722
    White: 0.3134, 0.3291
  Established Timings I & II:
    DMT 0x04:   640x480    59.940476 Hz   4:3     31.469 kHz     25.175000 MHz
    DMT 0x09:   800x600    60.316541 Hz   4:3     37.879 kHz     40.000000 MHz
    DMT 0x10:  1024x768    60.003840 Hz   4:3     48.363 kHz     65.000000 MHz
    DMT 0x24:  1280x1024   75.024675 Hz   5:4     79.976 kHz    135.000000 MHz
  Standard Timings:
    DMT 0x52:  1920x1080   60.000000 Hz  16:9     67.500 kHz    148.500000 MHz
    DMT 0x10:  1024x768    60.003840 Hz   4:3     48.363 kHz     65.000000 MHz
  Detailed Timing Descriptors:
    DTD 1:  3840x1080  119.973776 Hz  32:9    137.250 kHz    549.000000 MHz (1192 mm x 335 mm)
                 Hfront   48 Hsync  32 Hback   80 Hpol P
                 Vfront    3 Vsync  10 Vback   51 Vpol N
    Display Range Limits:
      Monitor ranges (Range Limits Only): 96-240 Hz V, 400-400 kHz H, max dotclock 2100 MHz
    Display Product Name: 'LG ULTRAGEAR+'
    Display Product Serial Number: ...
  Extension blocks: 2
Checksum: 0xf4

----------------

Block 1, CTA-861 Extension Block:
  Revision: 3
  Basic audio support
  Supports YCbCr 4:4:4
  Supports YCbCr 4:2:2
  Native DTDs: 0
  Audio Data Block:
    Linear PCM:
      Max channels: 8
      Supported sample rates (kHz): 48 44.1 32
      Supported sample sizes (bits): 24 20 16
  Speaker Allocation Data Block:
    FL/FR - Front Left/Right
  Video Data Block:
    VIC  63:  1920x1080  120.000000 Hz  16:9    135.000 kHz    297.000000 MHz
  Colorimetry Data Block:
    BT2020YCC
    BT2020RGB
  HDR Static Metadata Data Block:
    Electro optical transfer functions:
      Traditional gamma - SDR luminance range
      SMPTE ST2084
    Supported static metadata descriptors:
      Static metadata type 1
    Desired content max luminance: 139 (1015.241 cd/m^2)
    Desired content max frame-average luminance: 125 (749.667 cd/m^2)
    Desired content min luminance: 18 (0.051 cd/m^2)
  Video Capability Data Block:
    YCbCr quantization: No Data
    RGB quantization: Selectable (via AVI Q)
    PT scan behavior: Always Underscanned
    IT scan behavior: Always Underscanned
    CE scan behavior: Always Underscanned
  Vendor-Specific Data Block (AMD), OUI 00-00-1A:
    Version: 2
    Feature Caps: 0x0b
      Local Dimming Supported
    Minimum Refresh Rate: 96 Hz
    Maximum Refresh Rate: 240 Hz
    Flags 1.x: 0x00
    Flags 2.x: 0x04
      ST 2084 (PQ) EOTF Supported
      Linear EOTF (Windows scRGB, 0.0 - 125.0) Supported
      Gamma 2.2 EOTF Supported
      BT.2020 Gamut Supported
    Maximum luminance: 139 (1015.241 cd/m^2)
    Minimum luminance: 18 (0.051 cd/m^2)
    Maximum luminance (without local dimming): 125 (749.667 cd/m^2)
    Minimum luminance (without local dimming): 21 (0.051 cd/m^2)
  Detailed Timing Descriptors:
    DTD 2:  3840x1080   99.955869 Hz  32:9    113.250 kHz    453.000000 MHz (1192 mm x 335 mm)
                 Hfront   48 Hsync  32 Hback   80 Hpol P
                 Vfront    3 Vsync  10 Vback   40 Vpol N
Checksum: 0x49  Unused space in Extension Block: 67 bytes

----------------

Block 2, DisplayID Extension Block:
  Version: 1.2
  Extension Count: 0
  Display Product Type: Standalone display device
  Display Parameters Data Block (0x01):
    Image size: 1192.0 mm x 335.0 mm
    Display native pixel format: 5120x1440
    Feature support flags:
      Power management (DPM)
      Audio support on video interface
    Gamma: 2.20
    Aspect ratio: 3.55
    Dynamic bpc native: 12
    Dynamic bpc overall: 12
  Display Interface Data Block:
    Interface Type: DisplayPort
    Number of Links: 4
    Interface Standard Version: 1.4
    Supported bpc for RGB encoding: 8, 10, 12
    Supported bpc for YCbCr 4:4:4 encoding: 8, 10, 12
    Supported bpc for YCbCr 4:2:2 encoding: 8, 10, 12
    Supported Content Protection: HDCP 2.3
    Spread Spectrum: None
  Video Timing Modes Type 1 - Detailed Timings Data Block:
    DTD:  5120x1440  239.988676 Hz   0:0    388.542 kHz   2051.500000 MHz (aspect undefined, no 3D stereo, preferred)
               Hfront   48 Hsync  32 Hback   80 Hpol P
               Vfront    3 Vsync  10 Vback  166 Vpol N
    DTD:  5120x1440  143.978672 Hz   0:0    222.159 kHz   1173.000000 MHz (aspect undefined, no 3D stereo)
               Hfront   48 Hsync  32 Hback   80 Hpol P
               Vfront    3 Vsync  10 Vback   90 Vpol N
    DTD:  5120x1440  119.970194 Hz   0:0    182.955 kHz    966.000000 MHz (aspect undefined, no 3D stereo)
               Hfront   48 Hsync  32 Hback   80 Hpol P
               Vfront    3 Vsync  10 Vback   72 Vpol N
    DTD:  5120x1440   59.976879 Hz   0:0     88.826 kHz    469.000000 MHz (aspect undefined, no 3D stereo)
               Hfront   48 Hsync  32 Hback   80 Hpol P
               Vfront    3 Vsync  10 Vback   28 Vpol N
  Checksum: 0x77
Checksum: 0x90

----------------

Warnings:

Block 1, CTA-861 Extension Block:
  IT Video Formats are overscanned by default, but normally this should be underscanned.
  Video Data Block: VIC 63 and the first DTD are not identical. Is this intended?
  Colorimetry Data Block: Set the sRGB colorimetry bit to avoid interop issues.
  Video Capability Data Block: Set Selectable YCbCr Quantization to avoid interop issues.
  Video Capability Data Block: S_PT is equal to S_IT and S_CE, so should be set to 0 instead.
  Display Product Serial Number is set, so the Serial Number in the Base EDID should be 0.
EDID:
  Base EDID: Some timings are out of range of the Monitor Ranges:
    Vertical Freq: 59.940 - 239.989 Hz (Monitor: 96.000 - 240.000 Hz)
    Horizontal Freq: 31.468 - 388.541 kHz (Monitor: 400.000 - 400.000 kHz)

Failures:

Block 1, CTA-861 Extension Block:
  Video Capability Data Block: IT video formats are always underscanned, but bit 7 of Byte 3 of the CTA-861 Extension header is set to overscanned.
EDID:
  Extension Block 3 started with EDID header, ignoring Extension Blocks >= 3.

EDID conformity: FAIL
