edid-decode (hex):

00 ff ff ff ff ff ff 00 0e 6f 0f 13 00 00 00 00
00 1e 01 04 a5 1d 10 78 03 04 18 a6 56 4e 9f 27
0f 4e 53 00 00 00 01 01 01 01 01 01 01 01 01 01
01 01 01 01 01 01 36 36 80 a0 70 38 20 40 30 20
35 00 25 a5 10 00 00 18 26 24 80 a0 70 38 20 40
30 20 35 00 25 a5 10 00 00 18 00 00 00 00 00 00
00 00 00 00 00 00 00 00 00 00 00 00 00 00 00 03
00 0c 33 ff 0f 3c 96 08 10 26 96 00 00 00 00 21

00 ff ff ff ff ff ff 00 0e 6f 0f 13 00 00 00 00
00 1e 01 04 a5 1d 10 78 03 04 18 a6 56 4e 9f 27
0f 4e 53 00 00 00 01 01 01 01 01 01 01 01 01 01
01 01 01 01 01 01 36 36 80 a0 70 38 20 40 30 20
35 00 25 a5 10 00 00 18 26 24 80 a0 70 38 20 40
30 20 35 00 25 a5 10 00 00 18 00 00 00 00 00 00
00 00 00 00 00 00 00 00 00 00 00 00 00 00 00 03
00 0c 33 ff 0f 3c 96 08 10 26 96 00 00 00 00 21

----------------

Block 0, Base EDID:
  EDID Structure Version & Revision: 1.4
  Vendor & Product Identification:
    Manufacturer: CSO
    Model: 4879
    Made in: 2020
  Basic Display Parameters & Features:
    Digital display
    Bits per primary color channel: 8
    DisplayPort interface
    Maximum image size: 29 cm x 16 cm
    Gamma: 2.20
    Supported color formats: RGB 4:4:4
    First detailed timing includes the native pixel format and preferred refresh rate
    Display supports continuous frequencies
  Color Characteristics:
    Red  : 0.6484, 0.3359
    Green: 0.3056, 0.6210
    Blue : 0.1523, 0.0595
    White: 0.3066, 0.3242
  Established Timings I & II: none
  Standard Timings: none
  Detailed Timing Descriptors:
    DTD 1:  1920x1080   60.001038 Hz  16:9     66.721 kHz    138.780000 MHz (293 mm x 165 mm)
                 Hfront   48 Hsync  32 Hback   80 Hpol N
                 Vfront    3 Vsync   5 Vback   24 Vpol N
    DTD 2:  1920x1080   40.009339 Hz  16:9     44.490 kHz     92.540000 MHz (293 mm x 165 mm)
                 Hfront   48 Hsync  32 Hback   80 Hpol N
                 Vfront    3 Vsync   5 Vback   24 Vpol N
    Empty Descriptor
    Manufacturer-Specified Display Descriptor (0x03): 00 03 00 0c 33 ff 0f 3c 96 08 10 26 96 00 00 00 '....3..<...&....'
Checksum: 0x21

----------------

Warnings:

Block 0, Base EDID:
  Missing Display Product Name.

Failures:

Block 0, Base EDID:
  Empty Descriptor: Use Dummy Descriptor instead of all zeroes.
  Missing Display Range Limits Descriptor.
EDID:
  Extension Block 1 started with EDID header, ignoring Extension Blocks >= 1.

EDID conformity: FAIL
