edid-decode (hex):

00 ff ff ff ff ff ff 00 22 83 47 1c 9c d4 1e 31
23 0e 01 03 80 21 15 78 0a 2f d6 97 54 4c 8c 23
21 4f 54 00 00 00 01 01 01 01 01 01 01 01 01 01
01 01 01 01 01 01 d5 1b 00 a0 50 20 17 30 30 20
26 00 4b cf 10 00 00 19 00 00 00 0f 00 20 20 20
20 20 20 20 20 a0 ff 02 32 00 00 00 00 fe 00 57
00 07 06 03 01 33 39 38 39 46 41 20 00 00 00 fe
00 d4 b7 a7 99 82 70 53 2a 01 00 0a 20 20 00 c4

----------------

Block 0, Base EDID:
  EDID Structure Version & Revision: 1.3
  Vendor & Product Identification:
    Manufacturer: HTC
    Model: 7239
    Serial Number: ...
    Made in: week 35 of 2004
  Basic Display Parameters & Features:
    Digital display
    Maximum image size: 33 cm x 21 cm
    Gamma: 2.20
    RGB color display
    First detailed timing is the preferred timing
  Color Characteristics:
    Red  : 0.5898, 0.3300
    Green: 0.2998, 0.5498
    Blue : 0.1396, 0.1298
    White: 0.3095, 0.3300
  Established Timings I & II: none
  Standard Timings: none
  Detailed Timing Descriptors:
    DTD 1:  1280x800    60.120494 Hz  16:10    49.479 kHz     71.250000 MHz (331 mm x 207 mm)
                 Hfront   48 Hsync  32 Hback   80 Hpol N
                 Vfront    2 Vsync   6 Vback   15 Vpol N
    Manufacturer-Specified Display Descriptor (0x0f): 00 0f 00 20 20 20 20 20 20 20 20 a0 ff 02 32 00 '...        ...2.'
    Alphanumeric Data String: 'W'
    Alphanumeric Data String: '.....pS*.'
Checksum: 0xc4

----------------

Warnings:

Block 0, Base EDID:
  Alphanumeric Data String: Non-ASCII character 0xd4 at position 0, can cause problems.
  Alphanumeric Data String: Non-ASCII character 0xb7 at position 1, can cause problems.
  Alphanumeric Data String: Non-ASCII character 0xa7 at position 2, can cause problems.
  Alphanumeric Data String: Non-ASCII character 0x99 at position 3, can cause problems.
  Alphanumeric Data String: Non-ASCII character 0x82 at position 4, can cause problems.
  Alphanumeric Data String: Non-ASCII character 0x01 at position 8, can cause problems.

Failures:

Block 0, Base EDID:
  Alphanumeric Data String: NUL byte at position 1.
  Alphanumeric Data String: NUL byte at position 9.
  Missing Display Product Name.
  Missing Display Range Limits Descriptor.

EDID conformity: FAIL
