edid-decode (hex):

00 ff ff ff ff ff ff 00 22 f0 00 85 00 00 00 00
00 19 01 03 00 29 17 78 0e 49 95 a9 54 37 ad 25
13 50 54 3f cb 00 95 00 95 0f 81 00 a9 40 b3 00
01 01 01 01 01 01 66 21 56 b0 51 00 1b 30 00 7a
26 44 00 00 00 00 00 00 e2 1f 80 70 41 60 1f 30
b8 78 b3 04 00 00 00 00 00 00 96 2a 56 c0 51 00
25 30 e0 90 d5 04 00 00 00 00 00 00 7a 39 90 40
62 1a 25 40 20 b8 13 48 00 00 00 00 00 00 00 5a

00 ff ff ff ff ff ff 00 22 f0 00 85 00 00 00 00
00 19 01 03 00 29 17 78 0e 49 95 a9 54 37 ad 25
13 50 54 3f cb 00 95 00 95 0f 81 00 a9 40 b3 00
01 01 01 01 01 01 66 21 56 b0 51 00 1b 30 00 7a
26 44 00 00 00 00 00 00 e2 1f 80 70 41 60 1f 30
b8 78 b3 04 00 00 00 00 00 00 96 2a 56 c0 51 00
25 30 e0 90 d5 04 00 00 00 00 00 00 7a 39 90 40
62 1a 25 40 20 b8 13 48 00 00 00 00 00 00 00 5a

----------------

Block 0, Base EDID:
  EDID Structure Version & Revision: 1.3
  Vendor & Product Identification:
    Manufacturer: HWP
    Model: 34048
    Made in: 2015
  Basic Display Parameters & Features:
    Analog display
    Signal Level Standard: 0.700 : 0.300 : 1.000 V p-p
    Blank level equals black level
    Maximum image size: 41 cm x 23 cm
    Gamma: 2.20
    RGB color display
    Default (sRGB) color space is primary color space
    First detailed timing is the preferred timing
  Color Characteristics:
    Red  : 0.6611, 0.3281
    Green: 0.2167, 0.6767
    Blue : 0.1464, 0.0751
    White: 0.3134, 0.3291
  Established Timings I & II:
    DMT 0x04:   640x480    59.940476 Hz   4:3     31.469 kHz     25.175000 MHz
    Apple   :   640x480    66.666667 Hz   4:3     35.000 kHz     30.240000 MHz
    DMT 0x05:   640x480    72.808802 Hz   4:3     37.861 kHz     31.500000 MHz
    DMT 0x06:   640x480    75.000000 Hz   4:3     37.500 kHz     31.500000 MHz
    DMT 0x08:   800x600    56.250000 Hz   4:3     35.156 kHz     36.000000 MHz
    DMT 0x09:   800x600    60.316541 Hz   4:3     37.879 kHz     40.000000 MHz
    DMT 0x0a:   800x600    72.187572 Hz   4:3     48.077 kHz     50.000000 MHz
    DMT 0x0b:   800x600    75.000000 Hz   4:3     46.875 kHz     49.500000 MHz
    DMT 0x10:  1024x768    60.003840 Hz   4:3     48.363 kHz     65.000000 MHz
    DMT 0x12:  1024x768    75.028582 Hz   4:3     60.023 kHz     78.750000 MHz
    DMT 0x24:  1280x1024   75.024675 Hz   5:4     79.976 kHz    135.000000 MHz
  Standard Timings:
    DMT 0x2f:  1440x900    59.887445 Hz  16:10    55.935 kHz    106.500000 MHz
    DMT 0x30:  1440x900    74.984427 Hz  16:10    70.635 kHz    136.750000 MHz
    DMT 0x1c:  1280x800    59.810326 Hz  16:10    49.702 kHz     83.500000 MHz
    DMT 0x33:  1600x1200   60.000000 Hz   4:3     75.000 kHz    162.000000 MHz
    DMT 0x3a:  1680x1050   59.954250 Hz  16:10    65.290 kHz    146.250000 MHz
  Detailed Timing Descriptors:
    DTD 1:  1366x768    59.814889 Hz 683:384   47.553 kHz     85.500000 MHz (analog composite, sync-on-green)
                 Hfront  256 Hsync 122 Hback   54 Hpol N
                 Vfront   18 Vsync   6 Vback    3 Vpol N
    DTD 2:  1152x864    59.997060 Hz   4:3     53.697 kHz     81.620000 MHz (analog composite, sync-on-green)
                 Hfront  184 Hsync 120 Hback   64 Hpol N
                 Vfront   27 Vsync   3 Vback    1 Vpol N
    DTD 3:  1366x768    74.657426 Hz 683:384   60.099 kHz    109.020000 MHz (analog composite, sync-on-green)
                 Hfront  224 Hsync 144 Hback   80 Hpol N
                 Vfront   29 Vsync   5 Vback    3 Vpol N
    DTD 4:  1680x1050   60.001501 Hz  16:10    65.222 kHz    147.140000 MHz (analog composite, sync-on-green)
                 Hfront  288 Hsync 184 Hback  104 Hpol N
                 Vfront   33 Vsync   3 Vback    1 Vpol N
Checksum: 0x5a

----------------

Failures:

Block 0, Base EDID:
  Basic Display Parameters & Features: sRGB is signaled, but the chromaticities do not match.
  Detailed Timing Descriptor #1: Mismatch of image size vs display size: image size is not set, but display size is.
  Detailed Timing Descriptor #2: Mismatch of image size vs display size: image size is not set, but display size is.
  Detailed Timing Descriptor #3: Mismatch of image size vs display size: image size is not set, but display size is.
  Detailed Timing Descriptor #4: Mismatch of image size vs display size: image size is not set, but display size is.
  Missing Display Product Name.
  Missing Display Range Limits Descriptor.
EDID:
  Extension Block 1 started with EDID header, ignoring Extension Blocks >= 1.

EDID conformity: FAIL
