edid-decode (hex):

00 ff ff ff ff ff ff 00 30 ae 3c 40 00 00 00 00
00 1e 01 04 a5 1e 13 78 e3 ee 95 a3 54 4c 99 26
0f 50 54 00 00 00 01 01 01 01 01 01 01 01 01 01
01 01 01 01 01 01 44 52 c0 a0 80 78 3e 50 30 20
35 00 2c bc 10 00 00 18 00 00 00 fd 00 28 3c 58
58 15 01 0a 20 20 20 20 20 20 00 00 00 0f 00 f9
0a 3c f9 0a 28 1e 0e 00 06 af 95 a1 00 00 00 fe
00 42 31 34 30 51 41 4e 30 35 2e 30 20 0a 00 dc

00 ff ff ff ff ff ff 00 30 ae 3c 40 00 00 00 00
00 1e 01 04 a5 1e 13 78 e3 ee 95 a3 54 4c 99 26
0f 50 54 00 00 00 01 01 01 01 01 01 01 01 01 01
01 01 01 01 01 01 44 52 c0 a0 80 78 3e 50 30 20
35 00 2c bc 10 00 00 18 00 00 00 fd 00 28 3c 58
58 15 01 0a 20 20 20 20 20 20 00 00 00 0f 00 f9
0a 3c f9 0a 28 1e 0e 00 06 af 95 a1 00 00 00 fe
00 42 31 34 30 51 41 4e 30 35 2e 30 20 0a 00 dc

----------------

Block 0, Base EDID:
  EDID Structure Version & Revision: 1.4
  Vendor & Product Identification:
    Manufacturer: LEN
    Model: 16444
    Made in: 2020
  Basic Display Parameters & Features:
    Digital display
    Bits per primary color channel: 8
    DisplayPort interface
    Maximum image size: 30 cm x 19 cm
    Gamma: 2.20
    DPMS levels: Standby Suspend Off
    Supported color formats: RGB 4:4:4
    First detailed timing includes the native pixel format and preferred refresh rate
    Display supports continuous frequencies
  Color Characteristics:
    Red  : 0.6396, 0.3300
    Green: 0.2998, 0.5996
    Blue : 0.1503, 0.0595
    White: 0.3134, 0.3291
  Established Timings I & II: none
  Standard Timings: none
  Detailed Timing Descriptors:
    DTD 1:  2240x1400   60.020520 Hz  16:10    87.750 kHz    210.600000 MHz (300 mm x 188 mm)
                 Hfront   48 Hsync  32 Hback   80 Hpol N
                 Vfront    3 Vsync   5 Vback   54 Vpol N
    Display Range Limits:
      Monitor ranges (Range Limits Only): 40-60 Hz V, 88-88 kHz H, max dotclock 210 MHz
    Manufacturer-Specified Display Descriptor (0x0f): 00 0f 00 f9 0a 3c f9 0a 28 1e 0e 00 06 af 95 a1 '.....<..(.......'
    Alphanumeric Data String: 'B140QAN05.0 '
Checksum: 0xdc

----------------

Warnings:

Block 0, Base EDID:
  Missing Display Product Name.
EDID:
  Base EDID: Some timings are out of range of the Monitor Ranges:
    Maximum Clock: 210.600 MHz (Monitor: 210.000 MHz)
    Could be due to a Monitor Range off-by-one rounding issue

Failures:

Block 0, Base EDID:
  Alphanumeric Data String: One or more trailing spaces before newline.
EDID:
  Extension Block 1 started with EDID header, ignoring Extension Blocks >= 1.

EDID conformity: FAIL
