edid-decode (hex):

00 ff ff ff ff ff ff 00 30 ae 3c 40 00 00 00 00
28 1f 01 04 a5 1e 13 78 e3 a7 e5 a3 54 4a 9e 25
0e 50 54 00 00 00 01 01 01 01 01 01 01 01 01 01
01 01 01 01 01 01 07 53 c0 dc 80 78 28 50 30 20
36 00 2e bd 10 00 00 1a 00 00 00 fd 00 28 3c 56
56 15 01 0a 20 20 20 20 20 20 00 00 00 0f 00 f9
0a 3c f9 0a 28 1e 0e 00 09 e5 c9 0a 00 00 00 fe
00 4e 56 31 34 30 44 52 4d 2d 4e 36 32 0a 00 82

00 ff ff ff ff ff ff 00 30 ae 3c 40 00 00 00 00
28 1f 01 04 a5 1e 13 78 e3 a7 e5 a3 54 4a 9e 25
0e 50 54 00 00 00 01 01 01 01 01 01 01 01 01 01
01 01 01 01 01 01 07 53 c0 dc 80 78 28 50 30 20
36 00 2e bd 10 00 00 1a 00 00 00 fd 00 28 3c 56
56 15 01 0a 20 20 20 20 20 20 00 00 00 0f 00 f9
0a 3c f9 0a 28 1e 0e 00 09 e5 c9 0a 00 00 00 fe
00 4e 56 31 34 30 44 52 4d 2d 4e 36 32 0a 00 82

----------------

Block 0, Base EDID:
  EDID Structure Version & Revision: 1.4
  Vendor & Product Identification:
    Manufacturer: LEN
    Model: 16444
    Made in: week 40 of 2021
  Basic Display Parameters & Features:
    Digital display
    Bits per primary color channel: 8
    DisplayPort interface
    Maximum image size: 30 cm x 19 cm
    Gamma: 2.20
    DPMS levels: Standby Suspend Off
    Supported color formats: RGB 4:4:4
    First detailed timing includes the native pixel format and preferred refresh rate
    Display supports continuous frequencies
  Color Characteristics:
    Red  : 0.6386, 0.3300
    Green: 0.2900, 0.6201
    Blue : 0.1474, 0.0566
    White: 0.3134, 0.3291
  Established Timings I & II: none
  Standard Timings: none
  Detailed Timing Descriptors:
    DTD 1:  2240x1400   60.001694 Hz  16:10    86.402 kHz    212.550000 MHz (302 mm x 189 mm)
                 Hfront   48 Hsync  32 Hback  140 Hpol P
                 Vfront    3 Vsync   6 Vback   31 Vpol N
    Display Range Limits:
      Monitor ranges (Range Limits Only): 40-60 Hz V, 86-86 kHz H, max dotclock 210 MHz
    Manufacturer-Specified Display Descriptor (0x0f): 00 0f 00 f9 0a 3c f9 0a 28 1e 0e 00 09 e5 c9 0a '.....<..(.......'
    Alphanumeric Data String: 'NV140DRM-N62'
Checksum: 0x82

----------------

Warnings:

Block 0, Base EDID:
  Missing Display Product Name.
EDID:
  Base EDID: Some timings are out of range of the Monitor Ranges:
    Maximum Clock: 212.550 MHz (Monitor: 210.000 MHz)
    Could be due to a Monitor Range off-by-one rounding issue

Failures:

EDID:
  Extension Block 1 started with EDID header, ignoring Extension Blocks >= 1.

EDID conformity: FAIL
