edid-decode (hex):

00 ff ff ff ff ff ff 00 10 ac 46 a2 53 31 39 30
02 23 01 04 b5 46 28 78 3b 03 21 af 4e 3e b5 25
0d 50 54 a5 4b 00 71 4f 81 80 a9 c0 d1 c0 01 01
01 01 01 01 01 01 4d d0 00 a0 f0 70 3e 80 30 20
35 00 bb 8b 21 00 00 1a 00 00 00 ff 00 35 4b 36
38 59 5a 33 0a 20 20 20 20 20 00 00 00 fc 00 41
57 33 32 32 35 51 46 0a 20 20 20 20 00 00 00 fd
0c 30 f0 ff ff ea 01 0a 20 20 20 20 20 20 02 1b

02 03 3b f1 52 76 61 60 5f 5e 5d 3f 22 21 20 1f
13 12 10 04 03 02 01 e3 05 c3 01 e6 06 05 01 63
4d 02 e2 00 ea eb 01 46 d0 00 4c 02 5d 7b 6e 85
76 29 09 07 07 15 07 50 3d 1f c0 00 00 00 00 00
00 00 00 00 00 00 00 00 00 00 00 00 00 00 00 00
00 00 00 00 00 00 00 00 00 00 00 00 00 00 00 00
00 00 00 00 00 00 00 00 00 00 00 00 00 00 00 00
00 00 00 00 00 00 00 00 00 00 00 00 00 00 00 b7

70 12 79 03 00 03 01 64 5f e4 00 04 7f 07 b3 00
3f 80 3f 00 37 04 4f 00 02 00 04 00 6e c2 00 04
ff 09 9f 00 2f 80 1f 00 9f 05 54 00 02 00 04 00
ca 9c 01 04 ff 09 9f 00 2f 80 1f 00 9f 05 b2 00
02 00 04 00 d6 8e 03 04 ff 0e 9f 00 2f 80 1f 00
6f 08 0c 01 02 00 04 00 55 5e 00 04 ff 09 9f 00
2f 80 1f 00 9f 05 28 00 02 00 04 00 00 00 00 00
00 00 00 00 00 00 00 00 00 00 00 00 00 00 ac 90

00 ff ff ff ff ff ff 00 10 ac 46 a2 53 31 39 30
02 23 01 04 b5 46 28 78 3b 03 21 af 4e 3e b5 25
0d 50 54 a5 4b 00 71 4f 81 80 a9 c0 d1 c0 01 01
01 01 01 01 01 01 4d d0 00 a0 f0 70 3e 80 30 20
35 00 bb 8b 21 00 00 1a 00 00 00 ff 00 35 4b 36
38 59 5a 33 0a 20 20 20 20 20 00 00 00 fc 00 41
57 33 32 32 35 51 46 0a 20 20 20 20 00 00 00 fd
0c 30 f0 ff ff ea 01 0a 20 20 20 20 20 20 02 1b

02 03 3b f1 52 76 61 60 5f 5e 5d 3f 22 21 20 1f
13 12 10 04 03 02 01 e3 05 c3 01 e6 06 05 01 63
4d 02 e2 00 ea eb 01 46 d0 00 4c 02 5d 7b 6e 85
76 29 09 07 07 15 07 50 3d 1f c0 00 00 00 00 00
00 00 00 00 00 00 00 00 00 00 00 00 00 00 00 00
00 00 00 00 00 00 00 00 00 00 00 00 00 00 00 00
00 00 00 00 00 00 00 00 00 00 00 00 00 00 00 00
00 00 00 00 00 00 00 00 00 00 00 00 00 00 00 b7

70 12 79 03 00 03 01 64 5f e4 00 04 7f 07 b3 00
3f 80 3f 00 37 04 4f 00 02 00 04 00 6e c2 00 04
ff 09 9f 00 2f 80 1f 00 9f 05 54 00 02 00 04 00
ca 9c 01 04 ff 09 9f 00 2f 80 1f 00 9f 05 b2 00
02 00 04 00 d6 8e 03 04 ff 0e 9f 00 2f 80 1f 00
6f 08 0c 01 02 00 04 00 55 5e 00 04 ff 09 9f 00
2f 80 1f 00 9f 05 28 00 02 00 04 00 00 00 00 00
00 00 00 00 00 00 00 00 00 00 00 00 00 00 ac 90

----------------

Block 0, Base EDID:
  EDID Structure Version & Revision: 1.4
  Vendor & Product Identification:
    Manufacturer: DEL
    Model: 41542
    Serial Number: ...
    Made in: week 2 of 2025
  Basic Display Parameters & Features:
    Digital display
    Bits per primary color channel: 10
    DisplayPort interface
    Maximum image size: 70 cm x 40 cm
    Gamma: 2.20
    DPMS levels: Off
    Supported color formats: RGB 4:4:4, YCrCb 4:4:4, YCrCb 4:2:2
    First detailed timing includes the native pixel format and preferred refresh rate
    Display supports continuous frequencies
  Color Characteristics:
    Red  : 0.6835, 0.3046
    Green: 0.2421, 0.7099
    Blue : 0.1445, 0.0527
    White: 0.3125, 0.3291
  Established Timings I & II:
    IBM     :   720x400    70.081663 Hz   9:5     31.467 kHz     28.320000 MHz
    DMT 0x04:   640x480    59.940476 Hz   4:3     31.469 kHz     25.175000 MHz
    DMT 0x06:   640x480    75.000000 Hz   4:3     37.500 kHz     31.500000 MHz
    DMT 0x09:   800x600    60.316541 Hz   4:3     37.879 kHz     40.000000 MHz
    DMT 0x0b:   800x600    75.000000 Hz   4:3     46.875 kHz     49.500000 MHz
    DMT 0x10:  1024x768    60.003840 Hz   4:3     48.363 kHz     65.000000 MHz
    DMT 0x12:  1024x768    75.028582 Hz   4:3     60.023 kHz     78.750000 MHz
    DMT 0x24:  1280x1024   75.024675 Hz   5:4     79.976 kHz    135.000000 MHz
  Standard Timings:
    DMT 0x15:  1152x864    75.000000 Hz   4:3     67.500 kHz    108.000000 MHz
    DMT 0x23:  1280x1024   60.019740 Hz   5:4     63.981 kHz    108.000000 MHz
    DMT 0x53:  1600x900    60.000000 Hz  16:9     60.000 kHz    108.000000 MHz (RB)
    DMT 0x52:  1920x1080   60.000000 Hz  16:9     67.500 kHz    148.500000 MHz
  Detailed Timing Descriptors:
    DTD 1:  3840x2160   59.996625 Hz  16:9    133.312 kHz    533.250000 MHz (699 mm x 395 mm)
                 Hfront   48 Hsync  32 Hback   80 Hpol P
                 Vfront    3 Vsync   5 Vback   54 Vpol N
    Display Product Serial Number: ...
    Display Product Name: 'AW3225QF'
    Display Range Limits:
      Monitor ranges (Range Limits Only): 48-240 Hz V, 510-510 kHz H, max dotclock 2340 MHz
  Extension blocks: 2
Checksum: 0x1b

----------------

Block 1, CTA-861 Extension Block:
  Revision: 3
  Underscans IT Video Formats by default
  Basic audio support
  Supports YCbCr 4:4:4
  Supports YCbCr 4:2:2
  Native DTDs: 1
  Video Data Block:
    VIC 118:  3840x2160  120.000000 Hz  16:9    270.000 kHz   1188.000000 MHz
    VIC  97:  3840x2160   60.000000 Hz  16:9    135.000 kHz    594.000000 MHz
    VIC  96:  3840x2160   50.000000 Hz  16:9    112.500 kHz    594.000000 MHz
    VIC  95:  3840x2160   30.000000 Hz  16:9     67.500 kHz    297.000000 MHz
    VIC  94:  3840x2160   25.000000 Hz  16:9     56.250 kHz    297.000000 MHz
    VIC  93:  3840x2160   24.000000 Hz  16:9     54.000 kHz    297.000000 MHz
    VIC  63:  1920x1080  120.000000 Hz  16:9    135.000 kHz    297.000000 MHz
    VIC  34:  1920x1080   30.000000 Hz  16:9     33.750 kHz     74.250000 MHz
    VIC  33:  1920x1080   25.000000 Hz  16:9     28.125 kHz     74.250000 MHz
    VIC  32:  1920x1080   24.000000 Hz  16:9     27.000 kHz     74.250000 MHz
    VIC  31:  1920x1080   50.000000 Hz  16:9     56.250 kHz    148.500000 MHz
    VIC  19:  1280x720    50.000000 Hz  16:9     37.500 kHz     74.250000 MHz
    VIC  18:   720x576    50.000000 Hz  16:9     31.250 kHz     27.000000 MHz
    VIC  16:  1920x1080   60.000000 Hz  16:9     67.500 kHz    148.500000 MHz
    VIC   4:  1280x720    60.000000 Hz  16:9     45.000 kHz     74.250000 MHz
    VIC   3:   720x480    59.940060 Hz  16:9     31.469 kHz     27.000000 MHz
    VIC   2:   720x480    59.940060 Hz   4:3     31.469 kHz     27.000000 MHz
    VIC   1:   640x480    59.940476 Hz   4:3     31.469 kHz     25.175000 MHz
  Colorimetry Data Block:
    xvYCC601
    xvYCC709
    BT2020YCC
    BT2020RGB
    Gamut Boundary Description Metadata Profile P0
  HDR Static Metadata Data Block:
    Electro optical transfer functions:
      Traditional gamma - SDR luminance range
      SMPTE ST2084
    Supported static metadata descriptors:
      Static metadata type 1
    Desired content max luminance: 99 (426.856 cd/m^2)
    Desired content max frame-average luminance: 77 (265.047 cd/m^2)
    Desired content min luminance: 2 (0.000 cd/m^2)
  Video Capability Data Block:
    YCbCr quantization: Selectable (via AVI YQ)
    RGB quantization: Selectable (via AVI Q)
    PT scan behavior: Always Underscanned
    IT scan behavior: Always Underscanned
    CE scan behavior: Always Underscanned
  Vendor-Specific Video Data Block (Dolby), OUI 00-D0-46:
    Version: 2 (12 bytes)
    DM Version: 5.x
    Backlt Min Luma: 75 cd/m^2
    Interface: Low-Latency + Low-Latency-HDMI
    Supports 10b 12b 444: 12 bit
    Target Min PQ v2: 0 (0.00000000 cd/m^2)
    Target Max PQ v2: 2770 (499 cd/m^2)
    Unique Rx, Ry: 0.68750000, 0.30468750
    Unique Gx, Gy: 0.23828125, 0.71484375
    Unique Bx, By: 0.14453125, 0.05468750
  Audio Data Block:
    Linear PCM:
      Max channels: 2
      Supported sample rates (kHz): 48 44.1 32
      Supported sample sizes (bits): 24 20 16
    AC-3:
      Max channels: 6
      Supported sample rates (kHz): 48 44.1 32
      Maximum bit rate: 640 kb/s
    DTS:
      Max channels: 6
      Supported sample rates (kHz): 96 88.2 48 44.1 32
      Maximum bit rate: 1536 kb/s
Checksum: 0xb7  Unused space in Extension Block: 68 bytes

----------------

Block 2, DisplayID Extension Block:
  Version: 1.2
  Extension Count: 0
  Display Product Type: Standalone display device
  Video Timing Modes Type 1 - Detailed Timings Data Block:
    DTD:  1920x1080  240.000000 Hz  16:9    278.400 kHz    584.640000 MHz (aspect 16:9, no 3D stereo)
               Hfront   64 Hsync  64 Hback   52 Hpol P
               Vfront    3 Vsync   5 Vback   72 Vpol N
    DTD:  2560x1440  119.997589 Hz  16:9    182.996 kHz    497.750000 MHz (aspect 16:9, no 3D stereo)
               Hfront   48 Hsync  32 Hback   80 Hpol P
               Vfront    3 Vsync   5 Vback   77 Vpol N
    DTD:  2560x1440  239.969753 Hz  16:9    388.511 kHz   1056.750000 MHz (aspect 16:9, no 3D stereo)
               Hfront   48 Hsync  32 Hback   80 Hpol P
               Vfront    3 Vsync   5 Vback  171 Vpol N
    DTD:  3840x2160  239.990737 Hz  16:9    582.938 kHz   2331.750000 MHz (aspect 16:9, no 3D stereo)
               Hfront   48 Hsync  32 Hback   80 Hpol P
               Vfront    3 Vsync   5 Vback  261 Vpol N
    DTD:  2560x1440   59.950550 Hz  16:9     88.787 kHz    241.500000 MHz (aspect 16:9, no 3D stereo)
               Hfront   48 Hsync  32 Hback   80 Hpol P
               Vfront    3 Vsync   5 Vback   33 Vpol N
  Checksum: 0xac
Checksum: 0x90

----------------

Warnings:

Block 1, CTA-861 Extension Block:
  Video Data Block: VIC 118 and the first DTD are not identical. Is this intended?
  Colorimetry Data Block: Set the sRGB colorimetry bit to avoid interop issues.
  Video Capability Data Block: S_PT is equal to S_IT and S_CE, so should be set to 0 instead.
  Display Product Serial Number is set, so the Serial Number in the Base EDID should be 0.
EDID:
  Base EDID: Some timings are out of range of the Monitor Ranges:
    Vertical Freq: 24.000 - 240.000 Hz (Monitor: 48.000 - 240.000 Hz)
    Horizontal Freq: 27.000 - 582.937 kHz (Monitor: 510.000 - 510.000 kHz)

Failures:

EDID:
  Extension Block 3 started with EDID header, ignoring Extension Blocks >= 3.
  DisplayID: Missing DisplayID Display Parameters Data Block.
  DisplayID: DisplayID expects at least one preferred timing.

EDID conformity: FAIL
