edid-decode (hex):

00 ff ff ff ff ff ff 00 06 af 2d 63 00 00 00 00
01 1c 01 04 95 1d 11 78 02 30 e5 a5 56 53 9d 27
0c 50 54 00 00 00 01 01 01 01 01 01 01 01 01 01
01 01 01 01 01 01 14 37 80 b8 70 38 24 40 10 10
3e 00 25 a5 10 00 00 1a 10 2c 80 b8 70 38 24 40
10 10 3e 00 25 a5 10 00 00 1a 00 00 00 fe 00 46
36 34 4e 35 81 42 31 33 33 48 41 4e 00 00 00 00
00 01 81 01 9e 00 11 00 00 0a 01 0a 20 20 00 df

00 ff ff ff ff ff ff 00 06 af 2d 63 00 00 00 00
01 1c 01 04 95 1d 11 78 02 30 e5 a5 56 53 9d 27
0c 50 54 00 00 00 01 01 01 01 01 01 01 01 01 01
01 01 01 01 01 01 14 37 80 b8 70 38 24 40 10 10
3e 00 25 a5 10 00 00 1a 10 2c 80 b8 70 38 24 40
10 10 3e 00 25 a5 10 00 00 1a 00 00 00 fe 00 46
36 34 4e 35 81 42 31 33 33 48 41 4e 00 00 00 00
00 01 81 01 9e 00 11 00 00 0a 01 0a 20 20 00 df

----------------

Block 0, Base EDID:
  EDID Structure Version & Revision: 1.4
  Vendor & Product Identification:
    Manufacturer: AUO
    Model: 25389
    Made in: week 1 of 2018
  Basic Display Parameters & Features:
    Digital display
    Bits per primary color channel: 6
    DisplayPort interface
    Maximum image size: 29 cm x 17 cm
    Gamma: 2.20
    Supported color formats: RGB 4:4:4
    First detailed timing includes the native pixel format and preferred refresh rate
  Color Characteristics:
    Red  : 0.6445, 0.3388
    Green: 0.3242, 0.6132
    Blue : 0.1552, 0.0488
    White: 0.3134, 0.3291
  Established Timings I & II: none
  Standard Timings: none
  Detailed Timing Descriptors:
    DTD 1:  1920x1080   60.049471 Hz  16:9     67.015 kHz    141.000000 MHz (293 mm x 165 mm)
                 Hfront   16 Hsync  16 Hback  152 Hpol P
                 Vfront    3 Vsync  14 Vback   19 Vpol N
    DTD 2:  1920x1080   48.039576 Hz  16:9     53.612 kHz    112.800000 MHz (293 mm x 165 mm)
                 Hfront   16 Hsync  16 Hback  152 Hpol P
                 Vfront    3 Vsync  14 Vback   19 Vpol N
    Alphanumeric Data String: 'F64N5.B133HAN'
    Manufacturer-Specified Display Descriptor (0x00): 00 00 00 01 81 01 9e 00 11 00 00 0a 01 0a 20 20 '..............  '
Checksum: 0xdf

----------------

Block 1, Unknown EDID Extension Block 0x00:
  00 ff ff ff ff ff ff 00 06 af 2d 63 00 00 00 00 '..........-c....'
  01 1c 01 04 95 1d 11 78 02 30 e5 a5 56 53 9d 27 '.......x.0..VS.''
  0c 50 54 00 00 00 01 01 01 01 01 01 01 01 01 01 '.PT.............'
  01 01 01 01 01 01 14 37 80 b8 70 38 24 40 10 10 '.......7..p8$@..'
  3e 00 25 a5 10 00 00 1a 10 2c 80 b8 70 38 24 40 '>.%......,..p8$@'
  10 10 3e 00 25 a5 10 00 00 1a 00 00 00 fe 00 46 '..>.%..........F'
  36 34 4e 35 81 42 31 33 33 48 41 4e 00 00 00 00 '64N5.B133HAN....'
  00 01 81 01 9e 00 11 00 00 0a 01 0a 20 20 00 df '............  ..'
Checksum: 0xdf

----------------

Warnings:

Block 0, Base EDID:
  Alphanumeric Data String: Non-ASCII character 0x81 at position 5, can cause problems.
  Missing Display Product Name.

Failures:

Block 1, Base EDID:
  Unknown Extension Block.
EDID:
  Base EDID: EDID specified 0 extension block(s), but found 1 extension block(s).

EDID conformity: FAIL
