edid-decode (hex):

00 ff ff ff ff ff ff 00 4c 2d 96 77 31 53 57 30
28 22 01 04 b5 77 22 78 3b e0 95 ae 4e 3a bb 25
0c 50 54 25 cf 00 71 4f 81 c0 81 00 81 80 95 00
a9 c0 b3 00 d1 c0 bc e3 00 a0 f0 38 87 40 30 20
3a 00 a9 50 41 00 00 1a 00 00 00 fd 00 30 90 ea
ea 83 01 0a 20 20 20 20 20 20 00 00 00 fc 00 4f
64 79 73 73 65 79 20 47 39 31 53 44 00 00 00 ff
00 48 4e 54 58 41 30 30 33 38 35 0a 20 20 03 23

02 03 37 f0 44 10 3f 04 03 23 09 07 07 83 01 00
00 e3 05 c0 00 e6 06 05 01 60 4a 04 e5 01 8b 84
90 39 74 1a 00 00 03 07 30 90 00 a0 60 01 4a 02
90 00 00 00 00 00 00 6f c2 00 a0 a0 a0 55 50 30
20 35 00 a9 50 41 00 00 1a 56 5e 00 a0 a0 a0 29
50 30 20 35 00 a9 50 41 00 00 1a de 71 00 a0 f0
38 87 40 30 20 3a 00 a9 50 41 00 00 1a 00 00 00
00 00 00 00 00 00 00 00 00 00 00 00 00 00 00 10

00 ff ff ff ff ff ff 00 4c 2d 96 77 31 53 57 30
28 22 01 04 b5 77 22 78 3b e0 95 ae 4e 3a bb 25
0c 50 54 25 cf 00 71 4f 81 c0 81 00 81 80 95 00
a9 c0 b3 00 d1 c0 bc e3 00 a0 f0 38 87 40 30 20
3a 00 a9 50 41 00 00 1a 00 00 00 fd 00 30 90 ea
ea 83 01 0a 20 20 20 20 20 20 00 00 00 fc 00 4f
64 79 73 73 65 79 20 47 39 31 53 44 00 00 00 ff
00 48 4e 54 58 41 30 30 33 38 35 0a 20 20 03 23

02 03 37 f0 44 10 3f 04 03 23 09 07 07 83 01 00
00 e3 05 c0 00 e6 06 05 01 60 4a 04 e5 01 8b 84
90 39 74 1a 00 00 03 07 30 90 00 a0 60 01 4a 02
90 00 00 00 00 00 00 6f c2 00 a0 a0 a0 55 50 30
20 35 00 a9 50 41 00 00 1a 56 5e 00 a0 a0 a0 29
50 30 20 35 00 a9 50 41 00 00 1a de 71 00 a0 f0
38 87 40 30 20 3a 00 a9 50 41 00 00 1a 00 00 00
00 00 00 00 00 00 00 00 00 00 00 00 00 00 00 10

00 ff ff ff ff ff ff 00 4c 2d 96 77 31 53 57 30
28 22 01 04 b5 77 22 78 3b e0 95 ae 4e 3a bb 25
0c 50 54 25 cf 00 71 4f 81 c0 81 00 81 80 95 00
a9 c0 b3 00 d1 c0 bc e3 00 a0 f0 38 87 40 30 20
3a 00 a9 50 41 00 00 1a 00 00 00 fd 00 30 90 ea
ea 83 01 0a 20 20 20 20 20 20 00 00 00 fc 00 4f
64 79 73 73 65 79 20 47 39 31 53 44 00 00 00 ff
00 48 4e 54 58 41 30 30 33 38 35 0a 20 20 03 23

02 03 37 f0 44 10 3f 04 03 23 09 07 07 83 01 00
00 e3 05 c0 00 e6 06 05 01 60 4a 04 e5 01 8b 84
90 39 74 1a 00 00 03 07 30 90 00 a0 60 01 4a 02
90 00 00 00 00 00 00 6f c2 00 a0 a0 a0 55 50 30
20 35 00 a9 50 41 00 00 1a 56 5e 00 a0 a0 a0 29
50 30 20 35 00 a9 50 41 00 00 1a de 71 00 a0 f0
38 87 40 30 20 3a 00 a9 50 41 00 00 1a 00 00 00
00 00 00 00 00 00 00 00 00 00 00 00 00 00 00 10

00 ff ff ff ff ff ff 00 4c 2d 96 77 31 53 57 30
28 22 01 04 b5 77 22 78 3b e0 95 ae 4e 3a bb 25
0c 50 54 25 cf 00 71 4f 81 c0 81 00 81 80 95 00
a9 c0 b3 00 d1 c0 bc e3 00 a0 f0 38 87 40 30 20
3a 00 a9 50 41 00 00 1a 00 00 00 fd 00 30 90 ea
ea 83 01 0a 20 20 20 20 20 20 00 00 00 fc 00 4f
64 79 73 73 65 79 20 47 39 31 53 44 00 00 00 ff
00 48 4e 54 58 41 30 30 33 38 35 0a 20 20 03 23

02 03 37 f0 44 10 3f 04 03 23 09 07 07 83 01 00
00 e3 05 c0 00 e6 06 05 01 60 4a 04 e5 01 8b 84
90 39 74 1a 00 00 03 07 30 90 00 a0 60 01 4a 02
90 00 00 00 00 00 00 6f c2 00 a0 a0 a0 55 50 30
20 35 00 a9 50 41 00 00 1a 56 5e 00 a0 a0 a0 29
50 30 20 35 00 a9 50 41 00 00 1a de 71 00 a0 f0
38 87 40 30 20 3a 00 a9 50 41 00 00 1a 00 00 00
00 00 00 00 00 00 00 00 00 00 00 00 00 00 00 10

----------------

Block 0, Base EDID:
  EDID Structure Version & Revision: 1.4
  Vendor & Product Identification:
    Manufacturer: SAM
    Model: 30614
    Serial Number: ...
    Made in: week 40 of 2024
  Basic Display Parameters & Features:
    Digital display
    Bits per primary color channel: 10
    DisplayPort interface
    Maximum image size: 119 cm x 34 cm
    Gamma: 2.20
    DPMS levels: Off
    Supported color formats: RGB 4:4:4, YCrCb 4:4:4, YCrCb 4:2:2
    First detailed timing includes the native pixel format and preferred refresh rate
    Display supports continuous frequencies
  Color Characteristics:
    Red  : 0.6826, 0.3066
    Green: 0.2265, 0.7304
    Blue : 0.1464, 0.0478
    White: 0.3134, 0.3291
  Established Timings I & II:
    DMT 0x04:   640x480    59.940476 Hz   4:3     31.469 kHz     25.175000 MHz
    DMT 0x06:   640x480    75.000000 Hz   4:3     37.500 kHz     31.500000 MHz
    DMT 0x09:   800x600    60.316541 Hz   4:3     37.879 kHz     40.000000 MHz
    DMT 0x0a:   800x600    72.187572 Hz   4:3     48.077 kHz     50.000000 MHz
    DMT 0x0b:   800x600    75.000000 Hz   4:3     46.875 kHz     49.500000 MHz
    DMT 0x10:  1024x768    60.003840 Hz   4:3     48.363 kHz     65.000000 MHz
    DMT 0x11:  1024x768    70.069359 Hz   4:3     56.476 kHz     75.000000 MHz
    DMT 0x12:  1024x768    75.028582 Hz   4:3     60.023 kHz     78.750000 MHz
    DMT 0x24:  1280x1024   75.024675 Hz   5:4     79.976 kHz    135.000000 MHz
  Standard Timings:
    DMT 0x15:  1152x864    75.000000 Hz   4:3     67.500 kHz    108.000000 MHz
    DMT 0x55:  1280x720    60.000000 Hz  16:9     45.000 kHz     74.250000 MHz
    DMT 0x1c:  1280x800    59.810326 Hz  16:10    49.702 kHz     83.500000 MHz
    DMT 0x23:  1280x1024   60.019740 Hz   5:4     63.981 kHz    108.000000 MHz
    DMT 0x2f:  1440x900    59.887445 Hz  16:10    55.935 kHz    106.500000 MHz
    DMT 0x53:  1600x900    60.000000 Hz  16:9     60.000 kHz    108.000000 MHz (RB)
    DMT 0x3a:  1680x1050   59.954250 Hz  16:10    65.290 kHz    146.250000 MHz
    DMT 0x52:  1920x1080   60.000000 Hz  16:9     67.500 kHz    148.500000 MHz
  Detailed Timing Descriptors:
    DTD 1:  3840x1080  119.958848 Hz  32:9    145.750 kHz    583.000000 MHz (1193 mm x 336 mm)
                 Hfront   48 Hsync  32 Hback   80 Hpol P
                 Vfront    3 Vsync  10 Vback  122 Vpol N
    Display Range Limits:
      Monitor ranges (Range Limits Only): 48-144 Hz V, 234-234 kHz H, max dotclock 1310 MHz
    Display Product Name: 'Odyssey G91SD'
    Display Product Serial Number: ...
  Extension blocks: 3
Checksum: 0x23

----------------

Block 1, CTA-861 Extension Block:
  Revision: 3
  Underscans IT Video Formats by default
  Basic audio support
  Supports YCbCr 4:4:4
  Supports YCbCr 4:2:2
  Native DTDs: 0
  Video Data Block:
    VIC  16:  1920x1080   60.000000 Hz  16:9     67.500 kHz    148.500000 MHz
    VIC  63:  1920x1080  120.000000 Hz  16:9    135.000 kHz    297.000000 MHz
    VIC   4:  1280x720    60.000000 Hz  16:9     45.000 kHz     74.250000 MHz
    VIC   3:   720x480    59.940060 Hz  16:9     31.469 kHz     27.000000 MHz
  Audio Data Block:
    Linear PCM:
      Max channels: 2
      Supported sample rates (kHz): 48 44.1 32
      Supported sample sizes (bits): 24 20 16
  Speaker Allocation Data Block:
    FL/FR - Front Left/Right
  Colorimetry Data Block:
    BT2020YCC
    BT2020RGB
  HDR Static Metadata Data Block:
    Electro optical transfer functions:
      Traditional gamma - SDR luminance range
      SMPTE ST2084
    Supported static metadata descriptors:
      Static metadata type 1
    Desired content max luminance: 96 (400.000 cd/m^2)
    Desired content max frame-average luminance: 74 (248.372 cd/m^2)
    Desired content min luminance: 4 (0.001 cd/m^2)
  Vendor-Specific Video Data Block (HDR10+), OUI 90-84-8B:
    Application Version: 1
    Full Frame Peak Luminance Index: 2
    Peak Luminance Index: 3
  Vendor-Specific Data Block (AMD), OUI 00-00-1A:
    Version: 3
    Feature Caps: 0x07
      Global Backlight Control Supported
    Minimum Refresh Rate: 48 Hz
    Maximum Refresh Rate: 144 Hz
    Flags 1.x: 0x00
    Flags 2.x: 0xa0
      ST 2084 (PQ) EOTF Supported
      Linear EOTF (Windows scRGB, 0.0 - 125.0) Supported
      BT.2020 Gamut Supported
    Maximum luminance: 96 (400.000 cd/m^2)
    Minimum luminance: 1 (0.000 cd/m^2)
    Maximum luminance (minimum backlight): 74 (248.372 cd/m^2)
    Minimum luminance (minimum backlight): 2 (0.000 cd/m^2)
  Detailed Timing Descriptors:
    DTD 2:  2560x1440  119.997589 Hz  16:9    182.996 kHz    497.750000 MHz (1193 mm x 336 mm)
                 Hfront   48 Hsync  32 Hback   80 Hpol P
                 Vfront    3 Vsync   5 Vback   77 Vpol N
    DTD 3:  2560x1440   59.950550 Hz  16:9     88.787 kHz    241.500000 MHz (1193 mm x 336 mm)
                 Hfront   48 Hsync  32 Hback   80 Hpol P
                 Vfront    3 Vsync   5 Vback   33 Vpol N
    DTD 4:  3840x1080   59.979424 Hz  32:9     72.875 kHz    291.500000 MHz (1193 mm x 336 mm)
                 Hfront   48 Hsync  32 Hback   80 Hpol P
                 Vfront    3 Vsync  10 Vback  122 Vpol N
Checksum: 0x10  Unused space in Extension Block: 18 bytes

----------------

Warnings:

Block 1, CTA-861 Extension Block:
  Video Data Block: VIC 16 and the first DTD are not identical. Is this intended?
  Colorimetry Data Block: Set the sRGB colorimetry bit to avoid interop issues.
  Detailed Timing Descriptor #2: Image size is 1193x336 mm, but based on the picture AR it should be 597x336 mm.
  Detailed Timing Descriptor #3: Image size is 1193x336 mm, but based on the picture AR it should be 597x336 mm.
  Display Product Serial Number is set, so the Serial Number in the Base EDID should be 0.
EDID:
  Base EDID: Some timings are out of range of the Monitor Ranges:
    Horizontal Freq: 31.468 - 182.996 kHz (Monitor: 234.000 - 234.000 kHz)

Failures:

Block 1, CTA-861 Extension Block:
  Missing VCDB, needed for Set Selectable RGB Quantization to avoid interop issues.
EDID:
  Extension Block 2 started with EDID header, ignoring Extension Blocks >= 2.
  Base EDID: EDID specified 3 extension block(s), but found 1 extension block(s).

EDID conformity: FAIL
