edid-decode (hex):

00 ff ff ff ff ff ff 00 0d af a1 15 00 00 00 00
2c 15 01 03 80 23 13 78 0a 07 f5 9a 57 4e 87 26
1e 50 54 00 00 00 01 01 01 01 01 01 01 01 01 01
01 01 01 01 01 01 d8 1d 56 df 50 00 21 30 43 2d
48 00 58 c1 10 00 00 18 00 00 00 fe 00 4e 31 35
36 42 36 2d 4c 30 41 0a 20 20 00 00 00 fe 00 43
4d 4f 0a 20 20 20 20 20 20 20 20 20 00 00 00 fe
00 4e 31 35 36 42 36 2d 4c 30 41 0a 20 20 00 6a

00 ff ff ff ff ff ff 00 0d af a1 15 00 00 00 00
2c 15 01 03 80 23 13 78 0a 07 f5 9a 57 4e 87 26
1e 50 54 00 00 00 01 01 01 01 01 01 01 01 01 01
01 01 01 01 01 01 d8 1d 56 df 50 00 21 30 43 2d
48 00 58 c1 10 00 00 18 00 00 00 fe 00 4e 31 35
36 42 36 2d 4c 30 41 0a 20 20 00 00 00 fe 00 43
4d 4f 0a 20 20 20 20 20 20 20 20 20 00 00 00 fe
00 4e 31 35 36 42 36 2d 4c 30 41 0a 20 20 00 6a

----------------

Block 0, Base EDID:
  EDID Structure Version & Revision: 1.3
  Vendor & Product Identification:
    Manufacturer: CMO
    Model: 5537
    Made in: week 44 of 2011
  Basic Display Parameters & Features:
    Digital display
    Maximum image size: 35 cm x 19 cm
    Gamma: 2.20
    RGB color display
    First detailed timing is the preferred timing
  Color Characteristics:
    Red  : 0.6015, 0.3398
    Green: 0.3056, 0.5302
    Blue : 0.1513, 0.1201
    White: 0.3134, 0.3291
  Established Timings I & II: none
  Standard Timings: none
  Detailed Timing Descriptors:
    DTD 1:  1366x768    60.025660 Hz 683:384   48.081 kHz     76.400000 MHz (344 mm x 193 mm)
                 Hfront   67 Hsync  45 Hback  111 Hpol N
                 Vfront    4 Vsync   8 Vback   21 Vpol N
    Alphanumeric Data String: 'N156B6-L0A'
    Alphanumeric Data String: 'CMO'
    Alphanumeric Data String: 'N156B6-L0A'
Checksum: 0x6a

----------------

Failures:

Block 0, Base EDID:
  Missing Display Product Name.
  Missing Display Range Limits Descriptor.
EDID:
  Extension Block 1 started with EDID header, ignoring Extension Blocks >= 1.

EDID conformity: FAIL
