edid-decode (hex):

00 ff ff ff ff ff ff 00 3b 10 60 34 00 00 00 00
22 1a 01 03 80 00 00 78 02 00 00 00 00 00 00 00
00 00 00 00 00 00 01 01 01 01 01 01 01 01 01 01
01 01 01 01 01 01 40 38 80 00 71 38 14 40 58 2c
44 00 00 00 00 00 00 18 00 00 00 10 00 e0 2d 10
10 60 a2 00 00 00 00 00 00 18 00 00 00 10 00 0a
0a 0a 0a 0a 0a 0a 0a 0a 0a 0a 0a 0a 00 00 00 10
00 e0 2d 10 10 60 a2 00 00 00 00 00 00 18 00 c8

00 ff ff ff ff ff ff 00 3b 10 60 34 00 00 00 00
22 1a 01 03 80 00 00 78 02 00 00 00 00 00 00 00
00 00 00 00 00 00 01 01 01 01 01 01 01 01 01 01
01 01 01 01 01 01 40 38 80 00 71 38 14 40 58 2c
44 00 00 00 00 00 00 18 00 00 00 10 00 e0 2d 10
10 60 a2 00 00 00 00 00 00 18 00 00 00 10 00 0a
0a 0a 0a 0a 0a 0a 0a 0a 0a 0a 0a 0a 00 00 00 10
00 e0 2d 10 10 60 a2 00 00 00 00 00 00 18 00 c8

----------------

Block 0, Base EDID:
  EDID Structure Version & Revision: 1.3
  Vendor & Product Identification:
    Manufacturer: NXP
    Model: 13408
    Made in: week 34 of 2016
  Basic Display Parameters & Features:
    Digital display
    Image size is variable
    Gamma: 2.20
    Monochrome or grayscale display
    First detailed timing is the preferred timing
  Color Characteristics:
    Red  : 0.0000, 0.0000
    Green: 0.0000, 0.0000
    Blue : 0.0000, 0.0000
    White: 0.0000, 0.0000
  Established Timings I & II: none
  Standard Timings: none
  Detailed Timing Descriptors:
    DTD 1:  1920x1080   60.160428 Hz  16:9     66.176 kHz    144.000000 MHz
                 Hfront   88 Hsync  44 Hback  124 Hpol N
                 Vfront    4 Vsync   4 Vback   12 Vpol N
    Dummy Descriptor:
    Dummy Descriptor:
    Dummy Descriptor:
Checksum: 0xc8

----------------

Failures:

Block 0, Base EDID:
  Dummy Descriptor: Dummy block filled with garbage.
  Dummy Descriptor: Dummy block filled with garbage.
  Dummy Descriptor: Dummy block filled with garbage.
  Missing Display Product Name.
  Missing Display Range Limits Descriptor.
EDID:
  Extension Block 1 started with EDID header, ignoring Extension Blocks >= 1.

EDID conformity: FAIL
