edid-decode (hex):

00 ff ff ff ff ff ff 00 1e 6d 11 77 12 0d 02 00
0a 1c 01 04 a5 50 22 78 06 ee 91 a3 54 4c 99 26
0f 50 54 21 08 00 01 01 01 01 01 01 01 01 01 01
01 01 01 01 01 01 cd 46 00 a0 a0 38 1f 40 30 20
3a 00 1e 4f 31 00 00 1a 00 00 00 ff 00 23 41 53
4e 75 64 53 46 36 74 61 58 64 00 00 00 fd 00 1e
a6 42 c2 35 01 0a 20 20 20 20 20 20 00 00 00 fc
00 33 34 55 43 38 39 47 0a 20 20 20 20 20 01 19

02 03 12 41 23 09 07 01 83 01 00 00 65 4b 04 00
01 01 77 65 00 a0 a0 38 2c 40 30 20 3a 00 1e 4f
31 00 00 1a 50 78 00 a0 a0 38 35 40 30 20 3a 00
1e 4f 31 00 00 1a cd 91 00 a0 a0 38 40 40 30 20
3a 00 1e 4f 31 00 00 1a f4 b0 00 a0 a0 38 4d 40
30 20 3a 00 1e 4f 31 00 00 1a 59 ce 00 a0 a0 38
5a 40 30 20 3a 00 1e 4f 31 00 00 1a 00 00 00 00
00 00 00 00 00 00 00 00 00 00 00 00 00 00 00 43

00 ff ff ff ff ff ff 00 1e 6d 11 77 12 0d 02 00
0a 1c 01 04 a5 50 22 78 06 ee 91 a3 54 4c 99 26
0f 50 54 21 08 00 01 01 01 01 01 01 01 01 01 01
01 01 01 01 01 01 cd 46 00 a0 a0 38 1f 40 30 20
3a 00 1e 4f 31 00 00 1a 00 00 00 ff 00 23 41 53
4e 75 64 53 46 36 74 61 58 64 00 00 00 fd 00 1e
a6 42 c2 35 01 0a 20 20 20 20 20 20 00 00 00 fc
00 33 34 55 43 38 39 47 0a 20 20 20 20 20 01 19

02 03 12 41 23 09 07 01 83 01 00 00 65 4b 04 00
01 01 77 65 00 a0 a0 38 2c 40 30 20 3a 00 1e 4f
31 00 00 1a 50 78 00 a0 a0 38 35 40 30 20 3a 00
1e 4f 31 00 00 1a cd 91 00 a0 a0 38 40 40 30 20
3a 00 1e 4f 31 00 00 1a f4 b0 00 a0 a0 38 4d 40
30 20 3a 00 1e 4f 31 00 00 1a 59 ce 00 a0 a0 38
5a 40 30 20 3a 00 1e 4f 31 00 00 1a 00 00 00 00
00 00 00 00 00 00 00 00 00 00 00 00 00 00 00 43

----------------

Block 0, Base EDID:
  EDID Structure Version & Revision: 1.4
  Vendor & Product Identification:
    Manufacturer: GSM
    Model: 30481
    Serial Number: ...
    Made in: week 10 of 2018
  Basic Display Parameters & Features:
    Digital display
    Bits per primary color channel: 8
    DisplayPort interface
    Maximum image size: 80 cm x 34 cm
    Gamma: 2.20
    Supported color formats: RGB 4:4:4
    Default (sRGB) color space is primary color space
    First detailed timing includes the native pixel format and preferred refresh rate
  Color Characteristics:
    Red  : 0.6396, 0.3300
    Green: 0.2998, 0.5996
    Blue : 0.1503, 0.0595
    White: 0.3125, 0.3291
  Established Timings I & II:
    DMT 0x04:   640x480    59.940476 Hz   4:3     31.469 kHz     25.175000 MHz
    DMT 0x09:   800x600    60.316541 Hz   4:3     37.879 kHz     40.000000 MHz
    DMT 0x10:  1024x768    60.003840 Hz   4:3     48.363 kHz     65.000000 MHz
  Standard Timings: none
  Detailed Timing Descriptors:
    DTD 1:  2560x1080   59.978424 Hz  64:27    66.636 kHz    181.250000 MHz (798 mm x 335 mm)
                 Hfront   48 Hsync  32 Hback   80 Hpol P
                 Vfront    3 Vsync  10 Vback   18 Vpol N
    Display Product Serial Number: ...
    Display Range Limits:
      Monitor ranges (Range Limits Only): 30-166 Hz V, 66-194 kHz H, max dotclock 530 MHz
    Display Product Name: '34UC89G'
  Extension blocks: 1
Checksum: 0x19

----------------

Block 1, CTA-861 Extension Block:
  Revision: 3
  Basic audio support
  Native DTDs: 1
  Audio Data Block:
    Linear PCM:
      Max channels: 2
      Supported sample rates (kHz): 48 44.1 32
      Supported sample sizes (bits): 16
  Speaker Allocation Data Block:
    FL/FR - Front Left/Right
  Vendor-Specific Data Block (NVIDIA), OUI 00-04-4B:
    01 01                                           '..'
  Detailed Timing Descriptors:
    DTD 2:  2560x1080   84.961142 Hz  64:27    95.496 kHz    259.750000 MHz (798 mm x 335 mm)
                 Hfront   48 Hsync  32 Hback   80 Hpol P
                 Vfront    3 Vsync  10 Vback   31 Vpol N
    DTD 3:  2560x1080   99.942890 Hz  64:27   113.235 kHz    308.000000 MHz (798 mm x 335 mm)
                 Hfront   48 Hsync  32 Hback   80 Hpol P
                 Vfront    3 Vsync  10 Vback   40 Vpol N
    DTD 4:  2560x1080  119.951280 Hz  64:27   137.224 kHz    373.250000 MHz (798 mm x 335 mm)
                 Hfront   48 Hsync  32 Hback   80 Hpol P
                 Vfront    3 Vsync  10 Vback   51 Vpol N
    DTD 5:  2560x1080  143.944786 Hz  64:27   166.544 kHz    453.000000 MHz (798 mm x 335 mm)
                 Hfront   48 Hsync  32 Hback   80 Hpol P
                 Vfront    3 Vsync  10 Vback   64 Vpol N
    DTD 6:  2560x1080  165.991076 Hz  64:27   194.210 kHz    528.250000 MHz (798 mm x 335 mm)
                 Hfront   48 Hsync  32 Hback   80 Hpol P
                 Vfront    3 Vsync  10 Vback   77 Vpol N
Checksum: 0x43  Unused space in Extension Block: 19 bytes

----------------

Warnings:

Block 1, CTA-861 Extension Block:
  IT Video Formats are overscanned by default, but normally this should be underscanned.
  Display Product Serial Number is set, so the Serial Number in the Base EDID should be 0.
EDID:
  Base EDID: Some timings are out of range of the Monitor Ranges:
    Horizontal Freq: 31.468 - 194.209 kHz (Monitor: 66.000 - 194.000 kHz)

Failures:

Block 1, CTA-861 Extension Block:
  Missing VCDB, needed for Set Selectable RGB Quantization to avoid interop issues.
EDID:
  Extension Block 2 started with EDID header, ignoring Extension Blocks >= 2.

EDID conformity: FAIL
