edid-decode (hex):

00 ff ff ff ff ff ff 00 06 93 60 15 00 00 00 00
19 1f 01 03 80 23 13 78 2a 91 54 a3 57 60 9a 24
0e 4e 55 23 08 00 81 c0 81 00 81 40 95 00 b3 00
01 01 01 01 01 01 1a 36 80 a0 70 38 1f 40 30 20
25 00 59 c2 10 00 00 1e 7f 21 56 aa 51 00 1e 30
40 8f 33 00 59 c2 10 00 00 1e 00 00 00 fd 00 32
41 1e a0 0f 00 0a 20 20 20 20 20 20 00 00 00 fc
00 53 50 31 36 30 33 0a 20 20 20 20 20 20 00 c1

00 ff ff ff ff ff ff 00 06 93 60 15 00 00 00 00
19 1f 01 03 80 23 13 78 2a 91 54 a3 57 60 9a 24
0e 4e 55 23 08 00 81 c0 81 00 81 40 95 00 b3 00
01 01 01 01 01 01 1a 36 80 a0 70 38 1f 40 30 20
25 00 59 c2 10 00 00 1e 7f 21 56 aa 51 00 1e 30
40 8f 33 00 59 c2 10 00 00 1e 00 00 00 fd 00 32
41 1e a0 0f 00 0a 20 20 20 20 20 20 00 00 00 fc
00 53 50 31 36 30 33 0a 20 20 20 20 20 20 00 c1

----------------

Block 0, Base EDID:
  EDID Structure Version & Revision: 1.3
  Vendor & Product Identification:
    Manufacturer: ATS
    Model: 5472
    Made in: week 25 of 2021
  Basic Display Parameters & Features:
    Digital display
    Maximum image size: 35 cm x 19 cm
    Gamma: 2.20
    DPMS levels: Off
    RGB color display
    First detailed timing is the preferred timing
  Color Characteristics:
    Red  : 0.6386, 0.3408
    Green: 0.3750, 0.6025
    Blue : 0.1416, 0.0556
    White: 0.3056, 0.3320
  Established Timings I & II:
    DMT 0x04:   640x480    59.940476 Hz   4:3     31.469 kHz     25.175000 MHz
    DMT 0x08:   800x600    56.250000 Hz   4:3     35.156 kHz     36.000000 MHz
    DMT 0x09:   800x600    60.316541 Hz   4:3     37.879 kHz     40.000000 MHz
    DMT 0x10:  1024x768    60.003840 Hz   4:3     48.363 kHz     65.000000 MHz
  Standard Timings:
    DMT 0x55:  1280x720    60.000000 Hz  16:9     45.000 kHz     74.250000 MHz
    DMT 0x1c:  1280x800    59.810326 Hz  16:10    49.702 kHz     83.500000 MHz
    DMT 0x20:  1280x960    60.000000 Hz   4:3     60.000 kHz    108.000000 MHz
    DMT 0x2f:  1440x900    59.887445 Hz  16:10    55.935 kHz    106.500000 MHz
    DMT 0x3a:  1680x1050   59.954250 Hz  16:10    65.290 kHz    146.250000 MHz
  Detailed Timing Descriptors:
    DTD 1:  1920x1080   59.933878 Hz  16:9     66.587 kHz    138.500000 MHz (345 mm x 194 mm)
                 Hfront   48 Hsync  32 Hback   80 Hpol P
                 Vfront    2 Vsync   5 Vback   24 Vpol P
    DTD 2:  1366x768    59.964364 Hz 683:384   47.852 kHz     85.750000 MHz (345 mm x 194 mm)
                 Hfront   64 Hsync 143 Hback  219 Hpol P
                 Vfront    3 Vsync   3 Vback   24 Vpol P
    Display Range Limits:
      Monitor ranges (GTF): 50-65 Hz V, 30-160 kHz H, max dotclock 150 MHz
    Display Product Name: 'SP1603'
Checksum: 0xc1

----------------

Failures:

EDID:
  Extension Block 1 started with EDID header, ignoring Extension Blocks >= 1.

EDID conformity: FAIL
