edid-decode (hex):

00 ff ff ff ff ff ff 00 10 ac 5f 42 4c 41 55 41
22 1f 01 03 80 35 1e 78 ea 59 35 ab 53 4e 9c 25
10 50 54 a5 4b 00 71 4f 81 80 a9 c0 d1 c0 01 01
01 01 01 01 01 01 02 3a 80 18 71 38 2d 40 58 2c
45 00 0f 28 21 00 00 1e 00 00 00 ff 00 31 4c 48
51 5a 38 33 0a 20 20 20 20 20 00 00 00 fc 00 44
45 4c 4c 20 53 32 34 32 32 48 5a 0a 00 00 00 fd
00 30 4b 1e 5a 14 00 0a 20 20 20 20 20 20 01 88

02 03 28 f1 4c 90 05 04 03 02 07 16 01 14 1f 12
13 23 09 1f 07 83 01 00 00 65 03 0c 00 10 00 68
1a 00 00 01 01 30 4b e6 02 3a 80 18 71 38 2d 40
58 2c 45 00 0f 28 21 00 00 1e 01 1d 00 72 51 d0
1e 20 6e 28 55 00 0f 28 21 00 00 1e 8c 0a d0 8a
20 e0 2d 10 10 3e 96 00 0f 28 21 00 00 18 2a 44
80 a0 70 38 27 40 30 20 35 00 0f 28 21 00 00 1a
00 00 00 00 00 00 00 00 00 00 00 00 00 00 00 b5

00 ff ff ff ff ff ff 00 10 ac 5f 42 4c 41 55 41
22 1f 01 03 80 35 1e 78 ea 59 35 ab 53 4e 9c 25
10 50 54 a5 4b 00 71 4f 81 80 a9 c0 d1 c0 01 01
01 01 01 01 01 01 02 3a 80 18 71 38 2d 40 58 2c
45 00 0f 28 21 00 00 1e 00 00 00 ff 00 31 4c 48
51 5a 38 33 0a 20 20 20 20 20 00 00 00 fc 00 44
45 4c 4c 20 53 32 34 32 32 48 5a 0a 00 00 00 fd
00 30 4b 1e 5a 14 00 0a 20 20 20 20 20 20 01 88

02 03 28 f1 4c 90 05 04 03 02 07 16 01 14 1f 12
13 23 09 1f 07 83 01 00 00 65 03 0c 00 10 00 68
1a 00 00 01 01 30 4b e6 02 3a 80 18 71 38 2d 40
58 2c 45 00 0f 28 21 00 00 1e 01 1d 00 72 51 d0
1e 20 6e 28 55 00 0f 28 21 00 00 1e 8c 0a d0 8a
20 e0 2d 10 10 3e 96 00 0f 28 21 00 00 18 2a 44
80 a0 70 38 27 40 30 20 35 00 0f 28 21 00 00 1a
00 00 00 00 00 00 00 00 00 00 00 00 00 00 00 b5

----------------

Block 0, Base EDID:
  EDID Structure Version & Revision: 1.3
  Vendor & Product Identification:
    Manufacturer: DEL
    Model: 16991
    Serial Number: ...
    Made in: week 34 of 2021
  Basic Display Parameters & Features:
    Digital display
    Maximum image size: 53 cm x 30 cm
    Gamma: 2.20
    DPMS levels: Standby Suspend Off
    RGB color display
    First detailed timing is the preferred timing
  Color Characteristics:
    Red  : 0.6689, 0.3251
    Green: 0.3066, 0.6103
    Blue : 0.1445, 0.0654
    White: 0.3134, 0.3291
  Established Timings I & II:
    IBM     :   720x400    70.081663 Hz   9:5     31.467 kHz     28.320000 MHz
    DMT 0x04:   640x480    59.940476 Hz   4:3     31.469 kHz     25.175000 MHz
    DMT 0x06:   640x480    75.000000 Hz   4:3     37.500 kHz     31.500000 MHz
    DMT 0x09:   800x600    60.316541 Hz   4:3     37.879 kHz     40.000000 MHz
    DMT 0x0b:   800x600    75.000000 Hz   4:3     46.875 kHz     49.500000 MHz
    DMT 0x10:  1024x768    60.003840 Hz   4:3     48.363 kHz     65.000000 MHz
    DMT 0x12:  1024x768    75.028582 Hz   4:3     60.023 kHz     78.750000 MHz
    DMT 0x24:  1280x1024   75.024675 Hz   5:4     79.976 kHz    135.000000 MHz
  Standard Timings:
    DMT 0x15:  1152x864    75.000000 Hz   4:3     67.500 kHz    108.000000 MHz
    DMT 0x23:  1280x1024   60.019740 Hz   5:4     63.981 kHz    108.000000 MHz
    DMT 0x53:  1600x900    60.000000 Hz  16:9     60.000 kHz    108.000000 MHz (RB)
    DMT 0x52:  1920x1080   60.000000 Hz  16:9     67.500 kHz    148.500000 MHz
  Detailed Timing Descriptors:
    DTD 1:  1920x1080   60.000000 Hz  16:9     67.500 kHz    148.500000 MHz (527 mm x 296 mm)
                 Hfront   88 Hsync  44 Hback  148 Hpol P
                 Vfront    4 Vsync   5 Vback   36 Vpol P
    Display Product Serial Number: ...
    Display Product Name: 'DELL S2422HZ'
    Display Range Limits:
      Monitor ranges (GTF): 48-75 Hz V, 30-90 kHz H, max dotclock 200 MHz
  Extension blocks: 1
Checksum: 0x88

----------------

Block 1, CTA-861 Extension Block:
  Revision: 3
  Underscans IT Video Formats by default
  Basic audio support
  Supports YCbCr 4:4:4
  Supports YCbCr 4:2:2
  Native DTDs: 1
  Video Data Block:
    VIC  16:  1920x1080   60.000000 Hz  16:9     67.500 kHz    148.500000 MHz (native)
    VIC   5:  1920x1080i  60.000000 Hz  16:9     33.750 kHz     74.250000 MHz
    VIC   4:  1280x720    60.000000 Hz  16:9     45.000 kHz     74.250000 MHz
    VIC   3:   720x480    59.940060 Hz  16:9     31.469 kHz     27.000000 MHz
    VIC   2:   720x480    59.940060 Hz   4:3     31.469 kHz     27.000000 MHz
    VIC   7:  1440x480i   59.940060 Hz  16:9     15.734 kHz     27.000000 MHz
    VIC  22:  1440x576i   50.000000 Hz  16:9     15.625 kHz     27.000000 MHz
    VIC   1:   640x480    59.940476 Hz   4:3     31.469 kHz     25.175000 MHz
    VIC  20:  1920x1080i  50.000000 Hz  16:9     28.125 kHz     74.250000 MHz
    VIC  31:  1920x1080   50.000000 Hz  16:9     56.250 kHz    148.500000 MHz
    VIC  18:   720x576    50.000000 Hz  16:9     31.250 kHz     27.000000 MHz
    VIC  19:  1280x720    50.000000 Hz  16:9     37.500 kHz     74.250000 MHz
  Audio Data Block:
    Linear PCM:
      Max channels: 2
      Supported sample rates (kHz): 96 88.2 48 44.1 32
      Supported sample sizes (bits): 24 20 16
  Speaker Allocation Data Block:
    FL/FR - Front Left/Right
  Vendor-Specific Data Block (HDMI), OUI 00-0C-03:
    Source physical address: 1.0.0.0
  Vendor-Specific Data Block (AMD), OUI 00-00-1A:
    Version: 1
    Flags 1: 0x01
      FreeSync Supported
    Minimum Refresh Rate: 48 Hz
    Maximum Refresh Rate: 75 Hz
    MCCS VCP Code: 0xe6
  Detailed Timing Descriptors:
    DTD 2:  1920x1080   60.000000 Hz  16:9     67.500 kHz    148.500000 MHz (527 mm x 296 mm)
                 Hfront   88 Hsync  44 Hback  148 Hpol P
                 Vfront    4 Vsync   5 Vback   36 Vpol P
    DTD 3:  1280x720    60.000000 Hz  16:9     45.000 kHz     74.250000 MHz (527 mm x 296 mm)
                 Hfront  110 Hsync  40 Hback  220 Hpol P
                 Vfront    5 Vsync   5 Vback   20 Vpol P
    DTD 4:   720x480    59.940060 Hz   3:2     31.469 kHz     27.000000 MHz (527 mm x 296 mm)
                 Hfront   16 Hsync  62 Hback   60 Hpol N
                 Vfront    9 Vsync   6 Vback   30 Vpol N
    DTD 5:  1920x1080   74.972503 Hz  16:9     83.894 kHz    174.500000 MHz (527 mm x 296 mm)
                 Hfront   48 Hsync  32 Hback   80 Hpol P
                 Vfront    3 Vsync   5 Vback   31 Vpol N
Checksum: 0xb5  Unused space in Extension Block: 15 bytes

----------------

Warnings:

Block 1, CTA-861 Extension Block:
  Detailed Timing Descriptor #4: Image size is 527x296 mm, but based on the picture AR it should be 444x296 mm.
  Display Product Serial Number is set, so the Serial Number in the Base EDID should be 0.
  Add a Colorimetry Data Block with the sRGB colorimetry bit set to avoid interop issues.
EDID:
  Base EDID: Some timings are out of range of the Monitor Ranges:
    Horizontal Freq: 15.625 - 83.894 kHz (Monitor: 30.000 - 90.000 kHz)

Failures:

Block 1, CTA-861 Extension Block:
  Missing VCDB, needed for Set Selectable RGB Quantization to avoid interop issues.
EDID:
  Extension Block 2 started with EDID header, ignoring Extension Blocks >= 2.

EDID conformity: FAIL
