edid-decode (hex):

00 ff ff ff ff ff ff 00 10 ac 02 e0 39 56 34 47
31 0d 01 04 a5 24 1d 78 e6 09 25 a2 57 4b 99 24
18 50 54 a5 4b 00 81 80 71 4f 01 01 01 01 01 01
01 01 01 01 01 01 30 2a 00 98 51 00 2a 40 30 70
13 00 67 1f 11 00 00 1e 00 00 00 ff 00 37 52 34
37 37 33 43 33 47 34 56 39 0a 00 00 00 fc 00 44
45 4c 4c 20 31 38 30 30 46 50 0a 20 00 00 00 fd
00 38 4b 1e 50 0e 00 0a 20 20 20 20 20 20 00 a7

00 ff ff ff ff ff ff 00 10 ac 02 e0 39 56 34 47
31 0d 01 04 a5 24 1d 78 e6 09 25 a2 57 4b 99 24
18 50 54 a5 4b 00 81 80 71 4f 01 01 01 01 01 01
01 01 01 01 01 01 30 2a 00 98 51 00 2a 40 30 70
13 00 67 1f 11 00 00 1e 00 00 00 ff 00 37 52 34
37 37 33 43 33 47 34 56 39 0a 00 00 00 fc 00 44
45 4c 4c 20 31 38 30 30 46 50 0a 20 00 00 00 fd
00 38 4b 1e 50 0e 00 0a 20 20 20 20 20 20 00 a7

----------------

Block 0, Base EDID:
  EDID Structure Version & Revision: 1.4
  Vendor & Product Identification:
    Manufacturer: DEL
    Model: 57346
    Serial Number: ...
    Made in: week 49 of 2003
  Basic Display Parameters & Features:
    Digital display
    Bits per primary color channel: 8
    DisplayPort interface
    Maximum image size: 36 cm x 29 cm
    Gamma: 2.20
    DPMS levels: Standby Suspend Off
    Supported color formats: RGB 4:4:4
    Default (sRGB) color space is primary color space
    First detailed timing includes the native pixel format and preferred refresh rate
  Color Characteristics:
    Red  : 0.6328, 0.3398
    Green: 0.2949, 0.5986
    Blue : 0.1406, 0.0957
    White: 0.3134, 0.3291
  Established Timings I & II:
    IBM     :   720x400    70.081663 Hz   9:5     31.467 kHz     28.320000 MHz
    DMT 0x04:   640x480    59.940476 Hz   4:3     31.469 kHz     25.175000 MHz
    DMT 0x06:   640x480    75.000000 Hz   4:3     37.500 kHz     31.500000 MHz
    DMT 0x09:   800x600    60.316541 Hz   4:3     37.879 kHz     40.000000 MHz
    DMT 0x0b:   800x600    75.000000 Hz   4:3     46.875 kHz     49.500000 MHz
    DMT 0x10:  1024x768    60.003840 Hz   4:3     48.363 kHz     65.000000 MHz
    DMT 0x12:  1024x768    75.028582 Hz   4:3     60.023 kHz     78.750000 MHz
    DMT 0x24:  1280x1024   75.024675 Hz   5:4     79.976 kHz    135.000000 MHz
  Standard Timings:
    DMT 0x23:  1280x1024   60.019740 Hz   5:4     63.981 kHz    108.000000 MHz
    DMT 0x15:  1152x864    75.000000 Hz   4:3     67.500 kHz    108.000000 MHz
  Detailed Timing Descriptors:
    DTD 1:  1280x1024   60.019740 Hz   5:4     63.981 kHz    108.000000 MHz (359 mm x 287 mm)
                 Hfront   48 Hsync 112 Hback  248 Hpol P
                 Vfront    1 Vsync   3 Vback   38 Vpol P
    Display Product Serial Number: ...
    Display Product Name: 'DELL 1800FP'
    Display Range Limits:
      Monitor ranges (GTF): 56-75 Hz V, 30-80 kHz H, max dotclock 140 MHz
Checksum: 0xa7

----------------

Warnings:

Block 0, Base EDID:
  Display Range Limits: GTF support is deprecated in EDID 1.4.

Failures:

Block 0, Base EDID:
  Basic Display Parameters & Features: sRGB is signaled, but the chromaticities do not match.
  Display Range Limits: GTF is supported, but the display does not support continuous frequencies.
EDID:
  Extension Block 1 started with EDID header, ignoring Extension Blocks >= 1.

EDID conformity: FAIL
