edid-decode (hex):

00 ff ff ff ff ff ff 00 4d 10 51 15 00 00 00 00
31 1f 01 04 b5 1d 12 78 0b 6e 60 a9 52 49 a1 26
0d 50 54 00 00 00 01 01 01 01 01 01 01 01 01 01
01 01 01 01 01 01 72 e7 00 a0 f0 60 45 90 30 20
36 00 20 b4 10 00 00 18 00 00 00 fd 00 30 3c 94
94 3b 01 0a 20 20 20 20 20 20 00 00 00 fe 00 52
4b 34 34 4a 80 4c 51 31 33 34 52 31 00 00 00 00
00 02 41 03 32 01 12 00 00 0b 41 0a 20 20 01 0f

02 03 0f 00 e3 05 80 00 e6 06 05 01 66 66 26 00
00 00 00 00 00 00 00 00 00 00 00 00 00 00 00 00
00 00 00 00 00 00 00 00 00 00 00 00 00 00 00 00
00 00 00 00 00 00 00 00 00 00 00 00 00 00 00 00
00 00 00 00 00 00 00 00 00 00 00 00 00 00 00 00
00 00 00 00 00 00 00 00 00 00 00 00 00 00 00 00
00 00 00 00 00 00 00 00 00 00 00 00 00 00 00 00
00 00 00 00 00 00 00 00 00 00 00 00 00 00 00 a0

00 ff ff ff ff ff ff 00 4d 10 51 15 00 00 00 00
31 1f 01 04 b5 1d 12 78 0b 6e 60 a9 52 49 a1 26
0d 50 54 00 00 00 01 01 01 01 01 01 01 01 01 01
01 01 01 01 01 01 72 e7 00 a0 f0 60 45 90 30 20
36 00 20 b4 10 00 00 18 00 00 00 fd 00 30 3c 94
94 3b 01 0a 20 20 20 20 20 20 00 00 00 fe 00 52
4b 34 34 4a 80 4c 51 31 33 34 52 31 00 00 00 00
00 02 41 03 32 01 12 00 00 0b 41 0a 20 20 01 0f

02 03 0f 00 e3 05 80 00 e6 06 05 01 66 66 26 00
00 00 00 00 00 00 00 00 00 00 00 00 00 00 00 00
00 00 00 00 00 00 00 00 00 00 00 00 00 00 00 00
00 00 00 00 00 00 00 00 00 00 00 00 00 00 00 00
00 00 00 00 00 00 00 00 00 00 00 00 00 00 00 00
00 00 00 00 00 00 00 00 00 00 00 00 00 00 00 00
00 00 00 00 00 00 00 00 00 00 00 00 00 00 00 00
00 00 00 00 00 00 00 00 00 00 00 00 00 00 00 a0

----------------

Block 0, Base EDID:
  EDID Structure Version & Revision: 1.4
  Vendor & Product Identification:
    Manufacturer: SHP
    Model: 5457
    Made in: week 49 of 2021
  Basic Display Parameters & Features:
    Digital display
    Bits per primary color channel: 10
    DisplayPort interface
    Maximum image size: 29 cm x 18 cm
    Gamma: 2.20
    Supported color formats: RGB 4:4:4, YCrCb 4:4:4
    First detailed timing includes the native pixel format and preferred refresh rate
    Display supports continuous frequencies
  Color Characteristics:
    Red  : 0.6611, 0.3222
    Green: 0.2880, 0.6308
    Blue : 0.1494, 0.0527
    White: 0.3125, 0.3281
  Established Timings I & II: none
  Standard Timings: none
  Detailed Timing Descriptors:
    DTD 1:  3840x2400   59.993925 Hz  16:10   148.125 kHz    592.500000 MHz (288 mm x 180 mm)
                 Hfront   48 Hsync  32 Hback   80 Hpol N
                 Vfront    3 Vsync   6 Vback   60 Vpol N
    Display Range Limits:
      Monitor ranges (Range Limits Only): 48-60 Hz V, 148-148 kHz H, max dotclock 590 MHz
    Alphanumeric Data String: 'RK44J.LQ134R1'
    Manufacturer-Specified Display Descriptor (0x00): 00 00 00 02 41 03 32 01 12 00 00 0b 41 0a 20 20 '....A.2.....A.  '
  Extension blocks: 1
Checksum: 0x0f

----------------

Block 1, CTA-861 Extension Block:
  Revision: 3
  Native detailed modes: 0
  Colorimetry Data Block:
    BT2020RGB
  HDR Static Metadata Data Block:
    Electro optical transfer functions:
      Traditional gamma - SDR luminance range
      SMPTE ST2084
    Supported static metadata descriptors:
      Static metadata type 1
    Desired content max luminance: 102 (455.515 cd/m^2)
    Desired content max frame-average luminance: 102 (455.515 cd/m^2)
    Desired content min luminance: 38 (0.101 cd/m^2)
Checksum: 0xa0  Unused space in Extension Block: 112 bytes

----------------

Block 2, Unknown EDID Extension Block 0x00:
  00 ff ff ff ff ff ff 00 4d 10 51 15 00 00 00 00 '........M.Q.....'
  31 1f 01 04 b5 1d 12 78 0b 6e 60 a9 52 49 a1 26 '1......x.n`.RI.&'
  0d 50 54 00 00 00 01 01 01 01 01 01 01 01 01 01 '.PT.............'
  01 01 01 01 01 01 72 e7 00 a0 f0 60 45 90 30 20 '......r....`E.0 '
  36 00 20 b4 10 00 00 18 00 00 00 fd 00 30 3c 94 '6. ..........0<.'
  94 3b 01 0a 20 20 20 20 20 20 00 00 00 fe 00 52 '.;..      .....R'
  4b 34 34 4a 80 4c 51 31 33 34 52 31 00 00 00 00 'K44J.LQ134R1....'
  00 02 41 03 32 01 12 00 00 0b 41 0a 20 20 01 0f '..A.2.....A.  ..'
Checksum: 0x0f

----------------

Block 3, CTA-861 Extension Block:
  Revision: 3
  Native detailed modes: 0
  Colorimetry Data Block:
    BT2020RGB
  HDR Static Metadata Data Block:
    Electro optical transfer functions:
      Traditional gamma - SDR luminance range
      SMPTE ST2084
    Supported static metadata descriptors:
      Static metadata type 1
    Desired content max luminance: 102 (455.515 cd/m^2)
    Desired content max frame-average luminance: 102 (455.515 cd/m^2)
    Desired content min luminance: 38 (0.101 cd/m^2)
Checksum: 0xa0  Unused space in Extension Block: 112 bytes

----------------

Warnings:

Block 0, Base EDID:
  Alphanumeric Data String: Non-ASCII character 0x80 at position 5, can cause problems.
  Missing Display Product Name.
Block 1, CTA-861 Extension Block:
  IT Video Formats are overscanned by default, but normally this should be underscanned.
  Colorimetry Data Block: Set the sRGB colorimetry bit to avoid interop issues.
Block 3, CTA-861 Extension Block:
  IT Video Formats are overscanned by default, but normally this should be underscanned.
  Colorimetry Data Block: Set the sRGB colorimetry bit to avoid interop issues.
EDID:
  Base EDID: Some timings are out of range of the Monitor Ranges:
    Maximum Clock: 592.500 MHz (Monitor: 590.000 MHz)
    Could be due to a Monitor Range off-by-one rounding issue

Failures:

Block 1, CTA-861 Extension Block:
  Required 640x480p60 timings are missing in the established timings and the SVD list (VIC 1).
  Missing VCDB, needed for Set Selectable RGB Quantization to avoid interop issues.
Block 2, Base EDID:
  Unknown Extension Block.
Block 3, CTA-861 Extension Block:
  Colorimetry Data Block: Only one instance of this Data Block is allowed.
  HDR Static Metadata Data Block: Only one instance of this Data Block is allowed.
EDID:
  Base EDID: EDID specified 1 extension block(s), but found 3 extension block(s).

EDID conformity: FAIL
