edid-decode (hex):

00 ff ff ff ff ff ff 00 2e cd 10 20 71 b4 32 01
1c 13 01 03 0e 34 21 78 ee ee a6 9e 54 4c 99 26
19 4f 54 ff ff 80 e1 0f e1 4f d1 0f d1 4f a9 0f
a9 4f b3 0f c9 0f b0 18 00 20 41 00 20 30 10 60
13 00 2c e6 10 00 00 1e 00 00 00 10 00 00 2a 30
30 70 13 00 52 0e 11 00 00 1e 00 00 00 10 00 38
4c 1e 53 11 00 0a 20 20 20 20 20 20 00 00 00 10
00 00 20 30 10 60 13 00 2c e6 10 00 00 1e 00 67

00 ff ff ff ff ff ff 00 2e cd 10 20 71 b4 32 01
1c 13 01 03 0e 34 21 78 ee ee a6 9e 54 4c 99 26
19 4f 54 ff ff 80 e1 0f e1 4f d1 0f d1 4f a9 0f
a9 4f b3 0f c9 0f b0 18 00 20 41 00 20 30 10 60
13 00 2c e6 10 00 00 1e 00 00 00 10 00 00 2a 30
30 70 13 00 52 0e 11 00 00 1e 00 00 00 10 00 38
4c 1e 53 11 00 0a 20 20 20 20 20 20 00 00 00 10
00 00 20 30 10 60 13 00 2c e6 10 00 00 1e 00 67

----------------

Block 0, Base EDID:
  EDID Structure Version & Revision: 1.3
  Vendor & Product Identification:
    Manufacturer: KVM
    Model: 8208
    Serial Number: ...
    Made in: week 28 of 2009
  Basic Display Parameters & Features:
    Analog display
    Signal Level Standard: 0.700 : 0.300 : 1.000 V p-p
    Blank level equals black level
    Sync: Separate Composite SyncOnGreen
    Maximum image size: 52 cm x 33 cm
    Gamma: 2.20
    DPMS levels: Standby Suspend Off
    RGB color display
    Default (sRGB) color space is primary color space
    First detailed timing is the preferred timing
  Color Characteristics:
    Red  : 0.6201, 0.3300
    Green: 0.2998, 0.5996
    Blue : 0.1503, 0.0996
    White: 0.3095, 0.3300
  Established Timings I & II:
    IBM     :   720x400    70.081663 Hz   9:5     31.467 kHz     28.320000 MHz
    IBM     :   720x400    87.849542 Hz   9:5     39.444 kHz     35.500000 MHz
    DMT 0x04:   640x480    59.940476 Hz   4:3     31.469 kHz     25.175000 MHz
    Apple   :   640x480    66.666667 Hz   4:3     35.000 kHz     30.240000 MHz
    DMT 0x05:   640x480    72.808802 Hz   4:3     37.861 kHz     31.500000 MHz
    DMT 0x06:   640x480    75.000000 Hz   4:3     37.500 kHz     31.500000 MHz
    DMT 0x08:   800x600    56.250000 Hz   4:3     35.156 kHz     36.000000 MHz
    DMT 0x09:   800x600    60.316541 Hz   4:3     37.879 kHz     40.000000 MHz
    DMT 0x0a:   800x600    72.187572 Hz   4:3     48.077 kHz     50.000000 MHz
    DMT 0x0b:   800x600    75.000000 Hz   4:3     46.875 kHz     49.500000 MHz
    Apple   :   832x624    74.551266 Hz   4:3     49.726 kHz     57.284000 MHz
    DMT 0x0f:  1024x768i   86.957532 Hz   4:3     35.522 kHz     44.900000 MHz
    DMT 0x10:  1024x768    60.003840 Hz   4:3     48.363 kHz     65.000000 MHz
    DMT 0x11:  1024x768    70.069359 Hz   4:3     56.476 kHz     75.000000 MHz
    DMT 0x12:  1024x768    75.028582 Hz   4:3     60.023 kHz     78.750000 MHz
    DMT 0x24:  1280x1024   75.024675 Hz   5:4     79.976 kHz    135.000000 MHz
    Apple   :  1152x870    75.061550 Hz 192:145   68.681 kHz    100.000000 MHz
  Standard Timings:
    GTF     :  2048x1280   75.000000 Hz  16:10   100.200 kHz    280.560000 MHz
    GTF     :  2048x1536   74.999956 Hz   4:3    120.225 kHz    340.477000 MHz
    DMT 0x46:  1920x1200   74.930340 Hz  16:10    94.038 kHz    245.250000 MHz
    DMT 0x4a:  1920x1440   75.000000 Hz   4:3    112.500 kHz    297.000000 MHz
    GTF     :  1600x1000   75.000000 Hz  16:10    78.300 kHz    169.128000 MHz
    DMT 0x36:  1600x1200   75.000000 Hz   4:3     93.750 kHz    202.500000 MHz
    DMT 0x3b:  1680x1050   74.892027 Hz  16:10    82.306 kHz    187.000000 MHz
    GTF     :  1856x1160   75.000131 Hz  16:10    90.825 kHz    229.606000 MHz
  Detailed Timing Descriptors:
    DTD 1:  1024x768    60.213415 Hz   4:3     48.171 kHz     63.200000 MHz (300 mm x 230 mm)
                 Hfront   16 Hsync  96 Hback  176 Hpol P
                 Vfront    1 Vsync   3 Vback   28 Vpol P
    Dummy Descriptor:
    Dummy Descriptor:
    Dummy Descriptor:
Checksum: 0x67

----------------

Failures:

Block 0, Base EDID:
  Basic Display Parameters & Features: sRGB is signaled, but the chromaticities do not match.
  Detailed Timing Descriptor #1: Mismatch of image size 300x230 mm vs display size 520x330 mm.
  Dummy Descriptor: Dummy block filled with garbage.
  Dummy Descriptor: Dummy block filled with garbage.
  Dummy Descriptor: Dummy block filled with garbage.
  Missing Display Product Name.
  Missing Display Range Limits Descriptor.
EDID:
  Extension Block 1 started with EDID header, ignoring Extension Blocks >= 1.

EDID conformity: FAIL
