edid-decode (hex):

00 ff ff ff ff ff ff 00 5a 8b 00 35 00 00 00 00
13 1d 01 04 a5 52 23 78 3b ee d5 a3 54 4c 99 23
0f 50 54 a5 4b 00 81 c0 81 80 95 00 71 4f b3 00
d1 c0 01 01 01 01 b8 47 00 a0 a0 38 2d 40 30 20
35 00 34 5e 31 00 00 1a 4a aa 00 a0 a0 38 21 40
30 40 35 00 34 5e 31 00 00 1a 00 00 00 fd 00 3c
a7 dc dc 3b 01 0a 20 20 20 20 20 20 00 00 00 fc
00 47 4e 33 35 44 41 0a 20 20 20 20 20 20 01 2a

02 03 20 f1 4a 01 02 03 04 90 11 12 13 1f 3f 23
09 07 07 83 01 00 00 68 1a 00 00 01 01 3c a7 00
e5 e5 00 78 a0 38 12 40 42 16 86 00 34 5e 31 00
00 1e 3e 29 00 18 51 38 30 40 b0 58 8a 00 34 5e
31 00 00 1e 70 8f 00 a0 a0 38 2d 40 30 40 35 00
34 5e 31 00 00 1e 1a c6 00 a0 a0 38 32 40 30 40
35 00 34 5e 31 00 00 1e 1c e3 00 a0 a0 38 2d 40
30 40 35 00 34 5e 31 00 00 1e 00 00 00 00 00 13

----------------

Block 0, Base EDID:
  EDID Structure Version & Revision: 1.4
  Vendor & Product Identification:
    Manufacturer: VTK
    Model: 13568
    Made in: week 19 of 2019
  Basic Display Parameters & Features:
    Digital display
    Bits per primary color channel: 8
    DisplayPort interface
    Maximum image size: 82 cm x 35 cm
    Gamma: 2.20
    DPMS levels: Off
    Supported color formats: RGB 4:4:4, YCrCb 4:4:4, YCrCb 4:2:2
    First detailed timing includes the native pixel format and preferred refresh rate
    Display supports continuous frequencies
  Color Characteristics:
    Red  : 0.6396, 0.3300
    Green: 0.2998, 0.5996
    Blue : 0.1396, 0.0595
    White: 0.3134, 0.3291
  Established Timings I & II:
    IBM     :   720x400    70.081663 Hz   9:5     31.467 kHz     28.320000 MHz
    DMT 0x04:   640x480    59.940476 Hz   4:3     31.469 kHz     25.175000 MHz
    DMT 0x06:   640x480    75.000000 Hz   4:3     37.500 kHz     31.500000 MHz
    DMT 0x09:   800x600    60.316541 Hz   4:3     37.879 kHz     40.000000 MHz
    DMT 0x0b:   800x600    75.000000 Hz   4:3     46.875 kHz     49.500000 MHz
    DMT 0x10:  1024x768    60.003840 Hz   4:3     48.363 kHz     65.000000 MHz
    DMT 0x12:  1024x768    75.028582 Hz   4:3     60.023 kHz     78.750000 MHz
    DMT 0x24:  1280x1024   75.024675 Hz   5:4     79.976 kHz    135.000000 MHz
  Standard Timings:
    DMT 0x55:  1280x720    60.000000 Hz  16:9     45.000 kHz     74.250000 MHz
    DMT 0x23:  1280x1024   60.019740 Hz   5:4     63.981 kHz    108.000000 MHz
    DMT 0x2f:  1440x900    59.887445 Hz  16:10    55.935 kHz    106.500000 MHz
    DMT 0x15:  1152x864    75.000000 Hz   4:3     67.500 kHz    108.000000 MHz
    DMT 0x3a:  1680x1050   59.954250 Hz  16:10    65.290 kHz    146.250000 MHz
    DMT 0x52:  1920x1080   60.000000 Hz  16:9     67.500 kHz    148.500000 MHz
  Detailed Timing Descriptors:
    DTD 1:  2560x1080   60.000000 Hz  64:27    67.500 kHz    183.600000 MHz (820 mm x 350 mm)
                 Hfront   48 Hsync  32 Hback   80 Hpol P
                 Vfront    3 Vsync   5 Vback   37 Vpol N
    DTD 2:  2560x1080  144.000053 Hz  64:27   160.272 kHz    435.940000 MHz (820 mm x 350 mm)
                 Hfront   48 Hsync  64 Hback   48 Hpol P
                 Vfront    3 Vsync   5 Vback   25 Vpol N
    Display Range Limits:
      Monitor ranges (Range Limits Only): 60-167 Hz V, 220-220 kHz H, max dotclock 590 MHz
    Display Product Name: 'GN35DA'
  Extension blocks: 1
Checksum: 0x2a

----------------

Block 1, CTA-861 Extension Block:
  Revision: 3
  Underscans IT Video Formats by default
  Basic audio support
  Supports YCbCr 4:4:4
  Supports YCbCr 4:2:2
  Native DTDs: 1
  Video Data Block:
    VIC   1:   640x480    59.940476 Hz   4:3     31.469 kHz     25.175000 MHz
    VIC   2:   720x480    59.940060 Hz   4:3     31.469 kHz     27.000000 MHz
    VIC   3:   720x480    59.940060 Hz  16:9     31.469 kHz     27.000000 MHz
    VIC   4:  1280x720    60.000000 Hz  16:9     45.000 kHz     74.250000 MHz
    VIC  16:  1920x1080   60.000000 Hz  16:9     67.500 kHz    148.500000 MHz (native)
    VIC  17:   720x576    50.000000 Hz   4:3     31.250 kHz     27.000000 MHz
    VIC  18:   720x576    50.000000 Hz  16:9     31.250 kHz     27.000000 MHz
    VIC  19:  1280x720    50.000000 Hz  16:9     37.500 kHz     74.250000 MHz
    VIC  31:  1920x1080   50.000000 Hz  16:9     56.250 kHz    148.500000 MHz
    VIC  63:  1920x1080  120.000000 Hz  16:9    135.000 kHz    297.000000 MHz
  Audio Data Block:
    Linear PCM:
      Max channels: 2
      Supported sample rates (kHz): 48 44.1 32
      Supported sample sizes (bits): 24 20 16
  Speaker Allocation Data Block:
    FL/FR - Front Left/Right
  Vendor-Specific Data Block (AMD), OUI 00-00-1A:
    Version: 1
    Flags 1: 0x01
      FreeSync Supported
    Minimum Refresh Rate: 60 Hz
    Maximum Refresh Rate: 167 Hz
  Detailed Timing Descriptors:
    DTD 3:  2560x1080  200.000680 Hz  64:27   219.601 kHz    588.530000 MHz (820 mm x 350 mm)
                 Hfront   66 Hsync  22 Hback   32 Hpol P
                 Vfront    8 Vsync   6 Vback    4 Vpol P
    DTD 4:  1280x1080   59.999545 Hz  32:27    67.679 kHz    105.580000 MHz (820 mm x 350 mm)
                 Hfront  176 Hsync  88 Hback   16 Hpol P
                 Vfront    8 Vsync  10 Vback   30 Vpol P
    DTD 5:  2560x1080  120.000000 Hz  64:27   135.000 kHz    367.200000 MHz (820 mm x 350 mm)
                 Hfront   48 Hsync  64 Hback   48 Hpol P
                 Vfront    3 Vsync   5 Vback   37 Vpol P
    DTD 6:  2560x1080  164.998699 Hz  64:27   186.449 kHz    507.140000 MHz (820 mm x 350 mm)
                 Hfront   48 Hsync  64 Hback   48 Hpol P
                 Vfront    3 Vsync   5 Vback   42 Vpol P
    DTD 7:  2560x1080  190.000000 Hz  64:27   213.750 kHz    581.400000 MHz (820 mm x 350 mm)
                 Hfront   48 Hsync  64 Hback   48 Hpol P
                 Vfront    3 Vsync   5 Vback   37 Vpol P
Checksum: 0x13  Unused space in Extension Block: 5 bytes

----------------

Warnings:

Block 1, CTA-861 Extension Block:
  Video Data Block: VIC 1 and the first DTD are not identical. Is this intended?
  Video Data Block: All VICs are in ascending order, and the first (preferred) VIC <= 4, is that intended?
  Detailed Timing Descriptor #4: Image size is 820x350 mm, but based on the picture AR it should be 414x350 mm.
  Add a Colorimetry Data Block with the sRGB colorimetry bit set to avoid interop issues.
EDID:
  Base EDID: Some timings are out of range of the Monitor Ranges:
    Vertical Freq: 50.000 - 200.001 Hz (Monitor: 60.000 - 167.000 Hz)
    Horizontal Freq: 31.250 - 219.600 kHz (Monitor: 220.000 - 220.000 kHz)

Failures:

Block 1, CTA-861 Extension Block:
  Missing VCDB, needed for Set Selectable RGB Quantization to avoid interop issues.
EDID:
  CTA-861: Native progressive timings are a mix of several resolutions.

EDID conformity: FAIL
