edid-decode (hex):

00 ff ff ff ff ff ff 00 4d 67 21 24 00 00 00 00
01 23 01 04 b5 35 1e 78 3b 1d f5 ae 4f 35 b3 25
0d 50 54 01 08 00 81 80 81 00 a9 c0 95 00 b3 00
01 01 01 01 01 01 02 3a 80 18 71 38 2d 40 30 20
46 00 58 4a 21 00 00 1a 00 00 00 fd 00 3c b4 df
df 28 01 0a 20 20 20 20 20 20 00 00 00 ff 00 30
30 30 30 30 30 30 30 30 30 30 30 0a 00 00 00 fc
00 48 32 34 53 31 37 0a 20 20 20 20 20 20 01 a6

02 03 41 f1 4a 05 14 00 10 3f 03 01 04 07 00 23
09 87 07 83 01 00 00 65 03 0c 00 10 00 6d 1a 00
00 02 01 3c b4 00 00 00 00 00 00 e2 00 c0 e3 05
e3 01 e6 06 07 01 62 62 2f 67 d8 5d c4 01 78 c0
00 35 91 80 6a 70 38 20 40 30 20 35 00 56 50 21
00 00 1a 1b 82 80 88 70 38 2d 40 17 20 35 00 58
4a 21 00 00 1e f0 9d 80 64 70 38 20 40 30 20 35
00 57 50 21 00 00 1a 00 00 00 00 00 00 00 00 d9

00 ff ff ff ff ff ff 00 4d 67 21 24 00 00 00 00
01 23 01 04 b5 35 1e 78 3b 1d f5 ae 4f 35 b3 25
0d 50 54 01 08 00 81 80 81 00 a9 c0 95 00 b3 00
01 01 01 01 01 01 02 3a 80 18 71 38 2d 40 30 20
46 00 58 4a 21 00 00 1a 00 00 00 fd 00 3c b4 df
df 28 01 0a 20 20 20 20 20 20 00 00 00 ff 00 30
30 30 30 30 30 30 30 30 30 30 30 0a 00 00 00 fc
00 48 32 34 53 31 37 0a 20 20 20 20 20 20 01 a6

02 03 41 f1 4a 05 14 00 10 3f 03 01 04 07 00 23
09 87 07 83 01 00 00 65 03 0c 00 10 00 6d 1a 00
00 02 01 3c b4 00 00 00 00 00 00 e2 00 c0 e3 05
e3 01 e6 06 07 01 62 62 2f 67 d8 5d c4 01 78 c0
00 35 91 80 6a 70 38 20 40 30 20 35 00 56 50 21
00 00 1a 1b 82 80 88 70 38 2d 40 17 20 35 00 58
4a 21 00 00 1e f0 9d 80 64 70 38 20 40 30 20 35
00 57 50 21 00 00 1a 00 00 00 00 00 00 00 00 d9

----------------

Block 0, Base EDID:
  EDID Structure Version & Revision: 1.4
  Vendor & Product Identification:
    Manufacturer: SKG
    Model: 9249
    Made in: week 1 of 2025
  Basic Display Parameters & Features:
    Digital display
    Bits per primary color channel: 10
    DisplayPort interface
    Maximum image size: 53 cm x 30 cm
    Gamma: 2.20
    DPMS levels: Off
    Supported color formats: RGB 4:4:4, YCrCb 4:4:4, YCrCb 4:2:2
    First detailed timing includes the native pixel format and preferred refresh rate
    Display supports continuous frequencies
  Color Characteristics:
    Red  : 0.6796, 0.3095
    Green: 0.2099, 0.7001
    Blue : 0.1474, 0.0537
    White: 0.3134, 0.3291
  Established Timings I & II:
    DMT 0x09:   800x600    60.316541 Hz   4:3     37.879 kHz     40.000000 MHz
    DMT 0x10:  1024x768    60.003840 Hz   4:3     48.363 kHz     65.000000 MHz
  Standard Timings:
    DMT 0x23:  1280x1024   60.019740 Hz   5:4     63.981 kHz    108.000000 MHz
    DMT 0x1c:  1280x800    59.810326 Hz  16:10    49.702 kHz     83.500000 MHz
    DMT 0x53:  1600x900    60.000000 Hz  16:9     60.000 kHz    108.000000 MHz (RB)
    DMT 0x2f:  1440x900    59.887445 Hz  16:10    55.935 kHz    106.500000 MHz
    DMT 0x3a:  1680x1050   59.954250 Hz  16:10    65.290 kHz    146.250000 MHz
  Detailed Timing Descriptors:
    DTD 1:  1920x1080   60.000000 Hz  16:9     67.500 kHz    148.500000 MHz (600 mm x 330 mm)
                 Hfront   48 Hsync  32 Hback  200 Hpol P
                 Vfront    4 Vsync   6 Vback   35 Vpol N
    Display Range Limits:
      Monitor ranges (Range Limits Only): 60-180 Hz V, 223-223 kHz H, max dotclock 400 MHz
    Display Product Serial Number: ...
    Display Product Name: 'H24S17'
  Extension blocks: 1
Checksum: 0xa6

----------------

Block 1, CTA-861 Extension Block:
  Revision: 3
  Underscans IT Video Formats by default
  Basic audio support
  Supports YCbCr 4:4:4
  Supports YCbCr 4:2:2
  Native DTDs: 1
  Video Data Block:
    VIC   5:  1920x1080i  60.000000 Hz  16:9     33.750 kHz     74.250000 MHz
    VIC  20:  1920x1080i  50.000000 Hz  16:9     28.125 kHz     74.250000 MHz
    VIC  16:  1920x1080   60.000000 Hz  16:9     67.500 kHz    148.500000 MHz
    VIC  63:  1920x1080  120.000000 Hz  16:9    135.000 kHz    297.000000 MHz
    VIC   3:   720x480    59.940060 Hz  16:9     31.469 kHz     27.000000 MHz
    VIC   1:   640x480    59.940476 Hz   4:3     31.469 kHz     25.175000 MHz
    VIC   4:  1280x720    60.000000 Hz  16:9     45.000 kHz     74.250000 MHz
    VIC   7:  1440x480i   59.940060 Hz  16:9     15.734 kHz     27.000000 MHz
  Audio Data Block:
    Linear PCM:
      Max channels: 2
      Supported sample rates (kHz): 48 44.1 32
      Supported sample sizes (bits): 24 20 16
  Speaker Allocation Data Block:
    FL/FR - Front Left/Right
  Vendor-Specific Data Block (HDMI), OUI 00-0C-03:
    Source physical address: 1.0.0.0
  Vendor-Specific Data Block (AMD), OUI 00-00-1A:
    Version: 2
    Flags 1: 0x01
      FreeSync Supported
    Minimum Refresh Rate: 60 Hz
    Maximum Refresh Rate: 180 Hz
    Flags 5: 0x00
  Video Capability Data Block:
    YCbCr quantization: Selectable (via AVI YQ)
    RGB quantization: Selectable (via AVI Q)
    PT scan behavior: No Data
    IT scan behavior: IT video formats not supported
    CE scan behavior: CE video formats not supported
  Colorimetry Data Block:
    xvYCC601
    xvYCC709
    BT2020cYCC
    BT2020YCC
    BT2020RGB
    Gamut Boundary Description Metadata Profile P0
  HDR Static Metadata Data Block:
    Electro optical transfer functions:
      Traditional gamma - SDR luminance range
      Traditional gamma - HDR luminance range
      SMPTE ST2084
    Supported static metadata descriptors:
      Static metadata type 1
    Desired content max luminance: 98 (417.710 cd/m^2)
    Desired content max frame-average luminance: 98 (417.710 cd/m^2)
    Desired content min luminance: 47 (0.142 cd/m^2)
  Vendor-Specific Data Block (HDMI Forum), OUI C4-5D-D8:
    Version: 1
    Maximum TMDS Character Rate: 600 MHz
    SCDC Present
    SCDC Read Request Capable
  Detailed Timing Descriptors:
    DTD 2:  1920x1080  164.999787 Hz  16:9    183.480 kHz    371.730000 MHz (598 mm x 336 mm)
                 Hfront   48 Hsync  32 Hback   26 Hpol P
                 Vfront    3 Vsync   5 Vback   24 Vpol N
    DTD 3:  1920x1080  143.999135 Hz  16:9    161.999 kHz    333.070000 MHz (600 mm x 330 mm)
                 Hfront   23 Hsync  32 Hback   81 Hpol P
                 Vfront    3 Vsync   5 Vback   37 Vpol P
    DTD 4:  1920x1080  179.998575 Hz  16:9    200.158 kHz    404.320000 MHz (599 mm x 336 mm)
                 Hfront   48 Hsync  32 Hback   20 Hpol P
                 Vfront    3 Vsync   5 Vback   24 Vpol N
Checksum: 0xd9  Unused space in Extension Block: 8 bytes

----------------

Warnings:

Block 0, Base EDID:
  Detailed Timing Descriptor #1: DTD is similar but not identical to VIC 16.
  Display Product Serial Number: ...
Block 1, CTA-861 Extension Block:
  Video Data Block: VIC 5 and the first DTD are not identical. Is this intended?
  Video Capability Data Block: IT scan behavior is expected to support underscanned.
  Video Capability Data Block: 'CE video formats not supported' makes no sense.
  Colorimetry Data Block: Set the sRGB colorimetry bit to avoid interop issues.
EDID:
  Base EDID: Some timings are out of range of the Monitor Ranges:
    Vertical Freq: 50.000 - 179.999 Hz (Monitor: 60.000 - 180.000 Hz)
    Horizontal Freq: 15.734 - 200.158 kHz (Monitor: 223.000 - 223.000 kHz)
    Maximum Clock: 404.320 MHz (Monitor: 400.000 MHz)

Failures:

Block 0, Base EDID:
  Detailed Timing Descriptor #1: Mismatch of image size 600x330 mm vs display size 530x300 mm.
Block 1, CTA-861 Extension Block:
  Audio Data Block: Bit F27 must be 0.
  Vendor-Specific Data Block (HDMI), OUI 00-0C-03: The HDMI Specification requires EDID 1.3 instead of 1.4.
  Vendor-Specific Data Block (HDMI Forum), OUI C4-5D-D8: HDMI Forum VSDB did not immediately follow the HDMI VSDB.
  Detailed Timing Descriptor #2: Mismatch of image size 598x336 mm vs display size 530x300 mm.
  Detailed Timing Descriptor #3: Mismatch of image size 600x330 mm vs display size 530x300 mm.
  Detailed Timing Descriptor #4: Mismatch of image size 599x336 mm vs display size 530x300 mm.
EDID:
  Extension Block 2 started with EDID header, ignoring Extension Blocks >= 2.
  Base EDID: The DTD max image size is 600x336mm, which is larger than the display size 530.0x300.0mm.

EDID conformity: FAIL
