edid-decode (hex):

00 ff ff ff ff ff ff 00 30 e4 e4 05 00 00 00 00
00 1c 01 04 a5 22 13 78 ea e0 85 a3 54 4e 9b 26
0e 50 54 00 00 00 01 01 01 01 01 01 01 01 01 01
01 01 01 01 01 01 5e 87 80 a0 70 38 4d 40 30 20
35 00 58 c2 10 00 00 1b 00 00 00 00 00 00 00 00
00 00 00 00 00 00 00 00 00 00 00 00 00 fe 00 46
52 4a 59 32 80 31 35 36 57 46 47 0a 00 00 00 00
00 02 41 3f 9e 00 10 00 00 0b 01 0a 20 20 00 80

----------------

Block 0, Base EDID:
  EDID Structure Version & Revision: 1.4
  Vendor & Product Identification:
    Manufacturer: LGD
    Model: 1508
    Made in: 2018
  Basic Display Parameters & Features:
    Digital display
    Bits per primary color channel: 8
    DisplayPort interface
    Maximum image size: 34 cm x 19 cm
    Gamma: 2.20
    DPMS levels: Standby Suspend Off
    Supported color formats: RGB 4:4:4, YCrCb 4:4:4
    First detailed timing includes the native pixel format and preferred refresh rate
  Color Characteristics:
    Red  : 0.6396, 0.3300
    Green: 0.3046, 0.6054
    Blue : 0.1503, 0.0546
    White: 0.3134, 0.3291
  Established Timings I & II: none
  Standard Timings: none
  Detailed Timing Descriptors:
    DTD 1:  1920x1080  143.998072 Hz  16:9    166.606 kHz    346.540000 MHz (344 mm x 194 mm)
                 Hfront   48 Hsync  32 Hback   80 Hpol P
                 Vfront    3 Vsync   5 Vback   69 Vpol N
    Empty Descriptor
    Alphanumeric Data String: 'FRJY2.156WFG'
    Manufacturer-Specified Display Descriptor (0x00): 00 00 00 02 41 3f 9e 00 10 00 00 0b 01 0a 20 20 '....A?........  '
Checksum: 0x80

----------------

Warnings:

Block 0, Base EDID:
  Alphanumeric Data String: Non-ASCII character 0x80 at position 5, can cause problems.
  Missing Display Product Name.

Failures:

Block 0, Base EDID:
  Empty Descriptor: Use Dummy Descriptor instead of all zeroes.

EDID conformity: FAIL
