edid-decode (hex):

00 ff ff ff ff ff ff 00 0d 12 11 75 16 01 12 20
02 16 01 04 a5 00 00 78 e2 80 42 ac 51 30 b4 25
10 50 53 00 00 00 01 01 01 01 01 01 01 01 01 01
01 01 01 01 01 01 31 2e 40 00 62 84 1a 30 58 a8
48 00 ce 10 11 00 00 1c 7e 26 40 00 62 84 1a 30
58 a8 48 00 ce 10 11 00 00 1c 00 00 00 fd 00 38
4c 1e 53 11 00 0a 20 20 20 20 20 20 00 00 00 fc
00 45 54 32 30 31 32 45 0a 20 20 20 20 20 00 d2

----------------

Block 0, Base EDID:
  EDID Structure Version & Revision: 1.4
  Vendor & Product Identification:
    Manufacturer: CHR
    Model: 29969
    Serial Number: ...
    Made in: week 2 of 2012
  Basic Display Parameters & Features:
    Digital display
    Bits per primary color channel: 8
    DisplayPort interface
    Image size is variable
    Gamma: 2.20
    DPMS levels: Standby Suspend Off
    Supported color formats: RGB 4:4:4
    First detailed timing includes the native pixel format and preferred refresh rate
  Color Characteristics:
    Red  : 0.6738, 0.3164
    Green: 0.1875, 0.7031
    Blue : 0.1455, 0.0625
    White: 0.3125, 0.3261
  Established Timings I & II: none
  Standard Timings: none
  Detailed Timing Descriptors:
    DTD 1:  1600x900    60.463913 Hz  16:9     55.990 kHz    118.250000 MHz (462 mm x 272 mm)
                 Hfront   88 Hsync 168 Hback  256 Hpol N
                 Vfront    4 Vsync   8 Vback   14 Vpol P
    DTD 2:  1600x900    50.385742 Hz  16:9     46.657 kHz     98.540000 MHz (462 mm x 272 mm)
                 Hfront   88 Hsync 168 Hback  256 Hpol N
                 Vfront    4 Vsync   8 Vback   14 Vpol P
    Display Range Limits:
      Monitor ranges (GTF): 56-76 Hz V, 30-83 kHz H, max dotclock 170 MHz
    Display Product Name: 'ET2012E'
Checksum: 0xd2

----------------

Warnings:

Block 0, Base EDID:
  Detailed Timing Descriptor #1: Image size is 462x272 mm, but based on the picture AR it should be 462x259 mm.
  Detailed Timing Descriptor #2: Image size is 462x272 mm, but based on the picture AR it should be 462x259 mm.
  Display Range Limits: GTF support is deprecated in EDID 1.4.
EDID:
  Base EDID: Some timings are out of range of the Monitor Ranges:
    Vertical Freq: 50.386 - 60.464 Hz (Monitor: 56.000 - 76.000 Hz)

Failures:

Block 0, Base EDID:
  Display Range Limits: GTF is supported, but the display does not support continuous frequencies.
EDID:
  Base EDID: The DTD max image size is 462x272mm, but the display size is not specified anywhere.

EDID conformity: FAIL
