edid-decode (hex):

00 ff ff ff ff ff ff 00 0d 12 11 75 70 03 00 00
15 15 01 04 95 00 00 78 e2 80 42 ac 51 30 b4 25
10 50 53 00 00 00 01 01 01 01 01 01 01 01 01 01
01 01 01 01 01 01 a9 1a 00 a0 50 00 16 30 30 20
37 00 07 44 21 00 00 1a 37 16 00 a0 50 00 16 30
30 20 37 00 07 44 21 00 00 1a 00 00 00 fd 00 38
4c 1e 53 11 00 0a 20 20 20 20 20 20 00 00 00 fc
00 43 48 37 35 31 31 42 0a 20 20 20 20 20 00 a1

----------------

Block 0, Base EDID:
  EDID Structure Version & Revision: 1.4
  Vendor & Product Identification:
    Manufacturer: CHR
    Model: 29969
    Serial Number: ...
    Made in: week 21 of 2011
  Basic Display Parameters & Features:
    Digital display
    Bits per primary color channel: 6
    DisplayPort interface
    Image size is variable
    Gamma: 2.20
    DPMS levels: Standby Suspend Off
    Supported color formats: RGB 4:4:4
    First detailed timing includes the native pixel format and preferred refresh rate
  Color Characteristics:
    Red  : 0.6738, 0.3164
    Green: 0.1875, 0.7031
    Blue : 0.1455, 0.0625
    White: 0.3125, 0.3261
  Established Timings I & II: none
  Standard Timings: none
  Detailed Timing Descriptors:
    DTD 1:  1280x768    59.994726 Hz   5:3     47.396 kHz     68.250000 MHz (519 mm x 324 mm)
                 Hfront   48 Hsync  32 Hback   80 Hpol P
                 Vfront    3 Vsync   7 Vback   12 Vpol N
    DTD 2:  1280x768    49.991210 Hz   5:3     39.493 kHz     56.870000 MHz (519 mm x 324 mm)
                 Hfront   48 Hsync  32 Hback   80 Hpol P
                 Vfront    3 Vsync   7 Vback   12 Vpol N
    Display Range Limits:
      Monitor ranges (GTF): 56-76 Hz V, 30-83 kHz H, max dotclock 170 MHz
    Display Product Name: 'CH7511B'
Checksum: 0xa1

----------------

Warnings:

Block 0, Base EDID:
  Detailed Timing Descriptor #1: Image size is 519x324 mm, but based on the picture AR it should be 519x311 mm.
  Detailed Timing Descriptor #2: Image size is 519x324 mm, but based on the picture AR it should be 519x311 mm.
  Display Range Limits: GTF support is deprecated in EDID 1.4.
EDID:
  Base EDID: Some timings are out of range of the Monitor Ranges:
    Vertical Freq: 49.991 - 59.995 Hz (Monitor: 56.000 - 76.000 Hz)

Failures:

Block 0, Base EDID:
  Display Range Limits: GTF is supported, but the display does not support continuous frequencies.
EDID:
  Base EDID: The DTD max image size is 519x324mm, but the display size is not specified anywhere.

EDID conformity: FAIL
