edid-decode (hex):

00 ff ff ff ff ff ff 00 06 af b0 c1 00 00 00 00
2d 21 01 04 a5 1e 13 78 03 91 05 93 58 58 8f 28
1f 50 54 00 00 00 01 01 01 01 01 01 01 01 01 01
01 01 01 01 01 01 f4 3c 80 b8 70 b0 24 40 10 10
3e 00 2d bc 10 00 00 18 a3 28 80 b8 70 b0 24 40
10 10 3e 00 2d bc 10 00 00 18 00 00 00 fd 00 28
3c 4b 4b 10 01 0a 20 20 20 20 20 20 00 00 00 fe
00 42 31 34 30 55 41 4e 41 41 2e 30 20 0a 01 f2

70 20 79 02 00 22 00 14 87 61 02 85 7f 07 b7 00
0f 80 0f 00 af 04 23 00 02 00 0d 00 25 01 09 87
61 02 87 61 02 28 3c 80 81 00 10 72 1a 00 00 03
01 28 3c 00 00 53 50 53 50 3c 00 00 00 00 00 00
00 00 00 00 00 00 00 00 00 00 00 00 00 00 00 00
00 00 00 00 00 00 00 00 00 00 00 00 00 00 00 00
00 00 00 00 00 00 00 00 00 00 00 00 00 00 00 00
00 00 00 00 00 00 00 00 00 00 00 00 00 00 12 90

00 ff ff ff ff ff ff 00 06 af b0 c1 00 00 00 00
2d 21 01 04 a5 1e 13 78 03 91 05 93 58 58 8f 28
1f 50 54 00 00 00 01 01 01 01 01 01 01 01 01 01
01 01 01 01 01 01 f4 3c 80 b8 70 b0 24 40 10 10
3e 00 2d bc 10 00 00 18 a3 28 80 b8 70 b0 24 40
10 10 3e 00 2d bc 10 00 00 18 00 00 00 fd 00 28
3c 4b 4b 10 01 0a 20 20 20 20 20 20 00 00 00 fe
00 42 31 34 30 55 41 4e 41 41 2e 30 20 0a 01 f2

70 20 79 02 00 22 00 14 87 61 02 85 7f 07 b7 00
0f 80 0f 00 af 04 23 00 02 00 0d 00 25 01 09 87
61 02 87 61 02 28 3c 80 81 00 10 72 1a 00 00 03
01 28 3c 00 00 53 50 53 50 3c 00 00 00 00 00 00
00 00 00 00 00 00 00 00 00 00 00 00 00 00 00 00
00 00 00 00 00 00 00 00 00 00 00 00 00 00 00 00
00 00 00 00 00 00 00 00 00 00 00 00 00 00 00 00
00 00 00 00 00 00 00 00 00 00 00 00 00 00 12 90

----------------

Block 0, Base EDID:
  EDID Structure Version & Revision: 1.4
  Vendor & Product Identification:
    Manufacturer: AUO
    Model: 49584
    Made in: week 45 of 2023
  Basic Display Parameters & Features:
    Digital display
    Bits per primary color channel: 8
    DisplayPort interface
    Maximum image size: 30 cm x 19 cm
    Gamma: 2.20
    Supported color formats: RGB 4:4:4
    First detailed timing includes the native pixel format and preferred refresh rate
    Display supports continuous frequencies
  Color Characteristics:
    Red  : 0.5761, 0.3447
    Green: 0.3437, 0.5595
    Blue : 0.1562, 0.1210
    White: 0.3134, 0.3291
  Established Timings I & II: none
  Standard Timings: none
  Detailed Timing Descriptors:
    DTD 1:  1920x1200   60.002830 Hz  16:10    74.163 kHz    156.040000 MHz (301 mm x 188 mm)
                 Hfront   16 Hsync  16 Hback  152 Hpol N
                 Vfront    3 Vsync  14 Vback   19 Vpol N
    DTD 2:  1920x1200   40.003169 Hz  16:10    49.444 kHz    104.030000 MHz (301 mm x 188 mm)
                 Hfront   16 Hsync  16 Hback  152 Hpol N
                 Vfront    3 Vsync  14 Vback   19 Vpol N
    Display Range Limits:
      Monitor ranges (Range Limits Only): 40-60 Hz V, 75-75 kHz H, max dotclock 160 MHz
    Alphanumeric Data String: 'B140UANAA.0 '
  Extension blocks: 1
Checksum: 0xf2

----------------

Block 1, DisplayID Extension Block:
  Version: 2.0
  Extension Count: 0
  Display Product Primary Use Case: None of the listed primary use cases; generic display
  Video Timing Modes Type 7 - Detailed Timings Data Block:
    DTD:  1920x1200   60.002830 Hz  16:10    74.163 kHz    156.040000 MHz (aspect 16:10, no 3D stereo, preferred)
               Hfront   16 Hsync  16 Hback  152 Hpol P
               Vfront    3 Vsync  14 Vback   19 Vpol N
  Dynamic Video Timing Range Limits Data Block:
    Minimum Pixel Clock: 156040 kHz
    Maximum Pixel Clock: 156040 kHz
    Minimum Vertical Refresh Rate: 40 Hz
    Maximum Vertical Refresh Rate: 60 Hz
    Seamless Dynamic Video Timing Support: Yes
  CTA-861 DisplayID Data Block:
  Vendor-Specific Data Block (AMD), OUI 00-00-1A:
    Version: 3
    Flags 1: 0x01
      FreeSync Supported
    Minimum Refresh Rate: 40 Hz
    Maximum Refresh Rate: 60 Hz
    Flags 5: 0x00
  Checksum: 0x12
Checksum: 0x90

----------------

Warnings:

Block 0, Base EDID:
  Missing Display Product Name.
EDID:
  Base EDID: Some timings are out of range of the Monitor Ranges:
    Horizontal Freq: 49.443 - 74.163 kHz (Monitor: 75.000 - 75.000 kHz)

Failures:

Block 0, Base EDID:
  Alphanumeric Data String: One or more trailing spaces before newline.
Block 1, DisplayID Extension Block:
  Vendor-Specific Data Block (AMD), OUI 00-00-1A: Length is 16 instead of 19.
EDID:
  Extension Block 2 started with EDID header, ignoring Extension Blocks >= 2.
  DisplayID: Missing DisplayID Display Parameters Data Block.

EDID conformity: FAIL
