edid-decode (hex):

00 ff ff ff ff ff ff 00 15 c3 12 21 01 01 01 01
20 15 01 03 6c 34 21 78 ea f9 f5 a8 53 37 ae 25
12 50 54 af cf 00 a9 40 a9 4f b3 00 81 80 81 40
71 4f 01 01 01 01 7d 4b 80 a0 72 b0 2d 40 88 c8
36 00 07 44 21 00 00 1c 00 00 00 ff 00 37 38 36
34 37 30 38 31 0a 20 20 20 20 00 00 00 fd 00 37
4c 1f 5e 15 00 0a 20 20 20 20 20 20 00 00 00 fc
00 53 32 34 33 33 57 0a 20 20 20 20 20 20 00 8b

00 ff ff ff ff ff ff 00 15 c3 12 21 01 01 01 01
20 15 01 03 6c 34 21 78 ea f9 f5 a8 53 37 ae 25
12 50 54 af cf 00 a9 40 a9 4f b3 00 81 80 81 40
71 4f 01 01 01 01 7d 4b 80 a0 72 b0 2d 40 88 c8
36 00 07 44 21 00 00 1c 00 00 00 ff 00 37 38 36
34 37 30 38 31 0a 20 20 20 20 00 00 00 fd 00 37
4c 1f 5e 15 00 0a 20 20 20 20 20 20 00 00 00 fc
00 53 32 34 33 33 57 0a 20 20 20 20 20 20 00 8b

----------------

Block 0, Base EDID:
  EDID Structure Version & Revision: 1.3
  Vendor & Product Identification:
    Manufacturer: ENC
    Model: 8466
    Serial Number: ...
    Made in: week 32 of 2011
  Basic Display Parameters & Features:
    Analog display
    Signal Level Standard: 0.700 : 0.000 : 0.700 V p-p
    Blank level equals black level
    Sync: Separate Composite
    Maximum image size: 52 cm x 33 cm
    Gamma: 2.20
    DPMS levels: Standby Suspend Off
    RGB color display
    First detailed timing is the preferred timing
  Color Characteristics:
    Red  : 0.6591, 0.3271
    Green: 0.2167, 0.6806
    Blue : 0.1474, 0.0732
    White: 0.3134, 0.3291
  Established Timings I & II:
    IBM     :   720x400    70.081663 Hz   9:5     31.467 kHz     28.320000 MHz
    DMT 0x04:   640x480    59.940476 Hz   4:3     31.469 kHz     25.175000 MHz
    DMT 0x05:   640x480    72.808802 Hz   4:3     37.861 kHz     31.500000 MHz
    DMT 0x06:   640x480    75.000000 Hz   4:3     37.500 kHz     31.500000 MHz
    DMT 0x08:   800x600    56.250000 Hz   4:3     35.156 kHz     36.000000 MHz
    DMT 0x09:   800x600    60.316541 Hz   4:3     37.879 kHz     40.000000 MHz
    DMT 0x0a:   800x600    72.187572 Hz   4:3     48.077 kHz     50.000000 MHz
    DMT 0x0b:   800x600    75.000000 Hz   4:3     46.875 kHz     49.500000 MHz
    DMT 0x10:  1024x768    60.003840 Hz   4:3     48.363 kHz     65.000000 MHz
    DMT 0x11:  1024x768    70.069359 Hz   4:3     56.476 kHz     75.000000 MHz
    DMT 0x12:  1024x768    75.028582 Hz   4:3     60.023 kHz     78.750000 MHz
    DMT 0x24:  1280x1024   75.024675 Hz   5:4     79.976 kHz    135.000000 MHz
  Standard Timings:
    DMT 0x33:  1600x1200   60.000000 Hz   4:3     75.000 kHz    162.000000 MHz
    DMT 0x36:  1600x1200   75.000000 Hz   4:3     93.750 kHz    202.500000 MHz
    DMT 0x3a:  1680x1050   59.954250 Hz  16:10    65.290 kHz    146.250000 MHz
    DMT 0x23:  1280x1024   60.019740 Hz   5:4     63.981 kHz    108.000000 MHz
    DMT 0x20:  1280x960    60.000000 Hz   4:3     60.000 kHz    108.000000 MHz
    DMT 0x15:  1152x864    75.000000 Hz   4:3     67.500 kHz    108.000000 MHz
  Detailed Timing Descriptors:
    DTD 1:  1920x1200   59.884600 Hz  16:10    74.556 kHz    193.250000 MHz (519 mm x 324 mm)
                 Hfront  136 Hsync 200 Hback  336 Hpol N
                 Vfront    3 Vsync   6 Vback   36 Vpol P
    Display Product Serial Number: ...
    Display Range Limits:
      Monitor ranges (GTF): 55-76 Hz V, 31-94 kHz H, max dotclock 210 MHz
    Display Product Name: 'S2433W'
Checksum: 0x8b

----------------

Warnings:

Block 0, Base EDID:
  Vendor & Product Identification: The serial number is one of the known dummy values, it should probably be set to 0.

Failures:

EDID:
  Extension Block 1 started with EDID header, ignoring Extension Blocks >= 1.

EDID conformity: FAIL
