edid-decode (hex):

00 ff ff ff ff ff ff 00 36 63 35 05 00 00 00 00
1a 0e 01 04 a5 1e 17 78 e2 6d 8c 98 59 50 93 26
20 4c 52 af ee 80 31 59 45 59 61 59 01 01 01 01
01 01 01 01 01 01 64 19 00 40 41 00 26 30 18 88
36 00 30 e4 10 00 00 18 00 00 00 fc 00 4d 53 43
2d 35 33 35 0a 20 20 20 20 20 00 00 00 fd 00 38
56 1e 44 0a 00 0a 20 20 20 20 20 20 00 00 00 ff
00 53 43 30 34 35 33 35 30 30 30 30 30 0a 00 0e

00 ff ff ff ff ff ff 00 36 63 35 05 00 00 00 00
1a 0e 01 04 a5 1e 17 78 e2 6d 8c 98 59 50 93 26
20 4c 52 af ee 80 31 59 45 59 61 59 01 01 01 01
01 01 01 01 01 01 64 19 00 40 41 00 26 30 18 88
36 00 30 e4 10 00 00 18 00 00 00 fc 00 4d 53 43
2d 35 33 35 0a 20 20 20 20 20 00 00 00 fd 00 38
56 1e 44 0a 00 0a 20 20 20 20 20 20 00 00 00 ff
00 53 43 30 34 35 33 35 30 30 30 30 30 0a 00 0e

----------------

Block 0, Base EDID:
  EDID Structure Version & Revision: 1.4
  Vendor & Product Identification:
    Manufacturer: MSC
    Model: 1333
    Made in: week 26 of 2004
  Basic Display Parameters & Features:
    Digital display
    Bits per primary color channel: 8
    DisplayPort interface
    Maximum image size: 30 cm x 23 cm
    Gamma: 2.20
    DPMS levels: Standby Suspend Off
    Supported color formats: RGB 4:4:4
    First detailed timing includes the native pixel format and preferred refresh rate
  Color Characteristics:
    Red  : 0.5947, 0.3496
    Green: 0.3154, 0.5751
    Blue : 0.1503, 0.1250
    White: 0.2998, 0.3203
  Established Timings I & II:
    IBM     :   720x400    70.081663 Hz   9:5     31.467 kHz     28.320000 MHz
    DMT 0x04:   640x480    59.940476 Hz   4:3     31.469 kHz     25.175000 MHz
    DMT 0x05:   640x480    72.808802 Hz   4:3     37.861 kHz     31.500000 MHz
    DMT 0x06:   640x480    75.000000 Hz   4:3     37.500 kHz     31.500000 MHz
    DMT 0x08:   800x600    56.250000 Hz   4:3     35.156 kHz     36.000000 MHz
    DMT 0x09:   800x600    60.316541 Hz   4:3     37.879 kHz     40.000000 MHz
    DMT 0x0a:   800x600    72.187572 Hz   4:3     48.077 kHz     50.000000 MHz
    DMT 0x0b:   800x600    75.000000 Hz   4:3     46.875 kHz     49.500000 MHz
    Apple   :   832x624    74.551266 Hz   4:3     49.726 kHz     57.284000 MHz
    DMT 0x10:  1024x768    60.003840 Hz   4:3     48.363 kHz     65.000000 MHz
    DMT 0x11:  1024x768    70.069359 Hz   4:3     56.476 kHz     75.000000 MHz
    DMT 0x12:  1024x768    75.028582 Hz   4:3     60.023 kHz     78.750000 MHz
    Apple   :  1152x870    75.061550 Hz 192:145   68.681 kHz    100.000000 MHz
  Standard Timings:
    DMT 0x07:   640x480    85.008312 Hz   4:3     43.269 kHz     36.000000 MHz
    DMT 0x0c:   800x600    85.061274 Hz   4:3     53.674 kHz     56.250000 MHz
    DMT 0x13:  1024x768    84.996690 Hz   4:3     68.677 kHz     94.500000 MHz
  Detailed Timing Descriptors:
    DTD 1:  1024x768    60.003840 Hz   4:3     48.363 kHz     65.000000 MHz (304 mm x 228 mm)
                 Hfront   24 Hsync 136 Hback  160 Hpol N
                 Vfront    3 Vsync   6 Vback   29 Vpol N
    Display Product Name: 'MSC-535'
    Display Range Limits:
      Monitor ranges (GTF): 56-86 Hz V, 30-68 kHz H, max dotclock 100 MHz
    Display Product Serial Number: ...
Checksum: 0x0e

----------------

Warnings:

Block 0, Base EDID:
  Display Range Limits: GTF support is deprecated in EDID 1.4.
EDID:
  Base EDID: Some timings are out of range of the Monitor Ranges:
    Horizontal Freq: 31.466 - 68.681 kHz (Monitor: 30.000 - 68.000 kHz)
    Maximum Clock: 100.000 MHz (Monitor: 100.000 MHz)
    Could be due to a Monitor Range off-by-one rounding issue

Failures:

Block 0, Base EDID:
  Display Range Limits: GTF is supported, but the display does not support continuous frequencies.
EDID:
  Extension Block 1 started with EDID header, ignoring Extension Blocks >= 1.

EDID conformity: FAIL
