edid-decode (hex):

00 ff ff ff ff ff ff 00 10 a6 50 31 00 00 00 00
18 1c 01 03 80 3c 22 78 2a 4e 65 a9 55 4d 9c 26
10 50 54 a5 4b 00 71 4f 81 c0 81 00 81 80 95 00
a9 c0 b3 00 01 01 3c cf 00 5a f0 70 5a 80 0a 08
8a 00 55 5c 21 00 00 1a 04 74 00 30 f2 70 5a 80
30 20 35 00 20 4f 31 00 00 1a 00 00 00 fc 00 48
44 4d 49 31 00 00 00 00 00 00 00 00 00 00 00 fd
00 1e 4b 1f 8c 3c 00 0a 20 20 20 20 20 20 01 cc

02 03 41 f1 4f 00 60 5f 5e 5d 10 1f 20 04 13 12
11 03 02 01 23 09 7f 07 83 01 00 00 6d 03 0c 00
10 00 38 3c 20 00 60 03 02 01 67 d8 5d c4 01 78
88 03 e3 05 ff 01 e2 0f 03 00 e6 06 07 01 60 53
46 0e 1f 00 80 51 00 1e 30 40 80 37 00 61 5c 21
00 00 1e 56 5e 00 a0 a0 a0 29 50 30 20 36 00 61
5c 21 00 00 1e 02 3a 80 18 71 38 2d 40 58 2c 45
00 61 5c 21 00 00 1e 00 00 00 00 00 00 00 00 0b

00 ff ff ff ff ff ff 00 10 a6 50 31 00 00 00 00
18 1c 01 03 80 3c 22 78 2a 4e 65 a9 55 4d 9c 26
10 50 54 a5 4b 00 71 4f 81 c0 81 00 81 80 95 00
a9 c0 b3 00 01 01 3c cf 00 5a f0 70 5a 80 0a 08
8a 00 55 5c 21 00 00 1a 04 74 00 30 f2 70 5a 80
30 20 35 00 20 4f 31 00 00 1a 00 00 00 fc 00 48
44 4d 49 31 00 00 00 00 00 00 00 00 00 00 00 fd
00 1e 4b 1f 8c 3c 00 0a 20 20 20 20 20 20 01 cc

02 03 41 f1 4f 00 60 5f 5e 5d 10 1f 20 04 13 12
11 03 02 01 23 09 7f 07 83 01 00 00 6d 03 0c 00
10 00 38 3c 20 00 60 03 02 01 67 d8 5d c4 01 78
88 03 e3 05 ff 01 e2 0f 03 00 e6 06 07 01 60 53
46 0e 1f 00 80 51 00 1e 30 40 80 37 00 61 5c 21
00 00 1e 56 5e 00 a0 a0 a0 29 50 30 20 36 00 61
5c 21 00 00 1e 02 3a 80 18 71 38 2d 40 58 2c 45
00 61 5c 21 00 00 1e 00 00 00 00 00 00 00 00 0b

----------------

Block 0, Base EDID:
  EDID Structure Version & Revision: 1.3
  Vendor & Product Identification:
    Manufacturer: DEF
    Model: 12624
    Made in: week 24 of 2018
  Basic Display Parameters & Features:
    Digital display
    Maximum image size: 60 cm x 34 cm
    Gamma: 2.20
    DPMS levels: Off
    RGB color display
    First detailed timing is the preferred timing
  Color Characteristics:
    Red  : 0.6611, 0.3320
    Green: 0.3037, 0.6113
    Blue : 0.1494, 0.0644
    White: 0.3134, 0.3291
  Established Timings I & II:
    IBM     :   720x400    70.081663 Hz   9:5     31.467 kHz     28.320000 MHz
    DMT 0x04:   640x480    59.940476 Hz   4:3     31.469 kHz     25.175000 MHz
    DMT 0x06:   640x480    75.000000 Hz   4:3     37.500 kHz     31.500000 MHz
    DMT 0x09:   800x600    60.316541 Hz   4:3     37.879 kHz     40.000000 MHz
    DMT 0x0b:   800x600    75.000000 Hz   4:3     46.875 kHz     49.500000 MHz
    DMT 0x10:  1024x768    60.003840 Hz   4:3     48.363 kHz     65.000000 MHz
    DMT 0x12:  1024x768    75.028582 Hz   4:3     60.023 kHz     78.750000 MHz
    DMT 0x24:  1280x1024   75.024675 Hz   5:4     79.976 kHz    135.000000 MHz
  Standard Timings:
    DMT 0x15:  1152x864    75.000000 Hz   4:3     67.500 kHz    108.000000 MHz
    DMT 0x55:  1280x720    60.000000 Hz  16:9     45.000 kHz     74.250000 MHz
    DMT 0x1c:  1280x800    59.810326 Hz  16:10    49.702 kHz     83.500000 MHz
    DMT 0x23:  1280x1024   60.019740 Hz   5:4     63.981 kHz    108.000000 MHz
    DMT 0x2f:  1440x900    59.887445 Hz  16:10    55.935 kHz    106.500000 MHz
    DMT 0x53:  1600x900    60.000000 Hz  16:9     60.000 kHz    108.000000 MHz (RB)
    DMT 0x3a:  1680x1050   59.954250 Hz  16:10    65.290 kHz    146.250000 MHz
  Detailed Timing Descriptors:
    DTD 1:  3840x2160   59.996607 Hz  16:9    134.992 kHz    530.520000 MHz (597 mm x 348 mm)
                 Hfront   10 Hsync   8 Hback   72 Hpol P
                 Vfront    8 Vsync  10 Vback   72 Vpol N
    DTD 2:  3840x2160   30.000000 Hz  16:9     67.500 kHz    297.000000 MHz (800 mm x 335 mm)
                 Hfront   48 Hsync  32 Hback  480 Hpol P
                 Vfront    3 Vsync   5 Vback   82 Vpol N
    Display Product Name: 'HDMI1'
    Display Range Limits:
      Monitor ranges (GTF): 30-75 Hz V, 31-140 kHz H, max dotclock 600 MHz
  Extension blocks: 1
Checksum: 0xcc

----------------

Block 1, CTA-861 Extension Block:
  Revision: 3
  Underscans IT Video Formats by default
  Basic audio support
  Supports YCbCr 4:4:4
  Supports YCbCr 4:2:2
  Native DTDs: 1
  Video Data Block:
    VIC  96:  3840x2160   50.000000 Hz  16:9    112.500 kHz    594.000000 MHz
    VIC  95:  3840x2160   30.000000 Hz  16:9     67.500 kHz    297.000000 MHz
    VIC  94:  3840x2160   25.000000 Hz  16:9     56.250 kHz    297.000000 MHz
    VIC  93:  3840x2160   24.000000 Hz  16:9     54.000 kHz    297.000000 MHz
    VIC  16:  1920x1080   60.000000 Hz  16:9     67.500 kHz    148.500000 MHz
    VIC  31:  1920x1080   50.000000 Hz  16:9     56.250 kHz    148.500000 MHz
    VIC  32:  1920x1080   24.000000 Hz  16:9     27.000 kHz     74.250000 MHz
    VIC   4:  1280x720    60.000000 Hz  16:9     45.000 kHz     74.250000 MHz
    VIC  19:  1280x720    50.000000 Hz  16:9     37.500 kHz     74.250000 MHz
    VIC  18:   720x576    50.000000 Hz  16:9     31.250 kHz     27.000000 MHz
    VIC  17:   720x576    50.000000 Hz   4:3     31.250 kHz     27.000000 MHz
    VIC   3:   720x480    59.940060 Hz  16:9     31.469 kHz     27.000000 MHz
    VIC   2:   720x480    59.940060 Hz   4:3     31.469 kHz     27.000000 MHz
    VIC   1:   640x480    59.940476 Hz   4:3     31.469 kHz     25.175000 MHz
  Audio Data Block:
    Linear PCM:
      Max channels: 2
      Supported sample rates (kHz): 192 176.4 96 88.2 48 44.1 32
      Supported sample sizes (bits): 24 20 16
  Speaker Allocation Data Block:
    FL/FR - Front Left/Right
  Vendor-Specific Data Block (HDMI), OUI 00-0C-03:
    Source physical address: 1.0.0.0
    DC_36bit
    DC_30bit
    DC_Y444
    Maximum TMDS clock: 300 MHz
    Extended HDMI video details:
      HDMI VICs:
        HDMI VIC 3:  3840x2160   24.000000 Hz  16:9     54.000 kHz    297.000000 MHz
        HDMI VIC 2:  3840x2160   25.000000 Hz  16:9     56.250 kHz    297.000000 MHz
        HDMI VIC 1:  3840x2160   30.000000 Hz  16:9     67.500 kHz    297.000000 MHz
  Vendor-Specific Data Block (HDMI Forum), OUI C4-5D-D8:
    Version: 1
    Maximum TMDS Character Rate: 600 MHz
    SCDC Present
    Supports scrambling for <= 340 Mcsc
    Supports 12-bits/component Deep Color 4:2:0 Pixel Encoding
    Supports 10-bits/component Deep Color 4:2:0 Pixel Encoding
  Colorimetry Data Block:
    xvYCC601
    xvYCC709
    sYCC601
    opYCC601
    opRGB
    BT2020cYCC
    BT2020YCC
    BT2020RGB
    Gamut Boundary Description Metadata Profile P0
  YCbCr 4:2:0 Capability Map Data Block:
    Unknown (VIC   0)
    VIC  96:  3840x2160   50.000000 Hz  16:9    112.500 kHz    594.000000 MHz
  Unknown CTA-861 Data Block (tag 0x00, length 0):
  HDR Static Metadata Data Block:
    Electro optical transfer functions:
      Traditional gamma - SDR luminance range
      Traditional gamma - HDR luminance range
      SMPTE ST2084
    Supported static metadata descriptors:
      Static metadata type 1
    Desired content max luminance: 96 (400.000 cd/m^2)
    Desired content max frame-average luminance: 83 (301.833 cd/m^2)
    Desired content min luminance: 70 (0.301 cd/m^2)
  Detailed Timing Descriptors:
    DTD 3:  1280x768    59.870228 Hz   5:3     47.776 kHz     79.500000 MHz (609 mm x 348 mm)
                 Hfront   64 Hsync 128 Hback  192 Hpol P
                 Vfront    3 Vsync   7 Vback   20 Vpol P
    DTD 4:  2560x1440   59.950550 Hz  16:9     88.787 kHz    241.500000 MHz (609 mm x 348 mm)
                 Hfront   48 Hsync  32 Hback   80 Hpol P
                 Vfront    3 Vsync   6 Vback   32 Vpol P
    DTD 5:  1920x1080   60.000000 Hz  16:9     67.500 kHz    148.500000 MHz (609 mm x 348 mm)
                 Hfront   88 Hsync  44 Hback  148 Hpol P
                 Vfront    4 Vsync   5 Vback   36 Vpol P
Checksum: 0x0b  Unused space in Extension Block: 8 bytes

----------------

Warnings:

Block 0, Base EDID:
  Detailed Timing Descriptor #1: Image size is 597x348 mm, but based on the picture AR it should be 597x335 mm.
  Detailed Timing Descriptor #2: DTD is similar but not identical to VIC 95.
  Detailed Timing Descriptor #2: Image size is 800x335 mm, but based on the picture AR it should be 595x335 mm.
Block 1, CTA-861 Extension Block:
  Video Data Block: VIC 96 and the first DTD are not identical. Is this intended?
  Colorimetry Data Block: Set the sRGB colorimetry bit to avoid interop issues.
  Unknown CTA-861 Data Block (tag 0x00, length 0).
  Detailed Timing Descriptor #3: DTD is similar but not identical to DMT 0x17.
  Detailed Timing Descriptor #3: Image size is 609x348 mm, but based on the picture AR it should be 580x348 mm.
EDID:
  Base EDID: Some timings are out of range of the Monitor Ranges:
    Vertical Freq: 24.000 - 75.029 Hz (Monitor: 30.000 - 75.000 Hz)
    Horizontal Freq: 27.000 - 134.992 kHz (Monitor: 31.000 - 140.000 kHz)

Failures:

Block 0, Base EDID:
  Detailed Timing Descriptor #2: Mismatch of image size 800x335 mm vs display size 600x340 mm.
  Display Product Name: NUL byte at position 5.
Block 1, CTA-861 Extension Block:
  Vendor-Specific Data Block (HDMI Forum), OUI C4-5D-D8: HDMI VIC and related CTA VIC codes are present, but the UHD VIC bit is 0.
  Missing VCDB, needed for Set Selectable RGB Quantization to avoid interop issues.
EDID:
  Extension Block 2 started with EDID header, ignoring Extension Blocks >= 2.
  Base EDID: The DTD max image size is 800x348mm, which is larger than the display size 600.0x340.0mm.

EDID conformity: FAIL
