edid-decode (hex):

00 ff ff ff ff ff ff 00 30 e4 4b 02 00 00 00 00
00 14 01 04 95 22 13 78 02 62 25 9f 5d 57 9b 25
19 50 54 00 00 00 01 01 01 01 01 01 01 01 01 01
01 01 01 01 01 01 20 1c 56 9a 50 00 16 30 30 20
35 00 58 c2 10 00 00 1a c0 12 56 9a 50 00 16 30
30 20 35 00 58 c2 10 00 00 1a 00 00 00 fe 00 4e
35 38 33 59 80 31 35 36 57 48 32 0a 00 00 00 00
00 00 41 01 16 00 00 00 00 09 01 0a 20 20 00 4d

00 ff ff ff ff ff ff 00 30 e4 4b 02 00 00 00 00
00 14 01 04 95 22 13 78 02 62 25 9f 5d 57 9b 25
19 50 54 00 00 00 01 01 01 01 01 01 01 01 01 01
01 01 01 01 01 01 20 1c 56 9a 50 00 16 30 30 20
35 00 58 c2 10 00 00 1a c0 12 56 9a 50 00 16 30
30 20 35 00 58 c2 10 00 00 1a 00 00 00 fe 00 4e
35 38 33 59 80 31 35 36 57 48 32 0a 00 00 00 00
00 00 41 01 16 00 00 00 00 09 01 0a 20 20 00 4d

----------------

Block 0, Base EDID:
  EDID Structure Version & Revision: 1.4
  Vendor & Product Identification:
    Manufacturer: LGD
    Model: 587
    Made in: 2010
  Basic Display Parameters & Features:
    Digital display
    Bits per primary color channel: 6
    DisplayPort interface
    Maximum image size: 34 cm x 19 cm
    Gamma: 2.20
    Supported color formats: RGB 4:4:4
    First detailed timing includes the native pixel format and preferred refresh rate
  Color Characteristics:
    Red  : 0.6220, 0.3652
    Green: 0.3398, 0.6074
    Blue : 0.1445, 0.0996
    White: 0.3134, 0.3291
  Established Timings I & II: none
  Standard Timings: none
  Detailed Timing Descriptors:
    DTD 1:  1366x768    59.960027 Hz 683:384   47.368 kHz     72.000000 MHz (344 mm x 194 mm)
                 Hfront   48 Hsync  32 Hback   74 Hpol P
                 Vfront    3 Vsync   5 Vback   14 Vpol N
    DTD 2:  1366x768    39.973351 Hz 683:384   31.579 kHz     48.000000 MHz (344 mm x 194 mm)
                 Hfront   48 Hsync  32 Hback   74 Hpol P
                 Vfront    3 Vsync   5 Vback   14 Vpol N
    Alphanumeric Data String: 'N583Y.156WH2'
    Manufacturer-Specified Display Descriptor (0x00): 00 00 00 00 41 01 16 00 00 00 00 09 01 0a 20 20 '....A.........  '
Checksum: 0x4d

----------------

Warnings:

Block 0, Base EDID:
  Alphanumeric Data String: Non-ASCII character 0x80 at position 5, can cause problems.
  Missing Display Product Name.

Failures:

EDID:
  Extension Block 1 started with EDID header, ignoring Extension Blocks >= 1.

EDID conformity: FAIL
