edid-decode (hex):

00 ff ff ff ff ff ff 00 68 b5 00 16 03 01 01 01
0e 21 01 04 b5 24 13 78 2f 57 a1 b3 33 33 cc 14
14 50 54 21 08 00 d1 c0 a9 00 a9 c0 95 c0 95 c0
01 01 01 01 01 01 c4 3b 80 78 70 b0 32 40 30 20
35 00 68 be 10 00 00 9e 9d 68 00 a0 a0 40 29 60
30 20 35 00 68 be 10 00 00 1e 00 00 00 fc 00 54
59 50 45 2d 43 0a 20 20 20 20 20 20 00 00 00 fd
00 30 a5 78 78 46 01 0a 20 20 20 20 20 20 01 cc

02 03 2d f2 44 90 05 04 5a e2 00 d5 23 09 7f 07
83 01 00 00 e3 05 c0 00 e6 06 05 01 62 62 00 6d
d8 5d c4 01 82 00 00 00 00 00 00 00 00 ec 9c 00
a0 a0 40 29 60 30 20 35 00 68 be 10 00 00 1e 3b
d1 00 a0 a0 40 29 60 30 20 35 00 68 be 10 00 00
1e 12 fb 00 a0 a0 40 29 60 30 20 35 00 68 be 10
00 00 1e dd 40 24 78 90 38 2d 40 30 20 35 00 68
be 10 00 00 1e 00 00 00 00 00 00 00 00 00 00 63

00 ff ff ff ff ff ff 00 68 b5 00 16 03 01 01 01
0e 21 01 04 b5 24 13 78 2f 57 a1 b3 33 33 cc 14
14 50 54 21 08 00 d1 c0 a9 00 a9 c0 95 c0 95 c0
01 01 01 01 01 01 c4 3b 80 78 70 b0 32 40 30 20
35 00 68 be 10 00 00 9e 9d 68 00 a0 a0 40 29 60
30 20 35 00 68 be 10 00 00 1e 00 00 00 fc 00 54
59 50 45 2d 43 0a 20 20 20 20 20 20 00 00 00 fd
00 30 a5 78 78 46 01 0a 20 20 20 20 20 20 01 cc

02 03 2d f2 44 90 05 04 5a e2 00 d5 23 09 7f 07
83 01 00 00 e3 05 c0 00 e6 06 05 01 62 62 00 6d
d8 5d c4 01 82 00 00 00 00 00 00 00 00 ec 9c 00
a0 a0 40 29 60 30 20 35 00 68 be 10 00 00 1e 3b
d1 00 a0 a0 40 29 60 30 20 35 00 68 be 10 00 00
1e 12 fb 00 a0 a0 40 29 60 30 20 35 00 68 be 10
00 00 1e dd 40 24 78 90 38 2d 40 30 20 35 00 68
be 10 00 00 1e 00 00 00 00 00 00 00 00 00 00 63

----------------

Block 0, Base EDID:
  EDID Structure Version & Revision: 1.4
  Vendor & Product Identification:
    Manufacturer: ZEU
    Model: 5632
    Serial Number: ...
    Made in: week 14 of 2023
  Basic Display Parameters & Features:
    Digital display
    Bits per primary color channel: 10
    DisplayPort interface
    Maximum image size: 36 cm x 19 cm
    Gamma: 2.20
    DPMS levels: Off
    Supported color formats: RGB 4:4:4, YCrCb 4:4:4
    Default (sRGB) color space is primary color space
    First detailed timing includes the native pixel format and preferred refresh rate
    Display supports continuous frequencies
  Color Characteristics:
    Red  : 0.7001, 0.2001
    Green: 0.2001, 0.7998
    Blue : 0.0800, 0.0800
    White: 0.3125, 0.3291
  Established Timings I & II:
    DMT 0x04:   640x480    59.940476 Hz   4:3     31.469 kHz     25.175000 MHz
    DMT 0x09:   800x600    60.316541 Hz   4:3     37.879 kHz     40.000000 MHz
    DMT 0x10:  1024x768    60.003840 Hz   4:3     48.363 kHz     65.000000 MHz
  Standard Timings:
    DMT 0x52:  1920x1080   60.000000 Hz  16:9     67.500 kHz    148.500000 MHz
    GTF     :  1600x1000   59.999820 Hz  16:10    62.100 kHz    133.142000 MHz
    DMT 0x53:  1600x900    60.000000 Hz  16:9     60.000 kHz    108.000000 MHz (RB)
    GTF     :  1440x810    60.000051 Hz  16:9     50.340 kHz     95.042000 MHz
    GTF     :  1440x810    60.000051 Hz  16:9     50.340 kHz     95.042000 MHz
  Detailed Timing Descriptors:
    DTD 1:  1920x2400i  59.976010 Hz   4:5     75.000 kHz    153.000000 MHz (360 mm x 190 mm)
                 Hfront   48 Hsync  32 Hback   40 Hpol P
                 Vfront    3 Vsync   5 Vback   42 Vpol P Vfront +0.5 Odd Field
                 Vfront    3 Vsync   5 Vback   42 Vpol P Vback  +0.5 Even Field
    DTD 2:  2560x1600   59.999731 Hz  16:10    98.460 kHz    267.810000 MHz (360 mm x 190 mm)
                 Hfront   48 Hsync  32 Hback   80 Hpol P
                 Vfront    3 Vsync   5 Vback   33 Vpol P
    Display Product Name: 'TYPE-C'
    Display Range Limits:
      Monitor ranges (Range Limits Only): 48-165 Hz V, 120-120 kHz H, max dotclock 700 MHz
  Extension blocks: 1
Checksum: 0xcc

----------------

Block 1, CTA-861 Extension Block:
  Revision: 3
  Underscans IT Video Formats by default
  Basic audio support
  Supports YCbCr 4:4:4
  Supports YCbCr 4:2:2
  Native DTDs: 2
  Video Data Block:
    VIC  16:  1920x1080   60.000000 Hz  16:9     67.500 kHz    148.500000 MHz (native)
    VIC   5:  1920x1080i  60.000000 Hz  16:9     33.750 kHz     74.250000 MHz
    VIC   4:  1280x720    60.000000 Hz  16:9     45.000 kHz     74.250000 MHz
    VIC  90:  2560x1080   60.000000 Hz  64:27    66.000 kHz    198.000000 MHz
  Video Capability Data Block:
    YCbCr quantization: Selectable (via AVI YQ)
    RGB quantization: Selectable (via AVI Q)
    PT scan behavior: Always Overscanned
    IT scan behavior: Always Overscanned
    CE scan behavior: Always Overscanned
  Audio Data Block:
    Linear PCM:
      Max channels: 2
      Supported sample rates (kHz): 192 176.4 96 88.2 48 44.1 32
      Supported sample sizes (bits): 24 20 16
  Speaker Allocation Data Block:
    FL/FR - Front Left/Right
  Colorimetry Data Block:
    BT2020YCC
    BT2020RGB
  HDR Static Metadata Data Block:
    Electro optical transfer functions:
      Traditional gamma - SDR luminance range
      SMPTE ST2084
    Supported static metadata descriptors:
      Static metadata type 1
    Desired content max luminance: 98 (417.710 cd/m^2)
    Desired content max frame-average luminance: 98 (417.710 cd/m^2)
    Desired content min luminance: 0 (0.000 cd/m^2)
  Vendor-Specific Data Block (HDMI Forum), OUI C4-5D-D8:
    Version: 1
    Maximum TMDS Character Rate: 650 MHz
    VRRmin: 0 Hz
    VRRmax: 0 Hz
  Detailed Timing Descriptors:
    DTD 3:  2560x1600   90.000717 Hz  16:10   147.691 kHz    401.720000 MHz (360 mm x 190 mm)
                 Hfront   48 Hsync  32 Hback   80 Hpol P
                 Vfront    3 Vsync   5 Vback   33 Vpol P
    DTD 4:  2560x1600  120.001703 Hz  16:10   196.923 kHz    535.630000 MHz (360 mm x 190 mm)
                 Hfront   48 Hsync  32 Hback   80 Hpol P
                 Vfront    3 Vsync   5 Vback   33 Vpol P
    DTD 5:  2560x1600  143.998459 Hz  16:10   236.301 kHz    642.740000 MHz (360 mm x 190 mm)
                 Hfront   48 Hsync  32 Hback   80 Hpol P
                 Vfront    3 Vsync   5 Vback   33 Vpol P
    DTD 6:  2340x1080   60.000000 Hz  13:6     67.500 kHz    166.050000 MHz (360 mm x 190 mm)
                 Hfront   48 Hsync  32 Hback   40 Hpol P
                 Vfront    3 Vsync   5 Vback   37 Vpol P
Checksum: 0x63  Unused space in Extension Block: 10 bytes

----------------

Warnings:

Block 0, Base EDID:
  Detailed Timing Descriptor #1: Image size is 360x190 mm, but based on the picture AR it should be 152x190 mm.
  Detailed Timing Descriptor #2: Image size is 360x190 mm, but based on the picture AR it should be 304x190 mm.
Block 1, CTA-861 Extension Block:
  Video Data Block: VIC 16 and the first DTD are not identical. Is this intended?
  Video Capability Data Block: IT scan behavior is expected to support underscanned.
  Video Capability Data Block: S_PT is equal to S_IT and S_CE, so should be set to 0 instead.
  Detailed Timing Descriptor #3: Image size is 360x190 mm, but based on the picture AR it should be 304x190 mm.
  Detailed Timing Descriptor #4: Image size is 360x190 mm, but based on the picture AR it should be 304x190 mm.
  Detailed Timing Descriptor #5: Image size is 360x190 mm, but based on the picture AR it should be 304x190 mm.
  Detailed Timing Descriptor #6: Image size is 360x190 mm, but based on the picture AR it should be 360x166 mm.
EDID:
  Base EDID: Some timings are out of range of the Monitor Ranges:
    Horizontal Freq: 31.468 - 236.301 kHz (Monitor: 120.000 - 120.000 kHz)

Failures:

Block 0, Base EDID:
  Basic Display Parameters & Features: sRGB is signaled, but the chromaticities do not match.
Block 1, CTA-861 Extension Block:
  Video Capability Data Block: IT video formats are always overscanned, but bit 7 of Byte 3 of the CTA-861 Extension header is set to underscanned.
  Vendor-Specific Data Block (HDMI Forum), OUI C4-5D-D8: HDMI Forum VSDB did not immediately follow the HDMI VSDB.
  Vendor-Specific Data Block (HDMI Forum), OUI C4-5D-D8: Max TMDS rate is > 0 and <= 340 or > 600.
EDID:
  Extension Block 2 started with EDID header, ignoring Extension Blocks >= 2.
  CTA-861: Native progressive timings are a mix of several resolutions.

EDID conformity: FAIL
