edid-decode (hex):

00 ff ff ff ff ff ff 00 06 b3 ad 32 00 00 00 00
20 21 01 04 b5 46 27 78 3b b6 e1 a3 56 50 a0 27
0e 50 54 bf ef 80 71 4f 81 00 90 40 81 80 95 40
a9 c0 b3 00 95 00 02 3a 80 18 71 38 2d 40 58 2c
45 00 b9 88 21 00 00 1a 00 00 00 ff 00 52 38 4c
4d 44 57 30 31 30 37 34 38 0a 00 00 00 fd 00 30
a5 c3 c3 29 01 0a 20 20 20 20 20 20 00 00 00 fc
00 56 47 33 32 38 51 41 31 41 0a 20 20 20 01 19

02 03 23 f1 48 90 1f 04 13 03 12 3f 40 23 09 07
07 83 01 00 00 6d 1a 00 00 02 01 30 a5 00 00 00
00 00 00 fd 81 80 a0 70 38 1f 40 20 40 45 00 55
50 21 00 00 1e 04 74 80 d0 72 38 2d 40 10 2c 45
80 55 50 21 00 00 1e b9 9c 80 a0 70 38 59 40 30
20 35 00 55 50 21 00 00 1e 8b 6f 80 a0 70 38 40
40 30 20 35 00 55 50 21 00 00 1e 31 44 80 a0 70
38 27 40 30 20 35 00 55 50 21 00 00 1e 00 00 5f

00 ff ff ff ff ff ff 00 06 b3 ad 32 00 00 00 00
20 21 01 04 b5 46 27 78 3b b6 e1 a3 56 50 a0 27
0e 50 54 bf ef 80 71 4f 81 00 90 40 81 80 95 40
a9 c0 b3 00 95 00 02 3a 80 18 71 38 2d 40 58 2c
45 00 b9 88 21 00 00 1a 00 00 00 ff 00 52 38 4c
4d 44 57 30 31 30 37 34 38 0a 00 00 00 fd 00 30
a5 c3 c3 29 01 0a 20 20 20 20 20 20 00 00 00 fc
00 56 47 33 32 38 51 41 31 41 0a 20 20 20 01 19

02 03 23 f1 48 90 1f 04 13 03 12 3f 40 23 09 07
07 83 01 00 00 6d 1a 00 00 02 01 30 a5 00 00 00
00 00 00 fd 81 80 a0 70 38 1f 40 20 40 45 00 55
50 21 00 00 1e 04 74 80 d0 72 38 2d 40 10 2c 45
80 55 50 21 00 00 1e b9 9c 80 a0 70 38 59 40 30
20 35 00 55 50 21 00 00 1e 8b 6f 80 a0 70 38 40
40 30 20 35 00 55 50 21 00 00 1e 31 44 80 a0 70
38 27 40 30 20 35 00 55 50 21 00 00 1e 00 00 5f

----------------

Block 0, Base EDID:
  EDID Structure Version & Revision: 1.4
  Vendor & Product Identification:
    Manufacturer: AUS
    Model: 12973
    Made in: week 32 of 2023
  Basic Display Parameters & Features:
    Digital display
    Bits per primary color channel: 10
    DisplayPort interface
    Maximum image size: 70 cm x 39 cm
    Gamma: 2.20
    DPMS levels: Off
    Supported color formats: RGB 4:4:4, YCrCb 4:4:4, YCrCb 4:2:2
    First detailed timing includes the native pixel format and preferred refresh rate
    Display supports continuous frequencies
  Color Characteristics:
    Red  : 0.6386, 0.3388
    Green: 0.3134, 0.6269
    Blue : 0.1552, 0.0566
    White: 0.3125, 0.3291
  Established Timings I & II:
    IBM     :   720x400    70.081663 Hz   9:5     31.467 kHz     28.320000 MHz
    DMT 0x04:   640x480    59.940476 Hz   4:3     31.469 kHz     25.175000 MHz
    Apple   :   640x480    66.666667 Hz   4:3     35.000 kHz     30.240000 MHz
    DMT 0x05:   640x480    72.808802 Hz   4:3     37.861 kHz     31.500000 MHz
    DMT 0x06:   640x480    75.000000 Hz   4:3     37.500 kHz     31.500000 MHz
    DMT 0x08:   800x600    56.250000 Hz   4:3     35.156 kHz     36.000000 MHz
    DMT 0x09:   800x600    60.316541 Hz   4:3     37.879 kHz     40.000000 MHz
    DMT 0x0a:   800x600    72.187572 Hz   4:3     48.077 kHz     50.000000 MHz
    DMT 0x0b:   800x600    75.000000 Hz   4:3     46.875 kHz     49.500000 MHz
    Apple   :   832x624    74.551266 Hz   4:3     49.726 kHz     57.284000 MHz
    DMT 0x10:  1024x768    60.003840 Hz   4:3     48.363 kHz     65.000000 MHz
    DMT 0x11:  1024x768    70.069359 Hz   4:3     56.476 kHz     75.000000 MHz
    DMT 0x12:  1024x768    75.028582 Hz   4:3     60.023 kHz     78.750000 MHz
    DMT 0x24:  1280x1024   75.024675 Hz   5:4     79.976 kHz    135.000000 MHz
    Apple   :  1152x870    75.061550 Hz 192:145   68.681 kHz    100.000000 MHz
  Standard Timings:
    DMT 0x15:  1152x864    75.000000 Hz   4:3     67.500 kHz    108.000000 MHz
    DMT 0x1c:  1280x800    59.810326 Hz  16:10    49.702 kHz     83.500000 MHz
    DMT 0x2a:  1400x1050   59.978442 Hz   4:3     65.317 kHz    121.750000 MHz
    DMT 0x23:  1280x1024   60.019740 Hz   5:4     63.981 kHz    108.000000 MHz
    GTF     :  1440x1080   60.000055 Hz   4:3     67.080 kHz    129.867000 MHz
    DMT 0x53:  1600x900    60.000000 Hz  16:9     60.000 kHz    108.000000 MHz (RB)
    DMT 0x3a:  1680x1050   59.954250 Hz  16:10    65.290 kHz    146.250000 MHz
    DMT 0x2f:  1440x900    59.887445 Hz  16:10    55.935 kHz    106.500000 MHz
  Detailed Timing Descriptors:
    DTD 1:  1920x1080   60.000000 Hz  16:9     67.500 kHz    148.500000 MHz (697 mm x 392 mm)
                 Hfront   88 Hsync  44 Hback  148 Hpol P
                 Vfront    4 Vsync   5 Vback   36 Vpol N
    Display Product Serial Number: ...
    Display Range Limits:
      Monitor ranges (Range Limits Only): 48-165 Hz V, 195-195 kHz H, max dotclock 410 MHz
    Display Product Name: 'VG328QA1A'
  Extension blocks: 1
Checksum: 0x19

----------------

Block 1, CTA-861 Extension Block:
  Revision: 3
  Underscans IT Video Formats by default
  Basic audio support
  Supports YCbCr 4:4:4
  Supports YCbCr 4:2:2
  Native DTDs: 1
  Video Data Block:
    VIC  16:  1920x1080   60.000000 Hz  16:9     67.500 kHz    148.500000 MHz (native)
    VIC  31:  1920x1080   50.000000 Hz  16:9     56.250 kHz    148.500000 MHz
    VIC   4:  1280x720    60.000000 Hz  16:9     45.000 kHz     74.250000 MHz
    VIC  19:  1280x720    50.000000 Hz  16:9     37.500 kHz     74.250000 MHz
    VIC   3:   720x480    59.940060 Hz  16:9     31.469 kHz     27.000000 MHz
    VIC  18:   720x576    50.000000 Hz  16:9     31.250 kHz     27.000000 MHz
    VIC  63:  1920x1080  120.000000 Hz  16:9    135.000 kHz    297.000000 MHz
    VIC  64:  1920x1080  100.000000 Hz  16:9    112.500 kHz    297.000000 MHz
  Audio Data Block:
    Linear PCM:
      Max channels: 2
      Supported sample rates (kHz): 48 44.1 32
      Supported sample sizes (bits): 24 20 16
  Speaker Allocation Data Block:
    FL/FR - Front Left/Right
  Vendor-Specific Data Block (AMD), OUI 00-00-1A:
    Version: 2
    Feature Caps: 0x01
    Minimum Refresh Rate: 48 Hz
    Maximum Refresh Rate: 165 Hz
    Flags 1.x: 0x00
    Flags 2.x: 0x00
  Detailed Timing Descriptors:
    DTD 2:  1920x1080  144.001419 Hz  16:9    159.986 kHz    332.770000 MHz (597 mm x 336 mm)
                 Hfront   32 Hsync  64 Hback   64 Hpol P
                 Vfront    4 Vsync   5 Vback   22 Vpol P
    DTD 3:  1920x1080  100.000000 Hz  16:9    112.500 kHz    297.000000 MHz (597 mm x 336 mm)
                 Hfront  528 Hsync  44 Hback  148 Hpol P
                 Vfront    4 Vsync   5 Vback   36 Vpol P
    DTD 4:  1920x1080  165.003784 Hz  16:9    192.889 kHz    401.210000 MHz (597 mm x 336 mm)
                 Hfront   48 Hsync  32 Hback   80 Hpol P
                 Vfront    3 Vsync   5 Vback   81 Vpol P
    DTD 5:  1920x1080  120.003194 Hz  16:9    137.284 kHz    285.550000 MHz (597 mm x 336 mm)
                 Hfront   48 Hsync  32 Hback   80 Hpol P
                 Vfront    3 Vsync   5 Vback   56 Vpol P
    DTD 6:  1920x1080   75.002578 Hz  16:9     83.928 kHz    174.570000 MHz (597 mm x 336 mm)
                 Hfront   48 Hsync  32 Hback   80 Hpol P
                 Vfront    3 Vsync   5 Vback   31 Vpol P
Checksum: 0x5f  Unused space in Extension Block: 2 bytes

----------------

Warnings:

Block 0, Base EDID:
  Detailed Timing Descriptor #1: DTD is similar but not identical to VIC 16.
Block 1, CTA-861 Extension Block:
  Video Data Block: VIC 16 and the first DTD are not identical. Is this intended?
  Add a Colorimetry Data Block with the sRGB colorimetry bit set to avoid interop issues.
EDID:
  Base EDID: Some timings are out of range of the Monitor Ranges:
    Horizontal Freq: 31.250 - 192.889 kHz (Monitor: 195.000 - 195.000 kHz)

Failures:

Block 1, CTA-861 Extension Block:
  Detailed Timing Descriptor #2: Mismatch of image size 597x336 mm vs display size 700x390 mm.
  Detailed Timing Descriptor #3: Mismatch of image size 597x336 mm vs display size 700x390 mm.
  Detailed Timing Descriptor #4: Mismatch of image size 597x336 mm vs display size 700x390 mm.
  Detailed Timing Descriptor #5: Mismatch of image size 597x336 mm vs display size 700x390 mm.
  Detailed Timing Descriptor #6: Mismatch of image size 597x336 mm vs display size 700x390 mm.
  Missing VCDB, needed for Set Selectable RGB Quantization to avoid interop issues.
EDID:
  Extension Block 2 started with EDID header, ignoring Extension Blocks >= 2.

EDID conformity: FAIL
