edid-decode (hex):

00 ff ff ff ff ff ff 00 06 b3 ad 32 00 00 00 00
18 21 01 03 80 46 27 78 2e 84 b5 a8 54 52 9e 26
0d 50 54 b7 ef 00 71 4f 81 80 81 40 81 c0 81 00
95 00 b3 00 d1 e8 02 3a 80 18 71 38 2d 40 58 2c
45 00 b9 88 21 00 00 1e 00 00 00 fd 00 30 a5 1e
b9 27 00 0a 20 20 20 20 20 20 00 00 00 ff 00 52
36 4c 4d 44 57 30 30 39 37 39 30 0a 00 00 00 fc
00 56 47 33 32 38 51 41 31 41 0a 20 20 20 01 47

02 03 49 f1 51 81 02 04 10 13 1f 20 21 22 3f 40
5d 5e 5f 60 61 12 23 09 07 07 83 01 00 00 6d 03
0c 00 20 00 38 44 20 00 60 03 02 01 67 d8 5d c4
01 78 80 00 6d 1a 00 00 02 01 30 a5 ed 00 00 00
00 00 e3 0f 00 c0 e2 00 6a 86 6f 80 a0 70 38 40
40 30 20 35 00 b9 88 21 00 00 1a 5a 87 80 a0 70
38 4d 40 30 20 35 00 b9 88 21 00 00 1a 38 95 80
a0 70 38 21 40 30 40 35 00 b9 88 21 00 00 1a 4d

00 ff ff ff ff ff ff 00 06 b3 ad 32 00 00 00 00
18 21 01 03 80 46 27 78 2e 84 b5 a8 54 52 9e 26
0d 50 54 b7 ef 00 71 4f 81 80 81 40 81 c0 81 00
95 00 b3 00 d1 e8 02 3a 80 18 71 38 2d 40 58 2c
45 00 b9 88 21 00 00 1e 00 00 00 fd 00 30 a5 1e
b9 27 00 0a 20 20 20 20 20 20 00 00 00 ff 00 52
36 4c 4d 44 57 30 30 39 37 39 30 0a 00 00 00 fc
00 56 47 33 32 38 51 41 31 41 0a 20 20 20 01 47

02 03 49 f1 51 81 02 04 10 13 1f 20 21 22 3f 40
5d 5e 5f 60 61 12 23 09 07 07 83 01 00 00 6d 03
0c 00 20 00 38 44 20 00 60 03 02 01 67 d8 5d c4
01 78 80 00 6d 1a 00 00 02 01 30 a5 ed 00 00 00
00 00 e3 0f 00 c0 e2 00 6a 86 6f 80 a0 70 38 40
40 30 20 35 00 b9 88 21 00 00 1a 5a 87 80 a0 70
38 4d 40 30 20 35 00 b9 88 21 00 00 1a 38 95 80
a0 70 38 21 40 30 40 35 00 b9 88 21 00 00 1a 4d

----------------

Block 0, Base EDID:
  EDID Structure Version & Revision: 1.3
  Vendor & Product Identification:
    Manufacturer: AUS
    Model: 12973
    Made in: week 24 of 2023
  Basic Display Parameters & Features:
    Digital display
    Maximum image size: 70 cm x 39 cm
    Gamma: 2.20
    DPMS levels: Off
    RGB color display
    Default (sRGB) color space is primary color space
    First detailed timing is the preferred timing
  Color Characteristics:
    Red  : 0.6582, 0.3281
    Green: 0.3212, 0.6171
    Blue : 0.1503, 0.0537
    White: 0.3134, 0.3291
  Established Timings I & II:
    IBM     :   720x400    70.081663 Hz   9:5     31.467 kHz     28.320000 MHz
    DMT 0x04:   640x480    59.940476 Hz   4:3     31.469 kHz     25.175000 MHz
    Apple   :   640x480    66.666667 Hz   4:3     35.000 kHz     30.240000 MHz
    DMT 0x06:   640x480    75.000000 Hz   4:3     37.500 kHz     31.500000 MHz
    DMT 0x08:   800x600    56.250000 Hz   4:3     35.156 kHz     36.000000 MHz
    DMT 0x09:   800x600    60.316541 Hz   4:3     37.879 kHz     40.000000 MHz
    DMT 0x0a:   800x600    72.187572 Hz   4:3     48.077 kHz     50.000000 MHz
    DMT 0x0b:   800x600    75.000000 Hz   4:3     46.875 kHz     49.500000 MHz
    Apple   :   832x624    74.551266 Hz   4:3     49.726 kHz     57.284000 MHz
    DMT 0x10:  1024x768    60.003840 Hz   4:3     48.363 kHz     65.000000 MHz
    DMT 0x11:  1024x768    70.069359 Hz   4:3     56.476 kHz     75.000000 MHz
    DMT 0x12:  1024x768    75.028582 Hz   4:3     60.023 kHz     78.750000 MHz
    DMT 0x24:  1280x1024   75.024675 Hz   5:4     79.976 kHz    135.000000 MHz
  Standard Timings:
    DMT 0x15:  1152x864    75.000000 Hz   4:3     67.500 kHz    108.000000 MHz
    DMT 0x23:  1280x1024   60.019740 Hz   5:4     63.981 kHz    108.000000 MHz
    DMT 0x20:  1280x960    60.000000 Hz   4:3     60.000 kHz    108.000000 MHz
    DMT 0x55:  1280x720    60.000000 Hz  16:9     45.000 kHz     74.250000 MHz
    DMT 0x1c:  1280x800    59.810326 Hz  16:10    49.702 kHz     83.500000 MHz
    DMT 0x2f:  1440x900    59.887445 Hz  16:10    55.935 kHz    106.500000 MHz
    DMT 0x3a:  1680x1050   59.954250 Hz  16:10    65.290 kHz    146.250000 MHz
    GTF     :  1920x1080  100.000000 Hz  16:9    114.400 kHz    302.016000 MHz
  Detailed Timing Descriptors:
    DTD 1:  1920x1080   60.000000 Hz  16:9     67.500 kHz    148.500000 MHz (697 mm x 392 mm)
                 Hfront   88 Hsync  44 Hback  148 Hpol P
                 Vfront    4 Vsync   5 Vback   36 Vpol P
    Display Range Limits:
      Monitor ranges (GTF): 48-165 Hz V, 30-185 kHz H, max dotclock 390 MHz
    Display Product Serial Number: ...
    Display Product Name: 'VG328QA1A'
  Extension blocks: 1
Checksum: 0x47

----------------

Block 1, CTA-861 Extension Block:
  Revision: 3
  Underscans IT Video Formats by default
  Basic audio support
  Supports YCbCr 4:4:4
  Supports YCbCr 4:2:2
  Native DTDs: 1
  Video Data Block:
    VIC   1:   640x480    59.940476 Hz   4:3     31.469 kHz     25.175000 MHz (native)
    VIC   2:   720x480    59.940060 Hz   4:3     31.469 kHz     27.000000 MHz
    VIC   4:  1280x720    60.000000 Hz  16:9     45.000 kHz     74.250000 MHz
    VIC  16:  1920x1080   60.000000 Hz  16:9     67.500 kHz    148.500000 MHz
    VIC  19:  1280x720    50.000000 Hz  16:9     37.500 kHz     74.250000 MHz
    VIC  31:  1920x1080   50.000000 Hz  16:9     56.250 kHz    148.500000 MHz
    VIC  32:  1920x1080   24.000000 Hz  16:9     27.000 kHz     74.250000 MHz
    VIC  33:  1920x1080   25.000000 Hz  16:9     28.125 kHz     74.250000 MHz
    VIC  34:  1920x1080   30.000000 Hz  16:9     33.750 kHz     74.250000 MHz
    VIC  63:  1920x1080  120.000000 Hz  16:9    135.000 kHz    297.000000 MHz
    VIC  64:  1920x1080  100.000000 Hz  16:9    112.500 kHz    297.000000 MHz
    VIC  93:  3840x2160   24.000000 Hz  16:9     54.000 kHz    297.000000 MHz
    VIC  94:  3840x2160   25.000000 Hz  16:9     56.250 kHz    297.000000 MHz
    VIC  95:  3840x2160   30.000000 Hz  16:9     67.500 kHz    297.000000 MHz
    VIC  96:  3840x2160   50.000000 Hz  16:9    112.500 kHz    594.000000 MHz
    VIC  97:  3840x2160   60.000000 Hz  16:9    135.000 kHz    594.000000 MHz
    VIC  18:   720x576    50.000000 Hz  16:9     31.250 kHz     27.000000 MHz
  Audio Data Block:
    Linear PCM:
      Max channels: 2
      Supported sample rates (kHz): 48 44.1 32
      Supported sample sizes (bits): 24 20 16
  Speaker Allocation Data Block:
    FL/FR - Front Left/Right
  Vendor-Specific Data Block (HDMI), OUI 00-0C-03:
    Source physical address: 2.0.0.0
    DC_36bit
    DC_30bit
    DC_Y444
    Maximum TMDS clock: 340 MHz
    Extended HDMI video details:
      HDMI VICs:
        HDMI VIC 3:  3840x2160   24.000000 Hz  16:9     54.000 kHz    297.000000 MHz
        HDMI VIC 2:  3840x2160   25.000000 Hz  16:9     56.250 kHz    297.000000 MHz
        HDMI VIC 1:  3840x2160   30.000000 Hz  16:9     67.500 kHz    297.000000 MHz
  Vendor-Specific Data Block (HDMI Forum), OUI C4-5D-D8:
    Version: 1
    Maximum TMDS Character Rate: 600 MHz
    SCDC Present
  Vendor-Specific Data Block (AMD), OUI 00-00-1A:
    Version: 2
    Feature Caps: 0x01
    Minimum Refresh Rate: 48 Hz
    Maximum Refresh Rate: 165 Hz
    Flags 1.x: 0xed (MCCS)
    Flags 2.x: 0x00
  YCbCr 4:2:0 Capability Map Data Block:
    VIC  96:  3840x2160   50.000000 Hz  16:9    112.500 kHz    594.000000 MHz
    VIC  97:  3840x2160   60.000000 Hz  16:9    135.000 kHz    594.000000 MHz
  Video Capability Data Block:
    YCbCr quantization: No Data
    RGB quantization: Selectable (via AVI Q)
    PT scan behavior: Always Underscanned
    IT scan behavior: Always Underscanned
    CE scan behavior: Always Underscanned
  Detailed Timing Descriptors:
    DTD 2:  1920x1080  119.982181 Hz  16:9    137.260 kHz    285.500000 MHz (697 mm x 392 mm)
                 Hfront   48 Hsync  32 Hback   80 Hpol P
                 Vfront    3 Vsync   5 Vback   56 Vpol N
    DTD 3:  1920x1080  143.981451 Hz  16:9    166.587 kHz    346.500000 MHz (697 mm x 392 mm)
                 Hfront   48 Hsync  32 Hback   80 Hpol P
                 Vfront    3 Vsync   5 Vback   69 Vpol N
    DTD 4:  1920x1080  165.007948 Hz  16:9    183.654 kHz    382.000000 MHz (697 mm x 392 mm)
                 Hfront   48 Hsync  64 Hback   48 Hpol P
                 Vfront    3 Vsync   5 Vback   25 Vpol N
Checksum: 0x4d

----------------

Warnings:

Block 1, CTA-861 Extension Block:
  Video Data Block: VIC 1 and the first DTD are not identical. Is this intended?
  Video Capability Data Block: Set Selectable YCbCr Quantization to avoid interop issues.
  Video Capability Data Block: S_PT is equal to S_IT and S_CE, so should be set to 0 instead.
EDID:
  Base EDID: Some timings are out of range of the Monitor Ranges:
    Vertical Freq: 24.000 - 165.008 Hz (Monitor: 48.000 - 165.000 Hz)
    Horizontal Freq: 27.000 - 183.653 kHz (Monitor: 30.000 - 185.000 kHz)
    Maximum Clock: 594.000 MHz (Monitor: 390.000 MHz)

Failures:

Block 0, Base EDID:
  Basic Display Parameters & Features: sRGB is signaled, but the chromaticities do not match.
Block 1, CTA-861 Extension Block:
  Vendor-Specific Data Block (HDMI Forum), OUI C4-5D-D8: HDMI VIC and related CTA VIC codes are present, but the UHD VIC bit is 0.
EDID:
  Extension Block 2 started with EDID header, ignoring Extension Blocks >= 2.
  CTA-861: Native progressive timings are a mix of several resolutions.

EDID conformity: FAIL
