edid-decode (hex):

00 ff ff ff ff ff ff 00 21 6d 00 32 01 00 00 00
0e 20 01 03 80 46 27 78 2a ee 91 a3 54 4c 99 26
0f 50 54 21 08 00 81 80 b3 00 a9 c0 01 01 01 01
01 01 01 01 01 01 50 d0 00 a0 f0 70 3e 80 28 40
8a 00 ba 89 21 00 00 1e 00 00 00 ff 00 30 30 30
30 30 30 30 30 30 30 30 30 31 00 00 00 fd 00 18
3c 1e 86 3c 00 0a 20 20 20 20 20 20 00 00 00 fc
00 4a 41 50 41 4e 4e 45 58 54 20 4d 4e 54 01 8e

02 03 44 f1 4d 10 1f 04 13 03 12 01 5d 5e 5f 61
60 05 23 09 07 07 83 01 00 00 67 03 0c 00 10 00
38 78 67 d8 5d c4 01 78 80 00 e3 05 c0 00 e6 06
05 01 60 59 08 68 1a 00 00 01 01 30 3c e6 e3 0f
00 e2 00 c0 0c 68 00 a0 f0 70 3e 80 30 20 35 00
00 00 00 00 00 1e 38 61 00 a0 a0 a0 55 50 30 20
35 00 00 00 00 00 00 1e 84 21 56 aa 51 00 1e 30
46 8f 33 00 00 00 00 00 00 1e 00 00 00 00 00 2b

00 ff ff ff ff ff ff 00 21 6d 00 32 01 00 00 00
0e 20 01 03 80 46 27 78 2a ee 91 a3 54 4c 99 26
0f 50 54 21 08 00 81 80 b3 00 a9 c0 01 01 01 01
01 01 01 01 01 01 50 d0 00 a0 f0 70 3e 80 28 40
8a 00 ba 89 21 00 00 1e 00 00 00 ff 00 30 30 30
30 30 30 30 30 30 30 30 30 31 00 00 00 fd 00 18
3c 1e 86 3c 00 0a 20 20 20 20 20 20 00 00 00 fc
00 4a 41 50 41 4e 4e 45 58 54 20 4d 4e 54 01 8e

02 03 44 f1 4d 10 1f 04 13 03 12 01 5d 5e 5f 61
60 05 23 09 07 07 83 01 00 00 67 03 0c 00 10 00
38 78 67 d8 5d c4 01 78 80 00 e3 05 c0 00 e6 06
05 01 60 59 08 68 1a 00 00 01 01 30 3c e6 e3 0f
00 e2 00 c0 0c 68 00 a0 f0 70 3e 80 30 20 35 00
00 00 00 00 00 1e 38 61 00 a0 a0 a0 55 50 30 20
35 00 00 00 00 00 00 1e 84 21 56 aa 51 00 1e 30
46 8f 33 00 00 00 00 00 00 1e 00 00 00 00 00 2b

----------------

Block 0, Base EDID:
  EDID Structure Version & Revision: 1.3
  Vendor & Product Identification:
    Manufacturer: HKM
    Model: 12800
    Serial Number: ...
    Made in: week 14 of 2022
  Basic Display Parameters & Features:
    Digital display
    Maximum image size: 70 cm x 39 cm
    Gamma: 2.20
    DPMS levels: Off
    RGB color display
    First detailed timing is the preferred timing
  Color Characteristics:
    Red  : 0.6396, 0.3300
    Green: 0.2998, 0.5996
    Blue : 0.1503, 0.0595
    White: 0.3125, 0.3291
  Established Timings I & II:
    DMT 0x04:   640x480    59.940476 Hz   4:3     31.469 kHz     25.175000 MHz
    DMT 0x09:   800x600    60.316541 Hz   4:3     37.879 kHz     40.000000 MHz
    DMT 0x10:  1024x768    60.003840 Hz   4:3     48.363 kHz     65.000000 MHz
  Standard Timings:
    DMT 0x23:  1280x1024   60.019740 Hz   5:4     63.981 kHz    108.000000 MHz
    DMT 0x3a:  1680x1050   59.954250 Hz  16:10    65.290 kHz    146.250000 MHz
    DMT 0x53:  1600x900    60.000000 Hz  16:9     60.000 kHz    108.000000 MHz (RB)
  Detailed Timing Descriptors:
    DTD 1:  3840x2160   60.000000 Hz  16:9    133.320 kHz    533.280000 MHz (698 mm x 393 mm)
                 Hfront   40 Hsync  64 Hback   56 Hpol P
                 Vfront    8 Vsync  10 Vback   44 Vpol P
    Display Product Serial Number: ...
    Display Range Limits:
      Monitor ranges (GTF): 24-60 Hz V, 30-134 kHz H, max dotclock 600 MHz
    Display Product Name: 'JAPANNEXT MNT'
  Extension blocks: 1
Checksum: 0x8e

----------------

Block 1, CTA-861 Extension Block:
  Revision: 3
  Underscans IT Video Formats by default
  Basic audio support
  Supports YCbCr 4:4:4
  Supports YCbCr 4:2:2
  Native DTDs: 1
  Video Data Block:
    VIC  16:  1920x1080   60.000000 Hz  16:9     67.500 kHz    148.500000 MHz
    VIC  31:  1920x1080   50.000000 Hz  16:9     56.250 kHz    148.500000 MHz
    VIC   4:  1280x720    60.000000 Hz  16:9     45.000 kHz     74.250000 MHz
    VIC  19:  1280x720    50.000000 Hz  16:9     37.500 kHz     74.250000 MHz
    VIC   3:   720x480    59.940060 Hz  16:9     31.469 kHz     27.000000 MHz
    VIC  18:   720x576    50.000000 Hz  16:9     31.250 kHz     27.000000 MHz
    VIC   1:   640x480    59.940476 Hz   4:3     31.469 kHz     25.175000 MHz
    VIC  93:  3840x2160   24.000000 Hz  16:9     54.000 kHz    297.000000 MHz
    VIC  94:  3840x2160   25.000000 Hz  16:9     56.250 kHz    297.000000 MHz
    VIC  95:  3840x2160   30.000000 Hz  16:9     67.500 kHz    297.000000 MHz
    VIC  97:  3840x2160   60.000000 Hz  16:9    135.000 kHz    594.000000 MHz
    VIC  96:  3840x2160   50.000000 Hz  16:9    112.500 kHz    594.000000 MHz
    VIC   5:  1920x1080i  60.000000 Hz  16:9     33.750 kHz     74.250000 MHz
  Audio Data Block:
    Linear PCM:
      Max channels: 2
      Supported sample rates (kHz): 48 44.1 32
      Supported sample sizes (bits): 24 20 16
  Speaker Allocation Data Block:
    FL/FR - Front Left/Right
  Vendor-Specific Data Block (HDMI), OUI 00-0C-03:
    Source physical address: 1.0.0.0
    DC_36bit
    DC_30bit
    DC_Y444
    Maximum TMDS clock: 600 MHz
  Vendor-Specific Data Block (HDMI Forum), OUI C4-5D-D8:
    Version: 1
    Maximum TMDS Character Rate: 600 MHz
    SCDC Present
  Colorimetry Data Block:
    BT2020YCC
    BT2020RGB
  HDR Static Metadata Data Block:
    Electro optical transfer functions:
      Traditional gamma - SDR luminance range
      SMPTE ST2084
    Supported static metadata descriptors:
      Static metadata type 1
    Desired content max luminance: 96 (400.000 cd/m^2)
    Desired content max frame-average luminance: 89 (343.724 cd/m^2)
    Desired content min luminance: 8 (0.004 cd/m^2)
  Vendor-Specific Data Block (AMD), OUI 00-00-1A:
    Version: 1
    Flags 1: 0x01
      FreeSync Supported
    Minimum Refresh Rate: 48 Hz
    Maximum Refresh Rate: 60 Hz
    MCCS VCP Code: 0xe6
  YCbCr 4:2:0 Capability Map Data Block:
    VIC  95:  3840x2160   30.000000 Hz  16:9     67.500 kHz    297.000000 MHz
    SVD Index 14 is out of range
    SVD Index 15 is out of range
    SVD Index 16 is out of range
  Unknown CTA-861 Data Block (tag 0x00, length 0):
  Video Format Data Block:
  Detailed Timing Descriptors:
    DTD 2:  3840x2160   29.968497 Hz  16:9     66.590 kHz    266.360000 MHz
                 Hfront   48 Hsync  32 Hback   80 Hpol P
                 Vfront    3 Vsync   5 Vback   54 Vpol P
    DTD 3:  2560x1440   60.000000 Hz  16:9     91.500 kHz    248.880000 MHz
                 Hfront   48 Hsync  32 Hback   80 Hpol P
                 Vfront    3 Vsync   5 Vback   77 Vpol P
    DTD 4:  1366x768    59.999329 Hz 683:384   47.879 kHz     85.800000 MHz
                 Hfront   70 Hsync 143 Hback  213 Hpol P
                 Vfront    3 Vsync   3 Vback   24 Vpol P
Checksum: 0x2b  Unused space in Extension Block: 5 bytes

----------------

Warnings:

Block 0, Base EDID:
  Vendor & Product Identification: The serial number is one of the known dummy values, it should probably be set to 0.
  Display Product Serial Number: ...
Block 1, CTA-861 Extension Block:
  Video Data Block: VIC 16 and the first DTD are not identical. Is this intended?
  YCbCr 4:2:0 Capability Map Data Block: Some YCbCr 4:2:0 timings are invalid for HDMI 2.1 (which requires an RGB timings pixel rate >= 590 MHz).
  Unknown CTA-861 Data Block (tag 0x00, length 0).
  Display Product Serial Number is set, so the Serial Number in the Base EDID should be 0.
EDID:
  Base EDID: Some timings are out of range of the Monitor Ranges:
    Horizontal Freq: 31.250 - 135.000 kHz (Monitor: 30.000 - 134.000 kHz)

Failures:

Block 0, Base EDID:
  Basic Display Parameters & Features: The chromaticities match sRGB, but sRGB is not signaled.
Block 1, CTA-861 Extension Block:
  Vendor-Specific Data Block (HDMI), OUI 00-0C-03: HDMI VSDB Max TMDS rate is > 340.
  YCbCr 4:2:0 Capability Map Data Block: Max index 16 > 13 (#SVDs).
  Video Format Data Block: Length is 0.
  Detailed Timing Descriptor #2: Mismatch of image size vs display size: image size is not set, but display size is.
  Detailed Timing Descriptor #3: Mismatch of image size vs display size: image size is not set, but display size is.
  Detailed Timing Descriptor #4: Mismatch of image size vs display size: image size is not set, but display size is.
  Missing VCDB, needed for Set Selectable RGB Quantization to avoid interop issues.
EDID:
  Extension Block 2 started with EDID header, ignoring Extension Blocks >= 2.

EDID conformity: FAIL
