edid-decode (hex):

00 ff ff ff ff ff ff 00 21 6d 00 32 00 00 00 00
0e 1f 01 04 b5 46 27 78 eb 4d 70 a6 55 4d 98 24
0c 4c 52 23 08 00 01 01 01 01 b3 00 01 01 a9 c0
81 80 01 01 81 c0 4d d0 00 a0 f0 70 3e 80 30 20
35 00 ba 89 21 00 00 1e 1a 36 80 a0 70 38 1f 40
30 20 25 00 6c 5e 21 00 00 1a 00 00 00 fd 00 30
3c 87 87 3c 01 0a 20 20 20 20 20 20 00 00 00 fc
00 4a 41 50 41 4e 4e 45 58 54 20 4d 4e 54 01 8d

02 03 18 f2 4b 90 01 02 03 04 61 5f 60 13 05 12
23 09 07 07 83 01 00 00 04 74 00 30 f2 70 5a 80
b0 58 8a 00 6c 5e 21 00 00 1a 56 5e 00 a0 a0 a0
29 50 30 20 25 00 6c 5e 21 00 00 1e 02 3a 80 18
71 38 2d 40 58 2c 45 00 6c 5e 21 00 00 1e 84 21
56 aa 51 00 1e 30 46 8f 33 00 00 00 00 00 00 1e
00 00 00 00 00 00 00 00 00 00 00 00 00 00 00 00
00 00 00 00 00 00 00 00 00 00 00 00 00 00 00 d8

00 ff ff ff ff ff ff 00 21 6d 00 32 00 00 00 00
0e 1f 01 04 b5 46 27 78 eb 4d 70 a6 55 4d 98 24
0c 4c 52 23 08 00 01 01 01 01 b3 00 01 01 a9 c0
81 80 01 01 81 c0 4d d0 00 a0 f0 70 3e 80 30 20
35 00 ba 89 21 00 00 1e 1a 36 80 a0 70 38 1f 40
30 20 25 00 6c 5e 21 00 00 1a 00 00 00 fd 00 30
3c 87 87 3c 01 0a 20 20 20 20 20 20 00 00 00 fc
00 4a 41 50 41 4e 4e 45 58 54 20 4d 4e 54 01 8d

02 03 18 f2 4b 90 01 02 03 04 61 5f 60 13 05 12
23 09 07 07 83 01 00 00 04 74 00 30 f2 70 5a 80
b0 58 8a 00 6c 5e 21 00 00 1a 56 5e 00 a0 a0 a0
29 50 30 20 25 00 6c 5e 21 00 00 1e 02 3a 80 18
71 38 2d 40 58 2c 45 00 6c 5e 21 00 00 1e 84 21
56 aa 51 00 1e 30 46 8f 33 00 00 00 00 00 00 1e
00 00 00 00 00 00 00 00 00 00 00 00 00 00 00 00
00 00 00 00 00 00 00 00 00 00 00 00 00 00 00 d8

----------------

Block 0, Base EDID:
  EDID Structure Version & Revision: 1.4
  Vendor & Product Identification:
    Manufacturer: HKM
    Model: 12800
    Made in: week 14 of 2021
  Basic Display Parameters & Features:
    Digital display
    Bits per primary color channel: 10
    DisplayPort interface
    Maximum image size: 70 cm x 39 cm
    Gamma: 2.20
    DPMS levels: Standby Suspend Off
    Supported color formats: RGB 4:4:4, YCrCb 4:4:4
    First detailed timing includes the native pixel format and preferred refresh rate
    Display supports continuous frequencies
  Color Characteristics:
    Red  : 0.6494, 0.3320
    Green: 0.3037, 0.5947
    Blue : 0.1416, 0.0498
    White: 0.2968, 0.3203
  Established Timings I & II:
    DMT 0x04:   640x480    59.940476 Hz   4:3     31.469 kHz     25.175000 MHz
    DMT 0x08:   800x600    56.250000 Hz   4:3     35.156 kHz     36.000000 MHz
    DMT 0x09:   800x600    60.316541 Hz   4:3     37.879 kHz     40.000000 MHz
    DMT 0x10:  1024x768    60.003840 Hz   4:3     48.363 kHz     65.000000 MHz
  Standard Timings:
    DMT 0x3a:  1680x1050   59.954250 Hz  16:10    65.290 kHz    146.250000 MHz
    DMT 0x53:  1600x900    60.000000 Hz  16:9     60.000 kHz    108.000000 MHz (RB)
    DMT 0x23:  1280x1024   60.019740 Hz   5:4     63.981 kHz    108.000000 MHz
    DMT 0x55:  1280x720    60.000000 Hz  16:9     45.000 kHz     74.250000 MHz
  Detailed Timing Descriptors:
    DTD 1:  3840x2160   59.996625 Hz  16:9    133.312 kHz    533.250000 MHz (698 mm x 393 mm)
                 Hfront   48 Hsync  32 Hback   80 Hpol P
                 Vfront    3 Vsync   5 Vback   54 Vpol P
    DTD 2:  1920x1080   59.933878 Hz  16:9     66.587 kHz    138.500000 MHz (620 mm x 350 mm)
                 Hfront   48 Hsync  32 Hback   80 Hpol P
                 Vfront    2 Vsync   5 Vback   24 Vpol N
    Display Range Limits:
      Monitor ranges (Range Limits Only): 48-60 Hz V, 135-135 kHz H, max dotclock 600 MHz
    Display Product Name: 'JAPANNEXT MNT'
  Extension blocks: 1
Checksum: 0x8d

----------------

Block 1, CTA-861 Extension Block:
  Revision: 3
  Underscans IT Video Formats by default
  Basic audio support
  Supports YCbCr 4:4:4
  Supports YCbCr 4:2:2
  Native DTDs: 2
  Video Data Block:
    VIC  16:  1920x1080   60.000000 Hz  16:9     67.500 kHz    148.500000 MHz (native)
    VIC   1:   640x480    59.940476 Hz   4:3     31.469 kHz     25.175000 MHz
    VIC   2:   720x480    59.940060 Hz   4:3     31.469 kHz     27.000000 MHz
    VIC   3:   720x480    59.940060 Hz  16:9     31.469 kHz     27.000000 MHz
    VIC   4:  1280x720    60.000000 Hz  16:9     45.000 kHz     74.250000 MHz
    VIC  97:  3840x2160   60.000000 Hz  16:9    135.000 kHz    594.000000 MHz
    VIC  95:  3840x2160   30.000000 Hz  16:9     67.500 kHz    297.000000 MHz
    VIC  96:  3840x2160   50.000000 Hz  16:9    112.500 kHz    594.000000 MHz
    VIC  19:  1280x720    50.000000 Hz  16:9     37.500 kHz     74.250000 MHz
    VIC   5:  1920x1080i  60.000000 Hz  16:9     33.750 kHz     74.250000 MHz
    VIC  18:   720x576    50.000000 Hz  16:9     31.250 kHz     27.000000 MHz
  Audio Data Block:
    Linear PCM:
      Max channels: 2
      Supported sample rates (kHz): 48 44.1 32
      Supported sample sizes (bits): 24 20 16
  Speaker Allocation Data Block:
    FL/FR - Front Left/Right
  Detailed Timing Descriptors:
    DTD 3:  3840x2160   30.000000 Hz  16:9     67.500 kHz    297.000000 MHz (620 mm x 350 mm)
                 Hfront  176 Hsync  88 Hback  296 Hpol P
                 Vfront    8 Vsync  10 Vback   72 Vpol N
    DTD 4:  2560x1440   59.950550 Hz  16:9     88.787 kHz    241.500000 MHz (620 mm x 350 mm)
                 Hfront   48 Hsync  32 Hback   80 Hpol P
                 Vfront    2 Vsync   5 Vback   34 Vpol P
    DTD 5:  1920x1080   60.000000 Hz  16:9     67.500 kHz    148.500000 MHz (620 mm x 350 mm)
                 Hfront   88 Hsync  44 Hback  148 Hpol P
                 Vfront    4 Vsync   5 Vback   36 Vpol P
    DTD 6:  1366x768    59.999329 Hz 683:384   47.879 kHz     85.800000 MHz
                 Hfront   70 Hsync 143 Hback  213 Hpol P
                 Vfront    3 Vsync   3 Vback   24 Vpol P
Checksum: 0xd8  Unused space in Extension Block: 31 bytes

----------------

Warnings:

Block 1, CTA-861 Extension Block:
  Video Data Block: VIC 16 and the first DTD are not identical. Is this intended?
  Detailed Timing Descriptor #3: DTD is similar but not identical to VIC 95.
  Add a Colorimetry Data Block with the sRGB colorimetry bit set to avoid interop issues.
EDID:
  Base EDID: Some timings are out of range of the Monitor Ranges:
    Vertical Freq: 30.000 - 60.317 Hz (Monitor: 48.000 - 60.000 Hz)
    Horizontal Freq: 31.250 - 135.000 kHz (Monitor: 135.000 - 135.000 kHz)

Failures:

Block 0, Base EDID:
  Detailed Timing Descriptor #2: Mismatch of image size 620x350 mm vs display size 700x390 mm.
Block 1, CTA-861 Extension Block:
  Detailed Timing Descriptor #3: Mismatch of image size 620x350 mm vs display size 700x390 mm.
  Detailed Timing Descriptor #4: Mismatch of image size 620x350 mm vs display size 700x390 mm.
  Detailed Timing Descriptor #5: Mismatch of image size 620x350 mm vs display size 700x390 mm.
  Detailed Timing Descriptor #6: Mismatch of image size vs display size: image size is not set, but display size is.
  Missing VCDB, needed for Set Selectable RGB Quantization to avoid interop issues.
EDID:
  Extension Block 2 started with EDID header, ignoring Extension Blocks >= 2.
  CTA-861: Native progressive timings are a mix of several resolutions.

EDID conformity: FAIL
