edid-decode (hex):

00 ff ff ff ff ff ff 00 34 38 e0 0b f9 0d 00 00
0e 0a 01 00 28 20 18 b9 e8 26 9e 9c 57 4c 96 26
10 47 4f a4 43 00 31 59 45 59 61 59 01 01 01 01
01 01 01 01 01 01 d5 09 80 a0 20 90 31 10 10 60
c2 00 40 f0 10 00 00 1c 94 2a 00 46 41 00 29 30
30 73 03 00 40 f0 10 00 00 1e bc 34 00 98 51 00
2a 40 10 90 13 00 40 f0 10 00 00 1e 02 3a 00 c0
51 c0 33 30 40 a0 13 00 40 f0 10 00 00 1e 00 23

----------------

Block 0, Base EDID:
  EDID Structure Version & Revision: 1.0
  Vendor & Product Identification:
    Manufacturer: MAX
    Model: 3040
    Serial Number: ...
    Made in: week 14 of 2000
  Basic Display Parameters & Features:
    Analog display
    Signal Level Standard: 0.714 : 0.286 : 1.000 V p-p
    Blank level equals black level
    Sync: Separate
    Maximum image size: 32 cm x 24 cm
    Gamma: 2.85
    DPMS levels: Standby Suspend Off
    RGB color display
  Color Characteristics:
    Red  : 0.6093, 0.3417
    Green: 0.2978, 0.5878
    Blue : 0.1503, 0.0634
    White: 0.2802, 0.3105
  Established Timings I & II:
    IBM     :   720x400    70.081663 Hz   9:5     31.467 kHz     28.320000 MHz
    DMT 0x04:   640x480    59.940476 Hz   4:3     31.469 kHz     25.175000 MHz
    DMT 0x06:   640x480    75.000000 Hz   4:3     37.500 kHz     31.500000 MHz
    DMT 0x0b:   800x600    75.000000 Hz   4:3     46.875 kHz     49.500000 MHz
    DMT 0x12:  1024x768    75.028582 Hz   4:3     60.023 kHz     78.750000 MHz
    DMT 0x24:  1280x1024   75.024675 Hz   5:4     79.976 kHz    135.000000 MHz
  Standard Timings:
    DMT 0x07:   640x480    85.008312 Hz   4:3     43.269 kHz     36.000000 MHz
    DMT 0x0c:   800x600    85.061274 Hz   4:3     53.674 kHz     56.250000 MHz
    DMT 0x13:  1024x768    84.996690 Hz   4:3     68.677 kHz     94.500000 MHz
  Detailed Timing Descriptors:
    DTD 1:   640x400    70.072383 Hz  16:10    31.462 kHz     25.170000 MHz (320 mm x 240 mm)
                 Hfront   16 Hsync  96 Hback   48 Hpol N
                 Vfront   12 Vsync   2 Vback   35 Vpol P
    DTD 2:  1024x768    99.803141 Hz   4:3     80.741 kHz    109.000000 MHz (320 mm x 240 mm)
                 Hfront   48 Hsync 115 Hback  163 Hpol P
                 Vfront    0 Vsync   3 Vback   38 Vpol P
                   94 2a 00 46 41 00 29 30 30 73 03 00 40 f0 10 00 00 1e '.*.FA.)00s..@.....'
    DTD 3:  1280x1024   75.024675 Hz   5:4     79.976 kHz    135.000000 MHz (320 mm x 240 mm)
                 Hfront   16 Hsync 144 Hback  248 Hpol P
                 Vfront    1 Vsync   3 Vback   38 Vpol P
    DTD 4:  1280x960    85.002473 Hz   4:3     85.938 kHz    148.500000 MHz (320 mm x 240 mm)
                 Hfront   64 Hsync 160 Hback  224 Hpol P
                 Vfront    1 Vsync   3 Vback   47 Vpol P
Checksum: 0x23

----------------

Warnings:

Block 0, Base EDID:
  EDID Structure Version & Revision: EDID 1.0 is deprecated, do not use.
  Detailed Timing Descriptor #1: Image size is 320x240 mm, but based on the picture AR it should be 320x200 mm.
  Detailed Timing Descriptor #3: Image size is 320x240 mm, but based on the picture AR it should be 320x256 mm.

Failures:

Block 0, Base EDID:
  Detailed Timing Descriptor #2: 0 values in the video timing:
    Horizontal Active/Blanking 1024/326
    Horizontal Frontporch/Sync Width 48/115
    Vertical Active/Blanking 768/41
    Vertical Frontporch/Sync Width 0/3

EDID conformity: FAIL
