edid-decode (hex):

00 ff ff ff ff ff ff 00 5c 2d 00 25 00 00 00 00
0c 1f 01 04 b5 38 1e 78 3b ca 75 a9 54 45 98 22
1f 50 54 21 08 00 01 01 01 01 01 01 01 01 01 01
01 01 01 01 01 01 02 3a 80 18 71 38 2d 40 58 2c
35 00 30 2c 21 00 00 1e 13 95 80 a0 70 38 20 40
30 20 35 00 0a 25 21 00 00 1e 00 00 00 fd 00 30
a5 be be 3c 01 0a 20 20 20 20 20 20 00 00 00 fc
00 44 50 0a 20 20 20 20 20 20 20 20 20 20 01 02

02 03 25 f2 43 90 01 02 00 e2 00 c0 e3 05 c0 00
23 09 7f 07 83 01 00 00 e5 0f 00 00 0c 00 e6 06
05 00 69 69 4f d9 85 80 a0 70 38 40 40 30 20 35
00 0a 25 21 00 00 1e 8a 6f 80 a0 70 38 40 40 30
20 35 00 0a 25 21 00 00 1e 0e 5c 80 a0 70 38 35
40 30 20 35 00 0a 25 21 00 00 1e 00 00 00 00 00
00 00 00 00 00 00 00 00 00 00 00 00 00 00 00 00
00 00 00 00 00 00 00 00 00 00 00 00 00 00 00 15

00 ff ff ff ff ff ff 00 5c 2d 00 25 00 00 00 00
0c 1f 01 04 b5 38 1e 78 3b ca 75 a9 54 45 98 22
1f 50 54 21 08 00 01 01 01 01 01 01 01 01 01 01
01 01 01 01 01 01 02 3a 80 18 71 38 2d 40 58 2c
35 00 30 2c 21 00 00 1e 13 95 80 a0 70 38 20 40
30 20 35 00 0a 25 21 00 00 1e 00 00 00 fd 00 30
a5 be be 3c 01 0a 20 20 20 20 20 20 00 00 00 fc
00 44 50 0a 20 20 20 20 20 20 20 20 20 20 01 02

02 03 25 f2 43 90 01 02 00 e2 00 c0 e3 05 c0 00
23 09 7f 07 83 01 00 00 e5 0f 00 00 0c 00 e6 06
05 00 69 69 4f d9 85 80 a0 70 38 40 40 30 20 35
00 0a 25 21 00 00 1e 8a 6f 80 a0 70 38 40 40 30
20 35 00 0a 25 21 00 00 1e 0e 5c 80 a0 70 38 35
40 30 20 35 00 0a 25 21 00 00 1e 00 00 00 00 00
00 00 00 00 00 00 00 00 00 00 00 00 00 00 00 00
00 00 00 00 00 00 00 00 00 00 00 00 00 00 00 15

----------------

Block 0, Base EDID:
  EDID Structure Version & Revision: 1.4
  Vendor & Product Identification:
    Manufacturer: WAM
    Model: 9472
    Made in: week 12 of 2021
  Basic Display Parameters & Features:
    Digital display
    Bits per primary color channel: 10
    DisplayPort interface
    Maximum image size: 56 cm x 30 cm
    Gamma: 2.20
    DPMS levels: Off
    Supported color formats: RGB 4:4:4, YCrCb 4:4:4, YCrCb 4:2:2
    First detailed timing includes the native pixel format and preferred refresh rate
    Display supports continuous frequencies
  Color Characteristics:
    Red  : 0.6630, 0.3281
    Green: 0.2714, 0.5957
    Blue : 0.1337, 0.1240
    White: 0.3134, 0.3291
  Established Timings I & II:
    DMT 0x04:   640x480    59.940476 Hz   4:3     31.469 kHz     25.175000 MHz
    DMT 0x09:   800x600    60.316541 Hz   4:3     37.879 kHz     40.000000 MHz
    DMT 0x10:  1024x768    60.003840 Hz   4:3     48.363 kHz     65.000000 MHz
  Standard Timings: none
  Detailed Timing Descriptors:
    DTD 1:  1920x1080   60.000000 Hz  16:9     67.500 kHz    148.500000 MHz (560 mm x 300 mm)
                 Hfront   88 Hsync  44 Hback  148 Hpol P
                 Vfront    3 Vsync   5 Vback   37 Vpol P
    DTD 2:  1920x1080  164.996368 Hz  16:9    183.476 kHz    381.630000 MHz (522 mm x 293 mm)
                 Hfront   48 Hsync  32 Hback   80 Hpol P
                 Vfront    3 Vsync   5 Vback   24 Vpol P
    Display Range Limits:
      Monitor ranges (Range Limits Only): 48-165 Hz V, 190-190 kHz H, max dotclock 600 MHz
    Display Product Name: 'DP'
  Extension blocks: 1
Checksum: 0x02

----------------

Block 1, CTA-861 Extension Block:
  Revision: 3
  Underscans IT Video Formats by default
  Basic audio support
  Supports YCbCr 4:4:4
  Supports YCbCr 4:2:2
  Native DTDs: 2
  Video Data Block:
    VIC  16:  1920x1080   60.000000 Hz  16:9     67.500 kHz    148.500000 MHz (native)
    VIC   1:   640x480    59.940476 Hz   4:3     31.469 kHz     25.175000 MHz
    VIC   2:   720x480    59.940060 Hz   4:3     31.469 kHz     27.000000 MHz
  Unknown CTA-861 Data Block (tag 0x00, length 0):
  Video Capability Data Block:
    YCbCr quantization: Selectable (via AVI YQ)
    RGB quantization: Selectable (via AVI Q)
    PT scan behavior: No Data
    IT scan behavior: IT video formats not supported
    CE scan behavior: CE video formats not supported
  Colorimetry Data Block:
    BT2020YCC
    BT2020RGB
  Audio Data Block:
    Linear PCM:
      Max channels: 2
      Supported sample rates (kHz): 192 176.4 96 88.2 48 44.1 32
      Supported sample sizes (bits): 24 20 16
  Speaker Allocation Data Block:
    FL/FR - Front Left/Right
  YCbCr 4:2:0 Capability Map Data Block:
    SVD Index 19 is out of range
    SVD Index 20 is out of range
  HDR Static Metadata Data Block:
    Electro optical transfer functions:
      Traditional gamma - SDR luminance range
      SMPTE ST2084
    Supported static metadata descriptors:
    Desired content max luminance: 105 (486.099 cd/m^2)
    Desired content max frame-average luminance: 105 (486.099 cd/m^2)
    Desired content min luminance: 79 (0.467 cd/m^2)
  Detailed Timing Descriptors:
    DTD 3:  1920x1080  143.999630 Hz  16:9    164.736 kHz    342.650000 MHz (522 mm x 293 mm)
                 Hfront   48 Hsync  32 Hback   80 Hpol P
                 Vfront    3 Vsync   5 Vback   56 Vpol P
    DTD 4:  1920x1080  119.998991 Hz  16:9    137.279 kHz    285.540000 MHz (522 mm x 293 mm)
                 Hfront   48 Hsync  32 Hback   80 Hpol P
                 Vfront    3 Vsync   5 Vback   56 Vpol P
    DTD 5:  1920x1080   99.998303 Hz  16:9    113.298 kHz    235.660000 MHz (522 mm x 293 mm)
                 Hfront   48 Hsync  32 Hback   80 Hpol P
                 Vfront    3 Vsync   5 Vback   45 Vpol P
Checksum: 0x15  Unused space in Extension Block: 36 bytes

----------------

Warnings:

Block 0, Base EDID:
  Detailed Timing Descriptor #1: DTD is similar but not identical to VIC 16.
  Detailed Timing Descriptor #1: Image size is 560x300 mm, but based on the picture AR it should be 533x300 mm.
Block 1, CTA-861 Extension Block:
  Video Data Block: VIC 16 and the first DTD are not identical. Is this intended?
  Unknown CTA-861 Data Block (tag 0x00, length 0).
  Video Capability Data Block: IT scan behavior is expected to support underscanned.
  Video Capability Data Block: 'CE video formats not supported' makes no sense.
  Colorimetry Data Block: Set the sRGB colorimetry bit to avoid interop issues.
EDID:
  Base EDID: Some timings are out of range of the Monitor Ranges:
    Horizontal Freq: 31.468 - 183.475 kHz (Monitor: 190.000 - 190.000 kHz)

Failures:

Block 1, CTA-861 Extension Block:
  YCbCr 4:2:0 Capability Map Data Block: Max index 20 > 3 (#SVDs).
EDID:
  Extension Block 2 started with EDID header, ignoring Extension Blocks >= 2.

EDID conformity: FAIL
