edid-decode (hex):

00 ff ff ff ff ff ff 00 09 e5 58 0d a2 ff 00 00
26 22 01 04 a5 22 16 78 07 3a 55 97 5d 59 94 29
1e 50 54 00 00 00 01 01 01 01 01 01 01 01 01 01
01 01 01 01 01 01 9c 3e 80 c8 70 b0 3c 40 30 20
36 00 59 d7 10 00 00 1a bd 29 80 c8 70 b0 3c 40
30 20 36 00 59 d7 10 00 00 1a 00 00 00 00 00 00
00 00 00 00 00 00 00 00 00 00 00 00 00 00 00 02
00 0d 28 ff 0a 3c c8 11 13 3c c8 00 00 00 01 49

70 20 79 02 00 25 01 09 0f 72 02 0f 72 02 28 3c
80 81 00 15 74 1a 00 00 03 01 28 3c 00 00 60 51
60 51 3c 00 00 00 00 00 00 00 00 00 00 00 00 00
00 00 00 00 00 00 00 00 00 00 00 00 00 00 00 00
00 00 00 00 00 00 00 00 00 00 00 00 00 00 00 00
00 00 00 00 00 00 00 00 00 00 00 00 00 00 00 00
00 00 00 00 00 00 00 00 00 00 00 00 00 00 00 00
00 00 00 00 00 00 00 00 00 00 00 00 00 00 22 90

00 ff ff ff ff ff ff 00 09 e5 58 0d a2 ff 00 00
26 22 01 04 a5 22 16 78 07 3a 55 97 5d 59 94 29
1e 50 54 00 00 00 01 01 01 01 01 01 01 01 01 01
01 01 01 01 01 01 9c 3e 80 c8 70 b0 3c 40 30 20
36 00 59 d7 10 00 00 1a bd 29 80 c8 70 b0 3c 40
30 20 36 00 59 d7 10 00 00 1a 00 00 00 00 00 00
00 00 00 00 00 00 00 00 00 00 00 00 00 00 00 02
00 0d 28 ff 0a 3c c8 11 13 3c c8 00 00 00 01 49

70 20 79 02 00 25 01 09 0f 72 02 0f 72 02 28 3c
80 81 00 15 74 1a 00 00 03 01 28 3c 00 00 60 51
60 51 3c 00 00 00 00 00 00 00 00 00 00 00 00 00
00 00 00 00 00 00 00 00 00 00 00 00 00 00 00 00
00 00 00 00 00 00 00 00 00 00 00 00 00 00 00 00
00 00 00 00 00 00 00 00 00 00 00 00 00 00 00 00
00 00 00 00 00 00 00 00 00 00 00 00 00 00 00 00
00 00 00 00 00 00 00 00 00 00 00 00 00 00 22 90

----------------

Block 0, Base EDID:
  EDID Structure Version & Revision: 1.4
  Vendor & Product Identification:
    Manufacturer: BOE
    Model: 3416
    Serial Number: ...
    Made in: week 38 of 2024
  Basic Display Parameters & Features:
    Digital display
    Bits per primary color channel: 8
    DisplayPort interface
    Maximum image size: 34 cm x 22 cm
    Gamma: 2.20
    Supported color formats: RGB 4:4:4
    Default (sRGB) color space is primary color space
    First detailed timing includes the native pixel format and preferred refresh rate
    Display supports continuous frequencies
  Color Characteristics:
    Red  : 0.5898, 0.3662
    Green: 0.3496, 0.5800
    Blue : 0.1611, 0.1181
    White: 0.3134, 0.3291
  Established Timings I & II: none
  Standard Timings: none
  Detailed Timing Descriptors:
    DTD 1:  1920x1200   60.002995 Hz  16:10    75.604 kHz    160.280000 MHz (345 mm x 215 mm)
                 Hfront   48 Hsync  32 Hback  120 Hpol P
                 Vfront    3 Vsync   6 Vback   51 Vpol N
    DTD 2:  1920x1200   40.000749 Hz  16:10    50.401 kHz    106.850000 MHz (345 mm x 215 mm)
                 Hfront   48 Hsync  32 Hback  120 Hpol P
                 Vfront    3 Vsync   6 Vback   51 Vpol N
    Empty Descriptor
    Manufacturer-Specified Display Descriptor (0x02): 00 02 00 0d 28 ff 0a 3c c8 11 13 3c c8 00 00 00 '....(..<...<....'
  Extension blocks: 1
Checksum: 0x49

----------------

Block 1, DisplayID Extension Block:
  Version: 2.0
  Extension Count: 0
  Display Product Primary Use Case: None of the listed primary use cases; generic display
  Dynamic Video Timing Range Limits Data Block:
    Minimum Pixel Clock: 160272 kHz
    Maximum Pixel Clock: 160272 kHz
    Minimum Vertical Refresh Rate: 40 Hz
    Maximum Vertical Refresh Rate: 60 Hz
    Seamless Dynamic Video Timing Support: Yes
  CTA-861 DisplayID Data Block:
  Vendor-Specific Data Block (AMD), OUI 00-00-1A:
    Version: 3
    Feature Caps: 0x01
    Minimum Refresh Rate: 40 Hz
    Maximum Refresh Rate: 60 Hz
    Flags 1.x: 0x00
    Flags 2.x: 0x00
  Checksum: 0x22
Checksum: 0x90

----------------

Warnings:

Block 0, Base EDID:
  Missing Display Product Name.

Failures:

Block 0, Base EDID:
  Basic Display Parameters & Features: sRGB is signaled, but the chromaticities do not match.
  Empty Descriptor: Use Dummy Descriptor instead of all zeroes.
  Missing Display Range Limits Descriptor.
EDID:
  Extension Block 2 started with EDID header, ignoring Extension Blocks >= 2.
  DisplayID: Missing DisplayID Display Parameters Data Block.
  DisplayID: Missing DisplayID Type VII Detailed Timing Data Block.
  DisplayID: DisplayID expects at least one preferred timing.

EDID conformity: FAIL
