edid-decode (hex):

00 ff ff ff ff ff ff 00 09 e5 3d 09 00 00 00 00
0e 1e 01 04 95 1a 0e 78 02 8e b5 9e 5b 57 9e 27
19 50 54 00 00 00 01 01 01 01 01 01 01 01 01 01
01 01 01 01 01 01 42 1c 56 a0 50 00 16 30 30 20
36 00 00 90 10 00 00 1a 9b 16 56 a0 50 00 16 30
30 20 36 00 00 90 10 00 00 1a 00 00 00 fe 00 4d
4d 46 30 36 80 4e 56 31 31 36 34 33 00 00 00 00
00 00 41 21 96 01 10 00 00 09 01 0a 20 20 00 da

----------------

Block 0, Base EDID:
  EDID Structure Version & Revision: 1.4
  Vendor & Product Identification:
    Manufacturer: BOE
    Model: 2365
    Made in: week 14 of 2020
  Basic Display Parameters & Features:
    Digital display
    Bits per primary color channel: 6
    DisplayPort interface
    Maximum image size: 26 cm x 14 cm
    Gamma: 2.20
    Supported color formats: RGB 4:4:4
    First detailed timing includes the native pixel format and preferred refresh rate
  Color Characteristics:
    Red  : 0.6191, 0.3554
    Green: 0.3427, 0.6191
    Blue : 0.1542, 0.1005
    White: 0.3134, 0.3291
  Established Timings I & II: none
  Standard Timings: none
  Detailed Timing Descriptors:
    DTD 1:  1366x768    60.006304 Hz 683:384   47.405 kHz     72.340000 MHz (256 mm x 144 mm)
                 Hfront   48 Hsync  32 Hback   80 Hpol P
                 Vfront    3 Vsync   6 Vback   13 Vpol N
    DTD 2:  1366x768    48.003384 Hz 683:384   37.923 kHz     57.870000 MHz (256 mm x 144 mm)
                 Hfront   48 Hsync  32 Hback   80 Hpol P
                 Vfront    3 Vsync   6 Vback   13 Vpol N
    Alphanumeric Data String: 'MMF06.NV11643'
    Manufacturer-Specified Display Descriptor (0x00): 00 00 00 00 41 21 96 01 10 00 00 09 01 0a 20 20 '....A!........  '
Checksum: 0xda

----------------

Warnings:

Block 0, Base EDID:
  Alphanumeric Data String: Non-ASCII character 0x80 at position 5, can cause problems.
  Missing Display Product Name.

EDID conformity: PASS
