edid-decode (hex):

00 ff ff ff ff ff ff 00 0d af a4 15 00 00 00 00
1b 14 01 03 90 22 13 78 0a 00 25 9e 57 52 99 29
15 50 54 00 00 00 01 01 01 01 01 01 01 01 01 01
01 01 01 01 01 01 00 1e 56 d6 50 00 2a 30 1a 38
4d 00 58 c2 10 00 00 1a 00 1e 56 d6 50 00 2a 30
1a 38 4d 00 58 c2 10 00 00 1a 00 00 00 fe 00 58
4d 35 58 47 02 4e 31 35 36 42 36 0a 00 00 00 00
00 00 00 00 00 00 00 00 00 01 01 0a 20 20 00 41

----------------

Block 0, Base EDID:
  EDID Structure Version & Revision: 1.3
  Vendor & Product Identification:
    Manufacturer: CMO
    Model: 5540
    Made in: week 27 of 2010
  Basic Display Parameters & Features:
    Digital display
    Maximum image size: 34 cm x 19 cm
    Gamma: 2.20
    RGB color display
    First detailed timing is the preferred timing
  Color Characteristics:
    Red  : 0.6171, 0.3398
    Green: 0.3203, 0.5976
    Blue : 0.1601, 0.0839
    White: 0.3134, 0.3291
  Established Timings I & II: none
  Standard Timings: none
  Detailed Timing Descriptors:
    DTD 1:  1366x768    60.009376 Hz 683:384   48.608 kHz     76.800000 MHz (344 mm x 194 mm)
                 Hfront   26 Hsync  56 Hback  132 Hpol P
                 Vfront    4 Vsync  13 Vback   25 Vpol N
    DTD 2:  1366x768    60.009376 Hz 683:384   48.608 kHz     76.800000 MHz (344 mm x 194 mm)
                 Hfront   26 Hsync  56 Hback  132 Hpol P
                 Vfront    4 Vsync  13 Vback   25 Vpol N
    Alphanumeric Data String: 'XM5XG.N156B6'
    Manufacturer-Specified Display Descriptor (0x00): 00 00 00 00 00 00 00 00 00 00 00 01 01 0a 20 20 '..............  '
Checksum: 0x41

----------------

Warnings:

Block 0, Base EDID:
  Alphanumeric Data String: Non-ASCII character 0x02 at position 5, can cause problems.

Failures:

Block 0, Base EDID:
  Basic Display Parameters & Features: Digital Video Interface Standard set to reserved value 0x10.
  Missing Display Product Name.
  Missing Display Range Limits Descriptor.

EDID conformity: FAIL
