edid-decode (hex):

00 ff ff ff ff ff ff 00 1e 6d f0 59 04 27 00 00
02 19 01 03 80 50 22 78 ea 0a 95 a8 54 4c 9e 26
0f 50 54 a5 4b 80 71 4f 81 80 81 c0 a9 c0 b3 00
d1 c0 01 01 01 01 46 45 00 50 a0 38 28 40 14 28
3a 00 1e 4e 31 00 00 18 00 00 00 fd 00 38 4b 1e
5a 18 00 0a 20 20 20 20 20 20 00 00 00 fc 00 4c
47 20 55 4c 54 52 41 57 49 44 45 0a 00 00 00 ff
00 0a 20 20 20 20 20 20 20 20 20 20 20 20 00 00

00 ff ff ff ff ff ff 00 1e 6d f0 59 04 27 00 00
02 19 01 03 80 50 22 78 ea 0a 95 a8 54 4c 9e 26
0f 50 54 a5 4b 80 71 4f 81 80 81 c0 a9 c0 b3 00
d1 c0 01 01 01 01 46 45 00 50 a0 38 28 40 14 28
3a 00 1e 4e 31 00 00 18 00 00 00 fd 00 38 4b 1e
5a 18 00 0a 20 20 20 20 20 20 00 00 00 fc 00 4c
47 20 55 4c 54 52 41 57 49 44 45 0a 00 00 00 ff
00 0a 20 20 20 20 20 20 20 20 20 20 20 20 00 00

----------------

Block 0, Base EDID:
  EDID Structure Version & Revision: 1.3
  Vendor & Product Identification:
    Manufacturer: GSM
    Model: 23024
    Serial Number: ...
    Made in: week 2 of 2015
  Basic Display Parameters & Features:
    Digital display
    Maximum image size: 80 cm x 34 cm
    Gamma: 2.20
    DPMS levels: Standby Suspend Off
    RGB color display
    First detailed timing is the preferred timing
  Color Characteristics:
    Red  : 0.6562, 0.3281
    Green: 0.2988, 0.6191
    Blue : 0.1503, 0.0595
    White: 0.3134, 0.3291
  Established Timings I & II:
    IBM     :   720x400    70.081663 Hz   9:5     31.467 kHz     28.320000 MHz
    DMT 0x04:   640x480    59.940476 Hz   4:3     31.469 kHz     25.175000 MHz
    DMT 0x06:   640x480    75.000000 Hz   4:3     37.500 kHz     31.500000 MHz
    DMT 0x09:   800x600    60.316541 Hz   4:3     37.879 kHz     40.000000 MHz
    DMT 0x0b:   800x600    75.000000 Hz   4:3     46.875 kHz     49.500000 MHz
    DMT 0x10:  1024x768    60.003840 Hz   4:3     48.363 kHz     65.000000 MHz
    DMT 0x12:  1024x768    75.028582 Hz   4:3     60.023 kHz     78.750000 MHz
    DMT 0x24:  1280x1024   75.024675 Hz   5:4     79.976 kHz    135.000000 MHz
    Apple   :  1152x870    75.061550 Hz 192:145   68.681 kHz    100.000000 MHz
  Standard Timings:
    DMT 0x15:  1152x864    75.000000 Hz   4:3     67.500 kHz    108.000000 MHz
    DMT 0x23:  1280x1024   60.019740 Hz   5:4     63.981 kHz    108.000000 MHz
    DMT 0x55:  1280x720    60.000000 Hz  16:9     45.000 kHz     74.250000 MHz
    DMT 0x53:  1600x900    60.000000 Hz  16:9     60.000 kHz    108.000000 MHz (RB)
    DMT 0x3a:  1680x1050   59.954250 Hz  16:10    65.290 kHz    146.250000 MHz
    DMT 0x52:  1920x1080   60.000000 Hz  16:9     67.500 kHz    148.500000 MHz
  Detailed Timing Descriptors:
    DTD 1:  2560x1080   59.977002 Hz  64:27    67.174 kHz    177.340000 MHz (798 mm x 334 mm)
                 Hfront   20 Hsync  40 Hback   20 Hpol N
                 Vfront    3 Vsync  10 Vback   27 Vpol N
    Display Range Limits:
      Monitor ranges (GTF): 56-75 Hz V, 30-90 kHz H, max dotclock 240 MHz
    Display Product Name: 'LG ULTRAWIDE'
    Display Product Serial Number: ...
Checksum: 0x00

----------------

Failures:

Block 0, Base EDID:
  Display Product Serial Number: ...
EDID:
  Extension Block 1 started with EDID header, ignoring Extension Blocks >= 1.

EDID conformity: FAIL
