edid-decode (hex):

00 ff ff ff ff ff ff 00 22 0e 15 39 00 00 00 00
20 21 01 04 a5 3c 22 78 3a d7 35 ab 53 4f 9e 25
0f 50 54 a5 4b 00 d1 c0 a9 c0 81 c0 d1 00 b3 00
95 00 a9 40 81 80 56 5e 00 a0 a0 a0 29 50 30 20
35 00 54 50 21 00 00 1a 00 00 00 fd 00 32 4b 1e
78 1f 01 0a 20 20 20 20 20 20 00 00 00 fc 00 48
50 20 45 32 37 75 20 47 35 0a 20 20 00 00 00 ff
00 43 4e 34 33 33 32 31 35 42 5a 0a 20 20 01 bf

02 03 11 b1 49 10 1f 04 13 12 11 03 02 01 e2 00
ea d9 76 00 a0 a0 a0 34 50 30 20 36 00 54 50 21
00 00 1a 39 4e 00 a0 a0 a0 22 50 30 20 35 00 54
50 21 00 00 1a 28 3c 80 a0 70 b0 23 40 30 20 36
00 54 50 21 00 00 1a 2a 44 80 a0 70 38 27 40 30
20 35 00 54 50 21 00 00 1a 02 3a 80 18 71 38 2d
40 58 2c 45 00 54 50 21 00 00 1a 00 00 00 00 00
00 00 00 00 00 00 00 00 00 00 00 00 00 00 00 61

00 ff ff ff ff ff ff 00 22 0e 15 39 00 00 00 00
20 21 01 04 a5 3c 22 78 3a d7 35 ab 53 4f 9e 25
0f 50 54 a5 4b 00 d1 c0 a9 c0 81 c0 d1 00 b3 00
95 00 a9 40 81 80 56 5e 00 a0 a0 a0 29 50 30 20
35 00 54 50 21 00 00 1a 00 00 00 fd 00 32 4b 1e
78 1f 01 0a 20 20 20 20 20 20 00 00 00 fc 00 48
50 20 45 32 37 75 20 47 35 0a 20 20 00 00 00 ff
00 43 4e 34 33 33 32 31 35 42 5a 0a 20 20 01 bf

02 03 11 b1 49 10 1f 04 13 12 11 03 02 01 e2 00
ea d9 76 00 a0 a0 a0 34 50 30 20 36 00 54 50 21
00 00 1a 39 4e 00 a0 a0 a0 22 50 30 20 35 00 54
50 21 00 00 1a 28 3c 80 a0 70 b0 23 40 30 20 36
00 54 50 21 00 00 1a 2a 44 80 a0 70 38 27 40 30
20 35 00 54 50 21 00 00 1a 02 3a 80 18 71 38 2d
40 58 2c 45 00 54 50 21 00 00 1a 00 00 00 00 00
00 00 00 00 00 00 00 00 00 00 00 00 00 00 00 61

----------------

Block 0, Base EDID:
  EDID Structure Version & Revision: 1.4
  Vendor & Product Identification:
    Manufacturer: HPN
    Model: 14613
    Made in: week 32 of 2023
  Basic Display Parameters & Features:
    Digital display
    Bits per primary color channel: 8
    DisplayPort interface
    Maximum image size: 60 cm x 34 cm
    Gamma: 2.20
    DPMS levels: Off
    Supported color formats: RGB 4:4:4, YCrCb 4:4:4, YCrCb 4:2:2
    First detailed timing includes the native pixel format and preferred refresh rate
  Color Characteristics:
    Red  : 0.6708, 0.3251
    Green: 0.3095, 0.6201
    Blue : 0.1445, 0.0615
    White: 0.3134, 0.3291
  Established Timings I & II:
    IBM     :   720x400    70.081663 Hz   9:5     31.467 kHz     28.320000 MHz
    DMT 0x04:   640x480    59.940476 Hz   4:3     31.469 kHz     25.175000 MHz
    DMT 0x06:   640x480    75.000000 Hz   4:3     37.500 kHz     31.500000 MHz
    DMT 0x09:   800x600    60.316541 Hz   4:3     37.879 kHz     40.000000 MHz
    DMT 0x0b:   800x600    75.000000 Hz   4:3     46.875 kHz     49.500000 MHz
    DMT 0x10:  1024x768    60.003840 Hz   4:3     48.363 kHz     65.000000 MHz
    DMT 0x12:  1024x768    75.028582 Hz   4:3     60.023 kHz     78.750000 MHz
    DMT 0x24:  1280x1024   75.024675 Hz   5:4     79.976 kHz    135.000000 MHz
  Standard Timings:
    DMT 0x52:  1920x1080   60.000000 Hz  16:9     67.500 kHz    148.500000 MHz
    DMT 0x53:  1600x900    60.000000 Hz  16:9     60.000 kHz    108.000000 MHz (RB)
    DMT 0x55:  1280x720    60.000000 Hz  16:9     45.000 kHz     74.250000 MHz
    DMT 0x45:  1920x1200   59.884600 Hz  16:10    74.556 kHz    193.250000 MHz
    DMT 0x3a:  1680x1050   59.954250 Hz  16:10    65.290 kHz    146.250000 MHz
    DMT 0x2f:  1440x900    59.887445 Hz  16:10    55.935 kHz    106.500000 MHz
    DMT 0x33:  1600x1200   60.000000 Hz   4:3     75.000 kHz    162.000000 MHz
    DMT 0x23:  1280x1024   60.019740 Hz   5:4     63.981 kHz    108.000000 MHz
  Detailed Timing Descriptors:
    DTD 1:  2560x1440   59.950550 Hz  16:9     88.787 kHz    241.500000 MHz (596 mm x 336 mm)
                 Hfront   48 Hsync  32 Hback   80 Hpol P
                 Vfront    3 Vsync   5 Vback   33 Vpol N
    Display Range Limits:
      Monitor ranges (Range Limits Only): 50-75 Hz V, 30-120 kHz H, max dotclock 310 MHz
    Display Product Name: 'HP E27u G5'
    Display Product Serial Number: ...
  Extension blocks: 1
Checksum: 0xbf

----------------

Block 1, CTA-861 Extension Block:
  Revision: 3
  Underscans IT Video Formats by default
  Supports YCbCr 4:4:4
  Supports YCbCr 4:2:2
  Native DTDs: 1
  Video Data Block:
    VIC  16:  1920x1080   60.000000 Hz  16:9     67.500 kHz    148.500000 MHz
    VIC  31:  1920x1080   50.000000 Hz  16:9     56.250 kHz    148.500000 MHz
    VIC   4:  1280x720    60.000000 Hz  16:9     45.000 kHz     74.250000 MHz
    VIC  19:  1280x720    50.000000 Hz  16:9     37.500 kHz     74.250000 MHz
    VIC  18:   720x576    50.000000 Hz  16:9     31.250 kHz     27.000000 MHz
    VIC  17:   720x576    50.000000 Hz   4:3     31.250 kHz     27.000000 MHz
    VIC   3:   720x480    59.940060 Hz  16:9     31.469 kHz     27.000000 MHz
    VIC   2:   720x480    59.940060 Hz   4:3     31.469 kHz     27.000000 MHz
    VIC   1:   640x480    59.940476 Hz   4:3     31.469 kHz     25.175000 MHz
  Video Capability Data Block:
    YCbCr quantization: Selectable (via AVI YQ)
    RGB quantization: Selectable (via AVI Q)
    PT scan behavior: Always Underscanned
    IT scan behavior: Always Underscanned
    CE scan behavior: Always Underscanned
  Detailed Timing Descriptors:
    DTD 2:  2560x1440   74.970923 Hz  16:9    111.857 kHz    304.250000 MHz (596 mm x 336 mm)
                 Hfront   48 Hsync  32 Hback   80 Hpol P
                 Vfront    3 Vsync   6 Vback   43 Vpol N
    DTD 3:  2560x1440   49.946624 Hz  16:9     73.621 kHz    200.250000 MHz (596 mm x 336 mm)
                 Hfront   48 Hsync  32 Hback   80 Hpol P
                 Vfront    3 Vsync   5 Vback   26 Vpol N
    DTD 4:  1920x1200   59.950171 Hz  16:10    74.038 kHz    154.000000 MHz (596 mm x 336 mm)
                 Hfront   48 Hsync  32 Hback   80 Hpol P
                 Vfront    3 Vsync   6 Vback   26 Vpol N
    DTD 5:  1920x1080   74.972503 Hz  16:9     83.894 kHz    174.500000 MHz (596 mm x 336 mm)
                 Hfront   48 Hsync  32 Hback   80 Hpol P
                 Vfront    3 Vsync   5 Vback   31 Vpol N
    DTD 6:  1920x1080   60.000000 Hz  16:9     67.500 kHz    148.500000 MHz (596 mm x 336 mm)
                 Hfront   88 Hsync  44 Hback  148 Hpol P
                 Vfront    4 Vsync   5 Vback   36 Vpol N
Checksum: 0x61  Unused space in Extension Block: 20 bytes

----------------

Warnings:

Block 1, CTA-861 Extension Block:
  Video Data Block: VIC 16 and the first DTD are not identical. Is this intended?
  Video Capability Data Block: S_PT is equal to S_IT and S_CE, so should be set to 0 instead.
  Detailed Timing Descriptor #4: Image size is 596x336 mm, but based on the picture AR it should be 537x336 mm.
  Detailed Timing Descriptor #6: DTD is similar but not identical to VIC 16.
  Add a Colorimetry Data Block with the sRGB colorimetry bit set to avoid interop issues.

Failures:

EDID:
  Extension Block 2 started with EDID header, ignoring Extension Blocks >= 2.

EDID conformity: FAIL
