edid-decode (hex):

00 ff ff ff ff ff ff 00 1e 6d 83 9e a8 32 03 00
0c 21 01 03 80 69 3b 78 ea c1 f3 ad 52 45 af 25
0c 48 49 21 09 00 d1 c0 61 40 01 01 01 01 01 01
01 01 01 01 01 01 08 e8 00 30 f2 70 5a 80 b0 58
8a 00 1a 4e 42 00 00 1e 00 00 00 fd 08 28 8a 1e
41 80 00 0a 20 20 20 20 20 20 00 00 00 fc 00 4c
47 20 55 4c 54 52 41 47 45 41 52 2b 00 00 00 ff
00 33 31 32 4e 54 41 42 36 35 35 37 36 0a 03 8a

f0 02 70 00 00 00 00 00 00 00 00 00 00 00 00 00
00 00 00 00 00 00 00 00 00 00 00 00 00 00 00 00
00 00 00 00 00 00 00 00 00 00 00 00 00 00 00 00
00 00 00 00 00 00 00 00 00 00 00 00 00 00 00 00
00 00 00 00 00 00 00 00 00 00 00 00 00 00 00 00
00 00 00 00 00 00 00 00 00 00 00 00 00 00 00 00
00 00 00 00 00 00 00 00 00 00 00 00 00 00 00 00
00 00 00 00 00 00 00 00 00 00 00 00 00 00 00 9e

02 03 56 71 23 0f 57 07 83 01 00 00 50 61 60 5f
5e 5d 22 20 1f 12 10 04 03 01 13 3f 76 6d 03 0c
00 10 00 b8 3c 20 00 60 01 02 03 6a d8 5d c4 01
78 80 63 00 28 8a e3 0f 03 80 e2 00 6a e3 05 c0
00 e6 06 05 01 73 2e 12 6d 1a 00 00 02 01 28 8a
00 04 73 14 2e 29 04 74 00 30 f2 70 5a 80 b0 58
8a 00 1a 4e 42 00 00 1e 6f c2 00 a0 a0 a0 55 50
30 20 35 00 1a 4e 42 00 00 1a 00 00 00 00 00 c2

70 12 79 03 00 01 00 0c 70 17 48 0d 00 0f 70 08
90 78 4e bb 0f 00 0a 74 21 0e 0e 07 01 22 00 00
00 03 01 3c 5c f1 01 84 ff 0e 9f 00 2f 80 1f 00
6f 08 92 00 02 00 04 00 6e a3 01 04 ff 0e 9f 00
2f 80 1f 00 6f 08 4c 00 02 00 04 00 85 6f 00 04
7f 07 9f 00 2f 80 1f 00 37 04 3f 00 02 00 04 00
00 00 00 00 00 00 00 00 00 00 00 00 00 00 00 00
00 00 00 00 00 00 00 00 00 00 00 00 00 00 9e 90

00 ff ff ff ff ff ff 00 1e 6d 83 9e a8 32 03 00
0c 21 01 03 80 69 3b 78 ea c1 f3 ad 52 45 af 25
0c 48 49 21 09 00 d1 c0 61 40 01 01 01 01 01 01
01 01 01 01 01 01 08 e8 00 30 f2 70 5a 80 b0 58
8a 00 1a 4e 42 00 00 1e 00 00 00 fd 08 28 8a 1e
41 80 00 0a 20 20 20 20 20 20 00 00 00 fc 00 4c
47 20 55 4c 54 52 41 47 45 41 52 2b 00 00 00 ff
00 33 31 32 4e 54 41 42 36 35 35 37 36 0a 03 8a

f0 02 70 00 00 00 00 00 00 00 00 00 00 00 00 00
00 00 00 00 00 00 00 00 00 00 00 00 00 00 00 00
00 00 00 00 00 00 00 00 00 00 00 00 00 00 00 00
00 00 00 00 00 00 00 00 00 00 00 00 00 00 00 00
00 00 00 00 00 00 00 00 00 00 00 00 00 00 00 00
00 00 00 00 00 00 00 00 00 00 00 00 00 00 00 00
00 00 00 00 00 00 00 00 00 00 00 00 00 00 00 00
00 00 00 00 00 00 00 00 00 00 00 00 00 00 00 9e

02 03 56 71 23 0f 57 07 83 01 00 00 50 61 60 5f
5e 5d 22 20 1f 12 10 04 03 01 13 3f 76 6d 03 0c
00 10 00 b8 3c 20 00 60 01 02 03 6a d8 5d c4 01
78 80 63 00 28 8a e3 0f 03 80 e2 00 6a e3 05 c0
00 e6 06 05 01 73 2e 12 6d 1a 00 00 02 01 28 8a
00 04 73 14 2e 29 04 74 00 30 f2 70 5a 80 b0 58
8a 00 1a 4e 42 00 00 1e 6f c2 00 a0 a0 a0 55 50
30 20 35 00 1a 4e 42 00 00 1a 00 00 00 00 00 c2

70 12 79 03 00 01 00 0c 70 17 48 0d 00 0f 70 08
90 78 4e bb 0f 00 0a 74 21 0e 0e 07 01 22 00 00
00 03 01 3c 5c f1 01 84 ff 0e 9f 00 2f 80 1f 00
6f 08 92 00 02 00 04 00 6e a3 01 04 ff 0e 9f 00
2f 80 1f 00 6f 08 4c 00 02 00 04 00 85 6f 00 04
7f 07 9f 00 2f 80 1f 00 37 04 3f 00 02 00 04 00
00 00 00 00 00 00 00 00 00 00 00 00 00 00 00 00
00 00 00 00 00 00 00 00 00 00 00 00 00 00 9e 90

----------------

Block 0, Base EDID:
  EDID Structure Version & Revision: 1.3
  Vendor & Product Identification:
    Manufacturer: GSM
    Model: 40579
    Serial Number: ...
    Made in: week 12 of 2023
  Basic Display Parameters & Features:
    Digital display
    Maximum image size: 105 cm x 59 cm
    Gamma: 2.20
    DPMS levels: Standby Suspend Off
    RGB color display
    First detailed timing is the preferred timing
  Color Characteristics:
    Red  : 0.6787, 0.3203
    Green: 0.2695, 0.6845
    Blue : 0.1474, 0.0498
    White: 0.2812, 0.2880
  Established Timings I & II:
    DMT 0x04:   640x480    59.940476 Hz   4:3     31.469 kHz     25.175000 MHz
    DMT 0x09:   800x600    60.316541 Hz   4:3     37.879 kHz     40.000000 MHz
    DMT 0x10:  1024x768    60.003840 Hz   4:3     48.363 kHz     65.000000 MHz
    DMT 0x24:  1280x1024   75.024675 Hz   5:4     79.976 kHz    135.000000 MHz
  Standard Timings:
    DMT 0x52:  1920x1080   60.000000 Hz  16:9     67.500 kHz    148.500000 MHz
    DMT 0x10:  1024x768    60.003840 Hz   4:3     48.363 kHz     65.000000 MHz
  Detailed Timing Descriptors:
    DTD 1:  3840x2160   60.000000 Hz  16:9    135.000 kHz    594.000000 MHz (1050 mm x 590 mm)
                 Hfront  176 Hsync  88 Hback  296 Hpol P
                 Vfront    8 Vsync  10 Vback   72 Vpol P
    Display Range Limits:
      Monitor ranges (GTF): 40-138 Hz V, 30-65 kHz H, max dotclock 1280 MHz
    Display Product Name: 'LG ULTRAGEAR+'
    Display Product Serial Number: ...
  Extension blocks: 3
Checksum: 0x8a

----------------

Block 1, Block Map Extension Block:
  Block   2: CTA-861 Extension Block
  Block   3: DisplayID Extension Block
Checksum: 0x9e

----------------

Block 2, CTA-861 Extension Block:
  Revision: 3
  Basic audio support
  Supports YCbCr 4:4:4
  Supports YCbCr 4:2:2
  Native DTDs: 1
  Audio Data Block:
    Linear PCM:
      Max channels: 8
      Supported sample rates (kHz): 192 96 48 44.1 32
      Supported sample sizes (bits): 24 20 16
  Speaker Allocation Data Block:
    FL/FR - Front Left/Right
  Video Data Block:
    VIC  97:  3840x2160   60.000000 Hz  16:9    135.000 kHz    594.000000 MHz
    VIC  96:  3840x2160   50.000000 Hz  16:9    112.500 kHz    594.000000 MHz
    VIC  95:  3840x2160   30.000000 Hz  16:9     67.500 kHz    297.000000 MHz
    VIC  94:  3840x2160   25.000000 Hz  16:9     56.250 kHz    297.000000 MHz
    VIC  93:  3840x2160   24.000000 Hz  16:9     54.000 kHz    297.000000 MHz
    VIC  34:  1920x1080   30.000000 Hz  16:9     33.750 kHz     74.250000 MHz
    VIC  32:  1920x1080   24.000000 Hz  16:9     27.000 kHz     74.250000 MHz
    VIC  31:  1920x1080   50.000000 Hz  16:9     56.250 kHz    148.500000 MHz
    VIC  18:   720x576    50.000000 Hz  16:9     31.250 kHz     27.000000 MHz
    VIC  16:  1920x1080   60.000000 Hz  16:9     67.500 kHz    148.500000 MHz
    VIC   4:  1280x720    60.000000 Hz  16:9     45.000 kHz     74.250000 MHz
    VIC   3:   720x480    59.940060 Hz  16:9     31.469 kHz     27.000000 MHz
    VIC   1:   640x480    59.940476 Hz   4:3     31.469 kHz     25.175000 MHz
    VIC  19:  1280x720    50.000000 Hz  16:9     37.500 kHz     74.250000 MHz
    VIC  63:  1920x1080  120.000000 Hz  16:9    135.000 kHz    297.000000 MHz
    VIC 118:  3840x2160  120.000000 Hz  16:9    270.000 kHz   1188.000000 MHz
  Vendor-Specific Data Block (HDMI), OUI 00-0C-03:
    Source physical address: 1.0.0.0
    Supports_AI
    DC_36bit
    DC_30bit
    DC_Y444
    Maximum TMDS clock: 300 MHz
    Extended HDMI video details:
      HDMI VICs:
        HDMI VIC 1:  3840x2160   30.000000 Hz  16:9     67.500 kHz    297.000000 MHz
        HDMI VIC 2:  3840x2160   25.000000 Hz  16:9     56.250 kHz    297.000000 MHz
        HDMI VIC 3:  3840x2160   24.000000 Hz  16:9     54.000 kHz    297.000000 MHz
  Vendor-Specific Data Block (HDMI Forum), OUI C4-5D-D8:
    Version: 1
    Maximum TMDS Character Rate: 600 MHz
    SCDC Present
    Max Fixed Rate Link: 3 and 6 Gbps per lane on 3 lanes, 6, 8, 10 and 12 Gbps on 4 lanes
    Supports 12-bits/component Deep Color 4:2:0 Pixel Encoding
    Supports 10-bits/component Deep Color 4:2:0 Pixel Encoding
    VRRmin: 40 Hz
    VRRmax: 138 Hz
  YCbCr 4:2:0 Capability Map Data Block:
    VIC  97:  3840x2160   60.000000 Hz  16:9    135.000 kHz    594.000000 MHz
    VIC  96:  3840x2160   50.000000 Hz  16:9    112.500 kHz    594.000000 MHz
    VIC 118:  3840x2160  120.000000 Hz  16:9    270.000 kHz   1188.000000 MHz
  Video Capability Data Block:
    YCbCr quantization: No Data
    RGB quantization: Selectable (via AVI Q)
    PT scan behavior: Always Underscanned
    IT scan behavior: Always Underscanned
    CE scan behavior: Always Underscanned
  Colorimetry Data Block:
    BT2020YCC
    BT2020RGB
  HDR Static Metadata Data Block:
    Electro optical transfer functions:
      Traditional gamma - SDR luminance range
      SMPTE ST2084
    Supported static metadata descriptors:
      Static metadata type 1
    Desired content max luminance: 115 (603.666 cd/m^2)
    Desired content max frame-average luminance: 46 (135.426 cd/m^2)
    Desired content min luminance: 18 (0.030 cd/m^2)
  Vendor-Specific Data Block (AMD), OUI 00-00-1A:
    Version: 2
    Feature Caps: 0x01
    Minimum Refresh Rate: 40 Hz
    Maximum Refresh Rate: 138 Hz
    Flags 1.x: 0x00
    Flags 2.x: 0x04
  Detailed Timing Descriptors:
    DTD 2:  3840x2160   30.000000 Hz  16:9     67.500 kHz    297.000000 MHz (1050 mm x 590 mm)
                 Hfront  176 Hsync  88 Hback  296 Hpol P
                 Vfront    8 Vsync  10 Vback   72 Vpol P
    DTD 3:  2560x1440  119.997589 Hz  16:9    182.996 kHz    497.750000 MHz (1050 mm x 590 mm)
                 Hfront   48 Hsync  32 Hback   80 Hpol P
                 Vfront    3 Vsync   5 Vback   77 Vpol N
Checksum: 0xc2  Unused space in Extension Block: 5 bytes

----------------

Block 3, DisplayID Extension Block:
  Version: 1.2
  Extension Count: 0
  Display Product Type: Standalone display device
  Display Parameters Data Block (0x01):
    Image size: 600.0 mm x 340.0 mm
    Display native pixel format: 3840x2160
    Feature support flags:
      Power management (DPM)
      Audio support on video interface
    Gamma: 2.20
    Aspect ratio: 1.78
    Dynamic bpc native: 12
    Dynamic bpc overall: 12
  Display Interface Data Block:
    Interface Type: HDMI-A
    Number of Links: 4
    Interface Standard Version: 2.1
    Supported bpc for RGB encoding: 8, 10, 12
    Supported bpc for YCbCr 4:4:4 encoding: 8, 10, 12
    Supported bpc for YCbCr 4:2:2 encoding: 8, 10, 12
    Supported Content Protection: HDCP 2.2
    Spread Spectrum: None
  Video Timing Modes Type 1 - Detailed Timings Data Block:
    DTD:  3840x2160  137.976810 Hz  16:9    318.312 kHz   1273.250000 MHz (aspect 16:9, no 3D stereo, preferred)
               Hfront   48 Hsync  32 Hback   80 Hpol P
               Vfront    3 Vsync   5 Vback  139 Vpol N
    DTD:  3840x2160  119.998882 Hz  16:9    268.438 kHz   1073.750000 MHz (aspect 16:9, no 3D stereo)
               Hfront   48 Hsync  32 Hback   80 Hpol P
               Vfront    3 Vsync   5 Vback   69 Vpol N
    DTD:  1920x1080  119.982181 Hz  16:9    137.260 kHz    285.500000 MHz (aspect 16:9, no 3D stereo)
               Hfront   48 Hsync  32 Hback   80 Hpol P
               Vfront    3 Vsync   5 Vback   56 Vpol N
  Checksum: 0x9e
Checksum: 0x90

----------------

Warnings:

Block 2, CTA-861 Extension Block:
  IT Video Formats are overscanned by default, but normally this should be underscanned.
  Video Capability Data Block: Set Selectable YCbCr Quantization to avoid interop issues.
  Video Capability Data Block: S_PT is equal to S_IT and S_CE, so should be set to 0 instead.
  Colorimetry Data Block: Set the sRGB colorimetry bit to avoid interop issues.
  Display Product Serial Number is set, so the Serial Number in the Base EDID should be 0.
EDID:
  Base EDID: Some timings are out of range of the Monitor Ranges:
    Vertical Freq: 24.000 - 137.977 Hz (Monitor: 40.000 - 138.000 Hz)
    Horizontal Freq: 27.000 - 318.312 kHz (Monitor: 30.000 - 65.000 kHz)

Failures:

Block 0, Base EDID:
  Display Descriptor #2: Monitor descriptor block has byte 4 nonzero (0x08).
Block 2, CTA-861 Extension Block:
  Vendor-Specific Data Block (HDMI Forum), OUI C4-5D-D8: HDMI VIC and related CTA VIC codes are present, but the UHD VIC bit is 0.
  Video Capability Data Block: IT video formats are always underscanned, but bit 7 of Byte 3 of the CTA-861 Extension header is set to overscanned.
EDID:
  Extension Block 4 started with EDID header, ignoring Extension Blocks >= 4.
  DisplayID: Image size mismatch: DisplayID: 600.0x340.0mm Base EDID: 1050.0x590.0mm.

EDID conformity: FAIL
