edid-decode (hex):

00 ff ff ff ff ff ff 00 12 e5 85 01 00 00 00 00
17 16 01 04 a5 29 17 78 e6 5a d5 a7 56 4b 9b 24
13 50 54 bf cf 00 61 40 61 4f 81 c0 81 00 45 40
45 4f 01 01 01 01 00 1e 56 ea 50 00 20 30 28 46
55 00 9a e6 10 00 00 1a 66 21 50 b0 51 00 1b 30
40 70 36 00 9a e6 10 00 00 1e 00 00 00 fd 00 38
4b 1e 3c 08 00 0a 20 20 20 20 20 20 00 00 00 fc
00 31 38 2e 35 20 6d 6f 6e 69 74 6f 72 0a 00 a1

00 ff ff ff ff ff ff 00 12 e5 85 01 00 00 00 00
17 16 01 04 a5 29 17 78 e6 5a d5 a7 56 4b 9b 24
13 50 54 bf cf 00 61 40 61 4f 81 c0 81 00 45 40
45 4f 01 01 01 01 00 1e 56 ea 50 00 20 30 28 46
55 00 9a e6 10 00 00 1a 66 21 50 b0 51 00 1b 30
40 70 36 00 9a e6 10 00 00 1e 00 00 00 fd 00 38
4b 1e 3c 08 00 0a 20 20 20 20 20 20 00 00 00 fc
00 31 38 2e 35 20 6d 6f 6e 69 74 6f 72 0a 00 a1

----------------

Block 0, Base EDID:
  EDID Structure Version & Revision: 1.4
  Vendor & Product Identification:
    Manufacturer: DWE
    Model: 389
    Made in: week 23 of 2012
  Basic Display Parameters & Features:
    Digital display
    Bits per primary color channel: 8
    DisplayPort interface
    Maximum image size: 41 cm x 23 cm
    Gamma: 2.20
    DPMS levels: Standby Suspend Off
    Supported color formats: RGB 4:4:4
    Default (sRGB) color space is primary color space
    First detailed timing includes the native pixel format and preferred refresh rate
  Color Characteristics:
    Red  : 0.6533, 0.3369
    Green: 0.2949, 0.6074
    Blue : 0.1435, 0.0751
    White: 0.3134, 0.3291
  Established Timings I & II:
    IBM     :   720x400    70.081663 Hz   9:5     31.467 kHz     28.320000 MHz
    DMT 0x04:   640x480    59.940476 Hz   4:3     31.469 kHz     25.175000 MHz
    Apple   :   640x480    66.666667 Hz   4:3     35.000 kHz     30.240000 MHz
    DMT 0x05:   640x480    72.808802 Hz   4:3     37.861 kHz     31.500000 MHz
    DMT 0x06:   640x480    75.000000 Hz   4:3     37.500 kHz     31.500000 MHz
    DMT 0x08:   800x600    56.250000 Hz   4:3     35.156 kHz     36.000000 MHz
    DMT 0x09:   800x600    60.316541 Hz   4:3     37.879 kHz     40.000000 MHz
    DMT 0x0a:   800x600    72.187572 Hz   4:3     48.077 kHz     50.000000 MHz
    DMT 0x0b:   800x600    75.000000 Hz   4:3     46.875 kHz     49.500000 MHz
    DMT 0x10:  1024x768    60.003840 Hz   4:3     48.363 kHz     65.000000 MHz
    DMT 0x11:  1024x768    70.069359 Hz   4:3     56.476 kHz     75.000000 MHz
    DMT 0x12:  1024x768    75.028582 Hz   4:3     60.023 kHz     78.750000 MHz
    DMT 0x24:  1280x1024   75.024675 Hz   5:4     79.976 kHz    135.000000 MHz
  Standard Timings:
    DMT 0x10:  1024x768    60.003840 Hz   4:3     48.363 kHz     65.000000 MHz
    DMT 0x12:  1024x768    75.028582 Hz   4:3     60.023 kHz     78.750000 MHz
    DMT 0x55:  1280x720    60.000000 Hz  16:9     45.000 kHz     74.250000 MHz
    DMT 0x1c:  1280x800    59.810326 Hz  16:10    49.702 kHz     83.500000 MHz
    DMT 0x09:   800x600    60.316541 Hz   4:3     37.879 kHz     40.000000 MHz
    DMT 0x0b:   800x600    75.000000 Hz   4:3     46.875 kHz     49.500000 MHz
  Detailed Timing Descriptors:
    DTD 1:  1366x768    60.000000 Hz 683:384   48.000 kHz     76.800000 MHz (410 mm x 230 mm)
                 Hfront   40 Hsync  70 Hback  124 Hpol P
                 Vfront    5 Vsync   5 Vback   22 Vpol N
    DTD 2:  1360x768    60.015162 Hz  85:48    47.712 kHz     85.500000 MHz (410 mm x 230 mm)
                 Hfront   64 Hsync 112 Hback  256 Hpol P
                 Vfront    3 Vsync   6 Vback   18 Vpol P
    Display Range Limits:
      Monitor ranges (GTF): 56-75 Hz V, 30-60 kHz H, max dotclock 80 MHz
    Display Product Name: '18.5 monitor'
Checksum: 0xa1

----------------

Warnings:

Block 0, Base EDID:
  Display Range Limits: GTF support is deprecated in EDID 1.4.
EDID:
  Base EDID: Some timings are out of range of the Monitor Ranges:
    Horizontal Freq: 31.466 - 79.976 kHz (Monitor: 30.000 - 60.000 kHz)
    Maximum Clock: 135.000 MHz (Monitor: 80.000 MHz)

Failures:

Block 0, Base EDID:
  Basic Display Parameters & Features: sRGB is signaled, but the chromaticities do not match.
  Display Range Limits: GTF is supported, but the display does not support continuous frequencies.
EDID:
  Extension Block 1 started with EDID header, ignoring Extension Blocks >= 1.

EDID conformity: FAIL
