edid-decode (hex):

00 ff ff ff ff ff ff 00 09 e5 70 0c 00 00 00 00
1b 21 01 04 a5 26 15 78 03 de 50 a3 54 4c 99 26
0f 50 54 00 00 00 01 01 01 01 01 01 01 01 01 01
01 01 01 01 01 01 c8 37 80 cc 70 38 28 40 6c 30
aa 00 7e d7 10 00 00 1a 30 25 80 cc 70 38 28 40
6c 30 aa 00 7e d7 10 00 00 1a 00 00 00 00 00 00
00 00 00 00 00 00 00 00 00 00 00 00 00 00 00 02
00 09 33 ff 0a 3c 96 15 1b 44 96 00 00 00 00 54

00 ff ff ff ff ff ff 00 09 e5 70 0c 00 00 00 00
1b 21 01 04 a5 26 15 78 03 de 50 a3 54 4c 99 26
0f 50 54 00 00 00 01 01 01 01 01 01 01 01 01 01
01 01 01 01 01 01 c8 37 80 cc 70 38 28 40 6c 30
aa 00 7e d7 10 00 00 1a 30 25 80 cc 70 38 28 40
6c 30 aa 00 7e d7 10 00 00 1a 00 00 00 00 00 00
00 00 00 00 00 00 00 00 00 00 00 00 00 00 00 02
00 09 33 ff 0a 3c 96 15 1b 44 96 00 00 00 00 54

----------------

Block 0, Base EDID:
  EDID Structure Version & Revision: 1.4
  Vendor & Product Identification:
    Manufacturer: BOE
    Model: 3184
    Made in: week 27 of 2023
  Basic Display Parameters & Features:
    Digital display
    Bits per primary color channel: 8
    DisplayPort interface
    Maximum image size: 38 cm x 21 cm
    Gamma: 2.20
    Supported color formats: RGB 4:4:4
    First detailed timing includes the native pixel format and preferred refresh rate
    Display supports continuous frequencies
  Color Characteristics:
    Red  : 0.6396, 0.3291
    Green: 0.2998, 0.5996
    Blue : 0.1494, 0.0595
    White: 0.3125, 0.3281
  Established Timings I & II: none
  Standard Timings: none
  Detailed Timing Descriptors:
    DTD 1:  1920x1080   60.028249 Hz  16:9     67.232 kHz    142.800000 MHz (382 mm x 215 mm)
                 Hfront  108 Hsync  48 Hback   48 Hpol P
                 Vfront   10 Vsync  10 Vback   20 Vpol N
    DTD 2:  1920x1080   40.018832 Hz  16:9     44.821 kHz     95.200000 MHz (382 mm x 215 mm)
                 Hfront  108 Hsync  48 Hback   48 Hpol P
                 Vfront   10 Vsync  10 Vback   20 Vpol N
    Empty Descriptor
    Manufacturer-Specified Display Descriptor (0x02): 00 02 00 09 33 ff 0a 3c 96 15 1b 44 96 00 00 00 '....3..<...D....'
Checksum: 0x54

----------------

Warnings:

Block 0, Base EDID:
  Missing Display Product Name.

Failures:

Block 0, Base EDID:
  Empty Descriptor: Use Dummy Descriptor instead of all zeroes.
  Missing Display Range Limits Descriptor.
EDID:
  Extension Block 1 started with EDID header, ignoring Extension Blocks >= 1.

EDID conformity: FAIL
