edid-decode (hex):

00 ff ff ff ff ff ff 00 14 8f 45 41 00 00 00 00
10 22 01 04 b5 1f 14 78 00 0c b5 af 51 3e ba 23
0a 50 54 00 00 00 01 01 01 01 01 01 01 01 01 01
01 01 01 01 01 01 00 00 00 10 00 00 00 00 00 00
00 00 00 00 00 00 00 00 00 00 00 10 00 00 00 00
00 00 00 00 00 00 00 00 00 00 00 00 00 fe 00 45
44 4f 20 53 48 0a 20 20 20 20 20 20 00 00 00 fe
00 45 45 35 30 51 42 43 37 34 2e 41 0a 20 01 69

70 20 79 02 00 20 00 0c 94 0b d5 28 14 00 00 00
00 02 18 00 21 00 1d 30 0c 9e 07 b8 0b 54 07 80
f1 ea 50 eb 13 ba 39 c2 0a 02 35 54 ec 5f 1a 64
ea 10 23 78 26 00 09 07 00 00 00 00 00 40 00 00
22 00 28 c5 6e 0c 00 b7 0b 6f 01 eb 00 03 00 53
07 8b 00 88 00 00 00 c5 6e 0c 80 b7 0b 6f 01 eb
00 03 00 53 07 6b 08 68 08 00 00 81 00 0b e3 05
80 00 e6 06 05 01 8d 6b 02 00 00 00 00 00 59 90

00 ff ff ff ff ff ff 00 14 8f 45 41 00 00 00 00
10 22 01 04 b5 1f 14 78 00 0c b5 af 51 3e ba 23
0a 50 54 00 00 00 01 01 01 01 01 01 01 01 01 01
01 01 01 01 01 01 00 00 00 10 00 00 00 00 00 00
00 00 00 00 00 00 00 00 00 00 00 10 00 00 00 00
00 00 00 00 00 00 00 00 00 00 00 00 00 fe 00 45
44 4f 20 53 48 0a 20 20 20 20 20 20 00 00 00 fe
00 45 45 35 30 51 42 43 37 34 2e 41 0a 20 01 69

70 20 79 02 00 20 00 0c 94 0b d5 28 14 00 00 00
00 02 18 00 21 00 1d 30 0c 9e 07 b8 0b 54 07 80
f1 ea 50 eb 13 ba 39 c2 0a 02 35 54 ec 5f 1a 64
ea 10 23 78 26 00 09 07 00 00 00 00 00 40 00 00
22 00 28 c5 6e 0c 00 b7 0b 6f 01 eb 00 03 00 53
07 8b 00 88 00 00 00 c5 6e 0c 80 b7 0b 6f 01 eb
00 03 00 53 07 6b 08 68 08 00 00 81 00 0b e3 05
80 00 e6 06 05 01 8d 6b 02 00 00 00 00 00 59 90

----------------

Block 0, Base EDID:
  EDID Structure Version & Revision: 1.4
  Vendor & Product Identification:
    Manufacturer: EDO
    Model: 16709
    Made in: week 16 of 2024
  Basic Display Parameters & Features:
    Digital display
    Bits per primary color channel: 10
    DisplayPort interface
    Maximum image size: 31 cm x 20 cm
    Gamma: 2.20
    Supported color formats: RGB 4:4:4
    First detailed timing does not include the native pixel format and preferred refresh rate
  Color Characteristics:
    Red  : 0.6835, 0.3164
    Green: 0.2451, 0.7265
    Blue : 0.1386, 0.0419
    White: 0.3134, 0.3291
  Established Timings I & II: none
  Standard Timings: none
  Detailed Timing Descriptors:
    Dummy Descriptor:
    Dummy Descriptor:
    Alphanumeric Data String: 'EDO SH'
    Alphanumeric Data String: 'EE50QBC74.A'
  Extension blocks: 1
Checksum: 0x69

----------------

Block 1, DisplayID Extension Block:
  Version: 2.0
  Extension Count: 0
  Display Product Primary Use Case: None of the listed primary use cases; generic display
  Product Identification Data Block (0x20), OUI 94-0B-D5:
    Product Code: 5160
    Year of Manufacture: 2024, Week 2
  Display Parameters Data Block (0x21):
    Image size: 312.0 mm x 195.0 mm
    Display native pixel format: 3000x1876
    Scan Orientation: Left to Right, Top to Bottom
    Luminance Information: Minimum guaranteed value
    Color Information: CIE 1931
    Audio Speaker Information: not integrated
    Native Color Chromaticity:
      Primary #1:  (0.683838, 0.315918)
      Primary #2:  (0.244873, 0.726807)
      Primary #3:  (0.138916, 0.041992)
      White Point: (0.312988, 0.328857)
    Native Maximum Luminance (Full Coverage): 507.000000 cd/m^2
    Native Maximum Luminance (10% Rectangular Coverage): 1050.000000 cd/m^2
    Native Minimum Luminance: 0.000600 cd/m^2
    Native Color Depth: 10 bpc
    Display Device Technology: Organic LED
    Native Gamma EOTF: 2.20
  Display Interface Features Data Block:
    Supported bpc for RGB encoding: 6, 8, 10
    Supported color space and EOTF standard combination 1: BT.2020/SMPTE ST 2084
  Video Timing Modes Type 7 - Detailed Timings Data Block:
    DTD:  3000x1876  120.000507 Hz   1:1    241.921 kHz    814.790000 MHz (aspect 1:1, no 3D stereo)
               Hfront  236 Hsync   4 Hback  128 Hpol N
               Vfront  137 Vsync   1 Vback    2 Vpol N
    DTD:  3000x1876   60.000253 Hz   1:1    241.921 kHz    814.790000 MHz (aspect 1:1, no 3D stereo, preferred)
               Hfront  236 Hsync   4 Hback  128 Hpol N
               Vfront 2153 Vsync   1 Vback    2 Vpol N
  CTA-861 DisplayID Data Block:
  Colorimetry Data Block:
    BT2020RGB
  HDR Static Metadata Data Block:
    Electro optical transfer functions:
      Traditional gamma - SDR luminance range
      SMPTE ST2084
    Supported static metadata descriptors:
      Static metadata type 1
    Desired content max luminance: 141 (1060.189 cd/m^2)
    Desired content max frame-average luminance: 107 (507.620 cd/m^2)
    Desired content min luminance: 2 (0.001 cd/m^2)
  Checksum: 0x59
Checksum: 0x90

----------------

Warnings:

Block 0, Base EDID:
  Missing Display Product Name.
Block 1, DisplayID Extension Block:
  Colorimetry Data Block: Set the sRGB colorimetry bit to avoid interop issues.

Failures:

Block 0, Base EDID:
  Standard Timings: Missing preferred timing.
EDID:
  Extension Block 2 started with EDID header, ignoring Extension Blocks >= 2.

EDID conformity: FAIL
