edid-decode (hex):

00 ff ff ff ff ff ff 00 3e 8d 32 30 47 00 00 00
2d 15 01 03 0e 00 00 00 ea 7f 73 a9 53 4f a5 23
11 4c 55 bf ef 80 45 7c 61 7c 81 00 81 80 b3 00
81 c0 81 fc a9 40 9e 20 00 90 51 20 1f 30 48 80
36 00 00 00 00 00 00 1c 00 00 00 ff 00 51 38 48
41 31 34 35 30 30 37 31 0a 20 00 00 00 fc 00 4f
70 74 6f 6d 61 20 33 44 30 32 0a 20 00 00 00 fd
00 0f 78 0f 78 11 00 0a 20 20 20 20 00 00 00 fb

00 ff ff ff ff ff ff 00 3e 8d 32 30 47 00 00 00
2d 15 01 03 0e 00 00 00 ea 7f 73 a9 53 4f a5 23
11 4c 55 bf ef 80 45 7c 61 7c 81 00 81 80 b3 00
81 c0 81 fc a9 40 9e 20 00 90 51 20 1f 30 48 80
36 00 00 00 00 00 00 1c 00 00 00 ff 00 51 38 48
41 31 34 35 30 30 37 31 0a 20 00 00 00 fc 00 4f
70 74 6f 6d 61 20 33 44 30 32 0a 20 00 00 00 fd
00 0f 78 0f 78 11 00 0a 20 20 20 20 00 00 00 fb

----------------

Block 0, Base EDID:
  EDID Structure Version & Revision: 1.3
  Vendor & Product Identification:
    Manufacturer: OTM
    Model: 12338
    Serial Number: ...
    Made in: week 45 of 2011
  Basic Display Parameters & Features:
    Analog display
    Signal Level Standard: 0.700 : 0.300 : 1.000 V p-p
    Blank level equals black level
    Sync: Separate Composite SyncOnGreen
    Image size is variable
    Gamma: 1.00
    DPMS levels: Standby Suspend Off
    RGB color display
    First detailed timing is the preferred timing
  Color Characteristics:
    Red  : 0.6611, 0.3271
    Green: 0.3115, 0.6474
    Blue : 0.1376, 0.0693
    White: 0.2968, 0.3349
  Established Timings I & II:
    IBM     :   720x400    70.081663 Hz   9:5     31.467 kHz     28.320000 MHz
    DMT 0x04:   640x480    59.940476 Hz   4:3     31.469 kHz     25.175000 MHz
    Apple   :   640x480    66.666667 Hz   4:3     35.000 kHz     30.240000 MHz
    DMT 0x05:   640x480    72.808802 Hz   4:3     37.861 kHz     31.500000 MHz
    DMT 0x06:   640x480    75.000000 Hz   4:3     37.500 kHz     31.500000 MHz
    DMT 0x08:   800x600    56.250000 Hz   4:3     35.156 kHz     36.000000 MHz
    DMT 0x09:   800x600    60.316541 Hz   4:3     37.879 kHz     40.000000 MHz
    DMT 0x0a:   800x600    72.187572 Hz   4:3     48.077 kHz     50.000000 MHz
    DMT 0x0b:   800x600    75.000000 Hz   4:3     46.875 kHz     49.500000 MHz
    Apple   :   832x624    74.551266 Hz   4:3     49.726 kHz     57.284000 MHz
    DMT 0x10:  1024x768    60.003840 Hz   4:3     48.363 kHz     65.000000 MHz
    DMT 0x11:  1024x768    70.069359 Hz   4:3     56.476 kHz     75.000000 MHz
    DMT 0x12:  1024x768    75.028582 Hz   4:3     60.023 kHz     78.750000 MHz
    DMT 0x24:  1280x1024   75.024675 Hz   5:4     79.976 kHz    135.000000 MHz
    Apple   :  1152x870    75.061550 Hz 192:145   68.681 kHz    100.000000 MHz
  Standard Timings:
    GTF     :   800x600   119.999886 Hz   4:3     77.160 kHz     83.950000 MHz
    GTF     :  1024x768   119.999931 Hz   4:3     98.760 kHz    139.054000 MHz
    DMT 0x1c:  1280x800    59.810326 Hz  16:10    49.702 kHz     83.500000 MHz
    DMT 0x23:  1280x1024   60.019740 Hz   5:4     63.981 kHz    108.000000 MHz
    DMT 0x3a:  1680x1050   59.954250 Hz  16:10    65.290 kHz    146.250000 MHz
    DMT 0x55:  1280x720    60.000000 Hz  16:9     45.000 kHz     74.250000 MHz
    GTF     :  1280x720   119.999881 Hz  16:9     92.640 kHz    161.564000 MHz
    DMT 0x33:  1600x1200   60.000000 Hz   4:3     75.000 kHz    162.000000 MHz
  Detailed Timing Descriptors:
    DTD 1:  1280x800    59.810326 Hz  16:10    49.702 kHz     83.500000 MHz
                 Hfront   72 Hsync 128 Hback  200 Hpol N
                 Vfront    3 Vsync   6 Vback   22 Vpol P
    Display Product Serial Number: ...
    Display Product Name: 'Optoma 3D02'
    Display Range Limits:
      Monitor ranges (GTF): 15-120 Hz V, 15-120 kHz H, max dotclock 170 MHz
Checksum: 0xfb

----------------

Failures:

Block 0, Base EDID:
  Display Range Limits: Bytes 12-17 must be 0x20.
EDID:
  Extension Block 1 started with EDID header, ignoring Extension Blocks >= 1.

EDID conformity: FAIL
