edid-decode (hex):

00 ff ff ff ff ff ff 00 22 f0 43 31 01 01 01 01
07 18 01 03 80 2b 18 78 2e 2c c5 a4 56 50 a1 28
0f 50 54 a1 08 00 a9 c0 81 c0 95 00 81 80 01 01
01 01 01 01 01 01 30 2a 40 c8 60 84 64 30 18 50
13 00 b0 ef 10 00 00 1e 00 00 00 fd 00 32 4b 18
53 11 00 0a 20 20 20 20 20 20 00 00 00 fc 00 48
50 20 32 30 77 64 0a 20 20 20 20 20 00 00 00 ff
00 33 43 51 34 30 37 32 36 52 58 0a 20 20 00 0e

00 ff ff ff ff ff ff 00 22 f0 43 31 01 01 01 01
07 18 01 03 80 2b 18 78 2e 2c c5 a4 56 50 a1 28
0f 50 54 a1 08 00 a9 c0 81 c0 95 00 81 80 01 01
01 01 01 01 01 01 30 2a 40 c8 60 84 64 30 18 50
13 00 b0 ef 10 00 00 1e 00 00 00 fd 00 32 4b 18
53 11 00 0a 20 20 20 20 20 20 00 00 00 fc 00 48
50 20 32 30 77 64 0a 20 20 20 20 20 00 00 00 ff
00 33 43 51 34 30 37 32 36 52 58 0a 20 20 00 0e

----------------

Block 0, Base EDID:
  EDID Structure Version & Revision: 1.3
  Vendor & Product Identification:
    Manufacturer: HWP
    Model: 12611
    Serial Number: ...
    Made in: week 7 of 2014
  Basic Display Parameters & Features:
    Digital display
    Maximum image size: 43 cm x 24 cm
    Gamma: 2.20
    DPMS levels: Off
    RGB color display
    Default (sRGB) color space is primary color space
    First detailed timing is the preferred timing
  Color Characteristics:
    Red  : 0.6406, 0.3378
    Green: 0.3154, 0.6289
    Blue : 0.1591, 0.0585
    White: 0.3134, 0.3291
  Established Timings I & II:
    IBM     :   720x400    70.081663 Hz   9:5     31.467 kHz     28.320000 MHz
    DMT 0x04:   640x480    59.940476 Hz   4:3     31.469 kHz     25.175000 MHz
    DMT 0x09:   800x600    60.316541 Hz   4:3     37.879 kHz     40.000000 MHz
    DMT 0x10:  1024x768    60.003840 Hz   4:3     48.363 kHz     65.000000 MHz
  Standard Timings:
    DMT 0x53:  1600x900    60.000000 Hz  16:9     60.000 kHz    108.000000 MHz (RB)
    DMT 0x55:  1280x720    60.000000 Hz  16:9     45.000 kHz     74.250000 MHz
    DMT 0x2f:  1440x900    59.887445 Hz  16:10    55.935 kHz    106.500000 MHz
    DMT 0x23:  1280x1024   60.019740 Hz   5:4     63.981 kHz    108.000000 MHz
  Detailed Timing Descriptors:
    DTD 1:  1600x900    60.000000 Hz  16:9     60.000 kHz    108.000000 MHz (432 mm x 239 mm)
                 Hfront   24 Hsync  80 Hback   96 Hpol P
                 Vfront    1 Vsync   3 Vback   96 Vpol P
    Display Range Limits:
      Monitor ranges (GTF): 50-75 Hz V, 24-83 kHz H, max dotclock 170 MHz
    Display Product Name: 'HP 20wd'
    Display Product Serial Number: ...
Checksum: 0x0e

----------------

Warnings:

Block 0, Base EDID:
  Vendor & Product Identification: The serial number is one of the known dummy values, it should probably be set to 0.

Failures:

Block 0, Base EDID:
  Basic Display Parameters & Features: sRGB is signaled, but the chromaticities do not match.
EDID:
  Extension Block 1 started with EDID header, ignoring Extension Blocks >= 1.

EDID conformity: FAIL
