edid-decode (hex):

00 ff ff ff ff ff ff 00 10 ac 05 70 54 5a 4c 43
26 0d 01 03 68 1e 17 b1 ee 9e a8 a1 54 46 99 24
0e 48 4c a0 42 00 31 59 45 59 61 59 71 4f 01 01
01 01 01 01 01 01 c3 1e 00 20 41 00 20 30 10 60
13 00 2c e1 10 00 00 1e 00 00 00 ff 00 34 50 31
32 31 33 39 4b 43 4c 5a 54 0a 00 00 00 fc 00 44
45 4c 4c 20 20 45 37 37 32 70 0a 20 00 00 00 fd
00 32 a0 1e 46 0b 00 0a 20 20 20 20 20 20 00 70

00 ff ff ff ff ff ff 00 10 ac 05 70 54 5a 4c 43
26 0d 01 03 68 1e 17 b1 ee 9e a8 a1 54 46 99 24
0e 48 4c a0 42 00 31 59 45 59 61 59 71 4f 01 01
01 01 01 01 01 01 c3 1e 00 20 41 00 20 30 10 60
13 00 2c e1 10 00 00 1e 00 00 00 ff 00 34 50 31
32 31 33 39 4b 43 4c 5a 54 0a 00 00 00 fc 00 44
45 4c 4c 20 20 45 37 37 32 70 0a 20 00 00 00 fd
00 32 a0 1e 46 0b 00 0a 20 20 20 20 20 20 00 70

----------------

Block 0, Base EDID:
  EDID Structure Version & Revision: 1.3
  Vendor & Product Identification:
    Manufacturer: DEL
    Model: 28677
    Serial Number: ...
    Made in: week 38 of 2003
  Basic Display Parameters & Features:
    Analog display
    Signal Level Standard: 0.700 : 0.000 : 0.700 V p-p
    Blank level equals black level
    Sync: Separate
    Maximum image size: 30 cm x 23 cm
    Gamma: 2.77
    DPMS levels: Standby Suspend Off
    RGB color display
    Default (sRGB) color space is primary color space
    First detailed timing is the preferred timing
  Color Characteristics:
    Red  : 0.6308, 0.3291
    Green: 0.2763, 0.5996
    Blue : 0.1425, 0.0566
    White: 0.2832, 0.2968
  Established Timings I & II:
    IBM     :   720x400    70.081663 Hz   9:5     31.467 kHz     28.320000 MHz
    DMT 0x04:   640x480    59.940476 Hz   4:3     31.469 kHz     25.175000 MHz
    DMT 0x0b:   800x600    75.000000 Hz   4:3     46.875 kHz     49.500000 MHz
    DMT 0x12:  1024x768    75.028582 Hz   4:3     60.023 kHz     78.750000 MHz
  Standard Timings:
    DMT 0x07:   640x480    85.008312 Hz   4:3     43.269 kHz     36.000000 MHz
    DMT 0x0c:   800x600    85.061274 Hz   4:3     53.674 kHz     56.250000 MHz
    DMT 0x13:  1024x768    84.996690 Hz   4:3     68.677 kHz     94.500000 MHz
    DMT 0x15:  1152x864    75.000000 Hz   4:3     67.500 kHz    108.000000 MHz
  Detailed Timing Descriptors:
    DTD 1:  1024x768    75.028582 Hz   4:3     60.023 kHz     78.750000 MHz (300 mm x 225 mm)
                 Hfront   16 Hsync  96 Hback  176 Hpol P
                 Vfront    1 Vsync   3 Vback   28 Vpol P
    Display Product Serial Number: ...
    Display Product Name: 'DELL  E772p'
    Display Range Limits:
      Monitor ranges (GTF): 50-160 Hz V, 30-70 kHz H, max dotclock 110 MHz
Checksum: 0x70

----------------

Warnings:

Block 0, Base EDID:
  Basic Display Parameters & Features: sRGB is signaled, but the gamma != 2.2.

Failures:

Block 0, Base EDID:
  Basic Display Parameters & Features: sRGB is signaled, but the chromaticities do not match.
EDID:
  Extension Block 1 started with EDID header, ignoring Extension Blocks >= 1.

EDID conformity: FAIL
