edid-decode (hex):

00 ff ff ff ff ff ff 00 09 e5 7b 0b 00 00 00 00
1a 20 01 04 a5 1e 13 78 03 e0 05 ac 52 42 b3 27
0e 50 54 00 00 00 01 01 01 01 01 01 01 01 01 01
01 01 01 01 01 01 90 6f 00 a0 a0 40 96 60 30 20
36 00 2e bc 10 00 00 1a 00 00 00 fd 0c 3c a5 22
22 4f 01 0a 20 20 20 20 20 20 00 00 00 fe 00 4e
45 31 34 30 51 44 4d 2d 4e 59 31 0a 00 00 00 00
00 00 00 00 00 00 00 00 00 00 00 00 00 00 01 d2

70 20 79 02 00 22 00 14 f7 fb 0b 85 ff 09 9f 00
2f 00 1f 00 3f 06 95 00 02 00 05 00 2b 00 06 27
00 3c a4 00 00 81 00 13 72 1a 00 00 03 01 3c a5
00 00 00 00 00 00 a5 00 00 00 00 00 00 00 00 00
00 00 00 00 00 00 00 00 00 00 00 00 00 00 00 00
00 00 00 00 00 00 00 00 00 00 00 00 00 00 00 00
00 00 00 00 00 00 00 00 00 00 00 00 00 00 00 00
00 00 00 00 00 00 00 00 00 00 00 00 00 00 f5 90

00 ff ff ff ff ff ff 00 09 e5 7b 0b 00 00 00 00
1a 20 01 04 a5 1e 13 78 03 e0 05 ac 52 42 b3 27
0e 50 54 00 00 00 01 01 01 01 01 01 01 01 01 01
01 01 01 01 01 01 90 6f 00 a0 a0 40 96 60 30 20
36 00 2e bc 10 00 00 1a 00 00 00 fd 0c 3c a5 22
22 4f 01 0a 20 20 20 20 20 20 00 00 00 fe 00 4e
45 31 34 30 51 44 4d 2d 4e 59 31 0a 00 00 00 00
00 00 00 00 00 00 00 00 00 00 00 00 00 00 01 d2

70 20 79 02 00 22 00 14 f7 fb 0b 85 ff 09 9f 00
2f 00 1f 00 3f 06 95 00 02 00 05 00 2b 00 06 27
00 3c a4 00 00 81 00 13 72 1a 00 00 03 01 3c a5
00 00 00 00 00 00 a5 00 00 00 00 00 00 00 00 00
00 00 00 00 00 00 00 00 00 00 00 00 00 00 00 00
00 00 00 00 00 00 00 00 00 00 00 00 00 00 00 00
00 00 00 00 00 00 00 00 00 00 00 00 00 00 00 00
00 00 00 00 00 00 00 00 00 00 00 00 00 00 f5 90

----------------

Block 0, Base EDID:
  EDID Structure Version & Revision: 1.4
  Vendor & Product Identification:
    Manufacturer: BOE
    Model: 2939
    Made in: week 26 of 2022
  Basic Display Parameters & Features:
    Digital display
    Bits per primary color channel: 8
    DisplayPort interface
    Maximum image size: 30 cm x 19 cm
    Gamma: 2.20
    Supported color formats: RGB 4:4:4
    First detailed timing includes the native pixel format and preferred refresh rate
    Display supports continuous frequencies
  Color Characteristics:
    Red  : 0.6748, 0.3222
    Green: 0.2578, 0.6992
    Blue : 0.1523, 0.0546
    White: 0.3134, 0.3291
  Established Timings I & II: none
  Standard Timings: none
  Detailed Timing Descriptors:
    DTD 1:  2560x1600   60.000000 Hz  16:10   105.000 kHz    285.600000 MHz (302 mm x 188 mm)
                 Hfront   48 Hsync  32 Hback   80 Hpol P
                 Vfront    3 Vsync   6 Vback  141 Vpol N
    Display Range Limits:
      Monitor ranges (Range Limits Only): 60-165 Hz V, 289-289 kHz H, max dotclock 790 MHz
    Alphanumeric Data String: 'NE140QDM-NY1'
    Empty Descriptor
  Extension blocks: 1
Checksum: 0xd2

----------------

Block 1, DisplayID Extension Block:
  Version: 2.0
  Extension Count: 0
  Display Product Primary Use Case: None of the listed primary use cases; generic display
  Video Timing Modes Type 7 - Detailed Timings Data Block:
    DTD:  2560x1600  165.000000 Hz  16:10   288.750 kHz    785.400000 MHz (aspect 16:10, no 3D stereo, preferred)
               Hfront   48 Hsync  32 Hback   80 Hpol N
               Vfront    3 Vsync   6 Vback  141 Vpol N
  Adaptive Sync Data Block:
    Descriptor #1:
      Native Panel Range
      Fixed Average V-Total and Adaptive V-Total
      Supports Seamless Transition
      'Max Single Frame Duration Increase' field value without jitter impact
      'Max Single Frame Duration Decrease' field value without jitter impact
      Max Duration Increase: 0.00 ms
      Max Duration Decrease: 0.00 ms
      Min Refresh Rate: 60 Hz
      Max Refresh Rate: 165 Hz
  CTA-861 DisplayID Data Block:
  Vendor-Specific Data Block (AMD), OUI 00-00-1A:
    Version: 3
    Flags 1: 0x01
      FreeSync Supported
    Minimum Refresh Rate: 60 Hz
    Maximum Refresh Rate: 165 Hz
    Flags 5: 0x00
  Checksum: 0xf5
Checksum: 0x90

----------------

Warnings:

Block 0, Base EDID:
  Missing Display Product Name.
EDID:
  Base EDID: Some timings are out of range of the Monitor Ranges:
    Horizontal Freq: 105.000 - 288.750 kHz (Monitor: 289.000 - 289.000 kHz)

Failures:

Block 0, Base EDID:
  Empty Descriptor: Use Dummy Descriptor instead of all zeroes.
EDID:
  Extension Block 2 started with EDID header, ignoring Extension Blocks >= 2.
  DisplayID: Missing DisplayID Display Parameters Data Block.

EDID conformity: FAIL
