edid-decode (hex):

00 ff ff ff ff ff ff 00 0d ae 15 16 00 00 00 00
17 1f 01 04 a5 22 16 78 02 0f 95 ae 52 43 b0 26
0f 50 54 00 00 00 01 01 01 01 01 01 01 01 01 01
01 01 01 01 01 01 42 3c 80 a0 70 b0 24 40 30 20
35 00 58 d7 10 00 00 1a 42 3c 80 a0 70 b0 59 41
30 20 35 00 58 d7 10 00 00 1a 00 00 00 fe 00 4a
50 48 4a 4b 80 31 36 30 4a 43 41 0a 00 00 00 00
00 02 41 31 b2 00 10 00 00 0a 41 0a 20 20 00 a9

00 ff ff ff ff ff ff 00 0d ae 15 16 00 00 00 00
17 1f 01 04 a5 22 16 78 02 0f 95 ae 52 43 b0 26
0f 50 54 00 00 00 01 01 01 01 01 01 01 01 01 01
01 01 01 01 01 01 42 3c 80 a0 70 b0 24 40 30 20
35 00 58 d7 10 00 00 1a 42 3c 80 a0 70 b0 59 41
30 20 35 00 58 d7 10 00 00 1a 00 00 00 fe 00 4a
50 48 4a 4b 80 31 36 30 4a 43 41 0a 00 00 00 00
00 02 41 31 b2 00 10 00 00 0a 41 0a 20 20 00 a9

----------------

Block 0, Base EDID:
  EDID Structure Version & Revision: 1.4
  Vendor & Product Identification:
    Manufacturer: CMN
    Model: 5653
    Made in: week 23 of 2021
  Basic Display Parameters & Features:
    Digital display
    Bits per primary color channel: 8
    DisplayPort interface
    Maximum image size: 34 cm x 22 cm
    Gamma: 2.20
    Supported color formats: RGB 4:4:4
    First detailed timing includes the native pixel format and preferred refresh rate
  Color Characteristics:
    Red  : 0.6796, 0.3203
    Green: 0.2646, 0.6904
    Blue : 0.1503, 0.0595
    White: 0.3134, 0.3291
  Established Timings I & II: none
  Standard Timings: none
  Detailed Timing Descriptors:
    DTD 1:  1920x1200   60.002801 Hz  16:10    74.163 kHz    154.260000 MHz (344 mm x 215 mm)
                 Hfront   48 Hsync  32 Hback   80 Hpol P
                 Vfront    3 Vsync   5 Vback   28 Vpol N
    DTD 2:  1920x1200   48.002240 Hz  16:10    74.163 kHz    154.260000 MHz (344 mm x 215 mm)
                 Hfront   48 Hsync  32 Hback   80 Hpol P
                 Vfront    3 Vsync   5 Vback  337 Vpol N
    Alphanumeric Data String: 'JPHJK.160JCA'
    Manufacturer-Specified Display Descriptor (0x00): 00 00 00 02 41 31 b2 00 10 00 00 0a 41 0a 20 20 '....A1......A.  '
Checksum: 0xa9

----------------

Block 1, Unknown EDID Extension Block 0x00:
  00 ff ff ff ff ff ff 00 0d ae 15 16 00 00 00 00 '................'
  17 1f 01 04 a5 22 16 78 02 0f 95 ae 52 43 b0 26 '.....".x....RC.&'
  0f 50 54 00 00 00 01 01 01 01 01 01 01 01 01 01 '.PT.............'
  01 01 01 01 01 01 42 3c 80 a0 70 b0 24 40 30 20 '......B<..p.$@0 '
  35 00 58 d7 10 00 00 1a 42 3c 80 a0 70 b0 59 41 '5.X.....B<..p.YA'
  30 20 35 00 58 d7 10 00 00 1a 00 00 00 fe 00 4a '0 5.X..........J'
  50 48 4a 4b 80 31 36 30 4a 43 41 0a 00 00 00 00 'PHJK.160JCA.....'
  00 02 41 31 b2 00 10 00 00 0a 41 0a 20 20 00 a9 '..A1......A.  ..'
Checksum: 0xa9

----------------

Warnings:

Block 0, Base EDID:
  Alphanumeric Data String: Non-ASCII character 0x80 at position 5, can cause problems.
  Missing Display Product Name.

Failures:

Block 1, Base EDID:
  Unknown Extension Block.
EDID:
  Base EDID: EDID specified 0 extension block(s), but found 1 extension block(s).

EDID conformity: FAIL
