edid-decode (hex):

00 ff ff ff ff ff ff 00 06 af 3e 21 00 00 00 00
00 15 01 04 90 1f 11 78 02 61 95 9c 59 52 8f 26
21 50 54 00 00 00 01 01 01 01 01 01 01 01 01 01
01 01 01 01 01 01 f8 2a 40 76 61 84 1c 30 40 2a
33 00 35 ae 10 00 00 1a a5 1c 40 76 61 84 1c 30
40 2a 33 00 35 ae 10 00 00 1a 00 00 00 fe 00 56
33 59 48 46 80 42 31 34 30 52 54 4e 00 00 00 00
00 00 41 21 9e 01 10 00 00 02 01 0a 20 20 00 bb

----------------

Block 0, Base EDID:
  EDID Structure Version & Revision: 1.4
  Vendor & Product Identification:
    Manufacturer: AUO
    Model: 8510
    Made in: 2011
  Basic Display Parameters & Features:
    Digital display
    Bits per primary color channel: 6
    Digital interface is not defined
    Maximum image size: 31 cm x 17 cm
    Gamma: 2.20
    Supported color formats: RGB 4:4:4
    First detailed timing includes the native pixel format and preferred refresh rate
  Color Characteristics:
    Red  : 0.6103, 0.3496
    Green: 0.3203, 0.5595
    Blue : 0.1503, 0.1298
    White: 0.3134, 0.3291
  Established Timings I & II: none
  Standard Timings: none
  Detailed Timing Descriptors:
    DTD 1:  1600x900    60.047864 Hz  16:9     55.724 kHz    110.000000 MHz (309 mm x 174 mm)
                 Hfront   64 Hsync  42 Hback  268 Hpol P
                 Vfront    3 Vsync   3 Vback   22 Vpol N
    DTD 2:  1600x900    40.030089 Hz  16:9     37.148 kHz     73.330000 MHz (309 mm x 174 mm)
                 Hfront   64 Hsync  42 Hback  268 Hpol P
                 Vfront    3 Vsync   3 Vback   22 Vpol N
    Alphanumeric Data String: 'V3YHF.B140RTN'
    Manufacturer-Specified Display Descriptor (0x00): 00 00 00 00 41 21 9e 01 10 00 00 02 01 0a 20 20 '....A!........  '
Checksum: 0xbb

----------------

Warnings:

Block 0, Base EDID:
  Alphanumeric Data String: Non-ASCII character 0x80 at position 5, can cause problems.
  Missing Display Product Name.

EDID conformity: PASS
