edid-decode (hex):

00 ff ff ff ff ff ff 00 1e 55 48 44 01 00 00 00
28 13 01 03 80 a0 5a 78 2a ec 6b a0 56 47 9c 25
10 48 4a 2f cf 00 45 4a 61 4c 01 01 01 01 71 40
71 4a 01 01 01 01 1b 21 50 a0 51 00 1e 30 d0 88
65 04 a0 5a 00 00 00 1c 0e 1f 00 80 51 00 1e 30
c0 80 47 04 a0 5a 00 00 00 1c 00 00 00 fd 00 31
4c 0f 51 08 00 0a 20 20 20 20 20 20 00 00 00 fc
00 47 52 55 4e 44 49 47 20 57 55 58 47 41 01 12

02 03 1f 72 23 09 07 07 4f 14 05 13 04 12 03 11
02 16 07 15 06 9f 90 01 66 03 0c 00 20 00 80 a0
28 80 80 41 60 29 30 c0 78 24 08 a0 5a 00 00 00
1d f1 27 00 a0 51 00 25 30 d0 80 b7 04 a0 5a 00
00 00 1d 8d 27 00 a0 51 c0 24 30 d0 80 d4 04 a0
5a 00 00 00 1c 94 2a 00 b0 51 00 27 40 d8 88 d7
04 a0 5a 00 00 00 1c 01 1d 80 d0 72 1c 16 20 10
2c 25 80 c4 8e 21 00 00 9e 00 00 00 00 00 00 bd

00 ff ff ff ff ff ff 00 1e 55 48 44 01 00 00 00
28 13 01 03 80 a0 5a 78 2a ec 6b a0 56 47 9c 25
10 48 4a 2f cf 00 45 4a 61 4c 01 01 01 01 71 40
71 4a 01 01 01 01 1b 21 50 a0 51 00 1e 30 d0 88
65 04 a0 5a 00 00 00 1c 0e 1f 00 80 51 00 1e 30
c0 80 47 04 a0 5a 00 00 00 1c 00 00 00 fd 00 31
4c 0f 51 08 00 0a 20 20 20 20 20 20 00 00 00 fc
00 47 52 55 4e 44 49 47 20 57 55 58 47 41 01 12

02 03 1f 72 23 09 07 07 4f 14 05 13 04 12 03 11
02 16 07 15 06 9f 90 01 66 03 0c 00 20 00 80 a0
28 80 80 41 60 29 30 c0 78 24 08 a0 5a 00 00 00
1d f1 27 00 a0 51 00 25 30 d0 80 b7 04 a0 5a 00
00 00 1d 8d 27 00 a0 51 c0 24 30 d0 80 d4 04 a0
5a 00 00 00 1c 94 2a 00 b0 51 00 27 40 d8 88 d7
04 a0 5a 00 00 00 1c 01 1d 80 d0 72 1c 16 20 10
2c 25 80 c4 8e 21 00 00 9e 00 00 00 00 00 00 bd

----------------

Block 0, Base EDID:
  EDID Structure Version & Revision: 1.3
  Vendor & Product Identification:
    Manufacturer: GRU
    Model: 17480
    Serial Number: ...
    Made in: week 40 of 2009
  Basic Display Parameters & Features:
    Digital display
    Maximum image size: 160 cm x 90 cm
    Gamma: 2.20
    DPMS levels: Off
    RGB color display
    First detailed timing is the preferred timing
  Color Characteristics:
    Red  : 0.6279, 0.3378
    Green: 0.2802, 0.6093
    Blue : 0.1455, 0.0644
    White: 0.2832, 0.2919
  Established Timings I & II:
    DMT 0x04:   640x480    59.940476 Hz   4:3     31.469 kHz     25.175000 MHz
    DMT 0x05:   640x480    72.808802 Hz   4:3     37.861 kHz     31.500000 MHz
    DMT 0x06:   640x480    75.000000 Hz   4:3     37.500 kHz     31.500000 MHz
    DMT 0x08:   800x600    56.250000 Hz   4:3     35.156 kHz     36.000000 MHz
    DMT 0x09:   800x600    60.316541 Hz   4:3     37.879 kHz     40.000000 MHz
    DMT 0x0a:   800x600    72.187572 Hz   4:3     48.077 kHz     50.000000 MHz
    DMT 0x0b:   800x600    75.000000 Hz   4:3     46.875 kHz     49.500000 MHz
    DMT 0x10:  1024x768    60.003840 Hz   4:3     48.363 kHz     65.000000 MHz
    DMT 0x11:  1024x768    70.069359 Hz   4:3     56.476 kHz     75.000000 MHz
    DMT 0x12:  1024x768    75.028582 Hz   4:3     60.023 kHz     78.750000 MHz
    DMT 0x24:  1280x1024   75.024675 Hz   5:4     79.976 kHz    135.000000 MHz
  Standard Timings:
    GTF     :   800x600    70.000000 Hz   4:3     43.750 kHz     45.500000 MHz
    DMT 0x11:  1024x768    70.069359 Hz   4:3     56.476 kHz     75.000000 MHz
    GTF     :  1152x864    60.000000 Hz   4:3     53.700 kHz     81.624000 MHz
    GTF     :  1152x864    70.000000 Hz   4:3     63.000 kHz     96.768000 MHz
  Detailed Timing Descriptors:
    DTD  1:  1360x768    59.798991 Hz  85:48    47.720 kHz     84.750000 MHz (160 mm x 90 mm)
                  Hfront  208 Hsync 136 Hback   72 Hpol N
                  Vfront   22 Vsync   5 Vback    3 Vpol P
    DTD  2:  1280x768    59.870228 Hz   5:3     47.776 kHz     79.500000 MHz (160 mm x 90 mm)
                  Hfront  192 Hsync 128 Hback   64 Hpol N
                  Vfront   20 Vsync   7 Vback    3 Vpol P
    Display Range Limits:
      Monitor ranges (GTF): 49-76 Hz V, 15-81 kHz H, max dotclock 80 MHz
    Display Product Name: 'GRUNDIG WUXGA'
  Extension blocks: 1
Checksum: 0x12

----------------

Block 1, CTA-861 Extension Block:
  Revision: 3
  Basic audio support
  Supports YCbCr 4:4:4
  Supports YCbCr 4:2:2
  Native detailed modes: 2
  Audio Data Block:
    Linear PCM:
      Max channels: 2
      Supported sample rates (kHz): 48 44.1 32
      Supported sample sizes (bits): 24 20 16
  Video Data Block:
    VIC  20:  1920x1080i  50.000000 Hz  16:9     28.125 kHz     74.250000 MHz
    VIC   5:  1920x1080i  60.000000 Hz  16:9     33.750 kHz     74.250000 MHz
    VIC  19:  1280x720    50.000000 Hz  16:9     37.500 kHz     74.250000 MHz
    VIC   4:  1280x720    60.000000 Hz  16:9     45.000 kHz     74.250000 MHz
    VIC  18:   720x576    50.000000 Hz  16:9     31.250 kHz     27.000000 MHz
    VIC   3:   720x480    59.940060 Hz  16:9     31.469 kHz     27.000000 MHz
    VIC  17:   720x576    50.000000 Hz   4:3     31.250 kHz     27.000000 MHz
    VIC   2:   720x480    59.940060 Hz   4:3     31.469 kHz     27.000000 MHz
    VIC  22:  1440x576i   50.000000 Hz  16:9     15.625 kHz     27.000000 MHz
    VIC   7:  1440x480i   59.940060 Hz  16:9     15.734 kHz     27.000000 MHz
    VIC  21:  1440x576i   50.000000 Hz   4:3     15.625 kHz     27.000000 MHz
    VIC   6:  1440x480i   59.940060 Hz   4:3     15.734 kHz     27.000000 MHz
    VIC  31:  1920x1080   50.000000 Hz  16:9     56.250 kHz    148.500000 MHz (native)
    VIC  16:  1920x1080   60.000000 Hz  16:9     67.500 kHz    148.500000 MHz (native)
    VIC   1:   640x480    59.940476 Hz   4:3     31.469 kHz     25.175000 MHz
  Vendor-Specific Data Block (HDMI), OUI 00-0C-03:
    Source physical address: 2.0.0.0
    Supports_AI
  Detailed Timing Descriptors:
    DTD  3:  1152x864    74.815838 Hz   4:3     67.708 kHz    104.000000 MHz (160 mm x 90 mm)
                  Hfront  192 Hsync 120 Hback   72 Hpol N
                  Vfront   34 Vsync   4 Vback    3 Vpol P
    DTD  4:  1280x768    74.893062 Hz   5:3     60.289 kHz    102.250000 MHz (160 mm x 90 mm)
                  Hfront  208 Hsync 128 Hback   80 Hpol N
                  Vfront   27 Vsync   7 Vback    3 Vpol P
    DTD  5:  1280x960    59.939049 Hz   4:3     59.699 kHz    101.250000 MHz (160 mm x 90 mm)
                  Hfront  208 Hsync 128 Hback   80 Hpol N
                  Vfront   29 Vsync   4 Vback    3 Vpol P
    DTD  6:  1280x1024   59.894849 Hz   5:4     63.668 kHz    109.000000 MHz (160 mm x 90 mm)
                  Hfront  216 Hsync 136 Hback   80 Hpol N
                  Vfront   29 Vsync   7 Vback    3 Vpol P
    DTD  7:  1920x1080i  50.000000 Hz  16:9     28.125 kHz     74.250000 MHz (708 mm x 398 mm)
                  Hfront  528 Hsync  44 Hback  148 Hpol P
                  Vfront    2 Vsync   5 Vback   15 Vpol P Vfront +0.5 Odd Field
                  Vfront    2 Vsync   5 Vback   15 Vpol P Vback  +0.5 Even Field
Checksum: 0xbd  Unused space in Extension Block: 6 bytes

----------------

Block 2, Unknown EDID Extension Block 0x00:
  00 ff ff ff ff ff ff 00 1e 55 48 44 01 00 00 00 '.........UHD....'
  28 13 01 03 80 a0 5a 78 2a ec 6b a0 56 47 9c 25 '(.....Zx*.k.VG.%'
  10 48 4a 2f cf 00 45 4a 61 4c 01 01 01 01 71 40 '.HJ/..EJaL....q@'
  71 4a 01 01 01 01 1b 21 50 a0 51 00 1e 30 d0 88 'qJ.....!P.Q..0..'
  65 04 a0 5a 00 00 00 1c 0e 1f 00 80 51 00 1e 30 'e..Z........Q..0'
  c0 80 47 04 a0 5a 00 00 00 1c 00 00 00 fd 00 31 '..G..Z.........1'
  4c 0f 51 08 00 0a 20 20 20 20 20 20 00 00 00 fc 'L.Q...      ....'
  00 47 52 55 4e 44 49 47 20 57 55 58 47 41 01 12 '.GRUNDIG WUXGA..'
Checksum: 0x12

----------------

Block 3, CTA-861 Extension Block:
  Revision: 3
  Basic audio support
  Supports YCbCr 4:4:4
  Supports YCbCr 4:2:2
  Native detailed modes: 2
  Audio Data Block:
    Linear PCM:
      Max channels: 2
      Supported sample rates (kHz): 48 44.1 32
      Supported sample sizes (bits): 24 20 16
  Video Data Block:
    VIC  20:  1920x1080i  50.000000 Hz  16:9     28.125 kHz     74.250000 MHz
    VIC   5:  1920x1080i  60.000000 Hz  16:9     33.750 kHz     74.250000 MHz
    VIC  19:  1280x720    50.000000 Hz  16:9     37.500 kHz     74.250000 MHz
    VIC   4:  1280x720    60.000000 Hz  16:9     45.000 kHz     74.250000 MHz
    VIC  18:   720x576    50.000000 Hz  16:9     31.250 kHz     27.000000 MHz
    VIC   3:   720x480    59.940060 Hz  16:9     31.469 kHz     27.000000 MHz
    VIC  17:   720x576    50.000000 Hz   4:3     31.250 kHz     27.000000 MHz
    VIC   2:   720x480    59.940060 Hz   4:3     31.469 kHz     27.000000 MHz
    VIC  22:  1440x576i   50.000000 Hz  16:9     15.625 kHz     27.000000 MHz
    VIC   7:  1440x480i   59.940060 Hz  16:9     15.734 kHz     27.000000 MHz
    VIC  21:  1440x576i   50.000000 Hz   4:3     15.625 kHz     27.000000 MHz
    VIC   6:  1440x480i   59.940060 Hz   4:3     15.734 kHz     27.000000 MHz
    VIC  31:  1920x1080   50.000000 Hz  16:9     56.250 kHz    148.500000 MHz (native)
    VIC  16:  1920x1080   60.000000 Hz  16:9     67.500 kHz    148.500000 MHz (native)
    VIC   1:   640x480    59.940476 Hz   4:3     31.469 kHz     25.175000 MHz
  Vendor-Specific Data Block (HDMI), OUI 00-0C-03:
    Source physical address: 2.0.0.0
    Supports_AI
  Detailed Timing Descriptors:
    DTD  8:  1152x864    74.815838 Hz   4:3     67.708 kHz    104.000000 MHz (160 mm x 90 mm)
                  Hfront  192 Hsync 120 Hback   72 Hpol N
                  Vfront   34 Vsync   4 Vback    3 Vpol P
    DTD  9:  1280x768    74.893062 Hz   5:3     60.289 kHz    102.250000 MHz (160 mm x 90 mm)
                  Hfront  208 Hsync 128 Hback   80 Hpol N
                  Vfront   27 Vsync   7 Vback    3 Vpol P
    DTD 10:  1280x960    59.939049 Hz   4:3     59.699 kHz    101.250000 MHz (160 mm x 90 mm)
                  Hfront  208 Hsync 128 Hback   80 Hpol N
                  Vfront   29 Vsync   4 Vback    3 Vpol P
    DTD 11:  1280x1024   59.894849 Hz   5:4     63.668 kHz    109.000000 MHz (160 mm x 90 mm)
                  Hfront  216 Hsync 136 Hback   80 Hpol N
                  Vfront   29 Vsync   7 Vback    3 Vpol P
    DTD 12:  1920x1080i  50.000000 Hz  16:9     28.125 kHz     74.250000 MHz (708 mm x 398 mm)
                  Hfront  528 Hsync  44 Hback  148 Hpol P
                  Vfront    2 Vsync   5 Vback   15 Vpol P Vfront +0.5 Odd Field
                  Vfront    2 Vsync   5 Vback   15 Vpol P Vback  +0.5 Even Field
Checksum: 0xbd  Unused space in Extension Block: 6 bytes

----------------

Warnings:

Block 0, Base EDID:
  Vendor & Product Identification: The serial number is one of the known dummy values, it should probably be set to 0.
  Detailed Timing Descriptor #1: Dubious image size (160x90 mm is smaller than 100x100 mm).
  Detailed Timing Descriptor #2: DTD is similar but not identical to DMT 0x17.
  Detailed Timing Descriptor #2: Dubious image size (160x90 mm is smaller than 100x100 mm).
Block 1, CTA-861 Extension Block:
  IT Video Formats are overscanned by default, but normally this should be underscanned.
  Video Data Block: VIC 20 and the first DTD are not identical. Is this intended?
  Detailed Timing Descriptor #3: Dubious image size (160x90 mm is smaller than 100x100 mm).
  Detailed Timing Descriptor #4: DTD is similar but not identical to DMT 0x18.
  Detailed Timing Descriptor #4: Dubious image size (160x90 mm is smaller than 100x100 mm).
  Detailed Timing Descriptor #5: Dubious image size (160x90 mm is smaller than 100x100 mm).
  Detailed Timing Descriptor #6: Dubious image size (160x90 mm is smaller than 100x100 mm).
  Add a Colorimetry Data Block with the sRGB colorimetry bit set to avoid interop issues.
Block 3, CTA-861 Extension Block:
  IT Video Formats are overscanned by default, but normally this should be underscanned.
  Detailed Timing Descriptor #8: Dubious image size (160x90 mm is smaller than 100x100 mm).
  Detailed Timing Descriptor #9: DTD is similar but not identical to DMT 0x18.
  Detailed Timing Descriptor #9: Dubious image size (160x90 mm is smaller than 100x100 mm).
  Detailed Timing Descriptor #10: Dubious image size (160x90 mm is smaller than 100x100 mm).
  Detailed Timing Descriptor #11: Dubious image size (160x90 mm is smaller than 100x100 mm).
EDID:
  Base EDID: Some timings are out of range of the Monitor Ranges:
    Maximum Clock: 148.500 MHz (Monitor: 80.000 MHz)

Failures:

Block 0, Base EDID:
  Detailed Timing Descriptor #1: Mismatch of image size 160x90 mm vs display size 1600x900 mm.
  Detailed Timing Descriptor #2: Mismatch of image size 160x90 mm vs display size 1600x900 mm.
Block 1, CTA-861 Extension Block:
  Detailed Timing Descriptor #3: Mismatch of image size 160x90 mm vs display size 1600x900 mm.
  Detailed Timing Descriptor #4: Mismatch of image size 160x90 mm vs display size 1600x900 mm.
  Detailed Timing Descriptor #5: Mismatch of image size 160x90 mm vs display size 1600x900 mm.
  Detailed Timing Descriptor #6: Mismatch of image size 160x90 mm vs display size 1600x900 mm.
  Detailed Timing Descriptor #7: Mismatch of image size 708x398 mm vs display size 1600x900 mm.
  Missing VCDB, needed for Set Selectable RGB Quantization to avoid interop issues.
Block 2, Base EDID:
  Unknown Extension Block.
Block 3, CTA-861 Extension Block:
  Video Data Block: Duplicate VIC 20.
  Video Data Block: Duplicate VIC 5.
  Video Data Block: Duplicate VIC 19.
  Video Data Block: Duplicate VIC 4.
  Video Data Block: Duplicate VIC 18.
  Video Data Block: Duplicate VIC 3.
  Video Data Block: Duplicate VIC 17.
  Video Data Block: Duplicate VIC 2.
  Video Data Block: Duplicate VIC 22.
  Video Data Block: Duplicate VIC 7.
  Video Data Block: Duplicate VIC 21.
  Video Data Block: Duplicate VIC 6.
  Video Data Block: Duplicate VIC 31.
  Video Data Block: Duplicate VIC 16.
  Video Data Block: Duplicate VIC 1.
  Detailed Timing Descriptor #8: Mismatch of image size 160x90 mm vs display size 1600x900 mm.
  Detailed Timing Descriptor #9: Mismatch of image size 160x90 mm vs display size 1600x900 mm.
  Detailed Timing Descriptor #10: Mismatch of image size 160x90 mm vs display size 1600x900 mm.
  Detailed Timing Descriptor #11: Mismatch of image size 160x90 mm vs display size 1600x900 mm.
  Detailed Timing Descriptor #12: Mismatch of image size 708x398 mm vs display size 1600x900 mm.
EDID:
  Base EDID: EDID specified 1 extension block(s), but found 3 extension block(s).
  Base EDID: EDID 1.3 requires a Block Map Extension in Block 1 if there are more than 2 blocks in the EDID.
  CTA-861: Native progressive timings are a mix of several resolutions.

EDID conformity: FAIL
