edid-decode (hex):

00 ff ff ff ff ff ff 00 1e 55 48 44 01 00 00 00
15 17 01 03 80 a0 5a 78 2a ec 6b a0 56 47 9c 25
10 48 4a 27 cf 00 01 01 01 01 81 40 81 80 81 8f
8b 00 01 01 a9 40 02 3a 80 d0 72 38 2d 40 10 2c
45 80 a0 5a 00 00 00 1e 02 3a 80 18 71 38 2d 40
58 2c 45 00 a0 5a 00 00 00 1e 00 00 00 fd 00 31
4c 0f 51 08 00 0a 20 20 20 20 20 20 00 00 00 fc
00 47 52 55 4e 44 49 47 20 57 55 58 47 41 01 95

02 03 22 72 4f 14 05 13 04 12 03 11 02 16 07 15
06 01 9f 90 26 15 07 50 09 07 07 66 03 0c 00 30
00 80 1b 21 50 a0 51 00 1e 30 d0 88 65 04 a0 5a
00 00 00 1c 0e 1f 00 80 51 00 1e 30 c0 80 47 04
a0 5a 00 00 00 1c a0 28 80 80 41 60 29 30 c0 78
24 08 a0 5a 00 00 00 1c 8f 2f 78 d0 51 1a 27 40
e8 90 04 08 a0 90 00 00 00 1c 9a 29 a0 d0 51 84
22 30 e8 98 96 04 a0 90 00 00 00 1c 00 00 00 57

00 ff ff ff ff ff ff 00 1e 55 48 44 01 00 00 00
15 17 01 03 80 a0 5a 78 2a ec 6b a0 56 47 9c 25
10 48 4a 27 cf 00 01 01 01 01 81 40 81 80 81 8f
8b 00 01 01 a9 40 02 3a 80 d0 72 38 2d 40 10 2c
45 80 a0 5a 00 00 00 1e 02 3a 80 18 71 38 2d 40
58 2c 45 00 a0 5a 00 00 00 1e 00 00 00 fd 00 31
4c 0f 51 08 00 0a 20 20 20 20 20 20 00 00 00 fc
00 47 52 55 4e 44 49 47 20 57 55 58 47 41 01 95

02 03 22 72 4f 14 05 13 04 12 03 11 02 16 07 15
06 01 9f 90 26 15 07 50 09 07 07 66 03 0c 00 30
00 80 1b 21 50 a0 51 00 1e 30 d0 88 65 04 a0 5a
00 00 00 1c 0e 1f 00 80 51 00 1e 30 c0 80 47 04
a0 5a 00 00 00 1c a0 28 80 80 41 60 29 30 c0 78
24 08 a0 5a 00 00 00 1c 8f 2f 78 d0 51 1a 27 40
e8 90 04 08 a0 90 00 00 00 1c 9a 29 a0 d0 51 84
22 30 e8 98 96 04 a0 90 00 00 00 1c 00 00 00 57

----------------

Block 0, Base EDID:
  EDID Structure Version & Revision: 1.3
  Vendor & Product Identification:
    Manufacturer: GRU
    Model: 17480
    Serial Number: ...
    Made in: week 21 of 2013
  Basic Display Parameters & Features:
    Digital display
    Maximum image size: 160 cm x 90 cm
    Gamma: 2.20
    DPMS levels: Off
    RGB color display
    First detailed timing is the preferred timing
  Color Characteristics:
    Red  : 0.6279, 0.3378
    Green: 0.2802, 0.6093
    Blue : 0.1455, 0.0644
    White: 0.2832, 0.2919
  Established Timings I & II:
    DMT 0x04:   640x480    59.940476 Hz   4:3     31.469 kHz     25.175000 MHz
    DMT 0x06:   640x480    75.000000 Hz   4:3     37.500 kHz     31.500000 MHz
    DMT 0x08:   800x600    56.250000 Hz   4:3     35.156 kHz     36.000000 MHz
    DMT 0x09:   800x600    60.316541 Hz   4:3     37.879 kHz     40.000000 MHz
    DMT 0x0a:   800x600    72.187572 Hz   4:3     48.077 kHz     50.000000 MHz
    DMT 0x0b:   800x600    75.000000 Hz   4:3     46.875 kHz     49.500000 MHz
    DMT 0x10:  1024x768    60.003840 Hz   4:3     48.363 kHz     65.000000 MHz
    DMT 0x11:  1024x768    70.069359 Hz   4:3     56.476 kHz     75.000000 MHz
    DMT 0x12:  1024x768    75.028582 Hz   4:3     60.023 kHz     78.750000 MHz
    DMT 0x24:  1280x1024   75.024675 Hz   5:4     79.976 kHz    135.000000 MHz
  Standard Timings:
    DMT 0x20:  1280x960    60.000000 Hz   4:3     60.000 kHz    108.000000 MHz
    DMT 0x23:  1280x1024   60.019740 Hz   5:4     63.981 kHz    108.000000 MHz
    DMT 0x24:  1280x1024   75.024675 Hz   5:4     79.976 kHz    135.000000 MHz
    GTF     :  1360x850    60.000254 Hz  16:10    52.800 kHz     94.618000 MHz
    DMT 0x33:  1600x1200   60.000000 Hz   4:3     75.000 kHz    162.000000 MHz
  Detailed Timing Descriptors:
    DTD 1:  1920x1080   50.000000 Hz  16:9     56.250 kHz    148.500000 MHz (160 mm x 90 mm)
                 Hfront  528 Hsync  44 Hback  148 Hpol P
                 Vfront    4 Vsync   5 Vback   36 Vpol P
    DTD 2:  1920x1080   60.000000 Hz  16:9     67.500 kHz    148.500000 MHz (160 mm x 90 mm)
                 Hfront   88 Hsync  44 Hback  148 Hpol P
                 Vfront    4 Vsync   5 Vback   36 Vpol P
    Display Range Limits:
      Monitor ranges (GTF): 49-76 Hz V, 15-81 kHz H, max dotclock 80 MHz
    Display Product Name: 'GRUNDIG WUXGA'
  Extension blocks: 1
Checksum: 0x95

----------------

Block 1, CTA-861 Extension Block:
  Revision: 3
  Basic audio support
  Supports YCbCr 4:4:4
  Supports YCbCr 4:2:2
  Native DTDs: 2
  Video Data Block:
    VIC  20:  1920x1080i  50.000000 Hz  16:9     28.125 kHz     74.250000 MHz
    VIC   5:  1920x1080i  60.000000 Hz  16:9     33.750 kHz     74.250000 MHz
    VIC  19:  1280x720    50.000000 Hz  16:9     37.500 kHz     74.250000 MHz
    VIC   4:  1280x720    60.000000 Hz  16:9     45.000 kHz     74.250000 MHz
    VIC  18:   720x576    50.000000 Hz  16:9     31.250 kHz     27.000000 MHz
    VIC   3:   720x480    59.940060 Hz  16:9     31.469 kHz     27.000000 MHz
    VIC  17:   720x576    50.000000 Hz   4:3     31.250 kHz     27.000000 MHz
    VIC   2:   720x480    59.940060 Hz   4:3     31.469 kHz     27.000000 MHz
    VIC  22:  1440x576i   50.000000 Hz  16:9     15.625 kHz     27.000000 MHz
    VIC   7:  1440x480i   59.940060 Hz  16:9     15.734 kHz     27.000000 MHz
    VIC  21:  1440x576i   50.000000 Hz   4:3     15.625 kHz     27.000000 MHz
    VIC   6:  1440x480i   59.940060 Hz   4:3     15.734 kHz     27.000000 MHz
    VIC   1:   640x480    59.940476 Hz   4:3     31.469 kHz     25.175000 MHz
    VIC  31:  1920x1080   50.000000 Hz  16:9     56.250 kHz    148.500000 MHz (native)
    VIC  16:  1920x1080   60.000000 Hz  16:9     67.500 kHz    148.500000 MHz (native)
  Audio Data Block:
    AC-3:
      Max channels: 6
      Supported sample rates (kHz): 48 44.1 32
      Maximum bit rate: 640 kb/s
    Linear PCM:
      Max channels: 2
      Supported sample rates (kHz): 48 44.1 32
      Supported sample sizes (bits): 24 20 16
  Vendor-Specific Data Block (HDMI), OUI 00-0C-03:
    Source physical address: 3.0.0.0
    Supports_AI
  Detailed Timing Descriptors:
    DTD 3:  1360x768    59.798991 Hz  85:48    47.720 kHz     84.750000 MHz (160 mm x 90 mm)
                 Hfront  208 Hsync 136 Hback   72 Hpol N
                 Vfront   22 Vsync   5 Vback    3 Vpol P
    DTD 4:  1280x768    59.870228 Hz   5:3     47.776 kHz     79.500000 MHz (160 mm x 90 mm)
                 Hfront  192 Hsync 128 Hback   64 Hpol N
                 Vfront   20 Vsync   7 Vback    3 Vpol P
    DTD 5:  1152x864    74.815838 Hz   4:3     67.708 kHz    104.000000 MHz (160 mm x 90 mm)
                 Hfront  192 Hsync 120 Hback   72 Hpol N
                 Vfront   34 Vsync   4 Vback    3 Vpol P
    DTD 6:  1400x1050   59.978442 Hz   4:3     65.317 kHz    121.750000 MHz (160 mm x 144 mm)
                 Hfront  232 Hsync 144 Hback   88 Hpol N
                 Vfront   32 Vsync   4 Vback    3 Vpol P
    DTD 7:  1440x900    59.887445 Hz  16:10    55.935 kHz    106.500000 MHz (160 mm x 144 mm)
                 Hfront  232 Hsync 152 Hback   80 Hpol N
                 Vfront   25 Vsync   6 Vback    3 Vpol P
Checksum: 0x57  Unused space in Extension Block: 3 bytes

----------------

Warnings:

Block 0, Base EDID:
  Vendor & Product Identification: The serial number is one of the known dummy values, it should probably be set to 0.
  Detailed Timing Descriptor #1: Dubious image size (160x90 mm is smaller than 100x100 mm).
  Detailed Timing Descriptor #2: Dubious image size (160x90 mm is smaller than 100x100 mm).
Block 1, CTA-861 Extension Block:
  IT Video Formats are overscanned by default, but normally this should be underscanned.
  Video Data Block: VIC 20 and the first DTD are not identical. Is this intended?
  Detailed Timing Descriptor #3: Dubious image size (160x90 mm is smaller than 100x100 mm).
  Detailed Timing Descriptor #4: DTD is similar but not identical to DMT 0x17.
  Detailed Timing Descriptor #4: Dubious image size (160x90 mm is smaller than 100x100 mm).
  Detailed Timing Descriptor #5: Dubious image size (160x90 mm is smaller than 100x100 mm).
  Detailed Timing Descriptor #6: DTD is similar but not identical to DMT 0x2a.
  Detailed Timing Descriptor #6: Image size is 160x144 mm, but based on the picture AR it should be 160x120 mm.
  Detailed Timing Descriptor #7: DTD is similar but not identical to DMT 0x2f.
  Detailed Timing Descriptor #7: Image size is 160x144 mm, but based on the picture AR it should be 160x100 mm.
  Add a Colorimetry Data Block with the sRGB colorimetry bit set to avoid interop issues.
EDID:
  Base EDID: Some timings are out of range of the Monitor Ranges:
    Maximum Clock: 162.000 MHz (Monitor: 80.000 MHz)

Failures:

Block 0, Base EDID:
  Detailed Timing Descriptor #1: Mismatch of image size 160x90 mm vs display size 1600x900 mm.
  Detailed Timing Descriptor #2: Mismatch of image size 160x90 mm vs display size 1600x900 mm.
Block 1, CTA-861 Extension Block:
  Detailed Timing Descriptor #3: Mismatch of image size 160x90 mm vs display size 1600x900 mm.
  Detailed Timing Descriptor #4: Mismatch of image size 160x90 mm vs display size 1600x900 mm.
  Detailed Timing Descriptor #5: Mismatch of image size 160x90 mm vs display size 1600x900 mm.
  Detailed Timing Descriptor #6: Mismatch of image size 160x144 mm vs display size 1600x900 mm.
  Detailed Timing Descriptor #7: Mismatch of image size 160x144 mm vs display size 1600x900 mm.
  Missing VCDB, needed for Set Selectable RGB Quantization to avoid interop issues.
EDID:
  Extension Block 2 started with EDID header, ignoring Extension Blocks >= 2.

EDID conformity: FAIL
