edid-decode (hex):

00 ff ff ff ff ff ff 00 06 af ab a7 00 00 00 00
10 21 01 04 a5 22 16 78 02 a9 35 a7 54 49 9f 25
0f 50 54 00 00 00 01 01 01 01 01 01 01 01 01 01
01 01 01 01 01 01 fa 3c 80 b8 70 b0 24 40 10 10
3e 00 58 d7 10 00 00 1a c8 30 80 b8 70 b0 24 40
10 10 3e 00 58 d7 10 00 00 1a 00 00 00 fe 00 56
31 59 4a 38 80 42 31 36 30 55 41 54 00 00 00 00
00 03 81 02 9e 00 11 00 00 0a 41 0a 20 20 00 48

00 ff ff ff ff ff ff 00 06 af ab a7 00 00 00 00
10 21 01 04 a5 22 16 78 02 a9 35 a7 54 49 9f 25
0f 50 54 00 00 00 01 01 01 01 01 01 01 01 01 01
01 01 01 01 01 01 fa 3c 80 b8 70 b0 24 40 10 10
3e 00 58 d7 10 00 00 1a c8 30 80 b8 70 b0 24 40
10 10 3e 00 58 d7 10 00 00 1a 00 00 00 fe 00 56
31 59 4a 38 80 42 31 36 30 55 41 54 00 00 00 00
00 03 81 02 9e 00 11 00 00 0a 41 0a 20 20 00 48

----------------

Block 0, Base EDID:
  EDID Structure Version & Revision: 1.4
  Vendor & Product Identification:
    Manufacturer: AUO
    Model: 42923
    Made in: week 16 of 2023
  Basic Display Parameters & Features:
    Digital display
    Bits per primary color channel: 8
    DisplayPort interface
    Maximum image size: 34 cm x 22 cm
    Gamma: 2.20
    Supported color formats: RGB 4:4:4
    First detailed timing includes the native pixel format and preferred refresh rate
  Color Characteristics:
    Red  : 0.6542, 0.3300
    Green: 0.2871, 0.6220
    Blue : 0.1445, 0.0615
    White: 0.3134, 0.3291
  Established Timings I & II: none
  Standard Timings: none
  Detailed Timing Descriptors:
    DTD 1:  1920x1200   60.025902 Hz  16:10    74.192 kHz    156.100000 MHz (344 mm x 215 mm)
                 Hfront   16 Hsync  16 Hback  152 Hpol P
                 Vfront    3 Vsync  14 Vback   19 Vpol N
    DTD 2:  1920x1200   48.020722 Hz  16:10    59.354 kHz    124.880000 MHz (344 mm x 215 mm)
                 Hfront   16 Hsync  16 Hback  152 Hpol P
                 Vfront    3 Vsync  14 Vback   19 Vpol N
    Alphanumeric Data String: 'V1YJ8.B160UAT'
    Manufacturer-Specified Display Descriptor (0x00): 00 00 00 03 81 02 9e 00 11 00 00 0a 41 0a 20 20 '............A.  '
Checksum: 0x48

----------------

Block 1, Unknown EDID Extension Block 0x00:
  00 ff ff ff ff ff ff 00 06 af ab a7 00 00 00 00 '................'
  10 21 01 04 a5 22 16 78 02 a9 35 a7 54 49 9f 25 '.!...".x..5.TI.%'
  0f 50 54 00 00 00 01 01 01 01 01 01 01 01 01 01 '.PT.............'
  01 01 01 01 01 01 fa 3c 80 b8 70 b0 24 40 10 10 '.......<..p.$@..'
  3e 00 58 d7 10 00 00 1a c8 30 80 b8 70 b0 24 40 '>.X......0..p.$@'
  10 10 3e 00 58 d7 10 00 00 1a 00 00 00 fe 00 56 '..>.X..........V'
  31 59 4a 38 80 42 31 36 30 55 41 54 00 00 00 00 '1YJ8.B160UAT....'
  00 03 81 02 9e 00 11 00 00 0a 41 0a 20 20 00 48 '..........A.  .H'
Checksum: 0x48

----------------

Warnings:

Block 0, Base EDID:
  Alphanumeric Data String: Non-ASCII character 0x80 at position 5, can cause problems.
  Missing Display Product Name.

Failures:

Block 1, Base EDID:
  Unknown Extension Block.
EDID:
  Base EDID: EDID specified 0 extension block(s), but found 1 extension block(s).

EDID conformity: FAIL
