edid-decode (hex):

00 ff ff ff ff ff ff 00 1e e4 60 21 06 02 33 37
10 22 01 03 80 22 16 78 2e 7c e5 a4 55 4c 9f 26
0f 50 54 21 08 00 d1 00 b3 00 95 00 81 00 01 01
01 01 01 01 01 01 9c 68 00 a0 a0 40 29 60 30 20
35 00 59 d7 10 00 00 1a 00 00 00 fc 00 41 52 5a
4f 50 41 0a 20 20 20 20 20 20 00 00 00 ff 00 65
cb 46 16 33 2a 43 53 20 20 20 20 20 00 00 00 fd
00 30 3f 1e 6e 28 00 0a 20 20 20 20 20 20 01 0c

02 03 31 f1 45 90 01 02 03 04 e2 00 d5 e3 05 c0
00 23 09 7f 07 83 01 00 00 67 03 0c 00 10 00 18
3c e6 06 05 01 62 62 00 68 1a 00 00 01 01 30 3c
e6 6a 5e 00 a0 a0 a0 29 50 30 20 35 00 59 d7 10
00 00 1a 00 00 00 00 00 00 00 00 00 00 00 00 00
00 00 00 00 00 00 00 00 00 00 00 00 00 00 00 00
00 00 00 00 00 00 00 00 00 00 00 00 00 00 00 00
00 00 00 00 00 00 00 00 00 00 00 00 00 00 00 ff

00 ff ff ff ff ff ff 00 1e e4 60 21 06 02 33 37
10 22 01 03 80 22 16 78 2e 7c e5 a4 55 4c 9f 26
0f 50 54 21 08 00 d1 00 b3 00 95 00 81 00 01 01
01 01 01 01 01 01 9c 68 00 a0 a0 40 29 60 30 20
35 00 59 d7 10 00 00 1a 00 00 00 fc 00 41 52 5a
4f 50 41 0a 20 20 20 20 20 20 00 00 00 ff 00 65
cb 46 16 33 2a 43 53 20 20 20 20 20 00 00 00 fd
00 30 3f 1e 6e 28 00 0a 20 20 20 20 20 20 01 0c

02 03 31 f1 45 90 01 02 03 04 e2 00 d5 e3 05 c0
00 23 09 7f 07 83 01 00 00 67 03 0c 00 10 00 18
3c e6 06 05 01 62 62 00 68 1a 00 00 01 01 30 3c
e6 6a 5e 00 a0 a0 a0 29 50 30 20 35 00 59 d7 10
00 00 1a 00 00 00 00 00 00 00 00 00 00 00 00 00
00 00 00 00 00 00 00 00 00 00 00 00 00 00 00 00
00 00 00 00 00 00 00 00 00 00 00 00 00 00 00 00
00 00 00 00 00 00 00 00 00 00 00 00 00 00 00 ff

----------------

Block 0, Base EDID:
  EDID Structure Version & Revision: 1.3
  Vendor & Product Identification:
    Manufacturer: GWD
    Model: 8544
    Serial Number: ...
    Made in: week 16 of 2024
  Basic Display Parameters & Features:
    Digital display
    Maximum image size: 34 cm x 22 cm
    Gamma: 2.20
    DPMS levels: Off
    RGB color display
    Default (sRGB) color space is primary color space
    First detailed timing is the preferred timing
  Color Characteristics:
    Red  : 0.6416, 0.3349
    Green: 0.2998, 0.6210
    Blue : 0.1513, 0.0605
    White: 0.3134, 0.3291
  Established Timings I & II:
    DMT 0x04:   640x480    59.940476 Hz   4:3     31.469 kHz     25.175000 MHz
    DMT 0x09:   800x600    60.316541 Hz   4:3     37.879 kHz     40.000000 MHz
    DMT 0x10:  1024x768    60.003840 Hz   4:3     48.363 kHz     65.000000 MHz
  Standard Timings:
    DMT 0x45:  1920x1200   59.884600 Hz  16:10    74.556 kHz    193.250000 MHz
    DMT 0x3a:  1680x1050   59.954250 Hz  16:10    65.290 kHz    146.250000 MHz
    DMT 0x2f:  1440x900    59.887445 Hz  16:10    55.935 kHz    106.500000 MHz
    DMT 0x1c:  1280x800    59.810326 Hz  16:10    49.702 kHz     83.500000 MHz
  Detailed Timing Descriptors:
    DTD 1:  2560x1600   59.997491 Hz  16:10    98.456 kHz    267.800000 MHz (345 mm x 215 mm)
                 Hfront   48 Hsync  32 Hback   80 Hpol P
                 Vfront    3 Vsync   5 Vback   33 Vpol N
    Display Product Name: 'ARZOPA'
    Display Product Serial Number: ...
    Display Range Limits:
      Monitor ranges (GTF): 48-63 Hz V, 30-110 kHz H, max dotclock 400 MHz
  Extension blocks: 1
Checksum: 0x0c

----------------

Block 1, CTA-861 Extension Block:
  Revision: 3
  Underscans IT Video Formats by default
  Basic audio support
  Supports YCbCr 4:4:4
  Supports YCbCr 4:2:2
  Native detailed modes: 1
  Video Data Block:
    VIC  16:  1920x1080   60.000000 Hz  16:9     67.500 kHz    148.500000 MHz (native)
    VIC   1:   640x480    59.940476 Hz   4:3     31.469 kHz     25.175000 MHz
    VIC   2:   720x480    59.940060 Hz   4:3     31.469 kHz     27.000000 MHz
    VIC   3:   720x480    59.940060 Hz  16:9     31.469 kHz     27.000000 MHz
    VIC   4:  1280x720    60.000000 Hz  16:9     45.000 kHz     74.250000 MHz
  Video Capability Data Block:
    YCbCr quantization: Selectable (via AVI YQ)
    RGB quantization: Selectable (via AVI Q)
    PT scan behavior: Always Overscanned
    IT scan behavior: Always Overscanned
    CE scan behavior: Always Overscanned
  Colorimetry Data Block:
    BT2020YCC
    BT2020RGB
  Audio Data Block:
    Linear PCM:
      Max channels: 2
      Supported sample rates (kHz): 192 176.4 96 88.2 48 44.1 32
      Supported sample sizes (bits): 24 20 16
  Speaker Allocation Data Block:
    FL/FR - Front Left/Right
  Vendor-Specific Data Block (HDMI), OUI 00-0C-03:
    Source physical address: 1.0.0.0
    DC_30bit
    DC_Y444
    Maximum TMDS clock: 300 MHz
  HDR Static Metadata Data Block:
    Electro optical transfer functions:
      Traditional gamma - SDR luminance range
      SMPTE ST2084
    Supported static metadata descriptors:
      Static metadata type 1
    Desired content max luminance: 98 (417.710 cd/m^2)
    Desired content max frame-average luminance: 98 (417.710 cd/m^2)
    Desired content min luminance: 0 (0.000 cd/m^2)
  Vendor-Specific Data Block (AMD), OUI 00-00-1A:
    Version: 1
    Feature Caps: 0x01
    Minimum Refresh Rate: 48 Hz
    Maximum Refresh Rate: 60 Hz
    Flags 1.x: 0xe6 (MCCS)
  Detailed Timing Descriptors:
    DTD 2:  2560x1440   60.000199 Hz  16:9     88.860 kHz    241.700000 MHz (345 mm x 215 mm)
                 Hfront   48 Hsync  32 Hback   80 Hpol P
                 Vfront    3 Vsync   5 Vback   33 Vpol N
Checksum: 0xff  Unused space in Extension Block: 60 bytes

----------------

Block 2, Unknown EDID Extension Block 0x00:
  00 ff ff ff ff ff ff 00 1e e4 60 21 06 02 33 37 '..........`!..37'
  10 22 01 03 80 22 16 78 2e 7c e5 a4 55 4c 9f 26 '."...".x.|..UL.&'
  0f 50 54 21 08 00 d1 00 b3 00 95 00 81 00 01 01 '.PT!............'
  01 01 01 01 01 01 9c 68 00 a0 a0 40 29 60 30 20 '.......h...@)`0 '
  35 00 59 d7 10 00 00 1a 00 00 00 fc 00 41 52 5a '5.Y..........ARZ'
  4f 50 41 0a 20 20 20 20 20 20 00 00 00 ff 00 65 'OPA.      .....e'
  cb 46 16 33 2a 43 53 20 20 20 20 20 00 00 00 fd '.F.3*CS     ....'
  00 30 3f 1e 6e 28 00 0a 20 20 20 20 20 20 01 0c '.0?.n(..      ..'
Checksum: 0x0c

----------------

Block 3, CTA-861 Extension Block:
  Revision: 3
  Underscans IT Video Formats by default
  Basic audio support
  Supports YCbCr 4:4:4
  Supports YCbCr 4:2:2
  Native detailed modes: 1
  Video Data Block:
    VIC  16:  1920x1080   60.000000 Hz  16:9     67.500 kHz    148.500000 MHz (native)
    VIC   1:   640x480    59.940476 Hz   4:3     31.469 kHz     25.175000 MHz
    VIC   2:   720x480    59.940060 Hz   4:3     31.469 kHz     27.000000 MHz
    VIC   3:   720x480    59.940060 Hz  16:9     31.469 kHz     27.000000 MHz
    VIC   4:  1280x720    60.000000 Hz  16:9     45.000 kHz     74.250000 MHz
  Video Capability Data Block:
    YCbCr quantization: Selectable (via AVI YQ)
    RGB quantization: Selectable (via AVI Q)
    PT scan behavior: Always Overscanned
    IT scan behavior: Always Overscanned
    CE scan behavior: Always Overscanned
  Colorimetry Data Block:
    BT2020YCC
    BT2020RGB
  Audio Data Block:
    Linear PCM:
      Max channels: 2
      Supported sample rates (kHz): 192 176.4 96 88.2 48 44.1 32
      Supported sample sizes (bits): 24 20 16
  Speaker Allocation Data Block:
    FL/FR - Front Left/Right
  Vendor-Specific Data Block (HDMI), OUI 00-0C-03:
    Source physical address: 1.0.0.0
    DC_30bit
    DC_Y444
    Maximum TMDS clock: 300 MHz
  HDR Static Metadata Data Block:
    Electro optical transfer functions:
      Traditional gamma - SDR luminance range
      SMPTE ST2084
    Supported static metadata descriptors:
      Static metadata type 1
    Desired content max luminance: 98 (417.710 cd/m^2)
    Desired content max frame-average luminance: 98 (417.710 cd/m^2)
    Desired content min luminance: 0 (0.000 cd/m^2)
  Vendor-Specific Data Block (AMD), OUI 00-00-1A:
    Version: 1
    Feature Caps: 0x01
    Minimum Refresh Rate: 48 Hz
    Maximum Refresh Rate: 60 Hz
    Flags 1.x: 0xe6 (MCCS)
  Detailed Timing Descriptors:
    DTD 3:  2560x1440   60.000199 Hz  16:9     88.860 kHz    241.700000 MHz (345 mm x 215 mm)
                 Hfront   48 Hsync  32 Hback   80 Hpol P
                 Vfront    3 Vsync   5 Vback   33 Vpol N
Checksum: 0xff  Unused space in Extension Block: 60 bytes

----------------

Warnings:

Block 0, Base EDID:
  Display Product Serial Number: ...
  Display Product Serial Number: ...
Block 1, CTA-861 Extension Block:
  Video Data Block: VIC 16 and the first DTD are not identical. Is this intended?
  Video Capability Data Block: IT scan behavior is expected to support underscanned.
  Video Capability Data Block: S_PT is equal to S_IT and S_CE, so should be set to 0 instead.
  Detailed Timing Descriptor #2: Image size is 345x215 mm, but based on the picture AR it should be 345x194 mm.
  Display Product Serial Number is set, so the Serial Number in the Base EDID should be 0.
Block 3, CTA-861 Extension Block:
  Video Capability Data Block: IT scan behavior is expected to support underscanned.
  Video Capability Data Block: S_PT is equal to S_IT and S_CE, so should be set to 0 instead.
  Detailed Timing Descriptor #3: Image size is 345x215 mm, but based on the picture AR it should be 345x194 mm.

Failures:

Block 0, Base EDID:
  Display Product Serial Number: ...
  Basic Display Parameters & Features: sRGB is signaled, but the chromaticities do not match.
Block 1, CTA-861 Extension Block:
  Video Capability Data Block: IT video formats are always overscanned, but bit 7 of Byte 3 of the CTA-861 Extension header is set to underscanned.
Block 2, Base EDID:
  Unknown Extension Block.
Block 3, CTA-861 Extension Block:
  Video Data Block: Duplicate VIC 16.
  Video Data Block: Duplicate VIC 1.
  Video Data Block: Duplicate VIC 2.
  Video Data Block: Duplicate VIC 3.
  Video Data Block: Duplicate VIC 4.
  Video Capability Data Block: Only one instance of this Data Block is allowed.
  Video Capability Data Block: IT video formats are always overscanned, but bit 7 of Byte 3 of the CTA-861 Extension header is set to underscanned.
  Colorimetry Data Block: Only one instance of this Data Block is allowed.
  Speaker Allocation Data Block: Only one instance of this Data Block is allowed.
  HDR Static Metadata Data Block: Only one instance of this Data Block is allowed.
EDID:
  Base EDID: EDID specified 1 extension block(s), but found 3 extension block(s).
  Base EDID: EDID 1.3 requires a Block Map Extension in Block 1 if there are more than 2 blocks in the EDID.
  CTA-861: Native progressive timings are a mix of several resolutions.

EDID conformity: FAIL
