edid-decode (hex):

00 ff ff ff ff ff ff 00 41 0c 82 12 01 01 01 01
01 1f 01 03 80 90 51 78 0a 5c 10 ac 50 46 a7 27
0c 50 54 21 08 00 d1 c0 81 c0 01 01 01 01 01 01
01 01 01 01 01 01 08 e8 00 30 f2 70 5a 80 b0 58
8a 00 a0 2a 53 00 00 1e 6f c2 00 a0 a0 a0 55 50
30 20 35 00 a0 2a 53 00 00 1a 00 00 00 fc 00 50
68 69 6c 69 70 73 20 46 54 56 0a 20 00 00 00 fd
00 30 78 0f 46 3c 00 0a 20 20 20 20 20 20 01 3c

02 03 77 f1 5d 61 60 5d 5f 5e 76 75 10 1f 20 22
21 05 14 04 13 12 03 11 02 16 07 15 06 01 40 3f
29 2f 32 09 1f 07 15 07 50 3d 07 c0 57 06 01 5f
1f 01 67 04 03 83 01 00 00 6d 03 0c 00 20 00 38
3c 20 08 60 01 02 03 68 d8 5d c4 01 78 80 6b 00
e2 00 49 e2 0f 63 e3 05 c0 00 e3 06 0d 01 eb 01
46 d0 00 48 06 5b 88 53 57 8c e5 01 8b 84 90 01
e6 11 46 d0 00 70 00 00 00 00 00 00 00 00 00 e9

00 ff ff ff ff ff ff 00 41 0c 82 12 01 01 01 01
01 1f 01 03 80 90 51 78 0a 5c 10 ac 50 46 a7 27
0c 50 54 21 08 00 d1 c0 81 c0 01 01 01 01 01 01
01 01 01 01 01 01 08 e8 00 30 f2 70 5a 80 b0 58
8a 00 a0 2a 53 00 00 1e 6f c2 00 a0 a0 a0 55 50
30 20 35 00 a0 2a 53 00 00 1a 00 00 00 fc 00 50
68 69 6c 69 70 73 20 46 54 56 0a 20 00 00 00 fd
00 30 78 0f 46 3c 00 0a 20 20 20 20 20 20 01 3c

02 03 77 f1 5d 61 60 5d 5f 5e 76 75 10 1f 20 22
21 05 14 04 13 12 03 11 02 16 07 15 06 01 40 3f
29 2f 32 09 1f 07 15 07 50 3d 07 c0 57 06 01 5f
1f 01 67 04 03 83 01 00 00 6d 03 0c 00 20 00 38
3c 20 08 60 01 02 03 68 d8 5d c4 01 78 80 6b 00
e2 00 49 e2 0f 63 e3 05 c0 00 e3 06 0d 01 eb 01
46 d0 00 48 06 5b 88 53 57 8c e5 01 8b 84 90 01
e6 11 46 d0 00 70 00 00 00 00 00 00 00 00 00 e9

----------------

Block 0, Base EDID:
  EDID Structure Version & Revision: 1.3
  Vendor & Product Identification:
    Manufacturer: PHL
    Model: 4738
    Serial Number: ...
    Made in: week 1 of 2021
  Basic Display Parameters & Features:
    Digital display
    Maximum image size: 144 cm x 81 cm
    Gamma: 2.20
    RGB color display
    First detailed timing is the preferred timing
  Color Characteristics:
    Red  : 0.6728, 0.3134
    Green: 0.2763, 0.6523
    Blue : 0.1523, 0.0478
    White: 0.3125, 0.3281
  Established Timings I & II:
    DMT 0x04:   640x480    59.940476 Hz   4:3     31.469 kHz     25.175000 MHz
    DMT 0x09:   800x600    60.316541 Hz   4:3     37.879 kHz     40.000000 MHz
    DMT 0x10:  1024x768    60.003840 Hz   4:3     48.363 kHz     65.000000 MHz
  Standard Timings:
    DMT 0x52:  1920x1080   60.000000 Hz  16:9     67.500 kHz    148.500000 MHz
    DMT 0x55:  1280x720    60.000000 Hz  16:9     45.000 kHz     74.250000 MHz
  Detailed Timing Descriptors:
    DTD 1:  3840x2160   60.000000 Hz  16:9    135.000 kHz    594.000000 MHz (1440 mm x 810 mm)
                 Hfront  176 Hsync  88 Hback  296 Hpol P
                 Vfront    8 Vsync  10 Vback   72 Vpol P
    DTD 2:  2560x1440  119.997589 Hz  16:9    182.996 kHz    497.750000 MHz (1440 mm x 810 mm)
                 Hfront   48 Hsync  32 Hback   80 Hpol P
                 Vfront    3 Vsync   5 Vback   77 Vpol N
    Display Product Name: 'Philips FTV'
    Display Range Limits:
      Monitor ranges (GTF): 48-120 Hz V, 15-70 kHz H, max dotclock 600 MHz
  Extension blocks: 1
Checksum: 0x3c

----------------

Block 1, CTA-861 Extension Block:
  Revision: 3
  Underscans IT Video Formats by default
  Basic audio support
  Supports YCbCr 4:4:4
  Supports YCbCr 4:2:2
  Native detailed modes: 1
  Video Data Block:
    VIC  97:  3840x2160   60.000000 Hz  16:9    135.000 kHz    594.000000 MHz
    VIC  96:  3840x2160   50.000000 Hz  16:9    112.500 kHz    594.000000 MHz
    VIC  93:  3840x2160   24.000000 Hz  16:9     54.000 kHz    297.000000 MHz
    VIC  95:  3840x2160   30.000000 Hz  16:9     67.500 kHz    297.000000 MHz
    VIC  94:  3840x2160   25.000000 Hz  16:9     56.250 kHz    297.000000 MHz
    VIC 118:  3840x2160  120.000000 Hz  16:9    270.000 kHz   1188.000000 MHz
    VIC 117:  3840x2160  100.000000 Hz  16:9    225.000 kHz   1188.000000 MHz
    VIC  16:  1920x1080   60.000000 Hz  16:9     67.500 kHz    148.500000 MHz
    VIC  31:  1920x1080   50.000000 Hz  16:9     56.250 kHz    148.500000 MHz
    VIC  32:  1920x1080   24.000000 Hz  16:9     27.000 kHz     74.250000 MHz
    VIC  34:  1920x1080   30.000000 Hz  16:9     33.750 kHz     74.250000 MHz
    VIC  33:  1920x1080   25.000000 Hz  16:9     28.125 kHz     74.250000 MHz
    VIC   5:  1920x1080i  60.000000 Hz  16:9     33.750 kHz     74.250000 MHz
    VIC  20:  1920x1080i  50.000000 Hz  16:9     28.125 kHz     74.250000 MHz
    VIC   4:  1280x720    60.000000 Hz  16:9     45.000 kHz     74.250000 MHz
    VIC  19:  1280x720    50.000000 Hz  16:9     37.500 kHz     74.250000 MHz
    VIC  18:   720x576    50.000000 Hz  16:9     31.250 kHz     27.000000 MHz
    VIC   3:   720x480    59.940060 Hz  16:9     31.469 kHz     27.000000 MHz
    VIC  17:   720x576    50.000000 Hz   4:3     31.250 kHz     27.000000 MHz
    VIC   2:   720x480    59.940060 Hz   4:3     31.469 kHz     27.000000 MHz
    VIC  22:  1440x576i   50.000000 Hz  16:9     15.625 kHz     27.000000 MHz
    VIC   7:  1440x480i   59.940060 Hz  16:9     15.734 kHz     27.000000 MHz
    VIC  21:  1440x576i   50.000000 Hz   4:3     15.625 kHz     27.000000 MHz
    VIC   6:  1440x480i   59.940060 Hz   4:3     15.734 kHz     27.000000 MHz
    VIC   1:   640x480    59.940476 Hz   4:3     31.469 kHz     25.175000 MHz
    VIC  64:  1920x1080  100.000000 Hz  16:9    112.500 kHz    297.000000 MHz
    VIC  63:  1920x1080  120.000000 Hz  16:9    135.000 kHz    297.000000 MHz
    VIC  41:  1280x720   100.000000 Hz  16:9     75.000 kHz    148.500000 MHz
    VIC  47:  1280x720   120.000000 Hz  16:9     90.000 kHz    148.500000 MHz
  Audio Data Block:
    Linear PCM:
      Max channels: 2
      Supported sample rates (kHz): 96 88.2 48 44.1 32
      Supported sample sizes (bits): 24 20 16
    AC-3:
      Max channels: 6
      Supported sample rates (kHz): 48 44.1 32
      Maximum bit rate: 640 kb/s
    DTS:
      Max channels: 6
      Supported sample rates (kHz): 48 44.1 32
      Maximum bit rate: 1536 kb/s
    Enhanced AC-3 (DD+):
      Max channels: 8
      Supported sample rates (kHz): 48 44.1
      Supports Joint Object Coding
    DTS-HD:
      Max channels: 8
      Supported sample rates (kHz): 96 88.2 48 44.1 32
      Audio Format Code dependent value: 0x01
    MAT (MLP):
      Max channels: 8
      Supported sample rates (kHz): 48
      Supports Dolby TrueHD, object audio PCM and channel-based PCM
      Hash calculation not required for object audio PCM or channel-based PCM
  Speaker Allocation Data Block:
    FL/FR - Front Left/Right
  Vendor-Specific Data Block (HDMI), OUI 00-0C-03:
    Source physical address: 2.0.0.0
    DC_36bit
    DC_30bit
    DC_Y444
    Maximum TMDS clock: 300 MHz
    Extended HDMI video details:
      Base EDID image size is aspect ratio
      HDMI VICs:
        HDMI VIC 1:  3840x2160   30.000000 Hz  16:9     67.500 kHz    297.000000 MHz
        HDMI VIC 2:  3840x2160   25.000000 Hz  16:9     56.250 kHz    297.000000 MHz
        HDMI VIC 3:  3840x2160   24.000000 Hz  16:9     54.000 kHz    297.000000 MHz
  Vendor-Specific Data Block (HDMI Forum), OUI C4-5D-D8:
    Version: 1
    Maximum TMDS Character Rate: 600 MHz
    SCDC Present
    Max Fixed Rate Link: 3 and 6 Gbps per lane on 3 lanes, 6, 8, 10 and 12 Gbps on 4 lanes
    Supports UHD VIC
    Supports 12-bits/component Deep Color 4:2:0 Pixel Encoding
    Supports 10-bits/component Deep Color 4:2:0 Pixel Encoding
  Video Capability Data Block:
    YCbCr quantization: No Data
    RGB quantization: Selectable (via AVI Q)
    PT scan behavior: No Data
    IT scan behavior: Always Underscanned
    CE scan behavior: Always Overscanned
  YCbCr 4:2:0 Capability Map Data Block:
    VIC  97:  3840x2160   60.000000 Hz  16:9    135.000 kHz    594.000000 MHz
    VIC  96:  3840x2160   50.000000 Hz  16:9    112.500 kHz    594.000000 MHz
    VIC 118:  3840x2160  120.000000 Hz  16:9    270.000 kHz   1188.000000 MHz
    VIC 117:  3840x2160  100.000000 Hz  16:9    225.000 kHz   1188.000000 MHz
  Colorimetry Data Block:
    BT2020YCC
    BT2020RGB
  HDR Static Metadata Data Block:
    Electro optical transfer functions:
      Traditional gamma - SDR luminance range
      SMPTE ST2084
      Hybrid Log-Gamma
    Supported static metadata descriptors:
      Static metadata type 1
  Vendor-Specific Video Data Block (Dolby), OUI 00-D0-46:
    Version: 2 (12 bytes)
    Supports global dimming
    DM Version: 4.x
    Backlt Min Luma: 75 cd/m^2
    Interface: Standard + Low-Latency + Low-Latency-HDMI
    Supports 10b 12b 444: 10 bit
    Target Min PQ v2: 0 (0.00000000 cd/m^2)
    Target Max PQ v2: 2770 (499 cd/m^2)
    Unique Rx, Ry: 0.66406250, 0.31640625
    Unique Gx, Gy: 0.26562500, 0.66015625
    Unique Bx, By: 0.15234375, 0.04687500
  Vendor-Specific Video Data Block (HDR10+), OUI 90-84-8B:
    Application Version: 1
    Full Frame Peak Luminance Index: 0
    Peak Luminance Index: 0
  Vendor-Specific Audio Data Block (Dolby), OUI 00-D0-46:
    Version: 1 (7 bytes)
    Height speaker zone present
    Surround speaker zone present
    Center speaker zone present
Checksum: 0xe9  Unused space in Extension Block: 8 bytes

----------------

Block 2, Unknown EDID Extension Block 0x00:
  00 ff ff ff ff ff ff 00 41 0c 82 12 01 01 01 01 '........A.......'
  01 1f 01 03 80 90 51 78 0a 5c 10 ac 50 46 a7 27 '......Qx.\..PF.''
  0c 50 54 21 08 00 d1 c0 81 c0 01 01 01 01 01 01 '.PT!............'
  01 01 01 01 01 01 08 e8 00 30 f2 70 5a 80 b0 58 '.........0.pZ..X'
  8a 00 a0 2a 53 00 00 1e 6f c2 00 a0 a0 a0 55 50 '...*S...o.....UP'
  30 20 35 00 a0 2a 53 00 00 1a 00 00 00 fc 00 50 '0 5..*S........P'
  68 69 6c 69 70 73 20 46 54 56 0a 20 00 00 00 fd 'hilips FTV. ....'
  00 30 78 0f 46 3c 00 0a 20 20 20 20 20 20 01 3c '.0x.F<..      .<'
Checksum: 0x3c

----------------

Block 3, CTA-861 Extension Block:
  Revision: 3
  Underscans IT Video Formats by default
  Basic audio support
  Supports YCbCr 4:4:4
  Supports YCbCr 4:2:2
  Native detailed modes: 1
  Video Data Block:
    VIC  97:  3840x2160   60.000000 Hz  16:9    135.000 kHz    594.000000 MHz
    VIC  96:  3840x2160   50.000000 Hz  16:9    112.500 kHz    594.000000 MHz
    VIC  93:  3840x2160   24.000000 Hz  16:9     54.000 kHz    297.000000 MHz
    VIC  95:  3840x2160   30.000000 Hz  16:9     67.500 kHz    297.000000 MHz
    VIC  94:  3840x2160   25.000000 Hz  16:9     56.250 kHz    297.000000 MHz
    VIC 118:  3840x2160  120.000000 Hz  16:9    270.000 kHz   1188.000000 MHz
    VIC 117:  3840x2160  100.000000 Hz  16:9    225.000 kHz   1188.000000 MHz
    VIC  16:  1920x1080   60.000000 Hz  16:9     67.500 kHz    148.500000 MHz
    VIC  31:  1920x1080   50.000000 Hz  16:9     56.250 kHz    148.500000 MHz
    VIC  32:  1920x1080   24.000000 Hz  16:9     27.000 kHz     74.250000 MHz
    VIC  34:  1920x1080   30.000000 Hz  16:9     33.750 kHz     74.250000 MHz
    VIC  33:  1920x1080   25.000000 Hz  16:9     28.125 kHz     74.250000 MHz
    VIC   5:  1920x1080i  60.000000 Hz  16:9     33.750 kHz     74.250000 MHz
    VIC  20:  1920x1080i  50.000000 Hz  16:9     28.125 kHz     74.250000 MHz
    VIC   4:  1280x720    60.000000 Hz  16:9     45.000 kHz     74.250000 MHz
    VIC  19:  1280x720    50.000000 Hz  16:9     37.500 kHz     74.250000 MHz
    VIC  18:   720x576    50.000000 Hz  16:9     31.250 kHz     27.000000 MHz
    VIC   3:   720x480    59.940060 Hz  16:9     31.469 kHz     27.000000 MHz
    VIC  17:   720x576    50.000000 Hz   4:3     31.250 kHz     27.000000 MHz
    VIC   2:   720x480    59.940060 Hz   4:3     31.469 kHz     27.000000 MHz
    VIC  22:  1440x576i   50.000000 Hz  16:9     15.625 kHz     27.000000 MHz
    VIC   7:  1440x480i   59.940060 Hz  16:9     15.734 kHz     27.000000 MHz
    VIC  21:  1440x576i   50.000000 Hz   4:3     15.625 kHz     27.000000 MHz
    VIC   6:  1440x480i   59.940060 Hz   4:3     15.734 kHz     27.000000 MHz
    VIC   1:   640x480    59.940476 Hz   4:3     31.469 kHz     25.175000 MHz
    VIC  64:  1920x1080  100.000000 Hz  16:9    112.500 kHz    297.000000 MHz
    VIC  63:  1920x1080  120.000000 Hz  16:9    135.000 kHz    297.000000 MHz
    VIC  41:  1280x720   100.000000 Hz  16:9     75.000 kHz    148.500000 MHz
    VIC  47:  1280x720   120.000000 Hz  16:9     90.000 kHz    148.500000 MHz
  Audio Data Block:
    Linear PCM:
      Max channels: 2
      Supported sample rates (kHz): 96 88.2 48 44.1 32
      Supported sample sizes (bits): 24 20 16
    AC-3:
      Max channels: 6
      Supported sample rates (kHz): 48 44.1 32
      Maximum bit rate: 640 kb/s
    DTS:
      Max channels: 6
      Supported sample rates (kHz): 48 44.1 32
      Maximum bit rate: 1536 kb/s
    Enhanced AC-3 (DD+):
      Max channels: 8
      Supported sample rates (kHz): 48 44.1
      Supports Joint Object Coding
    DTS-HD:
      Max channels: 8
      Supported sample rates (kHz): 96 88.2 48 44.1 32
      Audio Format Code dependent value: 0x01
    MAT (MLP):
      Max channels: 8
      Supported sample rates (kHz): 48
      Supports Dolby TrueHD, object audio PCM and channel-based PCM
      Hash calculation not required for object audio PCM or channel-based PCM
  Speaker Allocation Data Block:
    FL/FR - Front Left/Right
  Vendor-Specific Data Block (HDMI), OUI 00-0C-03:
    Source physical address: 2.0.0.0
    DC_36bit
    DC_30bit
    DC_Y444
    Maximum TMDS clock: 300 MHz
    Extended HDMI video details:
      Base EDID image size is aspect ratio
      HDMI VICs:
        HDMI VIC 1:  3840x2160   30.000000 Hz  16:9     67.500 kHz    297.000000 MHz
        HDMI VIC 2:  3840x2160   25.000000 Hz  16:9     56.250 kHz    297.000000 MHz
        HDMI VIC 3:  3840x2160   24.000000 Hz  16:9     54.000 kHz    297.000000 MHz
  Vendor-Specific Data Block (HDMI Forum), OUI C4-5D-D8:
    Version: 1
    Maximum TMDS Character Rate: 600 MHz
    SCDC Present
    Max Fixed Rate Link: 3 and 6 Gbps per lane on 3 lanes, 6, 8, 10 and 12 Gbps on 4 lanes
    Supports UHD VIC
    Supports 12-bits/component Deep Color 4:2:0 Pixel Encoding
    Supports 10-bits/component Deep Color 4:2:0 Pixel Encoding
  Video Capability Data Block:
    YCbCr quantization: No Data
    RGB quantization: Selectable (via AVI Q)
    PT scan behavior: No Data
    IT scan behavior: Always Underscanned
    CE scan behavior: Always Overscanned
  YCbCr 4:2:0 Capability Map Data Block:
    VIC  97:  3840x2160   60.000000 Hz  16:9    135.000 kHz    594.000000 MHz
    VIC  96:  3840x2160   50.000000 Hz  16:9    112.500 kHz    594.000000 MHz
    VIC 118:  3840x2160  120.000000 Hz  16:9    270.000 kHz   1188.000000 MHz
    VIC 117:  3840x2160  100.000000 Hz  16:9    225.000 kHz   1188.000000 MHz
  Colorimetry Data Block:
    BT2020YCC
    BT2020RGB
  HDR Static Metadata Data Block:
    Electro optical transfer functions:
      Traditional gamma - SDR luminance range
      SMPTE ST2084
      Hybrid Log-Gamma
    Supported static metadata descriptors:
      Static metadata type 1
  Vendor-Specific Video Data Block (Dolby), OUI 00-D0-46:
    Version: 2 (12 bytes)
    Supports global dimming
    DM Version: 4.x
    Backlt Min Luma: 75 cd/m^2
    Interface: Standard + Low-Latency + Low-Latency-HDMI
    Supports 10b 12b 444: 10 bit
    Target Min PQ v2: 0 (0.00000000 cd/m^2)
    Target Max PQ v2: 2770 (499 cd/m^2)
    Unique Rx, Ry: 0.66406250, 0.31640625
    Unique Gx, Gy: 0.26562500, 0.66015625
    Unique Bx, By: 0.15234375, 0.04687500
  Vendor-Specific Video Data Block (HDR10+), OUI 90-84-8B:
    Application Version: 1
    Full Frame Peak Luminance Index: 0
    Peak Luminance Index: 0
  Vendor-Specific Audio Data Block (Dolby), OUI 00-D0-46:
    Version: 1 (7 bytes)
    Height speaker zone present
    Surround speaker zone present
    Center speaker zone present
Checksum: 0xe9  Unused space in Extension Block: 8 bytes

----------------

Warnings:

Block 0, Base EDID:
  Vendor & Product Identification: The serial number is one of the known dummy values, it should probably be set to 0.
Block 1, CTA-861 Extension Block:
  Video Capability Data Block: Set Selectable YCbCr Quantization to avoid interop issues.
  Colorimetry Data Block: Set the sRGB colorimetry bit to avoid interop issues.
Block 3, CTA-861 Extension Block:
  Video Capability Data Block: Set Selectable YCbCr Quantization to avoid interop issues.
  Colorimetry Data Block: Set the sRGB colorimetry bit to avoid interop issues.
EDID:
  Base EDID: Some timings are out of range of the Monitor Ranges:
    Vertical Freq: 24.000 - 120.000 Hz (Monitor: 48.000 - 120.000 Hz)
    Horizontal Freq: 15.625 - 270.000 kHz (Monitor: 15.000 - 70.000 kHz)
    Maximum Clock: 1188.000 MHz (Monitor: 600.000 MHz)

Failures:

Block 2, Base EDID:
  Unknown Extension Block.
Block 3, CTA-861 Extension Block:
  Video Data Block: Duplicate VIC 97.
  Video Data Block: Duplicate VIC 96.
  Video Data Block: Duplicate VIC 93.
  Video Data Block: Duplicate VIC 95.
  Video Data Block: Duplicate VIC 94.
  Video Data Block: Duplicate VIC 118.
  Video Data Block: Duplicate VIC 117.
  Video Data Block: Duplicate VIC 16.
  Video Data Block: Duplicate VIC 31.
  Video Data Block: Duplicate VIC 32.
  Video Data Block: Duplicate VIC 34.
  Video Data Block: Duplicate VIC 33.
  Video Data Block: Duplicate VIC 5.
  Video Data Block: Duplicate VIC 20.
  Video Data Block: Duplicate VIC 4.
  Video Data Block: Duplicate VIC 19.
  Video Data Block: Duplicate VIC 18.
  Video Data Block: Duplicate VIC 3.
  Video Data Block: Duplicate VIC 17.
  Video Data Block: Duplicate VIC 2.
  Video Data Block: Duplicate VIC 22.
  Video Data Block: Duplicate VIC 7.
  Video Data Block: Duplicate VIC 21.
  Video Data Block: Duplicate VIC 6.
  Video Data Block: Duplicate VIC 1.
  Video Data Block: Duplicate VIC 64.
  Video Data Block: Duplicate VIC 63.
  Video Data Block: Duplicate VIC 41.
  Video Data Block: Duplicate VIC 47.
  Speaker Allocation Data Block: Only one instance of this Data Block is allowed.
  Vendor-Specific Data Block (HDMI Forum), OUI C4-5D-D8: Duplicate HDMI Forum VSDB/SCDB.
  Video Capability Data Block: Only one instance of this Data Block is allowed.
  YCbCr 4:2:0 Capability Map Data Block: Only one instance of this Data Block is allowed.
  Colorimetry Data Block: Only one instance of this Data Block is allowed.
  HDR Static Metadata Data Block: Only one instance of this Data Block is allowed.
EDID:
  Base EDID: EDID specified 1 extension block(s), but found 3 extension block(s).
  Base EDID: EDID 1.3 requires a Block Map Extension in Block 1 if there are more than 2 blocks in the EDID.

EDID conformity: FAIL
