edid-decode (hex):

00 ff ff ff ff ff ff 00 3a 8b 00 00 00 00 00 00
20 19 01 03 80 30 1b 78 2a 9d 80 a2 59 54 9e 27
0e 50 54 bf ef 00 d1 c0 b3 00 95 00 81 80 81 40
81 c0 8b c0 01 01 00 14 00 40 41 58 23 20 a0 20
c3 00 0c dd 11 00 00 1a 66 21 50 b0 51 00 1b 30
40 70 36 00 58 4a 21 00 00 1a 00 00 00 fd 00 32
4c 1e 5a 16 00 0a 20 20 20 20 20 20 66 21 56 aa
51 00 1e 30 46 8f 33 00 58 4a 21 00 00 1a 01 51

02 03 1b 77 47 81 83 84 11 93 04 13 23 0f 57 07
83 4f 00 00 66 03 0c 00 10 00 80 26 1b 56 64 50
00 16 30 30 20 36 00 25 a4 10 00 00 18 00 00 00
10 00 1c 16 20 58 2c 25 00 c4 8e 21 00 00 9e 00
00 00 10 00 d0 1e 20 b8 28 55 40 c4 8e 21 00 00
1e 00 00 00 10 00 e0 2d 10 10 3e 96 00 13 8e 21
00 00 18 00 00 00 ff 00 30 30 0a 20 20 20 20 20
20 20 20 20 20 00 00 00 00 00 00 00 00 00 00 9c

00 ff ff ff ff ff ff 00 3a 8b 00 00 00 00 00 00
20 19 01 03 80 30 1b 78 2a 9d 80 a2 59 54 9e 27
0e 50 54 bf ef 00 d1 c0 b3 00 95 00 81 80 81 40
81 c0 8b c0 01 01 00 14 00 40 41 58 23 20 a0 20
c3 00 0c dd 11 00 00 1a 66 21 50 b0 51 00 1b 30
40 70 36 00 58 4a 21 00 00 1a 00 00 00 fd 00 32
4c 1e 5a 16 00 0a 20 20 20 20 20 20 66 21 56 aa
51 00 1e 30 46 8f 33 00 58 4a 21 00 00 1a 01 51

02 03 1b 77 47 81 83 84 11 93 04 13 23 0f 57 07
83 4f 00 00 66 03 0c 00 10 00 80 26 1b 56 64 50
00 16 30 30 20 36 00 25 a4 10 00 00 18 00 00 00
10 00 1c 16 20 58 2c 25 00 c4 8e 21 00 00 9e 00
00 00 10 00 d0 1e 20 b8 28 55 40 c4 8e 21 00 00
1e 00 00 00 10 00 e0 2d 10 10 3e 96 00 13 8e 21
00 00 18 00 00 00 ff 00 30 30 0a 20 20 20 20 20
20 20 20 20 20 00 00 00 00 00 00 00 00 00 00 9c

----------------

Block 0, Base EDID:
  EDID Structure Version & Revision: 1.3
  Vendor & Product Identification:
    Manufacturer: NTK
    Model: 0
    Made in: week 32 of 2015
  Basic Display Parameters & Features:
    Digital display
    Maximum image size: 48 cm x 27 cm
    Gamma: 2.20
    DPMS levels: Off
    RGB color display
    First detailed timing is the preferred timing
  Color Characteristics:
    Red  : 0.6347, 0.3486
    Green: 0.3310, 0.6181
    Blue : 0.1542, 0.0546
    White: 0.3125, 0.3281
  Established Timings I & II:
    IBM     :   720x400    70.081663 Hz   9:5     31.467 kHz     28.320000 MHz
    DMT 0x04:   640x480    59.940476 Hz   4:3     31.469 kHz     25.175000 MHz
    Apple   :   640x480    66.666667 Hz   4:3     35.000 kHz     30.240000 MHz
    DMT 0x05:   640x480    72.808802 Hz   4:3     37.861 kHz     31.500000 MHz
    DMT 0x06:   640x480    75.000000 Hz   4:3     37.500 kHz     31.500000 MHz
    DMT 0x08:   800x600    56.250000 Hz   4:3     35.156 kHz     36.000000 MHz
    DMT 0x09:   800x600    60.316541 Hz   4:3     37.879 kHz     40.000000 MHz
    DMT 0x0a:   800x600    72.187572 Hz   4:3     48.077 kHz     50.000000 MHz
    DMT 0x0b:   800x600    75.000000 Hz   4:3     46.875 kHz     49.500000 MHz
    Apple   :   832x624    74.551266 Hz   4:3     49.726 kHz     57.284000 MHz
    DMT 0x10:  1024x768    60.003840 Hz   4:3     48.363 kHz     65.000000 MHz
    DMT 0x11:  1024x768    70.069359 Hz   4:3     56.476 kHz     75.000000 MHz
    DMT 0x12:  1024x768    75.028582 Hz   4:3     60.023 kHz     78.750000 MHz
    DMT 0x24:  1280x1024   75.024675 Hz   5:4     79.976 kHz    135.000000 MHz
  Standard Timings:
    DMT 0x52:  1920x1080   60.000000 Hz  16:9     67.500 kHz    148.500000 MHz
    DMT 0x3a:  1680x1050   59.954250 Hz  16:10    65.290 kHz    146.250000 MHz
    DMT 0x2f:  1440x900    59.887445 Hz  16:10    55.935 kHz    106.500000 MHz
    DMT 0x23:  1280x1024   60.019740 Hz   5:4     63.981 kHz    108.000000 MHz
    DMT 0x20:  1280x960    60.000000 Hz   4:3     60.000 kHz    108.000000 MHz
    DMT 0x55:  1280x720    60.000000 Hz  16:9     45.000 kHz     74.250000 MHz
    GTF     :  1360x765    60.000341 Hz  16:9     47.520 kHz     84.396000 MHz
  Detailed Timing Descriptors:
    DTD 1:  1024x600    59.992501 Hz 128:75    38.095 kHz     51.200000 MHz (268 mm x 477 mm)
                 Hfront  160 Hsync  32 Hback  128 Hpol P
                 Vfront   12 Vsync   3 Vback   20 Vpol N
    DTD 2:  1360x768    60.015162 Hz  85:48    47.712 kHz     85.500000 MHz (600 mm x 330 mm)
                 Hfront   64 Hsync 112 Hback  256 Hpol P
                 Vfront    3 Vsync   6 Vback   18 Vpol N
    Display Range Limits:
      Monitor ranges (GTF): 50-76 Hz V, 30-90 kHz H, max dotclock 220 MHz
    DTD 3:  1366x768    59.789541 Hz 683:384   47.712 kHz     85.500000 MHz (600 mm x 330 mm)
                 Hfront   70 Hsync 143 Hback  213 Hpol P
                 Vfront    3 Vsync   3 Vback   24 Vpol N
  Extension blocks: 1
Checksum: 0x51

----------------

Block 1, CTA-861 Extension Block:
  Revision: 3
  Basic audio support
  Supports YCbCr 4:4:4
  Supports YCbCr 4:2:2
  Native DTDs: 7
  Video Data Block:
    VIC   1:   640x480    59.940476 Hz   4:3     31.469 kHz     25.175000 MHz (native)
    VIC   3:   720x480    59.940060 Hz  16:9     31.469 kHz     27.000000 MHz (native)
    VIC   4:  1280x720    60.000000 Hz  16:9     45.000 kHz     74.250000 MHz (native)
    VIC  17:   720x576    50.000000 Hz   4:3     31.250 kHz     27.000000 MHz
    VIC  19:  1280x720    50.000000 Hz  16:9     37.500 kHz     74.250000 MHz (native)
    VIC   4:  1280x720    60.000000 Hz  16:9     45.000 kHz     74.250000 MHz
    VIC  19:  1280x720    50.000000 Hz  16:9     37.500 kHz     74.250000 MHz
  Audio Data Block:
    Linear PCM:
      Max channels: 8
      Supported sample rates (kHz): 192 96 48 44.1 32
      Supported sample sizes (bits): 24 20 16
  Speaker Allocation Data Block:
    FL/FR - Front Left/Right
    LFE1 - Low Frequency Effects 1
    FC - Front Center
    LS/RS - Left/Right Surround
    BL/BR - Back Left/Right
  Vendor-Specific Data Block (HDMI), OUI 00-0C-03:
    Source physical address: 1.0.0.0
    Supports_AI
  Detailed Timing Descriptors:
    DTD 4:  1366x768    60.010016 Hz 683:384   47.408 kHz     69.500000 MHz (293 mm x 164 mm)
                 Hfront   48 Hsync  32 Hback   20 Hpol N
                 Vfront    3 Vsync   6 Vback   13 Vpol N
    Dummy Descriptor:
    Dummy Descriptor:
    Dummy Descriptor:
    Display Product Serial Number: ...
Checksum: 0x9c  Unused space in Extension Block: 10 bytes

----------------

Warnings:

Block 0, Base EDID:
  Standard Timings: Standard Timing 1360x765 has a dubious odd vertical resolution.
  Detailed Timing Descriptor #1: Image size is 268x477 mm, but based on the picture AR it should be 268x157 mm.
  Detailed Timing Descriptor #2: DTD is similar but not identical to DMT 0x27.
  Detailed Timing Descriptor #3: DTD is similar but not identical to DMT 0x51.
Block 1, CTA-861 Extension Block:
  IT Video Formats are overscanned by default, but normally this should be underscanned.
  Video Data Block: VIC 1 and the first DTD are not identical. Is this intended?
  Display Product Serial Number: ...
  Add a Colorimetry Data Block with the sRGB colorimetry bit set to avoid interop issues.

Failures:

Block 0, Base EDID:
  Detailed Timing Descriptor #1: Mismatch of image size 268x477 mm vs display size 480x270 mm.
  Detailed Timing Descriptor #2: Mismatch of image size 600x330 mm vs display size 480x270 mm.
  Detailed Timing Descriptor #3: Mismatch of image size 600x330 mm vs display size 480x270 mm.
  Detailed Timing Descriptor #3: Invalid detailed timing descriptor ordering.
  Missing Display Product Name.
Block 1, CTA-861 Extension Block:
  There are more Native DTDs (7) than DTDs (4).
  Video Data Block: Duplicate VIC 4.
  Video Data Block: Duplicate VIC 19.
  Detailed Timing Descriptor #4: Mismatch of image size 293x164 mm vs display size 480x270 mm.
  Dummy Descriptor: Dummy block filled with garbage.
  Dummy Descriptor: Dummy block filled with garbage.
  Dummy Descriptor: Dummy block filled with garbage.
  Missing VCDB, needed for Set Selectable RGB Quantization to avoid interop issues.
EDID:
  Extension Block 2 started with EDID header, ignoring Extension Blocks >= 2.
  Base EDID: The DTD max image size is 600x477mm, which is larger than the display size 480.0x270.0mm.
  CTA-861: Native progressive timings are a mix of several resolutions.

EDID conformity: FAIL
