edid-decode (hex):

00 ff ff ff ff ff ff 00 4d d9 b0 06 01 01 01 01
2f 0b 01 02 80 28 1e 96 2b 0c c9 a0 57 47 9b 27
12 48 4c ff ff 80 e1 4f d1 59 a9 59 81 99 71 59
61 59 45 59 81 4f 86 3d 00 c0 51 00 30 40 40 a0
13 00 84 23 11 00 00 1e 00 00 00 fd 00 30 aa 1e
89 16 00 0a 20 20 20 20 20 20 00 00 00 fc 00 47
44 4d 2d 46 35 32 30 0a 20 20 20 20 00 00 00 ff
00 32 38 31 31 33 33 35 0a 20 20 20 20 20 00 1e

00 ff ff ff ff ff ff 00 4d d9 b0 06 01 01 01 01
2f 0b 01 02 80 28 1e 96 2b 0c c9 a0 57 47 9b 27
12 48 4c ff ff 80 e1 4f d1 59 a9 59 81 99 71 59
61 59 45 59 81 4f 86 3d 00 c0 51 00 30 40 40 a0
13 00 84 23 11 00 00 1e 00 00 00 fd 00 30 aa 1e
89 16 00 0a 20 20 20 20 20 20 00 00 00 fc 00 47
44 4d 2d 46 35 32 30 0a 20 20 20 20 00 00 00 ff
00 32 38 31 31 33 33 35 0a 20 20 20 20 20 00 1e

----------------

Block 0, Base EDID:
  EDID Structure Version & Revision: 1.2
  Vendor & Product Identification:
    Manufacturer: SNY
    Model: 1712
    Serial Number: ...
    Made in: week 47 of 2001
  Basic Display Parameters & Features:
    Digital display
    Maximum image size: 40 cm x 30 cm
    Gamma: 2.50
    DPMS levels: Off
    RGB color display
    First detailed timing is the preferred timing
    Supports GTF timings within operating range
  Color Characteristics:
    Red  : 0.6250, 0.3398
    Green: 0.2802, 0.6054
    Blue : 0.1552, 0.0703
    White: 0.2832, 0.2978
  Established Timings I & II:
    IBM     :   720x400    70.081663 Hz   9:5     31.467 kHz     28.320000 MHz
    IBM     :   720x400    87.849542 Hz   9:5     39.444 kHz     35.500000 MHz
    DMT 0x04:   640x480    59.940476 Hz   4:3     31.469 kHz     25.175000 MHz
    Apple   :   640x480    66.666667 Hz   4:3     35.000 kHz     30.240000 MHz
    DMT 0x05:   640x480    72.808802 Hz   4:3     37.861 kHz     31.500000 MHz
    DMT 0x06:   640x480    75.000000 Hz   4:3     37.500 kHz     31.500000 MHz
    DMT 0x08:   800x600    56.250000 Hz   4:3     35.156 kHz     36.000000 MHz
    DMT 0x09:   800x600    60.316541 Hz   4:3     37.879 kHz     40.000000 MHz
    DMT 0x0a:   800x600    72.187572 Hz   4:3     48.077 kHz     50.000000 MHz
    DMT 0x0b:   800x600    75.000000 Hz   4:3     46.875 kHz     49.500000 MHz
    Apple   :   832x624    74.551266 Hz   4:3     49.726 kHz     57.284000 MHz
    DMT 0x0f:  1024x768i   86.957532 Hz   4:3     35.522 kHz     44.900000 MHz
    DMT 0x10:  1024x768    60.003840 Hz   4:3     48.363 kHz     65.000000 MHz
    DMT 0x11:  1024x768    70.069359 Hz   4:3     56.476 kHz     75.000000 MHz
    DMT 0x12:  1024x768    75.028582 Hz   4:3     60.023 kHz     78.750000 MHz
    DMT 0x24:  1280x1024   75.024675 Hz   5:4     79.976 kHz    135.000000 MHz
    Apple   :  1152x870    75.061550 Hz 192:145   68.681 kHz    100.000000 MHz
  Standard Timings:
    GTF     :  2048x1536   74.999956 Hz   4:3    120.225 kHz    340.477000 MHz
    GTF     :  1920x1440   84.999970 Hz   4:3    128.520 kHz    341.349000 MHz
    DMT 0x37:  1600x1200   85.000000 Hz   4:3    106.250 kHz    229.500000 MHz
    DMT 0x25:  1280x1024   85.024098 Hz   5:4     91.146 kHz    157.500000 MHz
    GTF     :  1152x864    84.999687 Hz   4:3     77.095 kHz    119.651000 MHz
    DMT 0x13:  1024x768    84.996690 Hz   4:3     68.677 kHz     94.500000 MHz
    DMT 0x0c:   800x600    85.061274 Hz   4:3     53.674 kHz     56.250000 MHz
    GTF     :  1280x960    74.999884 Hz   4:3     75.150 kHz    129.859000 MHz
  Detailed Timing Descriptors:
    DTD 1:  1280x1024   85.024098 Hz   5:4     91.146 kHz    157.500000 MHz (388 mm x 291 mm)
                 Hfront   64 Hsync 160 Hback  224 Hpol P
                 Vfront    1 Vsync   3 Vback   44 Vpol P
    Display Range Limits:
      Monitor ranges (GTF): 48-170 Hz V, 30-137 kHz H, max dotclock 220 MHz
    Display Product Name: 'GDM-F520'
    Display Product Serial Number: ...
Checksum: 0x1e

----------------

Block 1, Unknown EDID Extension Block 0x00:
  00 ff ff ff ff ff ff 00 4d d9 b0 06 01 01 01 01 '........M.......'
  2f 0b 01 02 80 28 1e 96 2b 0c c9 a0 57 47 9b 27 '/....(..+...WG.''
  12 48 4c ff ff 80 e1 4f d1 59 a9 59 81 99 71 59 '.HL....O.Y.Y..qY'
  61 59 45 59 81 4f 86 3d 00 c0 51 00 30 40 40 a0 'aYEY.O.=..Q.0@@.'
  13 00 84 23 11 00 00 1e 00 00 00 fd 00 30 aa 1e '...#.........0..'
  89 16 00 0a 20 20 20 20 20 20 00 00 00 fc 00 47 '....      .....G'
  44 4d 2d 46 35 32 30 0a 20 20 20 20 00 00 00 ff 'DM-F520.    ....'
  00 32 38 31 31 33 33 35 0a 20 20 20 20 20 00 1e '.2811335.     ..'
Checksum: 0x1e

----------------

Warnings:

Block 0, Base EDID:
  EDID Structure Version & Revision: EDID 1.2 is deprecated, do not use.
  Vendor & Product Identification: The serial number is one of the known dummy values, it should probably be set to 0.
  Detailed Timing Descriptor #1: Image size is 388x291 mm, but based on the picture AR it should be 388x310 mm.
EDID:
  Base EDID: Some timings are out of range of the Monitor Ranges:
    Maximum Clock: 341.349 MHz (Monitor: 220.000 MHz)

Failures:

Block 1, Base EDID:
  Unknown Extension Block.
EDID:
  Base EDID: EDID specified 0 extension block(s), but found 1 extension block(s).

EDID conformity: FAIL
