edid-decode (hex):

00 ff ff ff ff ff ff 00 09 e5 4b 09 00 00 00 00
11 1e 01 04 95 1a 0e 78 02 3a d5 95 5c 58 94 29
24 50 54 00 00 00 01 01 01 01 01 01 01 01 01 01
01 01 01 01 01 01 38 1d 56 c8 50 00 1c 30 30 20
36 00 00 90 10 00 00 1a 7b 13 56 c8 50 00 1c 30
30 20 36 00 00 90 10 00 00 1a 00 00 00 00 00 00
00 00 00 00 00 00 00 00 00 00 00 00 00 00 00 02
00 0d 49 ff 0a 3c 6e 0f 0b 14 6e 00 00 00 00 ee

00 ff ff ff ff ff ff 00 09 e5 4b 09 00 00 00 00
11 1e 01 04 95 1a 0e 78 02 3a d5 95 5c 58 94 29
24 50 54 00 00 00 01 01 01 01 01 01 01 01 01 01
01 01 01 01 01 01 38 1d 56 c8 50 00 1c 30 30 20
36 00 00 90 10 00 00 1a 7b 13 56 c8 50 00 1c 30
30 20 36 00 00 90 10 00 00 1a 00 00 00 00 00 00
00 00 00 00 00 00 00 00 00 00 00 00 00 00 00 02
00 0d 49 ff 0a 3c 6e 0f 0b 14 6e 00 00 00 00 ee

----------------

Block 0, Base EDID:
  EDID Structure Version & Revision: 1.4
  Vendor & Product Identification:
    Manufacturer: BOE
    Model: 2379
    Made in: week 17 of 2020
  Basic Display Parameters & Features:
    Digital display
    Bits per primary color channel: 6
    DisplayPort interface
    Maximum image size: 26 cm x 14 cm
    Gamma: 2.20
    Supported color formats: RGB 4:4:4
    First detailed timing includes the native pixel format and preferred refresh rate
  Color Characteristics:
    Red  : 0.5820, 0.3623
    Green: 0.3457, 0.5800
    Blue : 0.1630, 0.1416
    White: 0.3134, 0.3291
  Established Timings I & II: none
  Standard Timings: none
  Detailed Timing Descriptors:
    DTD 1:  1366x768    60.006289 Hz 683:384   47.765 kHz     74.800000 MHz (256 mm x 144 mm)
                 Hfront   48 Hsync  32 Hback  120 Hpol P
                 Vfront    3 Vsync   6 Vback   19 Vpol N
    DTD 2:  1366x768    40.006867 Hz 683:384   31.845 kHz     49.870000 MHz (256 mm x 144 mm)
                 Hfront   48 Hsync  32 Hback  120 Hpol P
                 Vfront    3 Vsync   6 Vback   19 Vpol N
    Empty Descriptor
    Manufacturer-Specified Display Descriptor (0x02): 00 02 00 0d 49 ff 0a 3c 6e 0f 0b 14 6e 00 00 00 '....I..<n...n...'
Checksum: 0xee

----------------

Warnings:

Block 0, Base EDID:
  Missing Display Product Name.

Failures:

Block 0, Base EDID:
  Empty Descriptor: Use Dummy Descriptor instead of all zeroes.
EDID:
  Extension Block 1 started with EDID header, ignoring Extension Blocks >= 1.

EDID conformity: FAIL
