edid-decode (hex):

00 ff ff ff ff ff ff 00 25 cc 00 00 00 00 00 00
28 12 01 03 80 0f 09 78 0a 58 54 8f 54 59 97 26
ca 4f 54 00 00 00 01 01 01 01 01 01 01 01 01 01
01 01 01 01 01 01 68 0b 20 80 30 e0 2d 10 28 30
c3 00 98 5b 00 00 00 18 00 00 00 fd 00 32 46 1a
28 06 00 0a 20 20 20 20 20 20 00 00 00 10 00 41
54 30 37 30 54 4e 39 32 46 00 00 00 00 00 00 10
00 00 00 00 00 00 00 00 00 00 00 00 00 00 00 ef

----------------

Block 0, Base EDID:
  EDID Structure Version & Revision: 1.3
  Vendor & Product Identification:
    Manufacturer: INL
    Model: 0
    Made in: week 40 of 2008
  Basic Display Parameters & Features:
    Digital display
    Maximum image size: 15 cm x 9 cm
    Gamma: 2.20
    RGB color display
    First detailed timing is the preferred timing
  Color Characteristics:
    Red  : 0.5595, 0.3291
    Green: 0.3496, 0.5898
    Blue : 0.1494, 0.7900
    White: 0.3095, 0.3281
  Established Timings I & II: none
  Standard Timings: none
  Detailed Timing Descriptors:
    DTD 1:   800x480    59.934319 Hz   5:3     31.466 kHz     29.200000 MHz (152 mm x 91 mm)
                 Hfront   40 Hsync  48 Hback   40 Hpol N
                 Vfront   12 Vsync   3 Vback   30 Vpol N
    Display Range Limits:
      Monitor ranges (GTF): 50-70 Hz V, 26-40 kHz H, max dotclock 60 MHz
    Dummy Descriptor:
    Dummy Descriptor:
Checksum: 0xef

----------------

Warnings:

Block 0, Base EDID:
  Basic Display Parameters & Features: Dubious maximum image size (15x9 is smaller than 10x10 cm).
  Detailed Timing Descriptor #1: Dubious image size (152x91 mm is smaller than 100x100 mm).

Failures:

Block 0, Base EDID:
  Dummy Descriptor: Dummy block filled with garbage.
  Missing Display Product Name.

EDID conformity: FAIL
