edid-decode (hex):

00 ff ff ff ff ff ff 00 11 38 00 00 bd 19 00 00
21 10 01 03 7e 1e 17 82 eb ab c5 a0 5b 4b 96 24
18 50 54 b7 ee 00 3b ca 31 ca 01 01 01 01 01 01
01 01 01 01 01 01 64 19 00 40 41 00 26 30 18 88
36 00 30 e4 10 00 00 1e 00 00 00 ff 00 30 30 36
35 38 39 0a 20 20 20 20 20 20 00 00 00 fd 00 37
4b 1e 3c 08 20 20 20 20 20 20 20 20 00 00 00 fc
00 46 31 35 39 42 0a 20 20 20 20 20 20 20 00 56

00 ff ff ff ff ff ff 00 11 38 00 00 bd 19 00 00
21 10 01 03 7e 1e 17 82 eb ab c5 a0 5b 4b 96 24
18 50 54 b7 ee 00 3b ca 31 ca 01 01 01 01 01 01
01 01 01 01 01 01 64 19 00 40 41 00 26 30 18 88
36 00 30 e4 10 00 00 1e 00 00 00 ff 00 30 30 36
35 38 39 0a 20 20 20 20 20 20 00 00 00 fd 00 37
4b 1e 3c 08 20 20 20 20 20 20 20 20 00 00 00 fc
00 46 31 35 39 42 0a 20 20 20 20 20 20 20 00 56

----------------

Block 0, Base EDID:
  EDID Structure Version & Revision: 1.3
  Vendor & Product Identification:
    Manufacturer: DIX
    Model: 0
    Serial Number: ...
    Made in: week 33 of 2006
  Basic Display Parameters & Features:
    Analog display
    Signal Level Standard: 0.700 : 0.000 : 0.700 V p-p
    Blank-to-black setup/pedestal
    Sync: Separate Composite SyncOnGreen
    Maximum image size: 30 cm x 23 cm
    Gamma: 2.30
    DPMS levels: Standby Suspend Off
    RGB color display
    First detailed timing is the preferred timing
    Supports GTF timings within operating range
  Color Characteristics:
    Red  : 0.6269, 0.3574
    Green: 0.2949, 0.5888
    Blue : 0.1435, 0.0937
    White: 0.3134, 0.3291
  Established Timings I & II:
    IBM     :   720x400    70.081663 Hz   9:5     31.467 kHz     28.320000 MHz
    DMT 0x04:   640x480    59.940476 Hz   4:3     31.469 kHz     25.175000 MHz
    Apple   :   640x480    66.666667 Hz   4:3     35.000 kHz     30.240000 MHz
    DMT 0x06:   640x480    75.000000 Hz   4:3     37.500 kHz     31.500000 MHz
    DMT 0x08:   800x600    56.250000 Hz   4:3     35.156 kHz     36.000000 MHz
    DMT 0x09:   800x600    60.316541 Hz   4:3     37.879 kHz     40.000000 MHz
    DMT 0x0a:   800x600    72.187572 Hz   4:3     48.077 kHz     50.000000 MHz
    DMT 0x0b:   800x600    75.000000 Hz   4:3     46.875 kHz     49.500000 MHz
    Apple   :   832x624    74.551266 Hz   4:3     49.726 kHz     57.284000 MHz
    DMT 0x10:  1024x768    60.003840 Hz   4:3     48.363 kHz     65.000000 MHz
    DMT 0x11:  1024x768    70.069359 Hz   4:3     56.476 kHz     75.000000 MHz
    DMT 0x12:  1024x768    75.028582 Hz   4:3     60.023 kHz     78.750000 MHz
  Standard Timings:
    GTF     :   720x405    70.000423 Hz  16:9     29.540 kHz     26.468000 MHz
    GTF     :   640x360    70.000000 Hz  16:9     26.250 kHz     20.580000 MHz
  Detailed Timing Descriptors:
    DTD 1:  1024x768    60.003840 Hz   4:3     48.363 kHz     65.000000 MHz (304 mm x 228 mm)
                 Hfront   24 Hsync 136 Hback  160 Hpol P
                 Vfront    3 Vsync   6 Vback   29 Vpol P
    Display Product Serial Number: ...
    Display Range Limits:
      Monitor ranges (Unknown (0x20)): 55-75 Hz V, 30-60 kHz H, max dotclock 80 MHz
    Display Product Name: 'F159B'
Checksum: 0x56

----------------

Warnings:

Block 0, Base EDID:
  Standard Timings: Standard Timing 720x405 has a dubious odd vertical resolution.
  Detailed Timing Descriptor #1: DTD is similar but not identical to DMT 0x10.
EDID:
  Base EDID: Some timings are out of range of the Monitor Ranges:
    Horizontal Freq: 26.250 - 60.022 kHz (Monitor: 30.000 - 60.000 kHz)

Failures:

Block 0, Base EDID:
  Display Range Limits: Unknown range class (0x20).
  Display Range Limits: Byte 11 is 0x20 instead of 0x0a.
EDID:
  Extension Block 1 started with EDID header, ignoring Extension Blocks >= 1.

EDID conformity: FAIL
