edid-decode (hex):

00 ff ff ff ff ff ff 00 06 af ac 65 00 00 00 00
14 21 01 04 a5 21 15 78 03 17 45 a6 54 4b 9c 26
0f 50 54 00 00 00 01 01 01 01 01 01 01 01 01 01
01 01 01 01 01 01 84 3d 80 c8 70 b0 26 40 6c 30
aa 00 49 cd 10 00 00 18 00 00 00 fd 00 28 3c 4b
4b 10 01 0a 20 20 20 20 20 20 00 00 00 fe 00 41
55 4f 0a 20 20 20 20 20 20 20 20 20 00 00 00 fe
00 42 31 35 33 55 41 4e 30 31 2e 48 20 0a 00 da

00 ff ff ff ff ff ff 00 06 af ac 65 00 00 00 00
14 21 01 04 a5 21 15 78 03 17 45 a6 54 4b 9c 26
0f 50 54 00 00 00 01 01 01 01 01 01 01 01 01 01
01 01 01 01 01 01 84 3d 80 c8 70 b0 26 40 6c 30
aa 00 49 cd 10 00 00 18 00 00 00 fd 00 28 3c 4b
4b 10 01 0a 20 20 20 20 20 20 00 00 00 fe 00 41
55 4f 0a 20 20 20 20 20 20 20 20 20 00 00 00 fe
00 42 31 35 33 55 41 4e 30 31 2e 48 20 0a 00 da

----------------

Block 0, Base EDID:
  EDID Structure Version & Revision: 1.4
  Vendor & Product Identification:
    Manufacturer: AUO
    Model: 26028
    Made in: week 20 of 2023
  Basic Display Parameters & Features:
    Digital display
    Bits per primary color channel: 8
    DisplayPort interface
    Maximum image size: 33 cm x 21 cm
    Gamma: 2.20
    Supported color formats: RGB 4:4:4
    First detailed timing includes the native pixel format and preferred refresh rate
    Display supports continuous frequencies
  Color Characteristics:
    Red  : 0.6484, 0.3291
    Green: 0.2939, 0.6123
    Blue : 0.1494, 0.0585
    White: 0.3134, 0.3291
  Established Timings I & II: none
  Standard Timings: none
  Detailed Timing Descriptors:
    DTD 1:  1920x1200   60.002439 Hz  16:10    74.283 kHz    157.480000 MHz (329 mm x 205 mm)
                 Hfront  108 Hsync  48 Hback   44 Hpol N
                 Vfront   10 Vsync  10 Vback   18 Vpol N
    Display Range Limits:
      Monitor ranges (Range Limits Only): 40-60 Hz V, 75-75 kHz H, max dotclock 160 MHz
    Alphanumeric Data String: 'AUO'
    Alphanumeric Data String: 'B153UAN01.H '
Checksum: 0xda

----------------

Warnings:

Block 0, Base EDID:
  Missing Display Product Name.
EDID:
  Base EDID: Some timings are out of range of the Monitor Ranges:
    Horizontal Freq: 74.283 - 74.283 kHz (Monitor: 75.000 - 75.000 kHz)
    Could be due to a Monitor Range off-by-one rounding issue

Failures:

Block 0, Base EDID:
  Alphanumeric Data String: One or more trailing spaces before newline.
EDID:
  Extension Block 1 started with EDID header, ignoring Extension Blocks >= 1.

EDID conformity: FAIL
