edid-decode (hex):

00 ff ff ff ff ff ff 00 44 93 6a 00 00 00 00 00
00 10 01 03 80 1e 13 78 0a 3b a0 93 55 50 8c 27
22 50 54 00 00 00 01 01 01 01 01 01 01 01 01 01
01 01 01 01 01 01 ea 1a 00 80 50 20 10 30 15 20
44 00 30 be 10 00 00 18 00 00 00 0f 00 08 00 2a
00 01 00 04 00 32 4a 04 19 01 00 00 00 fe 00 51
55 41 4e 54 41 44 49 53 50 4c 41 59 00 00 00 fe
00 51 44 31 34 54 4c 30 32 36 0a 20 20 20 00 c7

00 ff ff ff ff ff ff 00 44 93 6a 00 00 00 00 00
00 10 01 03 80 1e 13 78 0a 3b a0 93 55 50 8c 27
22 50 54 00 00 00 01 01 01 01 01 01 01 01 01 01
01 01 01 01 01 01 ea 1a 00 80 50 20 10 30 15 20
44 00 30 be 10 00 00 18 00 00 00 0f 00 08 00 2a
00 01 00 04 00 32 4a 04 19 01 00 00 00 fe 00 51
55 41 4e 54 41 44 49 53 50 4c 41 59 00 00 00 fe
00 51 44 31 34 54 4c 30 32 36 0a 20 20 20 00 c7

----------------

Block 0, Base EDID:
  EDID Structure Version & Revision: 1.3
  Vendor & Product Identification:
    Manufacturer: QDS
    Model: 106
    Made in: 2006
  Basic Display Parameters & Features:
    Digital display
    Maximum image size: 30 cm x 19 cm
    Gamma: 2.20
    RGB color display
    First detailed timing is the preferred timing
  Color Characteristics:
    Red  : 0.5742, 0.3349
    Green: 0.3144, 0.5498
    Blue : 0.1542, 0.1347
    White: 0.3125, 0.3281
  Established Timings I & II: none
  Standard Timings: none
  Detailed Timing Descriptors:
    DTD 1:  1280x800    59.968945 Hz  16:10    48.935 kHz     68.900000 MHz (304 mm x 190 mm)
                 Hfront   21 Hsync  32 Hback   75 Hpol N
                 Vfront    4 Vsync   4 Vback    8 Vpol N
    Manufacturer-Specified Display Descriptor (0x0f): 00 0f 00 08 00 2a 00 01 00 04 00 32 4a 04 19 01 '.....*.....2J...'
    Alphanumeric Data String: 'QUANTADISPLAY'
    Alphanumeric Data String: 'QD14TL026'
Checksum: 0xc7

----------------

Failures:

Block 0, Base EDID:
  Missing Display Product Name.
  Missing Display Range Limits Descriptor.
EDID:
  Extension Block 1 started with EDID header, ignoring Extension Blocks >= 1.

EDID conformity: FAIL
