edid-decode (hex):

00 ff ff ff ff ff ff 00 0d 2c 00 00 00 00 00 00
0f 13 01 03 08 50 2d 78 0a 0d c9 a0 57 47 98 27
12 48 4c a3 08 00 31 40 45 40 61 40 4b c0 81 c0
95 00 b3 00 d1 c0 66 21 50 b0 51 00 1b 30 46 70
36 00 20 c2 31 00 00 1e 0e 1f 00 80 51 00 1e 30
46 80 37 00 20 c2 31 00 00 1c 00 00 00 fd 00 3b
3d 1e 31 09 00 0a 20 20 20 20 20 20 00 00 00 fc
00 43 4c 43 35 30 31 0a 20 20 20 20 20 20 00 43

00 ff ff ff ff ff ff 00 0d 2c 00 00 00 00 00 00
0f 13 01 03 08 50 2d 78 0a 0d c9 a0 57 47 98 27
12 48 4c a3 08 00 31 40 45 40 61 40 4b c0 81 c0
95 00 b3 00 d1 c0 66 21 50 b0 51 00 1b 30 46 70
36 00 20 c2 31 00 00 1e 0e 1f 00 80 51 00 1e 30
46 80 37 00 20 c2 31 00 00 1c 00 00 00 fd 00 3b
3d 1e 31 09 00 0a 20 20 20 20 20 20 00 00 00 fc
00 43 4c 43 35 30 31 0a 20 20 20 20 20 20 00 43

----------------

Block 0, Base EDID:
  EDID Structure Version & Revision: 1.3
  Vendor & Product Identification:
    Manufacturer: CIL
    Model: 0
    Made in: week 15 of 2009
  Basic Display Parameters & Features:
    Analog display
    Signal Level Standard: 0.700 : 0.300 : 1.000 V p-p
    Blank level equals black level
    Sync: Separate
    Maximum image size: 80 cm x 45 cm
    Gamma: 2.20
    RGB color display
    First detailed timing is the preferred timing
  Color Characteristics:
    Red  : 0.6250, 0.3398
    Green: 0.2802, 0.5947
    Blue : 0.1552, 0.0703
    White: 0.2832, 0.2978
  Established Timings I & II:
    IBM     :   720x400    70.081663 Hz   9:5     31.467 kHz     28.320000 MHz
    DMT 0x04:   640x480    59.940476 Hz   4:3     31.469 kHz     25.175000 MHz
    DMT 0x08:   800x600    56.250000 Hz   4:3     35.156 kHz     36.000000 MHz
    DMT 0x09:   800x600    60.316541 Hz   4:3     37.879 kHz     40.000000 MHz
    DMT 0x10:  1024x768    60.003840 Hz   4:3     48.363 kHz     65.000000 MHz
  Standard Timings:
    DMT 0x04:   640x480    59.940476 Hz   4:3     31.469 kHz     25.175000 MHz
    DMT 0x09:   800x600    60.316541 Hz   4:3     37.879 kHz     40.000000 MHz
    DMT 0x10:  1024x768    60.003840 Hz   4:3     48.363 kHz     65.000000 MHz
    GTF     :   848x477    60.000307 Hz  16:9     29.640 kHz     31.300000 MHz
    DMT 0x55:  1280x720    60.000000 Hz  16:9     45.000 kHz     74.250000 MHz
    DMT 0x2f:  1440x900    59.887445 Hz  16:10    55.935 kHz    106.500000 MHz
    DMT 0x3a:  1680x1050   59.954250 Hz  16:10    65.290 kHz    146.250000 MHz
    DMT 0x52:  1920x1080   60.000000 Hz  16:9     67.500 kHz    148.500000 MHz
  Detailed Timing Descriptors:
    DTD 1:  1360x768    60.015162 Hz  85:48    47.712 kHz     85.500000 MHz (800 mm x 450 mm)
                 Hfront   70 Hsync 112 Hback  250 Hpol P
                 Vfront    3 Vsync   6 Vback   18 Vpol P
    DTD 2:  1280x768    59.870228 Hz   5:3     47.776 kHz     79.500000 MHz (800 mm x 450 mm)
                 Hfront   70 Hsync 128 Hback  186 Hpol N
                 Vfront    3 Vsync   7 Vback   20 Vpol P
    Display Range Limits:
      Monitor ranges (GTF): 59-61 Hz V, 30-49 kHz H, max dotclock 90 MHz
    Display Product Name: 'CLC501'
Checksum: 0x43

----------------

Warnings:

Block 0, Base EDID:
  Standard Timings: Standard Timing 848x477 has a dubious odd vertical resolution.
  Detailed Timing Descriptor #1: DTD is similar but not identical to DMT 0x27.
  Detailed Timing Descriptor #2: DTD is similar but not identical to DMT 0x17.
  Detailed Timing Descriptor #2: Image size is 800x450 mm, but based on the picture AR it should be 750x450 mm.
EDID:
  Base EDID: Some timings are out of range of the Monitor Ranges:
    Vertical Freq: 56.250 - 70.082 Hz (Monitor: 59.000 - 61.000 Hz)
    Horizontal Freq: 29.640 - 67.500 kHz (Monitor: 30.000 - 49.000 kHz)
    Maximum Clock: 148.500 MHz (Monitor: 90.000 MHz)

Failures:

EDID:
  Extension Block 1 started with EDID header, ignoring Extension Blocks >= 1.

EDID conformity: FAIL
