edid-decode (hex):

00 ff ff ff ff ff ff 00 4c 2d 4c 02 00 00 00 00
11 10 01 03 68 59 32 8c 2a e2 bd a1 5b 4a 98 24
15 47 4a ad ce 00 01 01 01 01 01 01 01 01 01 01
01 01 01 01 01 01 1a 1d 00 80 51 d0 1c 20 40 80
35 00 75 f2 31 00 00 1c 0e 1f 00 80 51 00 1e 30
40 80 37 00 75 f2 31 00 00 1c 00 00 00 fd 00 3c
4b 1e 3d 09 00 0a 20 20 20 20 20 20 00 00 00 fc
00 53 41 4d 53 55 4e 47 20 4c 43 44 0a 20 00 02

00 ff ff ff ff ff ff 00 4c 2d 4c 02 00 00 00 00
11 10 01 03 68 59 32 8c 2a e2 bd a1 5b 4a 98 24
15 47 4a ad ce 00 01 01 01 01 01 01 01 01 01 01
01 01 01 01 01 01 1a 1d 00 80 51 d0 1c 20 40 80
35 00 75 f2 31 00 00 1c 0e 1f 00 80 51 00 1e 30
40 80 37 00 75 f2 31 00 00 1c 00 00 00 fd 00 3c
4b 1e 3d 09 00 0a 20 20 20 20 20 20 00 00 00 fc
00 53 41 4d 53 55 4e 47 20 4c 43 44 0a 20 00 02

----------------

Block 0, Base EDID:
  EDID Structure Version & Revision: 1.3
  Vendor & Product Identification:
    Manufacturer: SAM
    Model: 588
    Made in: week 17 of 2006
  Basic Display Parameters & Features:
    Analog display
    Signal Level Standard: 0.700 : 0.000 : 0.700 V p-p
    Blank level equals black level
    Sync: Separate
    Maximum image size: 89 cm x 50 cm
    Gamma: 2.40
    DPMS levels: Off
    RGB color display
    First detailed timing is the preferred timing
  Color Characteristics:
    Red  : 0.6318, 0.3574
    Green: 0.2890, 0.5957
    Blue : 0.1425, 0.0849
    White: 0.2802, 0.2900
  Established Timings I & II:
    IBM     :   720x400    70.081663 Hz   9:5     31.467 kHz     28.320000 MHz
    DMT 0x04:   640x480    59.940476 Hz   4:3     31.469 kHz     25.175000 MHz
    DMT 0x05:   640x480    72.808802 Hz   4:3     37.861 kHz     31.500000 MHz
    DMT 0x06:   640x480    75.000000 Hz   4:3     37.500 kHz     31.500000 MHz
    DMT 0x09:   800x600    60.316541 Hz   4:3     37.879 kHz     40.000000 MHz
    DMT 0x0a:   800x600    72.187572 Hz   4:3     48.077 kHz     50.000000 MHz
    DMT 0x0b:   800x600    75.000000 Hz   4:3     46.875 kHz     49.500000 MHz
    DMT 0x10:  1024x768    60.003840 Hz   4:3     48.363 kHz     65.000000 MHz
    DMT 0x11:  1024x768    70.069359 Hz   4:3     56.476 kHz     75.000000 MHz
    DMT 0x12:  1024x768    75.028582 Hz   4:3     60.023 kHz     78.750000 MHz
  Standard Timings: none
  Detailed Timing Descriptors:
    DTD 1:  1280x720    59.855126 Hz  16:9     44.772 kHz     74.500000 MHz (885 mm x 498 mm)
                 Hfront   64 Hsync 128 Hback  192 Hpol N
                 Vfront    3 Vsync   5 Vback   20 Vpol P
    DTD 2:  1280x768    59.870228 Hz   5:3     47.776 kHz     79.500000 MHz (885 mm x 498 mm)
                 Hfront   64 Hsync 128 Hback  192 Hpol N
                 Vfront    3 Vsync   7 Vback   20 Vpol P
    Display Range Limits:
      Monitor ranges (GTF): 60-75 Hz V, 30-61 kHz H, max dotclock 90 MHz
    Display Product Name: 'SAMSUNG LCD'
Checksum: 0x02

----------------

Block 1, Unknown EDID Extension Block 0x00:
  00 ff ff ff ff ff ff 00 4c 2d 4c 02 00 00 00 00 '........L-L.....'
  11 10 01 03 68 59 32 8c 2a e2 bd a1 5b 4a 98 24 '....hY2.*...[J.$'
  15 47 4a ad ce 00 01 01 01 01 01 01 01 01 01 01 '.GJ.............'
  01 01 01 01 01 01 1a 1d 00 80 51 d0 1c 20 40 80 '..........Q.. @.'
  35 00 75 f2 31 00 00 1c 0e 1f 00 80 51 00 1e 30 '5.u.1.......Q..0'
  40 80 37 00 75 f2 31 00 00 1c 00 00 00 fd 00 3c '@.7.u.1........<'
  4b 1e 3d 09 00 0a 20 20 20 20 20 20 00 00 00 fc 'K.=...      ....'
  00 53 41 4d 53 55 4e 47 20 4c 43 44 0a 20 00 02 '.SAMSUNG LCD. ..'
Checksum: 0x02

----------------

Warnings:

Block 0, Base EDID:
  Detailed Timing Descriptor #2: Image size is 885x498 mm, but based on the picture AR it should be 885x531 mm.

Failures:

Block 1, Base EDID:
  Unknown Extension Block.
EDID:
  Base EDID: EDID specified 0 extension block(s), but found 1 extension block(s).

EDID conformity: FAIL
