edid-decode (hex):

00 ff ff ff ff ff ff 00 4c 2d 20 22 00 00 00 00
10 18 01 03 80 2f 1e 00 8a 00 00 00 00 00 00 00
00 00 00 af cf 00 81 00 81 40 95 00 81 c0 01 01
01 01 01 01 01 01 6c 39 90 30 62 1a 27 40 68 b0
36 00 00 00 00 00 00 1a 9a 29 a0 d0 51 84 22 30
50 98 36 00 00 00 00 00 00 1e 34 21 50 1b 50 00
20 30 30 70 36 00 20 56 00 00 00 1c 00 00 00 fc
00 57 20 c8 fd d0 c7 0a 0a 0a 0a 0a 0a 0a 00 07

00 ff ff ff ff ff ff 00 4c 2d 20 22 00 00 00 00
10 18 01 03 80 2f 1e 00 8a 00 00 00 00 00 00 00
00 00 00 af cf 00 81 00 81 40 95 00 81 c0 01 01
01 01 01 01 01 01 6c 39 90 30 62 1a 27 40 68 b0
36 00 00 00 00 00 00 1a 9a 29 a0 d0 51 84 22 30
50 98 36 00 00 00 00 00 00 1e 34 21 50 1b 50 00
20 30 30 70 36 00 20 56 00 00 00 1c 00 00 00 fc
00 57 20 c8 fd d0 c7 0a 0a 0a 0a 0a 0a 0a 00 07

----------------

Block 0, Base EDID:
  EDID Structure Version & Revision: 1.3
  Vendor & Product Identification:
    Manufacturer: SAM
    Model: 8736
    Made in: week 16 of 2014
  Basic Display Parameters & Features:
    Digital display
    Maximum image size: 47 cm x 30 cm
    Gamma: 1.00
    DPMS levels: Standby
    RGB color display
    First detailed timing is the preferred timing
  Color Characteristics:
    Red  : 0.0000, 0.0000
    Green: 0.0000, 0.0000
    Blue : 0.0000, 0.0000
    White: 0.0000, 0.0000
  Established Timings I & II:
    IBM     :   720x400    70.081663 Hz   9:5     31.467 kHz     28.320000 MHz
    DMT 0x04:   640x480    59.940476 Hz   4:3     31.469 kHz     25.175000 MHz
    DMT 0x05:   640x480    72.808802 Hz   4:3     37.861 kHz     31.500000 MHz
    DMT 0x06:   640x480    75.000000 Hz   4:3     37.500 kHz     31.500000 MHz
    DMT 0x08:   800x600    56.250000 Hz   4:3     35.156 kHz     36.000000 MHz
    DMT 0x09:   800x600    60.316541 Hz   4:3     37.879 kHz     40.000000 MHz
    DMT 0x0a:   800x600    72.187572 Hz   4:3     48.077 kHz     50.000000 MHz
    DMT 0x0b:   800x600    75.000000 Hz   4:3     46.875 kHz     49.500000 MHz
    DMT 0x10:  1024x768    60.003840 Hz   4:3     48.363 kHz     65.000000 MHz
    DMT 0x11:  1024x768    70.069359 Hz   4:3     56.476 kHz     75.000000 MHz
    DMT 0x12:  1024x768    75.028582 Hz   4:3     60.023 kHz     78.750000 MHz
    DMT 0x24:  1280x1024   75.024675 Hz   5:4     79.976 kHz    135.000000 MHz
  Standard Timings:
    DMT 0x1c:  1280x800    59.810326 Hz  16:10    49.702 kHz     83.500000 MHz
    DMT 0x20:  1280x960    60.000000 Hz   4:3     60.000 kHz    108.000000 MHz
    DMT 0x2f:  1440x900    59.887445 Hz  16:10    55.935 kHz    106.500000 MHz
    DMT 0x55:  1280x720    60.000000 Hz  16:9     45.000 kHz     74.250000 MHz
  Detailed Timing Descriptors:
    DTD 1:  1680x1050   60.261708 Hz  16:10    65.625 kHz    147.000000 MHz
                 Hfront  104 Hsync 176 Hback  280 Hpol P
                 Vfront    3 Vsync   6 Vback   30 Vpol N
    DTD 2:  1440x900    59.887445 Hz  16:10    55.935 kHz    106.500000 MHz
                 Hfront   80 Hsync 152 Hback  232 Hpol P
                 Vfront    3 Vsync   6 Vback   25 Vpol P
    DTD 3:  1360x768    76.604182 Hz  85:48    61.283 kHz     85.000000 MHz (32 mm x 86 mm)
                 Hfront   48 Hsync 112 Hback -133 Hpol N
                 Vfront    3 Vsync   6 Vback   23 Vpol P
    Display Product Name: 'W ....'
Checksum: 0x07

----------------

Warnings:

Block 0, Base EDID:
  Detailed Timing Descriptor #2: DTD is similar but not identical to DMT 0x2f.
  Detailed Timing Descriptor #3: Dubious image size (32x86 mm is smaller than 100x100 mm).
  Display Product Name: Non-ASCII character 0xc8 at position 2, can cause problems.
  Display Product Name: Non-ASCII character 0xfd at position 3, can cause problems.
  Display Product Name: Non-ASCII character 0xd0 at position 4, can cause problems.
  Display Product Name: Non-ASCII character 0xc7 at position 5, can cause problems.

Failures:

Block 0, Base EDID:
  Detailed Timing Descriptor #1: Mismatch of image size vs display size: image size is not set, but display size is.
  Detailed Timing Descriptor #2: Mismatch of image size vs display size: image size is not set, but display size is.
  Detailed Timing Descriptor #3: 0 or negative horizontal back porch.
  Detailed Timing Descriptor #3: Mismatch of image size 32x86 mm vs display size 470x300 mm.
  Display Product Name: Non-space after newline.
  Missing Display Range Limits Descriptor.
EDID:
  Extension Block 1 started with EDID header, ignoring Extension Blocks >= 1.

EDID conformity: FAIL
