edid-decode (hex):

00 ff ff ff ff ff ff 00 24 b8 60 15 b8 22 00 00
1d 1b 01 03 00 1e 1a 78 ae b1 a5 a1 58 4f 95 26
16 50 54 a1 08 00 31 40 45 40 61 40 81 80 81 c0
81 40 81 00 71 40 7f 21 56 aa 51 00 1e 30 46 8f
33 00 2c 04 11 00 00 1e 66 21 50 b0 51 00 1b 30
40 70 36 00 2c 04 11 00 00 1e 00 00 00 fd 00 32
3d 1e 58 08 00 0a 20 20 20 20 20 20 00 00 00 fc
00 56 47 41 0a 20 20 20 20 20 20 20 20 20 00 f3

----------------

Block 0, Base EDID:
  EDID Structure Version & Revision: 1.3
  Vendor & Product Identification:
    Manufacturer: IEX
    Model: 5472
    Serial Number: ...
    Made in: week 29 of 2017
  Basic Display Parameters & Features:
    Analog display
    Signal Level Standard: 0.700 : 0.300 : 1.000 V p-p
    Blank level equals black level
    Maximum image size: 30 cm x 26 cm
    Gamma: 2.20
    DPMS levels: Standby Off
    RGB color display
    Default (sRGB) color space is primary color space
    First detailed timing is the preferred timing
  Color Characteristics:
    Red  : 0.6308, 0.3466
    Green: 0.3085, 0.5830
    Blue : 0.1503, 0.0878
    White: 0.3134, 0.3291
  Established Timings I & II:
    IBM     :   720x400    70.081663 Hz   9:5     31.467 kHz     28.320000 MHz
    DMT 0x04:   640x480    59.940476 Hz   4:3     31.469 kHz     25.175000 MHz
    DMT 0x09:   800x600    60.316541 Hz   4:3     37.879 kHz     40.000000 MHz
    DMT 0x10:  1024x768    60.003840 Hz   4:3     48.363 kHz     65.000000 MHz
  Standard Timings:
    DMT 0x04:   640x480    59.940476 Hz   4:3     31.469 kHz     25.175000 MHz
    DMT 0x09:   800x600    60.316541 Hz   4:3     37.879 kHz     40.000000 MHz
    DMT 0x10:  1024x768    60.003840 Hz   4:3     48.363 kHz     65.000000 MHz
    DMT 0x23:  1280x1024   60.019740 Hz   5:4     63.981 kHz    108.000000 MHz
    DMT 0x55:  1280x720    60.000000 Hz  16:9     45.000 kHz     74.250000 MHz
    DMT 0x20:  1280x960    60.000000 Hz   4:3     60.000 kHz    108.000000 MHz
    DMT 0x1c:  1280x800    59.810326 Hz  16:10    49.702 kHz     83.500000 MHz
    GTF     :  1152x864    60.000000 Hz   4:3     53.700 kHz     81.624000 MHz
  Detailed Timing Descriptors:
    DTD 1:  1366x768    59.964364 Hz 683:384   47.852 kHz     85.750000 MHz (300 mm x 260 mm)
                 Hfront   70 Hsync 143 Hback  213 Hpol P
                 Vfront    3 Vsync   3 Vback   24 Vpol P
    DTD 2:  1360x768    60.015162 Hz  85:48    47.712 kHz     85.500000 MHz (300 mm x 260 mm)
                 Hfront   64 Hsync 112 Hback  256 Hpol P
                 Vfront    3 Vsync   6 Vback   18 Vpol P
    Display Range Limits:
      Monitor ranges (GTF): 50-61 Hz V, 30-88 kHz H, max dotclock 80 MHz
    Display Product Name: 'VGA'
Checksum: 0xf3

----------------

Warnings:

Block 0, Base EDID:
  Vendor & Product Identification: The serial number is one of the known dummy values, it should probably be set to 0.
  Detailed Timing Descriptor #1: Image size is 300x260 mm, but based on the picture AR it should be 300x168 mm.
  Detailed Timing Descriptor #2: Image size is 300x260 mm, but based on the picture AR it should be 300x169 mm.
EDID:
  Base EDID: Some timings are out of range of the Monitor Ranges:
    Vertical Freq: 59.810 - 70.082 Hz (Monitor: 50.000 - 61.000 Hz)
    Maximum Clock: 108.000 MHz (Monitor: 80.000 MHz)

Failures:

Block 0, Base EDID:
  Basic Display Parameters & Features: sRGB is signaled, but the chromaticities do not match.

EDID conformity: FAIL
