edid-decode (hex):

00 ff ff ff ff ff ff 00 30 e4 94 9c 00 00 00 00
07 18 01 03 80 2b 1b 78 0a af f4 a7 55 50 9a 26
0f 50 54 00 00 00 01 01 01 01 01 01 01 01 01 01
01 01 01 01 01 01 40 38 80 00 71 38 14 40 60 40
84 00 d6 2c 11 00 00 1e 00 00 00 00 00 00 00 00
00 00 00 00 00 00 00 00 00 00 00 00 00 00 00 00
00 00 00 00 00 00 00 00 00 00 00 00 00 00 00 00
00 00 00 00 00 00 00 00 00 00 00 00 00 00 00 9b

----------------

Block 0, Base EDID:
  EDID Structure Version & Revision: 1.3
  Vendor & Product Identification:
    Manufacturer: LGD
    Model: 40084
    Made in: week 7 of 2014
  Basic Display Parameters & Features:
    Digital display
    Maximum image size: 43 cm x 27 cm
    Gamma: 2.20
    RGB color display
    First detailed timing is the preferred timing
  Color Characteristics:
    Red  : 0.6542, 0.3339
    Green: 0.3154, 0.6044
    Blue : 0.1513, 0.0615
    White: 0.3134, 0.3281
  Established Timings I & II: none
  Standard Timings: none
  Detailed Timing Descriptors:
    DTD 1:  1920x1080   60.160428 Hz  16:9     66.176 kHz    144.000000 MHz (470 mm x 300 mm)
                 Hfront   96 Hsync  64 Hback   96 Hpol P
                 Vfront    8 Vsync   4 Vback    8 Vpol P
    Empty Descriptor
    Empty Descriptor
    Empty Descriptor
Checksum: 0x9b

----------------

Warnings:

Block 0, Base EDID:
  Detailed Timing Descriptor #1: Image size is 470x300 mm, but based on the picture AR it should be 470x264 mm.

Failures:

Block 0, Base EDID:
  Detailed Timing Descriptor #1: Mismatch of image size 470x300 mm vs display size 430x270 mm.
  Empty Descriptor: Use Dummy Descriptor instead of all zeroes.
  Empty Descriptor: Use Dummy Descriptor instead of all zeroes.
  Empty Descriptor: Use Dummy Descriptor instead of all zeroes.
  Missing Display Product Name.
  Missing Display Range Limits Descriptor.
EDID:
  Base EDID: The DTD max image size is 470x300mm, which is larger than the display size 430.0x270.0mm.

EDID conformity: FAIL
