edid-decode (hex):

00 ff ff ff ff ff ff 00 1e 6d f5 76 01 01 01 01
01 18 01 03 80 46 27 78 ea f3 53 a5 54 51 93 26
12 48 49 23 08 00 01 01 81 c0 81 00 81 80 95 00
90 40 a9 c0 b3 00 02 3a 80 18 71 38 2d 40 58 2c
45 00 ba 88 21 00 00 1a 21 39 90 30 62 1a 27 40
68 b0 36 00 ba 88 21 00 00 1c 00 00 00 fd 00 38
3d 1e 53 0f 00 0a 20 20 20 20 20 20 00 00 00 fc
00 33 32 69 6e 63 68 20 4c 47 20 46 48 44 01 e4

02 03 1d f1 49 90 00 03 02 1d 00 10 11 13 23 09
07 07 83 01 00 00 66 03 0c 00 10 00 80 01 1d 00
73 51 d0 1e 20 38 88 15 00 56 50 21 00 00 1e 00
00 00 00 00 00 00 00 00 00 00 00 00 00 00 00 00
00 00 00 00 00 00 00 00 00 00 00 00 00 00 00 00
00 00 00 02 3a 80 d0 72 38 2d 40 10 2c 45 20 06
44 21 00 00 1e 02 3a 80 18 71 38 2d 40 58 2c 45
00 56 50 21 00 00 1e 00 00 00 00 00 00 00 00 ec

00 ff ff ff ff ff ff 00 1e 6d f5 76 01 01 01 01
01 18 01 03 80 46 27 78 ea f3 53 a5 54 51 93 26
12 48 49 23 08 00 01 01 81 c0 81 00 81 80 95 00
90 40 a9 c0 b3 00 02 3a 80 18 71 38 2d 40 58 2c
45 00 ba 88 21 00 00 1a 21 39 90 30 62 1a 27 40
68 b0 36 00 ba 88 21 00 00 1c 00 00 00 fd 00 38
3d 1e 53 0f 00 0a 20 20 20 20 20 20 00 00 00 fc
00 33 32 69 6e 63 68 20 4c 47 20 46 48 44 01 e4

02 03 1d f1 49 90 00 03 02 1d 00 10 11 13 23 09
07 07 83 01 00 00 66 03 0c 00 10 00 80 01 1d 00
73 51 d0 1e 20 38 88 15 00 56 50 21 00 00 1e 00
00 00 00 00 00 00 00 00 00 00 00 00 00 00 00 00
00 00 00 00 00 00 00 00 00 00 00 00 00 00 00 00
00 00 00 02 3a 80 d0 72 38 2d 40 10 2c 45 20 06
44 21 00 00 1e 02 3a 80 18 71 38 2d 40 58 2c 45
00 56 50 21 00 00 1e 00 00 00 00 00 00 00 00 ec

----------------

Block 0, Base EDID:
  EDID Structure Version & Revision: 1.3
  Vendor & Product Identification:
    Manufacturer: GSM
    Model: 30453
    Serial Number: ...
    Made in: week 1 of 2014
  Basic Display Parameters & Features:
    Digital display
    Maximum image size: 70 cm x 39 cm
    Gamma: 2.20
    DPMS levels: Standby Suspend Off
    RGB color display
    First detailed timing is the preferred timing
  Color Characteristics:
    Red  : 0.6474, 0.3310
    Green: 0.3164, 0.5771
    Blue : 0.1494, 0.0712
    White: 0.2812, 0.2880
  Established Timings I & II:
    DMT 0x04:   640x480    59.940476 Hz   4:3     31.469 kHz     25.175000 MHz
    DMT 0x08:   800x600    56.250000 Hz   4:3     35.156 kHz     36.000000 MHz
    DMT 0x09:   800x600    60.316541 Hz   4:3     37.879 kHz     40.000000 MHz
    DMT 0x10:  1024x768    60.003840 Hz   4:3     48.363 kHz     65.000000 MHz
  Standard Timings:
    DMT 0x55:  1280x720    60.000000 Hz  16:9     45.000 kHz     74.250000 MHz
    DMT 0x1c:  1280x800    59.810326 Hz  16:10    49.702 kHz     83.500000 MHz
    DMT 0x23:  1280x1024   60.019740 Hz   5:4     63.981 kHz    108.000000 MHz
    DMT 0x2f:  1440x900    59.887445 Hz  16:10    55.935 kHz    106.500000 MHz
    DMT 0x2a:  1400x1050   59.978442 Hz   4:3     65.317 kHz    121.750000 MHz
    DMT 0x53:  1600x900    60.000000 Hz  16:9     60.000 kHz    108.000000 MHz (RB)
    DMT 0x3a:  1680x1050   59.954250 Hz  16:10    65.290 kHz    146.250000 MHz
  Detailed Timing Descriptors:
    DTD 1:  1920x1080   60.000000 Hz  16:9     67.500 kHz    148.500000 MHz (698 mm x 392 mm)
                 Hfront   88 Hsync  44 Hback  148 Hpol P
                 Vfront    4 Vsync   5 Vback   36 Vpol N
    DTD 2:  1680x1050   59.954250 Hz  16:10    65.290 kHz    146.250000 MHz (698 mm x 392 mm)
                 Hfront  104 Hsync 176 Hback  280 Hpol N
                 Vfront    3 Vsync   6 Vback   30 Vpol P
    Display Range Limits:
      Monitor ranges (GTF): 56-61 Hz V, 30-83 kHz H, max dotclock 150 MHz
    Display Product Name: '32inch LG FHD'
  Extension blocks: 1
Checksum: 0xe4

----------------

Block 1, CTA-861 Extension Block:
  Revision: 3
  Underscans IT Video Formats by default
  Basic audio support
  Supports YCbCr 4:4:4
  Supports YCbCr 4:2:2
  Native DTDs: 1
  Video Data Block:
    VIC  16:  1920x1080   60.000000 Hz  16:9     67.500 kHz    148.500000 MHz (native)
    VIC   3:   720x480    59.940060 Hz  16:9     31.469 kHz     27.000000 MHz
    VIC   2:   720x480    59.940060 Hz   4:3     31.469 kHz     27.000000 MHz
    VIC  29:  1440x576    50.000000 Hz   4:3     31.250 kHz     54.000000 MHz
    VIC  16:  1920x1080   60.000000 Hz  16:9     67.500 kHz    148.500000 MHz
    VIC  17:   720x576    50.000000 Hz   4:3     31.250 kHz     27.000000 MHz
    VIC  19:  1280x720    50.000000 Hz  16:9     37.500 kHz     74.250000 MHz
  Audio Data Block:
    Linear PCM:
      Max channels: 2
      Supported sample rates (kHz): 48 44.1 32
      Supported sample sizes (bits): 24 20 16
  Speaker Allocation Data Block:
    FL/FR - Front Left/Right
  Vendor-Specific Data Block (HDMI), OUI 00-0C-03:
    Source physical address: 1.0.0.0
    Supports_AI
  Detailed Timing Descriptors:
    DTD 3:  1280x720    59.963658 Hz  16:9     44.973 kHz     74.250000 MHz (598 mm x 336 mm)
                 Hfront   56 Hsync 136 Hback  179 Hpol P
                 Vfront    1 Vsync   5 Vback   24 Vpol P
Checksum: 0xec  Unused space in Extension Block: 80 bytes

----------------

Warnings:

Block 0, Base EDID:
  Vendor & Product Identification: The serial number is one of the known dummy values, it should probably be set to 0.
  Detailed Timing Descriptor #1: DTD is similar but not identical to VIC 16.
  Detailed Timing Descriptor #2: Image size is 698x392 mm, but based on the picture AR it should be 627x392 mm.
Block 1, CTA-861 Extension Block:
  Video Data Block: VIC 16 and the first DTD are not identical. Is this intended?
  Add a Colorimetry Data Block with the sRGB colorimetry bit set to avoid interop issues.
EDID:
  Base EDID: Some timings are out of range of the Monitor Ranges:
    Vertical Freq: 50.000 - 60.317 Hz (Monitor: 56.000 - 61.000 Hz)

Failures:

Block 1, CTA-861 Extension Block:
  Video Data Block: Duplicate VIC 16.
  Detailed Timing Descriptor #3: Mismatch of image size 598x336 mm vs display size 700x390 mm.
  Padding: Contains non-zero bytes.
  Missing VCDB, needed for Set Selectable RGB Quantization to avoid interop issues.
EDID:
  Extension Block 2 started with EDID header, ignoring Extension Blocks >= 2.

EDID conformity: FAIL
