edid-decode (hex):

00 ff ff ff ff ff ff 00 09 e5 8c 05 00 00 00 00
01 13 01 03 90 1f 11 78 0a b4 70 9d 5b 53 9d 25
17 50 54 00 00 00 01 01 01 01 01 01 01 01 01 01
01 01 01 01 01 01 bb 1d 56 cc 50 00 28 30 30 20
36 00 35 ad 10 00 00 1a bb 1d 56 cc 50 00 28 30
30 20 36 00 35 ad 10 00 00 1a 00 00 00 fe 00 44
39 38 52 36 80 48 54 31 34 31 30 30 00 00 00 00
00 00 00 00 00 00 00 00 00 01 01 0a 20 20 00 30

----------------

Block 0, Base EDID:
  EDID Structure Version & Revision: 1.3
  Vendor & Product Identification:
    Manufacturer: BOE
    Model: 1420
    Made in: week 1 of 2009
  Basic Display Parameters & Features:
    Digital display
    Maximum image size: 31 cm x 17 cm
    Gamma: 2.20
    RGB color display
    First detailed timing is the preferred timing
  Color Characteristics:
    Red  : 0.6152, 0.3583
    Green: 0.3251, 0.6132
    Blue : 0.1455, 0.0927
    White: 0.3125, 0.3281
  Established Timings I & II: none
  Standard Timings: none
  Detailed Timing Descriptors:
    DTD 1:  1366x768    59.997162 Hz 683:384   48.478 kHz     76.110000 MHz (309 mm x 173 mm)
                 Hfront   48 Hsync  32 Hback  124 Hpol P
                 Vfront    3 Vsync   6 Vback   31 Vpol N
    DTD 2:  1366x768    59.997162 Hz 683:384   48.478 kHz     76.110000 MHz (309 mm x 173 mm)
                 Hfront   48 Hsync  32 Hback  124 Hpol P
                 Vfront    3 Vsync   6 Vback   31 Vpol N
    Alphanumeric Data String: 'D98R6.HT14100'
    Manufacturer-Specified Display Descriptor (0x00): 00 00 00 00 00 00 00 00 00 00 00 01 01 0a 20 20 '..............  '
Checksum: 0x30

----------------

Warnings:

Block 0, Base EDID:
  Alphanumeric Data String: Non-ASCII character 0x80 at position 5, can cause problems.

Failures:

Block 0, Base EDID:
  Basic Display Parameters & Features: Digital Video Interface Standard set to reserved value 0x10.
  Missing Display Product Name.
  Missing Display Range Limits Descriptor.

EDID conformity: FAIL
