edid-decode (hex):

00 ff ff ff ff ff ff 00 09 e5 02 0b 00 00 00 00
01 20 01 04 a5 22 13 78 03 68 50 98 5c 58 8e 28
1b 50 54 00 00 00 01 01 01 01 01 01 01 01 01 01
01 01 01 01 01 01 91 8a 80 04 71 38 32 40 30 20
35 00 58 c2 10 00 00 1a bd 39 80 04 71 38 32 40
30 20 35 00 58 c2 10 00 00 1a 00 00 00 fd 00 30
90 a3 a3 23 01 0a 20 20 20 20 20 20 00 00 00 fe
00 4e 45 31 35 36 46 48 4d 2d 4e 58 32 0a 00 1e

00 ff ff ff ff ff ff 00 09 e5 02 0b 00 00 00 00
01 20 01 04 a5 22 13 78 03 68 50 98 5c 58 8e 28
1b 50 54 00 00 00 01 01 01 01 01 01 01 01 01 01
01 01 01 01 01 01 91 8a 80 04 71 38 32 40 30 20
35 00 58 c2 10 00 00 1a bd 39 80 04 71 38 32 40
30 20 35 00 58 c2 10 00 00 1a 00 00 00 fd 00 30
90 a3 a3 23 01 0a 20 20 20 20 20 20 00 00 00 fe
00 4e 45 31 35 36 46 48 4d 2d 4e 58 32 0a 00 1e

----------------

Block 0, Base EDID:
  EDID Structure Version & Revision: 1.4
  Vendor & Product Identification:
    Manufacturer: BOE
    Model: 2818
    Made in: week 1 of 2022
  Basic Display Parameters & Features:
    Digital display
    Bits per primary color channel: 8
    DisplayPort interface
    Maximum image size: 34 cm x 19 cm
    Gamma: 2.20
    Supported color formats: RGB 4:4:4
    First detailed timing includes the native pixel format and preferred refresh rate
    Display supports continuous frequencies
  Color Characteristics:
    Red  : 0.5947, 0.3613
    Green: 0.3457, 0.5546
    Blue : 0.1572, 0.1064
    White: 0.3125, 0.3281
  Established Timings I & II: none
  Standard Timings: none
  Detailed Timing Descriptors:
    DTD 1:  1920x1080  144.000162 Hz  16:9    162.720 kHz    354.730000 MHz (344 mm x 194 mm)
                 Hfront   48 Hsync  32 Hback  180 Hpol P
                 Vfront    3 Vsync   5 Vback   42 Vpol N
    DTD 2:  1920x1080   60.002436 Hz  16:9     67.803 kHz    147.810000 MHz (344 mm x 194 mm)
                 Hfront   48 Hsync  32 Hback  180 Hpol P
                 Vfront    3 Vsync   5 Vback   42 Vpol N
    Display Range Limits:
      Monitor ranges (Range Limits Only): 48-144 Hz V, 163-163 kHz H, max dotclock 350 MHz
    Alphanumeric Data String: 'NE156FHM-NX2'
Checksum: 0x1e

----------------

Warnings:

Block 0, Base EDID:
  Missing Display Product Name.
EDID:
  Base EDID: Some timings are out of range of the Monitor Ranges:
    Horizontal Freq: 67.802 - 162.720 kHz (Monitor: 163.000 - 163.000 kHz)
    Maximum Clock: 354.730 MHz (Monitor: 350.000 MHz)

Failures:

EDID:
  Extension Block 1 started with EDID header, ignoring Extension Blocks >= 1.

EDID conformity: FAIL
