edid-decode (hex):

00 ff ff ff ff ff ff 00 1c 54 0c 32 01 01 01 01
2c 22 01 04 b5 45 27 78 fb 0a d5 af 4e 3e b5 24
0e 50 54 bf ef 80 71 4f 81 c0 81 00 81 40 81 80
95 00 a9 c0 b3 00 4d d0 00 a0 f0 70 3e 80 30 20
35 00 bb 8b 21 00 00 1a 00 00 00 fd 0c 30 a5 83
83 a0 01 0a 20 20 20 20 20 20 00 00 00 fc 00 4d
4f 33 32 55 0a 20 20 20 20 20 20 20 00 00 00 ff
00 32 34 34 34 30 42 30 30 31 37 35 37 0a 02 ba

02 03 3c 70 4f 61 76 75 60 5f 5e 3f 40 10 1f 0f
29 04 13 03 23 09 06 07 83 01 00 00 74 1a 00 00
03 03 30 a5 00 a0 67 02 4c 02 a5 00 00 00 00 00
00 e3 05 c3 01 e6 06 0d 01 67 4c 02 6f c2 00 a0
a0 a0 55 50 30 20 35 00 bb 8b 21 00 00 1a 56 5e
00 a0 a0 a0 29 50 30 20 35 00 bb 8b 21 00 00 1a
00 00 00 00 00 00 00 00 00 00 00 00 00 00 00 00
00 00 00 00 00 00 00 00 00 00 00 00 00 00 00 4b

70 12 79 03 00 03 01 50 a3 9c 00 04 7f 07 9f 00
2f 80 1f 00 37 04 58 00 02 00 04 00 3d 11 01 04
ff 09 9f 00 2f 80 1f 00 9f 05 76 00 02 00 04 00
ce ac 01 04 ff 0e 9f 00 2f 80 1f 00 6f 08 7e 00
02 00 04 00 bb 5a 02 04 ff 0e 9f 00 2f 80 1f 00
6f 08 b1 00 02 00 04 00 00 00 00 00 00 00 00 00
00 00 00 00 00 00 00 00 00 00 00 00 00 00 00 00
00 00 00 00 00 00 00 00 00 00 00 00 00 00 b0 90

00 ff ff ff ff ff ff 00 1c 54 0c 32 01 01 01 01
2c 22 01 04 b5 45 27 78 fb 0a d5 af 4e 3e b5 24
0e 50 54 bf ef 80 71 4f 81 c0 81 00 81 40 81 80
95 00 a9 c0 b3 00 4d d0 00 a0 f0 70 3e 80 30 20
35 00 bb 8b 21 00 00 1a 00 00 00 fd 0c 30 a5 83
83 a0 01 0a 20 20 20 20 20 20 00 00 00 fc 00 4d
4f 33 32 55 0a 20 20 20 20 20 20 20 00 00 00 ff
00 32 34 34 34 30 42 30 30 31 37 35 37 0a 02 ba

02 03 3c 70 4f 61 76 75 60 5f 5e 3f 40 10 1f 0f
29 04 13 03 23 09 06 07 83 01 00 00 74 1a 00 00
03 03 30 a5 00 a0 67 02 4c 02 a5 00 00 00 00 00
00 e3 05 c3 01 e6 06 0d 01 67 4c 02 6f c2 00 a0
a0 a0 55 50 30 20 35 00 bb 8b 21 00 00 1a 56 5e
00 a0 a0 a0 29 50 30 20 35 00 bb 8b 21 00 00 1a
00 00 00 00 00 00 00 00 00 00 00 00 00 00 00 00
00 00 00 00 00 00 00 00 00 00 00 00 00 00 00 4b

70 12 79 03 00 03 01 50 a3 9c 00 04 7f 07 9f 00
2f 80 1f 00 37 04 58 00 02 00 04 00 3d 11 01 04
ff 09 9f 00 2f 80 1f 00 9f 05 76 00 02 00 04 00
ce ac 01 04 ff 0e 9f 00 2f 80 1f 00 6f 08 7e 00
02 00 04 00 bb 5a 02 04 ff 0e 9f 00 2f 80 1f 00
6f 08 b1 00 02 00 04 00 00 00 00 00 00 00 00 00
00 00 00 00 00 00 00 00 00 00 00 00 00 00 00 00
00 00 00 00 00 00 00 00 00 00 00 00 00 00 b0 90

----------------

Block 0, Base EDID:
  EDID Structure Version & Revision: 1.4
  Vendor & Product Identification:
    Manufacturer: GBT
    Model: 12812
    Serial Number: ...
    Made in: week 44 of 2024
  Basic Display Parameters & Features:
    Digital display
    Bits per primary color channel: 10
    DisplayPort interface
    Maximum image size: 69 cm x 39 cm
    Gamma: 2.20
    DPMS levels: Standby Suspend Off
    Supported color formats: RGB 4:4:4, YCrCb 4:4:4, YCrCb 4:2:2
    First detailed timing includes the native pixel format and preferred refresh rate
    Display supports continuous frequencies
  Color Characteristics:
    Red  : 0.6835, 0.3046
    Green: 0.2441, 0.7089
    Blue : 0.1435, 0.0556
    White: 0.3134, 0.3291
  Established Timings I & II:
    IBM     :   720x400    70.081663 Hz   9:5     31.467 kHz     28.320000 MHz
    DMT 0x04:   640x480    59.940476 Hz   4:3     31.469 kHz     25.175000 MHz
    Apple   :   640x480    66.666667 Hz   4:3     35.000 kHz     30.240000 MHz
    DMT 0x05:   640x480    72.808802 Hz   4:3     37.861 kHz     31.500000 MHz
    DMT 0x06:   640x480    75.000000 Hz   4:3     37.500 kHz     31.500000 MHz
    DMT 0x08:   800x600    56.250000 Hz   4:3     35.156 kHz     36.000000 MHz
    DMT 0x09:   800x600    60.316541 Hz   4:3     37.879 kHz     40.000000 MHz
    DMT 0x0a:   800x600    72.187572 Hz   4:3     48.077 kHz     50.000000 MHz
    DMT 0x0b:   800x600    75.000000 Hz   4:3     46.875 kHz     49.500000 MHz
    Apple   :   832x624    74.551266 Hz   4:3     49.726 kHz     57.284000 MHz
    DMT 0x10:  1024x768    60.003840 Hz   4:3     48.363 kHz     65.000000 MHz
    DMT 0x11:  1024x768    70.069359 Hz   4:3     56.476 kHz     75.000000 MHz
    DMT 0x12:  1024x768    75.028582 Hz   4:3     60.023 kHz     78.750000 MHz
    DMT 0x24:  1280x1024   75.024675 Hz   5:4     79.976 kHz    135.000000 MHz
    Apple   :  1152x870    75.061550 Hz 192:145   68.681 kHz    100.000000 MHz
  Standard Timings:
    DMT 0x15:  1152x864    75.000000 Hz   4:3     67.500 kHz    108.000000 MHz
    DMT 0x55:  1280x720    60.000000 Hz  16:9     45.000 kHz     74.250000 MHz
    DMT 0x1c:  1280x800    59.810326 Hz  16:10    49.702 kHz     83.500000 MHz
    DMT 0x20:  1280x960    60.000000 Hz   4:3     60.000 kHz    108.000000 MHz
    DMT 0x23:  1280x1024   60.019740 Hz   5:4     63.981 kHz    108.000000 MHz
    DMT 0x2f:  1440x900    59.887445 Hz  16:10    55.935 kHz    106.500000 MHz
    DMT 0x53:  1600x900    60.000000 Hz  16:9     60.000 kHz    108.000000 MHz (RB)
    DMT 0x3a:  1680x1050   59.954250 Hz  16:10    65.290 kHz    146.250000 MHz
  Detailed Timing Descriptors:
    DTD 1:  3840x2160   59.996625 Hz  16:9    133.312 kHz    533.250000 MHz (699 mm x 395 mm)
                 Hfront   48 Hsync  32 Hback   80 Hpol P
                 Vfront    3 Vsync   5 Vback   54 Vpol N
    Display Range Limits:
      Monitor ranges (Range Limits Only): 48-165 Hz V, 386-386 kHz H, max dotclock 1600 MHz
    Display Product Name: 'MO32U'
    Display Product Serial Number: ...
  Extension blocks: 2
Checksum: 0xba

----------------

Block 1, CTA-861 Extension Block:
  Revision: 3
  Basic audio support
  Supports YCbCr 4:4:4
  Supports YCbCr 4:2:2
  Native DTDs: 0
  Video Data Block:
    VIC  97:  3840x2160   60.000000 Hz  16:9    135.000 kHz    594.000000 MHz
    VIC 118:  3840x2160  120.000000 Hz  16:9    270.000 kHz   1188.000000 MHz
    VIC 117:  3840x2160  100.000000 Hz  16:9    225.000 kHz   1188.000000 MHz
    VIC  96:  3840x2160   50.000000 Hz  16:9    112.500 kHz    594.000000 MHz
    VIC  95:  3840x2160   30.000000 Hz  16:9     67.500 kHz    297.000000 MHz
    VIC  94:  3840x2160   25.000000 Hz  16:9     56.250 kHz    297.000000 MHz
    VIC  63:  1920x1080  120.000000 Hz  16:9    135.000 kHz    297.000000 MHz
    VIC  64:  1920x1080  100.000000 Hz  16:9    112.500 kHz    297.000000 MHz
    VIC  16:  1920x1080   60.000000 Hz  16:9     67.500 kHz    148.500000 MHz
    VIC  31:  1920x1080   50.000000 Hz  16:9     56.250 kHz    148.500000 MHz
    VIC  15:  1440x480    59.940060 Hz  16:9     31.469 kHz     54.000000 MHz
    VIC  41:  1280x720   100.000000 Hz  16:9     75.000 kHz    148.500000 MHz
    VIC   4:  1280x720    60.000000 Hz  16:9     45.000 kHz     74.250000 MHz
    VIC  19:  1280x720    50.000000 Hz  16:9     37.500 kHz     74.250000 MHz
    VIC   3:   720x480    59.940060 Hz  16:9     31.469 kHz     27.000000 MHz
  Audio Data Block:
    Linear PCM:
      Max channels: 2
      Supported sample rates (kHz): 48 44.1
      Supported sample sizes (bits): 24 20 16
  Speaker Allocation Data Block:
    FL/FR - Front Left/Right
  Vendor-Specific Data Block (AMD), OUI 00-00-1A:
    Version: 3
    Flags 1: 0x03
      FreeSync Supported
      FreeSync 2 HDR Supported
    Minimum Refresh Rate: 48 Hz
    Maximum Refresh Rate: 165 Hz
    Flags 5: 0xa0
      Display is OLED
      ST 2084 (PQ) EOTF Supported
    Maximum luminance: 103 (465.490 cd/m^2)
    Minimum luminance: 2 (0.000 cd/m^2)
    Maximum luminance (without local dimming): 76 (259.368 cd/m^2)
    Minimum luminance (without local dimming): 2 (0.000 cd/m^2)
  Colorimetry Data Block:
    xvYCC601
    xvYCC709
    BT2020YCC
    BT2020RGB
    Gamut Boundary Description Metadata Profile P0
  HDR Static Metadata Data Block:
    Electro optical transfer functions:
      Traditional gamma - SDR luminance range
      SMPTE ST2084
      Hybrid Log-Gamma
    Supported static metadata descriptors:
      Static metadata type 1
    Desired content max luminance: 103 (465.490 cd/m^2)
    Desired content max frame-average luminance: 76 (259.368 cd/m^2)
    Desired content min luminance: 2 (0.000 cd/m^2)
  Detailed Timing Descriptors:
    DTD 2:  2560x1440  119.997589 Hz  16:9    182.996 kHz    497.750000 MHz (699 mm x 395 mm)
                 Hfront   48 Hsync  32 Hback   80 Hpol P
                 Vfront    3 Vsync   5 Vback   77 Vpol N
    DTD 3:  2560x1440   59.950550 Hz  16:9     88.787 kHz    241.500000 MHz (699 mm x 395 mm)
                 Hfront   48 Hsync  32 Hback   80 Hpol P
                 Vfront    3 Vsync   5 Vback   33 Vpol N
Checksum: 0x4b  Unused space in Extension Block: 31 bytes

----------------

Block 2, DisplayID Extension Block:
  Version: 1.2
  Extension Count: 0
  Display Product Type: Standalone display device
  Video Timing Modes Type 1 - Detailed Timings Data Block:
    DTD:  1920x1080  164.917418 Hz  16:9    192.788 kHz    401.000000 MHz (aspect 16:9, no 3D stereo)
               Hfront   48 Hsync  32 Hback   80 Hpol P
               Vfront    3 Vsync   5 Vback   81 Vpol N
    DTD:  2560x1440  164.957741 Hz  16:9    257.169 kHz    699.500000 MHz (aspect 16:9, no 3D stereo)
               Hfront   48 Hsync  32 Hback   80 Hpol P
               Vfront    3 Vsync   5 Vback  111 Vpol N
    DTD:  3840x2160  119.998907 Hz  16:9    274.438 kHz   1097.750000 MHz (aspect 16:9, no 3D stereo)
               Hfront   48 Hsync  32 Hback   80 Hpol P
               Vfront    3 Vsync   5 Vback  119 Vpol N
    DTD:  3840x2160  164.991446 Hz  16:9    385.750 kHz   1543.000000 MHz (aspect 16:9, no 3D stereo)
               Hfront   48 Hsync  32 Hback   80 Hpol P
               Vfront    3 Vsync   5 Vback  170 Vpol N
  Checksum: 0xb0
Checksum: 0x90

----------------

Warnings:

Block 0, Base EDID:
  Vendor & Product Identification: The serial number is one of the known dummy values, it should probably be set to 0.
Block 1, CTA-861 Extension Block:
  IT Video Formats are overscanned by default, but normally this should be underscanned.
  Video Data Block: VIC 97 and the first DTD are not identical. Is this intended?
  Colorimetry Data Block: Set the sRGB colorimetry bit to avoid interop issues.
  Display Product Serial Number is set, so the Serial Number in the Base EDID should be 0.
EDID:
  Base EDID: Some timings are out of range of the Monitor Ranges:
    Vertical Freq: 25.000 - 164.991 Hz (Monitor: 48.000 - 165.000 Hz)
    Horizontal Freq: 31.466 - 385.750 kHz (Monitor: 386.000 - 386.000 kHz)

Failures:

Block 1, CTA-861 Extension Block:
  Missing VCDB, needed for Set Selectable RGB Quantization to avoid interop issues.
EDID:
  Extension Block 3 started with EDID header, ignoring Extension Blocks >= 3.
  DisplayID: Missing DisplayID Display Parameters Data Block.
  DisplayID: DisplayID expects at least one preferred timing.

EDID conformity: FAIL
