edid-decode (hex):

00 ff ff ff ff ff ff 00 10 ac 46 41 01 00 46 41
31 1a 01 04 a5 3d 24 78 3a 28 95 a7 55 4e a3 26
0f 50 54 21 08 00 d1 c0 a9 c0 95 00 01 01 81 80
01 01 01 01 01 01 4d d0 00 a0 f0 70 3e 80 30 20
35 00 61 63 21 00 00 1e 66 21 56 aa 51 00 1e 30
46 8f 33 00 17 39 21 00 00 1e 00 00 00 fc 00 49
6e 73 70 69 72 6f 6e 20 37 37 37 35 00 00 00 00
00 03 41 02 99 00 00 00 00 02 01 0a 20 20 00 5b

----------------

Block 0, Base EDID:
  EDID Structure Version & Revision: 1.4
  Vendor & Product Identification:
    Manufacturer: DEL
    Model: 16710
    Serial Number: ...
    Made in: week 49 of 2016
  Basic Display Parameters & Features:
    Digital display
    Bits per primary color channel: 8
    DisplayPort interface
    Maximum image size: 61 cm x 36 cm
    Gamma: 2.20
    DPMS levels: Off
    Supported color formats: RGB 4:4:4, YCrCb 4:4:4, YCrCb 4:2:2
    First detailed timing includes the native pixel format and preferred refresh rate
  Color Characteristics:
    Red  : 0.6523, 0.3339
    Green: 0.3066, 0.6367
    Blue : 0.1503, 0.0595
    White: 0.3134, 0.3291
  Established Timings I & II:
    DMT 0x04:   640x480    59.940476 Hz   4:3     31.469 kHz     25.175000 MHz
    DMT 0x09:   800x600    60.316541 Hz   4:3     37.879 kHz     40.000000 MHz
    DMT 0x10:  1024x768    60.003840 Hz   4:3     48.363 kHz     65.000000 MHz
  Standard Timings:
    DMT 0x52:  1920x1080   60.000000 Hz  16:9     67.500 kHz    148.500000 MHz
    DMT 0x53:  1600x900    60.000000 Hz  16:9     60.000 kHz    108.000000 MHz (RB)
    DMT 0x2f:  1440x900    59.887445 Hz  16:10    55.935 kHz    106.500000 MHz
    DMT 0x23:  1280x1024   60.019740 Hz   5:4     63.981 kHz    108.000000 MHz
  Detailed Timing Descriptors:
    DTD 1:  3840x2160   59.996625 Hz  16:9    133.312 kHz    533.250000 MHz (609 mm x 355 mm)
                 Hfront   48 Hsync  32 Hback   80 Hpol P
                 Vfront    3 Vsync   5 Vback   54 Vpol P
    DTD 2:  1366x768    59.789541 Hz 683:384   47.712 kHz     85.500000 MHz (535 mm x 313 mm)
                 Hfront   70 Hsync 143 Hback  213 Hpol P
                 Vfront    3 Vsync   3 Vback   24 Vpol P
    Display Product Name: 'Inspiron 7775'
    Manufacturer-Specified Display Descriptor (0x00): 00 00 00 03 41 02 99 00 00 00 00 02 01 0a 20 20 '....A.........  '
Checksum: 0x5b

----------------

Warnings:

Block 0, Base EDID:
  Detailed Timing Descriptor #1: Image size is 609x355 mm, but based on the picture AR it should be 609x342 mm.
  Detailed Timing Descriptor #2: Image size is 535x313 mm, but based on the picture AR it should be 535x300 mm.

Failures:

Block 0, Base EDID:
  Detailed Timing Descriptor #2: Mismatch of image size 535x313 mm vs display size 610x360 mm.

EDID conformity: FAIL
