edid-decode (hex):

00 ff ff ff ff ff ff 00 4d d9 02 d9 01 01 01 01
01 17 01 03 80 68 3b 78 0a 0d c9 a0 57 47 98 27
12 48 4c 21 08 00 81 80 a9 c0 01 01 01 01 01 01
01 01 01 01 01 01 02 3a 80 18 71 38 2d 40 58 2c
45 00 10 49 42 00 00 1e 01 1d 00 72 51 d0 1e 20
6e 28 55 00 10 49 42 00 00 1e 00 00 00 fc 00 53
4f 4e 59 20 54 56 20 20 2a 30 31 0a 00 00 00 fd
00 30 3e 0e 46 0f 00 0a 20 20 20 20 20 20 01 ac

----------------

Block 0, Base EDID:
  EDID Structure Version & Revision: 1.3
  Vendor & Product Identification:
    Manufacturer: SNY
    Model: 55554
    Serial Number: ...
    Made in: week 1 of 2013
  Basic Display Parameters & Features:
    Digital display
    Maximum image size: 104 cm x 59 cm
    Gamma: 2.20
    RGB color display
    First detailed timing is the preferred timing
  Color Characteristics:
    Red  : 0.6250, 0.3398
    Green: 0.2802, 0.5947
    Blue : 0.1552, 0.0703
    White: 0.2832, 0.2978
  Established Timings I & II:
    DMT 0x04:   640x480    59.940476 Hz   4:3     31.469 kHz     25.175000 MHz
    DMT 0x09:   800x600    60.316541 Hz   4:3     37.879 kHz     40.000000 MHz
    DMT 0x10:  1024x768    60.003840 Hz   4:3     48.363 kHz     65.000000 MHz
  Standard Timings:
    DMT 0x23:  1280x1024   60.019740 Hz   5:4     63.981 kHz    108.000000 MHz
    DMT 0x53:  1600x900    60.000000 Hz  16:9     60.000 kHz    108.000000 MHz (RB)
  Detailed Timing Descriptors:
    DTD 1:  1920x1080   60.000000 Hz  16:9     67.500 kHz    148.500000 MHz (1040 mm x 585 mm)
                 Hfront   88 Hsync  44 Hback  148 Hpol P
                 Vfront    4 Vsync   5 Vback   36 Vpol P
    DTD 2:  1280x720    60.000000 Hz  16:9     45.000 kHz     74.250000 MHz (1040 mm x 585 mm)
                 Hfront  110 Hsync  40 Hback  220 Hpol P
                 Vfront    5 Vsync   5 Vback   20 Vpol P
    Display Product Name: 'SONY TV  *01'
    Display Range Limits:
      Monitor ranges (GTF): 48-62 Hz V, 14-70 kHz H, max dotclock 150 MHz
  Extension blocks: 1
Checksum: 0xac

----------------

Warnings:

Block 0, Base EDID:
  Vendor & Product Identification: The serial number is one of the known dummy values, it should probably be set to 0.

Failures:

EDID:
  Base EDID: EDID specified 1 extension block(s), but found 0 extension block(s).

EDID conformity: FAIL
