edid-decode (hex):

00 ff ff ff ff ff ff 00 1e 6d 01 00 01 01 01 01
01 16 01 03 80 a0 5a 78 0a ee 91 a3 54 4c 99 26
0f 50 54 a1 08 00 31 40 45 40 61 40 71 40 81 80
01 01 01 01 01 01 02 3a 80 18 71 38 2d 40 58 2c
45 00 a0 5a 00 00 00 1e 66 21 50 b0 51 00 1b 30
40 70 36 00 a0 5a 00 00 00 1e 00 00 00 fd 00 3a
3e 1e 53 10 00 0a 20 20 20 20 20 20 00 00 00 fc
00 4c 47 20 54 56 0a 20 20 20 20 20 20 20 01 43

02 03 26 f1 4e 10 9f 04 13 13 13 03 02 13 20 21
22 22 01 26 09 07 07 09 07 07 67 03 0c 00 10 00
80 2d e3 05 00 00 01 1d 00 72 51 d0 1e 20 6e 28
55 00 a0 5a 00 00 00 1e 01 1d 00 80 51 d0 1a 20
6e 88 55 00 a0 5a 00 00 00 1a 02 3a 80 18 71 38
2d 40 58 2c 45 00 a0 5a 00 00 00 1e 66 21 50 b0
51 00 1b 30 40 70 36 00 a0 5a 00 00 00 1e 00 00
00 00 00 00 00 00 00 00 00 00 00 00 00 00 00 67

00 ff ff ff ff ff ff 00 1e 6d 01 00 01 01 01 01
01 16 01 03 80 a0 5a 78 0a ee 91 a3 54 4c 99 26
0f 50 54 a1 08 00 31 40 45 40 61 40 71 40 81 80
01 01 01 01 01 01 02 3a 80 18 71 38 2d 40 58 2c
45 00 a0 5a 00 00 00 1e 66 21 50 b0 51 00 1b 30
40 70 36 00 a0 5a 00 00 00 1e 00 00 00 fd 00 3a
3e 1e 53 10 00 0a 20 20 20 20 20 20 00 00 00 fc
00 4c 47 20 54 56 0a 20 20 20 20 20 20 20 01 43

02 03 26 f1 4e 10 9f 04 13 13 13 03 02 13 20 21
22 22 01 26 09 07 07 09 07 07 67 03 0c 00 10 00
80 2d e3 05 00 00 01 1d 00 72 51 d0 1e 20 6e 28
55 00 a0 5a 00 00 00 1e 01 1d 00 80 51 d0 1a 20
6e 88 55 00 a0 5a 00 00 00 1a 02 3a 80 18 71 38
2d 40 58 2c 45 00 a0 5a 00 00 00 1e 66 21 50 b0
51 00 1b 30 40 70 36 00 a0 5a 00 00 00 1e 00 00
00 00 00 00 00 00 00 00 00 00 00 00 00 00 00 67

----------------

Block 0, Base EDID:
  EDID Structure Version & Revision: 1.3
  Vendor & Product Identification:
    Manufacturer: GSM
    Model: 1
    Serial Number: ...
    Made in: week 1 of 2012
  Basic Display Parameters & Features:
    Digital display
    Maximum image size: 160 cm x 90 cm
    Gamma: 2.20
    RGB color display
    First detailed timing is the preferred timing
  Color Characteristics:
    Red  : 0.6396, 0.3300
    Green: 0.2998, 0.5996
    Blue : 0.1503, 0.0595
    White: 0.3125, 0.3291
  Established Timings I & II:
    IBM     :   720x400    70.081663 Hz   9:5     31.467 kHz     28.320000 MHz
    DMT 0x04:   640x480    59.940476 Hz   4:3     31.469 kHz     25.175000 MHz
    DMT 0x09:   800x600    60.316541 Hz   4:3     37.879 kHz     40.000000 MHz
    DMT 0x10:  1024x768    60.003840 Hz   4:3     48.363 kHz     65.000000 MHz
  Standard Timings:
    DMT 0x04:   640x480    59.940476 Hz   4:3     31.469 kHz     25.175000 MHz
    DMT 0x09:   800x600    60.316541 Hz   4:3     37.879 kHz     40.000000 MHz
    DMT 0x10:  1024x768    60.003840 Hz   4:3     48.363 kHz     65.000000 MHz
    GTF     :  1152x864    60.000000 Hz   4:3     53.700 kHz     81.624000 MHz
    DMT 0x23:  1280x1024   60.019740 Hz   5:4     63.981 kHz    108.000000 MHz
  Detailed Timing Descriptors:
    DTD 1:  1920x1080   60.000000 Hz  16:9     67.500 kHz    148.500000 MHz (160 mm x 90 mm)
                 Hfront   88 Hsync  44 Hback  148 Hpol P
                 Vfront    4 Vsync   5 Vback   36 Vpol P
    DTD 2:  1360x768    60.015162 Hz  85:48    47.712 kHz     85.500000 MHz (160 mm x 90 mm)
                 Hfront   64 Hsync 112 Hback  256 Hpol P
                 Vfront    3 Vsync   6 Vback   18 Vpol P
    Display Range Limits:
      Monitor ranges (GTF): 58-62 Hz V, 30-83 kHz H, max dotclock 160 MHz
    Display Product Name: 'LG TV'
  Extension blocks: 1
Checksum: 0x43

----------------

Block 1, CTA-861 Extension Block:
  Revision: 3
  Underscans IT Video Formats by default
  Basic audio support
  Supports YCbCr 4:4:4
  Supports YCbCr 4:2:2
  Native DTDs: 1
  Video Data Block:
    VIC  16:  1920x1080   60.000000 Hz  16:9     67.500 kHz    148.500000 MHz
    VIC  31:  1920x1080   50.000000 Hz  16:9     56.250 kHz    148.500000 MHz (native)
    VIC   4:  1280x720    60.000000 Hz  16:9     45.000 kHz     74.250000 MHz
    VIC  19:  1280x720    50.000000 Hz  16:9     37.500 kHz     74.250000 MHz
    VIC  19:  1280x720    50.000000 Hz  16:9     37.500 kHz     74.250000 MHz
    VIC  19:  1280x720    50.000000 Hz  16:9     37.500 kHz     74.250000 MHz
    VIC   3:   720x480    59.940060 Hz  16:9     31.469 kHz     27.000000 MHz
    VIC   2:   720x480    59.940060 Hz   4:3     31.469 kHz     27.000000 MHz
    VIC  19:  1280x720    50.000000 Hz  16:9     37.500 kHz     74.250000 MHz
    VIC  32:  1920x1080   24.000000 Hz  16:9     27.000 kHz     74.250000 MHz
    VIC  33:  1920x1080   25.000000 Hz  16:9     28.125 kHz     74.250000 MHz
    VIC  34:  1920x1080   30.000000 Hz  16:9     33.750 kHz     74.250000 MHz
    VIC  34:  1920x1080   30.000000 Hz  16:9     33.750 kHz     74.250000 MHz
    VIC   1:   640x480    59.940476 Hz   4:3     31.469 kHz     25.175000 MHz
  Audio Data Block:
    Linear PCM:
      Max channels: 2
      Supported sample rates (kHz): 48 44.1 32
      Supported sample sizes (bits): 24 20 16
    Linear PCM:
      Max channels: 2
      Supported sample rates (kHz): 48 44.1 32
      Supported sample sizes (bits): 24 20 16
  Vendor-Specific Data Block (HDMI), OUI 00-0C-03:
    Source physical address: 1.0.0.0
    Supports_AI
    Maximum TMDS clock: 225 MHz
  Colorimetry Data Block:
  Detailed Timing Descriptors:
    DTD 3:  1280x720    60.000000 Hz  16:9     45.000 kHz     74.250000 MHz (160 mm x 90 mm)
                 Hfront  110 Hsync  40 Hback  220 Hpol P
                 Vfront    5 Vsync   5 Vback   20 Vpol P
    DTD 4:  1280x720    59.814201 Hz  16:9     44.621 kHz     74.250000 MHz (160 mm x 90 mm)
                 Hfront  110 Hsync 136 Hback  138 Hpol P
                 Vfront    5 Vsync   5 Vback   16 Vpol N
    DTD 5:  1920x1080   60.000000 Hz  16:9     67.500 kHz    148.500000 MHz (160 mm x 90 mm)
                 Hfront   88 Hsync  44 Hback  148 Hpol P
                 Vfront    4 Vsync   5 Vback   36 Vpol P
    DTD 6:  1360x768    60.015162 Hz  85:48    47.712 kHz     85.500000 MHz (160 mm x 90 mm)
                 Hfront   64 Hsync 112 Hback  256 Hpol P
                 Vfront    3 Vsync   6 Vback   18 Vpol P
Checksum: 0x67  Unused space in Extension Block: 17 bytes

----------------

Warnings:

Block 0, Base EDID:
  Vendor & Product Identification: The serial number is one of the known dummy values, it should probably be set to 0.
  Detailed Timing Descriptor #1: Dubious image size (160x90 mm is smaller than 100x100 mm).
  Detailed Timing Descriptor #2: Dubious image size (160x90 mm is smaller than 100x100 mm).
Block 1, CTA-861 Extension Block:
  Detailed Timing Descriptor #3: Dubious image size (160x90 mm is smaller than 100x100 mm).
  Detailed Timing Descriptor #4: Dubious image size (160x90 mm is smaller than 100x100 mm).
  Detailed Timing Descriptor #5: Dubious image size (160x90 mm is smaller than 100x100 mm).
  Detailed Timing Descriptor #6: Dubious image size (160x90 mm is smaller than 100x100 mm).
EDID:
  Base EDID: Some timings are out of range of the Monitor Ranges:
    Vertical Freq: 24.000 - 70.082 Hz (Monitor: 58.000 - 62.000 Hz)
    Horizontal Freq: 27.000 - 67.500 kHz (Monitor: 30.000 - 83.000 kHz)

Failures:

Block 0, Base EDID:
  Basic Display Parameters & Features: The chromaticities match sRGB, but sRGB is not signaled.
  Detailed Timing Descriptor #1: Mismatch of image size 160x90 mm vs display size 1600x900 mm.
  Detailed Timing Descriptor #2: Mismatch of image size 160x90 mm vs display size 1600x900 mm.
Block 1, CTA-861 Extension Block:
  Video Data Block: Duplicate VIC 19.
  Video Data Block: Duplicate VIC 34.
  Detailed Timing Descriptor #3: Mismatch of image size 160x90 mm vs display size 1600x900 mm.
  Detailed Timing Descriptor #4: Mismatch of image size 160x90 mm vs display size 1600x900 mm.
  Detailed Timing Descriptor #5: Mismatch of image size 160x90 mm vs display size 1600x900 mm.
  Detailed Timing Descriptor #6: Mismatch of image size 160x90 mm vs display size 1600x900 mm.
  Missing VCDB, needed for Set Selectable RGB Quantization to avoid interop issues.
EDID:
  Extension Block 2 started with EDID header, ignoring Extension Blocks >= 2.

EDID conformity: FAIL
