edid-decode (hex):

00 ff ff ff ff ff ff 00 1e 6d 01 00 01 01 01 01
09 12 01 03 80 73 41 96 0a cf 74 a3 57 4c b0 23
09 48 4c 21 08 00 01 01 01 01 01 01 01 01 01 01
01 01 01 01 01 01 1b 21 50 a0 51 00 1e 30 40 88
36 00 c4 8e 21 00 00 1e 0e 1f 00 80 51 00 1e 30
40 80 37 00 c4 8e 21 00 00 1e 00 00 00 fd 00 38
3f 1f 3c 09 00 0a 20 20 20 20 20 20 00 00 00 fc
00 4c 47 20 54 56 0a 20 20 20 20 20 20 20 01 3d

02 03 18 f1 47 84 05 03 02 20 22 10 23 15 07 50
67 03 0c 00 30 00 b8 2d 01 1d 00 72 51 d0 1e 20
6e 28 55 00 c4 8e 21 00 00 1e 01 1d 80 18 71 1c
16 20 58 2c 25 00 c4 8e 21 00 00 9e 8c 0a d0 8a
20 e0 2d 10 10 3e 96 00 c4 8e 21 00 00 18 8c 0a
d0 8a 20 e0 2d 10 10 3e 96 00 13 8e 21 00 00 18
26 36 80 a0 70 38 1f 40 30 20 25 00 c4 8e 21 00
00 1a 00 00 00 00 00 00 00 00 00 00 00 00 00 07

00 ff ff ff ff ff ff 00 1e 6d 01 00 01 01 01 01
09 12 01 03 80 73 41 96 0a cf 74 a3 57 4c b0 23
09 48 4c 21 08 00 01 01 01 01 01 01 01 01 01 01
01 01 01 01 01 01 1b 21 50 a0 51 00 1e 30 40 88
36 00 c4 8e 21 00 00 1e 0e 1f 00 80 51 00 1e 30
40 80 37 00 c4 8e 21 00 00 1e 00 00 00 fd 00 38
3f 1f 3c 09 00 0a 20 20 20 20 20 20 00 00 00 fc
00 4c 47 20 54 56 0a 20 20 20 20 20 20 20 01 3d

02 03 18 f1 47 84 05 03 02 20 22 10 23 15 07 50
67 03 0c 00 30 00 b8 2d 01 1d 00 72 51 d0 1e 20
6e 28 55 00 c4 8e 21 00 00 1e 01 1d 80 18 71 1c
16 20 58 2c 25 00 c4 8e 21 00 00 9e 8c 0a d0 8a
20 e0 2d 10 10 3e 96 00 c4 8e 21 00 00 18 8c 0a
d0 8a 20 e0 2d 10 10 3e 96 00 13 8e 21 00 00 18
26 36 80 a0 70 38 1f 40 30 20 25 00 c4 8e 21 00
00 1a 00 00 00 00 00 00 00 00 00 00 00 00 00 07

----------------

Block 0, Base EDID:
  EDID Structure Version & Revision: 1.3
  Vendor & Product Identification:
    Manufacturer: GSM
    Model: 1
    Serial Number: ...
    Made in: week 9 of 2008
  Basic Display Parameters & Features:
    Digital display
    Maximum image size: 115 cm x 65 cm
    Gamma: 2.50
    RGB color display
    First detailed timing is the preferred timing
  Color Characteristics:
    Red  : 0.6396, 0.3398
    Green: 0.2998, 0.6904
    Blue : 0.1376, 0.0380
    White: 0.2822, 0.2968
  Established Timings I & II:
    DMT 0x04:   640x480    59.940476 Hz   4:3     31.469 kHz     25.175000 MHz
    DMT 0x09:   800x600    60.316541 Hz   4:3     37.879 kHz     40.000000 MHz
    DMT 0x10:  1024x768    60.003840 Hz   4:3     48.363 kHz     65.000000 MHz
  Standard Timings: none
  Detailed Timing Descriptors:
    DTD  1:  1360x768    59.798991 Hz  85:48    47.720 kHz     84.750000 MHz (708 mm x 398 mm)
                  Hfront   64 Hsync 136 Hback  216 Hpol P
                  Vfront    3 Vsync   6 Vback   21 Vpol P
    DTD  2:  1280x768    59.870228 Hz   5:3     47.776 kHz     79.500000 MHz (708 mm x 398 mm)
                  Hfront   64 Hsync 128 Hback  192 Hpol P
                  Vfront    3 Vsync   7 Vback   20 Vpol P
    Display Range Limits:
      Monitor ranges (GTF): 56-63 Hz V, 31-60 kHz H, max dotclock 90 MHz
    Display Product Name: 'LG TV'
  Extension blocks: 1
Checksum: 0x3d

----------------

Block 1, CTA-861 Extension Block:
  Revision: 3
  Underscans IT Video Formats by default
  Basic audio support
  Supports YCbCr 4:4:4
  Supports YCbCr 4:2:2
  Native detailed modes: 1
  Video Data Block:
    VIC   4:  1280x720    60.000000 Hz  16:9     45.000 kHz     74.250000 MHz (native)
    VIC   5:  1920x1080i  60.000000 Hz  16:9     33.750 kHz     74.250000 MHz
    VIC   3:   720x480    59.940060 Hz  16:9     31.469 kHz     27.000000 MHz
    VIC   2:   720x480    59.940060 Hz   4:3     31.469 kHz     27.000000 MHz
    VIC  32:  1920x1080   24.000000 Hz  16:9     27.000 kHz     74.250000 MHz
    VIC  34:  1920x1080   30.000000 Hz  16:9     33.750 kHz     74.250000 MHz
    VIC  16:  1920x1080   60.000000 Hz  16:9     67.500 kHz    148.500000 MHz
  Audio Data Block:
    AC-3:
      Max channels: 6
      Supported sample rates (kHz): 48 44.1 32
      Maximum bit rate: 640 kb/s
  Vendor-Specific Data Block (HDMI), OUI 00-0C-03:
    Source physical address: 3.0.0.0
    Supports_AI
    DC_36bit
    DC_30bit
    DC_Y444
    Maximum TMDS clock: 225 MHz
  Detailed Timing Descriptors:
    DTD  3:  1280x720    60.000000 Hz  16:9     45.000 kHz     74.250000 MHz (708 mm x 398 mm)
                  Hfront  110 Hsync  40 Hback  220 Hpol P
                  Vfront    5 Vsync   5 Vback   20 Vpol P
    DTD  4:  1920x1080i  60.000000 Hz  16:9     33.750 kHz     74.250000 MHz (708 mm x 398 mm)
                  Hfront   88 Hsync  44 Hback  148 Hpol P
                  Vfront    2 Vsync   5 Vback   15 Vpol P Vfront +0.5 Odd Field
                  Vfront    2 Vsync   5 Vback   15 Vpol P Vback  +0.5 Even Field
    DTD  5:   720x480    59.940060 Hz   3:2     31.469 kHz     27.000000 MHz (708 mm x 398 mm)
                  Hfront   16 Hsync  62 Hback   60 Hpol N
                  Vfront    9 Vsync   6 Vback   30 Vpol N
    DTD  6:   720x480    59.940060 Hz   3:2     31.469 kHz     27.000000 MHz (531 mm x 398 mm)
                  Hfront   16 Hsync  62 Hback   60 Hpol N
                  Vfront    9 Vsync   6 Vback   30 Vpol N
    DTD  7:  1920x1080   59.985806 Hz  16:9     66.644 kHz    138.620000 MHz (708 mm x 398 mm)
                  Hfront   48 Hsync  32 Hback   80 Hpol P
                  Vfront    2 Vsync   5 Vback   24 Vpol N
Checksum: 0x07  Unused space in Extension Block: 13 bytes

----------------

Block 2, Unknown EDID Extension Block 0x00:
  00 ff ff ff ff ff ff 00 1e 6d 01 00 01 01 01 01 '.........m......'
  09 12 01 03 80 73 41 96 0a cf 74 a3 57 4c b0 23 '.....sA...t.WL.#'
  09 48 4c 21 08 00 01 01 01 01 01 01 01 01 01 01 '.HL!............'
  01 01 01 01 01 01 1b 21 50 a0 51 00 1e 30 40 88 '.......!P.Q..0@.'
  36 00 c4 8e 21 00 00 1e 0e 1f 00 80 51 00 1e 30 '6...!.......Q..0'
  40 80 37 00 c4 8e 21 00 00 1e 00 00 00 fd 00 38 '@.7...!........8'
  3f 1f 3c 09 00 0a 20 20 20 20 20 20 00 00 00 fc '?.<...      ....'
  00 4c 47 20 54 56 0a 20 20 20 20 20 20 20 01 3d '.LG TV.       .='
Checksum: 0x3d

----------------

Block 3, CTA-861 Extension Block:
  Revision: 3
  Underscans IT Video Formats by default
  Basic audio support
  Supports YCbCr 4:4:4
  Supports YCbCr 4:2:2
  Native detailed modes: 1
  Video Data Block:
    VIC   4:  1280x720    60.000000 Hz  16:9     45.000 kHz     74.250000 MHz (native)
    VIC   5:  1920x1080i  60.000000 Hz  16:9     33.750 kHz     74.250000 MHz
    VIC   3:   720x480    59.940060 Hz  16:9     31.469 kHz     27.000000 MHz
    VIC   2:   720x480    59.940060 Hz   4:3     31.469 kHz     27.000000 MHz
    VIC  32:  1920x1080   24.000000 Hz  16:9     27.000 kHz     74.250000 MHz
    VIC  34:  1920x1080   30.000000 Hz  16:9     33.750 kHz     74.250000 MHz
    VIC  16:  1920x1080   60.000000 Hz  16:9     67.500 kHz    148.500000 MHz
  Audio Data Block:
    AC-3:
      Max channels: 6
      Supported sample rates (kHz): 48 44.1 32
      Maximum bit rate: 640 kb/s
  Vendor-Specific Data Block (HDMI), OUI 00-0C-03:
    Source physical address: 3.0.0.0
    Supports_AI
    DC_36bit
    DC_30bit
    DC_Y444
    Maximum TMDS clock: 225 MHz
  Detailed Timing Descriptors:
    DTD  8:  1280x720    60.000000 Hz  16:9     45.000 kHz     74.250000 MHz (708 mm x 398 mm)
                  Hfront  110 Hsync  40 Hback  220 Hpol P
                  Vfront    5 Vsync   5 Vback   20 Vpol P
    DTD  9:  1920x1080i  60.000000 Hz  16:9     33.750 kHz     74.250000 MHz (708 mm x 398 mm)
                  Hfront   88 Hsync  44 Hback  148 Hpol P
                  Vfront    2 Vsync   5 Vback   15 Vpol P Vfront +0.5 Odd Field
                  Vfront    2 Vsync   5 Vback   15 Vpol P Vback  +0.5 Even Field
    DTD 10:   720x480    59.940060 Hz   3:2     31.469 kHz     27.000000 MHz (708 mm x 398 mm)
                  Hfront   16 Hsync  62 Hback   60 Hpol N
                  Vfront    9 Vsync   6 Vback   30 Vpol N
    DTD 11:   720x480    59.940060 Hz   3:2     31.469 kHz     27.000000 MHz (531 mm x 398 mm)
                  Hfront   16 Hsync  62 Hback   60 Hpol N
                  Vfront    9 Vsync   6 Vback   30 Vpol N
    DTD 12:  1920x1080   59.985806 Hz  16:9     66.644 kHz    138.620000 MHz (708 mm x 398 mm)
                  Hfront   48 Hsync  32 Hback   80 Hpol P
                  Vfront    2 Vsync   5 Vback   24 Vpol N
Checksum: 0x07  Unused space in Extension Block: 13 bytes

----------------

Warnings:

Block 0, Base EDID:
  Vendor & Product Identification: The serial number is one of the known dummy values, it should probably be set to 0.
  Detailed Timing Descriptor #2: DTD is similar but not identical to DMT 0x17.
  Detailed Timing Descriptor #2: Image size is 708x398 mm, but based on the picture AR it should be 708x424 mm.
Block 1, CTA-861 Extension Block:
  Video Data Block: VIC 4 and the first DTD are not identical. Is this intended?
  Detailed Timing Descriptor #5: Image size is 708x398 mm, but based on the picture AR it should be 708x472 mm.
  Detailed Timing Descriptor #6: Image size is 531x398 mm, but based on the picture AR it should be 531x354 mm.
  Add a Colorimetry Data Block with the sRGB colorimetry bit set to avoid interop issues.
Block 3, CTA-861 Extension Block:
  Detailed Timing Descriptor #10: Image size is 708x398 mm, but based on the picture AR it should be 708x472 mm.
  Detailed Timing Descriptor #11: Image size is 531x398 mm, but based on the picture AR it should be 531x354 mm.
EDID:
  Base EDID: Some timings are out of range of the Monitor Ranges:
    Vertical Freq: 24.000 - 60.317 Hz (Monitor: 56.000 - 63.000 Hz)
    Horizontal Freq: 27.000 - 67.500 kHz (Monitor: 31.000 - 60.000 kHz)
    Maximum Clock: 148.500 MHz (Monitor: 90.000 MHz)

Failures:

Block 0, Base EDID:
  Detailed Timing Descriptor #1: Mismatch of image size 708x398 mm vs display size 1150x650 mm.
  Detailed Timing Descriptor #2: Mismatch of image size 708x398 mm vs display size 1150x650 mm.
Block 1, CTA-861 Extension Block:
  Detailed Timing Descriptor #3: Mismatch of image size 708x398 mm vs display size 1150x650 mm.
  Detailed Timing Descriptor #4: Mismatch of image size 708x398 mm vs display size 1150x650 mm.
  Detailed Timing Descriptor #5: Mismatch of image size 708x398 mm vs display size 1150x650 mm.
  Detailed Timing Descriptor #6: Mismatch of image size 531x398 mm vs display size 1150x650 mm.
  Detailed Timing Descriptor #7: Mismatch of image size 708x398 mm vs display size 1150x650 mm.
  Missing VCDB, needed for Set Selectable RGB Quantization to avoid interop issues.
Block 2, Base EDID:
  Unknown Extension Block.
Block 3, CTA-861 Extension Block:
  Video Data Block: Duplicate VIC 4.
  Video Data Block: Duplicate VIC 5.
  Video Data Block: Duplicate VIC 3.
  Video Data Block: Duplicate VIC 2.
  Video Data Block: Duplicate VIC 32.
  Video Data Block: Duplicate VIC 34.
  Video Data Block: Duplicate VIC 16.
  Detailed Timing Descriptor #8: Mismatch of image size 708x398 mm vs display size 1150x650 mm.
  Detailed Timing Descriptor #9: Mismatch of image size 708x398 mm vs display size 1150x650 mm.
  Detailed Timing Descriptor #10: Mismatch of image size 708x398 mm vs display size 1150x650 mm.
  Detailed Timing Descriptor #11: Mismatch of image size 531x398 mm vs display size 1150x650 mm.
  Detailed Timing Descriptor #12: Mismatch of image size 708x398 mm vs display size 1150x650 mm.
EDID:
  Base EDID: EDID specified 1 extension block(s), but found 3 extension block(s).
  Base EDID: EDID 1.3 requires a Block Map Extension in Block 1 if there are more than 2 blocks in the EDID.
  CTA-861: Native progressive timings are a mix of several resolutions.

EDID conformity: FAIL
