edid-decode (hex):

00 ff ff ff ff ff ff 00 1e 6d 01 00 01 01 01 01
01 19 01 03 80 a0 5a 78 0a f3 30 a4 54 46 96 26
0f 49 4b 21 08 00 45 40 01 01 61 40 01 01 01 01
01 01 01 01 01 01 01 1d 00 72 51 d0 1e 20 6e 28
55 00 c4 8e 21 00 00 1e 1b 21 50 a0 51 00 1e 30
48 88 35 00 bc 77 21 00 00 1c 00 00 00 fc 00 4c
47 20 54 56 0a 20 20 20 20 20 20 20 00 00 00 fd
00 3a 3f 1c 44 0f 00 0a 20 20 20 20 20 20 01 a3

02 03 28 f1 4f 84 07 01 16 02 03 11 12 13 14 05
20 22 1f 10 26 11 07 50 09 7f 07 83 01 00 00 68
03 0c 00 20 00 80 1e 00 01 1d 00 80 51 d0 1c 20
40 80 35 00 bc 88 21 00 00 1e 8c 0a d0 8a 20 e0
2d 10 10 3e 96 00 13 8e 21 00 00 18 8c 0a a0 14
51 f0 16 00 26 7c 43 00 c4 8e 21 00 00 98 01 1d
80 18 71 1c 16 20 58 2c 25 00 c4 8e 21 00 00 9e
00 00 00 00 00 00 00 00 00 00 00 00 00 00 00 34

00 ff ff ff ff ff ff 00 1e 6d 01 00 01 01 01 01
01 19 01 03 80 a0 5a 78 0a f3 30 a4 54 46 96 26
0f 49 4b 21 08 00 45 40 01 01 61 40 01 01 01 01
01 01 01 01 01 01 01 1d 00 72 51 d0 1e 20 6e 28
55 00 c4 8e 21 00 00 1e 1b 21 50 a0 51 00 1e 30
48 88 35 00 bc 77 21 00 00 1c 00 00 00 fc 00 4c
47 20 54 56 0a 20 20 20 20 20 20 20 00 00 00 fd
00 3a 3f 1c 44 0f 00 0a 20 20 20 20 20 20 01 a3

02 03 28 f1 4f 84 07 01 16 02 03 11 12 13 14 05
20 22 1f 10 26 11 07 50 09 7f 07 83 01 00 00 68
03 0c 00 20 00 80 1e 00 01 1d 00 80 51 d0 1c 20
40 80 35 00 bc 88 21 00 00 1e 8c 0a d0 8a 20 e0
2d 10 10 3e 96 00 13 8e 21 00 00 18 8c 0a a0 14
51 f0 16 00 26 7c 43 00 c4 8e 21 00 00 98 01 1d
80 18 71 1c 16 20 58 2c 25 00 c4 8e 21 00 00 9e
00 00 00 00 00 00 00 00 00 00 00 00 00 00 00 34

----------------

Block 0, Base EDID:
  EDID Structure Version & Revision: 1.3
  Vendor & Product Identification:
    Manufacturer: GSM
    Model: 1
    Serial Number: ...
    Made in: week 1 of 2015
  Basic Display Parameters & Features:
    Digital display
    Maximum image size: 160 cm x 90 cm
    Gamma: 2.20
    RGB color display
    First detailed timing is the preferred timing
  Color Characteristics:
    Red  : 0.6435, 0.3310
    Green: 0.2734, 0.5888
    Blue : 0.1484, 0.0615
    White: 0.2851, 0.2929
  Established Timings I & II:
    DMT 0x04:   640x480    59.940476 Hz   4:3     31.469 kHz     25.175000 MHz
    DMT 0x09:   800x600    60.316541 Hz   4:3     37.879 kHz     40.000000 MHz
    DMT 0x10:  1024x768    60.003840 Hz   4:3     48.363 kHz     65.000000 MHz
  Standard Timings:
    DMT 0x09:   800x600    60.316541 Hz   4:3     37.879 kHz     40.000000 MHz
    DMT 0x10:  1024x768    60.003840 Hz   4:3     48.363 kHz     65.000000 MHz
  Detailed Timing Descriptors:
    DTD 1:  1280x720    60.000000 Hz  16:9     45.000 kHz     74.250000 MHz (708 mm x 398 mm)
                 Hfront  110 Hsync  40 Hback  220 Hpol P
                 Vfront    5 Vsync   5 Vback   20 Vpol P
    DTD 2:  1360x768    59.798991 Hz  85:48    47.720 kHz     84.750000 MHz (700 mm x 375 mm)
                 Hfront   72 Hsync 136 Hback  208 Hpol N
                 Vfront    3 Vsync   5 Vback   22 Vpol P
    Display Product Name: 'LG TV'
    Display Range Limits:
      Monitor ranges (GTF): 58-63 Hz V, 28-68 kHz H, max dotclock 150 MHz
  Extension blocks: 1
Checksum: 0xa3

----------------

Block 1, CTA-861 Extension Block:
  Revision: 3
  Underscans IT Video Formats by default
  Basic audio support
  Supports YCbCr 4:4:4
  Supports YCbCr 4:2:2
  Native DTDs: 1
  Video Data Block:
    VIC   4:  1280x720    60.000000 Hz  16:9     45.000 kHz     74.250000 MHz (native)
    VIC   7:  1440x480i   59.940060 Hz  16:9     15.734 kHz     27.000000 MHz
    VIC   1:   640x480    59.940476 Hz   4:3     31.469 kHz     25.175000 MHz
    VIC  22:  1440x576i   50.000000 Hz  16:9     15.625 kHz     27.000000 MHz
    VIC   2:   720x480    59.940060 Hz   4:3     31.469 kHz     27.000000 MHz
    VIC   3:   720x480    59.940060 Hz  16:9     31.469 kHz     27.000000 MHz
    VIC  17:   720x576    50.000000 Hz   4:3     31.250 kHz     27.000000 MHz
    VIC  18:   720x576    50.000000 Hz  16:9     31.250 kHz     27.000000 MHz
    VIC  19:  1280x720    50.000000 Hz  16:9     37.500 kHz     74.250000 MHz
    VIC  20:  1920x1080i  50.000000 Hz  16:9     28.125 kHz     74.250000 MHz
    VIC   5:  1920x1080i  60.000000 Hz  16:9     33.750 kHz     74.250000 MHz
    VIC  32:  1920x1080   24.000000 Hz  16:9     27.000 kHz     74.250000 MHz
    VIC  34:  1920x1080   30.000000 Hz  16:9     33.750 kHz     74.250000 MHz
    VIC  31:  1920x1080   50.000000 Hz  16:9     56.250 kHz    148.500000 MHz
    VIC  16:  1920x1080   60.000000 Hz  16:9     67.500 kHz    148.500000 MHz
  Audio Data Block:
    AC-3:
      Max channels: 2
      Supported sample rates (kHz): 48 44.1 32
      Maximum bit rate: 640 kb/s
    Linear PCM:
      Max channels: 2
      Supported sample rates (kHz): 192 176.4 96 88.2 48 44.1 32
      Supported sample sizes (bits): 24 20 16
  Speaker Allocation Data Block:
    FL/FR - Front Left/Right
  Vendor-Specific Data Block (HDMI), OUI 00-0C-03:
    Source physical address: 2.0.0.0
    Supports_AI
    Maximum TMDS clock: 150 MHz
  Detailed Timing Descriptors:
    DTD 3:  1280x720    59.654270 Hz  16:9     44.621 kHz     74.250000 MHz (700 mm x 392 mm)
                 Hfront   64 Hsync 128 Hback  192 Hpol P
                 Vfront    3 Vsync   5 Vback   20 Vpol P
    DTD 4:   720x480    59.940060 Hz   3:2     31.469 kHz     27.000000 MHz (531 mm x 398 mm)
                 Hfront   16 Hsync  62 Hback   60 Hpol N
                 Vfront    9 Vsync   6 Vback   30 Vpol N
    DTD 5:  1440x480i   59.940060 Hz   3:1     15.734 kHz     27.000000 MHz (708 mm x 398 mm)
                 Hfront   38 Hsync 124 Hback  114 Hpol N
                 Vfront    4 Vsync   3 Vback   15 Vpol N Vfront +0.5 Odd Field
                 Vfront    4 Vsync   3 Vback   15 Vpol N Vback  +0.5 Even Field
    DTD 6:  1920x1080i  60.000000 Hz  16:9     33.750 kHz     74.250000 MHz (708 mm x 398 mm)
                 Hfront   88 Hsync  44 Hback  148 Hpol P
                 Vfront    2 Vsync   5 Vback   15 Vpol P Vfront +0.5 Odd Field
                 Vfront    2 Vsync   5 Vback   15 Vpol P Vback  +0.5 Even Field
Checksum: 0x34  Unused space in Extension Block: 15 bytes

----------------

Warnings:

Block 0, Base EDID:
  Vendor & Product Identification: The serial number is one of the known dummy values, it should probably be set to 0.
  Detailed Timing Descriptor #2: Image size is 700x375 mm, but based on the picture AR it should be 664x375 mm.
Block 1, CTA-861 Extension Block:
  Detailed Timing Descriptor #4: Image size is 531x398 mm, but based on the picture AR it should be 531x354 mm.
  Detailed Timing Descriptor #5: Image size is 708x398 mm, but based on the picture AR it should be 708x236 mm.
  Add a Colorimetry Data Block with the sRGB colorimetry bit set to avoid interop issues.
EDID:
  Base EDID: Some timings are out of range of the Monitor Ranges:
    Vertical Freq: 24.000 - 60.317 Hz (Monitor: 58.000 - 63.000 Hz)
    Horizontal Freq: 15.625 - 67.500 kHz (Monitor: 28.000 - 68.000 kHz)

Failures:

Block 0, Base EDID:
  Detailed Timing Descriptor #1: Mismatch of image size 708x398 mm vs display size 1600x900 mm.
  Detailed Timing Descriptor #2: Mismatch of image size 700x375 mm vs display size 1600x900 mm.
Block 1, CTA-861 Extension Block:
  Detailed Timing Descriptor #3: Mismatch of image size 700x392 mm vs display size 1600x900 mm.
  Detailed Timing Descriptor #4: Mismatch of image size 531x398 mm vs display size 1600x900 mm.
  Detailed Timing Descriptor #5: Mismatch of image size 708x398 mm vs display size 1600x900 mm.
  Detailed Timing Descriptor #6: Mismatch of image size 708x398 mm vs display size 1600x900 mm.
  Missing VCDB, needed for Set Selectable RGB Quantization to avoid interop issues.
EDID:
  Extension Block 2 started with EDID header, ignoring Extension Blocks >= 2.

EDID conformity: FAIL
