edid-decode (hex):

00 ff ff ff ff ff ff 00 4a 8b 00 16 44 01 00 00
01 21 01 03 80 24 13 78 2a ee 95 a3 54 4c 99 26
0f 50 54 21 08 00 71 40 81 c0 81 80 a9 c0 a9 40
b3 00 d1 c0 d1 00 9e 68 00 a0 a0 40 29 60 30 20
35 00 68 be 10 00 00 1a d6 d6 00 a0 a0 40 55 60
30 20 35 00 68 be 10 00 00 1a 00 00 00 fd 00 30
90 30 d7 3e 00 0a 20 20 20 20 20 20 00 00 00 fc
00 51 48 44 0a 20 20 20 20 20 20 20 20 20 01 32

02 03 3e f1 44 10 04 5a 4e 23 09 07 07 83 01 00
00 67 03 0c 00 10 00 38 82 67 d8 5d c4 01 82 80
01 68 1a 00 00 01 09 30 90 e6 e5 0f 00 00 06 00
e3 05 c0 00 e2 00 d5 e6 06 05 01 73 73 49 70 c2
00 a0 a0 a0 55 50 30 20 35 00 64 c8 10 00 00 1a
38 61 00 a0 a0 a0 55 50 30 20 35 00 64 c8 10 00
00 1a 00 00 00 00 00 00 00 00 00 00 00 00 00 00
00 00 00 00 00 00 00 00 00 00 00 00 00 00 00 33

00 ff ff ff ff ff ff 00 4a 8b 00 16 44 01 00 00
01 21 01 03 80 24 13 78 2a ee 95 a3 54 4c 99 26
0f 50 54 21 08 00 71 40 81 c0 81 80 a9 c0 a9 40
b3 00 d1 c0 d1 00 9e 68 00 a0 a0 40 29 60 30 20
35 00 68 be 10 00 00 1a d6 d6 00 a0 a0 40 55 60
30 20 35 00 68 be 10 00 00 1a 00 00 00 fd 00 30
90 30 d7 3e 00 0a 20 20 20 20 20 20 00 00 00 fc
00 51 48 44 0a 20 20 20 20 20 20 20 20 20 01 32

02 03 3e f1 44 10 04 5a 4e 23 09 07 07 83 01 00
00 67 03 0c 00 10 00 38 82 67 d8 5d c4 01 82 80
01 68 1a 00 00 01 09 30 90 e6 e5 0f 00 00 06 00
e3 05 c0 00 e2 00 d5 e6 06 05 01 73 73 49 70 c2
00 a0 a0 a0 55 50 30 20 35 00 64 c8 10 00 00 1a
38 61 00 a0 a0 a0 55 50 30 20 35 00 64 c8 10 00
00 1a 00 00 00 00 00 00 00 00 00 00 00 00 00 00
00 00 00 00 00 00 00 00 00 00 00 00 00 00 00 33

----------------

Block 0, Base EDID:
  EDID Structure Version & Revision: 1.3
  Vendor & Product Identification:
    Manufacturer: RTK
    Model: 5632
    Serial Number: ...
    Made in: week 1 of 2023
  Basic Display Parameters & Features:
    Digital display
    Maximum image size: 36 cm x 19 cm
    Gamma: 2.20
    DPMS levels: Off
    RGB color display
    First detailed timing is the preferred timing
  Color Characteristics:
    Red  : 0.6396, 0.3300
    Green: 0.2998, 0.5996
    Blue : 0.1503, 0.0595
    White: 0.3134, 0.3291
  Established Timings I & II:
    DMT 0x04:   640x480    59.940476 Hz   4:3     31.469 kHz     25.175000 MHz
    DMT 0x09:   800x600    60.316541 Hz   4:3     37.879 kHz     40.000000 MHz
    DMT 0x10:  1024x768    60.003840 Hz   4:3     48.363 kHz     65.000000 MHz
  Standard Timings:
    GTF     :  1152x864    60.000000 Hz   4:3     53.700 kHz     81.624000 MHz
    DMT 0x55:  1280x720    60.000000 Hz  16:9     45.000 kHz     74.250000 MHz
    DMT 0x23:  1280x1024   60.019740 Hz   5:4     63.981 kHz    108.000000 MHz
    DMT 0x53:  1600x900    60.000000 Hz  16:9     60.000 kHz    108.000000 MHz (RB)
    DMT 0x33:  1600x1200   60.000000 Hz   4:3     75.000 kHz    162.000000 MHz
    DMT 0x3a:  1680x1050   59.954250 Hz  16:10    65.290 kHz    146.250000 MHz
    DMT 0x52:  1920x1080   60.000000 Hz  16:9     67.500 kHz    148.500000 MHz
    DMT 0x45:  1920x1200   59.884600 Hz  16:10    74.556 kHz    193.250000 MHz
  Detailed Timing Descriptors:
    DTD 1:  2560x1600   60.001972 Hz  16:10    98.463 kHz    267.820000 MHz (360 mm x 190 mm)
                 Hfront   48 Hsync  32 Hback   80 Hpol P
                 Vfront    3 Vsync   5 Vback   33 Vpol N
    DTD 2:  2560x1600  119.999127 Hz  16:10   202.199 kHz    549.980000 MHz (360 mm x 190 mm)
                 Hfront   48 Hsync  32 Hback   80 Hpol P
                 Vfront    3 Vsync   5 Vback   77 Vpol N
    Display Range Limits:
      Monitor ranges (GTF): 48-144 Hz V, 48-215 kHz H, max dotclock 620 MHz
    Display Product Name: 'QHD'
  Extension blocks: 1
Checksum: 0x32

----------------

Block 1, CTA-861 Extension Block:
  Revision: 3
  Underscans IT Video Formats by default
  Basic audio support
  Supports YCbCr 4:4:4
  Supports YCbCr 4:2:2
  Native DTDs: 1
  Video Data Block:
    VIC  16:  1920x1080   60.000000 Hz  16:9     67.500 kHz    148.500000 MHz
    VIC   4:  1280x720    60.000000 Hz  16:9     45.000 kHz     74.250000 MHz
    VIC  90:  2560x1080   60.000000 Hz  64:27    66.000 kHz    198.000000 MHz
    VIC  78:  1920x1080  120.000000 Hz  64:27   135.000 kHz    297.000000 MHz
  Audio Data Block:
    Linear PCM:
      Max channels: 2
      Supported sample rates (kHz): 48 44.1 32
      Supported sample sizes (bits): 24 20 16
  Speaker Allocation Data Block:
    FL/FR - Front Left/Right
  Vendor-Specific Data Block (HDMI), OUI 00-0C-03:
    Source physical address: 1.0.0.0
    DC_36bit
    DC_30bit
    DC_Y444
    Maximum TMDS clock: 650 MHz
  Vendor-Specific Data Block (HDMI Forum), OUI C4-5D-D8:
    Version: 1
    Maximum TMDS Character Rate: 650 MHz
    SCDC Present
    Supports 10-bits/component Deep Color 4:2:0 Pixel Encoding
  Vendor-Specific Data Block (AMD), OUI 00-00-1A:
    Version: 1
    Flags 1: 0x09
      FreeSync Supported
    Minimum Refresh Rate: 48 Hz
    Maximum Refresh Rate: 144 Hz
    MCCS VCP Code: 0xe6
  YCbCr 4:2:0 Capability Map Data Block:
    SVD Index 18 is out of range
    SVD Index 19 is out of range
  Colorimetry Data Block:
    BT2020YCC
    BT2020RGB
  Video Capability Data Block:
    YCbCr quantization: Selectable (via AVI YQ)
    RGB quantization: Selectable (via AVI Q)
    PT scan behavior: Always Overscanned
    IT scan behavior: Always Overscanned
    CE scan behavior: Always Overscanned
  HDR Static Metadata Data Block:
    Electro optical transfer functions:
      Traditional gamma - SDR luminance range
      SMPTE ST2084
    Supported static metadata descriptors:
      Static metadata type 1
    Desired content max luminance: 115 (603.666 cd/m^2)
    Desired content max frame-average luminance: 115 (603.666 cd/m^2)
    Desired content min luminance: 73 (0.495 cd/m^2)
  Detailed Timing Descriptors:
    DTD 3:  2560x1440  120.000000 Hz  16:9    183.000 kHz    497.760000 MHz (356 mm x 200 mm)
                 Hfront   48 Hsync  32 Hback   80 Hpol P
                 Vfront    3 Vsync   5 Vback   77 Vpol N
    DTD 4:  2560x1440   60.000000 Hz  16:9     91.500 kHz    248.880000 MHz (356 mm x 200 mm)
                 Hfront   48 Hsync  32 Hback   80 Hpol P
                 Vfront    3 Vsync   5 Vback   77 Vpol N
Checksum: 0x33  Unused space in Extension Block: 29 bytes

----------------

Warnings:

Block 0, Base EDID:
  Detailed Timing Descriptor #1: Image size is 360x190 mm, but based on the picture AR it should be 304x190 mm.
  Detailed Timing Descriptor #2: Image size is 360x190 mm, but based on the picture AR it should be 304x190 mm.
Block 1, CTA-861 Extension Block:
  Video Data Block: VIC 16 and the first DTD are not identical. Is this intended?
  Colorimetry Data Block: Set the sRGB colorimetry bit to avoid interop issues.
  Video Capability Data Block: IT scan behavior is expected to support underscanned.
  Video Capability Data Block: S_PT is equal to S_IT and S_CE, so should be set to 0 instead.
EDID:
  Base EDID: Some timings are out of range of the Monitor Ranges:
    Horizontal Freq: 31.468 - 202.198 kHz (Monitor: 48.000 - 215.000 kHz)

Failures:

Block 1, CTA-861 Extension Block:
  Vendor-Specific Data Block (HDMI), OUI 00-0C-03: HDMI VSDB Max TMDS rate is > 340.
  Vendor-Specific Data Block (HDMI Forum), OUI C4-5D-D8: Max TMDS rate is > 0 and <= 340 or > 600.
  YCbCr 4:2:0 Capability Map Data Block: Max index 19 > 4 (#SVDs).
  Video Capability Data Block: IT video formats are always overscanned, but bit 7 of Byte 3 of the CTA-861 Extension header is set to underscanned.
  Detailed Timing Descriptor #3: Mismatch of image size 356x200 mm vs display size 360x190 mm.
  Detailed Timing Descriptor #4: Mismatch of image size 356x200 mm vs display size 360x190 mm.
EDID:
  Extension Block 2 started with EDID header, ignoring Extension Blocks >= 2.
  Base EDID: The DTD max image size is 360x200mm, which is larger than the display size 360.0x190.0mm.

EDID conformity: FAIL
