edid-decode (hex):

00 ff ff ff ff ff ff 00 22 f0 6e 28 01 01 01 01
19 17 01 03 80 40 28 78 ea 8d 85 ad 4f 35 b1 25
0e 50 54 21 08 00 01 01 01 01 01 01 01 01 01 01
01 01 01 01 01 01 e2 68 00 a0 a0 40 2e 60 30 20
36 00 81 90 21 00 00 1a bc 1b 00 a0 50 20 17 30
30 20 36 00 81 90 21 00 00 1a 00 00 00 fc 00 48
50 20 5a 52 33 30 77 0a 20 20 20 20 00 00 00 ff
00 43 4e 34 33 32 35 30 33 31 54 0a 20 20 01 59

02 03 1b 41 46 81 02 03 11 12 04 23 09 07 07 83
01 00 00 67 03 0c 00 13 00 88 1e 8c 0a d0 8a 20
e0 2d 10 10 3e 96 00 04 03 00 00 00 18 8c 0a d0
8a 20 e0 2d 10 10 3e 96 00 10 09 00 00 00 18 8c
0a d0 90 20 40 31 20 0c 40 55 00 04 03 00 00 00
18 8c 0a d0 90 20 40 31 20 0c 40 55 00 10 09 00
00 00 18 01 1d 00 72 51 d0 1e 20 6e 28 55 00 10
09 00 00 00 1e 00 00 00 00 00 00 00 00 00 00 5c

----------------

Block 0, Base EDID:
  EDID Structure Version & Revision: 1.3
  Vendor & Product Identification:
    Manufacturer: HWP
    Model: 10350
    Serial Number: ...
    Made in: week 25 of 2013
  Basic Display Parameters & Features:
    Digital display
    Maximum image size: 64 cm x 40 cm
    Gamma: 2.20
    DPMS levels: Standby Suspend Off
    RGB color display
    First detailed timing is the preferred timing
  Color Characteristics:
    Red  : 0.6777, 0.3085
    Green: 0.2099, 0.6923
    Blue : 0.1464, 0.0546
    White: 0.3134, 0.3291
  Established Timings I & II:
    DMT 0x04:   640x480    59.940476 Hz   4:3     31.469 kHz     25.175000 MHz
    DMT 0x09:   800x600    60.316541 Hz   4:3     37.879 kHz     40.000000 MHz
    DMT 0x10:  1024x768    60.003840 Hz   4:3     48.363 kHz     65.000000 MHz
  Standard Timings: none
  Detailed Timing Descriptors:
    DTD 1:  2560x1600   59.971589 Hz  16:10    98.713 kHz    268.500000 MHz (641 mm x 400 mm)
                 Hfront   48 Hsync  32 Hback   80 Hpol P
                 Vfront    3 Vsync   6 Vback   37 Vpol N
    DTD 2:  1280x800    59.909545 Hz  16:10    49.306 kHz     71.000000 MHz (641 mm x 400 mm)
                 Hfront   48 Hsync  32 Hback   80 Hpol P
                 Vfront    3 Vsync   6 Vback   14 Vpol N
    Display Product Name: 'HP ZR30w'
    Display Product Serial Number: ...
  Extension blocks: 1
Checksum: 0x59

----------------

Block 1, CTA-861 Extension Block:
  Revision: 3
  Basic audio support
  Native detailed modes: 1
  Video Data Block:
    VIC   1:   640x480    59.940476 Hz   4:3     31.469 kHz     25.175000 MHz (native)
    VIC   2:   720x480    59.940060 Hz   4:3     31.469 kHz     27.000000 MHz
    VIC   3:   720x480    59.940060 Hz  16:9     31.469 kHz     27.000000 MHz
    VIC  17:   720x576    50.000000 Hz   4:3     31.250 kHz     27.000000 MHz
    VIC  18:   720x576    50.000000 Hz  16:9     31.250 kHz     27.000000 MHz
    VIC   4:  1280x720    60.000000 Hz  16:9     45.000 kHz     74.250000 MHz
  Audio Data Block:
    Linear PCM:
      Max channels: 2
      Supported sample rates (kHz): 48 44.1 32
      Supported sample sizes (bits): 24 20 16
  Speaker Allocation Data Block:
    FL/FR - Front Left/Right
  Vendor-Specific Data Block (HDMI), OUI 00-0C-03:
    Source physical address: 1.3.0.0
    Supports_AI
    DC_Y444
    Maximum TMDS clock: 150 MHz
  Detailed Timing Descriptors:
    DTD 3:   720x480    59.940060 Hz   3:2     31.469 kHz     27.000000 MHz (4 mm x 3 mm)
                 Hfront   16 Hsync  62 Hback   60 Hpol N
                 Vfront    9 Vsync   6 Vback   30 Vpol N
    DTD 4:   720x480    59.940060 Hz   3:2     31.469 kHz     27.000000 MHz (16 mm x 9 mm)
                 Hfront   16 Hsync  62 Hback   60 Hpol N
                 Vfront    9 Vsync   6 Vback   30 Vpol N
    DTD 5:   720x576    50.000000 Hz   5:4     31.250 kHz     27.000000 MHz (4 mm x 3 mm)
                 Hfront   12 Hsync  64 Hback   68 Hpol N
                 Vfront    5 Vsync   5 Vback   39 Vpol N
    DTD 6:   720x576    50.000000 Hz   5:4     31.250 kHz     27.000000 MHz (16 mm x 9 mm)
                 Hfront   12 Hsync  64 Hback   68 Hpol N
                 Vfront    5 Vsync   5 Vback   39 Vpol N
    DTD 7:  1280x720    60.000000 Hz  16:9     45.000 kHz     74.250000 MHz (16 mm x 9 mm)
                 Hfront  110 Hsync  40 Hback  220 Hpol P
                 Vfront    5 Vsync   5 Vback   20 Vpol P
Checksum: 0x5c  Unused space in Extension Block: 10 bytes

----------------

Warnings:

Block 0, Base EDID:
  Vendor & Product Identification: The serial number is one of the known dummy values, it should probably be set to 0.
Block 1, CTA-861 Extension Block:
  IT Video Formats are overscanned by default, but normally this should be underscanned.
  Video Data Block: VIC 1 and the first DTD are not identical. Is this intended?
  Detailed Timing Descriptor #3: Dubious image size (4x3 mm is smaller than 100x100 mm).
  Detailed Timing Descriptor #4: Dubious image size (16x9 mm is smaller than 100x100 mm).
  Detailed Timing Descriptor #5: Dubious image size (4x3 mm is smaller than 100x100 mm).
  Detailed Timing Descriptor #6: Dubious image size (16x9 mm is smaller than 100x100 mm).
  Detailed Timing Descriptor #7: Dubious image size (16x9 mm is smaller than 100x100 mm).
  Display Product Serial Number is set, so the Serial Number in the Base EDID should be 0.
  Add a Colorimetry Data Block with the sRGB colorimetry bit set to avoid interop issues.

Failures:

Block 0, Base EDID:
  Missing Display Range Limits Descriptor.
Block 1, CTA-861 Extension Block:
  Detailed Timing Descriptor #3: Mismatch of image size 4x3 mm vs display size 640x400 mm.
  Detailed Timing Descriptor #4: Mismatch of image size 16x9 mm vs display size 640x400 mm.
  Detailed Timing Descriptor #5: Mismatch of image size 4x3 mm vs display size 640x400 mm.
  Detailed Timing Descriptor #6: Mismatch of image size 16x9 mm vs display size 640x400 mm.
  Detailed Timing Descriptor #7: Mismatch of image size 16x9 mm vs display size 640x400 mm.
  Missing VCDB, needed for Set Selectable RGB Quantization to avoid interop issues.
EDID:
  CTA-861: The maximum HDMI TMDS clock is 150000 kHz, but one or more video timings go up to 268500 kHz.
  CTA-861: Native progressive timings are a mix of several resolutions.

EDID conformity: FAIL
