edid-decode (hex):

00 ff ff ff ff ff ff 00 06 af 3e 20 00 00 00 00
21 14 01 04 90 1f 11 78 02 61 95 9c 59 52 8f 26
21 50 54 00 00 00 01 01 01 01 01 01 01 01 01 01
01 01 01 01 01 01 f8 2a 40 9a 61 84 0c 30 40 2a
33 00 35 ae 10 00 00 18 a5 1c 40 9a 61 84 0c 30
40 2a 33 00 35 ae 10 00 00 18 00 00 00 fe 00 41
55 4f 0a 20 20 20 20 20 20 20 20 20 00 00 00 fe
00 42 31 34 30 52 57 30 32 20 56 30 20 0a 00 d2

----------------

Block 0, Base EDID:
  EDID Structure Version & Revision: 1.4
  Vendor & Product Identification:
    Manufacturer: AUO
    Model: 8254
    Made in: week 33 of 2010
  Basic Display Parameters & Features:
    Digital display
    Bits per primary color channel: 6
    Digital interface is not defined
    Maximum image size: 31 cm x 17 cm
    Gamma: 2.20
    Supported color formats: RGB 4:4:4
    First detailed timing includes the native pixel format and preferred refresh rate
  Color Characteristics:
    Red  : 0.6103, 0.3496
    Green: 0.3203, 0.5595
    Blue : 0.1503, 0.1298
    White: 0.3134, 0.3291
  Established Timings I & II: none
  Standard Timings: none
  Detailed Timing Descriptors:
    DTD 1:  1600x900    60.006983 Hz  16:9     54.726 kHz    110.000000 MHz (309 mm x 174 mm)
                 Hfront   64 Hsync  42 Hback  304 Hpol N
                 Vfront    3 Vsync   3 Vback    6 Vpol N
    DTD 2:  1600x900    40.002837 Hz  16:9     36.483 kHz     73.330000 MHz (309 mm x 174 mm)
                 Hfront   64 Hsync  42 Hback  304 Hpol N
                 Vfront    3 Vsync   3 Vback    6 Vpol N
    Alphanumeric Data String: 'AUO'
    Alphanumeric Data String: 'B140RW02 V0 '
Checksum: 0xd2

----------------

Warnings:

Block 0, Base EDID:
  Missing Display Product Name.

Failures:

Block 0, Base EDID:
  Alphanumeric Data String: One or more trailing spaces before newline.

EDID conformity: FAIL
