edid-decode (hex):

00 ff ff ff ff ff ff 00 61 a9 01 f0 01 00 00 00
0f 23 01 04 08 30 1a 78 ea b6 81 a6 55 53 9f 27
12 50 54 bd cf 00 01 01 81 00 01 01 81 80 81 c0
95 00 a9 c0 b3 00 02 3a 80 18 71 38 2d 40 58 2c
45 00 df 04 11 00 00 1e 00 00 00 fd 00 30 3c 36
64 11 00 0a 20 20 20 20 20 20 00 00 00 ff 00 36
37 33 31 33 32 30 30 30 35 34 35 32 00 00 00 fc
00 56 32 32 46 41 42 2d 52 41 0a 20 20 20 00 39

00 ff ff ff ff ff ff 00 61 a9 01 f0 01 00 00 00
0f 23 01 04 08 30 1a 78 ea b6 81 a6 55 53 9f 27
12 50 54 bd cf 00 01 01 81 00 01 01 81 80 81 c0
95 00 a9 c0 b3 00 02 3a 80 18 71 38 2d 40 58 2c
45 00 df 04 11 00 00 1e 00 00 00 fd 00 30 3c 36
64 11 00 0a 20 20 20 20 20 20 00 00 00 ff 00 36
37 33 31 33 32 30 30 30 35 34 35 32 00 00 00 fc
00 56 32 32 46 41 42 2d 52 41 0a 20 20 20 00 39

----------------

Block 0, Base EDID:
  EDID Structure Version & Revision: 1.4
  Vendor & Product Identification:
    Manufacturer: XMI
    Model: 61441
    Serial Number: ...
    Made in: week 15 of 2025
  Basic Display Parameters & Features:
    Analog display
    Signal Level Standard: 0.700 : 0.300 : 1.000 V p-p
    Blank level equals black level
    Sync: Separate
    Maximum image size: 48 cm x 26 cm
    Gamma: 2.20
    DPMS levels: Standby Suspend Off
    RGB color display
    First detailed timing includes the native pixel format and preferred refresh rate
  Color Characteristics:
    Red  : 0.6503, 0.3349
    Green: 0.3251, 0.6230
    Blue : 0.1542, 0.0703
    White: 0.3125, 0.3291
  Established Timings I & II:
    IBM     :   720x400    70.081663 Hz   9:5     31.467 kHz     28.320000 MHz
    DMT 0x04:   640x480    59.940476 Hz   4:3     31.469 kHz     25.175000 MHz
    Apple   :   640x480    66.666667 Hz   4:3     35.000 kHz     30.240000 MHz
    DMT 0x05:   640x480    72.808802 Hz   4:3     37.861 kHz     31.500000 MHz
    DMT 0x06:   640x480    75.000000 Hz   4:3     37.500 kHz     31.500000 MHz
    DMT 0x09:   800x600    60.316541 Hz   4:3     37.879 kHz     40.000000 MHz
    DMT 0x0a:   800x600    72.187572 Hz   4:3     48.077 kHz     50.000000 MHz
    DMT 0x0b:   800x600    75.000000 Hz   4:3     46.875 kHz     49.500000 MHz
    DMT 0x10:  1024x768    60.003840 Hz   4:3     48.363 kHz     65.000000 MHz
    DMT 0x11:  1024x768    70.069359 Hz   4:3     56.476 kHz     75.000000 MHz
    DMT 0x12:  1024x768    75.028582 Hz   4:3     60.023 kHz     78.750000 MHz
    DMT 0x24:  1280x1024   75.024675 Hz   5:4     79.976 kHz    135.000000 MHz
  Standard Timings:
    DMT 0x1c:  1280x800    59.810326 Hz  16:10    49.702 kHz     83.500000 MHz
    DMT 0x23:  1280x1024   60.019740 Hz   5:4     63.981 kHz    108.000000 MHz
    DMT 0x55:  1280x720    60.000000 Hz  16:9     45.000 kHz     74.250000 MHz
    DMT 0x2f:  1440x900    59.887445 Hz  16:10    55.935 kHz    106.500000 MHz
    DMT 0x53:  1600x900    60.000000 Hz  16:9     60.000 kHz    108.000000 MHz (RB)
    DMT 0x3a:  1680x1050   59.954250 Hz  16:10    65.290 kHz    146.250000 MHz
  Detailed Timing Descriptors:
    DTD 1:  1920x1080   60.000000 Hz  16:9     67.500 kHz    148.500000 MHz (479 mm x 260 mm)
                 Hfront   88 Hsync  44 Hback  148 Hpol P
                 Vfront    4 Vsync   5 Vback   36 Vpol P
    Display Range Limits:
      Monitor ranges (GTF): 48-60 Hz V, 54-100 kHz H, max dotclock 170 MHz
    Display Product Serial Number: ...
    Display Product Name: 'V22FAB-RA'
Checksum: 0x39

----------------

Warnings:

Block 0, Base EDID:
  Vendor & Product Identification: The serial number is one of the known dummy values, it should probably be set to 0.
  Display Range Limits: GTF support is deprecated in EDID 1.4.
EDID:
  Base EDID: Some timings are out of range of the Monitor Ranges:
    Vertical Freq: 59.810 - 75.029 Hz (Monitor: 48.000 - 60.000 Hz)
    Horizontal Freq: 31.466 - 79.976 kHz (Monitor: 54.000 - 100.000 kHz)

Failures:

Block 0, Base EDID:
  Display Range Limits: GTF is supported, but the display does not support continuous frequencies.
EDID:
  Extension Block 1 started with EDID header, ignoring Extension Blocks >= 1.

EDID conformity: FAIL
