edid-decode (hex):

00 ff ff ff ff ff ff 00 41 d0 00 00 06 00 00 00
12 19 01 03 80 32 28 00 0a 07 f5 9a 57 4e 87 26
1e 50 54 00 00 00 01 01 01 01 01 01 01 01 01 01
01 01 01 01 01 01 ce 18 00 30 41 00 1e 30 30 68
34 00 2c c8 10 00 00 1a 00 00 00 fc 00 4c 56 44
53 20 31 30 32 34 78 37 36 38 00 00 00 10 00 00
00 00 00 00 00 00 00 00 00 00 00 00 00 00 00 10
00 00 00 00 00 00 00 00 00 00 00 00 00 00 00 3a

00 ff ff ff ff ff ff 00 41 d0 00 00 06 00 00 00
12 19 01 03 80 32 28 00 0a 07 f5 9a 57 4e 87 26
1e 50 54 00 00 00 01 01 01 01 01 01 01 01 01 01
01 01 01 01 01 01 ce 18 00 30 41 00 1e 30 30 68
34 00 2c c8 10 00 00 1a 00 00 00 fc 00 4c 56 44
53 20 31 30 32 34 78 37 36 38 00 00 00 10 00 00
00 00 00 00 00 00 00 00 00 00 00 00 00 00 00 10
00 00 00 00 00 00 00 00 00 00 00 00 00 00 00 3a

----------------

Block 0, Base EDID:
  EDID Structure Version & Revision: 1.3
  Vendor & Product Identification:
    Manufacturer: PNP
    Model: 0
    Serial Number: ...
    Made in: week 18 of 2015
  Basic Display Parameters & Features:
    Digital display
    Maximum image size: 50 cm x 40 cm
    Gamma: 1.00
    RGB color display
    First detailed timing is the preferred timing
  Color Characteristics:
    Red  : 0.6015, 0.3398
    Green: 0.3056, 0.5302
    Blue : 0.1513, 0.1201
    White: 0.3134, 0.3291
  Established Timings I & II: none
  Standard Timings: none
  Detailed Timing Descriptors:
    DTD 1:  1024x768    59.920132 Hz   4:3     47.816 kHz     63.500000 MHz (300 mm x 200 mm)
                 Hfront   48 Hsync 104 Hback  152 Hpol P
                 Vfront    3 Vsync   4 Vback   23 Vpol N
    Display Product Name: 'LVDS 1024x768'
    Dummy Descriptor:
    Dummy Descriptor:
Checksum: 0x3a

----------------

Warnings:

Block 0, Base EDID:
  Detailed Timing Descriptor #1: Image size is 300x200 mm, but based on the picture AR it should be 266x200 mm.

Failures:

Block 0, Base EDID:
  Detailed Timing Descriptor #1: Mismatch of image size 300x200 mm vs display size 500x400 mm.
  Missing Display Range Limits Descriptor.
EDID:
  Extension Block 1 started with EDID header, ignoring Extension Blocks >= 1.

EDID conformity: FAIL
