edid-decode (hex):

00 ff ff ff ff ff ff 00 30 e4 2b 05 00 00 00 00
00 1a 01 04 b5 3c 22 78 02 23 15 ac 51 35 b5 26
0e 50 54 00 00 00 01 01 01 01 01 01 01 01 01 01
01 01 01 01 01 01 4d d0 00 a0 f0 70 3e 80 30 20
36 00 55 50 21 00 00 1a 00 00 00 00 00 00 00 00
00 00 00 00 00 00 00 00 00 00 00 00 00 fe 00 44
55 43 41 54 80 32 37 30 57 52 34 0a 00 00 00 00
00 03 81 33 a3 01 02 00 00 0b 01 0a 20 20 00 ac

----------------

Block 0, Base EDID:
  EDID Structure Version & Revision: 1.4
  Vendor & Product Identification:
    Manufacturer: LGD
    Model: 1323
    Made in: 2016
  Basic Display Parameters & Features:
    Digital display
    Bits per primary color channel: 10
    DisplayPort interface
    Maximum image size: 60 cm x 34 cm
    Gamma: 2.20
    Supported color formats: RGB 4:4:4
    First detailed timing includes the native pixel format and preferred refresh rate
  Color Characteristics:
    Red  : 0.6718, 0.3183
    Green: 0.2070, 0.7099
    Blue : 0.1484, 0.0556
    White: 0.3134, 0.3291
  Established Timings I & II: none
  Standard Timings: none
  Detailed Timing Descriptors:
    DTD 1:  3840x2160   59.996625 Hz  16:9    133.312 kHz    533.250000 MHz (597 mm x 336 mm)
                 Hfront   48 Hsync  32 Hback   80 Hpol P
                 Vfront    3 Vsync   6 Vback   53 Vpol N
    Empty Descriptor
    Alphanumeric Data String: 'DUCAT.270WR4'
    Manufacturer-Specified Display Descriptor (0x00): 00 00 00 03 81 33 a3 01 02 00 00 0b 01 0a 20 20 '.....3........  '
Checksum: 0xac

----------------

Warnings:

Block 0, Base EDID:
  Alphanumeric Data String: Non-ASCII character 0x80 at position 5, can cause problems.
  Missing Display Product Name.

Failures:

Block 0, Base EDID:
  Empty Descriptor: Use Dummy Descriptor instead of all zeroes.

EDID conformity: FAIL
