edid-decode (hex):

00 ff ff ff ff ff ff 00 0d af 01 10 00 00 00 00
2c 12 01 03 80 16 0c 78 0a cf 45 90 59 57 95 29
1f 50 54 00 00 00 01 01 01 01 01 01 01 01 01 01
01 01 01 01 01 01 2a 15 00 ac 41 40 2e 20 80 56
8e 00 de 7d 00 00 00 18 00 00 00 fe 00 4e 31 30
31 4e 36 2d 4c 30 31 0a 20 20 00 00 00 fe 00 43
4d 4f 0a 20 20 20 20 20 20 20 20 20 00 00 00 fe
00 4e 31 30 31 4e 36 2d 4c 30 31 0a 20 20 00 4a

00 ff ff ff ff ff ff 00 0d af 01 10 00 00 00 00
2c 12 01 03 80 16 0c 78 0a cf 45 90 59 57 95 29
1f 50 54 00 00 00 01 01 01 01 01 01 01 01 01 01
01 01 01 01 01 01 2a 15 00 ac 41 40 2e 20 80 56
8e 00 de 7d 00 00 00 18 00 00 00 fe 00 4e 31 30
31 4e 36 2d 4c 30 31 0a 20 20 00 00 00 fe 00 43
4d 4f 0a 20 20 20 20 20 20 20 20 20 00 00 00 fe
00 4e 31 30 31 4e 36 2d 4c 30 31 0a 20 20 00 4a

----------------

Block 0, Base EDID:
  EDID Structure Version & Revision: 1.3
  Vendor & Product Identification:
    Manufacturer: CMO
    Model: 4097
    Made in: week 44 of 2008
  Basic Display Parameters & Features:
    Digital display
    Maximum image size: 22 cm x 12 cm
    Gamma: 2.20
    RGB color display
    First detailed timing is the preferred timing
  Color Characteristics:
    Red  : 0.5654, 0.3476
    Green: 0.3427, 0.5849
    Blue : 0.1611, 0.1210
    White: 0.3134, 0.3291
  Established Timings I & II: none
  Standard Timings: none
  Detailed Timing Descriptors:
    DTD 1:  1024x576    59.990433 Hz  16:9     37.314 kHz     54.180000 MHz (222 mm x 125 mm)
                 Hfront  128 Hsync  86 Hback  214 Hpol N
                 Vfront    8 Vsync  14 Vback   24 Vpol N
    Alphanumeric Data String: 'N101N6-L01'
    Alphanumeric Data String: 'CMO'
    Alphanumeric Data String: 'N101N6-L01'
Checksum: 0x4a

----------------

Failures:

Block 0, Base EDID:
  Missing Display Product Name.
  Missing Display Range Limits Descriptor.
EDID:
  Extension Block 1 started with EDID header, ignoring Extension Blocks >= 1.

EDID conformity: FAIL
