edid-decode (hex):

00 ff ff ff ff ff ff 00 21 6d 01 00 01 00 00 00
21 21 01 04 b5 3c 28 78 3b ee 91 a3 54 4c 99 26
0f 50 54 21 08 00 31 40 45 40 61 40 81 c0 81 80
95 00 b3 00 01 01 38 f4 00 a0 f0 00 2d a0 3c 30
35 00 54 8e 21 00 00 1e 00 00 00 ff 00 30 30 30
30 30 30 30 30 30 30 30 30 31 00 00 00 fd 00 30
3e ff ff 48 01 0a 20 20 20 20 20 20 00 00 00 fc
00 4a 41 50 41 4e 4e 45 58 54 2e 4d 4e 54 01 e9

02 03 1c f1 44 10 03 04 01 23 09 07 07 83 01 00
00 e3 05 c0 00 e6 06 05 01 60 60 3a bc ce 00 c8
f0 00 3c a0 3c 30 35 00 00 00 00 00 00 1e 64 81
00 18 f1 00 78 a0 3c 30 35 00 00 00 00 00 00 1e
77 d7 10 a0 e0 60 2d 90 3c 30 35 00 54 8e 21 00
00 1e bc 6b 10 a0 e0 60 2d 90 3c 30 35 00 56 8e
21 00 00 1e 00 00 00 00 00 00 00 00 00 00 00 00
00 00 00 00 00 00 00 00 00 00 00 00 00 00 00 49

00 ff ff ff ff ff ff 00 21 6d 01 00 01 00 00 00
21 21 01 04 b5 3c 28 78 3b ee 91 a3 54 4c 99 26
0f 50 54 21 08 00 31 40 45 40 61 40 81 c0 81 80
95 00 b3 00 01 01 38 f4 00 a0 f0 00 2d a0 3c 30
35 00 54 8e 21 00 00 1e 00 00 00 ff 00 30 30 30
30 30 30 30 30 30 30 30 30 31 00 00 00 fd 00 30
3e ff ff 48 01 0a 20 20 20 20 20 20 00 00 00 fc
00 4a 41 50 41 4e 4e 45 58 54 2e 4d 4e 54 01 e9

02 03 1c f1 44 10 03 04 01 23 09 07 07 83 01 00
00 e3 05 c0 00 e6 06 05 01 60 60 3a bc ce 00 c8
f0 00 3c a0 3c 30 35 00 00 00 00 00 00 1e 64 81
00 18 f1 00 78 a0 3c 30 35 00 00 00 00 00 00 1e
77 d7 10 a0 e0 60 2d 90 3c 30 35 00 54 8e 21 00
00 1e bc 6b 10 a0 e0 60 2d 90 3c 30 35 00 56 8e
21 00 00 1e 00 00 00 00 00 00 00 00 00 00 00 00
00 00 00 00 00 00 00 00 00 00 00 00 00 00 00 49

----------------

Block 0, Base EDID:
  EDID Structure Version & Revision: 1.4
  Vendor & Product Identification:
    Manufacturer: HKM
    Model: 1
    Serial Number: ...
    Made in: week 33 of 2023
  Basic Display Parameters & Features:
    Digital display
    Bits per primary color channel: 10
    DisplayPort interface
    Maximum image size: 60 cm x 40 cm
    Gamma: 2.20
    DPMS levels: Off
    Supported color formats: RGB 4:4:4, YCrCb 4:4:4, YCrCb 4:2:2
    First detailed timing includes the native pixel format and preferred refresh rate
    Display supports continuous frequencies
  Color Characteristics:
    Red  : 0.6396, 0.3300
    Green: 0.2998, 0.5996
    Blue : 0.1503, 0.0595
    White: 0.3125, 0.3291
  Established Timings I & II:
    DMT 0x04:   640x480    59.940476 Hz   4:3     31.469 kHz     25.175000 MHz
    DMT 0x09:   800x600    60.316541 Hz   4:3     37.879 kHz     40.000000 MHz
    DMT 0x10:  1024x768    60.003840 Hz   4:3     48.363 kHz     65.000000 MHz
  Standard Timings:
    DMT 0x04:   640x480    59.940476 Hz   4:3     31.469 kHz     25.175000 MHz
    DMT 0x09:   800x600    60.316541 Hz   4:3     37.879 kHz     40.000000 MHz
    DMT 0x10:  1024x768    60.003840 Hz   4:3     48.363 kHz     65.000000 MHz
    DMT 0x55:  1280x720    60.000000 Hz  16:9     45.000 kHz     74.250000 MHz
    DMT 0x23:  1280x1024   60.019740 Hz   5:4     63.981 kHz    108.000000 MHz
    DMT 0x2f:  1440x900    59.887445 Hz  16:10    55.935 kHz    106.500000 MHz
    DMT 0x3a:  1680x1050   59.954250 Hz  16:10    65.290 kHz    146.250000 MHz
  Detailed Timing Descriptors:
    DTD 1:  3840x2560   60.000000 Hz   3:2    156.300 kHz    625.200000 MHz (596 mm x 398 mm)
                 Hfront   60 Hsync  48 Hback   52 Hpol P
                 Vfront    3 Vsync   5 Vback   37 Vpol P
    Display Product Serial Number: ...
    Display Range Limits:
      Monitor ranges (Range Limits Only): 48-62 Hz V, 255-255 kHz H, max dotclock 720 MHz
    Display Product Name: 'JAPANNEXT.MNT'
  Extension blocks: 1
Checksum: 0xe9

----------------

Block 1, CTA-861 Extension Block:
  Revision: 3
  Underscans IT Video Formats by default
  Basic audio support
  Supports YCbCr 4:4:4
  Supports YCbCr 4:2:2
  Native DTDs: 1
  Video Data Block:
    VIC  16:  1920x1080   60.000000 Hz  16:9     67.500 kHz    148.500000 MHz
    VIC   3:   720x480    59.940060 Hz  16:9     31.469 kHz     27.000000 MHz
    VIC   4:  1280x720    60.000000 Hz  16:9     45.000 kHz     74.250000 MHz
    VIC   1:   640x480    59.940476 Hz   4:3     31.469 kHz     25.175000 MHz
  Audio Data Block:
    Linear PCM:
      Max channels: 2
      Supported sample rates (kHz): 48 44.1 32
      Supported sample sizes (bits): 24 20 16
  Speaker Allocation Data Block:
    FL/FR - Front Left/Right
  Colorimetry Data Block:
    BT2020YCC
    BT2020RGB
  HDR Static Metadata Data Block:
    Electro optical transfer functions:
      Traditional gamma - SDR luminance range
      SMPTE ST2084
    Supported static metadata descriptors:
      Static metadata type 1
    Desired content max luminance: 96 (400.000 cd/m^2)
    Desired content max frame-average luminance: 96 (400.000 cd/m^2)
    Desired content min luminance: 58 (0.207 cd/m^2)
  Detailed Timing Descriptors:
    DTD 2:  3840x2560   50.000000 Hz   3:2    131.000 kHz    529.240000 MHz
                 Hfront   60 Hsync  48 Hback   92 Hpol P
                 Vfront    3 Vsync   5 Vback   52 Vpol P
    DTD 3:  3840x2560   29.999275 Hz   3:2     80.398 kHz    331.240000 MHz
                 Hfront   60 Hsync  48 Hback  172 Hpol P
                 Vfront    3 Vsync   5 Vback  112 Vpol P
    DTD 4:  3600x2400   59.999782 Hz   3:2    146.699 kHz    551.590000 MHz (596 mm x 398 mm)
                 Hfront   60 Hsync  48 Hback   52 Hpol P
                 Vfront    3 Vsync   5 Vback   37 Vpol P
    DTD 5:  3600x2400   30.000435 Hz   3:2     73.351 kHz    275.800000 MHz (598 mm x 398 mm)
                 Hfront   60 Hsync  48 Hback   52 Hpol P
                 Vfront    3 Vsync   5 Vback   37 Vpol P
Checksum: 0x49  Unused space in Extension Block: 27 bytes

----------------

Warnings:

Block 0, Base EDID:
  Vendor & Product Identification: The serial number is one of the known dummy values, it should probably be set to 0.
  Display Product Serial Number: ...
Block 1, CTA-861 Extension Block:
  Video Data Block: VIC 16 and the first DTD are not identical. Is this intended?
  Display Product Serial Number is set, so the Serial Number in the Base EDID should be 0.
EDID:
  Base EDID: Some timings are out of range of the Monitor Ranges:
    Vertical Freq: 29.999 - 60.317 Hz (Monitor: 48.000 - 62.000 Hz)
    Horizontal Freq: 31.468 - 156.300 kHz (Monitor: 255.000 - 255.000 kHz)

Failures:

Block 0, Base EDID:
  Basic Display Parameters & Features: The chromaticities match sRGB, but sRGB is not signaled.
Block 1, CTA-861 Extension Block:
  Detailed Timing Descriptor #2: Mismatch of image size vs display size: image size is not set, but display size is.
  Detailed Timing Descriptor #3: Mismatch of image size vs display size: image size is not set, but display size is.
  Missing VCDB, needed for Set Selectable RGB Quantization to avoid interop issues.
EDID:
  Extension Block 2 started with EDID header, ignoring Extension Blocks >= 2.

EDID conformity: FAIL
