edid-decode (hex):

00 ff ff ff ff ff ff 00 30 e4 52 04 00 00 00 00
00 18 01 04 95 23 13 78 ea ae 95 a3 57 54 9e 24
0c 50 54 00 00 00 01 01 01 01 01 01 01 01 01 01
01 01 01 01 01 01 2e 36 80 a0 70 38 1f 40 30 20
35 00 59 c2 10 00 00 1a 5c 2b 80 a0 70 38 1f 40
30 20 35 00 59 c2 10 00 00 1a 00 00 00 fe 00 52
47 31 44 32 80 31 35 36 57 46 35 0a 00 00 00 00
00 00 41 31 9e 01 10 00 00 0a 01 0a 20 20 00 c6

00 ff ff ff ff ff ff 00 30 e4 52 04 00 00 00 00
00 18 01 04 95 23 13 78 ea ae 95 a3 57 54 9e 24
0c 50 54 00 00 00 01 01 01 01 01 01 01 01 01 01
01 01 01 01 01 01 2e 36 80 a0 70 38 1f 40 30 20
35 00 59 c2 10 00 00 1a 5c 2b 80 a0 70 38 1f 40
30 20 35 00 59 c2 10 00 00 1a 00 00 00 fe 00 52
47 31 44 32 80 31 35 36 57 46 35 0a 00 00 00 00
00 00 41 31 9e 01 10 00 00 0a 01 0a 20 20 00 c6

----------------

Block 0, Base EDID:
  EDID Structure Version & Revision: 1.4
  Vendor & Product Identification:
    Manufacturer: LGD
    Model: 1106
    Made in: 2014
  Basic Display Parameters & Features:
    Digital display
    Bits per primary color channel: 6
    DisplayPort interface
    Maximum image size: 35 cm x 19 cm
    Gamma: 2.20
    DPMS levels: Standby Suspend Off
    Supported color formats: RGB 4:4:4, YCrCb 4:4:4
    First detailed timing includes the native pixel format and preferred refresh rate
  Color Characteristics:
    Red  : 0.6386, 0.3417
    Green: 0.3310, 0.6191
    Blue : 0.1425, 0.0478
    White: 0.3134, 0.3291
  Established Timings I & II: none
  Standard Timings: none
  Detailed Timing Descriptors:
    DTD 1:  1920x1080   60.020425 Hz  16:9     66.683 kHz    138.700000 MHz (345 mm x 194 mm)
                 Hfront   48 Hsync  32 Hback   80 Hpol P
                 Vfront    3 Vsync   5 Vback   23 Vpol N
    DTD 2:  1920x1080   48.033650 Hz  16:9     53.365 kHz    111.000000 MHz (345 mm x 194 mm)
                 Hfront   48 Hsync  32 Hback   80 Hpol P
                 Vfront    3 Vsync   5 Vback   23 Vpol N
    Alphanumeric Data String: 'RG1D2.156WF5'
    Manufacturer-Specified Display Descriptor (0x00): 00 00 00 00 41 31 9e 01 10 00 00 0a 01 0a 20 20 '....A1........  '
Checksum: 0xc6

----------------

Block 1, Unknown EDID Extension Block 0x00:
  00 ff ff ff ff ff ff 00 30 e4 52 04 00 00 00 00 '........0.R.....'
  00 18 01 04 95 23 13 78 ea ae 95 a3 57 54 9e 24 '.....#.x....WT.$'
  0c 50 54 00 00 00 01 01 01 01 01 01 01 01 01 01 '.PT.............'
  01 01 01 01 01 01 2e 36 80 a0 70 38 1f 40 30 20 '.......6..p8.@0 '
  35 00 59 c2 10 00 00 1a 5c 2b 80 a0 70 38 1f 40 '5.Y.....\+..p8.@'
  30 20 35 00 59 c2 10 00 00 1a 00 00 00 fe 00 52 '0 5.Y..........R'
  47 31 44 32 80 31 35 36 57 46 35 0a 00 00 00 00 'G1D2.156WF5.....'
  00 00 41 31 9e 01 10 00 00 0a 01 0a 20 20 00 c6 '..A1........  ..'
Checksum: 0xc6

----------------

Warnings:

Block 0, Base EDID:
  Alphanumeric Data String: Non-ASCII character 0x80 at position 5, can cause problems.
  Missing Display Product Name.

Failures:

Block 1, Base EDID:
  Unknown Extension Block.
EDID:
  Base EDID: EDID specified 0 extension block(s), but found 1 extension block(s).

EDID conformity: FAIL
