edid-decode (hex):

00 ff ff ff ff ff ff 00 30 ae 21 90 00 00 00 00
27 1e 01 04 a5 1f 11 78 03 34 c5 95 5c 5a 92 29
1d 50 54 00 00 00 01 01 01 01 01 01 01 01 01 01
01 01 01 01 01 01 8b 39 80 10 71 38 28 40 30 20
36 00 35 ae 10 00 00 1a 00 00 00 fd 00 28 3c 43
43 0f 01 0a 20 20 20 20 20 20 00 00 00 fe 00 4c
45 4e 4f 56 4f 0a 20 20 20 20 20 20 00 00 00 fe
00 4c 45 4e 31 34 30 46 48 44 20 20 20 20 00 f5

00 ff ff ff ff ff ff 00 30 ae 21 90 00 00 00 00
27 1e 01 04 a5 1f 11 78 03 34 c5 95 5c 5a 92 29
1d 50 54 00 00 00 01 01 01 01 01 01 01 01 01 01
01 01 01 01 01 01 8b 39 80 10 71 38 28 40 30 20
36 00 35 ae 10 00 00 1a 00 00 00 fd 00 28 3c 43
43 0f 01 0a 20 20 20 20 20 20 00 00 00 fe 00 4c
45 4e 4f 56 4f 0a 20 20 20 20 20 20 00 00 00 fe
00 4c 45 4e 31 34 30 46 48 44 20 20 20 20 00 f5

----------------

Block 0, Base EDID:
  EDID Structure Version & Revision: 1.4
  Vendor & Product Identification:
    Manufacturer: LEN
    Model: 36897
    Made in: week 39 of 2020
  Basic Display Parameters & Features:
    Digital display
    Bits per primary color channel: 8
    DisplayPort interface
    Maximum image size: 31 cm x 17 cm
    Gamma: 2.20
    Supported color formats: RGB 4:4:4
    First detailed timing includes the native pixel format and preferred refresh rate
    Display supports continuous frequencies
  Color Characteristics:
    Red  : 0.5820, 0.3623
    Green: 0.3525, 0.5703
    Blue : 0.1630, 0.1132
    White: 0.3134, 0.3291
  Established Timings I & II: none
  Standard Timings: none
  Detailed Timing Descriptors:
    DTD 1:  1920x1080   60.003096 Hz  16:9     67.203 kHz    147.310000 MHz (309 mm x 174 mm)
                 Hfront   48 Hsync  32 Hback  192 Hpol P
                 Vfront    3 Vsync   6 Vback   31 Vpol N
    Display Range Limits:
      Monitor ranges (Range Limits Only): 40-60 Hz V, 67-67 kHz H, max dotclock 150 MHz
    Alphanumeric Data String: 'LENOVO'
    Alphanumeric Data String: 'LEN140FHD    '
Checksum: 0xf5

----------------

Warnings:

Block 0, Base EDID:
  Missing Display Product Name.

Failures:

Block 0, Base EDID:
  Alphanumeric Data String: No newline, but one or more trailing spaces.
EDID:
  Extension Block 1 started with EDID header, ignoring Extension Blocks >= 1.

EDID conformity: FAIL
