edid-decode (hex):

00 ff ff ff ff ff ff 00 4c a3 57 44 00 00 00 00
00 11 01 03 80 1e 13 78 0a 87 f5 94 57 4f 8c 27
27 50 54 00 00 00 01 01 01 01 01 01 01 01 01 01
01 01 01 01 01 01 44 2a a0 e8 51 84 23 30 2e 46
99 00 2f be 10 00 00 19 00 00 00 0f 00 00 00 00
00 00 00 00 00 00 00 00 00 00 00 00 00 fe 00 47
52 36 31 39 03 31 34 31 57 44 0a 20 00 00 00 fe
00 19 29 34 3a 54 70 8a b9 02 01 0a 20 20 00 09

----------------

Block 0, Base EDID:
  EDID Structure Version & Revision: 1.3
  Vendor & Product Identification:
    Manufacturer: SEC
    Model: 17495
    Made in: 2007
  Basic Display Parameters & Features:
    Digital display
    Maximum image size: 30 cm x 19 cm
    Gamma: 2.20
    RGB color display
    First detailed timing is the preferred timing
  Color Characteristics:
    Red  : 0.5800, 0.3398
    Green: 0.3095, 0.5498
    Blue : 0.1552, 0.1552
    White: 0.3134, 0.3291
  Established Timings I & II: none
  Standard Timings: none
  Detailed Timing Descriptors:
    DTD 1:  1440x900    60.021745 Hz  16:10    56.120 kHz    108.200000 MHz (303 mm x 190 mm)
                 Hfront   46 Hsync  70 Hback  372 Hpol N
                 Vfront    9 Vsync   9 Vback   17 Vpol N
    Manufacturer-Specified Display Descriptor (0x0f): 00 0f 00 00 00 00 00 00 00 00 00 00 00 00 00 00 '................'
    Alphanumeric Data String: 'GR619.141WD'
    Alphanumeric Data String: '.)4:Tp....'
Checksum: 0x09

----------------

Warnings:

Block 0, Base EDID:
  Alphanumeric Data String: Non-ASCII character 0x03 at position 5, can cause problems.
  Alphanumeric Data String: Non-ASCII character 0x19 at position 0, can cause problems.
  Alphanumeric Data String: Non-ASCII character 0x8a at position 6, can cause problems.
  Alphanumeric Data String: Non-ASCII character 0xb9 at position 7, can cause problems.
  Alphanumeric Data String: Non-ASCII character 0x02 at position 8, can cause problems.
  Alphanumeric Data String: Non-ASCII character 0x01 at position 9, can cause problems.

Failures:

Block 0, Base EDID:
  Missing Display Product Name.
  Missing Display Range Limits Descriptor.

EDID conformity: FAIL
