edid-decode (hex):

00 ff ff ff ff ff ff 00 4c a3 57 44 00 00 00 00
00 11 01 03 80 1e 13 78 0a 87 f5 94 57 4f 8c 27
27 50 54 00 00 00 01 01 01 01 01 01 01 01 01 01
01 01 01 01 01 01 0a 29 a0 e0 51 84 0c 30 30 80
63 00 2f be 10 00 00 19 00 00 00 0f 00 00 00 00
00 00 00 00 00 00 00 00 00 00 00 00 00 fe 00 50
59 37 30 37 04 31 34 31 57 44 0a 20 00 00 00 fe
00 20 2d 38 43 5c 7d a5 e1 02 01 0a 20 20 00 de

----------------

Block 0, Base EDID:
  EDID Structure Version & Revision: 1.3
  Vendor & Product Identification:
    Manufacturer: SEC
    Model: 17495
    Made in: 2007
  Basic Display Parameters & Features:
    Digital display
    Maximum image size: 30 cm x 19 cm
    Gamma: 2.20
    RGB color display
    First detailed timing is the preferred timing
  Color Characteristics:
    Red  : 0.5800, 0.3398
    Green: 0.3095, 0.5498
    Blue : 0.1552, 0.1552
    White: 0.3134, 0.3291
  Established Timings I & II: none
  Standard Timings: none
  Detailed Timing Descriptors:
    DTD 1:  1440x900    59.998629 Hz  16:10    54.719 kHz    105.060000 MHz (303 mm x 190 mm)
                 Hfront   48 Hsync 128 Hback  304 Hpol N
                 Vfront    6 Vsync   3 Vback    3 Vpol N
    Manufacturer-Specified Display Descriptor (0x0f): 00 0f 00 00 00 00 00 00 00 00 00 00 00 00 00 00 '................'
    Alphanumeric Data String: 'PY707.141WD'
    Alphanumeric Data String: ' -8C\}....'
Checksum: 0xde

----------------

Warnings:

Block 0, Base EDID:
  Alphanumeric Data String: Non-ASCII character 0x04 at position 5, can cause problems.
  Alphanumeric Data String: Non-ASCII character 0xa5 at position 6, can cause problems.
  Alphanumeric Data String: Non-ASCII character 0xe1 at position 7, can cause problems.
  Alphanumeric Data String: Non-ASCII character 0x02 at position 8, can cause problems.
  Alphanumeric Data String: Non-ASCII character 0x01 at position 9, can cause problems.

Failures:

Block 0, Base EDID:
  Missing Display Product Name.
  Missing Display Range Limits Descriptor.

EDID conformity: FAIL
