edid-decode (hex):

00 ff ff ff ff ff ff 00 0e 6f 23 16 00 00 00 00
00 20 01 04 a5 22 16 78 03 ee 91 a3 54 4c 99 26
0f 50 54 00 00 00 01 01 01 01 01 01 01 01 01 01
01 01 01 01 01 01 fd d7 00 a0 a0 40 5e 60 30 20
36 00 58 d7 10 00 00 18 ff 6b 00 a0 a0 40 5e 60
30 20 36 00 58 d7 10 00 00 18 00 00 00 fd 00 30
78 cc cc 38 01 0a 20 20 20 20 20 20 00 00 00 03
00 0c 33 ff 10 3c c8 17 15 33 c8 00 00 00 01 5e

70 20 79 00 00 25 01 09 d9 6f 08 d9 6f 08 30 78
80 81 00 10 6f 1a 00 00 03 01 30 78 00 00 00 00
00 00 78 00 00 00 00 00 00 00 00 00 00 00 00 00
00 00 00 00 00 00 00 00 00 00 00 00 00 00 00 00
00 00 00 00 00 00 00 00 00 00 00 00 00 00 00 00
00 00 00 00 00 00 00 00 00 00 00 00 00 00 00 00
00 00 00 00 00 00 00 00 00 00 00 00 00 00 00 00
00 00 00 00 00 00 00 00 00 00 00 00 00 00 32 90

00 ff ff ff ff ff ff 00 0e 6f 23 16 00 00 00 00
00 20 01 04 a5 22 16 78 03 ee 91 a3 54 4c 99 26
0f 50 54 00 00 00 01 01 01 01 01 01 01 01 01 01
01 01 01 01 01 01 fd d7 00 a0 a0 40 5e 60 30 20
36 00 58 d7 10 00 00 18 ff 6b 00 a0 a0 40 5e 60
30 20 36 00 58 d7 10 00 00 18 00 00 00 fd 00 30
78 cc cc 38 01 0a 20 20 20 20 20 20 00 00 00 03
00 0c 33 ff 10 3c c8 17 15 33 c8 00 00 00 01 5e

70 20 79 00 00 25 01 09 d9 6f 08 d9 6f 08 30 78
80 81 00 10 6f 1a 00 00 03 01 30 78 00 00 00 00
00 00 78 00 00 00 00 00 00 00 00 00 00 00 00 00
00 00 00 00 00 00 00 00 00 00 00 00 00 00 00 00
00 00 00 00 00 00 00 00 00 00 00 00 00 00 00 00
00 00 00 00 00 00 00 00 00 00 00 00 00 00 00 00
00 00 00 00 00 00 00 00 00 00 00 00 00 00 00 00
00 00 00 00 00 00 00 00 00 00 00 00 00 00 32 90

----------------

Block 0, Base EDID:
  EDID Structure Version & Revision: 1.4
  Vendor & Product Identification:
    Manufacturer: CSO
    Model: 5667
    Made in: 2022
  Basic Display Parameters & Features:
    Digital display
    Bits per primary color channel: 8
    DisplayPort interface
    Maximum image size: 34 cm x 22 cm
    Gamma: 2.20
    Supported color formats: RGB 4:4:4
    First detailed timing includes the native pixel format and preferred refresh rate
    Display supports continuous frequencies
  Color Characteristics:
    Red  : 0.6396, 0.3300
    Green: 0.2998, 0.5996
    Blue : 0.1503, 0.0595
    White: 0.3125, 0.3291
  Established Timings I & II: none
  Standard Timings: none
  Detailed Timing Descriptors:
    DTD 1:  2560x1600  120.001823 Hz  16:10   203.283 kHz    552.930000 MHz (344 mm x 215 mm)
                 Hfront   48 Hsync  32 Hback   80 Hpol N
                 Vfront    3 Vsync   6 Vback   85 Vpol N
    DTD 2:  2560x1600   60.001997 Hz  16:10   101.643 kHz    276.470000 MHz (344 mm x 215 mm)
                 Hfront   48 Hsync  32 Hback   80 Hpol N
                 Vfront    3 Vsync   6 Vback   85 Vpol N
    Display Range Limits:
      Monitor ranges (Range Limits Only): 48-120 Hz V, 204-204 kHz H, max dotclock 560 MHz
    Manufacturer-Specified Display Descriptor (0x03): 00 03 00 0c 33 ff 10 3c c8 17 15 33 c8 00 00 00 '....3..<...3....'
  Extension blocks: 1
Checksum: 0x5e

----------------

Block 1, DisplayID Extension Block:
  Version: 2.0
  Extension Count: 0
  Display Product Primary Use Case: Same primary use case as the base section
  Dynamic Video Timing Range Limits Data Block:
    Minimum Pixel Clock: 552922 kHz
    Maximum Pixel Clock: 552922 kHz
    Minimum Vertical Refresh Rate: 48 Hz
    Maximum Vertical Refresh Rate: 120 Hz
    Seamless Dynamic Video Timing Support: Yes
  CTA-861 DisplayID Data Block:
  Vendor-Specific Data Block (AMD), OUI 00-00-1A:
    Version: 3
    Feature Caps: 0x01
    Minimum Refresh Rate: 48 Hz
    Maximum Refresh Rate: 120 Hz
    Flags 1.x: 0x00
    Flags 2.x: 0x00
  Checksum: 0x32
Checksum: 0x90

----------------

Warnings:

Block 0, Base EDID:
  Missing Display Product Name.
EDID:
  Base EDID: Some timings are out of range of the Monitor Ranges:
    Horizontal Freq: 101.643 - 203.283 kHz (Monitor: 204.000 - 204.000 kHz)

Failures:

Block 0, Base EDID:
  Basic Display Parameters & Features: The chromaticities match sRGB, but sRGB is not signaled.
Block 1, DisplayID Extension Block:
  DisplayID Base Block has no product type.
EDID:
  Extension Block 2 started with EDID header, ignoring Extension Blocks >= 2.
  DisplayID: DisplayID expects at least one preferred timing.

EDID conformity: FAIL
