edid-decode (hex):

00 ff ff ff ff ff ff 00 4d 10 4f 15 00 00 00 00
2e 1f 01 04 a5 1d 12 78 07 de 50 a3 54 4c 99 26
0f 50 54 00 00 00 01 01 01 01 01 01 01 01 01 01
01 01 01 01 01 01 ed 7b 80 a0 70 b0 47 40 30 20
36 00 20 b4 10 00 00 18 ed 7b 80 a0 70 b0 3e 45
30 20 36 00 20 b4 10 00 00 18 00 00 00 fd 00 30
78 99 99 20 01 0a 20 20 20 20 20 20 00 00 00 fc
00 4c 51 31 33 34 4e 31 4a 57 35 34 0a 20 00 a9

----------------

Block 0, Base EDID:
  EDID Structure Version & Revision: 1.4
  Vendor & Product Identification:
    Manufacturer: SHP
    Model: 5455
    Made in: week 46 of 2021
  Basic Display Parameters & Features:
    Digital display
    Bits per primary color channel: 8
    DisplayPort interface
    Maximum image size: 29 cm x 18 cm
    Gamma: 2.20
    Supported color formats: RGB 4:4:4
    Default (sRGB) color space is primary color space
    First detailed timing includes the native pixel format and preferred refresh rate
    Display supports continuous frequencies
  Color Characteristics:
    Red  : 0.6396, 0.3291
    Green: 0.2998, 0.5996
    Blue : 0.1494, 0.0595
    White: 0.3125, 0.3281
  Established Timings I & II: none
  Standard Timings: none
  Detailed Timing Descriptors:
    DTD 1:  1920x1200  120.003177 Hz  16:10   152.524 kHz    317.250000 MHz (288 mm x 180 mm)
                 Hfront   48 Hsync  32 Hback   80 Hpol N
                 Vfront    3 Vsync   6 Vback   62 Vpol N
    DTD 2:  1920x1200   60.001589 Hz  16:10   152.524 kHz    317.250000 MHz (288 mm x 180 mm)
                 Hfront   48 Hsync  32 Hback   80 Hpol N
                 Vfront    3 Vsync   6 Vback 1333 Vpol N
    Display Range Limits:
      Monitor ranges (Range Limits Only): 48-120 Hz V, 153-153 kHz H, max dotclock 320 MHz
    Display Product Name: 'LQ134N1JW54'
Checksum: 0xa9

----------------

Failures:

Block 0, Base EDID:
  Basic Display Parameters & Features: sRGB is signaled, but the chromaticities do not match.

EDID conformity: FAIL
