edid-decode (hex):

00 ff ff ff ff ff ff 00 51 a1 21 20 00 00 00 00
12 21 01 04 b5 23 16 78 07 0f 91 ae 52 43 b0 26
0f 50 54 00 00 00 01 01 01 01 01 01 01 01 01 01
01 01 01 01 01 01 85 70 00 a0 a0 40 a5 60 30 20
36 00 59 d7 10 00 00 1a 00 00 00 fd 0c 3c f0 a8
a8 73 01 0a 20 20 20 20 20 20 00 00 00 fc 00 54
4c 31 36 30 41 44 4d 50 31 36 2d 30 00 00 00 10
0c 30 f0 50 50 43 00 0a 20 20 20 20 20 20 01 92

70 20 79 02 00 21 00 1d 59 01 d7 00 00 0a 40 06
80 e0 0a 52 3c c4 b0 68 42 0f 00 45 54 00 80 00
80 00 80 13 78 22 00 14 bf 94 11 85 ff 09 9f 00
2f 00 1f 00 3f 06 a4 00 02 00 05 00 2b 00 0c 27
00 3c ef 00 00 27 00 32 3b 00 00 81 00 13 72 1a
00 00 03 01 3c f0 00 00 00 00 00 00 f0 00 00 00
00 00 00 00 00 00 00 00 00 00 00 00 00 00 00 00
00 00 00 00 00 00 00 00 00 00 00 00 00 00 7c 90

00 ff ff ff ff ff ff 00 51 a1 21 20 00 00 00 00
12 21 01 04 b5 23 16 78 07 0f 91 ae 52 43 b0 26
0f 50 54 00 00 00 01 01 01 01 01 01 01 01 01 01
01 01 01 01 01 01 85 70 00 a0 a0 40 a5 60 30 20
36 00 59 d7 10 00 00 1a 00 00 00 fd 0c 3c f0 a8
a8 73 01 0a 20 20 20 20 20 20 00 00 00 fc 00 54
4c 31 36 30 41 44 4d 50 31 36 2d 30 00 00 00 10
0c 30 f0 50 50 43 00 0a 20 20 20 20 20 20 01 92

70 20 79 02 00 21 00 1d 59 01 d7 00 00 0a 40 06
80 e0 0a 52 3c c4 b0 68 42 0f 00 45 54 00 80 00
80 00 80 13 78 22 00 14 bf 94 11 85 ff 09 9f 00
2f 00 1f 00 3f 06 a4 00 02 00 05 00 2b 00 0c 27
00 3c ef 00 00 27 00 32 3b 00 00 81 00 13 72 1a
00 00 03 01 3c f0 00 00 00 00 00 00 f0 00 00 00
00 00 00 00 00 00 00 00 00 00 00 00 00 00 00 00
00 00 00 00 00 00 00 00 00 00 00 00 00 00 7c 90

----------------

Block 0, Base EDID:
  EDID Structure Version & Revision: 1.4
  Vendor & Product Identification:
    Manufacturer: TMA
    Model: 8225
    Made in: week 18 of 2023
  Basic Display Parameters & Features:
    Digital display
    Bits per primary color channel: 10
    DisplayPort interface
    Maximum image size: 35 cm x 22 cm
    Gamma: 2.20
    Supported color formats: RGB 4:4:4
    Default (sRGB) color space is primary color space
    First detailed timing includes the native pixel format and preferred refresh rate
    Display supports continuous frequencies
  Color Characteristics:
    Red  : 0.6796, 0.3203
    Green: 0.2646, 0.6904
    Blue : 0.1503, 0.0595
    White: 0.3125, 0.3291
  Established Timings I & II: none
  Standard Timings: none
  Detailed Timing Descriptors:
    DTD 1:  2560x1600   60.000417 Hz  16:10   105.901 kHz    288.050000 MHz (345 mm x 215 mm)
                 Hfront   48 Hsync  32 Hback   80 Hpol P
                 Vfront    3 Vsync   6 Vback  156 Vpol N
    Display Range Limits:
      Monitor ranges (Range Limits Only): 60-240 Hz V, 423-423 kHz H, max dotclock 1150 MHz
    Display Product Name: 'TL160ADMP16-0'
    Dummy Descriptor:
  Extension blocks: 1
Checksum: 0x92

----------------

Block 1, DisplayID Extension Block:
  Version: 2.0
  Extension Count: 0
  Display Product Primary Use Case: None of the listed primary use cases; generic display
  Display Parameters Data Block (0x21):
    Image size: 34.5 mm x 21.5 mm
    Display native pixel format: 2560x1600
    Scan Orientation: Left to Right, Top to Bottom
    Luminance Information: Minimum guaranteed value
    Color Information: CIE 1931
    Audio Speaker Information: not integrated
    Native Color Chromaticity:
      Primary #1:  (0.679688, 0.320312)
      Primary #2:  (0.264648, 0.690430)
      Primary #3:  (0.150391, 0.059570)
      White Point: (0.312500, 0.329102)
    Native Maximum Luminance (Full Coverage): do not use
    Native Maximum Luminance (10% Rectangular Coverage): do not use
    Native Minimum Luminance: do not use
    Native Color Depth: 10 bpc
    Display Device Technology: Active Matrix LCD
    Native Gamma EOTF: 2.20
  Video Timing Modes Type 7 - Detailed Timings Data Block:
    DTD:  2560x1600  240.000000 Hz  16:10   423.600 kHz   1152.192000 MHz (aspect 16:10, no 3D stereo, preferred)
               Hfront   48 Hsync  32 Hback   80 Hpol N
               Vfront    3 Vsync   6 Vback  156 Vpol N
  Adaptive Sync Data Block:
    Descriptor #1:
      Native Panel Range
      Fixed Average V-Total and Adaptive V-Total
      Supports Seamless Transition
      'Max Single Frame Duration Increase' field value without jitter impact
      'Max Single Frame Duration Decrease' field value without jitter impact
      Max Duration Increase: 0.00 ms
      Max Duration Decrease: 0.00 ms
      Min Refresh Rate: 60 Hz
      Max Refresh Rate: 240 Hz
    Descriptor #2:
      Native Panel Range
      Fixed Average V-Total and Adaptive V-Total
      Supports Seamless Transition
      'Max Single Frame Duration Increase' field value without jitter impact
      'Max Single Frame Duration Decrease' field value without jitter impact
      Max Duration Increase: 0.00 ms
      Max Duration Decrease: 0.00 ms
      Min Refresh Rate: 50 Hz
      Max Refresh Rate: 60 Hz
  CTA-861 DisplayID Data Block:
  Vendor-Specific Data Block (AMD), OUI 00-00-1A:
    Version: 3
    Feature Caps: 0x01
    Minimum Refresh Rate: 60 Hz
    Maximum Refresh Rate: 240 Hz
    Flags 1.x: 0x00
    Flags 2.x: 0x00
  Checksum: 0x7c
Checksum: 0x90

----------------

Warnings:

EDID:
  Base EDID: Some timings are out of range of the Monitor Ranges:
    Horizontal Freq: 105.900 - 423.600 kHz (Monitor: 423.000 - 423.000 kHz)
    Maximum Clock: 1152.192 MHz (Monitor: 1150.000 MHz)

Failures:

Block 0, Base EDID:
  Basic Display Parameters & Features: sRGB is signaled, but the chromaticities do not match.
  Display Descriptor #4: Monitor descriptor block has byte 4 nonzero (0x0c).
  Dummy Descriptor: Dummy block filled with garbage.
EDID:
  Extension Block 2 started with EDID header, ignoring Extension Blocks >= 2.
  DisplayID: Image size mismatch: DisplayID: 34.5x21.5mm Base EDID: 350.0x220.0mm.

EDID conformity: FAIL
