edid-decode (hex):

00 ff ff ff ff ff ff 00 1e 6d cf 56 3d 82 03 00
0c 13 01 03 80 35 1e 78 0a 3d 85 a6 56 4a 9a 24
12 50 54 21 08 00 b3 00 81 80 81 40 01 01 01 01
01 01 01 01 01 01 1a 36 80 a0 70 38 1f 40 30 20
35 00 dd 0c 11 00 00 1a 02 3a 80 18 71 38 2d 40
53 2c 45 00 dd 0c 11 00 00 1e 00 00 00 fd 00 38
3d 1e 53 0f 00 0a 20 20 20 20 20 20 00 00 00 fc
00 57 32 32 36 31 0a 20 20 20 20 20 20 20 01 5d

02 03 21 f1 4e 90 04 03 01 14 12 05 1f 10 13 00
00 00 00 23 09 07 07 83 01 00 00 65 03 0c 00 10
00 02 3a 80 18 71 38 2d 40 58 2c 45 00 dd 0c 11
00 00 1e 01 1d 80 18 71 1c 16 20 58 2c 25 00 dd
0c 11 00 00 9e 01 1d 00 72 51 d0 1e 20 6e 28 55
00 dd 0c 11 00 00 1e 8c 0a d0 8a 20 e0 2d 10 10
3e 96 00 dd 0c 11 00 00 18 00 00 00 00 00 00 00
00 00 00 00 00 00 00 00 00 00 00 00 00 00 00 ba

00 ff ff ff ff ff ff 00 1e 6d cf 56 3d 82 03 00
0c 13 01 03 80 35 1e 78 0a 3d 85 a6 56 4a 9a 24
12 50 54 21 08 00 b3 00 81 80 81 40 01 01 01 01
01 01 01 01 01 01 1a 36 80 a0 70 38 1f 40 30 20
35 00 dd 0c 11 00 00 1a 02 3a 80 18 71 38 2d 40
53 2c 45 00 dd 0c 11 00 00 1e 00 00 00 fd 00 38
3d 1e 53 0f 00 0a 20 20 20 20 20 20 00 00 00 fc
00 57 32 32 36 31 0a 20 20 20 20 20 20 20 01 5d

02 03 21 f1 4e 90 04 03 01 14 12 05 1f 10 13 00
00 00 00 23 09 07 07 83 01 00 00 65 03 0c 00 10
00 02 3a 80 18 71 38 2d 40 58 2c 45 00 dd 0c 11
00 00 1e 01 1d 80 18 71 1c 16 20 58 2c 25 00 dd
0c 11 00 00 9e 01 1d 00 72 51 d0 1e 20 6e 28 55
00 dd 0c 11 00 00 1e 8c 0a d0 8a 20 e0 2d 10 10
3e 96 00 dd 0c 11 00 00 18 00 00 00 00 00 00 00
00 00 00 00 00 00 00 00 00 00 00 00 00 00 00 ba

----------------

Block 0, Base EDID:
  EDID Structure Version & Revision: 1.3
  Vendor & Product Identification:
    Manufacturer: GSM
    Model: 22223
    Serial Number: ...
    Made in: week 12 of 2009
  Basic Display Parameters & Features:
    Digital display
    Maximum image size: 53 cm x 30 cm
    Gamma: 2.20
    RGB color display
    First detailed timing is the preferred timing
  Color Characteristics:
    Red  : 0.6484, 0.3388
    Green: 0.2919, 0.6025
    Blue : 0.1425, 0.0703
    White: 0.3134, 0.3291
  Established Timings I & II:
    DMT 0x04:   640x480    59.940476 Hz   4:3     31.469 kHz     25.175000 MHz
    DMT 0x09:   800x600    60.316541 Hz   4:3     37.879 kHz     40.000000 MHz
    DMT 0x10:  1024x768    60.003840 Hz   4:3     48.363 kHz     65.000000 MHz
  Standard Timings:
    DMT 0x3a:  1680x1050   59.954250 Hz  16:10    65.290 kHz    146.250000 MHz
    DMT 0x23:  1280x1024   60.019740 Hz   5:4     63.981 kHz    108.000000 MHz
    DMT 0x20:  1280x960    60.000000 Hz   4:3     60.000 kHz    108.000000 MHz
  Detailed Timing Descriptors:
    DTD 1:  1920x1080   59.933878 Hz  16:9     66.587 kHz    138.500000 MHz (477 mm x 268 mm)
                 Hfront   48 Hsync  32 Hback   80 Hpol P
                 Vfront    3 Vsync   5 Vback   23 Vpol N
    DTD 2:  1920x1080   60.000000 Hz  16:9     67.500 kHz    148.500000 MHz (477 mm x 268 mm)
                 Hfront   83 Hsync  44 Hback  153 Hpol P
                 Vfront    4 Vsync   5 Vback   36 Vpol P
    Display Range Limits:
      Monitor ranges (GTF): 56-61 Hz V, 30-83 kHz H, max dotclock 150 MHz
    Display Product Name: 'W2261'
  Extension blocks: 1
Checksum: 0x5d

----------------

Block 1, CTA-861 Extension Block:
  Revision: 3
  Underscans IT Video Formats by default
  Basic audio support
  Supports YCbCr 4:4:4
  Supports YCbCr 4:2:2
  Native DTDs: 1
  Video Data Block:
    VIC  16:  1920x1080   60.000000 Hz  16:9     67.500 kHz    148.500000 MHz (native)
    VIC   4:  1280x720    60.000000 Hz  16:9     45.000 kHz     74.250000 MHz
    VIC   3:   720x480    59.940060 Hz  16:9     31.469 kHz     27.000000 MHz
    VIC   1:   640x480    59.940476 Hz   4:3     31.469 kHz     25.175000 MHz
    VIC  20:  1920x1080i  50.000000 Hz  16:9     28.125 kHz     74.250000 MHz
    VIC  18:   720x576    50.000000 Hz  16:9     31.250 kHz     27.000000 MHz
    VIC   5:  1920x1080i  60.000000 Hz  16:9     33.750 kHz     74.250000 MHz
    VIC  31:  1920x1080   50.000000 Hz  16:9     56.250 kHz    148.500000 MHz
    VIC  16:  1920x1080   60.000000 Hz  16:9     67.500 kHz    148.500000 MHz
    VIC  19:  1280x720    50.000000 Hz  16:9     37.500 kHz     74.250000 MHz
  Audio Data Block:
    Linear PCM:
      Max channels: 2
      Supported sample rates (kHz): 48 44.1 32
      Supported sample sizes (bits): 24 20 16
  Speaker Allocation Data Block:
    FL/FR - Front Left/Right
  Vendor-Specific Data Block (HDMI), OUI 00-0C-03:
    Source physical address: 1.0.0.0
  Detailed Timing Descriptors:
    DTD 3:  1920x1080   60.000000 Hz  16:9     67.500 kHz    148.500000 MHz (477 mm x 268 mm)
                 Hfront   88 Hsync  44 Hback  148 Hpol P
                 Vfront    4 Vsync   5 Vback   36 Vpol P
    DTD 4:  1920x1080i  60.000000 Hz  16:9     33.750 kHz     74.250000 MHz (477 mm x 268 mm)
                 Hfront   88 Hsync  44 Hback  148 Hpol P
                 Vfront    2 Vsync   5 Vback   15 Vpol P Vfront +0.5 Odd Field
                 Vfront    2 Vsync   5 Vback   15 Vpol P Vback  +0.5 Even Field
    DTD 5:  1280x720    60.000000 Hz  16:9     45.000 kHz     74.250000 MHz (477 mm x 268 mm)
                 Hfront  110 Hsync  40 Hback  220 Hpol P
                 Vfront    5 Vsync   5 Vback   20 Vpol P
    DTD 6:   720x480    59.940060 Hz   3:2     31.469 kHz     27.000000 MHz (477 mm x 268 mm)
                 Hfront   16 Hsync  62 Hback   60 Hpol N
                 Vfront    9 Vsync   6 Vback   30 Vpol N
Checksum: 0xba  Unused space in Extension Block: 22 bytes

----------------

Warnings:

Block 0, Base EDID:
  Detailed Timing Descriptor #2: DTD is similar but not identical to VIC 16.
Block 1, CTA-861 Extension Block:
  Video Data Block: VIC 16 and the first DTD are not identical. Is this intended?
  Detailed Timing Descriptor #6: Image size is 477x268 mm, but based on the picture AR it should be 402x268 mm.
  Add a Colorimetry Data Block with the sRGB colorimetry bit set to avoid interop issues.
EDID:
  Base EDID: Some timings are out of range of the Monitor Ranges:
    Vertical Freq: 50.000 - 60.317 Hz (Monitor: 56.000 - 61.000 Hz)
    Horizontal Freq: 28.125 - 67.500 kHz (Monitor: 30.000 - 83.000 kHz)

Failures:

Block 0, Base EDID:
  Detailed Timing Descriptor #1: Mismatch of image size 477x268 mm vs display size 530x300 mm.
  Detailed Timing Descriptor #2: Mismatch of image size 477x268 mm vs display size 530x300 mm.
Block 1, CTA-861 Extension Block:
  Video Data Block: Duplicate VIC 16.
  Detailed Timing Descriptor #3: Mismatch of image size 477x268 mm vs display size 530x300 mm.
  Detailed Timing Descriptor #4: Mismatch of image size 477x268 mm vs display size 530x300 mm.
  Detailed Timing Descriptor #5: Mismatch of image size 477x268 mm vs display size 530x300 mm.
  Detailed Timing Descriptor #6: Mismatch of image size 477x268 mm vs display size 530x300 mm.
  Missing VCDB, needed for Set Selectable RGB Quantization to avoid interop issues.
EDID:
  Extension Block 2 started with EDID header, ignoring Extension Blocks >= 2.

EDID conformity: FAIL
