edid-decode (hex):

00 ff ff ff ff ff ff 00 1e 6d 11 78 23 02 00 00
33 22 01 04 b5 46 27 78 ff 18 d5 a8 55 4c a4 27
10 50 54 21 08 00 d1 c0 01 01 01 01 01 01 01 01
01 01 01 01 01 01 09 ec 00 a0 a0 a0 67 50 30 20
3a 00 b9 88 21 00 00 1a 00 00 00 fd 0c 30 a5 03
03 46 01 0a 20 20 20 20 20 20 00 00 00 fc 00 4c
47 20 55 4c 54 52 41 47 45 41 52 0a 00 00 00 ff
00 34 31 32 42 4f 43 56 30 38 35 34 37 0a 01 a3

02 03 1c 74 23 09 06 07 46 10 04 03 01 1f 13 68
1a 00 00 01 01 30 a5 00 83 01 00 00 6f c2 00 a0
a0 a0 55 50 30 20 3a 00 b9 88 21 00 00 1a 56 5e
00 a0 a0 a0 29 50 30 20 35 00 b9 88 21 00 00 1a
5a a0 00 a0 a0 a0 46 50 30 20 3a 00 b9 88 21 00
00 1a 00 00 00 00 00 00 00 00 00 00 00 00 00 00
00 00 00 00 00 00 00 00 00 00 00 00 00 00 00 00
00 00 00 00 00 00 00 00 00 00 00 00 00 00 00 85

00 ff ff ff ff ff ff 00 1e 6d 11 78 23 02 00 00
33 22 01 04 b5 46 27 78 ff 18 d5 a8 55 4c a4 27
10 50 54 21 08 00 d1 c0 01 01 01 01 01 01 01 01
01 01 01 01 01 01 09 ec 00 a0 a0 a0 67 50 30 20
3a 00 b9 88 21 00 00 1a 00 00 00 fd 0c 30 a5 03
03 46 01 0a 20 20 20 20 20 20 00 00 00 fc 00 4c
47 20 55 4c 54 52 41 47 45 41 52 0a 00 00 00 ff
00 34 31 32 42 4f 43 56 30 38 35 34 37 0a 01 a3

02 03 1c 74 23 09 06 07 46 10 04 03 01 1f 13 68
1a 00 00 01 01 30 a5 00 83 01 00 00 6f c2 00 a0
a0 a0 55 50 30 20 3a 00 b9 88 21 00 00 1a 56 5e
00 a0 a0 a0 29 50 30 20 35 00 b9 88 21 00 00 1a
5a a0 00 a0 a0 a0 46 50 30 20 3a 00 b9 88 21 00
00 1a 00 00 00 00 00 00 00 00 00 00 00 00 00 00
00 00 00 00 00 00 00 00 00 00 00 00 00 00 00 00
00 00 00 00 00 00 00 00 00 00 00 00 00 00 00 85

----------------

Block 0, Base EDID:
  EDID Structure Version & Revision: 1.4
  Vendor & Product Identification:
    Manufacturer: GSM
    Model: 30737
    Serial Number: ...
    Made in: week 51 of 2024
  Basic Display Parameters & Features:
    Digital display
    Bits per primary color channel: 10
    DisplayPort interface
    Maximum image size: 70 cm x 39 cm
    Gamma: 2.20
    DPMS levels: Standby Suspend Off
    Supported color formats: RGB 4:4:4, YCrCb 4:4:4, YCrCb 4:2:2
    Default (sRGB) color space is primary color space
    First detailed timing includes the native pixel format and preferred refresh rate
    Display supports continuous frequencies
  Color Characteristics:
    Red  : 0.6562, 0.3330
    Green: 0.2988, 0.6406
    Blue : 0.1552, 0.0634
    White: 0.3134, 0.3291
  Established Timings I & II:
    DMT 0x04:   640x480    59.940476 Hz   4:3     31.469 kHz     25.175000 MHz
    DMT 0x09:   800x600    60.316541 Hz   4:3     37.879 kHz     40.000000 MHz
    DMT 0x10:  1024x768    60.003840 Hz   4:3     48.363 kHz     65.000000 MHz
  Standard Timings:
    DMT 0x52:  1920x1080   60.000000 Hz  16:9     67.500 kHz    148.500000 MHz
  Detailed Timing Descriptors:
    DTD 1:  2560x1440  143.973257 Hz  16:9    222.151 kHz    604.250000 MHz (697 mm x 392 mm)
                 Hfront   48 Hsync  32 Hback   80 Hpol P
                 Vfront    3 Vsync  10 Vback   90 Vpol N
    Display Range Limits:
      Monitor ranges (Range Limits Only): 48-165 Hz V, 258-258 kHz H, max dotclock 700 MHz
    Display Product Name: 'LG ULTRAGEAR'
    Display Product Serial Number: ...
  Extension blocks: 1
Checksum: 0xa3

----------------

Block 1, CTA-861 Extension Block:
  Revision: 3
  Basic audio support
  Supports YCbCr 4:4:4
  Supports YCbCr 4:2:2
  Native DTDs: 4
  Audio Data Block:
    Linear PCM:
      Max channels: 2
      Supported sample rates (kHz): 48 44.1
      Supported sample sizes (bits): 24 20 16
  Video Data Block:
    VIC  16:  1920x1080   60.000000 Hz  16:9     67.500 kHz    148.500000 MHz
    VIC   4:  1280x720    60.000000 Hz  16:9     45.000 kHz     74.250000 MHz
    VIC   3:   720x480    59.940060 Hz  16:9     31.469 kHz     27.000000 MHz
    VIC   1:   640x480    59.940476 Hz   4:3     31.469 kHz     25.175000 MHz
    VIC  31:  1920x1080   50.000000 Hz  16:9     56.250 kHz    148.500000 MHz
    VIC  19:  1280x720    50.000000 Hz  16:9     37.500 kHz     74.250000 MHz
  Vendor-Specific Data Block (AMD), OUI 00-00-1A:
    Version: 1
    Flags 1: 0x01
      FreeSync Supported
    Minimum Refresh Rate: 48 Hz
    Maximum Refresh Rate: 165 Hz
  Speaker Allocation Data Block:
    FL/FR - Front Left/Right
  Detailed Timing Descriptors:
    DTD 2:  2560x1440  119.997589 Hz  16:9    182.996 kHz    497.750000 MHz (697 mm x 392 mm)
                 Hfront   48 Hsync  32 Hback   80 Hpol P
                 Vfront    3 Vsync  10 Vback   72 Vpol N
    DTD 3:  2560x1440   59.950550 Hz  16:9     88.787 kHz    241.500000 MHz (697 mm x 392 mm)
                 Hfront   48 Hsync  32 Hback   80 Hpol P
                 Vfront    3 Vsync   5 Vback   33 Vpol N
    DTD 4:  2560x1440   99.946436 Hz  16:9    150.919 kHz    410.500000 MHz (697 mm x 392 mm)
                 Hfront   48 Hsync  32 Hback   80 Hpol P
                 Vfront    3 Vsync  10 Vback   57 Vpol N
Checksum: 0x85  Unused space in Extension Block: 45 bytes

----------------

Warnings:

Block 1, CTA-861 Extension Block:
  IT Video Formats are overscanned by default, but normally this should be underscanned.
  Video Data Block: VIC 16 and the first DTD are not identical. Is this intended?
  Display Product Serial Number is set, so the Serial Number in the Base EDID should be 0.
EDID:
  Base EDID: Some timings are out of range of the Monitor Ranges:
    Horizontal Freq: 31.468 - 222.150 kHz (Monitor: 258.000 - 258.000 kHz)

Failures:

Block 0, Base EDID:
  Basic Display Parameters & Features: sRGB is signaled, but the chromaticities do not match.
Block 1, CTA-861 Extension Block:
  Missing VCDB, needed for Set Selectable RGB Quantization to avoid interop issues.
EDID:
  Extension Block 2 started with EDID header, ignoring Extension Blocks >= 2.

EDID conformity: FAIL
