edid-decode (hex):

00 ff ff ff ff ff ff 00 0c 2c 04 17 01 00 00 00
2e 0c 01 04 a5 22 1b 96 e2 6e 8b a2 5a 4d 94 24
1a 51 56 bf ef 00 81 80 01 01 01 01 01 01 01 01
01 01 01 01 01 01 00 00 00 fc 00 4c 31 37 41 58
0a 20 20 20 20 20 20 20 00 00 00 fc 00 0a 20 20
20 20 20 20 20 20 20 20 20 20 00 00 00 fd 00 3c
4b 1e 50 0f 02 00 28 50 10 0e 80 46 00 00 00 ff
00 30 30 34 34 0a 20 20 20 20 20 20 20 20 00 b8

----------------

Block 0, Base EDID:
  EDID Structure Version & Revision: 1.4
  Vendor & Product Identification:
    Manufacturer: CAL
    Model: 5892
    Serial Number: ...
    Made in: week 46 of 2002
  Basic Display Parameters & Features:
    Digital display
    Bits per primary color channel: 8
    DisplayPort interface
    Maximum image size: 34 cm x 27 cm
    Gamma: 2.50
    DPMS levels: Standby Suspend Off
    Supported color formats: RGB 4:4:4
    First detailed timing includes the native pixel format and preferred refresh rate
  Color Characteristics:
    Red  : 0.6337, 0.3535
    Green: 0.3037, 0.5800
    Blue : 0.1425, 0.1015
    White: 0.3183, 0.3388
  Established Timings I & II:
    IBM     :   720x400    70.081663 Hz   9:5     31.467 kHz     28.320000 MHz
    DMT 0x04:   640x480    59.940476 Hz   4:3     31.469 kHz     25.175000 MHz
    Apple   :   640x480    66.666667 Hz   4:3     35.000 kHz     30.240000 MHz
    DMT 0x05:   640x480    72.808802 Hz   4:3     37.861 kHz     31.500000 MHz
    DMT 0x06:   640x480    75.000000 Hz   4:3     37.500 kHz     31.500000 MHz
    DMT 0x08:   800x600    56.250000 Hz   4:3     35.156 kHz     36.000000 MHz
    DMT 0x09:   800x600    60.316541 Hz   4:3     37.879 kHz     40.000000 MHz
    DMT 0x0a:   800x600    72.187572 Hz   4:3     48.077 kHz     50.000000 MHz
    DMT 0x0b:   800x600    75.000000 Hz   4:3     46.875 kHz     49.500000 MHz
    Apple   :   832x624    74.551266 Hz   4:3     49.726 kHz     57.284000 MHz
    DMT 0x10:  1024x768    60.003840 Hz   4:3     48.363 kHz     65.000000 MHz
    DMT 0x11:  1024x768    70.069359 Hz   4:3     56.476 kHz     75.000000 MHz
    DMT 0x12:  1024x768    75.028582 Hz   4:3     60.023 kHz     78.750000 MHz
    DMT 0x24:  1280x1024   75.024675 Hz   5:4     79.976 kHz    135.000000 MHz
  Standard Timings:
    DMT 0x23:  1280x1024   60.019740 Hz   5:4     63.981 kHz    108.000000 MHz
  Detailed Timing Descriptors:
    Display Product Name: 'L17AX'
    Display Product Name: ''
    Display Range Limits:
      Monitor ranges (Secondary GTF): 60-75 Hz V, 30-80 kHz H, max dotclock 150 MHz
      GTF Secondary Curve Block:
        Start frequency: 80 kHz
        C: 40.0%
        M: 3600%/kHz
        K: 128
        J: 35.0%
    Display Product Serial Number: ...
Checksum: 0xb8

----------------

Warnings:

Block 0, Base EDID:
  Vendor & Product Identification: The serial number is one of the known dummy values, it should probably be set to 0.
  Display Range Limits: GTF support is deprecated in EDID 1.4.
EDID:
  No Native Video Resolution was defined.
  Base EDID: Some timings are out of range of the Monitor Ranges:
    Vertical Freq: 56.250 - 75.029 Hz (Monitor: 60.000 - 75.000 Hz)

Failures:

Block 0, Base EDID:
  Standard Timings: Missing preferred timing.
  Display Product Name: Empty string.
  Display Range Limits: Secondary GTF is supported, but the display does not support continuous frequencies.

EDID conformity: FAIL
