edid-decode (hex):

00 ff ff ff ff ff ff 00 09 e5 fd 06 00 00 00 00
01 1a 01 04 95 1d 11 78 0a a0 f0 99 59 57 93 29
23 50 54 00 00 00 01 01 01 01 01 01 01 01 01 01
01 01 01 01 01 01 35 36 80 a0 70 38 20 40 30 20
35 00 26 a5 10 00 00 1a 5e 2b 80 a0 70 38 20 40
30 20 35 00 26 a5 10 00 00 1a 00 00 00 fe 00 52
30 56 47 39 80 4e 56 31 33 33 46 48 00 00 00 00
00 00 41 01 94 00 10 00 00 09 01 0a 20 20 00 33

----------------

Block 0, Base EDID:
  EDID Structure Version & Revision: 1.4
  Vendor & Product Identification:
    Manufacturer: BOE
    Model: 1789
    Made in: week 1 of 2016
  Basic Display Parameters & Features:
    Digital display
    Bits per primary color channel: 6
    DisplayPort interface
    Maximum image size: 29 cm x 17 cm
    Gamma: 2.20
    Supported color formats: RGB 4:4:4, YCrCb 4:4:4
    First detailed timing includes the native pixel format and preferred refresh rate
  Color Characteristics:
    Red  : 0.5996, 0.3496
    Green: 0.3398, 0.5742
    Blue : 0.1630, 0.1396
    White: 0.3125, 0.3281
  Established Timings I & II: none
  Standard Timings: none
  Detailed Timing Descriptors:
    DTD 1:  1920x1080   59.996714 Hz  16:9     66.716 kHz    138.770000 MHz (294 mm x 165 mm)
                 Hfront   48 Hsync  32 Hback   80 Hpol P
                 Vfront    3 Vsync   5 Vback   24 Vpol N
    DTD 2:  1920x1080   47.999101 Hz  16:9     53.375 kHz    111.020000 MHz (294 mm x 165 mm)
                 Hfront   48 Hsync  32 Hback   80 Hpol P
                 Vfront    3 Vsync   5 Vback   24 Vpol N
    Alphanumeric Data String: 'R0VG9.NV133FH'
    Manufacturer-Specified Display Descriptor (0x00): 00 00 00 00 41 01 94 00 10 00 00 09 01 0a 20 20 '....A.........  '
Checksum: 0x33

----------------

Warnings:

Block 0, Base EDID:
  Alphanumeric Data String: Non-ASCII character 0x80 at position 5, can cause problems.
  Missing Display Product Name.

EDID conformity: PASS
