edid-decode (hex):

00 ff ff ff ff ff ff 00 36 69 a8 4f 00 00 00 00
14 22 01 04 b5 78 22 78 3b 61 e5 af 4d 3c ba 25
0c 50 54 bf cf 00 71 4f 81 c0 81 40 81 8f 95 00
b3 00 d1 c0 01 01 1a 68 00 a0 f0 38 1f 40 30 20
3a 00 ad 53 41 00 00 1a 56 5e 00 a0 a0 a0 29 50
30 20 35 00 ad 53 41 00 00 1a 00 00 00 fd 0c 30
f0 87 87 d2 01 0a 20 20 20 20 20 20 00 00 00 fc
00 4d 50 47 34 39 31 43 58 20 4f 4c 45 44 02 3d

02 03 35 f1 45 01 04 90 13 3f 23 09 07 07 83 01
00 00 e2 00 2a 74 1a 00 00 03 03 30 f0 00 a0 64
02 4d 03 f0 00 00 00 00 00 00 e3 05 e2 01 e6 06
07 01 64 4b 00 9c f9 80 18 71 38 84 40 30 20 3a
00 ad 53 41 00 00 1a 6f c2 00 a0 a0 a0 55 50 30
20 35 00 ad 53 41 00 00 1a 00 00 00 00 00 00 00
00 00 00 00 00 00 00 00 00 00 00 00 00 00 00 00
00 00 00 00 00 00 00 00 00 00 00 00 00 00 00 62

70 12 79 03 00 03 01 50 33 b7 00 88 ff 13 9f 00
2f 80 1f 00 9f 05 28 00 02 00 09 00 a7 79 01 08
ff 13 3f 01 2f 80 1f 00 9f 05 28 00 02 00 09 00
1d 4d 03 08 ff 13 bf 01 7f 80 1f 00 9f 05 b2 00
20 00 07 00 c7 c2 01 04 ff 09 9f 01 2f 80 1f 00
9f 05 ad 00 3f 00 07 00 00 00 00 00 00 00 00 00
00 00 00 00 00 00 00 00 00 00 00 00 00 00 00 00
00 00 00 00 00 00 00 00 00 00 00 00 00 00 b9 90

00 ff ff ff ff ff ff 00 36 69 a8 4f 00 00 00 00
14 22 01 04 b5 78 22 78 3b 61 e5 af 4d 3c ba 25
0c 50 54 bf cf 00 71 4f 81 c0 81 40 81 8f 95 00
b3 00 d1 c0 01 01 1a 68 00 a0 f0 38 1f 40 30 20
3a 00 ad 53 41 00 00 1a 56 5e 00 a0 a0 a0 29 50
30 20 35 00 ad 53 41 00 00 1a 00 00 00 fd 0c 30
f0 87 87 d2 01 0a 20 20 20 20 20 20 00 00 00 fc
00 4d 50 47 34 39 31 43 58 20 4f 4c 45 44 02 3d

02 03 35 f1 45 01 04 90 13 3f 23 09 07 07 83 01
00 00 e2 00 2a 74 1a 00 00 03 03 30 f0 00 a0 64
02 4d 03 f0 00 00 00 00 00 00 e3 05 e2 01 e6 06
07 01 64 4b 00 9c f9 80 18 71 38 84 40 30 20 3a
00 ad 53 41 00 00 1a 6f c2 00 a0 a0 a0 55 50 30
20 35 00 ad 53 41 00 00 1a 00 00 00 00 00 00 00
00 00 00 00 00 00 00 00 00 00 00 00 00 00 00 00
00 00 00 00 00 00 00 00 00 00 00 00 00 00 00 62

70 12 79 03 00 03 01 50 33 b7 00 88 ff 13 9f 00
2f 80 1f 00 9f 05 28 00 02 00 09 00 a7 79 01 08
ff 13 3f 01 2f 80 1f 00 9f 05 28 00 02 00 09 00
1d 4d 03 08 ff 13 bf 01 7f 80 1f 00 9f 05 b2 00
20 00 07 00 c7 c2 01 04 ff 09 9f 01 2f 80 1f 00
9f 05 ad 00 3f 00 07 00 00 00 00 00 00 00 00 00
00 00 00 00 00 00 00 00 00 00 00 00 00 00 00 00
00 00 00 00 00 00 00 00 00 00 00 00 00 00 b9 90

----------------

Block 0, Base EDID:
  EDID Structure Version & Revision: 1.4
  Vendor & Product Identification:
    Manufacturer: MSI
    Model: 20392
    Made in: week 20 of 2024
  Basic Display Parameters & Features:
    Digital display
    Bits per primary color channel: 10
    DisplayPort interface
    Maximum image size: 120 cm x 34 cm
    Gamma: 2.20
    DPMS levels: Off
    Supported color formats: RGB 4:4:4, YCrCb 4:4:4, YCrCb 4:2:2
    First detailed timing includes the native pixel format and preferred refresh rate
    Display supports continuous frequencies
  Color Characteristics:
    Red  : 0.6845, 0.3027
    Green: 0.2343, 0.7275
    Blue : 0.1474, 0.0488
    White: 0.3134, 0.3291
  Established Timings I & II:
    IBM     :   720x400    70.081663 Hz   9:5     31.467 kHz     28.320000 MHz
    DMT 0x04:   640x480    59.940476 Hz   4:3     31.469 kHz     25.175000 MHz
    Apple   :   640x480    66.666667 Hz   4:3     35.000 kHz     30.240000 MHz
    DMT 0x05:   640x480    72.808802 Hz   4:3     37.861 kHz     31.500000 MHz
    DMT 0x06:   640x480    75.000000 Hz   4:3     37.500 kHz     31.500000 MHz
    DMT 0x08:   800x600    56.250000 Hz   4:3     35.156 kHz     36.000000 MHz
    DMT 0x09:   800x600    60.316541 Hz   4:3     37.879 kHz     40.000000 MHz
    DMT 0x0a:   800x600    72.187572 Hz   4:3     48.077 kHz     50.000000 MHz
    DMT 0x0b:   800x600    75.000000 Hz   4:3     46.875 kHz     49.500000 MHz
    DMT 0x10:  1024x768    60.003840 Hz   4:3     48.363 kHz     65.000000 MHz
    DMT 0x11:  1024x768    70.069359 Hz   4:3     56.476 kHz     75.000000 MHz
    DMT 0x12:  1024x768    75.028582 Hz   4:3     60.023 kHz     78.750000 MHz
    DMT 0x24:  1280x1024   75.024675 Hz   5:4     79.976 kHz    135.000000 MHz
  Standard Timings:
    DMT 0x15:  1152x864    75.000000 Hz   4:3     67.500 kHz    108.000000 MHz
    DMT 0x55:  1280x720    60.000000 Hz  16:9     45.000 kHz     74.250000 MHz
    DMT 0x20:  1280x960    60.000000 Hz   4:3     60.000 kHz    108.000000 MHz
    DMT 0x24:  1280x1024   75.024675 Hz   5:4     79.976 kHz    135.000000 MHz
    DMT 0x2f:  1440x900    59.887445 Hz  16:10    55.935 kHz    106.500000 MHz
    DMT 0x3a:  1680x1050   59.954250 Hz  16:10    65.290 kHz    146.250000 MHz
    DMT 0x52:  1920x1080   60.000000 Hz  16:9     67.500 kHz    148.500000 MHz
  Detailed Timing Descriptors:
    DTD 1:  3840x1080   59.968497 Hz  32:9     66.625 kHz    266.500000 MHz (1197 mm x 339 mm)
                 Hfront   48 Hsync  32 Hback   80 Hpol P
                 Vfront    3 Vsync  10 Vback   18 Vpol N
    DTD 2:  2560x1440   59.950550 Hz  16:9     88.787 kHz    241.500000 MHz (1197 mm x 339 mm)
                 Hfront   48 Hsync  32 Hback   80 Hpol P
                 Vfront    3 Vsync   5 Vback   33 Vpol N
    Display Range Limits:
      Monitor ranges (Range Limits Only): 48-240 Hz V, 390-390 kHz H, max dotclock 2100 MHz
    Display Product Name: 'MPG491CX OLED'
  Extension blocks: 2
Checksum: 0x3d

----------------

Block 1, CTA-861 Extension Block:
  Revision: 3
  Underscans IT Video Formats by default
  Basic audio support
  Supports YCbCr 4:4:4
  Supports YCbCr 4:2:2
  Native DTDs: 1
  Video Data Block:
    VIC   1:   640x480    59.940476 Hz   4:3     31.469 kHz     25.175000 MHz
    VIC   4:  1280x720    60.000000 Hz  16:9     45.000 kHz     74.250000 MHz
    VIC  16:  1920x1080   60.000000 Hz  16:9     67.500 kHz    148.500000 MHz (native)
    VIC  19:  1280x720    50.000000 Hz  16:9     37.500 kHz     74.250000 MHz
    VIC  63:  1920x1080  120.000000 Hz  16:9    135.000 kHz    297.000000 MHz
  Audio Data Block:
    Linear PCM:
      Max channels: 2
      Supported sample rates (kHz): 48 44.1 32
      Supported sample sizes (bits): 24 20 16
  Speaker Allocation Data Block:
    FL/FR - Front Left/Right
  Video Capability Data Block:
    YCbCr quantization: No Data
    RGB quantization: No Data
    PT scan behavior: Always Underscanned
    IT scan behavior: Always Underscanned
    CE scan behavior: Always Underscanned
  Vendor-Specific Data Block (AMD), OUI 00-00-1A:
    Version: 3
    Feature Caps: 0x03
    Minimum Refresh Rate: 48 Hz
    Maximum Refresh Rate: 240 Hz
    Flags 1.x: 0x00
    Flags 2.x: 0xa0
      ST 2084 (PQ) EOTF Supported
      Linear EOTF (Windows scRGB, 0.0 - 125.0) Supported
      BT.2020 Gamut Supported
    Maximum luminance: 100 (436.203 cd/m^2)
    Minimum luminance: 2 (0.000 cd/m^2)
  Colorimetry Data Block:
    xvYCC709
    BT2020cYCC
    BT2020YCC
    BT2020RGB
    Gamut Boundary Description Metadata Profile P0
  HDR Static Metadata Data Block:
    Electro optical transfer functions:
      Traditional gamma - SDR luminance range
      Traditional gamma - HDR luminance range
      SMPTE ST2084
    Supported static metadata descriptors:
      Static metadata type 1
    Desired content max luminance: 100 (436.203 cd/m^2)
    Desired content max frame-average luminance: 75 (253.810 cd/m^2)
    Desired content min luminance: 0 (0.000 cd/m^2)
  Detailed Timing Descriptors:
    DTD 3:  1920x1080  239.648965 Hz  16:9    290.455 kHz    639.000000 MHz (1197 mm x 339 mm)
                 Hfront   48 Hsync  32 Hback  200 Hpol P
                 Vfront    3 Vsync  10 Vback  119 Vpol N
    DTD 4:  2560x1440  119.997589 Hz  16:9    182.996 kHz    497.750000 MHz (1197 mm x 339 mm)
                 Hfront   48 Hsync  32 Hback   80 Hpol P
                 Vfront    3 Vsync   5 Vback   77 Vpol N
Checksum: 0x62  Unused space in Extension Block: 38 bytes

----------------

Block 2, DisplayID Extension Block:
  Version: 1.2
  Extension Count: 0
  Display Product Type: Standalone display device
  Video Timing Modes Type 1 - Detailed Timings Data Block:
    DTD:  5120x1440   59.976879 Hz   0:0     88.826 kHz    469.000000 MHz (aspect undefined, no 3D stereo, preferred)
               Hfront   48 Hsync  32 Hback   80 Hpol P
               Vfront    3 Vsync  10 Vback   28 Vpol N
    DTD:  5120x1440  120.000397 Hz   0:0    177.721 kHz    966.800000 MHz (aspect undefined, no 3D stereo)
               Hfront   48 Hsync  32 Hback  240 Hpol P
               Vfront    3 Vsync  10 Vback   28 Vpol N
    DTD:  5120x1440  239.999769 Hz   0:0    388.560 kHz   2163.500000 MHz (aspect undefined, no 3D stereo)
               Hfront  128 Hsync  32 Hback  288 Hpol P
               Vfront   33 Vsync   8 Vback  138 Vpol N
    DTD:  2560x1440  240.253294 Hz  16:9    387.769 kHz   1154.000000 MHz (aspect 16:9, no 3D stereo)
               Hfront   48 Hsync  32 Hback  336 Hpol P
               Vfront   64 Vsync   8 Vback  102 Vpol N
  Checksum: 0xb9
Checksum: 0x90

----------------

Warnings:

Block 0, Base EDID:
  Detailed Timing Descriptor #2: Image size is 1197x339 mm, but based on the picture AR it should be 602x339 mm.
Block 1, CTA-861 Extension Block:
  Video Data Block: VIC 1 and the first DTD are not identical. Is this intended?
  Video Data Block: All VICs are in ascending order, and the first (preferred) VIC <= 4, is that intended?
  Video Capability Data Block: Set Selectable YCbCr Quantization to avoid interop issues.
  Video Capability Data Block: S_PT is equal to S_IT and S_CE, so should be set to 0 instead.
  Colorimetry Data Block: Set the sRGB colorimetry bit to avoid interop issues.
  Detailed Timing Descriptor #3: Image size is 1197x339 mm, but based on the picture AR it should be 602x339 mm.
  Detailed Timing Descriptor #4: Image size is 1197x339 mm, but based on the picture AR it should be 602x339 mm.
EDID:
  Base EDID: Some timings are out of range of the Monitor Ranges:
    Horizontal Freq: 31.466 - 388.559 kHz (Monitor: 390.000 - 390.000 kHz)
    Maximum Clock: 2163.500 MHz (Monitor: 2100.000 MHz)

Failures:

Block 1, CTA-861 Extension Block:
  Video Capability Data Block: Set Selectable RGB Quantization to avoid interop issues.
EDID:
  Extension Block 3 started with EDID header, ignoring Extension Blocks >= 3.
  CTA-861: Native progressive timings are a mix of several resolutions.
  DisplayID: Missing DisplayID Display Parameters Data Block.

EDID conformity: FAIL
