edid-decode (hex):

00 ff ff ff ff ff ff 00 0e 14 85 1c 00 00 00 00
26 14 01 03 80 16 0c 78 0a 82 7d 99 57 4f 99 26
1c 50 54 00 00 00 01 01 01 01 01 01 01 01 01 01
01 01 01 01 01 01 78 1d 56 c2 50 00 26 30 3b 27
59 00 de 7d 00 00 00 19 00 00 00 0f 00 20 20 20
20 20 20 20 20 a0 ff 02 32 00 00 00 00 fe 00 43
50 54 0a 20 20 20 20 20 20 20 20 20 00 00 00 fe
00 43 4c 41 41 31 30 31 57 41 30 31 41 20 00 a6

00 ff ff ff ff ff ff 00 0e 14 85 1c 00 00 00 00
26 14 01 03 80 16 0c 78 0a 82 7d 99 57 4f 99 26
1c 50 54 00 00 00 01 01 01 01 01 01 01 01 01 01
01 01 01 01 01 01 78 1d 56 c2 50 00 26 30 3b 27
59 00 de 7d 00 00 00 19 00 00 00 0f 00 20 20 20
20 20 20 20 20 a0 ff 02 32 00 00 00 00 fe 00 43
50 54 0a 20 20 20 20 20 20 20 20 20 00 00 00 fe
00 43 4c 41 41 31 30 31 57 41 30 31 41 20 00 a6

----------------

Block 0, Base EDID:
  EDID Structure Version & Revision: 1.3
  Vendor & Product Identification:
    Manufacturer: CPT
    Model: 7301
    Made in: week 38 of 2010
  Basic Display Parameters & Features:
    Digital display
    Maximum image size: 22 cm x 12 cm
    Gamma: 2.20
    RGB color display
    First detailed timing is the preferred timing
  Color Characteristics:
    Red  : 0.5996, 0.3398
    Green: 0.3085, 0.5996
    Blue : 0.1494, 0.1123
    White: 0.3154, 0.3291
  Established Timings I & II: none
  Standard Timings: none
  Detailed Timing Descriptors:
    DTD 1:  1366x768    59.998727 Hz 683:384   48.359 kHz     75.440000 MHz (222 mm x 125 mm)
                 Hfront   59 Hsync  39 Hback   96 Hpol N
                 Vfront    5 Vsync   9 Vback   24 Vpol N
    Manufacturer-Specified Display Descriptor (0x0f): 00 0f 00 20 20 20 20 20 20 20 20 a0 ff 02 32 00 '...        ...2.'
    Alphanumeric Data String: 'CPT'
    Alphanumeric Data String: 'CLAA101WA01A '
Checksum: 0xa6

----------------

Block 1, Unknown EDID Extension Block 0x00:
  00 ff ff ff ff ff ff 00 0e 14 85 1c 00 00 00 00 '................'
  26 14 01 03 80 16 0c 78 0a 82 7d 99 57 4f 99 26 '&......x..}.WO.&'
  1c 50 54 00 00 00 01 01 01 01 01 01 01 01 01 01 '.PT.............'
  01 01 01 01 01 01 78 1d 56 c2 50 00 26 30 3b 27 '......x.V.P.&0;''
  59 00 de 7d 00 00 00 19 00 00 00 0f 00 20 20 20 'Y..}.........   '
  20 20 20 20 20 a0 ff 02 32 00 00 00 00 fe 00 43 '     ...2......C'
  50 54 0a 20 20 20 20 20 20 20 20 20 00 00 00 fe 'PT.         ....'
  00 43 4c 41 41 31 30 31 57 41 30 31 41 20 00 a6 '.CLAA101WA01A ..'
Checksum: 0xa6

----------------

Failures:

Block 0, Base EDID:
  Alphanumeric Data String: No newline, but one or more trailing spaces.
  Missing Display Product Name.
  Missing Display Range Limits Descriptor.
Block 1, Base EDID:
  Unknown Extension Block.
EDID:
  Base EDID: EDID specified 0 extension block(s), but found 1 extension block(s).

EDID conformity: FAIL
